12448-12495 wiegand: bit: "0"
12495-12542 wiegand: bit: "0"
12542-12589 wiegand: bit: "1"
12589-12636 wiegand: bit: "0"
12636-12683 wiegand: bit: "0"
12683-12729 wiegand: bit: "0"
12729-12776 wiegand: bit: "1"
12776-12823 wiegand: bit: "0"
12823-12870 wiegand: bit: "1"
12870-12917 wiegand: bit: "0"
12917-12964 wiegand: bit: "0"
12964-13011 wiegand: bit: "1"
13011-13058 wiegand: bit: "1"
13058-13105 wiegand: bit: "0"
13105-13152 wiegand: bit: "0"
13152-13199 wiegand: bit: "1"
13199-13246 wiegand: bit: "0"
13246-13293 wiegand: bit: "0"
13293-13340 wiegand: bit: "0"
13340-13386 wiegand: bit: "0"
13386-13433 wiegand: bit: "0"
13433-13480 wiegand: bit: "0"
13480-13527 wiegand: bit: "1"
13527-13574 wiegand: bit: "0"
13574-13621 wiegand: bit: "0"
13621-13668 wiegand: bit: "1"
13668-13715 wiegand: bit: "0"
13715-13762 wiegand: bit: "0"
13762-13809 wiegand: bit: "0"
13809-13856 wiegand: bit: "1"
13856-13903 wiegand: bit: "0"
13903-13950 wiegand: bit: "0"
13950-13997 wiegand: bit: "0"
13997-14077 wiegand: bit: "0"
12448-14077 wiegand: state: "34 bits 0010001010011001000000100100010000" "34 bits"
23808-23855 wiegand: bit: "0"
23855-23902 wiegand: bit: "0"
23902-23949 wiegand: bit: "1"
23949-23996 wiegand: bit: "0"
23996-24043 wiegand: bit: "0"
24043-24090 wiegand: bit: "0"
24090-24137 wiegand: bit: "1"
24137-24184 wiegand: bit: "0"
24184-24231 wiegand: bit: "1"
24231-24278 wiegand: bit: "0"
24278-24325 wiegand: bit: "0"
24325-24372 wiegand: bit: "1"
24372-24418 wiegand: bit: "1"
24418-24465 wiegand: bit: "0"
24465-24512 wiegand: bit: "0"
24512-24559 wiegand: bit: "1"
24559-24606 wiegand: bit: "0"
24606-24653 wiegand: bit: "0"
24653-24700 wiegand: bit: "0"
24700-24747 wiegand: bit: "0"
24747-24794 wiegand: bit: "0"
24794-24841 wiegand: bit: "0"
24841-24888 wiegand: bit: "1"
24888-24935 wiegand: bit: "0"
24935-24982 wiegand: bit: "0"
24982-25029 wiegand: bit: "1"
25029-25076 wiegand: bit: "0"
25076-25122 wiegand: bit: "0"
25122-25169 wiegand: bit: "0"
25169-25216 wiegand: bit: "1"
25216-25263 wiegand: bit: "0"
25263-25310 wiegand: bit: "0"
25310-25357 wiegand: bit: "0"
25357-25437 wiegand: bit: "0"
23808-25437 wiegand: state: "34 bits 0010001010011001000000100100010000" "34 bits"
