150-1596 stepper_motor: speed: "8299 steps/s" "8299"
150-1596 stepper_motor: position: "-1 steps" "-1"
1596-3041 stepper_motor: speed: "8304 steps/s" "8304"
1596-3041 stepper_motor: position: "-2 steps" "-2"
3041-4368 stepper_motor: speed: "9043 steps/s" "9043"
3041-4368 stepper_motor: position: "-3 steps" "-3"
4368-5812 stepper_motor: speed: "8310 steps/s" "8310"
4368-5812 stepper_motor: position: "-4 steps" "-4"
5812-7258 stepper_motor: speed: "8299 steps/s" "8299"
5812-7258 stepper_motor: position: "-5 steps" "-5"
7258-8704 stepper_motor: speed: "8299 steps/s" "8299"
7258-8704 stepper_motor: position: "-6 steps" "-6"
8704-10029 stepper_motor: speed: "9057 steps/s" "9057"
8704-10029 stepper_motor: position: "-7 steps" "-7"
10029-11475 stepper_motor: speed: "8299 steps/s" "8299"
10029-11475 stepper_motor: position: "-8 steps" "-8"
11475-12920 stepper_motor: speed: "8304 steps/s" "8304"
11475-12920 stepper_motor: position: "-9 steps" "-9"
12920-14366 stepper_motor: speed: "8299 steps/s" "8299"
12920-14366 stepper_motor: position: "-10 steps" "-10"
14366-15812 stepper_motor: speed: "8299 steps/s" "8299"
14366-15812 stepper_motor: position: "-11 steps" "-11"
15812-17137 stepper_motor: speed: "9057 steps/s" "9057"
15812-17137 stepper_motor: position: "-12 steps" "-12"
17137-18583 stepper_motor: speed: "8299 steps/s" "8299"
17137-18583 stepper_motor: position: "-13 steps" "-13"
18583-20029 stepper_motor: speed: "8299 steps/s" "8299"
18583-20029 stepper_motor: position: "-14 steps" "-14"
20029-21474 stepper_motor: speed: "8304 steps/s" "8304"
20029-21474 stepper_motor: position: "-15 steps" "-15"
21474-22800 stepper_motor: speed: "9050 steps/s" "9050"
21474-22800 stepper_motor: position: "-16 steps" "-16"
22800-24246 stepper_motor: speed: "8299 steps/s" "8299"
22800-24246 stepper_motor: position: "-17 steps" "-17"
24246-25691 stepper_motor: speed: "8304 steps/s" "8304"
24246-25691 stepper_motor: position: "-18 steps" "-18"
25691-27137 stepper_motor: speed: "8299 steps/s" "8299"
25691-27137 stepper_motor: position: "-19 steps" "-19"
27137-28462 stepper_motor: speed: "9057 steps/s" "9057"
27137-28462 stepper_motor: position: "-20 steps" "-20"
28462-29908 stepper_motor: speed: "8299 steps/s" "8299"
28462-29908 stepper_motor: position: "-21 steps" "-21"
29908-31354 stepper_motor: speed: "8299 steps/s" "8299"
29908-31354 stepper_motor: position: "-22 steps" "-22"
31354-32799 stepper_motor: speed: "8304 steps/s" "8304"
31354-32799 stepper_motor: position: "-23 steps" "-23"
32799-34245 stepper_motor: speed: "8299 steps/s" "8299"
32799-34245 stepper_motor: position: "-24 steps" "-24"
34245-35570 stepper_motor: speed: "9057 steps/s" "9057"
34245-35570 stepper_motor: position: "-25 steps" "-25"
35570-37017 stepper_motor: speed: "8293 steps/s" "8293"
35570-37017 stepper_motor: position: "-26 steps" "-26"
37017-38462 stepper_motor: speed: "8304 steps/s" "8304"
37017-38462 stepper_motor: position: "-27 steps" "-27"
38462-39908 stepper_motor: speed: "8299 steps/s" "8299"
38462-39908 stepper_motor: position: "-28 steps" "-28"
39908-41234 stepper_motor: speed: "9050 steps/s" "9050"
39908-41234 stepper_motor: position: "-29 steps" "-29"
41234-42679 stepper_motor: speed: "8304 steps/s" "8304"
41234-42679 stepper_motor: position: "-30 steps" "-30"
42679-44124 stepper_motor: speed: "8304 steps/s" "8304"
42679-44124 stepper_motor: position: "-31 steps" "-31"
44124-45570 stepper_motor: speed: "8299 steps/s" "8299"
44124-45570 stepper_motor: position: "-32 steps" "-32"
45570-47016 stepper_motor: speed: "8299 steps/s" "8299"
45570-47016 stepper_motor: position: "-33 steps" "-33"
47016-48341 stepper_motor: speed: "9057 steps/s" "9057"
47016-48341 stepper_motor: position: "-34 steps" "-34"
48341-49787 stepper_motor: speed: "8299 steps/s" "8299"
48341-49787 stepper_motor: position: "-35 steps" "-35"
49787-51233 stepper_motor: speed: "8299 steps/s" "8299"
49787-51233 stepper_motor: position: "-36 steps" "-36"
51233-52678 stepper_motor: speed: "8304 steps/s" "8304"
51233-52678 stepper_motor: position: "-37 steps" "-37"
52678-54003 stepper_motor: speed: "9057 steps/s" "9057"
52678-54003 stepper_motor: position: "-38 steps" "-38"
54003-55449 stepper_motor: speed: "8299 steps/s" "8299"
54003-55449 stepper_motor: position: "-39 steps" "-39"
55449-56896 stepper_motor: speed: "8293 steps/s" "8293"
55449-56896 stepper_motor: position: "-40 steps" "-40"
56896-58341 stepper_motor: speed: "8304 steps/s" "8304"
56896-58341 stepper_motor: position: "-41 steps" "-41"
58341-59666 stepper_motor: speed: "9057 steps/s" "9057"
58341-59666 stepper_motor: position: "-42 steps" "-42"
59666-61112 stepper_motor: speed: "8299 steps/s" "8299"
59666-61112 stepper_motor: position: "-43 steps" "-43"
61112-62557 stepper_motor: speed: "8304 steps/s" "8304"
61112-62557 stepper_motor: position: "-44 steps" "-44"
62557-64003 stepper_motor: speed: "8299 steps/s" "8299"
62557-64003 stepper_motor: position: "-45 steps" "-45"
64003-65449 stepper_motor: speed: "8299 steps/s" "8299"
64003-65449 stepper_motor: position: "-46 steps" "-46"
65449-66774 stepper_motor: speed: "9057 steps/s" "9057"
65449-66774 stepper_motor: position: "-47 steps" "-47"
66774-68220 stepper_motor: speed: "8299 steps/s" "8299"
66774-68220 stepper_motor: position: "-48 steps" "-48"
68220-69666 stepper_motor: speed: "8299 steps/s" "8299"
68220-69666 stepper_motor: position: "-49 steps" "-49"
69666-71111 stepper_motor: speed: "8304 steps/s" "8304"
69666-71111 stepper_motor: position: "-50 steps" "-50"
71111-72437 stepper_motor: speed: "9050 steps/s" "9050"
71111-72437 stepper_motor: position: "-51 steps" "-51"
72437-73882 stepper_motor: speed: "8304 steps/s" "8304"
72437-73882 stepper_motor: position: "-52 steps" "-52"
73882-75328 stepper_motor: speed: "8299 steps/s" "8299"
73882-75328 stepper_motor: position: "-53 steps" "-53"
75328-76774 stepper_motor: speed: "8299 steps/s" "8299"
75328-76774 stepper_motor: position: "-54 steps" "-54"
76774-78100 stepper_motor: speed: "9050 steps/s" "9050"
76774-78100 stepper_motor: position: "-55 steps" "-55"
78100-79545 stepper_motor: speed: "8304 steps/s" "8304"
78100-79545 stepper_motor: position: "-56 steps" "-56"
79545-80991 stepper_motor: speed: "8299 steps/s" "8299"
79545-80991 stepper_motor: position: "-57 steps" "-57"
80991-82436 stepper_motor: speed: "8304 steps/s" "8304"
80991-82436 stepper_motor: position: "-58 steps" "-58"
82436-83883 stepper_motor: speed: "8293 steps/s" "8293"
82436-83883 stepper_motor: position: "-59 steps" "-59"
83883-85207 stepper_motor: speed: "9063 steps/s" "9063"
83883-85207 stepper_motor: position: "-60 steps" "-60"
85207-86653 stepper_motor: speed: "8299 steps/s" "8299"
85207-86653 stepper_motor: position: "-61 steps" "-61"
86653-88099 stepper_motor: speed: "8299 steps/s" "8299"
86653-88099 stepper_motor: position: "-62 steps" "-62"
88099-89545 stepper_motor: speed: "8299 steps/s" "8299"
88099-89545 stepper_motor: position: "-63 steps" "-63"
89545-90870 stepper_motor: speed: "9057 steps/s" "9057"
89545-90870 stepper_motor: position: "-64 steps" "-64"
90870-92316 stepper_motor: speed: "8299 steps/s" "8299"
90870-92316 stepper_motor: position: "-65 steps" "-65"
92316-93761 stepper_motor: speed: "8304 steps/s" "8304"
92316-93761 stepper_motor: position: "-66 steps" "-66"
93761-95207 stepper_motor: speed: "8299 steps/s" "8299"
93761-95207 stepper_motor: position: "-67 steps" "-67"
95207-96653 stepper_motor: speed: "8299 steps/s" "8299"
95207-96653 stepper_motor: position: "-68 steps" "-68"
96653-97978 stepper_motor: speed: "9057 steps/s" "9057"
96653-97978 stepper_motor: position: "-69 steps" "-69"
97978-99424 stepper_motor: speed: "8299 steps/s" "8299"
97978-99424 stepper_motor: position: "-70 steps" "-70"
99424-100870 stepper_motor: speed: "8299 steps/s" "8299"
99424-100870 stepper_motor: position: "-71 steps" "-71"
100870-102314 stepper_motor: speed: "8310 steps/s" "8310"
100870-102314 stepper_motor: position: "-72 steps" "-72"
102314-103641 stepper_motor: speed: "9043 steps/s" "9043"
102314-103641 stepper_motor: position: "-73 steps" "-73"
103641-105087 stepper_motor: speed: "8299 steps/s" "8299"
103641-105087 stepper_motor: position: "-74 steps" "-74"
105087-106532 stepper_motor: speed: "8304 steps/s" "8304"
105087-106532 stepper_motor: position: "-75 steps" "-75"
106532-107978 stepper_motor: speed: "8299 steps/s" "8299"
106532-107978 stepper_motor: position: "-76 steps" "-76"
107978-109303 stepper_motor: speed: "9057 steps/s" "9057"
107978-109303 stepper_motor: position: "-77 steps" "-77"
109303-110749 stepper_motor: speed: "8299 steps/s" "8299"
109303-110749 stepper_motor: position: "-78 steps" "-78"
110749-112195 stepper_motor: speed: "8299 steps/s" "8299"
110749-112195 stepper_motor: position: "-79 steps" "-79"
112195-113640 stepper_motor: speed: "8304 steps/s" "8304"
112195-113640 stepper_motor: position: "-80 steps" "-80"
113640-115086 stepper_motor: speed: "8299 steps/s" "8299"
113640-115086 stepper_motor: position: "-81 steps" "-81"
115086-116411 stepper_motor: speed: "9057 steps/s" "9057"
115086-116411 stepper_motor: position: "-82 steps" "-82"
116411-117858 stepper_motor: speed: "8293 steps/s" "8293"
116411-117858 stepper_motor: position: "-83 steps" "-83"
117858-119303 stepper_motor: speed: "8304 steps/s" "8304"
117858-119303 stepper_motor: position: "-84 steps" "-84"
119303-120749 stepper_motor: speed: "8299 steps/s" "8299"
119303-120749 stepper_motor: position: "-85 steps" "-85"
120749-122074 stepper_motor: speed: "9057 steps/s" "9057"
120749-122074 stepper_motor: position: "-86 steps" "-86"
122074-123520 stepper_motor: speed: "8299 steps/s" "8299"
122074-123520 stepper_motor: position: "-87 steps" "-87"
123520-124965 stepper_motor: speed: "8304 steps/s" "8304"
123520-124965 stepper_motor: position: "-88 steps" "-88"
124965-126411 stepper_motor: speed: "8299 steps/s" "8299"
124965-126411 stepper_motor: position: "-89 steps" "-89"
126411-127857 stepper_motor: speed: "8299 steps/s" "8299"
126411-127857 stepper_motor: position: "-90 steps" "-90"
127857-129182 stepper_motor: speed: "9057 steps/s" "9057"
127857-129182 stepper_motor: position: "-91 steps" "-91"
129182-130628 stepper_motor: speed: "8299 steps/s" "8299"
129182-130628 stepper_motor: position: "-92 steps" "-92"
130628-132074 stepper_motor: speed: "8299 steps/s" "8299"
130628-132074 stepper_motor: position: "-93 steps" "-93"
132074-133519 stepper_motor: speed: "8304 steps/s" "8304"
132074-133519 stepper_motor: position: "-94 steps" "-94"
133519-134845 stepper_motor: speed: "9050 steps/s" "9050"
133519-134845 stepper_motor: position: "-95 steps" "-95"
134845-136290 stepper_motor: speed: "8304 steps/s" "8304"
134845-136290 stepper_motor: position: "-96 steps" "-96"
136290-137736 stepper_motor: speed: "8299 steps/s" "8299"
136290-137736 stepper_motor: position: "-97 steps" "-97"
137736-139182 stepper_motor: speed: "8299 steps/s" "8299"
137736-139182 stepper_motor: position: "-98 steps" "-98"
139182-140507 stepper_motor: speed: "9057 steps/s" "9057"
139182-140507 stepper_motor: position: "-99 steps" "-99"
140507-141953 stepper_motor: speed: "8299 steps/s" "8299"
140507-141953 stepper_motor: position: "-100 steps" "-100"
141953-143399 stepper_motor: speed: "8299 steps/s" "8299"
141953-143399 stepper_motor: position: "-101 steps" "-101"
143399-144845 stepper_motor: speed: "8299 steps/s" "8299"
143399-144845 stepper_motor: position: "-102 steps" "-102"
144845-146290 stepper_motor: speed: "8304 steps/s" "8304"
144845-146290 stepper_motor: position: "-103 steps" "-103"
146290-147615 stepper_motor: speed: "9057 steps/s" "9057"
146290-147615 stepper_motor: position: "-104 steps" "-104"
147615-149061 stepper_motor: speed: "8299 steps/s" "8299"
147615-149061 stepper_motor: position: "-105 steps" "-105"
149061-150507 stepper_motor: speed: "8299 steps/s" "8299"
149061-150507 stepper_motor: position: "-106 steps" "-106"
150507-151952 stepper_motor: speed: "8304 steps/s" "8304"
150507-151952 stepper_motor: position: "-107 steps" "-107"
151952-153278 stepper_motor: speed: "9050 steps/s" "9050"
151952-153278 stepper_motor: position: "-108 steps" "-108"
153278-154723 stepper_motor: speed: "8304 steps/s" "8304"
153278-154723 stepper_motor: position: "-109 steps" "-109"
154723-156169 stepper_motor: speed: "8299 steps/s" "8299"
154723-156169 stepper_motor: position: "-110 steps" "-110"
156169-157615 stepper_motor: speed: "8299 steps/s" "8299"
156169-157615 stepper_motor: position: "-111 steps" "-111"
157615-158940 stepper_motor: speed: "9057 steps/s" "9057"
157615-158940 stepper_motor: position: "-112 steps" "-112"
158940-160386 stepper_motor: speed: "8299 steps/s" "8299"
158940-160386 stepper_motor: position: "-113 steps" "-113"
160386-161832 stepper_motor: speed: "8299 steps/s" "8299"
160386-161832 stepper_motor: position: "-114 steps" "-114"
161832-163277 stepper_motor: speed: "8304 steps/s" "8304"
161832-163277 stepper_motor: position: "-115 steps" "-115"
163277-164723 stepper_motor: speed: "8299 steps/s" "8299"
163277-164723 stepper_motor: position: "-116 steps" "-116"
164723-166048 stepper_motor: speed: "9057 steps/s" "9057"
164723-166048 stepper_motor: position: "-117 steps" "-117"
166048-167495 stepper_motor: speed: "8293 steps/s" "8293"
166048-167495 stepper_motor: position: "-118 steps" "-118"
167495-168940 stepper_motor: speed: "8304 steps/s" "8304"
167495-168940 stepper_motor: position: "-119 steps" "-119"
168940-170386 stepper_motor: speed: "8299 steps/s" "8299"
168940-170386 stepper_motor: position: "-120 steps" "-120"
170386-171711 stepper_motor: speed: "9057 steps/s" "9057"
170386-171711 stepper_motor: position: "-121 steps" "-121"
171711-173157 stepper_motor: speed: "8299 steps/s" "8299"
171711-173157 stepper_motor: position: "-122 steps" "-122"
173157-174602 stepper_motor: speed: "8304 steps/s" "8304"
173157-174602 stepper_motor: position: "-123 steps" "-123"
174602-176048 stepper_motor: speed: "8299 steps/s" "8299"
174602-176048 stepper_motor: position: "-124 steps" "-124"
176048-177494 stepper_motor: speed: "8299 steps/s" "8299"
176048-177494 stepper_motor: position: "-125 steps" "-125"
177494-178819 stepper_motor: speed: "9057 steps/s" "9057"
177494-178819 stepper_motor: position: "-126 steps" "-126"
178819-180265 stepper_motor: speed: "8299 steps/s" "8299"
178819-180265 stepper_motor: position: "-127 steps" "-127"
180265-181711 stepper_motor: speed: "8299 steps/s" "8299"
180265-181711 stepper_motor: position: "-128 steps" "-128"
181711-183156 stepper_motor: speed: "8304 steps/s" "8304"
181711-183156 stepper_motor: position: "-129 steps" "-129"
183156-184482 stepper_motor: speed: "9050 steps/s" "9050"
183156-184482 stepper_motor: position: "-130 steps" "-130"
184482-185928 stepper_motor: speed: "8299 steps/s" "8299"
184482-185928 stepper_motor: position: "-131 steps" "-131"
185928-187373 stepper_motor: speed: "8304 steps/s" "8304"
185928-187373 stepper_motor: position: "-132 steps" "-132"
187373-188820 stepper_motor: speed: "8293 steps/s" "8293"
187373-188820 stepper_motor: position: "-133 steps" "-133"
188820-190144 stepper_motor: speed: "9063 steps/s" "9063"
188820-190144 stepper_motor: position: "-134 steps" "-134"
190144-191590 stepper_motor: speed: "8299 steps/s" "8299"
190144-191590 stepper_motor: position: "-135 steps" "-135"
191590-193036 stepper_motor: speed: "8299 steps/s" "8299"
191590-193036 stepper_motor: position: "-136 steps" "-136"
193036-194481 stepper_motor: speed: "8304 steps/s" "8304"
193036-194481 stepper_motor: position: "-137 steps" "-137"
194481-195927 stepper_motor: speed: "8299 steps/s" "8299"
194481-195927 stepper_motor: position: "-138 steps" "-138"
195927-197252 stepper_motor: speed: "9057 steps/s" "9057"
195927-197252 stepper_motor: position: "-139 steps" "-139"
197252-198698 stepper_motor: speed: "8299 steps/s" "8299"
197252-198698 stepper_motor: position: "-140 steps" "-140"
198698-200144 stepper_motor: speed: "8299 steps/s" "8299"
198698-200144 stepper_motor: position: "-141 steps" "-141"
200144-201590 stepper_motor: speed: "8299 steps/s" "8299"
200144-201590 stepper_motor: position: "-142 steps" "-142"
201590-202915 stepper_motor: speed: "9057 steps/s" "9057"
201590-202915 stepper_motor: position: "-143 steps" "-143"
202915-204361 stepper_motor: speed: "8299 steps/s" "8299"
202915-204361 stepper_motor: position: "-144 steps" "-144"
204361-205806 stepper_motor: speed: "8304 steps/s" "8304"
204361-205806 stepper_motor: position: "-145 steps" "-145"
205806-207252 stepper_motor: speed: "8299 steps/s" "8299"
205806-207252 stepper_motor: position: "-146 steps" "-146"
207252-208577 stepper_motor: speed: "9057 steps/s" "9057"
207252-208577 stepper_motor: position: "-147 steps" "-147"
208577-210023 stepper_motor: speed: "8299 steps/s" "8299"
208577-210023 stepper_motor: position: "-148 steps" "-148"
210023-211469 stepper_motor: speed: "8299 steps/s" "8299"
210023-211469 stepper_motor: position: "-149 steps" "-149"
211469-212915 stepper_motor: speed: "8299 steps/s" "8299"
211469-212915 stepper_motor: position: "-150 steps" "-150"
212915-214360 stepper_motor: speed: "8304 steps/s" "8304"
212915-214360 stepper_motor: position: "-151 steps" "-151"
214360-215686 stepper_motor: speed: "9050 steps/s" "9050"
214360-215686 stepper_motor: position: "-152 steps" "-152"
215686-217131 stepper_motor: speed: "8304 steps/s" "8304"
215686-217131 stepper_motor: position: "-153 steps" "-153"
217131-218577 stepper_motor: speed: "8299 steps/s" "8299"
217131-218577 stepper_motor: position: "-154 steps" "-154"
218577-220023 stepper_motor: speed: "8299 steps/s" "8299"
218577-220023 stepper_motor: position: "-155 steps" "-155"
220023-221348 stepper_motor: speed: "9057 steps/s" "9057"
220023-221348 stepper_motor: position: "-156 steps" "-156"
221348-222794 stepper_motor: speed: "8299 steps/s" "8299"
221348-222794 stepper_motor: position: "-157 steps" "-157"
222794-224240 stepper_motor: speed: "8299 steps/s" "8299"
222794-224240 stepper_motor: position: "-158 steps" "-158"
224240-225685 stepper_motor: speed: "8304 steps/s" "8304"
224240-225685 stepper_motor: position: "-159 steps" "-159"
225685-227131 stepper_motor: speed: "8299 steps/s" "8299"
225685-227131 stepper_motor: position: "-160 steps" "-160"
227131-228456 stepper_motor: speed: "9057 steps/s" "9057"
227131-228456 stepper_motor: position: "-161 steps" "-161"
228456-229902 stepper_motor: speed: "8299 steps/s" "8299"
228456-229902 stepper_motor: position: "-162 steps" "-162"
229902-231348 stepper_motor: speed: "8299 steps/s" "8299"
229902-231348 stepper_motor: position: "-163 steps" "-163"
231348-232794 stepper_motor: speed: "8299 steps/s" "8299"
231348-232794 stepper_motor: position: "-164 steps" "-164"
232794-234119 stepper_motor: speed: "9057 steps/s" "9057"
232794-234119 stepper_motor: position: "-165 steps" "-165"
234119-235565 stepper_motor: speed: "8299 steps/s" "8299"
234119-235565 stepper_motor: position: "-166 steps" "-166"
235565-237010 stepper_motor: speed: "8304 steps/s" "8304"
235565-237010 stepper_motor: position: "-167 steps" "-167"
237010-238457 stepper_motor: speed: "8293 steps/s" "8293"
237010-238457 stepper_motor: position: "-168 steps" "-168"
238457-239902 stepper_motor: speed: "8304 steps/s" "8304"
238457-239902 stepper_motor: position: "-169 steps" "-169"
239902-241227 stepper_motor: speed: "9057 steps/s" "9057"
239902-241227 stepper_motor: position: "-170 steps" "-170"
241227-242673 stepper_motor: speed: "8299 steps/s" "8299"
241227-242673 stepper_motor: position: "-171 steps" "-171"
242673-244118 stepper_motor: speed: "8304 steps/s" "8304"
242673-244118 stepper_motor: position: "-172 steps" "-172"
244118-245564 stepper_motor: speed: "8299 steps/s" "8299"
244118-245564 stepper_motor: position: "-173 steps" "-173"
245564-247010 stepper_motor: speed: "8299 steps/s" "8299"
245564-247010 stepper_motor: position: "-174 steps" "-174"
247010-248335 stepper_motor: speed: "9057 steps/s" "9057"
247010-248335 stepper_motor: position: "-175 steps" "-175"
248335-249781 stepper_motor: speed: "8299 steps/s" "8299"
248335-249781 stepper_motor: position: "-176 steps" "-176"
249781-251227 stepper_motor: speed: "8299 steps/s" "8299"
249781-251227 stepper_motor: position: "-177 steps" "-177"
251227-252672 stepper_motor: speed: "8304 steps/s" "8304"
251227-252672 stepper_motor: position: "-178 steps" "-178"
252672-254118 stepper_motor: speed: "8299 steps/s" "8299"
252672-254118 stepper_motor: position: "-179 steps" "-179"
254118-255443 stepper_motor: speed: "9057 steps/s" "9057"
254118-255443 stepper_motor: position: "-180 steps" "-180"
255443-256890 stepper_motor: speed: "8293 steps/s" "8293"
255443-256890 stepper_motor: position: "-181 steps" "-181"
256890-258335 stepper_motor: speed: "8304 steps/s" "8304"
256890-258335 stepper_motor: position: "-182 steps" "-182"
258335-259781 stepper_motor: speed: "8299 steps/s" "8299"
258335-259781 stepper_motor: position: "-183 steps" "-183"
259781-261226 stepper_motor: speed: "8304 steps/s" "8304"
259781-261226 stepper_motor: position: "-184 steps" "-184"
261226-262672 stepper_motor: speed: "8299 steps/s" "8299"
261226-262672 stepper_motor: position: "-185 steps" "-185"
262672-263997 stepper_motor: speed: "9057 steps/s" "9057"
262672-263997 stepper_motor: position: "-186 steps" "-186"
263997-265443 stepper_motor: speed: "8299 steps/s" "8299"
263997-265443 stepper_motor: position: "-187 steps" "-187"
265443-266889 stepper_motor: speed: "8299 steps/s" "8299"
265443-266889 stepper_motor: position: "-188 steps" "-188"
266889-268335 stepper_motor: speed: "8299 steps/s" "8299"
266889-268335 stepper_motor: position: "-189 steps" "-189"
268335-269780 stepper_motor: speed: "8304 steps/s" "8304"
268335-269780 stepper_motor: position: "-190 steps" "-190"
269780-271106 stepper_motor: speed: "9050 steps/s" "9050"
269780-271106 stepper_motor: position: "-191 steps" "-191"
271106-272551 stepper_motor: speed: "8304 steps/s" "8304"
271106-272551 stepper_motor: position: "-192 steps" "-192"
272551-273997 stepper_motor: speed: "8299 steps/s" "8299"
272551-273997 stepper_motor: position: "-193 steps" "-193"
273997-275443 stepper_motor: speed: "8299 steps/s" "8299"
273997-275443 stepper_motor: position: "-194 steps" "-194"
275443-276889 stepper_motor: speed: "8299 steps/s" "8299"
275443-276889 stepper_motor: position: "-195 steps" "-195"
276889-278214 stepper_motor: speed: "9057 steps/s" "9057"
276889-278214 stepper_motor: position: "-196 steps" "-196"
278214-279660 stepper_motor: speed: "8299 steps/s" "8299"
278214-279660 stepper_motor: position: "-197 steps" "-197"
279660-281105 stepper_motor: speed: "8304 steps/s" "8304"
279660-281105 stepper_motor: position: "-198 steps" "-198"
281105-282552 stepper_motor: speed: "8293 steps/s" "8293"
281105-282552 stepper_motor: position: "-199 steps" "-199"
282552-283997 stepper_motor: speed: "8304 steps/s" "8304"
282552-283997 stepper_motor: position: "-200 steps" "-200"
283997-285443 stepper_motor: speed: "8299 steps/s" "8299"
283997-285443 stepper_motor: position: "-201 steps" "-201"
285443-286768 stepper_motor: speed: "9057 steps/s" "9057"
285443-286768 stepper_motor: position: "-202 steps" "-202"
286768-288214 stepper_motor: speed: "8299 steps/s" "8299"
286768-288214 stepper_motor: position: "-203 steps" "-203"
288214-289659 stepper_motor: speed: "8304 steps/s" "8304"
288214-289659 stepper_motor: position: "-204 steps" "-204"
289659-291105 stepper_motor: speed: "8299 steps/s" "8299"
289659-291105 stepper_motor: position: "-205 steps" "-205"
291105-292551 stepper_motor: speed: "8299 steps/s" "8299"
291105-292551 stepper_motor: position: "-206 steps" "-206"
292551-293876 stepper_motor: speed: "9057 steps/s" "9057"
292551-293876 stepper_motor: position: "-207 steps" "-207"
293876-295322 stepper_motor: speed: "8299 steps/s" "8299"
293876-295322 stepper_motor: position: "-208 steps" "-208"
295322-296768 stepper_motor: speed: "8299 steps/s" "8299"
295322-296768 stepper_motor: position: "-209 steps" "-209"
296768-298213 stepper_motor: speed: "8304 steps/s" "8304"
296768-298213 stepper_motor: position: "-210 steps" "-210"
298213-299660 stepper_motor: speed: "8293 steps/s" "8293"
298213-299660 stepper_motor: position: "-211 steps" "-211"
299660-300984 stepper_motor: speed: "9063 steps/s" "9063"
299660-300984 stepper_motor: position: "-212 steps" "-212"
300984-302430 stepper_motor: speed: "8299 steps/s" "8299"
300984-302430 stepper_motor: position: "-213 steps" "-213"
302430-303876 stepper_motor: speed: "8299 steps/s" "8299"
302430-303876 stepper_motor: position: "-214 steps" "-214"
303876-305322 stepper_motor: speed: "8299 steps/s" "8299"
303876-305322 stepper_motor: position: "-215 steps" "-215"
305322-306767 stepper_motor: speed: "8304 steps/s" "8304"
305322-306767 stepper_motor: position: "-216 steps" "-216"
306767-308214 stepper_motor: speed: "8293 steps/s" "8293"
306767-308214 stepper_motor: position: "-217 steps" "-217"
308214-309538 stepper_motor: speed: "9063 steps/s" "9063"
308214-309538 stepper_motor: position: "-218 steps" "-218"
309538-310984 stepper_motor: speed: "8299 steps/s" "8299"
309538-310984 stepper_motor: position: "-219 steps" "-219"
310984-312430 stepper_motor: speed: "8299 steps/s" "8299"
310984-312430 stepper_motor: position: "-220 steps" "-220"
312430-313876 stepper_motor: speed: "8299 steps/s" "8299"
312430-313876 stepper_motor: position: "-221 steps" "-221"
313876-315322 stepper_motor: speed: "8299 steps/s" "8299"
313876-315322 stepper_motor: position: "-222 steps" "-222"
315322-316647 stepper_motor: speed: "9057 steps/s" "9057"
315322-316647 stepper_motor: position: "-223 steps" "-223"
316647-318092 stepper_motor: speed: "8304 steps/s" "8304"
316647-318092 stepper_motor: position: "-224 steps" "-224"
318092-319538 stepper_motor: speed: "8299 steps/s" "8299"
318092-319538 stepper_motor: position: "-225 steps" "-225"
319538-320984 stepper_motor: speed: "8299 steps/s" "8299"
319538-320984 stepper_motor: position: "-226 steps" "-226"
320984-322429 stepper_motor: speed: "8304 steps/s" "8304"
320984-322429 stepper_motor: position: "-227 steps" "-227"
322429-323755 stepper_motor: speed: "9050 steps/s" "9050"
322429-323755 stepper_motor: position: "-228 steps" "-228"
323755-325200 stepper_motor: speed: "8304 steps/s" "8304"
323755-325200 stepper_motor: position: "-229 steps" "-229"
325200-326646 stepper_motor: speed: "8299 steps/s" "8299"
325200-326646 stepper_motor: position: "-230 steps" "-230"
326646-328094 stepper_motor: speed: "8287 steps/s" "8287"
326646-328094 stepper_motor: position: "-231 steps" "-231"
328094-329538 stepper_motor: speed: "8310 steps/s" "8310"
328094-329538 stepper_motor: position: "-232 steps" "-232"
329538-330983 stepper_motor: speed: "8304 steps/s" "8304"
329538-330983 stepper_motor: position: "-233 steps" "-233"
330983-332309 stepper_motor: speed: "9050 steps/s" "9050"
330983-332309 stepper_motor: position: "-234 steps" "-234"
332309-333754 stepper_motor: speed: "8304 steps/s" "8304"
332309-333754 stepper_motor: position: "-235 steps" "-235"
333754-335200 stepper_motor: speed: "8299 steps/s" "8299"
333754-335200 stepper_motor: position: "-236 steps" "-236"
335200-336646 stepper_motor: speed: "8299 steps/s" "8299"
335200-336646 stepper_motor: position: "-237 steps" "-237"
336646-338092 stepper_motor: speed: "8299 steps/s" "8299"
336646-338092 stepper_motor: position: "-238 steps" "-238"
338092-339417 stepper_motor: speed: "9057 steps/s" "9057"
338092-339417 stepper_motor: position: "-239 steps" "-239"
339417-340863 stepper_motor: speed: "8299 steps/s" "8299"
339417-340863 stepper_motor: position: "-240 steps" "-240"
340863-342308 stepper_motor: speed: "8304 steps/s" "8304"
340863-342308 stepper_motor: position: "-241 steps" "-241"
342308-343754 stepper_motor: speed: "8299 steps/s" "8299"
342308-343754 stepper_motor: position: "-242 steps" "-242"
343754-345200 stepper_motor: speed: "8299 steps/s" "8299"
343754-345200 stepper_motor: position: "-243 steps" "-243"
345200-346525 stepper_motor: speed: "9057 steps/s" "9057"
345200-346525 stepper_motor: position: "-244 steps" "-244"
346525-347971 stepper_motor: speed: "8299 steps/s" "8299"
346525-347971 stepper_motor: position: "-245 steps" "-245"
347971-349417 stepper_motor: speed: "8299 steps/s" "8299"
347971-349417 stepper_motor: position: "-246 steps" "-246"
349417-350862 stepper_motor: speed: "8304 steps/s" "8304"
349417-350862 stepper_motor: position: "-247 steps" "-247"
350862-352308 stepper_motor: speed: "8299 steps/s" "8299"
350862-352308 stepper_motor: position: "-248 steps" "-248"
352308-353754 stepper_motor: speed: "8299 steps/s" "8299"
352308-353754 stepper_motor: position: "-249 steps" "-249"
353754-355079 stepper_motor: speed: "9057 steps/s" "9057"
353754-355079 stepper_motor: position: "-250 steps" "-250"
355079-356525 stepper_motor: speed: "8299 steps/s" "8299"
355079-356525 stepper_motor: position: "-251 steps" "-251"
356525-357971 stepper_motor: speed: "8299 steps/s" "8299"
356525-357971 stepper_motor: position: "-252 steps" "-252"
357971-359416 stepper_motor: speed: "8304 steps/s" "8304"
357971-359416 stepper_motor: position: "-253 steps" "-253"
359416-360862 stepper_motor: speed: "8299 steps/s" "8299"
359416-360862 stepper_motor: position: "-254 steps" "-254"
360862-362187 stepper_motor: speed: "9057 steps/s" "9057"
360862-362187 stepper_motor: position: "-255 steps" "-255"
362187-363633 stepper_motor: speed: "8299 steps/s" "8299"
362187-363633 stepper_motor: position: "-256 steps" "-256"
363633-365079 stepper_motor: speed: "8299 steps/s" "8299"
363633-365079 stepper_motor: position: "-257 steps" "-257"
365079-366525 stepper_motor: speed: "8299 steps/s" "8299"
365079-366525 stepper_motor: position: "-258 steps" "-258"
366525-367970 stepper_motor: speed: "8304 steps/s" "8304"
366525-367970 stepper_motor: position: "-259 steps" "-259"
367970-369416 stepper_motor: speed: "8299 steps/s" "8299"
367970-369416 stepper_motor: position: "-260 steps" "-260"
369416-370741 stepper_motor: speed: "9057 steps/s" "9057"
369416-370741 stepper_motor: position: "-261 steps" "-261"
370741-372187 stepper_motor: speed: "8299 steps/s" "8299"
370741-372187 stepper_motor: position: "-262 steps" "-262"
372187-373633 stepper_motor: speed: "8299 steps/s" "8299"
372187-373633 stepper_motor: position: "-263 steps" "-263"
373633-375079 stepper_motor: speed: "8299 steps/s" "8299"
373633-375079 stepper_motor: position: "-264 steps" "-264"
375079-376524 stepper_motor: speed: "8304 steps/s" "8304"
375079-376524 stepper_motor: position: "-265 steps" "-265"
376524-377850 stepper_motor: speed: "9050 steps/s" "9050"
376524-377850 stepper_motor: position: "-266 steps" "-266"
377850-379295 stepper_motor: speed: "8304 steps/s" "8304"
377850-379295 stepper_motor: position: "-267 steps" "-267"
379295-380742 stepper_motor: speed: "8293 steps/s" "8293"
379295-380742 stepper_motor: position: "-268 steps" "-268"
380742-382187 stepper_motor: speed: "8304 steps/s" "8304"
380742-382187 stepper_motor: position: "-269 steps" "-269"
382187-383633 stepper_motor: speed: "8299 steps/s" "8299"
382187-383633 stepper_motor: position: "-270 steps" "-270"
383633-384958 stepper_motor: speed: "9057 steps/s" "9057"
383633-384958 stepper_motor: position: "-271 steps" "-271"
384958-386404 stepper_motor: speed: "8299 steps/s" "8299"
384958-386404 stepper_motor: position: "-272 steps" "-272"
386404-387849 stepper_motor: speed: "8304 steps/s" "8304"
386404-387849 stepper_motor: position: "-273 steps" "-273"
387849-389295 stepper_motor: speed: "8299 steps/s" "8299"
387849-389295 stepper_motor: position: "-274 steps" "-274"
389295-390741 stepper_motor: speed: "8299 steps/s" "8299"
389295-390741 stepper_motor: position: "-275 steps" "-275"
390741-392188 stepper_motor: speed: "8293 steps/s" "8293"
390741-392188 stepper_motor: position: "-276 steps" "-276"
392188-393512 stepper_motor: speed: "9063 steps/s" "9063"
392188-393512 stepper_motor: position: "-277 steps" "-277"
393512-394958 stepper_motor: speed: "8299 steps/s" "8299"
393512-394958 stepper_motor: position: "-278 steps" "-278"
394958-396403 stepper_motor: speed: "8304 steps/s" "8304"
394958-396403 stepper_motor: position: "-279 steps" "-279"
396403-397850 stepper_motor: speed: "8293 steps/s" "8293"
396403-397850 stepper_motor: position: "-280 steps" "-280"
397850-399295 stepper_motor: speed: "8304 steps/s" "8304"
397850-399295 stepper_motor: position: "-281 steps" "-281"
399295-400620 stepper_motor: speed: "9057 steps/s" "9057"
399295-400620 stepper_motor: position: "-282 steps" "-282"
400620-402066 stepper_motor: speed: "8299 steps/s" "8299"
400620-402066 stepper_motor: position: "-283 steps" "-283"
402066-403511 stepper_motor: speed: "8304 steps/s" "8304"
402066-403511 stepper_motor: position: "-284 steps" "-284"
403511-404957 stepper_motor: speed: "8299 steps/s" "8299"
403511-404957 stepper_motor: position: "-285 steps" "-285"
404957-406403 stepper_motor: speed: "8299 steps/s" "8299"
404957-406403 stepper_motor: position: "-286 steps" "-286"
406403-407728 stepper_motor: speed: "9057 steps/s" "9057"
406403-407728 stepper_motor: position: "-287 steps" "-287"
407728-409174 stepper_motor: speed: "8299 steps/s" "8299"
407728-409174 stepper_motor: position: "-288 steps" "-288"
409174-410621 stepper_motor: speed: "8293 steps/s" "8293"
409174-410621 stepper_motor: position: "-289 steps" "-289"
410621-412065 stepper_motor: speed: "8310 steps/s" "8310"
410621-412065 stepper_motor: position: "-290 steps" "-290"
412065-413511 stepper_motor: speed: "8299 steps/s" "8299"
412065-413511 stepper_motor: position: "-291 steps" "-291"
413511-414957 stepper_motor: speed: "8299 steps/s" "8299"
413511-414957 stepper_motor: position: "-292 steps" "-292"
414957-416282 stepper_motor: speed: "9057 steps/s" "9057"
414957-416282 stepper_motor: position: "-293 steps" "-293"
416282-417728 stepper_motor: speed: "8299 steps/s" "8299"
416282-417728 stepper_motor: position: "-294 steps" "-294"
417728-419174 stepper_motor: speed: "8299 steps/s" "8299"
417728-419174 stepper_motor: position: "-295 steps" "-295"
419174-420619 stepper_motor: speed: "8304 steps/s" "8304"
419174-420619 stepper_motor: position: "-296 steps" "-296"
420619-422065 stepper_motor: speed: "8299 steps/s" "8299"
420619-422065 stepper_motor: position: "-297 steps" "-297"
422065-423390 stepper_motor: speed: "9057 steps/s" "9057"
422065-423390 stepper_motor: position: "-298 steps" "-298"
423390-424836 stepper_motor: speed: "8299 steps/s" "8299"
423390-424836 stepper_motor: position: "-299 steps" "-299"
424836-426282 stepper_motor: speed: "8299 steps/s" "8299"
424836-426282 stepper_motor: position: "-300 steps" "-300"
426282-427728 stepper_motor: speed: "8299 steps/s" "8299"
426282-427728 stepper_motor: position: "-301 steps" "-301"
427728-429173 stepper_motor: speed: "8304 steps/s" "8304"
427728-429173 stepper_motor: position: "-302 steps" "-302"
429173-430499 stepper_motor: speed: "9050 steps/s" "9050"
429173-430499 stepper_motor: position: "-303 steps" "-303"
430499-431944 stepper_motor: speed: "8304 steps/s" "8304"
430499-431944 stepper_motor: position: "-304 steps" "-304"
431944-433390 stepper_motor: speed: "8299 steps/s" "8299"
431944-433390 stepper_motor: position: "-305 steps" "-305"
433390-434836 stepper_motor: speed: "8299 steps/s" "8299"
433390-434836 stepper_motor: position: "-306 steps" "-306"
434836-436282 stepper_motor: speed: "8299 steps/s" "8299"
434836-436282 stepper_motor: position: "-307 steps" "-307"
436282-437727 stepper_motor: speed: "8304 steps/s" "8304"
436282-437727 stepper_motor: position: "-308 steps" "-308"
437727-439053 stepper_motor: speed: "9050 steps/s" "9050"
437727-439053 stepper_motor: position: "-309 steps" "-309"
439053-440498 stepper_motor: speed: "8304 steps/s" "8304"
439053-440498 stepper_motor: position: "-310 steps" "-310"
440498-441944 stepper_motor: speed: "8299 steps/s" "8299"
440498-441944 stepper_motor: position: "-311 steps" "-311"
441944-443390 stepper_motor: speed: "8299 steps/s" "8299"
441944-443390 stepper_motor: position: "-312 steps" "-312"
443390-444836 stepper_motor: speed: "8299 steps/s" "8299"
443390-444836 stepper_motor: position: "-313 steps" "-313"
444836-446161 stepper_motor: speed: "9057 steps/s" "9057"
444836-446161 stepper_motor: position: "-314 steps" "-314"
446161-447607 stepper_motor: speed: "8299 steps/s" "8299"
446161-447607 stepper_motor: position: "-315 steps" "-315"
447607-449052 stepper_motor: speed: "8304 steps/s" "8304"
447607-449052 stepper_motor: position: "-316 steps" "-316"
449052-450498 stepper_motor: speed: "8299 steps/s" "8299"
449052-450498 stepper_motor: position: "-317 steps" "-317"
450498-451944 stepper_motor: speed: "8299 steps/s" "8299"
450498-451944 stepper_motor: position: "-318 steps" "-318"
451944-453269 stepper_motor: speed: "9057 steps/s" "9057"
451944-453269 stepper_motor: position: "-319 steps" "-319"
453269-454717 stepper_motor: speed: "8287 steps/s" "8287"
453269-454717 stepper_motor: position: "-320 steps" "-320"
454717-456161 stepper_motor: speed: "8310 steps/s" "8310"
454717-456161 stepper_motor: position: "-321 steps" "-321"
456161-457606 stepper_motor: speed: "8304 steps/s" "8304"
456161-457606 stepper_motor: position: "-322 steps" "-322"
457606-459052 stepper_motor: speed: "8299 steps/s" "8299"
457606-459052 stepper_motor: position: "-323 steps" "-323"
459052-460498 stepper_motor: speed: "8299 steps/s" "8299"
459052-460498 stepper_motor: position: "-324 steps" "-324"
460498-461823 stepper_motor: speed: "9057 steps/s" "9057"
460498-461823 stepper_motor: position: "-325 steps" "-325"
461823-463269 stepper_motor: speed: "8299 steps/s" "8299"
461823-463269 stepper_motor: position: "-326 steps" "-326"
463269-464715 stepper_motor: speed: "8299 steps/s" "8299"
463269-464715 stepper_motor: position: "-327 steps" "-327"
464715-466160 stepper_motor: speed: "8304 steps/s" "8304"
464715-466160 stepper_motor: position: "-328 steps" "-328"
466160-467606 stepper_motor: speed: "8299 steps/s" "8299"
466160-467606 stepper_motor: position: "-329 steps" "-329"
467606-468931 stepper_motor: speed: "9057 steps/s" "9057"
467606-468931 stepper_motor: position: "-330 steps" "-330"
468931-470377 stepper_motor: speed: "8299 steps/s" "8299"
468931-470377 stepper_motor: position: "-331 steps" "-331"
470377-471823 stepper_motor: speed: "8299 steps/s" "8299"
470377-471823 stepper_motor: position: "-332 steps" "-332"
471823-473269 stepper_motor: speed: "8299 steps/s" "8299"
471823-473269 stepper_motor: position: "-333 steps" "-333"
473269-474714 stepper_motor: speed: "8304 steps/s" "8304"
473269-474714 stepper_motor: position: "-334 steps" "-334"
474714-476160 stepper_motor: speed: "8299 steps/s" "8299"
474714-476160 stepper_motor: position: "-335 steps" "-335"
476160-477485 stepper_motor: speed: "9057 steps/s" "9057"
476160-477485 stepper_motor: position: "-336 steps" "-336"
477485-478931 stepper_motor: speed: "8299 steps/s" "8299"
477485-478931 stepper_motor: position: "-337 steps" "-337"
478931-480377 stepper_motor: speed: "8299 steps/s" "8299"
478931-480377 stepper_motor: position: "-338 steps" "-338"
480377-481822 stepper_motor: speed: "8304 steps/s" "8304"
480377-481822 stepper_motor: position: "-339 steps" "-339"
481822-483268 stepper_motor: speed: "8299 steps/s" "8299"
481822-483268 stepper_motor: position: "-340 steps" "-340"
483268-484593 stepper_motor: speed: "9057 steps/s" "9057"
483268-484593 stepper_motor: position: "-341 steps" "-341"
484593-486039 stepper_motor: speed: "8299 steps/s" "8299"
484593-486039 stepper_motor: position: "-342 steps" "-342"
486039-487485 stepper_motor: speed: "8299 steps/s" "8299"
486039-487485 stepper_motor: position: "-343 steps" "-343"
487485-488931 stepper_motor: speed: "8299 steps/s" "8299"
487485-488931 stepper_motor: position: "-344 steps" "-344"
488931-490376 stepper_motor: speed: "8304 steps/s" "8304"
488931-490376 stepper_motor: position: "-345 steps" "-345"
490376-491702 stepper_motor: speed: "9050 steps/s" "9050"
490376-491702 stepper_motor: position: "-346 steps" "-346"
491702-493147 stepper_motor: speed: "8304 steps/s" "8304"
491702-493147 stepper_motor: position: "-347 steps" "-347"
493147-494593 stepper_motor: speed: "8299 steps/s" "8299"
493147-494593 stepper_motor: position: "-348 steps" "-348"
494593-496039 stepper_motor: speed: "8299 steps/s" "8299"
494593-496039 stepper_motor: position: "-349 steps" "-349"
496039-497485 stepper_motor: speed: "8299 steps/s" "8299"
496039-497485 stepper_motor: position: "-350 steps" "-350"
497485-498930 stepper_motor: speed: "8304 steps/s" "8304"
497485-498930 stepper_motor: position: "-351 steps" "-351"
498930-500257 stepper_motor: speed: "9043 steps/s" "9043"
498930-500257 stepper_motor: position: "-352 steps" "-352"
500257-501701 stepper_motor: speed: "8310 steps/s" "8310"
500257-501701 stepper_motor: position: "-353 steps" "-353"
501701-503148 stepper_motor: speed: "8293 steps/s" "8293"
501701-503148 stepper_motor: position: "-354 steps" "-354"
503148-504593 stepper_motor: speed: "8304 steps/s" "8304"
503148-504593 stepper_motor: position: "-355 steps" "-355"
504593-506039 stepper_motor: speed: "8299 steps/s" "8299"
504593-506039 stepper_motor: position: "-356 steps" "-356"
506039-507364 stepper_motor: speed: "9057 steps/s" "9057"
506039-507364 stepper_motor: position: "-357 steps" "-357"
507364-508810 stepper_motor: speed: "8299 steps/s" "8299"
507364-508810 stepper_motor: position: "-358 steps" "-358"
508810-510255 stepper_motor: speed: "8304 steps/s" "8304"
508810-510255 stepper_motor: position: "-359 steps" "-359"
510255-511701 stepper_motor: speed: "8299 steps/s" "8299"
510255-511701 stepper_motor: position: "-360 steps" "-360"
511701-513147 stepper_motor: speed: "8299 steps/s" "8299"
511701-513147 stepper_motor: position: "-361 steps" "-361"
513147-514474 stepper_motor: speed: "9043 steps/s" "9043"
513147-514474 stepper_motor: position: "-362 steps" "-362"
514474-515918 stepper_motor: speed: "8310 steps/s" "8310"
514474-515918 stepper_motor: position: "-363 steps" "-363"
515918-517364 stepper_motor: speed: "8299 steps/s" "8299"
515918-517364 stepper_motor: position: "-364 steps" "-364"
517364-518810 stepper_motor: speed: "8299 steps/s" "8299"
517364-518810 stepper_motor: position: "-365 steps" "-365"
518810-520255 stepper_motor: speed: "8304 steps/s" "8304"
518810-520255 stepper_motor: position: "-366 steps" "-366"
520255-521701 stepper_motor: speed: "8299 steps/s" "8299"
520255-521701 stepper_motor: position: "-367 steps" "-367"
521701-523028 stepper_motor: speed: "9043 steps/s" "9043"
521701-523028 stepper_motor: position: "-368 steps" "-368"
523028-524472 stepper_motor: speed: "8310 steps/s" "8310"
523028-524472 stepper_motor: position: "-369 steps" "-369"
524472-525918 stepper_motor: speed: "8299 steps/s" "8299"
524472-525918 stepper_motor: position: "-370 steps" "-370"
525918-527363 stepper_motor: speed: "8304 steps/s" "8304"
525918-527363 stepper_motor: position: "-371 steps" "-371"
527363-528809 stepper_motor: speed: "8299 steps/s" "8299"
527363-528809 stepper_motor: position: "-372 steps" "-372"
528809-530134 stepper_motor: speed: "9057 steps/s" "9057"
528809-530134 stepper_motor: position: "-373 steps" "-373"
530134-531580 stepper_motor: speed: "8299 steps/s" "8299"
530134-531580 stepper_motor: position: "-374 steps" "-374"
531580-533026 stepper_motor: speed: "8299 steps/s" "8299"
531580-533026 stepper_motor: position: "-375 steps" "-375"
533026-534472 stepper_motor: speed: "8299 steps/s" "8299"
533026-534472 stepper_motor: position: "-376 steps" "-376"
534472-535917 stepper_motor: speed: "8304 steps/s" "8304"
534472-535917 stepper_motor: position: "-377 steps" "-377"
535917-537243 stepper_motor: speed: "9050 steps/s" "9050"
535917-537243 stepper_motor: position: "-378 steps" "-378"
537243-538688 stepper_motor: speed: "8304 steps/s" "8304"
537243-538688 stepper_motor: position: "-379 steps" "-379"
538688-540136 stepper_motor: speed: "8287 steps/s" "8287"
538688-540136 stepper_motor: position: "-380 steps" "-380"
540136-541580 stepper_motor: speed: "8310 steps/s" "8310"
540136-541580 stepper_motor: position: "-381 steps" "-381"
541580-543026 stepper_motor: speed: "8299 steps/s" "8299"
541580-543026 stepper_motor: position: "-382 steps" "-382"
543026-544471 stepper_motor: speed: "8304 steps/s" "8304"
543026-544471 stepper_motor: position: "-383 steps" "-383"
544471-545797 stepper_motor: speed: "9050 steps/s" "9050"
544471-545797 stepper_motor: position: "-384 steps" "-384"
545797-547242 stepper_motor: speed: "8304 steps/s" "8304"
545797-547242 stepper_motor: position: "-385 steps" "-385"
547242-548688 stepper_motor: speed: "8299 steps/s" "8299"
547242-548688 stepper_motor: position: "-386 steps" "-386"
548688-550134 stepper_motor: speed: "8299 steps/s" "8299"
548688-550134 stepper_motor: position: "-387 steps" "-387"
550134-551580 stepper_motor: speed: "8299 steps/s" "8299"
550134-551580 stepper_motor: position: "-388 steps" "-388"
551580-552905 stepper_motor: speed: "9057 steps/s" "9057"
551580-552905 stepper_motor: position: "-389 steps" "-389"
552905-554351 stepper_motor: speed: "8299 steps/s" "8299"
552905-554351 stepper_motor: position: "-390 steps" "-390"
554351-555797 stepper_motor: speed: "8299 steps/s" "8299"
554351-555797 stepper_motor: position: "-391 steps" "-391"
555797-557242 stepper_motor: speed: "8304 steps/s" "8304"
555797-557242 stepper_motor: position: "-392 steps" "-392"
557242-558688 stepper_motor: speed: "8299 steps/s" "8299"
557242-558688 stepper_motor: position: "-393 steps" "-393"
558688-560015 stepper_motor: speed: "9043 steps/s" "9043"
558688-560015 stepper_motor: position: "-394 steps" "-394"
560015-561459 stepper_motor: speed: "8310 steps/s" "8310"
560015-561459 stepper_motor: position: "-395 steps" "-395"
561459-562904 stepper_motor: speed: "8304 steps/s" "8304"
561459-562904 stepper_motor: position: "-396 steps" "-396"
562904-564350 stepper_motor: speed: "8299 steps/s" "8299"
562904-564350 stepper_motor: position: "-397 steps" "-397"
564350-565796 stepper_motor: speed: "8299 steps/s" "8299"
564350-565796 stepper_motor: position: "-398 steps" "-398"
565796-567242 stepper_motor: speed: "8299 steps/s" "8299"
565796-567242 stepper_motor: position: "-399 steps" "-399"
567242-568567 stepper_motor: speed: "9057 steps/s" "9057"
567242-568567 stepper_motor: position: "-400 steps" "-400"
568567-570013 stepper_motor: speed: "8299 steps/s" "8299"
568567-570013 stepper_motor: position: "-401 steps" "-401"
570013-571458 stepper_motor: speed: "8304 steps/s" "8304"
570013-571458 stepper_motor: position: "-402 steps" "-402"
571458-572904 stepper_motor: speed: "8299 steps/s" "8299"
571458-572904 stepper_motor: position: "-403 steps" "-403"
572904-574350 stepper_motor: speed: "8299 steps/s" "8299"
572904-574350 stepper_motor: position: "-404 steps" "-404"
574350-575675 stepper_motor: speed: "9057 steps/s" "9057"
574350-575675 stepper_motor: position: "-405 steps" "-405"
575675-577121 stepper_motor: speed: "8299 steps/s" "8299"
575675-577121 stepper_motor: position: "-406 steps" "-406"
577121-578567 stepper_motor: speed: "8299 steps/s" "8299"
577121-578567 stepper_motor: position: "-407 steps" "-407"
578567-580012 stepper_motor: speed: "8304 steps/s" "8304"
578567-580012 stepper_motor: position: "-408 steps" "-408"
580012-581458 stepper_motor: speed: "8299 steps/s" "8299"
580012-581458 stepper_motor: position: "-409 steps" "-409"
581458-582904 stepper_motor: speed: "8299 steps/s" "8299"
581458-582904 stepper_motor: position: "-410 steps" "-410"
582904-584229 stepper_motor: speed: "9057 steps/s" "9057"
582904-584229 stepper_motor: position: "-411 steps" "-411"
584229-585675 stepper_motor: speed: "8299 steps/s" "8299"
584229-585675 stepper_motor: position: "-412 steps" "-412"
585675-587121 stepper_motor: speed: "8299 steps/s" "8299"
585675-587121 stepper_motor: position: "-413 steps" "-413"
587121-588566 stepper_motor: speed: "8304 steps/s" "8304"
587121-588566 stepper_motor: position: "-414 steps" "-414"
588566-590013 stepper_motor: speed: "8293 steps/s" "8293"
588566-590013 stepper_motor: position: "-415 steps" "-415"
590013-591337 stepper_motor: speed: "9063 steps/s" "9063"
590013-591337 stepper_motor: position: "-416 steps" "-416"
591337-592783 stepper_motor: speed: "8299 steps/s" "8299"
591337-592783 stepper_motor: position: "-417 steps" "-417"
592783-594229 stepper_motor: speed: "8299 steps/s" "8299"
592783-594229 stepper_motor: position: "-418 steps" "-418"
594229-595677 stepper_motor: speed: "8287 steps/s" "8287"
594229-595677 stepper_motor: position: "-419 steps" "-419"
595677-597120 stepper_motor: speed: "8316 steps/s" "8316"
595677-597120 stepper_motor: position: "-420 steps" "-420"
597120-598446 stepper_motor: speed: "9050 steps/s" "9050"
597120-598446 stepper_motor: position: "-421 steps" "-421"
598446-599891 stepper_motor: speed: "8304 steps/s" "8304"
598446-599891 stepper_motor: position: "-422 steps" "-422"
599891-601339 stepper_motor: speed: "8287 steps/s" "8287"
599891-601339 stepper_motor: position: "-423 steps" "-423"
601339-602783 stepper_motor: speed: "8310 steps/s" "8310"
601339-602783 stepper_motor: position: "-424 steps" "-424"
602783-604229 stepper_motor: speed: "8299 steps/s" "8299"
602783-604229 stepper_motor: position: "-425 steps" "-425"
604229-605674 stepper_motor: speed: "8304 steps/s" "8304"
604229-605674 stepper_motor: position: "-426 steps" "-426"
605674-607000 stepper_motor: speed: "9050 steps/s" "9050"
605674-607000 stepper_motor: position: "-427 steps" "-427"
607000-608445 stepper_motor: speed: "8304 steps/s" "8304"
607000-608445 stepper_motor: position: "-428 steps" "-428"
608445-609891 stepper_motor: speed: "8299 steps/s" "8299"
608445-609891 stepper_motor: position: "-429 steps" "-429"
609891-611337 stepper_motor: speed: "8299 steps/s" "8299"
609891-611337 stepper_motor: position: "-430 steps" "-430"
611337-612783 stepper_motor: speed: "8299 steps/s" "8299"
611337-612783 stepper_motor: position: "-431 steps" "-431"
612783-614108 stepper_motor: speed: "9057 steps/s" "9057"
612783-614108 stepper_motor: position: "-432 steps" "-432"
614108-615555 stepper_motor: speed: "8293 steps/s" "8293"
614108-615555 stepper_motor: position: "-433 steps" "-433"
615555-616999 stepper_motor: speed: "8310 steps/s" "8310"
615555-616999 stepper_motor: position: "-434 steps" "-434"
616999-618445 stepper_motor: speed: "8299 steps/s" "8299"
616999-618445 stepper_motor: position: "-435 steps" "-435"
618445-619891 stepper_motor: speed: "8299 steps/s" "8299"
618445-619891 stepper_motor: position: "-436 steps" "-436"
619891-621218 stepper_motor: speed: "9043 steps/s" "9043"
619891-621218 stepper_motor: position: "-437 steps" "-437"
621218-622662 stepper_motor: speed: "8310 steps/s" "8310"
621218-622662 stepper_motor: position: "-438 steps" "-438"
622662-624108 stepper_motor: speed: "8299 steps/s" "8299"
622662-624108 stepper_motor: position: "-439 steps" "-439"
624108-625553 stepper_motor: speed: "8304 steps/s" "8304"
624108-625553 stepper_motor: position: "-440 steps" "-440"
625553-626999 stepper_motor: speed: "8299 steps/s" "8299"
625553-626999 stepper_motor: position: "-441 steps" "-441"
626999-628445 stepper_motor: speed: "8299 steps/s" "8299"
626999-628445 stepper_motor: position: "-442 steps" "-442"
628445-629770 stepper_motor: speed: "9057 steps/s" "9057"
628445-629770 stepper_motor: position: "-443 steps" "-443"
629770-631216 stepper_motor: speed: "8299 steps/s" "8299"
629770-631216 stepper_motor: position: "-444 steps" "-444"
631216-632662 stepper_motor: speed: "8299 steps/s" "8299"
631216-632662 stepper_motor: position: "-445 steps" "-445"
632662-634107 stepper_motor: speed: "8304 steps/s" "8304"
632662-634107 stepper_motor: position: "-446 steps" "-446"
634107-635553 stepper_motor: speed: "8299 steps/s" "8299"
634107-635553 stepper_motor: position: "-447 steps" "-447"
635553-636881 stepper_motor: speed: "9036 steps/s" "9036"
635553-636881 stepper_motor: position: "-448 steps" "-448"
636881-638324 stepper_motor: speed: "8316 steps/s" "8316"
636881-638324 stepper_motor: position: "-449 steps" "-449"
638324-639770 stepper_motor: speed: "8299 steps/s" "8299"
638324-639770 stepper_motor: position: "-450 steps" "-450"
639770-641215 stepper_motor: speed: "8304 steps/s" "8304"
639770-641215 stepper_motor: position: "-451 steps" "-451"
641215-642541 stepper_motor: speed: "9050 steps/s" "9050"
641215-642541 stepper_motor: position: "-452 steps" "-452"
642541-643986 stepper_motor: speed: "8304 steps/s" "8304"
642541-643986 stepper_motor: position: "-453 steps" "-453"
643986-645432 stepper_motor: speed: "8299 steps/s" "8299"
643986-645432 stepper_motor: position: "-454 steps" "-454"
645432-646878 stepper_motor: speed: "8299 steps/s" "8299"
645432-646878 stepper_motor: position: "-455 steps" "-455"
646878-648324 stepper_motor: speed: "8299 steps/s" "8299"
646878-648324 stepper_motor: position: "-456 steps" "-456"
648324-649650 stepper_motor: speed: "9050 steps/s" "9050"
648324-649650 stepper_motor: position: "-457 steps" "-457"
649650-651095 stepper_motor: speed: "8304 steps/s" "8304"
649650-651095 stepper_motor: position: "-458 steps" "-458"
651095-652540 stepper_motor: speed: "8304 steps/s" "8304"
651095-652540 stepper_motor: position: "-459 steps" "-459"
652540-653986 stepper_motor: speed: "8299 steps/s" "8299"
652540-653986 stepper_motor: position: "-460 steps" "-460"
653986-655311 stepper_motor: speed: "9057 steps/s" "9057"
653986-655311 stepper_motor: position: "-461 steps" "-461"
655311-656757 stepper_motor: speed: "8299 steps/s" "8299"
655311-656757 stepper_motor: position: "-462 steps" "-462"
656757-658203 stepper_motor: speed: "8299 steps/s" "8299"
656757-658203 stepper_motor: position: "-463 steps" "-463"
658203-659649 stepper_motor: speed: "8299 steps/s" "8299"
658203-659649 stepper_motor: position: "-464 steps" "-464"
659649-661094 stepper_motor: speed: "8304 steps/s" "8304"
659649-661094 stepper_motor: position: "-465 steps" "-465"
661094-662420 stepper_motor: speed: "9050 steps/s" "9050"
661094-662420 stepper_motor: position: "-466 steps" "-466"
662420-663865 stepper_motor: speed: "8304 steps/s" "8304"
662420-663865 stepper_motor: position: "-467 steps" "-467"
663865-665311 stepper_motor: speed: "8299 steps/s" "8299"
663865-665311 stepper_motor: position: "-468 steps" "-468"
665311-666757 stepper_motor: speed: "8299 steps/s" "8299"
665311-666757 stepper_motor: position: "-469 steps" "-469"
666757-668082 stepper_motor: speed: "9057 steps/s" "9057"
666757-668082 stepper_motor: position: "-470 steps" "-470"
668082-669528 stepper_motor: speed: "8299 steps/s" "8299"
668082-669528 stepper_motor: position: "-471 steps" "-471"
669528-670974 stepper_motor: speed: "8299 steps/s" "8299"
669528-670974 stepper_motor: position: "-472 steps" "-472"
670974-672419 stepper_motor: speed: "8304 steps/s" "8304"
670974-672419 stepper_motor: position: "-473 steps" "-473"
672419-673745 stepper_motor: speed: "9050 steps/s" "9050"
672419-673745 stepper_motor: position: "-474 steps" "-474"
673745-675190 stepper_motor: speed: "8304 steps/s" "8304"
673745-675190 stepper_motor: position: "-475 steps" "-475"
675190-676636 stepper_motor: speed: "8299 steps/s" "8299"
675190-676636 stepper_motor: position: "-476 steps" "-476"
676636-678082 stepper_motor: speed: "8299 steps/s" "8299"
676636-678082 stepper_motor: position: "-477 steps" "-477"
678082-679528 stepper_motor: speed: "8299 steps/s" "8299"
678082-679528 stepper_motor: position: "-478 steps" "-478"
679528-680853 stepper_motor: speed: "9057 steps/s" "9057"
679528-680853 stepper_motor: position: "-479 steps" "-479"
680853-682299 stepper_motor: speed: "8299 steps/s" "8299"
680853-682299 stepper_motor: position: "-480 steps" "-480"
682299-683744 stepper_motor: speed: "8304 steps/s" "8304"
682299-683744 stepper_motor: position: "-481 steps" "-481"
683744-685190 stepper_motor: speed: "8299 steps/s" "8299"
683744-685190 stepper_motor: position: "-482 steps" "-482"
685190-686515 stepper_motor: speed: "9057 steps/s" "9057"
685190-686515 stepper_motor: position: "-483 steps" "-483"
686515-687961 stepper_motor: speed: "8299 steps/s" "8299"
686515-687961 stepper_motor: position: "-484 steps" "-484"
687961-689407 stepper_motor: speed: "8299 steps/s" "8299"
687961-689407 stepper_motor: position: "-485 steps" "-485"
689407-690853 stepper_motor: speed: "8299 steps/s" "8299"
689407-690853 stepper_motor: position: "-486 steps" "-486"
690853-692299 stepper_motor: speed: "8299 steps/s" "8299"
690853-692299 stepper_motor: position: "-487 steps" "-487"
692299-693624 stepper_motor: speed: "9057 steps/s" "9057"
692299-693624 stepper_motor: position: "-488 steps" "-488"
693624-695069 stepper_motor: speed: "8304 steps/s" "8304"
693624-695069 stepper_motor: position: "-489 steps" "-489"
695069-696515 stepper_motor: speed: "8299 steps/s" "8299"
695069-696515 stepper_motor: position: "-490 steps" "-490"
696515-697963 stepper_motor: speed: "8287 steps/s" "8287"
696515-697963 stepper_motor: position: "-491 steps" "-491"
697963-699286 stepper_motor: speed: "9070 steps/s" "9070"
697963-699286 stepper_motor: position: "-492 steps" "-492"
699286-700732 stepper_motor: speed: "8299 steps/s" "8299"
699286-700732 stepper_motor: position: "-493 steps" "-493"
700732-702178 stepper_motor: speed: "8299 steps/s" "8299"
700732-702178 stepper_motor: position: "-494 steps" "-494"
702178-703623 stepper_motor: speed: "8304 steps/s" "8304"
702178-703623 stepper_motor: position: "-495 steps" "-495"
703623-704949 stepper_motor: speed: "9050 steps/s" "9050"
703623-704949 stepper_motor: position: "-496 steps" "-496"
704949-706394 stepper_motor: speed: "8304 steps/s" "8304"
704949-706394 stepper_motor: position: "-497 steps" "-497"
706394-707840 stepper_motor: speed: "8299 steps/s" "8299"
706394-707840 stepper_motor: position: "-498 steps" "-498"
707840-709286 stepper_motor: speed: "8299 steps/s" "8299"
707840-709286 stepper_motor: position: "-499 steps" "-499"
709286-710732 stepper_motor: speed: "8299 steps/s" "8299"
709286-710732 stepper_motor: position: "-500 steps" "-500"
710732-712057 stepper_motor: speed: "9057 steps/s" "9057"
710732-712057 stepper_motor: position: "-501 steps" "-501"
712057-713503 stepper_motor: speed: "8299 steps/s" "8299"
712057-713503 stepper_motor: position: "-502 steps" "-502"
713503-714949 stepper_motor: speed: "8299 steps/s" "8299"
713503-714949 stepper_motor: position: "-503 steps" "-503"
714949-716394 stepper_motor: speed: "8304 steps/s" "8304"
714949-716394 stepper_motor: position: "-504 steps" "-504"
716394-717719 stepper_motor: speed: "9057 steps/s" "9057"
716394-717719 stepper_motor: position: "-505 steps" "-505"
717719-719165 stepper_motor: speed: "8299 steps/s" "8299"
717719-719165 stepper_motor: position: "-506 steps" "-506"
719165-720611 stepper_motor: speed: "8299 steps/s" "8299"
719165-720611 stepper_motor: position: "-507 steps" "-507"
720611-722057 stepper_motor: speed: "8299 steps/s" "8299"
720611-722057 stepper_motor: position: "-508 steps" "-508"
722057-723383 stepper_motor: speed: "9050 steps/s" "9050"
722057-723383 stepper_motor: position: "-509 steps" "-509"
723383-724828 stepper_motor: speed: "8304 steps/s" "8304"
723383-724828 stepper_motor: position: "-510 steps" "-510"
724828-726273 stepper_motor: speed: "8304 steps/s" "8304"
724828-726273 stepper_motor: position: "-511 steps" "-511"
726273-727719 stepper_motor: speed: "8299 steps/s" "8299"
726273-727719 stepper_motor: position: "-512 steps" "-512"
727719-729165 stepper_motor: speed: "8299 steps/s" "8299"
727719-729165 stepper_motor: position: "-513 steps" "-513"
729165-730490 stepper_motor: speed: "9057 steps/s" "9057"
729165-730490 stepper_motor: position: "-514 steps" "-514"
730490-731936 stepper_motor: speed: "8299 steps/s" "8299"
730490-731936 stepper_motor: position: "-515 steps" "-515"
731936-733382 stepper_motor: speed: "8299 steps/s" "8299"
731936-733382 stepper_motor: position: "-516 steps" "-516"
733382-734827 stepper_motor: speed: "8304 steps/s" "8304"
733382-734827 stepper_motor: position: "-517 steps" "-517"
734827-736153 stepper_motor: speed: "9050 steps/s" "9050"
734827-736153 stepper_motor: position: "-518 steps" "-518"
736153-737600 stepper_motor: speed: "8293 steps/s" "8293"
736153-737600 stepper_motor: position: "-519 steps" "-519"
737600-739044 stepper_motor: speed: "8310 steps/s" "8310"
737600-739044 stepper_motor: position: "-520 steps" "-520"
739044-740490 stepper_motor: speed: "8299 steps/s" "8299"
739044-740490 stepper_motor: position: "-521 steps" "-521"
740490-741935 stepper_motor: speed: "8304 steps/s" "8304"
740490-741935 stepper_motor: position: "-522 steps" "-522"
741935-743261 stepper_motor: speed: "9050 steps/s" "9050"
741935-743261 stepper_motor: position: "-523 steps" "-523"
743261-744706 stepper_motor: speed: "8304 steps/s" "8304"
743261-744706 stepper_motor: position: "-524 steps" "-524"
744706-746152 stepper_motor: speed: "8299 steps/s" "8299"
744706-746152 stepper_motor: position: "-525 steps" "-525"
746152-747598 stepper_motor: speed: "8299 steps/s" "8299"
746152-747598 stepper_motor: position: "-526 steps" "-526"
747598-748923 stepper_motor: speed: "9057 steps/s" "9057"
747598-748923 stepper_motor: position: "-527 steps" "-527"
748923-750369 stepper_motor: speed: "8299 steps/s" "8299"
748923-750369 stepper_motor: position: "-528 steps" "-528"
750369-751815 stepper_motor: speed: "8299 steps/s" "8299"
750369-751815 stepper_motor: position: "-529 steps" "-529"
751815-753260 stepper_motor: speed: "8304 steps/s" "8304"
751815-753260 stepper_motor: position: "-530 steps" "-530"
753260-754586 stepper_motor: speed: "9050 steps/s" "9050"
753260-754586 stepper_motor: position: "-531 steps" "-531"
754586-756031 stepper_motor: speed: "8304 steps/s" "8304"
754586-756031 stepper_motor: position: "-532 steps" "-532"
756031-757477 stepper_motor: speed: "8299 steps/s" "8299"
756031-757477 stepper_motor: position: "-533 steps" "-533"
757477-758923 stepper_motor: speed: "8299 steps/s" "8299"
757477-758923 stepper_motor: position: "-534 steps" "-534"
758923-760370 stepper_motor: speed: "8293 steps/s" "8293"
758923-760370 stepper_motor: position: "-535 steps" "-535"
760370-761694 stepper_motor: speed: "9063 steps/s" "9063"
760370-761694 stepper_motor: position: "-536 steps" "-536"
761694-763140 stepper_motor: speed: "8299 steps/s" "8299"
761694-763140 stepper_motor: position: "-537 steps" "-537"
763140-764585 stepper_motor: speed: "8304 steps/s" "8304"
763140-764585 stepper_motor: position: "-538 steps" "-538"
764585-766033 stepper_motor: speed: "8287 steps/s" "8287"
764585-766033 stepper_motor: position: "-539 steps" "-539"
766033-767356 stepper_motor: speed: "9070 steps/s" "9070"
766033-767356 stepper_motor: position: "-540 steps" "-540"
767356-768802 stepper_motor: speed: "8299 steps/s" "8299"
767356-768802 stepper_motor: position: "-541 steps" "-541"
768802-770248 stepper_motor: speed: "8299 steps/s" "8299"
768802-770248 stepper_motor: position: "-542 steps" "-542"
770248-771694 stepper_motor: speed: "8299 steps/s" "8299"
770248-771694 stepper_motor: position: "-543 steps" "-543"
771694-773021 stepper_motor: speed: "9043 steps/s" "9043"
771694-773021 stepper_motor: position: "-544 steps" "-544"
773021-774465 stepper_motor: speed: "8310 steps/s" "8310"
773021-774465 stepper_motor: position: "-545 steps" "-545"
774465-775910 stepper_motor: speed: "8304 steps/s" "8304"
774465-775910 stepper_motor: position: "-546 steps" "-546"
775910-777356 stepper_motor: speed: "8299 steps/s" "8299"
775910-777356 stepper_motor: position: "-547 steps" "-547"
777356-778802 stepper_motor: speed: "8299 steps/s" "8299"
777356-778802 stepper_motor: position: "-548 steps" "-548"
778802-780128 stepper_motor: speed: "9050 steps/s" "9050"
778802-780128 stepper_motor: position: "-549 steps" "-549"
780128-781573 stepper_motor: speed: "8304 steps/s" "8304"
780128-781573 stepper_motor: position: "-550 steps" "-550"
781573-783019 stepper_motor: speed: "8299 steps/s" "8299"
781573-783019 stepper_motor: position: "-551 steps" "-551"
783019-784466 stepper_motor: speed: "8293 steps/s" "8293"
783019-784466 stepper_motor: position: "-552 steps" "-552"
784466-785790 stepper_motor: speed: "9063 steps/s" "9063"
784466-785790 stepper_motor: position: "-553 steps" "-553"
785790-787235 stepper_motor: speed: "8304 steps/s" "8304"
785790-787235 stepper_motor: position: "-554 steps" "-554"
787235-788681 stepper_motor: speed: "8299 steps/s" "8299"
787235-788681 stepper_motor: position: "-555 steps" "-555"
788681-790127 stepper_motor: speed: "8299 steps/s" "8299"
788681-790127 stepper_motor: position: "-556 steps" "-556"
790127-791573 stepper_motor: speed: "8299 steps/s" "8299"
790127-791573 stepper_motor: position: "-557 steps" "-557"
791573-792898 stepper_motor: speed: "9057 steps/s" "9057"
791573-792898 stepper_motor: position: "-558 steps" "-558"
792898-794345 stepper_motor: speed: "8293 steps/s" "8293"
792898-794345 stepper_motor: position: "-559 steps" "-559"
794345-795789 stepper_motor: speed: "8310 steps/s" "8310"
794345-795789 stepper_motor: position: "-560 steps" "-560"
795789-797235 stepper_motor: speed: "8299 steps/s" "8299"
795789-797235 stepper_motor: position: "-561 steps" "-561"
797235-798561 stepper_motor: speed: "9050 steps/s" "9050"
797235-798561 stepper_motor: position: "-562 steps" "-562"
798561-800007 stepper_motor: speed: "8299 steps/s" "8299"
798561-800007 stepper_motor: position: "-563 steps" "-563"
800007-801452 stepper_motor: speed: "8304 steps/s" "8304"
800007-801452 stepper_motor: position: "-564 steps" "-564"
801452-802898 stepper_motor: speed: "8299 steps/s" "8299"
801452-802898 stepper_motor: position: "-565 steps" "-565"
802898-804223 stepper_motor: speed: "9057 steps/s" "9057"
802898-804223 stepper_motor: position: "-566 steps" "-566"
804223-805669 stepper_motor: speed: "8299 steps/s" "8299"
804223-805669 stepper_motor: position: "-567 steps" "-567"
805669-807114 stepper_motor: speed: "8304 steps/s" "8304"
805669-807114 stepper_motor: position: "-568 steps" "-568"
807114-808560 stepper_motor: speed: "8299 steps/s" "8299"
807114-808560 stepper_motor: position: "-569 steps" "-569"
808560-810006 stepper_motor: speed: "8299 steps/s" "8299"
808560-810006 stepper_motor: position: "-570 steps" "-570"
810006-811331 stepper_motor: speed: "9057 steps/s" "9057"
810006-811331 stepper_motor: position: "-571 steps" "-571"
811331-812777 stepper_motor: speed: "8299 steps/s" "8299"
811331-812777 stepper_motor: position: "-572 steps" "-572"
812777-814223 stepper_motor: speed: "8299 steps/s" "8299"
812777-814223 stepper_motor: position: "-573 steps" "-573"
814223-815668 stepper_motor: speed: "8304 steps/s" "8304"
814223-815668 stepper_motor: position: "-574 steps" "-574"
815668-816994 stepper_motor: speed: "9050 steps/s" "9050"
815668-816994 stepper_motor: position: "-575 steps" "-575"
816994-818439 stepper_motor: speed: "8304 steps/s" "8304"
816994-818439 stepper_motor: position: "-576 steps" "-576"
818439-819885 stepper_motor: speed: "8299 steps/s" "8299"
818439-819885 stepper_motor: position: "-577 steps" "-577"
819885-821332 stepper_motor: speed: "8293 steps/s" "8293"
819885-821332 stepper_motor: position: "-578 steps" "-578"
821332-822656 stepper_motor: speed: "9063 steps/s" "9063"
821332-822656 stepper_motor: position: "-579 steps" "-579"
822656-824102 stepper_motor: speed: "8299 steps/s" "8299"
822656-824102 stepper_motor: position: "-580 steps" "-580"
824102-825548 stepper_motor: speed: "8299 steps/s" "8299"
824102-825548 stepper_motor: position: "-581 steps" "-581"
825548-826993 stepper_motor: speed: "8304 steps/s" "8304"
825548-826993 stepper_motor: position: "-582 steps" "-582"
826993-828439 stepper_motor: speed: "8299 steps/s" "8299"
826993-828439 stepper_motor: position: "-583 steps" "-583"
828439-829765 stepper_motor: speed: "9050 steps/s" "9050"
828439-829765 stepper_motor: position: "-584 steps" "-584"
829765-831210 stepper_motor: speed: "8304 steps/s" "8304"
829765-831210 stepper_motor: position: "-585 steps" "-585"
831210-832656 stepper_motor: speed: "8299 steps/s" "8299"
831210-832656 stepper_motor: position: "-586 steps" "-586"
832656-834103 stepper_motor: speed: "8293 steps/s" "8293"
832656-834103 stepper_motor: position: "-587 steps" "-587"
834103-835427 stepper_motor: speed: "9063 steps/s" "9063"
834103-835427 stepper_motor: position: "-588 steps" "-588"
835427-836872 stepper_motor: speed: "8304 steps/s" "8304"
835427-836872 stepper_motor: position: "-589 steps" "-589"
836872-838318 stepper_motor: speed: "8299 steps/s" "8299"
836872-838318 stepper_motor: position: "-590 steps" "-590"
838318-839764 stepper_motor: speed: "8299 steps/s" "8299"
838318-839764 stepper_motor: position: "-591 steps" "-591"
839764-841210 stepper_motor: speed: "8299 steps/s" "8299"
839764-841210 stepper_motor: position: "-592 steps" "-592"
841210-842535 stepper_motor: speed: "9057 steps/s" "9057"
841210-842535 stepper_motor: position: "-593 steps" "-593"
842535-843981 stepper_motor: speed: "8299 steps/s" "8299"
842535-843981 stepper_motor: position: "-594 steps" "-594"
843981-845426 stepper_motor: speed: "8304 steps/s" "8304"
843981-845426 stepper_motor: position: "-595 steps" "-595"
845426-846874 stepper_motor: speed: "8287 steps/s" "8287"
845426-846874 stepper_motor: position: "-596 steps" "-596"
846874-848197 stepper_motor: speed: "9070 steps/s" "9070"
846874-848197 stepper_motor: position: "-597 steps" "-597"
848197-849643 stepper_motor: speed: "8299 steps/s" "8299"
848197-849643 stepper_motor: position: "-598 steps" "-598"
849643-851089 stepper_motor: speed: "8299 steps/s" "8299"
849643-851089 stepper_motor: position: "-599 steps" "-599"
851089-852535 stepper_motor: speed: "8299 steps/s" "8299"
851089-852535 stepper_motor: position: "-600 steps" "-600"
852535-853860 stepper_motor: speed: "9057 steps/s" "9057"
852535-853860 stepper_motor: position: "-601 steps" "-601"
853860-855307 stepper_motor: speed: "8293 steps/s" "8293"
853860-855307 stepper_motor: position: "-602 steps" "-602"
855307-856751 stepper_motor: speed: "8310 steps/s" "8310"
855307-856751 stepper_motor: position: "-603 steps" "-603"
856751-858199 stepper_motor: speed: "8287 steps/s" "8287"
856751-858199 stepper_motor: position: "-604 steps" "-604"
858199-859643 stepper_motor: speed: "8310 steps/s" "8310"
858199-859643 stepper_motor: position: "-605 steps" "-605"
859643-860968 stepper_motor: speed: "9057 steps/s" "9057"
859643-860968 stepper_motor: position: "-606 steps" "-606"
860968-862414 stepper_motor: speed: "8299 steps/s" "8299"
860968-862414 stepper_motor: position: "-607 steps" "-607"
862414-863860 stepper_motor: speed: "8299 steps/s" "8299"
862414-863860 stepper_motor: position: "-608 steps" "-608"
863860-865305 stepper_motor: speed: "8304 steps/s" "8304"
863860-865305 stepper_motor: position: "-609 steps" "-609"
865305-866631 stepper_motor: speed: "9050 steps/s" "9050"
865305-866631 stepper_motor: position: "-610 steps" "-610"
866631-868076 stepper_motor: speed: "8304 steps/s" "8304"
866631-868076 stepper_motor: position: "-611 steps" "-611"
868076-869522 stepper_motor: speed: "8299 steps/s" "8299"
868076-869522 stepper_motor: position: "-612 steps" "-612"
869522-870968 stepper_motor: speed: "8299 steps/s" "8299"
869522-870968 stepper_motor: position: "-613 steps" "-613"
870968-872293 stepper_motor: speed: "9057 steps/s" "9057"
870968-872293 stepper_motor: position: "-614 steps" "-614"
872293-873739 stepper_motor: speed: "8299 steps/s" "8299"
872293-873739 stepper_motor: position: "-615 steps" "-615"
873739-875185 stepper_motor: speed: "8299 steps/s" "8299"
873739-875185 stepper_motor: position: "-616 steps" "-616"
875185-876630 stepper_motor: speed: "8304 steps/s" "8304"
875185-876630 stepper_motor: position: "-617 steps" "-617"
876630-878076 stepper_motor: speed: "8299 steps/s" "8299"
876630-878076 stepper_motor: position: "-618 steps" "-618"
878076-879401 stepper_motor: speed: "9057 steps/s" "9057"
878076-879401 stepper_motor: position: "-619 steps" "-619"
879401-880847 stepper_motor: speed: "8299 steps/s" "8299"
879401-880847 stepper_motor: position: "-620 steps" "-620"
880847-882293 stepper_motor: speed: "8299 steps/s" "8299"
880847-882293 stepper_motor: position: "-621 steps" "-621"
882293-883739 stepper_motor: speed: "8299 steps/s" "8299"
882293-883739 stepper_motor: position: "-622 steps" "-622"
883739-885064 stepper_motor: speed: "9057 steps/s" "9057"
883739-885064 stepper_motor: position: "-623 steps" "-623"
885064-886510 stepper_motor: speed: "8299 steps/s" "8299"
885064-886510 stepper_motor: position: "-624 steps" "-624"
886510-887955 stepper_motor: speed: "8304 steps/s" "8304"
886510-887955 stepper_motor: position: "-625 steps" "-625"
887955-889401 stepper_motor: speed: "8299 steps/s" "8299"
887955-889401 stepper_motor: position: "-626 steps" "-626"
889401-890847 stepper_motor: speed: "8299 steps/s" "8299"
889401-890847 stepper_motor: position: "-627 steps" "-627"
890847-892172 stepper_motor: speed: "9057 steps/s" "9057"
890847-892172 stepper_motor: position: "-628 steps" "-628"
892172-893619 stepper_motor: speed: "8293 steps/s" "8293"
892172-893619 stepper_motor: position: "-629 steps" "-629"
893619-895064 stepper_motor: speed: "8304 steps/s" "8304"
893619-895064 stepper_motor: position: "-630 steps" "-630"
895064-896509 stepper_motor: speed: "8304 steps/s" "8304"
895064-896509 stepper_motor: position: "-631 steps" "-631"
896509-897835 stepper_motor: speed: "9050 steps/s" "9050"
896509-897835 stepper_motor: position: "-632 steps" "-632"
897835-899280 stepper_motor: speed: "8304 steps/s" "8304"
897835-899280 stepper_motor: position: "-633 steps" "-633"
899280-900726 stepper_motor: speed: "8299 steps/s" "8299"
899280-900726 stepper_motor: position: "-634 steps" "-634"
900726-902173 stepper_motor: speed: "8293 steps/s" "8293"
900726-902173 stepper_motor: position: "-635 steps" "-635"
902173-903497 stepper_motor: speed: "9063 steps/s" "9063"
902173-903497 stepper_motor: position: "-636 steps" "-636"
903497-904943 stepper_motor: speed: "8299 steps/s" "8299"
903497-904943 stepper_motor: position: "-637 steps" "-637"
904943-906389 stepper_motor: speed: "8299 steps/s" "8299"
904943-906389 stepper_motor: position: "-638 steps" "-638"
906389-907835 stepper_motor: speed: "8299 steps/s" "8299"
906389-907835 stepper_motor: position: "-639 steps" "-639"
907835-909280 stepper_motor: speed: "8304 steps/s" "8304"
907835-909280 stepper_motor: position: "-640 steps" "-640"
909280-910605 stepper_motor: speed: "9057 steps/s" "9057"
909280-910605 stepper_motor: position: "-641 steps" "-641"
910605-912051 stepper_motor: speed: "8299 steps/s" "8299"
910605-912051 stepper_motor: position: "-642 steps" "-642"
912051-913497 stepper_motor: speed: "8299 steps/s" "8299"
912051-913497 stepper_motor: position: "-643 steps" "-643"
913497-914943 stepper_motor: speed: "8299 steps/s" "8299"
913497-914943 stepper_motor: position: "-644 steps" "-644"
914943-916268 stepper_motor: speed: "9057 steps/s" "9057"
914943-916268 stepper_motor: position: "-645 steps" "-645"
916268-917714 stepper_motor: speed: "8299 steps/s" "8299"
916268-917714 stepper_motor: position: "-646 steps" "-646"
917714-919159 stepper_motor: speed: "8304 steps/s" "8304"
917714-919159 stepper_motor: position: "-647 steps" "-647"
919159-920606 stepper_motor: speed: "8293 steps/s" "8293"
919159-920606 stepper_motor: position: "-648 steps" "-648"
920606-922051 stepper_motor: speed: "8304 steps/s" "8304"
920606-922051 stepper_motor: position: "-649 steps" "-649"
922051-923376 stepper_motor: speed: "9057 steps/s" "9057"
922051-923376 stepper_motor: position: "-650 steps" "-650"
923376-924822 stepper_motor: speed: "8299 steps/s" "8299"
923376-924822 stepper_motor: position: "-651 steps" "-651"
924822-926268 stepper_motor: speed: "8299 steps/s" "8299"
924822-926268 stepper_motor: position: "-652 steps" "-652"
926268-927715 stepper_motor: speed: "8293 steps/s" "8293"
926268-927715 stepper_motor: position: "-653 steps" "-653"
927715-929039 stepper_motor: speed: "9063 steps/s" "9063"
927715-929039 stepper_motor: position: "-654 steps" "-654"
929039-930484 stepper_motor: speed: "8304 steps/s" "8304"
929039-930484 stepper_motor: position: "-655 steps" "-655"
930484-931930 stepper_motor: speed: "8299 steps/s" "8299"
930484-931930 stepper_motor: position: "-656 steps" "-656"
931930-933376 stepper_motor: speed: "8299 steps/s" "8299"
931930-933376 stepper_motor: position: "-657 steps" "-657"
933376-934702 stepper_motor: speed: "9050 steps/s" "9050"
933376-934702 stepper_motor: position: "-658 steps" "-658"
934702-936147 stepper_motor: speed: "8304 steps/s" "8304"
934702-936147 stepper_motor: position: "-659 steps" "-659"
936147-937592 stepper_motor: speed: "8304 steps/s" "8304"
936147-937592 stepper_motor: position: "-660 steps" "-660"
937592-939038 stepper_motor: speed: "8299 steps/s" "8299"
937592-939038 stepper_motor: position: "-661 steps" "-661"
939038-940484 stepper_motor: speed: "8299 steps/s" "8299"
939038-940484 stepper_motor: position: "-662 steps" "-662"
940484-941809 stepper_motor: speed: "9057 steps/s" "9057"
940484-941809 stepper_motor: position: "-663 steps" "-663"
941809-943255 stepper_motor: speed: "8299 steps/s" "8299"
941809-943255 stepper_motor: position: "-664 steps" "-664"
943255-944701 stepper_motor: speed: "8299 steps/s" "8299"
943255-944701 stepper_motor: position: "-665 steps" "-665"
944701-946146 stepper_motor: speed: "8304 steps/s" "8304"
944701-946146 stepper_motor: position: "-666 steps" "-666"
946146-947472 stepper_motor: speed: "9050 steps/s" "9050"
946146-947472 stepper_motor: position: "-667 steps" "-667"
947472-948917 stepper_motor: speed: "8304 steps/s" "8304"
947472-948917 stepper_motor: position: "-668 steps" "-668"
948917-950363 stepper_motor: speed: "8299 steps/s" "8299"
948917-950363 stepper_motor: position: "-669 steps" "-669"
950363-951809 stepper_motor: speed: "8299 steps/s" "8299"
950363-951809 stepper_motor: position: "-670 steps" "-670"
951809-953134 stepper_motor: speed: "9057 steps/s" "9057"
951809-953134 stepper_motor: position: "-671 steps" "-671"
953134-954580 stepper_motor: speed: "8299 steps/s" "8299"
953134-954580 stepper_motor: position: "-672 steps" "-672"
954580-956026 stepper_motor: speed: "8299 steps/s" "8299"
954580-956026 stepper_motor: position: "-673 steps" "-673"
956026-957471 stepper_motor: speed: "8304 steps/s" "8304"
956026-957471 stepper_motor: position: "-674 steps" "-674"
957471-958917 stepper_motor: speed: "8299 steps/s" "8299"
957471-958917 stepper_motor: position: "-675 steps" "-675"
958917-960242 stepper_motor: speed: "9057 steps/s" "9057"
958917-960242 stepper_motor: position: "-676 steps" "-676"
960242-961688 stepper_motor: speed: "8299 steps/s" "8299"
960242-961688 stepper_motor: position: "-677 steps" "-677"
961688-963134 stepper_motor: speed: "8299 steps/s" "8299"
961688-963134 stepper_motor: position: "-678 steps" "-678"
963134-964580 stepper_motor: speed: "8299 steps/s" "8299"
963134-964580 stepper_motor: position: "-679 steps" "-679"
964580-965905 stepper_motor: speed: "9057 steps/s" "9057"
964580-965905 stepper_motor: position: "-680 steps" "-680"
965905-967351 stepper_motor: speed: "8299 steps/s" "8299"
965905-967351 stepper_motor: position: "-681 steps" "-681"
967351-968796 stepper_motor: speed: "8304 steps/s" "8304"
967351-968796 stepper_motor: position: "-682 steps" "-682"
968796-970242 stepper_motor: speed: "8299 steps/s" "8299"
968796-970242 stepper_motor: position: "-683 steps" "-683"
970242-971688 stepper_motor: speed: "8299 steps/s" "8299"
970242-971688 stepper_motor: position: "-684 steps" "-684"
971688-973013 stepper_motor: speed: "9057 steps/s" "9057"
971688-973013 stepper_motor: position: "-685 steps" "-685"
973013-974459 stepper_motor: speed: "8299 steps/s" "8299"
973013-974459 stepper_motor: position: "-686 steps" "-686"
974459-975905 stepper_motor: speed: "8299 steps/s" "8299"
974459-975905 stepper_motor: position: "-687 steps" "-687"
975905-977350 stepper_motor: speed: "8304 steps/s" "8304"
975905-977350 stepper_motor: position: "-688 steps" "-688"
977350-978676 stepper_motor: speed: "9050 steps/s" "9050"
977350-978676 stepper_motor: position: "-689 steps" "-689"
978676-980121 stepper_motor: speed: "8304 steps/s" "8304"
978676-980121 stepper_motor: position: "-690 steps" "-690"
980121-981567 stepper_motor: speed: "8299 steps/s" "8299"
980121-981567 stepper_motor: position: "-691 steps" "-691"
981567-983013 stepper_motor: speed: "8299 steps/s" "8299"
981567-983013 stepper_motor: position: "-692 steps" "-692"
983013-984338 stepper_motor: speed: "9057 steps/s" "9057"
983013-984338 stepper_motor: position: "-693 steps" "-693"
984338-985784 stepper_motor: speed: "8299 steps/s" "8299"
984338-985784 stepper_motor: position: "-694 steps" "-694"
985784-987230 stepper_motor: speed: "8299 steps/s" "8299"
985784-987230 stepper_motor: position: "-695 steps" "-695"
987230-988675 stepper_motor: speed: "8304 steps/s" "8304"
987230-988675 stepper_motor: position: "-696 steps" "-696"
988675-990121 stepper_motor: speed: "8299 steps/s" "8299"
988675-990121 stepper_motor: position: "-697 steps" "-697"
990121-991446 stepper_motor: speed: "9057 steps/s" "9057"
990121-991446 stepper_motor: position: "-698 steps" "-698"
991446-992892 stepper_motor: speed: "8299 steps/s" "8299"
991446-992892 stepper_motor: position: "-699 steps" "-699"
992892-994338 stepper_motor: speed: "8299 steps/s" "8299"
992892-994338 stepper_motor: position: "-700 steps" "-700"
994338-995784 stepper_motor: speed: "8299 steps/s" "8299"
994338-995784 stepper_motor: position: "-701 steps" "-701"
995784-997109 stepper_motor: speed: "9057 steps/s" "9057"
995784-997109 stepper_motor: position: "-702 steps" "-702"
997109-998555 stepper_motor: speed: "8299 steps/s" "8299"
997109-998555 stepper_motor: position: "-703 steps" "-703"
998555-1000000 stepper_motor: speed: "8304 steps/s" "8304"
998555-1000000 stepper_motor: position: "-704 steps" "-704"
1000000-1001447 stepper_motor: speed: "8293 steps/s" "8293"
1000000-1001447 stepper_motor: position: "-705 steps" "-705"
1001447-1002772 stepper_motor: speed: "9057 steps/s" "9057"
1001447-1002772 stepper_motor: position: "-706 steps" "-706"
1002772-1004217 stepper_motor: speed: "8304 steps/s" "8304"
1002772-1004217 stepper_motor: position: "-707 steps" "-707"
1004217-1005663 stepper_motor: speed: "8299 steps/s" "8299"
1004217-1005663 stepper_motor: position: "-708 steps" "-708"
1005663-1007109 stepper_motor: speed: "8299 steps/s" "8299"
1005663-1007109 stepper_motor: position: "-709 steps" "-709"
1007109-1008554 stepper_motor: speed: "8304 steps/s" "8304"
1007109-1008554 stepper_motor: position: "-710 steps" "-710"
1008554-1009880 stepper_motor: speed: "9050 steps/s" "9050"
1008554-1009880 stepper_motor: position: "-711 steps" "-711"
1009880-1011325 stepper_motor: speed: "8304 steps/s" "8304"
1009880-1011325 stepper_motor: position: "-712 steps" "-712"
1011325-1012771 stepper_motor: speed: "8299 steps/s" "8299"
1011325-1012771 stepper_motor: position: "-713 steps" "-713"
1012771-1014217 stepper_motor: speed: "8299 steps/s" "8299"
1012771-1014217 stepper_motor: position: "-714 steps" "-714"
1014217-1015542 stepper_motor: speed: "9057 steps/s" "9057"
1014217-1015542 stepper_motor: position: "-715 steps" "-715"
1015542-1016988 stepper_motor: speed: "8299 steps/s" "8299"
1015542-1016988 stepper_motor: position: "-716 steps" "-716"
1016988-1018434 stepper_motor: speed: "8299 steps/s" "8299"
1016988-1018434 stepper_motor: position: "-717 steps" "-717"
1018434-1019879 stepper_motor: speed: "8304 steps/s" "8304"
1018434-1019879 stepper_motor: position: "-718 steps" "-718"
1019879-1021325 stepper_motor: speed: "8299 steps/s" "8299"
1019879-1021325 stepper_motor: position: "-719 steps" "-719"
1021325-1022650 stepper_motor: speed: "9057 steps/s" "9057"
1021325-1022650 stepper_motor: position: "-720 steps" "-720"
1022650-1024096 stepper_motor: speed: "8299 steps/s" "8299"
1022650-1024096 stepper_motor: position: "-721 steps" "-721"
1024096-1025542 stepper_motor: speed: "8299 steps/s" "8299"
1024096-1025542 stepper_motor: position: "-722 steps" "-722"
1025542-1026988 stepper_motor: speed: "8299 steps/s" "8299"
1025542-1026988 stepper_motor: position: "-723 steps" "-723"
1026988-1028313 stepper_motor: speed: "9057 steps/s" "9057"
1026988-1028313 stepper_motor: position: "-724 steps" "-724"
1028313-1029758 stepper_motor: speed: "8304 steps/s" "8304"
1028313-1029758 stepper_motor: position: "-725 steps" "-725"
1029758-1031205 stepper_motor: speed: "8293 steps/s" "8293"
1029758-1031205 stepper_motor: position: "-726 steps" "-726"
1031205-1032650 stepper_motor: speed: "8304 steps/s" "8304"
1031205-1032650 stepper_motor: position: "-727 steps" "-727"
1032650-1033975 stepper_motor: speed: "9057 steps/s" "9057"
1032650-1033975 stepper_motor: position: "-728 steps" "-728"
1033975-1035421 stepper_motor: speed: "8299 steps/s" "8299"
1033975-1035421 stepper_motor: position: "-729 steps" "-729"
1035421-1036867 stepper_motor: speed: "8299 steps/s" "8299"
1035421-1036867 stepper_motor: position: "-730 steps" "-730"
1036867-1038312 stepper_motor: speed: "8304 steps/s" "8304"
1036867-1038312 stepper_motor: position: "-731 steps" "-731"
1038312-1039758 stepper_motor: speed: "8299 steps/s" "8299"
1038312-1039758 stepper_motor: position: "-732 steps" "-732"
1039758-1041083 stepper_motor: speed: "9057 steps/s" "9057"
1039758-1041083 stepper_motor: position: "-733 steps" "-733"
1041083-1042529 stepper_motor: speed: "8299 steps/s" "8299"
1041083-1042529 stepper_motor: position: "-734 steps" "-734"
1042529-1043975 stepper_motor: speed: "8299 steps/s" "8299"
1042529-1043975 stepper_motor: position: "-735 steps" "-735"
1043975-1045421 stepper_motor: speed: "8299 steps/s" "8299"
1043975-1045421 stepper_motor: position: "-736 steps" "-736"
1045421-1046746 stepper_motor: speed: "9057 steps/s" "9057"
1045421-1046746 stepper_motor: position: "-737 steps" "-737"
1046746-1048192 stepper_motor: speed: "8299 steps/s" "8299"
1046746-1048192 stepper_motor: position: "-738 steps" "-738"
