281-344 midi: text-verbose: "Channel 1: channel pressure / aftertouch 0" "ch 1: channel pressure 0" "1: CP 0"
355-454 midi: text-verbose: "Channel 1: pitch bend change 0x00 0x40 (8192)" "ch 1: pitch bend 0x00 0x40 (8192)" "1: PB (8192)"
466-565 midi: text-verbose: "Channel 1: control change 'Registered Parameter Number LSB' (param = 0x00)" "ch 1: ctrl chg 'RPN LSB' (param = 0x00)" "1: CC 'RPN-L' is 0x00"
575-672 midi: text-verbose: "Channel 1: control change 'Registered Parameter Number MSB' (param = 0x00)" "ch 1: ctrl chg 'RPN MSB' (param = 0x00)" "1: CC 'RPN-M' is 0x00"
683-780 midi: text-verbose: "Channel 1: control change 'data entry MSB' (param = 0x02)" "ch 1: ctrl chg 'data entry MSB' (param = 0x02)" "1: CC 'data-M' is 0x02"
790-888 midi: text-verbose: "Channel 1: control change 'bank select LSB' (param = 0x00)" "ch 1: ctrl chg 'bank LSB' (param = 0x00)" "1: CC 'bank-L' is 0x00"
898-996 midi: text-verbose: "Channel 1: pitch bend change 0x00 0x40 (8192)" "ch 1: pitch bend 0x00 0x40 (8192)" "1: PB (8192)"
1006-1104 midi: text-verbose: "Channel 1: control change 'effects 3 depth (formerly chorus depth)' (param = 0x00)" "ch 1: ctrl chg 'effects 3 depth' (param = 0x00)" "1: CC 'eff 3 depth' is 0x00"
1115-1212 midi: text-verbose: "Channel 1: control change 'effects 1 depth (formerly external effects depth)' (param = 0x28)" "ch 1: ctrl chg 'effects 1 depth' (param = 0x28)" "1: CC 'eff 1 depth' is 0x28"
1223-1320 midi: text-verbose: "Channel 1: control change 'damper pedal (sustain)' (param = 0x00)" "ch 1: ctrl chg 'sustain' (param = 0x00)" "1: CC 'sust' is 0x00"
1331-1428 midi: text-verbose: "Channel 1: control change 'expression controller MSB' (param = 0x7f)" "ch 1: ctrl chg 'expression MSB' (param = 0x7f)" "1: CC 'expr-M' is 0x7f"
1439-1536 midi: text-verbose: "Channel 1: control change 'pan MSB' (param = 0x40)" "ch 1: ctrl chg 'pan MSB' (param = 0x40)" "1: CC 'pan-M' is 0x40"
1547-1645 midi: text-verbose: "Channel 1: control change 'channel volume MSB (formerly main volume)' (param = 0x64)" "ch 1: ctrl chg 'channel volume MSB' (param = 0x64)" "1: CC 'ch vol-M' is 0x64"
1655-1753 midi: text-verbose: "Channel 1: control change 'modulation wheel/lever MSB' (param = 0x00)" "ch 1: ctrl chg 'modulation MSB' (param = 0x00)" "1: CC 'mod-M' is 0x00"
1763-1861 midi: text-verbose: "Channel 1: note off (note = 0 'C-2', velocity = 0)" "ch 1: note off 0, velocity = 0" "1: N off 0, vel 0"
1871-1968 midi: text-verbose: "Channel 1: note off (note = 0 'C-2', velocity = 0)" "ch 1: note off 0, velocity = 0" "1: N off 0, vel 0"
1979-2076 midi: text-verbose: "Channel 1: control change 'breath controller MSB' (param = 0x00)" "ch 1: ctrl chg 'breath MSB' (param = 0x00)" "1: CC 'breath-M' is 0x00"
2086-2186 midi: text-verbose: "Channel 1: control change 'Non-Registered Parameter Number MSB' (param = 0x78)" "ch 1: ctrl chg 'NRPN MSB' (param = 0x78)" "1: CC 'NRPN-M' is 0x78"
2197-2294 midi: text-verbose: "Channel 1: control change 'Non-Registered Parameter Number LSB' (param = 0x22)" "ch 1: ctrl chg 'NRPN LSB' (param = 0x22)" "1: CC 'NRPN-L' is 0x22"
2305-2402 midi: text-verbose: "Channel 1: control change 'data entry LSB' (param = 0x0e)" "ch 1: ctrl chg 'data entry LSB' (param = 0x0e)" "1: CC 'data-L' is 0x0e"
2413-2510 midi: text-verbose: "Channel 1: control change 'channel volume MSB (formerly main volume)' (param = 0x00)" "ch 1: ctrl chg 'channel volume MSB' (param = 0x00)" "1: CC 'ch vol-M' is 0x00"
2521-2618 midi: text-verbose: "Channel 1: control change 'bank select MSB' (param = 0x01)" "ch 1: ctrl chg 'bank MSB' (param = 0x01)" "1: CC 'bank-M' is 0x01"
2629-2689 midi: text-verbose: "Channel 1: program change to instrument 30 (assuming Overdriven Guitar)" "ch 1: prgm chg to instrument 30" "1: PC 30"
2701-2798 midi: text-verbose: "Channel 1: control change 'channel volume MSB (formerly main volume)' (param = 0x77)" "ch 1: ctrl chg 'channel volume MSB' (param = 0x77)" "1: CC 'ch vol-M' is 0x77"
2810-2905 midi: text-verbose: "Channel 1: control change 'pan MSB' (param = 0x2c)" "ch 1: ctrl chg 'pan MSB' (param = 0x2c)" "1: CC 'pan-M' is 0x2c"
2916-3014 midi: text-verbose: "Channel 1: control change 'Registered Parameter Number MSB' (param = 0x00)" "ch 1: ctrl chg 'RPN MSB' (param = 0x00)" "1: CC 'RPN-M' is 0x00"
3024-3121 midi: text-verbose: "Channel 1: control change 'Registered Parameter Number LSB' (param = 0x00)" "ch 1: ctrl chg 'RPN LSB' (param = 0x00)" "1: CC 'RPN-L' is 0x00"
3133-3229 midi: text-verbose: "Channel 1: control change 'data entry MSB' (param = 0x01)" "ch 1: ctrl chg 'data entry MSB' (param = 0x01)" "1: CC 'data-M' is 0x01"
3240-3302 midi: text-verbose: "Channel 2: channel pressure / aftertouch 0" "ch 2: channel pressure 0" "2: CP 0"
3312-3409 midi: text-verbose: "Channel 2: pitch bend change 0x00 0x40 (8192)" "ch 2: pitch bend 0x00 0x40 (8192)" "2: PB (8192)"
3421-3517 midi: text-verbose: "Channel 2: control change 'Registered Parameter Number LSB' (param = 0x00)" "ch 2: ctrl chg 'RPN LSB' (param = 0x00)" "2: CC 'RPN-L' is 0x00"
3528-3625 midi: text-verbose: "Channel 2: control change 'Registered Parameter Number MSB' (param = 0x00)" "ch 2: ctrl chg 'RPN MSB' (param = 0x00)" "2: CC 'RPN-M' is 0x00"
3636-3734 midi: text-verbose: "Channel 2: control change 'data entry MSB' (param = 0x02)" "ch 2: ctrl chg 'data entry MSB' (param = 0x02)" "2: CC 'data-M' is 0x02"
3744-3841 midi: text-verbose: "Channel 2: control change 'bank select LSB' (param = 0x00)" "ch 2: ctrl chg 'bank LSB' (param = 0x00)" "2: CC 'bank-L' is 0x00"
3853-3950 midi: text-verbose: "Channel 2: pitch bend change 0x00 0x40 (8192)" "ch 2: pitch bend 0x00 0x40 (8192)" "2: PB (8192)"
3960-4058 midi: text-verbose: "Channel 2: control change 'effects 3 depth (formerly chorus depth)' (param = 0x00)" "ch 2: ctrl chg 'effects 3 depth' (param = 0x00)" "2: CC 'eff 3 depth' is 0x00"
4068-4166 midi: text-verbose: "Channel 2: control change 'effects 1 depth (formerly external effects depth)' (param = 0x28)" "ch 2: ctrl chg 'effects 1 depth' (param = 0x28)" "2: CC 'eff 1 depth' is 0x28"
4177-4273 midi: text-verbose: "Channel 2: control change 'damper pedal (sustain)' (param = 0x00)" "ch 2: ctrl chg 'sustain' (param = 0x00)" "2: CC 'sust' is 0x00"
4285-4382 midi: text-verbose: "Channel 2: control change 'expression controller MSB' (param = 0x7f)" "ch 2: ctrl chg 'expression MSB' (param = 0x7f)" "2: CC 'expr-M' is 0x7f"
4394-4491 midi: text-verbose: "Channel 2: control change 'pan MSB' (param = 0x40)" "ch 2: ctrl chg 'pan MSB' (param = 0x40)" "2: CC 'pan-M' is 0x40"
4501-4599 midi: text-verbose: "Channel 2: control change 'channel volume MSB (formerly main volume)' (param = 0x64)" "ch 2: ctrl chg 'channel volume MSB' (param = 0x64)" "2: CC 'ch vol-M' is 0x64"
4609-4707 midi: text-verbose: "Channel 2: control change 'modulation wheel/lever MSB' (param = 0x00)" "ch 2: ctrl chg 'modulation MSB' (param = 0x00)" "2: CC 'mod-M' is 0x00"
4717-4814 midi: text-verbose: "Channel 2: note off (note = 0 'C-2', velocity = 0)" "ch 2: note off 0, velocity = 0" "2: N off 0, vel 0"
4824-4923 midi: text-verbose: "Channel 2: note off (note = 0 'C-2', velocity = 0)" "ch 2: note off 0, velocity = 0" "2: N off 0, vel 0"
4933-5031 midi: text-verbose: "Channel 2: control change 'breath controller MSB' (param = 0x00)" "ch 2: ctrl chg 'breath MSB' (param = 0x00)" "2: CC 'breath-M' is 0x00"
5041-5139 midi: text-verbose: "Channel 2: control change 'Non-Registered Parameter Number MSB' (param = 0x78)" "ch 2: ctrl chg 'NRPN MSB' (param = 0x78)" "2: CC 'NRPN-M' is 0x78"
5150-5246 midi: text-verbose: "Channel 2: control change 'Non-Registered Parameter Number LSB' (param = 0x22)" "ch 2: ctrl chg 'NRPN LSB' (param = 0x22)" "2: CC 'NRPN-L' is 0x22"
5258-5355 midi: text-verbose: "Channel 2: control change 'data entry LSB' (param = 0x0e)" "ch 2: ctrl chg 'data entry LSB' (param = 0x0e)" "2: CC 'data-L' is 0x0e"
5365-5464 midi: text-verbose: "Channel 2: control change 'channel volume MSB (formerly main volume)' (param = 0x00)" "ch 2: ctrl chg 'channel volume MSB' (param = 0x00)" "2: CC 'ch vol-M' is 0x00"
5474-5572 midi: text-verbose: "Channel 2: control change 'channel volume MSB (formerly main volume)' (param = 0x7e)" "ch 2: ctrl chg 'channel volume MSB' (param = 0x7e)" "2: CC 'ch vol-M' is 0x7e"
5582-5679 midi: text-verbose: "Channel 2: control change 'pan MSB' (param = 0x54)" "ch 2: ctrl chg 'pan MSB' (param = 0x54)" "2: CC 'pan-M' is 0x54"
5691-5788 midi: text-verbose: "Channel 2: control change 'Registered Parameter Number MSB' (param = 0x00)" "ch 2: ctrl chg 'RPN MSB' (param = 0x00)" "2: CC 'RPN-M' is 0x00"
5798-5896 midi: text-verbose: "Channel 2: control change 'Registered Parameter Number LSB' (param = 0x00)" "ch 2: ctrl chg 'RPN LSB' (param = 0x00)" "2: CC 'RPN-L' is 0x00"
5907-6004 midi: text-verbose: "Channel 2: control change 'data entry MSB' (param = 0x01)" "ch 2: ctrl chg 'data entry MSB' (param = 0x01)" "2: CC 'data-M' is 0x01"
6015-6076 midi: text-verbose: "Channel 3: channel pressure / aftertouch 0" "ch 3: channel pressure 0" "3: CP 0"
6086-6184 midi: text-verbose: "Channel 3: pitch bend change 0x00 0x40 (8192)" "ch 3: pitch bend 0x00 0x40 (8192)" "3: PB (8192)"
6194-6292 midi: text-verbose: "Channel 3: control change 'Registered Parameter Number LSB' (param = 0x00)" "ch 3: ctrl chg 'RPN LSB' (param = 0x00)" "3: CC 'RPN-L' is 0x00"
6303-6399 midi: text-verbose: "Channel 3: control change 'Registered Parameter Number MSB' (param = 0x00)" "ch 3: ctrl chg 'RPN MSB' (param = 0x00)" "3: CC 'RPN-M' is 0x00"
6411-6507 midi: text-verbose: "Channel 3: control change 'data entry MSB' (param = 0x02)" "ch 3: ctrl chg 'data entry MSB' (param = 0x02)" "3: CC 'data-M' is 0x02"
6518-6615 midi: text-verbose: "Channel 3: control change 'bank select LSB' (param = 0x00)" "ch 3: ctrl chg 'bank LSB' (param = 0x00)" "3: CC 'bank-L' is 0x00"
6626-6723 midi: text-verbose: "Channel 3: pitch bend change 0x00 0x40 (8192)" "ch 3: pitch bend 0x00 0x40 (8192)" "3: PB (8192)"
6734-6831 midi: text-verbose: "Channel 3: control change 'effects 3 depth (formerly chorus depth)' (param = 0x00)" "ch 3: ctrl chg 'effects 3 depth' (param = 0x00)" "3: CC 'eff 3 depth' is 0x00"
6842-6939 midi: text-verbose: "Channel 3: control change 'effects 1 depth (formerly external effects depth)' (param = 0x28)" "ch 3: ctrl chg 'effects 1 depth' (param = 0x28)" "3: CC 'eff 1 depth' is 0x28"
6950-7047 midi: text-verbose: "Channel 3: control change 'damper pedal (sustain)' (param = 0x00)" "ch 3: ctrl chg 'sustain' (param = 0x00)" "3: CC 'sust' is 0x00"
7058-7156 midi: text-verbose: "Channel 3: control change 'expression controller MSB' (param = 0x7f)" "ch 3: ctrl chg 'expression MSB' (param = 0x7f)" "3: CC 'expr-M' is 0x7f"
7167-7264 midi: text-verbose: "Channel 3: control change 'pan MSB' (param = 0x40)" "ch 3: ctrl chg 'pan MSB' (param = 0x40)" "3: CC 'pan-M' is 0x40"
7275-7372 midi: text-verbose: "Channel 3: control change 'channel volume MSB (formerly main volume)' (param = 0x7e)" "ch 3: ctrl chg 'channel volume MSB' (param = 0x7e)" "3: CC 'ch vol-M' is 0x7e"
7382-7480 midi: text-verbose: "Channel 3: control change 'modulation wheel/lever MSB' (param = 0x00)" "ch 3: ctrl chg 'modulation MSB' (param = 0x00)" "3: CC 'mod-M' is 0x00"
7491-7588 midi: text-verbose: "Channel 3: control change 'bank select MSB' (param = 0x01)" "ch 3: ctrl chg 'bank MSB' (param = 0x01)" "3: CC 'bank-M' is 0x01"
7600-7660 midi: text-verbose: "Channel 3: program change to instrument 30 (assuming Overdriven Guitar)" "ch 3: prgm chg to instrument 30" "3: PC 30"
7671-7768 midi: text-verbose: "Channel 3: note off (note = 0 'C-2', velocity = 0)" "ch 3: note off 0, velocity = 0" "3: N off 0, vel 0"
7779-7876 midi: text-verbose: "Channel 3: note off (note = 0 'C-2', velocity = 0)" "ch 3: note off 0, velocity = 0" "3: N off 0, vel 0"
7887-7983 midi: text-verbose: "Channel 3: control change 'breath controller MSB' (param = 0x00)" "ch 3: ctrl chg 'breath MSB' (param = 0x00)" "3: CC 'breath-M' is 0x00"
7995-8092 midi: text-verbose: "Channel 3: control change 'Non-Registered Parameter Number MSB' (param = 0x78)" "ch 3: ctrl chg 'NRPN MSB' (param = 0x78)" "3: CC 'NRPN-M' is 0x78"
8102-8201 midi: text-verbose: "Channel 3: control change 'Non-Registered Parameter Number LSB' (param = 0x22)" "ch 3: ctrl chg 'NRPN LSB' (param = 0x22)" "3: CC 'NRPN-L' is 0x22"
8211-8308 midi: text-verbose: "Channel 3: control change 'data entry LSB' (param = 0x0e)" "ch 3: ctrl chg 'data entry LSB' (param = 0x0e)" "3: CC 'data-L' is 0x0e"
8319-8416 midi: text-verbose: "Channel 3: control change 'channel volume MSB (formerly main volume)' (param = 0x00)" "ch 3: ctrl chg 'channel volume MSB' (param = 0x00)" "3: CC 'ch vol-M' is 0x00"
8428-8488 midi: text-verbose: "Channel 10: channel pressure / aftertouch 0" "ch 10: channel pressure 0" "10: CP 0"
8499-8596 midi: text-verbose: "Channel 10: pitch bend change 0x00 0x40 (8192)" "ch 10: pitch bend 0x00 0x40 (8192)" "10: PB (8192)"
8607-8705 midi: text-verbose: "Channel 10: control change 'Registered Parameter Number LSB' (param = 0x00)" "ch 10: ctrl chg 'RPN LSB' (param = 0x00)" "10: CC 'RPN-L' is 0x00"
8716-8813 midi: text-verbose: "Channel 10: control change 'Registered Parameter Number MSB' (param = 0x00)" "ch 10: ctrl chg 'RPN MSB' (param = 0x00)" "10: CC 'RPN-M' is 0x00"
8824-8921 midi: text-verbose: "Channel 10: control change 'data entry MSB' (param = 0x02)" "ch 10: ctrl chg 'data entry MSB' (param = 0x02)" "10: CC 'data-M' is 0x02"
8931-9029 midi: text-verbose: "Channel 10: control change 'bank select LSB' (param = 0x00)" "ch 10: ctrl chg 'bank LSB' (param = 0x00)" "10: CC 'bank-L' is 0x00"
9039-9137 midi: text-verbose: "Channel 10: pitch bend change 0x00 0x40 (8192)" "ch 10: pitch bend 0x00 0x40 (8192)" "10: PB (8192)"
9148-9244 midi: text-verbose: "Channel 10: pitch bend change 0x00 0x40 (8192)" "ch 10: pitch bend 0x00 0x40 (8192)" "10: PB (8192)"
9256-9353 midi: text-verbose: "Channel 10: control change 'effects 3 depth (formerly chorus depth)' (param = 0x00)" "ch 10: ctrl chg 'effects 3 depth' (param = 0x00)" "10: CC 'eff 3 depth' is 0x00"
9364-9462 midi: text-verbose: "Channel 10: control change 'effects 1 depth (formerly external effects depth)' (param = 0x28)" "ch 10: ctrl chg 'effects 1 depth' (param = 0x28)" "10: CC 'eff 1 depth' is 0x28"
9472-9570 midi: text-verbose: "Channel 10: control change 'damper pedal (sustain)' (param = 0x00)" "ch 10: ctrl chg 'sustain' (param = 0x00)" "10: CC 'sust' is 0x00"
9580-9677 midi: text-verbose: "Channel 10: control change 'expression controller MSB' (param = 0x7f)" "ch 10: ctrl chg 'expression MSB' (param = 0x7f)" "10: CC 'expr-M' is 0x7f"
9689-9786 midi: text-verbose: "Channel 10: control change 'pan MSB' (param = 0x40)" "ch 10: ctrl chg 'pan MSB' (param = 0x40)" "10: CC 'pan-M' is 0x40"
9797-9894 midi: text-verbose: "Channel 10: control change 'modulation wheel/lever MSB' (param = 0x00)" "ch 10: ctrl chg 'modulation MSB' (param = 0x00)" "10: CC 'mod-M' is 0x00"
9905-10002 midi: text-verbose: "Channel 10: control change 'bank select MSB' (param = 0x01)" "ch 10: ctrl chg 'bank MSB' (param = 0x01)" "10: CC 'bank-M' is 0x01"
10013-10074 midi: text-verbose: "Channel 10: program change to drum kit 17 (assuming GS Power Kit)" "ch 10: prgm chg to drum kit 17" "10: PC 17"
10084-10182 midi: text-verbose: "Channel 10: control change 'breath controller MSB' (param = 0x00)" "ch 10: ctrl chg 'breath MSB' (param = 0x00)" "10: CC 'breath-M' is 0x00"
10193-10290 midi: text-verbose: "Channel 10: control change 'Non-Registered Parameter Number MSB' (param = 0x78)" "ch 10: ctrl chg 'NRPN MSB' (param = 0x78)" "10: CC 'NRPN-M' is 0x78"
10301-10399 midi: text-verbose: "Channel 10: control change 'Non-Registered Parameter Number LSB' (param = 0x22)" "ch 10: ctrl chg 'NRPN LSB' (param = 0x22)" "10: CC 'NRPN-L' is 0x22"
10410-10506 midi: text-verbose: "Channel 10: control change 'data entry LSB' (param = 0x0e)" "ch 10: ctrl chg 'data entry LSB' (param = 0x0e)" "10: CC 'data-L' is 0x0e"
10516-10614 midi: text-verbose: "Channel 10: pitch bend change 0x00 0x40 (8192)" "ch 10: pitch bend 0x00 0x40 (8192)" "10: PB (8192)"
10624-10722 midi: text-verbose: "Channel 10: control change 'channel volume MSB (formerly main volume)' (param = 0x00)" "ch 10: ctrl chg 'channel volume MSB' (param = 0x00)" "10: CC 'ch vol-M' is 0x00"
10733-10829 midi: text-verbose: "Channel 10: pitch bend change 0x00 0x40 (8192)" "ch 10: pitch bend 0x00 0x40 (8192)" "10: PB (8192)"
10841-10938 midi: text-verbose: "Channel 10: control change 'channel volume MSB (formerly main volume)' (param = 0x6c)" "ch 10: ctrl chg 'channel volume MSB' (param = 0x6c)" "10: CC 'ch vol-M' is 0x6c"
10949-11047 midi: text-verbose: "Channel 10: control change 'breath controller MSB' (param = 0x00)" "ch 10: ctrl chg 'breath MSB' (param = 0x00)" "10: CC 'breath-M' is 0x00"
11057-11155 midi: text-verbose: "Channel 10: control change 'Non-Registered Parameter Number MSB' (param = 0x78)" "ch 10: ctrl chg 'NRPN MSB' (param = 0x78)" "10: CC 'NRPN-M' is 0x78"
11166-11262 midi: text-verbose: "Channel 10: control change 'Non-Registered Parameter Number LSB' (param = 0x22)" "ch 10: ctrl chg 'NRPN LSB' (param = 0x22)" "10: CC 'NRPN-L' is 0x22"
11274-11371 midi: text-verbose: "Channel 10: control change 'data entry LSB' (param = 0x0e)" "ch 10: ctrl chg 'data entry LSB' (param = 0x0e)" "10: CC 'data-L' is 0x0e"
11381-11480 midi: text-verbose: "Channel 10: pitch bend change 0x00 0x40 (8192)" "ch 10: pitch bend 0x00 0x40 (8192)" "10: PB (8192)"
11490-11588 midi: text-verbose: "Channel 10: control change 'channel volume MSB (formerly main volume)' (param = 0x00)" "ch 10: ctrl chg 'channel volume MSB' (param = 0x00)" "10: CC 'ch vol-M' is 0x00"
11598-11696 midi: text-verbose: "Channel 10: pitch bend change 0x00 0x40 (8192)" "ch 10: pitch bend 0x00 0x40 (8192)" "10: PB (8192)"
11706-11803 midi: text-verbose: "Channel 10: control change 'channel volume MSB (formerly main volume)' (param = 0x6c)" "ch 10: ctrl chg 'channel volume MSB' (param = 0x6c)" "10: CC 'ch vol-M' is 0x6c"
11815-11912 midi: text-verbose: "Channel 10: control change 'breath controller MSB' (param = 0x00)" "ch 10: ctrl chg 'breath MSB' (param = 0x00)" "10: CC 'breath-M' is 0x00"
11922-12020 midi: text-verbose: "Channel 10: control change 'Non-Registered Parameter Number MSB' (param = 0x78)" "ch 10: ctrl chg 'NRPN MSB' (param = 0x78)" "10: CC 'NRPN-M' is 0x78"
12031-12129 midi: text-verbose: "Channel 10: control change 'Non-Registered Parameter Number LSB' (param = 0x22)" "ch 10: ctrl chg 'NRPN LSB' (param = 0x22)" "10: CC 'NRPN-L' is 0x22"
12139-12236 midi: text-verbose: "Channel 10: control change 'data entry LSB' (param = 0x0e)" "ch 10: ctrl chg 'data entry LSB' (param = 0x0e)" "10: CC 'data-L' is 0x0e"
12248-12345 midi: text-verbose: "Channel 10: pitch bend change 0x00 0x40 (8192)" "ch 10: pitch bend 0x00 0x40 (8192)" "10: PB (8192)"
12355-12453 midi: text-verbose: "Channel 10: control change 'channel volume MSB (formerly main volume)' (param = 0x00)" "ch 10: ctrl chg 'channel volume MSB' (param = 0x00)" "10: CC 'ch vol-M' is 0x00"
12463-12562 midi: text-verbose: "Channel 10: pitch bend change 0x00 0x40 (8192)" "ch 10: pitch bend 0x00 0x40 (8192)" "10: PB (8192)"
12572-12669 midi: text-verbose: "Channel 10: control change 'channel volume MSB (formerly main volume)' (param = 0x6c)" "ch 10: ctrl chg 'channel volume MSB' (param = 0x6c)" "10: CC 'ch vol-M' is 0x6c"
12680-12777 midi: text-verbose: "Channel 1: note on (note = 57 'A2', velocity = 101)" "ch 1: note on 57, velocity = 101" "1: N on 57, vel 101"
12788-12885 midi: text-verbose: "Channel 2: control change 'bank select MSB' (param = 0x01)" "ch 2: ctrl chg 'bank MSB' (param = 0x01)" "2: CC 'bank-M' is 0x01"
12896-12957 midi: text-verbose: "Channel 2: program change to instrument 34 (assuming Electric Bass (finger))" "ch 2: prgm chg to instrument 34" "2: PC 34"
12968-13066 midi: text-verbose: "Channel 2: note on (note = 33 'A0', velocity = 127)" "ch 2: note on 33, velocity = 127" "2: N on 33, vel 127"
13076-13175 midi: text-verbose: "Channel 10: note on (note = 36 'assuming Bass Drum 1', velocity = 127)" "ch 10: note on 36, velocity = 127" "10: N on 36, vel 127"
13187-13286 midi: text-verbose: "Channel 10: note on (note = 49 'assuming Crash Cymbal 1', velocity = 84)" "ch 10: note on 49, velocity = 84" "10: N on 49, vel 84"
