77758-78014 midi: text-verbose: "System Realtime: active sensing" "SysReal: active sensing" "SR: sensing"
233013-233269 midi: text-verbose: "System Realtime: active sensing" "SysReal: active sensing" "SR: sensing"
388366-388622 midi: text-verbose: "System Realtime: active sensing" "SysReal: active sensing" "SR: sensing"
542535-542791 midi: text-verbose: "System Realtime: active sensing" "SysReal: active sensing" "SR: sensing"
697817-698073 midi: text-verbose: "System Realtime: active sensing" "SysReal: active sensing" "SR: sensing"
853173-853429 midi: text-verbose: "System Realtime: active sensing" "SysReal: active sensing" "SR: sensing"
1008430-1008686 midi: text-verbose: "System Realtime: active sensing" "SysReal: active sensing" "SR: sensing"
1163787-1164043 midi: text-verbose: "System Realtime: active sensing" "SysReal: active sensing" "SR: sensing"
1321072-1321328 midi: text-verbose: "System Realtime: active sensing" "SysReal: active sensing" "SR: sensing"
1476427-1476683 midi: text-verbose: "System Realtime: active sensing" "SysReal: active sensing" "SR: sensing"
1630564-1630820 midi: text-verbose: "System Realtime: active sensing" "SysReal: active sensing" "SR: sensing"
1785848-1786104 midi: text-verbose: "System Realtime: active sensing" "SysReal: active sensing" "SR: sensing"
1941204-1941460 midi: text-verbose: "System Realtime: active sensing" "SysReal: active sensing" "SR: sensing"
2098487-2098743 midi: text-verbose: "System Realtime: active sensing" "SysReal: active sensing" "SR: sensing"
2253843-2254099 midi: text-verbose: "System Realtime: active sensing" "SysReal: active sensing" "SR: sensing"
2407981-2408237 midi: text-verbose: "System Realtime: active sensing" "SysReal: active sensing" "SR: sensing"
2564457-2564713 midi: text-verbose: "System Realtime: active sensing" "SysReal: active sensing" "SR: sensing"
2718624-2718880 midi: text-verbose: "System Realtime: active sensing" "SysReal: active sensing" "SR: sensing"
2873908-2874164 midi: text-verbose: "System Realtime: active sensing" "SysReal: active sensing" "SR: sensing"
3031263-3031519 midi: text-verbose: "System Realtime: active sensing" "SysReal: active sensing" "SR: sensing"
3185402-3185658 midi: text-verbose: "System Realtime: active sensing" "SysReal: active sensing" "SR: sensing"
3341603-3341859 midi: text-verbose: "System Realtime: active sensing" "SysReal: active sensing" "SR: sensing"
3495768-3496024 midi: text-verbose: "System Realtime: active sensing" "SysReal: active sensing" "SR: sensing"
3651052-3651308 midi: text-verbose: "System Realtime: active sensing" "SysReal: active sensing" "SR: sensing"
3806384-3806640 midi: text-verbose: "System Realtime: active sensing" "SysReal: active sensing" "SR: sensing"
3963666-3963922 midi: text-verbose: "System Realtime: active sensing" "SysReal: active sensing" "SR: sensing"
4119021-4119277 midi: text-verbose: "System Realtime: active sensing" "SysReal: active sensing" "SR: sensing"
4273188-4273444 midi: text-verbose: "System Realtime: active sensing" "SysReal: active sensing" "SR: sensing"
4428470-4428726 midi: text-verbose: "System Realtime: active sensing" "SysReal: active sensing" "SR: sensing"
4583796-4584052 midi: text-verbose: "System Realtime: active sensing" "SysReal: active sensing" "SR: sensing"
4739079-4739335 midi: text-verbose: "System Realtime: active sensing" "SysReal: active sensing" "SR: sensing"
4894435-4894691 midi: text-verbose: "System Realtime: active sensing" "SysReal: active sensing" "SR: sensing"
