144169-144425 midi: text-verbose: "System Realtime: active sensing" "SysReal: active sensing" "SR: sensing"
184008-184908 midi: text-verbose: "Channel 1: note on (note = 60 'C3', velocity = 100)" "ch 1: note on 60, velocity = 100" "1: N on 60, vel 100"
190071-190971 midi: text-verbose: "Channel 1: note on (note = 62 'D3', velocity = 108)" "ch 1: note on 62, velocity = 108" "1: N on 62, vel 108"
194207-195108 midi: text-verbose: "Channel 1: note on (note = 64 'E3', velocity = 112)" "ch 1: note on 64, velocity = 112" "1: N on 64, vel 112"
209579-210479 midi: text-verbose: "Channel 1: note on (note = 67 'G3', velocity = 100)" "ch 1: note on 67, velocity = 100" "1: N on 67, vel 100"
292489-293389 midi: text-verbose: "Channel 1: note on (note = 50 'D2', velocity = 124)" "ch 1: note on 50, velocity = 124" "1: N on 50, vel 124"
296632-297532 midi: text-verbose: "Channel 1: note on (note = 52 'E2', velocity = 116)" "ch 1: note on 52, velocity = 116" "1: N on 52, vel 116"
299561-300461 midi: text-verbose: "Channel 1: note on (note = 55 'G2', velocity = 120)" "ch 1: note on 55, velocity = 120" "1: N on 55, vel 120"
302500-303400 midi: text-verbose: "Channel 1: note on (note = 53 'F2', velocity = 120)" "ch 1: note on 53, velocity = 120" "1: N on 53, vel 120"
308497-308753 midi: text-verbose: "System Realtime: active sensing" "SysReal: active sensing" "SR: sensing"
359940-360840 midi: text-verbose: "Channel 1: note off (note = 62 'D3', velocity = 114)" "ch 1: note off 62, velocity = 114" "1: N off 62, vel 114"
367224-368125 midi: text-verbose: "Channel 1: note off (note = 64 'E3', velocity = 117)" "ch 1: note off 64, velocity = 117" "1: N off 64, vel 117"
370174-371075 midi: text-verbose: "Channel 1: note off (note = 67 'G3', velocity = 108)" "ch 1: note off 67, velocity = 108" "1: N off 67, vel 108"
379133-380033 midi: text-verbose: "Channel 1: note off (note = 60 'C3', velocity = 114)" "ch 1: note off 60, velocity = 114" "1: N off 60, vel 114"
392405-393305 midi: text-verbose: "Channel 1: note off (note = 53 'F2', velocity = 117)" "ch 1: note off 53, velocity = 117" "1: N off 53, vel 117"
406460-407360 midi: text-verbose: "Channel 1: note off (note = 50 'D2', velocity = 117)" "ch 1: note off 50, velocity = 117" "1: N off 50, vel 117"
410609-411510 midi: text-verbose: "Channel 1: note off (note = 52 'E2', velocity = 120)" "ch 1: note off 52, velocity = 120" "1: N off 52, vel 120"
438792-439692 midi: text-verbose: "Channel 1: note off (note = 55 'G2', velocity = 115)" "ch 1: note off 55, velocity = 115" "1: N off 55, vel 115"
472990-473246 midi: text-verbose: "System Realtime: active sensing" "SysReal: active sensing" "SR: sensing"
494990-495890 midi: text-verbose: "Channel 1: note on (note = 68 'G#3', velocity = 112)" "ch 1: note on 68, velocity = 112" "1: N on 68, vel 112"
508571-509470 midi: text-verbose: "Channel 1: note on (note = 61 'C#3', velocity = 110)" "ch 1: note on 61, velocity = 110" "1: N on 61, vel 110"
517712-518611 midi: text-verbose: "Channel 1: note on (note = 63 'D#3', velocity = 118)" "ch 1: note on 63, velocity = 118" "1: N on 63, vel 118"
521846-522747 midi: text-verbose: "Channel 1: note on (note = 65 'F3', velocity = 118)" "ch 1: note on 65, velocity = 118" "1: N on 65, vel 118"
525908-526808 midi: text-verbose: "Channel 1: note on (note = 53 'F2', velocity = 112)" "ch 1: note on 53, velocity = 112" "1: N on 53, vel 112"
530075-530975 midi: text-verbose: "Channel 1: note on (note = 56 'G#2', velocity = 122)" "ch 1: note on 56, velocity = 122" "1: N on 56, vel 122"
534140-535040 midi: text-verbose: "Channel 1: note on (note = 60 'C3', velocity = 100)" "ch 1: note on 60, velocity = 100" "1: N on 60, vel 100"
541343-542244 midi: text-verbose: "Channel 1: note on (note = 50 'D2', velocity = 118)" "ch 1: note on 50, velocity = 118" "1: N on 50, vel 118"
545478-546379 midi: text-verbose: "Channel 1: note on (note = 52 'E2', velocity = 112)" "ch 1: note on 52, velocity = 112" "1: N on 52, vel 112"
549534-550434 midi: text-verbose: "Channel 1: note on (note = 62 'D3', velocity = 100)" "ch 1: note on 62, velocity = 100" "1: N on 62, vel 100"
601768-602669 midi: text-verbose: "Channel 1: note off (note = 52 'E2', velocity = 82)" "ch 1: note off 52, velocity = 82" "1: N off 52, vel 82"
622497-623397 midi: text-verbose: "Channel 1: note on (note = 57 'A2', velocity = 62)" "ch 1: note on 57, velocity = 62" "1: N on 57, vel 62"
639242-639498 midi: text-verbose: "System Realtime: active sensing" "SysReal: active sensing" "SR: sensing"
661332-662232 midi: text-verbose: "Channel 1: note off (note = 50 'D2', velocity = 113)" "ch 1: note off 50, velocity = 113" "1: N off 50, vel 113"
671818-672718 midi: text-verbose: "Channel 1: note off (note = 57 'A2', velocity = 101)" "ch 1: note off 57, velocity = 101" "1: N off 57, vel 101"
677908-678808 midi: text-verbose: "Channel 1: note off (note = 61 'C#3', velocity = 119)" "ch 1: note off 61, velocity = 119" "1: N off 61, vel 119"
682059-682959 midi: text-verbose: "Channel 1: note off (note = 60 'C3', velocity = 121)" "ch 1: note off 60, velocity = 121" "1: N off 60, vel 121"
686130-687029 midi: text-verbose: "Channel 1: note off (note = 62 'D3', velocity = 119)" "ch 1: note off 62, velocity = 119" "1: N off 62, vel 119"
693311-694211 midi: text-verbose: "Channel 1: note off (note = 56 'G#2', velocity = 116)" "ch 1: note off 56, velocity = 116" "1: N off 56, vel 116"
697448-698348 midi: text-verbose: "Channel 1: note off (note = 65 'F3', velocity = 119)" "ch 1: note off 65, velocity = 119" "1: N off 65, vel 119"
700402-701303 midi: text-verbose: "Channel 1: note off (note = 68 'G#3', velocity = 111)" "ch 1: note off 68, velocity = 111" "1: N off 68, vel 111"
716790-717690 midi: text-verbose: "Channel 1: note off (note = 63 'D#3', velocity = 121)" "ch 1: note off 63, velocity = 121" "1: N off 63, vel 121"
722921-723821 midi: text-verbose: "Channel 1: note off (note = 53 'F2', velocity = 121)" "ch 1: note off 53, velocity = 121" "1: N off 53, vel 121"
805540-806440 midi: text-verbose: "Channel 1: note on (note = 56 'G#2', velocity = 110)" "ch 1: note on 56, velocity = 110" "1: N on 56, vel 110"
806515-806771 midi: text-verbose: "System Realtime: active sensing" "SysReal: active sensing" "SR: sensing"
809990-810890 midi: text-verbose: "Channel 1: note on (note = 63 'D#3', velocity = 118)" "ch 1: note on 63, velocity = 118" "1: N on 63, vel 118"
814022-814923 midi: text-verbose: "Channel 1: note on (note = 65 'F3', velocity = 127)" "ch 1: note on 65, velocity = 127" "1: N on 65, vel 127"
821307-822206 midi: text-verbose: "Channel 1: note on (note = 62 'D3', velocity = 112)" "ch 1: note on 62, velocity = 112" "1: N on 62, vel 112"
825463-826363 midi: text-verbose: "Channel 1: note on (note = 55 'G2', velocity = 110)" "ch 1: note on 55, velocity = 110" "1: N on 55, vel 110"
837711-838611 midi: text-verbose: "Channel 1: note on (note = 53 'F2', velocity = 118)" "ch 1: note on 53, velocity = 118" "1: N on 53, vel 118"
841870-842771 midi: text-verbose: "Channel 1: note on (note = 64 'E3', velocity = 106)" "ch 1: note on 64, velocity = 106" "1: N on 64, vel 106"
845963-846864 midi: text-verbose: "Channel 1: note on (note = 68 'G#3', velocity = 78)" "ch 1: note on 68, velocity = 78" "1: N on 68, vel 78"
850117-851017 midi: text-verbose: "Channel 1: note on (note = 71 'B3', velocity = 82)" "ch 1: note on 71, velocity = 82" "1: N on 71, vel 82"
853081-853981 midi: text-verbose: "Channel 1: note on (note = 57 'A2', velocity = 116)" "ch 1: note on 57, velocity = 116" "1: N on 57, vel 116"
861031-861932 midi: text-verbose: "Channel 1: note on (note = 50 'D2', velocity = 62)" "ch 1: note on 50, velocity = 62" "1: N on 50, vel 62"
865175-866075 midi: text-verbose: "Channel 1: note on (note = 67 'G3', velocity = 72)" "ch 1: note on 67, velocity = 72" "1: N on 67, vel 72"
887152-888052 midi: text-verbose: "Channel 1: note off (note = 50 'D2', velocity = 115)" "ch 1: note off 50, velocity = 115" "1: N off 50, vel 115"
893241-894140 midi: text-verbose: "Channel 1: note off (note = 63 'D#3', velocity = 120)" "ch 1: note off 63, velocity = 120" "1: N off 63, vel 120"
925544-926445 midi: text-verbose: "Channel 1: note off (note = 68 'G#3', velocity = 105)" "ch 1: note off 68, velocity = 105" "1: N off 68, vel 105"
934684-935585 midi: text-verbose: "Channel 1: note off (note = 67 'G3', velocity = 110)" "ch 1: note off 67, velocity = 110" "1: N off 67, vel 110"
953535-954435 midi: text-verbose: "Channel 1: note off (note = 71 'B3', velocity = 48)" "ch 1: note off 71, velocity = 48" "1: N off 71, vel 48"
965901-966802 midi: text-verbose: "Channel 1: note off (note = 57 'A2', velocity = 121)" "ch 1: note off 57, velocity = 121" "1: N off 57, vel 121"
970074-970974 midi: text-verbose: "Channel 1: note off (note = 56 'G#2', velocity = 123)" "ch 1: note off 56, velocity = 123" "1: N off 56, vel 123"
977336-978236 midi: text-verbose: "Channel 1: note off (note = 53 'F2', velocity = 96)" "ch 1: note off 53, velocity = 96" "1: N off 53, vel 96"
981333-981589 midi: text-verbose: "System Realtime: active sensing" "SysReal: active sensing" "SR: sensing"
989823-990723 midi: text-verbose: "Channel 1: note off (note = 64 'E3', velocity = 113)" "ch 1: note off 64, velocity = 113" "1: N off 64, vel 113"
993964-994864 midi: text-verbose: "Channel 1: note off (note = 62 'D3', velocity = 113)" "ch 1: note off 62, velocity = 113" "1: N off 62, vel 113"
998029-998930 midi: text-verbose: "Channel 1: note off (note = 65 'F3', velocity = 122)" "ch 1: note off 65, velocity = 122" "1: N off 65, vel 122"
1005277-1006177 midi: text-verbose: "Channel 1: note off (note = 55 'G2', velocity = 118)" "ch 1: note off 55, velocity = 118" "1: N off 55, vel 118"
1075852-1076752 midi: text-verbose: "Channel 1: note on (note = 55 'G2', velocity = 114)" "ch 1: note on 55, velocity = 114" "1: N on 55, vel 114"
1085716-1086616 midi: text-verbose: "Channel 1: note on (note = 53 'F2', velocity = 124)" "ch 1: note on 53, velocity = 124" "1: N on 53, vel 124"
1089864-1090764 midi: text-verbose: "Channel 1: note on (note = 50 'D2', velocity = 122)" "ch 1: note on 50, velocity = 122" "1: N on 50, vel 122"
1093951-1094851 midi: text-verbose: "Channel 1: note on (note = 56 'G#2', velocity = 124)" "ch 1: note on 56, velocity = 124" "1: N on 56, vel 124"
1098096-1098996 midi: text-verbose: "Channel 1: note on (note = 63 'D#3', velocity = 122)" "ch 1: note on 63, velocity = 122" "1: N on 63, vel 122"
1102168-1103068 midi: text-verbose: "Channel 1: note on (note = 65 'F3', velocity = 124)" "ch 1: note on 65, velocity = 124" "1: N on 65, vel 124"
1109379-1110279 midi: text-verbose: "Channel 1: note on (note = 57 'A2', velocity = 102)" "ch 1: note on 57, velocity = 102" "1: N on 57, vel 102"
1113519-1114419 midi: text-verbose: "Channel 1: note on (note = 68 'G#3', velocity = 118)" "ch 1: note on 68, velocity = 118" "1: N on 68, vel 118"
1120812-1121712 midi: text-verbose: "Channel 1: note on (note = 62 'D3', velocity = 94)" "ch 1: note on 62, velocity = 94" "1: N on 62, vel 94"
1123752-1124653 midi: text-verbose: "Channel 1: note on (note = 64 'E3', velocity = 92)" "ch 1: note on 64, velocity = 92" "1: N on 64, vel 92"
1147425-1148325 midi: text-verbose: "Channel 1: note on (note = 71 'B3', velocity = 80)" "ch 1: note on 71, velocity = 80" "1: N on 71, vel 80"
1152275-1152531 midi: text-verbose: "System Realtime: active sensing" "SysReal: active sensing" "SR: sensing"
1157637-1158537 midi: text-verbose: "Channel 1: note on (note = 67 'G3', velocity = 62)" "ch 1: note on 67, velocity = 62" "1: N on 67, vel 62"
1224521-1225421 midi: text-verbose: "Channel 1: note off (note = 50 'D2', velocity = 107)" "ch 1: note off 50, velocity = 107" "1: N off 50, vel 107"
1231817-1232718 midi: text-verbose: "Channel 1: note off (note = 64 'E3', velocity = 111)" "ch 1: note off 64, velocity = 111" "1: N off 64, vel 111"
1234774-1235674 midi: text-verbose: "Channel 1: note off (note = 63 'D#3', velocity = 113)" "ch 1: note off 63, velocity = 113" "1: N off 63, vel 113"
1237734-1238634 midi: text-verbose: "Channel 1: note off (note = 68 'G#3', velocity = 18)" "ch 1: note off 68, velocity = 18" "1: N off 68, vel 18"
1245654-1246555 midi: text-verbose: "Channel 1: note off (note = 67 'G3', velocity = 105)" "ch 1: note off 67, velocity = 105" "1: N off 67, vel 105"
1249807-1250707 midi: text-verbose: "Channel 1: note off (note = 56 'G#2', velocity = 121)" "ch 1: note off 56, velocity = 121" "1: N off 56, vel 121"
1253878-1254778 midi: text-verbose: "Channel 1: note off (note = 53 'F2', velocity = 118)" "ch 1: note off 53, velocity = 118" "1: N off 53, vel 118"
1258020-1258920 midi: text-verbose: "Channel 1: note off (note = 57 'A2', velocity = 123)" "ch 1: note off 57, velocity = 123" "1: N off 57, vel 123"
1262079-1262979 midi: text-verbose: "Channel 1: note off (note = 62 'D3', velocity = 123)" "ch 1: note off 62, velocity = 123" "1: N off 62, vel 123"
1269267-1270168 midi: text-verbose: "Channel 1: note off (note = 65 'F3', velocity = 118)" "ch 1: note off 65, velocity = 118" "1: N off 65, vel 118"
1273413-1274313 midi: text-verbose: "Channel 1: note off (note = 71 'B3', velocity = 111)" "ch 1: note off 71, velocity = 111" "1: N off 71, vel 111"
1280664-1281563 midi: text-verbose: "Channel 1: note off (note = 55 'G2', velocity = 113)" "ch 1: note off 55, velocity = 113" "1: N off 55, vel 113"
1321196-1321452 midi: text-verbose: "System Realtime: active sensing" "SysReal: active sensing" "SR: sensing"
1346378-1347278 midi: text-verbose: "Channel 1: note on (note = 53 'F2', velocity = 108)" "ch 1: note on 53, velocity = 108" "1: N on 53, vel 108"
1355629-1356529 midi: text-verbose: "Channel 1: note on (note = 56 'G#2', velocity = 126)" "ch 1: note on 56, velocity = 126" "1: N on 56, vel 126"
1365479-1366379 midi: text-verbose: "Channel 1: note on (note = 49 'C#2', velocity = 122)" "ch 1: note on 49, velocity = 122" "1: N on 49, vel 122"
1369619-1370519 midi: text-verbose: "Channel 1: note on (note = 52 'E2', velocity = 120)" "ch 1: note on 52, velocity = 120" "1: N on 52, vel 120"
1373665-1374565 midi: text-verbose: "Channel 1: note on (note = 54 'F#2', velocity = 116)" "ch 1: note on 54, velocity = 116" "1: N on 54, vel 116"
1384162-1385062 midi: text-verbose: "Channel 1: note on (note = 62 'D3', velocity = 120)" "ch 1: note on 62, velocity = 120" "1: N on 62, vel 120"
1387121-1388021 midi: text-verbose: "Channel 1: note on (note = 64 'E3', velocity = 114)" "ch 1: note on 64, velocity = 114" "1: N on 64, vel 114"
1397046-1397945 midi: text-verbose: "Channel 1: note on (note = 59 'B2', velocity = 124)" "ch 1: note on 59, velocity = 124" "1: N on 59, vel 124"
1401245-1402145 midi: text-verbose: "Channel 1: note on (note = 60 'C3', velocity = 120)" "ch 1: note on 60, velocity = 120" "1: N on 60, vel 120"
1405284-1406184 midi: text-verbose: "Channel 1: note on (note = 65 'F3', velocity = 118)" "ch 1: note on 65, velocity = 118" "1: N on 65, vel 118"
1409484-1410384 midi: text-verbose: "Channel 1: note on (note = 67 'G3', velocity = 94)" "ch 1: note on 67, velocity = 94" "1: N on 67, vel 94"
1413518-1414418 midi: text-verbose: "Channel 1: note on (note = 69 'A3', velocity = 78)" "ch 1: note on 69, velocity = 78" "1: N on 69, vel 78"
1448979-1449880 midi: text-verbose: "Channel 1: note off (note = 54 'F#2', velocity = 69)" "ch 1: note off 54, velocity = 69" "1: N off 54, vel 69"
1458258-1459158 midi: text-verbose: "Channel 1: note off (note = 52 'E2', velocity = 69)" "ch 1: note off 52, velocity = 69" "1: N off 52, vel 69"
1490269-1490525 midi: text-verbose: "System Realtime: active sensing" "SysReal: active sensing" "SR: sensing"
1505253-1506153 midi: text-verbose: "Channel 1: note off (note = 60 'C3', velocity = 103)" "ch 1: note off 60, velocity = 103" "1: N off 60, vel 103"
1509326-1510226 midi: text-verbose: "Channel 1: note off (note = 67 'G3', velocity = 90)" "ch 1: note off 67, velocity = 90" "1: N off 67, vel 90"
1518612-1519513 midi: text-verbose: "Channel 1: note off (note = 69 'A3', velocity = 81)" "ch 1: note off 69, velocity = 81" "1: N off 69, vel 81"
1525825-1526726 midi: text-verbose: "Channel 1: note off (note = 64 'E3', velocity = 119)" "ch 1: note off 64, velocity = 119" "1: N off 64, vel 119"
1529996-1530896 midi: text-verbose: "Channel 1: note off (note = 56 'G#2', velocity = 120)" "ch 1: note off 56, velocity = 120" "1: N off 56, vel 120"
1534031-1534932 midi: text-verbose: "Channel 1: note off (note = 65 'F3', velocity = 121)" "ch 1: note off 65, velocity = 121" "1: N off 65, vel 121"
1538207-1539107 midi: text-verbose: "Channel 1: note off (note = 59 'B2', velocity = 117)" "ch 1: note off 59, velocity = 117" "1: N off 59, vel 117"
1542230-1543130 midi: text-verbose: "Channel 1: note off (note = 49 'C#2', velocity = 123)" "ch 1: note off 49, velocity = 123" "1: N off 49, vel 123"
1551351-1552251 midi: text-verbose: "Channel 1: note off (note = 62 'D3', velocity = 120)" "ch 1: note off 62, velocity = 120" "1: N off 62, vel 120"
1555507-1556407 midi: text-verbose: "Channel 1: note off (note = 53 'F2', velocity = 115)" "ch 1: note off 53, velocity = 115" "1: N off 53, vel 115"
1656443-1657344 midi: text-verbose: "Channel 1: note on (note = 52 'E2', velocity = 112)" "ch 1: note on 52, velocity = 112" "1: N on 52, vel 112"
1657419-1657675 midi: text-verbose: "System Realtime: active sensing" "SysReal: active sensing" "SR: sensing"
1659708-1660608 midi: text-verbose: "Channel 1: note on (note = 51 'D#2', velocity = 126)" "ch 1: note on 51, velocity = 126" "1: N on 51, vel 126"
1662653-1663553 midi: text-verbose: "Channel 1: note on (note = 53 'F2', velocity = 112)" "ch 1: note on 53, velocity = 112" "1: N on 53, vel 112"
1668702-1669601 midi: text-verbose: "Channel 1: note on (note = 54 'F#2', velocity = 126)" "ch 1: note on 54, velocity = 126" "1: N on 54, vel 126"
1672877-1673776 midi: text-verbose: "Channel 1: note on (note = 55 'G2', velocity = 118)" "ch 1: note on 55, velocity = 118" "1: N on 55, vel 118"
1676957-1677857 midi: text-verbose: "Channel 1: note on (note = 62 'D3', velocity = 122)" "ch 1: note on 62, velocity = 122" "1: N on 62, vel 122"
1681106-1682005 midi: text-verbose: "Channel 1: note on (note = 63 'D#3', velocity = 126)" "ch 1: note on 63, velocity = 126" "1: N on 63, vel 126"
1685181-1686081 midi: text-verbose: "Channel 1: note on (note = 64 'E3', velocity = 118)" "ch 1: note on 64, velocity = 118" "1: N on 64, vel 118"
1694355-1695255 midi: text-verbose: "Channel 1: note on (note = 50 'D2', velocity = 120)" "ch 1: note on 50, velocity = 120" "1: N on 50, vel 120"
1698501-1699402 midi: text-verbose: "Channel 1: note on (note = 65 'F3', velocity = 104)" "ch 1: note on 65, velocity = 104" "1: N on 65, vel 104"
1702564-1703464 midi: text-verbose: "Channel 1: note on (note = 48 'C2', velocity = 84)" "ch 1: note on 48, velocity = 84" "1: N on 48, vel 84"
1706705-1707605 midi: text-verbose: "Channel 1: note on (note = 68 'G#3', velocity = 124)" "ch 1: note on 68, velocity = 124" "1: N on 68, vel 124"
1710782-1711682 midi: text-verbose: "Channel 1: note on (note = 71 'B3', velocity = 86)" "ch 1: note on 71, velocity = 86" "1: N on 71, vel 86"
1717969-1718869 midi: text-verbose: "Channel 1: note off (note = 51 'D#2', velocity = 126)" "ch 1: note off 51, velocity = 126" "1: N off 51, vel 126"
1761797-1762697 midi: text-verbose: "Channel 1: note off (note = 63 'D#3', velocity = 113)" "ch 1: note off 63, velocity = 113" "1: N off 63, vel 113"
1785716-1786617 midi: text-verbose: "Channel 1: note off (note = 48 'C2', velocity = 113)" "ch 1: note off 48, velocity = 113" "1: N off 48, vel 113"
1807637-1808537 midi: text-verbose: "Channel 1: note off (note = 54 'F#2', velocity = 123)" "ch 1: note off 54, velocity = 123" "1: N off 54, vel 123"
1810578-1811478 midi: text-verbose: "Channel 1: note off (note = 50 'D2', velocity = 121)" "ch 1: note off 50, velocity = 121" "1: N off 50, vel 121"
1822354-1823254 midi: text-verbose: "Channel 1: note off (note = 52 'E2', velocity = 115)" "ch 1: note off 52, velocity = 115" "1: N off 52, vel 115"
1826530-1827430 midi: text-verbose: "Channel 1: note off (note = 53 'F2', velocity = 113)" "ch 1: note off 53, velocity = 113" "1: N off 53, vel 113"
1830559-1831459 midi: text-verbose: "Channel 1: note off (note = 55 'G2', velocity = 121)" "ch 1: note off 55, velocity = 121" "1: N off 55, vel 121"
1831534-1831790 midi: text-verbose: "System Realtime: active sensing" "SysReal: active sensing" "SR: sensing"
1835066-1835966 midi: text-verbose: "Channel 1: note off (note = 62 'D3', velocity = 117)" "ch 1: note off 62, velocity = 117" "1: N off 62, vel 117"
1839112-1840013 midi: text-verbose: "Channel 1: note off (note = 64 'E3', velocity = 117)" "ch 1: note off 64, velocity = 117" "1: N off 64, vel 117"
1854362-1855262 midi: text-verbose: "Channel 1: note off (note = 65 'F3', velocity = 121)" "ch 1: note off 65, velocity = 121" "1: N off 65, vel 121"
1858529-1859429 midi: text-verbose: "Channel 1: note off (note = 68 'G#3', velocity = 123)" "ch 1: note off 68, velocity = 123" "1: N off 68, vel 123"
1862569-1863469 midi: text-verbose: "Channel 1: note off (note = 71 'B3', velocity = 117)" "ch 1: note off 71, velocity = 117" "1: N off 71, vel 117"
1911365-1912265 midi: text-verbose: "Channel 1: note on (note = 52 'E2', velocity = 118)" "ch 1: note on 52, velocity = 118" "1: N on 52, vel 118"
1924923-1925824 midi: text-verbose: "Channel 1: note on (note = 66 'F#3', velocity = 126)" "ch 1: note on 66, velocity = 126" "1: N on 66, vel 126"
1934076-1934976 midi: text-verbose: "Channel 1: note on (note = 56 'G#2', velocity = 126)" "ch 1: note on 56, velocity = 126" "1: N on 56, vel 126"
1938226-1939125 midi: text-verbose: "Channel 1: note on (note = 63 'D#3', velocity = 116)" "ch 1: note on 63, velocity = 116" "1: N on 63, vel 116"
1942299-1943200 midi: text-verbose: "Channel 1: note on (note = 64 'E3', velocity = 108)" "ch 1: note on 64, velocity = 108" "1: N on 64, vel 108"
1946439-1947339 midi: text-verbose: "Channel 1: note on (note = 54 'F#2', velocity = 116)" "ch 1: note on 54, velocity = 116" "1: N on 54, vel 116"
1950501-1951402 midi: text-verbose: "Channel 1: note on (note = 68 'G#3', velocity = 122)" "ch 1: note on 68, velocity = 122" "1: N on 68, vel 122"
1957684-1958585 midi: text-verbose: "Channel 1: note on (note = 48 'C2', velocity = 116)" "ch 1: note on 48, velocity = 116" "1: N on 48, vel 116"
2001621-2001877 midi: text-verbose: "System Realtime: active sensing" "SysReal: active sensing" "SR: sensing"
2008270-2009170 midi: text-verbose: "Channel 1: note on (note = 57 'A2', velocity = 74)" "ch 1: note on 57, velocity = 74" "1: N on 57, vel 74"
2011210-2012111 midi: text-verbose: "Channel 1: note on (note = 65 'F3', velocity = 118)" "ch 1: note on 65, velocity = 118" "1: N on 65, vel 118"
2014157-2015057 midi: text-verbose: "Channel 1: note off (note = 54 'F#2', velocity = 93)" "ch 1: note off 54, velocity = 93" "1: N off 54, vel 93"
2025430-2026331 midi: text-verbose: "Channel 1: note off (note = 48 'C2', velocity = 73)" "ch 1: note off 48, velocity = 73" "1: N off 48, vel 73"
2051148-2052048 midi: text-verbose: "Channel 1: note off (note = 66 'F#3', velocity = 111)" "ch 1: note off 66, velocity = 111" "1: N off 66, vel 111"
2066411-2067311 midi: text-verbose: "Channel 1: note off (note = 65 'F3', velocity = 119)" "ch 1: note off 65, velocity = 119" "1: N off 65, vel 119"
2078809-2079709 midi: text-verbose: "Channel 1: note off (note = 57 'A2', velocity = 106)" "ch 1: note off 57, velocity = 106" "1: N off 57, vel 106"
2082993-2083894 midi: text-verbose: "Channel 1: note off (note = 64 'E3', velocity = 118)" "ch 1: note off 64, velocity = 118" "1: N off 64, vel 118"
2087038-2087939 midi: text-verbose: "Channel 1: note off (note = 68 'G#3', velocity = 118)" "ch 1: note off 68, velocity = 118" "1: N off 68, vel 118"
2094214-2095114 midi: text-verbose: "Channel 1: note off (note = 52 'E2', velocity = 119)" "ch 1: note off 52, velocity = 119" "1: N off 52, vel 119"
2098380-2099280 midi: text-verbose: "Channel 1: note off (note = 56 'G#2', velocity = 126)" "ch 1: note off 56, velocity = 126" "1: N off 56, vel 126"
2102415-2103315 midi: text-verbose: "Channel 1: note off (note = 63 'D#3', velocity = 124)" "ch 1: note off 63, velocity = 124" "1: N off 63, vel 124"
2169055-2169311 midi: text-verbose: "System Realtime: active sensing" "SysReal: active sensing" "SR: sensing"
2194256-2195156 midi: text-verbose: "Channel 1: note on (note = 61 'C#3', velocity = 127)" "ch 1: note on 61, velocity = 127" "1: N on 61, vel 127"
2203506-2204406 midi: text-verbose: "Channel 1: note on (note = 59 'B2', velocity = 124)" "ch 1: note on 59, velocity = 124" "1: N on 59, vel 124"
2215407-2216307 midi: text-verbose: "Channel 1: note on (note = 53 'F2', velocity = 122)" "ch 1: note on 53, velocity = 122" "1: N on 53, vel 122"
2219572-2220472 midi: text-verbose: "Channel 1: note on (note = 55 'G2', velocity = 118)" "ch 1: note on 55, velocity = 118" "1: N on 55, vel 118"
2223650-2224550 midi: text-verbose: "Channel 1: note on (note = 56 'G#2', velocity = 124)" "ch 1: note on 56, velocity = 124" "1: N on 56, vel 124"
2227800-2228700 midi: text-verbose: "Channel 1: note on (note = 58 'A#2', velocity = 124)" "ch 1: note on 58, velocity = 124" "1: N on 58, vel 124"
2231873-2232773 midi: text-verbose: "Channel 1: note on (note = 60 'C3', velocity = 120)" "ch 1: note on 60, velocity = 120" "1: N on 60, vel 120"
2245372-2246271 midi: text-verbose: "Channel 1: note on (note = 62 'D3', velocity = 90)" "ch 1: note on 62, velocity = 90" "1: N on 62, vel 90"
2249520-2250420 midi: text-verbose: "Channel 1: note on (note = 64 'E3', velocity = 124)" "ch 1: note on 64, velocity = 124" "1: N on 64, vel 124"
2253588-2254488 midi: text-verbose: "Channel 1: note on (note = 67 'G3', velocity = 78)" "ch 1: note on 67, velocity = 78" "1: N on 67, vel 78"
2257725-2258625 midi: text-verbose: "Channel 1: note on (note = 69 'A3', velocity = 74)" "ch 1: note on 69, velocity = 74" "1: N on 69, vel 74"
2304662-2305563 midi: text-verbose: "Channel 1: note off (note = 56 'G#2', velocity = 115)" "ch 1: note off 56, velocity = 115" "1: N off 56, vel 115"
2336631-2337531 midi: text-verbose: "Channel 1: note off (note = 61 'C#3', velocity = 112)" "ch 1: note off 61, velocity = 112" "1: N off 61, vel 112"
2337605-2337861 midi: text-verbose: "System Realtime: active sensing" "SysReal: active sensing" "SR: sensing"
2346214-2347114 midi: text-verbose: "Channel 1: note off (note = 60 'C3', velocity = 115)" "ch 1: note off 60, velocity = 115" "1: N off 60, vel 115"
2350293-2351193 midi: text-verbose: "Channel 1: note off (note = 58 'A#2', velocity = 119)" "ch 1: note off 58, velocity = 119" "1: N off 58, vel 119"
2354443-2355342 midi: text-verbose: "Channel 1: note off (note = 59 'B2', velocity = 119)" "ch 1: note off 59, velocity = 119" "1: N off 59, vel 119"
2358512-2359412 midi: text-verbose: "Channel 1: note off (note = 62 'D3', velocity = 117)" "ch 1: note off 62, velocity = 117" "1: N off 62, vel 117"
2367647-2368548 midi: text-verbose: "Channel 1: note off (note = 64 'E3', velocity = 121)" "ch 1: note off 64, velocity = 121" "1: N off 64, vel 121"
2372899-2373799 midi: text-verbose: "Channel 1: note off (note = 55 'G2', velocity = 115)" "ch 1: note off 55, velocity = 115" "1: N off 55, vel 115"
2377040-2377940 midi: text-verbose: "Channel 1: note off (note = 67 'G3', velocity = 117)" "ch 1: note off 67, velocity = 117" "1: N off 67, vel 117"
2381110-2382011 midi: text-verbose: "Channel 1: note off (note = 69 'A3', velocity = 123)" "ch 1: note off 69, velocity = 123" "1: N off 69, vel 123"
2385236-2386136 midi: text-verbose: "Channel 1: note off (note = 53 'F2', velocity = 113)" "ch 1: note off 53, velocity = 113" "1: N off 53, vel 113"
2467021-2467921 midi: text-verbose: "Channel 1: note on (note = 52 'E2', velocity = 110)" "ch 1: note on 52, velocity = 110" "1: N on 52, vel 110"
2471072-2471972 midi: text-verbose: "Channel 1: note on (note = 54 'F#2', velocity = 120)" "ch 1: note on 54, velocity = 120" "1: N on 54, vel 120"
2481549-2482450 midi: text-verbose: "Channel 1: note on (note = 50 'D2', velocity = 116)" "ch 1: note on 50, velocity = 116" "1: N on 50, vel 116"
2484484-2485384 midi: text-verbose: "Channel 1: note on (note = 66 'F#3', velocity = 127)" "ch 1: note on 66, velocity = 127" "1: N on 66, vel 127"
2491445-2492346 midi: text-verbose: "Channel 1: note on (note = 64 'E3', velocity = 120)" "ch 1: note on 64, velocity = 120" "1: N on 64, vel 120"
2503310-2504210 midi: text-verbose: "Channel 1: note on (note = 65 'F3', velocity = 116)" "ch 1: note on 65, velocity = 116" "1: N on 65, vel 116"
2507457-2508358 midi: text-verbose: "Channel 1: note on (note = 69 'A3', velocity = 124)" "ch 1: note on 69, velocity = 124" "1: N on 69, vel 124"
2508432-2508688 midi: text-verbose: "System Realtime: active sensing" "SysReal: active sensing" "SR: sensing"
2511811-2512711 midi: text-verbose: "Channel 1: note on (note = 48 'C2', velocity = 90)" "ch 1: note on 48, velocity = 90" "1: N on 48, vel 90"
2517083-2517983 midi: text-verbose: "Channel 1: note on (note = 72 'C4', velocity = 122)" "ch 1: note on 72, velocity = 122" "1: N on 72, vel 122"
2521234-2522134 midi: text-verbose: "Channel 1: note on (note = 67 'G3', velocity = 120)" "ch 1: note on 67, velocity = 120" "1: N on 67, vel 120"
2636846-2637746 midi: text-verbose: "Channel 1: note off (note = 50 'D2', velocity = 118)" "ch 1: note off 50, velocity = 118" "1: N off 50, vel 118"
2639807-2640707 midi: text-verbose: "Channel 1: note off (note = 66 'F#3', velocity = 105)" "ch 1: note off 66, velocity = 105" "1: N off 66, vel 105"
2642712-2643613 midi: text-verbose: "Channel 1: note off (note = 48 'C2', velocity = 119)" "ch 1: note off 48, velocity = 119" "1: N off 48, vel 119"
2646774-2647675 midi: text-verbose: "Channel 1: note off (note = 52 'E2', velocity = 116)" "ch 1: note off 52, velocity = 116" "1: N off 52, vel 116"
2650903-2651803 midi: text-verbose: "Channel 1: note off (note = 54 'F#2', velocity = 124)" "ch 1: note off 54, velocity = 124" "1: N off 54, vel 124"
2663116-2664016 midi: text-verbose: "Channel 1: note off (note = 67 'G3', velocity = 120)" "ch 1: note off 67, velocity = 120" "1: N off 67, vel 120"
2667265-2668166 midi: text-verbose: "Channel 1: note off (note = 64 'E3', velocity = 121)" "ch 1: note off 64, velocity = 121" "1: N off 64, vel 121"
2671328-2672228 midi: text-verbose: "Channel 1: note off (note = 65 'F3', velocity = 115)" "ch 1: note off 65, velocity = 115" "1: N off 65, vel 115"
2675468-2676368 midi: text-verbose: "Channel 1: note off (note = 69 'A3', velocity = 121)" "ch 1: note off 69, velocity = 121" "1: N off 69, vel 121"
2676442-2676698 midi: text-verbose: "System Realtime: active sensing" "SysReal: active sensing" "SR: sensing"
2679836-2680737 midi: text-verbose: "Channel 1: note off (note = 72 'C4', velocity = 117)" "ch 1: note off 72, velocity = 117" "1: N off 72, vel 117"
2756681-2757581 midi: text-verbose: "Channel 1: note on (note = 52 'E2', velocity = 112)" "ch 1: note on 52, velocity = 112" "1: N on 52, vel 112"
2766760-2767660 midi: text-verbose: "Channel 1: note on (note = 49 'C#2', velocity = 106)" "ch 1: note on 49, velocity = 106" "1: N on 49, vel 106"
2770878-2771778 midi: text-verbose: "Channel 1: note on (note = 51 'D#2', velocity = 106)" "ch 1: note on 51, velocity = 106" "1: N on 51, vel 106"
2774935-2775835 midi: text-verbose: "Channel 1: note on (note = 54 'F#2', velocity = 122)" "ch 1: note on 54, velocity = 122" "1: N on 54, vel 122"
2782221-2783120 midi: text-verbose: "Channel 1: note on (note = 61 'C#3', velocity = 124)" "ch 1: note on 61, velocity = 124" "1: N on 61, vel 124"
2791417-2792317 midi: text-verbose: "Channel 1: note on (note = 55 'G2', velocity = 112)" "ch 1: note on 55, velocity = 112" "1: N on 55, vel 112"
2795567-2796466 midi: text-verbose: "Channel 1: note on (note = 62 'D3', velocity = 106)" "ch 1: note on 62, velocity = 106" "1: N on 62, vel 106"
2799638-2800538 midi: text-verbose: "Channel 1: note on (note = 63 'D#3', velocity = 127)" "ch 1: note on 63, velocity = 127" "1: N on 63, vel 127"
2803775-2804675 midi: text-verbose: "Channel 1: note on (note = 66 'F#3', velocity = 124)" "ch 1: note on 66, velocity = 124" "1: N on 66, vel 124"
2806718-2807618 midi: text-verbose: "Channel 1: note off (note = 49 'C#2', velocity = 124)" "ch 1: note off 49, velocity = 124" "1: N off 49, vel 124"
2842947-2843203 midi: text-verbose: "System Realtime: active sensing" "SysReal: active sensing" "SR: sensing"
2894384-2895284 midi: text-verbose: "Channel 1: note off (note = 55 'G2', velocity = 112)" "ch 1: note off 55, velocity = 112" "1: N off 55, vel 112"
2913188-2914088 midi: text-verbose: "Channel 1: note off (note = 54 'F#2', velocity = 120)" "ch 1: note off 54, velocity = 120" "1: N off 54, vel 120"
2917248-2918148 midi: text-verbose: "Channel 1: note off (note = 61 'C#3', velocity = 117)" "ch 1: note off 61, velocity = 117" "1: N off 61, vel 117"
2921383-2922283 midi: text-verbose: "Channel 1: note off (note = 62 'D3', velocity = 115)" "ch 1: note off 62, velocity = 115" "1: N off 62, vel 115"
2936963-2937863 midi: text-verbose: "Channel 1: note off (note = 51 'D#2', velocity = 121)" "ch 1: note off 51, velocity = 121" "1: N off 51, vel 121"
2942956-2943856 midi: text-verbose: "Channel 1: note off (note = 52 'E2', velocity = 111)" "ch 1: note off 52, velocity = 111" "1: N off 52, vel 111"
2947096-2947996 midi: text-verbose: "Channel 1: note off (note = 63 'D#3', velocity = 121)" "ch 1: note off 63, velocity = 121" "1: N off 63, vel 121"
2951157-2952058 midi: text-verbose: "Channel 1: note off (note = 66 'F#3', velocity = 120)" "ch 1: note off 66, velocity = 120" "1: N off 66, vel 120"
3001126-3002026 midi: text-verbose: "Channel 1: note on (note = 52 'E2', velocity = 104)" "ch 1: note on 52, velocity = 104" "1: N on 52, vel 104"
3007225-3007481 midi: text-verbose: "System Realtime: active sensing" "SysReal: active sensing" "SR: sensing"
3010698-3011598 midi: text-verbose: "Channel 1: note on (note = 49 'C#2', velocity = 116)" "ch 1: note on 49, velocity = 116" "1: N on 49, vel 116"
3022867-3023767 midi: text-verbose: "Channel 1: note on (note = 54 'F#2', velocity = 124)" "ch 1: note on 54, velocity = 124" "1: N on 54, vel 124"
3027009-3027909 midi: text-verbose: "Channel 1: note on (note = 56 'G#2', velocity = 124)" "ch 1: note on 56, velocity = 124" "1: N on 56, vel 124"
3031067-3031966 midi: text-verbose: "Channel 1: note on (note = 61 'C#3', velocity = 127)" "ch 1: note on 61, velocity = 127" "1: N on 61, vel 127"
3035192-3036091 midi: text-verbose: "Channel 1: note on (note = 63 'D#3', velocity = 127)" "ch 1: note on 63, velocity = 127" "1: N on 63, vel 127"
3039264-3040164 midi: text-verbose: "Channel 1: note on (note = 69 'A3', velocity = 122)" "ch 1: note on 69, velocity = 122" "1: N on 69, vel 122"
3046490-3047389 midi: text-verbose: "Channel 1: note on (note = 62 'D3', velocity = 120)" "ch 1: note on 62, velocity = 120" "1: N on 62, vel 120"
3050631-3051531 midi: text-verbose: "Channel 1: note on (note = 60 'C3', velocity = 124)" "ch 1: note on 60, velocity = 124" "1: N on 60, vel 124"
3054689-3055589 midi: text-verbose: "Channel 1: note on (note = 65 'F3', velocity = 120)" "ch 1: note on 65, velocity = 120" "1: N on 65, vel 120"
3171500-3171756 midi: text-verbose: "System Realtime: active sensing" "SysReal: active sensing" "SR: sensing"
3211425-3212325 midi: text-verbose: "Channel 1: note off (note = 54 'F#2', velocity = 114)" "ch 1: note off 54, velocity = 114" "1: N off 54, vel 114"
3227025-3227925 midi: text-verbose: "Channel 1: note on (note = 50 'D2', velocity = 10)" "ch 1: note on 50, velocity = 10" "1: N on 50, vel 10"
3239188-3240088 midi: text-verbose: "Channel 1: note off (note = 49 'C#2', velocity = 117)" "ch 1: note off 49, velocity = 117" "1: N off 49, vel 117"
3330924-3331180 midi: text-verbose: "System Realtime: active sensing" "SysReal: active sensing" "SR: sensing"
3456401-3457300 midi: text-verbose: "Channel 1: note off (note = 61 'C#3', velocity = 115)" "ch 1: note off 61, velocity = 115" "1: N off 61, vel 115"
3474012-3474912 midi: text-verbose: "Channel 1: note off (note = 60 'C3', velocity = 115)" "ch 1: note off 60, velocity = 115" "1: N off 60, vel 115"
3478086-3478987 midi: text-verbose: "Channel 1: note off (note = 56 'G#2', velocity = 124)" "ch 1: note off 56, velocity = 124" "1: N off 56, vel 124"
3482229-3483129 midi: text-verbose: "Channel 1: note off (note = 50 'D2', velocity = 120)" "ch 1: note off 50, velocity = 120" "1: N off 50, vel 120"
3491310-3491566 midi: text-verbose: "System Realtime: active sensing" "SysReal: active sensing" "SR: sensing"
3494683-3495583 midi: text-verbose: "Channel 1: note off (note = 52 'E2', velocity = 119)" "ch 1: note off 52, velocity = 119" "1: N off 52, vel 119"
3498814-3499714 midi: text-verbose: "Channel 1: note off (note = 62 'D3', velocity = 120)" "ch 1: note off 62, velocity = 120" "1: N off 62, vel 120"
3502872-3503772 midi: text-verbose: "Channel 1: note off (note = 63 'D#3', velocity = 119)" "ch 1: note off 63, velocity = 119" "1: N off 63, vel 119"
3507006-3507907 midi: text-verbose: "Channel 1: note off (note = 65 'F3', velocity = 122)" "ch 1: note off 65, velocity = 122" "1: N off 65, vel 122"
3511072-3511973 midi: text-verbose: "Channel 1: note off (note = 69 'A3', velocity = 122)" "ch 1: note off 69, velocity = 122" "1: N off 69, vel 122"
3652321-3652577 midi: text-verbose: "System Realtime: active sensing" "SysReal: active sensing" "SR: sensing"
3808795-3809051 midi: text-verbose: "System Realtime: active sensing" "SysReal: active sensing" "SR: sensing"
3962964-3963220 midi: text-verbose: "System Realtime: active sensing" "SysReal: active sensing" "SR: sensing"
4117129-4117385 midi: text-verbose: "System Realtime: active sensing" "SysReal: active sensing" "SR: sensing"
4273300-4273556 midi: text-verbose: "System Realtime: active sensing" "SysReal: active sensing" "SR: sensing"
4402509-4403410 midi: text-verbose: "Channel 1: note on (note = 49 'C#2', velocity = 112)" "ch 1: note on 49, velocity = 112" "1: N on 49, vel 112"
4411766-4412666 midi: text-verbose: "Channel 1: note on (note = 54 'F#2', velocity = 120)" "ch 1: note on 54, velocity = 120" "1: N on 54, vel 120"
4427338-4428237 midi: text-verbose: "Channel 1: note on (note = 55 'G2', velocity = 100)" "ch 1: note on 55, velocity = 100" "1: N on 55, vel 100"
4431436-4431692 midi: text-verbose: "System Realtime: active sensing" "SysReal: active sensing" "SR: sensing"
4434919-4435819 midi: text-verbose: "Channel 1: note on (note = 61 'C#3', velocity = 127)" "ch 1: note on 61, velocity = 127" "1: N on 61, vel 127"
4442136-4443036 midi: text-verbose: "Channel 1: note on (note = 60 'C3', velocity = 127)" "ch 1: note on 60, velocity = 127" "1: N on 60, vel 127"
4448144-4449044 midi: text-verbose: "Channel 1: note on (note = 59 'B2', velocity = 126)" "ch 1: note on 59, velocity = 126" "1: N on 59, vel 126"
4452276-4453177 midi: text-verbose: "Channel 1: note on (note = 64 'E3', velocity = 124)" "ch 1: note on 64, velocity = 124" "1: N on 64, vel 124"
4459547-4460447 midi: text-verbose: "Channel 1: note on (note = 67 'G3', velocity = 122)" "ch 1: note on 67, velocity = 122" "1: N on 67, vel 122"
4506484-4507385 midi: text-verbose: "Channel 1: note off (note = 49 'C#2', velocity = 124)" "ch 1: note off 49, velocity = 124" "1: N off 49, vel 124"
4530403-4531303 midi: text-verbose: "Channel 1: note off (note = 55 'G2', velocity = 107)" "ch 1: note off 55, velocity = 107" "1: N off 55, vel 107"
4539594-4540494 midi: text-verbose: "Channel 1: note off (note = 54 'F#2', velocity = 121)" "ch 1: note off 54, velocity = 121" "1: N off 54, vel 121"
4555179-4556079 midi: text-verbose: "Channel 1: note off (note = 59 'B2', velocity = 121)" "ch 1: note off 59, velocity = 121" "1: N off 59, vel 121"
4562459-4563360 midi: text-verbose: "Channel 1: note off (note = 64 'E3', velocity = 116)" "ch 1: note off 64, velocity = 116" "1: N off 64, vel 116"
4566527-4567427 midi: text-verbose: "Channel 1: note off (note = 60 'C3', velocity = 121)" "ch 1: note off 60, velocity = 121" "1: N off 60, vel 121"
4570666-4571566 midi: text-verbose: "Channel 1: note off (note = 61 'C#3', velocity = 120)" "ch 1: note off 61, velocity = 120" "1: N off 61, vel 120"
4582826-4583727 midi: text-verbose: "Channel 1: note off (note = 67 'G3', velocity = 114)" "ch 1: note off 67, velocity = 114" "1: N off 67, vel 114"
4600412-4600668 midi: text-verbose: "System Realtime: active sensing" "SysReal: active sensing" "SR: sensing"
4620470-4621370 midi: text-verbose: "Channel 1: note on (note = 55 'G2', velocity = 124)" "ch 1: note on 55, velocity = 124" "1: N on 55, vel 124"
4623426-4624325 midi: text-verbose: "Channel 1: note on (note = 54 'F#2', velocity = 126)" "ch 1: note on 54, velocity = 126" "1: N on 54, vel 126"
4626359-4627259 midi: text-verbose: "Channel 1: note on (note = 57 'A2', velocity = 124)" "ch 1: note on 57, velocity = 124" "1: N on 57, vel 124"
4629306-4630207 midi: text-verbose: "Channel 1: note on (note = 52 'E2', velocity = 118)" "ch 1: note on 52, velocity = 118" "1: N on 52, vel 118"
4639182-4640082 midi: text-verbose: "Channel 1: note on (note = 53 'F2', velocity = 118)" "ch 1: note on 53, velocity = 118" "1: N on 53, vel 118"
4643386-4644286 midi: text-verbose: "Channel 1: note on (note = 62 'D3', velocity = 122)" "ch 1: note on 62, velocity = 122" "1: N on 62, vel 122"
4647424-4648323 midi: text-verbose: "Channel 1: note on (note = 63 'D#3', velocity = 127)" "ch 1: note on 63, velocity = 127" "1: N on 63, vel 127"
4651604-4652505 midi: text-verbose: "Channel 1: note on (note = 66 'F#3', velocity = 124)" "ch 1: note on 66, velocity = 124" "1: N on 66, vel 124"
4655647-4656548 midi: text-verbose: "Channel 1: note on (note = 64 'E3', velocity = 122)" "ch 1: note on 64, velocity = 122" "1: N on 64, vel 122"
4664791-4665692 midi: text-verbose: "Channel 1: note on (note = 69 'A3', velocity = 120)" "ch 1: note on 69, velocity = 120" "1: N on 69, vel 120"
4668969-4669869 midi: text-verbose: "Channel 1: note off (note = 63 'D#3', velocity = 121)" "ch 1: note off 63, velocity = 121" "1: N off 63, vel 121"
4690929-4691829 midi: text-verbose: "Channel 1: note off (note = 53 'F2', velocity = 101)" "ch 1: note off 53, velocity = 101" "1: N off 53, vel 101"
4694964-4695864 midi: text-verbose: "Channel 1: note off (note = 57 'A2', velocity = 110)" "ch 1: note off 57, velocity = 110" "1: N off 57, vel 110"
4699136-4700036 midi: text-verbose: "Channel 1: note off (note = 54 'F#2', velocity = 115)" "ch 1: note off 54, velocity = 115" "1: N off 54, vel 115"
4711259-4712160 midi: text-verbose: "Channel 1: note off (note = 52 'E2', velocity = 113)" "ch 1: note off 52, velocity = 113" "1: N off 52, vel 113"
4771823-4772079 midi: text-verbose: "System Realtime: active sensing" "SysReal: active sensing" "SR: sensing"
4839921-4840822 midi: text-verbose: "Channel 1: note off (note = 69 'A3', velocity = 115)" "ch 1: note off 69, velocity = 115" "1: N off 69, vel 115"
4850397-4851297 midi: text-verbose: "Channel 1: note off (note = 55 'G2', velocity = 119)" "ch 1: note off 55, velocity = 119" "1: N off 55, vel 119"
4853337-4854237 midi: text-verbose: "Channel 1: note off (note = 62 'D3', velocity = 119)" "ch 1: note off 62, velocity = 119" "1: N off 62, vel 119"
4856288-4857189 midi: text-verbose: "Channel 1: note off (note = 64 'E3', velocity = 120)" "ch 1: note off 64, velocity = 120" "1: N off 64, vel 120"
4864218-4865118 midi: text-verbose: "Channel 1: note off (note = 66 'F#3', velocity = 121)" "ch 1: note off 66, velocity = 121" "1: N off 66, vel 121"
4930858-4931114 midi: text-verbose: "System Realtime: active sensing" "SysReal: active sensing" "SR: sensing"
