0-1 seven_segment: decoded-digit: "A"
1-2 seven_segment: decoded-digit: "a"
2-3 seven_segment: decoded-digit: "b"
3-4 seven_segment: decoded-digit: "C"
4-5 seven_segment: decoded-digit: "c"
5-6 seven_segment: decoded-digit: "d"
6-7 seven_segment: decoded-digit: "E"
7-8 seven_segment: decoded-digit: "F"
8-9 seven_segment: decoded-digit: "G"
9-10 seven_segment: decoded-digit: "H"
10-11 seven_segment: decoded-digit: "h"
11-12 seven_segment: decoded-digit: "I"
12-13 seven_segment: decoded-digit: "i"
13-14 seven_segment: decoded-digit: "i"
14-15 seven_segment: decoded-digit: "J"
15-16 seven_segment: decoded-digit: "J"
16-17 seven_segment: decoded-digit: "j"
17-18 seven_segment: decoded-digit: "K"
18-19 seven_segment: decoded-digit: "L"
19-20 seven_segment: decoded-digit: "M"
20-21 seven_segment: decoded-digit: "M"
21-22 seven_segment: decoded-digit: "N"
22-23 seven_segment: decoded-digit: "n"
23-24 seven_segment: decoded-digit: "o"
24-25 seven_segment: decoded-digit: "p"
25-26 seven_segment: decoded-digit: "3"
26-27 seven_segment: decoded-digit: "R"
27-28 seven_segment: decoded-digit: "r"
28-29 seven_segment: decoded-digit: "5"
29-30 seven_segment: decoded-digit: "t"
30-31 seven_segment: decoded-digit: "u"
31-32 seven_segment: decoded-digit: "V"
32-33 seven_segment: decoded-digit: "V"
33-34 seven_segment: decoded-digit: "V"
34-35 seven_segment: decoded-digit: "v"
35-36 seven_segment: decoded-digit: "W"
36-37 seven_segment: decoded-digit: "x"
37-38 seven_segment: decoded-digit: "4"
38-39 seven_segment: decoded-digit: "Z"
39-40 seven_segment: decoded-digit: "0"
40-41 seven_segment: decoded-digit: "1"
41-42 seven_segment: decoded-digit: "2"
42-43 seven_segment: decoded-digit: "3"
43-44 seven_segment: decoded-digit: "4"
44-45 seven_segment: decoded-digit: "5"
45-46 seven_segment: decoded-digit: "6"
46-47 seven_segment: decoded-digit: "7"
47-48 seven_segment: decoded-digit: "7"
48-49 seven_segment: decoded-digit: "8"
49-50 seven_segment: decoded-digit: "9"
50-51 seven_segment: decoded-digit: "-"
51-52 seven_segment: decoded-digit: " "
52-53 seven_segment: decoded-digit: "_"
53-54 seven_segment: decoded-digit: ","
54-55 seven_segment: decoded-digit: "."
55-56 seven_segment: decoded-digit: "^"
56-57 seven_segment: decoded-digit: "?"
57-58 seven_segment: decoded-digit: "="
58-59 seven_segment: decoded-digit: "="
59-60 seven_segment: decoded-digit: "&"
60-61 seven_segment: decoded-digit: "'"
61-62 seven_segment: decoded-digit: "'"
