0-4612 seven_segment: decoded-digit: "E"
4612-4613 seven_segment: decoded-digit: "E."
4613-14615 seven_segment: decoded-digit: "F."
14615-24617 seven_segment: decoded-digit: "F"
24617-24618 seven_segment: decoded-digit: "F."
24618-34621 seven_segment: decoded-digit: "0."
34621-44623 seven_segment: decoded-digit: "0"
44623-44624 seven_segment: decoded-digit: "#."
44624-54626 seven_segment: decoded-digit: "1."
54626-64628 seven_segment: decoded-digit: "1"
64628-64629 seven_segment: decoded-digit: "7."
64629-74631 seven_segment: decoded-digit: "2."
74631-84634 seven_segment: decoded-digit: "2"
84634-94637 seven_segment: decoded-digit: "3."
94637-104639 seven_segment: decoded-digit: "3"
104639-104640 seven_segment: decoded-digit: "#."
104640-114642 seven_segment: decoded-digit: "4."
114642-124644 seven_segment: decoded-digit: "4"
124644-124645 seven_segment: decoded-digit: "4."
124645-134648 seven_segment: decoded-digit: "5."
134648-144650 seven_segment: decoded-digit: "5"
144650-144651 seven_segment: decoded-digit: "5."
144651-154653 seven_segment: decoded-digit: "6."
154653-164655 seven_segment: decoded-digit: "6"
164655-164656 seven_segment: decoded-digit: "6."
164656-174658 seven_segment: decoded-digit: "7."
174658-184661 seven_segment: decoded-digit: "7"
184661-184662 seven_segment: decoded-digit: "0."
184662-194664 seven_segment: decoded-digit: "8."
194664-204666 seven_segment: decoded-digit: "8"
204666-204667 seven_segment: decoded-digit: "8."
204667-214669 seven_segment: decoded-digit: "9."
214669-224672 seven_segment: decoded-digit: "9"
224672-234675 seven_segment: decoded-digit: "A."
234675-244677 seven_segment: decoded-digit: "A"
244677-244678 seven_segment: decoded-digit: "h."
244678-254680 seven_segment: decoded-digit: "b."
254680-264682 seven_segment: decoded-digit: "b"
264682-264683 seven_segment: decoded-digit: "b."
264683-274686 seven_segment: decoded-digit: "C."
274686-284688 seven_segment: decoded-digit: "C"
284688-284689 seven_segment: decoded-digit: "V."
284689-294691 seven_segment: decoded-digit: "d."
294691-304693 seven_segment: decoded-digit: "d"
304693-304694 seven_segment: decoded-digit: "d."
304694-314697 seven_segment: decoded-digit: "E."
314697-324699 seven_segment: decoded-digit: "E"
324699-334702 seven_segment: decoded-digit: "F."
334702-344704 seven_segment: decoded-digit: "F"
344704-344705 seven_segment: decoded-digit: "F."
344705-354708 seven_segment: decoded-digit: "0."
354708-364710 seven_segment: decoded-digit: "0"
364710-364711 seven_segment: decoded-digit: "#."
364711-374713 seven_segment: decoded-digit: "1."
