1295-1319 sda2506: cmdbit: "0"
1368-1393 sda2506: cmdbit: "1"
1447-1471 sda2506: cmdbit: "0"
1525-1550 sda2506: cmdbit: "0"
1672-1697 sda2506: cmdbit: "0"
1746-1771 sda2506: cmdbit: "1"
1820-1844 sda2506: cmdbit: "1"
1898-1923 sda2506: cmdbit: "0"
2045-2070 sda2506: cmdbit: "0"
2119-2143 sda2506: cmdbit: "1"
2192-2217 sda2506: cmdbit: "1"
2271-2295 sda2506: cmdbit: "0"
2418-2442 sda2506: cmdbit: "0"
2491-2516 sda2506: cmdbit: "1"
2565-2590 sda2506: cmdbit: "1"
2639-2663 sda2506: cmdbit: "1"
2045-2590 sda2506: databyte: "addr: 66"
2639-2663 sda2506: databyte: "CB: 01"
2707-29028 sda2506: cmd: "Erase: 66"
2045-2590 sda2506: databyte: "addr: 66"
2639-2663 sda2506: databyte: "CB: 01"
1295-1923 sda2506: databyte: "data: 62"
29048-55404 sda2506: cmd: "Write to 66: 62"
55791-55816 sda2506: cmdbit: "1"
55870-55894 sda2506: cmdbit: "0"
55943-55968 sda2506: cmdbit: "1"
56022-56046 sda2506: cmdbit: "0"
56169-56193 sda2506: cmdbit: "0"
56242-56267 sda2506: cmdbit: "1"
56316-56340 sda2506: cmdbit: "1"
56394-56419 sda2506: cmdbit: "0"
55791-56340 sda2506: databyte: "addr: 65"
56394-56419 sda2506: databyte: "CB: 00"
55791-56340 sda2506: databyte: "read: 65"
55791-56473 sda2506: cmd: "read"
56532-56610 sda2506: databit: "1"
56625-56703 sda2506: databit: "1"
56718-56796 sda2506: databit: "1"
56811-56890 sda2506: databit: "0"
56904-56983 sda2506: databit: "1"
56998-57076 sda2506: databit: "1"
57091-57169 sda2506: databit: "0"
57184-57262 sda2506: databit: "0"
56532-57262 sda2506: databyte: "37"
57709-57733 sda2506: cmdbit: "0"
57782-57807 sda2506: cmdbit: "1"
57856-57880 sda2506: cmdbit: "1"
57934-57959 sda2506: cmdbit: "0"
58081-58106 sda2506: cmdbit: "0"
58155-58179 sda2506: cmdbit: "1"
58228-58253 sda2506: cmdbit: "1"
58307-58331 sda2506: cmdbit: "0"
57709-58253 sda2506: databyte: "addr: 66"
58307-58331 sda2506: databyte: "CB: 00"
57709-58253 sda2506: databyte: "read: 66"
57709-58385 sda2506: cmd: "read"
58444-58523 sda2506: databit: "0"
58537-58616 sda2506: databit: "1"
58631-58709 sda2506: databit: "0"
58724-58802 sda2506: databit: "0"
58817-58895 sda2506: databit: "0"
58910-58989 sda2506: databit: "1"
59003-59082 sda2506: databit: "1"
59096-59175 sda2506: databit: "0"
58444-59175 sda2506: databyte: "62"
60156-60180 sda2506: cmdbit: "1"
60229-60254 sda2506: cmdbit: "1"
60303-60327 sda2506: cmdbit: "1"
60381-60406 sda2506: cmdbit: "0"
60528-60553 sda2506: cmdbit: "0"
60602-60627 sda2506: cmdbit: "1"
60676-60700 sda2506: cmdbit: "1"
60754-60779 sda2506: cmdbit: "0"
60156-60700 sda2506: databyte: "addr: 67"
60754-60779 sda2506: databyte: "CB: 00"
60156-60700 sda2506: databyte: "read: 67"
60156-60833 sda2506: cmd: "read"
60891-60970 sda2506: databit: "1"
60985-61063 sda2506: databit: "1"
61078-61156 sda2506: databit: "0"
61171-61249 sda2506: databit: "0"
61264-61342 sda2506: databit: "1"
61357-61436 sda2506: databit: "0"
61450-61529 sda2506: databit: "0"
61544-61622 sda2506: databit: "0"
60891-61622 sda2506: databyte: "13"
62211-62235 sda2506: cmdbit: "0"
62289-62314 sda2506: cmdbit: "0"
62367-62392 sda2506: cmdbit: "0"
62441-62466 sda2506: cmdbit: "1"
62588-62613 sda2506: cmdbit: "0"
62662-62686 sda2506: cmdbit: "1"
62735-62760 sda2506: cmdbit: "1"
62814-62838 sda2506: cmdbit: "0"
62211-62760 sda2506: databyte: "addr: 68"
62814-62838 sda2506: databyte: "CB: 00"
62211-62760 sda2506: databyte: "read: 68"
62211-62892 sda2506: cmd: "read"
62951-63029 sda2506: databit: "1"
63044-63123 sda2506: databit: "0"
63137-63216 sda2506: databit: "0"
63231-63309 sda2506: databit: "0"
63324-63402 sda2506: databit: "0"
63417-63495 sda2506: databit: "0"
63510-63589 sda2506: databit: "0"
63603-63682 sda2506: databit: "1"
62951-63682 sda2506: databyte: "81"
