464-476 sda2506: cmdbit: "0"
503-515 sda2506: cmdbit: "0"
540-552 sda2506: cmdbit: "1"
577-589 sda2506: cmdbit: "1"
648-660 sda2506: cmdbit: "1"
687-699 sda2506: cmdbit: "0"
724-736 sda2506: cmdbit: "1"
763-775 sda2506: cmdbit: "0"
837-849 sda2506: cmdbit: "0"
873-886 sda2506: cmdbit: "1"
910-922 sda2506: cmdbit: "1"
949-962 sda2506: cmdbit: "0"
1023-1035 sda2506: cmdbit: "0"
1060-1072 sda2506: cmdbit: "1"
1097-1109 sda2506: cmdbit: "1"
1133-1146 sda2506: cmdbit: "1"
837-1109 sda2506: data: "addr: 66"
1133-1146 sda2506: data: "CB: 01"
1168-14329 sda2506: cmd: "Erase: 66"
837-1109 sda2506: data: "addr: 66"
1133-1146 sda2506: data: "CB: 01"
464-775 sda2506: data: "data: 5C"
14339-27517 sda2506: cmd: "Write to 66: 5C"
27711-27723 sda2506: cmdbit: "1"
27750-27762 sda2506: cmdbit: "0"
27787-27799 sda2506: cmdbit: "1"
27826-27838 sda2506: cmdbit: "0"
27900-27912 sda2506: cmdbit: "0"
27936-27949 sda2506: cmdbit: "1"
27973-27985 sda2506: cmdbit: "1"
28012-28025 sda2506: cmdbit: "0"
27711-27985 sda2506: data: "addr: 65"
28012-28025 sda2506: data: "CB: 00"
27711-27985 sda2506: data: "read: 65"
27711-28052 sda2506: cmd: "read"
28081-28120 sda2506: databit: "1"
28128-28167 sda2506: databit: "1"
28174-28213 sda2506: databit: "1"
28221-28260 sda2506: databit: "0"
28267-28307 sda2506: databit: "1"
28314-28353 sda2506: databit: "1"
28361-28400 sda2506: databit: "0"
28407-28446 sda2506: databit: "0"
28081-28446 sda2506: data: "37"
28670-28682 sda2506: cmdbit: "0"
28706-28719 sda2506: cmdbit: "1"
28743-28755 sda2506: cmdbit: "1"
28782-28795 sda2506: cmdbit: "0"
28856-28868 sda2506: cmdbit: "0"
28893-28905 sda2506: cmdbit: "1"
28930-28942 sda2506: cmdbit: "1"
28969-28981 sda2506: cmdbit: "0"
28670-28942 sda2506: data: "addr: 66"
28969-28981 sda2506: data: "CB: 00"
28670-28942 sda2506: data: "read: 66"
28670-29008 sda2506: cmd: "read"
29037-29077 sda2506: databit: "0"
29084-29123 sda2506: databit: "0"
29131-29170 sda2506: databit: "1"
29177-29216 sda2506: databit: "1"
29224-29263 sda2506: databit: "1"
29270-29310 sda2506: databit: "0"
29317-29356 sda2506: databit: "1"
29364-29403 sda2506: databit: "0"
29037-29403 sda2506: data: "5C"
29896-29908 sda2506: cmdbit: "1"
29932-29945 sda2506: cmdbit: "1"
29969-29982 sda2506: cmdbit: "1"
30008-30021 sda2506: cmdbit: "0"
30082-30094 sda2506: cmdbit: "0"
30119-30131 sda2506: cmdbit: "1"
30156-30168 sda2506: cmdbit: "1"
30195-30207 sda2506: cmdbit: "0"
29896-30168 sda2506: data: "addr: 67"
30195-30207 sda2506: data: "CB: 00"
29896-30168 sda2506: data: "read: 67"
29896-30234 sda2506: cmd: "read"
30263-30303 sda2506: databit: "1"
30310-30349 sda2506: databit: "1"
30357-30396 sda2506: databit: "0"
30403-30442 sda2506: databit: "0"
30450-30489 sda2506: databit: "1"
30496-30536 sda2506: databit: "0"
30543-30582 sda2506: databit: "0"
30590-30629 sda2506: databit: "0"
30263-30629 sda2506: data: "13"
30923-30935 sda2506: cmdbit: "0"
30962-30975 sda2506: cmdbit: "0"
31002-31014 sda2506: cmdbit: "0"
31038-31051 sda2506: cmdbit: "1"
31112-31124 sda2506: cmdbit: "0"
31149-31161 sda2506: cmdbit: "1"
31185-31198 sda2506: cmdbit: "1"
31225-31237 sda2506: cmdbit: "0"
30923-31198 sda2506: data: "addr: 68"
31225-31237 sda2506: data: "CB: 00"
30923-31198 sda2506: data: "read: 68"
30923-31264 sda2506: cmd: "read"
31293-31333 sda2506: databit: "1"
31340-31379 sda2506: databit: "0"
31387-31426 sda2506: databit: "0"
31433-31472 sda2506: databit: "0"
31480-31519 sda2506: databit: "0"
31526-31566 sda2506: databit: "0"
31573-31612 sda2506: databit: "0"
31620-31659 sda2506: databit: "1"
31293-31659 sda2506: data: "81"
