140920-142099 dmx512: break: "Break"
142099-142356 dmx512: mab: "MAB"
142356-142403 dmx512: startbit: "Start bit"
142403-142450 dmx512: bit: "0"
142450-142497 dmx512: bit: "0"
142497-142544 dmx512: bit: "0"
142544-142591 dmx512: bit: "0"
142591-142638 dmx512: bit: "0"
142638-142685 dmx512: bit: "0"
142685-142732 dmx512: bit: "0"
142732-142779 dmx512: bit: "0"
142779-142826 dmx512: stopbits: "Stop bit"
142826-142873 dmx512: stopbits: "Stop bit"
142356-142873 dmx512: startcode: "Start code"
142403-142779 dmx512: data: "0 / 0x0"
142873-143062 dmx512: interframe: "Interframe"
143062-143109 dmx512: startbit: "Start bit"
143109-143156 dmx512: bit: "1"
143156-143203 dmx512: bit: "0"
143203-143250 dmx512: bit: "1"
143250-143297 dmx512: bit: "0"
143297-143344 dmx512: bit: "1"
143344-143391 dmx512: bit: "0"
143391-143438 dmx512: bit: "1"
143438-143485 dmx512: bit: "0"
143485-143532 dmx512: stopbits: "Stop bit"
143532-143579 dmx512: stopbits: "Stop bit"
143062-143579 dmx512: channel: "Channel 1"
143109-143485 dmx512: data: "85 / 0x55"
143579-143769 dmx512: interframe: "Interframe"
143769-143816 dmx512: startbit: "Start bit"
143816-143863 dmx512: bit: "1"
143863-143910 dmx512: bit: "0"
143910-143957 dmx512: bit: "1"
143957-144004 dmx512: bit: "0"
144004-144051 dmx512: bit: "1"
144051-144098 dmx512: bit: "0"
144098-144145 dmx512: bit: "1"
144145-144192 dmx512: bit: "0"
144192-144239 dmx512: stopbits: "Stop bit"
144239-144286 dmx512: stopbits: "Stop bit"
143769-144286 dmx512: channel: "Channel 2"
143816-144192 dmx512: data: "85 / 0x55"
144286-144475 dmx512: interframe: "Interframe"
144475-144522 dmx512: startbit: "Start bit"
144522-144569 dmx512: bit: "0"
144569-144616 dmx512: bit: "0"
144616-144663 dmx512: bit: "0"
144663-144710 dmx512: bit: "0"
144710-144757 dmx512: bit: "0"
144757-144804 dmx512: bit: "0"
144804-144851 dmx512: bit: "0"
144851-144898 dmx512: bit: "0"
144898-144945 dmx512: stopbits: "Stop bit"
144945-144992 dmx512: stopbits: "Stop bit"
144475-144992 dmx512: channel: "Channel 3"
144522-144898 dmx512: data: "0 / 0x0"
144992-145181 dmx512: interframe: "Interframe"
145181-145228 dmx512: startbit: "Start bit"
145228-145275 dmx512: bit: "0"
145275-145322 dmx512: bit: "0"
145322-145369 dmx512: bit: "0"
145369-145416 dmx512: bit: "0"
145416-145463 dmx512: bit: "0"
145463-145510 dmx512: bit: "0"
145510-145557 dmx512: bit: "0"
145557-145604 dmx512: bit: "0"
145604-145651 dmx512: stopbits: "Stop bit"
145651-145698 dmx512: stopbits: "Stop bit"
145181-145698 dmx512: channel: "Channel 4"
145228-145604 dmx512: data: "0 / 0x0"
145698-145887 dmx512: interframe: "Interframe"
145887-145934 dmx512: startbit: "Start bit"
145934-145981 dmx512: bit: "0"
145981-146028 dmx512: bit: "0"
146028-146075 dmx512: bit: "0"
146075-146122 dmx512: bit: "0"
146122-146169 dmx512: bit: "0"
146169-146216 dmx512: bit: "0"
146216-146263 dmx512: bit: "0"
146263-146310 dmx512: bit: "0"
146310-146357 dmx512: stopbits: "Stop bit"
146357-146404 dmx512: stopbits: "Stop bit"
145887-146404 dmx512: channel: "Channel 5"
145934-146310 dmx512: data: "0 / 0x0"
146404-146593 dmx512: interframe: "Interframe"
146593-146640 dmx512: startbit: "Start bit"
146640-146687 dmx512: bit: "0"
146687-146734 dmx512: bit: "0"
146734-146781 dmx512: bit: "0"
146781-146828 dmx512: bit: "0"
146828-146875 dmx512: bit: "0"
146875-146922 dmx512: bit: "0"
146922-146969 dmx512: bit: "0"
146969-147016 dmx512: bit: "0"
147016-147063 dmx512: stopbits: "Stop bit"
147063-147110 dmx512: stopbits: "Stop bit"
146593-147110 dmx512: channel: "Channel 6"
146640-147016 dmx512: data: "0 / 0x0"
147110-147299 dmx512: interframe: "Interframe"
147299-147346 dmx512: startbit: "Start bit"
147346-147393 dmx512: bit: "0"
147393-147440 dmx512: bit: "0"
147440-147487 dmx512: bit: "0"
147487-147534 dmx512: bit: "0"
147534-147581 dmx512: bit: "0"
147581-147628 dmx512: bit: "0"
147628-147675 dmx512: bit: "0"
147675-147722 dmx512: bit: "0"
147722-147769 dmx512: stopbits: "Stop bit"
147769-147816 dmx512: stopbits: "Stop bit"
147299-147816 dmx512: channel: "Channel 7"
147346-147722 dmx512: data: "0 / 0x0"
147816-148006 dmx512: interframe: "Interframe"
148006-148053 dmx512: startbit: "Start bit"
148053-148100 dmx512: bit: "0"
148100-148147 dmx512: bit: "0"
148147-148194 dmx512: bit: "0"
148194-148241 dmx512: bit: "0"
148241-148288 dmx512: bit: "0"
148288-148335 dmx512: bit: "0"
148335-148382 dmx512: bit: "0"
148382-148429 dmx512: bit: "0"
148429-148476 dmx512: stopbits: "Stop bit"
148476-148523 dmx512: stopbits: "Stop bit"
148006-148523 dmx512: channel: "Channel 8"
148053-148429 dmx512: data: "0 / 0x0"
148523-148712 dmx512: interframe: "Interframe"
148712-148759 dmx512: startbit: "Start bit"
148759-148806 dmx512: bit: "0"
148806-148853 dmx512: bit: "0"
148853-148900 dmx512: bit: "0"
148900-148947 dmx512: bit: "0"
148947-148994 dmx512: bit: "0"
148994-149041 dmx512: bit: "0"
149041-149088 dmx512: bit: "0"
149088-149135 dmx512: bit: "0"
149135-149182 dmx512: stopbits: "Stop bit"
149182-149229 dmx512: stopbits: "Stop bit"
148712-149229 dmx512: channel: "Channel 9"
148759-149135 dmx512: data: "0 / 0x0"
149229-149418 dmx512: interframe: "Interframe"
149418-149465 dmx512: startbit: "Start bit"
149465-149512 dmx512: bit: "0"
149512-149559 dmx512: bit: "0"
149559-149606 dmx512: bit: "0"
149606-149653 dmx512: bit: "0"
149653-149700 dmx512: bit: "0"
149700-149747 dmx512: bit: "0"
149747-149794 dmx512: bit: "0"
149794-149841 dmx512: bit: "0"
149841-149888 dmx512: stopbits: "Stop bit"
149888-149935 dmx512: stopbits: "Stop bit"
149418-149935 dmx512: channel: "Channel 10"
149465-149841 dmx512: data: "0 / 0x0"
149935-150124 dmx512: interframe: "Interframe"
150124-150171 dmx512: startbit: "Start bit"
150171-150218 dmx512: bit: "0"
150218-150265 dmx512: bit: "0"
150265-150312 dmx512: bit: "0"
150312-150359 dmx512: bit: "0"
150359-150406 dmx512: bit: "0"
150406-150453 dmx512: bit: "0"
150453-150500 dmx512: bit: "0"
150500-150547 dmx512: bit: "0"
150547-150594 dmx512: stopbits: "Stop bit"
150594-150641 dmx512: stopbits: "Stop bit"
150124-150641 dmx512: channel: "Channel 11"
150171-150547 dmx512: data: "0 / 0x0"
150641-150830 dmx512: interframe: "Interframe"
150830-150877 dmx512: startbit: "Start bit"
150877-150924 dmx512: bit: "0"
150924-150971 dmx512: bit: "0"
150971-151018 dmx512: bit: "0"
151018-151065 dmx512: bit: "0"
151065-151112 dmx512: bit: "0"
151112-151159 dmx512: bit: "0"
151159-151206 dmx512: bit: "0"
151206-151253 dmx512: bit: "0"
151253-151300 dmx512: stopbits: "Stop bit"
151300-151347 dmx512: stopbits: "Stop bit"
150830-151347 dmx512: channel: "Channel 12"
150877-151253 dmx512: data: "0 / 0x0"
151347-151536 dmx512: interframe: "Interframe"
151536-151583 dmx512: startbit: "Start bit"
151583-151630 dmx512: bit: "0"
151630-151677 dmx512: bit: "0"
151677-151724 dmx512: bit: "0"
151724-151771 dmx512: bit: "0"
151771-151818 dmx512: bit: "0"
151818-151865 dmx512: bit: "0"
151865-151912 dmx512: bit: "0"
151912-151959 dmx512: bit: "0"
151959-152006 dmx512: stopbits: "Stop bit"
152006-152053 dmx512: stopbits: "Stop bit"
151536-152053 dmx512: channel: "Channel 13"
151583-151959 dmx512: data: "0 / 0x0"
152053-152242 dmx512: interframe: "Interframe"
152242-152289 dmx512: startbit: "Start bit"
152289-152336 dmx512: bit: "0"
152336-152383 dmx512: bit: "0"
152383-152430 dmx512: bit: "0"
152430-152477 dmx512: bit: "0"
152477-152524 dmx512: bit: "0"
152524-152571 dmx512: bit: "0"
152571-152618 dmx512: bit: "0"
152618-152665 dmx512: bit: "0"
152665-152712 dmx512: stopbits: "Stop bit"
152712-152759 dmx512: stopbits: "Stop bit"
152242-152759 dmx512: channel: "Channel 14"
152289-152665 dmx512: data: "0 / 0x0"
152759-152949 dmx512: interframe: "Interframe"
152949-152996 dmx512: startbit: "Start bit"
152996-153043 dmx512: bit: "0"
153043-153090 dmx512: bit: "0"
153090-153137 dmx512: bit: "0"
153137-153184 dmx512: bit: "0"
153184-153231 dmx512: bit: "0"
153231-153278 dmx512: bit: "0"
153278-153325 dmx512: bit: "0"
153325-153372 dmx512: bit: "0"
153372-153419 dmx512: stopbits: "Stop bit"
153419-153466 dmx512: stopbits: "Stop bit"
152949-153466 dmx512: channel: "Channel 15"
152996-153372 dmx512: data: "0 / 0x0"
153466-153655 dmx512: interframe: "Interframe"
153655-153702 dmx512: startbit: "Start bit"
153702-153749 dmx512: bit: "0"
153749-153796 dmx512: bit: "0"
153796-153843 dmx512: bit: "0"
153843-153890 dmx512: bit: "0"
153890-153937 dmx512: bit: "0"
153937-153984 dmx512: bit: "0"
153984-154031 dmx512: bit: "0"
154031-154078 dmx512: bit: "0"
154078-154125 dmx512: stopbits: "Stop bit"
154125-154172 dmx512: stopbits: "Stop bit"
153655-154172 dmx512: channel: "Channel 16"
153702-154078 dmx512: data: "0 / 0x0"
154172-154361 dmx512: interframe: "Interframe"
154361-154408 dmx512: startbit: "Start bit"
154408-154455 dmx512: bit: "0"
154455-154502 dmx512: bit: "0"
154502-154549 dmx512: bit: "0"
154549-154596 dmx512: bit: "0"
154596-154643 dmx512: bit: "0"
154643-154690 dmx512: bit: "0"
154690-154737 dmx512: bit: "0"
154737-154784 dmx512: bit: "0"
154784-154831 dmx512: stopbits: "Stop bit"
154831-154878 dmx512: stopbits: "Stop bit"
154361-154878 dmx512: channel: "Channel 17"
154408-154784 dmx512: data: "0 / 0x0"
154878-155067 dmx512: interframe: "Interframe"
155067-155114 dmx512: startbit: "Start bit"
155114-155161 dmx512: bit: "0"
155161-155208 dmx512: bit: "0"
155208-155255 dmx512: bit: "0"
155255-155302 dmx512: bit: "0"
155302-155349 dmx512: bit: "0"
155349-155396 dmx512: bit: "0"
155396-155443 dmx512: bit: "0"
155443-155490 dmx512: bit: "0"
155490-155537 dmx512: stopbits: "Stop bit"
155537-155584 dmx512: stopbits: "Stop bit"
155067-155584 dmx512: channel: "Channel 18"
155114-155490 dmx512: data: "0 / 0x0"
155584-155773 dmx512: interframe: "Interframe"
155773-155820 dmx512: startbit: "Start bit"
155820-155867 dmx512: bit: "0"
155867-155914 dmx512: bit: "0"
155914-155961 dmx512: bit: "0"
155961-156008 dmx512: bit: "0"
156008-156055 dmx512: bit: "0"
156055-156102 dmx512: bit: "0"
156102-156149 dmx512: bit: "0"
156149-156196 dmx512: bit: "0"
156196-156243 dmx512: stopbits: "Stop bit"
156243-156290 dmx512: stopbits: "Stop bit"
155773-156290 dmx512: channel: "Channel 19"
155820-156196 dmx512: data: "0 / 0x0"
156290-156479 dmx512: interframe: "Interframe"
156479-156526 dmx512: startbit: "Start bit"
156526-156573 dmx512: bit: "0"
156573-156620 dmx512: bit: "0"
156620-156667 dmx512: bit: "0"
156667-156714 dmx512: bit: "0"
156714-156761 dmx512: bit: "0"
156761-156808 dmx512: bit: "0"
156808-156855 dmx512: bit: "0"
156855-156902 dmx512: bit: "0"
156902-156949 dmx512: stopbits: "Stop bit"
156949-156996 dmx512: stopbits: "Stop bit"
156479-156996 dmx512: channel: "Channel 20"
156526-156902 dmx512: data: "0 / 0x0"
156996-157186 dmx512: interframe: "Interframe"
157186-157233 dmx512: startbit: "Start bit"
157233-157280 dmx512: bit: "0"
157280-157327 dmx512: bit: "0"
157327-157374 dmx512: bit: "0"
157374-157421 dmx512: bit: "0"
157421-157468 dmx512: bit: "0"
157468-157515 dmx512: bit: "0"
157515-157562 dmx512: bit: "0"
157562-157609 dmx512: bit: "0"
157609-157656 dmx512: stopbits: "Stop bit"
157656-157703 dmx512: stopbits: "Stop bit"
157186-157703 dmx512: channel: "Channel 21"
157233-157609 dmx512: data: "0 / 0x0"
157703-157892 dmx512: interframe: "Interframe"
157892-157939 dmx512: startbit: "Start bit"
157939-157986 dmx512: bit: "0"
157986-158033 dmx512: bit: "0"
158033-158080 dmx512: bit: "0"
158080-158127 dmx512: bit: "0"
158127-158174 dmx512: bit: "0"
158174-158221 dmx512: bit: "0"
158221-158268 dmx512: bit: "0"
158268-158315 dmx512: bit: "0"
158315-158362 dmx512: stopbits: "Stop bit"
158362-158409 dmx512: stopbits: "Stop bit"
157892-158409 dmx512: channel: "Channel 22"
157939-158315 dmx512: data: "0 / 0x0"
158409-158598 dmx512: interframe: "Interframe"
158598-158645 dmx512: startbit: "Start bit"
158645-158692 dmx512: bit: "0"
158692-158739 dmx512: bit: "0"
158739-158786 dmx512: bit: "0"
158786-158833 dmx512: bit: "0"
158833-158880 dmx512: bit: "0"
158880-158927 dmx512: bit: "0"
158927-158974 dmx512: bit: "0"
158974-159021 dmx512: bit: "0"
159021-159068 dmx512: stopbits: "Stop bit"
159068-159115 dmx512: stopbits: "Stop bit"
158598-159115 dmx512: channel: "Channel 23"
158645-159021 dmx512: data: "0 / 0x0"
159115-159304 dmx512: interframe: "Interframe"
159304-159351 dmx512: startbit: "Start bit"
159351-159398 dmx512: bit: "0"
159398-159445 dmx512: bit: "0"
159445-159492 dmx512: bit: "0"
159492-159539 dmx512: bit: "0"
159539-159586 dmx512: bit: "0"
159586-159633 dmx512: bit: "0"
159633-159680 dmx512: bit: "0"
159680-159727 dmx512: bit: "0"
159727-159774 dmx512: stopbits: "Stop bit"
159774-159821 dmx512: stopbits: "Stop bit"
159304-159821 dmx512: channel: "Channel 24"
159351-159727 dmx512: data: "0 / 0x0"
159821-160010 dmx512: interframe: "Interframe"
160010-160057 dmx512: startbit: "Start bit"
160057-160104 dmx512: bit: "0"
160104-160151 dmx512: bit: "0"
160151-160198 dmx512: bit: "0"
160198-160245 dmx512: bit: "0"
160245-160292 dmx512: bit: "0"
160292-160339 dmx512: bit: "0"
160339-160386 dmx512: bit: "0"
160386-160433 dmx512: bit: "0"
160433-160480 dmx512: stopbits: "Stop bit"
160480-160527 dmx512: stopbits: "Stop bit"
160010-160527 dmx512: channel: "Channel 25"
160057-160433 dmx512: data: "0 / 0x0"
160527-160716 dmx512: interframe: "Interframe"
160716-160763 dmx512: startbit: "Start bit"
160763-160810 dmx512: bit: "0"
160810-160857 dmx512: bit: "0"
160857-160904 dmx512: bit: "0"
160904-160951 dmx512: bit: "0"
160951-160998 dmx512: bit: "0"
160998-161045 dmx512: bit: "0"
161045-161092 dmx512: bit: "0"
161092-161139 dmx512: bit: "0"
161139-161186 dmx512: stopbits: "Stop bit"
161186-161233 dmx512: stopbits: "Stop bit"
160716-161233 dmx512: channel: "Channel 26"
160763-161139 dmx512: data: "0 / 0x0"
161233-161423 dmx512: interframe: "Interframe"
161423-161470 dmx512: startbit: "Start bit"
161470-161517 dmx512: bit: "0"
161517-161564 dmx512: bit: "0"
161564-161611 dmx512: bit: "0"
161611-161658 dmx512: bit: "0"
161658-161705 dmx512: bit: "0"
161705-161752 dmx512: bit: "0"
161752-161799 dmx512: bit: "0"
161799-161846 dmx512: bit: "0"
161846-161893 dmx512: stopbits: "Stop bit"
161893-161940 dmx512: stopbits: "Stop bit"
161423-161940 dmx512: channel: "Channel 27"
161470-161846 dmx512: data: "0 / 0x0"
161940-162129 dmx512: interframe: "Interframe"
162129-162176 dmx512: startbit: "Start bit"
162176-162223 dmx512: bit: "0"
162223-162270 dmx512: bit: "0"
162270-162317 dmx512: bit: "0"
162317-162364 dmx512: bit: "0"
162364-162411 dmx512: bit: "0"
162411-162458 dmx512: bit: "0"
162458-162505 dmx512: bit: "0"
162505-162552 dmx512: bit: "0"
162552-162599 dmx512: stopbits: "Stop bit"
162599-162646 dmx512: stopbits: "Stop bit"
162129-162646 dmx512: channel: "Channel 28"
162176-162552 dmx512: data: "0 / 0x0"
162646-162835 dmx512: interframe: "Interframe"
162835-162882 dmx512: startbit: "Start bit"
162882-162929 dmx512: bit: "0"
162929-162976 dmx512: bit: "0"
162976-163023 dmx512: bit: "0"
163023-163070 dmx512: bit: "0"
163070-163117 dmx512: bit: "0"
163117-163164 dmx512: bit: "0"
163164-163211 dmx512: bit: "0"
163211-163258 dmx512: bit: "0"
163258-163305 dmx512: stopbits: "Stop bit"
163305-163352 dmx512: stopbits: "Stop bit"
162835-163352 dmx512: channel: "Channel 29"
162882-163258 dmx512: data: "0 / 0x0"
163352-163541 dmx512: interframe: "Interframe"
163541-163588 dmx512: startbit: "Start bit"
163588-163635 dmx512: bit: "0"
163635-163682 dmx512: bit: "0"
163682-163729 dmx512: bit: "0"
163729-163776 dmx512: bit: "0"
163776-163823 dmx512: bit: "0"
163823-163870 dmx512: bit: "0"
163870-163917 dmx512: bit: "0"
163917-163964 dmx512: bit: "0"
163964-164011 dmx512: stopbits: "Stop bit"
164011-164058 dmx512: stopbits: "Stop bit"
163541-164058 dmx512: channel: "Channel 30"
163588-163964 dmx512: data: "0 / 0x0"
164058-164247 dmx512: interframe: "Interframe"
164247-164294 dmx512: startbit: "Start bit"
164294-164341 dmx512: bit: "0"
164341-164388 dmx512: bit: "0"
164388-164435 dmx512: bit: "0"
164435-164482 dmx512: bit: "0"
164482-164529 dmx512: bit: "0"
164529-164576 dmx512: bit: "0"
164576-164623 dmx512: bit: "0"
164623-164670 dmx512: bit: "0"
164670-164717 dmx512: stopbits: "Stop bit"
164717-164764 dmx512: stopbits: "Stop bit"
164247-164764 dmx512: channel: "Channel 31"
164294-164670 dmx512: data: "0 / 0x0"
164764-164953 dmx512: interframe: "Interframe"
164953-165000 dmx512: startbit: "Start bit"
165000-165047 dmx512: bit: "0"
165047-165094 dmx512: bit: "0"
165094-165141 dmx512: bit: "0"
165141-165188 dmx512: bit: "0"
165188-165235 dmx512: bit: "0"
165235-165282 dmx512: bit: "0"
165282-165329 dmx512: bit: "0"
165329-165376 dmx512: bit: "0"
165376-165423 dmx512: stopbits: "Stop bit"
165423-165470 dmx512: stopbits: "Stop bit"
164953-165470 dmx512: channel: "Channel 32"
165000-165376 dmx512: data: "0 / 0x0"
165470-165660 dmx512: interframe: "Interframe"
165660-165707 dmx512: startbit: "Start bit"
165707-165754 dmx512: bit: "0"
165754-165801 dmx512: bit: "0"
165801-165848 dmx512: bit: "0"
165848-165895 dmx512: bit: "0"
165895-165942 dmx512: bit: "0"
165942-165989 dmx512: bit: "0"
165989-166036 dmx512: bit: "0"
166036-166083 dmx512: bit: "0"
166083-166130 dmx512: stopbits: "Stop bit"
166130-166177 dmx512: stopbits: "Stop bit"
165660-166177 dmx512: channel: "Channel 33"
165707-166083 dmx512: data: "0 / 0x0"
166177-166366 dmx512: interframe: "Interframe"
166366-166413 dmx512: startbit: "Start bit"
166413-166460 dmx512: bit: "0"
166460-166507 dmx512: bit: "0"
166507-166554 dmx512: bit: "0"
166554-166601 dmx512: bit: "0"
166601-166648 dmx512: bit: "0"
166648-166695 dmx512: bit: "0"
166695-166742 dmx512: bit: "0"
166742-166789 dmx512: bit: "0"
166789-166836 dmx512: stopbits: "Stop bit"
166836-166883 dmx512: stopbits: "Stop bit"
166366-166883 dmx512: channel: "Channel 34"
166413-166789 dmx512: data: "0 / 0x0"
166883-167072 dmx512: interframe: "Interframe"
167072-167119 dmx512: startbit: "Start bit"
167119-167166 dmx512: bit: "0"
167166-167213 dmx512: bit: "0"
167213-167260 dmx512: bit: "0"
167260-167307 dmx512: bit: "0"
167307-167354 dmx512: bit: "0"
167354-167401 dmx512: bit: "0"
167401-167448 dmx512: bit: "0"
167448-167495 dmx512: bit: "0"
167495-167542 dmx512: stopbits: "Stop bit"
167542-167589 dmx512: stopbits: "Stop bit"
167072-167589 dmx512: channel: "Channel 35"
167119-167495 dmx512: data: "0 / 0x0"
167589-167778 dmx512: interframe: "Interframe"
167778-167825 dmx512: startbit: "Start bit"
167825-167872 dmx512: bit: "0"
167872-167919 dmx512: bit: "0"
167919-167966 dmx512: bit: "0"
167966-168013 dmx512: bit: "0"
168013-168060 dmx512: bit: "0"
168060-168107 dmx512: bit: "0"
168107-168154 dmx512: bit: "0"
168154-168201 dmx512: bit: "0"
168201-168248 dmx512: stopbits: "Stop bit"
168248-168295 dmx512: stopbits: "Stop bit"
167778-168295 dmx512: channel: "Channel 36"
167825-168201 dmx512: data: "0 / 0x0"
168295-168484 dmx512: interframe: "Interframe"
168484-168531 dmx512: startbit: "Start bit"
168531-168578 dmx512: bit: "0"
168578-168625 dmx512: bit: "0"
168625-168672 dmx512: bit: "0"
168672-168719 dmx512: bit: "0"
168719-168766 dmx512: bit: "0"
168766-168813 dmx512: bit: "0"
168813-168860 dmx512: bit: "0"
168860-168907 dmx512: bit: "0"
168907-168954 dmx512: stopbits: "Stop bit"
168954-169001 dmx512: stopbits: "Stop bit"
168484-169001 dmx512: channel: "Channel 37"
168531-168907 dmx512: data: "0 / 0x0"
169001-169190 dmx512: interframe: "Interframe"
169190-169237 dmx512: startbit: "Start bit"
169237-169284 dmx512: bit: "0"
169284-169331 dmx512: bit: "0"
169331-169378 dmx512: bit: "0"
169378-169425 dmx512: bit: "0"
169425-169472 dmx512: bit: "0"
169472-169519 dmx512: bit: "0"
169519-169566 dmx512: bit: "0"
169566-169613 dmx512: bit: "0"
169613-169660 dmx512: stopbits: "Stop bit"
169660-169707 dmx512: stopbits: "Stop bit"
169190-169707 dmx512: channel: "Channel 38"
169237-169613 dmx512: data: "0 / 0x0"
169707-169896 dmx512: interframe: "Interframe"
169896-169943 dmx512: startbit: "Start bit"
169943-169990 dmx512: bit: "0"
169990-170037 dmx512: bit: "0"
170037-170084 dmx512: bit: "0"
170084-170131 dmx512: bit: "0"
170131-170178 dmx512: bit: "0"
170178-170225 dmx512: bit: "0"
170225-170272 dmx512: bit: "0"
170272-170319 dmx512: bit: "0"
170319-170366 dmx512: stopbits: "Stop bit"
170366-170413 dmx512: stopbits: "Stop bit"
169896-170413 dmx512: channel: "Channel 39"
169943-170319 dmx512: data: "0 / 0x0"
170413-170603 dmx512: interframe: "Interframe"
170603-170650 dmx512: startbit: "Start bit"
170650-170697 dmx512: bit: "0"
170697-170744 dmx512: bit: "0"
170744-170791 dmx512: bit: "0"
170791-170838 dmx512: bit: "0"
170838-170885 dmx512: bit: "0"
170885-170932 dmx512: bit: "0"
170932-170979 dmx512: bit: "0"
170979-171026 dmx512: bit: "0"
171026-171073 dmx512: stopbits: "Stop bit"
171073-171120 dmx512: stopbits: "Stop bit"
170603-171120 dmx512: channel: "Channel 40"
170650-171026 dmx512: data: "0 / 0x0"
171120-171309 dmx512: interframe: "Interframe"
171309-171356 dmx512: startbit: "Start bit"
171356-171403 dmx512: bit: "0"
171403-171450 dmx512: bit: "0"
171450-171497 dmx512: bit: "0"
171497-171544 dmx512: bit: "0"
171544-171591 dmx512: bit: "0"
171591-171638 dmx512: bit: "0"
171638-171685 dmx512: bit: "0"
171685-171732 dmx512: bit: "0"
171732-171779 dmx512: stopbits: "Stop bit"
171779-171826 dmx512: stopbits: "Stop bit"
171309-171826 dmx512: channel: "Channel 41"
171356-171732 dmx512: data: "0 / 0x0"
171826-172015 dmx512: interframe: "Interframe"
172015-172062 dmx512: startbit: "Start bit"
172062-172109 dmx512: bit: "0"
172109-172156 dmx512: bit: "0"
172156-172203 dmx512: bit: "0"
172203-172250 dmx512: bit: "0"
172250-172297 dmx512: bit: "0"
172297-172344 dmx512: bit: "0"
172344-172391 dmx512: bit: "0"
172391-172438 dmx512: bit: "0"
172438-172485 dmx512: stopbits: "Stop bit"
172485-172532 dmx512: stopbits: "Stop bit"
172015-172532 dmx512: channel: "Channel 42"
172062-172438 dmx512: data: "0 / 0x0"
172532-172721 dmx512: interframe: "Interframe"
172721-172768 dmx512: startbit: "Start bit"
172768-172815 dmx512: bit: "0"
172815-172862 dmx512: bit: "0"
172862-172909 dmx512: bit: "0"
172909-172956 dmx512: bit: "0"
172956-173003 dmx512: bit: "0"
173003-173050 dmx512: bit: "0"
173050-173097 dmx512: bit: "0"
173097-173144 dmx512: bit: "0"
173144-173191 dmx512: stopbits: "Stop bit"
173191-173238 dmx512: stopbits: "Stop bit"
172721-173238 dmx512: channel: "Channel 43"
172768-173144 dmx512: data: "0 / 0x0"
173238-173427 dmx512: interframe: "Interframe"
173427-173474 dmx512: startbit: "Start bit"
173474-173521 dmx512: bit: "0"
173521-173568 dmx512: bit: "0"
173568-173615 dmx512: bit: "0"
173615-173662 dmx512: bit: "0"
173662-173709 dmx512: bit: "0"
173709-173756 dmx512: bit: "0"
173756-173803 dmx512: bit: "0"
173803-173850 dmx512: bit: "0"
173850-173897 dmx512: stopbits: "Stop bit"
173897-173944 dmx512: stopbits: "Stop bit"
173427-173944 dmx512: channel: "Channel 44"
173474-173850 dmx512: data: "0 / 0x0"
173944-174133 dmx512: interframe: "Interframe"
174133-174180 dmx512: startbit: "Start bit"
174180-174227 dmx512: bit: "0"
174227-174274 dmx512: bit: "0"
174274-174321 dmx512: bit: "0"
174321-174368 dmx512: bit: "0"
174368-174415 dmx512: bit: "0"
174415-174462 dmx512: bit: "0"
174462-174509 dmx512: bit: "0"
174509-174556 dmx512: bit: "0"
174556-174603 dmx512: stopbits: "Stop bit"
174603-174650 dmx512: stopbits: "Stop bit"
174133-174650 dmx512: channel: "Channel 45"
174180-174556 dmx512: data: "0 / 0x0"
174650-174840 dmx512: interframe: "Interframe"
174840-174887 dmx512: startbit: "Start bit"
174887-174934 dmx512: bit: "0"
174934-174981 dmx512: bit: "0"
174981-175028 dmx512: bit: "0"
175028-175075 dmx512: bit: "0"
175075-175122 dmx512: bit: "0"
175122-175169 dmx512: bit: "0"
175169-175216 dmx512: bit: "0"
175216-175263 dmx512: bit: "0"
175263-175310 dmx512: stopbits: "Stop bit"
175310-175357 dmx512: stopbits: "Stop bit"
174840-175357 dmx512: channel: "Channel 46"
174887-175263 dmx512: data: "0 / 0x0"
175357-175546 dmx512: interframe: "Interframe"
175546-175593 dmx512: startbit: "Start bit"
175593-175640 dmx512: bit: "0"
175640-175687 dmx512: bit: "0"
175687-175734 dmx512: bit: "0"
175734-175781 dmx512: bit: "0"
175781-175828 dmx512: bit: "0"
175828-175875 dmx512: bit: "0"
175875-175922 dmx512: bit: "0"
175922-175969 dmx512: bit: "0"
175969-176016 dmx512: stopbits: "Stop bit"
176016-176063 dmx512: stopbits: "Stop bit"
175546-176063 dmx512: channel: "Channel 47"
175593-175969 dmx512: data: "0 / 0x0"
176063-176252 dmx512: interframe: "Interframe"
176252-176299 dmx512: startbit: "Start bit"
176299-176346 dmx512: bit: "0"
176346-176393 dmx512: bit: "0"
176393-176440 dmx512: bit: "0"
176440-176487 dmx512: bit: "0"
176487-176534 dmx512: bit: "0"
176534-176581 dmx512: bit: "0"
176581-176628 dmx512: bit: "0"
176628-176675 dmx512: bit: "0"
176675-176722 dmx512: stopbits: "Stop bit"
176722-176769 dmx512: stopbits: "Stop bit"
176252-176769 dmx512: channel: "Channel 48"
176299-176675 dmx512: data: "0 / 0x0"
176769-176958 dmx512: interframe: "Interframe"
176958-177005 dmx512: startbit: "Start bit"
177005-177052 dmx512: bit: "0"
177052-177099 dmx512: bit: "0"
177099-177146 dmx512: bit: "0"
177146-177193 dmx512: bit: "0"
177193-177240 dmx512: bit: "0"
177240-177287 dmx512: bit: "0"
177287-177334 dmx512: bit: "0"
177334-177381 dmx512: bit: "0"
177381-177428 dmx512: stopbits: "Stop bit"
177428-177475 dmx512: stopbits: "Stop bit"
176958-177475 dmx512: channel: "Channel 49"
177005-177381 dmx512: data: "0 / 0x0"
177475-177664 dmx512: interframe: "Interframe"
177664-177711 dmx512: startbit: "Start bit"
177711-177758 dmx512: bit: "0"
177758-177805 dmx512: bit: "0"
177805-177852 dmx512: bit: "0"
177852-177899 dmx512: bit: "0"
177899-177946 dmx512: bit: "0"
177946-177993 dmx512: bit: "0"
177993-178040 dmx512: bit: "0"
178040-178087 dmx512: bit: "0"
178087-178134 dmx512: stopbits: "Stop bit"
178134-178181 dmx512: stopbits: "Stop bit"
177664-178181 dmx512: channel: "Channel 50"
177711-178087 dmx512: data: "0 / 0x0"
178181-178370 dmx512: interframe: "Interframe"
178370-178417 dmx512: startbit: "Start bit"
178417-178464 dmx512: bit: "0"
178464-178511 dmx512: bit: "0"
178511-178558 dmx512: bit: "0"
178558-178605 dmx512: bit: "0"
178605-178652 dmx512: bit: "0"
178652-178699 dmx512: bit: "0"
178699-178746 dmx512: bit: "0"
178746-178793 dmx512: bit: "0"
178793-178840 dmx512: stopbits: "Stop bit"
178840-178887 dmx512: stopbits: "Stop bit"
178370-178887 dmx512: channel: "Channel 51"
178417-178793 dmx512: data: "0 / 0x0"
178887-179077 dmx512: interframe: "Interframe"
179077-179124 dmx512: startbit: "Start bit"
179124-179171 dmx512: bit: "0"
179171-179218 dmx512: bit: "0"
179218-179265 dmx512: bit: "0"
179265-179312 dmx512: bit: "0"
179312-179359 dmx512: bit: "0"
179359-179406 dmx512: bit: "0"
179406-179453 dmx512: bit: "0"
179453-179500 dmx512: bit: "0"
179500-179547 dmx512: stopbits: "Stop bit"
179547-179594 dmx512: stopbits: "Stop bit"
179077-179594 dmx512: channel: "Channel 52"
179124-179500 dmx512: data: "0 / 0x0"
179594-179783 dmx512: interframe: "Interframe"
179783-179830 dmx512: startbit: "Start bit"
179830-179877 dmx512: bit: "0"
179877-179924 dmx512: bit: "0"
179924-179971 dmx512: bit: "0"
179971-180018 dmx512: bit: "0"
180018-180065 dmx512: bit: "0"
180065-180112 dmx512: bit: "0"
180112-180159 dmx512: bit: "0"
180159-180206 dmx512: bit: "0"
180206-180253 dmx512: stopbits: "Stop bit"
180253-180300 dmx512: stopbits: "Stop bit"
179783-180300 dmx512: channel: "Channel 53"
179830-180206 dmx512: data: "0 / 0x0"
180300-180489 dmx512: interframe: "Interframe"
180489-180536 dmx512: startbit: "Start bit"
180536-180583 dmx512: bit: "0"
180583-180630 dmx512: bit: "0"
180630-180677 dmx512: bit: "0"
180677-180724 dmx512: bit: "0"
180724-180771 dmx512: bit: "0"
180771-180818 dmx512: bit: "0"
180818-180865 dmx512: bit: "0"
180865-180912 dmx512: bit: "0"
180912-180959 dmx512: stopbits: "Stop bit"
180959-181006 dmx512: stopbits: "Stop bit"
180489-181006 dmx512: channel: "Channel 54"
180536-180912 dmx512: data: "0 / 0x0"
181006-181195 dmx512: interframe: "Interframe"
181195-181242 dmx512: startbit: "Start bit"
181242-181289 dmx512: bit: "0"
181289-181336 dmx512: bit: "0"
181336-181383 dmx512: bit: "0"
181383-181430 dmx512: bit: "0"
181430-181477 dmx512: bit: "0"
181477-181524 dmx512: bit: "0"
181524-181571 dmx512: bit: "0"
181571-181618 dmx512: bit: "0"
181618-181665 dmx512: stopbits: "Stop bit"
181665-181712 dmx512: stopbits: "Stop bit"
181195-181712 dmx512: channel: "Channel 55"
181242-181618 dmx512: data: "0 / 0x0"
181712-181901 dmx512: interframe: "Interframe"
181901-181948 dmx512: startbit: "Start bit"
181948-181995 dmx512: bit: "0"
181995-182042 dmx512: bit: "0"
182042-182089 dmx512: bit: "0"
182089-182136 dmx512: bit: "0"
182136-182183 dmx512: bit: "0"
182183-182230 dmx512: bit: "0"
182230-182277 dmx512: bit: "0"
182277-182324 dmx512: bit: "0"
182324-182371 dmx512: stopbits: "Stop bit"
182371-182418 dmx512: stopbits: "Stop bit"
181901-182418 dmx512: channel: "Channel 56"
181948-182324 dmx512: data: "0 / 0x0"
182418-182607 dmx512: interframe: "Interframe"
182607-182654 dmx512: startbit: "Start bit"
182654-182701 dmx512: bit: "0"
182701-182748 dmx512: bit: "0"
182748-182795 dmx512: bit: "0"
182795-182842 dmx512: bit: "0"
182842-182889 dmx512: bit: "0"
182889-182936 dmx512: bit: "0"
182936-182983 dmx512: bit: "0"
182983-183030 dmx512: bit: "0"
183030-183077 dmx512: stopbits: "Stop bit"
183077-183124 dmx512: stopbits: "Stop bit"
182607-183124 dmx512: channel: "Channel 57"
182654-183030 dmx512: data: "0 / 0x0"
183124-183314 dmx512: interframe: "Interframe"
183314-183361 dmx512: startbit: "Start bit"
183361-183408 dmx512: bit: "0"
183408-183455 dmx512: bit: "0"
183455-183502 dmx512: bit: "0"
183502-183549 dmx512: bit: "0"
183549-183596 dmx512: bit: "0"
183596-183643 dmx512: bit: "0"
183643-183690 dmx512: bit: "0"
183690-183737 dmx512: bit: "0"
183737-183784 dmx512: stopbits: "Stop bit"
183784-183831 dmx512: stopbits: "Stop bit"
183314-183831 dmx512: channel: "Channel 58"
183361-183737 dmx512: data: "0 / 0x0"
183831-184020 dmx512: interframe: "Interframe"
184020-184067 dmx512: startbit: "Start bit"
184067-184114 dmx512: bit: "0"
184114-184161 dmx512: bit: "0"
184161-184208 dmx512: bit: "0"
184208-184255 dmx512: bit: "0"
184255-184302 dmx512: bit: "0"
184302-184349 dmx512: bit: "0"
184349-184396 dmx512: bit: "0"
184396-184443 dmx512: bit: "0"
184443-184490 dmx512: stopbits: "Stop bit"
184490-184537 dmx512: stopbits: "Stop bit"
184020-184537 dmx512: channel: "Channel 59"
184067-184443 dmx512: data: "0 / 0x0"
184537-184726 dmx512: interframe: "Interframe"
184726-184773 dmx512: startbit: "Start bit"
184773-184820 dmx512: bit: "0"
184820-184867 dmx512: bit: "0"
184867-184914 dmx512: bit: "0"
184914-184961 dmx512: bit: "0"
184961-185008 dmx512: bit: "0"
185008-185055 dmx512: bit: "0"
185055-185102 dmx512: bit: "0"
185102-185149 dmx512: bit: "0"
185149-185196 dmx512: stopbits: "Stop bit"
185196-185243 dmx512: stopbits: "Stop bit"
184726-185243 dmx512: channel: "Channel 60"
184773-185149 dmx512: data: "0 / 0x0"
185243-185432 dmx512: interframe: "Interframe"
185432-185479 dmx512: startbit: "Start bit"
185479-185526 dmx512: bit: "0"
185526-185573 dmx512: bit: "0"
185573-185620 dmx512: bit: "0"
185620-185667 dmx512: bit: "0"
185667-185714 dmx512: bit: "0"
185714-185761 dmx512: bit: "0"
185761-185808 dmx512: bit: "0"
185808-185855 dmx512: bit: "0"
185855-185902 dmx512: stopbits: "Stop bit"
185902-185949 dmx512: stopbits: "Stop bit"
185432-185949 dmx512: channel: "Channel 61"
185479-185855 dmx512: data: "0 / 0x0"
185949-186138 dmx512: interframe: "Interframe"
186138-186185 dmx512: startbit: "Start bit"
186185-186232 dmx512: bit: "0"
186232-186279 dmx512: bit: "0"
186279-186326 dmx512: bit: "0"
186326-186373 dmx512: bit: "0"
186373-186420 dmx512: bit: "0"
186420-186467 dmx512: bit: "0"
186467-186514 dmx512: bit: "0"
186514-186561 dmx512: bit: "0"
186561-186608 dmx512: stopbits: "Stop bit"
186608-186655 dmx512: stopbits: "Stop bit"
186138-186655 dmx512: channel: "Channel 62"
186185-186561 dmx512: data: "0 / 0x0"
186655-186844 dmx512: interframe: "Interframe"
186844-186891 dmx512: startbit: "Start bit"
186891-186938 dmx512: bit: "0"
186938-186985 dmx512: bit: "0"
186985-187032 dmx512: bit: "0"
187032-187079 dmx512: bit: "0"
187079-187126 dmx512: bit: "0"
187126-187173 dmx512: bit: "0"
187173-187220 dmx512: bit: "0"
187220-187267 dmx512: bit: "0"
187267-187314 dmx512: stopbits: "Stop bit"
187314-187361 dmx512: stopbits: "Stop bit"
186844-187361 dmx512: channel: "Channel 63"
186891-187267 dmx512: data: "0 / 0x0"
187361-187551 dmx512: interframe: "Interframe"
187551-187598 dmx512: startbit: "Start bit"
187598-187645 dmx512: bit: "0"
187645-187692 dmx512: bit: "0"
187692-187739 dmx512: bit: "0"
187739-187786 dmx512: bit: "0"
187786-187833 dmx512: bit: "0"
187833-187880 dmx512: bit: "0"
187880-187927 dmx512: bit: "0"
187927-187974 dmx512: bit: "0"
187974-188021 dmx512: stopbits: "Stop bit"
188021-188068 dmx512: stopbits: "Stop bit"
187551-188068 dmx512: channel: "Channel 64"
187598-187974 dmx512: data: "0 / 0x0"
188068-188257 dmx512: interframe: "Interframe"
188257-188304 dmx512: startbit: "Start bit"
188304-188351 dmx512: bit: "0"
188351-188398 dmx512: bit: "0"
188398-188445 dmx512: bit: "0"
188445-188492 dmx512: bit: "0"
188492-188539 dmx512: bit: "0"
188539-188586 dmx512: bit: "0"
188586-188633 dmx512: bit: "0"
188633-188680 dmx512: bit: "0"
188680-188727 dmx512: stopbits: "Stop bit"
188727-188774 dmx512: stopbits: "Stop bit"
188257-188774 dmx512: channel: "Channel 65"
188304-188680 dmx512: data: "0 / 0x0"
188774-188963 dmx512: interframe: "Interframe"
188963-189010 dmx512: startbit: "Start bit"
189010-189057 dmx512: bit: "0"
189057-189104 dmx512: bit: "0"
189104-189151 dmx512: bit: "0"
189151-189198 dmx512: bit: "0"
189198-189245 dmx512: bit: "0"
189245-189292 dmx512: bit: "0"
189292-189339 dmx512: bit: "0"
189339-189386 dmx512: bit: "0"
189386-189433 dmx512: stopbits: "Stop bit"
189433-189480 dmx512: stopbits: "Stop bit"
188963-189480 dmx512: channel: "Channel 66"
189010-189386 dmx512: data: "0 / 0x0"
189480-189669 dmx512: interframe: "Interframe"
189669-189716 dmx512: startbit: "Start bit"
189716-189763 dmx512: bit: "0"
189763-189810 dmx512: bit: "0"
189810-189857 dmx512: bit: "0"
189857-189904 dmx512: bit: "0"
189904-189951 dmx512: bit: "0"
189951-189998 dmx512: bit: "0"
189998-190045 dmx512: bit: "0"
190045-190092 dmx512: bit: "0"
190092-190139 dmx512: stopbits: "Stop bit"
190139-190186 dmx512: stopbits: "Stop bit"
189669-190186 dmx512: channel: "Channel 67"
189716-190092 dmx512: data: "0 / 0x0"
190186-190375 dmx512: interframe: "Interframe"
190375-190422 dmx512: startbit: "Start bit"
190422-190469 dmx512: bit: "0"
190469-190516 dmx512: bit: "0"
190516-190563 dmx512: bit: "0"
190563-190610 dmx512: bit: "0"
190610-190657 dmx512: bit: "0"
190657-190704 dmx512: bit: "0"
190704-190751 dmx512: bit: "0"
190751-190798 dmx512: bit: "0"
190798-190845 dmx512: stopbits: "Stop bit"
190845-190892 dmx512: stopbits: "Stop bit"
190375-190892 dmx512: channel: "Channel 68"
190422-190798 dmx512: data: "0 / 0x0"
190892-191081 dmx512: interframe: "Interframe"
191081-191128 dmx512: startbit: "Start bit"
191128-191175 dmx512: bit: "0"
191175-191222 dmx512: bit: "0"
191222-191269 dmx512: bit: "0"
191269-191316 dmx512: bit: "0"
191316-191363 dmx512: bit: "0"
191363-191410 dmx512: bit: "0"
191410-191457 dmx512: bit: "0"
191457-191504 dmx512: bit: "0"
191504-191551 dmx512: stopbits: "Stop bit"
191551-191598 dmx512: stopbits: "Stop bit"
191081-191598 dmx512: channel: "Channel 69"
191128-191504 dmx512: data: "0 / 0x0"
191598-191787 dmx512: interframe: "Interframe"
191787-191834 dmx512: startbit: "Start bit"
191834-191881 dmx512: bit: "0"
191881-191928 dmx512: bit: "0"
191928-191975 dmx512: bit: "0"
191975-192022 dmx512: bit: "0"
192022-192069 dmx512: bit: "0"
192069-192116 dmx512: bit: "0"
192116-192163 dmx512: bit: "0"
192163-192210 dmx512: bit: "0"
192210-192257 dmx512: stopbits: "Stop bit"
192257-192304 dmx512: stopbits: "Stop bit"
191787-192304 dmx512: channel: "Channel 70"
191834-192210 dmx512: data: "0 / 0x0"
192304-192494 dmx512: interframe: "Interframe"
192494-192541 dmx512: startbit: "Start bit"
192541-192588 dmx512: bit: "0"
192588-192635 dmx512: bit: "0"
192635-192682 dmx512: bit: "0"
192682-192729 dmx512: bit: "0"
192729-192776 dmx512: bit: "0"
192776-192823 dmx512: bit: "0"
192823-192870 dmx512: bit: "0"
192870-192917 dmx512: bit: "0"
192917-192964 dmx512: stopbits: "Stop bit"
192964-193011 dmx512: stopbits: "Stop bit"
192494-193011 dmx512: channel: "Channel 71"
192541-192917 dmx512: data: "0 / 0x0"
193011-193200 dmx512: interframe: "Interframe"
193200-193247 dmx512: startbit: "Start bit"
193247-193294 dmx512: bit: "0"
193294-193341 dmx512: bit: "0"
193341-193388 dmx512: bit: "0"
193388-193435 dmx512: bit: "0"
193435-193482 dmx512: bit: "0"
193482-193529 dmx512: bit: "0"
193529-193576 dmx512: bit: "0"
193576-193623 dmx512: bit: "0"
193623-193670 dmx512: stopbits: "Stop bit"
193670-193717 dmx512: stopbits: "Stop bit"
193200-193717 dmx512: channel: "Channel 72"
193247-193623 dmx512: data: "0 / 0x0"
193717-193906 dmx512: interframe: "Interframe"
193906-193953 dmx512: startbit: "Start bit"
193953-194000 dmx512: bit: "0"
194000-194047 dmx512: bit: "0"
194047-194094 dmx512: bit: "0"
194094-194141 dmx512: bit: "0"
194141-194188 dmx512: bit: "0"
194188-194235 dmx512: bit: "0"
194235-194282 dmx512: bit: "0"
194282-194329 dmx512: bit: "0"
194329-194376 dmx512: stopbits: "Stop bit"
194376-194423 dmx512: stopbits: "Stop bit"
193906-194423 dmx512: channel: "Channel 73"
193953-194329 dmx512: data: "0 / 0x0"
194423-194612 dmx512: interframe: "Interframe"
194612-194659 dmx512: startbit: "Start bit"
194659-194706 dmx512: bit: "0"
194706-194753 dmx512: bit: "0"
194753-194800 dmx512: bit: "0"
194800-194847 dmx512: bit: "0"
194847-194894 dmx512: bit: "0"
194894-194941 dmx512: bit: "0"
194941-194988 dmx512: bit: "0"
194988-195035 dmx512: bit: "0"
195035-195082 dmx512: stopbits: "Stop bit"
195082-195129 dmx512: stopbits: "Stop bit"
194612-195129 dmx512: channel: "Channel 74"
194659-195035 dmx512: data: "0 / 0x0"
195129-195318 dmx512: interframe: "Interframe"
195318-195365 dmx512: startbit: "Start bit"
195365-195412 dmx512: bit: "0"
195412-195459 dmx512: bit: "0"
195459-195506 dmx512: bit: "0"
195506-195553 dmx512: bit: "0"
195553-195600 dmx512: bit: "0"
195600-195647 dmx512: bit: "0"
195647-195694 dmx512: bit: "0"
195694-195741 dmx512: bit: "0"
195741-195788 dmx512: stopbits: "Stop bit"
195788-195835 dmx512: stopbits: "Stop bit"
195318-195835 dmx512: channel: "Channel 75"
195365-195741 dmx512: data: "0 / 0x0"
195835-196024 dmx512: interframe: "Interframe"
196024-196071 dmx512: startbit: "Start bit"
196071-196118 dmx512: bit: "0"
196118-196165 dmx512: bit: "0"
196165-196212 dmx512: bit: "0"
196212-196259 dmx512: bit: "0"
196259-196306 dmx512: bit: "0"
196306-196353 dmx512: bit: "0"
196353-196400 dmx512: bit: "0"
196400-196447 dmx512: bit: "0"
196447-196494 dmx512: stopbits: "Stop bit"
196494-196541 dmx512: stopbits: "Stop bit"
196024-196541 dmx512: channel: "Channel 76"
196071-196447 dmx512: data: "0 / 0x0"
196541-196731 dmx512: interframe: "Interframe"
196731-196778 dmx512: startbit: "Start bit"
196778-196825 dmx512: bit: "0"
196825-196872 dmx512: bit: "0"
196872-196919 dmx512: bit: "0"
196919-196966 dmx512: bit: "0"
196966-197013 dmx512: bit: "0"
197013-197060 dmx512: bit: "0"
197060-197107 dmx512: bit: "0"
197107-197154 dmx512: bit: "0"
197154-197201 dmx512: stopbits: "Stop bit"
197201-197248 dmx512: stopbits: "Stop bit"
196731-197248 dmx512: channel: "Channel 77"
196778-197154 dmx512: data: "0 / 0x0"
197248-197437 dmx512: interframe: "Interframe"
197437-197484 dmx512: startbit: "Start bit"
197484-197531 dmx512: bit: "0"
197531-197578 dmx512: bit: "0"
197578-197625 dmx512: bit: "0"
197625-197672 dmx512: bit: "0"
197672-197719 dmx512: bit: "0"
197719-197766 dmx512: bit: "0"
197766-197813 dmx512: bit: "0"
197813-197860 dmx512: bit: "0"
197860-197907 dmx512: stopbits: "Stop bit"
197907-197954 dmx512: stopbits: "Stop bit"
197437-197954 dmx512: channel: "Channel 78"
197484-197860 dmx512: data: "0 / 0x0"
197954-198143 dmx512: interframe: "Interframe"
198143-198190 dmx512: startbit: "Start bit"
198190-198237 dmx512: bit: "0"
198237-198284 dmx512: bit: "0"
198284-198331 dmx512: bit: "0"
198331-198378 dmx512: bit: "0"
198378-198425 dmx512: bit: "0"
198425-198472 dmx512: bit: "0"
198472-198519 dmx512: bit: "0"
198519-198566 dmx512: bit: "0"
198566-198613 dmx512: stopbits: "Stop bit"
198613-198660 dmx512: stopbits: "Stop bit"
198143-198660 dmx512: channel: "Channel 79"
198190-198566 dmx512: data: "0 / 0x0"
198660-198849 dmx512: interframe: "Interframe"
198849-198896 dmx512: startbit: "Start bit"
198896-198943 dmx512: bit: "0"
198943-198990 dmx512: bit: "0"
198990-199037 dmx512: bit: "0"
199037-199084 dmx512: bit: "0"
199084-199131 dmx512: bit: "0"
199131-199178 dmx512: bit: "0"
199178-199225 dmx512: bit: "0"
199225-199272 dmx512: bit: "0"
199272-199319 dmx512: stopbits: "Stop bit"
199319-199366 dmx512: stopbits: "Stop bit"
198849-199366 dmx512: channel: "Channel 80"
198896-199272 dmx512: data: "0 / 0x0"
199366-199555 dmx512: interframe: "Interframe"
199555-199602 dmx512: startbit: "Start bit"
199602-199649 dmx512: bit: "0"
199649-199696 dmx512: bit: "0"
199696-199743 dmx512: bit: "0"
199743-199790 dmx512: bit: "0"
199790-199837 dmx512: bit: "0"
199837-199884 dmx512: bit: "0"
199884-199931 dmx512: bit: "0"
199931-199978 dmx512: bit: "0"
199978-200025 dmx512: stopbits: "Stop bit"
200025-200072 dmx512: stopbits: "Stop bit"
199555-200072 dmx512: channel: "Channel 81"
199602-199978 dmx512: data: "0 / 0x0"
200072-200261 dmx512: interframe: "Interframe"
200261-200308 dmx512: startbit: "Start bit"
200308-200355 dmx512: bit: "0"
200355-200402 dmx512: bit: "0"
200402-200449 dmx512: bit: "0"
200449-200496 dmx512: bit: "0"
200496-200543 dmx512: bit: "0"
200543-200590 dmx512: bit: "0"
200590-200637 dmx512: bit: "0"
200637-200684 dmx512: bit: "0"
200684-200731 dmx512: stopbits: "Stop bit"
200731-200778 dmx512: stopbits: "Stop bit"
200261-200778 dmx512: channel: "Channel 82"
200308-200684 dmx512: data: "0 / 0x0"
200778-200968 dmx512: interframe: "Interframe"
200968-201015 dmx512: startbit: "Start bit"
201015-201062 dmx512: bit: "0"
201062-201109 dmx512: bit: "0"
201109-201156 dmx512: bit: "0"
201156-201203 dmx512: bit: "0"
201203-201250 dmx512: bit: "0"
201250-201297 dmx512: bit: "0"
201297-201344 dmx512: bit: "0"
201344-201391 dmx512: bit: "0"
201391-201438 dmx512: stopbits: "Stop bit"
201438-201485 dmx512: stopbits: "Stop bit"
200968-201485 dmx512: channel: "Channel 83"
201015-201391 dmx512: data: "0 / 0x0"
201485-201674 dmx512: interframe: "Interframe"
201674-201721 dmx512: startbit: "Start bit"
201721-201768 dmx512: bit: "0"
201768-201815 dmx512: bit: "0"
201815-201862 dmx512: bit: "0"
201862-201909 dmx512: bit: "0"
201909-201956 dmx512: bit: "0"
201956-202003 dmx512: bit: "0"
202003-202050 dmx512: bit: "0"
202050-202097 dmx512: bit: "0"
202097-202144 dmx512: stopbits: "Stop bit"
202144-202191 dmx512: stopbits: "Stop bit"
201674-202191 dmx512: channel: "Channel 84"
201721-202097 dmx512: data: "0 / 0x0"
202191-202380 dmx512: interframe: "Interframe"
202380-202427 dmx512: startbit: "Start bit"
202427-202474 dmx512: bit: "0"
202474-202521 dmx512: bit: "0"
202521-202568 dmx512: bit: "0"
202568-202615 dmx512: bit: "0"
202615-202662 dmx512: bit: "0"
202662-202709 dmx512: bit: "0"
202709-202756 dmx512: bit: "0"
202756-202803 dmx512: bit: "0"
202803-202850 dmx512: stopbits: "Stop bit"
202850-202897 dmx512: stopbits: "Stop bit"
202380-202897 dmx512: channel: "Channel 85"
202427-202803 dmx512: data: "0 / 0x0"
202897-203086 dmx512: interframe: "Interframe"
203086-203133 dmx512: startbit: "Start bit"
203133-203180 dmx512: bit: "0"
203180-203227 dmx512: bit: "0"
203227-203274 dmx512: bit: "0"
203274-203321 dmx512: bit: "0"
203321-203368 dmx512: bit: "0"
203368-203415 dmx512: bit: "0"
203415-203462 dmx512: bit: "0"
203462-203509 dmx512: bit: "0"
203509-203556 dmx512: stopbits: "Stop bit"
203556-203603 dmx512: stopbits: "Stop bit"
203086-203603 dmx512: channel: "Channel 86"
203133-203509 dmx512: data: "0 / 0x0"
203603-203792 dmx512: interframe: "Interframe"
203792-203839 dmx512: startbit: "Start bit"
203839-203886 dmx512: bit: "0"
203886-203933 dmx512: bit: "0"
203933-203980 dmx512: bit: "0"
203980-204027 dmx512: bit: "0"
204027-204074 dmx512: bit: "0"
204074-204121 dmx512: bit: "0"
204121-204168 dmx512: bit: "0"
204168-204215 dmx512: bit: "0"
204215-204262 dmx512: stopbits: "Stop bit"
204262-204309 dmx512: stopbits: "Stop bit"
203792-204309 dmx512: channel: "Channel 87"
203839-204215 dmx512: data: "0 / 0x0"
204309-204498 dmx512: interframe: "Interframe"
204498-204545 dmx512: startbit: "Start bit"
204545-204592 dmx512: bit: "0"
204592-204639 dmx512: bit: "0"
204639-204686 dmx512: bit: "0"
204686-204733 dmx512: bit: "0"
204733-204780 dmx512: bit: "0"
204780-204827 dmx512: bit: "0"
204827-204874 dmx512: bit: "0"
204874-204921 dmx512: bit: "0"
204921-204968 dmx512: stopbits: "Stop bit"
204968-205015 dmx512: stopbits: "Stop bit"
204498-205015 dmx512: channel: "Channel 88"
204545-204921 dmx512: data: "0 / 0x0"
205015-205205 dmx512: interframe: "Interframe"
205205-205252 dmx512: startbit: "Start bit"
205252-205299 dmx512: bit: "0"
205299-205346 dmx512: bit: "0"
205346-205393 dmx512: bit: "0"
205393-205440 dmx512: bit: "0"
205440-205487 dmx512: bit: "0"
205487-205534 dmx512: bit: "0"
205534-205581 dmx512: bit: "0"
205581-205628 dmx512: bit: "0"
205628-205675 dmx512: stopbits: "Stop bit"
205675-205722 dmx512: stopbits: "Stop bit"
205205-205722 dmx512: channel: "Channel 89"
205252-205628 dmx512: data: "0 / 0x0"
205722-205911 dmx512: interframe: "Interframe"
205911-205958 dmx512: startbit: "Start bit"
205958-206005 dmx512: bit: "0"
206005-206052 dmx512: bit: "0"
206052-206099 dmx512: bit: "0"
206099-206146 dmx512: bit: "0"
206146-206193 dmx512: bit: "0"
206193-206240 dmx512: bit: "0"
206240-206287 dmx512: bit: "0"
206287-206334 dmx512: bit: "0"
206334-206381 dmx512: stopbits: "Stop bit"
206381-206428 dmx512: stopbits: "Stop bit"
205911-206428 dmx512: channel: "Channel 90"
205958-206334 dmx512: data: "0 / 0x0"
206428-206617 dmx512: interframe: "Interframe"
206617-206664 dmx512: startbit: "Start bit"
206664-206711 dmx512: bit: "0"
206711-206758 dmx512: bit: "0"
206758-206805 dmx512: bit: "0"
206805-206852 dmx512: bit: "0"
206852-206899 dmx512: bit: "0"
206899-206946 dmx512: bit: "0"
206946-206993 dmx512: bit: "0"
206993-207040 dmx512: bit: "0"
207040-207087 dmx512: stopbits: "Stop bit"
207087-207134 dmx512: stopbits: "Stop bit"
206617-207134 dmx512: channel: "Channel 91"
206664-207040 dmx512: data: "0 / 0x0"
207134-207323 dmx512: interframe: "Interframe"
207323-207370 dmx512: startbit: "Start bit"
207370-207417 dmx512: bit: "0"
207417-207464 dmx512: bit: "0"
207464-207511 dmx512: bit: "0"
207511-207558 dmx512: bit: "0"
207558-207605 dmx512: bit: "0"
207605-207652 dmx512: bit: "0"
207652-207699 dmx512: bit: "0"
207699-207746 dmx512: bit: "0"
207746-207793 dmx512: stopbits: "Stop bit"
207793-207840 dmx512: stopbits: "Stop bit"
207323-207840 dmx512: channel: "Channel 92"
207370-207746 dmx512: data: "0 / 0x0"
207840-208029 dmx512: interframe: "Interframe"
208029-208076 dmx512: startbit: "Start bit"
208076-208123 dmx512: bit: "0"
208123-208170 dmx512: bit: "0"
208170-208217 dmx512: bit: "0"
208217-208264 dmx512: bit: "0"
208264-208311 dmx512: bit: "0"
208311-208358 dmx512: bit: "0"
208358-208405 dmx512: bit: "0"
208405-208452 dmx512: bit: "0"
208452-208499 dmx512: stopbits: "Stop bit"
208499-208546 dmx512: stopbits: "Stop bit"
208029-208546 dmx512: channel: "Channel 93"
208076-208452 dmx512: data: "0 / 0x0"
208546-208735 dmx512: interframe: "Interframe"
208735-208782 dmx512: startbit: "Start bit"
208782-208829 dmx512: bit: "0"
208829-208876 dmx512: bit: "0"
208876-208923 dmx512: bit: "0"
208923-208970 dmx512: bit: "0"
208970-209017 dmx512: bit: "0"
209017-209064 dmx512: bit: "0"
209064-209111 dmx512: bit: "0"
209111-209158 dmx512: bit: "0"
209158-209205 dmx512: stopbits: "Stop bit"
209205-209252 dmx512: stopbits: "Stop bit"
208735-209252 dmx512: channel: "Channel 94"
208782-209158 dmx512: data: "0 / 0x0"
209252-209442 dmx512: interframe: "Interframe"
209442-209489 dmx512: startbit: "Start bit"
209489-209536 dmx512: bit: "0"
209536-209583 dmx512: bit: "0"
209583-209630 dmx512: bit: "0"
209630-209677 dmx512: bit: "0"
209677-209724 dmx512: bit: "0"
209724-209771 dmx512: bit: "0"
209771-209818 dmx512: bit: "0"
209818-209865 dmx512: bit: "0"
209865-209912 dmx512: stopbits: "Stop bit"
209912-209959 dmx512: stopbits: "Stop bit"
209442-209959 dmx512: channel: "Channel 95"
209489-209865 dmx512: data: "0 / 0x0"
209959-210148 dmx512: interframe: "Interframe"
210148-210195 dmx512: startbit: "Start bit"
210195-210242 dmx512: bit: "0"
210242-210289 dmx512: bit: "0"
210289-210336 dmx512: bit: "0"
210336-210383 dmx512: bit: "0"
210383-210430 dmx512: bit: "0"
210430-210477 dmx512: bit: "0"
210477-210524 dmx512: bit: "0"
210524-210571 dmx512: bit: "0"
210571-210618 dmx512: stopbits: "Stop bit"
210618-210665 dmx512: stopbits: "Stop bit"
210148-210665 dmx512: channel: "Channel 96"
210195-210571 dmx512: data: "0 / 0x0"
210665-210854 dmx512: interframe: "Interframe"
210854-210901 dmx512: startbit: "Start bit"
210901-210948 dmx512: bit: "0"
210948-210995 dmx512: bit: "0"
210995-211042 dmx512: bit: "0"
211042-211089 dmx512: bit: "0"
211089-211136 dmx512: bit: "0"
211136-211183 dmx512: bit: "0"
211183-211230 dmx512: bit: "0"
211230-211277 dmx512: bit: "0"
211277-211324 dmx512: stopbits: "Stop bit"
211324-211371 dmx512: stopbits: "Stop bit"
210854-211371 dmx512: channel: "Channel 97"
210901-211277 dmx512: data: "0 / 0x0"
211371-211560 dmx512: interframe: "Interframe"
211560-211607 dmx512: startbit: "Start bit"
211607-211654 dmx512: bit: "0"
211654-211701 dmx512: bit: "0"
211701-211748 dmx512: bit: "0"
211748-211795 dmx512: bit: "0"
211795-211842 dmx512: bit: "0"
211842-211889 dmx512: bit: "0"
211889-211936 dmx512: bit: "0"
211936-211983 dmx512: bit: "0"
211983-212030 dmx512: stopbits: "Stop bit"
212030-212077 dmx512: stopbits: "Stop bit"
211560-212077 dmx512: channel: "Channel 98"
211607-211983 dmx512: data: "0 / 0x0"
212077-212266 dmx512: interframe: "Interframe"
212266-212313 dmx512: startbit: "Start bit"
212313-212360 dmx512: bit: "0"
212360-212407 dmx512: bit: "0"
212407-212454 dmx512: bit: "0"
212454-212501 dmx512: bit: "0"
212501-212548 dmx512: bit: "0"
212548-212595 dmx512: bit: "0"
212595-212642 dmx512: bit: "0"
212642-212689 dmx512: bit: "0"
212689-212736 dmx512: stopbits: "Stop bit"
212736-212783 dmx512: stopbits: "Stop bit"
212266-212783 dmx512: channel: "Channel 99"
212313-212689 dmx512: data: "0 / 0x0"
212783-212972 dmx512: interframe: "Interframe"
212972-213019 dmx512: startbit: "Start bit"
213019-213066 dmx512: bit: "0"
213066-213113 dmx512: bit: "0"
213113-213160 dmx512: bit: "0"
213160-213207 dmx512: bit: "0"
213207-213254 dmx512: bit: "0"
213254-213301 dmx512: bit: "0"
213301-213348 dmx512: bit: "0"
213348-213395 dmx512: bit: "0"
213395-213442 dmx512: stopbits: "Stop bit"
213442-213489 dmx512: stopbits: "Stop bit"
212972-213489 dmx512: channel: "Channel 100"
213019-213395 dmx512: data: "0 / 0x0"
213489-213678 dmx512: interframe: "Interframe"
213678-213725 dmx512: startbit: "Start bit"
213725-213772 dmx512: bit: "1"
213772-213819 dmx512: bit: "0"
213819-213866 dmx512: bit: "1"
213866-213913 dmx512: bit: "0"
213913-213960 dmx512: bit: "1"
213960-214007 dmx512: bit: "0"
214007-214054 dmx512: bit: "1"
214054-214101 dmx512: bit: "0"
214101-214148 dmx512: stopbits: "Stop bit"
214148-214195 dmx512: stopbits: "Stop bit"
213678-214195 dmx512: channel: "Channel 101"
213725-214101 dmx512: data: "85 / 0x55"
214195-214385 dmx512: interframe: "Interframe"
214385-214432 dmx512: startbit: "Start bit"
214432-214479 dmx512: bit: "1"
214479-214526 dmx512: bit: "0"
214526-214573 dmx512: bit: "1"
214573-214620 dmx512: bit: "0"
214620-214667 dmx512: bit: "1"
214667-214714 dmx512: bit: "0"
214714-214761 dmx512: bit: "1"
214761-214808 dmx512: bit: "0"
214808-214855 dmx512: stopbits: "Stop bit"
214855-214902 dmx512: stopbits: "Stop bit"
214385-214902 dmx512: channel: "Channel 102"
214432-214808 dmx512: data: "85 / 0x55"
214902-215091 dmx512: interframe: "Interframe"
215091-215138 dmx512: startbit: "Start bit"
215138-215185 dmx512: bit: "0"
215185-215232 dmx512: bit: "0"
215232-215279 dmx512: bit: "0"
215279-215326 dmx512: bit: "0"
215326-215373 dmx512: bit: "0"
215373-215420 dmx512: bit: "0"
215420-215467 dmx512: bit: "0"
215467-215514 dmx512: bit: "0"
215514-215561 dmx512: stopbits: "Stop bit"
215561-215608 dmx512: stopbits: "Stop bit"
215091-215608 dmx512: channel: "Channel 103"
215138-215514 dmx512: data: "0 / 0x0"
215608-215797 dmx512: interframe: "Interframe"
215797-215844 dmx512: startbit: "Start bit"
215844-215891 dmx512: bit: "0"
215891-215938 dmx512: bit: "0"
215938-215985 dmx512: bit: "0"
215985-216032 dmx512: bit: "0"
216032-216079 dmx512: bit: "0"
216079-216126 dmx512: bit: "0"
216126-216173 dmx512: bit: "0"
216173-216220 dmx512: bit: "0"
216220-216267 dmx512: stopbits: "Stop bit"
216267-216314 dmx512: stopbits: "Stop bit"
215797-216314 dmx512: channel: "Channel 104"
215844-216220 dmx512: data: "0 / 0x0"
216314-216503 dmx512: interframe: "Interframe"
216503-216550 dmx512: startbit: "Start bit"
216550-216597 dmx512: bit: "0"
216597-216644 dmx512: bit: "0"
216644-216691 dmx512: bit: "0"
216691-216738 dmx512: bit: "0"
216738-216785 dmx512: bit: "0"
216785-216832 dmx512: bit: "0"
216832-216879 dmx512: bit: "0"
216879-216926 dmx512: bit: "0"
216926-216973 dmx512: stopbits: "Stop bit"
216973-217020 dmx512: stopbits: "Stop bit"
216503-217020 dmx512: channel: "Channel 105"
216550-216926 dmx512: data: "0 / 0x0"
217020-217209 dmx512: interframe: "Interframe"
217209-217256 dmx512: startbit: "Start bit"
217256-217303 dmx512: bit: "0"
217303-217350 dmx512: bit: "0"
217350-217397 dmx512: bit: "0"
217397-217444 dmx512: bit: "0"
217444-217491 dmx512: bit: "0"
217491-217538 dmx512: bit: "0"
217538-217585 dmx512: bit: "0"
217585-217632 dmx512: bit: "0"
217632-217679 dmx512: stopbits: "Stop bit"
217679-217726 dmx512: stopbits: "Stop bit"
217209-217726 dmx512: channel: "Channel 106"
217256-217632 dmx512: data: "0 / 0x0"
217726-217915 dmx512: interframe: "Interframe"
217915-217962 dmx512: startbit: "Start bit"
217962-218009 dmx512: bit: "0"
218009-218056 dmx512: bit: "0"
218056-218103 dmx512: bit: "0"
218103-218150 dmx512: bit: "0"
218150-218197 dmx512: bit: "0"
218197-218244 dmx512: bit: "0"
218244-218291 dmx512: bit: "0"
218291-218338 dmx512: bit: "0"
218338-218385 dmx512: stopbits: "Stop bit"
218385-218432 dmx512: stopbits: "Stop bit"
217915-218432 dmx512: channel: "Channel 107"
217962-218338 dmx512: data: "0 / 0x0"
218432-218622 dmx512: interframe: "Interframe"
218622-218669 dmx512: startbit: "Start bit"
218669-218716 dmx512: bit: "0"
218716-218763 dmx512: bit: "0"
218763-218810 dmx512: bit: "0"
218810-218857 dmx512: bit: "0"
218857-218904 dmx512: bit: "0"
218904-218951 dmx512: bit: "0"
218951-218998 dmx512: bit: "0"
218998-219045 dmx512: bit: "0"
219045-219092 dmx512: stopbits: "Stop bit"
219092-219139 dmx512: stopbits: "Stop bit"
218622-219139 dmx512: channel: "Channel 108"
218669-219045 dmx512: data: "0 / 0x0"
219139-219328 dmx512: interframe: "Interframe"
219328-219375 dmx512: startbit: "Start bit"
219375-219422 dmx512: bit: "0"
219422-219469 dmx512: bit: "0"
219469-219516 dmx512: bit: "0"
219516-219563 dmx512: bit: "0"
219563-219610 dmx512: bit: "0"
219610-219657 dmx512: bit: "0"
219657-219704 dmx512: bit: "0"
219704-219751 dmx512: bit: "0"
219751-219798 dmx512: stopbits: "Stop bit"
219798-219845 dmx512: stopbits: "Stop bit"
219328-219845 dmx512: channel: "Channel 109"
219375-219751 dmx512: data: "0 / 0x0"
219845-220034 dmx512: interframe: "Interframe"
220034-220081 dmx512: startbit: "Start bit"
220081-220128 dmx512: bit: "0"
220128-220175 dmx512: bit: "0"
220175-220222 dmx512: bit: "0"
220222-220269 dmx512: bit: "0"
220269-220316 dmx512: bit: "0"
220316-220363 dmx512: bit: "0"
220363-220410 dmx512: bit: "0"
220410-220457 dmx512: bit: "0"
220457-220504 dmx512: stopbits: "Stop bit"
220504-220551 dmx512: stopbits: "Stop bit"
220034-220551 dmx512: channel: "Channel 110"
220081-220457 dmx512: data: "0 / 0x0"
220551-220740 dmx512: interframe: "Interframe"
220740-220787 dmx512: startbit: "Start bit"
220787-220834 dmx512: bit: "0"
220834-220881 dmx512: bit: "0"
220881-220928 dmx512: bit: "0"
220928-220975 dmx512: bit: "0"
220975-221022 dmx512: bit: "0"
221022-221069 dmx512: bit: "0"
221069-221116 dmx512: bit: "0"
221116-221163 dmx512: bit: "0"
221163-221210 dmx512: stopbits: "Stop bit"
221210-221257 dmx512: stopbits: "Stop bit"
220740-221257 dmx512: channel: "Channel 111"
220787-221163 dmx512: data: "0 / 0x0"
221257-221446 dmx512: interframe: "Interframe"
221446-221493 dmx512: startbit: "Start bit"
221493-221540 dmx512: bit: "0"
221540-221587 dmx512: bit: "0"
221587-221634 dmx512: bit: "0"
221634-221681 dmx512: bit: "0"
221681-221728 dmx512: bit: "0"
221728-221775 dmx512: bit: "0"
221775-221822 dmx512: bit: "0"
221822-221869 dmx512: bit: "0"
221869-221916 dmx512: stopbits: "Stop bit"
221916-221963 dmx512: stopbits: "Stop bit"
221446-221963 dmx512: channel: "Channel 112"
221493-221869 dmx512: data: "0 / 0x0"
221963-222152 dmx512: interframe: "Interframe"
222152-222199 dmx512: startbit: "Start bit"
222199-222246 dmx512: bit: "0"
222246-222293 dmx512: bit: "0"
222293-222340 dmx512: bit: "0"
222340-222387 dmx512: bit: "0"
222387-222434 dmx512: bit: "0"
222434-222481 dmx512: bit: "0"
222481-222528 dmx512: bit: "0"
222528-222575 dmx512: bit: "0"
222575-222622 dmx512: stopbits: "Stop bit"
222622-222669 dmx512: stopbits: "Stop bit"
222152-222669 dmx512: channel: "Channel 113"
222199-222575 dmx512: data: "0 / 0x0"
222669-222859 dmx512: interframe: "Interframe"
222859-222906 dmx512: startbit: "Start bit"
222906-222953 dmx512: bit: "0"
222953-223000 dmx512: bit: "0"
223000-223047 dmx512: bit: "0"
223047-223094 dmx512: bit: "0"
223094-223141 dmx512: bit: "0"
223141-223188 dmx512: bit: "0"
223188-223235 dmx512: bit: "0"
223235-223282 dmx512: bit: "0"
223282-223329 dmx512: stopbits: "Stop bit"
223329-223376 dmx512: stopbits: "Stop bit"
222859-223376 dmx512: channel: "Channel 114"
222906-223282 dmx512: data: "0 / 0x0"
223376-223565 dmx512: interframe: "Interframe"
223565-223612 dmx512: startbit: "Start bit"
223612-223659 dmx512: bit: "0"
223659-223706 dmx512: bit: "0"
223706-223753 dmx512: bit: "0"
223753-223800 dmx512: bit: "0"
223800-223847 dmx512: bit: "0"
223847-223894 dmx512: bit: "0"
223894-223941 dmx512: bit: "0"
223941-223988 dmx512: bit: "0"
223988-224035 dmx512: stopbits: "Stop bit"
224035-224082 dmx512: stopbits: "Stop bit"
223565-224082 dmx512: channel: "Channel 115"
223612-223988 dmx512: data: "0 / 0x0"
224082-224271 dmx512: interframe: "Interframe"
224271-224318 dmx512: startbit: "Start bit"
224318-224365 dmx512: bit: "0"
224365-224412 dmx512: bit: "0"
224412-224459 dmx512: bit: "0"
224459-224506 dmx512: bit: "0"
224506-224553 dmx512: bit: "0"
224553-224600 dmx512: bit: "0"
224600-224647 dmx512: bit: "0"
224647-224694 dmx512: bit: "0"
224694-224741 dmx512: stopbits: "Stop bit"
224741-224788 dmx512: stopbits: "Stop bit"
224271-224788 dmx512: channel: "Channel 116"
224318-224694 dmx512: data: "0 / 0x0"
224788-224977 dmx512: interframe: "Interframe"
224977-225024 dmx512: startbit: "Start bit"
225024-225071 dmx512: bit: "0"
225071-225118 dmx512: bit: "0"
225118-225165 dmx512: bit: "0"
225165-225212 dmx512: bit: "0"
225212-225259 dmx512: bit: "0"
225259-225306 dmx512: bit: "0"
225306-225353 dmx512: bit: "0"
225353-225400 dmx512: bit: "0"
225400-225447 dmx512: stopbits: "Stop bit"
225447-225494 dmx512: stopbits: "Stop bit"
224977-225494 dmx512: channel: "Channel 117"
225024-225400 dmx512: data: "0 / 0x0"
225494-225683 dmx512: interframe: "Interframe"
225683-225730 dmx512: startbit: "Start bit"
225730-225777 dmx512: bit: "0"
225777-225824 dmx512: bit: "0"
225824-225871 dmx512: bit: "0"
225871-225918 dmx512: bit: "0"
225918-225965 dmx512: bit: "0"
225965-226012 dmx512: bit: "0"
226012-226059 dmx512: bit: "0"
226059-226106 dmx512: bit: "0"
226106-226153 dmx512: stopbits: "Stop bit"
226153-226200 dmx512: stopbits: "Stop bit"
225683-226200 dmx512: channel: "Channel 118"
225730-226106 dmx512: data: "0 / 0x0"
226200-226389 dmx512: interframe: "Interframe"
226389-226436 dmx512: startbit: "Start bit"
226436-226483 dmx512: bit: "0"
226483-226530 dmx512: bit: "0"
226530-226577 dmx512: bit: "0"
226577-226624 dmx512: bit: "0"
226624-226671 dmx512: bit: "0"
226671-226718 dmx512: bit: "0"
226718-226765 dmx512: bit: "0"
226765-226812 dmx512: bit: "0"
226812-226859 dmx512: stopbits: "Stop bit"
226859-226906 dmx512: stopbits: "Stop bit"
226389-226906 dmx512: channel: "Channel 119"
226436-226812 dmx512: data: "0 / 0x0"
226906-227096 dmx512: interframe: "Interframe"
227096-227143 dmx512: startbit: "Start bit"
227143-227190 dmx512: bit: "0"
227190-227237 dmx512: bit: "0"
227237-227284 dmx512: bit: "0"
227284-227331 dmx512: bit: "0"
227331-227378 dmx512: bit: "0"
227378-227425 dmx512: bit: "0"
227425-227472 dmx512: bit: "0"
227472-227519 dmx512: bit: "0"
227519-227566 dmx512: stopbits: "Stop bit"
227566-227613 dmx512: stopbits: "Stop bit"
227096-227613 dmx512: channel: "Channel 120"
227143-227519 dmx512: data: "0 / 0x0"
227613-227802 dmx512: interframe: "Interframe"
227802-227849 dmx512: startbit: "Start bit"
227849-227896 dmx512: bit: "0"
227896-227943 dmx512: bit: "0"
227943-227990 dmx512: bit: "0"
227990-228037 dmx512: bit: "0"
228037-228084 dmx512: bit: "0"
228084-228131 dmx512: bit: "0"
228131-228178 dmx512: bit: "0"
228178-228225 dmx512: bit: "0"
228225-228272 dmx512: stopbits: "Stop bit"
228272-228319 dmx512: stopbits: "Stop bit"
227802-228319 dmx512: channel: "Channel 121"
227849-228225 dmx512: data: "0 / 0x0"
228319-228508 dmx512: interframe: "Interframe"
228508-228555 dmx512: startbit: "Start bit"
228555-228602 dmx512: bit: "0"
228602-228649 dmx512: bit: "0"
228649-228696 dmx512: bit: "0"
228696-228743 dmx512: bit: "0"
228743-228790 dmx512: bit: "0"
228790-228837 dmx512: bit: "0"
228837-228884 dmx512: bit: "0"
228884-228931 dmx512: bit: "0"
228931-228978 dmx512: stopbits: "Stop bit"
228978-229025 dmx512: stopbits: "Stop bit"
228508-229025 dmx512: channel: "Channel 122"
228555-228931 dmx512: data: "0 / 0x0"
229025-229214 dmx512: interframe: "Interframe"
229214-229261 dmx512: startbit: "Start bit"
229261-229308 dmx512: bit: "0"
229308-229355 dmx512: bit: "0"
229355-229402 dmx512: bit: "0"
229402-229449 dmx512: bit: "0"
229449-229496 dmx512: bit: "0"
229496-229543 dmx512: bit: "0"
229543-229590 dmx512: bit: "0"
229590-229637 dmx512: bit: "0"
229637-229684 dmx512: stopbits: "Stop bit"
229684-229731 dmx512: stopbits: "Stop bit"
229214-229731 dmx512: channel: "Channel 123"
229261-229637 dmx512: data: "0 / 0x0"
229731-229920 dmx512: interframe: "Interframe"
229920-229967 dmx512: startbit: "Start bit"
229967-230014 dmx512: bit: "0"
230014-230061 dmx512: bit: "0"
230061-230108 dmx512: bit: "0"
230108-230155 dmx512: bit: "0"
230155-230202 dmx512: bit: "0"
230202-230249 dmx512: bit: "0"
230249-230296 dmx512: bit: "0"
230296-230343 dmx512: bit: "0"
230343-230390 dmx512: stopbits: "Stop bit"
230390-230437 dmx512: stopbits: "Stop bit"
229920-230437 dmx512: channel: "Channel 124"
229967-230343 dmx512: data: "0 / 0x0"
230437-230626 dmx512: interframe: "Interframe"
230626-230673 dmx512: startbit: "Start bit"
230673-230720 dmx512: bit: "0"
230720-230767 dmx512: bit: "0"
230767-230814 dmx512: bit: "0"
230814-230861 dmx512: bit: "0"
230861-230908 dmx512: bit: "0"
230908-230955 dmx512: bit: "0"
230955-231002 dmx512: bit: "0"
231002-231049 dmx512: bit: "0"
231049-231096 dmx512: stopbits: "Stop bit"
231096-231143 dmx512: stopbits: "Stop bit"
230626-231143 dmx512: channel: "Channel 125"
230673-231049 dmx512: data: "0 / 0x0"
231143-231332 dmx512: interframe: "Interframe"
231332-231379 dmx512: startbit: "Start bit"
231379-231426 dmx512: bit: "0"
231426-231473 dmx512: bit: "0"
231473-231520 dmx512: bit: "0"
231520-231567 dmx512: bit: "0"
231567-231614 dmx512: bit: "0"
231614-231661 dmx512: bit: "0"
231661-231708 dmx512: bit: "0"
231708-231755 dmx512: bit: "0"
231755-231802 dmx512: stopbits: "Stop bit"
231802-231849 dmx512: stopbits: "Stop bit"
231332-231849 dmx512: channel: "Channel 126"
231379-231755 dmx512: data: "0 / 0x0"
231849-232039 dmx512: interframe: "Interframe"
232039-232086 dmx512: startbit: "Start bit"
232086-232133 dmx512: bit: "0"
232133-232180 dmx512: bit: "0"
232180-232227 dmx512: bit: "0"
232227-232274 dmx512: bit: "0"
232274-232321 dmx512: bit: "0"
232321-232368 dmx512: bit: "0"
232368-232415 dmx512: bit: "0"
232415-232462 dmx512: bit: "0"
232462-232509 dmx512: stopbits: "Stop bit"
232509-232556 dmx512: stopbits: "Stop bit"
232039-232556 dmx512: channel: "Channel 127"
232086-232462 dmx512: data: "0 / 0x0"
232556-232745 dmx512: interframe: "Interframe"
232745-232792 dmx512: startbit: "Start bit"
232792-232839 dmx512: bit: "0"
232839-232886 dmx512: bit: "0"
232886-232933 dmx512: bit: "0"
232933-232980 dmx512: bit: "0"
232980-233027 dmx512: bit: "0"
233027-233074 dmx512: bit: "0"
233074-233121 dmx512: bit: "0"
233121-233168 dmx512: bit: "0"
233168-233215 dmx512: stopbits: "Stop bit"
233215-233262 dmx512: stopbits: "Stop bit"
232745-233262 dmx512: channel: "Channel 128"
232792-233168 dmx512: data: "0 / 0x0"
233262-233451 dmx512: interframe: "Interframe"
233451-233498 dmx512: startbit: "Start bit"
233498-233545 dmx512: bit: "0"
233545-233592 dmx512: bit: "0"
233592-233639 dmx512: bit: "0"
233639-233686 dmx512: bit: "0"
233686-233733 dmx512: bit: "0"
233733-233780 dmx512: bit: "0"
233780-233827 dmx512: bit: "0"
233827-233874 dmx512: bit: "0"
233874-233921 dmx512: stopbits: "Stop bit"
233921-233968 dmx512: stopbits: "Stop bit"
233451-233968 dmx512: channel: "Channel 129"
233498-233874 dmx512: data: "0 / 0x0"
233968-234157 dmx512: interframe: "Interframe"
234157-234204 dmx512: startbit: "Start bit"
234204-234251 dmx512: bit: "0"
234251-234298 dmx512: bit: "0"
234298-234345 dmx512: bit: "0"
234345-234392 dmx512: bit: "0"
234392-234439 dmx512: bit: "0"
234439-234486 dmx512: bit: "0"
234486-234533 dmx512: bit: "0"
234533-234580 dmx512: bit: "0"
234580-234627 dmx512: stopbits: "Stop bit"
234627-234674 dmx512: stopbits: "Stop bit"
234157-234674 dmx512: channel: "Channel 130"
234204-234580 dmx512: data: "0 / 0x0"
234674-234863 dmx512: interframe: "Interframe"
234863-234910 dmx512: startbit: "Start bit"
234910-234957 dmx512: bit: "0"
234957-235004 dmx512: bit: "0"
235004-235051 dmx512: bit: "0"
235051-235098 dmx512: bit: "0"
235098-235145 dmx512: bit: "0"
235145-235192 dmx512: bit: "0"
235192-235239 dmx512: bit: "0"
235239-235286 dmx512: bit: "0"
235286-235333 dmx512: stopbits: "Stop bit"
235333-235380 dmx512: stopbits: "Stop bit"
234863-235380 dmx512: channel: "Channel 131"
234910-235286 dmx512: data: "0 / 0x0"
235380-235569 dmx512: interframe: "Interframe"
235569-235616 dmx512: startbit: "Start bit"
235616-235663 dmx512: bit: "0"
235663-235710 dmx512: bit: "0"
235710-235757 dmx512: bit: "0"
235757-235804 dmx512: bit: "0"
235804-235851 dmx512: bit: "0"
235851-235898 dmx512: bit: "0"
235898-235945 dmx512: bit: "0"
235945-235992 dmx512: bit: "0"
235992-236039 dmx512: stopbits: "Stop bit"
236039-236086 dmx512: stopbits: "Stop bit"
235569-236086 dmx512: channel: "Channel 132"
235616-235992 dmx512: data: "0 / 0x0"
236086-236276 dmx512: interframe: "Interframe"
236276-236323 dmx512: startbit: "Start bit"
236323-236370 dmx512: bit: "0"
236370-236417 dmx512: bit: "0"
236417-236464 dmx512: bit: "0"
236464-236511 dmx512: bit: "0"
236511-236558 dmx512: bit: "0"
236558-236605 dmx512: bit: "0"
236605-236652 dmx512: bit: "0"
236652-236699 dmx512: bit: "0"
236699-236746 dmx512: stopbits: "Stop bit"
236746-236793 dmx512: stopbits: "Stop bit"
236276-236793 dmx512: channel: "Channel 133"
236323-236699 dmx512: data: "0 / 0x0"
236793-236982 dmx512: interframe: "Interframe"
236982-237029 dmx512: startbit: "Start bit"
237029-237076 dmx512: bit: "0"
237076-237123 dmx512: bit: "0"
237123-237170 dmx512: bit: "0"
237170-237217 dmx512: bit: "0"
237217-237264 dmx512: bit: "0"
237264-237311 dmx512: bit: "0"
237311-237358 dmx512: bit: "0"
237358-237405 dmx512: bit: "0"
237405-237452 dmx512: stopbits: "Stop bit"
237452-237499 dmx512: stopbits: "Stop bit"
236982-237499 dmx512: channel: "Channel 134"
237029-237405 dmx512: data: "0 / 0x0"
237499-237688 dmx512: interframe: "Interframe"
237688-237735 dmx512: startbit: "Start bit"
237735-237782 dmx512: bit: "0"
237782-237829 dmx512: bit: "0"
237829-237876 dmx512: bit: "0"
237876-237923 dmx512: bit: "0"
237923-237970 dmx512: bit: "0"
237970-238017 dmx512: bit: "0"
238017-238064 dmx512: bit: "0"
238064-238111 dmx512: bit: "0"
238111-238158 dmx512: stopbits: "Stop bit"
238158-238205 dmx512: stopbits: "Stop bit"
237688-238205 dmx512: channel: "Channel 135"
237735-238111 dmx512: data: "0 / 0x0"
238205-238394 dmx512: interframe: "Interframe"
238394-238441 dmx512: startbit: "Start bit"
238441-238488 dmx512: bit: "0"
238488-238535 dmx512: bit: "0"
238535-238582 dmx512: bit: "0"
238582-238629 dmx512: bit: "0"
238629-238676 dmx512: bit: "0"
238676-238723 dmx512: bit: "0"
238723-238770 dmx512: bit: "0"
238770-238817 dmx512: bit: "0"
238817-238864 dmx512: stopbits: "Stop bit"
238864-238911 dmx512: stopbits: "Stop bit"
238394-238911 dmx512: channel: "Channel 136"
238441-238817 dmx512: data: "0 / 0x0"
238911-239100 dmx512: interframe: "Interframe"
239100-239147 dmx512: startbit: "Start bit"
239147-239194 dmx512: bit: "0"
239194-239241 dmx512: bit: "0"
239241-239288 dmx512: bit: "0"
239288-239335 dmx512: bit: "0"
239335-239382 dmx512: bit: "0"
239382-239429 dmx512: bit: "0"
239429-239476 dmx512: bit: "0"
239476-239523 dmx512: bit: "0"
239523-239570 dmx512: stopbits: "Stop bit"
239570-239617 dmx512: stopbits: "Stop bit"
239100-239617 dmx512: channel: "Channel 137"
239147-239523 dmx512: data: "0 / 0x0"
239617-239806 dmx512: interframe: "Interframe"
239806-239853 dmx512: startbit: "Start bit"
239853-239900 dmx512: bit: "0"
239900-239947 dmx512: bit: "0"
239947-239994 dmx512: bit: "0"
239994-240041 dmx512: bit: "0"
240041-240088 dmx512: bit: "0"
240088-240135 dmx512: bit: "0"
240135-240182 dmx512: bit: "0"
240182-240229 dmx512: bit: "0"
240229-240276 dmx512: stopbits: "Stop bit"
240276-240323 dmx512: stopbits: "Stop bit"
239806-240323 dmx512: channel: "Channel 138"
239853-240229 dmx512: data: "0 / 0x0"
240323-240513 dmx512: interframe: "Interframe"
240513-240560 dmx512: startbit: "Start bit"
240560-240607 dmx512: bit: "0"
240607-240654 dmx512: bit: "0"
240654-240701 dmx512: bit: "0"
240701-240748 dmx512: bit: "0"
240748-240795 dmx512: bit: "0"
240795-240842 dmx512: bit: "0"
240842-240889 dmx512: bit: "0"
240889-240936 dmx512: bit: "0"
240936-240983 dmx512: stopbits: "Stop bit"
240983-241030 dmx512: stopbits: "Stop bit"
240513-241030 dmx512: channel: "Channel 139"
240560-240936 dmx512: data: "0 / 0x0"
241030-241219 dmx512: interframe: "Interframe"
241219-241266 dmx512: startbit: "Start bit"
241266-241313 dmx512: bit: "0"
241313-241360 dmx512: bit: "0"
241360-241407 dmx512: bit: "0"
241407-241454 dmx512: bit: "0"
241454-241501 dmx512: bit: "0"
241501-241548 dmx512: bit: "0"
241548-241595 dmx512: bit: "0"
241595-241642 dmx512: bit: "0"
241642-241689 dmx512: stopbits: "Stop bit"
241689-241736 dmx512: stopbits: "Stop bit"
241219-241736 dmx512: channel: "Channel 140"
241266-241642 dmx512: data: "0 / 0x0"
241736-241925 dmx512: interframe: "Interframe"
241925-241972 dmx512: startbit: "Start bit"
241972-242019 dmx512: bit: "0"
242019-242066 dmx512: bit: "0"
242066-242113 dmx512: bit: "0"
242113-242160 dmx512: bit: "0"
242160-242207 dmx512: bit: "0"
242207-242254 dmx512: bit: "0"
242254-242301 dmx512: bit: "0"
242301-242348 dmx512: bit: "0"
242348-242395 dmx512: stopbits: "Stop bit"
242395-242442 dmx512: stopbits: "Stop bit"
241925-242442 dmx512: channel: "Channel 141"
241972-242348 dmx512: data: "0 / 0x0"
242442-242631 dmx512: interframe: "Interframe"
242631-242678 dmx512: startbit: "Start bit"
242678-242725 dmx512: bit: "0"
242725-242772 dmx512: bit: "0"
242772-242819 dmx512: bit: "0"
242819-242866 dmx512: bit: "0"
242866-242913 dmx512: bit: "0"
242913-242960 dmx512: bit: "0"
242960-243007 dmx512: bit: "0"
243007-243054 dmx512: bit: "0"
243054-243101 dmx512: stopbits: "Stop bit"
243101-243148 dmx512: stopbits: "Stop bit"
242631-243148 dmx512: channel: "Channel 142"
242678-243054 dmx512: data: "0 / 0x0"
243148-243337 dmx512: interframe: "Interframe"
243337-243384 dmx512: startbit: "Start bit"
243384-243431 dmx512: bit: "0"
243431-243478 dmx512: bit: "0"
243478-243525 dmx512: bit: "0"
243525-243572 dmx512: bit: "0"
243572-243619 dmx512: bit: "0"
243619-243666 dmx512: bit: "0"
243666-243713 dmx512: bit: "0"
243713-243760 dmx512: bit: "0"
243760-243807 dmx512: stopbits: "Stop bit"
243807-243854 dmx512: stopbits: "Stop bit"
243337-243854 dmx512: channel: "Channel 143"
243384-243760 dmx512: data: "0 / 0x0"
243854-244043 dmx512: interframe: "Interframe"
244043-244090 dmx512: startbit: "Start bit"
244090-244137 dmx512: bit: "0"
244137-244184 dmx512: bit: "0"
244184-244231 dmx512: bit: "0"
244231-244278 dmx512: bit: "0"
244278-244325 dmx512: bit: "0"
244325-244372 dmx512: bit: "0"
244372-244419 dmx512: bit: "0"
244419-244466 dmx512: bit: "0"
244466-244513 dmx512: stopbits: "Stop bit"
244513-244560 dmx512: stopbits: "Stop bit"
244043-244560 dmx512: channel: "Channel 144"
244090-244466 dmx512: data: "0 / 0x0"
244560-244750 dmx512: interframe: "Interframe"
244750-244797 dmx512: startbit: "Start bit"
244797-244844 dmx512: bit: "0"
244844-244891 dmx512: bit: "0"
244891-244938 dmx512: bit: "0"
244938-244985 dmx512: bit: "0"
244985-245032 dmx512: bit: "0"
245032-245079 dmx512: bit: "0"
245079-245126 dmx512: bit: "0"
245126-245173 dmx512: bit: "0"
245173-245220 dmx512: stopbits: "Stop bit"
245220-245267 dmx512: stopbits: "Stop bit"
244750-245267 dmx512: channel: "Channel 145"
244797-245173 dmx512: data: "0 / 0x0"
245267-245456 dmx512: interframe: "Interframe"
245456-245503 dmx512: startbit: "Start bit"
245503-245550 dmx512: bit: "0"
245550-245597 dmx512: bit: "0"
245597-245644 dmx512: bit: "0"
245644-245691 dmx512: bit: "0"
245691-245738 dmx512: bit: "0"
245738-245785 dmx512: bit: "0"
245785-245832 dmx512: bit: "0"
245832-245879 dmx512: bit: "0"
245879-245926 dmx512: stopbits: "Stop bit"
245926-245973 dmx512: stopbits: "Stop bit"
245456-245973 dmx512: channel: "Channel 146"
245503-245879 dmx512: data: "0 / 0x0"
245973-246162 dmx512: interframe: "Interframe"
246162-246209 dmx512: startbit: "Start bit"
246209-246256 dmx512: bit: "0"
246256-246303 dmx512: bit: "0"
246303-246350 dmx512: bit: "0"
246350-246397 dmx512: bit: "0"
246397-246444 dmx512: bit: "0"
246444-246491 dmx512: bit: "0"
246491-246538 dmx512: bit: "0"
246538-246585 dmx512: bit: "0"
246585-246632 dmx512: stopbits: "Stop bit"
246632-246679 dmx512: stopbits: "Stop bit"
246162-246679 dmx512: channel: "Channel 147"
246209-246585 dmx512: data: "0 / 0x0"
246679-246868 dmx512: interframe: "Interframe"
246868-246915 dmx512: startbit: "Start bit"
246915-246962 dmx512: bit: "0"
246962-247009 dmx512: bit: "0"
247009-247056 dmx512: bit: "0"
247056-247103 dmx512: bit: "0"
247103-247150 dmx512: bit: "0"
247150-247197 dmx512: bit: "0"
247197-247244 dmx512: bit: "0"
247244-247291 dmx512: bit: "0"
247291-247338 dmx512: stopbits: "Stop bit"
247338-247385 dmx512: stopbits: "Stop bit"
246868-247385 dmx512: channel: "Channel 148"
246915-247291 dmx512: data: "0 / 0x0"
247385-247574 dmx512: interframe: "Interframe"
247574-247621 dmx512: startbit: "Start bit"
247621-247668 dmx512: bit: "0"
247668-247715 dmx512: bit: "0"
247715-247762 dmx512: bit: "0"
247762-247809 dmx512: bit: "0"
247809-247856 dmx512: bit: "0"
247856-247903 dmx512: bit: "0"
247903-247950 dmx512: bit: "0"
247950-247997 dmx512: bit: "0"
247997-248044 dmx512: stopbits: "Stop bit"
248044-248091 dmx512: stopbits: "Stop bit"
247574-248091 dmx512: channel: "Channel 149"
247621-247997 dmx512: data: "0 / 0x0"
248091-248280 dmx512: interframe: "Interframe"
248280-248327 dmx512: startbit: "Start bit"
248327-248374 dmx512: bit: "0"
248374-248421 dmx512: bit: "0"
248421-248468 dmx512: bit: "0"
248468-248515 dmx512: bit: "0"
248515-248562 dmx512: bit: "0"
248562-248609 dmx512: bit: "0"
248609-248656 dmx512: bit: "0"
248656-248703 dmx512: bit: "0"
248703-248750 dmx512: stopbits: "Stop bit"
248750-248797 dmx512: stopbits: "Stop bit"
248280-248797 dmx512: channel: "Channel 150"
248327-248703 dmx512: data: "0 / 0x0"
248797-248987 dmx512: interframe: "Interframe"
248987-249034 dmx512: startbit: "Start bit"
249034-249081 dmx512: bit: "0"
249081-249128 dmx512: bit: "0"
249128-249175 dmx512: bit: "0"
249175-249222 dmx512: bit: "0"
249222-249269 dmx512: bit: "0"
249269-249316 dmx512: bit: "0"
249316-249363 dmx512: bit: "0"
249363-249410 dmx512: bit: "0"
249410-249457 dmx512: stopbits: "Stop bit"
249457-249504 dmx512: stopbits: "Stop bit"
248987-249504 dmx512: channel: "Channel 151"
249034-249410 dmx512: data: "0 / 0x0"
249504-249693 dmx512: interframe: "Interframe"
249693-249740 dmx512: startbit: "Start bit"
249740-249787 dmx512: bit: "0"
249787-249834 dmx512: bit: "0"
249834-249881 dmx512: bit: "0"
249881-249928 dmx512: bit: "0"
249928-249975 dmx512: bit: "0"
249975-250022 dmx512: bit: "0"
250022-250069 dmx512: bit: "0"
250069-250116 dmx512: bit: "0"
250116-250163 dmx512: stopbits: "Stop bit"
250163-250210 dmx512: stopbits: "Stop bit"
249693-250210 dmx512: channel: "Channel 152"
249740-250116 dmx512: data: "0 / 0x0"
250210-250399 dmx512: interframe: "Interframe"
250399-250446 dmx512: startbit: "Start bit"
250446-250493 dmx512: bit: "0"
250493-250540 dmx512: bit: "0"
250540-250587 dmx512: bit: "0"
250587-250634 dmx512: bit: "0"
250634-250681 dmx512: bit: "0"
250681-250728 dmx512: bit: "0"
250728-250775 dmx512: bit: "0"
250775-250822 dmx512: bit: "0"
250822-250869 dmx512: stopbits: "Stop bit"
250869-250916 dmx512: stopbits: "Stop bit"
250399-250916 dmx512: channel: "Channel 153"
250446-250822 dmx512: data: "0 / 0x0"
250916-251105 dmx512: interframe: "Interframe"
251105-251152 dmx512: startbit: "Start bit"
251152-251199 dmx512: bit: "0"
251199-251246 dmx512: bit: "0"
251246-251293 dmx512: bit: "0"
251293-251340 dmx512: bit: "0"
251340-251387 dmx512: bit: "0"
251387-251434 dmx512: bit: "0"
251434-251481 dmx512: bit: "0"
251481-251528 dmx512: bit: "0"
251528-251575 dmx512: stopbits: "Stop bit"
251575-251622 dmx512: stopbits: "Stop bit"
251105-251622 dmx512: channel: "Channel 154"
251152-251528 dmx512: data: "0 / 0x0"
251622-251811 dmx512: interframe: "Interframe"
251811-251858 dmx512: startbit: "Start bit"
251858-251905 dmx512: bit: "0"
251905-251952 dmx512: bit: "0"
251952-251999 dmx512: bit: "0"
251999-252046 dmx512: bit: "0"
252046-252093 dmx512: bit: "0"
252093-252140 dmx512: bit: "0"
252140-252187 dmx512: bit: "0"
252187-252234 dmx512: bit: "0"
252234-252281 dmx512: stopbits: "Stop bit"
252281-252328 dmx512: stopbits: "Stop bit"
251811-252328 dmx512: channel: "Channel 155"
251858-252234 dmx512: data: "0 / 0x0"
252328-252517 dmx512: interframe: "Interframe"
252517-252564 dmx512: startbit: "Start bit"
252564-252611 dmx512: bit: "0"
252611-252658 dmx512: bit: "0"
252658-252705 dmx512: bit: "0"
252705-252752 dmx512: bit: "0"
252752-252799 dmx512: bit: "0"
252799-252846 dmx512: bit: "0"
252846-252893 dmx512: bit: "0"
252893-252940 dmx512: bit: "0"
252940-252987 dmx512: stopbits: "Stop bit"
252987-253034 dmx512: stopbits: "Stop bit"
252517-253034 dmx512: channel: "Channel 156"
252564-252940 dmx512: data: "0 / 0x0"
253034-253223 dmx512: interframe: "Interframe"
253223-253270 dmx512: startbit: "Start bit"
253270-253317 dmx512: bit: "0"
253317-253364 dmx512: bit: "0"
253364-253411 dmx512: bit: "0"
253411-253458 dmx512: bit: "0"
253458-253505 dmx512: bit: "0"
253505-253552 dmx512: bit: "0"
253552-253599 dmx512: bit: "0"
253599-253646 dmx512: bit: "0"
253646-253693 dmx512: stopbits: "Stop bit"
253693-253740 dmx512: stopbits: "Stop bit"
253223-253740 dmx512: channel: "Channel 157"
253270-253646 dmx512: data: "0 / 0x0"
253740-253930 dmx512: interframe: "Interframe"
253930-253977 dmx512: startbit: "Start bit"
253977-254024 dmx512: bit: "0"
254024-254071 dmx512: bit: "0"
254071-254118 dmx512: bit: "0"
254118-254165 dmx512: bit: "0"
254165-254212 dmx512: bit: "0"
254212-254259 dmx512: bit: "0"
254259-254306 dmx512: bit: "0"
254306-254353 dmx512: bit: "0"
254353-254400 dmx512: stopbits: "Stop bit"
254400-254447 dmx512: stopbits: "Stop bit"
253930-254447 dmx512: channel: "Channel 158"
253977-254353 dmx512: data: "0 / 0x0"
254447-254636 dmx512: interframe: "Interframe"
254636-254683 dmx512: startbit: "Start bit"
254683-254730 dmx512: bit: "0"
254730-254777 dmx512: bit: "0"
254777-254824 dmx512: bit: "0"
254824-254871 dmx512: bit: "0"
254871-254918 dmx512: bit: "0"
254918-254965 dmx512: bit: "0"
254965-255012 dmx512: bit: "0"
255012-255059 dmx512: bit: "0"
255059-255106 dmx512: stopbits: "Stop bit"
255106-255153 dmx512: stopbits: "Stop bit"
254636-255153 dmx512: channel: "Channel 159"
254683-255059 dmx512: data: "0 / 0x0"
255153-255342 dmx512: interframe: "Interframe"
255342-255389 dmx512: startbit: "Start bit"
255389-255436 dmx512: bit: "0"
255436-255483 dmx512: bit: "0"
255483-255530 dmx512: bit: "0"
255530-255577 dmx512: bit: "0"
255577-255624 dmx512: bit: "0"
255624-255671 dmx512: bit: "0"
255671-255718 dmx512: bit: "0"
255718-255765 dmx512: bit: "0"
255765-255812 dmx512: stopbits: "Stop bit"
255812-255859 dmx512: stopbits: "Stop bit"
255342-255859 dmx512: channel: "Channel 160"
255389-255765 dmx512: data: "0 / 0x0"
255859-256048 dmx512: interframe: "Interframe"
256048-256095 dmx512: startbit: "Start bit"
256095-256142 dmx512: bit: "0"
256142-256189 dmx512: bit: "0"
256189-256236 dmx512: bit: "0"
256236-256283 dmx512: bit: "0"
256283-256330 dmx512: bit: "0"
256330-256377 dmx512: bit: "0"
256377-256424 dmx512: bit: "0"
256424-256471 dmx512: bit: "0"
256471-256518 dmx512: stopbits: "Stop bit"
256518-256565 dmx512: stopbits: "Stop bit"
256048-256565 dmx512: channel: "Channel 161"
256095-256471 dmx512: data: "0 / 0x0"
256565-256754 dmx512: interframe: "Interframe"
256754-256801 dmx512: startbit: "Start bit"
256801-256848 dmx512: bit: "0"
256848-256895 dmx512: bit: "0"
256895-256942 dmx512: bit: "0"
256942-256989 dmx512: bit: "0"
256989-257036 dmx512: bit: "0"
257036-257083 dmx512: bit: "0"
257083-257130 dmx512: bit: "0"
257130-257177 dmx512: bit: "0"
257177-257224 dmx512: stopbits: "Stop bit"
257224-257271 dmx512: stopbits: "Stop bit"
256754-257271 dmx512: channel: "Channel 162"
256801-257177 dmx512: data: "0 / 0x0"
257271-257460 dmx512: interframe: "Interframe"
257460-257507 dmx512: startbit: "Start bit"
257507-257554 dmx512: bit: "0"
257554-257601 dmx512: bit: "0"
257601-257648 dmx512: bit: "0"
257648-257695 dmx512: bit: "0"
257695-257742 dmx512: bit: "0"
257742-257789 dmx512: bit: "0"
257789-257836 dmx512: bit: "0"
257836-257883 dmx512: bit: "0"
257883-257930 dmx512: stopbits: "Stop bit"
257930-257977 dmx512: stopbits: "Stop bit"
257460-257977 dmx512: channel: "Channel 163"
257507-257883 dmx512: data: "0 / 0x0"
257977-258167 dmx512: interframe: "Interframe"
258167-258214 dmx512: startbit: "Start bit"
258214-258261 dmx512: bit: "0"
258261-258308 dmx512: bit: "0"
258308-258355 dmx512: bit: "0"
258355-258402 dmx512: bit: "0"
258402-258449 dmx512: bit: "0"
258449-258496 dmx512: bit: "0"
258496-258543 dmx512: bit: "0"
258543-258590 dmx512: bit: "0"
258590-258637 dmx512: stopbits: "Stop bit"
258637-258684 dmx512: stopbits: "Stop bit"
258167-258684 dmx512: channel: "Channel 164"
258214-258590 dmx512: data: "0 / 0x0"
258684-258873 dmx512: interframe: "Interframe"
258873-258920 dmx512: startbit: "Start bit"
258920-258967 dmx512: bit: "0"
258967-259014 dmx512: bit: "0"
259014-259061 dmx512: bit: "0"
259061-259108 dmx512: bit: "0"
259108-259155 dmx512: bit: "0"
259155-259202 dmx512: bit: "0"
259202-259249 dmx512: bit: "0"
259249-259296 dmx512: bit: "0"
259296-259343 dmx512: stopbits: "Stop bit"
259343-259390 dmx512: stopbits: "Stop bit"
258873-259390 dmx512: channel: "Channel 165"
258920-259296 dmx512: data: "0 / 0x0"
259390-259579 dmx512: interframe: "Interframe"
259579-259626 dmx512: startbit: "Start bit"
259626-259673 dmx512: bit: "0"
259673-259720 dmx512: bit: "0"
259720-259767 dmx512: bit: "0"
259767-259814 dmx512: bit: "0"
259814-259861 dmx512: bit: "0"
259861-259908 dmx512: bit: "0"
259908-259955 dmx512: bit: "0"
259955-260002 dmx512: bit: "0"
260002-260049 dmx512: stopbits: "Stop bit"
260049-260096 dmx512: stopbits: "Stop bit"
259579-260096 dmx512: channel: "Channel 166"
259626-260002 dmx512: data: "0 / 0x0"
260096-260285 dmx512: interframe: "Interframe"
260285-260332 dmx512: startbit: "Start bit"
260332-260379 dmx512: bit: "0"
260379-260426 dmx512: bit: "0"
260426-260473 dmx512: bit: "0"
260473-260520 dmx512: bit: "0"
260520-260567 dmx512: bit: "0"
260567-260614 dmx512: bit: "0"
260614-260661 dmx512: bit: "0"
260661-260708 dmx512: bit: "0"
260708-260755 dmx512: stopbits: "Stop bit"
260755-260802 dmx512: stopbits: "Stop bit"
260285-260802 dmx512: channel: "Channel 167"
260332-260708 dmx512: data: "0 / 0x0"
260802-260991 dmx512: interframe: "Interframe"
260991-261038 dmx512: startbit: "Start bit"
261038-261085 dmx512: bit: "0"
261085-261132 dmx512: bit: "0"
261132-261179 dmx512: bit: "0"
261179-261226 dmx512: bit: "0"
261226-261273 dmx512: bit: "0"
261273-261320 dmx512: bit: "0"
261320-261367 dmx512: bit: "0"
261367-261414 dmx512: bit: "0"
261414-261461 dmx512: stopbits: "Stop bit"
261461-261508 dmx512: stopbits: "Stop bit"
260991-261508 dmx512: channel: "Channel 168"
261038-261414 dmx512: data: "0 / 0x0"
261508-261697 dmx512: interframe: "Interframe"
261697-261744 dmx512: startbit: "Start bit"
261744-261791 dmx512: bit: "0"
261791-261838 dmx512: bit: "0"
261838-261885 dmx512: bit: "0"
261885-261932 dmx512: bit: "0"
261932-261979 dmx512: bit: "0"
261979-262026 dmx512: bit: "0"
262026-262073 dmx512: bit: "0"
262073-262120 dmx512: bit: "0"
262120-262167 dmx512: stopbits: "Stop bit"
262167-262214 dmx512: stopbits: "Stop bit"
261697-262214 dmx512: channel: "Channel 169"
261744-262120 dmx512: data: "0 / 0x0"
262214-262404 dmx512: interframe: "Interframe"
262404-262451 dmx512: startbit: "Start bit"
262451-262498 dmx512: bit: "0"
262498-262545 dmx512: bit: "0"
262545-262592 dmx512: bit: "0"
262592-262639 dmx512: bit: "0"
262639-262686 dmx512: bit: "0"
262686-262733 dmx512: bit: "0"
262733-262780 dmx512: bit: "0"
262780-262827 dmx512: bit: "0"
262827-262874 dmx512: stopbits: "Stop bit"
262874-262921 dmx512: stopbits: "Stop bit"
262404-262921 dmx512: channel: "Channel 170"
262451-262827 dmx512: data: "0 / 0x0"
262921-263110 dmx512: interframe: "Interframe"
263110-263157 dmx512: startbit: "Start bit"
263157-263204 dmx512: bit: "0"
263204-263251 dmx512: bit: "0"
263251-263298 dmx512: bit: "0"
263298-263345 dmx512: bit: "0"
263345-263392 dmx512: bit: "0"
263392-263439 dmx512: bit: "0"
263439-263486 dmx512: bit: "0"
263486-263533 dmx512: bit: "0"
263533-263580 dmx512: stopbits: "Stop bit"
263580-263627 dmx512: stopbits: "Stop bit"
263110-263627 dmx512: channel: "Channel 171"
263157-263533 dmx512: data: "0 / 0x0"
263627-263816 dmx512: interframe: "Interframe"
263816-263863 dmx512: startbit: "Start bit"
263863-263910 dmx512: bit: "0"
263910-263957 dmx512: bit: "0"
263957-264004 dmx512: bit: "0"
264004-264051 dmx512: bit: "0"
264051-264098 dmx512: bit: "0"
264098-264145 dmx512: bit: "0"
264145-264192 dmx512: bit: "0"
264192-264239 dmx512: bit: "0"
264239-264286 dmx512: stopbits: "Stop bit"
264286-264333 dmx512: stopbits: "Stop bit"
263816-264333 dmx512: channel: "Channel 172"
263863-264239 dmx512: data: "0 / 0x0"
264333-264522 dmx512: interframe: "Interframe"
264522-264569 dmx512: startbit: "Start bit"
264569-264616 dmx512: bit: "0"
264616-264663 dmx512: bit: "0"
264663-264710 dmx512: bit: "0"
264710-264757 dmx512: bit: "0"
264757-264804 dmx512: bit: "0"
264804-264851 dmx512: bit: "0"
264851-264898 dmx512: bit: "0"
264898-264945 dmx512: bit: "0"
264945-264992 dmx512: stopbits: "Stop bit"
264992-265039 dmx512: stopbits: "Stop bit"
264522-265039 dmx512: channel: "Channel 173"
264569-264945 dmx512: data: "0 / 0x0"
265039-265228 dmx512: interframe: "Interframe"
265228-265275 dmx512: startbit: "Start bit"
265275-265322 dmx512: bit: "0"
265322-265369 dmx512: bit: "0"
265369-265416 dmx512: bit: "0"
265416-265463 dmx512: bit: "0"
265463-265510 dmx512: bit: "0"
265510-265557 dmx512: bit: "0"
265557-265604 dmx512: bit: "0"
265604-265651 dmx512: bit: "0"
265651-265698 dmx512: stopbits: "Stop bit"
265698-265745 dmx512: stopbits: "Stop bit"
265228-265745 dmx512: channel: "Channel 174"
265275-265651 dmx512: data: "0 / 0x0"
265745-265934 dmx512: interframe: "Interframe"
265934-265981 dmx512: startbit: "Start bit"
265981-266028 dmx512: bit: "0"
266028-266075 dmx512: bit: "0"
266075-266122 dmx512: bit: "0"
266122-266169 dmx512: bit: "0"
266169-266216 dmx512: bit: "0"
266216-266263 dmx512: bit: "0"
266263-266310 dmx512: bit: "0"
266310-266357 dmx512: bit: "0"
266357-266404 dmx512: stopbits: "Stop bit"
266404-266451 dmx512: stopbits: "Stop bit"
265934-266451 dmx512: channel: "Channel 175"
265981-266357 dmx512: data: "0 / 0x0"
266451-266641 dmx512: interframe: "Interframe"
266641-266688 dmx512: startbit: "Start bit"
266688-266735 dmx512: bit: "0"
266735-266782 dmx512: bit: "0"
266782-266829 dmx512: bit: "0"
266829-266876 dmx512: bit: "0"
266876-266923 dmx512: bit: "0"
266923-266970 dmx512: bit: "0"
266970-267017 dmx512: bit: "0"
267017-267064 dmx512: bit: "0"
267064-267111 dmx512: stopbits: "Stop bit"
267111-267158 dmx512: stopbits: "Stop bit"
266641-267158 dmx512: channel: "Channel 176"
266688-267064 dmx512: data: "0 / 0x0"
267158-267347 dmx512: interframe: "Interframe"
267347-267394 dmx512: startbit: "Start bit"
267394-267441 dmx512: bit: "0"
267441-267488 dmx512: bit: "0"
267488-267535 dmx512: bit: "0"
267535-267582 dmx512: bit: "0"
267582-267629 dmx512: bit: "0"
267629-267676 dmx512: bit: "0"
267676-267723 dmx512: bit: "0"
267723-267770 dmx512: bit: "0"
267770-267817 dmx512: stopbits: "Stop bit"
267817-267864 dmx512: stopbits: "Stop bit"
267347-267864 dmx512: channel: "Channel 177"
267394-267770 dmx512: data: "0 / 0x0"
267864-268053 dmx512: interframe: "Interframe"
268053-268100 dmx512: startbit: "Start bit"
268100-268147 dmx512: bit: "0"
268147-268194 dmx512: bit: "0"
268194-268241 dmx512: bit: "0"
268241-268288 dmx512: bit: "0"
268288-268335 dmx512: bit: "0"
268335-268382 dmx512: bit: "0"
268382-268429 dmx512: bit: "0"
268429-268476 dmx512: bit: "0"
268476-268523 dmx512: stopbits: "Stop bit"
268523-268570 dmx512: stopbits: "Stop bit"
268053-268570 dmx512: channel: "Channel 178"
268100-268476 dmx512: data: "0 / 0x0"
268570-268759 dmx512: interframe: "Interframe"
268759-268806 dmx512: startbit: "Start bit"
268806-268853 dmx512: bit: "0"
268853-268900 dmx512: bit: "0"
268900-268947 dmx512: bit: "0"
268947-268994 dmx512: bit: "0"
268994-269041 dmx512: bit: "0"
269041-269088 dmx512: bit: "0"
269088-269135 dmx512: bit: "0"
269135-269182 dmx512: bit: "0"
269182-269229 dmx512: stopbits: "Stop bit"
269229-269276 dmx512: stopbits: "Stop bit"
268759-269276 dmx512: channel: "Channel 179"
268806-269182 dmx512: data: "0 / 0x0"
269276-269465 dmx512: interframe: "Interframe"
269465-269512 dmx512: startbit: "Start bit"
269512-269559 dmx512: bit: "0"
269559-269606 dmx512: bit: "0"
269606-269653 dmx512: bit: "0"
269653-269700 dmx512: bit: "0"
269700-269747 dmx512: bit: "0"
269747-269794 dmx512: bit: "0"
269794-269841 dmx512: bit: "0"
269841-269888 dmx512: bit: "0"
269888-269935 dmx512: stopbits: "Stop bit"
269935-269982 dmx512: stopbits: "Stop bit"
269465-269982 dmx512: channel: "Channel 180"
269512-269888 dmx512: data: "0 / 0x0"
269982-270171 dmx512: interframe: "Interframe"
270171-270218 dmx512: startbit: "Start bit"
270218-270265 dmx512: bit: "0"
270265-270312 dmx512: bit: "0"
270312-270359 dmx512: bit: "0"
270359-270406 dmx512: bit: "0"
270406-270453 dmx512: bit: "0"
270453-270500 dmx512: bit: "0"
270500-270547 dmx512: bit: "0"
270547-270594 dmx512: bit: "0"
270594-270641 dmx512: stopbits: "Stop bit"
270641-270688 dmx512: stopbits: "Stop bit"
270171-270688 dmx512: channel: "Channel 181"
270218-270594 dmx512: data: "0 / 0x0"
270688-270877 dmx512: interframe: "Interframe"
270877-270924 dmx512: startbit: "Start bit"
270924-270971 dmx512: bit: "0"
270971-271018 dmx512: bit: "0"
271018-271065 dmx512: bit: "0"
271065-271112 dmx512: bit: "0"
271112-271159 dmx512: bit: "0"
271159-271206 dmx512: bit: "0"
271206-271253 dmx512: bit: "0"
271253-271300 dmx512: bit: "0"
271300-271347 dmx512: stopbits: "Stop bit"
271347-271394 dmx512: stopbits: "Stop bit"
270877-271394 dmx512: channel: "Channel 182"
270924-271300 dmx512: data: "0 / 0x0"
271394-271584 dmx512: interframe: "Interframe"
271584-271631 dmx512: startbit: "Start bit"
271631-271678 dmx512: bit: "0"
271678-271725 dmx512: bit: "0"
271725-271772 dmx512: bit: "0"
271772-271819 dmx512: bit: "0"
271819-271866 dmx512: bit: "0"
271866-271913 dmx512: bit: "0"
271913-271960 dmx512: bit: "0"
271960-272007 dmx512: bit: "0"
272007-272054 dmx512: stopbits: "Stop bit"
272054-272101 dmx512: stopbits: "Stop bit"
271584-272101 dmx512: channel: "Channel 183"
271631-272007 dmx512: data: "0 / 0x0"
272101-272290 dmx512: interframe: "Interframe"
272290-272337 dmx512: startbit: "Start bit"
272337-272384 dmx512: bit: "0"
272384-272431 dmx512: bit: "0"
272431-272478 dmx512: bit: "0"
272478-272525 dmx512: bit: "0"
272525-272572 dmx512: bit: "0"
272572-272619 dmx512: bit: "0"
272619-272666 dmx512: bit: "0"
272666-272713 dmx512: bit: "0"
272713-272760 dmx512: stopbits: "Stop bit"
272760-272807 dmx512: stopbits: "Stop bit"
272290-272807 dmx512: channel: "Channel 184"
272337-272713 dmx512: data: "0 / 0x0"
272807-272996 dmx512: interframe: "Interframe"
272996-273043 dmx512: startbit: "Start bit"
273043-273090 dmx512: bit: "0"
273090-273137 dmx512: bit: "0"
273137-273184 dmx512: bit: "0"
273184-273231 dmx512: bit: "0"
273231-273278 dmx512: bit: "0"
273278-273325 dmx512: bit: "0"
273325-273372 dmx512: bit: "0"
273372-273419 dmx512: bit: "0"
273419-273466 dmx512: stopbits: "Stop bit"
273466-273513 dmx512: stopbits: "Stop bit"
272996-273513 dmx512: channel: "Channel 185"
273043-273419 dmx512: data: "0 / 0x0"
273513-273702 dmx512: interframe: "Interframe"
273702-273749 dmx512: startbit: "Start bit"
273749-273796 dmx512: bit: "0"
273796-273843 dmx512: bit: "0"
273843-273890 dmx512: bit: "0"
273890-273937 dmx512: bit: "0"
273937-273984 dmx512: bit: "0"
273984-274031 dmx512: bit: "0"
274031-274078 dmx512: bit: "0"
274078-274125 dmx512: bit: "0"
274125-274172 dmx512: stopbits: "Stop bit"
274172-274219 dmx512: stopbits: "Stop bit"
273702-274219 dmx512: channel: "Channel 186"
273749-274125 dmx512: data: "0 / 0x0"
274219-274408 dmx512: interframe: "Interframe"
274408-274455 dmx512: startbit: "Start bit"
274455-274502 dmx512: bit: "0"
274502-274549 dmx512: bit: "0"
274549-274596 dmx512: bit: "0"
274596-274643 dmx512: bit: "0"
274643-274690 dmx512: bit: "0"
274690-274737 dmx512: bit: "0"
274737-274784 dmx512: bit: "0"
274784-274831 dmx512: bit: "0"
274831-274878 dmx512: stopbits: "Stop bit"
274878-274925 dmx512: stopbits: "Stop bit"
274408-274925 dmx512: channel: "Channel 187"
274455-274831 dmx512: data: "0 / 0x0"
274925-275114 dmx512: interframe: "Interframe"
275114-275161 dmx512: startbit: "Start bit"
275161-275208 dmx512: bit: "0"
275208-275255 dmx512: bit: "0"
275255-275302 dmx512: bit: "0"
275302-275349 dmx512: bit: "0"
275349-275396 dmx512: bit: "0"
275396-275443 dmx512: bit: "0"
275443-275490 dmx512: bit: "0"
275490-275537 dmx512: bit: "0"
275537-275584 dmx512: stopbits: "Stop bit"
275584-275631 dmx512: stopbits: "Stop bit"
275114-275631 dmx512: channel: "Channel 188"
275161-275537 dmx512: data: "0 / 0x0"
275631-275821 dmx512: interframe: "Interframe"
275821-275868 dmx512: startbit: "Start bit"
275868-275915 dmx512: bit: "0"
275915-275962 dmx512: bit: "0"
275962-276009 dmx512: bit: "0"
276009-276056 dmx512: bit: "0"
276056-276103 dmx512: bit: "0"
276103-276150 dmx512: bit: "0"
276150-276197 dmx512: bit: "0"
276197-276244 dmx512: bit: "0"
276244-276291 dmx512: stopbits: "Stop bit"
276291-276338 dmx512: stopbits: "Stop bit"
275821-276338 dmx512: channel: "Channel 189"
275868-276244 dmx512: data: "0 / 0x0"
276338-276527 dmx512: interframe: "Interframe"
276527-276574 dmx512: startbit: "Start bit"
276574-276621 dmx512: bit: "0"
276621-276668 dmx512: bit: "0"
276668-276715 dmx512: bit: "0"
276715-276762 dmx512: bit: "0"
276762-276809 dmx512: bit: "0"
276809-276856 dmx512: bit: "0"
276856-276903 dmx512: bit: "0"
276903-276950 dmx512: bit: "0"
276950-276997 dmx512: stopbits: "Stop bit"
276997-277044 dmx512: stopbits: "Stop bit"
276527-277044 dmx512: channel: "Channel 190"
276574-276950 dmx512: data: "0 / 0x0"
277044-277233 dmx512: interframe: "Interframe"
277233-277280 dmx512: startbit: "Start bit"
277280-277327 dmx512: bit: "0"
277327-277374 dmx512: bit: "0"
277374-277421 dmx512: bit: "0"
277421-277468 dmx512: bit: "0"
277468-277515 dmx512: bit: "0"
277515-277562 dmx512: bit: "0"
277562-277609 dmx512: bit: "0"
277609-277656 dmx512: bit: "0"
277656-277703 dmx512: stopbits: "Stop bit"
277703-277750 dmx512: stopbits: "Stop bit"
277233-277750 dmx512: channel: "Channel 191"
277280-277656 dmx512: data: "0 / 0x0"
277750-277939 dmx512: interframe: "Interframe"
277939-277986 dmx512: startbit: "Start bit"
277986-278033 dmx512: bit: "0"
278033-278080 dmx512: bit: "0"
278080-278127 dmx512: bit: "0"
278127-278174 dmx512: bit: "0"
278174-278221 dmx512: bit: "0"
278221-278268 dmx512: bit: "0"
278268-278315 dmx512: bit: "0"
278315-278362 dmx512: bit: "0"
278362-278409 dmx512: stopbits: "Stop bit"
278409-278456 dmx512: stopbits: "Stop bit"
277939-278456 dmx512: channel: "Channel 192"
277986-278362 dmx512: data: "0 / 0x0"
278456-278645 dmx512: interframe: "Interframe"
278645-278692 dmx512: startbit: "Start bit"
278692-278739 dmx512: bit: "0"
278739-278786 dmx512: bit: "0"
278786-278833 dmx512: bit: "0"
278833-278880 dmx512: bit: "0"
278880-278927 dmx512: bit: "0"
278927-278974 dmx512: bit: "0"
278974-279021 dmx512: bit: "0"
279021-279068 dmx512: bit: "0"
279068-279115 dmx512: stopbits: "Stop bit"
279115-279162 dmx512: stopbits: "Stop bit"
278645-279162 dmx512: channel: "Channel 193"
278692-279068 dmx512: data: "0 / 0x0"
279162-279351 dmx512: interframe: "Interframe"
279351-279398 dmx512: startbit: "Start bit"
279398-279445 dmx512: bit: "0"
279445-279492 dmx512: bit: "0"
279492-279539 dmx512: bit: "0"
279539-279586 dmx512: bit: "0"
279586-279633 dmx512: bit: "0"
279633-279680 dmx512: bit: "0"
279680-279727 dmx512: bit: "0"
279727-279774 dmx512: bit: "0"
279774-279821 dmx512: stopbits: "Stop bit"
279821-279868 dmx512: stopbits: "Stop bit"
279351-279868 dmx512: channel: "Channel 194"
279398-279774 dmx512: data: "0 / 0x0"
279868-280058 dmx512: interframe: "Interframe"
280058-280105 dmx512: startbit: "Start bit"
280105-280152 dmx512: bit: "0"
280152-280199 dmx512: bit: "0"
280199-280246 dmx512: bit: "0"
280246-280293 dmx512: bit: "0"
280293-280340 dmx512: bit: "0"
280340-280387 dmx512: bit: "0"
280387-280434 dmx512: bit: "0"
280434-280481 dmx512: bit: "0"
280481-280528 dmx512: stopbits: "Stop bit"
280528-280575 dmx512: stopbits: "Stop bit"
280058-280575 dmx512: channel: "Channel 195"
280105-280481 dmx512: data: "0 / 0x0"
280575-280764 dmx512: interframe: "Interframe"
280764-280811 dmx512: startbit: "Start bit"
280811-280858 dmx512: bit: "0"
280858-280905 dmx512: bit: "0"
280905-280952 dmx512: bit: "0"
280952-280999 dmx512: bit: "0"
280999-281046 dmx512: bit: "0"
281046-281093 dmx512: bit: "0"
281093-281140 dmx512: bit: "0"
281140-281187 dmx512: bit: "0"
281187-281234 dmx512: stopbits: "Stop bit"
281234-281281 dmx512: stopbits: "Stop bit"
280764-281281 dmx512: channel: "Channel 196"
280811-281187 dmx512: data: "0 / 0x0"
281281-281470 dmx512: interframe: "Interframe"
281470-281517 dmx512: startbit: "Start bit"
281517-281564 dmx512: bit: "0"
281564-281611 dmx512: bit: "0"
281611-281658 dmx512: bit: "0"
281658-281705 dmx512: bit: "0"
281705-281752 dmx512: bit: "0"
281752-281799 dmx512: bit: "0"
281799-281846 dmx512: bit: "0"
281846-281893 dmx512: bit: "0"
281893-281940 dmx512: stopbits: "Stop bit"
281940-281987 dmx512: stopbits: "Stop bit"
281470-281987 dmx512: channel: "Channel 197"
281517-281893 dmx512: data: "0 / 0x0"
281987-282176 dmx512: interframe: "Interframe"
282176-282223 dmx512: startbit: "Start bit"
282223-282270 dmx512: bit: "0"
282270-282317 dmx512: bit: "0"
282317-282364 dmx512: bit: "0"
282364-282411 dmx512: bit: "0"
282411-282458 dmx512: bit: "0"
282458-282505 dmx512: bit: "0"
282505-282552 dmx512: bit: "0"
282552-282599 dmx512: bit: "0"
282599-282646 dmx512: stopbits: "Stop bit"
282646-282693 dmx512: stopbits: "Stop bit"
282176-282693 dmx512: channel: "Channel 198"
282223-282599 dmx512: data: "0 / 0x0"
282693-282882 dmx512: interframe: "Interframe"
282882-282929 dmx512: startbit: "Start bit"
282929-282976 dmx512: bit: "0"
282976-283023 dmx512: bit: "0"
283023-283070 dmx512: bit: "0"
283070-283117 dmx512: bit: "0"
283117-283164 dmx512: bit: "0"
283164-283211 dmx512: bit: "0"
283211-283258 dmx512: bit: "0"
283258-283305 dmx512: bit: "0"
283305-283352 dmx512: stopbits: "Stop bit"
283352-283399 dmx512: stopbits: "Stop bit"
282882-283399 dmx512: channel: "Channel 199"
282929-283305 dmx512: data: "0 / 0x0"
283399-283588 dmx512: interframe: "Interframe"
283588-283635 dmx512: startbit: "Start bit"
283635-283682 dmx512: bit: "0"
283682-283729 dmx512: bit: "0"
283729-283776 dmx512: bit: "0"
283776-283823 dmx512: bit: "0"
283823-283870 dmx512: bit: "0"
283870-283917 dmx512: bit: "0"
283917-283964 dmx512: bit: "0"
283964-284011 dmx512: bit: "0"
284011-284058 dmx512: stopbits: "Stop bit"
284058-284105 dmx512: stopbits: "Stop bit"
283588-284105 dmx512: channel: "Channel 200"
283635-284011 dmx512: data: "0 / 0x0"
284105-284295 dmx512: interframe: "Interframe"
284295-284342 dmx512: startbit: "Start bit"
284342-284389 dmx512: bit: "1"
284389-284436 dmx512: bit: "0"
284436-284483 dmx512: bit: "1"
284483-284530 dmx512: bit: "0"
284530-284577 dmx512: bit: "1"
284577-284624 dmx512: bit: "0"
284624-284671 dmx512: bit: "1"
284671-284718 dmx512: bit: "0"
284718-284765 dmx512: stopbits: "Stop bit"
284765-284812 dmx512: stopbits: "Stop bit"
284295-284812 dmx512: channel: "Channel 201"
284342-284718 dmx512: data: "85 / 0x55"
284812-285001 dmx512: interframe: "Interframe"
285001-285048 dmx512: startbit: "Start bit"
285048-285095 dmx512: bit: "1"
285095-285142 dmx512: bit: "0"
285142-285189 dmx512: bit: "1"
285189-285236 dmx512: bit: "0"
285236-285283 dmx512: bit: "1"
285283-285330 dmx512: bit: "0"
285330-285377 dmx512: bit: "1"
285377-285424 dmx512: bit: "0"
285424-285471 dmx512: stopbits: "Stop bit"
285471-285518 dmx512: stopbits: "Stop bit"
285001-285518 dmx512: channel: "Channel 202"
285048-285424 dmx512: data: "85 / 0x55"
285518-285707 dmx512: interframe: "Interframe"
285707-285754 dmx512: startbit: "Start bit"
285754-285801 dmx512: bit: "0"
285801-285848 dmx512: bit: "0"
285848-285895 dmx512: bit: "0"
285895-285942 dmx512: bit: "0"
285942-285989 dmx512: bit: "0"
285989-286036 dmx512: bit: "0"
286036-286083 dmx512: bit: "0"
286083-286130 dmx512: bit: "0"
286130-286177 dmx512: stopbits: "Stop bit"
286177-286224 dmx512: stopbits: "Stop bit"
285707-286224 dmx512: channel: "Channel 203"
285754-286130 dmx512: data: "0 / 0x0"
286224-286413 dmx512: interframe: "Interframe"
286413-286460 dmx512: startbit: "Start bit"
286460-286507 dmx512: bit: "0"
286507-286554 dmx512: bit: "0"
286554-286601 dmx512: bit: "0"
286601-286648 dmx512: bit: "0"
286648-286695 dmx512: bit: "0"
286695-286742 dmx512: bit: "0"
286742-286789 dmx512: bit: "0"
286789-286836 dmx512: bit: "0"
286836-286883 dmx512: stopbits: "Stop bit"
286883-286930 dmx512: stopbits: "Stop bit"
286413-286930 dmx512: channel: "Channel 204"
286460-286836 dmx512: data: "0 / 0x0"
286930-287119 dmx512: interframe: "Interframe"
287119-287166 dmx512: startbit: "Start bit"
287166-287213 dmx512: bit: "0"
287213-287260 dmx512: bit: "0"
287260-287307 dmx512: bit: "0"
287307-287354 dmx512: bit: "0"
287354-287401 dmx512: bit: "0"
287401-287448 dmx512: bit: "0"
287448-287495 dmx512: bit: "0"
287495-287542 dmx512: bit: "0"
287542-287589 dmx512: stopbits: "Stop bit"
287589-287636 dmx512: stopbits: "Stop bit"
287119-287636 dmx512: channel: "Channel 205"
287166-287542 dmx512: data: "0 / 0x0"
287636-287825 dmx512: interframe: "Interframe"
287825-287872 dmx512: startbit: "Start bit"
287872-287919 dmx512: bit: "0"
287919-287966 dmx512: bit: "0"
287966-288013 dmx512: bit: "0"
288013-288060 dmx512: bit: "0"
288060-288107 dmx512: bit: "0"
288107-288154 dmx512: bit: "0"
288154-288201 dmx512: bit: "0"
288201-288248 dmx512: bit: "0"
288248-288295 dmx512: stopbits: "Stop bit"
288295-288342 dmx512: stopbits: "Stop bit"
287825-288342 dmx512: channel: "Channel 206"
287872-288248 dmx512: data: "0 / 0x0"
288342-288532 dmx512: interframe: "Interframe"
288532-288579 dmx512: startbit: "Start bit"
288579-288626 dmx512: bit: "0"
288626-288673 dmx512: bit: "0"
288673-288720 dmx512: bit: "0"
288720-288767 dmx512: bit: "0"
288767-288814 dmx512: bit: "0"
288814-288861 dmx512: bit: "0"
288861-288908 dmx512: bit: "0"
288908-288955 dmx512: bit: "0"
288955-289002 dmx512: stopbits: "Stop bit"
289002-289049 dmx512: stopbits: "Stop bit"
288532-289049 dmx512: channel: "Channel 207"
288579-288955 dmx512: data: "0 / 0x0"
289049-289238 dmx512: interframe: "Interframe"
289238-289285 dmx512: startbit: "Start bit"
289285-289332 dmx512: bit: "0"
289332-289379 dmx512: bit: "0"
289379-289426 dmx512: bit: "0"
289426-289473 dmx512: bit: "0"
289473-289520 dmx512: bit: "0"
289520-289567 dmx512: bit: "0"
289567-289614 dmx512: bit: "0"
289614-289661 dmx512: bit: "0"
289661-289708 dmx512: stopbits: "Stop bit"
289708-289755 dmx512: stopbits: "Stop bit"
289238-289755 dmx512: channel: "Channel 208"
289285-289661 dmx512: data: "0 / 0x0"
289755-289944 dmx512: interframe: "Interframe"
289944-289991 dmx512: startbit: "Start bit"
289991-290038 dmx512: bit: "0"
290038-290085 dmx512: bit: "0"
290085-290132 dmx512: bit: "0"
290132-290179 dmx512: bit: "0"
290179-290226 dmx512: bit: "0"
290226-290273 dmx512: bit: "0"
290273-290320 dmx512: bit: "0"
290320-290367 dmx512: bit: "0"
290367-290414 dmx512: stopbits: "Stop bit"
290414-290461 dmx512: stopbits: "Stop bit"
289944-290461 dmx512: channel: "Channel 209"
289991-290367 dmx512: data: "0 / 0x0"
290461-290650 dmx512: interframe: "Interframe"
290650-290697 dmx512: startbit: "Start bit"
290697-290744 dmx512: bit: "0"
290744-290791 dmx512: bit: "0"
290791-290838 dmx512: bit: "0"
290838-290885 dmx512: bit: "0"
290885-290932 dmx512: bit: "0"
290932-290979 dmx512: bit: "0"
290979-291026 dmx512: bit: "0"
291026-291073 dmx512: bit: "0"
291073-291120 dmx512: stopbits: "Stop bit"
291120-291167 dmx512: stopbits: "Stop bit"
290650-291167 dmx512: channel: "Channel 210"
290697-291073 dmx512: data: "0 / 0x0"
291167-291356 dmx512: interframe: "Interframe"
291356-291403 dmx512: startbit: "Start bit"
291403-291450 dmx512: bit: "0"
291450-291497 dmx512: bit: "0"
291497-291544 dmx512: bit: "0"
291544-291591 dmx512: bit: "0"
291591-291638 dmx512: bit: "0"
291638-291685 dmx512: bit: "0"
291685-291732 dmx512: bit: "0"
291732-291779 dmx512: bit: "0"
291779-291826 dmx512: stopbits: "Stop bit"
291826-291873 dmx512: stopbits: "Stop bit"
291356-291873 dmx512: channel: "Channel 211"
291403-291779 dmx512: data: "0 / 0x0"
291873-292062 dmx512: interframe: "Interframe"
292062-292109 dmx512: startbit: "Start bit"
292109-292156 dmx512: bit: "0"
292156-292203 dmx512: bit: "0"
292203-292250 dmx512: bit: "0"
292250-292297 dmx512: bit: "0"
292297-292344 dmx512: bit: "0"
292344-292391 dmx512: bit: "0"
292391-292438 dmx512: bit: "0"
292438-292485 dmx512: bit: "0"
292485-292532 dmx512: stopbits: "Stop bit"
292532-292579 dmx512: stopbits: "Stop bit"
292062-292579 dmx512: channel: "Channel 212"
292109-292485 dmx512: data: "0 / 0x0"
292579-292768 dmx512: interframe: "Interframe"
292768-292815 dmx512: startbit: "Start bit"
292815-292862 dmx512: bit: "0"
292862-292909 dmx512: bit: "0"
292909-292956 dmx512: bit: "0"
292956-293003 dmx512: bit: "0"
293003-293050 dmx512: bit: "0"
293050-293097 dmx512: bit: "0"
293097-293144 dmx512: bit: "0"
293144-293191 dmx512: bit: "0"
293191-293238 dmx512: stopbits: "Stop bit"
293238-293285 dmx512: stopbits: "Stop bit"
292768-293285 dmx512: channel: "Channel 213"
292815-293191 dmx512: data: "0 / 0x0"
293285-293475 dmx512: interframe: "Interframe"
293475-293522 dmx512: startbit: "Start bit"
293522-293569 dmx512: bit: "0"
293569-293616 dmx512: bit: "0"
293616-293663 dmx512: bit: "0"
293663-293710 dmx512: bit: "0"
293710-293757 dmx512: bit: "0"
293757-293804 dmx512: bit: "0"
293804-293851 dmx512: bit: "0"
293851-293898 dmx512: bit: "0"
293898-293945 dmx512: stopbits: "Stop bit"
293945-293992 dmx512: stopbits: "Stop bit"
293475-293992 dmx512: channel: "Channel 214"
293522-293898 dmx512: data: "0 / 0x0"
293992-294181 dmx512: interframe: "Interframe"
294181-294228 dmx512: startbit: "Start bit"
294228-294275 dmx512: bit: "0"
294275-294322 dmx512: bit: "0"
294322-294369 dmx512: bit: "0"
294369-294416 dmx512: bit: "0"
294416-294463 dmx512: bit: "0"
294463-294510 dmx512: bit: "0"
294510-294557 dmx512: bit: "0"
294557-294604 dmx512: bit: "0"
294604-294651 dmx512: stopbits: "Stop bit"
294651-294698 dmx512: stopbits: "Stop bit"
294181-294698 dmx512: channel: "Channel 215"
294228-294604 dmx512: data: "0 / 0x0"
294698-294887 dmx512: interframe: "Interframe"
294887-294934 dmx512: startbit: "Start bit"
294934-294981 dmx512: bit: "0"
294981-295028 dmx512: bit: "0"
295028-295075 dmx512: bit: "0"
295075-295122 dmx512: bit: "0"
295122-295169 dmx512: bit: "0"
295169-295216 dmx512: bit: "0"
295216-295263 dmx512: bit: "0"
295263-295310 dmx512: bit: "0"
295310-295357 dmx512: stopbits: "Stop bit"
295357-295404 dmx512: stopbits: "Stop bit"
294887-295404 dmx512: channel: "Channel 216"
294934-295310 dmx512: data: "0 / 0x0"
295404-295593 dmx512: interframe: "Interframe"
295593-295640 dmx512: startbit: "Start bit"
295640-295687 dmx512: bit: "0"
295687-295734 dmx512: bit: "0"
295734-295781 dmx512: bit: "0"
295781-295828 dmx512: bit: "0"
295828-295875 dmx512: bit: "0"
295875-295922 dmx512: bit: "0"
295922-295969 dmx512: bit: "0"
295969-296016 dmx512: bit: "0"
296016-296063 dmx512: stopbits: "Stop bit"
296063-296110 dmx512: stopbits: "Stop bit"
295593-296110 dmx512: channel: "Channel 217"
295640-296016 dmx512: data: "0 / 0x0"
296110-296299 dmx512: interframe: "Interframe"
296299-296346 dmx512: startbit: "Start bit"
296346-296393 dmx512: bit: "0"
296393-296440 dmx512: bit: "0"
296440-296487 dmx512: bit: "0"
296487-296534 dmx512: bit: "0"
296534-296581 dmx512: bit: "0"
296581-296628 dmx512: bit: "0"
296628-296675 dmx512: bit: "0"
296675-296722 dmx512: bit: "0"
296722-296769 dmx512: stopbits: "Stop bit"
296769-296816 dmx512: stopbits: "Stop bit"
296299-296816 dmx512: channel: "Channel 218"
296346-296722 dmx512: data: "0 / 0x0"
296816-297005 dmx512: interframe: "Interframe"
297005-297052 dmx512: startbit: "Start bit"
297052-297099 dmx512: bit: "0"
297099-297146 dmx512: bit: "0"
297146-297193 dmx512: bit: "0"
297193-297240 dmx512: bit: "0"
297240-297287 dmx512: bit: "0"
297287-297334 dmx512: bit: "0"
297334-297381 dmx512: bit: "0"
297381-297428 dmx512: bit: "0"
297428-297475 dmx512: stopbits: "Stop bit"
297475-297522 dmx512: stopbits: "Stop bit"
297005-297522 dmx512: channel: "Channel 219"
297052-297428 dmx512: data: "0 / 0x0"
297522-297712 dmx512: interframe: "Interframe"
297712-297759 dmx512: startbit: "Start bit"
297759-297806 dmx512: bit: "0"
297806-297853 dmx512: bit: "0"
297853-297900 dmx512: bit: "0"
297900-297947 dmx512: bit: "0"
297947-297994 dmx512: bit: "0"
297994-298041 dmx512: bit: "0"
298041-298088 dmx512: bit: "0"
298088-298135 dmx512: bit: "0"
298135-298182 dmx512: stopbits: "Stop bit"
298182-298229 dmx512: stopbits: "Stop bit"
297712-298229 dmx512: channel: "Channel 220"
297759-298135 dmx512: data: "0 / 0x0"
298229-298418 dmx512: interframe: "Interframe"
298418-298465 dmx512: startbit: "Start bit"
298465-298512 dmx512: bit: "0"
298512-298559 dmx512: bit: "0"
298559-298606 dmx512: bit: "0"
298606-298653 dmx512: bit: "0"
298653-298700 dmx512: bit: "0"
298700-298747 dmx512: bit: "0"
298747-298794 dmx512: bit: "0"
298794-298841 dmx512: bit: "0"
298841-298888 dmx512: stopbits: "Stop bit"
298888-298935 dmx512: stopbits: "Stop bit"
298418-298935 dmx512: channel: "Channel 221"
298465-298841 dmx512: data: "0 / 0x0"
298935-299124 dmx512: interframe: "Interframe"
299124-299171 dmx512: startbit: "Start bit"
299171-299218 dmx512: bit: "0"
299218-299265 dmx512: bit: "0"
299265-299312 dmx512: bit: "0"
299312-299359 dmx512: bit: "0"
299359-299406 dmx512: bit: "0"
299406-299453 dmx512: bit: "0"
299453-299500 dmx512: bit: "0"
299500-299547 dmx512: bit: "0"
299547-299594 dmx512: stopbits: "Stop bit"
299594-299641 dmx512: stopbits: "Stop bit"
299124-299641 dmx512: channel: "Channel 222"
299171-299547 dmx512: data: "0 / 0x0"
299641-299830 dmx512: interframe: "Interframe"
299830-299877 dmx512: startbit: "Start bit"
299877-299924 dmx512: bit: "0"
299924-299971 dmx512: bit: "0"
299971-300018 dmx512: bit: "0"
300018-300065 dmx512: bit: "0"
300065-300112 dmx512: bit: "0"
300112-300159 dmx512: bit: "0"
300159-300206 dmx512: bit: "0"
300206-300253 dmx512: bit: "0"
300253-300300 dmx512: stopbits: "Stop bit"
300300-300347 dmx512: stopbits: "Stop bit"
299830-300347 dmx512: channel: "Channel 223"
299877-300253 dmx512: data: "0 / 0x0"
300347-300536 dmx512: interframe: "Interframe"
300536-300583 dmx512: startbit: "Start bit"
300583-300630 dmx512: bit: "0"
300630-300677 dmx512: bit: "0"
300677-300724 dmx512: bit: "0"
300724-300771 dmx512: bit: "0"
300771-300818 dmx512: bit: "0"
300818-300865 dmx512: bit: "0"
300865-300912 dmx512: bit: "0"
300912-300959 dmx512: bit: "0"
300959-301006 dmx512: stopbits: "Stop bit"
301006-301053 dmx512: stopbits: "Stop bit"
300536-301053 dmx512: channel: "Channel 224"
300583-300959 dmx512: data: "0 / 0x0"
301053-301242 dmx512: interframe: "Interframe"
301242-301289 dmx512: startbit: "Start bit"
301289-301336 dmx512: bit: "0"
301336-301383 dmx512: bit: "0"
301383-301430 dmx512: bit: "0"
301430-301477 dmx512: bit: "0"
301477-301524 dmx512: bit: "0"
301524-301571 dmx512: bit: "0"
301571-301618 dmx512: bit: "0"
301618-301665 dmx512: bit: "0"
301665-301712 dmx512: stopbits: "Stop bit"
301712-301759 dmx512: stopbits: "Stop bit"
301242-301759 dmx512: channel: "Channel 225"
301289-301665 dmx512: data: "0 / 0x0"
301759-301949 dmx512: interframe: "Interframe"
301949-301996 dmx512: startbit: "Start bit"
301996-302043 dmx512: bit: "0"
302043-302090 dmx512: bit: "0"
302090-302137 dmx512: bit: "0"
302137-302184 dmx512: bit: "0"
302184-302231 dmx512: bit: "0"
302231-302278 dmx512: bit: "0"
302278-302325 dmx512: bit: "0"
302325-302372 dmx512: bit: "0"
302372-302419 dmx512: stopbits: "Stop bit"
302419-302466 dmx512: stopbits: "Stop bit"
301949-302466 dmx512: channel: "Channel 226"
301996-302372 dmx512: data: "0 / 0x0"
302466-302655 dmx512: interframe: "Interframe"
302655-302702 dmx512: startbit: "Start bit"
302702-302749 dmx512: bit: "0"
302749-302796 dmx512: bit: "0"
302796-302843 dmx512: bit: "0"
302843-302890 dmx512: bit: "0"
302890-302937 dmx512: bit: "0"
302937-302984 dmx512: bit: "0"
302984-303031 dmx512: bit: "0"
303031-303078 dmx512: bit: "0"
303078-303125 dmx512: stopbits: "Stop bit"
303125-303172 dmx512: stopbits: "Stop bit"
302655-303172 dmx512: channel: "Channel 227"
302702-303078 dmx512: data: "0 / 0x0"
303172-303361 dmx512: interframe: "Interframe"
303361-303408 dmx512: startbit: "Start bit"
303408-303455 dmx512: bit: "0"
303455-303502 dmx512: bit: "0"
303502-303549 dmx512: bit: "0"
303549-303596 dmx512: bit: "0"
303596-303643 dmx512: bit: "0"
303643-303690 dmx512: bit: "0"
303690-303737 dmx512: bit: "0"
303737-303784 dmx512: bit: "0"
303784-303831 dmx512: stopbits: "Stop bit"
303831-303878 dmx512: stopbits: "Stop bit"
303361-303878 dmx512: channel: "Channel 228"
303408-303784 dmx512: data: "0 / 0x0"
303878-304067 dmx512: interframe: "Interframe"
304067-304114 dmx512: startbit: "Start bit"
304114-304161 dmx512: bit: "0"
304161-304208 dmx512: bit: "0"
304208-304255 dmx512: bit: "0"
304255-304302 dmx512: bit: "0"
304302-304349 dmx512: bit: "0"
304349-304396 dmx512: bit: "0"
304396-304443 dmx512: bit: "0"
304443-304490 dmx512: bit: "0"
304490-304537 dmx512: stopbits: "Stop bit"
304537-304584 dmx512: stopbits: "Stop bit"
304067-304584 dmx512: channel: "Channel 229"
304114-304490 dmx512: data: "0 / 0x0"
304584-304773 dmx512: interframe: "Interframe"
304773-304820 dmx512: startbit: "Start bit"
304820-304867 dmx512: bit: "0"
304867-304914 dmx512: bit: "0"
304914-304961 dmx512: bit: "0"
304961-305008 dmx512: bit: "0"
305008-305055 dmx512: bit: "0"
305055-305102 dmx512: bit: "0"
305102-305149 dmx512: bit: "0"
305149-305196 dmx512: bit: "0"
305196-305243 dmx512: stopbits: "Stop bit"
305243-305290 dmx512: stopbits: "Stop bit"
304773-305290 dmx512: channel: "Channel 230"
304820-305196 dmx512: data: "0 / 0x0"
305290-305479 dmx512: interframe: "Interframe"
305479-305526 dmx512: startbit: "Start bit"
305526-305573 dmx512: bit: "0"
305573-305620 dmx512: bit: "0"
305620-305667 dmx512: bit: "0"
305667-305714 dmx512: bit: "0"
305714-305761 dmx512: bit: "0"
305761-305808 dmx512: bit: "0"
305808-305855 dmx512: bit: "0"
305855-305902 dmx512: bit: "0"
305902-305949 dmx512: stopbits: "Stop bit"
305949-305996 dmx512: stopbits: "Stop bit"
305479-305996 dmx512: channel: "Channel 231"
305526-305902 dmx512: data: "0 / 0x0"
305996-306186 dmx512: interframe: "Interframe"
306186-306233 dmx512: startbit: "Start bit"
306233-306280 dmx512: bit: "0"
306280-306327 dmx512: bit: "0"
306327-306374 dmx512: bit: "0"
306374-306421 dmx512: bit: "0"
306421-306468 dmx512: bit: "0"
306468-306515 dmx512: bit: "0"
306515-306562 dmx512: bit: "0"
306562-306609 dmx512: bit: "0"
306609-306656 dmx512: stopbits: "Stop bit"
306656-306703 dmx512: stopbits: "Stop bit"
306186-306703 dmx512: channel: "Channel 232"
306233-306609 dmx512: data: "0 / 0x0"
306703-306892 dmx512: interframe: "Interframe"
306892-306939 dmx512: startbit: "Start bit"
306939-306986 dmx512: bit: "0"
306986-307033 dmx512: bit: "0"
307033-307080 dmx512: bit: "0"
307080-307127 dmx512: bit: "0"
307127-307174 dmx512: bit: "0"
307174-307221 dmx512: bit: "0"
307221-307268 dmx512: bit: "0"
307268-307315 dmx512: bit: "0"
307315-307362 dmx512: stopbits: "Stop bit"
307362-307409 dmx512: stopbits: "Stop bit"
306892-307409 dmx512: channel: "Channel 233"
306939-307315 dmx512: data: "0 / 0x0"
307409-307598 dmx512: interframe: "Interframe"
307598-307645 dmx512: startbit: "Start bit"
307645-307692 dmx512: bit: "0"
307692-307739 dmx512: bit: "0"
307739-307786 dmx512: bit: "0"
307786-307833 dmx512: bit: "0"
307833-307880 dmx512: bit: "0"
307880-307927 dmx512: bit: "0"
307927-307974 dmx512: bit: "0"
307974-308021 dmx512: bit: "0"
308021-308068 dmx512: stopbits: "Stop bit"
308068-308115 dmx512: stopbits: "Stop bit"
307598-308115 dmx512: channel: "Channel 234"
307645-308021 dmx512: data: "0 / 0x0"
308115-308304 dmx512: interframe: "Interframe"
308304-308351 dmx512: startbit: "Start bit"
308351-308398 dmx512: bit: "0"
308398-308445 dmx512: bit: "0"
308445-308492 dmx512: bit: "0"
308492-308539 dmx512: bit: "0"
308539-308586 dmx512: bit: "0"
308586-308633 dmx512: bit: "0"
308633-308680 dmx512: bit: "0"
308680-308727 dmx512: bit: "0"
308727-308774 dmx512: stopbits: "Stop bit"
308774-308821 dmx512: stopbits: "Stop bit"
308304-308821 dmx512: channel: "Channel 235"
308351-308727 dmx512: data: "0 / 0x0"
308821-309010 dmx512: interframe: "Interframe"
309010-309057 dmx512: startbit: "Start bit"
309057-309104 dmx512: bit: "0"
309104-309151 dmx512: bit: "0"
309151-309198 dmx512: bit: "0"
309198-309245 dmx512: bit: "0"
309245-309292 dmx512: bit: "0"
309292-309339 dmx512: bit: "0"
309339-309386 dmx512: bit: "0"
309386-309433 dmx512: bit: "0"
309433-309480 dmx512: stopbits: "Stop bit"
309480-309527 dmx512: stopbits: "Stop bit"
309010-309527 dmx512: channel: "Channel 236"
309057-309433 dmx512: data: "0 / 0x0"
309527-309716 dmx512: interframe: "Interframe"
309716-309763 dmx512: startbit: "Start bit"
309763-309810 dmx512: bit: "0"
309810-309857 dmx512: bit: "0"
309857-309904 dmx512: bit: "0"
309904-309951 dmx512: bit: "0"
309951-309998 dmx512: bit: "0"
309998-310045 dmx512: bit: "0"
310045-310092 dmx512: bit: "0"
310092-310139 dmx512: bit: "0"
310139-310186 dmx512: stopbits: "Stop bit"
310186-310233 dmx512: stopbits: "Stop bit"
309716-310233 dmx512: channel: "Channel 237"
309763-310139 dmx512: data: "0 / 0x0"
310233-310423 dmx512: interframe: "Interframe"
310423-310470 dmx512: startbit: "Start bit"
310470-310517 dmx512: bit: "0"
310517-310564 dmx512: bit: "0"
310564-310611 dmx512: bit: "0"
310611-310658 dmx512: bit: "0"
310658-310705 dmx512: bit: "0"
310705-310752 dmx512: bit: "0"
310752-310799 dmx512: bit: "0"
310799-310846 dmx512: bit: "0"
310846-310893 dmx512: stopbits: "Stop bit"
310893-310940 dmx512: stopbits: "Stop bit"
310423-310940 dmx512: channel: "Channel 238"
310470-310846 dmx512: data: "0 / 0x0"
310940-311129 dmx512: interframe: "Interframe"
311129-311176 dmx512: startbit: "Start bit"
311176-311223 dmx512: bit: "0"
311223-311270 dmx512: bit: "0"
311270-311317 dmx512: bit: "0"
311317-311364 dmx512: bit: "0"
311364-311411 dmx512: bit: "0"
311411-311458 dmx512: bit: "0"
311458-311505 dmx512: bit: "0"
311505-311552 dmx512: bit: "0"
311552-311599 dmx512: stopbits: "Stop bit"
311599-311646 dmx512: stopbits: "Stop bit"
311129-311646 dmx512: channel: "Channel 239"
311176-311552 dmx512: data: "0 / 0x0"
311646-311835 dmx512: interframe: "Interframe"
311835-311882 dmx512: startbit: "Start bit"
311882-311929 dmx512: bit: "0"
311929-311976 dmx512: bit: "0"
311976-312023 dmx512: bit: "0"
312023-312070 dmx512: bit: "0"
312070-312117 dmx512: bit: "0"
312117-312164 dmx512: bit: "0"
312164-312211 dmx512: bit: "0"
312211-312258 dmx512: bit: "0"
312258-312305 dmx512: stopbits: "Stop bit"
312305-312352 dmx512: stopbits: "Stop bit"
311835-312352 dmx512: channel: "Channel 240"
311882-312258 dmx512: data: "0 / 0x0"
312352-312541 dmx512: interframe: "Interframe"
312541-312588 dmx512: startbit: "Start bit"
312588-312635 dmx512: bit: "0"
312635-312682 dmx512: bit: "0"
312682-312729 dmx512: bit: "0"
312729-312776 dmx512: bit: "0"
312776-312823 dmx512: bit: "0"
312823-312870 dmx512: bit: "0"
312870-312917 dmx512: bit: "0"
312917-312964 dmx512: bit: "0"
312964-313011 dmx512: stopbits: "Stop bit"
313011-313058 dmx512: stopbits: "Stop bit"
312541-313058 dmx512: channel: "Channel 241"
312588-312964 dmx512: data: "0 / 0x0"
313058-313247 dmx512: interframe: "Interframe"
313247-313294 dmx512: startbit: "Start bit"
313294-313341 dmx512: bit: "0"
313341-313388 dmx512: bit: "0"
313388-313435 dmx512: bit: "0"
313435-313482 dmx512: bit: "0"
313482-313529 dmx512: bit: "0"
313529-313576 dmx512: bit: "0"
313576-313623 dmx512: bit: "0"
313623-313670 dmx512: bit: "0"
313670-313717 dmx512: stopbits: "Stop bit"
313717-313764 dmx512: stopbits: "Stop bit"
313247-313764 dmx512: channel: "Channel 242"
313294-313670 dmx512: data: "0 / 0x0"
313764-313953 dmx512: interframe: "Interframe"
313953-314000 dmx512: startbit: "Start bit"
314000-314047 dmx512: bit: "0"
314047-314094 dmx512: bit: "0"
314094-314141 dmx512: bit: "0"
314141-314188 dmx512: bit: "0"
314188-314235 dmx512: bit: "0"
314235-314282 dmx512: bit: "0"
314282-314329 dmx512: bit: "0"
314329-314376 dmx512: bit: "0"
314376-314423 dmx512: stopbits: "Stop bit"
314423-314470 dmx512: stopbits: "Stop bit"
313953-314470 dmx512: channel: "Channel 243"
314000-314376 dmx512: data: "0 / 0x0"
314470-314659 dmx512: interframe: "Interframe"
314659-314706 dmx512: startbit: "Start bit"
314706-314753 dmx512: bit: "0"
314753-314800 dmx512: bit: "0"
314800-314847 dmx512: bit: "0"
314847-314894 dmx512: bit: "0"
314894-314941 dmx512: bit: "0"
314941-314988 dmx512: bit: "0"
314988-315035 dmx512: bit: "0"
315035-315082 dmx512: bit: "0"
315082-315129 dmx512: stopbits: "Stop bit"
315129-315176 dmx512: stopbits: "Stop bit"
314659-315176 dmx512: channel: "Channel 244"
314706-315082 dmx512: data: "0 / 0x0"
315176-315366 dmx512: interframe: "Interframe"
315366-315413 dmx512: startbit: "Start bit"
315413-315460 dmx512: bit: "0"
315460-315507 dmx512: bit: "0"
315507-315554 dmx512: bit: "0"
315554-315601 dmx512: bit: "0"
315601-315648 dmx512: bit: "0"
315648-315695 dmx512: bit: "0"
315695-315742 dmx512: bit: "0"
315742-315789 dmx512: bit: "0"
315789-315836 dmx512: stopbits: "Stop bit"
315836-315883 dmx512: stopbits: "Stop bit"
315366-315883 dmx512: channel: "Channel 245"
315413-315789 dmx512: data: "0 / 0x0"
315883-316072 dmx512: interframe: "Interframe"
316072-316119 dmx512: startbit: "Start bit"
316119-316166 dmx512: bit: "0"
316166-316213 dmx512: bit: "0"
316213-316260 dmx512: bit: "0"
316260-316307 dmx512: bit: "0"
316307-316354 dmx512: bit: "0"
316354-316401 dmx512: bit: "0"
316401-316448 dmx512: bit: "0"
316448-316495 dmx512: bit: "0"
316495-316542 dmx512: stopbits: "Stop bit"
316542-316589 dmx512: stopbits: "Stop bit"
316072-316589 dmx512: channel: "Channel 246"
316119-316495 dmx512: data: "0 / 0x0"
316589-316778 dmx512: interframe: "Interframe"
316778-316825 dmx512: startbit: "Start bit"
316825-316872 dmx512: bit: "0"
316872-316919 dmx512: bit: "0"
316919-316966 dmx512: bit: "0"
316966-317013 dmx512: bit: "0"
317013-317060 dmx512: bit: "0"
317060-317107 dmx512: bit: "0"
317107-317154 dmx512: bit: "0"
317154-317201 dmx512: bit: "0"
317201-317248 dmx512: stopbits: "Stop bit"
317248-317295 dmx512: stopbits: "Stop bit"
316778-317295 dmx512: channel: "Channel 247"
316825-317201 dmx512: data: "0 / 0x0"
317295-317484 dmx512: interframe: "Interframe"
317484-317531 dmx512: startbit: "Start bit"
317531-317578 dmx512: bit: "0"
317578-317625 dmx512: bit: "0"
317625-317672 dmx512: bit: "0"
317672-317719 dmx512: bit: "0"
317719-317766 dmx512: bit: "0"
317766-317813 dmx512: bit: "0"
317813-317860 dmx512: bit: "0"
317860-317907 dmx512: bit: "0"
317907-317954 dmx512: stopbits: "Stop bit"
317954-318001 dmx512: stopbits: "Stop bit"
317484-318001 dmx512: channel: "Channel 248"
317531-317907 dmx512: data: "0 / 0x0"
318001-318190 dmx512: interframe: "Interframe"
318190-318237 dmx512: startbit: "Start bit"
318237-318284 dmx512: bit: "0"
318284-318331 dmx512: bit: "0"
318331-318378 dmx512: bit: "0"
318378-318425 dmx512: bit: "0"
318425-318472 dmx512: bit: "0"
318472-318519 dmx512: bit: "0"
318519-318566 dmx512: bit: "0"
318566-318613 dmx512: bit: "0"
318613-318660 dmx512: stopbits: "Stop bit"
318660-318707 dmx512: stopbits: "Stop bit"
318190-318707 dmx512: channel: "Channel 249"
318237-318613 dmx512: data: "0 / 0x0"
318707-318896 dmx512: interframe: "Interframe"
318896-318943 dmx512: startbit: "Start bit"
318943-318990 dmx512: bit: "0"
318990-319037 dmx512: bit: "0"
319037-319084 dmx512: bit: "0"
319084-319131 dmx512: bit: "0"
319131-319178 dmx512: bit: "0"
319178-319225 dmx512: bit: "0"
319225-319272 dmx512: bit: "0"
319272-319319 dmx512: bit: "0"
319319-319366 dmx512: stopbits: "Stop bit"
319366-319413 dmx512: stopbits: "Stop bit"
318896-319413 dmx512: channel: "Channel 250"
318943-319319 dmx512: data: "0 / 0x0"
319413-319603 dmx512: interframe: "Interframe"
319603-319650 dmx512: startbit: "Start bit"
319650-319697 dmx512: bit: "0"
319697-319744 dmx512: bit: "0"
319744-319791 dmx512: bit: "0"
319791-319838 dmx512: bit: "0"
319838-319885 dmx512: bit: "0"
319885-319932 dmx512: bit: "0"
319932-319979 dmx512: bit: "0"
319979-320026 dmx512: bit: "0"
320026-320073 dmx512: stopbits: "Stop bit"
320073-320120 dmx512: stopbits: "Stop bit"
319603-320120 dmx512: channel: "Channel 251"
319650-320026 dmx512: data: "0 / 0x0"
320120-320309 dmx512: interframe: "Interframe"
320309-320356 dmx512: startbit: "Start bit"
320356-320403 dmx512: bit: "0"
320403-320450 dmx512: bit: "0"
320450-320497 dmx512: bit: "0"
320497-320544 dmx512: bit: "0"
320544-320591 dmx512: bit: "0"
320591-320638 dmx512: bit: "0"
320638-320685 dmx512: bit: "0"
320685-320732 dmx512: bit: "0"
320732-320779 dmx512: stopbits: "Stop bit"
320779-320826 dmx512: stopbits: "Stop bit"
320309-320826 dmx512: channel: "Channel 252"
320356-320732 dmx512: data: "0 / 0x0"
320826-321015 dmx512: interframe: "Interframe"
321015-321062 dmx512: startbit: "Start bit"
321062-321109 dmx512: bit: "0"
321109-321156 dmx512: bit: "0"
321156-321203 dmx512: bit: "0"
321203-321250 dmx512: bit: "0"
321250-321297 dmx512: bit: "0"
321297-321344 dmx512: bit: "0"
321344-321391 dmx512: bit: "0"
321391-321438 dmx512: bit: "0"
321438-321485 dmx512: stopbits: "Stop bit"
321485-321532 dmx512: stopbits: "Stop bit"
321015-321532 dmx512: channel: "Channel 253"
321062-321438 dmx512: data: "0 / 0x0"
321532-321721 dmx512: interframe: "Interframe"
321721-321768 dmx512: startbit: "Start bit"
321768-321815 dmx512: bit: "0"
321815-321862 dmx512: bit: "0"
321862-321909 dmx512: bit: "0"
321909-321956 dmx512: bit: "0"
321956-322003 dmx512: bit: "0"
322003-322050 dmx512: bit: "0"
322050-322097 dmx512: bit: "0"
322097-322144 dmx512: bit: "0"
322144-322191 dmx512: stopbits: "Stop bit"
322191-322238 dmx512: stopbits: "Stop bit"
321721-322238 dmx512: channel: "Channel 254"
321768-322144 dmx512: data: "0 / 0x0"
322238-322427 dmx512: interframe: "Interframe"
322427-322474 dmx512: startbit: "Start bit"
322474-322521 dmx512: bit: "0"
322521-322568 dmx512: bit: "0"
322568-322615 dmx512: bit: "0"
322615-322662 dmx512: bit: "0"
322662-322709 dmx512: bit: "0"
322709-322756 dmx512: bit: "0"
322756-322803 dmx512: bit: "0"
322803-322850 dmx512: bit: "0"
322850-322897 dmx512: stopbits: "Stop bit"
322897-322944 dmx512: stopbits: "Stop bit"
322427-322944 dmx512: channel: "Channel 255"
322474-322850 dmx512: data: "0 / 0x0"
322944-323133 dmx512: interframe: "Interframe"
323133-323180 dmx512: startbit: "Start bit"
323180-323227 dmx512: bit: "0"
323227-323274 dmx512: bit: "0"
323274-323321 dmx512: bit: "0"
323321-323368 dmx512: bit: "0"
323368-323415 dmx512: bit: "0"
323415-323462 dmx512: bit: "0"
323462-323509 dmx512: bit: "0"
323509-323556 dmx512: bit: "0"
323556-323603 dmx512: stopbits: "Stop bit"
323603-323650 dmx512: stopbits: "Stop bit"
323133-323650 dmx512: channel: "Channel 256"
323180-323556 dmx512: data: "0 / 0x0"
323650-323840 dmx512: interframe: "Interframe"
323840-323887 dmx512: startbit: "Start bit"
323887-323934 dmx512: bit: "0"
323934-323981 dmx512: bit: "0"
323981-324028 dmx512: bit: "0"
324028-324075 dmx512: bit: "0"
324075-324122 dmx512: bit: "0"
324122-324169 dmx512: bit: "0"
324169-324216 dmx512: bit: "0"
324216-324263 dmx512: bit: "0"
324263-324310 dmx512: stopbits: "Stop bit"
324310-324357 dmx512: stopbits: "Stop bit"
323840-324357 dmx512: channel: "Channel 257"
323887-324263 dmx512: data: "0 / 0x0"
324357-324546 dmx512: interframe: "Interframe"
324546-324593 dmx512: startbit: "Start bit"
324593-324640 dmx512: bit: "0"
324640-324687 dmx512: bit: "0"
324687-324734 dmx512: bit: "0"
324734-324781 dmx512: bit: "0"
324781-324828 dmx512: bit: "0"
324828-324875 dmx512: bit: "0"
324875-324922 dmx512: bit: "0"
324922-324969 dmx512: bit: "0"
324969-325016 dmx512: stopbits: "Stop bit"
325016-325063 dmx512: stopbits: "Stop bit"
324546-325063 dmx512: channel: "Channel 258"
324593-324969 dmx512: data: "0 / 0x0"
325063-325252 dmx512: interframe: "Interframe"
325252-325299 dmx512: startbit: "Start bit"
325299-325346 dmx512: bit: "0"
325346-325393 dmx512: bit: "0"
325393-325440 dmx512: bit: "0"
325440-325487 dmx512: bit: "0"
325487-325534 dmx512: bit: "0"
325534-325581 dmx512: bit: "0"
325581-325628 dmx512: bit: "0"
325628-325675 dmx512: bit: "0"
325675-325722 dmx512: stopbits: "Stop bit"
325722-325769 dmx512: stopbits: "Stop bit"
325252-325769 dmx512: channel: "Channel 259"
325299-325675 dmx512: data: "0 / 0x0"
325769-325958 dmx512: interframe: "Interframe"
325958-326005 dmx512: startbit: "Start bit"
326005-326052 dmx512: bit: "0"
326052-326099 dmx512: bit: "0"
326099-326146 dmx512: bit: "0"
326146-326193 dmx512: bit: "0"
326193-326240 dmx512: bit: "0"
326240-326287 dmx512: bit: "0"
326287-326334 dmx512: bit: "0"
326334-326381 dmx512: bit: "0"
326381-326428 dmx512: stopbits: "Stop bit"
326428-326475 dmx512: stopbits: "Stop bit"
325958-326475 dmx512: channel: "Channel 260"
326005-326381 dmx512: data: "0 / 0x0"
326475-326664 dmx512: interframe: "Interframe"
326664-326711 dmx512: startbit: "Start bit"
326711-326758 dmx512: bit: "0"
326758-326805 dmx512: bit: "0"
326805-326852 dmx512: bit: "0"
326852-326899 dmx512: bit: "0"
326899-326946 dmx512: bit: "0"
326946-326993 dmx512: bit: "0"
326993-327040 dmx512: bit: "0"
327040-327087 dmx512: bit: "0"
327087-327134 dmx512: stopbits: "Stop bit"
327134-327181 dmx512: stopbits: "Stop bit"
326664-327181 dmx512: channel: "Channel 261"
326711-327087 dmx512: data: "0 / 0x0"
327181-327370 dmx512: interframe: "Interframe"
327370-327417 dmx512: startbit: "Start bit"
327417-327464 dmx512: bit: "0"
327464-327511 dmx512: bit: "0"
327511-327558 dmx512: bit: "0"
327558-327605 dmx512: bit: "0"
327605-327652 dmx512: bit: "0"
327652-327699 dmx512: bit: "0"
327699-327746 dmx512: bit: "0"
327746-327793 dmx512: bit: "0"
327793-327840 dmx512: stopbits: "Stop bit"
327840-327887 dmx512: stopbits: "Stop bit"
327370-327887 dmx512: channel: "Channel 262"
327417-327793 dmx512: data: "0 / 0x0"
327887-328077 dmx512: interframe: "Interframe"
328077-328124 dmx512: startbit: "Start bit"
328124-328171 dmx512: bit: "0"
328171-328218 dmx512: bit: "0"
328218-328265 dmx512: bit: "0"
328265-328312 dmx512: bit: "0"
328312-328359 dmx512: bit: "0"
328359-328406 dmx512: bit: "0"
328406-328453 dmx512: bit: "0"
328453-328500 dmx512: bit: "0"
328500-328547 dmx512: stopbits: "Stop bit"
328547-328594 dmx512: stopbits: "Stop bit"
328077-328594 dmx512: channel: "Channel 263"
328124-328500 dmx512: data: "0 / 0x0"
328594-328783 dmx512: interframe: "Interframe"
328783-328830 dmx512: startbit: "Start bit"
328830-328877 dmx512: bit: "0"
328877-328924 dmx512: bit: "0"
328924-328971 dmx512: bit: "0"
328971-329018 dmx512: bit: "0"
329018-329065 dmx512: bit: "0"
329065-329112 dmx512: bit: "0"
329112-329159 dmx512: bit: "0"
329159-329206 dmx512: bit: "0"
329206-329253 dmx512: stopbits: "Stop bit"
329253-329300 dmx512: stopbits: "Stop bit"
328783-329300 dmx512: channel: "Channel 264"
328830-329206 dmx512: data: "0 / 0x0"
329300-329489 dmx512: interframe: "Interframe"
329489-329536 dmx512: startbit: "Start bit"
329536-329583 dmx512: bit: "0"
329583-329630 dmx512: bit: "0"
329630-329677 dmx512: bit: "0"
329677-329724 dmx512: bit: "0"
329724-329771 dmx512: bit: "0"
329771-329818 dmx512: bit: "0"
329818-329865 dmx512: bit: "0"
329865-329912 dmx512: bit: "0"
329912-329959 dmx512: stopbits: "Stop bit"
329959-330006 dmx512: stopbits: "Stop bit"
329489-330006 dmx512: channel: "Channel 265"
329536-329912 dmx512: data: "0 / 0x0"
330006-330195 dmx512: interframe: "Interframe"
330195-330242 dmx512: startbit: "Start bit"
330242-330289 dmx512: bit: "0"
330289-330336 dmx512: bit: "0"
330336-330383 dmx512: bit: "0"
330383-330430 dmx512: bit: "0"
330430-330477 dmx512: bit: "0"
330477-330524 dmx512: bit: "0"
330524-330571 dmx512: bit: "0"
330571-330618 dmx512: bit: "0"
330618-330665 dmx512: stopbits: "Stop bit"
330665-330712 dmx512: stopbits: "Stop bit"
330195-330712 dmx512: channel: "Channel 266"
330242-330618 dmx512: data: "0 / 0x0"
330712-330901 dmx512: interframe: "Interframe"
330901-330948 dmx512: startbit: "Start bit"
330948-330995 dmx512: bit: "0"
330995-331042 dmx512: bit: "0"
331042-331089 dmx512: bit: "0"
331089-331136 dmx512: bit: "0"
331136-331183 dmx512: bit: "0"
331183-331230 dmx512: bit: "0"
331230-331277 dmx512: bit: "0"
331277-331324 dmx512: bit: "0"
331324-331371 dmx512: stopbits: "Stop bit"
331371-331418 dmx512: stopbits: "Stop bit"
330901-331418 dmx512: channel: "Channel 267"
330948-331324 dmx512: data: "0 / 0x0"
331418-331607 dmx512: interframe: "Interframe"
331607-331654 dmx512: startbit: "Start bit"
331654-331701 dmx512: bit: "0"
331701-331748 dmx512: bit: "0"
331748-331795 dmx512: bit: "0"
331795-331842 dmx512: bit: "0"
331842-331889 dmx512: bit: "0"
331889-331936 dmx512: bit: "0"
331936-331983 dmx512: bit: "0"
331983-332030 dmx512: bit: "0"
332030-332077 dmx512: stopbits: "Stop bit"
332077-332124 dmx512: stopbits: "Stop bit"
331607-332124 dmx512: channel: "Channel 268"
331654-332030 dmx512: data: "0 / 0x0"
332124-332313 dmx512: interframe: "Interframe"
332313-332360 dmx512: startbit: "Start bit"
332360-332407 dmx512: bit: "0"
332407-332454 dmx512: bit: "0"
332454-332501 dmx512: bit: "0"
332501-332548 dmx512: bit: "0"
332548-332595 dmx512: bit: "0"
332595-332642 dmx512: bit: "0"
332642-332689 dmx512: bit: "0"
332689-332736 dmx512: bit: "0"
332736-332783 dmx512: stopbits: "Stop bit"
332783-332830 dmx512: stopbits: "Stop bit"
332313-332830 dmx512: channel: "Channel 269"
332360-332736 dmx512: data: "0 / 0x0"
332830-333020 dmx512: interframe: "Interframe"
333020-333067 dmx512: startbit: "Start bit"
333067-333114 dmx512: bit: "0"
333114-333161 dmx512: bit: "0"
333161-333208 dmx512: bit: "0"
333208-333255 dmx512: bit: "0"
333255-333302 dmx512: bit: "0"
333302-333349 dmx512: bit: "0"
333349-333396 dmx512: bit: "0"
333396-333443 dmx512: bit: "0"
333443-333490 dmx512: stopbits: "Stop bit"
333490-333537 dmx512: stopbits: "Stop bit"
333020-333537 dmx512: channel: "Channel 270"
333067-333443 dmx512: data: "0 / 0x0"
333537-333726 dmx512: interframe: "Interframe"
333726-333773 dmx512: startbit: "Start bit"
333773-333820 dmx512: bit: "0"
333820-333867 dmx512: bit: "0"
333867-333914 dmx512: bit: "0"
333914-333961 dmx512: bit: "0"
333961-334008 dmx512: bit: "0"
334008-334055 dmx512: bit: "0"
334055-334102 dmx512: bit: "0"
334102-334149 dmx512: bit: "0"
334149-334196 dmx512: stopbits: "Stop bit"
334196-334243 dmx512: stopbits: "Stop bit"
333726-334243 dmx512: channel: "Channel 271"
333773-334149 dmx512: data: "0 / 0x0"
334243-334432 dmx512: interframe: "Interframe"
334432-334479 dmx512: startbit: "Start bit"
334479-334526 dmx512: bit: "0"
334526-334573 dmx512: bit: "0"
334573-334620 dmx512: bit: "0"
334620-334667 dmx512: bit: "0"
334667-334714 dmx512: bit: "0"
334714-334761 dmx512: bit: "0"
334761-334808 dmx512: bit: "0"
334808-334855 dmx512: bit: "0"
334855-334902 dmx512: stopbits: "Stop bit"
334902-334949 dmx512: stopbits: "Stop bit"
334432-334949 dmx512: channel: "Channel 272"
334479-334855 dmx512: data: "0 / 0x0"
334949-335138 dmx512: interframe: "Interframe"
335138-335185 dmx512: startbit: "Start bit"
335185-335232 dmx512: bit: "0"
335232-335279 dmx512: bit: "0"
335279-335326 dmx512: bit: "0"
335326-335373 dmx512: bit: "0"
335373-335420 dmx512: bit: "0"
335420-335467 dmx512: bit: "0"
335467-335514 dmx512: bit: "0"
335514-335561 dmx512: bit: "0"
335561-335608 dmx512: stopbits: "Stop bit"
335608-335655 dmx512: stopbits: "Stop bit"
335138-335655 dmx512: channel: "Channel 273"
335185-335561 dmx512: data: "0 / 0x0"
335655-335844 dmx512: interframe: "Interframe"
335844-335891 dmx512: startbit: "Start bit"
335891-335938 dmx512: bit: "0"
335938-335985 dmx512: bit: "0"
335985-336032 dmx512: bit: "0"
336032-336079 dmx512: bit: "0"
336079-336126 dmx512: bit: "0"
336126-336173 dmx512: bit: "0"
336173-336220 dmx512: bit: "0"
336220-336267 dmx512: bit: "0"
336267-336314 dmx512: stopbits: "Stop bit"
336314-336361 dmx512: stopbits: "Stop bit"
335844-336361 dmx512: channel: "Channel 274"
335891-336267 dmx512: data: "0 / 0x0"
336361-336550 dmx512: interframe: "Interframe"
336550-336597 dmx512: startbit: "Start bit"
336597-336644 dmx512: bit: "0"
336644-336691 dmx512: bit: "0"
336691-336738 dmx512: bit: "0"
336738-336785 dmx512: bit: "0"
336785-336832 dmx512: bit: "0"
336832-336879 dmx512: bit: "0"
336879-336926 dmx512: bit: "0"
336926-336973 dmx512: bit: "0"
336973-337020 dmx512: stopbits: "Stop bit"
337020-337067 dmx512: stopbits: "Stop bit"
336550-337067 dmx512: channel: "Channel 275"
336597-336973 dmx512: data: "0 / 0x0"
337067-337257 dmx512: interframe: "Interframe"
337257-337304 dmx512: startbit: "Start bit"
337304-337351 dmx512: bit: "0"
337351-337398 dmx512: bit: "0"
337398-337445 dmx512: bit: "0"
337445-337492 dmx512: bit: "0"
337492-337539 dmx512: bit: "0"
337539-337586 dmx512: bit: "0"
337586-337633 dmx512: bit: "0"
337633-337680 dmx512: bit: "0"
337680-337727 dmx512: stopbits: "Stop bit"
337727-337774 dmx512: stopbits: "Stop bit"
337257-337774 dmx512: channel: "Channel 276"
337304-337680 dmx512: data: "0 / 0x0"
337774-337963 dmx512: interframe: "Interframe"
337963-338010 dmx512: startbit: "Start bit"
338010-338057 dmx512: bit: "0"
338057-338104 dmx512: bit: "0"
338104-338151 dmx512: bit: "0"
338151-338198 dmx512: bit: "0"
338198-338245 dmx512: bit: "0"
338245-338292 dmx512: bit: "0"
338292-338339 dmx512: bit: "0"
338339-338386 dmx512: bit: "0"
338386-338433 dmx512: stopbits: "Stop bit"
338433-338480 dmx512: stopbits: "Stop bit"
337963-338480 dmx512: channel: "Channel 277"
338010-338386 dmx512: data: "0 / 0x0"
338480-338669 dmx512: interframe: "Interframe"
338669-338716 dmx512: startbit: "Start bit"
338716-338763 dmx512: bit: "0"
338763-338810 dmx512: bit: "0"
338810-338857 dmx512: bit: "0"
338857-338904 dmx512: bit: "0"
338904-338951 dmx512: bit: "0"
338951-338998 dmx512: bit: "0"
338998-339045 dmx512: bit: "0"
339045-339092 dmx512: bit: "0"
339092-339139 dmx512: stopbits: "Stop bit"
339139-339186 dmx512: stopbits: "Stop bit"
338669-339186 dmx512: channel: "Channel 278"
338716-339092 dmx512: data: "0 / 0x0"
339186-339375 dmx512: interframe: "Interframe"
339375-339422 dmx512: startbit: "Start bit"
339422-339469 dmx512: bit: "0"
339469-339516 dmx512: bit: "0"
339516-339563 dmx512: bit: "0"
339563-339610 dmx512: bit: "0"
339610-339657 dmx512: bit: "0"
339657-339704 dmx512: bit: "0"
339704-339751 dmx512: bit: "0"
339751-339798 dmx512: bit: "0"
339798-339845 dmx512: stopbits: "Stop bit"
339845-339892 dmx512: stopbits: "Stop bit"
339375-339892 dmx512: channel: "Channel 279"
339422-339798 dmx512: data: "0 / 0x0"
339892-340081 dmx512: interframe: "Interframe"
340081-340128 dmx512: startbit: "Start bit"
340128-340175 dmx512: bit: "0"
340175-340222 dmx512: bit: "0"
340222-340269 dmx512: bit: "0"
340269-340316 dmx512: bit: "0"
340316-340363 dmx512: bit: "0"
340363-340410 dmx512: bit: "0"
340410-340457 dmx512: bit: "0"
340457-340504 dmx512: bit: "0"
340504-340551 dmx512: stopbits: "Stop bit"
340551-340598 dmx512: stopbits: "Stop bit"
340081-340598 dmx512: channel: "Channel 280"
340128-340504 dmx512: data: "0 / 0x0"
340598-340787 dmx512: interframe: "Interframe"
340787-340834 dmx512: startbit: "Start bit"
340834-340881 dmx512: bit: "0"
340881-340928 dmx512: bit: "0"
340928-340975 dmx512: bit: "0"
340975-341022 dmx512: bit: "0"
341022-341069 dmx512: bit: "0"
341069-341116 dmx512: bit: "0"
341116-341163 dmx512: bit: "0"
341163-341210 dmx512: bit: "0"
341210-341257 dmx512: stopbits: "Stop bit"
341257-341304 dmx512: stopbits: "Stop bit"
340787-341304 dmx512: channel: "Channel 281"
340834-341210 dmx512: data: "0 / 0x0"
341304-341494 dmx512: interframe: "Interframe"
341494-341541 dmx512: startbit: "Start bit"
341541-341588 dmx512: bit: "0"
341588-341635 dmx512: bit: "0"
341635-341682 dmx512: bit: "0"
341682-341729 dmx512: bit: "0"
341729-341776 dmx512: bit: "0"
341776-341823 dmx512: bit: "0"
341823-341870 dmx512: bit: "0"
341870-341917 dmx512: bit: "0"
341917-341964 dmx512: stopbits: "Stop bit"
341964-342011 dmx512: stopbits: "Stop bit"
341494-342011 dmx512: channel: "Channel 282"
341541-341917 dmx512: data: "0 / 0x0"
342011-342200 dmx512: interframe: "Interframe"
342200-342247 dmx512: startbit: "Start bit"
342247-342294 dmx512: bit: "0"
342294-342341 dmx512: bit: "0"
342341-342388 dmx512: bit: "0"
342388-342435 dmx512: bit: "0"
342435-342482 dmx512: bit: "0"
342482-342529 dmx512: bit: "0"
342529-342576 dmx512: bit: "0"
342576-342623 dmx512: bit: "0"
342623-342670 dmx512: stopbits: "Stop bit"
342670-342717 dmx512: stopbits: "Stop bit"
342200-342717 dmx512: channel: "Channel 283"
342247-342623 dmx512: data: "0 / 0x0"
342717-342906 dmx512: interframe: "Interframe"
342906-342953 dmx512: startbit: "Start bit"
342953-343000 dmx512: bit: "0"
343000-343047 dmx512: bit: "0"
343047-343094 dmx512: bit: "0"
343094-343141 dmx512: bit: "0"
343141-343188 dmx512: bit: "0"
343188-343235 dmx512: bit: "0"
343235-343282 dmx512: bit: "0"
343282-343329 dmx512: bit: "0"
343329-343376 dmx512: stopbits: "Stop bit"
343376-343423 dmx512: stopbits: "Stop bit"
342906-343423 dmx512: channel: "Channel 284"
342953-343329 dmx512: data: "0 / 0x0"
343423-343612 dmx512: interframe: "Interframe"
343612-343659 dmx512: startbit: "Start bit"
343659-343706 dmx512: bit: "0"
343706-343753 dmx512: bit: "0"
343753-343800 dmx512: bit: "0"
343800-343847 dmx512: bit: "0"
343847-343894 dmx512: bit: "0"
343894-343941 dmx512: bit: "0"
343941-343988 dmx512: bit: "0"
343988-344035 dmx512: bit: "0"
344035-344082 dmx512: stopbits: "Stop bit"
344082-344129 dmx512: stopbits: "Stop bit"
343612-344129 dmx512: channel: "Channel 285"
343659-344035 dmx512: data: "0 / 0x0"
344129-344318 dmx512: interframe: "Interframe"
344318-344365 dmx512: startbit: "Start bit"
344365-344412 dmx512: bit: "0"
344412-344459 dmx512: bit: "0"
344459-344506 dmx512: bit: "0"
344506-344553 dmx512: bit: "0"
344553-344600 dmx512: bit: "0"
344600-344647 dmx512: bit: "0"
344647-344694 dmx512: bit: "0"
344694-344741 dmx512: bit: "0"
344741-344788 dmx512: stopbits: "Stop bit"
344788-344835 dmx512: stopbits: "Stop bit"
344318-344835 dmx512: channel: "Channel 286"
344365-344741 dmx512: data: "0 / 0x0"
344835-345024 dmx512: interframe: "Interframe"
345024-345071 dmx512: startbit: "Start bit"
345071-345118 dmx512: bit: "0"
345118-345165 dmx512: bit: "0"
345165-345212 dmx512: bit: "0"
345212-345259 dmx512: bit: "0"
345259-345306 dmx512: bit: "0"
345306-345353 dmx512: bit: "0"
345353-345400 dmx512: bit: "0"
345400-345447 dmx512: bit: "0"
345447-345494 dmx512: stopbits: "Stop bit"
345494-345541 dmx512: stopbits: "Stop bit"
345024-345541 dmx512: channel: "Channel 287"
345071-345447 dmx512: data: "0 / 0x0"
345541-345731 dmx512: interframe: "Interframe"
345731-345778 dmx512: startbit: "Start bit"
345778-345825 dmx512: bit: "0"
345825-345872 dmx512: bit: "0"
345872-345919 dmx512: bit: "0"
345919-345966 dmx512: bit: "0"
345966-346013 dmx512: bit: "0"
346013-346060 dmx512: bit: "0"
346060-346107 dmx512: bit: "0"
346107-346154 dmx512: bit: "0"
346154-346201 dmx512: stopbits: "Stop bit"
346201-346248 dmx512: stopbits: "Stop bit"
345731-346248 dmx512: channel: "Channel 288"
345778-346154 dmx512: data: "0 / 0x0"
346248-346437 dmx512: interframe: "Interframe"
346437-346484 dmx512: startbit: "Start bit"
346484-346531 dmx512: bit: "0"
346531-346578 dmx512: bit: "0"
346578-346625 dmx512: bit: "0"
346625-346672 dmx512: bit: "0"
346672-346719 dmx512: bit: "0"
346719-346766 dmx512: bit: "0"
346766-346813 dmx512: bit: "0"
346813-346860 dmx512: bit: "0"
346860-346907 dmx512: stopbits: "Stop bit"
346907-346954 dmx512: stopbits: "Stop bit"
346437-346954 dmx512: channel: "Channel 289"
346484-346860 dmx512: data: "0 / 0x0"
346954-347143 dmx512: interframe: "Interframe"
347143-347190 dmx512: startbit: "Start bit"
347190-347237 dmx512: bit: "0"
347237-347284 dmx512: bit: "0"
347284-347331 dmx512: bit: "0"
347331-347378 dmx512: bit: "0"
347378-347425 dmx512: bit: "0"
347425-347472 dmx512: bit: "0"
347472-347519 dmx512: bit: "0"
347519-347566 dmx512: bit: "0"
347566-347613 dmx512: stopbits: "Stop bit"
347613-347660 dmx512: stopbits: "Stop bit"
347143-347660 dmx512: channel: "Channel 290"
347190-347566 dmx512: data: "0 / 0x0"
347660-347849 dmx512: interframe: "Interframe"
347849-347896 dmx512: startbit: "Start bit"
347896-347943 dmx512: bit: "0"
347943-347990 dmx512: bit: "0"
347990-348037 dmx512: bit: "0"
348037-348084 dmx512: bit: "0"
348084-348131 dmx512: bit: "0"
348131-348178 dmx512: bit: "0"
348178-348225 dmx512: bit: "0"
348225-348272 dmx512: bit: "0"
348272-348319 dmx512: stopbits: "Stop bit"
348319-348366 dmx512: stopbits: "Stop bit"
347849-348366 dmx512: channel: "Channel 291"
347896-348272 dmx512: data: "0 / 0x0"
348366-348555 dmx512: interframe: "Interframe"
348555-348602 dmx512: startbit: "Start bit"
348602-348649 dmx512: bit: "0"
348649-348696 dmx512: bit: "0"
348696-348743 dmx512: bit: "0"
348743-348790 dmx512: bit: "0"
348790-348837 dmx512: bit: "0"
348837-348884 dmx512: bit: "0"
348884-348931 dmx512: bit: "0"
348931-348978 dmx512: bit: "0"
348978-349025 dmx512: stopbits: "Stop bit"
349025-349072 dmx512: stopbits: "Stop bit"
348555-349072 dmx512: channel: "Channel 292"
348602-348978 dmx512: data: "0 / 0x0"
349072-349261 dmx512: interframe: "Interframe"
349261-349308 dmx512: startbit: "Start bit"
349308-349355 dmx512: bit: "0"
349355-349402 dmx512: bit: "0"
349402-349449 dmx512: bit: "0"
349449-349496 dmx512: bit: "0"
349496-349543 dmx512: bit: "0"
349543-349590 dmx512: bit: "0"
349590-349637 dmx512: bit: "0"
349637-349684 dmx512: bit: "0"
349684-349731 dmx512: stopbits: "Stop bit"
349731-349778 dmx512: stopbits: "Stop bit"
349261-349778 dmx512: channel: "Channel 293"
349308-349684 dmx512: data: "0 / 0x0"
349778-349968 dmx512: interframe: "Interframe"
349968-350015 dmx512: startbit: "Start bit"
350015-350062 dmx512: bit: "0"
350062-350109 dmx512: bit: "0"
350109-350156 dmx512: bit: "0"
350156-350203 dmx512: bit: "0"
350203-350250 dmx512: bit: "0"
350250-350297 dmx512: bit: "0"
350297-350344 dmx512: bit: "0"
350344-350391 dmx512: bit: "0"
350391-350438 dmx512: stopbits: "Stop bit"
350438-350485 dmx512: stopbits: "Stop bit"
349968-350485 dmx512: channel: "Channel 294"
350015-350391 dmx512: data: "0 / 0x0"
350485-350674 dmx512: interframe: "Interframe"
350674-350721 dmx512: startbit: "Start bit"
350721-350768 dmx512: bit: "0"
350768-350815 dmx512: bit: "0"
350815-350862 dmx512: bit: "0"
350862-350909 dmx512: bit: "0"
350909-350956 dmx512: bit: "0"
350956-351003 dmx512: bit: "0"
351003-351050 dmx512: bit: "0"
351050-351097 dmx512: bit: "0"
351097-351144 dmx512: stopbits: "Stop bit"
351144-351191 dmx512: stopbits: "Stop bit"
350674-351191 dmx512: channel: "Channel 295"
350721-351097 dmx512: data: "0 / 0x0"
351191-351380 dmx512: interframe: "Interframe"
351380-351427 dmx512: startbit: "Start bit"
351427-351474 dmx512: bit: "0"
351474-351521 dmx512: bit: "0"
351521-351568 dmx512: bit: "0"
351568-351615 dmx512: bit: "0"
351615-351662 dmx512: bit: "0"
351662-351709 dmx512: bit: "0"
351709-351756 dmx512: bit: "0"
351756-351803 dmx512: bit: "0"
351803-351850 dmx512: stopbits: "Stop bit"
351850-351897 dmx512: stopbits: "Stop bit"
351380-351897 dmx512: channel: "Channel 296"
351427-351803 dmx512: data: "0 / 0x0"
351897-352086 dmx512: interframe: "Interframe"
352086-352133 dmx512: startbit: "Start bit"
352133-352180 dmx512: bit: "0"
352180-352227 dmx512: bit: "0"
352227-352274 dmx512: bit: "0"
352274-352321 dmx512: bit: "0"
352321-352368 dmx512: bit: "0"
352368-352415 dmx512: bit: "0"
352415-352462 dmx512: bit: "0"
352462-352509 dmx512: bit: "0"
352509-352556 dmx512: stopbits: "Stop bit"
352556-352603 dmx512: stopbits: "Stop bit"
352086-352603 dmx512: channel: "Channel 297"
352133-352509 dmx512: data: "0 / 0x0"
352603-352792 dmx512: interframe: "Interframe"
352792-352839 dmx512: startbit: "Start bit"
352839-352886 dmx512: bit: "0"
352886-352933 dmx512: bit: "0"
352933-352980 dmx512: bit: "0"
352980-353027 dmx512: bit: "0"
353027-353074 dmx512: bit: "0"
353074-353121 dmx512: bit: "0"
353121-353168 dmx512: bit: "0"
353168-353215 dmx512: bit: "0"
353215-353262 dmx512: stopbits: "Stop bit"
353262-353309 dmx512: stopbits: "Stop bit"
352792-353309 dmx512: channel: "Channel 298"
352839-353215 dmx512: data: "0 / 0x0"
353309-353498 dmx512: interframe: "Interframe"
353498-353545 dmx512: startbit: "Start bit"
353545-353592 dmx512: bit: "0"
353592-353639 dmx512: bit: "0"
353639-353686 dmx512: bit: "0"
353686-353733 dmx512: bit: "0"
353733-353780 dmx512: bit: "0"
353780-353827 dmx512: bit: "0"
353827-353874 dmx512: bit: "0"
353874-353921 dmx512: bit: "0"
353921-353968 dmx512: stopbits: "Stop bit"
353968-354015 dmx512: stopbits: "Stop bit"
353498-354015 dmx512: channel: "Channel 299"
353545-353921 dmx512: data: "0 / 0x0"
354015-354204 dmx512: interframe: "Interframe"
354204-354251 dmx512: startbit: "Start bit"
354251-354298 dmx512: bit: "0"
354298-354345 dmx512: bit: "0"
354345-354392 dmx512: bit: "0"
354392-354439 dmx512: bit: "0"
354439-354486 dmx512: bit: "0"
354486-354533 dmx512: bit: "0"
354533-354580 dmx512: bit: "0"
354580-354627 dmx512: bit: "0"
354627-354674 dmx512: stopbits: "Stop bit"
354674-354721 dmx512: stopbits: "Stop bit"
354204-354721 dmx512: channel: "Channel 300"
354251-354627 dmx512: data: "0 / 0x0"
354721-354911 dmx512: interframe: "Interframe"
354911-354958 dmx512: startbit: "Start bit"
354958-355005 dmx512: bit: "1"
355005-355052 dmx512: bit: "0"
355052-355099 dmx512: bit: "1"
355099-355146 dmx512: bit: "0"
355146-355193 dmx512: bit: "1"
355193-355240 dmx512: bit: "0"
355240-355287 dmx512: bit: "1"
355287-355334 dmx512: bit: "0"
355334-355381 dmx512: stopbits: "Stop bit"
355381-355428 dmx512: stopbits: "Stop bit"
354911-355428 dmx512: channel: "Channel 301"
354958-355334 dmx512: data: "85 / 0x55"
355428-355617 dmx512: interframe: "Interframe"
355617-355664 dmx512: startbit: "Start bit"
355664-355711 dmx512: bit: "1"
355711-355758 dmx512: bit: "0"
355758-355805 dmx512: bit: "1"
355805-355852 dmx512: bit: "0"
355852-355899 dmx512: bit: "1"
355899-355946 dmx512: bit: "0"
355946-355993 dmx512: bit: "1"
355993-356040 dmx512: bit: "0"
356040-356087 dmx512: stopbits: "Stop bit"
356087-356134 dmx512: stopbits: "Stop bit"
355617-356134 dmx512: channel: "Channel 302"
355664-356040 dmx512: data: "85 / 0x55"
356134-356323 dmx512: interframe: "Interframe"
356323-356370 dmx512: startbit: "Start bit"
356370-356417 dmx512: bit: "0"
356417-356464 dmx512: bit: "0"
356464-356511 dmx512: bit: "0"
356511-356558 dmx512: bit: "0"
356558-356605 dmx512: bit: "0"
356605-356652 dmx512: bit: "0"
356652-356699 dmx512: bit: "0"
356699-356746 dmx512: bit: "0"
356746-356793 dmx512: stopbits: "Stop bit"
356793-356840 dmx512: stopbits: "Stop bit"
356323-356840 dmx512: channel: "Channel 303"
356370-356746 dmx512: data: "0 / 0x0"
356840-357029 dmx512: interframe: "Interframe"
357029-357076 dmx512: startbit: "Start bit"
357076-357123 dmx512: bit: "0"
357123-357170 dmx512: bit: "0"
357170-357217 dmx512: bit: "0"
357217-357264 dmx512: bit: "0"
357264-357311 dmx512: bit: "0"
357311-357358 dmx512: bit: "0"
357358-357405 dmx512: bit: "0"
357405-357452 dmx512: bit: "0"
357452-357499 dmx512: stopbits: "Stop bit"
357499-357546 dmx512: stopbits: "Stop bit"
357029-357546 dmx512: channel: "Channel 304"
357076-357452 dmx512: data: "0 / 0x0"
357546-357735 dmx512: interframe: "Interframe"
357735-357782 dmx512: startbit: "Start bit"
357782-357829 dmx512: bit: "0"
357829-357876 dmx512: bit: "0"
357876-357923 dmx512: bit: "0"
357923-357970 dmx512: bit: "0"
357970-358017 dmx512: bit: "0"
358017-358064 dmx512: bit: "0"
358064-358111 dmx512: bit: "0"
358111-358158 dmx512: bit: "0"
358158-358205 dmx512: stopbits: "Stop bit"
358205-358252 dmx512: stopbits: "Stop bit"
357735-358252 dmx512: channel: "Channel 305"
357782-358158 dmx512: data: "0 / 0x0"
358252-358441 dmx512: interframe: "Interframe"
358441-358488 dmx512: startbit: "Start bit"
358488-358535 dmx512: bit: "0"
358535-358582 dmx512: bit: "0"
358582-358629 dmx512: bit: "0"
358629-358676 dmx512: bit: "0"
358676-358723 dmx512: bit: "0"
358723-358770 dmx512: bit: "0"
358770-358817 dmx512: bit: "0"
358817-358864 dmx512: bit: "0"
358864-358911 dmx512: stopbits: "Stop bit"
358911-358958 dmx512: stopbits: "Stop bit"
358441-358958 dmx512: channel: "Channel 306"
358488-358864 dmx512: data: "0 / 0x0"
358958-359148 dmx512: interframe: "Interframe"
359148-359195 dmx512: startbit: "Start bit"
359195-359242 dmx512: bit: "0"
359242-359289 dmx512: bit: "0"
359289-359336 dmx512: bit: "0"
359336-359383 dmx512: bit: "0"
359383-359430 dmx512: bit: "0"
359430-359477 dmx512: bit: "0"
359477-359524 dmx512: bit: "0"
359524-359571 dmx512: bit: "0"
359571-359618 dmx512: stopbits: "Stop bit"
359618-359665 dmx512: stopbits: "Stop bit"
359148-359665 dmx512: channel: "Channel 307"
359195-359571 dmx512: data: "0 / 0x0"
359665-359854 dmx512: interframe: "Interframe"
359854-359901 dmx512: startbit: "Start bit"
359901-359948 dmx512: bit: "0"
359948-359995 dmx512: bit: "0"
359995-360042 dmx512: bit: "0"
360042-360089 dmx512: bit: "0"
360089-360136 dmx512: bit: "0"
360136-360183 dmx512: bit: "0"
360183-360230 dmx512: bit: "0"
360230-360277 dmx512: bit: "0"
360277-360324 dmx512: stopbits: "Stop bit"
360324-360371 dmx512: stopbits: "Stop bit"
359854-360371 dmx512: channel: "Channel 308"
359901-360277 dmx512: data: "0 / 0x0"
360371-360560 dmx512: interframe: "Interframe"
360560-360607 dmx512: startbit: "Start bit"
360607-360654 dmx512: bit: "0"
360654-360701 dmx512: bit: "0"
360701-360748 dmx512: bit: "0"
360748-360795 dmx512: bit: "0"
360795-360842 dmx512: bit: "0"
360842-360889 dmx512: bit: "0"
360889-360936 dmx512: bit: "0"
360936-360983 dmx512: bit: "0"
360983-361030 dmx512: stopbits: "Stop bit"
361030-361077 dmx512: stopbits: "Stop bit"
360560-361077 dmx512: channel: "Channel 309"
360607-360983 dmx512: data: "0 / 0x0"
361077-361266 dmx512: interframe: "Interframe"
361266-361313 dmx512: startbit: "Start bit"
361313-361360 dmx512: bit: "0"
361360-361407 dmx512: bit: "0"
361407-361454 dmx512: bit: "0"
361454-361501 dmx512: bit: "0"
361501-361548 dmx512: bit: "0"
361548-361595 dmx512: bit: "0"
361595-361642 dmx512: bit: "0"
361642-361689 dmx512: bit: "0"
361689-361736 dmx512: stopbits: "Stop bit"
361736-361783 dmx512: stopbits: "Stop bit"
361266-361783 dmx512: channel: "Channel 310"
361313-361689 dmx512: data: "0 / 0x0"
361783-361972 dmx512: interframe: "Interframe"
361972-362019 dmx512: startbit: "Start bit"
362019-362066 dmx512: bit: "0"
362066-362113 dmx512: bit: "0"
362113-362160 dmx512: bit: "0"
362160-362207 dmx512: bit: "0"
362207-362254 dmx512: bit: "0"
362254-362301 dmx512: bit: "0"
362301-362348 dmx512: bit: "0"
362348-362395 dmx512: bit: "0"
362395-362442 dmx512: stopbits: "Stop bit"
362442-362489 dmx512: stopbits: "Stop bit"
361972-362489 dmx512: channel: "Channel 311"
362019-362395 dmx512: data: "0 / 0x0"
362489-362678 dmx512: interframe: "Interframe"
362678-362725 dmx512: startbit: "Start bit"
362725-362772 dmx512: bit: "0"
362772-362819 dmx512: bit: "0"
362819-362866 dmx512: bit: "0"
362866-362913 dmx512: bit: "0"
362913-362960 dmx512: bit: "0"
362960-363007 dmx512: bit: "0"
363007-363054 dmx512: bit: "0"
363054-363101 dmx512: bit: "0"
363101-363148 dmx512: stopbits: "Stop bit"
363148-363195 dmx512: stopbits: "Stop bit"
362678-363195 dmx512: channel: "Channel 312"
362725-363101 dmx512: data: "0 / 0x0"
363195-363385 dmx512: interframe: "Interframe"
363385-363432 dmx512: startbit: "Start bit"
363432-363479 dmx512: bit: "0"
363479-363526 dmx512: bit: "0"
363526-363573 dmx512: bit: "0"
363573-363620 dmx512: bit: "0"
363620-363667 dmx512: bit: "0"
363667-363714 dmx512: bit: "0"
363714-363761 dmx512: bit: "0"
363761-363808 dmx512: bit: "0"
363808-363855 dmx512: stopbits: "Stop bit"
363855-363902 dmx512: stopbits: "Stop bit"
363385-363902 dmx512: channel: "Channel 313"
363432-363808 dmx512: data: "0 / 0x0"
363902-364091 dmx512: interframe: "Interframe"
364091-364138 dmx512: startbit: "Start bit"
364138-364185 dmx512: bit: "0"
364185-364232 dmx512: bit: "0"
364232-364279 dmx512: bit: "0"
364279-364326 dmx512: bit: "0"
364326-364373 dmx512: bit: "0"
364373-364420 dmx512: bit: "0"
364420-364467 dmx512: bit: "0"
364467-364514 dmx512: bit: "0"
364514-364561 dmx512: stopbits: "Stop bit"
364561-364608 dmx512: stopbits: "Stop bit"
364091-364608 dmx512: channel: "Channel 314"
364138-364514 dmx512: data: "0 / 0x0"
364608-364797 dmx512: interframe: "Interframe"
364797-364844 dmx512: startbit: "Start bit"
364844-364891 dmx512: bit: "0"
364891-364938 dmx512: bit: "0"
364938-364985 dmx512: bit: "0"
364985-365032 dmx512: bit: "0"
365032-365079 dmx512: bit: "0"
365079-365126 dmx512: bit: "0"
365126-365173 dmx512: bit: "0"
365173-365220 dmx512: bit: "0"
365220-365267 dmx512: stopbits: "Stop bit"
365267-365314 dmx512: stopbits: "Stop bit"
364797-365314 dmx512: channel: "Channel 315"
364844-365220 dmx512: data: "0 / 0x0"
365314-365503 dmx512: interframe: "Interframe"
365503-365550 dmx512: startbit: "Start bit"
365550-365597 dmx512: bit: "0"
365597-365644 dmx512: bit: "0"
365644-365691 dmx512: bit: "0"
365691-365738 dmx512: bit: "0"
365738-365785 dmx512: bit: "0"
365785-365832 dmx512: bit: "0"
365832-365879 dmx512: bit: "0"
365879-365926 dmx512: bit: "0"
365926-365973 dmx512: stopbits: "Stop bit"
365973-366020 dmx512: stopbits: "Stop bit"
365503-366020 dmx512: channel: "Channel 316"
365550-365926 dmx512: data: "0 / 0x0"
366020-366209 dmx512: interframe: "Interframe"
366209-366256 dmx512: startbit: "Start bit"
366256-366303 dmx512: bit: "0"
366303-366350 dmx512: bit: "0"
366350-366397 dmx512: bit: "0"
366397-366444 dmx512: bit: "0"
366444-366491 dmx512: bit: "0"
366491-366538 dmx512: bit: "0"
366538-366585 dmx512: bit: "0"
366585-366632 dmx512: bit: "0"
366632-366679 dmx512: stopbits: "Stop bit"
366679-366726 dmx512: stopbits: "Stop bit"
366209-366726 dmx512: channel: "Channel 317"
366256-366632 dmx512: data: "0 / 0x0"
366726-366915 dmx512: interframe: "Interframe"
366915-366962 dmx512: startbit: "Start bit"
366962-367009 dmx512: bit: "0"
367009-367056 dmx512: bit: "0"
367056-367103 dmx512: bit: "0"
367103-367150 dmx512: bit: "0"
367150-367197 dmx512: bit: "0"
367197-367244 dmx512: bit: "0"
367244-367291 dmx512: bit: "0"
367291-367338 dmx512: bit: "0"
367338-367385 dmx512: stopbits: "Stop bit"
367385-367432 dmx512: stopbits: "Stop bit"
366915-367432 dmx512: channel: "Channel 318"
366962-367338 dmx512: data: "0 / 0x0"
367432-367622 dmx512: interframe: "Interframe"
367622-367669 dmx512: startbit: "Start bit"
367669-367716 dmx512: bit: "0"
367716-367763 dmx512: bit: "0"
367763-367810 dmx512: bit: "0"
367810-367857 dmx512: bit: "0"
367857-367904 dmx512: bit: "0"
367904-367951 dmx512: bit: "0"
367951-367998 dmx512: bit: "0"
367998-368045 dmx512: bit: "0"
368045-368092 dmx512: stopbits: "Stop bit"
368092-368139 dmx512: stopbits: "Stop bit"
367622-368139 dmx512: channel: "Channel 319"
367669-368045 dmx512: data: "0 / 0x0"
368139-368328 dmx512: interframe: "Interframe"
368328-368375 dmx512: startbit: "Start bit"
368375-368422 dmx512: bit: "0"
368422-368469 dmx512: bit: "0"
368469-368516 dmx512: bit: "0"
368516-368563 dmx512: bit: "0"
368563-368610 dmx512: bit: "0"
368610-368657 dmx512: bit: "0"
368657-368704 dmx512: bit: "0"
368704-368751 dmx512: bit: "0"
368751-368798 dmx512: stopbits: "Stop bit"
368798-368845 dmx512: stopbits: "Stop bit"
368328-368845 dmx512: channel: "Channel 320"
368375-368751 dmx512: data: "0 / 0x0"
368845-369034 dmx512: interframe: "Interframe"
369034-369081 dmx512: startbit: "Start bit"
369081-369128 dmx512: bit: "0"
369128-369175 dmx512: bit: "0"
369175-369222 dmx512: bit: "0"
369222-369269 dmx512: bit: "0"
369269-369316 dmx512: bit: "0"
369316-369363 dmx512: bit: "0"
369363-369410 dmx512: bit: "0"
369410-369457 dmx512: bit: "0"
369457-369504 dmx512: stopbits: "Stop bit"
369504-369551 dmx512: stopbits: "Stop bit"
369034-369551 dmx512: channel: "Channel 321"
369081-369457 dmx512: data: "0 / 0x0"
369551-369740 dmx512: interframe: "Interframe"
369740-369787 dmx512: startbit: "Start bit"
369787-369834 dmx512: bit: "0"
369834-369881 dmx512: bit: "0"
369881-369928 dmx512: bit: "0"
369928-369975 dmx512: bit: "0"
369975-370022 dmx512: bit: "0"
370022-370069 dmx512: bit: "0"
370069-370116 dmx512: bit: "0"
370116-370163 dmx512: bit: "0"
370163-370210 dmx512: stopbits: "Stop bit"
370210-370257 dmx512: stopbits: "Stop bit"
369740-370257 dmx512: channel: "Channel 322"
369787-370163 dmx512: data: "0 / 0x0"
370257-370446 dmx512: interframe: "Interframe"
370446-370493 dmx512: startbit: "Start bit"
370493-370540 dmx512: bit: "0"
370540-370587 dmx512: bit: "0"
370587-370634 dmx512: bit: "0"
370634-370681 dmx512: bit: "0"
370681-370728 dmx512: bit: "0"
370728-370775 dmx512: bit: "0"
370775-370822 dmx512: bit: "0"
370822-370869 dmx512: bit: "0"
370869-370916 dmx512: stopbits: "Stop bit"
370916-370963 dmx512: stopbits: "Stop bit"
370446-370963 dmx512: channel: "Channel 323"
370493-370869 dmx512: data: "0 / 0x0"
370963-371152 dmx512: interframe: "Interframe"
371152-371199 dmx512: startbit: "Start bit"
371199-371246 dmx512: bit: "0"
371246-371293 dmx512: bit: "0"
371293-371340 dmx512: bit: "0"
371340-371387 dmx512: bit: "0"
371387-371434 dmx512: bit: "0"
371434-371481 dmx512: bit: "0"
371481-371528 dmx512: bit: "0"
371528-371575 dmx512: bit: "0"
371575-371622 dmx512: stopbits: "Stop bit"
371622-371669 dmx512: stopbits: "Stop bit"
371152-371669 dmx512: channel: "Channel 324"
371199-371575 dmx512: data: "0 / 0x0"
371669-371858 dmx512: interframe: "Interframe"
371858-371905 dmx512: startbit: "Start bit"
371905-371952 dmx512: bit: "0"
371952-371999 dmx512: bit: "0"
371999-372046 dmx512: bit: "0"
372046-372093 dmx512: bit: "0"
372093-372140 dmx512: bit: "0"
372140-372187 dmx512: bit: "0"
372187-372234 dmx512: bit: "0"
372234-372281 dmx512: bit: "0"
372281-372328 dmx512: stopbits: "Stop bit"
372328-372375 dmx512: stopbits: "Stop bit"
371858-372375 dmx512: channel: "Channel 325"
371905-372281 dmx512: data: "0 / 0x0"
372375-372565 dmx512: interframe: "Interframe"
372565-372612 dmx512: startbit: "Start bit"
372612-372659 dmx512: bit: "0"
372659-372706 dmx512: bit: "0"
372706-372753 dmx512: bit: "0"
372753-372800 dmx512: bit: "0"
372800-372847 dmx512: bit: "0"
372847-372894 dmx512: bit: "0"
372894-372941 dmx512: bit: "0"
372941-372988 dmx512: bit: "0"
372988-373035 dmx512: stopbits: "Stop bit"
373035-373082 dmx512: stopbits: "Stop bit"
372565-373082 dmx512: channel: "Channel 326"
372612-372988 dmx512: data: "0 / 0x0"
373082-373271 dmx512: interframe: "Interframe"
373271-373318 dmx512: startbit: "Start bit"
373318-373365 dmx512: bit: "0"
373365-373412 dmx512: bit: "0"
373412-373459 dmx512: bit: "0"
373459-373506 dmx512: bit: "0"
373506-373553 dmx512: bit: "0"
373553-373600 dmx512: bit: "0"
373600-373647 dmx512: bit: "0"
373647-373694 dmx512: bit: "0"
373694-373741 dmx512: stopbits: "Stop bit"
373741-373788 dmx512: stopbits: "Stop bit"
373271-373788 dmx512: channel: "Channel 327"
373318-373694 dmx512: data: "0 / 0x0"
373788-373977 dmx512: interframe: "Interframe"
373977-374024 dmx512: startbit: "Start bit"
374024-374071 dmx512: bit: "0"
374071-374118 dmx512: bit: "0"
374118-374165 dmx512: bit: "0"
374165-374212 dmx512: bit: "0"
374212-374259 dmx512: bit: "0"
374259-374306 dmx512: bit: "0"
374306-374353 dmx512: bit: "0"
374353-374400 dmx512: bit: "0"
374400-374447 dmx512: stopbits: "Stop bit"
374447-374494 dmx512: stopbits: "Stop bit"
373977-374494 dmx512: channel: "Channel 328"
374024-374400 dmx512: data: "0 / 0x0"
374494-374683 dmx512: interframe: "Interframe"
374683-374730 dmx512: startbit: "Start bit"
374730-374777 dmx512: bit: "0"
374777-374824 dmx512: bit: "0"
374824-374871 dmx512: bit: "0"
374871-374918 dmx512: bit: "0"
374918-374965 dmx512: bit: "0"
374965-375012 dmx512: bit: "0"
375012-375059 dmx512: bit: "0"
375059-375106 dmx512: bit: "0"
375106-375153 dmx512: stopbits: "Stop bit"
375153-375200 dmx512: stopbits: "Stop bit"
374683-375200 dmx512: channel: "Channel 329"
374730-375106 dmx512: data: "0 / 0x0"
375200-375389 dmx512: interframe: "Interframe"
375389-375436 dmx512: startbit: "Start bit"
375436-375483 dmx512: bit: "0"
375483-375530 dmx512: bit: "0"
375530-375577 dmx512: bit: "0"
375577-375624 dmx512: bit: "0"
375624-375671 dmx512: bit: "0"
375671-375718 dmx512: bit: "0"
375718-375765 dmx512: bit: "0"
375765-375812 dmx512: bit: "0"
375812-375859 dmx512: stopbits: "Stop bit"
375859-375906 dmx512: stopbits: "Stop bit"
375389-375906 dmx512: channel: "Channel 330"
375436-375812 dmx512: data: "0 / 0x0"
375906-376095 dmx512: interframe: "Interframe"
376095-376142 dmx512: startbit: "Start bit"
376142-376189 dmx512: bit: "0"
376189-376236 dmx512: bit: "0"
376236-376283 dmx512: bit: "0"
376283-376330 dmx512: bit: "0"
376330-376377 dmx512: bit: "0"
376377-376424 dmx512: bit: "0"
376424-376471 dmx512: bit: "0"
376471-376518 dmx512: bit: "0"
376518-376565 dmx512: stopbits: "Stop bit"
376565-376612 dmx512: stopbits: "Stop bit"
376095-376612 dmx512: channel: "Channel 331"
376142-376518 dmx512: data: "0 / 0x0"
376612-376802 dmx512: interframe: "Interframe"
376802-376849 dmx512: startbit: "Start bit"
376849-376896 dmx512: bit: "0"
376896-376943 dmx512: bit: "0"
376943-376990 dmx512: bit: "0"
376990-377037 dmx512: bit: "0"
377037-377084 dmx512: bit: "0"
377084-377131 dmx512: bit: "0"
377131-377178 dmx512: bit: "0"
377178-377225 dmx512: bit: "0"
377225-377272 dmx512: stopbits: "Stop bit"
377272-377319 dmx512: stopbits: "Stop bit"
376802-377319 dmx512: channel: "Channel 332"
376849-377225 dmx512: data: "0 / 0x0"
377319-377508 dmx512: interframe: "Interframe"
377508-377555 dmx512: startbit: "Start bit"
377555-377602 dmx512: bit: "0"
377602-377649 dmx512: bit: "0"
377649-377696 dmx512: bit: "0"
377696-377743 dmx512: bit: "0"
377743-377790 dmx512: bit: "0"
377790-377837 dmx512: bit: "0"
377837-377884 dmx512: bit: "0"
377884-377931 dmx512: bit: "0"
377931-377978 dmx512: stopbits: "Stop bit"
377978-378025 dmx512: stopbits: "Stop bit"
377508-378025 dmx512: channel: "Channel 333"
377555-377931 dmx512: data: "0 / 0x0"
378025-378214 dmx512: interframe: "Interframe"
378214-378261 dmx512: startbit: "Start bit"
378261-378308 dmx512: bit: "0"
378308-378355 dmx512: bit: "0"
378355-378402 dmx512: bit: "0"
378402-378449 dmx512: bit: "0"
378449-378496 dmx512: bit: "0"
378496-378543 dmx512: bit: "0"
378543-378590 dmx512: bit: "0"
378590-378637 dmx512: bit: "0"
378637-378684 dmx512: stopbits: "Stop bit"
378684-378731 dmx512: stopbits: "Stop bit"
378214-378731 dmx512: channel: "Channel 334"
378261-378637 dmx512: data: "0 / 0x0"
378731-378920 dmx512: interframe: "Interframe"
378920-378967 dmx512: startbit: "Start bit"
378967-379014 dmx512: bit: "0"
379014-379061 dmx512: bit: "0"
379061-379108 dmx512: bit: "0"
379108-379155 dmx512: bit: "0"
379155-379202 dmx512: bit: "0"
379202-379249 dmx512: bit: "0"
379249-379296 dmx512: bit: "0"
379296-379343 dmx512: bit: "0"
379343-379390 dmx512: stopbits: "Stop bit"
379390-379437 dmx512: stopbits: "Stop bit"
378920-379437 dmx512: channel: "Channel 335"
378967-379343 dmx512: data: "0 / 0x0"
379437-379626 dmx512: interframe: "Interframe"
379626-379673 dmx512: startbit: "Start bit"
379673-379720 dmx512: bit: "0"
379720-379767 dmx512: bit: "0"
379767-379814 dmx512: bit: "0"
379814-379861 dmx512: bit: "0"
379861-379908 dmx512: bit: "0"
379908-379955 dmx512: bit: "0"
379955-380002 dmx512: bit: "0"
380002-380049 dmx512: bit: "0"
380049-380096 dmx512: stopbits: "Stop bit"
380096-380143 dmx512: stopbits: "Stop bit"
379626-380143 dmx512: channel: "Channel 336"
379673-380049 dmx512: data: "0 / 0x0"
380143-380332 dmx512: interframe: "Interframe"
380332-380379 dmx512: startbit: "Start bit"
380379-380426 dmx512: bit: "0"
380426-380473 dmx512: bit: "0"
380473-380520 dmx512: bit: "0"
380520-380567 dmx512: bit: "0"
380567-380614 dmx512: bit: "0"
380614-380661 dmx512: bit: "0"
380661-380708 dmx512: bit: "0"
380708-380755 dmx512: bit: "0"
380755-380802 dmx512: stopbits: "Stop bit"
380802-380849 dmx512: stopbits: "Stop bit"
380332-380849 dmx512: channel: "Channel 337"
380379-380755 dmx512: data: "0 / 0x0"
380849-381039 dmx512: interframe: "Interframe"
381039-381086 dmx512: startbit: "Start bit"
381086-381133 dmx512: bit: "0"
381133-381180 dmx512: bit: "0"
381180-381227 dmx512: bit: "0"
381227-381274 dmx512: bit: "0"
381274-381321 dmx512: bit: "0"
381321-381368 dmx512: bit: "0"
381368-381415 dmx512: bit: "0"
381415-381462 dmx512: bit: "0"
381462-381509 dmx512: stopbits: "Stop bit"
381509-381556 dmx512: stopbits: "Stop bit"
381039-381556 dmx512: channel: "Channel 338"
381086-381462 dmx512: data: "0 / 0x0"
381556-381745 dmx512: interframe: "Interframe"
381745-381792 dmx512: startbit: "Start bit"
381792-381839 dmx512: bit: "0"
381839-381886 dmx512: bit: "0"
381886-381933 dmx512: bit: "0"
381933-381980 dmx512: bit: "0"
381980-382027 dmx512: bit: "0"
382027-382074 dmx512: bit: "0"
382074-382121 dmx512: bit: "0"
382121-382168 dmx512: bit: "0"
382168-382215 dmx512: stopbits: "Stop bit"
382215-382262 dmx512: stopbits: "Stop bit"
381745-382262 dmx512: channel: "Channel 339"
381792-382168 dmx512: data: "0 / 0x0"
382262-382451 dmx512: interframe: "Interframe"
382451-382498 dmx512: startbit: "Start bit"
382498-382545 dmx512: bit: "0"
382545-382592 dmx512: bit: "0"
382592-382639 dmx512: bit: "0"
382639-382686 dmx512: bit: "0"
382686-382733 dmx512: bit: "0"
382733-382780 dmx512: bit: "0"
382780-382827 dmx512: bit: "0"
382827-382874 dmx512: bit: "0"
382874-382921 dmx512: stopbits: "Stop bit"
382921-382968 dmx512: stopbits: "Stop bit"
382451-382968 dmx512: channel: "Channel 340"
382498-382874 dmx512: data: "0 / 0x0"
382968-383157 dmx512: interframe: "Interframe"
383157-383204 dmx512: startbit: "Start bit"
383204-383251 dmx512: bit: "0"
383251-383298 dmx512: bit: "0"
383298-383345 dmx512: bit: "0"
383345-383392 dmx512: bit: "0"
383392-383439 dmx512: bit: "0"
383439-383486 dmx512: bit: "0"
383486-383533 dmx512: bit: "0"
383533-383580 dmx512: bit: "0"
383580-383627 dmx512: stopbits: "Stop bit"
383627-383674 dmx512: stopbits: "Stop bit"
383157-383674 dmx512: channel: "Channel 341"
383204-383580 dmx512: data: "0 / 0x0"
383674-383863 dmx512: interframe: "Interframe"
383863-383910 dmx512: startbit: "Start bit"
383910-383957 dmx512: bit: "0"
383957-384004 dmx512: bit: "0"
384004-384051 dmx512: bit: "0"
384051-384098 dmx512: bit: "0"
384098-384145 dmx512: bit: "0"
384145-384192 dmx512: bit: "0"
384192-384239 dmx512: bit: "0"
384239-384286 dmx512: bit: "0"
384286-384333 dmx512: stopbits: "Stop bit"
384333-384380 dmx512: stopbits: "Stop bit"
383863-384380 dmx512: channel: "Channel 342"
383910-384286 dmx512: data: "0 / 0x0"
384380-384569 dmx512: interframe: "Interframe"
384569-384616 dmx512: startbit: "Start bit"
384616-384663 dmx512: bit: "0"
384663-384710 dmx512: bit: "0"
384710-384757 dmx512: bit: "0"
384757-384804 dmx512: bit: "0"
384804-384851 dmx512: bit: "0"
384851-384898 dmx512: bit: "0"
384898-384945 dmx512: bit: "0"
384945-384992 dmx512: bit: "0"
384992-385039 dmx512: stopbits: "Stop bit"
385039-385086 dmx512: stopbits: "Stop bit"
384569-385086 dmx512: channel: "Channel 343"
384616-384992 dmx512: data: "0 / 0x0"
385086-385276 dmx512: interframe: "Interframe"
385276-385323 dmx512: startbit: "Start bit"
385323-385370 dmx512: bit: "0"
385370-385417 dmx512: bit: "0"
385417-385464 dmx512: bit: "0"
385464-385511 dmx512: bit: "0"
385511-385558 dmx512: bit: "0"
385558-385605 dmx512: bit: "0"
385605-385652 dmx512: bit: "0"
385652-385699 dmx512: bit: "0"
385699-385746 dmx512: stopbits: "Stop bit"
385746-385793 dmx512: stopbits: "Stop bit"
385276-385793 dmx512: channel: "Channel 344"
385323-385699 dmx512: data: "0 / 0x0"
385793-385982 dmx512: interframe: "Interframe"
385982-386029 dmx512: startbit: "Start bit"
386029-386076 dmx512: bit: "0"
386076-386123 dmx512: bit: "0"
386123-386170 dmx512: bit: "0"
386170-386217 dmx512: bit: "0"
386217-386264 dmx512: bit: "0"
386264-386311 dmx512: bit: "0"
386311-386358 dmx512: bit: "0"
386358-386405 dmx512: bit: "0"
386405-386452 dmx512: stopbits: "Stop bit"
386452-386499 dmx512: stopbits: "Stop bit"
385982-386499 dmx512: channel: "Channel 345"
386029-386405 dmx512: data: "0 / 0x0"
386499-386688 dmx512: interframe: "Interframe"
386688-386735 dmx512: startbit: "Start bit"
386735-386782 dmx512: bit: "0"
386782-386829 dmx512: bit: "0"
386829-386876 dmx512: bit: "0"
386876-386923 dmx512: bit: "0"
386923-386970 dmx512: bit: "0"
386970-387017 dmx512: bit: "0"
387017-387064 dmx512: bit: "0"
387064-387111 dmx512: bit: "0"
387111-387158 dmx512: stopbits: "Stop bit"
387158-387205 dmx512: stopbits: "Stop bit"
386688-387205 dmx512: channel: "Channel 346"
386735-387111 dmx512: data: "0 / 0x0"
387205-387394 dmx512: interframe: "Interframe"
387394-387441 dmx512: startbit: "Start bit"
387441-387488 dmx512: bit: "0"
387488-387535 dmx512: bit: "0"
387535-387582 dmx512: bit: "0"
387582-387629 dmx512: bit: "0"
387629-387676 dmx512: bit: "0"
387676-387723 dmx512: bit: "0"
387723-387770 dmx512: bit: "0"
387770-387817 dmx512: bit: "0"
387817-387864 dmx512: stopbits: "Stop bit"
387864-387911 dmx512: stopbits: "Stop bit"
387394-387911 dmx512: channel: "Channel 347"
387441-387817 dmx512: data: "0 / 0x0"
387911-388100 dmx512: interframe: "Interframe"
388100-388147 dmx512: startbit: "Start bit"
388147-388194 dmx512: bit: "0"
388194-388241 dmx512: bit: "0"
388241-388288 dmx512: bit: "0"
388288-388335 dmx512: bit: "0"
388335-388382 dmx512: bit: "0"
388382-388429 dmx512: bit: "0"
388429-388476 dmx512: bit: "0"
388476-388523 dmx512: bit: "0"
388523-388570 dmx512: stopbits: "Stop bit"
388570-388617 dmx512: stopbits: "Stop bit"
388100-388617 dmx512: channel: "Channel 348"
388147-388523 dmx512: data: "0 / 0x0"
388617-388806 dmx512: interframe: "Interframe"
388806-388853 dmx512: startbit: "Start bit"
388853-388900 dmx512: bit: "0"
388900-388947 dmx512: bit: "0"
388947-388994 dmx512: bit: "0"
388994-389041 dmx512: bit: "0"
389041-389088 dmx512: bit: "0"
389088-389135 dmx512: bit: "0"
389135-389182 dmx512: bit: "0"
389182-389229 dmx512: bit: "0"
389229-389276 dmx512: stopbits: "Stop bit"
389276-389323 dmx512: stopbits: "Stop bit"
388806-389323 dmx512: channel: "Channel 349"
388853-389229 dmx512: data: "0 / 0x0"
389323-389513 dmx512: interframe: "Interframe"
389513-389560 dmx512: startbit: "Start bit"
389560-389607 dmx512: bit: "0"
389607-389654 dmx512: bit: "0"
389654-389701 dmx512: bit: "0"
389701-389748 dmx512: bit: "0"
389748-389795 dmx512: bit: "0"
389795-389842 dmx512: bit: "0"
389842-389889 dmx512: bit: "0"
389889-389936 dmx512: bit: "0"
389936-389983 dmx512: stopbits: "Stop bit"
389983-390030 dmx512: stopbits: "Stop bit"
389513-390030 dmx512: channel: "Channel 350"
389560-389936 dmx512: data: "0 / 0x0"
390030-390219 dmx512: interframe: "Interframe"
390219-390266 dmx512: startbit: "Start bit"
390266-390313 dmx512: bit: "0"
390313-390360 dmx512: bit: "0"
390360-390407 dmx512: bit: "0"
390407-390454 dmx512: bit: "0"
390454-390501 dmx512: bit: "0"
390501-390548 dmx512: bit: "0"
390548-390595 dmx512: bit: "0"
390595-390642 dmx512: bit: "0"
390642-390689 dmx512: stopbits: "Stop bit"
390689-390736 dmx512: stopbits: "Stop bit"
390219-390736 dmx512: channel: "Channel 351"
390266-390642 dmx512: data: "0 / 0x0"
390736-390925 dmx512: interframe: "Interframe"
390925-390972 dmx512: startbit: "Start bit"
390972-391019 dmx512: bit: "0"
391019-391066 dmx512: bit: "0"
391066-391113 dmx512: bit: "0"
391113-391160 dmx512: bit: "0"
391160-391207 dmx512: bit: "0"
391207-391254 dmx512: bit: "0"
391254-391301 dmx512: bit: "0"
391301-391348 dmx512: bit: "0"
391348-391395 dmx512: stopbits: "Stop bit"
391395-391442 dmx512: stopbits: "Stop bit"
390925-391442 dmx512: channel: "Channel 352"
390972-391348 dmx512: data: "0 / 0x0"
391442-391631 dmx512: interframe: "Interframe"
391631-391678 dmx512: startbit: "Start bit"
391678-391725 dmx512: bit: "0"
391725-391772 dmx512: bit: "0"
391772-391819 dmx512: bit: "0"
391819-391866 dmx512: bit: "0"
391866-391913 dmx512: bit: "0"
391913-391960 dmx512: bit: "0"
391960-392007 dmx512: bit: "0"
392007-392054 dmx512: bit: "0"
392054-392101 dmx512: stopbits: "Stop bit"
392101-392148 dmx512: stopbits: "Stop bit"
391631-392148 dmx512: channel: "Channel 353"
391678-392054 dmx512: data: "0 / 0x0"
392148-392337 dmx512: interframe: "Interframe"
392337-392384 dmx512: startbit: "Start bit"
392384-392431 dmx512: bit: "0"
392431-392478 dmx512: bit: "0"
392478-392525 dmx512: bit: "0"
392525-392572 dmx512: bit: "0"
392572-392619 dmx512: bit: "0"
392619-392666 dmx512: bit: "0"
392666-392713 dmx512: bit: "0"
392713-392760 dmx512: bit: "0"
392760-392807 dmx512: stopbits: "Stop bit"
392807-392854 dmx512: stopbits: "Stop bit"
392337-392854 dmx512: channel: "Channel 354"
392384-392760 dmx512: data: "0 / 0x0"
392854-393043 dmx512: interframe: "Interframe"
393043-393090 dmx512: startbit: "Start bit"
393090-393137 dmx512: bit: "0"
393137-393184 dmx512: bit: "0"
393184-393231 dmx512: bit: "0"
393231-393278 dmx512: bit: "0"
393278-393325 dmx512: bit: "0"
393325-393372 dmx512: bit: "0"
393372-393419 dmx512: bit: "0"
393419-393466 dmx512: bit: "0"
393466-393513 dmx512: stopbits: "Stop bit"
393513-393560 dmx512: stopbits: "Stop bit"
393043-393560 dmx512: channel: "Channel 355"
393090-393466 dmx512: data: "0 / 0x0"
393560-393749 dmx512: interframe: "Interframe"
393749-393796 dmx512: startbit: "Start bit"
393796-393843 dmx512: bit: "0"
393843-393890 dmx512: bit: "0"
393890-393937 dmx512: bit: "0"
393937-393984 dmx512: bit: "0"
393984-394031 dmx512: bit: "0"
394031-394078 dmx512: bit: "0"
394078-394125 dmx512: bit: "0"
394125-394172 dmx512: bit: "0"
394172-394219 dmx512: stopbits: "Stop bit"
394219-394266 dmx512: stopbits: "Stop bit"
393749-394266 dmx512: channel: "Channel 356"
393796-394172 dmx512: data: "0 / 0x0"
394266-394456 dmx512: interframe: "Interframe"
394456-394503 dmx512: startbit: "Start bit"
394503-394550 dmx512: bit: "0"
394550-394597 dmx512: bit: "0"
394597-394644 dmx512: bit: "0"
394644-394691 dmx512: bit: "0"
394691-394738 dmx512: bit: "0"
394738-394785 dmx512: bit: "0"
394785-394832 dmx512: bit: "0"
394832-394879 dmx512: bit: "0"
394879-394926 dmx512: stopbits: "Stop bit"
394926-394973 dmx512: stopbits: "Stop bit"
394456-394973 dmx512: channel: "Channel 357"
394503-394879 dmx512: data: "0 / 0x0"
394973-395162 dmx512: interframe: "Interframe"
395162-395209 dmx512: startbit: "Start bit"
395209-395256 dmx512: bit: "0"
395256-395303 dmx512: bit: "0"
395303-395350 dmx512: bit: "0"
395350-395397 dmx512: bit: "0"
395397-395444 dmx512: bit: "0"
395444-395491 dmx512: bit: "0"
395491-395538 dmx512: bit: "0"
395538-395585 dmx512: bit: "0"
395585-395632 dmx512: stopbits: "Stop bit"
395632-395679 dmx512: stopbits: "Stop bit"
395162-395679 dmx512: channel: "Channel 358"
395209-395585 dmx512: data: "0 / 0x0"
395679-395868 dmx512: interframe: "Interframe"
395868-395915 dmx512: startbit: "Start bit"
395915-395962 dmx512: bit: "0"
395962-396009 dmx512: bit: "0"
396009-396056 dmx512: bit: "0"
396056-396103 dmx512: bit: "0"
396103-396150 dmx512: bit: "0"
396150-396197 dmx512: bit: "0"
396197-396244 dmx512: bit: "0"
396244-396291 dmx512: bit: "0"
396291-396338 dmx512: stopbits: "Stop bit"
396338-396385 dmx512: stopbits: "Stop bit"
395868-396385 dmx512: channel: "Channel 359"
395915-396291 dmx512: data: "0 / 0x0"
396385-396574 dmx512: interframe: "Interframe"
396574-396621 dmx512: startbit: "Start bit"
396621-396668 dmx512: bit: "0"
396668-396715 dmx512: bit: "0"
396715-396762 dmx512: bit: "0"
396762-396809 dmx512: bit: "0"
396809-396856 dmx512: bit: "0"
396856-396903 dmx512: bit: "0"
396903-396950 dmx512: bit: "0"
396950-396997 dmx512: bit: "0"
396997-397044 dmx512: stopbits: "Stop bit"
397044-397091 dmx512: stopbits: "Stop bit"
396574-397091 dmx512: channel: "Channel 360"
396621-396997 dmx512: data: "0 / 0x0"
397091-397280 dmx512: interframe: "Interframe"
397280-397327 dmx512: startbit: "Start bit"
397327-397374 dmx512: bit: "0"
397374-397421 dmx512: bit: "0"
397421-397468 dmx512: bit: "0"
397468-397515 dmx512: bit: "0"
397515-397562 dmx512: bit: "0"
397562-397609 dmx512: bit: "0"
397609-397656 dmx512: bit: "0"
397656-397703 dmx512: bit: "0"
397703-397750 dmx512: stopbits: "Stop bit"
397750-397797 dmx512: stopbits: "Stop bit"
397280-397797 dmx512: channel: "Channel 361"
397327-397703 dmx512: data: "0 / 0x0"
397797-397986 dmx512: interframe: "Interframe"
397986-398033 dmx512: startbit: "Start bit"
398033-398080 dmx512: bit: "0"
398080-398127 dmx512: bit: "0"
398127-398174 dmx512: bit: "0"
398174-398221 dmx512: bit: "0"
398221-398268 dmx512: bit: "0"
398268-398315 dmx512: bit: "0"
398315-398362 dmx512: bit: "0"
398362-398409 dmx512: bit: "0"
398409-398456 dmx512: stopbits: "Stop bit"
398456-398503 dmx512: stopbits: "Stop bit"
397986-398503 dmx512: channel: "Channel 362"
398033-398409 dmx512: data: "0 / 0x0"
398503-398693 dmx512: interframe: "Interframe"
398693-398740 dmx512: startbit: "Start bit"
398740-398787 dmx512: bit: "0"
398787-398834 dmx512: bit: "0"
398834-398881 dmx512: bit: "0"
398881-398928 dmx512: bit: "0"
398928-398975 dmx512: bit: "0"
398975-399022 dmx512: bit: "0"
399022-399069 dmx512: bit: "0"
399069-399116 dmx512: bit: "0"
399116-399163 dmx512: stopbits: "Stop bit"
399163-399210 dmx512: stopbits: "Stop bit"
398693-399210 dmx512: channel: "Channel 363"
398740-399116 dmx512: data: "0 / 0x0"
399210-399399 dmx512: interframe: "Interframe"
399399-399446 dmx512: startbit: "Start bit"
399446-399493 dmx512: bit: "0"
399493-399540 dmx512: bit: "0"
399540-399587 dmx512: bit: "0"
399587-399634 dmx512: bit: "0"
399634-399681 dmx512: bit: "0"
399681-399728 dmx512: bit: "0"
399728-399775 dmx512: bit: "0"
399775-399822 dmx512: bit: "0"
399822-399869 dmx512: stopbits: "Stop bit"
399869-399916 dmx512: stopbits: "Stop bit"
399399-399916 dmx512: channel: "Channel 364"
399446-399822 dmx512: data: "0 / 0x0"
399916-400105 dmx512: interframe: "Interframe"
400105-400152 dmx512: startbit: "Start bit"
400152-400199 dmx512: bit: "0"
400199-400246 dmx512: bit: "0"
400246-400293 dmx512: bit: "0"
400293-400340 dmx512: bit: "0"
400340-400387 dmx512: bit: "0"
400387-400434 dmx512: bit: "0"
400434-400481 dmx512: bit: "0"
400481-400528 dmx512: bit: "0"
400528-400575 dmx512: stopbits: "Stop bit"
400575-400622 dmx512: stopbits: "Stop bit"
400105-400622 dmx512: channel: "Channel 365"
400152-400528 dmx512: data: "0 / 0x0"
400622-400811 dmx512: interframe: "Interframe"
400811-400858 dmx512: startbit: "Start bit"
400858-400905 dmx512: bit: "0"
400905-400952 dmx512: bit: "0"
400952-400999 dmx512: bit: "0"
400999-401046 dmx512: bit: "0"
401046-401093 dmx512: bit: "0"
401093-401140 dmx512: bit: "0"
401140-401187 dmx512: bit: "0"
401187-401234 dmx512: bit: "0"
401234-401281 dmx512: stopbits: "Stop bit"
401281-401328 dmx512: stopbits: "Stop bit"
400811-401328 dmx512: channel: "Channel 366"
400858-401234 dmx512: data: "0 / 0x0"
401328-401517 dmx512: interframe: "Interframe"
401517-401564 dmx512: startbit: "Start bit"
401564-401611 dmx512: bit: "0"
401611-401658 dmx512: bit: "0"
401658-401705 dmx512: bit: "0"
401705-401752 dmx512: bit: "0"
401752-401799 dmx512: bit: "0"
401799-401846 dmx512: bit: "0"
401846-401893 dmx512: bit: "0"
401893-401940 dmx512: bit: "0"
401940-401987 dmx512: stopbits: "Stop bit"
401987-402034 dmx512: stopbits: "Stop bit"
401517-402034 dmx512: channel: "Channel 367"
401564-401940 dmx512: data: "0 / 0x0"
402034-402223 dmx512: interframe: "Interframe"
402223-402270 dmx512: startbit: "Start bit"
402270-402317 dmx512: bit: "0"
402317-402364 dmx512: bit: "0"
402364-402411 dmx512: bit: "0"
402411-402458 dmx512: bit: "0"
402458-402505 dmx512: bit: "0"
402505-402552 dmx512: bit: "0"
402552-402599 dmx512: bit: "0"
402599-402646 dmx512: bit: "0"
402646-402693 dmx512: stopbits: "Stop bit"
402693-402740 dmx512: stopbits: "Stop bit"
402223-402740 dmx512: channel: "Channel 368"
402270-402646 dmx512: data: "0 / 0x0"
402740-402930 dmx512: interframe: "Interframe"
402930-402977 dmx512: startbit: "Start bit"
402977-403024 dmx512: bit: "0"
403024-403071 dmx512: bit: "0"
403071-403118 dmx512: bit: "0"
403118-403165 dmx512: bit: "0"
403165-403212 dmx512: bit: "0"
403212-403259 dmx512: bit: "0"
403259-403306 dmx512: bit: "0"
403306-403353 dmx512: bit: "0"
403353-403400 dmx512: stopbits: "Stop bit"
403400-403447 dmx512: stopbits: "Stop bit"
402930-403447 dmx512: channel: "Channel 369"
402977-403353 dmx512: data: "0 / 0x0"
403447-403636 dmx512: interframe: "Interframe"
403636-403683 dmx512: startbit: "Start bit"
403683-403730 dmx512: bit: "0"
403730-403777 dmx512: bit: "0"
403777-403824 dmx512: bit: "0"
403824-403871 dmx512: bit: "0"
403871-403918 dmx512: bit: "0"
403918-403965 dmx512: bit: "0"
403965-404012 dmx512: bit: "0"
404012-404059 dmx512: bit: "0"
404059-404106 dmx512: stopbits: "Stop bit"
404106-404153 dmx512: stopbits: "Stop bit"
403636-404153 dmx512: channel: "Channel 370"
403683-404059 dmx512: data: "0 / 0x0"
404153-404342 dmx512: interframe: "Interframe"
404342-404389 dmx512: startbit: "Start bit"
404389-404436 dmx512: bit: "0"
404436-404483 dmx512: bit: "0"
404483-404530 dmx512: bit: "0"
404530-404577 dmx512: bit: "0"
404577-404624 dmx512: bit: "0"
404624-404671 dmx512: bit: "0"
404671-404718 dmx512: bit: "0"
404718-404765 dmx512: bit: "0"
404765-404812 dmx512: stopbits: "Stop bit"
404812-404859 dmx512: stopbits: "Stop bit"
404342-404859 dmx512: channel: "Channel 371"
404389-404765 dmx512: data: "0 / 0x0"
404859-405048 dmx512: interframe: "Interframe"
405048-405095 dmx512: startbit: "Start bit"
405095-405142 dmx512: bit: "0"
405142-405189 dmx512: bit: "0"
405189-405236 dmx512: bit: "0"
405236-405283 dmx512: bit: "0"
405283-405330 dmx512: bit: "0"
405330-405377 dmx512: bit: "0"
405377-405424 dmx512: bit: "0"
405424-405471 dmx512: bit: "0"
405471-405518 dmx512: stopbits: "Stop bit"
405518-405565 dmx512: stopbits: "Stop bit"
405048-405565 dmx512: channel: "Channel 372"
405095-405471 dmx512: data: "0 / 0x0"
405565-405754 dmx512: interframe: "Interframe"
405754-405801 dmx512: startbit: "Start bit"
405801-405848 dmx512: bit: "0"
405848-405895 dmx512: bit: "0"
405895-405942 dmx512: bit: "0"
405942-405989 dmx512: bit: "0"
405989-406036 dmx512: bit: "0"
406036-406083 dmx512: bit: "0"
406083-406130 dmx512: bit: "0"
406130-406177 dmx512: bit: "0"
406177-406224 dmx512: stopbits: "Stop bit"
406224-406271 dmx512: stopbits: "Stop bit"
405754-406271 dmx512: channel: "Channel 373"
405801-406177 dmx512: data: "0 / 0x0"
406271-406460 dmx512: interframe: "Interframe"
406460-406507 dmx512: startbit: "Start bit"
406507-406554 dmx512: bit: "0"
406554-406601 dmx512: bit: "0"
406601-406648 dmx512: bit: "0"
406648-406695 dmx512: bit: "0"
406695-406742 dmx512: bit: "0"
406742-406789 dmx512: bit: "0"
406789-406836 dmx512: bit: "0"
406836-406883 dmx512: bit: "0"
406883-406930 dmx512: stopbits: "Stop bit"
406930-406977 dmx512: stopbits: "Stop bit"
406460-406977 dmx512: channel: "Channel 374"
406507-406883 dmx512: data: "0 / 0x0"
406977-407167 dmx512: interframe: "Interframe"
407167-407214 dmx512: startbit: "Start bit"
407214-407261 dmx512: bit: "0"
407261-407308 dmx512: bit: "0"
407308-407355 dmx512: bit: "0"
407355-407402 dmx512: bit: "0"
407402-407449 dmx512: bit: "0"
407449-407496 dmx512: bit: "0"
407496-407543 dmx512: bit: "0"
407543-407590 dmx512: bit: "0"
407590-407637 dmx512: stopbits: "Stop bit"
407637-407684 dmx512: stopbits: "Stop bit"
407167-407684 dmx512: channel: "Channel 375"
407214-407590 dmx512: data: "0 / 0x0"
407684-407873 dmx512: interframe: "Interframe"
407873-407920 dmx512: startbit: "Start bit"
407920-407967 dmx512: bit: "0"
407967-408014 dmx512: bit: "0"
408014-408061 dmx512: bit: "0"
408061-408108 dmx512: bit: "0"
408108-408155 dmx512: bit: "0"
408155-408202 dmx512: bit: "0"
408202-408249 dmx512: bit: "0"
408249-408296 dmx512: bit: "0"
408296-408343 dmx512: stopbits: "Stop bit"
408343-408390 dmx512: stopbits: "Stop bit"
407873-408390 dmx512: channel: "Channel 376"
407920-408296 dmx512: data: "0 / 0x0"
408390-408579 dmx512: interframe: "Interframe"
408579-408626 dmx512: startbit: "Start bit"
408626-408673 dmx512: bit: "0"
408673-408720 dmx512: bit: "0"
408720-408767 dmx512: bit: "0"
408767-408814 dmx512: bit: "0"
408814-408861 dmx512: bit: "0"
408861-408908 dmx512: bit: "0"
408908-408955 dmx512: bit: "0"
408955-409002 dmx512: bit: "0"
409002-409049 dmx512: stopbits: "Stop bit"
409049-409096 dmx512: stopbits: "Stop bit"
408579-409096 dmx512: channel: "Channel 377"
408626-409002 dmx512: data: "0 / 0x0"
409096-409285 dmx512: interframe: "Interframe"
409285-409332 dmx512: startbit: "Start bit"
409332-409379 dmx512: bit: "0"
409379-409426 dmx512: bit: "0"
409426-409473 dmx512: bit: "0"
409473-409520 dmx512: bit: "0"
409520-409567 dmx512: bit: "0"
409567-409614 dmx512: bit: "0"
409614-409661 dmx512: bit: "0"
409661-409708 dmx512: bit: "0"
409708-409755 dmx512: stopbits: "Stop bit"
409755-409802 dmx512: stopbits: "Stop bit"
409285-409802 dmx512: channel: "Channel 378"
409332-409708 dmx512: data: "0 / 0x0"
409802-409991 dmx512: interframe: "Interframe"
409991-410038 dmx512: startbit: "Start bit"
410038-410085 dmx512: bit: "0"
410085-410132 dmx512: bit: "0"
410132-410179 dmx512: bit: "0"
410179-410226 dmx512: bit: "0"
410226-410273 dmx512: bit: "0"
410273-410320 dmx512: bit: "0"
410320-410367 dmx512: bit: "0"
410367-410414 dmx512: bit: "0"
410414-410461 dmx512: stopbits: "Stop bit"
410461-410508 dmx512: stopbits: "Stop bit"
409991-410508 dmx512: channel: "Channel 379"
410038-410414 dmx512: data: "0 / 0x0"
410508-410697 dmx512: interframe: "Interframe"
410697-410744 dmx512: startbit: "Start bit"
410744-410791 dmx512: bit: "0"
410791-410838 dmx512: bit: "0"
410838-410885 dmx512: bit: "0"
410885-410932 dmx512: bit: "0"
410932-410979 dmx512: bit: "0"
410979-411026 dmx512: bit: "0"
411026-411073 dmx512: bit: "0"
411073-411120 dmx512: bit: "0"
411120-411167 dmx512: stopbits: "Stop bit"
411167-411214 dmx512: stopbits: "Stop bit"
410697-411214 dmx512: channel: "Channel 380"
410744-411120 dmx512: data: "0 / 0x0"
411214-411404 dmx512: interframe: "Interframe"
411404-411451 dmx512: startbit: "Start bit"
411451-411498 dmx512: bit: "0"
411498-411545 dmx512: bit: "0"
411545-411592 dmx512: bit: "0"
411592-411639 dmx512: bit: "0"
411639-411686 dmx512: bit: "0"
411686-411733 dmx512: bit: "0"
411733-411780 dmx512: bit: "0"
411780-411827 dmx512: bit: "0"
411827-411874 dmx512: stopbits: "Stop bit"
411874-411921 dmx512: stopbits: "Stop bit"
411404-411921 dmx512: channel: "Channel 381"
411451-411827 dmx512: data: "0 / 0x0"
411921-412110 dmx512: interframe: "Interframe"
412110-412157 dmx512: startbit: "Start bit"
412157-412204 dmx512: bit: "0"
412204-412251 dmx512: bit: "0"
412251-412298 dmx512: bit: "0"
412298-412345 dmx512: bit: "0"
412345-412392 dmx512: bit: "0"
412392-412439 dmx512: bit: "0"
412439-412486 dmx512: bit: "0"
412486-412533 dmx512: bit: "0"
412533-412580 dmx512: stopbits: "Stop bit"
412580-412627 dmx512: stopbits: "Stop bit"
412110-412627 dmx512: channel: "Channel 382"
412157-412533 dmx512: data: "0 / 0x0"
412627-412816 dmx512: interframe: "Interframe"
412816-412863 dmx512: startbit: "Start bit"
412863-412910 dmx512: bit: "0"
412910-412957 dmx512: bit: "0"
412957-413004 dmx512: bit: "0"
413004-413051 dmx512: bit: "0"
413051-413098 dmx512: bit: "0"
413098-413145 dmx512: bit: "0"
413145-413192 dmx512: bit: "0"
413192-413239 dmx512: bit: "0"
413239-413286 dmx512: stopbits: "Stop bit"
413286-413333 dmx512: stopbits: "Stop bit"
412816-413333 dmx512: channel: "Channel 383"
412863-413239 dmx512: data: "0 / 0x0"
413333-413522 dmx512: interframe: "Interframe"
413522-413569 dmx512: startbit: "Start bit"
413569-413616 dmx512: bit: "0"
413616-413663 dmx512: bit: "0"
413663-413710 dmx512: bit: "0"
413710-413757 dmx512: bit: "0"
413757-413804 dmx512: bit: "0"
413804-413851 dmx512: bit: "0"
413851-413898 dmx512: bit: "0"
413898-413945 dmx512: bit: "0"
413945-413992 dmx512: stopbits: "Stop bit"
413992-414039 dmx512: stopbits: "Stop bit"
413522-414039 dmx512: channel: "Channel 384"
413569-413945 dmx512: data: "0 / 0x0"
414039-414228 dmx512: interframe: "Interframe"
414228-414275 dmx512: startbit: "Start bit"
414275-414322 dmx512: bit: "0"
414322-414369 dmx512: bit: "0"
414369-414416 dmx512: bit: "0"
414416-414463 dmx512: bit: "0"
414463-414510 dmx512: bit: "0"
414510-414557 dmx512: bit: "0"
414557-414604 dmx512: bit: "0"
414604-414651 dmx512: bit: "0"
414651-414698 dmx512: stopbits: "Stop bit"
414698-414745 dmx512: stopbits: "Stop bit"
414228-414745 dmx512: channel: "Channel 385"
414275-414651 dmx512: data: "0 / 0x0"
414745-414934 dmx512: interframe: "Interframe"
414934-414981 dmx512: startbit: "Start bit"
414981-415028 dmx512: bit: "0"
415028-415075 dmx512: bit: "0"
415075-415122 dmx512: bit: "0"
415122-415169 dmx512: bit: "0"
415169-415216 dmx512: bit: "0"
415216-415263 dmx512: bit: "0"
415263-415310 dmx512: bit: "0"
415310-415357 dmx512: bit: "0"
415357-415404 dmx512: stopbits: "Stop bit"
415404-415451 dmx512: stopbits: "Stop bit"
414934-415451 dmx512: channel: "Channel 386"
414981-415357 dmx512: data: "0 / 0x0"
415451-415640 dmx512: interframe: "Interframe"
415640-415687 dmx512: startbit: "Start bit"
415687-415734 dmx512: bit: "0"
415734-415781 dmx512: bit: "0"
415781-415828 dmx512: bit: "0"
415828-415875 dmx512: bit: "0"
415875-415922 dmx512: bit: "0"
415922-415969 dmx512: bit: "0"
415969-416016 dmx512: bit: "0"
416016-416063 dmx512: bit: "0"
416063-416110 dmx512: stopbits: "Stop bit"
416110-416157 dmx512: stopbits: "Stop bit"
415640-416157 dmx512: channel: "Channel 387"
415687-416063 dmx512: data: "0 / 0x0"
416157-416347 dmx512: interframe: "Interframe"
416347-416394 dmx512: startbit: "Start bit"
416394-416441 dmx512: bit: "0"
416441-416488 dmx512: bit: "0"
416488-416535 dmx512: bit: "0"
416535-416582 dmx512: bit: "0"
416582-416629 dmx512: bit: "0"
416629-416676 dmx512: bit: "0"
416676-416723 dmx512: bit: "0"
416723-416770 dmx512: bit: "0"
416770-416817 dmx512: stopbits: "Stop bit"
416817-416864 dmx512: stopbits: "Stop bit"
416347-416864 dmx512: channel: "Channel 388"
416394-416770 dmx512: data: "0 / 0x0"
416864-417053 dmx512: interframe: "Interframe"
417053-417100 dmx512: startbit: "Start bit"
417100-417147 dmx512: bit: "0"
417147-417194 dmx512: bit: "0"
417194-417241 dmx512: bit: "0"
417241-417288 dmx512: bit: "0"
417288-417335 dmx512: bit: "0"
417335-417382 dmx512: bit: "0"
417382-417429 dmx512: bit: "0"
417429-417476 dmx512: bit: "0"
417476-417523 dmx512: stopbits: "Stop bit"
417523-417570 dmx512: stopbits: "Stop bit"
417053-417570 dmx512: channel: "Channel 389"
417100-417476 dmx512: data: "0 / 0x0"
417570-417759 dmx512: interframe: "Interframe"
417759-417806 dmx512: startbit: "Start bit"
417806-417853 dmx512: bit: "0"
417853-417900 dmx512: bit: "0"
417900-417947 dmx512: bit: "0"
417947-417994 dmx512: bit: "0"
417994-418041 dmx512: bit: "0"
418041-418088 dmx512: bit: "0"
418088-418135 dmx512: bit: "0"
418135-418182 dmx512: bit: "0"
418182-418229 dmx512: stopbits: "Stop bit"
418229-418276 dmx512: stopbits: "Stop bit"
417759-418276 dmx512: channel: "Channel 390"
417806-418182 dmx512: data: "0 / 0x0"
418276-418465 dmx512: interframe: "Interframe"
418465-418512 dmx512: startbit: "Start bit"
418512-418559 dmx512: bit: "0"
418559-418606 dmx512: bit: "0"
418606-418653 dmx512: bit: "0"
418653-418700 dmx512: bit: "0"
418700-418747 dmx512: bit: "0"
418747-418794 dmx512: bit: "0"
418794-418841 dmx512: bit: "0"
418841-418888 dmx512: bit: "0"
418888-418935 dmx512: stopbits: "Stop bit"
418935-418982 dmx512: stopbits: "Stop bit"
418465-418982 dmx512: channel: "Channel 391"
418512-418888 dmx512: data: "0 / 0x0"
418982-419171 dmx512: interframe: "Interframe"
419171-419218 dmx512: startbit: "Start bit"
419218-419265 dmx512: bit: "0"
419265-419312 dmx512: bit: "0"
419312-419359 dmx512: bit: "0"
419359-419406 dmx512: bit: "0"
419406-419453 dmx512: bit: "0"
419453-419500 dmx512: bit: "0"
419500-419547 dmx512: bit: "0"
419547-419594 dmx512: bit: "0"
419594-419641 dmx512: stopbits: "Stop bit"
419641-419688 dmx512: stopbits: "Stop bit"
419171-419688 dmx512: channel: "Channel 392"
419218-419594 dmx512: data: "0 / 0x0"
419688-419877 dmx512: interframe: "Interframe"
419877-419924 dmx512: startbit: "Start bit"
419924-419971 dmx512: bit: "0"
419971-420018 dmx512: bit: "0"
420018-420065 dmx512: bit: "0"
420065-420112 dmx512: bit: "0"
420112-420159 dmx512: bit: "0"
420159-420206 dmx512: bit: "0"
420206-420253 dmx512: bit: "0"
420253-420300 dmx512: bit: "0"
420300-420347 dmx512: stopbits: "Stop bit"
420347-420394 dmx512: stopbits: "Stop bit"
419877-420394 dmx512: channel: "Channel 393"
419924-420300 dmx512: data: "0 / 0x0"
420394-420584 dmx512: interframe: "Interframe"
420584-420631 dmx512: startbit: "Start bit"
420631-420678 dmx512: bit: "0"
420678-420725 dmx512: bit: "0"
420725-420772 dmx512: bit: "0"
420772-420819 dmx512: bit: "0"
420819-420866 dmx512: bit: "0"
420866-420913 dmx512: bit: "0"
420913-420960 dmx512: bit: "0"
420960-421007 dmx512: bit: "0"
421007-421054 dmx512: stopbits: "Stop bit"
421054-421101 dmx512: stopbits: "Stop bit"
420584-421101 dmx512: channel: "Channel 394"
420631-421007 dmx512: data: "0 / 0x0"
421101-421290 dmx512: interframe: "Interframe"
421290-421337 dmx512: startbit: "Start bit"
421337-421384 dmx512: bit: "0"
421384-421431 dmx512: bit: "0"
421431-421478 dmx512: bit: "0"
421478-421525 dmx512: bit: "0"
421525-421572 dmx512: bit: "0"
421572-421619 dmx512: bit: "0"
421619-421666 dmx512: bit: "0"
421666-421713 dmx512: bit: "0"
421713-421760 dmx512: stopbits: "Stop bit"
421760-421807 dmx512: stopbits: "Stop bit"
421290-421807 dmx512: channel: "Channel 395"
421337-421713 dmx512: data: "0 / 0x0"
421807-421996 dmx512: interframe: "Interframe"
421996-422043 dmx512: startbit: "Start bit"
422043-422090 dmx512: bit: "0"
422090-422137 dmx512: bit: "0"
422137-422184 dmx512: bit: "0"
422184-422231 dmx512: bit: "0"
422231-422278 dmx512: bit: "0"
422278-422325 dmx512: bit: "0"
422325-422372 dmx512: bit: "0"
422372-422419 dmx512: bit: "0"
422419-422466 dmx512: stopbits: "Stop bit"
422466-422513 dmx512: stopbits: "Stop bit"
421996-422513 dmx512: channel: "Channel 396"
422043-422419 dmx512: data: "0 / 0x0"
422513-422702 dmx512: interframe: "Interframe"
422702-422749 dmx512: startbit: "Start bit"
422749-422796 dmx512: bit: "0"
422796-422843 dmx512: bit: "0"
422843-422890 dmx512: bit: "0"
422890-422937 dmx512: bit: "0"
422937-422984 dmx512: bit: "0"
422984-423031 dmx512: bit: "0"
423031-423078 dmx512: bit: "0"
423078-423125 dmx512: bit: "0"
423125-423172 dmx512: stopbits: "Stop bit"
423172-423219 dmx512: stopbits: "Stop bit"
422702-423219 dmx512: channel: "Channel 397"
422749-423125 dmx512: data: "0 / 0x0"
423219-423408 dmx512: interframe: "Interframe"
423408-423455 dmx512: startbit: "Start bit"
423455-423502 dmx512: bit: "0"
423502-423549 dmx512: bit: "0"
423549-423596 dmx512: bit: "0"
423596-423643 dmx512: bit: "0"
423643-423690 dmx512: bit: "0"
423690-423737 dmx512: bit: "0"
423737-423784 dmx512: bit: "0"
423784-423831 dmx512: bit: "0"
423831-423878 dmx512: stopbits: "Stop bit"
423878-423925 dmx512: stopbits: "Stop bit"
423408-423925 dmx512: channel: "Channel 398"
423455-423831 dmx512: data: "0 / 0x0"
423925-424114 dmx512: interframe: "Interframe"
424114-424161 dmx512: startbit: "Start bit"
424161-424208 dmx512: bit: "0"
424208-424255 dmx512: bit: "0"
424255-424302 dmx512: bit: "0"
424302-424349 dmx512: bit: "0"
424349-424396 dmx512: bit: "0"
424396-424443 dmx512: bit: "0"
424443-424490 dmx512: bit: "0"
424490-424537 dmx512: bit: "0"
424537-424584 dmx512: stopbits: "Stop bit"
424584-424631 dmx512: stopbits: "Stop bit"
424114-424631 dmx512: channel: "Channel 399"
424161-424537 dmx512: data: "0 / 0x0"
424631-424821 dmx512: interframe: "Interframe"
424821-424868 dmx512: startbit: "Start bit"
424868-424915 dmx512: bit: "0"
424915-424962 dmx512: bit: "0"
424962-425009 dmx512: bit: "0"
425009-425056 dmx512: bit: "0"
425056-425103 dmx512: bit: "0"
425103-425150 dmx512: bit: "0"
425150-425197 dmx512: bit: "0"
425197-425244 dmx512: bit: "0"
425244-425291 dmx512: stopbits: "Stop bit"
425291-425338 dmx512: stopbits: "Stop bit"
424821-425338 dmx512: channel: "Channel 400"
424868-425244 dmx512: data: "0 / 0x0"
425338-425527 dmx512: interframe: "Interframe"
425527-425574 dmx512: startbit: "Start bit"
425574-425621 dmx512: bit: "1"
425621-425668 dmx512: bit: "0"
425668-425715 dmx512: bit: "1"
425715-425762 dmx512: bit: "0"
425762-425809 dmx512: bit: "1"
425809-425856 dmx512: bit: "0"
425856-425903 dmx512: bit: "1"
425903-425950 dmx512: bit: "0"
425950-425997 dmx512: stopbits: "Stop bit"
425997-426044 dmx512: stopbits: "Stop bit"
425527-426044 dmx512: channel: "Channel 401"
425574-425950 dmx512: data: "85 / 0x55"
426044-426233 dmx512: interframe: "Interframe"
426233-426280 dmx512: startbit: "Start bit"
426280-426327 dmx512: bit: "1"
426327-426374 dmx512: bit: "0"
426374-426421 dmx512: bit: "1"
426421-426468 dmx512: bit: "0"
426468-426515 dmx512: bit: "1"
426515-426562 dmx512: bit: "0"
426562-426609 dmx512: bit: "1"
426609-426656 dmx512: bit: "0"
426656-426703 dmx512: stopbits: "Stop bit"
426703-426750 dmx512: stopbits: "Stop bit"
426233-426750 dmx512: channel: "Channel 402"
426280-426656 dmx512: data: "85 / 0x55"
426750-426939 dmx512: interframe: "Interframe"
426939-426986 dmx512: startbit: "Start bit"
426986-427033 dmx512: bit: "0"
427033-427080 dmx512: bit: "0"
427080-427127 dmx512: bit: "0"
427127-427174 dmx512: bit: "0"
427174-427221 dmx512: bit: "0"
427221-427268 dmx512: bit: "0"
427268-427315 dmx512: bit: "0"
427315-427362 dmx512: bit: "0"
427362-427409 dmx512: stopbits: "Stop bit"
427409-427456 dmx512: stopbits: "Stop bit"
426939-427456 dmx512: channel: "Channel 403"
426986-427362 dmx512: data: "0 / 0x0"
427456-427645 dmx512: interframe: "Interframe"
427645-427692 dmx512: startbit: "Start bit"
427692-427739 dmx512: bit: "0"
427739-427786 dmx512: bit: "0"
427786-427833 dmx512: bit: "0"
427833-427880 dmx512: bit: "0"
427880-427927 dmx512: bit: "0"
427927-427974 dmx512: bit: "0"
427974-428021 dmx512: bit: "0"
428021-428068 dmx512: bit: "0"
428068-428115 dmx512: stopbits: "Stop bit"
428115-428162 dmx512: stopbits: "Stop bit"
427645-428162 dmx512: channel: "Channel 404"
427692-428068 dmx512: data: "0 / 0x0"
428162-428351 dmx512: interframe: "Interframe"
428351-428398 dmx512: startbit: "Start bit"
428398-428445 dmx512: bit: "0"
428445-428492 dmx512: bit: "0"
428492-428539 dmx512: bit: "0"
428539-428586 dmx512: bit: "0"
428586-428633 dmx512: bit: "0"
428633-428680 dmx512: bit: "0"
428680-428727 dmx512: bit: "0"
428727-428774 dmx512: bit: "0"
428774-428821 dmx512: stopbits: "Stop bit"
428821-428868 dmx512: stopbits: "Stop bit"
428351-428868 dmx512: channel: "Channel 405"
428398-428774 dmx512: data: "0 / 0x0"
428868-429058 dmx512: interframe: "Interframe"
429058-429105 dmx512: startbit: "Start bit"
429105-429152 dmx512: bit: "0"
429152-429199 dmx512: bit: "0"
429199-429246 dmx512: bit: "0"
429246-429293 dmx512: bit: "0"
429293-429340 dmx512: bit: "0"
429340-429387 dmx512: bit: "0"
429387-429434 dmx512: bit: "0"
429434-429481 dmx512: bit: "0"
429481-429528 dmx512: stopbits: "Stop bit"
429528-429575 dmx512: stopbits: "Stop bit"
429058-429575 dmx512: channel: "Channel 406"
429105-429481 dmx512: data: "0 / 0x0"
429575-429764 dmx512: interframe: "Interframe"
429764-429811 dmx512: startbit: "Start bit"
429811-429858 dmx512: bit: "0"
429858-429905 dmx512: bit: "0"
429905-429952 dmx512: bit: "0"
429952-429999 dmx512: bit: "0"
429999-430046 dmx512: bit: "0"
430046-430093 dmx512: bit: "0"
430093-430140 dmx512: bit: "0"
430140-430187 dmx512: bit: "0"
430187-430234 dmx512: stopbits: "Stop bit"
430234-430281 dmx512: stopbits: "Stop bit"
429764-430281 dmx512: channel: "Channel 407"
429811-430187 dmx512: data: "0 / 0x0"
430281-430470 dmx512: interframe: "Interframe"
430470-430517 dmx512: startbit: "Start bit"
430517-430564 dmx512: bit: "0"
430564-430611 dmx512: bit: "0"
430611-430658 dmx512: bit: "0"
430658-430705 dmx512: bit: "0"
430705-430752 dmx512: bit: "0"
430752-430799 dmx512: bit: "0"
430799-430846 dmx512: bit: "0"
430846-430893 dmx512: bit: "0"
430893-430940 dmx512: stopbits: "Stop bit"
430940-430987 dmx512: stopbits: "Stop bit"
430470-430987 dmx512: channel: "Channel 408"
430517-430893 dmx512: data: "0 / 0x0"
430987-431176 dmx512: interframe: "Interframe"
431176-431223 dmx512: startbit: "Start bit"
431223-431270 dmx512: bit: "0"
431270-431317 dmx512: bit: "0"
431317-431364 dmx512: bit: "0"
431364-431411 dmx512: bit: "0"
431411-431458 dmx512: bit: "0"
431458-431505 dmx512: bit: "0"
431505-431552 dmx512: bit: "0"
431552-431599 dmx512: bit: "0"
431599-431646 dmx512: stopbits: "Stop bit"
431646-431693 dmx512: stopbits: "Stop bit"
431176-431693 dmx512: channel: "Channel 409"
431223-431599 dmx512: data: "0 / 0x0"
431693-431882 dmx512: interframe: "Interframe"
431882-431929 dmx512: startbit: "Start bit"
431929-431976 dmx512: bit: "0"
431976-432023 dmx512: bit: "0"
432023-432070 dmx512: bit: "0"
432070-432117 dmx512: bit: "0"
432117-432164 dmx512: bit: "0"
432164-432211 dmx512: bit: "0"
432211-432258 dmx512: bit: "0"
432258-432305 dmx512: bit: "0"
432305-432352 dmx512: stopbits: "Stop bit"
432352-432399 dmx512: stopbits: "Stop bit"
431882-432399 dmx512: channel: "Channel 410"
431929-432305 dmx512: data: "0 / 0x0"
432399-432588 dmx512: interframe: "Interframe"
432588-432635 dmx512: startbit: "Start bit"
432635-432682 dmx512: bit: "0"
432682-432729 dmx512: bit: "0"
432729-432776 dmx512: bit: "0"
432776-432823 dmx512: bit: "0"
432823-432870 dmx512: bit: "0"
432870-432917 dmx512: bit: "0"
432917-432964 dmx512: bit: "0"
432964-433011 dmx512: bit: "0"
433011-433058 dmx512: stopbits: "Stop bit"
433058-433105 dmx512: stopbits: "Stop bit"
432588-433105 dmx512: channel: "Channel 411"
432635-433011 dmx512: data: "0 / 0x0"
433105-433294 dmx512: interframe: "Interframe"
433294-433341 dmx512: startbit: "Start bit"
433341-433388 dmx512: bit: "0"
433388-433435 dmx512: bit: "0"
433435-433482 dmx512: bit: "0"
433482-433529 dmx512: bit: "0"
433529-433576 dmx512: bit: "0"
433576-433623 dmx512: bit: "0"
433623-433670 dmx512: bit: "0"
433670-433717 dmx512: bit: "0"
433717-433764 dmx512: stopbits: "Stop bit"
433764-433811 dmx512: stopbits: "Stop bit"
433294-433811 dmx512: channel: "Channel 412"
433341-433717 dmx512: data: "0 / 0x0"
433811-434001 dmx512: interframe: "Interframe"
434001-434048 dmx512: startbit: "Start bit"
434048-434095 dmx512: bit: "0"
434095-434142 dmx512: bit: "0"
434142-434189 dmx512: bit: "0"
434189-434236 dmx512: bit: "0"
434236-434283 dmx512: bit: "0"
434283-434330 dmx512: bit: "0"
434330-434377 dmx512: bit: "0"
434377-434424 dmx512: bit: "0"
434424-434471 dmx512: stopbits: "Stop bit"
434471-434518 dmx512: stopbits: "Stop bit"
434001-434518 dmx512: channel: "Channel 413"
434048-434424 dmx512: data: "0 / 0x0"
434518-434707 dmx512: interframe: "Interframe"
434707-434754 dmx512: startbit: "Start bit"
434754-434801 dmx512: bit: "0"
434801-434848 dmx512: bit: "0"
434848-434895 dmx512: bit: "0"
434895-434942 dmx512: bit: "0"
434942-434989 dmx512: bit: "0"
434989-435036 dmx512: bit: "0"
435036-435083 dmx512: bit: "0"
435083-435130 dmx512: bit: "0"
435130-435177 dmx512: stopbits: "Stop bit"
435177-435224 dmx512: stopbits: "Stop bit"
434707-435224 dmx512: channel: "Channel 414"
434754-435130 dmx512: data: "0 / 0x0"
435224-435413 dmx512: interframe: "Interframe"
435413-435460 dmx512: startbit: "Start bit"
435460-435507 dmx512: bit: "0"
435507-435554 dmx512: bit: "0"
435554-435601 dmx512: bit: "0"
435601-435648 dmx512: bit: "0"
435648-435695 dmx512: bit: "0"
435695-435742 dmx512: bit: "0"
435742-435789 dmx512: bit: "0"
435789-435836 dmx512: bit: "0"
435836-435883 dmx512: stopbits: "Stop bit"
435883-435930 dmx512: stopbits: "Stop bit"
435413-435930 dmx512: channel: "Channel 415"
435460-435836 dmx512: data: "0 / 0x0"
435930-436119 dmx512: interframe: "Interframe"
436119-436166 dmx512: startbit: "Start bit"
436166-436213 dmx512: bit: "0"
436213-436260 dmx512: bit: "0"
436260-436307 dmx512: bit: "0"
436307-436354 dmx512: bit: "0"
436354-436401 dmx512: bit: "0"
436401-436448 dmx512: bit: "0"
436448-436495 dmx512: bit: "0"
436495-436542 dmx512: bit: "0"
436542-436589 dmx512: stopbits: "Stop bit"
436589-436636 dmx512: stopbits: "Stop bit"
436119-436636 dmx512: channel: "Channel 416"
436166-436542 dmx512: data: "0 / 0x0"
436636-436825 dmx512: interframe: "Interframe"
436825-436872 dmx512: startbit: "Start bit"
436872-436919 dmx512: bit: "0"
436919-436966 dmx512: bit: "0"
436966-437013 dmx512: bit: "0"
437013-437060 dmx512: bit: "0"
437060-437107 dmx512: bit: "0"
437107-437154 dmx512: bit: "0"
437154-437201 dmx512: bit: "0"
437201-437248 dmx512: bit: "0"
437248-437295 dmx512: stopbits: "Stop bit"
437295-437342 dmx512: stopbits: "Stop bit"
436825-437342 dmx512: channel: "Channel 417"
436872-437248 dmx512: data: "0 / 0x0"
437342-437531 dmx512: interframe: "Interframe"
437531-437578 dmx512: startbit: "Start bit"
437578-437625 dmx512: bit: "0"
437625-437672 dmx512: bit: "0"
437672-437719 dmx512: bit: "0"
437719-437766 dmx512: bit: "0"
437766-437813 dmx512: bit: "0"
437813-437860 dmx512: bit: "0"
437860-437907 dmx512: bit: "0"
437907-437954 dmx512: bit: "0"
437954-438001 dmx512: stopbits: "Stop bit"
438001-438048 dmx512: stopbits: "Stop bit"
437531-438048 dmx512: channel: "Channel 418"
437578-437954 dmx512: data: "0 / 0x0"
438048-438238 dmx512: interframe: "Interframe"
438238-438285 dmx512: startbit: "Start bit"
438285-438332 dmx512: bit: "0"
438332-438379 dmx512: bit: "0"
438379-438426 dmx512: bit: "0"
438426-438473 dmx512: bit: "0"
438473-438520 dmx512: bit: "0"
438520-438567 dmx512: bit: "0"
438567-438614 dmx512: bit: "0"
438614-438661 dmx512: bit: "0"
438661-438708 dmx512: stopbits: "Stop bit"
438708-438755 dmx512: stopbits: "Stop bit"
438238-438755 dmx512: channel: "Channel 419"
438285-438661 dmx512: data: "0 / 0x0"
438755-438944 dmx512: interframe: "Interframe"
438944-438991 dmx512: startbit: "Start bit"
438991-439038 dmx512: bit: "0"
439038-439085 dmx512: bit: "0"
439085-439132 dmx512: bit: "0"
439132-439179 dmx512: bit: "0"
439179-439226 dmx512: bit: "0"
439226-439273 dmx512: bit: "0"
439273-439320 dmx512: bit: "0"
439320-439367 dmx512: bit: "0"
439367-439414 dmx512: stopbits: "Stop bit"
439414-439461 dmx512: stopbits: "Stop bit"
438944-439461 dmx512: channel: "Channel 420"
438991-439367 dmx512: data: "0 / 0x0"
439461-439650 dmx512: interframe: "Interframe"
439650-439697 dmx512: startbit: "Start bit"
439697-439744 dmx512: bit: "0"
439744-439791 dmx512: bit: "0"
439791-439838 dmx512: bit: "0"
439838-439885 dmx512: bit: "0"
439885-439932 dmx512: bit: "0"
439932-439979 dmx512: bit: "0"
439979-440026 dmx512: bit: "0"
440026-440073 dmx512: bit: "0"
440073-440120 dmx512: stopbits: "Stop bit"
440120-440167 dmx512: stopbits: "Stop bit"
439650-440167 dmx512: channel: "Channel 421"
439697-440073 dmx512: data: "0 / 0x0"
440167-440356 dmx512: interframe: "Interframe"
440356-440403 dmx512: startbit: "Start bit"
440403-440450 dmx512: bit: "0"
440450-440497 dmx512: bit: "0"
440497-440544 dmx512: bit: "0"
440544-440591 dmx512: bit: "0"
440591-440638 dmx512: bit: "0"
440638-440685 dmx512: bit: "0"
440685-440732 dmx512: bit: "0"
440732-440779 dmx512: bit: "0"
440779-440826 dmx512: stopbits: "Stop bit"
440826-440873 dmx512: stopbits: "Stop bit"
440356-440873 dmx512: channel: "Channel 422"
440403-440779 dmx512: data: "0 / 0x0"
440873-441062 dmx512: interframe: "Interframe"
441062-441109 dmx512: startbit: "Start bit"
441109-441156 dmx512: bit: "0"
441156-441203 dmx512: bit: "0"
441203-441250 dmx512: bit: "0"
441250-441297 dmx512: bit: "0"
441297-441344 dmx512: bit: "0"
441344-441391 dmx512: bit: "0"
441391-441438 dmx512: bit: "0"
441438-441485 dmx512: bit: "0"
441485-441532 dmx512: stopbits: "Stop bit"
441532-441579 dmx512: stopbits: "Stop bit"
441062-441579 dmx512: channel: "Channel 423"
441109-441485 dmx512: data: "0 / 0x0"
441579-441768 dmx512: interframe: "Interframe"
441768-441815 dmx512: startbit: "Start bit"
441815-441862 dmx512: bit: "0"
441862-441909 dmx512: bit: "0"
441909-441956 dmx512: bit: "0"
441956-442003 dmx512: bit: "0"
442003-442050 dmx512: bit: "0"
442050-442097 dmx512: bit: "0"
442097-442144 dmx512: bit: "0"
442144-442191 dmx512: bit: "0"
442191-442238 dmx512: stopbits: "Stop bit"
442238-442285 dmx512: stopbits: "Stop bit"
441768-442285 dmx512: channel: "Channel 424"
441815-442191 dmx512: data: "0 / 0x0"
442285-442475 dmx512: interframe: "Interframe"
442475-442522 dmx512: startbit: "Start bit"
442522-442569 dmx512: bit: "0"
442569-442616 dmx512: bit: "0"
442616-442663 dmx512: bit: "0"
442663-442710 dmx512: bit: "0"
442710-442757 dmx512: bit: "0"
442757-442804 dmx512: bit: "0"
442804-442851 dmx512: bit: "0"
442851-442898 dmx512: bit: "0"
442898-442945 dmx512: stopbits: "Stop bit"
442945-442992 dmx512: stopbits: "Stop bit"
442475-442992 dmx512: channel: "Channel 425"
442522-442898 dmx512: data: "0 / 0x0"
442992-443181 dmx512: interframe: "Interframe"
443181-443228 dmx512: startbit: "Start bit"
443228-443275 dmx512: bit: "0"
443275-443322 dmx512: bit: "0"
443322-443369 dmx512: bit: "0"
443369-443416 dmx512: bit: "0"
443416-443463 dmx512: bit: "0"
443463-443510 dmx512: bit: "0"
443510-443557 dmx512: bit: "0"
443557-443604 dmx512: bit: "0"
443604-443651 dmx512: stopbits: "Stop bit"
443651-443698 dmx512: stopbits: "Stop bit"
443181-443698 dmx512: channel: "Channel 426"
443228-443604 dmx512: data: "0 / 0x0"
443698-443887 dmx512: interframe: "Interframe"
443887-443934 dmx512: startbit: "Start bit"
443934-443981 dmx512: bit: "0"
443981-444028 dmx512: bit: "0"
444028-444075 dmx512: bit: "0"
444075-444122 dmx512: bit: "0"
444122-444169 dmx512: bit: "0"
444169-444216 dmx512: bit: "0"
444216-444263 dmx512: bit: "0"
444263-444310 dmx512: bit: "0"
444310-444357 dmx512: stopbits: "Stop bit"
444357-444404 dmx512: stopbits: "Stop bit"
443887-444404 dmx512: channel: "Channel 427"
443934-444310 dmx512: data: "0 / 0x0"
444404-444593 dmx512: interframe: "Interframe"
444593-444640 dmx512: startbit: "Start bit"
444640-444687 dmx512: bit: "0"
444687-444734 dmx512: bit: "0"
444734-444781 dmx512: bit: "0"
444781-444828 dmx512: bit: "0"
444828-444875 dmx512: bit: "0"
444875-444922 dmx512: bit: "0"
444922-444969 dmx512: bit: "0"
444969-445016 dmx512: bit: "0"
445016-445063 dmx512: stopbits: "Stop bit"
445063-445110 dmx512: stopbits: "Stop bit"
444593-445110 dmx512: channel: "Channel 428"
444640-445016 dmx512: data: "0 / 0x0"
445110-445299 dmx512: interframe: "Interframe"
445299-445346 dmx512: startbit: "Start bit"
445346-445393 dmx512: bit: "0"
445393-445440 dmx512: bit: "0"
445440-445487 dmx512: bit: "0"
445487-445534 dmx512: bit: "0"
445534-445581 dmx512: bit: "0"
445581-445628 dmx512: bit: "0"
445628-445675 dmx512: bit: "0"
445675-445722 dmx512: bit: "0"
445722-445769 dmx512: stopbits: "Stop bit"
445769-445816 dmx512: stopbits: "Stop bit"
445299-445816 dmx512: channel: "Channel 429"
445346-445722 dmx512: data: "0 / 0x0"
445816-446005 dmx512: interframe: "Interframe"
446005-446052 dmx512: startbit: "Start bit"
446052-446099 dmx512: bit: "0"
446099-446146 dmx512: bit: "0"
446146-446193 dmx512: bit: "0"
446193-446240 dmx512: bit: "0"
446240-446287 dmx512: bit: "0"
446287-446334 dmx512: bit: "0"
446334-446381 dmx512: bit: "0"
446381-446428 dmx512: bit: "0"
446428-446475 dmx512: stopbits: "Stop bit"
446475-446522 dmx512: stopbits: "Stop bit"
446005-446522 dmx512: channel: "Channel 430"
446052-446428 dmx512: data: "0 / 0x0"
446522-446712 dmx512: interframe: "Interframe"
446712-446759 dmx512: startbit: "Start bit"
446759-446806 dmx512: bit: "0"
446806-446853 dmx512: bit: "0"
446853-446900 dmx512: bit: "0"
446900-446947 dmx512: bit: "0"
446947-446994 dmx512: bit: "0"
446994-447041 dmx512: bit: "0"
447041-447088 dmx512: bit: "0"
447088-447135 dmx512: bit: "0"
447135-447182 dmx512: stopbits: "Stop bit"
447182-447229 dmx512: stopbits: "Stop bit"
446712-447229 dmx512: channel: "Channel 431"
446759-447135 dmx512: data: "0 / 0x0"
447229-447418 dmx512: interframe: "Interframe"
447418-447465 dmx512: startbit: "Start bit"
447465-447512 dmx512: bit: "0"
447512-447559 dmx512: bit: "0"
447559-447606 dmx512: bit: "0"
447606-447653 dmx512: bit: "0"
447653-447700 dmx512: bit: "0"
447700-447747 dmx512: bit: "0"
447747-447794 dmx512: bit: "0"
447794-447841 dmx512: bit: "0"
447841-447888 dmx512: stopbits: "Stop bit"
447888-447935 dmx512: stopbits: "Stop bit"
447418-447935 dmx512: channel: "Channel 432"
447465-447841 dmx512: data: "0 / 0x0"
447935-448124 dmx512: interframe: "Interframe"
448124-448171 dmx512: startbit: "Start bit"
448171-448218 dmx512: bit: "0"
448218-448265 dmx512: bit: "0"
448265-448312 dmx512: bit: "0"
448312-448359 dmx512: bit: "0"
448359-448406 dmx512: bit: "0"
448406-448453 dmx512: bit: "0"
448453-448500 dmx512: bit: "0"
448500-448547 dmx512: bit: "0"
448547-448594 dmx512: stopbits: "Stop bit"
448594-448641 dmx512: stopbits: "Stop bit"
448124-448641 dmx512: channel: "Channel 433"
448171-448547 dmx512: data: "0 / 0x0"
448641-448830 dmx512: interframe: "Interframe"
448830-448877 dmx512: startbit: "Start bit"
448877-448924 dmx512: bit: "0"
448924-448971 dmx512: bit: "0"
448971-449018 dmx512: bit: "0"
449018-449065 dmx512: bit: "0"
449065-449112 dmx512: bit: "0"
449112-449159 dmx512: bit: "0"
449159-449206 dmx512: bit: "0"
449206-449253 dmx512: bit: "0"
449253-449300 dmx512: stopbits: "Stop bit"
449300-449347 dmx512: stopbits: "Stop bit"
448830-449347 dmx512: channel: "Channel 434"
448877-449253 dmx512: data: "0 / 0x0"
449347-449536 dmx512: interframe: "Interframe"
449536-449583 dmx512: startbit: "Start bit"
449583-449630 dmx512: bit: "0"
449630-449677 dmx512: bit: "0"
449677-449724 dmx512: bit: "0"
449724-449771 dmx512: bit: "0"
449771-449818 dmx512: bit: "0"
449818-449865 dmx512: bit: "0"
449865-449912 dmx512: bit: "0"
449912-449959 dmx512: bit: "0"
449959-450006 dmx512: stopbits: "Stop bit"
450006-450053 dmx512: stopbits: "Stop bit"
449536-450053 dmx512: channel: "Channel 435"
449583-449959 dmx512: data: "0 / 0x0"
450053-450242 dmx512: interframe: "Interframe"
450242-450289 dmx512: startbit: "Start bit"
450289-450336 dmx512: bit: "0"
450336-450383 dmx512: bit: "0"
450383-450430 dmx512: bit: "0"
450430-450477 dmx512: bit: "0"
450477-450524 dmx512: bit: "0"
450524-450571 dmx512: bit: "0"
450571-450618 dmx512: bit: "0"
450618-450665 dmx512: bit: "0"
450665-450712 dmx512: stopbits: "Stop bit"
450712-450759 dmx512: stopbits: "Stop bit"
450242-450759 dmx512: channel: "Channel 436"
450289-450665 dmx512: data: "0 / 0x0"
450759-450949 dmx512: interframe: "Interframe"
450949-450996 dmx512: startbit: "Start bit"
450996-451043 dmx512: bit: "0"
451043-451090 dmx512: bit: "0"
451090-451137 dmx512: bit: "0"
451137-451184 dmx512: bit: "0"
451184-451231 dmx512: bit: "0"
451231-451278 dmx512: bit: "0"
451278-451325 dmx512: bit: "0"
451325-451372 dmx512: bit: "0"
451372-451419 dmx512: stopbits: "Stop bit"
451419-451466 dmx512: stopbits: "Stop bit"
450949-451466 dmx512: channel: "Channel 437"
450996-451372 dmx512: data: "0 / 0x0"
451466-451655 dmx512: interframe: "Interframe"
451655-451702 dmx512: startbit: "Start bit"
451702-451749 dmx512: bit: "0"
451749-451796 dmx512: bit: "0"
451796-451843 dmx512: bit: "0"
451843-451890 dmx512: bit: "0"
451890-451937 dmx512: bit: "0"
451937-451984 dmx512: bit: "0"
451984-452031 dmx512: bit: "0"
452031-452078 dmx512: bit: "0"
452078-452125 dmx512: stopbits: "Stop bit"
452125-452172 dmx512: stopbits: "Stop bit"
451655-452172 dmx512: channel: "Channel 438"
451702-452078 dmx512: data: "0 / 0x0"
452172-452361 dmx512: interframe: "Interframe"
452361-452408 dmx512: startbit: "Start bit"
452408-452455 dmx512: bit: "0"
452455-452502 dmx512: bit: "0"
452502-452549 dmx512: bit: "0"
452549-452596 dmx512: bit: "0"
452596-452643 dmx512: bit: "0"
452643-452690 dmx512: bit: "0"
452690-452737 dmx512: bit: "0"
452737-452784 dmx512: bit: "0"
452784-452831 dmx512: stopbits: "Stop bit"
452831-452878 dmx512: stopbits: "Stop bit"
452361-452878 dmx512: channel: "Channel 439"
452408-452784 dmx512: data: "0 / 0x0"
452878-453067 dmx512: interframe: "Interframe"
453067-453114 dmx512: startbit: "Start bit"
453114-453161 dmx512: bit: "0"
453161-453208 dmx512: bit: "0"
453208-453255 dmx512: bit: "0"
453255-453302 dmx512: bit: "0"
453302-453349 dmx512: bit: "0"
453349-453396 dmx512: bit: "0"
453396-453443 dmx512: bit: "0"
453443-453490 dmx512: bit: "0"
453490-453537 dmx512: stopbits: "Stop bit"
453537-453584 dmx512: stopbits: "Stop bit"
453067-453584 dmx512: channel: "Channel 440"
453114-453490 dmx512: data: "0 / 0x0"
453584-453773 dmx512: interframe: "Interframe"
453773-453820 dmx512: startbit: "Start bit"
453820-453867 dmx512: bit: "0"
453867-453914 dmx512: bit: "0"
453914-453961 dmx512: bit: "0"
453961-454008 dmx512: bit: "0"
454008-454055 dmx512: bit: "0"
454055-454102 dmx512: bit: "0"
454102-454149 dmx512: bit: "0"
454149-454196 dmx512: bit: "0"
454196-454243 dmx512: stopbits: "Stop bit"
454243-454290 dmx512: stopbits: "Stop bit"
453773-454290 dmx512: channel: "Channel 441"
453820-454196 dmx512: data: "0 / 0x0"
454290-454479 dmx512: interframe: "Interframe"
454479-454526 dmx512: startbit: "Start bit"
454526-454573 dmx512: bit: "0"
454573-454620 dmx512: bit: "0"
454620-454667 dmx512: bit: "0"
454667-454714 dmx512: bit: "0"
454714-454761 dmx512: bit: "0"
454761-454808 dmx512: bit: "0"
454808-454855 dmx512: bit: "0"
454855-454902 dmx512: bit: "0"
454902-454949 dmx512: stopbits: "Stop bit"
454949-454996 dmx512: stopbits: "Stop bit"
454479-454996 dmx512: channel: "Channel 442"
454526-454902 dmx512: data: "0 / 0x0"
454996-455185 dmx512: interframe: "Interframe"
455185-455232 dmx512: startbit: "Start bit"
455232-455279 dmx512: bit: "0"
455279-455326 dmx512: bit: "0"
455326-455373 dmx512: bit: "0"
455373-455420 dmx512: bit: "0"
455420-455467 dmx512: bit: "0"
455467-455514 dmx512: bit: "0"
455514-455561 dmx512: bit: "0"
455561-455608 dmx512: bit: "0"
455608-455655 dmx512: stopbits: "Stop bit"
455655-455702 dmx512: stopbits: "Stop bit"
455185-455702 dmx512: channel: "Channel 443"
455232-455608 dmx512: data: "0 / 0x0"
455702-455892 dmx512: interframe: "Interframe"
455892-455939 dmx512: startbit: "Start bit"
455939-455986 dmx512: bit: "0"
455986-456033 dmx512: bit: "0"
456033-456080 dmx512: bit: "0"
456080-456127 dmx512: bit: "0"
456127-456174 dmx512: bit: "0"
456174-456221 dmx512: bit: "0"
456221-456268 dmx512: bit: "0"
456268-456315 dmx512: bit: "0"
456315-456362 dmx512: stopbits: "Stop bit"
456362-456409 dmx512: stopbits: "Stop bit"
455892-456409 dmx512: channel: "Channel 444"
455939-456315 dmx512: data: "0 / 0x0"
456409-456598 dmx512: interframe: "Interframe"
456598-456645 dmx512: startbit: "Start bit"
456645-456692 dmx512: bit: "0"
456692-456739 dmx512: bit: "0"
456739-456786 dmx512: bit: "0"
456786-456833 dmx512: bit: "0"
456833-456880 dmx512: bit: "0"
456880-456927 dmx512: bit: "0"
456927-456974 dmx512: bit: "0"
456974-457021 dmx512: bit: "0"
457021-457068 dmx512: stopbits: "Stop bit"
457068-457115 dmx512: stopbits: "Stop bit"
456598-457115 dmx512: channel: "Channel 445"
456645-457021 dmx512: data: "0 / 0x0"
457115-457304 dmx512: interframe: "Interframe"
457304-457351 dmx512: startbit: "Start bit"
457351-457398 dmx512: bit: "0"
457398-457445 dmx512: bit: "0"
457445-457492 dmx512: bit: "0"
457492-457539 dmx512: bit: "0"
457539-457586 dmx512: bit: "0"
457586-457633 dmx512: bit: "0"
457633-457680 dmx512: bit: "0"
457680-457727 dmx512: bit: "0"
457727-457774 dmx512: stopbits: "Stop bit"
457774-457821 dmx512: stopbits: "Stop bit"
457304-457821 dmx512: channel: "Channel 446"
457351-457727 dmx512: data: "0 / 0x0"
457821-458010 dmx512: interframe: "Interframe"
458010-458057 dmx512: startbit: "Start bit"
458057-458104 dmx512: bit: "0"
458104-458151 dmx512: bit: "0"
458151-458198 dmx512: bit: "0"
458198-458245 dmx512: bit: "0"
458245-458292 dmx512: bit: "0"
458292-458339 dmx512: bit: "0"
458339-458386 dmx512: bit: "0"
458386-458433 dmx512: bit: "0"
458433-458480 dmx512: stopbits: "Stop bit"
458480-458527 dmx512: stopbits: "Stop bit"
458010-458527 dmx512: channel: "Channel 447"
458057-458433 dmx512: data: "0 / 0x0"
458527-458716 dmx512: interframe: "Interframe"
458716-458763 dmx512: startbit: "Start bit"
458763-458810 dmx512: bit: "0"
458810-458857 dmx512: bit: "0"
458857-458904 dmx512: bit: "0"
458904-458951 dmx512: bit: "0"
458951-458998 dmx512: bit: "0"
458998-459045 dmx512: bit: "0"
459045-459092 dmx512: bit: "0"
459092-459139 dmx512: bit: "0"
459139-459186 dmx512: stopbits: "Stop bit"
459186-459233 dmx512: stopbits: "Stop bit"
458716-459233 dmx512: channel: "Channel 448"
458763-459139 dmx512: data: "0 / 0x0"
459233-459422 dmx512: interframe: "Interframe"
459422-459469 dmx512: startbit: "Start bit"
459469-459516 dmx512: bit: "0"
459516-459563 dmx512: bit: "0"
459563-459610 dmx512: bit: "0"
459610-459657 dmx512: bit: "0"
459657-459704 dmx512: bit: "0"
459704-459751 dmx512: bit: "0"
459751-459798 dmx512: bit: "0"
459798-459845 dmx512: bit: "0"
459845-459892 dmx512: stopbits: "Stop bit"
459892-459939 dmx512: stopbits: "Stop bit"
459422-459939 dmx512: channel: "Channel 449"
459469-459845 dmx512: data: "0 / 0x0"
459939-460129 dmx512: interframe: "Interframe"
460129-460176 dmx512: startbit: "Start bit"
460176-460223 dmx512: bit: "0"
460223-460270 dmx512: bit: "0"
460270-460317 dmx512: bit: "0"
460317-460364 dmx512: bit: "0"
460364-460411 dmx512: bit: "0"
460411-460458 dmx512: bit: "0"
460458-460505 dmx512: bit: "0"
460505-460552 dmx512: bit: "0"
460552-460599 dmx512: stopbits: "Stop bit"
460599-460646 dmx512: stopbits: "Stop bit"
460129-460646 dmx512: channel: "Channel 450"
460176-460552 dmx512: data: "0 / 0x0"
460646-460835 dmx512: interframe: "Interframe"
460835-460882 dmx512: startbit: "Start bit"
460882-460929 dmx512: bit: "0"
460929-460976 dmx512: bit: "0"
460976-461023 dmx512: bit: "0"
461023-461070 dmx512: bit: "0"
461070-461117 dmx512: bit: "0"
461117-461164 dmx512: bit: "0"
461164-461211 dmx512: bit: "0"
461211-461258 dmx512: bit: "0"
461258-461305 dmx512: stopbits: "Stop bit"
461305-461352 dmx512: stopbits: "Stop bit"
460835-461352 dmx512: channel: "Channel 451"
460882-461258 dmx512: data: "0 / 0x0"
461352-461541 dmx512: interframe: "Interframe"
461541-461588 dmx512: startbit: "Start bit"
461588-461635 dmx512: bit: "0"
461635-461682 dmx512: bit: "0"
461682-461729 dmx512: bit: "0"
461729-461776 dmx512: bit: "0"
461776-461823 dmx512: bit: "0"
461823-461870 dmx512: bit: "0"
461870-461917 dmx512: bit: "0"
461917-461964 dmx512: bit: "0"
461964-462011 dmx512: stopbits: "Stop bit"
462011-462058 dmx512: stopbits: "Stop bit"
461541-462058 dmx512: channel: "Channel 452"
461588-461964 dmx512: data: "0 / 0x0"
462058-462247 dmx512: interframe: "Interframe"
462247-462294 dmx512: startbit: "Start bit"
462294-462341 dmx512: bit: "0"
462341-462388 dmx512: bit: "0"
462388-462435 dmx512: bit: "0"
462435-462482 dmx512: bit: "0"
462482-462529 dmx512: bit: "0"
462529-462576 dmx512: bit: "0"
462576-462623 dmx512: bit: "0"
462623-462670 dmx512: bit: "0"
462670-462717 dmx512: stopbits: "Stop bit"
462717-462764 dmx512: stopbits: "Stop bit"
462247-462764 dmx512: channel: "Channel 453"
462294-462670 dmx512: data: "0 / 0x0"
462764-462953 dmx512: interframe: "Interframe"
462953-463000 dmx512: startbit: "Start bit"
463000-463047 dmx512: bit: "0"
463047-463094 dmx512: bit: "0"
463094-463141 dmx512: bit: "0"
463141-463188 dmx512: bit: "0"
463188-463235 dmx512: bit: "0"
463235-463282 dmx512: bit: "0"
463282-463329 dmx512: bit: "0"
463329-463376 dmx512: bit: "0"
463376-463423 dmx512: stopbits: "Stop bit"
463423-463470 dmx512: stopbits: "Stop bit"
462953-463470 dmx512: channel: "Channel 454"
463000-463376 dmx512: data: "0 / 0x0"
463470-463659 dmx512: interframe: "Interframe"
463659-463706 dmx512: startbit: "Start bit"
463706-463753 dmx512: bit: "0"
463753-463800 dmx512: bit: "0"
463800-463847 dmx512: bit: "0"
463847-463894 dmx512: bit: "0"
463894-463941 dmx512: bit: "0"
463941-463988 dmx512: bit: "0"
463988-464035 dmx512: bit: "0"
464035-464082 dmx512: bit: "0"
464082-464129 dmx512: stopbits: "Stop bit"
464129-464176 dmx512: stopbits: "Stop bit"
463659-464176 dmx512: channel: "Channel 455"
463706-464082 dmx512: data: "0 / 0x0"
464176-464366 dmx512: interframe: "Interframe"
464366-464413 dmx512: startbit: "Start bit"
464413-464460 dmx512: bit: "0"
464460-464507 dmx512: bit: "0"
464507-464554 dmx512: bit: "0"
464554-464601 dmx512: bit: "0"
464601-464648 dmx512: bit: "0"
464648-464695 dmx512: bit: "0"
464695-464742 dmx512: bit: "0"
464742-464789 dmx512: bit: "0"
464789-464836 dmx512: stopbits: "Stop bit"
464836-464883 dmx512: stopbits: "Stop bit"
464366-464883 dmx512: channel: "Channel 456"
464413-464789 dmx512: data: "0 / 0x0"
464883-465072 dmx512: interframe: "Interframe"
465072-465119 dmx512: startbit: "Start bit"
465119-465166 dmx512: bit: "0"
465166-465213 dmx512: bit: "0"
465213-465260 dmx512: bit: "0"
465260-465307 dmx512: bit: "0"
465307-465354 dmx512: bit: "0"
465354-465401 dmx512: bit: "0"
465401-465448 dmx512: bit: "0"
465448-465495 dmx512: bit: "0"
465495-465542 dmx512: stopbits: "Stop bit"
465542-465589 dmx512: stopbits: "Stop bit"
465072-465589 dmx512: channel: "Channel 457"
465119-465495 dmx512: data: "0 / 0x0"
465589-465778 dmx512: interframe: "Interframe"
465778-465825 dmx512: startbit: "Start bit"
465825-465872 dmx512: bit: "0"
465872-465919 dmx512: bit: "0"
465919-465966 dmx512: bit: "0"
465966-466013 dmx512: bit: "0"
466013-466060 dmx512: bit: "0"
466060-466107 dmx512: bit: "0"
466107-466154 dmx512: bit: "0"
466154-466201 dmx512: bit: "0"
466201-466248 dmx512: stopbits: "Stop bit"
466248-466295 dmx512: stopbits: "Stop bit"
465778-466295 dmx512: channel: "Channel 458"
465825-466201 dmx512: data: "0 / 0x0"
466295-466484 dmx512: interframe: "Interframe"
466484-466531 dmx512: startbit: "Start bit"
466531-466578 dmx512: bit: "0"
466578-466625 dmx512: bit: "0"
466625-466672 dmx512: bit: "0"
466672-466719 dmx512: bit: "0"
466719-466766 dmx512: bit: "0"
466766-466813 dmx512: bit: "0"
466813-466860 dmx512: bit: "0"
466860-466907 dmx512: bit: "0"
466907-466954 dmx512: stopbits: "Stop bit"
466954-467001 dmx512: stopbits: "Stop bit"
466484-467001 dmx512: channel: "Channel 459"
466531-466907 dmx512: data: "0 / 0x0"
467001-467190 dmx512: interframe: "Interframe"
467190-467237 dmx512: startbit: "Start bit"
467237-467284 dmx512: bit: "0"
467284-467331 dmx512: bit: "0"
467331-467378 dmx512: bit: "0"
467378-467425 dmx512: bit: "0"
467425-467472 dmx512: bit: "0"
467472-467519 dmx512: bit: "0"
467519-467566 dmx512: bit: "0"
467566-467613 dmx512: bit: "0"
467613-467660 dmx512: stopbits: "Stop bit"
467660-467707 dmx512: stopbits: "Stop bit"
467190-467707 dmx512: channel: "Channel 460"
467237-467613 dmx512: data: "0 / 0x0"
467707-467896 dmx512: interframe: "Interframe"
467896-467943 dmx512: startbit: "Start bit"
467943-467990 dmx512: bit: "0"
467990-468037 dmx512: bit: "0"
468037-468084 dmx512: bit: "0"
468084-468131 dmx512: bit: "0"
468131-468178 dmx512: bit: "0"
468178-468225 dmx512: bit: "0"
468225-468272 dmx512: bit: "0"
468272-468319 dmx512: bit: "0"
468319-468366 dmx512: stopbits: "Stop bit"
468366-468413 dmx512: stopbits: "Stop bit"
467896-468413 dmx512: channel: "Channel 461"
467943-468319 dmx512: data: "0 / 0x0"
468413-468603 dmx512: interframe: "Interframe"
468603-468650 dmx512: startbit: "Start bit"
468650-468697 dmx512: bit: "0"
468697-468744 dmx512: bit: "0"
468744-468791 dmx512: bit: "0"
468791-468838 dmx512: bit: "0"
468838-468885 dmx512: bit: "0"
468885-468932 dmx512: bit: "0"
468932-468979 dmx512: bit: "0"
468979-469026 dmx512: bit: "0"
469026-469073 dmx512: stopbits: "Stop bit"
469073-469120 dmx512: stopbits: "Stop bit"
468603-469120 dmx512: channel: "Channel 462"
468650-469026 dmx512: data: "0 / 0x0"
469120-469309 dmx512: interframe: "Interframe"
469309-469356 dmx512: startbit: "Start bit"
469356-469403 dmx512: bit: "0"
469403-469450 dmx512: bit: "0"
469450-469497 dmx512: bit: "0"
469497-469544 dmx512: bit: "0"
469544-469591 dmx512: bit: "0"
469591-469638 dmx512: bit: "0"
469638-469685 dmx512: bit: "0"
469685-469732 dmx512: bit: "0"
469732-469779 dmx512: stopbits: "Stop bit"
469779-469826 dmx512: stopbits: "Stop bit"
469309-469826 dmx512: channel: "Channel 463"
469356-469732 dmx512: data: "0 / 0x0"
469826-470015 dmx512: interframe: "Interframe"
470015-470062 dmx512: startbit: "Start bit"
470062-470109 dmx512: bit: "0"
470109-470156 dmx512: bit: "0"
470156-470203 dmx512: bit: "0"
470203-470250 dmx512: bit: "0"
470250-470297 dmx512: bit: "0"
470297-470344 dmx512: bit: "0"
470344-470391 dmx512: bit: "0"
470391-470438 dmx512: bit: "0"
470438-470485 dmx512: stopbits: "Stop bit"
470485-470532 dmx512: stopbits: "Stop bit"
470015-470532 dmx512: channel: "Channel 464"
470062-470438 dmx512: data: "0 / 0x0"
470532-470721 dmx512: interframe: "Interframe"
470721-470768 dmx512: startbit: "Start bit"
470768-470815 dmx512: bit: "0"
470815-470862 dmx512: bit: "0"
470862-470909 dmx512: bit: "0"
470909-470956 dmx512: bit: "0"
470956-471003 dmx512: bit: "0"
471003-471050 dmx512: bit: "0"
471050-471097 dmx512: bit: "0"
471097-471144 dmx512: bit: "0"
471144-471191 dmx512: stopbits: "Stop bit"
471191-471238 dmx512: stopbits: "Stop bit"
470721-471238 dmx512: channel: "Channel 465"
470768-471144 dmx512: data: "0 / 0x0"
471238-471427 dmx512: interframe: "Interframe"
471427-471474 dmx512: startbit: "Start bit"
471474-471521 dmx512: bit: "0"
471521-471568 dmx512: bit: "0"
471568-471615 dmx512: bit: "0"
471615-471662 dmx512: bit: "0"
471662-471709 dmx512: bit: "0"
471709-471756 dmx512: bit: "0"
471756-471803 dmx512: bit: "0"
471803-471850 dmx512: bit: "0"
471850-471897 dmx512: stopbits: "Stop bit"
471897-471944 dmx512: stopbits: "Stop bit"
471427-471944 dmx512: channel: "Channel 466"
471474-471850 dmx512: data: "0 / 0x0"
471944-472133 dmx512: interframe: "Interframe"
472133-472180 dmx512: startbit: "Start bit"
472180-472227 dmx512: bit: "0"
472227-472274 dmx512: bit: "0"
472274-472321 dmx512: bit: "0"
472321-472368 dmx512: bit: "0"
472368-472415 dmx512: bit: "0"
472415-472462 dmx512: bit: "0"
472462-472509 dmx512: bit: "0"
472509-472556 dmx512: bit: "0"
472556-472603 dmx512: stopbits: "Stop bit"
472603-472650 dmx512: stopbits: "Stop bit"
472133-472650 dmx512: channel: "Channel 467"
472180-472556 dmx512: data: "0 / 0x0"
472650-472839 dmx512: interframe: "Interframe"
472839-472886 dmx512: startbit: "Start bit"
472886-472933 dmx512: bit: "0"
472933-472980 dmx512: bit: "0"
472980-473027 dmx512: bit: "0"
473027-473074 dmx512: bit: "0"
473074-473121 dmx512: bit: "0"
473121-473168 dmx512: bit: "0"
473168-473215 dmx512: bit: "0"
473215-473262 dmx512: bit: "0"
473262-473309 dmx512: stopbits: "Stop bit"
473309-473356 dmx512: stopbits: "Stop bit"
472839-473356 dmx512: channel: "Channel 468"
472886-473262 dmx512: data: "0 / 0x0"
473356-473546 dmx512: interframe: "Interframe"
473546-473593 dmx512: startbit: "Start bit"
473593-473640 dmx512: bit: "0"
473640-473687 dmx512: bit: "0"
473687-473734 dmx512: bit: "0"
473734-473781 dmx512: bit: "0"
473781-473828 dmx512: bit: "0"
473828-473875 dmx512: bit: "0"
473875-473922 dmx512: bit: "0"
473922-473969 dmx512: bit: "0"
473969-474016 dmx512: stopbits: "Stop bit"
474016-474063 dmx512: stopbits: "Stop bit"
473546-474063 dmx512: channel: "Channel 469"
473593-473969 dmx512: data: "0 / 0x0"
474063-474252 dmx512: interframe: "Interframe"
474252-474299 dmx512: startbit: "Start bit"
474299-474346 dmx512: bit: "0"
474346-474393 dmx512: bit: "0"
474393-474440 dmx512: bit: "0"
474440-474487 dmx512: bit: "0"
474487-474534 dmx512: bit: "0"
474534-474581 dmx512: bit: "0"
474581-474628 dmx512: bit: "0"
474628-474675 dmx512: bit: "0"
474675-474722 dmx512: stopbits: "Stop bit"
474722-474769 dmx512: stopbits: "Stop bit"
474252-474769 dmx512: channel: "Channel 470"
474299-474675 dmx512: data: "0 / 0x0"
474769-474958 dmx512: interframe: "Interframe"
474958-475005 dmx512: startbit: "Start bit"
475005-475052 dmx512: bit: "0"
475052-475099 dmx512: bit: "0"
475099-475146 dmx512: bit: "0"
475146-475193 dmx512: bit: "0"
475193-475240 dmx512: bit: "0"
475240-475287 dmx512: bit: "0"
475287-475334 dmx512: bit: "0"
475334-475381 dmx512: bit: "0"
475381-475428 dmx512: stopbits: "Stop bit"
475428-475475 dmx512: stopbits: "Stop bit"
474958-475475 dmx512: channel: "Channel 471"
475005-475381 dmx512: data: "0 / 0x0"
475475-475664 dmx512: interframe: "Interframe"
475664-475711 dmx512: startbit: "Start bit"
475711-475758 dmx512: bit: "0"
475758-475805 dmx512: bit: "0"
475805-475852 dmx512: bit: "0"
475852-475899 dmx512: bit: "0"
475899-475946 dmx512: bit: "0"
475946-475993 dmx512: bit: "0"
475993-476040 dmx512: bit: "0"
476040-476087 dmx512: bit: "0"
476087-476134 dmx512: stopbits: "Stop bit"
476134-476181 dmx512: stopbits: "Stop bit"
475664-476181 dmx512: channel: "Channel 472"
475711-476087 dmx512: data: "0 / 0x0"
476181-476370 dmx512: interframe: "Interframe"
476370-476417 dmx512: startbit: "Start bit"
476417-476464 dmx512: bit: "0"
476464-476511 dmx512: bit: "0"
476511-476558 dmx512: bit: "0"
476558-476605 dmx512: bit: "0"
476605-476652 dmx512: bit: "0"
476652-476699 dmx512: bit: "0"
476699-476746 dmx512: bit: "0"
476746-476793 dmx512: bit: "0"
476793-476840 dmx512: stopbits: "Stop bit"
476840-476887 dmx512: stopbits: "Stop bit"
476370-476887 dmx512: channel: "Channel 473"
476417-476793 dmx512: data: "0 / 0x0"
476887-477076 dmx512: interframe: "Interframe"
477076-477123 dmx512: startbit: "Start bit"
477123-477170 dmx512: bit: "0"
477170-477217 dmx512: bit: "0"
477217-477264 dmx512: bit: "0"
477264-477311 dmx512: bit: "0"
477311-477358 dmx512: bit: "0"
477358-477405 dmx512: bit: "0"
477405-477452 dmx512: bit: "0"
477452-477499 dmx512: bit: "0"
477499-477546 dmx512: stopbits: "Stop bit"
477546-477593 dmx512: stopbits: "Stop bit"
477076-477593 dmx512: channel: "Channel 474"
477123-477499 dmx512: data: "0 / 0x0"
477593-477783 dmx512: interframe: "Interframe"
477783-477830 dmx512: startbit: "Start bit"
477830-477877 dmx512: bit: "0"
477877-477924 dmx512: bit: "0"
477924-477971 dmx512: bit: "0"
477971-478018 dmx512: bit: "0"
478018-478065 dmx512: bit: "0"
478065-478112 dmx512: bit: "0"
478112-478159 dmx512: bit: "0"
478159-478206 dmx512: bit: "0"
478206-478253 dmx512: stopbits: "Stop bit"
478253-478300 dmx512: stopbits: "Stop bit"
477783-478300 dmx512: channel: "Channel 475"
477830-478206 dmx512: data: "0 / 0x0"
478300-478489 dmx512: interframe: "Interframe"
478489-478536 dmx512: startbit: "Start bit"
478536-478583 dmx512: bit: "0"
478583-478630 dmx512: bit: "0"
478630-478677 dmx512: bit: "0"
478677-478724 dmx512: bit: "0"
478724-478771 dmx512: bit: "0"
478771-478818 dmx512: bit: "0"
478818-478865 dmx512: bit: "0"
478865-478912 dmx512: bit: "0"
478912-478959 dmx512: stopbits: "Stop bit"
478959-479006 dmx512: stopbits: "Stop bit"
478489-479006 dmx512: channel: "Channel 476"
478536-478912 dmx512: data: "0 / 0x0"
479006-479195 dmx512: interframe: "Interframe"
479195-479242 dmx512: startbit: "Start bit"
479242-479289 dmx512: bit: "0"
479289-479336 dmx512: bit: "0"
479336-479383 dmx512: bit: "0"
479383-479430 dmx512: bit: "0"
479430-479477 dmx512: bit: "0"
479477-479524 dmx512: bit: "0"
479524-479571 dmx512: bit: "0"
479571-479618 dmx512: bit: "0"
479618-479665 dmx512: stopbits: "Stop bit"
479665-479712 dmx512: stopbits: "Stop bit"
479195-479712 dmx512: channel: "Channel 477"
479242-479618 dmx512: data: "0 / 0x0"
479712-479901 dmx512: interframe: "Interframe"
479901-479948 dmx512: startbit: "Start bit"
479948-479995 dmx512: bit: "0"
479995-480042 dmx512: bit: "0"
480042-480089 dmx512: bit: "0"
480089-480136 dmx512: bit: "0"
480136-480183 dmx512: bit: "0"
480183-480230 dmx512: bit: "0"
480230-480277 dmx512: bit: "0"
480277-480324 dmx512: bit: "0"
480324-480371 dmx512: stopbits: "Stop bit"
480371-480418 dmx512: stopbits: "Stop bit"
479901-480418 dmx512: channel: "Channel 478"
479948-480324 dmx512: data: "0 / 0x0"
480418-480607 dmx512: interframe: "Interframe"
480607-480654 dmx512: startbit: "Start bit"
