4533-4536 dmx512: interpacket: "INTER PACKET" "IP"
4536-4585 dmx512: break: "BREAK" "B"
4585-4596 dmx512: mab: "MARK AFTER BREAK" "MAB"
4596-4616 dmx512: startcode: "STARTCODE 0" "START 0" "0"
4536-4616 dmx512: reset: "RESET SEQUENCE" "RESET" "R"
4616-4625 dmx512: interframe: "INTER FRAME" "IF"
4625-4645 dmx512: databyte: "DATABYTE 1: 255" "DATA 1: 255" "DATA 255" "255"
4625-4645 dmx512: chan_data: "CHANNEL 1: 255" "CH 1: 255" "CH 255" "255"
4645-4654 dmx512: interframe: "INTER FRAME" "IF"
4654-4674 dmx512: databyte: "DATABYTE 2: 255" "DATA 2: 255" "DATA 255" "255"
4654-4674 dmx512: chan_data: "CHANNEL 2: 255" "CH 2: 255" "CH 255" "255"
4674-4684 dmx512: interframe: "INTER FRAME" "IF"
4684-4704 dmx512: databyte: "DATABYTE 3: 0" "DATA 3: 0" "DATA 0" "0"
4704-4713 dmx512: interframe: "INTER FRAME" "IF"
4713-4733 dmx512: databyte: "DATABYTE 4: 0" "DATA 4: 0" "DATA 0" "0"
4733-4743 dmx512: interframe: "INTER FRAME" "IF"
4743-4763 dmx512: databyte: "DATABYTE 5: 0" "DATA 5: 0" "DATA 0" "0"
4763-4772 dmx512: interframe: "INTER FRAME" "IF"
4772-4792 dmx512: databyte: "DATABYTE 6: 0" "DATA 6: 0" "DATA 0" "0"
4792-4802 dmx512: interframe: "INTER FRAME" "IF"
4802-4822 dmx512: databyte: "DATABYTE 7: 0" "DATA 7: 0" "DATA 0" "0"
4822-4831 dmx512: interframe: "INTER FRAME" "IF"
4831-4851 dmx512: databyte: "DATABYTE 8: 0" "DATA 8: 0" "DATA 0" "0"
4851-4860 dmx512: interframe: "INTER FRAME" "IF"
4860-4880 dmx512: databyte: "DATABYTE 9: 0" "DATA 9: 0" "DATA 0" "0"
4880-4890 dmx512: interframe: "INTER FRAME" "IF"
4890-4910 dmx512: databyte: "DATABYTE 10: 0" "DATA 10: 0" "DATA 0" "0"
4910-4919 dmx512: interframe: "INTER FRAME" "IF"
4919-4939 dmx512: databyte: "DATABYTE 11: 0" "DATA 11: 0" "DATA 0" "0"
4939-4949 dmx512: interframe: "INTER FRAME" "IF"
4949-4969 dmx512: databyte: "DATABYTE 12: 0" "DATA 12: 0" "DATA 0" "0"
4969-4978 dmx512: interframe: "INTER FRAME" "IF"
4978-4998 dmx512: databyte: "DATABYTE 13: 0" "DATA 13: 0" "DATA 0" "0"
4998-5008 dmx512: interframe: "INTER FRAME" "IF"
5008-5028 dmx512: databyte: "DATABYTE 14: 0" "DATA 14: 0" "DATA 0" "0"
5028-5037 dmx512: interframe: "INTER FRAME" "IF"
5037-5057 dmx512: databyte: "DATABYTE 15: 0" "DATA 15: 0" "DATA 0" "0"
5057-5066 dmx512: interframe: "INTER FRAME" "IF"
5066-5086 dmx512: databyte: "DATABYTE 16: 0" "DATA 16: 0" "DATA 0" "0"
5086-5096 dmx512: interframe: "INTER FRAME" "IF"
5096-5116 dmx512: databyte: "DATABYTE 17: 0" "DATA 17: 0" "DATA 0" "0"
5116-5125 dmx512: interframe: "INTER FRAME" "IF"
5125-5145 dmx512: databyte: "DATABYTE 18: 0" "DATA 18: 0" "DATA 0" "0"
5145-5155 dmx512: interframe: "INTER FRAME" "IF"
5155-5175 dmx512: databyte: "DATABYTE 19: 0" "DATA 19: 0" "DATA 0" "0"
5175-5184 dmx512: interframe: "INTER FRAME" "IF"
5184-5204 dmx512: databyte: "DATABYTE 20: 0" "DATA 20: 0" "DATA 0" "0"
5204-5213 dmx512: interframe: "INTER FRAME" "IF"
5213-5233 dmx512: databyte: "DATABYTE 21: 0" "DATA 21: 0" "DATA 0" "0"
5233-5243 dmx512: interframe: "INTER FRAME" "IF"
5243-5263 dmx512: databyte: "DATABYTE 22: 0" "DATA 22: 0" "DATA 0" "0"
5263-5272 dmx512: interframe: "INTER FRAME" "IF"
5272-5292 dmx512: databyte: "DATABYTE 23: 0" "DATA 23: 0" "DATA 0" "0"
5292-5302 dmx512: interframe: "INTER FRAME" "IF"
5302-5322 dmx512: databyte: "DATABYTE 24: 0" "DATA 24: 0" "DATA 0" "0"
5322-5331 dmx512: interframe: "INTER FRAME" "IF"
5331-5351 dmx512: databyte: "DATABYTE 25: 0" "DATA 25: 0" "DATA 0" "0"
5351-5361 dmx512: interframe: "INTER FRAME" "IF"
5361-5381 dmx512: databyte: "DATABYTE 26: 0" "DATA 26: 0" "DATA 0" "0"
5381-5390 dmx512: interframe: "INTER FRAME" "IF"
5390-5410 dmx512: databyte: "DATABYTE 27: 0" "DATA 27: 0" "DATA 0" "0"
5410-5419 dmx512: interframe: "INTER FRAME" "IF"
5419-5439 dmx512: databyte: "DATABYTE 28: 0" "DATA 28: 0" "DATA 0" "0"
5439-5449 dmx512: interframe: "INTER FRAME" "IF"
5449-5469 dmx512: databyte: "DATABYTE 29: 0" "DATA 29: 0" "DATA 0" "0"
5469-5478 dmx512: interframe: "INTER FRAME" "IF"
5478-5498 dmx512: databyte: "DATABYTE 30: 0" "DATA 30: 0" "DATA 0" "0"
5498-5508 dmx512: interframe: "INTER FRAME" "IF"
5508-5528 dmx512: databyte: "DATABYTE 31: 0" "DATA 31: 0" "DATA 0" "0"
5528-5537 dmx512: interframe: "INTER FRAME" "IF"
5537-5557 dmx512: databyte: "DATABYTE 32: 0" "DATA 32: 0" "DATA 0" "0"
5557-5567 dmx512: interframe: "INTER FRAME" "IF"
5567-5587 dmx512: databyte: "DATABYTE 33: 0" "DATA 33: 0" "DATA 0" "0"
5587-5596 dmx512: interframe: "INTER FRAME" "IF"
5596-5616 dmx512: databyte: "DATABYTE 34: 0" "DATA 34: 0" "DATA 0" "0"
5616-5625 dmx512: interframe: "INTER FRAME" "IF"
5625-5645 dmx512: databyte: "DATABYTE 35: 0" "DATA 35: 0" "DATA 0" "0"
5645-5655 dmx512: interframe: "INTER FRAME" "IF"
5655-5675 dmx512: databyte: "DATABYTE 36: 0" "DATA 36: 0" "DATA 0" "0"
5675-5684 dmx512: interframe: "INTER FRAME" "IF"
5684-5704 dmx512: databyte: "DATABYTE 37: 0" "DATA 37: 0" "DATA 0" "0"
5704-5714 dmx512: interframe: "INTER FRAME" "IF"
5714-5734 dmx512: databyte: "DATABYTE 38: 0" "DATA 38: 0" "DATA 0" "0"
5734-5743 dmx512: interframe: "INTER FRAME" "IF"
5743-5763 dmx512: databyte: "DATABYTE 39: 0" "DATA 39: 0" "DATA 0" "0"
5763-5773 dmx512: interframe: "INTER FRAME" "IF"
5773-5793 dmx512: databyte: "DATABYTE 40: 0" "DATA 40: 0" "DATA 0" "0"
5793-5802 dmx512: interframe: "INTER FRAME" "IF"
5802-5822 dmx512: databyte: "DATABYTE 41: 0" "DATA 41: 0" "DATA 0" "0"
5822-5831 dmx512: interframe: "INTER FRAME" "IF"
5831-5851 dmx512: databyte: "DATABYTE 42: 0" "DATA 42: 0" "DATA 0" "0"
5851-5861 dmx512: interframe: "INTER FRAME" "IF"
5861-5881 dmx512: databyte: "DATABYTE 43: 0" "DATA 43: 0" "DATA 0" "0"
5881-5890 dmx512: interframe: "INTER FRAME" "IF"
5890-5910 dmx512: databyte: "DATABYTE 44: 0" "DATA 44: 0" "DATA 0" "0"
5910-5920 dmx512: interframe: "INTER FRAME" "IF"
5920-5940 dmx512: databyte: "DATABYTE 45: 0" "DATA 45: 0" "DATA 0" "0"
5940-5949 dmx512: interframe: "INTER FRAME" "IF"
5949-5969 dmx512: databyte: "DATABYTE 46: 0" "DATA 46: 0" "DATA 0" "0"
5969-5978 dmx512: interframe: "INTER FRAME" "IF"
5978-5998 dmx512: databyte: "DATABYTE 47: 0" "DATA 47: 0" "DATA 0" "0"
5998-6008 dmx512: interframe: "INTER FRAME" "IF"
6008-6028 dmx512: databyte: "DATABYTE 48: 0" "DATA 48: 0" "DATA 0" "0"
6028-6037 dmx512: interframe: "INTER FRAME" "IF"
6037-6057 dmx512: databyte: "DATABYTE 49: 0" "DATA 49: 0" "DATA 0" "0"
6057-6067 dmx512: interframe: "INTER FRAME" "IF"
6067-6087 dmx512: databyte: "DATABYTE 50: 0" "DATA 50: 0" "DATA 0" "0"
6087-6096 dmx512: interframe: "INTER FRAME" "IF"
6096-6116 dmx512: databyte: "DATABYTE 51: 0" "DATA 51: 0" "DATA 0" "0"
6116-6126 dmx512: interframe: "INTER FRAME" "IF"
6126-6146 dmx512: databyte: "DATABYTE 52: 0" "DATA 52: 0" "DATA 0" "0"
6146-6155 dmx512: interframe: "INTER FRAME" "IF"
6155-6175 dmx512: databyte: "DATABYTE 53: 0" "DATA 53: 0" "DATA 0" "0"
6175-6184 dmx512: interframe: "INTER FRAME" "IF"
6184-6204 dmx512: databyte: "DATABYTE 54: 0" "DATA 54: 0" "DATA 0" "0"
6204-6214 dmx512: interframe: "INTER FRAME" "IF"
6214-6234 dmx512: databyte: "DATABYTE 55: 0" "DATA 55: 0" "DATA 0" "0"
6234-6243 dmx512: interframe: "INTER FRAME" "IF"
6243-6263 dmx512: databyte: "DATABYTE 56: 0" "DATA 56: 0" "DATA 0" "0"
6263-6273 dmx512: interframe: "INTER FRAME" "IF"
6273-6293 dmx512: databyte: "DATABYTE 57: 0" "DATA 57: 0" "DATA 0" "0"
6293-6302 dmx512: interframe: "INTER FRAME" "IF"
6302-6322 dmx512: databyte: "DATABYTE 58: 0" "DATA 58: 0" "DATA 0" "0"
6322-6332 dmx512: interframe: "INTER FRAME" "IF"
6332-6352 dmx512: databyte: "DATABYTE 59: 0" "DATA 59: 0" "DATA 0" "0"
6352-6361 dmx512: interframe: "INTER FRAME" "IF"
6361-6381 dmx512: databyte: "DATABYTE 60: 0" "DATA 60: 0" "DATA 0" "0"
6381-6390 dmx512: interframe: "INTER FRAME" "IF"
6390-6410 dmx512: databyte: "DATABYTE 61: 0" "DATA 61: 0" "DATA 0" "0"
6410-6420 dmx512: interframe: "INTER FRAME" "IF"
6420-6440 dmx512: databyte: "DATABYTE 62: 0" "DATA 62: 0" "DATA 0" "0"
6440-6449 dmx512: interframe: "INTER FRAME" "IF"
6449-6469 dmx512: databyte: "DATABYTE 63: 0" "DATA 63: 0" "DATA 0" "0"
6469-6479 dmx512: interframe: "INTER FRAME" "IF"
6479-6499 dmx512: databyte: "DATABYTE 64: 0" "DATA 64: 0" "DATA 0" "0"
6499-6508 dmx512: interframe: "INTER FRAME" "IF"
6508-6528 dmx512: databyte: "DATABYTE 65: 0" "DATA 65: 0" "DATA 0" "0"
6528-6537 dmx512: interframe: "INTER FRAME" "IF"
6537-6557 dmx512: databyte: "DATABYTE 66: 0" "DATA 66: 0" "DATA 0" "0"
6557-6567 dmx512: interframe: "INTER FRAME" "IF"
6567-6587 dmx512: databyte: "DATABYTE 67: 0" "DATA 67: 0" "DATA 0" "0"
6587-6596 dmx512: interframe: "INTER FRAME" "IF"
6596-6616 dmx512: databyte: "DATABYTE 68: 0" "DATA 68: 0" "DATA 0" "0"
6616-6626 dmx512: interframe: "INTER FRAME" "IF"
6626-6646 dmx512: databyte: "DATABYTE 69: 0" "DATA 69: 0" "DATA 0" "0"
6646-6655 dmx512: interframe: "INTER FRAME" "IF"
6655-6675 dmx512: databyte: "DATABYTE 70: 0" "DATA 70: 0" "DATA 0" "0"
6675-6685 dmx512: interframe: "INTER FRAME" "IF"
6685-6705 dmx512: databyte: "DATABYTE 71: 0" "DATA 71: 0" "DATA 0" "0"
6705-6714 dmx512: interframe: "INTER FRAME" "IF"
6714-6734 dmx512: databyte: "DATABYTE 72: 0" "DATA 72: 0" "DATA 0" "0"
6734-6743 dmx512: interframe: "INTER FRAME" "IF"
6743-6763 dmx512: databyte: "DATABYTE 73: 0" "DATA 73: 0" "DATA 0" "0"
6763-6773 dmx512: interframe: "INTER FRAME" "IF"
6773-6793 dmx512: databyte: "DATABYTE 74: 0" "DATA 74: 0" "DATA 0" "0"
6793-6802 dmx512: interframe: "INTER FRAME" "IF"
6802-6822 dmx512: databyte: "DATABYTE 75: 0" "DATA 75: 0" "DATA 0" "0"
6822-6832 dmx512: interframe: "INTER FRAME" "IF"
6832-6852 dmx512: databyte: "DATABYTE 76: 0" "DATA 76: 0" "DATA 0" "0"
6852-6861 dmx512: interframe: "INTER FRAME" "IF"
6861-6881 dmx512: databyte: "DATABYTE 77: 0" "DATA 77: 0" "DATA 0" "0"
6881-6891 dmx512: interframe: "INTER FRAME" "IF"
6891-6911 dmx512: databyte: "DATABYTE 78: 0" "DATA 78: 0" "DATA 0" "0"
6911-6920 dmx512: interframe: "INTER FRAME" "IF"
6920-6940 dmx512: databyte: "DATABYTE 79: 0" "DATA 79: 0" "DATA 0" "0"
6940-6949 dmx512: interframe: "INTER FRAME" "IF"
6949-6969 dmx512: databyte: "DATABYTE 80: 0" "DATA 80: 0" "DATA 0" "0"
6969-6979 dmx512: interframe: "INTER FRAME" "IF"
6979-6999 dmx512: databyte: "DATABYTE 81: 0" "DATA 81: 0" "DATA 0" "0"
6999-7008 dmx512: interframe: "INTER FRAME" "IF"
7008-7028 dmx512: databyte: "DATABYTE 82: 0" "DATA 82: 0" "DATA 0" "0"
7028-7038 dmx512: interframe: "INTER FRAME" "IF"
7038-7058 dmx512: databyte: "DATABYTE 83: 0" "DATA 83: 0" "DATA 0" "0"
7058-7067 dmx512: interframe: "INTER FRAME" "IF"
7067-7087 dmx512: databyte: "DATABYTE 84: 0" "DATA 84: 0" "DATA 0" "0"
7087-7097 dmx512: interframe: "INTER FRAME" "IF"
7097-7117 dmx512: databyte: "DATABYTE 85: 0" "DATA 85: 0" "DATA 0" "0"
7117-7126 dmx512: interframe: "INTER FRAME" "IF"
7126-7146 dmx512: databyte: "DATABYTE 86: 0" "DATA 86: 0" "DATA 0" "0"
7146-7155 dmx512: interframe: "INTER FRAME" "IF"
7155-7175 dmx512: databyte: "DATABYTE 87: 0" "DATA 87: 0" "DATA 0" "0"
7175-7185 dmx512: interframe: "INTER FRAME" "IF"
7185-7205 dmx512: databyte: "DATABYTE 88: 0" "DATA 88: 0" "DATA 0" "0"
7205-7214 dmx512: interframe: "INTER FRAME" "IF"
7214-7234 dmx512: databyte: "DATABYTE 89: 0" "DATA 89: 0" "DATA 0" "0"
7234-7244 dmx512: interframe: "INTER FRAME" "IF"
7244-7264 dmx512: databyte: "DATABYTE 90: 0" "DATA 90: 0" "DATA 0" "0"
7264-7273 dmx512: interframe: "INTER FRAME" "IF"
7273-7293 dmx512: databyte: "DATABYTE 91: 0" "DATA 91: 0" "DATA 0" "0"
7293-7302 dmx512: interframe: "INTER FRAME" "IF"
7302-7322 dmx512: databyte: "DATABYTE 92: 0" "DATA 92: 0" "DATA 0" "0"
7322-7332 dmx512: interframe: "INTER FRAME" "IF"
7332-7352 dmx512: databyte: "DATABYTE 93: 0" "DATA 93: 0" "DATA 0" "0"
7352-7361 dmx512: interframe: "INTER FRAME" "IF"
7361-7381 dmx512: databyte: "DATABYTE 94: 0" "DATA 94: 0" "DATA 0" "0"
7381-7391 dmx512: interframe: "INTER FRAME" "IF"
7391-7411 dmx512: databyte: "DATABYTE 95: 0" "DATA 95: 0" "DATA 0" "0"
7411-7420 dmx512: interframe: "INTER FRAME" "IF"
7420-7440 dmx512: databyte: "DATABYTE 96: 0" "DATA 96: 0" "DATA 0" "0"
7440-7450 dmx512: interframe: "INTER FRAME" "IF"
7450-7470 dmx512: databyte: "DATABYTE 97: 0" "DATA 97: 0" "DATA 0" "0"
7470-7479 dmx512: interframe: "INTER FRAME" "IF"
7479-7499 dmx512: databyte: "DATABYTE 98: 0" "DATA 98: 0" "DATA 0" "0"
7499-7508 dmx512: interframe: "INTER FRAME" "IF"
7508-7528 dmx512: databyte: "DATABYTE 99: 0" "DATA 99: 0" "DATA 0" "0"
7528-7538 dmx512: interframe: "INTER FRAME" "IF"
7538-7558 dmx512: databyte: "DATABYTE 100: 0" "DATA 100: 0" "DATA 0" "0"
7558-7567 dmx512: interframe: "INTER FRAME" "IF"
7567-7587 dmx512: databyte: "DATABYTE 101: 255" "DATA 101: 255" "DATA 255" "255"
7567-7587 dmx512: chan_data: "CHANNEL 101: 255" "CH 101: 255" "CH 255" "255"
7587-7597 dmx512: interframe: "INTER FRAME" "IF"
7597-7617 dmx512: databyte: "DATABYTE 102: 255" "DATA 102: 255" "DATA 255" "255"
7597-7617 dmx512: chan_data: "CHANNEL 102: 255" "CH 102: 255" "CH 255" "255"
7617-7626 dmx512: interframe: "INTER FRAME" "IF"
7626-7646 dmx512: databyte: "DATABYTE 103: 0" "DATA 103: 0" "DATA 0" "0"
7646-7656 dmx512: interframe: "INTER FRAME" "IF"
7656-7676 dmx512: databyte: "DATABYTE 104: 0" "DATA 104: 0" "DATA 0" "0"
7676-7685 dmx512: interframe: "INTER FRAME" "IF"
7685-7705 dmx512: databyte: "DATABYTE 105: 0" "DATA 105: 0" "DATA 0" "0"
7705-7714 dmx512: interframe: "INTER FRAME" "IF"
7714-7734 dmx512: databyte: "DATABYTE 106: 0" "DATA 106: 0" "DATA 0" "0"
7734-7744 dmx512: interframe: "INTER FRAME" "IF"
7744-7764 dmx512: databyte: "DATABYTE 107: 0" "DATA 107: 0" "DATA 0" "0"
7764-7773 dmx512: interframe: "INTER FRAME" "IF"
7773-7793 dmx512: databyte: "DATABYTE 108: 0" "DATA 108: 0" "DATA 0" "0"
7793-7803 dmx512: interframe: "INTER FRAME" "IF"
7803-7823 dmx512: databyte: "DATABYTE 109: 0" "DATA 109: 0" "DATA 0" "0"
7823-7832 dmx512: interframe: "INTER FRAME" "IF"
7832-7852 dmx512: databyte: "DATABYTE 110: 0" "DATA 110: 0" "DATA 0" "0"
7852-7862 dmx512: interframe: "INTER FRAME" "IF"
7862-7882 dmx512: databyte: "DATABYTE 111: 0" "DATA 111: 0" "DATA 0" "0"
7882-7891 dmx512: interframe: "INTER FRAME" "IF"
7891-7911 dmx512: databyte: "DATABYTE 112: 0" "DATA 112: 0" "DATA 0" "0"
7911-7920 dmx512: interframe: "INTER FRAME" "IF"
7920-7940 dmx512: databyte: "DATABYTE 113: 0" "DATA 113: 0" "DATA 0" "0"
7940-7950 dmx512: interframe: "INTER FRAME" "IF"
7950-7970 dmx512: databyte: "DATABYTE 114: 0" "DATA 114: 0" "DATA 0" "0"
7970-7979 dmx512: interframe: "INTER FRAME" "IF"
7979-7999 dmx512: databyte: "DATABYTE 115: 0" "DATA 115: 0" "DATA 0" "0"
7999-8009 dmx512: interframe: "INTER FRAME" "IF"
8009-8029 dmx512: databyte: "DATABYTE 116: 0" "DATA 116: 0" "DATA 0" "0"
8029-8038 dmx512: interframe: "INTER FRAME" "IF"
8038-8058 dmx512: databyte: "DATABYTE 117: 0" "DATA 117: 0" "DATA 0" "0"
8058-8067 dmx512: interframe: "INTER FRAME" "IF"
8067-8087 dmx512: databyte: "DATABYTE 118: 0" "DATA 118: 0" "DATA 0" "0"
8087-8097 dmx512: interframe: "INTER FRAME" "IF"
8097-8117 dmx512: databyte: "DATABYTE 119: 0" "DATA 119: 0" "DATA 0" "0"
8117-8126 dmx512: interframe: "INTER FRAME" "IF"
8126-8146 dmx512: databyte: "DATABYTE 120: 0" "DATA 120: 0" "DATA 0" "0"
8146-8156 dmx512: interframe: "INTER FRAME" "IF"
8156-8176 dmx512: databyte: "DATABYTE 121: 0" "DATA 121: 0" "DATA 0" "0"
8176-8185 dmx512: interframe: "INTER FRAME" "IF"
8185-8205 dmx512: databyte: "DATABYTE 122: 0" "DATA 122: 0" "DATA 0" "0"
8205-8215 dmx512: interframe: "INTER FRAME" "IF"
8215-8235 dmx512: databyte: "DATABYTE 123: 0" "DATA 123: 0" "DATA 0" "0"
8235-8244 dmx512: interframe: "INTER FRAME" "IF"
8244-8264 dmx512: databyte: "DATABYTE 124: 0" "DATA 124: 0" "DATA 0" "0"
8264-8273 dmx512: interframe: "INTER FRAME" "IF"
8273-8293 dmx512: databyte: "DATABYTE 125: 0" "DATA 125: 0" "DATA 0" "0"
8293-8303 dmx512: interframe: "INTER FRAME" "IF"
8303-8323 dmx512: databyte: "DATABYTE 126: 0" "DATA 126: 0" "DATA 0" "0"
8323-8332 dmx512: interframe: "INTER FRAME" "IF"
8332-8352 dmx512: databyte: "DATABYTE 127: 0" "DATA 127: 0" "DATA 0" "0"
8352-8362 dmx512: interframe: "INTER FRAME" "IF"
8362-8382 dmx512: databyte: "DATABYTE 128: 0" "DATA 128: 0" "DATA 0" "0"
8382-8391 dmx512: interframe: "INTER FRAME" "IF"
8391-8411 dmx512: databyte: "DATABYTE 129: 0" "DATA 129: 0" "DATA 0" "0"
8411-8421 dmx512: interframe: "INTER FRAME" "IF"
8421-8441 dmx512: databyte: "DATABYTE 130: 0" "DATA 130: 0" "DATA 0" "0"
8441-8450 dmx512: interframe: "INTER FRAME" "IF"
8450-8470 dmx512: databyte: "DATABYTE 131: 0" "DATA 131: 0" "DATA 0" "0"
8470-8479 dmx512: interframe: "INTER FRAME" "IF"
8479-8499 dmx512: databyte: "DATABYTE 132: 0" "DATA 132: 0" "DATA 0" "0"
8499-8509 dmx512: interframe: "INTER FRAME" "IF"
8509-8529 dmx512: databyte: "DATABYTE 133: 0" "DATA 133: 0" "DATA 0" "0"
8529-8538 dmx512: interframe: "INTER FRAME" "IF"
8538-8558 dmx512: databyte: "DATABYTE 134: 0" "DATA 134: 0" "DATA 0" "0"
8558-8568 dmx512: interframe: "INTER FRAME" "IF"
8568-8588 dmx512: databyte: "DATABYTE 135: 0" "DATA 135: 0" "DATA 0" "0"
8588-8597 dmx512: interframe: "INTER FRAME" "IF"
8597-8617 dmx512: databyte: "DATABYTE 136: 0" "DATA 136: 0" "DATA 0" "0"
8617-8626 dmx512: interframe: "INTER FRAME" "IF"
8626-8646 dmx512: databyte: "DATABYTE 137: 0" "DATA 137: 0" "DATA 0" "0"
8646-8656 dmx512: interframe: "INTER FRAME" "IF"
8656-8676 dmx512: databyte: "DATABYTE 138: 0" "DATA 138: 0" "DATA 0" "0"
8676-8685 dmx512: interframe: "INTER FRAME" "IF"
8685-8705 dmx512: databyte: "DATABYTE 139: 0" "DATA 139: 0" "DATA 0" "0"
8705-8715 dmx512: interframe: "INTER FRAME" "IF"
8715-8735 dmx512: databyte: "DATABYTE 140: 0" "DATA 140: 0" "DATA 0" "0"
8735-8744 dmx512: interframe: "INTER FRAME" "IF"
8744-8764 dmx512: databyte: "DATABYTE 141: 0" "DATA 141: 0" "DATA 0" "0"
8764-8774 dmx512: interframe: "INTER FRAME" "IF"
8774-8794 dmx512: databyte: "DATABYTE 142: 0" "DATA 142: 0" "DATA 0" "0"
8794-8803 dmx512: interframe: "INTER FRAME" "IF"
8803-8823 dmx512: databyte: "DATABYTE 143: 0" "DATA 143: 0" "DATA 0" "0"
8823-8832 dmx512: interframe: "INTER FRAME" "IF"
8832-8852 dmx512: databyte: "DATABYTE 144: 0" "DATA 144: 0" "DATA 0" "0"
8852-8862 dmx512: interframe: "INTER FRAME" "IF"
8862-8882 dmx512: databyte: "DATABYTE 145: 0" "DATA 145: 0" "DATA 0" "0"
8882-8891 dmx512: interframe: "INTER FRAME" "IF"
8891-8911 dmx512: databyte: "DATABYTE 146: 0" "DATA 146: 0" "DATA 0" "0"
8911-8921 dmx512: interframe: "INTER FRAME" "IF"
8921-8941 dmx512: databyte: "DATABYTE 147: 0" "DATA 147: 0" "DATA 0" "0"
8941-8950 dmx512: interframe: "INTER FRAME" "IF"
8950-8970 dmx512: databyte: "DATABYTE 148: 0" "DATA 148: 0" "DATA 0" "0"
8970-8980 dmx512: interframe: "INTER FRAME" "IF"
8980-9000 dmx512: databyte: "DATABYTE 149: 0" "DATA 149: 0" "DATA 0" "0"
9000-9009 dmx512: interframe: "INTER FRAME" "IF"
9009-9029 dmx512: databyte: "DATABYTE 150: 0" "DATA 150: 0" "DATA 0" "0"
9029-9038 dmx512: interframe: "INTER FRAME" "IF"
9038-9058 dmx512: databyte: "DATABYTE 151: 0" "DATA 151: 0" "DATA 0" "0"
9058-9068 dmx512: interframe: "INTER FRAME" "IF"
9068-9088 dmx512: databyte: "DATABYTE 152: 0" "DATA 152: 0" "DATA 0" "0"
9088-9097 dmx512: interframe: "INTER FRAME" "IF"
9097-9117 dmx512: databyte: "DATABYTE 153: 0" "DATA 153: 0" "DATA 0" "0"
9117-9127 dmx512: interframe: "INTER FRAME" "IF"
9127-9147 dmx512: databyte: "DATABYTE 154: 0" "DATA 154: 0" "DATA 0" "0"
9147-9156 dmx512: interframe: "INTER FRAME" "IF"
9156-9176 dmx512: databyte: "DATABYTE 155: 0" "DATA 155: 0" "DATA 0" "0"
9176-9186 dmx512: interframe: "INTER FRAME" "IF"
9186-9206 dmx512: databyte: "DATABYTE 156: 0" "DATA 156: 0" "DATA 0" "0"
9206-9215 dmx512: interframe: "INTER FRAME" "IF"
9215-9235 dmx512: databyte: "DATABYTE 157: 0" "DATA 157: 0" "DATA 0" "0"
9235-9244 dmx512: interframe: "INTER FRAME" "IF"
9244-9264 dmx512: databyte: "DATABYTE 158: 0" "DATA 158: 0" "DATA 0" "0"
9264-9274 dmx512: interframe: "INTER FRAME" "IF"
9274-9294 dmx512: databyte: "DATABYTE 159: 0" "DATA 159: 0" "DATA 0" "0"
9294-9303 dmx512: interframe: "INTER FRAME" "IF"
9303-9323 dmx512: databyte: "DATABYTE 160: 0" "DATA 160: 0" "DATA 0" "0"
9323-9333 dmx512: interframe: "INTER FRAME" "IF"
9333-9353 dmx512: databyte: "DATABYTE 161: 0" "DATA 161: 0" "DATA 0" "0"
9353-9362 dmx512: interframe: "INTER FRAME" "IF"
9362-9382 dmx512: databyte: "DATABYTE 162: 0" "DATA 162: 0" "DATA 0" "0"
9382-9391 dmx512: interframe: "INTER FRAME" "IF"
9391-9411 dmx512: databyte: "DATABYTE 163: 0" "DATA 163: 0" "DATA 0" "0"
9411-9421 dmx512: interframe: "INTER FRAME" "IF"
9421-9441 dmx512: databyte: "DATABYTE 164: 0" "DATA 164: 0" "DATA 0" "0"
9441-9450 dmx512: interframe: "INTER FRAME" "IF"
9450-9470 dmx512: databyte: "DATABYTE 165: 0" "DATA 165: 0" "DATA 0" "0"
9470-9480 dmx512: interframe: "INTER FRAME" "IF"
9480-9500 dmx512: databyte: "DATABYTE 166: 0" "DATA 166: 0" "DATA 0" "0"
9500-9509 dmx512: interframe: "INTER FRAME" "IF"
9509-9529 dmx512: databyte: "DATABYTE 167: 0" "DATA 167: 0" "DATA 0" "0"
9529-9539 dmx512: interframe: "INTER FRAME" "IF"
9539-9559 dmx512: databyte: "DATABYTE 168: 0" "DATA 168: 0" "DATA 0" "0"
9559-9568 dmx512: interframe: "INTER FRAME" "IF"
9568-9588 dmx512: databyte: "DATABYTE 169: 0" "DATA 169: 0" "DATA 0" "0"
9588-9597 dmx512: interframe: "INTER FRAME" "IF"
9597-9617 dmx512: databyte: "DATABYTE 170: 0" "DATA 170: 0" "DATA 0" "0"
9617-9627 dmx512: interframe: "INTER FRAME" "IF"
9627-9647 dmx512: databyte: "DATABYTE 171: 0" "DATA 171: 0" "DATA 0" "0"
9647-9656 dmx512: interframe: "INTER FRAME" "IF"
9656-9676 dmx512: databyte: "DATABYTE 172: 0" "DATA 172: 0" "DATA 0" "0"
9676-9686 dmx512: interframe: "INTER FRAME" "IF"
9686-9706 dmx512: databyte: "DATABYTE 173: 0" "DATA 173: 0" "DATA 0" "0"
9706-9715 dmx512: interframe: "INTER FRAME" "IF"
9715-9735 dmx512: databyte: "DATABYTE 174: 0" "DATA 174: 0" "DATA 0" "0"
9735-9745 dmx512: interframe: "INTER FRAME" "IF"
9745-9765 dmx512: databyte: "DATABYTE 175: 0" "DATA 175: 0" "DATA 0" "0"
9765-9774 dmx512: interframe: "INTER FRAME" "IF"
9774-9794 dmx512: databyte: "DATABYTE 176: 0" "DATA 176: 0" "DATA 0" "0"
9794-9803 dmx512: interframe: "INTER FRAME" "IF"
9803-9823 dmx512: databyte: "DATABYTE 177: 0" "DATA 177: 0" "DATA 0" "0"
9823-9833 dmx512: interframe: "INTER FRAME" "IF"
9833-9853 dmx512: databyte: "DATABYTE 178: 0" "DATA 178: 0" "DATA 0" "0"
9853-9862 dmx512: interframe: "INTER FRAME" "IF"
9862-9882 dmx512: databyte: "DATABYTE 179: 0" "DATA 179: 0" "DATA 0" "0"
9882-9892 dmx512: interframe: "INTER FRAME" "IF"
9892-9912 dmx512: databyte: "DATABYTE 180: 0" "DATA 180: 0" "DATA 0" "0"
9912-9921 dmx512: interframe: "INTER FRAME" "IF"
9921-9941 dmx512: databyte: "DATABYTE 181: 0" "DATA 181: 0" "DATA 0" "0"
9941-9951 dmx512: interframe: "INTER FRAME" "IF"
9951-9971 dmx512: databyte: "DATABYTE 182: 0" "DATA 182: 0" "DATA 0" "0"
9971-9980 dmx512: interframe: "INTER FRAME" "IF"
9980-10000 dmx512: databyte: "DATABYTE 183: 0" "DATA 183: 0" "DATA 0" "0"
10000-10009 dmx512: interframe: "INTER FRAME" "IF"
10009-10029 dmx512: databyte: "DATABYTE 184: 0" "DATA 184: 0" "DATA 0" "0"
10029-10039 dmx512: interframe: "INTER FRAME" "IF"
10039-10059 dmx512: databyte: "DATABYTE 185: 0" "DATA 185: 0" "DATA 0" "0"
10059-10068 dmx512: interframe: "INTER FRAME" "IF"
10068-10088 dmx512: databyte: "DATABYTE 186: 0" "DATA 186: 0" "DATA 0" "0"
10088-10098 dmx512: interframe: "INTER FRAME" "IF"
10098-10118 dmx512: databyte: "DATABYTE 187: 0" "DATA 187: 0" "DATA 0" "0"
10118-10127 dmx512: interframe: "INTER FRAME" "IF"
10127-10147 dmx512: databyte: "DATABYTE 188: 0" "DATA 188: 0" "DATA 0" "0"
10147-10156 dmx512: interframe: "INTER FRAME" "IF"
10156-10176 dmx512: databyte: "DATABYTE 189: 0" "DATA 189: 0" "DATA 0" "0"
10176-10186 dmx512: interframe: "INTER FRAME" "IF"
10186-10206 dmx512: databyte: "DATABYTE 190: 0" "DATA 190: 0" "DATA 0" "0"
10206-10215 dmx512: interframe: "INTER FRAME" "IF"
10215-10235 dmx512: databyte: "DATABYTE 191: 0" "DATA 191: 0" "DATA 0" "0"
10235-10245 dmx512: interframe: "INTER FRAME" "IF"
10245-10265 dmx512: databyte: "DATABYTE 192: 0" "DATA 192: 0" "DATA 0" "0"
10265-10274 dmx512: interframe: "INTER FRAME" "IF"
10274-10294 dmx512: databyte: "DATABYTE 193: 0" "DATA 193: 0" "DATA 0" "0"
10294-10304 dmx512: interframe: "INTER FRAME" "IF"
10304-10324 dmx512: databyte: "DATABYTE 194: 0" "DATA 194: 0" "DATA 0" "0"
10324-10333 dmx512: interframe: "INTER FRAME" "IF"
10333-10353 dmx512: databyte: "DATABYTE 195: 0" "DATA 195: 0" "DATA 0" "0"
10353-10362 dmx512: interframe: "INTER FRAME" "IF"
10362-10382 dmx512: databyte: "DATABYTE 196: 0" "DATA 196: 0" "DATA 0" "0"
10382-10392 dmx512: interframe: "INTER FRAME" "IF"
10392-10412 dmx512: databyte: "DATABYTE 197: 0" "DATA 197: 0" "DATA 0" "0"
10412-10421 dmx512: interframe: "INTER FRAME" "IF"
10421-10441 dmx512: databyte: "DATABYTE 198: 0" "DATA 198: 0" "DATA 0" "0"
10441-10451 dmx512: interframe: "INTER FRAME" "IF"
10451-10471 dmx512: databyte: "DATABYTE 199: 0" "DATA 199: 0" "DATA 0" "0"
10471-10480 dmx512: interframe: "INTER FRAME" "IF"
10480-10500 dmx512: databyte: "DATABYTE 200: 0" "DATA 200: 0" "DATA 0" "0"
10500-10510 dmx512: interframe: "INTER FRAME" "IF"
10510-10530 dmx512: databyte: "DATABYTE 201: 255" "DATA 201: 255" "DATA 255" "255"
10510-10530 dmx512: chan_data: "CHANNEL 201: 255" "CH 201: 255" "CH 255" "255"
10530-10539 dmx512: interframe: "INTER FRAME" "IF"
10539-10559 dmx512: databyte: "DATABYTE 202: 255" "DATA 202: 255" "DATA 255" "255"
10539-10559 dmx512: chan_data: "CHANNEL 202: 255" "CH 202: 255" "CH 255" "255"
10559-10568 dmx512: interframe: "INTER FRAME" "IF"
10568-10588 dmx512: databyte: "DATABYTE 203: 0" "DATA 203: 0" "DATA 0" "0"
10588-10598 dmx512: interframe: "INTER FRAME" "IF"
10598-10618 dmx512: databyte: "DATABYTE 204: 0" "DATA 204: 0" "DATA 0" "0"
10618-10627 dmx512: interframe: "INTER FRAME" "IF"
10627-10647 dmx512: databyte: "DATABYTE 205: 0" "DATA 205: 0" "DATA 0" "0"
10647-10657 dmx512: interframe: "INTER FRAME" "IF"
10657-10677 dmx512: databyte: "DATABYTE 206: 0" "DATA 206: 0" "DATA 0" "0"
10677-10686 dmx512: interframe: "INTER FRAME" "IF"
10686-10706 dmx512: databyte: "DATABYTE 207: 0" "DATA 207: 0" "DATA 0" "0"
10706-10716 dmx512: interframe: "INTER FRAME" "IF"
10716-10736 dmx512: databyte: "DATABYTE 208: 0" "DATA 208: 0" "DATA 0" "0"
10736-10745 dmx512: interframe: "INTER FRAME" "IF"
10745-10765 dmx512: databyte: "DATABYTE 209: 0" "DATA 209: 0" "DATA 0" "0"
10765-10774 dmx512: interframe: "INTER FRAME" "IF"
10774-10794 dmx512: databyte: "DATABYTE 210: 0" "DATA 210: 0" "DATA 0" "0"
10794-10804 dmx512: interframe: "INTER FRAME" "IF"
10804-10824 dmx512: databyte: "DATABYTE 211: 0" "DATA 211: 0" "DATA 0" "0"
10824-10833 dmx512: interframe: "INTER FRAME" "IF"
10833-10853 dmx512: databyte: "DATABYTE 212: 0" "DATA 212: 0" "DATA 0" "0"
10853-10863 dmx512: interframe: "INTER FRAME" "IF"
10863-10883 dmx512: databyte: "DATABYTE 213: 0" "DATA 213: 0" "DATA 0" "0"
10883-10892 dmx512: interframe: "INTER FRAME" "IF"
10892-10912 dmx512: databyte: "DATABYTE 214: 0" "DATA 214: 0" "DATA 0" "0"
10912-10921 dmx512: interframe: "INTER FRAME" "IF"
10921-10941 dmx512: databyte: "DATABYTE 215: 0" "DATA 215: 0" "DATA 0" "0"
10941-10951 dmx512: interframe: "INTER FRAME" "IF"
10951-10971 dmx512: databyte: "DATABYTE 216: 0" "DATA 216: 0" "DATA 0" "0"
10971-10980 dmx512: interframe: "INTER FRAME" "IF"
10980-11000 dmx512: databyte: "DATABYTE 217: 0" "DATA 217: 0" "DATA 0" "0"
11000-11010 dmx512: interframe: "INTER FRAME" "IF"
11010-11030 dmx512: databyte: "DATABYTE 218: 0" "DATA 218: 0" "DATA 0" "0"
11030-11039 dmx512: interframe: "INTER FRAME" "IF"
11039-11059 dmx512: databyte: "DATABYTE 219: 0" "DATA 219: 0" "DATA 0" "0"
11059-11069 dmx512: interframe: "INTER FRAME" "IF"
11069-11089 dmx512: databyte: "DATABYTE 220: 0" "DATA 220: 0" "DATA 0" "0"
11089-11098 dmx512: interframe: "INTER FRAME" "IF"
11098-11118 dmx512: databyte: "DATABYTE 221: 0" "DATA 221: 0" "DATA 0" "0"
11118-11127 dmx512: interframe: "INTER FRAME" "IF"
11127-11147 dmx512: databyte: "DATABYTE 222: 0" "DATA 222: 0" "DATA 0" "0"
11147-11157 dmx512: interframe: "INTER FRAME" "IF"
11157-11177 dmx512: databyte: "DATABYTE 223: 0" "DATA 223: 0" "DATA 0" "0"
11177-11186 dmx512: interframe: "INTER FRAME" "IF"
11186-11206 dmx512: databyte: "DATABYTE 224: 0" "DATA 224: 0" "DATA 0" "0"
11206-11216 dmx512: interframe: "INTER FRAME" "IF"
11216-11236 dmx512: databyte: "DATABYTE 225: 0" "DATA 225: 0" "DATA 0" "0"
11236-11245 dmx512: interframe: "INTER FRAME" "IF"
11245-11265 dmx512: databyte: "DATABYTE 226: 0" "DATA 226: 0" "DATA 0" "0"
11265-11275 dmx512: interframe: "INTER FRAME" "IF"
11275-11295 dmx512: databyte: "DATABYTE 227: 0" "DATA 227: 0" "DATA 0" "0"
11295-11304 dmx512: interframe: "INTER FRAME" "IF"
11304-11324 dmx512: databyte: "DATABYTE 228: 0" "DATA 228: 0" "DATA 0" "0"
11324-11333 dmx512: interframe: "INTER FRAME" "IF"
11333-11353 dmx512: databyte: "DATABYTE 229: 0" "DATA 229: 0" "DATA 0" "0"
11353-11363 dmx512: interframe: "INTER FRAME" "IF"
11363-11383 dmx512: databyte: "DATABYTE 230: 0" "DATA 230: 0" "DATA 0" "0"
11383-11392 dmx512: interframe: "INTER FRAME" "IF"
11392-11412 dmx512: databyte: "DATABYTE 231: 0" "DATA 231: 0" "DATA 0" "0"
11412-11422 dmx512: interframe: "INTER FRAME" "IF"
11422-11442 dmx512: databyte: "DATABYTE 232: 0" "DATA 232: 0" "DATA 0" "0"
11442-11451 dmx512: interframe: "INTER FRAME" "IF"
11451-11471 dmx512: databyte: "DATABYTE 233: 0" "DATA 233: 0" "DATA 0" "0"
11471-11480 dmx512: interframe: "INTER FRAME" "IF"
11480-11500 dmx512: databyte: "DATABYTE 234: 0" "DATA 234: 0" "DATA 0" "0"
11500-11510 dmx512: interframe: "INTER FRAME" "IF"
11510-11530 dmx512: databyte: "DATABYTE 235: 0" "DATA 235: 0" "DATA 0" "0"
11530-11539 dmx512: interframe: "INTER FRAME" "IF"
11539-11559 dmx512: databyte: "DATABYTE 236: 0" "DATA 236: 0" "DATA 0" "0"
11559-11569 dmx512: interframe: "INTER FRAME" "IF"
11569-11589 dmx512: databyte: "DATABYTE 237: 0" "DATA 237: 0" "DATA 0" "0"
11589-11598 dmx512: interframe: "INTER FRAME" "IF"
11598-11618 dmx512: databyte: "DATABYTE 238: 0" "DATA 238: 0" "DATA 0" "0"
11618-11628 dmx512: interframe: "INTER FRAME" "IF"
11628-11648 dmx512: databyte: "DATABYTE 239: 0" "DATA 239: 0" "DATA 0" "0"
11648-11657 dmx512: interframe: "INTER FRAME" "IF"
11657-11677 dmx512: databyte: "DATABYTE 240: 0" "DATA 240: 0" "DATA 0" "0"
11677-11686 dmx512: interframe: "INTER FRAME" "IF"
11686-11706 dmx512: databyte: "DATABYTE 241: 0" "DATA 241: 0" "DATA 0" "0"
11706-11716 dmx512: interframe: "INTER FRAME" "IF"
11716-11736 dmx512: databyte: "DATABYTE 242: 0" "DATA 242: 0" "DATA 0" "0"
11736-11745 dmx512: interframe: "INTER FRAME" "IF"
11745-11765 dmx512: databyte: "DATABYTE 243: 0" "DATA 243: 0" "DATA 0" "0"
11765-11775 dmx512: interframe: "INTER FRAME" "IF"
11775-11795 dmx512: databyte: "DATABYTE 244: 0" "DATA 244: 0" "DATA 0" "0"
11795-11804 dmx512: interframe: "INTER FRAME" "IF"
11804-11824 dmx512: databyte: "DATABYTE 245: 0" "DATA 245: 0" "DATA 0" "0"
11824-11834 dmx512: interframe: "INTER FRAME" "IF"
11834-11854 dmx512: databyte: "DATABYTE 246: 0" "DATA 246: 0" "DATA 0" "0"
11854-11863 dmx512: interframe: "INTER FRAME" "IF"
11863-11883 dmx512: databyte: "DATABYTE 247: 0" "DATA 247: 0" "DATA 0" "0"
11883-11892 dmx512: interframe: "INTER FRAME" "IF"
11892-11912 dmx512: databyte: "DATABYTE 248: 0" "DATA 248: 0" "DATA 0" "0"
11912-11922 dmx512: interframe: "INTER FRAME" "IF"
11922-11942 dmx512: databyte: "DATABYTE 249: 0" "DATA 249: 0" "DATA 0" "0"
11942-11951 dmx512: interframe: "INTER FRAME" "IF"
11951-11971 dmx512: databyte: "DATABYTE 250: 0" "DATA 250: 0" "DATA 0" "0"
11971-11981 dmx512: interframe: "INTER FRAME" "IF"
11981-12001 dmx512: databyte: "DATABYTE 251: 0" "DATA 251: 0" "DATA 0" "0"
12001-12010 dmx512: interframe: "INTER FRAME" "IF"
12010-12030 dmx512: databyte: "DATABYTE 252: 0" "DATA 252: 0" "DATA 0" "0"
12030-12040 dmx512: interframe: "INTER FRAME" "IF"
12040-12060 dmx512: databyte: "DATABYTE 253: 0" "DATA 253: 0" "DATA 0" "0"
12060-12069 dmx512: interframe: "INTER FRAME" "IF"
12069-12089 dmx512: databyte: "DATABYTE 254: 0" "DATA 254: 0" "DATA 0" "0"
12089-12098 dmx512: interframe: "INTER FRAME" "IF"
12098-12118 dmx512: databyte: "DATABYTE 255: 0" "DATA 255: 0" "DATA 0" "0"
12118-12128 dmx512: interframe: "INTER FRAME" "IF"
12128-12148 dmx512: databyte: "DATABYTE 256: 0" "DATA 256: 0" "DATA 0" "0"
12148-12157 dmx512: interframe: "INTER FRAME" "IF"
12157-12177 dmx512: databyte: "DATABYTE 257: 0" "DATA 257: 0" "DATA 0" "0"
12177-12187 dmx512: interframe: "INTER FRAME" "IF"
12187-12207 dmx512: databyte: "DATABYTE 258: 0" "DATA 258: 0" "DATA 0" "0"
12207-12216 dmx512: interframe: "INTER FRAME" "IF"
12216-12236 dmx512: databyte: "DATABYTE 259: 0" "DATA 259: 0" "DATA 0" "0"
12236-12245 dmx512: interframe: "INTER FRAME" "IF"
12245-12265 dmx512: databyte: "DATABYTE 260: 0" "DATA 260: 0" "DATA 0" "0"
12265-12275 dmx512: interframe: "INTER FRAME" "IF"
12275-12295 dmx512: databyte: "DATABYTE 261: 0" "DATA 261: 0" "DATA 0" "0"
12295-12304 dmx512: interframe: "INTER FRAME" "IF"
12304-12324 dmx512: databyte: "DATABYTE 262: 0" "DATA 262: 0" "DATA 0" "0"
12324-12334 dmx512: interframe: "INTER FRAME" "IF"
12334-12354 dmx512: databyte: "DATABYTE 263: 0" "DATA 263: 0" "DATA 0" "0"
12354-12363 dmx512: interframe: "INTER FRAME" "IF"
12363-12383 dmx512: databyte: "DATABYTE 264: 0" "DATA 264: 0" "DATA 0" "0"
12383-12393 dmx512: interframe: "INTER FRAME" "IF"
12393-12413 dmx512: databyte: "DATABYTE 265: 0" "DATA 265: 0" "DATA 0" "0"
12413-12422 dmx512: interframe: "INTER FRAME" "IF"
12422-12442 dmx512: databyte: "DATABYTE 266: 0" "DATA 266: 0" "DATA 0" "0"
12442-12451 dmx512: interframe: "INTER FRAME" "IF"
12451-12471 dmx512: databyte: "DATABYTE 267: 0" "DATA 267: 0" "DATA 0" "0"
12471-12481 dmx512: interframe: "INTER FRAME" "IF"
12481-12501 dmx512: databyte: "DATABYTE 268: 0" "DATA 268: 0" "DATA 0" "0"
12501-12510 dmx512: interframe: "INTER FRAME" "IF"
12510-12530 dmx512: databyte: "DATABYTE 269: 0" "DATA 269: 0" "DATA 0" "0"
12530-12540 dmx512: interframe: "INTER FRAME" "IF"
12540-12560 dmx512: databyte: "DATABYTE 270: 0" "DATA 270: 0" "DATA 0" "0"
12560-12569 dmx512: interframe: "INTER FRAME" "IF"
12569-12589 dmx512: databyte: "DATABYTE 271: 0" "DATA 271: 0" "DATA 0" "0"
12589-12599 dmx512: interframe: "INTER FRAME" "IF"
12599-12619 dmx512: databyte: "DATABYTE 272: 0" "DATA 272: 0" "DATA 0" "0"
12619-12628 dmx512: interframe: "INTER FRAME" "IF"
12628-12648 dmx512: databyte: "DATABYTE 273: 0" "DATA 273: 0" "DATA 0" "0"
12648-12657 dmx512: interframe: "INTER FRAME" "IF"
12657-12677 dmx512: databyte: "DATABYTE 274: 0" "DATA 274: 0" "DATA 0" "0"
12677-12687 dmx512: interframe: "INTER FRAME" "IF"
12687-12707 dmx512: databyte: "DATABYTE 275: 0" "DATA 275: 0" "DATA 0" "0"
12707-12716 dmx512: interframe: "INTER FRAME" "IF"
12716-12736 dmx512: databyte: "DATABYTE 276: 0" "DATA 276: 0" "DATA 0" "0"
12736-12746 dmx512: interframe: "INTER FRAME" "IF"
12746-12766 dmx512: databyte: "DATABYTE 277: 0" "DATA 277: 0" "DATA 0" "0"
12766-12775 dmx512: interframe: "INTER FRAME" "IF"
12775-12795 dmx512: databyte: "DATABYTE 278: 0" "DATA 278: 0" "DATA 0" "0"
12795-12805 dmx512: interframe: "INTER FRAME" "IF"
12805-12825 dmx512: databyte: "DATABYTE 279: 0" "DATA 279: 0" "DATA 0" "0"
12825-12834 dmx512: interframe: "INTER FRAME" "IF"
12834-12854 dmx512: databyte: "DATABYTE 280: 0" "DATA 280: 0" "DATA 0" "0"
12854-12863 dmx512: interframe: "INTER FRAME" "IF"
12863-12883 dmx512: databyte: "DATABYTE 281: 0" "DATA 281: 0" "DATA 0" "0"
12883-12893 dmx512: interframe: "INTER FRAME" "IF"
12893-12913 dmx512: databyte: "DATABYTE 282: 0" "DATA 282: 0" "DATA 0" "0"
12913-12922 dmx512: interframe: "INTER FRAME" "IF"
12922-12942 dmx512: databyte: "DATABYTE 283: 0" "DATA 283: 0" "DATA 0" "0"
12942-12952 dmx512: interframe: "INTER FRAME" "IF"
12952-12972 dmx512: databyte: "DATABYTE 284: 0" "DATA 284: 0" "DATA 0" "0"
12972-12981 dmx512: interframe: "INTER FRAME" "IF"
12981-13001 dmx512: databyte: "DATABYTE 285: 0" "DATA 285: 0" "DATA 0" "0"
13001-13010 dmx512: interframe: "INTER FRAME" "IF"
13010-13030 dmx512: databyte: "DATABYTE 286: 0" "DATA 286: 0" "DATA 0" "0"
13030-13040 dmx512: interframe: "INTER FRAME" "IF"
13040-13060 dmx512: databyte: "DATABYTE 287: 0" "DATA 287: 0" "DATA 0" "0"
13060-13069 dmx512: interframe: "INTER FRAME" "IF"
13069-13089 dmx512: databyte: "DATABYTE 288: 0" "DATA 288: 0" "DATA 0" "0"
13089-13099 dmx512: interframe: "INTER FRAME" "IF"
13099-13119 dmx512: databyte: "DATABYTE 289: 0" "DATA 289: 0" "DATA 0" "0"
13119-13128 dmx512: interframe: "INTER FRAME" "IF"
13128-13148 dmx512: databyte: "DATABYTE 290: 0" "DATA 290: 0" "DATA 0" "0"
13148-13158 dmx512: interframe: "INTER FRAME" "IF"
13158-13178 dmx512: databyte: "DATABYTE 291: 0" "DATA 291: 0" "DATA 0" "0"
13178-13187 dmx512: interframe: "INTER FRAME" "IF"
13187-13207 dmx512: databyte: "DATABYTE 292: 0" "DATA 292: 0" "DATA 0" "0"
13207-13216 dmx512: interframe: "INTER FRAME" "IF"
13216-13236 dmx512: databyte: "DATABYTE 293: 0" "DATA 293: 0" "DATA 0" "0"
13236-13246 dmx512: interframe: "INTER FRAME" "IF"
13246-13266 dmx512: databyte: "DATABYTE 294: 0" "DATA 294: 0" "DATA 0" "0"
13266-13275 dmx512: interframe: "INTER FRAME" "IF"
13275-13295 dmx512: databyte: "DATABYTE 295: 0" "DATA 295: 0" "DATA 0" "0"
13295-13305 dmx512: interframe: "INTER FRAME" "IF"
13305-13325 dmx512: databyte: "DATABYTE 296: 0" "DATA 296: 0" "DATA 0" "0"
13325-13334 dmx512: interframe: "INTER FRAME" "IF"
13334-13354 dmx512: databyte: "DATABYTE 297: 0" "DATA 297: 0" "DATA 0" "0"
13354-13364 dmx512: interframe: "INTER FRAME" "IF"
13364-13384 dmx512: databyte: "DATABYTE 298: 0" "DATA 298: 0" "DATA 0" "0"
13384-13393 dmx512: interframe: "INTER FRAME" "IF"
13393-13413 dmx512: databyte: "DATABYTE 299: 0" "DATA 299: 0" "DATA 0" "0"
13413-13422 dmx512: interframe: "INTER FRAME" "IF"
13422-13442 dmx512: databyte: "DATABYTE 300: 0" "DATA 300: 0" "DATA 0" "0"
13442-13452 dmx512: interframe: "INTER FRAME" "IF"
13452-13472 dmx512: databyte: "DATABYTE 301: 255" "DATA 301: 255" "DATA 255" "255"
13452-13472 dmx512: chan_data: "CHANNEL 301: 255" "CH 301: 255" "CH 255" "255"
13472-13481 dmx512: interframe: "INTER FRAME" "IF"
13481-13501 dmx512: databyte: "DATABYTE 302: 255" "DATA 302: 255" "DATA 255" "255"
13481-13501 dmx512: chan_data: "CHANNEL 302: 255" "CH 302: 255" "CH 255" "255"
13501-13511 dmx512: interframe: "INTER FRAME" "IF"
13511-13531 dmx512: databyte: "DATABYTE 303: 0" "DATA 303: 0" "DATA 0" "0"
13531-13540 dmx512: interframe: "INTER FRAME" "IF"
13540-13560 dmx512: databyte: "DATABYTE 304: 0" "DATA 304: 0" "DATA 0" "0"
13560-13569 dmx512: interframe: "INTER FRAME" "IF"
13569-13589 dmx512: databyte: "DATABYTE 305: 0" "DATA 305: 0" "DATA 0" "0"
13589-13599 dmx512: interframe: "INTER FRAME" "IF"
13599-13619 dmx512: databyte: "DATABYTE 306: 0" "DATA 306: 0" "DATA 0" "0"
13619-13628 dmx512: interframe: "INTER FRAME" "IF"
13628-13648 dmx512: databyte: "DATABYTE 307: 0" "DATA 307: 0" "DATA 0" "0"
13648-13658 dmx512: interframe: "INTER FRAME" "IF"
13658-13678 dmx512: databyte: "DATABYTE 308: 0" "DATA 308: 0" "DATA 0" "0"
13678-13687 dmx512: interframe: "INTER FRAME" "IF"
13687-13707 dmx512: databyte: "DATABYTE 309: 0" "DATA 309: 0" "DATA 0" "0"
13707-13717 dmx512: interframe: "INTER FRAME" "IF"
13717-13737 dmx512: databyte: "DATABYTE 310: 0" "DATA 310: 0" "DATA 0" "0"
13737-13746 dmx512: interframe: "INTER FRAME" "IF"
13746-13766 dmx512: databyte: "DATABYTE 311: 0" "DATA 311: 0" "DATA 0" "0"
13766-13775 dmx512: interframe: "INTER FRAME" "IF"
13775-13795 dmx512: databyte: "DATABYTE 312: 0" "DATA 312: 0" "DATA 0" "0"
13795-13805 dmx512: interframe: "INTER FRAME" "IF"
13805-13825 dmx512: databyte: "DATABYTE 313: 0" "DATA 313: 0" "DATA 0" "0"
13825-13834 dmx512: interframe: "INTER FRAME" "IF"
13834-13854 dmx512: databyte: "DATABYTE 314: 0" "DATA 314: 0" "DATA 0" "0"
13854-13864 dmx512: interframe: "INTER FRAME" "IF"
13864-13884 dmx512: databyte: "DATABYTE 315: 0" "DATA 315: 0" "DATA 0" "0"
13884-13893 dmx512: interframe: "INTER FRAME" "IF"
13893-13913 dmx512: databyte: "DATABYTE 316: 0" "DATA 316: 0" "DATA 0" "0"
13913-13923 dmx512: interframe: "INTER FRAME" "IF"
13923-13943 dmx512: databyte: "DATABYTE 317: 0" "DATA 317: 0" "DATA 0" "0"
13943-13952 dmx512: interframe: "INTER FRAME" "IF"
13952-13972 dmx512: databyte: "DATABYTE 318: 0" "DATA 318: 0" "DATA 0" "0"
13972-13981 dmx512: interframe: "INTER FRAME" "IF"
13981-14001 dmx512: databyte: "DATABYTE 319: 0" "DATA 319: 0" "DATA 0" "0"
14001-14011 dmx512: interframe: "INTER FRAME" "IF"
14011-14031 dmx512: databyte: "DATABYTE 320: 0" "DATA 320: 0" "DATA 0" "0"
14031-14040 dmx512: interframe: "INTER FRAME" "IF"
14040-14060 dmx512: databyte: "DATABYTE 321: 0" "DATA 321: 0" "DATA 0" "0"
14060-14070 dmx512: interframe: "INTER FRAME" "IF"
14070-14090 dmx512: databyte: "DATABYTE 322: 0" "DATA 322: 0" "DATA 0" "0"
14090-14099 dmx512: interframe: "INTER FRAME" "IF"
14099-14119 dmx512: databyte: "DATABYTE 323: 0" "DATA 323: 0" "DATA 0" "0"
14119-14129 dmx512: interframe: "INTER FRAME" "IF"
14129-14149 dmx512: databyte: "DATABYTE 324: 0" "DATA 324: 0" "DATA 0" "0"
14149-14158 dmx512: interframe: "INTER FRAME" "IF"
14158-14178 dmx512: databyte: "DATABYTE 325: 0" "DATA 325: 0" "DATA 0" "0"
14178-14187 dmx512: interframe: "INTER FRAME" "IF"
14187-14207 dmx512: databyte: "DATABYTE 326: 0" "DATA 326: 0" "DATA 0" "0"
14207-14217 dmx512: interframe: "INTER FRAME" "IF"
14217-14237 dmx512: databyte: "DATABYTE 327: 0" "DATA 327: 0" "DATA 0" "0"
14237-14246 dmx512: interframe: "INTER FRAME" "IF"
14246-14266 dmx512: databyte: "DATABYTE 328: 0" "DATA 328: 0" "DATA 0" "0"
14266-14276 dmx512: interframe: "INTER FRAME" "IF"
14276-14296 dmx512: databyte: "DATABYTE 329: 0" "DATA 329: 0" "DATA 0" "0"
14296-14305 dmx512: interframe: "INTER FRAME" "IF"
14305-14325 dmx512: databyte: "DATABYTE 330: 0" "DATA 330: 0" "DATA 0" "0"
14325-14334 dmx512: interframe: "INTER FRAME" "IF"
14334-14354 dmx512: databyte: "DATABYTE 331: 0" "DATA 331: 0" "DATA 0" "0"
14354-14364 dmx512: interframe: "INTER FRAME" "IF"
14364-14384 dmx512: databyte: "DATABYTE 332: 0" "DATA 332: 0" "DATA 0" "0"
14384-14393 dmx512: interframe: "INTER FRAME" "IF"
14393-14413 dmx512: databyte: "DATABYTE 333: 0" "DATA 333: 0" "DATA 0" "0"
14413-14423 dmx512: interframe: "INTER FRAME" "IF"
14423-14443 dmx512: databyte: "DATABYTE 334: 0" "DATA 334: 0" "DATA 0" "0"
14443-14452 dmx512: interframe: "INTER FRAME" "IF"
14452-14472 dmx512: databyte: "DATABYTE 335: 0" "DATA 335: 0" "DATA 0" "0"
14472-14482 dmx512: interframe: "INTER FRAME" "IF"
14482-14502 dmx512: databyte: "DATABYTE 336: 0" "DATA 336: 0" "DATA 0" "0"
14502-14511 dmx512: interframe: "INTER FRAME" "IF"
14511-14531 dmx512: databyte: "DATABYTE 337: 0" "DATA 337: 0" "DATA 0" "0"
14531-14540 dmx512: interframe: "INTER FRAME" "IF"
14540-14560 dmx512: databyte: "DATABYTE 338: 0" "DATA 338: 0" "DATA 0" "0"
14560-14570 dmx512: interframe: "INTER FRAME" "IF"
14570-14590 dmx512: databyte: "DATABYTE 339: 0" "DATA 339: 0" "DATA 0" "0"
14590-14599 dmx512: interframe: "INTER FRAME" "IF"
14599-14619 dmx512: databyte: "DATABYTE 340: 0" "DATA 340: 0" "DATA 0" "0"
14619-14629 dmx512: interframe: "INTER FRAME" "IF"
14629-14649 dmx512: databyte: "DATABYTE 341: 0" "DATA 341: 0" "DATA 0" "0"
14649-14658 dmx512: interframe: "INTER FRAME" "IF"
14658-14678 dmx512: databyte: "DATABYTE 342: 0" "DATA 342: 0" "DATA 0" "0"
14678-14688 dmx512: interframe: "INTER FRAME" "IF"
14688-14708 dmx512: databyte: "DATABYTE 343: 0" "DATA 343: 0" "DATA 0" "0"
14708-14717 dmx512: interframe: "INTER FRAME" "IF"
14717-14737 dmx512: databyte: "DATABYTE 344: 0" "DATA 344: 0" "DATA 0" "0"
14737-14746 dmx512: interframe: "INTER FRAME" "IF"
14746-14766 dmx512: databyte: "DATABYTE 345: 0" "DATA 345: 0" "DATA 0" "0"
14766-14776 dmx512: interframe: "INTER FRAME" "IF"
14776-14796 dmx512: databyte: "DATABYTE 346: 0" "DATA 346: 0" "DATA 0" "0"
14796-14805 dmx512: interframe: "INTER FRAME" "IF"
14805-14825 dmx512: databyte: "DATABYTE 347: 0" "DATA 347: 0" "DATA 0" "0"
14825-14835 dmx512: interframe: "INTER FRAME" "IF"
14835-14855 dmx512: databyte: "DATABYTE 348: 0" "DATA 348: 0" "DATA 0" "0"
14855-14864 dmx512: interframe: "INTER FRAME" "IF"
14864-14884 dmx512: databyte: "DATABYTE 349: 0" "DATA 349: 0" "DATA 0" "0"
14884-14894 dmx512: interframe: "INTER FRAME" "IF"
14894-14914 dmx512: databyte: "DATABYTE 350: 0" "DATA 350: 0" "DATA 0" "0"
14914-14923 dmx512: interframe: "INTER FRAME" "IF"
14923-14943 dmx512: databyte: "DATABYTE 351: 0" "DATA 351: 0" "DATA 0" "0"
14943-14952 dmx512: interframe: "INTER FRAME" "IF"
14952-14972 dmx512: databyte: "DATABYTE 352: 0" "DATA 352: 0" "DATA 0" "0"
14972-14982 dmx512: interframe: "INTER FRAME" "IF"
14982-15002 dmx512: databyte: "DATABYTE 353: 0" "DATA 353: 0" "DATA 0" "0"
15002-15011 dmx512: interframe: "INTER FRAME" "IF"
15011-15031 dmx512: databyte: "DATABYTE 354: 0" "DATA 354: 0" "DATA 0" "0"
15031-15041 dmx512: interframe: "INTER FRAME" "IF"
15041-15061 dmx512: databyte: "DATABYTE 355: 0" "DATA 355: 0" "DATA 0" "0"
15061-15070 dmx512: interframe: "INTER FRAME" "IF"
15070-15090 dmx512: databyte: "DATABYTE 356: 0" "DATA 356: 0" "DATA 0" "0"
15090-15099 dmx512: interframe: "INTER FRAME" "IF"
15099-15119 dmx512: databyte: "DATABYTE 357: 0" "DATA 357: 0" "DATA 0" "0"
15119-15129 dmx512: interframe: "INTER FRAME" "IF"
15129-15149 dmx512: databyte: "DATABYTE 358: 0" "DATA 358: 0" "DATA 0" "0"
15149-15158 dmx512: interframe: "INTER FRAME" "IF"
15158-15178 dmx512: databyte: "DATABYTE 359: 0" "DATA 359: 0" "DATA 0" "0"
15178-15188 dmx512: interframe: "INTER FRAME" "IF"
15188-15208 dmx512: databyte: "DATABYTE 360: 0" "DATA 360: 0" "DATA 0" "0"
15208-15217 dmx512: interframe: "INTER FRAME" "IF"
15217-15237 dmx512: databyte: "DATABYTE 361: 0" "DATA 361: 0" "DATA 0" "0"
15237-15247 dmx512: interframe: "INTER FRAME" "IF"
15247-15267 dmx512: databyte: "DATABYTE 362: 0" "DATA 362: 0" "DATA 0" "0"
15267-15276 dmx512: interframe: "INTER FRAME" "IF"
15276-15296 dmx512: databyte: "DATABYTE 363: 0" "DATA 363: 0" "DATA 0" "0"
15296-15305 dmx512: interframe: "INTER FRAME" "IF"
15305-15325 dmx512: databyte: "DATABYTE 364: 0" "DATA 364: 0" "DATA 0" "0"
15325-15335 dmx512: interframe: "INTER FRAME" "IF"
15335-15355 dmx512: databyte: "DATABYTE 365: 0" "DATA 365: 0" "DATA 0" "0"
15355-15364 dmx512: interframe: "INTER FRAME" "IF"
15364-15384 dmx512: databyte: "DATABYTE 366: 0" "DATA 366: 0" "DATA 0" "0"
15384-15394 dmx512: interframe: "INTER FRAME" "IF"
15394-15414 dmx512: databyte: "DATABYTE 367: 0" "DATA 367: 0" "DATA 0" "0"
15414-15423 dmx512: interframe: "INTER FRAME" "IF"
15423-15443 dmx512: databyte: "DATABYTE 368: 0" "DATA 368: 0" "DATA 0" "0"
15443-15453 dmx512: interframe: "INTER FRAME" "IF"
15453-15473 dmx512: databyte: "DATABYTE 369: 0" "DATA 369: 0" "DATA 0" "0"
15473-15482 dmx512: interframe: "INTER FRAME" "IF"
15482-15502 dmx512: databyte: "DATABYTE 370: 0" "DATA 370: 0" "DATA 0" "0"
15502-15511 dmx512: interframe: "INTER FRAME" "IF"
15511-15531 dmx512: databyte: "DATABYTE 371: 0" "DATA 371: 0" "DATA 0" "0"
15531-15541 dmx512: interframe: "INTER FRAME" "IF"
15541-15561 dmx512: databyte: "DATABYTE 372: 0" "DATA 372: 0" "DATA 0" "0"
15561-15570 dmx512: interframe: "INTER FRAME" "IF"
15570-15590 dmx512: databyte: "DATABYTE 373: 0" "DATA 373: 0" "DATA 0" "0"
15590-15600 dmx512: interframe: "INTER FRAME" "IF"
15600-15620 dmx512: databyte: "DATABYTE 374: 0" "DATA 374: 0" "DATA 0" "0"
15620-15629 dmx512: interframe: "INTER FRAME" "IF"
15629-15649 dmx512: databyte: "DATABYTE 375: 0" "DATA 375: 0" "DATA 0" "0"
15649-15658 dmx512: interframe: "INTER FRAME" "IF"
15658-15678 dmx512: databyte: "DATABYTE 376: 0" "DATA 376: 0" "DATA 0" "0"
15678-15688 dmx512: interframe: "INTER FRAME" "IF"
15688-15708 dmx512: databyte: "DATABYTE 377: 0" "DATA 377: 0" "DATA 0" "0"
15708-15717 dmx512: interframe: "INTER FRAME" "IF"
15717-15737 dmx512: databyte: "DATABYTE 378: 0" "DATA 378: 0" "DATA 0" "0"
15737-15747 dmx512: interframe: "INTER FRAME" "IF"
15747-15767 dmx512: databyte: "DATABYTE 379: 0" "DATA 379: 0" "DATA 0" "0"
15767-15776 dmx512: interframe: "INTER FRAME" "IF"
15776-15796 dmx512: databyte: "DATABYTE 380: 0" "DATA 380: 0" "DATA 0" "0"
15796-15806 dmx512: interframe: "INTER FRAME" "IF"
15806-15826 dmx512: databyte: "DATABYTE 381: 0" "DATA 381: 0" "DATA 0" "0"
15826-15835 dmx512: interframe: "INTER FRAME" "IF"
15835-15855 dmx512: databyte: "DATABYTE 382: 0" "DATA 382: 0" "DATA 0" "0"
15855-15864 dmx512: interframe: "INTER FRAME" "IF"
15864-15884 dmx512: databyte: "DATABYTE 383: 0" "DATA 383: 0" "DATA 0" "0"
15884-15894 dmx512: interframe: "INTER FRAME" "IF"
15894-15914 dmx512: databyte: "DATABYTE 384: 0" "DATA 384: 0" "DATA 0" "0"
15914-15923 dmx512: interframe: "INTER FRAME" "IF"
15923-15943 dmx512: databyte: "DATABYTE 385: 0" "DATA 385: 0" "DATA 0" "0"
15943-15953 dmx512: interframe: "INTER FRAME" "IF"
15953-15973 dmx512: databyte: "DATABYTE 386: 0" "DATA 386: 0" "DATA 0" "0"
15973-15982 dmx512: interframe: "INTER FRAME" "IF"
15982-16002 dmx512: databyte: "DATABYTE 387: 0" "DATA 387: 0" "DATA 0" "0"
16002-16012 dmx512: interframe: "INTER FRAME" "IF"
16012-16032 dmx512: databyte: "DATABYTE 388: 0" "DATA 388: 0" "DATA 0" "0"
16032-16041 dmx512: interframe: "INTER FRAME" "IF"
16041-16061 dmx512: databyte: "DATABYTE 389: 0" "DATA 389: 0" "DATA 0" "0"
16061-16070 dmx512: interframe: "INTER FRAME" "IF"
16070-16090 dmx512: databyte: "DATABYTE 390: 0" "DATA 390: 0" "DATA 0" "0"
16090-16100 dmx512: interframe: "INTER FRAME" "IF"
16100-16120 dmx512: databyte: "DATABYTE 391: 0" "DATA 391: 0" "DATA 0" "0"
16120-16129 dmx512: interframe: "INTER FRAME" "IF"
16129-16149 dmx512: databyte: "DATABYTE 392: 0" "DATA 392: 0" "DATA 0" "0"
16149-16159 dmx512: interframe: "INTER FRAME" "IF"
16159-16179 dmx512: databyte: "DATABYTE 393: 0" "DATA 393: 0" "DATA 0" "0"
16179-16188 dmx512: interframe: "INTER FRAME" "IF"
16188-16208 dmx512: databyte: "DATABYTE 394: 0" "DATA 394: 0" "DATA 0" "0"
16208-16218 dmx512: interframe: "INTER FRAME" "IF"
16218-16238 dmx512: databyte: "DATABYTE 395: 0" "DATA 395: 0" "DATA 0" "0"
16238-16247 dmx512: interframe: "INTER FRAME" "IF"
16247-16267 dmx512: databyte: "DATABYTE 396: 0" "DATA 396: 0" "DATA 0" "0"
16267-16276 dmx512: interframe: "INTER FRAME" "IF"
16276-16296 dmx512: databyte: "DATABYTE 397: 0" "DATA 397: 0" "DATA 0" "0"
16296-16306 dmx512: interframe: "INTER FRAME" "IF"
16306-16326 dmx512: databyte: "DATABYTE 398: 0" "DATA 398: 0" "DATA 0" "0"
16326-16335 dmx512: interframe: "INTER FRAME" "IF"
16335-16355 dmx512: databyte: "DATABYTE 399: 0" "DATA 399: 0" "DATA 0" "0"
16355-16365 dmx512: interframe: "INTER FRAME" "IF"
16365-16385 dmx512: databyte: "DATABYTE 400: 0" "DATA 400: 0" "DATA 0" "0"
16385-16394 dmx512: interframe: "INTER FRAME" "IF"
16394-16414 dmx512: databyte: "DATABYTE 401: 255" "DATA 401: 255" "DATA 255" "255"
16394-16414 dmx512: chan_data: "CHANNEL 401: 255" "CH 401: 255" "CH 255" "255"
16414-16423 dmx512: interframe: "INTER FRAME" "IF"
16423-16443 dmx512: databyte: "DATABYTE 402: 255" "DATA 402: 255" "DATA 255" "255"
16423-16443 dmx512: chan_data: "CHANNEL 402: 255" "CH 402: 255" "CH 255" "255"
16443-16453 dmx512: interframe: "INTER FRAME" "IF"
16453-16473 dmx512: databyte: "DATABYTE 403: 0" "DATA 403: 0" "DATA 0" "0"
16473-16482 dmx512: interframe: "INTER FRAME" "IF"
16482-16502 dmx512: databyte: "DATABYTE 404: 0" "DATA 404: 0" "DATA 0" "0"
16502-16512 dmx512: interframe: "INTER FRAME" "IF"
16512-16532 dmx512: databyte: "DATABYTE 405: 0" "DATA 405: 0" "DATA 0" "0"
16532-16541 dmx512: interframe: "INTER FRAME" "IF"
16541-16561 dmx512: databyte: "DATABYTE 406: 0" "DATA 406: 0" "DATA 0" "0"
16561-16571 dmx512: interframe: "INTER FRAME" "IF"
16571-16591 dmx512: databyte: "DATABYTE 407: 0" "DATA 407: 0" "DATA 0" "0"
16591-16600 dmx512: interframe: "INTER FRAME" "IF"
16600-16620 dmx512: databyte: "DATABYTE 408: 0" "DATA 408: 0" "DATA 0" "0"
16620-16629 dmx512: interframe: "INTER FRAME" "IF"
16629-16649 dmx512: databyte: "DATABYTE 409: 0" "DATA 409: 0" "DATA 0" "0"
16649-16659 dmx512: interframe: "INTER FRAME" "IF"
16659-16679 dmx512: databyte: "DATABYTE 410: 0" "DATA 410: 0" "DATA 0" "0"
16679-16688 dmx512: interframe: "INTER FRAME" "IF"
16688-16708 dmx512: databyte: "DATABYTE 411: 0" "DATA 411: 0" "DATA 0" "0"
16708-16718 dmx512: interframe: "INTER FRAME" "IF"
16718-16738 dmx512: databyte: "DATABYTE 412: 0" "DATA 412: 0" "DATA 0" "0"
16738-16747 dmx512: interframe: "INTER FRAME" "IF"
16747-16767 dmx512: databyte: "DATABYTE 413: 0" "DATA 413: 0" "DATA 0" "0"
16767-16777 dmx512: interframe: "INTER FRAME" "IF"
16777-16797 dmx512: databyte: "DATABYTE 414: 0" "DATA 414: 0" "DATA 0" "0"
16797-16806 dmx512: interframe: "INTER FRAME" "IF"
16806-16826 dmx512: databyte: "DATABYTE 415: 0" "DATA 415: 0" "DATA 0" "0"
16826-16835 dmx512: interframe: "INTER FRAME" "IF"
16835-16855 dmx512: databyte: "DATABYTE 416: 0" "DATA 416: 0" "DATA 0" "0"
16855-16865 dmx512: interframe: "INTER FRAME" "IF"
16865-16885 dmx512: databyte: "DATABYTE 417: 0" "DATA 417: 0" "DATA 0" "0"
16885-16894 dmx512: interframe: "INTER FRAME" "IF"
16894-16914 dmx512: databyte: "DATABYTE 418: 0" "DATA 418: 0" "DATA 0" "0"
16914-16924 dmx512: interframe: "INTER FRAME" "IF"
16924-16944 dmx512: databyte: "DATABYTE 419: 0" "DATA 419: 0" "DATA 0" "0"
16944-16953 dmx512: interframe: "INTER FRAME" "IF"
16953-16973 dmx512: databyte: "DATABYTE 420: 0" "DATA 420: 0" "DATA 0" "0"
16973-16983 dmx512: interframe: "INTER FRAME" "IF"
16983-17003 dmx512: databyte: "DATABYTE 421: 0" "DATA 421: 0" "DATA 0" "0"
17003-17012 dmx512: interframe: "INTER FRAME" "IF"
17012-17032 dmx512: databyte: "DATABYTE 422: 0" "DATA 422: 0" "DATA 0" "0"
17032-17041 dmx512: interframe: "INTER FRAME" "IF"
17041-17061 dmx512: databyte: "DATABYTE 423: 0" "DATA 423: 0" "DATA 0" "0"
17061-17071 dmx512: interframe: "INTER FRAME" "IF"
17071-17091 dmx512: databyte: "DATABYTE 424: 0" "DATA 424: 0" "DATA 0" "0"
17091-17100 dmx512: interframe: "INTER FRAME" "IF"
17100-17120 dmx512: databyte: "DATABYTE 425: 0" "DATA 425: 0" "DATA 0" "0"
17120-17130 dmx512: interframe: "INTER FRAME" "IF"
17130-17150 dmx512: databyte: "DATABYTE 426: 0" "DATA 426: 0" "DATA 0" "0"
17150-17159 dmx512: interframe: "INTER FRAME" "IF"
17159-17179 dmx512: databyte: "DATABYTE 427: 0" "DATA 427: 0" "DATA 0" "0"
17179-17188 dmx512: interframe: "INTER FRAME" "IF"
17188-17208 dmx512: databyte: "DATABYTE 428: 0" "DATA 428: 0" "DATA 0" "0"
17208-17218 dmx512: interframe: "INTER FRAME" "IF"
17218-17238 dmx512: databyte: "DATABYTE 429: 0" "DATA 429: 0" "DATA 0" "0"
17238-17247 dmx512: interframe: "INTER FRAME" "IF"
17247-17267 dmx512: databyte: "DATABYTE 430: 0" "DATA 430: 0" "DATA 0" "0"
17267-17277 dmx512: interframe: "INTER FRAME" "IF"
17277-17297 dmx512: databyte: "DATABYTE 431: 0" "DATA 431: 0" "DATA 0" "0"
17297-17306 dmx512: interframe: "INTER FRAME" "IF"
17306-17326 dmx512: databyte: "DATABYTE 432: 0" "DATA 432: 0" "DATA 0" "0"
17326-17336 dmx512: interframe: "INTER FRAME" "IF"
17336-17356 dmx512: databyte: "DATABYTE 433: 0" "DATA 433: 0" "DATA 0" "0"
17356-17365 dmx512: interframe: "INTER FRAME" "IF"
17365-17385 dmx512: databyte: "DATABYTE 434: 0" "DATA 434: 0" "DATA 0" "0"
17385-17394 dmx512: interframe: "INTER FRAME" "IF"
17394-17414 dmx512: databyte: "DATABYTE 435: 0" "DATA 435: 0" "DATA 0" "0"
17414-17424 dmx512: interframe: "INTER FRAME" "IF"
17424-17444 dmx512: databyte: "DATABYTE 436: 0" "DATA 436: 0" "DATA 0" "0"
17444-17453 dmx512: interframe: "INTER FRAME" "IF"
17453-17473 dmx512: databyte: "DATABYTE 437: 0" "DATA 437: 0" "DATA 0" "0"
17473-17483 dmx512: interframe: "INTER FRAME" "IF"
17483-17503 dmx512: databyte: "DATABYTE 438: 0" "DATA 438: 0" "DATA 0" "0"
17503-17512 dmx512: interframe: "INTER FRAME" "IF"
17512-17532 dmx512: databyte: "DATABYTE 439: 0" "DATA 439: 0" "DATA 0" "0"
17532-17542 dmx512: interframe: "INTER FRAME" "IF"
17542-17562 dmx512: databyte: "DATABYTE 440: 0" "DATA 440: 0" "DATA 0" "0"
17562-17571 dmx512: interframe: "INTER FRAME" "IF"
17571-17591 dmx512: databyte: "DATABYTE 441: 0" "DATA 441: 0" "DATA 0" "0"
17591-17600 dmx512: interframe: "INTER FRAME" "IF"
17600-17620 dmx512: databyte: "DATABYTE 442: 0" "DATA 442: 0" "DATA 0" "0"
17620-17630 dmx512: interframe: "INTER FRAME" "IF"
17630-17650 dmx512: databyte: "DATABYTE 443: 0" "DATA 443: 0" "DATA 0" "0"
17650-17659 dmx512: interframe: "INTER FRAME" "IF"
17659-17679 dmx512: databyte: "DATABYTE 444: 0" "DATA 444: 0" "DATA 0" "0"
17679-17689 dmx512: interframe: "INTER FRAME" "IF"
17689-17709 dmx512: databyte: "DATABYTE 445: 0" "DATA 445: 0" "DATA 0" "0"
17709-17718 dmx512: interframe: "INTER FRAME" "IF"
17718-17738 dmx512: databyte: "DATABYTE 446: 0" "DATA 446: 0" "DATA 0" "0"
17738-17747 dmx512: interframe: "INTER FRAME" "IF"
17747-17767 dmx512: databyte: "DATABYTE 447: 0" "DATA 447: 0" "DATA 0" "0"
17767-17777 dmx512: interframe: "INTER FRAME" "IF"
17777-17797 dmx512: databyte: "DATABYTE 448: 0" "DATA 448: 0" "DATA 0" "0"
17797-17806 dmx512: interframe: "INTER FRAME" "IF"
17806-17826 dmx512: databyte: "DATABYTE 449: 0" "DATA 449: 0" "DATA 0" "0"
17826-17836 dmx512: interframe: "INTER FRAME" "IF"
17836-17856 dmx512: databyte: "DATABYTE 450: 0" "DATA 450: 0" "DATA 0" "0"
17856-17865 dmx512: interframe: "INTER FRAME" "IF"
17865-17885 dmx512: databyte: "DATABYTE 451: 0" "DATA 451: 0" "DATA 0" "0"
17885-17895 dmx512: interframe: "INTER FRAME" "IF"
17895-17915 dmx512: databyte: "DATABYTE 452: 0" "DATA 452: 0" "DATA 0" "0"
17915-17924 dmx512: interframe: "INTER FRAME" "IF"
17924-17944 dmx512: databyte: "DATABYTE 453: 0" "DATA 453: 0" "DATA 0" "0"
17944-17953 dmx512: interframe: "INTER FRAME" "IF"
17953-17973 dmx512: databyte: "DATABYTE 454: 0" "DATA 454: 0" "DATA 0" "0"
17973-17983 dmx512: interframe: "INTER FRAME" "IF"
17983-18003 dmx512: databyte: "DATABYTE 455: 0" "DATA 455: 0" "DATA 0" "0"
18003-18012 dmx512: interframe: "INTER FRAME" "IF"
18012-18032 dmx512: databyte: "DATABYTE 456: 0" "DATA 456: 0" "DATA 0" "0"
18032-18042 dmx512: interframe: "INTER FRAME" "IF"
18042-18062 dmx512: databyte: "DATABYTE 457: 0" "DATA 457: 0" "DATA 0" "0"
18062-18071 dmx512: interframe: "INTER FRAME" "IF"
18071-18091 dmx512: databyte: "DATABYTE 458: 0" "DATA 458: 0" "DATA 0" "0"
18091-18101 dmx512: interframe: "INTER FRAME" "IF"
18101-18121 dmx512: databyte: "DATABYTE 459: 0" "DATA 459: 0" "DATA 0" "0"
18121-18130 dmx512: interframe: "INTER FRAME" "IF"
18130-18150 dmx512: databyte: "DATABYTE 460: 0" "DATA 460: 0" "DATA 0" "0"
18150-18159 dmx512: interframe: "INTER FRAME" "IF"
18159-18179 dmx512: databyte: "DATABYTE 461: 0" "DATA 461: 0" "DATA 0" "0"
18179-18189 dmx512: interframe: "INTER FRAME" "IF"
18189-18209 dmx512: databyte: "DATABYTE 462: 0" "DATA 462: 0" "DATA 0" "0"
18209-18218 dmx512: interframe: "INTER FRAME" "IF"
18218-18238 dmx512: databyte: "DATABYTE 463: 0" "DATA 463: 0" "DATA 0" "0"
18238-18248 dmx512: interframe: "INTER FRAME" "IF"
18248-18268 dmx512: databyte: "DATABYTE 464: 0" "DATA 464: 0" "DATA 0" "0"
18268-18277 dmx512: interframe: "INTER FRAME" "IF"
18277-18297 dmx512: databyte: "DATABYTE 465: 0" "DATA 465: 0" "DATA 0" "0"
18297-18307 dmx512: interframe: "INTER FRAME" "IF"
18307-18327 dmx512: databyte: "DATABYTE 466: 0" "DATA 466: 0" "DATA 0" "0"
18327-18336 dmx512: interframe: "INTER FRAME" "IF"
18336-18356 dmx512: databyte: "DATABYTE 467: 0" "DATA 467: 0" "DATA 0" "0"
18356-18365 dmx512: interframe: "INTER FRAME" "IF"
18365-18385 dmx512: databyte: "DATABYTE 468: 0" "DATA 468: 0" "DATA 0" "0"
18385-18395 dmx512: interframe: "INTER FRAME" "IF"
18395-18415 dmx512: databyte: "DATABYTE 469: 0" "DATA 469: 0" "DATA 0" "0"
18415-18424 dmx512: interframe: "INTER FRAME" "IF"
18424-18444 dmx512: databyte: "DATABYTE 470: 0" "DATA 470: 0" "DATA 0" "0"
18444-18454 dmx512: interframe: "INTER FRAME" "IF"
18454-18474 dmx512: databyte: "DATABYTE 471: 0" "DATA 471: 0" "DATA 0" "0"
18474-18483 dmx512: interframe: "INTER FRAME" "IF"
18483-18503 dmx512: databyte: "DATABYTE 472: 0" "DATA 472: 0" "DATA 0" "0"
18503-18512 dmx512: interframe: "INTER FRAME" "IF"
18512-18532 dmx512: databyte: "DATABYTE 473: 0" "DATA 473: 0" "DATA 0" "0"
18532-18542 dmx512: interframe: "INTER FRAME" "IF"
18542-18562 dmx512: databyte: "DATABYTE 474: 0" "DATA 474: 0" "DATA 0" "0"
18562-18571 dmx512: interframe: "INTER FRAME" "IF"
18571-18591 dmx512: databyte: "DATABYTE 475: 0" "DATA 475: 0" "DATA 0" "0"
18591-18601 dmx512: interframe: "INTER FRAME" "IF"
18601-18621 dmx512: databyte: "DATABYTE 476: 0" "DATA 476: 0" "DATA 0" "0"
18621-18630 dmx512: interframe: "INTER FRAME" "IF"
18630-18650 dmx512: databyte: "DATABYTE 477: 0" "DATA 477: 0" "DATA 0" "0"
18650-18660 dmx512: interframe: "INTER FRAME" "IF"
18660-18680 dmx512: databyte: "DATABYTE 478: 0" "DATA 478: 0" "DATA 0" "0"
18680-18689 dmx512: interframe: "INTER FRAME" "IF"
18689-18709 dmx512: databyte: "DATABYTE 479: 0" "DATA 479: 0" "DATA 0" "0"
18709-18718 dmx512: interframe: "INTER FRAME" "IF"
18718-18738 dmx512: databyte: "DATABYTE 480: 0" "DATA 480: 0" "DATA 0" "0"
18738-18748 dmx512: interframe: "INTER FRAME" "IF"
18748-18768 dmx512: databyte: "DATABYTE 481: 0" "DATA 481: 0" "DATA 0" "0"
18768-18777 dmx512: interframe: "INTER FRAME" "IF"
18777-18797 dmx512: databyte: "DATABYTE 482: 0" "DATA 482: 0" "DATA 0" "0"
18797-18807 dmx512: interframe: "INTER FRAME" "IF"
18807-18827 dmx512: databyte: "DATABYTE 483: 0" "DATA 483: 0" "DATA 0" "0"
18827-18836 dmx512: interframe: "INTER FRAME" "IF"
18836-18856 dmx512: databyte: "DATABYTE 484: 0" "DATA 484: 0" "DATA 0" "0"
18856-18866 dmx512: interframe: "INTER FRAME" "IF"
18866-18886 dmx512: databyte: "DATABYTE 485: 0" "DATA 485: 0" "DATA 0" "0"
18886-18895 dmx512: interframe: "INTER FRAME" "IF"
18895-18915 dmx512: databyte: "DATABYTE 486: 0" "DATA 486: 0" "DATA 0" "0"
18915-18924 dmx512: interframe: "INTER FRAME" "IF"
18924-18944 dmx512: databyte: "DATABYTE 487: 0" "DATA 487: 0" "DATA 0" "0"
18944-18954 dmx512: interframe: "INTER FRAME" "IF"
18954-18974 dmx512: databyte: "DATABYTE 488: 0" "DATA 488: 0" "DATA 0" "0"
18974-18983 dmx512: interframe: "INTER FRAME" "IF"
18983-19003 dmx512: databyte: "DATABYTE 489: 0" "DATA 489: 0" "DATA 0" "0"
19003-19013 dmx512: interframe: "INTER FRAME" "IF"
19013-19033 dmx512: databyte: "DATABYTE 490: 0" "DATA 490: 0" "DATA 0" "0"
19033-19042 dmx512: interframe: "INTER FRAME" "IF"
19042-19062 dmx512: databyte: "DATABYTE 491: 0" "DATA 491: 0" "DATA 0" "0"
19062-19072 dmx512: interframe: "INTER FRAME" "IF"
19072-19092 dmx512: databyte: "DATABYTE 492: 0" "DATA 492: 0" "DATA 0" "0"
19092-19101 dmx512: interframe: "INTER FRAME" "IF"
19101-19121 dmx512: databyte: "DATABYTE 493: 0" "DATA 493: 0" "DATA 0" "0"
19121-19130 dmx512: interframe: "INTER FRAME" "IF"
19130-19150 dmx512: databyte: "DATABYTE 494: 0" "DATA 494: 0" "DATA 0" "0"
19150-19160 dmx512: interframe: "INTER FRAME" "IF"
19160-19180 dmx512: databyte: "DATABYTE 495: 0" "DATA 495: 0" "DATA 0" "0"
19180-19189 dmx512: interframe: "INTER FRAME" "IF"
19189-19209 dmx512: databyte: "DATABYTE 496: 0" "DATA 496: 0" "DATA 0" "0"
19209-19219 dmx512: interframe: "INTER FRAME" "IF"
19219-19239 dmx512: databyte: "DATABYTE 497: 0" "DATA 497: 0" "DATA 0" "0"
19239-19248 dmx512: interframe: "INTER FRAME" "IF"
19248-19268 dmx512: databyte: "DATABYTE 498: 0" "DATA 498: 0" "DATA 0" "0"
19268-19277 dmx512: interframe: "INTER FRAME" "IF"
19277-19297 dmx512: databyte: "DATABYTE 499: 0" "DATA 499: 0" "DATA 0" "0"
19297-19307 dmx512: interframe: "INTER FRAME" "IF"
19307-19327 dmx512: databyte: "DATABYTE 500: 0" "DATA 500: 0" "DATA 0" "0"
19327-19336 dmx512: interframe: "INTER FRAME" "IF"
19336-19356 dmx512: databyte: "DATABYTE 501: 0" "DATA 501: 0" "DATA 0" "0"
