8469-8497 jitter: jitter: "14.0μs"
8538-8566 jitter: jitter: "14.0μs"
8677-8705 jitter: jitter: "14.0μs"
8816-8846 jitter: jitter: "15.0μs"
8920-8950 jitter: jitter: "15.0μs"
9058-9088 jitter: jitter: "15.0μs"
9163-9190 jitter: jitter: "13.5μs"
9267-9296 jitter: jitter: "14.5μs"
9405-9435 jitter: jitter: "15.0μs"
9509-9537 jitter: jitter: "14.0μs"
9648-9678 jitter: jitter: "15.0μs"
9787-9814 jitter: jitter: "13.5μs"
9856-9886 jitter: jitter: "15.0μs"
9925-9953 jitter: jitter: "14.0μs"
9995-10023 jitter: jitter: "14.0μs"
10064-10094 jitter: jitter: "15.0μs"
10133-10161 jitter: jitter: "14.0μs"
10203-10231 jitter: jitter: "14.0μs"
10342-10369 jitter: jitter: "13.5μs"
10480-10510 jitter: jitter: "15.0μs"
10550-10577 jitter: jitter: "13.5μs"
10688-10718 jitter: jitter: "15.0μs"
10827-10855 jitter: jitter: "14.0μs"
10896-10926 jitter: jitter: "15.0μs"
11070-11100 jitter: jitter: "15.0μs"
11243-11271 jitter: jitter: "14.0μs"
11313-11342 jitter: jitter: "14.5μs"
11451-11479 jitter: jitter: "14.0μs"
11590-11618 jitter: jitter: "14.0μs"
11694-11724 jitter: jitter: "15.0μs"
11763-11793 jitter: jitter: "15.0μs"
11833-11863 jitter: jitter: "15.0μs"
