399842-400012 adf435x: write: "Register: 5" "Reg: 5" "[5]"
398669-398782 adf435x: write: "LD Pin Mode: High"
511405-511572 adf435x: write: "Register: 4" "Reg: 4" "[4]"
511291-511405 adf435x: write: "Output Power: +5dBm"
511235-511291 adf435x: write: "Output Enable: Enabled"
511121-511235 adf435x: write: "AUX Output Power: +5dBm"
511065-511121 adf435x: write: "AUX Output Select: Divided Output"
511009-511065 adf435x: write: "AUX Output Enable: Disabled"
510953-511009 adf435x: write: "MTLD: Disabled"
510898-510953 adf435x: write: "VCO Power-Down: VCO Powered Up"
510450-510898 adf435x: write: "Band Select Clock Divider: 200"
510282-510450 adf435x: write: "RF Divider Select: ÷1"
510227-510282 adf435x: write: "Feedback Select: Fundamental"
723589-723758 adf435x: write: "Register: 3" "Reg: 3" "[3]"
722917-723589 adf435x: write: "Clock Divider: 150"
722806-722917 adf435x: write: "Clock Divider Mode: Clock Divider Off"
722694-722750 adf435x: write: "CSR Enable: Disabled"
722527-722583 adf435x: write: "Charge Cancellation: Disabled"
722471-722527 adf435x: write: "ABP: 6ns (FRAC-N)"
722416-722471 adf435x: write: "Band Select Clock Mode: Low"
1018442-1018609 adf435x: write: "Register: 2" "Reg: 2" "[2]"
1018386-1018442 adf435x: write: "Counter Reset: Disabled"
1018331-1018386 adf435x: write: "Charge Pump Three-State: Disabled"
1018275-1018331 adf435x: write: "Power-Down: Disabled"
1018219-1018275 adf435x: write: "PD Polarity: Positive"
1018163-1018219 adf435x: write: "LDP: 10ns"
1018107-1018163 adf435x: write: "LDF: FRAC-N"
1017881-1018107 adf435x: write: "Charge Pump Current Setting: 2.50mA @ 5.1kΩ"
1017826-1017881 adf435x: write: "Double Buffer: Disabled"
1017268-1017826 adf435x: write: "R Counter: 1"
1017212-1017267 adf435x: write: "RDIV2: Disabled"
1017157-1017212 adf435x: write: "Reference Doubler: Disabled"
1016990-1017157 adf435x: write: "MUXOUT: Three-State Output"
1016878-1016990 adf435x: write: "Low Noise and Low Spur Modes: Low Noise Mode"
1304000-1304170 adf435x: write: "Register: 1" "Reg: 1" "[1]"
1303331-1304000 adf435x: write: "MOD: 2"
1302662-1303331 adf435x: write: "Phase: 1"
1302607-1302662 adf435x: write: "Prescalar: 8/9"
1302550-1302607 adf435x: write: "Phase Adjust: Off"
1507574-1507741 adf435x: write: "Register: 0" "Reg: 0" "[0]"
1506905-1507574 adf435x: write: "FRAC: 0"
1506013-1506905 adf435x: write: "INT: 160"
