7569-7928 max72xx: digit: "Digit 1: 00"
7933-8305 max72xx: digit: "Digit 1: 00"
8310-8669 max72xx: digit: "Digit 1: 00"
8675-9034 max72xx: digit: "Digit 1: 00"
9074-9434 max72xx: digit: "Digit 2: 00"
9439-9798 max72xx: digit: "Digit 2: 00"
9803-10164 max72xx: digit: "Digit 2: 00"
10168-10539 max72xx: digit: "Digit 2: 00"
10580-10939 max72xx: digit: "Digit 3: 00"
10945-11304 max72xx: digit: "Digit 3: 00"
11309-11669 max72xx: digit: "Digit 3: 00"
11674-12033 max72xx: digit: "Digit 3: 00"
12074-12445 max72xx: digit: "Digit 4: 00"
12451-12810 max72xx: digit: "Digit 4: 00"
12815-13174 max72xx: digit: "Digit 4: 00"
13180-13539 max72xx: digit: "Digit 4: 00"
13579-13939 max72xx: digit: "Digit 5: 00"
13944-14304 max72xx: digit: "Digit 5: 00"
14309-14682 max72xx: digit: "Digit 5: 00"
14686-15045 max72xx: digit: "Digit 5: 00"
15086-15445 max72xx: digit: "Digit 6: 00"
15451-15810 max72xx: digit: "Digit 6: 00"
15815-16175 max72xx: digit: "Digit 6: 00"
16180-16552 max72xx: digit: "Digit 6: 00"
16592-16952 max72xx: digit: "Digit 7: 00"
16957-17317 max72xx: digit: "Digit 7: 00"
17322-17682 max72xx: digit: "Digit 7: 00"
17687-18047 max72xx: digit: "Digit 7: 00"
18088-18471 max72xx: digit: "Digit 8: 00"
18464-18823 max72xx: digit: "Digit 8: 00"
18829-19188 max72xx: digit: "Digit 8: 00"
19193-19552 max72xx: digit: "Digit 8: 00"
1625575-1625936 max72xx: digit: "Digit 4: 08"
1625940-1626312 max72xx: digit: "Digit 3: 04"
1626317-1626676 max72xx: digit: "Digit 2: 02"
1626682-1627041 max72xx: digit: "Digit 1: 01"
2627037-2627396 max72xx: digit: "Digit 4: 00"
2627413-2627773 max72xx: digit: "Digit 3: 00"
2627778-2628137 max72xx: digit: "Digit 2: 00"
2628143-2628502 max72xx: digit: "Digit 1: 00"
