52-412 max72xx: register: "Display test: on"
417-777 max72xx: register: "Display test: on"
783-1144 max72xx: register: "Display test: on"
1148-1508 max72xx: register: "Display test: on"
1548-1908 max72xx: register: "Decode: 0b00000000"
1913-2285 max72xx: register: "Decode: 0b00000000"
2290-2649 max72xx: register: "Decode: 0b00000000"
2655-3014 max72xx: register: "Decode: 0b00000000"
3054-3416 max72xx: register: "Intensity: 7"
3420-3780 max72xx: register: "Intensity: 7"
3785-4159 max72xx: register: "Intensity: 7"
4163-4523 max72xx: register: "Intensity: 7"
4563-4925 max72xx: register: "Scan limit: 8"
4929-5289 max72xx: register: "Scan limit: 8"
5295-5655 max72xx: register: "Scan limit: 8"
5660-6022 max72xx: register: "Scan limit: 8"
6061-6433 max72xx: register: "Display test: off"
6438-6798 max72xx: register: "Display test: off"
6804-7165 max72xx: register: "Display test: off"
7169-7529 max72xx: register: "Display test: off"
19593-19954 max72xx: register: "Shutdown: off"
19958-20317 max72xx: register: "Shutdown: off"
20323-20696 max72xx: register: "Shutdown: off"
20700-21061 max72xx: register: "Shutdown: off"
221104-221475 max72xx: register: "No-op"
221480-221839 max72xx: register: "No-op"
221845-222205 max72xx: register: "No-op"
422244-422603 max72xx: register: "No-op"
422609-422969 max72xx: register: "No-op"
422973-423332 max72xx: register: "No-op"
423337-423696 max72xx: register: "No-op"
