13724-14404 edid: section: "Offset: 0" "O: 0" "0"
14565-14885 edid: section: "EDID"
14925-17765 edid: section: "Header"
14925-17765 edid: field: "Header pattern"
21685-22365 edid: field: "ABO (Alcatel Bell)"
22405-23085 edid: field: "Product 0x6781"
23125-24525 edid: field: "Serial 670"
29725-30405 edid: field: "Manufactured week 1, 2003" "week 1, 2003"
21685-30405 edid: section: "Vendor/product"
30445-31125 edid: section: "EDID Version"
30445-30765 edid: field: "Version 1"
30805-31125 edid: field: "Revision 3"
31165-38125 edid: section: "Basic display"
31165-31485 edid: field: "Video input: VESA DFP 1."
31525-32205 edid: field: "Physical size: 34x27cm"
32245-32565 edid: field: "Gamma: 2.20"
37805-38125 edid: field: "DPMS support: standby, active off"
37805-38125 edid: field: "Generalized timing formula: not supported"
38165-46885 edid: section: "Color characteristics"
38165-46885 edid: field: "Chromacity red: X 0.633, Y 0.354"
38165-46885 edid: field: "Chromacity green: X 0.289, Y 0.598"
38165-46885 edid: field: "Chromacity blue: X 0.145, Y 0.106"
38165-46885 edid: field: "Chromacity white: X 0.305, Y 0.336"
46925-47965 edid: section: "Established timings"
46925-47965 edid: field: "Supported established modes: 720x400@70Hz, 640x480@60Hz, 640x480@67Hz, 640x480@72Hz, 640x480@75Hz, 800x600@56Hz, 800x600@60Hz, 800x600@72Hz, 800x600@75Hz, 832x624@75Hz, 1024x768@60Hz, 1024x768@70Hz, 1024x768@75Hz, 1280x1024@75Hz"
48005-64085 edid: section: "Standard timings"
48005-64085 edid: field: "Supported standard modes: 1280x1024@60Hz"
64125-80965 edid: section: "Preferred timing descriptor"
64125-64805 edid: field: "Pixel clock: 108.00 MHz"
70045-71085 edid: field: "Horizontal active: 1280, blanking: 408"
71125-72165 edid: field: "Vertical active: 1024, blanking: 42"
72205-78805 edid: field: "Horizontal sync offset: 48, pulse width: 112, Vertical sync offset: 1, pulse width: 3" "HSync off: 48, pw: 112, VSync off: 1, pw: 3"
78845-79885 edid: field: "Physical size: 338x270mm"
79925-80245 edid: field: "Horizontal border: 0 pixels"
80285-80605 edid: field: "Vertical border: 0 lines"
80645-80965 edid: field: "Flags: sync type digital separate (Vsync polarity positive, Hsync polarity positive)"
86165-86845 edid: field: "Flag"
86885-87205 edid: field: "Flag (reserved)"
87245-87565 edid: field: "Tag: FD"
87605-87925 edid: field: "Flag"
86165-102725 edid: section: "Monitor range limits"
87965-88285 edid: field: "Minimum vertical rate: 56Hz" "VSync >= 56Hz"
88325-88645 edid: field: "Maximum vertical rate: 75Hz" "VSync <= 75Hz"
88685-89005 edid: field: "Minimum horizontal rate: 24kHz" "HSync >= 24kHz"
93965-94285 edid: field: "Maximum horizontal rate: 80kHz" "HSync <= 80kHz"
94325-94645 edid: field: "Maximum pixel clock: 140MHz" "PixClk <= 140MHz"
94685-95005 edid: field: "Secondary timing formula unsupported" "2nd GTF: no"
95045-102725 edid: field: "Padding"
102765-103445 edid: field: "Flag"
103485-103805 edid: field: "Flag (reserved)"
103845-104165 edid: field: "Tag: FC"
104205-104525 edid: field: "Flag"
102765-117685 edid: section: "Monitor name"
104565-117685 edid: field: "Acer AL711"
117725-118405 edid: field: "Flag"
118445-118765 edid: field: "Flag (reserved)"
118805-119125 edid: field: "Tag: FF"
124445-124765 edid: field: "Flag"
117725-134605 edid: section: "Serial number"
124805-134605 edid: field: "ET7013010029E"
134645-134965 edid: field: "Extensions present: 1"
135005-135325 edid: field: "Checksum: 193 (OK)"
145000-145680 edid: section: "Offset: 128" "O: 128" "128"
145841-146161 edid: section: "Extension: 1" "X: 1" "1"
146201-146521 edid: section: "Extensions Tag" "Tag"
146561-146881 edid: section: "Version"
146561-146881 edid: field: "3"
146921-147241 edid: section: "DTD offset"
146921-147241 edid: field: "27"
147281-147601 edid: section: "Format support | DTD count"
147281-147601 edid: field: "Underscan: no, Basic Audio, YCbCr: 422+444, DTDs: 1"
147641-170121 edid: section: "Data block collection"
147641-147961 edid: field: "1: Audio Data Block" "Audio"
148001-149041 edid: field: "Format: 1 (LPCM) Channels: 2 Rates: 32 44 48 Extra: [07]"
152961-153281 edid: field: "4: Speacker Allocation Data Block" "SADB"
153321-154361 edid: field: "Speakers: FL/FR"
154401-154721 edid: field: "3: Vendor Specific Data Block" "VSDB"
154761-162401 edid: field: "OUI: 00 0C 03 (HDMI Licensing, LLC), PhyAddr: 1.0.0.0, [80 21]"
162441-162761 edid: field: "2: Video Data Block" "Video"
162801-163841 edid: field: "VIC: 1, 16, 4 (Native)"
169081-169761 edid: field: "7: Extended, 0: Video Capability Data Block" "Ext: VCDB"
169801-170121 edid: field: "0F"
170161-183801 edid: section: "DTD"
170161-183801 edid: section: "Preferred timing descriptor"
170161-170841 edid: field: "Pixel clock: 74.25 MHz"
170881-171921 edid: field: "Horizontal active: 1280, blanking: 370"
173961-175001 edid: field: "Vertical active: 720, blanking: 30"
175041-176441 edid: field: "Horizontal sync offset: 110, pulse width: 40, Vertical sync offset: 5, pulse width: 5" "HSync off: 110, pw: 40, VSync off: 5, pw: 5"
176481-182721 edid: field: "Physical size: 129x73mm"
182761-183081 edid: field: "Horizontal border: 0 pixels"
183121-183441 edid: field: "Vertical border: 0 lines"
183481-183801 edid: field: "Flags: sync type digital separate (Vsync polarity positive, Hsync polarity positive)"
183841-264521 edid: section: "Padding"
264561-264881 edid: field: "Checksum: 191 (OK)"
