13724-14404 edid: sections: "Offset: 0" "O: 0" "0"
14565-14885 edid: sections: "EDID"
14925-17765 edid: sections: "Header"
14925-17765 edid: fields: "Header pattern"
21685-22365 edid: fields: "ABO (Alcatel Bell)"
22405-23085 edid: fields: "Product 0x6781"
23125-24525 edid: fields: "Serial 670"
29725-30405 edid: fields: "Manufactured week 1, 2003" "week 1, 2003"
21685-30405 edid: sections: "Vendor/product"
30445-31125 edid: sections: "EDID Version"
30445-30765 edid: fields: "Version 1"
30805-31125 edid: fields: "Revision 3"
31165-38125 edid: sections: "Basic display"
31165-31485 edid: fields: "Video input: VESA DFP 1."
31525-32205 edid: fields: "Physical size: 34x27cm"
32245-32565 edid: fields: "Gamma: 2.20"
37805-38125 edid: fields: "DPMS support: standby, active off"
37805-38125 edid: fields: "Generalized timing formula: not supported"
38165-46885 edid: sections: "Color characteristics"
38165-46885 edid: fields: "Chromacity red: X 0.633, Y 0.354"
38165-46885 edid: fields: "Chromacity green: X 0.289, Y 0.598"
38165-46885 edid: fields: "Chromacity blue: X 0.145, Y 0.106"
38165-46885 edid: fields: "Chromacity white: X 0.305, Y 0.336"
46925-47965 edid: sections: "Established timings"
46925-47965 edid: fields: "Supported established modes: 720x400@70Hz, 640x480@60Hz, 640x480@67Hz, 640x480@72Hz, 640x480@75Hz, 800x600@56Hz, 800x600@60Hz, 800x600@72Hz, 800x600@75Hz, 832x624@75Hz, 1024x768@60Hz, 1024x768@70Hz, 1024x768@75Hz, 1280x1024@75Hz"
48005-64085 edid: sections: "Standard timings"
48005-64085 edid: fields: "Supported standard modes: 1280x1024@60Hz"
64125-80965 edid: sections: "Preferred timing descriptor"
64125-64805 edid: fields: "Pixel clock: 108.00 MHz"
70045-71085 edid: fields: "Horizontal active: 1280, blanking: 408"
71125-72165 edid: fields: "Vertical active: 1024, blanking: 42"
72205-78805 edid: fields: "Horizontal sync offset: 48, pulse width: 112, Vertical sync offset: 1, pulse width: 3" "HSync off: 48, pw: 112, VSync off: 1, pw: 3"
78845-79885 edid: fields: "Physical size: 338x270mm"
79925-80245 edid: fields: "Horizontal border: 0 pixels"
80285-80605 edid: fields: "Vertical border: 0 lines"
80645-80965 edid: fields: "Flags: sync type digital separate (Vsync polarity positive, Hsync polarity positive)"
86165-86845 edid: fields: "Flag"
86885-87205 edid: fields: "Flag (reserved)"
87245-87565 edid: fields: "Tag: FD"
87605-87925 edid: fields: "Flag"
86165-102725 edid: sections: "Monitor range limits"
87965-88285 edid: fields: "Minimum vertical rate: 56Hz" "VSync >= 56Hz"
88325-88645 edid: fields: "Maximum vertical rate: 75Hz" "VSync <= 75Hz"
88685-89005 edid: fields: "Minimum horizontal rate: 24kHz" "HSync >= 24kHz"
93965-94285 edid: fields: "Maximum horizontal rate: 80kHz" "HSync <= 80kHz"
94325-94645 edid: fields: "Maximum pixel clock: 140MHz" "PixClk <= 140MHz"
94685-95005 edid: fields: "Secondary timing formula unsupported" "2nd GTF: no"
95045-102725 edid: fields: "Padding"
102765-103445 edid: fields: "Flag"
103485-103805 edid: fields: "Flag (reserved)"
103845-104165 edid: fields: "Tag: FC"
104205-104525 edid: fields: "Flag"
102765-117685 edid: sections: "Monitor name"
104565-117685 edid: fields: "Acer AL711"
117725-118405 edid: fields: "Flag"
118445-118765 edid: fields: "Flag (reserved)"
118805-119125 edid: fields: "Tag: FF"
124445-124765 edid: fields: "Flag"
117725-134605 edid: sections: "Serial number"
124805-134605 edid: fields: "ET7013010029E"
134645-134965 edid: fields: "Extensions present: 1"
135005-135325 edid: fields: "Checksum: 193 (OK)"
145000-145680 edid: sections: "Offset: 128" "O: 128" "128"
145841-146161 edid: sections: "Extension: 1" "X: 1" "1"
146201-146521 edid: sections: "Extensions Tag" "Tag"
146561-146881 edid: sections: "Version"
146561-146881 edid: fields: "3"
146921-147241 edid: sections: "DTD offset"
146921-147241 edid: fields: "27"
147281-147601 edid: sections: "Format support | DTD count"
147281-147601 edid: fields: "Underscan: no, Basic Audio, YCbCr: 422+444, DTDs: 1"
147641-170121 edid: sections: "Data block collection"
147641-147961 edid: fields: "1: Audio Data Block" "Audio"
148001-149041 edid: fields: "Format: 1 (LPCM) Channels: 2 Rates: 32 44 48 Extra: [07]"
152961-153281 edid: fields: "4: Speacker Allocation Data Block" "SADB"
153321-154361 edid: fields: "Speakers: FL/FR"
154401-154721 edid: fields: "3: Vendor Specific Data Block" "VSDB"
154761-162401 edid: fields: "OUI: 00 0C 03 (HDMI Licensing, LLC), PhyAddr: 1.0.0.0, [80 21]"
162441-162761 edid: fields: "2: Video Data Block" "Video"
162801-163841 edid: fields: "VIC: 1, 16, 4 (Native)"
169081-169761 edid: fields: "7: Extended, 0: Video Capability Data Block" "Ext: VCDB"
169801-170121 edid: fields: "0F"
170161-183801 edid: sections: "DTD"
170161-183801 edid: sections: "Preferred timing descriptor"
170161-170841 edid: fields: "Pixel clock: 74.25 MHz"
170881-171921 edid: fields: "Horizontal active: 1280, blanking: 370"
173961-175001 edid: fields: "Vertical active: 720, blanking: 30"
175041-176441 edid: fields: "Horizontal sync offset: 110, pulse width: 40, Vertical sync offset: 5, pulse width: 5" "HSync off: 110, pw: 40, VSync off: 5, pw: 5"
176481-182721 edid: fields: "Physical size: 129x73mm"
182761-183081 edid: fields: "Horizontal border: 0 pixels"
183121-183441 edid: fields: "Vertical border: 0 lines"
183481-183801 edid: fields: "Flags: sync type digital separate (Vsync polarity positive, Hsync polarity positive)"
183841-264521 edid: sections: "Padding"
264561-264881 edid: fields: "Checksum: 191 (OK)"
