3444-6497 edid: fields: "Header pattern"
6558-7289 edid: fields: "SAM (Samsung Electric Company)"
7351-8068 edid: fields: "Product 0x0508"
8129-9620 edid: fields: "Serial 0"
9682-10499 edid: fields: "Manufactured week 48, 2008"
10562-10889 edid: fields: "Version 1"
11006-11333 edid: fields: "Revision 3"
11394-11721 edid: fields: "Signal level standard: 01"
11394-11721 edid: fields: "Supported syncs: separate syncs"
11782-12500 edid: fields: "Physical size: 88x50cm"
12561-12888 edid: fields: "Gamma: 2.20"
12950-13279 edid: fields: "DPMS support: active off"
12950-13279 edid: fields: "Display type: RGB color"
12950-13279 edid: fields: "Generalized timing formula: not supported"
13339-17165 edid: fields: "Chromacity red: X 0.640, Y 0.330"
13339-17165 edid: fields: "Chromacity green: X 0.297, Y 0.598"
13339-17165 edid: fields: "Chromacity blue: X 0.150, Y 0.060"
13339-17165 edid: fields: "Chromacity white: X 0.312, Y 0.328"
17226-18329 edid: fields: "Supported established modes: 720x400@70Hz, 640x480@60Hz, 640x480@67Hz, 640x480@72Hz, 640x480@75Hz, 800x600@60Hz, 800x600@72Hz, 800x600@75Hz, 832x624@75Hz, 1024x768@60Hz, 1024x768@70Hz, 1024x768@75Hz, 1280x1024@75Hz, 1152x870@75Hz"
18390-24557 edid: fields: "Supported standard modes: 1152x864@75Hz, 1280x800@60Hz, 1280x960@60Hz, 1280x1024@60Hz, 1440x900@60Hz, 1440x900@75Hz, 1680x1050@60Hz"
24618-25336 edid: fields: "Pixel clock: 148.50 MHz"
25397-26500 edid: fields: "Horizontal active: 1920"
25397-26500 edid: fields: "Horizontal blanking: 280"
26561-27673 edid: fields: "Vertical active: 1080"
26561-27673 edid: fields: "Vertical blanking: 45"
27735-29226 edid: fields: "Horizontal sync offset: 88"
27735-29226 edid: fields: "Horizontal sync pulse width: 44"
27735-29226 edid: fields: "Vertical sync offset: 4"
27735-29226 edid: fields: "Vertical sync pulse width: 5"
29287-30400 edid: fields: "Physical size: 886x498mm"
30461-30789 edid: fields: "Horizontal border: 0 pixels"
30850-31177 edid: fields: "Vertical border: 0 lines"
31238-31563 edid: fields: "Flags: sync type digital separate (Vsync polarity positive, Hsync polarity positive)"
31626-32345 edid: fields: "Pixel clock: 85.50 MHz"
32408-33516 edid: fields: "Horizontal active: 1360"
32408-33516 edid: fields: "Horizontal blanking: 432"
33577-34686 edid: fields: "Vertical active: 768"
33577-34686 edid: fields: "Vertical blanking: 27"
34747-36239 edid: fields: "Horizontal sync offset: 64"
34747-36239 edid: fields: "Horizontal sync pulse width: 112"
34747-36239 edid: fields: "Vertical sync offset: 3"
34747-36239 edid: fields: "Vertical sync pulse width: 6"
36300-37414 edid: fields: "Physical size: 886x498mm"
37476-37803 edid: fields: "Horizontal border: 0 pixels"
37864-38191 edid: fields: "Vertical border: 0 lines"
38252-38579 edid: fields: "Flags: sync type digital separate (Vsync polarity positive, Hsync polarity positive)"
40594-40921 edid: fields: "Minimum vertical rate: 60Hz"
40982-41309 edid: fields: "Maximum vertical rate: 75Hz"
41370-41697 edid: fields: "Minimum horizontal rate: 30kHz"
41758-42088 edid: fields: "Maximum horizontal rate: 81kHz"
42149-42474 edid: fields: "Maximum pixel clock: 150MHz"
45645-52606 edid: fields: "SAMSUNG"
52667-52994 edid: fields: "Extensions present: 0"
53055-53382 edid: fields: "Checksum: 155 (OK)"
