3444-6497 edid: field: "Header pattern"
6558-7289 edid: field: "SAM (Samsung Electric Company)"
7351-8068 edid: field: "Product 0x0508"
8129-9620 edid: field: "Serial 0"
9682-10499 edid: field: "Manufactured week 48, 2008" "week 48, 2008"
10562-10889 edid: field: "Version 1"
11006-11333 edid: field: "Revision 3"
11394-11721 edid: field: "Signal level standard: 01"
11394-11721 edid: field: "Supported syncs: separate syncs"
11782-12500 edid: field: "Physical size: 88x50cm"
12561-12888 edid: field: "Gamma: 2.20"
12950-13279 edid: field: "DPMS support: active off"
12950-13279 edid: field: "Display type: RGB color"
12950-13279 edid: field: "Generalized timing formula: not supported"
13339-17165 edid: field: "Chromacity red: X 0.640, Y 0.330"
13339-17165 edid: field: "Chromacity green: X 0.297, Y 0.598"
13339-17165 edid: field: "Chromacity blue: X 0.150, Y 0.060"
13339-17165 edid: field: "Chromacity white: X 0.312, Y 0.328"
17226-18329 edid: field: "Supported established modes: 720x400@70Hz, 640x480@60Hz, 640x480@67Hz, 640x480@72Hz, 640x480@75Hz, 800x600@60Hz, 800x600@72Hz, 800x600@75Hz, 832x624@75Hz, 1024x768@60Hz, 1024x768@70Hz, 1024x768@75Hz, 1280x1024@75Hz, 1152x870@75Hz"
18390-24557 edid: field: "Supported standard modes: 1152x864@75Hz, 1280x800@60Hz, 1280x960@60Hz, 1280x1024@60Hz, 1440x900@60Hz, 1440x900@75Hz, 1680x1050@60Hz"
24618-25336 edid: field: "Pixel clock: 148.50 MHz"
25397-26500 edid: field: "Horizontal active: 1920, blanking: 280"
26561-27673 edid: field: "Vertical active: 1080, blanking: 45"
27735-29226 edid: field: "Horizontal sync offset: 88, pulse width: 44, Vertical sync offset: 4, pulse width: 5" "HSync off: 88, pw: 44, VSync off: 4, pw: 5"
29287-30400 edid: field: "Physical size: 886x498mm"
30461-30789 edid: field: "Horizontal border: 0 pixels"
30850-31177 edid: field: "Vertical border: 0 lines"
31238-31563 edid: field: "Flags: sync type digital separate (Vsync polarity positive, Hsync polarity positive)"
31626-32345 edid: field: "Pixel clock: 85.50 MHz"
32408-33516 edid: field: "Horizontal active: 1360, blanking: 432"
33577-34686 edid: field: "Vertical active: 768, blanking: 27"
34747-36239 edid: field: "Horizontal sync offset: 64, pulse width: 112, Vertical sync offset: 3, pulse width: 6" "HSync off: 64, pw: 112, VSync off: 3, pw: 6"
36300-37414 edid: field: "Physical size: 886x498mm"
37476-37803 edid: field: "Horizontal border: 0 pixels"
37864-38191 edid: field: "Vertical border: 0 lines"
38252-38579 edid: field: "Flags: sync type digital separate (Vsync polarity positive, Hsync polarity positive)"
38640-39356 edid: field: "Flag"
39417-39744 edid: field: "Flag (reserved)"
39805-40138 edid: field: "Tag: FD"
40199-40531 edid: field: "Flag"
40594-40921 edid: field: "Minimum vertical rate: 60Hz" "VSync >= 60Hz"
40982-41309 edid: field: "Maximum vertical rate: 75Hz" "VSync <= 75Hz"
41370-41697 edid: field: "Minimum horizontal rate: 30kHz" "HSync >= 30kHz"
41758-42088 edid: field: "Maximum horizontal rate: 81kHz" "HSync <= 81kHz"
42149-42474 edid: field: "Maximum pixel clock: 150MHz" "PixClk <= 150MHz"
42537-42865 edid: field: "Secondary timing formula unsupported" "2nd GTF: no"
42926-45584 edid: field: "Padding"
45645-46366 edid: field: "Flag"
46427-46755 edid: field: "Flag (reserved)"
46816-47148 edid: field: "Tag: FC"
47209-47545 edid: field: "Flag"
47606-52606 edid: field: "SAMSUNG"
52667-52994 edid: field: "Extensions present: 0"
53055-53382 edid: field: "Checksum: 155 (OK)"
