1041-1449 edid: sections: "EDID"
1970-2839 edid: sections: "Offset: 0" "O: 0" "0"
2964-3372 edid: sections: "EDID"
3424-6555 edid: sections: "Header"
3424-6555 edid: fields: "Header pattern"
6615-7330 edid: fields: "SAM (Samsung Electric Company)"
7392-8107 edid: fields: "Product 0x02b5"
8168-9658 edid: fields: "Serial HU24"
9721-10442 edid: fields: "Manufactured week 1, 2008" "week 1, 2008"
6615-10442 edid: sections: "Vendor/product"
10504-11217 edid: sections: "EDID Version"
10504-10831 edid: fields: "Version 1"
10892-11217 edid: fields: "Revision 3"
11280-13157 edid: sections: "Basic display"
11280-11606 edid: fields: "Signal level standard: 00"
11280-11606 edid: fields: "Supported syncs: separate syncs, composite syncs, sync on green"
11667-12382 edid: fields: "Physical size: 52x32cm"
12443-12771 edid: fields: "Gamma: 2.60"
12832-13157 edid: fields: "DPMS support: active off"
12832-13157 edid: fields: "Display type: RGB color"
12832-13157 edid: fields: "Generalized timing formula: not supported"
13220-17040 edid: sections: "Color characteristics"
13220-17040 edid: fields: "Chromacity red: X 0.653, Y 0.337"
13220-17040 edid: fields: "Chromacity green: X 0.293, Y 0.605"
13220-17040 edid: fields: "Chromacity blue: X 0.144, Y 0.075"
13220-17040 edid: fields: "Chromacity white: X 0.312, Y 0.328"
17101-18203 edid: sections: "Established timings"
17101-18203 edid: fields: "Supported established modes: 720x400@70Hz, 640x480@60Hz, 640x480@67Hz, 640x480@72Hz, 640x480@75Hz, 800x600@56Hz, 800x600@60Hz, 800x600@72Hz, 800x600@75Hz, 832x624@75Hz, 1024x768@60Hz, 1024x768@70Hz, 1024x768@75Hz, 1280x1024@75Hz, 1152x870@75Hz"
18264-24409 edid: sections: "Standard timings"
18264-24409 edid: fields: "Supported standard modes: 1600x1200@60Hz, 1280x1024@60Hz, 1280x960@60Hz, 1152x864@75Hz"
24470-31391 edid: sections: "Preferred timing descriptor"
24470-25185 edid: fields: "Pixel clock: 154.00 MHz"
25246-26348 edid: fields: "Horizontal active: 1920, blanking: 160"
26409-27511 edid: fields: "Vertical active: 1200, blanking: 35"
27574-29065 edid: fields: "Horizontal sync offset: 48, pulse width: 32, Vertical sync offset: 3, pulse width: 6" "HSync off: 48, pw: 32, VSync off: 3, pw: 6"
29126-30228 edid: fields: "Physical size: 518x324mm"
30289-30618 edid: fields: "Horizontal border: 0 pixels"
30678-31005 edid: fields: "Vertical border: 0 lines"
31066-31391 edid: fields: "Flags: sync type digital separate (Vsync polarity negative, Hsync polarity positive)"
31454-32168 edid: fields: "Flag"
32229-32556 edid: fields: "Flag (reserved)"
32617-32944 edid: fields: "Tag: FD"
33005-33332 edid: fields: "Flag"
31454-38375 edid: sections: "Monitor range limits"
33393-33720 edid: fields: "Minimum vertical rate: 56Hz" "VSync >= 56Hz"
33781-34108 edid: fields: "Maximum vertical rate: 75Hz" "VSync <= 75Hz"
34169-34496 edid: fields: "Minimum horizontal rate: 30kHz" "HSync >= 30kHz"
34557-34884 edid: fields: "Maximum horizontal rate: 81kHz" "HSync <= 81kHz"
34945-35271 edid: fields: "Maximum pixel clock: 170MHz" "PixClk <= 170MHz"
35332-35659 edid: fields: "Secondary timing formula unsupported" "2nd GTF: no"
35720-38375 edid: fields: "Padding"
38436-39152 edid: fields: "Flag"
39213-39538 edid: fields: "Flag (reserved)"
39600-39927 edid: fields: "Tag: FC"
39988-40314 edid: fields: "Flag"
38436-45359 edid: sections: "Monitor name"
40377-45359 edid: fields: "SyncMaster"
45420-46135 edid: fields: "Flag"
46196-46523 edid: fields: "Flag (reserved)"
46585-46912 edid: fields: "Tag: FF"
46973-47300 edid: fields: "Flag"
45420-52348 edid: sections: "Serial number"
47361-52348 edid: fields: "HS1Q102936"
52409-52736 edid: fields: "Extensions present: 0"
52797-53122 edid: fields: "Checksum: 64 (OK)"
