1041-1449 edid: section: "EDID"
1970-2839 edid: section: "Offset: 0" "O: 0" "0"
2964-3372 edid: section: "EDID"
3424-6555 edid: section: "Header"
3424-6555 edid: field: "Header pattern"
6615-7330 edid: field: "SAM (Samsung Electric Company)"
7392-8107 edid: field: "Product 0x02b5"
8168-9658 edid: field: "Serial HU24"
9721-10442 edid: field: "Manufactured week 1, 2008" "week 1, 2008"
6615-10442 edid: section: "Vendor/product"
10504-11217 edid: section: "EDID Version"
10504-10831 edid: field: "Version 1"
10892-11217 edid: field: "Revision 3"
11280-13157 edid: section: "Basic display"
11280-11606 edid: field: "Signal level standard: 00"
11280-11606 edid: field: "Supported syncs: separate syncs, composite syncs, sync on green"
11667-12382 edid: field: "Physical size: 52x32cm"
12443-12771 edid: field: "Gamma: 2.60"
12832-13157 edid: field: "DPMS support: active off"
12832-13157 edid: field: "Display type: RGB color"
12832-13157 edid: field: "Generalized timing formula: not supported"
13220-17040 edid: section: "Color characteristics"
13220-17040 edid: field: "Chromacity red: X 0.653, Y 0.337"
13220-17040 edid: field: "Chromacity green: X 0.293, Y 0.605"
13220-17040 edid: field: "Chromacity blue: X 0.144, Y 0.075"
13220-17040 edid: field: "Chromacity white: X 0.312, Y 0.328"
17101-18203 edid: section: "Established timings"
17101-18203 edid: field: "Supported established modes: 720x400@70Hz, 640x480@60Hz, 640x480@67Hz, 640x480@72Hz, 640x480@75Hz, 800x600@56Hz, 800x600@60Hz, 800x600@72Hz, 800x600@75Hz, 832x624@75Hz, 1024x768@60Hz, 1024x768@70Hz, 1024x768@75Hz, 1280x1024@75Hz, 1152x870@75Hz"
18264-24409 edid: section: "Standard timings"
18264-24409 edid: field: "Supported standard modes: 1600x1200@60Hz, 1280x1024@60Hz, 1280x960@60Hz, 1152x864@75Hz"
24470-31391 edid: section: "Preferred timing descriptor"
24470-25185 edid: field: "Pixel clock: 154.00 MHz"
25246-26348 edid: field: "Horizontal active: 1920, blanking: 160"
26409-27511 edid: field: "Vertical active: 1200, blanking: 35"
27574-29065 edid: field: "Horizontal sync offset: 48, pulse width: 32, Vertical sync offset: 3, pulse width: 6" "HSync off: 48, pw: 32, VSync off: 3, pw: 6"
29126-30228 edid: field: "Physical size: 518x324mm"
30289-30618 edid: field: "Horizontal border: 0 pixels"
30678-31005 edid: field: "Vertical border: 0 lines"
31066-31391 edid: field: "Flags: sync type digital separate (Vsync polarity negative, Hsync polarity positive)"
31454-32168 edid: field: "Flag"
32229-32556 edid: field: "Flag (reserved)"
32617-32944 edid: field: "Tag: FD"
33005-33332 edid: field: "Flag"
31454-38375 edid: section: "Monitor range limits"
33393-33720 edid: field: "Minimum vertical rate: 56Hz" "VSync >= 56Hz"
33781-34108 edid: field: "Maximum vertical rate: 75Hz" "VSync <= 75Hz"
34169-34496 edid: field: "Minimum horizontal rate: 30kHz" "HSync >= 30kHz"
34557-34884 edid: field: "Maximum horizontal rate: 81kHz" "HSync <= 81kHz"
34945-35271 edid: field: "Maximum pixel clock: 170MHz" "PixClk <= 170MHz"
35332-35659 edid: field: "Secondary timing formula unsupported" "2nd GTF: no"
35720-38375 edid: field: "Padding"
38436-39152 edid: field: "Flag"
39213-39538 edid: field: "Flag (reserved)"
39600-39927 edid: field: "Tag: FC"
39988-40314 edid: field: "Flag"
38436-45359 edid: section: "Monitor name"
40377-45359 edid: field: "SyncMaster"
45420-46135 edid: field: "Flag"
46196-46523 edid: field: "Flag (reserved)"
46585-46912 edid: field: "Tag: FF"
46973-47300 edid: field: "Flag"
45420-52348 edid: section: "Serial number"
47361-52348 edid: field: "HS1Q102936"
52409-52736 edid: field: "Extensions present: 0"
52797-53122 edid: field: "Checksum: 64 (OK)"
