65030-65070 ltc26x7: slave_addr: "Global address" "Global addr" "Glob addr" "GA"
65099-65119 ltc26x7: command: "Write and Power Up DAC" "Write & Power Up" "W&PU"
65119-65139 ltc26x7: address: "DAC B" "B"
65169-65279 ltc26x7: dac_b_voltage: "0.750183V" "0.75V"
143139-143179 ltc26x7: slave_addr: "Global address" "Global addr" "Glob addr" "GA"
143209-143229 ltc26x7: command: "Write and Power Up DAC" "Write & Power Up" "W&PU"
143229-143249 ltc26x7: address: "DAC A" "A"
143279-143388 ltc26x7: dac_a_voltage: "1.347985V" "1.35V"
221224-221264 ltc26x7: slave_addr: "Global address" "Global addr" "Glob addr" "GA"
221297-221317 ltc26x7: command: "Write and Power Up DAC" "Write & Power Up" "W&PU"
221317-221337 ltc26x7: address: "DAC B" "B"
221367-221476 ltc26x7: dac_b_voltage: "0.750183V" "0.75V"
299304-299344 ltc26x7: slave_addr: "Global address" "Global addr" "Glob addr" "GA"
299374-299394 ltc26x7: command: "Write and Power Up DAC" "Write & Power Up" "W&PU"
299394-299414 ltc26x7: address: "DAC A" "A"
299444-299554 ltc26x7: dac_a_voltage: "1.347985V" "1.35V"
377394-377434 ltc26x7: slave_addr: "Global address" "Global addr" "Glob addr" "GA"
377464-377484 ltc26x7: command: "Write and Power Up DAC" "Write & Power Up" "W&PU"
377484-377504 ltc26x7: address: "DAC B" "B"
377534-377643 ltc26x7: dac_b_voltage: "0.750183V" "0.75V"
455546-455586 ltc26x7: slave_addr: "Global address" "Global addr" "Glob addr" "GA"
455616-455636 ltc26x7: command: "Write and Power Up DAC" "Write & Power Up" "W&PU"
455636-455656 ltc26x7: address: "DAC A" "A"
455686-455796 ltc26x7: dac_a_voltage: "1.347985V" "1.35V"
533629-533669 ltc26x7: slave_addr: "Global address" "Global addr" "Glob addr" "GA"
533699-533719 ltc26x7: command: "Write and Power Up DAC" "Write & Power Up" "W&PU"
533719-533739 ltc26x7: address: "DAC B" "B"
533768-533878 ltc26x7: dac_b_voltage: "0.750183V" "0.75V"
611751-611791 ltc26x7: slave_addr: "Global address" "Global addr" "Glob addr" "GA"
611824-611844 ltc26x7: command: "Write and Power Up DAC" "Write & Power Up" "W&PU"
611844-611864 ltc26x7: address: "DAC A" "A"
611894-612003 ltc26x7: dac_a_voltage: "1.347985V" "1.35V"
691948-691988 ltc26x7: slave_addr: "Global address" "Global addr" "Glob addr" "GA"
692018-692038 ltc26x7: command: "Write and Power Up DAC" "Write & Power Up" "W&PU"
692038-692058 ltc26x7: address: "DAC B" "B"
692088-692197 ltc26x7: dac_b_voltage: "0.750183V" "0.75V"
770038-770078 ltc26x7: slave_addr: "Global address" "Global addr" "Glob addr" "GA"
770108-770128 ltc26x7: command: "Write and Power Up DAC" "Write & Power Up" "W&PU"
770128-770148 ltc26x7: address: "DAC A" "A"
770178-770287 ltc26x7: dac_a_voltage: "1.347985V" "1.35V"
848740-848780 ltc26x7: slave_addr: "Global address" "Global addr" "Glob addr" "GA"
848813-848833 ltc26x7: command: "Write and Power Up DAC" "Write & Power Up" "W&PU"
848833-848853 ltc26x7: address: "DAC B" "B"
848883-848992 ltc26x7: dac_b_voltage: "0.750183V" "0.75V"
926865-926905 ltc26x7: slave_addr: "Global address" "Global addr" "Glob addr" "GA"
926935-926955 ltc26x7: command: "Write and Power Up DAC" "Write & Power Up" "W&PU"
926955-926975 ltc26x7: address: "DAC A" "A"
927005-927115 ltc26x7: dac_a_voltage: "1.347985V" "1.35V"
1004970-1005010 ltc26x7: slave_addr: "Global address" "Global addr" "Glob addr" "GA"
1005040-1005060 ltc26x7: command: "Write and Power Up DAC" "Write & Power Up" "W&PU"
1005060-1005080 ltc26x7: address: "DAC B" "B"
1005110-1005219 ltc26x7: dac_b_voltage: "0.750183V" "0.75V"
1083075-1083115 ltc26x7: slave_addr: "Global address" "Global addr" "Glob addr" "GA"
1083144-1083164 ltc26x7: command: "Write and Power Up DAC" "Write & Power Up" "W&PU"
1083164-1083184 ltc26x7: address: "DAC A" "A"
1083217-1083327 ltc26x7: dac_a_voltage: "1.347985V" "1.35V"
1161220-1161260 ltc26x7: slave_addr: "Global address" "Global addr" "Glob addr" "GA"
1161289-1161309 ltc26x7: command: "Write and Power Up DAC" "Write & Power Up" "W&PU"
1161309-1161329 ltc26x7: address: "DAC B" "B"
1161359-1161469 ltc26x7: dac_b_voltage: "0.750183V" "0.75V"
1239287-1239327 ltc26x7: slave_addr: "Global address" "Global addr" "Glob addr" "GA"
1239357-1239377 ltc26x7: command: "Write and Power Up DAC" "Write & Power Up" "W&PU"
1239377-1239397 ltc26x7: address: "DAC A" "A"
1239427-1239537 ltc26x7: dac_a_voltage: "1.347985V" "1.35V"
1317395-1317435 ltc26x7: slave_addr: "Global address" "Global addr" "Glob addr" "GA"
1317465-1317485 ltc26x7: command: "Write and Power Up DAC" "Write & Power Up" "W&PU"
1317485-1317505 ltc26x7: address: "DAC B" "B"
1317534-1317644 ltc26x7: dac_b_voltage: "0.750183V" "0.75V"
1395519-1395559 ltc26x7: slave_addr: "Global address" "Global addr" "Glob addr" "GA"
1395589-1395609 ltc26x7: command: "Write and Power Up DAC" "Write & Power Up" "W&PU"
1395609-1395629 ltc26x7: address: "DAC A" "A"
1395659-1395769 ltc26x7: dac_a_voltage: "1.347985V" "1.35V"
1473597-1473637 ltc26x7: slave_addr: "Global address" "Global addr" "Glob addr" "GA"
1473667-1473687 ltc26x7: command: "Write and Power Up DAC" "Write & Power Up" "W&PU"
1473687-1473707 ltc26x7: address: "DAC B" "B"
1473739-1473849 ltc26x7: dac_b_voltage: "0.750183V" "0.75V"
1551782-1551822 ltc26x7: slave_addr: "Global address" "Global addr" "Glob addr" "GA"
1551852-1551872 ltc26x7: command: "Write and Power Up DAC" "Write & Power Up" "W&PU"
1551872-1551892 ltc26x7: address: "DAC A" "A"
1551922-1552031 ltc26x7: dac_a_voltage: "1.347985V" "1.35V"
1629822-1629862 ltc26x7: slave_addr: "Global address" "Global addr" "Glob addr" "GA"
1629892-1629912 ltc26x7: command: "Write and Power Up DAC" "Write & Power Up" "W&PU"
1629912-1629932 ltc26x7: address: "DAC B" "B"
1629962-1630071 ltc26x7: dac_b_voltage: "0.750183V" "0.75V"
1707976-1708016 ltc26x7: slave_addr: "Global address" "Global addr" "Glob addr" "GA"
1708046-1708066 ltc26x7: command: "Write and Power Up DAC" "Write & Power Up" "W&PU"
1708066-1708086 ltc26x7: address: "DAC A" "A"
1708116-1708226 ltc26x7: dac_a_voltage: "1.347985V" "1.35V"
1786041-1786081 ltc26x7: slave_addr: "Global address" "Global addr" "Glob addr" "GA"
1786111-1786131 ltc26x7: command: "Write and Power Up DAC" "Write & Power Up" "W&PU"
1786131-1786151 ltc26x7: address: "DAC B" "B"
1786181-1786291 ltc26x7: dac_b_voltage: "0.750183V" "0.75V"
1864153-1864193 ltc26x7: slave_addr: "Global address" "Global addr" "Glob addr" "GA"
1864223-1864243 ltc26x7: command: "Write and Power Up DAC" "Write & Power Up" "W&PU"
1864243-1864263 ltc26x7: address: "DAC A" "A"
1864293-1864403 ltc26x7: dac_a_voltage: "1.347985V" "1.35V"
1942256-1942296 ltc26x7: slave_addr: "Global address" "Global addr" "Glob addr" "GA"
1942326-1942346 ltc26x7: command: "Write and Power Up DAC" "Write & Power Up" "W&PU"
1942346-1942366 ltc26x7: address: "DAC B" "B"
1942395-1942505 ltc26x7: dac_b_voltage: "0.750183V" "0.75V"
2020371-2020411 ltc26x7: slave_addr: "Global address" "Global addr" "Glob addr" "GA"
2020441-2020461 ltc26x7: command: "Write and Power Up DAC" "Write & Power Up" "W&PU"
2020461-2020481 ltc26x7: address: "DAC A" "A"
2020511-2020620 ltc26x7: dac_a_voltage: "1.347985V" "1.35V"
2098441-2098481 ltc26x7: slave_addr: "Global address" "Global addr" "Glob addr" "GA"
2098511-2098531 ltc26x7: command: "Write and Power Up DAC" "Write & Power Up" "W&PU"
2098531-2098551 ltc26x7: address: "DAC B" "B"
2098580-2098690 ltc26x7: dac_b_voltage: "0.750183V" "0.75V"
2176575-2176615 ltc26x7: slave_addr: "Global address" "Global addr" "Glob addr" "GA"
2176645-2176665 ltc26x7: command: "Write and Power Up DAC" "Write & Power Up" "W&PU"
2176665-2176685 ltc26x7: address: "DAC A" "A"
2176715-2176825 ltc26x7: dac_a_voltage: "1.347985V" "1.35V"
2254705-2254745 ltc26x7: slave_addr: "Global address" "Global addr" "Glob addr" "GA"
2254778-2254798 ltc26x7: command: "Write and Power Up DAC" "Write & Power Up" "W&PU"
2254798-2254818 ltc26x7: address: "DAC B" "B"
2254848-2254958 ltc26x7: dac_b_voltage: "0.750183V" "0.75V"
2332811-2332851 ltc26x7: slave_addr: "Global address" "Global addr" "Glob addr" "GA"
2332881-2332901 ltc26x7: command: "Write and Power Up DAC" "Write & Power Up" "W&PU"
2332901-2332921 ltc26x7: address: "DAC A" "A"
2332951-2333060 ltc26x7: dac_a_voltage: "1.347985V" "1.35V"
2410863-2410903 ltc26x7: slave_addr: "Global address" "Global addr" "Glob addr" "GA"
2410933-2410953 ltc26x7: command: "Write and Power Up DAC" "Write & Power Up" "W&PU"
2410953-2410973 ltc26x7: address: "DAC B" "B"
2411003-2411112 ltc26x7: dac_b_voltage: "0.750183V" "0.75V"
2489000-2489040 ltc26x7: slave_addr: "Global address" "Global addr" "Glob addr" "GA"
2489070-2489090 ltc26x7: command: "Write and Power Up DAC" "Write & Power Up" "W&PU"
2489090-2489110 ltc26x7: address: "DAC A" "A"
2489140-2489251 ltc26x7: dac_a_voltage: "1.347985V" "1.35V"
2567180-2567220 ltc26x7: slave_addr: "Global address" "Global addr" "Glob addr" "GA"
2567249-2567269 ltc26x7: command: "Write and Power Up DAC" "Write & Power Up" "W&PU"
2567269-2567289 ltc26x7: address: "DAC B" "B"
2567319-2567429 ltc26x7: dac_b_voltage: "0.750183V" "0.75V"
2645182-2645222 ltc26x7: slave_addr: "Global address" "Global addr" "Glob addr" "GA"
2645252-2645272 ltc26x7: command: "Write and Power Up DAC" "Write & Power Up" "W&PU"
2645272-2645292 ltc26x7: address: "DAC A" "A"
2645322-2645431 ltc26x7: dac_a_voltage: "1.347985V" "1.35V"
2723311-2723351 ltc26x7: slave_addr: "Global address" "Global addr" "Glob addr" "GA"
2723381-2723401 ltc26x7: command: "Write and Power Up DAC" "Write & Power Up" "W&PU"
2723401-2723421 ltc26x7: address: "DAC B" "B"
2723451-2723561 ltc26x7: dac_b_voltage: "0.750183V" "0.75V"
2801676-2801716 ltc26x7: slave_addr: "Global address" "Global addr" "Glob addr" "GA"
2801746-2801766 ltc26x7: command: "Write and Power Up DAC" "Write & Power Up" "W&PU"
2801766-2801786 ltc26x7: address: "DAC A" "A"
2801816-2801926 ltc26x7: dac_a_voltage: "1.347985V" "1.35V"
2879526-2879566 ltc26x7: slave_addr: "Global address" "Global addr" "Glob addr" "GA"
2879596-2879616 ltc26x7: command: "Write and Power Up DAC" "Write & Power Up" "W&PU"
2879616-2879636 ltc26x7: address: "DAC B" "B"
2879665-2879775 ltc26x7: dac_b_voltage: "0.750183V" "0.75V"
2957670-2957710 ltc26x7: slave_addr: "Global address" "Global addr" "Glob addr" "GA"
2957740-2957760 ltc26x7: command: "Write and Power Up DAC" "Write & Power Up" "W&PU"
2957760-2957780 ltc26x7: address: "DAC A" "A"
2957810-2957920 ltc26x7: dac_a_voltage: "1.347985V" "1.35V"
3035750-3035790 ltc26x7: slave_addr: "Global address" "Global addr" "Glob addr" "GA"
3035823-3035843 ltc26x7: command: "Write and Power Up DAC" "Write & Power Up" "W&PU"
3035843-3035863 ltc26x7: address: "DAC B" "B"
3035893-3036003 ltc26x7: dac_b_voltage: "0.750183V" "0.75V"
3113828-3113868 ltc26x7: slave_addr: "Global address" "Global addr" "Glob addr" "GA"
3113898-3113918 ltc26x7: command: "Write and Power Up DAC" "Write & Power Up" "W&PU"
3113918-3113938 ltc26x7: address: "DAC A" "A"
3113968-3114077 ltc26x7: dac_a_voltage: "1.347985V" "1.35V"
3192560-3192600 ltc26x7: slave_addr: "Global address" "Global addr" "Glob addr" "GA"
3192630-3192650 ltc26x7: command: "Write and Power Up DAC" "Write & Power Up" "W&PU"
3192650-3192670 ltc26x7: address: "DAC B" "B"
3192700-3192809 ltc26x7: dac_b_voltage: "0.750183V" "0.75V"
3270680-3270720 ltc26x7: slave_addr: "Global address" "Global addr" "Glob addr" "GA"
3270752-3270772 ltc26x7: command: "Write and Power Up DAC" "Write & Power Up" "W&PU"
3270772-3270792 ltc26x7: address: "DAC A" "A"
3270822-3270932 ltc26x7: dac_a_voltage: "1.347985V" "1.35V"
3349445-3349485 ltc26x7: slave_addr: "Global address" "Global addr" "Glob addr" "GA"
3349514-3349534 ltc26x7: command: "Write and Power Up DAC" "Write & Power Up" "W&PU"
3349534-3349554 ltc26x7: address: "DAC B" "B"
3349587-3349697 ltc26x7: dac_b_voltage: "0.750183V" "0.75V"
3427617-3427657 ltc26x7: slave_addr: "Global address" "Global addr" "Glob addr" "GA"
3427687-3427707 ltc26x7: command: "Write and Power Up DAC" "Write & Power Up" "W&PU"
3427707-3427727 ltc26x7: address: "DAC A" "A"
3427757-3427867 ltc26x7: dac_a_voltage: "1.347985V" "1.35V"
3505655-3505695 ltc26x7: slave_addr: "Global address" "Global addr" "Glob addr" "GA"
3505724-3505744 ltc26x7: command: "Write and Power Up DAC" "Write & Power Up" "W&PU"
3505744-3505764 ltc26x7: address: "DAC B" "B"
3505794-3505904 ltc26x7: dac_b_voltage: "0.750183V" "0.75V"
3583759-3583799 ltc26x7: slave_addr: "Global address" "Global addr" "Glob addr" "GA"
3583829-3583849 ltc26x7: command: "Write and Power Up DAC" "Write & Power Up" "W&PU"
3583849-3583869 ltc26x7: address: "DAC A" "A"
3583899-3584009 ltc26x7: dac_a_voltage: "1.347985V" "1.35V"
3661829-3661869 ltc26x7: slave_addr: "Global address" "Global addr" "Glob addr" "GA"
3661899-3661919 ltc26x7: command: "Write and Power Up DAC" "Write & Power Up" "W&PU"
3661919-3661939 ltc26x7: address: "DAC B" "B"
3661969-3662078 ltc26x7: dac_b_voltage: "0.750183V" "0.75V"
3739931-3739971 ltc26x7: slave_addr: "Global address" "Global addr" "Glob addr" "GA"
3740001-3740021 ltc26x7: command: "Write and Power Up DAC" "Write & Power Up" "W&PU"
3740021-3740041 ltc26x7: address: "DAC A" "A"
3740071-3740180 ltc26x7: dac_a_voltage: "1.347985V" "1.35V"
3818078-3818118 ltc26x7: slave_addr: "Global address" "Global addr" "Glob addr" "GA"
3818148-3818168 ltc26x7: command: "Write and Power Up DAC" "Write & Power Up" "W&PU"
3818168-3818188 ltc26x7: address: "DAC B" "B"
3818218-3818328 ltc26x7: dac_b_voltage: "0.750183V" "0.75V"
3896178-3896218 ltc26x7: slave_addr: "Global address" "Global addr" "Glob addr" "GA"
3896248-3896268 ltc26x7: command: "Write and Power Up DAC" "Write & Power Up" "W&PU"
3896268-3896288 ltc26x7: address: "DAC A" "A"
3896318-3896427 ltc26x7: dac_a_voltage: "1.347985V" "1.35V"
3974308-3974348 ltc26x7: slave_addr: "Global address" "Global addr" "Glob addr" "GA"
3974378-3974398 ltc26x7: command: "Write and Power Up DAC" "Write & Power Up" "W&PU"
3974398-3974418 ltc26x7: address: "DAC B" "B"
3974447-3974560 ltc26x7: dac_b_voltage: "0.750183V" "0.75V"
4052400-4052440 ltc26x7: slave_addr: "Global address" "Global addr" "Glob addr" "GA"
4052470-4052490 ltc26x7: command: "Write and Power Up DAC" "Write & Power Up" "W&PU"
4052490-4052510 ltc26x7: address: "DAC A" "A"
4052540-4052650 ltc26x7: dac_a_voltage: "1.347985V" "1.35V"
4130505-4130545 ltc26x7: slave_addr: "Global address" "Global addr" "Glob addr" "GA"
4130575-4130595 ltc26x7: command: "Write and Power Up DAC" "Write & Power Up" "W&PU"
4130595-4130615 ltc26x7: address: "DAC B" "B"
4130645-4130754 ltc26x7: dac_b_voltage: "0.750183V" "0.75V"
4208615-4208655 ltc26x7: slave_addr: "Global address" "Global addr" "Glob addr" "GA"
4208684-4208704 ltc26x7: command: "Write and Power Up DAC" "Write & Power Up" "W&PU"
4208704-4208724 ltc26x7: address: "DAC A" "A"
4208754-4208864 ltc26x7: dac_a_voltage: "1.347985V" "1.35V"
4286714-4286754 ltc26x7: slave_addr: "Global address" "Global addr" "Glob addr" "GA"
4286784-4286804 ltc26x7: command: "Write and Power Up DAC" "Write & Power Up" "W&PU"
4286804-4286824 ltc26x7: address: "DAC B" "B"
4286854-4286964 ltc26x7: dac_b_voltage: "0.750183V" "0.75V"
4364794-4364834 ltc26x7: slave_addr: "Global address" "Global addr" "Glob addr" "GA"
4364864-4364884 ltc26x7: command: "Write and Power Up DAC" "Write & Power Up" "W&PU"
4364884-4364904 ltc26x7: address: "DAC A" "A"
4364934-4365043 ltc26x7: dac_a_voltage: "1.347985V" "1.35V"
4442964-4443004 ltc26x7: slave_addr: "Global address" "Global addr" "Glob addr" "GA"
4443034-4443054 ltc26x7: command: "Write and Power Up DAC" "Write & Power Up" "W&PU"
4443054-4443074 ltc26x7: address: "DAC B" "B"
4443103-4443213 ltc26x7: dac_b_voltage: "0.750183V" "0.75V"
4521029-4521069 ltc26x7: slave_addr: "Global address" "Global addr" "Glob addr" "GA"
4521098-4521118 ltc26x7: command: "Write and Power Up DAC" "Write & Power Up" "W&PU"
4521118-4521138 ltc26x7: address: "DAC A" "A"
4521168-4521278 ltc26x7: dac_a_voltage: "1.347985V" "1.35V"
4599146-4599186 ltc26x7: slave_addr: "Global address" "Global addr" "Glob addr" "GA"
4599216-4599236 ltc26x7: command: "Write and Power Up DAC" "Write & Power Up" "W&PU"
4599236-4599256 ltc26x7: address: "DAC B" "B"
4599285-4599395 ltc26x7: dac_b_voltage: "0.750183V" "0.75V"
4677308-4677348 ltc26x7: slave_addr: "Global address" "Global addr" "Glob addr" "GA"
4677378-4677398 ltc26x7: command: "Write and Power Up DAC" "Write & Power Up" "W&PU"
4677398-4677418 ltc26x7: address: "DAC A" "A"
4677448-4677557 ltc26x7: dac_a_voltage: "1.347985V" "1.35V"
4755341-4755381 ltc26x7: slave_addr: "Global address" "Global addr" "Glob addr" "GA"
4755410-4755430 ltc26x7: command: "Write and Power Up DAC" "Write & Power Up" "W&PU"
4755430-4755450 ltc26x7: address: "DAC B" "B"
4755480-4755593 ltc26x7: dac_b_voltage: "0.750183V" "0.75V"
4833458-4833498 ltc26x7: slave_addr: "Global address" "Global addr" "Glob addr" "GA"
4833528-4833548 ltc26x7: command: "Write and Power Up DAC" "Write & Power Up" "W&PU"
4833548-4833568 ltc26x7: address: "DAC A" "A"
4833598-4833708 ltc26x7: dac_a_voltage: "1.347985V" "1.35V"
4912997-4913037 ltc26x7: slave_addr: "Global address" "Global addr" "Glob addr" "GA"
4913067-4913087 ltc26x7: command: "Write and Power Up DAC" "Write & Power Up" "W&PU"
4913087-4913107 ltc26x7: address: "DAC B" "B"
4913137-4913249 ltc26x7: dac_b_voltage: "0.750183V" "0.75V"
4991167-4991207 ltc26x7: slave_addr: "Global address" "Global addr" "Glob addr" "GA"
4991237-4991257 ltc26x7: command: "Write and Power Up DAC" "Write & Power Up" "W&PU"
4991257-4991277 ltc26x7: address: "DAC A" "A"
4991307-4991417 ltc26x7: dac_a_voltage: "1.347985V" "1.35V"
