133440-221836 dcf77: unknown-bit: "Unknown bit 0: 0" "0"
1140635-1235505 dcf77: unknown-bit: "Unknown bit 1: 0" "0"
2136457-2228964 dcf77: unknown-bit: "Unknown bit 2: 0" "0"
3149034-3335702 dcf77: unknown-bit: "Unknown bit 3: 1" "1"
4141283-4329592 dcf77: unknown-bit: "Unknown bit 4: 1" "1"
5143413-5318713 dcf77: unknown-bit: "Unknown bit 5: 1" "1"
5341993-5369901 dcf77: warning: "Invalid bit timing" "Inv timing" "Inv"
6149910-6240535 dcf77: unknown-bit: "Unknown bit 6: 0" "0"
7142163-7228546 dcf77: unknown-bit: "Unknown bit 7: 0" "0"
8133204-8329367 dcf77: unknown-bit: "Unknown bit 8: 1" "1"
9135716-9232918 dcf77: unknown-bit: "Unknown bit 9: 0" "0"
10150749-10234435 dcf77: unknown-bit: "Unknown bit 10: 0" "0"
11144063-11350869 dcf77: unknown-bit: "Unknown bit 11: 1" "1"
12142678-12231252 dcf77: unknown-bit: "Unknown bit 12: 0" "0"
13158761-13158965 dcf77: warning: "Invalid bit timing" "Inv timing" "Inv"
13159136-13250494 dcf77: unknown-bit: "Unknown bit 13: 0" "0"
14139545-14335341 dcf77: unknown-bit: "Unknown bit 14: 1" "1"
15133672-15279207 dcf77: unknown-bit: "Unknown bit 15: 0" "0"
16121652-16250431 dcf77: unknown-bit: "Unknown bit 16: 0" "0"
17164191-17237481 dcf77: unknown-bit: "Unknown bit 17: 0" "0"
18169617-18250938 dcf77: unknown-bit: "Unknown bit 18: 0" "0"
19135770-19248663 dcf77: unknown-bit: "Unknown bit 19: 0" "0"
20136475-20336952 dcf77: unknown-bit: "Unknown bit 20: 1" "1"
21137675-21255542 dcf77: unknown-bit: "Unknown bit 21: 0" "0"
22142437-22142624 dcf77: warning: "Invalid bit timing" "Inv timing" "Inv"
22142722-22248350 dcf77: unknown-bit: "Unknown bit 22: 0" "0"
23131937-23338630 dcf77: unknown-bit: "Unknown bit 23: 1" "1"
24165192-24242951 dcf77: unknown-bit: "Unknown bit 24: 0" "0"
25159250-25254205 dcf77: unknown-bit: "Unknown bit 25: 0" "0"
26144105-26261429 dcf77: unknown-bit: "Unknown bit 26: 0" "0"
27154210-27258100 dcf77: unknown-bit: "Unknown bit 27: 0" "0"
29153497-29255539 dcf77: raw-bit: "Bit 0: 0" "0"
29153497-29255539 dcf77: start-of-minute: "Start of minute (always 0)" "Start of minute" "SoM"
30150114-30244485 dcf77: raw-bit: "Bit 1: 0" "0"
31149393-31352101 dcf77: raw-bit: "Bit 2: 1" "1"
32153770-32350976 dcf77: raw-bit: "Bit 3: 1" "1"
33149732-33338312 dcf77: raw-bit: "Bit 4: 1" "1"
34153854-34351310 dcf77: raw-bit: "Bit 5: 1" "1"
35144136-35354460 dcf77: raw-bit: "Bit 6: 1" "1"
36152100-36357464 dcf77: raw-bit: "Bit 7: 1" "1"
37145644-37258356 dcf77: raw-bit: "Bit 8: 0" "0"
38154750-38355147 dcf77: raw-bit: "Bit 9: 1" "1"
39158810-39348536 dcf77: raw-bit: "Bit 10: 1" "1"
40150835-40277297 dcf77: raw-bit: "Bit 11: 0" "0"
41151219-41255527 dcf77: raw-bit: "Bit 12: 0" "0"
42150870-42265449 dcf77: raw-bit: "Bit 13: 0" "0"
42296892-42297084 dcf77: warning: "Invalid bit timing" "Inv timing" "Inv"
42297298-42322824 dcf77: warning: "Invalid bit timing" "Inv timing" "Inv"
43162811-43253951 dcf77: raw-bit: "Bit 14: 0" "0"
30150114-43253951 dcf77: special-bit: "Special bits: 00001101111110" "SB: 00001101111110"
44153455-44254820 dcf77: raw-bit: "Bit 15: 0" "0"
44153455-44254820 dcf77: call-bit: "Call bit: not set" "CB: not set"
45161804-45248329 dcf77: raw-bit: "Bit 16: 0" "0"
45161804-45248329 dcf77: summer-time: "Summer time announcement: not active" "Summer time: not active" "Summer time: no" "ST: no"
46156609-46260970 dcf77: raw-bit: "Bit 17: 0" "0"
46156609-46260970 dcf77: cest: "CEST: not in effect" "CEST: no"
46988847-47015150 dcf77: warning: "Invalid bit timing" "Inv timing" "Inv"
47159182-47359412 dcf77: raw-bit: "Bit 18: 1" "1"
47159182-47359412 dcf77: cet: "CET: in effect" "CET: yes"
48188927-48263649 dcf77: raw-bit: "Bit 19: 0" "0"
48188927-48263649 dcf77: leap-second: "Leap second announcement: not active" "Leap second: not active" "Leap second: no" "LS: no"
49161160-49350530 dcf77: raw-bit: "Bit 20: 1" "1"
49161160-49350530 dcf77: start-of-time: "Start of encoded time (always 1)" "Start of encoded time" "SoeT"
50161567-50367882 dcf77: raw-bit: "Bit 21: 1" "1"
51158356-51264389 dcf77: raw-bit: "Bit 22: 0" "0"
52135875-52269151 dcf77: raw-bit: "Bit 23: 0" "0"
53156439-53353661 dcf77: raw-bit: "Bit 24: 1" "1"
54154204-54270905 dcf77: raw-bit: "Bit 25: 0" "0"
55168907-55253942 dcf77: raw-bit: "Bit 26: 0" "0"
56165009-56358233 dcf77: raw-bit: "Bit 27: 1" "1"
50161567-56358233 dcf77: minute: "Minutes: 49" "Min: 49"
56989345-57011555 dcf77: warning: "Invalid bit timing" "Inv timing" "Inv"
57149694-57369207 dcf77: raw-bit: "Bit 28: 1" "1"
57149694-57369207 dcf77: minute-parity: "Minute parity: OK" "Min parity: OK"
57583383-57600115 dcf77: warning: "Invalid bit timing" "Inv timing" "Inv"
58188464-58353234 dcf77: raw-bit: "Bit 29: 1" "1"
59168120-59370583 dcf77: raw-bit: "Bit 30: 1" "1"
60167019-60254626 dcf77: raw-bit: "Bit 31: 0" "0"
61175038-61260999 dcf77: raw-bit: "Bit 32: 0" "0"
62178195-62266826 dcf77: raw-bit: "Bit 33: 0" "0"
63163576-63353950 dcf77: raw-bit: "Bit 34: 1" "1"
58188464-63353950 dcf77: hour: "Hours: 23"
64162548-64352863 dcf77: raw-bit: "Bit 35: 1" "1"
64162548-64352863 dcf77: hour-parity: "Hour parity: OK"
65156714-65360536 dcf77: raw-bit: "Bit 36: 1" "1"
66169235-66274653 dcf77: raw-bit: "Bit 37: 0" "0"
67163391-67260074 dcf77: raw-bit: "Bit 38: 0" "0"
68186357-68367853 dcf77: raw-bit: "Bit 39: 1" "1"
69158026-69264091 dcf77: raw-bit: "Bit 40: 0" "0"
70193072-70261944 dcf77: raw-bit: "Bit 41: 0" "0"
65156714-70261944 dcf77: day: "Day: 9"
71177165-71382173 dcf77: raw-bit: "Bit 42: 1" "1"
72160372-72259036 dcf77: raw-bit: "Bit 43: 0" "0"
73168922-73270840 dcf77: raw-bit: "Bit 44: 0" "0"
71177165-73270840 dcf77: day-of-week: "Day of week: 1 (Monday)" "DoW: 1 (Monday)"
74175942-74373492 dcf77: raw-bit: "Bit 45: 1" "1"
75163241-75272869 dcf77: raw-bit: "Bit 46: 0" "0"
76167361-76270494 dcf77: raw-bit: "Bit 47: 0" "0"
77179583-77270060 dcf77: raw-bit: "Bit 48: 0" "0"
77973648-78018356 dcf77: raw-bit: "Bit 49: 0" "0"
74175942-78018356 dcf77: month: "Month: 1 (January)" "Mon: 1 (January)"
78186436-78270191 dcf77: raw-bit: "Bit 50: 0" "0"
79165888-79286122 dcf77: raw-bit: "Bit 51: 0" "0"
80160082-80372918 dcf77: raw-bit: "Bit 52: 1" "1"
81166877-81272567 dcf77: raw-bit: "Bit 53: 0" "0"
82194701-82288239 dcf77: raw-bit: "Bit 54: 0" "0"
83173464-83376053 dcf77: raw-bit: "Bit 55: 1" "1"
84177056-84272149 dcf77: raw-bit: "Bit 56: 0" "0"
84771293-84806517 dcf77: warning: "Invalid bit timing" "Inv timing" "Inv"
84828276-84846737 dcf77: warning: "Invalid bit timing" "Inv timing" "Inv"
85160876-85272459 dcf77: raw-bit: "Bit 57: 0" "0"
78186436-85272459 dcf77: year: "Year: 24"
86170380-86279748 dcf77: raw-bit: "Bit 58: 0" "0"
86170380-86279748 dcf77: date-parity: "Date parity: OK" "DP: OK"
87164293-87296489 dcf77: raw-bit: "Bit 59: 0" "0"
87164293-87296489 dcf77: warning: "Invalid DCF77 bit: 59" "Invalid bit: 59" "Inv: 59"
89164921-89283919 dcf77: raw-bit: "Bit 0: 0" "0"
89164921-89283919 dcf77: start-of-minute: "Start of minute (always 0)" "Start of minute" "SoM"
89574211-89597614 dcf77: warning: "Invalid bit timing" "Inv timing" "Inv"
90184906-90292947 dcf77: raw-bit: "Bit 1: 0" "0"
91187787-91295455 dcf77: raw-bit: "Bit 2: 0" "0"
92191913-92382391 dcf77: raw-bit: "Bit 3: 1" "1"
93182560-93375940 dcf77: raw-bit: "Bit 4: 1" "1"
94049583-94067956 dcf77: warning: "Invalid bit timing" "Inv timing" "Inv"
94181752-94302565 dcf77: raw-bit: "Bit 5: 0" "0"
95170277-95284991 dcf77: raw-bit: "Bit 6: 0" "0"
96189456-96378025 dcf77: raw-bit: "Bit 7: 1" "1"
97177209-97377681 dcf77: raw-bit: "Bit 8: 1" "1"
98167780-98382422 dcf77: raw-bit: "Bit 9: 1" "1"
99186864-99287669 dcf77: raw-bit: "Bit 10: 0" "0"
99374960-99400671 dcf77: warning: "Invalid bit timing" "Inv timing" "Inv"
100090935-100128079 dcf77: warning: "Invalid bit timing" "Inv timing" "Inv"
100178193-100383281 dcf77: raw-bit: "Bit 11: 1" "1"
