3385868-3816588 dcf77: unknown-bits: "Unknown bit 0: 0" "0"
7451331-7803774 dcf77: unknown-bits: "Unknown bit 1: 0" "0"
11453513-11837491 dcf77: unknown-bits: "Unknown bit 2: 0" "0"
15390315-16260184 dcf77: unknown-bits: "Unknown bit 3: 1" "1"
19412144-19840469 dcf77: unknown-bits: "Unknown bit 4: 0" "0"
23465530-23876573 dcf77: unknown-bits: "Unknown bit 5: 0" "0"
27447136-28226152 dcf77: unknown-bits: "Unknown bit 6: 1" "1"
31394974-31869823 dcf77: unknown-bits: "Unknown bit 7: 0" "0"
35411113-35817715 dcf77: unknown-bits: "Unknown bit 8: 0" "0"
39428525-39795985 dcf77: unknown-bits: "Unknown bit 9: 0" "0"
43412996-44251865 dcf77: unknown-bits: "Unknown bit 10: 1" "1"
51423132-51862491 dcf77: raw-bits: "Bit 0: 0" "0"
51423132-51862491 dcf77: start-of-minute: "Start of minute (always 0)" "Start of minute" "SoM"
55473560-55474303 dcf77: warnings: "Invalid bit timing" "Inv timing" "Inv"
55474957-55840087 dcf77: raw-bits: "Bit 1: 0" "0"
59398818-60286631 dcf77: raw-bits: "Bit 2: 1" "1"
63439979-63824318 dcf77: raw-bits: "Bit 3: 0" "0"
67433969-67862129 dcf77: raw-bits: "Bit 4: 0" "0"
71462911-72251057 dcf77: raw-bits: "Bit 5: 1" "1"
75460488-76300548 dcf77: raw-bits: "Bit 6: 1" "1"
79432933-80246530 dcf77: raw-bits: "Bit 7: 1" "1"
83453813-83905974 dcf77: raw-bits: "Bit 8: 0" "0"
87502688-88233158 dcf77: raw-bits: "Bit 9: 1" "1"
91431659-92217715 dcf77: raw-bits: "Bit 10: 1" "1"
95569385-95839672 dcf77: raw-bits: "Bit 11: 0" "0"
99474929-100319633 dcf77: raw-bits: "Bit 12: 1" "1"
103488123-103880718 dcf77: raw-bits: "Bit 13: 0" "0"
107581200-108320663 dcf77: raw-bits: "Bit 14: 1" "1"
55474957-108320663 dcf77: special-bits: "Special bits: 10101101110010" "SB: 10101101110010"
111511396-111905056 dcf77: raw-bits: "Bit 15: 0" "0"
111511396-111905056 dcf77: call-bit: "Call bit: not set" "CB: not set"
115469239-115872335 dcf77: raw-bits: "Bit 16: 0" "0"
115469239-115872335 dcf77: summer-time: "Summer time announcement: not active" "Summer time: not active" "Summer time: no" "ST: no"
119509402-119891651 dcf77: raw-bits: "Bit 17: 0" "0"
119509402-119891651 dcf77: cest: "CEST: not in effect" "CEST: no"
123448775-124282330 dcf77: raw-bits: "Bit 18: 1" "1"
123448775-124282330 dcf77: cet: "CET: in effect" "CET: yes"
127485503-127867712 dcf77: raw-bits: "Bit 19: 0" "0"
127485503-127867712 dcf77: leap-second: "Leap second announcement: not active" "Leap second: not active" "Leap second: no" "LS: no"
131500364-132260309 dcf77: raw-bits: "Bit 20: 1" "1"
131500364-132260309 dcf77: start-of-time: "Start of encoded time (always 1)" "Start of encoded time" "SoeT"
135473820-135845659 dcf77: raw-bits: "Bit 21: 0" "0"
139501316-139954255 dcf77: raw-bits: "Bit 22: 0" "0"
143496487-144270535 dcf77: raw-bits: "Bit 23: 1" "1"
147520754-147894347 dcf77: raw-bits: "Bit 24: 0" "0"
151578652-151887629 dcf77: raw-bits: "Bit 25: 0" "0"
155506927-155897592 dcf77: raw-bits: "Bit 26: 0" "0"
159499814-159915749 dcf77: raw-bits: "Bit 27: 0" "0"
135473820-159915749 dcf77: minute: "Minutes: 4" "Min: 4"
163533134-164288503 dcf77: raw-bits: "Bit 28: 1" "1"
163533134-164288503 dcf77: minute-parity: "Minute parity: OK" "Min parity: OK"
167462007-167923137 dcf77: raw-bits: "Bit 29: 0" "0"
171493115-171916030 dcf77: raw-bits: "Bit 30: 0" "0"
175450829-175868722 dcf77: raw-bits: "Bit 31: 0" "0"
179515059-179929269 dcf77: raw-bits: "Bit 32: 0" "0"
183445397-183934256 dcf77: raw-bits: "Bit 33: 0" "0"
187494149-187914994 dcf77: raw-bits: "Bit 34: 0" "0"
167462007-187914994 dcf77: hour: "Hours: 0"
191546508-191929553 dcf77: raw-bits: "Bit 35: 0" "0"
191546508-191929553 dcf77: hour-parity: "Hour parity: OK"
195539408-195923269 dcf77: raw-bits: "Bit 36: 0" "0"
199535159-199964022 dcf77: raw-bits: "Bit 37: 0" "0"
203508776-203923381 dcf77: raw-bits: "Bit 38: 0" "0"
207492694-207887851 dcf77: raw-bits: "Bit 39: 0" "0"
211489676-212343292 dcf77: raw-bits: "Bit 40: 1" "1"
215527014-215946915 dcf77: raw-bits: "Bit 41: 0" "0"
195539408-215946915 dcf77: day: "Day: 10"
219519691-219938729 dcf77: raw-bits: "Bit 42: 0" "0"
223529334-224324650 dcf77: raw-bits: "Bit 43: 1" "1"
227504894-227946676 dcf77: raw-bits: "Bit 44: 0" "0"
219519691-227946676 dcf77: day-of-week: "Day of week: 2 (Tuesday)" "DoW: 2 (Tuesday)"
231507648-232321821 dcf77: raw-bits: "Bit 45: 1" "1"
235564907-235896956 dcf77: raw-bits: "Bit 46: 0" "0"
239535357-239943464 dcf77: raw-bits: "Bit 47: 0" "0"
243513053-243923326 dcf77: raw-bits: "Bit 48: 0" "0"
247577651-247996458 dcf77: raw-bits: "Bit 49: 0" "0"
231507648-247996458 dcf77: month: "Month: 1 (January)" "Mon: 1 (January)"
251565880-251946968 dcf77: raw-bits: "Bit 50: 0" "0"
255520379-256370759 dcf77: raw-bits: "Bit 51: 1" "1"
259546807-259965987 dcf77: raw-bits: "Bit 52: 0" "0"
263526601-263990226 dcf77: raw-bits: "Bit 53: 0" "0"
267602457-268338230 dcf77: raw-bits: "Bit 54: 1" "1"
271523110-272012188 dcf77: raw-bits: "Bit 55: 0" "0"
275570004-275923329 dcf77: raw-bits: "Bit 56: 0" "0"
279566985-279935762 dcf77: raw-bits: "Bit 57: 0" "0"
251565880-279935762 dcf77: year: "Year: 12"
283562232-284364536 dcf77: raw-bits: "Bit 58: 1" "1"
283562232-284364536 dcf77: date-parity: "Date parity: OK" "DP: OK"
291617391-291949431 dcf77: raw-bits: "Bit 0: 0" "0"
291617391-291949431 dcf77: start-of-minute: "Start of minute (always 0)" "Start of minute" "SoM"
295582957-295988224 dcf77: raw-bits: "Bit 1: 0" "0"
299586749-299933304 dcf77: raw-bits: "Bit 2: 0" "0"
303551724-303973548 dcf77: raw-bits: "Bit 3: 0" "0"
307580441-307999978 dcf77: raw-bits: "Bit 4: 0" "0"
311536091-311975493 dcf77: raw-bits: "Bit 5: 0" "0"
315564125-316315787 dcf77: raw-bits: "Bit 6: 1" "1"
319553074-320365124 dcf77: raw-bits: "Bit 7: 1" "1"
323570160-324389363 dcf77: raw-bits: "Bit 8: 1" "1"
327541745-328353521 dcf77: raw-bits: "Bit 9: 1" "1"
331579081-332407157 dcf77: raw-bits: "Bit 10: 1" "1"
335582926-336400448 dcf77: raw-bits: "Bit 11: 1" "1"
339520845-339992629 dcf77: raw-bits: "Bit 12: 0" "0"
343578377-343954807 dcf77: raw-bits: "Bit 13: 0" "0"
347614164-348433530 dcf77: raw-bits: "Bit 14: 1" "1"
295582957-348433530 dcf77: special-bits: "Special bits: 10011111100000" "SB: 10011111100000"
351586228-352003609 dcf77: raw-bits: "Bit 15: 0" "0"
351586228-352003609 dcf77: call-bit: "Call bit: not set" "CB: not set"
355560616-356016931 dcf77: raw-bits: "Bit 16: 0" "0"
355560616-356016931 dcf77: summer-time: "Summer time announcement: not active" "Summer time: not active" "Summer time: no" "ST: no"
359612112-360032114 dcf77: raw-bits: "Bit 17: 0" "0"
359612112-360032114 dcf77: cest: "CEST: not in effect" "CEST: no"
363625652-364384985 dcf77: raw-bits: "Bit 18: 1" "1"
363625652-364384985 dcf77: cet: "CET: in effect" "CET: yes"
367571317-367995025 dcf77: raw-bits: "Bit 19: 0" "0"
367571317-367995025 dcf77: leap-second: "Leap second announcement: not active" "Leap second: not active" "Leap second: no" "LS: no"
371617577-372403564 dcf77: raw-bits: "Bit 20: 1" "1"
371617577-372403564 dcf77: start-of-time: "Start of encoded time (always 1)" "Start of encoded time" "SoeT"
375560787-376421342 dcf77: raw-bits: "Bit 21: 1" "1"
379616860-380000588 dcf77: raw-bits: "Bit 22: 0" "0"
383557822-384402456 dcf77: raw-bits: "Bit 23: 1" "1"
387633468-387984065 dcf77: raw-bits: "Bit 24: 0" "0"
391612489-392016700 dcf77: raw-bits: "Bit 25: 0" "0"
395596763-396026523 dcf77: raw-bits: "Bit 26: 0" "0"
399601497-399968440 dcf77: raw-bits: "Bit 27: 0" "0"
375560787-399968440 dcf77: minute: "Minutes: 5" "Min: 5"
403621160-403971653 dcf77: raw-bits: "Bit 28: 0" "0"
403621160-403971653 dcf77: minute-parity: "Minute parity: OK" "Min parity: OK"
407097115-407189139 dcf77: warnings: "Invalid bit timing" "Inv timing" "Inv"
407606483-407987323 dcf77: raw-bits: "Bit 29: 0" "0"
411607088-412028348 dcf77: raw-bits: "Bit 30: 0" "0"
415619209-416016805 dcf77: raw-bits: "Bit 31: 0" "0"
419669003-420024595 dcf77: raw-bits: "Bit 32: 0" "0"
423634271-424031663 dcf77: raw-bits: "Bit 33: 0" "0"
427627901-428185927 dcf77: raw-bits: "Bit 34: 0" "0"
407606483-428185927 dcf77: hour: "Hours: 0"
428884439-429055901 dcf77: raw-bits: "Bit 35: 0" "0"
428884439-429055901 dcf77: hour-parity: "Hour parity: OK"
431640531-432010229 dcf77: raw-bits: "Bit 36: 0" "0"
435599116-436142864 dcf77: raw-bits: "Bit 37: 0" "0"
439675848-439676578 dcf77: warnings: "Invalid bit timing" "Inv timing" "Inv"
439676991-440009011 dcf77: raw-bits: "Bit 38: 0" "0"
443627505-444031934 dcf77: raw-bits: "Bit 39: 0" "0"
446011744-446100720 dcf77: warnings: "Invalid bit timing" "Inv timing" "Inv"
447621737-448134482 dcf77: raw-bits: "Bit 40: 0" "0"
451681593-452387819 dcf77: raw-bits: "Bit 41: 1" "1"
431640531-452387819 dcf77: day: "Day: 20"
455743603-456025399 dcf77: raw-bits: "Bit 42: 0" "0"
459647325-460063634 dcf77: raw-bits: "Bit 43: 0" "0"
463609816-464550866 dcf77: raw-bits: "Bit 44: 1" "1"
455743603-464550866 dcf77: day-of-week: "Day of week: 4 (Thursday)" "DoW: 4 (Thursday)"
467616324-468025437 dcf77: raw-bits: "Bit 45: 0" "0"
471633589-472441190 dcf77: raw-bits: "Bit 46: 1" "1"
475655848-475962334 dcf77: raw-bits: "Bit 47: 0" "0"
479606086-480020294 dcf77: raw-bits: "Bit 48: 0" "0"
483619045-484091176 dcf77: raw-bits: "Bit 49: 0" "0"
467616324-484091176 dcf77: month: "Month: 2 (February)" "Mon: 2 (February)"
487601145-488045980 dcf77: raw-bits: "Bit 50: 0" "0"
491612867-492095105 dcf77: raw-bits: "Bit 51: 0" "0"
495717661-496655762 dcf77: raw-bits: "Bit 52: 1" "1"
499670264-500054926 dcf77: raw-bits: "Bit 53: 0" "0"
503645462-504068682 dcf77: raw-bits: "Bit 54: 0" "0"
507616484-508548693 dcf77: raw-bits: "Bit 55: 1" "1"
511705035-512084523 dcf77: raw-bits: "Bit 56: 0" "0"
515667665-516063273 dcf77: raw-bits: "Bit 57: 0" "0"
487601145-516063273 dcf77: year: "Year: 24"
519682223-520062378 dcf77: raw-bits: "Bit 58: 0" "0"
519682223-520062378 dcf77: date-parity: "Date parity: INVALID!" "DP: INVALID!"
523669762-524507216 dcf77: raw-bits: "Bit 59: 1" "1"
523669762-524507216 dcf77: warnings: "Invalid DCF77 bit: 59" "Invalid bit: 59" "Inv: 59"
531688637-532074328 dcf77: raw-bits: "Bit 0: 0" "0"
531688637-532074328 dcf77: start-of-minute: "Start of minute (always 0)" "Start of minute" "SoM"
535740658-536106970 dcf77: raw-bits: "Bit 1: 0" "0"
539750054-540053730 dcf77: raw-bits: "Bit 2: 0" "0"
543782645-544492433 dcf77: raw-bits: "Bit 3: 1" "1"
547766147-548473713 dcf77: raw-bits: "Bit 4: 1" "1"
551649868-552552519 dcf77: raw-bits: "Bit 5: 1" "1"
555704971-556137468 dcf77: raw-bits: "Bit 6: 0" "0"
559717926-560520374 dcf77: raw-bits: "Bit 7: 1" "1"
563699198-564458576 dcf77: raw-bits: "Bit 8: 1" "1"
567652920-568071041 dcf77: raw-bits: "Bit 9: 0" "0"
571696119-572508034 dcf77: raw-bits: "Bit 10: 1" "1"
575730422-576508328 dcf77: raw-bits: "Bit 11: 1" "1"
578027317-578108236 dcf77: warnings: "Invalid bit timing" "Inv timing" "Inv"
579700357-580098369 dcf77: raw-bits: "Bit 12: 0" "0"
583670687-584154780 dcf77: raw-bits: "Bit 13: 0" "0"
587664417-588126467 dcf77: raw-bits: "Bit 14: 0" "0"
535740658-588126467 dcf77: special-bits: "Special bits: 00011011011100" "SB: 00011011011100"
591651382-592112176 dcf77: raw-bits: "Bit 15: 0" "0"
591651382-592112176 dcf77: call-bit: "Call bit: not set" "CB: not set"
595732864-596114743 dcf77: raw-bits: "Bit 16: 0" "0"
595732864-596114743 dcf77: summer-time: "Summer time announcement: not active" "Summer time: not active" "Summer time: no" "ST: no"
599777822-600100106 dcf77: raw-bits: "Bit 17: 0" "0"
599777822-600100106 dcf77: cest: "CEST: not in effect" "CEST: no"
603761814-604466474 dcf77: raw-bits: "Bit 18: 1" "1"
603761814-604466474 dcf77: cet: "CET: in effect" "CET: yes"
605053313-605227920 dcf77: raw-bits: "Bit 19: 0" "0"
605053313-605227920 dcf77: leap-second: "Leap second announcement: not active" "Leap second: not active" "Leap second: no" "LS: no"
607757188-607757924 dcf77: warnings: "Invalid bit timing" "Inv timing" "Inv"
607758361-608146567 dcf77: raw-bits: "Bit 20: 0" "0"
607758361-608146567 dcf77: warnings: "Start of encoded time != 1" "SoeT != 1"
611729910-612570425 dcf77: raw-bits: "Bit 21: 1" "1"
615837379-616119343 dcf77: raw-bits: "Bit 22: 0" "0"
619757889-620632194 dcf77: raw-bits: "Bit 23: 1" "1"
623801770-624551357 dcf77: raw-bits: "Bit 24: 1" "1"
627685292-628181055 dcf77: raw-bits: "Bit 25: 0" "0"
631694634-632132867 dcf77: raw-bits: "Bit 26: 0" "0"
635679108-636151829 dcf77: raw-bits: "Bit 27: 0" "0"
611729910-636151829 dcf77: minute: "Minutes: 13" "Min: 13"
637349998-637527852 dcf77: raw-bits: "Bit 28: 0" "0"
637349998-637527852 dcf77: minute-parity: "Minute parity: INVALID!" "Min parity: INVALID!"
639732765-640113649 dcf77: raw-bits: "Bit 29: 0" "0"
643739158-644122690 dcf77: raw-bits: "Bit 30: 0" "0"
647713120-648090092 dcf77: raw-bits: "Bit 31: 0" "0"
651704125-652101514 dcf77: raw-bits: "Bit 32: 0" "0"
655717729-656198821 dcf77: raw-bits: "Bit 33: 0" "0"
656307789-656382447 dcf77: warnings: "Invalid bit timing" "Inv timing" "Inv"
659827696-660169786 dcf77: raw-bits: "Bit 34: 0" "0"
639732765-660169786 dcf77: hour: "Hours: 0"
663816502-664215535 dcf77: raw-bits: "Bit 35: 0" "0"
663816502-664215535 dcf77: hour-parity: "Hour parity: OK"
667777248-668144651 dcf77: raw-bits: "Bit 36: 0" "0"
671711307-672238837 dcf77: raw-bits: "Bit 37: 0" "0"
675760442-676215005 dcf77: raw-bits: "Bit 38: 0" "0"
679433154-679547479 dcf77: warnings: "Invalid bit timing" "Inv timing" "Inv"
679791909-680137099 dcf77: raw-bits: "Bit 39: 0" "0"
683722471-684174600 dcf77: raw-bits: "Bit 40: 0" "0"
687750263-688171220 dcf77: raw-bits: "Bit 41: 0" "0"
667777248-688171220 dcf77: day: "Day: 0"
691814611-692615359 dcf77: raw-bits: "Bit 42: 1" "1"
695777091-696153665 dcf77: raw-bits: "Bit 43: 0" "0"
699795658-700173933 dcf77: raw-bits: "Bit 44: 0" "0"
691814611-700173933 dcf77: day-of-week: "Day of week: 1 (Monday)" "DoW: 1 (Monday)"
