318-529 i2c_packet: data: "0x50 RD: 06" "50 RD: 06"
1421-2025 i2c_packet: data: "0x50 WR: 01 [SR] 0x50 RD: 00" "50 WR: 01 [SR] 50 RD: 00"
2881-3403 i2c_packet: data: "0x50 WR: 02 [SR] 0x50 RD: 50" "50 WR: 02 [SR] 50 RD: 50"
4300-4823 i2c_packet: data: "0x50 WR: 03 [SR] 0x50 RD: 00" "50 WR: 03 [SR] 50 RD: 00"
5687-6206 i2c_packet: data: "0x50 WR: 04 [SR] 0x50 RD: F1" "50 WR: 04 [SR] 50 RD: F1"
6980-7503 i2c_packet: data: "0x50 WR: 05 [SR] 0x50 RD: 00" "50 WR: 05 [SR] 50 RD: 00"
7771-8281 i2c_packet: data: "0x50 WR: 06 [SR] 0x50 RD: 4B" "50 WR: 06 [SR] 50 RD: 4B"
8706-9215 i2c_packet: data: "0x50 WR: 07 [SR] 0x50 RD: 00" "50 WR: 07 [SR] 50 RD: 00"
9726-10232 i2c_packet: data: "0x50 WR: 08 [SR] 0x50 RD: F6" "50 WR: 08 [SR] 50 RD: F6"
10647-11155 i2c_packet: data: "0x50 WR: 09 [SR] 0x50 RD: 00" "50 WR: 09 [SR] 50 RD: 00"
11632-12143 i2c_packet: data: "0x50 WR: 0A [SR] 0x50 RD: 00" "50 WR: 0A [SR] 50 RD: 00"
12553-13064 i2c_packet: data: "0x50 WR: 0B [SR] 0x50 RD: 00" "50 WR: 0B [SR] 50 RD: 00"
13540-14054 i2c_packet: data: "0x50 WR: 0C [SR] 0x50 RD: 00" "50 WR: 0C [SR] 50 RD: 00"
14459-14967 i2c_packet: data: "0x50 WR: 0D [SR] 0x50 RD: 00" "50 WR: 0D [SR] 50 RD: 00"
15436-15947 i2c_packet: data: "0x50 WR: 0E [SR] 0x50 RD: 00" "50 WR: 0E [SR] 50 RD: 00"
16346-16855 i2c_packet: data: "0x50 WR: 0F [SR] 0x50 RD: 00" "50 WR: 0F [SR] 50 RD: 00"
17610-18130 i2c_packet: data: "0x50 WR: 10 [SR] 0x50 RD: 00" "50 WR: 10 [SR] 50 RD: 00"
18591-19099 i2c_packet: data: "0x50 WR: 11 [SR] 0x50 RD: 00" "50 WR: 11 [SR] 50 RD: 00"
19591-20095 i2c_packet: data: "0x50 WR: 12 [SR] 0x50 RD: C3" "50 WR: 12 [SR] 50 RD: C3"
20528-21037 i2c_packet: data: "0x50 WR: 13 [SR] 0x50 RD: 50" "50 WR: 13 [SR] 50 RD: 50"
21514-22022 i2c_packet: data: "0x50 WR: 14 [SR] 0x50 RD: 00" "50 WR: 14 [SR] 50 RD: 00"
22430-22939 i2c_packet: data: "0x50 WR: 15 [SR] 0x50 RD: 00" "50 WR: 15 [SR] 50 RD: 00"
23411-23918 i2c_packet: data: "0x50 WR: 16 [SR] 0x50 RD: 9C" "50 WR: 16 [SR] 50 RD: 9C"
24325-24831 i2c_packet: data: "0x50 WR: 17 [SR] 0x50 RD: 40" "50 WR: 17 [SR] 50 RD: 40"
25303-25814 i2c_packet: data: "0x50 WR: 18 [SR] 0x50 RD: 00" "50 WR: 18 [SR] 50 RD: 00"
26204-26713 i2c_packet: data: "0x50 WR: 19 [SR] 0x50 RD: 00" "50 WR: 19 [SR] 50 RD: 00"
27187-27697 i2c_packet: data: "0x50 WR: 1A [SR] 0x50 RD: 3D" "50 WR: 1A [SR] 50 RD: 3D"
28109-28620 i2c_packet: data: "0x50 WR: 1B [SR] 0x50 RD: E8" "50 WR: 1B [SR] 50 RD: E8"
29091-29605 i2c_packet: data: "0x50 WR: 1C [SR] 0x50 RD: 04" "50 WR: 1C [SR] 50 RD: 04"
30007-30513 i2c_packet: data: "0x50 WR: 1D [SR] 0x50 RD: EA" "50 WR: 1D [SR] 50 RD: EA"
30851-31352 i2c_packet: data: "0x50 WR: 1E [SR] 0x50 RD: 27" "50 WR: 1E [SR] 50 RD: 27"
31529-32034 i2c_packet: data: "0x50 WR: 1F [SR] 0x50 RD: 10" "50 WR: 1F [SR] 50 RD: 10"
32405-32914 i2c_packet: data: "0x50 WR: 20 [SR] 0x50 RD: 07" "50 WR: 20 [SR] 50 RD: 07"
33275-33792 i2c_packet: data: "0x50 WR: 21 [SR] 0x50 RD: CB" "50 WR: 21 [SR] 50 RD: CB"
34092-34605 i2c_packet: data: "0x50 WR: 22 [SR] 0x50 RD: 45" "50 WR: 22 [SR] 50 RD: 45"
34982-35504 i2c_packet: data: "0x50 WR: 23 [SR] 0x50 RD: 76" "50 WR: 23 [SR] 50 RD: 76"
35832-36360 i2c_packet: data: "0x50 WR: 24 [SR] 0x50 RD: 00" "50 WR: 24 [SR] 50 RD: 00"
36654-37205 i2c_packet: data: "0x50 WR: 25 [SR] 0x50 RD: 00" "50 WR: 25 [SR] 50 RD: 00"
37575-38086 i2c_packet: data: "0x50 WR: 26 [SR] 0x50 RD: 37" "50 WR: 26 [SR] 50 RD: 37"
38402-38925 i2c_packet: data: "0x50 WR: 27 [SR] 0x50 RD: 2D" "50 WR: 27 [SR] 50 RD: 2D"
39305-39811 i2c_packet: data: "0x50 WR: 28 [SR] 0x50 RD: 01" "50 WR: 28 [SR] 50 RD: 01"
40126-40644 i2c_packet: data: "0x50 WR: 29 [SR] 0x50 RD: 19" "50 WR: 29 [SR] 50 RD: 19"
41003-41538 i2c_packet: data: "0x50 WR: 2A [SR] 0x50 RD: 00" "50 WR: 2A [SR] 50 RD: 00"
41836-42359 i2c_packet: data: "0x50 WR: 2B [SR] 0x50 RD: 00" "50 WR: 2B [SR] 50 RD: 00"
42652-43162 i2c_packet: data: "0x50 WR: 2C [SR] 0x50 RD: 00" "50 WR: 2C [SR] 50 RD: 00"
43569-44096 i2c_packet: data: "0x50 WR: 2D [SR] 0x50 RD: 00" "50 WR: 2D [SR] 50 RD: 00"
44395-44982 i2c_packet: data: "0x50 WR: 2E [SR] 0x50 RD: 00" "50 WR: 2E [SR] 50 RD: 00"
45290-45811 i2c_packet: data: "0x50 WR: 2F [SR] 0x50 RD: 00" "50 WR: 2F [SR] 50 RD: 00"
46178-46688 i2c_packet: data: "0x50 WR: 30 [SR] 0x50 RD: 00" "50 WR: 30 [SR] 50 RD: 00"
46865-47499 i2c_packet: data: "0x50 WR: 31 [SR] 0x50 RD: 00" "50 WR: 31 [SR] 50 RD: 00"
47682-48316 i2c_packet: data: "0x50 WR: 32 [SR] 0x50 RD: 00" "50 WR: 32 [SR] 50 RD: 00"
48498-49213 i2c_packet: data: "0x50 WR: 33 [SR] 0x50 RD: 00" "50 WR: 33 [SR] 50 RD: 00"
49398-50048 i2c_packet: data: "0x50 WR: 34 [SR] 0x50 RD: 00" "50 WR: 34 [SR] 50 RD: 00"
50233-50923 i2c_packet: data: "0x50 WR: 35 [SR] 0x50 RD: 00" "50 WR: 35 [SR] 50 RD: 00"
51105-51774 i2c_packet: data: "0x50 WR: 36 [SR] 0x50 RD: 00" "50 WR: 36 [SR] 50 RD: 00"
51964-52596 i2c_packet: data: "0x50 WR: 37 [SR] 0x50 RD: 00" "50 WR: 37 [SR] 50 RD: 00"
52784-53293 i2c_packet: data: "0x50 WR: 38 [SR] 0x50 RD: 00" "50 WR: 38 [SR] 50 RD: 00"
53562-54070 i2c_packet: data: "0x50 WR: 39 [SR] 0x50 RD: 00" "50 WR: 39 [SR] 50 RD: 00"
54347-54845 i2c_packet: data: "0x50 WR: 3A [SR] 0x50 RD: 00" "50 WR: 3A [SR] 50 RD: 00"
55224-55751 i2c_packet: data: "0x50 WR: 3B [SR] 0x50 RD: 00" "50 WR: 3B [SR] 50 RD: 00"
56045-56568 i2c_packet: data: "0x50 WR: 3C [SR] 0x50 RD: 00" "50 WR: 3C [SR] 50 RD: 00"
56953-57481 i2c_packet: data: "0x50 WR: 3D [SR] 0x50 RD: 00" "50 WR: 3D [SR] 50 RD: 00"
57781-58300 i2c_packet: data: "0x50 WR: 3E [SR] 0x50 RD: 00" "50 WR: 3E [SR] 50 RD: 00"
58669-59192 i2c_packet: data: "0x50 WR: 3F [SR] 0x50 RD: 00" "50 WR: 3F [SR] 50 RD: 00"
59575-60081 i2c_packet: data: "0x50 WR: 40 [SR] 0x50 RD: 00" "50 WR: 40 [SR] 50 RD: 00"
60476-60985 i2c_packet: data: "0x50 WR: 41 [SR] 0x50 RD: 00" "50 WR: 41 [SR] 50 RD: 00"
61298-61834 i2c_packet: data: "0x50 WR: 42 [SR] 0x50 RD: 00" "50 WR: 42 [SR] 50 RD: 00"
62128-62628 i2c_packet: data: "0x50 WR: 43 [SR] 0x50 RD: 00" "50 WR: 43 [SR] 50 RD: 00"
62807-63440 i2c_packet: data: "0x50 WR: 44 [SR] 0x50 RD: 00" "50 WR: 44 [SR] 50 RD: 00"
63621-64255 i2c_packet: data: "0x50 WR: 45 [SR] 0x50 RD: 00" "50 WR: 45 [SR] 50 RD: 00"
64460-65164 i2c_packet: data: "0x50 WR: 46 [SR] 0x50 RD: 00" "50 WR: 46 [SR] 50 RD: 00"
65522-66029 i2c_packet: data: "0x50 WR: 47 [SR] 0x50 RD: 00" "50 WR: 47 [SR] 50 RD: 00"
66470-66990 i2c_packet: data: "0x50 WR: 48 [SR] 0x50 RD: 00" "50 WR: 48 [SR] 50 RD: 00"
67386-67894 i2c_packet: data: "0x50 WR: 49 [SR] 0x50 RD: 00" "50 WR: 49 [SR] 50 RD: 00"
68358-68864 i2c_packet: data: "0x50 WR: 4A [SR] 0x50 RD: 00" "50 WR: 4A [SR] 50 RD: 00"
69034-69663 i2c_packet: data: "0x50 WR: 4B [SR] 0x50 RD: 00" "50 WR: 4B [SR] 50 RD: 00"
69845-70432 i2c_packet: data: "0x50 WR: 4C [SR] 0x50 RD: 00" "50 WR: 4C [SR] 50 RD: 00"
70719-71236 i2c_packet: data: "0x50 WR: 4D [SR] 0x50 RD: 00" "50 WR: 4D [SR] 50 RD: 00"
71516-72023 i2c_packet: data: "0x50 WR: 4E [SR] 0x50 RD: 00" "50 WR: 4E [SR] 50 RD: 00"
72394-72905 i2c_packet: data: "0x50 WR: 4F [SR] 0x50 RD: 00" "50 WR: 4F [SR] 50 RD: 00"
73303-73822 i2c_packet: data: "0x50 WR: 50 [SR] 0x50 RD: 00" "50 WR: 50 [SR] 50 RD: 00"
74192-74700 i2c_packet: data: "0x50 WR: 51 [SR] 0x50 RD: 80" "50 WR: 51 [SR] 50 RD: 80"
75018-75538 i2c_packet: data: "0x50 WR: 52 [SR] 0x50 RD: 00" "50 WR: 52 [SR] 50 RD: 00"
75840-76345 i2c_packet: data: "0x50 WR: 53 [SR] 0x50 RD: 80" "50 WR: 53 [SR] 50 RD: 80"
76506-77136 i2c_packet: data: "0x50 WR: 54 [SR] 0x50 RD: A2" "50 WR: 54 [SR] 50 RD: A2"
77319-77955 i2c_packet: data: "0x50 WR: 55 [SR] 0x50 RD: 00" "50 WR: 55 [SR] 50 RD: 00"
78140-78648 i2c_packet: data: "0x50 WR: 56 [SR] 0x50 RD: 00" "50 WR: 56 [SR] 50 RD: 00"
78916-79433 i2c_packet: data: "0x50 WR: 57 [SR] 0x50 RD: 00" "50 WR: 57 [SR] 50 RD: 00"
79713-80215 i2c_packet: data: "0x50 WR: 58 [SR] 0x50 RD: 00" "50 WR: 58 [SR] 50 RD: 00"
80590-81113 i2c_packet: data: "0x50 WR: 59 [SR] 0x50 RD: 00" "50 WR: 59 [SR] 50 RD: 00"
81410-81923 i2c_packet: data: "0x50 WR: 5A [SR] 0x50 RD: 00" "50 WR: 5A [SR] 50 RD: 00"
82313-82822 i2c_packet: data: "0x50 WR: 5B [SR] 0x50 RD: 00" "50 WR: 5B [SR] 50 RD: 00"
83138-83665 i2c_packet: data: "0x50 WR: 5C [SR] 0x50 RD: 00" "50 WR: 5C [SR] 50 RD: 00"
84046-84559 i2c_packet: data: "0x50 WR: 5D [SR] 0x50 RD: 00" "50 WR: 5D [SR] 50 RD: 00"
84885-85403 i2c_packet: data: "0x50 WR: 5E [SR] 0x50 RD: 00" "50 WR: 5E [SR] 50 RD: 00"
85781-86299 i2c_packet: data: "0x50 WR: 5F [SR] 0x50 RD: 00" "50 WR: 5F [SR] 50 RD: 00"
86681-87190 i2c_packet: data: "0x50 WR: 60 [SR] 0x50 RD: 23" "50 WR: 60 [SR] 50 RD: 23"
87502-88002 i2c_packet: data: "0x50 WR: 61 [SR] 0x50 RD: CB" "50 WR: 61 [SR] 50 RD: CB"
88171-88807 i2c_packet: data: "0x50 WR: 62 [SR] 0x50 RD: 00" "50 WR: 62 [SR] 50 RD: 00"
88985-89610 i2c_packet: data: "0x50 WR: 63 [SR] 0x50 RD: 00" "50 WR: 63 [SR] 50 RD: 00"
89872-90497 i2c_packet: data: "0x50 WR: 64 [SR] 0x50 RD: 00" "50 WR: 64 [SR] 50 RD: 00"
90677-91312 i2c_packet: data: "0x50 WR: 65 [SR] 0x50 RD: 00" "50 WR: 65 [SR] 50 RD: 00"
91487-91992 i2c_packet: data: "0x50 WR: 66 [SR] 0x50 RD: 00" "50 WR: 66 [SR] 50 RD: 00"
92290-92801 i2c_packet: data: "0x50 WR: 67 [SR] 0x50 RD: 00" "50 WR: 67 [SR] 50 RD: 00"
93085-93593 i2c_packet: data: "0x50 WR: 68 [SR] 0x50 RD: 55" "50 WR: 68 [SR] 50 RD: 55"
93948-94470 i2c_packet: data: "0x50 WR: 69 [SR] 0x50 RD: DC" "50 WR: 69 [SR] 50 RD: DC"
94764-95290 i2c_packet: data: "0x50 WR: 6A [SR] 0x50 RD: 81" "50 WR: 6A [SR] 50 RD: 81"
95660-96168 i2c_packet: data: "0x50 WR: 6B [SR] 0x50 RD: 51" "50 WR: 6B [SR] 50 RD: 51"
96488-97008 i2c_packet: data: "0x50 WR: 6C [SR] 0x50 RD: 00" "50 WR: 6C [SR] 50 RD: 00"
97304-97806 i2c_packet: data: "0x50 WR: 6D [SR] 0x50 RD: 00" "50 WR: 6D [SR] 50 RD: 00"
97980-98611 i2c_packet: data: "0x50 WR: 6E [SR] 0x50 RD: B0" "50 WR: 6E [SR] 50 RD: B0"
98787-99413 i2c_packet: data: "0x50 WR: 6F [SR] 0x50 RD: A0" "50 WR: 6F [SR] 50 RD: A0"
99714-100406 i2c_packet: data: "0x50 WR: 70 [SR] 0x50 RD: 00" "50 WR: 70 [SR] 50 RD: 00"
100587-101238 i2c_packet: data: "0x50 WR: 71 [SR] 0x50 RD: 00" "50 WR: 71 [SR] 50 RD: 00"
101499-102149 i2c_packet: data: "0x50 WR: 72 [SR] 0x50 RD: 00" "50 WR: 72 [SR] 50 RD: 00"
102341-102992 i2c_packet: data: "0x50 WR: 73 [SR] 0x50 RD: 00" "50 WR: 73 [SR] 50 RD: 00"
103180-103891 i2c_packet: data: "0x50 WR: 74 [SR] 0x50 RD: 00" "50 WR: 74 [SR] 50 RD: 00"
104072-104716 i2c_packet: data: "0x50 WR: 75 [SR] 0x50 RD: 00" "50 WR: 75 [SR] 50 RD: 00"
104896-105592 i2c_packet: data: "0x50 WR: 76 [SR] 0x50 RD: 00" "50 WR: 76 [SR] 50 RD: 00"
105770-106404 i2c_packet: data: "0x50 WR: 77 [SR] 0x50 RD: 00" "50 WR: 77 [SR] 50 RD: 00"
106585-107213 i2c_packet: data: "0x50 WR: 78 [SR] 0x50 RD: 00" "50 WR: 78 [SR] 50 RD: 00"
107454-108117 i2c_packet: data: "0x50 WR: 79 [SR] 0x50 RD: 00" "50 WR: 79 [SR] 50 RD: 00"
108295-108921 i2c_packet: data: "0x50 WR: 7A [SR] 0x50 RD: 00" "50 WR: 7A [SR] 50 RD: 00"
109096-109805 i2c_packet: data: "0x50 WR: 7B [SR] 0x50 RD: 00" "50 WR: 7B [SR] 50 RD: 00"
109990-110619 i2c_packet: data: "0x50 WR: 7C [SR] 0x50 RD: 00" "50 WR: 7C [SR] 50 RD: 00"
110796-111490 i2c_packet: data: "0x50 WR: 7D [SR] 0x50 RD: 00" "50 WR: 7D [SR] 50 RD: 00"
111678-112318 i2c_packet: data: "0x50 WR: 7E [SR] 0x50 RD: 00" "50 WR: 7E [SR] 50 RD: 00"
112504-113126 i2c_packet: data: "0x50 WR: 7F [SR] 0x50 RD: 01" "50 WR: 7F [SR] 50 RD: 01"
113390-113898 i2c_packet: data: "0x50 WR: 80 [SR] 0x50 RD: 06" "50 WR: 80 [SR] 50 RD: 06"
114174-114691 i2c_packet: data: "0x50 WR: 81 [SR] 0x50 RD: 58" "50 WR: 81 [SR] 50 RD: 58"
114971-115485 i2c_packet: data: "0x50 WR: 82 [SR] 0x50 RD: 07" "50 WR: 82 [SR] 50 RD: 07"
115870-116399 i2c_packet: data: "0x50 WR: 83 [SR] 0x50 RD: 44" "50 WR: 83 [SR] 50 RD: 44"
116696-117284 i2c_packet: data: "0x50 WR: 84 [SR] 0x50 RD: 00" "50 WR: 84 [SR] 50 RD: 00"
117598-118121 i2c_packet: data: "0x50 WR: 85 [SR] 0x50 RD: 00" "50 WR: 85 [SR] 50 RD: 00"
118413-118934 i2c_packet: data: "0x50 WR: 86 [SR] 0x50 RD: 00" "50 WR: 86 [SR] 50 RD: 00"
119288-119796 i2c_packet: data: "0x50 WR: 87 [SR] 0x50 RD: 00" "50 WR: 87 [SR] 50 RD: 00"
120106-120625 i2c_packet: data: "0x50 WR: 88 [SR] 0x50 RD: 00" "50 WR: 88 [SR] 50 RD: 00"
121001-121517 i2c_packet: data: "0x50 WR: 89 [SR] 0x50 RD: 00" "50 WR: 89 [SR] 50 RD: 00"
121820-122336 i2c_packet: data: "0x50 WR: 8A [SR] 0x50 RD: 00" "50 WR: 8A [SR] 50 RD: 00"
122636-123186 i2c_packet: data: "0x50 WR: 8B [SR] 0x50 RD: 90" "50 WR: 8B [SR] 50 RD: 90"
123544-124070 i2c_packet: data: "0x50 WR: 8C [SR] 0x50 RD: 64" "50 WR: 8C [SR] 50 RD: 64"
124364-124883 i2c_packet: data: "0x50 WR: 8D [SR] 0x50 RD: 6C" "50 WR: 8D [SR] 50 RD: 6C"
125267-125789 i2c_packet: data: "0x50 WR: 8E [SR] 0x50 RD: 0A" "50 WR: 8E [SR] 50 RD: 0A"
126088-126608 i2c_packet: data: "0x50 WR: 8F [SR] 0x50 RD: 00" "50 WR: 8F [SR] 50 RD: 00"
127049-127560 i2c_packet: data: "0x50 WR: 90 [SR] 0x50 RD: 00" "50 WR: 90 [SR] 50 RD: 00"
127890-128412 i2c_packet: data: "0x50 WR: 91 [SR] 0x50 RD: 00" "50 WR: 91 [SR] 50 RD: 00"
128788-129311 i2c_packet: data: "0x50 WR: 92 [SR] 0x50 RD: 00" "50 WR: 92 [SR] 50 RD: 00"
129616-130144 i2c_packet: data: "0x50 WR: 93 [SR] 0x50 RD: 40" "50 WR: 93 [SR] 50 RD: 40"
130443-130999 i2c_packet: data: "0x50 WR: 94 [SR] 0x50 RD: 53" "50 WR: 94 [SR] 50 RD: 53"
131368-131891 i2c_packet: data: "0x50 WR: 95 [SR] 0x50 RD: 75" "50 WR: 95 [SR] 50 RD: 75"
132195-132722 i2c_packet: data: "0x50 WR: 96 [SR] 0x50 RD: 6D" "50 WR: 96 [SR] 50 RD: 6D"
133115-133623 i2c_packet: data: "0x50 WR: 97 [SR] 0x50 RD: 69" "50 WR: 97 [SR] 50 RD: 69"
133939-134461 i2c_packet: data: "0x50 WR: 98 [SR] 0x50 RD: 74" "50 WR: 98 [SR] 50 RD: 74"
134818-135337 i2c_packet: data: "0x50 WR: 99 [SR] 0x50 RD: 6F" "50 WR: 99 [SR] 50 RD: 6F"
135648-136169 i2c_packet: data: "0x50 WR: 9A [SR] 0x50 RD: 6D" "50 WR: 9A [SR] 50 RD: 6D"
136465-136974 i2c_packet: data: "0x50 WR: 9B [SR] 0x50 RD: 6F" "50 WR: 9B [SR] 50 RD: 6F"
137353-137876 i2c_packet: data: "0x50 WR: 9C [SR] 0x50 RD: 45" "50 WR: 9C [SR] 50 RD: 45"
138167-138757 i2c_packet: data: "0x50 WR: 9D [SR] 0x50 RD: 6C" "50 WR: 9D [SR] 50 RD: 6C"
139072-139595 i2c_packet: data: "0x50 WR: 9E [SR] 0x50 RD: 65" "50 WR: 9E [SR] 50 RD: 65"
139887-140410 i2c_packet: data: "0x50 WR: 9F [SR] 0x50 RD: 63" "50 WR: 9F [SR] 50 RD: 63"
140839-141348 i2c_packet: data: "0x50 WR: A0 [SR] 0x50 RD: 74" "50 WR: A0 [SR] 50 RD: 74"
141679-142198 i2c_packet: data: "0x50 WR: A1 [SR] 0x50 RD: 72" "50 WR: A1 [SR] 50 RD: 72"
142569-143091 i2c_packet: data: "0x50 WR: A2 [SR] 0x50 RD: 69" "50 WR: A2 [SR] 50 RD: 69"
143389-143914 i2c_packet: data: "0x50 WR: A3 [SR] 0x50 RD: 63" "50 WR: A3 [SR] 50 RD: 63"
144205-144708 i2c_packet: data: "0x50 WR: A4 [SR] 0x50 RD: F0" "50 WR: A4 [SR] 50 RD: F0"
144878-145512 i2c_packet: data: "0x50 WR: A5 [SR] 0x50 RD: 00" "50 WR: A5 [SR] 50 RD: 00"
145691-146326 i2c_packet: data: "0x50 WR: A6 [SR] 0x50 RD: 0A" "50 WR: A6 [SR] 50 RD: 0A"
146530-147233 i2c_packet: data: "0x50 WR: A7 [SR] 0x50 RD: 1D" "50 WR: A7 [SR] 50 RD: 1D"
147590-148097 i2c_packet: data: "0x50 WR: A8 [SR] 0x50 RD: 53" "50 WR: A8 [SR] 50 RD: 53"
148548-149053 i2c_packet: data: "0x50 WR: A9 [SR] 0x50 RD: 58" "50 WR: A9 [SR] 50 RD: 58"
149332-149871 i2c_packet: data: "0x50 WR: AA [SR] 0x50 RD: 50" "50 WR: AA [SR] 50 RD: 50"
150041-150557 i2c_packet: data: "0x50 WR: AB [SR] 0x50 RD: 33" "50 WR: AB [SR] 50 RD: 33"
150864-151385 i2c_packet: data: "0x50 WR: AC [SR] 0x50 RD: 31" "50 WR: AC [SR] 50 RD: 31"
151674-152193 i2c_packet: data: "0x50 WR: AD [SR] 0x50 RD: 30" "50 WR: AD [SR] 50 RD: 30"
152559-153077 i2c_packet: data: "0x50 WR: AE [SR] 0x50 RD: 31" "50 WR: AE [SR] 50 RD: 31"
153394-153917 i2c_packet: data: "0x50 WR: AF [SR] 0x50 RD: 4C" "50 WR: AF [SR] 50 RD: 4C"
154355-154864 i2c_packet: data: "0x50 WR: B0 [SR] 0x50 RD: 58" "50 WR: B0 [SR] 50 RD: 58"
155192-155709 i2c_packet: data: "0x50 WR: B1 [SR] 0x50 RD: 2D" "50 WR: B1 [SR] 50 RD: 2D"
156003-156523 i2c_packet: data: "0x50 WR: B2 [SR] 0x50 RD: 41" "50 WR: B2 [SR] 50 RD: 41"
156908-157434 i2c_packet: data: "0x50 WR: B3 [SR] 0x50 RD: 34" "50 WR: B3 [SR] 50 RD: 34"
157722-158401 i2c_packet: data: "0x50 WR: B4 [SR] 0x50 RD: 20" "50 WR: B4 [SR] 50 RD: 20"
158714-159222 i2c_packet: data: "0x50 WR: B5 [SR] 0x50 RD: 20" "50 WR: B5 [SR] 50 RD: 20"
159538-160059 i2c_packet: data: "0x50 WR: B6 [SR] 0x50 RD: 20" "50 WR: B6 [SR] 50 RD: 20"
160443-160948 i2c_packet: data: "0x50 WR: B7 [SR] 0x50 RD: 20" "50 WR: B7 [SR] 50 RD: 20"
161260-161780 i2c_packet: data: "0x50 WR: B8 [SR] 0x50 RD: 41" "50 WR: B8 [SR] 50 RD: 41"
162146-162670 i2c_packet: data: "0x50 WR: B9 [SR] 0x50 RD: 20" "50 WR: B9 [SR] 50 RD: 20"
163002-163524 i2c_packet: data: "0x50 WR: BA [SR] 0x50 RD: 66" "50 WR: BA [SR] 50 RD: 66"
163816-164332 i2c_packet: data: "0x50 WR: BB [SR] 0x50 RD: 58" "50 WR: BB [SR] 50 RD: 58"
164720-165249 i2c_packet: data: "0x50 WR: BC [SR] 0x50 RD: 0F" "50 WR: BC [SR] 50 RD: 0F"
165545-166134 i2c_packet: data: "0x50 WR: BD [SR] 0x50 RD: A0" "50 WR: BD [SR] 50 RD: A0"
166444-166951 i2c_packet: data: "0x50 WR: BE [SR] 0x50 RD: 46" "50 WR: BE [SR] 50 RD: 46"
167262-167781 i2c_packet: data: "0x50 WR: BF [SR] 0x50 RD: 8C" "50 WR: BF [SR] 50 RD: 8C"
168214-168725 i2c_packet: data: "0x50 WR: C0 [SR] 0x50 RD: 7D" "50 WR: C0 [SR] 50 RD: 7D"
169040-169551 i2c_packet: data: "0x50 WR: C1 [SR] 0x50 RD: 96" "50 WR: C1 [SR] 50 RD: 96"
169933-170453 i2c_packet: data: "0x50 WR: C2 [SR] 0x50 RD: 08" "50 WR: C2 [SR] 50 RD: 08"
170772-171291 i2c_packet: data: "0x50 WR: C3 [SR] 0x50 RD: 00" "50 WR: C3 [SR] 50 RD: 00"
171589-172086 i2c_packet: data: "0x50 WR: C4 [SR] 0x50 RD: 38" "50 WR: C4 [SR] 50 RD: 38"
172257-172894 i2c_packet: data: "0x50 WR: C5 [SR] 0x50 RD: 33" "50 WR: C5 [SR] 50 RD: 33"
173071-173712 i2c_packet: data: "0x50 WR: C6 [SR] 0x50 RD: 33" "50 WR: C6 [SR] 50 RD: 33"
173893-174397 i2c_packet: data: "0x50 WR: C7 [SR] 0x50 RD: 30" "50 WR: C7 [SR] 50 RD: 30"
174665-175168 i2c_packet: data: "0x50 WR: C8 [SR] 0x50 RD: 31" "50 WR: C8 [SR] 50 RD: 31"
175449-175950 i2c_packet: data: "0x50 WR: C9 [SR] 0x50 RD: 32" "50 WR: C9 [SR] 50 RD: 32"
176327-176853 i2c_packet: data: "0x50 WR: CA [SR] 0x50 RD: 41" "50 WR: CA [SR] 50 RD: 41"
177145-177660 i2c_packet: data: "0x50 WR: CB [SR] 0x50 RD: 30" "50 WR: CB [SR] 50 RD: 30"
178051-178570 i2c_packet: data: "0x50 WR: CC [SR] 0x50 RD: 30" "50 WR: CC [SR] 50 RD: 30"
178887-179405 i2c_packet: data: "0x50 WR: CD [SR] 0x50 RD: 33" "50 WR: CD [SR] 50 RD: 33"
179762-180285 i2c_packet: data: "0x50 WR: CE [SR] 0x50 RD: 38" "50 WR: CE [SR] 50 RD: 38"
180583-181102 i2c_packet: data: "0x50 WR: CF [SR] 0x50 RD: 38" "50 WR: CF [SR] 50 RD: 38"
181549-182075 i2c_packet: data: "0x50 WR: D0 [SR] 0x50 RD: 20" "50 WR: D0 [SR] 50 RD: 20"
182380-182904 i2c_packet: data: "0x50 WR: D1 [SR] 0x50 RD: 20" "50 WR: D1 [SR] 50 RD: 20"
183209-183763 i2c_packet: data: "0x50 WR: D2 [SR] 0x50 RD: 20" "50 WR: D2 [SR] 50 RD: 20"
184109-184631 i2c_packet: data: "0x50 WR: D3 [SR] 0x50 RD: 20" "50 WR: D3 [SR] 50 RD: 20"
184917-185436 i2c_packet: data: "0x50 WR: D4 [SR] 0x50 RD: 30" "50 WR: D4 [SR] 50 RD: 30"
185809-186339 i2c_packet: data: "0x50 WR: D5 [SR] 0x50 RD: 38" "50 WR: D5 [SR] 50 RD: 38"
186637-187156 i2c_packet: data: "0x50 WR: D6 [SR] 0x50 RD: 30" "50 WR: D6 [SR] 50 RD: 30"
187522-188045 i2c_packet: data: "0x50 WR: D7 [SR] 0x50 RD: 33" "50 WR: D7 [SR] 50 RD: 33"
188348-188870 i2c_packet: data: "0x50 WR: D8 [SR] 0x50 RD: 32" "50 WR: D8 [SR] 50 RD: 32"
189169-189668 i2c_packet: data: "0x50 WR: D9 [SR] 0x50 RD: 31" "50 WR: D9 [SR] 50 RD: 31"
189843-190482 i2c_packet: data: "0x50 WR: DA [SR] 0x50 RD: 41" "50 WR: DA [SR] 50 RD: 41"
190658-191290 i2c_packet: data: "0x50 WR: DB [SR] 0x50 RD: 35" "50 WR: DB [SR] 50 RD: 35"
191485-192188 i2c_packet: data: "0x50 WR: DC [SR] 0x50 RD: 08" "50 WR: DC [SR] 50 RD: 08"
192543-193049 i2c_packet: data: "0x50 WR: DD [SR] 0x50 RD: 60" "50 WR: DD [SR] 50 RD: 60"
193519-194023 i2c_packet: data: "0x50 WR: DE [SR] 0x50 RD: 70" "50 WR: DE [SR] 50 RD: 70"
194427-194932 i2c_packet: data: "0x50 WR: DF [SR] 0x50 RD: 8C" "50 WR: DF [SR] 50 RD: 8C"
195260-195903 i2c_packet: data: "0x50 WR: E0 [SR] 0x50 RD: 33" "50 WR: E0 [SR] 50 RD: 33"
196082-196589 i2c_packet: data: "0x50 WR: E1 [SR] 0x50 RD: 48" "50 WR: E1 [SR] 50 RD: 48"
196870-197447 i2c_packet: data: "0x50 WR: E2 [SR] 0x50 RD: 45" "50 WR: E2 [SR] 50 RD: 45"
197750-198270 i2c_packet: data: "0x50 WR: E3 [SR] 0x50 RD: 30" "50 WR: E3 [SR] 50 RD: 30"
198567-199074 i2c_packet: data: "0x50 WR: E4 [SR] 0x50 RD: 30" "50 WR: E4 [SR] 50 RD: 30"
199437-199962 i2c_packet: data: "0x50 WR: E5 [SR] 0x50 RD: 35" "50 WR: E5 [SR] 50 RD: 35"
200257-200775 i2c_packet: data: "0x50 WR: E6 [SR] 0x50 RD: 36" "50 WR: E6 [SR] 50 RD: 36"
201147-201670 i2c_packet: data: "0x50 WR: E7 [SR] 0x50 RD: 34" "50 WR: E7 [SR] 50 RD: 34"
201968-202485 i2c_packet: data: "0x50 WR: E8 [SR] 0x50 RD: 41" "50 WR: E8 [SR] 50 RD: 41"
202784-203302 i2c_packet: data: "0x50 WR: E9 [SR] 0x50 RD: 41" "50 WR: E9 [SR] 50 RD: 41"
203699-204222 i2c_packet: data: "0x50 WR: EA [SR] 0x50 RD: 41" "50 WR: EA [SR] 50 RD: 41"
204517-205037 i2c_packet: data: "0x50 WR: EB [SR] 0x50 RD: 41" "50 WR: EB [SR] 50 RD: 41"
205417-205943 i2c_packet: data: "0x50 WR: EC [SR] 0x50 RD: 30" "50 WR: EC [SR] 50 RD: 30"
206238-206751 i2c_packet: data: "0x50 WR: ED [SR] 0x50 RD: 31" "50 WR: ED [SR] 50 RD: 31"
207112-207632 i2c_packet: data: "0x50 WR: EE [SR] 0x50 RD: 20" "50 WR: EE [SR] 50 RD: 20"
207936-208455 i2c_packet: data: "0x50 WR: EF [SR] 0x50 RD: 20" "50 WR: EF [SR] 50 RD: 20"
208899-209429 i2c_packet: data: "0x50 WR: F0 [SR] 0x50 RD: 41" "50 WR: F0 [SR] 50 RD: 41"
209732-210253 i2c_packet: data: "0x50 WR: F1 [SR] 0x50 RD: 4C" "50 WR: F1 [SR] 50 RD: 4C"
210557-211129 i2c_packet: data: "0x50 WR: F2 [SR] 0x50 RD: 41" "50 WR: F2 [SR] 50 RD: 41"
211459-211968 i2c_packet: data: "0x50 WR: F3 [SR] 0x50 RD: 20" "50 WR: F3 [SR] 50 RD: 20"
212274-212795 i2c_packet: data: "0x50 WR: F4 [SR] 0x50 RD: 20" "50 WR: F4 [SR] 50 RD: 20"
213173-213678 i2c_packet: data: "0x50 WR: F5 [SR] 0x50 RD: 49" "50 WR: F5 [SR] 50 RD: 49"
214006-214528 i2c_packet: data: "0x50 WR: F6 [SR] 0x50 RD: 50" "50 WR: F6 [SR] 50 RD: 50"
214891-215419 i2c_packet: data: "0x50 WR: F7 [SR] 0x50 RD: 55" "50 WR: F7 [SR] 50 RD: 55"
215727-216248 i2c_packet: data: "0x50 WR: F8 [SR] 0x50 RD: 49" "50 WR: F8 [SR] 50 RD: 49"
216538-217043 i2c_packet: data: "0x50 WR: F9 [SR] 0x50 RD: 41" "50 WR: F9 [SR] 50 RD: 41"
217207-217843 i2c_packet: data: "0x50 WR: FA [SR] 0x50 RD: 52" "50 WR: FA [SR] 50 RD: 52"
218025-218653 i2c_packet: data: "0x50 WR: FB [SR] 0x50 RD: 52" "50 WR: FB [SR] 50 RD: 52"
218834-219345 i2c_packet: data: "0x50 WR: FC [SR] 0x50 RD: 44" "50 WR: FC [SR] 50 RD: 44"
219614-220126 i2c_packet: data: "0x50 WR: FD [SR] 0x50 RD: 41" "50 WR: FD [SR] 50 RD: 41"
220401-220904 i2c_packet: data: "0x50 WR: FE [SR] 0x50 RD: 41" "50 WR: FE [SR] 50 RD: 41"
221268-221778 i2c_packet: data: "0x50 WR: FF [SR] 0x50 RD: 54" "50 WR: FF [SR] 50 RD: 54"
