18446744073709551615-0 spi: miso-transfer: ""
18446744073709551615-0 spi: mosi-transfer: ""
662-666 spi: miso-bits: "0"
658-662 spi: miso-bits: "0"
654-658 spi: miso-bits: "0"
650-654 spi: miso-bits: "1"
646-650 spi: miso-bits: "1"
642-646 spi: miso-bits: "0"
638-642 spi: miso-bits: "0"
634-638 spi: miso-bits: "0"
630-634 spi: miso-bits: "0"
626-630 spi: miso-bits: "0"
622-626 spi: miso-bits: "1"
618-622 spi: miso-bits: "0"
614-618 spi: miso-bits: "0"
610-614 spi: miso-bits: "1"
606-610 spi: miso-bits: "1"
602-606 spi: miso-bits: "0"
598-602 spi: miso-bits: "0"
594-598 spi: miso-bits: "0"
590-594 spi: miso-bits: "0"
586-590 spi: miso-bits: "1"
582-586 spi: miso-bits: "1"
578-582 spi: miso-bits: "0"
574-578 spi: miso-bits: "0"
570-574 spi: miso-bits: "0"
566-570 spi: miso-bits: "0"
562-566 spi: miso-bits: "1"
558-562 spi: miso-bits: "0"
554-558 spi: miso-bits: "1"
550-554 spi: miso-bits: "0"
546-550 spi: miso-bits: "1"
542-546 spi: miso-bits: "0"
538-542 spi: miso-bits: "0"
534-538 spi: miso-bits: "0"
530-534 spi: miso-bits: "0"
526-530 spi: miso-bits: "0"
522-526 spi: miso-bits: "1"
518-522 spi: miso-bits: "1"
514-518 spi: miso-bits: "0"
510-514 spi: miso-bits: "0"
506-510 spi: miso-bits: "0"
502-506 spi: miso-bits: "0"
498-502 spi: miso-bits: "1"
494-498 spi: miso-bits: "0"
490-494 spi: miso-bits: "1"
486-490 spi: miso-bits: "0"
482-486 spi: miso-bits: "0"
478-482 spi: miso-bits: "0"
474-478 spi: miso-bits: "0"
470-474 spi: miso-bits: "0"
466-470 spi: miso-bits: "0"
462-466 spi: miso-bits: "0"
458-462 spi: miso-bits: "0"
454-458 spi: miso-bits: "0"
450-454 spi: miso-bits: "0"
446-450 spi: miso-bits: "0"
442-446 spi: miso-bits: "1"
438-442 spi: miso-bits: "0"
434-438 spi: miso-bits: "0"
430-434 spi: miso-bits: "0"
426-430 spi: miso-bits: "0"
422-426 spi: miso-bits: "0"
418-422 spi: miso-bits: "0"
414-418 spi: miso-bits: "0"
410-414 spi: miso-bits: "0"
406-410 spi: miso-bits: "0"
402-406 spi: miso-bits: "0"
398-402 spi: miso-bits: "0"
394-398 spi: miso-bits: "0"
390-394 spi: miso-bits: "0"
386-390 spi: miso-bits: "0"
382-386 spi: miso-bits: "0"
378-382 spi: miso-bits: "1"
374-378 spi: miso-bits: "0"
370-374 spi: miso-bits: "0"
366-370 spi: miso-bits: "0"
362-366 spi: miso-bits: "0"
358-362 spi: miso-bits: "0"
354-358 spi: miso-bits: "0"
350-354 spi: miso-bits: "0"
346-350 spi: miso-bits: "0"
342-346 spi: miso-bits: "0"
338-342 spi: miso-bits: "0"
334-338 spi: miso-bits: "1"
330-334 spi: miso-bits: "1"
326-330 spi: miso-bits: "1"
322-326 spi: miso-bits: "1"
318-322 spi: miso-bits: "1"
314-318 spi: miso-bits: "0"
310-314 spi: miso-bits: "0"
306-310 spi: miso-bits: "1"
302-306 spi: miso-bits: "1"
298-302 spi: miso-bits: "1"
294-298 spi: miso-bits: "1"
290-294 spi: miso-bits: "1"
286-290 spi: miso-bits: "0"
282-286 spi: miso-bits: "0"
278-282 spi: miso-bits: "1"
274-278 spi: miso-bits: "1"
270-274 spi: miso-bits: "0"
266-270 spi: miso-bits: "0"
262-266 spi: miso-bits: "0"
258-262 spi: miso-bits: "1"
254-258 spi: miso-bits: "0"
250-254 spi: miso-bits: "0"
246-250 spi: miso-bits: "0"
242-246 spi: miso-bits: "0"
238-242 spi: miso-bits: "0"
234-238 spi: miso-bits: "1"
230-234 spi: miso-bits: "0"
226-230 spi: miso-bits: "0"
222-226 spi: miso-bits: "0"
218-222 spi: miso-bits: "1"
214-218 spi: miso-bits: "0"
210-214 spi: miso-bits: "1"
206-210 spi: miso-bits: "0"
202-206 spi: miso-bits: "1"
198-202 spi: miso-bits: "0"
194-198 spi: miso-bits: "0"
190-194 spi: miso-bits: "1"
186-190 spi: miso-bits: "0"
182-186 spi: miso-bits: "0"
178-182 spi: miso-bits: "1"
174-178 spi: miso-bits: "0"
170-174 spi: miso-bits: "0"
166-170 spi: miso-bits: "0"
162-166 spi: miso-bits: "0"
158-162 spi: miso-bits: "0"
154-158 spi: miso-bits: "0"
150-154 spi: miso-bits: "0"
146-150 spi: miso-bits: "0"
142-146 spi: miso-bits: "0"
138-142 spi: miso-bits: "0"
134-138 spi: miso-bits: "0"
130-134 spi: miso-bits: "0"
126-130 spi: miso-bits: "0"
122-126 spi: miso-bits: "1"
118-122 spi: miso-bits: "0"
114-118 spi: miso-bits: "1"
110-114 spi: miso-bits: "1"
106-110 spi: miso-bits: "1"
102-106 spi: miso-bits: "1"
98-102 spi: miso-bits: "0"
94-98 spi: miso-bits: "0"
90-94 spi: miso-bits: "0"
86-90 spi: miso-bits: "1"
82-86 spi: miso-bits: "1"
78-82 spi: miso-bits: "0"
74-78 spi: miso-bits: "1"
70-74 spi: miso-bits: "1"
66-70 spi: miso-bits: "1"
62-66 spi: miso-bits: "0"
58-62 spi: miso-bits: "1"
662-666 spi: mosi-bits: "0"
658-662 spi: mosi-bits: "0"
654-658 spi: mosi-bits: "1"
650-654 spi: mosi-bits: "0"
646-650 spi: mosi-bits: "1"
642-646 spi: mosi-bits: "0"
638-642 spi: mosi-bits: "0"
634-638 spi: mosi-bits: "0"
630-634 spi: mosi-bits: "0"
626-630 spi: mosi-bits: "1"
622-626 spi: mosi-bits: "1"
618-622 spi: mosi-bits: "0"
614-618 spi: mosi-bits: "0"
610-614 spi: mosi-bits: "0"
606-610 spi: mosi-bits: "0"
602-606 spi: mosi-bits: "0"
598-602 spi: mosi-bits: "0"
594-598 spi: mosi-bits: "0"
590-594 spi: mosi-bits: "1"
586-590 spi: mosi-bits: "0"
582-586 spi: mosi-bits: "1"
578-582 spi: mosi-bits: "0"
574-578 spi: mosi-bits: "0"
570-574 spi: mosi-bits: "0"
566-570 spi: mosi-bits: "0"
562-566 spi: mosi-bits: "0"
558-562 spi: mosi-bits: "0"
554-558 spi: mosi-bits: "0"
550-554 spi: mosi-bits: "0"
546-550 spi: mosi-bits: "0"
542-546 spi: mosi-bits: "0"
538-542 spi: mosi-bits: "0"
534-538 spi: mosi-bits: "0"
530-534 spi: mosi-bits: "0"
526-530 spi: mosi-bits: "1"
522-526 spi: mosi-bits: "0"
518-522 spi: mosi-bits: "1"
514-518 spi: mosi-bits: "0"
510-514 spi: mosi-bits: "0"
506-510 spi: mosi-bits: "0"
502-506 spi: mosi-bits: "0"
498-502 spi: mosi-bits: "0"
494-498 spi: mosi-bits: "0"
490-494 spi: mosi-bits: "0"
486-490 spi: mosi-bits: "0"
482-486 spi: mosi-bits: "0"
478-482 spi: mosi-bits: "0"
474-478 spi: mosi-bits: "0"
470-474 spi: mosi-bits: "0"
466-470 spi: mosi-bits: "0"
462-466 spi: mosi-bits: "0"
458-462 spi: mosi-bits: "0"
454-458 spi: mosi-bits: "0"
450-454 spi: mosi-bits: "0"
446-450 spi: mosi-bits: "1"
442-446 spi: mosi-bits: "1"
438-442 spi: mosi-bits: "0"
434-438 spi: mosi-bits: "0"
430-434 spi: mosi-bits: "0"
426-430 spi: mosi-bits: "0"
422-426 spi: mosi-bits: "0"
418-422 spi: mosi-bits: "0"
414-418 spi: mosi-bits: "0"
410-414 spi: mosi-bits: "0"
406-410 spi: mosi-bits: "0"
402-406 spi: mosi-bits: "0"
398-402 spi: mosi-bits: "0"
394-398 spi: mosi-bits: "0"
390-394 spi: mosi-bits: "0"
386-390 spi: mosi-bits: "0"
382-386 spi: mosi-bits: "0"
378-382 spi: mosi-bits: "1"
374-378 spi: mosi-bits: "0"
370-374 spi: mosi-bits: "0"
366-370 spi: mosi-bits: "0"
362-366 spi: mosi-bits: "0"
358-362 spi: mosi-bits: "0"
354-358 spi: mosi-bits: "0"
350-354 spi: mosi-bits: "0"
346-350 spi: mosi-bits: "0"
342-346 spi: mosi-bits: "0"
338-342 spi: mosi-bits: "0"
334-338 spi: mosi-bits: "1"
330-334 spi: mosi-bits: "1"
326-330 spi: mosi-bits: "0"
322-326 spi: mosi-bits: "1"
318-322 spi: mosi-bits: "0"
314-318 spi: mosi-bits: "0"
310-314 spi: mosi-bits: "1"
306-310 spi: mosi-bits: "1"
302-306 spi: mosi-bits: "1"
298-302 spi: mosi-bits: "1"
294-298 spi: mosi-bits: "0"
290-294 spi: mosi-bits: "1"
286-290 spi: mosi-bits: "1"
282-286 spi: mosi-bits: "0"
278-282 spi: mosi-bits: "0"
274-278 spi: mosi-bits: "0"
270-274 spi: mosi-bits: "1"
266-270 spi: mosi-bits: "1"
262-266 spi: mosi-bits: "1"
258-262 spi: mosi-bits: "0"
254-258 spi: mosi-bits: "1"
250-254 spi: mosi-bits: "0"
246-250 spi: mosi-bits: "1"
242-246 spi: mosi-bits: "0"
238-242 spi: mosi-bits: "1"
234-238 spi: mosi-bits: "0"
230-234 spi: mosi-bits: "1"
226-230 spi: mosi-bits: "0"
222-226 spi: mosi-bits: "0"
218-222 spi: mosi-bits: "0"
214-218 spi: mosi-bits: "0"
210-214 spi: mosi-bits: "0"
206-210 spi: mosi-bits: "0"
202-206 spi: mosi-bits: "0"
198-202 spi: mosi-bits: "1"
194-198 spi: mosi-bits: "1"
190-194 spi: mosi-bits: "1"
186-190 spi: mosi-bits: "0"
182-186 spi: mosi-bits: "1"
178-182 spi: mosi-bits: "0"
174-178 spi: mosi-bits: "1"
170-174 spi: mosi-bits: "0"
166-170 spi: mosi-bits: "1"
162-166 spi: mosi-bits: "0"
158-162 spi: mosi-bits: "1"
154-158 spi: mosi-bits: "0"
150-154 spi: mosi-bits: "0"
146-150 spi: mosi-bits: "0"
142-146 spi: mosi-bits: "0"
138-142 spi: mosi-bits: "0"
134-138 spi: mosi-bits: "0"
130-134 spi: mosi-bits: "0"
126-130 spi: mosi-bits: "0"
122-126 spi: mosi-bits: "1"
118-122 spi: mosi-bits: "1"
114-118 spi: mosi-bits: "1"
110-114 spi: mosi-bits: "0"
106-110 spi: mosi-bits: "0"
102-106 spi: mosi-bits: "1"
98-102 spi: mosi-bits: "0"
94-98 spi: mosi-bits: "0"
90-94 spi: mosi-bits: "0"
86-90 spi: mosi-bits: "1"
82-86 spi: mosi-bits: "1"
78-82 spi: mosi-bits: "1"
74-78 spi: mosi-bits: "1"
70-74 spi: mosi-bits: "1"
66-70 spi: mosi-bits: "1"
62-66 spi: mosi-bits: "1"
58-62 spi: mosi-bits: "1"
58-666 spi: miso-data: "BB1E80024A88233E7C008000800A182A186418"
58-666 spi: mosi-data: "FF13805570155C6F2C008000C0001400140614"
56-664 spi: miso-transfer: "BB1E80024A88233E7C008000800A182A186418"
56-664 spi: mosi-transfer: "FF13805570155C6F2C008000C0001400140614"
