70-74 spi: miso-bit: "0"
66-70 spi: miso-bit: "0"
62-66 spi: miso-bit: "0"
58-62 spi: miso-bit: "0"
54-58 spi: miso-bit: "0"
50-54 spi: miso-bit: "0"
46-50 spi: miso-bit: "0"
42-46 spi: miso-bit: "0"
38-42 spi: miso-bit: "1"
34-38 spi: miso-bit: "0"
30-34 spi: miso-bit: "1"
26-30 spi: miso-bit: "0"
22-26 spi: miso-bit: "0"
18-22 spi: miso-bit: "0"
14-18 spi: miso-bit: "0"
10-14 spi: miso-bit: "0"
70-74 spi: mosi-bit: "1"
66-70 spi: mosi-bit: "1"
62-66 spi: mosi-bit: "0"
58-62 spi: mosi-bit: "0"
54-58 spi: mosi-bit: "0"
50-54 spi: mosi-bit: "0"
46-50 spi: mosi-bit: "0"
42-46 spi: mosi-bit: "0"
38-42 spi: mosi-bit: "1"
34-38 spi: mosi-bit: "1"
30-34 spi: mosi-bit: "1"
26-30 spi: mosi-bit: "1"
22-26 spi: mosi-bit: "1"
18-22 spi: mosi-bit: "1"
14-18 spi: mosi-bit: "1"
10-14 spi: mosi-bit: "1"
10-74 spi: miso-data: "500"
10-74 spi: mosi-data: "FF03"
8-72 spi: miso-transfer: "500"
8-72 spi: mosi-transfer: "FF03"
