186-190 spi: miso-bit: "1"
182-186 spi: miso-bit: "0"
178-182 spi: miso-bit: "1"
174-178 spi: miso-bit: "0"
170-174 spi: miso-bit: "1"
166-170 spi: miso-bit: "0"
162-166 spi: miso-bit: "0"
158-162 spi: miso-bit: "0"
154-158 spi: miso-bit: "1"
150-154 spi: miso-bit: "1"
146-150 spi: miso-bit: "1"
142-146 spi: miso-bit: "1"
138-142 spi: miso-bit: "1"
134-138 spi: miso-bit: "1"
130-134 spi: miso-bit: "1"
126-130 spi: miso-bit: "1"
122-126 spi: miso-bit: "1"
118-122 spi: miso-bit: "1"
114-118 spi: miso-bit: "1"
110-114 spi: miso-bit: "1"
106-110 spi: miso-bit: "1"
102-106 spi: miso-bit: "1"
98-102 spi: miso-bit: "1"
94-98 spi: miso-bit: "1"
90-94 spi: miso-bit: "1"
86-90 spi: miso-bit: "1"
82-86 spi: miso-bit: "1"
78-82 spi: miso-bit: "1"
74-78 spi: miso-bit: "1"
70-74 spi: miso-bit: "1"
66-70 spi: miso-bit: "1"
62-66 spi: miso-bit: "1"
58-62 spi: miso-bit: "1"
54-58 spi: miso-bit: "1"
50-54 spi: miso-bit: "1"
46-50 spi: miso-bit: "1"
42-46 spi: miso-bit: "1"
38-42 spi: miso-bit: "1"
34-38 spi: miso-bit: "1"
30-34 spi: miso-bit: "1"
186-190 spi: mosi-bit: "0"
182-186 spi: mosi-bit: "0"
178-182 spi: mosi-bit: "0"
174-178 spi: mosi-bit: "0"
170-174 spi: mosi-bit: "0"
166-170 spi: mosi-bit: "0"
162-166 spi: mosi-bit: "0"
158-162 spi: mosi-bit: "0"
154-158 spi: mosi-bit: "0"
150-154 spi: mosi-bit: "0"
146-150 spi: mosi-bit: "0"
142-146 spi: mosi-bit: "0"
138-142 spi: mosi-bit: "0"
134-138 spi: mosi-bit: "0"
130-134 spi: mosi-bit: "0"
126-130 spi: mosi-bit: "0"
122-126 spi: mosi-bit: "0"
118-122 spi: mosi-bit: "0"
114-118 spi: mosi-bit: "0"
110-114 spi: mosi-bit: "0"
106-110 spi: mosi-bit: "0"
102-106 spi: mosi-bit: "0"
98-102 spi: mosi-bit: "0"
94-98 spi: mosi-bit: "0"
90-94 spi: mosi-bit: "0"
86-90 spi: mosi-bit: "0"
82-86 spi: mosi-bit: "0"
78-82 spi: mosi-bit: "0"
74-78 spi: mosi-bit: "0"
70-74 spi: mosi-bit: "0"
66-70 spi: mosi-bit: "0"
62-66 spi: mosi-bit: "0"
58-62 spi: mosi-bit: "1"
54-58 spi: mosi-bit: "1"
50-54 spi: mosi-bit: "0"
46-50 spi: mosi-bit: "1"
42-46 spi: mosi-bit: "0"
38-42 spi: mosi-bit: "1"
34-38 spi: mosi-bit: "0"
30-34 spi: mosi-bit: "1"
30-190 spi: miso-data: "FFFFFFFF15"
30-190 spi: mosi-data: "AB00000000"
28-188 spi: miso-transfer: "FFFFFFFF15"
28-188 spi: mosi-transfer: "AB00000000"
