18446744073709551615-0 spi: miso-transfer: ""
18446744073709551615-0 spi: mosi-transfer: ""
186-190 spi: miso-bits: "1"
182-186 spi: miso-bits: "0"
178-182 spi: miso-bits: "1"
174-178 spi: miso-bits: "0"
170-174 spi: miso-bits: "1"
166-170 spi: miso-bits: "0"
162-166 spi: miso-bits: "0"
158-162 spi: miso-bits: "0"
154-158 spi: miso-bits: "1"
150-154 spi: miso-bits: "1"
146-150 spi: miso-bits: "1"
142-146 spi: miso-bits: "1"
138-142 spi: miso-bits: "1"
134-138 spi: miso-bits: "1"
130-134 spi: miso-bits: "1"
126-130 spi: miso-bits: "1"
122-126 spi: miso-bits: "1"
118-122 spi: miso-bits: "1"
114-118 spi: miso-bits: "1"
110-114 spi: miso-bits: "1"
106-110 spi: miso-bits: "1"
102-106 spi: miso-bits: "1"
98-102 spi: miso-bits: "1"
94-98 spi: miso-bits: "1"
90-94 spi: miso-bits: "1"
86-90 spi: miso-bits: "1"
82-86 spi: miso-bits: "1"
78-82 spi: miso-bits: "1"
74-78 spi: miso-bits: "1"
70-74 spi: miso-bits: "1"
66-70 spi: miso-bits: "1"
62-66 spi: miso-bits: "1"
58-62 spi: miso-bits: "1"
54-58 spi: miso-bits: "1"
50-54 spi: miso-bits: "1"
46-50 spi: miso-bits: "1"
42-46 spi: miso-bits: "1"
38-42 spi: miso-bits: "1"
34-38 spi: miso-bits: "1"
30-34 spi: miso-bits: "1"
186-190 spi: mosi-bits: "0"
182-186 spi: mosi-bits: "0"
178-182 spi: mosi-bits: "0"
174-178 spi: mosi-bits: "0"
170-174 spi: mosi-bits: "0"
166-170 spi: mosi-bits: "0"
162-166 spi: mosi-bits: "0"
158-162 spi: mosi-bits: "0"
154-158 spi: mosi-bits: "0"
150-154 spi: mosi-bits: "0"
146-150 spi: mosi-bits: "0"
142-146 spi: mosi-bits: "0"
138-142 spi: mosi-bits: "0"
134-138 spi: mosi-bits: "0"
130-134 spi: mosi-bits: "0"
126-130 spi: mosi-bits: "0"
122-126 spi: mosi-bits: "0"
118-122 spi: mosi-bits: "0"
114-118 spi: mosi-bits: "0"
110-114 spi: mosi-bits: "0"
106-110 spi: mosi-bits: "0"
102-106 spi: mosi-bits: "0"
98-102 spi: mosi-bits: "0"
94-98 spi: mosi-bits: "0"
90-94 spi: mosi-bits: "0"
86-90 spi: mosi-bits: "0"
82-86 spi: mosi-bits: "0"
78-82 spi: mosi-bits: "0"
74-78 spi: mosi-bits: "0"
70-74 spi: mosi-bits: "0"
66-70 spi: mosi-bits: "0"
62-66 spi: mosi-bits: "0"
58-62 spi: mosi-bits: "1"
54-58 spi: mosi-bits: "1"
50-54 spi: mosi-bits: "0"
46-50 spi: mosi-bits: "1"
42-46 spi: mosi-bits: "0"
38-42 spi: mosi-bits: "1"
34-38 spi: mosi-bits: "0"
30-34 spi: mosi-bits: "1"
30-190 spi: miso-data: "FFFFFFFF15"
30-190 spi: mosi-data: "AB00000000"
28-188 spi: miso-transfer: "FFFFFFFF15"
28-188 spi: mosi-transfer: "AB00000000"
