72-76 spi: mosi-bits: "0"
68-72 spi: mosi-bits: "1"
64-68 spi: mosi-bits: "0"
60-64 spi: mosi-bits: "1"
56-60 spi: mosi-bits: "0"
52-56 spi: mosi-bits: "1"
48-52 spi: mosi-bits: "0"
44-48 spi: mosi-bits: "0"
40-44 spi: mosi-bits: "0"
40-76 spi: mosi-data: "2A"
120-124 spi: mosi-bits: "0"
116-120 spi: mosi-bits: "0"
112-116 spi: mosi-bits: "0"
108-112 spi: mosi-bits: "0"
104-108 spi: mosi-bits: "0"
100-104 spi: mosi-bits: "0"
96-100 spi: mosi-bits: "0"
92-96 spi: mosi-bits: "0"
88-92 spi: mosi-bits: "1"
88-124 spi: mosi-data: "100"
167-171 spi: mosi-bits: "0"
163-167 spi: mosi-bits: "0"
159-163 spi: mosi-bits: "0"
155-159 spi: mosi-bits: "0"
151-155 spi: mosi-bits: "1"
147-151 spi: mosi-bits: "0"
143-147 spi: mosi-bits: "1"
139-143 spi: mosi-bits: "0"
135-139 spi: mosi-bits: "1"
135-171 spi: mosi-data: "150"
214-218 spi: mosi-bits: "0"
210-214 spi: mosi-bits: "0"
206-210 spi: mosi-bits: "0"
202-206 spi: mosi-bits: "0"
198-202 spi: mosi-bits: "0"
194-198 spi: mosi-bits: "0"
190-194 spi: mosi-bits: "0"
186-190 spi: mosi-bits: "0"
182-186 spi: mosi-bits: "1"
182-218 spi: mosi-data: "100"
262-266 spi: mosi-bits: "0"
258-262 spi: mosi-bits: "0"
254-258 spi: mosi-bits: "0"
250-254 spi: mosi-bits: "0"
246-250 spi: mosi-bits: "1"
242-246 spi: mosi-bits: "0"
238-242 spi: mosi-bits: "1"
234-238 spi: mosi-bits: "0"
230-234 spi: mosi-bits: "1"
230-266 spi: mosi-data: "150"
309-313 spi: mosi-bits: "0"
305-309 spi: mosi-bits: "0"
301-305 spi: mosi-bits: "1"
297-301 spi: mosi-bits: "1"
293-297 spi: mosi-bits: "0"
289-293 spi: mosi-bits: "1"
285-289 spi: mosi-bits: "0"
281-285 spi: mosi-bits: "0"
277-281 spi: mosi-bits: "0"
277-313 spi: mosi-data: "2C"
356-360 spi: mosi-bits: "0"
352-356 spi: mosi-bits: "0"
348-352 spi: mosi-bits: "0"
344-348 spi: mosi-bits: "0"
340-344 spi: mosi-bits: "0"
336-340 spi: mosi-bits: "0"
332-336 spi: mosi-bits: "0"
328-332 spi: mosi-bits: "0"
324-328 spi: mosi-bits: "1"
324-360 spi: mosi-data: "100"
404-408 spi: mosi-bits: "0"
400-404 spi: mosi-bits: "0"
396-400 spi: mosi-bits: "0"
392-396 spi: mosi-bits: "0"
388-392 spi: mosi-bits: "0"
384-388 spi: mosi-bits: "0"
380-384 spi: mosi-bits: "0"
376-380 spi: mosi-bits: "0"
372-376 spi: mosi-bits: "1"
372-408 spi: mosi-data: "100"
451-455 spi: mosi-bits: "0"
447-451 spi: mosi-bits: "0"
443-447 spi: mosi-bits: "0"
439-443 spi: mosi-bits: "0"
435-439 spi: mosi-bits: "0"
431-435 spi: mosi-bits: "0"
427-431 spi: mosi-bits: "0"
423-427 spi: mosi-bits: "0"
419-423 spi: mosi-bits: "1"
419-455 spi: mosi-data: "100"
