398613-398669 spi: mosi-bit: "0"
398557-398613 spi: mosi-bit: "0"
398501-398557 spi: mosi-bit: "0"
398446-398501 spi: mosi-bit: "0"
398390-398446 spi: mosi-bit: "0"
398334-398390 spi: mosi-bit: "0"
398278-398334 spi: mosi-bit: "0"
398223-398278 spi: mosi-bit: "0"
398223-398669 spi: mosi-data: "00"
399062-399118 spi: mosi-bit: "0"
399006-399062 spi: mosi-bit: "0"
398951-399006 spi: mosi-bit: "0"
398895-398951 spi: mosi-bit: "1"
398838-398895 spi: mosi-bit: "1"
398782-398838 spi: mosi-bit: "0"
398726-398782 spi: mosi-bit: "1"
398669-398726 spi: mosi-bit: "1"
398669-399118 spi: mosi-data: "D8"
399507-399562 spi: mosi-bit: "0"
399452-399507 spi: mosi-bit: "0"
399396-399452 spi: mosi-bit: "0"
399340-399396 spi: mosi-bit: "0"
399285-399340 spi: mosi-bit: "0"
399229-399285 spi: mosi-bit: "0"
399173-399229 spi: mosi-bit: "0"
399118-399173 spi: mosi-bit: "0"
399118-399562 spi: mosi-data: "00"
399955-400012 spi: mosi-bit: "1"
399898-399955 spi: mosi-bit: "0"
399842-399898 spi: mosi-bit: "1"
399786-399842 spi: mosi-bit: "0"
399730-399786 spi: mosi-bit: "0"
399674-399730 spi: mosi-bit: "0"
399619-399674 spi: mosi-bit: "0"
399563-399619 spi: mosi-bit: "0"
399563-400012 spi: mosi-data: "05"
0-399987 spi: mosi-transfer: "00 D8 00 05"
510170-510226 spi: mosi-bit: "0"
510114-510170 spi: mosi-bit: "0"
510059-510114 spi: mosi-bit: "0"
510003-510059 spi: mosi-bit: "0"
509947-510003 spi: mosi-bit: "0"
509892-509947 spi: mosi-bit: "0"
509836-509892 spi: mosi-bit: "0"
509780-509836 spi: mosi-bit: "0"
509780-510226 spi: mosi-data: "00"
510618-510673 spi: mosi-bit: "0"
510563-510618 spi: mosi-bit: "0"
510507-510563 spi: mosi-bit: "1"
510450-510507 spi: mosi-bit: "1"
510394-510450 spi: mosi-bit: "0"
510338-510394 spi: mosi-bit: "0"
510282-510338 spi: mosi-bit: "0"
510227-510282 spi: mosi-bit: "1"
510227-510673 spi: mosi-data: "8C"
511065-511121 spi: mosi-bit: "0"
511009-511065 spi: mosi-bit: "0"
510953-511009 spi: mosi-bit: "0"
510898-510953 spi: mosi-bit: "0"
510842-510898 spi: mosi-bit: "0"
510786-510842 spi: mosi-bit: "0"
510731-510786 spi: mosi-bit: "0"
510675-510731 spi: mosi-bit: "1"
510675-511121 spi: mosi-data: "80"
511516-511572 spi: mosi-bit: "0"
511460-511516 spi: mosi-bit: "0"
511405-511460 spi: mosi-bit: "1"
511348-511405 spi: mosi-bit: "1"
511291-511348 spi: mosi-bit: "1"
511235-511291 spi: mosi-bit: "1"
511178-511235 spi: mosi-bit: "1"
511121-511178 spi: mosi-bit: "1"
511121-511572 spi: mosi-data: "FC"
400000-511548 spi: mosi-transfer: "00 8C 80 FC"
722360-722416 spi: mosi-bit: "0"
722304-722360 spi: mosi-bit: "0"
722249-722304 spi: mosi-bit: "0"
722193-722249 spi: mosi-bit: "0"
722137-722193 spi: mosi-bit: "0"
722082-722137 spi: mosi-bit: "0"
722026-722082 spi: mosi-bit: "0"
721970-722026 spi: mosi-bit: "0"
721970-722416 spi: mosi-data: "00"
722806-722862 spi: mosi-bit: "0"
722750-722806 spi: mosi-bit: "0"
722694-722750 spi: mosi-bit: "0"
722639-722694 spi: mosi-bit: "0"
722583-722639 spi: mosi-bit: "0"
722527-722583 spi: mosi-bit: "0"
722471-722527 spi: mosi-bit: "0"
722416-722471 spi: mosi-bit: "0"
722416-722862 spi: mosi-data: "00"
723252-723308 spi: mosi-bit: "0"
723196-723252 spi: mosi-bit: "0"
723141-723196 spi: mosi-bit: "1"
723084-723141 spi: mosi-bit: "0"
723028-723084 spi: mosi-bit: "0"
722973-723028 spi: mosi-bit: "0"
722917-722973 spi: mosi-bit: "0"
722861-722917 spi: mosi-bit: "0"
722861-723308 spi: mosi-data: "04"
723702-723758 spi: mosi-bit: "1"
723646-723702 spi: mosi-bit: "1"
723589-723646 spi: mosi-bit: "0"
723533-723589 spi: mosi-bit: "0"
723478-723533 spi: mosi-bit: "1"
723421-723478 spi: mosi-bit: "1"
723364-723421 spi: mosi-bit: "0"
723309-723364 spi: mosi-bit: "1"
723309-723758 spi: mosi-data: "B3"
511561-723735 spi: mosi-transfer: "00 00 04 B3"
1017212-1017267 spi: mosi-bit: "0"
1017157-1017212 spi: mosi-bit: "0"
1017101-1017157 spi: mosi-bit: "0"
1017045-1017101 spi: mosi-bit: "0"
1016990-1017045 spi: mosi-bit: "0"
1016934-1016990 spi: mosi-bit: "0"
1016878-1016934 spi: mosi-bit: "0"
1016823-1016878 spi: mosi-bit: "0"
1016823-1017267 spi: mosi-data: "00"
1017658-1017714 spi: mosi-bit: "0"
1017602-1017658 spi: mosi-bit: "0"
1017546-1017602 spi: mosi-bit: "0"
1017491-1017546 spi: mosi-bit: "0"
1017435-1017491 spi: mosi-bit: "0"
1017379-1017435 spi: mosi-bit: "0"
1017324-1017379 spi: mosi-bit: "0"
1017268-1017324 spi: mosi-bit: "0"
1017268-1017714 spi: mosi-data: "00"
1018107-1018163 spi: mosi-bit: "0"
1018051-1018107 spi: mosi-bit: "1"
1017995-1018051 spi: mosi-bit: "1"
1017938-1017995 spi: mosi-bit: "1"
1017881-1017938 spi: mosi-bit: "0"
1017826-1017881 spi: mosi-bit: "0"
1017770-1017826 spi: mosi-bit: "1"
1017713-1017770 spi: mosi-bit: "0"
1017713-1018163 spi: mosi-data: "4E"
1018554-1018609 spi: mosi-bit: "0"
1018499-1018554 spi: mosi-bit: "1"
1018442-1018499 spi: mosi-bit: "0"
1018386-1018442 spi: mosi-bit: "0"
1018331-1018386 spi: mosi-bit: "0"
1018275-1018331 spi: mosi-bit: "0"
1018219-1018275 spi: mosi-bit: "1"
1018163-1018219 spi: mosi-bit: "0"
1018163-1018609 spi: mosi-data: "42"
723747-1018587 spi: mosi-transfer: "00 00 4E 42"
1302774-1302830 spi: mosi-bit: "0"
1302718-1302774 spi: mosi-bit: "0"
1302662-1302718 spi: mosi-bit: "0"
1302607-1302662 spi: mosi-bit: "1"
1302550-1302607 spi: mosi-bit: "0"
1302494-1302550 spi: mosi-bit: "0"
1302439-1302494 spi: mosi-bit: "0"
1302383-1302439 spi: mosi-bit: "0"
1302383-1302830 spi: mosi-data: "08"
1303219-1303275 spi: mosi-bit: "0"
1303163-1303219 spi: mosi-bit: "0"
1303108-1303163 spi: mosi-bit: "0"
1303052-1303108 spi: mosi-bit: "0"
1302996-1303052 spi: mosi-bit: "0"
1302941-1302996 spi: mosi-bit: "0"
1302885-1302941 spi: mosi-bit: "0"
1302829-1302885 spi: mosi-bit: "0"
1302829-1303275 spi: mosi-data: "00"
1303665-1303720 spi: mosi-bit: "0"
1303610-1303665 spi: mosi-bit: "0"
1303554-1303610 spi: mosi-bit: "0"
1303498-1303554 spi: mosi-bit: "0"
1303443-1303498 spi: mosi-bit: "0"
1303387-1303443 spi: mosi-bit: "0"
1303331-1303387 spi: mosi-bit: "0"
1303276-1303331 spi: mosi-bit: "1"
1303276-1303720 spi: mosi-data: "80"
1304113-1304170 spi: mosi-bit: "1"
1304056-1304113 spi: mosi-bit: "0"
1304000-1304056 spi: mosi-bit: "0"
1303945-1304000 spi: mosi-bit: "0"
1303889-1303945 spi: mosi-bit: "1"
1303832-1303889 spi: mosi-bit: "0"
1303777-1303832 spi: mosi-bit: "0"
1303721-1303777 spi: mosi-bit: "0"
1303721-1304170 spi: mosi-data: "11"
1018599-1304145 spi: mosi-transfer: "08 00 80 11"
1506347-1506403 spi: mosi-bit: "0"
1506291-1506347 spi: mosi-bit: "0"
1506235-1506291 spi: mosi-bit: "0"
1506180-1506235 spi: mosi-bit: "0"
1506124-1506180 spi: mosi-bit: "0"
1506068-1506124 spi: mosi-bit: "0"
1506013-1506068 spi: mosi-bit: "0"
1505957-1506013 spi: mosi-bit: "0"
1505957-1506403 spi: mosi-data: "00"
1506794-1506850 spi: mosi-bit: "0"
1506738-1506794 spi: mosi-bit: "0"
1506683-1506738 spi: mosi-bit: "0"
1506627-1506683 spi: mosi-bit: "0"
1506571-1506627 spi: mosi-bit: "1"
1506515-1506571 spi: mosi-bit: "0"
1506459-1506515 spi: mosi-bit: "1"
1506402-1506459 spi: mosi-bit: "0"
1506402-1506850 spi: mosi-data: "50"
1507239-1507294 spi: mosi-bit: "0"
1507184-1507239 spi: mosi-bit: "0"
1507128-1507184 spi: mosi-bit: "0"
1507072-1507128 spi: mosi-bit: "0"
1507017-1507072 spi: mosi-bit: "0"
1506961-1507017 spi: mosi-bit: "0"
1506905-1506961 spi: mosi-bit: "0"
1506850-1506905 spi: mosi-bit: "0"
1506850-1507294 spi: mosi-data: "00"
1507685-1507741 spi: mosi-bit: "0"
1507629-1507685 spi: mosi-bit: "0"
1507574-1507629 spi: mosi-bit: "0"
1507518-1507574 spi: mosi-bit: "0"
1507462-1507518 spi: mosi-bit: "0"
1507406-1507462 spi: mosi-bit: "0"
1507351-1507406 spi: mosi-bit: "0"
1507295-1507351 spi: mosi-bit: "0"
1507295-1507741 spi: mosi-data: "00"
1304158-1507717 spi: mosi-transfer: "00 50 00 00"
