95-99 spi: miso-bits: "1"
91-95 spi: miso-bits: "0"
87-91 spi: miso-bits: "1"
83-87 spi: miso-bits: "1"
79-83 spi: miso-bits: "0"
75-79 spi: miso-bits: "0"
71-75 spi: miso-bits: "0"
67-71 spi: miso-bits: "0"
95-99 spi: mosi-bits: "1"
91-95 spi: mosi-bits: "1"
87-91 spi: mosi-bits: "0"
83-87 spi: mosi-bits: "1"
79-83 spi: mosi-bits: "1"
75-79 spi: mosi-bits: "1"
71-75 spi: mosi-bits: "1"
67-71 spi: mosi-bits: "1"
67-99 spi: miso-data: "0D"
67-99 spi: mosi-data: "FB"
146-150 spi: miso-bits: "1"
142-146 spi: miso-bits: "0"
137-142 spi: miso-bits: "1"
133-137 spi: miso-bits: "1"
129-133 spi: miso-bits: "0"
125-129 spi: miso-bits: "0"
121-125 spi: miso-bits: "0"
117-121 spi: miso-bits: "0"
146-150 spi: mosi-bits: "0"
142-146 spi: mosi-bits: "0"
137-142 spi: mosi-bits: "0"
133-137 spi: mosi-bits: "0"
129-133 spi: mosi-bits: "0"
125-129 spi: mosi-bits: "0"
121-125 spi: mosi-bits: "0"
117-121 spi: mosi-bits: "0"
117-150 spi: miso-data: "0D"
117-150 spi: mosi-data: "00"
279-283 spi: miso-bits: "1"
275-279 spi: miso-bits: "0"
271-275 spi: miso-bits: "1"
267-271 spi: miso-bits: "1"
262-267 spi: miso-bits: "0"
258-262 spi: miso-bits: "0"
254-258 spi: miso-bits: "0"
250-254 spi: miso-bits: "0"
279-283 spi: mosi-bits: "1"
275-279 spi: mosi-bits: "1"
271-275 spi: mosi-bits: "1"
267-271 spi: mosi-bits: "1"
262-267 spi: mosi-bits: "1"
258-262 spi: mosi-bits: "1"
254-258 spi: mosi-bits: "0"
250-254 spi: mosi-bits: "1"
250-283 spi: miso-data: "0D"
250-283 spi: mosi-data: "BF"
329-333 spi: miso-bits: "0"
325-329 spi: miso-bits: "1"
321-325 spi: miso-bits: "0"
317-321 spi: miso-bits: "1"
313-317 spi: miso-bits: "0"
309-313 spi: miso-bits: "0"
305-309 spi: miso-bits: "0"
301-305 spi: miso-bits: "0"
329-333 spi: mosi-bits: "0"
325-329 spi: mosi-bits: "0"
321-325 spi: mosi-bits: "0"
317-321 spi: mosi-bits: "0"
313-317 spi: mosi-bits: "0"
309-313 spi: mosi-bits: "0"
305-309 spi: mosi-bits: "0"
301-305 spi: mosi-bits: "0"
301-333 spi: miso-data: "0A"
301-333 spi: mosi-data: "00"
430-434 spi: miso-bits: "0"
426-430 spi: miso-bits: "0"
422-426 spi: miso-bits: "1"
418-422 spi: miso-bits: "1"
414-418 spi: miso-bits: "0"
410-414 spi: miso-bits: "0"
406-410 spi: miso-bits: "0"
402-406 spi: miso-bits: "0"
430-434 spi: mosi-bits: "1"
426-430 spi: mosi-bits: "1"
422-426 spi: mosi-bits: "1"
418-422 spi: mosi-bits: "1"
414-418 spi: mosi-bits: "1"
410-414 spi: mosi-bits: "1"
406-410 spi: mosi-bits: "1"
402-406 spi: mosi-bits: "1"
402-434 spi: miso-data: "0C"
402-434 spi: mosi-data: "FF"
488-492 spi: miso-bits: "0"
484-488 spi: miso-bits: "0"
480-484 spi: miso-bits: "0"
476-480 spi: miso-bits: "0"
472-476 spi: miso-bits: "1"
468-472 spi: miso-bits: "1"
464-468 spi: miso-bits: "1"
460-464 spi: miso-bits: "0"
488-492 spi: mosi-bits: "0"
484-488 spi: mosi-bits: "0"
480-484 spi: mosi-bits: "0"
476-480 spi: mosi-bits: "0"
472-476 spi: mosi-bits: "0"
468-472 spi: mosi-bits: "0"
464-468 spi: mosi-bits: "0"
460-464 spi: mosi-bits: "0"
460-492 spi: miso-data: "70"
460-492 spi: mosi-data: "00"
551-555 spi: miso-bits: "0"
547-551 spi: miso-bits: "0"
543-547 spi: miso-bits: "1"
539-543 spi: miso-bits: "1"
535-539 spi: miso-bits: "0"
531-535 spi: miso-bits: "0"
526-531 spi: miso-bits: "1"
522-526 spi: miso-bits: "1"
551-555 spi: mosi-bits: "0"
547-551 spi: mosi-bits: "0"
543-547 spi: mosi-bits: "0"
539-543 spi: mosi-bits: "0"
535-539 spi: mosi-bits: "0"
531-535 spi: mosi-bits: "0"
526-531 spi: mosi-bits: "0"
522-526 spi: mosi-bits: "0"
522-555 spi: miso-data: "CC"
522-555 spi: mosi-data: "00"
613-617 spi: miso-bits: "0"
609-613 spi: miso-bits: "1"
605-609 spi: miso-bits: "0"
601-605 spi: miso-bits: "1"
597-601 spi: miso-bits: "0"
593-597 spi: miso-bits: "1"
589-593 spi: miso-bits: "0"
585-589 spi: miso-bits: "1"
613-617 spi: mosi-bits: "0"
609-613 spi: mosi-bits: "0"
605-609 spi: mosi-bits: "0"
601-605 spi: mosi-bits: "0"
597-601 spi: mosi-bits: "0"
593-597 spi: mosi-bits: "0"
589-593 spi: mosi-bits: "0"
585-589 spi: mosi-bits: "0"
585-617 spi: miso-data: "AA"
585-617 spi: mosi-data: "00"
676-680 spi: miso-bits: "0"
672-676 spi: miso-bits: "0"
668-672 spi: miso-bits: "0"
664-668 spi: miso-bits: "1"
660-664 spi: miso-bits: "1"
655-660 spi: miso-bits: "0"
651-655 spi: miso-bits: "0"
647-651 spi: miso-bits: "1"
676-680 spi: mosi-bits: "0"
672-676 spi: mosi-bits: "0"
668-672 spi: mosi-bits: "0"
664-668 spi: mosi-bits: "0"
660-664 spi: mosi-bits: "0"
655-660 spi: mosi-bits: "0"
651-655 spi: mosi-bits: "0"
647-651 spi: mosi-bits: "0"
647-680 spi: miso-data: "98"
647-680 spi: mosi-data: "00"
738-742 spi: miso-bits: "1"
734-738 spi: miso-bits: "0"
730-734 spi: miso-bits: "0"
726-730 spi: miso-bits: "0"
722-726 spi: miso-bits: "0"
718-722 spi: miso-bits: "0"
714-718 spi: miso-bits: "1"
710-714 spi: miso-bits: "0"
738-742 spi: mosi-bits: "0"
734-738 spi: mosi-bits: "0"
730-734 spi: mosi-bits: "0"
726-730 spi: mosi-bits: "0"
722-726 spi: mosi-bits: "0"
718-722 spi: mosi-bits: "0"
714-718 spi: mosi-bits: "0"
710-714 spi: mosi-bits: "0"
710-742 spi: miso-data: "41"
710-742 spi: mosi-data: "00"
801-805 spi: miso-bits: "0"
797-801 spi: miso-bits: "0"
793-797 spi: miso-bits: "0"
789-793 spi: miso-bits: "1"
784-789 spi: miso-bits: "1"
780-784 spi: miso-bits: "0"
776-780 spi: miso-bits: "0"
772-776 spi: miso-bits: "1"
801-805 spi: mosi-bits: "0"
797-801 spi: mosi-bits: "0"
793-797 spi: mosi-bits: "0"
789-793 spi: mosi-bits: "0"
784-789 spi: mosi-bits: "0"
780-784 spi: mosi-bits: "0"
776-780 spi: mosi-bits: "0"
772-776 spi: mosi-bits: "0"
772-805 spi: miso-data: "98"
772-805 spi: mosi-data: "00"
863-867 spi: miso-bits: "0"
859-863 spi: miso-bits: "1"
855-859 spi: miso-bits: "0"
851-855 spi: miso-bits: "0"
847-851 spi: miso-bits: "0"
843-847 spi: miso-bits: "1"
839-843 spi: miso-bits: "0"
835-839 spi: miso-bits: "0"
863-867 spi: mosi-bits: "0"
859-863 spi: mosi-bits: "0"
855-859 spi: mosi-bits: "0"
851-855 spi: mosi-bits: "0"
847-851 spi: mosi-bits: "0"
843-847 spi: mosi-bits: "0"
839-843 spi: mosi-bits: "0"
835-839 spi: mosi-bits: "0"
835-867 spi: miso-data: "22"
835-867 spi: mosi-data: "00"
926-930 spi: miso-bits: "0"
922-926 spi: miso-bits: "1"
918-922 spi: miso-bits: "0"
913-918 spi: miso-bits: "1"
909-913 spi: miso-bits: "1"
905-909 spi: miso-bits: "1"
901-905 spi: miso-bits: "0"
897-901 spi: miso-bits: "1"
926-930 spi: mosi-bits: "0"
922-926 spi: mosi-bits: "0"
918-922 spi: mosi-bits: "0"
913-918 spi: mosi-bits: "0"
909-913 spi: mosi-bits: "0"
905-909 spi: mosi-bits: "0"
901-905 spi: mosi-bits: "0"
897-901 spi: mosi-bits: "0"
897-930 spi: miso-data: "BA"
897-930 spi: mosi-data: "00"
988-992 spi: miso-bits: "1"
984-988 spi: miso-bits: "1"
980-984 spi: miso-bits: "1"
976-980 spi: miso-bits: "1"
972-976 spi: miso-bits: "1"
968-972 spi: miso-bits: "1"
964-968 spi: miso-bits: "0"
960-964 spi: miso-bits: "0"
988-992 spi: mosi-bits: "0"
984-988 spi: mosi-bits: "0"
980-984 spi: mosi-bits: "0"
976-980 spi: mosi-bits: "0"
972-976 spi: mosi-bits: "0"
968-972 spi: mosi-bits: "0"
964-968 spi: mosi-bits: "0"
960-964 spi: mosi-bits: "0"
960-992 spi: miso-data: "3F"
960-992 spi: mosi-data: "00"
1051-1055 spi: miso-bits: "0"
1047-1051 spi: miso-bits: "0"
1042-1047 spi: miso-bits: "0"
1038-1042 spi: miso-bits: "0"
1034-1038 spi: miso-bits: "0"
1030-1034 spi: miso-bits: "0"
1026-1030 spi: miso-bits: "0"
1022-1026 spi: miso-bits: "1"
1051-1055 spi: mosi-bits: "0"
1047-1051 spi: mosi-bits: "0"
1042-1047 spi: mosi-bits: "0"
1038-1042 spi: mosi-bits: "0"
1034-1038 spi: mosi-bits: "0"
1030-1034 spi: mosi-bits: "0"
1026-1030 spi: mosi-bits: "0"
1022-1026 spi: mosi-bits: "0"
1022-1055 spi: miso-data: "80"
1022-1055 spi: mosi-data: "00"
1147-1151 spi: miso-bits: "0"
1143-1147 spi: miso-bits: "1"
1139-1143 spi: miso-bits: "0"
1135-1139 spi: miso-bits: "0"
1131-1135 spi: miso-bits: "0"
1127-1131 spi: miso-bits: "0"
1123-1127 spi: miso-bits: "0"
1119-1123 spi: miso-bits: "0"
1147-1151 spi: mosi-bits: "1"
1143-1147 spi: mosi-bits: "1"
1139-1143 spi: mosi-bits: "1"
1135-1139 spi: mosi-bits: "1"
1131-1135 spi: mosi-bits: "1"
1127-1131 spi: mosi-bits: "1"
1123-1127 spi: mosi-bits: "1"
1119-1123 spi: mosi-bits: "1"
1119-1151 spi: miso-data: "02"
1119-1151 spi: mosi-data: "FF"
1206-1210 spi: miso-bits: "1"
1202-1206 spi: miso-bits: "0"
1198-1202 spi: miso-bits: "0"
1194-1198 spi: miso-bits: "1"
1190-1194 spi: miso-bits: "0"
1186-1190 spi: miso-bits: "1"
1182-1186 spi: miso-bits: "0"
1178-1182 spi: miso-bits: "0"
1206-1210 spi: mosi-bits: "0"
1202-1206 spi: mosi-bits: "0"
1198-1202 spi: mosi-bits: "0"
1194-1198 spi: mosi-bits: "0"
1190-1194 spi: mosi-bits: "0"
1186-1190 spi: mosi-bits: "0"
1182-1186 spi: mosi-bits: "0"
1178-1182 spi: mosi-bits: "0"
1178-1210 spi: miso-data: "29"
1178-1210 spi: mosi-data: "00"
1268-1272 spi: miso-bits: "0"
1264-1268 spi: miso-bits: "1"
1260-1264 spi: miso-bits: "1"
1256-1260 spi: miso-bits: "0"
1252-1256 spi: miso-bits: "0"
1248-1252 spi: miso-bits: "0"
1244-1248 spi: miso-bits: "0"
1240-1244 spi: miso-bits: "1"
1268-1272 spi: mosi-bits: "0"
1264-1268 spi: mosi-bits: "0"
1260-1264 spi: mosi-bits: "0"
1256-1260 spi: mosi-bits: "0"
1252-1256 spi: mosi-bits: "0"
1248-1252 spi: mosi-bits: "0"
1244-1248 spi: mosi-bits: "0"
1240-1244 spi: mosi-bits: "0"
1240-1272 spi: miso-data: "86"
1240-1272 spi: mosi-data: "00"
1361-1365 spi: miso-bits: "1"
1357-1361 spi: miso-bits: "1"
1353-1357 spi: miso-bits: "1"
1349-1353 spi: miso-bits: "1"
1345-1349 spi: miso-bits: "0"
1341-1345 spi: miso-bits: "0"
1337-1341 spi: miso-bits: "0"
1333-1337 spi: miso-bits: "0"
1361-1365 spi: mosi-bits: "0"
1357-1361 spi: mosi-bits: "1"
1353-1357 spi: mosi-bits: "0"
1349-1353 spi: mosi-bits: "1"
1345-1349 spi: mosi-bits: "1"
1341-1345 spi: mosi-bits: "1"
1337-1341 spi: mosi-bits: "0"
1333-1337 spi: mosi-bits: "0"
1333-1365 spi: miso-data: "0F"
1333-1365 spi: mosi-data: "3A"
