114-1590 x2444m: rcl: "RCL" "R"
2091-3567 x2444m: wren: "WREN" "W"
4077-8677 x2444m: write: "WRITE: 0x0 => 0xabcd" "W: 0x0 => 0xabcd" "W"
9187-13787 x2444m: write: "WRITE: 0x1 => 0x1234" "W: 0x1 => 0x1234" "W"
14301-18901 x2444m: write: "WRITE: 0x2 => 0xabcd" "W: 0x2 => 0xabcd" "W"
19411-24011 x2444m: write: "WRITE: 0x3 => 0x1234" "W: 0x3 => 0x1234" "W"
24525-29125 x2444m: write: "WRITE: 0x4 => 0xabcd" "W: 0x4 => 0xabcd" "W"
29635-34235 x2444m: write: "WRITE: 0x5 => 0x1234" "W: 0x5 => 0x1234" "W"
34750-39350 x2444m: write: "WRITE: 0x6 => 0xabcd" "W: 0x6 => 0xabcd" "W"
39860-44460 x2444m: write: "WRITE: 0x7 => 0x1234" "W: 0x7 => 0x1234" "W"
44974-49574 x2444m: write: "WRITE: 0x8 => 0xabcd" "W: 0x8 => 0xabcd" "W"
50084-54684 x2444m: write: "WRITE: 0x9 => 0x1234" "W: 0x9 => 0x1234" "W"
55198-59798 x2444m: write: "WRITE: 0xa => 0xabcd" "W: 0xa => 0xabcd" "W"
60308-64908 x2444m: write: "WRITE: 0xb => 0x1234" "W: 0xb => 0x1234" "W"
65423-70023 x2444m: write: "WRITE: 0xc => 0xabcd" "W: 0xc => 0xabcd" "W"
70532-75132 x2444m: write: "WRITE: 0xd => 0x1234" "W: 0xd => 0x1234" "W"
75647-80247 x2444m: write: "WRITE: 0xe => 0xabcd" "W: 0xe => 0xabcd" "W"
80757-85357 x2444m: write: "WRITE: 0xf => 0x1234" "W: 0xf => 0x1234" "W"
85862-87338 x2444m: sto: "STO" "S"
376039-377515 x2444m: rcl: "RCL" "R"
378016-379492 x2444m: wren: "WREN" "W"
379976-384574 x2444m: read: "READ: 0x0 => 0xabcd" "R: 0x0 => 0xabcd" "R"
385063-389662 x2444m: read: "READ: 0x1 => 0x1234" "R: 0x1 => 0x1234" "R"
390158-394757 x2444m: read: "READ: 0x2 => 0xabcd" "R: 0x2 => 0xabcd" "R"
395246-399844 x2444m: read: "READ: 0x3 => 0x1234" "R: 0x3 => 0x1234" "R"
400341-404939 x2444m: read: "READ: 0x4 => 0xabcd" "R: 0x4 => 0xabcd" "R"
405428-410027 x2444m: read: "READ: 0x5 => 0x1234" "R: 0x5 => 0x1234" "R"
410523-415122 x2444m: read: "READ: 0x6 => 0xabcd" "R: 0x6 => 0xabcd" "R"
415611-420209 x2444m: read: "READ: 0x7 => 0x1234" "R: 0x7 => 0x1234" "R"
420706-425304 x2444m: read: "READ: 0x8 => 0xabcd" "R: 0x8 => 0xabcd" "R"
425793-430392 x2444m: read: "READ: 0x9 => 0x1234" "R: 0x9 => 0x1234" "R"
430888-435486 x2444m: read: "READ: 0xa => 0xabcd" "R: 0xa => 0xabcd" "R"
435975-440574 x2444m: read: "READ: 0xb => 0x1234" "R: 0xb => 0x1234" "R"
441070-445669 x2444m: read: "READ: 0xc => 0xabcd" "R: 0xc => 0xabcd" "R"
446158-450756 x2444m: read: "READ: 0xd => 0x1234" "R: 0xd => 0x1234" "R"
451253-455851 x2444m: read: "READ: 0xe => 0xabcd" "R: 0xe => 0xabcd" "R"
456340-460939 x2444m: read: "READ: 0xf => 0x1234" "R: 0xf => 0x1234" "R"
