454639-454755 sdcard_sd: bit: "0"
454755-454872 sdcard_sd: bit: "1"
454872-454988 sdcard_sd: bit: "0"
454988-455104 sdcard_sd: bit: "0"
455104-455221 sdcard_sd: bit: "0"
455221-455337 sdcard_sd: bit: "0"
455337-455454 sdcard_sd: bit: "0"
455454-455570 sdcard_sd: bit: "0"
455570-455686 sdcard_sd: bit: "0"
455686-455803 sdcard_sd: bit: "0"
455803-455919 sdcard_sd: bit: "0"
455919-456035 sdcard_sd: bit: "0"
456035-456152 sdcard_sd: bit: "0"
456152-456268 sdcard_sd: bit: "0"
456268-456384 sdcard_sd: bit: "0"
456384-456501 sdcard_sd: bit: "0"
456501-456617 sdcard_sd: bit: "0"
456617-456734 sdcard_sd: bit: "0"
456734-456850 sdcard_sd: bit: "0"
456850-456966 sdcard_sd: bit: "0"
456966-457083 sdcard_sd: bit: "0"
457083-457199 sdcard_sd: bit: "0"
457199-457315 sdcard_sd: bit: "0"
457315-457432 sdcard_sd: bit: "0"
457432-457548 sdcard_sd: bit: "0"
457548-457665 sdcard_sd: bit: "0"
457665-457781 sdcard_sd: bit: "0"
457781-457897 sdcard_sd: bit: "0"
457897-458014 sdcard_sd: bit: "0"
458014-458130 sdcard_sd: bit: "0"
458130-458246 sdcard_sd: bit: "0"
458246-458363 sdcard_sd: bit: "0"
458363-458479 sdcard_sd: bit: "0"
458479-458596 sdcard_sd: bit: "0"
458596-458712 sdcard_sd: bit: "0"
458712-458828 sdcard_sd: bit: "0"
458828-458945 sdcard_sd: bit: "0"
458945-459061 sdcard_sd: bit: "0"
459061-459177 sdcard_sd: bit: "0"
459177-459294 sdcard_sd: bit: "0"
459294-459410 sdcard_sd: bit: "1"
459410-459527 sdcard_sd: bit: "0"
459527-459643 sdcard_sd: bit: "0"
459643-459759 sdcard_sd: bit: "1"
459759-459876 sdcard_sd: bit: "0"
459876-459992 sdcard_sd: bit: "1"
459992-460108 sdcard_sd: bit: "0"
460108-460224 sdcard_sd: bit: "1"
454639-454755 sdcard_sd: field-start: "Start bit" "Start" "S"
454755-454872 sdcard_sd: field-transmission: "Transmission: host" "T: host" "T"
454872-455570 sdcard_sd: field-cmd: "Command: GO_IDLE_STATE (0)" "Cmd: GO_IDLE_STATE (0)" "CMD0" "Cmd" "C"
455570-459294 sdcard_sd: field-arg: "Argument: 0x00000000" "Arg" "A"
459294-460108 sdcard_sd: field-crc: "CRC: 0x4a" "CRC" "C"
460108-460224 sdcard_sd: field-end: "End bit" "End" "E"
455570-459294 sdcard_sd: decoded-field: "Stuff bits" "Stuff" "SB" "S"
454639-460224 sdcard_sd: cmd0: "CMD0 (GO_IDLE_STATE): Reset all SD cards" "CMD0 (GO_IDLE_STATE)" "CMD0"
464181-464298 sdcard_sd: bit: "0"
464298-464414 sdcard_sd: bit: "1"
464414-464530 sdcard_sd: bit: "0"
464530-464647 sdcard_sd: bit: "0"
464647-464763 sdcard_sd: bit: "1"
464763-464880 sdcard_sd: bit: "0"
464880-464996 sdcard_sd: bit: "0"
464996-465112 sdcard_sd: bit: "0"
465112-465229 sdcard_sd: bit: "0"
465229-465345 sdcard_sd: bit: "0"
465345-465461 sdcard_sd: bit: "0"
465461-465578 sdcard_sd: bit: "0"
465578-465694 sdcard_sd: bit: "0"
465694-465811 sdcard_sd: bit: "0"
465811-465927 sdcard_sd: bit: "0"
465927-466043 sdcard_sd: bit: "0"
466043-466160 sdcard_sd: bit: "0"
466160-466276 sdcard_sd: bit: "0"
466276-466392 sdcard_sd: bit: "0"
466392-466509 sdcard_sd: bit: "0"
466509-466625 sdcard_sd: bit: "0"
466625-466742 sdcard_sd: bit: "0"
466742-466858 sdcard_sd: bit: "0"
466858-466974 sdcard_sd: bit: "0"
466974-467091 sdcard_sd: bit: "0"
467091-467207 sdcard_sd: bit: "0"
467207-467323 sdcard_sd: bit: "0"
467323-467440 sdcard_sd: bit: "0"
467440-467556 sdcard_sd: bit: "0"
467556-467673 sdcard_sd: bit: "0"
467673-467789 sdcard_sd: bit: "0"
467789-467905 sdcard_sd: bit: "1"
467905-468022 sdcard_sd: bit: "1"
468022-468138 sdcard_sd: bit: "0"
468138-468254 sdcard_sd: bit: "1"
468254-468371 sdcard_sd: bit: "0"
468371-468487 sdcard_sd: bit: "1"
468487-468603 sdcard_sd: bit: "0"
468603-468720 sdcard_sd: bit: "1"
468720-468836 sdcard_sd: bit: "0"
468836-468953 sdcard_sd: bit: "1"
468953-469069 sdcard_sd: bit: "0"
469069-469185 sdcard_sd: bit: "0"
469185-469302 sdcard_sd: bit: "0"
469302-469418 sdcard_sd: bit: "0"
469418-469534 sdcard_sd: bit: "1"
469534-469651 sdcard_sd: bit: "1"
469651-469768 sdcard_sd: bit: "1"
464181-464298 sdcard_sd: field-start: "Start bit" "Start" "S"
464298-464414 sdcard_sd: field-transmission: "Transmission: host" "T: host" "T"
464414-465112 sdcard_sd: field-cmd: "Command: SEND_IF_COND (8)" "Cmd: SEND_IF_COND (8)" "CMD8" "Cmd" "C"
465112-468836 sdcard_sd: field-arg: "Argument: 0x000001aa" "Arg" "A"
468836-469651 sdcard_sd: field-crc: "CRC: 0x43" "CRC" "C"
469651-469768 sdcard_sd: field-end: "End bit" "End" "E"
465112-467440 sdcard_sd: decoded-field: "Reserved" "Res" "R"
467440-467905 sdcard_sd: decoded-field: "Supply voltage" "Voltage" "VHS" "V"
467905-468836 sdcard_sd: decoded-field: "Check pattern" "Check pat" "Check" "C"
464181-469768 sdcard_sd: cmd8: "CMD8 (SEND_IF_COND): Send interface condition to card" "CMD8 (SEND_IF_COND)" "CMD8"
470349-470465 sdcard_sd: bit: "0"
470465-470582 sdcard_sd: bit: "0"
470582-470698 sdcard_sd: bit: "0"
470698-470815 sdcard_sd: bit: "0"
470815-470931 sdcard_sd: bit: "1"
470931-471047 sdcard_sd: bit: "0"
471047-471164 sdcard_sd: bit: "0"
471164-471280 sdcard_sd: bit: "0"
471280-471396 sdcard_sd: bit: "0"
471396-471513 sdcard_sd: bit: "0"
471513-471629 sdcard_sd: bit: "0"
471629-471746 sdcard_sd: bit: "0"
471746-471862 sdcard_sd: bit: "0"
471862-471978 sdcard_sd: bit: "0"
471978-472095 sdcard_sd: bit: "0"
472095-472211 sdcard_sd: bit: "0"
472211-472327 sdcard_sd: bit: "0"
472327-472444 sdcard_sd: bit: "0"
472444-472560 sdcard_sd: bit: "0"
472560-472676 sdcard_sd: bit: "0"
472676-472793 sdcard_sd: bit: "0"
472793-472909 sdcard_sd: bit: "0"
472909-473026 sdcard_sd: bit: "0"
473026-473142 sdcard_sd: bit: "0"
473142-473258 sdcard_sd: bit: "0"
473258-473375 sdcard_sd: bit: "0"
473375-473491 sdcard_sd: bit: "0"
473491-473607 sdcard_sd: bit: "0"
473607-473724 sdcard_sd: bit: "0"
473724-473840 sdcard_sd: bit: "0"
473840-473957 sdcard_sd: bit: "0"
473957-474073 sdcard_sd: bit: "1"
474073-474189 sdcard_sd: bit: "1"
474189-474306 sdcard_sd: bit: "0"
474306-474422 sdcard_sd: bit: "1"
474422-474538 sdcard_sd: bit: "0"
474538-474655 sdcard_sd: bit: "1"
474655-474771 sdcard_sd: bit: "0"
474771-474888 sdcard_sd: bit: "1"
474888-475004 sdcard_sd: bit: "0"
475004-475120 sdcard_sd: bit: "0"
475120-475237 sdcard_sd: bit: "0"
475237-475353 sdcard_sd: bit: "0"
475353-475469 sdcard_sd: bit: "1"
475469-475586 sdcard_sd: bit: "0"
475586-475702 sdcard_sd: bit: "0"
475702-475819 sdcard_sd: bit: "1"
475819-475936 sdcard_sd: bit: "1"
470349-470465 sdcard_sd: field-start: "Start bit" "Start" "S"
470465-470582 sdcard_sd: field-transmission: "Transmission: card" "T: card" "T"
470582-471280 sdcard_sd: field-cmd: "Command: SEND_IF_COND (8)" "Cmd: SEND_IF_COND (8)" "CMD8" "Cmd" "C"
471280-475004 sdcard_sd: field-arg: "Argument: 0x000001aa" "Arg" "A"
475004-475819 sdcard_sd: field-crc: "CRC: 0x9" "CRC" "C"
475819-475936 sdcard_sd: field-end: "End bit" "End" "E"
470349-475936 sdcard_sd: r7: "Response: R7"
471280-473607 sdcard_sd: decoded-field: "Reserved" "Res" "R"
473607-474073 sdcard_sd: decoded-field: "Voltage accepted: 2.7-3.6V" "Voltage" "Volt" "V"
474073-475004 sdcard_sd: decoded-field: "Echo-back of check pattern" "Echo" "E"
480590-480706 sdcard_sd: bit: "0"
480706-480823 sdcard_sd: bit: "1"
480823-480939 sdcard_sd: bit: "1"
480939-481055 sdcard_sd: bit: "1"
481055-481172 sdcard_sd: bit: "0"
481172-481288 sdcard_sd: bit: "1"
481288-481404 sdcard_sd: bit: "1"
481404-481521 sdcard_sd: bit: "1"
481521-481637 sdcard_sd: bit: "0"
481637-481753 sdcard_sd: bit: "0"
481753-481870 sdcard_sd: bit: "0"
481870-481986 sdcard_sd: bit: "0"
481986-482103 sdcard_sd: bit: "0"
482103-482219 sdcard_sd: bit: "0"
482219-482335 sdcard_sd: bit: "0"
482335-482452 sdcard_sd: bit: "0"
482452-482568 sdcard_sd: bit: "0"
482568-482684 sdcard_sd: bit: "0"
482684-482801 sdcard_sd: bit: "0"
482801-482917 sdcard_sd: bit: "0"
482917-483034 sdcard_sd: bit: "0"
483034-483150 sdcard_sd: bit: "0"
483150-483266 sdcard_sd: bit: "0"
483266-483383 sdcard_sd: bit: "0"
483383-483499 sdcard_sd: bit: "0"
483499-483615 sdcard_sd: bit: "0"
483615-483732 sdcard_sd: bit: "0"
483732-483848 sdcard_sd: bit: "0"
483848-483965 sdcard_sd: bit: "0"
483965-484081 sdcard_sd: bit: "0"
484081-484197 sdcard_sd: bit: "0"
484197-484314 sdcard_sd: bit: "0"
484314-484430 sdcard_sd: bit: "0"
484430-484546 sdcard_sd: bit: "0"
484546-484663 sdcard_sd: bit: "0"
484663-484779 sdcard_sd: bit: "0"
484779-484896 sdcard_sd: bit: "0"
484896-485012 sdcard_sd: bit: "0"
485012-485128 sdcard_sd: bit: "0"
485128-485245 sdcard_sd: bit: "0"
485245-485361 sdcard_sd: bit: "0"
485361-485477 sdcard_sd: bit: "1"
485477-485594 sdcard_sd: bit: "1"
485594-485710 sdcard_sd: bit: "0"
485710-485826 sdcard_sd: bit: "0"
485826-485943 sdcard_sd: bit: "1"
485943-486059 sdcard_sd: bit: "0"
486059-486175 sdcard_sd: bit: "1"
480590-480706 sdcard_sd: field-start: "Start bit" "Start" "S"
480706-480823 sdcard_sd: field-transmission: "Transmission: host" "T: host" "T"
480823-481521 sdcard_sd: field-cmd: "Command: APP_CMD (55)" "Cmd: APP_CMD (55)" "CMD55" "Cmd" "C"
481521-485245 sdcard_sd: field-arg: "Argument: 0x00000000" "Arg" "A"
485245-486059 sdcard_sd: field-crc: "CRC: 0x32" "CRC" "C"
486059-486175 sdcard_sd: field-end: "End bit" "End" "E"
481521-483383 sdcard_sd: decoded-field: "RCA" "R"
483383-485245 sdcard_sd: decoded-field: "Stuff bits" "Stuff" "SB" "S"
480590-486175 sdcard_sd: cmd55: "CMD55 (APP_CMD): Next command is an application-specific command" "CMD55 (APP_CMD)" "CMD55"
486757-486874 sdcard_sd: bit: "0"
486874-486990 sdcard_sd: bit: "0"
486990-487107 sdcard_sd: bit: "1"
487107-487223 sdcard_sd: bit: "1"
487223-487339 sdcard_sd: bit: "0"
487339-487456 sdcard_sd: bit: "1"
487456-487572 sdcard_sd: bit: "1"
487572-487688 sdcard_sd: bit: "1"
487688-487805 sdcard_sd: bit: "0"
487805-487921 sdcard_sd: bit: "0"
487921-488038 sdcard_sd: bit: "0"
488038-488154 sdcard_sd: bit: "0"
488154-488270 sdcard_sd: bit: "0"
488270-488387 sdcard_sd: bit: "0"
488387-488503 sdcard_sd: bit: "0"
488503-488619 sdcard_sd: bit: "0"
488619-488736 sdcard_sd: bit: "0"
488736-488852 sdcard_sd: bit: "0"
488852-488969 sdcard_sd: bit: "0"
488969-489085 sdcard_sd: bit: "0"
489085-489201 sdcard_sd: bit: "0"
489201-489318 sdcard_sd: bit: "0"
489318-489434 sdcard_sd: bit: "0"
489434-489550 sdcard_sd: bit: "0"
489550-489667 sdcard_sd: bit: "0"
489667-489783 sdcard_sd: bit: "0"
489783-489899 sdcard_sd: bit: "0"
489899-490016 sdcard_sd: bit: "0"
490016-490132 sdcard_sd: bit: "0"
490132-490249 sdcard_sd: bit: "0"
490249-490365 sdcard_sd: bit: "0"
490365-490481 sdcard_sd: bit: "1"
490481-490598 sdcard_sd: bit: "0"
490598-490714 sdcard_sd: bit: "0"
490714-490830 sdcard_sd: bit: "1"
490830-490947 sdcard_sd: bit: "0"
490947-491063 sdcard_sd: bit: "0"
491063-491180 sdcard_sd: bit: "0"
491180-491296 sdcard_sd: bit: "0"
491296-491412 sdcard_sd: bit: "0"
491412-491529 sdcard_sd: bit: "1"
491529-491645 sdcard_sd: bit: "0"
491645-491761 sdcard_sd: bit: "0"
491761-491878 sdcard_sd: bit: "0"
491878-491994 sdcard_sd: bit: "0"
491994-492111 sdcard_sd: bit: "0"
492111-492227 sdcard_sd: bit: "1"
492227-492343 sdcard_sd: bit: "1"
486757-486874 sdcard_sd: field-start: "Start bit" "Start" "S"
486874-486990 sdcard_sd: field-transmission: "Transmission: card" "T: card" "T"
486990-487688 sdcard_sd: field-cmd: "Command: Non-existant (55)" "Cmd: Non-existant (55)" "CMD55" "Cmd" "C"
487688-491412 sdcard_sd: field-arg: "Argument: 0x00000120" "Arg" "A"
491412-492227 sdcard_sd: field-crc: "CRC: 0x41" "CRC" "C"
492227-492343 sdcard_sd: field-end: "End bit" "End" "E"
486757-492343 sdcard_sd: r1: "Response: R1"
487688-491412 sdcard_sd: decoded-field: "Card status" "Status" "S"
487688-487805 sdcard_sd: decoded-bit: "OUT_OF_RANGE"
487805-487921 sdcard_sd: decoded-bit: "ADDRESS_ERROR"
487921-488038 sdcard_sd: decoded-bit: "BLOCK_LEN_ERROR"
488038-488154 sdcard_sd: decoded-bit: "ERASE_SEQ_ERROR"
488154-488270 sdcard_sd: decoded-bit: "ERASE_PARAM"
488270-488387 sdcard_sd: decoded-bit: "WP_VIOLATION"
488387-488503 sdcard_sd: decoded-bit: "CARD_IS_LOCKED"
488503-488619 sdcard_sd: decoded-bit: "LOCK_UNLOCK_FAILED"
488619-488736 sdcard_sd: decoded-bit: "COM_CRC_ERROR"
488736-488852 sdcard_sd: decoded-bit: "ILLEGAL_COMMAND"
488852-488969 sdcard_sd: decoded-bit: "CARD_ECC_FAILED"
488969-489085 sdcard_sd: decoded-bit: "CC_ERROR"
489085-489201 sdcard_sd: decoded-bit: "ERROR"
489201-489318 sdcard_sd: decoded-bit: "Reserved"
489318-489434 sdcard_sd: decoded-bit: "Reserved for DEFERRED_RESPONSE"
489434-489550 sdcard_sd: decoded-bit: "CSD_OVERWRITE"
489550-489667 sdcard_sd: decoded-bit: "WP_ERASE_SKIP"
489667-489783 sdcard_sd: decoded-bit: "CARD_ECC_DISABLED"
489783-489899 sdcard_sd: decoded-bit: "ERASE_RESET"
489899-490016 sdcard_sd: decoded-bit: "CURRENT_STATE"
490016-490132 sdcard_sd: decoded-bit: "CURRENT_STATE"
490132-490249 sdcard_sd: decoded-bit: "CURRENT_STATE"
490249-490365 sdcard_sd: decoded-bit: "CURRENT_STATE"
490365-490481 sdcard_sd: decoded-bit: "READY_FOR_DATA"
490481-490598 sdcard_sd: decoded-bit: "Unknown"
490598-490714 sdcard_sd: decoded-bit: "Unknown"
490714-490830 sdcard_sd: decoded-bit: "APP_CMD"
490830-490947 sdcard_sd: decoded-bit: "Reserved for SDIO card"
490947-491063 sdcard_sd: decoded-bit: "AKE_SEQ_ERROR"
491063-491180 sdcard_sd: decoded-bit: "Reserved for application specific commands"
491180-491296 sdcard_sd: decoded-bit: "Reserved for manufacturer test mode"
491296-491412 sdcard_sd: decoded-bit: "Reserved for manufacturer test mode"
496765-496882 sdcard_sd: bit: "0"
496882-496998 sdcard_sd: bit: "1"
496998-497115 sdcard_sd: bit: "1"
497115-497231 sdcard_sd: bit: "0"
497231-497347 sdcard_sd: bit: "1"
497347-497464 sdcard_sd: bit: "0"
497464-497580 sdcard_sd: bit: "0"
497580-497696 sdcard_sd: bit: "1"
497696-497813 sdcard_sd: bit: "0"
497813-497929 sdcard_sd: bit: "1"
497929-498045 sdcard_sd: bit: "1"
498045-498162 sdcard_sd: bit: "1"
498162-498278 sdcard_sd: bit: "0"
498278-498395 sdcard_sd: bit: "0"
498395-498511 sdcard_sd: bit: "0"
498511-498627 sdcard_sd: bit: "0"
498627-498744 sdcard_sd: bit: "1"
498744-498860 sdcard_sd: bit: "1"
498860-498976 sdcard_sd: bit: "1"
498976-499093 sdcard_sd: bit: "1"
499093-499209 sdcard_sd: bit: "1"
499209-499326 sdcard_sd: bit: "1"
499326-499442 sdcard_sd: bit: "1"
499442-499558 sdcard_sd: bit: "1"
499558-499675 sdcard_sd: bit: "1"
499675-499791 sdcard_sd: bit: "0"
499791-499907 sdcard_sd: bit: "0"
499907-500024 sdcard_sd: bit: "0"
500024-500140 sdcard_sd: bit: "0"
500140-500257 sdcard_sd: bit: "0"
500257-500373 sdcard_sd: bit: "0"
500373-500489 sdcard_sd: bit: "0"
500489-500606 sdcard_sd: bit: "0"
500606-500722 sdcard_sd: bit: "0"
500722-500838 sdcard_sd: bit: "0"
500838-500955 sdcard_sd: bit: "0"
500955-501071 sdcard_sd: bit: "0"
501071-501188 sdcard_sd: bit: "0"
501188-501304 sdcard_sd: bit: "0"
501304-501420 sdcard_sd: bit: "0"
501420-501537 sdcard_sd: bit: "1"
501537-501653 sdcard_sd: bit: "0"
501653-501769 sdcard_sd: bit: "1"
501769-501886 sdcard_sd: bit: "1"
501886-502002 sdcard_sd: bit: "0"
502002-502118 sdcard_sd: bit: "1"
502118-502235 sdcard_sd: bit: "1"
502235-502352 sdcard_sd: bit: "1"
496765-496882 sdcard_sd: field-start: "Start bit" "Start" "S"
496882-496998 sdcard_sd: field-transmission: "Transmission: host" "T: host" "T"
496998-497696 sdcard_sd: field-cmd: "Command: SD_SEND_OP_COND (41)" "Cmd: SD_SEND_OP_COND (41)" "CMD41" "Cmd" "C"
497696-501420 sdcard_sd: field-arg: "Argument: 0x70ff8000" "Arg" "A"
501420-502235 sdcard_sd: field-crc: "CRC: 0x5b" "CRC" "C"
502235-502352 sdcard_sd: field-end: "End bit" "End" "E"
498627-501420 sdcard_sd: decoded-field: "VDD voltage window" "VDD volt" "VDD" "V"
498511-498627 sdcard_sd: decoded-field: "S18R"
498162-498511 sdcard_sd: decoded-field: "Reserved" "Res" "R"
498045-498162 sdcard_sd: decoded-field: "XPC"
497929-498045 sdcard_sd: decoded-field: "Reserved for eSD" "Reserved" "Res" "R"
497813-497929 sdcard_sd: decoded-field: "Host capacity support info" "Host capacity" "HCS" "H"
497696-497813 sdcard_sd: decoded-field: "Reserved" "Res" "R"
496765-502352 sdcard_sd: acmd41: "ACMD41 (SD_SEND_OP_COND): Send HCS info and activate the card init process" "ACMD41 (SD_SEND_OP_COND)" "ACMD41"
502933-508520 sdcard_sd: r3: "Response: R3"
502933-503049 sdcard_sd: bit: "0"
503049-503166 sdcard_sd: bit: "0"
503166-503282 sdcard_sd: bit: "1"
503282-503399 sdcard_sd: bit: "1"
503399-503515 sdcard_sd: bit: "1"
503515-503631 sdcard_sd: bit: "1"
503631-503748 sdcard_sd: bit: "1"
503748-503864 sdcard_sd: bit: "1"
503864-503980 sdcard_sd: bit: "0"
503980-504097 sdcard_sd: bit: "0"
504097-504213 sdcard_sd: bit: "0"
504213-504330 sdcard_sd: bit: "0"
504330-504446 sdcard_sd: bit: "0"
504446-504562 sdcard_sd: bit: "0"
504562-504679 sdcard_sd: bit: "0"
504679-504795 sdcard_sd: bit: "0"
504795-504911 sdcard_sd: bit: "1"
504911-505028 sdcard_sd: bit: "1"
505028-505144 sdcard_sd: bit: "1"
505144-505261 sdcard_sd: bit: "1"
505261-505377 sdcard_sd: bit: "1"
505377-505493 sdcard_sd: bit: "1"
505493-505610 sdcard_sd: bit: "1"
505610-505726 sdcard_sd: bit: "1"
505726-505842 sdcard_sd: bit: "1"
505842-505959 sdcard_sd: bit: "0"
505959-506075 sdcard_sd: bit: "0"
506075-506192 sdcard_sd: bit: "0"
506192-506308 sdcard_sd: bit: "0"
506308-506424 sdcard_sd: bit: "0"
506424-506541 sdcard_sd: bit: "0"
506541-506657 sdcard_sd: bit: "0"
506657-506773 sdcard_sd: bit: "0"
506773-506890 sdcard_sd: bit: "0"
506890-507006 sdcard_sd: bit: "0"
507006-507122 sdcard_sd: bit: "0"
507122-507239 sdcard_sd: bit: "0"
507239-507355 sdcard_sd: bit: "0"
507355-507472 sdcard_sd: bit: "0"
507472-507588 sdcard_sd: bit: "0"
507588-507704 sdcard_sd: bit: "1"
507704-507821 sdcard_sd: bit: "1"
507821-507937 sdcard_sd: bit: "1"
507937-508053 sdcard_sd: bit: "1"
508053-508170 sdcard_sd: bit: "1"
508170-508286 sdcard_sd: bit: "1"
508286-508403 sdcard_sd: bit: "1"
508403-508520 sdcard_sd: bit: "1"
502933-503049 sdcard_sd: field-start: "Start bit" "Start" "S"
503049-503166 sdcard_sd: field-transmission: "Transmission: card" "T: card" "T"
503166-503864 sdcard_sd: field-cmd: "Reserved" "Res" "R"
503864-507588 sdcard_sd: field-arg: "Argument" "Arg" "A"
507588-508403 sdcard_sd: field-crc: "Reserved" "Res" "R"
508403-508520 sdcard_sd: field-end: "End bit" "End" "E"
503864-507588 sdcard_sd: decoded-field: "OCR register" "OCR reg" "OCR" "O"
513057-513174 sdcard_sd: bit: "0"
513174-513290 sdcard_sd: bit: "1"
513290-513407 sdcard_sd: bit: "1"
513407-513523 sdcard_sd: bit: "1"
513523-513639 sdcard_sd: bit: "0"
513639-513756 sdcard_sd: bit: "1"
513756-513872 sdcard_sd: bit: "1"
513872-513988 sdcard_sd: bit: "1"
513988-514105 sdcard_sd: bit: "0"
514105-514221 sdcard_sd: bit: "0"
514221-514338 sdcard_sd: bit: "0"
514338-514454 sdcard_sd: bit: "0"
514454-514570 sdcard_sd: bit: "0"
514570-514687 sdcard_sd: bit: "0"
514687-514803 sdcard_sd: bit: "0"
514803-514919 sdcard_sd: bit: "0"
514919-515036 sdcard_sd: bit: "0"
515036-515152 sdcard_sd: bit: "0"
515152-515268 sdcard_sd: bit: "0"
515268-515385 sdcard_sd: bit: "0"
515385-515501 sdcard_sd: bit: "0"
515501-515618 sdcard_sd: bit: "0"
515618-515734 sdcard_sd: bit: "0"
515734-515850 sdcard_sd: bit: "0"
515850-515967 sdcard_sd: bit: "0"
515967-516083 sdcard_sd: bit: "0"
516083-516199 sdcard_sd: bit: "0"
516199-516316 sdcard_sd: bit: "0"
516316-516432 sdcard_sd: bit: "0"
516432-516549 sdcard_sd: bit: "0"
516549-516665 sdcard_sd: bit: "0"
516665-516781 sdcard_sd: bit: "0"
516781-516898 sdcard_sd: bit: "0"
516898-517014 sdcard_sd: bit: "0"
517014-517130 sdcard_sd: bit: "0"
517130-517247 sdcard_sd: bit: "0"
517247-517363 sdcard_sd: bit: "0"
517363-517480 sdcard_sd: bit: "0"
517480-517596 sdcard_sd: bit: "0"
517596-517712 sdcard_sd: bit: "0"
517712-517829 sdcard_sd: bit: "0"
517829-517945 sdcard_sd: bit: "1"
517945-518061 sdcard_sd: bit: "1"
518061-518178 sdcard_sd: bit: "0"
518178-518294 sdcard_sd: bit: "0"
518294-518411 sdcard_sd: bit: "1"
518411-518527 sdcard_sd: bit: "0"
518527-518643 sdcard_sd: bit: "1"
513057-513174 sdcard_sd: field-start: "Start bit" "Start" "S"
513174-513290 sdcard_sd: field-transmission: "Transmission: host" "T: host" "T"
513290-513988 sdcard_sd: field-cmd: "Command: APP_CMD (55)" "Cmd: APP_CMD (55)" "CMD55" "Cmd" "C"
513988-517712 sdcard_sd: field-arg: "Argument: 0x00000000" "Arg" "A"
517712-518527 sdcard_sd: field-crc: "CRC: 0x32" "CRC" "C"
518527-518643 sdcard_sd: field-end: "End bit" "End" "E"
513988-515850 sdcard_sd: decoded-field: "RCA" "R"
515850-517712 sdcard_sd: decoded-field: "Stuff bits" "Stuff" "SB" "S"
513057-518643 sdcard_sd: cmd55: "CMD55 (APP_CMD): Next command is an application-specific command" "CMD55 (APP_CMD)" "CMD55"
