21919-22586 sdcard_sd: bit_0: "0"
22586-23253 sdcard_sd: bit_1: "1"
23253-23919 sdcard_sd: bit_0: "0"
23919-24586 sdcard_sd: bit_0: "0"
24586-25252 sdcard_sd: bit_0: "0"
25252-25919 sdcard_sd: bit_0: "0"
25919-26586 sdcard_sd: bit_1: "1"
26586-27252 sdcard_sd: bit_1: "1"
27252-27919 sdcard_sd: bit_0: "0"
27919-28586 sdcard_sd: bit_0: "0"
28586-29252 sdcard_sd: bit_0: "0"
29252-29919 sdcard_sd: bit_0: "0"
29919-30585 sdcard_sd: bit_0: "0"
30585-31252 sdcard_sd: bit_0: "0"
31252-31919 sdcard_sd: bit_0: "0"
31919-32585 sdcard_sd: bit_0: "0"
32585-33252 sdcard_sd: bit_0: "0"
33252-33919 sdcard_sd: bit_0: "0"
33919-34585 sdcard_sd: bit_0: "0"
34585-35252 sdcard_sd: bit_0: "0"
35252-35918 sdcard_sd: bit_0: "0"
35918-36585 sdcard_sd: bit_0: "0"
36585-37252 sdcard_sd: bit_0: "0"
37252-37918 sdcard_sd: bit_0: "0"
37918-38585 sdcard_sd: bit_0: "0"
38585-39251 sdcard_sd: bit_0: "0"
39251-39918 sdcard_sd: bit_0: "0"
39918-40585 sdcard_sd: bit_0: "0"
40585-41251 sdcard_sd: bit_0: "0"
41251-41918 sdcard_sd: bit_0: "0"
41918-42585 sdcard_sd: bit_0: "0"
42585-43251 sdcard_sd: bit_0: "0"
43251-43918 sdcard_sd: bit_0: "0"
43918-44584 sdcard_sd: bit_0: "0"
44584-45251 sdcard_sd: bit_0: "0"
45251-45918 sdcard_sd: bit_0: "0"
45918-46584 sdcard_sd: bit_0: "0"
46584-47251 sdcard_sd: bit_0: "0"
47251-47918 sdcard_sd: bit_0: "0"
47918-48584 sdcard_sd: bit_0: "0"
48584-49251 sdcard_sd: bit_0: "0"
49251-49917 sdcard_sd: bit_0: "0"
49917-50584 sdcard_sd: bit_1: "1"
50584-51251 sdcard_sd: bit_0: "0"
51251-51917 sdcard_sd: bit_0: "0"
51917-52584 sdcard_sd: bit_0: "0"
52584-53250 sdcard_sd: bit_0: "0"
53250-53916 sdcard_sd: bit_1: "1"
21919-22586 sdcard_sd: field-start: "Start bit" "Start" "S"
22586-23253 sdcard_sd: field-transmission: "Transmission: host" "T: host" "T"
23253-27252 sdcard_sd: field-cmd: "Command: SEND_RELATIVE_ADDR (3)" "Cmd: SEND_RELATIVE_ADDR (3)" "CMD3" "Cmd" "C"
27252-48584 sdcard_sd: field-arg: "Argument: 0x00000000" "Arg" "A"
48584-53250 sdcard_sd: field-crc: "CRC: 0x10" "CRC" "C"
53250-53916 sdcard_sd: field-end: "End bit" "End" "E"
27252-48584 sdcard_sd: decoded-field: "Stuff bits" "Stuff" "SB" "S"
21919-53916 sdcard_sd: cmd3: "CMD3 (SEND_RELATIVE_ADDR): Ask card for new relative card address (RCA)" "CMD3 (SEND_RELATIVE_ADDR)" "CMD3"
61250-61917 sdcard_sd: bit_0: "0"
61917-62583 sdcard_sd: bit_0: "0"
62583-63250 sdcard_sd: bit_0: "0"
63250-63916 sdcard_sd: bit_0: "0"
63916-64583 sdcard_sd: bit_0: "0"
64583-65250 sdcard_sd: bit_0: "0"
65250-65916 sdcard_sd: bit_1: "1"
65916-66583 sdcard_sd: bit_1: "1"
66583-67249 sdcard_sd: bit_1: "1"
67249-67916 sdcard_sd: bit_0: "0"
67916-68583 sdcard_sd: bit_1: "1"
68583-69249 sdcard_sd: bit_1: "1"
69249-69916 sdcard_sd: bit_0: "0"
69916-70583 sdcard_sd: bit_0: "0"
70583-71249 sdcard_sd: bit_1: "1"
71249-71916 sdcard_sd: bit_1: "1"
71916-72582 sdcard_sd: bit_0: "0"
72582-73249 sdcard_sd: bit_1: "1"
73249-73916 sdcard_sd: bit_1: "1"
73916-74582 sdcard_sd: bit_0: "0"
74582-75249 sdcard_sd: bit_1: "1"
75249-75916 sdcard_sd: bit_0: "0"
75916-76582 sdcard_sd: bit_0: "0"
76582-77249 sdcard_sd: bit_0: "0"
77249-77915 sdcard_sd: bit_0: "0"
77915-78582 sdcard_sd: bit_0: "0"
78582-79249 sdcard_sd: bit_0: "0"
79249-79915 sdcard_sd: bit_0: "0"
79915-80582 sdcard_sd: bit_0: "0"
80582-81249 sdcard_sd: bit_1: "1"
81249-81915 sdcard_sd: bit_0: "0"
81915-82582 sdcard_sd: bit_1: "1"
82582-83248 sdcard_sd: bit_0: "0"
83248-83915 sdcard_sd: bit_0: "0"
83915-84582 sdcard_sd: bit_0: "0"
84582-85248 sdcard_sd: bit_0: "0"
85248-85915 sdcard_sd: bit_0: "0"
85915-86581 sdcard_sd: bit_0: "0"
86581-87248 sdcard_sd: bit_0: "0"
87248-87915 sdcard_sd: bit_0: "0"
87915-88581 sdcard_sd: bit_0: "0"
88581-89248 sdcard_sd: bit_0: "0"
89248-89915 sdcard_sd: bit_0: "0"
89915-90581 sdcard_sd: bit_1: "1"
90581-91248 sdcard_sd: bit_1: "1"
91248-91914 sdcard_sd: bit_0: "0"
91914-92581 sdcard_sd: bit_0: "0"
92581-93248 sdcard_sd: bit_1: "1"
61250-61917 sdcard_sd: field-start: "Start bit" "Start" "S"
61917-62583 sdcard_sd: field-transmission: "Transmission: card" "T: card" "T"
62583-66583 sdcard_sd: field-cmd: "Command: SEND_RELATIVE_ADDR (3)" "Cmd: SEND_RELATIVE_ADDR (3)" "CMD3" "Cmd" "C"
66583-87915 sdcard_sd: field-arg: "Argument: 0xb3680500" "Arg" "A"
87915-92581 sdcard_sd: field-crc: "CRC: 0xc" "CRC" "C"
92581-93248 sdcard_sd: field-end: "End bit" "End" "E"
77249-87915 sdcard_sd: decoded-field: "Card status bits" "Status" "S"
66583-77249 sdcard_sd: decoded-field: "Relative card address" "RCA" "R"
61250-93248 sdcard_sd: response_r6: "Response: R6"
