10632-11298 sdcard_sd: bit_0: "0"
11298-11965 sdcard_sd: bit_1: "1"
11965-12632 sdcard_sd: bit_0: "0"
12632-13298 sdcard_sd: bit_0: "0"
13298-13965 sdcard_sd: bit_1: "1"
13965-14632 sdcard_sd: bit_0: "0"
14632-15298 sdcard_sd: bit_0: "0"
15298-15965 sdcard_sd: bit_1: "1"
15965-16631 sdcard_sd: bit_1: "1"
16631-17298 sdcard_sd: bit_0: "0"
17298-17965 sdcard_sd: bit_1: "1"
17965-18631 sdcard_sd: bit_1: "1"
18631-19298 sdcard_sd: bit_0: "0"
19298-19965 sdcard_sd: bit_0: "0"
19965-20631 sdcard_sd: bit_1: "1"
20631-21298 sdcard_sd: bit_1: "1"
21298-21964 sdcard_sd: bit_0: "0"
21964-22631 sdcard_sd: bit_1: "1"
22631-23298 sdcard_sd: bit_1: "1"
23298-23964 sdcard_sd: bit_0: "0"
23964-24631 sdcard_sd: bit_1: "1"
24631-25297 sdcard_sd: bit_0: "0"
25297-25964 sdcard_sd: bit_0: "0"
25964-26631 sdcard_sd: bit_0: "0"
26631-27297 sdcard_sd: bit_0: "0"
27297-27964 sdcard_sd: bit_0: "0"
27964-28631 sdcard_sd: bit_0: "0"
28631-29297 sdcard_sd: bit_0: "0"
29297-29964 sdcard_sd: bit_0: "0"
29964-30630 sdcard_sd: bit_0: "0"
30630-31297 sdcard_sd: bit_0: "0"
31297-31964 sdcard_sd: bit_0: "0"
31964-32630 sdcard_sd: bit_0: "0"
32630-33297 sdcard_sd: bit_0: "0"
33297-33963 sdcard_sd: bit_0: "0"
33963-34630 sdcard_sd: bit_0: "0"
34630-35297 sdcard_sd: bit_0: "0"
35297-35963 sdcard_sd: bit_0: "0"
35963-36630 sdcard_sd: bit_0: "0"
36630-37297 sdcard_sd: bit_0: "0"
37297-37963 sdcard_sd: bit_0: "0"
37963-38630 sdcard_sd: bit_1: "1"
38630-39296 sdcard_sd: bit_0: "0"
39296-39963 sdcard_sd: bit_0: "0"
39963-40630 sdcard_sd: bit_1: "1"
40630-41296 sdcard_sd: bit_1: "1"
41296-41963 sdcard_sd: bit_0: "0"
41963-42630 sdcard_sd: bit_1: "1"
10632-11298 sdcard_sd: field-start: "Start bit" "Start" "S"
11298-11965 sdcard_sd: field-transmission: "Transmission: host" "T: host" "T"
11965-15965 sdcard_sd: field-cmd: "Command: SEND_CSD (9)" "Cmd: SEND_CSD (9)" "CMD9" "Cmd" "C"
15965-37297 sdcard_sd: field-arg: "Argument: 0xb3680000" "Arg" "A"
37297-41963 sdcard_sd: field-crc: "CRC: 0x26" "CRC" "C"
41963-42630 sdcard_sd: field-end: "End bit" "End" "E"
15965-26631 sdcard_sd: decoded-field: "RCA" "R"
26631-37297 sdcard_sd: decoded-field: "Stuff bits" "Stuff" "SB" "S"
10632-42630 sdcard_sd: cmd9: "CMD9 (SEND_CSD): Send card-specific data (CSD)" "CMD9 (SEND_CSD)" "CMD9"
49962-50629 sdcard_sd: bit_0: "0"
50629-51296 sdcard_sd: bit_0: "0"
51296-51962 sdcard_sd: bit_1: "1"
51962-52629 sdcard_sd: bit_1: "1"
52629-53295 sdcard_sd: bit_1: "1"
53295-53962 sdcard_sd: bit_1: "1"
53962-54629 sdcard_sd: bit_1: "1"
54629-55295 sdcard_sd: bit_1: "1"
55295-55962 sdcard_sd: bit_0: "0"
55962-56629 sdcard_sd: bit_0: "0"
56629-57295 sdcard_sd: bit_0: "0"
57295-57962 sdcard_sd: bit_0: "0"
57962-58628 sdcard_sd: bit_0: "0"
58628-59295 sdcard_sd: bit_0: "0"
59295-59962 sdcard_sd: bit_0: "0"
59962-60628 sdcard_sd: bit_0: "0"
60628-61295 sdcard_sd: bit_0: "0"
61295-61961 sdcard_sd: bit_1: "1"
61961-62628 sdcard_sd: bit_0: "0"
62628-63295 sdcard_sd: bit_1: "1"
63295-63961 sdcard_sd: bit_1: "1"
63961-64628 sdcard_sd: bit_1: "1"
64628-65295 sdcard_sd: bit_1: "1"
65295-65961 sdcard_sd: bit_0: "0"
65961-66628 sdcard_sd: bit_0: "0"
66628-67294 sdcard_sd: bit_0: "0"
67294-67961 sdcard_sd: bit_0: "0"
67961-68628 sdcard_sd: bit_0: "0"
68628-69294 sdcard_sd: bit_0: "0"
69294-69961 sdcard_sd: bit_0: "0"
69961-70628 sdcard_sd: bit_0: "0"
70628-71294 sdcard_sd: bit_0: "0"
71294-71961 sdcard_sd: bit_0: "0"
71961-72627 sdcard_sd: bit_0: "0"
72627-73294 sdcard_sd: bit_1: "1"
73294-73961 sdcard_sd: bit_1: "1"
73961-74627 sdcard_sd: bit_0: "0"
74627-75294 sdcard_sd: bit_0: "0"
75294-75961 sdcard_sd: bit_1: "1"
75961-76627 sdcard_sd: bit_0: "0"
76627-77294 sdcard_sd: bit_0: "0"
77294-77960 sdcard_sd: bit_1: "1"
77960-78627 sdcard_sd: bit_0: "0"
78627-79294 sdcard_sd: bit_1: "1"
79294-79960 sdcard_sd: bit_1: "1"
79960-80627 sdcard_sd: bit_1: "1"
80627-81293 sdcard_sd: bit_1: "1"
81293-81960 sdcard_sd: bit_1: "1"
81960-82627 sdcard_sd: bit_0: "0"
82627-83293 sdcard_sd: bit_1: "1"
83293-83960 sdcard_sd: bit_0: "0"
83960-84627 sdcard_sd: bit_1: "1"
84627-85293 sdcard_sd: bit_1: "1"
85293-85960 sdcard_sd: bit_0: "0"
85960-86626 sdcard_sd: bit_0: "0"
86626-87293 sdcard_sd: bit_1: "1"
87293-87960 sdcard_sd: bit_1: "1"
87960-88626 sdcard_sd: bit_0: "0"
88626-89293 sdcard_sd: bit_0: "0"
89293-89960 sdcard_sd: bit_0: "0"
89960-90626 sdcard_sd: bit_0: "0"
90626-91293 sdcard_sd: bit_0: "0"
91293-91959 sdcard_sd: bit_1: "1"
91959-92626 sdcard_sd: bit_1: "1"
92626-93293 sdcard_sd: bit_1: "1"
93293-93959 sdcard_sd: bit_1: "1"
93959-94626 sdcard_sd: bit_0: "0"
94626-95292 sdcard_sd: bit_1: "1"
95292-95959 sdcard_sd: bit_0: "0"
95959-96626 sdcard_sd: bit_0: "0"
96626-97292 sdcard_sd: bit_1: "1"
97292-97959 sdcard_sd: bit_0: "0"
97959-98626 sdcard_sd: bit_1: "1"
98626-99292 sdcard_sd: bit_1: "1"
99292-99959 sdcard_sd: bit_1: "1"
99959-100625 sdcard_sd: bit_0: "0"
100625-101292 sdcard_sd: bit_1: "1"
101292-101959 sdcard_sd: bit_1: "1"
101959-102625 sdcard_sd: bit_0: "0"
102625-103292 sdcard_sd: bit_1: "1"
103292-103958 sdcard_sd: bit_1: "1"
103958-104625 sdcard_sd: bit_0: "0"
104625-105292 sdcard_sd: bit_1: "1"
105292-105958 sdcard_sd: bit_1: "1"
105958-106625 sdcard_sd: bit_0: "0"
106625-107292 sdcard_sd: bit_1: "1"
107292-107958 sdcard_sd: bit_1: "1"
107958-108625 sdcard_sd: bit_1: "1"
108625-109291 sdcard_sd: bit_0: "0"
109291-109958 sdcard_sd: bit_1: "1"
109958-110625 sdcard_sd: bit_1: "1"
110625-111291 sdcard_sd: bit_1: "1"
111291-111958 sdcard_sd: bit_1: "1"
111958-112625 sdcard_sd: bit_1: "1"
112625-113291 sdcard_sd: bit_1: "1"
113291-113958 sdcard_sd: bit_1: "1"
113958-114624 sdcard_sd: bit_1: "1"
114624-115291 sdcard_sd: bit_0: "0"
115291-115958 sdcard_sd: bit_0: "0"
115958-116624 sdcard_sd: bit_0: "0"
116624-117291 sdcard_sd: bit_1: "1"
117291-117958 sdcard_sd: bit_1: "1"
117958-118624 sdcard_sd: bit_1: "1"
118624-119291 sdcard_sd: bit_1: "1"
119291-119957 sdcard_sd: bit_1: "1"
119957-120624 sdcard_sd: bit_0: "0"
120624-121291 sdcard_sd: bit_0: "0"
121291-121957 sdcard_sd: bit_1: "1"
121957-122624 sdcard_sd: bit_0: "0"
122624-123290 sdcard_sd: bit_1: "1"
123290-123957 sdcard_sd: bit_1: "1"
123957-124624 sdcard_sd: bit_0: "0"
124624-125290 sdcard_sd: bit_0: "0"
125290-125957 sdcard_sd: bit_1: "1"
125957-126624 sdcard_sd: bit_0: "0"
126624-127290 sdcard_sd: bit_0: "0"
127290-127957 sdcard_sd: bit_0: "0"
127957-128623 sdcard_sd: bit_0: "0"
128623-129290 sdcard_sd: bit_0: "0"
129290-129957 sdcard_sd: bit_0: "0"
129957-130623 sdcard_sd: bit_0: "0"
130623-131290 sdcard_sd: bit_0: "0"
131290-131956 sdcard_sd: bit_0: "0"
131956-132623 sdcard_sd: bit_0: "0"
132623-133290 sdcard_sd: bit_0: "0"
133290-133956 sdcard_sd: bit_0: "0"
133956-134623 sdcard_sd: bit_0: "0"
134623-135290 sdcard_sd: bit_0: "0"
135290-135956 sdcard_sd: bit_1: "1"
135956-136623 sdcard_sd: bit_1: "1"
136623-137289 sdcard_sd: bit_1: "1"
137289-137956 sdcard_sd: bit_1: "1"
137956-138623 sdcard_sd: bit_0: "0"
138623-139289 sdcard_sd: bit_1: "1"
139289-139956 sdcard_sd: bit_1: "1"
139956-140623 sdcard_sd: bit_1: "1"
49962-50629 sdcard_sd: field-start: "Start bit" "Start" "S"
50629-51296 sdcard_sd: field-transmission: "Transmission: card" "T: card" "T"
51296-55295 sdcard_sd: field-cmd: "Reserved" "Res" "R"
55295-139956 sdcard_sd: field-arg: "Argument" "Arg" "A"
139956-140623 sdcard_sd: field-end: "End bit" "End" "E"
55295-139956 sdcard_sd: decoded-field: "CID/CSD register" "CID/CSD" "C"
49962-140623 sdcard_sd: response_r2: "Response: R2"
55295-56629 sdcard_sd: reg_csd_csd_structure: "CSD structure" "CSD_STRUCTURE"
56629-60628 sdcard_sd: reg_csd_rsvd: "Reserved" "RSVD" "R"
60628-65961 sdcard_sd: reg_csd_taac: "Data read access-time - 1" "TAAC"
65961-71294 sdcard_sd: reg_csd_nsac: "Data read access-time - 2 in CLK cycles (NSAC * 100)" "NSAC"
71294-76627 sdcard_sd: reg_csd_tran_speed: "Max. data transfer rate" "TRAN_SPEED"
76627-84627 sdcard_sd: reg_csd_ccc: "Card command classes" "CCC"
84627-87293 sdcard_sd: reg_csd_read_bl_len: "Max. read data block length" "READ_BL_LEN"
87293-87960 sdcard_sd: reg_csd_read_bl_partial: "Partial blocks for read allowed" "READ_BL_PARTIAL"
87960-88626 sdcard_sd: reg_csd_write_blk_misalign: "Write block misalignment" "WRITE_BLK_MISALIGN"
88626-89293 sdcard_sd: reg_csd_read_blk_misalign: "Read block misalignment" "READ_BLK_MISALIGN"
89293-89960 sdcard_sd: reg_csd_dsr_imp: "DSR implemented" "DSR_IMP"
89960-91293 sdcard_sd: reg_csd_rsvd: "Reserved" "RSVD" "R"
91293-99292 sdcard_sd: reg_csd_c_size: "Device size" "C_SIZE"
99292-101292 sdcard_sd: reg_csd_vdd_r_curr_min: "Max. read current @VDD min" "VDD_R_CURR_MIN"
101292-103292 sdcard_sd: reg_csd_vdd_r_curr_max: "Max. read current @VDD max" "VDD_R_CURR_MAX"
103292-105292 sdcard_sd: reg_csd_vdd_w_curr_min: "Max. write current @VDD min" "VDD_W_CURR_MIN"
105292-107292 sdcard_sd: reg_csd_vdd_w_curr_max: "Max. write current @VDD max" "VDD_W_CURR_MAX"
107292-109291 sdcard_sd: reg_csd_c_size_mult: "Device size multiplier" "C_SIZE_MULT"
109291-109958 sdcard_sd: reg_csd_erase_blk_en: "Erase single block enable" "ERASE_BLK_EN"
109958-114624 sdcard_sd: reg_csd_sector_size: "Erase sector size" "SECTOR_SIZE"
114624-119291 sdcard_sd: reg_csd_wp_grp_size: "Write protect group size" "WP_GRP_SIZE"
119291-119957 sdcard_sd: reg_csd_wp_grp_enable: "Write protect group enable" "WP_GRP_ENABLE"
119957-121291 sdcard_sd: reg_csd_rsvd: "Reserved" "RSVD" "R"
121291-123290 sdcard_sd: reg_csd_r2w_factor: "Write speed factor" "R2W_FACTOR"
123290-125957 sdcard_sd: reg_csd_write_bl_len: "Max. write data block length" "WRITE_BL_LEN"
125957-126624 sdcard_sd: reg_csd_write_bl_partial: "Partial blocks for write allowed" "WRITE_BL_PARTIAL"
126624-129957 sdcard_sd: reg_csd_rsvd: "Reserved" "RSVD"
129957-130623 sdcard_sd: reg_csd_file_format_grp: "File format group" "FILE_FORMAT_GRP"
130623-131290 sdcard_sd: reg_csd_copy: "Copy flag" "COPY"
131290-131956 sdcard_sd: reg_csd_perm_write_protect: "Permanent write protection" "PERM_WRITE_PROTECT"
131956-132623 sdcard_sd: reg_csd_tmp_write_protect: "Temporary write protection" "TMP_WRITE_PROTECT"
132623-133956 sdcard_sd: reg_csd_file_format: "File format" "FILE_FORMAT"
133956-135290 sdcard_sd: reg_csd_rsvd: "Reserved" "RSVD" "R"
135290-139956 sdcard_sd: reg_csd_crc: "CRC" "CRC" "C"
139956-140623 sdcard_sd: reg_csd_one: "Always 1" "1"
