7966-8633 sdcard_sd: bit_0: "0"
8633-9299 sdcard_sd: bit_1: "1"
9299-9966 sdcard_sd: bit_1: "1"
9966-10632 sdcard_sd: bit_1: "1"
10632-11299 sdcard_sd: bit_0: "0"
11299-11966 sdcard_sd: bit_1: "1"
11966-12632 sdcard_sd: bit_1: "1"
12632-13299 sdcard_sd: bit_1: "1"
13299-13965 sdcard_sd: bit_1: "1"
13965-14632 sdcard_sd: bit_0: "0"
14632-15299 sdcard_sd: bit_1: "1"
15299-15965 sdcard_sd: bit_1: "1"
15965-16632 sdcard_sd: bit_0: "0"
16632-17299 sdcard_sd: bit_0: "0"
17299-17965 sdcard_sd: bit_1: "1"
17965-18632 sdcard_sd: bit_1: "1"
18632-19298 sdcard_sd: bit_0: "0"
19298-19965 sdcard_sd: bit_1: "1"
19965-20632 sdcard_sd: bit_1: "1"
20632-21298 sdcard_sd: bit_0: "0"
21298-21965 sdcard_sd: bit_1: "1"
21965-22632 sdcard_sd: bit_0: "0"
22632-23298 sdcard_sd: bit_0: "0"
23298-23965 sdcard_sd: bit_0: "0"
23965-24631 sdcard_sd: bit_0: "0"
24631-25298 sdcard_sd: bit_0: "0"
25298-25965 sdcard_sd: bit_0: "0"
25965-26631 sdcard_sd: bit_0: "0"
26631-27298 sdcard_sd: bit_0: "0"
27298-27964 sdcard_sd: bit_0: "0"
27964-28631 sdcard_sd: bit_0: "0"
28631-29298 sdcard_sd: bit_0: "0"
29298-29964 sdcard_sd: bit_0: "0"
29964-30631 sdcard_sd: bit_0: "0"
30631-31298 sdcard_sd: bit_0: "0"
31298-31964 sdcard_sd: bit_0: "0"
31964-32631 sdcard_sd: bit_0: "0"
32631-33297 sdcard_sd: bit_0: "0"
33297-33964 sdcard_sd: bit_0: "0"
33964-34631 sdcard_sd: bit_0: "0"
34631-35297 sdcard_sd: bit_1: "1"
35297-35964 sdcard_sd: bit_0: "0"
35964-36631 sdcard_sd: bit_0: "0"
36631-37297 sdcard_sd: bit_0: "0"
37297-37964 sdcard_sd: bit_0: "0"
37964-38630 sdcard_sd: bit_1: "1"
38630-39297 sdcard_sd: bit_1: "1"
39297-39964 sdcard_sd: bit_1: "1"
7966-8633 sdcard_sd: field-start: "Start bit" "Start" "S"
8633-9299 sdcard_sd: field-transmission: "Transmission: host" "T: host" "T"
9299-13299 sdcard_sd: field-cmd: "Command: APP_CMD (55)" "Cmd: APP_CMD (55)" "CMD55" "Cmd" "C"
13299-34631 sdcard_sd: field-arg: "Argument: 0xb3680000" "Arg" "A"
34631-39297 sdcard_sd: field-crc: "CRC: 0x43" "CRC" "C"
39297-39964 sdcard_sd: field-end: "End bit" "End" "E"
13299-23965 sdcard_sd: decoded-field: "RCA" "R"
23965-34631 sdcard_sd: decoded-field: "Stuff bits" "Stuff" "SB" "S"
7966-39964 sdcard_sd: cmd55: "CMD55 (APP_CMD): Next command is an application-specific command" "CMD55 (APP_CMD)" "CMD55"
47296-47963 sdcard_sd: bit_0: "0"
47963-48630 sdcard_sd: bit_0: "0"
48630-49296 sdcard_sd: bit_1: "1"
49296-49963 sdcard_sd: bit_1: "1"
49963-50630 sdcard_sd: bit_0: "0"
50630-51296 sdcard_sd: bit_1: "1"
51296-51963 sdcard_sd: bit_1: "1"
51963-52629 sdcard_sd: bit_1: "1"
52629-53296 sdcard_sd: bit_0: "0"
53296-53963 sdcard_sd: bit_0: "0"
53963-54629 sdcard_sd: bit_0: "0"
54629-55296 sdcard_sd: bit_0: "0"
55296-55963 sdcard_sd: bit_0: "0"
55963-56629 sdcard_sd: bit_0: "0"
56629-57296 sdcard_sd: bit_0: "0"
57296-57962 sdcard_sd: bit_0: "0"
57962-58629 sdcard_sd: bit_0: "0"
58629-59296 sdcard_sd: bit_0: "0"
59296-59962 sdcard_sd: bit_0: "0"
59962-60629 sdcard_sd: bit_0: "0"
60629-61295 sdcard_sd: bit_0: "0"
61295-61962 sdcard_sd: bit_0: "0"
61962-62629 sdcard_sd: bit_0: "0"
62629-63295 sdcard_sd: bit_0: "0"
63295-63962 sdcard_sd: bit_0: "0"
63962-64629 sdcard_sd: bit_0: "0"
64629-65295 sdcard_sd: bit_0: "0"
65295-65962 sdcard_sd: bit_0: "0"
65962-66628 sdcard_sd: bit_1: "1"
66628-67295 sdcard_sd: bit_0: "0"
67295-67962 sdcard_sd: bit_0: "0"
67962-68628 sdcard_sd: bit_1: "1"
68628-69295 sdcard_sd: bit_0: "0"
69295-69961 sdcard_sd: bit_0: "0"
69961-70628 sdcard_sd: bit_1: "1"
70628-71295 sdcard_sd: bit_0: "0"
71295-71961 sdcard_sd: bit_0: "0"
71961-72628 sdcard_sd: bit_0: "0"
72628-73295 sdcard_sd: bit_0: "0"
73295-73961 sdcard_sd: bit_0: "0"
73961-74628 sdcard_sd: bit_0: "0"
74628-75294 sdcard_sd: bit_0: "0"
75294-75961 sdcard_sd: bit_1: "1"
75961-76628 sdcard_sd: bit_1: "1"
76628-77294 sdcard_sd: bit_0: "0"
77294-77961 sdcard_sd: bit_0: "0"
77961-78628 sdcard_sd: bit_1: "1"
78628-79295 sdcard_sd: bit_1: "1"
47296-47963 sdcard_sd: field-start: "Start bit" "Start" "S"
47963-48630 sdcard_sd: field-transmission: "Transmission: card" "T: card" "T"
48630-52629 sdcard_sd: field-cmd: "Command: Non-existant (55)" "Cmd: Non-existant (55)" "CMD55" "Cmd" "C"
52629-73961 sdcard_sd: field-arg: "Argument: 0x00000920" "Arg" "A"
73961-78628 sdcard_sd: field-crc: "CRC: 0x19" "CRC" "C"
78628-79295 sdcard_sd: field-end: "End bit" "End" "E"
47296-79295 sdcard_sd: response_r1: "Response: R1"
52629-73961 sdcard_sd: decoded-field: "Card status" "Status" "S"
52629-53296 sdcard_sd: reg_status_out_of_range: "OUT_OF_RANGE"
53296-53963 sdcard_sd: reg_status_address_error: "ADDRESS_ERROR"
53963-54629 sdcard_sd: reg_status_block_len_error: "BLOCK_LEN_ERROR"
54629-55296 sdcard_sd: reg_status_erase_seq_error: "ERASE_SEQ_ERROR"
55296-55963 sdcard_sd: reg_status_erase_param: "ERASE_PARAM"
55963-56629 sdcard_sd: reg_status_wp_violation: "WP_VIOLATION"
56629-57296 sdcard_sd: reg_status_card_is_locked: "CARD_IS_LOCKED"
57296-57962 sdcard_sd: reg_status_lock_unlock_failed: "LOCK_UNLOCK_FAILED"
57962-58629 sdcard_sd: reg_status_com_crc_error: "COM_CRC_ERROR"
58629-59296 sdcard_sd: reg_status_illegal_command: "ILLEGAL_COMMAND"
59296-59962 sdcard_sd: reg_status_card_ecc_failed: "CARD_ECC_FAILED"
59962-60629 sdcard_sd: reg_status_cc_error: "CC_ERROR"
60629-61295 sdcard_sd: reg_status_error: "ERROR"
61295-61962 sdcard_sd: reg_status_rsvd: "Reserved" "RSVD" "R"
61962-62629 sdcard_sd: reg_status_rsvd_deferred_response: "Reserved for DEFERRED_RESPONSE" "RSVD_DEFERRED_RESPONSE"
62629-63295 sdcard_sd: reg_status_csd_overwrite: "CSD_OVERWRITE"
63295-63962 sdcard_sd: reg_status_wp_erase_skip: "WP_ERASE_SKIP"
63962-64629 sdcard_sd: reg_status_card_ecc_disabled: "CARD_ECC_DISABLED"
64629-65295 sdcard_sd: reg_status_erase_reset: "ERASE_RESET"
65295-67962 sdcard_sd: reg_status_current_state: "CURRENT_STATE"
67962-68628 sdcard_sd: reg_status_ready_for_data: "READY_FOR_DATA"
68628-69295 sdcard_sd: reg_status_rsvd: "RSVD"
69295-69961 sdcard_sd: reg_status_fx_event: "FX_EVENT"
69961-70628 sdcard_sd: reg_status_app_cmd: "APP_CMD"
70628-71295 sdcard_sd: reg_status_rsvd_sdio: "Reserved for SDIO card" "RSVD_SDIO"
71295-71961 sdcard_sd: reg_status_ake_seq_error: "AKE_SEQ_ERROR"
71961-72628 sdcard_sd: reg_status_rsvd_app_cmd: "Reserved for application specific commands" "RSVD_APP_CMD"
72628-73961 sdcard_sd: reg_status_rsvd_testmode: "Reserved for manufacturer test mode" "RSVD_TESTMODE"
85960-86627 sdcard_sd: bit_0: "0"
86627-87294 sdcard_sd: bit_1: "1"
87294-87960 sdcard_sd: bit_1: "1"
87960-88627 sdcard_sd: bit_1: "1"
88627-89293 sdcard_sd: bit_0: "0"
89293-89960 sdcard_sd: bit_0: "0"
89960-90627 sdcard_sd: bit_1: "1"
90627-91293 sdcard_sd: bit_1: "1"
91293-91960 sdcard_sd: bit_0: "0"
91960-92627 sdcard_sd: bit_0: "0"
92627-93293 sdcard_sd: bit_0: "0"
93293-93960 sdcard_sd: bit_0: "0"
93960-94626 sdcard_sd: bit_0: "0"
94626-95293 sdcard_sd: bit_0: "0"
95293-95960 sdcard_sd: bit_0: "0"
95960-96626 sdcard_sd: bit_0: "0"
96626-97293 sdcard_sd: bit_0: "0"
97293-97959 sdcard_sd: bit_0: "0"
97959-98626 sdcard_sd: bit_0: "0"
98626-99293 sdcard_sd: bit_0: "0"
99293-99959 sdcard_sd: bit_0: "0"
99959-100626 sdcard_sd: bit_0: "0"
100626-101293 sdcard_sd: bit_0: "0"
101293-101959 sdcard_sd: bit_0: "0"
101959-102626 sdcard_sd: bit_0: "0"
102626-103292 sdcard_sd: bit_0: "0"
103292-103959 sdcard_sd: bit_0: "0"
103959-104626 sdcard_sd: bit_0: "0"
104626-105292 sdcard_sd: bit_0: "0"
105292-105959 sdcard_sd: bit_0: "0"
105959-106626 sdcard_sd: bit_0: "0"
106626-107292 sdcard_sd: bit_0: "0"
107292-107959 sdcard_sd: bit_0: "0"
107959-108625 sdcard_sd: bit_0: "0"
108625-109292 sdcard_sd: bit_0: "0"
109292-109959 sdcard_sd: bit_0: "0"
109959-110625 sdcard_sd: bit_0: "0"
110625-111292 sdcard_sd: bit_0: "0"
111292-111959 sdcard_sd: bit_0: "0"
111959-112625 sdcard_sd: bit_0: "0"
112625-113292 sdcard_sd: bit_1: "1"
113292-113958 sdcard_sd: bit_1: "1"
113958-114625 sdcard_sd: bit_0: "0"
114625-115292 sdcard_sd: bit_0: "0"
115292-115958 sdcard_sd: bit_0: "0"
115958-116625 sdcard_sd: bit_1: "1"
116625-117291 sdcard_sd: bit_1: "1"
117291-117957 sdcard_sd: bit_1: "1"
85960-86627 sdcard_sd: field-start: "Start bit" "Start" "S"
86627-87294 sdcard_sd: field-transmission: "Transmission: host" "T: host" "T"
87294-91293 sdcard_sd: field-cmd: "Command: SEND_SCR (51)" "Cmd: SEND_SCR (51)" "CMD51" "Cmd" "C"
91293-112625 sdcard_sd: field-arg: "Argument: 0x00000000" "Arg" "A"
112625-117291 sdcard_sd: field-crc: "CRC: 0x63" "CRC" "C"
117291-117957 sdcard_sd: field-end: "End bit" "End" "E"
85960-117957 sdcard_sd: acmd51: "ACMD51 (SEND_SCR): Read SD config register (SCR)" "ACMD51 (SEND_SCR)" "ACMD51"
125291-125958 sdcard_sd: bit_0: "0"
125958-126624 sdcard_sd: bit_0: "0"
126624-127291 sdcard_sd: bit_1: "1"
127291-127957 sdcard_sd: bit_1: "1"
127957-128624 sdcard_sd: bit_0: "0"
128624-129291 sdcard_sd: bit_0: "0"
129291-129957 sdcard_sd: bit_1: "1"
129957-130624 sdcard_sd: bit_1: "1"
130624-131290 sdcard_sd: bit_0: "0"
131290-131957 sdcard_sd: bit_0: "0"
131957-132624 sdcard_sd: bit_0: "0"
132624-133290 sdcard_sd: bit_0: "0"
133290-133957 sdcard_sd: bit_0: "0"
133957-134624 sdcard_sd: bit_0: "0"
134624-135290 sdcard_sd: bit_0: "0"
135290-135957 sdcard_sd: bit_0: "0"
135957-136623 sdcard_sd: bit_0: "0"
136623-137290 sdcard_sd: bit_0: "0"
137290-137957 sdcard_sd: bit_0: "0"
137957-138623 sdcard_sd: bit_0: "0"
138623-139290 sdcard_sd: bit_0: "0"
139290-139957 sdcard_sd: bit_0: "0"
139957-140623 sdcard_sd: bit_0: "0"
140623-141290 sdcard_sd: bit_0: "0"
141290-141956 sdcard_sd: bit_0: "0"
141956-142623 sdcard_sd: bit_0: "0"
142623-143290 sdcard_sd: bit_0: "0"
143290-143956 sdcard_sd: bit_0: "0"
143956-144623 sdcard_sd: bit_1: "1"
144623-145289 sdcard_sd: bit_0: "0"
145289-145956 sdcard_sd: bit_0: "0"
145956-146623 sdcard_sd: bit_1: "1"
146623-147289 sdcard_sd: bit_0: "0"
147289-147956 sdcard_sd: bit_0: "0"
147956-148623 sdcard_sd: bit_1: "1"
148623-149289 sdcard_sd: bit_0: "0"
149289-149956 sdcard_sd: bit_0: "0"
149956-150622 sdcard_sd: bit_0: "0"
150622-151289 sdcard_sd: bit_0: "0"
151289-151956 sdcard_sd: bit_0: "0"
151956-152622 sdcard_sd: bit_1: "1"
152622-153289 sdcard_sd: bit_0: "0"
153289-153956 sdcard_sd: bit_0: "0"
153956-154622 sdcard_sd: bit_1: "1"
154622-155289 sdcard_sd: bit_0: "0"
155289-155955 sdcard_sd: bit_0: "0"
155955-156622 sdcard_sd: bit_0: "0"
156622-157289 sdcard_sd: bit_1: "1"
125291-125958 sdcard_sd: field-start: "Start bit" "Start" "S"
125958-126624 sdcard_sd: field-transmission: "Transmission: card" "T: card" "T"
126624-130624 sdcard_sd: field-cmd: "Command: Unknown (51)" "Cmd: Unknown (51)" "CMD51" "Cmd" "C"
130624-151956 sdcard_sd: field-arg: "Argument: 0x00000920" "Arg" "A"
151956-156622 sdcard_sd: field-crc: "CRC: 0x48" "CRC" "C"
156622-157289 sdcard_sd: field-end: "End bit" "End" "E"
125291-157289 sdcard_sd: response_r1: "Response: R1"
130624-151956 sdcard_sd: decoded-field: "Card status" "Status" "S"
130624-131290 sdcard_sd: reg_status_out_of_range: "OUT_OF_RANGE"
131290-131957 sdcard_sd: reg_status_address_error: "ADDRESS_ERROR"
131957-132624 sdcard_sd: reg_status_block_len_error: "BLOCK_LEN_ERROR"
132624-133290 sdcard_sd: reg_status_erase_seq_error: "ERASE_SEQ_ERROR"
133290-133957 sdcard_sd: reg_status_erase_param: "ERASE_PARAM"
133957-134624 sdcard_sd: reg_status_wp_violation: "WP_VIOLATION"
134624-135290 sdcard_sd: reg_status_card_is_locked: "CARD_IS_LOCKED"
135290-135957 sdcard_sd: reg_status_lock_unlock_failed: "LOCK_UNLOCK_FAILED"
135957-136623 sdcard_sd: reg_status_com_crc_error: "COM_CRC_ERROR"
136623-137290 sdcard_sd: reg_status_illegal_command: "ILLEGAL_COMMAND"
137290-137957 sdcard_sd: reg_status_card_ecc_failed: "CARD_ECC_FAILED"
137957-138623 sdcard_sd: reg_status_cc_error: "CC_ERROR"
138623-139290 sdcard_sd: reg_status_error: "ERROR"
139290-139957 sdcard_sd: reg_status_rsvd: "Reserved" "RSVD" "R"
139957-140623 sdcard_sd: reg_status_rsvd_deferred_response: "Reserved for DEFERRED_RESPONSE" "RSVD_DEFERRED_RESPONSE"
140623-141290 sdcard_sd: reg_status_csd_overwrite: "CSD_OVERWRITE"
141290-141956 sdcard_sd: reg_status_wp_erase_skip: "WP_ERASE_SKIP"
141956-142623 sdcard_sd: reg_status_card_ecc_disabled: "CARD_ECC_DISABLED"
142623-143290 sdcard_sd: reg_status_erase_reset: "ERASE_RESET"
143290-145956 sdcard_sd: reg_status_current_state: "CURRENT_STATE"
145956-146623 sdcard_sd: reg_status_ready_for_data: "READY_FOR_DATA"
146623-147289 sdcard_sd: reg_status_rsvd: "RSVD"
147289-147956 sdcard_sd: reg_status_fx_event: "FX_EVENT"
147956-148623 sdcard_sd: reg_status_app_cmd: "APP_CMD"
148623-149289 sdcard_sd: reg_status_rsvd_sdio: "Reserved for SDIO card" "RSVD_SDIO"
149289-149956 sdcard_sd: reg_status_ake_seq_error: "AKE_SEQ_ERROR"
149956-150622 sdcard_sd: reg_status_rsvd_app_cmd: "Reserved for application specific commands" "RSVD_APP_CMD"
150622-151956 sdcard_sd: reg_status_rsvd_testmode: "Reserved for manufacturer test mode" "RSVD_TESTMODE"
