9340-10006 sdcard_sd: bit_0: "0"
10006-10673 sdcard_sd: bit_1: "1"
10673-11340 sdcard_sd: bit_0: "0"
11340-12006 sdcard_sd: bit_0: "0"
12006-12673 sdcard_sd: bit_0: "0"
12673-13340 sdcard_sd: bit_0: "0"
13340-14006 sdcard_sd: bit_1: "1"
14006-14673 sdcard_sd: bit_0: "0"
14673-15339 sdcard_sd: bit_0: "0"
15339-16006 sdcard_sd: bit_0: "0"
16006-16673 sdcard_sd: bit_0: "0"
16673-17339 sdcard_sd: bit_0: "0"
17339-18006 sdcard_sd: bit_0: "0"
18006-18673 sdcard_sd: bit_0: "0"
18673-19339 sdcard_sd: bit_0: "0"
19339-20006 sdcard_sd: bit_0: "0"
20006-20672 sdcard_sd: bit_0: "0"
20672-21339 sdcard_sd: bit_0: "0"
21339-22006 sdcard_sd: bit_0: "0"
22006-22672 sdcard_sd: bit_0: "0"
22672-23339 sdcard_sd: bit_0: "0"
23339-24005 sdcard_sd: bit_0: "0"
24005-24672 sdcard_sd: bit_0: "0"
24672-25339 sdcard_sd: bit_0: "0"
25339-26005 sdcard_sd: bit_0: "0"
26005-26672 sdcard_sd: bit_0: "0"
26672-27339 sdcard_sd: bit_0: "0"
27339-28005 sdcard_sd: bit_0: "0"
28005-28672 sdcard_sd: bit_0: "0"
28672-29338 sdcard_sd: bit_0: "0"
29338-30005 sdcard_sd: bit_0: "0"
30005-30672 sdcard_sd: bit_0: "0"
30672-31338 sdcard_sd: bit_0: "0"
31338-32005 sdcard_sd: bit_0: "0"
32005-32672 sdcard_sd: bit_0: "0"
32672-33338 sdcard_sd: bit_0: "0"
33338-34005 sdcard_sd: bit_0: "0"
34005-34671 sdcard_sd: bit_0: "0"
34671-35338 sdcard_sd: bit_0: "0"
35338-36005 sdcard_sd: bit_0: "0"
36005-36671 sdcard_sd: bit_0: "0"
36671-37338 sdcard_sd: bit_1: "1"
37338-38004 sdcard_sd: bit_0: "0"
38004-38671 sdcard_sd: bit_0: "0"
38671-39338 sdcard_sd: bit_1: "1"
39338-40004 sdcard_sd: bit_1: "1"
40004-40671 sdcard_sd: bit_0: "0"
40671-41338 sdcard_sd: bit_1: "1"
9340-10006 sdcard_sd: field-start: "Start bit" "Start" "S"
10006-10673 sdcard_sd: field-transmission: "Transmission: host" "T: host" "T"
10673-14673 sdcard_sd: field-cmd: "Command: ALL_SEND_CID (2)" "Cmd: ALL_SEND_CID (2)" "CMD2" "Cmd" "C"
14673-36005 sdcard_sd: field-arg: "Argument: 0x00000000" "Arg" "A"
36005-40671 sdcard_sd: field-crc: "CRC: 0x26" "CRC" "C"
40671-41338 sdcard_sd: field-end: "End bit" "End" "E"
14673-36005 sdcard_sd: decoded-field: "Stuff bits" "Stuff" "SB" "S"
9340-41338 sdcard_sd: cmd2: "CMD2 (ALL_SEND_CID): Ask card for CID number" "CMD2 (ALL_SEND_CID)" "CMD2"
44671-45337 sdcard_sd: bit_0: "0"
45337-46004 sdcard_sd: bit_0: "0"
46004-46671 sdcard_sd: bit_1: "1"
46671-47337 sdcard_sd: bit_1: "1"
47337-48004 sdcard_sd: bit_1: "1"
48004-48670 sdcard_sd: bit_1: "1"
48670-49337 sdcard_sd: bit_1: "1"
49337-50004 sdcard_sd: bit_1: "1"
50004-50670 sdcard_sd: bit_0: "0"
50670-51337 sdcard_sd: bit_0: "0"
51337-52003 sdcard_sd: bit_0: "0"
52003-52670 sdcard_sd: bit_0: "0"
52670-53337 sdcard_sd: bit_1: "1"
53337-54003 sdcard_sd: bit_0: "0"
54003-54670 sdcard_sd: bit_0: "0"
54670-55337 sdcard_sd: bit_1: "1"
55337-56003 sdcard_sd: bit_0: "0"
56003-56670 sdcard_sd: bit_1: "1"
56670-57336 sdcard_sd: bit_0: "0"
57336-58003 sdcard_sd: bit_0: "0"
58003-58670 sdcard_sd: bit_0: "0"
58670-59336 sdcard_sd: bit_0: "0"
59336-60003 sdcard_sd: bit_0: "0"
60003-60670 sdcard_sd: bit_1: "1"
60670-61336 sdcard_sd: bit_0: "0"
61336-62003 sdcard_sd: bit_1: "1"
62003-62669 sdcard_sd: bit_0: "0"
62669-63336 sdcard_sd: bit_1: "1"
63336-64003 sdcard_sd: bit_0: "0"
64003-64669 sdcard_sd: bit_0: "0"
64669-65336 sdcard_sd: bit_0: "0"
65336-66002 sdcard_sd: bit_0: "0"
66002-66669 sdcard_sd: bit_0: "0"
66669-67336 sdcard_sd: bit_1: "1"
67336-68002 sdcard_sd: bit_0: "0"
68002-68669 sdcard_sd: bit_0: "0"
68669-69336 sdcard_sd: bit_0: "0"
69336-70002 sdcard_sd: bit_0: "0"
70002-70669 sdcard_sd: bit_0: "0"
70669-71335 sdcard_sd: bit_1: "1"
71335-72002 sdcard_sd: bit_0: "0"
72002-72669 sdcard_sd: bit_1: "1"
72669-73335 sdcard_sd: bit_0: "0"
73335-74002 sdcard_sd: bit_0: "0"
74002-74669 sdcard_sd: bit_0: "0"
74669-75335 sdcard_sd: bit_1: "1"
75335-76002 sdcard_sd: bit_1: "1"
76002-76668 sdcard_sd: bit_0: "0"
76668-77335 sdcard_sd: bit_0: "0"
77335-78002 sdcard_sd: bit_1: "1"
78002-78668 sdcard_sd: bit_0: "0"
78668-79335 sdcard_sd: bit_1: "1"
79335-80002 sdcard_sd: bit_0: "0"
80002-80668 sdcard_sd: bit_0: "0"
80668-81335 sdcard_sd: bit_1: "1"
81335-82001 sdcard_sd: bit_1: "1"
82001-82668 sdcard_sd: bit_0: "0"
82668-83335 sdcard_sd: bit_1: "1"
83335-84001 sdcard_sd: bit_0: "0"
84001-84668 sdcard_sd: bit_0: "0"
84668-85334 sdcard_sd: bit_0: "0"
85334-86001 sdcard_sd: bit_1: "1"
86001-86668 sdcard_sd: bit_0: "0"
86668-87334 sdcard_sd: bit_0: "0"
87334-88001 sdcard_sd: bit_0: "0"
88001-88668 sdcard_sd: bit_1: "1"
88668-89334 sdcard_sd: bit_0: "0"
89334-90001 sdcard_sd: bit_0: "0"
90001-90667 sdcard_sd: bit_1: "1"
90667-91334 sdcard_sd: bit_0: "0"
91334-92001 sdcard_sd: bit_0: "0"
92001-92667 sdcard_sd: bit_1: "1"
92667-93334 sdcard_sd: bit_0: "0"
93334-94000 sdcard_sd: bit_0: "0"
94000-94667 sdcard_sd: bit_0: "0"
94667-95334 sdcard_sd: bit_1: "1"
95334-96000 sdcard_sd: bit_0: "0"
96000-96667 sdcard_sd: bit_0: "0"
96667-97334 sdcard_sd: bit_0: "0"
97334-98000 sdcard_sd: bit_0: "0"
98000-98667 sdcard_sd: bit_0: "0"
98667-99333 sdcard_sd: bit_0: "0"
99333-100000 sdcard_sd: bit_1: "1"
100000-100667 sdcard_sd: bit_0: "0"
100667-101333 sdcard_sd: bit_0: "0"
101333-102000 sdcard_sd: bit_1: "1"
102000-102667 sdcard_sd: bit_1: "1"
102667-103333 sdcard_sd: bit_0: "0"
103333-104000 sdcard_sd: bit_0: "0"
104000-104666 sdcard_sd: bit_1: "1"
104666-105333 sdcard_sd: bit_1: "1"
105333-106000 sdcard_sd: bit_1: "1"
106000-106666 sdcard_sd: bit_1: "1"
106666-107333 sdcard_sd: bit_0: "0"
107333-107999 sdcard_sd: bit_0: "0"
107999-108666 sdcard_sd: bit_0: "0"
108666-109333 sdcard_sd: bit_0: "0"
109333-109999 sdcard_sd: bit_0: "0"
109999-110666 sdcard_sd: bit_0: "0"
110666-111333 sdcard_sd: bit_0: "0"
111333-111999 sdcard_sd: bit_0: "0"
111999-112666 sdcard_sd: bit_1: "1"
112666-113332 sdcard_sd: bit_1: "1"
113332-113999 sdcard_sd: bit_0: "0"
113999-114666 sdcard_sd: bit_0: "0"
114666-115332 sdcard_sd: bit_1: "1"
115332-115999 sdcard_sd: bit_1: "1"
115999-116666 sdcard_sd: bit_1: "1"
116666-117332 sdcard_sd: bit_1: "1"
117332-117999 sdcard_sd: bit_0: "0"
117999-118665 sdcard_sd: bit_1: "1"
118665-119332 sdcard_sd: bit_1: "1"
119332-119999 sdcard_sd: bit_0: "0"
119999-120665 sdcard_sd: bit_0: "0"
120665-121332 sdcard_sd: bit_0: "0"
121332-121998 sdcard_sd: bit_0: "0"
121998-122665 sdcard_sd: bit_0: "0"
122665-123332 sdcard_sd: bit_0: "0"
123332-123998 sdcard_sd: bit_0: "0"
123998-124665 sdcard_sd: bit_0: "0"
124665-125332 sdcard_sd: bit_1: "1"
125332-125998 sdcard_sd: bit_0: "0"
125998-126665 sdcard_sd: bit_0: "0"
126665-127331 sdcard_sd: bit_0: "0"
127331-127998 sdcard_sd: bit_0: "0"
127998-128665 sdcard_sd: bit_1: "1"
128665-129331 sdcard_sd: bit_1: "1"
129331-129998 sdcard_sd: bit_1: "1"
129998-130665 sdcard_sd: bit_0: "0"
130665-131331 sdcard_sd: bit_1: "1"
131331-131998 sdcard_sd: bit_1: "1"
131998-132664 sdcard_sd: bit_1: "1"
132664-133331 sdcard_sd: bit_0: "0"
133331-133998 sdcard_sd: bit_1: "1"
133998-134664 sdcard_sd: bit_0: "0"
134664-135330 sdcard_sd: bit_1: "1"
44671-45337 sdcard_sd: field-start: "Start bit" "Start" "S"
45337-46004 sdcard_sd: field-transmission: "Transmission: card" "T: card" "T"
46004-50004 sdcard_sd: field-cmd: "Reserved" "Res" "R"
50004-134664 sdcard_sd: field-arg: "Argument" "Arg" "A"
134664-135330 sdcard_sd: field-end: "End bit" "End" "E"
50004-134664 sdcard_sd: decoded-field: "CID/CSD register" "CID/CSD" "C"
44671-135330 sdcard_sd: response_r2: "Response: R2"
50004-55337 sdcard_sd: reg_cid_mid: "Manufacturer ID" "MID"
55337-66002 sdcard_sd: reg_cid_oid: "OEM/application ID" "OID"
66002-92667 sdcard_sd: reg_cid_pnm: "Product name" "PNM"
92667-98000 sdcard_sd: reg_cid_prv: "Product revision" "PRV"
98000-119332 sdcard_sd: reg_cid_psn: "Product serial number" "PSN"
119332-121998 sdcard_sd: reg_cid_rsvd: "Reserved" "RSVD" "R"
121998-129998 sdcard_sd: reg_cid_mdt: "Manufacturing date" "MDT"
129998-134664 sdcard_sd: reg_cid_crc: "CRC7 checksum" "CRC"
134664-135330 sdcard_sd: reg_cid_one: "Always 1" "1"
