4976-5642 sdcard_sd: bit_0: "0"
5642-6309 sdcard_sd: bit_1: "1"
6309-6976 sdcard_sd: bit_1: "1"
6976-7642 sdcard_sd: bit_1: "1"
7642-8309 sdcard_sd: bit_0: "0"
8309-8976 sdcard_sd: bit_1: "1"
8976-9642 sdcard_sd: bit_1: "1"
9642-10309 sdcard_sd: bit_1: "1"
10309-10975 sdcard_sd: bit_0: "0"
10975-11642 sdcard_sd: bit_0: "0"
11642-12309 sdcard_sd: bit_0: "0"
12309-12975 sdcard_sd: bit_0: "0"
12975-13642 sdcard_sd: bit_0: "0"
13642-14309 sdcard_sd: bit_0: "0"
14309-14975 sdcard_sd: bit_0: "0"
14975-15642 sdcard_sd: bit_0: "0"
15642-16308 sdcard_sd: bit_0: "0"
16308-16975 sdcard_sd: bit_0: "0"
16975-17642 sdcard_sd: bit_0: "0"
17642-18308 sdcard_sd: bit_0: "0"
18308-18975 sdcard_sd: bit_0: "0"
18975-19641 sdcard_sd: bit_0: "0"
19641-20308 sdcard_sd: bit_0: "0"
20308-20975 sdcard_sd: bit_0: "0"
20975-21641 sdcard_sd: bit_0: "0"
21641-22308 sdcard_sd: bit_0: "0"
22308-22975 sdcard_sd: bit_0: "0"
22975-23641 sdcard_sd: bit_0: "0"
23641-24308 sdcard_sd: bit_0: "0"
24308-24974 sdcard_sd: bit_0: "0"
24974-25641 sdcard_sd: bit_0: "0"
25641-26308 sdcard_sd: bit_0: "0"
26308-26974 sdcard_sd: bit_0: "0"
26974-27641 sdcard_sd: bit_0: "0"
27641-28308 sdcard_sd: bit_0: "0"
28308-28974 sdcard_sd: bit_0: "0"
28974-29641 sdcard_sd: bit_0: "0"
29641-30307 sdcard_sd: bit_0: "0"
30307-30974 sdcard_sd: bit_0: "0"
30974-31641 sdcard_sd: bit_0: "0"
31641-32307 sdcard_sd: bit_0: "0"
32307-32974 sdcard_sd: bit_1: "1"
32974-33640 sdcard_sd: bit_1: "1"
33640-34307 sdcard_sd: bit_0: "0"
34307-34974 sdcard_sd: bit_0: "0"
34974-35640 sdcard_sd: bit_1: "1"
35640-36307 sdcard_sd: bit_0: "0"
36307-36974 sdcard_sd: bit_1: "1"
4976-5642 sdcard_sd: field-start: "Start bit" "Start" "S"
5642-6309 sdcard_sd: field-transmission: "Transmission: host" "T: host" "T"
6309-10309 sdcard_sd: field-cmd: "Command: APP_CMD (55)" "Cmd: APP_CMD (55)" "CMD55" "Cmd" "C"
10309-31641 sdcard_sd: field-arg: "Argument: 0x00000000" "Arg" "A"
31641-36307 sdcard_sd: field-crc: "CRC: 0x32" "CRC" "C"
36307-36974 sdcard_sd: field-end: "End bit" "End" "E"
10309-20975 sdcard_sd: decoded-field: "RCA" "R"
20975-31641 sdcard_sd: decoded-field: "Stuff bits" "Stuff" "SB" "S"
4976-36974 sdcard_sd: cmd55: "CMD55 (APP_CMD): Next command is an application-specific command" "CMD55 (APP_CMD)" "CMD55"
40307-40973 sdcard_sd: bit_0: "0"
40973-41640 sdcard_sd: bit_0: "0"
41640-42307 sdcard_sd: bit_1: "1"
42307-42973 sdcard_sd: bit_1: "1"
42973-43640 sdcard_sd: bit_0: "0"
43640-44306 sdcard_sd: bit_1: "1"
44306-44973 sdcard_sd: bit_1: "1"
44973-45640 sdcard_sd: bit_1: "1"
45640-46306 sdcard_sd: bit_0: "0"
46306-46973 sdcard_sd: bit_0: "0"
46973-47639 sdcard_sd: bit_0: "0"
47639-48306 sdcard_sd: bit_0: "0"
48306-48973 sdcard_sd: bit_0: "0"
48973-49639 sdcard_sd: bit_0: "0"
49639-50306 sdcard_sd: bit_0: "0"
50306-50973 sdcard_sd: bit_0: "0"
50973-51639 sdcard_sd: bit_0: "0"
51639-52306 sdcard_sd: bit_0: "0"
52306-52972 sdcard_sd: bit_0: "0"
52972-53639 sdcard_sd: bit_0: "0"
53639-54306 sdcard_sd: bit_0: "0"
54306-54972 sdcard_sd: bit_0: "0"
54972-55639 sdcard_sd: bit_0: "0"
55639-56306 sdcard_sd: bit_0: "0"
56306-56972 sdcard_sd: bit_0: "0"
56972-57639 sdcard_sd: bit_0: "0"
57639-58305 sdcard_sd: bit_0: "0"
58305-58972 sdcard_sd: bit_0: "0"
58972-59639 sdcard_sd: bit_0: "0"
59639-60305 sdcard_sd: bit_0: "0"
60305-60972 sdcard_sd: bit_0: "0"
60972-61638 sdcard_sd: bit_1: "1"
61638-62305 sdcard_sd: bit_0: "0"
62305-62972 sdcard_sd: bit_0: "0"
62972-63638 sdcard_sd: bit_1: "1"
63638-64305 sdcard_sd: bit_0: "0"
64305-64972 sdcard_sd: bit_0: "0"
64972-65638 sdcard_sd: bit_0: "0"
65638-66305 sdcard_sd: bit_0: "0"
66305-66971 sdcard_sd: bit_0: "0"
66971-67638 sdcard_sd: bit_1: "1"
67638-68305 sdcard_sd: bit_0: "0"
68305-68971 sdcard_sd: bit_0: "0"
68971-69638 sdcard_sd: bit_0: "0"
69638-70305 sdcard_sd: bit_0: "0"
70305-70971 sdcard_sd: bit_0: "0"
70971-71638 sdcard_sd: bit_1: "1"
71638-72305 sdcard_sd: bit_1: "1"
40307-40973 sdcard_sd: field-start: "Start bit" "Start" "S"
40973-41640 sdcard_sd: field-transmission: "Transmission: card" "T: card" "T"
41640-45640 sdcard_sd: field-cmd: "Command: Non-existant (55)" "Cmd: Non-existant (55)" "CMD55" "Cmd" "C"
45640-66971 sdcard_sd: field-arg: "Argument: 0x00000120" "Arg" "A"
66971-71638 sdcard_sd: field-crc: "CRC: 0x41" "CRC" "C"
71638-72305 sdcard_sd: field-end: "End bit" "End" "E"
40307-72305 sdcard_sd: response_r1: "Response: R1"
45640-66971 sdcard_sd: decoded-field: "Card status" "Status" "S"
45640-46306 sdcard_sd: reg_status_out_of_range: "OUT_OF_RANGE"
46306-46973 sdcard_sd: reg_status_address_error: "ADDRESS_ERROR"
46973-47639 sdcard_sd: reg_status_block_len_error: "BLOCK_LEN_ERROR"
47639-48306 sdcard_sd: reg_status_erase_seq_error: "ERASE_SEQ_ERROR"
48306-48973 sdcard_sd: reg_status_erase_param: "ERASE_PARAM"
48973-49639 sdcard_sd: reg_status_wp_violation: "WP_VIOLATION"
49639-50306 sdcard_sd: reg_status_card_is_locked: "CARD_IS_LOCKED"
50306-50973 sdcard_sd: reg_status_lock_unlock_failed: "LOCK_UNLOCK_FAILED"
50973-51639 sdcard_sd: reg_status_com_crc_error: "COM_CRC_ERROR"
51639-52306 sdcard_sd: reg_status_illegal_command: "ILLEGAL_COMMAND"
52306-52972 sdcard_sd: reg_status_card_ecc_failed: "CARD_ECC_FAILED"
52972-53639 sdcard_sd: reg_status_cc_error: "CC_ERROR"
53639-54306 sdcard_sd: reg_status_error: "ERROR"
54306-54972 sdcard_sd: reg_status_rsvd: "Reserved" "RSVD" "R"
54972-55639 sdcard_sd: reg_status_rsvd_deferred_response: "Reserved for DEFERRED_RESPONSE" "RSVD_DEFERRED_RESPONSE"
55639-56306 sdcard_sd: reg_status_csd_overwrite: "CSD_OVERWRITE"
56306-56972 sdcard_sd: reg_status_wp_erase_skip: "WP_ERASE_SKIP"
56972-57639 sdcard_sd: reg_status_card_ecc_disabled: "CARD_ECC_DISABLED"
57639-58305 sdcard_sd: reg_status_erase_reset: "ERASE_RESET"
58305-60972 sdcard_sd: reg_status_current_state: "CURRENT_STATE"
60972-61638 sdcard_sd: reg_status_ready_for_data: "READY_FOR_DATA"
61638-62305 sdcard_sd: reg_status_rsvd: "RSVD"
62305-62972 sdcard_sd: reg_status_fx_event: "FX_EVENT"
62972-63638 sdcard_sd: reg_status_app_cmd: "APP_CMD"
63638-64305 sdcard_sd: reg_status_rsvd_sdio: "Reserved for SDIO card" "RSVD_SDIO"
64305-64972 sdcard_sd: reg_status_ake_seq_error: "AKE_SEQ_ERROR"
64972-65638 sdcard_sd: reg_status_rsvd_app_cmd: "Reserved for application specific commands" "RSVD_APP_CMD"
65638-66971 sdcard_sd: reg_status_rsvd_testmode: "Reserved for manufacturer test mode" "RSVD_TESTMODE"
205628-206295 sdcard_sd: bit_0: "0"
206295-206961 sdcard_sd: bit_1: "1"
206961-207628 sdcard_sd: bit_1: "1"
207628-208295 sdcard_sd: bit_0: "0"
208295-208961 sdcard_sd: bit_1: "1"
208961-209628 sdcard_sd: bit_0: "0"
209628-210295 sdcard_sd: bit_0: "0"
210295-210961 sdcard_sd: bit_1: "1"
210961-211628 sdcard_sd: bit_0: "0"
211628-212294 sdcard_sd: bit_0: "0"
212294-212961 sdcard_sd: bit_0: "0"
212961-213628 sdcard_sd: bit_0: "0"
213628-214294 sdcard_sd: bit_0: "0"
214294-214961 sdcard_sd: bit_0: "0"
214961-215627 sdcard_sd: bit_0: "0"
215627-216294 sdcard_sd: bit_0: "0"
216294-216961 sdcard_sd: bit_1: "1"
216961-217627 sdcard_sd: bit_1: "1"
217627-218294 sdcard_sd: bit_1: "1"
218294-218961 sdcard_sd: bit_1: "1"
218961-219627 sdcard_sd: bit_1: "1"
219627-220294 sdcard_sd: bit_1: "1"
220294-220960 sdcard_sd: bit_0: "0"
220960-221627 sdcard_sd: bit_0: "0"
221627-222294 sdcard_sd: bit_0: "0"
222294-222960 sdcard_sd: bit_0: "0"
222960-223627 sdcard_sd: bit_0: "0"
223627-224294 sdcard_sd: bit_0: "0"
224294-224960 sdcard_sd: bit_0: "0"
224960-225627 sdcard_sd: bit_0: "0"
225627-226293 sdcard_sd: bit_0: "0"
226293-226960 sdcard_sd: bit_0: "0"
226960-227627 sdcard_sd: bit_0: "0"
227627-228293 sdcard_sd: bit_0: "0"
228293-228960 sdcard_sd: bit_0: "0"
228960-229626 sdcard_sd: bit_0: "0"
229626-230293 sdcard_sd: bit_0: "0"
230293-230960 sdcard_sd: bit_0: "0"
230960-231626 sdcard_sd: bit_0: "0"
231626-232293 sdcard_sd: bit_0: "0"
232293-232960 sdcard_sd: bit_1: "1"
232960-233626 sdcard_sd: bit_1: "1"
233626-234293 sdcard_sd: bit_0: "0"
234293-234959 sdcard_sd: bit_0: "0"
234959-235626 sdcard_sd: bit_0: "0"
235626-236293 sdcard_sd: bit_0: "0"
236293-236959 sdcard_sd: bit_0: "0"
236959-237625 sdcard_sd: bit_1: "1"
205628-206295 sdcard_sd: field-start: "Start bit" "Start" "S"
206295-206961 sdcard_sd: field-transmission: "Transmission: host" "T: host" "T"
206961-210961 sdcard_sd: field-cmd: "Command: SD_SEND_OP_COND (41)" "Cmd: SD_SEND_OP_COND (41)" "CMD41" "Cmd" "C"
210961-232293 sdcard_sd: field-arg: "Argument: 0x00fc0000" "Arg" "A"
232293-236959 sdcard_sd: field-crc: "CRC: 0x60" "CRC" "C"
236959-237625 sdcard_sd: field-end: "End bit" "End" "E"
216294-232293 sdcard_sd: decoded-field: "VDD voltage window" "VDD volt" "VDD" "V"
215627-216294 sdcard_sd: decoded-field: "S18R"
213628-215627 sdcard_sd: decoded-field: "Reserved" "Res" "R"
212961-213628 sdcard_sd: decoded-field: "XPC"
212294-212961 sdcard_sd: decoded-field: "Reserved for eSD" "Reserved" "Res" "R"
211628-212294 sdcard_sd: decoded-field: "Host capacity support info" "Host capacity" "HCS" "H"
210961-211628 sdcard_sd: decoded-field: "Reserved" "Res" "R"
205628-237625 sdcard_sd: acmd41: "ACMD41 (SD_SEND_OP_COND): Send HCS info and activate the card init process" "ACMD41 (SD_SEND_OP_COND)" "ACMD41"
240959-272957 sdcard_sd: response_r3: "Response: R3"
240959-241626 sdcard_sd: bit_0: "0"
241626-242292 sdcard_sd: bit_0: "0"
242292-242959 sdcard_sd: bit_1: "1"
242959-243626 sdcard_sd: bit_1: "1"
243626-244292 sdcard_sd: bit_1: "1"
244292-244959 sdcard_sd: bit_1: "1"
244959-245625 sdcard_sd: bit_1: "1"
245625-246292 sdcard_sd: bit_1: "1"
246292-246959 sdcard_sd: bit_0: "0"
246959-247625 sdcard_sd: bit_0: "0"
247625-248292 sdcard_sd: bit_0: "0"
248292-248958 sdcard_sd: bit_0: "0"
248958-249625 sdcard_sd: bit_0: "0"
249625-250292 sdcard_sd: bit_0: "0"
250292-250958 sdcard_sd: bit_0: "0"
250958-251625 sdcard_sd: bit_0: "0"
251625-252292 sdcard_sd: bit_1: "1"
252292-252958 sdcard_sd: bit_1: "1"
252958-253625 sdcard_sd: bit_1: "1"
253625-254291 sdcard_sd: bit_1: "1"
254291-254958 sdcard_sd: bit_1: "1"
254958-255625 sdcard_sd: bit_1: "1"
255625-256291 sdcard_sd: bit_1: "1"
256291-256958 sdcard_sd: bit_1: "1"
256958-257625 sdcard_sd: bit_1: "1"
257625-258291 sdcard_sd: bit_0: "0"
258291-258958 sdcard_sd: bit_0: "0"
258958-259624 sdcard_sd: bit_0: "0"
259624-260291 sdcard_sd: bit_0: "0"
260291-260958 sdcard_sd: bit_0: "0"
260958-261624 sdcard_sd: bit_0: "0"
261624-262291 sdcard_sd: bit_0: "0"
262291-262957 sdcard_sd: bit_0: "0"
262957-263624 sdcard_sd: bit_0: "0"
263624-264291 sdcard_sd: bit_0: "0"
264291-264957 sdcard_sd: bit_0: "0"
264957-265624 sdcard_sd: bit_0: "0"
265624-266291 sdcard_sd: bit_0: "0"
266291-266957 sdcard_sd: bit_0: "0"
266957-267624 sdcard_sd: bit_0: "0"
267624-268290 sdcard_sd: bit_1: "1"
268290-268957 sdcard_sd: bit_1: "1"
268957-269624 sdcard_sd: bit_1: "1"
269624-270290 sdcard_sd: bit_1: "1"
270290-270957 sdcard_sd: bit_1: "1"
270957-271623 sdcard_sd: bit_1: "1"
271623-272290 sdcard_sd: bit_1: "1"
272290-272957 sdcard_sd: bit_1: "1"
240959-241626 sdcard_sd: field-start: "Start bit" "Start" "S"
241626-242292 sdcard_sd: field-transmission: "Transmission: card" "T: card" "T"
242292-246292 sdcard_sd: field-cmd: "Reserved" "Res" "R"
246292-267624 sdcard_sd: field-arg: "Argument" "Arg" "A"
267624-272290 sdcard_sd: field-crc: "Reserved" "Res" "R"
272290-272957 sdcard_sd: field-end: "End bit" "End" "E"
246292-267624 sdcard_sd: decoded-field: "OCR register" "OCR reg" "OCR" "O"
