6674-7340 sdcard_sd: bit_0: "0"
7340-8007 sdcard_sd: bit_1: "1"
8007-8674 sdcard_sd: bit_0: "0"
8674-9340 sdcard_sd: bit_0: "0"
9340-10007 sdcard_sd: bit_0: "0"
10007-10674 sdcard_sd: bit_1: "1"
10674-11340 sdcard_sd: bit_1: "1"
11340-12007 sdcard_sd: bit_1: "1"
12007-12673 sdcard_sd: bit_1: "1"
12673-13340 sdcard_sd: bit_0: "0"
13340-14007 sdcard_sd: bit_1: "1"
14007-14673 sdcard_sd: bit_1: "1"
14673-15340 sdcard_sd: bit_0: "0"
15340-16006 sdcard_sd: bit_0: "0"
16006-16673 sdcard_sd: bit_1: "1"
16673-17340 sdcard_sd: bit_1: "1"
17340-18006 sdcard_sd: bit_0: "0"
18006-18673 sdcard_sd: bit_1: "1"
18673-19340 sdcard_sd: bit_1: "1"
19340-20006 sdcard_sd: bit_0: "0"
20006-20673 sdcard_sd: bit_1: "1"
20673-21339 sdcard_sd: bit_0: "0"
21339-22006 sdcard_sd: bit_0: "0"
22006-22673 sdcard_sd: bit_0: "0"
22673-23339 sdcard_sd: bit_0: "0"
23339-24006 sdcard_sd: bit_0: "0"
24006-24673 sdcard_sd: bit_0: "0"
24673-25339 sdcard_sd: bit_0: "0"
25339-26006 sdcard_sd: bit_0: "0"
26006-26672 sdcard_sd: bit_0: "0"
26672-27339 sdcard_sd: bit_0: "0"
27339-28006 sdcard_sd: bit_0: "0"
28006-28672 sdcard_sd: bit_0: "0"
28672-29339 sdcard_sd: bit_0: "0"
29339-30005 sdcard_sd: bit_0: "0"
30005-30672 sdcard_sd: bit_0: "0"
30672-31339 sdcard_sd: bit_0: "0"
31339-32005 sdcard_sd: bit_0: "0"
32005-32672 sdcard_sd: bit_0: "0"
32672-33339 sdcard_sd: bit_0: "0"
33339-34005 sdcard_sd: bit_0: "0"
34005-34672 sdcard_sd: bit_1: "1"
34672-35338 sdcard_sd: bit_1: "1"
35338-36005 sdcard_sd: bit_0: "0"
36005-36672 sdcard_sd: bit_0: "0"
36672-37338 sdcard_sd: bit_0: "0"
37338-38005 sdcard_sd: bit_0: "0"
38005-38672 sdcard_sd: bit_1: "1"
6674-7340 sdcard_sd: field-start: "Start bit" "Start" "S"
7340-8007 sdcard_sd: field-transmission: "Transmission: host" "T: host" "T"
8007-12007 sdcard_sd: field-cmd: "Command: SELECT/DESELECT_CARD (7)" "Cmd: SELECT/DESELECT_CARD (7)" "CMD7" "Cmd" "C"
12007-33339 sdcard_sd: field-arg: "Argument: 0xb3680000" "Arg" "A"
33339-38005 sdcard_sd: field-crc: "CRC: 0x30" "CRC" "C"
38005-38672 sdcard_sd: field-end: "End bit" "End" "E"
6674-38672 sdcard_sd: cmd7: "CMD7 (SELECT/DESELECT_CARD): Select / deselect card" "CMD7 (SELECT/DESELECT_CARD)" "CMD7"
46004-46671 sdcard_sd: bit_0: "0"
46671-47338 sdcard_sd: bit_0: "0"
47338-48004 sdcard_sd: bit_0: "0"
48004-48671 sdcard_sd: bit_0: "0"
48671-49337 sdcard_sd: bit_0: "0"
49337-50004 sdcard_sd: bit_1: "1"
50004-50671 sdcard_sd: bit_1: "1"
50671-51337 sdcard_sd: bit_1: "1"
51337-52004 sdcard_sd: bit_0: "0"
52004-52671 sdcard_sd: bit_0: "0"
52671-53337 sdcard_sd: bit_0: "0"
53337-54004 sdcard_sd: bit_0: "0"
54004-54670 sdcard_sd: bit_0: "0"
54670-55337 sdcard_sd: bit_0: "0"
55337-56004 sdcard_sd: bit_0: "0"
56004-56670 sdcard_sd: bit_0: "0"
56670-57337 sdcard_sd: bit_0: "0"
57337-58003 sdcard_sd: bit_0: "0"
58003-58670 sdcard_sd: bit_0: "0"
58670-59337 sdcard_sd: bit_0: "0"
59337-60003 sdcard_sd: bit_0: "0"
60003-60670 sdcard_sd: bit_0: "0"
60670-61337 sdcard_sd: bit_0: "0"
61337-62003 sdcard_sd: bit_0: "0"
62003-62670 sdcard_sd: bit_0: "0"
62670-63336 sdcard_sd: bit_0: "0"
63336-64003 sdcard_sd: bit_0: "0"
64003-64670 sdcard_sd: bit_0: "0"
64670-65336 sdcard_sd: bit_0: "0"
65336-66003 sdcard_sd: bit_1: "1"
66003-66670 sdcard_sd: bit_1: "1"
66670-67336 sdcard_sd: bit_1: "1"
67336-68003 sdcard_sd: bit_0: "0"
68003-68669 sdcard_sd: bit_0: "0"
68669-69336 sdcard_sd: bit_0: "0"
69336-70003 sdcard_sd: bit_0: "0"
70003-70669 sdcard_sd: bit_0: "0"
70669-71336 sdcard_sd: bit_0: "0"
71336-72002 sdcard_sd: bit_0: "0"
72002-72669 sdcard_sd: bit_0: "0"
72669-73336 sdcard_sd: bit_0: "0"
73336-74002 sdcard_sd: bit_1: "1"
74002-74669 sdcard_sd: bit_1: "1"
74669-75336 sdcard_sd: bit_1: "1"
75336-76002 sdcard_sd: bit_0: "0"
76002-76669 sdcard_sd: bit_1: "1"
76669-77335 sdcard_sd: bit_0: "0"
77335-78001 sdcard_sd: bit_1: "1"
46004-46671 sdcard_sd: field-start: "Start bit" "Start" "S"
46671-47338 sdcard_sd: field-transmission: "Transmission: card" "T: card" "T"
47338-51337 sdcard_sd: field-cmd: "Command: SELECT/DESELECT_CARD (7)" "Cmd: SELECT/DESELECT_CARD (7)" "CMD7" "Cmd" "C"
51337-72669 sdcard_sd: field-arg: "Argument: 0x00000700" "Arg" "A"
72669-77335 sdcard_sd: field-crc: "CRC: 0x3a" "CRC" "C"
77335-78001 sdcard_sd: field-end: "End bit" "End" "E"
62003-72669 sdcard_sd: decoded-field: "Card status bits" "Status" "S"
51337-62003 sdcard_sd: decoded-field: "Relative card address" "RCA" "R"
46004-78001 sdcard_sd: response_r6: "Response: R6"
