258-279 parallel: item: "8"
279-299 parallel: item: "0"
258-299 parallel: word: "80"
299-320 parallel: item: "0"
320-340 parallel: item: "0"
299-340 parallel: word: "00"
340-361 parallel: item: "0"
361-381 parallel: item: "0"
340-381 parallel: word: "00"
381-402 parallel: item: "1"
402-422 parallel: item: "0"
381-422 parallel: word: "10"
422-443 parallel: item: "2"
443-463 parallel: item: "2"
422-463 parallel: word: "22"
463-484 parallel: item: "4"
484-504 parallel: item: "2"
463-504 parallel: word: "42"
504-525 parallel: item: "4"
525-545 parallel: item: "f"
504-545 parallel: word: "4f"
545-566 parallel: item: "4"
566-586 parallel: item: "f"
545-586 parallel: word: "4f"
586-607 parallel: item: "5"
607-627 parallel: item: "4"
586-627 parallel: word: "54"
627-648 parallel: item: "0"
648-668 parallel: item: "0"
627-668 parallel: word: "00"
668-689 parallel: item: "8"
689-709 parallel: item: "0"
668-709 parallel: word: "80"
709-730 parallel: item: "0"
730-750 parallel: item: "0"
709-750 parallel: word: "00"
750-770 parallel: item: "0"
770-791 parallel: item: "0"
750-791 parallel: word: "00"
791-811 parallel: item: "a"
811-832 parallel: item: "8"
791-832 parallel: word: "a8"
832-852 parallel: item: "8"
852-873 parallel: item: "5"
832-873 parallel: word: "85"
873-893 parallel: item: "7"
893-914 parallel: item: "7"
873-914 parallel: word: "77"
914-934 parallel: item: "0"
934-955 parallel: item: "0"
914-955 parallel: word: "00"
955-975 parallel: item: "2"
975-996 parallel: item: "0"
955-996 parallel: word: "20"
996-1016 parallel: item: "4"
1016-1037 parallel: item: "e"
996-1037 parallel: word: "4e"
1037-1057 parallel: item: "0"
1057-1078 parallel: item: "0"
1037-1078 parallel: word: "00"
1078-1098 parallel: item: "0"
1098-1170 parallel: item: "0"
1078-1170 parallel: word: "00"
