55912-56424 usb_power_delivery: preamble: "Preamble" "..."
56424-56464 usb_power_delivery: sym: "SYNC-1" "S1"
56464-56504 usb_power_delivery: sym: "SYNC-1" "S1"
56504-56545 usb_power_delivery: sym: "SYNC-1" "S1"
56545-56585 usb_power_delivery: sym: "SYNC-2" "S2"
56424-56585 usb_power_delivery: sop: "SOP" "S"
56585-56625 usb_power_delivery: sym: "0x1" "1"
56625-56665 usb_power_delivery: sym: "0x6" "6"
56665-56705 usb_power_delivery: sym: "0x1" "1"
56705-56745 usb_power_delivery: sym: "0x1" "1"
56585-56745 usb_power_delivery: header: "H:1161" "HD"
55912-57428 usb_power_delivery: src: "(r2) SRC[0]: SOURCE CAP" "SOURCE CAP"
56745-56786 usb_power_delivery: sym: "0x6" "6"
56786-56826 usb_power_delivery: sym: "0x9" "9"
56826-56866 usb_power_delivery: sym: "0x0" "0"
56866-56906 usb_power_delivery: sym: "0x9" "9"
56906-56946 usb_power_delivery: sym: "0x1" "1"
56946-56986 usb_power_delivery: sym: "0x0" "0"
56986-57027 usb_power_delivery: sym: "0x6" "6"
57027-57067 usb_power_delivery: sym: "0x3" "3"
56745-57067 usb_power_delivery: data: "[0]36019096" "D0"
56745-57067 usb_power_delivery: payload: "[1] [Fixed] 5V 1.5A (7.5W) [dual_role_power] [suspend] [comm_cap] [dual_role_data]" "[1] [Fixed] 5V 1.5A (7.5W) [dual_role_power] [suspend] [comm_cap] [dual_role_data]"
57067-57107 usb_power_delivery: sym: "0xE" "E"
57107-57147 usb_power_delivery: sym: "0x3" "3"
57147-57187 usb_power_delivery: sym: "0x1" "1"
57187-57227 usb_power_delivery: sym: "0x6" "6"
57227-57268 usb_power_delivery: sym: "0x3" "3"
57268-57308 usb_power_delivery: sym: "0x7" "7"
57308-57348 usb_power_delivery: sym: "0xC" "C"
57348-57388 usb_power_delivery: sym: "0x9" "9"
57067-57388 usb_power_delivery: crc: "CRC:9c73613e" "CRC"
57388-57428 usb_power_delivery: sym: "EOP" "#"
57388-57428 usb_power_delivery: eop: "EOP" "E"
55912-57428 usb_power_delivery: text: "#1    (23.296667ms): (r2) SRC[0]: SOURCE CAP - [1] [Fixed] 5V 1.5A (7.5W) [dual_role_power] [suspend] [comm_cap] [dual_role_data]" "..."
62499-63011 usb_power_delivery: preamble: "Preamble" "..."
63011-63051 usb_power_delivery: sym: "SYNC-1" "S1"
63051-63091 usb_power_delivery: sym: "SYNC-1" "S1"
63091-63132 usb_power_delivery: sym: "SYNC-1" "S1"
63132-63172 usb_power_delivery: sym: "SYNC-2" "S2"
63011-63172 usb_power_delivery: sop: "SOP" "S"
63172-63212 usb_power_delivery: sym: "0x1" "1"
63212-63252 usb_power_delivery: sym: "0x6" "6"
63252-63292 usb_power_delivery: sym: "0x1" "1"
63292-63332 usb_power_delivery: sym: "0x1" "1"
63172-63332 usb_power_delivery: header: "H:1161" "HD"
62499-64015 usb_power_delivery: src: "(r2) SRC[0]: SOURCE CAP" "SOURCE CAP"
63332-63373 usb_power_delivery: sym: "0x6" "6"
63373-63413 usb_power_delivery: sym: "0x9" "9"
63413-63453 usb_power_delivery: sym: "0x0" "0"
63453-63493 usb_power_delivery: sym: "0x9" "9"
63493-63533 usb_power_delivery: sym: "0x1" "1"
63533-63573 usb_power_delivery: sym: "0x0" "0"
63573-63614 usb_power_delivery: sym: "0x6" "6"
63614-63654 usb_power_delivery: sym: "0x3" "3"
63332-63654 usb_power_delivery: data: "[0]36019096" "D0"
63332-63654 usb_power_delivery: payload: "[1] [Fixed] 5V 1.5A (7.5W) [dual_role_power] [suspend] [comm_cap] [dual_role_data]" "[1] [Fixed] 5V 1.5A (7.5W) [dual_role_power] [suspend] [comm_cap] [dual_role_data]"
63654-63694 usb_power_delivery: sym: "0xE" "E"
63694-63734 usb_power_delivery: sym: "0x3" "3"
63734-63774 usb_power_delivery: sym: "0x1" "1"
63774-63814 usb_power_delivery: sym: "0x6" "6"
63814-63855 usb_power_delivery: sym: "0x3" "3"
63855-63895 usb_power_delivery: sym: "0x7" "7"
63895-63935 usb_power_delivery: sym: "0xC" "C"
63935-63975 usb_power_delivery: sym: "0x9" "9"
63654-63975 usb_power_delivery: crc: "CRC:9c73613e" "CRC"
63975-64015 usb_power_delivery: sym: "EOP" "#"
63975-64015 usb_power_delivery: eop: "EOP" "E"
62499-64015 usb_power_delivery: text: "#2    (26.041250ms): (r2) SRC[0]: SOURCE CAP - [1] [Fixed] 5V 1.5A (7.5W) [dual_role_power] [suspend] [comm_cap] [dual_role_data]" "..."
69076-69589 usb_power_delivery: preamble: "Preamble" "..."
69589-69629 usb_power_delivery: sym: "SYNC-1" "S1"
69629-69669 usb_power_delivery: sym: "SYNC-1" "S1"
69669-69709 usb_power_delivery: sym: "SYNC-1" "S1"
69709-69749 usb_power_delivery: sym: "SYNC-2" "S2"
69589-69749 usb_power_delivery: sop: "SOP" "S"
69749-69789 usb_power_delivery: sym: "0x1" "1"
69789-69830 usb_power_delivery: sym: "0x6" "6"
69830-69870 usb_power_delivery: sym: "0x1" "1"
69870-69910 usb_power_delivery: sym: "0x1" "1"
69749-69910 usb_power_delivery: header: "H:1161" "HD"
69076-70593 usb_power_delivery: src: "(r2) SRC[0]: SOURCE CAP" "SOURCE CAP"
69910-69950 usb_power_delivery: sym: "0x6" "6"
69950-69990 usb_power_delivery: sym: "0x9" "9"
69990-70030 usb_power_delivery: sym: "0x0" "0"
70030-70071 usb_power_delivery: sym: "0x9" "9"
70071-70111 usb_power_delivery: sym: "0x1" "1"
70111-70151 usb_power_delivery: sym: "0x0" "0"
70151-70191 usb_power_delivery: sym: "0x6" "6"
70191-70231 usb_power_delivery: sym: "0x3" "3"
69910-70231 usb_power_delivery: data: "[0]36019096" "D0"
69910-70231 usb_power_delivery: payload: "[1] [Fixed] 5V 1.5A (7.5W) [dual_role_power] [suspend] [comm_cap] [dual_role_data]" "[1] [Fixed] 5V 1.5A (7.5W) [dual_role_power] [suspend] [comm_cap] [dual_role_data]"
70231-70271 usb_power_delivery: sym: "0xE" "E"
70271-70312 usb_power_delivery: sym: "0x3" "3"
70312-70352 usb_power_delivery: sym: "0x1" "1"
70352-70392 usb_power_delivery: sym: "0x6" "6"
70392-70432 usb_power_delivery: sym: "0x3" "3"
70432-70472 usb_power_delivery: sym: "0x7" "7"
70472-70512 usb_power_delivery: sym: "0xC" "C"
70512-70553 usb_power_delivery: sym: "0x9" "9"
70231-70553 usb_power_delivery: crc: "CRC:9c73613e" "CRC"
70553-70593 usb_power_delivery: sym: "EOP" "#"
70553-70593 usb_power_delivery: eop: "EOP" "E"
69076-70593 usb_power_delivery: text: "#3    (28.781667ms): (r2) SRC[0]: SOURCE CAP - [1] [Fixed] 5V 1.5A (7.5W) [dual_role_power] [suspend] [comm_cap] [dual_role_data]" "..."
463745-464257 usb_power_delivery: preamble: "Preamble" "..."
464257-464297 usb_power_delivery: sym: "SYNC-1" "S1"
464297-464337 usb_power_delivery: sym: "SYNC-1" "S1"
464337-464378 usb_power_delivery: sym: "SYNC-1" "S1"
464378-464418 usb_power_delivery: sym: "SYNC-2" "S2"
464257-464418 usb_power_delivery: sop: "SOP" "S"
464418-464458 usb_power_delivery: sym: "0x1" "1"
464458-464498 usb_power_delivery: sym: "0x6" "6"
464498-464538 usb_power_delivery: sym: "0x1" "1"
464538-464579 usb_power_delivery: sym: "0x1" "1"
464418-464579 usb_power_delivery: header: "H:1161" "HD"
463745-465261 usb_power_delivery: src: "(r2) SRC[0]: SOURCE CAP" "SOURCE CAP"
464579-464619 usb_power_delivery: sym: "0x6" "6"
464619-464659 usb_power_delivery: sym: "0x9" "9"
464659-464699 usb_power_delivery: sym: "0x0" "0"
464699-464739 usb_power_delivery: sym: "0x9" "9"
464739-464779 usb_power_delivery: sym: "0x1" "1"
464779-464820 usb_power_delivery: sym: "0x0" "0"
464820-464860 usb_power_delivery: sym: "0x6" "6"
464860-464900 usb_power_delivery: sym: "0x3" "3"
464579-464900 usb_power_delivery: data: "[0]36019096" "D0"
464579-464900 usb_power_delivery: payload: "[1] [Fixed] 5V 1.5A (7.5W) [dual_role_power] [suspend] [comm_cap] [dual_role_data]" "[1] [Fixed] 5V 1.5A (7.5W) [dual_role_power] [suspend] [comm_cap] [dual_role_data]"
464900-464940 usb_power_delivery: sym: "0xE" "E"
464940-464980 usb_power_delivery: sym: "0x3" "3"
464980-465020 usb_power_delivery: sym: "0x1" "1"
465020-465061 usb_power_delivery: sym: "0x6" "6"
465061-465101 usb_power_delivery: sym: "0x3" "3"
465101-465141 usb_power_delivery: sym: "0x7" "7"
465141-465181 usb_power_delivery: sym: "0xC" "C"
465181-465221 usb_power_delivery: sym: "0x9" "9"
464900-465221 usb_power_delivery: crc: "CRC:9c73613e" "CRC"
465221-465261 usb_power_delivery: sym: "EOP" "#"
465221-465261 usb_power_delivery: eop: "EOP" "E"
463745-465261 usb_power_delivery: text: "#4    (193.227083ms): (r2) SRC[0]: SOURCE CAP - [1] [Fixed] 5V 1.5A (7.5W) [dual_role_power] [suspend] [comm_cap] [dual_role_data]" "..."
465508-466023 usb_power_delivery: preamble: "Preamble" "..."
466023-466064 usb_power_delivery: sym: "SYNC-1" "S1"
466064-466104 usb_power_delivery: sym: "SYNC-1" "S1"
466104-466145 usb_power_delivery: sym: "SYNC-1" "S1"
466145-466185 usb_power_delivery: sym: "SYNC-2" "S2"
466023-466185 usb_power_delivery: sop: "SOP" "S"
466185-466225 usb_power_delivery: sym: "0x1" "1"
466225-466265 usb_power_delivery: sym: "0x4" "4"
466265-466306 usb_power_delivery: sym: "0x0" "0"
466306-466346 usb_power_delivery: sym: "0x0" "0"
466185-466346 usb_power_delivery: header: "H:0041" "HD"
465508-466718 usb_power_delivery: snk: "(r2) SNK[0]: GOOD CRC" "GOOD CRC"
466346-466387 usb_power_delivery: sym: "0xB" "B"
466387-466427 usb_power_delivery: sym: "0xB" "B"
466427-466467 usb_power_delivery: sym: "0xC" "C"
466467-466508 usb_power_delivery: sym: "0x6" "6"
466508-466548 usb_power_delivery: sym: "0xB" "B"
466548-466588 usb_power_delivery: sym: "0xB" "B"
466588-466629 usb_power_delivery: sym: "0x8" "8"
466629-466669 usb_power_delivery: sym: "0xA" "A"
466346-466669 usb_power_delivery: crc: "CRC:a8bb6cbb" "CRC"
466669-466710 usb_power_delivery: sym: "EOP" "#"
466669-466710 usb_power_delivery: eop: "EOP" "E"
465508-466710 usb_power_delivery: text: "#5    (193.961667ms): (r2) SNK[0]: GOOD CRC" "..."
467724-468239 usb_power_delivery: preamble: "Preamble" "..."
468239-468280 usb_power_delivery: sym: "SYNC-1" "S1"
468280-468320 usb_power_delivery: sym: "SYNC-1" "S1"
468320-468361 usb_power_delivery: sym: "SYNC-1" "S1"
468361-468401 usb_power_delivery: sym: "SYNC-2" "S2"
468239-468401 usb_power_delivery: sop: "SOP" "S"
468401-468441 usb_power_delivery: sym: "0x2" "2"
468441-468481 usb_power_delivery: sym: "0x4" "4"
468481-468522 usb_power_delivery: sym: "0x0" "0"
468522-468562 usb_power_delivery: sym: "0x1" "1"
468401-468562 usb_power_delivery: header: "H:1042" "HD"
467724-469256 usb_power_delivery: snk: "(r2) SNK[0]: REQUEST" "REQUEST"
468562-468603 usb_power_delivery: sym: "0x6" "6"
468603-468643 usb_power_delivery: sym: "0x9" "9"
468643-468683 usb_power_delivery: sym: "0x8" "8"
468683-468724 usb_power_delivery: sym: "0x5" "5"
468724-468764 usb_power_delivery: sym: "0x2" "2"
468764-468805 usb_power_delivery: sym: "0x0" "0"
468805-468845 usb_power_delivery: sym: "0x3" "3"
468845-468885 usb_power_delivery: sym: "0x1" "1"
468562-468885 usb_power_delivery: data: "[0]13025896" "D0"
468562-468885 usb_power_delivery: payload: "[1] (PDO #1: Fixed 5V) 1.5A (operating) / 1.5A (max) [comm_cap] [no_suspend]" "[1] (PDO #1: Fixed 5V) 1.5A (operating) / 1.5A (max) [comm_cap] [no_suspend]"
468885-468925 usb_power_delivery: sym: "0xA" "A"
468925-468966 usb_power_delivery: sym: "0x6" "6"
468966-469006 usb_power_delivery: sym: "0xF" "F"
469006-469046 usb_power_delivery: sym: "0x7" "7"
469046-469087 usb_power_delivery: sym: "0xE" "E"
469087-469127 usb_power_delivery: sym: "0xB" "B"
469127-469168 usb_power_delivery: sym: "0xF" "F"
469168-469208 usb_power_delivery: sym: "0xD" "D"
468885-469208 usb_power_delivery: crc: "CRC:dfbe7f6a" "CRC"
469208-469248 usb_power_delivery: sym: "EOP" "#"
469208-469248 usb_power_delivery: eop: "EOP" "E"
467724-469248 usb_power_delivery: text: "#6    (194.885000ms): (r2) SNK[0]: REQUEST - [1] (PDO #1: Fixed 5V) 1.5A (operating) / 1.5A (max) [comm_cap] [no_suspend]" "..."
469499-470011 usb_power_delivery: preamble: "Preamble" "..."
470011-470052 usb_power_delivery: sym: "SYNC-1" "S1"
470052-470092 usb_power_delivery: sym: "SYNC-1" "S1"
470092-470132 usb_power_delivery: sym: "SYNC-1" "S1"
470132-470172 usb_power_delivery: sym: "SYNC-2" "S2"
470011-470172 usb_power_delivery: sop: "SOP" "S"
470172-470212 usb_power_delivery: sym: "0x1" "1"
470212-470252 usb_power_delivery: sym: "0x6" "6"
470252-470293 usb_power_delivery: sym: "0x1" "1"
470293-470333 usb_power_delivery: sym: "0x0" "0"
470172-470333 usb_power_delivery: header: "H:0161" "HD"
469499-470702 usb_power_delivery: src: "(r2) SRC[0]: GOOD CRC" "GOOD CRC"
470333-470373 usb_power_delivery: sym: "0xF" "F"
470373-470413 usb_power_delivery: sym: "0x8" "8"
470413-470453 usb_power_delivery: sym: "0x8" "8"
470453-470494 usb_power_delivery: sym: "0x7" "7"
470494-470534 usb_power_delivery: sym: "0x8" "8"
470534-470574 usb_power_delivery: sym: "0x3" "3"
470574-470614 usb_power_delivery: sym: "0xA" "A"
470614-470654 usb_power_delivery: sym: "0x4" "4"
470333-470654 usb_power_delivery: crc: "CRC:4a38788f" "CRC"
470654-470694 usb_power_delivery: sym: "EOP" "#"
470654-470694 usb_power_delivery: eop: "EOP" "E"
469499-470694 usb_power_delivery: text: "#7    (195.624583ms): (r2) SRC[0]: GOOD CRC" "..."
471380-471893 usb_power_delivery: preamble: "Preamble" "..."
471893-471933 usb_power_delivery: sym: "SYNC-1" "S1"
471933-471973 usb_power_delivery: sym: "SYNC-1" "S1"
471973-472014 usb_power_delivery: sym: "SYNC-1" "S1"
472014-472054 usb_power_delivery: sym: "SYNC-2" "S2"
471893-472054 usb_power_delivery: sop: "SOP" "S"
472054-472094 usb_power_delivery: sym: "0x3" "3"
472094-472134 usb_power_delivery: sym: "0x6" "6"
472134-472174 usb_power_delivery: sym: "0x3" "3"
472174-472214 usb_power_delivery: sym: "0x0" "0"
472054-472214 usb_power_delivery: header: "H:0363" "HD"
471380-472584 usb_power_delivery: src: "(r2) SRC[1]: ACCEPT" "ACCEPT"
472214-472255 usb_power_delivery: sym: "0x1" "1"
472255-472295 usb_power_delivery: sym: "0x2" "2"
472295-472335 usb_power_delivery: sym: "0xB" "B"
472335-472375 usb_power_delivery: sym: "0x7" "7"
472375-472415 usb_power_delivery: sym: "0x0" "0"
472415-472456 usb_power_delivery: sym: "0x0" "0"
472456-472496 usb_power_delivery: sym: "0x6" "6"
472496-472536 usb_power_delivery: sym: "0x9" "9"
472214-472536 usb_power_delivery: crc: "CRC:96007b21" "CRC"
472536-472576 usb_power_delivery: sym: "EOP" "#"
472536-472576 usb_power_delivery: eop: "EOP" "E"
471380-472576 usb_power_delivery: text: "#8    (196.408333ms): (r2) SRC[1]: ACCEPT" "..."
472834-473349 usb_power_delivery: preamble: "Preamble" "..."
473349-473389 usb_power_delivery: sym: "SYNC-1" "S1"
473389-473430 usb_power_delivery: sym: "SYNC-1" "S1"
473430-473470 usb_power_delivery: sym: "SYNC-1" "S1"
473470-473510 usb_power_delivery: sym: "SYNC-2" "S2"
473349-473510 usb_power_delivery: sop: "SOP" "S"
473510-473551 usb_power_delivery: sym: "0x1" "1"
473551-473591 usb_power_delivery: sym: "0x4" "4"
473591-473632 usb_power_delivery: sym: "0x2" "2"
473632-473672 usb_power_delivery: sym: "0x0" "0"
473510-473672 usb_power_delivery: header: "H:0241" "HD"
472834-474043 usb_power_delivery: snk: "(r2) SNK[1]: GOOD CRC" "GOOD CRC"
473672-473712 usb_power_delivery: sym: "0x7" "7"
473712-473753 usb_power_delivery: sym: "0x9" "9"
473753-473793 usb_power_delivery: sym: "0xD" "D"
473793-473833 usb_power_delivery: sym: "0x0" "0"
473833-473874 usb_power_delivery: sym: "0x5" "5"
473874-473914 usb_power_delivery: sym: "0xB" "B"
473914-473954 usb_power_delivery: sym: "0x6" "6"
473954-473995 usb_power_delivery: sym: "0x4" "4"
473672-473995 usb_power_delivery: crc: "CRC:46b50d97" "CRC"
473995-474035 usb_power_delivery: sym: "EOP" "#"
473995-474035 usb_power_delivery: eop: "EOP" "E"
472834-474035 usb_power_delivery: text: "#9    (197.014167ms): (r2) SNK[1]: GOOD CRC" "..."
595656-596169 usb_power_delivery: preamble: "Preamble" "..."
596169-596209 usb_power_delivery: sym: "SYNC-1" "S1"
596209-596249 usb_power_delivery: sym: "SYNC-1" "S1"
596249-596289 usb_power_delivery: sym: "SYNC-1" "S1"
596289-596329 usb_power_delivery: sym: "SYNC-2" "S2"
596169-596329 usb_power_delivery: sop: "SOP" "S"
596329-596369 usb_power_delivery: sym: "0x6" "6"
596369-596410 usb_power_delivery: sym: "0x6" "6"
596410-596450 usb_power_delivery: sym: "0x5" "5"
596450-596490 usb_power_delivery: sym: "0x0" "0"
596329-596490 usb_power_delivery: header: "H:0566" "HD"
595656-596860 usb_power_delivery: src: "(r2) SRC[2]: PS RDY" "PS RDY"
596490-596530 usb_power_delivery: sym: "0x1" "1"
596530-596570 usb_power_delivery: sym: "0x5" "5"
596570-596611 usb_power_delivery: sym: "0xA" "A"
596611-596651 usb_power_delivery: sym: "0x2" "2"
596651-596691 usb_power_delivery: sym: "0x4" "4"
596691-596731 usb_power_delivery: sym: "0x1" "1"
596731-596771 usb_power_delivery: sym: "0x2" "2"
596771-596812 usb_power_delivery: sym: "0x0" "0"
596490-596812 usb_power_delivery: crc: "CRC:02142a51" "CRC"
596812-596852 usb_power_delivery: sym: "EOP" "#"
596812-596852 usb_power_delivery: eop: "EOP" "E"
595656-596852 usb_power_delivery: text: "#10   (248.190000ms): (r2) SRC[2]: PS RDY" "..."
597133-597648 usb_power_delivery: preamble: "Preamble" "..."
597648-597688 usb_power_delivery: sym: "SYNC-1" "S1"
597688-597729 usb_power_delivery: sym: "SYNC-1" "S1"
597729-597769 usb_power_delivery: sym: "SYNC-1" "S1"
597769-597809 usb_power_delivery: sym: "SYNC-2" "S2"
597648-597809 usb_power_delivery: sop: "SOP" "S"
597809-597850 usb_power_delivery: sym: "0x1" "1"
597850-597890 usb_power_delivery: sym: "0x4" "4"
597890-597931 usb_power_delivery: sym: "0x4" "4"
597931-597971 usb_power_delivery: sym: "0x0" "0"
597809-597971 usb_power_delivery: header: "H:0441" "HD"
597133-598334 usb_power_delivery: snk: "(r2) SNK[2]: GOOD CRC" "GOOD CRC"
597971-598011 usb_power_delivery: sym: "0x2" "2"
598011-598052 usb_power_delivery: sym: "0xA" "A"
598052-598092 usb_power_delivery: sym: "0x8" "8"
598092-598132 usb_power_delivery: sym: "0xA" "A"
598132-598173 usb_power_delivery: sym: "0x6" "6"
598173-598213 usb_power_delivery: sym: "0xD" "D"
598213-598253 usb_power_delivery: sym: "0xF" "F"
598253-598294 usb_power_delivery: sym: "0xA" "A"
597971-598294 usb_power_delivery: crc: "CRC:afd6a8a2" "CRC"
598294-598334 usb_power_delivery: sym: "EOP" "#"
598294-598334 usb_power_delivery: eop: "EOP" "E"
597133-598334 usb_power_delivery: text: "#11   (248.805417ms): (r2) SNK[2]: GOOD CRC" "..."
598834-599346 usb_power_delivery: preamble: "Preamble" "..."
599346-599387 usb_power_delivery: sym: "SYNC-1" "S1"
599387-599427 usb_power_delivery: sym: "SYNC-1" "S1"
599427-599467 usb_power_delivery: sym: "SYNC-1" "S1"
599467-599507 usb_power_delivery: sym: "SYNC-2" "S2"
599346-599507 usb_power_delivery: sop: "SOP" "S"
599507-599547 usb_power_delivery: sym: "0x1" "1"
599547-599588 usb_power_delivery: sym: "0x6" "6"
599588-599628 usb_power_delivery: sym: "0x7" "7"
599628-599668 usb_power_delivery: sym: "0x1" "1"
599507-599668 usb_power_delivery: header: "H:1761" "HD"
598834-600359 usb_power_delivery: src: "(r2) SRC[3]: SOURCE CAP" "SOURCE CAP"
599668-599708 usb_power_delivery: sym: "0x6" "6"
599708-599748 usb_power_delivery: sym: "0x9" "9"
599748-599788 usb_power_delivery: sym: "0x0" "0"
599788-599828 usb_power_delivery: sym: "0x9" "9"
599828-599869 usb_power_delivery: sym: "0x1" "1"
599869-599909 usb_power_delivery: sym: "0x0" "0"
599909-599949 usb_power_delivery: sym: "0x6" "6"
599949-599989 usb_power_delivery: sym: "0x2" "2"
599668-599989 usb_power_delivery: data: "[0]26019096" "D0"
599668-599989 usb_power_delivery: payload: "[1] [Fixed] 5V 1.5A (7.5W) [dual_role_power] [comm_cap] [dual_role_data]" "[1] [Fixed] 5V 1.5A (7.5W) [dual_role_power] [comm_cap] [dual_role_data]"
599989-600029 usb_power_delivery: sym: "0xA" "A"
600029-600069 usb_power_delivery: sym: "0xF" "F"
600069-600110 usb_power_delivery: sym: "0x4" "4"
600110-600150 usb_power_delivery: sym: "0x8" "8"
600150-600190 usb_power_delivery: sym: "0x4" "4"
600190-600230 usb_power_delivery: sym: "0x8" "8"
600230-600270 usb_power_delivery: sym: "0xE" "E"
600270-600311 usb_power_delivery: sym: "0x0" "0"
599989-600311 usb_power_delivery: crc: "CRC:0e8484fa" "CRC"
600311-600351 usb_power_delivery: sym: "EOP" "#"
600311-600351 usb_power_delivery: eop: "EOP" "E"
598834-600351 usb_power_delivery: text: "#12   (249.514167ms): (r2) SRC[3]: SOURCE CAP - [1] [Fixed] 5V 1.5A (7.5W) [dual_role_power] [comm_cap] [dual_role_data]" "..."
600632-601147 usb_power_delivery: preamble: "Preamble" "..."
601147-601187 usb_power_delivery: sym: "SYNC-1" "S1"
601187-601228 usb_power_delivery: sym: "SYNC-1" "S1"
601228-601268 usb_power_delivery: sym: "SYNC-1" "S1"
601268-601308 usb_power_delivery: sym: "SYNC-2" "S2"
601147-601308 usb_power_delivery: sop: "SOP" "S"
601308-601349 usb_power_delivery: sym: "0x1" "1"
601349-601389 usb_power_delivery: sym: "0x4" "4"
601389-601429 usb_power_delivery: sym: "0x6" "6"
601429-601470 usb_power_delivery: sym: "0x0" "0"
601308-601470 usb_power_delivery: header: "H:0641" "HD"
600632-601833 usb_power_delivery: snk: "(r2) SNK[3]: GOOD CRC" "GOOD CRC"
601470-601510 usb_power_delivery: sym: "0xE" "E"
601510-601550 usb_power_delivery: sym: "0x8" "8"
601550-601591 usb_power_delivery: sym: "0x9" "9"
601591-601631 usb_power_delivery: sym: "0xC" "C"
601631-601672 usb_power_delivery: sym: "0x8" "8"
601672-601712 usb_power_delivery: sym: "0xD" "D"
601712-601752 usb_power_delivery: sym: "0x1" "1"
601752-601793 usb_power_delivery: sym: "0x4" "4"
601470-601793 usb_power_delivery: crc: "CRC:41d8c98e" "CRC"
601793-601833 usb_power_delivery: sym: "EOP" "#"
601793-601833 usb_power_delivery: eop: "EOP" "E"
600632-601833 usb_power_delivery: text: "#13   (250.263333ms): (r2) SNK[3]: GOOD CRC" "..."
603380-603895 usb_power_delivery: preamble: "Preamble" "..."
603895-603936 usb_power_delivery: sym: "SYNC-1" "S1"
603936-603976 usb_power_delivery: sym: "SYNC-1" "S1"
603976-604016 usb_power_delivery: sym: "SYNC-1" "S1"
604016-604056 usb_power_delivery: sym: "SYNC-2" "S2"
603895-604056 usb_power_delivery: sop: "SOP" "S"
604056-604097 usb_power_delivery: sym: "0x2" "2"
604097-604137 usb_power_delivery: sym: "0x4" "4"
604137-604178 usb_power_delivery: sym: "0x2" "2"
604178-604218 usb_power_delivery: sym: "0x1" "1"
604056-604218 usb_power_delivery: header: "H:1242" "HD"
603380-604912 usb_power_delivery: snk: "(r2) SNK[1]: REQUEST" "REQUEST"
604218-604258 usb_power_delivery: sym: "0x6" "6"
604258-604299 usb_power_delivery: sym: "0x9" "9"
604299-604339 usb_power_delivery: sym: "0x8" "8"
604339-604380 usb_power_delivery: sym: "0x5" "5"
604380-604420 usb_power_delivery: sym: "0x2" "2"
604420-604460 usb_power_delivery: sym: "0x0" "0"
604460-604501 usb_power_delivery: sym: "0x3" "3"
604501-604541 usb_power_delivery: sym: "0x1" "1"
604218-604541 usb_power_delivery: data: "[0]13025896" "D0"
604218-604541 usb_power_delivery: payload: "[1] (PDO #1: Fixed 5V) 1.5A (operating) / 1.5A (max) [comm_cap] [no_suspend]" "[1] (PDO #1: Fixed 5V) 1.5A (operating) / 1.5A (max) [comm_cap] [no_suspend]"
604541-604581 usb_power_delivery: sym: "0xA" "A"
604581-604622 usb_power_delivery: sym: "0x0" "0"
604622-604662 usb_power_delivery: sym: "0xC" "C"
604662-604702 usb_power_delivery: sym: "0x2" "2"
604702-604743 usb_power_delivery: sym: "0xE" "E"
604743-604783 usb_power_delivery: sym: "0x7" "7"
604783-604824 usb_power_delivery: sym: "0x5" "5"
604824-604864 usb_power_delivery: sym: "0xA" "A"
604541-604864 usb_power_delivery: crc: "CRC:a57e2c0a" "CRC"
604864-604904 usb_power_delivery: sym: "EOP" "#"
604864-604904 usb_power_delivery: eop: "EOP" "E"
603380-604904 usb_power_delivery: text: "#14   (251.408333ms): (r2) SNK[1]: REQUEST - [1] (PDO #1: Fixed 5V) 1.5A (operating) / 1.5A (max) [comm_cap] [no_suspend]" "..."
605141-605654 usb_power_delivery: preamble: "Preamble" "..."
605654-605694 usb_power_delivery: sym: "SYNC-1" "S1"
605694-605734 usb_power_delivery: sym: "SYNC-1" "S1"
605734-605775 usb_power_delivery: sym: "SYNC-1" "S1"
605775-605815 usb_power_delivery: sym: "SYNC-2" "S2"
605654-605815 usb_power_delivery: sop: "SOP" "S"
605815-605855 usb_power_delivery: sym: "0x1" "1"
605855-605895 usb_power_delivery: sym: "0x6" "6"
605895-605935 usb_power_delivery: sym: "0x3" "3"
605935-605975 usb_power_delivery: sym: "0x0" "0"
605815-605975 usb_power_delivery: header: "H:0361" "HD"
605141-606337 usb_power_delivery: src: "(r2) SRC[1]: GOOD CRC" "GOOD CRC"
605975-606015 usb_power_delivery: sym: "0x3" "3"
606015-606056 usb_power_delivery: sym: "0xA" "A"
606056-606096 usb_power_delivery: sym: "0x9" "9"
606096-606136 usb_power_delivery: sym: "0x1" "1"
606136-606176 usb_power_delivery: sym: "0x6" "6"
606176-606216 usb_power_delivery: sym: "0x3" "3"
606216-606257 usb_power_delivery: sym: "0x4" "4"
606257-606297 usb_power_delivery: sym: "0xA" "A"
605975-606297 usb_power_delivery: crc: "CRC:a43619a3" "CRC"
606297-606337 usb_power_delivery: sym: "EOP" "#"
606297-606337 usb_power_delivery: eop: "EOP" "E"
605141-606337 usb_power_delivery: text: "#15   (252.142083ms): (r2) SRC[1]: GOOD CRC" "..."
606877-607389 usb_power_delivery: preamble: "Preamble" "..."
607389-607430 usb_power_delivery: sym: "SYNC-1" "S1"
607430-607470 usb_power_delivery: sym: "SYNC-1" "S1"
607470-607510 usb_power_delivery: sym: "SYNC-1" "S1"
607510-607550 usb_power_delivery: sym: "SYNC-2" "S2"
607389-607550 usb_power_delivery: sop: "SOP" "S"
607550-607590 usb_power_delivery: sym: "0x3" "3"
607590-607630 usb_power_delivery: sym: "0x6" "6"
607630-607670 usb_power_delivery: sym: "0x9" "9"
607670-607711 usb_power_delivery: sym: "0x0" "0"
607550-607711 usb_power_delivery: header: "H:0963" "HD"
606877-608080 usb_power_delivery: src: "(r2) SRC[4]: ACCEPT" "ACCEPT"
607711-607751 usb_power_delivery: sym: "0xF" "F"
607751-607791 usb_power_delivery: sym: "0x3" "3"
607791-607831 usb_power_delivery: sym: "0x2" "2"
607831-607871 usb_power_delivery: sym: "0x9" "9"
607871-607912 usb_power_delivery: sym: "0x5" "5"
607912-607952 usb_power_delivery: sym: "0xD" "D"
607952-607992 usb_power_delivery: sym: "0x6" "6"
607992-608032 usb_power_delivery: sym: "0x7" "7"
607711-608032 usb_power_delivery: crc: "CRC:76d5923f" "CRC"
608032-608072 usb_power_delivery: sym: "EOP" "#"
608032-608072 usb_power_delivery: eop: "EOP" "E"
606877-608072 usb_power_delivery: text: "#16   (252.865417ms): (r2) SRC[4]: ACCEPT" "..."
608325-608840 usb_power_delivery: preamble: "Preamble" "..."
608840-608880 usb_power_delivery: sym: "SYNC-1" "S1"
608880-608920 usb_power_delivery: sym: "SYNC-1" "S1"
608920-608961 usb_power_delivery: sym: "SYNC-1" "S1"
608961-609001 usb_power_delivery: sym: "SYNC-2" "S2"
608840-609001 usb_power_delivery: sop: "SOP" "S"
609001-609042 usb_power_delivery: sym: "0x1" "1"
609042-609082 usb_power_delivery: sym: "0x4" "4"
609082-609122 usb_power_delivery: sym: "0x8" "8"
609122-609162 usb_power_delivery: sym: "0x0" "0"
609001-609162 usb_power_delivery: header: "H:0841" "HD"
608325-609534 usb_power_delivery: snk: "(r2) SNK[4]: GOOD CRC" "GOOD CRC"
609162-609203 usb_power_delivery: sym: "0x9" "9"
609203-609243 usb_power_delivery: sym: "0x8" "8"
609243-609284 usb_power_delivery: sym: "0x4" "4"
609284-609324 usb_power_delivery: sym: "0xE" "E"
609324-609364 usb_power_delivery: sym: "0x0" "0"
609364-609405 usb_power_delivery: sym: "0x6" "6"
609405-609445 usb_power_delivery: sym: "0x6" "6"
609445-609486 usb_power_delivery: sym: "0xA" "A"
609162-609486 usb_power_delivery: crc: "CRC:a660e489" "CRC"
609486-609526 usb_power_delivery: sym: "EOP" "#"
609486-609526 usb_power_delivery: eop: "EOP" "E"
608325-609526 usb_power_delivery: text: "#17   (253.468750ms): (r2) SNK[4]: GOOD CRC" "..."
731206-731719 usb_power_delivery: preamble: "Preamble" "..."
731719-731759 usb_power_delivery: sym: "SYNC-1" "S1"
731759-731799 usb_power_delivery: sym: "SYNC-1" "S1"
731799-731839 usb_power_delivery: sym: "SYNC-1" "S1"
731839-731879 usb_power_delivery: sym: "SYNC-2" "S2"
731719-731879 usb_power_delivery: sop: "SOP" "S"
731879-731920 usb_power_delivery: sym: "0x6" "6"
731920-731960 usb_power_delivery: sym: "0x6" "6"
731960-732000 usb_power_delivery: sym: "0xB" "B"
732000-732040 usb_power_delivery: sym: "0x0" "0"
731879-732040 usb_power_delivery: header: "H:0b66" "HD"
731206-732401 usb_power_delivery: src: "(r2) SRC[5]: PS RDY" "PS RDY"
732040-732080 usb_power_delivery: sym: "0x6" "6"
732080-732120 usb_power_delivery: sym: "0x5" "5"
732120-732160 usb_power_delivery: sym: "0x7" "7"
732160-732201 usb_power_delivery: sym: "0x0" "0"
732201-732241 usb_power_delivery: sym: "0xC" "C"
732241-732281 usb_power_delivery: sym: "0xA" "A"
732281-732321 usb_power_delivery: sym: "0x5" "5"
732321-732361 usb_power_delivery: sym: "0xE" "E"
732040-732361 usb_power_delivery: crc: "CRC:e5ac0756" "CRC"
732361-732401 usb_power_delivery: sym: "EOP" "#"
732361-732401 usb_power_delivery: eop: "EOP" "E"
731206-732401 usb_power_delivery: text: "#18   (304.669167ms): (r2) SRC[5]: PS RDY" "..."
732677-733191 usb_power_delivery: preamble: "Preamble" "..."
733191-733232 usb_power_delivery: sym: "SYNC-1" "S1"
733232-733272 usb_power_delivery: sym: "SYNC-1" "S1"
733272-733313 usb_power_delivery: sym: "SYNC-1" "S1"
733313-733353 usb_power_delivery: sym: "SYNC-2" "S2"
733191-733353 usb_power_delivery: sop: "SOP" "S"
733353-733393 usb_power_delivery: sym: "0x1" "1"
733393-733434 usb_power_delivery: sym: "0x4" "4"
733434-733474 usb_power_delivery: sym: "0xA" "A"
733474-733514 usb_power_delivery: sym: "0x0" "0"
733353-733514 usb_power_delivery: header: "H:0a41" "HD"
732677-733877 usb_power_delivery: snk: "(r2) SNK[5]: GOOD CRC" "GOOD CRC"
733514-733555 usb_power_delivery: sym: "0x5" "5"
733555-733595 usb_power_delivery: sym: "0xA" "A"
733595-733635 usb_power_delivery: sym: "0x5" "5"
733635-733676 usb_power_delivery: sym: "0x8" "8"
733676-733716 usb_power_delivery: sym: "0xE" "E"
733716-733756 usb_power_delivery: sym: "0x6" "6"
733756-733797 usb_power_delivery: sym: "0x8" "8"
733797-733837 usb_power_delivery: sym: "0x4" "4"
733514-733837 usb_power_delivery: crc: "CRC:486e85a5" "CRC"
733837-733877 usb_power_delivery: sym: "EOP" "#"
733837-733877 usb_power_delivery: eop: "EOP" "E"
732677-733877 usb_power_delivery: text: "#19   (305.282083ms): (r2) SNK[5]: GOOD CRC" "..."
860313-860825 usb_power_delivery: preamble: "Preamble" "..."
860825-860866 usb_power_delivery: sym: "SYNC-1" "S1"
860866-860906 usb_power_delivery: sym: "SYNC-1" "S1"
860906-860946 usb_power_delivery: sym: "SYNC-1" "S1"
860946-860986 usb_power_delivery: sym: "SYNC-2" "S2"
860825-860986 usb_power_delivery: sop: "SOP" "S"
860986-861026 usb_power_delivery: sym: "0xF" "F"
861026-861067 usb_power_delivery: sym: "0x6" "6"
861067-861107 usb_power_delivery: sym: "0xD" "D"
861107-861147 usb_power_delivery: sym: "0x1" "1"
860986-861147 usb_power_delivery: header: "H:1d6f" "HD"
860313-861830 usb_power_delivery: src: "(r2) SRC[6]: VDM" "VDM"
861147-861187 usb_power_delivery: sym: "0x1" "1"
861187-861227 usb_power_delivery: sym: "0x0" "0"
861227-861267 usb_power_delivery: sym: "0x0" "0"
861267-861308 usb_power_delivery: sym: "0x8" "8"
861308-861348 usb_power_delivery: sym: "0x0" "0"
861348-861388 usb_power_delivery: sym: "0x0" "0"
861388-861428 usb_power_delivery: sym: "0xF" "F"
861428-861468 usb_power_delivery: sym: "0xF" "F"
861147-861468 usb_power_delivery: data: "[0]ff008001" "D0"
861147-861468 usb_power_delivery: payload: "[1] REQ Disc Ident  SVID:ff00" "[1] REQ Disc Ident  SVID:ff00"
861468-861508 usb_power_delivery: sym: "0x7" "7"
861508-861549 usb_power_delivery: sym: "0x7" "7"
861549-861589 usb_power_delivery: sym: "0xC" "C"
861589-861629 usb_power_delivery: sym: "0xD" "D"
861629-861669 usb_power_delivery: sym: "0xB" "B"
861669-861709 usb_power_delivery: sym: "0x9" "9"
861709-861750 usb_power_delivery: sym: "0x4" "4"
861750-861790 usb_power_delivery: sym: "0xA" "A"
861468-861790 usb_power_delivery: crc: "CRC:a49bdc77" "CRC"
861790-861830 usb_power_delivery: sym: "EOP" "#"
861790-861830 usb_power_delivery: eop: "EOP" "E"
860313-861830 usb_power_delivery: text: "#20   (358.463750ms): (r2) SRC[6]: VDM - [1] REQ Disc Ident  SVID:ff00" "..."
862103-862618 usb_power_delivery: preamble: "Preamble" "..."
862618-862659 usb_power_delivery: sym: "SYNC-1" "S1"
862659-862699 usb_power_delivery: sym: "SYNC-1" "S1"
862699-862739 usb_power_delivery: sym: "SYNC-1" "S1"
862739-862779 usb_power_delivery: sym: "SYNC-2" "S2"
862618-862779 usb_power_delivery: sop: "SOP" "S"
862779-862820 usb_power_delivery: sym: "0x1" "1"
862820-862860 usb_power_delivery: sym: "0x4" "4"
862860-862901 usb_power_delivery: sym: "0xC" "C"
862901-862941 usb_power_delivery: sym: "0x0" "0"
862779-862941 usb_power_delivery: header: "H:0c41" "HD"
862103-863312 usb_power_delivery: snk: "(r2) SNK[6]: GOOD CRC" "GOOD CRC"
862941-862981 usb_power_delivery: sym: "0x0" "0"
862981-863022 usb_power_delivery: sym: "0x9" "9"
863022-863062 usb_power_delivery: sym: "0x0" "0"
863062-863102 usb_power_delivery: sym: "0x2" "2"
863102-863143 usb_power_delivery: sym: "0xD" "D"
863143-863183 usb_power_delivery: sym: "0x0" "0"
863183-863224 usb_power_delivery: sym: "0x1" "1"
863224-863264 usb_power_delivery: sym: "0xA" "A"
862941-863264 usb_power_delivery: crc: "CRC:a10d2090" "CRC"
863264-863304 usb_power_delivery: sym: "EOP" "#"
863264-863304 usb_power_delivery: eop: "EOP" "E"
862103-863304 usb_power_delivery: text: "#21   (359.209583ms): (r2) SNK[6]: GOOD CRC" "..."
864178-864693 usb_power_delivery: preamble: "Preamble" "..."
864693-864734 usb_power_delivery: sym: "SYNC-1" "S1"
864734-864774 usb_power_delivery: sym: "SYNC-1" "S1"
864774-864814 usb_power_delivery: sym: "SYNC-1" "S1"
864814-864855 usb_power_delivery: sym: "SYNC-2" "S2"
864693-864855 usb_power_delivery: sop: "SOP" "S"
864855-864895 usb_power_delivery: sym: "0xF" "F"
864895-864935 usb_power_delivery: sym: "0x4" "4"
864935-864976 usb_power_delivery: sym: "0x4" "4"
864976-865016 usb_power_delivery: sym: "0x5" "5"
864855-865016 usb_power_delivery: header: "H:544f" "HD"
864178-867001 usb_power_delivery: snk: "(r2) SNK[2]: VDM" "VDM"
865016-865056 usb_power_delivery: sym: "0x1" "1"
865056-865097 usb_power_delivery: sym: "0x4" "4"
865097-865137 usb_power_delivery: sym: "0x0" "0"
865137-865178 usb_power_delivery: sym: "0x8" "8"
865178-865218 usb_power_delivery: sym: "0x0" "0"
865218-865258 usb_power_delivery: sym: "0x0" "0"
865258-865299 usb_power_delivery: sym: "0xF" "F"
865299-865339 usb_power_delivery: sym: "0xF" "F"
865016-865339 usb_power_delivery: data: "[0]ff008041" "D0"
865016-865339 usb_power_delivery: payload: "[1] ACK Disc Ident  SVID:ff00" "[1] ACK Disc Ident  SVID:ff00"
865339-865379 usb_power_delivery: sym: "0xC" "C"
865379-865420 usb_power_delivery: sym: "0xA" "A"
865420-865460 usb_power_delivery: sym: "0x5" "5"
865460-865500 usb_power_delivery: sym: "0x0" "0"
865500-865541 usb_power_delivery: sym: "0x0" "0"
865541-865581 usb_power_delivery: sym: "0x0" "0"
865581-865621 usb_power_delivery: sym: "0xC" "C"
865621-865662 usb_power_delivery: sym: "0x6" "6"
865339-865662 usb_power_delivery: data: "[1]6c0005ac" "D1"
865339-865662 usb_power_delivery: payload: "[2] VDO:6c0005ac" "[2] VDO:6c0005ac"
865662-865702 usb_power_delivery: sym: "0x0" "0"
865702-865742 usb_power_delivery: sym: "0x0" "0"
865742-865783 usb_power_delivery: sym: "0x0" "0"
865783-865823 usb_power_delivery: sym: "0x0" "0"
865823-865864 usb_power_delivery: sym: "0x0" "0"
865864-865904 usb_power_delivery: sym: "0x0" "0"
865904-865944 usb_power_delivery: sym: "0x0" "0"
865944-865984 usb_power_delivery: sym: "0x0" "0"
865662-865984 usb_power_delivery: data: "[2]00000000" "D2"
865662-865984 usb_power_delivery: payload: "[3] VDO:00000000" "[3] VDO:00000000"
865984-866025 usb_power_delivery: sym: "0x8" "8"
866025-866065 usb_power_delivery: sym: "0x5" "5"
866065-866105 usb_power_delivery: sym: "0x1" "1"
866105-866146 usb_power_delivery: sym: "0x0" "0"
866146-866186 usb_power_delivery: sym: "0x2" "2"
866186-866227 usb_power_delivery: sym: "0x1" "1"
866227-866267 usb_power_delivery: sym: "0x0" "0"
866267-866307 usb_power_delivery: sym: "0x1" "1"
865984-866307 usb_power_delivery: data: "[3]10120158" "D3"
865984-866307 usb_power_delivery: payload: "[4] VDO:10120158" "[4] VDO:10120158"
866307-866348 usb_power_delivery: sym: "0x9" "9"
866348-866388 usb_power_delivery: sym: "0x3" "3"
866388-866428 usb_power_delivery: sym: "0x0" "0"
866428-866469 usb_power_delivery: sym: "0x0" "0"
866469-866509 usb_power_delivery: sym: "0x0" "0"
866509-866549 usb_power_delivery: sym: "0x0" "0"
866549-866590 usb_power_delivery: sym: "0x1" "1"
866590-866630 usb_power_delivery: sym: "0x6" "6"
866307-866630 usb_power_delivery: data: "[4]61000039" "D4"
866307-866630 usb_power_delivery: payload: "[5] VDO:61000039" "[5] VDO:61000039"
866630-866670 usb_power_delivery: sym: "0x0" "0"
866670-866711 usb_power_delivery: sym: "0xD" "D"
866711-866751 usb_power_delivery: sym: "0xD" "D"
866751-866791 usb_power_delivery: sym: "0x0" "0"
866791-866832 usb_power_delivery: sym: "0x7" "7"
866832-866872 usb_power_delivery: sym: "0xC" "C"
866872-866912 usb_power_delivery: sym: "0x3" "3"
866912-866953 usb_power_delivery: sym: "0x3" "3"
866630-866953 usb_power_delivery: crc: "CRC:33c70dd0" "CRC"
866953-866993 usb_power_delivery: sym: "EOP" "#"
866953-866993 usb_power_delivery: eop: "EOP" "E"
864178-866993 usb_power_delivery: text: "#22   (360.074167ms): (r2) SNK[2]: VDM - [1] ACK Disc Ident  SVID:ff00 - [2] VDO:6c0005ac - [3] VDO:00000000 - [4] VDO:10120158 - [5] VDO:61000039" "..."
867231-867744 usb_power_delivery: preamble: "Preamble" "..."
867744-867784 usb_power_delivery: sym: "SYNC-1" "S1"
867784-867824 usb_power_delivery: sym: "SYNC-1" "S1"
867824-867864 usb_power_delivery: sym: "SYNC-1" "S1"
867864-867904 usb_power_delivery: sym: "SYNC-2" "S2"
867744-867904 usb_power_delivery: sop: "SOP" "S"
867904-867945 usb_power_delivery: sym: "0x1" "1"
867945-867985 usb_power_delivery: sym: "0x6" "6"
867985-868025 usb_power_delivery: sym: "0x5" "5"
868025-868065 usb_power_delivery: sym: "0x0" "0"
867904-868065 usb_power_delivery: header: "H:0561" "HD"
867231-868435 usb_power_delivery: src: "(r2) SRC[2]: GOOD CRC" "GOOD CRC"
868065-868105 usb_power_delivery: sym: "0x6" "6"
868105-868145 usb_power_delivery: sym: "0x9" "9"
868145-868186 usb_power_delivery: sym: "0xC" "C"
868186-868226 usb_power_delivery: sym: "0xB" "B"
868226-868266 usb_power_delivery: sym: "0x5" "5"
868266-868306 usb_power_delivery: sym: "0x5" "5"
868306-868346 usb_power_delivery: sym: "0xD" "D"
868346-868387 usb_power_delivery: sym: "0x4" "4"
868065-868387 usb_power_delivery: crc: "CRC:4d55bc96" "CRC"
868387-868427 usb_power_delivery: sym: "EOP" "#"
868387-868427 usb_power_delivery: eop: "EOP" "E"
867231-868427 usb_power_delivery: text: "#23   (361.346250ms): (r2) SRC[2]: GOOD CRC" "..."
869448-869977 usb_power_delivery: preamble: "Junk???" "XXX"
869448-869977 usb_power_delivery: warnings: "No start of packet found" "XXX"
869448-869977 usb_power_delivery: text: "#24   (362.270000ms): Junk???" "..."
870175-870473 usb_power_delivery: preamble: "Preamble" "..."
870473-870513 usb_power_delivery: sym: "SYNC-1" "S1"
870513-870553 usb_power_delivery: sym: "SYNC-1" "S1"
870553-870593 usb_power_delivery: sym: "SYNC-1" "S1"
870593-870634 usb_power_delivery: sym: "SYNC-2" "S2"
870473-870634 usb_power_delivery: sop: "SOP" "S"
870634-870674 usb_power_delivery: sym: "0x1" "1"
870674-870714 usb_power_delivery: sym: "0x6" "6"
870714-870754 usb_power_delivery: sym: "0x7" "7"
870754-870794 usb_power_delivery: sym: "0x0" "0"
870634-870794 usb_power_delivery: header: "H:0761" "HD"
870175-871164 usb_power_delivery: src: "(r2) SRC[3]: GOOD CRC" "GOOD CRC"
870794-870835 usb_power_delivery: sym: "0xA" "A"
870835-870875 usb_power_delivery: sym: "0xB" "B"
870875-870915 usb_power_delivery: sym: "0xD" "D"
870915-870955 usb_power_delivery: sym: "0xD" "D"
870955-870995 usb_power_delivery: sym: "0xB" "B"
870995-871035 usb_power_delivery: sym: "0x5" "5"
871035-871076 usb_power_delivery: sym: "0x3" "3"
871076-871116 usb_power_delivery: sym: "0xA" "A"
870794-871116 usb_power_delivery: crc: "CRC:a35bddba" "CRC"
871116-871156 usb_power_delivery: sym: "EOP" "#"
871116-871156 usb_power_delivery: eop: "EOP" "E"
870175-871156 usb_power_delivery: text: "#25   (362.572917ms): (r2) SRC[3]: GOOD CRC" "..."
872088-872600 usb_power_delivery: preamble: "Preamble" "..."
872600-872641 usb_power_delivery: sym: "SYNC-1" "S1"
872641-872681 usb_power_delivery: sym: "SYNC-1" "S1"
872681-872721 usb_power_delivery: sym: "SYNC-1" "S1"
872721-872761 usb_power_delivery: sym: "SYNC-2" "S2"
872600-872761 usb_power_delivery: sop: "SOP" "S"
872761-872801 usb_power_delivery: sym: "0xF" "F"
872801-872842 usb_power_delivery: sym: "0x6" "6"
872842-872882 usb_power_delivery: sym: "0x1" "1"
872882-872922 usb_power_delivery: sym: "0x1" "1"
872761-872922 usb_power_delivery: header: "H:116f" "HD"
872088-873613 usb_power_delivery: src: "(r2) SRC[0]: VDM" "VDM"
872922-872962 usb_power_delivery: sym: "0x3" "3"
872962-873002 usb_power_delivery: sym: "0x0" "0"
873002-873042 usb_power_delivery: sym: "0x0" "0"
873042-873083 usb_power_delivery: sym: "0x8" "8"
873083-873123 usb_power_delivery: sym: "0x1" "1"
873123-873163 usb_power_delivery: sym: "0x0" "0"
873163-873203 usb_power_delivery: sym: "0xF" "F"
873203-873243 usb_power_delivery: sym: "0xF" "F"
872922-873243 usb_power_delivery: data: "[0]ff018003" "D0"
872922-873243 usb_power_delivery: payload: "[1] REQ Disc Mode  SVID:ff01" "[1] REQ Disc Mode  SVID:ff01"
873243-873283 usb_power_delivery: sym: "0xC" "C"
873283-873324 usb_power_delivery: sym: "0xB" "B"
873324-873364 usb_power_delivery: sym: "0x8" "8"
873364-873404 usb_power_delivery: sym: "0xC" "C"
873404-873444 usb_power_delivery: sym: "0x9" "9"
873444-873484 usb_power_delivery: sym: "0x7" "7"
873484-873524 usb_power_delivery: sym: "0x2" "2"
873524-873565 usb_power_delivery: sym: "0xD" "D"
873243-873565 usb_power_delivery: crc: "CRC:d279c8bc" "CRC"
873565-873605 usb_power_delivery: sym: "EOP" "#"
873565-873605 usb_power_delivery: eop: "EOP" "E"
872088-873605 usb_power_delivery: text: "#26   (363.370000ms): (r2) SRC[0]: VDM - [1] REQ Disc Mode  SVID:ff01" "..."
874437-874470 usb_power_delivery: preamble: "Preamble" "..."
874470-874510 usb_power_delivery: sym: "SYNC-1" "S1"
874510-874550 usb_power_delivery: sym: "SYNC-1" "S1"
874550-874591 usb_power_delivery: sym: "SYNC-1" "S1"
874591-874631 usb_power_delivery: sym: "SYNC-2" "S2"
874470-874631 usb_power_delivery: sop: "SOP" "S"
874631-874671 usb_power_delivery: sym: "0xF" "F"
874671-874712 usb_power_delivery: sym: "0x4" "4"
874712-874752 usb_power_delivery: sym: "0x6" "6"
874752-874792 usb_power_delivery: sym: "0x3" "3"
874631-874792 usb_power_delivery: header: "H:364f" "HD"
874437-876132 usb_power_delivery: snk: "(r2) SNK[3]: VDM" "VDM"
874792-874833 usb_power_delivery: sym: "0x2" "2"
874833-874873 usb_power_delivery: sym: "0x4" "4"
874873-874913 usb_power_delivery: sym: "0x0" "0"
874913-874954 usb_power_delivery: sym: "0x8" "8"
874954-874994 usb_power_delivery: sym: "0x0" "0"
874994-875034 usb_power_delivery: sym: "0x0" "0"
875034-875075 usb_power_delivery: sym: "0xF" "F"
875075-875115 usb_power_delivery: sym: "0xF" "F"
874792-875115 usb_power_delivery: data: "[0]ff008042" "D0"
874792-875115 usb_power_delivery: payload: "[1] ACK Disc SVID  SVID:ff00" "[1] ACK Disc SVID  SVID:ff00"
875115-875155 usb_power_delivery: sym: "0xC" "C"
875155-875196 usb_power_delivery: sym: "0xA" "A"
875196-875236 usb_power_delivery: sym: "0x5" "5"
875236-875277 usb_power_delivery: sym: "0x0" "0"
875277-875317 usb_power_delivery: sym: "0x1" "1"
875317-875357 usb_power_delivery: sym: "0x0" "0"
875357-875398 usb_power_delivery: sym: "0xF" "F"
875398-875438 usb_power_delivery: sym: "0xF" "F"
875115-875438 usb_power_delivery: data: "[1]ff0105ac" "D1"
875115-875438 usb_power_delivery: payload: "[2] VDO:ff0105ac" "[2] VDO:ff0105ac"
875438-875478 usb_power_delivery: sym: "0x0" "0"
875478-875519 usb_power_delivery: sym: "0x0" "0"
875519-875559 usb_power_delivery: sym: "0x0" "0"
875559-875600 usb_power_delivery: sym: "0x0" "0"
875600-875640 usb_power_delivery: sym: "0x0" "0"
875640-875680 usb_power_delivery: sym: "0x0" "0"
875680-875720 usb_power_delivery: sym: "0x0" "0"
875720-875761 usb_power_delivery: sym: "0x0" "0"
875438-875761 usb_power_delivery: data: "[2]00000000" "D2"
875438-875761 usb_power_delivery: payload: "[3] VDO:00000000" "[3] VDO:00000000"
875761-875801 usb_power_delivery: sym: "0x4" "4"
875801-875841 usb_power_delivery: sym: "0xC" "C"
875841-875882 usb_power_delivery: sym: "0x1" "1"
875882-875922 usb_power_delivery: sym: "0xD" "D"
875922-875963 usb_power_delivery: sym: "0xE" "E"
875963-876003 usb_power_delivery: sym: "0x1" "1"
876003-876043 usb_power_delivery: sym: "0xD" "D"
876043-876084 usb_power_delivery: sym: "0x2" "2"
875761-876084 usb_power_delivery: crc: "CRC:2d1ed1c4" "CRC"
876084-876124 usb_power_delivery: sym: "EOP" "#"
876084-876124 usb_power_delivery: eop: "EOP" "E"
874437-876124 usb_power_delivery: text: "#27   (364.348750ms): (r2) SNK[3]: VDM - [1] ACK Disc SVID  SVID:ff00 - [2] VDO:ff0105ac - [3] VDO:00000000" "..."
876696-876696 usb_power_delivery: preamble: "Preamble" "..."
876696-876737 usb_power_delivery: sym: "SYNC-1" "S1"
876737-876777 usb_power_delivery: sym: "SYNC-1" "S1"
876777-876817 usb_power_delivery: sym: "SYNC-1" "S1"
876817-876857 usb_power_delivery: sym: "SYNC-2" "S2"
876696-876857 usb_power_delivery: sop: "SOP" "S"
876857-876897 usb_power_delivery: sym: "0xF" "F"
876897-876938 usb_power_delivery: sym: "0x6" "6"
876938-876978 usb_power_delivery: sym: "0x1" "1"
876978-877018 usb_power_delivery: sym: "0x1" "1"
876857-877018 usb_power_delivery: header: "H:116f" "HD"
876696-877709 usb_power_delivery: src: "(r2) SRC[0]: VDM" "VDM"
877018-877058 usb_power_delivery: sym: "0x3" "3"
877058-877098 usb_power_delivery: sym: "0x0" "0"
877098-877138 usb_power_delivery: sym: "0x0" "0"
877138-877179 usb_power_delivery: sym: "0x8" "8"
877179-877219 usb_power_delivery: sym: "0x1" "1"
877219-877259 usb_power_delivery: sym: "0x0" "0"
877259-877299 usb_power_delivery: sym: "0xF" "F"
877299-877339 usb_power_delivery: sym: "0xF" "F"
877018-877339 usb_power_delivery: data: "[0]ff018003" "D0"
877018-877339 usb_power_delivery: payload: "[1] REQ Disc Mode  SVID:ff01" "[1] REQ Disc Mode  SVID:ff01"
877339-877379 usb_power_delivery: sym: "0xC" "C"
877379-877420 usb_power_delivery: sym: "0xB" "B"
877420-877460 usb_power_delivery: sym: "0x8" "8"
877460-877500 usb_power_delivery: sym: "0xC" "C"
877500-877540 usb_power_delivery: sym: "0x9" "9"
877540-877580 usb_power_delivery: sym: "0x7" "7"
877580-877620 usb_power_delivery: sym: "0x2" "2"
877620-877661 usb_power_delivery: sym: "0xD" "D"
877339-877661 usb_power_delivery: crc: "CRC:d279c8bc" "CRC"
877661-877701 usb_power_delivery: sym: "EOP" "#"
877661-877701 usb_power_delivery: eop: "EOP" "E"
876696-877701 usb_power_delivery: text: "#28   (365.290000ms): (r2) SRC[0]: VDM - [1] REQ Disc Mode  SVID:ff01" "..."
877974-878489 usb_power_delivery: preamble: "Preamble" "..."
878489-878529 usb_power_delivery: sym: "SYNC-1" "S1"
878529-878569 usb_power_delivery: sym: "SYNC-1" "S1"
878569-878610 usb_power_delivery: sym: "SYNC-1" "S1"
878610-878650 usb_power_delivery: sym: "SYNC-2" "S2"
878489-878650 usb_power_delivery: sop: "SOP" "S"
878650-878691 usb_power_delivery: sym: "0x1" "1"
878691-878731 usb_power_delivery: sym: "0x4" "4"
878731-878771 usb_power_delivery: sym: "0x0" "0"
878771-878812 usb_power_delivery: sym: "0x0" "0"
878650-878812 usb_power_delivery: header: "H:0041" "HD"
877974-879183 usb_power_delivery: snk: "(r2) SNK[0]: GOOD CRC" "GOOD CRC"
878812-878852 usb_power_delivery: sym: "0xB" "B"
878852-878892 usb_power_delivery: sym: "0xB" "B"
878892-878933 usb_power_delivery: sym: "0xC" "C"
878933-878973 usb_power_delivery: sym: "0x6" "6"
878973-879013 usb_power_delivery: sym: "0xB" "B"
879013-879054 usb_power_delivery: sym: "0xB" "B"
879054-879094 usb_power_delivery: sym: "0x8" "8"
879094-879134 usb_power_delivery: sym: "0xA" "A"
878812-879134 usb_power_delivery: crc: "CRC:a8bb6cbb" "CRC"
879134-879175 usb_power_delivery: sym: "EOP" "#"
879134-879175 usb_power_delivery: eop: "EOP" "E"
877974-879175 usb_power_delivery: text: "#29   (365.822500ms): (r2) SNK[0]: GOOD CRC" "..."
880167-880682 usb_power_delivery: preamble: "Preamble" "..."
880682-880723 usb_power_delivery: sym: "SYNC-1" "S1"
880723-880763 usb_power_delivery: sym: "SYNC-1" "S1"
880763-880803 usb_power_delivery: sym: "SYNC-1" "S1"
880803-880844 usb_power_delivery: sym: "SYNC-2" "S2"
880682-880844 usb_power_delivery: sop: "SOP" "S"
880844-880884 usb_power_delivery: sym: "0xF" "F"
880884-880924 usb_power_delivery: sym: "0x4" "4"
880924-880965 usb_power_delivery: sym: "0x8" "8"
880965-881005 usb_power_delivery: sym: "0x2" "2"
880844-881005 usb_power_delivery: header: "H:284f" "HD"
880167-882014 usb_power_delivery: snk: "(r2) SNK[4]: VDM" "VDM"
881005-881045 usb_power_delivery: sym: "0x3" "3"
881045-881086 usb_power_delivery: sym: "0x4" "4"
881086-881126 usb_power_delivery: sym: "0x0" "0"
881126-881166 usb_power_delivery: sym: "0x8" "8"
881166-881207 usb_power_delivery: sym: "0x1" "1"
881207-881247 usb_power_delivery: sym: "0x0" "0"
881247-881287 usb_power_delivery: sym: "0xF" "F"
881287-881328 usb_power_delivery: sym: "0xF" "F"
881005-881328 usb_power_delivery: data: "[0]ff018043" "D0"
881005-881328 usb_power_delivery: payload: "[1] ACK Disc Mode  SVID:ff01" "[1] ACK Disc Mode  SVID:ff01"
881328-881368 usb_power_delivery: sym: "0x5" "5"
881368-881408 usb_power_delivery: sym: "0x0" "0"
881408-881449 usb_power_delivery: sym: "0xC" "C"
881449-881489 usb_power_delivery: sym: "0x0" "0"
881489-881529 usb_power_delivery: sym: "0x0" "0"
881529-881570 usb_power_delivery: sym: "0x0" "0"
881570-881610 usb_power_delivery: sym: "0x0" "0"
881610-881651 usb_power_delivery: sym: "0x0" "0"
881328-881651 usb_power_delivery: data: "[1]00000c05" "D1"
881328-881651 usb_power_delivery: payload: "[2] VDO:00000c05" "[2] VDO:00000c05"
881651-881691 usb_power_delivery: sym: "0x3" "3"
881691-881731 usb_power_delivery: sym: "0x6" "6"
881731-881772 usb_power_delivery: sym: "0x6" "6"
881772-881812 usb_power_delivery: sym: "0x2" "2"
881812-881852 usb_power_delivery: sym: "0xA" "A"
881852-881892 usb_power_delivery: sym: "0xE" "E"
881892-881933 usb_power_delivery: sym: "0x5" "5"
881933-881973 usb_power_delivery: sym: "0xA" "A"
881651-881973 usb_power_delivery: crc: "CRC:a5ea2663" "CRC"
881973-882014 usb_power_delivery: sym: "EOP" "#"
881973-882014 usb_power_delivery: eop: "EOP" "E"
880167-882014 usb_power_delivery: text: "#30   (366.736250ms): (r2) SNK[4]: VDM - [1] ACK Disc Mode  SVID:ff01 - [2] VDO:00000c05" "..."
882242-882754 usb_power_delivery: preamble: "Preamble" "..."
882754-882795 usb_power_delivery: sym: "SYNC-1" "S1"
882795-882835 usb_power_delivery: sym: "SYNC-1" "S1"
882835-882875 usb_power_delivery: sym: "SYNC-1" "S1"
882875-882915 usb_power_delivery: sym: "SYNC-2" "S2"
882754-882915 usb_power_delivery: sop: "SOP" "S"
882915-882955 usb_power_delivery: sym: "0x1" "1"
882955-882995 usb_power_delivery: sym: "0x6" "6"
882995-883036 usb_power_delivery: sym: "0x9" "9"
883036-883076 usb_power_delivery: sym: "0x0" "0"
882915-883076 usb_power_delivery: header: "H:0961" "HD"
882242-883437 usb_power_delivery: src: "(r2) SRC[4]: GOOD CRC" "GOOD CRC"
883076-883116 usb_power_delivery: sym: "0xD" "D"
883116-883156 usb_power_delivery: sym: "0xB" "B"
883156-883196 usb_power_delivery: sym: "0x0" "0"
883196-883236 usb_power_delivery: sym: "0xF" "F"
883236-883277 usb_power_delivery: sym: "0x3" "3"
883277-883317 usb_power_delivery: sym: "0xE" "E"
883317-883357 usb_power_delivery: sym: "0x4" "4"
883357-883397 usb_power_delivery: sym: "0x4" "4"
883076-883397 usb_power_delivery: crc: "CRC:44e3f0bd" "CRC"
883397-883437 usb_power_delivery: sym: "EOP" "#"
883397-883437 usb_power_delivery: eop: "EOP" "E"
882242-883437 usb_power_delivery: text: "#31   (367.600833ms): (r2) SRC[4]: GOOD CRC" "..."
884062-884574 usb_power_delivery: preamble: "Preamble" "..."
884574-884615 usb_power_delivery: sym: "SYNC-1" "S1"
884615-884655 usb_power_delivery: sym: "SYNC-1" "S1"
884655-884695 usb_power_delivery: sym: "SYNC-1" "S1"
884695-884735 usb_power_delivery: sym: "SYNC-2" "S2"
884574-884735 usb_power_delivery: sop: "SOP" "S"
884735-884775 usb_power_delivery: sym: "0xF" "F"
884775-884815 usb_power_delivery: sym: "0x6" "6"
884815-884856 usb_power_delivery: sym: "0x3" "3"
884856-884896 usb_power_delivery: sym: "0x1" "1"
884735-884896 usb_power_delivery: header: "H:136f" "HD"
884062-885579 usb_power_delivery: src: "(r2) SRC[1]: VDM" "VDM"
884896-884936 usb_power_delivery: sym: "0x4" "4"
884936-884976 usb_power_delivery: sym: "0x0" "0"
884976-885016 usb_power_delivery: sym: "0x1" "1"
885016-885056 usb_power_delivery: sym: "0x8" "8"
885056-885097 usb_power_delivery: sym: "0x1" "1"
885097-885137 usb_power_delivery: sym: "0x0" "0"
885137-885177 usb_power_delivery: sym: "0xF" "F"
885177-885217 usb_power_delivery: sym: "0xF" "F"
884896-885217 usb_power_delivery: data: "[0]ff018104" "D0"
884896-885217 usb_power_delivery: payload: "[1] REQ Enter Mode pos 1 SVID:ff01" "[1] REQ Enter Mode pos 1 SVID:ff01"
885217-885257 usb_power_delivery: sym: "0x2" "2"
885257-885298 usb_power_delivery: sym: "0x5" "5"
885298-885338 usb_power_delivery: sym: "0x9" "9"
885338-885378 usb_power_delivery: sym: "0xC" "C"
885378-885418 usb_power_delivery: sym: "0xC" "C"
885418-885458 usb_power_delivery: sym: "0xA" "A"
885458-885498 usb_power_delivery: sym: "0x4" "4"
885498-885539 usb_power_delivery: sym: "0x3" "3"
885217-885539 usb_power_delivery: crc: "CRC:34acc952" "CRC"
885539-885579 usb_power_delivery: sym: "EOP" "#"
885539-885579 usb_power_delivery: eop: "EOP" "E"
884062-885579 usb_power_delivery: text: "#32   (368.359167ms): (r2) SRC[1]: VDM - [1] REQ Enter Mode pos 1 SVID:ff01" "..."
885809-886324 usb_power_delivery: preamble: "Preamble" "..."
886324-886365 usb_power_delivery: sym: "SYNC-1" "S1"
886365-886405 usb_power_delivery: sym: "SYNC-1" "S1"
886405-886445 usb_power_delivery: sym: "SYNC-1" "S1"
886445-886485 usb_power_delivery: sym: "SYNC-2" "S2"
886324-886485 usb_power_delivery: sop: "SOP" "S"
886485-886526 usb_power_delivery: sym: "0x1" "1"
886526-886566 usb_power_delivery: sym: "0x4" "4"
886566-886607 usb_power_delivery: sym: "0x2" "2"
886607-886647 usb_power_delivery: sym: "0x0" "0"
886485-886647 usb_power_delivery: header: "H:0241" "HD"
885809-887018 usb_power_delivery: snk: "(r2) SNK[1]: GOOD CRC" "GOOD CRC"
886647-886687 usb_power_delivery: sym: "0x7" "7"
886687-886728 usb_power_delivery: sym: "0x9" "9"
886728-886768 usb_power_delivery: sym: "0xD" "D"
886768-886808 usb_power_delivery: sym: "0x0" "0"
886808-886849 usb_power_delivery: sym: "0x5" "5"
886849-886889 usb_power_delivery: sym: "0xB" "B"
886889-886929 usb_power_delivery: sym: "0x6" "6"
886929-886970 usb_power_delivery: sym: "0x4" "4"
886647-886970 usb_power_delivery: crc: "CRC:46b50d97" "CRC"
886970-887010 usb_power_delivery: sym: "EOP" "#"
886970-887010 usb_power_delivery: eop: "EOP" "E"
885809-887010 usb_power_delivery: text: "#33   (369.087083ms): (r2) SNK[1]: GOOD CRC" "..."
887613-888128 usb_power_delivery: preamble: "Preamble" "..."
888128-888169 usb_power_delivery: sym: "SYNC-1" "S1"
888169-888209 usb_power_delivery: sym: "SYNC-1" "S1"
888209-888249 usb_power_delivery: sym: "SYNC-1" "S1"
888249-888290 usb_power_delivery: sym: "SYNC-2" "S2"
888128-888290 usb_power_delivery: sop: "SOP" "S"
888290-888330 usb_power_delivery: sym: "0xF" "F"
888330-888370 usb_power_delivery: sym: "0x4" "4"
888370-888411 usb_power_delivery: sym: "0xA" "A"
888411-888451 usb_power_delivery: sym: "0x1" "1"
888290-888451 usb_power_delivery: header: "H:1a4f" "HD"
887613-889137 usb_power_delivery: snk: "(r2) SNK[5]: VDM" "VDM"
888451-888491 usb_power_delivery: sym: "0x4" "4"
888491-888532 usb_power_delivery: sym: "0x4" "4"
888532-888572 usb_power_delivery: sym: "0x1" "1"
888572-888613 usb_power_delivery: sym: "0x8" "8"
888613-888653 usb_power_delivery: sym: "0x1" "1"
888653-888693 usb_power_delivery: sym: "0x0" "0"
888693-888733 usb_power_delivery: sym: "0xF" "F"
888733-888774 usb_power_delivery: sym: "0xF" "F"
888451-888774 usb_power_delivery: data: "[0]ff018144" "D0"
888451-888774 usb_power_delivery: payload: "[1] ACK Enter Mode pos 1 SVID:ff01" "[1] ACK Enter Mode pos 1 SVID:ff01"
888774-888814 usb_power_delivery: sym: "0x8" "8"
888814-888855 usb_power_delivery: sym: "0x2" "2"
888855-888895 usb_power_delivery: sym: "0x6" "6"
888895-888935 usb_power_delivery: sym: "0xF" "F"
888935-888976 usb_power_delivery: sym: "0x4" "4"
888976-889016 usb_power_delivery: sym: "0x0" "0"
889016-889056 usb_power_delivery: sym: "0x5" "5"
889056-889097 usb_power_delivery: sym: "0xA" "A"
888774-889097 usb_power_delivery: crc: "CRC:a504f628" "CRC"
889097-889137 usb_power_delivery: sym: "EOP" "#"
889097-889137 usb_power_delivery: eop: "EOP" "E"
887613-889137 usb_power_delivery: text: "#34   (369.838750ms): (r2) SNK[5]: VDM - [1] ACK Enter Mode pos 1 SVID:ff01" "..."
889366-889879 usb_power_delivery: preamble: "Preamble" "..."
889879-889919 usb_power_delivery: sym: "SYNC-1" "S1"
889919-889959 usb_power_delivery: sym: "SYNC-1" "S1"
889959-890000 usb_power_delivery: sym: "SYNC-1" "S1"
890000-890040 usb_power_delivery: sym: "SYNC-2" "S2"
889879-890040 usb_power_delivery: sop: "SOP" "S"
890040-890080 usb_power_delivery: sym: "0x1" "1"
890080-890120 usb_power_delivery: sym: "0x6" "6"
890120-890160 usb_power_delivery: sym: "0xB" "B"
890160-890201 usb_power_delivery: sym: "0x0" "0"
890040-890201 usb_power_delivery: header: "H:0b61" "HD"
889366-890562 usb_power_delivery: src: "(r2) SRC[5]: GOOD CRC" "GOOD CRC"
890201-890241 usb_power_delivery: sym: "0x1" "1"
890241-890281 usb_power_delivery: sym: "0x9" "9"
890281-890321 usb_power_delivery: sym: "0x1" "1"
890321-890361 usb_power_delivery: sym: "0x9" "9"
890361-890401 usb_power_delivery: sym: "0xD" "D"
890401-890441 usb_power_delivery: sym: "0xE" "E"
890441-890482 usb_power_delivery: sym: "0xA" "A"
890482-890522 usb_power_delivery: sym: "0xA" "A"
890201-890522 usb_power_delivery: crc: "CRC:aaed9191" "CRC"
890522-890562 usb_power_delivery: sym: "EOP" "#"
890522-890562 usb_power_delivery: eop: "EOP" "E"
889366-890562 usb_power_delivery: text: "#35   (370.569167ms): (r2) SRC[5]: GOOD CRC" "..."
891150-891663 usb_power_delivery: preamble: "Preamble" "..."
891663-891703 usb_power_delivery: sym: "SYNC-1" "S1"
891703-891743 usb_power_delivery: sym: "SYNC-1" "S1"
891743-891783 usb_power_delivery: sym: "SYNC-1" "S1"
891783-891823 usb_power_delivery: sym: "SYNC-2" "S2"
891663-891823 usb_power_delivery: sop: "SOP" "S"
891823-891864 usb_power_delivery: sym: "0xF" "F"
891864-891904 usb_power_delivery: sym: "0x6" "6"
891904-891944 usb_power_delivery: sym: "0x5" "5"
891944-891984 usb_power_delivery: sym: "0x2" "2"
891823-891984 usb_power_delivery: header: "H:256f" "HD"
891150-892988 usb_power_delivery: src: "(r2) SRC[2]: VDM" "VDM"
891984-892024 usb_power_delivery: sym: "0x0" "0"
892024-892064 usb_power_delivery: sym: "0x1" "1"
892064-892105 usb_power_delivery: sym: "0x1" "1"
892105-892145 usb_power_delivery: sym: "0x8" "8"
892145-892185 usb_power_delivery: sym: "0x1" "1"
892185-892225 usb_power_delivery: sym: "0x0" "0"
892225-892265 usb_power_delivery: sym: "0xF" "F"
892265-892305 usb_power_delivery: sym: "0xF" "F"
891984-892305 usb_power_delivery: data: "[0]ff018110" "D0"
891984-892305 usb_power_delivery: payload: "[1] REQ DP Status pos 1 SVID:ff01" "[1] REQ DP Status pos 1 SVID:ff01"
892305-892346 usb_power_delivery: sym: "0x1" "1"
892346-892386 usb_power_delivery: sym: "0x0" "0"
892386-892426 usb_power_delivery: sym: "0x0" "0"
892426-892466 usb_power_delivery: sym: "0x0" "0"
892466-892506 usb_power_delivery: sym: "0x0" "0"
892506-892547 usb_power_delivery: sym: "0x0" "0"
892547-892587 usb_power_delivery: sym: "0x0" "0"
892587-892627 usb_power_delivery: sym: "0x0" "0"
892305-892627 usb_power_delivery: data: "[1]00000001" "D1"
892305-892627 usb_power_delivery: payload: "[2] VDO:00000001" "[2] VDO:00000001"
892627-892667 usb_power_delivery: sym: "0x6" "6"
892667-892707 usb_power_delivery: sym: "0x4" "4"
892707-892748 usb_power_delivery: sym: "0x3" "3"
892748-892788 usb_power_delivery: sym: "0x5" "5"
892788-892828 usb_power_delivery: sym: "0xE" "E"
892828-892868 usb_power_delivery: sym: "0x5" "5"
892868-892908 usb_power_delivery: sym: "0x0" "0"
892908-892948 usb_power_delivery: sym: "0xE" "E"
892627-892948 usb_power_delivery: crc: "CRC:e05e5346" "CRC"
892948-892988 usb_power_delivery: sym: "EOP" "#"
892948-892988 usb_power_delivery: eop: "EOP" "E"
891150-892988 usb_power_delivery: text: "#36   (371.312500ms): (r2) SRC[2]: VDM - [1] REQ DP Status pos 1 SVID:ff01 - [2] VDO:00000001" "..."
893235-893749 usb_power_delivery: preamble: "Preamble" "..."
893749-893790 usb_power_delivery: sym: "SYNC-1" "S1"
893790-893830 usb_power_delivery: sym: "SYNC-1" "S1"
893830-893871 usb_power_delivery: sym: "SYNC-1" "S1"
893871-893911 usb_power_delivery: sym: "SYNC-2" "S2"
893749-893911 usb_power_delivery: sop: "SOP" "S"
893911-893951 usb_power_delivery: sym: "0x1" "1"
893951-893992 usb_power_delivery: sym: "0x4" "4"
893992-894032 usb_power_delivery: sym: "0x4" "4"
894032-894072 usb_power_delivery: sym: "0x0" "0"
893911-894072 usb_power_delivery: header: "H:0441" "HD"
893235-894435 usb_power_delivery: snk: "(r2) SNK[2]: GOOD CRC" "GOOD CRC"
894072-894113 usb_power_delivery: sym: "0x2" "2"
894113-894153 usb_power_delivery: sym: "0xA" "A"
894153-894193 usb_power_delivery: sym: "0x8" "8"
894193-894234 usb_power_delivery: sym: "0xA" "A"
894234-894274 usb_power_delivery: sym: "0x6" "6"
894274-894315 usb_power_delivery: sym: "0xD" "D"
894315-894355 usb_power_delivery: sym: "0xF" "F"
894355-894395 usb_power_delivery: sym: "0xA" "A"
894072-894395 usb_power_delivery: crc: "CRC:afd6a8a2" "CRC"
894395-894435 usb_power_delivery: sym: "EOP" "#"
894395-894435 usb_power_delivery: eop: "EOP" "E"
893235-894435 usb_power_delivery: text: "#37   (372.181250ms): (r2) SNK[2]: GOOD CRC" "..."
895103-895618 usb_power_delivery: preamble: "Preamble" "..."
895618-895659 usb_power_delivery: sym: "SYNC-1" "S1"
895659-895699 usb_power_delivery: sym: "SYNC-1" "S1"
895699-895739 usb_power_delivery: sym: "SYNC-1" "S1"
895739-895780 usb_power_delivery: sym: "SYNC-2" "S2"
895618-895780 usb_power_delivery: sop: "SOP" "S"
895780-895820 usb_power_delivery: sym: "0xF" "F"
895820-895860 usb_power_delivery: sym: "0x4" "4"
895860-895901 usb_power_delivery: sym: "0xC" "C"
895901-895941 usb_power_delivery: sym: "0x2" "2"
895780-895941 usb_power_delivery: header: "H:2c4f" "HD"
895103-896950 usb_power_delivery: snk: "(r2) SNK[6]: VDM" "VDM"
895941-895981 usb_power_delivery: sym: "0x0" "0"
895981-896022 usb_power_delivery: sym: "0x5" "5"
896022-896062 usb_power_delivery: sym: "0x1" "1"
896062-896102 usb_power_delivery: sym: "0x8" "8"
896102-896143 usb_power_delivery: sym: "0x1" "1"
896143-896183 usb_power_delivery: sym: "0x0" "0"
896183-896224 usb_power_delivery: sym: "0xF" "F"
896224-896264 usb_power_delivery: sym: "0xF" "F"
895941-896264 usb_power_delivery: data: "[0]ff018150" "D0"
895941-896264 usb_power_delivery: payload: "[1] ACK DP Status pos 1 SVID:ff01" "[1] ACK DP Status pos 1 SVID:ff01"
896264-896304 usb_power_delivery: sym: "0xA" "A"
896304-896345 usb_power_delivery: sym: "0x1" "1"
896345-896385 usb_power_delivery: sym: "0x0" "0"
896385-896425 usb_power_delivery: sym: "0x0" "0"
896425-896466 usb_power_delivery: sym: "0x0" "0"
896466-896506 usb_power_delivery: sym: "0x0" "0"
896506-896546 usb_power_delivery: sym: "0x0" "0"
896546-896587 usb_power_delivery: sym: "0x0" "0"
896264-896587 usb_power_delivery: data: "[1]0000001a" "D1"
896264-896587 usb_power_delivery: payload: "[2] VDO:0000001a" "[2] VDO:0000001a"
896587-896627 usb_power_delivery: sym: "0xE" "E"
896627-896667 usb_power_delivery: sym: "0xB" "B"
896667-896708 usb_power_delivery: sym: "0x4" "4"
896708-896748 usb_power_delivery: sym: "0xF" "F"
896748-896789 usb_power_delivery: sym: "0x5" "5"
896789-896829 usb_power_delivery: sym: "0x2" "2"
896829-896869 usb_power_delivery: sym: "0xD" "D"
896869-896910 usb_power_delivery: sym: "0xA" "A"
896587-896910 usb_power_delivery: crc: "CRC:ad25f4be" "CRC"
896910-896950 usb_power_delivery: sym: "EOP" "#"
896910-896950 usb_power_delivery: eop: "EOP" "E"
895103-896950 usb_power_delivery: text: "#38   (372.959583ms): (r2) SNK[6]: VDM - [1] ACK DP Status pos 1 SVID:ff01 - [2] VDO:0000001a" "..."
897178-897691 usb_power_delivery: preamble: "Preamble" "..."
897691-897731 usb_power_delivery: sym: "SYNC-1" "S1"
897731-897771 usb_power_delivery: sym: "SYNC-1" "S1"
897771-897811 usb_power_delivery: sym: "SYNC-1" "S1"
897811-897851 usb_power_delivery: sym: "SYNC-2" "S2"
897691-897851 usb_power_delivery: sop: "SOP" "S"
897851-897892 usb_power_delivery: sym: "0x1" "1"
897892-897932 usb_power_delivery: sym: "0x6" "6"
897932-897972 usb_power_delivery: sym: "0xD" "D"
897972-898012 usb_power_delivery: sym: "0x0" "0"
897851-898012 usb_power_delivery: header: "H:0d61" "HD"
897178-898382 usb_power_delivery: src: "(r2) SRC[6]: GOOD CRC" "GOOD CRC"
898012-898052 usb_power_delivery: sym: "0x4" "4"
898052-898092 usb_power_delivery: sym: "0xA" "A"
898092-898133 usb_power_delivery: sym: "0x4" "4"
898133-898173 usb_power_delivery: sym: "0x3" "3"
898173-898213 usb_power_delivery: sym: "0xE" "E"
898213-898253 usb_power_delivery: sym: "0x8" "8"
898253-898293 usb_power_delivery: sym: "0x3" "3"
898293-898334 usb_power_delivery: sym: "0x4" "4"
898012-898334 usb_power_delivery: crc: "CRC:438e34a4" "CRC"
898334-898374 usb_power_delivery: sym: "EOP" "#"
898334-898374 usb_power_delivery: eop: "EOP" "E"
897178-898374 usb_power_delivery: text: "#39   (373.824167ms): (r2) SRC[6]: GOOD CRC" "..."
909163-909675 usb_power_delivery: preamble: "Preamble" "..."
909675-909716 usb_power_delivery: sym: "SYNC-1" "S1"
909716-909756 usb_power_delivery: sym: "SYNC-1" "S1"
909756-909796 usb_power_delivery: sym: "SYNC-1" "S1"
909796-909836 usb_power_delivery: sym: "SYNC-2" "S2"
909675-909836 usb_power_delivery: sop: "SOP" "S"
909836-909876 usb_power_delivery: sym: "0xF" "F"
909876-909916 usb_power_delivery: sym: "0x6" "6"
909916-909957 usb_power_delivery: sym: "0x7" "7"
909957-909997 usb_power_delivery: sym: "0x2" "2"
909836-909997 usb_power_delivery: header: "H:276f" "HD"
909163-911001 usb_power_delivery: src: "(r2) SRC[3]: VDM" "VDM"
909997-910037 usb_power_delivery: sym: "0x1" "1"
910037-910077 usb_power_delivery: sym: "0x1" "1"
910077-910117 usb_power_delivery: sym: "0x1" "1"
910117-910157 usb_power_delivery: sym: "0x8" "8"
910157-910198 usb_power_delivery: sym: "0x1" "1"
910198-910238 usb_power_delivery: sym: "0x0" "0"
910238-910278 usb_power_delivery: sym: "0xF" "F"
910278-910318 usb_power_delivery: sym: "0xF" "F"
909997-910318 usb_power_delivery: data: "[0]ff018111" "D0"
909997-910318 usb_power_delivery: payload: "[1] REQ DP Configure pos 1 SVID:ff01" "[1] REQ DP Configure pos 1 SVID:ff01"
910318-910358 usb_power_delivery: sym: "0x6" "6"
910358-910399 usb_power_delivery: sym: "0x0" "0"
910399-910439 usb_power_delivery: sym: "0x8" "8"
910439-910479 usb_power_delivery: sym: "0x0" "0"
910479-910519 usb_power_delivery: sym: "0x0" "0"
910519-910559 usb_power_delivery: sym: "0x0" "0"
910559-910600 usb_power_delivery: sym: "0x0" "0"
910600-910640 usb_power_delivery: sym: "0x0" "0"
910318-910640 usb_power_delivery: data: "[1]00000806" "D1"
910318-910640 usb_power_delivery: payload: "[2] VDO:00000806" "[2] VDO:00000806"
910640-910680 usb_power_delivery: sym: "0xF" "F"
910680-910720 usb_power_delivery: sym: "0x5" "5"
910720-910760 usb_power_delivery: sym: "0x2" "2"
910760-910800 usb_power_delivery: sym: "0x1" "1"
910800-910841 usb_power_delivery: sym: "0x6" "6"
910841-910881 usb_power_delivery: sym: "0xC" "C"
910881-910921 usb_power_delivery: sym: "0x1" "1"
910921-910961 usb_power_delivery: sym: "0x9" "9"
910640-910961 usb_power_delivery: crc: "CRC:91c6125f" "CRC"
910961-911001 usb_power_delivery: sym: "EOP" "#"
910961-911001 usb_power_delivery: eop: "EOP" "E"
909163-911001 usb_power_delivery: text: "#40   (378.817917ms): (r2) SRC[3]: VDM - [1] REQ DP Configure pos 1 SVID:ff01 - [2] VDO:00000806" "..."
911232-911747 usb_power_delivery: preamble: "Preamble" "..."
911747-911787 usb_power_delivery: sym: "SYNC-1" "S1"
911787-911827 usb_power_delivery: sym: "SYNC-1" "S1"
911827-911868 usb_power_delivery: sym: "SYNC-1" "S1"
911868-911908 usb_power_delivery: sym: "SYNC-2" "S2"
911747-911908 usb_power_delivery: sop: "SOP" "S"
911908-911949 usb_power_delivery: sym: "0x1" "1"
911949-911989 usb_power_delivery: sym: "0x4" "4"
911989-912029 usb_power_delivery: sym: "0x6" "6"
912029-912070 usb_power_delivery: sym: "0x0" "0"
911908-912070 usb_power_delivery: header: "H:0641" "HD"
911232-912433 usb_power_delivery: snk: "(r2) SNK[3]: GOOD CRC" "GOOD CRC"
912070-912110 usb_power_delivery: sym: "0xE" "E"
912110-912150 usb_power_delivery: sym: "0x8" "8"
912150-912191 usb_power_delivery: sym: "0x9" "9"
912191-912231 usb_power_delivery: sym: "0xC" "C"
912231-912272 usb_power_delivery: sym: "0x8" "8"
912272-912312 usb_power_delivery: sym: "0xD" "D"
912312-912352 usb_power_delivery: sym: "0x1" "1"
912352-912392 usb_power_delivery: sym: "0x4" "4"
912070-912392 usb_power_delivery: crc: "CRC:41d8c98e" "CRC"
912392-912433 usb_power_delivery: sym: "EOP" "#"
912392-912433 usb_power_delivery: eop: "EOP" "E"
911232-912433 usb_power_delivery: text: "#41   (379.680000ms): (r2) SNK[3]: GOOD CRC" "..."
913247-913762 usb_power_delivery: preamble: "Preamble" "..."
913762-913803 usb_power_delivery: sym: "SYNC-1" "S1"
913803-913843 usb_power_delivery: sym: "SYNC-1" "S1"
913843-913883 usb_power_delivery: sym: "SYNC-1" "S1"
913883-913923 usb_power_delivery: sym: "SYNC-2" "S2"
913762-913923 usb_power_delivery: sop: "SOP" "S"
913923-913964 usb_power_delivery: sym: "0xF" "F"
913964-914004 usb_power_delivery: sym: "0x4" "4"
914004-914044 usb_power_delivery: sym: "0xE" "E"
914044-914085 usb_power_delivery: sym: "0x1" "1"
913923-914085 usb_power_delivery: header: "H:1e4f" "HD"
913247-914779 usb_power_delivery: snk: "(r2) SNK[7]: VDM" "VDM"
914085-914125 usb_power_delivery: sym: "0x1" "1"
914125-914165 usb_power_delivery: sym: "0x5" "5"
914165-914206 usb_power_delivery: sym: "0x1" "1"
914206-914246 usb_power_delivery: sym: "0x8" "8"
914246-914287 usb_power_delivery: sym: "0x1" "1"
914287-914327 usb_power_delivery: sym: "0x0" "0"
914327-914367 usb_power_delivery: sym: "0xF" "F"
914367-914407 usb_power_delivery: sym: "0xF" "F"
914085-914407 usb_power_delivery: data: "[0]ff018151" "D0"
914085-914407 usb_power_delivery: payload: "[1] ACK DP Configure pos 1 SVID:ff01" "[1] ACK DP Configure pos 1 SVID:ff01"
914407-914448 usb_power_delivery: sym: "0x5" "5"
914448-914488 usb_power_delivery: sym: "0x4" "4"
914488-914529 usb_power_delivery: sym: "0x7" "7"
914529-914569 usb_power_delivery: sym: "0xF" "F"
914569-914609 usb_power_delivery: sym: "0x3" "3"
914609-914650 usb_power_delivery: sym: "0x4" "4"
914650-914690 usb_power_delivery: sym: "0x7" "7"
914690-914730 usb_power_delivery: sym: "0x3" "3"
914407-914730 usb_power_delivery: crc: "CRC:3743f745" "CRC"
914730-914771 usb_power_delivery: sym: "EOP" "#"
914730-914771 usb_power_delivery: eop: "EOP" "E"
913247-914771 usb_power_delivery: text: "#42   (380.519583ms): (r2) SNK[7]: VDM - [1] ACK DP Configure pos 1 SVID:ff01" "..."
915010-915522 usb_power_delivery: preamble: "Preamble" "..."
915522-915563 usb_power_delivery: sym: "SYNC-1" "S1"
915563-915603 usb_power_delivery: sym: "SYNC-1" "S1"
915603-915643 usb_power_delivery: sym: "SYNC-1" "S1"
915643-915683 usb_power_delivery: sym: "SYNC-2" "S2"
915522-915683 usb_power_delivery: sop: "SOP" "S"
915683-915723 usb_power_delivery: sym: "0x1" "1"
915723-915763 usb_power_delivery: sym: "0x6" "6"
915763-915804 usb_power_delivery: sym: "0xF" "F"
915804-915844 usb_power_delivery: sym: "0x0" "0"
915683-915844 usb_power_delivery: header: "H:0f61" "HD"
915010-916205 usb_power_delivery: src: "(r2) SRC[7]: GOOD CRC" "GOOD CRC"
915844-915884 usb_power_delivery: sym: "0x8" "8"
915884-915924 usb_power_delivery: sym: "0x8" "8"
915924-915964 usb_power_delivery: sym: "0x5" "5"
915964-916005 usb_power_delivery: sym: "0x5" "5"
916005-916045 usb_power_delivery: sym: "0x0" "0"
916045-916085 usb_power_delivery: sym: "0x8" "8"
916085-916125 usb_power_delivery: sym: "0xD" "D"
916125-916165 usb_power_delivery: sym: "0xA" "A"
915844-916165 usb_power_delivery: crc: "CRC:ad805588" "CRC"
916165-916205 usb_power_delivery: sym: "EOP" "#"
916165-916205 usb_power_delivery: eop: "EOP" "E"
915010-916205 usb_power_delivery: text: "#43   (381.254167ms): (r2) SRC[7]: GOOD CRC" "..."
917318-917831 usb_power_delivery: preamble: "Preamble" "..."
917831-917871 usb_power_delivery: sym: "SYNC-1" "S1"
917871-917911 usb_power_delivery: sym: "SYNC-1" "S1"
917911-917951 usb_power_delivery: sym: "SYNC-1" "S1"
917951-917991 usb_power_delivery: sym: "SYNC-2" "S2"
917831-917991 usb_power_delivery: sop: "SOP" "S"
917991-918032 usb_power_delivery: sym: "0xF" "F"
918032-918072 usb_power_delivery: sym: "0x6" "6"
918072-918112 usb_power_delivery: sym: "0x9" "9"
918112-918152 usb_power_delivery: sym: "0x1" "1"
917991-918152 usb_power_delivery: header: "H:196f" "HD"
917318-918835 usb_power_delivery: src: "(r2) SRC[4]: VDM" "VDM"
918152-918192 usb_power_delivery: sym: "0x3" "3"
918192-918233 usb_power_delivery: sym: "0x0" "0"
918233-918273 usb_power_delivery: sym: "0x0" "0"
918273-918313 usb_power_delivery: sym: "0x8" "8"
918313-918353 usb_power_delivery: sym: "0xC" "C"
918353-918393 usb_power_delivery: sym: "0xA" "A"
918393-918433 usb_power_delivery: sym: "0x5" "5"
918433-918473 usb_power_delivery: sym: "0x0" "0"
918152-918473 usb_power_delivery: data: "[0]05ac8003" "D0"
918152-918473 usb_power_delivery: payload: "[1] REQ Disc Mode  SVID:05ac" "[1] REQ Disc Mode  SVID:05ac"
918473-918514 usb_power_delivery: sym: "0xB" "B"
918514-918554 usb_power_delivery: sym: "0xD" "D"
918554-918594 usb_power_delivery: sym: "0xA" "A"
918594-918634 usb_power_delivery: sym: "0x5" "5"
918634-918674 usb_power_delivery: sym: "0x8" "8"
918674-918715 usb_power_delivery: sym: "0xC" "C"
918715-918755 usb_power_delivery: sym: "0x4" "4"
918755-918795 usb_power_delivery: sym: "0xA" "A"
918473-918795 usb_power_delivery: crc: "CRC:a4c85adb" "CRC"
918795-918835 usb_power_delivery: sym: "EOP" "#"
918795-918835 usb_power_delivery: eop: "EOP" "E"
917318-918835 usb_power_delivery: text: "#44   (382.215833ms): (r2) SRC[4]: VDM - [1] REQ Disc Mode  SVID:05ac" "..."
919066-919581 usb_power_delivery: preamble: "Preamble" "..."
919581-919621 usb_power_delivery: sym: "SYNC-1" "S1"
919621-919661 usb_power_delivery: sym: "SYNC-1" "S1"
919661-919702 usb_power_delivery: sym: "SYNC-1" "S1"
919702-919742 usb_power_delivery: sym: "SYNC-2" "S2"
919581-919742 usb_power_delivery: sop: "SOP" "S"
919742-919782 usb_power_delivery: sym: "0x1" "1"
919782-919823 usb_power_delivery: sym: "0x4" "4"
919823-919863 usb_power_delivery: sym: "0x8" "8"
919863-919903 usb_power_delivery: sym: "0x0" "0"
919742-919903 usb_power_delivery: header: "H:0841" "HD"
919066-920275 usb_power_delivery: snk: "(r2) SNK[4]: GOOD CRC" "GOOD CRC"
919903-919944 usb_power_delivery: sym: "0x9" "9"
919944-919984 usb_power_delivery: sym: "0x8" "8"
919984-920025 usb_power_delivery: sym: "0x4" "4"
920025-920065 usb_power_delivery: sym: "0xE" "E"
920065-920105 usb_power_delivery: sym: "0x0" "0"
920105-920146 usb_power_delivery: sym: "0x6" "6"
920146-920186 usb_power_delivery: sym: "0x6" "6"
920186-920226 usb_power_delivery: sym: "0xA" "A"
919903-920226 usb_power_delivery: crc: "CRC:a660e489" "CRC"
920226-920267 usb_power_delivery: sym: "EOP" "#"
920226-920267 usb_power_delivery: eop: "EOP" "E"
919066-920267 usb_power_delivery: text: "#45   (382.944167ms): (r2) SNK[4]: GOOD CRC" "..."
924559-925074 usb_power_delivery: preamble: "Preamble" "..."
925074-925115 usb_power_delivery: sym: "SYNC-1" "S1"
925115-925155 usb_power_delivery: sym: "SYNC-1" "S1"
925155-925195 usb_power_delivery: sym: "SYNC-1" "S1"
925195-925235 usb_power_delivery: sym: "SYNC-2" "S2"
925074-925235 usb_power_delivery: sop: "SOP" "S"
925235-925276 usb_power_delivery: sym: "0xF" "F"
925276-925316 usb_power_delivery: sym: "0x4" "4"
925316-925357 usb_power_delivery: sym: "0x0" "0"
925357-925397 usb_power_delivery: sym: "0x3" "3"
925235-925397 usb_power_delivery: header: "H:304f" "HD"
924559-926737 usb_power_delivery: snk: "(r2) SNK[0]: VDM" "VDM"
925397-925437 usb_power_delivery: sym: "0x3" "3"
925437-925478 usb_power_delivery: sym: "0x4" "4"
925478-925518 usb_power_delivery: sym: "0x0" "0"
925518-925558 usb_power_delivery: sym: "0x8" "8"
925558-925599 usb_power_delivery: sym: "0xC" "C"
925599-925639 usb_power_delivery: sym: "0xA" "A"
925639-925679 usb_power_delivery: sym: "0x5" "5"
925679-925720 usb_power_delivery: sym: "0x0" "0"
925397-925720 usb_power_delivery: data: "[0]05ac8043" "D0"
925397-925720 usb_power_delivery: payload: "[1] ACK Disc Mode  SVID:05ac" "[1] ACK Disc Mode  SVID:05ac"
925720-925760 usb_power_delivery: sym: "0x2" "2"
925760-925801 usb_power_delivery: sym: "0x0" "0"
925801-925841 usb_power_delivery: sym: "0x0" "0"
925841-925881 usb_power_delivery: sym: "0x0" "0"
925881-925921 usb_power_delivery: sym: "0x0" "0"
925921-925962 usb_power_delivery: sym: "0x0" "0"
925962-926002 usb_power_delivery: sym: "0x0" "0"
926002-926043 usb_power_delivery: sym: "0x0" "0"
925720-926043 usb_power_delivery: data: "[1]00000002" "D1"
925720-926043 usb_power_delivery: payload: "[2] VDO:00000002" "[2] VDO:00000002"
926043-926083 usb_power_delivery: sym: "0x1" "1"
926083-926123 usb_power_delivery: sym: "0x0" "0"
926123-926164 usb_power_delivery: sym: "0x0" "0"
926164-926204 usb_power_delivery: sym: "0x0" "0"
926204-926244 usb_power_delivery: sym: "0x0" "0"
926244-926285 usb_power_delivery: sym: "0x0" "0"
926285-926325 usb_power_delivery: sym: "0x0" "0"
926325-926365 usb_power_delivery: sym: "0x0" "0"
926043-926365 usb_power_delivery: data: "[2]00000001" "D2"
926043-926365 usb_power_delivery: payload: "[3] VDO:00000001" "[3] VDO:00000001"
926365-926406 usb_power_delivery: sym: "0x8" "8"
926406-926446 usb_power_delivery: sym: "0x7" "7"
926446-926486 usb_power_delivery: sym: "0x8" "8"
926486-926527 usb_power_delivery: sym: "0x4" "4"
926527-926567 usb_power_delivery: sym: "0x9" "9"
926567-926608 usb_power_delivery: sym: "0x9" "9"
926608-926648 usb_power_delivery: sym: "0x2" "2"
926648-926688 usb_power_delivery: sym: "0xF" "F"
926365-926688 usb_power_delivery: crc: "CRC:f2994878" "CRC"
926688-926729 usb_power_delivery: sym: "EOP" "#"
926688-926729 usb_power_delivery: eop: "EOP" "E"
924559-926729 usb_power_delivery: text: "#46   (385.232917ms): (r2) SNK[0]: VDM - [1] ACK Disc Mode  SVID:05ac - [2] VDO:00000002 - [3] VDO:00000001" "..."
926965-927478 usb_power_delivery: preamble: "Preamble" "..."
927478-927518 usb_power_delivery: sym: "SYNC-1" "S1"
927518-927558 usb_power_delivery: sym: "SYNC-1" "S1"
927558-927598 usb_power_delivery: sym: "SYNC-1" "S1"
927598-927638 usb_power_delivery: sym: "SYNC-2" "S2"
927478-927638 usb_power_delivery: sop: "SOP" "S"
927638-927679 usb_power_delivery: sym: "0x1" "1"
927679-927719 usb_power_delivery: sym: "0x6" "6"
927719-927759 usb_power_delivery: sym: "0x1" "1"
927759-927799 usb_power_delivery: sym: "0x0" "0"
927638-927799 usb_power_delivery: header: "H:0161" "HD"
926965-928169 usb_power_delivery: src: "(r2) SRC[0]: GOOD CRC" "GOOD CRC"
927799-927839 usb_power_delivery: sym: "0xF" "F"
927839-927880 usb_power_delivery: sym: "0x8" "8"
927880-927920 usb_power_delivery: sym: "0x8" "8"
927920-927960 usb_power_delivery: sym: "0x7" "7"
927960-928000 usb_power_delivery: sym: "0x8" "8"
928000-928040 usb_power_delivery: sym: "0x3" "3"
928040-928080 usb_power_delivery: sym: "0xA" "A"
928080-928121 usb_power_delivery: sym: "0x4" "4"
927799-928121 usb_power_delivery: crc: "CRC:4a38788f" "CRC"
928121-928161 usb_power_delivery: sym: "EOP" "#"
928121-928161 usb_power_delivery: eop: "EOP" "E"
926965-928161 usb_power_delivery: text: "#47   (386.235417ms): (r2) SRC[0]: GOOD CRC" "..."
929385-929897 usb_power_delivery: preamble: "Preamble" "..."
929897-929938 usb_power_delivery: sym: "SYNC-1" "S1"
929938-929978 usb_power_delivery: sym: "SYNC-1" "S1"
929978-930018 usb_power_delivery: sym: "SYNC-1" "S1"
930018-930058 usb_power_delivery: sym: "SYNC-2" "S2"
929897-930058 usb_power_delivery: sop: "SOP" "S"
930058-930098 usb_power_delivery: sym: "0xF" "F"
930098-930139 usb_power_delivery: sym: "0x6" "6"
930139-930179 usb_power_delivery: sym: "0xB" "B"
930179-930219 usb_power_delivery: sym: "0x1" "1"
930058-930219 usb_power_delivery: header: "H:1b6f" "HD"
929385-930910 usb_power_delivery: src: "(r2) SRC[5]: VDM" "VDM"
930219-930259 usb_power_delivery: sym: "0x4" "4"
930259-930299 usb_power_delivery: sym: "0x0" "0"
930299-930340 usb_power_delivery: sym: "0x1" "1"
930340-930380 usb_power_delivery: sym: "0x8" "8"
930380-930420 usb_power_delivery: sym: "0xC" "C"
930420-930460 usb_power_delivery: sym: "0xA" "A"
930460-930500 usb_power_delivery: sym: "0x5" "5"
930500-930541 usb_power_delivery: sym: "0x0" "0"
930219-930541 usb_power_delivery: data: "[0]05ac8104" "D0"
930219-930541 usb_power_delivery: payload: "[1] REQ Enter Mode pos 1 SVID:05ac" "[1] REQ Enter Mode pos 1 SVID:05ac"
930541-930581 usb_power_delivery: sym: "0x5" "5"
930581-930621 usb_power_delivery: sym: "0x3" "3"
930621-930661 usb_power_delivery: sym: "0xB" "B"
930661-930701 usb_power_delivery: sym: "0x5" "5"
930701-930741 usb_power_delivery: sym: "0xD" "D"
930741-930782 usb_power_delivery: sym: "0x1" "1"
930782-930822 usb_power_delivery: sym: "0x2" "2"
930822-930862 usb_power_delivery: sym: "0x4" "4"
930541-930862 usb_power_delivery: crc: "CRC:421d5b35" "CRC"
930862-930902 usb_power_delivery: sym: "EOP" "#"
930862-930902 usb_power_delivery: eop: "EOP" "E"
929385-930902 usb_power_delivery: text: "#48   (387.243750ms): (r2) SRC[5]: VDM - [1] REQ Enter Mode pos 1 SVID:05ac" "..."
931176-931691 usb_power_delivery: preamble: "Preamble" "..."
931691-931731 usb_power_delivery: sym: "SYNC-1" "S1"
931731-931772 usb_power_delivery: sym: "SYNC-1" "S1"
931772-931812 usb_power_delivery: sym: "SYNC-1" "S1"
931812-931852 usb_power_delivery: sym: "SYNC-2" "S2"
931691-931852 usb_power_delivery: sop: "SOP" "S"
931852-931893 usb_power_delivery: sym: "0x1" "1"
931893-931933 usb_power_delivery: sym: "0x4" "4"
931933-931973 usb_power_delivery: sym: "0xA" "A"
931973-932014 usb_power_delivery: sym: "0x0" "0"
931852-932014 usb_power_delivery: header: "H:0a41" "HD"
931176-932377 usb_power_delivery: snk: "(r2) SNK[5]: GOOD CRC" "GOOD CRC"
932014-932054 usb_power_delivery: sym: "0x5" "5"
932054-932095 usb_power_delivery: sym: "0xA" "A"
932095-932135 usb_power_delivery: sym: "0x5" "5"
932135-932175 usb_power_delivery: sym: "0x8" "8"
932175-932215 usb_power_delivery: sym: "0xE" "E"
932215-932256 usb_power_delivery: sym: "0x6" "6"
932256-932296 usb_power_delivery: sym: "0x8" "8"
932296-932337 usb_power_delivery: sym: "0x4" "4"
932014-932337 usb_power_delivery: crc: "CRC:486e85a5" "CRC"
932337-932377 usb_power_delivery: sym: "EOP" "#"
932337-932377 usb_power_delivery: eop: "EOP" "E"
931176-932377 usb_power_delivery: text: "#49   (387.990000ms): (r2) SNK[5]: GOOD CRC" "..."
932850-933365 usb_power_delivery: preamble: "Preamble" "..."
933365-933405 usb_power_delivery: sym: "SYNC-1" "S1"
933405-933445 usb_power_delivery: sym: "SYNC-1" "S1"
933445-933486 usb_power_delivery: sym: "SYNC-1" "S1"
933486-933526 usb_power_delivery: sym: "SYNC-2" "S2"
933365-933526 usb_power_delivery: sop: "SOP" "S"
933526-933567 usb_power_delivery: sym: "0xF" "F"
933567-933607 usb_power_delivery: sym: "0x4" "4"
933607-933647 usb_power_delivery: sym: "0x2" "2"
933647-933688 usb_power_delivery: sym: "0x1" "1"
933526-933688 usb_power_delivery: header: "H:124f" "HD"
932850-934374 usb_power_delivery: snk: "(r2) SNK[1]: VDM" "VDM"
933688-933728 usb_power_delivery: sym: "0x4" "4"
933728-933768 usb_power_delivery: sym: "0x4" "4"
933768-933809 usb_power_delivery: sym: "0x1" "1"
933809-933849 usb_power_delivery: sym: "0x8" "8"
933849-933889 usb_power_delivery: sym: "0xC" "C"
933889-933930 usb_power_delivery: sym: "0xA" "A"
933930-933970 usb_power_delivery: sym: "0x5" "5"
933970-934011 usb_power_delivery: sym: "0x0" "0"
933688-934011 usb_power_delivery: data: "[0]05ac8144" "D0"
933688-934011 usb_power_delivery: payload: "[1] ACK Enter Mode pos 1 SVID:05ac" "[1] ACK Enter Mode pos 1 SVID:05ac"
934011-934051 usb_power_delivery: sym: "0xF" "F"
934051-934091 usb_power_delivery: sym: "0x4" "4"
934091-934132 usb_power_delivery: sym: "0x4" "4"
934132-934172 usb_power_delivery: sym: "0x6" "6"
934172-934212 usb_power_delivery: sym: "0x5" "5"
934212-934253 usb_power_delivery: sym: "0xB" "B"
934253-934293 usb_power_delivery: sym: "0x3" "3"
934293-934333 usb_power_delivery: sym: "0xD" "D"
934011-934333 usb_power_delivery: crc: "CRC:d3b5644f" "CRC"
934333-934374 usb_power_delivery: sym: "EOP" "#"
934333-934374 usb_power_delivery: eop: "EOP" "E"
932850-934374 usb_power_delivery: text: "#50   (388.687500ms): (r2) SNK[1]: VDM - [1] ACK Enter Mode pos 1 SVID:05ac" "..."
934603-935116 usb_power_delivery: preamble: "Preamble" "..."
935116-935156 usb_power_delivery: sym: "SYNC-1" "S1"
935156-935196 usb_power_delivery: sym: "SYNC-1" "S1"
935196-935236 usb_power_delivery: sym: "SYNC-1" "S1"
935236-935276 usb_power_delivery: sym: "SYNC-2" "S2"
935116-935276 usb_power_delivery: sop: "SOP" "S"
935276-935317 usb_power_delivery: sym: "0x1" "1"
935317-935357 usb_power_delivery: sym: "0x6" "6"
935357-935397 usb_power_delivery: sym: "0x3" "3"
935397-935437 usb_power_delivery: sym: "0x0" "0"
935276-935437 usb_power_delivery: header: "H:0361" "HD"
934603-935799 usb_power_delivery: src: "(r2) SRC[1]: GOOD CRC" "GOOD CRC"
935437-935477 usb_power_delivery: sym: "0x3" "3"
935477-935517 usb_power_delivery: sym: "0xA" "A"
935517-935558 usb_power_delivery: sym: "0x9" "9"
935558-935598 usb_power_delivery: sym: "0x1" "1"
935598-935638 usb_power_delivery: sym: "0x6" "6"
935638-935678 usb_power_delivery: sym: "0x3" "3"
935678-935718 usb_power_delivery: sym: "0x4" "4"
935718-935758 usb_power_delivery: sym: "0xA" "A"
935437-935758 usb_power_delivery: crc: "CRC:a43619a3" "CRC"
935758-935799 usb_power_delivery: sym: "EOP" "#"
935758-935799 usb_power_delivery: eop: "EOP" "E"
934603-935799 usb_power_delivery: text: "#51   (389.417917ms): (r2) SRC[1]: GOOD CRC" "..."
936662-937175 usb_power_delivery: preamble: "Preamble" "..."
937175-937215 usb_power_delivery: sym: "SYNC-1" "S1"
937215-937255 usb_power_delivery: sym: "SYNC-1" "S1"
937255-937295 usb_power_delivery: sym: "SYNC-1" "S1"
937295-937336 usb_power_delivery: sym: "SYNC-2" "S2"
937175-937336 usb_power_delivery: sop: "SOP" "S"
937336-937376 usb_power_delivery: sym: "0xF" "F"
937376-937416 usb_power_delivery: sym: "0x6" "6"
937416-937456 usb_power_delivery: sym: "0xD" "D"
937456-937496 usb_power_delivery: sym: "0x2" "2"
937336-937496 usb_power_delivery: header: "H:2d6f" "HD"
936662-938501 usb_power_delivery: src: "(r2) SRC[6]: VDM" "VDM"
937496-937536 usb_power_delivery: sym: "0x1" "1"
937536-937577 usb_power_delivery: sym: "0x0" "0"
937577-937617 usb_power_delivery: sym: "0x1" "1"
937617-937657 usb_power_delivery: sym: "0x0" "0"
937657-937697 usb_power_delivery: sym: "0xC" "C"
937697-937737 usb_power_delivery: sym: "0xA" "A"
937737-937777 usb_power_delivery: sym: "0x5" "5"
937777-937818 usb_power_delivery: sym: "0x0" "0"
937496-937818 usb_power_delivery: data: "[0]05ac0101" "D0"
937496-937818 usb_power_delivery: payload: "[1] unstruct [0101] SVID:05ac" "[1] unstruct [0101] SVID:05ac"
937818-937858 usb_power_delivery: sym: "0x0" "0"
937858-937898 usb_power_delivery: sym: "0x0" "0"
937898-937938 usb_power_delivery: sym: "0x0" "0"
937938-937978 usb_power_delivery: sym: "0x0" "0"
937978-938019 usb_power_delivery: sym: "0x0" "0"
938019-938059 usb_power_delivery: sym: "0x0" "0"
938059-938099 usb_power_delivery: sym: "0x0" "0"
938099-938139 usb_power_delivery: sym: "0x0" "0"
937818-938139 usb_power_delivery: data: "[1]00000000" "D1"
937818-938139 usb_power_delivery: payload: "[2] VDO:00000000" "[2] VDO:00000000"
938139-938179 usb_power_delivery: sym: "0x0" "0"
938179-938219 usb_power_delivery: sym: "0xB" "B"
938219-938260 usb_power_delivery: sym: "0x7" "7"
938260-938300 usb_power_delivery: sym: "0x0" "0"
938300-938340 usb_power_delivery: sym: "0xB" "B"
938340-938380 usb_power_delivery: sym: "0x3" "3"
938380-938420 usb_power_delivery: sym: "0xC" "C"
938420-938460 usb_power_delivery: sym: "0x7" "7"
938139-938460 usb_power_delivery: crc: "CRC:7c3b07b0" "CRC"
938460-938501 usb_power_delivery: sym: "EOP" "#"
938460-938501 usb_power_delivery: eop: "EOP" "E"
936662-938501 usb_power_delivery: text: "#52   (390.275833ms): (r2) SRC[6]: VDM - [1] unstruct [0101] SVID:05ac - [2] VDO:00000000" "..."
938747-939262 usb_power_delivery: preamble: "Preamble" "..."
939262-939302 usb_power_delivery: sym: "SYNC-1" "S1"
939302-939343 usb_power_delivery: sym: "SYNC-1" "S1"
939343-939383 usb_power_delivery: sym: "SYNC-1" "S1"
939383-939423 usb_power_delivery: sym: "SYNC-2" "S2"
939262-939423 usb_power_delivery: sop: "SOP" "S"
939423-939464 usb_power_delivery: sym: "0x1" "1"
939464-939504 usb_power_delivery: sym: "0x4" "4"
939504-939544 usb_power_delivery: sym: "0xC" "C"
939544-939585 usb_power_delivery: sym: "0x0" "0"
939423-939585 usb_power_delivery: header: "H:0c41" "HD"
938747-939956 usb_power_delivery: snk: "(r2) SNK[6]: GOOD CRC" "GOOD CRC"
939585-939625 usb_power_delivery: sym: "0x0" "0"
939625-939665 usb_power_delivery: sym: "0x9" "9"
939665-939706 usb_power_delivery: sym: "0x0" "0"
939706-939746 usb_power_delivery: sym: "0x2" "2"
939746-939787 usb_power_delivery: sym: "0xD" "D"
939787-939827 usb_power_delivery: sym: "0x0" "0"
939827-939867 usb_power_delivery: sym: "0x1" "1"
939867-939908 usb_power_delivery: sym: "0xA" "A"
939585-939908 usb_power_delivery: crc: "CRC:a10d2090" "CRC"
939908-939948 usb_power_delivery: sym: "EOP" "#"
939908-939948 usb_power_delivery: eop: "EOP" "E"
938747-939948 usb_power_delivery: text: "#53   (391.144583ms): (r2) SNK[6]: GOOD CRC" "..."
941206-941720 usb_power_delivery: preamble: "Preamble" "..."
941720-941761 usb_power_delivery: sym: "SYNC-1" "S1"
941761-941801 usb_power_delivery: sym: "SYNC-1" "S1"
941801-941842 usb_power_delivery: sym: "SYNC-1" "S1"
941842-941882 usb_power_delivery: sym: "SYNC-2" "S2"
941720-941882 usb_power_delivery: sop: "SOP" "S"
941882-941922 usb_power_delivery: sym: "0xF" "F"
941922-941962 usb_power_delivery: sym: "0x4" "4"
941962-942003 usb_power_delivery: sym: "0x4" "4"
942003-942043 usb_power_delivery: sym: "0x2" "2"
941882-942043 usb_power_delivery: header: "H:244f" "HD"
941206-943060 usb_power_delivery: snk: "(r2) SNK[2]: VDM" "VDM"
942043-942084 usb_power_delivery: sym: "0x1" "1"
942084-942124 usb_power_delivery: sym: "0x1" "1"
942124-942164 usb_power_delivery: sym: "0x1" "1"
942164-942205 usb_power_delivery: sym: "0x0" "0"
942205-942245 usb_power_delivery: sym: "0xC" "C"
942245-942285 usb_power_delivery: sym: "0xA" "A"
942285-942326 usb_power_delivery: sym: "0x5" "5"
942326-942366 usb_power_delivery: sym: "0x0" "0"
942043-942366 usb_power_delivery: data: "[0]05ac0111" "D0"
942043-942366 usb_power_delivery: payload: "[1] unstruct [0111] SVID:05ac" "[1] unstruct [0111] SVID:05ac"
942366-942407 usb_power_delivery: sym: "0x6" "6"
942407-942447 usb_power_delivery: sym: "0x0" "0"
942447-942487 usb_power_delivery: sym: "0x0" "0"
942487-942527 usb_power_delivery: sym: "0x0" "0"
942527-942568 usb_power_delivery: sym: "0x0" "0"
942568-942608 usb_power_delivery: sym: "0x0" "0"
942608-942649 usb_power_delivery: sym: "0x0" "0"
942649-942689 usb_power_delivery: sym: "0x2" "2"
942366-942689 usb_power_delivery: data: "[1]20000006" "D1"
942366-942689 usb_power_delivery: payload: "[2] VDO:20000006" "[2] VDO:20000006"
942689-942729 usb_power_delivery: sym: "0x4" "4"
942729-942770 usb_power_delivery: sym: "0x0" "0"
942770-942810 usb_power_delivery: sym: "0xC" "C"
942810-942850 usb_power_delivery: sym: "0xF" "F"
942850-942891 usb_power_delivery: sym: "0xB" "B"
942891-942931 usb_power_delivery: sym: "0x7" "7"
942931-942971 usb_power_delivery: sym: "0xD" "D"
942971-943012 usb_power_delivery: sym: "0xF" "F"
942689-943012 usb_power_delivery: crc: "CRC:fd7bfc04" "CRC"
943012-943052 usb_power_delivery: sym: "EOP" "#"
943012-943052 usb_power_delivery: eop: "EOP" "E"
941206-943052 usb_power_delivery: text: "#54   (392.169167ms): (r2) SNK[2]: VDM - [1] unstruct [0111] SVID:05ac - [2] VDO:20000006" "..."
943303-943815 usb_power_delivery: preamble: "Preamble" "..."
943815-943855 usb_power_delivery: sym: "SYNC-1" "S1"
943855-943896 usb_power_delivery: sym: "SYNC-1" "S1"
943896-943936 usb_power_delivery: sym: "SYNC-1" "S1"
943936-943976 usb_power_delivery: sym: "SYNC-2" "S2"
943815-943976 usb_power_delivery: sop: "SOP" "S"
943976-944016 usb_power_delivery: sym: "0x1" "1"
944016-944056 usb_power_delivery: sym: "0x6" "6"
944056-944097 usb_power_delivery: sym: "0x5" "5"
944097-944137 usb_power_delivery: sym: "0x0" "0"
943976-944137 usb_power_delivery: header: "H:0561" "HD"
943303-944506 usb_power_delivery: src: "(r2) SRC[2]: GOOD CRC" "GOOD CRC"
944137-944177 usb_power_delivery: sym: "0x6" "6"
944177-944217 usb_power_delivery: sym: "0x9" "9"
944217-944257 usb_power_delivery: sym: "0xC" "C"
944257-944297 usb_power_delivery: sym: "0xB" "B"
944297-944338 usb_power_delivery: sym: "0x5" "5"
944338-944378 usb_power_delivery: sym: "0x5" "5"
944378-944418 usb_power_delivery: sym: "0xD" "D"
944418-944458 usb_power_delivery: sym: "0x4" "4"
944137-944458 usb_power_delivery: crc: "CRC:4d55bc96" "CRC"
944458-944498 usb_power_delivery: sym: "EOP" "#"
944458-944498 usb_power_delivery: eop: "EOP" "E"
943303-944498 usb_power_delivery: text: "#55   (393.042917ms): (r2) SRC[2]: GOOD CRC" "..."
945276-945789 usb_power_delivery: preamble: "Preamble" "..."
945789-945829 usb_power_delivery: sym: "SYNC-1" "S1"
945829-945869 usb_power_delivery: sym: "SYNC-1" "S1"
945869-945909 usb_power_delivery: sym: "SYNC-1" "S1"
945909-945949 usb_power_delivery: sym: "SYNC-2" "S2"
945789-945949 usb_power_delivery: sop: "SOP" "S"
945949-945990 usb_power_delivery: sym: "0xF" "F"
945990-946030 usb_power_delivery: sym: "0x6" "6"
946030-946070 usb_power_delivery: sym: "0xF" "F"
946070-946110 usb_power_delivery: sym: "0x2" "2"
945949-946110 usb_power_delivery: header: "H:2f6f" "HD"
945276-947114 usb_power_delivery: src: "(r2) SRC[7]: VDM" "VDM"
946110-946150 usb_power_delivery: sym: "0x1" "1"
946150-946190 usb_power_delivery: sym: "0x0" "0"
946190-946231 usb_power_delivery: sym: "0x1" "1"
946231-946271 usb_power_delivery: sym: "0x0" "0"
946271-946311 usb_power_delivery: sym: "0xC" "C"
946311-946351 usb_power_delivery: sym: "0xA" "A"
946351-946391 usb_power_delivery: sym: "0x5" "5"
946391-946431 usb_power_delivery: sym: "0x0" "0"
946110-946431 usb_power_delivery: data: "[0]05ac0101" "D0"
946110-946431 usb_power_delivery: payload: "[1] unstruct [0101] SVID:05ac" "[1] unstruct [0101] SVID:05ac"
946431-946472 usb_power_delivery: sym: "0x4" "4"
946472-946512 usb_power_delivery: sym: "0x0" "0"
946512-946552 usb_power_delivery: sym: "0x0" "0"
946552-946592 usb_power_delivery: sym: "0x0" "0"
946592-946632 usb_power_delivery: sym: "0x0" "0"
946632-946672 usb_power_delivery: sym: "0x0" "0"
946672-946713 usb_power_delivery: sym: "0x0" "0"
946713-946753 usb_power_delivery: sym: "0x0" "0"
946431-946753 usb_power_delivery: data: "[1]00000004" "D1"
946431-946753 usb_power_delivery: payload: "[2] VDO:00000004" "[2] VDO:00000004"
946753-946793 usb_power_delivery: sym: "0x1" "1"
946793-946833 usb_power_delivery: sym: "0x6" "6"
946833-946873 usb_power_delivery: sym: "0x8" "8"
946873-946914 usb_power_delivery: sym: "0xB" "B"
946914-946954 usb_power_delivery: sym: "0xF" "F"
946954-946994 usb_power_delivery: sym: "0xA" "A"
946994-947034 usb_power_delivery: sym: "0xD" "D"
947034-947074 usb_power_delivery: sym: "0xD" "D"
946753-947074 usb_power_delivery: crc: "CRC:ddafb861" "CRC"
947074-947114 usb_power_delivery: sym: "EOP" "#"
947074-947114 usb_power_delivery: eop: "EOP" "E"
945276-947114 usb_power_delivery: text: "#56   (393.865000ms): (r2) SRC[7]: VDM - [1] unstruct [0101] SVID:05ac - [2] VDO:00000004" "..."
947345-947860 usb_power_delivery: preamble: "Preamble" "..."
947860-947900 usb_power_delivery: sym: "SYNC-1" "S1"
947900-947941 usb_power_delivery: sym: "SYNC-1" "S1"
947941-947981 usb_power_delivery: sym: "SYNC-1" "S1"
947981-948021 usb_power_delivery: sym: "SYNC-2" "S2"
947860-948021 usb_power_delivery: sop: "SOP" "S"
948021-948062 usb_power_delivery: sym: "0x1" "1"
948062-948102 usb_power_delivery: sym: "0x4" "4"
948102-948142 usb_power_delivery: sym: "0xE" "E"
948142-948183 usb_power_delivery: sym: "0x0" "0"
948021-948183 usb_power_delivery: header: "H:0e41" "HD"
947345-948554 usb_power_delivery: snk: "(r2) SNK[7]: GOOD CRC" "GOOD CRC"
948183-948223 usb_power_delivery: sym: "0xC" "C"
948223-948264 usb_power_delivery: sym: "0xB" "B"
948264-948304 usb_power_delivery: sym: "0x1" "1"
948304-948344 usb_power_delivery: sym: "0x4" "4"
948344-948385 usb_power_delivery: sym: "0x3" "3"
948385-948425 usb_power_delivery: sym: "0x0" "0"
948425-948465 usb_power_delivery: sym: "0xF" "F"
948465-948506 usb_power_delivery: sym: "0x4" "4"
948183-948506 usb_power_delivery: crc: "CRC:4f0341bc" "CRC"
948506-948546 usb_power_delivery: sym: "EOP" "#"
948506-948546 usb_power_delivery: eop: "EOP" "E"
947345-948546 usb_power_delivery: text: "#57   (394.727083ms): (r2) SNK[7]: GOOD CRC" "..."
949230-949745 usb_power_delivery: preamble: "Preamble" "..."
949745-949786 usb_power_delivery: sym: "SYNC-1" "S1"
949786-949826 usb_power_delivery: sym: "SYNC-1" "S1"
949826-949867 usb_power_delivery: sym: "SYNC-1" "S1"
949867-949907 usb_power_delivery: sym: "SYNC-2" "S2"
949745-949907 usb_power_delivery: sop: "SOP" "S"
949907-949947 usb_power_delivery: sym: "0xF" "F"
949947-949987 usb_power_delivery: sym: "0x4" "4"
949987-950028 usb_power_delivery: sym: "0x6" "6"
950028-950068 usb_power_delivery: sym: "0x2" "2"
949907-950068 usb_power_delivery: header: "H:264f" "HD"
949230-951077 usb_power_delivery: snk: "(r2) SNK[3]: VDM" "VDM"
950068-950108 usb_power_delivery: sym: "0x1" "1"
950108-950149 usb_power_delivery: sym: "0x1" "1"
950149-950189 usb_power_delivery: sym: "0x1" "1"
950189-950230 usb_power_delivery: sym: "0x0" "0"
950230-950270 usb_power_delivery: sym: "0xC" "C"
950270-950310 usb_power_delivery: sym: "0xA" "A"
950310-950351 usb_power_delivery: sym: "0x5" "5"
950351-950391 usb_power_delivery: sym: "0x0" "0"
950068-950391 usb_power_delivery: data: "[0]05ac0111" "D0"
950068-950391 usb_power_delivery: payload: "[1] unstruct [0111] SVID:05ac" "[1] unstruct [0111] SVID:05ac"
950391-950431 usb_power_delivery: sym: "0x8" "8"
950431-950472 usb_power_delivery: sym: "0x9" "9"
950472-950512 usb_power_delivery: sym: "0x0" "0"
950512-950552 usb_power_delivery: sym: "0x0" "0"
950552-950593 usb_power_delivery: sym: "0x6" "6"
950593-950633 usb_power_delivery: sym: "0x0" "0"
950633-950674 usb_power_delivery: sym: "0x0" "0"
950674-950714 usb_power_delivery: sym: "0x0" "0"
950391-950714 usb_power_delivery: data: "[1]00060098" "D1"
950391-950714 usb_power_delivery: payload: "[2] VDO:00060098" "[2] VDO:00060098"
950714-950754 usb_power_delivery: sym: "0xB" "B"
950754-950795 usb_power_delivery: sym: "0x5" "5"
950795-950835 usb_power_delivery: sym: "0x5" "5"
950835-950875 usb_power_delivery: sym: "0xC" "C"
950875-950916 usb_power_delivery: sym: "0x6" "6"
950916-950956 usb_power_delivery: sym: "0x2" "2"
950956-950996 usb_power_delivery: sym: "0x3" "3"
950996-951037 usb_power_delivery: sym: "0xE" "E"
950714-951037 usb_power_delivery: crc: "CRC:e326c55b" "CRC"
951037-951077 usb_power_delivery: sym: "EOP" "#"
951037-951077 usb_power_delivery: eop: "EOP" "E"
949230-951077 usb_power_delivery: text: "#58   (395.512500ms): (r2) SNK[3]: VDM - [1] unstruct [0111] SVID:05ac - [2] VDO:00060098" "..."
951306-951819 usb_power_delivery: preamble: "Preamble" "..."
951819-951859 usb_power_delivery: sym: "SYNC-1" "S1"
951859-951899 usb_power_delivery: sym: "SYNC-1" "S1"
951899-951939 usb_power_delivery: sym: "SYNC-1" "S1"
951939-951979 usb_power_delivery: sym: "SYNC-2" "S2"
951819-951979 usb_power_delivery: sop: "SOP" "S"
951979-952020 usb_power_delivery: sym: "0x1" "1"
952020-952060 usb_power_delivery: sym: "0x6" "6"
952060-952100 usb_power_delivery: sym: "0x7" "7"
952100-952140 usb_power_delivery: sym: "0x0" "0"
951979-952140 usb_power_delivery: header: "H:0761" "HD"
951306-952510 usb_power_delivery: src: "(r2) SRC[3]: GOOD CRC" "GOOD CRC"
952140-952180 usb_power_delivery: sym: "0xA" "A"
952180-952220 usb_power_delivery: sym: "0xB" "B"
952220-952261 usb_power_delivery: sym: "0xD" "D"
952261-952301 usb_power_delivery: sym: "0xD" "D"
952301-952341 usb_power_delivery: sym: "0xB" "B"
952341-952381 usb_power_delivery: sym: "0x5" "5"
952381-952421 usb_power_delivery: sym: "0x3" "3"
952421-952462 usb_power_delivery: sym: "0xA" "A"
952140-952462 usb_power_delivery: crc: "CRC:a35bddba" "CRC"
952462-952502 usb_power_delivery: sym: "EOP" "#"
952462-952502 usb_power_delivery: eop: "EOP" "E"
951306-952502 usb_power_delivery: text: "#59   (396.377500ms): (r2) SRC[3]: GOOD CRC" "..."
953122-953634 usb_power_delivery: preamble: "Preamble" "..."
953634-953675 usb_power_delivery: sym: "SYNC-1" "S1"
953675-953715 usb_power_delivery: sym: "SYNC-1" "S1"
953715-953755 usb_power_delivery: sym: "SYNC-1" "S1"
953755-953795 usb_power_delivery: sym: "SYNC-2" "S2"
953634-953795 usb_power_delivery: sop: "SOP" "S"
953795-953835 usb_power_delivery: sym: "0xF" "F"
953835-953876 usb_power_delivery: sym: "0x6" "6"
953876-953916 usb_power_delivery: sym: "0x1" "1"
953916-953956 usb_power_delivery: sym: "0x2" "2"
953795-953956 usb_power_delivery: header: "H:216f" "HD"
953122-954968 usb_power_delivery: src: "(r2) SRC[0]: VDM" "VDM"
953956-953996 usb_power_delivery: sym: "0x1" "1"
953996-954036 usb_power_delivery: sym: "0x0" "0"
954036-954076 usb_power_delivery: sym: "0x1" "1"
954076-954117 usb_power_delivery: sym: "0x0" "0"
954117-954157 usb_power_delivery: sym: "0xC" "C"
954157-954197 usb_power_delivery: sym: "0xA" "A"
954197-954237 usb_power_delivery: sym: "0x5" "5"
954237-954277 usb_power_delivery: sym: "0x0" "0"
953956-954277 usb_power_delivery: data: "[0]05ac0101" "D0"
953956-954277 usb_power_delivery: payload: "[1] unstruct [0101] SVID:05ac" "[1] unstruct [0101] SVID:05ac"
954277-954317 usb_power_delivery: sym: "0x0" "0"
954317-954358 usb_power_delivery: sym: "0x0" "0"
954358-954398 usb_power_delivery: sym: "0x0" "0"
954398-954438 usb_power_delivery: sym: "0x0" "0"
954438-954478 usb_power_delivery: sym: "0x0" "0"
954478-954518 usb_power_delivery: sym: "0x0" "0"
954518-954559 usb_power_delivery: sym: "0x1" "1"
954559-954599 usb_power_delivery: sym: "0x0" "0"
954277-954599 usb_power_delivery: data: "[1]01000000" "D1"
954277-954599 usb_power_delivery: payload: "[2] VDO:01000000" "[2] VDO:01000000"
954599-954639 usb_power_delivery: sym: "0x2" "2"
954639-954679 usb_power_delivery: sym: "0x3" "3"
954679-954719 usb_power_delivery: sym: "0x4" "4"
954719-954759 usb_power_delivery: sym: "0xC" "C"
954759-954800 usb_power_delivery: sym: "0x8" "8"
954800-954840 usb_power_delivery: sym: "0x0" "0"
954840-954880 usb_power_delivery: sym: "0xD" "D"
954880-954920 usb_power_delivery: sym: "0xE" "E"
954599-954920 usb_power_delivery: crc: "CRC:ed08c432" "CRC"
954920-954960 usb_power_delivery: sym: "EOP" "#"
954920-954960 usb_power_delivery: eop: "EOP" "E"
953122-954960 usb_power_delivery: text: "#60   (397.134167ms): (r2) SRC[0]: VDM - [1] unstruct [0101] SVID:05ac - [2] VDO:01000000" "..."
955233-955748 usb_power_delivery: preamble: "Preamble" "..."
955748-955789 usb_power_delivery: sym: "SYNC-1" "S1"
955789-955829 usb_power_delivery: sym: "SYNC-1" "S1"
955829-955870 usb_power_delivery: sym: "SYNC-1" "S1"
955870-955910 usb_power_delivery: sym: "SYNC-2" "S2"
955748-955910 usb_power_delivery: sop: "SOP" "S"
955910-955950 usb_power_delivery: sym: "0x1" "1"
955950-955990 usb_power_delivery: sym: "0x4" "4"
955990-956031 usb_power_delivery: sym: "0x0" "0"
956031-956071 usb_power_delivery: sym: "0x0" "0"
955910-956071 usb_power_delivery: header: "H:0041" "HD"
955233-956442 usb_power_delivery: snk: "(r2) SNK[0]: GOOD CRC" "GOOD CRC"
956071-956112 usb_power_delivery: sym: "0xB" "B"
956112-956152 usb_power_delivery: sym: "0xB" "B"
956152-956192 usb_power_delivery: sym: "0xC" "C"
956192-956232 usb_power_delivery: sym: "0x6" "6"
956232-956273 usb_power_delivery: sym: "0xB" "B"
956273-956313 usb_power_delivery: sym: "0xB" "B"
956313-956354 usb_power_delivery: sym: "0x8" "8"
956354-956394 usb_power_delivery: sym: "0xA" "A"
956071-956394 usb_power_delivery: crc: "CRC:a8bb6cbb" "CRC"
956394-956434 usb_power_delivery: sym: "EOP" "#"
956394-956434 usb_power_delivery: eop: "EOP" "E"
955233-956434 usb_power_delivery: text: "#61   (398.013750ms): (r2) SNK[0]: GOOD CRC" "..."
957271-957786 usb_power_delivery: preamble: "Preamble" "..."
957786-957827 usb_power_delivery: sym: "SYNC-1" "S1"
957827-957867 usb_power_delivery: sym: "SYNC-1" "S1"
957867-957908 usb_power_delivery: sym: "SYNC-1" "S1"
957908-957948 usb_power_delivery: sym: "SYNC-2" "S2"
957786-957948 usb_power_delivery: sop: "SOP" "S"
957948-957988 usb_power_delivery: sym: "0xF" "F"
957988-958028 usb_power_delivery: sym: "0x4" "4"
958028-958069 usb_power_delivery: sym: "0x8" "8"
958069-958109 usb_power_delivery: sym: "0x2" "2"
957948-958109 usb_power_delivery: header: "H:284f" "HD"
957271-959126 usb_power_delivery: snk: "(r2) SNK[4]: VDM" "VDM"
958109-958150 usb_power_delivery: sym: "0x1" "1"
958150-958190 usb_power_delivery: sym: "0x1" "1"
958190-958230 usb_power_delivery: sym: "0x1" "1"
958230-958271 usb_power_delivery: sym: "0x0" "0"
958271-958311 usb_power_delivery: sym: "0xC" "C"
958311-958351 usb_power_delivery: sym: "0xA" "A"
958351-958392 usb_power_delivery: sym: "0x5" "5"
958392-958432 usb_power_delivery: sym: "0x0" "0"
958109-958432 usb_power_delivery: data: "[0]05ac0111" "D0"
958109-958432 usb_power_delivery: payload: "[1] unstruct [0111] SVID:05ac" "[1] unstruct [0111] SVID:05ac"
958432-958472 usb_power_delivery: sym: "0x4" "4"
958472-958513 usb_power_delivery: sym: "0x0" "0"
958513-958553 usb_power_delivery: sym: "0x0" "0"
958553-958594 usb_power_delivery: sym: "0x0" "0"
958594-958634 usb_power_delivery: sym: "0x0" "0"
958634-958674 usb_power_delivery: sym: "0x0" "0"
958674-958714 usb_power_delivery: sym: "0x0" "0"
958714-958755 usb_power_delivery: sym: "0x0" "0"
958432-958755 usb_power_delivery: data: "[1]00000004" "D1"
958432-958755 usb_power_delivery: payload: "[2] VDO:00000004" "[2] VDO:00000004"
958755-958795 usb_power_delivery: sym: "0x3" "3"
958795-958836 usb_power_delivery: sym: "0x5" "5"
958836-958876 usb_power_delivery: sym: "0x7" "7"
958876-958916 usb_power_delivery: sym: "0xE" "E"
958916-958957 usb_power_delivery: sym: "0x8" "8"
958957-958997 usb_power_delivery: sym: "0x2" "2"
958997-959037 usb_power_delivery: sym: "0xA" "A"
959037-959078 usb_power_delivery: sym: "0x8" "8"
958755-959078 usb_power_delivery: crc: "CRC:8a28e753" "CRC"
959078-959118 usb_power_delivery: sym: "EOP" "#"
959078-959118 usb_power_delivery: eop: "EOP" "E"
957271-959118 usb_power_delivery: text: "#62   (398.862917ms): (r2) SNK[4]: VDM - [1] unstruct [0111] SVID:05ac - [2] VDO:00000004" "..."
959377-959889 usb_power_delivery: preamble: "Preamble" "..."
959889-959930 usb_power_delivery: sym: "SYNC-1" "S1"
959930-959970 usb_power_delivery: sym: "SYNC-1" "S1"
959970-960010 usb_power_delivery: sym: "SYNC-1" "S1"
960010-960050 usb_power_delivery: sym: "SYNC-2" "S2"
959889-960050 usb_power_delivery: sop: "SOP" "S"
960050-960090 usb_power_delivery: sym: "0x1" "1"
960090-960130 usb_power_delivery: sym: "0x6" "6"
960130-960171 usb_power_delivery: sym: "0x9" "9"
960171-960211 usb_power_delivery: sym: "0x0" "0"
960050-960211 usb_power_delivery: header: "H:0961" "HD"
959377-960572 usb_power_delivery: src: "(r2) SRC[4]: GOOD CRC" "GOOD CRC"
960211-960251 usb_power_delivery: sym: "0xD" "D"
960251-960291 usb_power_delivery: sym: "0xB" "B"
960291-960331 usb_power_delivery: sym: "0x0" "0"
960331-960371 usb_power_delivery: sym: "0xF" "F"
960371-960412 usb_power_delivery: sym: "0x3" "3"
960412-960452 usb_power_delivery: sym: "0xE" "E"
960452-960492 usb_power_delivery: sym: "0x4" "4"
960492-960532 usb_power_delivery: sym: "0x4" "4"
960211-960532 usb_power_delivery: crc: "CRC:44e3f0bd" "CRC"
960532-960572 usb_power_delivery: sym: "EOP" "#"
960532-960572 usb_power_delivery: eop: "EOP" "E"
959377-960572 usb_power_delivery: text: "#63   (399.740417ms): (r2) SRC[4]: GOOD CRC" "..."
961423-961935 usb_power_delivery: preamble: "Preamble" "..."
961935-961975 usb_power_delivery: sym: "SYNC-1" "S1"
961975-962015 usb_power_delivery: sym: "SYNC-1" "S1"
962015-962056 usb_power_delivery: sym: "SYNC-1" "S1"
962056-962096 usb_power_delivery: sym: "SYNC-2" "S2"
961935-962096 usb_power_delivery: sop: "SOP" "S"
962096-962136 usb_power_delivery: sym: "0xF" "F"
962136-962176 usb_power_delivery: sym: "0x6" "6"
962176-962217 usb_power_delivery: sym: "0x3" "3"
962217-962257 usb_power_delivery: sym: "0x2" "2"
962096-962257 usb_power_delivery: header: "H:236f" "HD"
961423-963261 usb_power_delivery: src: "(r2) SRC[1]: VDM" "VDM"
962257-962297 usb_power_delivery: sym: "0x1" "1"
962297-962337 usb_power_delivery: sym: "0x0" "0"
962337-962377 usb_power_delivery: sym: "0x1" "1"
962377-962417 usb_power_delivery: sym: "0x0" "0"
962417-962458 usb_power_delivery: sym: "0xC" "C"
962458-962498 usb_power_delivery: sym: "0xA" "A"
962498-962538 usb_power_delivery: sym: "0x5" "5"
962538-962578 usb_power_delivery: sym: "0x0" "0"
962257-962578 usb_power_delivery: data: "[0]05ac0101" "D0"
962257-962578 usb_power_delivery: payload: "[1] unstruct [0101] SVID:05ac" "[1] unstruct [0101] SVID:05ac"
962578-962618 usb_power_delivery: sym: "0x4" "4"
962618-962659 usb_power_delivery: sym: "0x0" "0"
962659-962699 usb_power_delivery: sym: "0x0" "0"
962699-962739 usb_power_delivery: sym: "0x0" "0"
962739-962779 usb_power_delivery: sym: "0x0" "0"
962779-962819 usb_power_delivery: sym: "0x0" "0"
962819-962859 usb_power_delivery: sym: "0x1" "1"
962859-962900 usb_power_delivery: sym: "0x0" "0"
962578-962900 usb_power_delivery: data: "[1]01000004" "D1"
962578-962900 usb_power_delivery: payload: "[2] VDO:01000004" "[2] VDO:01000004"
962900-962940 usb_power_delivery: sym: "0x3" "3"
962940-962980 usb_power_delivery: sym: "0xE" "E"
962980-963020 usb_power_delivery: sym: "0xB" "B"
963020-963060 usb_power_delivery: sym: "0x7" "7"
963060-963101 usb_power_delivery: sym: "0xC" "C"
963101-963141 usb_power_delivery: sym: "0x9" "9"
963141-963181 usb_power_delivery: sym: "0xC" "C"
963181-963221 usb_power_delivery: sym: "0x4" "4"
962900-963221 usb_power_delivery: crc: "CRC:4c9c7be3" "CRC"
963221-963261 usb_power_delivery: sym: "EOP" "#"
963221-963261 usb_power_delivery: eop: "EOP" "E"
961423-963261 usb_power_delivery: text: "#64   (400.592917ms): (r2) SRC[1]: VDM - [1] unstruct [0101] SVID:05ac - [2] VDO:01000004" "..."
963507-964022 usb_power_delivery: preamble: "Preamble" "..."
964022-964063 usb_power_delivery: sym: "SYNC-1" "S1"
964063-964103 usb_power_delivery: sym: "SYNC-1" "S1"
964103-964143 usb_power_delivery: sym: "SYNC-1" "S1"
964143-964184 usb_power_delivery: sym: "SYNC-2" "S2"
964022-964184 usb_power_delivery: sop: "SOP" "S"
964184-964224 usb_power_delivery: sym: "0x1" "1"
964224-964264 usb_power_delivery: sym: "0x4" "4"
964264-964305 usb_power_delivery: sym: "0x2" "2"
964305-964345 usb_power_delivery: sym: "0x0" "0"
964184-964345 usb_power_delivery: header: "H:0241" "HD"
963507-964716 usb_power_delivery: snk: "(r2) SNK[1]: GOOD CRC" "GOOD CRC"
964345-964386 usb_power_delivery: sym: "0x7" "7"
964386-964426 usb_power_delivery: sym: "0x9" "9"
964426-964466 usb_power_delivery: sym: "0xD" "D"
964466-964507 usb_power_delivery: sym: "0x0" "0"
964507-964547 usb_power_delivery: sym: "0x5" "5"
964547-964587 usb_power_delivery: sym: "0xB" "B"
964587-964628 usb_power_delivery: sym: "0x6" "6"
964628-964668 usb_power_delivery: sym: "0x4" "4"
964345-964668 usb_power_delivery: crc: "CRC:46b50d97" "CRC"
964668-964708 usb_power_delivery: sym: "EOP" "#"
964668-964708 usb_power_delivery: eop: "EOP" "E"
963507-964708 usb_power_delivery: text: "#65   (401.461250ms): (r2) SNK[1]: GOOD CRC" "..."
965309-965824 usb_power_delivery: preamble: "Preamble" "..."
965824-965864 usb_power_delivery: sym: "SYNC-1" "S1"
965864-965905 usb_power_delivery: sym: "SYNC-1" "S1"
965905-965945 usb_power_delivery: sym: "SYNC-1" "S1"
965945-965985 usb_power_delivery: sym: "SYNC-2" "S2"
965824-965985 usb_power_delivery: sop: "SOP" "S"
965985-966026 usb_power_delivery: sym: "0xF" "F"
966026-966066 usb_power_delivery: sym: "0x4" "4"
966066-966106 usb_power_delivery: sym: "0xA" "A"
966106-966147 usb_power_delivery: sym: "0x2" "2"
965985-966147 usb_power_delivery: header: "H:2a4f" "HD"
965309-967156 usb_power_delivery: snk: "(r2) SNK[5]: VDM" "VDM"
966147-966187 usb_power_delivery: sym: "0x1" "1"
966187-966228 usb_power_delivery: sym: "0x1" "1"
966228-966268 usb_power_delivery: sym: "0x1" "1"
966268-966308 usb_power_delivery: sym: "0x0" "0"
966308-966349 usb_power_delivery: sym: "0xC" "C"
966349-966389 usb_power_delivery: sym: "0xA" "A"
966389-966429 usb_power_delivery: sym: "0x5" "5"
966429-966470 usb_power_delivery: sym: "0x0" "0"
966147-966470 usb_power_delivery: data: "[0]05ac0111" "D0"
966147-966470 usb_power_delivery: payload: "[1] unstruct [0111] SVID:05ac" "[1] unstruct [0111] SVID:05ac"
966470-966510 usb_power_delivery: sym: "0x8" "8"
966510-966550 usb_power_delivery: sym: "0x0" "0"
966550-966591 usb_power_delivery: sym: "0x1" "1"
966591-966631 usb_power_delivery: sym: "0x0" "0"
966631-966672 usb_power_delivery: sym: "0x0" "0"
966672-966712 usb_power_delivery: sym: "0x0" "0"
966712-966752 usb_power_delivery: sym: "0x0" "0"
966752-966793 usb_power_delivery: sym: "0x0" "0"
966470-966793 usb_power_delivery: data: "[1]00000108" "D1"
966470-966793 usb_power_delivery: payload: "[2] VDO:00000108" "[2] VDO:00000108"
966793-966833 usb_power_delivery: sym: "0xA" "A"
966833-966873 usb_power_delivery: sym: "0x5" "5"
966873-966914 usb_power_delivery: sym: "0xA" "A"
966914-966954 usb_power_delivery: sym: "0x1" "1"
966954-966995 usb_power_delivery: sym: "0xA" "A"
966995-967035 usb_power_delivery: sym: "0xC" "C"
967035-967075 usb_power_delivery: sym: "0xF" "F"
967075-967115 usb_power_delivery: sym: "0xE" "E"
966793-967115 usb_power_delivery: crc: "CRC:efca1a5a" "CRC"
967115-967156 usb_power_delivery: sym: "EOP" "#"
967115-967156 usb_power_delivery: eop: "EOP" "E"
965309-967156 usb_power_delivery: text: "#66   (402.212083ms): (r2) SNK[5]: VDM - [1] unstruct [0111] SVID:05ac - [2] VDO:00000108" "..."
967384-967897 usb_power_delivery: preamble: "Preamble" "..."
967897-967937 usb_power_delivery: sym: "SYNC-1" "S1"
967937-967977 usb_power_delivery: sym: "SYNC-1" "S1"
967977-968017 usb_power_delivery: sym: "SYNC-1" "S1"
968017-968057 usb_power_delivery: sym: "SYNC-2" "S2"
967897-968057 usb_power_delivery: sop: "SOP" "S"
968057-968098 usb_power_delivery: sym: "0x1" "1"
968098-968138 usb_power_delivery: sym: "0x6" "6"
968138-968178 usb_power_delivery: sym: "0xB" "B"
968178-968218 usb_power_delivery: sym: "0x0" "0"
968057-968218 usb_power_delivery: header: "H:0b61" "HD"
967384-968580 usb_power_delivery: src: "(r2) SRC[5]: GOOD CRC" "GOOD CRC"
968218-968258 usb_power_delivery: sym: "0x1" "1"
968258-968298 usb_power_delivery: sym: "0x9" "9"
968298-968339 usb_power_delivery: sym: "0x1" "1"
968339-968379 usb_power_delivery: sym: "0x9" "9"
968379-968419 usb_power_delivery: sym: "0xD" "D"
968419-968459 usb_power_delivery: sym: "0xE" "E"
968459-968499 usb_power_delivery: sym: "0xA" "A"
968499-968539 usb_power_delivery: sym: "0xA" "A"
968218-968539 usb_power_delivery: crc: "CRC:aaed9191" "CRC"
968539-968580 usb_power_delivery: sym: "EOP" "#"
968539-968580 usb_power_delivery: eop: "EOP" "E"
967384-968580 usb_power_delivery: text: "#67   (403.076667ms): (r2) SRC[5]: GOOD CRC" "..."
969367-969880 usb_power_delivery: preamble: "Preamble" "..."
969880-969920 usb_power_delivery: sym: "SYNC-1" "S1"
969920-969960 usb_power_delivery: sym: "SYNC-1" "S1"
969960-970000 usb_power_delivery: sym: "SYNC-1" "S1"
970000-970040 usb_power_delivery: sym: "SYNC-2" "S2"
969880-970040 usb_power_delivery: sop: "SOP" "S"
970040-970081 usb_power_delivery: sym: "0xF" "F"
970081-970121 usb_power_delivery: sym: "0x6" "6"
970121-970161 usb_power_delivery: sym: "0x5" "5"
970161-970201 usb_power_delivery: sym: "0x2" "2"
970040-970201 usb_power_delivery: header: "H:256f" "HD"
969367-971206 usb_power_delivery: src: "(r2) SRC[2]: VDM" "VDM"
970201-970242 usb_power_delivery: sym: "0x1" "1"
970242-970282 usb_power_delivery: sym: "0x0" "0"
970282-970322 usb_power_delivery: sym: "0x1" "1"
970322-970362 usb_power_delivery: sym: "0x0" "0"
970362-970402 usb_power_delivery: sym: "0xC" "C"
970402-970442 usb_power_delivery: sym: "0xA" "A"
970442-970482 usb_power_delivery: sym: "0x5" "5"
970482-970523 usb_power_delivery: sym: "0x0" "0"
970201-970523 usb_power_delivery: data: "[0]05ac0101" "D0"
970201-970523 usb_power_delivery: payload: "[1] unstruct [0101] SVID:05ac" "[1] unstruct [0101] SVID:05ac"
970523-970563 usb_power_delivery: sym: "0x0" "0"
970563-970603 usb_power_delivery: sym: "0x0" "0"
970603-970643 usb_power_delivery: sym: "0x0" "0"
970643-970683 usb_power_delivery: sym: "0x0" "0"
970683-970724 usb_power_delivery: sym: "0x0" "0"
970724-970764 usb_power_delivery: sym: "0x0" "0"
970764-970804 usb_power_delivery: sym: "0x2" "2"
970804-970844 usb_power_delivery: sym: "0x0" "0"
970523-970844 usb_power_delivery: data: "[1]02000000" "D1"
970523-970844 usb_power_delivery: payload: "[2] VDO:02000000" "[2] VDO:02000000"
970844-970884 usb_power_delivery: sym: "0x4" "4"
970884-970925 usb_power_delivery: sym: "0x8" "8"
970925-970965 usb_power_delivery: sym: "0x4" "4"
970965-971005 usb_power_delivery: sym: "0xC" "C"
971005-971045 usb_power_delivery: sym: "0xD" "D"
971045-971085 usb_power_delivery: sym: "0xE" "E"
971085-971125 usb_power_delivery: sym: "0x9" "9"
971125-971165 usb_power_delivery: sym: "0x2" "2"
970844-971165 usb_power_delivery: crc: "CRC:29edc484" "CRC"
971165-971206 usb_power_delivery: sym: "EOP" "#"
971165-971206 usb_power_delivery: eop: "EOP" "E"
969367-971206 usb_power_delivery: text: "#68   (403.902917ms): (r2) SRC[2]: VDM - [1] unstruct [0101] SVID:05ac - [2] VDO:02000000" "..."
971452-971967 usb_power_delivery: preamble: "Preamble" "..."
971967-972008 usb_power_delivery: sym: "SYNC-1" "S1"
972008-972048 usb_power_delivery: sym: "SYNC-1" "S1"
972048-972088 usb_power_delivery: sym: "SYNC-1" "S1"
972088-972128 usb_power_delivery: sym: "SYNC-2" "S2"
971967-972128 usb_power_delivery: sop: "SOP" "S"
972128-972169 usb_power_delivery: sym: "0x1" "1"
972169-972209 usb_power_delivery: sym: "0x4" "4"
972209-972250 usb_power_delivery: sym: "0x4" "4"
972250-972290 usb_power_delivery: sym: "0x0" "0"
972128-972290 usb_power_delivery: header: "H:0441" "HD"
971452-972653 usb_power_delivery: snk: "(r2) SNK[2]: GOOD CRC" "GOOD CRC"
972290-972330 usb_power_delivery: sym: "0x2" "2"
972330-972371 usb_power_delivery: sym: "0xA" "A"
972371-972411 usb_power_delivery: sym: "0x8" "8"
972411-972451 usb_power_delivery: sym: "0xA" "A"
972451-972492 usb_power_delivery: sym: "0x6" "6"
972492-972532 usb_power_delivery: sym: "0xD" "D"
972532-972572 usb_power_delivery: sym: "0xF" "F"
972572-972613 usb_power_delivery: sym: "0xA" "A"
972290-972613 usb_power_delivery: crc: "CRC:afd6a8a2" "CRC"
972613-972653 usb_power_delivery: sym: "EOP" "#"
972613-972653 usb_power_delivery: eop: "EOP" "E"
971452-972653 usb_power_delivery: text: "#69   (404.771667ms): (r2) SNK[2]: GOOD CRC" "..."
973317-973832 usb_power_delivery: preamble: "Preamble" "..."
973832-973872 usb_power_delivery: sym: "SYNC-1" "S1"
973872-973912 usb_power_delivery: sym: "SYNC-1" "S1"
973912-973953 usb_power_delivery: sym: "SYNC-1" "S1"
973953-973993 usb_power_delivery: sym: "SYNC-2" "S2"
973832-973993 usb_power_delivery: sop: "SOP" "S"
973993-974034 usb_power_delivery: sym: "0xF" "F"
974034-974074 usb_power_delivery: sym: "0x4" "4"
974074-974114 usb_power_delivery: sym: "0xC" "C"
974114-974155 usb_power_delivery: sym: "0x2" "2"
973993-974155 usb_power_delivery: header: "H:2c4f" "HD"
973317-975163 usb_power_delivery: snk: "(r2) SNK[6]: VDM" "VDM"
974155-974195 usb_power_delivery: sym: "0x1" "1"
974195-974235 usb_power_delivery: sym: "0x2" "2"
974235-974276 usb_power_delivery: sym: "0x1" "1"
974276-974316 usb_power_delivery: sym: "0x0" "0"
974316-974356 usb_power_delivery: sym: "0xC" "C"
974356-974397 usb_power_delivery: sym: "0xA" "A"
974397-974437 usb_power_delivery: sym: "0x5" "5"
974437-974477 usb_power_delivery: sym: "0x0" "0"
974155-974477 usb_power_delivery: data: "[0]05ac0121" "D0"
974155-974477 usb_power_delivery: payload: "[1] unstruct [0121] SVID:05ac" "[1] unstruct [0121] SVID:05ac"
974477-974518 usb_power_delivery: sym: "0x0" "0"
974518-974558 usb_power_delivery: sym: "0x0" "0"
974558-974598 usb_power_delivery: sym: "0x0" "0"
974598-974639 usb_power_delivery: sym: "0x0" "0"
974639-974679 usb_power_delivery: sym: "0x0" "0"
974679-974719 usb_power_delivery: sym: "0x0" "0"
974719-974760 usb_power_delivery: sym: "0x0" "0"
974760-974800 usb_power_delivery: sym: "0x0" "0"
974477-974800 usb_power_delivery: data: "[1]00000000" "D1"
974477-974800 usb_power_delivery: payload: "[2] VDO:00000000" "[2] VDO:00000000"
974800-974840 usb_power_delivery: sym: "0x5" "5"
974840-974881 usb_power_delivery: sym: "0x7" "7"
974881-974921 usb_power_delivery: sym: "0x2" "2"
974921-974962 usb_power_delivery: sym: "0x7" "7"
974962-975002 usb_power_delivery: sym: "0xB" "B"
975002-975042 usb_power_delivery: sym: "0x6" "6"
975042-975083 usb_power_delivery: sym: "0xD" "D"
975083-975123 usb_power_delivery: sym: "0xD" "D"
974800-975123 usb_power_delivery: crc: "CRC:dd6b7275" "CRC"
975123-975163 usb_power_delivery: sym: "EOP" "#"
975123-975163 usb_power_delivery: eop: "EOP" "E"
973317-975163 usb_power_delivery: text: "#70   (405.548750ms): (r2) SNK[6]: VDM - [1] unstruct [0121] SVID:05ac - [2] VDO:00000000" "..."
975391-975904 usb_power_delivery: preamble: "Preamble" "..."
975904-975944 usb_power_delivery: sym: "SYNC-1" "S1"
975944-975984 usb_power_delivery: sym: "SYNC-1" "S1"
975984-976025 usb_power_delivery: sym: "SYNC-1" "S1"
976025-976065 usb_power_delivery: sym: "SYNC-2" "S2"
975904-976065 usb_power_delivery: sop: "SOP" "S"
976065-976105 usb_power_delivery: sym: "0x1" "1"
976105-976145 usb_power_delivery: sym: "0x6" "6"
976145-976185 usb_power_delivery: sym: "0xD" "D"
976185-976226 usb_power_delivery: sym: "0x0" "0"
976065-976226 usb_power_delivery: header: "H:0d61" "HD"
975391-976595 usb_power_delivery: src: "(r2) SRC[6]: GOOD CRC" "GOOD CRC"
976226-976266 usb_power_delivery: sym: "0x4" "4"
976266-976306 usb_power_delivery: sym: "0xA" "A"
976306-976346 usb_power_delivery: sym: "0x4" "4"
976346-976386 usb_power_delivery: sym: "0x3" "3"
976386-976427 usb_power_delivery: sym: "0xE" "E"
976427-976467 usb_power_delivery: sym: "0x8" "8"
976467-976507 usb_power_delivery: sym: "0x3" "3"
976507-976547 usb_power_delivery: sym: "0x4" "4"
976226-976547 usb_power_delivery: crc: "CRC:438e34a4" "CRC"
976547-976587 usb_power_delivery: sym: "EOP" "#"
976547-976587 usb_power_delivery: eop: "EOP" "E"
975391-976587 usb_power_delivery: text: "#71   (406.412917ms): (r2) SRC[6]: GOOD CRC" "..."
977206-977719 usb_power_delivery: preamble: "Preamble" "..."
977719-977759 usb_power_delivery: sym: "SYNC-1" "S1"
977759-977799 usb_power_delivery: sym: "SYNC-1" "S1"
977799-977839 usb_power_delivery: sym: "SYNC-1" "S1"
977839-977879 usb_power_delivery: sym: "SYNC-2" "S2"
977719-977879 usb_power_delivery: sop: "SOP" "S"
977879-977920 usb_power_delivery: sym: "0xF" "F"
977920-977960 usb_power_delivery: sym: "0x6" "6"
977960-978000 usb_power_delivery: sym: "0x7" "7"
978000-978040 usb_power_delivery: sym: "0x2" "2"
977879-978040 usb_power_delivery: header: "H:276f" "HD"
977206-979053 usb_power_delivery: src: "(r2) SRC[3]: VDM" "VDM"
978040-978080 usb_power_delivery: sym: "0x1" "1"
978080-978121 usb_power_delivery: sym: "0x0" "0"
978121-978161 usb_power_delivery: sym: "0x1" "1"
978161-978201 usb_power_delivery: sym: "0x0" "0"
978201-978241 usb_power_delivery: sym: "0xC" "C"
978241-978281 usb_power_delivery: sym: "0xA" "A"
978281-978321 usb_power_delivery: sym: "0x5" "5"
978321-978362 usb_power_delivery: sym: "0x0" "0"
978040-978362 usb_power_delivery: data: "[0]05ac0101" "D0"
978040-978362 usb_power_delivery: payload: "[1] unstruct [0101] SVID:05ac" "[1] unstruct [0101] SVID:05ac"
978362-978402 usb_power_delivery: sym: "0x4" "4"
978402-978442 usb_power_delivery: sym: "0x0" "0"
978442-978482 usb_power_delivery: sym: "0x0" "0"
978482-978522 usb_power_delivery: sym: "0x0" "0"
978522-978563 usb_power_delivery: sym: "0x0" "0"
978563-978603 usb_power_delivery: sym: "0x0" "0"
978603-978643 usb_power_delivery: sym: "0x2" "2"
978643-978683 usb_power_delivery: sym: "0x0" "0"
978362-978683 usb_power_delivery: data: "[1]02000004" "D1"
978362-978683 usb_power_delivery: payload: "[2] VDO:02000004" "[2] VDO:02000004"
978683-978723 usb_power_delivery: sym: "0x5" "5"
978723-978764 usb_power_delivery: sym: "0x5" "5"
978764-978804 usb_power_delivery: sym: "0xB" "B"
978804-978844 usb_power_delivery: sym: "0x7" "7"
978844-978884 usb_power_delivery: sym: "0x9" "9"
978884-978924 usb_power_delivery: sym: "0x7" "7"
978924-978964 usb_power_delivery: sym: "0x8" "8"
978964-979005 usb_power_delivery: sym: "0x8" "8"
978683-979005 usb_power_delivery: crc: "CRC:88797b55" "CRC"
979005-979045 usb_power_delivery: sym: "EOP" "#"
979005-979045 usb_power_delivery: eop: "EOP" "E"
977206-979045 usb_power_delivery: text: "#72   (407.169167ms): (r2) SRC[3]: VDM - [1] unstruct [0101] SVID:05ac - [2] VDO:02000004" "..."
979313-979828 usb_power_delivery: preamble: "Preamble" "..."
979828-979869 usb_power_delivery: sym: "SYNC-1" "S1"
979869-979909 usb_power_delivery: sym: "SYNC-1" "S1"
979909-979950 usb_power_delivery: sym: "SYNC-1" "S1"
979950-979990 usb_power_delivery: sym: "SYNC-2" "S2"
979828-979990 usb_power_delivery: sop: "SOP" "S"
979990-980030 usb_power_delivery: sym: "0x1" "1"
980030-980070 usb_power_delivery: sym: "0x4" "4"
980070-980111 usb_power_delivery: sym: "0x6" "6"
980111-980151 usb_power_delivery: sym: "0x0" "0"
979990-980151 usb_power_delivery: header: "H:0641" "HD"
979313-980514 usb_power_delivery: snk: "(r2) SNK[3]: GOOD CRC" "GOOD CRC"
980151-980192 usb_power_delivery: sym: "0xE" "E"
980192-980232 usb_power_delivery: sym: "0x8" "8"
980232-980272 usb_power_delivery: sym: "0x9" "9"
980272-980313 usb_power_delivery: sym: "0xC" "C"
980313-980353 usb_power_delivery: sym: "0x8" "8"
980353-980393 usb_power_delivery: sym: "0xD" "D"
980393-980434 usb_power_delivery: sym: "0x1" "1"
980434-980474 usb_power_delivery: sym: "0x4" "4"
980151-980474 usb_power_delivery: crc: "CRC:41d8c98e" "CRC"
980474-980514 usb_power_delivery: sym: "EOP" "#"
980474-980514 usb_power_delivery: eop: "EOP" "E"
979313-980514 usb_power_delivery: text: "#73   (408.047083ms): (r2) SNK[3]: GOOD CRC" "..."
981350-981865 usb_power_delivery: preamble: "Preamble" "..."
981865-981906 usb_power_delivery: sym: "SYNC-1" "S1"
981906-981946 usb_power_delivery: sym: "SYNC-1" "S1"
981946-981986 usb_power_delivery: sym: "SYNC-1" "S1"
981986-982027 usb_power_delivery: sym: "SYNC-2" "S2"
981865-982027 usb_power_delivery: sop: "SOP" "S"
982027-982067 usb_power_delivery: sym: "0xF" "F"
982067-982107 usb_power_delivery: sym: "0x4" "4"
982107-982148 usb_power_delivery: sym: "0xE" "E"
982148-982188 usb_power_delivery: sym: "0x2" "2"
982027-982188 usb_power_delivery: header: "H:2e4f" "HD"
981350-983205 usb_power_delivery: snk: "(r2) SNK[7]: VDM" "VDM"
982188-982228 usb_power_delivery: sym: "0x1" "1"
982228-982269 usb_power_delivery: sym: "0x2" "2"
982269-982309 usb_power_delivery: sym: "0x1" "1"
982309-982349 usb_power_delivery: sym: "0x0" "0"
982349-982390 usb_power_delivery: sym: "0xC" "C"
982390-982430 usb_power_delivery: sym: "0xA" "A"
982430-982471 usb_power_delivery: sym: "0x5" "5"
982471-982511 usb_power_delivery: sym: "0x0" "0"
982188-982511 usb_power_delivery: data: "[0]05ac0121" "D0"
982188-982511 usb_power_delivery: payload: "[1] unstruct [0121] SVID:05ac" "[1] unstruct [0121] SVID:05ac"
982511-982551 usb_power_delivery: sym: "0x0" "0"
982551-982591 usb_power_delivery: sym: "0x0" "0"
982591-982632 usb_power_delivery: sym: "0x0" "0"
982632-982672 usb_power_delivery: sym: "0x0" "0"
982672-982713 usb_power_delivery: sym: "0x0" "0"
982713-982753 usb_power_delivery: sym: "0x0" "0"
982753-982793 usb_power_delivery: sym: "0x0" "0"
982793-982834 usb_power_delivery: sym: "0x0" "0"
982511-982834 usb_power_delivery: data: "[1]00000000" "D1"
982511-982834 usb_power_delivery: payload: "[2] VDO:00000000" "[2] VDO:00000000"
982834-982874 usb_power_delivery: sym: "0x3" "3"
982874-982915 usb_power_delivery: sym: "0xF" "F"
982915-982955 usb_power_delivery: sym: "0xA" "A"
982955-982995 usb_power_delivery: sym: "0x5" "5"
982995-983035 usb_power_delivery: sym: "0xD" "D"
983035-983076 usb_power_delivery: sym: "0x9" "9"
983076-983116 usb_power_delivery: sym: "0x3" "3"
983116-983157 usb_power_delivery: sym: "0xF" "F"
982834-983157 usb_power_delivery: crc: "CRC:f39d5af3" "CRC"
983157-983197 usb_power_delivery: sym: "EOP" "#"
983157-983197 usb_power_delivery: eop: "EOP" "E"
981350-983197 usb_power_delivery: text: "#74   (408.895833ms): (r2) SNK[7]: VDM - [1] unstruct [0121] SVID:05ac - [2] VDO:00000000" "..."
983433-983946 usb_power_delivery: preamble: "Preamble" "..."
983946-983986 usb_power_delivery: sym: "SYNC-1" "S1"
983986-984026 usb_power_delivery: sym: "SYNC-1" "S1"
984026-984066 usb_power_delivery: sym: "SYNC-1" "S1"
984066-984107 usb_power_delivery: sym: "SYNC-2" "S2"
983946-984107 usb_power_delivery: sop: "SOP" "S"
984107-984147 usb_power_delivery: sym: "0x1" "1"
984147-984187 usb_power_delivery: sym: "0x6" "6"
984187-984227 usb_power_delivery: sym: "0xF" "F"
984227-984267 usb_power_delivery: sym: "0x0" "0"
984107-984267 usb_power_delivery: header: "H:0f61" "HD"
983433-984629 usb_power_delivery: src: "(r2) SRC[7]: GOOD CRC" "GOOD CRC"
984267-984308 usb_power_delivery: sym: "0x8" "8"
984308-984348 usb_power_delivery: sym: "0x8" "8"
984348-984388 usb_power_delivery: sym: "0x5" "5"
984388-984428 usb_power_delivery: sym: "0x5" "5"
984428-984468 usb_power_delivery: sym: "0x0" "0"
984468-984509 usb_power_delivery: sym: "0x8" "8"
984509-984549 usb_power_delivery: sym: "0xD" "D"
984549-984589 usb_power_delivery: sym: "0xA" "A"
984267-984589 usb_power_delivery: crc: "CRC:ad805588" "CRC"
984589-984629 usb_power_delivery: sym: "EOP" "#"
984589-984629 usb_power_delivery: eop: "EOP" "E"
983433-984629 usb_power_delivery: text: "#75   (409.763750ms): (r2) SRC[7]: GOOD CRC" "..."
985427-985939 usb_power_delivery: preamble: "Preamble" "..."
985939-985980 usb_power_delivery: sym: "SYNC-1" "S1"
985980-986020 usb_power_delivery: sym: "SYNC-1" "S1"
986020-986060 usb_power_delivery: sym: "SYNC-1" "S1"
986060-986100 usb_power_delivery: sym: "SYNC-2" "S2"
985939-986100 usb_power_delivery: sop: "SOP" "S"
986100-986140 usb_power_delivery: sym: "0xF" "F"
986140-986181 usb_power_delivery: sym: "0x6" "6"
986181-986221 usb_power_delivery: sym: "0x9" "9"
986221-986261 usb_power_delivery: sym: "0x1" "1"
986100-986261 usb_power_delivery: header: "H:196f" "HD"
985427-986944 usb_power_delivery: src: "(r2) SRC[4]: VDM" "VDM"
986261-986301 usb_power_delivery: sym: "0x5" "5"
986301-986341 usb_power_delivery: sym: "0x0" "0"
986341-986381 usb_power_delivery: sym: "0x0" "0"
986381-986422 usb_power_delivery: sym: "0x0" "0"
986422-986462 usb_power_delivery: sym: "0xC" "C"
986462-986502 usb_power_delivery: sym: "0xA" "A"
986502-986542 usb_power_delivery: sym: "0x5" "5"
986542-986582 usb_power_delivery: sym: "0x0" "0"
986261-986582 usb_power_delivery: data: "[0]05ac0005" "D0"
986261-986582 usb_power_delivery: payload: "[1] unstruct [0005] SVID:05ac" "[1] unstruct [0005] SVID:05ac"
986582-986623 usb_power_delivery: sym: "0x7" "7"
986623-986663 usb_power_delivery: sym: "0x8" "8"
986663-986703 usb_power_delivery: sym: "0xE" "E"
986703-986743 usb_power_delivery: sym: "0x1" "1"
986743-986783 usb_power_delivery: sym: "0x6" "6"
986783-986823 usb_power_delivery: sym: "0x9" "9"
986823-986864 usb_power_delivery: sym: "0x0" "0"
986864-986904 usb_power_delivery: sym: "0x6" "6"
986582-986904 usb_power_delivery: crc: "CRC:60961e87" "CRC"
986904-986944 usb_power_delivery: sym: "EOP" "#"
986904-986944 usb_power_delivery: eop: "EOP" "E"
985427-986944 usb_power_delivery: text: "#76   (410.594583ms): (r2) SRC[4]: VDM - [1] unstruct [0005] SVID:05ac" "..."
987175-987690 usb_power_delivery: preamble: "Preamble" "..."
987690-987730 usb_power_delivery: sym: "SYNC-1" "S1"
987730-987770 usb_power_delivery: sym: "SYNC-1" "S1"
987770-987811 usb_power_delivery: sym: "SYNC-1" "S1"
987811-987851 usb_power_delivery: sym: "SYNC-2" "S2"
987690-987851 usb_power_delivery: sop: "SOP" "S"
987851-987892 usb_power_delivery: sym: "0x1" "1"
987892-987932 usb_power_delivery: sym: "0x4" "4"
987932-987972 usb_power_delivery: sym: "0x8" "8"
987972-988012 usb_power_delivery: sym: "0x0" "0"
987851-988012 usb_power_delivery: header: "H:0841" "HD"
987175-988384 usb_power_delivery: snk: "(r2) SNK[4]: GOOD CRC" "GOOD CRC"
988012-988053 usb_power_delivery: sym: "0x9" "9"
988053-988093 usb_power_delivery: sym: "0x8" "8"
988093-988134 usb_power_delivery: sym: "0x4" "4"
988134-988174 usb_power_delivery: sym: "0xE" "E"
988174-988214 usb_power_delivery: sym: "0x0" "0"
988214-988255 usb_power_delivery: sym: "0x6" "6"
988255-988295 usb_power_delivery: sym: "0x6" "6"
988295-988336 usb_power_delivery: sym: "0xA" "A"
988012-988336 usb_power_delivery: crc: "CRC:a660e489" "CRC"
988336-988376 usb_power_delivery: sym: "EOP" "#"
988336-988376 usb_power_delivery: eop: "EOP" "E"
987175-988376 usb_power_delivery: text: "#77   (411.322917ms): (r2) SNK[4]: GOOD CRC" "..."
988981-989496 usb_power_delivery: preamble: "Preamble" "..."
989496-989536 usb_power_delivery: sym: "SYNC-1" "S1"
989536-989576 usb_power_delivery: sym: "SYNC-1" "S1"
989576-989617 usb_power_delivery: sym: "SYNC-1" "S1"
989617-989657 usb_power_delivery: sym: "SYNC-2" "S2"
989496-989657 usb_power_delivery: sop: "SOP" "S"
989657-989698 usb_power_delivery: sym: "0xF" "F"
989698-989738 usb_power_delivery: sym: "0x4" "4"
989738-989778 usb_power_delivery: sym: "0x0" "0"
989778-989818 usb_power_delivery: sym: "0x1" "1"
989657-989818 usb_power_delivery: header: "H:104f" "HD"
988981-990504 usb_power_delivery: snk: "(r2) SNK[0]: VDM" "VDM"
989818-989859 usb_power_delivery: sym: "0x5" "5"
989859-989899 usb_power_delivery: sym: "0x1" "1"
989899-989939 usb_power_delivery: sym: "0x0" "0"
989939-989980 usb_power_delivery: sym: "0x0" "0"
989980-990020 usb_power_delivery: sym: "0xC" "C"
990020-990061 usb_power_delivery: sym: "0xA" "A"
990061-990101 usb_power_delivery: sym: "0x5" "5"
990101-990141 usb_power_delivery: sym: "0x0" "0"
989818-990141 usb_power_delivery: data: "[0]05ac0015" "D0"
989818-990141 usb_power_delivery: payload: "[1] unstruct [0015] SVID:05ac" "[1] unstruct [0015] SVID:05ac"
990141-990182 usb_power_delivery: sym: "0xF" "F"
990182-990222 usb_power_delivery: sym: "0x5" "5"
990222-990262 usb_power_delivery: sym: "0xE" "E"
990262-990303 usb_power_delivery: sym: "0x2" "2"
990303-990343 usb_power_delivery: sym: "0x3" "3"
990343-990383 usb_power_delivery: sym: "0x3" "3"
990383-990424 usb_power_delivery: sym: "0xA" "A"
990424-990464 usb_power_delivery: sym: "0x3" "3"
990141-990464 usb_power_delivery: crc: "CRC:3a332e5f" "CRC"
990464-990504 usb_power_delivery: sym: "EOP" "#"
990464-990504 usb_power_delivery: eop: "EOP" "E"
988981-990504 usb_power_delivery: text: "#78   (412.075417ms): (r2) SNK[0]: VDM - [1] unstruct [0015] SVID:05ac" "..."
990736-991249 usb_power_delivery: preamble: "Preamble" "..."
991249-991289 usb_power_delivery: sym: "SYNC-1" "S1"
991289-991329 usb_power_delivery: sym: "SYNC-1" "S1"
991329-991369 usb_power_delivery: sym: "SYNC-1" "S1"
991369-991409 usb_power_delivery: sym: "SYNC-2" "S2"
991249-991409 usb_power_delivery: sop: "SOP" "S"
991409-991450 usb_power_delivery: sym: "0x1" "1"
991450-991490 usb_power_delivery: sym: "0x6" "6"
991490-991530 usb_power_delivery: sym: "0x1" "1"
991530-991570 usb_power_delivery: sym: "0x0" "0"
991409-991570 usb_power_delivery: header: "H:0161" "HD"
990736-991940 usb_power_delivery: src: "(r2) SRC[0]: GOOD CRC" "GOOD CRC"
991570-991610 usb_power_delivery: sym: "0xF" "F"
991610-991651 usb_power_delivery: sym: "0x8" "8"
991651-991691 usb_power_delivery: sym: "0x8" "8"
991691-991731 usb_power_delivery: sym: "0x7" "7"
991731-991771 usb_power_delivery: sym: "0x8" "8"
991771-991811 usb_power_delivery: sym: "0x3" "3"
991811-991851 usb_power_delivery: sym: "0xA" "A"
991851-991892 usb_power_delivery: sym: "0x4" "4"
991570-991892 usb_power_delivery: crc: "CRC:4a38788f" "CRC"
991892-991932 usb_power_delivery: sym: "EOP" "#"
991892-991932 usb_power_delivery: eop: "EOP" "E"
990736-991932 usb_power_delivery: text: "#79   (412.806667ms): (r2) SRC[0]: GOOD CRC" "..."
1513286-1513801 usb_power_delivery: preamble: "Preamble" "..."
1513801-1513842 usb_power_delivery: sym: "SYNC-1" "S1"
1513842-1513882 usb_power_delivery: sym: "SYNC-1" "S1"
1513882-1513922 usb_power_delivery: sym: "SYNC-1" "S1"
1513922-1513963 usb_power_delivery: sym: "SYNC-2" "S2"
1513801-1513963 usb_power_delivery: sop: "SOP" "S"
1513963-1514003 usb_power_delivery: sym: "0xF" "F"
1514003-1514043 usb_power_delivery: sym: "0x4" "4"
1514043-1514084 usb_power_delivery: sym: "0x2" "2"
1514084-1514124 usb_power_delivery: sym: "0x2" "2"
1513963-1514124 usb_power_delivery: header: "H:224f" "HD"
1513286-1515141 usb_power_delivery: snk: "(r2) SNK[1]: VDM" "VDM"
1514124-1514164 usb_power_delivery: sym: "0x6" "6"
1514164-1514205 usb_power_delivery: sym: "0x0" "0"
1514205-1514245 usb_power_delivery: sym: "0x1" "1"
1514245-1514286 usb_power_delivery: sym: "0x8" "8"
1514286-1514326 usb_power_delivery: sym: "0x1" "1"
1514326-1514366 usb_power_delivery: sym: "0x0" "0"
1514366-1514407 usb_power_delivery: sym: "0xF" "F"
1514407-1514447 usb_power_delivery: sym: "0xF" "F"
1514124-1514447 usb_power_delivery: data: "[0]ff018106" "D0"
1514124-1514447 usb_power_delivery: payload: "[1] REQ Attention pos 1 SVID:ff01" "[1] REQ Attention pos 1 SVID:ff01"
1514447-1514488 usb_power_delivery: sym: "0xA" "A"
1514488-1514528 usb_power_delivery: sym: "0x9" "9"
1514528-1514568 usb_power_delivery: sym: "0x0" "0"
1514568-1514609 usb_power_delivery: sym: "0x0" "0"
1514609-1514649 usb_power_delivery: sym: "0x0" "0"
1514649-1514689 usb_power_delivery: sym: "0x0" "0"
1514689-1514729 usb_power_delivery: sym: "0x0" "0"
1514729-1514770 usb_power_delivery: sym: "0x0" "0"
1514447-1514770 usb_power_delivery: data: "[1]0000009a" "D1"
1514447-1514770 usb_power_delivery: payload: "[2] VDO:0000009a" "[2] VDO:0000009a"
1514770-1514810 usb_power_delivery: sym: "0x6" "6"
1514810-1514851 usb_power_delivery: sym: "0x5" "5"
1514851-1514891 usb_power_delivery: sym: "0x3" "3"
1514891-1514932 usb_power_delivery: sym: "0x6" "6"
1514932-1514972 usb_power_delivery: sym: "0x7" "7"
1514972-1515012 usb_power_delivery: sym: "0xF" "F"
1515012-1515052 usb_power_delivery: sym: "0xB" "B"
1515052-1515093 usb_power_delivery: sym: "0x1" "1"
1514770-1515093 usb_power_delivery: crc: "CRC:1bf76356" "CRC"
1515093-1515133 usb_power_delivery: sym: "EOP" "#"
1515093-1515133 usb_power_delivery: eop: "EOP" "E"
1513286-1515133 usb_power_delivery: text: "#80   (630.535833ms): (r2) SNK[1]: VDM - [1] REQ Attention pos 1 SVID:ff01 - [2] VDO:0000009a" "..."
1515401-1515914 usb_power_delivery: preamble: "Preamble" "..."
1515914-1515954 usb_power_delivery: sym: "SYNC-1" "S1"
1515954-1515994 usb_power_delivery: sym: "SYNC-1" "S1"
1515994-1516034 usb_power_delivery: sym: "SYNC-1" "S1"
1516034-1516074 usb_power_delivery: sym: "SYNC-2" "S2"
1515914-1516074 usb_power_delivery: sop: "SOP" "S"
1516074-1516115 usb_power_delivery: sym: "0x1" "1"
1516115-1516155 usb_power_delivery: sym: "0x6" "6"
1516155-1516195 usb_power_delivery: sym: "0x3" "3"
1516195-1516235 usb_power_delivery: sym: "0x0" "0"
1516074-1516235 usb_power_delivery: header: "H:0361" "HD"
1515401-1516597 usb_power_delivery: src: "(r2) SRC[1]: GOOD CRC" "GOOD CRC"
1516235-1516275 usb_power_delivery: sym: "0x3" "3"
1516275-1516315 usb_power_delivery: sym: "0xA" "A"
1516315-1516356 usb_power_delivery: sym: "0x9" "9"
1516356-1516396 usb_power_delivery: sym: "0x1" "1"
1516396-1516436 usb_power_delivery: sym: "0x6" "6"
1516436-1516476 usb_power_delivery: sym: "0x3" "3"
1516476-1516516 usb_power_delivery: sym: "0x4" "4"
1516516-1516556 usb_power_delivery: sym: "0xA" "A"
1516235-1516556 usb_power_delivery: crc: "CRC:a43619a3" "CRC"
1516556-1516597 usb_power_delivery: sym: "EOP" "#"
1516556-1516597 usb_power_delivery: eop: "EOP" "E"
1515401-1516597 usb_power_delivery: text: "#81   (631.417083ms): (r2) SRC[1]: GOOD CRC" "..."
1966996-1967511 usb_power_delivery: preamble: "Preamble" "..."
1967511-1967552 usb_power_delivery: sym: "SYNC-1" "S1"
1967552-1967592 usb_power_delivery: sym: "SYNC-1" "S1"
1967592-1967632 usb_power_delivery: sym: "SYNC-1" "S1"
1967632-1967672 usb_power_delivery: sym: "SYNC-2" "S2"
1967511-1967672 usb_power_delivery: sop: "SOP" "S"
1967672-1967713 usb_power_delivery: sym: "0xF" "F"
1967713-1967753 usb_power_delivery: sym: "0x4" "4"
1967753-1967794 usb_power_delivery: sym: "0x4" "4"
1967794-1967834 usb_power_delivery: sym: "0x2" "2"
1967672-1967834 usb_power_delivery: header: "H:244f" "HD"
1966996-1968843 usb_power_delivery: snk: "(r2) SNK[2]: VDM" "VDM"
1967834-1967874 usb_power_delivery: sym: "0x6" "6"
1967874-1967915 usb_power_delivery: sym: "0x0" "0"
1967915-1967955 usb_power_delivery: sym: "0x1" "1"
1967955-1967996 usb_power_delivery: sym: "0x8" "8"
1967996-1968036 usb_power_delivery: sym: "0x1" "1"
1968036-1968076 usb_power_delivery: sym: "0x0" "0"
1968076-1968116 usb_power_delivery: sym: "0xF" "F"
1968116-1968157 usb_power_delivery: sym: "0xF" "F"
1967834-1968157 usb_power_delivery: data: "[0]ff018106" "D0"
1967834-1968157 usb_power_delivery: payload: "[1] REQ Attention pos 1 SVID:ff01" "[1] REQ Attention pos 1 SVID:ff01"
1968157-1968197 usb_power_delivery: sym: "0xA" "A"
1968197-1968238 usb_power_delivery: sym: "0x9" "9"
1968238-1968278 usb_power_delivery: sym: "0x1" "1"
1968278-1968318 usb_power_delivery: sym: "0x0" "0"
1968318-1968359 usb_power_delivery: sym: "0x0" "0"
1968359-1968399 usb_power_delivery: sym: "0x0" "0"
1968399-1968439 usb_power_delivery: sym: "0x0" "0"
1968439-1968480 usb_power_delivery: sym: "0x0" "0"
1968157-1968480 usb_power_delivery: data: "[1]0000019a" "D1"
1968157-1968480 usb_power_delivery: payload: "[2] VDO:0000019a" "[2] VDO:0000019a"
1968480-1968520 usb_power_delivery: sym: "0xB" "B"
1968520-1968560 usb_power_delivery: sym: "0xE" "E"
1968560-1968601 usb_power_delivery: sym: "0x0" "0"
1968601-1968641 usb_power_delivery: sym: "0x7" "7"
1968641-1968682 usb_power_delivery: sym: "0xF" "F"
1968682-1968722 usb_power_delivery: sym: "0x2" "2"
1968722-1968762 usb_power_delivery: sym: "0x9" "9"
1968762-1968802 usb_power_delivery: sym: "0x6" "6"
1968480-1968802 usb_power_delivery: crc: "CRC:692f70eb" "CRC"
1968802-1968843 usb_power_delivery: sym: "EOP" "#"
1968802-1968843 usb_power_delivery: eop: "EOP" "E"
1966996-1968843 usb_power_delivery: text: "#82   (819.581667ms): (r2) SNK[2]: VDM - [1] REQ Attention pos 1 SVID:ff01 - [2] VDO:0000019a" "..."
1969103-1969615 usb_power_delivery: preamble: "Preamble" "..."
1969615-1969655 usb_power_delivery: sym: "SYNC-1" "S1"
1969655-1969695 usb_power_delivery: sym: "SYNC-1" "S1"
1969695-1969736 usb_power_delivery: sym: "SYNC-1" "S1"
1969736-1969776 usb_power_delivery: sym: "SYNC-2" "S2"
1969615-1969776 usb_power_delivery: sop: "SOP" "S"
1969776-1969816 usb_power_delivery: sym: "0x1" "1"
1969816-1969856 usb_power_delivery: sym: "0x6" "6"
1969856-1969896 usb_power_delivery: sym: "0x5" "5"
1969896-1969936 usb_power_delivery: sym: "0x0" "0"
1969776-1969936 usb_power_delivery: header: "H:0561" "HD"
1969103-1970306 usb_power_delivery: src: "(r2) SRC[2]: GOOD CRC" "GOOD CRC"
1969936-1969977 usb_power_delivery: sym: "0x6" "6"
1969977-1970017 usb_power_delivery: sym: "0x9" "9"
1970017-1970057 usb_power_delivery: sym: "0xC" "C"
1970057-1970097 usb_power_delivery: sym: "0xB" "B"
1970097-1970137 usb_power_delivery: sym: "0x5" "5"
1970137-1970178 usb_power_delivery: sym: "0x5" "5"
1970178-1970218 usb_power_delivery: sym: "0xD" "D"
1970218-1970258 usb_power_delivery: sym: "0x4" "4"
1969936-1970258 usb_power_delivery: crc: "CRC:4d55bc96" "CRC"
1970258-1970298 usb_power_delivery: sym: "EOP" "#"
1970258-1970298 usb_power_delivery: eop: "EOP" "E"
1969103-1970298 usb_power_delivery: text: "#83   (820.459583ms): (r2) SRC[2]: GOOD CRC" "..."
1977881-1978396 usb_power_delivery: preamble: "Preamble" "..."
1978396-1978436 usb_power_delivery: sym: "SYNC-1" "S1"
1978436-1978476 usb_power_delivery: sym: "SYNC-1" "S1"
1978476-1978517 usb_power_delivery: sym: "SYNC-1" "S1"
1978517-1978557 usb_power_delivery: sym: "SYNC-2" "S2"
1978396-1978557 usb_power_delivery: sop: "SOP" "S"
1978557-1978597 usb_power_delivery: sym: "0xF" "F"
1978597-1978638 usb_power_delivery: sym: "0x4" "4"
1978638-1978678 usb_power_delivery: sym: "0x6" "6"
1978678-1978719 usb_power_delivery: sym: "0x2" "2"
1978557-1978719 usb_power_delivery: header: "H:264f" "HD"
1977881-1979735 usb_power_delivery: snk: "(r2) SNK[3]: VDM" "VDM"
1978719-1978759 usb_power_delivery: sym: "0x6" "6"
1978759-1978799 usb_power_delivery: sym: "0x0" "0"
1978799-1978840 usb_power_delivery: sym: "0x1" "1"
1978840-1978880 usb_power_delivery: sym: "0x8" "8"
1978880-1978920 usb_power_delivery: sym: "0x1" "1"
1978920-1978960 usb_power_delivery: sym: "0x0" "0"
1978960-1979001 usb_power_delivery: sym: "0xF" "F"
1979001-1979041 usb_power_delivery: sym: "0xF" "F"
1978719-1979041 usb_power_delivery: data: "[0]ff018106" "D0"
1978719-1979041 usb_power_delivery: payload: "[1] REQ Attention pos 1 SVID:ff01" "[1] REQ Attention pos 1 SVID:ff01"
1979041-1979081 usb_power_delivery: sym: "0xA" "A"
1979081-1979122 usb_power_delivery: sym: "0x9" "9"
1979122-1979162 usb_power_delivery: sym: "0x1" "1"
1979162-1979202 usb_power_delivery: sym: "0x0" "0"
1979202-1979243 usb_power_delivery: sym: "0x0" "0"
1979243-1979283 usb_power_delivery: sym: "0x0" "0"
1979283-1979324 usb_power_delivery: sym: "0x0" "0"
1979324-1979364 usb_power_delivery: sym: "0x0" "0"
1979041-1979364 usb_power_delivery: data: "[1]0000019a" "D1"
1979041-1979364 usb_power_delivery: payload: "[2] VDO:0000019a" "[2] VDO:0000019a"
1979364-1979404 usb_power_delivery: sym: "0xD" "D"
1979404-1979445 usb_power_delivery: sym: "0x6" "6"
1979445-1979485 usb_power_delivery: sym: "0x8" "8"
1979485-1979525 usb_power_delivery: sym: "0x5" "5"
1979525-1979566 usb_power_delivery: sym: "0x9" "9"
1979566-1979606 usb_power_delivery: sym: "0xD" "D"
1979606-1979646 usb_power_delivery: sym: "0x7" "7"
1979646-1979687 usb_power_delivery: sym: "0x4" "4"
1979364-1979687 usb_power_delivery: crc: "CRC:47d9586d" "CRC"
1979687-1979727 usb_power_delivery: sym: "EOP" "#"
1979687-1979727 usb_power_delivery: eop: "EOP" "E"
1977881-1979727 usb_power_delivery: text: "#84   (824.117083ms): (r2) SNK[3]: VDM - [1] REQ Attention pos 1 SVID:ff01 - [2] VDO:0000019a" "..."
1979995-1980507 usb_power_delivery: preamble: "Preamble" "..."
1980507-1980548 usb_power_delivery: sym: "SYNC-1" "S1"
1980548-1980588 usb_power_delivery: sym: "SYNC-1" "S1"
1980588-1980628 usb_power_delivery: sym: "SYNC-1" "S1"
1980628-1980668 usb_power_delivery: sym: "SYNC-2" "S2"
1980507-1980668 usb_power_delivery: sop: "SOP" "S"
1980668-1980708 usb_power_delivery: sym: "0x1" "1"
1980708-1980749 usb_power_delivery: sym: "0x6" "6"
1980749-1980789 usb_power_delivery: sym: "0x7" "7"
1980789-1980829 usb_power_delivery: sym: "0x0" "0"
1980668-1980829 usb_power_delivery: header: "H:0761" "HD"
1979995-1981198 usb_power_delivery: src: "(r2) SRC[3]: GOOD CRC" "GOOD CRC"
1980829-1980869 usb_power_delivery: sym: "0xA" "A"
1980869-1980909 usb_power_delivery: sym: "0xB" "B"
1980909-1980949 usb_power_delivery: sym: "0xD" "D"
1980949-1980989 usb_power_delivery: sym: "0xD" "D"
1980989-1981030 usb_power_delivery: sym: "0xB" "B"
1981030-1981070 usb_power_delivery: sym: "0x5" "5"
1981070-1981110 usb_power_delivery: sym: "0x3" "3"
1981110-1981150 usb_power_delivery: sym: "0xA" "A"
1980829-1981150 usb_power_delivery: crc: "CRC:a35bddba" "CRC"
1981150-1981190 usb_power_delivery: sym: "EOP" "#"
1981150-1981190 usb_power_delivery: eop: "EOP" "E"
1979995-1981190 usb_power_delivery: text: "#85   (824.997917ms): (r2) SRC[3]: GOOD CRC" "..."
