4301977-4302499 usb_power_delivery: preamble: "Preamble" "..."
4302499-4302540 usb_power_delivery: sym: "SYNC-1" "S1"
4302540-4302580 usb_power_delivery: sym: "SYNC-1" "S1"
4302580-4302621 usb_power_delivery: sym: "SYNC-1" "S1"
4302621-4302662 usb_power_delivery: sym: "SYNC-2" "S2"
4302499-4302662 usb_power_delivery: sop: "SOP" "S"
4302662-4302703 usb_power_delivery: sym: "0x1" "1"
4302703-4302743 usb_power_delivery: sym: "0x6" "6"
4302743-4302784 usb_power_delivery: sym: "0x1" "1"
4302784-4302825 usb_power_delivery: sym: "0x3" "3"
4302662-4302825 usb_power_delivery: header: "H:3161" "HD"
4301977-4304177 usb_power_delivery: src: "(r2) SRC[0]: SOURCE CAP" "SOURCE CAP"
4302825-4302865 usb_power_delivery: sym: "0xC" "C"
4302865-4302906 usb_power_delivery: sym: "0x2" "2"
4302906-4302947 usb_power_delivery: sym: "0x1" "1"
4302947-4302988 usb_power_delivery: sym: "0x9" "9"
4302988-4303028 usb_power_delivery: sym: "0x1" "1"
4303028-4303069 usb_power_delivery: sym: "0x0" "0"
4303069-4303110 usb_power_delivery: sym: "0xA" "A"
4303110-4303151 usb_power_delivery: sym: "0x0" "0"
4302825-4303151 usb_power_delivery: data: "[0]0a01912c" "D0"
4302825-4303151 usb_power_delivery: payload: "[1] [Fixed] 5V 3A (15W) [unconstrained] [dual_role_data]" "[1] [Fixed] 5V 3A (15W) [unconstrained] [dual_role_data]"
4303151-4303191 usb_power_delivery: sym: "0xC" "C"
4303191-4303232 usb_power_delivery: sym: "0x2" "2"
4303232-4303273 usb_power_delivery: sym: "0x1" "1"
4303273-4303313 usb_power_delivery: sym: "0xC" "C"
4303313-4303354 usb_power_delivery: sym: "0x3" "3"
4303354-4303395 usb_power_delivery: sym: "0x0" "0"
4303395-4303436 usb_power_delivery: sym: "0xA" "A"
4303436-4303476 usb_power_delivery: sym: "0x0" "0"
4303151-4303476 usb_power_delivery: data: "[1]0a03c12c" "D1"
4303151-4303476 usb_power_delivery: payload: "[2] [Fixed] 12V 3A (36W) [unconstrained] [dual_role_data]" "[2] [Fixed] 12V 3A (36W) [unconstrained] [dual_role_data]"
4303476-4303517 usb_power_delivery: sym: "0xC" "C"
4303517-4303558 usb_power_delivery: sym: "0x2" "2"
4303558-4303598 usb_power_delivery: sym: "0x1" "1"
4303598-4303639 usb_power_delivery: sym: "0x4" "4"
4303639-4303680 usb_power_delivery: sym: "0x6" "6"
4303680-4303721 usb_power_delivery: sym: "0x0" "0"
4303721-4303761 usb_power_delivery: sym: "0xA" "A"
4303761-4303802 usb_power_delivery: sym: "0x0" "0"
4303476-4303802 usb_power_delivery: data: "[2]0a06412c" "D2"
4303476-4303802 usb_power_delivery: payload: "[3] [Fixed] 20V 3A (60W) [unconstrained] [dual_role_data]" "[3] [Fixed] 20V 3A (60W) [unconstrained] [dual_role_data]"
4303802-4303843 usb_power_delivery: sym: "0xF" "F"
4303843-4303883 usb_power_delivery: sym: "0xB" "B"
4303883-4303924 usb_power_delivery: sym: "0xA" "A"
4303924-4303965 usb_power_delivery: sym: "0x4" "4"
4303965-4304006 usb_power_delivery: sym: "0xC" "C"
4304006-4304046 usb_power_delivery: sym: "0x6" "6"
4304046-4304087 usb_power_delivery: sym: "0x0" "0"
4304087-4304128 usb_power_delivery: sym: "0x4" "4"
4303802-4304128 usb_power_delivery: crc: "CRC:406c4abf" "CRC"
4304128-4304168 usb_power_delivery: sym: "EOP" "#"
4304128-4304168 usb_power_delivery: eop: "EOP" "E"
4301977-4304168 usb_power_delivery: text: "#1    (1792.490417ms): (r2) SRC[0]: SOURCE CAP - [1] [Fixed] 5V 3A (15W) [unconstrained] [dual_role_data] - [2] [Fixed] 12V 3A (36W) [unconstrained] [dual_role_data] - [3] [Fixed] 20V 3A (60W) [unconstrained] [dual_role_data]" "..."
4304342-4304868 usb_power_delivery: preamble: "Preamble" "..."
4304868-4304909 usb_power_delivery: sym: "SYNC-1" "S1"
4304909-4304950 usb_power_delivery: sym: "SYNC-1" "S1"
4304950-4304991 usb_power_delivery: sym: "SYNC-1" "S1"
4304991-4305032 usb_power_delivery: sym: "SYNC-2" "S2"
4304868-4305032 usb_power_delivery: sop: "SOP" "S"
4305032-4305073 usb_power_delivery: sym: "0x1" "1"
4305073-4305114 usb_power_delivery: sym: "0x4" "4"
4305114-4305155 usb_power_delivery: sym: "0x0" "0"
4305155-4305196 usb_power_delivery: sym: "0x0" "0"
4305032-4305196 usb_power_delivery: header: "H:0041" "HD"
4304342-4305573 usb_power_delivery: snk: "(r2) SNK[0]: GOOD CRC" "GOOD CRC"
4305196-4305237 usb_power_delivery: sym: "0xB" "B"
4305237-4305278 usb_power_delivery: sym: "0xB" "B"
4305278-4305319 usb_power_delivery: sym: "0xC" "C"
4305319-4305360 usb_power_delivery: sym: "0x6" "6"
4305360-4305401 usb_power_delivery: sym: "0xB" "B"
4305401-4305442 usb_power_delivery: sym: "0xB" "B"
4305442-4305483 usb_power_delivery: sym: "0x8" "8"
4305483-4305524 usb_power_delivery: sym: "0xA" "A"
4305196-4305524 usb_power_delivery: crc: "CRC:a8bb6cbb" "CRC"
4305524-4305565 usb_power_delivery: sym: "EOP" "#"
4305524-4305565 usb_power_delivery: eop: "EOP" "E"
4304342-4305565 usb_power_delivery: text: "#2    (1793.475833ms): (r2) SNK[0]: GOOD CRC" "..."
4306408-4306934 usb_power_delivery: preamble: "Preamble" "..."
4306934-4306975 usb_power_delivery: sym: "SYNC-1" "S1"
4306975-4307016 usb_power_delivery: sym: "SYNC-1" "S1"
4307016-4307057 usb_power_delivery: sym: "SYNC-1" "S1"
4307057-4307098 usb_power_delivery: sym: "SYNC-2" "S2"
4306934-4307098 usb_power_delivery: sop: "SOP" "S"
4307098-4307139 usb_power_delivery: sym: "0x2" "2"
4307139-4307180 usb_power_delivery: sym: "0x4" "4"
4307180-4307221 usb_power_delivery: sym: "0x0" "0"
4307221-4307262 usb_power_delivery: sym: "0x1" "1"
4307098-4307262 usb_power_delivery: header: "H:1042" "HD"
4306408-4307958 usb_power_delivery: snk: "(r2) SNK[0]: REQUEST" "REQUEST"
4307262-4307303 usb_power_delivery: sym: "0xC" "C"
4307303-4307343 usb_power_delivery: sym: "0x2" "2"
4307343-4307384 usb_power_delivery: sym: "0x1" "1"
4307384-4307425 usb_power_delivery: sym: "0xB" "B"
4307425-4307466 usb_power_delivery: sym: "0x4" "4"
4307466-4307507 usb_power_delivery: sym: "0x0" "0"
4307507-4307548 usb_power_delivery: sym: "0x0" "0"
4307548-4307589 usb_power_delivery: sym: "0x1" "1"
4307262-4307589 usb_power_delivery: data: "[0]1004b12c" "D0"
4307262-4307589 usb_power_delivery: payload: "[1] (PDO #1: Fixed 5V) 3A (operating) / 3A (max)" "[1] (PDO #1: Fixed 5V) 3A (operating) / 3A (max)"
4307589-4307630 usb_power_delivery: sym: "0x7" "7"
4307630-4307671 usb_power_delivery: sym: "0x8" "8"
4307671-4307712 usb_power_delivery: sym: "0xC" "C"
4307712-4307753 usb_power_delivery: sym: "0xC" "C"
4307753-4307794 usb_power_delivery: sym: "0x1" "1"
4307794-4307835 usb_power_delivery: sym: "0x1" "1"
4307835-4307876 usb_power_delivery: sym: "0x4" "4"
4307876-4307917 usb_power_delivery: sym: "0xC" "C"
4307589-4307917 usb_power_delivery: crc: "CRC:c411cc87" "CRC"
4307917-4307958 usb_power_delivery: sym: "EOP" "#"
4307917-4307958 usb_power_delivery: eop: "EOP" "E"
4306408-4307958 usb_power_delivery: text: "#3    (1794.336667ms): (r2) SNK[0]: REQUEST - [1] (PDO #1: Fixed 5V) 3A (operating) / 3A (max)" "..."
4308101-4308624 usb_power_delivery: preamble: "Preamble" "..."
4308624-4308664 usb_power_delivery: sym: "SYNC-1" "S1"
4308664-4308705 usb_power_delivery: sym: "SYNC-1" "S1"
4308705-4308746 usb_power_delivery: sym: "SYNC-1" "S1"
4308746-4308786 usb_power_delivery: sym: "SYNC-2" "S2"
4308624-4308786 usb_power_delivery: sop: "SOP" "S"
4308786-4308827 usb_power_delivery: sym: "0x1" "1"
4308827-4308868 usb_power_delivery: sym: "0x6" "6"
4308868-4308909 usb_power_delivery: sym: "0x1" "1"
4308909-4308949 usb_power_delivery: sym: "0x0" "0"
4308786-4308949 usb_power_delivery: header: "H:0161" "HD"
4308101-4309324 usb_power_delivery: src: "(r2) SRC[0]: GOOD CRC" "GOOD CRC"
4308949-4308990 usb_power_delivery: sym: "0xF" "F"
4308990-4309031 usb_power_delivery: sym: "0x8" "8"
4309031-4309071 usb_power_delivery: sym: "0x8" "8"
4309071-4309112 usb_power_delivery: sym: "0x7" "7"
4309112-4309153 usb_power_delivery: sym: "0x8" "8"
4309153-4309194 usb_power_delivery: sym: "0x3" "3"
4309194-4309234 usb_power_delivery: sym: "0xA" "A"
4309234-4309275 usb_power_delivery: sym: "0x4" "4"
4308949-4309275 usb_power_delivery: crc: "CRC:4a38788f" "CRC"
4309275-4309316 usb_power_delivery: sym: "EOP" "#"
4309275-4309316 usb_power_delivery: eop: "EOP" "E"
4308101-4309316 usb_power_delivery: text: "#4    (1795.042083ms): (r2) SRC[0]: GOOD CRC" "..."
4318500-4319022 usb_power_delivery: preamble: "Preamble" "..."
4319022-4319063 usb_power_delivery: sym: "SYNC-1" "S1"
4319063-4319104 usb_power_delivery: sym: "SYNC-1" "S1"
4319104-4319145 usb_power_delivery: sym: "SYNC-1" "S1"
4319145-4319185 usb_power_delivery: sym: "SYNC-2" "S2"
4319022-4319185 usb_power_delivery: sop: "SOP" "S"
4319185-4319226 usb_power_delivery: sym: "0x3" "3"
4319226-4319267 usb_power_delivery: sym: "0x6" "6"
4319267-4319307 usb_power_delivery: sym: "0x3" "3"
4319307-4319348 usb_power_delivery: sym: "0x0" "0"
4319185-4319348 usb_power_delivery: header: "H:0363" "HD"
4318500-4319723 usb_power_delivery: src: "(r2) SRC[1]: ACCEPT" "ACCEPT"
4319348-4319389 usb_power_delivery: sym: "0x1" "1"
4319389-4319430 usb_power_delivery: sym: "0x2" "2"
4319430-4319470 usb_power_delivery: sym: "0xB" "B"
4319470-4319511 usb_power_delivery: sym: "0x7" "7"
4319511-4319552 usb_power_delivery: sym: "0x0" "0"
4319552-4319592 usb_power_delivery: sym: "0x0" "0"
4319592-4319633 usb_power_delivery: sym: "0x6" "6"
4319633-4319674 usb_power_delivery: sym: "0x9" "9"
4319348-4319674 usb_power_delivery: crc: "CRC:96007b21" "CRC"
4319674-4319715 usb_power_delivery: sym: "EOP" "#"
4319674-4319715 usb_power_delivery: eop: "EOP" "E"
4318500-4319715 usb_power_delivery: text: "#5    (1799.375000ms): (r2) SRC[1]: ACCEPT" "..."
4319893-4320418 usb_power_delivery: preamble: "Preamble" "..."
4320418-4320459 usb_power_delivery: sym: "SYNC-1" "S1"
4320459-4320500 usb_power_delivery: sym: "SYNC-1" "S1"
4320500-4320541 usb_power_delivery: sym: "SYNC-1" "S1"
4320541-4320582 usb_power_delivery: sym: "SYNC-2" "S2"
4320418-4320582 usb_power_delivery: sop: "SOP" "S"
4320582-4320623 usb_power_delivery: sym: "0x1" "1"
4320623-4320664 usb_power_delivery: sym: "0x4" "4"
4320664-4320705 usb_power_delivery: sym: "0x2" "2"
4320705-4320746 usb_power_delivery: sym: "0x0" "0"
4320582-4320746 usb_power_delivery: header: "H:0241" "HD"
4319893-4321123 usb_power_delivery: snk: "(r2) SNK[1]: GOOD CRC" "GOOD CRC"
4320746-4320787 usb_power_delivery: sym: "0x7" "7"
4320787-4320828 usb_power_delivery: sym: "0x9" "9"
4320828-4320869 usb_power_delivery: sym: "0xD" "D"
4320869-4320910 usb_power_delivery: sym: "0x0" "0"
4320910-4320951 usb_power_delivery: sym: "0x5" "5"
4320951-4320992 usb_power_delivery: sym: "0xB" "B"
4320992-4321033 usb_power_delivery: sym: "0x6" "6"
4321033-4321074 usb_power_delivery: sym: "0x4" "4"
4320746-4321074 usb_power_delivery: crc: "CRC:46b50d97" "CRC"
4321074-4321115 usb_power_delivery: sym: "EOP" "#"
4321074-4321115 usb_power_delivery: eop: "EOP" "E"
4319893-4321115 usb_power_delivery: text: "#6    (1799.955417ms): (r2) SNK[1]: GOOD CRC" "..."
4575113-4575635 usb_power_delivery: preamble: "Preamble" "..."
4575635-4575676 usb_power_delivery: sym: "SYNC-1" "S1"
4575676-4575716 usb_power_delivery: sym: "SYNC-1" "S1"
4575716-4575757 usb_power_delivery: sym: "SYNC-1" "S1"
4575757-4575798 usb_power_delivery: sym: "SYNC-2" "S2"
4575635-4575798 usb_power_delivery: sop: "SOP" "S"
4575798-4575839 usb_power_delivery: sym: "0x6" "6"
4575839-4575879 usb_power_delivery: sym: "0x6" "6"
4575879-4575920 usb_power_delivery: sym: "0x5" "5"
4575920-4575961 usb_power_delivery: sym: "0x0" "0"
4575798-4575961 usb_power_delivery: header: "H:0566" "HD"
4575113-4576335 usb_power_delivery: src: "(r2) SRC[2]: PS RDY" "PS RDY"
4575961-4576001 usb_power_delivery: sym: "0x1" "1"
4576001-4576042 usb_power_delivery: sym: "0x5" "5"
4576042-4576083 usb_power_delivery: sym: "0xA" "A"
4576083-4576124 usb_power_delivery: sym: "0x2" "2"
4576124-4576164 usb_power_delivery: sym: "0x4" "4"
4576164-4576205 usb_power_delivery: sym: "0x1" "1"
4576205-4576246 usb_power_delivery: sym: "0x2" "2"
4576246-4576286 usb_power_delivery: sym: "0x0" "0"
4575961-4576286 usb_power_delivery: crc: "CRC:02142a51" "CRC"
4576286-4576327 usb_power_delivery: sym: "EOP" "#"
4576286-4576327 usb_power_delivery: eop: "EOP" "E"
4575113-4576327 usb_power_delivery: text: "#7    (1906.297083ms): (r2) SRC[2]: PS RDY" "..."
4576503-4577028 usb_power_delivery: preamble: "Preamble" "..."
4577028-4577069 usb_power_delivery: sym: "SYNC-1" "S1"
4577069-4577110 usb_power_delivery: sym: "SYNC-1" "S1"
4577110-4577151 usb_power_delivery: sym: "SYNC-1" "S1"
4577151-4577192 usb_power_delivery: sym: "SYNC-2" "S2"
4577028-4577192 usb_power_delivery: sop: "SOP" "S"
4577192-4577233 usb_power_delivery: sym: "0x1" "1"
4577233-4577274 usb_power_delivery: sym: "0x4" "4"
4577274-4577315 usb_power_delivery: sym: "0x4" "4"
4577315-4577356 usb_power_delivery: sym: "0x0" "0"
4577192-4577356 usb_power_delivery: header: "H:0441" "HD"
4576503-4577724 usb_power_delivery: snk: "(r2) SNK[2]: GOOD CRC" "GOOD CRC"
4577356-4577397 usb_power_delivery: sym: "0x2" "2"
4577397-4577438 usb_power_delivery: sym: "0xA" "A"
4577438-4577479 usb_power_delivery: sym: "0x8" "8"
4577479-4577520 usb_power_delivery: sym: "0xA" "A"
4577520-4577561 usb_power_delivery: sym: "0x6" "6"
4577561-4577601 usb_power_delivery: sym: "0xD" "D"
4577601-4577643 usb_power_delivery: sym: "0xF" "F"
4577643-4577683 usb_power_delivery: sym: "0xA" "A"
4577356-4577683 usb_power_delivery: crc: "CRC:afd6a8a2" "CRC"
4577683-4577724 usb_power_delivery: sym: "EOP" "#"
4577683-4577724 usb_power_delivery: eop: "EOP" "E"
4576503-4577724 usb_power_delivery: text: "#8    (1906.876250ms): (r2) SNK[2]: GOOD CRC" "..."
4602168-4602690 usb_power_delivery: preamble: "Preamble" "..."
4602690-4602731 usb_power_delivery: sym: "SYNC-1" "S1"
4602731-4602772 usb_power_delivery: sym: "SYNC-1" "S1"
4602772-4602813 usb_power_delivery: sym: "SYNC-1" "S1"
4602813-4602853 usb_power_delivery: sym: "SYNC-2" "S2"
4602690-4602853 usb_power_delivery: sop: "SOP" "S"
4602853-4602894 usb_power_delivery: sym: "0x8" "8"
4602894-4602935 usb_power_delivery: sym: "0x6" "6"
4602935-4602975 usb_power_delivery: sym: "0x7" "7"
4602975-4603016 usb_power_delivery: sym: "0x0" "0"
4602853-4603016 usb_power_delivery: header: "H:0768" "HD"
4602168-4603382 usb_power_delivery: src: "(r2) SRC[3]: GET SINK CAP" "GET SINK CAP"
4603016-4603057 usb_power_delivery: sym: "0x3" "3"
4603057-4603097 usb_power_delivery: sym: "0xF" "F"
4603097-4603138 usb_power_delivery: sym: "0x6" "6"
4603138-4603179 usb_power_delivery: sym: "0x6" "6"
4603179-4603219 usb_power_delivery: sym: "0x9" "9"
4603219-4603260 usb_power_delivery: sym: "0x9" "9"
4603260-4603301 usb_power_delivery: sym: "0x2" "2"
4603301-4603341 usb_power_delivery: sym: "0x7" "7"
4603016-4603341 usb_power_delivery: crc: "CRC:729966f3" "CRC"
4603341-4603382 usb_power_delivery: sym: "EOP" "#"
4603341-4603382 usb_power_delivery: eop: "EOP" "E"
4602168-4603382 usb_power_delivery: text: "#9    (1917.570000ms): (r2) SRC[3]: GET SINK CAP" "..."
4603559-4604085 usb_power_delivery: preamble: "Preamble" "..."
4604085-4604126 usb_power_delivery: sym: "SYNC-1" "S1"
4604126-4604167 usb_power_delivery: sym: "SYNC-1" "S1"
4604167-4604208 usb_power_delivery: sym: "SYNC-1" "S1"
4604208-4604249 usb_power_delivery: sym: "SYNC-2" "S2"
4604085-4604249 usb_power_delivery: sop: "SOP" "S"
4604249-4604289 usb_power_delivery: sym: "0x1" "1"
4604289-4604330 usb_power_delivery: sym: "0x4" "4"
4604330-4604371 usb_power_delivery: sym: "0x6" "6"
4604371-4604412 usb_power_delivery: sym: "0x0" "0"
4604249-4604412 usb_power_delivery: header: "H:0641" "HD"
4603559-4604781 usb_power_delivery: snk: "(r2) SNK[3]: GOOD CRC" "GOOD CRC"
4604412-4604453 usb_power_delivery: sym: "0xE" "E"
4604453-4604494 usb_power_delivery: sym: "0x8" "8"
4604494-4604535 usb_power_delivery: sym: "0x9" "9"
4604535-4604576 usb_power_delivery: sym: "0xC" "C"
4604576-4604617 usb_power_delivery: sym: "0x8" "8"
4604617-4604658 usb_power_delivery: sym: "0xD" "D"
4604658-4604699 usb_power_delivery: sym: "0x1" "1"
4604699-4604740 usb_power_delivery: sym: "0x4" "4"
4604412-4604740 usb_power_delivery: crc: "CRC:41d8c98e" "CRC"
4604740-4604781 usb_power_delivery: sym: "EOP" "#"
4604740-4604781 usb_power_delivery: eop: "EOP" "E"
4603559-4604781 usb_power_delivery: text: "#10   (1918.149583ms): (r2) SNK[3]: GOOD CRC" "..."
4605144-4605669 usb_power_delivery: preamble: "Preamble" "..."
4605669-4605710 usb_power_delivery: sym: "SYNC-1" "S1"
4605710-4605751 usb_power_delivery: sym: "SYNC-1" "S1"
4605751-4605792 usb_power_delivery: sym: "SYNC-1" "S1"
4605792-4605833 usb_power_delivery: sym: "SYNC-2" "S2"
4605669-4605833 usb_power_delivery: sop: "SOP" "S"
4605833-4605874 usb_power_delivery: sym: "0x4" "4"
4605874-4605915 usb_power_delivery: sym: "0x4" "4"
4605915-4605956 usb_power_delivery: sym: "0x2" "2"
4605956-4605997 usb_power_delivery: sym: "0x3" "3"
4605833-4605997 usb_power_delivery: header: "H:3244" "HD"
4605144-4607349 usb_power_delivery: snk: "(r2) SNK[1]: SINK CAP" "SINK CAP"
4605997-4606038 usb_power_delivery: sym: "0x2" "2"
4606038-4606079 usb_power_delivery: sym: "0x3" "3"
4606079-4606120 usb_power_delivery: sym: "0x0" "0"
4606120-4606161 usb_power_delivery: sym: "0x9" "9"
4606161-4606202 usb_power_delivery: sym: "0x1" "1"
4606202-4606243 usb_power_delivery: sym: "0x0" "0"
4606243-4606284 usb_power_delivery: sym: "0x2" "2"
4606284-4606325 usb_power_delivery: sym: "0x2" "2"
4605997-4606325 usb_power_delivery: data: "[0]22019032" "D0"
4605997-4606325 usb_power_delivery: payload: "[1] [Fixed] 5V 0.5A (2.5W) [dual_role_power] [dual_role_data]" "[1] [Fixed] 5V 0.5A (2.5W) [dual_role_power] [dual_role_data]"
4606325-4606366 usb_power_delivery: sym: "0xC" "C"
4606366-4606407 usb_power_delivery: sym: "0x3" "3"
4606407-4606448 usb_power_delivery: sym: "0xC" "C"
4606448-4606489 usb_power_delivery: sym: "0x7" "7"
4606489-4606530 usb_power_delivery: sym: "0x1" "1"
4606530-4606571 usb_power_delivery: sym: "0x4" "4"
4606571-4606612 usb_power_delivery: sym: "0xA" "A"
4606612-4606653 usb_power_delivery: sym: "0x5" "5"
4606325-4606653 usb_power_delivery: data: "[1]5a417c3c" "D1"
4606325-4606653 usb_power_delivery: payload: "[2] [Battery] 4.75/21V 15W" "[2] [Battery] 4.75/21V 15W"
4606653-4606694 usb_power_delivery: sym: "0xC" "C"
4606694-4606735 usb_power_delivery: sym: "0x2" "2"
4606735-4606776 usb_power_delivery: sym: "0xD" "D"
4606776-4606817 usb_power_delivery: sym: "0x7" "7"
4606817-4606858 usb_power_delivery: sym: "0x1" "1"
4606858-4606898 usb_power_delivery: sym: "0x4" "4"
4606898-4606939 usb_power_delivery: sym: "0xA" "A"
4606939-4606980 usb_power_delivery: sym: "0x9" "9"
4606653-4606980 usb_power_delivery: data: "[2]9a417d2c" "D2"
4606653-4606980 usb_power_delivery: payload: "[3] [Variable] 4.75/21V 3A" "[3] [Variable] 4.75/21V 3A"
4606980-4607021 usb_power_delivery: sym: "0x8" "8"
4607021-4607062 usb_power_delivery: sym: "0xC" "C"
4607062-4607103 usb_power_delivery: sym: "0xC" "C"
4607103-4607144 usb_power_delivery: sym: "0xD" "D"
4607144-4607185 usb_power_delivery: sym: "0x3" "3"
4607185-4607226 usb_power_delivery: sym: "0x3" "3"
4607226-4607267 usb_power_delivery: sym: "0xC" "C"
4607267-4607308 usb_power_delivery: sym: "0x8" "8"
4606980-4607308 usb_power_delivery: crc: "CRC:8c33dcc8" "CRC"
4607308-4607349 usb_power_delivery: sym: "EOP" "#"
4607308-4607349 usb_power_delivery: eop: "EOP" "E"
4605144-4607349 usb_power_delivery: text: "#11   (1918.810000ms): (r2) SNK[1]: SINK CAP - [1] [Fixed] 5V 0.5A (2.5W) [dual_role_power] [dual_role_data] - [2] [Battery] 4.75/21V 15W - [3] [Variable] 4.75/21V 3A" "..."
4607496-4608018 usb_power_delivery: preamble: "Preamble" "..."
4608018-4608060 usb_power_delivery: sym: "SYNC-1" "S1"
4608060-4608100 usb_power_delivery: sym: "SYNC-1" "S1"
4608100-4608141 usb_power_delivery: sym: "SYNC-1" "S1"
4608141-4608181 usb_power_delivery: sym: "SYNC-2" "S2"
4608018-4608181 usb_power_delivery: sop: "SOP" "S"
4608181-4608223 usb_power_delivery: sym: "0x1" "1"
4608223-4608263 usb_power_delivery: sym: "0x6" "6"
4608263-4608304 usb_power_delivery: sym: "0x3" "3"
4608304-4608344 usb_power_delivery: sym: "0x0" "0"
4608181-4608344 usb_power_delivery: header: "H:0361" "HD"
4607496-4608710 usb_power_delivery: src: "(r2) SRC[1]: GOOD CRC" "GOOD CRC"
4608344-4608385 usb_power_delivery: sym: "0x3" "3"
4608385-4608425 usb_power_delivery: sym: "0xA" "A"
4608425-4608466 usb_power_delivery: sym: "0x9" "9"
4608466-4608507 usb_power_delivery: sym: "0x1" "1"
4608507-4608548 usb_power_delivery: sym: "0x6" "6"
4608548-4608589 usb_power_delivery: sym: "0x3" "3"
4608589-4608629 usb_power_delivery: sym: "0x4" "4"
4608629-4608670 usb_power_delivery: sym: "0xA" "A"
4608344-4608670 usb_power_delivery: crc: "CRC:a43619a3" "CRC"
4608670-4608710 usb_power_delivery: sym: "EOP" "#"
4608670-4608710 usb_power_delivery: eop: "EOP" "E"
4607496-4608710 usb_power_delivery: text: "#12   (1919.790000ms): (r2) SRC[1]: GOOD CRC" "..."
4755090-4755615 usb_power_delivery: preamble: "Preamble" "..."
4755615-4755656 usb_power_delivery: sym: "SYNC-1" "S1"
4755656-4755697 usb_power_delivery: sym: "SYNC-1" "S1"
4755697-4755738 usb_power_delivery: sym: "SYNC-1" "S1"
4755738-4755779 usb_power_delivery: sym: "SYNC-2" "S2"
4755615-4755779 usb_power_delivery: sop: "SOP" "S"
4755779-4755820 usb_power_delivery: sym: "0x9" "9"
4755820-4755861 usb_power_delivery: sym: "0x4" "4"
4755861-4755902 usb_power_delivery: sym: "0x4" "4"
4755902-4755943 usb_power_delivery: sym: "0x0" "0"
4755779-4755943 usb_power_delivery: header: "H:0449" "HD"
4755090-4756312 usb_power_delivery: snk: "(r2) SNK[2]: DR SWAP" "DR SWAP"
4755943-4755984 usb_power_delivery: sym: "0xA" "A"
4755984-4756025 usb_power_delivery: sym: "0xA" "A"
4756025-4756066 usb_power_delivery: sym: "0x2" "2"
4756066-4756107 usb_power_delivery: sym: "0x2" "2"
4756107-4756148 usb_power_delivery: sym: "0xF" "F"
4756148-4756189 usb_power_delivery: sym: "0x0" "0"
4756189-4756230 usb_power_delivery: sym: "0x7" "7"
4756230-4756271 usb_power_delivery: sym: "0x6" "6"
4755943-4756271 usb_power_delivery: crc: "CRC:670f22aa" "CRC"
4756271-4756312 usb_power_delivery: sym: "EOP" "#"
4756271-4756312 usb_power_delivery: eop: "EOP" "E"
4755090-4756312 usb_power_delivery: text: "#13   (1981.287500ms): (r2) SNK[2]: DR SWAP" "..."
4756456-4756978 usb_power_delivery: preamble: "Preamble" "..."
4756978-4757020 usb_power_delivery: sym: "SYNC-1" "S1"
4757020-4757060 usb_power_delivery: sym: "SYNC-1" "S1"
4757060-4757101 usb_power_delivery: sym: "SYNC-1" "S1"
4757101-4757141 usb_power_delivery: sym: "SYNC-2" "S2"
4756978-4757141 usb_power_delivery: sop: "SOP" "S"
4757141-4757182 usb_power_delivery: sym: "0x1" "1"
4757182-4757223 usb_power_delivery: sym: "0x6" "6"
4757223-4757264 usb_power_delivery: sym: "0x5" "5"
4757264-4757304 usb_power_delivery: sym: "0x0" "0"
4757141-4757304 usb_power_delivery: header: "H:0561" "HD"
4756456-4757678 usb_power_delivery: src: "(r2) SRC[2]: GOOD CRC" "GOOD CRC"
4757304-4757345 usb_power_delivery: sym: "0x6" "6"
4757345-4757385 usb_power_delivery: sym: "0x9" "9"
4757385-4757426 usb_power_delivery: sym: "0xC" "C"
4757426-4757467 usb_power_delivery: sym: "0xB" "B"
4757467-4757508 usb_power_delivery: sym: "0x5" "5"
4757508-4757549 usb_power_delivery: sym: "0x5" "5"
4757549-4757589 usb_power_delivery: sym: "0xD" "D"
4757589-4757630 usb_power_delivery: sym: "0x4" "4"
4757304-4757630 usb_power_delivery: crc: "CRC:4d55bc96" "CRC"
4757630-4757671 usb_power_delivery: sym: "EOP" "#"
4757630-4757671 usb_power_delivery: eop: "EOP" "E"
4756456-4757671 usb_power_delivery: text: "#14   (1981.856667ms): (r2) SRC[2]: GOOD CRC" "..."
4757832-4758355 usb_power_delivery: preamble: "Preamble" "..."
4758355-4758396 usb_power_delivery: sym: "SYNC-1" "S1"
4758396-4758436 usb_power_delivery: sym: "SYNC-1" "S1"
4758436-4758477 usb_power_delivery: sym: "SYNC-1" "S1"
4758477-4758517 usb_power_delivery: sym: "SYNC-2" "S2"
4758355-4758517 usb_power_delivery: sop: "SOP" "S"
4758517-4758558 usb_power_delivery: sym: "0x3" "3"
4758558-4758599 usb_power_delivery: sym: "0x6" "6"
4758599-4758640 usb_power_delivery: sym: "0x9" "9"
4758640-4758681 usb_power_delivery: sym: "0x0" "0"
4758517-4758681 usb_power_delivery: header: "H:0963" "HD"
4757832-4759055 usb_power_delivery: src: "(r2) SRC[4]: ACCEPT" "ACCEPT"
4758681-4758721 usb_power_delivery: sym: "0xF" "F"
4758721-4758762 usb_power_delivery: sym: "0x3" "3"
4758762-4758803 usb_power_delivery: sym: "0x2" "2"
4758803-4758844 usb_power_delivery: sym: "0x9" "9"
4758844-4758884 usb_power_delivery: sym: "0x5" "5"
4758884-4758925 usb_power_delivery: sym: "0xD" "D"
4758925-4758965 usb_power_delivery: sym: "0x6" "6"
4758965-4759007 usb_power_delivery: sym: "0x7" "7"
4758681-4759007 usb_power_delivery: crc: "CRC:76d5923f" "CRC"
4759007-4759047 usb_power_delivery: sym: "EOP" "#"
4759007-4759047 usb_power_delivery: eop: "EOP" "E"
4757832-4759047 usb_power_delivery: text: "#15   (1982.430000ms): (r2) SRC[4]: ACCEPT" "..."
4759225-4759750 usb_power_delivery: preamble: "Preamble" "..."
4759750-4759791 usb_power_delivery: sym: "SYNC-1" "S1"
4759791-4759832 usb_power_delivery: sym: "SYNC-1" "S1"
4759832-4759873 usb_power_delivery: sym: "SYNC-1" "S1"
4759873-4759914 usb_power_delivery: sym: "SYNC-2" "S2"
4759750-4759914 usb_power_delivery: sop: "SOP" "S"
4759914-4759955 usb_power_delivery: sym: "0x1" "1"
4759955-4759996 usb_power_delivery: sym: "0x4" "4"
4759996-4760037 usb_power_delivery: sym: "0x8" "8"
4760037-4760078 usb_power_delivery: sym: "0x0" "0"
4759914-4760078 usb_power_delivery: header: "H:0841" "HD"
4759225-4760455 usb_power_delivery: snk: "(r2) SNK[4]: GOOD CRC" "GOOD CRC"
4760078-4760119 usb_power_delivery: sym: "0x9" "9"
4760119-4760160 usb_power_delivery: sym: "0x8" "8"
4760160-4760201 usb_power_delivery: sym: "0x4" "4"
4760201-4760242 usb_power_delivery: sym: "0xE" "E"
4760242-4760283 usb_power_delivery: sym: "0x0" "0"
4760283-4760324 usb_power_delivery: sym: "0x6" "6"
4760324-4760365 usb_power_delivery: sym: "0x6" "6"
4760365-4760406 usb_power_delivery: sym: "0xA" "A"
4760078-4760406 usb_power_delivery: crc: "CRC:a660e489" "CRC"
4760406-4760447 usb_power_delivery: sym: "EOP" "#"
4760406-4760447 usb_power_delivery: eop: "EOP" "E"
4759225-4760447 usb_power_delivery: text: "#16   (1983.010417ms): (r2) SNK[4]: GOOD CRC" "..."
4811849-4812375 usb_power_delivery: preamble: "Preamble" "..."
4812375-4812416 usb_power_delivery: sym: "SYNC-1" "S1"
4812416-4812457 usb_power_delivery: sym: "SYNC-1" "S1"
4812457-4812498 usb_power_delivery: sym: "SYNC-1" "S1"
4812498-4812539 usb_power_delivery: sym: "SYNC-2" "S2"
4812375-4812539 usb_power_delivery: sop: "SOP" "S"
4812539-4812580 usb_power_delivery: sym: "0xF" "F"
4812580-4812621 usb_power_delivery: sym: "0x6" "6"
4812621-4812662 usb_power_delivery: sym: "0x6" "6"
4812662-4812703 usb_power_delivery: sym: "0x1" "1"
4812539-4812703 usb_power_delivery: header: "H:166f" "HD"
4811849-4813399 usb_power_delivery: snk: "(r2) SNK/DFP[3]: VDM" "VDM"
4812703-4812744 usb_power_delivery: sym: "0x1" "1"
4812744-4812785 usb_power_delivery: sym: "0x0" "0"
4812785-4812826 usb_power_delivery: sym: "0x0" "0"
4812826-4812867 usb_power_delivery: sym: "0x8" "8"
4812867-4812908 usb_power_delivery: sym: "0x0" "0"
4812908-4812949 usb_power_delivery: sym: "0x0" "0"
4812949-4812990 usb_power_delivery: sym: "0xF" "F"
4812990-4813031 usb_power_delivery: sym: "0xF" "F"
4812703-4813031 usb_power_delivery: data: "[0]ff008001" "D0"
4812703-4813031 usb_power_delivery: payload: "[1] REQ Disc Ident  SVID:ff00" "[1] REQ Disc Ident  SVID:ff00"
4813031-4813072 usb_power_delivery: sym: "0x6" "6"
4813072-4813113 usb_power_delivery: sym: "0x6" "6"
4813113-4813154 usb_power_delivery: sym: "0xD" "D"
4813154-4813195 usb_power_delivery: sym: "0xE" "E"
4813195-4813236 usb_power_delivery: sym: "0xB" "B"
4813236-4813276 usb_power_delivery: sym: "0x4" "4"
4813276-4813317 usb_power_delivery: sym: "0x3" "3"
4813317-4813358 usb_power_delivery: sym: "0xD" "D"
4813031-4813358 usb_power_delivery: crc: "CRC:d34bed66" "CRC"
4813358-4813399 usb_power_delivery: sym: "EOP" "#"
4813358-4813399 usb_power_delivery: eop: "EOP" "E"
4811849-4813399 usb_power_delivery: text: "#17   (2004.937083ms): (r2) SNK/DFP[3]: VDM - [1] REQ Disc Ident  SVID:ff00" "..."
4813539-4814062 usb_power_delivery: preamble: "Preamble" "..."
4814062-4814103 usb_power_delivery: sym: "SYNC-1" "S1"
4814103-4814143 usb_power_delivery: sym: "SYNC-1" "S1"
4814143-4814185 usb_power_delivery: sym: "SYNC-1" "S1"
4814185-4814225 usb_power_delivery: sym: "SYNC-2" "S2"
4814062-4814225 usb_power_delivery: sop: "SOP" "S"
4814225-4814266 usb_power_delivery: sym: "0x1" "1"
4814266-4814306 usb_power_delivery: sym: "0x4" "4"
4814306-4814347 usb_power_delivery: sym: "0x7" "7"
4814347-4814388 usb_power_delivery: sym: "0x0" "0"
4814225-4814388 usb_power_delivery: header: "H:0741" "HD"
4813539-4814762 usb_power_delivery: src: "(r2) SRC/UFP[3]: GOOD CRC" "GOOD CRC"
4814388-4814429 usb_power_delivery: sym: "0x8" "8"
4814429-4814469 usb_power_delivery: sym: "0x1" "1"
4814469-4814510 usb_power_delivery: sym: "0x9" "9"
4814510-4814551 usb_power_delivery: sym: "0xF" "F"
4814551-4814591 usb_power_delivery: sym: "0xF" "F"
4814591-4814632 usb_power_delivery: sym: "0xD" "D"
4814632-4814673 usb_power_delivery: sym: "0x6" "6"
4814673-4814714 usb_power_delivery: sym: "0x3" "3"
4814388-4814714 usb_power_delivery: crc: "CRC:36dff918" "CRC"
4814714-4814754 usb_power_delivery: sym: "EOP" "#"
4814714-4814754 usb_power_delivery: eop: "EOP" "E"
4813539-4814754 usb_power_delivery: text: "#18   (2005.641250ms): (r2) SRC/UFP[3]: GOOD CRC" "..."
4815151-4815674 usb_power_delivery: preamble: "Preamble" "..."
4815674-4815715 usb_power_delivery: sym: "SYNC-1" "S1"
4815715-4815755 usb_power_delivery: sym: "SYNC-1" "S1"
4815755-4815797 usb_power_delivery: sym: "SYNC-1" "S1"
4815797-4815837 usb_power_delivery: sym: "SYNC-2" "S2"
4815674-4815837 usb_power_delivery: sop: "SOP" "S"
4815837-4815878 usb_power_delivery: sym: "0xF" "F"
4815878-4815918 usb_power_delivery: sym: "0x4" "4"
4815918-4815959 usb_power_delivery: sym: "0xB" "B"
4815959-4815999 usb_power_delivery: sym: "0x4" "4"
4815837-4815999 usb_power_delivery: header: "H:4b4f" "HD"
4815151-4817677 usb_power_delivery: src: "(r2) SRC/UFP[5]: VDM" "VDM"
4815999-4816041 usb_power_delivery: sym: "0x1" "1"
4816041-4816081 usb_power_delivery: sym: "0x4" "4"
4816081-4816122 usb_power_delivery: sym: "0x0" "0"
4816122-4816162 usb_power_delivery: sym: "0x8" "8"
4816162-4816204 usb_power_delivery: sym: "0x0" "0"
4816204-4816244 usb_power_delivery: sym: "0x0" "0"
4816244-4816285 usb_power_delivery: sym: "0xF" "F"
4816285-4816325 usb_power_delivery: sym: "0xF" "F"
4815999-4816325 usb_power_delivery: data: "[0]ff008041" "D0"
4815999-4816325 usb_power_delivery: payload: "[1] ACK Disc Ident  SVID:ff00" "[1] ACK Disc Ident  SVID:ff00"
4816325-4816366 usb_power_delivery: sym: "0x1" "1"
4816366-4816407 usb_power_delivery: sym: "0xD" "D"
4816407-4816448 usb_power_delivery: sym: "0x8" "8"
4816448-4816488 usb_power_delivery: sym: "0x1" "1"
4816488-4816529 usb_power_delivery: sym: "0x0" "0"
4816529-4816569 usb_power_delivery: sym: "0x0" "0"
4816569-4816611 usb_power_delivery: sym: "0x4" "4"
4816611-4816651 usb_power_delivery: sym: "0x0" "0"
4816325-4816651 usb_power_delivery: data: "[1]040018d1" "D1"
4816325-4816651 usb_power_delivery: payload: "[2] VDO:040018d1" "[2] VDO:040018d1"
4816651-4816692 usb_power_delivery: sym: "0x0" "0"
4816692-4816732 usb_power_delivery: sym: "0x0" "0"
4816732-4816774 usb_power_delivery: sym: "0x0" "0"
4816774-4816814 usb_power_delivery: sym: "0x0" "0"
4816814-4816855 usb_power_delivery: sym: "0x0" "0"
4816855-4816895 usb_power_delivery: sym: "0x0" "0"
4816895-4816936 usb_power_delivery: sym: "0x0" "0"
4816936-4816977 usb_power_delivery: sym: "0x0" "0"
4816651-4816977 usb_power_delivery: data: "[2]00000000" "D2"
4816651-4816977 usb_power_delivery: payload: "[3] VDO:00000000" "[3] VDO:00000000"
4816977-4817018 usb_power_delivery: sym: "0x1" "1"
4817018-4817058 usb_power_delivery: sym: "0x0" "0"
4817058-4817099 usb_power_delivery: sym: "0x0" "0"
4817099-4817139 usb_power_delivery: sym: "0x0" "0"
4817139-4817181 usb_power_delivery: sym: "0x2" "2"
4817181-4817221 usb_power_delivery: sym: "0x1" "1"
4817221-4817262 usb_power_delivery: sym: "0x0" "0"
4817262-4817303 usb_power_delivery: sym: "0x5" "5"
4816977-4817303 usb_power_delivery: data: "[3]50120001" "D3"
4816977-4817303 usb_power_delivery: payload: "[4] VDO:50120001" "[4] VDO:50120001"
4817303-4817344 usb_power_delivery: sym: "0xE" "E"
4817344-4817384 usb_power_delivery: sym: "0x9" "9"
4817384-4817425 usb_power_delivery: sym: "0xA" "A"
4817425-4817466 usb_power_delivery: sym: "0x3" "3"
4817466-4817506 usb_power_delivery: sym: "0x9" "9"
4817506-4817546 usb_power_delivery: sym: "0xB" "B"
4817546-4817587 usb_power_delivery: sym: "0x5" "5"
4817587-4817628 usb_power_delivery: sym: "0x1" "1"
4817303-4817628 usb_power_delivery: crc: "CRC:15b93a9e" "CRC"
4817628-4817669 usb_power_delivery: sym: "EOP" "#"
4817628-4817669 usb_power_delivery: eop: "EOP" "E"
4815151-4817669 usb_power_delivery: text: "#19   (2006.312917ms): (r2) SRC/UFP[5]: VDM - [1] ACK Disc Ident  SVID:ff00 - [2] VDO:040018d1 - [3] VDO:00000000 - [4] VDO:50120001" "..."
4817845-4818371 usb_power_delivery: preamble: "Preamble" "..."
4818371-4818412 usb_power_delivery: sym: "SYNC-1" "S1"
4818412-4818453 usb_power_delivery: sym: "SYNC-1" "S1"
4818453-4818494 usb_power_delivery: sym: "SYNC-1" "S1"
4818494-4818535 usb_power_delivery: sym: "SYNC-2" "S2"
4818371-4818535 usb_power_delivery: sop: "SOP" "S"
4818535-4818576 usb_power_delivery: sym: "0x1" "1"
4818576-4818617 usb_power_delivery: sym: "0x6" "6"
4818617-4818658 usb_power_delivery: sym: "0xA" "A"
4818658-4818699 usb_power_delivery: sym: "0x0" "0"
4818535-4818699 usb_power_delivery: header: "H:0a61" "HD"
4817845-4819076 usb_power_delivery: snk: "(r2) SNK/DFP[5]: GOOD CRC" "GOOD CRC"
4818699-4818740 usb_power_delivery: sym: "0x7" "7"
4818740-4818781 usb_power_delivery: sym: "0x0" "0"
4818781-4818822 usb_power_delivery: sym: "0x1" "1"
4818822-4818863 usb_power_delivery: sym: "0xA" "A"
4818863-4818904 usb_power_delivery: sym: "0xA" "A"
4818904-4818945 usb_power_delivery: sym: "0xE" "E"
4818945-4818986 usb_power_delivery: sym: "0xD" "D"
4818986-4819027 usb_power_delivery: sym: "0xD" "D"
4818699-4819027 usb_power_delivery: crc: "CRC:ddeaa107" "CRC"
4819027-4819068 usb_power_delivery: sym: "EOP" "#"
4819027-4819068 usb_power_delivery: eop: "EOP" "E"
4817845-4819068 usb_power_delivery: text: "#20   (2007.435417ms): (r2) SNK/DFP[5]: GOOD CRC" "..."
4819431-4819956 usb_power_delivery: preamble: "Preamble" "..."
4819956-4819997 usb_power_delivery: sym: "SYNC-1" "S1"
4819997-4820038 usb_power_delivery: sym: "SYNC-1" "S1"
4820038-4820079 usb_power_delivery: sym: "SYNC-1" "S1"
4820079-4820120 usb_power_delivery: sym: "SYNC-2" "S2"
4819956-4820120 usb_power_delivery: sop: "SOP" "S"
4820120-4820161 usb_power_delivery: sym: "0xF" "F"
4820161-4820202 usb_power_delivery: sym: "0x6" "6"
4820202-4820243 usb_power_delivery: sym: "0x8" "8"
4820243-4820284 usb_power_delivery: sym: "0x1" "1"
4820120-4820284 usb_power_delivery: header: "H:186f" "HD"
4819431-4820989 usb_power_delivery: snk: "(r2) SNK/DFP[4]: VDM" "VDM"
4820284-4820325 usb_power_delivery: sym: "0x2" "2"
4820325-4820366 usb_power_delivery: sym: "0x0" "0"
4820366-4820407 usb_power_delivery: sym: "0x0" "0"
4820407-4820448 usb_power_delivery: sym: "0x8" "8"
4820448-4820489 usb_power_delivery: sym: "0x0" "0"
4820489-4820530 usb_power_delivery: sym: "0x0" "0"
4820530-4820571 usb_power_delivery: sym: "0xF" "F"
4820571-4820612 usb_power_delivery: sym: "0xF" "F"
4820284-4820612 usb_power_delivery: data: "[0]ff008002" "D0"
4820284-4820612 usb_power_delivery: payload: "[1] REQ Disc SVID  SVID:ff00" "[1] REQ Disc SVID  SVID:ff00"
4820612-4820653 usb_power_delivery: sym: "0x9" "9"
4820653-4820694 usb_power_delivery: sym: "0xE" "E"
4820694-4820735 usb_power_delivery: sym: "0xC" "C"
4820735-4820776 usb_power_delivery: sym: "0xF" "F"
4820776-4820817 usb_power_delivery: sym: "0xE" "E"
4820817-4820858 usb_power_delivery: sym: "0xC" "C"
4820858-4820899 usb_power_delivery: sym: "0xE" "E"
4820899-4820940 usb_power_delivery: sym: "0x7" "7"
4820612-4820940 usb_power_delivery: crc: "CRC:7ecefce9" "CRC"
4820940-4820981 usb_power_delivery: sym: "EOP" "#"
4820940-4820981 usb_power_delivery: eop: "EOP" "E"
4819431-4820981 usb_power_delivery: text: "#21   (2008.096250ms): (r2) SNK/DFP[4]: VDM - [1] REQ Disc SVID  SVID:ff00" "..."
4821124-4821647 usb_power_delivery: preamble: "Preamble" "..."
4821647-4821688 usb_power_delivery: sym: "SYNC-1" "S1"
4821688-4821728 usb_power_delivery: sym: "SYNC-1" "S1"
4821728-4821769 usb_power_delivery: sym: "SYNC-1" "S1"
4821769-4821810 usb_power_delivery: sym: "SYNC-2" "S2"
4821647-4821810 usb_power_delivery: sop: "SOP" "S"
4821810-4821851 usb_power_delivery: sym: "0x1" "1"
4821851-4821891 usb_power_delivery: sym: "0x4" "4"
4821891-4821932 usb_power_delivery: sym: "0x9" "9"
4821932-4821973 usb_power_delivery: sym: "0x0" "0"
4821810-4821973 usb_power_delivery: header: "H:0941" "HD"
4821124-4822339 usb_power_delivery: src: "(r2) SRC/UFP[4]: GOOD CRC" "GOOD CRC"
4821973-4822013 usb_power_delivery: sym: "0xF" "F"
4822013-4822054 usb_power_delivery: sym: "0x1" "1"
4822054-4822094 usb_power_delivery: sym: "0x4" "4"
4822094-4822136 usb_power_delivery: sym: "0xD" "D"
4822136-4822176 usb_power_delivery: sym: "0x7" "7"
4822176-4822217 usb_power_delivery: sym: "0x6" "6"
4822217-4822258 usb_power_delivery: sym: "0x1" "1"
4822258-4822298 usb_power_delivery: sym: "0xD" "D"
4821973-4822298 usb_power_delivery: crc: "CRC:d167d41f" "CRC"
4822298-4822339 usb_power_delivery: sym: "EOP" "#"
4822298-4822339 usb_power_delivery: eop: "EOP" "E"
4821124-4822339 usb_power_delivery: text: "#22   (2008.801667ms): (r2) SRC/UFP[4]: GOOD CRC" "..."
4822640-4823162 usb_power_delivery: preamble: "Preamble" "..."
4823162-4823204 usb_power_delivery: sym: "SYNC-1" "S1"
4823204-4823244 usb_power_delivery: sym: "SYNC-1" "S1"
4823244-4823285 usb_power_delivery: sym: "SYNC-1" "S1"
4823285-4823325 usb_power_delivery: sym: "SYNC-2" "S2"
4823162-4823325 usb_power_delivery: sop: "SOP" "S"
4823325-4823367 usb_power_delivery: sym: "0xF" "F"
4823367-4823407 usb_power_delivery: sym: "0x4" "4"
4823407-4823448 usb_power_delivery: sym: "0xD" "D"
4823448-4823488 usb_power_delivery: sym: "0x2" "2"
4823325-4823488 usb_power_delivery: header: "H:2d4f" "HD"
4822640-4824514 usb_power_delivery: src: "(r2) SRC/UFP[6]: VDM" "VDM"
4823488-4823529 usb_power_delivery: sym: "0x2" "2"
4823529-4823569 usb_power_delivery: sym: "0x4" "4"
4823569-4823611 usb_power_delivery: sym: "0x0" "0"
4823611-4823651 usb_power_delivery: sym: "0x8" "8"
4823651-4823692 usb_power_delivery: sym: "0x0" "0"
4823692-4823732 usb_power_delivery: sym: "0x0" "0"
4823732-4823774 usb_power_delivery: sym: "0xF" "F"
4823774-4823814 usb_power_delivery: sym: "0xF" "F"
4823488-4823814 usb_power_delivery: data: "[0]ff008042" "D0"
4823488-4823814 usb_power_delivery: payload: "[1] ACK Disc SVID  SVID:ff00" "[1] ACK Disc SVID  SVID:ff00"
4823814-4823855 usb_power_delivery: sym: "0x0" "0"
4823855-4823895 usb_power_delivery: sym: "0x0" "0"
4823895-4823937 usb_power_delivery: sym: "0x0" "0"
4823937-4823977 usb_power_delivery: sym: "0x0" "0"
4823977-4824018 usb_power_delivery: sym: "0x1" "1"
4824018-4824058 usb_power_delivery: sym: "0xD" "D"
4824058-4824099 usb_power_delivery: sym: "0x8" "8"
4824099-4824139 usb_power_delivery: sym: "0x1" "1"
4823814-4824139 usb_power_delivery: data: "[1]18d10000" "D1"
4823814-4824139 usb_power_delivery: payload: "[2] VDO:18d10000" "[2] VDO:18d10000"
4824139-4824180 usb_power_delivery: sym: "0x9" "9"
4824180-4824221 usb_power_delivery: sym: "0x4" "4"
4824221-4824262 usb_power_delivery: sym: "0x5" "5"
4824262-4824302 usb_power_delivery: sym: "0xD" "D"
4824302-4824344 usb_power_delivery: sym: "0x0" "0"
4824344-4824384 usb_power_delivery: sym: "0x0" "0"
4824384-4824425 usb_power_delivery: sym: "0xD" "D"
4824425-4824466 usb_power_delivery: sym: "0x5" "5"
4824139-4824466 usb_power_delivery: crc: "CRC:5d00d549" "CRC"
4824466-4824506 usb_power_delivery: sym: "EOP" "#"
4824466-4824506 usb_power_delivery: eop: "EOP" "E"
4822640-4824506 usb_power_delivery: text: "#23   (2009.433333ms): (r2) SRC/UFP[6]: VDM - [1] ACK Disc SVID  SVID:ff00 - [2] VDO:18d10000" "..."
4824680-4825206 usb_power_delivery: preamble: "Preamble" "..."
4825206-4825247 usb_power_delivery: sym: "SYNC-1" "S1"
4825247-4825288 usb_power_delivery: sym: "SYNC-1" "S1"
4825288-4825329 usb_power_delivery: sym: "SYNC-1" "S1"
4825329-4825370 usb_power_delivery: sym: "SYNC-2" "S2"
4825206-4825370 usb_power_delivery: sop: "SOP" "S"
4825370-4825411 usb_power_delivery: sym: "0x1" "1"
4825411-4825452 usb_power_delivery: sym: "0x6" "6"
4825452-4825493 usb_power_delivery: sym: "0xC" "C"
4825493-4825534 usb_power_delivery: sym: "0x0" "0"
4825370-4825534 usb_power_delivery: header: "H:0c61" "HD"
4824680-4825911 usb_power_delivery: snk: "(r2) SNK/DFP[6]: GOOD CRC" "GOOD CRC"
4825534-4825575 usb_power_delivery: sym: "0x2" "2"
4825575-4825616 usb_power_delivery: sym: "0x3" "3"
4825616-4825657 usb_power_delivery: sym: "0x4" "4"
4825657-4825698 usb_power_delivery: sym: "0x0" "0"
4825698-4825739 usb_power_delivery: sym: "0x9" "9"
4825739-4825780 usb_power_delivery: sym: "0x8" "8"
4825780-4825821 usb_power_delivery: sym: "0x4" "4"
4825821-4825861 usb_power_delivery: sym: "0x3" "3"
4825534-4825861 usb_power_delivery: crc: "CRC:34890432" "CRC"
4825861-4825902 usb_power_delivery: sym: "EOP" "#"
4825861-4825902 usb_power_delivery: eop: "EOP" "E"
4824680-4825902 usb_power_delivery: text: "#24   (2010.283333ms): (r2) SNK/DFP[6]: GOOD CRC" "..."
4826202-4826727 usb_power_delivery: preamble: "Preamble" "..."
4826727-4826768 usb_power_delivery: sym: "SYNC-1" "S1"
4826768-4826809 usb_power_delivery: sym: "SYNC-1" "S1"
4826809-4826850 usb_power_delivery: sym: "SYNC-1" "S1"
4826850-4826891 usb_power_delivery: sym: "SYNC-2" "S2"
4826727-4826891 usb_power_delivery: sop: "SOP" "S"
4826891-4826932 usb_power_delivery: sym: "0xF" "F"
4826932-4826973 usb_power_delivery: sym: "0x6" "6"
4826973-4827014 usb_power_delivery: sym: "0xA" "A"
4827014-4827055 usb_power_delivery: sym: "0x1" "1"
4826891-4827055 usb_power_delivery: header: "H:1a6f" "HD"
4826202-4827752 usb_power_delivery: snk: "(r2) SNK/DFP[5]: VDM" "VDM"
4827055-4827096 usb_power_delivery: sym: "0x3" "3"
4827096-4827137 usb_power_delivery: sym: "0x0" "0"
4827137-4827178 usb_power_delivery: sym: "0x0" "0"
4827178-4827219 usb_power_delivery: sym: "0x8" "8"
4827219-4827260 usb_power_delivery: sym: "0x1" "1"
4827260-4827301 usb_power_delivery: sym: "0xD" "D"
4827301-4827342 usb_power_delivery: sym: "0x8" "8"
4827342-4827383 usb_power_delivery: sym: "0x1" "1"
4827055-4827383 usb_power_delivery: data: "[0]18d18003" "D0"
4827055-4827383 usb_power_delivery: payload: "[1] REQ Disc Mode  SVID:18d1" "[1] REQ Disc Mode  SVID:18d1"
4827383-4827424 usb_power_delivery: sym: "0x9" "9"
4827424-4827465 usb_power_delivery: sym: "0x6" "6"
4827465-4827506 usb_power_delivery: sym: "0xB" "B"
4827506-4827547 usb_power_delivery: sym: "0x4" "4"
4827547-4827588 usb_power_delivery: sym: "0xF" "F"
4827588-4827629 usb_power_delivery: sym: "0xF" "F"
4827629-4827670 usb_power_delivery: sym: "0xA" "A"
4827670-4827711 usb_power_delivery: sym: "0x1" "1"
4827383-4827711 usb_power_delivery: crc: "CRC:1aff4b69" "CRC"
4827711-4827752 usb_power_delivery: sym: "EOP" "#"
4827711-4827752 usb_power_delivery: eop: "EOP" "E"
4826202-4827752 usb_power_delivery: text: "#25   (2010.917500ms): (r2) SNK/DFP[5]: VDM - [1] REQ Disc Mode  SVID:18d1" "..."
4827897-4828420 usb_power_delivery: preamble: "Preamble" "..."
4828420-4828461 usb_power_delivery: sym: "SYNC-1" "S1"
4828461-4828501 usb_power_delivery: sym: "SYNC-1" "S1"
4828501-4828542 usb_power_delivery: sym: "SYNC-1" "S1"
4828542-4828582 usb_power_delivery: sym: "SYNC-2" "S2"
4828420-4828582 usb_power_delivery: sop: "SOP" "S"
4828582-4828624 usb_power_delivery: sym: "0x1" "1"
4828624-4828664 usb_power_delivery: sym: "0x4" "4"
4828664-4828705 usb_power_delivery: sym: "0xB" "B"
4828705-4828745 usb_power_delivery: sym: "0x0" "0"
4828582-4828745 usb_power_delivery: header: "H:0b41" "HD"
4827897-4829112 usb_power_delivery: src: "(r2) SRC/UFP[5]: GOOD CRC" "GOOD CRC"
4828745-4828786 usb_power_delivery: sym: "0x3" "3"
4828786-4828827 usb_power_delivery: sym: "0x3" "3"
4828827-4828867 usb_power_delivery: sym: "0x5" "5"
4828867-4828909 usb_power_delivery: sym: "0xB" "B"
4828909-4828949 usb_power_delivery: sym: "0x9" "9"
4828949-4828990 usb_power_delivery: sym: "0x6" "6"
4828990-4829030 usb_power_delivery: sym: "0xF" "F"
4829030-4829071 usb_power_delivery: sym: "0x3" "3"
4828745-4829071 usb_power_delivery: crc: "CRC:3f69b533" "CRC"
4829071-4829112 usb_power_delivery: sym: "EOP" "#"
4829071-4829112 usb_power_delivery: eop: "EOP" "E"
4827897-4829112 usb_power_delivery: text: "#26   (2011.623750ms): (r2) SRC/UFP[5]: GOOD CRC" "..."
4829416-4829939 usb_power_delivery: preamble: "Preamble" "..."
4829939-4829980 usb_power_delivery: sym: "SYNC-1" "S1"
4829980-4830020 usb_power_delivery: sym: "SYNC-1" "S1"
4830020-4830062 usb_power_delivery: sym: "SYNC-1" "S1"
4830062-4830102 usb_power_delivery: sym: "SYNC-2" "S2"
4829939-4830102 usb_power_delivery: sop: "SOP" "S"
4830102-4830143 usb_power_delivery: sym: "0xF" "F"
4830143-4830183 usb_power_delivery: sym: "0x4" "4"
4830183-4830224 usb_power_delivery: sym: "0xF" "F"
4830224-4830264 usb_power_delivery: sym: "0x2" "2"
4830102-4830264 usb_power_delivery: header: "H:2f4f" "HD"
4829416-4831290 usb_power_delivery: src: "(r2) SRC/UFP[7]: VDM" "VDM"
4830264-4830305 usb_power_delivery: sym: "0x3" "3"
4830305-4830347 usb_power_delivery: sym: "0x4" "4"
4830347-4830387 usb_power_delivery: sym: "0x0" "0"
4830387-4830428 usb_power_delivery: sym: "0x8" "8"
4830428-4830468 usb_power_delivery: sym: "0x1" "1"
4830468-4830509 usb_power_delivery: sym: "0xD" "D"
4830509-4830549 usb_power_delivery: sym: "0x8" "8"
4830549-4830591 usb_power_delivery: sym: "0x1" "1"
4830264-4830591 usb_power_delivery: data: "[0]18d18043" "D0"
4830264-4830591 usb_power_delivery: payload: "[1] ACK Disc Mode  SVID:18d1" "[1] ACK Disc Mode  SVID:18d1"
4830591-4830631 usb_power_delivery: sym: "0x1" "1"
4830631-4830672 usb_power_delivery: sym: "0x0" "0"
4830672-4830712 usb_power_delivery: sym: "0x0" "0"
4830712-4830753 usb_power_delivery: sym: "0x0" "0"
4830753-4830794 usb_power_delivery: sym: "0x0" "0"
4830794-4830835 usb_power_delivery: sym: "0x0" "0"
4830835-4830875 usb_power_delivery: sym: "0x0" "0"
4830875-4830916 usb_power_delivery: sym: "0x0" "0"
4830591-4830916 usb_power_delivery: data: "[1]00000001" "D1"
4830591-4830916 usb_power_delivery: payload: "[2] VDO:00000001" "[2] VDO:00000001"
4830916-4830957 usb_power_delivery: sym: "0x9" "9"
4830957-4830997 usb_power_delivery: sym: "0x7" "7"
4830997-4831038 usb_power_delivery: sym: "0x2" "2"
4831038-4831078 usb_power_delivery: sym: "0x2" "2"
4831078-4831119 usb_power_delivery: sym: "0x9" "9"
4831119-4831160 usb_power_delivery: sym: "0x3" "3"
4831160-4831201 usb_power_delivery: sym: "0xF" "F"
4831201-4831242 usb_power_delivery: sym: "0xC" "C"
4830916-4831242 usb_power_delivery: crc: "CRC:cf392279" "CRC"
4831242-4831283 usb_power_delivery: sym: "EOP" "#"
4831242-4831283 usb_power_delivery: eop: "EOP" "E"
4829416-4831283 usb_power_delivery: text: "#27   (2012.256667ms): (r2) SRC/UFP[7]: VDM - [1] ACK Disc Mode  SVID:18d1 - [2] VDO:00000001" "..."
4831453-4831979 usb_power_delivery: preamble: "Preamble" "..."
4831979-4832020 usb_power_delivery: sym: "SYNC-1" "S1"
4832020-4832061 usb_power_delivery: sym: "SYNC-1" "S1"
4832061-4832102 usb_power_delivery: sym: "SYNC-1" "S1"
4832102-4832143 usb_power_delivery: sym: "SYNC-2" "S2"
4831979-4832143 usb_power_delivery: sop: "SOP" "S"
4832143-4832184 usb_power_delivery: sym: "0x1" "1"
4832184-4832225 usb_power_delivery: sym: "0x6" "6"
4832225-4832265 usb_power_delivery: sym: "0xE" "E"
4832265-4832307 usb_power_delivery: sym: "0x0" "0"
4832143-4832307 usb_power_delivery: header: "H:0e61" "HD"
4831453-4832675 usb_power_delivery: snk: "(r2) SNK/DFP[7]: GOOD CRC" "GOOD CRC"
4832307-4832348 usb_power_delivery: sym: "0xE" "E"
4832348-4832388 usb_power_delivery: sym: "0x1" "1"
4832388-4832429 usb_power_delivery: sym: "0x5" "5"
4832429-4832470 usb_power_delivery: sym: "0x6" "6"
4832470-4832511 usb_power_delivery: sym: "0x7" "7"
4832511-4832552 usb_power_delivery: sym: "0x8" "8"
4832552-4832593 usb_power_delivery: sym: "0xA" "A"
4832593-4832634 usb_power_delivery: sym: "0xD" "D"
4832307-4832634 usb_power_delivery: crc: "CRC:da87651e" "CRC"
4832634-4832675 usb_power_delivery: sym: "EOP" "#"
4832634-4832675 usb_power_delivery: eop: "EOP" "E"
4831453-4832675 usb_power_delivery: text: "#28   (2013.105417ms): (r2) SNK/DFP[7]: GOOD CRC" "..."
4832992-4833518 usb_power_delivery: preamble: "Preamble" "..."
4833518-4833559 usb_power_delivery: sym: "SYNC-1" "S1"
4833559-4833600 usb_power_delivery: sym: "SYNC-1" "S1"
4833600-4833641 usb_power_delivery: sym: "SYNC-1" "S1"
4833641-4833682 usb_power_delivery: sym: "SYNC-2" "S2"
4833518-4833682 usb_power_delivery: sop: "SOP" "S"
4833682-4833723 usb_power_delivery: sym: "0xF" "F"
4833723-4833764 usb_power_delivery: sym: "0x6" "6"
4833764-4833805 usb_power_delivery: sym: "0xC" "C"
4833805-4833846 usb_power_delivery: sym: "0x1" "1"
4833682-4833846 usb_power_delivery: header: "H:1c6f" "HD"
4832992-4834550 usb_power_delivery: snk: "(r2) SNK/DFP[6]: VDM" "VDM"
4833846-4833887 usb_power_delivery: sym: "0x4" "4"
4833887-4833928 usb_power_delivery: sym: "0x0" "0"
4833928-4833969 usb_power_delivery: sym: "0x1" "1"
4833969-4834010 usb_power_delivery: sym: "0x8" "8"
4834010-4834051 usb_power_delivery: sym: "0x1" "1"
4834051-4834092 usb_power_delivery: sym: "0xD" "D"
4834092-4834133 usb_power_delivery: sym: "0x8" "8"
4834133-4834174 usb_power_delivery: sym: "0x1" "1"
4833846-4834174 usb_power_delivery: data: "[0]18d18104" "D0"
4833846-4834174 usb_power_delivery: payload: "[1] REQ Enter Mode pos 1 SVID:18d1" "[1] REQ Enter Mode pos 1 SVID:18d1"
4834174-4834214 usb_power_delivery: sym: "0x7" "7"
4834214-4834255 usb_power_delivery: sym: "0x4" "4"
4834255-4834296 usb_power_delivery: sym: "0xC" "C"
4834296-4834337 usb_power_delivery: sym: "0xE" "E"
4834337-4834378 usb_power_delivery: sym: "0xA" "A"
4834378-4834419 usb_power_delivery: sym: "0xA" "A"
4834419-4834460 usb_power_delivery: sym: "0x9" "9"
4834460-4834501 usb_power_delivery: sym: "0x0" "0"
4834174-4834501 usb_power_delivery: crc: "CRC:09aaec47" "CRC"
4834501-4834542 usb_power_delivery: sym: "EOP" "#"
4834501-4834542 usb_power_delivery: eop: "EOP" "E"
4832992-4834542 usb_power_delivery: text: "#29   (2013.746667ms): (r2) SNK/DFP[6]: VDM - [1] REQ Enter Mode pos 1 SVID:18d1" "..."
4834686-4835208 usb_power_delivery: preamble: "Preamble" "..."
4835208-4835250 usb_power_delivery: sym: "SYNC-1" "S1"
4835250-4835290 usb_power_delivery: sym: "SYNC-1" "S1"
4835290-4835331 usb_power_delivery: sym: "SYNC-1" "S1"
4835331-4835371 usb_power_delivery: sym: "SYNC-2" "S2"
4835208-4835371 usb_power_delivery: sop: "SOP" "S"
4835371-4835413 usb_power_delivery: sym: "0x1" "1"
4835413-4835453 usb_power_delivery: sym: "0x4" "4"
4835453-4835494 usb_power_delivery: sym: "0xD" "D"
4835494-4835534 usb_power_delivery: sym: "0x0" "0"
4835371-4835534 usb_power_delivery: header: "H:0d41" "HD"
4834686-4835909 usb_power_delivery: src: "(r2) SRC/UFP[6]: GOOD CRC" "GOOD CRC"
4835534-4835575 usb_power_delivery: sym: "0x6" "6"
4835575-4835616 usb_power_delivery: sym: "0x0" "0"
4835616-4835656 usb_power_delivery: sym: "0x0" "0"
4835656-4835697 usb_power_delivery: sym: "0x1" "1"
4835697-4835738 usb_power_delivery: sym: "0xA" "A"
4835738-4835778 usb_power_delivery: sym: "0x0" "0"
4835778-4835819 usb_power_delivery: sym: "0x6" "6"
4835819-4835860 usb_power_delivery: sym: "0xD" "D"
4835534-4835860 usb_power_delivery: crc: "CRC:d60a1006" "CRC"
4835860-4835901 usb_power_delivery: sym: "EOP" "#"
4835860-4835901 usb_power_delivery: eop: "EOP" "E"
4834686-4835901 usb_power_delivery: text: "#30   (2014.452500ms): (r2) SRC/UFP[6]: GOOD CRC" "..."
4836791-4837313 usb_power_delivery: preamble: "Preamble" "..."
4837313-4837355 usb_power_delivery: sym: "SYNC-1" "S1"
4837355-4837395 usb_power_delivery: sym: "SYNC-1" "S1"
4837395-4837436 usb_power_delivery: sym: "SYNC-1" "S1"
4837436-4837476 usb_power_delivery: sym: "SYNC-2" "S2"
4837313-4837476 usb_power_delivery: sop: "SOP" "S"
4837476-4837517 usb_power_delivery: sym: "0xF" "F"
4837517-4837557 usb_power_delivery: sym: "0x4" "4"
4837557-4837599 usb_power_delivery: sym: "0x1" "1"
4837599-4837639 usb_power_delivery: sym: "0x1" "1"
4837476-4837639 usb_power_delivery: header: "H:114f" "HD"
4836791-4838331 usb_power_delivery: src: "(r2) SRC/UFP[0]: VDM" "VDM"
4837639-4837680 usb_power_delivery: sym: "0x4" "4"
4837680-4837720 usb_power_delivery: sym: "0x4" "4"
4837720-4837762 usb_power_delivery: sym: "0x1" "1"
4837762-4837802 usb_power_delivery: sym: "0x8" "8"
4837802-4837843 usb_power_delivery: sym: "0x1" "1"
4837843-4837883 usb_power_delivery: sym: "0xD" "D"
4837883-4837924 usb_power_delivery: sym: "0x8" "8"
4837924-4837964 usb_power_delivery: sym: "0x1" "1"
4837639-4837964 usb_power_delivery: data: "[0]18d18144" "D0"
4837639-4837964 usb_power_delivery: payload: "[1] ACK Enter Mode pos 1 SVID:18d1" "[1] ACK Enter Mode pos 1 SVID:18d1"
4837964-4838006 usb_power_delivery: sym: "0xD" "D"
4838006-4838046 usb_power_delivery: sym: "0xF" "F"
4838046-4838087 usb_power_delivery: sym: "0x5" "5"
4838087-4838128 usb_power_delivery: sym: "0x7" "7"
4838128-4838168 usb_power_delivery: sym: "0x2" "2"
4838168-4838209 usb_power_delivery: sym: "0x8" "8"
4838209-4838249 usb_power_delivery: sym: "0xD" "D"
4838249-4838290 usb_power_delivery: sym: "0x6" "6"
4837964-4838290 usb_power_delivery: crc: "CRC:6d8275fd" "CRC"
4838290-4838331 usb_power_delivery: sym: "EOP" "#"
4838290-4838331 usb_power_delivery: eop: "EOP" "E"
4836791-4838331 usb_power_delivery: text: "#31   (2015.329583ms): (r2) SRC/UFP[0]: VDM - [1] ACK Enter Mode pos 1 SVID:18d1" "..."
4838512-4839037 usb_power_delivery: preamble: "Preamble" "..."
4839037-4839078 usb_power_delivery: sym: "SYNC-1" "S1"
4839078-4839119 usb_power_delivery: sym: "SYNC-1" "S1"
4839119-4839160 usb_power_delivery: sym: "SYNC-1" "S1"
4839160-4839201 usb_power_delivery: sym: "SYNC-2" "S2"
4839037-4839201 usb_power_delivery: sop: "SOP" "S"
4839201-4839242 usb_power_delivery: sym: "0x1" "1"
4839242-4839283 usb_power_delivery: sym: "0x6" "6"
4839283-4839324 usb_power_delivery: sym: "0x0" "0"
4839324-4839365 usb_power_delivery: sym: "0x0" "0"
4839201-4839365 usb_power_delivery: header: "H:0061" "HD"
4838512-4839734 usb_power_delivery: snk: "(r2) SNK/DFP[0]: GOOD CRC" "GOOD CRC"
4839365-4839406 usb_power_delivery: sym: "0x9" "9"
4839406-4839447 usb_power_delivery: sym: "0x1" "1"
4839447-4839488 usb_power_delivery: sym: "0x8" "8"
4839488-4839529 usb_power_delivery: sym: "0x4" "4"
4839529-4839570 usb_power_delivery: sym: "0xF" "F"
4839570-4839611 usb_power_delivery: sym: "0x3" "3"
4839611-4839652 usb_power_delivery: sym: "0xD" "D"
4839652-4839693 usb_power_delivery: sym: "0x3" "3"
4839365-4839693 usb_power_delivery: crc: "CRC:3d3f4819" "CRC"
4839693-4839734 usb_power_delivery: sym: "EOP" "#"
4839693-4839734 usb_power_delivery: eop: "EOP" "E"
4838512-4839734 usb_power_delivery: text: "#32   (2016.046667ms): (r2) SNK/DFP[0]: GOOD CRC" "..."
4840048-4840574 usb_power_delivery: preamble: "Preamble" "..."
4840574-4840615 usb_power_delivery: sym: "SYNC-1" "S1"
4840615-4840656 usb_power_delivery: sym: "SYNC-1" "S1"
4840656-4840697 usb_power_delivery: sym: "SYNC-1" "S1"
4840697-4840738 usb_power_delivery: sym: "SYNC-2" "S2"
4840574-4840738 usb_power_delivery: sop: "SOP" "S"
4840738-4840779 usb_power_delivery: sym: "0xF" "F"
4840779-4840820 usb_power_delivery: sym: "0x6" "6"
4840820-4840861 usb_power_delivery: sym: "0xE" "E"
4840861-4840902 usb_power_delivery: sym: "0x1" "1"
4840738-4840902 usb_power_delivery: header: "H:1e6f" "HD"
4840048-4841598 usb_power_delivery: snk: "(r2) SNK/DFP[7]: VDM" "VDM"
4840902-4840943 usb_power_delivery: sym: "0xC" "C"
4840943-4840984 usb_power_delivery: sym: "0x0" "0"
4840984-4841025 usb_power_delivery: sym: "0x0" "0"
4841025-4841066 usb_power_delivery: sym: "0x0" "0"
4841066-4841107 usb_power_delivery: sym: "0x1" "1"
4841107-4841147 usb_power_delivery: sym: "0xD" "D"
4841147-4841189 usb_power_delivery: sym: "0x8" "8"
4841189-4841229 usb_power_delivery: sym: "0x1" "1"
4840902-4841229 usb_power_delivery: data: "[0]18d1000c" "D0"
4840902-4841229 usb_power_delivery: payload: "[1] unstruct [000c] SVID:18d1" "[1] unstruct [000c] SVID:18d1"
4841229-4841270 usb_power_delivery: sym: "0xF" "F"
4841270-4841311 usb_power_delivery: sym: "0x7" "7"
4841311-4841352 usb_power_delivery: sym: "0x6" "6"
4841352-4841393 usb_power_delivery: sym: "0xE" "E"
4841393-4841434 usb_power_delivery: sym: "0x9" "9"
4841434-4841475 usb_power_delivery: sym: "0x2" "2"
4841475-4841516 usb_power_delivery: sym: "0x6" "6"
4841516-4841557 usb_power_delivery: sym: "0x5" "5"
4841229-4841557 usb_power_delivery: crc: "CRC:5629e67f" "CRC"
4841557-4841598 usb_power_delivery: sym: "EOP" "#"
4841557-4841598 usb_power_delivery: eop: "EOP" "E"
4840048-4841598 usb_power_delivery: text: "#33   (2016.686667ms): (r2) SNK/DFP[7]: VDM - [1] unstruct [000c] SVID:18d1" "..."
4841741-4842263 usb_power_delivery: preamble: "Preamble" "..."
4842263-4842304 usb_power_delivery: sym: "SYNC-1" "S1"
4842304-4842344 usb_power_delivery: sym: "SYNC-1" "S1"
4842344-4842386 usb_power_delivery: sym: "SYNC-1" "S1"
4842386-4842426 usb_power_delivery: sym: "SYNC-2" "S2"
4842263-4842426 usb_power_delivery: sop: "SOP" "S"
4842426-4842467 usb_power_delivery: sym: "0x1" "1"
4842467-4842507 usb_power_delivery: sym: "0x4" "4"
4842507-4842548 usb_power_delivery: sym: "0xF" "F"
4842548-4842588 usb_power_delivery: sym: "0x0" "0"
4842426-4842588 usb_power_delivery: header: "H:0f41" "HD"
4841741-4842955 usb_power_delivery: src: "(r2) SRC/UFP[7]: GOOD CRC" "GOOD CRC"
4842588-4842629 usb_power_delivery: sym: "0xA" "A"
4842629-4842671 usb_power_delivery: sym: "0x2" "2"
4842671-4842711 usb_power_delivery: sym: "0x1" "1"
4842711-4842752 usb_power_delivery: sym: "0x7" "7"
4842752-4842792 usb_power_delivery: sym: "0x4" "4"
4842792-4842833 usb_power_delivery: sym: "0x0" "0"
4842833-4842873 usb_power_delivery: sym: "0x8" "8"
4842873-4842914 usb_power_delivery: sym: "0x3" "3"
4842588-4842914 usb_power_delivery: crc: "CRC:3804712a" "CRC"
4842914-4842955 usb_power_delivery: sym: "EOP" "#"
4842914-4842955 usb_power_delivery: eop: "EOP" "E"
4841741-4842955 usb_power_delivery: text: "#34   (2017.392083ms): (r2) SRC/UFP[7]: GOOD CRC" "..."
4849761-4850283 usb_power_delivery: preamble: "Preamble" "..."
4850283-4850325 usb_power_delivery: sym: "SYNC-1" "S1"
4850325-4850365 usb_power_delivery: sym: "SYNC-1" "S1"
4850365-4850406 usb_power_delivery: sym: "SYNC-1" "S1"
4850406-4850446 usb_power_delivery: sym: "SYNC-2" "S2"
4850283-4850446 usb_power_delivery: sop: "SOP" "S"
4850446-4850487 usb_power_delivery: sym: "0xF" "F"
4850487-4850528 usb_power_delivery: sym: "0x4" "4"
4850528-4850568 usb_power_delivery: sym: "0x3" "3"
4850568-4850610 usb_power_delivery: sym: "0x7" "7"
4850446-4850610 usb_power_delivery: header: "H:734f" "HD"
4849761-4853263 usb_power_delivery: src: "(r2) SRC/UFP[1]: VDM" "VDM"
4850610-4850650 usb_power_delivery: sym: "0xC" "C"
4850650-4850690 usb_power_delivery: sym: "0x2" "2"
4850690-4850732 usb_power_delivery: sym: "0x0" "0"
4850732-4850772 usb_power_delivery: sym: "0x0" "0"
4850772-4850813 usb_power_delivery: sym: "0x1" "1"
4850813-4850853 usb_power_delivery: sym: "0xD" "D"
4850853-4850895 usb_power_delivery: sym: "0x8" "8"
4850895-4850935 usb_power_delivery: sym: "0x1" "1"
4850610-4850935 usb_power_delivery: data: "[0]18d1002c" "D0"
4850610-4850935 usb_power_delivery: payload: "[1] unstruct [002c] SVID:18d1" "[1] unstruct [002c] SVID:18d1"
4850935-4850976 usb_power_delivery: sym: "0xB" "B"
4850976-4851017 usb_power_delivery: sym: "0x3" "3"
4851017-4851057 usb_power_delivery: sym: "0xE" "E"
4851057-4851097 usb_power_delivery: sym: "0x2" "2"
4851097-4851138 usb_power_delivery: sym: "0x3" "3"
4851138-4851179 usb_power_delivery: sym: "0xE" "E"
4851179-4851220 usb_power_delivery: sym: "0x6" "6"
4851220-4851261 usb_power_delivery: sym: "0xF" "F"
4850935-4851261 usb_power_delivery: data: "[1]f6e32e3b" "D1"
4850935-4851261 usb_power_delivery: payload: "[2] VDO:f6e32e3b" "[2] VDO:f6e32e3b"
4851261-4851302 usb_power_delivery: sym: "0xE" "E"
4851302-4851342 usb_power_delivery: sym: "0x1" "1"
4851342-4851382 usb_power_delivery: sym: "0xA" "A"
4851382-4851423 usb_power_delivery: sym: "0x6" "6"
4851423-4851464 usb_power_delivery: sym: "0xD" "D"
4851464-4851505 usb_power_delivery: sym: "0x1" "1"
4851505-4851545 usb_power_delivery: sym: "0x9" "9"
4851545-4851587 usb_power_delivery: sym: "0x4" "4"
4851261-4851587 usb_power_delivery: data: "[2]491d6a1e" "D2"
4851261-4851587 usb_power_delivery: payload: "[3] VDO:491d6a1e" "[3] VDO:491d6a1e"
4851587-4851627 usb_power_delivery: sym: "0x3" "3"
4851627-4851667 usb_power_delivery: sym: "0xD" "D"
4851667-4851708 usb_power_delivery: sym: "0xC" "C"
4851708-4851749 usb_power_delivery: sym: "0x1" "1"
4851749-4851790 usb_power_delivery: sym: "0x5" "5"
4851790-4851830 usb_power_delivery: sym: "0xF" "F"
4851830-4851872 usb_power_delivery: sym: "0x7" "7"
4851872-4851912 usb_power_delivery: sym: "0x7" "7"
4851587-4851912 usb_power_delivery: data: "[3]77f51cd3" "D3"
4851587-4851912 usb_power_delivery: payload: "[4] VDO:77f51cd3" "[4] VDO:77f51cd3"
4851912-4851952 usb_power_delivery: sym: "0xE" "E"
4851952-4851993 usb_power_delivery: sym: "0x5" "5"
4851993-4852034 usb_power_delivery: sym: "0x7" "7"
4852034-4852075 usb_power_delivery: sym: "0xA" "A"
4852075-4852116 usb_power_delivery: sym: "0x9" "9"
4852116-4852156 usb_power_delivery: sym: "0x1" "1"
4852156-4852197 usb_power_delivery: sym: "0xB" "B"
4852197-4852237 usb_power_delivery: sym: "0xD" "D"
4851912-4852237 usb_power_delivery: data: "[4]db19a75e" "D4"
4851912-4852237 usb_power_delivery: payload: "[5] VDO:db19a75e" "[5] VDO:db19a75e"
4852237-4852278 usb_power_delivery: sym: "0xE" "E"
4852278-4852319 usb_power_delivery: sym: "0xD" "D"
4852319-4852359 usb_power_delivery: sym: "0xD" "D"
4852359-4852400 usb_power_delivery: sym: "0xC" "C"
4852400-4852441 usb_power_delivery: sym: "0xA" "A"
4852441-4852482 usb_power_delivery: sym: "0xA" "A"
4852482-4852523 usb_power_delivery: sym: "0x2" "2"
4852523-4852564 usb_power_delivery: sym: "0xC" "C"
4852237-4852564 usb_power_delivery: data: "[5]c2aacdde" "D5"
4852237-4852564 usb_power_delivery: payload: "[6] VDO:c2aacdde" "[6] VDO:c2aacdde"
4852564-4852604 usb_power_delivery: sym: "0x7" "7"
4852604-4852644 usb_power_delivery: sym: "0x3" "3"
4852644-4852686 usb_power_delivery: sym: "0x4" "4"
4852686-4852726 usb_power_delivery: sym: "0x0" "0"
4852726-4852767 usb_power_delivery: sym: "0x1" "1"
4852767-4852807 usb_power_delivery: sym: "0x0" "0"
4852807-4852849 usb_power_delivery: sym: "0x4" "4"
4852849-4852889 usb_power_delivery: sym: "0x0" "0"
4852564-4852889 usb_power_delivery: data: "[6]04010437" "D6"
4852564-4852889 usb_power_delivery: payload: "[7] VDO:04010437" "[7] VDO:04010437"
4852889-4852929 usb_power_delivery: sym: "0xA" "A"
4852929-4852971 usb_power_delivery: sym: "0xF" "F"
4852971-4853011 usb_power_delivery: sym: "0x5" "5"
4853011-4853052 usb_power_delivery: sym: "0x5" "5"
4853052-4853092 usb_power_delivery: sym: "0x1" "1"
4853092-4853134 usb_power_delivery: sym: "0x4" "4"
4853134-4853174 usb_power_delivery: sym: "0x1" "1"
4853174-4853215 usb_power_delivery: sym: "0x8" "8"
4852889-4853215 usb_power_delivery: crc: "CRC:814155fa" "CRC"
4853215-4853256 usb_power_delivery: sym: "EOP" "#"
4853215-4853256 usb_power_delivery: eop: "EOP" "E"
4849761-4853256 usb_power_delivery: text: "#35   (2020.733750ms): (r2) SRC/UFP[1]: VDM - [1] unstruct [002c] SVID:18d1 - [2] VDO:f6e32e3b - [3] VDO:491d6a1e - [4] VDO:77f51cd3 - [5] VDO:db19a75e - [6] VDO:c2aacdde - [7] VDO:04010437" "..."
4853432-4853958 usb_power_delivery: preamble: "Preamble" "..."
4853958-4853999 usb_power_delivery: sym: "SYNC-1" "S1"
4853999-4854040 usb_power_delivery: sym: "SYNC-1" "S1"
4854040-4854080 usb_power_delivery: sym: "SYNC-1" "S1"
4854080-4854122 usb_power_delivery: sym: "SYNC-2" "S2"
4853958-4854122 usb_power_delivery: sop: "SOP" "S"
4854122-4854162 usb_power_delivery: sym: "0x1" "1"
4854162-4854203 usb_power_delivery: sym: "0x6" "6"
4854203-4854244 usb_power_delivery: sym: "0x2" "2"
4854244-4854285 usb_power_delivery: sym: "0x0" "0"
4854122-4854285 usb_power_delivery: header: "H:0261" "HD"
4853432-4854654 usb_power_delivery: snk: "(r2) SNK/DFP[1]: GOOD CRC" "GOOD CRC"
4854285-4854326 usb_power_delivery: sym: "0x5" "5"
4854326-4854367 usb_power_delivery: sym: "0x3" "3"
4854367-4854408 usb_power_delivery: sym: "0x9" "9"
4854408-4854449 usb_power_delivery: sym: "0x2" "2"
4854449-4854490 usb_power_delivery: sym: "0x1" "1"
4854490-4854531 usb_power_delivery: sym: "0x3" "3"
4854531-4854572 usb_power_delivery: sym: "0x3" "3"
4854572-4854613 usb_power_delivery: sym: "0xD" "D"
4854285-4854613 usb_power_delivery: crc: "CRC:d3312935" "CRC"
4854613-4854654 usb_power_delivery: sym: "EOP" "#"
4854613-4854654 usb_power_delivery: eop: "EOP" "E"
4853432-4854654 usb_power_delivery: text: "#36   (2022.263333ms): (r2) SNK/DFP[1]: GOOD CRC" "..."
5603782-5604308 usb_power_delivery: preamble: "Preamble" "..."
5604308-5604349 usb_power_delivery: sym: "SYNC-1" "S1"
5604349-5604390 usb_power_delivery: sym: "SYNC-1" "S1"
5604390-5604431 usb_power_delivery: sym: "SYNC-1" "S1"
5604431-5604472 usb_power_delivery: sym: "SYNC-2" "S2"
5604308-5604472 usb_power_delivery: sop: "SOP" "S"
5604472-5604513 usb_power_delivery: sym: "0x2" "2"
5604513-5604554 usb_power_delivery: sym: "0x6" "6"
5604554-5604595 usb_power_delivery: sym: "0x0" "0"
5604595-5604636 usb_power_delivery: sym: "0x1" "1"
5604472-5604636 usb_power_delivery: header: "H:1062" "HD"
5603782-5605341 usb_power_delivery: snk: "(r2) SNK/DFP[0]: REQUEST" "REQUEST"
5604636-5604677 usb_power_delivery: sym: "0xC" "C"
5604677-5604718 usb_power_delivery: sym: "0x2" "2"
5604718-5604759 usb_power_delivery: sym: "0x1" "1"
5604759-5604800 usb_power_delivery: sym: "0xB" "B"
5604800-5604841 usb_power_delivery: sym: "0x4" "4"
5604841-5604882 usb_power_delivery: sym: "0x0" "0"
5604882-5604923 usb_power_delivery: sym: "0x0" "0"
5604923-5604964 usb_power_delivery: sym: "0x3" "3"
5604636-5604964 usb_power_delivery: data: "[0]3004b12c" "D0"
5604636-5604964 usb_power_delivery: payload: "[1] (PDO #3: Variable 4.75/21V) 75W (operating)" "[1] (PDO #3: Variable 4.75/21V) 75W (operating)"
5604964-5605005 usb_power_delivery: sym: "0x9" "9"
5605005-5605046 usb_power_delivery: sym: "0x7" "7"
5605046-5605087 usb_power_delivery: sym: "0x9" "9"
5605087-5605128 usb_power_delivery: sym: "0xE" "E"
5605128-5605169 usb_power_delivery: sym: "0x3" "3"
5605169-5605209 usb_power_delivery: sym: "0xD" "D"
5605209-5605251 usb_power_delivery: sym: "0x8" "8"
5605251-5605291 usb_power_delivery: sym: "0xF" "F"
5604964-5605291 usb_power_delivery: crc: "CRC:f8d3e979" "CRC"
5605291-5605332 usb_power_delivery: sym: "EOP" "#"
5605291-5605332 usb_power_delivery: eop: "EOP" "E"
5603782-5605332 usb_power_delivery: text: "#37   (2334.909167ms): (r2) SNK/DFP[0]: REQUEST - [1] (PDO #3: Variable 4.75/21V) 75W (operating)" "..."
5605475-5605998 usb_power_delivery: preamble: "Preamble" "..."
5605998-5606039 usb_power_delivery: sym: "SYNC-1" "S1"
5606039-5606079 usb_power_delivery: sym: "SYNC-1" "S1"
5606079-5606120 usb_power_delivery: sym: "SYNC-1" "S1"
5606120-5606160 usb_power_delivery: sym: "SYNC-2" "S2"
5605998-5606160 usb_power_delivery: sop: "SOP" "S"
5606160-5606202 usb_power_delivery: sym: "0x1" "1"
5606202-5606242 usb_power_delivery: sym: "0x4" "4"
5606242-5606283 usb_power_delivery: sym: "0x1" "1"
5606283-5606323 usb_power_delivery: sym: "0x0" "0"
5606160-5606323 usb_power_delivery: header: "H:0141" "HD"
5605475-5606698 usb_power_delivery: src: "(r2) SRC/UFP[0]: GOOD CRC" "GOOD CRC"
5606323-5606365 usb_power_delivery: sym: "0xD" "D"
5606365-5606405 usb_power_delivery: sym: "0x2" "2"
5606405-5606446 usb_power_delivery: sym: "0xC" "C"
5606446-5606486 usb_power_delivery: sym: "0x5" "5"
5606486-5606527 usb_power_delivery: sym: "0xC" "C"
5606527-5606568 usb_power_delivery: sym: "0xB" "B"
5606568-5606608 usb_power_delivery: sym: "0xF" "F"
5606608-5606650 usb_power_delivery: sym: "0xD" "D"
5606323-5606650 usb_power_delivery: crc: "CRC:dfbc5c2d" "CRC"
5606650-5606690 usb_power_delivery: sym: "EOP" "#"
5606650-5606690 usb_power_delivery: eop: "EOP" "E"
5605475-5606690 usb_power_delivery: text: "#38   (2335.614583ms): (r2) SRC/UFP[0]: GOOD CRC" "..."
5616084-5616607 usb_power_delivery: preamble: "Preamble" "..."
5616607-5616648 usb_power_delivery: sym: "SYNC-1" "S1"
5616648-5616688 usb_power_delivery: sym: "SYNC-1" "S1"
5616688-5616730 usb_power_delivery: sym: "SYNC-1" "S1"
5616730-5616770 usb_power_delivery: sym: "SYNC-2" "S2"
5616607-5616770 usb_power_delivery: sop: "SOP" "S"
5616770-5616810 usb_power_delivery: sym: "0x3" "3"
5616810-5616852 usb_power_delivery: sym: "0x4" "4"
5616852-5616892 usb_power_delivery: sym: "0x5" "5"
5616892-5616933 usb_power_delivery: sym: "0x0" "0"
5616770-5616933 usb_power_delivery: header: "H:0543" "HD"
5616084-5617307 usb_power_delivery: src: "(r2) SRC/UFP[2]: ACCEPT" "ACCEPT"
5616933-5616973 usb_power_delivery: sym: "0x6" "6"
5616973-5617015 usb_power_delivery: sym: "0xB" "B"
5617015-5617055 usb_power_delivery: sym: "0xA" "A"
5617055-5617095 usb_power_delivery: sym: "0xF" "F"
5617095-5617137 usb_power_delivery: sym: "0x7" "7"
5617137-5617178 usb_power_delivery: sym: "0xE" "E"
5617178-5617218 usb_power_delivery: sym: "0xA" "A"
5617218-5617259 usb_power_delivery: sym: "0xE" "E"
5616933-5617259 usb_power_delivery: crc: "CRC:eae7fab6" "CRC"
5617259-5617300 usb_power_delivery: sym: "EOP" "#"
5617259-5617300 usb_power_delivery: eop: "EOP" "E"
5616084-5617300 usb_power_delivery: text: "#39   (2340.035000ms): (r2) SRC/UFP[2]: ACCEPT" "..."
5617481-5618007 usb_power_delivery: preamble: "Preamble" "..."
5618007-5618048 usb_power_delivery: sym: "SYNC-1" "S1"
5618048-5618089 usb_power_delivery: sym: "SYNC-1" "S1"
5618089-5618130 usb_power_delivery: sym: "SYNC-1" "S1"
5618130-5618171 usb_power_delivery: sym: "SYNC-2" "S2"
5618007-5618171 usb_power_delivery: sop: "SOP" "S"
5618171-5618212 usb_power_delivery: sym: "0x1" "1"
5618212-5618253 usb_power_delivery: sym: "0x6" "6"
5618253-5618294 usb_power_delivery: sym: "0x4" "4"
5618294-5618335 usb_power_delivery: sym: "0x0" "0"
5618171-5618335 usb_power_delivery: header: "H:0461" "HD"
5617481-5618712 usb_power_delivery: snk: "(r2) SNK/DFP[2]: GOOD CRC" "GOOD CRC"
5618335-5618376 usb_power_delivery: sym: "0x0" "0"
5618376-5618417 usb_power_delivery: sym: "0x0" "0"
5618417-5618458 usb_power_delivery: sym: "0xC" "C"
5618458-5618499 usb_power_delivery: sym: "0x8" "8"
5618499-5618540 usb_power_delivery: sym: "0x2" "2"
5618540-5618581 usb_power_delivery: sym: "0x5" "5"
5618581-5618622 usb_power_delivery: sym: "0xA" "A"
5618622-5618663 usb_power_delivery: sym: "0x3" "3"
5618335-5618663 usb_power_delivery: crc: "CRC:3a528c00" "CRC"
5618663-5618704 usb_power_delivery: sym: "EOP" "#"
5618663-5618704 usb_power_delivery: eop: "EOP" "E"
5617481-5618704 usb_power_delivery: text: "#40   (2340.617083ms): (r2) SNK/DFP[2]: GOOD CRC" "..."
5872714-5873236 usb_power_delivery: preamble: "Preamble" "..."
5873236-5873277 usb_power_delivery: sym: "SYNC-1" "S1"
5873277-5873318 usb_power_delivery: sym: "SYNC-1" "S1"
5873318-5873359 usb_power_delivery: sym: "SYNC-1" "S1"
5873359-5873399 usb_power_delivery: sym: "SYNC-2" "S2"
5873236-5873399 usb_power_delivery: sop: "SOP" "S"
5873399-5873440 usb_power_delivery: sym: "0x6" "6"
5873440-5873481 usb_power_delivery: sym: "0x4" "4"
5873481-5873521 usb_power_delivery: sym: "0x7" "7"
5873521-5873562 usb_power_delivery: sym: "0x0" "0"
5873399-5873562 usb_power_delivery: header: "H:0746" "HD"
5872714-5873937 usb_power_delivery: src: "(r2) SRC/UFP[3]: PS RDY" "PS RDY"
5873562-5873603 usb_power_delivery: sym: "0xF" "F"
5873603-5873644 usb_power_delivery: sym: "0xD" "D"
5873644-5873684 usb_power_delivery: sym: "0xF" "F"
5873684-5873725 usb_power_delivery: sym: "0x6" "6"
5873725-5873766 usb_power_delivery: sym: "0xE" "E"
5873766-5873806 usb_power_delivery: sym: "0x9" "9"
5873806-5873847 usb_power_delivery: sym: "0x9" "9"
5873847-5873888 usb_power_delivery: sym: "0x7" "7"
5873562-5873888 usb_power_delivery: crc: "CRC:799e6fdf" "CRC"
5873888-5873929 usb_power_delivery: sym: "EOP" "#"
5873888-5873929 usb_power_delivery: eop: "EOP" "E"
5872714-5873929 usb_power_delivery: text: "#41   (2446.964167ms): (r2) SRC/UFP[3]: PS RDY" "..."
5874106-5874632 usb_power_delivery: preamble: "Preamble" "..."
5874632-5874673 usb_power_delivery: sym: "SYNC-1" "S1"
5874673-5874714 usb_power_delivery: sym: "SYNC-1" "S1"
5874714-5874755 usb_power_delivery: sym: "SYNC-1" "S1"
5874755-5874796 usb_power_delivery: sym: "SYNC-2" "S2"
5874632-5874796 usb_power_delivery: sop: "SOP" "S"
5874796-5874837 usb_power_delivery: sym: "0x1" "1"
5874837-5874878 usb_power_delivery: sym: "0x6" "6"
5874878-5874919 usb_power_delivery: sym: "0x6" "6"
5874919-5874960 usb_power_delivery: sym: "0x0" "0"
5874796-5874960 usb_power_delivery: header: "H:0661" "HD"
5874106-5875328 usb_power_delivery: snk: "(r2) SNK/DFP[3]: GOOD CRC" "GOOD CRC"
5874960-5875001 usb_power_delivery: sym: "0xC" "C"
5875001-5875041 usb_power_delivery: sym: "0x2" "2"
5875041-5875082 usb_power_delivery: sym: "0xD" "D"
5875082-5875123 usb_power_delivery: sym: "0xE" "E"
5875123-5875164 usb_power_delivery: sym: "0xC" "C"
5875164-5875205 usb_power_delivery: sym: "0x5" "5"
5875205-5875246 usb_power_delivery: sym: "0x4" "4"
5875246-5875287 usb_power_delivery: sym: "0xD" "D"
5874960-5875287 usb_power_delivery: crc: "CRC:d45ced2c" "CRC"
5875287-5875328 usb_power_delivery: sym: "EOP" "#"
5875287-5875328 usb_power_delivery: eop: "EOP" "E"
5874106-5875328 usb_power_delivery: text: "#42   (2447.544167ms): (r2) SNK/DFP[3]: GOOD CRC" "..."
