121033-122308 usb_power_delivery: preamble: "Preamble" "..."
122308-122406 usb_power_delivery: sym: "SYNC-1" "S1"
122406-122508 usb_power_delivery: sym: "SYNC-1" "S1"
122508-122606 usb_power_delivery: sym: "SYNC-3" "S3"
122606-122708 usb_power_delivery: sym: "SYNC-3" "S3"
122308-122708 usb_power_delivery: sop: "SOP'" "S"
122708-122806 usb_power_delivery: sym: "0xF" "F"
122806-122908 usb_power_delivery: sym: "0x4" "4"
122908-123006 usb_power_delivery: sym: "0x0" "0"
123006-123108 usb_power_delivery: sym: "0x1" "1"
122708-123108 usb_power_delivery: header: "H:104f" "HD"
121033-124826 usb_power_delivery: snk: "(r2) SNK[0]: VDM" "VDM"
123108-123206 usb_power_delivery: sym: "0x1" "1"
123206-123308 usb_power_delivery: sym: "0x0" "0"
123308-123406 usb_power_delivery: sym: "0x0" "0"
123406-123508 usb_power_delivery: sym: "0x8" "8"
123508-123606 usb_power_delivery: sym: "0x0" "0"
123606-123708 usb_power_delivery: sym: "0x0" "0"
123708-123806 usb_power_delivery: sym: "0xF" "F"
123806-123908 usb_power_delivery: sym: "0xF" "F"
123108-123908 usb_power_delivery: data: "[0]ff008001" "D0"
123108-123908 usb_power_delivery: payload: "[1] REQ Disc Ident  SVID:ff00" "[1] REQ Disc Ident  SVID:ff00"
123908-124006 usb_power_delivery: sym: "0x0" "0"
124006-124108 usb_power_delivery: sym: "0xF" "F"
124108-124206 usb_power_delivery: sym: "0xD" "D"
124206-124308 usb_power_delivery: sym: "0x1" "1"
124308-124406 usb_power_delivery: sym: "0x7" "7"
124406-124506 usb_power_delivery: sym: "0xA" "A"
124506-124608 usb_power_delivery: sym: "0xB" "B"
124608-124708 usb_power_delivery: sym: "0x5" "5"
123908-124708 usb_power_delivery: crc: "CRC:5ba71df0" "CRC"
124708-124808 usb_power_delivery: sym: "EOP" "#"
124708-124808 usb_power_delivery: eop: "EOP" "E"
121033-124808 usb_power_delivery: text: "#1    (20.172167ms): (r2) SNK[0]: VDM - [1] REQ Disc Ident  SVID:ff00" "..."
131688-132963 usb_power_delivery: preamble: "Preamble" "..."
132963-133062 usb_power_delivery: sym: "SYNC-1" "S1"
133062-133163 usb_power_delivery: sym: "SYNC-1" "S1"
133163-133262 usb_power_delivery: sym: "SYNC-3" "S3"
133262-133363 usb_power_delivery: sym: "SYNC-3" "S3"
132963-133363 usb_power_delivery: sop: "SOP'" "S"
133363-133462 usb_power_delivery: sym: "0xF" "F"
133462-133563 usb_power_delivery: sym: "0x4" "4"
133563-133662 usb_power_delivery: sym: "0x0" "0"
133662-133763 usb_power_delivery: sym: "0x1" "1"
133363-133763 usb_power_delivery: header: "H:104f" "HD"
131688-135482 usb_power_delivery: snk: "(r2) SNK[0]: VDM" "VDM"
133763-133862 usb_power_delivery: sym: "0x1" "1"
133862-133963 usb_power_delivery: sym: "0x0" "0"
133963-134062 usb_power_delivery: sym: "0x0" "0"
134062-134163 usb_power_delivery: sym: "0x8" "8"
134163-134262 usb_power_delivery: sym: "0x0" "0"
134262-134363 usb_power_delivery: sym: "0x0" "0"
134363-134462 usb_power_delivery: sym: "0xF" "F"
134462-134563 usb_power_delivery: sym: "0xF" "F"
133763-134563 usb_power_delivery: data: "[0]ff008001" "D0"
133763-134563 usb_power_delivery: payload: "[1] REQ Disc Ident  SVID:ff00" "[1] REQ Disc Ident  SVID:ff00"
134563-134662 usb_power_delivery: sym: "0x0" "0"
134662-134763 usb_power_delivery: sym: "0xF" "F"
134763-134862 usb_power_delivery: sym: "0xD" "D"
134862-134963 usb_power_delivery: sym: "0x1" "1"
134963-135062 usb_power_delivery: sym: "0x7" "7"
135062-135162 usb_power_delivery: sym: "0xA" "A"
135162-135263 usb_power_delivery: sym: "0xB" "B"
135263-135363 usb_power_delivery: sym: "0x5" "5"
134563-135363 usb_power_delivery: crc: "CRC:5ba71df0" "CRC"
135363-135463 usb_power_delivery: sym: "EOP" "#"
135363-135463 usb_power_delivery: eop: "EOP" "E"
131688-135463 usb_power_delivery: text: "#2    (21.948000ms): (r2) SNK[0]: VDM - [1] REQ Disc Ident  SVID:ff00" "..."
142354-143629 usb_power_delivery: preamble: "Preamble" "..."
143629-143727 usb_power_delivery: sym: "SYNC-1" "S1"
143727-143829 usb_power_delivery: sym: "SYNC-1" "S1"
143829-143927 usb_power_delivery: sym: "SYNC-3" "S3"
143927-144029 usb_power_delivery: sym: "SYNC-3" "S3"
143629-144029 usb_power_delivery: sop: "SOP'" "S"
144029-144127 usb_power_delivery: sym: "0xF" "F"
144127-144229 usb_power_delivery: sym: "0x4" "4"
144229-144328 usb_power_delivery: sym: "0x0" "0"
144328-144429 usb_power_delivery: sym: "0x1" "1"
144029-144429 usb_power_delivery: header: "H:104f" "HD"
142354-146148 usb_power_delivery: snk: "(r2) SNK[0]: VDM" "VDM"
144429-144528 usb_power_delivery: sym: "0x1" "1"
144528-144629 usb_power_delivery: sym: "0x0" "0"
144629-144728 usb_power_delivery: sym: "0x0" "0"
144728-144829 usb_power_delivery: sym: "0x8" "8"
144829-144928 usb_power_delivery: sym: "0x0" "0"
144928-145029 usb_power_delivery: sym: "0x0" "0"
145029-145128 usb_power_delivery: sym: "0xF" "F"
145128-145229 usb_power_delivery: sym: "0xF" "F"
144429-145229 usb_power_delivery: data: "[0]ff008001" "D0"
144429-145229 usb_power_delivery: payload: "[1] REQ Disc Ident  SVID:ff00" "[1] REQ Disc Ident  SVID:ff00"
145229-145328 usb_power_delivery: sym: "0x0" "0"
145328-145429 usb_power_delivery: sym: "0xF" "F"
145429-145528 usb_power_delivery: sym: "0xD" "D"
145528-145629 usb_power_delivery: sym: "0x1" "1"
145629-145728 usb_power_delivery: sym: "0x7" "7"
145728-145828 usb_power_delivery: sym: "0xA" "A"
145828-145929 usb_power_delivery: sym: "0xB" "B"
145929-146029 usb_power_delivery: sym: "0x5" "5"
145229-146029 usb_power_delivery: crc: "CRC:5ba71df0" "CRC"
146029-146129 usb_power_delivery: sym: "EOP" "#"
146029-146129 usb_power_delivery: eop: "EOP" "E"
142354-146129 usb_power_delivery: text: "#3    (23.725667ms): (r2) SNK[0]: VDM - [1] REQ Disc Ident  SVID:ff00" "..."
153013-154288 usb_power_delivery: preamble: "Preamble" "..."
154288-154386 usb_power_delivery: sym: "SYNC-1" "S1"
154386-154488 usb_power_delivery: sym: "SYNC-1" "S1"
154488-154586 usb_power_delivery: sym: "SYNC-3" "S3"
154586-154688 usb_power_delivery: sym: "SYNC-3" "S3"
154288-154688 usb_power_delivery: sop: "SOP'" "S"
154688-154786 usb_power_delivery: sym: "0xF" "F"
154786-154888 usb_power_delivery: sym: "0x4" "4"
154888-154986 usb_power_delivery: sym: "0x0" "0"
154986-155088 usb_power_delivery: sym: "0x1" "1"
154688-155088 usb_power_delivery: header: "H:104f" "HD"
153013-156806 usb_power_delivery: snk: "(r2) SNK[0]: VDM" "VDM"
155088-155186 usb_power_delivery: sym: "0x1" "1"
155186-155288 usb_power_delivery: sym: "0x0" "0"
155288-155386 usb_power_delivery: sym: "0x0" "0"
155386-155488 usb_power_delivery: sym: "0x8" "8"
155488-155586 usb_power_delivery: sym: "0x0" "0"
155586-155688 usb_power_delivery: sym: "0x0" "0"
155688-155786 usb_power_delivery: sym: "0xF" "F"
155786-155888 usb_power_delivery: sym: "0xF" "F"
155088-155888 usb_power_delivery: data: "[0]ff008001" "D0"
155088-155888 usb_power_delivery: payload: "[1] REQ Disc Ident  SVID:ff00" "[1] REQ Disc Ident  SVID:ff00"
155888-155986 usb_power_delivery: sym: "0x0" "0"
155986-156088 usb_power_delivery: sym: "0xF" "F"
156088-156186 usb_power_delivery: sym: "0xD" "D"
156186-156288 usb_power_delivery: sym: "0x1" "1"
156288-156386 usb_power_delivery: sym: "0x7" "7"
156386-156486 usb_power_delivery: sym: "0xA" "A"
156486-156588 usb_power_delivery: sym: "0xB" "B"
156588-156688 usb_power_delivery: sym: "0x5" "5"
155888-156688 usb_power_delivery: crc: "CRC:5ba71df0" "CRC"
156688-156788 usb_power_delivery: sym: "EOP" "#"
156688-156788 usb_power_delivery: eop: "EOP" "E"
153013-156788 usb_power_delivery: text: "#4    (25.502167ms): (r2) SNK[0]: VDM - [1] REQ Disc Ident  SVID:ff00" "..."
164627-165902 usb_power_delivery: preamble: "Preamble" "..."
165902-166000 usb_power_delivery: sym: "SYNC-1" "S1"
166000-166102 usb_power_delivery: sym: "SYNC-1" "S1"
166102-166200 usb_power_delivery: sym: "SYNC-1" "S1"
166200-166302 usb_power_delivery: sym: "SYNC-2" "S2"
165902-166302 usb_power_delivery: sop: "SOP" "S"
166302-166400 usb_power_delivery: sym: "0x1" "1"
166400-166500 usb_power_delivery: sym: "0x6" "6"
166500-166602 usb_power_delivery: sym: "0x1" "1"
166602-166700 usb_power_delivery: sym: "0x1" "1"
166302-166700 usb_power_delivery: header: "H:1161" "HD"
164627-168441 usb_power_delivery: src: "(r2) SRC[0]: SOURCE CAP" "SOURCE CAP"
166700-166800 usb_power_delivery: sym: "0xC" "C"
166800-166902 usb_power_delivery: sym: "0x2" "2"
166902-167001 usb_power_delivery: sym: "0x1" "1"
167001-167101 usb_power_delivery: sym: "0x9" "9"
167101-167202 usb_power_delivery: sym: "0x1" "1"
167202-167301 usb_power_delivery: sym: "0x0" "0"
167301-167402 usb_power_delivery: sym: "0x4" "4"
167402-167501 usb_power_delivery: sym: "0x2" "2"
166700-167501 usb_power_delivery: data: "[0]2401912c" "D0"
166700-167501 usb_power_delivery: payload: "[1] [Fixed] 5V 3A (15W) [dual_role_power] [comm_cap]" "[1] [Fixed] 5V 3A (15W) [dual_role_power] [comm_cap]"
167501-167602 usb_power_delivery: sym: "0xF" "F"
167602-167701 usb_power_delivery: sym: "0xB" "B"
167701-167802 usb_power_delivery: sym: "0x4" "4"
167802-167901 usb_power_delivery: sym: "0xD" "D"
167901-168002 usb_power_delivery: sym: "0x7" "7"
168002-168102 usb_power_delivery: sym: "0xC" "C"
168102-168202 usb_power_delivery: sym: "0xC" "C"
168202-168301 usb_power_delivery: sym: "0x1" "1"
167501-168301 usb_power_delivery: crc: "CRC:1cc7d4bf" "CRC"
168301-168401 usb_power_delivery: sym: "EOP" "#"
168301-168401 usb_power_delivery: eop: "EOP" "E"
164627-168401 usb_power_delivery: text: "#5    (27.437833ms): (r2) SRC[0]: SOURCE CAP - [1] [Fixed] 5V 3A (15W) [dual_role_power] [comm_cap]" "..."
175306-176581 usb_power_delivery: preamble: "Preamble" "..."
176581-176679 usb_power_delivery: sym: "SYNC-1" "S1"
176679-176781 usb_power_delivery: sym: "SYNC-1" "S1"
176781-176879 usb_power_delivery: sym: "SYNC-1" "S1"
176879-176981 usb_power_delivery: sym: "SYNC-2" "S2"
176581-176981 usb_power_delivery: sop: "SOP" "S"
176981-177079 usb_power_delivery: sym: "0x1" "1"
177079-177179 usb_power_delivery: sym: "0x6" "6"
177179-177281 usb_power_delivery: sym: "0x1" "1"
177281-177379 usb_power_delivery: sym: "0x1" "1"
176981-177379 usb_power_delivery: header: "H:1161" "HD"
175306-179119 usb_power_delivery: src: "(r2) SRC[0]: SOURCE CAP" "SOURCE CAP"
177379-177479 usb_power_delivery: sym: "0xC" "C"
177479-177581 usb_power_delivery: sym: "0x2" "2"
177581-177679 usb_power_delivery: sym: "0x1" "1"
177679-177779 usb_power_delivery: sym: "0x9" "9"
177779-177881 usb_power_delivery: sym: "0x1" "1"
177881-177979 usb_power_delivery: sym: "0x0" "0"
177979-178081 usb_power_delivery: sym: "0x4" "4"
178081-178179 usb_power_delivery: sym: "0x2" "2"
177379-178179 usb_power_delivery: data: "[0]2401912c" "D0"
177379-178179 usb_power_delivery: payload: "[1] [Fixed] 5V 3A (15W) [dual_role_power] [comm_cap]" "[1] [Fixed] 5V 3A (15W) [dual_role_power] [comm_cap]"
178179-178281 usb_power_delivery: sym: "0xF" "F"
178281-178379 usb_power_delivery: sym: "0xB" "B"
178379-178481 usb_power_delivery: sym: "0x4" "4"
178481-178579 usb_power_delivery: sym: "0xD" "D"
178579-178681 usb_power_delivery: sym: "0x7" "7"
178681-178781 usb_power_delivery: sym: "0xC" "C"
178781-178881 usb_power_delivery: sym: "0xC" "C"
178881-178979 usb_power_delivery: sym: "0x1" "1"
178179-178979 usb_power_delivery: crc: "CRC:1cc7d4bf" "CRC"
178979-179079 usb_power_delivery: sym: "EOP" "#"
178979-179079 usb_power_delivery: eop: "EOP" "E"
175306-179079 usb_power_delivery: text: "#6    (29.217667ms): (r2) SRC[0]: SOURCE CAP - [1] [Fixed] 5V 3A (15W) [dual_role_power] [comm_cap]" "..."
185984-187260 usb_power_delivery: preamble: "Preamble" "..."
187260-187358 usb_power_delivery: sym: "SYNC-1" "S1"
187358-187460 usb_power_delivery: sym: "SYNC-1" "S1"
187460-187558 usb_power_delivery: sym: "SYNC-1" "S1"
187558-187660 usb_power_delivery: sym: "SYNC-2" "S2"
187260-187660 usb_power_delivery: sop: "SOP" "S"
187660-187758 usb_power_delivery: sym: "0x1" "1"
187758-187858 usb_power_delivery: sym: "0x6" "6"
187858-187960 usb_power_delivery: sym: "0x1" "1"
187960-188058 usb_power_delivery: sym: "0x1" "1"
187660-188058 usb_power_delivery: header: "H:1161" "HD"
185984-189798 usb_power_delivery: src: "(r2) SRC[0]: SOURCE CAP" "SOURCE CAP"
188058-188158 usb_power_delivery: sym: "0xC" "C"
188158-188260 usb_power_delivery: sym: "0x2" "2"
188260-188358 usb_power_delivery: sym: "0x1" "1"
188358-188458 usb_power_delivery: sym: "0x9" "9"
188458-188560 usb_power_delivery: sym: "0x1" "1"
188560-188658 usb_power_delivery: sym: "0x0" "0"
188658-188760 usb_power_delivery: sym: "0x4" "4"
188760-188858 usb_power_delivery: sym: "0x2" "2"
188058-188858 usb_power_delivery: data: "[0]2401912c" "D0"
188058-188858 usb_power_delivery: payload: "[1] [Fixed] 5V 3A (15W) [dual_role_power] [comm_cap]" "[1] [Fixed] 5V 3A (15W) [dual_role_power] [comm_cap]"
188858-188960 usb_power_delivery: sym: "0xF" "F"
188960-189058 usb_power_delivery: sym: "0xB" "B"
189058-189160 usb_power_delivery: sym: "0x4" "4"
189160-189258 usb_power_delivery: sym: "0xD" "D"
189258-189360 usb_power_delivery: sym: "0x7" "7"
189360-189460 usb_power_delivery: sym: "0xC" "C"
189460-189560 usb_power_delivery: sym: "0xC" "C"
189560-189658 usb_power_delivery: sym: "0x1" "1"
188858-189658 usb_power_delivery: crc: "CRC:1cc7d4bf" "CRC"
189658-189758 usb_power_delivery: sym: "EOP" "#"
189658-189758 usb_power_delivery: eop: "EOP" "E"
185984-189758 usb_power_delivery: text: "#7    (30.997333ms): (r2) SRC[0]: SOURCE CAP - [1] [Fixed] 5V 3A (15W) [dual_role_power] [comm_cap]" "..."
196663-197939 usb_power_delivery: preamble: "Preamble" "..."
197939-198037 usb_power_delivery: sym: "SYNC-1" "S1"
198037-198138 usb_power_delivery: sym: "SYNC-1" "S1"
198138-198237 usb_power_delivery: sym: "SYNC-1" "S1"
198237-198338 usb_power_delivery: sym: "SYNC-2" "S2"
197939-198338 usb_power_delivery: sop: "SOP" "S"
198338-198437 usb_power_delivery: sym: "0x1" "1"
198437-198537 usb_power_delivery: sym: "0x6" "6"
198537-198639 usb_power_delivery: sym: "0x1" "1"
198639-198737 usb_power_delivery: sym: "0x1" "1"
198338-198737 usb_power_delivery: header: "H:1161" "HD"
196663-200477 usb_power_delivery: src: "(r2) SRC[0]: SOURCE CAP" "SOURCE CAP"
198737-198837 usb_power_delivery: sym: "0xC" "C"
198837-198939 usb_power_delivery: sym: "0x2" "2"
198939-199037 usb_power_delivery: sym: "0x1" "1"
199037-199137 usb_power_delivery: sym: "0x9" "9"
199137-199239 usb_power_delivery: sym: "0x1" "1"
199239-199337 usb_power_delivery: sym: "0x0" "0"
199337-199439 usb_power_delivery: sym: "0x4" "4"
199439-199537 usb_power_delivery: sym: "0x2" "2"
198737-199537 usb_power_delivery: data: "[0]2401912c" "D0"
198737-199537 usb_power_delivery: payload: "[1] [Fixed] 5V 3A (15W) [dual_role_power] [comm_cap]" "[1] [Fixed] 5V 3A (15W) [dual_role_power] [comm_cap]"
199537-199639 usb_power_delivery: sym: "0xF" "F"
199639-199737 usb_power_delivery: sym: "0xB" "B"
199737-199839 usb_power_delivery: sym: "0x4" "4"
199839-199937 usb_power_delivery: sym: "0xD" "D"
199937-200039 usb_power_delivery: sym: "0x7" "7"
200039-200139 usb_power_delivery: sym: "0xC" "C"
200139-200239 usb_power_delivery: sym: "0xC" "C"
200239-200337 usb_power_delivery: sym: "0x1" "1"
199537-200337 usb_power_delivery: crc: "CRC:1cc7d4bf" "CRC"
200337-200437 usb_power_delivery: sym: "EOP" "#"
200337-200437 usb_power_delivery: eop: "EOP" "E"
196663-200437 usb_power_delivery: text: "#8    (32.777167ms): (r2) SRC[0]: SOURCE CAP - [1] [Fixed] 5V 3A (15W) [dual_role_power] [comm_cap]" "..."
1267213-1268488 usb_power_delivery: preamble: "Preamble" "..."
1268488-1268586 usb_power_delivery: sym: "SYNC-1" "S1"
1268586-1268688 usb_power_delivery: sym: "SYNC-1" "S1"
1268688-1268786 usb_power_delivery: sym: "SYNC-3" "S3"
1268786-1268888 usb_power_delivery: sym: "SYNC-3" "S3"
1268488-1268888 usb_power_delivery: sop: "SOP'" "S"
1268888-1268986 usb_power_delivery: sym: "0xF" "F"
1268986-1269088 usb_power_delivery: sym: "0x4" "4"
1269088-1269186 usb_power_delivery: sym: "0x0" "0"
1269186-1269288 usb_power_delivery: sym: "0x1" "1"
1268888-1269288 usb_power_delivery: header: "H:104f" "HD"
1267213-1271006 usb_power_delivery: snk: "(r2) SNK[0]: VDM" "VDM"
1269288-1269386 usb_power_delivery: sym: "0x1" "1"
1269386-1269488 usb_power_delivery: sym: "0x0" "0"
1269488-1269586 usb_power_delivery: sym: "0x0" "0"
1269586-1269688 usb_power_delivery: sym: "0x8" "8"
1269688-1269786 usb_power_delivery: sym: "0x0" "0"
1269786-1269888 usb_power_delivery: sym: "0x0" "0"
1269888-1269986 usb_power_delivery: sym: "0xF" "F"
1269986-1270088 usb_power_delivery: sym: "0xF" "F"
1269288-1270088 usb_power_delivery: data: "[0]ff008001" "D0"
1269288-1270088 usb_power_delivery: payload: "[1] REQ Disc Ident  SVID:ff00" "[1] REQ Disc Ident  SVID:ff00"
1270088-1270186 usb_power_delivery: sym: "0x0" "0"
1270186-1270288 usb_power_delivery: sym: "0xF" "F"
1270288-1270386 usb_power_delivery: sym: "0xD" "D"
1270386-1270488 usb_power_delivery: sym: "0x1" "1"
1270488-1270586 usb_power_delivery: sym: "0x7" "7"
1270586-1270686 usb_power_delivery: sym: "0xA" "A"
1270686-1270788 usb_power_delivery: sym: "0xB" "B"
1270788-1270888 usb_power_delivery: sym: "0x5" "5"
1270088-1270888 usb_power_delivery: crc: "CRC:5ba71df0" "CRC"
1270888-1270988 usb_power_delivery: sym: "EOP" "#"
1270888-1270988 usb_power_delivery: eop: "EOP" "E"
1267213-1270988 usb_power_delivery: text: "#9    (211.202167ms): (r2) SNK[0]: VDM - [1] REQ Disc Ident  SVID:ff00" "..."
1277871-1279147 usb_power_delivery: preamble: "Preamble" "..."
1279147-1279245 usb_power_delivery: sym: "SYNC-1" "S1"
1279245-1279347 usb_power_delivery: sym: "SYNC-1" "S1"
1279347-1279445 usb_power_delivery: sym: "SYNC-3" "S3"
1279445-1279547 usb_power_delivery: sym: "SYNC-3" "S3"
1279147-1279547 usb_power_delivery: sop: "SOP'" "S"
1279547-1279645 usb_power_delivery: sym: "0xF" "F"
1279645-1279747 usb_power_delivery: sym: "0x4" "4"
1279747-1279845 usb_power_delivery: sym: "0x0" "0"
1279845-1279947 usb_power_delivery: sym: "0x1" "1"
1279547-1279947 usb_power_delivery: header: "H:104f" "HD"
1277871-1281665 usb_power_delivery: snk: "(r2) SNK[0]: VDM" "VDM"
1279947-1280045 usb_power_delivery: sym: "0x1" "1"
1280045-1280147 usb_power_delivery: sym: "0x0" "0"
1280147-1280245 usb_power_delivery: sym: "0x0" "0"
1280245-1280347 usb_power_delivery: sym: "0x8" "8"
1280347-1280445 usb_power_delivery: sym: "0x0" "0"
1280445-1280547 usb_power_delivery: sym: "0x0" "0"
1280547-1280645 usb_power_delivery: sym: "0xF" "F"
1280645-1280747 usb_power_delivery: sym: "0xF" "F"
1279947-1280747 usb_power_delivery: data: "[0]ff008001" "D0"
1279947-1280747 usb_power_delivery: payload: "[1] REQ Disc Ident  SVID:ff00" "[1] REQ Disc Ident  SVID:ff00"
1280747-1280845 usb_power_delivery: sym: "0x0" "0"
1280845-1280947 usb_power_delivery: sym: "0xF" "F"
1280947-1281045 usb_power_delivery: sym: "0xD" "D"
1281045-1281147 usb_power_delivery: sym: "0x1" "1"
1281147-1281245 usb_power_delivery: sym: "0x7" "7"
1281245-1281345 usb_power_delivery: sym: "0xA" "A"
1281345-1281447 usb_power_delivery: sym: "0xB" "B"
1281447-1281547 usb_power_delivery: sym: "0x5" "5"
1280747-1281547 usb_power_delivery: crc: "CRC:5ba71df0" "CRC"
1281547-1281647 usb_power_delivery: sym: "EOP" "#"
1281547-1281647 usb_power_delivery: eop: "EOP" "E"
1277871-1281647 usb_power_delivery: text: "#10   (212.978500ms): (r2) SNK[0]: VDM - [1] REQ Disc Ident  SVID:ff00" "..."
1288530-1289805 usb_power_delivery: preamble: "Preamble" "..."
1289805-1289904 usb_power_delivery: sym: "SYNC-1" "S1"
1289904-1290005 usb_power_delivery: sym: "SYNC-1" "S1"
1290005-1290104 usb_power_delivery: sym: "SYNC-3" "S3"
1290104-1290205 usb_power_delivery: sym: "SYNC-3" "S3"
1289805-1290205 usb_power_delivery: sop: "SOP'" "S"
1290205-1290304 usb_power_delivery: sym: "0xF" "F"
1290304-1290405 usb_power_delivery: sym: "0x4" "4"
1290405-1290504 usb_power_delivery: sym: "0x0" "0"
1290504-1290605 usb_power_delivery: sym: "0x1" "1"
1290205-1290605 usb_power_delivery: header: "H:104f" "HD"
1288530-1292324 usb_power_delivery: snk: "(r2) SNK[0]: VDM" "VDM"
1290605-1290704 usb_power_delivery: sym: "0x1" "1"
1290704-1290806 usb_power_delivery: sym: "0x0" "0"
1290806-1290904 usb_power_delivery: sym: "0x0" "0"
1290904-1291006 usb_power_delivery: sym: "0x8" "8"
1291006-1291104 usb_power_delivery: sym: "0x0" "0"
1291104-1291206 usb_power_delivery: sym: "0x0" "0"
1291206-1291304 usb_power_delivery: sym: "0xF" "F"
1291304-1291406 usb_power_delivery: sym: "0xF" "F"
1290605-1291406 usb_power_delivery: data: "[0]ff008001" "D0"
1290605-1291406 usb_power_delivery: payload: "[1] REQ Disc Ident  SVID:ff00" "[1] REQ Disc Ident  SVID:ff00"
1291406-1291504 usb_power_delivery: sym: "0x0" "0"
1291504-1291606 usb_power_delivery: sym: "0xF" "F"
1291606-1291704 usb_power_delivery: sym: "0xD" "D"
1291704-1291806 usb_power_delivery: sym: "0x1" "1"
1291806-1291904 usb_power_delivery: sym: "0x7" "7"
1291904-1292004 usb_power_delivery: sym: "0xA" "A"
1292004-1292106 usb_power_delivery: sym: "0xB" "B"
1292106-1292206 usb_power_delivery: sym: "0x5" "5"
1291406-1292206 usb_power_delivery: crc: "CRC:5ba71df0" "CRC"
1292206-1292306 usb_power_delivery: sym: "EOP" "#"
1292206-1292306 usb_power_delivery: eop: "EOP" "E"
1288530-1292306 usb_power_delivery: text: "#11   (214.755000ms): (r2) SNK[0]: VDM - [1] REQ Disc Ident  SVID:ff00" "..."
1299189-1300464 usb_power_delivery: preamble: "Preamble" "..."
1300464-1300562 usb_power_delivery: sym: "SYNC-1" "S1"
1300562-1300664 usb_power_delivery: sym: "SYNC-1" "S1"
1300664-1300762 usb_power_delivery: sym: "SYNC-3" "S3"
1300762-1300864 usb_power_delivery: sym: "SYNC-3" "S3"
1300464-1300864 usb_power_delivery: sop: "SOP'" "S"
1300864-1300962 usb_power_delivery: sym: "0xF" "F"
1300962-1301064 usb_power_delivery: sym: "0x4" "4"
1301064-1301162 usb_power_delivery: sym: "0x0" "0"
1301162-1301264 usb_power_delivery: sym: "0x1" "1"
1300864-1301264 usb_power_delivery: header: "H:104f" "HD"
1299189-1302983 usb_power_delivery: snk: "(r2) SNK[0]: VDM" "VDM"
1301264-1301362 usb_power_delivery: sym: "0x1" "1"
1301362-1301464 usb_power_delivery: sym: "0x0" "0"
1301464-1301562 usb_power_delivery: sym: "0x0" "0"
1301562-1301664 usb_power_delivery: sym: "0x8" "8"
1301664-1301762 usb_power_delivery: sym: "0x0" "0"
1301762-1301864 usb_power_delivery: sym: "0x0" "0"
1301864-1301962 usb_power_delivery: sym: "0xF" "F"
1301962-1302064 usb_power_delivery: sym: "0xF" "F"
1301264-1302064 usb_power_delivery: data: "[0]ff008001" "D0"
1301264-1302064 usb_power_delivery: payload: "[1] REQ Disc Ident  SVID:ff00" "[1] REQ Disc Ident  SVID:ff00"
1302064-1302163 usb_power_delivery: sym: "0x0" "0"
1302163-1302264 usb_power_delivery: sym: "0xF" "F"
1302264-1302363 usb_power_delivery: sym: "0xD" "D"
1302363-1302464 usb_power_delivery: sym: "0x1" "1"
1302464-1302563 usb_power_delivery: sym: "0x7" "7"
1302563-1302663 usb_power_delivery: sym: "0xA" "A"
1302663-1302764 usb_power_delivery: sym: "0xB" "B"
1302764-1302864 usb_power_delivery: sym: "0x5" "5"
1302064-1302864 usb_power_delivery: crc: "CRC:5ba71df0" "CRC"
1302864-1302964 usb_power_delivery: sym: "EOP" "#"
1302864-1302964 usb_power_delivery: eop: "EOP" "E"
1299189-1302964 usb_power_delivery: text: "#12   (216.531500ms): (r2) SNK[0]: VDM - [1] REQ Disc Ident  SVID:ff00" "..."
1310803-1312078 usb_power_delivery: preamble: "Preamble" "..."
1312078-1312177 usb_power_delivery: sym: "SYNC-1" "S1"
1312177-1312278 usb_power_delivery: sym: "SYNC-1" "S1"
1312278-1312377 usb_power_delivery: sym: "SYNC-1" "S1"
1312377-1312478 usb_power_delivery: sym: "SYNC-2" "S2"
1312078-1312478 usb_power_delivery: sop: "SOP" "S"
1312478-1312577 usb_power_delivery: sym: "0x1" "1"
1312577-1312677 usb_power_delivery: sym: "0x6" "6"
1312677-1312778 usb_power_delivery: sym: "0x1" "1"
1312778-1312877 usb_power_delivery: sym: "0x1" "1"
1312478-1312877 usb_power_delivery: header: "H:1161" "HD"
1310803-1314617 usb_power_delivery: src: "(r2) SRC[0]: SOURCE CAP" "SOURCE CAP"
1312877-1312977 usb_power_delivery: sym: "0xC" "C"
1312977-1313078 usb_power_delivery: sym: "0x2" "2"
1313078-1313177 usb_power_delivery: sym: "0x1" "1"
1313177-1313277 usb_power_delivery: sym: "0x9" "9"
1313277-1313378 usb_power_delivery: sym: "0x1" "1"
1313378-1313477 usb_power_delivery: sym: "0x0" "0"
1313477-1313578 usb_power_delivery: sym: "0x4" "4"
1313578-1313677 usb_power_delivery: sym: "0x2" "2"
1312877-1313677 usb_power_delivery: data: "[0]2401912c" "D0"
1312877-1313677 usb_power_delivery: payload: "[1] [Fixed] 5V 3A (15W) [dual_role_power] [comm_cap]" "[1] [Fixed] 5V 3A (15W) [dual_role_power] [comm_cap]"
1313677-1313778 usb_power_delivery: sym: "0xF" "F"
1313778-1313877 usb_power_delivery: sym: "0xB" "B"
1313877-1313978 usb_power_delivery: sym: "0x4" "4"
1313978-1314077 usb_power_delivery: sym: "0xD" "D"
1314077-1314178 usb_power_delivery: sym: "0x7" "7"
1314178-1314278 usb_power_delivery: sym: "0xC" "C"
1314278-1314378 usb_power_delivery: sym: "0xC" "C"
1314378-1314477 usb_power_delivery: sym: "0x1" "1"
1313677-1314477 usb_power_delivery: crc: "CRC:1cc7d4bf" "CRC"
1314477-1314577 usb_power_delivery: sym: "EOP" "#"
1314477-1314577 usb_power_delivery: eop: "EOP" "E"
1310803-1314577 usb_power_delivery: text: "#13   (218.467167ms): (r2) SRC[0]: SOURCE CAP - [1] [Fixed] 5V 3A (15W) [dual_role_power] [comm_cap]" "..."
1321482-1322757 usb_power_delivery: preamble: "Preamble" "..."
1322757-1322855 usb_power_delivery: sym: "SYNC-1" "S1"
1322855-1322957 usb_power_delivery: sym: "SYNC-1" "S1"
1322957-1323055 usb_power_delivery: sym: "SYNC-1" "S1"
1323055-1323157 usb_power_delivery: sym: "SYNC-2" "S2"
1322757-1323157 usb_power_delivery: sop: "SOP" "S"
1323157-1323255 usb_power_delivery: sym: "0x1" "1"
1323255-1323355 usb_power_delivery: sym: "0x6" "6"
1323355-1323457 usb_power_delivery: sym: "0x1" "1"
1323457-1323555 usb_power_delivery: sym: "0x1" "1"
1323157-1323555 usb_power_delivery: header: "H:1161" "HD"
1321482-1325295 usb_power_delivery: src: "(r2) SRC[0]: SOURCE CAP" "SOURCE CAP"
1323555-1323655 usb_power_delivery: sym: "0xC" "C"
1323655-1323757 usb_power_delivery: sym: "0x2" "2"
1323757-1323855 usb_power_delivery: sym: "0x1" "1"
1323855-1323955 usb_power_delivery: sym: "0x9" "9"
1323955-1324057 usb_power_delivery: sym: "0x1" "1"
1324057-1324155 usb_power_delivery: sym: "0x0" "0"
1324155-1324257 usb_power_delivery: sym: "0x4" "4"
1324257-1324355 usb_power_delivery: sym: "0x2" "2"
1323555-1324355 usb_power_delivery: data: "[0]2401912c" "D0"
1323555-1324355 usb_power_delivery: payload: "[1] [Fixed] 5V 3A (15W) [dual_role_power] [comm_cap]" "[1] [Fixed] 5V 3A (15W) [dual_role_power] [comm_cap]"
1324355-1324457 usb_power_delivery: sym: "0xF" "F"
1324457-1324555 usb_power_delivery: sym: "0xB" "B"
1324555-1324657 usb_power_delivery: sym: "0x4" "4"
1324657-1324755 usb_power_delivery: sym: "0xD" "D"
1324755-1324857 usb_power_delivery: sym: "0x7" "7"
1324857-1324957 usb_power_delivery: sym: "0xC" "C"
1324957-1325057 usb_power_delivery: sym: "0xC" "C"
1325057-1325155 usb_power_delivery: sym: "0x1" "1"
1324355-1325155 usb_power_delivery: crc: "CRC:1cc7d4bf" "CRC"
1325155-1325255 usb_power_delivery: sym: "EOP" "#"
1325155-1325255 usb_power_delivery: eop: "EOP" "E"
1321482-1325255 usb_power_delivery: text: "#14   (220.247000ms): (r2) SRC[0]: SOURCE CAP - [1] [Fixed] 5V 3A (15W) [dual_role_power] [comm_cap]" "..."
1332160-1333436 usb_power_delivery: preamble: "Preamble" "..."
1333436-1333534 usb_power_delivery: sym: "SYNC-1" "S1"
1333534-1333636 usb_power_delivery: sym: "SYNC-1" "S1"
1333636-1333734 usb_power_delivery: sym: "SYNC-1" "S1"
1333734-1333836 usb_power_delivery: sym: "SYNC-2" "S2"
1333436-1333836 usb_power_delivery: sop: "SOP" "S"
1333836-1333934 usb_power_delivery: sym: "0x1" "1"
1333934-1334034 usb_power_delivery: sym: "0x6" "6"
1334034-1334136 usb_power_delivery: sym: "0x1" "1"
1334136-1334234 usb_power_delivery: sym: "0x1" "1"
1333836-1334234 usb_power_delivery: header: "H:1161" "HD"
1332160-1335974 usb_power_delivery: src: "(r2) SRC[0]: SOURCE CAP" "SOURCE CAP"
1334234-1334334 usb_power_delivery: sym: "0xC" "C"
1334334-1334436 usb_power_delivery: sym: "0x2" "2"
1334436-1334534 usb_power_delivery: sym: "0x1" "1"
1334534-1334634 usb_power_delivery: sym: "0x9" "9"
1334634-1334736 usb_power_delivery: sym: "0x1" "1"
1334736-1334834 usb_power_delivery: sym: "0x0" "0"
1334834-1334936 usb_power_delivery: sym: "0x4" "4"
1334936-1335034 usb_power_delivery: sym: "0x2" "2"
1334234-1335034 usb_power_delivery: data: "[0]2401912c" "D0"
1334234-1335034 usb_power_delivery: payload: "[1] [Fixed] 5V 3A (15W) [dual_role_power] [comm_cap]" "[1] [Fixed] 5V 3A (15W) [dual_role_power] [comm_cap]"
1335034-1335136 usb_power_delivery: sym: "0xF" "F"
1335136-1335234 usb_power_delivery: sym: "0xB" "B"
1335234-1335336 usb_power_delivery: sym: "0x4" "4"
1335336-1335434 usb_power_delivery: sym: "0xD" "D"
1335434-1335536 usb_power_delivery: sym: "0x7" "7"
1335536-1335636 usb_power_delivery: sym: "0xC" "C"
1335636-1335736 usb_power_delivery: sym: "0xC" "C"
1335736-1335834 usb_power_delivery: sym: "0x1" "1"
1335034-1335834 usb_power_delivery: crc: "CRC:1cc7d4bf" "CRC"
1335834-1335934 usb_power_delivery: sym: "EOP" "#"
1335834-1335934 usb_power_delivery: eop: "EOP" "E"
1332160-1335934 usb_power_delivery: text: "#15   (222.026667ms): (r2) SRC[0]: SOURCE CAP - [1] [Fixed] 5V 3A (15W) [dual_role_power] [comm_cap]" "..."
1342839-1344114 usb_power_delivery: preamble: "Preamble" "..."
1344114-1344213 usb_power_delivery: sym: "SYNC-1" "S1"
1344213-1344314 usb_power_delivery: sym: "SYNC-1" "S1"
1344314-1344413 usb_power_delivery: sym: "SYNC-1" "S1"
1344413-1344514 usb_power_delivery: sym: "SYNC-2" "S2"
1344114-1344514 usb_power_delivery: sop: "SOP" "S"
1344514-1344613 usb_power_delivery: sym: "0x1" "1"
1344613-1344713 usb_power_delivery: sym: "0x6" "6"
1344713-1344814 usb_power_delivery: sym: "0x1" "1"
1344814-1344913 usb_power_delivery: sym: "0x1" "1"
1344514-1344913 usb_power_delivery: header: "H:1161" "HD"
1342839-1346653 usb_power_delivery: src: "(r2) SRC[0]: SOURCE CAP" "SOURCE CAP"
1344913-1345013 usb_power_delivery: sym: "0xC" "C"
1345013-1345115 usb_power_delivery: sym: "0x2" "2"
1345115-1345213 usb_power_delivery: sym: "0x1" "1"
1345213-1345313 usb_power_delivery: sym: "0x9" "9"
1345313-1345415 usb_power_delivery: sym: "0x1" "1"
1345415-1345513 usb_power_delivery: sym: "0x0" "0"
1345513-1345615 usb_power_delivery: sym: "0x4" "4"
1345615-1345713 usb_power_delivery: sym: "0x2" "2"
1344913-1345713 usb_power_delivery: data: "[0]2401912c" "D0"
1344913-1345713 usb_power_delivery: payload: "[1] [Fixed] 5V 3A (15W) [dual_role_power] [comm_cap]" "[1] [Fixed] 5V 3A (15W) [dual_role_power] [comm_cap]"
1345713-1345815 usb_power_delivery: sym: "0xF" "F"
1345815-1345913 usb_power_delivery: sym: "0xB" "B"
1345913-1346015 usb_power_delivery: sym: "0x4" "4"
1346015-1346113 usb_power_delivery: sym: "0xD" "D"
1346113-1346215 usb_power_delivery: sym: "0x7" "7"
1346215-1346315 usb_power_delivery: sym: "0xC" "C"
1346315-1346415 usb_power_delivery: sym: "0xC" "C"
1346415-1346513 usb_power_delivery: sym: "0x1" "1"
1345713-1346513 usb_power_delivery: crc: "CRC:1cc7d4bf" "CRC"
1346513-1346613 usb_power_delivery: sym: "EOP" "#"
1346513-1346613 usb_power_delivery: eop: "EOP" "E"
1342839-1346613 usb_power_delivery: text: "#16   (223.806500ms): (r2) SRC[0]: SOURCE CAP - [1] [Fixed] 5V 3A (15W) [dual_role_power] [comm_cap]" "..."
2413341-2414617 usb_power_delivery: preamble: "Preamble" "..."
2414617-2414715 usb_power_delivery: sym: "SYNC-1" "S1"
2414715-2414817 usb_power_delivery: sym: "SYNC-1" "S1"
2414817-2414915 usb_power_delivery: sym: "SYNC-3" "S3"
2414915-2415017 usb_power_delivery: sym: "SYNC-3" "S3"
2414617-2415017 usb_power_delivery: sop: "SOP'" "S"
2415017-2415115 usb_power_delivery: sym: "0xF" "F"
2415115-2415217 usb_power_delivery: sym: "0x4" "4"
2415217-2415315 usb_power_delivery: sym: "0x0" "0"
2415315-2415417 usb_power_delivery: sym: "0x1" "1"
2415017-2415417 usb_power_delivery: header: "H:104f" "HD"
2413341-2417135 usb_power_delivery: snk: "(r2) SNK[0]: VDM" "VDM"
2415417-2415515 usb_power_delivery: sym: "0x1" "1"
2415515-2415617 usb_power_delivery: sym: "0x0" "0"
2415617-2415715 usb_power_delivery: sym: "0x0" "0"
2415715-2415817 usb_power_delivery: sym: "0x8" "8"
2415817-2415915 usb_power_delivery: sym: "0x0" "0"
2415915-2416017 usb_power_delivery: sym: "0x0" "0"
2416017-2416115 usb_power_delivery: sym: "0xF" "F"
2416115-2416217 usb_power_delivery: sym: "0xF" "F"
2415417-2416217 usb_power_delivery: data: "[0]ff008001" "D0"
2415417-2416217 usb_power_delivery: payload: "[1] REQ Disc Ident  SVID:ff00" "[1] REQ Disc Ident  SVID:ff00"
2416217-2416315 usb_power_delivery: sym: "0x0" "0"
2416315-2416417 usb_power_delivery: sym: "0xF" "F"
2416417-2416515 usb_power_delivery: sym: "0xD" "D"
2416515-2416617 usb_power_delivery: sym: "0x1" "1"
2416617-2416715 usb_power_delivery: sym: "0x7" "7"
2416715-2416815 usb_power_delivery: sym: "0xA" "A"
2416815-2416917 usb_power_delivery: sym: "0xB" "B"
2416917-2417017 usb_power_delivery: sym: "0x5" "5"
2416217-2417017 usb_power_delivery: crc: "CRC:5ba71df0" "CRC"
2417017-2417117 usb_power_delivery: sym: "EOP" "#"
2417017-2417117 usb_power_delivery: eop: "EOP" "E"
2413341-2417117 usb_power_delivery: text: "#17   (402.223500ms): (r2) SNK[0]: VDM - [1] REQ Disc Ident  SVID:ff00" "..."
2424000-2425275 usb_power_delivery: preamble: "Preamble" "..."
2425275-2425374 usb_power_delivery: sym: "SYNC-1" "S1"
2425374-2425475 usb_power_delivery: sym: "SYNC-1" "S1"
2425475-2425574 usb_power_delivery: sym: "SYNC-3" "S3"
2425574-2425675 usb_power_delivery: sym: "SYNC-3" "S3"
2425275-2425675 usb_power_delivery: sop: "SOP'" "S"
2425675-2425774 usb_power_delivery: sym: "0xF" "F"
2425774-2425875 usb_power_delivery: sym: "0x4" "4"
2425875-2425974 usb_power_delivery: sym: "0x0" "0"
2425974-2426076 usb_power_delivery: sym: "0x1" "1"
2425675-2426076 usb_power_delivery: header: "H:104f" "HD"
2424000-2427794 usb_power_delivery: snk: "(r2) SNK[0]: VDM" "VDM"
2426076-2426174 usb_power_delivery: sym: "0x1" "1"
2426174-2426275 usb_power_delivery: sym: "0x0" "0"
2426275-2426374 usb_power_delivery: sym: "0x0" "0"
2426374-2426475 usb_power_delivery: sym: "0x8" "8"
2426475-2426574 usb_power_delivery: sym: "0x0" "0"
2426574-2426676 usb_power_delivery: sym: "0x0" "0"
2426676-2426774 usb_power_delivery: sym: "0xF" "F"
2426774-2426876 usb_power_delivery: sym: "0xF" "F"
2426076-2426876 usb_power_delivery: data: "[0]ff008001" "D0"
2426076-2426876 usb_power_delivery: payload: "[1] REQ Disc Ident  SVID:ff00" "[1] REQ Disc Ident  SVID:ff00"
2426876-2426974 usb_power_delivery: sym: "0x0" "0"
2426974-2427076 usb_power_delivery: sym: "0xF" "F"
2427076-2427174 usb_power_delivery: sym: "0xD" "D"
2427174-2427276 usb_power_delivery: sym: "0x1" "1"
2427276-2427374 usb_power_delivery: sym: "0x7" "7"
2427374-2427474 usb_power_delivery: sym: "0xA" "A"
2427474-2427576 usb_power_delivery: sym: "0xB" "B"
2427576-2427676 usb_power_delivery: sym: "0x5" "5"
2426876-2427676 usb_power_delivery: crc: "CRC:5ba71df0" "CRC"
2427676-2427776 usb_power_delivery: sym: "EOP" "#"
2427676-2427776 usb_power_delivery: eop: "EOP" "E"
2424000-2427776 usb_power_delivery: text: "#18   (404.000000ms): (r2) SNK[0]: VDM - [1] REQ Disc Ident  SVID:ff00" "..."
2434659-2435934 usb_power_delivery: preamble: "Preamble" "..."
2435934-2436032 usb_power_delivery: sym: "SYNC-1" "S1"
2436032-2436134 usb_power_delivery: sym: "SYNC-1" "S1"
2436134-2436232 usb_power_delivery: sym: "SYNC-3" "S3"
2436232-2436334 usb_power_delivery: sym: "SYNC-3" "S3"
2435934-2436334 usb_power_delivery: sop: "SOP'" "S"
2436334-2436432 usb_power_delivery: sym: "0xF" "F"
2436432-2436534 usb_power_delivery: sym: "0x4" "4"
2436534-2436632 usb_power_delivery: sym: "0x0" "0"
2436632-2436734 usb_power_delivery: sym: "0x1" "1"
2436334-2436734 usb_power_delivery: header: "H:104f" "HD"
2434659-2438453 usb_power_delivery: snk: "(r2) SNK[0]: VDM" "VDM"
2436734-2436832 usb_power_delivery: sym: "0x1" "1"
2436832-2436934 usb_power_delivery: sym: "0x0" "0"
2436934-2437032 usb_power_delivery: sym: "0x0" "0"
2437032-2437134 usb_power_delivery: sym: "0x8" "8"
2437134-2437232 usb_power_delivery: sym: "0x0" "0"
2437232-2437334 usb_power_delivery: sym: "0x0" "0"
2437334-2437432 usb_power_delivery: sym: "0xF" "F"
2437432-2437534 usb_power_delivery: sym: "0xF" "F"
2436734-2437534 usb_power_delivery: data: "[0]ff008001" "D0"
2436734-2437534 usb_power_delivery: payload: "[1] REQ Disc Ident  SVID:ff00" "[1] REQ Disc Ident  SVID:ff00"
2437534-2437632 usb_power_delivery: sym: "0x0" "0"
2437632-2437734 usb_power_delivery: sym: "0xF" "F"
2437734-2437832 usb_power_delivery: sym: "0xD" "D"
2437832-2437934 usb_power_delivery: sym: "0x1" "1"
2437934-2438033 usb_power_delivery: sym: "0x7" "7"
2438033-2438133 usb_power_delivery: sym: "0xA" "A"
2438133-2438234 usb_power_delivery: sym: "0xB" "B"
2438234-2438334 usb_power_delivery: sym: "0x5" "5"
2437534-2438334 usb_power_delivery: crc: "CRC:5ba71df0" "CRC"
2438334-2438434 usb_power_delivery: sym: "EOP" "#"
2438334-2438434 usb_power_delivery: eop: "EOP" "E"
2434659-2438434 usb_power_delivery: text: "#19   (405.776500ms): (r2) SNK[0]: VDM - [1] REQ Disc Ident  SVID:ff00" "..."
2445318-2446593 usb_power_delivery: preamble: "Preamble" "..."
2446593-2446691 usb_power_delivery: sym: "SYNC-1" "S1"
2446691-2446793 usb_power_delivery: sym: "SYNC-1" "S1"
2446793-2446891 usb_power_delivery: sym: "SYNC-3" "S3"
2446891-2446993 usb_power_delivery: sym: "SYNC-3" "S3"
2446593-2446993 usb_power_delivery: sop: "SOP'" "S"
2446993-2447091 usb_power_delivery: sym: "0xF" "F"
2447091-2447193 usb_power_delivery: sym: "0x4" "4"
2447193-2447291 usb_power_delivery: sym: "0x0" "0"
2447291-2447393 usb_power_delivery: sym: "0x1" "1"
2446993-2447393 usb_power_delivery: header: "H:104f" "HD"
2445318-2449111 usb_power_delivery: snk: "(r2) SNK[0]: VDM" "VDM"
2447393-2447491 usb_power_delivery: sym: "0x1" "1"
2447491-2447593 usb_power_delivery: sym: "0x0" "0"
2447593-2447691 usb_power_delivery: sym: "0x0" "0"
2447691-2447793 usb_power_delivery: sym: "0x8" "8"
2447793-2447891 usb_power_delivery: sym: "0x0" "0"
2447891-2447993 usb_power_delivery: sym: "0x0" "0"
2447993-2448091 usb_power_delivery: sym: "0xF" "F"
2448091-2448193 usb_power_delivery: sym: "0xF" "F"
2447393-2448193 usb_power_delivery: data: "[0]ff008001" "D0"
2447393-2448193 usb_power_delivery: payload: "[1] REQ Disc Ident  SVID:ff00" "[1] REQ Disc Ident  SVID:ff00"
2448193-2448291 usb_power_delivery: sym: "0x0" "0"
2448291-2448393 usb_power_delivery: sym: "0xF" "F"
2448393-2448491 usb_power_delivery: sym: "0xD" "D"
2448491-2448593 usb_power_delivery: sym: "0x1" "1"
2448593-2448691 usb_power_delivery: sym: "0x7" "7"
2448691-2448791 usb_power_delivery: sym: "0xA" "A"
2448791-2448893 usb_power_delivery: sym: "0xB" "B"
2448893-2448993 usb_power_delivery: sym: "0x5" "5"
2448193-2448993 usb_power_delivery: crc: "CRC:5ba71df0" "CRC"
2448993-2449093 usb_power_delivery: sym: "EOP" "#"
2448993-2449093 usb_power_delivery: eop: "EOP" "E"
2445318-2449093 usb_power_delivery: text: "#20   (407.553000ms): (r2) SNK[0]: VDM - [1] REQ Disc Ident  SVID:ff00" "..."
2456932-2458207 usb_power_delivery: preamble: "Preamble" "..."
2458207-2458305 usb_power_delivery: sym: "SYNC-1" "S1"
2458305-2458407 usb_power_delivery: sym: "SYNC-1" "S1"
2458407-2458505 usb_power_delivery: sym: "SYNC-1" "S1"
2458505-2458607 usb_power_delivery: sym: "SYNC-2" "S2"
2458207-2458607 usb_power_delivery: sop: "SOP" "S"
2458607-2458705 usb_power_delivery: sym: "0x1" "1"
2458705-2458805 usb_power_delivery: sym: "0x6" "6"
2458805-2458907 usb_power_delivery: sym: "0x1" "1"
2458907-2459005 usb_power_delivery: sym: "0x1" "1"
2458607-2459005 usb_power_delivery: header: "H:1161" "HD"
2456932-2460745 usb_power_delivery: src: "(r2) SRC[0]: SOURCE CAP" "SOURCE CAP"
2459005-2459105 usb_power_delivery: sym: "0xC" "C"
2459105-2459207 usb_power_delivery: sym: "0x2" "2"
2459207-2459305 usb_power_delivery: sym: "0x1" "1"
2459305-2459405 usb_power_delivery: sym: "0x9" "9"
2459405-2459507 usb_power_delivery: sym: "0x1" "1"
2459507-2459605 usb_power_delivery: sym: "0x0" "0"
2459605-2459707 usb_power_delivery: sym: "0x4" "4"
2459707-2459805 usb_power_delivery: sym: "0x2" "2"
2459005-2459805 usb_power_delivery: data: "[0]2401912c" "D0"
2459005-2459805 usb_power_delivery: payload: "[1] [Fixed] 5V 3A (15W) [dual_role_power] [comm_cap]" "[1] [Fixed] 5V 3A (15W) [dual_role_power] [comm_cap]"
2459805-2459907 usb_power_delivery: sym: "0xF" "F"
2459907-2460005 usb_power_delivery: sym: "0xB" "B"
2460005-2460107 usb_power_delivery: sym: "0x4" "4"
2460107-2460205 usb_power_delivery: sym: "0xD" "D"
2460205-2460307 usb_power_delivery: sym: "0x7" "7"
2460307-2460407 usb_power_delivery: sym: "0xC" "C"
2460407-2460507 usb_power_delivery: sym: "0xC" "C"
2460507-2460605 usb_power_delivery: sym: "0x1" "1"
2459805-2460605 usb_power_delivery: crc: "CRC:1cc7d4bf" "CRC"
2460605-2460705 usb_power_delivery: sym: "EOP" "#"
2460605-2460705 usb_power_delivery: eop: "EOP" "E"
2456932-2460705 usb_power_delivery: text: "#21   (409.488667ms): (r2) SRC[0]: SOURCE CAP - [1] [Fixed] 5V 3A (15W) [dual_role_power] [comm_cap]" "..."
2461591-2462872 usb_power_delivery: preamble: "Preamble" "..."
2462872-2462969 usb_power_delivery: sym: "SYNC-1" "S1"
2462969-2463072 usb_power_delivery: sym: "SYNC-1" "S1"
2463072-2463169 usb_power_delivery: sym: "SYNC-1" "S1"
2463169-2463272 usb_power_delivery: sym: "SYNC-2" "S2"
2462872-2463272 usb_power_delivery: sop: "SOP" "S"
2463272-2463369 usb_power_delivery: sym: "0x1" "1"
2463369-2463472 usb_power_delivery: sym: "0x4" "4"
2463472-2463569 usb_power_delivery: sym: "0x0" "0"
2463569-2463672 usb_power_delivery: sym: "0x0" "0"
2463272-2463672 usb_power_delivery: header: "H:0041" "HD"
2461591-2464610 usb_power_delivery: snk: "(r2) SNK[0]: GOOD CRC" "GOOD CRC"
2463672-2463769 usb_power_delivery: sym: "0xB" "B"
2463769-2463872 usb_power_delivery: sym: "0xB" "B"
2463872-2463972 usb_power_delivery: sym: "0xC" "C"
2463972-2464072 usb_power_delivery: sym: "0x6" "6"
2464072-2464169 usb_power_delivery: sym: "0xB" "B"
2464169-2464272 usb_power_delivery: sym: "0xB" "B"
2464272-2464370 usb_power_delivery: sym: "0x8" "8"
2464370-2464470 usb_power_delivery: sym: "0xA" "A"
2463672-2464470 usb_power_delivery: crc: "CRC:a8bb6cbb" "CRC"
2464470-2464570 usb_power_delivery: sym: "EOP" "#"
2464470-2464570 usb_power_delivery: eop: "EOP" "E"
2461591-2464570 usb_power_delivery: text: "#22   (410.265167ms): (r2) SNK[0]: GOOD CRC" "..."
2490293-2491574 usb_power_delivery: preamble: "Preamble" "..."
2491574-2491672 usb_power_delivery: sym: "SYNC-1" "S1"
2491672-2491774 usb_power_delivery: sym: "SYNC-1" "S1"
2491774-2491872 usb_power_delivery: sym: "SYNC-1" "S1"
2491872-2491974 usb_power_delivery: sym: "SYNC-2" "S2"
2491574-2491974 usb_power_delivery: sop: "SOP" "S"
2491974-2492072 usb_power_delivery: sym: "0x2" "2"
2492072-2492174 usb_power_delivery: sym: "0x4" "4"
2492174-2492272 usb_power_delivery: sym: "0x0" "0"
2492272-2492374 usb_power_delivery: sym: "0x1" "1"
2491974-2492374 usb_power_delivery: header: "H:1042" "HD"
2490293-2494092 usb_power_delivery: snk: "(r2) SNK[0]: REQUEST" "REQUEST"
2492374-2492474 usb_power_delivery: sym: "0xC" "C"
2492474-2492572 usb_power_delivery: sym: "0x2" "2"
2492572-2492674 usb_power_delivery: sym: "0x1" "1"
2492674-2492772 usb_power_delivery: sym: "0xB" "B"
2492772-2492874 usb_power_delivery: sym: "0x4" "4"
2492874-2492972 usb_power_delivery: sym: "0x0" "0"
2492972-2493074 usb_power_delivery: sym: "0x2" "2"
2493074-2493172 usb_power_delivery: sym: "0x1" "1"
2492374-2493172 usb_power_delivery: data: "[0]1204b12c" "D0"
2492374-2493172 usb_power_delivery: payload: "[1] (PDO #1: Fixed 5V) 3A (operating) / 3A (max) [comm_cap]" "[1] (PDO #1: Fixed 5V) 3A (operating) / 3A (max) [comm_cap]"
2493172-2493274 usb_power_delivery: sym: "0xB" "B"
2493274-2493374 usb_power_delivery: sym: "0xA" "A"
2493374-2493472 usb_power_delivery: sym: "0xD" "D"
2493472-2493572 usb_power_delivery: sym: "0xA" "A"
2493572-2493674 usb_power_delivery: sym: "0xF" "F"
2493674-2493772 usb_power_delivery: sym: "0x1" "1"
2493772-2493872 usb_power_delivery: sym: "0xA" "A"
2493872-2493974 usb_power_delivery: sym: "0x2" "2"
2493172-2493974 usb_power_delivery: crc: "CRC:2a1fadab" "CRC"
2493974-2494074 usb_power_delivery: sym: "EOP" "#"
2493974-2494074 usb_power_delivery: eop: "EOP" "E"
2490293-2494074 usb_power_delivery: text: "#23   (415.048833ms): (r2) SNK[0]: REQUEST - [1] (PDO #1: Fixed 5V) 3A (operating) / 3A (max) [comm_cap]" "..."
2494737-2496012 usb_power_delivery: preamble: "Preamble" "..."
2496012-2496110 usb_power_delivery: sym: "SYNC-1" "S1"
2496110-2496212 usb_power_delivery: sym: "SYNC-1" "S1"
2496212-2496310 usb_power_delivery: sym: "SYNC-1" "S1"
2496310-2496412 usb_power_delivery: sym: "SYNC-2" "S2"
2496012-2496412 usb_power_delivery: sop: "SOP" "S"
2496412-2496510 usb_power_delivery: sym: "0x1" "1"
2496510-2496610 usb_power_delivery: sym: "0x6" "6"
2496610-2496712 usb_power_delivery: sym: "0x1" "1"
2496712-2496810 usb_power_delivery: sym: "0x0" "0"
2496412-2496810 usb_power_delivery: header: "H:0161" "HD"
2494737-2497750 usb_power_delivery: src: "(r2) SRC[0]: GOOD CRC" "GOOD CRC"
2496810-2496912 usb_power_delivery: sym: "0xF" "F"
2496912-2497010 usb_power_delivery: sym: "0x8" "8"
2497010-2497112 usb_power_delivery: sym: "0x8" "8"
2497112-2497210 usb_power_delivery: sym: "0x7" "7"
2497210-2497312 usb_power_delivery: sym: "0x8" "8"
2497312-2497412 usb_power_delivery: sym: "0x3" "3"
2497412-2497512 usb_power_delivery: sym: "0xA" "A"
2497512-2497610 usb_power_delivery: sym: "0x4" "4"
2496810-2497610 usb_power_delivery: crc: "CRC:4a38788f" "CRC"
2497610-2497710 usb_power_delivery: sym: "EOP" "#"
2497610-2497710 usb_power_delivery: eop: "EOP" "E"
2494737-2497710 usb_power_delivery: text: "#24   (415.789500ms): (r2) SRC[0]: GOOD CRC" "..."
2498939-2500214 usb_power_delivery: preamble: "Preamble" "..."
2500214-2500312 usb_power_delivery: sym: "SYNC-1" "S1"
2500312-2500414 usb_power_delivery: sym: "SYNC-1" "S1"
2500414-2500512 usb_power_delivery: sym: "SYNC-1" "S1"
2500512-2500614 usb_power_delivery: sym: "SYNC-2" "S2"
2500214-2500614 usb_power_delivery: sop: "SOP" "S"
2500614-2500714 usb_power_delivery: sym: "0x3" "3"
2500714-2500814 usb_power_delivery: sym: "0x6" "6"
2500814-2500914 usb_power_delivery: sym: "0x3" "3"
2500914-2501012 usb_power_delivery: sym: "0x0" "0"
2500614-2501012 usb_power_delivery: header: "H:0363" "HD"
2498939-2501952 usb_power_delivery: src: "(r2) SRC[1]: ACCEPT" "ACCEPT"
2501012-2501114 usb_power_delivery: sym: "0x1" "1"
2501114-2501212 usb_power_delivery: sym: "0x2" "2"
2501212-2501314 usb_power_delivery: sym: "0xB" "B"
2501314-2501412 usb_power_delivery: sym: "0x7" "7"
2501412-2501514 usb_power_delivery: sym: "0x0" "0"
2501514-2501612 usb_power_delivery: sym: "0x0" "0"
2501612-2501712 usb_power_delivery: sym: "0x6" "6"
2501712-2501812 usb_power_delivery: sym: "0x9" "9"
2501012-2501812 usb_power_delivery: crc: "CRC:96007b21" "CRC"
2501812-2501912 usb_power_delivery: sym: "EOP" "#"
2501812-2501912 usb_power_delivery: eop: "EOP" "E"
2498939-2501912 usb_power_delivery: text: "#25   (416.489833ms): (r2) SRC[1]: ACCEPT" "..."
2502794-2504075 usb_power_delivery: preamble: "Preamble" "..."
2504075-2504172 usb_power_delivery: sym: "SYNC-1" "S1"
2504172-2504275 usb_power_delivery: sym: "SYNC-1" "S1"
2504275-2504372 usb_power_delivery: sym: "SYNC-1" "S1"
2504372-2504475 usb_power_delivery: sym: "SYNC-2" "S2"
2504075-2504475 usb_power_delivery: sop: "SOP" "S"
2504475-2504572 usb_power_delivery: sym: "0x1" "1"
2504572-2504675 usb_power_delivery: sym: "0x4" "4"
2504675-2504772 usb_power_delivery: sym: "0x2" "2"
2504772-2504875 usb_power_delivery: sym: "0x0" "0"
2504475-2504875 usb_power_delivery: header: "H:0241" "HD"
2502794-2505813 usb_power_delivery: snk: "(r2) SNK[1]: GOOD CRC" "GOOD CRC"
2504875-2504973 usb_power_delivery: sym: "0x7" "7"
2504973-2505073 usb_power_delivery: sym: "0x9" "9"
2505073-2505175 usb_power_delivery: sym: "0xD" "D"
2505175-2505272 usb_power_delivery: sym: "0x0" "0"
2505272-2505373 usb_power_delivery: sym: "0x5" "5"
2505373-2505475 usb_power_delivery: sym: "0xB" "B"
2505475-2505575 usb_power_delivery: sym: "0x6" "6"
2505575-2505673 usb_power_delivery: sym: "0x4" "4"
2504875-2505673 usb_power_delivery: crc: "CRC:46b50d97" "CRC"
2505673-2505773 usb_power_delivery: sym: "EOP" "#"
2505673-2505773 usb_power_delivery: eop: "EOP" "E"
2502794-2505773 usb_power_delivery: text: "#26   (417.132333ms): (r2) SNK[1]: GOOD CRC" "..."
2714643-2715918 usb_power_delivery: preamble: "Preamble" "..."
2715918-2716016 usb_power_delivery: sym: "SYNC-1" "S1"
2716016-2716118 usb_power_delivery: sym: "SYNC-1" "S1"
2716118-2716216 usb_power_delivery: sym: "SYNC-1" "S1"
2716216-2716318 usb_power_delivery: sym: "SYNC-2" "S2"
2715918-2716318 usb_power_delivery: sop: "SOP" "S"
2716318-2716418 usb_power_delivery: sym: "0x6" "6"
2716418-2716518 usb_power_delivery: sym: "0x6" "6"
2716518-2716618 usb_power_delivery: sym: "0x5" "5"
2716618-2716716 usb_power_delivery: sym: "0x0" "0"
2716318-2716716 usb_power_delivery: header: "H:0566" "HD"
2714643-2717657 usb_power_delivery: src: "(r2) SRC[2]: PS RDY" "PS RDY"
2716716-2716818 usb_power_delivery: sym: "0x1" "1"
2716818-2716918 usb_power_delivery: sym: "0x5" "5"
2716918-2717018 usb_power_delivery: sym: "0xA" "A"
2717018-2717117 usb_power_delivery: sym: "0x2" "2"
2717117-2717218 usb_power_delivery: sym: "0x4" "4"
2717218-2717317 usb_power_delivery: sym: "0x1" "1"
2717317-2717418 usb_power_delivery: sym: "0x2" "2"
2717418-2717517 usb_power_delivery: sym: "0x0" "0"
2716716-2717517 usb_power_delivery: crc: "CRC:02142a51" "CRC"
2717517-2717617 usb_power_delivery: sym: "EOP" "#"
2717517-2717617 usb_power_delivery: eop: "EOP" "E"
2714643-2717617 usb_power_delivery: text: "#27   (452.440500ms): (r2) SRC[2]: PS RDY" "..."
2718509-2719790 usb_power_delivery: preamble: "Preamble" "..."
2719790-2719888 usb_power_delivery: sym: "SYNC-1" "S1"
2719888-2719990 usb_power_delivery: sym: "SYNC-1" "S1"
2719990-2720088 usb_power_delivery: sym: "SYNC-1" "S1"
2720088-2720191 usb_power_delivery: sym: "SYNC-2" "S2"
2719790-2720191 usb_power_delivery: sop: "SOP" "S"
2720191-2720288 usb_power_delivery: sym: "0x1" "1"
2720288-2720390 usb_power_delivery: sym: "0x4" "4"
2720390-2720488 usb_power_delivery: sym: "0x4" "4"
2720488-2720590 usb_power_delivery: sym: "0x0" "0"
2720191-2720590 usb_power_delivery: header: "H:0441" "HD"
2718509-2721509 usb_power_delivery: snk: "(r2) SNK[2]: GOOD CRC" "GOOD CRC"
2720590-2720688 usb_power_delivery: sym: "0x2" "2"
2720688-2720788 usb_power_delivery: sym: "0xA" "A"
2720788-2720891 usb_power_delivery: sym: "0x8" "8"
2720891-2720991 usb_power_delivery: sym: "0xA" "A"
2720991-2721091 usb_power_delivery: sym: "0x6" "6"
2721091-2721188 usb_power_delivery: sym: "0xD" "D"
2721188-2721291 usb_power_delivery: sym: "0xF" "F"
2721291-2721391 usb_power_delivery: sym: "0xA" "A"
2720590-2721391 usb_power_delivery: crc: "CRC:afd6a8a2" "CRC"
2721391-2721491 usb_power_delivery: sym: "EOP" "#"
2721391-2721491 usb_power_delivery: eop: "EOP" "E"
2718509-2721491 usb_power_delivery: text: "#28   (453.084833ms): (r2) SNK[2]: GOOD CRC" "..."
2784552-2785827 usb_power_delivery: preamble: "Preamble" "..."
2785827-2785925 usb_power_delivery: sym: "SYNC-1" "S1"
2785925-2786027 usb_power_delivery: sym: "SYNC-1" "S1"
2786027-2786125 usb_power_delivery: sym: "SYNC-1" "S1"
2786125-2786227 usb_power_delivery: sym: "SYNC-2" "S2"
2785827-2786227 usb_power_delivery: sop: "SOP" "S"
2786227-2786325 usb_power_delivery: sym: "0xF" "F"
2786325-2786425 usb_power_delivery: sym: "0x6" "6"
2786425-2786527 usb_power_delivery: sym: "0x7" "7"
2786527-2786625 usb_power_delivery: sym: "0x1" "1"
2786227-2786625 usb_power_delivery: header: "H:176f" "HD"
2784552-2788365 usb_power_delivery: src: "(r2) SRC[3]: VDM" "VDM"
2786625-2786727 usb_power_delivery: sym: "0x1" "1"
2786727-2786825 usb_power_delivery: sym: "0x0" "0"
2786825-2786927 usb_power_delivery: sym: "0x0" "0"
2786927-2787025 usb_power_delivery: sym: "0x8" "8"
2787025-2787127 usb_power_delivery: sym: "0x0" "0"
2787127-2787225 usb_power_delivery: sym: "0x0" "0"
2787225-2787327 usb_power_delivery: sym: "0xF" "F"
2787327-2787425 usb_power_delivery: sym: "0xF" "F"
2786625-2787425 usb_power_delivery: data: "[0]ff008001" "D0"
2786625-2787425 usb_power_delivery: payload: "[1] REQ Disc Ident  SVID:ff00" "[1] REQ Disc Ident  SVID:ff00"
2787425-2787525 usb_power_delivery: sym: "0x6" "6"
2787525-2787627 usb_power_delivery: sym: "0xD" "D"
2787627-2787725 usb_power_delivery: sym: "0x4" "4"
2787725-2787825 usb_power_delivery: sym: "0xC" "C"
2787825-2787927 usb_power_delivery: sym: "0xB" "B"
2787927-2788025 usb_power_delivery: sym: "0x2" "2"
2788025-2788125 usb_power_delivery: sym: "0xE" "E"
2788125-2788225 usb_power_delivery: sym: "0xE" "E"
2787425-2788225 usb_power_delivery: crc: "CRC:ee2bc4d6" "CRC"
2788225-2788325 usb_power_delivery: sym: "EOP" "#"
2788225-2788325 usb_power_delivery: eop: "EOP" "E"
2784552-2788325 usb_power_delivery: text: "#29   (464.092000ms): (r2) SRC[3]: VDM - [1] REQ Disc Ident  SVID:ff00" "..."
2789215-2790496 usb_power_delivery: preamble: "Preamble" "..."
2790496-2790593 usb_power_delivery: sym: "SYNC-1" "S1"
2790593-2790696 usb_power_delivery: sym: "SYNC-1" "S1"
2790696-2790793 usb_power_delivery: sym: "SYNC-1" "S1"
2790793-2790896 usb_power_delivery: sym: "SYNC-2" "S2"
2790496-2790896 usb_power_delivery: sop: "SOP" "S"
2790896-2790993 usb_power_delivery: sym: "0x1" "1"
2790993-2791096 usb_power_delivery: sym: "0x4" "4"
2791096-2791196 usb_power_delivery: sym: "0x6" "6"
2791196-2791293 usb_power_delivery: sym: "0x0" "0"
2790896-2791293 usb_power_delivery: header: "H:0641" "HD"
2789215-2792214 usb_power_delivery: snk: "(r2) SNK[3]: GOOD CRC" "GOOD CRC"
2791293-2791393 usb_power_delivery: sym: "0xE" "E"
2791393-2791496 usb_power_delivery: sym: "0x8" "8"
2791496-2791596 usb_power_delivery: sym: "0x9" "9"
2791596-2791696 usb_power_delivery: sym: "0xC" "C"
2791696-2791794 usb_power_delivery: sym: "0x8" "8"
2791794-2791896 usb_power_delivery: sym: "0xD" "D"
2791896-2791994 usb_power_delivery: sym: "0x1" "1"
2791994-2792096 usb_power_delivery: sym: "0x4" "4"
2791293-2792096 usb_power_delivery: crc: "CRC:41d8c98e" "CRC"
2792096-2792196 usb_power_delivery: sym: "EOP" "#"
2792096-2792196 usb_power_delivery: eop: "EOP" "E"
2789215-2792196 usb_power_delivery: text: "#30   (464.869167ms): (r2) SNK[3]: GOOD CRC" "..."
2807516-2808797 usb_power_delivery: preamble: "Preamble" "..."
2808797-2808895 usb_power_delivery: sym: "SYNC-1" "S1"
2808895-2808997 usb_power_delivery: sym: "SYNC-1" "S1"
2808997-2809095 usb_power_delivery: sym: "SYNC-1" "S1"
2809095-2809197 usb_power_delivery: sym: "SYNC-2" "S2"
2808797-2809197 usb_power_delivery: sop: "SOP" "S"
2809197-2809295 usb_power_delivery: sym: "0xF" "F"
2809295-2809397 usb_power_delivery: sym: "0x4" "4"
2809397-2809495 usb_power_delivery: sym: "0x2" "2"
2809495-2809595 usb_power_delivery: sym: "0x5" "5"
2809197-2809595 usb_power_delivery: header: "H:524f" "HD"
2807516-2814515 usb_power_delivery: snk: "(r2) SNK[1]: VDM" "VDM"
2809595-2809697 usb_power_delivery: sym: "0x1" "1"
2809697-2809795 usb_power_delivery: sym: "0x4" "4"
2809795-2809897 usb_power_delivery: sym: "0x0" "0"
2809897-2809995 usb_power_delivery: sym: "0x8" "8"
2809995-2810097 usb_power_delivery: sym: "0x0" "0"
2810097-2810195 usb_power_delivery: sym: "0x0" "0"
2810195-2810297 usb_power_delivery: sym: "0xF" "F"
2810297-2810395 usb_power_delivery: sym: "0xF" "F"
2809595-2810395 usb_power_delivery: data: "[0]ff008041" "D0"
2809595-2810395 usb_power_delivery: payload: "[1] ACK Disc Ident  SVID:ff00" "[1] ACK Disc Ident  SVID:ff00"
2810395-2810495 usb_power_delivery: sym: "0x9" "9"
2810495-2810597 usb_power_delivery: sym: "0x0" "0"
2810597-2810695 usb_power_delivery: sym: "0x1" "1"
2810695-2810797 usb_power_delivery: sym: "0x2" "2"
2810797-2810895 usb_power_delivery: sym: "0x0" "0"
2810895-2810997 usb_power_delivery: sym: "0x0" "0"
2810997-2811097 usb_power_delivery: sym: "0xC" "C"
2811097-2811197 usb_power_delivery: sym: "0x6" "6"
2810395-2811197 usb_power_delivery: data: "[1]6c002109" "D1"
2810395-2811197 usb_power_delivery: payload: "[2] VDO:6c002109" "[2] VDO:6c002109"
2811197-2811297 usb_power_delivery: sym: "0xC" "C"
2811297-2811395 usb_power_delivery: sym: "0x7" "7"
2811395-2811495 usb_power_delivery: sym: "0x3" "3"
2811495-2811597 usb_power_delivery: sym: "0x0" "0"
2811597-2811695 usb_power_delivery: sym: "0x0" "0"
2811695-2811797 usb_power_delivery: sym: "0x0" "0"
2811797-2811895 usb_power_delivery: sym: "0x0" "0"
2811895-2811997 usb_power_delivery: sym: "0x0" "0"
2811197-2811997 usb_power_delivery: data: "[2]0000037c" "D2"
2811197-2811997 usb_power_delivery: payload: "[3] VDO:0000037c" "[3] VDO:0000037c"
2811997-2812095 usb_power_delivery: sym: "0x1" "1"
2812095-2812197 usb_power_delivery: sym: "0x0" "0"
2812197-2812295 usb_power_delivery: sym: "0x0" "0"
2812295-2812397 usb_power_delivery: sym: "0x0" "0"
2812397-2812495 usb_power_delivery: sym: "0x0" "0"
2812495-2812597 usb_power_delivery: sym: "0x0" "0"
2812597-2812695 usb_power_delivery: sym: "0x1" "1"
2812695-2812797 usb_power_delivery: sym: "0x0" "0"
2811997-2812797 usb_power_delivery: data: "[3]01000001" "D3"
2811997-2812797 usb_power_delivery: payload: "[4] VDO:01000001" "[4] VDO:01000001"
2812797-2812897 usb_power_delivery: sym: "0x9" "9"
2812897-2812997 usb_power_delivery: sym: "0x3" "3"
2812997-2813095 usb_power_delivery: sym: "0x0" "0"
2813095-2813197 usb_power_delivery: sym: "0x0" "0"
2813197-2813295 usb_power_delivery: sym: "0x0" "0"
2813295-2813397 usb_power_delivery: sym: "0x0" "0"
2813397-2813495 usb_power_delivery: sym: "0x0" "0"
2813495-2813597 usb_power_delivery: sym: "0x0" "0"
2812797-2813597 usb_power_delivery: data: "[4]00000039" "D4"
2812797-2813597 usb_power_delivery: payload: "[5] VDO:00000039" "[5] VDO:00000039"
2813597-2813697 usb_power_delivery: sym: "0x5" "5"
2813697-2813797 usb_power_delivery: sym: "0x3" "3"
2813797-2813895 usb_power_delivery: sym: "0xD" "D"
2813895-2813997 usb_power_delivery: sym: "0x1" "1"
2813997-2814095 usb_power_delivery: sym: "0xF" "F"
2814095-2814197 usb_power_delivery: sym: "0x4" "4"
2814197-2814295 usb_power_delivery: sym: "0xB" "B"
2814295-2814397 usb_power_delivery: sym: "0x8" "8"
2813597-2814397 usb_power_delivery: crc: "CRC:8b4f1d35" "CRC"
2814397-2814497 usb_power_delivery: sym: "EOP" "#"
2814397-2814497 usb_power_delivery: eop: "EOP" "E"
2807516-2814497 usb_power_delivery: text: "#31   (467.919333ms): (r2) SNK[1]: VDM - [1] ACK Disc Ident  SVID:ff00 - [2] VDO:6c002109 - [3] VDO:0000037c - [4] VDO:01000001 - [5] VDO:00000039" "..."
2815161-2816436 usb_power_delivery: preamble: "Preamble" "..."
2816436-2816534 usb_power_delivery: sym: "SYNC-1" "S1"
2816534-2816636 usb_power_delivery: sym: "SYNC-1" "S1"
2816636-2816734 usb_power_delivery: sym: "SYNC-1" "S1"
2816734-2816836 usb_power_delivery: sym: "SYNC-2" "S2"
2816436-2816836 usb_power_delivery: sop: "SOP" "S"
2816836-2816934 usb_power_delivery: sym: "0x1" "1"
2816934-2817034 usb_power_delivery: sym: "0x6" "6"
2817034-2817134 usb_power_delivery: sym: "0x3" "3"
2817134-2817236 usb_power_delivery: sym: "0x0" "0"
2816836-2817236 usb_power_delivery: header: "H:0361" "HD"
2815161-2818154 usb_power_delivery: src: "(r2) SRC[1]: GOOD CRC" "GOOD CRC"
2817236-2817336 usb_power_delivery: sym: "0x3" "3"
2817336-2817436 usb_power_delivery: sym: "0xA" "A"
2817436-2817536 usb_power_delivery: sym: "0x9" "9"
2817536-2817634 usb_power_delivery: sym: "0x1" "1"
2817634-2817734 usb_power_delivery: sym: "0x6" "6"
2817734-2817834 usb_power_delivery: sym: "0x3" "3"
2817834-2817936 usb_power_delivery: sym: "0x4" "4"
2817936-2818036 usb_power_delivery: sym: "0xA" "A"
2817236-2818036 usb_power_delivery: crc: "CRC:a43619a3" "CRC"
2818036-2818136 usb_power_delivery: sym: "EOP" "#"
2818036-2818136 usb_power_delivery: eop: "EOP" "E"
2815161-2818136 usb_power_delivery: text: "#32   (469.193500ms): (r2) SRC[1]: GOOD CRC" "..."
2820590-2821865 usb_power_delivery: preamble: "Preamble" "..."
2821865-2821963 usb_power_delivery: sym: "SYNC-1" "S1"
2821963-2822065 usb_power_delivery: sym: "SYNC-1" "S1"
2822065-2822163 usb_power_delivery: sym: "SYNC-1" "S1"
2822163-2822265 usb_power_delivery: sym: "SYNC-2" "S2"
2821865-2822265 usb_power_delivery: sop: "SOP" "S"
2822265-2822363 usb_power_delivery: sym: "0xF" "F"
2822363-2822463 usb_power_delivery: sym: "0x6" "6"
2822463-2822563 usb_power_delivery: sym: "0x9" "9"
2822563-2822665 usb_power_delivery: sym: "0x1" "1"
2822265-2822665 usb_power_delivery: header: "H:196f" "HD"
2820590-2824383 usb_power_delivery: src: "(r2) SRC[4]: VDM" "VDM"
2822665-2822763 usb_power_delivery: sym: "0x2" "2"
2822763-2822865 usb_power_delivery: sym: "0x0" "0"
2822865-2822963 usb_power_delivery: sym: "0x0" "0"
2822963-2823065 usb_power_delivery: sym: "0x8" "8"
2823065-2823163 usb_power_delivery: sym: "0x0" "0"
2823163-2823265 usb_power_delivery: sym: "0x0" "0"
2823265-2823363 usb_power_delivery: sym: "0xF" "F"
2823363-2823465 usb_power_delivery: sym: "0xF" "F"
2822665-2823465 usb_power_delivery: data: "[0]ff008002" "D0"
2822665-2823465 usb_power_delivery: payload: "[1] REQ Disc SVID  SVID:ff00" "[1] REQ Disc SVID  SVID:ff00"
2823465-2823565 usb_power_delivery: sym: "0x9" "9"
2823565-2823665 usb_power_delivery: sym: "0x5" "5"
2823665-2823765 usb_power_delivery: sym: "0x5" "5"
2823765-2823863 usb_power_delivery: sym: "0xD" "D"
2823863-2823963 usb_power_delivery: sym: "0xE" "E"
2823963-2824063 usb_power_delivery: sym: "0xA" "A"
2824063-2824163 usb_power_delivery: sym: "0x3" "3"
2824163-2824265 usb_power_delivery: sym: "0x4" "4"
2823465-2824265 usb_power_delivery: crc: "CRC:43aed559" "CRC"
2824265-2824365 usb_power_delivery: sym: "EOP" "#"
2824265-2824365 usb_power_delivery: eop: "EOP" "E"
2820590-2824365 usb_power_delivery: text: "#33   (470.098333ms): (r2) SRC[4]: VDM - [1] REQ Disc SVID  SVID:ff00" "..."
2825217-2826498 usb_power_delivery: preamble: "Preamble" "..."
2826498-2826596 usb_power_delivery: sym: "SYNC-1" "S1"
2826596-2826698 usb_power_delivery: sym: "SYNC-1" "S1"
2826698-2826796 usb_power_delivery: sym: "SYNC-1" "S1"
2826796-2826898 usb_power_delivery: sym: "SYNC-2" "S2"
2826498-2826898 usb_power_delivery: sop: "SOP" "S"
2826898-2826996 usb_power_delivery: sym: "0x1" "1"
2826996-2827098 usb_power_delivery: sym: "0x4" "4"
2827098-2827196 usb_power_delivery: sym: "0x8" "8"
2827196-2827298 usb_power_delivery: sym: "0x0" "0"
2826898-2827298 usb_power_delivery: header: "H:0841" "HD"
2825217-2828236 usb_power_delivery: snk: "(r2) SNK[4]: GOOD CRC" "GOOD CRC"
2827298-2827398 usb_power_delivery: sym: "0x9" "9"
2827398-2827496 usb_power_delivery: sym: "0x8" "8"
2827496-2827598 usb_power_delivery: sym: "0x4" "4"
2827598-2827698 usb_power_delivery: sym: "0xE" "E"
2827698-2827796 usb_power_delivery: sym: "0x0" "0"
2827796-2827896 usb_power_delivery: sym: "0x6" "6"
2827896-2827996 usb_power_delivery: sym: "0x6" "6"
2827996-2828096 usb_power_delivery: sym: "0xA" "A"
2827298-2828096 usb_power_delivery: crc: "CRC:a660e489" "CRC"
2828096-2828196 usb_power_delivery: sym: "EOP" "#"
2828096-2828196 usb_power_delivery: eop: "EOP" "E"
2825217-2828196 usb_power_delivery: text: "#34   (470.869500ms): (r2) SNK[4]: GOOD CRC" "..."
2855519-2856801 usb_power_delivery: preamble: "Preamble" "..."
2856801-2856898 usb_power_delivery: sym: "SYNC-1" "S1"
2856898-2857000 usb_power_delivery: sym: "SYNC-1" "S1"
2857000-2857098 usb_power_delivery: sym: "SYNC-1" "S1"
2857098-2857200 usb_power_delivery: sym: "SYNC-2" "S2"
2856801-2857200 usb_power_delivery: sop: "SOP" "S"
2857200-2857298 usb_power_delivery: sym: "0xF" "F"
2857298-2857401 usb_power_delivery: sym: "0x4" "4"
2857401-2857498 usb_power_delivery: sym: "0x4" "4"
2857498-2857601 usb_power_delivery: sym: "0x2" "2"
2857200-2857601 usb_power_delivery: header: "H:244f" "HD"
2855519-2860139 usb_power_delivery: snk: "(r2) SNK[2]: VDM" "VDM"
2857601-2857698 usb_power_delivery: sym: "0x2" "2"
2857698-2857801 usb_power_delivery: sym: "0x4" "4"
2857801-2857898 usb_power_delivery: sym: "0x0" "0"
2857898-2858001 usb_power_delivery: sym: "0x8" "8"
2858001-2858098 usb_power_delivery: sym: "0x0" "0"
2858098-2858201 usb_power_delivery: sym: "0x0" "0"
2858201-2858298 usb_power_delivery: sym: "0xF" "F"
2858298-2858401 usb_power_delivery: sym: "0xF" "F"
2857601-2858401 usb_power_delivery: data: "[0]ff008042" "D0"
2857601-2858401 usb_power_delivery: payload: "[1] ACK Disc SVID  SVID:ff00" "[1] ACK Disc SVID  SVID:ff00"
2858401-2858498 usb_power_delivery: sym: "0x0" "0"
2858498-2858601 usb_power_delivery: sym: "0x0" "0"
2858601-2858698 usb_power_delivery: sym: "0x0" "0"
2858698-2858801 usb_power_delivery: sym: "0x0" "0"
2858801-2858898 usb_power_delivery: sym: "0x1" "1"
2858898-2859001 usb_power_delivery: sym: "0x0" "0"
2859001-2859098 usb_power_delivery: sym: "0xF" "F"
2859098-2859201 usb_power_delivery: sym: "0xF" "F"
2858401-2859201 usb_power_delivery: data: "[1]ff010000" "D1"
2858401-2859201 usb_power_delivery: payload: "[2] VDO:ff010000" "[2] VDO:ff010000"
2859201-2859301 usb_power_delivery: sym: "0x6" "6"
2859301-2859398 usb_power_delivery: sym: "0xD" "D"
2859398-2859501 usb_power_delivery: sym: "0x1" "1"
2859501-2859598 usb_power_delivery: sym: "0xD" "D"
2859598-2859698 usb_power_delivery: sym: "0x5" "5"
2859698-2859801 usb_power_delivery: sym: "0xF" "F"
2859801-2859901 usb_power_delivery: sym: "0xE" "E"
2859901-2859999 usb_power_delivery: sym: "0x4" "4"
2859201-2859999 usb_power_delivery: crc: "CRC:4ef5d1d6" "CRC"
2859999-2860099 usb_power_delivery: sym: "EOP" "#"
2859999-2860099 usb_power_delivery: eop: "EOP" "E"
2855519-2860099 usb_power_delivery: text: "#35   (475.919833ms): (r2) SNK[2]: VDM - [1] ACK Disc SVID  SVID:ff00 - [2] VDO:ff010000" "..."
2860765-2862040 usb_power_delivery: preamble: "Preamble" "..."
2862040-2862139 usb_power_delivery: sym: "SYNC-1" "S1"
2862139-2862240 usb_power_delivery: sym: "SYNC-1" "S1"
2862240-2862339 usb_power_delivery: sym: "SYNC-1" "S1"
2862339-2862440 usb_power_delivery: sym: "SYNC-2" "S2"
2862040-2862440 usb_power_delivery: sop: "SOP" "S"
2862440-2862539 usb_power_delivery: sym: "0x1" "1"
2862539-2862639 usb_power_delivery: sym: "0x6" "6"
2862639-2862739 usb_power_delivery: sym: "0x5" "5"
2862739-2862840 usb_power_delivery: sym: "0x0" "0"
2862440-2862840 usb_power_delivery: header: "H:0561" "HD"
2860765-2863779 usb_power_delivery: src: "(r2) SRC[2]: GOOD CRC" "GOOD CRC"
2862840-2862940 usb_power_delivery: sym: "0x6" "6"
2862940-2863040 usb_power_delivery: sym: "0x9" "9"
2863040-2863140 usb_power_delivery: sym: "0xC" "C"
2863140-2863239 usb_power_delivery: sym: "0xB" "B"
2863239-2863339 usb_power_delivery: sym: "0x5" "5"
2863339-2863439 usb_power_delivery: sym: "0x5" "5"
2863439-2863540 usb_power_delivery: sym: "0xD" "D"
2863540-2863639 usb_power_delivery: sym: "0x4" "4"
2862840-2863639 usb_power_delivery: crc: "CRC:4d55bc96" "CRC"
2863639-2863739 usb_power_delivery: sym: "EOP" "#"
2863639-2863739 usb_power_delivery: eop: "EOP" "E"
2860765-2863739 usb_power_delivery: text: "#36   (476.794167ms): (r2) SRC[2]: GOOD CRC" "..."
2866230-2867505 usb_power_delivery: preamble: "Preamble" "..."
2867505-2867603 usb_power_delivery: sym: "SYNC-1" "S1"
2867603-2867705 usb_power_delivery: sym: "SYNC-1" "S1"
2867705-2867803 usb_power_delivery: sym: "SYNC-1" "S1"
2867803-2867905 usb_power_delivery: sym: "SYNC-2" "S2"
2867505-2867905 usb_power_delivery: sop: "SOP" "S"
2867905-2868004 usb_power_delivery: sym: "0xF" "F"
2868004-2868104 usb_power_delivery: sym: "0x6" "6"
2868104-2868205 usb_power_delivery: sym: "0xB" "B"
2868205-2868304 usb_power_delivery: sym: "0x1" "1"
2867905-2868304 usb_power_delivery: header: "H:1b6f" "HD"
2866230-2870044 usb_power_delivery: src: "(r2) SRC[5]: VDM" "VDM"
2868304-2868403 usb_power_delivery: sym: "0x3" "3"
2868403-2868505 usb_power_delivery: sym: "0x0" "0"
2868505-2868604 usb_power_delivery: sym: "0x0" "0"
2868604-2868705 usb_power_delivery: sym: "0x8" "8"
2868705-2868804 usb_power_delivery: sym: "0x1" "1"
2868804-2868905 usb_power_delivery: sym: "0x0" "0"
2868905-2869004 usb_power_delivery: sym: "0xF" "F"
2869004-2869105 usb_power_delivery: sym: "0xF" "F"
2868304-2869105 usb_power_delivery: data: "[0]ff018003" "D0"
2868304-2869105 usb_power_delivery: payload: "[1] REQ Disc Mode  SVID:ff01" "[1] REQ Disc Mode  SVID:ff01"
2869105-2869204 usb_power_delivery: sym: "0xD" "D"
2869204-2869305 usb_power_delivery: sym: "0x1" "1"
2869305-2869404 usb_power_delivery: sym: "0x0" "0"
2869404-2869505 usb_power_delivery: sym: "0xD" "D"
2869505-2869605 usb_power_delivery: sym: "0x9" "9"
2869605-2869705 usb_power_delivery: sym: "0xC" "C"
2869705-2869804 usb_power_delivery: sym: "0x8" "8"
2869804-2869904 usb_power_delivery: sym: "0x9" "9"
2869105-2869904 usb_power_delivery: crc: "CRC:98c9d01d" "CRC"
2869904-2870004 usb_power_delivery: sym: "EOP" "#"
2869904-2870004 usb_power_delivery: eop: "EOP" "E"
2866230-2870004 usb_power_delivery: text: "#37   (477.705000ms): (r2) SRC[5]: VDM - [1] REQ Disc Mode  SVID:ff01" "..."
2870821-2872102 usb_power_delivery: preamble: "Preamble" "..."
2872102-2872199 usb_power_delivery: sym: "SYNC-1" "S1"
2872199-2872302 usb_power_delivery: sym: "SYNC-1" "S1"
2872302-2872399 usb_power_delivery: sym: "SYNC-1" "S1"
2872399-2872502 usb_power_delivery: sym: "SYNC-2" "S2"
2872102-2872502 usb_power_delivery: sop: "SOP" "S"
2872502-2872599 usb_power_delivery: sym: "0x1" "1"
2872599-2872702 usb_power_delivery: sym: "0x4" "4"
2872702-2872802 usb_power_delivery: sym: "0xA" "A"
2872802-2872899 usb_power_delivery: sym: "0x0" "0"
2872502-2872899 usb_power_delivery: header: "H:0a41" "HD"
2870821-2873820 usb_power_delivery: snk: "(r2) SNK[5]: GOOD CRC" "GOOD CRC"
2872899-2872999 usb_power_delivery: sym: "0x5" "5"
2872999-2873099 usb_power_delivery: sym: "0xA" "A"
2873099-2873199 usb_power_delivery: sym: "0x5" "5"
2873199-2873302 usb_power_delivery: sym: "0x8" "8"
2873302-2873402 usb_power_delivery: sym: "0xE" "E"
2873402-2873502 usb_power_delivery: sym: "0x6" "6"
2873502-2873600 usb_power_delivery: sym: "0x8" "8"
2873600-2873702 usb_power_delivery: sym: "0x4" "4"
2872899-2873702 usb_power_delivery: crc: "CRC:486e85a5" "CRC"
2873702-2873802 usb_power_delivery: sym: "EOP" "#"
2873702-2873802 usb_power_delivery: eop: "EOP" "E"
2870821-2873802 usb_power_delivery: text: "#38   (478.470167ms): (r2) SNK[5]: GOOD CRC" "..."
2893622-2894903 usb_power_delivery: preamble: "Preamble" "..."
2894903-2895001 usb_power_delivery: sym: "SYNC-1" "S1"
2895001-2895103 usb_power_delivery: sym: "SYNC-1" "S1"
2895103-2895201 usb_power_delivery: sym: "SYNC-1" "S1"
2895201-2895303 usb_power_delivery: sym: "SYNC-2" "S2"
2894903-2895303 usb_power_delivery: sop: "SOP" "S"
2895303-2895401 usb_power_delivery: sym: "0xF" "F"
2895401-2895503 usb_power_delivery: sym: "0x4" "4"
2895503-2895603 usb_power_delivery: sym: "0x6" "6"
2895603-2895701 usb_power_delivery: sym: "0x2" "2"
2895303-2895701 usb_power_delivery: header: "H:264f" "HD"
2893622-2898242 usb_power_delivery: snk: "(r2) SNK[3]: VDM" "VDM"
2895701-2895801 usb_power_delivery: sym: "0x3" "3"
2895801-2895903 usb_power_delivery: sym: "0x4" "4"
2895903-2896001 usb_power_delivery: sym: "0x0" "0"
2896001-2896103 usb_power_delivery: sym: "0x8" "8"
2896103-2896201 usb_power_delivery: sym: "0x1" "1"
2896201-2896303 usb_power_delivery: sym: "0x0" "0"
2896303-2896401 usb_power_delivery: sym: "0xF" "F"
2896401-2896503 usb_power_delivery: sym: "0xF" "F"
2895701-2896503 usb_power_delivery: data: "[0]ff018043" "D0"
2895701-2896503 usb_power_delivery: payload: "[1] ACK Disc Mode  SVID:ff01" "[1] ACK Disc Mode  SVID:ff01"
2896503-2896603 usb_power_delivery: sym: "0x5" "5"
2896603-2896701 usb_power_delivery: sym: "0x0" "0"
2896701-2896801 usb_power_delivery: sym: "0xC" "C"
2896801-2896903 usb_power_delivery: sym: "0x0" "0"
2896903-2897001 usb_power_delivery: sym: "0x0" "0"
2897001-2897103 usb_power_delivery: sym: "0x0" "0"
2897103-2897201 usb_power_delivery: sym: "0x0" "0"
2897201-2897303 usb_power_delivery: sym: "0x0" "0"
2896503-2897303 usb_power_delivery: data: "[1]00000c05" "D1"
2896503-2897303 usb_power_delivery: payload: "[2] VDO:00000c05" "[2] VDO:00000c05"
2897303-2897401 usb_power_delivery: sym: "0x1" "1"
2897401-2897503 usb_power_delivery: sym: "0xF" "F"
2897503-2897601 usb_power_delivery: sym: "0xD" "D"
2897601-2897703 usb_power_delivery: sym: "0xF" "F"
2897703-2897801 usb_power_delivery: sym: "0x8" "8"
2897801-2897904 usb_power_delivery: sym: "0x2" "2"
2897904-2898001 usb_power_delivery: sym: "0xD" "D"
2898001-2898101 usb_power_delivery: sym: "0x6" "6"
2897303-2898101 usb_power_delivery: crc: "CRC:6d28fdf1" "CRC"
2898101-2898201 usb_power_delivery: sym: "EOP" "#"
2898101-2898201 usb_power_delivery: eop: "EOP" "E"
2893622-2898201 usb_power_delivery: text: "#39   (482.270333ms): (r2) SNK[3]: VDM - [1] ACK Disc Mode  SVID:ff01 - [2] VDO:00000c05" "..."
2898868-2900143 usb_power_delivery: preamble: "Preamble" "..."
2900143-2900241 usb_power_delivery: sym: "SYNC-1" "S1"
2900241-2900343 usb_power_delivery: sym: "SYNC-1" "S1"
2900343-2900441 usb_power_delivery: sym: "SYNC-1" "S1"
2900441-2900543 usb_power_delivery: sym: "SYNC-2" "S2"
2900143-2900543 usb_power_delivery: sop: "SOP" "S"
2900543-2900641 usb_power_delivery: sym: "0x1" "1"
2900641-2900741 usb_power_delivery: sym: "0x6" "6"
2900741-2900843 usb_power_delivery: sym: "0x7" "7"
2900843-2900941 usb_power_delivery: sym: "0x0" "0"
2900543-2900941 usb_power_delivery: header: "H:0761" "HD"
2898868-2901881 usb_power_delivery: src: "(r2) SRC[3]: GOOD CRC" "GOOD CRC"
2900941-2901041 usb_power_delivery: sym: "0xA" "A"
2901041-2901143 usb_power_delivery: sym: "0xB" "B"
2901143-2901241 usb_power_delivery: sym: "0xD" "D"
2901241-2901343 usb_power_delivery: sym: "0xD" "D"
2901343-2901441 usb_power_delivery: sym: "0xB" "B"
2901441-2901541 usb_power_delivery: sym: "0x5" "5"
2901541-2901641 usb_power_delivery: sym: "0x3" "3"
2901641-2901741 usb_power_delivery: sym: "0xA" "A"
2900941-2901741 usb_power_delivery: crc: "CRC:a35bddba" "CRC"
2901741-2901841 usb_power_delivery: sym: "EOP" "#"
2901741-2901841 usb_power_delivery: eop: "EOP" "E"
2898868-2901841 usb_power_delivery: text: "#40   (483.144667ms): (r2) SRC[3]: GOOD CRC" "..."
2904461-2905736 usb_power_delivery: preamble: "Preamble" "..."
2905736-2905835 usb_power_delivery: sym: "SYNC-1" "S1"
2905835-2905936 usb_power_delivery: sym: "SYNC-1" "S1"
2905936-2906035 usb_power_delivery: sym: "SYNC-3" "S3"
2906035-2906136 usb_power_delivery: sym: "SYNC-3" "S3"
2905736-2906136 usb_power_delivery: sop: "SOP'" "S"
2906136-2906235 usb_power_delivery: sym: "0xF" "F"
2906235-2906336 usb_power_delivery: sym: "0x4" "4"
2906336-2906435 usb_power_delivery: sym: "0x0" "0"
2906435-2906536 usb_power_delivery: sym: "0x1" "1"
2906136-2906536 usb_power_delivery: header: "H:104f" "HD"
2904461-2908255 usb_power_delivery: snk: "(r2) SNK[0]: VDM" "VDM"
2906536-2906635 usb_power_delivery: sym: "0x1" "1"
2906635-2906736 usb_power_delivery: sym: "0x0" "0"
2906736-2906835 usb_power_delivery: sym: "0x0" "0"
2906835-2906936 usb_power_delivery: sym: "0x8" "8"
2906936-2907035 usb_power_delivery: sym: "0x0" "0"
2907035-2907136 usb_power_delivery: sym: "0x0" "0"
2907136-2907235 usb_power_delivery: sym: "0xF" "F"
2907235-2907336 usb_power_delivery: sym: "0xF" "F"
2906536-2907336 usb_power_delivery: data: "[0]ff008001" "D0"
2906536-2907336 usb_power_delivery: payload: "[1] REQ Disc Ident  SVID:ff00" "[1] REQ Disc Ident  SVID:ff00"
2907336-2907435 usb_power_delivery: sym: "0x0" "0"
2907435-2907536 usb_power_delivery: sym: "0xF" "F"
2907536-2907635 usb_power_delivery: sym: "0xD" "D"
2907635-2907736 usb_power_delivery: sym: "0x1" "1"
2907736-2907835 usb_power_delivery: sym: "0x7" "7"
2907835-2907935 usb_power_delivery: sym: "0xA" "A"
2907935-2908036 usb_power_delivery: sym: "0xB" "B"
2908036-2908136 usb_power_delivery: sym: "0x5" "5"
2907336-2908136 usb_power_delivery: crc: "CRC:5ba71df0" "CRC"
2908136-2908236 usb_power_delivery: sym: "EOP" "#"
2908136-2908236 usb_power_delivery: eop: "EOP" "E"
2904461-2908236 usb_power_delivery: text: "#41   (484.076833ms): (r2) SNK[0]: VDM - [1] REQ Disc Ident  SVID:ff00" "..."
2915119-2916395 usb_power_delivery: preamble: "Preamble" "..."
2916395-2916493 usb_power_delivery: sym: "SYNC-1" "S1"
2916493-2916595 usb_power_delivery: sym: "SYNC-1" "S1"
2916595-2916693 usb_power_delivery: sym: "SYNC-3" "S3"
2916693-2916795 usb_power_delivery: sym: "SYNC-3" "S3"
2916395-2916795 usb_power_delivery: sop: "SOP'" "S"
2916795-2916893 usb_power_delivery: sym: "0xF" "F"
2916893-2916995 usb_power_delivery: sym: "0x4" "4"
2916995-2917093 usb_power_delivery: sym: "0x0" "0"
2917093-2917195 usb_power_delivery: sym: "0x1" "1"
2916795-2917195 usb_power_delivery: header: "H:104f" "HD"
2915119-2918913 usb_power_delivery: snk: "(r2) SNK[0]: VDM" "VDM"
2917195-2917293 usb_power_delivery: sym: "0x1" "1"
2917293-2917395 usb_power_delivery: sym: "0x0" "0"
2917395-2917493 usb_power_delivery: sym: "0x0" "0"
2917493-2917595 usb_power_delivery: sym: "0x8" "8"
2917595-2917693 usb_power_delivery: sym: "0x0" "0"
2917693-2917795 usb_power_delivery: sym: "0x0" "0"
2917795-2917893 usb_power_delivery: sym: "0xF" "F"
2917893-2917995 usb_power_delivery: sym: "0xF" "F"
2917195-2917995 usb_power_delivery: data: "[0]ff008001" "D0"
2917195-2917995 usb_power_delivery: payload: "[1] REQ Disc Ident  SVID:ff00" "[1] REQ Disc Ident  SVID:ff00"
2917995-2918093 usb_power_delivery: sym: "0x0" "0"
2918093-2918195 usb_power_delivery: sym: "0xF" "F"
2918195-2918293 usb_power_delivery: sym: "0xD" "D"
2918293-2918395 usb_power_delivery: sym: "0x1" "1"
2918395-2918493 usb_power_delivery: sym: "0x7" "7"
2918493-2918593 usb_power_delivery: sym: "0xA" "A"
2918593-2918695 usb_power_delivery: sym: "0xB" "B"
2918695-2918795 usb_power_delivery: sym: "0x5" "5"
2917995-2918795 usb_power_delivery: crc: "CRC:5ba71df0" "CRC"
2918795-2918895 usb_power_delivery: sym: "EOP" "#"
2918795-2918895 usb_power_delivery: eop: "EOP" "E"
2915119-2918895 usb_power_delivery: text: "#42   (485.853167ms): (r2) SNK[0]: VDM - [1] REQ Disc Ident  SVID:ff00" "..."
2925778-2927053 usb_power_delivery: preamble: "Preamble" "..."
2927053-2927151 usb_power_delivery: sym: "SYNC-1" "S1"
2927151-2927253 usb_power_delivery: sym: "SYNC-1" "S1"
2927253-2927351 usb_power_delivery: sym: "SYNC-3" "S3"
2927351-2927453 usb_power_delivery: sym: "SYNC-3" "S3"
2927053-2927453 usb_power_delivery: sop: "SOP'" "S"
2927453-2927552 usb_power_delivery: sym: "0xF" "F"
2927552-2927653 usb_power_delivery: sym: "0x4" "4"
2927653-2927752 usb_power_delivery: sym: "0x0" "0"
2927752-2927853 usb_power_delivery: sym: "0x1" "1"
2927453-2927853 usb_power_delivery: header: "H:104f" "HD"
2925778-2929572 usb_power_delivery: snk: "(r2) SNK[0]: VDM" "VDM"
2927853-2927952 usb_power_delivery: sym: "0x1" "1"
2927952-2928053 usb_power_delivery: sym: "0x0" "0"
2928053-2928152 usb_power_delivery: sym: "0x0" "0"
2928152-2928253 usb_power_delivery: sym: "0x8" "8"
2928253-2928352 usb_power_delivery: sym: "0x0" "0"
2928352-2928453 usb_power_delivery: sym: "0x0" "0"
2928453-2928552 usb_power_delivery: sym: "0xF" "F"
2928552-2928653 usb_power_delivery: sym: "0xF" "F"
2927853-2928653 usb_power_delivery: data: "[0]ff008001" "D0"
2927853-2928653 usb_power_delivery: payload: "[1] REQ Disc Ident  SVID:ff00" "[1] REQ Disc Ident  SVID:ff00"
2928653-2928752 usb_power_delivery: sym: "0x0" "0"
2928752-2928853 usb_power_delivery: sym: "0xF" "F"
2928853-2928952 usb_power_delivery: sym: "0xD" "D"
2928952-2929053 usb_power_delivery: sym: "0x1" "1"
2929053-2929152 usb_power_delivery: sym: "0x7" "7"
2929152-2929252 usb_power_delivery: sym: "0xA" "A"
2929252-2929353 usb_power_delivery: sym: "0xB" "B"
2929353-2929453 usb_power_delivery: sym: "0x5" "5"
2928653-2929453 usb_power_delivery: crc: "CRC:5ba71df0" "CRC"
2929453-2929553 usb_power_delivery: sym: "EOP" "#"
2929453-2929553 usb_power_delivery: eop: "EOP" "E"
2925778-2929553 usb_power_delivery: text: "#43   (487.629667ms): (r2) SNK[0]: VDM - [1] REQ Disc Ident  SVID:ff00" "..."
2936436-2937712 usb_power_delivery: preamble: "Preamble" "..."
2937712-2937810 usb_power_delivery: sym: "SYNC-1" "S1"
2937810-2937912 usb_power_delivery: sym: "SYNC-1" "S1"
2937912-2938010 usb_power_delivery: sym: "SYNC-3" "S3"
2938010-2938112 usb_power_delivery: sym: "SYNC-3" "S3"
2937712-2938112 usb_power_delivery: sop: "SOP'" "S"
2938112-2938210 usb_power_delivery: sym: "0xF" "F"
2938210-2938312 usb_power_delivery: sym: "0x4" "4"
2938312-2938410 usb_power_delivery: sym: "0x0" "0"
2938410-2938512 usb_power_delivery: sym: "0x1" "1"
2938112-2938512 usb_power_delivery: header: "H:104f" "HD"
2936436-2940230 usb_power_delivery: snk: "(r2) SNK[0]: VDM" "VDM"
2938512-2938610 usb_power_delivery: sym: "0x1" "1"
2938610-2938712 usb_power_delivery: sym: "0x0" "0"
2938712-2938810 usb_power_delivery: sym: "0x0" "0"
2938810-2938912 usb_power_delivery: sym: "0x8" "8"
2938912-2939010 usb_power_delivery: sym: "0x0" "0"
2939010-2939112 usb_power_delivery: sym: "0x0" "0"
2939112-2939210 usb_power_delivery: sym: "0xF" "F"
2939210-2939312 usb_power_delivery: sym: "0xF" "F"
2938512-2939312 usb_power_delivery: data: "[0]ff008001" "D0"
2938512-2939312 usb_power_delivery: payload: "[1] REQ Disc Ident  SVID:ff00" "[1] REQ Disc Ident  SVID:ff00"
2939312-2939410 usb_power_delivery: sym: "0x0" "0"
2939410-2939512 usb_power_delivery: sym: "0xF" "F"
2939512-2939610 usb_power_delivery: sym: "0xD" "D"
2939610-2939712 usb_power_delivery: sym: "0x1" "1"
2939712-2939810 usb_power_delivery: sym: "0x7" "7"
2939810-2939910 usb_power_delivery: sym: "0xA" "A"
2939910-2940012 usb_power_delivery: sym: "0xB" "B"
2940012-2940112 usb_power_delivery: sym: "0x5" "5"
2939312-2940112 usb_power_delivery: crc: "CRC:5ba71df0" "CRC"
2940112-2940212 usb_power_delivery: sym: "EOP" "#"
2940112-2940212 usb_power_delivery: eop: "EOP" "E"
2936436-2940212 usb_power_delivery: text: "#44   (489.406000ms): (r2) SNK[0]: VDM - [1] REQ Disc Ident  SVID:ff00" "..."
2947614-2948889 usb_power_delivery: preamble: "Preamble" "..."
2948889-2948987 usb_power_delivery: sym: "SYNC-1" "S1"
2948987-2949089 usb_power_delivery: sym: "SYNC-1" "S1"
2949089-2949187 usb_power_delivery: sym: "SYNC-3" "S3"
2949187-2949289 usb_power_delivery: sym: "SYNC-3" "S3"
2948889-2949289 usb_power_delivery: sop: "SOP'" "S"
2949289-2949387 usb_power_delivery: sym: "0xF" "F"
2949387-2949489 usb_power_delivery: sym: "0x4" "4"
2949489-2949587 usb_power_delivery: sym: "0x0" "0"
2949587-2949689 usb_power_delivery: sym: "0x1" "1"
2949289-2949689 usb_power_delivery: header: "H:104f" "HD"
2947614-2951407 usb_power_delivery: snk: "(r2) SNK[0]: VDM" "VDM"
2949689-2949787 usb_power_delivery: sym: "0x1" "1"
2949787-2949889 usb_power_delivery: sym: "0x0" "0"
2949889-2949987 usb_power_delivery: sym: "0x0" "0"
2949987-2950089 usb_power_delivery: sym: "0x8" "8"
2950089-2950187 usb_power_delivery: sym: "0x0" "0"
2950187-2950289 usb_power_delivery: sym: "0x0" "0"
2950289-2950387 usb_power_delivery: sym: "0xF" "F"
2950387-2950489 usb_power_delivery: sym: "0xF" "F"
2949689-2950489 usb_power_delivery: data: "[0]ff008001" "D0"
2949689-2950489 usb_power_delivery: payload: "[1] REQ Disc Ident  SVID:ff00" "[1] REQ Disc Ident  SVID:ff00"
2950489-2950587 usb_power_delivery: sym: "0x0" "0"
2950587-2950689 usb_power_delivery: sym: "0xF" "F"
2950689-2950787 usb_power_delivery: sym: "0xD" "D"
2950787-2950889 usb_power_delivery: sym: "0x1" "1"
2950889-2950987 usb_power_delivery: sym: "0x7" "7"
2950987-2951087 usb_power_delivery: sym: "0xA" "A"
2951087-2951189 usb_power_delivery: sym: "0xB" "B"
2951189-2951289 usb_power_delivery: sym: "0x5" "5"
2950489-2951289 usb_power_delivery: crc: "CRC:5ba71df0" "CRC"
2951289-2951389 usb_power_delivery: sym: "EOP" "#"
2951289-2951389 usb_power_delivery: eop: "EOP" "E"
2947614-2951389 usb_power_delivery: text: "#45   (491.269000ms): (r2) SNK[0]: VDM - [1] REQ Disc Ident  SVID:ff00" "..."
2958272-2959548 usb_power_delivery: preamble: "Preamble" "..."
2959548-2959646 usb_power_delivery: sym: "SYNC-1" "S1"
2959646-2959748 usb_power_delivery: sym: "SYNC-1" "S1"
2959748-2959846 usb_power_delivery: sym: "SYNC-3" "S3"
2959846-2959948 usb_power_delivery: sym: "SYNC-3" "S3"
2959548-2959948 usb_power_delivery: sop: "SOP'" "S"
2959948-2960046 usb_power_delivery: sym: "0xF" "F"
2960046-2960148 usb_power_delivery: sym: "0x4" "4"
2960148-2960246 usb_power_delivery: sym: "0x0" "0"
2960246-2960348 usb_power_delivery: sym: "0x1" "1"
2959948-2960348 usb_power_delivery: header: "H:104f" "HD"
2958272-2962066 usb_power_delivery: snk: "(r2) SNK[0]: VDM" "VDM"
2960348-2960446 usb_power_delivery: sym: "0x1" "1"
2960446-2960548 usb_power_delivery: sym: "0x0" "0"
2960548-2960646 usb_power_delivery: sym: "0x0" "0"
2960646-2960748 usb_power_delivery: sym: "0x8" "8"
2960748-2960846 usb_power_delivery: sym: "0x0" "0"
2960846-2960948 usb_power_delivery: sym: "0x0" "0"
2960948-2961046 usb_power_delivery: sym: "0xF" "F"
2961046-2961148 usb_power_delivery: sym: "0xF" "F"
2960348-2961148 usb_power_delivery: data: "[0]ff008001" "D0"
2960348-2961148 usb_power_delivery: payload: "[1] REQ Disc Ident  SVID:ff00" "[1] REQ Disc Ident  SVID:ff00"
2961148-2961246 usb_power_delivery: sym: "0x0" "0"
2961246-2961348 usb_power_delivery: sym: "0xF" "F"
2961348-2961446 usb_power_delivery: sym: "0xD" "D"
2961446-2961548 usb_power_delivery: sym: "0x1" "1"
2961548-2961646 usb_power_delivery: sym: "0x7" "7"
2961646-2961746 usb_power_delivery: sym: "0xA" "A"
2961746-2961848 usb_power_delivery: sym: "0xB" "B"
2961848-2961948 usb_power_delivery: sym: "0x5" "5"
2961148-2961948 usb_power_delivery: crc: "CRC:5ba71df0" "CRC"
2961948-2962048 usb_power_delivery: sym: "EOP" "#"
2961948-2962048 usb_power_delivery: eop: "EOP" "E"
2958272-2962048 usb_power_delivery: text: "#46   (493.045333ms): (r2) SNK[0]: VDM - [1] REQ Disc Ident  SVID:ff00" "..."
2968931-2970206 usb_power_delivery: preamble: "Preamble" "..."
2970206-2970305 usb_power_delivery: sym: "SYNC-1" "S1"
2970305-2970406 usb_power_delivery: sym: "SYNC-1" "S1"
2970406-2970505 usb_power_delivery: sym: "SYNC-3" "S3"
2970505-2970606 usb_power_delivery: sym: "SYNC-3" "S3"
2970206-2970606 usb_power_delivery: sop: "SOP'" "S"
2970606-2970705 usb_power_delivery: sym: "0xF" "F"
2970705-2970806 usb_power_delivery: sym: "0x4" "4"
2970806-2970905 usb_power_delivery: sym: "0x0" "0"
2970905-2971006 usb_power_delivery: sym: "0x1" "1"
2970606-2971006 usb_power_delivery: header: "H:104f" "HD"
2968931-2972725 usb_power_delivery: snk: "(r2) SNK[0]: VDM" "VDM"
2971006-2971105 usb_power_delivery: sym: "0x1" "1"
2971105-2971206 usb_power_delivery: sym: "0x0" "0"
2971206-2971305 usb_power_delivery: sym: "0x0" "0"
2971305-2971406 usb_power_delivery: sym: "0x8" "8"
2971406-2971505 usb_power_delivery: sym: "0x0" "0"
2971505-2971607 usb_power_delivery: sym: "0x0" "0"
2971607-2971705 usb_power_delivery: sym: "0xF" "F"
2971705-2971806 usb_power_delivery: sym: "0xF" "F"
2971006-2971806 usb_power_delivery: data: "[0]ff008001" "D0"
2971006-2971806 usb_power_delivery: payload: "[1] REQ Disc Ident  SVID:ff00" "[1] REQ Disc Ident  SVID:ff00"
2971806-2971905 usb_power_delivery: sym: "0x0" "0"
2971905-2972006 usb_power_delivery: sym: "0xF" "F"
2972006-2972105 usb_power_delivery: sym: "0xD" "D"
2972105-2972207 usb_power_delivery: sym: "0x1" "1"
2972207-2972305 usb_power_delivery: sym: "0x7" "7"
2972305-2972405 usb_power_delivery: sym: "0xA" "A"
2972405-2972507 usb_power_delivery: sym: "0xB" "B"
2972507-2972607 usb_power_delivery: sym: "0x5" "5"
2971806-2972607 usb_power_delivery: crc: "CRC:5ba71df0" "CRC"
2972607-2972707 usb_power_delivery: sym: "EOP" "#"
2972607-2972707 usb_power_delivery: eop: "EOP" "E"
2968931-2972707 usb_power_delivery: text: "#47   (494.821833ms): (r2) SNK[0]: VDM - [1] REQ Disc Ident  SVID:ff00" "..."
2979590-2980865 usb_power_delivery: preamble: "Preamble" "..."
2980865-2980963 usb_power_delivery: sym: "SYNC-1" "S1"
2980963-2981065 usb_power_delivery: sym: "SYNC-1" "S1"
2981065-2981163 usb_power_delivery: sym: "SYNC-3" "S3"
2981163-2981265 usb_power_delivery: sym: "SYNC-3" "S3"
2980865-2981265 usb_power_delivery: sop: "SOP'" "S"
2981265-2981363 usb_power_delivery: sym: "0xF" "F"
2981363-2981465 usb_power_delivery: sym: "0x4" "4"
2981465-2981563 usb_power_delivery: sym: "0x0" "0"
2981563-2981665 usb_power_delivery: sym: "0x1" "1"
2981265-2981665 usb_power_delivery: header: "H:104f" "HD"
2979590-2983384 usb_power_delivery: snk: "(r2) SNK[0]: VDM" "VDM"
2981665-2981763 usb_power_delivery: sym: "0x1" "1"
2981763-2981865 usb_power_delivery: sym: "0x0" "0"
2981865-2981963 usb_power_delivery: sym: "0x0" "0"
2981963-2982065 usb_power_delivery: sym: "0x8" "8"
2982065-2982163 usb_power_delivery: sym: "0x0" "0"
2982163-2982265 usb_power_delivery: sym: "0x0" "0"
2982265-2982363 usb_power_delivery: sym: "0xF" "F"
2982363-2982465 usb_power_delivery: sym: "0xF" "F"
2981665-2982465 usb_power_delivery: data: "[0]ff008001" "D0"
2981665-2982465 usb_power_delivery: payload: "[1] REQ Disc Ident  SVID:ff00" "[1] REQ Disc Ident  SVID:ff00"
2982465-2982563 usb_power_delivery: sym: "0x0" "0"
2982563-2982665 usb_power_delivery: sym: "0xF" "F"
2982665-2982764 usb_power_delivery: sym: "0xD" "D"
2982764-2982865 usb_power_delivery: sym: "0x1" "1"
2982865-2982964 usb_power_delivery: sym: "0x7" "7"
2982964-2983064 usb_power_delivery: sym: "0xA" "A"
2983064-2983165 usb_power_delivery: sym: "0xB" "B"
2983165-2983265 usb_power_delivery: sym: "0x5" "5"
2982465-2983265 usb_power_delivery: crc: "CRC:5ba71df0" "CRC"
2983265-2983365 usb_power_delivery: sym: "EOP" "#"
2983265-2983365 usb_power_delivery: eop: "EOP" "E"
2979590-2983365 usb_power_delivery: text: "#48   (496.598333ms): (r2) SNK[0]: VDM - [1] REQ Disc Ident  SVID:ff00" "..."
2990767-2992042 usb_power_delivery: preamble: "Preamble" "..."
2992042-2992141 usb_power_delivery: sym: "SYNC-1" "S1"
2992141-2992242 usb_power_delivery: sym: "SYNC-1" "S1"
2992242-2992341 usb_power_delivery: sym: "SYNC-3" "S3"
2992341-2992442 usb_power_delivery: sym: "SYNC-3" "S3"
2992042-2992442 usb_power_delivery: sop: "SOP'" "S"
2992442-2992541 usb_power_delivery: sym: "0xF" "F"
2992541-2992642 usb_power_delivery: sym: "0x4" "4"
2992642-2992741 usb_power_delivery: sym: "0x0" "0"
2992741-2992842 usb_power_delivery: sym: "0x1" "1"
2992442-2992842 usb_power_delivery: header: "H:104f" "HD"
2990767-2994561 usb_power_delivery: snk: "(r2) SNK[0]: VDM" "VDM"
2992842-2992941 usb_power_delivery: sym: "0x1" "1"
2992941-2993042 usb_power_delivery: sym: "0x0" "0"
2993042-2993141 usb_power_delivery: sym: "0x0" "0"
2993141-2993242 usb_power_delivery: sym: "0x8" "8"
2993242-2993341 usb_power_delivery: sym: "0x0" "0"
2993341-2993442 usb_power_delivery: sym: "0x0" "0"
2993442-2993541 usb_power_delivery: sym: "0xF" "F"
2993541-2993642 usb_power_delivery: sym: "0xF" "F"
2992842-2993642 usb_power_delivery: data: "[0]ff008001" "D0"
2992842-2993642 usb_power_delivery: payload: "[1] REQ Disc Ident  SVID:ff00" "[1] REQ Disc Ident  SVID:ff00"
2993642-2993741 usb_power_delivery: sym: "0x0" "0"
2993741-2993842 usb_power_delivery: sym: "0xF" "F"
2993842-2993941 usb_power_delivery: sym: "0xD" "D"
2993941-2994042 usb_power_delivery: sym: "0x1" "1"
2994042-2994141 usb_power_delivery: sym: "0x7" "7"
2994141-2994241 usb_power_delivery: sym: "0xA" "A"
2994241-2994342 usb_power_delivery: sym: "0xB" "B"
2994342-2994442 usb_power_delivery: sym: "0x5" "5"
2993642-2994442 usb_power_delivery: crc: "CRC:5ba71df0" "CRC"
2994442-2994542 usb_power_delivery: sym: "EOP" "#"
2994442-2994542 usb_power_delivery: eop: "EOP" "E"
2990767-2994542 usb_power_delivery: text: "#49   (498.461167ms): (r2) SNK[0]: VDM - [1] REQ Disc Ident  SVID:ff00" "..."
3001426-3002701 usb_power_delivery: preamble: "Preamble" "..."
3002701-3002799 usb_power_delivery: sym: "SYNC-1" "S1"
3002799-3002901 usb_power_delivery: sym: "SYNC-1" "S1"
3002901-3002999 usb_power_delivery: sym: "SYNC-3" "S3"
3002999-3003101 usb_power_delivery: sym: "SYNC-3" "S3"
3002701-3003101 usb_power_delivery: sop: "SOP'" "S"
3003101-3003199 usb_power_delivery: sym: "0xF" "F"
3003199-3003301 usb_power_delivery: sym: "0x4" "4"
3003301-3003399 usb_power_delivery: sym: "0x0" "0"
3003399-3003501 usb_power_delivery: sym: "0x1" "1"
3003101-3003501 usb_power_delivery: header: "H:104f" "HD"
3001426-3005219 usb_power_delivery: snk: "(r2) SNK[0]: VDM" "VDM"
3003501-3003599 usb_power_delivery: sym: "0x1" "1"
3003599-3003701 usb_power_delivery: sym: "0x0" "0"
3003701-3003799 usb_power_delivery: sym: "0x0" "0"
3003799-3003901 usb_power_delivery: sym: "0x8" "8"
3003901-3003999 usb_power_delivery: sym: "0x0" "0"
3003999-3004101 usb_power_delivery: sym: "0x0" "0"
3004101-3004199 usb_power_delivery: sym: "0xF" "F"
3004199-3004301 usb_power_delivery: sym: "0xF" "F"
3003501-3004301 usb_power_delivery: data: "[0]ff008001" "D0"
3003501-3004301 usb_power_delivery: payload: "[1] REQ Disc Ident  SVID:ff00" "[1] REQ Disc Ident  SVID:ff00"
3004301-3004399 usb_power_delivery: sym: "0x0" "0"
3004399-3004501 usb_power_delivery: sym: "0xF" "F"
3004501-3004599 usb_power_delivery: sym: "0xD" "D"
3004599-3004701 usb_power_delivery: sym: "0x1" "1"
3004701-3004799 usb_power_delivery: sym: "0x7" "7"
3004799-3004899 usb_power_delivery: sym: "0xA" "A"
3004899-3005001 usb_power_delivery: sym: "0xB" "B"
3005001-3005101 usb_power_delivery: sym: "0x5" "5"
3004301-3005101 usb_power_delivery: crc: "CRC:5ba71df0" "CRC"
3005101-3005201 usb_power_delivery: sym: "EOP" "#"
3005101-3005201 usb_power_delivery: eop: "EOP" "E"
3001426-3005201 usb_power_delivery: text: "#50   (500.237667ms): (r2) SNK[0]: VDM - [1] REQ Disc Ident  SVID:ff00" "..."
3012084-3013360 usb_power_delivery: preamble: "Preamble" "..."
3013360-3013458 usb_power_delivery: sym: "SYNC-1" "S1"
3013458-3013560 usb_power_delivery: sym: "SYNC-1" "S1"
3013560-3013658 usb_power_delivery: sym: "SYNC-3" "S3"
3013658-3013760 usb_power_delivery: sym: "SYNC-3" "S3"
3013360-3013760 usb_power_delivery: sop: "SOP'" "S"
3013760-3013858 usb_power_delivery: sym: "0xF" "F"
3013858-3013960 usb_power_delivery: sym: "0x4" "4"
3013960-3014058 usb_power_delivery: sym: "0x0" "0"
3014058-3014160 usb_power_delivery: sym: "0x1" "1"
3013760-3014160 usb_power_delivery: header: "H:104f" "HD"
3012084-3015878 usb_power_delivery: snk: "(r2) SNK[0]: VDM" "VDM"
3014160-3014258 usb_power_delivery: sym: "0x1" "1"
3014258-3014360 usb_power_delivery: sym: "0x0" "0"
3014360-3014458 usb_power_delivery: sym: "0x0" "0"
3014458-3014560 usb_power_delivery: sym: "0x8" "8"
3014560-3014658 usb_power_delivery: sym: "0x0" "0"
3014658-3014760 usb_power_delivery: sym: "0x0" "0"
3014760-3014858 usb_power_delivery: sym: "0xF" "F"
3014858-3014960 usb_power_delivery: sym: "0xF" "F"
3014160-3014960 usb_power_delivery: data: "[0]ff008001" "D0"
3014160-3014960 usb_power_delivery: payload: "[1] REQ Disc Ident  SVID:ff00" "[1] REQ Disc Ident  SVID:ff00"
3014960-3015058 usb_power_delivery: sym: "0x0" "0"
3015058-3015160 usb_power_delivery: sym: "0xF" "F"
3015160-3015258 usb_power_delivery: sym: "0xD" "D"
3015258-3015360 usb_power_delivery: sym: "0x1" "1"
3015360-3015458 usb_power_delivery: sym: "0x7" "7"
3015458-3015558 usb_power_delivery: sym: "0xA" "A"
3015558-3015660 usb_power_delivery: sym: "0xB" "B"
3015660-3015760 usb_power_delivery: sym: "0x5" "5"
3014960-3015760 usb_power_delivery: crc: "CRC:5ba71df0" "CRC"
3015760-3015860 usb_power_delivery: sym: "EOP" "#"
3015760-3015860 usb_power_delivery: eop: "EOP" "E"
3012084-3015860 usb_power_delivery: text: "#51   (502.014000ms): (r2) SNK[0]: VDM - [1] REQ Disc Ident  SVID:ff00" "..."
3022743-3024018 usb_power_delivery: preamble: "Preamble" "..."
3024018-3024117 usb_power_delivery: sym: "SYNC-1" "S1"
3024117-3024218 usb_power_delivery: sym: "SYNC-1" "S1"
3024218-3024317 usb_power_delivery: sym: "SYNC-3" "S3"
3024317-3024418 usb_power_delivery: sym: "SYNC-3" "S3"
3024018-3024418 usb_power_delivery: sop: "SOP'" "S"
3024418-3024517 usb_power_delivery: sym: "0xF" "F"
3024517-3024618 usb_power_delivery: sym: "0x4" "4"
3024618-3024717 usb_power_delivery: sym: "0x0" "0"
3024717-3024818 usb_power_delivery: sym: "0x1" "1"
3024418-3024818 usb_power_delivery: header: "H:104f" "HD"
3022743-3026537 usb_power_delivery: snk: "(r2) SNK[0]: VDM" "VDM"
3024818-3024917 usb_power_delivery: sym: "0x1" "1"
3024917-3025019 usb_power_delivery: sym: "0x0" "0"
3025019-3025117 usb_power_delivery: sym: "0x0" "0"
3025117-3025219 usb_power_delivery: sym: "0x8" "8"
3025219-3025317 usb_power_delivery: sym: "0x0" "0"
3025317-3025418 usb_power_delivery: sym: "0x0" "0"
3025418-3025517 usb_power_delivery: sym: "0xF" "F"
3025517-3025619 usb_power_delivery: sym: "0xF" "F"
3024818-3025619 usb_power_delivery: data: "[0]ff008001" "D0"
3024818-3025619 usb_power_delivery: payload: "[1] REQ Disc Ident  SVID:ff00" "[1] REQ Disc Ident  SVID:ff00"
3025619-3025717 usb_power_delivery: sym: "0x0" "0"
3025717-3025819 usb_power_delivery: sym: "0xF" "F"
3025819-3025917 usb_power_delivery: sym: "0xD" "D"
3025917-3026019 usb_power_delivery: sym: "0x1" "1"
3026019-3026117 usb_power_delivery: sym: "0x7" "7"
3026117-3026217 usb_power_delivery: sym: "0xA" "A"
3026217-3026319 usb_power_delivery: sym: "0xB" "B"
3026319-3026419 usb_power_delivery: sym: "0x5" "5"
3025619-3026419 usb_power_delivery: crc: "CRC:5ba71df0" "CRC"
3026419-3026519 usb_power_delivery: sym: "EOP" "#"
3026419-3026519 usb_power_delivery: eop: "EOP" "E"
3022743-3026519 usb_power_delivery: text: "#52   (503.790500ms): (r2) SNK[0]: VDM - [1] REQ Disc Ident  SVID:ff00" "..."
3033920-3035196 usb_power_delivery: preamble: "Preamble" "..."
3035196-3035294 usb_power_delivery: sym: "SYNC-1" "S1"
3035294-3035396 usb_power_delivery: sym: "SYNC-1" "S1"
3035396-3035494 usb_power_delivery: sym: "SYNC-3" "S3"
3035494-3035596 usb_power_delivery: sym: "SYNC-3" "S3"
3035196-3035596 usb_power_delivery: sop: "SOP'" "S"
3035596-3035694 usb_power_delivery: sym: "0xF" "F"
3035694-3035796 usb_power_delivery: sym: "0x4" "4"
3035796-3035894 usb_power_delivery: sym: "0x0" "0"
3035894-3035996 usb_power_delivery: sym: "0x1" "1"
3035596-3035996 usb_power_delivery: header: "H:104f" "HD"
3033920-3037714 usb_power_delivery: snk: "(r2) SNK[0]: VDM" "VDM"
3035996-3036094 usb_power_delivery: sym: "0x1" "1"
3036094-3036196 usb_power_delivery: sym: "0x0" "0"
3036196-3036294 usb_power_delivery: sym: "0x0" "0"
3036294-3036396 usb_power_delivery: sym: "0x8" "8"
3036396-3036494 usb_power_delivery: sym: "0x0" "0"
3036494-3036596 usb_power_delivery: sym: "0x0" "0"
3036596-3036694 usb_power_delivery: sym: "0xF" "F"
3036694-3036796 usb_power_delivery: sym: "0xF" "F"
3035996-3036796 usb_power_delivery: data: "[0]ff008001" "D0"
3035996-3036796 usb_power_delivery: payload: "[1] REQ Disc Ident  SVID:ff00" "[1] REQ Disc Ident  SVID:ff00"
3036796-3036894 usb_power_delivery: sym: "0x0" "0"
3036894-3036996 usb_power_delivery: sym: "0xF" "F"
3036996-3037094 usb_power_delivery: sym: "0xD" "D"
3037094-3037196 usb_power_delivery: sym: "0x1" "1"
3037196-3037294 usb_power_delivery: sym: "0x7" "7"
3037294-3037394 usb_power_delivery: sym: "0xA" "A"
3037394-3037496 usb_power_delivery: sym: "0xB" "B"
3037496-3037596 usb_power_delivery: sym: "0x5" "5"
3036796-3037596 usb_power_delivery: crc: "CRC:5ba71df0" "CRC"
3037596-3037696 usb_power_delivery: sym: "EOP" "#"
3037596-3037696 usb_power_delivery: eop: "EOP" "E"
3033920-3037696 usb_power_delivery: text: "#53   (505.653333ms): (r2) SNK[0]: VDM - [1] REQ Disc Ident  SVID:ff00" "..."
3044576-3045851 usb_power_delivery: preamble: "Preamble" "..."
3045851-3045950 usb_power_delivery: sym: "SYNC-1" "S1"
3045950-3046051 usb_power_delivery: sym: "SYNC-1" "S1"
3046051-3046150 usb_power_delivery: sym: "SYNC-3" "S3"
3046150-3046251 usb_power_delivery: sym: "SYNC-3" "S3"
3045851-3046251 usb_power_delivery: sop: "SOP'" "S"
3046251-3046350 usb_power_delivery: sym: "0xF" "F"
3046350-3046451 usb_power_delivery: sym: "0x4" "4"
3046451-3046550 usb_power_delivery: sym: "0x0" "0"
3046550-3046651 usb_power_delivery: sym: "0x1" "1"
3046251-3046651 usb_power_delivery: header: "H:104f" "HD"
3044576-3048370 usb_power_delivery: snk: "(r2) SNK[0]: VDM" "VDM"
3046651-3046750 usb_power_delivery: sym: "0x1" "1"
3046750-3046851 usb_power_delivery: sym: "0x0" "0"
3046851-3046950 usb_power_delivery: sym: "0x0" "0"
3046950-3047051 usb_power_delivery: sym: "0x8" "8"
3047051-3047150 usb_power_delivery: sym: "0x0" "0"
3047150-3047251 usb_power_delivery: sym: "0x0" "0"
3047251-3047350 usb_power_delivery: sym: "0xF" "F"
3047350-3047452 usb_power_delivery: sym: "0xF" "F"
3046651-3047452 usb_power_delivery: data: "[0]ff008001" "D0"
3046651-3047452 usb_power_delivery: payload: "[1] REQ Disc Ident  SVID:ff00" "[1] REQ Disc Ident  SVID:ff00"
3047452-3047550 usb_power_delivery: sym: "0x0" "0"
3047550-3047652 usb_power_delivery: sym: "0xF" "F"
3047652-3047750 usb_power_delivery: sym: "0xD" "D"
3047750-3047851 usb_power_delivery: sym: "0x1" "1"
3047851-3047950 usb_power_delivery: sym: "0x7" "7"
3047950-3048050 usb_power_delivery: sym: "0xA" "A"
3048050-3048152 usb_power_delivery: sym: "0xB" "B"
3048152-3048252 usb_power_delivery: sym: "0x5" "5"
3047452-3048252 usb_power_delivery: crc: "CRC:5ba71df0" "CRC"
3048252-3048352 usb_power_delivery: sym: "EOP" "#"
3048252-3048352 usb_power_delivery: eop: "EOP" "E"
3044576-3048352 usb_power_delivery: text: "#54   (507.429333ms): (r2) SNK[0]: VDM - [1] REQ Disc Ident  SVID:ff00" "..."
3055235-3056510 usb_power_delivery: preamble: "Preamble" "..."
3056510-3056608 usb_power_delivery: sym: "SYNC-1" "S1"
3056608-3056710 usb_power_delivery: sym: "SYNC-1" "S1"
3056710-3056808 usb_power_delivery: sym: "SYNC-3" "S3"
3056808-3056910 usb_power_delivery: sym: "SYNC-3" "S3"
3056510-3056910 usb_power_delivery: sop: "SOP'" "S"
3056910-3057008 usb_power_delivery: sym: "0xF" "F"
3057008-3057110 usb_power_delivery: sym: "0x4" "4"
3057110-3057208 usb_power_delivery: sym: "0x0" "0"
3057208-3057310 usb_power_delivery: sym: "0x1" "1"
3056910-3057310 usb_power_delivery: header: "H:104f" "HD"
3055235-3059029 usb_power_delivery: snk: "(r2) SNK[0]: VDM" "VDM"
3057310-3057408 usb_power_delivery: sym: "0x1" "1"
3057408-3057510 usb_power_delivery: sym: "0x0" "0"
3057510-3057608 usb_power_delivery: sym: "0x0" "0"
3057608-3057710 usb_power_delivery: sym: "0x8" "8"
3057710-3057808 usb_power_delivery: sym: "0x0" "0"
3057808-3057910 usb_power_delivery: sym: "0x0" "0"
3057910-3058008 usb_power_delivery: sym: "0xF" "F"
3058008-3058110 usb_power_delivery: sym: "0xF" "F"
3057310-3058110 usb_power_delivery: data: "[0]ff008001" "D0"
3057310-3058110 usb_power_delivery: payload: "[1] REQ Disc Ident  SVID:ff00" "[1] REQ Disc Ident  SVID:ff00"
3058110-3058208 usb_power_delivery: sym: "0x0" "0"
3058208-3058310 usb_power_delivery: sym: "0xF" "F"
3058310-3058408 usb_power_delivery: sym: "0xD" "D"
3058408-3058510 usb_power_delivery: sym: "0x1" "1"
3058510-3058609 usb_power_delivery: sym: "0x7" "7"
3058609-3058709 usb_power_delivery: sym: "0xA" "A"
3058709-3058810 usb_power_delivery: sym: "0xB" "B"
3058810-3058910 usb_power_delivery: sym: "0x5" "5"
3058110-3058910 usb_power_delivery: crc: "CRC:5ba71df0" "CRC"
3058910-3059010 usb_power_delivery: sym: "EOP" "#"
3058910-3059010 usb_power_delivery: eop: "EOP" "E"
3055235-3059010 usb_power_delivery: text: "#55   (509.205833ms): (r2) SNK[0]: VDM - [1] REQ Disc Ident  SVID:ff00" "..."
3065893-3067169 usb_power_delivery: preamble: "Preamble" "..."
3067169-3067267 usb_power_delivery: sym: "SYNC-1" "S1"
3067267-3067369 usb_power_delivery: sym: "SYNC-1" "S1"
3067369-3067467 usb_power_delivery: sym: "SYNC-3" "S3"
3067467-3067569 usb_power_delivery: sym: "SYNC-3" "S3"
3067169-3067569 usb_power_delivery: sop: "SOP'" "S"
3067569-3067667 usb_power_delivery: sym: "0xF" "F"
3067667-3067769 usb_power_delivery: sym: "0x4" "4"
3067769-3067867 usb_power_delivery: sym: "0x0" "0"
3067867-3067969 usb_power_delivery: sym: "0x1" "1"
3067569-3067969 usb_power_delivery: header: "H:104f" "HD"
3065893-3069687 usb_power_delivery: snk: "(r2) SNK[0]: VDM" "VDM"
3067969-3068067 usb_power_delivery: sym: "0x1" "1"
3068067-3068169 usb_power_delivery: sym: "0x0" "0"
3068169-3068267 usb_power_delivery: sym: "0x0" "0"
3068267-3068369 usb_power_delivery: sym: "0x8" "8"
3068369-3068467 usb_power_delivery: sym: "0x0" "0"
3068467-3068569 usb_power_delivery: sym: "0x0" "0"
3068569-3068667 usb_power_delivery: sym: "0xF" "F"
3068667-3068769 usb_power_delivery: sym: "0xF" "F"
3067969-3068769 usb_power_delivery: data: "[0]ff008001" "D0"
3067969-3068769 usb_power_delivery: payload: "[1] REQ Disc Ident  SVID:ff00" "[1] REQ Disc Ident  SVID:ff00"
3068769-3068867 usb_power_delivery: sym: "0x0" "0"
3068867-3068969 usb_power_delivery: sym: "0xF" "F"
3068969-3069067 usb_power_delivery: sym: "0xD" "D"
3069067-3069169 usb_power_delivery: sym: "0x1" "1"
3069169-3069267 usb_power_delivery: sym: "0x7" "7"
3069267-3069367 usb_power_delivery: sym: "0xA" "A"
3069367-3069469 usb_power_delivery: sym: "0xB" "B"
3069469-3069569 usb_power_delivery: sym: "0x5" "5"
3068769-3069569 usb_power_delivery: crc: "CRC:5ba71df0" "CRC"
3069569-3069669 usb_power_delivery: sym: "EOP" "#"
3069569-3069669 usb_power_delivery: eop: "EOP" "E"
3065893-3069669 usb_power_delivery: text: "#56   (510.982167ms): (r2) SNK[0]: VDM - [1] REQ Disc Ident  SVID:ff00" "..."
3077071-3078346 usb_power_delivery: preamble: "Preamble" "..."
3078346-3078444 usb_power_delivery: sym: "SYNC-1" "S1"
3078444-3078546 usb_power_delivery: sym: "SYNC-1" "S1"
3078546-3078644 usb_power_delivery: sym: "SYNC-3" "S3"
3078644-3078746 usb_power_delivery: sym: "SYNC-3" "S3"
3078346-3078746 usb_power_delivery: sop: "SOP'" "S"
3078746-3078844 usb_power_delivery: sym: "0xF" "F"
3078844-3078946 usb_power_delivery: sym: "0x4" "4"
3078946-3079044 usb_power_delivery: sym: "0x0" "0"
3079044-3079146 usb_power_delivery: sym: "0x1" "1"
3078746-3079146 usb_power_delivery: header: "H:104f" "HD"
3077071-3080864 usb_power_delivery: snk: "(r2) SNK[0]: VDM" "VDM"
3079146-3079244 usb_power_delivery: sym: "0x1" "1"
3079244-3079346 usb_power_delivery: sym: "0x0" "0"
3079346-3079444 usb_power_delivery: sym: "0x0" "0"
3079444-3079546 usb_power_delivery: sym: "0x8" "8"
3079546-3079644 usb_power_delivery: sym: "0x0" "0"
3079644-3079746 usb_power_delivery: sym: "0x0" "0"
3079746-3079844 usb_power_delivery: sym: "0xF" "F"
3079844-3079946 usb_power_delivery: sym: "0xF" "F"
3079146-3079946 usb_power_delivery: data: "[0]ff008001" "D0"
3079146-3079946 usb_power_delivery: payload: "[1] REQ Disc Ident  SVID:ff00" "[1] REQ Disc Ident  SVID:ff00"
3079946-3080044 usb_power_delivery: sym: "0x0" "0"
3080044-3080146 usb_power_delivery: sym: "0xF" "F"
3080146-3080244 usb_power_delivery: sym: "0xD" "D"
3080244-3080346 usb_power_delivery: sym: "0x1" "1"
3080346-3080444 usb_power_delivery: sym: "0x7" "7"
3080444-3080544 usb_power_delivery: sym: "0xA" "A"
3080544-3080646 usb_power_delivery: sym: "0xB" "B"
3080646-3080746 usb_power_delivery: sym: "0x5" "5"
3079946-3080746 usb_power_delivery: crc: "CRC:5ba71df0" "CRC"
3080746-3080846 usb_power_delivery: sym: "EOP" "#"
3080746-3080846 usb_power_delivery: eop: "EOP" "E"
3077071-3080846 usb_power_delivery: text: "#57   (512.845167ms): (r2) SNK[0]: VDM - [1] REQ Disc Ident  SVID:ff00" "..."
3087729-3089005 usb_power_delivery: preamble: "Preamble" "..."
3089005-3089103 usb_power_delivery: sym: "SYNC-1" "S1"
3089103-3089205 usb_power_delivery: sym: "SYNC-1" "S1"
3089205-3089303 usb_power_delivery: sym: "SYNC-3" "S3"
3089303-3089405 usb_power_delivery: sym: "SYNC-3" "S3"
3089005-3089405 usb_power_delivery: sop: "SOP'" "S"
3089405-3089503 usb_power_delivery: sym: "0xF" "F"
3089503-3089605 usb_power_delivery: sym: "0x4" "4"
3089605-3089703 usb_power_delivery: sym: "0x0" "0"
3089703-3089805 usb_power_delivery: sym: "0x1" "1"
3089405-3089805 usb_power_delivery: header: "H:104f" "HD"
3087729-3091523 usb_power_delivery: snk: "(r2) SNK[0]: VDM" "VDM"
3089805-3089903 usb_power_delivery: sym: "0x1" "1"
3089903-3090005 usb_power_delivery: sym: "0x0" "0"
3090005-3090103 usb_power_delivery: sym: "0x0" "0"
3090103-3090205 usb_power_delivery: sym: "0x8" "8"
3090205-3090303 usb_power_delivery: sym: "0x0" "0"
3090303-3090405 usb_power_delivery: sym: "0x0" "0"
3090405-3090503 usb_power_delivery: sym: "0xF" "F"
3090503-3090605 usb_power_delivery: sym: "0xF" "F"
3089805-3090605 usb_power_delivery: data: "[0]ff008001" "D0"
3089805-3090605 usb_power_delivery: payload: "[1] REQ Disc Ident  SVID:ff00" "[1] REQ Disc Ident  SVID:ff00"
3090605-3090703 usb_power_delivery: sym: "0x0" "0"
3090703-3090805 usb_power_delivery: sym: "0xF" "F"
3090805-3090903 usb_power_delivery: sym: "0xD" "D"
3090903-3091005 usb_power_delivery: sym: "0x1" "1"
3091005-3091103 usb_power_delivery: sym: "0x7" "7"
3091103-3091203 usb_power_delivery: sym: "0xA" "A"
3091203-3091305 usb_power_delivery: sym: "0xB" "B"
3091305-3091405 usb_power_delivery: sym: "0x5" "5"
3090605-3091405 usb_power_delivery: crc: "CRC:5ba71df0" "CRC"
3091405-3091505 usb_power_delivery: sym: "EOP" "#"
3091405-3091505 usb_power_delivery: eop: "EOP" "E"
3087729-3091505 usb_power_delivery: text: "#58   (514.621500ms): (r2) SNK[0]: VDM - [1] REQ Disc Ident  SVID:ff00" "..."
3098388-3099663 usb_power_delivery: preamble: "Preamble" "..."
3099663-3099762 usb_power_delivery: sym: "SYNC-1" "S1"
3099762-3099863 usb_power_delivery: sym: "SYNC-1" "S1"
3099863-3099962 usb_power_delivery: sym: "SYNC-3" "S3"
3099962-3100063 usb_power_delivery: sym: "SYNC-3" "S3"
3099663-3100063 usb_power_delivery: sop: "SOP'" "S"
3100063-3100162 usb_power_delivery: sym: "0xF" "F"
3100162-3100263 usb_power_delivery: sym: "0x4" "4"
3100263-3100362 usb_power_delivery: sym: "0x0" "0"
3100362-3100463 usb_power_delivery: sym: "0x1" "1"
3100063-3100463 usb_power_delivery: header: "H:104f" "HD"
3098388-3102182 usb_power_delivery: snk: "(r2) SNK[0]: VDM" "VDM"
3100463-3100562 usb_power_delivery: sym: "0x1" "1"
3100562-3100663 usb_power_delivery: sym: "0x0" "0"
3100663-3100762 usb_power_delivery: sym: "0x0" "0"
3100762-3100863 usb_power_delivery: sym: "0x8" "8"
3100863-3100962 usb_power_delivery: sym: "0x0" "0"
3100962-3101064 usb_power_delivery: sym: "0x0" "0"
3101064-3101162 usb_power_delivery: sym: "0xF" "F"
3101162-3101264 usb_power_delivery: sym: "0xF" "F"
3100463-3101264 usb_power_delivery: data: "[0]ff008001" "D0"
3100463-3101264 usb_power_delivery: payload: "[1] REQ Disc Ident  SVID:ff00" "[1] REQ Disc Ident  SVID:ff00"
3101264-3101362 usb_power_delivery: sym: "0x0" "0"
3101362-3101463 usb_power_delivery: sym: "0xF" "F"
3101463-3101562 usb_power_delivery: sym: "0xD" "D"
3101562-3101664 usb_power_delivery: sym: "0x1" "1"
3101664-3101762 usb_power_delivery: sym: "0x7" "7"
3101762-3101862 usb_power_delivery: sym: "0xA" "A"
3101862-3101964 usb_power_delivery: sym: "0xB" "B"
3101964-3102064 usb_power_delivery: sym: "0x5" "5"
3101264-3102064 usb_power_delivery: crc: "CRC:5ba71df0" "CRC"
3102064-3102164 usb_power_delivery: sym: "EOP" "#"
3102064-3102164 usb_power_delivery: eop: "EOP" "E"
3098388-3102164 usb_power_delivery: text: "#59   (516.398000ms): (r2) SNK[0]: VDM - [1] REQ Disc Ident  SVID:ff00" "..."
3109047-3110322 usb_power_delivery: preamble: "Preamble" "..."
3110322-3110420 usb_power_delivery: sym: "SYNC-1" "S1"
3110420-3110522 usb_power_delivery: sym: "SYNC-1" "S1"
3110522-3110620 usb_power_delivery: sym: "SYNC-3" "S3"
3110620-3110722 usb_power_delivery: sym: "SYNC-3" "S3"
3110322-3110722 usb_power_delivery: sop: "SOP'" "S"
3110722-3110820 usb_power_delivery: sym: "0xF" "F"
3110820-3110922 usb_power_delivery: sym: "0x4" "4"
3110922-3111020 usb_power_delivery: sym: "0x0" "0"
3111020-3111122 usb_power_delivery: sym: "0x1" "1"
3110722-3111122 usb_power_delivery: header: "H:104f" "HD"
3109047-3112840 usb_power_delivery: snk: "(r2) SNK[0]: VDM" "VDM"
3111122-3111220 usb_power_delivery: sym: "0x1" "1"
3111220-3111322 usb_power_delivery: sym: "0x0" "0"
3111322-3111420 usb_power_delivery: sym: "0x0" "0"
3111420-3111522 usb_power_delivery: sym: "0x8" "8"
3111522-3111620 usb_power_delivery: sym: "0x0" "0"
3111620-3111722 usb_power_delivery: sym: "0x0" "0"
3111722-3111820 usb_power_delivery: sym: "0xF" "F"
3111820-3111922 usb_power_delivery: sym: "0xF" "F"
3111122-3111922 usb_power_delivery: data: "[0]ff008001" "D0"
3111122-3111922 usb_power_delivery: payload: "[1] REQ Disc Ident  SVID:ff00" "[1] REQ Disc Ident  SVID:ff00"
3111922-3112020 usb_power_delivery: sym: "0x0" "0"
3112020-3112122 usb_power_delivery: sym: "0xF" "F"
3112122-3112220 usb_power_delivery: sym: "0xD" "D"
3112220-3112322 usb_power_delivery: sym: "0x1" "1"
3112322-3112420 usb_power_delivery: sym: "0x7" "7"
3112420-3112520 usb_power_delivery: sym: "0xA" "A"
3112520-3112622 usb_power_delivery: sym: "0xB" "B"
3112622-3112722 usb_power_delivery: sym: "0x5" "5"
3111922-3112722 usb_power_delivery: crc: "CRC:5ba71df0" "CRC"
3112722-3112822 usb_power_delivery: sym: "EOP" "#"
3112722-3112822 usb_power_delivery: eop: "EOP" "E"
3109047-3112822 usb_power_delivery: text: "#60   (518.174500ms): (r2) SNK[0]: VDM - [1] REQ Disc Ident  SVID:ff00" "..."
3120224-3121499 usb_power_delivery: preamble: "Preamble" "..."
3121499-3121598 usb_power_delivery: sym: "SYNC-1" "S1"
3121598-3121699 usb_power_delivery: sym: "SYNC-1" "S1"
3121699-3121798 usb_power_delivery: sym: "SYNC-3" "S3"
3121798-3121899 usb_power_delivery: sym: "SYNC-3" "S3"
3121499-3121899 usb_power_delivery: sop: "SOP'" "S"
3121899-3121998 usb_power_delivery: sym: "0xF" "F"
3121998-3122099 usb_power_delivery: sym: "0x4" "4"
3122099-3122198 usb_power_delivery: sym: "0x0" "0"
3122198-3122299 usb_power_delivery: sym: "0x1" "1"
3121899-3122299 usb_power_delivery: header: "H:104f" "HD"
3120224-3124018 usb_power_delivery: snk: "(r2) SNK[0]: VDM" "VDM"
3122299-3122398 usb_power_delivery: sym: "0x1" "1"
3122398-3122499 usb_power_delivery: sym: "0x0" "0"
3122499-3122598 usb_power_delivery: sym: "0x0" "0"
3122598-3122699 usb_power_delivery: sym: "0x8" "8"
3122699-3122798 usb_power_delivery: sym: "0x0" "0"
3122798-3122899 usb_power_delivery: sym: "0x0" "0"
3122899-3122998 usb_power_delivery: sym: "0xF" "F"
3122998-3123099 usb_power_delivery: sym: "0xF" "F"
3122299-3123099 usb_power_delivery: data: "[0]ff008001" "D0"
3122299-3123099 usb_power_delivery: payload: "[1] REQ Disc Ident  SVID:ff00" "[1] REQ Disc Ident  SVID:ff00"
3123099-3123198 usb_power_delivery: sym: "0x0" "0"
3123198-3123299 usb_power_delivery: sym: "0xF" "F"
3123299-3123398 usb_power_delivery: sym: "0xD" "D"
3123398-3123499 usb_power_delivery: sym: "0x1" "1"
3123499-3123598 usb_power_delivery: sym: "0x7" "7"
3123598-3123698 usb_power_delivery: sym: "0xA" "A"
3123698-3123799 usb_power_delivery: sym: "0xB" "B"
3123799-3123899 usb_power_delivery: sym: "0x5" "5"
3123099-3123899 usb_power_delivery: crc: "CRC:5ba71df0" "CRC"
3123899-3123999 usb_power_delivery: sym: "EOP" "#"
3123899-3123999 usb_power_delivery: eop: "EOP" "E"
3120224-3123999 usb_power_delivery: text: "#61   (520.037333ms): (r2) SNK[0]: VDM - [1] REQ Disc Ident  SVID:ff00" "..."
3130883-3132158 usb_power_delivery: preamble: "Preamble" "..."
3132158-3132256 usb_power_delivery: sym: "SYNC-1" "S1"
3132256-3132358 usb_power_delivery: sym: "SYNC-1" "S1"
3132358-3132456 usb_power_delivery: sym: "SYNC-3" "S3"
3132456-3132558 usb_power_delivery: sym: "SYNC-3" "S3"
3132158-3132558 usb_power_delivery: sop: "SOP'" "S"
3132558-3132656 usb_power_delivery: sym: "0xF" "F"
3132656-3132758 usb_power_delivery: sym: "0x4" "4"
3132758-3132856 usb_power_delivery: sym: "0x0" "0"
3132856-3132958 usb_power_delivery: sym: "0x1" "1"
3132558-3132958 usb_power_delivery: header: "H:104f" "HD"
3130883-3134676 usb_power_delivery: snk: "(r2) SNK[0]: VDM" "VDM"
3132958-3133056 usb_power_delivery: sym: "0x1" "1"
3133056-3133158 usb_power_delivery: sym: "0x0" "0"
3133158-3133256 usb_power_delivery: sym: "0x0" "0"
3133256-3133358 usb_power_delivery: sym: "0x8" "8"
3133358-3133456 usb_power_delivery: sym: "0x0" "0"
3133456-3133558 usb_power_delivery: sym: "0x0" "0"
3133558-3133656 usb_power_delivery: sym: "0xF" "F"
3133656-3133758 usb_power_delivery: sym: "0xF" "F"
3132958-3133758 usb_power_delivery: data: "[0]ff008001" "D0"
3132958-3133758 usb_power_delivery: payload: "[1] REQ Disc Ident  SVID:ff00" "[1] REQ Disc Ident  SVID:ff00"
3133758-3133856 usb_power_delivery: sym: "0x0" "0"
3133856-3133958 usb_power_delivery: sym: "0xF" "F"
3133958-3134056 usb_power_delivery: sym: "0xD" "D"
3134056-3134158 usb_power_delivery: sym: "0x1" "1"
3134158-3134256 usb_power_delivery: sym: "0x7" "7"
3134256-3134356 usb_power_delivery: sym: "0xA" "A"
3134356-3134458 usb_power_delivery: sym: "0xB" "B"
3134458-3134558 usb_power_delivery: sym: "0x5" "5"
3133758-3134558 usb_power_delivery: crc: "CRC:5ba71df0" "CRC"
3134558-3134658 usb_power_delivery: sym: "EOP" "#"
3134558-3134658 usb_power_delivery: eop: "EOP" "E"
3130883-3134658 usb_power_delivery: text: "#62   (521.813833ms): (r2) SNK[0]: VDM - [1] REQ Disc Ident  SVID:ff00" "..."
3141542-3142817 usb_power_delivery: preamble: "Preamble" "..."
3142817-3142915 usb_power_delivery: sym: "SYNC-1" "S1"
3142915-3143017 usb_power_delivery: sym: "SYNC-1" "S1"
3143017-3143115 usb_power_delivery: sym: "SYNC-3" "S3"
3143115-3143217 usb_power_delivery: sym: "SYNC-3" "S3"
3142817-3143217 usb_power_delivery: sop: "SOP'" "S"
3143217-3143315 usb_power_delivery: sym: "0xF" "F"
3143315-3143417 usb_power_delivery: sym: "0x4" "4"
3143417-3143515 usb_power_delivery: sym: "0x0" "0"
3143515-3143617 usb_power_delivery: sym: "0x1" "1"
3143217-3143617 usb_power_delivery: header: "H:104f" "HD"
3141542-3145335 usb_power_delivery: snk: "(r2) SNK[0]: VDM" "VDM"
3143617-3143715 usb_power_delivery: sym: "0x1" "1"
3143715-3143817 usb_power_delivery: sym: "0x0" "0"
3143817-3143915 usb_power_delivery: sym: "0x0" "0"
3143915-3144017 usb_power_delivery: sym: "0x8" "8"
3144017-3144115 usb_power_delivery: sym: "0x0" "0"
3144115-3144217 usb_power_delivery: sym: "0x0" "0"
3144217-3144315 usb_power_delivery: sym: "0xF" "F"
3144315-3144417 usb_power_delivery: sym: "0xF" "F"
3143617-3144417 usb_power_delivery: data: "[0]ff008001" "D0"
3143617-3144417 usb_power_delivery: payload: "[1] REQ Disc Ident  SVID:ff00" "[1] REQ Disc Ident  SVID:ff00"
3144417-3144515 usb_power_delivery: sym: "0x0" "0"
3144515-3144617 usb_power_delivery: sym: "0xF" "F"
3144617-3144715 usb_power_delivery: sym: "0xD" "D"
3144715-3144817 usb_power_delivery: sym: "0x1" "1"
3144817-3144915 usb_power_delivery: sym: "0x7" "7"
3144915-3145015 usb_power_delivery: sym: "0xA" "A"
3145015-3145117 usb_power_delivery: sym: "0xB" "B"
3145117-3145217 usb_power_delivery: sym: "0x5" "5"
3144417-3145217 usb_power_delivery: crc: "CRC:5ba71df0" "CRC"
3145217-3145317 usb_power_delivery: sym: "EOP" "#"
3145217-3145317 usb_power_delivery: eop: "EOP" "E"
3141542-3145317 usb_power_delivery: text: "#63   (523.590333ms): (r2) SNK[0]: VDM - [1] REQ Disc Ident  SVID:ff00" "..."
3152200-3153476 usb_power_delivery: preamble: "Preamble" "..."
3153476-3153574 usb_power_delivery: sym: "SYNC-1" "S1"
3153574-3153676 usb_power_delivery: sym: "SYNC-1" "S1"
3153676-3153774 usb_power_delivery: sym: "SYNC-3" "S3"
3153774-3153876 usb_power_delivery: sym: "SYNC-3" "S3"
3153476-3153876 usb_power_delivery: sop: "SOP'" "S"
3153876-3153974 usb_power_delivery: sym: "0xF" "F"
3153974-3154076 usb_power_delivery: sym: "0x4" "4"
3154076-3154174 usb_power_delivery: sym: "0x0" "0"
3154174-3154276 usb_power_delivery: sym: "0x1" "1"
3153876-3154276 usb_power_delivery: header: "H:104f" "HD"
3152200-3155994 usb_power_delivery: snk: "(r2) SNK[0]: VDM" "VDM"
3154276-3154374 usb_power_delivery: sym: "0x1" "1"
3154374-3154476 usb_power_delivery: sym: "0x0" "0"
3154476-3154574 usb_power_delivery: sym: "0x0" "0"
3154574-3154676 usb_power_delivery: sym: "0x8" "8"
3154676-3154774 usb_power_delivery: sym: "0x0" "0"
3154774-3154876 usb_power_delivery: sym: "0x0" "0"
3154876-3154974 usb_power_delivery: sym: "0xF" "F"
3154974-3155076 usb_power_delivery: sym: "0xF" "F"
3154276-3155076 usb_power_delivery: data: "[0]ff008001" "D0"
3154276-3155076 usb_power_delivery: payload: "[1] REQ Disc Ident  SVID:ff00" "[1] REQ Disc Ident  SVID:ff00"
3155076-3155174 usb_power_delivery: sym: "0x0" "0"
3155174-3155276 usb_power_delivery: sym: "0xF" "F"
3155276-3155374 usb_power_delivery: sym: "0xD" "D"
3155374-3155476 usb_power_delivery: sym: "0x1" "1"
3155476-3155574 usb_power_delivery: sym: "0x7" "7"
3155574-3155674 usb_power_delivery: sym: "0xA" "A"
3155674-3155776 usb_power_delivery: sym: "0xB" "B"
3155776-3155876 usb_power_delivery: sym: "0x5" "5"
3155076-3155876 usb_power_delivery: crc: "CRC:5ba71df0" "CRC"
3155876-3155976 usb_power_delivery: sym: "EOP" "#"
3155876-3155976 usb_power_delivery: eop: "EOP" "E"
3152200-3155976 usb_power_delivery: text: "#64   (525.366667ms): (r2) SNK[0]: VDM - [1] REQ Disc Ident  SVID:ff00" "..."
3163377-3164653 usb_power_delivery: preamble: "Preamble" "..."
3164653-3164751 usb_power_delivery: sym: "SYNC-1" "S1"
3164751-3164853 usb_power_delivery: sym: "SYNC-1" "S1"
3164853-3164951 usb_power_delivery: sym: "SYNC-3" "S3"
3164951-3165053 usb_power_delivery: sym: "SYNC-3" "S3"
3164653-3165053 usb_power_delivery: sop: "SOP'" "S"
3165053-3165151 usb_power_delivery: sym: "0xF" "F"
3165151-3165253 usb_power_delivery: sym: "0x4" "4"
3165253-3165351 usb_power_delivery: sym: "0x0" "0"
3165351-3165453 usb_power_delivery: sym: "0x1" "1"
3165053-3165453 usb_power_delivery: header: "H:104f" "HD"
3163377-3167171 usb_power_delivery: snk: "(r2) SNK[0]: VDM" "VDM"
3165453-3165551 usb_power_delivery: sym: "0x1" "1"
3165551-3165653 usb_power_delivery: sym: "0x0" "0"
3165653-3165751 usb_power_delivery: sym: "0x0" "0"
3165751-3165853 usb_power_delivery: sym: "0x8" "8"
3165853-3165951 usb_power_delivery: sym: "0x0" "0"
3165951-3166053 usb_power_delivery: sym: "0x0" "0"
3166053-3166151 usb_power_delivery: sym: "0xF" "F"
3166151-3166253 usb_power_delivery: sym: "0xF" "F"
3165453-3166253 usb_power_delivery: data: "[0]ff008001" "D0"
3165453-3166253 usb_power_delivery: payload: "[1] REQ Disc Ident  SVID:ff00" "[1] REQ Disc Ident  SVID:ff00"
3166253-3166351 usb_power_delivery: sym: "0x0" "0"
3166351-3166453 usb_power_delivery: sym: "0xF" "F"
3166453-3166551 usb_power_delivery: sym: "0xD" "D"
3166551-3166653 usb_power_delivery: sym: "0x1" "1"
3166653-3166751 usb_power_delivery: sym: "0x7" "7"
3166751-3166851 usb_power_delivery: sym: "0xA" "A"
3166851-3166953 usb_power_delivery: sym: "0xB" "B"
3166953-3167053 usb_power_delivery: sym: "0x5" "5"
3166253-3167053 usb_power_delivery: crc: "CRC:5ba71df0" "CRC"
3167053-3167153 usb_power_delivery: sym: "EOP" "#"
3167053-3167153 usb_power_delivery: eop: "EOP" "E"
3163377-3167153 usb_power_delivery: text: "#65   (527.229500ms): (r2) SNK[0]: VDM - [1] REQ Disc Ident  SVID:ff00" "..."
3174036-3175311 usb_power_delivery: preamble: "Preamble" "..."
3175311-3175410 usb_power_delivery: sym: "SYNC-1" "S1"
3175410-3175511 usb_power_delivery: sym: "SYNC-1" "S1"
3175511-3175610 usb_power_delivery: sym: "SYNC-3" "S3"
3175610-3175712 usb_power_delivery: sym: "SYNC-3" "S3"
3175311-3175712 usb_power_delivery: sop: "SOP'" "S"
3175712-3175810 usb_power_delivery: sym: "0xF" "F"
3175810-3175912 usb_power_delivery: sym: "0x4" "4"
3175912-3176010 usb_power_delivery: sym: "0x0" "0"
3176010-3176111 usb_power_delivery: sym: "0x1" "1"
3175712-3176111 usb_power_delivery: header: "H:104f" "HD"
3174036-3177830 usb_power_delivery: snk: "(r2) SNK[0]: VDM" "VDM"
3176111-3176210 usb_power_delivery: sym: "0x1" "1"
3176210-3176312 usb_power_delivery: sym: "0x0" "0"
3176312-3176410 usb_power_delivery: sym: "0x0" "0"
3176410-3176512 usb_power_delivery: sym: "0x8" "8"
3176512-3176610 usb_power_delivery: sym: "0x0" "0"
3176610-3176712 usb_power_delivery: sym: "0x0" "0"
3176712-3176810 usb_power_delivery: sym: "0xF" "F"
3176810-3176912 usb_power_delivery: sym: "0xF" "F"
3176111-3176912 usb_power_delivery: data: "[0]ff008001" "D0"
3176111-3176912 usb_power_delivery: payload: "[1] REQ Disc Ident  SVID:ff00" "[1] REQ Disc Ident  SVID:ff00"
3176912-3177010 usb_power_delivery: sym: "0x0" "0"
3177010-3177112 usb_power_delivery: sym: "0xF" "F"
3177112-3177210 usb_power_delivery: sym: "0xD" "D"
3177210-3177312 usb_power_delivery: sym: "0x1" "1"
3177312-3177410 usb_power_delivery: sym: "0x7" "7"
3177410-3177510 usb_power_delivery: sym: "0xA" "A"
3177510-3177612 usb_power_delivery: sym: "0xB" "B"
3177612-3177712 usb_power_delivery: sym: "0x5" "5"
3176912-3177712 usb_power_delivery: crc: "CRC:5ba71df0" "CRC"
3177712-3177812 usb_power_delivery: sym: "EOP" "#"
3177712-3177812 usb_power_delivery: eop: "EOP" "E"
3174036-3177812 usb_power_delivery: text: "#66   (529.006000ms): (r2) SNK[0]: VDM - [1] REQ Disc Ident  SVID:ff00" "..."
3184695-3185970 usb_power_delivery: preamble: "Preamble" "..."
3185970-3186068 usb_power_delivery: sym: "SYNC-1" "S1"
3186068-3186170 usb_power_delivery: sym: "SYNC-1" "S1"
3186170-3186268 usb_power_delivery: sym: "SYNC-3" "S3"
3186268-3186370 usb_power_delivery: sym: "SYNC-3" "S3"
3185970-3186370 usb_power_delivery: sop: "SOP'" "S"
3186370-3186468 usb_power_delivery: sym: "0xF" "F"
3186468-3186570 usb_power_delivery: sym: "0x4" "4"
3186570-3186668 usb_power_delivery: sym: "0x0" "0"
3186668-3186770 usb_power_delivery: sym: "0x1" "1"
3186370-3186770 usb_power_delivery: header: "H:104f" "HD"
3184695-3188489 usb_power_delivery: snk: "(r2) SNK[0]: VDM" "VDM"
3186770-3186868 usb_power_delivery: sym: "0x1" "1"
3186868-3186970 usb_power_delivery: sym: "0x0" "0"
3186970-3187068 usb_power_delivery: sym: "0x0" "0"
3187068-3187170 usb_power_delivery: sym: "0x8" "8"
3187170-3187268 usb_power_delivery: sym: "0x0" "0"
3187268-3187370 usb_power_delivery: sym: "0x0" "0"
3187370-3187468 usb_power_delivery: sym: "0xF" "F"
3187468-3187570 usb_power_delivery: sym: "0xF" "F"
3186770-3187570 usb_power_delivery: data: "[0]ff008001" "D0"
3186770-3187570 usb_power_delivery: payload: "[1] REQ Disc Ident  SVID:ff00" "[1] REQ Disc Ident  SVID:ff00"
3187570-3187669 usb_power_delivery: sym: "0x0" "0"
3187669-3187770 usb_power_delivery: sym: "0xF" "F"
3187770-3187869 usb_power_delivery: sym: "0xD" "D"
3187869-3187970 usb_power_delivery: sym: "0x1" "1"
3187970-3188069 usb_power_delivery: sym: "0x7" "7"
3188069-3188169 usb_power_delivery: sym: "0xA" "A"
3188169-3188270 usb_power_delivery: sym: "0xB" "B"
3188270-3188370 usb_power_delivery: sym: "0x5" "5"
3187570-3188370 usb_power_delivery: crc: "CRC:5ba71df0" "CRC"
3188370-3188470 usb_power_delivery: sym: "EOP" "#"
3188370-3188470 usb_power_delivery: eop: "EOP" "E"
3184695-3188470 usb_power_delivery: text: "#67   (530.782500ms): (r2) SNK[0]: VDM - [1] REQ Disc Ident  SVID:ff00" "..."
3195354-3196629 usb_power_delivery: preamble: "Preamble" "..."
3196629-3196727 usb_power_delivery: sym: "SYNC-1" "S1"
3196727-3196829 usb_power_delivery: sym: "SYNC-1" "S1"
3196829-3196927 usb_power_delivery: sym: "SYNC-3" "S3"
3196927-3197029 usb_power_delivery: sym: "SYNC-3" "S3"
3196629-3197029 usb_power_delivery: sop: "SOP'" "S"
3197029-3197127 usb_power_delivery: sym: "0xF" "F"
3197127-3197229 usb_power_delivery: sym: "0x4" "4"
3197229-3197327 usb_power_delivery: sym: "0x0" "0"
3197327-3197429 usb_power_delivery: sym: "0x1" "1"
3197029-3197429 usb_power_delivery: header: "H:104f" "HD"
3195354-3199147 usb_power_delivery: snk: "(r2) SNK[0]: VDM" "VDM"
3197429-3197527 usb_power_delivery: sym: "0x1" "1"
3197527-3197629 usb_power_delivery: sym: "0x0" "0"
3197629-3197727 usb_power_delivery: sym: "0x0" "0"
3197727-3197829 usb_power_delivery: sym: "0x8" "8"
3197829-3197927 usb_power_delivery: sym: "0x0" "0"
3197927-3198029 usb_power_delivery: sym: "0x0" "0"
3198029-3198127 usb_power_delivery: sym: "0xF" "F"
3198127-3198229 usb_power_delivery: sym: "0xF" "F"
3197429-3198229 usb_power_delivery: data: "[0]ff008001" "D0"
3197429-3198229 usb_power_delivery: payload: "[1] REQ Disc Ident  SVID:ff00" "[1] REQ Disc Ident  SVID:ff00"
3198229-3198327 usb_power_delivery: sym: "0x0" "0"
3198327-3198429 usb_power_delivery: sym: "0xF" "F"
3198429-3198527 usb_power_delivery: sym: "0xD" "D"
3198527-3198629 usb_power_delivery: sym: "0x1" "1"
3198629-3198727 usb_power_delivery: sym: "0x7" "7"
3198727-3198827 usb_power_delivery: sym: "0xA" "A"
3198827-3198929 usb_power_delivery: sym: "0xB" "B"
3198929-3199029 usb_power_delivery: sym: "0x5" "5"
3198229-3199029 usb_power_delivery: crc: "CRC:5ba71df0" "CRC"
3199029-3199129 usb_power_delivery: sym: "EOP" "#"
3199029-3199129 usb_power_delivery: eop: "EOP" "E"
3195354-3199129 usb_power_delivery: text: "#68   (532.559000ms): (r2) SNK[0]: VDM - [1] REQ Disc Ident  SVID:ff00" "..."
3206565-3207840 usb_power_delivery: preamble: "Preamble" "..."
3207840-3207939 usb_power_delivery: sym: "SYNC-1" "S1"
3207939-3208040 usb_power_delivery: sym: "SYNC-1" "S1"
3208040-3208139 usb_power_delivery: sym: "SYNC-3" "S3"
3208139-3208241 usb_power_delivery: sym: "SYNC-3" "S3"
3207840-3208241 usb_power_delivery: sop: "SOP'" "S"
3208241-3208339 usb_power_delivery: sym: "0xF" "F"
3208339-3208441 usb_power_delivery: sym: "0x4" "4"
3208441-3208539 usb_power_delivery: sym: "0x0" "0"
3208539-3208641 usb_power_delivery: sym: "0x1" "1"
3208241-3208641 usb_power_delivery: header: "H:104f" "HD"
3206565-3210359 usb_power_delivery: snk: "(r2) SNK[0]: VDM" "VDM"
3208641-3208739 usb_power_delivery: sym: "0x1" "1"
3208739-3208841 usb_power_delivery: sym: "0x0" "0"
3208841-3208939 usb_power_delivery: sym: "0x0" "0"
3208939-3209041 usb_power_delivery: sym: "0x8" "8"
3209041-3209139 usb_power_delivery: sym: "0x0" "0"
3209139-3209241 usb_power_delivery: sym: "0x0" "0"
3209241-3209339 usb_power_delivery: sym: "0xF" "F"
3209339-3209441 usb_power_delivery: sym: "0xF" "F"
3208641-3209441 usb_power_delivery: data: "[0]ff008001" "D0"
3208641-3209441 usb_power_delivery: payload: "[1] REQ Disc Ident  SVID:ff00" "[1] REQ Disc Ident  SVID:ff00"
3209441-3209539 usb_power_delivery: sym: "0x0" "0"
3209539-3209641 usb_power_delivery: sym: "0xF" "F"
3209641-3209739 usb_power_delivery: sym: "0xD" "D"
3209739-3209841 usb_power_delivery: sym: "0x1" "1"
3209841-3209939 usb_power_delivery: sym: "0x7" "7"
3209939-3210039 usb_power_delivery: sym: "0xA" "A"
3210039-3210141 usb_power_delivery: sym: "0xB" "B"
3210141-3210241 usb_power_delivery: sym: "0x5" "5"
3209441-3210241 usb_power_delivery: crc: "CRC:5ba71df0" "CRC"
3210241-3210341 usb_power_delivery: sym: "EOP" "#"
3210241-3210341 usb_power_delivery: eop: "EOP" "E"
3206565-3210341 usb_power_delivery: text: "#69   (534.427500ms): (r2) SNK[0]: VDM - [1] REQ Disc Ident  SVID:ff00" "..."
3217221-3218496 usb_power_delivery: preamble: "Preamble" "..."
3218496-3218594 usb_power_delivery: sym: "SYNC-1" "S1"
3218594-3218696 usb_power_delivery: sym: "SYNC-1" "S1"
3218696-3218794 usb_power_delivery: sym: "SYNC-3" "S3"
3218794-3218896 usb_power_delivery: sym: "SYNC-3" "S3"
3218496-3218896 usb_power_delivery: sop: "SOP'" "S"
3218896-3218994 usb_power_delivery: sym: "0xF" "F"
3218994-3219096 usb_power_delivery: sym: "0x4" "4"
3219096-3219194 usb_power_delivery: sym: "0x0" "0"
3219194-3219296 usb_power_delivery: sym: "0x1" "1"
3218896-3219296 usb_power_delivery: header: "H:104f" "HD"
3217221-3221015 usb_power_delivery: snk: "(r2) SNK[0]: VDM" "VDM"
3219296-3219394 usb_power_delivery: sym: "0x1" "1"
3219394-3219496 usb_power_delivery: sym: "0x0" "0"
3219496-3219595 usb_power_delivery: sym: "0x0" "0"
3219595-3219696 usb_power_delivery: sym: "0x8" "8"
3219696-3219795 usb_power_delivery: sym: "0x0" "0"
3219795-3219896 usb_power_delivery: sym: "0x0" "0"
3219896-3219995 usb_power_delivery: sym: "0xF" "F"
3219995-3220096 usb_power_delivery: sym: "0xF" "F"
3219296-3220096 usb_power_delivery: data: "[0]ff008001" "D0"
3219296-3220096 usb_power_delivery: payload: "[1] REQ Disc Ident  SVID:ff00" "[1] REQ Disc Ident  SVID:ff00"
3220096-3220195 usb_power_delivery: sym: "0x0" "0"
3220195-3220296 usb_power_delivery: sym: "0xF" "F"
3220296-3220395 usb_power_delivery: sym: "0xD" "D"
3220395-3220496 usb_power_delivery: sym: "0x1" "1"
3220496-3220595 usb_power_delivery: sym: "0x7" "7"
3220595-3220695 usb_power_delivery: sym: "0xA" "A"
3220695-3220796 usb_power_delivery: sym: "0xB" "B"
3220796-3220896 usb_power_delivery: sym: "0x5" "5"
3220096-3220896 usb_power_delivery: crc: "CRC:5ba71df0" "CRC"
3220896-3220996 usb_power_delivery: sym: "EOP" "#"
3220896-3220996 usb_power_delivery: eop: "EOP" "E"
3217221-3220996 usb_power_delivery: text: "#70   (536.203500ms): (r2) SNK[0]: VDM - [1] REQ Disc Ident  SVID:ff00" "..."
3227880-3229155 usb_power_delivery: preamble: "Preamble" "..."
3229155-3229253 usb_power_delivery: sym: "SYNC-1" "S1"
3229253-3229355 usb_power_delivery: sym: "SYNC-1" "S1"
3229355-3229453 usb_power_delivery: sym: "SYNC-3" "S3"
3229453-3229555 usb_power_delivery: sym: "SYNC-3" "S3"
3229155-3229555 usb_power_delivery: sop: "SOP'" "S"
3229555-3229653 usb_power_delivery: sym: "0xF" "F"
3229653-3229755 usb_power_delivery: sym: "0x4" "4"
3229755-3229853 usb_power_delivery: sym: "0x0" "0"
3229853-3229955 usb_power_delivery: sym: "0x1" "1"
3229555-3229955 usb_power_delivery: header: "H:104f" "HD"
3227880-3231673 usb_power_delivery: snk: "(r2) SNK[0]: VDM" "VDM"
3229955-3230053 usb_power_delivery: sym: "0x1" "1"
3230053-3230155 usb_power_delivery: sym: "0x0" "0"
3230155-3230253 usb_power_delivery: sym: "0x0" "0"
3230253-3230355 usb_power_delivery: sym: "0x8" "8"
3230355-3230453 usb_power_delivery: sym: "0x0" "0"
3230453-3230555 usb_power_delivery: sym: "0x0" "0"
3230555-3230653 usb_power_delivery: sym: "0xF" "F"
3230653-3230755 usb_power_delivery: sym: "0xF" "F"
3229955-3230755 usb_power_delivery: data: "[0]ff008001" "D0"
3229955-3230755 usb_power_delivery: payload: "[1] REQ Disc Ident  SVID:ff00" "[1] REQ Disc Ident  SVID:ff00"
3230755-3230853 usb_power_delivery: sym: "0x0" "0"
3230853-3230955 usb_power_delivery: sym: "0xF" "F"
3230955-3231053 usb_power_delivery: sym: "0xD" "D"
3231053-3231155 usb_power_delivery: sym: "0x1" "1"
3231155-3231253 usb_power_delivery: sym: "0x7" "7"
3231253-3231353 usb_power_delivery: sym: "0xA" "A"
3231353-3231455 usb_power_delivery: sym: "0xB" "B"
3231455-3231555 usb_power_delivery: sym: "0x5" "5"
3230755-3231555 usb_power_delivery: crc: "CRC:5ba71df0" "CRC"
3231555-3231655 usb_power_delivery: sym: "EOP" "#"
3231555-3231655 usb_power_delivery: eop: "EOP" "E"
3227880-3231655 usb_power_delivery: text: "#71   (537.980000ms): (r2) SNK[0]: VDM - [1] REQ Disc Ident  SVID:ff00" "..."
3238538-3239814 usb_power_delivery: preamble: "Preamble" "..."
3239814-3239912 usb_power_delivery: sym: "SYNC-1" "S1"
3239912-3240014 usb_power_delivery: sym: "SYNC-1" "S1"
3240014-3240112 usb_power_delivery: sym: "SYNC-3" "S3"
3240112-3240214 usb_power_delivery: sym: "SYNC-3" "S3"
3239814-3240214 usb_power_delivery: sop: "SOP'" "S"
3240214-3240312 usb_power_delivery: sym: "0xF" "F"
3240312-3240414 usb_power_delivery: sym: "0x4" "4"
3240414-3240512 usb_power_delivery: sym: "0x0" "0"
3240512-3240614 usb_power_delivery: sym: "0x1" "1"
3240214-3240614 usb_power_delivery: header: "H:104f" "HD"
3238538-3242332 usb_power_delivery: snk: "(r2) SNK[0]: VDM" "VDM"
3240614-3240712 usb_power_delivery: sym: "0x1" "1"
3240712-3240814 usb_power_delivery: sym: "0x0" "0"
3240814-3240912 usb_power_delivery: sym: "0x0" "0"
3240912-3241014 usb_power_delivery: sym: "0x8" "8"
3241014-3241112 usb_power_delivery: sym: "0x0" "0"
3241112-3241214 usb_power_delivery: sym: "0x0" "0"
3241214-3241312 usb_power_delivery: sym: "0xF" "F"
3241312-3241414 usb_power_delivery: sym: "0xF" "F"
3240614-3241414 usb_power_delivery: data: "[0]ff008001" "D0"
3240614-3241414 usb_power_delivery: payload: "[1] REQ Disc Ident  SVID:ff00" "[1] REQ Disc Ident  SVID:ff00"
3241414-3241512 usb_power_delivery: sym: "0x0" "0"
3241512-3241614 usb_power_delivery: sym: "0xF" "F"
3241614-3241712 usb_power_delivery: sym: "0xD" "D"
3241712-3241814 usb_power_delivery: sym: "0x1" "1"
3241814-3241912 usb_power_delivery: sym: "0x7" "7"
3241912-3242012 usb_power_delivery: sym: "0xA" "A"
3242012-3242114 usb_power_delivery: sym: "0xB" "B"
3242114-3242214 usb_power_delivery: sym: "0x5" "5"
3241414-3242214 usb_power_delivery: crc: "CRC:5ba71df0" "CRC"
3242214-3242314 usb_power_delivery: sym: "EOP" "#"
3242214-3242314 usb_power_delivery: eop: "EOP" "E"
3238538-3242314 usb_power_delivery: text: "#72   (539.756333ms): (r2) SNK[0]: VDM - [1] REQ Disc Ident  SVID:ff00" "..."
3249715-3250991 usb_power_delivery: preamble: "Preamble" "..."
3250991-3251089 usb_power_delivery: sym: "SYNC-1" "S1"
3251089-3251191 usb_power_delivery: sym: "SYNC-1" "S1"
3251191-3251289 usb_power_delivery: sym: "SYNC-3" "S3"
3251289-3251391 usb_power_delivery: sym: "SYNC-3" "S3"
3250991-3251391 usb_power_delivery: sop: "SOP'" "S"
3251391-3251489 usb_power_delivery: sym: "0xF" "F"
3251489-3251591 usb_power_delivery: sym: "0x4" "4"
3251591-3251689 usb_power_delivery: sym: "0x0" "0"
3251689-3251791 usb_power_delivery: sym: "0x1" "1"
3251391-3251791 usb_power_delivery: header: "H:104f" "HD"
3249715-3253509 usb_power_delivery: snk: "(r2) SNK[0]: VDM" "VDM"
3251791-3251889 usb_power_delivery: sym: "0x1" "1"
3251889-3251991 usb_power_delivery: sym: "0x0" "0"
3251991-3252089 usb_power_delivery: sym: "0x0" "0"
3252089-3252191 usb_power_delivery: sym: "0x8" "8"
3252191-3252289 usb_power_delivery: sym: "0x0" "0"
3252289-3252391 usb_power_delivery: sym: "0x0" "0"
3252391-3252489 usb_power_delivery: sym: "0xF" "F"
3252489-3252591 usb_power_delivery: sym: "0xF" "F"
3251791-3252591 usb_power_delivery: data: "[0]ff008001" "D0"
3251791-3252591 usb_power_delivery: payload: "[1] REQ Disc Ident  SVID:ff00" "[1] REQ Disc Ident  SVID:ff00"
3252591-3252689 usb_power_delivery: sym: "0x0" "0"
3252689-3252791 usb_power_delivery: sym: "0xF" "F"
3252791-3252889 usb_power_delivery: sym: "0xD" "D"
3252889-3252991 usb_power_delivery: sym: "0x1" "1"
3252991-3253089 usb_power_delivery: sym: "0x7" "7"
3253089-3253189 usb_power_delivery: sym: "0xA" "A"
3253189-3253291 usb_power_delivery: sym: "0xB" "B"
3253291-3253391 usb_power_delivery: sym: "0x5" "5"
3252591-3253391 usb_power_delivery: crc: "CRC:5ba71df0" "CRC"
3253391-3253491 usb_power_delivery: sym: "EOP" "#"
3253391-3253491 usb_power_delivery: eop: "EOP" "E"
3249715-3253491 usb_power_delivery: text: "#73   (541.619167ms): (r2) SNK[0]: VDM - [1] REQ Disc Ident  SVID:ff00" "..."
3260374-3261649 usb_power_delivery: preamble: "Preamble" "..."
3261649-3261748 usb_power_delivery: sym: "SYNC-1" "S1"
3261748-3261850 usb_power_delivery: sym: "SYNC-1" "S1"
3261850-3261948 usb_power_delivery: sym: "SYNC-3" "S3"
3261948-3262050 usb_power_delivery: sym: "SYNC-3" "S3"
3261649-3262050 usb_power_delivery: sop: "SOP'" "S"
3262050-3262148 usb_power_delivery: sym: "0xF" "F"
3262148-3262249 usb_power_delivery: sym: "0x4" "4"
3262249-3262348 usb_power_delivery: sym: "0x0" "0"
3262348-3262449 usb_power_delivery: sym: "0x1" "1"
3262050-3262449 usb_power_delivery: header: "H:104f" "HD"
3260374-3264168 usb_power_delivery: snk: "(r2) SNK[0]: VDM" "VDM"
3262449-3262548 usb_power_delivery: sym: "0x1" "1"
3262548-3262650 usb_power_delivery: sym: "0x0" "0"
3262650-3262748 usb_power_delivery: sym: "0x0" "0"
3262748-3262850 usb_power_delivery: sym: "0x8" "8"
3262850-3262948 usb_power_delivery: sym: "0x0" "0"
3262948-3263050 usb_power_delivery: sym: "0x0" "0"
3263050-3263148 usb_power_delivery: sym: "0xF" "F"
3263148-3263250 usb_power_delivery: sym: "0xF" "F"
3262449-3263250 usb_power_delivery: data: "[0]ff008001" "D0"
3262449-3263250 usb_power_delivery: payload: "[1] REQ Disc Ident  SVID:ff00" "[1] REQ Disc Ident  SVID:ff00"
3263250-3263348 usb_power_delivery: sym: "0x0" "0"
3263348-3263450 usb_power_delivery: sym: "0xF" "F"
3263450-3263548 usb_power_delivery: sym: "0xD" "D"
3263548-3263650 usb_power_delivery: sym: "0x1" "1"
3263650-3263748 usb_power_delivery: sym: "0x7" "7"
3263748-3263848 usb_power_delivery: sym: "0xA" "A"
3263848-3263950 usb_power_delivery: sym: "0xB" "B"
3263950-3264050 usb_power_delivery: sym: "0x5" "5"
3263250-3264050 usb_power_delivery: crc: "CRC:5ba71df0" "CRC"
3264050-3264150 usb_power_delivery: sym: "EOP" "#"
3264050-3264150 usb_power_delivery: eop: "EOP" "E"
3260374-3264150 usb_power_delivery: text: "#74   (543.395667ms): (r2) SNK[0]: VDM - [1] REQ Disc Ident  SVID:ff00" "..."
3271033-3272308 usb_power_delivery: preamble: "Preamble" "..."
3272308-3272406 usb_power_delivery: sym: "SYNC-1" "S1"
3272406-3272508 usb_power_delivery: sym: "SYNC-1" "S1"
3272508-3272606 usb_power_delivery: sym: "SYNC-3" "S3"
3272606-3272708 usb_power_delivery: sym: "SYNC-3" "S3"
3272308-3272708 usb_power_delivery: sop: "SOP'" "S"
3272708-3272806 usb_power_delivery: sym: "0xF" "F"
3272806-3272908 usb_power_delivery: sym: "0x4" "4"
3272908-3273006 usb_power_delivery: sym: "0x0" "0"
3273006-3273108 usb_power_delivery: sym: "0x1" "1"
3272708-3273108 usb_power_delivery: header: "H:104f" "HD"
3271033-3274827 usb_power_delivery: snk: "(r2) SNK[0]: VDM" "VDM"
3273108-3273206 usb_power_delivery: sym: "0x1" "1"
3273206-3273308 usb_power_delivery: sym: "0x0" "0"
3273308-3273406 usb_power_delivery: sym: "0x0" "0"
3273406-3273508 usb_power_delivery: sym: "0x8" "8"
3273508-3273606 usb_power_delivery: sym: "0x0" "0"
3273606-3273708 usb_power_delivery: sym: "0x0" "0"
3273708-3273807 usb_power_delivery: sym: "0xF" "F"
3273807-3273908 usb_power_delivery: sym: "0xF" "F"
3273108-3273908 usb_power_delivery: data: "[0]ff008001" "D0"
3273108-3273908 usb_power_delivery: payload: "[1] REQ Disc Ident  SVID:ff00" "[1] REQ Disc Ident  SVID:ff00"
3273908-3274007 usb_power_delivery: sym: "0x0" "0"
3274007-3274108 usb_power_delivery: sym: "0xF" "F"
3274108-3274207 usb_power_delivery: sym: "0xD" "D"
3274207-3274308 usb_power_delivery: sym: "0x1" "1"
3274308-3274407 usb_power_delivery: sym: "0x7" "7"
3274407-3274507 usb_power_delivery: sym: "0xA" "A"
3274507-3274608 usb_power_delivery: sym: "0xB" "B"
3274608-3274708 usb_power_delivery: sym: "0x5" "5"
3273908-3274708 usb_power_delivery: crc: "CRC:5ba71df0" "CRC"
3274708-3274808 usb_power_delivery: sym: "EOP" "#"
3274708-3274808 usb_power_delivery: eop: "EOP" "E"
3271033-3274808 usb_power_delivery: text: "#75   (545.172167ms): (r2) SNK[0]: VDM - [1] REQ Disc Ident  SVID:ff00" "..."
3281692-3282967 usb_power_delivery: preamble: "Preamble" "..."
3282967-3283065 usb_power_delivery: sym: "SYNC-1" "S1"
3283065-3283167 usb_power_delivery: sym: "SYNC-1" "S1"
3283167-3283265 usb_power_delivery: sym: "SYNC-3" "S3"
3283265-3283367 usb_power_delivery: sym: "SYNC-3" "S3"
3282967-3283367 usb_power_delivery: sop: "SOP'" "S"
3283367-3283465 usb_power_delivery: sym: "0xF" "F"
3283465-3283567 usb_power_delivery: sym: "0x4" "4"
3283567-3283665 usb_power_delivery: sym: "0x0" "0"
3283665-3283767 usb_power_delivery: sym: "0x1" "1"
3283367-3283767 usb_power_delivery: header: "H:104f" "HD"
3281692-3285485 usb_power_delivery: snk: "(r2) SNK[0]: VDM" "VDM"
3283767-3283865 usb_power_delivery: sym: "0x1" "1"
3283865-3283967 usb_power_delivery: sym: "0x0" "0"
3283967-3284065 usb_power_delivery: sym: "0x0" "0"
3284065-3284167 usb_power_delivery: sym: "0x8" "8"
3284167-3284265 usb_power_delivery: sym: "0x0" "0"
3284265-3284367 usb_power_delivery: sym: "0x0" "0"
3284367-3284465 usb_power_delivery: sym: "0xF" "F"
3284465-3284567 usb_power_delivery: sym: "0xF" "F"
3283767-3284567 usb_power_delivery: data: "[0]ff008001" "D0"
3283767-3284567 usb_power_delivery: payload: "[1] REQ Disc Ident  SVID:ff00" "[1] REQ Disc Ident  SVID:ff00"
3284567-3284665 usb_power_delivery: sym: "0x0" "0"
3284665-3284767 usb_power_delivery: sym: "0xF" "F"
3284767-3284865 usb_power_delivery: sym: "0xD" "D"
3284865-3284967 usb_power_delivery: sym: "0x1" "1"
3284967-3285065 usb_power_delivery: sym: "0x7" "7"
3285065-3285165 usb_power_delivery: sym: "0xA" "A"
3285165-3285267 usb_power_delivery: sym: "0xB" "B"
3285267-3285367 usb_power_delivery: sym: "0x5" "5"
3284567-3285367 usb_power_delivery: crc: "CRC:5ba71df0" "CRC"
3285367-3285467 usb_power_delivery: sym: "EOP" "#"
3285367-3285467 usb_power_delivery: eop: "EOP" "E"
3281692-3285467 usb_power_delivery: text: "#76   (546.948667ms): (r2) SNK[0]: VDM - [1] REQ Disc Ident  SVID:ff00" "..."
3292869-3294144 usb_power_delivery: preamble: "Preamble" "..."
3294144-3294242 usb_power_delivery: sym: "SYNC-1" "S1"
3294242-3294344 usb_power_delivery: sym: "SYNC-1" "S1"
3294344-3294442 usb_power_delivery: sym: "SYNC-3" "S3"
3294442-3294544 usb_power_delivery: sym: "SYNC-3" "S3"
3294144-3294544 usb_power_delivery: sop: "SOP'" "S"
3294544-3294642 usb_power_delivery: sym: "0xF" "F"
3294642-3294744 usb_power_delivery: sym: "0x4" "4"
3294744-3294842 usb_power_delivery: sym: "0x0" "0"
3294842-3294944 usb_power_delivery: sym: "0x1" "1"
3294544-3294944 usb_power_delivery: header: "H:104f" "HD"
3292869-3296662 usb_power_delivery: snk: "(r2) SNK[0]: VDM" "VDM"
3294944-3295042 usb_power_delivery: sym: "0x1" "1"
3295042-3295144 usb_power_delivery: sym: "0x0" "0"
3295144-3295242 usb_power_delivery: sym: "0x0" "0"
3295242-3295344 usb_power_delivery: sym: "0x8" "8"
3295344-3295442 usb_power_delivery: sym: "0x0" "0"
3295442-3295544 usb_power_delivery: sym: "0x0" "0"
3295544-3295642 usb_power_delivery: sym: "0xF" "F"
3295642-3295744 usb_power_delivery: sym: "0xF" "F"
3294944-3295744 usb_power_delivery: data: "[0]ff008001" "D0"
3294944-3295744 usb_power_delivery: payload: "[1] REQ Disc Ident  SVID:ff00" "[1] REQ Disc Ident  SVID:ff00"
3295744-3295842 usb_power_delivery: sym: "0x0" "0"
3295842-3295944 usb_power_delivery: sym: "0xF" "F"
3295944-3296042 usb_power_delivery: sym: "0xD" "D"
3296042-3296144 usb_power_delivery: sym: "0x1" "1"
3296144-3296242 usb_power_delivery: sym: "0x7" "7"
3296242-3296342 usb_power_delivery: sym: "0xA" "A"
3296342-3296444 usb_power_delivery: sym: "0xB" "B"
3296444-3296544 usb_power_delivery: sym: "0x5" "5"
3295744-3296544 usb_power_delivery: crc: "CRC:5ba71df0" "CRC"
3296544-3296644 usb_power_delivery: sym: "EOP" "#"
3296544-3296644 usb_power_delivery: eop: "EOP" "E"
3292869-3296644 usb_power_delivery: text: "#77   (548.811500ms): (r2) SNK[0]: VDM - [1] REQ Disc Ident  SVID:ff00" "..."
3303527-3304803 usb_power_delivery: preamble: "Preamble" "..."
3304803-3304901 usb_power_delivery: sym: "SYNC-1" "S1"
3304901-3305003 usb_power_delivery: sym: "SYNC-1" "S1"
3305003-3305101 usb_power_delivery: sym: "SYNC-3" "S3"
3305101-3305203 usb_power_delivery: sym: "SYNC-3" "S3"
3304803-3305203 usb_power_delivery: sop: "SOP'" "S"
3305203-3305301 usb_power_delivery: sym: "0xF" "F"
3305301-3305403 usb_power_delivery: sym: "0x4" "4"
3305403-3305501 usb_power_delivery: sym: "0x0" "0"
3305501-3305603 usb_power_delivery: sym: "0x1" "1"
3305203-3305603 usb_power_delivery: header: "H:104f" "HD"
3303527-3307321 usb_power_delivery: snk: "(r2) SNK[0]: VDM" "VDM"
3305603-3305701 usb_power_delivery: sym: "0x1" "1"
3305701-3305803 usb_power_delivery: sym: "0x0" "0"
3305803-3305901 usb_power_delivery: sym: "0x0" "0"
3305901-3306003 usb_power_delivery: sym: "0x8" "8"
3306003-3306101 usb_power_delivery: sym: "0x0" "0"
3306101-3306203 usb_power_delivery: sym: "0x0" "0"
3306203-3306301 usb_power_delivery: sym: "0xF" "F"
3306301-3306403 usb_power_delivery: sym: "0xF" "F"
3305603-3306403 usb_power_delivery: data: "[0]ff008001" "D0"
3305603-3306403 usb_power_delivery: payload: "[1] REQ Disc Ident  SVID:ff00" "[1] REQ Disc Ident  SVID:ff00"
3306403-3306501 usb_power_delivery: sym: "0x0" "0"
3306501-3306603 usb_power_delivery: sym: "0xF" "F"
3306603-3306701 usb_power_delivery: sym: "0xD" "D"
3306701-3306803 usb_power_delivery: sym: "0x1" "1"
3306803-3306901 usb_power_delivery: sym: "0x7" "7"
3306901-3307001 usb_power_delivery: sym: "0xA" "A"
3307001-3307103 usb_power_delivery: sym: "0xB" "B"
3307103-3307203 usb_power_delivery: sym: "0x5" "5"
3306403-3307203 usb_power_delivery: crc: "CRC:5ba71df0" "CRC"
3307203-3307303 usb_power_delivery: sym: "EOP" "#"
3307203-3307303 usb_power_delivery: eop: "EOP" "E"
3303527-3307303 usb_power_delivery: text: "#78   (550.587833ms): (r2) SNK[0]: VDM - [1] REQ Disc Ident  SVID:ff00" "..."
3314186-3315462 usb_power_delivery: preamble: "Preamble" "..."
3315462-3315560 usb_power_delivery: sym: "SYNC-1" "S1"
3315560-3315662 usb_power_delivery: sym: "SYNC-1" "S1"
3315662-3315760 usb_power_delivery: sym: "SYNC-3" "S3"
3315760-3315861 usb_power_delivery: sym: "SYNC-3" "S3"
3315462-3315861 usb_power_delivery: sop: "SOP'" "S"
3315861-3315960 usb_power_delivery: sym: "0xF" "F"
3315960-3316061 usb_power_delivery: sym: "0x4" "4"
3316061-3316160 usb_power_delivery: sym: "0x0" "0"
3316160-3316262 usb_power_delivery: sym: "0x1" "1"
3315861-3316262 usb_power_delivery: header: "H:104f" "HD"
3314186-3317980 usb_power_delivery: snk: "(r2) SNK[0]: VDM" "VDM"
3316262-3316360 usb_power_delivery: sym: "0x1" "1"
3316360-3316462 usb_power_delivery: sym: "0x0" "0"
3316462-3316560 usb_power_delivery: sym: "0x0" "0"
3316560-3316662 usb_power_delivery: sym: "0x8" "8"
3316662-3316760 usb_power_delivery: sym: "0x0" "0"
3316760-3316862 usb_power_delivery: sym: "0x0" "0"
3316862-3316960 usb_power_delivery: sym: "0xF" "F"
3316960-3317062 usb_power_delivery: sym: "0xF" "F"
3316262-3317062 usb_power_delivery: data: "[0]ff008001" "D0"
3316262-3317062 usb_power_delivery: payload: "[1] REQ Disc Ident  SVID:ff00" "[1] REQ Disc Ident  SVID:ff00"
3317062-3317160 usb_power_delivery: sym: "0x0" "0"
3317160-3317262 usb_power_delivery: sym: "0xF" "F"
3317262-3317360 usb_power_delivery: sym: "0xD" "D"
3317360-3317462 usb_power_delivery: sym: "0x1" "1"
3317462-3317560 usb_power_delivery: sym: "0x7" "7"
3317560-3317660 usb_power_delivery: sym: "0xA" "A"
3317660-3317762 usb_power_delivery: sym: "0xB" "B"
3317762-3317862 usb_power_delivery: sym: "0x5" "5"
3317062-3317862 usb_power_delivery: crc: "CRC:5ba71df0" "CRC"
3317862-3317962 usb_power_delivery: sym: "EOP" "#"
3317862-3317962 usb_power_delivery: eop: "EOP" "E"
3314186-3317962 usb_power_delivery: text: "#79   (552.364333ms): (r2) SNK[0]: VDM - [1] REQ Disc Ident  SVID:ff00" "..."
3324857-3326133 usb_power_delivery: preamble: "Preamble" "..."
3326133-3326231 usb_power_delivery: sym: "SYNC-1" "S1"
3326231-3326333 usb_power_delivery: sym: "SYNC-1" "S1"
3326333-3326431 usb_power_delivery: sym: "SYNC-3" "S3"
3326431-3326533 usb_power_delivery: sym: "SYNC-3" "S3"
3326133-3326533 usb_power_delivery: sop: "SOP'" "S"
3326533-3326631 usb_power_delivery: sym: "0xF" "F"
3326631-3326733 usb_power_delivery: sym: "0x4" "4"
3326733-3326831 usb_power_delivery: sym: "0x0" "0"
3326831-3326933 usb_power_delivery: sym: "0x1" "1"
3326533-3326933 usb_power_delivery: header: "H:104f" "HD"
3324857-3328651 usb_power_delivery: snk: "(r2) SNK[0]: VDM" "VDM"
3326933-3327031 usb_power_delivery: sym: "0x1" "1"
3327031-3327133 usb_power_delivery: sym: "0x0" "0"
3327133-3327231 usb_power_delivery: sym: "0x0" "0"
3327231-3327333 usb_power_delivery: sym: "0x8" "8"
3327333-3327431 usb_power_delivery: sym: "0x0" "0"
3327431-3327533 usb_power_delivery: sym: "0x0" "0"
3327533-3327631 usb_power_delivery: sym: "0xF" "F"
3327631-3327733 usb_power_delivery: sym: "0xF" "F"
3326933-3327733 usb_power_delivery: data: "[0]ff008001" "D0"
3326933-3327733 usb_power_delivery: payload: "[1] REQ Disc Ident  SVID:ff00" "[1] REQ Disc Ident  SVID:ff00"
3327733-3327831 usb_power_delivery: sym: "0x0" "0"
3327831-3327933 usb_power_delivery: sym: "0xF" "F"
3327933-3328031 usb_power_delivery: sym: "0xD" "D"
3328031-3328133 usb_power_delivery: sym: "0x1" "1"
3328133-3328231 usb_power_delivery: sym: "0x7" "7"
3328231-3328331 usb_power_delivery: sym: "0xA" "A"
3328331-3328433 usb_power_delivery: sym: "0xB" "B"
3328433-3328533 usb_power_delivery: sym: "0x5" "5"
3327733-3328533 usb_power_delivery: crc: "CRC:5ba71df0" "CRC"
3328533-3328633 usb_power_delivery: sym: "EOP" "#"
3328533-3328633 usb_power_delivery: eop: "EOP" "E"
3324857-3328633 usb_power_delivery: text: "#80   (554.142833ms): (r2) SNK[0]: VDM - [1] REQ Disc Ident  SVID:ff00" "..."
3336034-3337310 usb_power_delivery: preamble: "Preamble" "..."
3337310-3337408 usb_power_delivery: sym: "SYNC-1" "S1"
3337408-3337510 usb_power_delivery: sym: "SYNC-1" "S1"
3337510-3337608 usb_power_delivery: sym: "SYNC-3" "S3"
3337608-3337710 usb_power_delivery: sym: "SYNC-3" "S3"
3337310-3337710 usb_power_delivery: sop: "SOP'" "S"
3337710-3337808 usb_power_delivery: sym: "0xF" "F"
3337808-3337910 usb_power_delivery: sym: "0x4" "4"
3337910-3338008 usb_power_delivery: sym: "0x0" "0"
3338008-3338110 usb_power_delivery: sym: "0x1" "1"
3337710-3338110 usb_power_delivery: header: "H:104f" "HD"
3336034-3339828 usb_power_delivery: snk: "(r2) SNK[0]: VDM" "VDM"
3338110-3338208 usb_power_delivery: sym: "0x1" "1"
3338208-3338310 usb_power_delivery: sym: "0x0" "0"
3338310-3338408 usb_power_delivery: sym: "0x0" "0"
3338408-3338510 usb_power_delivery: sym: "0x8" "8"
3338510-3338608 usb_power_delivery: sym: "0x0" "0"
3338608-3338710 usb_power_delivery: sym: "0x0" "0"
3338710-3338808 usb_power_delivery: sym: "0xF" "F"
3338808-3338910 usb_power_delivery: sym: "0xF" "F"
3338110-3338910 usb_power_delivery: data: "[0]ff008001" "D0"
3338110-3338910 usb_power_delivery: payload: "[1] REQ Disc Ident  SVID:ff00" "[1] REQ Disc Ident  SVID:ff00"
3338910-3339008 usb_power_delivery: sym: "0x0" "0"
3339008-3339110 usb_power_delivery: sym: "0xF" "F"
3339110-3339208 usb_power_delivery: sym: "0xD" "D"
3339208-3339310 usb_power_delivery: sym: "0x1" "1"
3339310-3339408 usb_power_delivery: sym: "0x7" "7"
3339408-3339508 usb_power_delivery: sym: "0xA" "A"
3339508-3339610 usb_power_delivery: sym: "0xB" "B"
3339610-3339710 usb_power_delivery: sym: "0x5" "5"
3338910-3339710 usb_power_delivery: crc: "CRC:5ba71df0" "CRC"
3339710-3339810 usb_power_delivery: sym: "EOP" "#"
3339710-3339810 usb_power_delivery: eop: "EOP" "E"
3336034-3339810 usb_power_delivery: text: "#81   (556.005667ms): (r2) SNK[0]: VDM - [1] REQ Disc Ident  SVID:ff00" "..."
3346693-3347969 usb_power_delivery: preamble: "Preamble" "..."
3347969-3348067 usb_power_delivery: sym: "SYNC-1" "S1"
3348067-3348169 usb_power_delivery: sym: "SYNC-1" "S1"
3348169-3348267 usb_power_delivery: sym: "SYNC-3" "S3"
3348267-3348369 usb_power_delivery: sym: "SYNC-3" "S3"
3347969-3348369 usb_power_delivery: sop: "SOP'" "S"
3348369-3348467 usb_power_delivery: sym: "0xF" "F"
3348467-3348569 usb_power_delivery: sym: "0x4" "4"
3348569-3348667 usb_power_delivery: sym: "0x0" "0"
3348667-3348769 usb_power_delivery: sym: "0x1" "1"
3348369-3348769 usb_power_delivery: header: "H:104f" "HD"
3346693-3350487 usb_power_delivery: snk: "(r2) SNK[0]: VDM" "VDM"
3348769-3348867 usb_power_delivery: sym: "0x1" "1"
3348867-3348969 usb_power_delivery: sym: "0x0" "0"
3348969-3349067 usb_power_delivery: sym: "0x0" "0"
3349067-3349169 usb_power_delivery: sym: "0x8" "8"
3349169-3349267 usb_power_delivery: sym: "0x0" "0"
3349267-3349369 usb_power_delivery: sym: "0x0" "0"
3349369-3349467 usb_power_delivery: sym: "0xF" "F"
3349467-3349569 usb_power_delivery: sym: "0xF" "F"
3348769-3349569 usb_power_delivery: data: "[0]ff008001" "D0"
3348769-3349569 usb_power_delivery: payload: "[1] REQ Disc Ident  SVID:ff00" "[1] REQ Disc Ident  SVID:ff00"
3349569-3349667 usb_power_delivery: sym: "0x0" "0"
3349667-3349769 usb_power_delivery: sym: "0xF" "F"
3349769-3349867 usb_power_delivery: sym: "0xD" "D"
3349867-3349969 usb_power_delivery: sym: "0x1" "1"
3349969-3350067 usb_power_delivery: sym: "0x7" "7"
3350067-3350167 usb_power_delivery: sym: "0xA" "A"
3350167-3350269 usb_power_delivery: sym: "0xB" "B"
3350269-3350369 usb_power_delivery: sym: "0x5" "5"
3349569-3350369 usb_power_delivery: crc: "CRC:5ba71df0" "CRC"
3350369-3350469 usb_power_delivery: sym: "EOP" "#"
3350369-3350469 usb_power_delivery: eop: "EOP" "E"
3346693-3350469 usb_power_delivery: text: "#82   (557.782167ms): (r2) SNK[0]: VDM - [1] REQ Disc Ident  SVID:ff00" "..."
3357352-3358627 usb_power_delivery: preamble: "Preamble" "..."
3358627-3358726 usb_power_delivery: sym: "SYNC-1" "S1"
3358726-3358827 usb_power_delivery: sym: "SYNC-1" "S1"
3358827-3358926 usb_power_delivery: sym: "SYNC-3" "S3"
3358926-3359027 usb_power_delivery: sym: "SYNC-3" "S3"
3358627-3359027 usb_power_delivery: sop: "SOP'" "S"
3359027-3359126 usb_power_delivery: sym: "0xF" "F"
3359126-3359227 usb_power_delivery: sym: "0x4" "4"
3359227-3359326 usb_power_delivery: sym: "0x0" "0"
3359326-3359427 usb_power_delivery: sym: "0x1" "1"
3359027-3359427 usb_power_delivery: header: "H:104f" "HD"
3357352-3361146 usb_power_delivery: snk: "(r2) SNK[0]: VDM" "VDM"
3359427-3359526 usb_power_delivery: sym: "0x1" "1"
3359526-3359627 usb_power_delivery: sym: "0x0" "0"
3359627-3359726 usb_power_delivery: sym: "0x0" "0"
3359726-3359828 usb_power_delivery: sym: "0x8" "8"
3359828-3359926 usb_power_delivery: sym: "0x0" "0"
3359926-3360027 usb_power_delivery: sym: "0x0" "0"
3360027-3360126 usb_power_delivery: sym: "0xF" "F"
3360126-3360227 usb_power_delivery: sym: "0xF" "F"
3359427-3360227 usb_power_delivery: data: "[0]ff008001" "D0"
3359427-3360227 usb_power_delivery: payload: "[1] REQ Disc Ident  SVID:ff00" "[1] REQ Disc Ident  SVID:ff00"
3360227-3360326 usb_power_delivery: sym: "0x0" "0"
3360326-3360427 usb_power_delivery: sym: "0xF" "F"
3360427-3360526 usb_power_delivery: sym: "0xD" "D"
3360526-3360628 usb_power_delivery: sym: "0x1" "1"
3360628-3360726 usb_power_delivery: sym: "0x7" "7"
3360726-3360826 usb_power_delivery: sym: "0xA" "A"
3360826-3360927 usb_power_delivery: sym: "0xB" "B"
3360927-3361027 usb_power_delivery: sym: "0x5" "5"
3360227-3361027 usb_power_delivery: crc: "CRC:5ba71df0" "CRC"
3361027-3361128 usb_power_delivery: sym: "EOP" "#"
3361027-3361128 usb_power_delivery: eop: "EOP" "E"
3357352-3361128 usb_power_delivery: text: "#83   (559.558667ms): (r2) SNK[0]: VDM - [1] REQ Disc Ident  SVID:ff00" "..."
3368011-3369286 usb_power_delivery: preamble: "Preamble" "..."
3369286-3369384 usb_power_delivery: sym: "SYNC-1" "S1"
3369384-3369486 usb_power_delivery: sym: "SYNC-1" "S1"
3369486-3369584 usb_power_delivery: sym: "SYNC-3" "S3"
3369584-3369686 usb_power_delivery: sym: "SYNC-3" "S3"
3369286-3369686 usb_power_delivery: sop: "SOP'" "S"
3369686-3369784 usb_power_delivery: sym: "0xF" "F"
3369784-3369886 usb_power_delivery: sym: "0x4" "4"
3369886-3369984 usb_power_delivery: sym: "0x0" "0"
3369984-3370086 usb_power_delivery: sym: "0x1" "1"
3369686-3370086 usb_power_delivery: header: "H:104f" "HD"
3368011-3371805 usb_power_delivery: snk: "(r2) SNK[0]: VDM" "VDM"
3370086-3370184 usb_power_delivery: sym: "0x1" "1"
3370184-3370286 usb_power_delivery: sym: "0x0" "0"
3370286-3370384 usb_power_delivery: sym: "0x0" "0"
3370384-3370486 usb_power_delivery: sym: "0x8" "8"
3370486-3370584 usb_power_delivery: sym: "0x0" "0"
3370584-3370686 usb_power_delivery: sym: "0x0" "0"
3370686-3370784 usb_power_delivery: sym: "0xF" "F"
3370784-3370886 usb_power_delivery: sym: "0xF" "F"
3370086-3370886 usb_power_delivery: data: "[0]ff008001" "D0"
3370086-3370886 usb_power_delivery: payload: "[1] REQ Disc Ident  SVID:ff00" "[1] REQ Disc Ident  SVID:ff00"
3370886-3370984 usb_power_delivery: sym: "0x0" "0"
3370984-3371086 usb_power_delivery: sym: "0xF" "F"
3371086-3371184 usb_power_delivery: sym: "0xD" "D"
3371184-3371286 usb_power_delivery: sym: "0x1" "1"
3371286-3371384 usb_power_delivery: sym: "0x7" "7"
3371384-3371484 usb_power_delivery: sym: "0xA" "A"
3371484-3371586 usb_power_delivery: sym: "0xB" "B"
3371586-3371686 usb_power_delivery: sym: "0x5" "5"
3370886-3371686 usb_power_delivery: crc: "CRC:5ba71df0" "CRC"
3371686-3371786 usb_power_delivery: sym: "EOP" "#"
3371686-3371786 usb_power_delivery: eop: "EOP" "E"
3368011-3371786 usb_power_delivery: text: "#84   (561.335167ms): (r2) SNK[0]: VDM - [1] REQ Disc Ident  SVID:ff00" "..."
3379188-3380463 usb_power_delivery: preamble: "Preamble" "..."
3380463-3380562 usb_power_delivery: sym: "SYNC-1" "S1"
3380562-3380663 usb_power_delivery: sym: "SYNC-1" "S1"
3380663-3380762 usb_power_delivery: sym: "SYNC-3" "S3"
3380762-3380863 usb_power_delivery: sym: "SYNC-3" "S3"
3380463-3380863 usb_power_delivery: sop: "SOP'" "S"
3380863-3380962 usb_power_delivery: sym: "0xF" "F"
3380962-3381063 usb_power_delivery: sym: "0x4" "4"
3381063-3381162 usb_power_delivery: sym: "0x0" "0"
3381162-3381263 usb_power_delivery: sym: "0x1" "1"
3380863-3381263 usb_power_delivery: header: "H:104f" "HD"
3379188-3382982 usb_power_delivery: snk: "(r2) SNK[0]: VDM" "VDM"
3381263-3381362 usb_power_delivery: sym: "0x1" "1"
3381362-3381463 usb_power_delivery: sym: "0x0" "0"
3381463-3381562 usb_power_delivery: sym: "0x0" "0"
3381562-3381663 usb_power_delivery: sym: "0x8" "8"
3381663-3381762 usb_power_delivery: sym: "0x0" "0"
3381762-3381863 usb_power_delivery: sym: "0x0" "0"
3381863-3381962 usb_power_delivery: sym: "0xF" "F"
3381962-3382063 usb_power_delivery: sym: "0xF" "F"
3381263-3382063 usb_power_delivery: data: "[0]ff008001" "D0"
3381263-3382063 usb_power_delivery: payload: "[1] REQ Disc Ident  SVID:ff00" "[1] REQ Disc Ident  SVID:ff00"
3382063-3382162 usb_power_delivery: sym: "0x0" "0"
3382162-3382263 usb_power_delivery: sym: "0xF" "F"
3382263-3382362 usb_power_delivery: sym: "0xD" "D"
3382362-3382463 usb_power_delivery: sym: "0x1" "1"
3382463-3382562 usb_power_delivery: sym: "0x7" "7"
3382562-3382662 usb_power_delivery: sym: "0xA" "A"
3382662-3382763 usb_power_delivery: sym: "0xB" "B"
3382763-3382863 usb_power_delivery: sym: "0x5" "5"
3382063-3382863 usb_power_delivery: crc: "CRC:5ba71df0" "CRC"
3382863-3382963 usb_power_delivery: sym: "EOP" "#"
3382863-3382963 usb_power_delivery: eop: "EOP" "E"
3379188-3382963 usb_power_delivery: text: "#85   (563.198000ms): (r2) SNK[0]: VDM - [1] REQ Disc Ident  SVID:ff00" "..."
3389847-3391122 usb_power_delivery: preamble: "Preamble" "..."
3391122-3391220 usb_power_delivery: sym: "SYNC-1" "S1"
3391220-3391322 usb_power_delivery: sym: "SYNC-1" "S1"
3391322-3391420 usb_power_delivery: sym: "SYNC-3" "S3"
3391420-3391522 usb_power_delivery: sym: "SYNC-3" "S3"
3391122-3391522 usb_power_delivery: sop: "SOP'" "S"
3391522-3391620 usb_power_delivery: sym: "0xF" "F"
3391620-3391722 usb_power_delivery: sym: "0x4" "4"
3391722-3391820 usb_power_delivery: sym: "0x0" "0"
3391820-3391922 usb_power_delivery: sym: "0x1" "1"
3391522-3391922 usb_power_delivery: header: "H:104f" "HD"
3389847-3393640 usb_power_delivery: snk: "(r2) SNK[0]: VDM" "VDM"
3391922-3392020 usb_power_delivery: sym: "0x1" "1"
3392020-3392122 usb_power_delivery: sym: "0x0" "0"
3392122-3392220 usb_power_delivery: sym: "0x0" "0"
3392220-3392322 usb_power_delivery: sym: "0x8" "8"
3392322-3392420 usb_power_delivery: sym: "0x0" "0"
3392420-3392522 usb_power_delivery: sym: "0x0" "0"
3392522-3392620 usb_power_delivery: sym: "0xF" "F"
3392620-3392722 usb_power_delivery: sym: "0xF" "F"
3391922-3392722 usb_power_delivery: data: "[0]ff008001" "D0"
3391922-3392722 usb_power_delivery: payload: "[1] REQ Disc Ident  SVID:ff00" "[1] REQ Disc Ident  SVID:ff00"
3392722-3392820 usb_power_delivery: sym: "0x0" "0"
3392820-3392922 usb_power_delivery: sym: "0xF" "F"
3392922-3393020 usb_power_delivery: sym: "0xD" "D"
3393020-3393122 usb_power_delivery: sym: "0x1" "1"
3393122-3393220 usb_power_delivery: sym: "0x7" "7"
3393220-3393320 usb_power_delivery: sym: "0xA" "A"
3393320-3393422 usb_power_delivery: sym: "0xB" "B"
3393422-3393522 usb_power_delivery: sym: "0x5" "5"
3392722-3393522 usb_power_delivery: crc: "CRC:5ba71df0" "CRC"
3393522-3393622 usb_power_delivery: sym: "EOP" "#"
3393522-3393622 usb_power_delivery: eop: "EOP" "E"
3389847-3393622 usb_power_delivery: text: "#86   (564.974500ms): (r2) SNK[0]: VDM - [1] REQ Disc Ident  SVID:ff00" "..."
3400505-3401781 usb_power_delivery: preamble: "Preamble" "..."
3401781-3401879 usb_power_delivery: sym: "SYNC-1" "S1"
3401879-3401981 usb_power_delivery: sym: "SYNC-1" "S1"
3401981-3402079 usb_power_delivery: sym: "SYNC-3" "S3"
3402079-3402181 usb_power_delivery: sym: "SYNC-3" "S3"
3401781-3402181 usb_power_delivery: sop: "SOP'" "S"
3402181-3402279 usb_power_delivery: sym: "0xF" "F"
3402279-3402381 usb_power_delivery: sym: "0x4" "4"
3402381-3402479 usb_power_delivery: sym: "0x0" "0"
3402479-3402581 usb_power_delivery: sym: "0x1" "1"
3402181-3402581 usb_power_delivery: header: "H:104f" "HD"
3400505-3404299 usb_power_delivery: snk: "(r2) SNK[0]: VDM" "VDM"
3402581-3402679 usb_power_delivery: sym: "0x1" "1"
3402679-3402781 usb_power_delivery: sym: "0x0" "0"
3402781-3402879 usb_power_delivery: sym: "0x0" "0"
3402879-3402981 usb_power_delivery: sym: "0x8" "8"
3402981-3403079 usb_power_delivery: sym: "0x0" "0"
3403079-3403181 usb_power_delivery: sym: "0x0" "0"
3403181-3403279 usb_power_delivery: sym: "0xF" "F"
3403279-3403381 usb_power_delivery: sym: "0xF" "F"
3402581-3403381 usb_power_delivery: data: "[0]ff008001" "D0"
3402581-3403381 usb_power_delivery: payload: "[1] REQ Disc Ident  SVID:ff00" "[1] REQ Disc Ident  SVID:ff00"
3403381-3403479 usb_power_delivery: sym: "0x0" "0"
3403479-3403581 usb_power_delivery: sym: "0xF" "F"
3403581-3403679 usb_power_delivery: sym: "0xD" "D"
3403679-3403781 usb_power_delivery: sym: "0x1" "1"
3403781-3403879 usb_power_delivery: sym: "0x7" "7"
3403879-3403979 usb_power_delivery: sym: "0xA" "A"
3403979-3404081 usb_power_delivery: sym: "0xB" "B"
3404081-3404181 usb_power_delivery: sym: "0x5" "5"
3403381-3404181 usb_power_delivery: crc: "CRC:5ba71df0" "CRC"
3404181-3404281 usb_power_delivery: sym: "EOP" "#"
3404181-3404281 usb_power_delivery: eop: "EOP" "E"
3400505-3404281 usb_power_delivery: text: "#87   (566.750833ms): (r2) SNK[0]: VDM - [1] REQ Disc Ident  SVID:ff00" "..."
3411164-3412439 usb_power_delivery: preamble: "Preamble" "..."
3412439-3412537 usb_power_delivery: sym: "SYNC-1" "S1"
3412537-3412639 usb_power_delivery: sym: "SYNC-1" "S1"
3412639-3412737 usb_power_delivery: sym: "SYNC-3" "S3"
3412737-3412839 usb_power_delivery: sym: "SYNC-3" "S3"
3412439-3412839 usb_power_delivery: sop: "SOP'" "S"
3412839-3412937 usb_power_delivery: sym: "0xF" "F"
3412937-3413039 usb_power_delivery: sym: "0x4" "4"
3413039-3413137 usb_power_delivery: sym: "0x0" "0"
3413137-3413239 usb_power_delivery: sym: "0x1" "1"
3412839-3413239 usb_power_delivery: header: "H:104f" "HD"
3411164-3414958 usb_power_delivery: snk: "(r2) SNK[0]: VDM" "VDM"
3413239-3413337 usb_power_delivery: sym: "0x1" "1"
3413337-3413439 usb_power_delivery: sym: "0x0" "0"
3413439-3413537 usb_power_delivery: sym: "0x0" "0"
3413537-3413639 usb_power_delivery: sym: "0x8" "8"
3413639-3413738 usb_power_delivery: sym: "0x0" "0"
3413738-3413839 usb_power_delivery: sym: "0x0" "0"
3413839-3413938 usb_power_delivery: sym: "0xF" "F"
3413938-3414039 usb_power_delivery: sym: "0xF" "F"
3413239-3414039 usb_power_delivery: data: "[0]ff008001" "D0"
3413239-3414039 usb_power_delivery: payload: "[1] REQ Disc Ident  SVID:ff00" "[1] REQ Disc Ident  SVID:ff00"
3414039-3414138 usb_power_delivery: sym: "0x0" "0"
3414138-3414239 usb_power_delivery: sym: "0xF" "F"
3414239-3414338 usb_power_delivery: sym: "0xD" "D"
3414338-3414439 usb_power_delivery: sym: "0x1" "1"
3414439-3414538 usb_power_delivery: sym: "0x7" "7"
3414538-3414638 usb_power_delivery: sym: "0xA" "A"
3414638-3414739 usb_power_delivery: sym: "0xB" "B"
3414739-3414839 usb_power_delivery: sym: "0x5" "5"
3414039-3414839 usb_power_delivery: crc: "CRC:5ba71df0" "CRC"
3414839-3414939 usb_power_delivery: sym: "EOP" "#"
3414839-3414939 usb_power_delivery: eop: "EOP" "E"
3411164-3414939 usb_power_delivery: text: "#88   (568.527333ms): (r2) SNK[0]: VDM - [1] REQ Disc Ident  SVID:ff00" "..."
3422341-3423616 usb_power_delivery: preamble: "Preamble" "..."
3423616-3423715 usb_power_delivery: sym: "SYNC-1" "S1"
3423715-3423816 usb_power_delivery: sym: "SYNC-1" "S1"
3423816-3423915 usb_power_delivery: sym: "SYNC-3" "S3"
3423915-3424016 usb_power_delivery: sym: "SYNC-3" "S3"
3423616-3424016 usb_power_delivery: sop: "SOP'" "S"
3424016-3424115 usb_power_delivery: sym: "0xF" "F"
3424115-3424216 usb_power_delivery: sym: "0x4" "4"
3424216-3424315 usb_power_delivery: sym: "0x0" "0"
3424315-3424416 usb_power_delivery: sym: "0x1" "1"
3424016-3424416 usb_power_delivery: header: "H:104f" "HD"
3422341-3426135 usb_power_delivery: snk: "(r2) SNK[0]: VDM" "VDM"
3424416-3424515 usb_power_delivery: sym: "0x1" "1"
3424515-3424616 usb_power_delivery: sym: "0x0" "0"
3424616-3424715 usb_power_delivery: sym: "0x0" "0"
3424715-3424816 usb_power_delivery: sym: "0x8" "8"
3424816-3424915 usb_power_delivery: sym: "0x0" "0"
3424915-3425016 usb_power_delivery: sym: "0x0" "0"
3425016-3425115 usb_power_delivery: sym: "0xF" "F"
3425115-3425217 usb_power_delivery: sym: "0xF" "F"
3424416-3425217 usb_power_delivery: data: "[0]ff008001" "D0"
3424416-3425217 usb_power_delivery: payload: "[1] REQ Disc Ident  SVID:ff00" "[1] REQ Disc Ident  SVID:ff00"
3425217-3425315 usb_power_delivery: sym: "0x0" "0"
3425315-3425416 usb_power_delivery: sym: "0xF" "F"
3425416-3425515 usb_power_delivery: sym: "0xD" "D"
3425515-3425616 usb_power_delivery: sym: "0x1" "1"
3425616-3425715 usb_power_delivery: sym: "0x7" "7"
3425715-3425815 usb_power_delivery: sym: "0xA" "A"
3425815-3425917 usb_power_delivery: sym: "0xB" "B"
3425917-3426017 usb_power_delivery: sym: "0x5" "5"
3425217-3426017 usb_power_delivery: crc: "CRC:5ba71df0" "CRC"
3426017-3426117 usb_power_delivery: sym: "EOP" "#"
3426017-3426117 usb_power_delivery: eop: "EOP" "E"
3422341-3426117 usb_power_delivery: text: "#89   (570.390167ms): (r2) SNK[0]: VDM - [1] REQ Disc Ident  SVID:ff00" "..."
3433000-3434275 usb_power_delivery: preamble: "Preamble" "..."
3434275-3434373 usb_power_delivery: sym: "SYNC-1" "S1"
3434373-3434475 usb_power_delivery: sym: "SYNC-1" "S1"
3434475-3434573 usb_power_delivery: sym: "SYNC-3" "S3"
3434573-3434675 usb_power_delivery: sym: "SYNC-3" "S3"
3434275-3434675 usb_power_delivery: sop: "SOP'" "S"
3434675-3434773 usb_power_delivery: sym: "0xF" "F"
3434773-3434875 usb_power_delivery: sym: "0x4" "4"
3434875-3434973 usb_power_delivery: sym: "0x0" "0"
3434973-3435075 usb_power_delivery: sym: "0x1" "1"
3434675-3435075 usb_power_delivery: header: "H:104f" "HD"
3433000-3436793 usb_power_delivery: snk: "(r2) SNK[0]: VDM" "VDM"
3435075-3435173 usb_power_delivery: sym: "0x1" "1"
3435173-3435275 usb_power_delivery: sym: "0x0" "0"
3435275-3435373 usb_power_delivery: sym: "0x0" "0"
3435373-3435475 usb_power_delivery: sym: "0x8" "8"
3435475-3435573 usb_power_delivery: sym: "0x0" "0"
3435573-3435675 usb_power_delivery: sym: "0x0" "0"
3435675-3435773 usb_power_delivery: sym: "0xF" "F"
3435773-3435875 usb_power_delivery: sym: "0xF" "F"
3435075-3435875 usb_power_delivery: data: "[0]ff008001" "D0"
3435075-3435875 usb_power_delivery: payload: "[1] REQ Disc Ident  SVID:ff00" "[1] REQ Disc Ident  SVID:ff00"
3435875-3435973 usb_power_delivery: sym: "0x0" "0"
3435973-3436075 usb_power_delivery: sym: "0xF" "F"
3436075-3436173 usb_power_delivery: sym: "0xD" "D"
3436173-3436275 usb_power_delivery: sym: "0x1" "1"
3436275-3436373 usb_power_delivery: sym: "0x7" "7"
3436373-3436473 usb_power_delivery: sym: "0xA" "A"
3436473-3436575 usb_power_delivery: sym: "0xB" "B"
3436575-3436675 usb_power_delivery: sym: "0x5" "5"
3435875-3436675 usb_power_delivery: crc: "CRC:5ba71df0" "CRC"
3436675-3436775 usb_power_delivery: sym: "EOP" "#"
3436675-3436775 usb_power_delivery: eop: "EOP" "E"
3433000-3436775 usb_power_delivery: text: "#90   (572.166667ms): (r2) SNK[0]: VDM - [1] REQ Disc Ident  SVID:ff00" "..."
3443658-3444934 usb_power_delivery: preamble: "Preamble" "..."
3444934-3445032 usb_power_delivery: sym: "SYNC-1" "S1"
3445032-3445134 usb_power_delivery: sym: "SYNC-1" "S1"
3445134-3445232 usb_power_delivery: sym: "SYNC-3" "S3"
3445232-3445334 usb_power_delivery: sym: "SYNC-3" "S3"
3444934-3445334 usb_power_delivery: sop: "SOP'" "S"
3445334-3445432 usb_power_delivery: sym: "0xF" "F"
3445432-3445534 usb_power_delivery: sym: "0x4" "4"
3445534-3445632 usb_power_delivery: sym: "0x0" "0"
3445632-3445734 usb_power_delivery: sym: "0x1" "1"
3445334-3445734 usb_power_delivery: header: "H:104f" "HD"
3443658-3447452 usb_power_delivery: snk: "(r2) SNK[0]: VDM" "VDM"
3445734-3445832 usb_power_delivery: sym: "0x1" "1"
3445832-3445934 usb_power_delivery: sym: "0x0" "0"
3445934-3446032 usb_power_delivery: sym: "0x0" "0"
3446032-3446134 usb_power_delivery: sym: "0x8" "8"
3446134-3446232 usb_power_delivery: sym: "0x0" "0"
3446232-3446334 usb_power_delivery: sym: "0x0" "0"
3446334-3446432 usb_power_delivery: sym: "0xF" "F"
3446432-3446534 usb_power_delivery: sym: "0xF" "F"
3445734-3446534 usb_power_delivery: data: "[0]ff008001" "D0"
3445734-3446534 usb_power_delivery: payload: "[1] REQ Disc Ident  SVID:ff00" "[1] REQ Disc Ident  SVID:ff00"
3446534-3446632 usb_power_delivery: sym: "0x0" "0"
3446632-3446734 usb_power_delivery: sym: "0xF" "F"
3446734-3446832 usb_power_delivery: sym: "0xD" "D"
3446832-3446934 usb_power_delivery: sym: "0x1" "1"
3446934-3447032 usb_power_delivery: sym: "0x7" "7"
3447032-3447132 usb_power_delivery: sym: "0xA" "A"
3447132-3447234 usb_power_delivery: sym: "0xB" "B"
3447234-3447334 usb_power_delivery: sym: "0x5" "5"
3446534-3447334 usb_power_delivery: crc: "CRC:5ba71df0" "CRC"
3447334-3447434 usb_power_delivery: sym: "EOP" "#"
3447334-3447434 usb_power_delivery: eop: "EOP" "E"
3443658-3447434 usb_power_delivery: text: "#91   (573.943000ms): (r2) SNK[0]: VDM - [1] REQ Disc Ident  SVID:ff00" "..."
3454317-3455592 usb_power_delivery: preamble: "Preamble" "..."
3455592-3455691 usb_power_delivery: sym: "SYNC-1" "S1"
3455691-3455792 usb_power_delivery: sym: "SYNC-1" "S1"
3455792-3455891 usb_power_delivery: sym: "SYNC-3" "S3"
3455891-3455992 usb_power_delivery: sym: "SYNC-3" "S3"
3455592-3455992 usb_power_delivery: sop: "SOP'" "S"
3455992-3456091 usb_power_delivery: sym: "0xF" "F"
3456091-3456193 usb_power_delivery: sym: "0x4" "4"
3456193-3456291 usb_power_delivery: sym: "0x0" "0"
3456291-3456392 usb_power_delivery: sym: "0x1" "1"
3455992-3456392 usb_power_delivery: header: "H:104f" "HD"
3454317-3458111 usb_power_delivery: snk: "(r2) SNK[0]: VDM" "VDM"
3456392-3456491 usb_power_delivery: sym: "0x1" "1"
3456491-3456592 usb_power_delivery: sym: "0x0" "0"
3456592-3456691 usb_power_delivery: sym: "0x0" "0"
3456691-3456793 usb_power_delivery: sym: "0x8" "8"
3456793-3456891 usb_power_delivery: sym: "0x0" "0"
3456891-3456993 usb_power_delivery: sym: "0x0" "0"
3456993-3457091 usb_power_delivery: sym: "0xF" "F"
3457091-3457193 usb_power_delivery: sym: "0xF" "F"
3456392-3457193 usb_power_delivery: data: "[0]ff008001" "D0"
3456392-3457193 usb_power_delivery: payload: "[1] REQ Disc Ident  SVID:ff00" "[1] REQ Disc Ident  SVID:ff00"
3457193-3457291 usb_power_delivery: sym: "0x0" "0"
3457291-3457393 usb_power_delivery: sym: "0xF" "F"
3457393-3457491 usb_power_delivery: sym: "0xD" "D"
3457491-3457593 usb_power_delivery: sym: "0x1" "1"
3457593-3457691 usb_power_delivery: sym: "0x7" "7"
3457691-3457791 usb_power_delivery: sym: "0xA" "A"
3457791-3457893 usb_power_delivery: sym: "0xB" "B"
3457893-3457993 usb_power_delivery: sym: "0x5" "5"
3457193-3457993 usb_power_delivery: crc: "CRC:5ba71df0" "CRC"
3457993-3458093 usb_power_delivery: sym: "EOP" "#"
3457993-3458093 usb_power_delivery: eop: "EOP" "E"
3454317-3458093 usb_power_delivery: text: "#92   (575.719500ms): (r2) SNK[0]: VDM - [1] REQ Disc Ident  SVID:ff00" "..."
3465494-3466770 usb_power_delivery: preamble: "Preamble" "..."
3466770-3466868 usb_power_delivery: sym: "SYNC-1" "S1"
3466868-3466970 usb_power_delivery: sym: "SYNC-1" "S1"
3466970-3467068 usb_power_delivery: sym: "SYNC-3" "S3"
3467068-3467170 usb_power_delivery: sym: "SYNC-3" "S3"
3466770-3467170 usb_power_delivery: sop: "SOP'" "S"
3467170-3467268 usb_power_delivery: sym: "0xF" "F"
3467268-3467370 usb_power_delivery: sym: "0x4" "4"
3467370-3467468 usb_power_delivery: sym: "0x0" "0"
3467468-3467570 usb_power_delivery: sym: "0x1" "1"
3467170-3467570 usb_power_delivery: header: "H:104f" "HD"
3465494-3469288 usb_power_delivery: snk: "(r2) SNK[0]: VDM" "VDM"
3467570-3467668 usb_power_delivery: sym: "0x1" "1"
3467668-3467770 usb_power_delivery: sym: "0x0" "0"
3467770-3467868 usb_power_delivery: sym: "0x0" "0"
3467868-3467970 usb_power_delivery: sym: "0x8" "8"
3467970-3468068 usb_power_delivery: sym: "0x0" "0"
3468068-3468170 usb_power_delivery: sym: "0x0" "0"
3468170-3468268 usb_power_delivery: sym: "0xF" "F"
3468268-3468370 usb_power_delivery: sym: "0xF" "F"
3467570-3468370 usb_power_delivery: data: "[0]ff008001" "D0"
3467570-3468370 usb_power_delivery: payload: "[1] REQ Disc Ident  SVID:ff00" "[1] REQ Disc Ident  SVID:ff00"
3468370-3468468 usb_power_delivery: sym: "0x0" "0"
3468468-3468570 usb_power_delivery: sym: "0xF" "F"
3468570-3468668 usb_power_delivery: sym: "0xD" "D"
3468668-3468770 usb_power_delivery: sym: "0x1" "1"
3468770-3468868 usb_power_delivery: sym: "0x7" "7"
3468868-3468968 usb_power_delivery: sym: "0xA" "A"
3468968-3469070 usb_power_delivery: sym: "0xB" "B"
3469070-3469170 usb_power_delivery: sym: "0x5" "5"
3468370-3469170 usb_power_delivery: crc: "CRC:5ba71df0" "CRC"
3469170-3469270 usb_power_delivery: sym: "EOP" "#"
3469170-3469270 usb_power_delivery: eop: "EOP" "E"
3465494-3469270 usb_power_delivery: text: "#93   (577.582333ms): (r2) SNK[0]: VDM - [1] REQ Disc Ident  SVID:ff00" "..."
3476153-3477428 usb_power_delivery: preamble: "Preamble" "..."
3477428-3477527 usb_power_delivery: sym: "SYNC-1" "S1"
3477527-3477628 usb_power_delivery: sym: "SYNC-1" "S1"
3477628-3477727 usb_power_delivery: sym: "SYNC-3" "S3"
3477727-3477828 usb_power_delivery: sym: "SYNC-3" "S3"
3477428-3477828 usb_power_delivery: sop: "SOP'" "S"
3477828-3477927 usb_power_delivery: sym: "0xF" "F"
3477927-3478028 usb_power_delivery: sym: "0x4" "4"
3478028-3478127 usb_power_delivery: sym: "0x0" "0"
3478127-3478228 usb_power_delivery: sym: "0x1" "1"
3477828-3478228 usb_power_delivery: header: "H:104f" "HD"
3476153-3479947 usb_power_delivery: snk: "(r2) SNK[0]: VDM" "VDM"
3478228-3478327 usb_power_delivery: sym: "0x1" "1"
3478327-3478428 usb_power_delivery: sym: "0x0" "0"
3478428-3478527 usb_power_delivery: sym: "0x0" "0"
3478527-3478628 usb_power_delivery: sym: "0x8" "8"
3478628-3478727 usb_power_delivery: sym: "0x0" "0"
3478727-3478828 usb_power_delivery: sym: "0x0" "0"
3478828-3478927 usb_power_delivery: sym: "0xF" "F"
3478927-3479028 usb_power_delivery: sym: "0xF" "F"
3478228-3479028 usb_power_delivery: data: "[0]ff008001" "D0"
3478228-3479028 usb_power_delivery: payload: "[1] REQ Disc Ident  SVID:ff00" "[1] REQ Disc Ident  SVID:ff00"
3479028-3479127 usb_power_delivery: sym: "0x0" "0"
3479127-3479228 usb_power_delivery: sym: "0xF" "F"
3479228-3479327 usb_power_delivery: sym: "0xD" "D"
3479327-3479429 usb_power_delivery: sym: "0x1" "1"
3479429-3479527 usb_power_delivery: sym: "0x7" "7"
3479527-3479627 usb_power_delivery: sym: "0xA" "A"
3479627-3479728 usb_power_delivery: sym: "0xB" "B"
3479728-3479828 usb_power_delivery: sym: "0x5" "5"
3479028-3479828 usb_power_delivery: crc: "CRC:5ba71df0" "CRC"
3479828-3479928 usb_power_delivery: sym: "EOP" "#"
3479828-3479928 usb_power_delivery: eop: "EOP" "E"
3476153-3479928 usb_power_delivery: text: "#94   (579.358833ms): (r2) SNK[0]: VDM - [1] REQ Disc Ident  SVID:ff00" "..."
3486812-3488087 usb_power_delivery: preamble: "Preamble" "..."
3488087-3488185 usb_power_delivery: sym: "SYNC-1" "S1"
3488185-3488287 usb_power_delivery: sym: "SYNC-1" "S1"
3488287-3488385 usb_power_delivery: sym: "SYNC-3" "S3"
3488385-3488487 usb_power_delivery: sym: "SYNC-3" "S3"
3488087-3488487 usb_power_delivery: sop: "SOP'" "S"
3488487-3488585 usb_power_delivery: sym: "0xF" "F"
3488585-3488687 usb_power_delivery: sym: "0x4" "4"
3488687-3488785 usb_power_delivery: sym: "0x0" "0"
3488785-3488887 usb_power_delivery: sym: "0x1" "1"
3488487-3488887 usb_power_delivery: header: "H:104f" "HD"
3486812-3490605 usb_power_delivery: snk: "(r2) SNK[0]: VDM" "VDM"
3488887-3488985 usb_power_delivery: sym: "0x1" "1"
3488985-3489087 usb_power_delivery: sym: "0x0" "0"
3489087-3489185 usb_power_delivery: sym: "0x0" "0"
3489185-3489287 usb_power_delivery: sym: "0x8" "8"
3489287-3489385 usb_power_delivery: sym: "0x0" "0"
3489385-3489487 usb_power_delivery: sym: "0x0" "0"
3489487-3489585 usb_power_delivery: sym: "0xF" "F"
3489585-3489687 usb_power_delivery: sym: "0xF" "F"
3488887-3489687 usb_power_delivery: data: "[0]ff008001" "D0"
3488887-3489687 usb_power_delivery: payload: "[1] REQ Disc Ident  SVID:ff00" "[1] REQ Disc Ident  SVID:ff00"
3489687-3489785 usb_power_delivery: sym: "0x0" "0"
3489785-3489887 usb_power_delivery: sym: "0xF" "F"
3489887-3489985 usb_power_delivery: sym: "0xD" "D"
3489985-3490087 usb_power_delivery: sym: "0x1" "1"
3490087-3490185 usb_power_delivery: sym: "0x7" "7"
3490185-3490285 usb_power_delivery: sym: "0xA" "A"
3490285-3490387 usb_power_delivery: sym: "0xB" "B"
3490387-3490487 usb_power_delivery: sym: "0x5" "5"
3489687-3490487 usb_power_delivery: crc: "CRC:5ba71df0" "CRC"
3490487-3490587 usb_power_delivery: sym: "EOP" "#"
3490487-3490587 usb_power_delivery: eop: "EOP" "E"
3486812-3490587 usb_power_delivery: text: "#95   (581.135333ms): (r2) SNK[0]: VDM - [1] REQ Disc Ident  SVID:ff00" "..."
3497466-3498742 usb_power_delivery: preamble: "Preamble" "..."
3498742-3498840 usb_power_delivery: sym: "SYNC-1" "S1"
3498840-3498942 usb_power_delivery: sym: "SYNC-1" "S1"
3498942-3499040 usb_power_delivery: sym: "SYNC-3" "S3"
3499040-3499142 usb_power_delivery: sym: "SYNC-3" "S3"
3498742-3499142 usb_power_delivery: sop: "SOP'" "S"
3499142-3499240 usb_power_delivery: sym: "0xF" "F"
3499240-3499342 usb_power_delivery: sym: "0x4" "4"
3499342-3499440 usb_power_delivery: sym: "0x0" "0"
3499440-3499542 usb_power_delivery: sym: "0x1" "1"
3499142-3499542 usb_power_delivery: header: "H:104f" "HD"
3497466-3501260 usb_power_delivery: snk: "(r2) SNK[0]: VDM" "VDM"
3499542-3499640 usb_power_delivery: sym: "0x1" "1"
3499640-3499742 usb_power_delivery: sym: "0x0" "0"
3499742-3499840 usb_power_delivery: sym: "0x0" "0"
3499840-3499942 usb_power_delivery: sym: "0x8" "8"
3499942-3500040 usb_power_delivery: sym: "0x0" "0"
3500040-3500142 usb_power_delivery: sym: "0x0" "0"
3500142-3500240 usb_power_delivery: sym: "0xF" "F"
3500240-3500342 usb_power_delivery: sym: "0xF" "F"
3499542-3500342 usb_power_delivery: data: "[0]ff008001" "D0"
3499542-3500342 usb_power_delivery: payload: "[1] REQ Disc Ident  SVID:ff00" "[1] REQ Disc Ident  SVID:ff00"
3500342-3500440 usb_power_delivery: sym: "0x0" "0"
3500440-3500542 usb_power_delivery: sym: "0xF" "F"
3500542-3500640 usb_power_delivery: sym: "0xD" "D"
3500640-3500742 usb_power_delivery: sym: "0x1" "1"
3500742-3500840 usb_power_delivery: sym: "0x7" "7"
3500840-3500940 usb_power_delivery: sym: "0xA" "A"
3500940-3501042 usb_power_delivery: sym: "0xB" "B"
3501042-3501142 usb_power_delivery: sym: "0x5" "5"
3500342-3501142 usb_power_delivery: crc: "CRC:5ba71df0" "CRC"
3501142-3501242 usb_power_delivery: sym: "EOP" "#"
3501142-3501242 usb_power_delivery: eop: "EOP" "E"
3497466-3501242 usb_power_delivery: text: "#96   (582.911000ms): (r2) SNK[0]: VDM - [1] REQ Disc Ident  SVID:ff00" "..."
3508643-3509919 usb_power_delivery: preamble: "Preamble" "..."
3509919-3510017 usb_power_delivery: sym: "SYNC-1" "S1"
3510017-3510119 usb_power_delivery: sym: "SYNC-1" "S1"
3510119-3510217 usb_power_delivery: sym: "SYNC-3" "S3"
3510217-3510319 usb_power_delivery: sym: "SYNC-3" "S3"
3509919-3510319 usb_power_delivery: sop: "SOP'" "S"
3510319-3510417 usb_power_delivery: sym: "0xF" "F"
3510417-3510519 usb_power_delivery: sym: "0x4" "4"
3510519-3510617 usb_power_delivery: sym: "0x0" "0"
3510617-3510719 usb_power_delivery: sym: "0x1" "1"
3510319-3510719 usb_power_delivery: header: "H:104f" "HD"
3508643-3512437 usb_power_delivery: snk: "(r2) SNK[0]: VDM" "VDM"
3510719-3510817 usb_power_delivery: sym: "0x1" "1"
3510817-3510919 usb_power_delivery: sym: "0x0" "0"
3510919-3511017 usb_power_delivery: sym: "0x0" "0"
3511017-3511119 usb_power_delivery: sym: "0x8" "8"
3511119-3511217 usb_power_delivery: sym: "0x0" "0"
3511217-3511319 usb_power_delivery: sym: "0x0" "0"
3511319-3511417 usb_power_delivery: sym: "0xF" "F"
3511417-3511519 usb_power_delivery: sym: "0xF" "F"
3510719-3511519 usb_power_delivery: data: "[0]ff008001" "D0"
3510719-3511519 usb_power_delivery: payload: "[1] REQ Disc Ident  SVID:ff00" "[1] REQ Disc Ident  SVID:ff00"
3511519-3511617 usb_power_delivery: sym: "0x0" "0"
3511617-3511719 usb_power_delivery: sym: "0xF" "F"
3511719-3511817 usb_power_delivery: sym: "0xD" "D"
3511817-3511919 usb_power_delivery: sym: "0x1" "1"
3511919-3512017 usb_power_delivery: sym: "0x7" "7"
3512017-3512117 usb_power_delivery: sym: "0xA" "A"
3512117-3512219 usb_power_delivery: sym: "0xB" "B"
3512219-3512319 usb_power_delivery: sym: "0x5" "5"
3511519-3512319 usb_power_delivery: crc: "CRC:5ba71df0" "CRC"
3512319-3512419 usb_power_delivery: sym: "EOP" "#"
3512319-3512419 usb_power_delivery: eop: "EOP" "E"
3508643-3512419 usb_power_delivery: text: "#97   (584.773833ms): (r2) SNK[0]: VDM - [1] REQ Disc Ident  SVID:ff00" "..."
3519317-3520592 usb_power_delivery: preamble: "Preamble" "..."
3520592-3520690 usb_power_delivery: sym: "SYNC-1" "S1"
3520690-3520792 usb_power_delivery: sym: "SYNC-1" "S1"
3520792-3520890 usb_power_delivery: sym: "SYNC-3" "S3"
3520890-3520992 usb_power_delivery: sym: "SYNC-3" "S3"
3520592-3520992 usb_power_delivery: sop: "SOP'" "S"
3520992-3521090 usb_power_delivery: sym: "0xF" "F"
3521090-3521192 usb_power_delivery: sym: "0x4" "4"
3521192-3521290 usb_power_delivery: sym: "0x0" "0"
3521290-3521392 usb_power_delivery: sym: "0x1" "1"
3520992-3521392 usb_power_delivery: header: "H:104f" "HD"
3519317-3523110 usb_power_delivery: snk: "(r2) SNK[0]: VDM" "VDM"
3521392-3521490 usb_power_delivery: sym: "0x1" "1"
3521490-3521592 usb_power_delivery: sym: "0x0" "0"
3521592-3521690 usb_power_delivery: sym: "0x0" "0"
3521690-3521792 usb_power_delivery: sym: "0x8" "8"
3521792-3521890 usb_power_delivery: sym: "0x0" "0"
3521890-3521992 usb_power_delivery: sym: "0x0" "0"
3521992-3522090 usb_power_delivery: sym: "0xF" "F"
3522090-3522192 usb_power_delivery: sym: "0xF" "F"
3521392-3522192 usb_power_delivery: data: "[0]ff008001" "D0"
3521392-3522192 usb_power_delivery: payload: "[1] REQ Disc Ident  SVID:ff00" "[1] REQ Disc Ident  SVID:ff00"
3522192-3522290 usb_power_delivery: sym: "0x0" "0"
3522290-3522392 usb_power_delivery: sym: "0xF" "F"
3522392-3522490 usb_power_delivery: sym: "0xD" "D"
3522490-3522592 usb_power_delivery: sym: "0x1" "1"
3522592-3522690 usb_power_delivery: sym: "0x7" "7"
3522690-3522790 usb_power_delivery: sym: "0xA" "A"
3522790-3522892 usb_power_delivery: sym: "0xB" "B"
3522892-3522992 usb_power_delivery: sym: "0x5" "5"
3522192-3522992 usb_power_delivery: crc: "CRC:5ba71df0" "CRC"
3522992-3523092 usb_power_delivery: sym: "EOP" "#"
3522992-3523092 usb_power_delivery: eop: "EOP" "E"
3519317-3523092 usb_power_delivery: text: "#98   (586.552833ms): (r2) SNK[0]: VDM - [1] REQ Disc Ident  SVID:ff00" "..."
3529975-3531251 usb_power_delivery: preamble: "Preamble" "..."
3531251-3531349 usb_power_delivery: sym: "SYNC-1" "S1"
3531349-3531451 usb_power_delivery: sym: "SYNC-1" "S1"
3531451-3531549 usb_power_delivery: sym: "SYNC-3" "S3"
3531549-3531651 usb_power_delivery: sym: "SYNC-3" "S3"
3531251-3531651 usb_power_delivery: sop: "SOP'" "S"
3531651-3531749 usb_power_delivery: sym: "0xF" "F"
3531749-3531851 usb_power_delivery: sym: "0x4" "4"
3531851-3531949 usb_power_delivery: sym: "0x0" "0"
3531949-3532051 usb_power_delivery: sym: "0x1" "1"
3531651-3532051 usb_power_delivery: header: "H:104f" "HD"
3529975-3533769 usb_power_delivery: snk: "(r2) SNK[0]: VDM" "VDM"
3532051-3532149 usb_power_delivery: sym: "0x1" "1"
3532149-3532251 usb_power_delivery: sym: "0x0" "0"
3532251-3532349 usb_power_delivery: sym: "0x0" "0"
3532349-3532451 usb_power_delivery: sym: "0x8" "8"
3532451-3532549 usb_power_delivery: sym: "0x0" "0"
3532549-3532651 usb_power_delivery: sym: "0x0" "0"
3532651-3532749 usb_power_delivery: sym: "0xF" "F"
3532749-3532851 usb_power_delivery: sym: "0xF" "F"
3532051-3532851 usb_power_delivery: data: "[0]ff008001" "D0"
3532051-3532851 usb_power_delivery: payload: "[1] REQ Disc Ident  SVID:ff00" "[1] REQ Disc Ident  SVID:ff00"
3532851-3532949 usb_power_delivery: sym: "0x0" "0"
3532949-3533051 usb_power_delivery: sym: "0xF" "F"
3533051-3533149 usb_power_delivery: sym: "0xD" "D"
3533149-3533251 usb_power_delivery: sym: "0x1" "1"
3533251-3533349 usb_power_delivery: sym: "0x7" "7"
3533349-3533449 usb_power_delivery: sym: "0xA" "A"
3533449-3533551 usb_power_delivery: sym: "0xB" "B"
3533551-3533651 usb_power_delivery: sym: "0x5" "5"
3532851-3533651 usb_power_delivery: crc: "CRC:5ba71df0" "CRC"
3533651-3533751 usb_power_delivery: sym: "EOP" "#"
3533651-3533751 usb_power_delivery: eop: "EOP" "E"
3529975-3533751 usb_power_delivery: text: "#99   (588.329167ms): (r2) SNK[0]: VDM - [1] REQ Disc Ident  SVID:ff00" "..."
3540634-3541909 usb_power_delivery: preamble: "Preamble" "..."
3541909-3542008 usb_power_delivery: sym: "SYNC-1" "S1"
3542008-3542109 usb_power_delivery: sym: "SYNC-1" "S1"
3542109-3542208 usb_power_delivery: sym: "SYNC-3" "S3"
3542208-3542310 usb_power_delivery: sym: "SYNC-3" "S3"
3541909-3542310 usb_power_delivery: sop: "SOP'" "S"
3542310-3542408 usb_power_delivery: sym: "0xF" "F"
3542408-3542510 usb_power_delivery: sym: "0x4" "4"
3542510-3542608 usb_power_delivery: sym: "0x0" "0"
3542608-3542709 usb_power_delivery: sym: "0x1" "1"
3542310-3542709 usb_power_delivery: header: "H:104f" "HD"
3540634-3544428 usb_power_delivery: snk: "(r2) SNK[0]: VDM" "VDM"
3542709-3542808 usb_power_delivery: sym: "0x1" "1"
3542808-3542910 usb_power_delivery: sym: "0x0" "0"
3542910-3543008 usb_power_delivery: sym: "0x0" "0"
3543008-3543110 usb_power_delivery: sym: "0x8" "8"
3543110-3543208 usb_power_delivery: sym: "0x0" "0"
3543208-3543310 usb_power_delivery: sym: "0x0" "0"
3543310-3543408 usb_power_delivery: sym: "0xF" "F"
3543408-3543510 usb_power_delivery: sym: "0xF" "F"
3542709-3543510 usb_power_delivery: data: "[0]ff008001" "D0"
3542709-3543510 usb_power_delivery: payload: "[1] REQ Disc Ident  SVID:ff00" "[1] REQ Disc Ident  SVID:ff00"
3543510-3543608 usb_power_delivery: sym: "0x0" "0"
3543608-3543710 usb_power_delivery: sym: "0xF" "F"
3543710-3543808 usb_power_delivery: sym: "0xD" "D"
3543808-3543910 usb_power_delivery: sym: "0x1" "1"
3543910-3544008 usb_power_delivery: sym: "0x7" "7"
3544008-3544108 usb_power_delivery: sym: "0xA" "A"
3544108-3544210 usb_power_delivery: sym: "0xB" "B"
3544210-3544310 usb_power_delivery: sym: "0x5" "5"
3543510-3544310 usb_power_delivery: crc: "CRC:5ba71df0" "CRC"
3544310-3544410 usb_power_delivery: sym: "EOP" "#"
3544310-3544410 usb_power_delivery: eop: "EOP" "E"
3540634-3544410 usb_power_delivery: text: "#100  (590.105667ms): (r2) SNK[0]: VDM - [1] REQ Disc Ident  SVID:ff00" "..."
3551811-3553087 usb_power_delivery: preamble: "Preamble" "..."
3553087-3553185 usb_power_delivery: sym: "SYNC-1" "S1"
3553185-3553287 usb_power_delivery: sym: "SYNC-1" "S1"
3553287-3553385 usb_power_delivery: sym: "SYNC-3" "S3"
3553385-3553487 usb_power_delivery: sym: "SYNC-3" "S3"
3553087-3553487 usb_power_delivery: sop: "SOP'" "S"
3553487-3553585 usb_power_delivery: sym: "0xF" "F"
3553585-3553687 usb_power_delivery: sym: "0x4" "4"
3553687-3553785 usb_power_delivery: sym: "0x0" "0"
3553785-3553887 usb_power_delivery: sym: "0x1" "1"
3553487-3553887 usb_power_delivery: header: "H:104f" "HD"
3551811-3555605 usb_power_delivery: snk: "(r2) SNK[0]: VDM" "VDM"
3553887-3553985 usb_power_delivery: sym: "0x1" "1"
3553985-3554087 usb_power_delivery: sym: "0x0" "0"
3554087-3554185 usb_power_delivery: sym: "0x0" "0"
3554185-3554287 usb_power_delivery: sym: "0x8" "8"
3554287-3554385 usb_power_delivery: sym: "0x0" "0"
3554385-3554487 usb_power_delivery: sym: "0x0" "0"
3554487-3554585 usb_power_delivery: sym: "0xF" "F"
3554585-3554687 usb_power_delivery: sym: "0xF" "F"
3553887-3554687 usb_power_delivery: data: "[0]ff008001" "D0"
3553887-3554687 usb_power_delivery: payload: "[1] REQ Disc Ident  SVID:ff00" "[1] REQ Disc Ident  SVID:ff00"
3554687-3554785 usb_power_delivery: sym: "0x0" "0"
3554785-3554887 usb_power_delivery: sym: "0xF" "F"
3554887-3554985 usb_power_delivery: sym: "0xD" "D"
3554985-3555087 usb_power_delivery: sym: "0x1" "1"
3555087-3555185 usb_power_delivery: sym: "0x7" "7"
3555185-3555285 usb_power_delivery: sym: "0xA" "A"
3555285-3555387 usb_power_delivery: sym: "0xB" "B"
3555387-3555487 usb_power_delivery: sym: "0x5" "5"
3554687-3555487 usb_power_delivery: crc: "CRC:5ba71df0" "CRC"
3555487-3555587 usb_power_delivery: sym: "EOP" "#"
3555487-3555587 usb_power_delivery: eop: "EOP" "E"
3551811-3555587 usb_power_delivery: text: "#101  (591.968500ms): (r2) SNK[0]: VDM - [1] REQ Disc Ident  SVID:ff00" "..."
3562470-3563745 usb_power_delivery: preamble: "Preamble" "..."
3563745-3563844 usb_power_delivery: sym: "SYNC-1" "S1"
3563844-3563945 usb_power_delivery: sym: "SYNC-1" "S1"
3563945-3564044 usb_power_delivery: sym: "SYNC-3" "S3"
3564044-3564145 usb_power_delivery: sym: "SYNC-3" "S3"
3563745-3564145 usb_power_delivery: sop: "SOP'" "S"
3564145-3564244 usb_power_delivery: sym: "0xF" "F"
3564244-3564345 usb_power_delivery: sym: "0x4" "4"
3564345-3564444 usb_power_delivery: sym: "0x0" "0"
3564444-3564545 usb_power_delivery: sym: "0x1" "1"
3564145-3564545 usb_power_delivery: header: "H:104f" "HD"
3562470-3566264 usb_power_delivery: snk: "(r2) SNK[0]: VDM" "VDM"
3564545-3564644 usb_power_delivery: sym: "0x1" "1"
3564644-3564745 usb_power_delivery: sym: "0x0" "0"
3564745-3564844 usb_power_delivery: sym: "0x0" "0"
3564844-3564945 usb_power_delivery: sym: "0x8" "8"
3564945-3565044 usb_power_delivery: sym: "0x0" "0"
3565044-3565145 usb_power_delivery: sym: "0x0" "0"
3565145-3565244 usb_power_delivery: sym: "0xF" "F"
3565244-3565345 usb_power_delivery: sym: "0xF" "F"
3564545-3565345 usb_power_delivery: data: "[0]ff008001" "D0"
3564545-3565345 usb_power_delivery: payload: "[1] REQ Disc Ident  SVID:ff00" "[1] REQ Disc Ident  SVID:ff00"
3565345-3565444 usb_power_delivery: sym: "0x0" "0"
3565444-3565546 usb_power_delivery: sym: "0xF" "F"
3565546-3565644 usb_power_delivery: sym: "0xD" "D"
3565644-3565746 usb_power_delivery: sym: "0x1" "1"
3565746-3565844 usb_power_delivery: sym: "0x7" "7"
3565844-3565944 usb_power_delivery: sym: "0xA" "A"
3565944-3566045 usb_power_delivery: sym: "0xB" "B"
3566045-3566145 usb_power_delivery: sym: "0x5" "5"
3565345-3566145 usb_power_delivery: crc: "CRC:5ba71df0" "CRC"
3566145-3566246 usb_power_delivery: sym: "EOP" "#"
3566145-3566246 usb_power_delivery: eop: "EOP" "E"
3562470-3566246 usb_power_delivery: text: "#102  (593.745000ms): (r2) SNK[0]: VDM - [1] REQ Disc Ident  SVID:ff00" "..."
3573129-3574404 usb_power_delivery: preamble: "Preamble" "..."
3574404-3574502 usb_power_delivery: sym: "SYNC-1" "S1"
3574502-3574604 usb_power_delivery: sym: "SYNC-1" "S1"
3574604-3574702 usb_power_delivery: sym: "SYNC-3" "S3"
3574702-3574804 usb_power_delivery: sym: "SYNC-3" "S3"
3574404-3574804 usb_power_delivery: sop: "SOP'" "S"
3574804-3574902 usb_power_delivery: sym: "0xF" "F"
3574902-3575004 usb_power_delivery: sym: "0x4" "4"
3575004-3575102 usb_power_delivery: sym: "0x0" "0"
3575102-3575204 usb_power_delivery: sym: "0x1" "1"
3574804-3575204 usb_power_delivery: header: "H:104f" "HD"
3573129-3576923 usb_power_delivery: snk: "(r2) SNK[0]: VDM" "VDM"
3575204-3575302 usb_power_delivery: sym: "0x1" "1"
3575302-3575404 usb_power_delivery: sym: "0x0" "0"
3575404-3575502 usb_power_delivery: sym: "0x0" "0"
3575502-3575604 usb_power_delivery: sym: "0x8" "8"
3575604-3575702 usb_power_delivery: sym: "0x0" "0"
3575702-3575804 usb_power_delivery: sym: "0x0" "0"
3575804-3575902 usb_power_delivery: sym: "0xF" "F"
3575902-3576004 usb_power_delivery: sym: "0xF" "F"
3575204-3576004 usb_power_delivery: data: "[0]ff008001" "D0"
3575204-3576004 usb_power_delivery: payload: "[1] REQ Disc Ident  SVID:ff00" "[1] REQ Disc Ident  SVID:ff00"
3576004-3576102 usb_power_delivery: sym: "0x0" "0"
3576102-3576204 usb_power_delivery: sym: "0xF" "F"
3576204-3576302 usb_power_delivery: sym: "0xD" "D"
3576302-3576404 usb_power_delivery: sym: "0x1" "1"
3576404-3576502 usb_power_delivery: sym: "0x7" "7"
3576502-3576602 usb_power_delivery: sym: "0xA" "A"
3576602-3576704 usb_power_delivery: sym: "0xB" "B"
3576704-3576804 usb_power_delivery: sym: "0x5" "5"
3576004-3576804 usb_power_delivery: crc: "CRC:5ba71df0" "CRC"
3576804-3576904 usb_power_delivery: sym: "EOP" "#"
3576804-3576904 usb_power_delivery: eop: "EOP" "E"
3573129-3576904 usb_power_delivery: text: "#103  (595.521500ms): (r2) SNK[0]: VDM - [1] REQ Disc Ident  SVID:ff00" "..."
3583787-3585063 usb_power_delivery: preamble: "Preamble" "..."
3585063-3585161 usb_power_delivery: sym: "SYNC-1" "S1"
3585161-3585263 usb_power_delivery: sym: "SYNC-1" "S1"
3585263-3585361 usb_power_delivery: sym: "SYNC-3" "S3"
3585361-3585463 usb_power_delivery: sym: "SYNC-3" "S3"
3585063-3585463 usb_power_delivery: sop: "SOP'" "S"
3585463-3585561 usb_power_delivery: sym: "0xF" "F"
3585561-3585663 usb_power_delivery: sym: "0x4" "4"
3585663-3585761 usb_power_delivery: sym: "0x0" "0"
3585761-3585863 usb_power_delivery: sym: "0x1" "1"
3585463-3585863 usb_power_delivery: header: "H:104f" "HD"
3583787-3587581 usb_power_delivery: snk: "(r2) SNK[0]: VDM" "VDM"
3585863-3585961 usb_power_delivery: sym: "0x1" "1"
3585961-3586063 usb_power_delivery: sym: "0x0" "0"
3586063-3586161 usb_power_delivery: sym: "0x0" "0"
3586161-3586263 usb_power_delivery: sym: "0x8" "8"
3586263-3586361 usb_power_delivery: sym: "0x0" "0"
3586361-3586463 usb_power_delivery: sym: "0x0" "0"
3586463-3586561 usb_power_delivery: sym: "0xF" "F"
3586561-3586663 usb_power_delivery: sym: "0xF" "F"
3585863-3586663 usb_power_delivery: data: "[0]ff008001" "D0"
3585863-3586663 usb_power_delivery: payload: "[1] REQ Disc Ident  SVID:ff00" "[1] REQ Disc Ident  SVID:ff00"
3586663-3586761 usb_power_delivery: sym: "0x0" "0"
3586761-3586863 usb_power_delivery: sym: "0xF" "F"
3586863-3586961 usb_power_delivery: sym: "0xD" "D"
3586961-3587063 usb_power_delivery: sym: "0x1" "1"
3587063-3587161 usb_power_delivery: sym: "0x7" "7"
3587161-3587261 usb_power_delivery: sym: "0xA" "A"
3587261-3587363 usb_power_delivery: sym: "0xB" "B"
3587363-3587463 usb_power_delivery: sym: "0x5" "5"
3586663-3587463 usb_power_delivery: crc: "CRC:5ba71df0" "CRC"
3587463-3587563 usb_power_delivery: sym: "EOP" "#"
3587463-3587563 usb_power_delivery: eop: "EOP" "E"
3583787-3587563 usb_power_delivery: text: "#104  (597.297833ms): (r2) SNK[0]: VDM - [1] REQ Disc Ident  SVID:ff00" "..."
3594964-3596240 usb_power_delivery: preamble: "Preamble" "..."
3596240-3596338 usb_power_delivery: sym: "SYNC-1" "S1"
3596338-3596440 usb_power_delivery: sym: "SYNC-1" "S1"
3596440-3596538 usb_power_delivery: sym: "SYNC-3" "S3"
3596538-3596640 usb_power_delivery: sym: "SYNC-3" "S3"
3596240-3596640 usb_power_delivery: sop: "SOP'" "S"
3596640-3596738 usb_power_delivery: sym: "0xF" "F"
3596738-3596840 usb_power_delivery: sym: "0x4" "4"
3596840-3596938 usb_power_delivery: sym: "0x0" "0"
3596938-3597040 usb_power_delivery: sym: "0x1" "1"
3596640-3597040 usb_power_delivery: header: "H:104f" "HD"
3594964-3598758 usb_power_delivery: snk: "(r2) SNK[0]: VDM" "VDM"
3597040-3597138 usb_power_delivery: sym: "0x1" "1"
3597138-3597240 usb_power_delivery: sym: "0x0" "0"
3597240-3597338 usb_power_delivery: sym: "0x0" "0"
3597338-3597440 usb_power_delivery: sym: "0x8" "8"
3597440-3597538 usb_power_delivery: sym: "0x0" "0"
3597538-3597640 usb_power_delivery: sym: "0x0" "0"
3597640-3597738 usb_power_delivery: sym: "0xF" "F"
3597738-3597840 usb_power_delivery: sym: "0xF" "F"
3597040-3597840 usb_power_delivery: data: "[0]ff008001" "D0"
3597040-3597840 usb_power_delivery: payload: "[1] REQ Disc Ident  SVID:ff00" "[1] REQ Disc Ident  SVID:ff00"
3597840-3597938 usb_power_delivery: sym: "0x0" "0"
3597938-3598040 usb_power_delivery: sym: "0xF" "F"
3598040-3598138 usb_power_delivery: sym: "0xD" "D"
3598138-3598240 usb_power_delivery: sym: "0x1" "1"
3598240-3598338 usb_power_delivery: sym: "0x7" "7"
3598338-3598438 usb_power_delivery: sym: "0xA" "A"
3598438-3598540 usb_power_delivery: sym: "0xB" "B"
3598540-3598640 usb_power_delivery: sym: "0x5" "5"
3597840-3598640 usb_power_delivery: crc: "CRC:5ba71df0" "CRC"
3598640-3598740 usb_power_delivery: sym: "EOP" "#"
3598640-3598740 usb_power_delivery: eop: "EOP" "E"
3594964-3598740 usb_power_delivery: text: "#105  (599.160667ms): (r2) SNK[0]: VDM - [1] REQ Disc Ident  SVID:ff00" "..."
3605623-3606898 usb_power_delivery: preamble: "Preamble" "..."
3606898-3606997 usb_power_delivery: sym: "SYNC-1" "S1"
3606997-3607098 usb_power_delivery: sym: "SYNC-1" "S1"
3607098-3607197 usb_power_delivery: sym: "SYNC-3" "S3"
3607197-3607298 usb_power_delivery: sym: "SYNC-3" "S3"
3606898-3607298 usb_power_delivery: sop: "SOP'" "S"
3607298-3607397 usb_power_delivery: sym: "0xF" "F"
3607397-3607499 usb_power_delivery: sym: "0x4" "4"
3607499-3607597 usb_power_delivery: sym: "0x0" "0"
3607597-3607699 usb_power_delivery: sym: "0x1" "1"
3607298-3607699 usb_power_delivery: header: "H:104f" "HD"
3605623-3609417 usb_power_delivery: snk: "(r2) SNK[0]: VDM" "VDM"
3607699-3607797 usb_power_delivery: sym: "0x1" "1"
3607797-3607898 usb_power_delivery: sym: "0x0" "0"
3607898-3607997 usb_power_delivery: sym: "0x0" "0"
3607997-3608098 usb_power_delivery: sym: "0x8" "8"
3608098-3608197 usb_power_delivery: sym: "0x0" "0"
3608197-3608299 usb_power_delivery: sym: "0x0" "0"
3608299-3608397 usb_power_delivery: sym: "0xF" "F"
3608397-3608499 usb_power_delivery: sym: "0xF" "F"
3607699-3608499 usb_power_delivery: data: "[0]ff008001" "D0"
3607699-3608499 usb_power_delivery: payload: "[1] REQ Disc Ident  SVID:ff00" "[1] REQ Disc Ident  SVID:ff00"
3608499-3608597 usb_power_delivery: sym: "0x0" "0"
3608597-3608699 usb_power_delivery: sym: "0xF" "F"
3608699-3608797 usb_power_delivery: sym: "0xD" "D"
3608797-3608899 usb_power_delivery: sym: "0x1" "1"
3608899-3608997 usb_power_delivery: sym: "0x7" "7"
3608997-3609097 usb_power_delivery: sym: "0xA" "A"
3609097-3609199 usb_power_delivery: sym: "0xB" "B"
3609199-3609299 usb_power_delivery: sym: "0x5" "5"
3608499-3609299 usb_power_delivery: crc: "CRC:5ba71df0" "CRC"
3609299-3609399 usb_power_delivery: sym: "EOP" "#"
3609299-3609399 usb_power_delivery: eop: "EOP" "E"
3605623-3609399 usb_power_delivery: text: "#106  (600.937167ms): (r2) SNK[0]: VDM - [1] REQ Disc Ident  SVID:ff00" "..."
3616282-3617557 usb_power_delivery: preamble: "Preamble" "..."
3617557-3617655 usb_power_delivery: sym: "SYNC-1" "S1"
3617655-3617757 usb_power_delivery: sym: "SYNC-1" "S1"
3617757-3617855 usb_power_delivery: sym: "SYNC-3" "S3"
3617855-3617957 usb_power_delivery: sym: "SYNC-3" "S3"
3617557-3617957 usb_power_delivery: sop: "SOP'" "S"
3617957-3618055 usb_power_delivery: sym: "0xF" "F"
3618055-3618157 usb_power_delivery: sym: "0x4" "4"
3618157-3618255 usb_power_delivery: sym: "0x0" "0"
3618255-3618357 usb_power_delivery: sym: "0x1" "1"
3617957-3618357 usb_power_delivery: header: "H:104f" "HD"
3616282-3620076 usb_power_delivery: snk: "(r2) SNK[0]: VDM" "VDM"
3618357-3618455 usb_power_delivery: sym: "0x1" "1"
3618455-3618557 usb_power_delivery: sym: "0x0" "0"
3618557-3618655 usb_power_delivery: sym: "0x0" "0"
3618655-3618757 usb_power_delivery: sym: "0x8" "8"
3618757-3618855 usb_power_delivery: sym: "0x0" "0"
3618855-3618957 usb_power_delivery: sym: "0x0" "0"
3618957-3619055 usb_power_delivery: sym: "0xF" "F"
3619055-3619157 usb_power_delivery: sym: "0xF" "F"
3618357-3619157 usb_power_delivery: data: "[0]ff008001" "D0"
3618357-3619157 usb_power_delivery: payload: "[1] REQ Disc Ident  SVID:ff00" "[1] REQ Disc Ident  SVID:ff00"
3619157-3619255 usb_power_delivery: sym: "0x0" "0"
3619255-3619357 usb_power_delivery: sym: "0xF" "F"
3619357-3619455 usb_power_delivery: sym: "0xD" "D"
3619455-3619557 usb_power_delivery: sym: "0x1" "1"
3619557-3619655 usb_power_delivery: sym: "0x7" "7"
3619655-3619756 usb_power_delivery: sym: "0xA" "A"
3619756-3619857 usb_power_delivery: sym: "0xB" "B"
3619857-3619957 usb_power_delivery: sym: "0x5" "5"
3619157-3619957 usb_power_delivery: crc: "CRC:5ba71df0" "CRC"
3619957-3620057 usb_power_delivery: sym: "EOP" "#"
3619957-3620057 usb_power_delivery: eop: "EOP" "E"
3616282-3620057 usb_power_delivery: text: "#107  (602.713667ms): (r2) SNK[0]: VDM - [1] REQ Disc Ident  SVID:ff00" "..."
3626940-3628216 usb_power_delivery: preamble: "Preamble" "..."
3628216-3628314 usb_power_delivery: sym: "SYNC-1" "S1"
3628314-3628416 usb_power_delivery: sym: "SYNC-1" "S1"
3628416-3628514 usb_power_delivery: sym: "SYNC-3" "S3"
3628514-3628616 usb_power_delivery: sym: "SYNC-3" "S3"
3628216-3628616 usb_power_delivery: sop: "SOP'" "S"
3628616-3628714 usb_power_delivery: sym: "0xF" "F"
3628714-3628816 usb_power_delivery: sym: "0x4" "4"
3628816-3628914 usb_power_delivery: sym: "0x0" "0"
3628914-3629016 usb_power_delivery: sym: "0x1" "1"
3628616-3629016 usb_power_delivery: header: "H:104f" "HD"
3626940-3630734 usb_power_delivery: snk: "(r2) SNK[0]: VDM" "VDM"
3629016-3629114 usb_power_delivery: sym: "0x1" "1"
3629114-3629216 usb_power_delivery: sym: "0x0" "0"
3629216-3629314 usb_power_delivery: sym: "0x0" "0"
3629314-3629416 usb_power_delivery: sym: "0x8" "8"
3629416-3629514 usb_power_delivery: sym: "0x0" "0"
3629514-3629616 usb_power_delivery: sym: "0x0" "0"
3629616-3629714 usb_power_delivery: sym: "0xF" "F"
3629714-3629816 usb_power_delivery: sym: "0xF" "F"
3629016-3629816 usb_power_delivery: data: "[0]ff008001" "D0"
3629016-3629816 usb_power_delivery: payload: "[1] REQ Disc Ident  SVID:ff00" "[1] REQ Disc Ident  SVID:ff00"
3629816-3629914 usb_power_delivery: sym: "0x0" "0"
3629914-3630016 usb_power_delivery: sym: "0xF" "F"
3630016-3630114 usb_power_delivery: sym: "0xD" "D"
3630114-3630216 usb_power_delivery: sym: "0x1" "1"
3630216-3630314 usb_power_delivery: sym: "0x7" "7"
3630314-3630414 usb_power_delivery: sym: "0xA" "A"
3630414-3630516 usb_power_delivery: sym: "0xB" "B"
3630516-3630616 usb_power_delivery: sym: "0x5" "5"
3629816-3630616 usb_power_delivery: crc: "CRC:5ba71df0" "CRC"
3630616-3630716 usb_power_delivery: sym: "EOP" "#"
3630616-3630716 usb_power_delivery: eop: "EOP" "E"
3626940-3630716 usb_power_delivery: text: "#108  (604.490000ms): (r2) SNK[0]: VDM - [1] REQ Disc Ident  SVID:ff00" "..."
3639697-3640972 usb_power_delivery: preamble: "Preamble" "..."
3640972-3641070 usb_power_delivery: sym: "SYNC-1" "S1"
3641070-3641172 usb_power_delivery: sym: "SYNC-1" "S1"
3641172-3641270 usb_power_delivery: sym: "SYNC-1" "S1"
3641270-3641372 usb_power_delivery: sym: "SYNC-2" "S2"
3640972-3641372 usb_power_delivery: sop: "SOP" "S"
3641372-3641470 usb_power_delivery: sym: "0xF" "F"
3641470-3641570 usb_power_delivery: sym: "0x6" "6"
3641570-3641672 usb_power_delivery: sym: "0xD" "D"
3641672-3641770 usb_power_delivery: sym: "0x1" "1"
3641372-3641770 usb_power_delivery: header: "H:1d6f" "HD"
3639697-3643511 usb_power_delivery: src: "(r2) SRC[6]: VDM" "VDM"
3641770-3641872 usb_power_delivery: sym: "0x4" "4"
3641872-3641970 usb_power_delivery: sym: "0x0" "0"
3641970-3642072 usb_power_delivery: sym: "0x1" "1"
3642072-3642170 usb_power_delivery: sym: "0x8" "8"
3642170-3642272 usb_power_delivery: sym: "0x1" "1"
3642272-3642370 usb_power_delivery: sym: "0x0" "0"
3642370-3642472 usb_power_delivery: sym: "0xF" "F"
3642472-3642570 usb_power_delivery: sym: "0xF" "F"
3641770-3642570 usb_power_delivery: data: "[0]ff018104" "D0"
3641770-3642570 usb_power_delivery: payload: "[1] REQ Enter Mode pos 1 SVID:ff01" "[1] REQ Enter Mode pos 1 SVID:ff01"
3642570-3642670 usb_power_delivery: sym: "0x3" "3"
3642670-3642771 usb_power_delivery: sym: "0x3" "3"
3642771-3642872 usb_power_delivery: sym: "0x7" "7"
3642872-3642971 usb_power_delivery: sym: "0x7" "7"
3642971-3643071 usb_power_delivery: sym: "0xC" "C"
3643071-3643171 usb_power_delivery: sym: "0x9" "9"
3643171-3643272 usb_power_delivery: sym: "0xB" "B"
3643272-3643371 usb_power_delivery: sym: "0x8" "8"
3642570-3643371 usb_power_delivery: crc: "CRC:8b9c7733" "CRC"
3643371-3643471 usb_power_delivery: sym: "EOP" "#"
3643371-3643471 usb_power_delivery: eop: "EOP" "E"
3639697-3643471 usb_power_delivery: text: "#109  (606.616167ms): (r2) SRC[6]: VDM - [1] REQ Enter Mode pos 1 SVID:ff01" "..."
3644277-3645558 usb_power_delivery: preamble: "Preamble" "..."
3645558-3645656 usb_power_delivery: sym: "SYNC-1" "S1"
3645656-3645758 usb_power_delivery: sym: "SYNC-1" "S1"
3645758-3645856 usb_power_delivery: sym: "SYNC-1" "S1"
3645856-3645958 usb_power_delivery: sym: "SYNC-2" "S2"
3645558-3645958 usb_power_delivery: sop: "SOP" "S"
3645958-3646056 usb_power_delivery: sym: "0x1" "1"
3646056-3646158 usb_power_delivery: sym: "0x4" "4"
3646158-3646258 usb_power_delivery: sym: "0xC" "C"
3646258-3646356 usb_power_delivery: sym: "0x0" "0"
3645958-3646356 usb_power_delivery: header: "H:0c41" "HD"
3644277-3647296 usb_power_delivery: snk: "(r2) SNK[6]: GOOD CRC" "GOOD CRC"
3646356-3646458 usb_power_delivery: sym: "0x0" "0"
3646458-3646558 usb_power_delivery: sym: "0x9" "9"
3646558-3646656 usb_power_delivery: sym: "0x0" "0"
3646656-3646758 usb_power_delivery: sym: "0x2" "2"
3646758-3646856 usb_power_delivery: sym: "0xD" "D"
3646856-3646958 usb_power_delivery: sym: "0x0" "0"
3646958-3647056 usb_power_delivery: sym: "0x1" "1"
3647056-3647156 usb_power_delivery: sym: "0xA" "A"
3646356-3647156 usb_power_delivery: crc: "CRC:a10d2090" "CRC"
3647156-3647256 usb_power_delivery: sym: "EOP" "#"
3647156-3647256 usb_power_delivery: eop: "EOP" "E"
3644277-3647256 usb_power_delivery: text: "#110  (607.379500ms): (r2) SNK[6]: GOOD CRC" "..."
3670279-3671560 usb_power_delivery: preamble: "Preamble" "..."
3671560-3671658 usb_power_delivery: sym: "SYNC-1" "S1"
3671658-3671760 usb_power_delivery: sym: "SYNC-1" "S1"
3671760-3671858 usb_power_delivery: sym: "SYNC-1" "S1"
3671858-3671960 usb_power_delivery: sym: "SYNC-2" "S2"
3671560-3671960 usb_power_delivery: sop: "SOP" "S"
3671960-3672058 usb_power_delivery: sym: "0xF" "F"
3672058-3672160 usb_power_delivery: sym: "0x4" "4"
3672160-3672258 usb_power_delivery: sym: "0x8" "8"
3672258-3672360 usb_power_delivery: sym: "0x1" "1"
3671960-3672360 usb_power_delivery: header: "H:184f" "HD"
3670279-3674098 usb_power_delivery: snk: "(r2) SNK[4]: VDM" "VDM"
3672360-3672458 usb_power_delivery: sym: "0x4" "4"
3672458-3672560 usb_power_delivery: sym: "0x4" "4"
3672560-3672658 usb_power_delivery: sym: "0x1" "1"
3672658-3672760 usb_power_delivery: sym: "0x8" "8"
3672760-3672858 usb_power_delivery: sym: "0x1" "1"
3672858-3672960 usb_power_delivery: sym: "0x0" "0"
3672960-3673058 usb_power_delivery: sym: "0xF" "F"
3673058-3673160 usb_power_delivery: sym: "0xF" "F"
3672360-3673160 usb_power_delivery: data: "[0]ff018144" "D0"
3672360-3673160 usb_power_delivery: payload: "[1] ACK Enter Mode pos 1 SVID:ff01" "[1] ACK Enter Mode pos 1 SVID:ff01"
3673160-3673258 usb_power_delivery: sym: "0x8" "8"
3673258-3673360 usb_power_delivery: sym: "0x4" "4"
3673360-3673460 usb_power_delivery: sym: "0x5" "5"
3673460-3673560 usb_power_delivery: sym: "0xA" "A"
3673560-3673658 usb_power_delivery: sym: "0x4" "4"
3673658-3673758 usb_power_delivery: sym: "0xC" "C"
3673758-3673860 usb_power_delivery: sym: "0xF" "F"
3673860-3673958 usb_power_delivery: sym: "0xD" "D"
3673160-3673958 usb_power_delivery: crc: "CRC:dfc4a548" "CRC"
3673958-3674058 usb_power_delivery: sym: "EOP" "#"
3673958-3674058 usb_power_delivery: eop: "EOP" "E"
3670279-3674058 usb_power_delivery: text: "#111  (611.713167ms): (r2) SNK[4]: VDM - [1] ACK Enter Mode pos 1 SVID:ff01" "..."
3674725-3676000 usb_power_delivery: preamble: "Preamble" "..."
3676000-3676098 usb_power_delivery: sym: "SYNC-1" "S1"
3676098-3676200 usb_power_delivery: sym: "SYNC-1" "S1"
3676200-3676298 usb_power_delivery: sym: "SYNC-1" "S1"
3676298-3676400 usb_power_delivery: sym: "SYNC-2" "S2"
3676000-3676400 usb_power_delivery: sop: "SOP" "S"
3676400-3676498 usb_power_delivery: sym: "0x1" "1"
3676498-3676598 usb_power_delivery: sym: "0x6" "6"
3676598-3676698 usb_power_delivery: sym: "0x9" "9"
3676698-3676800 usb_power_delivery: sym: "0x0" "0"
3676400-3676800 usb_power_delivery: header: "H:0961" "HD"
3674725-3677719 usb_power_delivery: src: "(r2) SRC[4]: GOOD CRC" "GOOD CRC"
3676800-3676898 usb_power_delivery: sym: "0xD" "D"
3676898-3677000 usb_power_delivery: sym: "0xB" "B"
3677000-3677098 usb_power_delivery: sym: "0x0" "0"
3677098-3677200 usb_power_delivery: sym: "0xF" "F"
3677200-3677300 usb_power_delivery: sym: "0x3" "3"
3677300-3677400 usb_power_delivery: sym: "0xE" "E"
3677400-3677498 usb_power_delivery: sym: "0x4" "4"
3677498-3677600 usb_power_delivery: sym: "0x4" "4"
3676800-3677600 usb_power_delivery: crc: "CRC:44e3f0bd" "CRC"
3677600-3677700 usb_power_delivery: sym: "EOP" "#"
3677600-3677700 usb_power_delivery: eop: "EOP" "E"
3674725-3677700 usb_power_delivery: text: "#112  (612.454167ms): (r2) SRC[4]: GOOD CRC" "..."
3680389-3681664 usb_power_delivery: preamble: "Preamble" "..."
3681664-3681762 usb_power_delivery: sym: "SYNC-1" "S1"
3681762-3681864 usb_power_delivery: sym: "SYNC-1" "S1"
3681864-3681962 usb_power_delivery: sym: "SYNC-1" "S1"
3681962-3682064 usb_power_delivery: sym: "SYNC-2" "S2"
3681664-3682064 usb_power_delivery: sop: "SOP" "S"
3682064-3682162 usb_power_delivery: sym: "0xF" "F"
3682162-3682262 usb_power_delivery: sym: "0x6" "6"
3682262-3682364 usb_power_delivery: sym: "0xF" "F"
3682364-3682462 usb_power_delivery: sym: "0x2" "2"
3682064-3682462 usb_power_delivery: header: "H:2f6f" "HD"
3680389-3685003 usb_power_delivery: src: "(r2) SRC[7]: VDM" "VDM"
3682462-3682564 usb_power_delivery: sym: "0x0" "0"
3682564-3682662 usb_power_delivery: sym: "0x1" "1"
3682662-3682764 usb_power_delivery: sym: "0x1" "1"
3682764-3682862 usb_power_delivery: sym: "0x8" "8"
3682862-3682964 usb_power_delivery: sym: "0x1" "1"
3682964-3683062 usb_power_delivery: sym: "0x0" "0"
3683062-3683164 usb_power_delivery: sym: "0xF" "F"
3683164-3683262 usb_power_delivery: sym: "0xF" "F"
3682462-3683262 usb_power_delivery: data: "[0]ff018110" "D0"
3682462-3683262 usb_power_delivery: payload: "[1] REQ DP Status pos 1 SVID:ff01" "[1] REQ DP Status pos 1 SVID:ff01"
3683262-3683364 usb_power_delivery: sym: "0x1" "1"
3683364-3683462 usb_power_delivery: sym: "0x0" "0"
3683462-3683564 usb_power_delivery: sym: "0x0" "0"
3683564-3683662 usb_power_delivery: sym: "0x0" "0"
3683662-3683764 usb_power_delivery: sym: "0x0" "0"
3683764-3683862 usb_power_delivery: sym: "0x0" "0"
3683862-3683964 usb_power_delivery: sym: "0x0" "0"
3683964-3684063 usb_power_delivery: sym: "0x0" "0"
3683262-3684063 usb_power_delivery: data: "[1]00000001" "D1"
3683262-3684063 usb_power_delivery: payload: "[2] VDO:00000001" "[2] VDO:00000001"
3684063-3684164 usb_power_delivery: sym: "0x8" "8"
3684164-3684263 usb_power_delivery: sym: "0xD" "D"
3684263-3684363 usb_power_delivery: sym: "0x9" "9"
3684363-3684464 usb_power_delivery: sym: "0xD" "D"
3684464-3684563 usb_power_delivery: sym: "0x0" "0"
3684563-3684664 usb_power_delivery: sym: "0x7" "7"
3684664-3684764 usb_power_delivery: sym: "0x5" "5"
3684764-3684863 usb_power_delivery: sym: "0x7" "7"
3684063-3684863 usb_power_delivery: crc: "CRC:7570d9d8" "CRC"
3684863-3684963 usb_power_delivery: sym: "EOP" "#"
3684863-3684963 usb_power_delivery: eop: "EOP" "E"
3680389-3684963 usb_power_delivery: text: "#113  (613.398167ms): (r2) SRC[7]: VDM - [1] REQ DP Status pos 1 SVID:ff01 - [2] VDO:00000001" "..."
3685780-3687061 usb_power_delivery: preamble: "Preamble" "..."
3687061-3687159 usb_power_delivery: sym: "SYNC-1" "S1"
3687159-3687261 usb_power_delivery: sym: "SYNC-1" "S1"
3687261-3687359 usb_power_delivery: sym: "SYNC-1" "S1"
3687359-3687461 usb_power_delivery: sym: "SYNC-2" "S2"
3687061-3687461 usb_power_delivery: sop: "SOP" "S"
3687461-3687559 usb_power_delivery: sym: "0x1" "1"
3687559-3687661 usb_power_delivery: sym: "0x4" "4"
3687661-3687761 usb_power_delivery: sym: "0xE" "E"
3687761-3687859 usb_power_delivery: sym: "0x0" "0"
3687461-3687859 usb_power_delivery: header: "H:0e41" "HD"
3685780-3688800 usb_power_delivery: snk: "(r2) SNK[7]: GOOD CRC" "GOOD CRC"
3687859-3687959 usb_power_delivery: sym: "0xC" "C"
3687959-3688061 usb_power_delivery: sym: "0xB" "B"
3688061-3688159 usb_power_delivery: sym: "0x1" "1"
3688159-3688262 usb_power_delivery: sym: "0x4" "4"
3688262-3688361 usb_power_delivery: sym: "0x3" "3"
3688361-3688459 usb_power_delivery: sym: "0x0" "0"
3688459-3688561 usb_power_delivery: sym: "0xF" "F"
3688561-3688659 usb_power_delivery: sym: "0x4" "4"
3687859-3688659 usb_power_delivery: crc: "CRC:4f0341bc" "CRC"
3688659-3688759 usb_power_delivery: sym: "EOP" "#"
3688659-3688759 usb_power_delivery: eop: "EOP" "E"
3685780-3688759 usb_power_delivery: text: "#114  (614.296667ms): (r2) SNK[7]: GOOD CRC" "..."
3715382-3716663 usb_power_delivery: preamble: "Preamble" "..."
3716663-3716761 usb_power_delivery: sym: "SYNC-1" "S1"
3716761-3716864 usb_power_delivery: sym: "SYNC-1" "S1"
3716864-3716961 usb_power_delivery: sym: "SYNC-1" "S1"
3716961-3717064 usb_power_delivery: sym: "SYNC-2" "S2"
3716663-3717064 usb_power_delivery: sop: "SOP" "S"
3717064-3717161 usb_power_delivery: sym: "0xF" "F"
3717161-3717264 usb_power_delivery: sym: "0x4" "4"
3717264-3717364 usb_power_delivery: sym: "0xA" "A"
3717364-3717461 usb_power_delivery: sym: "0x2" "2"
3717064-3717461 usb_power_delivery: header: "H:2a4f" "HD"
3715382-3719982 usb_power_delivery: snk: "(r2) SNK[5]: VDM" "VDM"
3717461-3717564 usb_power_delivery: sym: "0x0" "0"
3717564-3717664 usb_power_delivery: sym: "0x5" "5"
3717664-3717761 usb_power_delivery: sym: "0x1" "1"
3717761-3717864 usb_power_delivery: sym: "0x8" "8"
3717864-3717961 usb_power_delivery: sym: "0x1" "1"
3717961-3718064 usb_power_delivery: sym: "0x0" "0"
3718064-3718161 usb_power_delivery: sym: "0xF" "F"
3718161-3718264 usb_power_delivery: sym: "0xF" "F"
3717461-3718264 usb_power_delivery: data: "[0]ff018150" "D0"
3717461-3718264 usb_power_delivery: payload: "[1] ACK DP Status pos 1 SVID:ff01" "[1] ACK DP Status pos 1 SVID:ff01"
3718264-3718364 usb_power_delivery: sym: "0xA" "A"
3718364-3718461 usb_power_delivery: sym: "0x1" "1"
3718461-3718564 usb_power_delivery: sym: "0x0" "0"
3718564-3718661 usb_power_delivery: sym: "0x0" "0"
3718661-3718764 usb_power_delivery: sym: "0x0" "0"
3718764-3718861 usb_power_delivery: sym: "0x0" "0"
3718861-3718964 usb_power_delivery: sym: "0x0" "0"
3718964-3719061 usb_power_delivery: sym: "0x0" "0"
3718264-3719061 usb_power_delivery: data: "[1]0000001a" "D1"
3718264-3719061 usb_power_delivery: payload: "[2] VDO:0000001a" "[2] VDO:0000001a"
3719061-3719164 usb_power_delivery: sym: "0x4" "4"
3719164-3719264 usb_power_delivery: sym: "0x3" "3"
3719264-3719361 usb_power_delivery: sym: "0xD" "D"
3719361-3719464 usb_power_delivery: sym: "0x8" "8"
3719464-3719562 usb_power_delivery: sym: "0xF" "F"
3719562-3719662 usb_power_delivery: sym: "0x3" "3"
3719662-3719762 usb_power_delivery: sym: "0xE" "E"
3719762-3719864 usb_power_delivery: sym: "0xD" "D"
3719061-3719864 usb_power_delivery: crc: "CRC:de3f8d34" "CRC"
3719864-3719964 usb_power_delivery: sym: "EOP" "#"
3719864-3719964 usb_power_delivery: eop: "EOP" "E"
3715382-3719964 usb_power_delivery: text: "#115  (619.230333ms): (r2) SNK[5]: VDM - [1] ACK DP Status pos 1 SVID:ff01 - [2] VDO:0000001a" "..."
3720627-3721902 usb_power_delivery: preamble: "Preamble" "..."
3721902-3722000 usb_power_delivery: sym: "SYNC-1" "S1"
3722000-3722102 usb_power_delivery: sym: "SYNC-1" "S1"
3722102-3722200 usb_power_delivery: sym: "SYNC-1" "S1"
3722200-3722302 usb_power_delivery: sym: "SYNC-2" "S2"
3721902-3722302 usb_power_delivery: sop: "SOP" "S"
3722302-3722400 usb_power_delivery: sym: "0x1" "1"
3722400-3722500 usb_power_delivery: sym: "0x6" "6"
3722500-3722602 usb_power_delivery: sym: "0xB" "B"
3722602-3722700 usb_power_delivery: sym: "0x0" "0"
3722302-3722700 usb_power_delivery: header: "H:0b61" "HD"
3720627-3723620 usb_power_delivery: src: "(r2) SRC[5]: GOOD CRC" "GOOD CRC"
3722700-3722802 usb_power_delivery: sym: "0x1" "1"
3722802-3722902 usb_power_delivery: sym: "0x9" "9"
3722902-3723000 usb_power_delivery: sym: "0x1" "1"
3723000-3723100 usb_power_delivery: sym: "0x9" "9"
3723100-3723202 usb_power_delivery: sym: "0xD" "D"
3723202-3723302 usb_power_delivery: sym: "0xE" "E"
3723302-3723402 usb_power_delivery: sym: "0xA" "A"
3723402-3723502 usb_power_delivery: sym: "0xA" "A"
3722700-3723502 usb_power_delivery: crc: "CRC:aaed9191" "CRC"
3723502-3723602 usb_power_delivery: sym: "EOP" "#"
3723502-3723602 usb_power_delivery: eop: "EOP" "E"
3720627-3723602 usb_power_delivery: text: "#116  (620.104500ms): (r2) SRC[5]: GOOD CRC" "..."
3726903-3728179 usb_power_delivery: preamble: "Preamble" "..."
3728179-3728277 usb_power_delivery: sym: "SYNC-1" "S1"
3728277-3728379 usb_power_delivery: sym: "SYNC-1" "S1"
3728379-3728477 usb_power_delivery: sym: "SYNC-1" "S1"
3728477-3728579 usb_power_delivery: sym: "SYNC-2" "S2"
3728179-3728579 usb_power_delivery: sop: "SOP" "S"
3728579-3728677 usb_power_delivery: sym: "0xF" "F"
3728677-3728777 usb_power_delivery: sym: "0x6" "6"
3728777-3728879 usb_power_delivery: sym: "0x1" "1"
3728879-3728977 usb_power_delivery: sym: "0x2" "2"
3728579-3728977 usb_power_delivery: header: "H:216f" "HD"
3726903-3731497 usb_power_delivery: src: "(r2) SRC[0]: VDM" "VDM"
3728977-3729079 usb_power_delivery: sym: "0x1" "1"
3729079-3729177 usb_power_delivery: sym: "0x1" "1"
3729177-3729279 usb_power_delivery: sym: "0x1" "1"
3729279-3729377 usb_power_delivery: sym: "0x8" "8"
3729377-3729479 usb_power_delivery: sym: "0x1" "1"
3729479-3729577 usb_power_delivery: sym: "0x0" "0"
3729577-3729679 usb_power_delivery: sym: "0xF" "F"
3729679-3729777 usb_power_delivery: sym: "0xF" "F"
3728977-3729777 usb_power_delivery: data: "[0]ff018111" "D0"
3728977-3729777 usb_power_delivery: payload: "[1] REQ DP Configure pos 1 SVID:ff01" "[1] REQ DP Configure pos 1 SVID:ff01"
3729777-3729877 usb_power_delivery: sym: "0x6" "6"
3729877-3729979 usb_power_delivery: sym: "0x0" "0"
3729979-3730077 usb_power_delivery: sym: "0x8" "8"
3730077-3730179 usb_power_delivery: sym: "0x0" "0"
3730179-3730277 usb_power_delivery: sym: "0x0" "0"
3730277-3730379 usb_power_delivery: sym: "0x0" "0"
3730379-3730477 usb_power_delivery: sym: "0x0" "0"
3730477-3730579 usb_power_delivery: sym: "0x0" "0"
3729777-3730579 usb_power_delivery: data: "[1]00000806" "D1"
3729777-3730579 usb_power_delivery: payload: "[2] VDO:00000806" "[2] VDO:00000806"
3730579-3730679 usb_power_delivery: sym: "0x5" "5"
3730679-3730777 usb_power_delivery: sym: "0xD" "D"
3730777-3730879 usb_power_delivery: sym: "0xB" "B"
3730879-3730979 usb_power_delivery: sym: "0x6" "6"
3730979-3731079 usb_power_delivery: sym: "0xC" "C"
3731079-3731177 usb_power_delivery: sym: "0xD" "D"
3731177-3731279 usb_power_delivery: sym: "0x2" "2"
3731279-3731379 usb_power_delivery: sym: "0xE" "E"
3730579-3731379 usb_power_delivery: crc: "CRC:e2dc6bd5" "CRC"
3731379-3731479 usb_power_delivery: sym: "EOP" "#"
3731379-3731479 usb_power_delivery: eop: "EOP" "E"
3726903-3731479 usb_power_delivery: text: "#117  (621.150500ms): (r2) SRC[0]: VDM - [1] REQ DP Configure pos 1 SVID:ff01 - [2] VDO:00000806" "..."
3732284-3733565 usb_power_delivery: preamble: "Preamble" "..."
3733565-3733663 usb_power_delivery: sym: "SYNC-1" "S1"
3733663-3733765 usb_power_delivery: sym: "SYNC-1" "S1"
3733765-3733863 usb_power_delivery: sym: "SYNC-1" "S1"
3733863-3733965 usb_power_delivery: sym: "SYNC-2" "S2"
3733565-3733965 usb_power_delivery: sop: "SOP" "S"
3733965-3734063 usb_power_delivery: sym: "0x1" "1"
3734063-3734165 usb_power_delivery: sym: "0x4" "4"
3734165-3734263 usb_power_delivery: sym: "0x0" "0"
3734263-3734365 usb_power_delivery: sym: "0x0" "0"
3733965-3734365 usb_power_delivery: header: "H:0041" "HD"
3732284-3735303 usb_power_delivery: snk: "(r2) SNK[0]: GOOD CRC" "GOOD CRC"
3734365-3734463 usb_power_delivery: sym: "0xB" "B"
3734463-3734565 usb_power_delivery: sym: "0xB" "B"
3734565-3734665 usb_power_delivery: sym: "0xC" "C"
3734665-3734765 usb_power_delivery: sym: "0x6" "6"
3734765-3734863 usb_power_delivery: sym: "0xB" "B"
3734863-3734965 usb_power_delivery: sym: "0xB" "B"
3734965-3735063 usb_power_delivery: sym: "0x8" "8"
3735063-3735163 usb_power_delivery: sym: "0xA" "A"
3734365-3735163 usb_power_delivery: crc: "CRC:a8bb6cbb" "CRC"
3735163-3735263 usb_power_delivery: sym: "EOP" "#"
3735163-3735263 usb_power_delivery: eop: "EOP" "E"
3732284-3735263 usb_power_delivery: text: "#118  (622.047333ms): (r2) SNK[0]: GOOD CRC" "..."
3758786-3760067 usb_power_delivery: preamble: "Preamble" "..."
3760067-3760165 usb_power_delivery: sym: "SYNC-1" "S1"
3760165-3760267 usb_power_delivery: sym: "SYNC-1" "S1"
3760267-3760365 usb_power_delivery: sym: "SYNC-1" "S1"
3760365-3760467 usb_power_delivery: sym: "SYNC-2" "S2"
3760067-3760467 usb_power_delivery: sop: "SOP" "S"
3760467-3760564 usb_power_delivery: sym: "0xF" "F"
3760564-3760667 usb_power_delivery: sym: "0x4" "4"
3760667-3760767 usb_power_delivery: sym: "0xC" "C"
3760767-3760865 usb_power_delivery: sym: "0x1" "1"
3760467-3760865 usb_power_delivery: header: "H:1c4f" "HD"
3758786-3762605 usb_power_delivery: snk: "(r2) SNK[6]: VDM" "VDM"
3760865-3760967 usb_power_delivery: sym: "0x1" "1"
3760967-3761067 usb_power_delivery: sym: "0x5" "5"
3761067-3761165 usb_power_delivery: sym: "0x1" "1"
3761165-3761267 usb_power_delivery: sym: "0x8" "8"
3761267-3761365 usb_power_delivery: sym: "0x1" "1"
3761365-3761467 usb_power_delivery: sym: "0x0" "0"
3761467-3761565 usb_power_delivery: sym: "0xF" "F"
3761565-3761667 usb_power_delivery: sym: "0xF" "F"
3760865-3761667 usb_power_delivery: data: "[0]ff018151" "D0"
3760865-3761667 usb_power_delivery: payload: "[1] ACK DP Configure pos 1 SVID:ff01" "[1] ACK DP Configure pos 1 SVID:ff01"
3761667-3761767 usb_power_delivery: sym: "0x5" "5"
3761767-3761865 usb_power_delivery: sym: "0x2" "2"
3761865-3761967 usb_power_delivery: sym: "0x4" "4"
3761967-3762067 usb_power_delivery: sym: "0xA" "A"
3762067-3762167 usb_power_delivery: sym: "0x3" "3"
3762167-3762265 usb_power_delivery: sym: "0x8" "8"
3762265-3762367 usb_power_delivery: sym: "0xD" "D"
3762367-3762465 usb_power_delivery: sym: "0x4" "4"
3761667-3762465 usb_power_delivery: crc: "CRC:4d83a425" "CRC"
3762465-3762565 usb_power_delivery: sym: "EOP" "#"
3762465-3762565 usb_power_delivery: eop: "EOP" "E"
3758786-3762565 usb_power_delivery: text: "#119  (626.464333ms): (r2) SNK[6]: VDM - [1] ACK DP Configure pos 1 SVID:ff01" "..."
3763231-3764507 usb_power_delivery: preamble: "Preamble" "..."
3764507-3764605 usb_power_delivery: sym: "SYNC-1" "S1"
3764605-3764706 usb_power_delivery: sym: "SYNC-1" "S1"
3764706-3764805 usb_power_delivery: sym: "SYNC-1" "S1"
3764805-3764907 usb_power_delivery: sym: "SYNC-2" "S2"
3764507-3764907 usb_power_delivery: sop: "SOP" "S"
3764907-3765005 usb_power_delivery: sym: "0x1" "1"
3765005-3765105 usb_power_delivery: sym: "0x6" "6"
3765105-3765207 usb_power_delivery: sym: "0xD" "D"
3765207-3765305 usb_power_delivery: sym: "0x0" "0"
3764907-3765305 usb_power_delivery: header: "H:0d61" "HD"
3763231-3766245 usb_power_delivery: src: "(r2) SRC[6]: GOOD CRC" "GOOD CRC"
3765305-3765407 usb_power_delivery: sym: "0x4" "4"
3765407-3765507 usb_power_delivery: sym: "0xA" "A"
3765507-3765605 usb_power_delivery: sym: "0x4" "4"
3765605-3765705 usb_power_delivery: sym: "0x3" "3"
3765705-3765805 usb_power_delivery: sym: "0xE" "E"
3765805-3765907 usb_power_delivery: sym: "0x8" "8"
3765907-3766007 usb_power_delivery: sym: "0x3" "3"
3766007-3766105 usb_power_delivery: sym: "0x4" "4"
3765305-3766105 usb_power_delivery: crc: "CRC:438e34a4" "CRC"
3766105-3766205 usb_power_delivery: sym: "EOP" "#"
3766105-3766205 usb_power_delivery: eop: "EOP" "E"
3763231-3766205 usb_power_delivery: text: "#120  (627.205167ms): (r2) SRC[6]: GOOD CRC" "..."
20594720-20596001 usb_power_delivery: preamble: "Preamble" "..."
20596001-20596099 usb_power_delivery: sym: "SYNC-1" "S1"
20596099-20596201 usb_power_delivery: sym: "SYNC-1" "S1"
20596201-20596299 usb_power_delivery: sym: "SYNC-1" "S1"
20596299-20596401 usb_power_delivery: sym: "SYNC-2" "S2"
20596001-20596401 usb_power_delivery: sop: "SOP" "S"
20596401-20596501 usb_power_delivery: sym: "0xA" "A"
20596501-20596599 usb_power_delivery: sym: "0x4" "4"
20596599-20596699 usb_power_delivery: sym: "0xE" "E"
20596699-20596801 usb_power_delivery: sym: "0x0" "0"
20596401-20596801 usb_power_delivery: header: "H:0e4a" "HD"
20594720-20597739 usb_power_delivery: snk: "(r2) SNK[7]: PR SWAP" "PR SWAP"
20596801-20596899 usb_power_delivery: sym: "0x7" "7"
20596899-20597001 usb_power_delivery: sym: "0x7" "7"
20597001-20597099 usb_power_delivery: sym: "0x8" "8"
20597099-20597199 usb_power_delivery: sym: "0x9" "9"
20597199-20597301 usb_power_delivery: sym: "0x7" "7"
20597301-20597399 usb_power_delivery: sym: "0xF" "F"
20597399-20597499 usb_power_delivery: sym: "0xC" "C"
20597499-20597599 usb_power_delivery: sym: "0xA" "A"
20596801-20597599 usb_power_delivery: crc: "CRC:acf79877" "CRC"
20597599-20597699 usb_power_delivery: sym: "EOP" "#"
20597599-20597699 usb_power_delivery: eop: "EOP" "E"
20594720-20597699 usb_power_delivery: text: "#121  (3432.453333ms): (r2) SNK[7]: PR SWAP" "..."
20598369-20599644 usb_power_delivery: preamble: "Preamble" "..."
20599644-20599742 usb_power_delivery: sym: "SYNC-1" "S1"
20599742-20599844 usb_power_delivery: sym: "SYNC-1" "S1"
20599844-20599942 usb_power_delivery: sym: "SYNC-1" "S1"
20599942-20600044 usb_power_delivery: sym: "SYNC-2" "S2"
20599644-20600044 usb_power_delivery: sop: "SOP" "S"
20600044-20600142 usb_power_delivery: sym: "0x1" "1"
20600142-20600242 usb_power_delivery: sym: "0x6" "6"
20600242-20600344 usb_power_delivery: sym: "0xF" "F"
20600344-20600442 usb_power_delivery: sym: "0x0" "0"
20600044-20600442 usb_power_delivery: header: "H:0f61" "HD"
20598369-20601363 usb_power_delivery: src: "(r2) SRC[7]: GOOD CRC" "GOOD CRC"
20600442-20600544 usb_power_delivery: sym: "0x8" "8"
20600544-20600642 usb_power_delivery: sym: "0x8" "8"
20600642-20600742 usb_power_delivery: sym: "0x5" "5"
20600742-20600842 usb_power_delivery: sym: "0x5" "5"
20600842-20600944 usb_power_delivery: sym: "0x0" "0"
20600944-20601042 usb_power_delivery: sym: "0x8" "8"
20601042-20601144 usb_power_delivery: sym: "0xD" "D"
20601144-20601244 usb_power_delivery: sym: "0xA" "A"
20600442-20601244 usb_power_delivery: crc: "CRC:ad805588" "CRC"
20601244-20601344 usb_power_delivery: sym: "EOP" "#"
20601244-20601344 usb_power_delivery: eop: "EOP" "E"
20598369-20601344 usb_power_delivery: text: "#122  (3433.061500ms): (r2) SRC[7]: GOOD CRC" "..."
20602481-20603756 usb_power_delivery: preamble: "Preamble" "..."
20603756-20603854 usb_power_delivery: sym: "SYNC-1" "S1"
20603854-20603956 usb_power_delivery: sym: "SYNC-1" "S1"
20603956-20604054 usb_power_delivery: sym: "SYNC-1" "S1"
20604054-20604156 usb_power_delivery: sym: "SYNC-2" "S2"
20603756-20604156 usb_power_delivery: sop: "SOP" "S"
20604156-20604256 usb_power_delivery: sym: "0x3" "3"
20604256-20604356 usb_power_delivery: sym: "0x6" "6"
20604356-20604456 usb_power_delivery: sym: "0x3" "3"
20604456-20604555 usb_power_delivery: sym: "0x0" "0"
20604156-20604555 usb_power_delivery: header: "H:0363" "HD"
20602481-20605495 usb_power_delivery: src: "(r2) SRC[1]: ACCEPT" "ACCEPT"
20604555-20604656 usb_power_delivery: sym: "0x1" "1"
20604656-20604755 usb_power_delivery: sym: "0x2" "2"
20604755-20604856 usb_power_delivery: sym: "0xB" "B"
20604856-20604955 usb_power_delivery: sym: "0x7" "7"
20604955-20605056 usb_power_delivery: sym: "0x0" "0"
20605056-20605155 usb_power_delivery: sym: "0x0" "0"
20605155-20605255 usb_power_delivery: sym: "0x6" "6"
20605255-20605355 usb_power_delivery: sym: "0x9" "9"
20604555-20605355 usb_power_delivery: crc: "CRC:96007b21" "CRC"
20605355-20605455 usb_power_delivery: sym: "EOP" "#"
20605355-20605455 usb_power_delivery: eop: "EOP" "E"
20602481-20605455 usb_power_delivery: text: "#123  (3433.746833ms): (r2) SRC[1]: ACCEPT" "..."
20606320-20607602 usb_power_delivery: preamble: "Preamble" "..."
20607602-20607699 usb_power_delivery: sym: "SYNC-1" "S1"
20607699-20607802 usb_power_delivery: sym: "SYNC-1" "S1"
20607802-20607900 usb_power_delivery: sym: "SYNC-1" "S1"
20607900-20608002 usb_power_delivery: sym: "SYNC-2" "S2"
20607602-20608002 usb_power_delivery: sop: "SOP" "S"
20608002-20608100 usb_power_delivery: sym: "0x1" "1"
20608100-20608202 usb_power_delivery: sym: "0x4" "4"
20608202-20608300 usb_power_delivery: sym: "0x2" "2"
20608300-20608402 usb_power_delivery: sym: "0x0" "0"
20608002-20608402 usb_power_delivery: header: "H:0241" "HD"
20606320-20609340 usb_power_delivery: snk: "(r2) SNK[1]: GOOD CRC" "GOOD CRC"
20608402-20608500 usb_power_delivery: sym: "0x7" "7"
20608500-20608600 usb_power_delivery: sym: "0x9" "9"
20608600-20608702 usb_power_delivery: sym: "0xD" "D"
20608702-20608800 usb_power_delivery: sym: "0x0" "0"
20608800-20608900 usb_power_delivery: sym: "0x5" "5"
20608900-20609002 usb_power_delivery: sym: "0xB" "B"
20609002-20609102 usb_power_delivery: sym: "0x6" "6"
20609102-20609200 usb_power_delivery: sym: "0x4" "4"
20608402-20609200 usb_power_delivery: crc: "CRC:46b50d97" "CRC"
20609200-20609300 usb_power_delivery: sym: "EOP" "#"
20609200-20609300 usb_power_delivery: eop: "EOP" "E"
20606320-20609300 usb_power_delivery: text: "#124  (3434.386667ms): (r2) SNK[1]: GOOD CRC" "..."
21911215-21912497 usb_power_delivery: preamble: "Preamble" "..."
21912497-21912595 usb_power_delivery: sym: "SYNC-1" "S1"
21912595-21912697 usb_power_delivery: sym: "SYNC-1" "S1"
21912697-21912795 usb_power_delivery: sym: "SYNC-1" "S1"
21912795-21912897 usb_power_delivery: sym: "SYNC-2" "S2"
21912497-21912897 usb_power_delivery: sop: "SOP" "S"
21912897-21912997 usb_power_delivery: sym: "0x6" "6"
21912997-21913095 usb_power_delivery: sym: "0x4" "4"
21913095-21913197 usb_power_delivery: sym: "0x1" "1"
21913197-21913295 usb_power_delivery: sym: "0x0" "0"
21912897-21913295 usb_power_delivery: header: "H:0146" "HD"
21911215-21914216 usb_power_delivery: src: "(r2) SRC/UFP[0]: PS RDY" "PS RDY"
21913295-21913395 usb_power_delivery: sym: "0xA" "A"
21913395-21913495 usb_power_delivery: sym: "0xE" "E"
21913495-21913595 usb_power_delivery: sym: "0xA" "A"
21913595-21913695 usb_power_delivery: sym: "0xC" "C"
21913695-21913797 usb_power_delivery: sym: "0xD" "D"
21913797-21913895 usb_power_delivery: sym: "0xF" "F"
21913895-21913997 usb_power_delivery: sym: "0x0" "0"
21913997-21914097 usb_power_delivery: sym: "0x9" "9"
21913295-21914097 usb_power_delivery: crc: "CRC:90fdcaea" "CRC"
21914097-21914197 usb_power_delivery: sym: "EOP" "#"
21914097-21914197 usb_power_delivery: eop: "EOP" "E"
21911215-21914197 usb_power_delivery: text: "#125  (3651.869167ms): (r2) SRC/UFP[0]: PS RDY" "..."
21914863-21916139 usb_power_delivery: preamble: "Preamble" "..."
21916139-21916237 usb_power_delivery: sym: "SYNC-1" "S1"
21916237-21916339 usb_power_delivery: sym: "SYNC-1" "S1"
21916339-21916437 usb_power_delivery: sym: "SYNC-1" "S1"
21916437-21916539 usb_power_delivery: sym: "SYNC-2" "S2"
21916139-21916539 usb_power_delivery: sop: "SOP" "S"
21916539-21916637 usb_power_delivery: sym: "0x1" "1"
21916637-21916737 usb_power_delivery: sym: "0x6" "6"
21916737-21916839 usb_power_delivery: sym: "0x0" "0"
21916839-21916937 usb_power_delivery: sym: "0x0" "0"
21916539-21916937 usb_power_delivery: header: "H:0061" "HD"
21914863-21917858 usb_power_delivery: snk: "(r2) SNK/DFP[0]: GOOD CRC" "GOOD CRC"
21916937-21917037 usb_power_delivery: sym: "0x9" "9"
21917037-21917139 usb_power_delivery: sym: "0x1" "1"
21917139-21917237 usb_power_delivery: sym: "0x8" "8"
21917237-21917339 usb_power_delivery: sym: "0x4" "4"
21917339-21917437 usb_power_delivery: sym: "0xF" "F"
21917437-21917537 usb_power_delivery: sym: "0x3" "3"
21917537-21917639 usb_power_delivery: sym: "0xD" "D"
21917639-21917739 usb_power_delivery: sym: "0x3" "3"
21916937-21917739 usb_power_delivery: crc: "CRC:3d3f4819" "CRC"
21917739-21917839 usb_power_delivery: sym: "EOP" "#"
21917739-21917839 usb_power_delivery: eop: "EOP" "E"
21914863-21917839 usb_power_delivery: text: "#126  (3652.477167ms): (r2) SNK/DFP[0]: GOOD CRC" "..."
22063527-22064808 usb_power_delivery: preamble: "Preamble" "..."
22064808-22064906 usb_power_delivery: sym: "SYNC-1" "S1"
22064906-22065008 usb_power_delivery: sym: "SYNC-1" "S1"
22065008-22065106 usb_power_delivery: sym: "SYNC-1" "S1"
22065106-22065208 usb_power_delivery: sym: "SYNC-2" "S2"
22064808-22065208 usb_power_delivery: sop: "SOP" "S"
22065208-22065306 usb_power_delivery: sym: "0x1" "1"
22065306-22065408 usb_power_delivery: sym: "0x4" "4"
22065408-22065506 usb_power_delivery: sym: "0x1" "1"
22065506-22065606 usb_power_delivery: sym: "0x5" "5"
22065208-22065606 usb_power_delivery: header: "H:5141" "HD"
22063527-22070547 usb_power_delivery: src: "(r2) SRC/UFP[0]: SOURCE CAP" "SOURCE CAP"
22065606-22065708 usb_power_delivery: sym: "0x2" "2"
22065708-22065808 usb_power_delivery: sym: "0x3" "3"
22065808-22065906 usb_power_delivery: sym: "0x0" "0"
22065906-22066006 usb_power_delivery: sym: "0x9" "9"
22066006-22066108 usb_power_delivery: sym: "0x1" "1"
22066108-22066207 usb_power_delivery: sym: "0x0" "0"
22066207-22066307 usb_power_delivery: sym: "0xE" "E"
22066307-22066407 usb_power_delivery: sym: "0x3" "3"
22065606-22066407 usb_power_delivery: data: "[0]3e019032" "D0"
22065606-22066407 usb_power_delivery: payload: "[1] [Fixed] 5V 0.5A (2.5W) [dual_role_power] [suspend] [unconstrained] [comm_cap] [dual_role_data]" "[1] [Fixed] 5V 0.5A (2.5W) [dual_role_power] [suspend] [unconstrained] [comm_cap] [dual_role_data]"
22066407-22066508 usb_power_delivery: sym: "0x4" "4"
22066508-22066607 usb_power_delivery: sym: "0xF" "F"
22066607-22066709 usb_power_delivery: sym: "0x0" "0"
22066709-22066807 usb_power_delivery: sym: "0xD" "D"
22066807-22066909 usb_power_delivery: sym: "0x2" "2"
22066909-22067007 usb_power_delivery: sym: "0x0" "0"
22067007-22067109 usb_power_delivery: sym: "0x0" "0"
22067109-22067207 usb_power_delivery: sym: "0x0" "0"
22066407-22067207 usb_power_delivery: data: "[1]0002d0f4" "D1"
22066407-22067207 usb_power_delivery: payload: "[2] [Fixed] 9V 2.44A (21.96W)" "[2] [Fixed] 9V 2.44A (21.96W)"
22067207-22067309 usb_power_delivery: sym: "0x0" "0"
22067309-22067407 usb_power_delivery: sym: "0xD" "D"
22067407-22067509 usb_power_delivery: sym: "0x0" "0"
22067509-22067609 usb_power_delivery: sym: "0xC" "C"
22067609-22067709 usb_power_delivery: sym: "0x3" "3"
22067709-22067807 usb_power_delivery: sym: "0x0" "0"
22067807-22067909 usb_power_delivery: sym: "0x0" "0"
22067909-22068007 usb_power_delivery: sym: "0x0" "0"
22067207-22068007 usb_power_delivery: data: "[2]0003c0d0" "D2"
22067207-22068007 usb_power_delivery: payload: "[3] [Fixed] 12V 2.08A (24.96W)" "[3] [Fixed] 12V 2.08A (24.96W)"
22068007-22068109 usb_power_delivery: sym: "0x7" "7"
22068109-22068209 usb_power_delivery: sym: "0xA" "A"
22068209-22068307 usb_power_delivery: sym: "0x0" "0"
22068307-22068409 usb_power_delivery: sym: "0xB" "B"
22068409-22068507 usb_power_delivery: sym: "0x4" "4"
22068507-22068609 usb_power_delivery: sym: "0x0" "0"
22068609-22068707 usb_power_delivery: sym: "0x0" "0"
22068707-22068809 usb_power_delivery: sym: "0x0" "0"
22068007-22068809 usb_power_delivery: data: "[3]0004b0a7" "D3"
22068007-22068809 usb_power_delivery: payload: "[4] [Fixed] 15V 1.67A (25.05W)" "[4] [Fixed] 15V 1.67A (25.05W)"
22068809-22068907 usb_power_delivery: sym: "0x4" "4"
22068907-22069007 usb_power_delivery: sym: "0x6" "6"
22069007-22069109 usb_power_delivery: sym: "0x0" "0"
22069109-22069207 usb_power_delivery: sym: "0x4" "4"
22069207-22069307 usb_power_delivery: sym: "0x6" "6"
22069307-22069409 usb_power_delivery: sym: "0x0" "0"
22069409-22069507 usb_power_delivery: sym: "0x0" "0"
22069507-22069609 usb_power_delivery: sym: "0x0" "0"
22068809-22069609 usb_power_delivery: data: "[4]00064064" "D4"
22068809-22069609 usb_power_delivery: payload: "[5] [Fixed] 20V 1A (20W)" "[5] [Fixed] 20V 1A (20W)"
22069609-22069709 usb_power_delivery: sym: "0xC" "C"
22069709-22069807 usb_power_delivery: sym: "0x8" "8"
22069807-22069909 usb_power_delivery: sym: "0x8" "8"
22069909-22070009 usb_power_delivery: sym: "0x6" "6"
22070009-22070109 usb_power_delivery: sym: "0x3" "3"
22070109-22070209 usb_power_delivery: sym: "0xA" "A"
22070209-22070307 usb_power_delivery: sym: "0x2" "2"
22070307-22070407 usb_power_delivery: sym: "0x9" "9"
22069609-22070407 usb_power_delivery: crc: "CRC:92a3688c" "CRC"
22070407-22070507 usb_power_delivery: sym: "EOP" "#"
22070407-22070507 usb_power_delivery: eop: "EOP" "E"
22063527-22070507 usb_power_delivery: text: "#127  (3677.254500ms): (r2) SRC/UFP[0]: SOURCE CAP - [1] [Fixed] 5V 0.5A (2.5W) [dual_role_power] [suspend] [unconstrained] [comm_cap] [dual_role_data] - [2] [Fixed] 9V 2.44A (21.96W) - [3] [Fixed] 12V 2.08A (24.96W) - [4] [Fixed] 15V 1.67A (25.05W) - [5] [Fixed] 20V 1A (20W)" "..."
22071171-22072447 usb_power_delivery: preamble: "Preamble" "..."
22072447-22072545 usb_power_delivery: sym: "SYNC-1" "S1"
22072545-22072647 usb_power_delivery: sym: "SYNC-1" "S1"
22072647-22072746 usb_power_delivery: sym: "SYNC-1" "S1"
22072746-22072847 usb_power_delivery: sym: "SYNC-2" "S2"
22072447-22072847 usb_power_delivery: sop: "SOP" "S"
22072847-22072946 usb_power_delivery: sym: "0x1" "1"
22072946-22073046 usb_power_delivery: sym: "0x6" "6"
22073046-22073147 usb_power_delivery: sym: "0x0" "0"
22073147-22073246 usb_power_delivery: sym: "0x0" "0"
22072847-22073246 usb_power_delivery: header: "H:0061" "HD"
22071171-22074166 usb_power_delivery: snk: "(r2) SNK/DFP[0]: GOOD CRC" "GOOD CRC"
22073246-22073346 usb_power_delivery: sym: "0x9" "9"
22073346-22073447 usb_power_delivery: sym: "0x1" "1"
22073447-22073546 usb_power_delivery: sym: "0x8" "8"
22073546-22073647 usb_power_delivery: sym: "0x4" "4"
22073647-22073746 usb_power_delivery: sym: "0xF" "F"
22073746-22073846 usb_power_delivery: sym: "0x3" "3"
22073846-22073947 usb_power_delivery: sym: "0xD" "D"
22073947-22074047 usb_power_delivery: sym: "0x3" "3"
22073246-22074047 usb_power_delivery: crc: "CRC:3d3f4819" "CRC"
22074047-22074147 usb_power_delivery: sym: "EOP" "#"
22074047-22074147 usb_power_delivery: eop: "EOP" "E"
22071171-22074147 usb_power_delivery: text: "#128  (3678.528500ms): (r2) SNK/DFP[0]: GOOD CRC" "..."
22080827-22082104 usb_power_delivery: preamble: "Preamble" "..."
22082104-22082202 usb_power_delivery: sym: "SYNC-1" "S1"
22082202-22082304 usb_power_delivery: sym: "SYNC-1" "S1"
22082304-22082402 usb_power_delivery: sym: "SYNC-1" "S1"
22082402-22082504 usb_power_delivery: sym: "SYNC-2" "S2"
22082104-22082504 usb_power_delivery: sop: "SOP" "S"
22082504-22082602 usb_power_delivery: sym: "0x2" "2"
22082602-22082702 usb_power_delivery: sym: "0x6" "6"
22082702-22082804 usb_power_delivery: sym: "0x0" "0"
22082804-22082902 usb_power_delivery: sym: "0x1" "1"
22082504-22082902 usb_power_delivery: header: "H:1062" "HD"
22080827-22084642 usb_power_delivery: snk: "(r2) SNK/DFP[0]: REQUEST" "REQUEST"
22082902-22083004 usb_power_delivery: sym: "0x8" "8"
22083004-22083104 usb_power_delivery: sym: "0xC" "C"
22083104-22083202 usb_power_delivery: sym: "0x0" "0"
22083202-22083304 usb_power_delivery: sym: "0x2" "2"
22083304-22083404 usb_power_delivery: sym: "0x3" "3"
22083404-22083502 usb_power_delivery: sym: "0x0" "0"
22083502-22083602 usb_power_delivery: sym: "0x3" "3"
22083602-22083702 usb_power_delivery: sym: "0x3" "3"
22082902-22083702 usb_power_delivery: data: "[0]330320c8" "D0"
22082902-22083702 usb_power_delivery: payload: "[1] (PDO #3: Fixed 12V) 2A (operating) / 2A (max) [comm_cap] [no_suspend]" "[1] (PDO #3: Fixed 12V) 2A (operating) / 2A (max) [comm_cap] [no_suspend]"
22083702-22083802 usb_power_delivery: sym: "0xC" "C"
22083802-22083902 usb_power_delivery: sym: "0xA" "A"
22083902-22084002 usb_power_delivery: sym: "0xA" "A"
22084002-22084104 usb_power_delivery: sym: "0x2" "2"
22084104-22084202 usb_power_delivery: sym: "0x7" "7"
22084202-22084302 usb_power_delivery: sym: "0x5" "5"
22084302-22084404 usb_power_delivery: sym: "0xB" "B"
22084404-22084502 usb_power_delivery: sym: "0x8" "8"
22083702-22084502 usb_power_delivery: crc: "CRC:8b572aac" "CRC"
22084502-22084602 usb_power_delivery: sym: "EOP" "#"
22084502-22084602 usb_power_delivery: eop: "EOP" "E"
22080827-22084602 usb_power_delivery: text: "#129  (3680.137833ms): (r2) SNK/DFP[0]: REQUEST - [1] (PDO #3: Fixed 12V) 2A (operating) / 2A (max) [comm_cap] [no_suspend]" "..."
22085428-22086710 usb_power_delivery: preamble: "Preamble" "..."
22086710-22086808 usb_power_delivery: sym: "SYNC-1" "S1"
22086808-22086910 usb_power_delivery: sym: "SYNC-1" "S1"
22086910-22087008 usb_power_delivery: sym: "SYNC-1" "S1"
22087008-22087110 usb_power_delivery: sym: "SYNC-2" "S2"
22086710-22087110 usb_power_delivery: sop: "SOP" "S"
22087110-22087208 usb_power_delivery: sym: "0x1" "1"
22087208-22087310 usb_power_delivery: sym: "0x4" "4"
22087310-22087408 usb_power_delivery: sym: "0x1" "1"
22087408-22087510 usb_power_delivery: sym: "0x0" "0"
22087110-22087510 usb_power_delivery: header: "H:0141" "HD"
22085428-22088449 usb_power_delivery: src: "(r2) SRC/UFP[0]: GOOD CRC" "GOOD CRC"
22087510-22087608 usb_power_delivery: sym: "0xD" "D"
22087608-22087710 usb_power_delivery: sym: "0x2" "2"
22087710-22087810 usb_power_delivery: sym: "0xC" "C"
22087810-22087910 usb_power_delivery: sym: "0x5" "5"
22087910-22088010 usb_power_delivery: sym: "0xC" "C"
22088010-22088108 usb_power_delivery: sym: "0xB" "B"
22088108-22088210 usb_power_delivery: sym: "0xF" "F"
22088210-22088308 usb_power_delivery: sym: "0xD" "D"
22087510-22088308 usb_power_delivery: crc: "CRC:dfbc5c2d" "CRC"
22088308-22088408 usb_power_delivery: sym: "EOP" "#"
22088308-22088408 usb_power_delivery: eop: "EOP" "E"
22085428-22088408 usb_power_delivery: text: "#130  (3680.904667ms): (r2) SRC/UFP[0]: GOOD CRC" "..."
22106530-22107812 usb_power_delivery: preamble: "Preamble" "..."
22107812-22107910 usb_power_delivery: sym: "SYNC-1" "S1"
22107910-22108012 usb_power_delivery: sym: "SYNC-1" "S1"
22108012-22108110 usb_power_delivery: sym: "SYNC-1" "S1"
22108110-22108212 usb_power_delivery: sym: "SYNC-2" "S2"
22107812-22108212 usb_power_delivery: sop: "SOP" "S"
22108212-22108312 usb_power_delivery: sym: "0x3" "3"
22108312-22108410 usb_power_delivery: sym: "0x4" "4"
22108410-22108510 usb_power_delivery: sym: "0x3" "3"
22108510-22108612 usb_power_delivery: sym: "0x0" "0"
22108212-22108612 usb_power_delivery: header: "H:0343" "HD"
22106530-22109550 usb_power_delivery: src: "(r2) SRC/UFP[1]: ACCEPT" "ACCEPT"
22108612-22108712 usb_power_delivery: sym: "0x3" "3"
22108712-22108810 usb_power_delivery: sym: "0x8" "8"
22108810-22108912 usb_power_delivery: sym: "0xF" "F"
22108912-22109012 usb_power_delivery: sym: "0x5" "5"
22109012-22109110 usb_power_delivery: sym: "0x4" "4"
22109110-22109212 usb_power_delivery: sym: "0x8" "8"
22109212-22109312 usb_power_delivery: sym: "0x3" "3"
22109312-22109410 usb_power_delivery: sym: "0x0" "0"
22108612-22109410 usb_power_delivery: crc: "CRC:03845f83" "CRC"
22109410-22109510 usb_power_delivery: sym: "EOP" "#"
22109410-22109510 usb_power_delivery: eop: "EOP" "E"
22106530-22109510 usb_power_delivery: text: "#131  (3684.421667ms): (r2) SRC/UFP[1]: ACCEPT" "..."
22110177-22111454 usb_power_delivery: preamble: "Preamble" "..."
22111454-22111552 usb_power_delivery: sym: "SYNC-1" "S1"
22111552-22111654 usb_power_delivery: sym: "SYNC-1" "S1"
22111654-22111752 usb_power_delivery: sym: "SYNC-1" "S1"
22111752-22111854 usb_power_delivery: sym: "SYNC-2" "S2"
22111454-22111854 usb_power_delivery: sop: "SOP" "S"
22111854-22111952 usb_power_delivery: sym: "0x1" "1"
22111952-22112052 usb_power_delivery: sym: "0x6" "6"
22112052-22112154 usb_power_delivery: sym: "0x2" "2"
22112154-22112252 usb_power_delivery: sym: "0x0" "0"
22111854-22112252 usb_power_delivery: header: "H:0261" "HD"
22110177-22113172 usb_power_delivery: snk: "(r2) SNK/DFP[1]: GOOD CRC" "GOOD CRC"
22112252-22112352 usb_power_delivery: sym: "0x5" "5"
22112352-22112452 usb_power_delivery: sym: "0x3" "3"
22112452-22112552 usb_power_delivery: sym: "0x9" "9"
22112552-22112654 usb_power_delivery: sym: "0x2" "2"
22112654-22112752 usb_power_delivery: sym: "0x1" "1"
22112752-22112852 usb_power_delivery: sym: "0x3" "3"
22112852-22112952 usb_power_delivery: sym: "0x3" "3"
22112952-22113054 usb_power_delivery: sym: "0xD" "D"
22112252-22113054 usb_power_delivery: crc: "CRC:d3312935" "CRC"
22113054-22113154 usb_power_delivery: sym: "EOP" "#"
22113054-22113154 usb_power_delivery: eop: "EOP" "E"
22110177-22113154 usb_power_delivery: text: "#132  (3685.029500ms): (r2) SNK/DFP[1]: GOOD CRC" "..."
22369949-22371231 usb_power_delivery: preamble: "Preamble" "..."
22371231-22371329 usb_power_delivery: sym: "SYNC-1" "S1"
22371329-22371431 usb_power_delivery: sym: "SYNC-1" "S1"
22371431-22371529 usb_power_delivery: sym: "SYNC-1" "S1"
22371529-22371631 usb_power_delivery: sym: "SYNC-2" "S2"
22371231-22371631 usb_power_delivery: sop: "SOP" "S"
22371631-22371731 usb_power_delivery: sym: "0x6" "6"
22371731-22371829 usb_power_delivery: sym: "0x4" "4"
22371829-22371929 usb_power_delivery: sym: "0x5" "5"
22371929-22372031 usb_power_delivery: sym: "0x0" "0"
22371631-22372031 usb_power_delivery: header: "H:0546" "HD"
22369949-22372950 usb_power_delivery: src: "(r2) SRC/UFP[2]: PS RDY" "PS RDY"
22372031-22372131 usb_power_delivery: sym: "0x3" "3"
22372131-22372229 usb_power_delivery: sym: "0xF" "F"
22372229-22372329 usb_power_delivery: sym: "0xE" "E"
22372329-22372431 usb_power_delivery: sym: "0x0" "0"
22372431-22372529 usb_power_delivery: sym: "0x0" "0"
22372529-22372629 usb_power_delivery: sym: "0x9" "9"
22372629-22372731 usb_power_delivery: sym: "0x7" "7"
22372731-22372831 usb_power_delivery: sym: "0x9" "9"
22372031-22372831 usb_power_delivery: crc: "CRC:97900ef3" "CRC"
22372831-22372931 usb_power_delivery: sym: "EOP" "#"
22372831-22372931 usb_power_delivery: eop: "EOP" "E"
22369949-22372931 usb_power_delivery: text: "#133  (3728.324833ms): (r2) SRC/UFP[2]: PS RDY" "..."
22373598-22374874 usb_power_delivery: preamble: "Preamble" "..."
22374874-22374972 usb_power_delivery: sym: "SYNC-1" "S1"
22374972-22375074 usb_power_delivery: sym: "SYNC-1" "S1"
22375074-22375172 usb_power_delivery: sym: "SYNC-1" "S1"
22375172-22375274 usb_power_delivery: sym: "SYNC-2" "S2"
22374874-22375274 usb_power_delivery: sop: "SOP" "S"
22375274-22375372 usb_power_delivery: sym: "0x1" "1"
22375372-22375472 usb_power_delivery: sym: "0x6" "6"
22375472-22375574 usb_power_delivery: sym: "0x4" "4"
22375574-22375672 usb_power_delivery: sym: "0x0" "0"
22375274-22375672 usb_power_delivery: header: "H:0461" "HD"
22373598-22376613 usb_power_delivery: snk: "(r2) SNK/DFP[2]: GOOD CRC" "GOOD CRC"
22375672-22375774 usb_power_delivery: sym: "0x0" "0"
22375774-22375872 usb_power_delivery: sym: "0x0" "0"
22375872-22375972 usb_power_delivery: sym: "0xC" "C"
22375972-22376074 usb_power_delivery: sym: "0x8" "8"
22376074-22376172 usb_power_delivery: sym: "0x2" "2"
22376172-22376272 usb_power_delivery: sym: "0x5" "5"
22376272-22376372 usb_power_delivery: sym: "0xA" "A"
22376372-22376472 usb_power_delivery: sym: "0x3" "3"
22375672-22376472 usb_power_delivery: crc: "CRC:3a528c00" "CRC"
22376472-22376572 usb_power_delivery: sym: "EOP" "#"
22376472-22376572 usb_power_delivery: eop: "EOP" "E"
22373598-22376572 usb_power_delivery: text: "#134  (3728.933000ms): (r2) SNK/DFP[2]: GOOD CRC" "..."
23151506-23152788 usb_power_delivery: preamble: "Preamble" "..."
23152788-23152886 usb_power_delivery: sym: "SYNC-1" "S1"
23152886-23152988 usb_power_delivery: sym: "SYNC-1" "S1"
23152988-23153086 usb_power_delivery: sym: "SYNC-1" "S1"
23153086-23153188 usb_power_delivery: sym: "SYNC-2" "S2"
23152788-23153188 usb_power_delivery: sop: "SOP" "S"
23153188-23153286 usb_power_delivery: sym: "0x8" "8"
23153286-23153388 usb_power_delivery: sym: "0x4" "4"
23153388-23153486 usb_power_delivery: sym: "0x7" "7"
23153486-23153588 usb_power_delivery: sym: "0x0" "0"
23153188-23153588 usb_power_delivery: header: "H:0748" "HD"
23151506-23154507 usb_power_delivery: src: "(r2) SRC/UFP[3]: GET SINK CAP" "GET SINK CAP"
23153588-23153686 usb_power_delivery: sym: "0x1" "1"
23153686-23153786 usb_power_delivery: sym: "0x5" "5"
23153786-23153888 usb_power_delivery: sym: "0x2" "2"
23153888-23153986 usb_power_delivery: sym: "0x4" "4"
23153986-23154088 usb_power_delivery: sym: "0xD" "D"
23154088-23154186 usb_power_delivery: sym: "0x1" "1"
23154186-23154288 usb_power_delivery: sym: "0x7" "7"
23154288-23154388 usb_power_delivery: sym: "0xE" "E"
23153588-23154388 usb_power_delivery: crc: "CRC:e71d4251" "CRC"
23154388-23154488 usb_power_delivery: sym: "EOP" "#"
23154388-23154488 usb_power_delivery: eop: "EOP" "E"
23151506-23154488 usb_power_delivery: text: "#135  (3858.584333ms): (r2) SRC/UFP[3]: GET SINK CAP" "..."
23155155-23156431 usb_power_delivery: preamble: "Preamble" "..."
23156431-23156529 usb_power_delivery: sym: "SYNC-1" "S1"
23156529-23156631 usb_power_delivery: sym: "SYNC-1" "S1"
23156631-23156729 usb_power_delivery: sym: "SYNC-1" "S1"
23156729-23156831 usb_power_delivery: sym: "SYNC-2" "S2"
23156431-23156831 usb_power_delivery: sop: "SOP" "S"
23156831-23156929 usb_power_delivery: sym: "0x1" "1"
23156929-23157029 usb_power_delivery: sym: "0x6" "6"
23157029-23157129 usb_power_delivery: sym: "0x6" "6"
23157129-23157231 usb_power_delivery: sym: "0x0" "0"
23156831-23157231 usb_power_delivery: header: "H:0661" "HD"
23155155-23158150 usb_power_delivery: snk: "(r2) SNK/DFP[3]: GOOD CRC" "GOOD CRC"
23157231-23157331 usb_power_delivery: sym: "0xC" "C"
23157331-23157429 usb_power_delivery: sym: "0x2" "2"
23157429-23157531 usb_power_delivery: sym: "0xD" "D"
23157531-23157631 usb_power_delivery: sym: "0xE" "E"
23157631-23157731 usb_power_delivery: sym: "0xC" "C"
23157731-23157831 usb_power_delivery: sym: "0x5" "5"
23157831-23157930 usb_power_delivery: sym: "0x4" "4"
23157930-23158031 usb_power_delivery: sym: "0xD" "D"
23157231-23158031 usb_power_delivery: crc: "CRC:d45ced2c" "CRC"
23158031-23158131 usb_power_delivery: sym: "EOP" "#"
23158031-23158131 usb_power_delivery: eop: "EOP" "E"
23155155-23158131 usb_power_delivery: text: "#136  (3859.192500ms): (r2) SNK/DFP[3]: GOOD CRC" "..."
23159255-23160532 usb_power_delivery: preamble: "Preamble" "..."
23160532-23160630 usb_power_delivery: sym: "SYNC-1" "S1"
23160630-23160732 usb_power_delivery: sym: "SYNC-1" "S1"
23160732-23160830 usb_power_delivery: sym: "SYNC-1" "S1"
23160830-23160932 usb_power_delivery: sym: "SYNC-2" "S2"
23160532-23160932 usb_power_delivery: sop: "SOP" "S"
23160932-23161030 usb_power_delivery: sym: "0x4" "4"
23161030-23161130 usb_power_delivery: sym: "0x6" "6"
23161130-23161232 usb_power_delivery: sym: "0x2" "2"
23161232-23161332 usb_power_delivery: sym: "0x6" "6"
23160932-23161332 usb_power_delivery: header: "H:6264" "HD"
23159255-23167051 usb_power_delivery: snk: "(r2) SNK/DFP[1]: SINK CAP" "SINK CAP"
23161332-23161432 usb_power_delivery: sym: "0xC" "C"
23161432-23161530 usb_power_delivery: sym: "0x2" "2"
23161530-23161632 usb_power_delivery: sym: "0x1" "1"
23161632-23161732 usb_power_delivery: sym: "0x9" "9"
23161732-23161830 usb_power_delivery: sym: "0x1" "1"
23161830-23161932 usb_power_delivery: sym: "0x0" "0"
23161932-23162030 usb_power_delivery: sym: "0x4" "4"
23162030-23162130 usb_power_delivery: sym: "0x3" "3"
23161332-23162130 usb_power_delivery: data: "[0]3401912c" "D0"
23161332-23162130 usb_power_delivery: payload: "[1] [Fixed] 5V 3A (15W) [dual_role_power] [high_capability] [comm_cap]" "[1] [Fixed] 5V 3A (15W) [dual_role_power] [high_capability] [comm_cap]"
23162130-23162230 usb_power_delivery: sym: "0xC" "C"
23162230-23162332 usb_power_delivery: sym: "0x2" "2"
23162332-23162430 usb_power_delivery: sym: "0x1" "1"
23162430-23162532 usb_power_delivery: sym: "0xD" "D"
23162532-23162630 usb_power_delivery: sym: "0x2" "2"
23162630-23162730 usb_power_delivery: sym: "0xC" "C"
23162730-23162832 usb_power_delivery: sym: "0x2" "2"
23162832-23162932 usb_power_delivery: sym: "0x9" "9"
23162130-23162932 usb_power_delivery: data: "[1]92c2d12c" "D1"
23162130-23162932 usb_power_delivery: payload: "[2] [Variable] 9/15V 3A" "[2] [Variable] 9/15V 3A"
23162932-23163030 usb_power_delivery: sym: "0x1" "1"
23163030-23163130 usb_power_delivery: sym: "0xE" "E"
23163130-23163232 usb_power_delivery: sym: "0x0" "0"
23163232-23163330 usb_power_delivery: sym: "0x4" "4"
23163330-23163430 usb_power_delivery: sym: "0x6" "6"
23163430-23163532 usb_power_delivery: sym: "0x0" "0"
23163532-23163630 usb_power_delivery: sym: "0x0" "0"
23163630-23163732 usb_power_delivery: sym: "0x0" "0"
23162932-23163732 usb_power_delivery: data: "[2]000640e1" "D2"
23162932-23163732 usb_power_delivery: payload: "[3] [Fixed] 20V 2.25A (45W)" "[3] [Fixed] 20V 2.25A (45W)"
23163732-23163832 usb_power_delivery: sym: "0x5" "5"
23163832-23163930 usb_power_delivery: sym: "0x4" "4"
23163930-23164032 usb_power_delivery: sym: "0x1" "1"
23164032-23164130 usb_power_delivery: sym: "0x4" "4"
23164130-23164230 usb_power_delivery: sym: "0x6" "6"
23164230-23164332 usb_power_delivery: sym: "0x0" "0"
23164332-23164430 usb_power_delivery: sym: "0x0" "0"
23164430-23164532 usb_power_delivery: sym: "0x0" "0"
23163732-23164532 usb_power_delivery: data: "[3]00064145" "D3"
23163732-23164532 usb_power_delivery: payload: "[4] [Fixed] 20V 3.25A (65W)" "[4] [Fixed] 20V 3.25A (65W)"
23164532-23164630 usb_power_delivery: sym: "0x8" "8"
23164630-23164730 usb_power_delivery: sym: "0xC" "C"
23164730-23164832 usb_power_delivery: sym: "0x0" "0"
23164832-23164932 usb_power_delivery: sym: "0x9" "9"
23164932-23165030 usb_power_delivery: sym: "0x1" "1"
23165030-23165132 usb_power_delivery: sym: "0x0" "0"
23165132-23165230 usb_power_delivery: sym: "0x0" "0"
23165230-23165332 usb_power_delivery: sym: "0x0" "0"
23164532-23165332 usb_power_delivery: data: "[4]000190c8" "D4"
23164532-23165332 usb_power_delivery: payload: "[5] [Fixed] 5V 2A (10W)" "[5] [Fixed] 5V 2A (10W)"
23165332-23165430 usb_power_delivery: sym: "0x8" "8"
23165430-23165530 usb_power_delivery: sym: "0xC" "C"
23165530-23165632 usb_power_delivery: sym: "0x0" "0"
23165632-23165730 usb_power_delivery: sym: "0xD" "D"
23165730-23165832 usb_power_delivery: sym: "0x2" "2"
23165832-23165932 usb_power_delivery: sym: "0xC" "C"
23165932-23166030 usb_power_delivery: sym: "0x2" "2"
23166030-23166130 usb_power_delivery: sym: "0x9" "9"
23165332-23166130 usb_power_delivery: data: "[5]92c2d0c8" "D5"
23165332-23166130 usb_power_delivery: payload: "[6] [Variable] 9/15V 2A" "[6] [Variable] 9/15V 2A"
23166130-23166232 usb_power_delivery: sym: "0x7" "7"
23166232-23166330 usb_power_delivery: sym: "0x1" "1"
23166330-23166430 usb_power_delivery: sym: "0xE" "E"
23166430-23166532 usb_power_delivery: sym: "0x7" "7"
23166532-23166630 usb_power_delivery: sym: "0x8" "8"
23166630-23166730 usb_power_delivery: sym: "0x9" "9"
23166730-23166830 usb_power_delivery: sym: "0x5" "5"
23166830-23166932 usb_power_delivery: sym: "0xF" "F"
23166130-23166932 usb_power_delivery: crc: "CRC:f5987e17" "CRC"
23166932-23167032 usb_power_delivery: sym: "EOP" "#"
23166932-23167032 usb_power_delivery: eop: "EOP" "E"
23159255-23167032 usb_power_delivery: text: "#137  (3859.875833ms): (r2) SNK/DFP[1]: SINK CAP - [1] [Fixed] 5V 3A (15W) [dual_role_power] [high_capability] [comm_cap] - [2] [Variable] 9/15V 3A - [3] [Fixed] 20V 2.25A (45W) - [4] [Fixed] 20V 3.25A (65W) - [5] [Fixed] 5V 2A (10W) - [6] [Variable] 9/15V 2A" "..."
23167908-23169189 usb_power_delivery: preamble: "Preamble" "..."
23169189-23169287 usb_power_delivery: sym: "SYNC-1" "S1"
23169287-23169389 usb_power_delivery: sym: "SYNC-1" "S1"
23169389-23169487 usb_power_delivery: sym: "SYNC-1" "S1"
23169487-23169589 usb_power_delivery: sym: "SYNC-2" "S2"
23169189-23169589 usb_power_delivery: sop: "SOP" "S"
23169589-23169687 usb_power_delivery: sym: "0x1" "1"
23169687-23169789 usb_power_delivery: sym: "0x4" "4"
23169789-23169889 usb_power_delivery: sym: "0x3" "3"
23169889-23169987 usb_power_delivery: sym: "0x0" "0"
23169589-23169987 usb_power_delivery: header: "H:0341" "HD"
23167908-23170928 usb_power_delivery: src: "(r2) SRC/UFP[1]: GOOD CRC" "GOOD CRC"
23169987-23170089 usb_power_delivery: sym: "0x1" "1"
23170089-23170187 usb_power_delivery: sym: "0x0" "0"
23170187-23170289 usb_power_delivery: sym: "0xD" "D"
23170289-23170389 usb_power_delivery: sym: "0x3" "3"
23170389-23170487 usb_power_delivery: sym: "0x2" "2"
23170487-23170589 usb_power_delivery: sym: "0xB" "B"
23170589-23170688 usb_power_delivery: sym: "0x1" "1"
23170688-23170788 usb_power_delivery: sym: "0x3" "3"
23169987-23170788 usb_power_delivery: crc: "CRC:31b23d01" "CRC"
23170788-23170887 usb_power_delivery: sym: "EOP" "#"
23170788-23170887 usb_power_delivery: eop: "EOP" "E"
23167908-23170887 usb_power_delivery: text: "#138  (3861.318000ms): (r2) SRC/UFP[1]: GOOD CRC" "..."
