54518-55377 usb_power_delivery: preamble: "Preamble" "..."
55377-55443 usb_power_delivery: sym: "SYNC-1" "S1"
55443-55511 usb_power_delivery: sym: "SYNC-1" "S1"
55511-55577 usb_power_delivery: sym: "SYNC-3" "S3"
55577-55646 usb_power_delivery: sym: "SYNC-3" "S3"
55377-55646 usb_power_delivery: sop: "SOP'" "S"
55646-55711 usb_power_delivery: sym: "0xF" "F"
55711-55780 usb_power_delivery: sym: "0x4" "4"
55780-55845 usb_power_delivery: sym: "0x0" "0"
55845-55914 usb_power_delivery: sym: "0x1" "1"
55646-55914 usb_power_delivery: header: "H:104f" "HD"
54518-57067 usb_power_delivery: snk: "(r2) SNK[0]: VDM" "VDM"
55914-55979 usb_power_delivery: sym: "0x1" "1"
55979-56048 usb_power_delivery: sym: "0x0" "0"
56048-56114 usb_power_delivery: sym: "0x0" "0"
56114-56182 usb_power_delivery: sym: "0x8" "8"
56182-56248 usb_power_delivery: sym: "0x0" "0"
56248-56317 usb_power_delivery: sym: "0x0" "0"
56317-56382 usb_power_delivery: sym: "0xF" "F"
56382-56451 usb_power_delivery: sym: "0xF" "F"
55914-56451 usb_power_delivery: data: "[0]ff008001" "D0"
55914-56451 usb_power_delivery: payload: "[1] REQ Disc Ident  SVID:ff00" "[1] REQ Disc Ident  SVID:ff00"
56451-56516 usb_power_delivery: sym: "0x0" "0"
56516-56585 usb_power_delivery: sym: "0xF" "F"
56585-56650 usb_power_delivery: sym: "0xD" "D"
56650-56719 usb_power_delivery: sym: "0x1" "1"
56719-56785 usb_power_delivery: sym: "0x7" "7"
56785-56852 usb_power_delivery: sym: "0xA" "A"
56852-56921 usb_power_delivery: sym: "0xB" "B"
56921-56988 usb_power_delivery: sym: "0x5" "5"
56451-56988 usb_power_delivery: crc: "CRC:5ba71df0" "CRC"
56988-57055 usb_power_delivery: sym: "EOP" "#"
56988-57055 usb_power_delivery: eop: "EOP" "E"
54518-57055 usb_power_delivery: text: "#1    (13.629500ms): (r2) SNK[0]: VDM - [1] REQ Disc Ident  SVID:ff00" "..."
63685-64544 usb_power_delivery: preamble: "Preamble" "..."
64544-64609 usb_power_delivery: sym: "SYNC-1" "S1"
64609-64678 usb_power_delivery: sym: "SYNC-1" "S1"
64678-64743 usb_power_delivery: sym: "SYNC-1" "S1"
64743-64812 usb_power_delivery: sym: "SYNC-2" "S2"
64544-64812 usb_power_delivery: sop: "SOP" "S"
64812-64877 usb_power_delivery: sym: "0x1" "1"
64877-64945 usb_power_delivery: sym: "0x6" "6"
64945-65013 usb_power_delivery: sym: "0x1" "1"
65013-65079 usb_power_delivery: sym: "0x2" "2"
64812-65079 usb_power_delivery: header: "H:2161" "HD"
63685-66770 usb_power_delivery: src: "(r2) SRC[0]: SOURCE CAP" "SOURCE CAP"
65079-65146 usb_power_delivery: sym: "0xC" "C"
65146-65215 usb_power_delivery: sym: "0x2" "2"
65215-65280 usb_power_delivery: sym: "0x1" "1"
65280-65347 usb_power_delivery: sym: "0x9" "9"
65347-65416 usb_power_delivery: sym: "0x1" "1"
65416-65481 usb_power_delivery: sym: "0x0" "0"
65481-65550 usb_power_delivery: sym: "0x8" "8"
65550-65616 usb_power_delivery: sym: "0x2" "2"
65079-65616 usb_power_delivery: data: "[0]2801912c" "D0"
65079-65616 usb_power_delivery: payload: "[1] [Fixed] 5V 3A (15W) [dual_role_power] [unconstrained]" "[1] [Fixed] 5V 3A (15W) [dual_role_power] [unconstrained]"
65616-65684 usb_power_delivery: sym: "0x8" "8"
65684-65751 usb_power_delivery: sym: "0xC" "C"
65751-65817 usb_power_delivery: sym: "0x0" "0"
65817-65886 usb_power_delivery: sym: "0xB" "B"
65886-65951 usb_power_delivery: sym: "0x4" "4"
65951-66020 usb_power_delivery: sym: "0x0" "0"
66020-66085 usb_power_delivery: sym: "0x0" "0"
66085-66154 usb_power_delivery: sym: "0x0" "0"
65616-66154 usb_power_delivery: data: "[1]0004b0c8" "D1"
65616-66154 usb_power_delivery: payload: "[2] [Fixed] 15V 2A (30W)" "[2] [Fixed] 15V 2A (30W)"
66154-66219 usb_power_delivery: sym: "0x4" "4"
66219-66288 usb_power_delivery: sym: "0xD" "D"
66288-66354 usb_power_delivery: sym: "0x1" "1"
66354-66422 usb_power_delivery: sym: "0xD" "D"
66422-66490 usb_power_delivery: sym: "0x5" "5"
66490-66557 usb_power_delivery: sym: "0x6" "6"
66557-66622 usb_power_delivery: sym: "0x7" "7"
66622-66691 usb_power_delivery: sym: "0x8" "8"
66154-66691 usb_power_delivery: crc: "CRC:8765d1d4" "CRC"
66691-66758 usb_power_delivery: sym: "EOP" "#"
66691-66758 usb_power_delivery: eop: "EOP" "E"
63685-66758 usb_power_delivery: text: "#2    (15.921250ms): (r2) SRC[0]: SOURCE CAP - [1] [Fixed] 5V 3A (15W) [dual_role_power] [unconstrained] - [2] [Fixed] 15V 2A (30W)" "..."
67201-68051 usb_power_delivery: preamble: "Preamble" "..."
68051-68116 usb_power_delivery: sym: "SYNC-1" "S1"
68116-68184 usb_power_delivery: sym: "SYNC-1" "S1"
68184-68250 usb_power_delivery: sym: "SYNC-1" "S1"
68250-68318 usb_power_delivery: sym: "SYNC-2" "S2"
68051-68318 usb_power_delivery: sop: "SOP" "S"
68318-68383 usb_power_delivery: sym: "0x1" "1"
68383-68451 usb_power_delivery: sym: "0x4" "4"
68451-68516 usb_power_delivery: sym: "0x0" "0"
68516-68584 usb_power_delivery: sym: "0x0" "0"
68318-68584 usb_power_delivery: header: "H:0041" "HD"
67201-69210 usb_power_delivery: snk: "(r2) SNK[0]: GOOD CRC" "GOOD CRC"
68584-68650 usb_power_delivery: sym: "0xB" "B"
68650-68718 usb_power_delivery: sym: "0xB" "B"
68718-68784 usb_power_delivery: sym: "0xC" "C"
68784-68851 usb_power_delivery: sym: "0x6" "6"
68851-68916 usb_power_delivery: sym: "0xB" "B"
68916-68984 usb_power_delivery: sym: "0xB" "B"
68984-69050 usb_power_delivery: sym: "0x8" "8"
69050-69116 usb_power_delivery: sym: "0xA" "A"
68584-69116 usb_power_delivery: crc: "CRC:a8bb6cbb" "CRC"
69116-69183 usb_power_delivery: sym: "EOP" "#"
69116-69183 usb_power_delivery: eop: "EOP" "E"
67201-69183 usb_power_delivery: text: "#3    (16.800250ms): (r2) SNK[0]: GOOD CRC" "..."
71907-72757 usb_power_delivery: preamble: "Preamble" "..."
72757-72822 usb_power_delivery: sym: "SYNC-1" "S1"
72822-72890 usb_power_delivery: sym: "SYNC-1" "S1"
72890-72956 usb_power_delivery: sym: "SYNC-1" "S1"
72956-73024 usb_power_delivery: sym: "SYNC-2" "S2"
72757-73024 usb_power_delivery: sop: "SOP" "S"
73024-73089 usb_power_delivery: sym: "0x2" "2"
73089-73157 usb_power_delivery: sym: "0x4" "4"
73157-73222 usb_power_delivery: sym: "0x0" "0"
73222-73290 usb_power_delivery: sym: "0x1" "1"
73024-73290 usb_power_delivery: header: "H:1042" "HD"
71907-74449 usb_power_delivery: snk: "(r2) SNK[0]: REQUEST" "REQUEST"
73290-73356 usb_power_delivery: sym: "0x8" "8"
73356-73422 usb_power_delivery: sym: "0xC" "C"
73422-73490 usb_power_delivery: sym: "0x0" "0"
73490-73555 usb_power_delivery: sym: "0x2" "2"
73555-73622 usb_power_delivery: sym: "0x3" "3"
73622-73690 usb_power_delivery: sym: "0x0" "0"
73690-73757 usb_power_delivery: sym: "0x3" "3"
73757-73822 usb_power_delivery: sym: "0x2" "2"
73290-73822 usb_power_delivery: data: "[0]230320c8" "D0"
73290-73822 usb_power_delivery: payload: "[1] (PDO #2: Fixed 15V) 2A (operating) / 2A (max) [comm_cap] [no_suspend]" "[1] (PDO #2: Fixed 15V) 2A (operating) / 2A (max) [comm_cap] [no_suspend]"
73822-73889 usb_power_delivery: sym: "0xE" "E"
73889-73957 usb_power_delivery: sym: "0xF" "F"
73957-74022 usb_power_delivery: sym: "0xF" "F"
74022-74089 usb_power_delivery: sym: "0x3" "3"
74089-74155 usb_power_delivery: sym: "0xC" "C"
74155-74224 usb_power_delivery: sym: "0x4" "4"
74224-74289 usb_power_delivery: sym: "0x1" "1"
74289-74355 usb_power_delivery: sym: "0x9" "9"
73822-74355 usb_power_delivery: crc: "CRC:914c3ffe" "CRC"
74355-74422 usb_power_delivery: sym: "EOP" "#"
74355-74422 usb_power_delivery: eop: "EOP" "E"
71907-74422 usb_power_delivery: text: "#4    (17.976750ms): (r2) SNK[0]: REQUEST - [1] (PDO #2: Fixed 15V) 2A (operating) / 2A (max) [comm_cap] [no_suspend]" "..."
75160-76019 usb_power_delivery: preamble: "Preamble" "..."
76019-76084 usb_power_delivery: sym: "SYNC-1" "S1"
76084-76153 usb_power_delivery: sym: "SYNC-1" "S1"
76153-76218 usb_power_delivery: sym: "SYNC-1" "S1"
76218-76287 usb_power_delivery: sym: "SYNC-2" "S2"
76019-76287 usb_power_delivery: sop: "SOP" "S"
76287-76353 usb_power_delivery: sym: "0x1" "1"
76353-76420 usb_power_delivery: sym: "0x6" "6"
76420-76488 usb_power_delivery: sym: "0x1" "1"
76488-76554 usb_power_delivery: sym: "0x0" "0"
76287-76554 usb_power_delivery: header: "H:0161" "HD"
75160-77185 usb_power_delivery: src: "(r2) SRC[0]: GOOD CRC" "GOOD CRC"
76554-76623 usb_power_delivery: sym: "0xF" "F"
76623-76688 usb_power_delivery: sym: "0x8" "8"
76688-76757 usb_power_delivery: sym: "0x8" "8"
76757-76822 usb_power_delivery: sym: "0x7" "7"
76822-76891 usb_power_delivery: sym: "0x8" "8"
76891-76958 usb_power_delivery: sym: "0x3" "3"
76958-77025 usb_power_delivery: sym: "0xA" "A"
77025-77091 usb_power_delivery: sym: "0x4" "4"
76554-77091 usb_power_delivery: crc: "CRC:4a38788f" "CRC"
77091-77158 usb_power_delivery: sym: "EOP" "#"
77091-77158 usb_power_delivery: eop: "EOP" "E"
75160-77158 usb_power_delivery: text: "#5    (18.790000ms): (r2) SRC[0]: GOOD CRC" "..."
86796-87655 usb_power_delivery: preamble: "Preamble" "..."
87655-87720 usb_power_delivery: sym: "SYNC-1" "S1"
87720-87789 usb_power_delivery: sym: "SYNC-1" "S1"
87789-87854 usb_power_delivery: sym: "SYNC-1" "S1"
87854-87923 usb_power_delivery: sym: "SYNC-2" "S2"
87655-87923 usb_power_delivery: sop: "SOP" "S"
87923-87990 usb_power_delivery: sym: "0x3" "3"
87990-88057 usb_power_delivery: sym: "0x6" "6"
88057-88124 usb_power_delivery: sym: "0x3" "3"
88124-88190 usb_power_delivery: sym: "0x0" "0"
87923-88190 usb_power_delivery: header: "H:0363" "HD"
86796-88821 usb_power_delivery: src: "(r2) SRC[1]: ACCEPT" "ACCEPT"
88190-88259 usb_power_delivery: sym: "0x1" "1"
88259-88324 usb_power_delivery: sym: "0x2" "2"
88324-88393 usb_power_delivery: sym: "0xB" "B"
88393-88458 usb_power_delivery: sym: "0x7" "7"
88458-88527 usb_power_delivery: sym: "0x0" "0"
88527-88592 usb_power_delivery: sym: "0x0" "0"
88592-88660 usb_power_delivery: sym: "0x6" "6"
88660-88727 usb_power_delivery: sym: "0x9" "9"
88190-88727 usb_power_delivery: crc: "CRC:96007b21" "CRC"
88727-88794 usb_power_delivery: sym: "EOP" "#"
88727-88794 usb_power_delivery: eop: "EOP" "E"
86796-88794 usb_power_delivery: text: "#6    (21.699000ms): (r2) SRC[1]: ACCEPT" "..."
89240-90090 usb_power_delivery: preamble: "Preamble" "..."
90090-90155 usb_power_delivery: sym: "SYNC-1" "S1"
90155-90224 usb_power_delivery: sym: "SYNC-1" "S1"
90224-90289 usb_power_delivery: sym: "SYNC-1" "S1"
90289-90357 usb_power_delivery: sym: "SYNC-2" "S2"
90090-90357 usb_power_delivery: sop: "SOP" "S"
90357-90422 usb_power_delivery: sym: "0x1" "1"
90422-90490 usb_power_delivery: sym: "0x4" "4"
90490-90555 usb_power_delivery: sym: "0x2" "2"
90555-90624 usb_power_delivery: sym: "0x0" "0"
90357-90624 usb_power_delivery: header: "H:0241" "HD"
89240-91249 usb_power_delivery: snk: "(r2) SNK[1]: GOOD CRC" "GOOD CRC"
90624-90689 usb_power_delivery: sym: "0x7" "7"
90689-90755 usb_power_delivery: sym: "0x9" "9"
90755-90824 usb_power_delivery: sym: "0xD" "D"
90824-90889 usb_power_delivery: sym: "0x0" "0"
90889-90955 usb_power_delivery: sym: "0x5" "5"
90955-91024 usb_power_delivery: sym: "0xB" "B"
91024-91090 usb_power_delivery: sym: "0x6" "6"
91090-91155 usb_power_delivery: sym: "0x4" "4"
90624-91155 usb_power_delivery: crc: "CRC:46b50d97" "CRC"
91155-91222 usb_power_delivery: sym: "EOP" "#"
91155-91222 usb_power_delivery: eop: "EOP" "E"
89240-91222 usb_power_delivery: text: "#7    (22.310000ms): (r2) SNK[1]: GOOD CRC" "..."
250110-250969 usb_power_delivery: preamble: "Preamble" "..."
250969-251034 usb_power_delivery: sym: "SYNC-1" "S1"
251034-251103 usb_power_delivery: sym: "SYNC-1" "S1"
251103-251168 usb_power_delivery: sym: "SYNC-1" "S1"
251168-251237 usb_power_delivery: sym: "SYNC-2" "S2"
250969-251237 usb_power_delivery: sop: "SOP" "S"
251237-251304 usb_power_delivery: sym: "0x6" "6"
251304-251371 usb_power_delivery: sym: "0x6" "6"
251371-251438 usb_power_delivery: sym: "0x5" "5"
251438-251504 usb_power_delivery: sym: "0x0" "0"
251237-251504 usb_power_delivery: header: "H:0566" "HD"
250110-252135 usb_power_delivery: src: "(r2) SRC[2]: PS RDY" "PS RDY"
251504-251573 usb_power_delivery: sym: "0x1" "1"
251573-251640 usb_power_delivery: sym: "0x5" "5"
251640-251707 usb_power_delivery: sym: "0xA" "A"
251707-251772 usb_power_delivery: sym: "0x2" "2"
251772-251841 usb_power_delivery: sym: "0x4" "4"
251841-251906 usb_power_delivery: sym: "0x1" "1"
251906-251975 usb_power_delivery: sym: "0x2" "2"
251975-252041 usb_power_delivery: sym: "0x0" "0"
251504-252041 usb_power_delivery: crc: "CRC:02142a51" "CRC"
252041-252108 usb_power_delivery: sym: "EOP" "#"
252041-252108 usb_power_delivery: eop: "EOP" "E"
250110-252108 usb_power_delivery: text: "#8    (62.527500ms): (r2) SRC[2]: PS RDY" "..."
252555-254549 usb_power_delivery: preamble: "Junk???" "XXX"
252555-254549 usb_power_delivery: warnings: "No start of packet found" "XXX"
252555-254549 usb_power_delivery: text: "#9    (63.138750ms): Junk???" "..."
632525-633384 usb_power_delivery: preamble: "Preamble" "..."
633384-633449 usb_power_delivery: sym: "SYNC-1" "S1"
633449-633518 usb_power_delivery: sym: "SYNC-1" "S1"
633518-633584 usb_power_delivery: sym: "SYNC-1" "S1"
633584-633652 usb_power_delivery: sym: "SYNC-2" "S2"
633384-633652 usb_power_delivery: sop: "SOP" "S"
633652-633718 usb_power_delivery: sym: "0xF" "F"
633718-633785 usb_power_delivery: sym: "0x6" "6"
633785-633854 usb_power_delivery: sym: "0x7" "7"
633854-633919 usb_power_delivery: sym: "0x1" "1"
633652-633919 usb_power_delivery: header: "H:176f" "HD"
632525-635087 usb_power_delivery: src: "(r2) SRC[3]: VDM" "VDM"
633919-633988 usb_power_delivery: sym: "0x1" "1"
633988-634053 usb_power_delivery: sym: "0x0" "0"
634053-634122 usb_power_delivery: sym: "0x0" "0"
634122-634188 usb_power_delivery: sym: "0x8" "8"
634188-634256 usb_power_delivery: sym: "0x0" "0"
634256-634322 usb_power_delivery: sym: "0x0" "0"
634322-634391 usb_power_delivery: sym: "0xF" "F"
634391-634456 usb_power_delivery: sym: "0xF" "F"
633919-634456 usb_power_delivery: data: "[0]ff008001" "D0"
633919-634456 usb_power_delivery: payload: "[1] REQ Disc Ident  SVID:ff00" "[1] REQ Disc Ident  SVID:ff00"
634456-634523 usb_power_delivery: sym: "0x6" "6"
634523-634592 usb_power_delivery: sym: "0xD" "D"
634592-634657 usb_power_delivery: sym: "0x4" "4"
634657-634724 usb_power_delivery: sym: "0xC" "C"
634724-634793 usb_power_delivery: sym: "0xB" "B"
634793-634859 usb_power_delivery: sym: "0x2" "2"
634859-634926 usb_power_delivery: sym: "0xE" "E"
634926-634993 usb_power_delivery: sym: "0xE" "E"
634456-634993 usb_power_delivery: crc: "CRC:ee2bc4d6" "CRC"
634993-635060 usb_power_delivery: sym: "EOP" "#"
634993-635060 usb_power_delivery: eop: "EOP" "E"
632525-635060 usb_power_delivery: text: "#10   (158.131250ms): (r2) SRC[3]: VDM - [1] REQ Disc Ident  SVID:ff00" "..."
635504-636354 usb_power_delivery: preamble: "Preamble" "..."
636354-636419 usb_power_delivery: sym: "SYNC-1" "S1"
636419-636487 usb_power_delivery: sym: "SYNC-1" "S1"
636487-636552 usb_power_delivery: sym: "SYNC-1" "S1"
636552-636621 usb_power_delivery: sym: "SYNC-2" "S2"
636354-636621 usb_power_delivery: sop: "SOP" "S"
636621-636686 usb_power_delivery: sym: "0x1" "1"
636686-636754 usb_power_delivery: sym: "0x4" "4"
636754-636821 usb_power_delivery: sym: "0x6" "6"
636821-636886 usb_power_delivery: sym: "0x0" "0"
636621-636886 usb_power_delivery: header: "H:0641" "HD"
635504-637499 usb_power_delivery: snk: "(r2) SNK[3]: GOOD CRC" "GOOD CRC"
636886-636952 usb_power_delivery: sym: "0xE" "E"
636952-637021 usb_power_delivery: sym: "0x8" "8"
637021-637087 usb_power_delivery: sym: "0x9" "9"
637087-637154 usb_power_delivery: sym: "0xC" "C"
637154-637219 usb_power_delivery: sym: "0x8" "8"
637219-637287 usb_power_delivery: sym: "0xD" "D"
637287-637353 usb_power_delivery: sym: "0x1" "1"
637353-637421 usb_power_delivery: sym: "0x4" "4"
636886-637421 usb_power_delivery: crc: "CRC:41d8c98e" "CRC"
637421-637487 usb_power_delivery: sym: "EOP" "#"
637421-637487 usb_power_delivery: eop: "EOP" "E"
635504-637487 usb_power_delivery: text: "#11   (158.876000ms): (r2) SNK[3]: GOOD CRC" "..."
638430-639280 usb_power_delivery: preamble: "Preamble" "..."
639280-639345 usb_power_delivery: sym: "SYNC-1" "S1"
639345-639413 usb_power_delivery: sym: "SYNC-1" "S1"
639413-639478 usb_power_delivery: sym: "SYNC-1" "S1"
639478-639547 usb_power_delivery: sym: "SYNC-2" "S2"
639280-639547 usb_power_delivery: sop: "SOP" "S"
639547-639612 usb_power_delivery: sym: "0xF" "F"
639612-639680 usb_power_delivery: sym: "0x4" "4"
639680-639745 usb_power_delivery: sym: "0x2" "2"
639745-639813 usb_power_delivery: sym: "0x4" "4"
639547-639813 usb_power_delivery: header: "H:424f" "HD"
638430-642558 usb_power_delivery: snk: "(r2) SNK[1]: VDM" "VDM"
639813-639878 usb_power_delivery: sym: "0x1" "1"
639878-639947 usb_power_delivery: sym: "0x4" "4"
639947-640012 usb_power_delivery: sym: "0x0" "0"
640012-640080 usb_power_delivery: sym: "0x8" "8"
640080-640145 usb_power_delivery: sym: "0x0" "0"
640145-640213 usb_power_delivery: sym: "0x0" "0"
640213-640278 usb_power_delivery: sym: "0xF" "F"
640278-640347 usb_power_delivery: sym: "0xF" "F"
639813-640347 usb_power_delivery: data: "[0]ff008041" "D0"
639813-640347 usb_power_delivery: payload: "[1] ACK Disc Ident  SVID:ff00" "[1] ACK Disc Ident  SVID:ff00"
640347-640412 usb_power_delivery: sym: "0xF" "F"
640412-640478 usb_power_delivery: sym: "0xE" "E"
640478-640547 usb_power_delivery: sym: "0x7" "7"
640547-640612 usb_power_delivery: sym: "0x1" "1"
640612-640680 usb_power_delivery: sym: "0x0" "0"
640680-640745 usb_power_delivery: sym: "0x0" "0"
640745-640813 usb_power_delivery: sym: "0x4" "4"
640813-640880 usb_power_delivery: sym: "0xC" "C"
640347-640880 usb_power_delivery: data: "[1]c40017ef" "D1"
640347-640880 usb_power_delivery: payload: "[2] VDO:c40017ef" "[2] VDO:c40017ef"
640880-640945 usb_power_delivery: sym: "0x0" "0"
640945-641013 usb_power_delivery: sym: "0x0" "0"
641013-641078 usb_power_delivery: sym: "0x0" "0"
641078-641147 usb_power_delivery: sym: "0x0" "0"
641147-641212 usb_power_delivery: sym: "0x0" "0"
641212-641280 usb_power_delivery: sym: "0x0" "0"
641280-641345 usb_power_delivery: sym: "0x0" "0"
641345-641413 usb_power_delivery: sym: "0x0" "0"
640880-641413 usb_power_delivery: data: "[2]00000000" "D2"
640880-641413 usb_power_delivery: payload: "[3] VDO:00000000" "[3] VDO:00000000"
641413-641478 usb_power_delivery: sym: "0x0" "0"
641478-641547 usb_power_delivery: sym: "0x0" "0"
641547-641612 usb_power_delivery: sym: "0x0" "0"
641612-641680 usb_power_delivery: sym: "0x0" "0"
641680-641747 usb_power_delivery: sym: "0x3" "3"
641747-641812 usb_power_delivery: sym: "0x1" "1"
641812-641878 usb_power_delivery: sym: "0x3" "3"
641878-641945 usb_power_delivery: sym: "0xA" "A"
641413-641945 usb_power_delivery: data: "[3]a3130000" "D3"
641413-641945 usb_power_delivery: payload: "[4] VDO:a3130000" "[4] VDO:a3130000"
641945-642012 usb_power_delivery: sym: "0x5" "5"
642012-642078 usb_power_delivery: sym: "0x5" "5"
642078-642145 usb_power_delivery: sym: "0x9" "9"
642145-642212 usb_power_delivery: sym: "0x5" "5"
642212-642280 usb_power_delivery: sym: "0xB" "B"
642280-642347 usb_power_delivery: sym: "0x3" "3"
642347-642412 usb_power_delivery: sym: "0x7" "7"
642412-642480 usb_power_delivery: sym: "0x2" "2"
641945-642480 usb_power_delivery: crc: "CRC:273b5955" "CRC"
642480-642547 usb_power_delivery: sym: "EOP" "#"
642480-642547 usb_power_delivery: eop: "EOP" "E"
638430-642547 usb_power_delivery: text: "#12   (159.607500ms): (r2) SNK[1]: VDM - [1] ACK Disc Ident  SVID:ff00 - [2] VDO:c40017ef - [3] VDO:00000000 - [4] VDO:a3130000" "..."
643275-644134 usb_power_delivery: preamble: "Preamble" "..."
644134-644199 usb_power_delivery: sym: "SYNC-1" "S1"
644199-644268 usb_power_delivery: sym: "SYNC-1" "S1"
644268-644334 usb_power_delivery: sym: "SYNC-1" "S1"
644334-644402 usb_power_delivery: sym: "SYNC-2" "S2"
644134-644402 usb_power_delivery: sop: "SOP" "S"
644402-644468 usb_power_delivery: sym: "0x1" "1"
644468-644535 usb_power_delivery: sym: "0x6" "6"
644535-644602 usb_power_delivery: sym: "0x3" "3"
644602-644671 usb_power_delivery: sym: "0x0" "0"
644402-644671 usb_power_delivery: header: "H:0361" "HD"
643275-645287 usb_power_delivery: src: "(r2) SRC[1]: GOOD CRC" "GOOD CRC"
644671-644738 usb_power_delivery: sym: "0x3" "3"
644738-644805 usb_power_delivery: sym: "0xA" "A"
644805-644872 usb_power_delivery: sym: "0x9" "9"
644872-644938 usb_power_delivery: sym: "0x1" "1"
644938-645005 usb_power_delivery: sym: "0x6" "6"
645005-645072 usb_power_delivery: sym: "0x3" "3"
645072-645140 usb_power_delivery: sym: "0x4" "4"
645140-645208 usb_power_delivery: sym: "0xA" "A"
644671-645208 usb_power_delivery: crc: "CRC:a43619a3" "CRC"
645208-645275 usb_power_delivery: sym: "EOP" "#"
645208-645275 usb_power_delivery: eop: "EOP" "E"
643275-645275 usb_power_delivery: text: "#13   (160.818750ms): (r2) SRC[1]: GOOD CRC" "..."
648241-649099 usb_power_delivery: preamble: "Preamble" "..."
649099-649165 usb_power_delivery: sym: "SYNC-1" "S1"
649165-649234 usb_power_delivery: sym: "SYNC-1" "S1"
649234-649299 usb_power_delivery: sym: "SYNC-1" "S1"
649299-649368 usb_power_delivery: sym: "SYNC-2" "S2"
649099-649368 usb_power_delivery: sop: "SOP" "S"
649368-649433 usb_power_delivery: sym: "0x1" "1"
649433-649500 usb_power_delivery: sym: "0x6" "6"
649500-649567 usb_power_delivery: sym: "0x9" "9"
649567-649635 usb_power_delivery: sym: "0x5" "5"
649368-649635 usb_power_delivery: header: "H:5961" "HD"
648241-652950 usb_power_delivery: src: "(r2) SRC[4]: SOURCE CAP" "SOURCE CAP"
649635-649702 usb_power_delivery: sym: "0xC" "C"
649702-649770 usb_power_delivery: sym: "0x2" "2"
649770-649836 usb_power_delivery: sym: "0x1" "1"
649836-649903 usb_power_delivery: sym: "0x9" "9"
649903-649972 usb_power_delivery: sym: "0x1" "1"
649972-650037 usb_power_delivery: sym: "0x0" "0"
650037-650106 usb_power_delivery: sym: "0x8" "8"
650106-650171 usb_power_delivery: sym: "0x2" "2"
649635-650171 usb_power_delivery: data: "[0]2801912c" "D0"
649635-650171 usb_power_delivery: payload: "[1] [Fixed] 5V 3A (15W) [dual_role_power] [unconstrained]" "[1] [Fixed] 5V 3A (15W) [dual_role_power] [unconstrained]"
650171-650238 usb_power_delivery: sym: "0xC" "C"
650238-650307 usb_power_delivery: sym: "0x2" "2"
650307-650373 usb_power_delivery: sym: "0x1" "1"
650373-650441 usb_power_delivery: sym: "0xD" "D"
650441-650507 usb_power_delivery: sym: "0x2" "2"
650507-650576 usb_power_delivery: sym: "0x0" "0"
650576-650641 usb_power_delivery: sym: "0x0" "0"
650641-650710 usb_power_delivery: sym: "0x0" "0"
650171-650710 usb_power_delivery: data: "[1]0002d12c" "D1"
650171-650710 usb_power_delivery: payload: "[2] [Fixed] 9V 3A (27W)" "[2] [Fixed] 9V 3A (27W)"
650710-650777 usb_power_delivery: sym: "0xA" "A"
650777-650842 usb_power_delivery: sym: "0xF" "F"
650842-650911 usb_power_delivery: sym: "0x0" "0"
650911-650978 usb_power_delivery: sym: "0xC" "C"
650978-651045 usb_power_delivery: sym: "0x3" "3"
651045-651111 usb_power_delivery: sym: "0x0" "0"
651111-651179 usb_power_delivery: sym: "0x0" "0"
651179-651245 usb_power_delivery: sym: "0x0" "0"
650710-651245 usb_power_delivery: data: "[2]0003c0fa" "D2"
650710-651245 usb_power_delivery: payload: "[3] [Fixed] 12V 2.5A (30W)" "[3] [Fixed] 12V 2.5A (30W)"
651245-651314 usb_power_delivery: sym: "0x8" "8"
651314-651381 usb_power_delivery: sym: "0xC" "C"
651381-651446 usb_power_delivery: sym: "0x0" "0"
651446-651515 usb_power_delivery: sym: "0xB" "B"
651515-651580 usb_power_delivery: sym: "0x4" "4"
651580-651649 usb_power_delivery: sym: "0x0" "0"
651649-651715 usb_power_delivery: sym: "0x0" "0"
651715-651783 usb_power_delivery: sym: "0x0" "0"
651245-651783 usb_power_delivery: data: "[3]0004b0c8" "D3"
651245-651783 usb_power_delivery: payload: "[4] [Fixed] 15V 2A (30W)" "[4] [Fixed] 15V 2A (30W)"
651783-651849 usb_power_delivery: sym: "0xD" "D"
651849-651918 usb_power_delivery: sym: "0x7" "7"
651918-651983 usb_power_delivery: sym: "0x0" "0"
651983-652052 usb_power_delivery: sym: "0x4" "4"
652052-652119 usb_power_delivery: sym: "0x6" "6"
652119-652184 usb_power_delivery: sym: "0x0" "0"
652184-652253 usb_power_delivery: sym: "0x0" "0"
652253-652319 usb_power_delivery: sym: "0x0" "0"
651783-652319 usb_power_delivery: data: "[4]0006407d" "D4"
651783-652319 usb_power_delivery: payload: "[5] [Fixed] 20V 1.25A (25W)" "[5] [Fixed] 20V 1.25A (25W)"
652319-652386 usb_power_delivery: sym: "0xA" "A"
652386-652454 usb_power_delivery: sym: "0xF" "F"
652454-652522 usb_power_delivery: sym: "0x5" "5"
652522-652587 usb_power_delivery: sym: "0x4" "4"
652587-652656 usb_power_delivery: sym: "0x7" "7"
652656-652723 usb_power_delivery: sym: "0xE" "E"
652723-652790 usb_power_delivery: sym: "0x9" "9"
652790-652855 usb_power_delivery: sym: "0x2" "2"
652319-652855 usb_power_delivery: crc: "CRC:29e745fa" "CRC"
652855-652923 usb_power_delivery: sym: "EOP" "#"
652855-652923 usb_power_delivery: eop: "EOP" "E"
648241-652923 usb_power_delivery: text: "#14   (162.060250ms): (r2) SRC[4]: SOURCE CAP - [1] [Fixed] 5V 3A (15W) [dual_role_power] [unconstrained] - [2] [Fixed] 9V 3A (27W) - [3] [Fixed] 12V 2.5A (30W) - [4] [Fixed] 15V 2A (30W) - [5] [Fixed] 20V 1.25A (25W)" "..."
653367-654217 usb_power_delivery: preamble: "Preamble" "..."
654217-654282 usb_power_delivery: sym: "SYNC-1" "S1"
654282-654350 usb_power_delivery: sym: "SYNC-1" "S1"
654350-654415 usb_power_delivery: sym: "SYNC-1" "S1"
654415-654483 usb_power_delivery: sym: "SYNC-2" "S2"
654217-654483 usb_power_delivery: sop: "SOP" "S"
654483-654548 usb_power_delivery: sym: "0x1" "1"
654548-654617 usb_power_delivery: sym: "0x4" "4"
654617-654682 usb_power_delivery: sym: "0x8" "8"
654682-654750 usb_power_delivery: sym: "0x0" "0"
654483-654750 usb_power_delivery: header: "H:0841" "HD"
653367-655375 usb_power_delivery: snk: "(r2) SNK[4]: GOOD CRC" "GOOD CRC"
654750-654817 usb_power_delivery: sym: "0x9" "9"
654817-654882 usb_power_delivery: sym: "0x8" "8"
654882-654950 usb_power_delivery: sym: "0x4" "4"
654950-655017 usb_power_delivery: sym: "0xE" "E"
655017-655082 usb_power_delivery: sym: "0x0" "0"
655082-655148 usb_power_delivery: sym: "0x6" "6"
655148-655215 usb_power_delivery: sym: "0x6" "6"
655215-655282 usb_power_delivery: sym: "0xA" "A"
654750-655282 usb_power_delivery: crc: "CRC:a660e489" "CRC"
655282-655348 usb_power_delivery: sym: "EOP" "#"
655282-655348 usb_power_delivery: eop: "EOP" "E"
653367-655348 usb_power_delivery: text: "#15   (163.341750ms): (r2) SNK[4]: GOOD CRC" "..."
659417-660267 usb_power_delivery: preamble: "Preamble" "..."
660267-660332 usb_power_delivery: sym: "SYNC-1" "S1"
660332-660400 usb_power_delivery: sym: "SYNC-1" "S1"
660400-660466 usb_power_delivery: sym: "SYNC-1" "S1"
660466-660534 usb_power_delivery: sym: "SYNC-2" "S2"
660267-660534 usb_power_delivery: sop: "SOP" "S"
660534-660599 usb_power_delivery: sym: "0x2" "2"
660599-660667 usb_power_delivery: sym: "0x4" "4"
660667-660732 usb_power_delivery: sym: "0x4" "4"
660732-660800 usb_power_delivery: sym: "0x1" "1"
660534-660800 usb_power_delivery: header: "H:1442" "HD"
659417-661959 usb_power_delivery: snk: "(r2) SNK[2]: REQUEST" "REQUEST"
660800-660866 usb_power_delivery: sym: "0x8" "8"
660866-660932 usb_power_delivery: sym: "0xC" "C"
660932-661000 usb_power_delivery: sym: "0x0" "0"
661000-661066 usb_power_delivery: sym: "0x2" "2"
661066-661132 usb_power_delivery: sym: "0x3" "3"
661132-661200 usb_power_delivery: sym: "0x0" "0"
661200-661267 usb_power_delivery: sym: "0x3" "3"
661267-661332 usb_power_delivery: sym: "0x4" "4"
660800-661332 usb_power_delivery: data: "[0]430320c8" "D0"
660800-661332 usb_power_delivery: payload: "[1] (PDO #4: Fixed 15V) 2A (operating) / 2A (max) [comm_cap] [no_suspend]" "[1] (PDO #4: Fixed 15V) 2A (operating) / 2A (max) [comm_cap] [no_suspend]"
661332-661399 usb_power_delivery: sym: "0x6" "6"
661399-661466 usb_power_delivery: sym: "0x6" "6"
661466-661534 usb_power_delivery: sym: "0x8" "8"
661534-661599 usb_power_delivery: sym: "0xF" "F"
661599-661666 usb_power_delivery: sym: "0xE" "E"
661666-661734 usb_power_delivery: sym: "0x7" "7"
661734-661800 usb_power_delivery: sym: "0x9" "9"
661800-661866 usb_power_delivery: sym: "0x2" "2"
661332-661866 usb_power_delivery: crc: "CRC:297ef866" "CRC"
661866-661932 usb_power_delivery: sym: "EOP" "#"
661866-661932 usb_power_delivery: eop: "EOP" "E"
659417-661932 usb_power_delivery: text: "#16   (164.854250ms): (r2) SNK[2]: REQUEST - [1] (PDO #4: Fixed 15V) 2A (operating) / 2A (max) [comm_cap] [no_suspend]" "..."
662668-663527 usb_power_delivery: preamble: "Preamble" "..."
663527-663592 usb_power_delivery: sym: "SYNC-1" "S1"
663592-663661 usb_power_delivery: sym: "SYNC-1" "S1"
663661-663726 usb_power_delivery: sym: "SYNC-1" "S1"
663726-663795 usb_power_delivery: sym: "SYNC-2" "S2"
663527-663795 usb_power_delivery: sop: "SOP" "S"
663795-663861 usb_power_delivery: sym: "0x1" "1"
663861-663928 usb_power_delivery: sym: "0x6" "6"
663928-663995 usb_power_delivery: sym: "0x5" "5"
663995-664064 usb_power_delivery: sym: "0x0" "0"
663795-664064 usb_power_delivery: header: "H:0561" "HD"
662668-664693 usb_power_delivery: src: "(r2) SRC[2]: GOOD CRC" "GOOD CRC"
664064-664131 usb_power_delivery: sym: "0x6" "6"
664131-664198 usb_power_delivery: sym: "0x9" "9"
664198-664265 usb_power_delivery: sym: "0xC" "C"
664265-664330 usb_power_delivery: sym: "0xB" "B"
664330-664397 usb_power_delivery: sym: "0x5" "5"
664397-664465 usb_power_delivery: sym: "0x5" "5"
664465-664533 usb_power_delivery: sym: "0xD" "D"
664533-664599 usb_power_delivery: sym: "0x4" "4"
664064-664599 usb_power_delivery: crc: "CRC:4d55bc96" "CRC"
664599-664666 usb_power_delivery: sym: "EOP" "#"
664599-664666 usb_power_delivery: eop: "EOP" "E"
662668-664666 usb_power_delivery: text: "#17   (165.667000ms): (r2) SRC[2]: GOOD CRC" "..."
673874-674733 usb_power_delivery: preamble: "Preamble" "..."
674733-674799 usb_power_delivery: sym: "SYNC-1" "S1"
674799-674867 usb_power_delivery: sym: "SYNC-1" "S1"
674867-674933 usb_power_delivery: sym: "SYNC-1" "S1"
674933-675002 usb_power_delivery: sym: "SYNC-2" "S2"
674733-675002 usb_power_delivery: sop: "SOP" "S"
675002-675069 usb_power_delivery: sym: "0x3" "3"
675069-675136 usb_power_delivery: sym: "0x6" "6"
675136-675201 usb_power_delivery: sym: "0xB" "B"
675201-675270 usb_power_delivery: sym: "0x0" "0"
675002-675270 usb_power_delivery: header: "H:0b63" "HD"
673874-675899 usb_power_delivery: src: "(r2) SRC[5]: ACCEPT" "ACCEPT"
675270-675337 usb_power_delivery: sym: "0x3" "3"
675337-675403 usb_power_delivery: sym: "0x1" "1"
675403-675470 usb_power_delivery: sym: "0x3" "3"
675470-675539 usb_power_delivery: sym: "0xF" "F"
675539-675604 usb_power_delivery: sym: "0xB" "B"
675604-675673 usb_power_delivery: sym: "0xD" "D"
675673-675738 usb_power_delivery: sym: "0x8" "8"
675738-675805 usb_power_delivery: sym: "0x9" "9"
675270-675805 usb_power_delivery: crc: "CRC:98dbf313" "CRC"
675805-675872 usb_power_delivery: sym: "EOP" "#"
675805-675872 usb_power_delivery: eop: "EOP" "E"
673874-675872 usb_power_delivery: text: "#18   (168.468500ms): (r2) SRC[5]: ACCEPT" "..."
676319-677169 usb_power_delivery: preamble: "Preamble" "..."
677169-677234 usb_power_delivery: sym: "SYNC-1" "S1"
677234-677302 usb_power_delivery: sym: "SYNC-1" "S1"
677302-677367 usb_power_delivery: sym: "SYNC-1" "S1"
677367-677435 usb_power_delivery: sym: "SYNC-2" "S2"
677169-677435 usb_power_delivery: sop: "SOP" "S"
677435-677501 usb_power_delivery: sym: "0x1" "1"
677501-677569 usb_power_delivery: sym: "0x4" "4"
677569-677635 usb_power_delivery: sym: "0xA" "A"
677635-677701 usb_power_delivery: sym: "0x0" "0"
677435-677701 usb_power_delivery: header: "H:0a41" "HD"
676319-678314 usb_power_delivery: snk: "(r2) SNK[5]: GOOD CRC" "GOOD CRC"
677701-677767 usb_power_delivery: sym: "0x5" "5"
677767-677834 usb_power_delivery: sym: "0xA" "A"
677834-677901 usb_power_delivery: sym: "0x5" "5"
677901-677969 usb_power_delivery: sym: "0x8" "8"
677969-678036 usb_power_delivery: sym: "0xE" "E"
678036-678102 usb_power_delivery: sym: "0x6" "6"
678102-678167 usb_power_delivery: sym: "0x8" "8"
678167-678235 usb_power_delivery: sym: "0x4" "4"
677701-678235 usb_power_delivery: crc: "CRC:486e85a5" "CRC"
678235-678302 usb_power_delivery: sym: "EOP" "#"
678235-678302 usb_power_delivery: eop: "EOP" "E"
676319-678302 usb_power_delivery: text: "#19   (169.079750ms): (r2) SNK[5]: GOOD CRC" "..."
793216-794074 usb_power_delivery: preamble: "Preamble" "..."
794074-794140 usb_power_delivery: sym: "SYNC-1" "S1"
794140-794209 usb_power_delivery: sym: "SYNC-1" "S1"
794209-794274 usb_power_delivery: sym: "SYNC-1" "S1"
794274-794343 usb_power_delivery: sym: "SYNC-2" "S2"
794074-794343 usb_power_delivery: sop: "SOP" "S"
794343-794410 usb_power_delivery: sym: "0x6" "6"
794410-794477 usb_power_delivery: sym: "0x6" "6"
794477-794542 usb_power_delivery: sym: "0xD" "D"
794542-794611 usb_power_delivery: sym: "0x0" "0"
794343-794611 usb_power_delivery: header: "H:0d66" "HD"
793216-795241 usb_power_delivery: src: "(r2) SRC[6]: PS RDY" "PS RDY"
794611-794678 usb_power_delivery: sym: "0x3" "3"
794678-794745 usb_power_delivery: sym: "0x6" "6"
794745-794811 usb_power_delivery: sym: "0x2" "2"
794811-794878 usb_power_delivery: sym: "0xA" "A"
794878-794947 usb_power_delivery: sym: "0xF" "F"
794947-795014 usb_power_delivery: sym: "0xC" "C"
795014-795081 usb_power_delivery: sym: "0xC" "C"
795081-795146 usb_power_delivery: sym: "0x0" "0"
794611-795146 usb_power_delivery: crc: "CRC:0ccfa263" "CRC"
795146-795214 usb_power_delivery: sym: "EOP" "#"
795146-795214 usb_power_delivery: eop: "EOP" "E"
793216-795214 usb_power_delivery: text: "#20   (198.304000ms): (r2) SRC[6]: PS RDY" "..."
795660-796510 usb_power_delivery: preamble: "Preamble" "..."
796510-796575 usb_power_delivery: sym: "SYNC-1" "S1"
796575-796643 usb_power_delivery: sym: "SYNC-1" "S1"
796643-796709 usb_power_delivery: sym: "SYNC-1" "S1"
796709-796777 usb_power_delivery: sym: "SYNC-2" "S2"
796510-796777 usb_power_delivery: sop: "SOP" "S"
796777-796842 usb_power_delivery: sym: "0x1" "1"
796842-796910 usb_power_delivery: sym: "0x4" "4"
796910-796977 usb_power_delivery: sym: "0xC" "C"
796977-797042 usb_power_delivery: sym: "0x0" "0"
796777-797042 usb_power_delivery: header: "H:0c41" "HD"
795660-797669 usb_power_delivery: snk: "(r2) SNK[6]: GOOD CRC" "GOOD CRC"
797042-797110 usb_power_delivery: sym: "0x0" "0"
797110-797177 usb_power_delivery: sym: "0x9" "9"
797177-797242 usb_power_delivery: sym: "0x0" "0"
797242-797310 usb_power_delivery: sym: "0x2" "2"
797310-797375 usb_power_delivery: sym: "0xD" "D"
797375-797443 usb_power_delivery: sym: "0x0" "0"
797443-797509 usb_power_delivery: sym: "0x1" "1"
797509-797575 usb_power_delivery: sym: "0xA" "A"
797042-797575 usb_power_delivery: crc: "CRC:a10d2090" "CRC"
797575-797642 usb_power_delivery: sym: "EOP" "#"
797575-797642 usb_power_delivery: eop: "EOP" "E"
795660-797642 usb_power_delivery: text: "#21   (198.915000ms): (r2) SNK[6]: GOOD CRC" "..."
11198779-11199638 usb_power_delivery: preamble: "Preamble" "..."
11199638-11199704 usb_power_delivery: sym: "SYNC-1" "S1"
11199704-11199772 usb_power_delivery: sym: "SYNC-1" "S1"
11199772-11199838 usb_power_delivery: sym: "SYNC-3" "S3"
11199838-11199907 usb_power_delivery: sym: "SYNC-3" "S3"
11199638-11199907 usb_power_delivery: sop: "SOP'" "S"
11199907-11199972 usb_power_delivery: sym: "0xF" "F"
11199972-11200041 usb_power_delivery: sym: "0x4" "4"
11200041-11200106 usb_power_delivery: sym: "0x0" "0"
11200106-11200175 usb_power_delivery: sym: "0x1" "1"
11199907-11200175 usb_power_delivery: header: "H:104f" "HD"
11198779-11201328 usb_power_delivery: snk: "(r2) SNK[0]: VDM" "VDM"
11200175-11200241 usb_power_delivery: sym: "0x1" "1"
11200241-11200309 usb_power_delivery: sym: "0x0" "0"
11200309-11200375 usb_power_delivery: sym: "0x0" "0"
11200375-11200443 usb_power_delivery: sym: "0x8" "8"
11200443-11200509 usb_power_delivery: sym: "0x0" "0"
11200509-11200578 usb_power_delivery: sym: "0x0" "0"
11200578-11200643 usb_power_delivery: sym: "0xF" "F"
11200643-11200712 usb_power_delivery: sym: "0xF" "F"
11200175-11200712 usb_power_delivery: data: "[0]ff008001" "D0"
11200175-11200712 usb_power_delivery: payload: "[1] REQ Disc Ident  SVID:ff00" "[1] REQ Disc Ident  SVID:ff00"
11200712-11200777 usb_power_delivery: sym: "0x0" "0"
11200777-11200846 usb_power_delivery: sym: "0xF" "F"
11200846-11200912 usb_power_delivery: sym: "0xD" "D"
11200912-11200980 usb_power_delivery: sym: "0x1" "1"
11200980-11201046 usb_power_delivery: sym: "0x7" "7"
11201046-11201113 usb_power_delivery: sym: "0xA" "A"
11201113-11201182 usb_power_delivery: sym: "0xB" "B"
11201182-11201249 usb_power_delivery: sym: "0x5" "5"
11200712-11201249 usb_power_delivery: crc: "CRC:5ba71df0" "CRC"
11201249-11201316 usb_power_delivery: sym: "EOP" "#"
11201249-11201316 usb_power_delivery: eop: "EOP" "E"
11198779-11201316 usb_power_delivery: text: "#22   (2799.694750ms): (r2) SNK[0]: VDM - [1] REQ Disc Ident  SVID:ff00" "..."
11207946-11208804 usb_power_delivery: preamble: "Preamble" "..."
11208804-11208870 usb_power_delivery: sym: "SYNC-1" "S1"
11208870-11208938 usb_power_delivery: sym: "SYNC-1" "S1"
11208938-11209004 usb_power_delivery: sym: "SYNC-1" "S1"
11209004-11209073 usb_power_delivery: sym: "SYNC-2" "S2"
11208804-11209073 usb_power_delivery: sop: "SOP" "S"
11209073-11209138 usb_power_delivery: sym: "0x1" "1"
11209138-11209205 usb_power_delivery: sym: "0x6" "6"
11209205-11209274 usb_power_delivery: sym: "0x1" "1"
11209274-11209340 usb_power_delivery: sym: "0x2" "2"
11209073-11209340 usb_power_delivery: header: "H:2161" "HD"
11207946-11211031 usb_power_delivery: src: "(r2) SRC[0]: SOURCE CAP" "SOURCE CAP"
11209340-11209407 usb_power_delivery: sym: "0xC" "C"
11209407-11209475 usb_power_delivery: sym: "0x2" "2"
11209475-11209541 usb_power_delivery: sym: "0x1" "1"
11209541-11209608 usb_power_delivery: sym: "0x9" "9"
11209608-11209677 usb_power_delivery: sym: "0x1" "1"
11209677-11209742 usb_power_delivery: sym: "0x0" "0"
11209742-11209811 usb_power_delivery: sym: "0x8" "8"
11209811-11209876 usb_power_delivery: sym: "0x2" "2"
11209340-11209876 usb_power_delivery: data: "[0]2801912c" "D0"
11209340-11209876 usb_power_delivery: payload: "[1] [Fixed] 5V 3A (15W) [dual_role_power] [unconstrained]" "[1] [Fixed] 5V 3A (15W) [dual_role_power] [unconstrained]"
11209876-11209945 usb_power_delivery: sym: "0x8" "8"
11209945-11210012 usb_power_delivery: sym: "0xC" "C"
11210012-11210078 usb_power_delivery: sym: "0x0" "0"
11210078-11210146 usb_power_delivery: sym: "0xB" "B"
11210146-11210212 usb_power_delivery: sym: "0x4" "4"
11210212-11210281 usb_power_delivery: sym: "0x0" "0"
11210281-11210346 usb_power_delivery: sym: "0x0" "0"
11210346-11210415 usb_power_delivery: sym: "0x0" "0"
11209876-11210415 usb_power_delivery: data: "[1]0004b0c8" "D1"
11209876-11210415 usb_power_delivery: payload: "[2] [Fixed] 15V 2A (30W)" "[2] [Fixed] 15V 2A (30W)"
11210415-11210480 usb_power_delivery: sym: "0x4" "4"
11210480-11210549 usb_power_delivery: sym: "0xD" "D"
11210549-11210615 usb_power_delivery: sym: "0x1" "1"
11210615-11210683 usb_power_delivery: sym: "0xD" "D"
11210683-11210750 usb_power_delivery: sym: "0x5" "5"
11210750-11210817 usb_power_delivery: sym: "0x6" "6"
11210817-11210883 usb_power_delivery: sym: "0x7" "7"
11210883-11210952 usb_power_delivery: sym: "0x8" "8"
11210415-11210952 usb_power_delivery: crc: "CRC:8765d1d4" "CRC"
11210952-11211019 usb_power_delivery: sym: "EOP" "#"
11210952-11211019 usb_power_delivery: eop: "EOP" "E"
11207946-11211019 usb_power_delivery: text: "#23   (2801.986500ms): (r2) SRC[0]: SOURCE CAP - [1] [Fixed] 5V 3A (15W) [dual_role_power] [unconstrained] - [2] [Fixed] 15V 2A (30W)" "..."
11211462-11212312 usb_power_delivery: preamble: "Preamble" "..."
11212312-11212377 usb_power_delivery: sym: "SYNC-1" "S1"
11212377-11212445 usb_power_delivery: sym: "SYNC-1" "S1"
11212445-11212511 usb_power_delivery: sym: "SYNC-1" "S1"
11212511-11212578 usb_power_delivery: sym: "SYNC-2" "S2"
11212312-11212578 usb_power_delivery: sop: "SOP" "S"
11212578-11212644 usb_power_delivery: sym: "0x1" "1"
11212644-11212712 usb_power_delivery: sym: "0x4" "4"
11212712-11212777 usb_power_delivery: sym: "0x0" "0"
11212777-11212845 usb_power_delivery: sym: "0x0" "0"
11212578-11212845 usb_power_delivery: header: "H:0041" "HD"
11211462-11213471 usb_power_delivery: snk: "(r2) SNK[0]: GOOD CRC" "GOOD CRC"
11212845-11212911 usb_power_delivery: sym: "0xB" "B"
11212911-11212978 usb_power_delivery: sym: "0xB" "B"
11212978-11213045 usb_power_delivery: sym: "0xC" "C"
11213045-11213112 usb_power_delivery: sym: "0x6" "6"
11213112-11213177 usb_power_delivery: sym: "0xB" "B"
11213177-11213245 usb_power_delivery: sym: "0xB" "B"
11213245-11213311 usb_power_delivery: sym: "0x8" "8"
11213311-11213377 usb_power_delivery: sym: "0xA" "A"
11212845-11213377 usb_power_delivery: crc: "CRC:a8bb6cbb" "CRC"
11213377-11213444 usb_power_delivery: sym: "EOP" "#"
11213377-11213444 usb_power_delivery: eop: "EOP" "E"
11211462-11213444 usb_power_delivery: text: "#24   (2802.865500ms): (r2) SNK[0]: GOOD CRC" "..."
11216168-11217018 usb_power_delivery: preamble: "Preamble" "..."
11217018-11217083 usb_power_delivery: sym: "SYNC-1" "S1"
11217083-11217151 usb_power_delivery: sym: "SYNC-1" "S1"
11217151-11217216 usb_power_delivery: sym: "SYNC-1" "S1"
11217216-11217284 usb_power_delivery: sym: "SYNC-2" "S2"
11217018-11217284 usb_power_delivery: sop: "SOP" "S"
11217284-11217350 usb_power_delivery: sym: "0x2" "2"
11217350-11217418 usb_power_delivery: sym: "0x4" "4"
11217418-11217483 usb_power_delivery: sym: "0x0" "0"
11217483-11217551 usb_power_delivery: sym: "0x1" "1"
11217284-11217551 usb_power_delivery: header: "H:1042" "HD"
11216168-11218710 usb_power_delivery: snk: "(r2) SNK[0]: REQUEST" "REQUEST"
11217551-11217616 usb_power_delivery: sym: "0x8" "8"
11217616-11217683 usb_power_delivery: sym: "0xC" "C"
11217683-11217751 usb_power_delivery: sym: "0x0" "0"
11217751-11217816 usb_power_delivery: sym: "0x2" "2"
11217816-11217883 usb_power_delivery: sym: "0x3" "3"
11217883-11217951 usb_power_delivery: sym: "0x0" "0"
11217951-11218018 usb_power_delivery: sym: "0x3" "3"
11218018-11218083 usb_power_delivery: sym: "0x2" "2"
11217551-11218083 usb_power_delivery: data: "[0]230320c8" "D0"
11217551-11218083 usb_power_delivery: payload: "[1] (PDO #2: Fixed 15V) 2A (operating) / 2A (max) [comm_cap] [no_suspend]" "[1] (PDO #2: Fixed 15V) 2A (operating) / 2A (max) [comm_cap] [no_suspend]"
11218083-11218150 usb_power_delivery: sym: "0xE" "E"
11218150-11218218 usb_power_delivery: sym: "0xF" "F"
11218218-11218283 usb_power_delivery: sym: "0xF" "F"
11218283-11218350 usb_power_delivery: sym: "0x3" "3"
11218350-11218416 usb_power_delivery: sym: "0xC" "C"
11218416-11218484 usb_power_delivery: sym: "0x4" "4"
11218484-11218550 usb_power_delivery: sym: "0x1" "1"
11218550-11218616 usb_power_delivery: sym: "0x9" "9"
11218083-11218616 usb_power_delivery: crc: "CRC:914c3ffe" "CRC"
11218616-11218683 usb_power_delivery: sym: "EOP" "#"
11218616-11218683 usb_power_delivery: eop: "EOP" "E"
11216168-11218683 usb_power_delivery: text: "#25   (2804.042000ms): (r2) SNK[0]: REQUEST - [1] (PDO #2: Fixed 15V) 2A (operating) / 2A (max) [comm_cap] [no_suspend]" "..."
11219420-11220279 usb_power_delivery: preamble: "Preamble" "..."
11220279-11220344 usb_power_delivery: sym: "SYNC-1" "S1"
11220344-11220413 usb_power_delivery: sym: "SYNC-1" "S1"
11220413-11220479 usb_power_delivery: sym: "SYNC-1" "S1"
11220479-11220547 usb_power_delivery: sym: "SYNC-2" "S2"
11220279-11220547 usb_power_delivery: sop: "SOP" "S"
11220547-11220613 usb_power_delivery: sym: "0x1" "1"
11220613-11220680 usb_power_delivery: sym: "0x6" "6"
11220680-11220749 usb_power_delivery: sym: "0x1" "1"
11220749-11220814 usb_power_delivery: sym: "0x0" "0"
11220547-11220814 usb_power_delivery: header: "H:0161" "HD"
11219420-11221445 usb_power_delivery: src: "(r2) SRC[0]: GOOD CRC" "GOOD CRC"
11220814-11220883 usb_power_delivery: sym: "0xF" "F"
11220883-11220948 usb_power_delivery: sym: "0x8" "8"
11220948-11221017 usb_power_delivery: sym: "0x8" "8"
11221017-11221083 usb_power_delivery: sym: "0x7" "7"
11221083-11221151 usb_power_delivery: sym: "0x8" "8"
11221151-11221218 usb_power_delivery: sym: "0x3" "3"
11221218-11221285 usb_power_delivery: sym: "0xA" "A"
11221285-11221351 usb_power_delivery: sym: "0x4" "4"
11220814-11221351 usb_power_delivery: crc: "CRC:4a38788f" "CRC"
11221351-11221418 usb_power_delivery: sym: "EOP" "#"
11221351-11221418 usb_power_delivery: eop: "EOP" "E"
11219420-11221418 usb_power_delivery: text: "#26   (2804.855000ms): (r2) SRC[0]: GOOD CRC" "..."
11231177-11232035 usb_power_delivery: preamble: "Preamble" "..."
11232035-11232101 usb_power_delivery: sym: "SYNC-1" "S1"
11232101-11232169 usb_power_delivery: sym: "SYNC-1" "S1"
11232169-11232235 usb_power_delivery: sym: "SYNC-1" "S1"
11232235-11232304 usb_power_delivery: sym: "SYNC-2" "S2"
11232035-11232304 usb_power_delivery: sop: "SOP" "S"
11232304-11232371 usb_power_delivery: sym: "0x3" "3"
11232371-11232438 usb_power_delivery: sym: "0x6" "6"
11232438-11232505 usb_power_delivery: sym: "0x3" "3"
11232505-11232571 usb_power_delivery: sym: "0x0" "0"
11232304-11232571 usb_power_delivery: header: "H:0363" "HD"
11231177-11233202 usb_power_delivery: src: "(r2) SRC[1]: ACCEPT" "ACCEPT"
11232571-11232639 usb_power_delivery: sym: "0x1" "1"
11232639-11232705 usb_power_delivery: sym: "0x2" "2"
11232705-11232773 usb_power_delivery: sym: "0xB" "B"
11232773-11232839 usb_power_delivery: sym: "0x7" "7"
11232839-11232908 usb_power_delivery: sym: "0x0" "0"
11232908-11232973 usb_power_delivery: sym: "0x0" "0"
11232973-11233040 usb_power_delivery: sym: "0x6" "6"
11233040-11233107 usb_power_delivery: sym: "0x9" "9"
11232571-11233107 usb_power_delivery: crc: "CRC:96007b21" "CRC"
11233107-11233174 usb_power_delivery: sym: "EOP" "#"
11233107-11233174 usb_power_delivery: eop: "EOP" "E"
11231177-11233174 usb_power_delivery: text: "#27   (2807.794250ms): (r2) SRC[1]: ACCEPT" "..."
11233620-11234470 usb_power_delivery: preamble: "Preamble" "..."
11234470-11234536 usb_power_delivery: sym: "SYNC-1" "S1"
11234536-11234604 usb_power_delivery: sym: "SYNC-1" "S1"
11234604-11234669 usb_power_delivery: sym: "SYNC-1" "S1"
11234669-11234737 usb_power_delivery: sym: "SYNC-2" "S2"
11234470-11234737 usb_power_delivery: sop: "SOP" "S"
11234737-11234803 usb_power_delivery: sym: "0x1" "1"
11234803-11234870 usb_power_delivery: sym: "0x4" "4"
11234870-11234936 usb_power_delivery: sym: "0x2" "2"
11234936-11235004 usb_power_delivery: sym: "0x0" "0"
11234737-11235004 usb_power_delivery: header: "H:0241" "HD"
11233620-11235629 usb_power_delivery: snk: "(r2) SNK[1]: GOOD CRC" "GOOD CRC"
11235004-11235069 usb_power_delivery: sym: "0x7" "7"
11235069-11235136 usb_power_delivery: sym: "0x9" "9"
11235136-11235204 usb_power_delivery: sym: "0xD" "D"
11235204-11235269 usb_power_delivery: sym: "0x0" "0"
11235269-11235336 usb_power_delivery: sym: "0x5" "5"
11235336-11235404 usb_power_delivery: sym: "0xB" "B"
11235404-11235470 usb_power_delivery: sym: "0x6" "6"
11235470-11235536 usb_power_delivery: sym: "0x4" "4"
11235004-11235536 usb_power_delivery: crc: "CRC:46b50d97" "CRC"
11235536-11235603 usb_power_delivery: sym: "EOP" "#"
11235536-11235603 usb_power_delivery: eop: "EOP" "E"
11233620-11235603 usb_power_delivery: text: "#28   (2808.405000ms): (r2) SNK[1]: GOOD CRC" "..."
11385750-11386609 usb_power_delivery: preamble: "Preamble" "..."
11386609-11386674 usb_power_delivery: sym: "SYNC-1" "S1"
11386674-11386743 usb_power_delivery: sym: "SYNC-1" "S1"
11386743-11386809 usb_power_delivery: sym: "SYNC-1" "S1"
11386809-11386877 usb_power_delivery: sym: "SYNC-2" "S2"
11386609-11386877 usb_power_delivery: sop: "SOP" "S"
11386877-11386944 usb_power_delivery: sym: "0x6" "6"
11386944-11387011 usb_power_delivery: sym: "0x6" "6"
11387011-11387079 usb_power_delivery: sym: "0x5" "5"
11387079-11387144 usb_power_delivery: sym: "0x0" "0"
11386877-11387144 usb_power_delivery: header: "H:0566" "HD"
11385750-11387775 usb_power_delivery: src: "(r2) SRC[2]: PS RDY" "PS RDY"
11387144-11387213 usb_power_delivery: sym: "0x1" "1"
11387213-11387280 usb_power_delivery: sym: "0x5" "5"
11387280-11387347 usb_power_delivery: sym: "0xA" "A"
11387347-11387413 usb_power_delivery: sym: "0x2" "2"
11387413-11387481 usb_power_delivery: sym: "0x4" "4"
11387481-11387547 usb_power_delivery: sym: "0x1" "1"
11387547-11387615 usb_power_delivery: sym: "0x2" "2"
11387615-11387681 usb_power_delivery: sym: "0x0" "0"
11387144-11387681 usb_power_delivery: crc: "CRC:02142a51" "CRC"
11387681-11387748 usb_power_delivery: sym: "EOP" "#"
11387681-11387748 usb_power_delivery: eop: "EOP" "E"
11385750-11387748 usb_power_delivery: text: "#29   (2846.437500ms): (r2) SRC[2]: PS RDY" "..."
11388194-11389044 usb_power_delivery: preamble: "Preamble" "..."
11389044-11389110 usb_power_delivery: sym: "SYNC-1" "S1"
11389110-11389178 usb_power_delivery: sym: "SYNC-1" "S1"
11389178-11389243 usb_power_delivery: sym: "SYNC-1" "S1"
11389243-11389311 usb_power_delivery: sym: "SYNC-2" "S2"
11389044-11389311 usb_power_delivery: sop: "SOP" "S"
11389311-11389376 usb_power_delivery: sym: "0x1" "1"
11389376-11389444 usb_power_delivery: sym: "0x4" "4"
11389444-11389510 usb_power_delivery: sym: "0x4" "4"
11389510-11389578 usb_power_delivery: sym: "0x0" "0"
11389311-11389578 usb_power_delivery: header: "H:0441" "HD"
11388194-11390190 usb_power_delivery: snk: "(r2) SNK[2]: GOOD CRC" "GOOD CRC"
11389578-11389643 usb_power_delivery: sym: "0x2" "2"
11389643-11389710 usb_power_delivery: sym: "0xA" "A"
11389710-11389778 usb_power_delivery: sym: "0x8" "8"
11389778-11389844 usb_power_delivery: sym: "0xA" "A"
11389844-11389911 usb_power_delivery: sym: "0x6" "6"
11389911-11389976 usb_power_delivery: sym: "0xD" "D"
11389976-11390044 usb_power_delivery: sym: "0xF" "F"
11390044-11390111 usb_power_delivery: sym: "0xA" "A"
11389578-11390111 usb_power_delivery: crc: "CRC:afd6a8a2" "CRC"
11390111-11390178 usb_power_delivery: sym: "EOP" "#"
11390111-11390178 usb_power_delivery: eop: "EOP" "E"
11388194-11390178 usb_power_delivery: text: "#30   (2847.048500ms): (r2) SNK[2]: GOOD CRC" "..."
11770598-11771457 usb_power_delivery: preamble: "Preamble" "..."
11771457-11771523 usb_power_delivery: sym: "SYNC-1" "S1"
11771523-11771591 usb_power_delivery: sym: "SYNC-1" "S1"
11771591-11771657 usb_power_delivery: sym: "SYNC-1" "S1"
11771657-11771726 usb_power_delivery: sym: "SYNC-2" "S2"
11771457-11771726 usb_power_delivery: sop: "SOP" "S"
11771726-11771791 usb_power_delivery: sym: "0xF" "F"
11771791-11771858 usb_power_delivery: sym: "0x6" "6"
11771858-11771927 usb_power_delivery: sym: "0x7" "7"
11771927-11771992 usb_power_delivery: sym: "0x1" "1"
11771726-11771992 usb_power_delivery: header: "H:176f" "HD"
11770598-11773160 usb_power_delivery: src: "(r2) SRC[3]: VDM" "VDM"
11771992-11772061 usb_power_delivery: sym: "0x1" "1"
11772061-11772127 usb_power_delivery: sym: "0x0" "0"
11772127-11772195 usb_power_delivery: sym: "0x0" "0"
11772195-11772261 usb_power_delivery: sym: "0x8" "8"
11772261-11772330 usb_power_delivery: sym: "0x0" "0"
11772330-11772395 usb_power_delivery: sym: "0x0" "0"
11772395-11772464 usb_power_delivery: sym: "0xF" "F"
11772464-11772529 usb_power_delivery: sym: "0xF" "F"
11771992-11772529 usb_power_delivery: data: "[0]ff008001" "D0"
11771992-11772529 usb_power_delivery: payload: "[1] REQ Disc Ident  SVID:ff00" "[1] REQ Disc Ident  SVID:ff00"
11772529-11772596 usb_power_delivery: sym: "0x6" "6"
11772596-11772665 usb_power_delivery: sym: "0xD" "D"
11772665-11772731 usb_power_delivery: sym: "0x4" "4"
11772731-11772798 usb_power_delivery: sym: "0xC" "C"
11772798-11772866 usb_power_delivery: sym: "0xB" "B"
11772866-11772932 usb_power_delivery: sym: "0x2" "2"
11772932-11772999 usb_power_delivery: sym: "0xE" "E"
11772999-11773066 usb_power_delivery: sym: "0xE" "E"
11772529-11773066 usb_power_delivery: crc: "CRC:ee2bc4d6" "CRC"
11773066-11773133 usb_power_delivery: sym: "EOP" "#"
11773066-11773133 usb_power_delivery: eop: "EOP" "E"
11770598-11773133 usb_power_delivery: text: "#31   (2942.649500ms): (r2) SRC[3]: VDM - [1] REQ Disc Ident  SVID:ff00" "..."
11773577-11774427 usb_power_delivery: preamble: "Preamble" "..."
11774427-11774493 usb_power_delivery: sym: "SYNC-1" "S1"
11774493-11774560 usb_power_delivery: sym: "SYNC-1" "S1"
11774560-11774626 usb_power_delivery: sym: "SYNC-1" "S1"
11774626-11774694 usb_power_delivery: sym: "SYNC-2" "S2"
11774427-11774694 usb_power_delivery: sop: "SOP" "S"
11774694-11774759 usb_power_delivery: sym: "0x1" "1"
11774759-11774827 usb_power_delivery: sym: "0x4" "4"
11774827-11774894 usb_power_delivery: sym: "0x6" "6"
11774894-11774959 usb_power_delivery: sym: "0x0" "0"
11774694-11774959 usb_power_delivery: header: "H:0641" "HD"
11773577-11775573 usb_power_delivery: snk: "(r2) SNK[3]: GOOD CRC" "GOOD CRC"
11774959-11775026 usb_power_delivery: sym: "0xE" "E"
11775026-11775094 usb_power_delivery: sym: "0x8" "8"
11775094-11775160 usb_power_delivery: sym: "0x9" "9"
11775160-11775227 usb_power_delivery: sym: "0xC" "C"
11775227-11775293 usb_power_delivery: sym: "0x8" "8"
11775293-11775360 usb_power_delivery: sym: "0xD" "D"
11775360-11775426 usb_power_delivery: sym: "0x1" "1"
11775426-11775494 usb_power_delivery: sym: "0x4" "4"
11774959-11775494 usb_power_delivery: crc: "CRC:41d8c98e" "CRC"
11775494-11775560 usb_power_delivery: sym: "EOP" "#"
11775494-11775560 usb_power_delivery: eop: "EOP" "E"
11773577-11775560 usb_power_delivery: text: "#32   (2943.394250ms): (r2) SNK[3]: GOOD CRC" "..."
11776503-11777353 usb_power_delivery: preamble: "Preamble" "..."
11777353-11777418 usb_power_delivery: sym: "SYNC-1" "S1"
11777418-11777486 usb_power_delivery: sym: "SYNC-1" "S1"
11777486-11777552 usb_power_delivery: sym: "SYNC-1" "S1"
11777552-11777620 usb_power_delivery: sym: "SYNC-2" "S2"
11777353-11777620 usb_power_delivery: sop: "SOP" "S"
11777620-11777685 usb_power_delivery: sym: "0xF" "F"
11777685-11777753 usb_power_delivery: sym: "0x4" "4"
11777753-11777818 usb_power_delivery: sym: "0x2" "2"
11777818-11777886 usb_power_delivery: sym: "0x4" "4"
11777620-11777886 usb_power_delivery: header: "H:424f" "HD"
11776503-11780632 usb_power_delivery: snk: "(r2) SNK[1]: VDM" "VDM"
11777886-11777952 usb_power_delivery: sym: "0x1" "1"
11777952-11778020 usb_power_delivery: sym: "0x4" "4"
11778020-11778085 usb_power_delivery: sym: "0x0" "0"
11778085-11778153 usb_power_delivery: sym: "0x8" "8"
11778153-11778218 usb_power_delivery: sym: "0x0" "0"
11778218-11778286 usb_power_delivery: sym: "0x0" "0"
11778286-11778352 usb_power_delivery: sym: "0xF" "F"
11778352-11778420 usb_power_delivery: sym: "0xF" "F"
11777886-11778420 usb_power_delivery: data: "[0]ff008041" "D0"
11777886-11778420 usb_power_delivery: payload: "[1] ACK Disc Ident  SVID:ff00" "[1] ACK Disc Ident  SVID:ff00"
11778420-11778485 usb_power_delivery: sym: "0xF" "F"
11778485-11778552 usb_power_delivery: sym: "0xE" "E"
11778552-11778620 usb_power_delivery: sym: "0x7" "7"
11778620-11778685 usb_power_delivery: sym: "0x1" "1"
11778685-11778753 usb_power_delivery: sym: "0x0" "0"
11778753-11778818 usb_power_delivery: sym: "0x0" "0"
11778818-11778886 usb_power_delivery: sym: "0x4" "4"
11778886-11778953 usb_power_delivery: sym: "0xC" "C"
11778420-11778953 usb_power_delivery: data: "[1]c40017ef" "D1"
11778420-11778953 usb_power_delivery: payload: "[2] VDO:c40017ef" "[2] VDO:c40017ef"
11778953-11779018 usb_power_delivery: sym: "0x0" "0"
11779018-11779086 usb_power_delivery: sym: "0x0" "0"
11779086-11779152 usb_power_delivery: sym: "0x0" "0"
11779152-11779220 usb_power_delivery: sym: "0x0" "0"
11779220-11779285 usb_power_delivery: sym: "0x0" "0"
11779285-11779353 usb_power_delivery: sym: "0x0" "0"
11779353-11779418 usb_power_delivery: sym: "0x0" "0"
11779418-11779486 usb_power_delivery: sym: "0x0" "0"
11778953-11779486 usb_power_delivery: data: "[2]00000000" "D2"
11778953-11779486 usb_power_delivery: payload: "[3] VDO:00000000" "[3] VDO:00000000"
11779486-11779552 usb_power_delivery: sym: "0x0" "0"
11779552-11779620 usb_power_delivery: sym: "0x0" "0"
11779620-11779685 usb_power_delivery: sym: "0x0" "0"
11779685-11779753 usb_power_delivery: sym: "0x0" "0"
11779753-11779820 usb_power_delivery: sym: "0x3" "3"
11779820-11779885 usb_power_delivery: sym: "0x1" "1"
11779885-11779952 usb_power_delivery: sym: "0x3" "3"
11779952-11780018 usb_power_delivery: sym: "0xA" "A"
11779486-11780018 usb_power_delivery: data: "[3]a3130000" "D3"
11779486-11780018 usb_power_delivery: payload: "[4] VDO:a3130000" "[4] VDO:a3130000"
11780018-11780085 usb_power_delivery: sym: "0x5" "5"
11780085-11780152 usb_power_delivery: sym: "0x5" "5"
11780152-11780218 usb_power_delivery: sym: "0x9" "9"
11780218-11780285 usb_power_delivery: sym: "0x5" "5"
11780285-11780353 usb_power_delivery: sym: "0xB" "B"
11780353-11780420 usb_power_delivery: sym: "0x3" "3"
11780420-11780485 usb_power_delivery: sym: "0x7" "7"
11780485-11780553 usb_power_delivery: sym: "0x2" "2"
11780018-11780553 usb_power_delivery: crc: "CRC:273b5955" "CRC"
11780553-11780620 usb_power_delivery: sym: "EOP" "#"
11780553-11780620 usb_power_delivery: eop: "EOP" "E"
11776503-11780620 usb_power_delivery: text: "#33   (2944.125750ms): (r2) SNK[1]: VDM - [1] ACK Disc Ident  SVID:ff00 - [2] VDO:c40017ef - [3] VDO:00000000 - [4] VDO:a3130000" "..."
11781350-11782209 usb_power_delivery: preamble: "Preamble" "..."
11782209-11782274 usb_power_delivery: sym: "SYNC-1" "S1"
11782274-11782343 usb_power_delivery: sym: "SYNC-1" "S1"
11782343-11782408 usb_power_delivery: sym: "SYNC-1" "S1"
11782408-11782477 usb_power_delivery: sym: "SYNC-2" "S2"
11782209-11782477 usb_power_delivery: sop: "SOP" "S"
11782477-11782543 usb_power_delivery: sym: "0x1" "1"
11782543-11782610 usb_power_delivery: sym: "0x6" "6"
11782610-11782677 usb_power_delivery: sym: "0x3" "3"
11782677-11782745 usb_power_delivery: sym: "0x0" "0"
11782477-11782745 usb_power_delivery: header: "H:0361" "HD"
11781350-11783362 usb_power_delivery: src: "(r2) SRC[1]: GOOD CRC" "GOOD CRC"
11782745-11782813 usb_power_delivery: sym: "0x3" "3"
11782813-11782880 usb_power_delivery: sym: "0xA" "A"
11782880-11782947 usb_power_delivery: sym: "0x9" "9"
11782947-11783012 usb_power_delivery: sym: "0x1" "1"
11783012-11783080 usb_power_delivery: sym: "0x6" "6"
11783080-11783147 usb_power_delivery: sym: "0x3" "3"
11783147-11783215 usb_power_delivery: sym: "0x4" "4"
11783215-11783282 usb_power_delivery: sym: "0xA" "A"
11782745-11783282 usb_power_delivery: crc: "CRC:a43619a3" "CRC"
11783282-11783349 usb_power_delivery: sym: "EOP" "#"
11783282-11783349 usb_power_delivery: eop: "EOP" "E"
11781350-11783349 usb_power_delivery: text: "#34   (2945.337500ms): (r2) SRC[1]: GOOD CRC" "..."
11786262-11787121 usb_power_delivery: preamble: "Preamble" "..."
11787121-11787187 usb_power_delivery: sym: "SYNC-1" "S1"
11787187-11787255 usb_power_delivery: sym: "SYNC-1" "S1"
11787255-11787321 usb_power_delivery: sym: "SYNC-1" "S1"
11787321-11787390 usb_power_delivery: sym: "SYNC-2" "S2"
11787121-11787390 usb_power_delivery: sop: "SOP" "S"
11787390-11787455 usb_power_delivery: sym: "0x1" "1"
11787455-11787522 usb_power_delivery: sym: "0x6" "6"
11787522-11787590 usb_power_delivery: sym: "0x9" "9"
11787590-11787657 usb_power_delivery: sym: "0x5" "5"
11787390-11787657 usb_power_delivery: header: "H:5961" "HD"
11786262-11790972 usb_power_delivery: src: "(r2) SRC[4]: SOURCE CAP" "SOURCE CAP"
11787657-11787724 usb_power_delivery: sym: "0xC" "C"
11787724-11787792 usb_power_delivery: sym: "0x2" "2"
11787792-11787858 usb_power_delivery: sym: "0x1" "1"
11787858-11787925 usb_power_delivery: sym: "0x9" "9"
11787925-11787994 usb_power_delivery: sym: "0x1" "1"
11787994-11788059 usb_power_delivery: sym: "0x0" "0"
11788059-11788128 usb_power_delivery: sym: "0x8" "8"
11788128-11788194 usb_power_delivery: sym: "0x2" "2"
11787657-11788194 usb_power_delivery: data: "[0]2801912c" "D0"
11787657-11788194 usb_power_delivery: payload: "[1] [Fixed] 5V 3A (15W) [dual_role_power] [unconstrained]" "[1] [Fixed] 5V 3A (15W) [dual_role_power] [unconstrained]"
11788194-11788261 usb_power_delivery: sym: "0xC" "C"
11788261-11788329 usb_power_delivery: sym: "0x2" "2"
11788329-11788395 usb_power_delivery: sym: "0x1" "1"
11788395-11788464 usb_power_delivery: sym: "0xD" "D"
11788464-11788529 usb_power_delivery: sym: "0x2" "2"
11788529-11788598 usb_power_delivery: sym: "0x0" "0"
11788598-11788663 usb_power_delivery: sym: "0x0" "0"
11788663-11788732 usb_power_delivery: sym: "0x0" "0"
11788194-11788732 usb_power_delivery: data: "[1]0002d12c" "D1"
11788194-11788732 usb_power_delivery: payload: "[2] [Fixed] 9V 3A (27W)" "[2] [Fixed] 9V 3A (27W)"
11788732-11788799 usb_power_delivery: sym: "0xA" "A"
11788799-11788865 usb_power_delivery: sym: "0xF" "F"
11788865-11788933 usb_power_delivery: sym: "0x0" "0"
11788933-11789000 usb_power_delivery: sym: "0xC" "C"
11789000-11789068 usb_power_delivery: sym: "0x3" "3"
11789068-11789133 usb_power_delivery: sym: "0x0" "0"
11789133-11789202 usb_power_delivery: sym: "0x0" "0"
11789202-11789267 usb_power_delivery: sym: "0x0" "0"
11788732-11789267 usb_power_delivery: data: "[2]0003c0fa" "D2"
11788732-11789267 usb_power_delivery: payload: "[3] [Fixed] 12V 2.5A (30W)" "[3] [Fixed] 12V 2.5A (30W)"
11789267-11789336 usb_power_delivery: sym: "0x8" "8"
11789336-11789403 usb_power_delivery: sym: "0xC" "C"
11789403-11789469 usb_power_delivery: sym: "0x0" "0"
11789469-11789537 usb_power_delivery: sym: "0xB" "B"
11789537-11789603 usb_power_delivery: sym: "0x4" "4"
11789603-11789672 usb_power_delivery: sym: "0x0" "0"
11789672-11789737 usb_power_delivery: sym: "0x0" "0"
11789737-11789806 usb_power_delivery: sym: "0x0" "0"
11789267-11789806 usb_power_delivery: data: "[3]0004b0c8" "D3"
11789267-11789806 usb_power_delivery: payload: "[4] [Fixed] 15V 2A (30W)" "[4] [Fixed] 15V 2A (30W)"
11789806-11789871 usb_power_delivery: sym: "0xD" "D"
11789871-11789940 usb_power_delivery: sym: "0x7" "7"
11789940-11790006 usb_power_delivery: sym: "0x0" "0"
11790006-11790074 usb_power_delivery: sym: "0x4" "4"
11790074-11790141 usb_power_delivery: sym: "0x6" "6"
11790141-11790207 usb_power_delivery: sym: "0x0" "0"
11790207-11790276 usb_power_delivery: sym: "0x0" "0"
11790276-11790341 usb_power_delivery: sym: "0x0" "0"
11789806-11790341 usb_power_delivery: data: "[4]0006407d" "D4"
11789806-11790341 usb_power_delivery: payload: "[5] [Fixed] 20V 1.25A (25W)" "[5] [Fixed] 20V 1.25A (25W)"
11790341-11790408 usb_power_delivery: sym: "0xA" "A"
11790408-11790477 usb_power_delivery: sym: "0xF" "F"
11790477-11790544 usb_power_delivery: sym: "0x5" "5"
11790544-11790610 usb_power_delivery: sym: "0x4" "4"
11790610-11790678 usb_power_delivery: sym: "0x7" "7"
11790678-11790745 usb_power_delivery: sym: "0xE" "E"
11790745-11790813 usb_power_delivery: sym: "0x9" "9"
11790813-11790878 usb_power_delivery: sym: "0x2" "2"
11790341-11790878 usb_power_delivery: crc: "CRC:29e745fa" "CRC"
11790878-11790945 usb_power_delivery: sym: "EOP" "#"
11790878-11790945 usb_power_delivery: eop: "EOP" "E"
11786262-11790945 usb_power_delivery: text: "#35   (2946.565500ms): (r2) SRC[4]: SOURCE CAP - [1] [Fixed] 5V 3A (15W) [dual_role_power] [unconstrained] - [2] [Fixed] 9V 3A (27W) - [3] [Fixed] 12V 2.5A (30W) - [4] [Fixed] 15V 2A (30W) - [5] [Fixed] 20V 1.25A (25W)" "..."
11791389-11792239 usb_power_delivery: preamble: "Preamble" "..."
11792239-11792305 usb_power_delivery: sym: "SYNC-1" "S1"
11792305-11792372 usb_power_delivery: sym: "SYNC-1" "S1"
11792372-11792438 usb_power_delivery: sym: "SYNC-1" "S1"
11792438-11792506 usb_power_delivery: sym: "SYNC-2" "S2"
11792239-11792506 usb_power_delivery: sop: "SOP" "S"
11792506-11792571 usb_power_delivery: sym: "0x1" "1"
11792571-11792639 usb_power_delivery: sym: "0x4" "4"
11792639-11792705 usb_power_delivery: sym: "0x8" "8"
11792705-11792772 usb_power_delivery: sym: "0x0" "0"
11792506-11792772 usb_power_delivery: header: "H:0841" "HD"
11791389-11793398 usb_power_delivery: snk: "(r2) SNK[4]: GOOD CRC" "GOOD CRC"
11792772-11792839 usb_power_delivery: sym: "0x9" "9"
11792839-11792905 usb_power_delivery: sym: "0x8" "8"
11792905-11792972 usb_power_delivery: sym: "0x4" "4"
11792972-11793039 usb_power_delivery: sym: "0xE" "E"
11793039-11793105 usb_power_delivery: sym: "0x0" "0"
11793105-11793171 usb_power_delivery: sym: "0x6" "6"
11793171-11793238 usb_power_delivery: sym: "0x6" "6"
11793238-11793305 usb_power_delivery: sym: "0xA" "A"
11792772-11793305 usb_power_delivery: crc: "CRC:a660e489" "CRC"
11793305-11793371 usb_power_delivery: sym: "EOP" "#"
11793305-11793371 usb_power_delivery: eop: "EOP" "E"
11791389-11793371 usb_power_delivery: text: "#36   (2947.847250ms): (r2) SNK[4]: GOOD CRC" "..."
11797439-11798290 usb_power_delivery: preamble: "Preamble" "..."
11798290-11798355 usb_power_delivery: sym: "SYNC-1" "S1"
11798355-11798423 usb_power_delivery: sym: "SYNC-1" "S1"
11798423-11798488 usb_power_delivery: sym: "SYNC-1" "S1"
11798488-11798556 usb_power_delivery: sym: "SYNC-2" "S2"
11798290-11798556 usb_power_delivery: sop: "SOP" "S"
11798556-11798622 usb_power_delivery: sym: "0x2" "2"
11798622-11798689 usb_power_delivery: sym: "0x4" "4"
11798689-11798755 usb_power_delivery: sym: "0x4" "4"
11798755-11798823 usb_power_delivery: sym: "0x1" "1"
11798556-11798823 usb_power_delivery: header: "H:1442" "HD"
11797439-11799982 usb_power_delivery: snk: "(r2) SNK[2]: REQUEST" "REQUEST"
11798823-11798888 usb_power_delivery: sym: "0x8" "8"
11798888-11798955 usb_power_delivery: sym: "0xC" "C"
11798955-11799023 usb_power_delivery: sym: "0x0" "0"
11799023-11799088 usb_power_delivery: sym: "0x2" "2"
11799088-11799155 usb_power_delivery: sym: "0x3" "3"
11799155-11799223 usb_power_delivery: sym: "0x0" "0"
11799223-11799290 usb_power_delivery: sym: "0x3" "3"
11799290-11799355 usb_power_delivery: sym: "0x4" "4"
11798823-11799355 usb_power_delivery: data: "[0]430320c8" "D0"
11798823-11799355 usb_power_delivery: payload: "[1] (PDO #4: Fixed 15V) 2A (operating) / 2A (max) [comm_cap] [no_suspend]" "[1] (PDO #4: Fixed 15V) 2A (operating) / 2A (max) [comm_cap] [no_suspend]"
11799355-11799422 usb_power_delivery: sym: "0x6" "6"
11799422-11799488 usb_power_delivery: sym: "0x6" "6"
11799488-11799556 usb_power_delivery: sym: "0x8" "8"
11799556-11799622 usb_power_delivery: sym: "0xF" "F"
11799622-11799688 usb_power_delivery: sym: "0xE" "E"
11799688-11799756 usb_power_delivery: sym: "0x7" "7"
11799756-11799823 usb_power_delivery: sym: "0x9" "9"
11799823-11799888 usb_power_delivery: sym: "0x2" "2"
11799355-11799888 usb_power_delivery: crc: "CRC:297ef866" "CRC"
11799888-11799955 usb_power_delivery: sym: "EOP" "#"
11799888-11799955 usb_power_delivery: eop: "EOP" "E"
11797439-11799955 usb_power_delivery: text: "#37   (2949.359750ms): (r2) SNK[2]: REQUEST - [1] (PDO #4: Fixed 15V) 2A (operating) / 2A (max) [comm_cap] [no_suspend]" "..."
11800692-11801551 usb_power_delivery: preamble: "Preamble" "..."
11801551-11801616 usb_power_delivery: sym: "SYNC-1" "S1"
11801616-11801685 usb_power_delivery: sym: "SYNC-1" "S1"
11801685-11801750 usb_power_delivery: sym: "SYNC-1" "S1"
11801750-11801819 usb_power_delivery: sym: "SYNC-2" "S2"
11801551-11801819 usb_power_delivery: sop: "SOP" "S"
11801819-11801885 usb_power_delivery: sym: "0x1" "1"
11801885-11801952 usb_power_delivery: sym: "0x6" "6"
11801952-11802019 usb_power_delivery: sym: "0x5" "5"
11802019-11802087 usb_power_delivery: sym: "0x0" "0"
11801819-11802087 usb_power_delivery: header: "H:0561" "HD"
11800692-11802717 usb_power_delivery: src: "(r2) SRC[2]: GOOD CRC" "GOOD CRC"
11802087-11802155 usb_power_delivery: sym: "0x6" "6"
11802155-11802222 usb_power_delivery: sym: "0x9" "9"
11802222-11802289 usb_power_delivery: sym: "0xC" "C"
11802289-11802354 usb_power_delivery: sym: "0xB" "B"
11802354-11802421 usb_power_delivery: sym: "0x5" "5"
11802421-11802489 usb_power_delivery: sym: "0x5" "5"
11802489-11802557 usb_power_delivery: sym: "0xD" "D"
11802557-11802623 usb_power_delivery: sym: "0x4" "4"
11802087-11802623 usb_power_delivery: crc: "CRC:4d55bc96" "CRC"
11802623-11802690 usb_power_delivery: sym: "EOP" "#"
11802623-11802690 usb_power_delivery: eop: "EOP" "E"
11800692-11802690 usb_power_delivery: text: "#38   (2950.173000ms): (r2) SRC[2]: GOOD CRC" "..."
11812571-11813430 usb_power_delivery: preamble: "Preamble" "..."
11813430-11813495 usb_power_delivery: sym: "SYNC-1" "S1"
11813495-11813564 usb_power_delivery: sym: "SYNC-1" "S1"
11813564-11813630 usb_power_delivery: sym: "SYNC-1" "S1"
11813630-11813698 usb_power_delivery: sym: "SYNC-2" "S2"
11813430-11813698 usb_power_delivery: sop: "SOP" "S"
11813698-11813765 usb_power_delivery: sym: "0x3" "3"
11813765-11813832 usb_power_delivery: sym: "0x6" "6"
11813832-11813898 usb_power_delivery: sym: "0xB" "B"
11813898-11813967 usb_power_delivery: sym: "0x0" "0"
11813698-11813967 usb_power_delivery: header: "H:0b63" "HD"
11812571-11814596 usb_power_delivery: src: "(r2) SRC[5]: ACCEPT" "ACCEPT"
11813967-11814034 usb_power_delivery: sym: "0x3" "3"
11814034-11814099 usb_power_delivery: sym: "0x1" "1"
11814099-11814166 usb_power_delivery: sym: "0x3" "3"
11814166-11814235 usb_power_delivery: sym: "0xF" "F"
11814235-11814301 usb_power_delivery: sym: "0xB" "B"
11814301-11814369 usb_power_delivery: sym: "0xD" "D"
11814369-11814435 usb_power_delivery: sym: "0x8" "8"
11814435-11814502 usb_power_delivery: sym: "0x9" "9"
11813967-11814502 usb_power_delivery: crc: "CRC:98dbf313" "CRC"
11814502-11814569 usb_power_delivery: sym: "EOP" "#"
11814502-11814569 usb_power_delivery: eop: "EOP" "E"
11812571-11814569 usb_power_delivery: text: "#39   (2953.142750ms): (r2) SRC[5]: ACCEPT" "..."
11815015-11815865 usb_power_delivery: preamble: "Preamble" "..."
11815865-11815930 usb_power_delivery: sym: "SYNC-1" "S1"
11815930-11815998 usb_power_delivery: sym: "SYNC-1" "S1"
11815998-11816064 usb_power_delivery: sym: "SYNC-1" "S1"
11816064-11816132 usb_power_delivery: sym: "SYNC-2" "S2"
11815865-11816132 usb_power_delivery: sop: "SOP" "S"
11816132-11816197 usb_power_delivery: sym: "0x1" "1"
11816197-11816265 usb_power_delivery: sym: "0x4" "4"
11816265-11816332 usb_power_delivery: sym: "0xA" "A"
11816332-11816397 usb_power_delivery: sym: "0x0" "0"
11816132-11816397 usb_power_delivery: header: "H:0a41" "HD"
11815015-11817011 usb_power_delivery: snk: "(r2) SNK[5]: GOOD CRC" "GOOD CRC"
11816397-11816464 usb_power_delivery: sym: "0x5" "5"
11816464-11816530 usb_power_delivery: sym: "0xA" "A"
11816530-11816597 usb_power_delivery: sym: "0x5" "5"
11816597-11816665 usb_power_delivery: sym: "0x8" "8"
11816665-11816732 usb_power_delivery: sym: "0xE" "E"
11816732-11816798 usb_power_delivery: sym: "0x6" "6"
11816798-11816864 usb_power_delivery: sym: "0x8" "8"
11816864-11816932 usb_power_delivery: sym: "0x4" "4"
11816397-11816932 usb_power_delivery: crc: "CRC:486e85a5" "CRC"
11816932-11816998 usb_power_delivery: sym: "EOP" "#"
11816932-11816998 usb_power_delivery: eop: "EOP" "E"
11815015-11816998 usb_power_delivery: text: "#40   (2953.753750ms): (r2) SNK[5]: GOOD CRC" "..."
11932526-11933384 usb_power_delivery: preamble: "Preamble" "..."
11933384-11933450 usb_power_delivery: sym: "SYNC-1" "S1"
11933450-11933519 usb_power_delivery: sym: "SYNC-1" "S1"
11933519-11933584 usb_power_delivery: sym: "SYNC-1" "S1"
11933584-11933653 usb_power_delivery: sym: "SYNC-2" "S2"
11933384-11933653 usb_power_delivery: sop: "SOP" "S"
11933653-11933720 usb_power_delivery: sym: "0x6" "6"
11933720-11933787 usb_power_delivery: sym: "0x6" "6"
11933787-11933853 usb_power_delivery: sym: "0xD" "D"
11933853-11933921 usb_power_delivery: sym: "0x0" "0"
11933653-11933921 usb_power_delivery: header: "H:0d66" "HD"
11932526-11934551 usb_power_delivery: src: "(r2) SRC[6]: PS RDY" "PS RDY"
11933921-11933988 usb_power_delivery: sym: "0x3" "3"
11933988-11934056 usb_power_delivery: sym: "0x6" "6"
11934056-11934121 usb_power_delivery: sym: "0x2" "2"
11934121-11934188 usb_power_delivery: sym: "0xA" "A"
11934188-11934257 usb_power_delivery: sym: "0xF" "F"
11934257-11934324 usb_power_delivery: sym: "0xC" "C"
11934324-11934391 usb_power_delivery: sym: "0xC" "C"
11934391-11934457 usb_power_delivery: sym: "0x0" "0"
11933921-11934457 usb_power_delivery: crc: "CRC:0ccfa263" "CRC"
11934457-11934524 usb_power_delivery: sym: "EOP" "#"
11934457-11934524 usb_power_delivery: eop: "EOP" "E"
11932526-11934524 usb_power_delivery: text: "#41   (2983.131500ms): (r2) SRC[6]: PS RDY" "..."
11934970-11935820 usb_power_delivery: preamble: "Preamble" "..."
11935820-11935885 usb_power_delivery: sym: "SYNC-1" "S1"
11935885-11935953 usb_power_delivery: sym: "SYNC-1" "S1"
11935953-11936019 usb_power_delivery: sym: "SYNC-1" "S1"
11936019-11936087 usb_power_delivery: sym: "SYNC-2" "S2"
11935820-11936087 usb_power_delivery: sop: "SOP" "S"
11936087-11936152 usb_power_delivery: sym: "0x1" "1"
11936152-11936220 usb_power_delivery: sym: "0x4" "4"
11936220-11936287 usb_power_delivery: sym: "0xC" "C"
11936287-11936352 usb_power_delivery: sym: "0x0" "0"
11936087-11936352 usb_power_delivery: header: "H:0c41" "HD"
11934970-11936979 usb_power_delivery: snk: "(r2) SNK[6]: GOOD CRC" "GOOD CRC"
11936352-11936420 usb_power_delivery: sym: "0x0" "0"
11936420-11936487 usb_power_delivery: sym: "0x9" "9"
11936487-11936552 usb_power_delivery: sym: "0x0" "0"
11936552-11936620 usb_power_delivery: sym: "0x2" "2"
11936620-11936685 usb_power_delivery: sym: "0xD" "D"
11936685-11936753 usb_power_delivery: sym: "0x0" "0"
11936753-11936819 usb_power_delivery: sym: "0x1" "1"
11936819-11936885 usb_power_delivery: sym: "0xA" "A"
11936352-11936885 usb_power_delivery: crc: "CRC:a10d2090" "CRC"
11936885-11936952 usb_power_delivery: sym: "EOP" "#"
11936885-11936952 usb_power_delivery: eop: "EOP" "E"
11934970-11936952 usb_power_delivery: text: "#42   (2983.742500ms): (r2) SNK[6]: GOOD CRC" "..."
