52624-53486 usb_power_delivery: preamble: "Preamble" "..."
53486-53552 usb_power_delivery: sym: "SYNC-1" "S1"
53552-53621 usb_power_delivery: sym: "SYNC-1" "S1"
53621-53687 usb_power_delivery: sym: "SYNC-1" "S1"
53687-53756 usb_power_delivery: sym: "SYNC-2" "S2"
53486-53756 usb_power_delivery: sop: "SOP" "S"
53756-53822 usb_power_delivery: sym: "0x1" "1"
53822-53889 usb_power_delivery: sym: "0xA" "A"
53889-53958 usb_power_delivery: sym: "0x1" "1"
53958-54026 usb_power_delivery: sym: "0x6" "6"
53756-54026 usb_power_delivery: header: "H:61a1" "HD"
52624-57894 usb_power_delivery: src: "(r3) SRC[0]: SOURCE CAP" "SOURCE CAP"
54026-54093 usb_power_delivery: sym: "0xC" "C"
54093-54159 usb_power_delivery: sym: "0x2" "2"
54159-54228 usb_power_delivery: sym: "0x1" "1"
54228-54295 usb_power_delivery: sym: "0x9" "9"
54295-54361 usb_power_delivery: sym: "0x1" "1"
54361-54430 usb_power_delivery: sym: "0x0" "0"
54430-54498 usb_power_delivery: sym: "0xA" "A"
54498-54563 usb_power_delivery: sym: "0x0" "0"
54026-54563 usb_power_delivery: data: "[0]0a01912c" "D0"
54026-54563 usb_power_delivery: payload: "[1] [Fixed] 5V 3A (15W) [unconstrained] [dual_role_data]" "[1] [Fixed] 5V 3A (15W) [unconstrained] [dual_role_data]"
54563-54631 usb_power_delivery: sym: "0xC" "C"
54631-54700 usb_power_delivery: sym: "0x2" "2"
54700-54766 usb_power_delivery: sym: "0x1" "1"
54766-54835 usb_power_delivery: sym: "0xD" "D"
54835-54900 usb_power_delivery: sym: "0x2" "2"
54900-54969 usb_power_delivery: sym: "0x0" "0"
54969-55035 usb_power_delivery: sym: "0x0" "0"
55035-55104 usb_power_delivery: sym: "0x0" "0"
54563-55104 usb_power_delivery: data: "[1]0002d12c" "D1"
54563-55104 usb_power_delivery: payload: "[2] [Fixed] 9V 3A (27W)" "[2] [Fixed] 9V 3A (27W)"
55104-55172 usb_power_delivery: sym: "0xC" "C"
55172-55237 usb_power_delivery: sym: "0x2" "2"
55237-55306 usb_power_delivery: sym: "0x1" "1"
55306-55374 usb_power_delivery: sym: "0xC" "C"
55374-55441 usb_power_delivery: sym: "0x3" "3"
55441-55507 usb_power_delivery: sym: "0x0" "0"
55507-55576 usb_power_delivery: sym: "0x0" "0"
55576-55642 usb_power_delivery: sym: "0x0" "0"
55104-55642 usb_power_delivery: data: "[2]0003c12c" "D2"
55104-55642 usb_power_delivery: payload: "[3] [Fixed] 12V 3A (36W)" "[3] [Fixed] 12V 3A (36W)"
55642-55709 usb_power_delivery: sym: "0xC" "C"
55709-55778 usb_power_delivery: sym: "0x2" "2"
55778-55844 usb_power_delivery: sym: "0x1" "1"
55844-55913 usb_power_delivery: sym: "0xB" "B"
55913-55979 usb_power_delivery: sym: "0x4" "4"
55979-56048 usb_power_delivery: sym: "0x0" "0"
56048-56114 usb_power_delivery: sym: "0x0" "0"
56114-56183 usb_power_delivery: sym: "0x0" "0"
55642-56183 usb_power_delivery: data: "[3]0004b12c" "D3"
55642-56183 usb_power_delivery: payload: "[4] [Fixed] 15V 3A (45W)" "[4] [Fixed] 15V 3A (45W)"
56183-56248 usb_power_delivery: sym: "0x1" "1"
56248-56316 usb_power_delivery: sym: "0xE" "E"
56316-56385 usb_power_delivery: sym: "0x0" "0"
56385-56451 usb_power_delivery: sym: "0x4" "4"
56451-56518 usb_power_delivery: sym: "0x6" "6"
56518-56587 usb_power_delivery: sym: "0x0" "0"
56587-56653 usb_power_delivery: sym: "0x0" "0"
56653-56722 usb_power_delivery: sym: "0x0" "0"
56183-56722 usb_power_delivery: data: "[4]000640e1" "D4"
56183-56722 usb_power_delivery: payload: "[5] [Fixed] 20V 2.25A (45W)" "[5] [Fixed] 20V 2.25A (45W)"
56722-56789 usb_power_delivery: sym: "0xC" "C"
56789-56857 usb_power_delivery: sym: "0x3" "3"
56857-56924 usb_power_delivery: sym: "0xE" "E"
56924-56990 usb_power_delivery: sym: "0x1" "1"
56990-57059 usb_power_delivery: sym: "0x0" "0"
57059-57125 usb_power_delivery: sym: "0x4" "4"
57125-57194 usb_power_delivery: sym: "0x1" "1"
57194-57261 usb_power_delivery: sym: "0xC" "C"
56722-57261 usb_power_delivery: data: "[5]c1401e3c" "D5"
56722-57261 usb_power_delivery: payload: "[6] [Programmable|PPS] 3/16V 3A" "[6] [Programmable|PPS] 3/16V 3A"
57261-57327 usb_power_delivery: sym: "0x2" "2"
57327-57396 usb_power_delivery: sym: "0x0" "0"
57396-57462 usb_power_delivery: sym: "0xF" "F"
57462-57531 usb_power_delivery: sym: "0x4" "4"
57531-57597 usb_power_delivery: sym: "0x1" "1"
57597-57664 usb_power_delivery: sym: "0xC" "C"
57664-57733 usb_power_delivery: sym: "0x0" "0"
57733-57799 usb_power_delivery: sym: "0xF" "F"
57261-57799 usb_power_delivery: crc: "CRC:f0c14f02" "CRC"
57799-57866 usb_power_delivery: sym: "EOP" "#"
57799-57866 usb_power_delivery: eop: "EOP" "E"
52624-57866 usb_power_delivery: text: "#1    (13.156000ms): (r3) SRC[0]: SOURCE CAP - [1] [Fixed] 5V 3A (15W) [unconstrained] [dual_role_data] - [2] [Fixed] 9V 3A (27W) - [3] [Fixed] 12V 3A (36W) - [4] [Fixed] 15V 3A (45W) - [5] [Fixed] 20V 2.25A (45W) - [6] [Programmable|PPS] 3/16V 3A" "..."
58376-59225 usb_power_delivery: preamble: "Preamble" "..."
59225-59290 usb_power_delivery: sym: "SYNC-1" "S1"
59290-59358 usb_power_delivery: sym: "SYNC-1" "S1"
59358-59423 usb_power_delivery: sym: "SYNC-1" "S1"
59423-59491 usb_power_delivery: sym: "SYNC-2" "S2"
59225-59491 usb_power_delivery: sop: "SOP" "S"
59491-59556 usb_power_delivery: sym: "0x1" "1"
59556-59624 usb_power_delivery: sym: "0x4" "4"
59624-59689 usb_power_delivery: sym: "0x0" "0"
59689-59757 usb_power_delivery: sym: "0x0" "0"
59491-59757 usb_power_delivery: header: "H:0041" "HD"
58376-60381 usb_power_delivery: snk: "(r2) SNK[0]: GOOD CRC" "GOOD CRC"
59757-59822 usb_power_delivery: sym: "0xB" "B"
59822-59890 usb_power_delivery: sym: "0xB" "B"
59890-59957 usb_power_delivery: sym: "0xC" "C"
59957-60023 usb_power_delivery: sym: "0x6" "6"
60023-60088 usb_power_delivery: sym: "0xB" "B"
60088-60156 usb_power_delivery: sym: "0xB" "B"
60156-60221 usb_power_delivery: sym: "0x8" "8"
60221-60288 usb_power_delivery: sym: "0xA" "A"
59757-60288 usb_power_delivery: crc: "CRC:a8bb6cbb" "CRC"
60288-60354 usb_power_delivery: sym: "EOP" "#"
60288-60354 usb_power_delivery: eop: "EOP" "E"
58376-60354 usb_power_delivery: text: "#2    (14.594000ms): (r2) SNK[0]: GOOD CRC" "..."
65214-66062 usb_power_delivery: preamble: "Preamble" "..."
66062-66127 usb_power_delivery: sym: "SYNC-1" "S1"
66127-66195 usb_power_delivery: sym: "SYNC-1" "S1"
66195-66260 usb_power_delivery: sym: "SYNC-1" "S1"
66260-66328 usb_power_delivery: sym: "SYNC-2" "S2"
66062-66328 usb_power_delivery: sop: "SOP" "S"
66328-66393 usb_power_delivery: sym: "0x2" "2"
66393-66461 usb_power_delivery: sym: "0x4" "4"
66461-66526 usb_power_delivery: sym: "0x0" "0"
66526-66594 usb_power_delivery: sym: "0x1" "1"
66328-66594 usb_power_delivery: header: "H:1042" "HD"
65214-67737 usb_power_delivery: snk: "(r2) SNK[0]: REQUEST" "REQUEST"
66594-66659 usb_power_delivery: sym: "0x1" "1"
66659-66726 usb_power_delivery: sym: "0xE" "E"
66726-66794 usb_power_delivery: sym: "0x4" "4"
66794-66859 usb_power_delivery: sym: "0x8" "8"
66859-66926 usb_power_delivery: sym: "0x3" "3"
66926-66994 usb_power_delivery: sym: "0x0" "0"
66994-67060 usb_power_delivery: sym: "0x3" "3"
67060-67127 usb_power_delivery: sym: "0x5" "5"
66594-67127 usb_power_delivery: data: "[0]530384e1" "D0"
66594-67127 usb_power_delivery: payload: "[1] (PDO #5: Fixed 20V) 2.25A (operating) / 2.25A (max) [comm_cap] [no_suspend]" "[1] (PDO #5: Fixed 20V) 2.25A (operating) / 2.25A (max) [comm_cap] [no_suspend]"
67127-67193 usb_power_delivery: sym: "0xA" "A"
67193-67260 usb_power_delivery: sym: "0xC" "C"
67260-67325 usb_power_delivery: sym: "0xB" "B"
67325-67391 usb_power_delivery: sym: "0x5" "5"
67391-67459 usb_power_delivery: sym: "0x2" "2"
67459-67524 usb_power_delivery: sym: "0x0" "0"
67524-67592 usb_power_delivery: sym: "0x2" "2"
67592-67659 usb_power_delivery: sym: "0xC" "C"
67127-67659 usb_power_delivery: crc: "CRC:c2025bca" "CRC"
67659-67725 usb_power_delivery: sym: "EOP" "#"
67659-67725 usb_power_delivery: eop: "EOP" "E"
65214-67725 usb_power_delivery: text: "#3    (16.303500ms): (r2) SNK[0]: REQUEST - [1] (PDO #5: Fixed 20V) 2.25A (operating) / 2.25A (max) [comm_cap] [no_suspend]" "..."
68291-69154 usb_power_delivery: preamble: "Preamble" "..."
69154-69219 usb_power_delivery: sym: "SYNC-1" "S1"
69219-69289 usb_power_delivery: sym: "SYNC-1" "S1"
69289-69354 usb_power_delivery: sym: "SYNC-1" "S1"
69354-69423 usb_power_delivery: sym: "SYNC-2" "S2"
69154-69423 usb_power_delivery: sop: "SOP" "S"
69423-69489 usb_power_delivery: sym: "0x1" "1"
69489-69557 usb_power_delivery: sym: "0x6" "6"
69557-69625 usb_power_delivery: sym: "0x1" "1"
69625-69691 usb_power_delivery: sym: "0x0" "0"
69423-69691 usb_power_delivery: header: "H:0161" "HD"
68291-70326 usb_power_delivery: src: "(r2) SRC[0]: GOOD CRC" "GOOD CRC"
69691-69760 usb_power_delivery: sym: "0xF" "F"
69760-69826 usb_power_delivery: sym: "0x8" "8"
69826-69895 usb_power_delivery: sym: "0x8" "8"
69895-69961 usb_power_delivery: sym: "0x7" "7"
69961-70030 usb_power_delivery: sym: "0x8" "8"
70030-70097 usb_power_delivery: sym: "0x3" "3"
70097-70165 usb_power_delivery: sym: "0xA" "A"
70165-70231 usb_power_delivery: sym: "0x4" "4"
69691-70231 usb_power_delivery: crc: "CRC:4a38788f" "CRC"
70231-70298 usb_power_delivery: sym: "EOP" "#"
70231-70298 usb_power_delivery: eop: "EOP" "E"
68291-70298 usb_power_delivery: text: "#4    (17.072750ms): (r2) SRC[0]: GOOD CRC" "..."
76811-77674 usb_power_delivery: preamble: "Preamble" "..."
77674-77739 usb_power_delivery: sym: "SYNC-1" "S1"
77739-77808 usb_power_delivery: sym: "SYNC-1" "S1"
77808-77874 usb_power_delivery: sym: "SYNC-1" "S1"
77874-77943 usb_power_delivery: sym: "SYNC-2" "S2"
77674-77943 usb_power_delivery: sop: "SOP" "S"
77943-78011 usb_power_delivery: sym: "0x3" "3"
78011-78078 usb_power_delivery: sym: "0x6" "6"
78078-78145 usb_power_delivery: sym: "0x3" "3"
78145-78211 usb_power_delivery: sym: "0x0" "0"
77943-78211 usb_power_delivery: header: "H:0363" "HD"
76811-78845 usb_power_delivery: src: "(r2) SRC[1]: ACCEPT" "ACCEPT"
78211-78280 usb_power_delivery: sym: "0x1" "1"
78280-78346 usb_power_delivery: sym: "0x2" "2"
78346-78415 usb_power_delivery: sym: "0xB" "B"
78415-78481 usb_power_delivery: sym: "0x7" "7"
78481-78550 usb_power_delivery: sym: "0x0" "0"
78550-78616 usb_power_delivery: sym: "0x0" "0"
78616-78683 usb_power_delivery: sym: "0x6" "6"
78683-78750 usb_power_delivery: sym: "0x9" "9"
78211-78750 usb_power_delivery: crc: "CRC:96007b21" "CRC"
78750-78818 usb_power_delivery: sym: "EOP" "#"
78750-78818 usb_power_delivery: eop: "EOP" "E"
76811-78818 usb_power_delivery: text: "#5    (19.202750ms): (r2) SRC[1]: ACCEPT" "..."
79263-80111 usb_power_delivery: preamble: "Preamble" "..."
80111-80176 usb_power_delivery: sym: "SYNC-1" "S1"
80176-80244 usb_power_delivery: sym: "SYNC-1" "S1"
80244-80309 usb_power_delivery: sym: "SYNC-1" "S1"
80309-80377 usb_power_delivery: sym: "SYNC-2" "S2"
80111-80377 usb_power_delivery: sop: "SOP" "S"
80377-80442 usb_power_delivery: sym: "0x1" "1"
80442-80510 usb_power_delivery: sym: "0x4" "4"
80510-80575 usb_power_delivery: sym: "0x2" "2"
80575-80643 usb_power_delivery: sym: "0x0" "0"
80377-80643 usb_power_delivery: header: "H:0241" "HD"
79263-81267 usb_power_delivery: snk: "(r2) SNK[1]: GOOD CRC" "GOOD CRC"
80643-80708 usb_power_delivery: sym: "0x7" "7"
80708-80775 usb_power_delivery: sym: "0x9" "9"
80775-80843 usb_power_delivery: sym: "0xD" "D"
80843-80908 usb_power_delivery: sym: "0x0" "0"
80908-80974 usb_power_delivery: sym: "0x5" "5"
80974-81042 usb_power_delivery: sym: "0xB" "B"
81042-81109 usb_power_delivery: sym: "0x6" "6"
81109-81174 usb_power_delivery: sym: "0x4" "4"
80643-81174 usb_power_delivery: crc: "CRC:46b50d97" "CRC"
81174-81240 usb_power_delivery: sym: "EOP" "#"
81174-81240 usb_power_delivery: eop: "EOP" "E"
79263-81240 usb_power_delivery: text: "#6    (19.815750ms): (r2) SNK[1]: GOOD CRC" "..."
976655-977517 usb_power_delivery: preamble: "Preamble" "..."
977517-977583 usb_power_delivery: sym: "SYNC-1" "S1"
977583-977652 usb_power_delivery: sym: "SYNC-1" "S1"
977652-977718 usb_power_delivery: sym: "SYNC-1" "S1"
977718-977787 usb_power_delivery: sym: "SYNC-2" "S2"
977517-977787 usb_power_delivery: sop: "SOP" "S"
977787-977854 usb_power_delivery: sym: "0x6" "6"
977854-977922 usb_power_delivery: sym: "0x6" "6"
977922-977989 usb_power_delivery: sym: "0x5" "5"
977989-978055 usb_power_delivery: sym: "0x0" "0"
977787-978055 usb_power_delivery: header: "H:0566" "HD"
976655-978689 usb_power_delivery: src: "(r2) SRC[2]: PS RDY" "PS RDY"
978055-978124 usb_power_delivery: sym: "0x1" "1"
978124-978191 usb_power_delivery: sym: "0x5" "5"
978191-978259 usb_power_delivery: sym: "0xA" "A"
978259-978324 usb_power_delivery: sym: "0x2" "2"
978324-978393 usb_power_delivery: sym: "0x4" "4"
978393-978459 usb_power_delivery: sym: "0x1" "1"
978459-978528 usb_power_delivery: sym: "0x2" "2"
978528-978594 usb_power_delivery: sym: "0x0" "0"
978055-978594 usb_power_delivery: crc: "CRC:02142a51" "CRC"
978594-978661 usb_power_delivery: sym: "EOP" "#"
978594-978661 usb_power_delivery: eop: "EOP" "E"
976655-978661 usb_power_delivery: text: "#7    (244.163750ms): (r2) SRC[2]: PS RDY" "..."
979106-979955 usb_power_delivery: preamble: "Preamble" "..."
979955-980020 usb_power_delivery: sym: "SYNC-1" "S1"
980020-980088 usb_power_delivery: sym: "SYNC-1" "S1"
980088-980153 usb_power_delivery: sym: "SYNC-1" "S1"
980153-980221 usb_power_delivery: sym: "SYNC-2" "S2"
979955-980221 usb_power_delivery: sop: "SOP" "S"
980221-980286 usb_power_delivery: sym: "0x1" "1"
980286-980354 usb_power_delivery: sym: "0x4" "4"
980354-980419 usb_power_delivery: sym: "0x4" "4"
980419-980487 usb_power_delivery: sym: "0x0" "0"
980221-980487 usb_power_delivery: header: "H:0441" "HD"
979106-981097 usb_power_delivery: snk: "(r2) SNK[2]: GOOD CRC" "GOOD CRC"
980487-980552 usb_power_delivery: sym: "0x2" "2"
980552-980618 usb_power_delivery: sym: "0xA" "A"
980618-980686 usb_power_delivery: sym: "0x8" "8"
980686-980753 usb_power_delivery: sym: "0xA" "A"
980753-980819 usb_power_delivery: sym: "0x6" "6"
980819-980884 usb_power_delivery: sym: "0xD" "D"
980884-980952 usb_power_delivery: sym: "0xF" "F"
980952-981019 usb_power_delivery: sym: "0xA" "A"
980487-981019 usb_power_delivery: crc: "CRC:afd6a8a2" "CRC"
981019-981085 usb_power_delivery: sym: "EOP" "#"
981019-981085 usb_power_delivery: eop: "EOP" "E"
979106-981085 usb_power_delivery: text: "#8    (244.776500ms): (r2) SNK[2]: GOOD CRC" "..."
