2292707-2293995 usb_power_delivery: preamble: "Preamble" "..."
2293995-2294093 usb_power_delivery: sym: "SYNC-1" "S1"
2294093-2294196 usb_power_delivery: sym: "SYNC-1" "S1"
2294196-2294295 usb_power_delivery: sym: "SYNC-3" "S3"
2294295-2294398 usb_power_delivery: sym: "SYNC-3" "S3"
2293995-2294398 usb_power_delivery: sop: "SOP'" "S"
2294398-2294496 usb_power_delivery: sym: "0xF" "F"
2294496-2294599 usb_power_delivery: sym: "0x4" "4"
2294599-2294697 usb_power_delivery: sym: "0x0" "0"
2294697-2294800 usb_power_delivery: sym: "0x1" "1"
2294398-2294800 usb_power_delivery: header: "H:104f" "HD"
2292707-2296528 usb_power_delivery: snk: "(r2) SNK[0]: VDM" "VDM"
2294800-2294898 usb_power_delivery: sym: "0x1" "1"
2294898-2295001 usb_power_delivery: sym: "0x0" "0"
2295001-2295100 usb_power_delivery: sym: "0x0" "0"
2295100-2295203 usb_power_delivery: sym: "0x8" "8"
2295203-2295301 usb_power_delivery: sym: "0x0" "0"
2295301-2295404 usb_power_delivery: sym: "0x0" "0"
2295404-2295502 usb_power_delivery: sym: "0xF" "F"
2295502-2295605 usb_power_delivery: sym: "0xF" "F"
2294800-2295605 usb_power_delivery: data: "[0]ff008001" "D0"
2294800-2295605 usb_power_delivery: payload: "[1] REQ Disc Ident  SVID:ff00" "[1] REQ Disc Ident  SVID:ff00"
2295605-2295703 usb_power_delivery: sym: "0x0" "0"
2295703-2295806 usb_power_delivery: sym: "0xF" "F"
2295806-2295904 usb_power_delivery: sym: "0xD" "D"
2295904-2296008 usb_power_delivery: sym: "0x1" "1"
2296008-2296106 usb_power_delivery: sym: "0x7" "7"
2296106-2296206 usb_power_delivery: sym: "0xA" "A"
2296206-2296309 usb_power_delivery: sym: "0xB" "B"
2296309-2296410 usb_power_delivery: sym: "0x5" "5"
2295605-2296410 usb_power_delivery: crc: "CRC:5ba71df0" "CRC"
2296410-2296511 usb_power_delivery: sym: "EOP" "#"
2296410-2296511 usb_power_delivery: eop: "EOP" "E"
2292707-2296511 usb_power_delivery: text: "#1    (382.117833ms): (r2) SNK[0]: VDM - [1] REQ Disc Ident  SVID:ff00" "..."
2306452-2307739 usb_power_delivery: preamble: "Preamble" "..."
2307739-2307838 usb_power_delivery: sym: "SYNC-1" "S1"
2307838-2307941 usb_power_delivery: sym: "SYNC-1" "S1"
2307941-2308039 usb_power_delivery: sym: "SYNC-1" "S1"
2308039-2308142 usb_power_delivery: sym: "SYNC-2" "S2"
2307739-2308142 usb_power_delivery: sop: "SOP" "S"
2308142-2308240 usb_power_delivery: sym: "0x1" "1"
2308240-2308341 usb_power_delivery: sym: "0x6" "6"
2308341-2308444 usb_power_delivery: sym: "0x1" "1"
2308444-2308542 usb_power_delivery: sym: "0x2" "2"
2308142-2308542 usb_power_delivery: header: "H:2161" "HD"
2306452-2311078 usb_power_delivery: src: "(r2) SRC[0]: SOURCE CAP" "SOURCE CAP"
2308542-2308642 usb_power_delivery: sym: "0xC" "C"
2308642-2308746 usb_power_delivery: sym: "0x2" "2"
2308746-2308844 usb_power_delivery: sym: "0x1" "1"
2308844-2308944 usb_power_delivery: sym: "0x9" "9"
2308944-2309047 usb_power_delivery: sym: "0x1" "1"
2309047-2309146 usb_power_delivery: sym: "0x0" "0"
2309146-2309249 usb_power_delivery: sym: "0x8" "8"
2309249-2309347 usb_power_delivery: sym: "0x2" "2"
2308542-2309347 usb_power_delivery: data: "[0]2801912c" "D0"
2308542-2309347 usb_power_delivery: payload: "[1] [Fixed] 5V 3A (15W) [dual_role_power] [unconstrained]" "[1] [Fixed] 5V 3A (15W) [dual_role_power] [unconstrained]"
2309347-2309450 usb_power_delivery: sym: "0x8" "8"
2309450-2309550 usb_power_delivery: sym: "0xC" "C"
2309550-2309649 usb_power_delivery: sym: "0x0" "0"
2309649-2309752 usb_power_delivery: sym: "0xB" "B"
2309752-2309850 usb_power_delivery: sym: "0x4" "4"
2309850-2309953 usb_power_delivery: sym: "0x0" "0"
2309953-2310051 usb_power_delivery: sym: "0x0" "0"
2310051-2310154 usb_power_delivery: sym: "0x0" "0"
2309347-2310154 usb_power_delivery: data: "[1]0004b0c8" "D1"
2309347-2310154 usb_power_delivery: payload: "[2] [Fixed] 15V 2A (30W)" "[2] [Fixed] 15V 2A (30W)"
2310154-2310252 usb_power_delivery: sym: "0x4" "4"
2310252-2310355 usb_power_delivery: sym: "0xD" "D"
2310355-2310454 usb_power_delivery: sym: "0x1" "1"
2310454-2310557 usb_power_delivery: sym: "0xD" "D"
2310557-2310657 usb_power_delivery: sym: "0x5" "5"
2310657-2310758 usb_power_delivery: sym: "0x6" "6"
2310758-2310856 usb_power_delivery: sym: "0x7" "7"
2310856-2310959 usb_power_delivery: sym: "0x8" "8"
2310154-2310959 usb_power_delivery: crc: "CRC:8765d1d4" "CRC"
2310959-2311060 usb_power_delivery: sym: "EOP" "#"
2310959-2311060 usb_power_delivery: eop: "EOP" "E"
2306452-2311060 usb_power_delivery: text: "#2    (384.408667ms): (r2) SRC[0]: SOURCE CAP - [1] [Fixed] 5V 3A (15W) [dual_role_power] [unconstrained] - [2] [Fixed] 15V 2A (30W)" "..."
2328063-2329351 usb_power_delivery: preamble: "Preamble" "..."
2329351-2329449 usb_power_delivery: sym: "SYNC-1" "S1"
2329449-2329552 usb_power_delivery: sym: "SYNC-1" "S1"
2329552-2329650 usb_power_delivery: sym: "SYNC-3" "S3"
2329650-2329753 usb_power_delivery: sym: "SYNC-3" "S3"
2329351-2329753 usb_power_delivery: sop: "SOP'" "S"
2329753-2329852 usb_power_delivery: sym: "0xF" "F"
2329852-2329955 usb_power_delivery: sym: "0x4" "4"
2329955-2330053 usb_power_delivery: sym: "0x2" "2"
2330053-2330156 usb_power_delivery: sym: "0x1" "1"
2329753-2330156 usb_power_delivery: header: "H:124f" "HD"
2328063-2331904 usb_power_delivery: snk: "(r2) SNK[1]: VDM" "VDM"
2330156-2330254 usb_power_delivery: sym: "0x1" "1"
2330254-2330357 usb_power_delivery: sym: "0x0" "0"
2330357-2330455 usb_power_delivery: sym: "0x0" "0"
2330455-2330558 usb_power_delivery: sym: "0x8" "8"
2330558-2330657 usb_power_delivery: sym: "0x0" "0"
2330657-2330760 usb_power_delivery: sym: "0x0" "0"
2330760-2330858 usb_power_delivery: sym: "0xF" "F"
2330858-2330961 usb_power_delivery: sym: "0xF" "F"
2330156-2330961 usb_power_delivery: data: "[0]ff008001" "D0"
2330156-2330961 usb_power_delivery: payload: "[1] REQ Disc Ident  SVID:ff00" "[1] REQ Disc Ident  SVID:ff00"
2330961-2331059 usb_power_delivery: sym: "0x0" "0"
2331059-2331160 usb_power_delivery: sym: "0x9" "9"
2331160-2331260 usb_power_delivery: sym: "0xE" "E"
2331260-2331363 usb_power_delivery: sym: "0x4" "4"
2331363-2331462 usb_power_delivery: sym: "0x7" "7"
2331462-2331562 usb_power_delivery: sym: "0x6" "6"
2331562-2331665 usb_power_delivery: sym: "0x1" "1"
2331665-2331763 usb_power_delivery: sym: "0x2" "2"
2330961-2331763 usb_power_delivery: crc: "CRC:21674e90" "CRC"
2331763-2331864 usb_power_delivery: sym: "EOP" "#"
2331763-2331864 usb_power_delivery: eop: "EOP" "E"
2328063-2331864 usb_power_delivery: text: "#3    (388.010500ms): (r2) SNK[1]: VDM - [1] REQ Disc Ident  SVID:ff00" "..."
2985185-2986473 usb_power_delivery: preamble: "Preamble" "..."
2986473-2986571 usb_power_delivery: sym: "SYNC-1" "S1"
2986571-2986674 usb_power_delivery: sym: "SYNC-1" "S1"
2986674-2986773 usb_power_delivery: sym: "SYNC-1" "S1"
2986773-2986876 usb_power_delivery: sym: "SYNC-2" "S2"
2986473-2986876 usb_power_delivery: sop: "SOP" "S"
2986876-2986974 usb_power_delivery: sym: "0x1" "1"
2986974-2987074 usb_power_delivery: sym: "0x6" "6"
2987074-2987175 usb_power_delivery: sym: "0x3" "3"
2987175-2987278 usb_power_delivery: sym: "0x2" "2"
2986876-2987278 usb_power_delivery: header: "H:2361" "HD"
2985185-2989832 usb_power_delivery: src: "(r2) SRC[1]: SOURCE CAP" "SOURCE CAP"
2987278-2987379 usb_power_delivery: sym: "0xC" "C"
2987379-2987477 usb_power_delivery: sym: "0x2" "2"
2987477-2987580 usb_power_delivery: sym: "0x1" "1"
2987580-2987681 usb_power_delivery: sym: "0x9" "9"
2987681-2987779 usb_power_delivery: sym: "0x1" "1"
2987779-2987882 usb_power_delivery: sym: "0x0" "0"
2987882-2987980 usb_power_delivery: sym: "0x8" "8"
2987980-2988083 usb_power_delivery: sym: "0x2" "2"
2987278-2988083 usb_power_delivery: data: "[0]2801912c" "D0"
2987278-2988083 usb_power_delivery: payload: "[1] [Fixed] 5V 3A (15W) [dual_role_power] [unconstrained]" "[1] [Fixed] 5V 3A (15W) [dual_role_power] [unconstrained]"
2988083-2988181 usb_power_delivery: sym: "0x8" "8"
2988181-2988282 usb_power_delivery: sym: "0xC" "C"
2988282-2988385 usb_power_delivery: sym: "0x0" "0"
2988385-2988483 usb_power_delivery: sym: "0xB" "B"
2988483-2988586 usb_power_delivery: sym: "0x4" "4"
2988586-2988684 usb_power_delivery: sym: "0x0" "0"
2988684-2988787 usb_power_delivery: sym: "0x0" "0"
2988787-2988886 usb_power_delivery: sym: "0x0" "0"
2988083-2988886 usb_power_delivery: data: "[1]0004b0c8" "D1"
2988083-2988886 usb_power_delivery: payload: "[2] [Fixed] 15V 2A (30W)" "[2] [Fixed] 15V 2A (30W)"
2988886-2988989 usb_power_delivery: sym: "0x2" "2"
2988989-2989089 usb_power_delivery: sym: "0x5" "5"
2989089-2989190 usb_power_delivery: sym: "0x9" "9"
2989190-2989288 usb_power_delivery: sym: "0xF" "F"
2989288-2989389 usb_power_delivery: sym: "0x3" "3"
2989389-2989489 usb_power_delivery: sym: "0x9" "9"
2989489-2989590 usb_power_delivery: sym: "0x9" "9"
2989590-2989690 usb_power_delivery: sym: "0xA" "A"
2988886-2989690 usb_power_delivery: crc: "CRC:a993f952" "CRC"
2989690-2989791 usb_power_delivery: sym: "EOP" "#"
2989690-2989791 usb_power_delivery: eop: "EOP" "E"
2985185-2989791 usb_power_delivery: text: "#4    (497.530833ms): (r2) SRC[1]: SOURCE CAP - [1] [Fixed] 5V 3A (15W) [dual_role_power] [unconstrained] - [2] [Fixed] 15V 2A (30W)" "..."
3006778-3008065 usb_power_delivery: preamble: "Preamble" "..."
3008065-3008164 usb_power_delivery: sym: "SYNC-1" "S1"
3008164-3008267 usb_power_delivery: sym: "SYNC-1" "S1"
3008267-3008365 usb_power_delivery: sym: "SYNC-3" "S3"
3008365-3008468 usb_power_delivery: sym: "SYNC-3" "S3"
3008065-3008468 usb_power_delivery: sop: "SOP'" "S"
3008468-3008566 usb_power_delivery: sym: "0xF" "F"
3008566-3008669 usb_power_delivery: sym: "0x4" "4"
3008669-3008767 usb_power_delivery: sym: "0x4" "4"
3008767-3008870 usb_power_delivery: sym: "0x1" "1"
3008468-3008870 usb_power_delivery: header: "H:144f" "HD"
3006778-3010619 usb_power_delivery: snk: "(r2) SNK[2]: VDM" "VDM"
3008870-3008969 usb_power_delivery: sym: "0x1" "1"
3008969-3009072 usb_power_delivery: sym: "0x0" "0"
3009072-3009170 usb_power_delivery: sym: "0x0" "0"
3009170-3009273 usb_power_delivery: sym: "0x8" "8"
3009273-3009371 usb_power_delivery: sym: "0x0" "0"
3009371-3009474 usb_power_delivery: sym: "0x0" "0"
3009474-3009572 usb_power_delivery: sym: "0xF" "F"
3009572-3009675 usb_power_delivery: sym: "0xF" "F"
3008870-3009675 usb_power_delivery: data: "[0]ff008001" "D0"
3008870-3009675 usb_power_delivery: payload: "[1] REQ Disc Ident  SVID:ff00" "[1] REQ Disc Ident  SVID:ff00"
3009675-3009774 usb_power_delivery: sym: "0x0" "0"
3009774-3009874 usb_power_delivery: sym: "0x3" "3"
3009874-3009977 usb_power_delivery: sym: "0xB" "B"
3009977-3010075 usb_power_delivery: sym: "0xB" "B"
3010075-3010178 usb_power_delivery: sym: "0x7" "7"
3010178-3010277 usb_power_delivery: sym: "0x2" "2"
3010277-3010377 usb_power_delivery: sym: "0xE" "E"
3010377-3010478 usb_power_delivery: sym: "0xA" "A"
3009675-3010478 usb_power_delivery: crc: "CRC:ae27bb30" "CRC"
3010478-3010579 usb_power_delivery: sym: "EOP" "#"
3010478-3010579 usb_power_delivery: eop: "EOP" "E"
3006778-3010579 usb_power_delivery: text: "#5    (501.129667ms): (r2) SNK[2]: VDM - [1] REQ Disc Ident  SVID:ff00" "..."
3663411-3664698 usb_power_delivery: preamble: "Preamble" "..."
3664698-3664797 usb_power_delivery: sym: "SYNC-1" "S1"
3664797-3664900 usb_power_delivery: sym: "SYNC-1" "S1"
3664900-3664998 usb_power_delivery: sym: "SYNC-1" "S1"
3664998-3665101 usb_power_delivery: sym: "SYNC-2" "S2"
3664698-3665101 usb_power_delivery: sop: "SOP" "S"
3665101-3665199 usb_power_delivery: sym: "0x1" "1"
3665199-3665300 usb_power_delivery: sym: "0x6" "6"
3665300-3665400 usb_power_delivery: sym: "0x5" "5"
3665400-3665503 usb_power_delivery: sym: "0x2" "2"
3665101-3665503 usb_power_delivery: header: "H:2561" "HD"
3663411-3668056 usb_power_delivery: src: "(r2) SRC[2]: SOURCE CAP" "SOURCE CAP"
3665503-3665604 usb_power_delivery: sym: "0xC" "C"
3665604-3665702 usb_power_delivery: sym: "0x2" "2"
3665702-3665805 usb_power_delivery: sym: "0x1" "1"
3665805-3665906 usb_power_delivery: sym: "0x9" "9"
3665906-3666004 usb_power_delivery: sym: "0x1" "1"
3666004-3666107 usb_power_delivery: sym: "0x0" "0"
3666107-3666205 usb_power_delivery: sym: "0x8" "8"
3666205-3666308 usb_power_delivery: sym: "0x2" "2"
3665503-3666308 usb_power_delivery: data: "[0]2801912c" "D0"
3665503-3666308 usb_power_delivery: payload: "[1] [Fixed] 5V 3A (15W) [dual_role_power] [unconstrained]" "[1] [Fixed] 5V 3A (15W) [dual_role_power] [unconstrained]"
3666308-3666406 usb_power_delivery: sym: "0x8" "8"
3666406-3666507 usb_power_delivery: sym: "0xC" "C"
3666507-3666610 usb_power_delivery: sym: "0x0" "0"
3666610-3666708 usb_power_delivery: sym: "0xB" "B"
3666708-3666811 usb_power_delivery: sym: "0x4" "4"
3666811-3666909 usb_power_delivery: sym: "0x0" "0"
3666909-3667012 usb_power_delivery: sym: "0x0" "0"
3667012-3667111 usb_power_delivery: sym: "0x0" "0"
3666308-3667111 usb_power_delivery: data: "[1]0004b0c8" "D1"
3666308-3667111 usb_power_delivery: payload: "[2] [Fixed] 15V 2A (30W)" "[2] [Fixed] 15V 2A (30W)"
3667111-3667214 usb_power_delivery: sym: "0x8" "8"
3667214-3667312 usb_power_delivery: sym: "0xD" "D"
3667312-3667415 usb_power_delivery: sym: "0x0" "0"
3667415-3667513 usb_power_delivery: sym: "0x8" "8"
3667513-3667614 usb_power_delivery: sym: "0x9" "9"
3667614-3667717 usb_power_delivery: sym: "0x8" "8"
3667717-3667817 usb_power_delivery: sym: "0xA" "A"
3667817-3667915 usb_power_delivery: sym: "0xD" "D"
3667111-3667915 usb_power_delivery: crc: "CRC:da8980d8" "CRC"
3667915-3668016 usb_power_delivery: sym: "EOP" "#"
3667915-3668016 usb_power_delivery: eop: "EOP" "E"
3663411-3668016 usb_power_delivery: text: "#6    (610.568500ms): (r2) SRC[2]: SOURCE CAP - [1] [Fixed] 5V 3A (15W) [dual_role_power] [unconstrained] - [2] [Fixed] 15V 2A (30W)" "..."
3668550-3669824 usb_power_delivery: preamble: "Preamble" "..."
3669824-3669921 usb_power_delivery: sym: "SYNC-1" "S1"
3669921-3670023 usb_power_delivery: sym: "SYNC-1" "S1"
3670023-3670121 usb_power_delivery: sym: "SYNC-1" "S1"
3670121-3670223 usb_power_delivery: sym: "SYNC-2" "S2"
3669824-3670223 usb_power_delivery: sop: "SOP" "S"
3670223-3670320 usb_power_delivery: sym: "0x1" "1"
3670320-3670423 usb_power_delivery: sym: "0x4" "4"
3670423-3670520 usb_power_delivery: sym: "0x4" "4"
3670520-3670623 usb_power_delivery: sym: "0x0" "0"
3670223-3670623 usb_power_delivery: header: "H:0441" "HD"
3668550-3671521 usb_power_delivery: snk: "(r2) SNK[2]: GOOD CRC" "GOOD CRC"
3670623-3670720 usb_power_delivery: sym: "0x2" "2"
3670720-3670820 usb_power_delivery: sym: "0xA" "A"
3670820-3670922 usb_power_delivery: sym: "0x8" "8"
3670922-3671022 usb_power_delivery: sym: "0xA" "A"
3671022-3671122 usb_power_delivery: sym: "0x6" "6"
3671122-3671219 usb_power_delivery: sym: "0xD" "D"
3671219-3671322 usb_power_delivery: sym: "0xF" "F"
3671322-3671422 usb_power_delivery: sym: "0xA" "A"
3670623-3671422 usb_power_delivery: crc: "CRC:afd6a8a2" "CRC"
3671422-3671521 usb_power_delivery: sym: "EOP" "#"
3671422-3671521 usb_power_delivery: eop: "EOP" "E"
3668550-3671521 usb_power_delivery: text: "#7    (611.425000ms): (r2) SNK[2]: GOOD CRC" "..."
3675678-3676952 usb_power_delivery: preamble: "Preamble" "..."
3676952-3677049 usb_power_delivery: sym: "SYNC-1" "S1"
3677049-3677152 usb_power_delivery: sym: "SYNC-1" "S1"
3677152-3677249 usb_power_delivery: sym: "SYNC-1" "S1"
3677249-3677351 usb_power_delivery: sym: "SYNC-2" "S2"
3676952-3677351 usb_power_delivery: sop: "SOP" "S"
3677351-3677449 usb_power_delivery: sym: "0x2" "2"
3677449-3677551 usb_power_delivery: sym: "0x4" "4"
3677551-3677648 usb_power_delivery: sym: "0x0" "0"
3677648-3677751 usb_power_delivery: sym: "0x1" "1"
3677351-3677751 usb_power_delivery: header: "H:1042" "HD"
3675678-3679485 usb_power_delivery: snk: "(r2) SNK[0]: REQUEST" "REQUEST"
3677751-3677851 usb_power_delivery: sym: "0xC" "C"
3677851-3677948 usb_power_delivery: sym: "0x2" "2"
3677948-3678050 usb_power_delivery: sym: "0x1" "1"
3678050-3678148 usb_power_delivery: sym: "0xB" "B"
3678148-3678250 usb_power_delivery: sym: "0x4" "4"
3678250-3678347 usb_power_delivery: sym: "0x0" "0"
3678347-3678447 usb_power_delivery: sym: "0x3" "3"
3678447-3678550 usb_power_delivery: sym: "0x1" "1"
3677751-3678550 usb_power_delivery: data: "[0]1304b12c" "D0"
3677751-3678550 usb_power_delivery: payload: "[1] (PDO #1: Fixed 5V) 3A (operating) / 3A (max) [comm_cap] [no_suspend]" "[1] (PDO #1: Fixed 5V) 3A (operating) / 3A (max) [comm_cap] [no_suspend]"
3678550-3678647 usb_power_delivery: sym: "0xD" "D"
3678647-3678747 usb_power_delivery: sym: "0x3" "3"
3678747-3678849 usb_power_delivery: sym: "0xD" "D"
3678849-3678949 usb_power_delivery: sym: "0x9" "9"
3678949-3679046 usb_power_delivery: sym: "0x8" "8"
3679046-3679149 usb_power_delivery: sym: "0x1" "1"
3679149-3679246 usb_power_delivery: sym: "0xD" "D"
3679246-3679346 usb_power_delivery: sym: "0x5" "5"
3678550-3679346 usb_power_delivery: crc: "CRC:5d189d3d" "CRC"
3679346-3679446 usb_power_delivery: sym: "EOP" "#"
3679346-3679446 usb_power_delivery: eop: "EOP" "E"
3675678-3679446 usb_power_delivery: text: "#8    (612.613000ms): (r2) SNK[0]: REQUEST - [1] (PDO #1: Fixed 5V) 3A (operating) / 3A (max) [comm_cap] [no_suspend]" "..."
3680555-3681842 usb_power_delivery: preamble: "Preamble" "..."
3681842-3681940 usb_power_delivery: sym: "SYNC-1" "S1"
3681940-3682044 usb_power_delivery: sym: "SYNC-1" "S1"
3682044-3682142 usb_power_delivery: sym: "SYNC-1" "S1"
3682142-3682245 usb_power_delivery: sym: "SYNC-2" "S2"
3681842-3682245 usb_power_delivery: sop: "SOP" "S"
3682245-3682343 usb_power_delivery: sym: "0x1" "1"
3682343-3682444 usb_power_delivery: sym: "0x6" "6"
3682444-3682547 usb_power_delivery: sym: "0x1" "1"
3682547-3682645 usb_power_delivery: sym: "0x0" "0"
3682245-3682645 usb_power_delivery: header: "H:0161" "HD"
3680555-3683591 usb_power_delivery: src: "(r2) SRC[0]: GOOD CRC" "GOOD CRC"
3682645-3682748 usb_power_delivery: sym: "0xF" "F"
3682748-3682846 usb_power_delivery: sym: "0x8" "8"
3682846-3682949 usb_power_delivery: sym: "0x8" "8"
3682949-3683047 usb_power_delivery: sym: "0x7" "7"
3683047-3683150 usb_power_delivery: sym: "0x8" "8"
3683150-3683251 usb_power_delivery: sym: "0x3" "3"
3683251-3683352 usb_power_delivery: sym: "0xA" "A"
3683352-3683450 usb_power_delivery: sym: "0x4" "4"
3682645-3683450 usb_power_delivery: crc: "CRC:4a38788f" "CRC"
3683450-3683550 usb_power_delivery: sym: "EOP" "#"
3683450-3683550 usb_power_delivery: eop: "EOP" "E"
3680555-3683550 usb_power_delivery: text: "#9    (613.425833ms): (r2) SRC[0]: GOOD CRC" "..."
3697880-3699168 usb_power_delivery: preamble: "Preamble" "..."
3699168-3699266 usb_power_delivery: sym: "SYNC-1" "S1"
3699266-3699369 usb_power_delivery: sym: "SYNC-1" "S1"
3699369-3699467 usb_power_delivery: sym: "SYNC-1" "S1"
3699467-3699570 usb_power_delivery: sym: "SYNC-2" "S2"
3699168-3699570 usb_power_delivery: sop: "SOP" "S"
3699570-3699671 usb_power_delivery: sym: "0x3" "3"
3699671-3699772 usb_power_delivery: sym: "0x6" "6"
3699772-3699870 usb_power_delivery: sym: "0x7" "7"
3699870-3699973 usb_power_delivery: sym: "0x0" "0"
3699570-3699973 usb_power_delivery: header: "H:0763" "HD"
3697880-3700917 usb_power_delivery: src: "(r2) SRC[3]: ACCEPT" "ACCEPT"
3699973-3700071 usb_power_delivery: sym: "0x8" "8"
3700071-3700172 usb_power_delivery: sym: "0x3" "3"
3700172-3700275 usb_power_delivery: sym: "0xF" "F"
3700275-3700373 usb_power_delivery: sym: "0xB" "B"
3700373-3700476 usb_power_delivery: sym: "0xD" "D"
3700476-3700577 usb_power_delivery: sym: "0x6" "6"
3700577-3700675 usb_power_delivery: sym: "0x1" "1"
3700675-3700775 usb_power_delivery: sym: "0x9" "9"
3699973-3700775 usb_power_delivery: crc: "CRC:916dbf38" "CRC"
3700775-3700876 usb_power_delivery: sym: "EOP" "#"
3700775-3700876 usb_power_delivery: eop: "EOP" "E"
3697880-3700876 usb_power_delivery: text: "#10   (616.313333ms): (r2) SRC[3]: ACCEPT" "..."
3701410-3702684 usb_power_delivery: preamble: "Preamble" "..."
3702684-3702782 usb_power_delivery: sym: "SYNC-1" "S1"
3702782-3702884 usb_power_delivery: sym: "SYNC-1" "S1"
3702884-3702981 usb_power_delivery: sym: "SYNC-1" "S1"
3702981-3703084 usb_power_delivery: sym: "SYNC-2" "S2"
3702684-3703084 usb_power_delivery: sop: "SOP" "S"
3703084-3703181 usb_power_delivery: sym: "0x1" "1"
3703181-3703284 usb_power_delivery: sym: "0x4" "4"
3703284-3703383 usb_power_delivery: sym: "0x6" "6"
3703383-3703481 usb_power_delivery: sym: "0x0" "0"
3703084-3703481 usb_power_delivery: header: "H:0641" "HD"
3701410-3704382 usb_power_delivery: snk: "(r2) SNK[3]: GOOD CRC" "GOOD CRC"
3703481-3703580 usb_power_delivery: sym: "0xE" "E"
3703580-3703683 usb_power_delivery: sym: "0x8" "8"
3703683-3703783 usb_power_delivery: sym: "0x9" "9"
3703783-3703883 usb_power_delivery: sym: "0xC" "C"
3703883-3703980 usb_power_delivery: sym: "0x8" "8"
3703980-3704083 usb_power_delivery: sym: "0xD" "D"
3704083-3704180 usb_power_delivery: sym: "0x1" "1"
3704180-3704282 usb_power_delivery: sym: "0x4" "4"
3703481-3704282 usb_power_delivery: crc: "CRC:41d8c98e" "CRC"
3704282-3704382 usb_power_delivery: sym: "EOP" "#"
3704282-3704382 usb_power_delivery: eop: "EOP" "E"
3701410-3704382 usb_power_delivery: text: "#11   (616.901667ms): (r2) SNK[3]: GOOD CRC" "..."
3876597-3877885 usb_power_delivery: preamble: "Preamble" "..."
3877885-3877983 usb_power_delivery: sym: "SYNC-1" "S1"
3877983-3878086 usb_power_delivery: sym: "SYNC-1" "S1"
3878086-3878185 usb_power_delivery: sym: "SYNC-1" "S1"
3878185-3878288 usb_power_delivery: sym: "SYNC-2" "S2"
3877885-3878288 usb_power_delivery: sop: "SOP" "S"
3878288-3878388 usb_power_delivery: sym: "0x6" "6"
3878388-3878489 usb_power_delivery: sym: "0x6" "6"
3878489-3878589 usb_power_delivery: sym: "0x9" "9"
3878589-3878688 usb_power_delivery: sym: "0x0" "0"
3878288-3878688 usb_power_delivery: header: "H:0966" "HD"
3876597-3879634 usb_power_delivery: src: "(r2) SRC[4]: PS RDY" "PS RDY"
3878688-3878788 usb_power_delivery: sym: "0xA" "A"
3878788-3878891 usb_power_delivery: sym: "0x7" "7"
3878891-3878992 usb_power_delivery: sym: "0x6" "6"
3878992-3879093 usb_power_delivery: sym: "0x6" "6"
3879093-3879191 usb_power_delivery: sym: "0x2" "2"
3879191-3879291 usb_power_delivery: sym: "0xA" "A"
3879291-3879394 usb_power_delivery: sym: "0xB" "B"
3879394-3879493 usb_power_delivery: sym: "0x0" "0"
3878688-3879493 usb_power_delivery: crc: "CRC:0ba2667a" "CRC"
3879493-3879593 usb_power_delivery: sym: "EOP" "#"
3879493-3879593 usb_power_delivery: eop: "EOP" "E"
3876597-3879593 usb_power_delivery: text: "#12   (646.099500ms): (r2) SRC[4]: PS RDY" "..."
3880127-3881401 usb_power_delivery: preamble: "Preamble" "..."
3881401-3881498 usb_power_delivery: sym: "SYNC-1" "S1"
3881498-3881601 usb_power_delivery: sym: "SYNC-1" "S1"
3881601-3881698 usb_power_delivery: sym: "SYNC-1" "S1"
3881698-3881800 usb_power_delivery: sym: "SYNC-2" "S2"
3881401-3881800 usb_power_delivery: sop: "SOP" "S"
3881800-3881898 usb_power_delivery: sym: "0x1" "1"
3881898-3882000 usb_power_delivery: sym: "0x4" "4"
3882000-3882097 usb_power_delivery: sym: "0x8" "8"
3882097-3882200 usb_power_delivery: sym: "0x0" "0"
3881800-3882200 usb_power_delivery: header: "H:0841" "HD"
3880127-3883136 usb_power_delivery: snk: "(r2) SNK[4]: GOOD CRC" "GOOD CRC"
3882200-3882300 usb_power_delivery: sym: "0x9" "9"
3882300-3882397 usb_power_delivery: sym: "0x8" "8"
3882397-3882499 usb_power_delivery: sym: "0x4" "4"
3882499-3882599 usb_power_delivery: sym: "0xE" "E"
3882599-3882696 usb_power_delivery: sym: "0x0" "0"
3882696-3882796 usb_power_delivery: sym: "0x6" "6"
3882796-3882896 usb_power_delivery: sym: "0x6" "6"
3882896-3882996 usb_power_delivery: sym: "0xA" "A"
3882200-3882996 usb_power_delivery: crc: "CRC:a660e489" "CRC"
3882996-3883096 usb_power_delivery: sym: "EOP" "#"
3882996-3883096 usb_power_delivery: eop: "EOP" "E"
3880127-3883096 usb_power_delivery: text: "#13   (646.687833ms): (r2) SNK[4]: GOOD CRC" "..."
3927935-3929223 usb_power_delivery: preamble: "Preamble" "..."
3929223-3929321 usb_power_delivery: sym: "SYNC-1" "S1"
3929321-3929424 usb_power_delivery: sym: "SYNC-1" "S1"
3929424-3929522 usb_power_delivery: sym: "SYNC-1" "S1"
3929522-3929625 usb_power_delivery: sym: "SYNC-2" "S2"
3929223-3929625 usb_power_delivery: sop: "SOP" "S"
3929625-3929724 usb_power_delivery: sym: "0xF" "F"
3929724-3929824 usb_power_delivery: sym: "0x6" "6"
3929824-3929927 usb_power_delivery: sym: "0xB" "B"
3929927-3930025 usb_power_delivery: sym: "0x1" "1"
3929625-3930025 usb_power_delivery: header: "H:1b6f" "HD"
3927935-3931756 usb_power_delivery: src: "(r2) SRC[5]: VDM" "VDM"
3930025-3930128 usb_power_delivery: sym: "0x1" "1"
3930128-3930227 usb_power_delivery: sym: "0x0" "0"
3930227-3930330 usb_power_delivery: sym: "0x0" "0"
3930330-3930428 usb_power_delivery: sym: "0x8" "8"
3930428-3930531 usb_power_delivery: sym: "0x0" "0"
3930531-3930629 usb_power_delivery: sym: "0x0" "0"
3930629-3930732 usb_power_delivery: sym: "0xF" "F"
3930732-3930830 usb_power_delivery: sym: "0xF" "F"
3930025-3930830 usb_power_delivery: data: "[0]ff008001" "D0"
3930025-3930830 usb_power_delivery: payload: "[1] REQ Disc Ident  SVID:ff00" "[1] REQ Disc Ident  SVID:ff00"
3930830-3930933 usb_power_delivery: sym: "0x7" "7"
3930933-3931032 usb_power_delivery: sym: "0xD" "D"
3931032-3931132 usb_power_delivery: sym: "0x9" "9"
3931132-3931235 usb_power_delivery: sym: "0x2" "2"
3931235-3931334 usb_power_delivery: sym: "0xB" "B"
3931334-3931437 usb_power_delivery: sym: "0xD" "D"
3931437-3931535 usb_power_delivery: sym: "0xB" "B"
3931535-3931638 usb_power_delivery: sym: "0x2" "2"
3930830-3931638 usb_power_delivery: crc: "CRC:2bdb29d7" "CRC"
3931638-3931738 usb_power_delivery: sym: "EOP" "#"
3931638-3931738 usb_power_delivery: eop: "EOP" "E"
3927935-3931738 usb_power_delivery: text: "#14   (654.655833ms): (r2) SRC[5]: VDM - [1] REQ Disc Ident  SVID:ff00" "..."
3932270-3933544 usb_power_delivery: preamble: "Preamble" "..."
3933544-3933641 usb_power_delivery: sym: "SYNC-1" "S1"
3933641-3933744 usb_power_delivery: sym: "SYNC-1" "S1"
3933744-3933841 usb_power_delivery: sym: "SYNC-1" "S1"
3933841-3933943 usb_power_delivery: sym: "SYNC-2" "S2"
3933544-3933943 usb_power_delivery: sop: "SOP" "S"
3933943-3934040 usb_power_delivery: sym: "0x1" "1"
3934040-3934143 usb_power_delivery: sym: "0x4" "4"
3934143-3934243 usb_power_delivery: sym: "0xA" "A"
3934243-3934340 usb_power_delivery: sym: "0x0" "0"
3933943-3934340 usb_power_delivery: header: "H:0a41" "HD"
3932270-3935241 usb_power_delivery: snk: "(r2) SNK[5]: GOOD CRC" "GOOD CRC"
3934340-3934440 usb_power_delivery: sym: "0x5" "5"
3934440-3934540 usb_power_delivery: sym: "0xA" "A"
3934540-3934640 usb_power_delivery: sym: "0x5" "5"
3934640-3934742 usb_power_delivery: sym: "0x8" "8"
3934742-3934842 usb_power_delivery: sym: "0xE" "E"
3934842-3934942 usb_power_delivery: sym: "0x6" "6"
3934942-3935039 usb_power_delivery: sym: "0x8" "8"
3935039-3935141 usb_power_delivery: sym: "0x4" "4"
3934340-3935141 usb_power_delivery: crc: "CRC:486e85a5" "CRC"
3935141-3935241 usb_power_delivery: sym: "EOP" "#"
3935141-3935241 usb_power_delivery: eop: "EOP" "E"
3932270-3935241 usb_power_delivery: text: "#15   (655.378333ms): (r2) SNK[5]: GOOD CRC" "..."
4090295-4091583 usb_power_delivery: preamble: "Preamble" "..."
4091583-4091681 usb_power_delivery: sym: "SYNC-1" "S1"
4091681-4091784 usb_power_delivery: sym: "SYNC-1" "S1"
4091784-4091882 usb_power_delivery: sym: "SYNC-1" "S1"
4091882-4091985 usb_power_delivery: sym: "SYNC-2" "S2"
4091583-4091985 usb_power_delivery: sop: "SOP" "S"
4091985-4092083 usb_power_delivery: sym: "0x1" "1"
4092083-4092184 usb_power_delivery: sym: "0x6" "6"
4092184-4092287 usb_power_delivery: sym: "0xD" "D"
4092287-4092388 usb_power_delivery: sym: "0x5" "5"
4091985-4092388 usb_power_delivery: header: "H:5d61" "HD"
4090295-4097336 usb_power_delivery: src: "(r2) SRC[6]: SOURCE CAP" "SOURCE CAP"
4092388-4092488 usb_power_delivery: sym: "0xC" "C"
4092488-4092586 usb_power_delivery: sym: "0x2" "2"
4092586-4092689 usb_power_delivery: sym: "0x1" "1"
4092689-4092790 usb_power_delivery: sym: "0x9" "9"
4092790-4092888 usb_power_delivery: sym: "0x1" "1"
4092888-4092991 usb_power_delivery: sym: "0x0" "0"
4092991-4093090 usb_power_delivery: sym: "0x8" "8"
4093090-4093193 usb_power_delivery: sym: "0x2" "2"
4092388-4093193 usb_power_delivery: data: "[0]2801912c" "D0"
4092388-4093193 usb_power_delivery: payload: "[1] [Fixed] 5V 3A (15W) [dual_role_power] [unconstrained]" "[1] [Fixed] 5V 3A (15W) [dual_role_power] [unconstrained]"
4093193-4093293 usb_power_delivery: sym: "0xC" "C"
4093293-4093391 usb_power_delivery: sym: "0x2" "2"
4093391-4093494 usb_power_delivery: sym: "0x1" "1"
4093494-4093593 usb_power_delivery: sym: "0xD" "D"
4093593-4093696 usb_power_delivery: sym: "0x2" "2"
4093696-4093794 usb_power_delivery: sym: "0x0" "0"
4093794-4093897 usb_power_delivery: sym: "0x0" "0"
4093897-4093995 usb_power_delivery: sym: "0x0" "0"
4093193-4093995 usb_power_delivery: data: "[1]0002d12c" "D1"
4093193-4093995 usb_power_delivery: payload: "[2] [Fixed] 9V 3A (27W)" "[2] [Fixed] 9V 3A (27W)"
4093995-4094096 usb_power_delivery: sym: "0xA" "A"
4094096-4094199 usb_power_delivery: sym: "0xF" "F"
4094199-4094297 usb_power_delivery: sym: "0x0" "0"
4094297-4094397 usb_power_delivery: sym: "0xC" "C"
4094397-4094498 usb_power_delivery: sym: "0x3" "3"
4094498-4094601 usb_power_delivery: sym: "0x0" "0"
4094601-4094699 usb_power_delivery: sym: "0x0" "0"
4094699-4094802 usb_power_delivery: sym: "0x0" "0"
4093995-4094802 usb_power_delivery: data: "[2]0003c0fa" "D2"
4093995-4094802 usb_power_delivery: payload: "[3] [Fixed] 12V 2.5A (30W)" "[3] [Fixed] 12V 2.5A (30W)"
4094802-4094901 usb_power_delivery: sym: "0x8" "8"
4094901-4095001 usb_power_delivery: sym: "0xC" "C"
4095001-4095104 usb_power_delivery: sym: "0x0" "0"
4095104-4095202 usb_power_delivery: sym: "0xB" "B"
4095202-4095306 usb_power_delivery: sym: "0x4" "4"
4095306-4095404 usb_power_delivery: sym: "0x0" "0"
4095404-4095507 usb_power_delivery: sym: "0x0" "0"
4095507-4095605 usb_power_delivery: sym: "0x0" "0"
4094802-4095605 usb_power_delivery: data: "[3]0004b0c8" "D3"
4094802-4095605 usb_power_delivery: payload: "[4] [Fixed] 15V 2A (30W)" "[4] [Fixed] 15V 2A (30W)"
4095605-4095708 usb_power_delivery: sym: "0xD" "D"
4095708-4095806 usb_power_delivery: sym: "0x7" "7"
4095806-4095909 usb_power_delivery: sym: "0x0" "0"
4095909-4096007 usb_power_delivery: sym: "0x4" "4"
4096007-4096108 usb_power_delivery: sym: "0x6" "6"
4096108-4096211 usb_power_delivery: sym: "0x0" "0"
4096211-4096309 usb_power_delivery: sym: "0x0" "0"
4096309-4096412 usb_power_delivery: sym: "0x0" "0"
4095605-4096412 usb_power_delivery: data: "[4]0006407d" "D4"
4095605-4096412 usb_power_delivery: payload: "[5] [Fixed] 20V 1.25A (25W)" "[5] [Fixed] 20V 1.25A (25W)"
4096412-4096510 usb_power_delivery: sym: "0x1" "1"
4096510-4096614 usb_power_delivery: sym: "0x4" "4"
4096614-4096712 usb_power_delivery: sym: "0x1" "1"
4096712-4096815 usb_power_delivery: sym: "0x4" "4"
4096815-4096915 usb_power_delivery: sym: "0xE" "E"
4096915-4097014 usb_power_delivery: sym: "0x1" "1"
4097014-4097117 usb_power_delivery: sym: "0xB" "B"
4097117-4097217 usb_power_delivery: sym: "0x3" "3"
4096412-4097217 usb_power_delivery: crc: "CRC:3b1e4141" "CRC"
4097217-4097318 usb_power_delivery: sym: "EOP" "#"
4097217-4097318 usb_power_delivery: eop: "EOP" "E"
4090295-4097318 usb_power_delivery: text: "#16   (681.715833ms): (r2) SRC[6]: SOURCE CAP - [1] [Fixed] 5V 3A (15W) [dual_role_power] [unconstrained] - [2] [Fixed] 9V 3A (27W) - [3] [Fixed] 12V 2.5A (30W) - [4] [Fixed] 15V 2A (30W) - [5] [Fixed] 20V 1.25A (25W)" "..."
4097849-4099123 usb_power_delivery: preamble: "Preamble" "..."
4099123-4099220 usb_power_delivery: sym: "SYNC-1" "S1"
4099220-4099322 usb_power_delivery: sym: "SYNC-1" "S1"
4099322-4099420 usb_power_delivery: sym: "SYNC-1" "S1"
4099420-4099522 usb_power_delivery: sym: "SYNC-2" "S2"
4099123-4099522 usb_power_delivery: sop: "SOP" "S"
4099522-4099619 usb_power_delivery: sym: "0x1" "1"
4099619-4099722 usb_power_delivery: sym: "0x4" "4"
4099722-4099822 usb_power_delivery: sym: "0xC" "C"
4099822-4099919 usb_power_delivery: sym: "0x0" "0"
4099522-4099919 usb_power_delivery: header: "H:0c41" "HD"
4097849-4100857 usb_power_delivery: snk: "(r2) SNK[6]: GOOD CRC" "GOOD CRC"
4099919-4100021 usb_power_delivery: sym: "0x0" "0"
4100021-4100121 usb_power_delivery: sym: "0x9" "9"
4100121-4100219 usb_power_delivery: sym: "0x0" "0"
4100219-4100321 usb_power_delivery: sym: "0x2" "2"
4100321-4100418 usb_power_delivery: sym: "0xD" "D"
4100418-4100521 usb_power_delivery: sym: "0x0" "0"
4100521-4100618 usb_power_delivery: sym: "0x1" "1"
4100618-4100718 usb_power_delivery: sym: "0xA" "A"
4099919-4100718 usb_power_delivery: crc: "CRC:a10d2090" "CRC"
4100718-4100818 usb_power_delivery: sym: "EOP" "#"
4100718-4100818 usb_power_delivery: eop: "EOP" "E"
4097849-4100818 usb_power_delivery: text: "#17   (682.974833ms): (r2) SNK[6]: GOOD CRC" "..."
4105754-4107028 usb_power_delivery: preamble: "Preamble" "..."
4107028-4107125 usb_power_delivery: sym: "SYNC-1" "S1"
4107125-4107228 usb_power_delivery: sym: "SYNC-1" "S1"
4107228-4107325 usb_power_delivery: sym: "SYNC-1" "S1"
4107325-4107428 usb_power_delivery: sym: "SYNC-2" "S2"
4107028-4107428 usb_power_delivery: sop: "SOP" "S"
4107428-4107525 usb_power_delivery: sym: "0x2" "2"
4107525-4107627 usb_power_delivery: sym: "0x4" "4"
4107627-4107725 usb_power_delivery: sym: "0x2" "2"
4107725-4107827 usb_power_delivery: sym: "0x1" "1"
4107428-4107827 usb_power_delivery: header: "H:1242" "HD"
4105754-4109562 usb_power_delivery: snk: "(r2) SNK[1]: REQUEST" "REQUEST"
4107827-4107927 usb_power_delivery: sym: "0xC" "C"
4107927-4108024 usb_power_delivery: sym: "0x2" "2"
4108024-4108127 usb_power_delivery: sym: "0x1" "1"
4108127-4108224 usb_power_delivery: sym: "0xB" "B"
4108224-4108327 usb_power_delivery: sym: "0x4" "4"
4108327-4108424 usb_power_delivery: sym: "0x0" "0"
4108424-4108524 usb_power_delivery: sym: "0x3" "3"
4108524-4108626 usb_power_delivery: sym: "0x1" "1"
4107827-4108626 usb_power_delivery: data: "[0]1304b12c" "D0"
4107827-4108626 usb_power_delivery: payload: "[1] (PDO #1: Fixed 5V) 3A (operating) / 3A (max) [comm_cap] [no_suspend]" "[1] (PDO #1: Fixed 5V) 3A (operating) / 3A (max) [comm_cap] [no_suspend]"
4108626-4108723 usb_power_delivery: sym: "0xD" "D"
4108723-4108823 usb_power_delivery: sym: "0x5" "5"
4108823-4108923 usb_power_delivery: sym: "0xE" "E"
4108923-4109023 usb_power_delivery: sym: "0xC" "C"
4109023-4109126 usb_power_delivery: sym: "0x8" "8"
4109126-4109223 usb_power_delivery: sym: "0xD" "D"
4109223-4109325 usb_power_delivery: sym: "0x7" "7"
4109325-4109422 usb_power_delivery: sym: "0x2" "2"
4108626-4109422 usb_power_delivery: crc: "CRC:27d8ce5d" "CRC"
4109422-4109522 usb_power_delivery: sym: "EOP" "#"
4109422-4109522 usb_power_delivery: eop: "EOP" "E"
4105754-4109522 usb_power_delivery: text: "#18   (684.292333ms): (r2) SNK[1]: REQUEST - [1] (PDO #1: Fixed 5V) 3A (operating) / 3A (max) [comm_cap] [no_suspend]" "..."
4110620-4111907 usb_power_delivery: preamble: "Preamble" "..."
4111907-4112006 usb_power_delivery: sym: "SYNC-1" "S1"
4112006-4112109 usb_power_delivery: sym: "SYNC-1" "S1"
4112109-4112207 usb_power_delivery: sym: "SYNC-1" "S1"
4112207-4112310 usb_power_delivery: sym: "SYNC-2" "S2"
4111907-4112310 usb_power_delivery: sop: "SOP" "S"
4112310-4112408 usb_power_delivery: sym: "0x1" "1"
4112408-4112509 usb_power_delivery: sym: "0x6" "6"
4112509-4112609 usb_power_delivery: sym: "0x3" "3"
4112609-4112712 usb_power_delivery: sym: "0x0" "0"
4112310-4112712 usb_power_delivery: header: "H:0361" "HD"
4110620-4113636 usb_power_delivery: src: "(r2) SRC[1]: GOOD CRC" "GOOD CRC"
4112712-4112813 usb_power_delivery: sym: "0x3" "3"
4112813-4112914 usb_power_delivery: sym: "0xA" "A"
4112914-4113014 usb_power_delivery: sym: "0x9" "9"
4113014-4113112 usb_power_delivery: sym: "0x1" "1"
4113112-4113213 usb_power_delivery: sym: "0x6" "6"
4113213-4113314 usb_power_delivery: sym: "0x3" "3"
4113314-4113417 usb_power_delivery: sym: "0x4" "4"
4113417-4113517 usb_power_delivery: sym: "0xA" "A"
4112712-4113517 usb_power_delivery: crc: "CRC:a43619a3" "CRC"
4113517-4113618 usb_power_delivery: sym: "EOP" "#"
4113517-4113618 usb_power_delivery: eop: "EOP" "E"
4110620-4113618 usb_power_delivery: text: "#19   (685.103333ms): (r2) SRC[1]: GOOD CRC" "..."
4127543-4128831 usb_power_delivery: preamble: "Preamble" "..."
4128831-4128929 usb_power_delivery: sym: "SYNC-1" "S1"
4128929-4129032 usb_power_delivery: sym: "SYNC-1" "S1"
4129032-4129130 usb_power_delivery: sym: "SYNC-1" "S1"
4129130-4129233 usb_power_delivery: sym: "SYNC-2" "S2"
4128831-4129233 usb_power_delivery: sop: "SOP" "S"
4129233-4129334 usb_power_delivery: sym: "0x3" "3"
4129334-4129434 usb_power_delivery: sym: "0x6" "6"
4129434-4129533 usb_power_delivery: sym: "0xF" "F"
4129533-4129636 usb_power_delivery: sym: "0x0" "0"
4129233-4129636 usb_power_delivery: header: "H:0f63" "HD"
4127543-4130559 usb_power_delivery: src: "(r2) SRC[7]: ACCEPT" "ACCEPT"
4129636-4129736 usb_power_delivery: sym: "0xA" "A"
4129736-4129834 usb_power_delivery: sym: "0x0" "0"
4129834-4129937 usb_power_delivery: sym: "0x7" "7"
4129937-4130038 usb_power_delivery: sym: "0x3" "3"
4130038-4130139 usb_power_delivery: sym: "0x6" "6"
4130139-4130237 usb_power_delivery: sym: "0xB" "B"
4130237-4130340 usb_power_delivery: sym: "0xF" "F"
4130340-4130440 usb_power_delivery: sym: "0x9" "9"
4129636-4130440 usb_power_delivery: crc: "CRC:9fb6370a" "CRC"
4130440-4130541 usb_power_delivery: sym: "EOP" "#"
4130440-4130541 usb_power_delivery: eop: "EOP" "E"
4127543-4130541 usb_power_delivery: text: "#20   (687.923833ms): (r2) SRC[7]: ACCEPT" "..."
4131072-4132346 usb_power_delivery: preamble: "Preamble" "..."
4132346-4132443 usb_power_delivery: sym: "SYNC-1" "S1"
4132443-4132546 usb_power_delivery: sym: "SYNC-1" "S1"
4132546-4132643 usb_power_delivery: sym: "SYNC-1" "S1"
4132643-4132745 usb_power_delivery: sym: "SYNC-2" "S2"
4132346-4132745 usb_power_delivery: sop: "SOP" "S"
4132745-4132843 usb_power_delivery: sym: "0x1" "1"
4132843-4132945 usb_power_delivery: sym: "0x4" "4"
4132945-4133045 usb_power_delivery: sym: "0xE" "E"
4133045-4133142 usb_power_delivery: sym: "0x0" "0"
4132745-4133142 usb_power_delivery: header: "H:0e41" "HD"
4131072-4134081 usb_power_delivery: snk: "(r2) SNK[7]: GOOD CRC" "GOOD CRC"
4133142-4133242 usb_power_delivery: sym: "0xC" "C"
4133242-4133345 usb_power_delivery: sym: "0xB" "B"
4133345-4133442 usb_power_delivery: sym: "0x1" "1"
4133442-4133544 usb_power_delivery: sym: "0x4" "4"
4133544-4133644 usb_power_delivery: sym: "0x3" "3"
4133644-4133741 usb_power_delivery: sym: "0x0" "0"
4133741-4133844 usb_power_delivery: sym: "0xF" "F"
4133844-4133941 usb_power_delivery: sym: "0x4" "4"
4133142-4133941 usb_power_delivery: crc: "CRC:4f0341bc" "CRC"
4133941-4134041 usb_power_delivery: sym: "EOP" "#"
4133941-4134041 usb_power_delivery: eop: "EOP" "E"
4131072-4134041 usb_power_delivery: text: "#21   (688.512000ms): (r2) SNK[7]: GOOD CRC" "..."
4306356-4307644 usb_power_delivery: preamble: "Preamble" "..."
4307644-4307742 usb_power_delivery: sym: "SYNC-1" "S1"
4307742-4307845 usb_power_delivery: sym: "SYNC-1" "S1"
4307845-4307943 usb_power_delivery: sym: "SYNC-1" "S1"
4307943-4308046 usb_power_delivery: sym: "SYNC-2" "S2"
4307644-4308046 usb_power_delivery: sop: "SOP" "S"
4308046-4308147 usb_power_delivery: sym: "0x6" "6"
4308147-4308247 usb_power_delivery: sym: "0x6" "6"
4308247-4308346 usb_power_delivery: sym: "0x1" "1"
4308346-4308449 usb_power_delivery: sym: "0x0" "0"
4308046-4308449 usb_power_delivery: header: "H:0166" "HD"
4306356-4309372 usb_power_delivery: src: "(r2) SRC[0]: PS RDY" "PS RDY"
4308449-4308547 usb_power_delivery: sym: "0x8" "8"
4308547-4308650 usb_power_delivery: sym: "0x4" "4"
4308650-4308750 usb_power_delivery: sym: "0xE" "E"
4308750-4308851 usb_power_delivery: sym: "0xE" "E"
4308851-4308952 usb_power_delivery: sym: "0x9" "9"
4308952-4309050 usb_power_delivery: sym: "0x7" "7"
4309050-4309150 usb_power_delivery: sym: "0x5" "5"
4309150-4309253 usb_power_delivery: sym: "0x0" "0"
4308449-4309253 usb_power_delivery: crc: "CRC:0579ee48" "CRC"
4309253-4309354 usb_power_delivery: sym: "EOP" "#"
4309253-4309354 usb_power_delivery: eop: "EOP" "E"
4306356-4309354 usb_power_delivery: text: "#22   (717.726000ms): (r2) SRC[0]: PS RDY" "..."
4309885-4311159 usb_power_delivery: preamble: "Preamble" "..."
4311159-4311256 usb_power_delivery: sym: "SYNC-1" "S1"
4311256-4311359 usb_power_delivery: sym: "SYNC-1" "S1"
4311359-4311456 usb_power_delivery: sym: "SYNC-1" "S1"
4311456-4311558 usb_power_delivery: sym: "SYNC-2" "S2"
4311159-4311558 usb_power_delivery: sop: "SOP" "S"
4311558-4311655 usb_power_delivery: sym: "0x1" "1"
4311655-4311758 usb_power_delivery: sym: "0x4" "4"
4311758-4311855 usb_power_delivery: sym: "0x0" "0"
4311855-4311958 usb_power_delivery: sym: "0x0" "0"
4311558-4311958 usb_power_delivery: header: "H:0041" "HD"
4309885-4312893 usb_power_delivery: snk: "(r2) SNK[0]: GOOD CRC" "GOOD CRC"
4311958-4312055 usb_power_delivery: sym: "0xB" "B"
4312055-4312158 usb_power_delivery: sym: "0xB" "B"
4312158-4312257 usb_power_delivery: sym: "0xC" "C"
4312257-4312357 usb_power_delivery: sym: "0x6" "6"
4312357-4312454 usb_power_delivery: sym: "0xB" "B"
4312454-4312557 usb_power_delivery: sym: "0xB" "B"
4312557-4312654 usb_power_delivery: sym: "0x8" "8"
4312654-4312754 usb_power_delivery: sym: "0xA" "A"
4311958-4312754 usb_power_delivery: crc: "CRC:a8bb6cbb" "CRC"
4312754-4312854 usb_power_delivery: sym: "EOP" "#"
4312754-4312854 usb_power_delivery: eop: "EOP" "E"
4309885-4312854 usb_power_delivery: text: "#23   (718.314167ms): (r2) SNK[0]: GOOD CRC" "..."
12702720-12703994 usb_power_delivery: preamble: "Preamble" "..."
12703994-12704091 usb_power_delivery: sym: "SYNC-1" "S1"
12704091-12704193 usb_power_delivery: sym: "SYNC-1" "S1"
12704193-12704290 usb_power_delivery: sym: "SYNC-1" "S1"
12704290-12704393 usb_power_delivery: sym: "SYNC-2" "S2"
12703994-12704393 usb_power_delivery: sop: "SOP" "S"
12704393-12704490 usb_power_delivery: sym: "0x2" "2"
12704490-12704593 usb_power_delivery: sym: "0x4" "4"
12704593-12704690 usb_power_delivery: sym: "0x4" "4"
12704690-12704792 usb_power_delivery: sym: "0x1" "1"
12704393-12704792 usb_power_delivery: header: "H:1442" "HD"
12702720-12706490 usb_power_delivery: snk: "(r2) SNK[2]: REQUEST" "REQUEST"
12704792-12704892 usb_power_delivery: sym: "0xC" "C"
12704892-12704989 usb_power_delivery: sym: "0x2" "2"
12704989-12705092 usb_power_delivery: sym: "0x1" "1"
12705092-12705189 usb_power_delivery: sym: "0xB" "B"
12705189-12705292 usb_power_delivery: sym: "0x4" "4"
12705292-12705389 usb_power_delivery: sym: "0x0" "0"
12705389-12705489 usb_power_delivery: sym: "0x3" "3"
12705489-12705591 usb_power_delivery: sym: "0x2" "2"
12704792-12705591 usb_power_delivery: data: "[0]2304b12c" "D0"
12704792-12705591 usb_power_delivery: payload: "[1] (PDO #2: Fixed 9V) 3A (operating) / 3A (max) [comm_cap] [no_suspend]" "[1] (PDO #2: Fixed 9V) 3A (operating) / 3A (max) [comm_cap] [no_suspend]"
12705591-12705689 usb_power_delivery: sym: "0x1" "1"
12705689-12705788 usb_power_delivery: sym: "0x5" "5"
12705788-12705891 usb_power_delivery: sym: "0xB" "B"
12705891-12705988 usb_power_delivery: sym: "0x0" "0"
12705988-12706091 usb_power_delivery: sym: "0x1" "1"
12706091-12706188 usb_power_delivery: sym: "0x4" "4"
12706188-12706288 usb_power_delivery: sym: "0xE" "E"
12706288-12706390 usb_power_delivery: sym: "0x8" "8"
12705591-12706390 usb_power_delivery: crc: "CRC:8e410b51" "CRC"
12706390-12706490 usb_power_delivery: sym: "EOP" "#"
12706390-12706490 usb_power_delivery: eop: "EOP" "E"
12702720-12706490 usb_power_delivery: text: "#24   (2117.120000ms): (r2) SNK[2]: REQUEST - [1] (PDO #2: Fixed 9V) 3A (operating) / 3A (max) [comm_cap] [no_suspend]" "..."
12707582-12708870 usb_power_delivery: preamble: "Preamble" "..."
12708870-12708968 usb_power_delivery: sym: "SYNC-1" "S1"
12708968-12709071 usb_power_delivery: sym: "SYNC-1" "S1"
12709071-12709169 usb_power_delivery: sym: "SYNC-1" "S1"
12709169-12709273 usb_power_delivery: sym: "SYNC-2" "S2"
12708870-12709273 usb_power_delivery: sop: "SOP" "S"
12709273-12709371 usb_power_delivery: sym: "0x1" "1"
12709371-12709471 usb_power_delivery: sym: "0x6" "6"
12709471-12709572 usb_power_delivery: sym: "0x5" "5"
12709572-12709675 usb_power_delivery: sym: "0x0" "0"
12709273-12709675 usb_power_delivery: header: "H:0561" "HD"
12707582-12710619 usb_power_delivery: src: "(r2) SRC[2]: GOOD CRC" "GOOD CRC"
12709675-12709776 usb_power_delivery: sym: "0x6" "6"
12709776-12709876 usb_power_delivery: sym: "0x9" "9"
12709876-12709977 usb_power_delivery: sym: "0xC" "C"
12709977-12710075 usb_power_delivery: sym: "0xB" "B"
12710075-12710176 usb_power_delivery: sym: "0x5" "5"
12710176-12710276 usb_power_delivery: sym: "0x5" "5"
12710276-12710379 usb_power_delivery: sym: "0xD" "D"
12710379-12710478 usb_power_delivery: sym: "0x4" "4"
12709675-12710478 usb_power_delivery: crc: "CRC:4d55bc96" "CRC"
12710478-12710578 usb_power_delivery: sym: "EOP" "#"
12710478-12710578 usb_power_delivery: eop: "EOP" "E"
12707582-12710578 usb_power_delivery: text: "#25   (2117.930333ms): (r2) SRC[2]: GOOD CRC" "..."
12725634-12726921 usb_power_delivery: preamble: "Preamble" "..."
12726921-12727020 usb_power_delivery: sym: "SYNC-1" "S1"
12727020-12727123 usb_power_delivery: sym: "SYNC-1" "S1"
12727123-12727221 usb_power_delivery: sym: "SYNC-1" "S1"
12727221-12727324 usb_power_delivery: sym: "SYNC-2" "S2"
12726921-12727324 usb_power_delivery: sop: "SOP" "S"
12727324-12727425 usb_power_delivery: sym: "0x3" "3"
12727425-12727525 usb_power_delivery: sym: "0x6" "6"
12727525-12727626 usb_power_delivery: sym: "0x3" "3"
12727626-12727724 usb_power_delivery: sym: "0x0" "0"
12727324-12727724 usb_power_delivery: header: "H:0363" "HD"
12725634-12728670 usb_power_delivery: src: "(r2) SRC[1]: ACCEPT" "ACCEPT"
12727724-12727827 usb_power_delivery: sym: "0x1" "1"
12727827-12727925 usb_power_delivery: sym: "0x2" "2"
12727925-12728028 usb_power_delivery: sym: "0xB" "B"
12728028-12728127 usb_power_delivery: sym: "0x7" "7"
12728127-12728230 usb_power_delivery: sym: "0x0" "0"
12728230-12728328 usb_power_delivery: sym: "0x0" "0"
12728328-12728428 usb_power_delivery: sym: "0x6" "6"
12728428-12728529 usb_power_delivery: sym: "0x9" "9"
12727724-12728529 usb_power_delivery: crc: "CRC:96007b21" "CRC"
12728529-12728630 usb_power_delivery: sym: "EOP" "#"
12728529-12728630 usb_power_delivery: eop: "EOP" "E"
12725634-12728630 usb_power_delivery: text: "#26   (2120.939000ms): (r2) SRC[1]: ACCEPT" "..."
12729164-12730438 usb_power_delivery: preamble: "Preamble" "..."
12730438-12730535 usb_power_delivery: sym: "SYNC-1" "S1"
12730535-12730637 usb_power_delivery: sym: "SYNC-1" "S1"
12730637-12730734 usb_power_delivery: sym: "SYNC-1" "S1"
12730734-12730837 usb_power_delivery: sym: "SYNC-2" "S2"
12730438-12730837 usb_power_delivery: sop: "SOP" "S"
12730837-12730934 usb_power_delivery: sym: "0x1" "1"
12730934-12731037 usb_power_delivery: sym: "0x4" "4"
12731037-12731134 usb_power_delivery: sym: "0x2" "2"
12731134-12731236 usb_power_delivery: sym: "0x0" "0"
12730837-12731236 usb_power_delivery: header: "H:0241" "HD"
12729164-12732172 usb_power_delivery: snk: "(r2) SNK[1]: GOOD CRC" "GOOD CRC"
12731236-12731334 usb_power_delivery: sym: "0x7" "7"
12731334-12731434 usb_power_delivery: sym: "0x9" "9"
12731434-12731536 usb_power_delivery: sym: "0xD" "D"
12731536-12731633 usb_power_delivery: sym: "0x0" "0"
12731633-12731733 usb_power_delivery: sym: "0x5" "5"
12731733-12731836 usb_power_delivery: sym: "0xB" "B"
12731836-12731936 usb_power_delivery: sym: "0x6" "6"
12731936-12732033 usb_power_delivery: sym: "0x4" "4"
12731236-12732033 usb_power_delivery: crc: "CRC:46b50d97" "CRC"
12732033-12732133 usb_power_delivery: sym: "EOP" "#"
12732033-12732133 usb_power_delivery: eop: "EOP" "E"
12729164-12732133 usb_power_delivery: text: "#27   (2121.527333ms): (r2) SNK[1]: GOOD CRC" "..."
12963173-12964460 usb_power_delivery: preamble: "Preamble" "..."
12964460-12964558 usb_power_delivery: sym: "SYNC-1" "S1"
12964558-12964661 usb_power_delivery: sym: "SYNC-1" "S1"
12964661-12964760 usb_power_delivery: sym: "SYNC-1" "S1"
12964760-12964862 usb_power_delivery: sym: "SYNC-2" "S2"
12964460-12964862 usb_power_delivery: sop: "SOP" "S"
12964862-12964963 usb_power_delivery: sym: "0x6" "6"
12964963-12965064 usb_power_delivery: sym: "0x6" "6"
12965064-12965164 usb_power_delivery: sym: "0x5" "5"
12965164-12965263 usb_power_delivery: sym: "0x0" "0"
12964862-12965263 usb_power_delivery: header: "H:0566" "HD"
12963173-12966208 usb_power_delivery: src: "(r2) SRC[2]: PS RDY" "PS RDY"
12965263-12965366 usb_power_delivery: sym: "0x1" "1"
12965366-12965466 usb_power_delivery: sym: "0x5" "5"
12965466-12965567 usb_power_delivery: sym: "0xA" "A"
12965567-12965665 usb_power_delivery: sym: "0x2" "2"
12965665-12965768 usb_power_delivery: sym: "0x4" "4"
12965768-12965866 usb_power_delivery: sym: "0x1" "1"
12965866-12965969 usb_power_delivery: sym: "0x2" "2"
12965969-12966067 usb_power_delivery: sym: "0x0" "0"
12965263-12966067 usb_power_delivery: crc: "CRC:02142a51" "CRC"
12966067-12966168 usb_power_delivery: sym: "EOP" "#"
12966067-12966168 usb_power_delivery: eop: "EOP" "E"
12963173-12966168 usb_power_delivery: text: "#28   (2160.528833ms): (r2) SRC[2]: PS RDY" "..."
12966701-12967975 usb_power_delivery: preamble: "Preamble" "..."
12967975-12968072 usb_power_delivery: sym: "SYNC-1" "S1"
12968072-12968174 usb_power_delivery: sym: "SYNC-1" "S1"
12968174-12968271 usb_power_delivery: sym: "SYNC-1" "S1"
12968271-12968374 usb_power_delivery: sym: "SYNC-2" "S2"
12967975-12968374 usb_power_delivery: sop: "SOP" "S"
12968374-12968471 usb_power_delivery: sym: "0x1" "1"
12968471-12968574 usb_power_delivery: sym: "0x4" "4"
12968574-12968671 usb_power_delivery: sym: "0x4" "4"
12968671-12968774 usb_power_delivery: sym: "0x0" "0"
12968374-12968774 usb_power_delivery: header: "H:0441" "HD"
12966701-12969672 usb_power_delivery: snk: "(r2) SNK[2]: GOOD CRC" "GOOD CRC"
12968774-12968870 usb_power_delivery: sym: "0x2" "2"
12968870-12968970 usb_power_delivery: sym: "0xA" "A"
12968970-12969073 usb_power_delivery: sym: "0x8" "8"
12969073-12969173 usb_power_delivery: sym: "0xA" "A"
12969173-12969273 usb_power_delivery: sym: "0x6" "6"
12969273-12969370 usb_power_delivery: sym: "0xD" "D"
12969370-12969473 usb_power_delivery: sym: "0xF" "F"
12969473-12969572 usb_power_delivery: sym: "0xA" "A"
12968774-12969572 usb_power_delivery: crc: "CRC:afd6a8a2" "CRC"
12969572-12969672 usb_power_delivery: sym: "EOP" "#"
12969572-12969672 usb_power_delivery: eop: "EOP" "E"
12966701-12969672 usb_power_delivery: text: "#29   (2161.116833ms): (r2) SNK[2]: GOOD CRC" "..."
23757965-23759238 usb_power_delivery: preamble: "Preamble" "..."
23759238-23759335 usb_power_delivery: sym: "SYNC-1" "S1"
23759335-23759438 usb_power_delivery: sym: "SYNC-1" "S1"
23759438-23759535 usb_power_delivery: sym: "SYNC-1" "S1"
23759535-23759638 usb_power_delivery: sym: "SYNC-2" "S2"
23759238-23759638 usb_power_delivery: sop: "SOP" "S"
23759638-23759735 usb_power_delivery: sym: "0x2" "2"
23759735-23759838 usb_power_delivery: sym: "0x4" "4"
23759838-23759937 usb_power_delivery: sym: "0x6" "6"
23759937-23760034 usb_power_delivery: sym: "0x1" "1"
23759638-23760034 usb_power_delivery: header: "H:1642" "HD"
23757965-23761735 usb_power_delivery: snk: "(r2) SNK[3]: REQUEST" "REQUEST"
23760034-23760134 usb_power_delivery: sym: "0xA" "A"
23760134-23760237 usb_power_delivery: sym: "0xF" "F"
23760237-23760334 usb_power_delivery: sym: "0x8" "8"
23760334-23760434 usb_power_delivery: sym: "0xE" "E"
23760434-23760534 usb_power_delivery: sym: "0x3" "3"
23760534-23760636 usb_power_delivery: sym: "0x0" "0"
23760636-23760736 usb_power_delivery: sym: "0x3" "3"
23760736-23760836 usb_power_delivery: sym: "0x3" "3"
23760034-23760836 usb_power_delivery: data: "[0]3303e8fa" "D0"
23760034-23760836 usb_power_delivery: payload: "[1] (PDO #3: Fixed 12V) 2.5A (operating) / 2.5A (max) [comm_cap] [no_suspend]" "[1] (PDO #3: Fixed 12V) 2.5A (operating) / 2.5A (max) [comm_cap] [no_suspend]"
23760836-23760933 usb_power_delivery: sym: "0x8" "8"
23760933-23761033 usb_power_delivery: sym: "0xE" "E"
23761033-23761136 usb_power_delivery: sym: "0xD" "D"
23761136-23761233 usb_power_delivery: sym: "0x2" "2"
23761233-23761332 usb_power_delivery: sym: "0x5" "5"
23761332-23761435 usb_power_delivery: sym: "0x2" "2"
23761435-23761535 usb_power_delivery: sym: "0x6" "6"
23761535-23761635 usb_power_delivery: sym: "0xC" "C"
23760836-23761635 usb_power_delivery: crc: "CRC:c6252de8" "CRC"
23761635-23761735 usb_power_delivery: sym: "EOP" "#"
23761635-23761735 usb_power_delivery: eop: "EOP" "E"
23757965-23761735 usb_power_delivery: text: "#30   (3959.660833ms): (r2) SNK[3]: REQUEST - [1] (PDO #3: Fixed 12V) 2.5A (operating) / 2.5A (max) [comm_cap] [no_suspend]" "..."
23762827-23764115 usb_power_delivery: preamble: "Preamble" "..."
23764115-23764213 usb_power_delivery: sym: "SYNC-1" "S1"
23764213-23764316 usb_power_delivery: sym: "SYNC-1" "S1"
23764316-23764415 usb_power_delivery: sym: "SYNC-1" "S1"
23764415-23764517 usb_power_delivery: sym: "SYNC-2" "S2"
23764115-23764517 usb_power_delivery: sop: "SOP" "S"
23764517-23764616 usb_power_delivery: sym: "0x1" "1"
23764616-23764716 usb_power_delivery: sym: "0x6" "6"
23764716-23764819 usb_power_delivery: sym: "0x7" "7"
23764819-23764918 usb_power_delivery: sym: "0x0" "0"
23764517-23764918 usb_power_delivery: header: "H:0761" "HD"
23762827-23765864 usb_power_delivery: src: "(r2) SRC[3]: GOOD CRC" "GOOD CRC"
23764918-23765018 usb_power_delivery: sym: "0xA" "A"
23765018-23765121 usb_power_delivery: sym: "0xB" "B"
23765121-23765220 usb_power_delivery: sym: "0xD" "D"
23765220-23765323 usb_power_delivery: sym: "0xD" "D"
23765323-23765421 usb_power_delivery: sym: "0xB" "B"
23765421-23765521 usb_power_delivery: sym: "0x5" "5"
23765521-23765622 usb_power_delivery: sym: "0x3" "3"
23765622-23765723 usb_power_delivery: sym: "0xA" "A"
23764918-23765723 usb_power_delivery: crc: "CRC:a35bddba" "CRC"
23765723-23765823 usb_power_delivery: sym: "EOP" "#"
23765723-23765823 usb_power_delivery: eop: "EOP" "E"
23762827-23765823 usb_power_delivery: text: "#31   (3960.471167ms): (r2) SRC[3]: GOOD CRC" "..."
23780798-23782086 usb_power_delivery: preamble: "Preamble" "..."
23782086-23782184 usb_power_delivery: sym: "SYNC-1" "S1"
23782184-23782287 usb_power_delivery: sym: "SYNC-1" "S1"
23782287-23782385 usb_power_delivery: sym: "SYNC-1" "S1"
23782385-23782488 usb_power_delivery: sym: "SYNC-2" "S2"
23782086-23782488 usb_power_delivery: sop: "SOP" "S"
23782488-23782589 usb_power_delivery: sym: "0x3" "3"
23782589-23782690 usb_power_delivery: sym: "0x6" "6"
23782690-23782788 usb_power_delivery: sym: "0x7" "7"
23782788-23782891 usb_power_delivery: sym: "0x0" "0"
23782488-23782891 usb_power_delivery: header: "H:0763" "HD"
23780798-23783835 usb_power_delivery: src: "(r2) SRC[3]: ACCEPT" "ACCEPT"
23782891-23782989 usb_power_delivery: sym: "0x8" "8"
23782989-23783090 usb_power_delivery: sym: "0x3" "3"
23783090-23783193 usb_power_delivery: sym: "0xF" "F"
23783193-23783291 usb_power_delivery: sym: "0xB" "B"
23783291-23783394 usb_power_delivery: sym: "0xD" "D"
23783394-23783495 usb_power_delivery: sym: "0x6" "6"
23783495-23783593 usb_power_delivery: sym: "0x1" "1"
23783593-23783693 usb_power_delivery: sym: "0x9" "9"
23782891-23783693 usb_power_delivery: crc: "CRC:916dbf38" "CRC"
23783693-23783794 usb_power_delivery: sym: "EOP" "#"
23783693-23783794 usb_power_delivery: eop: "EOP" "E"
23780798-23783794 usb_power_delivery: text: "#32   (3963.466333ms): (r2) SRC[3]: ACCEPT" "..."
23784328-23785602 usb_power_delivery: preamble: "Preamble" "..."
23785602-23785699 usb_power_delivery: sym: "SYNC-1" "S1"
23785699-23785802 usb_power_delivery: sym: "SYNC-1" "S1"
23785802-23785898 usb_power_delivery: sym: "SYNC-1" "S1"
23785898-23786001 usb_power_delivery: sym: "SYNC-2" "S2"
23785602-23786001 usb_power_delivery: sop: "SOP" "S"
23786001-23786098 usb_power_delivery: sym: "0x1" "1"
23786098-23786201 usb_power_delivery: sym: "0x4" "4"
23786201-23786301 usb_power_delivery: sym: "0x6" "6"
23786301-23786398 usb_power_delivery: sym: "0x0" "0"
23786001-23786398 usb_power_delivery: header: "H:0641" "HD"
23784328-23787299 usb_power_delivery: snk: "(r2) SNK[3]: GOOD CRC" "GOOD CRC"
23786398-23786498 usb_power_delivery: sym: "0xE" "E"
23786498-23786600 usb_power_delivery: sym: "0x8" "8"
23786600-23786700 usb_power_delivery: sym: "0x9" "9"
23786700-23786800 usb_power_delivery: sym: "0xC" "C"
23786800-23786897 usb_power_delivery: sym: "0x8" "8"
23786897-23787000 usb_power_delivery: sym: "0xD" "D"
23787000-23787097 usb_power_delivery: sym: "0x1" "1"
23787097-23787199 usb_power_delivery: sym: "0x4" "4"
23786398-23787199 usb_power_delivery: crc: "CRC:41d8c98e" "CRC"
23787199-23787299 usb_power_delivery: sym: "EOP" "#"
23787199-23787299 usb_power_delivery: eop: "EOP" "E"
23784328-23787299 usb_power_delivery: text: "#33   (3964.054667ms): (r2) SNK[3]: GOOD CRC" "..."
24003984-24005272 usb_power_delivery: preamble: "Preamble" "..."
24005272-24005370 usb_power_delivery: sym: "SYNC-1" "S1"
24005370-24005473 usb_power_delivery: sym: "SYNC-1" "S1"
24005473-24005572 usb_power_delivery: sym: "SYNC-1" "S1"
24005572-24005674 usb_power_delivery: sym: "SYNC-2" "S2"
24005272-24005674 usb_power_delivery: sop: "SOP" "S"
24005674-24005775 usb_power_delivery: sym: "0x6" "6"
24005775-24005876 usb_power_delivery: sym: "0x6" "6"
24005876-24005976 usb_power_delivery: sym: "0x9" "9"
24005976-24006075 usb_power_delivery: sym: "0x0" "0"
24005674-24006075 usb_power_delivery: header: "H:0966" "HD"
24003984-24007021 usb_power_delivery: src: "(r2) SRC[4]: PS RDY" "PS RDY"
24006075-24006175 usb_power_delivery: sym: "0xA" "A"
24006175-24006278 usb_power_delivery: sym: "0x7" "7"
24006278-24006379 usb_power_delivery: sym: "0x6" "6"
24006379-24006480 usb_power_delivery: sym: "0x6" "6"
24006480-24006578 usb_power_delivery: sym: "0x2" "2"
24006578-24006678 usb_power_delivery: sym: "0xA" "A"
24006678-24006781 usb_power_delivery: sym: "0xB" "B"
24006781-24006880 usb_power_delivery: sym: "0x0" "0"
24006075-24006880 usb_power_delivery: crc: "CRC:0ba2667a" "CRC"
24006880-24006980 usb_power_delivery: sym: "EOP" "#"
24006880-24006980 usb_power_delivery: eop: "EOP" "E"
24003984-24006980 usb_power_delivery: text: "#34   (4000.664000ms): (r2) SRC[4]: PS RDY" "..."
24007514-24008788 usb_power_delivery: preamble: "Preamble" "..."
24008788-24008885 usb_power_delivery: sym: "SYNC-1" "S1"
24008885-24008988 usb_power_delivery: sym: "SYNC-1" "S1"
24008988-24009085 usb_power_delivery: sym: "SYNC-1" "S1"
24009085-24009188 usb_power_delivery: sym: "SYNC-2" "S2"
24008788-24009188 usb_power_delivery: sop: "SOP" "S"
24009188-24009284 usb_power_delivery: sym: "0x1" "1"
24009284-24009387 usb_power_delivery: sym: "0x4" "4"
24009387-24009484 usb_power_delivery: sym: "0x8" "8"
24009484-24009587 usb_power_delivery: sym: "0x0" "0"
24009188-24009587 usb_power_delivery: header: "H:0841" "HD"
24007514-24010522 usb_power_delivery: snk: "(r2) SNK[4]: GOOD CRC" "GOOD CRC"
24009587-24009687 usb_power_delivery: sym: "0x9" "9"
24009687-24009784 usb_power_delivery: sym: "0x8" "8"
24009784-24009887 usb_power_delivery: sym: "0x4" "4"
24009887-24009987 usb_power_delivery: sym: "0xE" "E"
24009987-24010083 usb_power_delivery: sym: "0x0" "0"
24010083-24010183 usb_power_delivery: sym: "0x6" "6"
24010183-24010283 usb_power_delivery: sym: "0x6" "6"
24010283-24010383 usb_power_delivery: sym: "0xA" "A"
24009587-24010383 usb_power_delivery: crc: "CRC:a660e489" "CRC"
24010383-24010483 usb_power_delivery: sym: "EOP" "#"
24010383-24010483 usb_power_delivery: eop: "EOP" "E"
24007514-24010483 usb_power_delivery: text: "#35   (4001.252333ms): (r2) SNK[4]: GOOD CRC" "..."
34797738-34799012 usb_power_delivery: preamble: "Preamble" "..."
34799012-34799109 usb_power_delivery: sym: "SYNC-1" "S1"
34799109-34799211 usb_power_delivery: sym: "SYNC-1" "S1"
34799211-34799308 usb_power_delivery: sym: "SYNC-1" "S1"
34799308-34799411 usb_power_delivery: sym: "SYNC-2" "S2"
34799012-34799411 usb_power_delivery: sop: "SOP" "S"
34799411-34799508 usb_power_delivery: sym: "0x2" "2"
34799508-34799611 usb_power_delivery: sym: "0x4" "4"
34799611-34799708 usb_power_delivery: sym: "0x8" "8"
34799708-34799811 usb_power_delivery: sym: "0x1" "1"
34799411-34799811 usb_power_delivery: header: "H:1842" "HD"
34797738-34801508 usb_power_delivery: snk: "(r2) SNK[4]: REQUEST" "REQUEST"
34799811-34799908 usb_power_delivery: sym: "0x8" "8"
34799908-34800008 usb_power_delivery: sym: "0xC" "C"
34800008-34800110 usb_power_delivery: sym: "0x0" "0"
34800110-34800207 usb_power_delivery: sym: "0x2" "2"
34800207-34800307 usb_power_delivery: sym: "0x3" "3"
34800307-34800410 usb_power_delivery: sym: "0x0" "0"
34800410-34800510 usb_power_delivery: sym: "0x3" "3"
34800510-34800607 usb_power_delivery: sym: "0x4" "4"
34799811-34800607 usb_power_delivery: data: "[0]430320c8" "D0"
34799811-34800607 usb_power_delivery: payload: "[1] (PDO #4: Fixed 15V) 2A (operating) / 2A (max) [comm_cap] [no_suspend]" "[1] (PDO #4: Fixed 15V) 2A (operating) / 2A (max) [comm_cap] [no_suspend]"
34800607-34800709 usb_power_delivery: sym: "0x7" "7"
34800709-34800809 usb_power_delivery: sym: "0x6" "6"
34800809-34800909 usb_power_delivery: sym: "0x5" "5"
34800909-34801006 usb_power_delivery: sym: "0x1" "1"
34801006-34801106 usb_power_delivery: sym: "0xE" "E"
34801106-34801209 usb_power_delivery: sym: "0x8" "8"
34801209-34801309 usb_power_delivery: sym: "0xC" "C"
34801309-34801409 usb_power_delivery: sym: "0xE" "E"
34800607-34801409 usb_power_delivery: crc: "CRC:ec8e1567" "CRC"
34801409-34801508 usb_power_delivery: sym: "EOP" "#"
34801409-34801508 usb_power_delivery: eop: "EOP" "E"
34797738-34801508 usb_power_delivery: text: "#36   (5799.623000ms): (r2) SNK[4]: REQUEST - [1] (PDO #4: Fixed 15V) 2A (operating) / 2A (max) [comm_cap] [no_suspend]" "..."
34802600-34803888 usb_power_delivery: preamble: "Preamble" "..."
34803888-34803986 usb_power_delivery: sym: "SYNC-1" "S1"
34803986-34804089 usb_power_delivery: sym: "SYNC-1" "S1"
34804089-34804187 usb_power_delivery: sym: "SYNC-1" "S1"
34804187-34804290 usb_power_delivery: sym: "SYNC-2" "S2"
34803888-34804290 usb_power_delivery: sop: "SOP" "S"
34804290-34804389 usb_power_delivery: sym: "0x1" "1"
34804389-34804489 usb_power_delivery: sym: "0x6" "6"
34804489-34804590 usb_power_delivery: sym: "0x9" "9"
34804590-34804693 usb_power_delivery: sym: "0x0" "0"
34804290-34804693 usb_power_delivery: header: "H:0961" "HD"
34802600-34805617 usb_power_delivery: src: "(r2) SRC[4]: GOOD CRC" "GOOD CRC"
34804693-34804791 usb_power_delivery: sym: "0xD" "D"
34804791-34804894 usb_power_delivery: sym: "0xB" "B"
34804894-34804992 usb_power_delivery: sym: "0x0" "0"
34804992-34805095 usb_power_delivery: sym: "0xF" "F"
34805095-34805196 usb_power_delivery: sym: "0x3" "3"
34805196-34805297 usb_power_delivery: sym: "0xE" "E"
34805297-34805395 usb_power_delivery: sym: "0x4" "4"
34805395-34805498 usb_power_delivery: sym: "0x4" "4"
34804693-34805498 usb_power_delivery: crc: "CRC:44e3f0bd" "CRC"
34805498-34805598 usb_power_delivery: sym: "EOP" "#"
34805498-34805598 usb_power_delivery: eop: "EOP" "E"
34802600-34805598 usb_power_delivery: text: "#37   (5800.433333ms): (r2) SRC[4]: GOOD CRC" "..."
34819826-34821113 usb_power_delivery: preamble: "Preamble" "..."
34821113-34821211 usb_power_delivery: sym: "SYNC-1" "S1"
34821211-34821314 usb_power_delivery: sym: "SYNC-1" "S1"
34821314-34821413 usb_power_delivery: sym: "SYNC-1" "S1"
34821413-34821516 usb_power_delivery: sym: "SYNC-2" "S2"
34821113-34821516 usb_power_delivery: sop: "SOP" "S"
34821516-34821616 usb_power_delivery: sym: "0x3" "3"
34821616-34821717 usb_power_delivery: sym: "0x6" "6"
34821717-34821815 usb_power_delivery: sym: "0xB" "B"
34821815-34821918 usb_power_delivery: sym: "0x0" "0"
34821516-34821918 usb_power_delivery: header: "H:0b63" "HD"
34819826-34822862 usb_power_delivery: src: "(r2) SRC[5]: ACCEPT" "ACCEPT"
34821918-34822019 usb_power_delivery: sym: "0x3" "3"
34822019-34822117 usb_power_delivery: sym: "0x1" "1"
34822117-34822218 usb_power_delivery: sym: "0x3" "3"
34822218-34822320 usb_power_delivery: sym: "0xF" "F"
34822320-34822419 usb_power_delivery: sym: "0xB" "B"
34822419-34822522 usb_power_delivery: sym: "0xD" "D"
34822522-34822620 usb_power_delivery: sym: "0x8" "8"
34822620-34822721 usb_power_delivery: sym: "0x9" "9"
34821918-34822721 usb_power_delivery: crc: "CRC:98dbf313" "CRC"
34822721-34822821 usb_power_delivery: sym: "EOP" "#"
34822721-34822821 usb_power_delivery: eop: "EOP" "E"
34819826-34822821 usb_power_delivery: text: "#38   (5803.304333ms): (r2) SRC[5]: ACCEPT" "..."
34823355-34824629 usb_power_delivery: preamble: "Preamble" "..."
34824629-34824726 usb_power_delivery: sym: "SYNC-1" "S1"
34824726-34824829 usb_power_delivery: sym: "SYNC-1" "S1"
34824829-34824926 usb_power_delivery: sym: "SYNC-1" "S1"
34824926-34825029 usb_power_delivery: sym: "SYNC-2" "S2"
34824629-34825029 usb_power_delivery: sop: "SOP" "S"
34825029-34825126 usb_power_delivery: sym: "0x1" "1"
34825126-34825228 usb_power_delivery: sym: "0x4" "4"
34825228-34825328 usb_power_delivery: sym: "0xA" "A"
34825328-34825425 usb_power_delivery: sym: "0x0" "0"
34825029-34825425 usb_power_delivery: header: "H:0a41" "HD"
34823355-34826327 usb_power_delivery: snk: "(r2) SNK[5]: GOOD CRC" "GOOD CRC"
34825425-34825525 usb_power_delivery: sym: "0x5" "5"
34825525-34825625 usb_power_delivery: sym: "0xA" "A"
34825625-34825725 usb_power_delivery: sym: "0x5" "5"
34825725-34825828 usb_power_delivery: sym: "0x8" "8"
34825828-34825927 usb_power_delivery: sym: "0xE" "E"
34825927-34826027 usb_power_delivery: sym: "0x6" "6"
34826027-34826124 usb_power_delivery: sym: "0x8" "8"
34826124-34826227 usb_power_delivery: sym: "0x4" "4"
34825425-34826227 usb_power_delivery: crc: "CRC:486e85a5" "CRC"
34826227-34826327 usb_power_delivery: sym: "EOP" "#"
34826227-34826327 usb_power_delivery: eop: "EOP" "E"
34823355-34826327 usb_power_delivery: text: "#39   (5803.892500ms): (r2) SNK[5]: GOOD CRC" "..."
35050716-35052004 usb_power_delivery: preamble: "Preamble" "..."
35052004-35052102 usb_power_delivery: sym: "SYNC-1" "S1"
35052102-35052205 usb_power_delivery: sym: "SYNC-1" "S1"
35052205-35052303 usb_power_delivery: sym: "SYNC-1" "S1"
35052303-35052406 usb_power_delivery: sym: "SYNC-2" "S2"
35052004-35052406 usb_power_delivery: sop: "SOP" "S"
35052406-35052507 usb_power_delivery: sym: "0x6" "6"
35052507-35052607 usb_power_delivery: sym: "0x6" "6"
35052607-35052706 usb_power_delivery: sym: "0xD" "D"
35052706-35052809 usb_power_delivery: sym: "0x0" "0"
35052406-35052809 usb_power_delivery: header: "H:0d66" "HD"
35050716-35053752 usb_power_delivery: src: "(r2) SRC[6]: PS RDY" "PS RDY"
35052809-35052909 usb_power_delivery: sym: "0x3" "3"
35052909-35053010 usb_power_delivery: sym: "0x6" "6"
35053010-35053108 usb_power_delivery: sym: "0x2" "2"
35053108-35053209 usb_power_delivery: sym: "0xA" "A"
35053209-35053312 usb_power_delivery: sym: "0xF" "F"
35053312-35053412 usb_power_delivery: sym: "0xC" "C"
35053412-35053513 usb_power_delivery: sym: "0xC" "C"
35053513-35053611 usb_power_delivery: sym: "0x0" "0"
35052809-35053611 usb_power_delivery: crc: "CRC:0ccfa263" "CRC"
35053611-35053712 usb_power_delivery: sym: "EOP" "#"
35053611-35053712 usb_power_delivery: eop: "EOP" "E"
35050716-35053712 usb_power_delivery: text: "#40   (5841.786000ms): (r2) SRC[6]: PS RDY" "..."
35054246-35055520 usb_power_delivery: preamble: "Preamble" "..."
35055520-35055616 usb_power_delivery: sym: "SYNC-1" "S1"
35055616-35055720 usb_power_delivery: sym: "SYNC-1" "S1"
35055720-35055816 usb_power_delivery: sym: "SYNC-1" "S1"
35055816-35055920 usb_power_delivery: sym: "SYNC-2" "S2"
35055520-35055920 usb_power_delivery: sop: "SOP" "S"
35055920-35056016 usb_power_delivery: sym: "0x1" "1"
35056016-35056120 usb_power_delivery: sym: "0x4" "4"
35056120-35056219 usb_power_delivery: sym: "0xC" "C"
35056219-35056315 usb_power_delivery: sym: "0x0" "0"
35055920-35056315 usb_power_delivery: header: "H:0c41" "HD"
35054246-35057254 usb_power_delivery: snk: "(r2) SNK[6]: GOOD CRC" "GOOD CRC"
35056315-35056419 usb_power_delivery: sym: "0x0" "0"
35056419-35056519 usb_power_delivery: sym: "0x9" "9"
35056519-35056615 usb_power_delivery: sym: "0x0" "0"
35056615-35056718 usb_power_delivery: sym: "0x2" "2"
35056718-35056815 usb_power_delivery: sym: "0xD" "D"
35056815-35056918 usb_power_delivery: sym: "0x0" "0"
35056918-35057015 usb_power_delivery: sym: "0x1" "1"
35057015-35057115 usb_power_delivery: sym: "0xA" "A"
35056315-35057115 usb_power_delivery: crc: "CRC:a10d2090" "CRC"
35057115-35057215 usb_power_delivery: sym: "EOP" "#"
35057115-35057215 usb_power_delivery: eop: "EOP" "E"
35054246-35057215 usb_power_delivery: text: "#41   (5842.374333ms): (r2) SNK[6]: GOOD CRC" "..."
45844206-45845480 usb_power_delivery: preamble: "Preamble" "..."
45845480-45845577 usb_power_delivery: sym: "SYNC-1" "S1"
45845577-45845680 usb_power_delivery: sym: "SYNC-1" "S1"
45845680-45845776 usb_power_delivery: sym: "SYNC-1" "S1"
45845776-45845879 usb_power_delivery: sym: "SYNC-2" "S2"
45845480-45845879 usb_power_delivery: sop: "SOP" "S"
45845879-45845976 usb_power_delivery: sym: "0x2" "2"
45845976-45846079 usb_power_delivery: sym: "0x4" "4"
45846079-45846179 usb_power_delivery: sym: "0xA" "A"
45846179-45846276 usb_power_delivery: sym: "0x1" "1"
45845879-45846276 usb_power_delivery: header: "H:1a42" "HD"
45844206-45847976 usb_power_delivery: snk: "(r2) SNK[5]: REQUEST" "REQUEST"
45846276-45846379 usb_power_delivery: sym: "0xD" "D"
45846379-45846475 usb_power_delivery: sym: "0x7" "7"
45846475-45846578 usb_power_delivery: sym: "0x4" "4"
45846578-45846675 usb_power_delivery: sym: "0xF" "F"
45846675-45846778 usb_power_delivery: sym: "0x1" "1"
45846778-45846875 usb_power_delivery: sym: "0x0" "0"
45846875-45846974 usb_power_delivery: sym: "0x3" "3"
45846974-45847074 usb_power_delivery: sym: "0x5" "5"
45846276-45847074 usb_power_delivery: data: "[0]5301f47d" "D0"
45846276-45847074 usb_power_delivery: payload: "[1] (PDO #5: Fixed 20V) 1.25A (operating) / 1.25A (max) [comm_cap] [no_suspend]" "[1] (PDO #5: Fixed 20V) 1.25A (operating) / 1.25A (max) [comm_cap] [no_suspend]"
45847074-45847174 usb_power_delivery: sym: "0x5" "5"
45847174-45847274 usb_power_delivery: sym: "0xA" "A"
45847274-45847377 usb_power_delivery: sym: "0x7" "7"
45847377-45847474 usb_power_delivery: sym: "0x1" "1"
45847474-45847573 usb_power_delivery: sym: "0x3" "3"
45847573-45847673 usb_power_delivery: sym: "0xE" "E"
45847673-45847773 usb_power_delivery: sym: "0x9" "9"
45847773-45847876 usb_power_delivery: sym: "0x1" "1"
45847074-45847876 usb_power_delivery: crc: "CRC:19e317a5" "CRC"
45847876-45847976 usb_power_delivery: sym: "EOP" "#"
45847876-45847976 usb_power_delivery: eop: "EOP" "E"
45844206-45847976 usb_power_delivery: text: "#42   (7640.701000ms): (r2) SNK[5]: REQUEST - [1] (PDO #5: Fixed 20V) 1.25A (operating) / 1.25A (max) [comm_cap] [no_suspend]" "..."
45849068-45850356 usb_power_delivery: preamble: "Preamble" "..."
45850356-45850454 usb_power_delivery: sym: "SYNC-1" "S1"
45850454-45850557 usb_power_delivery: sym: "SYNC-1" "S1"
45850557-45850656 usb_power_delivery: sym: "SYNC-1" "S1"
45850656-45850758 usb_power_delivery: sym: "SYNC-2" "S2"
45850356-45850758 usb_power_delivery: sop: "SOP" "S"
45850758-45850857 usb_power_delivery: sym: "0x1" "1"
45850857-45850957 usb_power_delivery: sym: "0x6" "6"
45850957-45851060 usb_power_delivery: sym: "0xB" "B"
45851060-45851159 usb_power_delivery: sym: "0x0" "0"
45850758-45851159 usb_power_delivery: header: "H:0b61" "HD"
45849068-45852085 usb_power_delivery: src: "(r2) SRC[5]: GOOD CRC" "GOOD CRC"
45851159-45851262 usb_power_delivery: sym: "0x1" "1"
45851262-45851362 usb_power_delivery: sym: "0x9" "9"
45851362-45851460 usb_power_delivery: sym: "0x1" "1"
45851460-45851561 usb_power_delivery: sym: "0x9" "9"
45851561-45851664 usb_power_delivery: sym: "0xD" "D"
45851664-45851765 usb_power_delivery: sym: "0xE" "E"
45851765-45851865 usb_power_delivery: sym: "0xA" "A"
45851865-45851966 usb_power_delivery: sym: "0xA" "A"
45851159-45851966 usb_power_delivery: crc: "CRC:aaed9191" "CRC"
45851966-45852067 usb_power_delivery: sym: "EOP" "#"
45851966-45852067 usb_power_delivery: eop: "EOP" "E"
45849068-45852067 usb_power_delivery: text: "#43   (7641.511333ms): (r2) SRC[5]: GOOD CRC" "..."
45867058-45868346 usb_power_delivery: preamble: "Preamble" "..."
45868346-45868444 usb_power_delivery: sym: "SYNC-1" "S1"
45868444-45868547 usb_power_delivery: sym: "SYNC-1" "S1"
45868547-45868646 usb_power_delivery: sym: "SYNC-1" "S1"
45868646-45868749 usb_power_delivery: sym: "SYNC-2" "S2"
45868346-45868749 usb_power_delivery: sop: "SOP" "S"
45868749-45868849 usb_power_delivery: sym: "0x3" "3"
45868849-45868950 usb_power_delivery: sym: "0x6" "6"
45868950-45869048 usb_power_delivery: sym: "0xF" "F"
45869048-45869151 usb_power_delivery: sym: "0x0" "0"
45868749-45869151 usb_power_delivery: header: "H:0f63" "HD"
45867058-45870075 usb_power_delivery: src: "(r2) SRC[7]: ACCEPT" "ACCEPT"
45869151-45869252 usb_power_delivery: sym: "0xA" "A"
45869252-45869350 usb_power_delivery: sym: "0x0" "0"
45869350-45869453 usb_power_delivery: sym: "0x7" "7"
45869453-45869554 usb_power_delivery: sym: "0x3" "3"
45869554-45869654 usb_power_delivery: sym: "0x6" "6"
45869654-45869752 usb_power_delivery: sym: "0xB" "B"
45869752-45869855 usb_power_delivery: sym: "0xF" "F"
45869855-45869956 usb_power_delivery: sym: "0x9" "9"
45869151-45869956 usb_power_delivery: crc: "CRC:9fb6370a" "CRC"
45869956-45870057 usb_power_delivery: sym: "EOP" "#"
45869956-45870057 usb_power_delivery: eop: "EOP" "E"
45867058-45870057 usb_power_delivery: text: "#44   (7644.509667ms): (r2) SRC[7]: ACCEPT" "..."
45870588-45871862 usb_power_delivery: preamble: "Preamble" "..."
45871862-45871959 usb_power_delivery: sym: "SYNC-1" "S1"
45871959-45872062 usb_power_delivery: sym: "SYNC-1" "S1"
45872062-45872158 usb_power_delivery: sym: "SYNC-1" "S1"
45872158-45872262 usb_power_delivery: sym: "SYNC-2" "S2"
45871862-45872262 usb_power_delivery: sop: "SOP" "S"
45872262-45872358 usb_power_delivery: sym: "0x1" "1"
45872358-45872461 usb_power_delivery: sym: "0x4" "4"
45872461-45872561 usb_power_delivery: sym: "0xE" "E"
45872561-45872658 usb_power_delivery: sym: "0x0" "0"
45872262-45872658 usb_power_delivery: header: "H:0e41" "HD"
45870588-45873596 usb_power_delivery: snk: "(r2) SNK[7]: GOOD CRC" "GOOD CRC"
45872658-45872758 usb_power_delivery: sym: "0xC" "C"
45872758-45872861 usb_power_delivery: sym: "0xB" "B"
45872861-45872958 usb_power_delivery: sym: "0x1" "1"
45872958-45873061 usb_power_delivery: sym: "0x4" "4"
45873061-45873160 usb_power_delivery: sym: "0x3" "3"
45873160-45873257 usb_power_delivery: sym: "0x0" "0"
45873257-45873360 usb_power_delivery: sym: "0xF" "F"
45873360-45873457 usb_power_delivery: sym: "0x4" "4"
45872658-45873457 usb_power_delivery: crc: "CRC:4f0341bc" "CRC"
45873457-45873557 usb_power_delivery: sym: "EOP" "#"
45873457-45873557 usb_power_delivery: eop: "EOP" "E"
45870588-45873557 usb_power_delivery: text: "#45   (7645.098000ms): (r2) SNK[7]: GOOD CRC" "..."
46090240-46091528 usb_power_delivery: preamble: "Preamble" "..."
46091528-46091626 usb_power_delivery: sym: "SYNC-1" "S1"
46091626-46091729 usb_power_delivery: sym: "SYNC-1" "S1"
46091729-46091828 usb_power_delivery: sym: "SYNC-1" "S1"
46091828-46091930 usb_power_delivery: sym: "SYNC-2" "S2"
46091528-46091930 usb_power_delivery: sop: "SOP" "S"
46091930-46092031 usb_power_delivery: sym: "0x6" "6"
46092031-46092132 usb_power_delivery: sym: "0x6" "6"
46092132-46092230 usb_power_delivery: sym: "0x1" "1"
46092230-46092333 usb_power_delivery: sym: "0x0" "0"
46091930-46092333 usb_power_delivery: header: "H:0166" "HD"
46090240-46093257 usb_power_delivery: src: "(r2) SRC[0]: PS RDY" "PS RDY"
46092333-46092431 usb_power_delivery: sym: "0x8" "8"
46092431-46092534 usb_power_delivery: sym: "0x4" "4"
46092534-46092635 usb_power_delivery: sym: "0xE" "E"
46092635-46092735 usb_power_delivery: sym: "0xE" "E"
46092735-46092836 usb_power_delivery: sym: "0x9" "9"
46092836-46092934 usb_power_delivery: sym: "0x7" "7"
46092934-46093035 usb_power_delivery: sym: "0x5" "5"
46093035-46093138 usb_power_delivery: sym: "0x0" "0"
46092333-46093138 usb_power_delivery: crc: "CRC:0579ee48" "CRC"
46093138-46093238 usb_power_delivery: sym: "EOP" "#"
46093138-46093238 usb_power_delivery: eop: "EOP" "E"
46090240-46093238 usb_power_delivery: text: "#46   (7681.706667ms): (r2) SRC[0]: PS RDY" "..."
46093770-46095044 usb_power_delivery: preamble: "Preamble" "..."
46095044-46095140 usb_power_delivery: sym: "SYNC-1" "S1"
46095140-46095243 usb_power_delivery: sym: "SYNC-1" "S1"
46095243-46095339 usb_power_delivery: sym: "SYNC-1" "S1"
46095339-46095443 usb_power_delivery: sym: "SYNC-2" "S2"
46095044-46095443 usb_power_delivery: sop: "SOP" "S"
46095443-46095539 usb_power_delivery: sym: "0x1" "1"
46095539-46095642 usb_power_delivery: sym: "0x4" "4"
46095642-46095739 usb_power_delivery: sym: "0x0" "0"
46095739-46095842 usb_power_delivery: sym: "0x0" "0"
46095443-46095842 usb_power_delivery: header: "H:0041" "HD"
46093770-46096777 usb_power_delivery: snk: "(r2) SNK[0]: GOOD CRC" "GOOD CRC"
46095842-46095939 usb_power_delivery: sym: "0xB" "B"
46095939-46096042 usb_power_delivery: sym: "0xB" "B"
46096042-46096142 usb_power_delivery: sym: "0xC" "C"
46096142-46096242 usb_power_delivery: sym: "0x6" "6"
46096242-46096338 usb_power_delivery: sym: "0xB" "B"
46096338-46096441 usb_power_delivery: sym: "0xB" "B"
46096441-46096538 usb_power_delivery: sym: "0x8" "8"
46096538-46096638 usb_power_delivery: sym: "0xA" "A"
46095842-46096638 usb_power_delivery: crc: "CRC:a8bb6cbb" "CRC"
46096638-46096737 usb_power_delivery: sym: "EOP" "#"
46096638-46096737 usb_power_delivery: eop: "EOP" "E"
46093770-46096737 usb_power_delivery: text: "#47   (7682.295000ms): (r2) SNK[0]: GOOD CRC" "..."
56884536-56885810 usb_power_delivery: preamble: "Preamble" "..."
56885810-56885906 usb_power_delivery: sym: "SYNC-1" "S1"
56885906-56886009 usb_power_delivery: sym: "SYNC-1" "S1"
56886009-56886105 usb_power_delivery: sym: "SYNC-1" "S1"
56886105-56886209 usb_power_delivery: sym: "SYNC-2" "S2"
56885810-56886209 usb_power_delivery: sop: "SOP" "S"
56886209-56886305 usb_power_delivery: sym: "0x2" "2"
56886305-56886408 usb_power_delivery: sym: "0x4" "4"
56886408-56886509 usb_power_delivery: sym: "0xC" "C"
56886509-56886605 usb_power_delivery: sym: "0x1" "1"
56886209-56886605 usb_power_delivery: header: "H:1c42" "HD"
56884536-56888342 usb_power_delivery: snk: "(r2) SNK[6]: REQUEST" "REQUEST"
56886605-56886705 usb_power_delivery: sym: "0xC" "C"
56886705-56886808 usb_power_delivery: sym: "0x2" "2"
56886808-56886904 usb_power_delivery: sym: "0x1" "1"
56886904-56887008 usb_power_delivery: sym: "0xB" "B"
56887008-56887104 usb_power_delivery: sym: "0x4" "4"
56887104-56887207 usb_power_delivery: sym: "0x0" "0"
56887207-56887308 usb_power_delivery: sym: "0x3" "3"
56887308-56887404 usb_power_delivery: sym: "0x1" "1"
56886605-56887404 usb_power_delivery: data: "[0]1304b12c" "D0"
56886605-56887404 usb_power_delivery: payload: "[1] (PDO #1: Fixed 5V) 3A (operating) / 3A (max) [comm_cap] [no_suspend]" "[1] (PDO #1: Fixed 5V) 3A (operating) / 3A (max) [comm_cap] [no_suspend]"
56887404-56887503 usb_power_delivery: sym: "0xC" "C"
56887503-56887603 usb_power_delivery: sym: "0x3" "3"
56887603-56887706 usb_power_delivery: sym: "0x0" "0"
56887706-56887803 usb_power_delivery: sym: "0x7" "7"
56887803-56887906 usb_power_delivery: sym: "0x8" "8"
56887906-56888006 usb_power_delivery: sym: "0xE" "E"
56888006-56888103 usb_power_delivery: sym: "0x8" "8"
56888103-56888202 usb_power_delivery: sym: "0x9" "9"
56887404-56888202 usb_power_delivery: crc: "CRC:98e8703c" "CRC"
56888202-56888302 usb_power_delivery: sym: "EOP" "#"
56888202-56888302 usb_power_delivery: eop: "EOP" "E"
56884536-56888302 usb_power_delivery: text: "#48   (9480.756000ms): (r2) SNK[6]: REQUEST - [1] (PDO #1: Fixed 5V) 3A (operating) / 3A (max) [comm_cap] [no_suspend]" "..."
56889398-56890686 usb_power_delivery: preamble: "Preamble" "..."
56890686-56890784 usb_power_delivery: sym: "SYNC-1" "S1"
56890784-56890887 usb_power_delivery: sym: "SYNC-1" "S1"
56890887-56890985 usb_power_delivery: sym: "SYNC-1" "S1"
56890985-56891088 usb_power_delivery: sym: "SYNC-2" "S2"
56890686-56891088 usb_power_delivery: sop: "SOP" "S"
56891088-56891187 usb_power_delivery: sym: "0x1" "1"
56891187-56891287 usb_power_delivery: sym: "0x6" "6"
56891287-56891390 usb_power_delivery: sym: "0xD" "D"
56891390-56891488 usb_power_delivery: sym: "0x0" "0"
56891088-56891488 usb_power_delivery: header: "H:0d61" "HD"
56889398-56892434 usb_power_delivery: src: "(r2) SRC[6]: GOOD CRC" "GOOD CRC"
56891488-56891591 usb_power_delivery: sym: "0x4" "4"
56891591-56891692 usb_power_delivery: sym: "0xA" "A"
56891692-56891790 usb_power_delivery: sym: "0x4" "4"
56891790-56891891 usb_power_delivery: sym: "0x3" "3"
56891891-56891991 usb_power_delivery: sym: "0xE" "E"
56891991-56892094 usb_power_delivery: sym: "0x8" "8"
56892094-56892195 usb_power_delivery: sym: "0x3" "3"
56892195-56892293 usb_power_delivery: sym: "0x4" "4"
56891488-56892293 usb_power_delivery: crc: "CRC:438e34a4" "CRC"
56892293-56892394 usb_power_delivery: sym: "EOP" "#"
56892293-56892394 usb_power_delivery: eop: "EOP" "E"
56889398-56892394 usb_power_delivery: text: "#49   (9481.566333ms): (r2) SRC[6]: GOOD CRC" "..."
56907369-56908656 usb_power_delivery: preamble: "Preamble" "..."
56908656-56908755 usb_power_delivery: sym: "SYNC-1" "S1"
56908755-56908857 usb_power_delivery: sym: "SYNC-1" "S1"
56908857-56908956 usb_power_delivery: sym: "SYNC-1" "S1"
56908956-56909059 usb_power_delivery: sym: "SYNC-2" "S2"
56908656-56909059 usb_power_delivery: sop: "SOP" "S"
56909059-56909159 usb_power_delivery: sym: "0x3" "3"
56909159-56909260 usb_power_delivery: sym: "0x6" "6"
56909260-56909361 usb_power_delivery: sym: "0x3" "3"
56909361-56909459 usb_power_delivery: sym: "0x0" "0"
56909059-56909459 usb_power_delivery: header: "H:0363" "HD"
56907369-56910405 usb_power_delivery: src: "(r2) SRC[1]: ACCEPT" "ACCEPT"
56909459-56909562 usb_power_delivery: sym: "0x1" "1"
56909562-56909660 usb_power_delivery: sym: "0x2" "2"
56909660-56909763 usb_power_delivery: sym: "0xB" "B"
56909763-56909861 usb_power_delivery: sym: "0x7" "7"
56909861-56909964 usb_power_delivery: sym: "0x0" "0"
56909964-56910063 usb_power_delivery: sym: "0x0" "0"
56910063-56910163 usb_power_delivery: sym: "0x6" "6"
56910163-56910264 usb_power_delivery: sym: "0x9" "9"
56909459-56910264 usb_power_delivery: crc: "CRC:96007b21" "CRC"
56910264-56910365 usb_power_delivery: sym: "EOP" "#"
56910264-56910365 usb_power_delivery: eop: "EOP" "E"
56907369-56910365 usb_power_delivery: text: "#50   (9484.561500ms): (r2) SRC[1]: ACCEPT" "..."
56910899-56912173 usb_power_delivery: preamble: "Preamble" "..."
56912173-56912269 usb_power_delivery: sym: "SYNC-1" "S1"
56912269-56912373 usb_power_delivery: sym: "SYNC-1" "S1"
56912373-56912469 usb_power_delivery: sym: "SYNC-1" "S1"
56912469-56912573 usb_power_delivery: sym: "SYNC-2" "S2"
56912173-56912573 usb_power_delivery: sop: "SOP" "S"
56912573-56912669 usb_power_delivery: sym: "0x1" "1"
56912669-56912772 usb_power_delivery: sym: "0x4" "4"
56912772-56912868 usb_power_delivery: sym: "0x2" "2"
56912868-56912972 usb_power_delivery: sym: "0x0" "0"
56912573-56912972 usb_power_delivery: header: "H:0241" "HD"
56910899-56913907 usb_power_delivery: snk: "(r2) SNK[1]: GOOD CRC" "GOOD CRC"
56912972-56913068 usb_power_delivery: sym: "0x7" "7"
56913068-56913168 usb_power_delivery: sym: "0x9" "9"
56913168-56913272 usb_power_delivery: sym: "0xD" "D"
56913272-56913368 usb_power_delivery: sym: "0x0" "0"
56913368-56913468 usb_power_delivery: sym: "0x5" "5"
56913468-56913571 usb_power_delivery: sym: "0xB" "B"
56913571-56913671 usb_power_delivery: sym: "0x6" "6"
56913671-56913767 usb_power_delivery: sym: "0x4" "4"
56912972-56913767 usb_power_delivery: crc: "CRC:46b50d97" "CRC"
56913767-56913867 usb_power_delivery: sym: "EOP" "#"
56913767-56913867 usb_power_delivery: eop: "EOP" "E"
56910899-56913867 usb_power_delivery: text: "#51   (9485.149833ms): (r2) SNK[1]: GOOD CRC" "..."
57186888-57188176 usb_power_delivery: preamble: "Preamble" "..."
57188176-57188274 usb_power_delivery: sym: "SYNC-1" "S1"
57188274-57188377 usb_power_delivery: sym: "SYNC-1" "S1"
57188377-57188476 usb_power_delivery: sym: "SYNC-1" "S1"
57188476-57188579 usb_power_delivery: sym: "SYNC-2" "S2"
57188176-57188579 usb_power_delivery: sop: "SOP" "S"
57188579-57188679 usb_power_delivery: sym: "0x6" "6"
57188679-57188780 usb_power_delivery: sym: "0x6" "6"
57188780-57188880 usb_power_delivery: sym: "0x5" "5"
57188880-57188979 usb_power_delivery: sym: "0x0" "0"
57188579-57188979 usb_power_delivery: header: "H:0566" "HD"
57186888-57189925 usb_power_delivery: src: "(r2) SRC[2]: PS RDY" "PS RDY"
57188979-57189082 usb_power_delivery: sym: "0x1" "1"
57189082-57189182 usb_power_delivery: sym: "0x5" "5"
57189182-57189283 usb_power_delivery: sym: "0xA" "A"
57189283-57189381 usb_power_delivery: sym: "0x2" "2"
57189381-57189484 usb_power_delivery: sym: "0x4" "4"
57189484-57189582 usb_power_delivery: sym: "0x1" "1"
57189582-57189686 usb_power_delivery: sym: "0x2" "2"
57189686-57189784 usb_power_delivery: sym: "0x0" "0"
57188979-57189784 usb_power_delivery: crc: "CRC:02142a51" "CRC"
57189784-57189884 usb_power_delivery: sym: "EOP" "#"
57189784-57189884 usb_power_delivery: eop: "EOP" "E"
57186888-57189884 usb_power_delivery: text: "#52   (9531.148000ms): (r2) SRC[2]: PS RDY" "..."
57190418-57191692 usb_power_delivery: preamble: "Preamble" "..."
57191692-57191789 usb_power_delivery: sym: "SYNC-1" "S1"
57191789-57191892 usb_power_delivery: sym: "SYNC-1" "S1"
57191892-57191989 usb_power_delivery: sym: "SYNC-1" "S1"
57191989-57192092 usb_power_delivery: sym: "SYNC-2" "S2"
57191692-57192092 usb_power_delivery: sop: "SOP" "S"
57192092-57192189 usb_power_delivery: sym: "0x1" "1"
57192189-57192291 usb_power_delivery: sym: "0x4" "4"
57192291-57192389 usb_power_delivery: sym: "0x4" "4"
57192389-57192491 usb_power_delivery: sym: "0x0" "0"
57192092-57192491 usb_power_delivery: header: "H:0441" "HD"
57190418-57193390 usb_power_delivery: snk: "(r2) SNK[2]: GOOD CRC" "GOOD CRC"
57192491-57192588 usb_power_delivery: sym: "0x2" "2"
57192588-57192688 usb_power_delivery: sym: "0xA" "A"
57192688-57192791 usb_power_delivery: sym: "0x8" "8"
57192791-57192891 usb_power_delivery: sym: "0xA" "A"
57192891-57192990 usb_power_delivery: sym: "0x6" "6"
57192990-57193088 usb_power_delivery: sym: "0xD" "D"
57193088-57193190 usb_power_delivery: sym: "0xF" "F"
57193190-57193290 usb_power_delivery: sym: "0xA" "A"
57192491-57193290 usb_power_delivery: crc: "CRC:afd6a8a2" "CRC"
57193290-57193390 usb_power_delivery: sym: "EOP" "#"
57193290-57193390 usb_power_delivery: eop: "EOP" "E"
57190418-57193390 usb_power_delivery: text: "#53   (9531.736333ms): (r2) SNK[2]: GOOD CRC" "..."
