50026-50330 avr_isp: pe: "Programming enable"
50026-50330 avr_isp: warning: "Warning: Unexpected bytes in reply!"
50391-50713 avr_isp: rsb0: "Vendor code: 0x1e (Atmel)"
50713-51033 avr_isp: rsb1: "Part family / memory size: 0x92"
51032-51350 avr_isp: rsb2: "Part number: 0x05"
50713-51350 avr_isp: dev: "Device: Atmel ATmega48"
51785-52108 avr_isp: rfb: "Read fuse bits: 0x42"
52106-52422 avr_isp: rhfb: "Read fuse high bits: 0xdb"
52423-52732 avr_isp: refb: "Read extended fuse bits: 0xfe"
52897-53212 avr_isp: ce: "Chip erase"
53218-53534 avr_isp: prnb: "Poll RDY/nBSY: Busy" "Busy" "B"
55535-55855 avr_isp: prnb: "Poll RDY/nBSY: Busy" "Busy" "B"
57859-58183 avr_isp: prnb: "Poll RDY/nBSY: Busy" "Busy" "B"
60184-60502 avr_isp: prnb: "Poll RDY/nBSY: Busy" "Busy" "B"
62503-62836 avr_isp: prnb: "Poll RDY/nBSY: Ready" "Ready" "R"
62833-63146 avr_isp: ce: "Chip erase"
63144-63462 avr_isp: prnb: "Poll RDY/nBSY: Busy" "Busy" "B"
65461-65779 avr_isp: prnb: "Poll RDY/nBSY: Busy" "Busy" "B"
67780-68098 avr_isp: prnb: "Poll RDY/nBSY: Busy" "Busy" "B"
70102-70428 avr_isp: prnb: "Poll RDY/nBSY: Busy" "Busy" "B"
72427-72745 avr_isp: prnb: "Poll RDY/nBSY: Ready" "Ready" "R"
72757-73080 avr_isp: ce: "Chip erase"
73078-73391 avr_isp: prnb: "Poll RDY/nBSY: Busy" "Busy" "B"
75394-75714 avr_isp: prnb: "Poll RDY/nBSY: Busy" "Busy" "B"
77717-78040 avr_isp: prnb: "Poll RDY/nBSY: Busy" "Busy" "B"
80041-80361 avr_isp: prnb: "Poll RDY/nBSY: Busy" "Busy" "B"
82365-82687 avr_isp: prnb: "Poll RDY/nBSY: Ready" "Ready" "R"
82692-83008 avr_isp: rcb: "Read calibration byte: 0x92"
83148-83473 avr_isp: rp: "Read program memory Low: [0x000]: 0xff" "[000L]:ff" "ff"
83652-83980 avr_isp: ce: "Chip erase"
83986-84307 avr_isp: prnb: "Poll RDY/nBSY: Busy" "Busy" "B"
86308-86626 avr_isp: prnb: "Poll RDY/nBSY: Busy" "Busy" "B"
88627-88947 avr_isp: prnb: "Poll RDY/nBSY: Busy" "Busy" "B"
90950-91262 avr_isp: prnb: "Poll RDY/nBSY: Busy" "Busy" "B"
93264-93581 avr_isp: prnb: "Poll RDY/nBSY: Busy" "Busy" "B"
95580-95896 avr_isp: prnb: "Poll RDY/nBSY: Busy" "Busy" "B"
97897-98217 avr_isp: prnb: "Poll RDY/nBSY: Busy" "Busy" "B"
100221-100545 avr_isp: prnb: "Poll RDY/nBSY: Ready" "Ready" "R"
100555-100877 avr_isp: lpmp: "Load program memory page Low: [0x000]: 0x19" "[000L]=19" "19"
100877-101199 avr_isp: lpmp: "Load program memory page High: [0x000]: 0xc0" "[000H]=c0" "c0"
101198-101525 avr_isp: lpmp: "Load program memory page Low: [0x001]: 0x33" "[001L]=33" "33"
101521-101845 avr_isp: lpmp: "Load program memory page High: [0x001]: 0xc0" "[001H]=c0" "c0"
101844-102158 avr_isp: lpmp: "Load program memory page Low: [0x002]: 0x32" "[002L]=32" "32"
102162-102472 avr_isp: lpmp: "Load program memory page High: [0x002]: 0xc0" "[002H]=c0" "c0"
102473-102796 avr_isp: lpmp: "Load program memory page Low: [0x003]: 0x50" "[003L]=50" "50"
102799-103122 avr_isp: lpmp: "Load program memory page High: [0x003]: 0xc1" "[003H]=c1" "c1"
103125-103438 avr_isp: lpmp: "Load program memory page Low: [0x004]: 0x30" "[004L]=30" "30"
103439-103758 avr_isp: lpmp: "Load program memory page High: [0x004]: 0xc0" "[004H]=c0" "c0"
103761-104079 avr_isp: lpmp: "Load program memory page Low: [0x005]: 0x2f" "[005L]=2f" "2f"
104081-104394 avr_isp: lpmp: "Load program memory page High: [0x005]: 0xc0" "[005H]=c0" "c0"
104395-104710 avr_isp: lpmp: "Load program memory page Low: [0x006]: 0x2e" "[006L]=2e" "2e"
104708-105031 avr_isp: lpmp: "Load program memory page High: [0x006]: 0xc0" "[006H]=c0" "c0"
105033-105347 avr_isp: lpmp: "Load program memory page Low: [0x007]: 0x2d" "[007L]=2d" "2d"
105349-105670 avr_isp: lpmp: "Load program memory page High: [0x007]: 0xc0" "[007H]=c0" "c0"
105667-105990 avr_isp: lpmp: "Load program memory page Low: [0x008]: 0x2c" "[008L]=2c" "2c"
105989-106305 avr_isp: lpmp: "Load program memory page High: [0x008]: 0xc0" "[008H]=c0" "c0"
106308-106624 avr_isp: lpmp: "Load program memory page Low: [0x009]: 0x2b" "[009L]=2b" "2b"
106623-106950 avr_isp: lpmp: "Load program memory page High: [0x009]: 0xc0" "[009H]=c0" "c0"
106949-107276 avr_isp: lpmp: "Load program memory page Low: [0x00a]: 0x2a" "[00aL]=2a" "2a"
107275-107591 avr_isp: lpmp: "Load program memory page High: [0x00a]: 0xc0" "[00aH]=c0" "c0"
107594-107905 avr_isp: lpmp: "Load program memory page Low: [0x00b]: 0x29" "[00bL]=29" "29"
107907-108221 avr_isp: lpmp: "Load program memory page High: [0x00b]: 0xc0" "[00bH]=c0" "c0"
108224-108541 avr_isp: lpmp: "Load program memory page Low: [0x00c]: 0x28" "[00cL]=28" "28"
108539-108859 avr_isp: lpmp: "Load program memory page High: [0x00c]: 0xc0" "[00cH]=c0" "c0"
108860-109171 avr_isp: lpmp: "Load program memory page Low: [0x00d]: 0x27" "[00dL]=27" "27"
109172-109489 avr_isp: lpmp: "Load program memory page High: [0x00d]: 0xc0" "[00dH]=c0" "c0"
109488-109792 avr_isp: lpmp: "Load program memory page Low: [0x00e]: 0x26" "[00eL]=26" "26"
109794-110114 avr_isp: lpmp: "Load program memory page High: [0x00e]: 0xc0" "[00eH]=c0" "c0"
110116-110436 avr_isp: lpmp: "Load program memory page Low: [0x00f]: 0x25" "[00fL]=25" "25"
110438-110755 avr_isp: lpmp: "Load program memory page High: [0x00f]: 0xc0" "[00fH]=c0" "c0"
110762-111080 avr_isp: lpmp: "Load program memory page Low: [0x010]: 0x21" "[010L]=21" "21"
111083-111404 avr_isp: lpmp: "Load program memory page High: [0x010]: 0xc2" "[010H]=c2" "c2"
111407-111716 avr_isp: lpmp: "Load program memory page Low: [0x011]: 0xe8" "[011L]=e8" "e8"
111715-112028 avr_isp: lpmp: "Load program memory page High: [0x011]: 0xc0" "[011H]=c0" "c0"
112029-112340 avr_isp: lpmp: "Load program memory page Low: [0x012]: 0x22" "[012L]=22" "22"
112341-112657 avr_isp: lpmp: "Load program memory page High: [0x012]: 0xc0" "[012H]=c0" "c0"
112656-112980 avr_isp: lpmp: "Load program memory page Low: [0x013]: 0x21" "[013L]=21" "21"
112981-113301 avr_isp: lpmp: "Load program memory page High: [0x013]: 0xc0" "[013H]=c0" "c0"
113303-113613 avr_isp: lpmp: "Load program memory page Low: [0x014]: 0x20" "[014L]=20" "20"
113615-113934 avr_isp: lpmp: "Load program memory page High: [0x014]: 0xc0" "[014H]=c0" "c0"
113932-114245 avr_isp: lpmp: "Load program memory page Low: [0x015]: 0x1f" "[015L]=1f" "1f"
114247-114568 avr_isp: lpmp: "Load program memory page High: [0x015]: 0xc0" "[015H]=c0" "c0"
114565-114890 avr_isp: lpmp: "Load program memory page Low: [0x016]: 0x1e" "[016L]=1e" "1e"
114889-115204 avr_isp: lpmp: "Load program memory page High: [0x016]: 0xc0" "[016H]=c0" "c0"
115205-115514 avr_isp: lpmp: "Load program memory page Low: [0x017]: 0x1d" "[017L]=1d" "1d"
115513-115829 avr_isp: lpmp: "Load program memory page High: [0x017]: 0xc0" "[017H]=c0" "c0"
115832-116148 avr_isp: lpmp: "Load program memory page Low: [0x018]: 0x1c" "[018L]=1c" "1c"
116147-116463 avr_isp: lpmp: "Load program memory page High: [0x018]: 0xc0" "[018H]=c0" "c0"
116464-116781 avr_isp: lpmp: "Load program memory page Low: [0x019]: 0x1b" "[019L]=1b" "1b"
116782-117107 avr_isp: lpmp: "Load program memory page High: [0x019]: 0xc0" "[019H]=c0" "c0"
117108-117428 avr_isp: lpmp: "Load program memory page Low: [0x01a]: 0x11" "[01aL]=11" "11"
117430-117750 avr_isp: lpmp: "Load program memory page High: [0x01a]: 0x24" "[01aH]=24" "24"
117752-118069 avr_isp: lpmp: "Load program memory page Low: [0x01b]: 0x1f" "[01bL]=1f" "1f"
118069-118385 avr_isp: lpmp: "Load program memory page High: [0x01b]: 0xbe" "[01bH]=be" "be"
118384-118710 avr_isp: lpmp: "Load program memory page Low: [0x01c]: 0xcf" "[01cL]=cf" "cf"
118712-119043 avr_isp: lpmp: "Load program memory page High: [0x01c]: 0xef" "[01cH]=ef" "ef"
119042-119358 avr_isp: lpmp: "Load program memory page Low: [0x01d]: 0xd2" "[01dL]=d2" "d2"
119362-119670 avr_isp: lpmp: "Load program memory page High: [0x01d]: 0xe0" "[01dH]=e0" "e0"
119673-119978 avr_isp: lpmp: "Load program memory page Low: [0x01e]: 0xde" "[01eL]=de" "de"
119981-120294 avr_isp: lpmp: "Load program memory page High: [0x01e]: 0xbf" "[01eH]=bf" "bf"
120294-120603 avr_isp: lpmp: "Load program memory page Low: [0x01f]: 0xcd" "[01fL]=cd" "cd"
120604-120925 avr_isp: lpmp: "Load program memory page High: [0x01f]: 0xbf" "[01fH]=bf" "bf"
121004-121312 avr_isp: wp: "Write program memory page: 0x00"
121317-121636 avr_isp: prnb: "Poll RDY/nBSY: Busy" "Busy" "B"
123637-123943 avr_isp: prnb: "Poll RDY/nBSY: Busy" "Busy" "B"
125947-126260 avr_isp: prnb: "Poll RDY/nBSY: Busy" "Busy" "B"
128262-128568 avr_isp: prnb: "Poll RDY/nBSY: Busy" "Busy" "B"
130573-130897 avr_isp: prnb: "Poll RDY/nBSY: Ready" "Ready" "R"
130904-131217 avr_isp: lpmp: "Load program memory page Low: [0x000]: 0x11" "[000L]=11" "11"
131219-131539 avr_isp: lpmp: "Load program memory page High: [0x000]: 0xe0" "[000H]=e0" "e0"
131542-131860 avr_isp: lpmp: "Load program memory page Low: [0x001]: 0xa0" "[001L]=a0" "a0"
131859-132175 avr_isp: lpmp: "Load program memory page High: [0x001]: 0xe0" "[001H]=e0" "e0"
132176-132489 avr_isp: lpmp: "Load program memory page Low: [0x002]: 0xb1" "[002L]=b1" "b1"
132489-132811 avr_isp: lpmp: "Load program memory page High: [0x002]: 0xe0" "[002H]=e0" "e0"
132814-133131 avr_isp: lpmp: "Load program memory page Low: [0x003]: 0xea" "[003L]=ea" "ea"
133131-133447 avr_isp: lpmp: "Load program memory page High: [0x003]: 0xea" "[003H]=ea" "ea"
133450-133767 avr_isp: lpmp: "Load program memory page Low: [0x004]: 0xf4" "[004L]=f4" "f4"
133765-134088 avr_isp: lpmp: "Load program memory page High: [0x004]: 0xe0" "[004H]=e0" "e0"
134089-134405 avr_isp: lpmp: "Load program memory page Low: [0x005]: 0x02" "[005L]=02" "02"
134406-134717 avr_isp: lpmp: "Load program memory page High: [0x005]: 0xc0" "[005H]=c0" "c0"
134718-135037 avr_isp: lpmp: "Load program memory page Low: [0x006]: 0x05" "[006L]=05" "05"
135038-135347 avr_isp: lpmp: "Load program memory page High: [0x006]: 0x90" "[006H]=90" "90"
135348-135654 avr_isp: lpmp: "Load program memory page Low: [0x007]: 0x0d" "[007L]=0d" "0d"
135658-135973 avr_isp: lpmp: "Load program memory page High: [0x007]: 0x92" "[007H]=92" "92"
135972-136288 avr_isp: lpmp: "Load program memory page Low: [0x008]: 0xae" "[008L]=ae" "ae"
136290-136607 avr_isp: lpmp: "Load program memory page High: [0x008]: 0x31" "[008H]=31" "31"
136606-136922 avr_isp: lpmp: "Load program memory page Low: [0x009]: 0xb1" "[009L]=b1" "b1"
136925-137236 avr_isp: lpmp: "Load program memory page High: [0x009]: 0x07" "[009H]=07" "07"
137239-137558 avr_isp: lpmp: "Load program memory page Low: [0x00a]: 0xd9" "[00aL]=d9" "d9"
137561-137878 avr_isp: lpmp: "Load program memory page High: [0x00a]: 0xf7" "[00aH]=f7" "f7"
137881-138187 avr_isp: lpmp: "Load program memory page Low: [0x00b]: 0x21" "[00bL]=21" "21"
138189-138500 avr_isp: lpmp: "Load program memory page High: [0x00b]: 0xe0" "[00bH]=e0" "e0"
138501-138824 avr_isp: lpmp: "Load program memory page Low: [0x00c]: 0xae" "[00cL]=ae" "ae"
138826-139146 avr_isp: lpmp: "Load program memory page High: [0x00c]: 0xe1" "[00cH]=e1" "e1"
139144-139462 avr_isp: lpmp: "Load program memory page Low: [0x00d]: 0xb1" "[00dL]=b1" "b1"
139463-139781 avr_isp: lpmp: "Load program memory page High: [0x00d]: 0xe0" "[00dH]=e0" "e0"
139783-140090 avr_isp: lpmp: "Load program memory page Low: [0x00e]: 0x01" "[00eL]=01" "01"
140089-140408 avr_isp: lpmp: "Load program memory page High: [0x00e]: 0xc0" "[00eH]=c0" "c0"
140407-140722 avr_isp: lpmp: "Load program memory page Low: [0x00f]: 0x1d" "[00fL]=1d" "1d"
140721-141051 avr_isp: lpmp: "Load program memory page High: [0x00f]: 0x92" "[00fH]=92" "92"
141054-141372 avr_isp: lpmp: "Load program memory page Low: [0x010]: 0xae" "[010L]=ae" "ae"
141371-141687 avr_isp: lpmp: "Load program memory page High: [0x010]: 0x34" "[010H]=34" "34"
141686-142006 avr_isp: lpmp: "Load program memory page Low: [0x011]: 0xb2" "[011L]=b2" "b2"
142005-142321 avr_isp: lpmp: "Load program memory page High: [0x011]: 0x07" "[011H]=07" "07"
142322-142630 avr_isp: lpmp: "Load program memory page Low: [0x012]: 0xe1" "[012L]=e1" "e1"
142634-142957 avr_isp: lpmp: "Load program memory page High: [0x012]: 0xf7" "[012H]=f7" "f7"
142957-143271 avr_isp: lpmp: "Load program memory page Low: [0x013]: 0xc5" "[013L]=c5" "c5"
143270-143586 avr_isp: lpmp: "Load program memory page High: [0x013]: 0xd1" "[013H]=d1" "d1"
143587-143900 avr_isp: lpmp: "Load program memory page Low: [0x014]: 0x1e" "[014L]=1e" "1e"
143902-144210 avr_isp: lpmp: "Load program memory page High: [0x014]: 0xc2" "[014H]=c2" "c2"
144209-144533 avr_isp: lpmp: "Load program memory page Low: [0x015]: 0xca" "[015L]=ca" "ca"
144530-144855 avr_isp: lpmp: "Load program memory page High: [0x015]: 0xcf" "[015H]=cf" "cf"
144854-145172 avr_isp: lpmp: "Load program memory page Low: [0x016]: 0x08" "[016L]=08" "08"
145175-145494 avr_isp: lpmp: "Load program memory page High: [0x016]: 0x95" "[016H]=95" "95"
145497-145816 avr_isp: lpmp: "Load program memory page Low: [0x017]: 0x8b" "[017L]=8b" "8b"
145819-146132 avr_isp: lpmp: "Load program memory page High: [0x017]: 0xb1" "[017H]=b1" "b1"
146132-146446 avr_isp: lpmp: "Load program memory page Low: [0x018]: 0x80" "[018L]=80" "80"
146444-146760 avr_isp: lpmp: "Load program memory page High: [0x018]: 0x62" "[018H]=62" "62"
146771-147092 avr_isp: lpmp: "Load program memory page Low: [0x019]: 0x8b" "[019L]=8b" "8b"
147091-147404 avr_isp: lpmp: "Load program memory page High: [0x019]: 0xb9" "[019H]=b9" "b9"
147402-147715 avr_isp: lpmp: "Load program memory page Low: [0x01a]: 0x82" "[01aL]=82" "82"
147716-148032 avr_isp: lpmp: "Load program memory page High: [0x01a]: 0xe0" "[01aH]=e0" "e0"
148033-148348 avr_isp: lpmp: "Load program memory page Low: [0x01b]: 0x8a" "[01bL]=8a" "8a"
148348-148669 avr_isp: lpmp: "Load program memory page High: [0x01b]: 0x95" "[01bH]=95" "95"
148672-148969 avr_isp: lpmp: "Load program memory page Low: [0x01c]: 0xf1" "[01cL]=f1" "f1"
148969-149260 avr_isp: lpmp: "Load program memory page High: [0x01c]: 0xf7" "[01cH]=f7" "f7"
149261-149553 avr_isp: lpmp: "Load program memory page Low: [0x01d]: 0x00" "[01dL]=00" "00"
149554-149872 avr_isp: lpmp: "Load program memory page High: [0x01d]: 0xc0" "[01dH]=c0" "c0"
149871-150179 avr_isp: lpmp: "Load program memory page Low: [0x01e]: 0x8b" "[01eL]=8b" "8b"
150179-150503 avr_isp: lpmp: "Load program memory page High: [0x01e]: 0xb1" "[01eH]=b1" "b1"
150503-150824 avr_isp: lpmp: "Load program memory page Low: [0x01f]: 0x8f" "[01fL]=8f" "8f"
150824-151138 avr_isp: lpmp: "Load program memory page High: [0x01f]: 0x7d" "[01fH]=7d" "7d"
151191-151505 avr_isp: wp: "Write program memory page: 0x400"
151507-151825 avr_isp: prnb: "Poll RDY/nBSY: Busy" "Busy" "B"
153824-154132 avr_isp: prnb: "Poll RDY/nBSY: Busy" "Busy" "B"
156137-156456 avr_isp: prnb: "Poll RDY/nBSY: Busy" "Busy" "B"
158457-158795 avr_isp: prnb: "Poll RDY/nBSY: Busy" "Busy" "B"
160787-161102 avr_isp: prnb: "Poll RDY/nBSY: Ready" "Ready" "R"
161105-161425 avr_isp: lpmp: "Load program memory page Low: [0x000]: 0x8b" "[000L]=8b" "8b"
161424-161735 avr_isp: lpmp: "Load program memory page High: [0x000]: 0xb9" "[000H]=b9" "b9"
161734-162038 avr_isp: lpmp: "Load program memory page Low: [0x001]: 0x08" "[001L]=08" "08"
162042-162359 avr_isp: lpmp: "Load program memory page High: [0x001]: 0x95" "[001H]=95" "95"
162358-162672 avr_isp: lpmp: "Load program memory page Low: [0x002]: 0x87" "[002L]=87" "87"
162675-162995 avr_isp: lpmp: "Load program memory page High: [0x002]: 0xb1" "[002H]=b1" "b1"
162994-163309 avr_isp: lpmp: "Load program memory page Low: [0x003]: 0x80" "[003L]=80" "80"
163310-163622 avr_isp: lpmp: "Load program memory page High: [0x003]: 0x7f" "[003H]=7f" "7f"
163625-163942 avr_isp: lpmp: "Load program memory page Low: [0x004]: 0x87" "[004L]=87" "87"
163940-164255 avr_isp: lpmp: "Load program memory page High: [0x004]: 0xb9" "[004H]=b9" "b9"
164257-164567 avr_isp: lpmp: "Load program memory page Low: [0x005]: 0x8b" "[005L]=8b" "8b"
164569-164891 avr_isp: lpmp: "Load program memory page High: [0x005]: 0xb1" "[005H]=b1" "b1"
164896-165226 avr_isp: lpmp: "Load program memory page Low: [0x006]: 0x8f" "[006L]=8f" "8f"
165224-165546 avr_isp: lpmp: "Load program memory page High: [0x006]: 0x77" "[006H]=77" "77"
165545-165856 avr_isp: lpmp: "Load program memory page Low: [0x007]: 0x8b" "[007L]=8b" "8b"
165855-166166 avr_isp: lpmp: "Load program memory page High: [0x007]: 0xb9" "[007H]=b9" "b9"
166165-166476 avr_isp: lpmp: "Load program memory page Low: [0x008]: 0x8b" "[008L]=8b" "8b"
166477-166802 avr_isp: lpmp: "Load program memory page High: [0x008]: 0xb1" "[008H]=b1" "b1"
166794-167102 avr_isp: lpmp: "Load program memory page Low: [0x009]: 0x80" "[009L]=80" "80"
167103-167417 avr_isp: lpmp: "Load program memory page High: [0x009]: 0x64" "[009H]=64" "64"
167418-167736 avr_isp: lpmp: "Load program memory page Low: [0x00a]: 0x8b" "[00aL]=8b" "8b"
167735-168055 avr_isp: lpmp: "Load program memory page High: [0x00a]: 0xb9" "[00aH]=b9" "b9"
168055-168370 avr_isp: lpmp: "Load program memory page Low: [0x00b]: 0x8b" "[00bL]=8b" "8b"
168373-168690 avr_isp: lpmp: "Load program memory page High: [0x00b]: 0xb1" "[00bH]=b1" "b1"
168692-169016 avr_isp: lpmp: "Load program memory page Low: [0x00c]: 0x80" "[00cL]=80" "80"
169017-169333 avr_isp: lpmp: "Load program memory page High: [0x00c]: 0x62" "[00cH]=62" "62"
169332-169649 avr_isp: lpmp: "Load program memory page Low: [0x00d]: 0x8b" "[00dL]=8b" "8b"
169648-169959 avr_isp: lpmp: "Load program memory page High: [0x00d]: 0xb9" "[00dH]=b9" "b9"
169958-170273 avr_isp: lpmp: "Load program memory page Low: [0x00e]: 0x33" "[00eL]=33" "33"
170269-170583 avr_isp: lpmp: "Load program memory page High: [0x00e]: 0x99" "[00eH]=99" "99"
170580-170903 avr_isp: lpmp: "Load program memory page Low: [0x00f]: 0xfe" "[00fL]=fe" "fe"
170902-171218 avr_isp: lpmp: "Load program memory page High: [0x00f]: 0xcf" "[00fH]=cf" "cf"
171221-171537 avr_isp: lpmp: "Load program memory page Low: [0x010]: 0x8b" "[010L]=8b" "8b"
171538-171861 avr_isp: lpmp: "Load program memory page High: [0x010]: 0xb1" "[010H]=b1" "b1"
171860-172176 avr_isp: lpmp: "Load program memory page Low: [0x011]: 0x8f" "[011L]=8f" "8f"
172177-172496 avr_isp: lpmp: "Load program memory page High: [0x011]: 0x7b" "[011H]=7b" "7b"
172497-172821 avr_isp: lpmp: "Load program memory page Low: [0x012]: 0x8b" "[012L]=8b" "8b"
172824-173145 avr_isp: lpmp: "Load program memory page High: [0x012]: 0xb9" "[012H]=b9" "b9"
173149-173460 avr_isp: lpmp: "Load program memory page Low: [0x013]: 0x87" "[013L]=87" "87"
173459-173777 avr_isp: lpmp: "Load program memory page High: [0x013]: 0xb1" "[013H]=b1" "b1"
173778-174089 avr_isp: lpmp: "Load program memory page Low: [0x014]: 0x8f" "[014L]=8f" "8f"
174091-174411 avr_isp: lpmp: "Load program memory page High: [0x014]: 0x60" "[014H]=60" "60"
174414-174730 avr_isp: lpmp: "Load program memory page Low: [0x015]: 0x87" "[015L]=87" "87"
174729-175048 avr_isp: lpmp: "Load program memory page High: [0x015]: 0xb9" "[015H]=b9" "b9"
175047-175353 avr_isp: lpmp: "Load program memory page Low: [0x016]: 0x08" "[016L]=08" "08"
175354-175665 avr_isp: lpmp: "Load program memory page High: [0x016]: 0x95" "[016H]=95" "95"
175668-175980 avr_isp: lpmp: "Load program memory page Low: [0x017]: 0xcf" "[017L]=cf" "cf"
175981-176299 avr_isp: lpmp: "Load program memory page High: [0x017]: 0x93" "[017H]=93" "93"
176300-176614 avr_isp: lpmp: "Load program memory page Low: [0x018]: 0xc8" "[018L]=c8" "c8"
176613-176932 avr_isp: lpmp: "Load program memory page High: [0x018]: 0x2f" "[018H]=2f" "2f"
176934-177256 avr_isp: lpmp: "Load program memory page Low: [0x019]: 0xe8" "[019L]=e8" "e8"
177258-177575 avr_isp: lpmp: "Load program memory page High: [0x019]: 0xdf" "[019H]=df" "df"
177573-177888 avr_isp: lpmp: "Load program memory page Low: [0x01a]: 0x98" "[01aL]=98" "98"
177890-178210 avr_isp: lpmp: "Load program memory page High: [0x01a]: 0xb1" "[01aH]=b1" "b1"
178212-178532 avr_isp: lpmp: "Load program memory page Low: [0x01b]: 0x90" "[01bL]=90" "90"
178536-178855 avr_isp: lpmp: "Load program memory page High: [0x01b]: 0x7f" "[01bH]=7f" "7f"
178854-179173 avr_isp: lpmp: "Load program memory page Low: [0x01c]: 0x8c" "[01cL]=8c" "8c"
179170-179474 avr_isp: lpmp: "Load program memory page High: [0x01c]: 0x2f" "[01cH]=2f" "2f"
179475-179791 avr_isp: lpmp: "Load program memory page Low: [0x01d]: 0x82" "[01dL]=82" "82"
179792-180104 avr_isp: lpmp: "Load program memory page High: [0x01d]: 0x95" "[01dH]=95" "95"
180107-180426 avr_isp: lpmp: "Load program memory page Low: [0x01e]: 0x8f" "[01eL]=8f" "8f"
180427-180736 avr_isp: lpmp: "Load program memory page High: [0x01e]: 0x70" "[01eH]=70" "70"
180739-181059 avr_isp: lpmp: "Load program memory page Low: [0x01f]: 0x89" "[01fL]=89" "89"
181058-181370 avr_isp: lpmp: "Load program memory page High: [0x01f]: 0x2b" "[01fH]=2b" "2b"
181417-181729 avr_isp: wp: "Write program memory page: 0x800"
181735-182047 avr_isp: prnb: "Poll RDY/nBSY: Busy" "Busy" "B"
184053-184371 avr_isp: prnb: "Poll RDY/nBSY: Busy" "Busy" "B"
186372-186691 avr_isp: prnb: "Poll RDY/nBSY: Busy" "Busy" "B"
188690-189020 avr_isp: prnb: "Poll RDY/nBSY: Busy" "Busy" "B"
191023-191333 avr_isp: prnb: "Poll RDY/nBSY: Ready" "Ready" "R"
191338-191649 avr_isp: lpmp: "Load program memory page Low: [0x000]: 0x88" "[000L]=88" "88"
191652-191968 avr_isp: lpmp: "Load program memory page High: [0x000]: 0xb9" "[000H]=b9" "b9"
191967-192290 avr_isp: lpmp: "Load program memory page Low: [0x001]: 0x8b" "[001L]=8b" "8b"
192289-192597 avr_isp: lpmp: "Load program memory page High: [0x001]: 0xb1" "[001H]=b1" "b1"
192597-192928 avr_isp: lpmp: "Load program memory page Low: [0x002]: 0x8f" "[002L]=8f" "8f"
192927-193239 avr_isp: lpmp: "Load program memory page High: [0x002]: 0x77" "[002H]=77" "77"
193239-193551 avr_isp: lpmp: "Load program memory page Low: [0x003]: 0x8b" "[003L]=8b" "8b"
193551-193875 avr_isp: lpmp: "Load program memory page High: [0x003]: 0xb9" "[003H]=b9" "b9"
193873-194188 avr_isp: lpmp: "Load program memory page Low: [0x004]: 0x8b" "[004L]=8b" "8b"
194190-194507 avr_isp: lpmp: "Load program memory page High: [0x004]: 0xb1" "[004H]=b1" "b1"
194505-194827 avr_isp: lpmp: "Load program memory page Low: [0x005]: 0x8f" "[005L]=8f" "8f"
194827-195148 avr_isp: lpmp: "Load program memory page High: [0x005]: 0x7b" "[005H]=7b" "7b"
195150-195455 avr_isp: lpmp: "Load program memory page Low: [0x006]: 0x8b" "[006L]=8b" "8b"
195456-195770 avr_isp: lpmp: "Load program memory page High: [0x006]: 0xb9" "[006H]=b9" "b9"
195772-196099 avr_isp: lpmp: "Load program memory page Low: [0x007]: 0xcf" "[007L]=cf" "cf"
196098-196410 avr_isp: lpmp: "Load program memory page High: [0x007]: 0xdf" "[007H]=df" "df"
196413-196731 avr_isp: lpmp: "Load program memory page Low: [0x008]: 0x88" "[008L]=88" "88"
196730-197060 avr_isp: lpmp: "Load program memory page High: [0x008]: 0xb1" "[008H]=b1" "b1"
197058-197376 avr_isp: lpmp: "Load program memory page Low: [0x009]: 0x80" "[009L]=80" "80"
197375-197693 avr_isp: lpmp: "Load program memory page High: [0x009]: 0x7f" "[009H]=7f" "7f"
197692-198002 avr_isp: lpmp: "Load program memory page Low: [0x00a]: 0xcf" "[00aL]=cf" "cf"
198002-198317 avr_isp: lpmp: "Load program memory page High: [0x00a]: 0x70" "[00aH]=70" "70"
198321-198640 avr_isp: lpmp: "Load program memory page Low: [0x00b]: 0x8c" "[00bL]=8c" "8c"
198638-198972 avr_isp: lpmp: "Load program memory page High: [0x00b]: 0x2b" "[00bH]=2b" "2b"
198971-199289 avr_isp: lpmp: "Load program memory page Low: [0x00c]: 0x88" "[00cL]=88" "88"
199291-199609 avr_isp: lpmp: "Load program memory page High: [0x00c]: 0xb9" "[00cH]=b9" "b9"
199612-199931 avr_isp: lpmp: "Load program memory page Low: [0x00d]: 0xc9" "[00dL]=c9" "c9"
199934-200250 avr_isp: lpmp: "Load program memory page High: [0x00d]: 0xdf" "[00dH]=df" "df"
200249-200563 avr_isp: lpmp: "Load program memory page Low: [0x00e]: 0xcf" "[00eL]=cf" "cf"
200564-200900 avr_isp: lpmp: "Load program memory page High: [0x00e]: 0x91" "[00eH]=91" "91"
200897-201213 avr_isp: lpmp: "Load program memory page Low: [0x00f]: 0x08" "[00fL]=08" "08"
201216-201535 avr_isp: lpmp: "Load program memory page High: [0x00f]: 0x95" "[00fH]=95" "95"
201538-201854 avr_isp: lpmp: "Load program memory page Low: [0x010]: 0xcf" "[010L]=cf" "cf"
201853-202169 avr_isp: lpmp: "Load program memory page High: [0x010]: 0x93" "[010H]=93" "93"
202170-202486 avr_isp: lpmp: "Load program memory page Low: [0x011]: 0xc8" "[011L]=c8" "c8"
202485-202811 avr_isp: lpmp: "Load program memory page High: [0x011]: 0x2f" "[011H]=2f" "2f"
202812-203128 avr_isp: lpmp: "Load program memory page Low: [0x012]: 0xcf" "[012L]=cf" "cf"
203130-203447 avr_isp: lpmp: "Load program memory page High: [0x012]: 0xdf" "[012H]=df" "df"
203445-203757 avr_isp: lpmp: "Load program memory page Low: [0x013]: 0x98" "[013L]=98" "98"
203756-204079 avr_isp: lpmp: "Load program memory page High: [0x013]: 0xb1" "[013H]=b1" "b1"
204078-204391 avr_isp: lpmp: "Load program memory page Low: [0x014]: 0x90" "[014L]=90" "90"
204390-204701 avr_isp: lpmp: "Load program memory page High: [0x014]: 0x7f" "[014H]=7f" "7f"
204700-205025 avr_isp: lpmp: "Load program memory page Low: [0x015]: 0x8c" "[015L]=8c" "8c"
205024-205342 avr_isp: lpmp: "Load program memory page High: [0x015]: 0x2f" "[015H]=2f" "2f"
205343-205661 avr_isp: lpmp: "Load program memory page Low: [0x016]: 0x82" "[016L]=82" "82"
205662-205983 avr_isp: lpmp: "Load program memory page High: [0x016]: 0x95" "[016H]=95" "95"
205982-206302 avr_isp: lpmp: "Load program memory page Low: [0x017]: 0x8f" "[017L]=8f" "8f"
206302-206613 avr_isp: lpmp: "Load program memory page High: [0x017]: 0x70" "[017H]=70" "70"
206614-206940 avr_isp: lpmp: "Load program memory page Low: [0x018]: 0x89" "[018L]=89" "89"
206941-207258 avr_isp: lpmp: "Load program memory page High: [0x018]: 0x2b" "[018H]=2b" "2b"
207256-207572 avr_isp: lpmp: "Load program memory page Low: [0x019]: 0x88" "[019L]=88" "88"
207568-207881 avr_isp: lpmp: "Load program memory page High: [0x019]: 0xb9" "[019H]=b9" "b9"
207883-208204 avr_isp: lpmp: "Load program memory page Low: [0x01a]: 0x8b" "[01aL]=8b" "8b"
208200-208522 avr_isp: lpmp: "Load program memory page High: [0x01a]: 0xb1" "[01aH]=b1" "b1"
208521-208845 avr_isp: lpmp: "Load program memory page Low: [0x01b]: 0x80" "[01bL]=80" "80"
208851-209168 avr_isp: lpmp: "Load program memory page High: [0x01b]: 0x68" "[01bH]=68" "68"
209165-209491 avr_isp: lpmp: "Load program memory page Low: [0x01c]: 0x8b" "[01cL]=8b" "8b"
209492-209799 avr_isp: lpmp: "Load program memory page High: [0x01c]: 0xb9" "[01cH]=b9" "b9"
209802-210118 avr_isp: lpmp: "Load program memory page Low: [0x01d]: 0x8b" "[01dL]=8b" "8b"
210117-210428 avr_isp: lpmp: "Load program memory page High: [0x01d]: 0xb1" "[01dH]=b1" "b1"
210429-210743 avr_isp: lpmp: "Load program memory page Low: [0x01e]: 0x8f" "[01eL]=8f" "8f"
210744-211066 avr_isp: lpmp: "Load program memory page High: [0x01e]: 0x7b" "[01eH]=7b" "7b"
211068-211386 avr_isp: lpmp: "Load program memory page Low: [0x01f]: 0x8b" "[01fL]=8b" "8b"
211385-211707 avr_isp: lpmp: "Load program memory page High: [0x01f]: 0xb9" "[01fH]=b9" "b9"
211755-212075 avr_isp: wp: "Write program memory page: 0xc00"
212077-212396 avr_isp: prnb: "Poll RDY/nBSY: Busy" "Busy" "B"
214400-214722 avr_isp: prnb: "Poll RDY/nBSY: Busy" "Busy" "B"
216724-217054 avr_isp: prnb: "Poll RDY/nBSY: Busy" "Busy" "B"
219054-219373 avr_isp: prnb: "Poll RDY/nBSY: Busy" "Busy" "B"
221374-221692 avr_isp: prnb: "Poll RDY/nBSY: Ready" "Ready" "R"
221695-222015 avr_isp: lpmp: "Load program memory page Low: [0x000]: 0xb6" "[000L]=b6" "b6"
222014-222333 avr_isp: lpmp: "Load program memory page High: [0x000]: 0xdf" "[000H]=df" "df"
222334-222647 avr_isp: lpmp: "Load program memory page Low: [0x001]: 0x88" "[001L]=88" "88"
222646-222976 avr_isp: lpmp: "Load program memory page High: [0x001]: 0xb1" "[001H]=b1" "b1"
222974-223294 avr_isp: lpmp: "Load program memory page Low: [0x002]: 0x80" "[002L]=80" "80"
223295-223613 avr_isp: lpmp: "Load program memory page High: [0x002]: 0x7f" "[002H]=7f" "7f"
223615-223923 avr_isp: lpmp: "Load program memory page Low: [0x003]: 0xcf" "[003L]=cf" "cf"
223925-224246 avr_isp: lpmp: "Load program memory page High: [0x003]: 0x70" "[003H]=70" "70"
224242-224565 avr_isp: lpmp: "Load program memory page Low: [0x004]: 0x8c" "[004L]=8c" "8c"
224564-224892 avr_isp: lpmp: "Load program memory page High: [0x004]: 0x2b" "[004H]=2b" "2b"
224891-225206 avr_isp: lpmp: "Load program memory page Low: [0x005]: 0x88" "[005L]=88" "88"
225205-225516 avr_isp: lpmp: "Load program memory page High: [0x005]: 0xb9" "[005H]=b9" "b9"
225515-225829 avr_isp: lpmp: "Load program memory page Low: [0x006]: 0xb0" "[006L]=b0" "b0"
225830-226151 avr_isp: lpmp: "Load program memory page High: [0x006]: 0xdf" "[006H]=df" "df"
226154-226470 avr_isp: lpmp: "Load program memory page Low: [0x007]: 0xcf" "[007L]=cf" "cf"
226469-226787 avr_isp: lpmp: "Load program memory page High: [0x007]: 0x91" "[007H]=91" "91"
226797-227110 avr_isp: lpmp: "Load program memory page Low: [0x008]: 0x08" "[008L]=08" "08"
227109-227413 avr_isp: lpmp: "Load program memory page High: [0x008]: 0x95" "[008H]=95" "95"
227416-227735 avr_isp: lpmp: "Load program memory page Low: [0x009]: 0xcf" "[009L]=cf" "cf"
227736-228054 avr_isp: lpmp: "Load program memory page High: [0x009]: 0x93" "[009H]=93" "93"
228053-228375 avr_isp: lpmp: "Load program memory page Low: [0x00a]: 0x8b" "[00aL]=8b" "8b"
228375-228690 avr_isp: lpmp: "Load program memory page High: [0x00a]: 0xb1" "[00aH]=b1" "b1"
228692-229014 avr_isp: lpmp: "Load program memory page Low: [0x00b]: 0x8f" "[00bL]=8f" "8f"
229018-229324 avr_isp: lpmp: "Load program memory page High: [0x00b]: 0x71" "[00bH]=71" "71"
229326-229645 avr_isp: lpmp: "Load program memory page Low: [0x00c]: 0x8b" "[00cL]=8b" "8b"
229643-229956 avr_isp: lpmp: "Load program memory page High: [0x00c]: 0xb9" "[00cH]=b9" "b9"
229960-230277 avr_isp: lpmp: "Load program memory page Low: [0x00d]: 0x8a" "[00dL]=8a" "8a"
230276-230601 avr_isp: lpmp: "Load program memory page High: [0x00d]: 0xb1" "[00dH]=b1" "b1"
230598-230925 avr_isp: lpmp: "Load program memory page Low: [0x00e]: 0x80" "[00eL]=80" "80"
230924-231237 avr_isp: lpmp: "Load program memory page High: [0x00e]: 0x6e" "[00eH]=6e" "6e"
231236-231552 avr_isp: lpmp: "Load program memory page Low: [0x00f]: 0x8a" "[00fL]=8a" "8a"
231553-231864 avr_isp: lpmp: "Load program memory page High: [0x00f]: 0xb9" "[00fH]=b9" "b9"
231865-232174 avr_isp: lpmp: "Load program memory page Low: [0x010]: 0x87" "[010L]=87" "87"
232175-232496 avr_isp: lpmp: "Load program memory page High: [0x010]: 0xb1" "[010H]=b1" "b1"
232497-232815 avr_isp: lpmp: "Load program memory page Low: [0x011]: 0x8f" "[011L]=8f" "8f"
232815-233133 avr_isp: lpmp: "Load program memory page High: [0x011]: 0x60" "[011H]=60" "60"
233135-233445 avr_isp: lpmp: "Load program memory page Low: [0x012]: 0x87" "[012L]=87" "87"
233447-233762 avr_isp: lpmp: "Load program memory page High: [0x012]: 0xb9" "[012H]=b9" "b9"
233761-234070 avr_isp: lpmp: "Load program memory page Low: [0x013]: 0x2f" "[013L]=2f" "2f"
234071-234382 avr_isp: lpmp: "Load program memory page High: [0x013]: 0xef" "[013H]=ef" "ef"
234381-234687 avr_isp: lpmp: "Load program memory page Low: [0x014]: 0x83" "[014L]=83" "83"
234688-235006 avr_isp: lpmp: "Load program memory page High: [0x014]: 0xef" "[014H]=ef" "ef"
235005-235320 avr_isp: lpmp: "Load program memory page Low: [0x015]: 0x91" "[015L]=91" "91"
235319-235637 avr_isp: lpmp: "Load program memory page High: [0x015]: 0xe0" "[015H]=e0" "e0"
235638-235945 avr_isp: lpmp: "Load program memory page Low: [0x016]: 0x21" "[016L]=21" "21"
235948-236259 avr_isp: lpmp: "Load program memory page High: [0x016]: 0x50" "[016H]=50" "50"
236260-236575 avr_isp: lpmp: "Load program memory page Low: [0x017]: 0x80" "[017L]=80" "80"
236573-236905 avr_isp: lpmp: "Load program memory page High: [0x017]: 0x40" "[017H]=40" "40"
236902-237219 avr_isp: lpmp: "Load program memory page Low: [0x018]: 0x90" "[018L]=90" "90"
237215-237533 avr_isp: lpmp: "Load program memory page High: [0x018]: 0x40" "[018H]=40" "40"
237532-237842 avr_isp: lpmp: "Load program memory page Low: [0x019]: 0xe1" "[019L]=e1" "e1"
237842-238159 avr_isp: lpmp: "Load program memory page High: [0x019]: 0xf7" "[019H]=f7" "f7"
238157-238471 avr_isp: lpmp: "Load program memory page Low: [0x01a]: 0x00" "[01aL]=00" "00"
238470-238781 avr_isp: lpmp: "Load program memory page High: [0x01a]: 0xc0" "[01aH]=c0" "c0"
238782-239096 avr_isp: lpmp: "Load program memory page Low: [0x01b]: 0x00" "[01bL]=00" "00"
239100-239410 avr_isp: lpmp: "Load program memory page High: [0x01b]: 0x00" "[01bH]=00" "00"
239410-239737 avr_isp: lpmp: "Load program memory page Low: [0x01c]: 0x88" "[01cL]=88" "88"
239736-240054 avr_isp: lpmp: "Load program memory page High: [0x01c]: 0xb1" "[01cH]=b1" "b1"
240055-240381 avr_isp: lpmp: "Load program memory page Low: [0x01d]: 0x83" "[01dL]=83" "83"
240380-240693 avr_isp: lpmp: "Load program memory page High: [0x01d]: 0x60" "[01dH]=60" "60"
240694-241022 avr_isp: lpmp: "Load program memory page Low: [0x01e]: 0x88" "[01eL]=88" "88"
241023-241343 avr_isp: lpmp: "Load program memory page High: [0x01e]: 0xb9" "[01eH]=b9" "b9"
241345-241665 avr_isp: lpmp: "Load program memory page Low: [0x01f]: 0xc0" "[01fL]=c0" "c0"
241669-241984 avr_isp: lpmp: "Load program memory page High: [0x01f]: 0xe0" "[01fH]=e0" "e0"
242041-242352 avr_isp: wp: "Write program memory page: 0x1000"
242357-242676 avr_isp: prnb: "Poll RDY/nBSY: Busy" "Busy" "B"
244677-245003 avr_isp: prnb: "Poll RDY/nBSY: Busy" "Busy" "B"
247004-247324 avr_isp: prnb: "Poll RDY/nBSY: Busy" "Busy" "B"
249328-249652 avr_isp: prnb: "Poll RDY/nBSY: Busy" "Busy" "B"
251653-251971 avr_isp: prnb: "Poll RDY/nBSY: Ready" "Ready" "R"
251980-252298 avr_isp: lpmp: "Load program memory page Low: [0x000]: 0x08" "[000L]=08" "08"
252297-252617 avr_isp: lpmp: "Load program memory page High: [0x000]: 0xc0" "[000H]=c0" "c0"
252620-252946 avr_isp: lpmp: "Load program memory page Low: [0x001]: 0x95" "[001L]=95" "95"
252945-253257 avr_isp: lpmp: "Load program memory page High: [0x001]: 0xdf" "[001H]=df" "df"
253257-253581 avr_isp: lpmp: "Load program memory page Low: [0x002]: 0x8f" "[002L]=8f" "8f"
253579-253887 avr_isp: lpmp: "Load program memory page High: [0x002]: 0xe0" "[002H]=e0" "e0"
253888-254203 avr_isp: lpmp: "Load program memory page Low: [0x003]: 0x97" "[003L]=97" "97"
254201-254519 avr_isp: lpmp: "Load program memory page High: [0x003]: 0xe2" "[003H]=e2" "e2"
254518-254841 avr_isp: lpmp: "Load program memory page Low: [0x004]: 0x01" "[004L]=01" "01"
254840-255158 avr_isp: lpmp: "Load program memory page High: [0x004]: 0x97" "[004H]=97" "97"
255160-255471 avr_isp: lpmp: "Load program memory page Low: [0x005]: 0xf1" "[005L]=f1" "f1"
255472-255788 avr_isp: lpmp: "Load program memory page High: [0x005]: 0xf7" "[005H]=f7" "f7"
255791-256100 avr_isp: lpmp: "Load program memory page Low: [0x006]: 0x00" "[006L]=00" "00"
256101-256416 avr_isp: lpmp: "Load program memory page High: [0x006]: 0xc0" "[006H]=c0" "c0"
256416-256721 avr_isp: lpmp: "Load program memory page Low: [0x007]: 0x00" "[007L]=00" "00"
256722-257049 avr_isp: lpmp: "Load program memory page High: [0x007]: 0x00" "[007H]=00" "00"
257048-257364 avr_isp: lpmp: "Load program memory page Low: [0x008]: 0xcf" "[008L]=cf" "cf"
257367-257674 avr_isp: lpmp: "Load program memory page High: [0x008]: 0x5f" "[008H]=5f" "5f"
257677-257994 avr_isp: lpmp: "Load program memory page Low: [0x009]: 0xc3" "[009L]=c3" "c3"
257992-258307 avr_isp: lpmp: "Load program memory page High: [0x009]: 0x30" "[009H]=30" "30"
258308-258628 avr_isp: lpmp: "Load program memory page Low: [0x00a]: 0xb0" "[00aL]=b0" "b0"
258626-258941 avr_isp: lpmp: "Load program memory page High: [0x00a]: 0xf3" "[00aH]=f3" "f3"
258944-259264 avr_isp: lpmp: "Load program memory page Low: [0x00b]: 0x88" "[00bL]=88" "88"
259264-259586 avr_isp: lpmp: "Load program memory page High: [0x00b]: 0xb1" "[00bH]=b1" "b1"
259582-259892 avr_isp: lpmp: "Load program memory page Low: [0x00c]: 0x8e" "[00cL]=8e" "8e"
259893-260214 avr_isp: lpmp: "Load program memory page High: [0x00c]: 0x7f" "[00cH]=7f" "7f"
260213-260540 avr_isp: lpmp: "Load program memory page Low: [0x00d]: 0x88" "[00dL]=88" "88"
260537-260863 avr_isp: lpmp: "Load program memory page High: [0x00d]: 0xb9" "[00dH]=b9" "b9"
260866-261176 avr_isp: lpmp: "Load program memory page Low: [0x00e]: 0x88" "[00eL]=88" "88"
261177-261495 avr_isp: lpmp: "Load program memory page High: [0x00e]: 0xdf" "[00eH]=df" "df"
261495-261811 avr_isp: lpmp: "Load program memory page Low: [0x00f]: 0x8f" "[00fL]=8f" "8f"
261812-262127 avr_isp: lpmp: "Load program memory page High: [0x00f]: 0xec" "[00fH]=ec" "ec"
262125-262443 avr_isp: lpmp: "Load program memory page Low: [0x010]: 0x97" "[010L]=97" "97"
262444-262764 avr_isp: lpmp: "Load program memory page High: [0x010]: 0xe0" "[010H]=e0" "e0"
262766-263087 avr_isp: lpmp: "Load program memory page Low: [0x011]: 0x01" "[011L]=01" "01"
263086-263411 avr_isp: lpmp: "Load program memory page High: [0x011]: 0x97" "[011H]=97" "97"
263409-263735 avr_isp: lpmp: "Load program memory page Low: [0x012]: 0xf1" "[012L]=f1" "f1"
263731-264053 avr_isp: lpmp: "Load program memory page High: [0x012]: 0xf7" "[012H]=f7" "f7"
264052-264373 avr_isp: lpmp: "Load program memory page Low: [0x013]: 0x00" "[013L]=00" "00"
264372-264687 avr_isp: lpmp: "Load program memory page High: [0x013]: 0xc0" "[013H]=c0" "c0"
264686-265006 avr_isp: lpmp: "Load program memory page Low: [0x014]: 0x00" "[014L]=00" "00"
265009-265329 avr_isp: lpmp: "Load program memory page High: [0x014]: 0x00" "[014H]=00" "00"
265328-265651 avr_isp: lpmp: "Load program memory page Low: [0x015]: 0x88" "[015L]=88" "88"
265650-265954 avr_isp: lpmp: "Load program memory page High: [0x015]: 0xe2" "[015H]=e2" "e2"
265955-266268 avr_isp: lpmp: "Load program memory page Low: [0x016]: 0xa0" "[016L]=a0" "a0"
266269-266585 avr_isp: lpmp: "Load program memory page High: [0x016]: 0xdf" "[016H]=df" "df"
266587-266899 avr_isp: lpmp: "Load program memory page Low: [0x017]: 0x8c" "[017L]=8c" "8c"
266903-267223 avr_isp: lpmp: "Load program memory page High: [0x017]: 0xe0" "[017H]=e0" "e0"
267227-267540 avr_isp: lpmp: "Load program memory page Low: [0x018]: 0x9e" "[018L]=9e" "9e"
267541-267864 avr_isp: lpmp: "Load program memory page High: [0x018]: 0xdf" "[018H]=df" "df"
267862-268186 avr_isp: lpmp: "Load program memory page Low: [0x019]: 0x86" "[019L]=86" "86"
268185-268508 avr_isp: lpmp: "Load program memory page High: [0x019]: 0xe0" "[019H]=e0" "e0"
268507-268835 avr_isp: lpmp: "Load program memory page Low: [0x01a]: 0x9c" "[01aL]=9c" "9c"
268838-269159 avr_isp: lpmp: "Load program memory page High: [0x01a]: 0xdf" "[01aH]=df" "df"
269162-269483 avr_isp: lpmp: "Load program memory page Low: [0x01b]: 0x81" "[01bL]=81" "81"
269484-269801 avr_isp: lpmp: "Load program memory page High: [0x01b]: 0xe0" "[01bH]=e0" "e0"
269804-270107 avr_isp: lpmp: "Load program memory page Low: [0x01c]: 0x9a" "[01cL]=9a" "9a"
270107-270409 avr_isp: lpmp: "Load program memory page High: [0x01c]: 0xdf" "[01cH]=df" "df"
270412-270728 avr_isp: lpmp: "Load program memory page Low: [0x01d]: 0xcf" "[01dL]=cf" "cf"
270727-271037 avr_isp: lpmp: "Load program memory page High: [0x01d]: 0x91" "[01dH]=91" "91"
271038-271351 avr_isp: lpmp: "Load program memory page Low: [0x01e]: 0x08" "[01eL]=08" "08"
271352-271669 avr_isp: lpmp: "Load program memory page High: [0x01e]: 0x95" "[01eH]=95" "95"
271665-271978 avr_isp: lpmp: "Load program memory page Low: [0x01f]: 0x62" "[01fL]=62" "62"
271982-272297 avr_isp: lpmp: "Load program memory page High: [0x01f]: 0x95" "[01fH]=95" "95"
272358-272673 avr_isp: wp: "Write program memory page: 0x1400"
272676-272996 avr_isp: prnb: "Poll RDY/nBSY: Busy" "Busy" "B"
275000-275324 avr_isp: prnb: "Poll RDY/nBSY: Busy" "Busy" "B"
277325-277640 avr_isp: prnb: "Poll RDY/nBSY: Busy" "Busy" "B"
279642-279945 avr_isp: prnb: "Poll RDY/nBSY: Busy" "Busy" "B"
281948-282268 avr_isp: prnb: "Poll RDY/nBSY: Ready" "Ready" "R"
282275-282586 avr_isp: lpmp: "Load program memory page Low: [0x000]: 0x66" "[000L]=66" "66"
282587-282905 avr_isp: lpmp: "Load program memory page High: [0x000]: 0x0f" "[000H]=0f" "0f"
282906-283214 avr_isp: lpmp: "Load program memory page Low: [0x001]: 0x66" "[001L]=66" "66"
283215-283533 avr_isp: lpmp: "Load program memory page High: [0x001]: 0x0f" "[001H]=0f" "0f"
283532-283847 avr_isp: lpmp: "Load program memory page Low: [0x002]: 0x60" "[002L]=60" "60"
283849-284166 avr_isp: lpmp: "Load program memory page High: [0x002]: 0x7c" "[002H]=7c" "7c"
284164-284481 avr_isp: lpmp: "Load program memory page Low: [0x003]: 0x86" "[003L]=86" "86"
284483-284803 avr_isp: lpmp: "Load program memory page High: [0x003]: 0x0f" "[003H]=0f" "0f"
284813-285123 avr_isp: lpmp: "Load program memory page Low: [0x004]: 0x80" "[004L]=80" "80"
285124-285443 avr_isp: lpmp: "Load program memory page High: [0x004]: 0x58" "[004H]=58" "58"
285447-285767 avr_isp: lpmp: "Load program memory page Low: [0x005]: 0x91" "[005L]=91" "91"
285770-286087 avr_isp: lpmp: "Load program memory page High: [0x005]: 0xcf" "[005H]=cf" "cf"
286090-286399 avr_isp: lpmp: "Load program memory page Low: [0x006]: 0x08" "[006L]=08" "08"
286402-286718 avr_isp: lpmp: "Load program memory page High: [0x006]: 0x95" "[006H]=95" "95"
286717-287028 avr_isp: lpmp: "Load program memory page Low: [0x007]: 0xcf" "[007L]=cf" "cf"
287029-287353 avr_isp: lpmp: "Load program memory page High: [0x007]: 0x93" "[007H]=93" "93"
287353-287667 avr_isp: lpmp: "Load program memory page Low: [0x008]: 0xdf" "[008L]=df" "df"
287670-287987 avr_isp: lpmp: "Load program memory page High: [0x008]: 0x93" "[008H]=93" "93"
287985-288300 avr_isp: lpmp: "Load program memory page Low: [0x009]: 0xec" "[009L]=ec" "ec"
288302-288621 avr_isp: lpmp: "Load program memory page High: [0x009]: 0x01" "[009H]=01" "01"
288619-288940 avr_isp: lpmp: "Load program memory page Low: [0x00a]: 0x02" "[00aL]=02" "02"
288943-289262 avr_isp: lpmp: "Load program memory page High: [0x00a]: 0xc0" "[00aH]=c0" "c0"
289261-289573 avr_isp: lpmp: "Load program memory page Low: [0x00b]: 0x21" "[00bL]=21" "21"
289573-289894 avr_isp: lpmp: "Load program memory page High: [0x00b]: 0x96" "[00bH]=96" "96"
289897-290216 avr_isp: lpmp: "Load program memory page Low: [0x00c]: 0xa3" "[00cL]=a3" "a3"
290219-290536 avr_isp: lpmp: "Load program memory page High: [0x00c]: 0xdf" "[00cH]=df" "df"
290539-290871 avr_isp: lpmp: "Load program memory page Low: [0x00d]: 0x88" "[00dL]=88" "88"
290868-291183 avr_isp: lpmp: "Load program memory page High: [0x00d]: 0x81" "[00dH]=81" "81"
291182-291495 avr_isp: lpmp: "Load program memory page Low: [0x00e]: 0x81" "[00eL]=81" "81"
291494-291804 avr_isp: lpmp: "Load program memory page High: [0x00e]: 0x11" "[00eH]=11" "11"
291804-292118 avr_isp: lpmp: "Load program memory page Low: [0x00f]: 0xfb" "[00fL]=fb" "fb"
292119-292434 avr_isp: lpmp: "Load program memory page High: [0x00f]: 0xcf" "[00fH]=cf" "cf"
292434-292756 avr_isp: lpmp: "Load program memory page Low: [0x010]: 0xdf" "[010L]=df" "df"
292754-293072 avr_isp: lpmp: "Load program memory page High: [0x010]: 0x91" "[010H]=91" "91"
293071-293382 avr_isp: lpmp: "Load program memory page Low: [0x011]: 0xcf" "[011L]=cf" "cf"
293383-293696 avr_isp: lpmp: "Load program memory page High: [0x011]: 0x91" "[011H]=91" "91"
293695-294011 avr_isp: lpmp: "Load program memory page Low: [0x012]: 0x08" "[012L]=08" "08"
294013-294330 avr_isp: lpmp: "Load program memory page High: [0x012]: 0x95" "[012H]=95" "95"
294329-294638 avr_isp: lpmp: "Load program memory page Low: [0x013]: 0x84" "[013L]=84" "84"
294639-294959 avr_isp: lpmp: "Load program memory page High: [0x013]: 0xb1" "[013H]=b1" "b1"
294960-295271 avr_isp: lpmp: "Load program memory page Low: [0x014]: 0x82" "[014L]=82" "82"
295272-295593 avr_isp: lpmp: "Load program memory page High: [0x014]: 0x60" "[014H]=60" "60"
295594-295913 avr_isp: lpmp: "Load program memory page Low: [0x015]: 0x84" "[015L]=84" "84"
295911-296224 avr_isp: lpmp: "Load program memory page High: [0x015]: 0xb9" "[015H]=b9" "b9"
296226-296545 avr_isp: lpmp: "Load program memory page Low: [0x016]: 0x08" "[016L]=08" "08"
296543-296863 avr_isp: lpmp: "Load program memory page High: [0x016]: 0x95" "[016H]=95" "95"
296864-297193 avr_isp: lpmp: "Load program memory page Low: [0x017]: 0x85" "[017L]=85" "85"
297189-297511 avr_isp: lpmp: "Load program memory page High: [0x017]: 0xb1" "[017H]=b1" "b1"
297510-297824 avr_isp: lpmp: "Load program memory page Low: [0x018]: 0x82" "[018L]=82" "82"
297823-298136 avr_isp: lpmp: "Load program memory page High: [0x018]: 0x60" "[018H]=60" "60"
298139-298457 avr_isp: lpmp: "Load program memory page Low: [0x019]: 0x85" "[019L]=85" "85"
298456-298777 avr_isp: lpmp: "Load program memory page High: [0x019]: 0xb9" "[019H]=b9" "b9"
298776-299096 avr_isp: lpmp: "Load program memory page Low: [0x01a]: 0x08" "[01aL]=08" "08"
299099-299420 avr_isp: lpmp: "Load program memory page High: [0x01a]: 0x95" "[01aH]=95" "95"
299423-299742 avr_isp: lpmp: "Load program memory page Low: [0x01b]: 0x85" "[01bL]=85" "85"
299746-300064 avr_isp: lpmp: "Load program memory page High: [0x01b]: 0xb1" "[01bH]=b1" "b1"
300065-300377 avr_isp: lpmp: "Load program memory page Low: [0x01c]: 0x8d" "[01cL]=8d" "8d"
300378-300691 avr_isp: lpmp: "Load program memory page High: [0x01c]: 0x7f" "[01cH]=7f" "7f"
300693-301017 avr_isp: lpmp: "Load program memory page Low: [0x01d]: 0x85" "[01dL]=85" "85"
301020-301338 avr_isp: lpmp: "Load program memory page High: [0x01d]: 0xb9" "[01dH]=b9" "b9"
301336-301644 avr_isp: lpmp: "Load program memory page Low: [0x01e]: 0x08" "[01eL]=08" "08"
301645-301951 avr_isp: lpmp: "Load program memory page High: [0x01e]: 0x95" "[01eH]=95" "95"
301953-302271 avr_isp: lpmp: "Load program memory page Low: [0x01f]: 0xe8" "[01fL]=e8" "e8"
302274-302588 avr_isp: lpmp: "Load program memory page High: [0x01f]: 0xe6" "[01fH]=e6" "e6"
302645-302969 avr_isp: wp: "Write program memory page: 0x1800"
302975-303287 avr_isp: prnb: "Poll RDY/nBSY: Busy" "Busy" "B"
305291-305617 avr_isp: prnb: "Poll RDY/nBSY: Busy" "Busy" "B"
307616-307924 avr_isp: prnb: "Poll RDY/nBSY: Busy" "Busy" "B"
309924-310231 avr_isp: prnb: "Poll RDY/nBSY: Busy" "Busy" "B"
312234-312556 avr_isp: prnb: "Poll RDY/nBSY: Ready" "Ready" "R"
312555-312887 avr_isp: lpmp: "Load program memory page Low: [0x000]: 0xf0" "[000L]=f0" "f0"
312890-313215 avr_isp: lpmp: "Load program memory page High: [0x000]: 0xe0" "[000H]=e0" "e0"
313216-313529 avr_isp: lpmp: "Load program memory page Low: [0x001]: 0x80" "[001L]=80" "80"
313530-313839 avr_isp: lpmp: "Load program memory page High: [0x001]: 0x81" "[001H]=81" "81"
313840-314147 avr_isp: lpmp: "Load program memory page Low: [0x002]: 0x81" "[002L]=81" "81"
314145-314460 avr_isp: lpmp: "Load program memory page High: [0x002]: 0x60" "[002H]=60" "60"
314461-314772 avr_isp: lpmp: "Load program memory page Low: [0x003]: 0x80" "[003L]=80" "80"
314773-315098 avr_isp: lpmp: "Load program memory page High: [0x003]: 0x83" "[003H]=83" "83"
315098-315409 avr_isp: lpmp: "Load program memory page Low: [0x004]: 0xeb" "[004L]=eb" "eb"
315408-315719 avr_isp: lpmp: "Load program memory page High: [0x004]: 0xe6" "[004H]=e6" "e6"
315718-316041 avr_isp: lpmp: "Load program memory page Low: [0x005]: 0xf0" "[005L]=f0" "f0"
316040-316356 avr_isp: lpmp: "Load program memory page High: [0x005]: 0xe0" "[005H]=e0" "e0"
316359-316665 avr_isp: lpmp: "Load program memory page Low: [0x006]: 0x80" "[006L]=80" "80"
316666-316982 avr_isp: lpmp: "Load program memory page High: [0x006]: 0x81" "[006H]=81" "81"
316983-317303 avr_isp: lpmp: "Load program memory page Low: [0x007]: 0x84" "[007L]=84" "84"
317302-317627 avr_isp: lpmp: "Load program memory page High: [0x007]: 0x60" "[007H]=60" "60"
317628-317944 avr_isp: lpmp: "Load program memory page Low: [0x008]: 0x80" "[008L]=80" "80"
317945-318260 avr_isp: lpmp: "Load program memory page High: [0x008]: 0x83" "[008H]=83" "83"
318258-318575 avr_isp: lpmp: "Load program memory page Low: [0x009]: 0x84" "[009L]=84" "84"
318577-318897 avr_isp: lpmp: "Load program memory page High: [0x009]: 0xb1" "[009H]=b1" "b1"
318899-319215 avr_isp: lpmp: "Load program memory page Low: [0x00a]: 0x8b" "[00aL]=8b" "8b"
319217-319535 avr_isp: lpmp: "Load program memory page High: [0x00a]: 0x7f" "[00aH]=7f" "7f"
319537-319845 avr_isp: lpmp: "Load program memory page Low: [0x00b]: 0x84" "[00bL]=84" "84"
319847-320162 avr_isp: lpmp: "Load program memory page High: [0x00b]: 0xb9" "[00bH]=b9" "b9"
320161-320484 avr_isp: lpmp: "Load program memory page Low: [0x00c]: 0x85" "[00cL]=85" "85"
320483-320797 avr_isp: lpmp: "Load program memory page High: [0x00c]: 0xb1" "[00cH]=b1" "b1"
320795-321109 avr_isp: lpmp: "Load program memory page Low: [0x00d]: 0x84" "[00dL]=84" "84"
321109-321423 avr_isp: lpmp: "Load program memory page High: [0x00d]: 0x60" "[00dH]=60" "60"
321424-321733 avr_isp: lpmp: "Load program memory page Low: [0x00e]: 0x85" "[00eL]=85" "85"
321736-322054 avr_isp: lpmp: "Load program memory page High: [0x00e]: 0xb9" "[00eH]=b9" "b9"
322056-322363 avr_isp: lpmp: "Load program memory page Low: [0x00f]: 0x84" "[00fL]=84" "84"
322361-322683 avr_isp: lpmp: "Load program memory page High: [0x00f]: 0xb1" "[00fH]=b1" "b1"
322682-323007 avr_isp: lpmp: "Load program memory page Low: [0x010]: 0x80" "[010L]=80" "80"
323004-323322 avr_isp: lpmp: "Load program memory page High: [0x010]: 0x61" "[010H]=61" "61"
323322-323632 avr_isp: lpmp: "Load program memory page Low: [0x011]: 0x84" "[011L]=84" "84"
323634-323952 avr_isp: lpmp: "Load program memory page High: [0x011]: 0xb9" "[011H]=b9" "b9"
323956-324273 avr_isp: lpmp: "Load program memory page Low: [0x012]: 0xe4" "[012L]=e4" "e4"
324272-324591 avr_isp: lpmp: "Load program memory page High: [0x012]: 0xe6" "[012H]=e6" "e6"
324592-324919 avr_isp: lpmp: "Load program memory page Low: [0x013]: 0xf0" "[013L]=f0" "f0"
324920-325236 avr_isp: lpmp: "Load program memory page High: [0x013]: 0xe0" "[013H]=e0" "e0"
325235-325557 avr_isp: lpmp: "Load program memory page Low: [0x014]: 0x80" "[014L]=80" "80"
325556-325872 avr_isp: lpmp: "Load program memory page High: [0x014]: 0x81" "[014H]=81" "81"
325873-326187 avr_isp: lpmp: "Load program memory page Low: [0x015]: 0x8b" "[015L]=8b" "8b"
326188-326501 avr_isp: lpmp: "Load program memory page High: [0x015]: 0x7f" "[015H]=7f" "7f"
326503-326840 avr_isp: lpmp: "Load program memory page Low: [0x016]: 0x80" "[016L]=80" "80"
326832-327148 avr_isp: lpmp: "Load program memory page High: [0x016]: 0x83" "[016H]=83" "83"
327148-327463 avr_isp: lpmp: "Load program memory page Low: [0x017]: 0x80" "[017L]=80" "80"
327464-327783 avr_isp: lpmp: "Load program memory page High: [0x017]: 0xec" "[017H]=ec" "ec"
327784-328095 avr_isp: lpmp: "Load program memory page Low: [0x018]: 0x8c" "[018L]=8c" "8c"
328096-328414 avr_isp: lpmp: "Load program memory page High: [0x018]: 0xbd" "[018H]=bd" "bd"
328413-328729 avr_isp: lpmp: "Load program memory page Low: [0x019]: 0x08" "[019L]=08" "08"
328732-329051 avr_isp: lpmp: "Load program memory page High: [0x019]: 0x95" "[019H]=95" "95"
329056-329377 avr_isp: lpmp: "Load program memory page Low: [0x01a]: 0x1f" "[01aL]=1f" "1f"
329380-329697 avr_isp: lpmp: "Load program memory page High: [0x01a]: 0x92" "[01aH]=92" "92"
329695-330014 avr_isp: lpmp: "Load program memory page Low: [0x01b]: 0x0f" "[01bL]=0f" "0f"
330016-330337 avr_isp: lpmp: "Load program memory page High: [0x01b]: 0x92" "[01bH]=92" "92"
330335-330651 avr_isp: lpmp: "Load program memory page Low: [0x01c]: 0x0f" "[01cL]=0f" "0f"
330652-330972 avr_isp: lpmp: "Load program memory page High: [0x01c]: 0xb6" "[01cH]=b6" "b6"
330975-331287 avr_isp: lpmp: "Load program memory page Low: [0x01d]: 0x0f" "[01dL]=0f" "0f"
331286-331594 avr_isp: lpmp: "Load program memory page High: [0x01d]: 0x92" "[01dH]=92" "92"
331598-331915 avr_isp: lpmp: "Load program memory page Low: [0x01e]: 0x11" "[01eL]=11" "11"
331913-332228 avr_isp: lpmp: "Load program memory page High: [0x01e]: 0x24" "[01eH]=24" "24"
332230-332548 avr_isp: lpmp: "Load program memory page Low: [0x01f]: 0x2f" "[01fL]=2f" "2f"
332551-332872 avr_isp: lpmp: "Load program memory page High: [0x01f]: 0x93" "[01fH]=93" "93"
332924-333237 avr_isp: wp: "Write program memory page: 0x1c00"
333242-333561 avr_isp: prnb: "Poll RDY/nBSY: Busy" "Busy" "B"
335561-335869 avr_isp: prnb: "Poll RDY/nBSY: Busy" "Busy" "B"
337874-338192 avr_isp: prnb: "Poll RDY/nBSY: Busy" "Busy" "B"
340194-340512 avr_isp: prnb: "Poll RDY/nBSY: Busy" "Busy" "B"
342514-342842 avr_isp: prnb: "Poll RDY/nBSY: Ready" "Ready" "R"
342834-343140 avr_isp: lpmp: "Load program memory page Low: [0x000]: 0x3f" "[000L]=3f" "3f"
343143-343460 avr_isp: lpmp: "Load program memory page High: [0x000]: 0x93" "[000H]=93" "93"
343458-343770 avr_isp: lpmp: "Load program memory page Low: [0x001]: 0x8f" "[001L]=8f" "8f"
343770-344094 avr_isp: lpmp: "Load program memory page High: [0x001]: 0x93" "[001H]=93" "93"
344092-344407 avr_isp: lpmp: "Load program memory page Low: [0x002]: 0x9f" "[002L]=9f" "9f"
344409-344729 avr_isp: lpmp: "Load program memory page High: [0x002]: 0x93" "[002H]=93" "93"
344731-345048 avr_isp: lpmp: "Load program memory page Low: [0x003]: 0xef" "[003L]=ef" "ef"
345049-345364 avr_isp: lpmp: "Load program memory page High: [0x003]: 0x93" "[003H]=93" "93"
345363-345677 avr_isp: lpmp: "Load program memory page Low: [0x004]: 0xff" "[004L]=ff" "ff"
345679-345996 avr_isp: lpmp: "Load program memory page High: [0x004]: 0x93" "[004H]=93" "93"
345995-346309 avr_isp: lpmp: "Load program memory page Low: [0x005]: 0x8e" "[005L]=8e" "8e"
346312-346628 avr_isp: lpmp: "Load program memory page High: [0x005]: 0xb5" "[005H]=b5" "b5"
346627-346944 avr_isp: lpmp: "Load program memory page Low: [0x006]: 0x90" "[006L]=90" "90"
346945-347261 avr_isp: lpmp: "Load program memory page High: [0x006]: 0x91" "[006H]=91" "91"
347264-347575 avr_isp: lpmp: "Load program memory page Low: [0x007]: 0x20" "[007L]=20" "20"
347576-347893 avr_isp: lpmp: "Load program memory page High: [0x007]: 0x01" "[007H]=01" "01"
347891-348206 avr_isp: lpmp: "Load program memory page Low: [0x008]: 0x91" "[008L]=91" "91"
348210-348518 avr_isp: lpmp: "Load program memory page High: [0x008]: 0x11" "[008H]=11" "11"
348520-348839 avr_isp: lpmp: "Load program memory page Low: [0x009]: 0x15" "[009L]=15" "15"
348840-349158 avr_isp: lpmp: "Load program memory page High: [0x009]: 0xc0" "[009H]=c0" "c0"
349161-349470 avr_isp: lpmp: "Load program memory page Low: [0x00a]: 0x84" "[00aL]=84" "84"
349473-349789 avr_isp: lpmp: "Load program memory page High: [0x00a]: 0x35" "[00aH]=35" "35"
349788-350111 avr_isp: lpmp: "Load program memory page Low: [0x00b]: 0x99" "[00bL]=99" "99"
350111-350429 avr_isp: lpmp: "Load program memory page High: [0x00b]: 0xf4" "[00bH]=f4" "f4"
350428-350734 avr_isp: lpmp: "Load program memory page Low: [0x00c]: 0x22" "[00cL]=22" "22"
350735-351058 avr_isp: lpmp: "Load program memory page High: [0x00c]: 0xe2" "[00cH]=e2" "e2"
351061-351369 avr_isp: lpmp: "Load program memory page Low: [0x00d]: 0x31" "[00dL]=31" "31"
351370-351686 avr_isp: lpmp: "Load program memory page High: [0x00d]: 0xe0" "[00dH]=e0" "e0"
351687-351993 avr_isp: lpmp: "Load program memory page Low: [0x00e]: 0x30" "[00eL]=30" "30"
351994-352314 avr_isp: lpmp: "Load program memory page High: [0x00e]: 0x93" "[00eH]=93" "93"
352312-352624 avr_isp: lpmp: "Load program memory page Low: [0x00f]: 0x24" "[00fL]=24" "24"
352622-352950 avr_isp: lpmp: "Load program memory page High: [0x00f]: 0x01" "[00fH]=01" "01"
352949-353264 avr_isp: lpmp: "Load program memory page Low: [0x010]: 0x20" "[010L]=20" "20"
353263-353567 avr_isp: lpmp: "Load program memory page High: [0x010]: 0x93" "[010H]=93" "93"
353569-353886 avr_isp: lpmp: "Load program memory page Low: [0x011]: 0x23" "[011L]=23" "23"
353885-354189 avr_isp: lpmp: "Load program memory page High: [0x011]: 0x01" "[011H]=01" "01"
354192-354498 avr_isp: lpmp: "Load program memory page Low: [0x012]: 0x90" "[012L]=90" "90"
354499-354811 avr_isp: lpmp: "Load program memory page High: [0x012]: 0x91" "[012H]=91" "91"
354823-355143 avr_isp: lpmp: "Load program memory page Low: [0x013]: 0x22" "[013L]=22" "22"
355144-355465 avr_isp: lpmp: "Load program memory page High: [0x013]: 0x01" "[013H]=01" "01"
355468-355784 avr_isp: lpmp: "Load program memory page Low: [0x014]: 0x91" "[014L]=91" "91"
355783-356107 avr_isp: lpmp: "Load program memory page High: [0x014]: 0x60" "[014H]=60" "60"
356105-356429 avr_isp: lpmp: "Load program memory page Low: [0x015]: 0x90" "[015L]=90" "90"
356427-356739 avr_isp: lpmp: "Load program memory page High: [0x015]: 0x93" "[015H]=93" "93"
356737-357054 avr_isp: lpmp: "Load program memory page Low: [0x016]: 0x22" "[016L]=22" "22"
357055-357360 avr_isp: lpmp: "Load program memory page High: [0x016]: 0x01" "[016H]=01" "01"
357362-357680 avr_isp: lpmp: "Load program memory page Low: [0x017]: 0x90" "[017L]=90" "90"
357679-358001 avr_isp: lpmp: "Load program memory page High: [0x017]: 0x91" "[017H]=91" "91"
358000-358316 avr_isp: lpmp: "Load program memory page Low: [0x018]: 0x22" "[018L]=22" "22"
358318-358635 avr_isp: lpmp: "Load program memory page High: [0x018]: 0x01" "[018H]=01" "01"
358634-358952 avr_isp: lpmp: "Load program memory page Low: [0x019]: 0x92" "[019L]=92" "92"
358955-359270 avr_isp: lpmp: "Load program memory page High: [0x019]: 0x60" "[019H]=60" "60"
359270-359578 avr_isp: lpmp: "Load program memory page Low: [0x01a]: 0x90" "[01aL]=90" "90"
359577-359898 avr_isp: lpmp: "Load program memory page High: [0x01a]: 0x93" "[01aH]=93" "93"
359896-360206 avr_isp: lpmp: "Load program memory page Low: [0x01b]: 0x22" "[01bL]=22" "22"
360207-360522 avr_isp: lpmp: "Load program memory page High: [0x01b]: 0x01" "[01bH]=01" "01"
360523-360843 avr_isp: lpmp: "Load program memory page Low: [0x01c]: 0x91" "[01cL]=91" "91"
360846-361165 avr_isp: lpmp: "Load program memory page High: [0x01c]: 0xe0" "[01cH]=e0" "e0"
361166-361488 avr_isp: lpmp: "Load program memory page Low: [0x01d]: 0x90" "[01dL]=90" "90"
361487-361801 avr_isp: lpmp: "Load program memory page High: [0x01d]: 0x93" "[01dH]=93" "93"
361803-362120 avr_isp: lpmp: "Load program memory page Low: [0x01e]: 0x1f" "[01eL]=1f" "1f"
362118-362433 avr_isp: lpmp: "Load program memory page High: [0x01e]: 0x01" "[01eH]=01" "01"
362436-362752 avr_isp: lpmp: "Load program memory page Low: [0x01f]: 0x90" "[01fL]=90" "90"
362751-363066 avr_isp: lpmp: "Load program memory page High: [0x01f]: 0x91" "[01fH]=91" "91"
363116-363427 avr_isp: wp: "Write program memory page: 0x08"
363435-363747 avr_isp: prnb: "Poll RDY/nBSY: Busy" "Busy" "B"
365747-366065 avr_isp: prnb: "Poll RDY/nBSY: Busy" "Busy" "B"
368064-368380 avr_isp: prnb: "Poll RDY/nBSY: Busy" "Busy" "B"
370381-370701 avr_isp: prnb: "Poll RDY/nBSY: Busy" "Busy" "B"
372704-373031 avr_isp: prnb: "Poll RDY/nBSY: Ready" "Ready" "R"
373030-373347 avr_isp: lpmp: "Load program memory page Low: [0x000]: 0x1f" "[000L]=1f" "1f"
373347-373660 avr_isp: lpmp: "Load program memory page High: [0x000]: 0x01" "[000H]=01" "01"
373661-373986 avr_isp: lpmp: "Load program memory page Low: [0x001]: 0x99" "[001L]=99" "99"
373988-374305 avr_isp: lpmp: "Load program memory page High: [0x001]: 0x23" "[001H]=23" "23"
374303-374611 avr_isp: lpmp: "Load program memory page Low: [0x002]: 0xb1" "[002L]=b1" "b1"
374612-374932 avr_isp: lpmp: "Load program memory page High: [0x002]: 0xf0" "[002H]=f0" "f0"
374932-375248 avr_isp: lpmp: "Load program memory page Low: [0x003]: 0xe0" "[003L]=e0" "e0"
375251-375570 avr_isp: lpmp: "Load program memory page High: [0x003]: 0x91" "[003H]=91" "91"
375573-375882 avr_isp: lpmp: "Load program memory page Low: [0x004]: 0x23" "[004L]=23" "23"
375885-376198 avr_isp: lpmp: "Load program memory page High: [0x004]: 0x01" "[004H]=01" "01"
376198-376508 avr_isp: lpmp: "Load program memory page Low: [0x005]: 0xf0" "[005L]=f0" "f0"
376509-376846 avr_isp: lpmp: "Load program memory page High: [0x005]: 0x91" "[005H]=91" "91"
376837-377154 avr_isp: lpmp: "Load program memory page Low: [0x006]: 0x24" "[006L]=24" "24"
377152-377466 avr_isp: lpmp: "Load program memory page High: [0x006]: 0x01" "[006H]=01" "01"
377464-377780 avr_isp: lpmp: "Load program memory page Low: [0x007]: 0x90" "[007L]=90" "90"
377776-378087 avr_isp: lpmp: "Load program memory page High: [0x007]: 0x81" "[007H]=81" "81"
378088-378398 avr_isp: lpmp: "Load program memory page Low: [0x008]: 0x9e" "[008L]=9e" "9e"
378397-378711 avr_isp: lpmp: "Load program memory page High: [0x008]: 0xbd" "[008H]=bd" "bd"
378713-379037 avr_isp: lpmp: "Load program memory page Low: [0x009]: 0x20" "[009L]=20" "20"
379037-379353 avr_isp: lpmp: "Load program memory page High: [0x009]: 0x91" "[009H]=91" "91"
379355-379672 avr_isp: lpmp: "Load program memory page Low: [0x00a]: 0x23" "[00aL]=23" "23"
379671-379984 avr_isp: lpmp: "Load program memory page High: [0x00a]: 0x01" "[00aH]=01" "01"
379983-380294 avr_isp: lpmp: "Load program memory page Low: [0x00b]: 0x30" "[00bL]=30" "30"
380296-380617 avr_isp: lpmp: "Load program memory page High: [0x00b]: 0x91" "[00bH]=91" "91"
380620-380940 avr_isp: lpmp: "Load program memory page Low: [0x00c]: 0x24" "[00cL]=24" "24"
380939-381257 avr_isp: lpmp: "Load program memory page High: [0x00c]: 0x01" "[00cH]=01" "01"
381255-381563 avr_isp: lpmp: "Load program memory page Low: [0x00d]: 0x2f" "[00dL]=2f" "2f"
381563-381873 avr_isp: lpmp: "Load program memory page High: [0x00d]: 0x5f" "[00dH]=5f" "5f"
381873-382195 avr_isp: lpmp: "Load program memory page Low: [0x00e]: 0x3f" "[00eL]=3f" "3f"
382195-382508 avr_isp: lpmp: "Load program memory page High: [0x00e]: 0x4f" "[00eH]=4f" "4f"
382510-382811 avr_isp: lpmp: "Load program memory page Low: [0x00f]: 0x30" "[00fL]=30" "30"
382812-383131 avr_isp: lpmp: "Load program memory page High: [0x00f]: 0x93" "[00fH]=93" "93"
383128-383444 avr_isp: lpmp: "Load program memory page Low: [0x010]: 0x24" "[010L]=24" "24"
383445-383768 avr_isp: lpmp: "Load program memory page High: [0x010]: 0x01" "[010H]=01" "01"
383771-384080 avr_isp: lpmp: "Load program memory page Low: [0x011]: 0x20" "[011L]=20" "20"
384083-384402 avr_isp: lpmp: "Load program memory page High: [0x011]: 0x93" "[011H]=93" "93"
384405-384711 avr_isp: lpmp: "Load program memory page Low: [0x012]: 0x23" "[012L]=23" "23"
384712-385030 avr_isp: lpmp: "Load program memory page High: [0x012]: 0x01" "[012H]=01" "01"
385033-385351 avr_isp: lpmp: "Load program memory page Low: [0x013]: 0x90" "[013L]=90" "90"
385350-385666 avr_isp: lpmp: "Load program memory page High: [0x013]: 0x91" "[013H]=91" "91"
385667-385975 avr_isp: lpmp: "Load program memory page Low: [0x014]: 0x1f" "[014L]=1f" "1f"
385977-386287 avr_isp: lpmp: "Load program memory page High: [0x014]: 0x01" "[014H]=01" "01"
386289-386606 avr_isp: lpmp: "Load program memory page Low: [0x015]: 0x91" "[015L]=91" "91"
386604-386921 avr_isp: lpmp: "Load program memory page High: [0x015]: 0x50" "[015H]=50" "50"
386924-387247 avr_isp: lpmp: "Load program memory page Low: [0x016]: 0x90" "[016L]=90" "90"
387249-387569 avr_isp: lpmp: "Load program memory page High: [0x016]: 0x93" "[016H]=93" "93"
387571-387886 avr_isp: lpmp: "Load program memory page Low: [0x017]: 0x1f" "[017L]=1f" "1f"
387885-388194 avr_isp: lpmp: "Load program memory page High: [0x017]: 0x01" "[017H]=01" "01"
388193-388513 avr_isp: lpmp: "Load program memory page Low: [0x018]: 0x01" "[018L]=01" "01"
388515-388850 avr_isp: lpmp: "Load program memory page High: [0x018]: 0xc0" "[018H]=c0" "c0"
388840-389151 avr_isp: lpmp: "Load program memory page Low: [0x019]: 0x1e" "[019L]=1e" "1e"
389154-389470 avr_isp: lpmp: "Load program memory page High: [0x019]: 0xbc" "[019H]=bc" "bc"
389469-389777 avr_isp: lpmp: "Load program memory page Low: [0x01a]: 0x90" "[01aL]=90" "90"
389778-390085 avr_isp: lpmp: "Load program memory page High: [0x01a]: 0x91" "[01aH]=91" "91"
390086-390405 avr_isp: lpmp: "Load program memory page Low: [0x01b]: 0x20" "[01bL]=20" "20"
390411-390727 avr_isp: lpmp: "Load program memory page High: [0x01b]: 0x01" "[01bH]=01" "01"
390728-391047 avr_isp: lpmp: "Load program memory page Low: [0x01c]: 0x99" "[01cL]=99" "99"
391046-391371 avr_isp: lpmp: "Load program memory page High: [0x01c]: 0x32" "[01cH]=32" "32"
391369-391684 avr_isp: lpmp: "Load program memory page Low: [0x01d]: 0x58" "[01dL]=58" "58"
391686-391992 avr_isp: lpmp: "Load program memory page High: [0x01d]: 0xf4" "[01dH]=f4" "f4"
391993-392316 avr_isp: lpmp: "Load program memory page Low: [0x01e]: 0xe0" "[01eL]=e0" "e0"
392319-392623 avr_isp: lpmp: "Load program memory page High: [0x01e]: 0x91" "[01eH]=91" "91"
392624-392940 avr_isp: lpmp: "Load program memory page Low: [0x01f]: 0x20" "[01fL]=20" "20"
392945-393266 avr_isp: lpmp: "Load program memory page High: [0x01f]: 0x01" "[01fH]=01" "01"
393321-393632 avr_isp: wp: "Write program memory page: 0x408"
393635-393960 avr_isp: prnb: "Poll RDY/nBSY: Busy" "Busy" "B"
395960-396275 avr_isp: prnb: "Poll RDY/nBSY: Busy" "Busy" "B"
398279-398603 avr_isp: prnb: "Poll RDY/nBSY: Busy" "Busy" "B"
400604-400925 avr_isp: prnb: "Poll RDY/nBSY: Busy" "Busy" "B"
402927-403246 avr_isp: prnb: "Poll RDY/nBSY: Ready" "Ready" "R"
403245-403558 avr_isp: lpmp: "Load program memory page Low: [0x000]: 0xf0" "[000L]=f0" "f0"
403556-403882 avr_isp: lpmp: "Load program memory page High: [0x000]: 0xe0" "[000H]=e0" "e0"
403880-404204 avr_isp: lpmp: "Load program memory page Low: [0x001]: 0xeb" "[001L]=eb" "eb"
404202-404514 avr_isp: lpmp: "Load program memory page High: [0x001]: 0x5d" "[001H]=5d" "5d"
404513-404824 avr_isp: lpmp: "Load program memory page Low: [0x002]: 0xfe" "[002L]=fe" "fe"
404831-405149 avr_isp: lpmp: "Load program memory page High: [0x002]: 0x4f" "[002H]=4f" "4f"
405152-405468 avr_isp: lpmp: "Load program memory page Low: [0x003]: 0x80" "[003L]=80" "80"
405467-405773 avr_isp: lpmp: "Load program memory page High: [0x003]: 0x83" "[003H]=83" "83"
405776-406094 avr_isp: lpmp: "Load program memory page Low: [0x004]: 0x80" "[004L]=80" "80"
406093-406406 avr_isp: lpmp: "Load program memory page High: [0x004]: 0x91" "[004H]=91" "91"
406405-406713 avr_isp: lpmp: "Load program memory page Low: [0x005]: 0x20" "[005L]=20" "20"
406714-407037 avr_isp: lpmp: "Load program memory page High: [0x005]: 0x01" "[005H]=01" "01"
407038-407348 avr_isp: lpmp: "Load program memory page Low: [0x006]: 0x8f" "[006L]=8f" "8f"
407350-407658 avr_isp: lpmp: "Load program memory page High: [0x006]: 0x5f" "[006H]=5f" "5f"
407660-407966 avr_isp: lpmp: "Load program memory page Low: [0x007]: 0x80" "[007L]=80" "80"
407967-408289 avr_isp: lpmp: "Load program memory page High: [0x007]: 0x93" "[007H]=93" "93"
408287-408602 avr_isp: lpmp: "Load program memory page Low: [0x008]: 0x20" "[008L]=20" "20"
408601-408929 avr_isp: lpmp: "Load program memory page High: [0x008]: 0x01" "[008H]=01" "01"
408926-409240 avr_isp: lpmp: "Load program memory page Low: [0x009]: 0xff" "[009L]=ff" "ff"
409242-409559 avr_isp: lpmp: "Load program memory page High: [0x009]: 0x91" "[009H]=91" "91"
409558-409872 avr_isp: lpmp: "Load program memory page Low: [0x00a]: 0xef" "[00aL]=ef" "ef"
409875-410195 avr_isp: lpmp: "Load program memory page High: [0x00a]: 0x91" "[00aH]=91" "91"
410192-410513 avr_isp: lpmp: "Load program memory page Low: [0x00b]: 0x9f" "[00bL]=9f" "9f"
410517-410850 avr_isp: lpmp: "Load program memory page High: [0x00b]: 0x91" "[00bH]=91" "91"
410845-411139 avr_isp: lpmp: "Load program memory page Low: [0x00c]: 0x8f" "[00cL]=8f" "8f"
411139-411429 avr_isp: lpmp: "Load program memory page High: [0x00c]: 0x91" "[00cH]=91" "91"
411430-411719 avr_isp: lpmp: "Load program memory page Low: [0x00d]: 0x3f" "[00dL]=3f" "3f"
411720-412046 avr_isp: lpmp: "Load program memory page High: [0x00d]: 0x91" "[00dH]=91" "91"
412047-412362 avr_isp: lpmp: "Load program memory page Low: [0x00e]: 0x2f" "[00eL]=2f" "2f"
412362-412688 avr_isp: lpmp: "Load program memory page High: [0x00e]: 0x91" "[00eH]=91" "91"
412684-413001 avr_isp: lpmp: "Load program memory page Low: [0x00f]: 0x0f" "[00fL]=0f" "0f"
413004-413318 avr_isp: lpmp: "Load program memory page High: [0x00f]: 0x90" "[00fH]=90" "90"
413319-413632 avr_isp: lpmp: "Load program memory page Low: [0x010]: 0x0f" "[010L]=0f" "0f"
413633-413947 avr_isp: lpmp: "Load program memory page High: [0x010]: 0xbe" "[010H]=be" "be"
413950-414256 avr_isp: lpmp: "Load program memory page Low: [0x011]: 0x0f" "[011L]=0f" "0f"
414255-414578 avr_isp: lpmp: "Load program memory page High: [0x011]: 0x90" "[011H]=90" "90"
414577-414890 avr_isp: lpmp: "Load program memory page Low: [0x012]: 0x1f" "[012L]=1f" "1f"
414891-415218 avr_isp: lpmp: "Load program memory page High: [0x012]: 0x90" "[012H]=90" "90"
415217-415541 avr_isp: lpmp: "Load program memory page Low: [0x013]: 0x18" "[013L]=18" "18"
415539-415851 avr_isp: lpmp: "Load program memory page High: [0x013]: 0x95" "[013H]=95" "95"
415849-416161 avr_isp: lpmp: "Load program memory page Low: [0x014]: 0x1f" "[014L]=1f" "1f"
416161-416487 avr_isp: lpmp: "Load program memory page High: [0x014]: 0x92" "[014H]=92" "92"
416483-416811 avr_isp: lpmp: "Load program memory page Low: [0x015]: 0x0f" "[015L]=0f" "0f"
416810-417136 avr_isp: lpmp: "Load program memory page High: [0x015]: 0x92" "[015H]=92" "92"
417139-417469 avr_isp: lpmp: "Load program memory page Low: [0x016]: 0x0f" "[016L]=0f" "0f"
417467-417780 avr_isp: lpmp: "Load program memory page High: [0x016]: 0xb6" "[016H]=b6" "b6"
417783-418090 avr_isp: lpmp: "Load program memory page Low: [0x017]: 0x0f" "[017L]=0f" "0f"
418093-418400 avr_isp: lpmp: "Load program memory page High: [0x017]: 0x92" "[017H]=92" "92"
418405-418721 avr_isp: lpmp: "Load program memory page Low: [0x018]: 0x11" "[018L]=11" "11"
418720-419036 avr_isp: lpmp: "Load program memory page High: [0x018]: 0x24" "[018H]=24" "24"
419039-419360 avr_isp: lpmp: "Load program memory page Low: [0x019]: 0x8f" "[019L]=8f" "8f"
419363-419678 avr_isp: lpmp: "Load program memory page High: [0x019]: 0x93" "[019H]=93" "93"
419678-419992 avr_isp: lpmp: "Load program memory page Low: [0x01a]: 0x1a" "[01aL]=1a" "1a"
419990-420303 avr_isp: lpmp: "Load program memory page High: [0x01a]: 0x9b" "[01aH]=9b" "9b"
420305-420612 avr_isp: lpmp: "Load program memory page Low: [0x01b]: 0x08" "[01bL]=08" "08"
420612-420938 avr_isp: lpmp: "Load program memory page High: [0x01b]: 0xc0" "[01bH]=c0" "c0"
420937-421254 avr_isp: lpmp: "Load program memory page Low: [0x01c]: 0x80" "[01cL]=80" "80"
421252-421578 avr_isp: lpmp: "Load program memory page High: [0x01c]: 0x91" "[01cH]=91" "91"
421574-421884 avr_isp: lpmp: "Load program memory page Low: [0x01d]: 0x1e" "[01dL]=1e" "1e"
421883-422196 avr_isp: lpmp: "Load program memory page High: [0x01d]: 0x01" "[01dH]=01" "01"
422195-422511 avr_isp: lpmp: "Load program memory page Low: [0x01e]: 0x82" "[01eL]=82" "82"
422512-422828 avr_isp: lpmp: "Load program memory page High: [0x01e]: 0x60" "[01eH]=60" "60"
422837-423152 avr_isp: lpmp: "Load program memory page Low: [0x01f]: 0x80" "[01fL]=80" "80"
423151-423455 avr_isp: lpmp: "Load program memory page High: [0x01f]: 0x93" "[01fH]=93" "93"
423509-423830 avr_isp: wp: "Write program memory page: 0x808"
423833-424153 avr_isp: prnb: "Poll RDY/nBSY: Busy" "Busy" "B"
426155-426481 avr_isp: prnb: "Poll RDY/nBSY: Busy" "Busy" "B"
428480-428800 avr_isp: prnb: "Poll RDY/nBSY: Busy" "Busy" "B"
430802-431119 avr_isp: prnb: "Poll RDY/nBSY: Busy" "Busy" "B"
433123-433433 avr_isp: prnb: "Poll RDY/nBSY: Ready" "Ready" "R"
433434-433753 avr_isp: lpmp: "Load program memory page Low: [0x000]: 0x1e" "[000L]=1e" "1e"
433751-434065 avr_isp: lpmp: "Load program memory page High: [0x000]: 0x01" "[000H]=01" "01"
434064-434368 avr_isp: lpmp: "Load program memory page Low: [0x001]: 0x10" "[001L]=10" "10"
434372-434689 avr_isp: lpmp: "Load program memory page High: [0x001]: 0x92" "[001H]=92" "92"
434688-435004 avr_isp: lpmp: "Load program memory page Low: [0x002]: 0x1f" "[002L]=1f" "1f"
435007-435327 avr_isp: lpmp: "Load program memory page High: [0x002]: 0x01" "[002H]=01" "01"
435326-435647 avr_isp: lpmp: "Load program memory page Low: [0x003]: 0x02" "[003L]=02" "02"
435648-435956 avr_isp: lpmp: "Load program memory page High: [0x003]: 0xc0" "[003H]=c0" "c0"
435957-436273 avr_isp: lpmp: "Load program memory page Low: [0x004]: 0x10" "[004L]=10" "10"
436272-436595 avr_isp: lpmp: "Load program memory page High: [0x004]: 0x92" "[004H]=92" "92"
436594-436913 avr_isp: lpmp: "Load program memory page Low: [0x005]: 0x20" "[005L]=20" "20"
436914-437230 avr_isp: lpmp: "Load program memory page High: [0x005]: 0x01" "[005H]=01" "01"
437231-437539 avr_isp: lpmp: "Load program memory page Low: [0x006]: 0x8f" "[006L]=8f" "8f"
437541-437847 avr_isp: lpmp: "Load program memory page High: [0x006]: 0x91" "[006H]=91" "91"
437848-438161 avr_isp: lpmp: "Load program memory page Low: [0x007]: 0x0f" "[007L]=0f" "0f"
438163-438481 avr_isp: lpmp: "Load program memory page High: [0x007]: 0x90" "[007H]=90" "90"
438480-438804 avr_isp: lpmp: "Load program memory page Low: [0x008]: 0x0f" "[008L]=0f" "0f"
438802-439126 avr_isp: lpmp: "Load program memory page High: [0x008]: 0xbe" "[008H]=be" "be"
439125-439438 avr_isp: lpmp: "Load program memory page Low: [0x009]: 0x0f" "[009L]=0f" "0f"
439439-439762 avr_isp: lpmp: "Load program memory page High: [0x009]: 0x90" "[009H]=90" "90"
439761-440075 avr_isp: lpmp: "Load program memory page Low: [0x00a]: 0x1f" "[00aL]=1f" "1f"
440078-440397 avr_isp: lpmp: "Load program memory page High: [0x00a]: 0x90" "[00aH]=90" "90"
440395-440709 avr_isp: lpmp: "Load program memory page Low: [0x00b]: 0x18" "[00bL]=18" "18"
440713-441031 avr_isp: lpmp: "Load program memory page High: [0x00b]: 0x95" "[00bH]=95" "95"
441029-441346 avr_isp: lpmp: "Load program memory page Low: [0x00c]: 0x88" "[00cL]=88" "88"
441350-441659 avr_isp: lpmp: "Load program memory page High: [0x00c]: 0xe1" "[00cH]=e1" "e1"
441660-441975 avr_isp: lpmp: "Load program memory page Low: [0x00d]: 0x9e" "[00dL]=9e" "9e"
441973-442288 avr_isp: lpmp: "Load program memory page High: [0x00d]: 0xe0" "[00dH]=e0" "e0"
442289-442609 avr_isp: lpmp: "Load program memory page Low: [0x00e]: 0x0f" "[00eL]=0f" "0f"
442607-442924 avr_isp: lpmp: "Load program memory page High: [0x00e]: 0xb6" "[00eH]=b6" "b6"
442927-443245 avr_isp: lpmp: "Load program memory page Low: [0x00f]: 0xf8" "[00fL]=f8" "f8"
443244-443558 avr_isp: lpmp: "Load program memory page High: [0x00f]: 0x94" "[00fH]=94" "94"
443561-443879 avr_isp: lpmp: "Load program memory page Low: [0x010]: 0xa8" "[010L]=a8" "a8"
443878-444201 avr_isp: lpmp: "Load program memory page High: [0x010]: 0x95" "[010H]=95" "95"
444200-444527 avr_isp: lpmp: "Load program memory page Low: [0x011]: 0x80" "[011L]=80" "80"
444524-444835 avr_isp: lpmp: "Load program memory page High: [0x011]: 0x93" "[011H]=93" "93"
444845-445156 avr_isp: lpmp: "Load program memory page Low: [0x012]: 0x60" "[012L]=60" "60"
445159-445472 avr_isp: lpmp: "Load program memory page High: [0x012]: 0x00" "[012H]=00" "00"
445473-445780 avr_isp: lpmp: "Load program memory page Low: [0x013]: 0x0f" "[013L]=0f" "0f"
445781-446099 avr_isp: lpmp: "Load program memory page High: [0x013]: 0xbe" "[013H]=be" "be"
446101-446411 avr_isp: lpmp: "Load program memory page Low: [0x014]: 0x90" "[014L]=90" "90"
446413-446733 avr_isp: lpmp: "Load program memory page High: [0x014]: 0x93" "[014H]=93" "93"
446735-447053 avr_isp: lpmp: "Load program memory page Low: [0x015]: 0x60" "[015L]=60" "60"
447056-447372 avr_isp: lpmp: "Load program memory page High: [0x015]: 0x00" "[015H]=00" "00"
447373-447689 avr_isp: lpmp: "Load program memory page Low: [0x016]: 0xe4" "[016L]=e4" "e4"
447690-447997 avr_isp: lpmp: "Load program memory page High: [0x016]: 0xe6" "[016H]=e6" "e6"
448000-448316 avr_isp: lpmp: "Load program memory page Low: [0x017]: 0xf0" "[017L]=f0" "f0"
448315-448619 avr_isp: lpmp: "Load program memory page High: [0x017]: 0xe0" "[017H]=e0" "e0"
448622-448945 avr_isp: lpmp: "Load program memory page Low: [0x018]: 0x80" "[018L]=80" "80"
448948-449259 avr_isp: lpmp: "Load program memory page High: [0x018]: 0x81" "[018H]=81" "81"
449262-449576 avr_isp: lpmp: "Load program memory page Low: [0x019]: 0x8f" "[019L]=8f" "8f"
449577-449891 avr_isp: lpmp: "Load program memory page High: [0x019]: 0x6e" "[019H]=6e" "6e"
449894-450205 avr_isp: lpmp: "Load program memory page Low: [0x01a]: 0x80" "[01aL]=80" "80"
450206-450523 avr_isp: lpmp: "Load program memory page High: [0x01a]: 0x83" "[01aH]=83" "83"
450521-450833 avr_isp: lpmp: "Load program memory page Low: [0x01b]: 0x80" "[01bL]=80" "80"
450833-451163 avr_isp: lpmp: "Load program memory page High: [0x01b]: 0xe8" "[01bH]=e8" "e8"
451162-451470 avr_isp: lpmp: "Load program memory page Low: [0x01c]: 0x30" "[01cL]=30" "30"
451472-451790 avr_isp: lpmp: "Load program memory page High: [0x01c]: 0xe0" "[01cH]=e0" "e0"
451791-452111 avr_isp: lpmp: "Load program memory page Low: [0x01d]: 0x20" "[01dL]=20" "20"
452110-452424 avr_isp: lpmp: "Load program memory page High: [0x01d]: 0xe0" "[01dH]=e0" "e0"
452427-452731 avr_isp: lpmp: "Load program memory page Low: [0x01e]: 0x0f" "[01eL]=0f" "0f"
452730-453055 avr_isp: lpmp: "Load program memory page High: [0x01e]: 0xb6" "[01eH]=b6" "b6"
453054-453367 avr_isp: lpmp: "Load program memory page Low: [0x01f]: 0xf8" "[01fL]=f8" "f8"
453366-453682 avr_isp: lpmp: "Load program memory page High: [0x01f]: 0x94" "[01fH]=94" "94"
453734-454058 avr_isp: wp: "Write program memory page: 0xc08"
454060-454370 avr_isp: prnb: "Poll RDY/nBSY: Busy" "Busy" "B"
456373-456693 avr_isp: prnb: "Poll RDY/nBSY: Busy" "Busy" "B"
458697-459015 avr_isp: prnb: "Poll RDY/nBSY: Busy" "Busy" "B"
461017-461333 avr_isp: prnb: "Poll RDY/nBSY: Busy" "Busy" "B"
463332-463651 avr_isp: prnb: "Poll RDY/nBSY: Ready" "Ready" "R"
463654-463978 avr_isp: lpmp: "Load program memory page Low: [0x000]: 0x80" "[000L]=80" "80"
463974-464289 avr_isp: lpmp: "Load program memory page High: [0x000]: 0x93" "[000H]=93" "93"
464291-464612 avr_isp: lpmp: "Load program memory page Low: [0x001]: 0x61" "[001L]=61" "61"
464608-464927 avr_isp: lpmp: "Load program memory page High: [0x001]: 0x00" "[001H]=00" "00"
464928-465240 avr_isp: lpmp: "Load program memory page Low: [0x002]: 0x20" "[002L]=20" "20"
465240-465553 avr_isp: lpmp: "Load program memory page High: [0x002]: 0x93" "[002H]=93" "93"
465556-465862 avr_isp: lpmp: "Load program memory page Low: [0x003]: 0x61" "[003L]=61" "61"
465863-466174 avr_isp: lpmp: "Load program memory page High: [0x003]: 0x00" "[003H]=00" "00"
466173-466489 avr_isp: lpmp: "Load program memory page Low: [0x004]: 0x0f" "[004L]=0f" "0f"
466490-466806 avr_isp: lpmp: "Load program memory page High: [0x004]: 0xbe" "[004H]=be" "be"
466805-467120 avr_isp: lpmp: "Load program memory page Low: [0x005]: 0x4d" "[005L]=4d" "4d"
467121-467445 avr_isp: lpmp: "Load program memory page High: [0x005]: 0xdf" "[005H]=df" "df"
467443-467758 avr_isp: lpmp: "Load program memory page Low: [0x006]: 0xaf" "[006L]=af" "af"
467760-468077 avr_isp: lpmp: "Load program memory page High: [0x006]: 0xde" "[006H]=de" "de"
468075-468393 avr_isp: lpmp: "Load program memory page Low: [0x007]: 0xbd" "[007L]=bd" "bd"
468394-468712 avr_isp: lpmp: "Load program memory page High: [0x007]: 0xd0" "[007H]=d0" "d0"
468714-469026 avr_isp: lpmp: "Load program memory page Low: [0x008]: 0x73" "[008L]=73" "73"
469029-469352 avr_isp: lpmp: "Load program memory page High: [0x008]: 0xd0" "[008H]=d0" "d0"
469355-469683 avr_isp: lpmp: "Load program memory page Low: [0x009]: 0x55" "[009L]=55" "55"
469682-470003 avr_isp: lpmp: "Load program memory page High: [0x009]: 0xdf" "[009H]=df" "df"
470002-470313 avr_isp: lpmp: "Load program memory page Low: [0x00a]: 0xfe" "[00aL]=fe" "fe"
470312-470632 avr_isp: lpmp: "Load program memory page High: [0x00a]: 0xde" "[00aH]=de" "de"
470632-470968 avr_isp: lpmp: "Load program memory page Low: [0x00b]: 0x80" "[00bL]=80" "80"
470970-471285 avr_isp: lpmp: "Load program memory page High: [0x00b]: 0xe0" "[00bH]=e0" "e0"
471286-471609 avr_isp: lpmp: "Load program memory page Low: [0x00c]: 0x91" "[00cL]=91" "91"
471611-471927 avr_isp: lpmp: "Load program memory page High: [0x00c]: 0xe0" "[00cH]=e0" "e0"
471928-472241 avr_isp: lpmp: "Load program memory page Low: [0x00d]: 0x39" "[00dL]=39" "39"
472243-472560 avr_isp: lpmp: "Load program memory page High: [0x00d]: 0xdf" "[00dH]=df" "df"
472558-472878 avr_isp: lpmp: "Load program memory page Low: [0x00e]: 0x61" "[00eL]=61" "61"
472880-473191 avr_isp: lpmp: "Load program memory page High: [0x00e]: 0xe0" "[00eH]=e0" "e0"
473193-473506 avr_isp: lpmp: "Load program memory page Low: [0x00f]: 0x80" "[00fL]=80" "80"
473505-473821 avr_isp: lpmp: "Load program memory page High: [0x00f]: 0xe0" "[00fH]=e0" "e0"
473822-474145 avr_isp: lpmp: "Load program memory page Low: [0x010]: 0x2e" "[010L]=2e" "2e"
474148-474455 avr_isp: lpmp: "Load program memory page High: [0x010]: 0xdf" "[010H]=df" "df"
474458-474777 avr_isp: lpmp: "Load program memory page Low: [0x011]: 0x83" "[011L]=83" "83"
474775-475099 avr_isp: lpmp: "Load program memory page High: [0x011]: 0xe1" "[011H]=e1" "e1"
475100-475419 avr_isp: lpmp: "Load program memory page Low: [0x012]: 0x91" "[012L]=91" "91"
475420-475736 avr_isp: lpmp: "Load program memory page High: [0x012]: 0xe0" "[012H]=e0" "e0"
475737-476050 avr_isp: lpmp: "Load program memory page Low: [0x013]: 0x33" "[013L]=33" "33"
476052-476367 avr_isp: lpmp: "Load program memory page High: [0x013]: 0xdf" "[013H]=df" "df"
476367-476682 avr_isp: lpmp: "Load program memory page Low: [0x014]: 0x78" "[014L]=78" "78"
476684-477017 avr_isp: lpmp: "Load program memory page High: [0x014]: 0x94" "[014H]=94" "94"
477016-477331 avr_isp: lpmp: "Load program memory page Low: [0x015]: 0x08" "[015L]=08" "08"
477330-477653 avr_isp: lpmp: "Load program memory page High: [0x015]: 0x95" "[015H]=95" "95"
477652-477976 avr_isp: lpmp: "Load program memory page Low: [0x016]: 0xcf" "[016L]=cf" "cf"
477979-478286 avr_isp: lpmp: "Load program memory page High: [0x016]: 0x93" "[016H]=93" "93"
478289-478603 avr_isp: lpmp: "Load program memory page Low: [0x017]: 0xdf" "[017L]=df" "df"
478602-478929 avr_isp: lpmp: "Load program memory page High: [0x017]: 0x93" "[017H]=93" "93"
478928-479246 avr_isp: lpmp: "Load program memory page Low: [0x018]: 0xa8" "[018L]=a8" "a8"
479249-479570 avr_isp: lpmp: "Load program memory page High: [0x018]: 0x95" "[018H]=95" "95"
479571-479882 avr_isp: lpmp: "Load program memory page Low: [0x019]: 0x80" "[019L]=80" "80"
479883-480204 avr_isp: lpmp: "Load program memory page High: [0x019]: 0x91" "[019H]=91" "91"
480205-480513 avr_isp: lpmp: "Load program memory page Low: [0x01a]: 0x1e" "[01aL]=1e" "1e"
480515-480834 avr_isp: lpmp: "Load program memory page High: [0x01a]: 0x01" "[01aH]=01" "01"
480832-481160 avr_isp: lpmp: "Load program memory page Low: [0x01b]: 0x88" "[01bL]=88" "88"
481163-481476 avr_isp: lpmp: "Load program memory page High: [0x01b]: 0x23" "[01bH]=23" "23"
481474-481787 avr_isp: lpmp: "Load program memory page Low: [0x01c]: 0xe1" "[01cL]=e1" "e1"
481786-482099 avr_isp: lpmp: "Load program memory page High: [0x01c]: 0xf3" "[01cH]=f3" "f3"
482100-482418 avr_isp: lpmp: "Load program memory page Low: [0x01d]: 0x80" "[01dL]=80" "80"
482417-482728 avr_isp: lpmp: "Load program memory page High: [0x01d]: 0x91" "[01dH]=91" "91"
482729-483045 avr_isp: lpmp: "Load program memory page Low: [0x01e]: 0x1e" "[01eL]=1e" "1e"
483048-483363 avr_isp: lpmp: "Load program memory page High: [0x01e]: 0x01" "[01eH]=01" "01"
483363-483673 avr_isp: lpmp: "Load program memory page Low: [0x01f]: 0x80" "[01fL]=80" "80"
483674-483989 avr_isp: lpmp: "Load program memory page High: [0x01f]: 0xff" "[01fH]=ff" "ff"
484041-484355 avr_isp: wp: "Write program memory page: 0x1008"
484357-484675 avr_isp: prnb: "Poll RDY/nBSY: Busy" "Busy" "B"
486673-486992 avr_isp: prnb: "Poll RDY/nBSY: Busy" "Busy" "B"
488996-489313 avr_isp: prnb: "Poll RDY/nBSY: Busy" "Busy" "B"
491316-491641 avr_isp: prnb: "Poll RDY/nBSY: Busy" "Busy" "B"
493642-493960 avr_isp: prnb: "Poll RDY/nBSY: Ready" "Ready" "R"
493963-494276 avr_isp: lpmp: "Load program memory page Low: [0x000]: 0x05" "[000L]=05" "05"
494278-494595 avr_isp: lpmp: "Load program memory page High: [0x000]: 0xc0" "[000H]=c0" "c0"
494594-494910 avr_isp: lpmp: "Load program memory page Low: [0x001]: 0x80" "[001L]=80" "80"
494915-495237 avr_isp: lpmp: "Load program memory page High: [0x001]: 0x91" "[001H]=91" "91"
495234-495545 avr_isp: lpmp: "Load program memory page Low: [0x002]: 0x1e" "[002L]=1e" "1e"
495544-495860 avr_isp: lpmp: "Load program memory page High: [0x002]: 0x01" "[002H]=01" "01"
495863-496191 avr_isp: lpmp: "Load program memory page Low: [0x003]: 0x8e" "[003L]=8e" "8e"
496190-496511 avr_isp: lpmp: "Load program memory page High: [0x003]: 0x7f" "[003H]=7f" "7f"
496510-496824 avr_isp: lpmp: "Load program memory page Low: [0x004]: 0x80" "[004L]=80" "80"
496822-497152 avr_isp: lpmp: "Load program memory page High: [0x004]: 0x93" "[004H]=93" "93"
497150-497464 avr_isp: lpmp: "Load program memory page Low: [0x005]: 0x1e" "[005L]=1e" "1e"
497462-497775 avr_isp: lpmp: "Load program memory page High: [0x005]: 0x01" "[005H]=01" "01"
497776-498091 avr_isp: lpmp: "Load program memory page Low: [0x006]: 0x80" "[006L]=80" "80"
498093-498409 avr_isp: lpmp: "Load program memory page High: [0x006]: 0x91" "[006H]=91" "91"
498410-498723 avr_isp: lpmp: "Load program memory page Low: [0x007]: 0x1e" "[007L]=1e" "1e"
498725-499048 avr_isp: lpmp: "Load program memory page High: [0x007]: 0x01" "[007H]=01" "01"
499047-499362 avr_isp: lpmp: "Load program memory page Low: [0x008]: 0x81" "[008L]=81" "81"
499362-499682 avr_isp: lpmp: "Load program memory page High: [0x008]: 0xff" "[008H]=ff" "ff"
499681-499997 avr_isp: lpmp: "Load program memory page Low: [0x009]: 0x4c" "[009L]=4c" "4c"
499996-500316 avr_isp: lpmp: "Load program memory page High: [0x009]: 0xc0" "[009H]=c0" "c0"
500317-500628 avr_isp: lpmp: "Load program memory page Low: [0x00a]: 0x80" "[00aL]=80" "80"
500629-500953 avr_isp: lpmp: "Load program memory page High: [0x00a]: 0x91" "[00aH]=91" "91"
500954-501270 avr_isp: lpmp: "Load program memory page Low: [0x00b]: 0x1e" "[00bL]=1e" "1e"
501275-501599 avr_isp: lpmp: "Load program memory page High: [0x00b]: 0x01" "[00bH]=01" "01"
501597-501909 avr_isp: lpmp: "Load program memory page Low: [0x00c]: 0x8d" "[00cL]=8d" "8d"
501909-502231 avr_isp: lpmp: "Load program memory page High: [0x00c]: 0x7f" "[00cH]=7f" "7f"
502229-502553 avr_isp: lpmp: "Load program memory page Low: [0x00d]: 0x80" "[00dL]=80" "80"
502552-502881 avr_isp: lpmp: "Load program memory page High: [0x00d]: 0x93" "[00dH]=93" "93"
502873-503193 avr_isp: lpmp: "Load program memory page Low: [0x00e]: 0x1e" "[00eL]=1e" "1e"
503191-503505 avr_isp: lpmp: "Load program memory page High: [0x00e]: 0x01" "[00eH]=01" "01"
503504-503825 avr_isp: lpmp: "Load program memory page Low: [0x00f]: 0x27" "[00fL]=27" "27"
503824-504136 avr_isp: lpmp: "Load program memory page High: [0x00f]: 0xdf" "[00fH]=df" "df"
504139-504448 avr_isp: lpmp: "Load program memory page Low: [0x010]: 0x80" "[010L]=80" "80"
504446-504760 avr_isp: lpmp: "Load program memory page High: [0x010]: 0x91" "[010H]=91" "91"
504763-505088 avr_isp: lpmp: "Load program memory page Low: [0x011]: 0x25" "[011L]=25" "25"
505089-505409 avr_isp: lpmp: "Load program memory page High: [0x011]: 0x01" "[011H]=01" "01"
505408-505714 avr_isp: lpmp: "Load program memory page Low: [0x012]: 0x87" "[012L]=87" "87"
505715-506032 avr_isp: lpmp: "Load program memory page High: [0x012]: 0x35" "[012H]=35" "35"
506030-506346 avr_isp: lpmp: "Load program memory page Low: [0x013]: 0x09" "[013L]=09" "09"
506342-506655 avr_isp: lpmp: "Load program memory page High: [0x013]: 0xf0" "[013H]=f0" "f0"
506657-506975 avr_isp: lpmp: "Load program memory page Low: [0x014]: 0x40" "[014L]=40" "40"
506980-507298 avr_isp: lpmp: "Load program memory page High: [0x014]: 0xc0" "[014H]=c0" "c0"
507297-507620 avr_isp: lpmp: "Load program memory page Low: [0x015]: 0xe5" "[015L]=e5" "e5"
507619-507940 avr_isp: lpmp: "Load program memory page High: [0x015]: 0xe2" "[015H]=e2" "e2"
507939-508253 avr_isp: lpmp: "Load program memory page Low: [0x016]: 0xf1" "[016L]=f1" "f1"
508256-508565 avr_isp: lpmp: "Load program memory page High: [0x016]: 0xe0" "[016H]=e0" "e0"
508564-508887 avr_isp: lpmp: "Load program memory page Low: [0x017]: 0x83" "[017L]=83" "83"
508890-509205 avr_isp: lpmp: "Load program memory page High: [0x017]: 0x81" "[017H]=81" "81"
509206-509518 avr_isp: lpmp: "Load program memory page Low: [0x018]: 0x8f" "[018L]=8f" "8f"
509519-509833 avr_isp: lpmp: "Load program memory page High: [0x018]: 0x5f" "[018H]=5f" "5f"
509834-510145 avr_isp: lpmp: "Load program memory page Low: [0x019]: 0x83" "[019L]=83" "83"
510146-510462 avr_isp: lpmp: "Load program memory page High: [0x019]: 0x83" "[019H]=83" "83"
510461-510769 avr_isp: lpmp: "Load program memory page Low: [0x01a]: 0x91" "[01aL]=91" "91"
510770-511088 avr_isp: lpmp: "Load program memory page High: [0x01a]: 0x81" "[01aH]=81" "81"
511090-511404 avr_isp: lpmp: "Load program memory page Low: [0x01b]: 0x91" "[01bL]=91" "91"
511416-511724 avr_isp: lpmp: "Load program memory page High: [0x01b]: 0x11" "[01bH]=11" "11"
511725-512034 avr_isp: lpmp: "Load program memory page Low: [0x01c]: 0x02" "[01cL]=02" "02"
512037-512346 avr_isp: lpmp: "Load program memory page High: [0x01c]: 0xc0" "[01cH]=c0" "c0"
512347-512656 avr_isp: lpmp: "Load program memory page Low: [0x01d]: 0x80" "[01dL]=80" "80"
512659-512981 avr_isp: lpmp: "Load program memory page High: [0x01d]: 0x93" "[01dH]=93" "93"
512978-513294 avr_isp: lpmp: "Load program memory page Low: [0x01e]: 0x21" "[01eL]=21" "21"
513297-513615 avr_isp: lpmp: "Load program memory page High: [0x01e]: 0x01" "[01eH]=01" "01"
513614-513930 avr_isp: lpmp: "Load program memory page Low: [0x01f]: 0x80" "[01fL]=80" "80"
513931-514246 avr_isp: lpmp: "Load program memory page High: [0x01f]: 0x91" "[01fH]=91" "91"
514293-514615 avr_isp: wp: "Write program memory page: 0x1408"
514623-514946 avr_isp: prnb: "Poll RDY/nBSY: Busy" "Busy" "B"
516946-517259 avr_isp: prnb: "Poll RDY/nBSY: Busy" "Busy" "B"
519259-519566 avr_isp: prnb: "Poll RDY/nBSY: Busy" "Busy" "B"
521569-521891 avr_isp: prnb: "Poll RDY/nBSY: Busy" "Busy" "B"
523893-524204 avr_isp: prnb: "Poll RDY/nBSY: Ready" "Ready" "R"
524206-524524 avr_isp: lpmp: "Load program memory page Low: [0x000]: 0x27" "[000L]=27" "27"
524523-524839 avr_isp: lpmp: "Load program memory page High: [0x000]: 0x01" "[000H]=01" "01"
524841-525163 avr_isp: lpmp: "Load program memory page Low: [0x001]: 0x90" "[001L]=90" "90"
525166-525486 avr_isp: lpmp: "Load program memory page High: [0x001]: 0x91" "[001H]=91" "91"
525485-525798 avr_isp: lpmp: "Load program memory page Low: [0x002]: 0x21" "[002L]=21" "21"
525797-526110 avr_isp: lpmp: "Load program memory page High: [0x002]: 0x01" "[002H]=01" "01"
526109-526432 avr_isp: lpmp: "Load program memory page Low: [0x003]: 0x89" "[003L]=89" "89"
526431-526747 avr_isp: lpmp: "Load program memory page High: [0x003]: 0x17" "[003H]=17" "17"
526748-527062 avr_isp: lpmp: "Load program memory page Low: [0x004]: 0x11" "[004L]=11" "11"
527065-527385 avr_isp: lpmp: "Load program memory page High: [0x004]: 0xf0" "[004H]=f0" "f0"
527383-527708 avr_isp: lpmp: "Load program memory page Low: [0x005]: 0x8f" "[005L]=8f" "8f"
527710-528027 avr_isp: lpmp: "Load program memory page High: [0x005]: 0x3f" "[005H]=3f" "3f"
528025-528333 avr_isp: lpmp: "Load program memory page Low: [0x006]: 0xb1" "[006L]=b1" "b1"
528334-528659 avr_isp: lpmp: "Load program memory page High: [0x006]: 0xf4" "[006H]=f4" "f4"
528658-528983 avr_isp: lpmp: "Load program memory page Low: [0x007]: 0x80" "[007L]=80" "80"
528983-529302 avr_isp: lpmp: "Load program memory page High: [0x007]: 0x91" "[007H]=91" "91"
529305-529623 avr_isp: lpmp: "Load program memory page Low: [0x008]: 0x29" "[008L]=29" "29"
529622-529935 avr_isp: lpmp: "Load program memory page High: [0x008]: 0x01" "[008H]=01" "01"
529934-530250 avr_isp: lpmp: "Load program memory page Low: [0x009]: 0x81" "[009L]=81" "81"
530251-530570 avr_isp: lpmp: "Load program memory page High: [0x009]: 0x30" "[009H]=30" "30"
530568-530904 avr_isp: lpmp: "Load program memory page Low: [0x00a]: 0x91" "[00aL]=91" "91"
530905-531221 avr_isp: lpmp: "Load program memory page High: [0x00a]: 0xf4" "[00aH]=f4" "f4"
531222-531543 avr_isp: lpmp: "Load program memory page Low: [0x00b]: 0xe5" "[00bL]=e5" "e5"
531547-531859 avr_isp: lpmp: "Load program memory page High: [0x00b]: 0xe2" "[00bH]=e2" "e2"
531860-532173 avr_isp: lpmp: "Load program memory page Low: [0x00c]: 0xf1" "[00cL]=f1" "f1"
532175-532495 avr_isp: lpmp: "Load program memory page High: [0x00c]: 0xe0" "[00cH]=e0" "e0"
532497-532814 avr_isp: lpmp: "Load program memory page Low: [0x00d]: 0x67" "[00dL]=67" "67"
532813-533128 avr_isp: lpmp: "Load program memory page High: [0x00d]: 0x81" "[00dH]=81" "81"
533130-533446 avr_isp: lpmp: "Load program memory page Low: [0x00e]: 0x86" "[00eL]=86" "86"
533445-533746 avr_isp: lpmp: "Load program memory page High: [0x00e]: 0x81" "[00eH]=81" "81"
533747-534057 avr_isp: lpmp: "Load program memory page Low: [0x00f]: 0xef" "[00fL]=ef" "ef"
534060-534376 avr_isp: lpmp: "Load program memory page High: [0x00f]: 0xde" "[00fH]=de" "de"
534375-534691 avr_isp: lpmp: "Load program memory page Low: [0x010]: 0xc0" "[010L]=c0" "c0"
534694-535026 avr_isp: lpmp: "Load program memory page High: [0x010]: 0xe0" "[010H]=e0" "e0"
535025-535339 avr_isp: lpmp: "Load program memory page Low: [0x011]: 0x07" "[011L]=07" "07"
535339-535663 avr_isp: lpmp: "Load program memory page High: [0x011]: 0xc0" "[011H]=c0" "c0"
535661-535985 avr_isp: lpmp: "Load program memory page Low: [0x012]: 0xec" "[012L]=ec" "ec"
535983-536307 avr_isp: lpmp: "Load program memory page High: [0x012]: 0x2f" "[012H]=2f" "2f"
536305-536627 avr_isp: lpmp: "Load program memory page Low: [0x013]: 0xf0" "[013L]=f0" "f0"
536626-536956 avr_isp: lpmp: "Load program memory page High: [0x013]: 0xe0" "[013H]=e0" "e0"
536961-537281 avr_isp: lpmp: "Load program memory page Low: [0x014]: 0xeb" "[014L]=eb" "eb"
537277-537599 avr_isp: lpmp: "Load program memory page High: [0x014]: 0x5d" "[014H]=5d" "5d"
537598-537912 avr_isp: lpmp: "Load program memory page Low: [0x015]: 0xfe" "[015L]=fe" "fe"
537915-538234 avr_isp: lpmp: "Load program memory page High: [0x015]: 0x4f" "[015H]=4f" "4f"
538235-538553 avr_isp: lpmp: "Load program memory page Low: [0x016]: 0x81" "[016L]=81" "81"
538554-538884 avr_isp: lpmp: "Load program memory page High: [0x016]: 0x85" "[016H]=85" "85"
538877-539200 avr_isp: lpmp: "Load program memory page Low: [0x017]: 0x98" "[017L]=98" "98"
539201-539516 avr_isp: lpmp: "Load program memory page High: [0x017]: 0xde" "[017H]=de" "de"
539514-539825 avr_isp: lpmp: "Load program memory page Low: [0x018]: 0xcf" "[018L]=cf" "cf"
539826-540142 avr_isp: lpmp: "Load program memory page High: [0x018]: 0x5f" "[018H]=5f" "5f"
540141-540454 avr_isp: lpmp: "Load program memory page Low: [0x019]: 0x80" "[019L]=80" "80"
540455-540774 avr_isp: lpmp: "Load program memory page High: [0x019]: 0x91" "[019H]=91" "91"
540770-541094 avr_isp: lpmp: "Load program memory page Low: [0x01a]: 0x2d" "[01aL]=2d" "2d"
541093-541408 avr_isp: lpmp: "Load program memory page High: [0x01a]: 0x01" "[01aH]=01" "01"
541407-541721 avr_isp: lpmp: "Load program memory page Low: [0x01b]: 0xc8" "[01bL]=c8" "c8"
541725-542031 avr_isp: lpmp: "Load program memory page High: [0x01b]: 0x17" "[01bH]=17" "17"
542034-542322 avr_isp: lpmp: "Load program memory page Low: [0x01c]: 0xa8" "[01cL]=a8" "a8"
542322-542615 avr_isp: lpmp: "Load program memory page High: [0x01c]: 0xf3" "[01cH]=f3" "f3"
542615-542924 avr_isp: lpmp: "Load program memory page Low: [0x01d]: 0x80" "[01dL]=80" "80"
542924-543231 avr_isp: lpmp: "Load program memory page High: [0x01d]: 0x91" "[01dH]=91" "91"
543234-543547 avr_isp: lpmp: "Load program memory page Low: [0x01e]: 0x27" "[01eL]=27" "27"
543547-543852 avr_isp: lpmp: "Load program memory page High: [0x01e]: 0x01" "[01eH]=01" "01"
543854-544165 avr_isp: lpmp: "Load program memory page Low: [0x01f]: 0x90" "[01fL]=90" "90"
544166-544484 avr_isp: lpmp: "Load program memory page High: [0x01f]: 0x91" "[01fH]=91" "91"
544535-544847 avr_isp: wp: "Write program memory page: 0x1808"
544849-545170 avr_isp: prnb: "Poll RDY/nBSY: Busy" "Busy" "B"
547172-547482 avr_isp: prnb: "Poll RDY/nBSY: Busy" "Busy" "B"
549482-549806 avr_isp: prnb: "Poll RDY/nBSY: Busy" "Busy" "B"
551807-552125 avr_isp: prnb: "Poll RDY/nBSY: Busy" "Busy" "B"
554126-554444 avr_isp: prnb: "Poll RDY/nBSY: Ready" "Ready" "R"
554447-554760 avr_isp: lpmp: "Load program memory page Low: [0x000]: 0x21" "[000L]=21" "21"
554762-555077 avr_isp: lpmp: "Load program memory page High: [0x000]: 0x01" "[000H]=01" "01"
555076-555401 avr_isp: lpmp: "Load program memory page Low: [0x001]: 0x89" "[001L]=89" "89"
555400-555713 avr_isp: lpmp: "Load program memory page High: [0x001]: 0x13" "[001H]=13" "13"
555712-556028 avr_isp: lpmp: "Load program memory page Low: [0x002]: 0x02" "[002L]=02" "02"
556031-556348 avr_isp: lpmp: "Load program memory page High: [0x002]: 0xc0" "[002H]=c0" "c0"
556346-556661 avr_isp: lpmp: "Load program memory page Low: [0x003]: 0x8f" "[003L]=8f" "8f"
556663-556980 avr_isp: lpmp: "Load program memory page High: [0x003]: 0x3f" "[003H]=3f" "3f"
556981-557300 avr_isp: lpmp: "Load program memory page Low: [0x004]: 0x81" "[004L]=81" "81"
557301-557621 avr_isp: lpmp: "Load program memory page High: [0x004]: 0xf4" "[004H]=f4" "f4"
557623-557941 avr_isp: lpmp: "Load program memory page Low: [0x005]: 0xd0" "[005L]=d0" "d0"
557940-558255 avr_isp: lpmp: "Load program memory page High: [0x005]: 0x91" "[005H]=91" "91"
558257-558574 avr_isp: lpmp: "Load program memory page Low: [0x006]: 0x2a" "[006L]=2a" "2a"
558573-558891 avr_isp: lpmp: "Load program memory page High: [0x006]: 0x01" "[006H]=01" "01"
558894-559215 avr_isp: lpmp: "Load program memory page Low: [0x007]: 0xda" "[007L]=da" "da"
559219-559537 avr_isp: lpmp: "Load program memory page High: [0x007]: 0x5f" "[007H]=5f" "5f"
559540-559851 avr_isp: lpmp: "Load program memory page Low: [0x008]: 0x41" "[008L]=41" "41"
559852-560171 avr_isp: lpmp: "Load program memory page High: [0x008]: 0xd0" "[008H]=d0" "d0"
560174-560480 avr_isp: lpmp: "Load program memory page Low: [0x009]: 0xc0" "[009L]=c0" "c0"
560481-560795 avr_isp: lpmp: "Load program memory page High: [0x009]: 0xe0" "[009H]=e0" "e0"
560798-561116 avr_isp: lpmp: "Load program memory page Low: [0x00a]: 0x07" "[00aL]=07" "07"
561118-561443 avr_isp: lpmp: "Load program memory page High: [0x00a]: 0xc0" "[00aH]=c0" "c0"
561441-561765 avr_isp: lpmp: "Load program memory page Low: [0x00b]: 0xec" "[00bL]=ec" "ec"
561771-562096 avr_isp: lpmp: "Load program memory page High: [0x00b]: 0x2f" "[00bH]=2f" "2f"
562098-562406 avr_isp: lpmp: "Load program memory page Low: [0x00c]: 0xf0" "[00cL]=f0" "f0"
562407-562721 avr_isp: lpmp: "Load program memory page High: [0x00c]: 0xe0" "[00cH]=e0" "e0"
562722-563044 avr_isp: lpmp: "Load program memory page Low: [0x00d]: 0xeb" "[00dL]=eb" "eb"
563047-563365 avr_isp: lpmp: "Load program memory page High: [0x00d]: 0x5d" "[00dH]=5d" "5d"
563364-563676 avr_isp: lpmp: "Load program memory page Low: [0x00e]: 0xfe" "[00eL]=fe" "fe"
563679-563986 avr_isp: lpmp: "Load program memory page High: [0x00e]: 0x4f" "[00eH]=4f" "4f"
563989-564295 avr_isp: lpmp: "Load program memory page Low: [0x00f]: 0x80" "[00fL]=80" "80"
564294-564608 avr_isp: lpmp: "Load program memory page High: [0x00f]: 0x81" "[00fH]=81" "81"
564606-564930 avr_isp: lpmp: "Load program memory page Low: [0x010]: 0x29" "[010L]=29" "29"
564931-565250 avr_isp: lpmp: "Load program memory page High: [0x010]: 0xd0" "[010H]=d0" "d0"
565251-565568 avr_isp: lpmp: "Load program memory page Low: [0x011]: 0xcf" "[011L]=cf" "cf"
565566-565881 avr_isp: lpmp: "Load program memory page High: [0x011]: 0x5f" "[011H]=5f" "5f"
565883-566191 avr_isp: lpmp: "Load program memory page Low: [0x012]: 0xcd" "[012L]=cd" "cd"
566193-566503 avr_isp: lpmp: "Load program memory page High: [0x012]: 0x17" "[012H]=17" "17"
566505-566820 avr_isp: lpmp: "Load program memory page Low: [0x013]: 0xb8" "[013L]=b8" "b8"
566819-567146 avr_isp: lpmp: "Load program memory page High: [0x013]: 0xf3" "[013H]=f3" "f3"
567145-567460 avr_isp: lpmp: "Load program memory page Low: [0x014]: 0x39" "[014L]=39" "39"
567459-567782 avr_isp: lpmp: "Load program memory page High: [0x014]: 0xd0" "[014H]=d0" "d0"
567781-568104 avr_isp: lpmp: "Load program memory page Low: [0x015]: 0xe5" "[015L]=e5" "e5"
568103-568424 avr_isp: lpmp: "Load program memory page High: [0x015]: 0xde" "[015H]=de" "de"
568423-568737 avr_isp: lpmp: "Load program memory page Low: [0x016]: 0xdf" "[016L]=df" "df"
568740-569066 avr_isp: lpmp: "Load program memory page High: [0x016]: 0x91" "[016H]=91" "91"
569067-569376 avr_isp: lpmp: "Load program memory page Low: [0x017]: 0xcf" "[017L]=cf" "cf"
569377-569695 avr_isp: lpmp: "Load program memory page High: [0x017]: 0x91" "[017H]=91" "91"
569696-570004 avr_isp: lpmp: "Load program memory page Low: [0x018]: 0x08" "[018L]=08" "08"
570006-570326 avr_isp: lpmp: "Load program memory page High: [0x018]: 0x95" "[018H]=95" "95"
570328-570648 avr_isp: lpmp: "Load program memory page Low: [0x019]: 0x72" "[019L]=72" "72"
570650-570981 avr_isp: lpmp: "Load program memory page High: [0x019]: 0xdf" "[019H]=df" "df"
570980-571305 avr_isp: lpmp: "Load program memory page Low: [0x01a]: 0x9b" "[01aL]=9b" "9b"
571303-571616 avr_isp: lpmp: "Load program memory page High: [0x01a]: 0xdf" "[01aH]=df" "df"
571618-571933 avr_isp: lpmp: "Load program memory page Low: [0x01b]: 0xfe" "[01bL]=fe" "fe"
571933-572251 avr_isp: lpmp: "Load program memory page High: [0x01b]: 0xcf" "[01bH]=cf" "cf"
572250-572556 avr_isp: lpmp: "Load program memory page Low: [0x01c]: 0x8b" "[01cL]=8b" "8b"
572557-572891 avr_isp: lpmp: "Load program memory page High: [0x01c]: 0xb1" "[01cH]=b1" "b1"
572881-573202 avr_isp: lpmp: "Load program memory page Low: [0x01d]: 0x84" "[01dL]=84" "84"
573205-573516 avr_isp: lpmp: "Load program memory page High: [0x01d]: 0x60" "[01dH]=60" "60"
573517-573830 avr_isp: lpmp: "Load program memory page Low: [0x01e]: 0x8b" "[01eL]=8b" "8b"
573830-574143 avr_isp: lpmp: "Load program memory page High: [0x01e]: 0xb9" "[01eH]=b9" "b9"
574147-574462 avr_isp: lpmp: "Load program memory page Low: [0x01f]: 0x8a" "[01fL]=8a" "8a"
574461-574778 avr_isp: lpmp: "Load program memory page High: [0x01f]: 0xb1" "[01fH]=b1" "b1"
574836-575157 avr_isp: wp: "Write program memory page: 0x1c08"
575165-575475 avr_isp: prnb: "Poll RDY/nBSY: Busy" "Busy" "B"
577477-577783 avr_isp: prnb: "Poll RDY/nBSY: Busy" "Busy" "B"
579787-580109 avr_isp: prnb: "Poll RDY/nBSY: Busy" "Busy" "B"
582110-582422 avr_isp: prnb: "Poll RDY/nBSY: Busy" "Busy" "B"
584424-584735 avr_isp: prnb: "Poll RDY/nBSY: Ready" "Ready" "R"
584736-585057 avr_isp: lpmp: "Load program memory page Low: [0x000]: 0x84" "[000L]=84" "84"
585058-585378 avr_isp: lpmp: "Load program memory page High: [0x000]: 0x60" "[000H]=60" "60"
585377-585700 avr_isp: lpmp: "Load program memory page Low: [0x001]: 0x8a" "[001L]=8a" "8a"
585699-586013 avr_isp: lpmp: "Load program memory page High: [0x001]: 0xb9" "[001H]=b9" "b9"
586011-586327 avr_isp: lpmp: "Load program memory page Low: [0x002]: 0x88" "[002L]=88" "88"
586330-586641 avr_isp: lpmp: "Load program memory page High: [0x002]: 0xb1" "[002H]=b1" "b1"
586642-586971 avr_isp: lpmp: "Load program memory page Low: [0x003]: 0x80" "[003L]=80" "80"
586970-587287 avr_isp: lpmp: "Load program memory page High: [0x003]: 0x62" "[003H]=62" "62"
587283-587605 avr_isp: lpmp: "Load program memory page Low: [0x004]: 0x88" "[004L]=88" "88"
587606-587921 avr_isp: lpmp: "Load program memory page High: [0x004]: 0xb9" "[004H]=b9" "b9"
587917-588230 avr_isp: lpmp: "Load program memory page Low: [0x005]: 0xe4" "[005L]=e4" "e4"
588231-588552 avr_isp: lpmp: "Load program memory page High: [0x005]: 0xe6" "[005H]=e6" "e6"
588555-588874 avr_isp: lpmp: "Load program memory page Low: [0x006]: 0xf0" "[006L]=f0" "f0"
588884-589200 avr_isp: lpmp: "Load program memory page High: [0x006]: 0xe0" "[006H]=e0" "e0"
589201-589514 avr_isp: lpmp: "Load program memory page Low: [0x007]: 0x80" "[007L]=80" "80"
589517-589828 avr_isp: lpmp: "Load program memory page High: [0x007]: 0x81" "[007H]=81" "81"
589828-590146 avr_isp: lpmp: "Load program memory page Low: [0x008]: 0x8d" "[008L]=8d" "8d"
590149-590456 avr_isp: lpmp: "Load program memory page High: [0x008]: 0x7f" "[008H]=7f" "7f"
590459-590772 avr_isp: lpmp: "Load program memory page Low: [0x009]: 0x80" "[009L]=80" "80"
590773-591094 avr_isp: lpmp: "Load program memory page High: [0x009]: 0x83" "[009H]=83" "83"
591095-591408 avr_isp: lpmp: "Load program memory page Low: [0x00a]: 0x8a" "[00aL]=8a" "8a"
591409-591727 avr_isp: lpmp: "Load program memory page High: [0x00a]: 0xb1" "[00aH]=b1" "b1"
591731-592049 avr_isp: lpmp: "Load program memory page Low: [0x00b]: 0x80" "[00bL]=80" "80"
592050-592362 avr_isp: lpmp: "Load program memory page High: [0x00b]: 0x61" "[00bH]=61" "61"
592363-592690 avr_isp: lpmp: "Load program memory page Low: [0x00c]: 0x8a" "[00cL]=8a" "8a"
592689-593012 avr_isp: lpmp: "Load program memory page High: [0x00c]: 0xb9" "[00cH]=b9" "b9"
593011-593338 avr_isp: lpmp: "Load program memory page Low: [0x00d]: 0x80" "[00dL]=80" "80"
593339-593658 avr_isp: lpmp: "Load program memory page High: [0x00d]: 0xec" "[00dH]=ec" "ec"
593657-593982 avr_isp: lpmp: "Load program memory page Low: [0x00e]: 0x80" "[00eL]=80" "80"
593983-594304 avr_isp: lpmp: "Load program memory page High: [0x00e]: 0x93" "[00eH]=93" "93"
594303-594614 avr_isp: lpmp: "Load program memory page Low: [0x00f]: 0xc2" "[00fL]=c2" "c2"
594615-594940 avr_isp: lpmp: "Load program memory page High: [0x00f]: 0x00" "[00fH]=00" "00"
594941-595249 avr_isp: lpmp: "Load program memory page Low: [0x010]: 0x88" "[010L]=88" "88"
595250-595570 avr_isp: lpmp: "Load program memory page High: [0x010]: 0xe1" "[010H]=e1" "e1"
595572-595877 avr_isp: lpmp: "Load program memory page Low: [0x011]: 0x80" "[011L]=80" "80"
595878-596195 avr_isp: lpmp: "Load program memory page High: [0x011]: 0x93" "[011H]=93" "93"
596194-596516 avr_isp: lpmp: "Load program memory page Low: [0x012]: 0xc1" "[012L]=c1" "c1"
596518-596828 avr_isp: lpmp: "Load program memory page High: [0x012]: 0x00" "[012H]=00" "00"
596830-597151 avr_isp: lpmp: "Load program memory page Low: [0x013]: 0x8f" "[013L]=8f" "8f"
597152-597468 avr_isp: lpmp: "Load program memory page High: [0x013]: 0xe4" "[013H]=e4" "e4"
597469-597780 avr_isp: lpmp: "Load program memory page Low: [0x014]: 0x90" "[014L]=90" "90"
597785-598103 avr_isp: lpmp: "Load program memory page High: [0x014]: 0xe0" "[014H]=e0" "e0"
598100-598426 avr_isp: lpmp: "Load program memory page Low: [0x015]: 0x90" "[015L]=90" "90"
598429-598748 avr_isp: lpmp: "Load program memory page High: [0x015]: 0x93" "[015H]=93" "93"
598751-599080 avr_isp: lpmp: "Load program memory page Low: [0x016]: 0xc5" "[016L]=c5" "c5"
599081-599396 avr_isp: lpmp: "Load program memory page High: [0x016]: 0x00" "[016H]=00" "00"
599394-599702 avr_isp: lpmp: "Load program memory page Low: [0x017]: 0x80" "[017L]=80" "80"
599703-600022 avr_isp: lpmp: "Load program memory page High: [0x017]: 0x93" "[017H]=93" "93"
600023-600334 avr_isp: lpmp: "Load program memory page Low: [0x018]: 0xc4" "[018L]=c4" "c4"
600333-600652 avr_isp: lpmp: "Load program memory page High: [0x018]: 0x00" "[018H]=00" "00"
600650-600969 avr_isp: lpmp: "Load program memory page Low: [0x019]: 0x08" "[019L]=08" "08"
600974-601294 avr_isp: lpmp: "Load program memory page High: [0x019]: 0x95" "[019H]=95" "95"
601290-601602 avr_isp: lpmp: "Load program memory page Low: [0x01a]: 0x90" "[01aL]=90" "90"
601602-601924 avr_isp: lpmp: "Load program memory page High: [0x01a]: 0x91" "[01aH]=91" "91"
601923-602246 avr_isp: lpmp: "Load program memory page Low: [0x01b]: 0xc0" "[01bL]=c0" "c0"
602253-602564 avr_isp: lpmp: "Load program memory page High: [0x01b]: 0x00" "[01bH]=00" "00"
602563-602901 avr_isp: lpmp: "Load program memory page Low: [0x01c]: 0x95" "[01cL]=95" "95"
602892-603207 avr_isp: lpmp: "Load program memory page High: [0x01c]: 0xff" "[01cH]=ff" "ff"
603207-603518 avr_isp: lpmp: "Load program memory page Low: [0x01d]: 0xfc" "[01dL]=fc" "fc"
603517-603827 avr_isp: lpmp: "Load program memory page High: [0x01d]: 0xcf" "[01dH]=cf" "cf"
603827-604142 avr_isp: lpmp: "Load program memory page Low: [0x01e]: 0x80" "[01eL]=80" "80"
604146-604461 avr_isp: lpmp: "Load program memory page High: [0x01e]: 0x93" "[01eH]=93" "93"
604459-604781 avr_isp: lpmp: "Load program memory page Low: [0x01f]: 0xc6" "[01fL]=c6" "c6"
604780-605109 avr_isp: lpmp: "Load program memory page High: [0x01f]: 0x00" "[01fH]=00" "00"
605160-605468 avr_isp: wp: "Write program memory page: 0x10"
605473-605799 avr_isp: prnb: "Poll RDY/nBSY: Busy" "Busy" "B"
607798-608118 avr_isp: prnb: "Poll RDY/nBSY: Busy" "Busy" "B"
610120-610446 avr_isp: prnb: "Poll RDY/nBSY: Busy" "Busy" "B"
612445-612764 avr_isp: prnb: "Poll RDY/nBSY: Busy" "Busy" "B"
614767-615093 avr_isp: prnb: "Poll RDY/nBSY: Ready" "Ready" "R"
615093-615404 avr_isp: lpmp: "Load program memory page Low: [0x000]: 0x80" "[000L]=80" "80"
615403-615714 avr_isp: lpmp: "Load program memory page High: [0x000]: 0x91" "[000H]=91" "91"
615717-616035 avr_isp: lpmp: "Load program memory page Low: [0x001]: 0xc0" "[001L]=c0" "c0"
616034-616347 avr_isp: lpmp: "Load program memory page High: [0x001]: 0x00" "[001H]=00" "00"
616348-616664 avr_isp: lpmp: "Load program memory page Low: [0x002]: 0x86" "[002L]=86" "86"
616665-616988 avr_isp: lpmp: "Load program memory page High: [0x002]: 0xff" "[002H]=ff" "ff"
616989-617308 avr_isp: lpmp: "Load program memory page Low: [0x003]: 0xfc" "[003L]=fc" "fc"
617306-617630 avr_isp: lpmp: "Load program memory page High: [0x003]: 0xcf" "[003H]=cf" "cf"
617628-617952 avr_isp: lpmp: "Load program memory page Low: [0x004]: 0xe0" "[004L]=e0" "e0"
617951-618262 avr_isp: lpmp: "Load program memory page High: [0x004]: 0xec" "[004H]=ec" "ec"
618261-618575 avr_isp: lpmp: "Load program memory page Low: [0x005]: 0xf0" "[005L]=f0" "f0"
618579-618910 avr_isp: lpmp: "Load program memory page High: [0x005]: 0xe0" "[005H]=e0" "e0"
618909-619214 avr_isp: lpmp: "Load program memory page Low: [0x006]: 0x80" "[006L]=80" "80"
619215-619533 avr_isp: lpmp: "Load program memory page High: [0x006]: 0x81" "[006H]=81" "81"
619533-619848 avr_isp: lpmp: "Load program memory page Low: [0x007]: 0x80" "[007L]=80" "80"
619849-620163 avr_isp: lpmp: "Load program memory page High: [0x007]: 0x64" "[007H]=64" "64"
620164-620475 avr_isp: lpmp: "Load program memory page Low: [0x008]: 0x80" "[008L]=80" "80"
620478-620780 avr_isp: lpmp: "Load program memory page High: [0x008]: 0x83" "[008H]=83" "83"
620781-621104 avr_isp: lpmp: "Load program memory page Low: [0x009]: 0x08" "[009L]=08" "08"
621104-621420 avr_isp: lpmp: "Load program memory page High: [0x009]: 0x95" "[009H]=95" "95"
621424-621741 avr_isp: lpmp: "Load program memory page Low: [0x00a]: 0x8b" "[00aL]=8b" "8b"
621739-622057 avr_isp: lpmp: "Load program memory page High: [0x00a]: 0xb1" "[00aH]=b1" "b1"
622058-622371 avr_isp: lpmp: "Load program memory page Low: [0x00b]: 0x8b" "[00bL]=8b" "8b"
622373-622691 avr_isp: lpmp: "Load program memory page High: [0x00b]: 0x7f" "[00bH]=7f" "7f"
622689-623017 avr_isp: lpmp: "Load program memory page Low: [0x00c]: 0x8b" "[00cL]=8b" "8b"
623016-623341 avr_isp: lpmp: "Load program memory page High: [0x00c]: 0xb9" "[00cH]=b9" "b9"
623340-623654 avr_isp: lpmp: "Load program memory page Low: [0x00d]: 0x08" "[00dL]=08" "08"
623655-623973 avr_isp: lpmp: "Load program memory page High: [0x00d]: 0x95" "[00dH]=95" "95"
623972-624285 avr_isp: lpmp: "Load program memory page Low: [0x00e]: 0x8b" "[00eL]=8b" "8b"
624284-624597 avr_isp: lpmp: "Load program memory page High: [0x00e]: 0xb1" "[00eH]=b1" "b1"
624601-624919 avr_isp: lpmp: "Load program memory page Low: [0x00f]: 0x84" "[00fL]=84" "84"
624920-625236 avr_isp: lpmp: "Load program memory page High: [0x00f]: 0x60" "[00fH]=60" "60"
625237-625557 avr_isp: lpmp: "Load program memory page Low: [0x010]: 0x8b" "[010L]=8b" "8b"
625559-625867 avr_isp: lpmp: "Load program memory page High: [0x010]: 0xb9" "[010H]=b9" "b9"
625869-626188 avr_isp: lpmp: "Load program memory page Low: [0x011]: 0x08" "[011L]=08" "08"
626186-626501 avr_isp: lpmp: "Load program memory page High: [0x011]: 0x95" "[011H]=95" "95"
626503-626811 avr_isp: lpmp: "Load program memory page Low: [0x012]: 0x1f" "[012L]=1f" "1f"
626813-627136 avr_isp: lpmp: "Load program memory page High: [0x012]: 0x92" "[012H]=92" "92"
627135-627446 avr_isp: lpmp: "Load program memory page Low: [0x013]: 0x0f" "[013L]=0f" "0f"
627447-627762 avr_isp: lpmp: "Load program memory page High: [0x013]: 0x92" "[013H]=92" "92"
627759-628082 avr_isp: lpmp: "Load program memory page Low: [0x014]: 0x0f" "[014L]=0f" "0f"
628081-628402 avr_isp: lpmp: "Load program memory page High: [0x014]: 0xb6" "[014H]=b6" "b6"
628401-628705 avr_isp: lpmp: "Load program memory page Low: [0x015]: 0x0f" "[015L]=0f" "0f"
628708-629037 avr_isp: lpmp: "Load program memory page High: [0x015]: 0x92" "[015H]=92" "92"
629036-629354 avr_isp: lpmp: "Load program memory page Low: [0x016]: 0x11" "[016L]=11" "11"
629356-629676 avr_isp: lpmp: "Load program memory page High: [0x016]: 0x24" "[016H]=24" "24"
629678-629995 avr_isp: lpmp: "Load program memory page Low: [0x017]: 0x8f" "[017L]=8f" "8f"
629993-630315 avr_isp: lpmp: "Load program memory page High: [0x017]: 0x93" "[017H]=93" "93"
630314-630627 avr_isp: lpmp: "Load program memory page Low: [0x018]: 0x83" "[018L]=83" "83"
630626-630951 avr_isp: lpmp: "Load program memory page High: [0x018]: 0xe8" "[018H]=e8" "e8"
630950-631267 avr_isp: lpmp: "Load program memory page Low: [0x019]: 0x86" "[019L]=86" "86"
631266-631578 avr_isp: lpmp: "Load program memory page High: [0x019]: 0xbd" "[019H]=bd" "bd"
631581-631887 avr_isp: lpmp: "Load program memory page Low: [0x01a]: 0x80" "[01aL]=80" "80"
631888-632209 avr_isp: lpmp: "Load program memory page High: [0x01a]: 0x91" "[01aH]=91" "91"
632208-632519 avr_isp: lpmp: "Load program memory page Low: [0x01b]: 0x1e" "[01bL]=1e" "1e"
632519-632839 avr_isp: lpmp: "Load program memory page High: [0x01b]: 0x01" "[01bH]=01" "01"
632838-633149 avr_isp: lpmp: "Load program memory page Low: [0x01c]: 0x81" "[01cL]=81" "81"
633150-633451 avr_isp: lpmp: "Load program memory page High: [0x01c]: 0x60" "[01cH]=60" "60"
633452-633768 avr_isp: lpmp: "Load program memory page Low: [0x01d]: 0x80" "[01dL]=80" "80"
633769-634075 avr_isp: lpmp: "Load program memory page High: [0x01d]: 0x93" "[01dH]=93" "93"
634077-634385 avr_isp: lpmp: "Load program memory page Low: [0x01e]: 0x1e" "[01eL]=1e" "1e"
634387-634693 avr_isp: lpmp: "Load program memory page High: [0x01e]: 0x01" "[01eH]=01" "01"
634694-635020 avr_isp: lpmp: "Load program memory page Low: [0x01f]: 0x8f" "[01fL]=8f" "8f"
635019-635333 avr_isp: lpmp: "Load program memory page High: [0x01f]: 0x91" "[01fH]=91" "91"
635383-635698 avr_isp: wp: "Write program memory page: 0x410"
635701-636009 avr_isp: prnb: "Poll RDY/nBSY: Busy" "Busy" "B"
638012-638322 avr_isp: prnb: "Poll RDY/nBSY: Busy" "Busy" "B"
640326-640636 avr_isp: prnb: "Poll RDY/nBSY: Busy" "Busy" "B"
642637-642959 avr_isp: prnb: "Poll RDY/nBSY: Busy" "Busy" "B"
644965-645281 avr_isp: prnb: "Poll RDY/nBSY: Ready" "Ready" "R"
645286-645606 avr_isp: lpmp: "Load program memory page Low: [0x000]: 0x0f" "[000L]=0f" "0f"
645605-645925 avr_isp: lpmp: "Load program memory page High: [0x000]: 0x90" "[000H]=90" "90"
645926-646245 avr_isp: lpmp: "Load program memory page Low: [0x001]: 0x0f" "[001L]=0f" "0f"
646246-646555 avr_isp: lpmp: "Load program memory page High: [0x001]: 0xbe" "[001H]=be" "be"
646556-646866 avr_isp: lpmp: "Load program memory page Low: [0x002]: 0x0f" "[002L]=0f" "0f"
646868-647190 avr_isp: lpmp: "Load program memory page High: [0x002]: 0x90" "[002H]=90" "90"
647193-647511 avr_isp: lpmp: "Load program memory page Low: [0x003]: 0x1f" "[003L]=1f" "1f"
647509-647826 avr_isp: lpmp: "Load program memory page High: [0x003]: 0x90" "[003H]=90" "90"
647828-648148 avr_isp: lpmp: "Load program memory page Low: [0x004]: 0x18" "[004L]=18" "18"
648152-648469 avr_isp: lpmp: "Load program memory page High: [0x004]: 0x95" "[004H]=95" "95"
648468-648792 avr_isp: lpmp: "Load program memory page Low: [0x005]: 0xe4" "[005L]=e4" "e4"
648796-649114 avr_isp: lpmp: "Load program memory page High: [0x005]: 0xe6" "[005H]=e6" "e6"
649117-649426 avr_isp: lpmp: "Load program memory page Low: [0x006]: 0xf0" "[006L]=f0" "f0"
649431-649742 avr_isp: lpmp: "Load program memory page High: [0x006]: 0xe0" "[006H]=e0" "e0"
649743-650059 avr_isp: lpmp: "Load program memory page Low: [0x007]: 0x80" "[007L]=80" "80"
650058-650376 avr_isp: lpmp: "Load program memory page High: [0x007]: 0x81" "[007H]=81" "81"
650377-650690 avr_isp: lpmp: "Load program memory page Low: [0x008]: 0x8f" "[008L]=8f" "8f"
650690-651010 avr_isp: lpmp: "Load program memory page High: [0x008]: 0x7d" "[008H]=7d" "7d"
651011-651323 avr_isp: lpmp: "Load program memory page Low: [0x009]: 0x80" "[009L]=80" "80"
651325-651645 avr_isp: lpmp: "Load program memory page High: [0x009]: 0x83" "[009H]=83" "83"
651647-651957 avr_isp: lpmp: "Load program memory page Low: [0x00a]: 0x85" "[00aL]=85" "85"
651959-652277 avr_isp: lpmp: "Load program memory page High: [0x00a]: 0xb5" "[00aH]=b5" "b5"
652280-652599 avr_isp: lpmp: "Load program memory page Low: [0x00b]: 0x83" "[00bL]=83" "83"
652605-652923 avr_isp: lpmp: "Load program memory page High: [0x00b]: 0x60" "[00bH]=60" "60"
652926-653244 avr_isp: lpmp: "Load program memory page Low: [0x00c]: 0x85" "[00cL]=85" "85"
653245-653568 avr_isp: lpmp: "Load program memory page High: [0x00c]: 0xbd" "[00cH]=bd" "bd"
653567-653879 avr_isp: lpmp: "Load program memory page Low: [0x00d]: 0xee" "[00dL]=ee" "ee"
653882-654198 avr_isp: lpmp: "Load program memory page High: [0x00d]: 0xe6" "[00dH]=e6" "e6"
654197-654508 avr_isp: lpmp: "Load program memory page Low: [0x00e]: 0xf0" "[00eL]=f0" "f0"
654509-654823 avr_isp: lpmp: "Load program memory page High: [0x00e]: 0xe0" "[00eH]=e0" "e0"
654826-655147 avr_isp: lpmp: "Load program memory page Low: [0x00f]: 0x80" "[00fL]=80" "80"
655146-655462 avr_isp: lpmp: "Load program memory page High: [0x00f]: 0x81" "[00fH]=81" "81"
655466-655781 avr_isp: lpmp: "Load program memory page Low: [0x010]: 0x81" "[010L]=81" "81"
655781-656086 avr_isp: lpmp: "Load program memory page High: [0x010]: 0x60" "[010H]=60" "60"
656088-656407 avr_isp: lpmp: "Load program memory page Low: [0x011]: 0x80" "[011L]=80" "80"
656406-656729 avr_isp: lpmp: "Load program memory page High: [0x011]: 0x83" "[011H]=83" "83"
656728-657048 avr_isp: lpmp: "Load program memory page Low: [0x012]: 0x08" "[012L]=08" "08"
657051-657372 avr_isp: lpmp: "Load program memory page High: [0x012]: 0x95" "[012H]=95" "95"
657375-657693 avr_isp: lpmp: "Load program memory page Low: [0x013]: 0xf8" "[013L]=f8" "f8"
657690-658013 avr_isp: lpmp: "Load program memory page High: [0x013]: 0x94" "[013H]=94" "94"
658012-658324 avr_isp: lpmp: "Load program memory page Low: [0x014]: 0xff" "[014L]=ff" "ff"
658327-658643 avr_isp: lpmp: "Load program memory page High: [0x014]: 0xcf" "[014H]=cf" "cf"
658642-658958 avr_isp: lpmp: "Load program memory page Low: [0x015]: 0x52" "[015L]=52" "52"
658961-659280 avr_isp: lpmp: "Load program memory page High: [0x015]: 0x65" "[015H]=65" "65"
659278-659596 avr_isp: lpmp: "Load program memory page Low: [0x016]: 0x61" "[016L]=61" "61"
659597-659916 avr_isp: lpmp: "Load program memory page High: [0x016]: 0x64" "[016H]=64" "64"
659912-660234 avr_isp: lpmp: "Load program memory page Low: [0x017]: 0x79" "[017L]=79" "79"
660232-660535 avr_isp: lpmp: "Load program memory page High: [0x017]: 0x2e" "[017H]=2e" "2e"
660537-660849 avr_isp: lpmp: "Load program memory page Low: [0x018]: 0x20" "[018L]=20" "20"
660851-661173 avr_isp: lpmp: "Load program memory page High: [0x018]: 0x42" "[018H]=42" "42"
661173-661496 avr_isp: lpmp: "Load program memory page Low: [0x019]: 0x75" "[019L]=75" "75"
661495-661809 avr_isp: lpmp: "Load program memory page High: [0x019]: 0x69" "[019H]=69" "69"
661811-662130 avr_isp: lpmp: "Load program memory page Low: [0x01a]: 0x6c" "[01aL]=6c" "6c"
662127-662441 avr_isp: lpmp: "Load program memory page High: [0x01a]: 0x64" "[01aH]=64" "64"
662444-662772 avr_isp: lpmp: "Load program memory page Low: [0x01b]: 0x20" "[01bL]=20" "20"
662772-663096 avr_isp: lpmp: "Load program memory page High: [0x01b]: 0x74" "[01bH]=74" "74"
663097-663410 avr_isp: lpmp: "Load program memory page Low: [0x01c]: 0x69" "[01cL]=69" "69"
663412-663720 avr_isp: lpmp: "Load program memory page High: [0x01c]: 0x6d" "[01cH]=6d" "6d"
663722-664029 avr_isp: lpmp: "Load program memory page Low: [0x01d]: 0x65" "[01dL]=65" "65"
664027-664349 avr_isp: lpmp: "Load program memory page High: [0x01d]: 0x3a" "[01dH]=3a" "3a"
664347-664661 avr_isp: lpmp: "Load program memory page Low: [0x01e]: 0x00" "[01eL]=00" "00"
664659-664995 avr_isp: lpmp: "Load program memory page High: [0x01e]: 0x31" "[01eH]=31" "31"
664994-665298 avr_isp: lpmp: "Load program memory page Low: [0x01f]: 0x37" "[01fL]=37" "37"
665300-665610 avr_isp: lpmp: "Load program memory page High: [0x01f]: 0x30" "[01fH]=30" "30"
665661-665981 avr_isp: wp: "Write program memory page: 0x810"
665988-666307 avr_isp: prnb: "Poll RDY/nBSY: Busy" "Busy" "B"
668308-668616 avr_isp: prnb: "Poll RDY/nBSY: Busy" "Busy" "B"
670618-670939 avr_isp: prnb: "Poll RDY/nBSY: Busy" "Busy" "B"
672941-673247 avr_isp: prnb: "Poll RDY/nBSY: Busy" "Busy" "B"
675247-675562 avr_isp: prnb: "Poll RDY/nBSY: Ready" "Ready" "R"
675565-675888 avr_isp: lpmp: "Load program memory page Low: [0x000]: 0x39" "[000L]=39" "39"
675889-676207 avr_isp: lpmp: "Load program memory page High: [0x000]: 0x34" "[000H]=34" "34"
676206-676518 avr_isp: lpmp: "Load program memory page Low: [0x001]: 0x39" "[001L]=39" "39"
676516-676830 avr_isp: lpmp: "Load program memory page High: [0x001]: 0x30" "[001H]=30" "30"
676828-677145 avr_isp: lpmp: "Load program memory page Low: [0x002]: 0x30" "[002L]=30" "30"
677146-677459 avr_isp: lpmp: "Load program memory page High: [0x002]: 0x32" "[002H]=32" "32"
677460-677773 avr_isp: lpmp: "Load program memory page Low: [0x003]: 0x39" "[003L]=39" "39"
677775-678080 avr_isp: lpmp: "Load program memory page High: [0x003]: 0x00" "[003H]=00" "00"
678130-678444 avr_isp: wp: "Write program memory page: 0xc10"
678449-678768 avr_isp: prnb: "Poll RDY/nBSY: Busy" "Busy" "B"
680769-681088 avr_isp: prnb: "Poll RDY/nBSY: Busy" "Busy" "B"
683092-683400 avr_isp: prnb: "Poll RDY/nBSY: Busy" "Busy" "B"
685401-685715 avr_isp: prnb: "Poll RDY/nBSY: Busy" "Busy" "B"
687718-688031 avr_isp: prnb: "Poll RDY/nBSY: Ready" "Ready" "R"
688063-688373 avr_isp: rlb: "Read lock bits: 0xff"
