5112726-5114073 avr_isp: pe: "Programming enable"
5112726-5114073 avr_isp: warning: "Warning: Unexpected bytes in reply!"
5121246-5122595 avr_isp: rsb0: "Vendor code: 0x1e (Atmel)"
5137251-5138600 avr_isp: rsb1: "Part family / memory size: 0x93"
5153263-5154611 avr_isp: rsb2: "Part number: 0x0a"
5137251-5154611 avr_isp: dev: "Device: Atmel ATmega88"
5169269-5170618 avr_isp: rfb: "Read fuse bits: 0xff"
5184610-5185959 avr_isp: rfb: "Read fuse bits: 0xff"
5201287-5202636 avr_isp: rfb: "Read fuse bits: 0xff"
5217299-5218648 avr_isp: rhfb: "Read fuse high bits: 0xdf"
5232632-5233982 avr_isp: rhfb: "Read fuse high bits: 0xdf"
5249311-5250661 avr_isp: rhfb: "Read fuse high bits: 0xdf"
5264650-5265998 avr_isp: refb: "Read extended fuse bits: 0xf9"
5281330-5282678 avr_isp: refb: "Read extended fuse bits: 0xf9"
5297338-5298687 avr_isp: refb: "Read extended fuse bits: 0xf9"
5312699-5314048 avr_isp: reem: "Read EEPROM Memory: [0x1fc]: 0xff"
5329353-5330702 avr_isp: reem: "Read EEPROM Memory: [0x1fd]: 0xff"
5344691-5346042 avr_isp: reem: "Read EEPROM Memory: [0x1fe]: 0xff"
5360931-5362282 avr_isp: reem: "Read EEPROM Memory: [0x1ff]: 0xff"
5376907-5378241 avr_isp: ce: "Chip erase"
5674961-5676308 avr_isp: pe: "Programming enable"
5674961-5676308 avr_isp: warning: "Warning: Unexpected bytes in reply!"
5685574-5686923 avr_isp: rfb: "Read fuse bits: 0xff"
5701579-5702926 avr_isp: rfb: "Read fuse bits: 0xff"
5716887-5718236 avr_isp: rfb: "Read fuse bits: 0xff"
5733582-5734932 avr_isp: rhfb: "Read fuse high bits: 0xdf"
5748917-5750266 avr_isp: rhfb: "Read fuse high bits: 0xdf"
5765626-5766975 avr_isp: rhfb: "Read fuse high bits: 0xdf"
5781366-5782715 avr_isp: refb: "Read extended fuse bits: 0xf9"
5797100-5798448 avr_isp: refb: "Read extended fuse bits: 0xf9"
5813639-5814987 avr_isp: refb: "Read extended fuse bits: 0xf9"
