4855355-4867314 em4305: first_field_stop: "First field stop" "Field stop" "FFS"
4867314-4872121 em4305: write_mode_exit: "Write mode exit"
5147211-5165131 em4305: first_field_stop: "First field stop" "Field stop" "FFS"
5165131-5169938 em4305: write_mode_exit: "Write mode exit"
5171107-5189028 em4305: first_field_stop: "First field stop" "Field stop" "FFS"
5189028-5193834 em4305: write_mode_exit: "Write mode exit"
5195004-5212924 em4305: first_field_stop: "First field stop" "Field stop" "FFS"
5212924-5217731 em4305: write_mode_exit: "Write mode exit"
5218932-5236822 em4305: first_field_stop: "First field stop" "Field stop" "FFS"
5236822-5241629 em4305: write_mode_exit: "Write mode exit"
5242830-5260750 em4305: first_field_stop: "First field stop" "Field stop" "FFS"
5260750-5265557 em4305: write_mode_exit: "Write mode exit"
5266727-5284647 em4305: first_field_stop: "First field stop" "Field stop" "FFS"
5284647-5289453 em4305: write_mode_exit: "Write mode exit"
5290623-5308543 em4305: first_field_stop: "First field stop" "Field stop" "FFS"
5308543-5313350 em4305: write_mode_exit: "Write mode exit"
5314528-5332448 em4305: first_field_stop: "First field stop" "Field stop" "FFS"
5332448-5337254 em4305: write_mode_exit: "Write mode exit"
5338456-5356346 em4305: first_field_stop: "First field stop" "Field stop" "FFS"
5356346-5361152 em4305: write_mode_exit: "Write mode exit"
5362354-5380274 em4305: first_field_stop: "First field stop" "Field stop" "FFS"
5380274-5385081 em4305: write_mode_exit: "Write mode exit"
5806765-5807544 em4305: first_field_stop: "First field stop" "Field stop" "FFS"
5807544-5808229 em4305: bit_value: "0"
5808229-5808923 em4305: bit_value: "0"
5808923-5809617 em4305: bit_value: "0"
5809617-5810129 em4305: bit_value: "1"
5810129-5810641 em4305: bit_value: "1"
5810641-5811345 em4305: bit_value: "0"
5811345-5812030 em4305: bit_value: "0"
5812030-5812723 em4305: bit_value: "0"
5812723-5813409 em4305: bit_value: "0"
5813409-5814094 em4305: bit_value: "0"
5814094-5814788 em4305: bit_value: "0"
5814788-5815473 em4305: bit_value: "0"
5815473-5816159 em4305: bit_value: "0"
5816159-5816852 em4305: bit_value: "0"
5816852-5817538 em4305: bit_value: "0"
5817538-5818223 em4305: bit_value: "0"
5818223-5818916 em4305: bit_value: "0"
5818916-5819602 em4305: bit_value: "0"
5819602-5820287 em4305: bit_value: "0"
5820287-5820981 em4305: bit_value: "0"
5820981-5821666 em4305: bit_value: "0"
5821666-5822352 em4305: bit_value: "0"
5822352-5823037 em4305: bit_value: "0"
5823037-5823730 em4305: bit_value: "0"
5823730-5824416 em4305: bit_value: "0"
5824416-5825101 em4305: bit_value: "0"
5825101-5825795 em4305: bit_value: "0"
5825795-5826480 em4305: bit_value: "0"
5826480-5827166 em4305: bit_value: "0"
5827166-5827859 em4305: bit_value: "0"
5827859-5828544 em4305: bit_value: "0"
5828544-5829230 em4305: bit_value: "0"
5829230-5829923 em4305: bit_value: "0"
5829923-5830609 em4305: bit_value: "0"
5830609-5831294 em4305: bit_value: "0"
5831294-5831988 em4305: bit_value: "0"
5831988-5832673 em4305: bit_value: "0"
5832673-5833358 em4305: bit_value: "0"
5833358-5834052 em4305: bit_value: "0"
5834052-5834737 em4305: bit_value: "0"
5834737-5835423 em4305: bit_value: "0"
5835423-5836116 em4305: bit_value: "0"
5836116-5836802 em4305: bit_value: "0"
5836802-5837487 em4305: bit_value: "0"
5837487-5838172 em4305: bit_value: "0"
5838172-5838866 em4305: bit_value: "0"
5838866-5839551 em4305: bit_value: "0"
5839551-5840237 em4305: bit_value: "0"
5840237-5840930 em4305: bit_value: "0"
5840930-5841612 em4305: bit_value: "0"
5841612-5846419 em4305: write_mode_exit: "Write mode exit"
5807544-5808229 em4305: bit: "Logic zero"
5808229-5810641 em4305: bit: "Command" "Cmd" "C"
5810641-5841612 em4305: bit: "Password" "Passwd" "Pass" "P"
5808229-5810129 em4305: opcode: "Login"
5810129-5810641 em4305: opcode: "Row parity OK" "Parity OK" "OK"
5810641-5816159 em4305: address: "Data: 0" "0"
5816159-5816852 em4305: opcode: "Row parity OK" "Parity OK" "OK"
5816852-5822352 em4305: address: "Data: 0" "0"
5822352-5823037 em4305: opcode: "Row parity OK" "Parity OK" "OK"
5823037-5828544 em4305: address: "Data: 0" "0"
5828544-5829230 em4305: opcode: "Row parity OK" "Parity OK" "OK"
5829230-5834737 em4305: address: "Data: 0" "0"
5834737-5835423 em4305: opcode: "Row parity OK" "Parity OK" "OK"
5835423-5840930 em4305: opcode: "Column parity OK" "Parity OK" "OK"
5840930-5841612 em4305: opcode: "Stop bit" "Stop" "SB"
5815473-5839551 em4305: bitrate: "Login password: 0"
5903937-5904715 em4305: first_field_stop: "First field stop" "Field stop" "FFS"
5904715-5905401 em4305: bit_value: "0"
5905401-5906095 em4305: bit_value: "0"
5906095-5906607 em4305: bit_value: "1"
5906607-5907314 em4305: bit_value: "0"
5907314-5907826 em4305: bit_value: "1"
5907826-5908338 em4305: bit_value: "1"
5908338-5909043 em4305: bit_value: "0"
5909043-5909555 em4305: bit_value: "1"
5909555-5910253 em4305: bit_value: "0"
5910253-5910939 em4305: bit_value: "0"
5910939-5911624 em4305: bit_value: "0"
5911624-5912326 em4305: bit_value: "0"
5912326-5912838 em4305: bit_value: "1"
5912838-5913350 em4305: bit_value: "1"
5913350-5913862 em4305: bit_value: "1"
5913862-5914374 em4305: bit_value: "1"
5914374-5914886 em4305: bit_value: "1"
5914886-5915398 em4305: bit_value: "1"
5915398-5915910 em4305: bit_value: "1"
5915910-5916422 em4305: bit_value: "1"
5916422-5917206 em4305: bit_value: "0"
5917206-5917718 em4305: bit_value: "1"
5917718-5918409 em4305: bit_value: "0"
5918409-5919094 em4305: bit_value: "0"
5919094-5919780 em4305: bit_value: "0"
5919780-5920473 em4305: bit_value: "0"
5920473-5921159 em4305: bit_value: "0"
5921159-5921844 em4305: bit_value: "0"
5921844-5922546 em4305: bit_value: "0"
5922546-5923058 em4305: bit_value: "1"
5923058-5923570 em4305: bit_value: "1"
5923570-5924283 em4305: bit_value: "0"
5924283-5924795 em4305: bit_value: "1"
5924795-5925485 em4305: bit_value: "0"
5925485-5926171 em4305: bit_value: "0"
5926171-5926856 em4305: bit_value: "0"
5926856-5927550 em4305: bit_value: "0"
5927550-5928235 em4305: bit_value: "0"
5928235-5928921 em4305: bit_value: "0"
5928921-5929614 em4305: bit_value: "0"
5929614-5930299 em4305: bit_value: "0"
5930299-5930985 em4305: bit_value: "0"
5930985-5931678 em4305: bit_value: "0"
5931678-5932372 em4305: bit_value: "0"
5932372-5932884 em4305: bit_value: "1"
5932884-5933396 em4305: bit_value: "1"
5933396-5933908 em4305: bit_value: "1"
5933908-5934420 em4305: bit_value: "1"
5934420-5934932 em4305: bit_value: "1"
5934932-5935444 em4305: bit_value: "1"
5935444-5936202 em4305: bit_value: "0"
5936202-5936714 em4305: bit_value: "1"
5936714-5937226 em4305: bit_value: "1"
5937226-5937930 em4305: bit_value: "0"
5937930-5938623 em4305: bit_value: "0"
5938623-5939309 em4305: bit_value: "0"
5939309-5939991 em4305: bit_value: "0"
5939991-5944797 em4305: write_mode_exit: "Write mode exit"
5904715-5905401 em4305: bit: "Logic zero" "LZ"
5905401-5907826 em4305: bit: "Command" "Cmd" "C"
5907826-5912326 em4305: bit: "Address" "Addr" "A"
5912326-5939991 em4305: bit: "Data" "Da" "D"
5905401-5907314 em4305: opcode: "Write word"
5907314-5907826 em4305: opcode: "Row parity OK" "Parity OK" "OK"
5907826-5910253 em4305: address: "Addr: 5" "5"
5910253-5911624 em4305: opcode: "Zero bits" "ZB"
5911624-5912326 em4305: opcode: "Row parity OK" "Parity OK" "OK"
5912326-5916422 em4305: address: "Data: FF" "FF"
5916422-5917206 em4305: opcode: "Row parity OK" "Parity OK" "OK"
5917206-5922546 em4305: address: "Data: 80" "80"
5922546-5923058 em4305: opcode: "Row parity OK" "Parity OK" "OK"
5923058-5928235 em4305: address: "Data: A0" "A0"
5928235-5928921 em4305: opcode: "Row parity OK" "Parity OK" "OK"
5928921-5933908 em4305: address: "Data: 7" "7"
5933908-5934420 em4305: opcode: "Row parity OK" "Parity OK" "OK"
5934420-5939309 em4305: opcode: "Column parity OK" "Parity OK" "OK"
5939309-5939991 em4305: opcode: "Stop bit" "Stop" "SB"
5912326-5917718 em4305: bitrate: "EM4100 header" "EM header" "Header" "H"
5917718-5920473 em4305: bitrate: "0"
5921159-5924283 em4305: bitrate: "2"
5924795-5927550 em4305: bitrate: "0"
5928921-5931678 em4305: bitrate: "0"
5932372-5933908 em4305: bitrate: "Partial nibble"
6002339-6003118 em4305: first_field_stop: "First field stop" "Field stop" "FFS"
6003118-6003803 em4305: bit_value: "0"
6003803-6004505 em4305: bit_value: "0"
6004505-6005017 em4305: bit_value: "1"
6005017-6005716 em4305: bit_value: "0"
6005716-6006228 em4305: bit_value: "1"
6006228-6006928 em4305: bit_value: "0"
6006928-6007440 em4305: bit_value: "1"
6007440-6007952 em4305: bit_value: "1"
6007952-6008656 em4305: bit_value: "0"
6008656-6009341 em4305: bit_value: "0"
6009341-6010027 em4305: bit_value: "0"
6010027-6010729 em4305: bit_value: "0"
6010729-6011241 em4305: bit_value: "1"
6011241-6011931 em4305: bit_value: "0"
6011931-6012625 em4305: bit_value: "0"
6012625-6013137 em4305: bit_value: "1"
6013137-6013837 em4305: bit_value: "0"
6013837-6014349 em4305: bit_value: "1"
6014349-6015048 em4305: bit_value: "0"
6015048-6015560 em4305: bit_value: "1"
6015560-6016260 em4305: bit_value: "0"
6016260-6016772 em4305: bit_value: "1"
6016772-6017284 em4305: bit_value: "1"
6017284-6017996 em4305: bit_value: "0"
6017996-6018508 em4305: bit_value: "1"
6018508-6019020 em4305: bit_value: "1"
6019020-6019532 em4305: bit_value: "1"
6019532-6020258 em4305: bit_value: "0"
6020258-6020770 em4305: bit_value: "1"
6020770-6021469 em4305: bit_value: "0"
6021469-6021981 em4305: bit_value: "1"
6021981-6022493 em4305: bit_value: "1"
6022493-6023197 em4305: bit_value: "0"
6023197-6023883 em4305: bit_value: "0"
6023883-6024585 em4305: bit_value: "0"
6024585-6025097 em4305: bit_value: "1"
6025097-6025609 em4305: bit_value: "1"
6025609-6026121 em4305: bit_value: "1"
6026121-6026633 em4305: bit_value: "1"
6026633-6027364 em4305: bit_value: "0"
6027364-6027876 em4305: bit_value: "1"
6027876-6028388 em4305: bit_value: "1"
6028388-6028900 em4305: bit_value: "1"
6028900-6029412 em4305: bit_value: "1"
6029412-6029924 em4305: bit_value: "1"
6029924-6030667 em4305: bit_value: "0"
6030667-6031361 em4305: bit_value: "0"
6031361-6031873 em4305: bit_value: "1"
6031873-6032385 em4305: bit_value: "1"
6032385-6032897 em4305: bit_value: "1"
6032897-6033409 em4305: bit_value: "1"
6033409-6033921 em4305: bit_value: "1"
6033921-6034665 em4305: bit_value: "0"
6034665-6035359 em4305: bit_value: "0"
6035359-6035871 em4305: bit_value: "1"
6035871-6036383 em4305: bit_value: "1"
6036383-6037084 em4305: bit_value: "0"
6037084-6041890 em4305: write_mode_exit: "Write mode exit"
6003118-6003803 em4305: bit: "Logic zero" "LZ"
6003803-6006228 em4305: bit: "Command" "Cmd" "C"
6006228-6010729 em4305: bit: "Address" "Addr" "A"
6010729-6037084 em4305: bit: "Data" "Da" "D"
6003803-6005716 em4305: opcode: "Write word"
6005716-6006228 em4305: opcode: "Row parity OK" "Parity OK" "OK"
6006228-6008656 em4305: address: "Addr: 6" "6"
6008656-6010027 em4305: opcode: "Zero bits" "ZB"
6010027-6010729 em4305: opcode: "Row parity OK" "Parity OK" "OK"
6010729-6015560 em4305: address: "Data: 95" "95"
6015560-6016260 em4305: opcode: "Row parity OK" "Parity OK" "OK"
6016260-6020770 em4305: address: "Data: DD" "DD"
6020770-6021469 em4305: opcode: "Row parity OK" "Parity OK" "OK"
6021469-6026121 em4305: address: "Data: C7" "C7"
6026121-6026633 em4305: opcode: "Row parity OK" "Parity OK" "OK"
6026633-6031361 em4305: address: "Data: 7C" "7C"
6031361-6031873 em4305: opcode: "Row parity OK" "Parity OK" "OK"
6031873-6036383 em4305: opcode: "Column parity OK" "Parity OK" "OK"
6036383-6037084 em4305: opcode: "Stop bit" "Stop" "SB"
6010729-6011241 em4305: bitrate: "F"
6011931-6014349 em4305: bitrate: "5"
6015048-6017996 em4305: bitrate: "E"
6018508-6020770 em4305: bitrate: "D"
6021981-6024585 em4305: bitrate: "8"
6025097-6027876 em4305: bitrate: "D"
6028388-6031361 em4305: bitrate: "EM4100 trailer"
6099448-6100226 em4305: first_field_stop: "First field stop" "Field stop" "FFS"
6100226-6100920 em4305: bit_value: "0"
6100920-6101614 em4305: bit_value: "0"
6101614-6102126 em4305: bit_value: "1"
6102126-6102825 em4305: bit_value: "0"
6102825-6103337 em4305: bit_value: "1"
6103337-6104028 em4305: bit_value: "0"
6104028-6104722 em4305: bit_value: "0"
6104722-6105234 em4305: bit_value: "1"
6105234-6105925 em4305: bit_value: "0"
6105925-6106618 em4305: bit_value: "0"
6106618-6107312 em4305: bit_value: "0"
6107312-6107824 em4305: bit_value: "1"
6107824-6108336 em4305: bit_value: "1"
6108336-6108848 em4305: bit_value: "1"
6108848-6109360 em4305: bit_value: "1"
6109360-6109872 em4305: bit_value: "1"
6109872-6110384 em4305: bit_value: "1"
6110384-6111142 em4305: bit_value: "0"
6111142-6111654 em4305: bit_value: "1"
6111654-6112352 em4305: bit_value: "0"
6112352-6113038 em4305: bit_value: "0"
6113038-6113723 em4305: bit_value: "0"
6113723-6114417 em4305: bit_value: "0"
6114417-6115102 em4305: bit_value: "0"
6115102-6115788 em4305: bit_value: "0"
6115788-6116473 em4305: bit_value: "0"
6116473-6117166 em4305: bit_value: "0"
6117166-6117861 em4305: bit_value: "0"
6117861-6118373 em4305: bit_value: "1"
6118373-6118885 em4305: bit_value: "1"
6118885-6119397 em4305: bit_value: "1"
6119397-6120114 em4305: bit_value: "0"
6120114-6120799 em4305: bit_value: "0"
6120799-6121501 em4305: bit_value: "0"
6121501-6122013 em4305: bit_value: "1"
6122013-6122704 em4305: bit_value: "0"
6122704-6123389 em4305: bit_value: "0"
6123389-6124075 em4305: bit_value: "0"
6124075-6124768 em4305: bit_value: "0"
6124768-6125454 em4305: bit_value: "0"
6125454-6126139 em4305: bit_value: "0"
6126139-6126832 em4305: bit_value: "0"
6126832-6127518 em4305: bit_value: "0"
6127518-6128203 em4305: bit_value: "0"
6128203-6128897 em4305: bit_value: "0"
6128897-6129582 em4305: bit_value: "0"
6129582-6130268 em4305: bit_value: "0"
6130268-6130953 em4305: bit_value: "0"
6130953-6131655 em4305: bit_value: "0"
6131655-6132167 em4305: bit_value: "1"
6132167-6132679 em4305: bit_value: "1"
6132679-6133191 em4305: bit_value: "1"
6133191-6133908 em4305: bit_value: "0"
6133908-6134602 em4305: bit_value: "0"
6134602-6135114 em4305: bit_value: "1"
6135114-6135626 em4305: bit_value: "1"
6135626-6136327 em4305: bit_value: "0"
6136327-6141133 em4305: write_mode_exit: "Write mode exit"
6100226-6100920 em4305: bit: "Logic zero" "LZ"
6100920-6103337 em4305: bit: "Command" "Cmd" "C"
6103337-6107824 em4305: bit: "Address" "Addr" "A"
6107824-6136327 em4305: bit: "Data" "Da" "D"
6100920-6102825 em4305: opcode: "Write word"
6102825-6103337 em4305: opcode: "Row parity OK" "Parity OK" "OK"
6103337-6105925 em4305: address: "Addr: 4" "4"
6105925-6107312 em4305: opcode: "Zero bits" "ZB"
6107312-6107824 em4305: opcode: "Row parity OK" "Parity OK" "OK"
6107824-6112352 em4305: address: "Data: FA" "FA"
6112352-6113038 em4305: opcode: "Row parity OK" "Parity OK" "OK"
6113038-6118373 em4305: address: "Data: 1" "1"
6118373-6118885 em4305: opcode: "Row parity OK" "Parity OK" "OK"
6118885-6124075 em4305: address: "Data: 88" "88"
6124075-6124768 em4305: opcode: "Row parity OK" "Parity OK" "OK"
6124768-6130268 em4305: address: "Data: 0" "0"
6130268-6130953 em4305: opcode: "Row parity OK" "Parity OK" "OK"
6130953-6135626 em4305: opcode: "Column parity OK" "Parity OK" "OK"
6135626-6136327 em4305: opcode: "Stop bit" "Stop" "SB"
6107824-6111142 em4305: bitrate: "Data rate: RF/64" "RF/64"
6111142-6114417 em4305: bitrate: "Encoder: Manchester" "Manchester"
6114417-6115788 em4305: bitrate: "Zero bits" "ZB"
6115788-6117166 em4305: bitrate: "Delayed on: No delay" "No delay"
6117166-6120114 em4305: bitrate: "Last default read word: 6" "LWR: 6" "6"
6120114-6120799 em4305: bitrate: "Read login: 0" "0"
6120799-6121501 em4305: bitrate: "Zero bits" "ZB"
6121501-6122013 em4305: bitrate: "Write login: 1" "1"
6122013-6123389 em4305: bitrate: "Zero bits" "ZB"
6123389-6124075 em4305: bitrate: "Disable: 0" "0"
6124768-6125454 em4305: bitrate: "Reader talk first: 0" "RTF: 0"
6125454-6126139 em4305: bitrate: "Zero bits" "ZB"
6126139-6126832 em4305: bitrate: "Pigeon mode: 0" "0"
6126832-6130268 em4305: bitrate: "Reserved" "Res" "R"
6493976-6792005 em4305: first_field_stop: "First field stop" "Field stop" "FFS"
6792005-6796812 em4305: write_mode_exit: "Write mode exit"
