10190-10270 mcp230xx: register_write: "Write IODIRA: 00" "W00"
10510-10590 mcp230xx: register_write: "Write IODIRB: 00" "W00"
10832-10912 mcp230xx: register_write: "Write OLATA: 00" "W00"
21226-21306 mcp230xx: register_write: "Write OLATA: 01" "W01"
31603-31683 mcp230xx: register_write: "Write OLATA: 02" "W02"
41984-42064 mcp230xx: register_write: "Write OLATA: 03" "W03"
52365-52445 mcp230xx: register_write: "Write OLATA: 04" "W04"
62795-62875 mcp230xx: register_write: "Write OLATA: 05" "W05"
73178-73258 mcp230xx: register_write: "Write OLATA: 06" "W06"
83559-83639 mcp230xx: register_write: "Write OLATA: 07" "W07"
93938-94018 mcp230xx: register_write: "Write OLATA: 08" "W08"
104320-104400 mcp230xx: register_write: "Write OLATA: 09" "W09"
114700-114780 mcp230xx: register_write: "Write OLATA: 0A" "W0A"
125079-125159 mcp230xx: register_write: "Write OLATA: 0B" "W0B"
135459-135539 mcp230xx: register_write: "Write OLATA: 0C" "W0C"
145837-145917 mcp230xx: register_write: "Write OLATA: 0D" "W0D"
156218-156298 mcp230xx: register_write: "Write OLATA: 0E" "W0E"
166598-166678 mcp230xx: register_write: "Write OLATA: 0F" "W0F"
176977-177057 mcp230xx: register_write: "Write OLATA: 10" "W10"
187357-187437 mcp230xx: register_write: "Write OLATA: 11" "W11"
197735-197815 mcp230xx: register_write: "Write OLATA: 12" "W12"
208114-208194 mcp230xx: register_write: "Write OLATA: 13" "W13"
218495-218575 mcp230xx: register_write: "Write OLATA: 14" "W14"
228874-228954 mcp230xx: register_write: "Write OLATA: 15" "W15"
239254-239334 mcp230xx: register_write: "Write OLATA: 16" "W16"
249633-249713 mcp230xx: register_write: "Write OLATA: 17" "W17"
260011-260091 mcp230xx: register_write: "Write OLATA: 18" "W18"
270391-270471 mcp230xx: register_write: "Write OLATA: 19" "W19"
280769-280849 mcp230xx: register_write: "Write OLATA: 1A" "W1A"
291149-291229 mcp230xx: register_write: "Write OLATA: 1B" "W1B"
301527-301607 mcp230xx: register_write: "Write OLATA: 1C" "W1C"
311906-311986 mcp230xx: register_write: "Write OLATA: 1D" "W1D"
322287-322367 mcp230xx: register_write: "Write OLATA: 1E" "W1E"
332667-332747 mcp230xx: register_write: "Write OLATA: 1F" "W1F"
343046-343126 mcp230xx: register_write: "Write OLATA: 20" "W20"
353425-353505 mcp230xx: register_write: "Write OLATA: 21" "W21"
363805-363885 mcp230xx: register_write: "Write OLATA: 22" "W22"
374183-374263 mcp230xx: register_write: "Write OLATA: 23" "W23"
384563-384643 mcp230xx: register_write: "Write OLATA: 24" "W24"
394941-395021 mcp230xx: register_write: "Write OLATA: 25" "W25"
405321-405401 mcp230xx: register_write: "Write OLATA: 26" "W26"
415699-415779 mcp230xx: register_write: "Write OLATA: 27" "W27"
426080-426160 mcp230xx: register_write: "Write OLATA: 28" "W28"
436460-436540 mcp230xx: register_write: "Write OLATA: 29" "W29"
446839-446919 mcp230xx: register_write: "Write OLATA: 2A" "W2A"
457218-457298 mcp230xx: register_write: "Write OLATA: 2B" "W2B"
467598-467678 mcp230xx: register_write: "Write OLATA: 2C" "W2C"
477977-478057 mcp230xx: register_write: "Write OLATA: 2D" "W2D"
488356-488436 mcp230xx: register_write: "Write OLATA: 2E" "W2E"
498743-498823 mcp230xx: register_write: "Write OLATA: 2F" "W2F"
509123-509203 mcp230xx: register_write: "Write OLATA: 30" "W30"
519502-519582 mcp230xx: register_write: "Write OLATA: 31" "W31"
529881-529961 mcp230xx: register_write: "Write OLATA: 32" "W32"
540261-540341 mcp230xx: register_write: "Write OLATA: 33" "W33"
550640-550720 mcp230xx: register_write: "Write OLATA: 34" "W34"
561018-561098 mcp230xx: register_write: "Write OLATA: 35" "W35"
571398-571478 mcp230xx: register_write: "Write OLATA: 36" "W36"
581777-581857 mcp230xx: register_write: "Write OLATA: 37" "W37"
592157-592237 mcp230xx: register_write: "Write OLATA: 38" "W38"
602537-602617 mcp230xx: register_write: "Write OLATA: 39" "W39"
612917-612997 mcp230xx: register_write: "Write OLATA: 3A" "W3A"
623294-623374 mcp230xx: register_write: "Write OLATA: 3B" "W3B"
633675-633755 mcp230xx: register_write: "Write OLATA: 3C" "W3C"
644053-644133 mcp230xx: register_write: "Write OLATA: 3D" "W3D"
654433-654513 mcp230xx: register_write: "Write OLATA: 3E" "W3E"
664813-664893 mcp230xx: register_write: "Write OLATA: 3F" "W3F"
675193-675273 mcp230xx: register_write: "Write OLATA: 40" "W40"
685572-685652 mcp230xx: register_write: "Write OLATA: 41" "W41"
695951-696031 mcp230xx: register_write: "Write OLATA: 42" "W42"
706365-706445 mcp230xx: register_write: "Write OLATA: 43" "W43"
717080-717280 mcp230xx: register_write: "Write OLATA: 44" "W44"
727954-728154 mcp230xx: register_write: "Write OLATA: 45" "W45"
738830-739030 mcp230xx: register_write: "Write OLATA: 46" "W46"
749705-749905 mcp230xx: register_write: "Write OLATA: 47" "W47"
760581-760781 mcp230xx: register_write: "Write OLATA: 48" "W48"
771452-771652 mcp230xx: register_write: "Write OLATA: 49" "W49"
782326-782526 mcp230xx: register_write: "Write OLATA: 4A" "W4A"
793205-793405 mcp230xx: register_write: "Write OLATA: 4B" "W4B"
804080-804280 mcp230xx: register_write: "Write OLATA: 4C" "W4C"
814979-815179 mcp230xx: register_write: "Write OLATA: 4D" "W4D"
825857-826057 mcp230xx: register_write: "Write OLATA: 4E" "W4E"
836726-836926 mcp230xx: register_write: "Write OLATA: 4F" "W4F"
847598-847798 mcp230xx: register_write: "Write OLATA: 50" "W50"
858474-858674 mcp230xx: register_write: "Write OLATA: 51" "W51"
869350-869550 mcp230xx: register_write: "Write OLATA: 52" "W52"
880221-880421 mcp230xx: register_write: "Write OLATA: 53" "W53"
891097-891297 mcp230xx: register_write: "Write OLATA: 54" "W54"
901968-902168 mcp230xx: register_write: "Write OLATA: 55" "W55"
912845-913045 mcp230xx: register_write: "Write OLATA: 56" "W56"
923745-923945 mcp230xx: register_write: "Write OLATA: 57" "W57"
934622-934822 mcp230xx: register_write: "Write OLATA: 58" "W58"
945494-945694 mcp230xx: register_write: "Write OLATA: 59" "W59"
956369-956569 mcp230xx: register_write: "Write OLATA: 5A" "W5A"
967243-967443 mcp230xx: register_write: "Write OLATA: 5B" "W5B"
978115-978315 mcp230xx: register_write: "Write OLATA: 5C" "W5C"
988991-989191 mcp230xx: register_write: "Write OLATA: 5D" "W5D"
