10190-10270 mcp230xx: register_write: "Write IODIRA: 00" "W00"
10280-10360 mcp230xx: register_write: "Write IODIRB: 00" "W00"
10615-10695 mcp230xx: register_write: "Write IODIRA: 00" "W00"
10705-10785 mcp230xx: register_write: "Write IODIRB: 00" "W00"
10795-10875 mcp230xx: register_write: "Write IPOLA: 00" "W00"
10885-10965 mcp230xx: register_write: "Write IPOLB: 00" "W00"
10975-11055 mcp230xx: register_write: "Write GPINTENA: 00" "W00"
11065-11145 mcp230xx: register_write: "Write GPINTENB: 00" "W00"
11155-11235 mcp230xx: register_write: "Write DEFVALA: 00" "W00"
11245-11325 mcp230xx: register_write: "Write DEFVALB: 00" "W00"
11335-11415 mcp230xx: register_write: "Write INTCONA: 00" "W00"
11425-11505 mcp230xx: register_write: "Write INTCONB: 00" "W00"
11515-11595 mcp230xx: register_write: "Write IOCON: 00" "W00"
11605-11685 mcp230xx: register_write: "Write IOCON: 00" "W00"
11695-11775 mcp230xx: register_write: "Write GPPUA: 00" "W00"
11785-11865 mcp230xx: register_write: "Write GPPUB: 00" "W00"
11875-11955 mcp230xx: register_write: "Write INTFA: 00" "W00"
11965-12045 mcp230xx: register_write: "Write INTFB: 00" "W00"
12055-12135 mcp230xx: register_write: "Write INTCAPA: 00" "W00"
12145-12225 mcp230xx: register_write: "Write INTCAPB: 00" "W00"
12519-12599 mcp230xx: register_write: "Write OLATA: 00" "W00"
12609-12689 mcp230xx: register_write: "Write OLATB: FF" "WFF"
23055-23135 mcp230xx: register_write: "Write OLATA: 01" "W01"
23145-23225 mcp230xx: register_write: "Write OLATB: FE" "WFE"
33580-33660 mcp230xx: register_write: "Write OLATA: 02" "W02"
33670-33750 mcp230xx: register_write: "Write OLATB: FD" "WFD"
44152-44232 mcp230xx: register_write: "Write OLATA: 03" "W03"
44242-44322 mcp230xx: register_write: "Write OLATB: FC" "WFC"
54777-54857 mcp230xx: register_write: "Write OLATA: 04" "W04"
54867-54947 mcp230xx: register_write: "Write OLATB: FB" "WFB"
65302-65382 mcp230xx: register_write: "Write OLATA: 05" "W05"
65392-65472 mcp230xx: register_write: "Write OLATB: FA" "WFA"
75857-75937 mcp230xx: register_write: "Write OLATA: 06" "W06"
75947-76027 mcp230xx: register_write: "Write OLATB: F9" "WF9"
86408-86488 mcp230xx: register_write: "Write OLATA: 07" "W07"
86498-86578 mcp230xx: register_write: "Write OLATB: F8" "WF8"
96925-97005 mcp230xx: register_write: "Write OLATA: 08" "W08"
97015-97095 mcp230xx: register_write: "Write OLATB: F7" "WF7"
107432-107512 mcp230xx: register_write: "Write OLATA: 09" "W09"
107522-107602 mcp230xx: register_write: "Write OLATB: F6" "WF6"
117906-117986 mcp230xx: register_write: "Write OLATA: 0A" "W0A"
117996-118076 mcp230xx: register_write: "Write OLATB: F5" "WF5"
128375-128455 mcp230xx: register_write: "Write OLATA: 0B" "W0B"
128465-128545 mcp230xx: register_write: "Write OLATB: F4" "WF4"
138843-138923 mcp230xx: register_write: "Write OLATA: 0C" "W0C"
138933-139013 mcp230xx: register_write: "Write OLATB: F3" "WF3"
149311-149391 mcp230xx: register_write: "Write OLATA: 0D" "W0D"
149401-149481 mcp230xx: register_write: "Write OLATB: F2" "WF2"
159778-159858 mcp230xx: register_write: "Write OLATA: 0E" "W0E"
159868-159948 mcp230xx: register_write: "Write OLATB: F1" "WF1"
170245-170325 mcp230xx: register_write: "Write OLATA: 0F" "W0F"
170335-170415 mcp230xx: register_write: "Write OLATB: F0" "WF0"
180712-180792 mcp230xx: register_write: "Write OLATA: 10" "W10"
180802-180882 mcp230xx: register_write: "Write OLATB: EF" "WEF"
191179-191259 mcp230xx: register_write: "Write OLATA: 11" "W11"
191269-191349 mcp230xx: register_write: "Write OLATB: EE" "WEE"
201650-201730 mcp230xx: register_write: "Write OLATA: 12" "W12"
201740-201820 mcp230xx: register_write: "Write OLATB: ED" "WED"
212118-212198 mcp230xx: register_write: "Write OLATA: 13" "W13"
212208-212288 mcp230xx: register_write: "Write OLATB: EC" "WEC"
222585-222665 mcp230xx: register_write: "Write OLATA: 14" "W14"
222675-222755 mcp230xx: register_write: "Write OLATB: EB" "WEB"
233053-233133 mcp230xx: register_write: "Write OLATA: 15" "W15"
233143-233223 mcp230xx: register_write: "Write OLATB: EA" "WEA"
243521-243601 mcp230xx: register_write: "Write OLATA: 16" "W16"
243611-243691 mcp230xx: register_write: "Write OLATB: E9" "WE9"
254006-254086 mcp230xx: register_write: "Write OLATA: 17" "W17"
254096-254176 mcp230xx: register_write: "Write OLATB: E8" "WE8"
264474-264554 mcp230xx: register_write: "Write OLATA: 18" "W18"
264564-264644 mcp230xx: register_write: "Write OLATB: E7" "WE7"
274943-275023 mcp230xx: register_write: "Write OLATA: 19" "W19"
275033-275113 mcp230xx: register_write: "Write OLATB: E6" "WE6"
285411-285491 mcp230xx: register_write: "Write OLATA: 1A" "W1A"
285501-285581 mcp230xx: register_write: "Write OLATB: E5" "WE5"
295879-295959 mcp230xx: register_write: "Write OLATA: 1B" "W1B"
295969-296049 mcp230xx: register_write: "Write OLATB: E4" "WE4"
306347-306427 mcp230xx: register_write: "Write OLATA: 1C" "W1C"
306437-306517 mcp230xx: register_write: "Write OLATB: E3" "WE3"
316817-316895 mcp230xx: register_write: "Write OLATA: 1D" "W1D"
316906-316988 mcp230xx: register_write: "Write OLATB: E2" "WE2"
327284-327364 mcp230xx: register_write: "Write OLATA: 1E" "W1E"
327374-327454 mcp230xx: register_write: "Write OLATB: E1" "WE1"
337752-337832 mcp230xx: register_write: "Write OLATA: 1F" "W1F"
337842-337922 mcp230xx: register_write: "Write OLATB: E0" "WE0"
348223-348303 mcp230xx: register_write: "Write OLATA: 20" "W20"
348313-348393 mcp230xx: register_write: "Write OLATB: DF" "WDF"
358692-358772 mcp230xx: register_write: "Write OLATA: 21" "W21"
358782-358862 mcp230xx: register_write: "Write OLATB: DE" "WDE"
369193-369273 mcp230xx: register_write: "Write OLATA: 22" "W22"
369283-369363 mcp230xx: register_write: "Write OLATB: DD" "WDD"
379993-380193 mcp230xx: register_write: "Write OLATA: 23" "W23"
380218-380418 mcp230xx: register_write: "Write OLATB: DC" "WDC"
391091-391291 mcp230xx: register_write: "Write OLATA: 24" "W24"
391316-391516 mcp230xx: register_write: "Write OLATB: DB" "WDB"
402188-402388 mcp230xx: register_write: "Write OLATA: 25" "W25"
402413-402613 mcp230xx: register_write: "Write OLATB: DA" "WDA"
413283-413483 mcp230xx: register_write: "Write OLATA: 26" "W26"
413508-413708 mcp230xx: register_write: "Write OLATB: D9" "WD9"
424381-424581 mcp230xx: register_write: "Write OLATA: 27" "W27"
424606-424806 mcp230xx: register_write: "Write OLATB: D8" "WD8"
435475-435675 mcp230xx: register_write: "Write OLATA: 28" "W28"
435700-435900 mcp230xx: register_write: "Write OLATB: D7" "WD7"
446571-446771 mcp230xx: register_write: "Write OLATA: 29" "W29"
446796-446996 mcp230xx: register_write: "Write OLATB: D6" "WD6"
457666-457866 mcp230xx: register_write: "Write OLATA: 2A" "W2A"
457891-458091 mcp230xx: register_write: "Write OLATB: D5" "WD5"
468763-468963 mcp230xx: register_write: "Write OLATA: 2B" "W2B"
468988-469188 mcp230xx: register_write: "Write OLATB: D4" "WD4"
479882-480082 mcp230xx: register_write: "Write OLATA: 2C" "W2C"
480107-480307 mcp230xx: register_write: "Write OLATB: D3" "WD3"
490982-491182 mcp230xx: register_write: "Write OLATA: 2D" "W2D"
491207-491407 mcp230xx: register_write: "Write OLATB: D2" "WD2"
502078-502278 mcp230xx: register_write: "Write OLATA: 2E" "W2E"
502303-502503 mcp230xx: register_write: "Write OLATB: D1" "WD1"
513172-513372 mcp230xx: register_write: "Write OLATA: 2F" "W2F"
513397-513597 mcp230xx: register_write: "Write OLATB: D0" "WD0"
524275-524475 mcp230xx: register_write: "Write OLATA: 30" "W30"
524500-524700 mcp230xx: register_write: "Write OLATB: CF" "WCF"
535369-535569 mcp230xx: register_write: "Write OLATA: 31" "W31"
535594-535794 mcp230xx: register_write: "Write OLATB: CE" "WCE"
546461-546661 mcp230xx: register_write: "Write OLATA: 32" "W32"
546686-546886 mcp230xx: register_write: "Write OLATB: CD" "WCD"
557557-557757 mcp230xx: register_write: "Write OLATA: 33" "W33"
557782-557982 mcp230xx: register_write: "Write OLATB: CC" "WCC"
568652-568852 mcp230xx: register_write: "Write OLATA: 34" "W34"
568877-569077 mcp230xx: register_write: "Write OLATB: CB" "WCB"
579747-579947 mcp230xx: register_write: "Write OLATA: 35" "W35"
579972-580172 mcp230xx: register_write: "Write OLATB: CA" "WCA"
590843-591043 mcp230xx: register_write: "Write OLATA: 36" "W36"
591068-591268 mcp230xx: register_write: "Write OLATB: C9" "WC9"
601939-602139 mcp230xx: register_write: "Write OLATA: 37" "W37"
602164-602364 mcp230xx: register_write: "Write OLATB: C8" "WC8"
613032-613232 mcp230xx: register_write: "Write OLATA: 38" "W38"
613257-613457 mcp230xx: register_write: "Write OLATB: C7" "WC7"
624129-624329 mcp230xx: register_write: "Write OLATA: 39" "W39"
624354-624554 mcp230xx: register_write: "Write OLATB: C6" "WC6"
635228-635428 mcp230xx: register_write: "Write OLATA: 3A" "W3A"
635453-635653 mcp230xx: register_write: "Write OLATB: C5" "WC5"
646322-646522 mcp230xx: register_write: "Write OLATA: 3B" "W3B"
646547-646747 mcp230xx: register_write: "Write OLATB: C4" "WC4"
657418-657618 mcp230xx: register_write: "Write OLATA: 3C" "W3C"
657643-657843 mcp230xx: register_write: "Write OLATB: C3" "WC3"
668516-668716 mcp230xx: register_write: "Write OLATA: 3D" "W3D"
668741-668941 mcp230xx: register_write: "Write OLATB: C2" "WC2"
679636-679836 mcp230xx: register_write: "Write OLATA: 3E" "W3E"
679861-680061 mcp230xx: register_write: "Write OLATB: C1" "WC1"
690739-690939 mcp230xx: register_write: "Write OLATA: 3F" "W3F"
690964-691164 mcp230xx: register_write: "Write OLATB: C0" "WC0"
701837-702037 mcp230xx: register_write: "Write OLATA: 40" "W40"
702062-702262 mcp230xx: register_write: "Write OLATB: BF" "WBF"
712927-713127 mcp230xx: register_write: "Write OLATA: 41" "W41"
713152-713354 mcp230xx: register_write: "Write OLATB: BE" "WBE"
724025-724225 mcp230xx: register_write: "Write OLATA: 42" "W42"
724250-724450 mcp230xx: register_write: "Write OLATB: BD" "WBD"
735126-735326 mcp230xx: register_write: "Write OLATA: 43" "W43"
735351-735551 mcp230xx: register_write: "Write OLATB: BC" "WBC"
746220-746420 mcp230xx: register_write: "Write OLATA: 44" "W44"
746445-746645 mcp230xx: register_write: "Write OLATB: BB" "WBB"
757316-757516 mcp230xx: register_write: "Write OLATA: 45" "W45"
757541-757741 mcp230xx: register_write: "Write OLATB: BA" "WBA"
768411-768611 mcp230xx: register_write: "Write OLATA: 46" "W46"
768636-768836 mcp230xx: register_write: "Write OLATB: B9" "WB9"
779506-779706 mcp230xx: register_write: "Write OLATA: 47" "W47"
779731-779931 mcp230xx: register_write: "Write OLATB: B8" "WB8"
790627-790827 mcp230xx: register_write: "Write OLATA: 48" "W48"
790852-791052 mcp230xx: register_write: "Write OLATB: B7" "WB7"
801721-801921 mcp230xx: register_write: "Write OLATA: 49" "W49"
801946-802146 mcp230xx: register_write: "Write OLATB: B6" "WB6"
812814-813014 mcp230xx: register_write: "Write OLATA: 4A" "W4A"
813039-813239 mcp230xx: register_write: "Write OLATB: B5" "WB5"
823910-824110 mcp230xx: register_write: "Write OLATA: 4B" "W4B"
824135-824335 mcp230xx: register_write: "Write OLATB: B4" "WB4"
835006-835206 mcp230xx: register_write: "Write OLATA: 4C" "W4C"
835231-835431 mcp230xx: register_write: "Write OLATB: B3" "WB3"
846099-846299 mcp230xx: register_write: "Write OLATA: 4D" "W4D"
846324-846524 mcp230xx: register_write: "Write OLATB: B2" "WB2"
857195-857395 mcp230xx: register_write: "Write OLATA: 4E" "W4E"
857420-857620 mcp230xx: register_write: "Write OLATB: B1" "WB1"
868290-868490 mcp230xx: register_write: "Write OLATA: 4F" "W4F"
868515-868715 mcp230xx: register_write: "Write OLATB: B0" "WB0"
879384-879584 mcp230xx: register_write: "Write OLATA: 50" "W50"
879609-879809 mcp230xx: register_write: "Write OLATB: AF" "WAF"
890502-890702 mcp230xx: register_write: "Write OLATA: 51" "W51"
890727-890927 mcp230xx: register_write: "Write OLATB: AE" "WAE"
901596-901796 mcp230xx: register_write: "Write OLATA: 52" "W52"
901821-902021 mcp230xx: register_write: "Write OLATB: AD" "WAD"
912689-912889 mcp230xx: register_write: "Write OLATA: 53" "W53"
912914-913114 mcp230xx: register_write: "Write OLATB: AC" "WAC"
923785-923985 mcp230xx: register_write: "Write OLATA: 54" "W54"
924010-924210 mcp230xx: register_write: "Write OLATB: AB" "WAB"
934878-935078 mcp230xx: register_write: "Write OLATA: 55" "W55"
935103-935303 mcp230xx: register_write: "Write OLATB: AA" "WAA"
945971-946171 mcp230xx: register_write: "Write OLATA: 56" "W56"
946196-946396 mcp230xx: register_write: "Write OLATB: A9" "WA9"
957066-957266 mcp230xx: register_write: "Write OLATA: 57" "W57"
957291-957491 mcp230xx: register_write: "Write OLATB: A8" "WA8"
968161-968361 mcp230xx: register_write: "Write OLATA: 58" "W58"
968386-968586 mcp230xx: register_write: "Write OLATB: A7" "WA7"
979254-979454 mcp230xx: register_write: "Write OLATA: 59" "W59"
979479-979679 mcp230xx: register_write: "Write OLATB: A6" "WA6"
990350-990550 mcp230xx: register_write: "Write OLATA: 5A" "W5A"
990575-990775 mcp230xx: register_write: "Write OLATB: A5" "WA5"
