673573-693599 timing: time: "20.026 ms (49.935 Hz)"
673573-693599 timing: average: "20.026 ms (49.935 Hz)"
693599-693643 timing: time: "44.000 μs (22.727 kHz)"
693599-693643 timing: average: "10.035 ms (99.651 Hz)"
693643-693702 timing: time: "59.000 μs (16.949 kHz)"
693643-693702 timing: average: "6.710 ms (149.039 Hz)"
693702-693783 timing: time: "81.000 μs (12.346 kHz)"
693702-693783 timing: average: "5.052 ms (197.922 Hz)"
693783-693844 timing: time: "61.000 μs (16.393 kHz)"
693783-693844 timing: average: "4.054 ms (246.658 Hz)"
693844-693870 timing: time: "26.000 μs (38.462 kHz)"
693844-693870 timing: average: "3.383 ms (295.610 Hz)"
693870-693929 timing: time: "59.000 μs (16.949 kHz)"
693870-693929 timing: average: "2.908 ms (343.879 Hz)"
693929-693955 timing: time: "26.000 μs (38.462 kHz)"
693929-693955 timing: average: "2.548 ms (392.503 Hz)"
693955-694014 timing: time: "59.000 μs (16.949 kHz)"
693955-694014 timing: average: "2.271 ms (440.292 Hz)"
694014-694040 timing: time: "26.000 μs (38.462 kHz)"
694014-694040 timing: average: "2.047 ms (488.591 Hz)"
694040-694099 timing: time: "59.000 μs (16.949 kHz)"
694040-694099 timing: average: "1.866 ms (535.906 Hz)"
694099-694125 timing: time: "26.000 μs (38.462 kHz)"
694099-694125 timing: average: "1.713 ms (583.885 Hz)"
694125-694184 timing: time: "59.000 μs (16.949 kHz)"
694125-694184 timing: average: "1.585 ms (630.731 Hz)"
694184-694210 timing: time: "26.000 μs (38.462 kHz)"
694184-694210 timing: average: "1.474 ms (678.393 Hz)"
694210-694269 timing: time: "59.000 μs (16.949 kHz)"
694210-694269 timing: average: "1.380 ms (724.778 Hz)"
694269-694295 timing: time: "26.000 μs (38.462 kHz)"
694269-694295 timing: average: "1.295 ms (772.126 Hz)"
694295-694354 timing: time: "59.000 μs (16.949 kHz)"
694295-694354 timing: average: "1.222 ms (818.055 Hz)"
694354-694429 timing: time: "75.000 μs (13.333 kHz)"
694354-694429 timing: average: "1.159 ms (863.061 Hz)"
694429-694488 timing: time: "59.000 μs (16.949 kHz)"
694429-694488 timing: average: "1.101 ms (908.439 Hz)"
694488-694514 timing: time: "26.000 μs (38.462 kHz)"
694488-694514 timing: average: "1.047 ms (955.064 Hz)"
694514-694577 timing: time: "63.000 μs (15.873 kHz)"
694514-694577 timing: average: "1.000 ms (999.810 Hz)"
694577-694603 timing: time: "26.000 μs (38.462 kHz)"
694577-694603 timing: average: "955.909 μs (1.046 kHz)"
694603-694662 timing: time: "59.000 μs (16.949 kHz)"
694603-694662 timing: average: "916.913 μs (1.091 kHz)"
694662-694689 timing: time: "27.000 μs (37.037 kHz)"
694662-694689 timing: average: "879.833 μs (1.137 kHz)"
694689-694748 timing: time: "59.000 μs (16.949 kHz)"
694689-694748 timing: average: "847.000 μs (1.181 kHz)"
694748-694774 timing: time: "26.000 μs (38.462 kHz)"
694748-694774 timing: average: "815.423 μs (1.226 kHz)"
694774-694833 timing: time: "59.000 μs (16.949 kHz)"
694774-694833 timing: average: "787.407 μs (1.270 kHz)"
694833-694859 timing: time: "26.000 μs (38.462 kHz)"
694833-694859 timing: average: "760.214 μs (1.315 kHz)"
694859-694918 timing: time: "59.000 μs (16.949 kHz)"
694859-694918 timing: average: "736.034 μs (1.359 kHz)"
694918-694993 timing: time: "75.000 μs (13.333 kHz)"
694918-694993 timing: average: "714.000 μs (1.401 kHz)"
694993-695052 timing: time: "59.000 μs (16.949 kHz)"
694993-695052 timing: average: "692.871 μs (1.443 kHz)"
695052-695127 timing: time: "75.000 μs (13.333 kHz)"
695052-695127 timing: average: "673.563 μs (1.485 kHz)"
695127-695186 timing: time: "59.000 μs (16.949 kHz)"
695127-695186 timing: average: "654.939 μs (1.527 kHz)"
695186-695261 timing: time: "75.000 μs (13.333 kHz)"
695186-695261 timing: average: "637.882 μs (1.568 kHz)"
695261-695320 timing: time: "59.000 μs (16.949 kHz)"
695261-695320 timing: average: "621.343 μs (1.609 kHz)"
695320-695346 timing: time: "26.000 μs (38.462 kHz)"
695320-695346 timing: average: "604.806 μs (1.653 kHz)"
695346-695409 timing: time: "63.000 μs (15.873 kHz)"
695346-695409 timing: average: "590.162 μs (1.694 kHz)"
695409-695435 timing: time: "26.000 μs (38.462 kHz)"
695409-695435 timing: average: "575.316 μs (1.738 kHz)"
695435-695494 timing: time: "59.000 μs (16.949 kHz)"
695435-695494 timing: average: "562.077 μs (1.779 kHz)"
695494-695520 timing: time: "26.000 μs (38.462 kHz)"
695494-695520 timing: average: "548.675 μs (1.823 kHz)"
695520-695579 timing: time: "59.000 μs (16.949 kHz)"
695520-695579 timing: average: "536.732 μs (1.863 kHz)"
695579-695605 timing: time: "26.000 μs (38.462 kHz)"
695579-695605 timing: average: "524.571 μs (1.906 kHz)"
695605-695664 timing: time: "59.000 μs (16.949 kHz)"
695605-695664 timing: average: "513.744 μs (1.946 kHz)"
695664-695690 timing: time: "26.000 μs (38.462 kHz)"
695664-695690 timing: average: "502.659 μs (1.989 kHz)"
695690-695749 timing: time: "59.000 μs (16.949 kHz)"
695690-695749 timing: average: "492.800 μs (2.029 kHz)"
695749-695775 timing: time: "26.000 μs (38.462 kHz)"
695749-695775 timing: average: "482.652 μs (2.072 kHz)"
695775-695834 timing: time: "59.000 μs (16.949 kHz)"
695775-695834 timing: average: "473.638 μs (2.111 kHz)"
695834-695860 timing: time: "26.000 μs (38.462 kHz)"
695834-695860 timing: average: "464.313 μs (2.154 kHz)"
695860-695919 timing: time: "59.000 μs (16.949 kHz)"
695860-695919 timing: average: "456.041 μs (2.193 kHz)"
695919-695945 timing: time: "26.000 μs (38.462 kHz)"
695919-695945 timing: average: "447.440 μs (2.235 kHz)"
695945-696004 timing: time: "59.000 μs (16.949 kHz)"
695945-696004 timing: average: "439.824 μs (2.274 kHz)"
696004-696079 timing: time: "75.000 μs (13.333 kHz)"
696004-696079 timing: average: "432.808 μs (2.310 kHz)"
696079-696142 timing: time: "63.000 μs (15.873 kHz)"
696079-696142 timing: average: "425.830 μs (2.348 kHz)"
696142-696168 timing: time: "26.000 μs (38.462 kHz)"
696142-696168 timing: average: "418.426 μs (2.390 kHz)"
696168-696227 timing: time: "59.000 μs (16.949 kHz)"
696168-696227 timing: average: "411.891 μs (2.428 kHz)"
696227-696253 timing: time: "26.000 μs (38.462 kHz)"
696227-696253 timing: average: "405.000 μs (2.469 kHz)"
696253-696312 timing: time: "59.000 μs (16.949 kHz)"
696253-696312 timing: average: "398.930 μs (2.507 kHz)"
696312-696338 timing: time: "26.000 μs (38.462 kHz)"
696312-696338 timing: average: "392.500 μs (2.548 kHz)"
696338-696397 timing: time: "59.000 μs (16.949 kHz)"
696338-696397 timing: average: "386.847 μs (2.585 kHz)"
696397-696423 timing: time: "26.000 μs (38.462 kHz)"
696397-696423 timing: average: "380.833 μs (2.626 kHz)"
696423-696482 timing: time: "59.000 μs (16.949 kHz)"
696423-696482 timing: average: "375.557 μs (2.663 kHz)"
696482-696508 timing: time: "26.000 μs (38.462 kHz)"
696482-696508 timing: average: "369.919 μs (2.703 kHz)"
696508-696567 timing: time: "59.000 μs (16.949 kHz)"
696508-696567 timing: average: "364.984 μs (2.740 kHz)"
696567-696593 timing: time: "26.000 μs (38.462 kHz)"
696567-696593 timing: average: "359.688 μs (2.780 kHz)"
696593-696653 timing: time: "60.000 μs (16.667 kHz)"
696593-696653 timing: average: "355.077 μs (2.816 kHz)"
696653-696679 timing: time: "26.000 μs (38.462 kHz)"
696653-696679 timing: average: "350.091 μs (2.856 kHz)"
696679-696738 timing: time: "59.000 μs (16.949 kHz)"
696679-696738 timing: average: "345.746 μs (2.892 kHz)"
696738-696764 timing: time: "26.000 μs (38.462 kHz)"
696738-696764 timing: average: "341.044 μs (2.932 kHz)"
696764-696827 timing: time: "63.000 μs (15.873 kHz)"
696764-696827 timing: average: "337.014 μs (2.967 kHz)"
696827-696853 timing: time: "26.000 μs (38.462 kHz)"
696827-696853 timing: average: "332.571 μs (3.007 kHz)"
696853-696912 timing: time: "59.000 μs (16.949 kHz)"
696853-696912 timing: average: "328.718 μs (3.042 kHz)"
696912-696938 timing: time: "26.000 μs (38.462 kHz)"
696912-696938 timing: average: "324.514 μs (3.082 kHz)"
696938-696997 timing: time: "59.000 μs (16.949 kHz)"
696938-696997 timing: average: "320.877 μs (3.116 kHz)"
696997-697023 timing: time: "26.000 μs (38.462 kHz)"
696997-697023 timing: average: "316.892 μs (3.156 kHz)"
697023-697082 timing: time: "59.000 μs (16.949 kHz)"
697023-697082 timing: average: "313.453 μs (3.190 kHz)"
697082-697157 timing: time: "75.000 μs (13.333 kHz)"
697082-697157 timing: average: "310.316 μs (3.223 kHz)"
697157-697216 timing: time: "59.000 μs (16.949 kHz)"
697157-697216 timing: average: "307.052 μs (3.257 kHz)"
697216-697242 timing: time: "26.000 μs (38.462 kHz)"
697216-697242 timing: average: "303.449 μs (3.295 kHz)"
697242-697301 timing: time: "59.000 μs (16.949 kHz)"
697242-697301 timing: average: "300.354 μs (3.329 kHz)"
697301-697327 timing: time: "26.000 μs (38.462 kHz)"
697301-697327 timing: average: "296.925 μs (3.368 kHz)"
697327-697386 timing: time: "59.000 μs (16.949 kHz)"
697327-697386 timing: average: "293.988 μs (3.402 kHz)"
697386-697412 timing: time: "26.000 μs (38.462 kHz)"
697386-697412 timing: average: "290.720 μs (3.440 kHz)"
697412-697471 timing: time: "59.000 μs (16.949 kHz)"
697412-697471 timing: average: "287.928 μs (3.473 kHz)"
697471-697546 timing: time: "75.000 μs (13.333 kHz)"
697471-697546 timing: average: "285.393 μs (3.504 kHz)"
697546-697609 timing: time: "63.000 μs (15.873 kHz)"
697546-697609 timing: average: "282.776 μs (3.536 kHz)"
697609-697635 timing: time: "26.000 μs (38.462 kHz)"
697609-697635 timing: average: "279.791 μs (3.574 kHz)"
697635-697694 timing: time: "59.000 μs (16.949 kHz)"
697635-697694 timing: average: "277.253 μs (3.607 kHz)"
697694-697720 timing: time: "26.000 μs (38.462 kHz)"
697694-697720 timing: average: "274.398 μs (3.644 kHz)"
697720-697779 timing: time: "59.000 μs (16.949 kHz)"
697720-697779 timing: average: "271.978 μs (3.677 kHz)"
697779-697805 timing: time: "26.000 μs (38.462 kHz)"
697779-697805 timing: average: "269.244 μs (3.714 kHz)"
697805-697864 timing: time: "59.000 μs (16.949 kHz)"
697805-697864 timing: average: "266.934 μs (3.746 kHz)"
697864-697890 timing: time: "26.000 μs (38.462 kHz)"
697864-697890 timing: average: "264.315 μs (3.783 kHz)"
697890-697949 timing: time: "59.000 μs (16.949 kHz)"
697890-697949 timing: average: "262.108 μs (3.815 kHz)"
697949-697975 timing: time: "26.000 μs (38.462 kHz)"
697949-697975 timing: average: "259.596 μs (3.852 kHz)"
697975-698034 timing: time: "59.000 μs (16.949 kHz)"
697975-698034 timing: average: "257.484 μs (3.884 kHz)"
698034-698060 timing: time: "26.000 μs (38.462 kHz)"
698034-698060 timing: average: "255.073 μs (3.920 kHz)"
698060-698119 timing: time: "59.000 μs (16.949 kHz)"
698060-698119 timing: average: "253.052 μs (3.952 kHz)"
698119-698145 timing: time: "26.000 μs (38.462 kHz)"
698119-698145 timing: average: "250.735 μs (3.988 kHz)"
698145-698204 timing: time: "59.000 μs (16.949 kHz)"
698145-698204 timing: average: "248.798 μs (4.019 kHz)"
698204-698230 timing: time: "26.000 μs (38.462 kHz)"
698204-698230 timing: average: "246.570 μs (4.056 kHz)"
698230-698293 timing: time: "63.000 μs (15.873 kHz)"
698230-698293 timing: average: "46.940 μs (21.304 kHz)"
698293-698319 timing: time: "26.000 μs (38.462 kHz)"
698293-698319 timing: average: "46.760 μs (21.386 kHz)"
698319-698378 timing: time: "59.000 μs (16.949 kHz)"
698319-698378 timing: average: "46.760 μs (21.386 kHz)"
698378-698404 timing: time: "26.000 μs (38.462 kHz)"
698378-698404 timing: average: "46.210 μs (21.640 kHz)"
698404-698463 timing: time: "59.000 μs (16.949 kHz)"
698404-698463 timing: average: "46.190 μs (21.650 kHz)"
698463-698489 timing: time: "26.000 μs (38.462 kHz)"
698463-698489 timing: average: "46.190 μs (21.650 kHz)"
698489-698548 timing: time: "59.000 μs (16.949 kHz)"
698489-698548 timing: average: "46.190 μs (21.650 kHz)"
698548-698575 timing: time: "27.000 μs (37.037 kHz)"
698548-698575 timing: average: "46.200 μs (21.645 kHz)"
698575-698634 timing: time: "59.000 μs (16.949 kHz)"
698575-698634 timing: average: "46.200 μs (21.645 kHz)"
698634-698660 timing: time: "26.000 μs (38.462 kHz)"
698634-698660 timing: average: "46.200 μs (21.645 kHz)"
698660-698719 timing: time: "59.000 μs (16.949 kHz)"
698660-698719 timing: average: "46.200 μs (21.645 kHz)"
698719-698745 timing: time: "26.000 μs (38.462 kHz)"
698719-698745 timing: average: "46.200 μs (21.645 kHz)"
698745-698804 timing: time: "59.000 μs (16.949 kHz)"
698745-698804 timing: average: "46.200 μs (21.645 kHz)"
698804-698830 timing: time: "26.000 μs (38.462 kHz)"
698804-698830 timing: average: "46.200 μs (21.645 kHz)"
698830-698889 timing: time: "59.000 μs (16.949 kHz)"
698830-698889 timing: average: "46.200 μs (21.645 kHz)"
698889-698915 timing: time: "26.000 μs (38.462 kHz)"
698889-698915 timing: average: "46.200 μs (21.645 kHz)"
698915-698978 timing: time: "63.000 μs (15.873 kHz)"
698915-698978 timing: average: "46.240 μs (21.626 kHz)"
698978-699004 timing: time: "26.000 μs (38.462 kHz)"
698978-699004 timing: average: "45.750 μs (21.858 kHz)"
699004-699063 timing: time: "59.000 μs (16.949 kHz)"
699004-699063 timing: average: "45.750 μs (21.858 kHz)"
699063-699089 timing: time: "26.000 μs (38.462 kHz)"
699063-699089 timing: average: "45.750 μs (21.858 kHz)"
699089-699148 timing: time: "59.000 μs (16.949 kHz)"
699089-699148 timing: average: "45.710 μs (21.877 kHz)"
699148-699174 timing: time: "26.000 μs (38.462 kHz)"
699148-699174 timing: average: "45.710 μs (21.877 kHz)"
699174-699233 timing: time: "59.000 μs (16.949 kHz)"
699174-699233 timing: average: "45.710 μs (21.877 kHz)"
699233-699259 timing: time: "26.000 μs (38.462 kHz)"
699233-699259 timing: average: "45.700 μs (21.882 kHz)"
699259-699318 timing: time: "59.000 μs (16.949 kHz)"
699259-699318 timing: average: "45.700 μs (21.882 kHz)"
699318-699344 timing: time: "26.000 μs (38.462 kHz)"
699318-699344 timing: average: "45.700 μs (21.882 kHz)"
699344-699403 timing: time: "59.000 μs (16.949 kHz)"
699344-699403 timing: average: "45.700 μs (21.882 kHz)"
699403-699429 timing: time: "26.000 μs (38.462 kHz)"
699403-699429 timing: average: "45.700 μs (21.882 kHz)"
699429-699488 timing: time: "59.000 μs (16.949 kHz)"
699429-699488 timing: average: "45.700 μs (21.882 kHz)"
699488-699514 timing: time: "26.000 μs (38.462 kHz)"
699488-699514 timing: average: "45.210 μs (22.119 kHz)"
699514-699573 timing: time: "59.000 μs (16.949 kHz)"
699514-699573 timing: average: "45.210 μs (22.119 kHz)"
699573-699599 timing: time: "26.000 μs (38.462 kHz)"
699573-699599 timing: average: "44.720 μs (22.361 kHz)"
699599-699653 timing: time: "54.000 μs (18.519 kHz)"
699599-699653 timing: average: "44.670 μs (22.386 kHz)"
699653-2956015 timing: time: "2.256 s  (0.443 Hz)"
699653-2956015 timing: average: "22.608 ms (44.233 Hz)"
2956015-2976040 timing: time: "20.025 ms (49.938 Hz)"
2956015-2976040 timing: average: "22.807 ms (43.846 Hz)"
2976040-2976084 timing: time: "44.000 μs (22.727 kHz)"
2976040-2976084 timing: average: "22.807 ms (43.845 Hz)"
2976084-2976144 timing: time: "60.000 μs (16.667 kHz)"
2976084-2976144 timing: average: "22.807 ms (43.846 Hz)"
2976144-2976225 timing: time: "81.000 μs (12.346 kHz)"
2976144-2976225 timing: average: "22.808 ms (43.844 Hz)"
2976225-2976286 timing: time: "61.000 μs (16.393 kHz)"
2976225-2976286 timing: average: "22.808 ms (43.844 Hz)"
2976286-2976312 timing: time: "26.000 μs (38.462 kHz)"
2976286-2976312 timing: average: "22.808 ms (43.844 Hz)"
2976312-2976371 timing: time: "59.000 μs (16.949 kHz)"
2976312-2976371 timing: average: "22.808 ms (43.844 Hz)"
2976371-2976397 timing: time: "26.000 μs (38.462 kHz)"
2976371-2976397 timing: average: "22.808 ms (43.844 Hz)"
2976397-2976456 timing: time: "59.000 μs (16.949 kHz)"
2976397-2976456 timing: average: "22.808 ms (43.844 Hz)"
2976456-2976482 timing: time: "26.000 μs (38.462 kHz)"
2976456-2976482 timing: average: "22.808 ms (43.844 Hz)"
2976482-2976541 timing: time: "59.000 μs (16.949 kHz)"
2976482-2976541 timing: average: "22.808 ms (43.844 Hz)"
2976541-2976567 timing: time: "26.000 μs (38.462 kHz)"
2976541-2976567 timing: average: "22.808 ms (43.844 Hz)"
2976567-2976626 timing: time: "59.000 μs (16.949 kHz)"
2976567-2976626 timing: average: "22.808 ms (43.844 Hz)"
2976626-2976652 timing: time: "26.000 μs (38.462 kHz)"
2976626-2976652 timing: average: "22.808 ms (43.844 Hz)"
2976652-2976711 timing: time: "59.000 μs (16.949 kHz)"
2976652-2976711 timing: average: "22.808 ms (43.844 Hz)"
2976711-2976737 timing: time: "26.000 μs (38.462 kHz)"
2976711-2976737 timing: average: "22.808 ms (43.844 Hz)"
2976737-2976796 timing: time: "59.000 μs (16.949 kHz)"
2976737-2976796 timing: average: "22.808 ms (43.844 Hz)"
2976796-2976871 timing: time: "75.000 μs (13.333 kHz)"
2976796-2976871 timing: average: "22.808 ms (43.844 Hz)"
2976871-2976930 timing: time: "59.000 μs (16.949 kHz)"
2976871-2976930 timing: average: "22.808 ms (43.844 Hz)"
2976930-2976956 timing: time: "26.000 μs (38.462 kHz)"
2976930-2976956 timing: average: "22.808 ms (43.844 Hz)"
2976956-2977019 timing: time: "63.000 μs (15.873 kHz)"
2976956-2977019 timing: average: "22.808 ms (43.844 Hz)"
2977019-2977045 timing: time: "26.000 μs (38.462 kHz)"
2977019-2977045 timing: average: "22.808 ms (43.844 Hz)"
2977045-2977104 timing: time: "59.000 μs (16.949 kHz)"
2977045-2977104 timing: average: "22.808 ms (43.844 Hz)"
2977104-2977130 timing: time: "26.000 μs (38.462 kHz)"
2977104-2977130 timing: average: "22.808 ms (43.844 Hz)"
2977130-2977189 timing: time: "59.000 μs (16.949 kHz)"
2977130-2977189 timing: average: "22.808 ms (43.844 Hz)"
2977189-2977215 timing: time: "26.000 μs (38.462 kHz)"
2977189-2977215 timing: average: "22.808 ms (43.844 Hz)"
2977215-2977274 timing: time: "59.000 μs (16.949 kHz)"
2977215-2977274 timing: average: "22.808 ms (43.844 Hz)"
2977274-2977300 timing: time: "26.000 μs (38.462 kHz)"
2977274-2977300 timing: average: "22.808 ms (43.844 Hz)"
2977300-2977359 timing: time: "59.000 μs (16.949 kHz)"
2977300-2977359 timing: average: "22.808 ms (43.844 Hz)"
2977359-2977434 timing: time: "75.000 μs (13.333 kHz)"
2977359-2977434 timing: average: "22.808 ms (43.843 Hz)"
2977434-2977493 timing: time: "59.000 μs (16.949 kHz)"
2977434-2977493 timing: average: "22.808 ms (43.843 Hz)"
2977493-2977568 timing: time: "75.000 μs (13.333 kHz)"
2977493-2977568 timing: average: "22.809 ms (43.843 Hz)"
2977568-2977627 timing: time: "59.000 μs (16.949 kHz)"
2977568-2977627 timing: average: "22.809 ms (43.843 Hz)"
2977627-2977702 timing: time: "75.000 μs (13.333 kHz)"
2977627-2977702 timing: average: "22.809 ms (43.842 Hz)"
2977702-2977762 timing: time: "60.000 μs (16.667 kHz)"
2977702-2977762 timing: average: "22.809 ms (43.842 Hz)"
2977762-2977788 timing: time: "26.000 μs (38.462 kHz)"
2977762-2977788 timing: average: "22.809 ms (43.842 Hz)"
2977788-2977851 timing: time: "63.000 μs (15.873 kHz)"
2977788-2977851 timing: average: "22.809 ms (43.842 Hz)"
2977851-2977877 timing: time: "26.000 μs (38.462 kHz)"
2977851-2977877 timing: average: "22.809 ms (43.842 Hz)"
2977877-2977936 timing: time: "59.000 μs (16.949 kHz)"
2977877-2977936 timing: average: "22.809 ms (43.842 Hz)"
2977936-2977962 timing: time: "26.000 μs (38.462 kHz)"
2977936-2977962 timing: average: "22.809 ms (43.842 Hz)"
2977962-2978021 timing: time: "59.000 μs (16.949 kHz)"
2977962-2978021 timing: average: "22.809 ms (43.842 Hz)"
2978021-2978047 timing: time: "26.000 μs (38.462 kHz)"
2978021-2978047 timing: average: "22.809 ms (43.843 Hz)"
2978047-2978106 timing: time: "59.000 μs (16.949 kHz)"
2978047-2978106 timing: average: "22.809 ms (43.843 Hz)"
2978106-2978132 timing: time: "26.000 μs (38.462 kHz)"
2978106-2978132 timing: average: "22.809 ms (43.843 Hz)"
2978132-2978191 timing: time: "59.000 μs (16.949 kHz)"
2978132-2978191 timing: average: "22.809 ms (43.843 Hz)"
2978191-2978217 timing: time: "26.000 μs (38.462 kHz)"
2978191-2978217 timing: average: "22.809 ms (43.843 Hz)"
2978217-2978276 timing: time: "59.000 μs (16.949 kHz)"
2978217-2978276 timing: average: "22.809 ms (43.843 Hz)"
2978276-2978302 timing: time: "26.000 μs (38.462 kHz)"
2978276-2978302 timing: average: "22.809 ms (43.843 Hz)"
2978302-2978361 timing: time: "59.000 μs (16.949 kHz)"
2978302-2978361 timing: average: "22.809 ms (43.843 Hz)"
2978361-2978387 timing: time: "26.000 μs (38.462 kHz)"
2978361-2978387 timing: average: "22.808 ms (43.843 Hz)"
2978387-2978446 timing: time: "59.000 μs (16.949 kHz)"
2978387-2978446 timing: average: "22.808 ms (43.844 Hz)"
2978446-2978521 timing: time: "75.000 μs (13.333 kHz)"
2978446-2978521 timing: average: "22.809 ms (43.843 Hz)"
2978521-2978584 timing: time: "63.000 μs (15.873 kHz)"
2978521-2978584 timing: average: "22.809 ms (43.843 Hz)"
2978584-2978610 timing: time: "26.000 μs (38.462 kHz)"
2978584-2978610 timing: average: "22.809 ms (43.843 Hz)"
2978610-2978669 timing: time: "59.000 μs (16.949 kHz)"
2978610-2978669 timing: average: "22.809 ms (43.843 Hz)"
2978669-2978695 timing: time: "26.000 μs (38.462 kHz)"
2978669-2978695 timing: average: "22.809 ms (43.843 Hz)"
2978695-2978754 timing: time: "59.000 μs (16.949 kHz)"
2978695-2978754 timing: average: "22.809 ms (43.843 Hz)"
2978754-2978780 timing: time: "26.000 μs (38.462 kHz)"
2978754-2978780 timing: average: "22.809 ms (43.843 Hz)"
2978780-2978839 timing: time: "59.000 μs (16.949 kHz)"
2978780-2978839 timing: average: "22.809 ms (43.843 Hz)"
2978839-2978865 timing: time: "26.000 μs (38.462 kHz)"
2978839-2978865 timing: average: "22.809 ms (43.843 Hz)"
2978865-2978924 timing: time: "59.000 μs (16.949 kHz)"
2978865-2978924 timing: average: "22.809 ms (43.843 Hz)"
2978924-2978950 timing: time: "26.000 μs (38.462 kHz)"
2978924-2978950 timing: average: "22.809 ms (43.843 Hz)"
2978950-2979009 timing: time: "59.000 μs (16.949 kHz)"
2978950-2979009 timing: average: "22.809 ms (43.843 Hz)"
2979009-2979035 timing: time: "26.000 μs (38.462 kHz)"
2979009-2979035 timing: average: "22.809 ms (43.843 Hz)"
2979035-2979094 timing: time: "59.000 μs (16.949 kHz)"
2979035-2979094 timing: average: "22.809 ms (43.843 Hz)"
2979094-2979120 timing: time: "26.000 μs (38.462 kHz)"
2979094-2979120 timing: average: "22.809 ms (43.843 Hz)"
2979120-2979179 timing: time: "59.000 μs (16.949 kHz)"
2979120-2979179 timing: average: "22.809 ms (43.843 Hz)"
2979179-2979205 timing: time: "26.000 μs (38.462 kHz)"
2979179-2979205 timing: average: "22.809 ms (43.843 Hz)"
2979205-2979268 timing: time: "63.000 μs (15.873 kHz)"
2979205-2979268 timing: average: "22.809 ms (43.843 Hz)"
2979268-2979294 timing: time: "26.000 μs (38.462 kHz)"
2979268-2979294 timing: average: "22.809 ms (43.843 Hz)"
2979294-2979353 timing: time: "59.000 μs (16.949 kHz)"
2979294-2979353 timing: average: "22.809 ms (43.843 Hz)"
2979353-2979379 timing: time: "26.000 μs (38.462 kHz)"
2979353-2979379 timing: average: "22.809 ms (43.843 Hz)"
2979379-2979438 timing: time: "59.000 μs (16.949 kHz)"
2979379-2979438 timing: average: "22.809 ms (43.843 Hz)"
2979438-2979464 timing: time: "26.000 μs (38.462 kHz)"
2979438-2979464 timing: average: "22.809 ms (43.843 Hz)"
2979464-2979523 timing: time: "59.000 μs (16.949 kHz)"
2979464-2979523 timing: average: "22.809 ms (43.843 Hz)"
2979523-2979598 timing: time: "75.000 μs (13.333 kHz)"
2979523-2979598 timing: average: "22.809 ms (43.842 Hz)"
2979598-2979657 timing: time: "59.000 μs (16.949 kHz)"
2979598-2979657 timing: average: "22.809 ms (43.842 Hz)"
2979657-2979683 timing: time: "26.000 μs (38.462 kHz)"
2979657-2979683 timing: average: "22.809 ms (43.842 Hz)"
2979683-2979743 timing: time: "60.000 μs (16.667 kHz)"
2979683-2979743 timing: average: "22.809 ms (43.842 Hz)"
2979743-2979769 timing: time: "26.000 μs (38.462 kHz)"
2979743-2979769 timing: average: "22.809 ms (43.842 Hz)"
2979769-2979828 timing: time: "59.000 μs (16.949 kHz)"
2979769-2979828 timing: average: "22.809 ms (43.842 Hz)"
2979828-2979854 timing: time: "26.000 μs (38.462 kHz)"
2979828-2979854 timing: average: "22.809 ms (43.842 Hz)"
2979854-2979913 timing: time: "59.000 μs (16.949 kHz)"
2979854-2979913 timing: average: "22.809 ms (43.842 Hz)"
2979913-2979988 timing: time: "75.000 μs (13.333 kHz)"
2979913-2979988 timing: average: "22.810 ms (43.841 Hz)"
2979988-2980051 timing: time: "63.000 μs (15.873 kHz)"
2979988-2980051 timing: average: "22.810 ms (43.841 Hz)"
2980051-2980077 timing: time: "26.000 μs (38.462 kHz)"
2980051-2980077 timing: average: "22.810 ms (43.841 Hz)"
2980077-2980136 timing: time: "59.000 μs (16.949 kHz)"
2980077-2980136 timing: average: "22.810 ms (43.841 Hz)"
2980136-2980162 timing: time: "26.000 μs (38.462 kHz)"
2980136-2980162 timing: average: "22.810 ms (43.841 Hz)"
2980162-2980221 timing: time: "59.000 μs (16.949 kHz)"
2980162-2980221 timing: average: "22.810 ms (43.841 Hz)"
2980221-2980247 timing: time: "26.000 μs (38.462 kHz)"
2980221-2980247 timing: average: "22.810 ms (43.841 Hz)"
2980247-2980306 timing: time: "59.000 μs (16.949 kHz)"
2980247-2980306 timing: average: "22.810 ms (43.841 Hz)"
2980306-2980332 timing: time: "26.000 μs (38.462 kHz)"
2980306-2980332 timing: average: "22.810 ms (43.841 Hz)"
2980332-2980391 timing: time: "59.000 μs (16.949 kHz)"
2980332-2980391 timing: average: "22.810 ms (43.841 Hz)"
2980391-2980417 timing: time: "26.000 μs (38.462 kHz)"
2980391-2980417 timing: average: "22.810 ms (43.841 Hz)"
2980417-2980476 timing: time: "59.000 μs (16.949 kHz)"
2980417-2980476 timing: average: "22.810 ms (43.841 Hz)"
2980476-2980502 timing: time: "26.000 μs (38.462 kHz)"
2980476-2980502 timing: average: "22.810 ms (43.841 Hz)"
2980502-2980561 timing: time: "59.000 μs (16.949 kHz)"
2980502-2980561 timing: average: "22.810 ms (43.841 Hz)"
2980561-2980587 timing: time: "26.000 μs (38.462 kHz)"
2980561-2980587 timing: average: "22.810 ms (43.841 Hz)"
2980587-2980646 timing: time: "59.000 μs (16.949 kHz)"
2980587-2980646 timing: average: "22.810 ms (43.841 Hz)"
2980646-2980672 timing: time: "26.000 μs (38.462 kHz)"
2980646-2980672 timing: average: "246.570 μs (4.056 kHz)"
2980672-2980735 timing: time: "63.000 μs (15.873 kHz)"
2980672-2980735 timing: average: "46.950 μs (21.299 kHz)"
2980735-2980761 timing: time: "26.000 μs (38.462 kHz)"
2980735-2980761 timing: average: "46.770 μs (21.381 kHz)"
2980761-2980820 timing: time: "59.000 μs (16.949 kHz)"
2980761-2980820 timing: average: "46.760 μs (21.386 kHz)"
2980820-2980846 timing: time: "26.000 μs (38.462 kHz)"
2980820-2980846 timing: average: "46.210 μs (21.640 kHz)"
2980846-2980905 timing: time: "59.000 μs (16.949 kHz)"
2980846-2980905 timing: average: "46.190 μs (21.650 kHz)"
2980905-2980931 timing: time: "26.000 μs (38.462 kHz)"
2980905-2980931 timing: average: "46.190 μs (21.650 kHz)"
2980931-2980990 timing: time: "59.000 μs (16.949 kHz)"
2980931-2980990 timing: average: "46.190 μs (21.650 kHz)"
2980990-2981016 timing: time: "26.000 μs (38.462 kHz)"
2980990-2981016 timing: average: "46.190 μs (21.650 kHz)"
2981016-2981075 timing: time: "59.000 μs (16.949 kHz)"
2981016-2981075 timing: average: "46.190 μs (21.650 kHz)"
2981075-2981101 timing: time: "26.000 μs (38.462 kHz)"
2981075-2981101 timing: average: "46.190 μs (21.650 kHz)"
2981101-2981160 timing: time: "59.000 μs (16.949 kHz)"
2981101-2981160 timing: average: "46.190 μs (21.650 kHz)"
2981160-2981186 timing: time: "26.000 μs (38.462 kHz)"
2981160-2981186 timing: average: "46.190 μs (21.650 kHz)"
2981186-2981245 timing: time: "59.000 μs (16.949 kHz)"
2981186-2981245 timing: average: "46.190 μs (21.650 kHz)"
2981245-2981271 timing: time: "26.000 μs (38.462 kHz)"
2981245-2981271 timing: average: "46.190 μs (21.650 kHz)"
2981271-2981330 timing: time: "59.000 μs (16.949 kHz)"
2981271-2981330 timing: average: "46.190 μs (21.650 kHz)"
2981330-2981356 timing: time: "26.000 μs (38.462 kHz)"
2981330-2981356 timing: average: "46.190 μs (21.650 kHz)"
2981356-2981419 timing: time: "63.000 μs (15.873 kHz)"
2981356-2981419 timing: average: "46.230 μs (21.631 kHz)"
2981419-2981445 timing: time: "26.000 μs (38.462 kHz)"
2981419-2981445 timing: average: "45.740 μs (21.863 kHz)"
2981445-2981504 timing: time: "59.000 μs (16.949 kHz)"
2981445-2981504 timing: average: "45.740 μs (21.863 kHz)"
2981504-2981530 timing: time: "26.000 μs (38.462 kHz)"
2981504-2981530 timing: average: "45.740 μs (21.863 kHz)"
2981530-2981589 timing: time: "59.000 μs (16.949 kHz)"
2981530-2981589 timing: average: "45.700 μs (21.882 kHz)"
2981589-2981615 timing: time: "26.000 μs (38.462 kHz)"
2981589-2981615 timing: average: "45.700 μs (21.882 kHz)"
2981615-2981675 timing: time: "60.000 μs (16.667 kHz)"
2981615-2981675 timing: average: "45.710 μs (21.877 kHz)"
2981675-2981701 timing: time: "26.000 μs (38.462 kHz)"
2981675-2981701 timing: average: "45.710 μs (21.877 kHz)"
2981701-2981760 timing: time: "59.000 μs (16.949 kHz)"
2981701-2981760 timing: average: "45.710 μs (21.877 kHz)"
2981760-2981786 timing: time: "26.000 μs (38.462 kHz)"
2981760-2981786 timing: average: "45.710 μs (21.877 kHz)"
2981786-2981845 timing: time: "59.000 μs (16.949 kHz)"
2981786-2981845 timing: average: "45.710 μs (21.877 kHz)"
2981845-2981871 timing: time: "26.000 μs (38.462 kHz)"
2981845-2981871 timing: average: "45.710 μs (21.877 kHz)"
2981871-2981930 timing: time: "59.000 μs (16.949 kHz)"
2981871-2981930 timing: average: "45.710 μs (21.877 kHz)"
2981930-2981956 timing: time: "26.000 μs (38.462 kHz)"
2981930-2981956 timing: average: "45.220 μs (22.114 kHz)"
2981956-2982015 timing: time: "59.000 μs (16.949 kHz)"
2981956-2982015 timing: average: "45.220 μs (22.114 kHz)"
2982015-2982041 timing: time: "26.000 μs (38.462 kHz)"
2982015-2982041 timing: average: "44.730 μs (22.356 kHz)"
2982041-2982094 timing: time: "53.000 μs (18.868 kHz)"
2982041-2982094 timing: average: "44.670 μs (22.386 kHz)"
