4267-4352 timing: time: "850.000 ns (1.176 MHz)"
4267-4352 timing: average: "850.000 ns (1.176 MHz)"
17407-17492 timing: time: "850.000 ns (1.176 MHz)"
17407-17492 timing: average: "850.000 ns (1.176 MHz)"
30548-30633 timing: time: "850.000 ns (1.176 MHz)"
30548-30633 timing: average: "850.000 ns (1.176 MHz)"
43688-43773 timing: time: "850.000 ns (1.176 MHz)"
43688-43773 timing: average: "850.000 ns (1.176 MHz)"
56829-56914 timing: time: "850.000 ns (1.176 MHz)"
56829-56914 timing: average: "850.000 ns (1.176 MHz)"
69969-70054 timing: time: "850.000 ns (1.176 MHz)"
69969-70054 timing: average: "850.000 ns (1.176 MHz)"
83253-83338 timing: time: "850.000 ns (1.176 MHz)"
83253-83338 timing: average: "850.000 ns (1.176 MHz)"
96453-96538 timing: time: "850.000 ns (1.176 MHz)"
96453-96538 timing: average: "850.000 ns (1.176 MHz)"
109593-109678 timing: time: "850.000 ns (1.176 MHz)"
109593-109678 timing: average: "850.000 ns (1.176 MHz)"
122734-122819 timing: time: "850.000 ns (1.176 MHz)"
122734-122819 timing: average: "850.000 ns (1.176 MHz)"
135874-135959 timing: time: "850.000 ns (1.176 MHz)"
135874-135959 timing: average: "850.000 ns (1.176 MHz)"
149015-149100 timing: time: "850.000 ns (1.176 MHz)"
149015-149100 timing: average: "850.000 ns (1.176 MHz)"
162155-162240 timing: time: "850.000 ns (1.176 MHz)"
162155-162240 timing: average: "850.000 ns (1.176 MHz)"
175440-175525 timing: time: "850.000 ns (1.176 MHz)"
175440-175525 timing: average: "850.000 ns (1.176 MHz)"
188581-188665 timing: time: "840.000 ns (1.190 MHz)"
188581-188665 timing: average: "849.333 ns (1.177 MHz)"
201781-201866 timing: time: "850.000 ns (1.176 MHz)"
201781-201866 timing: average: "849.375 ns (1.177 MHz)"
214921-215006 timing: time: "850.000 ns (1.176 MHz)"
214921-215006 timing: average: "849.412 ns (1.177 MHz)"
228062-228147 timing: time: "850.000 ns (1.176 MHz)"
228062-228147 timing: average: "849.444 ns (1.177 MHz)"
241202-241287 timing: time: "850.000 ns (1.176 MHz)"
241202-241287 timing: average: "849.474 ns (1.177 MHz)"
254343-254427 timing: time: "840.000 ns (1.190 MHz)"
254343-254427 timing: average: "849.000 ns (1.178 MHz)"
267483-267568 timing: time: "850.000 ns (1.176 MHz)"
267483-267568 timing: average: "849.048 ns (1.178 MHz)"
280769-280854 timing: time: "850.000 ns (1.176 MHz)"
280769-280854 timing: average: "849.091 ns (1.178 MHz)"
293971-294056 timing: time: "850.000 ns (1.176 MHz)"
293971-294056 timing: average: "849.130 ns (1.178 MHz)"
307111-307196 timing: time: "850.000 ns (1.176 MHz)"
307111-307196 timing: average: "849.167 ns (1.178 MHz)"
320252-320337 timing: time: "850.000 ns (1.176 MHz)"
320252-320337 timing: average: "849.200 ns (1.178 MHz)"
333392-333477 timing: time: "850.000 ns (1.176 MHz)"
333392-333477 timing: average: "849.231 ns (1.178 MHz)"
346533-346618 timing: time: "850.000 ns (1.176 MHz)"
346533-346618 timing: average: "849.259 ns (1.177 MHz)"
359673-359758 timing: time: "850.000 ns (1.176 MHz)"
359673-359758 timing: average: "849.286 ns (1.177 MHz)"
372959-373044 timing: time: "850.000 ns (1.176 MHz)"
372959-373044 timing: average: "849.310 ns (1.177 MHz)"
386100-386185 timing: time: "850.000 ns (1.176 MHz)"
386100-386185 timing: average: "849.333 ns (1.177 MHz)"
399297-399382 timing: time: "850.000 ns (1.176 MHz)"
399297-399382 timing: average: "849.355 ns (1.177 MHz)"
412438-412523 timing: time: "850.000 ns (1.176 MHz)"
412438-412523 timing: average: "849.375 ns (1.177 MHz)"
425578-425663 timing: time: "850.000 ns (1.176 MHz)"
425578-425663 timing: average: "849.394 ns (1.177 MHz)"
438719-438804 timing: time: "850.000 ns (1.176 MHz)"
438719-438804 timing: average: "849.412 ns (1.177 MHz)"
451859-451944 timing: time: "850.000 ns (1.176 MHz)"
451859-451944 timing: average: "849.429 ns (1.177 MHz)"
465000-465085 timing: time: "850.000 ns (1.176 MHz)"
465000-465085 timing: average: "849.444 ns (1.177 MHz)"
478283-478368 timing: time: "850.000 ns (1.176 MHz)"
478283-478368 timing: average: "849.459 ns (1.177 MHz)"
491424-491509 timing: time: "850.000 ns (1.176 MHz)"
491424-491509 timing: average: "849.474 ns (1.177 MHz)"
504620-504705 timing: time: "850.000 ns (1.176 MHz)"
504620-504705 timing: average: "849.487 ns (1.177 MHz)"
517760-517845 timing: time: "850.000 ns (1.176 MHz)"
517760-517845 timing: average: "849.500 ns (1.177 MHz)"
530901-530985 timing: time: "840.000 ns (1.190 MHz)"
530901-530985 timing: average: "849.268 ns (1.177 MHz)"
544041-544126 timing: time: "850.000 ns (1.176 MHz)"
544041-544126 timing: average: "849.286 ns (1.177 MHz)"
557182-557266 timing: time: "840.000 ns (1.190 MHz)"
557182-557266 timing: average: "849.070 ns (1.178 MHz)"
570322-570407 timing: time: "850.000 ns (1.176 MHz)"
570322-570407 timing: average: "849.091 ns (1.178 MHz)"
583610-583695 timing: time: "850.000 ns (1.176 MHz)"
583610-583695 timing: average: "849.111 ns (1.178 MHz)"
596811-596896 timing: time: "850.000 ns (1.176 MHz)"
596811-596896 timing: average: "849.130 ns (1.178 MHz)"
609952-610037 timing: time: "850.000 ns (1.176 MHz)"
609952-610037 timing: average: "849.149 ns (1.178 MHz)"
623092-623177 timing: time: "850.000 ns (1.176 MHz)"
623092-623177 timing: average: "849.167 ns (1.178 MHz)"
636233-636318 timing: time: "850.000 ns (1.176 MHz)"
636233-636318 timing: average: "849.184 ns (1.178 MHz)"
649373-649458 timing: time: "850.000 ns (1.176 MHz)"
649373-649458 timing: average: "849.200 ns (1.178 MHz)"
662514-662598 timing: time: "840.000 ns (1.190 MHz)"
662514-662598 timing: average: "849.020 ns (1.178 MHz)"
675797-675882 timing: time: "850.000 ns (1.176 MHz)"
675797-675882 timing: average: "849.038 ns (1.178 MHz)"
688938-689022 timing: time: "840.000 ns (1.190 MHz)"
688938-689022 timing: average: "848.868 ns (1.178 MHz)"
702139-702224 timing: time: "850.000 ns (1.176 MHz)"
702139-702224 timing: average: "848.889 ns (1.178 MHz)"
715279-715364 timing: time: "850.000 ns (1.176 MHz)"
715279-715364 timing: average: "848.909 ns (1.178 MHz)"
728420-728505 timing: time: "850.000 ns (1.176 MHz)"
728420-728505 timing: average: "848.929 ns (1.178 MHz)"
741560-741645 timing: time: "850.000 ns (1.176 MHz)"
741560-741645 timing: average: "848.947 ns (1.178 MHz)"
754701-754786 timing: time: "850.000 ns (1.176 MHz)"
754701-754786 timing: average: "848.966 ns (1.178 MHz)"
767841-767926 timing: time: "850.000 ns (1.176 MHz)"
767841-767926 timing: average: "848.983 ns (1.178 MHz)"
781126-781211 timing: time: "850.000 ns (1.176 MHz)"
781126-781211 timing: average: "849.000 ns (1.178 MHz)"
794324-794409 timing: time: "850.000 ns (1.176 MHz)"
794324-794409 timing: average: "849.016 ns (1.178 MHz)"
807464-807549 timing: time: "850.000 ns (1.176 MHz)"
807464-807549 timing: average: "849.032 ns (1.178 MHz)"
820605-820690 timing: time: "850.000 ns (1.176 MHz)"
820605-820690 timing: average: "849.048 ns (1.178 MHz)"
833745-833830 timing: time: "850.000 ns (1.176 MHz)"
833745-833830 timing: average: "849.063 ns (1.178 MHz)"
846886-846970 timing: time: "840.000 ns (1.190 MHz)"
846886-846970 timing: average: "848.923 ns (1.178 MHz)"
860026-860111 timing: time: "850.000 ns (1.176 MHz)"
860026-860111 timing: average: "848.939 ns (1.178 MHz)"
873311-873396 timing: time: "850.000 ns (1.176 MHz)"
873311-873396 timing: average: "848.955 ns (1.178 MHz)"
886451-886536 timing: time: "850.000 ns (1.176 MHz)"
886451-886536 timing: average: "848.971 ns (1.178 MHz)"
899650-899735 timing: time: "850.000 ns (1.176 MHz)"
899650-899735 timing: average: "848.986 ns (1.178 MHz)"
912791-912875 timing: time: "840.000 ns (1.190 MHz)"
912791-912875 timing: average: "848.857 ns (1.178 MHz)"
925931-926016 timing: time: "850.000 ns (1.176 MHz)"
925931-926016 timing: average: "848.873 ns (1.178 MHz)"
939071-939156 timing: time: "850.000 ns (1.176 MHz)"
939071-939156 timing: average: "848.889 ns (1.178 MHz)"
952212-952297 timing: time: "850.000 ns (1.176 MHz)"
952212-952297 timing: average: "848.904 ns (1.178 MHz)"
965352-965437 timing: time: "850.000 ns (1.176 MHz)"
965352-965437 timing: average: "848.919 ns (1.178 MHz)"
978637-978722 timing: time: "850.000 ns (1.176 MHz)"
978637-978722 timing: average: "848.933 ns (1.178 MHz)"
991835-991920 timing: time: "850.000 ns (1.176 MHz)"
991835-991920 timing: average: "848.947 ns (1.178 MHz)"
