5589-5650 timing: time: "610.000 ns (1.639 MHz)"
5589-5650 timing: average: "610.000 ns (1.639 MHz)"
18730-18791 timing: time: "610.000 ns (1.639 MHz)"
18730-18791 timing: average: "610.000 ns (1.639 MHz)"
31870-31931 timing: time: "610.000 ns (1.639 MHz)"
31870-31931 timing: average: "610.000 ns (1.639 MHz)"
45011-45072 timing: time: "610.000 ns (1.639 MHz)"
45011-45072 timing: average: "610.000 ns (1.639 MHz)"
58151-58212 timing: time: "610.000 ns (1.639 MHz)"
58151-58212 timing: average: "610.000 ns (1.639 MHz)"
71434-71496 timing: time: "620.000 ns (1.613 MHz)"
71434-71496 timing: average: "613.333 ns (1.630 MHz)"
84575-84636 timing: time: "610.000 ns (1.639 MHz)"
84575-84636 timing: average: "613.333 ns (1.630 MHz)"
97775-97836 timing: time: "610.000 ns (1.639 MHz)"
97775-97836 timing: average: "613.333 ns (1.630 MHz)"
110916-110977 timing: time: "610.000 ns (1.639 MHz)"
110916-110977 timing: average: "610.000 ns (1.639 MHz)"
124056-124117 timing: time: "610.000 ns (1.639 MHz)"
124056-124117 timing: average: "610.000 ns (1.639 MHz)"
137196-137258 timing: time: "620.000 ns (1.613 MHz)"
137196-137258 timing: average: "613.333 ns (1.630 MHz)"
150337-150398 timing: time: "610.000 ns (1.639 MHz)"
150337-150398 timing: average: "613.333 ns (1.630 MHz)"
163477-163539 timing: time: "620.000 ns (1.613 MHz)"
163477-163539 timing: average: "616.667 ns (1.622 MHz)"
176762-176823 timing: time: "610.000 ns (1.639 MHz)"
176762-176823 timing: average: "613.333 ns (1.630 MHz)"
189903-189964 timing: time: "610.000 ns (1.639 MHz)"
189903-189964 timing: average: "613.333 ns (1.630 MHz)"
203103-203164 timing: time: "610.000 ns (1.639 MHz)"
203103-203164 timing: average: "610.000 ns (1.639 MHz)"
216243-216305 timing: time: "620.000 ns (1.613 MHz)"
216243-216305 timing: average: "613.333 ns (1.630 MHz)"
229384-229445 timing: time: "610.000 ns (1.639 MHz)"
229384-229445 timing: average: "613.333 ns (1.630 MHz)"
242524-242585 timing: time: "610.000 ns (1.639 MHz)"
242524-242585 timing: average: "613.333 ns (1.630 MHz)"
255665-255726 timing: time: "610.000 ns (1.639 MHz)"
255665-255726 timing: average: "610.000 ns (1.639 MHz)"
268805-268866 timing: time: "610.000 ns (1.639 MHz)"
268805-268866 timing: average: "610.000 ns (1.639 MHz)"
282092-282153 timing: time: "610.000 ns (1.639 MHz)"
282092-282153 timing: average: "610.000 ns (1.639 MHz)"
295293-295354 timing: time: "610.000 ns (1.639 MHz)"
295293-295354 timing: average: "610.000 ns (1.639 MHz)"
308434-308495 timing: time: "610.000 ns (1.639 MHz)"
308434-308495 timing: average: "610.000 ns (1.639 MHz)"
321574-321635 timing: time: "610.000 ns (1.639 MHz)"
321574-321635 timing: average: "610.000 ns (1.639 MHz)"
334715-334776 timing: time: "610.000 ns (1.639 MHz)"
334715-334776 timing: average: "610.000 ns (1.639 MHz)"
347855-347916 timing: time: "610.000 ns (1.639 MHz)"
347855-347916 timing: average: "610.000 ns (1.639 MHz)"
360995-361057 timing: time: "620.000 ns (1.613 MHz)"
360995-361057 timing: average: "613.333 ns (1.630 MHz)"
374282-374343 timing: time: "610.000 ns (1.639 MHz)"
374282-374343 timing: average: "613.333 ns (1.630 MHz)"
387422-387483 timing: time: "610.000 ns (1.639 MHz)"
387422-387483 timing: average: "613.333 ns (1.630 MHz)"
400620-400681 timing: time: "610.000 ns (1.639 MHz)"
400620-400681 timing: average: "610.000 ns (1.639 MHz)"
413760-413821 timing: time: "610.000 ns (1.639 MHz)"
413760-413821 timing: average: "610.000 ns (1.639 MHz)"
426901-426962 timing: time: "610.000 ns (1.639 MHz)"
426901-426962 timing: average: "610.000 ns (1.639 MHz)"
440041-440102 timing: time: "610.000 ns (1.639 MHz)"
440041-440102 timing: average: "610.000 ns (1.639 MHz)"
453181-453243 timing: time: "620.000 ns (1.613 MHz)"
453181-453243 timing: average: "613.333 ns (1.630 MHz)"
466322-466383 timing: time: "610.000 ns (1.639 MHz)"
466322-466383 timing: average: "613.333 ns (1.630 MHz)"
479605-479667 timing: time: "620.000 ns (1.613 MHz)"
479605-479667 timing: average: "616.667 ns (1.622 MHz)"
492801-492863 timing: time: "620.000 ns (1.613 MHz)"
492801-492863 timing: average: "616.667 ns (1.622 MHz)"
505942-506003 timing: time: "610.000 ns (1.639 MHz)"
505942-506003 timing: average: "616.667 ns (1.622 MHz)"
519082-519143 timing: time: "610.000 ns (1.639 MHz)"
519082-519143 timing: average: "613.333 ns (1.630 MHz)"
532223-532284 timing: time: "610.000 ns (1.639 MHz)"
532223-532284 timing: average: "610.000 ns (1.639 MHz)"
545363-545424 timing: time: "610.000 ns (1.639 MHz)"
545363-545424 timing: average: "610.000 ns (1.639 MHz)"
558504-558565 timing: time: "610.000 ns (1.639 MHz)"
558504-558565 timing: average: "610.000 ns (1.639 MHz)"
571791-571853 timing: time: "620.000 ns (1.613 MHz)"
571791-571853 timing: average: "613.333 ns (1.630 MHz)"
584932-584993 timing: time: "610.000 ns (1.639 MHz)"
584932-584993 timing: average: "613.333 ns (1.630 MHz)"
598133-598195 timing: time: "620.000 ns (1.613 MHz)"
598133-598195 timing: average: "616.667 ns (1.622 MHz)"
611274-611335 timing: time: "610.000 ns (1.639 MHz)"
611274-611335 timing: average: "613.333 ns (1.630 MHz)"
624414-624475 timing: time: "610.000 ns (1.639 MHz)"
624414-624475 timing: average: "613.333 ns (1.630 MHz)"
637555-637616 timing: time: "610.000 ns (1.639 MHz)"
637555-637616 timing: average: "610.000 ns (1.639 MHz)"
650695-650756 timing: time: "610.000 ns (1.639 MHz)"
650695-650756 timing: average: "610.000 ns (1.639 MHz)"
663836-663897 timing: time: "610.000 ns (1.639 MHz)"
663836-663897 timing: average: "610.000 ns (1.639 MHz)"
677119-677180 timing: time: "610.000 ns (1.639 MHz)"
677119-677180 timing: average: "610.000 ns (1.639 MHz)"
690260-690321 timing: time: "610.000 ns (1.639 MHz)"
690260-690321 timing: average: "610.000 ns (1.639 MHz)"
703461-703522 timing: time: "610.000 ns (1.639 MHz)"
703461-703522 timing: average: "610.000 ns (1.639 MHz)"
716602-716663 timing: time: "610.000 ns (1.639 MHz)"
716602-716663 timing: average: "610.000 ns (1.639 MHz)"
729742-729803 timing: time: "610.000 ns (1.639 MHz)"
729742-729803 timing: average: "610.000 ns (1.639 MHz)"
742883-742944 timing: time: "610.000 ns (1.639 MHz)"
742883-742944 timing: average: "610.000 ns (1.639 MHz)"
756023-756084 timing: time: "610.000 ns (1.639 MHz)"
756023-756084 timing: average: "610.000 ns (1.639 MHz)"
769164-769225 timing: time: "610.000 ns (1.639 MHz)"
769164-769225 timing: average: "610.000 ns (1.639 MHz)"
782448-782510 timing: time: "620.000 ns (1.613 MHz)"
782448-782510 timing: average: "613.333 ns (1.630 MHz)"
795646-795707 timing: time: "610.000 ns (1.639 MHz)"
795646-795707 timing: average: "613.333 ns (1.630 MHz)"
808786-808847 timing: time: "610.000 ns (1.639 MHz)"
808786-808847 timing: average: "613.333 ns (1.630 MHz)"
821927-821988 timing: time: "610.000 ns (1.639 MHz)"
821927-821988 timing: average: "610.000 ns (1.639 MHz)"
835067-835128 timing: time: "610.000 ns (1.639 MHz)"
835067-835128 timing: average: "610.000 ns (1.639 MHz)"
848208-848269 timing: time: "610.000 ns (1.639 MHz)"
848208-848269 timing: average: "610.000 ns (1.639 MHz)"
861348-861409 timing: time: "610.000 ns (1.639 MHz)"
861348-861409 timing: average: "610.000 ns (1.639 MHz)"
874633-874694 timing: time: "610.000 ns (1.639 MHz)"
874633-874694 timing: average: "610.000 ns (1.639 MHz)"
887774-887835 timing: time: "610.000 ns (1.639 MHz)"
887774-887835 timing: average: "610.000 ns (1.639 MHz)"
900972-901033 timing: time: "610.000 ns (1.639 MHz)"
900972-901033 timing: average: "610.000 ns (1.639 MHz)"
914113-914174 timing: time: "610.000 ns (1.639 MHz)"
914113-914174 timing: average: "610.000 ns (1.639 MHz)"
927253-927314 timing: time: "610.000 ns (1.639 MHz)"
927253-927314 timing: average: "610.000 ns (1.639 MHz)"
940394-940455 timing: time: "610.000 ns (1.639 MHz)"
940394-940455 timing: average: "610.000 ns (1.639 MHz)"
953534-953595 timing: time: "610.000 ns (1.639 MHz)"
953534-953595 timing: average: "610.000 ns (1.639 MHz)"
966675-966736 timing: time: "610.000 ns (1.639 MHz)"
966675-966736 timing: average: "610.000 ns (1.639 MHz)"
979960-980021 timing: time: "610.000 ns (1.639 MHz)"
979960-980021 timing: average: "610.000 ns (1.639 MHz)"
993157-993218 timing: time: "610.000 ns (1.639 MHz)"
993157-993218 timing: average: "610.000 ns (1.639 MHz)"
