4267-5650 timing: time: "13.830 μs (72.307 kHz)"
4267-5650 timing: average: "13.830 μs (72.307 kHz)"
5650-17407 timing: time: "117.570 μs (8.506 kHz)"
5650-17407 timing: average: "65.700 μs (15.221 kHz)"
17407-18791 timing: time: "13.840 μs (72.254 kHz)"
17407-18791 timing: average: "48.413 μs (20.655 kHz)"
18791-30548 timing: time: "117.570 μs (8.506 kHz)"
18791-30548 timing: average: "65.703 μs (15.220 kHz)"
30548-31931 timing: time: "13.830 μs (72.307 kHz)"
30548-31931 timing: average: "55.328 μs (18.074 kHz)"
31931-43688 timing: time: "117.570 μs (8.506 kHz)"
31931-43688 timing: average: "65.702 μs (15.220 kHz)"
43688-45072 timing: time: "13.840 μs (72.254 kHz)"
43688-45072 timing: average: "58.293 μs (17.155 kHz)"
45072-56829 timing: time: "117.570 μs (8.506 kHz)"
45072-56829 timing: average: "65.703 μs (15.220 kHz)"
56829-58212 timing: time: "13.830 μs (72.307 kHz)"
56829-58212 timing: average: "59.939 μs (16.684 kHz)"
58212-69969 timing: time: "117.570 μs (8.506 kHz)"
58212-69969 timing: average: "65.702 μs (15.220 kHz)"
69969-71496 timing: time: "15.270 μs (65.488 kHz)"
69969-71496 timing: average: "65.846 μs (15.187 kHz)"
71496-83253 timing: time: "117.570 μs (8.506 kHz)"
71496-83253 timing: average: "65.846 μs (15.187 kHz)"
83253-84636 timing: time: "13.830 μs (72.307 kHz)"
83253-84636 timing: average: "65.845 μs (15.187 kHz)"
84636-96453 timing: time: "118.170 μs (8.462 kHz)"
84636-96453 timing: average: "65.905 μs (15.173 kHz)"
96453-97836 timing: time: "13.830 μs (72.307 kHz)"
96453-97836 timing: average: "65.905 μs (15.173 kHz)"
97836-109593 timing: time: "117.570 μs (8.506 kHz)"
97836-109593 timing: average: "65.905 μs (15.173 kHz)"
109593-110977 timing: time: "13.840 μs (72.254 kHz)"
109593-110977 timing: average: "65.905 μs (15.173 kHz)"
110977-122734 timing: time: "117.570 μs (8.506 kHz)"
110977-122734 timing: average: "65.905 μs (15.173 kHz)"
122734-124117 timing: time: "13.830 μs (72.307 kHz)"
122734-124117 timing: average: "65.905 μs (15.173 kHz)"
124117-135874 timing: time: "117.570 μs (8.506 kHz)"
124117-135874 timing: average: "65.905 μs (15.173 kHz)"
135874-137258 timing: time: "13.840 μs (72.254 kHz)"
135874-137258 timing: average: "65.762 μs (15.206 kHz)"
137258-149015 timing: time: "117.570 μs (8.506 kHz)"
137258-149015 timing: average: "65.762 μs (15.206 kHz)"
149015-150398 timing: time: "13.830 μs (72.307 kHz)"
149015-150398 timing: average: "65.762 μs (15.206 kHz)"
150398-162155 timing: time: "117.570 μs (8.506 kHz)"
150398-162155 timing: average: "65.702 μs (15.220 kHz)"
162155-163539 timing: time: "13.840 μs (72.254 kHz)"
162155-163539 timing: average: "65.703 μs (15.220 kHz)"
163539-175440 timing: time: "119.010 μs (8.403 kHz)"
163539-175440 timing: average: "65.847 μs (15.187 kHz)"
175440-176823 timing: time: "13.830 μs (72.307 kHz)"
175440-176823 timing: average: "65.846 μs (15.187 kHz)"
176823-188581 timing: time: "117.580 μs (8.505 kHz)"
176823-188581 timing: average: "65.847 μs (15.187 kHz)"
188581-189964 timing: time: "13.830 μs (72.307 kHz)"
188581-189964 timing: average: "65.847 μs (15.187 kHz)"
189964-201781 timing: time: "118.170 μs (8.462 kHz)"
189964-201781 timing: average: "65.907 μs (15.173 kHz)"
201781-203164 timing: time: "13.830 μs (72.307 kHz)"
201781-203164 timing: average: "65.906 μs (15.173 kHz)"
203164-214921 timing: time: "117.570 μs (8.506 kHz)"
203164-214921 timing: average: "65.906 μs (15.173 kHz)"
214921-216305 timing: time: "13.840 μs (72.254 kHz)"
214921-216305 timing: average: "65.907 μs (15.173 kHz)"
216305-228062 timing: time: "117.570 μs (8.506 kHz)"
216305-228062 timing: average: "65.907 μs (15.173 kHz)"
228062-229445 timing: time: "13.830 μs (72.307 kHz)"
228062-229445 timing: average: "65.906 μs (15.173 kHz)"
229445-241202 timing: time: "117.570 μs (8.506 kHz)"
229445-241202 timing: average: "65.762 μs (15.206 kHz)"
241202-242585 timing: time: "13.830 μs (72.307 kHz)"
241202-242585 timing: average: "65.762 μs (15.206 kHz)"
242585-254343 timing: time: "117.580 μs (8.505 kHz)"
242585-254343 timing: average: "65.762 μs (15.206 kHz)"
254343-255726 timing: time: "13.830 μs (72.307 kHz)"
254343-255726 timing: average: "65.762 μs (15.206 kHz)"
255726-267483 timing: time: "117.570 μs (8.506 kHz)"
255726-267483 timing: average: "65.702 μs (15.220 kHz)"
267483-268866 timing: time: "13.830 μs (72.307 kHz)"
267483-268866 timing: average: "65.702 μs (15.220 kHz)"
268866-280769 timing: time: "119.030 μs (8.401 kHz)"
268866-280769 timing: average: "65.848 μs (15.186 kHz)"
280769-282153 timing: time: "13.840 μs (72.254 kHz)"
280769-282153 timing: average: "65.848 μs (15.186 kHz)"
282153-293971 timing: time: "118.180 μs (8.462 kHz)"
282153-293971 timing: average: "65.909 μs (15.172 kHz)"
293971-295354 timing: time: "13.830 μs (72.307 kHz)"
293971-295354 timing: average: "65.909 μs (15.172 kHz)"
295354-307111 timing: time: "117.570 μs (8.506 kHz)"
295354-307111 timing: average: "65.909 μs (15.172 kHz)"
307111-308495 timing: time: "13.840 μs (72.254 kHz)"
307111-308495 timing: average: "65.910 μs (15.172 kHz)"
308495-320252 timing: time: "117.570 μs (8.506 kHz)"
308495-320252 timing: average: "65.909 μs (15.172 kHz)"
320252-321635 timing: time: "13.830 μs (72.307 kHz)"
320252-321635 timing: average: "65.909 μs (15.172 kHz)"
321635-333392 timing: time: "117.570 μs (8.506 kHz)"
321635-333392 timing: average: "65.909 μs (15.172 kHz)"
333392-334776 timing: time: "13.840 μs (72.254 kHz)"
333392-334776 timing: average: "65.910 μs (15.172 kHz)"
334776-346533 timing: time: "117.570 μs (8.506 kHz)"
334776-346533 timing: average: "65.764 μs (15.206 kHz)"
346533-347916 timing: time: "13.830 μs (72.307 kHz)"
346533-347916 timing: average: "65.763 μs (15.206 kHz)"
347916-359673 timing: time: "117.570 μs (8.506 kHz)"
347916-359673 timing: average: "65.702 μs (15.220 kHz)"
359673-361057 timing: time: "13.840 μs (72.254 kHz)"
359673-361057 timing: average: "65.703 μs (15.220 kHz)"
361057-372959 timing: time: "119.020 μs (8.402 kHz)"
361057-372959 timing: average: "65.848 μs (15.186 kHz)"
372959-374343 timing: time: "13.840 μs (72.254 kHz)"
372959-374343 timing: average: "65.848 μs (15.186 kHz)"
374343-386100 timing: time: "117.570 μs (8.506 kHz)"
374343-386100 timing: average: "65.848 μs (15.186 kHz)"
386100-387483 timing: time: "13.830 μs (72.307 kHz)"
386100-387483 timing: average: "65.848 μs (15.186 kHz)"
387483-399297 timing: time: "118.140 μs (8.465 kHz)"
387483-399297 timing: average: "65.905 μs (15.173 kHz)"
399297-400681 timing: time: "13.840 μs (72.254 kHz)"
399297-400681 timing: average: "65.905 μs (15.173 kHz)"
400681-412438 timing: time: "117.570 μs (8.506 kHz)"
400681-412438 timing: average: "65.905 μs (15.173 kHz)"
412438-413821 timing: time: "13.830 μs (72.307 kHz)"
412438-413821 timing: average: "65.905 μs (15.173 kHz)"
413821-425578 timing: time: "117.570 μs (8.506 kHz)"
413821-425578 timing: average: "65.905 μs (15.173 kHz)"
425578-426962 timing: time: "13.840 μs (72.254 kHz)"
425578-426962 timing: average: "65.905 μs (15.173 kHz)"
426962-438719 timing: time: "117.570 μs (8.506 kHz)"
426962-438719 timing: average: "65.760 μs (15.207 kHz)"
438719-440102 timing: time: "13.830 μs (72.307 kHz)"
438719-440102 timing: average: "65.759 μs (15.207 kHz)"
440102-451859 timing: time: "117.570 μs (8.506 kHz)"
440102-451859 timing: average: "65.759 μs (15.207 kHz)"
451859-453243 timing: time: "13.840 μs (72.254 kHz)"
451859-453243 timing: average: "65.760 μs (15.207 kHz)"
453243-465000 timing: time: "117.570 μs (8.506 kHz)"
453243-465000 timing: average: "65.703 μs (15.220 kHz)"
465000-466383 timing: time: "13.830 μs (72.307 kHz)"
465000-466383 timing: average: "65.702 μs (15.220 kHz)"
466383-478283 timing: time: "119.000 μs (8.403 kHz)"
466383-478283 timing: average: "65.845 μs (15.187 kHz)"
478283-479667 timing: time: "13.840 μs (72.254 kHz)"
478283-479667 timing: average: "65.846 μs (15.187 kHz)"
479667-491424 timing: time: "117.570 μs (8.506 kHz)"
479667-491424 timing: average: "65.846 μs (15.187 kHz)"
491424-492863 timing: time: "14.390 μs (69.493 kHz)"
491424-492863 timing: average: "65.901 μs (15.174 kHz)"
492863-504620 timing: time: "117.570 μs (8.506 kHz)"
492863-504620 timing: average: "65.901 μs (15.174 kHz)"
504620-506003 timing: time: "13.830 μs (72.307 kHz)"
504620-506003 timing: average: "65.901 μs (15.174 kHz)"
506003-517760 timing: time: "117.570 μs (8.506 kHz)"
506003-517760 timing: average: "65.901 μs (15.174 kHz)"
517760-519143 timing: time: "13.830 μs (72.307 kHz)"
517760-519143 timing: average: "65.900 μs (15.175 kHz)"
519143-530901 timing: time: "117.580 μs (8.505 kHz)"
519143-530901 timing: average: "65.901 μs (15.174 kHz)"
530901-532284 timing: time: "13.830 μs (72.307 kHz)"
530901-532284 timing: average: "65.901 μs (15.174 kHz)"
532284-544041 timing: time: "117.570 μs (8.506 kHz)"
532284-544041 timing: average: "65.758 μs (15.207 kHz)"
544041-545424 timing: time: "13.830 μs (72.307 kHz)"
544041-545424 timing: average: "65.757 μs (15.208 kHz)"
545424-557182 timing: time: "117.580 μs (8.505 kHz)"
545424-557182 timing: average: "65.758 μs (15.207 kHz)"
557182-558565 timing: time: "13.830 μs (72.307 kHz)"
557182-558565 timing: average: "65.702 μs (15.220 kHz)"
558565-570322 timing: time: "117.570 μs (8.506 kHz)"
558565-570322 timing: average: "65.702 μs (15.220 kHz)"
570322-571853 timing: time: "15.310 μs (65.317 kHz)"
570322-571853 timing: average: "65.850 μs (15.186 kHz)"
571853-583610 timing: time: "117.570 μs (8.506 kHz)"
571853-583610 timing: average: "65.850 μs (15.186 kHz)"
583610-584993 timing: time: "13.830 μs (72.307 kHz)"
583610-584993 timing: average: "65.850 μs (15.186 kHz)"
584993-596811 timing: time: "118.180 μs (8.462 kHz)"
584993-596811 timing: average: "65.910 μs (15.172 kHz)"
596811-598195 timing: time: "13.840 μs (72.254 kHz)"
596811-598195 timing: average: "65.911 μs (15.172 kHz)"
598195-609952 timing: time: "117.570 μs (8.506 kHz)"
598195-609952 timing: average: "65.911 μs (15.172 kHz)"
609952-611335 timing: time: "13.830 μs (72.307 kHz)"
609952-611335 timing: average: "65.911 μs (15.172 kHz)"
611335-623092 timing: time: "117.570 μs (8.506 kHz)"
611335-623092 timing: average: "65.910 μs (15.172 kHz)"
623092-624475 timing: time: "13.830 μs (72.307 kHz)"
623092-624475 timing: average: "65.910 μs (15.172 kHz)"
624475-636233 timing: time: "117.580 μs (8.505 kHz)"
624475-636233 timing: average: "65.911 μs (15.172 kHz)"
636233-637616 timing: time: "13.830 μs (72.307 kHz)"
636233-637616 timing: average: "65.763 μs (15.206 kHz)"
637616-649373 timing: time: "117.570 μs (8.506 kHz)"
637616-649373 timing: average: "65.763 μs (15.206 kHz)"
649373-650756 timing: time: "13.830 μs (72.307 kHz)"
649373-650756 timing: average: "65.763 μs (15.206 kHz)"
650756-662514 timing: time: "117.580 μs (8.505 kHz)"
650756-662514 timing: average: "65.703 μs (15.220 kHz)"
662514-663897 timing: time: "13.830 μs (72.307 kHz)"
662514-663897 timing: average: "65.702 μs (15.220 kHz)"
663897-675797 timing: time: "119.000 μs (8.403 kHz)"
663897-675797 timing: average: "65.845 μs (15.187 kHz)"
675797-677180 timing: time: "13.830 μs (72.307 kHz)"
675797-677180 timing: average: "65.845 μs (15.187 kHz)"
677180-688938 timing: time: "117.580 μs (8.505 kHz)"
677180-688938 timing: average: "65.846 μs (15.187 kHz)"
688938-690321 timing: time: "13.830 μs (72.307 kHz)"
688938-690321 timing: average: "65.846 μs (15.187 kHz)"
690321-702139 timing: time: "118.180 μs (8.462 kHz)"
690321-702139 timing: average: "65.906 μs (15.173 kHz)"
702139-703522 timing: time: "13.830 μs (72.307 kHz)"
702139-703522 timing: average: "65.906 μs (15.173 kHz)"
703522-715279 timing: time: "117.570 μs (8.506 kHz)"
703522-715279 timing: average: "65.906 μs (15.173 kHz)"
715279-716663 timing: time: "13.840 μs (72.254 kHz)"
715279-716663 timing: average: "65.907 μs (15.173 kHz)"
716663-728420 timing: time: "117.570 μs (8.506 kHz)"
716663-728420 timing: average: "65.906 μs (15.173 kHz)"
728420-729803 timing: time: "13.830 μs (72.307 kHz)"
728420-729803 timing: average: "65.906 μs (15.173 kHz)"
729803-741560 timing: time: "117.570 μs (8.506 kHz)"
729803-741560 timing: average: "65.763 μs (15.206 kHz)"
741560-742944 timing: time: "13.840 μs (72.254 kHz)"
741560-742944 timing: average: "65.764 μs (15.206 kHz)"
742944-754701 timing: time: "117.570 μs (8.506 kHz)"
742944-754701 timing: average: "65.763 μs (15.206 kHz)"
754701-756084 timing: time: "13.830 μs (72.307 kHz)"
754701-756084 timing: average: "65.763 μs (15.206 kHz)"
756084-767841 timing: time: "117.570 μs (8.506 kHz)"
756084-767841 timing: average: "65.702 μs (15.220 kHz)"
767841-769225 timing: time: "13.840 μs (72.254 kHz)"
767841-769225 timing: average: "65.703 μs (15.220 kHz)"
769225-781126 timing: time: "119.010 μs (8.403 kHz)"
769225-781126 timing: average: "65.847 μs (15.187 kHz)"
781126-782510 timing: time: "13.840 μs (72.254 kHz)"
781126-782510 timing: average: "65.847 μs (15.187 kHz)"
782510-794324 timing: time: "118.140 μs (8.465 kHz)"
782510-794324 timing: average: "65.904 μs (15.174 kHz)"
794324-795707 timing: time: "13.830 μs (72.307 kHz)"
794324-795707 timing: average: "65.904 μs (15.174 kHz)"
795707-807464 timing: time: "117.570 μs (8.506 kHz)"
795707-807464 timing: average: "65.904 μs (15.174 kHz)"
807464-808847 timing: time: "13.830 μs (72.307 kHz)"
807464-808847 timing: average: "65.903 μs (15.174 kHz)"
808847-820605 timing: time: "117.580 μs (8.505 kHz)"
808847-820605 timing: average: "65.904 μs (15.174 kHz)"
820605-821988 timing: time: "13.830 μs (72.307 kHz)"
820605-821988 timing: average: "65.904 μs (15.174 kHz)"
821988-833745 timing: time: "117.570 μs (8.506 kHz)"
821988-833745 timing: average: "65.904 μs (15.174 kHz)"
833745-835128 timing: time: "13.830 μs (72.307 kHz)"
833745-835128 timing: average: "65.903 μs (15.174 kHz)"
835128-846886 timing: time: "117.580 μs (8.505 kHz)"
835128-846886 timing: average: "65.760 μs (15.207 kHz)"
846886-848269 timing: time: "13.830 μs (72.307 kHz)"
846886-848269 timing: average: "65.759 μs (15.207 kHz)"
848269-860026 timing: time: "117.570 μs (8.506 kHz)"
848269-860026 timing: average: "65.702 μs (15.220 kHz)"
860026-861409 timing: time: "13.830 μs (72.307 kHz)"
860026-861409 timing: average: "65.702 μs (15.220 kHz)"
861409-873311 timing: time: "119.020 μs (8.402 kHz)"
861409-873311 timing: average: "65.847 μs (15.187 kHz)"
873311-874694 timing: time: "13.830 μs (72.307 kHz)"
873311-874694 timing: average: "65.847 μs (15.187 kHz)"
874694-886451 timing: time: "117.570 μs (8.506 kHz)"
874694-886451 timing: average: "65.846 μs (15.187 kHz)"
886451-887835 timing: time: "13.840 μs (72.254 kHz)"
886451-887835 timing: average: "65.847 μs (15.187 kHz)"
887835-899650 timing: time: "118.150 μs (8.464 kHz)"
887835-899650 timing: average: "65.905 μs (15.173 kHz)"
899650-901033 timing: time: "13.830 μs (72.307 kHz)"
899650-901033 timing: average: "65.905 μs (15.173 kHz)"
901033-912791 timing: time: "117.580 μs (8.505 kHz)"
901033-912791 timing: average: "65.905 μs (15.173 kHz)"
912791-914174 timing: time: "13.830 μs (72.307 kHz)"
912791-914174 timing: average: "65.905 μs (15.173 kHz)"
914174-925931 timing: time: "117.570 μs (8.506 kHz)"
914174-925931 timing: average: "65.905 μs (15.173 kHz)"
925931-927314 timing: time: "13.830 μs (72.307 kHz)"
925931-927314 timing: average: "65.905 μs (15.173 kHz)"
927314-939071 timing: time: "117.570 μs (8.506 kHz)"
927314-939071 timing: average: "65.760 μs (15.207 kHz)"
939071-940455 timing: time: "13.840 μs (72.254 kHz)"
939071-940455 timing: average: "65.761 μs (15.207 kHz)"
940455-952212 timing: time: "117.570 μs (8.506 kHz)"
940455-952212 timing: average: "65.761 μs (15.207 kHz)"
952212-953595 timing: time: "13.830 μs (72.307 kHz)"
952212-953595 timing: average: "65.760 μs (15.207 kHz)"
953595-965352 timing: time: "117.570 μs (8.506 kHz)"
953595-965352 timing: average: "65.702 μs (15.220 kHz)"
965352-966736 timing: time: "13.840 μs (72.254 kHz)"
965352-966736 timing: average: "65.703 μs (15.220 kHz)"
966736-978637 timing: time: "119.010 μs (8.403 kHz)"
966736-978637 timing: average: "65.846 μs (15.187 kHz)"
978637-980021 timing: time: "13.840 μs (72.254 kHz)"
978637-980021 timing: average: "65.847 μs (15.187 kHz)"
980021-991835 timing: time: "118.140 μs (8.465 kHz)"
980021-991835 timing: average: "65.904 μs (15.174 kHz)"
991835-993218 timing: time: "13.830 μs (72.307 kHz)"
991835-993218 timing: average: "65.904 μs (15.174 kHz)"
