5650-17407 timing: time: "117.570 μs (8.506 kHz)"
5650-17407 timing: average: "117.570 μs (8.506 kHz)"
18791-30548 timing: time: "117.570 μs (8.506 kHz)"
18791-30548 timing: average: "117.570 μs (8.506 kHz)"
31931-43688 timing: time: "117.570 μs (8.506 kHz)"
31931-43688 timing: average: "117.570 μs (8.506 kHz)"
45072-56829 timing: time: "117.570 μs (8.506 kHz)"
45072-56829 timing: average: "117.570 μs (8.506 kHz)"
58212-69969 timing: time: "117.570 μs (8.506 kHz)"
58212-69969 timing: average: "117.570 μs (8.506 kHz)"
71496-83253 timing: time: "117.570 μs (8.506 kHz)"
71496-83253 timing: average: "117.570 μs (8.506 kHz)"
84636-96453 timing: time: "118.170 μs (8.462 kHz)"
84636-96453 timing: average: "117.656 μs (8.499 kHz)"
97836-109593 timing: time: "117.570 μs (8.506 kHz)"
97836-109593 timing: average: "117.645 μs (8.500 kHz)"
110977-122734 timing: time: "117.570 μs (8.506 kHz)"
110977-122734 timing: average: "117.637 μs (8.501 kHz)"
124117-135874 timing: time: "117.570 μs (8.506 kHz)"
124117-135874 timing: average: "117.630 μs (8.501 kHz)"
137258-149015 timing: time: "117.570 μs (8.506 kHz)"
137258-149015 timing: average: "117.630 μs (8.501 kHz)"
150398-162155 timing: time: "117.570 μs (8.506 kHz)"
150398-162155 timing: average: "117.630 μs (8.501 kHz)"
163539-175440 timing: time: "119.010 μs (8.403 kHz)"
163539-175440 timing: average: "117.774 μs (8.491 kHz)"
176823-188581 timing: time: "117.580 μs (8.505 kHz)"
176823-188581 timing: average: "117.775 μs (8.491 kHz)"
189964-201781 timing: time: "118.170 μs (8.462 kHz)"
189964-201781 timing: average: "117.835 μs (8.486 kHz)"
203164-214921 timing: time: "117.570 μs (8.506 kHz)"
203164-214921 timing: average: "117.835 μs (8.486 kHz)"
216305-228062 timing: time: "117.570 μs (8.506 kHz)"
216305-228062 timing: average: "117.775 μs (8.491 kHz)"
229445-241202 timing: time: "117.570 μs (8.506 kHz)"
229445-241202 timing: average: "117.775 μs (8.491 kHz)"
242585-254343 timing: time: "117.580 μs (8.505 kHz)"
242585-254343 timing: average: "117.776 μs (8.491 kHz)"
255726-267483 timing: time: "117.570 μs (8.506 kHz)"
255726-267483 timing: average: "117.776 μs (8.491 kHz)"
268866-280769 timing: time: "119.030 μs (8.401 kHz)"
268866-280769 timing: average: "117.922 μs (8.480 kHz)"
282153-293971 timing: time: "118.180 μs (8.462 kHz)"
282153-293971 timing: average: "117.983 μs (8.476 kHz)"
295354-307111 timing: time: "117.570 μs (8.506 kHz)"
295354-307111 timing: average: "117.839 μs (8.486 kHz)"
308495-320252 timing: time: "117.570 μs (8.506 kHz)"
308495-320252 timing: average: "117.838 μs (8.486 kHz)"
321635-333392 timing: time: "117.570 μs (8.506 kHz)"
321635-333392 timing: average: "117.778 μs (8.491 kHz)"
334776-346533 timing: time: "117.570 μs (8.506 kHz)"
334776-346533 timing: average: "117.778 μs (8.491 kHz)"
347916-359673 timing: time: "117.570 μs (8.506 kHz)"
347916-359673 timing: average: "117.778 μs (8.491 kHz)"
361057-372959 timing: time: "119.020 μs (8.402 kHz)"
361057-372959 timing: average: "117.923 μs (8.480 kHz)"
374343-386100 timing: time: "117.570 μs (8.506 kHz)"
374343-386100 timing: average: "117.922 μs (8.480 kHz)"
387483-399297 timing: time: "118.140 μs (8.465 kHz)"
387483-399297 timing: average: "117.979 μs (8.476 kHz)"
400681-412438 timing: time: "117.570 μs (8.506 kHz)"
400681-412438 timing: average: "117.833 μs (8.487 kHz)"
413821-425578 timing: time: "117.570 μs (8.506 kHz)"
413821-425578 timing: average: "117.772 μs (8.491 kHz)"
426962-438719 timing: time: "117.570 μs (8.506 kHz)"
426962-438719 timing: average: "117.772 μs (8.491 kHz)"
440102-451859 timing: time: "117.570 μs (8.506 kHz)"
440102-451859 timing: average: "117.772 μs (8.491 kHz)"
453243-465000 timing: time: "117.570 μs (8.506 kHz)"
453243-465000 timing: average: "117.772 μs (8.491 kHz)"
466383-478283 timing: time: "119.000 μs (8.403 kHz)"
466383-478283 timing: average: "117.915 μs (8.481 kHz)"
479667-491424 timing: time: "117.570 μs (8.506 kHz)"
479667-491424 timing: average: "117.915 μs (8.481 kHz)"
492863-504620 timing: time: "117.570 μs (8.506 kHz)"
492863-504620 timing: average: "117.770 μs (8.491 kHz)"
506003-517760 timing: time: "117.570 μs (8.506 kHz)"
506003-517760 timing: average: "117.770 μs (8.491 kHz)"
519143-530901 timing: time: "117.580 μs (8.505 kHz)"
519143-530901 timing: average: "117.714 μs (8.495 kHz)"
532284-544041 timing: time: "117.570 μs (8.506 kHz)"
532284-544041 timing: average: "117.714 μs (8.495 kHz)"
545424-557182 timing: time: "117.580 μs (8.505 kHz)"
545424-557182 timing: average: "117.715 μs (8.495 kHz)"
558565-570322 timing: time: "117.570 μs (8.506 kHz)"
558565-570322 timing: average: "117.715 μs (8.495 kHz)"
571853-583610 timing: time: "117.570 μs (8.506 kHz)"
571853-583610 timing: average: "117.715 μs (8.495 kHz)"
584993-596811 timing: time: "118.180 μs (8.462 kHz)"
584993-596811 timing: average: "117.776 μs (8.491 kHz)"
598195-609952 timing: time: "117.570 μs (8.506 kHz)"
598195-609952 timing: average: "117.633 μs (8.501 kHz)"
611335-623092 timing: time: "117.570 μs (8.506 kHz)"
611335-623092 timing: average: "117.633 μs (8.501 kHz)"
624475-636233 timing: time: "117.580 μs (8.505 kHz)"
624475-636233 timing: average: "117.634 μs (8.501 kHz)"
637616-649373 timing: time: "117.570 μs (8.506 kHz)"
637616-649373 timing: average: "117.634 μs (8.501 kHz)"
650756-662514 timing: time: "117.580 μs (8.505 kHz)"
650756-662514 timing: average: "117.634 μs (8.501 kHz)"
663897-675797 timing: time: "119.000 μs (8.403 kHz)"
663897-675797 timing: average: "117.777 μs (8.491 kHz)"
677180-688938 timing: time: "117.580 μs (8.505 kHz)"
677180-688938 timing: average: "117.777 μs (8.491 kHz)"
690321-702139 timing: time: "118.180 μs (8.462 kHz)"
690321-702139 timing: average: "117.838 μs (8.486 kHz)"
703522-715279 timing: time: "117.570 μs (8.506 kHz)"
703522-715279 timing: average: "117.838 μs (8.486 kHz)"
716663-728420 timing: time: "117.570 μs (8.506 kHz)"
716663-728420 timing: average: "117.777 μs (8.491 kHz)"
729803-741560 timing: time: "117.570 μs (8.506 kHz)"
729803-741560 timing: average: "117.777 μs (8.491 kHz)"
742944-754701 timing: time: "117.570 μs (8.506 kHz)"
742944-754701 timing: average: "117.777 μs (8.491 kHz)"
756084-767841 timing: time: "117.570 μs (8.506 kHz)"
756084-767841 timing: average: "117.776 μs (8.491 kHz)"
769225-781126 timing: time: "119.010 μs (8.403 kHz)"
769225-781126 timing: average: "117.920 μs (8.480 kHz)"
782510-794324 timing: time: "118.140 μs (8.465 kHz)"
782510-794324 timing: average: "117.976 μs (8.476 kHz)"
795707-807464 timing: time: "117.570 μs (8.506 kHz)"
795707-807464 timing: average: "117.833 μs (8.487 kHz)"
808847-820605 timing: time: "117.580 μs (8.505 kHz)"
808847-820605 timing: average: "117.833 μs (8.487 kHz)"
821988-833745 timing: time: "117.570 μs (8.506 kHz)"
821988-833745 timing: average: "117.772 μs (8.491 kHz)"
835128-846886 timing: time: "117.580 μs (8.505 kHz)"
835128-846886 timing: average: "117.773 μs (8.491 kHz)"
848269-860026 timing: time: "117.570 μs (8.506 kHz)"
848269-860026 timing: average: "117.773 μs (8.491 kHz)"
861409-873311 timing: time: "119.020 μs (8.402 kHz)"
861409-873311 timing: average: "117.918 μs (8.480 kHz)"
874694-886451 timing: time: "117.570 μs (8.506 kHz)"
874694-886451 timing: average: "117.918 μs (8.480 kHz)"
887835-899650 timing: time: "118.150 μs (8.464 kHz)"
887835-899650 timing: average: "117.976 μs (8.476 kHz)"
901033-912791 timing: time: "117.580 μs (8.505 kHz)"
901033-912791 timing: average: "117.833 μs (8.487 kHz)"
914174-925931 timing: time: "117.570 μs (8.506 kHz)"
914174-925931 timing: average: "117.776 μs (8.491 kHz)"
927314-939071 timing: time: "117.570 μs (8.506 kHz)"
927314-939071 timing: average: "117.776 μs (8.491 kHz)"
940455-952212 timing: time: "117.570 μs (8.506 kHz)"
940455-952212 timing: average: "117.775 μs (8.491 kHz)"
953595-965352 timing: time: "117.570 μs (8.506 kHz)"
953595-965352 timing: average: "117.775 μs (8.491 kHz)"
966736-978637 timing: time: "119.010 μs (8.403 kHz)"
966736-978637 timing: average: "117.918 μs (8.480 kHz)"
980021-991835 timing: time: "118.140 μs (8.465 kHz)"
980021-991835 timing: average: "117.975 μs (8.476 kHz)"
