100493-100973 onewire_network: text: "Reset/presence: true"
101057-101519 onewire_network: text: "ROM command: 0xf0 'Search ROM'"
101533-115584 onewire_network: text: "ROM: 0x8d011627f794ee28"
116108-116588 onewire_network: text: "Reset/presence: true"
116672-117134 onewire_network: text: "ROM command: 0xf0 'Search ROM'"
117148-131206 onewire_network: text: "ROM: 0x330216255487ee28"
131816-132296 onewire_network: text: "Reset/presence: true"
132383-132845 onewire_network: text: "ROM command: 0xf0 'Search ROM'"
132858-146909 onewire_network: text: "ROM: 0x8d011627f794ee28"
147680-148160 onewire_network: text: "Reset/presence: true"
148248-148713 onewire_network: text: "ROM command: 0x55 'Match ROM'"
148794-153010 onewire_network: text: "ROM: 0x8d011627f794ee28"
153092-153554 onewire_network: text: "Data: 0xbe"
153636-154098 onewire_network: text: "Data: 0x82"
154172-154635 onewire_network: text: "Data: 0x01"
154709-155171 onewire_network: text: "Data: 0x4b"
155245-155707 onewire_network: text: "Data: 0x46"
155781-156243 onewire_network: text: "Data: 0x7f"
156317-156779 onewire_network: text: "Data: 0xff"
156853-157315 onewire_network: text: "Data: 0x0c"
157389-157851 onewire_network: text: "Data: 0x10"
157925-158388 onewire_network: text: "Data: 0xe1"
158491-158956 onewire_network: text: "Data: 0x4e"
159036-159501 onewire_network: text: "Data: 0x4b"
159572-160037 onewire_network: text: "Data: 0x46"
160108-160573 onewire_network: text: "Data: 0x1f"
160653-161118 onewire_network: text: "Data: 0x48"
161619-162099 onewire_network: text: "Reset/presence: true"
162183-162645 onewire_network: text: "ROM command: 0xf0 'Search ROM'"
162659-176715 onewire_network: text: "ROM: 0x330216255487ee28"
177499-177979 onewire_network: text: "Reset/presence: true"
178067-178532 onewire_network: text: "ROM command: 0x55 'Match ROM'"
178614-182832 onewire_network: text: "ROM: 0x330216255487ee28"
182912-183374 onewire_network: text: "Data: 0xbe"
183456-183918 onewire_network: text: "Data: 0x81"
183992-184454 onewire_network: text: "Data: 0x01"
184528-184990 onewire_network: text: "Data: 0x4b"
185064-185527 onewire_network: text: "Data: 0x46"
185601-186063 onewire_network: text: "Data: 0x7f"
186137-186599 onewire_network: text: "Data: 0xff"
186673-187135 onewire_network: text: "Data: 0x0c"
187209-187671 onewire_network: text: "Data: 0x10"
187745-188207 onewire_network: text: "Data: 0x24"
188311-188776 onewire_network: text: "Data: 0x4e"
188856-189321 onewire_network: text: "Data: 0x4b"
189392-189857 onewire_network: text: "Data: 0x46"
189928-190393 onewire_network: text: "Data: 0x1f"
190473-190937 onewire_network: text: "Data: 0x48"
191542-192022 onewire_network: text: "Reset/presence: true"
192108-192569 onewire_network: text: "ROM command: 0xcc 'Skip ROM'"
192651-193116 onewire_network: text: "Data: 0x44"
425201-425681 onewire_network: text: "Reset/presence: true"
425769-426234 onewire_network: text: "ROM command: 0x55 'Match ROM'"
426315-430531 onewire_network: text: "ROM: 0x8d011627f794ee28"
430613-431075 onewire_network: text: "Data: 0xbe"
431159-431621 onewire_network: text: "Data: 0x82"
431695-432157 onewire_network: text: "Data: 0x01"
432231-432693 onewire_network: text: "Data: 0x4b"
432767-433229 onewire_network: text: "Data: 0x46"
433303-433766 onewire_network: text: "Data: 0x7f"
433840-434302 onewire_network: text: "Data: 0xff"
434376-434838 onewire_network: text: "Data: 0x0c"
434912-435374 onewire_network: text: "Data: 0x10"
435448-435910 onewire_network: text: "Data: 0xe1"
436672-437152 onewire_network: text: "Reset/presence: true"
437240-437705 onewire_network: text: "ROM command: 0x55 'Match ROM'"
437786-442004 onewire_network: text: "ROM: 0x330216255487ee28"
442084-442546 onewire_network: text: "Data: 0xbe"
442628-443090 onewire_network: text: "Data: 0x81"
443164-443627 onewire_network: text: "Data: 0x01"
443701-444163 onewire_network: text: "Data: 0x4b"
444237-444699 onewire_network: text: "Data: 0x46"
444773-445235 onewire_network: text: "Data: 0x7f"
445309-445771 onewire_network: text: "Data: 0xff"
445845-446307 onewire_network: text: "Data: 0x0c"
446381-446843 onewire_network: text: "Data: 0x10"
446917-447380 onewire_network: text: "Data: 0x24"
1425368-1425848 onewire_network: text: "Reset/presence: true"
1425932-1426394 onewire_network: text: "ROM command: 0xcc 'Skip ROM'"
1426477-1426942 onewire_network: text: "Data: 0x44"
