513-993 onewire_network: text: "Reset/presence: true"
5060-5515 onewire_network: text: "ROM command: 0xf0 'Search ROM'"
6036-30481 onewire_network: text: "ROM: 0x3f000000c8cf9b28"
34728-35208 onewire_network: text: "Reset/presence: true"
39278-39733 onewire_network: text: "ROM command: 0x55 'Match ROM'"
40316-48056 onewire_network: text: "ROM: 0x3f000000c8cf9b28"
51028-51486 onewire_network: text: "Data: 0xbe"
54045-54506 onewire_network: text: "Data: 0xac"
55086-55546 onewire_network: text: "Data: 0x01"
56125-56586 onewire_network: text: "Data: 0x4b"
57165-57626 onewire_network: text: "Data: 0x46"
58205-58666 onewire_network: text: "Data: 0x7f"
59245-59706 onewire_network: text: "Data: 0xff"
60285-60745 onewire_network: text: "Data: 0x04"
61325-61786 onewire_network: text: "Data: 0x10"
62365-62826 onewire_network: text: "Data: 0x86"
67590-68070 onewire_network: text: "Reset/presence: true"
72141-72596 onewire_network: text: "ROM command: 0x55 'Match ROM'"
73179-80919 onewire_network: text: "ROM: 0x3f000000c8cf9b28"
83994-84449 onewire_network: text: "Data: 0xb4"
87012-87473 onewire_network: text: "Data: 0xff"
91511-91991 onewire_network: text: "Reset/presence: true"
96060-96515 onewire_network: text: "ROM command: 0x55 'Match ROM'"
97098-104839 onewire_network: text: "ROM: 0x3f000000c8cf9b28"
108018-108471 onewire_network: text: "Data: 0x44"
121228-174326 onewire_network: text: "Data: 0xff"
174534-228397 onewire_network: text: "Data: 0xff"
228538-334104 onewire_network: text: "Data: 0xff"
334177-387410 onewire_network: text: "Data: 0xff"
387561-440545 onewire_network: text: "Data: 0xff"
493189-546221 onewire_network: text: "Data: 0xff"
546428-599356 onewire_network: text: "Data: 0xff"
652135-705063 onewire_network: text: "Data: 0xff"
709568-710048 onewire_network: text: "Reset/presence: true"
714117-714572 onewire_network: text: "ROM command: 0x55 'Match ROM'"
715155-722896 onewire_network: text: "ROM: 0x3f000000c8cf9b28"
725971-726430 onewire_network: text: "Data: 0xbe"
728989-729450 onewire_network: text: "Data: 0x98"
730029-730490 onewire_network: text: "Data: 0x01"
731069-731530 onewire_network: text: "Data: 0x4b"
732109-732570 onewire_network: text: "Data: 0x46"
733149-733610 onewire_network: text: "Data: 0x7f"
734189-734650 onewire_network: text: "Data: 0xff"
735229-735690 onewire_network: text: "Data: 0x08"
736269-736730 onewire_network: text: "Data: 0x10"
