8949750-8953590 onewire_network: text: "Reset/presence: true"
9056578-9060784 onewire_network: text: "ROM command: 0xf0 'Search ROM'"
9065077-9282488 onewire_network: text: "ROM: 0x05000000586ce20b"
9318856-9322696 onewire_network: text: "Reset/presence: true"
9431443-9435671 onewire_network: text: "ROM command: 0x55 'Match ROM'"
9439946-9503595 onewire_network: text: "ROM: 0x05000000586ce20b"
9521987-9526189 onewire_network: text: "Data: 0xaa"
9530486-9534637 onewire_network: text: "Data: 0x00"
9538979-9543147 onewire_network: text: "Data: 0x01"
9562283-9566550 onewire_network: text: "Data: 0xff"
9570778-9575047 onewire_network: text: "Data: 0xff"
9579273-9583540 onewire_network: text: "Data: 0xff"
9587765-9592036 onewire_network: text: "Data: 0xff"
9596260-9600531 onewire_network: text: "Data: 0xff"
9604754-9609025 onewire_network: text: "Data: 0xff"
9613251-9617520 onewire_network: text: "Data: 0xff"
9621746-9626013 onewire_network: text: "Data: 0xff"
9630238-9634508 onewire_network: text: "Data: 0x90"
9638735-9643004 onewire_network: text: "Data: 0x31"
9666351-9670618 onewire_network: text: "Data: 0xff"
9674847-9679114 onewire_network: text: "Data: 0xff"
9683342-9687612 onewire_network: text: "Data: 0xff"
9691835-9696104 onewire_network: text: "Data: 0xff"
9700331-9704599 onewire_network: text: "Data: 0xff"
9708825-9713093 onewire_network: text: "Data: 0xff"
9717318-9721586 onewire_network: text: "Data: 0xff"
9725812-9730080 onewire_network: text: "Data: 0xff"
9734307-9738575 onewire_network: text: "Data: 0xbe"
9742804-9747070 onewire_network: text: "Data: 0x7b"
9770288-9774558 onewire_network: text: "Data: 0xff"
9778788-9783056 onewire_network: text: "Data: 0xff"
9787281-9791551 onewire_network: text: "Data: 0xff"
9795776-9800044 onewire_network: text: "Data: 0xff"
9804270-9808538 onewire_network: text: "Data: 0xff"
9812764-9817032 onewire_network: text: "Data: 0xff"
9821258-9825529 onewire_network: text: "Data: 0xff"
9829753-9834023 onewire_network: text: "Data: 0xff"
9838248-9842516 onewire_network: text: "Data: 0xbe"
9846746-9851013 onewire_network: text: "Data: 0x7b"
9874486-9878754 onewire_network: text: "Data: 0xff"
9882983-9887250 onewire_network: text: "Data: 0xff"
9891475-9895747 onewire_network: text: "Data: 0xff"
9899971-9904239 onewire_network: text: "Data: 0xff"
9908465-9912737 onewire_network: text: "Data: 0xff"
9916963-9921230 onewire_network: text: "Data: 0xff"
9925456-9929723 onewire_network: text: "Data: 0xff"
9933951-9938219 onewire_network: text: "Data: 0xff"
9942446-9946714 onewire_network: text: "Data: 0xbe"
9950941-9955208 onewire_network: text: "Data: 0x7b"
9978382-9982653 onewire_network: text: "Data: 0xff"
9986883-9991151 onewire_network: text: "Data: 0xff"
9995377-9999644 onewire_network: text: "Data: 0xff"
10003870-10008139 onewire_network: text: "Data: 0xff"
10012366-10016633 onewire_network: text: "Data: 0xff"
10020859-10025127 onewire_network: text: "Data: 0xff"
10029354-10033621 onewire_network: text: "Data: 0xff"
10037846-10042117 onewire_network: text: "Data: 0xff"
10046344-10050612 onewire_network: text: "Data: 0xbe"
10054837-10059105 onewire_network: text: "Data: 0x7b"
10082919-10087191 onewire_network: text: "Data: 0xff"
10091420-10095688 onewire_network: text: "Data: 0xff"
10099915-10104183 onewire_network: text: "Data: 0xff"
10108410-10112677 onewire_network: text: "Data: 0xff"
10116905-10121172 onewire_network: text: "Data: 0xff"
10125398-10129665 onewire_network: text: "Data: 0xff"
10133891-10138161 onewire_network: text: "Data: 0xff"
10142387-10146655 onewire_network: text: "Data: 0xff"
10150881-10155150 onewire_network: text: "Data: 0xbe"
10159377-10163643 onewire_network: text: "Data: 0x7b"
10186523-10190790 onewire_network: text: "Data: 0xff"
10195018-10199286 onewire_network: text: "Data: 0xff"
10203513-10207780 onewire_network: text: "Data: 0xff"
10212008-10216276 onewire_network: text: "Data: 0xff"
10220502-10224770 onewire_network: text: "Data: 0xff"
10228998-10233265 onewire_network: text: "Data: 0xff"
10237489-10241758 onewire_network: text: "Data: 0xff"
10245986-10250253 onewire_network: text: "Data: 0xff"
10254479-10258748 onewire_network: text: "Data: 0xbe"
10262974-10267243 onewire_network: text: "Data: 0x7b"
10290334-10294601 onewire_network: text: "Data: 0xff"
10298831-10303097 onewire_network: text: "Data: 0xff"
10307325-10311594 onewire_network: text: "Data: 0xff"
10315820-10320090 onewire_network: text: "Data: 0xff"
10324317-10328585 onewire_network: text: "Data: 0xff"
10332810-10337078 onewire_network: text: "Data: 0xff"
10341305-10345573 onewire_network: text: "Data: 0xff"
10349800-10354066 onewire_network: text: "Data: 0xff"
10358293-10362561 onewire_network: text: "Data: 0xbe"
10366787-10371054 onewire_network: text: "Data: 0x7b"
