2838402-2842242 onewire_network: text: "Reset/presence: true"
2873822-2878026 onewire_network: text: "ROM command: 0xf0 'Search ROM'"
2907801-3041607 onewire_network: text: "ROM: 0x05000000586ce20b"
3962966-3966806 onewire_network: text: "Reset/presence: true"
3994502-3998706 onewire_network: text: "ROM command: 0xf0 'Search ROM'"
4028480-4162286 onewire_network: text: "ROM: 0x05000000586ce20b"
4190866-4194706 onewire_network: text: "Reset/presence: true"
7717842-7721682 onewire_network: text: "Reset/presence: true"
7755952-7760156 onewire_network: text: "ROM command: 0xf0 'Search ROM'"
7789930-7923735 onewire_network: text: "ROM: 0x05000000586ce20b"
8840954-8844794 onewire_network: text: "Reset/presence: true"
8876673-8880877 onewire_network: text: "ROM command: 0xf0 'Search ROM'"
8910651-9044458 onewire_network: text: "ROM: 0x05000000586ce20b"
9072782-9076622 onewire_network: text: "Reset/presence: true"
12594806-12598646 onewire_network: text: "Reset/presence: true"
12630099-12634303 onewire_network: text: "ROM command: 0xf0 'Search ROM'"
12664077-12797882 onewire_network: text: "ROM: 0x05000000586ce20b"
13718942-13722782 onewire_network: text: "Reset/presence: true"
13750777-13754981 onewire_network: text: "ROM command: 0xf0 'Search ROM'"
13784755-13918562 onewire_network: text: "ROM: 0x05000000586ce20b"
13947356-13951196 onewire_network: text: "Reset/presence: true"
17471599-17475439 onewire_network: text: "Reset/presence: true"
17504245-17508449 onewire_network: text: "ROM command: 0xf0 'Search ROM'"
17538223-17672029 onewire_network: text: "ROM: 0x05000000586ce20b"
18471562-18475402 onewire_network: text: "Reset/presence: true"
18504891-18509095 onewire_network: text: "ROM command: 0xf0 'Search ROM'"
18538870-18672676 onewire_network: text: "ROM: 0x05000000586ce20b"
18701042-18704882 onewire_network: text: "Reset/presence: true"
22223791-22227631 onewire_network: text: "Reset/presence: true"
22258358-22262562 onewire_network: text: "ROM command: 0xf0 'Search ROM'"
22292336-22426142 onewire_network: text: "ROM: 0x05000000586ce20b"
23224352-23228192 onewire_network: text: "Reset/presence: true"
23258962-23263166 onewire_network: text: "ROM command: 0xf0 'Search ROM'"
23292940-23426746 onewire_network: text: "ROM: 0x05000000586ce20b"
23455412-23459252 onewire_network: text: "Reset/presence: true"
26976838-26980678 onewire_network: text: "Reset/presence: true"
27012429-27016633 onewire_network: text: "ROM command: 0xf0 'Search ROM'"
27046408-27180213 onewire_network: text: "ROM: 0x05000000586ce20b"
27977185-27981025 onewire_network: text: "Reset/presence: true"
28013075-28017279 onewire_network: text: "ROM command: 0xf0 'Search ROM'"
28047053-28180859 onewire_network: text: "ROM: 0x05000000586ce20b"
28209610-28213450 onewire_network: text: "Reset/presence: true"
31731079-31734919 onewire_network: text: "Reset/presence: true"
31766543-31770747 onewire_network: text: "ROM command: 0xf0 'Search ROM'"
31800521-31934327 onewire_network: text: "ROM: 0x05000000586ce20b"
32855557-32859397 onewire_network: text: "Reset/presence: true"
32887222-32891425 onewire_network: text: "ROM command: 0xf0 'Search ROM'"
32921200-33055006 onewire_network: text: "ROM: 0x05000000586ce20b"
33083373-33087213 onewire_network: text: "Reset/presence: true"
36607446-36611286 onewire_network: text: "Reset/presence: true"
36640690-36644894 onewire_network: text: "ROM command: 0xf0 'Search ROM'"
36674668-36808473 onewire_network: text: "ROM: 0x05000000586ce20b"
37607878-37611718 onewire_network: text: "Reset/presence: true"
37641335-37645539 onewire_network: text: "ROM command: 0xf0 'Search ROM'"
37675314-37809119 onewire_network: text: "ROM: 0x05000000586ce20b"
37837742-37841582 onewire_network: text: "Reset/presence: true"
