10480-17001 onewire_network: text: "ROM command: 0xf0 'Search ROM'"
18768-246326 onewire_network: text: "ROM: 0x44000801e51ec510"
252682-256522 onewire_network: text: "Reset/presence: true"
259321-267060 onewire_network: text: "ROM command: 0xf0 'Search ROM'"
267658-493250 onewire_network: text: "ROM: 0x3f000000c8cf9b28"
499587-503427 onewire_network: text: "Reset/presence: true"
505008-512215 onewire_network: text: "ROM command: 0xf0 'Search ROM'"
512813-740287 onewire_network: text: "ROM: 0x6700000003a6a842"
748016-751856 onewire_network: text: "Reset/presence: true"
754654-761176 onewire_network: text: "ROM command: 0xf0 'Search ROM'"
762798-989285 onewire_network: text: "ROM: 0x3f000000c8cf9b28"
995641-999481 onewire_network: text: "Reset/presence: true"
1001062-1008269 onewire_network: text: "ROM command: 0xf0 'Search ROM'"
1008867-1236293 onewire_network: text: "ROM: 0x6700000003a6a842"
1244022-1247862 onewire_network: text: "Reset/presence: true"
1250660-1257182 onewire_network: text: "ROM command: 0xf0 'Search ROM'"
1258852-1485327 onewire_network: text: "ROM: 0x6700000003a6a842"
1560431-1564271 onewire_network: text: "Reset/presence: true"
1565836-1573286 onewire_network: text: "ROM command: 0x69 'Overdrive match ROM'"
1575835-1616579 onewire_network: text: "ROM: 0x6700000003a6a842"
1620170-1623411 onewire_network: text: "Data: 0xb4"
1624638-1629097 onewire_network: text: "Data: 0xff"
1633995-1637835 onewire_network: text: "Reset/presence: true"
1639400-1647140 onewire_network: text: "ROM command: 0x69 'Overdrive match ROM'"
1650906-1691651 onewire_network: text: "ROM: 0x6700000003a6a842"
1694108-1698568 onewire_network: text: "Data: 0x44"
10010256-10014096 onewire_network: text: "Reset/presence: true"
10015661-10022918 onewire_network: text: "ROM command: 0x69 'Overdrive match ROM'"
10025467-10067429 onewire_network: text: "ROM: 0x6700000003a6a842"
10070769-10075227 onewire_network: text: "Data: 0xbe"
10076474-10079715 onewire_network: text: "Data: 0x9e"
10080962-10085421 onewire_network: text: "Data: 0x01"
10086667-10091126 onewire_network: text: "Data: 0x03"
10092372-10095614 onewire_network: text: "Data: 0x03"
10096860-10101319 onewire_network: text: "Data: 0x7f"
10102565-10107024 onewire_network: text: "Data: 0xff"
10108271-10111512 onewire_network: text: "Data: 0x02"
10112759-10117217 onewire_network: text: "Data: 0x10"
10118464-10121705 onewire_network: text: "Data: 0xb9"
10328759-10332599 onewire_network: text: "Reset/presence: true"
10335242-10342934 onewire_network: text: "ROM command: 0x55 'Match ROM'"
10344697-10415922 onewire_network: text: "ROM: 0x3f000000c8cf9b28"
10420074-10427813 onewire_network: text: "Data: 0xb4"
10429557-10436909 onewire_network: text: "Data: 0xff"
10441356-10445196 onewire_network: text: "Reset/presence: true"
10447839-10455579 onewire_network: text: "ROM command: 0x55 'Match ROM'"
10457342-10528954 onewire_network: text: "ROM: 0x3f000000c8cf9b28"
10533190-10540930 onewire_network: text: "Data: 0x44"
18853768-18857608 onewire_network: text: "Reset/presence: true"
18861469-18869209 onewire_network: text: "ROM command: 0x55 'Match ROM'"
18870972-18942536 onewire_network: text: "ROM: 0x3f000000c8cf9b28"
18947654-18954176 onewire_network: text: "Data: 0xbe"
18957157-18964510 onewire_network: text: "Data: 0x9d"
18966273-18973529 onewire_network: text: "Data: 0x01"
18975293-18982549 onewire_network: text: "Data: 0x4b"
18984313-18991569 onewire_network: text: "Data: 0x46"
18993332-19000540 onewire_network: text: "Data: 0x7f"
19002304-19009560 onewire_network: text: "Data: 0xff"
19012058-19018579 onewire_network: text: "Data: 0x03"
19021271-19028527 onewire_network: text: "Data: 0x10"
19030290-19037546 onewire_network: text: "Data: 0x57"
19245559-19249399 onewire_network: text: "Reset/presence: true"
19253260-19260565 onewire_network: text: "ROM command: 0x55 'Match ROM'"
19262328-19333553 onewire_network: text: "ROM: 0x44000801e51ec510"
19336487-19344226 onewire_network: text: "Data: 0xb4"
19345970-19353564 onewire_network: text: "Data: 0xff"
19358011-19361851 onewire_network: text: "Reset/presence: true"
19365712-19373452 onewire_network: text: "ROM command: 0x55 'Match ROM'"
19375215-19446585 onewire_network: text: "ROM: 0x44000801e51ec510"
19449603-19457343 onewire_network: text: "Data: 0x44"
27771120-27774960 onewire_network: text: "Reset/presence: true"
27777604-27785199 onewire_network: text: "ROM command: 0x55 'Match ROM'"
27786962-27858187 onewire_network: text: "ROM: 0x44000801e51ec510"
27863305-27871044 onewire_network: text: "Data: 0xbe"
27872808-27880209 onewire_network: text: "Data: 0x34"
27881973-27889180 onewire_network: text: "Data: 0x00"
27890944-27898200 onewire_network: text: "Data: 0x4b"
27900698-27907220 onewire_network: text: "Data: 0x46"
27909911-27917167 onewire_network: text: "Data: 0xff"
27918931-27926187 onewire_network: text: "Data: 0xff"
27927950-27935206 onewire_network: text: "Data: 0x0d"
27936970-27944178 onewire_network: text: "Data: 0x10"
27945941-27953197 onewire_network: text: "Data: 0x3c"
