177807-178896 mlx90614: celsius: "Temperature: 24.11 °C"
177807-178896 mlx90614: kelvin: "Temperature: 297.26 K"
275755-276844 mlx90614: celsius: "Temperature: 24.11 °C"
275755-276844 mlx90614: kelvin: "Temperature: 297.26 K"
569598-570683 mlx90614: celsius: "Temperature: 24.09 °C"
569598-570683 mlx90614: kelvin: "Temperature: 297.24 K"
667540-668621 mlx90614: celsius: "Temperature: 24.05 °C"
667540-668621 mlx90614: kelvin: "Temperature: 297.20 K"
961388-962470 mlx90614: celsius: "Temperature: 24.05 °C"
961388-962470 mlx90614: kelvin: "Temperature: 297.20 K"
1059334-1060424 mlx90614: celsius: "Temperature: 24.11 °C"
1059334-1060424 mlx90614: kelvin: "Temperature: 297.26 K"
1353177-1354263 mlx90614: celsius: "Temperature: 24.09 °C"
1353177-1354263 mlx90614: kelvin: "Temperature: 297.24 K"
1451127-1452216 mlx90614: celsius: "Temperature: 24.11 °C"
1451127-1452216 mlx90614: kelvin: "Temperature: 297.26 K"
1744970-1746052 mlx90614: celsius: "Temperature: 24.05 °C"
1744970-1746052 mlx90614: kelvin: "Temperature: 297.20 K"
1842915-1843997 mlx90614: celsius: "Temperature: 24.05 °C"
1842915-1843997 mlx90614: kelvin: "Temperature: 297.20 K"
2136757-2137839 mlx90614: celsius: "Temperature: 24.05 °C"
2136757-2137839 mlx90614: kelvin: "Temperature: 297.20 K"
2234708-2235794 mlx90614: celsius: "Temperature: 24.09 °C"
2234708-2235794 mlx90614: kelvin: "Temperature: 297.24 K"
2528548-2529633 mlx90614: celsius: "Temperature: 24.09 °C"
2528548-2529633 mlx90614: kelvin: "Temperature: 297.24 K"
2626495-2627581 mlx90614: celsius: "Temperature: 24.09 °C"
2626495-2627581 mlx90614: kelvin: "Temperature: 297.24 K"
2920342-2921426 mlx90614: celsius: "Temperature: 24.09 °C"
2920342-2921426 mlx90614: kelvin: "Temperature: 297.24 K"
3018286-3019368 mlx90614: celsius: "Temperature: 24.05 °C"
3018286-3019368 mlx90614: kelvin: "Temperature: 297.20 K"
3312133-3313218 mlx90614: celsius: "Temperature: 24.09 °C"
3312133-3313218 mlx90614: kelvin: "Temperature: 297.24 K"
3410076-3411166 mlx90614: celsius: "Temperature: 24.11 °C"
3410076-3411166 mlx90614: kelvin: "Temperature: 297.26 K"
3703923-3705017 mlx90614: celsius: "Temperature: 27.79 °C"
3703923-3705017 mlx90614: kelvin: "Temperature: 300.94 K"
3801869-3802959 mlx90614: celsius: "Temperature: 27.99 °C"
3801869-3802959 mlx90614: kelvin: "Temperature: 301.14 K"
4095710-4096800 mlx90614: celsius: "Temperature: 25.61 °C"
4095710-4096800 mlx90614: kelvin: "Temperature: 298.76 K"
4193658-4194751 mlx90614: celsius: "Temperature: 24.99 °C"
4193658-4194751 mlx90614: kelvin: "Temperature: 298.14 K"
4487503-4488589 mlx90614: celsius: "Temperature: 25.81 °C"
4487503-4488589 mlx90614: kelvin: "Temperature: 298.96 K"
4585451-4586544 mlx90614: celsius: "Temperature: 25.05 °C"
4585451-4586544 mlx90614: kelvin: "Temperature: 298.20 K"
4879292-4880377 mlx90614: celsius: "Temperature: 24.33 °C"
4879292-4880377 mlx90614: kelvin: "Temperature: 297.48 K"
4977241-4978323 mlx90614: celsius: "Temperature: 24.29 °C"
4977241-4978323 mlx90614: kelvin: "Temperature: 297.44 K"
5271085-5272170 mlx90614: celsius: "Temperature: 24.23 °C"
5271085-5272170 mlx90614: kelvin: "Temperature: 297.38 K"
5369034-5370120 mlx90614: celsius: "Temperature: 24.23 °C"
5369034-5370120 mlx90614: kelvin: "Temperature: 297.38 K"
5662876-5663958 mlx90614: celsius: "Temperature: 24.17 °C"
5662876-5663958 mlx90614: kelvin: "Temperature: 297.32 K"
5760823-5761904 mlx90614: celsius: "Temperature: 24.15 °C"
5760823-5761904 mlx90614: kelvin: "Temperature: 297.30 K"
6054665-6055747 mlx90614: celsius: "Temperature: 24.15 °C"
6054665-6055747 mlx90614: kelvin: "Temperature: 297.30 K"
6152612-6153694 mlx90614: celsius: "Temperature: 24.17 °C"
6152612-6153694 mlx90614: kelvin: "Temperature: 297.32 K"
6446457-6447539 mlx90614: celsius: "Temperature: 24.15 °C"
6446457-6447539 mlx90614: kelvin: "Temperature: 297.30 K"
6544401-6545482 mlx90614: celsius: "Temperature: 24.15 °C"
6544401-6545482 mlx90614: kelvin: "Temperature: 297.30 K"
6838247-6839336 mlx90614: celsius: "Temperature: 24.11 °C"
6838247-6839336 mlx90614: kelvin: "Temperature: 297.26 K"
6936194-6937276 mlx90614: celsius: "Temperature: 24.17 °C"
6936194-6937276 mlx90614: kelvin: "Temperature: 297.32 K"
7230040-7231130 mlx90614: celsius: "Temperature: 24.11 °C"
7230040-7231130 mlx90614: kelvin: "Temperature: 297.26 K"
7327988-7329077 mlx90614: celsius: "Temperature: 24.11 °C"
7327988-7329077 mlx90614: kelvin: "Temperature: 297.26 K"
7621831-7622913 mlx90614: celsius: "Temperature: 24.15 °C"
7621831-7622913 mlx90614: kelvin: "Temperature: 297.30 K"
7719777-7720866 mlx90614: celsius: "Temperature: 24.11 °C"
7719777-7720866 mlx90614: kelvin: "Temperature: 297.26 K"
8013620-8014702 mlx90614: celsius: "Temperature: 24.05 °C"
8013620-8014702 mlx90614: kelvin: "Temperature: 297.20 K"
8111565-8112655 mlx90614: celsius: "Temperature: 24.11 °C"
8111565-8112655 mlx90614: kelvin: "Temperature: 297.26 K"
8405413-8406498 mlx90614: celsius: "Temperature: 24.09 °C"
8405413-8406498 mlx90614: kelvin: "Temperature: 297.24 K"
8503354-8504444 mlx90614: celsius: "Temperature: 24.11 °C"
8503354-8504444 mlx90614: kelvin: "Temperature: 297.26 K"
8797203-8798293 mlx90614: celsius: "Temperature: 24.35 °C"
8797203-8798293 mlx90614: kelvin: "Temperature: 297.50 K"
8895151-8896244 mlx90614: celsius: "Temperature: 25.87 °C"
8895151-8896244 mlx90614: kelvin: "Temperature: 299.02 K"
9188992-9190089 mlx90614: celsius: "Temperature: 31.43 °C"
9188992-9190089 mlx90614: kelvin: "Temperature: 304.58 K"
9286940-9288033 mlx90614: celsius: "Temperature: 31.95 °C"
9286940-9288033 mlx90614: kelvin: "Temperature: 305.10 K"
9580787-9581876 mlx90614: celsius: "Temperature: 32.53 °C"
9580787-9581876 mlx90614: kelvin: "Temperature: 305.68 K"
9678732-9679829 mlx90614: celsius: "Temperature: 32.59 °C"
9678732-9679829 mlx90614: kelvin: "Temperature: 305.74 K"
9972573-9973674 mlx90614: celsius: "Temperature: 32.75 °C"
9972573-9973674 mlx90614: kelvin: "Temperature: 305.90 K"
10070518-10071600 mlx90614: celsius: "Temperature: 32.77 °C"
10070518-10071600 mlx90614: kelvin: "Temperature: 305.92 K"
10364365-10365455 mlx90614: celsius: "Temperature: 32.95 °C"
10364365-10365455 mlx90614: kelvin: "Temperature: 306.10 K"
10462309-10463398 mlx90614: celsius: "Temperature: 32.95 °C"
10462309-10463398 mlx90614: kelvin: "Temperature: 306.10 K"
10756152-10757245 mlx90614: celsius: "Temperature: 28.47 °C"
10756152-10757245 mlx90614: kelvin: "Temperature: 301.62 K"
10854104-10855185 mlx90614: celsius: "Temperature: 26.53 °C"
10854104-10855185 mlx90614: kelvin: "Temperature: 299.68 K"
11147948-11149037 mlx90614: celsius: "Temperature: 24.71 °C"
11147948-11149037 mlx90614: kelvin: "Temperature: 297.86 K"
11245895-11246981 mlx90614: celsius: "Temperature: 24.63 °C"
11245895-11246981 mlx90614: kelvin: "Temperature: 297.78 K"
11539738-11540827 mlx90614: celsius: "Temperature: 24.39 °C"
11539738-11540827 mlx90614: kelvin: "Temperature: 297.54 K"
11637686-11638775 mlx90614: celsius: "Temperature: 24.39 °C"
11637686-11638775 mlx90614: kelvin: "Temperature: 297.54 K"
11931528-11932618 mlx90614: celsius: "Temperature: 24.35 °C"
11931528-11932618 mlx90614: kelvin: "Temperature: 297.50 K"
12029476-12030562 mlx90614: celsius: "Temperature: 24.33 °C"
12029476-12030562 mlx90614: kelvin: "Temperature: 297.48 K"
12323319-12324403 mlx90614: celsius: "Temperature: 24.33 °C"
12323319-12324403 mlx90614: kelvin: "Temperature: 297.48 K"
12421267-12422352 mlx90614: celsius: "Temperature: 24.33 °C"
12421267-12422352 mlx90614: kelvin: "Temperature: 297.48 K"
12715112-12716201 mlx90614: celsius: "Temperature: 24.27 °C"
12715112-12716201 mlx90614: kelvin: "Temperature: 297.42 K"
12813059-12814141 mlx90614: celsius: "Temperature: 24.29 °C"
12813059-12814141 mlx90614: kelvin: "Temperature: 297.44 K"
13106902-13107992 mlx90614: celsius: "Temperature: 24.35 °C"
13106902-13107992 mlx90614: kelvin: "Temperature: 297.50 K"
13204849-13205932 mlx90614: celsius: "Temperature: 24.29 °C"
13204849-13205932 mlx90614: kelvin: "Temperature: 297.44 K"
13498692-13499782 mlx90614: celsius: "Temperature: 24.27 °C"
13498692-13499782 mlx90614: kelvin: "Temperature: 297.42 K"
13596635-13597717 mlx90614: celsius: "Temperature: 24.29 °C"
13596635-13597717 mlx90614: kelvin: "Temperature: 297.44 K"
13890484-13891568 mlx90614: celsius: "Temperature: 24.23 °C"
13890484-13891568 mlx90614: kelvin: "Temperature: 297.38 K"
13988427-13989513 mlx90614: celsius: "Temperature: 24.23 °C"
13988427-13989513 mlx90614: kelvin: "Temperature: 297.38 K"
16553324-16554405 mlx90614: celsius: "Temperature: 24.77 °C"
16553324-16554405 mlx90614: kelvin: "Temperature: 297.92 K"
16651274-16652356 mlx90614: celsius: "Temperature: 24.77 °C"
16651274-16652356 mlx90614: kelvin: "Temperature: 297.92 K"
16945117-16946203 mlx90614: celsius: "Temperature: 24.69 °C"
16945117-16946203 mlx90614: kelvin: "Temperature: 297.84 K"
17043061-17044147 mlx90614: celsius: "Temperature: 24.65 °C"
17043061-17044147 mlx90614: kelvin: "Temperature: 297.80 K"
17336905-17337986 mlx90614: celsius: "Temperature: 24.47 °C"
17336905-17337986 mlx90614: kelvin: "Temperature: 297.62 K"
17434858-17435940 mlx90614: celsius: "Temperature: 24.47 °C"
17434858-17435940 mlx90614: kelvin: "Temperature: 297.62 K"
17728698-17729787 mlx90614: celsius: "Temperature: 24.39 °C"
17728698-17729787 mlx90614: kelvin: "Temperature: 297.54 K"
17826646-17827735 mlx90614: celsius: "Temperature: 24.41 °C"
17826646-17827735 mlx90614: kelvin: "Temperature: 297.56 K"
18120485-18121570 mlx90614: celsius: "Temperature: 24.33 °C"
18120485-18121570 mlx90614: kelvin: "Temperature: 297.48 K"
18218435-18219516 mlx90614: celsius: "Temperature: 24.29 °C"
18218435-18219516 mlx90614: kelvin: "Temperature: 297.44 K"
18512277-18513367 mlx90614: celsius: "Temperature: 24.27 °C"
18512277-18513367 mlx90614: kelvin: "Temperature: 297.42 K"
18610226-18611307 mlx90614: celsius: "Temperature: 24.29 °C"
18610226-18611307 mlx90614: kelvin: "Temperature: 297.44 K"
18904068-18905154 mlx90614: celsius: "Temperature: 24.23 °C"
18904068-18905154 mlx90614: kelvin: "Temperature: 297.38 K"
19002018-19003100 mlx90614: celsius: "Temperature: 24.29 °C"
19002018-19003100 mlx90614: kelvin: "Temperature: 297.44 K"
19295859-19296945 mlx90614: celsius: "Temperature: 24.33 °C"
19295859-19296945 mlx90614: kelvin: "Temperature: 297.48 K"
19393811-19394892 mlx90614: celsius: "Temperature: 24.29 °C"
19393811-19394892 mlx90614: kelvin: "Temperature: 297.44 K"
19687653-19688735 mlx90614: celsius: "Temperature: 24.21 °C"
19687653-19688735 mlx90614: kelvin: "Temperature: 297.36 K"
19785600-19786689 mlx90614: celsius: "Temperature: 24.27 °C"
19785600-19786689 mlx90614: kelvin: "Temperature: 297.42 K"
20079441-20080531 mlx90614: celsius: "Temperature: 24.27 °C"
20079441-20080531 mlx90614: kelvin: "Temperature: 297.42 K"
20177390-20178479 mlx90614: celsius: "Temperature: 24.27 °C"
20177390-20178479 mlx90614: kelvin: "Temperature: 297.42 K"
20471231-20472321 mlx90614: celsius: "Temperature: 24.27 °C"
20471231-20472321 mlx90614: kelvin: "Temperature: 297.42 K"
20569179-20570261 mlx90614: celsius: "Temperature: 24.21 °C"
20569179-20570261 mlx90614: kelvin: "Temperature: 297.36 K"
20863023-20864105 mlx90614: celsius: "Temperature: 24.21 °C"
20863023-20864105 mlx90614: kelvin: "Temperature: 297.36 K"
20960969-20962050 mlx90614: celsius: "Temperature: 24.29 °C"
20960969-20962050 mlx90614: kelvin: "Temperature: 297.44 K"
21254810-21255892 mlx90614: celsius: "Temperature: 24.21 °C"
21254810-21255892 mlx90614: kelvin: "Temperature: 297.36 K"
21352764-21353845 mlx90614: celsius: "Temperature: 24.17 °C"
21352764-21353845 mlx90614: kelvin: "Temperature: 297.32 K"
21646603-21647685 mlx90614: celsius: "Temperature: 24.21 °C"
21646603-21647685 mlx90614: kelvin: "Temperature: 297.36 K"
21744555-21745637 mlx90614: celsius: "Temperature: 24.21 °C"
21744555-21745637 mlx90614: kelvin: "Temperature: 297.36 K"
22038394-22039475 mlx90614: celsius: "Temperature: 24.21 °C"
22038394-22039475 mlx90614: kelvin: "Temperature: 297.36 K"
22136345-22137427 mlx90614: celsius: "Temperature: 24.17 °C"
22136345-22137427 mlx90614: kelvin: "Temperature: 297.32 K"
22430185-22431273 mlx90614: celsius: "Temperature: 24.11 °C"
22430185-22431273 mlx90614: kelvin: "Temperature: 297.26 K"
22528133-22529214 mlx90614: celsius: "Temperature: 24.15 °C"
22528133-22529214 mlx90614: kelvin: "Temperature: 297.30 K"
22821977-22823058 mlx90614: celsius: "Temperature: 24.17 °C"
22821977-22823058 mlx90614: kelvin: "Temperature: 297.32 K"
22919922-22921004 mlx90614: celsius: "Temperature: 24.15 °C"
22919922-22921004 mlx90614: kelvin: "Temperature: 297.30 K"
23213765-23214846 mlx90614: celsius: "Temperature: 24.15 °C"
23213765-23214846 mlx90614: kelvin: "Temperature: 297.30 K"
23311718-23312800 mlx90614: celsius: "Temperature: 24.15 °C"
23311718-23312800 mlx90614: kelvin: "Temperature: 297.30 K"
23605556-23606638 mlx90614: celsius: "Temperature: 24.17 °C"
23605556-23606638 mlx90614: kelvin: "Temperature: 297.32 K"
23703508-23704590 mlx90614: celsius: "Temperature: 24.17 °C"
23703508-23704590 mlx90614: kelvin: "Temperature: 297.32 K"
23997348-23998430 mlx90614: celsius: "Temperature: 24.21 °C"
23997348-23998430 mlx90614: kelvin: "Temperature: 297.36 K"
24095300-24096381 mlx90614: celsius: "Temperature: 24.15 °C"
24095300-24096381 mlx90614: kelvin: "Temperature: 297.30 K"
24389138-24390220 mlx90614: celsius: "Temperature: 24.15 °C"
24389138-24390220 mlx90614: kelvin: "Temperature: 297.30 K"
24487089-24488175 mlx90614: celsius: "Temperature: 24.09 °C"
24487089-24488175 mlx90614: kelvin: "Temperature: 297.24 K"
24780929-24782018 mlx90614: celsius: "Temperature: 24.11 °C"
24780929-24782018 mlx90614: kelvin: "Temperature: 297.26 K"
24878876-24879966 mlx90614: celsius: "Temperature: 24.11 °C"
24878876-24879966 mlx90614: kelvin: "Temperature: 297.26 K"
25172721-25173803 mlx90614: celsius: "Temperature: 24.15 °C"
25172721-25173803 mlx90614: kelvin: "Temperature: 297.30 K"
25270669-25271758 mlx90614: celsius: "Temperature: 24.11 °C"
25270669-25271758 mlx90614: kelvin: "Temperature: 297.26 K"
25564512-25565598 mlx90614: celsius: "Temperature: 24.09 °C"
25564512-25565598 mlx90614: kelvin: "Temperature: 297.24 K"
25662462-25663543 mlx90614: celsius: "Temperature: 24.15 °C"
25662462-25663543 mlx90614: kelvin: "Temperature: 297.30 K"
25956306-25957395 mlx90614: celsius: "Temperature: 24.11 °C"
25956306-25957395 mlx90614: kelvin: "Temperature: 297.26 K"
26054253-26055335 mlx90614: celsius: "Temperature: 24.17 °C"
26054253-26055335 mlx90614: kelvin: "Temperature: 297.32 K"
26348093-26349175 mlx90614: celsius: "Temperature: 24.15 °C"
26348093-26349175 mlx90614: kelvin: "Temperature: 297.30 K"
26446039-26447129 mlx90614: celsius: "Temperature: 24.11 °C"
26446039-26447129 mlx90614: kelvin: "Temperature: 297.26 K"
26739886-26740968 mlx90614: celsius: "Temperature: 24.17 °C"
26739886-26740968 mlx90614: kelvin: "Temperature: 297.32 K"
26837832-26838922 mlx90614: celsius: "Temperature: 24.11 °C"
26837832-26838922 mlx90614: kelvin: "Temperature: 297.26 K"
27131672-27132755 mlx90614: celsius: "Temperature: 24.15 °C"
27131672-27132755 mlx90614: kelvin: "Temperature: 297.30 K"
27229627-27230708 mlx90614: celsius: "Temperature: 24.15 °C"
27229627-27230708 mlx90614: kelvin: "Temperature: 297.30 K"
27523465-27524547 mlx90614: celsius: "Temperature: 24.15 °C"
27523465-27524547 mlx90614: kelvin: "Temperature: 297.30 K"
27621411-27622500 mlx90614: celsius: "Temperature: 24.11 °C"
27621411-27622500 mlx90614: kelvin: "Temperature: 297.26 K"
27915257-27916347 mlx90614: celsius: "Temperature: 24.11 °C"
27915257-27916347 mlx90614: kelvin: "Temperature: 297.26 K"
28013205-28014291 mlx90614: celsius: "Temperature: 24.09 °C"
28013205-28014291 mlx90614: kelvin: "Temperature: 297.24 K"
28307050-28308132 mlx90614: celsius: "Temperature: 24.17 °C"
28307050-28308132 mlx90614: kelvin: "Temperature: 297.32 K"
28404995-28406077 mlx90614: celsius: "Temperature: 24.17 °C"
28404995-28406077 mlx90614: kelvin: "Temperature: 297.32 K"
28698836-28699922 mlx90614: celsius: "Temperature: 24.09 °C"
28698836-28699922 mlx90614: kelvin: "Temperature: 297.24 K"
28796786-28797875 mlx90614: celsius: "Temperature: 24.11 °C"
28796786-28797875 mlx90614: kelvin: "Temperature: 297.26 K"
29090627-29091707 mlx90614: celsius: "Temperature: 24.15 °C"
29090627-29091707 mlx90614: kelvin: "Temperature: 297.30 K"
29188580-29189662 mlx90614: celsius: "Temperature: 24.15 °C"
29188580-29189662 mlx90614: kelvin: "Temperature: 297.30 K"
29482419-29483502 mlx90614: celsius: "Temperature: 24.17 °C"
29482419-29483502 mlx90614: kelvin: "Temperature: 297.32 K"
29580370-29581452 mlx90614: celsius: "Temperature: 24.21 °C"
29580370-29581452 mlx90614: kelvin: "Temperature: 297.36 K"
29874208-29875294 mlx90614: celsius: "Temperature: 24.09 °C"
29874208-29875294 mlx90614: kelvin: "Temperature: 297.24 K"
29972158-29973243 mlx90614: celsius: "Temperature: 24.09 °C"
29972158-29973243 mlx90614: kelvin: "Temperature: 297.24 K"
30266003-30267087 mlx90614: celsius: "Temperature: 24.09 °C"
30266003-30267087 mlx90614: kelvin: "Temperature: 297.24 K"
30363947-30365036 mlx90614: celsius: "Temperature: 24.11 °C"
30363947-30365036 mlx90614: kelvin: "Temperature: 297.26 K"
30657794-30658875 mlx90614: celsius: "Temperature: 24.05 °C"
30657794-30658875 mlx90614: kelvin: "Temperature: 297.20 K"
30755739-30756821 mlx90614: celsius: "Temperature: 24.05 °C"
30755739-30756821 mlx90614: kelvin: "Temperature: 297.20 K"
31049579-31050668 mlx90614: celsius: "Temperature: 24.11 °C"
31049579-31050668 mlx90614: kelvin: "Temperature: 297.26 K"
31147534-31148616 mlx90614: celsius: "Temperature: 24.15 °C"
31147534-31148616 mlx90614: kelvin: "Temperature: 297.30 K"
31441372-31442462 mlx90614: celsius: "Temperature: 24.11 °C"
31441372-31442462 mlx90614: kelvin: "Temperature: 297.26 K"
31539320-31540402 mlx90614: celsius: "Temperature: 24.15 °C"
31539320-31540402 mlx90614: kelvin: "Temperature: 297.30 K"
31833164-31834248 mlx90614: celsius: "Temperature: 24.09 °C"
31833164-31834248 mlx90614: kelvin: "Temperature: 297.24 K"
31931114-31932203 mlx90614: celsius: "Temperature: 24.11 °C"
31931114-31932203 mlx90614: kelvin: "Temperature: 297.26 K"
32224957-32226046 mlx90614: celsius: "Temperature: 24.11 °C"
32224957-32226046 mlx90614: kelvin: "Temperature: 297.26 K"
32322904-32323994 mlx90614: celsius: "Temperature: 24.11 °C"
32322904-32323994 mlx90614: kelvin: "Temperature: 297.26 K"
32616747-32617833 mlx90614: celsius: "Temperature: 24.09 °C"
32616747-32617833 mlx90614: kelvin: "Temperature: 297.24 K"
32714691-32715781 mlx90614: celsius: "Temperature: 24.11 °C"
32714691-32715781 mlx90614: kelvin: "Temperature: 297.26 K"
33008536-33009623 mlx90614: celsius: "Temperature: 24.09 °C"
33008536-33009623 mlx90614: kelvin: "Temperature: 297.24 K"
33106488-33107570 mlx90614: celsius: "Temperature: 24.05 °C"
33106488-33107570 mlx90614: kelvin: "Temperature: 297.20 K"
33400329-33401418 mlx90614: celsius: "Temperature: 24.11 °C"
33400329-33401418 mlx90614: kelvin: "Temperature: 297.26 K"
33498277-33499362 mlx90614: celsius: "Temperature: 24.09 °C"
33498277-33499362 mlx90614: kelvin: "Temperature: 297.24 K"
33792116-33793198 mlx90614: celsius: "Temperature: 24.15 °C"
33792116-33793198 mlx90614: kelvin: "Temperature: 297.30 K"
33890067-33891153 mlx90614: celsius: "Temperature: 24.09 °C"
33890067-33891153 mlx90614: kelvin: "Temperature: 297.24 K"
34183907-34184988 mlx90614: celsius: "Temperature: 24.05 °C"
34183907-34184988 mlx90614: kelvin: "Temperature: 297.20 K"
34281858-34282943 mlx90614: celsius: "Temperature: 24.09 °C"
34281858-34282943 mlx90614: kelvin: "Temperature: 297.24 K"
34575697-34576783 mlx90614: celsius: "Temperature: 24.09 °C"
34575697-34576783 mlx90614: kelvin: "Temperature: 297.24 K"
34673646-34674729 mlx90614: celsius: "Temperature: 24.05 °C"
34673646-34674729 mlx90614: kelvin: "Temperature: 297.20 K"
34967486-34968572 mlx90614: celsius: "Temperature: 24.09 °C"
34967486-34968572 mlx90614: kelvin: "Temperature: 297.24 K"
35065438-35066527 mlx90614: celsius: "Temperature: 24.11 °C"
35065438-35066527 mlx90614: kelvin: "Temperature: 297.26 K"
35359281-35360366 mlx90614: celsius: "Temperature: 24.09 °C"
35359281-35360366 mlx90614: kelvin: "Temperature: 297.24 K"
35457230-35458319 mlx90614: celsius: "Temperature: 24.11 °C"
35457230-35458319 mlx90614: kelvin: "Temperature: 297.26 K"
35751074-35752159 mlx90614: celsius: "Temperature: 24.09 °C"
35751074-35752159 mlx90614: kelvin: "Temperature: 297.24 K"
35849017-35850099 mlx90614: celsius: "Temperature: 24.05 °C"
35849017-35850099 mlx90614: kelvin: "Temperature: 297.20 K"
46502916-46503998 mlx90614: celsius: "Temperature: 24.47 °C"
46502916-46503998 mlx90614: kelvin: "Temperature: 297.62 K"
46600863-46601953 mlx90614: celsius: "Temperature: 24.41 °C"
46600863-46601953 mlx90614: kelvin: "Temperature: 297.56 K"
46894703-46895792 mlx90614: celsius: "Temperature: 24.35 °C"
46894703-46895792 mlx90614: kelvin: "Temperature: 297.50 K"
46992650-46993731 mlx90614: celsius: "Temperature: 24.29 °C"
46992650-46993731 mlx90614: kelvin: "Temperature: 297.44 K"
47286491-47287577 mlx90614: celsius: "Temperature: 24.23 °C"
47286491-47287577 mlx90614: kelvin: "Temperature: 297.38 K"
47384443-47385532 mlx90614: celsius: "Temperature: 24.27 °C"
47384443-47385532 mlx90614: kelvin: "Temperature: 297.42 K"
47678284-47679374 mlx90614: celsius: "Temperature: 24.11 °C"
47678284-47679374 mlx90614: kelvin: "Temperature: 297.26 K"
47776233-47777322 mlx90614: celsius: "Temperature: 24.11 °C"
47776233-47777322 mlx90614: kelvin: "Temperature: 297.26 K"
48070075-48071165 mlx90614: celsius: "Temperature: 24.11 °C"
48070075-48071165 mlx90614: kelvin: "Temperature: 297.26 K"
48168023-48169111 mlx90614: celsius: "Temperature: 24.11 °C"
48168023-48169111 mlx90614: kelvin: "Temperature: 297.26 K"
48461870-48462952 mlx90614: celsius: "Temperature: 24.05 °C"
48461870-48462952 mlx90614: kelvin: "Temperature: 297.20 K"
48559815-48560898 mlx90614: celsius: "Temperature: 24.05 °C"
48559815-48560898 mlx90614: kelvin: "Temperature: 297.20 K"
48853657-48854742 mlx90614: celsius: "Temperature: 24.03 °C"
48853657-48854742 mlx90614: kelvin: "Temperature: 297.18 K"
48951606-48952688 mlx90614: celsius: "Temperature: 24.05 °C"
48951606-48952688 mlx90614: kelvin: "Temperature: 297.20 K"
49245446-49246528 mlx90614: celsius: "Temperature: 23.99 °C"
49245446-49246528 mlx90614: kelvin: "Temperature: 297.14 K"
49343399-49344485 mlx90614: celsius: "Temperature: 24.03 °C"
49343399-49344485 mlx90614: kelvin: "Temperature: 297.18 K"
49637241-49638323 mlx90614: celsius: "Temperature: 23.99 °C"
49637241-49638323 mlx90614: kelvin: "Temperature: 297.14 K"
49735187-49736269 mlx90614: celsius: "Temperature: 23.99 °C"
49735187-49736269 mlx90614: kelvin: "Temperature: 297.14 K"
50029028-50030114 mlx90614: celsius: "Temperature: 24.03 °C"
50029028-50030114 mlx90614: kelvin: "Temperature: 297.18 K"
50126978-50128059 mlx90614: celsius: "Temperature: 23.99 °C"
50126978-50128059 mlx90614: kelvin: "Temperature: 297.14 K"
50420819-50421901 mlx90614: celsius: "Temperature: 23.91 °C"
50420819-50421901 mlx90614: kelvin: "Temperature: 297.06 K"
50518770-50519851 mlx90614: celsius: "Temperature: 23.93 °C"
50518770-50519851 mlx90614: kelvin: "Temperature: 297.08 K"
50812615-50813696 mlx90614: celsius: "Temperature: 23.99 °C"
50812615-50813696 mlx90614: kelvin: "Temperature: 297.14 K"
50910560-50911642 mlx90614: celsius: "Temperature: 23.99 °C"
50910560-50911642 mlx90614: kelvin: "Temperature: 297.14 K"
51204400-51205485 mlx90614: celsius: "Temperature: 24.03 °C"
51204400-51205485 mlx90614: kelvin: "Temperature: 297.18 K"
51302351-51303433 mlx90614: celsius: "Temperature: 23.99 °C"
51302351-51303433 mlx90614: kelvin: "Temperature: 297.14 K"
51596192-51597274 mlx90614: celsius: "Temperature: 23.99 °C"
51596192-51597274 mlx90614: kelvin: "Temperature: 297.14 K"
51694144-51695227 mlx90614: celsius: "Temperature: 23.99 °C"
51694144-51695227 mlx90614: kelvin: "Temperature: 297.14 K"
51987984-51989068 mlx90614: celsius: "Temperature: 23.93 °C"
51987984-51989068 mlx90614: kelvin: "Temperature: 297.08 K"
52085931-52087011 mlx90614: celsius: "Temperature: 23.93 °C"
52085931-52087011 mlx90614: kelvin: "Temperature: 297.08 K"
52379775-52380857 mlx90614: celsius: "Temperature: 23.99 °C"
52379775-52380857 mlx90614: kelvin: "Temperature: 297.14 K"
52477720-52478798 mlx90614: celsius: "Temperature: 23.97 °C"
52477720-52478798 mlx90614: kelvin: "Temperature: 297.12 K"
52771567-52772644 mlx90614: celsius: "Temperature: 23.97 °C"
52771567-52772644 mlx90614: kelvin: "Temperature: 297.12 K"
52869514-52870596 mlx90614: celsius: "Temperature: 23.91 °C"
52869514-52870596 mlx90614: kelvin: "Temperature: 297.06 K"
53163354-53164432 mlx90614: celsius: "Temperature: 23.97 °C"
53163354-53164432 mlx90614: kelvin: "Temperature: 297.12 K"
53261304-53262383 mlx90614: celsius: "Temperature: 23.97 °C"
53261304-53262383 mlx90614: kelvin: "Temperature: 297.12 K"
53555150-53556228 mlx90614: celsius: "Temperature: 23.97 °C"
53555150-53556228 mlx90614: kelvin: "Temperature: 297.12 K"
53653097-53654176 mlx90614: celsius: "Temperature: 23.97 °C"
53653097-53654176 mlx90614: kelvin: "Temperature: 297.12 K"
53946937-53948019 mlx90614: celsius: "Temperature: 23.87 °C"
53946937-53948019 mlx90614: kelvin: "Temperature: 297.02 K"
54044883-54045965 mlx90614: celsius: "Temperature: 23.87 °C"
54044883-54045965 mlx90614: kelvin: "Temperature: 297.02 K"
54338731-54339809 mlx90614: celsius: "Temperature: 23.85 °C"
54338731-54339809 mlx90614: kelvin: "Temperature: 297.00 K"
54436674-54437755 mlx90614: celsius: "Temperature: 23.87 °C"
54436674-54437755 mlx90614: kelvin: "Temperature: 297.02 K"
54730521-54731601 mlx90614: celsius: "Temperature: 23.87 °C"
54730521-54731601 mlx90614: kelvin: "Temperature: 297.02 K"
54828467-54829549 mlx90614: celsius: "Temperature: 23.87 °C"
54828467-54829549 mlx90614: kelvin: "Temperature: 297.02 K"
55122307-55123388 mlx90614: celsius: "Temperature: 23.99 °C"
55122307-55123388 mlx90614: kelvin: "Temperature: 297.14 K"
55220260-55221342 mlx90614: celsius: "Temperature: 23.91 °C"
55220260-55221342 mlx90614: kelvin: "Temperature: 297.06 K"
55514102-55515184 mlx90614: celsius: "Temperature: 23.87 °C"
55514102-55515184 mlx90614: kelvin: "Temperature: 297.02 K"
55612048-55613130 mlx90614: celsius: "Temperature: 23.87 °C"
55612048-55613130 mlx90614: kelvin: "Temperature: 297.02 K"
55905890-55906972 mlx90614: celsius: "Temperature: 23.91 °C"
55905890-55906972 mlx90614: kelvin: "Temperature: 297.06 K"
56003835-56004918 mlx90614: celsius: "Temperature: 23.99 °C"
56003835-56004918 mlx90614: kelvin: "Temperature: 297.14 K"
56297683-56298765 mlx90614: celsius: "Temperature: 23.91 °C"
56297683-56298765 mlx90614: kelvin: "Temperature: 297.06 K"
56395629-56396707 mlx90614: celsius: "Temperature: 23.97 °C"
56395629-56396707 mlx90614: kelvin: "Temperature: 297.12 K"
56689475-56690555 mlx90614: celsius: "Temperature: 23.87 °C"
56689475-56690555 mlx90614: kelvin: "Temperature: 297.02 K"
56787420-56788502 mlx90614: celsius: "Temperature: 23.91 °C"
56787420-56788502 mlx90614: kelvin: "Temperature: 297.06 K"
57081261-57082343 mlx90614: celsius: "Temperature: 23.93 °C"
57081261-57082343 mlx90614: kelvin: "Temperature: 297.08 K"
57179214-57180296 mlx90614: celsius: "Temperature: 23.93 °C"
57179214-57180296 mlx90614: kelvin: "Temperature: 297.08 K"
57473052-57474134 mlx90614: celsius: "Temperature: 23.91 °C"
57473052-57474134 mlx90614: kelvin: "Temperature: 297.06 K"
57571004-57572082 mlx90614: celsius: "Temperature: 23.97 °C"
57571004-57572082 mlx90614: kelvin: "Temperature: 297.12 K"
57864844-57865926 mlx90614: celsius: "Temperature: 23.87 °C"
57864844-57865926 mlx90614: kelvin: "Temperature: 297.02 K"
57962790-57963872 mlx90614: celsius: "Temperature: 23.87 °C"
57962790-57963872 mlx90614: kelvin: "Temperature: 297.02 K"
58256637-58257715 mlx90614: celsius: "Temperature: 23.97 °C"
58256637-58257715 mlx90614: kelvin: "Temperature: 297.12 K"
58354585-58355666 mlx90614: celsius: "Temperature: 23.87 °C"
58354585-58355666 mlx90614: kelvin: "Temperature: 297.02 K"
58648428-58649509 mlx90614: celsius: "Temperature: 23.91 °C"
58648428-58649509 mlx90614: kelvin: "Temperature: 297.06 K"
58746373-58747455 mlx90614: celsius: "Temperature: 23.91 °C"
58746373-58747455 mlx90614: kelvin: "Temperature: 297.06 K"
59040213-59041295 mlx90614: celsius: "Temperature: 23.87 °C"
59040213-59041295 mlx90614: kelvin: "Temperature: 297.02 K"
59138167-59139248 mlx90614: celsius: "Temperature: 23.87 °C"
59138167-59139248 mlx90614: kelvin: "Temperature: 297.02 K"
59432009-59433092 mlx90614: celsius: "Temperature: 23.91 °C"
59432009-59433092 mlx90614: kelvin: "Temperature: 297.06 K"
59529955-59531036 mlx90614: celsius: "Temperature: 23.91 °C"
59529955-59531036 mlx90614: kelvin: "Temperature: 297.06 K"
59823797-59824878 mlx90614: celsius: "Temperature: 23.91 °C"
59823797-59824878 mlx90614: kelvin: "Temperature: 297.06 K"
59921748-59922830 mlx90614: celsius: "Temperature: 23.91 °C"
59921748-59922830 mlx90614: kelvin: "Temperature: 297.06 K"
60215590-60216672 mlx90614: celsius: "Temperature: 23.91 °C"
60215590-60216672 mlx90614: kelvin: "Temperature: 297.06 K"
60313535-60314614 mlx90614: celsius: "Temperature: 23.97 °C"
60313535-60314614 mlx90614: kelvin: "Temperature: 297.12 K"
60607381-60608460 mlx90614: celsius: "Temperature: 23.85 °C"
60607381-60608460 mlx90614: kelvin: "Temperature: 297.00 K"
60705330-60706411 mlx90614: celsius: "Temperature: 23.87 °C"
60705330-60706411 mlx90614: kelvin: "Temperature: 297.02 K"
60999170-61000250 mlx90614: celsius: "Temperature: 23.87 °C"
60999170-61000250 mlx90614: kelvin: "Temperature: 297.02 K"
61097123-61098207 mlx90614: celsius: "Temperature: 23.91 °C"
61097123-61098207 mlx90614: kelvin: "Temperature: 297.06 K"
61390959-61392041 mlx90614: celsius: "Temperature: 23.91 °C"
61390959-61392041 mlx90614: kelvin: "Temperature: 297.06 K"
61488911-61489989 mlx90614: celsius: "Temperature: 23.97 °C"
61488911-61489989 mlx90614: kelvin: "Temperature: 297.12 K"
61782751-61783833 mlx90614: celsius: "Temperature: 23.91 °C"
61782751-61783833 mlx90614: kelvin: "Temperature: 297.06 K"
61880703-61881785 mlx90614: celsius: "Temperature: 23.91 °C"
61880703-61881785 mlx90614: kelvin: "Temperature: 297.06 K"
62174545-62175627 mlx90614: celsius: "Temperature: 23.91 °C"
62174545-62175627 mlx90614: kelvin: "Temperature: 297.06 K"
62272490-62273569 mlx90614: celsius: "Temperature: 23.97 °C"
62272490-62273569 mlx90614: kelvin: "Temperature: 297.12 K"
62566331-62567413 mlx90614: celsius: "Temperature: 23.91 °C"
62566331-62567413 mlx90614: kelvin: "Temperature: 297.06 K"
62664283-62665360 mlx90614: celsius: "Temperature: 23.97 °C"
62664283-62665360 mlx90614: kelvin: "Temperature: 297.12 K"
62958121-62959202 mlx90614: celsius: "Temperature: 23.87 °C"
62958121-62959202 mlx90614: kelvin: "Temperature: 297.02 K"
63056073-63057156 mlx90614: celsius: "Temperature: 23.91 °C"
63056073-63057156 mlx90614: kelvin: "Temperature: 297.06 K"
63349916-63350998 mlx90614: celsius: "Temperature: 23.91 °C"
63349916-63350998 mlx90614: kelvin: "Temperature: 297.06 K"
63447862-63448944 mlx90614: celsius: "Temperature: 23.91 °C"
63447862-63448944 mlx90614: kelvin: "Temperature: 297.06 K"
63741704-63742786 mlx90614: celsius: "Temperature: 23.87 °C"
63741704-63742786 mlx90614: kelvin: "Temperature: 297.02 K"
63839656-63840736 mlx90614: celsius: "Temperature: 23.87 °C"
63839656-63840736 mlx90614: kelvin: "Temperature: 297.02 K"
64133497-64134579 mlx90614: celsius: "Temperature: 23.91 °C"
64133497-64134579 mlx90614: kelvin: "Temperature: 297.06 K"
64231444-64232525 mlx90614: celsius: "Temperature: 23.87 °C"
64231444-64232525 mlx90614: kelvin: "Temperature: 297.02 K"
64525286-64526367 mlx90614: celsius: "Temperature: 23.91 °C"
64525286-64526367 mlx90614: kelvin: "Temperature: 297.06 K"
64623237-64624319 mlx90614: celsius: "Temperature: 23.91 °C"
64623237-64624319 mlx90614: kelvin: "Temperature: 297.06 K"
64917077-64918159 mlx90614: celsius: "Temperature: 23.87 °C"
64917077-64918159 mlx90614: kelvin: "Temperature: 297.02 K"
65015031-65016113 mlx90614: celsius: "Temperature: 23.91 °C"
65015031-65016113 mlx90614: kelvin: "Temperature: 297.06 K"
65308866-65309949 mlx90614: celsius: "Temperature: 23.87 °C"
65308866-65309949 mlx90614: kelvin: "Temperature: 297.02 K"
65406819-65407900 mlx90614: celsius: "Temperature: 23.87 °C"
65406819-65407900 mlx90614: kelvin: "Temperature: 297.02 K"
65700661-65701739 mlx90614: celsius: "Temperature: 23.85 °C"
65700661-65701739 mlx90614: kelvin: "Temperature: 297.00 K"
65798607-65799689 mlx90614: celsius: "Temperature: 23.87 °C"
65798607-65799689 mlx90614: kelvin: "Temperature: 297.02 K"
75743054-75744144 mlx90614: celsius: "Temperature: 24.39 °C"
75743054-75744144 mlx90614: kelvin: "Temperature: 297.54 K"
75840999-75842085 mlx90614: celsius: "Temperature: 24.33 °C"
75840999-75842085 mlx90614: kelvin: "Temperature: 297.48 K"
76134842-76135931 mlx90614: celsius: "Temperature: 24.27 °C"
76134842-76135931 mlx90614: kelvin: "Temperature: 297.42 K"
76232790-76233879 mlx90614: celsius: "Temperature: 24.27 °C"
76232790-76233879 mlx90614: kelvin: "Temperature: 297.42 K"
76526630-76527712 mlx90614: celsius: "Temperature: 24.15 °C"
76526630-76527712 mlx90614: kelvin: "Temperature: 297.30 K"
76624583-76625672 mlx90614: celsius: "Temperature: 24.11 °C"
76624583-76625672 mlx90614: kelvin: "Temperature: 297.26 K"
76918426-76919510 mlx90614: celsius: "Temperature: 24.09 °C"
76918426-76919510 mlx90614: kelvin: "Temperature: 297.24 K"
77016370-77017456 mlx90614: celsius: "Temperature: 24.09 °C"
77016370-77017456 mlx90614: kelvin: "Temperature: 297.24 K"
77310215-77311297 mlx90614: celsius: "Temperature: 24.05 °C"
77310215-77311297 mlx90614: kelvin: "Temperature: 297.20 K"
77408161-77409246 mlx90614: celsius: "Temperature: 24.03 °C"
77408161-77409246 mlx90614: kelvin: "Temperature: 297.18 K"
77702008-77703094 mlx90614: celsius: "Temperature: 24.03 °C"
77702008-77703094 mlx90614: kelvin: "Temperature: 297.18 K"
77799952-77801038 mlx90614: celsius: "Temperature: 24.03 °C"
77799952-77801038 mlx90614: kelvin: "Temperature: 297.18 K"
78093795-78094880 mlx90614: celsius: "Temperature: 24.03 °C"
78093795-78094880 mlx90614: kelvin: "Temperature: 297.18 K"
78191744-78192829 mlx90614: celsius: "Temperature: 24.03 °C"
78191744-78192829 mlx90614: kelvin: "Temperature: 297.18 K"
78485584-78486662 mlx90614: celsius: "Temperature: 23.97 °C"
78485584-78486662 mlx90614: kelvin: "Temperature: 297.12 K"
78583540-78584625 mlx90614: celsius: "Temperature: 24.03 °C"
78583540-78584625 mlx90614: kelvin: "Temperature: 297.18 K"
78877376-78878458 mlx90614: celsius: "Temperature: 23.93 °C"
78877376-78878458 mlx90614: kelvin: "Temperature: 297.08 K"
78975327-78976409 mlx90614: celsius: "Temperature: 23.99 °C"
78975327-78976409 mlx90614: kelvin: "Temperature: 297.14 K"
79269169-79270247 mlx90614: celsius: "Temperature: 23.97 °C"
79269169-79270247 mlx90614: kelvin: "Temperature: 297.12 K"
79367116-79368194 mlx90614: celsius: "Temperature: 23.97 °C"
79367116-79368194 mlx90614: kelvin: "Temperature: 297.12 K"
79660962-79662040 mlx90614: celsius: "Temperature: 23.97 °C"
79660962-79662040 mlx90614: kelvin: "Temperature: 297.12 K"
79758910-79759988 mlx90614: celsius: "Temperature: 23.97 °C"
79758910-79759988 mlx90614: kelvin: "Temperature: 297.12 K"
80052750-80053832 mlx90614: celsius: "Temperature: 23.91 °C"
80052750-80053832 mlx90614: kelvin: "Temperature: 297.06 K"
80150696-80151774 mlx90614: celsius: "Temperature: 23.85 °C"
80150696-80151774 mlx90614: kelvin: "Temperature: 297.00 K"
80444542-80445623 mlx90614: celsius: "Temperature: 23.93 °C"
80444542-80445623 mlx90614: kelvin: "Temperature: 297.08 K"
80542489-80543571 mlx90614: celsius: "Temperature: 23.93 °C"
80542489-80543571 mlx90614: kelvin: "Temperature: 297.08 K"
80836333-80837415 mlx90614: celsius: "Temperature: 23.87 °C"
80836333-80837415 mlx90614: kelvin: "Temperature: 297.02 K"
80934279-80935361 mlx90614: celsius: "Temperature: 23.93 °C"
80934279-80935361 mlx90614: kelvin: "Temperature: 297.08 K"
81228123-81229201 mlx90614: celsius: "Temperature: 23.97 °C"
81228123-81229201 mlx90614: kelvin: "Temperature: 297.12 K"
81326071-81327153 mlx90614: celsius: "Temperature: 23.93 °C"
81326071-81327153 mlx90614: kelvin: "Temperature: 297.08 K"
81619915-81620997 mlx90614: celsius: "Temperature: 23.93 °C"
81619915-81620997 mlx90614: kelvin: "Temperature: 297.08 K"
81717861-81718939 mlx90614: celsius: "Temperature: 23.97 °C"
81717861-81718939 mlx90614: kelvin: "Temperature: 297.12 K"
82011701-82012783 mlx90614: celsius: "Temperature: 23.93 °C"
82011701-82012783 mlx90614: kelvin: "Temperature: 297.08 K"
82109652-82110734 mlx90614: celsius: "Temperature: 23.91 °C"
82109652-82110734 mlx90614: kelvin: "Temperature: 297.06 K"
82403493-82404574 mlx90614: celsius: "Temperature: 23.93 °C"
82403493-82404574 mlx90614: kelvin: "Temperature: 297.08 K"
82501445-82502528 mlx90614: celsius: "Temperature: 23.91 °C"
82501445-82502528 mlx90614: kelvin: "Temperature: 297.06 K"
82795282-82796359 mlx90614: celsius: "Temperature: 23.97 °C"
82795282-82796359 mlx90614: kelvin: "Temperature: 297.12 K"
82893236-82894316 mlx90614: celsius: "Temperature: 23.99 °C"
82893236-82894316 mlx90614: kelvin: "Temperature: 297.14 K"
83187077-83188155 mlx90614: celsius: "Temperature: 23.97 °C"
83187077-83188155 mlx90614: kelvin: "Temperature: 297.12 K"
83285025-83286103 mlx90614: celsius: "Temperature: 23.97 °C"
83285025-83286103 mlx90614: kelvin: "Temperature: 297.12 K"
83578865-83579946 mlx90614: celsius: "Temperature: 23.91 °C"
83578865-83579946 mlx90614: kelvin: "Temperature: 297.06 K"
83676816-83677898 mlx90614: celsius: "Temperature: 23.93 °C"
83676816-83677898 mlx90614: kelvin: "Temperature: 297.08 K"
83970660-83971742 mlx90614: celsius: "Temperature: 23.93 °C"
83970660-83971742 mlx90614: kelvin: "Temperature: 297.08 K"
84068606-84069688 mlx90614: celsius: "Temperature: 23.91 °C"
84068606-84069688 mlx90614: kelvin: "Temperature: 297.06 K"
84362446-84363521 mlx90614: celsius: "Temperature: 23.81 °C"
84362446-84363521 mlx90614: kelvin: "Temperature: 296.96 K"
84460398-84461476 mlx90614: celsius: "Temperature: 23.97 °C"
84460398-84461476 mlx90614: kelvin: "Temperature: 297.12 K"
84754238-84755316 mlx90614: celsius: "Temperature: 23.97 °C"
84754238-84755316 mlx90614: kelvin: "Temperature: 297.12 K"
84852186-84853267 mlx90614: celsius: "Temperature: 23.93 °C"
84852186-84853267 mlx90614: kelvin: "Temperature: 297.08 K"
85146030-85147108 mlx90614: celsius: "Temperature: 23.85 °C"
85146030-85147108 mlx90614: kelvin: "Temperature: 297.00 K"
85243977-85245059 mlx90614: celsius: "Temperature: 23.91 °C"
85243977-85245059 mlx90614: kelvin: "Temperature: 297.06 K"
85537819-85538896 mlx90614: celsius: "Temperature: 23.85 °C"
85537819-85538896 mlx90614: kelvin: "Temperature: 297.00 K"
85635767-85636845 mlx90614: celsius: "Temperature: 23.85 °C"
85635767-85636845 mlx90614: kelvin: "Temperature: 297.00 K"
85929609-85930691 mlx90614: celsius: "Temperature: 23.93 °C"
85929609-85930691 mlx90614: kelvin: "Temperature: 297.08 K"
86027561-86028643 mlx90614: celsius: "Temperature: 23.91 °C"
86027561-86028643 mlx90614: kelvin: "Temperature: 297.06 K"
86321401-86322479 mlx90614: celsius: "Temperature: 23.97 °C"
86321401-86322479 mlx90614: kelvin: "Temperature: 297.12 K"
86419351-86420432 mlx90614: celsius: "Temperature: 23.93 °C"
86419351-86420432 mlx90614: kelvin: "Temperature: 297.08 K"
86713195-86714277 mlx90614: celsius: "Temperature: 23.91 °C"
86713195-86714277 mlx90614: kelvin: "Temperature: 297.06 K"
86811140-86812218 mlx90614: celsius: "Temperature: 23.97 °C"
86811140-86812218 mlx90614: kelvin: "Temperature: 297.12 K"
87104986-87106064 mlx90614: celsius: "Temperature: 23.85 °C"
87104986-87106064 mlx90614: kelvin: "Temperature: 297.00 K"
87202933-87204016 mlx90614: celsius: "Temperature: 23.91 °C"
87202933-87204016 mlx90614: kelvin: "Temperature: 297.06 K"
87496776-87497854 mlx90614: celsius: "Temperature: 23.85 °C"
87496776-87497854 mlx90614: kelvin: "Temperature: 297.00 K"
87594723-87595807 mlx90614: celsius: "Temperature: 23.91 °C"
87594723-87595807 mlx90614: kelvin: "Temperature: 297.06 K"
87888566-87889644 mlx90614: celsius: "Temperature: 23.97 °C"
87888566-87889644 mlx90614: kelvin: "Temperature: 297.12 K"
87986514-87987591 mlx90614: celsius: "Temperature: 23.97 °C"
87986514-87987591 mlx90614: kelvin: "Temperature: 297.12 K"
88280351-88281429 mlx90614: celsius: "Temperature: 23.97 °C"
88280351-88281429 mlx90614: kelvin: "Temperature: 297.12 K"
88378306-88379389 mlx90614: celsius: "Temperature: 23.99 °C"
88378306-88379389 mlx90614: kelvin: "Temperature: 297.14 K"
88672148-88673230 mlx90614: celsius: "Temperature: 23.91 °C"
88672148-88673230 mlx90614: kelvin: "Temperature: 297.06 K"
88770094-88771176 mlx90614: celsius: "Temperature: 23.93 °C"
88770094-88771176 mlx90614: kelvin: "Temperature: 297.08 K"
89063937-89065020 mlx90614: celsius: "Temperature: 23.93 °C"
89063937-89065020 mlx90614: kelvin: "Temperature: 297.08 K"
89161884-89162965 mlx90614: celsius: "Temperature: 23.91 °C"
89161884-89162965 mlx90614: kelvin: "Temperature: 297.06 K"
89455725-89456808 mlx90614: celsius: "Temperature: 23.93 °C"
89455725-89456808 mlx90614: kelvin: "Temperature: 297.08 K"
89553677-89554759 mlx90614: celsius: "Temperature: 23.93 °C"
89553677-89554759 mlx90614: kelvin: "Temperature: 297.08 K"
89847521-89848603 mlx90614: celsius: "Temperature: 23.93 °C"
89847521-89848603 mlx90614: kelvin: "Temperature: 297.08 K"
89945467-89946549 mlx90614: celsius: "Temperature: 23.93 °C"
89945467-89946549 mlx90614: kelvin: "Temperature: 297.08 K"
90239310-90240387 mlx90614: celsius: "Temperature: 23.97 °C"
90239310-90240387 mlx90614: kelvin: "Temperature: 297.12 K"
90337258-90338340 mlx90614: celsius: "Temperature: 23.93 °C"
90337258-90338340 mlx90614: kelvin: "Temperature: 297.08 K"
90631103-90632185 mlx90614: celsius: "Temperature: 23.93 °C"
90631103-90632185 mlx90614: kelvin: "Temperature: 297.08 K"
90729048-90730130 mlx90614: celsius: "Temperature: 23.93 °C"
90729048-90730130 mlx90614: kelvin: "Temperature: 297.08 K"
91022893-91023974 mlx90614: celsius: "Temperature: 23.93 °C"
91022893-91023974 mlx90614: kelvin: "Temperature: 297.08 K"
91120838-91121920 mlx90614: celsius: "Temperature: 23.93 °C"
91120838-91121920 mlx90614: kelvin: "Temperature: 297.08 K"
91414682-91415760 mlx90614: celsius: "Temperature: 23.97 °C"
91414682-91415760 mlx90614: kelvin: "Temperature: 297.12 K"
91512629-91513708 mlx90614: celsius: "Temperature: 23.97 °C"
91512629-91513708 mlx90614: kelvin: "Temperature: 297.12 K"
91806470-91807548 mlx90614: celsius: "Temperature: 23.97 °C"
91806470-91807548 mlx90614: kelvin: "Temperature: 297.12 K"
91904417-91905496 mlx90614: celsius: "Temperature: 23.97 °C"
91904417-91905496 mlx90614: kelvin: "Temperature: 297.12 K"
92198261-92199344 mlx90614: celsius: "Temperature: 23.93 °C"
92198261-92199344 mlx90614: kelvin: "Temperature: 297.08 K"
92296210-92297291 mlx90614: celsius: "Temperature: 23.93 °C"
92296210-92297291 mlx90614: kelvin: "Temperature: 297.08 K"
92590053-92591135 mlx90614: celsius: "Temperature: 23.93 °C"
92590053-92591135 mlx90614: kelvin: "Temperature: 297.08 K"
92688000-92689081 mlx90614: celsius: "Temperature: 23.93 °C"
92688000-92689081 mlx90614: kelvin: "Temperature: 297.08 K"
92981843-92982925 mlx90614: celsius: "Temperature: 23.91 °C"
92981843-92982925 mlx90614: kelvin: "Temperature: 297.06 K"
93079794-93080877 mlx90614: celsius: "Temperature: 23.91 °C"
93079794-93080877 mlx90614: kelvin: "Temperature: 297.06 K"
93373637-93374718 mlx90614: celsius: "Temperature: 23.93 °C"
93373637-93374718 mlx90614: kelvin: "Temperature: 297.08 K"
93471583-93472661 mlx90614: celsius: "Temperature: 23.97 °C"
93471583-93472661 mlx90614: kelvin: "Temperature: 297.12 K"
93765428-93766508 mlx90614: celsius: "Temperature: 23.85 °C"
93765428-93766508 mlx90614: kelvin: "Temperature: 297.00 K"
93863371-93864454 mlx90614: celsius: "Temperature: 23.93 °C"
93863371-93864454 mlx90614: kelvin: "Temperature: 297.08 K"
94157213-94158293 mlx90614: celsius: "Temperature: 23.99 °C"
94157213-94158293 mlx90614: kelvin: "Temperature: 297.14 K"
94255166-94256248 mlx90614: celsius: "Temperature: 23.93 °C"
94255166-94256248 mlx90614: kelvin: "Temperature: 297.08 K"
94549010-94550088 mlx90614: celsius: "Temperature: 23.97 °C"
94549010-94550088 mlx90614: kelvin: "Temperature: 297.12 K"
94646957-94648039 mlx90614: celsius: "Temperature: 23.93 °C"
94646957-94648039 mlx90614: kelvin: "Temperature: 297.08 K"
94940796-94941878 mlx90614: celsius: "Temperature: 23.93 °C"
94940796-94941878 mlx90614: kelvin: "Temperature: 297.08 K"
95038747-95039829 mlx90614: celsius: "Temperature: 23.91 °C"
95038747-95039829 mlx90614: kelvin: "Temperature: 297.06 K"
117363159-117364248 mlx90614: celsius: "Temperature: 24.39 °C"
117363159-117364248 mlx90614: kelvin: "Temperature: 297.54 K"
117461104-117462193 mlx90614: celsius: "Temperature: 24.39 °C"
117461104-117462193 mlx90614: kelvin: "Temperature: 297.54 K"
117754950-117756032 mlx90614: celsius: "Temperature: 24.21 °C"
117754950-117756032 mlx90614: kelvin: "Temperature: 297.36 K"
117852896-117853978 mlx90614: celsius: "Temperature: 24.17 °C"
117852896-117853978 mlx90614: kelvin: "Temperature: 297.32 K"
118146739-118147822 mlx90614: celsius: "Temperature: 24.17 °C"
118146739-118147822 mlx90614: kelvin: "Temperature: 297.32 K"
118244689-118245771 mlx90614: celsius: "Temperature: 24.17 °C"
118244689-118245771 mlx90614: kelvin: "Temperature: 297.32 K"
118538530-118539619 mlx90614: celsius: "Temperature: 24.11 °C"
118538530-118539619 mlx90614: kelvin: "Temperature: 297.26 K"
118636478-118637567 mlx90614: celsius: "Temperature: 24.11 °C"
118636478-118637567 mlx90614: kelvin: "Temperature: 297.26 K"
118930320-118931402 mlx90614: celsius: "Temperature: 23.99 °C"
118930320-118931402 mlx90614: kelvin: "Temperature: 297.14 K"
119028266-119029352 mlx90614: celsius: "Temperature: 24.03 °C"
119028266-119029352 mlx90614: kelvin: "Temperature: 297.18 K"
119322114-119323196 mlx90614: celsius: "Temperature: 23.99 °C"
119322114-119323196 mlx90614: kelvin: "Temperature: 297.14 K"
119420059-119421137 mlx90614: celsius: "Temperature: 23.97 °C"
119420059-119421137 mlx90614: kelvin: "Temperature: 297.12 K"
119713900-119714982 mlx90614: celsius: "Temperature: 23.93 °C"
119713900-119714982 mlx90614: kelvin: "Temperature: 297.08 K"
119811851-119812933 mlx90614: celsius: "Temperature: 23.93 °C"
119811851-119812933 mlx90614: kelvin: "Temperature: 297.08 K"
120105688-120106770 mlx90614: celsius: "Temperature: 23.93 °C"
120105688-120106770 mlx90614: kelvin: "Temperature: 297.08 K"
120203641-120204723 mlx90614: celsius: "Temperature: 23.93 °C"
120203641-120204723 mlx90614: kelvin: "Temperature: 297.08 K"
120497485-120498567 mlx90614: celsius: "Temperature: 23.91 °C"
120497485-120498567 mlx90614: kelvin: "Temperature: 297.06 K"
120595431-120596513 mlx90614: celsius: "Temperature: 23.91 °C"
120595431-120596513 mlx90614: kelvin: "Temperature: 297.06 K"
120889273-120890355 mlx90614: celsius: "Temperature: 23.93 °C"
120889273-120890355 mlx90614: kelvin: "Temperature: 297.08 K"
120987225-120988306 mlx90614: celsius: "Temperature: 23.87 °C"
120987225-120988306 mlx90614: kelvin: "Temperature: 297.02 K"
121281067-121282149 mlx90614: celsius: "Temperature: 23.91 °C"
121281067-121282149 mlx90614: kelvin: "Temperature: 297.06 K"
121379013-121380094 mlx90614: celsius: "Temperature: 23.91 °C"
121379013-121380094 mlx90614: kelvin: "Temperature: 297.06 K"
121672854-121673936 mlx90614: celsius: "Temperature: 23.87 °C"
121672854-121673936 mlx90614: kelvin: "Temperature: 297.02 K"
121770806-121771884 mlx90614: celsius: "Temperature: 23.85 °C"
121770806-121771884 mlx90614: kelvin: "Temperature: 297.00 K"
122064646-122065724 mlx90614: celsius: "Temperature: 23.85 °C"
122064646-122065724 mlx90614: kelvin: "Temperature: 297.00 K"
122162596-122163672 mlx90614: celsius: "Temperature: 23.85 °C"
122162596-122163672 mlx90614: kelvin: "Temperature: 297.00 K"
122456438-122457515 mlx90614: celsius: "Temperature: 23.85 °C"
122456438-122457515 mlx90614: kelvin: "Temperature: 297.00 K"
122554385-122555463 mlx90614: celsius: "Temperature: 23.85 °C"
122554385-122555463 mlx90614: kelvin: "Temperature: 297.00 K"
122848227-122849309 mlx90614: celsius: "Temperature: 23.91 °C"
122848227-122849309 mlx90614: kelvin: "Temperature: 297.06 K"
122946173-122947255 mlx90614: celsius: "Temperature: 23.87 °C"
122946173-122947255 mlx90614: kelvin: "Temperature: 297.02 K"
123240021-123241103 mlx90614: celsius: "Temperature: 23.91 °C"
123240021-123241103 mlx90614: kelvin: "Temperature: 297.06 K"
123337967-123339049 mlx90614: celsius: "Temperature: 23.87 °C"
123337967-123339049 mlx90614: kelvin: "Temperature: 297.02 K"
123631809-123632891 mlx90614: celsius: "Temperature: 23.87 °C"
123631809-123632891 mlx90614: kelvin: "Temperature: 297.02 K"
123729755-123730836 mlx90614: celsius: "Temperature: 23.87 °C"
123729755-123730836 mlx90614: kelvin: "Temperature: 297.02 K"
124023594-124024677 mlx90614: celsius: "Temperature: 23.91 °C"
124023594-124024677 mlx90614: kelvin: "Temperature: 297.06 K"
124121548-124122630 mlx90614: celsius: "Temperature: 23.91 °C"
124121548-124122630 mlx90614: kelvin: "Temperature: 297.06 K"
124415389-124416470 mlx90614: celsius: "Temperature: 23.91 °C"
124415389-124416470 mlx90614: kelvin: "Temperature: 297.06 K"
124513340-124514422 mlx90614: celsius: "Temperature: 23.87 °C"
124513340-124514422 mlx90614: kelvin: "Temperature: 297.02 K"
124807183-124808265 mlx90614: celsius: "Temperature: 23.91 °C"
124807183-124808265 mlx90614: kelvin: "Temperature: 297.06 K"
124905128-124906211 mlx90614: celsius: "Temperature: 23.87 °C"
124905128-124906211 mlx90614: kelvin: "Temperature: 297.02 K"
125198970-125200054 mlx90614: celsius: "Temperature: 23.87 °C"
125198970-125200054 mlx90614: kelvin: "Temperature: 297.02 K"
125296922-125298000 mlx90614: celsius: "Temperature: 23.85 °C"
125296922-125298000 mlx90614: kelvin: "Temperature: 297.00 K"
125590765-125591842 mlx90614: celsius: "Temperature: 23.85 °C"
125590765-125591842 mlx90614: kelvin: "Temperature: 297.00 K"
125688712-125689790 mlx90614: celsius: "Temperature: 23.85 °C"
125688712-125689790 mlx90614: kelvin: "Temperature: 297.00 K"
125982552-125983634 mlx90614: celsius: "Temperature: 23.93 °C"
125982552-125983634 mlx90614: kelvin: "Temperature: 297.08 K"
126080505-126081587 mlx90614: celsius: "Temperature: 23.91 °C"
126080505-126081587 mlx90614: kelvin: "Temperature: 297.06 K"
126374342-126375424 mlx90614: celsius: "Temperature: 23.87 °C"
126374342-126375424 mlx90614: kelvin: "Temperature: 297.02 K"
126472293-126473375 mlx90614: celsius: "Temperature: 23.87 °C"
126472293-126473375 mlx90614: kelvin: "Temperature: 297.02 K"
126766135-126767217 mlx90614: celsius: "Temperature: 23.87 °C"
126766135-126767217 mlx90614: kelvin: "Temperature: 297.02 K"
126864081-126865163 mlx90614: celsius: "Temperature: 23.87 °C"
126864081-126865163 mlx90614: kelvin: "Temperature: 297.02 K"
127157923-127159005 mlx90614: celsius: "Temperature: 23.91 °C"
127157923-127159005 mlx90614: kelvin: "Temperature: 297.06 K"
127255875-127256953 mlx90614: celsius: "Temperature: 23.85 °C"
127255875-127256953 mlx90614: kelvin: "Temperature: 297.00 K"
127549717-127550795 mlx90614: celsius: "Temperature: 23.85 °C"
127549717-127550795 mlx90614: kelvin: "Temperature: 297.00 K"
127647664-127648743 mlx90614: celsius: "Temperature: 23.85 °C"
127647664-127648743 mlx90614: kelvin: "Temperature: 297.00 K"
127941504-127942586 mlx90614: celsius: "Temperature: 23.87 °C"
127941504-127942586 mlx90614: kelvin: "Temperature: 297.02 K"
128039458-128040540 mlx90614: celsius: "Temperature: 23.87 °C"
128039458-128040540 mlx90614: kelvin: "Temperature: 297.02 K"
128333301-128334378 mlx90614: celsius: "Temperature: 23.85 °C"
128333301-128334378 mlx90614: kelvin: "Temperature: 297.00 K"
128431242-128432322 mlx90614: celsius: "Temperature: 23.85 °C"
128431242-128432322 mlx90614: kelvin: "Temperature: 297.00 K"
128725090-128726168 mlx90614: celsius: "Temperature: 23.85 °C"
128725090-128726168 mlx90614: kelvin: "Temperature: 297.00 K"
128823038-128824116 mlx90614: celsius: "Temperature: 23.85 °C"
128823038-128824116 mlx90614: kelvin: "Temperature: 297.00 K"
129116880-129117961 mlx90614: celsius: "Temperature: 23.87 °C"
129116880-129117961 mlx90614: kelvin: "Temperature: 297.02 K"
129214825-129215907 mlx90614: celsius: "Temperature: 23.87 °C"
129214825-129215907 mlx90614: kelvin: "Temperature: 297.02 K"
129508668-129509750 mlx90614: celsius: "Temperature: 23.87 °C"
129508668-129509750 mlx90614: kelvin: "Temperature: 297.02 K"
129606619-129607701 mlx90614: celsius: "Temperature: 23.87 °C"
129606619-129607701 mlx90614: kelvin: "Temperature: 297.02 K"
129900458-129901540 mlx90614: celsius: "Temperature: 23.87 °C"
129900458-129901540 mlx90614: kelvin: "Temperature: 297.02 K"
129998412-129999494 mlx90614: celsius: "Temperature: 23.87 °C"
129998412-129999494 mlx90614: kelvin: "Temperature: 297.02 K"
130292249-130293330 mlx90614: celsius: "Temperature: 23.87 °C"
130292249-130293330 mlx90614: kelvin: "Temperature: 297.02 K"
130390199-130391282 mlx90614: celsius: "Temperature: 23.87 °C"
130390199-130391282 mlx90614: kelvin: "Temperature: 297.02 K"
130684042-130685123 mlx90614: celsius: "Temperature: 23.91 °C"
130684042-130685123 mlx90614: kelvin: "Temperature: 297.06 K"
130781987-130783069 mlx90614: celsius: "Temperature: 23.87 °C"
130781987-130783069 mlx90614: kelvin: "Temperature: 297.02 K"
131075836-131076910 mlx90614: celsius: "Temperature: 23.81 °C"
131075836-131076910 mlx90614: kelvin: "Temperature: 296.96 K"
131173779-131174858 mlx90614: celsius: "Temperature: 23.85 °C"
131173779-131174858 mlx90614: kelvin: "Temperature: 297.00 K"
131467622-131468703 mlx90614: celsius: "Temperature: 23.87 °C"
131467622-131468703 mlx90614: kelvin: "Temperature: 297.02 K"
131565572-131566654 mlx90614: celsius: "Temperature: 23.91 °C"
131565572-131566654 mlx90614: kelvin: "Temperature: 297.06 K"
131859413-131860495 mlx90614: celsius: "Temperature: 23.91 °C"
131859413-131860495 mlx90614: kelvin: "Temperature: 297.06 K"
131957360-131958442 mlx90614: celsius: "Temperature: 23.87 °C"
131957360-131958442 mlx90614: kelvin: "Temperature: 297.02 K"
132251203-132252285 mlx90614: celsius: "Temperature: 23.91 °C"
132251203-132252285 mlx90614: kelvin: "Temperature: 297.06 K"
132349154-132350236 mlx90614: celsius: "Temperature: 23.87 °C"
132349154-132350236 mlx90614: kelvin: "Temperature: 297.02 K"
132642996-132644078 mlx90614: celsius: "Temperature: 23.87 °C"
132642996-132644078 mlx90614: kelvin: "Temperature: 297.02 K"
132740942-132742024 mlx90614: celsius: "Temperature: 23.91 °C"
132740942-132742024 mlx90614: kelvin: "Temperature: 297.06 K"
133034784-133035866 mlx90614: celsius: "Temperature: 23.87 °C"
133034784-133035866 mlx90614: kelvin: "Temperature: 297.02 K"
133132736-133133818 mlx90614: celsius: "Temperature: 23.87 °C"
133132736-133133818 mlx90614: kelvin: "Temperature: 297.02 K"
133426578-133427660 mlx90614: celsius: "Temperature: 23.87 °C"
133426578-133427660 mlx90614: kelvin: "Temperature: 297.02 K"
133524524-133525605 mlx90614: celsius: "Temperature: 23.87 °C"
133524524-133525605 mlx90614: kelvin: "Temperature: 297.02 K"
133818364-133819446 mlx90614: celsius: "Temperature: 23.93 °C"
133818364-133819446 mlx90614: kelvin: "Temperature: 297.08 K"
133916317-133917399 mlx90614: celsius: "Temperature: 23.93 °C"
133916317-133917399 mlx90614: kelvin: "Temperature: 297.08 K"
134210161-134211243 mlx90614: celsius: "Temperature: 23.87 °C"
134210161-134211243 mlx90614: kelvin: "Temperature: 297.02 K"
134308107-134309189 mlx90614: celsius: "Temperature: 23.91 °C"
134308107-134309189 mlx90614: kelvin: "Temperature: 297.06 K"
134601949-134603031 mlx90614: celsius: "Temperature: 23.87 °C"
134601949-134603031 mlx90614: kelvin: "Temperature: 297.02 K"
134699895-134700977 mlx90614: celsius: "Temperature: 23.91 °C"
134699895-134700977 mlx90614: kelvin: "Temperature: 297.06 K"
134993743-134994825 mlx90614: celsius: "Temperature: 23.91 °C"
134993743-134994825 mlx90614: kelvin: "Temperature: 297.06 K"
135091688-135092771 mlx90614: celsius: "Temperature: 23.91 °C"
135091688-135092771 mlx90614: kelvin: "Temperature: 297.06 K"
135385531-135386612 mlx90614: celsius: "Temperature: 23.91 °C"
135385531-135386612 mlx90614: kelvin: "Temperature: 297.06 K"
135483476-135484558 mlx90614: celsius: "Temperature: 23.91 °C"
135483476-135484558 mlx90614: kelvin: "Temperature: 297.06 K"
135777322-135778399 mlx90614: celsius: "Temperature: 23.85 °C"
135777322-135778399 mlx90614: kelvin: "Temperature: 297.00 K"
135875271-135876354 mlx90614: celsius: "Temperature: 23.87 °C"
135875271-135876354 mlx90614: kelvin: "Temperature: 297.02 K"
136169114-136170192 mlx90614: celsius: "Temperature: 23.85 °C"
136169114-136170192 mlx90614: kelvin: "Temperature: 297.00 K"
136267062-136268143 mlx90614: celsius: "Temperature: 23.87 °C"
136267062-136268143 mlx90614: kelvin: "Temperature: 297.02 K"
136560904-136561985 mlx90614: celsius: "Temperature: 23.87 °C"
136560904-136561985 mlx90614: kelvin: "Temperature: 297.02 K"
136658850-136659931 mlx90614: celsius: "Temperature: 23.91 °C"
136658850-136659931 mlx90614: kelvin: "Temperature: 297.06 K"
352412136-352413222 mlx90614: celsius: "Temperature: 24.51 °C"
352412136-352413222 mlx90614: kelvin: "Temperature: 297.66 K"
352510078-352511161 mlx90614: celsius: "Temperature: 24.47 °C"
352510078-352511161 mlx90614: kelvin: "Temperature: 297.62 K"
352803929-352805010 mlx90614: celsius: "Temperature: 24.29 °C"
352803929-352805010 mlx90614: kelvin: "Temperature: 297.44 K"
352901874-352902964 mlx90614: celsius: "Temperature: 24.27 °C"
352901874-352902964 mlx90614: kelvin: "Temperature: 297.42 K"
353195714-353196796 mlx90614: celsius: "Temperature: 24.17 °C"
353195714-353196796 mlx90614: kelvin: "Temperature: 297.32 K"
353293662-353294745 mlx90614: celsius: "Temperature: 24.15 °C"
353293662-353294745 mlx90614: kelvin: "Temperature: 297.30 K"
353587506-353588592 mlx90614: celsius: "Temperature: 24.09 °C"
353587506-353588592 mlx90614: kelvin: "Temperature: 297.24 K"
353685455-353686541 mlx90614: celsius: "Temperature: 24.09 °C"
353685455-353686541 mlx90614: kelvin: "Temperature: 297.24 K"
353979295-353980380 mlx90614: celsius: "Temperature: 24.09 °C"
353979295-353980380 mlx90614: kelvin: "Temperature: 297.24 K"
354077244-354078326 mlx90614: celsius: "Temperature: 24.05 °C"
354077244-354078326 mlx90614: kelvin: "Temperature: 297.20 K"
354371085-354372167 mlx90614: celsius: "Temperature: 24.05 °C"
354371085-354372167 mlx90614: kelvin: "Temperature: 297.20 K"
354469037-354470122 mlx90614: celsius: "Temperature: 24.03 °C"
354469037-354470122 mlx90614: kelvin: "Temperature: 297.18 K"
354762879-354763964 mlx90614: celsius: "Temperature: 24.03 °C"
354762879-354763964 mlx90614: kelvin: "Temperature: 297.18 K"
354860828-354861910 mlx90614: celsius: "Temperature: 23.99 °C"
354860828-354861910 mlx90614: kelvin: "Temperature: 297.14 K"
355154667-355155753 mlx90614: celsius: "Temperature: 24.03 °C"
355154667-355155753 mlx90614: kelvin: "Temperature: 297.18 K"
355252619-355253704 mlx90614: celsius: "Temperature: 24.03 °C"
355252619-355253704 mlx90614: kelvin: "Temperature: 297.18 K"
355546462-355547542 mlx90614: celsius: "Temperature: 23.93 °C"
355546462-355547542 mlx90614: kelvin: "Temperature: 297.08 K"
355644407-355645488 mlx90614: celsius: "Temperature: 23.93 °C"
355644407-355645488 mlx90614: kelvin: "Temperature: 297.08 K"
355938251-355939336 mlx90614: celsius: "Temperature: 24.03 °C"
355938251-355939336 mlx90614: kelvin: "Temperature: 297.18 K"
356036194-356037272 mlx90614: celsius: "Temperature: 23.97 °C"
356036194-356037272 mlx90614: kelvin: "Temperature: 297.12 K"
356330040-356331120 mlx90614: celsius: "Temperature: 23.97 °C"
356330040-356331120 mlx90614: kelvin: "Temperature: 297.12 K"
356427988-356429070 mlx90614: celsius: "Temperature: 23.99 °C"
356427988-356429070 mlx90614: kelvin: "Temperature: 297.14 K"
356721829-356722911 mlx90614: celsius: "Temperature: 23.91 °C"
356721829-356722911 mlx90614: kelvin: "Temperature: 297.06 K"
356819781-356820862 mlx90614: celsius: "Temperature: 23.87 °C"
356819781-356820862 mlx90614: kelvin: "Temperature: 297.02 K"
357113621-357114703 mlx90614: celsius: "Temperature: 23.93 °C"
357113621-357114703 mlx90614: kelvin: "Temperature: 297.08 K"
357211568-357212650 mlx90614: celsius: "Temperature: 23.93 °C"
357211568-357212650 mlx90614: kelvin: "Temperature: 297.08 K"
357505412-357506494 mlx90614: celsius: "Temperature: 23.93 °C"
357505412-357506494 mlx90614: kelvin: "Temperature: 297.08 K"
357603358-357604440 mlx90614: celsius: "Temperature: 23.93 °C"
357603358-357604440 mlx90614: kelvin: "Temperature: 297.08 K"
357897202-357898284 mlx90614: celsius: "Temperature: 23.91 °C"
357897202-357898284 mlx90614: kelvin: "Temperature: 297.06 K"
357995148-357996230 mlx90614: celsius: "Temperature: 23.93 °C"
357995148-357996230 mlx90614: kelvin: "Temperature: 297.08 K"
358288992-358290075 mlx90614: celsius: "Temperature: 23.93 °C"
358288992-358290075 mlx90614: kelvin: "Temperature: 297.08 K"
358386943-358388025 mlx90614: celsius: "Temperature: 23.91 °C"
358386943-358388025 mlx90614: kelvin: "Temperature: 297.06 K"
358680786-358681867 mlx90614: celsius: "Temperature: 23.93 °C"
358680786-358681867 mlx90614: kelvin: "Temperature: 297.08 K"
358778731-358779813 mlx90614: celsius: "Temperature: 23.93 °C"
358778731-358779813 mlx90614: kelvin: "Temperature: 297.08 K"
359072574-359073651 mlx90614: celsius: "Temperature: 23.97 °C"
359072574-359073651 mlx90614: kelvin: "Temperature: 297.12 K"
359170523-359171604 mlx90614: celsius: "Temperature: 23.93 °C"
359170523-359171604 mlx90614: kelvin: "Temperature: 297.08 K"
359464367-359465443 mlx90614: celsius: "Temperature: 23.97 °C"
359464367-359465443 mlx90614: kelvin: "Temperature: 297.12 K"
359562314-359563392 mlx90614: celsius: "Temperature: 23.97 °C"
359562314-359563392 mlx90614: kelvin: "Temperature: 297.12 K"
359856154-359857236 mlx90614: celsius: "Temperature: 23.87 °C"
359856154-359857236 mlx90614: kelvin: "Temperature: 297.02 K"
359954106-359955188 mlx90614: celsius: "Temperature: 23.87 °C"
359954106-359955188 mlx90614: kelvin: "Temperature: 297.02 K"
360247948-360249030 mlx90614: celsius: "Temperature: 23.99 °C"
360247948-360249030 mlx90614: kelvin: "Temperature: 297.14 K"
360345894-360346972 mlx90614: celsius: "Temperature: 23.97 °C"
360345894-360346972 mlx90614: kelvin: "Temperature: 297.12 K"
360639740-360640818 mlx90614: celsius: "Temperature: 23.97 °C"
360639740-360640818 mlx90614: kelvin: "Temperature: 297.12 K"
360737687-360738765 mlx90614: celsius: "Temperature: 23.97 °C"
360737687-360738765 mlx90614: kelvin: "Temperature: 297.12 K"
361031526-361032607 mlx90614: celsius: "Temperature: 23.91 °C"
361031526-361032607 mlx90614: kelvin: "Temperature: 297.06 K"
361129479-361130561 mlx90614: celsius: "Temperature: 23.91 °C"
361129479-361130561 mlx90614: kelvin: "Temperature: 297.06 K"
361423321-361424403 mlx90614: celsius: "Temperature: 23.91 °C"
361423321-361424403 mlx90614: kelvin: "Temperature: 297.06 K"
361521267-361522348 mlx90614: celsius: "Temperature: 23.87 °C"
361521267-361522348 mlx90614: kelvin: "Temperature: 297.02 K"
361815109-361816191 mlx90614: celsius: "Temperature: 23.91 °C"
361815109-361816191 mlx90614: kelvin: "Temperature: 297.06 K"
361913055-361914136 mlx90614: celsius: "Temperature: 23.91 °C"
361913055-361914136 mlx90614: kelvin: "Temperature: 297.06 K"
362206902-362207984 mlx90614: celsius: "Temperature: 23.93 °C"
362206902-362207984 mlx90614: kelvin: "Temperature: 297.08 K"
362304848-362305930 mlx90614: celsius: "Temperature: 23.91 °C"
362304848-362305930 mlx90614: kelvin: "Temperature: 297.06 K"
362598690-362599772 mlx90614: celsius: "Temperature: 23.99 °C"
362598690-362599772 mlx90614: kelvin: "Temperature: 297.14 K"
362696636-362697714 mlx90614: celsius: "Temperature: 23.97 °C"
362696636-362697714 mlx90614: kelvin: "Temperature: 297.12 K"
362990480-362991558 mlx90614: celsius: "Temperature: 23.97 °C"
362990480-362991558 mlx90614: kelvin: "Temperature: 297.12 K"
363088430-363089508 mlx90614: celsius: "Temperature: 23.97 °C"
363088430-363089508 mlx90614: kelvin: "Temperature: 297.12 K"
363382275-363383357 mlx90614: celsius: "Temperature: 23.93 °C"
363382275-363383357 mlx90614: kelvin: "Temperature: 297.08 K"
363480221-363481303 mlx90614: celsius: "Temperature: 23.93 °C"
363480221-363481303 mlx90614: kelvin: "Temperature: 297.08 K"
363774065-363775147 mlx90614: celsius: "Temperature: 23.93 °C"
363774065-363775147 mlx90614: kelvin: "Temperature: 297.08 K"
363872011-363873093 mlx90614: celsius: "Temperature: 23.93 °C"
363872011-363873093 mlx90614: kelvin: "Temperature: 297.08 K"
364165855-364166936 mlx90614: celsius: "Temperature: 23.93 °C"
364165855-364166936 mlx90614: kelvin: "Temperature: 297.08 K"
364263801-364264882 mlx90614: celsius: "Temperature: 23.93 °C"
364263801-364264882 mlx90614: kelvin: "Temperature: 297.08 K"
364557645-364558726 mlx90614: celsius: "Temperature: 23.93 °C"
364557645-364558726 mlx90614: kelvin: "Temperature: 297.08 K"
364655590-364656672 mlx90614: celsius: "Temperature: 23.91 °C"
364655590-364656672 mlx90614: kelvin: "Temperature: 297.06 K"
364949436-364950518 mlx90614: celsius: "Temperature: 23.93 °C"
364949436-364950518 mlx90614: kelvin: "Temperature: 297.08 K"
365047384-365048466 mlx90614: celsius: "Temperature: 23.93 °C"
365047384-365048466 mlx90614: kelvin: "Temperature: 297.08 K"
365341228-365342309 mlx90614: celsius: "Temperature: 23.93 °C"
365341228-365342309 mlx90614: kelvin: "Temperature: 297.08 K"
365439173-365440255 mlx90614: celsius: "Temperature: 23.91 °C"
365439173-365440255 mlx90614: kelvin: "Temperature: 297.06 K"
365733016-365734093 mlx90614: celsius: "Temperature: 23.97 °C"
365733016-365734093 mlx90614: kelvin: "Temperature: 297.12 K"
365830963-365832041 mlx90614: celsius: "Temperature: 23.97 °C"
365830963-365832041 mlx90614: kelvin: "Temperature: 297.12 K"
366124809-366125887 mlx90614: celsius: "Temperature: 23.97 °C"
366124809-366125887 mlx90614: kelvin: "Temperature: 297.12 K"
366222757-366223835 mlx90614: celsius: "Temperature: 23.97 °C"
366222757-366223835 mlx90614: kelvin: "Temperature: 297.12 K"
366516597-366517679 mlx90614: celsius: "Temperature: 23.99 °C"
366516597-366517679 mlx90614: kelvin: "Temperature: 297.14 K"
366614543-366615621 mlx90614: celsius: "Temperature: 23.97 °C"
366614543-366615621 mlx90614: kelvin: "Temperature: 297.12 K"
366908387-366909464 mlx90614: celsius: "Temperature: 23.97 °C"
366908387-366909464 mlx90614: kelvin: "Temperature: 297.12 K"
367006336-367007414 mlx90614: celsius: "Temperature: 23.97 °C"
367006336-367007414 mlx90614: kelvin: "Temperature: 297.12 K"
367300176-367301258 mlx90614: celsius: "Temperature: 23.93 °C"
367300176-367301258 mlx90614: kelvin: "Temperature: 297.08 K"
367398128-367399210 mlx90614: celsius: "Temperature: 23.93 °C"
367398128-367399210 mlx90614: kelvin: "Temperature: 297.08 K"
367691972-367693054 mlx90614: celsius: "Temperature: 23.93 °C"
367691972-367693054 mlx90614: kelvin: "Temperature: 297.08 K"
367789918-367790999 mlx90614: celsius: "Temperature: 23.93 °C"
367789918-367790999 mlx90614: kelvin: "Temperature: 297.08 K"
368083761-368084843 mlx90614: celsius: "Temperature: 23.99 °C"
368083761-368084843 mlx90614: kelvin: "Temperature: 297.14 K"
368181707-368182789 mlx90614: celsius: "Temperature: 23.93 °C"
368181707-368182789 mlx90614: kelvin: "Temperature: 297.08 K"
368475551-368476633 mlx90614: celsius: "Temperature: 23.93 °C"
368475551-368476633 mlx90614: kelvin: "Temperature: 297.08 K"
368573497-368574575 mlx90614: celsius: "Temperature: 23.97 °C"
368573497-368574575 mlx90614: kelvin: "Temperature: 297.12 K"
368867341-368868421 mlx90614: celsius: "Temperature: 23.99 °C"
368867341-368868421 mlx90614: kelvin: "Temperature: 297.14 K"
368965294-368966372 mlx90614: celsius: "Temperature: 23.97 °C"
368965294-368966372 mlx90614: kelvin: "Temperature: 297.12 K"
369259134-369260216 mlx90614: celsius: "Temperature: 23.91 °C"
369259134-369260216 mlx90614: kelvin: "Temperature: 297.06 K"
369357080-369358158 mlx90614: celsius: "Temperature: 23.97 °C"
369357080-369358158 mlx90614: kelvin: "Temperature: 297.12 K"
369650926-369652004 mlx90614: celsius: "Temperature: 23.97 °C"
369650926-369652004 mlx90614: kelvin: "Temperature: 297.12 K"
369748874-369749951 mlx90614: celsius: "Temperature: 23.97 °C"
369748874-369749951 mlx90614: kelvin: "Temperature: 297.12 K"
370042714-370043796 mlx90614: celsius: "Temperature: 23.93 °C"
370042714-370043796 mlx90614: kelvin: "Temperature: 297.08 K"
370140660-370141741 mlx90614: celsius: "Temperature: 23.93 °C"
370140660-370141741 mlx90614: kelvin: "Temperature: 297.08 K"
370434504-370435585 mlx90614: celsius: "Temperature: 23.93 °C"
370434504-370435585 mlx90614: kelvin: "Temperature: 297.08 K"
370532455-370533537 mlx90614: celsius: "Temperature: 23.91 °C"
370532455-370533537 mlx90614: kelvin: "Temperature: 297.06 K"
370826295-370827377 mlx90614: celsius: "Temperature: 23.93 °C"
370826295-370827377 mlx90614: kelvin: "Temperature: 297.08 K"
370924243-370925325 mlx90614: celsius: "Temperature: 23.93 °C"
370924243-370925325 mlx90614: kelvin: "Temperature: 297.08 K"
371218087-371219165 mlx90614: celsius: "Temperature: 23.97 °C"
371218087-371219165 mlx90614: kelvin: "Temperature: 297.12 K"
371316035-371317116 mlx90614: celsius: "Temperature: 23.93 °C"
371316035-371317116 mlx90614: kelvin: "Temperature: 297.08 K"
371609879-371610960 mlx90614: celsius: "Temperature: 23.91 °C"
371609879-371610960 mlx90614: kelvin: "Temperature: 297.06 K"
371707824-371708906 mlx90614: celsius: "Temperature: 23.91 °C"
371707824-371708906 mlx90614: kelvin: "Temperature: 297.06 K"
477025586-477026675 mlx90614: celsius: "Temperature: 24.39 °C"
477025586-477026675 mlx90614: kelvin: "Temperature: 297.54 K"
477123533-477124623 mlx90614: celsius: "Temperature: 24.41 °C"
477123533-477124623 mlx90614: kelvin: "Temperature: 297.56 K"
477417372-477418454 mlx90614: celsius: "Temperature: 24.29 °C"
477417372-477418454 mlx90614: kelvin: "Temperature: 297.44 K"
477515323-477516405 mlx90614: celsius: "Temperature: 24.21 °C"
477515323-477516405 mlx90614: kelvin: "Temperature: 297.36 K"
477809166-477810247 mlx90614: celsius: "Temperature: 24.21 °C"
477809166-477810247 mlx90614: kelvin: "Temperature: 297.36 K"
477907113-477908195 mlx90614: celsius: "Temperature: 24.15 °C"
477907113-477908195 mlx90614: kelvin: "Temperature: 297.30 K"
478200957-478202039 mlx90614: celsius: "Temperature: 24.15 °C"
478200957-478202039 mlx90614: kelvin: "Temperature: 297.30 K"
478298903-478299993 mlx90614: celsius: "Temperature: 24.11 °C"
478298903-478299993 mlx90614: kelvin: "Temperature: 297.26 K"
478592746-478593828 mlx90614: celsius: "Temperature: 24.05 °C"
478592746-478593828 mlx90614: kelvin: "Temperature: 297.20 K"
478690698-478691783 mlx90614: celsius: "Temperature: 24.03 °C"
478690698-478691783 mlx90614: kelvin: "Temperature: 297.18 K"
478984540-478985621 mlx90614: celsius: "Temperature: 24.05 °C"
478984540-478985621 mlx90614: kelvin: "Temperature: 297.20 K"
479082485-479083567 mlx90614: celsius: "Temperature: 24.05 °C"
479082485-479083567 mlx90614: kelvin: "Temperature: 297.20 K"
479376326-479377408 mlx90614: celsius: "Temperature: 23.93 °C"
479376326-479377408 mlx90614: kelvin: "Temperature: 297.08 K"
479474277-479475356 mlx90614: celsius: "Temperature: 23.97 °C"
479474277-479475356 mlx90614: kelvin: "Temperature: 297.12 K"
479768116-479769194 mlx90614: celsius: "Temperature: 23.97 °C"
479768116-479769194 mlx90614: kelvin: "Temperature: 297.12 K"
479866071-479867153 mlx90614: celsius: "Temperature: 23.99 °C"
479866071-479867153 mlx90614: kelvin: "Temperature: 297.14 K"
480159912-480160994 mlx90614: celsius: "Temperature: 23.99 °C"
480159912-480160994 mlx90614: kelvin: "Temperature: 297.14 K"
480257858-480258940 mlx90614: celsius: "Temperature: 23.93 °C"
480257858-480258940 mlx90614: kelvin: "Temperature: 297.08 K"
480551701-480552780 mlx90614: celsius: "Temperature: 23.97 °C"
480551701-480552780 mlx90614: kelvin: "Temperature: 297.12 K"
480649650-480650735 mlx90614: celsius: "Temperature: 24.03 °C"
480649650-480650735 mlx90614: kelvin: "Temperature: 297.18 K"
480943491-480944569 mlx90614: celsius: "Temperature: 23.97 °C"
480943491-480944569 mlx90614: kelvin: "Temperature: 297.12 K"
481041439-481042517 mlx90614: celsius: "Temperature: 23.97 °C"
481041439-481042517 mlx90614: kelvin: "Temperature: 297.12 K"
481335280-481336361 mlx90614: celsius: "Temperature: 23.99 °C"
481335280-481336361 mlx90614: kelvin: "Temperature: 297.14 K"
481433230-481434313 mlx90614: celsius: "Temperature: 23.99 °C"
481433230-481434313 mlx90614: kelvin: "Temperature: 297.14 K"
481727070-481728153 mlx90614: celsius: "Temperature: 23.99 °C"
481727070-481728153 mlx90614: kelvin: "Temperature: 297.14 K"
481825023-481826101 mlx90614: celsius: "Temperature: 23.97 °C"
481825023-481826101 mlx90614: kelvin: "Temperature: 297.12 K"
482118863-482119945 mlx90614: celsius: "Temperature: 23.91 °C"
482118863-482119945 mlx90614: kelvin: "Temperature: 297.06 K"
482216809-482217887 mlx90614: celsius: "Temperature: 23.97 °C"
482216809-482217887 mlx90614: kelvin: "Temperature: 297.12 K"
482510655-482511733 mlx90614: celsius: "Temperature: 23.97 °C"
482510655-482511733 mlx90614: kelvin: "Temperature: 297.12 K"
482608603-482609680 mlx90614: celsius: "Temperature: 23.97 °C"
482608603-482609680 mlx90614: kelvin: "Temperature: 297.12 K"
482902443-482903521 mlx90614: celsius: "Temperature: 23.97 °C"
482902443-482903521 mlx90614: kelvin: "Temperature: 297.12 K"
483000390-483001472 mlx90614: celsius: "Temperature: 23.93 °C"
483000390-483001472 mlx90614: kelvin: "Temperature: 297.08 K"
483294234-483295316 mlx90614: celsius: "Temperature: 23.93 °C"
483294234-483295316 mlx90614: kelvin: "Temperature: 297.08 K"
483392181-483393262 mlx90614: celsius: "Temperature: 23.91 °C"
483392181-483393262 mlx90614: kelvin: "Temperature: 297.06 K"
483686026-483687104 mlx90614: celsius: "Temperature: 23.97 °C"
483686026-483687104 mlx90614: kelvin: "Temperature: 297.12 K"
483783975-483785057 mlx90614: celsius: "Temperature: 23.99 °C"
483783975-483785057 mlx90614: kelvin: "Temperature: 297.14 K"
484077816-484078899 mlx90614: celsius: "Temperature: 23.93 °C"
484077816-484078899 mlx90614: kelvin: "Temperature: 297.08 K"
484175762-484176840 mlx90614: celsius: "Temperature: 23.97 °C"
484175762-484176840 mlx90614: kelvin: "Temperature: 297.12 K"
484469608-484470690 mlx90614: celsius: "Temperature: 23.93 °C"
484469608-484470690 mlx90614: kelvin: "Temperature: 297.08 K"
484567554-484568635 mlx90614: celsius: "Temperature: 23.93 °C"
484567554-484568635 mlx90614: kelvin: "Temperature: 297.08 K"
484861398-484862476 mlx90614: celsius: "Temperature: 23.97 °C"
484861398-484862476 mlx90614: kelvin: "Temperature: 297.12 K"
484959345-484960427 mlx90614: celsius: "Temperature: 23.99 °C"
484959345-484960427 mlx90614: kelvin: "Temperature: 297.14 K"
485253186-485254268 mlx90614: celsius: "Temperature: 23.93 °C"
485253186-485254268 mlx90614: kelvin: "Temperature: 297.08 K"
485351139-485352220 mlx90614: celsius: "Temperature: 23.93 °C"
485351139-485352220 mlx90614: kelvin: "Temperature: 297.08 K"
485644975-485646056 mlx90614: celsius: "Temperature: 23.91 °C"
485644975-485646056 mlx90614: kelvin: "Temperature: 297.06 K"
485742928-485744005 mlx90614: celsius: "Temperature: 23.97 °C"
485742928-485744005 mlx90614: kelvin: "Temperature: 297.12 K"
486036769-486037846 mlx90614: celsius: "Temperature: 23.97 °C"
486036769-486037846 mlx90614: kelvin: "Temperature: 297.12 K"
486134715-486135797 mlx90614: celsius: "Temperature: 23.99 °C"
486134715-486135797 mlx90614: kelvin: "Temperature: 297.14 K"
486428562-486429640 mlx90614: celsius: "Temperature: 23.97 °C"
486428562-486429640 mlx90614: kelvin: "Temperature: 297.12 K"
486526504-486527582 mlx90614: celsius: "Temperature: 23.97 °C"
486526504-486527582 mlx90614: kelvin: "Temperature: 297.12 K"
486820350-486821428 mlx90614: celsius: "Temperature: 23.97 °C"
486820350-486821428 mlx90614: kelvin: "Temperature: 297.12 K"
486918298-486919375 mlx90614: celsius: "Temperature: 23.97 °C"
486918298-486919375 mlx90614: kelvin: "Temperature: 297.12 K"
487212144-487213225 mlx90614: celsius: "Temperature: 23.93 °C"
487212144-487213225 mlx90614: kelvin: "Temperature: 297.08 K"
487310089-487311171 mlx90614: celsius: "Temperature: 23.91 °C"
487310089-487311171 mlx90614: kelvin: "Temperature: 297.06 K"
487603930-487605013 mlx90614: celsius: "Temperature: 23.93 °C"
487603930-487605013 mlx90614: kelvin: "Temperature: 297.08 K"
487701883-487702964 mlx90614: celsius: "Temperature: 23.93 °C"
487701883-487702964 mlx90614: kelvin: "Temperature: 297.08 K"
487995721-487996802 mlx90614: celsius: "Temperature: 23.93 °C"
487995721-487996802 mlx90614: kelvin: "Temperature: 297.08 K"
488093672-488094754 mlx90614: celsius: "Temperature: 23.93 °C"
488093672-488094754 mlx90614: kelvin: "Temperature: 297.08 K"
488387511-488388592 mlx90614: celsius: "Temperature: 23.93 °C"
488387511-488388592 mlx90614: kelvin: "Temperature: 297.08 K"
488485462-488486540 mlx90614: celsius: "Temperature: 23.97 °C"
488485462-488486540 mlx90614: kelvin: "Temperature: 297.12 K"
488779302-488780384 mlx90614: celsius: "Temperature: 23.99 °C"
488779302-488780384 mlx90614: kelvin: "Temperature: 297.14 K"
488877254-488878331 mlx90614: celsius: "Temperature: 23.97 °C"
488877254-488878331 mlx90614: kelvin: "Temperature: 297.12 K"
489171094-489172170 mlx90614: celsius: "Temperature: 23.97 °C"
489171094-489172170 mlx90614: kelvin: "Temperature: 297.12 K"
489269041-489270119 mlx90614: celsius: "Temperature: 23.97 °C"
489269041-489270119 mlx90614: kelvin: "Temperature: 297.12 K"
489562880-489563957 mlx90614: celsius: "Temperature: 23.97 °C"
489562880-489563957 mlx90614: kelvin: "Temperature: 297.12 K"
489660836-489661913 mlx90614: celsius: "Temperature: 23.97 °C"
489660836-489661913 mlx90614: kelvin: "Temperature: 297.12 K"
489954675-489955756 mlx90614: celsius: "Temperature: 23.93 °C"
489954675-489955756 mlx90614: kelvin: "Temperature: 297.08 K"
490052621-490053702 mlx90614: celsius: "Temperature: 23.93 °C"
490052621-490053702 mlx90614: kelvin: "Temperature: 297.08 K"
490346465-490347546 mlx90614: celsius: "Temperature: 23.93 °C"
490346465-490347546 mlx90614: kelvin: "Temperature: 297.08 K"
490444416-490445494 mlx90614: celsius: "Temperature: 23.97 °C"
490444416-490445494 mlx90614: kelvin: "Temperature: 297.12 K"
490738257-490739334 mlx90614: celsius: "Temperature: 23.97 °C"
490738257-490739334 mlx90614: kelvin: "Temperature: 297.12 K"
490836204-490837282 mlx90614: celsius: "Temperature: 23.97 °C"
490836204-490837282 mlx90614: kelvin: "Temperature: 297.12 K"
491130050-491131131 mlx90614: celsius: "Temperature: 23.99 °C"
491130050-491131131 mlx90614: kelvin: "Temperature: 297.14 K"
491227996-491229077 mlx90614: celsius: "Temperature: 23.93 °C"
491227996-491229077 mlx90614: kelvin: "Temperature: 297.08 K"
491521838-491522919 mlx90614: celsius: "Temperature: 23.91 °C"
491521838-491522919 mlx90614: kelvin: "Temperature: 297.06 K"
491619785-491620863 mlx90614: celsius: "Temperature: 23.97 °C"
491619785-491620863 mlx90614: kelvin: "Temperature: 297.12 K"
491913631-491914713 mlx90614: celsius: "Temperature: 23.99 °C"
491913631-491914713 mlx90614: kelvin: "Temperature: 297.14 K"
492011577-492012658 mlx90614: celsius: "Temperature: 23.93 °C"
492011577-492012658 mlx90614: kelvin: "Temperature: 297.08 K"
492305421-492306499 mlx90614: celsius: "Temperature: 23.97 °C"
492305421-492306499 mlx90614: kelvin: "Temperature: 297.12 K"
492403369-492404446 mlx90614: celsius: "Temperature: 23.97 °C"
492403369-492404446 mlx90614: kelvin: "Temperature: 297.12 K"
492697209-492698286 mlx90614: celsius: "Temperature: 23.97 °C"
492697209-492698286 mlx90614: kelvin: "Temperature: 297.12 K"
492795156-492796234 mlx90614: celsius: "Temperature: 23.97 °C"
492795156-492796234 mlx90614: kelvin: "Temperature: 297.12 K"
493089002-493090080 mlx90614: celsius: "Temperature: 23.97 °C"
493089002-493090080 mlx90614: kelvin: "Temperature: 297.12 K"
493186950-493188027 mlx90614: celsius: "Temperature: 23.97 °C"
493186950-493188027 mlx90614: kelvin: "Temperature: 297.12 K"
493480788-493481866 mlx90614: celsius: "Temperature: 23.97 °C"
493480788-493481866 mlx90614: kelvin: "Temperature: 297.12 K"
493578743-493579821 mlx90614: celsius: "Temperature: 23.97 °C"
493578743-493579821 mlx90614: kelvin: "Temperature: 297.12 K"
493872583-493873661 mlx90614: celsius: "Temperature: 23.97 °C"
493872583-493873661 mlx90614: kelvin: "Temperature: 297.12 K"
493970531-493971613 mlx90614: celsius: "Temperature: 23.91 °C"
493970531-493971613 mlx90614: kelvin: "Temperature: 297.06 K"
494264373-494265455 mlx90614: celsius: "Temperature: 23.93 °C"
494264373-494265455 mlx90614: kelvin: "Temperature: 297.08 K"
494362319-494363400 mlx90614: celsius: "Temperature: 23.93 °C"
494362319-494363400 mlx90614: kelvin: "Temperature: 297.08 K"
494656163-494657244 mlx90614: celsius: "Temperature: 23.91 °C"
494656163-494657244 mlx90614: kelvin: "Temperature: 297.06 K"
494754108-494755186 mlx90614: celsius: "Temperature: 23.97 °C"
494754108-494755186 mlx90614: kelvin: "Temperature: 297.12 K"
495047955-495049032 mlx90614: celsius: "Temperature: 23.97 °C"
495047955-495049032 mlx90614: kelvin: "Temperature: 297.12 K"
495145902-495146988 mlx90614: celsius: "Temperature: 24.03 °C"
495145902-495146988 mlx90614: kelvin: "Temperature: 297.18 K"
495439742-495440823 mlx90614: celsius: "Temperature: 23.99 °C"
495439742-495440823 mlx90614: kelvin: "Temperature: 297.14 K"
495537695-495538777 mlx90614: celsius: "Temperature: 23.99 °C"
495537695-495538777 mlx90614: kelvin: "Temperature: 297.14 K"
495831536-495832614 mlx90614: celsius: "Temperature: 23.97 °C"
495831536-495832614 mlx90614: kelvin: "Temperature: 297.12 K"
495929484-495930566 mlx90614: celsius: "Temperature: 23.93 °C"
495929484-495930566 mlx90614: kelvin: "Temperature: 297.08 K"
496223328-496224410 mlx90614: celsius: "Temperature: 23.91 °C"
496223328-496224410 mlx90614: kelvin: "Temperature: 297.06 K"
496321274-496322352 mlx90614: celsius: "Temperature: 23.97 °C"
496321274-496322352 mlx90614: kelvin: "Temperature: 297.12 K"
661644556-661645645 mlx90614: celsius: "Temperature: 24.59 °C"
661644556-661645645 mlx90614: kelvin: "Temperature: 297.74 K"
661742502-661743588 mlx90614: celsius: "Temperature: 24.57 °C"
661742502-661743588 mlx90614: kelvin: "Temperature: 297.72 K"
662036343-662037432 mlx90614: celsius: "Temperature: 24.41 °C"
662036343-662037432 mlx90614: kelvin: "Temperature: 297.56 K"
662134290-662135379 mlx90614: celsius: "Temperature: 24.41 °C"
662134290-662135379 mlx90614: kelvin: "Temperature: 297.56 K"
662428133-662429222 mlx90614: celsius: "Temperature: 24.35 °C"
662428133-662429222 mlx90614: kelvin: "Temperature: 297.50 K"
662526088-662527170 mlx90614: celsius: "Temperature: 24.29 °C"
662526088-662527170 mlx90614: kelvin: "Temperature: 297.44 K"
662819926-662821011 mlx90614: celsius: "Temperature: 24.23 °C"
662819926-662821011 mlx90614: kelvin: "Temperature: 297.38 K"
662917875-662918960 mlx90614: celsius: "Temperature: 24.23 °C"
662917875-662918960 mlx90614: kelvin: "Temperature: 297.38 K"
663211717-663212799 mlx90614: celsius: "Temperature: 24.17 °C"
663211717-663212799 mlx90614: kelvin: "Temperature: 297.32 K"
663309663-663310745 mlx90614: celsius: "Temperature: 24.17 °C"
663309663-663310745 mlx90614: kelvin: "Temperature: 297.32 K"
663603509-663604590 mlx90614: celsius: "Temperature: 24.17 °C"
663603509-663604590 mlx90614: kelvin: "Temperature: 297.32 K"
663701455-663702544 mlx90614: celsius: "Temperature: 24.11 °C"
663701455-663702544 mlx90614: kelvin: "Temperature: 297.26 K"
663995298-663996383 mlx90614: celsius: "Temperature: 24.03 °C"
663995298-663996383 mlx90614: kelvin: "Temperature: 297.18 K"
664093247-664094329 mlx90614: celsius: "Temperature: 24.05 °C"
664093247-664094329 mlx90614: kelvin: "Temperature: 297.20 K"
664387087-664388168 mlx90614: celsius: "Temperature: 24.15 °C"
664387087-664388168 mlx90614: kelvin: "Temperature: 297.30 K"
664485039-664486121 mlx90614: celsius: "Temperature: 24.15 °C"
664485039-664486121 mlx90614: kelvin: "Temperature: 297.30 K"
664778879-664779967 mlx90614: celsius: "Temperature: 24.11 °C"
664778879-664779967 mlx90614: kelvin: "Temperature: 297.26 K"
664876825-664877915 mlx90614: celsius: "Temperature: 24.11 °C"
664876825-664877915 mlx90614: kelvin: "Temperature: 297.26 K"
665170668-665171758 mlx90614: celsius: "Temperature: 24.11 °C"
665170668-665171758 mlx90614: kelvin: "Temperature: 297.26 K"
665268616-665269705 mlx90614: celsius: "Temperature: 24.11 °C"
665268616-665269705 mlx90614: kelvin: "Temperature: 297.26 K"
665562463-665563549 mlx90614: celsius: "Temperature: 24.03 °C"
665562463-665563549 mlx90614: kelvin: "Temperature: 297.18 K"
665660407-665661492 mlx90614: celsius: "Temperature: 24.03 °C"
665660407-665661492 mlx90614: kelvin: "Temperature: 297.18 K"
665954249-665955331 mlx90614: celsius: "Temperature: 24.05 °C"
665954249-665955331 mlx90614: kelvin: "Temperature: 297.20 K"
666052200-666053282 mlx90614: celsius: "Temperature: 24.05 °C"
666052200-666053282 mlx90614: kelvin: "Temperature: 297.20 K"
666346039-666347129 mlx90614: celsius: "Temperature: 24.11 °C"
666346039-666347129 mlx90614: kelvin: "Temperature: 297.26 K"
666443995-666445076 mlx90614: celsius: "Temperature: 24.05 °C"
666443995-666445076 mlx90614: kelvin: "Temperature: 297.20 K"
666737830-666738912 mlx90614: celsius: "Temperature: 24.05 °C"
666737830-666738912 mlx90614: kelvin: "Temperature: 297.20 K"
666835782-666836863 mlx90614: celsius: "Temperature: 24.05 °C"
666835782-666836863 mlx90614: kelvin: "Temperature: 297.20 K"
667129623-667130704 mlx90614: celsius: "Temperature: 24.05 °C"
667129623-667130704 mlx90614: kelvin: "Temperature: 297.20 K"
667227574-667228663 mlx90614: celsius: "Temperature: 24.11 °C"
667227574-667228663 mlx90614: kelvin: "Temperature: 297.26 K"
667521411-667522493 mlx90614: celsius: "Temperature: 24.05 °C"
667521411-667522493 mlx90614: kelvin: "Temperature: 297.20 K"
667619363-667620452 mlx90614: celsius: "Temperature: 24.11 °C"
667619363-667620452 mlx90614: kelvin: "Temperature: 297.26 K"
667913205-667914291 mlx90614: celsius: "Temperature: 24.03 °C"
667913205-667914291 mlx90614: kelvin: "Temperature: 297.18 K"
668011155-668012237 mlx90614: celsius: "Temperature: 24.05 °C"
668011155-668012237 mlx90614: kelvin: "Temperature: 297.20 K"
668304994-668306084 mlx90614: celsius: "Temperature: 24.11 °C"
668304994-668306084 mlx90614: kelvin: "Temperature: 297.26 K"
668402944-668404034 mlx90614: celsius: "Temperature: 24.11 °C"
668402944-668404034 mlx90614: kelvin: "Temperature: 297.26 K"
668696787-668697873 mlx90614: celsius: "Temperature: 24.03 °C"
668696787-668697873 mlx90614: kelvin: "Temperature: 297.18 K"
668794731-668795816 mlx90614: celsius: "Temperature: 24.03 °C"
668794731-668795816 mlx90614: kelvin: "Temperature: 297.18 K"
669088578-669089668 mlx90614: celsius: "Temperature: 24.11 °C"
669088578-669089668 mlx90614: kelvin: "Temperature: 297.26 K"
669186526-669187608 mlx90614: celsius: "Temperature: 24.05 °C"
669186526-669187608 mlx90614: kelvin: "Temperature: 297.20 K"
669480368-669481445 mlx90614: celsius: "Temperature: 23.97 °C"
669480368-669481445 mlx90614: kelvin: "Temperature: 297.12 K"
669578315-669579401 mlx90614: celsius: "Temperature: 24.03 °C"
669578315-669579401 mlx90614: kelvin: "Temperature: 297.18 K"
669872157-669873239 mlx90614: celsius: "Temperature: 24.05 °C"
669872157-669873239 mlx90614: kelvin: "Temperature: 297.20 K"
669970108-669971190 mlx90614: celsius: "Temperature: 24.05 °C"
669970108-669971190 mlx90614: kelvin: "Temperature: 297.20 K"
670263948-670265037 mlx90614: celsius: "Temperature: 24.11 °C"
670263948-670265037 mlx90614: kelvin: "Temperature: 297.26 K"
670361897-670362987 mlx90614: celsius: "Temperature: 24.11 °C"
670361897-670362987 mlx90614: kelvin: "Temperature: 297.26 K"
670655741-670656826 mlx90614: celsius: "Temperature: 24.03 °C"
670655741-670656826 mlx90614: kelvin: "Temperature: 297.18 K"
670753684-670754766 mlx90614: celsius: "Temperature: 24.05 °C"
670753684-670754766 mlx90614: kelvin: "Temperature: 297.20 K"
671047531-671048616 mlx90614: celsius: "Temperature: 24.03 °C"
671047531-671048616 mlx90614: kelvin: "Temperature: 297.18 K"
671145474-671146552 mlx90614: celsius: "Temperature: 23.97 °C"
671145474-671146552 mlx90614: kelvin: "Temperature: 297.12 K"
671439320-671440406 mlx90614: celsius: "Temperature: 24.03 °C"
671439320-671440406 mlx90614: kelvin: "Temperature: 297.18 K"
671537265-671538350 mlx90614: celsius: "Temperature: 24.03 °C"
671537265-671538350 mlx90614: kelvin: "Temperature: 297.18 K"
671831112-671832190 mlx90614: celsius: "Temperature: 23.97 °C"
671831112-671832190 mlx90614: kelvin: "Temperature: 297.12 K"
671929060-671930145 mlx90614: celsius: "Temperature: 24.03 °C"
671929060-671930145 mlx90614: kelvin: "Temperature: 297.18 K"
672222900-672223978 mlx90614: celsius: "Temperature: 23.97 °C"
672222900-672223978 mlx90614: kelvin: "Temperature: 297.12 K"
672320849-672321935 mlx90614: celsius: "Temperature: 24.03 °C"
672320849-672321935 mlx90614: kelvin: "Temperature: 297.18 K"
672614692-672615781 mlx90614: celsius: "Temperature: 24.11 °C"
672614692-672615781 mlx90614: kelvin: "Temperature: 297.26 K"
672712639-672713721 mlx90614: celsius: "Temperature: 24.05 °C"
672712639-672713721 mlx90614: kelvin: "Temperature: 297.20 K"
673006481-673007562 mlx90614: celsius: "Temperature: 24.05 °C"
673006481-673007562 mlx90614: kelvin: "Temperature: 297.20 K"
673104431-673105521 mlx90614: celsius: "Temperature: 24.11 °C"
673104431-673105521 mlx90614: kelvin: "Temperature: 297.26 K"
673398274-673399364 mlx90614: celsius: "Temperature: 24.11 °C"
673398274-673399364 mlx90614: kelvin: "Temperature: 297.26 K"
673496222-673497304 mlx90614: celsius: "Temperature: 24.05 °C"
673496222-673497304 mlx90614: kelvin: "Temperature: 297.20 K"
673790064-673791153 mlx90614: celsius: "Temperature: 24.11 °C"
673790064-673791153 mlx90614: kelvin: "Temperature: 297.26 K"
673888011-673889100 mlx90614: celsius: "Temperature: 24.11 °C"
673888011-673889100 mlx90614: kelvin: "Temperature: 297.26 K"
674181853-674182937 mlx90614: celsius: "Temperature: 24.03 °C"
674181853-674182937 mlx90614: kelvin: "Temperature: 297.18 K"
674279803-674280889 mlx90614: celsius: "Temperature: 24.03 °C"
674279803-674280889 mlx90614: kelvin: "Temperature: 297.18 K"
674573645-674574735 mlx90614: celsius: "Temperature: 24.11 °C"
674573645-674574735 mlx90614: kelvin: "Temperature: 297.26 K"
674671593-674672682 mlx90614: celsius: "Temperature: 24.11 °C"
674671593-674672682 mlx90614: kelvin: "Temperature: 297.26 K"
674965436-674966518 mlx90614: celsius: "Temperature: 24.05 °C"
674965436-674966518 mlx90614: kelvin: "Temperature: 297.20 K"
675063382-675064464 mlx90614: celsius: "Temperature: 24.05 °C"
675063382-675064464 mlx90614: kelvin: "Temperature: 297.20 K"
675357223-675358312 mlx90614: celsius: "Temperature: 24.11 °C"
675357223-675358312 mlx90614: kelvin: "Temperature: 297.26 K"
675455176-675456266 mlx90614: celsius: "Temperature: 24.11 °C"
675455176-675456266 mlx90614: kelvin: "Temperature: 297.26 K"
675749020-675750101 mlx90614: celsius: "Temperature: 24.15 °C"
675749020-675750101 mlx90614: kelvin: "Temperature: 297.30 K"
675846965-675848047 mlx90614: celsius: "Temperature: 24.15 °C"
675846965-675848047 mlx90614: kelvin: "Temperature: 297.30 K"
676140807-676141889 mlx90614: celsius: "Temperature: 24.05 °C"
676140807-676141889 mlx90614: kelvin: "Temperature: 297.20 K"
676238754-676239844 mlx90614: celsius: "Temperature: 24.11 °C"
676238754-676239844 mlx90614: kelvin: "Temperature: 297.26 K"
676532597-676533679 mlx90614: celsius: "Temperature: 24.05 °C"
676532597-676533679 mlx90614: kelvin: "Temperature: 297.20 K"
676630544-676631625 mlx90614: celsius: "Temperature: 24.05 °C"
676630544-676631625 mlx90614: kelvin: "Temperature: 297.20 K"
676924391-676925472 mlx90614: celsius: "Temperature: 24.05 °C"
676924391-676925472 mlx90614: kelvin: "Temperature: 297.20 K"
677022337-677023425 mlx90614: celsius: "Temperature: 24.11 °C"
677022337-677023425 mlx90614: kelvin: "Temperature: 297.26 K"
677316177-677317263 mlx90614: celsius: "Temperature: 24.03 °C"
677316177-677317263 mlx90614: kelvin: "Temperature: 297.18 K"
677414126-677415212 mlx90614: celsius: "Temperature: 24.03 °C"
677414126-677415212 mlx90614: kelvin: "Temperature: 297.18 K"
677707968-677709052 mlx90614: celsius: "Temperature: 24.05 °C"
677707968-677709052 mlx90614: kelvin: "Temperature: 297.20 K"
677805914-677807004 mlx90614: celsius: "Temperature: 24.11 °C"
677805914-677807004 mlx90614: kelvin: "Temperature: 297.26 K"
678099759-678100841 mlx90614: celsius: "Temperature: 24.05 °C"
678099759-678100841 mlx90614: kelvin: "Temperature: 297.20 K"
678197712-678198795 mlx90614: celsius: "Temperature: 24.05 °C"
678197712-678198795 mlx90614: kelvin: "Temperature: 297.20 K"
678491553-678492643 mlx90614: celsius: "Temperature: 24.11 °C"
678491553-678492643 mlx90614: kelvin: "Temperature: 297.26 K"
678589502-678590591 mlx90614: celsius: "Temperature: 24.11 °C"
678589502-678590591 mlx90614: kelvin: "Temperature: 297.26 K"
678883338-678884425 mlx90614: celsius: "Temperature: 24.03 °C"
678883338-678884425 mlx90614: kelvin: "Temperature: 297.18 K"
678981288-678982370 mlx90614: celsius: "Temperature: 24.05 °C"
678981288-678982370 mlx90614: kelvin: "Temperature: 297.20 K"
679275136-679276217 mlx90614: celsius: "Temperature: 24.15 °C"
679275136-679276217 mlx90614: kelvin: "Temperature: 297.30 K"
679373080-679374170 mlx90614: celsius: "Temperature: 24.11 °C"
679373080-679374170 mlx90614: kelvin: "Temperature: 297.26 K"
679666923-679668013 mlx90614: celsius: "Temperature: 24.11 °C"
679666923-679668013 mlx90614: kelvin: "Temperature: 297.26 K"
679764872-679765953 mlx90614: celsius: "Temperature: 24.05 °C"
679764872-679765953 mlx90614: kelvin: "Temperature: 297.20 K"
680058710-680059800 mlx90614: celsius: "Temperature: 24.11 °C"
680058710-680059800 mlx90614: kelvin: "Temperature: 297.26 K"
680156666-680157747 mlx90614: celsius: "Temperature: 24.05 °C"
680156666-680157747 mlx90614: kelvin: "Temperature: 297.20 K"
680450507-680451585 mlx90614: celsius: "Temperature: 23.97 °C"
680450507-680451585 mlx90614: kelvin: "Temperature: 297.12 K"
680548449-680549532 mlx90614: celsius: "Temperature: 24.05 °C"
680548449-680549532 mlx90614: kelvin: "Temperature: 297.20 K"
680842296-680843381 mlx90614: celsius: "Temperature: 24.03 °C"
680842296-680843381 mlx90614: kelvin: "Temperature: 297.18 K"
680940245-680941327 mlx90614: celsius: "Temperature: 24.05 °C"
680940245-680941327 mlx90614: kelvin: "Temperature: 297.20 K"
