2315842-2316931 mlx90614: celsius: "Temperature: 25.79 °C"
2315842-2316931 mlx90614: kelvin: "Temperature: 298.94 K"
2413788-2414872 mlx90614: celsius: "Temperature: 25.75 °C"
2413788-2414872 mlx90614: kelvin: "Temperature: 298.90 K"
2707631-2708724 mlx90614: celsius: "Temperature: 25.63 °C"
2707631-2708724 mlx90614: kelvin: "Temperature: 298.78 K"
2805582-2806675 mlx90614: celsius: "Temperature: 25.63 °C"
2805582-2806675 mlx90614: kelvin: "Temperature: 298.78 K"
3099421-3100510 mlx90614: celsius: "Temperature: 25.59 °C"
3099421-3100510 mlx90614: kelvin: "Temperature: 298.74 K"
3197371-3198464 mlx90614: celsius: "Temperature: 25.55 °C"
3197371-3198464 mlx90614: kelvin: "Temperature: 298.70 K"
3491214-3492308 mlx90614: celsius: "Temperature: 25.55 °C"
3491214-3492308 mlx90614: kelvin: "Temperature: 298.70 K"
3589160-3590253 mlx90614: celsius: "Temperature: 25.55 °C"
3589160-3590253 mlx90614: kelvin: "Temperature: 298.70 K"
3883004-3884090 mlx90614: celsius: "Temperature: 25.49 °C"
3883004-3884090 mlx90614: kelvin: "Temperature: 298.64 K"
3980954-3982039 mlx90614: celsius: "Temperature: 25.49 °C"
3980954-3982039 mlx90614: kelvin: "Temperature: 298.64 K"
4274796-4275885 mlx90614: celsius: "Temperature: 25.47 °C"
4274796-4275885 mlx90614: kelvin: "Temperature: 298.62 K"
4372743-4373829 mlx90614: celsius: "Temperature: 25.49 °C"
4372743-4373829 mlx90614: kelvin: "Temperature: 298.64 K"
4666585-4667674 mlx90614: celsius: "Temperature: 25.47 °C"
4666585-4667674 mlx90614: kelvin: "Temperature: 298.62 K"
4764533-4765622 mlx90614: celsius: "Temperature: 25.47 °C"
4764533-4765622 mlx90614: kelvin: "Temperature: 298.62 K"
5058372-5059457 mlx90614: celsius: "Temperature: 26.77 °C"
5058372-5059457 mlx90614: kelvin: "Temperature: 299.92 K"
5156323-5157409 mlx90614: celsius: "Temperature: 29.35 °C"
5156323-5157409 mlx90614: kelvin: "Temperature: 302.50 K"
5450167-5451245 mlx90614: celsius: "Temperature: 34.23 °C"
5450167-5451245 mlx90614: kelvin: "Temperature: 307.38 K"
5548113-5549198 mlx90614: celsius: "Temperature: 34.59 °C"
5548113-5549198 mlx90614: kelvin: "Temperature: 307.74 K"
5841955-5843040 mlx90614: celsius: "Temperature: 34.97 °C"
5841955-5843040 mlx90614: kelvin: "Temperature: 308.12 K"
5939902-5940980 mlx90614: celsius: "Temperature: 35.01 °C"
5939902-5940980 mlx90614: kelvin: "Temperature: 308.16 K"
6233746-6234827 mlx90614: celsius: "Temperature: 35.05 °C"
6233746-6234827 mlx90614: kelvin: "Temperature: 308.20 K"
6331696-6332781 mlx90614: celsius: "Temperature: 35.07 °C"
6331696-6332781 mlx90614: kelvin: "Temperature: 308.22 K"
6625536-6626617 mlx90614: celsius: "Temperature: 35.09 °C"
6625536-6626617 mlx90614: kelvin: "Temperature: 308.24 K"
6723485-6724567 mlx90614: celsius: "Temperature: 35.09 °C"
6723485-6724567 mlx90614: kelvin: "Temperature: 308.24 K"
7017324-7018410 mlx90614: celsius: "Temperature: 35.13 °C"
7017324-7018410 mlx90614: kelvin: "Temperature: 308.28 K"
7115280-7116365 mlx90614: celsius: "Temperature: 35.19 °C"
7115280-7116365 mlx90614: kelvin: "Temperature: 308.34 K"
7409118-7410208 mlx90614: celsius: "Temperature: 35.15 °C"
7409118-7410208 mlx90614: kelvin: "Temperature: 308.30 K"
7507069-7508158 mlx90614: celsius: "Temperature: 35.15 °C"
7507069-7508158 mlx90614: kelvin: "Temperature: 308.30 K"
7800908-7801993 mlx90614: celsius: "Temperature: 35.19 °C"
7800908-7801993 mlx90614: kelvin: "Temperature: 308.34 K"
7898856-7899945 mlx90614: celsius: "Temperature: 35.15 °C"
7898856-7899945 mlx90614: kelvin: "Temperature: 308.30 K"
8192700-8193789 mlx90614: celsius: "Temperature: 35.15 °C"
8192700-8193789 mlx90614: kelvin: "Temperature: 308.30 K"
8290646-8291731 mlx90614: celsius: "Temperature: 35.19 °C"
8290646-8291731 mlx90614: kelvin: "Temperature: 308.34 K"
8584490-8585575 mlx90614: celsius: "Temperature: 35.19 °C"
8584490-8585575 mlx90614: kelvin: "Temperature: 308.34 K"
8682437-8683523 mlx90614: celsius: "Temperature: 35.19 °C"
8682437-8683523 mlx90614: kelvin: "Temperature: 308.34 K"
8976279-8977365 mlx90614: celsius: "Temperature: 35.19 °C"
8976279-8977365 mlx90614: kelvin: "Temperature: 308.34 K"
9074229-9075314 mlx90614: celsius: "Temperature: 35.19 °C"
9074229-9075314 mlx90614: kelvin: "Temperature: 308.34 K"
9368073-9369158 mlx90614: celsius: "Temperature: 35.13 °C"
9368073-9369158 mlx90614: kelvin: "Temperature: 308.28 K"
9466020-9467106 mlx90614: celsius: "Temperature: 35.13 °C"
9466020-9467106 mlx90614: kelvin: "Temperature: 308.28 K"
9759862-9760949 mlx90614: celsius: "Temperature: 34.97 °C"
9759862-9760949 mlx90614: kelvin: "Temperature: 308.12 K"
9857810-9858891 mlx90614: celsius: "Temperature: 34.89 °C"
9857810-9858891 mlx90614: kelvin: "Temperature: 308.04 K"
10151654-10152739 mlx90614: celsius: "Temperature: 34.59 °C"
10151654-10152739 mlx90614: kelvin: "Temperature: 307.74 K"
10249601-10250688 mlx90614: celsius: "Temperature: 34.63 °C"
10249601-10250688 mlx90614: kelvin: "Temperature: 307.78 K"
10543443-10544526 mlx90614: celsius: "Temperature: 34.61 °C"
10543443-10544526 mlx90614: kelvin: "Temperature: 307.76 K"
10641393-10642486 mlx90614: celsius: "Temperature: 28.77 °C"
10641393-10642486 mlx90614: kelvin: "Temperature: 301.92 K"
10935234-10936319 mlx90614: celsius: "Temperature: 26.43 °C"
10935234-10936319 mlx90614: kelvin: "Temperature: 299.58 K"
11033185-11034278 mlx90614: celsius: "Temperature: 26.23 °C"
11033185-11034278 mlx90614: kelvin: "Temperature: 299.38 K"
11327025-11328111 mlx90614: celsius: "Temperature: 26.05 °C"
11327025-11328111 mlx90614: kelvin: "Temperature: 299.20 K"
11424969-11426058 mlx90614: celsius: "Temperature: 26.09 °C"
11424969-11426058 mlx90614: kelvin: "Temperature: 299.24 K"
11718813-11719903 mlx90614: celsius: "Temperature: 25.93 °C"
11718813-11719903 mlx90614: kelvin: "Temperature: 299.08 K"
11816761-11817851 mlx90614: celsius: "Temperature: 25.91 °C"
11816761-11817851 mlx90614: kelvin: "Temperature: 299.06 K"
12110605-12111694 mlx90614: celsius: "Temperature: 25.91 °C"
12110605-12111694 mlx90614: kelvin: "Temperature: 299.06 K"
12208553-12209642 mlx90614: celsius: "Temperature: 25.91 °C"
12208553-12209642 mlx90614: kelvin: "Temperature: 299.06 K"
12502397-12503486 mlx90614: celsius: "Temperature: 25.91 °C"
12502397-12503486 mlx90614: kelvin: "Temperature: 299.06 K"
12600344-12601434 mlx90614: celsius: "Temperature: 25.93 °C"
12600344-12601434 mlx90614: kelvin: "Temperature: 299.08 K"
12894184-12895277 mlx90614: celsius: "Temperature: 25.99 °C"
12894184-12895277 mlx90614: kelvin: "Temperature: 299.14 K"
12992138-12993227 mlx90614: celsius: "Temperature: 25.91 °C"
12992138-12993227 mlx90614: kelvin: "Temperature: 299.06 K"
13285975-13287065 mlx90614: celsius: "Temperature: 25.93 °C"
13285975-13287065 mlx90614: kelvin: "Temperature: 299.08 K"
13383923-13385013 mlx90614: celsius: "Temperature: 25.93 °C"
13383923-13385013 mlx90614: kelvin: "Temperature: 299.08 K"
13677765-13678858 mlx90614: celsius: "Temperature: 25.99 °C"
13677765-13678858 mlx90614: kelvin: "Temperature: 299.14 K"
13775717-13776810 mlx90614: celsius: "Temperature: 25.99 °C"
13775717-13776810 mlx90614: kelvin: "Temperature: 299.14 K"
14069556-14070642 mlx90614: celsius: "Temperature: 26.43 °C"
14069556-14070642 mlx90614: kelvin: "Temperature: 299.58 K"
14167506-14168599 mlx90614: celsius: "Temperature: 27.91 °C"
14167506-14168599 mlx90614: kelvin: "Temperature: 301.06 K"
14461347-14462422 mlx90614: celsius: "Temperature: 34.21 °C"
14461347-14462422 mlx90614: kelvin: "Temperature: 307.36 K"
14559295-14560380 mlx90614: celsius: "Temperature: 34.59 °C"
14559295-14560380 mlx90614: kelvin: "Temperature: 307.74 K"
14853135-14854220 mlx90614: celsius: "Temperature: 34.97 °C"
14853135-14854220 mlx90614: kelvin: "Temperature: 308.12 K"
14951090-14952168 mlx90614: celsius: "Temperature: 35.01 °C"
14951090-14952168 mlx90614: kelvin: "Temperature: 308.16 K"
15244929-15246018 mlx90614: celsius: "Temperature: 35.15 °C"
15244929-15246018 mlx90614: kelvin: "Temperature: 308.30 K"
15342875-15343960 mlx90614: celsius: "Temperature: 35.19 °C"
15342875-15343960 mlx90614: kelvin: "Temperature: 308.34 K"
15636718-15637804 mlx90614: celsius: "Temperature: 35.19 °C"
15636718-15637804 mlx90614: kelvin: "Temperature: 308.34 K"
15734666-15735751 mlx90614: celsius: "Temperature: 35.19 °C"
15734666-15735751 mlx90614: kelvin: "Temperature: 308.34 K"
16028510-16029595 mlx90614: celsius: "Temperature: 29.97 °C"
16028510-16029595 mlx90614: kelvin: "Temperature: 303.12 K"
16126458-16127550 mlx90614: celsius: "Temperature: 28.17 °C"
16126458-16127550 mlx90614: kelvin: "Temperature: 301.32 K"
16420301-16421387 mlx90614: celsius: "Temperature: 26.47 °C"
16420301-16421387 mlx90614: kelvin: "Temperature: 299.62 K"
16518245-16519339 mlx90614: celsius: "Temperature: 26.29 °C"
16518245-16519339 mlx90614: kelvin: "Temperature: 299.44 K"
16812091-16813184 mlx90614: celsius: "Temperature: 26.15 °C"
16812091-16813184 mlx90614: kelvin: "Temperature: 299.30 K"
16910039-16911131 mlx90614: celsius: "Temperature: 26.11 °C"
16910039-16911131 mlx90614: kelvin: "Temperature: 299.26 K"
17203881-17204974 mlx90614: celsius: "Temperature: 26.11 °C"
17203881-17204974 mlx90614: kelvin: "Temperature: 299.26 K"
17301826-17302919 mlx90614: celsius: "Temperature: 26.11 °C"
17301826-17302919 mlx90614: kelvin: "Temperature: 299.26 K"
17595669-17596754 mlx90614: celsius: "Temperature: 26.05 °C"
17595669-17596754 mlx90614: kelvin: "Temperature: 299.20 K"
17693619-17694708 mlx90614: celsius: "Temperature: 26.09 °C"
17693619-17694708 mlx90614: kelvin: "Temperature: 299.24 K"
17987463-17988553 mlx90614: celsius: "Temperature: 26.09 °C"
17987463-17988553 mlx90614: kelvin: "Temperature: 299.24 K"
18085412-18086498 mlx90614: celsius: "Temperature: 26.05 °C"
18085412-18086498 mlx90614: kelvin: "Temperature: 299.20 K"
18379254-18380340 mlx90614: celsius: "Temperature: 26.05 °C"
18379254-18380340 mlx90614: kelvin: "Temperature: 299.20 K"
18477198-18478284 mlx90614: celsius: "Temperature: 26.05 °C"
18477198-18478284 mlx90614: kelvin: "Temperature: 299.20 K"
18771039-18772124 mlx90614: celsius: "Temperature: 26.05 °C"
18771039-18772124 mlx90614: kelvin: "Temperature: 299.20 K"
18868990-18870075 mlx90614: celsius: "Temperature: 26.05 °C"
18868990-18870075 mlx90614: kelvin: "Temperature: 299.20 K"
19162831-19163921 mlx90614: celsius: "Temperature: 26.09 °C"
19162831-19163921 mlx90614: kelvin: "Temperature: 299.24 K"
19260780-19261865 mlx90614: celsius: "Temperature: 26.05 °C"
19260780-19261865 mlx90614: kelvin: "Temperature: 299.20 K"
19554621-19555710 mlx90614: celsius: "Temperature: 26.09 °C"
19554621-19555710 mlx90614: kelvin: "Temperature: 299.24 K"
19652568-19653658 mlx90614: celsius: "Temperature: 26.09 °C"
19652568-19653658 mlx90614: kelvin: "Temperature: 299.24 K"
19946413-19947507 mlx90614: celsius: "Temperature: 25.99 °C"
19946413-19947507 mlx90614: kelvin: "Temperature: 299.14 K"
20044360-20045445 mlx90614: celsius: "Temperature: 26.05 °C"
20044360-20045445 mlx90614: kelvin: "Temperature: 299.20 K"
20338207-20339296 mlx90614: celsius: "Temperature: 25.97 °C"
20338207-20339296 mlx90614: kelvin: "Temperature: 299.12 K"
20436154-20437244 mlx90614: celsius: "Temperature: 25.97 °C"
20436154-20437244 mlx90614: kelvin: "Temperature: 299.12 K"
20729992-20731084 mlx90614: celsius: "Temperature: 25.99 °C"
20729992-20731084 mlx90614: kelvin: "Temperature: 299.14 K"
20827945-20829034 mlx90614: celsius: "Temperature: 25.97 °C"
20827945-20829034 mlx90614: kelvin: "Temperature: 299.12 K"
21121783-21122880 mlx90614: celsius: "Temperature: 26.03 °C"
21121783-21122880 mlx90614: kelvin: "Temperature: 299.18 K"
21219733-21220819 mlx90614: celsius: "Temperature: 26.05 °C"
21219733-21220819 mlx90614: kelvin: "Temperature: 299.20 K"
21513575-21514672 mlx90614: celsius: "Temperature: 26.03 °C"
21513575-21514672 mlx90614: kelvin: "Temperature: 299.18 K"
21611525-21612610 mlx90614: celsius: "Temperature: 26.05 °C"
21611525-21612610 mlx90614: kelvin: "Temperature: 299.20 K"
24106439-24107532 mlx90614: celsius: "Temperature: 26.67 °C"
24106439-24107532 mlx90614: kelvin: "Temperature: 299.82 K"
24204391-24205476 mlx90614: celsius: "Temperature: 26.61 °C"
24204391-24205476 mlx90614: kelvin: "Temperature: 299.76 K"
24498232-24499317 mlx90614: celsius: "Temperature: 26.49 °C"
24498232-24499317 mlx90614: kelvin: "Temperature: 299.64 K"
24596181-24597266 mlx90614: celsius: "Temperature: 26.47 °C"
24596181-24597266 mlx90614: kelvin: "Temperature: 299.62 K"
24890022-24891100 mlx90614: celsius: "Temperature: 26.37 °C"
24890022-24891100 mlx90614: kelvin: "Temperature: 299.52 K"
24987972-24989051 mlx90614: celsius: "Temperature: 26.37 °C"
24987972-24989051 mlx90614: kelvin: "Temperature: 299.52 K"
25281812-25282905 mlx90614: celsius: "Temperature: 26.29 °C"
25281812-25282905 mlx90614: kelvin: "Temperature: 299.44 K"
25379757-25380843 mlx90614: celsius: "Temperature: 26.49 °C"
25379757-25380843 mlx90614: kelvin: "Temperature: 299.64 K"
25673602-25674699 mlx90614: celsius: "Temperature: 33.35 °C"
25673602-25674699 mlx90614: kelvin: "Temperature: 306.50 K"
25771550-25772625 mlx90614: celsius: "Temperature: 34.07 °C"
25771550-25772625 mlx90614: kelvin: "Temperature: 307.22 K"
26065393-26066467 mlx90614: celsius: "Temperature: 34.69 °C"
26065393-26066467 mlx90614: kelvin: "Temperature: 307.84 K"
26163341-26164422 mlx90614: celsius: "Temperature: 34.75 °C"
26163341-26164422 mlx90614: kelvin: "Temperature: 307.90 K"
26457185-26458271 mlx90614: celsius: "Temperature: 34.91 °C"
26457185-26458271 mlx90614: kelvin: "Temperature: 308.06 K"
26555133-26556219 mlx90614: celsius: "Temperature: 34.97 °C"
26555133-26556219 mlx90614: kelvin: "Temperature: 308.12 K"
26848970-26850056 mlx90614: celsius: "Temperature: 34.97 °C"
26848970-26850056 mlx90614: kelvin: "Temperature: 308.12 K"
26946926-26948005 mlx90614: celsius: "Temperature: 35.01 °C"
26946926-26948005 mlx90614: kelvin: "Temperature: 308.16 K"
27240762-27241848 mlx90614: celsius: "Temperature: 29.43 °C"
27240762-27241848 mlx90614: kelvin: "Temperature: 302.58 K"
27338710-27339804 mlx90614: celsius: "Temperature: 27.91 °C"
27338710-27339804 mlx90614: kelvin: "Temperature: 301.06 K"
27632557-27633642 mlx90614: celsius: "Temperature: 26.47 °C"
27632557-27633642 mlx90614: kelvin: "Temperature: 299.62 K"
27730501-27731598 mlx90614: celsius: "Temperature: 26.31 °C"
27730501-27731598 mlx90614: kelvin: "Temperature: 299.46 K"
28024343-28025437 mlx90614: celsius: "Temperature: 26.23 °C"
28024343-28025437 mlx90614: kelvin: "Temperature: 299.38 K"
28122295-28123388 mlx90614: celsius: "Temperature: 26.17 °C"
28122295-28123388 mlx90614: kelvin: "Temperature: 299.32 K"
28416138-28417231 mlx90614: celsius: "Temperature: 26.15 °C"
28416138-28417231 mlx90614: kelvin: "Temperature: 299.30 K"
28514084-28515173 mlx90614: celsius: "Temperature: 26.21 °C"
28514084-28515173 mlx90614: kelvin: "Temperature: 299.36 K"
28807924-28809008 mlx90614: celsius: "Temperature: 32.45 °C"
28807924-28809008 mlx90614: kelvin: "Temperature: 305.60 K"
28905873-28906966 mlx90614: celsius: "Temperature: 33.65 °C"
28905873-28906966 mlx90614: kelvin: "Temperature: 306.80 K"
29199715-29200801 mlx90614: celsius: "Temperature: 34.97 °C"
29199715-29200801 mlx90614: kelvin: "Temperature: 308.12 K"
29297663-29298748 mlx90614: celsius: "Temperature: 35.07 °C"
29297663-29298748 mlx90614: kelvin: "Temperature: 308.22 K"
29591508-29592598 mlx90614: celsius: "Temperature: 31.19 °C"
29591508-29592598 mlx90614: kelvin: "Temperature: 304.34 K"
29689454-29690555 mlx90614: celsius: "Temperature: 28.75 °C"
29689454-29690555 mlx90614: kelvin: "Temperature: 301.90 K"
29983295-29984381 mlx90614: celsius: "Temperature: 26.47 °C"
29983295-29984381 mlx90614: kelvin: "Temperature: 299.62 K"
30081245-30082342 mlx90614: celsius: "Temperature: 26.31 °C"
30081245-30082342 mlx90614: kelvin: "Temperature: 299.46 K"
30375088-30376181 mlx90614: celsius: "Temperature: 26.15 °C"
30375088-30376181 mlx90614: kelvin: "Temperature: 299.30 K"
30473033-30474128 mlx90614: celsius: "Temperature: 26.11 °C"
30473033-30474128 mlx90614: kelvin: "Temperature: 299.26 K"
30766874-30767952 mlx90614: celsius: "Temperature: 26.37 °C"
30766874-30767952 mlx90614: kelvin: "Temperature: 299.52 K"
30864829-30865915 mlx90614: celsius: "Temperature: 29.91 °C"
30864829-30865915 mlx90614: kelvin: "Temperature: 303.06 K"
31158671-31159768 mlx90614: celsius: "Temperature: 33.91 °C"
31158671-31159768 mlx90614: kelvin: "Temperature: 307.06 K"
31256619-31257693 mlx90614: celsius: "Temperature: 34.21 °C"
31256619-31257693 mlx90614: kelvin: "Temperature: 307.36 K"
31550462-31551551 mlx90614: celsius: "Temperature: 33.49 °C"
31550462-31551551 mlx90614: kelvin: "Temperature: 306.64 K"
31648408-31649493 mlx90614: celsius: "Temperature: 29.91 °C"
31648408-31649493 mlx90614: kelvin: "Temperature: 303.06 K"
31942249-31943340 mlx90614: celsius: "Temperature: 26.59 °C"
31942249-31943340 mlx90614: kelvin: "Temperature: 299.74 K"
32040197-32041294 mlx90614: celsius: "Temperature: 26.27 °C"
32040197-32041294 mlx90614: kelvin: "Temperature: 299.42 K"
32334041-32335130 mlx90614: celsius: "Temperature: 26.09 °C"
32334041-32335130 mlx90614: kelvin: "Temperature: 299.24 K"
32431989-32433077 mlx90614: celsius: "Temperature: 26.09 °C"
32431989-32433077 mlx90614: kelvin: "Temperature: 299.24 K"
32725831-32726920 mlx90614: celsius: "Temperature: 26.21 °C"
32725831-32726920 mlx90614: kelvin: "Temperature: 299.36 K"
32823781-32824866 mlx90614: celsius: "Temperature: 27.69 °C"
32823781-32824866 mlx90614: kelvin: "Temperature: 300.84 K"
33117620-33118713 mlx90614: celsius: "Temperature: 33.77 °C"
33117620-33118713 mlx90614: kelvin: "Temperature: 306.92 K"
33215569-33216647 mlx90614: celsius: "Temperature: 34.29 °C"
33215569-33216647 mlx90614: kelvin: "Temperature: 307.44 K"
33509412-33510486 mlx90614: celsius: "Temperature: 34.69 °C"
33509412-33510486 mlx90614: kelvin: "Temperature: 307.84 K"
33607360-33608453 mlx90614: celsius: "Temperature: 33.05 °C"
33607360-33608453 mlx90614: kelvin: "Temperature: 306.20 K"
33901202-33902291 mlx90614: celsius: "Temperature: 27.11 °C"
33901202-33902291 mlx90614: kelvin: "Temperature: 300.26 K"
33999149-34000233 mlx90614: celsius: "Temperature: 26.61 °C"
33999149-34000233 mlx90614: kelvin: "Temperature: 299.76 K"
34292990-34294083 mlx90614: celsius: "Temperature: 26.23 °C"
34292990-34294083 mlx90614: kelvin: "Temperature: 299.38 K"
34390942-34392035 mlx90614: celsius: "Temperature: 26.23 °C"
34390942-34392035 mlx90614: kelvin: "Temperature: 299.38 K"
34684780-34685865 mlx90614: celsius: "Temperature: 26.05 °C"
34684780-34685865 mlx90614: kelvin: "Temperature: 299.20 K"
34782730-34783828 mlx90614: celsius: "Temperature: 26.03 °C"
34782730-34783828 mlx90614: kelvin: "Temperature: 299.18 K"
35076572-35077658 mlx90614: celsius: "Temperature: 26.05 °C"
35076572-35077658 mlx90614: kelvin: "Temperature: 299.20 K"
35174521-35175607 mlx90614: celsius: "Temperature: 26.05 °C"
35174521-35175607 mlx90614: kelvin: "Temperature: 299.20 K"
35468363-35469460 mlx90614: celsius: "Temperature: 26.03 °C"
35468363-35469460 mlx90614: kelvin: "Temperature: 299.18 K"
35566312-35567402 mlx90614: celsius: "Temperature: 25.97 °C"
35566312-35567402 mlx90614: kelvin: "Temperature: 299.12 K"
35860151-35861241 mlx90614: celsius: "Temperature: 25.97 °C"
35860151-35861241 mlx90614: kelvin: "Temperature: 299.12 K"
35958100-35959193 mlx90614: celsius: "Temperature: 25.99 °C"
35958100-35959193 mlx90614: kelvin: "Temperature: 299.14 K"
36251945-36253035 mlx90614: celsius: "Temperature: 25.93 °C"
36251945-36253035 mlx90614: kelvin: "Temperature: 299.08 K"
36349893-36350986 mlx90614: celsius: "Temperature: 25.99 °C"
36349893-36350986 mlx90614: kelvin: "Temperature: 299.14 K"
36643730-36644820 mlx90614: celsius: "Temperature: 25.91 °C"
36643730-36644820 mlx90614: kelvin: "Temperature: 299.06 K"
36741686-36742776 mlx90614: celsius: "Temperature: 25.91 °C"
36741686-36742776 mlx90614: kelvin: "Temperature: 299.06 K"
37035524-37036613 mlx90614: celsius: "Temperature: 25.93 °C"
37035524-37036613 mlx90614: kelvin: "Temperature: 299.08 K"
37133472-37134561 mlx90614: celsius: "Temperature: 25.91 °C"
37133472-37134561 mlx90614: kelvin: "Temperature: 299.06 K"
37427316-37428405 mlx90614: celsius: "Temperature: 25.97 °C"
37427316-37428405 mlx90614: kelvin: "Temperature: 299.12 K"
37525263-37526356 mlx90614: celsius: "Temperature: 25.99 °C"
37525263-37526356 mlx90614: kelvin: "Temperature: 299.14 K"
37819109-37820200 mlx90614: celsius: "Temperature: 25.93 °C"
37819109-37820200 mlx90614: kelvin: "Temperature: 299.08 K"
37917056-37918146 mlx90614: celsius: "Temperature: 25.97 °C"
37917056-37918146 mlx90614: kelvin: "Temperature: 299.12 K"
38210896-38211985 mlx90614: celsius: "Temperature: 25.91 °C"
38210896-38211985 mlx90614: kelvin: "Temperature: 299.06 K"
38308843-38309932 mlx90614: celsius: "Temperature: 25.91 °C"
38308843-38309932 mlx90614: kelvin: "Temperature: 299.06 K"
38602685-38603778 mlx90614: celsius: "Temperature: 25.87 °C"
38602685-38603778 mlx90614: kelvin: "Temperature: 299.02 K"
38700639-38701727 mlx90614: celsius: "Temperature: 25.91 °C"
38700639-38701727 mlx90614: kelvin: "Temperature: 299.06 K"
38994477-38995566 mlx90614: celsius: "Temperature: 25.91 °C"
38994477-38995566 mlx90614: kelvin: "Temperature: 299.06 K"
39092424-39093513 mlx90614: celsius: "Temperature: 25.91 °C"
39092424-39093513 mlx90614: kelvin: "Temperature: 299.06 K"
39386268-39387356 mlx90614: celsius: "Temperature: 25.91 °C"
39386268-39387356 mlx90614: kelvin: "Temperature: 299.06 K"
39484216-39485305 mlx90614: celsius: "Temperature: 25.91 °C"
39484216-39485305 mlx90614: kelvin: "Temperature: 299.06 K"
39778060-39779149 mlx90614: celsius: "Temperature: 25.91 °C"
39778060-39779149 mlx90614: kelvin: "Temperature: 299.06 K"
39876007-39877096 mlx90614: celsius: "Temperature: 25.93 °C"
39876007-39877096 mlx90614: kelvin: "Temperature: 299.08 K"
40169848-40170938 mlx90614: celsius: "Temperature: 25.91 °C"
40169848-40170938 mlx90614: kelvin: "Temperature: 299.06 K"
40267797-40268886 mlx90614: celsius: "Temperature: 25.91 °C"
40267797-40268886 mlx90614: kelvin: "Temperature: 299.06 K"
40561638-40562728 mlx90614: celsius: "Temperature: 25.91 °C"
40561638-40562728 mlx90614: kelvin: "Temperature: 299.06 K"
40659588-40660677 mlx90614: celsius: "Temperature: 25.97 °C"
40659588-40660677 mlx90614: kelvin: "Temperature: 299.12 K"
40953433-40954522 mlx90614: celsius: "Temperature: 25.91 °C"
40953433-40954522 mlx90614: kelvin: "Temperature: 299.06 K"
41051380-41052473 mlx90614: celsius: "Temperature: 25.87 °C"
41051380-41052473 mlx90614: kelvin: "Temperature: 299.02 K"
41345221-41346311 mlx90614: celsius: "Temperature: 25.91 °C"
41345221-41346311 mlx90614: kelvin: "Temperature: 299.06 K"
41443168-41444258 mlx90614: celsius: "Temperature: 25.91 °C"
41443168-41444258 mlx90614: kelvin: "Temperature: 299.06 K"
41737013-41738102 mlx90614: celsius: "Temperature: 25.91 °C"
41737013-41738102 mlx90614: kelvin: "Temperature: 299.06 K"
41834960-41836049 mlx90614: celsius: "Temperature: 25.85 °C"
41834960-41836049 mlx90614: kelvin: "Temperature: 299.00 K"
42128803-42129893 mlx90614: celsius: "Temperature: 25.91 °C"
42128803-42129893 mlx90614: kelvin: "Temperature: 299.06 K"
42226751-42227841 mlx90614: celsius: "Temperature: 25.91 °C"
42226751-42227841 mlx90614: kelvin: "Temperature: 299.06 K"
42520588-42521681 mlx90614: celsius: "Temperature: 25.87 °C"
42520588-42521681 mlx90614: kelvin: "Temperature: 299.02 K"
42618541-42619634 mlx90614: celsius: "Temperature: 25.87 °C"
42618541-42619634 mlx90614: kelvin: "Temperature: 299.02 K"
42912382-42913475 mlx90614: celsius: "Temperature: 25.87 °C"
42912382-42913475 mlx90614: kelvin: "Temperature: 299.02 K"
43010327-43011417 mlx90614: celsius: "Temperature: 25.91 °C"
43010327-43011417 mlx90614: kelvin: "Temperature: 299.06 K"
43304172-43305261 mlx90614: celsius: "Temperature: 25.85 °C"
43304172-43305261 mlx90614: kelvin: "Temperature: 299.00 K"
43402119-43403211 mlx90614: celsius: "Temperature: 25.87 °C"
43402119-43403211 mlx90614: kelvin: "Temperature: 299.02 K"
45387595-45388681 mlx90614: celsius: "Temperature: 26.47 °C"
45387595-45388681 mlx90614: kelvin: "Temperature: 299.62 K"
45485539-45486621 mlx90614: celsius: "Temperature: 26.41 °C"
45485539-45486621 mlx90614: kelvin: "Temperature: 299.56 K"
45779385-45780483 mlx90614: celsius: "Temperature: 26.31 °C"
45779385-45780483 mlx90614: kelvin: "Temperature: 299.46 K"
45877330-45878431 mlx90614: celsius: "Temperature: 26.35 °C"
45877330-45878431 mlx90614: kelvin: "Temperature: 299.50 K"
46171170-46172263 mlx90614: celsius: "Temperature: 26.29 °C"
46171170-46172263 mlx90614: kelvin: "Temperature: 299.44 K"
46269123-46270212 mlx90614: celsius: "Temperature: 26.21 °C"
46269123-46270212 mlx90614: kelvin: "Temperature: 299.36 K"
46562965-46564056 mlx90614: celsius: "Temperature: 26.09 °C"
46562965-46564056 mlx90614: kelvin: "Temperature: 299.24 K"
46660912-46661998 mlx90614: celsius: "Temperature: 26.05 °C"
46660912-46661998 mlx90614: kelvin: "Temperature: 299.20 K"
46954754-46955848 mlx90614: celsius: "Temperature: 25.99 °C"
46954754-46955848 mlx90614: kelvin: "Temperature: 299.14 K"
47052700-47053793 mlx90614: celsius: "Temperature: 25.99 °C"
47052700-47053793 mlx90614: kelvin: "Temperature: 299.14 K"
47346545-47347635 mlx90614: celsius: "Temperature: 25.97 °C"
47346545-47347635 mlx90614: kelvin: "Temperature: 299.12 K"
47444493-47445587 mlx90614: celsius: "Temperature: 25.99 °C"
47444493-47445587 mlx90614: kelvin: "Temperature: 299.14 K"
47738333-47739422 mlx90614: celsius: "Temperature: 25.93 °C"
47738333-47739422 mlx90614: kelvin: "Temperature: 299.08 K"
47836280-47837370 mlx90614: celsius: "Temperature: 25.91 °C"
47836280-47837370 mlx90614: kelvin: "Temperature: 299.06 K"
48130122-48131212 mlx90614: celsius: "Temperature: 25.93 °C"
48130122-48131212 mlx90614: kelvin: "Temperature: 299.08 K"
48228078-48229167 mlx90614: celsius: "Temperature: 25.93 °C"
48228078-48229167 mlx90614: kelvin: "Temperature: 299.08 K"
48521914-48523003 mlx90614: celsius: "Temperature: 25.93 °C"
48521914-48523003 mlx90614: kelvin: "Temperature: 299.08 K"
48619861-48620951 mlx90614: celsius: "Temperature: 25.91 °C"
48619861-48620951 mlx90614: kelvin: "Temperature: 299.06 K"
48913705-48914799 mlx90614: celsius: "Temperature: 25.87 °C"
48913705-48914799 mlx90614: kelvin: "Temperature: 299.02 K"
49011657-49012746 mlx90614: celsius: "Temperature: 25.85 °C"
49011657-49012746 mlx90614: kelvin: "Temperature: 299.00 K"
49305495-49306588 mlx90614: celsius: "Temperature: 25.87 °C"
49305495-49306588 mlx90614: kelvin: "Temperature: 299.02 K"
49403446-49404535 mlx90614: celsius: "Temperature: 25.85 °C"
49403446-49404535 mlx90614: kelvin: "Temperature: 299.00 K"
49697290-49698376 mlx90614: celsius: "Temperature: 25.81 °C"
49697290-49698376 mlx90614: kelvin: "Temperature: 298.96 K"
49795234-49796323 mlx90614: celsius: "Temperature: 25.79 °C"
49795234-49796323 mlx90614: kelvin: "Temperature: 298.94 K"
50089075-50090164 mlx90614: celsius: "Temperature: 25.85 °C"
50089075-50090164 mlx90614: kelvin: "Temperature: 299.00 K"
50187030-50188116 mlx90614: celsius: "Temperature: 25.81 °C"
50187030-50188116 mlx90614: kelvin: "Temperature: 298.96 K"
50480866-50481952 mlx90614: celsius: "Temperature: 25.81 °C"
50480866-50481952 mlx90614: kelvin: "Temperature: 298.96 K"
50578815-50579902 mlx90614: celsius: "Temperature: 25.81 °C"
50578815-50579902 mlx90614: kelvin: "Temperature: 298.96 K"
50872658-50873743 mlx90614: celsius: "Temperature: 25.81 °C"
50872658-50873743 mlx90614: kelvin: "Temperature: 298.96 K"
50970607-50971697 mlx90614: celsius: "Temperature: 25.79 °C"
50970607-50971697 mlx90614: kelvin: "Temperature: 298.94 K"
51264450-51265537 mlx90614: celsius: "Temperature: 25.81 °C"
51264450-51265537 mlx90614: kelvin: "Temperature: 298.96 K"
51362399-51363485 mlx90614: celsius: "Temperature: 25.81 °C"
51362399-51363485 mlx90614: kelvin: "Temperature: 298.96 K"
51656241-51657323 mlx90614: celsius: "Temperature: 25.73 °C"
51656241-51657323 mlx90614: kelvin: "Temperature: 298.88 K"
51754187-51755269 mlx90614: celsius: "Temperature: 25.73 °C"
51754187-51755269 mlx90614: kelvin: "Temperature: 298.88 K"
52048028-52049114 mlx90614: celsius: "Temperature: 25.81 °C"
52048028-52049114 mlx90614: kelvin: "Temperature: 298.96 K"
52145980-52147069 mlx90614: celsius: "Temperature: 25.79 °C"
52145980-52147069 mlx90614: kelvin: "Temperature: 298.94 K"
52439822-52440908 mlx90614: celsius: "Temperature: 25.75 °C"
52439822-52440908 mlx90614: kelvin: "Temperature: 298.90 K"
52537766-52538848 mlx90614: celsius: "Temperature: 25.73 °C"
52537766-52538848 mlx90614: kelvin: "Temperature: 298.88 K"
52831609-52832694 mlx90614: celsius: "Temperature: 25.75 °C"
52831609-52832694 mlx90614: kelvin: "Temperature: 298.90 K"
52929558-52930640 mlx90614: celsius: "Temperature: 25.73 °C"
52929558-52930640 mlx90614: kelvin: "Temperature: 298.88 K"
53223401-53224487 mlx90614: celsius: "Temperature: 25.75 °C"
53223401-53224487 mlx90614: kelvin: "Temperature: 298.90 K"
53321351-53322432 mlx90614: celsius: "Temperature: 25.73 °C"
53321351-53322432 mlx90614: kelvin: "Temperature: 298.88 K"
53615193-53616279 mlx90614: celsius: "Temperature: 25.75 °C"
53615193-53616279 mlx90614: kelvin: "Temperature: 298.90 K"
53713138-53714223 mlx90614: celsius: "Temperature: 25.75 °C"
53713138-53714223 mlx90614: kelvin: "Temperature: 298.90 K"
54006978-54008067 mlx90614: celsius: "Temperature: 25.79 °C"
54006978-54008067 mlx90614: kelvin: "Temperature: 298.94 K"
54104934-54106023 mlx90614: celsius: "Temperature: 25.79 °C"
54104934-54106023 mlx90614: kelvin: "Temperature: 298.94 K"
54398771-54399856 mlx90614: celsius: "Temperature: 25.75 °C"
54398771-54399856 mlx90614: kelvin: "Temperature: 298.90 K"
54496720-54497811 mlx90614: celsius: "Temperature: 25.79 °C"
54496720-54497811 mlx90614: kelvin: "Temperature: 298.94 K"
54790563-54791652 mlx90614: celsius: "Temperature: 25.79 °C"
54790563-54791652 mlx90614: kelvin: "Temperature: 298.94 K"
54888510-54889596 mlx90614: celsius: "Temperature: 25.81 °C"
54888510-54889596 mlx90614: kelvin: "Temperature: 298.96 K"
55182352-55183438 mlx90614: celsius: "Temperature: 25.75 °C"
55182352-55183438 mlx90614: kelvin: "Temperature: 298.90 K"
55280302-55281391 mlx90614: celsius: "Temperature: 25.79 °C"
55280302-55281391 mlx90614: kelvin: "Temperature: 298.94 K"
55574145-55575230 mlx90614: celsius: "Temperature: 25.75 °C"
55574145-55575230 mlx90614: kelvin: "Temperature: 298.90 K"
55672094-55673176 mlx90614: celsius: "Temperature: 25.73 °C"
55672094-55673176 mlx90614: kelvin: "Temperature: 298.88 K"
55965935-55967021 mlx90614: celsius: "Temperature: 25.75 °C"
55965935-55967021 mlx90614: kelvin: "Temperature: 298.90 K"
56063887-56064978 mlx90614: celsius: "Temperature: 25.79 °C"
56063887-56064978 mlx90614: kelvin: "Temperature: 298.94 K"
56357724-56358809 mlx90614: celsius: "Temperature: 25.75 °C"
56357724-56358809 mlx90614: kelvin: "Temperature: 298.90 K"
56455673-56456764 mlx90614: celsius: "Temperature: 25.79 °C"
56455673-56456764 mlx90614: kelvin: "Temperature: 298.94 K"
56749516-56750602 mlx90614: celsius: "Temperature: 25.75 °C"
56749516-56750602 mlx90614: kelvin: "Temperature: 298.90 K"
56847466-56848551 mlx90614: celsius: "Temperature: 25.75 °C"
56847466-56848551 mlx90614: kelvin: "Temperature: 298.90 K"
57141308-57142394 mlx90614: celsius: "Temperature: 25.75 °C"
57141308-57142394 mlx90614: kelvin: "Temperature: 298.90 K"
57239252-57240334 mlx90614: celsius: "Temperature: 25.73 °C"
57239252-57240334 mlx90614: kelvin: "Temperature: 298.88 K"
57533095-57534181 mlx90614: celsius: "Temperature: 25.75 °C"
57533095-57534181 mlx90614: kelvin: "Temperature: 298.90 K"
57631045-57632138 mlx90614: celsius: "Temperature: 25.67 °C"
57631045-57632138 mlx90614: kelvin: "Temperature: 298.82 K"
57924886-57925971 mlx90614: celsius: "Temperature: 25.75 °C"
57924886-57925971 mlx90614: kelvin: "Temperature: 298.90 K"
58022837-58023930 mlx90614: celsius: "Temperature: 25.69 °C"
58022837-58023930 mlx90614: kelvin: "Temperature: 298.84 K"
58316680-58317762 mlx90614: celsius: "Temperature: 25.73 °C"
58316680-58317762 mlx90614: kelvin: "Temperature: 298.88 K"
58414626-58415719 mlx90614: celsius: "Temperature: 25.67 °C"
58414626-58415719 mlx90614: kelvin: "Temperature: 298.82 K"
58708468-58709554 mlx90614: celsius: "Temperature: 25.75 °C"
58708468-58709554 mlx90614: kelvin: "Temperature: 298.90 K"
58806418-58807511 mlx90614: celsius: "Temperature: 25.69 °C"
58806418-58807511 mlx90614: kelvin: "Temperature: 298.84 K"
59100261-59101342 mlx90614: celsius: "Temperature: 25.73 °C"
59100261-59101342 mlx90614: kelvin: "Temperature: 298.88 K"
59198206-59199300 mlx90614: celsius: "Temperature: 25.69 °C"
59198206-59199300 mlx90614: kelvin: "Temperature: 298.84 K"
59492049-59493135 mlx90614: celsius: "Temperature: 25.75 °C"
59492049-59493135 mlx90614: kelvin: "Temperature: 298.90 K"
59589999-59591085 mlx90614: celsius: "Temperature: 25.75 °C"
59589999-59591085 mlx90614: kelvin: "Temperature: 298.90 K"
59883840-59884921 mlx90614: celsius: "Temperature: 25.73 °C"
59883840-59884921 mlx90614: kelvin: "Temperature: 298.88 K"
59981787-59982881 mlx90614: celsius: "Temperature: 25.69 °C"
59981787-59982881 mlx90614: kelvin: "Temperature: 298.84 K"
