97705-99485 ir_rc5: bit: "1"
99485-101240 ir_rc5: bit: "1"
101240-103009 ir_rc5: bit: "0"
103009-104770 ir_rc5: bit: "0"
104770-106526 ir_rc5: bit: "0"
106526-108256 ir_rc5: bit: "1"
108256-110025 ir_rc5: bit: "0"
110025-111763 ir_rc5: bit: "1"
111763-113533 ir_rc5: bit: "0"
113533-115294 ir_rc5: bit: "0"
115294-117024 ir_rc5: bit: "1"
117024-118780 ir_rc5: bit: "1"
118780-120550 ir_rc5: bit: "0"
120550-122309 ir_rc5: bit: "0"
97705-99485 ir_rc5: startbit1: "Startbit1: 1" "SB1: 1" "SB1" "S1" "S"
99485-101240 ir_rc5: startbit2: "Startbit2: 1" "SB2: 1" "SB2" "S2" "S"
101240-103009 ir_rc5: togglebit-0: "Togglebit: 0" "Toggle: 0" "TB: 0" "TB" "T"
103009-111763 ir_rc5: address: "Address: 5 (Video cassette recorder 1)" "Addr: 5 (VCR1)" "Addr: 5" "A: 5" "A"
111763-122309 ir_rc5: command: "Command: 12 (Standby)" "Cmd: 12 (StBy)" "Cmd: 12" "C: 12" "C"
210290-212070 ir_rc5: bit: "1"
212070-213827 ir_rc5: bit: "1"
213827-215604 ir_rc5: bit: "0"
215604-217360 ir_rc5: bit: "0"
217360-219114 ir_rc5: bit: "0"
219114-220842 ir_rc5: bit: "1"
220842-222617 ir_rc5: bit: "0"
222617-224350 ir_rc5: bit: "1"
224350-226124 ir_rc5: bit: "0"
226124-227886 ir_rc5: bit: "0"
227886-229610 ir_rc5: bit: "1"
229610-231366 ir_rc5: bit: "1"
231366-233140 ir_rc5: bit: "0"
233140-234900 ir_rc5: bit: "0"
210290-212070 ir_rc5: startbit1: "Startbit1: 1" "SB1: 1" "SB1" "S1" "S"
212070-213827 ir_rc5: startbit2: "Startbit2: 1" "SB2: 1" "SB2" "S2" "S"
213827-215604 ir_rc5: togglebit-0: "Togglebit: 0" "Toggle: 0" "TB: 0" "TB" "T"
215604-224350 ir_rc5: address: "Address: 5 (Video cassette recorder 1)" "Addr: 5 (VCR1)" "Addr: 5" "A: 5" "A"
224350-234900 ir_rc5: command: "Command: 12 (Standby)" "Cmd: 12 (StBy)" "Cmd: 12" "C: 12" "C"
322880-324660 ir_rc5: bit: "1"
324660-326413 ir_rc5: bit: "1"
326413-328182 ir_rc5: bit: "0"
328182-329949 ir_rc5: bit: "0"
329949-331704 ir_rc5: bit: "0"
331704-333429 ir_rc5: bit: "1"
333429-335198 ir_rc5: bit: "0"
335198-336928 ir_rc5: bit: "1"
336928-338705 ir_rc5: bit: "0"
338705-340467 ir_rc5: bit: "0"
340467-342199 ir_rc5: bit: "1"
342199-343952 ir_rc5: bit: "1"
343952-345730 ir_rc5: bit: "0"
345730-347485 ir_rc5: bit: "0"
322880-324660 ir_rc5: startbit1: "Startbit1: 1" "SB1: 1" "SB1" "S1" "S"
324660-326413 ir_rc5: startbit2: "Startbit2: 1" "SB2: 1" "SB2" "S2" "S"
326413-328182 ir_rc5: togglebit-0: "Togglebit: 0" "Toggle: 0" "TB: 0" "TB" "T"
328182-336928 ir_rc5: address: "Address: 5 (Video cassette recorder 1)" "Addr: 5 (VCR1)" "Addr: 5" "A: 5" "A"
336928-347485 ir_rc5: command: "Command: 12 (Standby)" "Cmd: 12 (StBy)" "Cmd: 12" "C: 12" "C"
435465-437245 ir_rc5: bit: "1"
437245-439000 ir_rc5: bit: "1"
439000-440766 ir_rc5: bit: "0"
440766-442520 ir_rc5: bit: "0"
442520-444275 ir_rc5: bit: "0"
444275-446015 ir_rc5: bit: "1"
446015-447781 ir_rc5: bit: "0"
447781-449524 ir_rc5: bit: "1"
449524-451287 ir_rc5: bit: "0"
451287-453042 ir_rc5: bit: "0"
453042-454784 ir_rc5: bit: "1"
454784-456540 ir_rc5: bit: "1"
456540-458305 ir_rc5: bit: "0"
458305-460058 ir_rc5: bit: "0"
435465-437245 ir_rc5: startbit1: "Startbit1: 1" "SB1: 1" "SB1" "S1" "S"
437245-439000 ir_rc5: startbit2: "Startbit2: 1" "SB2: 1" "SB2" "S2" "S"
439000-440766 ir_rc5: togglebit-0: "Togglebit: 0" "Toggle: 0" "TB: 0" "TB" "T"
440766-449524 ir_rc5: address: "Address: 5 (Video cassette recorder 1)" "Addr: 5 (VCR1)" "Addr: 5" "A: 5" "A"
449524-460058 ir_rc5: command: "Command: 12 (Standby)" "Cmd: 12 (StBy)" "Cmd: 12" "C: 12" "C"
548054-549834 ir_rc5: bit: "1"
549834-551587 ir_rc5: bit: "1"
551587-553357 ir_rc5: bit: "0"
553357-555117 ir_rc5: bit: "0"
555117-556876 ir_rc5: bit: "0"
556876-558603 ir_rc5: bit: "1"
558603-560374 ir_rc5: bit: "0"
560374-562110 ir_rc5: bit: "1"
562110-563885 ir_rc5: bit: "0"
563885-565647 ir_rc5: bit: "0"
565647-567373 ir_rc5: bit: "1"
567373-569126 ir_rc5: bit: "1"
569126-570895 ir_rc5: bit: "0"
570895-572664 ir_rc5: bit: "0"
548054-549834 ir_rc5: startbit1: "Startbit1: 1" "SB1: 1" "SB1" "S1" "S"
549834-551587 ir_rc5: startbit2: "Startbit2: 1" "SB2: 1" "SB2" "S2" "S"
551587-553357 ir_rc5: togglebit-0: "Togglebit: 0" "Toggle: 0" "TB: 0" "TB" "T"
553357-562110 ir_rc5: address: "Address: 5 (Video cassette recorder 1)" "Addr: 5 (VCR1)" "Addr: 5" "A: 5" "A"
562110-572664 ir_rc5: command: "Command: 12 (Standby)" "Cmd: 12 (StBy)" "Cmd: 12" "C: 12" "C"
660639-662419 ir_rc5: bit: "1"
662419-664175 ir_rc5: bit: "1"
664175-665944 ir_rc5: bit: "0"
665944-667709 ir_rc5: bit: "0"
667709-669462 ir_rc5: bit: "0"
669462-671189 ir_rc5: bit: "1"
671189-672959 ir_rc5: bit: "0"
672959-674698 ir_rc5: bit: "1"
674698-676468 ir_rc5: bit: "0"
676468-678230 ir_rc5: bit: "0"
678230-679958 ir_rc5: bit: "1"
679958-681713 ir_rc5: bit: "1"
681713-683483 ir_rc5: bit: "0"
683483-685247 ir_rc5: bit: "0"
660639-662419 ir_rc5: startbit1: "Startbit1: 1" "SB1: 1" "SB1" "S1" "S"
662419-664175 ir_rc5: startbit2: "Startbit2: 1" "SB2: 1" "SB2" "S2" "S"
664175-665944 ir_rc5: togglebit-0: "Togglebit: 0" "Toggle: 0" "TB: 0" "TB" "T"
665944-674698 ir_rc5: address: "Address: 5 (Video cassette recorder 1)" "Addr: 5 (VCR1)" "Addr: 5" "A: 5" "A"
674698-685247 ir_rc5: command: "Command: 12 (Standby)" "Cmd: 12 (StBy)" "Cmd: 12" "C: 12" "C"
773228-775008 ir_rc5: bit: "1"
775008-776761 ir_rc5: bit: "1"
776761-778530 ir_rc5: bit: "0"
778530-780292 ir_rc5: bit: "0"
780292-782050 ir_rc5: bit: "0"
782050-783777 ir_rc5: bit: "1"
783777-785547 ir_rc5: bit: "0"
785547-787284 ir_rc5: bit: "1"
787284-789053 ir_rc5: bit: "0"
789053-790815 ir_rc5: bit: "0"
790815-792547 ir_rc5: bit: "1"
792547-794300 ir_rc5: bit: "1"
794300-796069 ir_rc5: bit: "0"
796069-797832 ir_rc5: bit: "0"
773228-775008 ir_rc5: startbit1: "Startbit1: 1" "SB1: 1" "SB1" "S1" "S"
775008-776761 ir_rc5: startbit2: "Startbit2: 1" "SB2: 1" "SB2" "S2" "S"
776761-778530 ir_rc5: togglebit-0: "Togglebit: 0" "Toggle: 0" "TB: 0" "TB" "T"
778530-787284 ir_rc5: address: "Address: 5 (Video cassette recorder 1)" "Addr: 5 (VCR1)" "Addr: 5" "A: 5" "A"
787284-797832 ir_rc5: command: "Command: 12 (Standby)" "Cmd: 12 (StBy)" "Cmd: 12" "C: 12" "C"
885813-887593 ir_rc5: bit: "1"
887593-889349 ir_rc5: bit: "1"
889349-891118 ir_rc5: bit: "0"
891118-892878 ir_rc5: bit: "0"
892878-894637 ir_rc5: bit: "0"
894637-896364 ir_rc5: bit: "1"
896364-898132 ir_rc5: bit: "0"
898132-899872 ir_rc5: bit: "1"
899872-901642 ir_rc5: bit: "0"
901642-903398 ir_rc5: bit: "0"
903398-905132 ir_rc5: bit: "1"
905132-906887 ir_rc5: bit: "1"
906887-908656 ir_rc5: bit: "0"
908656-910414 ir_rc5: bit: "0"
885813-887593 ir_rc5: startbit1: "Startbit1: 1" "SB1: 1" "SB1" "S1" "S"
887593-889349 ir_rc5: startbit2: "Startbit2: 1" "SB2: 1" "SB2" "S2" "S"
889349-891118 ir_rc5: togglebit-0: "Togglebit: 0" "Toggle: 0" "TB: 0" "TB" "T"
891118-899872 ir_rc5: address: "Address: 5 (Video cassette recorder 1)" "Addr: 5 (VCR1)" "Addr: 5" "A: 5" "A"
899872-910414 ir_rc5: command: "Command: 12 (Standby)" "Cmd: 12 (StBy)" "Cmd: 12" "C: 12" "C"
998402-1000182 ir_rc5: bit: "1"
1000182-1001935 ir_rc5: bit: "1"
1001935-1003704 ir_rc5: bit: "0"
1003704-1005469 ir_rc5: bit: "0"
1005469-1007214 ir_rc5: bit: "0"
1007214-1008951 ir_rc5: bit: "1"
1008951-1010720 ir_rc5: bit: "0"
1010720-1012458 ir_rc5: bit: "1"
1012458-1014227 ir_rc5: bit: "0"
1014227-1015987 ir_rc5: bit: "0"
1015987-1017721 ir_rc5: bit: "1"
1017721-1019473 ir_rc5: bit: "1"
1019473-1021242 ir_rc5: bit: "0"
1021242-1022998 ir_rc5: bit: "0"
998402-1000182 ir_rc5: startbit1: "Startbit1: 1" "SB1: 1" "SB1" "S1" "S"
1000182-1001935 ir_rc5: startbit2: "Startbit2: 1" "SB2: 1" "SB2" "S2" "S"
1001935-1003704 ir_rc5: togglebit-0: "Togglebit: 0" "Toggle: 0" "TB: 0" "TB" "T"
1003704-1012458 ir_rc5: address: "Address: 5 (Video cassette recorder 1)" "Addr: 5 (VCR1)" "Addr: 5" "A: 5" "A"
1012458-1022998 ir_rc5: command: "Command: 12 (Standby)" "Cmd: 12 (StBy)" "Cmd: 12" "C: 12" "C"
1110972-1112752 ir_rc5: bit: "1"
1112752-1114522 ir_rc5: bit: "1"
1114522-1116291 ir_rc5: bit: "0"
1116291-1118049 ir_rc5: bit: "0"
1118049-1119800 ir_rc5: bit: "0"
1119800-1121537 ir_rc5: bit: "1"
1121537-1123306 ir_rc5: bit: "0"
1123306-1125046 ir_rc5: bit: "1"
1125046-1126814 ir_rc5: bit: "0"
1126814-1128568 ir_rc5: bit: "0"
1128568-1130306 ir_rc5: bit: "1"
1130306-1132062 ir_rc5: bit: "1"
1132062-1133830 ir_rc5: bit: "0"
1133830-1135589 ir_rc5: bit: "0"
1110972-1112752 ir_rc5: startbit1: "Startbit1: 1" "SB1: 1" "SB1" "S1" "S"
1112752-1114522 ir_rc5: startbit2: "Startbit2: 1" "SB2: 1" "SB2" "S2" "S"
1114522-1116291 ir_rc5: togglebit-0: "Togglebit: 0" "Toggle: 0" "TB: 0" "TB" "T"
1116291-1125046 ir_rc5: address: "Address: 5 (Video cassette recorder 1)" "Addr: 5 (VCR1)" "Addr: 5" "A: 5" "A"
1125046-1135589 ir_rc5: command: "Command: 12 (Standby)" "Cmd: 12 (StBy)" "Cmd: 12" "C: 12" "C"
1223576-1225356 ir_rc5: bit: "1"
1225356-1227109 ir_rc5: bit: "1"
1227109-1228876 ir_rc5: bit: "0"
1228876-1230636 ir_rc5: bit: "0"
1230636-1232388 ir_rc5: bit: "0"
1232388-1234125 ir_rc5: bit: "1"
1234125-1235893 ir_rc5: bit: "0"
1235893-1237632 ir_rc5: bit: "1"
1237632-1239399 ir_rc5: bit: "0"
1239399-1241156 ir_rc5: bit: "0"
1241156-1242895 ir_rc5: bit: "1"
1242895-1244648 ir_rc5: bit: "1"
1244648-1246416 ir_rc5: bit: "0"
1246416-1248176 ir_rc5: bit: "0"
1223576-1225356 ir_rc5: startbit1: "Startbit1: 1" "SB1: 1" "SB1" "S1" "S"
1225356-1227109 ir_rc5: startbit2: "Startbit2: 1" "SB2: 1" "SB2" "S2" "S"
1227109-1228876 ir_rc5: togglebit-0: "Togglebit: 0" "Toggle: 0" "TB: 0" "TB" "T"
1228876-1237632 ir_rc5: address: "Address: 5 (Video cassette recorder 1)" "Addr: 5 (VCR1)" "Addr: 5" "A: 5" "A"
1237632-1248176 ir_rc5: command: "Command: 12 (Standby)" "Cmd: 12 (StBy)" "Cmd: 12" "C: 12" "C"
1336161-1337941 ir_rc5: bit: "1"
1337941-1339696 ir_rc5: bit: "1"
1339696-1341465 ir_rc5: bit: "0"
1341465-1343218 ir_rc5: bit: "0"
1343218-1344981 ir_rc5: bit: "0"
1344981-1346711 ir_rc5: bit: "1"
1346711-1348480 ir_rc5: bit: "0"
1348480-1350220 ir_rc5: bit: "1"
1350220-1351988 ir_rc5: bit: "0"
1351988-1353747 ir_rc5: bit: "0"
1353747-1355480 ir_rc5: bit: "1"
1355480-1357234 ir_rc5: bit: "1"
1357234-1359004 ir_rc5: bit: "0"
1359004-1360757 ir_rc5: bit: "0"
1336161-1337941 ir_rc5: startbit1: "Startbit1: 1" "SB1: 1" "SB1" "S1" "S"
1337941-1339696 ir_rc5: startbit2: "Startbit2: 1" "SB2: 1" "SB2" "S2" "S"
1339696-1341465 ir_rc5: togglebit-0: "Togglebit: 0" "Toggle: 0" "TB: 0" "TB" "T"
1341465-1350220 ir_rc5: address: "Address: 5 (Video cassette recorder 1)" "Addr: 5 (VCR1)" "Addr: 5" "A: 5" "A"
1350220-1360757 ir_rc5: command: "Command: 12 (Standby)" "Cmd: 12 (StBy)" "Cmd: 12" "C: 12" "C"
1448750-1450530 ir_rc5: bit: "1"
1450530-1452283 ir_rc5: bit: "1"
1452283-1454052 ir_rc5: bit: "0"
1454052-1455810 ir_rc5: bit: "0"
1455810-1457566 ir_rc5: bit: "0"
1457566-1459292 ir_rc5: bit: "1"
1459292-1461067 ir_rc5: bit: "0"
1461067-1462806 ir_rc5: bit: "1"
1462806-1464573 ir_rc5: bit: "0"
1464573-1466330 ir_rc5: bit: "0"
1466330-1468069 ir_rc5: bit: "1"
1468069-1469822 ir_rc5: bit: "1"
1469822-1471590 ir_rc5: bit: "0"
1471590-1473351 ir_rc5: bit: "0"
1448750-1450530 ir_rc5: startbit1: "Startbit1: 1" "SB1: 1" "SB1" "S1" "S"
1450530-1452283 ir_rc5: startbit2: "Startbit2: 1" "SB2: 1" "SB2" "S2" "S"
1452283-1454052 ir_rc5: togglebit-0: "Togglebit: 0" "Toggle: 0" "TB: 0" "TB" "T"
1454052-1462806 ir_rc5: address: "Address: 5 (Video cassette recorder 1)" "Addr: 5 (VCR1)" "Addr: 5" "A: 5" "A"
1462806-1473351 ir_rc5: command: "Command: 12 (Standby)" "Cmd: 12 (StBy)" "Cmd: 12" "C: 12" "C"
1561335-1563115 ir_rc5: bit: "1"
1563115-1564870 ir_rc5: bit: "1"
1564870-1566639 ir_rc5: bit: "0"
1566639-1568399 ir_rc5: bit: "0"
1568399-1570153 ir_rc5: bit: "0"
1570153-1571885 ir_rc5: bit: "1"
1571885-1573654 ir_rc5: bit: "0"
1573654-1575394 ir_rc5: bit: "1"
1575394-1577162 ir_rc5: bit: "0"
1577162-1578923 ir_rc5: bit: "0"
1578923-1580650 ir_rc5: bit: "1"
1580650-1582410 ir_rc5: bit: "1"
1582410-1584179 ir_rc5: bit: "0"
1584179-1585931 ir_rc5: bit: "0"
1561335-1563115 ir_rc5: startbit1: "Startbit1: 1" "SB1: 1" "SB1" "S1" "S"
1563115-1564870 ir_rc5: startbit2: "Startbit2: 1" "SB2: 1" "SB2" "S2" "S"
1564870-1566639 ir_rc5: togglebit-0: "Togglebit: 0" "Toggle: 0" "TB: 0" "TB" "T"
1566639-1575394 ir_rc5: address: "Address: 5 (Video cassette recorder 1)" "Addr: 5 (VCR1)" "Addr: 5" "A: 5" "A"
1575394-1585931 ir_rc5: command: "Command: 12 (Standby)" "Cmd: 12 (StBy)" "Cmd: 12" "C: 12" "C"
1673924-1675704 ir_rc5: bit: "1"
1675704-1677457 ir_rc5: bit: "1"
1677457-1679225 ir_rc5: bit: "0"
1679225-1680984 ir_rc5: bit: "0"
1680984-1682745 ir_rc5: bit: "0"
1682745-1684473 ir_rc5: bit: "1"
1684473-1686242 ir_rc5: bit: "0"
1686242-1687979 ir_rc5: bit: "1"
1687979-1689748 ir_rc5: bit: "0"
1689748-1691515 ir_rc5: bit: "0"
1691515-1693242 ir_rc5: bit: "1"
1693242-1694996 ir_rc5: bit: "1"
1694996-1696764 ir_rc5: bit: "0"
1696764-1698529 ir_rc5: bit: "0"
1673924-1675704 ir_rc5: startbit1: "Startbit1: 1" "SB1: 1" "SB1" "S1" "S"
1675704-1677457 ir_rc5: startbit2: "Startbit2: 1" "SB2: 1" "SB2" "S2" "S"
1677457-1679225 ir_rc5: togglebit-0: "Togglebit: 0" "Toggle: 0" "TB: 0" "TB" "T"
1679225-1687979 ir_rc5: address: "Address: 5 (Video cassette recorder 1)" "Addr: 5 (VCR1)" "Addr: 5" "A: 5" "A"
1687979-1698529 ir_rc5: command: "Command: 12 (Standby)" "Cmd: 12 (StBy)" "Cmd: 12" "C: 12" "C"
1786509-1788289 ir_rc5: bit: "1"
1788289-1790044 ir_rc5: bit: "1"
1790044-1791813 ir_rc5: bit: "0"
1791813-1793573 ir_rc5: bit: "0"
1793573-1795330 ir_rc5: bit: "0"
1795330-1797059 ir_rc5: bit: "1"
1797059-1798833 ir_rc5: bit: "0"
1798833-1800568 ir_rc5: bit: "1"
1800568-1802337 ir_rc5: bit: "0"
1802337-1804099 ir_rc5: bit: "0"
1804099-1805828 ir_rc5: bit: "1"
1805828-1807584 ir_rc5: bit: "1"
1807584-1809352 ir_rc5: bit: "0"
1809352-1811111 ir_rc5: bit: "0"
1786509-1788289 ir_rc5: startbit1: "Startbit1: 1" "SB1: 1" "SB1" "S1" "S"
1788289-1790044 ir_rc5: startbit2: "Startbit2: 1" "SB2: 1" "SB2" "S2" "S"
1790044-1791813 ir_rc5: togglebit-0: "Togglebit: 0" "Toggle: 0" "TB: 0" "TB" "T"
1791813-1800568 ir_rc5: address: "Address: 5 (Video cassette recorder 1)" "Addr: 5 (VCR1)" "Addr: 5" "A: 5" "A"
1800568-1811111 ir_rc5: command: "Command: 12 (Standby)" "Cmd: 12 (StBy)" "Cmd: 12" "C: 12" "C"
1899098-1900878 ir_rc5: bit: "1"
1900878-1902631 ir_rc5: bit: "1"
1902631-1904400 ir_rc5: bit: "0"
1904400-1906163 ir_rc5: bit: "0"
1906163-1907917 ir_rc5: bit: "0"
1907917-1909647 ir_rc5: bit: "1"
1909647-1911416 ir_rc5: bit: "0"
1911416-1913154 ir_rc5: bit: "1"
1913154-1914923 ir_rc5: bit: "0"
1914923-1916686 ir_rc5: bit: "0"
1916686-1918417 ir_rc5: bit: "1"
1918417-1920170 ir_rc5: bit: "1"
1920170-1921938 ir_rc5: bit: "0"
1921938-1923700 ir_rc5: bit: "0"
1899098-1900878 ir_rc5: startbit1: "Startbit1: 1" "SB1: 1" "SB1" "S1" "S"
1900878-1902631 ir_rc5: startbit2: "Startbit2: 1" "SB2: 1" "SB2" "S2" "S"
1902631-1904400 ir_rc5: togglebit-0: "Togglebit: 0" "Toggle: 0" "TB: 0" "TB" "T"
1904400-1913154 ir_rc5: address: "Address: 5 (Video cassette recorder 1)" "Addr: 5 (VCR1)" "Addr: 5" "A: 5" "A"
1913154-1923700 ir_rc5: command: "Command: 12 (Standby)" "Cmd: 12 (StBy)" "Cmd: 12" "C: 12" "C"
