142688-144468 ir_rc5: bit: "1"
144468-146223 ir_rc5: bit: "1"
146223-147992 ir_rc5: bit: "0"
147992-149757 ir_rc5: bit: "0"
149757-151510 ir_rc5: bit: "0"
151510-153237 ir_rc5: bit: "1"
153237-155013 ir_rc5: bit: "0"
155013-156746 ir_rc5: bit: "1"
156746-158515 ir_rc5: bit: "0"
158515-160281 ir_rc5: bit: "0"
160281-162033 ir_rc5: bit: "0"
162033-163788 ir_rc5: bit: "0"
163788-165515 ir_rc5: bit: "1"
165515-167284 ir_rc5: bit: "0"
142688-144468 ir_rc5: startbit1: "Startbit1: 1" "SB1: 1" "SB1" "S1" "S"
144468-146223 ir_rc5: startbit2: "Startbit2: 1" "SB2: 1" "SB2" "S2" "S"
146223-147992 ir_rc5: togglebit-0: "Togglebit: 0" "Toggle: 0" "TB: 0" "TB" "T"
147992-156746 ir_rc5: address: "Address: 5 (Video cassette recorder 1)" "Addr: 5 (VCR1)" "Addr: 5" "A: 5" "A"
156746-167284 ir_rc5: command: "Command: 2 (2)" "Cmd: 2 (2)" "Cmd: 2" "C: 2" "C"
255228-257008 ir_rc5: bit: "1"
257008-258763 ir_rc5: bit: "1"
258763-260532 ir_rc5: bit: "0"
260532-262293 ir_rc5: bit: "0"
262293-264044 ir_rc5: bit: "0"
264044-265777 ir_rc5: bit: "1"
265777-267546 ir_rc5: bit: "0"
267546-269286 ir_rc5: bit: "1"
269286-271054 ir_rc5: bit: "0"
271054-272815 ir_rc5: bit: "0"
272815-274562 ir_rc5: bit: "0"
274562-276324 ir_rc5: bit: "0"
276324-278055 ir_rc5: bit: "1"
278055-279824 ir_rc5: bit: "0"
255228-257008 ir_rc5: startbit1: "Startbit1: 1" "SB1: 1" "SB1" "S1" "S"
257008-258763 ir_rc5: startbit2: "Startbit2: 1" "SB2: 1" "SB2" "S2" "S"
258763-260532 ir_rc5: togglebit-0: "Togglebit: 0" "Toggle: 0" "TB: 0" "TB" "T"
260532-269286 ir_rc5: address: "Address: 5 (Video cassette recorder 1)" "Addr: 5 (VCR1)" "Addr: 5" "A: 5" "A"
269286-279824 ir_rc5: command: "Command: 2 (2)" "Cmd: 2 (2)" "Cmd: 2" "C: 2" "C"
367768-369548 ir_rc5: bit: "1"
369548-371301 ir_rc5: bit: "1"
371301-373079 ir_rc5: bit: "0"
373079-374834 ir_rc5: bit: "0"
374834-376589 ir_rc5: bit: "0"
376589-378317 ir_rc5: bit: "1"
378317-380086 ir_rc5: bit: "0"
380086-381825 ir_rc5: bit: "1"
381825-383594 ir_rc5: bit: "0"
383594-385357 ir_rc5: bit: "0"
385357-387112 ir_rc5: bit: "0"
387112-388868 ir_rc5: bit: "0"
388868-390595 ir_rc5: bit: "1"
390595-392365 ir_rc5: bit: "0"
367768-369548 ir_rc5: startbit1: "Startbit1: 1" "SB1: 1" "SB1" "S1" "S"
369548-371301 ir_rc5: startbit2: "Startbit2: 1" "SB2: 1" "SB2" "S2" "S"
371301-373079 ir_rc5: togglebit-0: "Togglebit: 0" "Toggle: 0" "TB: 0" "TB" "T"
373079-381825 ir_rc5: address: "Address: 5 (Video cassette recorder 1)" "Addr: 5 (VCR1)" "Addr: 5" "A: 5" "A"
381825-392365 ir_rc5: command: "Command: 2 (2)" "Cmd: 2 (2)" "Cmd: 2" "C: 2" "C"
480308-482088 ir_rc5: bit: "1"
482088-483843 ir_rc5: bit: "1"
483843-485622 ir_rc5: bit: "0"
485622-487377 ir_rc5: bit: "0"
487377-489133 ir_rc5: bit: "0"
489133-490857 ir_rc5: bit: "1"
490857-492630 ir_rc5: bit: "0"
492630-494365 ir_rc5: bit: "1"
494365-496142 ir_rc5: bit: "0"
496142-497901 ir_rc5: bit: "0"
497901-499654 ir_rc5: bit: "0"
499654-501414 ir_rc5: bit: "0"
501414-503135 ir_rc5: bit: "1"
503135-504911 ir_rc5: bit: "0"
480308-482088 ir_rc5: startbit1: "Startbit1: 1" "SB1: 1" "SB1" "S1" "S"
482088-483843 ir_rc5: startbit2: "Startbit2: 1" "SB2: 1" "SB2" "S2" "S"
483843-485622 ir_rc5: togglebit-0: "Togglebit: 0" "Toggle: 0" "TB: 0" "TB" "T"
485622-494365 ir_rc5: address: "Address: 5 (Video cassette recorder 1)" "Addr: 5 (VCR1)" "Addr: 5" "A: 5" "A"
494365-504911 ir_rc5: command: "Command: 2 (2)" "Cmd: 2 (2)" "Cmd: 2" "C: 2" "C"
592847-594627 ir_rc5: bit: "1"
594627-596382 ir_rc5: bit: "1"
596382-598152 ir_rc5: bit: "0"
598152-599915 ir_rc5: bit: "0"
599915-601667 ir_rc5: bit: "0"
601667-603394 ir_rc5: bit: "1"
603394-605166 ir_rc5: bit: "0"
605166-606905 ir_rc5: bit: "1"
606905-608675 ir_rc5: bit: "0"
608675-610438 ir_rc5: bit: "0"
610438-612193 ir_rc5: bit: "0"
612193-613948 ir_rc5: bit: "0"
613948-615675 ir_rc5: bit: "1"
615675-617444 ir_rc5: bit: "0"
592847-594627 ir_rc5: startbit1: "Startbit1: 1" "SB1: 1" "SB1" "S1" "S"
594627-596382 ir_rc5: startbit2: "Startbit2: 1" "SB2: 1" "SB2" "S2" "S"
596382-598152 ir_rc5: togglebit-0: "Togglebit: 0" "Toggle: 0" "TB: 0" "TB" "T"
598152-606905 ir_rc5: address: "Address: 5 (Video cassette recorder 1)" "Addr: 5 (VCR1)" "Addr: 5" "A: 5" "A"
606905-617444 ir_rc5: command: "Command: 2 (2)" "Cmd: 2 (2)" "Cmd: 2" "C: 2" "C"
705387-707167 ir_rc5: bit: "1"
707167-708922 ir_rc5: bit: "1"
708922-710692 ir_rc5: bit: "0"
710692-712458 ir_rc5: bit: "0"
712458-714215 ir_rc5: bit: "0"
714215-715937 ir_rc5: bit: "1"
715937-717713 ir_rc5: bit: "0"
717713-719445 ir_rc5: bit: "1"
719445-721222 ir_rc5: bit: "0"
721222-722980 ir_rc5: bit: "0"
722980-724734 ir_rc5: bit: "0"
724734-726491 ir_rc5: bit: "0"
726491-728215 ir_rc5: bit: "1"
728215-729990 ir_rc5: bit: "0"
705387-707167 ir_rc5: startbit1: "Startbit1: 1" "SB1: 1" "SB1" "S1" "S"
707167-708922 ir_rc5: startbit2: "Startbit2: 1" "SB2: 1" "SB2" "S2" "S"
708922-710692 ir_rc5: togglebit-0: "Togglebit: 0" "Toggle: 0" "TB: 0" "TB" "T"
710692-719445 ir_rc5: address: "Address: 5 (Video cassette recorder 1)" "Addr: 5 (VCR1)" "Addr: 5" "A: 5" "A"
719445-729990 ir_rc5: command: "Command: 2 (2)" "Cmd: 2 (2)" "Cmd: 2" "C: 2" "C"
817927-819707 ir_rc5: bit: "1"
819707-821462 ir_rc5: bit: "1"
821462-823232 ir_rc5: bit: "0"
823232-824997 ir_rc5: bit: "0"
824997-826750 ir_rc5: bit: "0"
826750-828477 ir_rc5: bit: "1"
828477-830252 ir_rc5: bit: "0"
830252-831985 ir_rc5: bit: "1"
831985-833754 ir_rc5: bit: "0"
833754-835517 ir_rc5: bit: "0"
835517-837273 ir_rc5: bit: "0"
837273-839029 ir_rc5: bit: "0"
839029-840755 ir_rc5: bit: "1"
840755-842524 ir_rc5: bit: "0"
817927-819707 ir_rc5: startbit1: "Startbit1: 1" "SB1: 1" "SB1" "S1" "S"
819707-821462 ir_rc5: startbit2: "Startbit2: 1" "SB2: 1" "SB2" "S2" "S"
821462-823232 ir_rc5: togglebit-0: "Togglebit: 0" "Toggle: 0" "TB: 0" "TB" "T"
823232-831985 ir_rc5: address: "Address: 5 (Video cassette recorder 1)" "Addr: 5 (VCR1)" "Addr: 5" "A: 5" "A"
831985-842524 ir_rc5: command: "Command: 2 (2)" "Cmd: 2 (2)" "Cmd: 2" "C: 2" "C"
930467-932247 ir_rc5: bit: "1"
932247-934002 ir_rc5: bit: "1"
934002-935779 ir_rc5: bit: "0"
935779-937535 ir_rc5: bit: "0"
937535-939290 ir_rc5: bit: "0"
939290-941017 ir_rc5: bit: "1"
941017-942786 ir_rc5: bit: "0"
942786-944525 ir_rc5: bit: "1"
944525-946298 ir_rc5: bit: "0"
946298-948058 ir_rc5: bit: "0"
948058-949815 ir_rc5: bit: "0"
949815-951566 ir_rc5: bit: "0"
951566-953295 ir_rc5: bit: "1"
953295-955064 ir_rc5: bit: "0"
930467-932247 ir_rc5: startbit1: "Startbit1: 1" "SB1: 1" "SB1" "S1" "S"
932247-934002 ir_rc5: startbit2: "Startbit2: 1" "SB2: 1" "SB2" "S2" "S"
934002-935779 ir_rc5: togglebit-0: "Togglebit: 0" "Toggle: 0" "TB: 0" "TB" "T"
935779-944525 ir_rc5: address: "Address: 5 (Video cassette recorder 1)" "Addr: 5 (VCR1)" "Addr: 5" "A: 5" "A"
944525-955064 ir_rc5: command: "Command: 2 (2)" "Cmd: 2 (2)" "Cmd: 2" "C: 2" "C"
1043007-1044787 ir_rc5: bit: "1"
1044787-1046542 ir_rc5: bit: "1"
1046542-1048315 ir_rc5: bit: "0"
1048315-1050071 ir_rc5: bit: "0"
1050071-1051828 ir_rc5: bit: "0"
1051828-1053556 ir_rc5: bit: "1"
1053556-1055325 ir_rc5: bit: "0"
1055325-1057064 ir_rc5: bit: "1"
1057064-1058834 ir_rc5: bit: "0"
1058834-1060594 ir_rc5: bit: "0"
1060594-1062349 ir_rc5: bit: "0"
1062349-1064106 ir_rc5: bit: "0"
1064106-1065834 ir_rc5: bit: "1"
1065834-1067604 ir_rc5: bit: "0"
1043007-1044787 ir_rc5: startbit1: "Startbit1: 1" "SB1: 1" "SB1" "S1" "S"
1044787-1046542 ir_rc5: startbit2: "Startbit2: 1" "SB2: 1" "SB2" "S2" "S"
1046542-1048315 ir_rc5: togglebit-0: "Togglebit: 0" "Toggle: 0" "TB: 0" "TB" "T"
1048315-1057064 ir_rc5: address: "Address: 5 (Video cassette recorder 1)" "Addr: 5 (VCR1)" "Addr: 5" "A: 5" "A"
1057064-1067604 ir_rc5: command: "Command: 2 (2)" "Cmd: 2 (2)" "Cmd: 2" "C: 2" "C"
1155546-1157326 ir_rc5: bit: "1"
1157326-1159082 ir_rc5: bit: "1"
1159082-1160855 ir_rc5: bit: "0"
1160855-1162611 ir_rc5: bit: "0"
1162611-1164369 ir_rc5: bit: "0"
1164369-1166096 ir_rc5: bit: "1"
1166096-1167865 ir_rc5: bit: "0"
1167865-1169605 ir_rc5: bit: "1"
1169605-1171374 ir_rc5: bit: "0"
1171374-1173135 ir_rc5: bit: "0"
1173135-1174891 ir_rc5: bit: "0"
1174891-1176645 ir_rc5: bit: "0"
1176645-1178374 ir_rc5: bit: "1"
1178374-1180143 ir_rc5: bit: "0"
1155546-1157326 ir_rc5: startbit1: "Startbit1: 1" "SB1: 1" "SB1" "S1" "S"
1157326-1159082 ir_rc5: startbit2: "Startbit2: 1" "SB2: 1" "SB2" "S2" "S"
1159082-1160855 ir_rc5: togglebit-0: "Togglebit: 0" "Toggle: 0" "TB: 0" "TB" "T"
1160855-1169605 ir_rc5: address: "Address: 5 (Video cassette recorder 1)" "Addr: 5 (VCR1)" "Addr: 5" "A: 5" "A"
1169605-1180143 ir_rc5: command: "Command: 2 (2)" "Cmd: 2 (2)" "Cmd: 2" "C: 2" "C"
1268087-1269867 ir_rc5: bit: "1"
1269867-1271622 ir_rc5: bit: "1"
1271622-1273397 ir_rc5: bit: "0"
1273397-1275151 ir_rc5: bit: "0"
1275151-1276911 ir_rc5: bit: "0"
1276911-1278636 ir_rc5: bit: "1"
1278636-1280410 ir_rc5: bit: "0"
1280410-1282144 ir_rc5: bit: "1"
1282144-1283915 ir_rc5: bit: "0"
1283915-1285677 ir_rc5: bit: "0"
1285677-1287432 ir_rc5: bit: "0"
1287432-1289184 ir_rc5: bit: "0"
1289184-1290914 ir_rc5: bit: "1"
1290914-1292683 ir_rc5: bit: "0"
1268087-1269867 ir_rc5: startbit1: "Startbit1: 1" "SB1: 1" "SB1" "S1" "S"
1269867-1271622 ir_rc5: startbit2: "Startbit2: 1" "SB2: 1" "SB2" "S2" "S"
1271622-1273397 ir_rc5: togglebit-0: "Togglebit: 0" "Toggle: 0" "TB: 0" "TB" "T"
1273397-1282144 ir_rc5: address: "Address: 5 (Video cassette recorder 1)" "Addr: 5 (VCR1)" "Addr: 5" "A: 5" "A"
1282144-1292683 ir_rc5: command: "Command: 2 (2)" "Cmd: 2 (2)" "Cmd: 2" "C: 2" "C"
1380626-1382406 ir_rc5: bit: "1"
1382406-1384161 ir_rc5: bit: "1"
1384161-1385938 ir_rc5: bit: "0"
1385938-1387695 ir_rc5: bit: "0"
1387695-1389449 ir_rc5: bit: "0"
1389449-1391175 ir_rc5: bit: "1"
1391175-1392948 ir_rc5: bit: "0"
1392948-1394684 ir_rc5: bit: "1"
1394684-1396458 ir_rc5: bit: "0"
1396458-1398216 ir_rc5: bit: "0"
1398216-1399971 ir_rc5: bit: "0"
1399971-1401727 ir_rc5: bit: "0"
1401727-1403454 ir_rc5: bit: "1"
1403454-1405228 ir_rc5: bit: "0"
1380626-1382406 ir_rc5: startbit1: "Startbit1: 1" "SB1: 1" "SB1" "S1" "S"
1382406-1384161 ir_rc5: startbit2: "Startbit2: 1" "SB2: 1" "SB2" "S2" "S"
1384161-1385938 ir_rc5: togglebit-0: "Togglebit: 0" "Toggle: 0" "TB: 0" "TB" "T"
1385938-1394684 ir_rc5: address: "Address: 5 (Video cassette recorder 1)" "Addr: 5 (VCR1)" "Addr: 5" "A: 5" "A"
1394684-1405228 ir_rc5: command: "Command: 2 (2)" "Cmd: 2 (2)" "Cmd: 2" "C: 2" "C"
1493166-1494946 ir_rc5: bit: "1"
1494946-1496701 ir_rc5: bit: "1"
1496701-1498474 ir_rc5: bit: "0"
1498474-1500235 ir_rc5: bit: "0"
1500235-1501989 ir_rc5: bit: "0"
1501989-1503715 ir_rc5: bit: "1"
1503715-1505489 ir_rc5: bit: "0"
1505489-1507221 ir_rc5: bit: "1"
1507221-1508998 ir_rc5: bit: "0"
1508998-1510756 ir_rc5: bit: "0"
1510756-1512510 ir_rc5: bit: "0"
1512510-1514269 ir_rc5: bit: "0"
1514269-1515994 ir_rc5: bit: "1"
1515994-1517763 ir_rc5: bit: "0"
1493166-1494946 ir_rc5: startbit1: "Startbit1: 1" "SB1: 1" "SB1" "S1" "S"
1494946-1496701 ir_rc5: startbit2: "Startbit2: 1" "SB2: 1" "SB2" "S2" "S"
1496701-1498474 ir_rc5: togglebit-0: "Togglebit: 0" "Toggle: 0" "TB: 0" "TB" "T"
1498474-1507221 ir_rc5: address: "Address: 5 (Video cassette recorder 1)" "Addr: 5 (VCR1)" "Addr: 5" "A: 5" "A"
1507221-1517763 ir_rc5: command: "Command: 2 (2)" "Cmd: 2 (2)" "Cmd: 2" "C: 2" "C"
1605706-1607486 ir_rc5: bit: "1"
1607486-1609241 ir_rc5: bit: "1"
1609241-1611011 ir_rc5: bit: "0"
1611011-1612774 ir_rc5: bit: "0"
1612774-1614526 ir_rc5: bit: "0"
1614526-1616255 ir_rc5: bit: "1"
1616255-1618025 ir_rc5: bit: "0"
1618025-1619763 ir_rc5: bit: "1"
1619763-1621533 ir_rc5: bit: "0"
1621533-1623297 ir_rc5: bit: "0"
1623297-1625053 ir_rc5: bit: "0"
1625053-1626808 ir_rc5: bit: "0"
1626808-1628533 ir_rc5: bit: "1"
1628533-1630303 ir_rc5: bit: "0"
1605706-1607486 ir_rc5: startbit1: "Startbit1: 1" "SB1: 1" "SB1" "S1" "S"
1607486-1609241 ir_rc5: startbit2: "Startbit2: 1" "SB2: 1" "SB2" "S2" "S"
1609241-1611011 ir_rc5: togglebit-0: "Togglebit: 0" "Toggle: 0" "TB: 0" "TB" "T"
1611011-1619763 ir_rc5: address: "Address: 5 (Video cassette recorder 1)" "Addr: 5 (VCR1)" "Addr: 5" "A: 5" "A"
1619763-1630303 ir_rc5: command: "Command: 2 (2)" "Cmd: 2 (2)" "Cmd: 2" "C: 2" "C"
1718233-1720013 ir_rc5: bit: "1"
1720013-1721781 ir_rc5: bit: "1"
1721781-1723556 ir_rc5: bit: "0"
1723556-1725313 ir_rc5: bit: "0"
1725313-1727068 ir_rc5: bit: "0"
1727068-1728796 ir_rc5: bit: "1"
1728796-1730571 ir_rc5: bit: "0"
1730571-1732304 ir_rc5: bit: "1"
1732304-1734073 ir_rc5: bit: "0"
1734073-1735833 ir_rc5: bit: "0"
1735833-1737592 ir_rc5: bit: "0"
1737592-1739342 ir_rc5: bit: "0"
1739342-1741074 ir_rc5: bit: "1"
1741074-1742843 ir_rc5: bit: "0"
1718233-1720013 ir_rc5: startbit1: "Startbit1: 1" "SB1: 1" "SB1" "S1" "S"
1720013-1721781 ir_rc5: startbit2: "Startbit2: 1" "SB2: 1" "SB2" "S2" "S"
1721781-1723556 ir_rc5: togglebit-0: "Togglebit: 0" "Toggle: 0" "TB: 0" "TB" "T"
1723556-1732304 ir_rc5: address: "Address: 5 (Video cassette recorder 1)" "Addr: 5 (VCR1)" "Addr: 5" "A: 5" "A"
1732304-1742843 ir_rc5: command: "Command: 2 (2)" "Cmd: 2 (2)" "Cmd: 2" "C: 2" "C"
1830786-1832566 ir_rc5: bit: "1"
1832566-1834321 ir_rc5: bit: "1"
1834321-1836090 ir_rc5: bit: "0"
1836090-1837851 ir_rc5: bit: "0"
1837851-1839607 ir_rc5: bit: "0"
1839607-1841335 ir_rc5: bit: "1"
1841335-1843105 ir_rc5: bit: "0"
1843105-1844844 ir_rc5: bit: "1"
1844844-1846619 ir_rc5: bit: "0"
1846619-1848379 ir_rc5: bit: "0"
1848379-1850128 ir_rc5: bit: "0"
1850128-1851888 ir_rc5: bit: "0"
1851888-1853613 ir_rc5: bit: "1"
1853613-1855389 ir_rc5: bit: "0"
1830786-1832566 ir_rc5: startbit1: "Startbit1: 1" "SB1: 1" "SB1" "S1" "S"
1832566-1834321 ir_rc5: startbit2: "Startbit2: 1" "SB2: 1" "SB2" "S2" "S"
1834321-1836090 ir_rc5: togglebit-0: "Togglebit: 0" "Toggle: 0" "TB: 0" "TB" "T"
1836090-1844844 ir_rc5: address: "Address: 5 (Video cassette recorder 1)" "Addr: 5 (VCR1)" "Addr: 5" "A: 5" "A"
1844844-1855389 ir_rc5: command: "Command: 2 (2)" "Cmd: 2 (2)" "Cmd: 2" "C: 2" "C"
1943326-1945106 ir_rc5: bit: "1"
1945106-1946861 ir_rc5: bit: "1"
1946861-1948636 ir_rc5: bit: "0"
1948636-1950394 ir_rc5: bit: "0"
1950394-1952148 ir_rc5: bit: "0"
1952148-1953875 ir_rc5: bit: "1"
1953875-1955649 ir_rc5: bit: "0"
1955649-1957384 ir_rc5: bit: "1"
1957384-1959159 ir_rc5: bit: "0"
1959159-1960915 ir_rc5: bit: "0"
1960915-1962672 ir_rc5: bit: "0"
1962672-1964428 ir_rc5: bit: "0"
1964428-1966153 ir_rc5: bit: "1"
1966153-1967923 ir_rc5: bit: "0"
1943326-1945106 ir_rc5: startbit1: "Startbit1: 1" "SB1: 1" "SB1" "S1" "S"
1945106-1946861 ir_rc5: startbit2: "Startbit2: 1" "SB2: 1" "SB2" "S2" "S"
1946861-1948636 ir_rc5: togglebit-0: "Togglebit: 0" "Toggle: 0" "TB: 0" "TB" "T"
1948636-1957384 ir_rc5: address: "Address: 5 (Video cassette recorder 1)" "Addr: 5 (VCR1)" "Addr: 5" "A: 5" "A"
1957384-1967923 ir_rc5: command: "Command: 2 (2)" "Cmd: 2 (2)" "Cmd: 2" "C: 2" "C"
