121967-123747 ir_rc5: bit: "1"
123747-125500 ir_rc5: bit: "1"
125500-127255 ir_rc5: bit: "1"
127255-129013 ir_rc5: bit: "0"
129013-130773 ir_rc5: bit: "0"
130773-132517 ir_rc5: bit: "1"
132517-134270 ir_rc5: bit: "0"
134270-136025 ir_rc5: bit: "1"
136025-137780 ir_rc5: bit: "0"
137780-139543 ir_rc5: bit: "0"
139543-141292 ir_rc5: bit: "0"
141292-143051 ir_rc5: bit: "0"
143051-144809 ir_rc5: bit: "0"
144809-146550 ir_rc5: bit: "1"
121967-123747 ir_rc5: startbit1: "Startbit1: 1" "SB1: 1" "SB1" "S1" "S"
123747-125500 ir_rc5: startbit2: "Startbit2: 1" "SB2: 1" "SB2" "S2" "S"
125500-127255 ir_rc5: togglebit-1: "Togglebit: 1" "Toggle: 1" "TB: 1" "TB" "T"
127255-136025 ir_rc5: address: "Address: 5 (Video cassette recorder 1)" "Addr: 5 (VCR1)" "Addr: 5" "A: 5" "A"
136025-146550 ir_rc5: command: "Command: 1 (1)" "Cmd: 1 (1)" "Cmd: 1" "C: 1" "C"
234583-236363 ir_rc5: bit: "1"
236363-238131 ir_rc5: bit: "1"
238131-239886 ir_rc5: bit: "1"
239886-241637 ir_rc5: bit: "0"
241637-243403 ir_rc5: bit: "0"
243403-245147 ir_rc5: bit: "1"
245147-246909 ir_rc5: bit: "0"
246909-248653 ir_rc5: bit: "1"
248653-250414 ir_rc5: bit: "0"
250414-252174 ir_rc5: bit: "0"
252174-253926 ir_rc5: bit: "0"
253926-255684 ir_rc5: bit: "0"
255684-257430 ir_rc5: bit: "0"
257430-259179 ir_rc5: bit: "1"
234583-236363 ir_rc5: startbit1: "Startbit1: 1" "SB1: 1" "SB1" "S1" "S"
236363-238131 ir_rc5: startbit2: "Startbit2: 1" "SB2: 1" "SB2" "S2" "S"
238131-239886 ir_rc5: togglebit-1: "Togglebit: 1" "Toggle: 1" "TB: 1" "TB" "T"
239886-248653 ir_rc5: address: "Address: 5 (Video cassette recorder 1)" "Addr: 5 (VCR1)" "Addr: 5" "A: 5" "A"
248653-259179 ir_rc5: command: "Command: 1 (1)" "Cmd: 1 (1)" "Cmd: 1" "C: 1" "C"
347215-348995 ir_rc5: bit: "1"
348995-350745 ir_rc5: bit: "1"
350745-352515 ir_rc5: bit: "1"
352515-354259 ir_rc5: bit: "0"
354259-356032 ir_rc5: bit: "0"
356032-357776 ir_rc5: bit: "1"
357776-359531 ir_rc5: bit: "0"
359531-361282 ir_rc5: bit: "1"
361282-363030 ir_rc5: bit: "0"
363030-364802 ir_rc5: bit: "0"
364802-366555 ir_rc5: bit: "0"
366555-368311 ir_rc5: bit: "0"
368311-370065 ir_rc5: bit: "0"
370065-371808 ir_rc5: bit: "1"
347215-348995 ir_rc5: startbit1: "Startbit1: 1" "SB1: 1" "SB1" "S1" "S"
348995-350745 ir_rc5: startbit2: "Startbit2: 1" "SB2: 1" "SB2" "S2" "S"
350745-352515 ir_rc5: togglebit-1: "Togglebit: 1" "Toggle: 1" "TB: 1" "TB" "T"
352515-361282 ir_rc5: address: "Address: 5 (Video cassette recorder 1)" "Addr: 5 (VCR1)" "Addr: 5" "A: 5" "A"
361282-371808 ir_rc5: command: "Command: 1 (1)" "Cmd: 1 (1)" "Cmd: 1" "C: 1" "C"
459854-461634 ir_rc5: bit: "1"
461634-463388 ir_rc5: bit: "1"
463388-465143 ir_rc5: bit: "1"
465143-466904 ir_rc5: bit: "0"
466904-468661 ir_rc5: bit: "0"
468661-470404 ir_rc5: bit: "1"
470404-472161 ir_rc5: bit: "0"
472161-473910 ir_rc5: bit: "1"
473910-475676 ir_rc5: bit: "0"
475676-477432 ir_rc5: bit: "0"
477432-479184 ir_rc5: bit: "0"
479184-480940 ir_rc5: bit: "0"
480940-482694 ir_rc5: bit: "0"
482694-484436 ir_rc5: bit: "1"
459854-461634 ir_rc5: startbit1: "Startbit1: 1" "SB1: 1" "SB1" "S1" "S"
461634-463388 ir_rc5: startbit2: "Startbit2: 1" "SB2: 1" "SB2" "S2" "S"
463388-465143 ir_rc5: togglebit-1: "Togglebit: 1" "Toggle: 1" "TB: 1" "TB" "T"
465143-473910 ir_rc5: address: "Address: 5 (Video cassette recorder 1)" "Addr: 5 (VCR1)" "Addr: 5" "A: 5" "A"
473910-484436 ir_rc5: command: "Command: 1 (1)" "Cmd: 1 (1)" "Cmd: 1" "C: 1" "C"
572482-574262 ir_rc5: bit: "1"
574262-576016 ir_rc5: bit: "1"
576016-577772 ir_rc5: bit: "1"
577772-579526 ir_rc5: bit: "0"
579526-581289 ir_rc5: bit: "0"
581289-583032 ir_rc5: bit: "1"
583032-584782 ir_rc5: bit: "0"
584782-586539 ir_rc5: bit: "1"
586539-588294 ir_rc5: bit: "0"
588294-590060 ir_rc5: bit: "0"
590060-591812 ir_rc5: bit: "0"
591812-593566 ir_rc5: bit: "0"
593566-595321 ir_rc5: bit: "0"
595321-597065 ir_rc5: bit: "1"
572482-574262 ir_rc5: startbit1: "Startbit1: 1" "SB1: 1" "SB1" "S1" "S"
574262-576016 ir_rc5: startbit2: "Startbit2: 1" "SB2: 1" "SB2" "S2" "S"
576016-577772 ir_rc5: togglebit-1: "Togglebit: 1" "Toggle: 1" "TB: 1" "TB" "T"
577772-586539 ir_rc5: address: "Address: 5 (Video cassette recorder 1)" "Addr: 5 (VCR1)" "Addr: 5" "A: 5" "A"
586539-597065 ir_rc5: command: "Command: 1 (1)" "Cmd: 1 (1)" "Cmd: 1" "C: 1" "C"
685111-686891 ir_rc5: bit: "1"
686891-688645 ir_rc5: bit: "1"
688645-690400 ir_rc5: bit: "1"
690400-692147 ir_rc5: bit: "0"
692147-693904 ir_rc5: bit: "0"
693904-695660 ir_rc5: bit: "1"
695660-697418 ir_rc5: bit: "0"
697418-699167 ir_rc5: bit: "1"
699167-700924 ir_rc5: bit: "0"
700924-702687 ir_rc5: bit: "0"
702687-704441 ir_rc5: bit: "0"
704441-706197 ir_rc5: bit: "0"
706197-707951 ir_rc5: bit: "0"
707951-709693 ir_rc5: bit: "1"
685111-686891 ir_rc5: startbit1: "Startbit1: 1" "SB1: 1" "SB1" "S1" "S"
686891-688645 ir_rc5: startbit2: "Startbit2: 1" "SB2: 1" "SB2" "S2" "S"
688645-690400 ir_rc5: togglebit-1: "Togglebit: 1" "Toggle: 1" "TB: 1" "TB" "T"
690400-699167 ir_rc5: address: "Address: 5 (Video cassette recorder 1)" "Addr: 5 (VCR1)" "Addr: 5" "A: 5" "A"
699167-709693 ir_rc5: command: "Command: 1 (1)" "Cmd: 1 (1)" "Cmd: 1" "C: 1" "C"
797739-799519 ir_rc5: bit: "1"
799519-801273 ir_rc5: bit: "1"
801273-803028 ir_rc5: bit: "1"
803028-804785 ir_rc5: bit: "0"
804785-806546 ir_rc5: bit: "0"
806546-808289 ir_rc5: bit: "1"
808289-810045 ir_rc5: bit: "0"
810045-811796 ir_rc5: bit: "1"
811796-813549 ir_rc5: bit: "0"
813549-815315 ir_rc5: bit: "0"
815315-817070 ir_rc5: bit: "0"
817070-818825 ir_rc5: bit: "0"
818825-820574 ir_rc5: bit: "0"
820574-822321 ir_rc5: bit: "1"
797739-799519 ir_rc5: startbit1: "Startbit1: 1" "SB1: 1" "SB1" "S1" "S"
799519-801273 ir_rc5: startbit2: "Startbit2: 1" "SB2: 1" "SB2" "S2" "S"
801273-803028 ir_rc5: togglebit-1: "Togglebit: 1" "Toggle: 1" "TB: 1" "TB" "T"
803028-811796 ir_rc5: address: "Address: 5 (Video cassette recorder 1)" "Addr: 5 (VCR1)" "Addr: 5" "A: 5" "A"
811796-822321 ir_rc5: command: "Command: 1 (1)" "Cmd: 1 (1)" "Cmd: 1" "C: 1" "C"
910367-912147 ir_rc5: bit: "1"
912147-913901 ir_rc5: bit: "1"
913901-915657 ir_rc5: bit: "1"
915657-917415 ir_rc5: bit: "0"
917415-919173 ir_rc5: bit: "0"
919173-920917 ir_rc5: bit: "1"
920917-922681 ir_rc5: bit: "0"
922681-924422 ir_rc5: bit: "1"
924422-926175 ir_rc5: bit: "0"
926175-927944 ir_rc5: bit: "0"
927944-929697 ir_rc5: bit: "0"
929697-931453 ir_rc5: bit: "0"
931453-933206 ir_rc5: bit: "0"
933206-934950 ir_rc5: bit: "1"
910367-912147 ir_rc5: startbit1: "Startbit1: 1" "SB1: 1" "SB1" "S1" "S"
912147-913901 ir_rc5: startbit2: "Startbit2: 1" "SB2: 1" "SB2" "S2" "S"
913901-915657 ir_rc5: togglebit-1: "Togglebit: 1" "Toggle: 1" "TB: 1" "TB" "T"
915657-924422 ir_rc5: address: "Address: 5 (Video cassette recorder 1)" "Addr: 5 (VCR1)" "Addr: 5" "A: 5" "A"
924422-934950 ir_rc5: command: "Command: 1 (1)" "Cmd: 1 (1)" "Cmd: 1" "C: 1" "C"
1022996-1024776 ir_rc5: bit: "1"
1024776-1026530 ir_rc5: bit: "1"
1026530-1028285 ir_rc5: bit: "1"
1028285-1030038 ir_rc5: bit: "0"
1030038-1031803 ir_rc5: bit: "0"
1031803-1033545 ir_rc5: bit: "1"
1033545-1035308 ir_rc5: bit: "0"
1035308-1037052 ir_rc5: bit: "1"
1037052-1038811 ir_rc5: bit: "0"
1038811-1040573 ir_rc5: bit: "0"
1040573-1042327 ir_rc5: bit: "0"
1042327-1044081 ir_rc5: bit: "0"
1044081-1045835 ir_rc5: bit: "0"
1045835-1047578 ir_rc5: bit: "1"
1022996-1024776 ir_rc5: startbit1: "Startbit1: 1" "SB1: 1" "SB1" "S1" "S"
1024776-1026530 ir_rc5: startbit2: "Startbit2: 1" "SB2: 1" "SB2" "S2" "S"
1026530-1028285 ir_rc5: togglebit-1: "Togglebit: 1" "Toggle: 1" "TB: 1" "TB" "T"
1028285-1037052 ir_rc5: address: "Address: 5 (Video cassette recorder 1)" "Addr: 5 (VCR1)" "Addr: 5" "A: 5" "A"
1037052-1047578 ir_rc5: command: "Command: 1 (1)" "Cmd: 1 (1)" "Cmd: 1" "C: 1" "C"
1135624-1137404 ir_rc5: bit: "1"
1137404-1139158 ir_rc5: bit: "1"
1139158-1140913 ir_rc5: bit: "1"
1140913-1142661 ir_rc5: bit: "0"
1142661-1144431 ir_rc5: bit: "0"
1144431-1146167 ir_rc5: bit: "1"
1146167-1147933 ir_rc5: bit: "0"
1147933-1149680 ir_rc5: bit: "1"
1149680-1151426 ir_rc5: bit: "0"
1151426-1153201 ir_rc5: bit: "0"
1153201-1154954 ir_rc5: bit: "0"
1154954-1156710 ir_rc5: bit: "0"
1156710-1158462 ir_rc5: bit: "0"
1158462-1160207 ir_rc5: bit: "1"
1135624-1137404 ir_rc5: startbit1: "Startbit1: 1" "SB1: 1" "SB1" "S1" "S"
1137404-1139158 ir_rc5: startbit2: "Startbit2: 1" "SB2: 1" "SB2" "S2" "S"
1139158-1140913 ir_rc5: togglebit-1: "Togglebit: 1" "Toggle: 1" "TB: 1" "TB" "T"
1140913-1149680 ir_rc5: address: "Address: 5 (Video cassette recorder 1)" "Addr: 5 (VCR1)" "Addr: 5" "A: 5" "A"
1149680-1160207 ir_rc5: command: "Command: 1 (1)" "Cmd: 1 (1)" "Cmd: 1" "C: 1" "C"
1248252-1250032 ir_rc5: bit: "1"
1250032-1251786 ir_rc5: bit: "1"
1251786-1253542 ir_rc5: bit: "1"
1253542-1255300 ir_rc5: bit: "0"
1255300-1257057 ir_rc5: bit: "0"
1257057-1258802 ir_rc5: bit: "1"
1258802-1260558 ir_rc5: bit: "0"
1260558-1262309 ir_rc5: bit: "1"
1262309-1264059 ir_rc5: bit: "0"
1264059-1265827 ir_rc5: bit: "0"
1265827-1267582 ir_rc5: bit: "0"
1267582-1269335 ir_rc5: bit: "0"
1269335-1271092 ir_rc5: bit: "0"
1271092-1272835 ir_rc5: bit: "1"
1248252-1250032 ir_rc5: startbit1: "Startbit1: 1" "SB1: 1" "SB1" "S1" "S"
1250032-1251786 ir_rc5: startbit2: "Startbit2: 1" "SB2: 1" "SB2" "S2" "S"
1251786-1253542 ir_rc5: togglebit-1: "Togglebit: 1" "Toggle: 1" "TB: 1" "TB" "T"
1253542-1262309 ir_rc5: address: "Address: 5 (Video cassette recorder 1)" "Addr: 5 (VCR1)" "Addr: 5" "A: 5" "A"
1262309-1272835 ir_rc5: command: "Command: 1 (1)" "Cmd: 1 (1)" "Cmd: 1" "C: 1" "C"
1360881-1362661 ir_rc5: bit: "1"
1362661-1364415 ir_rc5: bit: "1"
1364415-1366170 ir_rc5: bit: "1"
1366170-1367929 ir_rc5: bit: "0"
1367929-1369682 ir_rc5: bit: "0"
1369682-1371431 ir_rc5: bit: "1"
1371431-1373184 ir_rc5: bit: "0"
1373184-1374938 ir_rc5: bit: "1"
1374938-1376685 ir_rc5: bit: "0"
1376685-1378457 ir_rc5: bit: "0"
1378457-1380211 ir_rc5: bit: "0"
1380211-1381967 ir_rc5: bit: "0"
1381967-1383719 ir_rc5: bit: "0"
1383719-1385464 ir_rc5: bit: "1"
1360881-1362661 ir_rc5: startbit1: "Startbit1: 1" "SB1: 1" "SB1" "S1" "S"
1362661-1364415 ir_rc5: startbit2: "Startbit2: 1" "SB2: 1" "SB2" "S2" "S"
1364415-1366170 ir_rc5: togglebit-1: "Togglebit: 1" "Toggle: 1" "TB: 1" "TB" "T"
1366170-1374938 ir_rc5: address: "Address: 5 (Video cassette recorder 1)" "Addr: 5 (VCR1)" "Addr: 5" "A: 5" "A"
1374938-1385464 ir_rc5: command: "Command: 1 (1)" "Cmd: 1 (1)" "Cmd: 1" "C: 1" "C"
1473509-1475289 ir_rc5: bit: "1"
1475289-1477043 ir_rc5: bit: "1"
1477043-1478798 ir_rc5: bit: "1"
1478798-1480549 ir_rc5: bit: "0"
1480549-1482317 ir_rc5: bit: "0"
1482317-1484059 ir_rc5: bit: "1"
1484059-1485823 ir_rc5: bit: "0"
1485823-1487566 ir_rc5: bit: "1"
1487566-1489319 ir_rc5: bit: "0"
1489319-1491086 ir_rc5: bit: "0"
1491086-1492840 ir_rc5: bit: "0"
1492840-1494595 ir_rc5: bit: "0"
1494595-1496338 ir_rc5: bit: "0"
1496338-1498092 ir_rc5: bit: "1"
1473509-1475289 ir_rc5: startbit1: "Startbit1: 1" "SB1: 1" "SB1" "S1" "S"
1475289-1477043 ir_rc5: startbit2: "Startbit2: 1" "SB2: 1" "SB2" "S2" "S"
1477043-1478798 ir_rc5: togglebit-1: "Togglebit: 1" "Toggle: 1" "TB: 1" "TB" "T"
1478798-1487566 ir_rc5: address: "Address: 5 (Video cassette recorder 1)" "Addr: 5 (VCR1)" "Addr: 5" "A: 5" "A"
1487566-1498092 ir_rc5: command: "Command: 1 (1)" "Cmd: 1 (1)" "Cmd: 1" "C: 1" "C"
1586138-1587918 ir_rc5: bit: "1"
1587918-1589672 ir_rc5: bit: "1"
1589672-1591427 ir_rc5: bit: "1"
1591427-1593184 ir_rc5: bit: "0"
1593184-1594940 ir_rc5: bit: "0"
1594940-1596687 ir_rc5: bit: "1"
1596687-1598444 ir_rc5: bit: "0"
1598444-1600193 ir_rc5: bit: "1"
1600193-1601956 ir_rc5: bit: "0"
1601956-1603715 ir_rc5: bit: "0"
1603715-1605468 ir_rc5: bit: "0"
1605468-1607224 ir_rc5: bit: "0"
1607224-1608977 ir_rc5: bit: "0"
1608977-1610720 ir_rc5: bit: "1"
1586138-1587918 ir_rc5: startbit1: "Startbit1: 1" "SB1: 1" "SB1" "S1" "S"
1587918-1589672 ir_rc5: startbit2: "Startbit2: 1" "SB2: 1" "SB2" "S2" "S"
1589672-1591427 ir_rc5: togglebit-1: "Togglebit: 1" "Toggle: 1" "TB: 1" "TB" "T"
1591427-1600193 ir_rc5: address: "Address: 5 (Video cassette recorder 1)" "Addr: 5 (VCR1)" "Addr: 5" "A: 5" "A"
1600193-1610720 ir_rc5: command: "Command: 1 (1)" "Cmd: 1 (1)" "Cmd: 1" "C: 1" "C"
1698766-1700546 ir_rc5: bit: "1"
1700546-1702300 ir_rc5: bit: "1"
1702300-1704055 ir_rc5: bit: "1"
1704055-1705806 ir_rc5: bit: "0"
1705806-1707573 ir_rc5: bit: "0"
1707573-1709316 ir_rc5: bit: "1"
1709316-1711068 ir_rc5: bit: "0"
1711068-1712823 ir_rc5: bit: "1"
1712823-1714574 ir_rc5: bit: "0"
1714574-1716343 ir_rc5: bit: "0"
1716343-1718096 ir_rc5: bit: "0"
1718096-1719846 ir_rc5: bit: "0"
1719846-1721606 ir_rc5: bit: "0"
1721606-1723349 ir_rc5: bit: "1"
1698766-1700546 ir_rc5: startbit1: "Startbit1: 1" "SB1: 1" "SB1" "S1" "S"
1700546-1702300 ir_rc5: startbit2: "Startbit2: 1" "SB2: 1" "SB2" "S2" "S"
1702300-1704055 ir_rc5: togglebit-1: "Togglebit: 1" "Toggle: 1" "TB: 1" "TB" "T"
1704055-1712823 ir_rc5: address: "Address: 5 (Video cassette recorder 1)" "Addr: 5 (VCR1)" "Addr: 5" "A: 5" "A"
1712823-1723349 ir_rc5: command: "Command: 1 (1)" "Cmd: 1 (1)" "Cmd: 1" "C: 1" "C"
1811394-1813174 ir_rc5: bit: "1"
1813174-1814929 ir_rc5: bit: "1"
1814929-1816684 ir_rc5: bit: "1"
1816684-1818441 ir_rc5: bit: "0"
1818441-1820201 ir_rc5: bit: "0"
1820201-1821945 ir_rc5: bit: "1"
1821945-1823698 ir_rc5: bit: "0"
1823698-1825451 ir_rc5: bit: "1"
1825451-1827199 ir_rc5: bit: "0"
1827199-1828971 ir_rc5: bit: "0"
1828971-1830723 ir_rc5: bit: "0"
1830723-1832481 ir_rc5: bit: "0"
1832481-1834234 ir_rc5: bit: "0"
1834234-1835977 ir_rc5: bit: "1"
1811394-1813174 ir_rc5: startbit1: "Startbit1: 1" "SB1: 1" "SB1" "S1" "S"
1813174-1814929 ir_rc5: startbit2: "Startbit2: 1" "SB2: 1" "SB2" "S2" "S"
1814929-1816684 ir_rc5: togglebit-1: "Togglebit: 1" "Toggle: 1" "TB: 1" "TB" "T"
1816684-1825451 ir_rc5: address: "Address: 5 (Video cassette recorder 1)" "Addr: 5 (VCR1)" "Addr: 5" "A: 5" "A"
1825451-1835977 ir_rc5: command: "Command: 1 (1)" "Cmd: 1 (1)" "Cmd: 1" "C: 1" "C"
1924023-1925803 ir_rc5: bit: "1"
1925803-1927557 ir_rc5: bit: "1"
1927557-1929312 ir_rc5: bit: "1"
1929312-1931065 ir_rc5: bit: "0"
1931065-1932830 ir_rc5: bit: "0"
1932830-1934573 ir_rc5: bit: "1"
1934573-1936337 ir_rc5: bit: "0"
1936337-1938080 ir_rc5: bit: "1"
1938080-1939844 ir_rc5: bit: "0"
1939844-1941600 ir_rc5: bit: "0"
1941600-1943350 ir_rc5: bit: "0"
1943350-1945107 ir_rc5: bit: "0"
1945107-1946863 ir_rc5: bit: "0"
1946863-1948599 ir_rc5: bit: "1"
1924023-1925803 ir_rc5: startbit1: "Startbit1: 1" "SB1: 1" "SB1" "S1" "S"
1925803-1927557 ir_rc5: startbit2: "Startbit2: 1" "SB2: 1" "SB2" "S2" "S"
1927557-1929312 ir_rc5: togglebit-1: "Togglebit: 1" "Toggle: 1" "TB: 1" "TB" "T"
1929312-1938080 ir_rc5: address: "Address: 5 (Video cassette recorder 1)" "Addr: 5 (VCR1)" "Addr: 5" "A: 5" "A"
1938080-1948599 ir_rc5: command: "Command: 1 (1)" "Cmd: 1 (1)" "Cmd: 1" "C: 1" "C"
