202936-203039 ook_vis: field: "a"
203039-203143 ook_vis: field: "a"
203143-203246 ook_vis: field: "a"
203246-203349 ook_vis: field: "a"
203349-203452 ook_vis: field: "a"
203452-203556 ook_vis: field: "a"
203556-203659 ook_vis: field: "a"
203659-203762 ook_vis: field: "b"
203762-203865 ook_vis: field: "3"
203865-203969 ook_vis: field: "2"
203969-204072 ook_vis: field: "c"
204072-204175 ook_vis: field: "c"
204175-204278 ook_vis: field: "c"
204278-204382 ook_vis: field: "b"
204382-204485 ook_vis: field: "2"
204485-204588 ook_vis: field: "d"
204588-204691 ook_vis: field: "5"
204691-204795 ook_vis: field: "5"
204795-204898 ook_vis: field: "3"
204898-205001 ook_vis: field: "4"
205001-205105 ook_vis: field: "b"
205105-205208 ook_vis: field: "3"
205208-205311 ook_vis: field: "4"
205311-205414 ook_vis: field: "b"
205414-205518 ook_vis: field: "5"
205518-205621 ook_vis: field: "5"
205621-205724 ook_vis: field: "3"
205724-205827 ook_vis: field: "4"
205827-205930 ook_vis: field: "d"
205930-206034 ook_vis: field: "4"
206034-206137 ook_vis: field: "d"
206137-206240 ook_vis: field: "5"
206240-206343 ook_vis: field: "5"
206343-206447 ook_vis: field: "5"
206447-206550 ook_vis: field: "3"
206550-206653 ook_vis: field: "4"
206653-206756 ook_vis: field: "c"
206756-206860 ook_vis: field: "d"
206860-206963 ook_vis: field: "5"
206963-207066 ook_vis: field: "4"
207066-207169 ook_vis: field: "c"
207169-207273 ook_vis: field: "a"
207273-207376 ook_vis: field: "d"
207376-207479 ook_vis: field: "3"
207479-207582 ook_vis: field: "5"
207582-207686 ook_vis: field: "5"
207686-207789 ook_vis: field: "4"
207789-207892 ook_vis: field: "b"
207892-207995 ook_vis: field: "2"
207995-208099 ook_vis: field: "a"
208099-208202 ook_vis: field: "c"
208202-208305 ook_vis: field: "d"
208305-208408 ook_vis: field: "5"
208408-208512 ook_vis: field: "5"
208512-208615 ook_vis: field: "5"
208615-208718 ook_vis: field: "5"
202936-203737 ook_vis: level2: "Preamble" "Pre" "P"
203737-203840 ook_vis: level2: "Sync" "Syn" "S"
203840-203943 ook_vis: level2: "9"
203943-204046 ook_vis: level2: "6"
204046-204150 ook_vis: level2: "6"
204150-204253 ook_vis: level2: "6"
204253-204356 ook_vis: level2: "5"
204356-204459 ook_vis: level2: "9"
204459-204562 ook_vis: level2: "6"
204562-204666 ook_vis: level2: "a"
204666-204769 ook_vis: level2: "a"
204769-204872 ook_vis: level2: "9"
204872-204976 ook_vis: level2: "a"
204976-205079 ook_vis: level2: "5"
205079-205182 ook_vis: level2: "9"
205182-205285 ook_vis: level2: "a"
205285-205389 ook_vis: level2: "5"
205389-205492 ook_vis: level2: "a"
205492-205595 ook_vis: level2: "a"
205595-205698 ook_vis: level2: "9"
205698-205801 ook_vis: level2: "a"
205801-205905 ook_vis: level2: "6"
205905-206008 ook_vis: level2: "a"
206008-206111 ook_vis: level2: "6"
206111-206214 ook_vis: level2: "a"
206214-206318 ook_vis: level2: "a"
206318-206421 ook_vis: level2: "a"
206421-206524 ook_vis: level2: "9"
206524-206628 ook_vis: level2: "a"
206628-206731 ook_vis: level2: "6"
206731-206834 ook_vis: level2: "6"
206834-206937 ook_vis: level2: "a"
206937-207040 ook_vis: level2: "a"
207040-207144 ook_vis: level2: "6"
207144-207247 ook_vis: level2: "5"
207247-207350 ook_vis: level2: "6"
207350-207453 ook_vis: level2: "9"
207453-207557 ook_vis: level2: "a"
207557-207660 ook_vis: level2: "a"
207660-207763 ook_vis: level2: "a"
207763-207866 ook_vis: level2: "5"
207866-207970 ook_vis: level2: "9"
207970-208073 ook_vis: level2: "5"
208073-208176 ook_vis: level2: "6"
208176-208279 ook_vis: level2: "6"
208279-208383 ook_vis: level2: "a"
208383-208486 ook_vis: level2: "a"
208486-208589 ook_vis: level2: "a"
208589-208692 ook_vis: level2: "a"
