11370-11403 ook_vis: field: "f"
11370-11403 ook_vis: level2: "Preamble" "Pre" "P"
14099-14146 ook_vis: field: "f"
14099-14157 ook_vis: level2: "Preamble" "Pre" "P"
19164-19187 ook_vis: field: "f"
21862-21883 ook_vis: field: "f"
23007-23028 ook_vis: field: "f"
24590-24619 ook_vis: field: "f"
26947-26978 ook_vis: field: "f"
44788-44835 ook_vis: field: "f"
44788-44835 ook_vis: level2: "Preamble" "Pre" "P"
48518-48569 ook_vis: field: "f"
50401-50492 ook_vis: field: "f"
50492-50590 ook_vis: field: "f"
50590-50687 ook_vis: field: "f"
50687-50785 ook_vis: field: "f"
50785-50883 ook_vis: field: "f"
50883-50980 ook_vis: field: "f"
50980-51078 ook_vis: field: "5"
51078-51175 ook_vis: field: "f"
51175-51272 ook_vis: field: "1"
51272-51371 ook_vis: field: "4"
51371-51468 ook_vis: field: "2"
51468-51565 ook_vis: field: "8"
51565-51663 ook_vis: field: "f"
51663-51762 ook_vis: field: "6"
51762-51858 ook_vis: field: "0"
51858-51956 ook_vis: field: "c"
51956-52053 ook_vis: field: "e"
52053-52152 ook_vis: field: "8"
52152-52250 ook_vis: field: "0"
52250-52346 ook_vis: field: "2"
52346-52446 ook_vis: field: "e"
52446-52543 ook_vis: field: "3"
52543-52640 ook_vis: field: "a"
52640-52739 ook_vis: field: "a"
52739-52835 ook_vis: field: "7"
52835-52920 ook_vis: field: "b"
50401-50980 ook_vis: level2: "Preamble" "Pre" "P"
50980-51078 ook_vis: level2: "Sync" "Syn" "S"
51078-51175 ook_vis: level2: "f"
51175-51272 ook_vis: level2: "1"
51272-51371 ook_vis: level2: "4"
51371-51468 ook_vis: level2: "2"
51468-51565 ook_vis: level2: "8"
51565-51663 ook_vis: level2: "f"
51663-51762 ook_vis: level2: "6"
51762-51858 ook_vis: level2: "0"
51858-51956 ook_vis: level2: "c"
51956-52053 ook_vis: level2: "e"
52053-52152 ook_vis: level2: "8"
52152-52250 ook_vis: level2: "0"
52250-52346 ook_vis: level2: "2"
52346-52446 ook_vis: level2: "e"
52446-52543 ook_vis: level2: "3"
52543-52640 ook_vis: level2: "a"
52640-52739 ook_vis: level2: "a"
52739-52835 ook_vis: level2: "7"
52835-52920 ook_vis: level2: "b"
62301-62378 ook_vis: field: "f"
62301-62378 ook_vis: level2: "Preamble" "Pre" "P"
70471-70527 ook_vis: field: "f"
70471-70527 ook_vis: level2: "Preamble" "Pre" "P"
88455-88491 ook_vis: field: "f"
88455-88491 ook_vis: level2: "Preamble" "Pre" "P"
94396-94440 ook_vis: field: "f"
97961-98018 ook_vis: field: "111E"
97961-97990 ook_vis: level2: "Preamble" "Pre" "P"
97979-98029 ook_vis: level2: "1EE1"
106438-106479 ook_vis: field: "000E"
106438-106478 ook_vis: level2: "Preamble" "Pre" "P"
111405-111432 ook_vis: field: "f"
111890-111956 ook_vis: field: "f"
111956-112010 ook_vis: field: "EEEE"
111890-111956 ook_vis: level2: "Preamble" "Pre" "P"
111956-112010 ook_vis: level2: "Sync" "Syn" "S"
114580-114613 ook_vis: field: "5"
114613-114669 ook_vis: field: "5"
119110-119150 ook_vis: field: "f"
119362-119401 ook_vis: field: "f"
119474-119505 ook_vis: field: "0EEE"
119505-119550 ook_vis: field: "EEEE"
119474-119498 ook_vis: level2: "Preamble" "Pre" "P"
119498-119515 ook_vis: level2: "Sync" "Syn" "S"
119515-119559 ook_vis: level2: "EEE1"
129703-129737 ook_vis: field: "111E"
129703-129734 ook_vis: level2: "Preamble" "Pre" "P"
129734-129786 ook_vis: level2: "Sync" "Syn" "S"
133104-133126 ook_vis: field: "f"
134841-134873 ook_vis: field: "f"
134841-134873 ook_vis: level2: "Preamble" "Pre" "P"
140342-140370 ook_vis: field: "f"
143996-144026 ook_vis: field: "0"
143996-144026 ook_vis: level2: "Preamble" "Pre" "P"
144085-144102 ook_vis: field: "0E01"
146818-146901 ook_vis: field: "f"
152809-152829 ook_vis: field: "f"
152809-152829 ook_vis: level2: "Preamble" "Pre" "P"
153297-153333 ook_vis: field: "0"
153297-153333 ook_vis: level2: "Preamble" "Pre" "P"
158535-158595 ook_vis: field: "000E"
158595-158676 ook_vis: field: "E1E1"
158535-158593 ook_vis: level2: "Preamble" "Pre" "P"
158593-158665 ook_vis: level2: "Sync" "Syn" "S"
158780-158809 ook_vis: field: "f"
161615-161650 ook_vis: field: "f"
162524-162561 ook_vis: field: "f"
162524-162561 ook_vis: level2: "Preamble" "Pre" "P"
162553-162601 ook_vis: level2: "10E1"
167374-167401 ook_vis: field: "f"
175817-175912 ook_vis: field: "f"
175912-176009 ook_vis: field: "f"
176009-176107 ook_vis: field: "f"
176107-176204 ook_vis: field: "f"
176204-176302 ook_vis: field: "f"
176302-176399 ook_vis: field: "f"
176399-176497 ook_vis: field: "5"
176497-176594 ook_vis: field: "8"
176594-176692 ook_vis: field: "9"
176692-176789 ook_vis: field: "1"
176789-176888 ook_vis: field: "2"
176888-176985 ook_vis: field: "0"
176985-177083 ook_vis: field: "a"
177083-177180 ook_vis: field: "7"
177180-177278 ook_vis: field: "0"
177278-177376 ook_vis: field: "4"
177376-177473 ook_vis: field: "0"
177473-177572 ook_vis: field: "3"
177572-177669 ook_vis: field: "c"
177669-177767 ook_vis: field: "c"
177767-177864 ook_vis: field: "0"
177864-177962 ook_vis: field: "0"
177962-178059 ook_vis: field: "4"
178059-178157 ook_vis: field: "0"
178157-178256 ook_vis: field: "f"
178256-178352 ook_vis: field: "c"
178352-178450 ook_vis: field: "b"
178450-178536 ook_vis: field: "7"
175817-176399 ook_vis: level2: "Preamble" "Pre" "P"
176399-176497 ook_vis: level2: "Sync" "Syn" "S"
176497-176594 ook_vis: level2: "8"
176594-176692 ook_vis: level2: "9"
176692-176789 ook_vis: level2: "1"
176789-176888 ook_vis: level2: "2"
176888-176985 ook_vis: level2: "0"
176985-177083 ook_vis: level2: "a"
177083-177180 ook_vis: level2: "7"
177180-177278 ook_vis: level2: "0"
177278-177376 ook_vis: level2: "4"
177376-177473 ook_vis: level2: "0"
177473-177572 ook_vis: level2: "3"
177572-177669 ook_vis: level2: "c"
177669-177767 ook_vis: level2: "c"
177767-177864 ook_vis: level2: "0"
177864-177962 ook_vis: level2: "0"
177962-178059 ook_vis: level2: "4"
178059-178157 ook_vis: level2: "0"
178157-178256 ook_vis: level2: "f"
178256-178352 ook_vis: level2: "c"
178352-178450 ook_vis: level2: "b"
178450-178536 ook_vis: level2: "7"
184240-184279 ook_vis: field: "000E"
184240-184278 ook_vis: level2: "Preamble" "Pre" "P"
184278-184316 ook_vis: level2: "Sync" "Syn" "S"
186358-186453 ook_vis: field: "f"
186453-186551 ook_vis: field: "f"
186551-186649 ook_vis: field: "f"
186649-186746 ook_vis: field: "f"
186746-186845 ook_vis: field: "f"
186845-186940 ook_vis: field: "f"
186940-187038 ook_vis: field: "5"
187038-187135 ook_vis: field: "4"
187135-187236 ook_vis: field: "9"
187236-187330 ook_vis: field: "8"
187330-187427 ook_vis: field: "2"
187427-187526 ook_vis: field: "0"
187526-187624 ook_vis: field: "b"
187624-187721 ook_vis: field: "4"
187721-187818 ook_vis: field: "0"
187818-187916 ook_vis: field: "0"
187916-188013 ook_vis: field: "0"
188013-188111 ook_vis: field: "0"
188111-188209 ook_vis: field: "0"
188209-188306 ook_vis: field: "a"
188306-188405 ook_vis: field: "1"
188405-188503 ook_vis: field: "1"
188503-188603 ook_vis: field: "1"
188603-188697 ook_vis: field: "c"
188697-188795 ook_vis: field: "0"
188795-188896 ook_vis: field: "f"
188896-188990 ook_vis: field: "c"
188990-189089 ook_vis: field: "7"
189089-189187 ook_vis: field: "2"
186358-186940 ook_vis: level2: "Preamble" "Pre" "P"
186940-187038 ook_vis: level2: "Sync" "Syn" "S"
187038-187135 ook_vis: level2: "4"
187135-187236 ook_vis: level2: "9"
187236-187330 ook_vis: level2: "8"
187330-187427 ook_vis: level2: "2"
187427-187526 ook_vis: level2: "0"
187526-187624 ook_vis: level2: "b"
187624-187721 ook_vis: level2: "4"
187721-187818 ook_vis: level2: "0"
187818-187916 ook_vis: level2: "0"
187916-188013 ook_vis: level2: "0"
188013-188111 ook_vis: level2: "0"
188111-188209 ook_vis: level2: "0"
188209-188306 ook_vis: level2: "a"
188306-188405 ook_vis: level2: "1"
188405-188503 ook_vis: level2: "1"
188503-188603 ook_vis: level2: "1"
188603-188697 ook_vis: level2: "c"
188697-188795 ook_vis: level2: "0"
188795-188896 ook_vis: level2: "f"
188896-188990 ook_vis: level2: "c"
188990-189089 ook_vis: level2: "7"
189089-189187 ook_vis: level2: "2"
190554-190596 ook_vis: field: "f"
191738-191766 ook_vis: field: "f"
191738-191776 ook_vis: level2: "Preamble" "Pre" "P"
191821-191846 ook_vis: field: "f"
191821-191846 ook_vis: level2: "Preamble" "Pre" "P"
191842-191859 ook_vis: level2: "9"
202887-203015 ook_vis: field: "5"
203015-203118 ook_vis: field: "5"
203118-203221 ook_vis: field: "5"
203221-203325 ook_vis: field: "5"
203325-203428 ook_vis: field: "5"
203428-203531 ook_vis: field: "5"
203531-203634 ook_vis: field: "5"
203634-203738 ook_vis: field: "5"
203738-203841 ook_vis: field: "9"
203841-203944 ook_vis: field: "9"
203944-204048 ook_vis: field: "6"
204048-204151 ook_vis: field: "6"
204151-204254 ook_vis: field: "6"
204254-204358 ook_vis: field: "5"
204358-204460 ook_vis: field: "9"
204460-204564 ook_vis: field: "6"
204564-204667 ook_vis: field: "a"
204667-204770 ook_vis: field: "a"
204770-204874 ook_vis: field: "9"
204874-204977 ook_vis: field: "a"
204977-205080 ook_vis: field: "5"
205080-205184 ook_vis: field: "9"
205184-205287 ook_vis: field: "a"
205287-205390 ook_vis: field: "5"
205390-205493 ook_vis: field: "a"
205493-205596 ook_vis: field: "a"
205596-205700 ook_vis: field: "9"
205700-205803 ook_vis: field: "a"
205803-205906 ook_vis: field: "6"
205906-206010 ook_vis: field: "a"
206010-206112 ook_vis: field: "6"
206112-206216 ook_vis: field: "a"
206216-206319 ook_vis: field: "a"
206319-206422 ook_vis: field: "a"
206422-206526 ook_vis: field: "9"
206526-206629 ook_vis: field: "a"
206629-206732 ook_vis: field: "6"
206732-206835 ook_vis: field: "6"
206835-206938 ook_vis: field: "a"
206938-207042 ook_vis: field: "a"
207042-207145 ook_vis: field: "6"
207145-207248 ook_vis: field: "5"
207248-207351 ook_vis: field: "6"
207351-207455 ook_vis: field: "9"
207455-207558 ook_vis: field: "a"
207558-207661 ook_vis: field: "a"
207661-207765 ook_vis: field: "a"
207765-207868 ook_vis: field: "5"
207868-207971 ook_vis: field: "9"
207971-208074 ook_vis: field: "5"
208074-208178 ook_vis: field: "6"
208178-208281 ook_vis: field: "6"
208281-208384 ook_vis: field: "a"
208384-208487 ook_vis: field: "a"
208487-208590 ook_vis: field: "a"
208590-208694 ook_vis: field: "a"
202887-203738 ook_vis: level2: "Preamble" "Pre" "P"
203738-203841 ook_vis: level2: "Sync" "Syn" "S"
203841-203944 ook_vis: level2: "9"
203944-204048 ook_vis: level2: "6"
204048-204151 ook_vis: level2: "6"
204151-204254 ook_vis: level2: "6"
204254-204358 ook_vis: level2: "5"
204358-204460 ook_vis: level2: "9"
204460-204564 ook_vis: level2: "6"
204564-204667 ook_vis: level2: "a"
204667-204770 ook_vis: level2: "a"
204770-204874 ook_vis: level2: "9"
204874-204977 ook_vis: level2: "a"
204977-205080 ook_vis: level2: "5"
205080-205184 ook_vis: level2: "9"
205184-205287 ook_vis: level2: "a"
205287-205390 ook_vis: level2: "5"
205390-205493 ook_vis: level2: "a"
205493-205596 ook_vis: level2: "a"
205596-205700 ook_vis: level2: "9"
205700-205803 ook_vis: level2: "a"
205803-205906 ook_vis: level2: "6"
205906-206010 ook_vis: level2: "a"
206010-206112 ook_vis: level2: "6"
206112-206216 ook_vis: level2: "a"
206216-206319 ook_vis: level2: "a"
206319-206422 ook_vis: level2: "a"
206422-206526 ook_vis: level2: "9"
206526-206629 ook_vis: level2: "a"
206629-206732 ook_vis: level2: "6"
206732-206835 ook_vis: level2: "6"
206835-206938 ook_vis: level2: "a"
206938-207042 ook_vis: level2: "a"
207042-207145 ook_vis: level2: "6"
207145-207248 ook_vis: level2: "5"
207248-207351 ook_vis: level2: "6"
207351-207455 ook_vis: level2: "9"
207455-207558 ook_vis: level2: "a"
207558-207661 ook_vis: level2: "a"
207661-207765 ook_vis: level2: "a"
207765-207868 ook_vis: level2: "5"
207868-207971 ook_vis: level2: "9"
207971-208074 ook_vis: level2: "5"
208074-208178 ook_vis: level2: "6"
208178-208281 ook_vis: level2: "6"
208281-208384 ook_vis: level2: "a"
208384-208487 ook_vis: level2: "a"
208487-208590 ook_vis: level2: "a"
208590-208694 ook_vis: level2: "a"
229245-229266 ook_vis: field: "f"
229245-229266 ook_vis: level2: "Preamble" "Pre" "P"
235700-235724 ook_vis: field: "f"
235880-235913 ook_vis: field: "f"
238763-238791 ook_vis: field: "f"
239828-239918 ook_vis: field: "EE00"
239828-239891 ook_vis: level2: "Preamble" "Pre" "P"
239838-239933 ook_vis: level2: "E00E"
243595-243628 ook_vis: field: "f"
245517-245544 ook_vis: field: "f"
250635-250691 ook_vis: field: "000E"
250635-250690 ook_vis: level2: "Preamble" "Pre" "P"
251662-251746 ook_vis: field: "f"
251746-251763 ook_vis: field: "EEEE"
251662-251746 ook_vis: level2: "Preamble" "Pre" "P"
251746-251763 ook_vis: level2: "Sync" "Syn" "S"
261310-261360 ook_vis: field: "f"
261310-261360 ook_vis: level2: "Preamble" "Pre" "P"
262343-262373 ook_vis: field: "f"
265144-265175 ook_vis: field: "f"
270564-270608 ook_vis: field: "000E"
270608-270683 ook_vis: field: "E0E1"
270564-270607 ook_vis: level2: "Preamble" "Pre" "P"
270607-270666 ook_vis: level2: "Sync" "Syn" "S"
277345-277375 ook_vis: field: "f"
