57-152 ook_vis: field: "f"
152-250 ook_vis: field: "f"
250-348 ook_vis: field: "f"
348-445 ook_vis: field: "f"
445-544 ook_vis: field: "f"
544-639 ook_vis: field: "f"
639-737 ook_vis: field: "5"
737-834 ook_vis: field: "4"
834-935 ook_vis: field: "9"
935-1029 ook_vis: field: "8"
1029-1126 ook_vis: field: "2"
1126-1225 ook_vis: field: "0"
1225-1323 ook_vis: field: "b"
1323-1420 ook_vis: field: "4"
1420-1517 ook_vis: field: "0"
1517-1615 ook_vis: field: "0"
1615-1712 ook_vis: field: "0"
1712-1810 ook_vis: field: "0"
1810-1908 ook_vis: field: "0"
1908-2005 ook_vis: field: "a"
2005-2104 ook_vis: field: "1"
2104-2202 ook_vis: field: "1"
2202-2302 ook_vis: field: "1"
2302-2396 ook_vis: field: "c"
2396-2494 ook_vis: field: "0"
2494-2595 ook_vis: field: "f"
2595-2689 ook_vis: field: "c"
2689-2788 ook_vis: field: "7"
2788-2886 ook_vis: field: "2"
57-639 ook_vis: level2: "Preamble" "Pre" "P"
639-737 ook_vis: level2: "Sync" "Syn" "S"
737-834 ook_vis: level2: "4"
834-935 ook_vis: level2: "9"
935-1029 ook_vis: level2: "8"
1029-1126 ook_vis: level2: "2"
1126-1225 ook_vis: level2: "0"
1225-1323 ook_vis: level2: "b"
1323-1420 ook_vis: level2: "4"
1420-1517 ook_vis: level2: "0"
1517-1615 ook_vis: level2: "0"
1615-1712 ook_vis: level2: "0"
1712-1810 ook_vis: level2: "0"
1810-1908 ook_vis: level2: "0"
1908-2005 ook_vis: level2: "a"
2005-2104 ook_vis: level2: "1"
2104-2202 ook_vis: level2: "1"
2202-2302 ook_vis: level2: "1"
2302-2396 ook_vis: level2: "c"
2396-2494 ook_vis: level2: "0"
2494-2595 ook_vis: level2: "f"
2595-2689 ook_vis: level2: "c"
2689-2788 ook_vis: level2: "7"
2788-2886 ook_vis: level2: "2"
