0-3760 graycode: phase: "0"
0-3760 graycode: count: "0"
3760-5318 graycode: phase: "1"
3760-5318 graycode: count: "1"
5318-6513 graycode: phase: "2"
5318-6513 graycode: count: "2"
6513-7520 graycode: phase: "3"
6513-7520 graycode: count: "3"
7520-8408 graycode: phase: "4"
7520-8408 graycode: count: "4"
8408-9210 graycode: phase: "5"
8408-9210 graycode: count: "5"
9210-9948 graycode: phase: "6"
9210-9948 graycode: count: "6"
9948-10635 graycode: phase: "7"
9948-10635 graycode: count: "7"
10635-11280 graycode: phase: "8"
10635-11280 graycode: count: "8"
11280-11890 graycode: phase: "9"
11280-11890 graycode: count: "9"
11890-12471 graycode: phase: "10"
11890-12471 graycode: count: "10"
12471-13025 graycode: phase: "11"
12471-13025 graycode: count: "11"
13025-13557 graycode: phase: "12"
13025-13557 graycode: count: "12"
13557-14069 graycode: phase: "13"
13557-14069 graycode: count: "13"
14069-14563 graycode: phase: "14"
14069-14563 graycode: count: "14"
14563-15040 graycode: phase: "15"
14563-15040 graycode: count: "15"
15040-15503 graycode: phase: "16"
15040-15503 graycode: count: "16"
15503-15953 graycode: phase: "17"
15503-15953 graycode: count: "17"
15953-16390 graycode: phase: "18"
15953-16390 graycode: count: "18"
16390-16815 graycode: phase: "19"
16390-16815 graycode: count: "19"
16815-17231 graycode: phase: "20"
16815-17231 graycode: count: "20"
17231-17636 graycode: phase: "21"
17231-17636 graycode: count: "21"
17636-18033 graycode: phase: "22"
17636-18033 graycode: count: "22"
18033-18420 graycode: phase: "23"
18033-18420 graycode: count: "23"
18420-18800 graycode: phase: "24"
18420-18800 graycode: count: "24"
18800-19173 graycode: phase: "25"
18800-19173 graycode: count: "25"
19173-19538 graycode: phase: "26"
19173-19538 graycode: count: "26"
19538-19896 graycode: phase: "27"
19538-19896 graycode: count: "27"
19896-20248 graycode: phase: "28"
19896-20248 graycode: count: "28"
20248-20595 graycode: phase: "29"
20248-20595 graycode: count: "29"
20595-20935 graycode: phase: "30"
20595-20935 graycode: count: "30"
20935-21270 graycode: phase: "31"
20935-21270 graycode: count: "31"
21270-21600 graycode: phase: "32"
21270-21600 graycode: count: "32"
21600-21925 graycode: phase: "33"
21600-21925 graycode: count: "33"
21925-22245 graycode: phase: "34"
21925-22245 graycode: count: "34"
22245-22560 graycode: phase: "35"
22245-22560 graycode: count: "35"
22560-22871 graycode: phase: "36"
22560-22871 graycode: count: "36"
22871-23178 graycode: phase: "37"
22871-23178 graycode: count: "37"
23178-23481 graycode: phase: "38"
23178-23481 graycode: count: "38"
23481-23780 graycode: phase: "39"
23481-23780 graycode: count: "39"
23780-24076 graycode: phase: "40"
23780-24076 graycode: count: "40"
24076-24368 graycode: phase: "41"
24076-24368 graycode: count: "41"
24368-24656 graycode: phase: "42"
24368-24656 graycode: count: "42"
24656-24941 graycode: phase: "43"
24656-24941 graycode: count: "43"
24941-25223 graycode: phase: "44"
24941-25223 graycode: count: "44"
25223-25502 graycode: phase: "45"
25223-25502 graycode: count: "45"
25502-25777 graycode: phase: "46"
25502-25777 graycode: count: "46"
25777-26050 graycode: phase: "47"
25777-26050 graycode: count: "47"
26050-26320 graycode: phase: "48"
26050-26320 graycode: count: "48"
26320-26587 graycode: phase: "49"
26320-26587 graycode: count: "49"
26587-26852 graycode: phase: "50"
26587-26852 graycode: count: "50"
26852-27114 graycode: phase: "51"
26852-27114 graycode: count: "51"
27114-27373 graycode: phase: "52"
27114-27373 graycode: count: "52"
27373-27630 graycode: phase: "53"
27373-27630 graycode: count: "53"
27630-27885 graycode: phase: "54"
27630-27885 graycode: count: "54"
27885-28137 graycode: phase: "55"
27885-28137 graycode: count: "55"
28137-28387 graycode: phase: "56"
28137-28387 graycode: count: "56"
28387-28635 graycode: phase: "57"
28387-28635 graycode: count: "57"
28635-28881 graycode: phase: "58"
28635-28881 graycode: count: "58"
28881-29125 graycode: phase: "59"
28881-29125 graycode: count: "59"
29125-29367 graycode: phase: "60"
29125-29367 graycode: count: "60"
29367-29606 graycode: phase: "61"
29367-29606 graycode: count: "61"
29606-29844 graycode: phase: "62"
29606-29844 graycode: count: "62"
29844-30080 graycode: phase: "63"
29844-30080 graycode: count: "63"
30080-30314 graycode: phase: "64"
30080-30314 graycode: count: "64"
30314-30546 graycode: phase: "65"
30314-30546 graycode: count: "65"
30546-30777 graycode: phase: "66"
30546-30777 graycode: count: "66"
30777-31006 graycode: phase: "67"
30777-31006 graycode: count: "67"
31006-31233 graycode: phase: "68"
31006-31233 graycode: count: "68"
31233-31458 graycode: phase: "69"
31233-31458 graycode: count: "69"
31458-31682 graycode: phase: "70"
31458-31682 graycode: count: "70"
31682-31905 graycode: phase: "71"
31682-31905 graycode: count: "71"
31905-32125 graycode: phase: "72"
31905-32125 graycode: count: "72"
32125-32345 graycode: phase: "73"
32125-32345 graycode: count: "73"
32345-32563 graycode: phase: "74"
32345-32563 graycode: count: "74"
32563-32779 graycode: phase: "75"
32563-32779 graycode: count: "75"
32779-32994 graycode: phase: "76"
32779-32994 graycode: count: "76"
32994-33207 graycode: phase: "77"
32994-33207 graycode: count: "77"
33207-33420 graycode: phase: "78"
33207-33420 graycode: count: "78"
33420-33630 graycode: phase: "79"
33420-33630 graycode: count: "79"
33630-33840 graycode: phase: "80"
33630-33840 graycode: count: "80"
33840-34048 graycode: phase: "81"
33840-34048 graycode: count: "81"
34048-34255 graycode: phase: "82"
34048-34255 graycode: count: "82"
34255-34461 graycode: phase: "83"
34255-34461 graycode: count: "83"
34461-34665 graycode: phase: "84"
34461-34665 graycode: count: "84"
34665-34869 graycode: phase: "85"
34665-34869 graycode: count: "85"
34869-35071 graycode: phase: "86"
34869-35071 graycode: count: "86"
35071-35272 graycode: phase: "87"
35071-35272 graycode: count: "87"
35272-35472 graycode: phase: "88"
35272-35472 graycode: count: "88"
35472-35670 graycode: phase: "89"
35472-35670 graycode: count: "89"
35670-35868 graycode: phase: "90"
35670-35868 graycode: count: "90"
35868-36065 graycode: phase: "91"
35868-36065 graycode: count: "91"
36065-36260 graycode: phase: "92"
36065-36260 graycode: count: "92"
36260-36454 graycode: phase: "93"
36260-36454 graycode: count: "93"
36454-36648 graycode: phase: "94"
36454-36648 graycode: count: "94"
36648-36840 graycode: phase: "95"
36648-36840 graycode: count: "95"
36840-37032 graycode: phase: "96"
36840-37032 graycode: count: "96"
37032-37222 graycode: phase: "97"
37032-37222 graycode: count: "97"
37222-37411 graycode: phase: "98"
37222-37411 graycode: count: "98"
37411-37600 graycode: phase: "99"
37411-37600 graycode: count: "99"
37600-37787 graycode: phase: "100"
37600-37787 graycode: count: "100"
37787-37974 graycode: phase: "101"
37787-37974 graycode: count: "101"
37974-38160 graycode: phase: "102"
37974-38160 graycode: count: "102"
38160-38345 graycode: phase: "103"
38160-38345 graycode: count: "103"
38345-38528 graycode: phase: "104"
38345-38528 graycode: count: "104"
38528-38711 graycode: phase: "105"
38528-38711 graycode: count: "105"
38711-38894 graycode: phase: "106"
38711-38894 graycode: count: "106"
38894-39075 graycode: phase: "107"
38894-39075 graycode: count: "107"
39075-39255 graycode: phase: "108"
39075-39255 graycode: count: "108"
39255-39435 graycode: phase: "109"
39255-39435 graycode: count: "109"
39435-39614 graycode: phase: "110"
39435-39614 graycode: count: "110"
39614-39792 graycode: phase: "111"
39614-39792 graycode: count: "111"
39792-39969 graycode: phase: "112"
39792-39969 graycode: count: "112"
39969-40146 graycode: phase: "113"
39969-40146 graycode: count: "113"
40146-40321 graycode: phase: "114"
40146-40321 graycode: count: "114"
40321-40496 graycode: phase: "115"
40321-40496 graycode: count: "115"
40496-40670 graycode: phase: "116"
40496-40670 graycode: count: "116"
40670-40844 graycode: phase: "117"
40670-40844 graycode: count: "117"
40844-41017 graycode: phase: "118"
40844-41017 graycode: count: "118"
41017-41189 graycode: phase: "119"
41017-41189 graycode: count: "119"
41189-41360 graycode: phase: "120"
41189-41360 graycode: count: "120"
41360-41530 graycode: phase: "121"
41360-41530 graycode: count: "121"
41530-41700 graycode: phase: "122"
41530-41700 graycode: count: "122"
41700-41869 graycode: phase: "123"
41700-41869 graycode: count: "123"
41869-42038 graycode: phase: "124"
41869-42038 graycode: count: "124"
42038-42206 graycode: phase: "125"
42038-42206 graycode: count: "125"
42206-42373 graycode: phase: "126"
42206-42373 graycode: count: "126"
42373-42539 graycode: phase: "127"
42373-42539 graycode: count: "127"
42539-42705 graycode: phase: "128"
42539-42705 graycode: count: "128"
42705-42870 graycode: phase: "129"
42705-42870 graycode: count: "129"
42870-43035 graycode: phase: "130"
42870-43035 graycode: count: "130"
43035-43199 graycode: phase: "131"
43035-43199 graycode: count: "131"
43199-43362 graycode: phase: "132"
43199-43362 graycode: count: "132"
43362-43525 graycode: phase: "133"
43362-43525 graycode: count: "133"
43525-43687 graycode: phase: "134"
43525-43687 graycode: count: "134"
43687-43849 graycode: phase: "135"
43687-43849 graycode: count: "135"
43849-44009 graycode: phase: "136"
43849-44009 graycode: count: "136"
44009-44170 graycode: phase: "137"
44009-44170 graycode: count: "137"
44170-44330 graycode: phase: "138"
44170-44330 graycode: count: "138"
44330-44489 graycode: phase: "139"
44330-44489 graycode: count: "139"
44489-44647 graycode: phase: "140"
44489-44647 graycode: count: "140"
44647-44805 graycode: phase: "141"
44647-44805 graycode: count: "141"
44805-44963 graycode: phase: "142"
44805-44963 graycode: count: "142"
44963-45120 graycode: phase: "143"
44963-45120 graycode: count: "143"
45120-45276 graycode: phase: "144"
45120-45276 graycode: count: "144"
45276-45432 graycode: phase: "145"
45276-45432 graycode: count: "145"
45432-45587 graycode: phase: "146"
45432-45587 graycode: count: "146"
45587-45742 graycode: phase: "147"
45587-45742 graycode: count: "147"
45742-45896 graycode: phase: "148"
45742-45896 graycode: count: "148"
45896-46050 graycode: phase: "149"
45896-46050 graycode: count: "149"
46050-46203 graycode: phase: "150"
46050-46203 graycode: count: "150"
46203-46356 graycode: phase: "151"
46203-46356 graycode: count: "151"
46356-46508 graycode: phase: "152"
46356-46508 graycode: count: "152"
46508-46660 graycode: phase: "153"
46508-46660 graycode: count: "153"
46660-46811 graycode: phase: "154"
46660-46811 graycode: count: "154"
46811-46962 graycode: phase: "155"
46811-46962 graycode: count: "155"
46962-47112 graycode: phase: "156"
46962-47112 graycode: count: "156"
47112-47262 graycode: phase: "157"
47112-47262 graycode: count: "157"
47262-47412 graycode: phase: "158"
47262-47412 graycode: count: "158"
47412-47560 graycode: phase: "159"
47412-47560 graycode: count: "159"
47560-47709 graycode: phase: "160"
47560-47709 graycode: count: "160"
47709-47857 graycode: phase: "161"
47709-47857 graycode: count: "161"
47857-48004 graycode: phase: "162"
47857-48004 graycode: count: "162"
48004-48151 graycode: phase: "163"
48004-48151 graycode: count: "163"
48151-48298 graycode: phase: "164"
48151-48298 graycode: count: "164"
48298-48444 graycode: phase: "165"
48298-48444 graycode: count: "165"
48444-48590 graycode: phase: "166"
48444-48590 graycode: count: "166"
48590-48735 graycode: phase: "167"
48590-48735 graycode: count: "167"
48735-48880 graycode: phase: "168"
48735-48880 graycode: count: "168"
48880-49024 graycode: phase: "169"
48880-49024 graycode: count: "169"
49024-49168 graycode: phase: "170"
49024-49168 graycode: count: "170"
49168-49312 graycode: phase: "171"
49168-49312 graycode: count: "171"
49312-49455 graycode: phase: "172"
49312-49455 graycode: count: "172"
49455-49598 graycode: phase: "173"
49455-49598 graycode: count: "173"
49598-49740 graycode: phase: "174"
49598-49740 graycode: count: "174"
49740-49882 graycode: phase: "175"
49740-49882 graycode: count: "175"
49882-50023 graycode: phase: "176"
49882-50023 graycode: count: "176"
50023-50164 graycode: phase: "177"
50023-50164 graycode: count: "177"
50164-50305 graycode: phase: "178"
50164-50305 graycode: count: "178"
50305-50445 graycode: phase: "179"
50305-50445 graycode: count: "179"
50445-50585 graycode: phase: "180"
50445-50585 graycode: count: "180"
50585-50725 graycode: phase: "181"
50585-50725 graycode: count: "181"
50725-50864 graycode: phase: "182"
50725-50864 graycode: count: "182"
50864-51003 graycode: phase: "183"
50864-51003 graycode: count: "183"
51003-51141 graycode: phase: "184"
51003-51141 graycode: count: "184"
51141-51279 graycode: phase: "185"
51141-51279 graycode: count: "185"
51279-51417 graycode: phase: "186"
51279-51417 graycode: count: "186"
51417-51554 graycode: phase: "187"
51417-51554 graycode: count: "187"
51554-51691 graycode: phase: "188"
51554-51691 graycode: count: "188"
51691-51828 graycode: phase: "189"
51691-51828 graycode: count: "189"
51828-51964 graycode: phase: "190"
51828-51964 graycode: count: "190"
51964-52100 graycode: phase: "191"
51964-52100 graycode: count: "191"
52100-52235 graycode: phase: "192"
52100-52235 graycode: count: "192"
52235-52370 graycode: phase: "193"
52235-52370 graycode: count: "193"
52370-52505 graycode: phase: "194"
52370-52505 graycode: count: "194"
52505-52640 graycode: phase: "195"
52505-52640 graycode: count: "195"
52640-52774 graycode: phase: "196"
52640-52774 graycode: count: "196"
52774-52908 graycode: phase: "197"
52774-52908 graycode: count: "197"
52908-53041 graycode: phase: "198"
52908-53041 graycode: count: "198"
53041-53174 graycode: phase: "199"
53041-53174 graycode: count: "199"
53174-53307 graycode: phase: "200"
53174-53307 graycode: count: "200"
53307-53439 graycode: phase: "201"
53307-53439 graycode: count: "201"
53439-53571 graycode: phase: "202"
53439-53571 graycode: count: "202"
53571-53703 graycode: phase: "203"
53571-53703 graycode: count: "203"
53703-53835 graycode: phase: "204"
53703-53835 graycode: count: "204"
53835-53966 graycode: phase: "205"
53835-53966 graycode: count: "205"
53966-54097 graycode: phase: "206"
53966-54097 graycode: count: "206"
54097-54227 graycode: phase: "207"
54097-54227 graycode: count: "207"
54227-54357 graycode: phase: "208"
54227-54357 graycode: count: "208"
54357-54487 graycode: phase: "209"
54357-54487 graycode: count: "209"
54487-54617 graycode: phase: "210"
54487-54617 graycode: count: "210"
54617-54746 graycode: phase: "211"
54617-54746 graycode: count: "211"
54746-54875 graycode: phase: "212"
54746-54875 graycode: count: "212"
54875-55004 graycode: phase: "213"
54875-55004 graycode: count: "213"
55004-55132 graycode: phase: "214"
55004-55132 graycode: count: "214"
55132-55260 graycode: phase: "215"
55132-55260 graycode: count: "215"
55260-55388 graycode: phase: "216"
55260-55388 graycode: count: "216"
55388-55515 graycode: phase: "217"
55388-55515 graycode: count: "217"
55515-55643 graycode: phase: "218"
55515-55643 graycode: count: "218"
55643-55769 graycode: phase: "219"
55643-55769 graycode: count: "219"
55769-55896 graycode: phase: "220"
55769-55896 graycode: count: "220"
55896-56022 graycode: phase: "221"
55896-56022 graycode: count: "221"
56022-56148 graycode: phase: "222"
56022-56148 graycode: count: "222"
56148-56274 graycode: phase: "223"
56148-56274 graycode: count: "223"
56274-56400 graycode: phase: "224"
56274-56400 graycode: count: "224"
56400-56525 graycode: phase: "225"
56400-56525 graycode: count: "225"
56525-56650 graycode: phase: "226"
56525-56650 graycode: count: "226"
56650-56774 graycode: phase: "227"
56650-56774 graycode: count: "227"
56774-56899 graycode: phase: "228"
56774-56899 graycode: count: "228"
56899-57023 graycode: phase: "229"
56899-57023 graycode: count: "229"
57023-57147 graycode: phase: "230"
57023-57147 graycode: count: "230"
57147-57270 graycode: phase: "231"
57147-57270 graycode: count: "231"
57270-57394 graycode: phase: "232"
57270-57394 graycode: count: "232"
57394-57517 graycode: phase: "233"
57394-57517 graycode: count: "233"
57517-57639 graycode: phase: "234"
57517-57639 graycode: count: "234"
57639-57762 graycode: phase: "235"
57639-57762 graycode: count: "235"
57762-57884 graycode: phase: "236"
57762-57884 graycode: count: "236"
57884-58006 graycode: phase: "237"
57884-58006 graycode: count: "237"
58006-58128 graycode: phase: "238"
58006-58128 graycode: count: "238"
58128-58249 graycode: phase: "239"
58128-58249 graycode: count: "239"
58249-58371 graycode: phase: "240"
58249-58371 graycode: count: "240"
58371-58491 graycode: phase: "241"
58371-58491 graycode: count: "241"
58491-58612 graycode: phase: "242"
58491-58612 graycode: count: "242"
58612-58733 graycode: phase: "243"
58612-58733 graycode: count: "243"
58733-58853 graycode: phase: "244"
58733-58853 graycode: count: "244"
58853-58973 graycode: phase: "245"
58853-58973 graycode: count: "245"
58973-59093 graycode: phase: "246"
58973-59093 graycode: count: "246"
59093-59212 graycode: phase: "247"
59093-59212 graycode: count: "247"
59212-59331 graycode: phase: "248"
59212-59331 graycode: count: "248"
59331-59450 graycode: phase: "249"
59331-59450 graycode: count: "249"
59450-59569 graycode: phase: "250"
59450-59569 graycode: count: "250"
59569-59688 graycode: phase: "251"
59569-59688 graycode: count: "251"
59688-59806 graycode: phase: "252"
59688-59806 graycode: count: "252"
59806-59924 graycode: phase: "253"
59806-59924 graycode: count: "253"
59924-60042 graycode: phase: "254"
59924-60042 graycode: count: "254"
60042-60160 graycode: phase: "255"
60042-60160 graycode: count: "255"
60160-60277 graycode: phase: "0"
60160-60277 graycode: count: "256"
60277-60394 graycode: phase: "1"
60277-60394 graycode: count: "257"
60394-60511 graycode: phase: "2"
60394-60511 graycode: count: "258"
60511-60628 graycode: phase: "3"
60511-60628 graycode: count: "259"
60628-60744 graycode: phase: "4"
60628-60744 graycode: count: "260"
60744-60860 graycode: phase: "5"
60744-60860 graycode: count: "261"
60860-60977 graycode: phase: "6"
60860-60977 graycode: count: "262"
60977-61092 graycode: phase: "7"
60977-61092 graycode: count: "263"
61092-61208 graycode: phase: "8"
61092-61208 graycode: count: "264"
61208-61323 graycode: phase: "9"
61208-61323 graycode: count: "265"
61323-61438 graycode: phase: "10"
61323-61438 graycode: count: "266"
61438-61553 graycode: phase: "11"
61438-61553 graycode: count: "267"
61553-61668 graycode: phase: "12"
61553-61668 graycode: count: "268"
61668-61783 graycode: phase: "13"
61668-61783 graycode: count: "269"
61783-61897 graycode: phase: "14"
61783-61897 graycode: count: "270"
61897-62011 graycode: phase: "15"
61897-62011 graycode: count: "271"
62011-62125 graycode: phase: "16"
62011-62125 graycode: count: "272"
62125-62239 graycode: phase: "17"
62125-62239 graycode: count: "273"
62239-62352 graycode: phase: "18"
62239-62352 graycode: count: "274"
62352-62465 graycode: phase: "19"
62352-62465 graycode: count: "275"
62465-62578 graycode: phase: "20"
62465-62578 graycode: count: "276"
62578-62691 graycode: phase: "21"
62578-62691 graycode: count: "277"
62691-62804 graycode: phase: "22"
62691-62804 graycode: count: "278"
62804-62916 graycode: phase: "23"
62804-62916 graycode: count: "279"
62916-63029 graycode: phase: "24"
62916-63029 graycode: count: "280"
63029-63141 graycode: phase: "25"
63029-63141 graycode: count: "281"
63141-63253 graycode: phase: "26"
63141-63253 graycode: count: "282"
63253-63364 graycode: phase: "27"
63253-63364 graycode: count: "283"
63364-63476 graycode: phase: "28"
63364-63476 graycode: count: "284"
63476-63587 graycode: phase: "29"
63476-63587 graycode: count: "285"
63587-63698 graycode: phase: "30"
63587-63698 graycode: count: "286"
63698-63809 graycode: phase: "31"
63698-63809 graycode: count: "287"
63809-63920 graycode: phase: "32"
63809-63920 graycode: count: "288"
63920-64030 graycode: phase: "33"
63920-64030 graycode: count: "289"
64030-64140 graycode: phase: "34"
64030-64140 graycode: count: "290"
64140-64250 graycode: phase: "35"
64140-64250 graycode: count: "291"
64250-64360 graycode: phase: "36"
64250-64360 graycode: count: "292"
64360-64470 graycode: phase: "37"
64360-64470 graycode: count: "293"
64470-64580 graycode: phase: "38"
64470-64580 graycode: count: "294"
64580-64689 graycode: phase: "39"
64580-64689 graycode: count: "295"
64689-64798 graycode: phase: "40"
64689-64798 graycode: count: "296"
64798-64907 graycode: phase: "41"
64798-64907 graycode: count: "297"
64907-65016 graycode: phase: "42"
64907-65016 graycode: count: "298"
65016-65125 graycode: phase: "43"
65016-65125 graycode: count: "299"
65125-65233 graycode: phase: "44"
65125-65233 graycode: count: "300"
65233-65341 graycode: phase: "45"
65233-65341 graycode: count: "301"
65341-65449 graycode: phase: "46"
65341-65449 graycode: count: "302"
65449-65557 graycode: phase: "47"
65449-65557 graycode: count: "303"
65557-65665 graycode: phase: "48"
65557-65665 graycode: count: "304"
65665-65773 graycode: phase: "49"
65665-65773 graycode: count: "305"
65773-65880 graycode: phase: "50"
65773-65880 graycode: count: "306"
65880-65987 graycode: phase: "51"
65880-65987 graycode: count: "307"
65987-66094 graycode: phase: "52"
65987-66094 graycode: count: "308"
66094-66201 graycode: phase: "53"
66094-66201 graycode: count: "309"
66201-66308 graycode: phase: "54"
66201-66308 graycode: count: "310"
66308-66414 graycode: phase: "55"
66308-66414 graycode: count: "311"
66414-66521 graycode: phase: "56"
66414-66521 graycode: count: "312"
66521-66627 graycode: phase: "57"
66521-66627 graycode: count: "313"
66627-66733 graycode: phase: "58"
66627-66733 graycode: count: "314"
66733-66839 graycode: phase: "59"
66733-66839 graycode: count: "315"
66839-66944 graycode: phase: "60"
66839-66944 graycode: count: "316"
66944-67050 graycode: phase: "61"
66944-67050 graycode: count: "317"
67050-67155 graycode: phase: "62"
67050-67155 graycode: count: "318"
67155-67260 graycode: phase: "63"
67155-67260 graycode: count: "319"
67260-67365 graycode: phase: "64"
67260-67365 graycode: count: "320"
67365-67470 graycode: phase: "65"
67365-67470 graycode: count: "321"
67470-67575 graycode: phase: "66"
67470-67575 graycode: count: "322"
67575-67679 graycode: phase: "67"
67575-67679 graycode: count: "323"
67679-67784 graycode: phase: "68"
67679-67784 graycode: count: "324"
67784-67888 graycode: phase: "69"
67784-67888 graycode: count: "325"
67888-67992 graycode: phase: "70"
67888-67992 graycode: count: "326"
67992-68096 graycode: phase: "71"
67992-68096 graycode: count: "327"
68096-68200 graycode: phase: "72"
68096-68200 graycode: count: "328"
68200-68303 graycode: phase: "73"
68200-68303 graycode: count: "329"
68303-68407 graycode: phase: "74"
68303-68407 graycode: count: "330"
68407-68510 graycode: phase: "75"
68407-68510 graycode: count: "331"
68510-68613 graycode: phase: "76"
68510-68613 graycode: count: "332"
68613-68716 graycode: phase: "77"
68613-68716 graycode: count: "333"
68716-68819 graycode: phase: "78"
68716-68819 graycode: count: "334"
68819-68921 graycode: phase: "79"
68819-68921 graycode: count: "335"
68921-69024 graycode: phase: "80"
68921-69024 graycode: count: "336"
69024-69126 graycode: phase: "81"
69024-69126 graycode: count: "337"
69126-69228 graycode: phase: "82"
69126-69228 graycode: count: "338"
69228-69330 graycode: phase: "83"
69228-69330 graycode: count: "339"
69330-69432 graycode: phase: "84"
69330-69432 graycode: count: "340"
69432-69534 graycode: phase: "85"
69432-69534 graycode: count: "341"
69534-69636 graycode: phase: "86"
69534-69636 graycode: count: "342"
69636-69737 graycode: phase: "87"
69636-69737 graycode: count: "343"
69737-69838 graycode: phase: "88"
69737-69838 graycode: count: "344"
69838-69939 graycode: phase: "89"
69838-69939 graycode: count: "345"
69939-70040 graycode: phase: "90"
69939-70040 graycode: count: "346"
70040-70141 graycode: phase: "91"
70040-70141 graycode: count: "347"
70141-70242 graycode: phase: "92"
70141-70242 graycode: count: "348"
70242-70343 graycode: phase: "93"
70242-70343 graycode: count: "349"
70343-70443 graycode: phase: "94"
70343-70443 graycode: count: "350"
70443-70543 graycode: phase: "95"
70443-70543 graycode: count: "351"
70543-70643 graycode: phase: "96"
70543-70643 graycode: count: "352"
70643-70743 graycode: phase: "97"
70643-70743 graycode: count: "353"
70743-70843 graycode: phase: "98"
70743-70843 graycode: count: "354"
70843-70943 graycode: phase: "99"
70843-70943 graycode: count: "355"
70943-71043 graycode: phase: "100"
70943-71043 graycode: count: "356"
71043-71142 graycode: phase: "101"
71043-71142 graycode: count: "357"
71142-71241 graycode: phase: "102"
71142-71241 graycode: count: "358"
71241-71340 graycode: phase: "103"
71241-71340 graycode: count: "359"
71340-71439 graycode: phase: "104"
71340-71439 graycode: count: "360"
71439-71538 graycode: phase: "105"
71439-71538 graycode: count: "361"
71538-71637 graycode: phase: "106"
71538-71637 graycode: count: "362"
71637-71736 graycode: phase: "107"
71637-71736 graycode: count: "363"
71736-71834 graycode: phase: "108"
71736-71834 graycode: count: "364"
71834-71932 graycode: phase: "109"
71834-71932 graycode: count: "365"
71932-72031 graycode: phase: "110"
71932-72031 graycode: count: "366"
72031-72129 graycode: phase: "111"
72031-72129 graycode: count: "367"
72129-72227 graycode: phase: "112"
72129-72227 graycode: count: "368"
72227-72324 graycode: phase: "113"
72227-72324 graycode: count: "369"
72324-72422 graycode: phase: "114"
72324-72422 graycode: count: "370"
72422-72520 graycode: phase: "115"
72422-72520 graycode: count: "371"
72520-72617 graycode: phase: "116"
72520-72617 graycode: count: "372"
72617-72714 graycode: phase: "117"
72617-72714 graycode: count: "373"
72714-72811 graycode: phase: "118"
72714-72811 graycode: count: "374"
72811-72908 graycode: phase: "119"
72811-72908 graycode: count: "375"
72908-73005 graycode: phase: "120"
72908-73005 graycode: count: "376"
73005-73102 graycode: phase: "121"
73005-73102 graycode: count: "377"
73102-73199 graycode: phase: "122"
73102-73199 graycode: count: "378"
73199-73295 graycode: phase: "123"
73199-73295 graycode: count: "379"
73295-73392 graycode: phase: "124"
73295-73392 graycode: count: "380"
73392-73488 graycode: phase: "125"
73392-73488 graycode: count: "381"
73488-73584 graycode: phase: "126"
73488-73584 graycode: count: "382"
73584-73680 graycode: phase: "127"
73584-73680 graycode: count: "383"
73680-73776 graycode: phase: "128"
73680-73776 graycode: count: "384"
73776-73872 graycode: phase: "129"
73776-73872 graycode: count: "385"
73872-73967 graycode: phase: "130"
73872-73967 graycode: count: "386"
73967-74063 graycode: phase: "131"
73967-74063 graycode: count: "387"
74063-74158 graycode: phase: "132"
74063-74158 graycode: count: "388"
74158-74253 graycode: phase: "133"
74158-74253 graycode: count: "389"
74253-74349 graycode: phase: "134"
74253-74349 graycode: count: "390"
74349-74444 graycode: phase: "135"
74349-74444 graycode: count: "391"
74444-74538 graycode: phase: "136"
74444-74538 graycode: count: "392"
74538-74633 graycode: phase: "137"
74538-74633 graycode: count: "393"
74633-74728 graycode: phase: "138"
74633-74728 graycode: count: "394"
74728-74822 graycode: phase: "139"
74728-74822 graycode: count: "395"
74822-74917 graycode: phase: "140"
74822-74917 graycode: count: "396"
74917-75011 graycode: phase: "141"
74917-75011 graycode: count: "397"
75011-75105 graycode: phase: "142"
75011-75105 graycode: count: "398"
75105-75199 graycode: phase: "143"
75105-75199 graycode: count: "399"
75199-75293 graycode: phase: "144"
75199-75293 graycode: count: "400"
75293-75387 graycode: phase: "145"
75293-75387 graycode: count: "401"
75387-75481 graycode: phase: "146"
75387-75481 graycode: count: "402"
75481-75574 graycode: phase: "147"
75481-75574 graycode: count: "403"
75574-75668 graycode: phase: "148"
75574-75668 graycode: count: "404"
75668-75761 graycode: phase: "149"
75668-75761 graycode: count: "405"
75761-75854 graycode: phase: "150"
75761-75854 graycode: count: "406"
75854-75948 graycode: phase: "151"
75854-75948 graycode: count: "407"
75948-76041 graycode: phase: "152"
75948-76041 graycode: count: "408"
76041-76134 graycode: phase: "153"
76041-76134 graycode: count: "409"
76134-76226 graycode: phase: "154"
76134-76226 graycode: count: "410"
76226-76319 graycode: phase: "155"
76226-76319 graycode: count: "411"
76319-76412 graycode: phase: "156"
76319-76412 graycode: count: "412"
76412-76504 graycode: phase: "157"
76412-76504 graycode: count: "413"
76504-76596 graycode: phase: "158"
76504-76596 graycode: count: "414"
76596-76689 graycode: phase: "159"
76596-76689 graycode: count: "415"
76689-76781 graycode: phase: "160"
76689-76781 graycode: count: "416"
76781-76873 graycode: phase: "161"
76781-76873 graycode: count: "417"
76873-76965 graycode: phase: "162"
76873-76965 graycode: count: "418"
76965-77056 graycode: phase: "163"
76965-77056 graycode: count: "419"
77056-77148 graycode: phase: "164"
77056-77148 graycode: count: "420"
77148-77240 graycode: phase: "165"
77148-77240 graycode: count: "421"
77240-77331 graycode: phase: "166"
77240-77331 graycode: count: "422"
77331-77422 graycode: phase: "167"
77331-77422 graycode: count: "423"
77422-77514 graycode: phase: "168"
77422-77514 graycode: count: "424"
77514-77605 graycode: phase: "169"
77514-77605 graycode: count: "425"
77605-77696 graycode: phase: "170"
77605-77696 graycode: count: "426"
77696-77787 graycode: phase: "171"
77696-77787 graycode: count: "427"
77787-77878 graycode: phase: "172"
77787-77878 graycode: count: "428"
77878-77968 graycode: phase: "173"
77878-77968 graycode: count: "429"
77968-78059 graycode: phase: "174"
77968-78059 graycode: count: "430"
78059-78149 graycode: phase: "175"
78059-78149 graycode: count: "431"
78149-78240 graycode: phase: "176"
78149-78240 graycode: count: "432"
78240-78330 graycode: phase: "177"
78240-78330 graycode: count: "433"
78330-78420 graycode: phase: "178"
78330-78420 graycode: count: "434"
78420-78510 graycode: phase: "179"
78420-78510 graycode: count: "435"
78510-78600 graycode: phase: "180"
78510-78600 graycode: count: "436"
78600-78690 graycode: phase: "181"
78600-78690 graycode: count: "437"
78690-78780 graycode: phase: "182"
78690-78780 graycode: count: "438"
78780-78870 graycode: phase: "183"
78780-78870 graycode: count: "439"
78870-78959 graycode: phase: "184"
78870-78959 graycode: count: "440"
78959-79049 graycode: phase: "185"
78959-79049 graycode: count: "441"
79049-79138 graycode: phase: "186"
79049-79138 graycode: count: "442"
79138-79227 graycode: phase: "187"
79138-79227 graycode: count: "443"
79227-79317 graycode: phase: "188"
79227-79317 graycode: count: "444"
79317-79406 graycode: phase: "189"
79317-79406 graycode: count: "445"
79406-79495 graycode: phase: "190"
79406-79495 graycode: count: "446"
79495-79583 graycode: phase: "191"
79495-79583 graycode: count: "447"
79583-79672 graycode: phase: "192"
79583-79672 graycode: count: "448"
79672-79761 graycode: phase: "193"
79672-79761 graycode: count: "449"
79761-79849 graycode: phase: "194"
79761-79849 graycode: count: "450"
79849-79938 graycode: phase: "195"
79849-79938 graycode: count: "451"
79938-80026 graycode: phase: "196"
79938-80026 graycode: count: "452"
80026-80115 graycode: phase: "197"
80026-80115 graycode: count: "453"
80115-80203 graycode: phase: "198"
80115-80203 graycode: count: "454"
80203-80291 graycode: phase: "199"
80203-80291 graycode: count: "455"
80291-80379 graycode: phase: "200"
80291-80379 graycode: count: "456"
80379-80467 graycode: phase: "201"
80379-80467 graycode: count: "457"
80467-80555 graycode: phase: "202"
80467-80555 graycode: count: "458"
80555-80642 graycode: phase: "203"
80555-80642 graycode: count: "459"
80642-80730 graycode: phase: "204"
80642-80730 graycode: count: "460"
80730-80817 graycode: phase: "205"
80730-80817 graycode: count: "461"
80817-80905 graycode: phase: "206"
80817-80905 graycode: count: "462"
80905-80992 graycode: phase: "207"
80905-80992 graycode: count: "463"
80992-81079 graycode: phase: "208"
80992-81079 graycode: count: "464"
81079-81167 graycode: phase: "209"
81079-81167 graycode: count: "465"
81167-81254 graycode: phase: "210"
81167-81254 graycode: count: "466"
81254-81340 graycode: phase: "211"
81254-81340 graycode: count: "467"
81340-81427 graycode: phase: "212"
81340-81427 graycode: count: "468"
81427-81514 graycode: phase: "213"
81427-81514 graycode: count: "469"
81514-81601 graycode: phase: "214"
81514-81601 graycode: count: "470"
81601-81687 graycode: phase: "215"
81601-81687 graycode: count: "471"
81687-81774 graycode: phase: "216"
81687-81774 graycode: count: "472"
81774-81860 graycode: phase: "217"
81774-81860 graycode: count: "473"
81860-81947 graycode: phase: "218"
81860-81947 graycode: count: "474"
81947-82033 graycode: phase: "219"
81947-82033 graycode: count: "475"
82033-82119 graycode: phase: "220"
82033-82119 graycode: count: "476"
82119-82205 graycode: phase: "221"
82119-82205 graycode: count: "477"
82205-82291 graycode: phase: "222"
82205-82291 graycode: count: "478"
82291-82377 graycode: phase: "223"
82291-82377 graycode: count: "479"
82377-82462 graycode: phase: "224"
82377-82462 graycode: count: "480"
82462-82548 graycode: phase: "225"
82462-82548 graycode: count: "481"
82548-82634 graycode: phase: "226"
82548-82634 graycode: count: "482"
82634-82719 graycode: phase: "227"
82634-82719 graycode: count: "483"
82719-82805 graycode: phase: "228"
82719-82805 graycode: count: "484"
82805-82890 graycode: phase: "229"
82805-82890 graycode: count: "485"
82890-82975 graycode: phase: "230"
82890-82975 graycode: count: "486"
82975-83060 graycode: phase: "231"
82975-83060 graycode: count: "487"
83060-83145 graycode: phase: "232"
83060-83145 graycode: count: "488"
83145-83230 graycode: phase: "233"
83145-83230 graycode: count: "489"
83230-83315 graycode: phase: "234"
83230-83315 graycode: count: "490"
83315-83400 graycode: phase: "235"
83315-83400 graycode: count: "491"
83400-83485 graycode: phase: "236"
83400-83485 graycode: count: "492"
83485-83569 graycode: phase: "237"
83485-83569 graycode: count: "493"
83569-83654 graycode: phase: "238"
83569-83654 graycode: count: "494"
83654-83738 graycode: phase: "239"
83654-83738 graycode: count: "495"
83738-83823 graycode: phase: "240"
83738-83823 graycode: count: "496"
83823-83907 graycode: phase: "241"
83823-83907 graycode: count: "497"
83907-83991 graycode: phase: "242"
83907-83991 graycode: count: "498"
83991-84075 graycode: phase: "243"
83991-84075 graycode: count: "499"
