0-627 graycode: phase: "3"
0-627 graycode: count: "0"
0-627 graycode: interval: "627 µs, 1.59 kHz"
0-627 graycode: average: "627 µs, 1.59 kHz"
627-1880 graycode: phase: "0"
627-1880 graycode: count: "1"
627-1880 graycode: interval: "1.25 ms, 798 Hz"
627-1880 graycode: average: "940 µs, 1.06 kHz"
1880-3134 graycode: phase: "1"
1880-3134 graycode: count: "2"
1880-3134 graycode: interval: "1.25 ms, 797 Hz"
1880-3134 graycode: average: "1.04 ms, 957 Hz"
3134-4387 graycode: phase: "2"
3134-4387 graycode: count: "3"
3134-4387 graycode: interval: "1.25 ms, 798 Hz"
3134-4387 graycode: average: "1.09 ms, 911 Hz"
4387-5641 graycode: phase: "3"
4387-5641 graycode: count: "4"
4387-5641 graycode: interval: "1.25 ms, 797 Hz"
4387-5641 graycode: average: "1.12 ms, 886 Hz"
5641-6895 graycode: phase: "0"
5641-6895 graycode: count: "5"
5641-6895 graycode: interval: "1.25 ms, 797 Hz"
5641-6895 graycode: average: "1.14 ms, 870 Hz"
6895-8150 graycode: phase: "1"
6895-8150 graycode: count: "6"
6895-8150 graycode: interval: "1.25 ms, 796 Hz"
6895-8150 graycode: average: "1.16 ms, 858 Hz"
8150-9405 graycode: phase: "2"
8150-9405 graycode: count: "7"
8150-9405 graycode: interval: "1.25 ms, 796 Hz"
8150-9405 graycode: average: "1.17 ms, 850 Hz"
9405-10661 graycode: phase: "3"
9405-10661 graycode: count: "8"
9405-10661 graycode: interval: "1.25 ms, 796 Hz"
9405-10661 graycode: average: "1.18 ms, 844 Hz"
10661-11917 graycode: phase: "0"
10661-11917 graycode: count: "9"
10661-11917 graycode: interval: "1.25 ms, 796 Hz"
10661-11917 graycode: average: "1.19 ms, 839 Hz"
11917-13174 graycode: phase: "1"
11917-13174 graycode: count: "10"
11917-13174 graycode: interval: "1.25 ms, 795 Hz"
11917-13174 graycode: average: "1.25 ms, 797 Hz"
13174-14432 graycode: phase: "2"
13174-14432 graycode: count: "11"
13174-14432 graycode: interval: "1.25 ms, 794 Hz"
13174-14432 graycode: average: "1.25 ms, 796 Hz"
14432-15691 graycode: phase: "3"
14432-15691 graycode: count: "12"
14432-15691 graycode: interval: "1.25 ms, 794 Hz"
14432-15691 graycode: average: "1.25 ms, 796 Hz"
15691-16951 graycode: phase: "0"
15691-16951 graycode: count: "13"
15691-16951 graycode: interval: "1.26 ms, 793 Hz"
15691-16951 graycode: average: "1.25 ms, 795 Hz"
16951-18211 graycode: phase: "1"
16951-18211 graycode: count: "14"
16951-18211 graycode: interval: "1.26 ms, 793 Hz"
16951-18211 graycode: average: "1.25 ms, 795 Hz"
18211-19473 graycode: phase: "2"
18211-19473 graycode: count: "15"
18211-19473 graycode: interval: "1.26 ms, 792 Hz"
18211-19473 graycode: average: "1.25 ms, 795 Hz"
19473-20737 graycode: phase: "3"
19473-20737 graycode: count: "16"
19473-20737 graycode: interval: "1.26 ms, 791 Hz"
19473-20737 graycode: average: "1.25 ms, 794 Hz"
20737-22001 graycode: phase: "0"
20737-22001 graycode: count: "17"
20737-22001 graycode: interval: "1.26 ms, 791 Hz"
20737-22001 graycode: average: "1.25 ms, 793 Hz"
22001-23267 graycode: phase: "1"
22001-23267 graycode: count: "18"
22001-23267 graycode: interval: "1.26 ms, 789 Hz"
22001-23267 graycode: average: "1.26 ms, 793 Hz"
23267-24535 graycode: phase: "2"
23267-24535 graycode: count: "19"
23267-24535 graycode: interval: "1.26 ms, 788 Hz"
23267-24535 graycode: average: "1.26 ms, 792 Hz"
24535-25804 graycode: phase: "3"
24535-25804 graycode: count: "20"
24535-25804 graycode: interval: "1.26 ms, 788 Hz"
24535-25804 graycode: average: "1.26 ms, 791 Hz"
25804-27074 graycode: phase: "0"
25804-27074 graycode: count: "21"
25804-27074 graycode: interval: "1.27 ms, 787 Hz"
25804-27074 graycode: average: "1.26 ms, 791 Hz"
27074-28347 graycode: phase: "1"
27074-28347 graycode: count: "22"
27074-28347 graycode: interval: "1.27 ms, 785 Hz"
27074-28347 graycode: average: "1.26 ms, 790 Hz"
28347-29621 graycode: phase: "2"
28347-29621 graycode: count: "23"
28347-29621 graycode: interval: "1.27 ms, 784 Hz"
28347-29621 graycode: average: "1.26 ms, 789 Hz"
29621-30897 graycode: phase: "3"
29621-30897 graycode: count: "24"
29621-30897 graycode: interval: "1.27 ms, 783 Hz"
29621-30897 graycode: average: "1.26 ms, 788 Hz"
30897-32176 graycode: phase: "0"
30897-32176 graycode: count: "25"
30897-32176 graycode: interval: "1.27 ms, 781 Hz"
30897-32176 graycode: average: "1.27 ms, 787 Hz"
32176-33456 graycode: phase: "1"
32176-33456 graycode: count: "26"
32176-33456 graycode: interval: "1.28 ms, 781 Hz"
32176-33456 graycode: average: "1.27 ms, 786 Hz"
33456-34738 graycode: phase: "2"
33456-34738 graycode: count: "27"
33456-34738 graycode: interval: "1.28 ms, 780 Hz"
33456-34738 graycode: average: "1.27 ms, 785 Hz"
34738-36023 graycode: phase: "3"
34738-36023 graycode: count: "28"
34738-36023 graycode: interval: "1.28 ms, 778 Hz"
34738-36023 graycode: average: "1.27 ms, 783 Hz"
36023-37310 graycode: phase: "0"
36023-37310 graycode: count: "29"
36023-37310 graycode: interval: "1.28 ms, 777 Hz"
36023-37310 graycode: average: "1.27 ms, 782 Hz"
37310-38600 graycode: phase: "1"
37310-38600 graycode: count: "30"
37310-38600 graycode: interval: "1.29 ms, 775 Hz"
37310-38600 graycode: average: "1.27 ms, 781 Hz"
38600-39892 graycode: phase: "2"
38600-39892 graycode: count: "31"
38600-39892 graycode: interval: "1.29 ms, 773 Hz"
38600-39892 graycode: average: "1.28 ms, 780 Hz"
39892-41187 graycode: phase: "3"
39892-41187 graycode: count: "32"
39892-41187 graycode: interval: "1.29 ms, 772 Hz"
39892-41187 graycode: average: "1.28 ms, 778 Hz"
41187-42485 graycode: phase: "0"
41187-42485 graycode: count: "33"
41187-42485 graycode: interval: "1.29 ms, 770 Hz"
41187-42485 graycode: average: "1.28 ms, 777 Hz"
42485-43786 graycode: phase: "1"
42485-43786 graycode: count: "34"
42485-43786 graycode: interval: "1.30 ms, 768 Hz"
42485-43786 graycode: average: "1.28 ms, 775 Hz"
43786-45089 graycode: phase: "2"
43786-45089 graycode: count: "35"
43786-45089 graycode: interval: "1.30 ms, 767 Hz"
43786-45089 graycode: average: "1.29 ms, 774 Hz"
45089-46396 graycode: phase: "3"
45089-46396 graycode: count: "36"
45089-46396 graycode: interval: "1.30 ms, 765 Hz"
45089-46396 graycode: average: "1.29 ms, 772 Hz"
46396-47706 graycode: phase: "0"
46396-47706 graycode: count: "37"
46396-47706 graycode: interval: "1.31 ms, 763 Hz"
46396-47706 graycode: average: "1.29 ms, 771 Hz"
47706-49020 graycode: phase: "1"
47706-49020 graycode: count: "38"
47706-49020 graycode: interval: "1.31 ms, 761 Hz"
47706-49020 graycode: average: "1.29 ms, 769 Hz"
49020-50336 graycode: phase: "2"
49020-50336 graycode: count: "39"
49020-50336 graycode: interval: "1.31 ms, 759 Hz"
49020-50336 graycode: average: "1.30 ms, 767 Hz"
50336-51657 graycode: phase: "3"
50336-51657 graycode: count: "40"
50336-51657 graycode: interval: "1.32 ms, 757 Hz"
50336-51657 graycode: average: "1.30 ms, 765 Hz"
51657-52981 graycode: phase: "0"
51657-52981 graycode: count: "41"
51657-52981 graycode: interval: "1.32 ms, 755 Hz"
51657-52981 graycode: average: "1.30 ms, 764 Hz"
52981-54309 graycode: phase: "1"
52981-54309 graycode: count: "42"
52981-54309 graycode: interval: "1.32 ms, 753 Hz"
52981-54309 graycode: average: "1.31 ms, 762 Hz"
54309-55641 graycode: phase: "2"
54309-55641 graycode: count: "43"
54309-55641 graycode: interval: "1.33 ms, 750 Hz"
54309-55641 graycode: average: "1.31 ms, 760 Hz"
55641-56977 graycode: phase: "3"
55641-56977 graycode: count: "44"
55641-56977 graycode: interval: "1.33 ms, 748 Hz"
55641-56977 graycode: average: "1.31 ms, 758 Hz"
56977-58317 graycode: phase: "0"
56977-58317 graycode: count: "45"
56977-58317 graycode: interval: "1.34 ms, 746 Hz"
56977-58317 graycode: average: "1.32 ms, 755 Hz"
58317-59661 graycode: phase: "1"
58317-59661 graycode: count: "46"
58317-59661 graycode: interval: "1.34 ms, 744 Hz"
58317-59661 graycode: average: "1.32 ms, 753 Hz"
59661-61010 graycode: phase: "2"
59661-61010 graycode: count: "47"
59661-61010 graycode: interval: "1.34 ms, 741 Hz"
59661-61010 graycode: average: "1.33 ms, 751 Hz"
61010-62364 graycode: phase: "3"
61010-62364 graycode: count: "48"
61010-62364 graycode: interval: "1.35 ms, 738 Hz"
61010-62364 graycode: average: "1.33 ms, 749 Hz"
62364-63722 graycode: phase: "0"
62364-63722 graycode: count: "49"
62364-63722 graycode: interval: "1.35 ms, 736 Hz"
62364-63722 graycode: average: "1.33 ms, 747 Hz"
63722-65085 graycode: phase: "1"
63722-65085 graycode: count: "50"
63722-65085 graycode: interval: "1.36 ms, 733 Hz"
63722-65085 graycode: average: "1.34 ms, 744 Hz"
65085-66454 graycode: phase: "2"
65085-66454 graycode: count: "51"
65085-66454 graycode: interval: "1.36 ms, 730 Hz"
65085-66454 graycode: average: "1.34 ms, 742 Hz"
66454-67827 graycode: phase: "3"
66454-67827 graycode: count: "52"
66454-67827 graycode: interval: "1.37 ms, 728 Hz"
66454-67827 graycode: average: "1.35 ms, 739 Hz"
67827-69206 graycode: phase: "0"
67827-69206 graycode: count: "53"
67827-69206 graycode: interval: "1.37 ms, 725 Hz"
67827-69206 graycode: average: "1.35 ms, 737 Hz"
69206-70591 graycode: phase: "1"
69206-70591 graycode: count: "54"
69206-70591 graycode: interval: "1.38 ms, 722 Hz"
69206-70591 graycode: average: "1.36 ms, 734 Hz"
70591-71981 graycode: phase: "2"
70591-71981 graycode: count: "55"
70591-71981 graycode: interval: "1.39 ms, 719 Hz"
70591-71981 graycode: average: "1.36 ms, 731 Hz"
71981-73378 graycode: phase: "3"
71981-73378 graycode: count: "56"
71981-73378 graycode: interval: "1.39 ms, 715 Hz"
71981-73378 graycode: average: "1.37 ms, 729 Hz"
73378-74780 graycode: phase: "0"
73378-74780 graycode: count: "57"
73378-74780 graycode: interval: "1.40 ms, 713 Hz"
73378-74780 graycode: average: "1.37 ms, 726 Hz"
74780-76189 graycode: phase: "1"
74780-76189 graycode: count: "58"
74780-76189 graycode: interval: "1.40 ms, 709 Hz"
74780-76189 graycode: average: "1.38 ms, 723 Hz"
76189-77604 graycode: phase: "2"
76189-77604 graycode: count: "59"
76189-77604 graycode: interval: "1.41 ms, 706 Hz"
76189-77604 graycode: average: "1.38 ms, 720 Hz"
77604-79026 graycode: phase: "3"
77604-79026 graycode: count: "60"
77604-79026 graycode: interval: "1.42 ms, 703 Hz"
77604-79026 graycode: average: "1.39 ms, 717 Hz"
79026-80455 graycode: phase: "0"
79026-80455 graycode: count: "61"
79026-80455 graycode: interval: "1.42 ms, 699 Hz"
79026-80455 graycode: average: "1.40 ms, 714 Hz"
80455-81891 graycode: phase: "1"
80455-81891 graycode: count: "62"
80455-81891 graycode: interval: "1.43 ms, 696 Hz"
80455-81891 graycode: average: "1.40 ms, 711 Hz"
81891-83334 graycode: phase: "2"
81891-83334 graycode: count: "63"
81891-83334 graycode: interval: "1.44 ms, 693 Hz"
81891-83334 graycode: average: "1.41 ms, 707 Hz"
83334-84785 graycode: phase: "3"
83334-84785 graycode: count: "64"
83334-84785 graycode: interval: "1.45 ms, 689 Hz"
83334-84785 graycode: average: "1.41 ms, 704 Hz"
84785-86243 graycode: phase: "0"
84785-86243 graycode: count: "65"
84785-86243 graycode: interval: "1.45 ms, 685 Hz"
84785-86243 graycode: average: "1.42 ms, 701 Hz"
86243-87710 graycode: phase: "1"
86243-87710 graycode: count: "66"
86243-87710 graycode: interval: "1.46 ms, 681 Hz"
86243-87710 graycode: average: "1.43 ms, 697 Hz"
87710-89185 graycode: phase: "2"
87710-89185 graycode: count: "67"
87710-89185 graycode: interval: "1.47 ms, 677 Hz"
87710-89185 graycode: average: "1.44 ms, 694 Hz"
89185-90669 graycode: phase: "3"
89185-90669 graycode: count: "68"
89185-90669 graycode: interval: "1.48 ms, 673 Hz"
89185-90669 graycode: average: "1.44 ms, 690 Hz"
90669-92162 graycode: phase: "0"
90669-92162 graycode: count: "69"
90669-92162 graycode: interval: "1.49 ms, 669 Hz"
90669-92162 graycode: average: "1.45 ms, 686 Hz"
92162-93664 graycode: phase: "1"
92162-93664 graycode: count: "70"
92162-93664 graycode: interval: "1.50 ms, 665 Hz"
92162-93664 graycode: average: "1.46 ms, 683 Hz"
93664-95175 graycode: phase: "2"
93664-95175 graycode: count: "71"
93664-95175 graycode: interval: "1.51 ms, 661 Hz"
93664-95175 graycode: average: "1.47 ms, 679 Hz"
95175-96697 graycode: phase: "3"
95175-96697 graycode: count: "72"
95175-96697 graycode: interval: "1.52 ms, 657 Hz"
95175-96697 graycode: average: "1.48 ms, 675 Hz"
96697-98228 graycode: phase: "0"
96697-98228 graycode: count: "73"
96697-98228 graycode: interval: "1.53 ms, 653 Hz"
96697-98228 graycode: average: "1.48 ms, 671 Hz"
98228-99770 graycode: phase: "1"
98228-99770 graycode: count: "74"
98228-99770 graycode: interval: "1.54 ms, 648 Hz"
98228-99770 graycode: average: "1.49 ms, 667 Hz"
99770-101323 graycode: phase: "2"
99770-101323 graycode: count: "75"
99770-101323 graycode: interval: "1.55 ms, 643 Hz"
99770-101323 graycode: average: "1.50 ms, 663 Hz"
101323-102887 graycode: phase: "3"
101323-102887 graycode: count: "76"
101323-102887 graycode: interval: "1.56 ms, 639 Hz"
101323-102887 graycode: average: "1.51 ms, 658 Hz"
102887-104463 graycode: phase: "0"
102887-104463 graycode: count: "77"
102887-104463 graycode: interval: "1.57 ms, 634 Hz"
102887-104463 graycode: average: "1.52 ms, 654 Hz"
104463-106051 graycode: phase: "1"
104463-106051 graycode: count: "78"
104463-106051 graycode: interval: "1.58 ms, 629 Hz"
104463-106051 graycode: average: "1.53 ms, 650 Hz"
106051-107652 graycode: phase: "2"
106051-107652 graycode: count: "79"
106051-107652 graycode: interval: "1.60 ms, 624 Hz"
106051-107652 graycode: average: "1.54 ms, 645 Hz"
107652-109265 graycode: phase: "3"
107652-109265 graycode: count: "80"
107652-109265 graycode: interval: "1.61 ms, 619 Hz"
107652-109265 graycode: average: "1.56 ms, 640 Hz"
109265-110892 graycode: phase: "0"
109265-110892 graycode: count: "81"
109265-110892 graycode: interval: "1.62 ms, 614 Hz"
109265-110892 graycode: average: "1.57 ms, 636 Hz"
110892-112534 graycode: phase: "1"
110892-112534 graycode: count: "82"
110892-112534 graycode: interval: "1.64 ms, 609 Hz"
110892-112534 graycode: average: "1.58 ms, 631 Hz"
112534-114189 graycode: phase: "2"
112534-114189 graycode: count: "83"
112534-114189 graycode: interval: "1.65 ms, 604 Hz"
112534-114189 graycode: average: "1.59 ms, 626 Hz"
114189-115860 graycode: phase: "3"
114189-115860 graycode: count: "84"
114189-115860 graycode: interval: "1.67 ms, 598 Hz"
114189-115860 graycode: average: "1.60 ms, 621 Hz"
115860-117547 graycode: phase: "0"
115860-117547 graycode: count: "85"
115860-117547 graycode: interval: "1.68 ms, 592 Hz"
115860-117547 graycode: average: "1.62 ms, 616 Hz"
117547-119250 graycode: phase: "1"
117547-119250 graycode: count: "86"
117547-119250 graycode: interval: "1.70 ms, 587 Hz"
117547-119250 graycode: average: "1.63 ms, 611 Hz"
119250-120970 graycode: phase: "2"
119250-120970 graycode: count: "87"
119250-120970 graycode: interval: "1.72 ms, 581 Hz"
119250-120970 graycode: average: "1.65 ms, 605 Hz"
120970-122708 graycode: phase: "3"
120970-122708 graycode: count: "88"
120970-122708 graycode: interval: "1.73 ms, 575 Hz"
120970-122708 graycode: average: "1.66 ms, 600 Hz"
122708-124465 graycode: phase: "0"
122708-124465 graycode: count: "89"
122708-124465 graycode: interval: "1.75 ms, 569 Hz"
122708-124465 graycode: average: "1.68 ms, 594 Hz"
124465-126241 graycode: phase: "1"
124465-126241 graycode: count: "90"
124465-126241 graycode: interval: "1.77 ms, 563 Hz"
124465-126241 graycode: average: "1.69 ms, 589 Hz"
126241-128038 graycode: phase: "2"
126241-128038 graycode: count: "91"
126241-128038 graycode: interval: "1.79 ms, 556 Hz"
126241-128038 graycode: average: "1.71 ms, 583 Hz"
128038-129856 graycode: phase: "3"
128038-129856 graycode: count: "92"
128038-129856 graycode: interval: "1.81 ms, 550 Hz"
128038-129856 graycode: average: "1.73 ms, 577 Hz"
129856-131696 graycode: phase: "0"
129856-131696 graycode: count: "93"
129856-131696 graycode: interval: "1.84 ms, 543 Hz"
129856-131696 graycode: average: "1.75 ms, 571 Hz"
131696-133560 graycode: phase: "1"
131696-133560 graycode: count: "94"
131696-133560 graycode: interval: "1.86 ms, 536 Hz"
131696-133560 graycode: average: "1.77 ms, 564 Hz"
133560-135448 graycode: phase: "2"
133560-135448 graycode: count: "95"
133560-135448 graycode: interval: "1.88 ms, 529 Hz"
133560-135448 graycode: average: "1.79 ms, 558 Hz"
135448-137362 graycode: phase: "3"
135448-137362 graycode: count: "96"
135448-137362 graycode: interval: "1.91 ms, 522 Hz"
135448-137362 graycode: average: "1.81 ms, 552 Hz"
137362-139304 graycode: phase: "0"
137362-139304 graycode: count: "97"
137362-139304 graycode: interval: "1.94 ms, 514 Hz"
137362-139304 graycode: average: "1.83 ms, 545 Hz"
139304-141274 graycode: phase: "1"
139304-141274 graycode: count: "98"
139304-141274 graycode: interval: "1.97 ms, 507 Hz"
139304-141274 graycode: average: "1.85 ms, 538 Hz"
141274-143275 graycode: phase: "2"
141274-143275 graycode: count: "99"
141274-143275 graycode: interval: "2.00 ms, 499 Hz"
141274-143275 graycode: average: "1.88 ms, 531 Hz"
143275-145308 graycode: phase: "3"
143275-145308 graycode: count: "100"
143275-145308 graycode: interval: "2.03 ms, 491 Hz"
143275-145308 graycode: average: "1.90 ms, 524 Hz"
145308-147375 graycode: phase: "0"
145308-147375 graycode: count: "101"
145308-147375 graycode: interval: "2.06 ms, 483 Hz"
145308-147375 graycode: average: "1.93 ms, 517 Hz"
147375-149479 graycode: phase: "1"
147375-149479 graycode: count: "102"
147375-149479 graycode: interval: "2.10 ms, 475 Hz"
147375-149479 graycode: average: "1.96 ms, 509 Hz"
149479-151621 graycode: phase: "2"
149479-151621 graycode: count: "103"
149479-151621 graycode: interval: "2.14 ms, 466 Hz"
149479-151621 graycode: average: "1.99 ms, 501 Hz"
151621-153805 graycode: phase: "3"
151621-153805 graycode: count: "104"
151621-153805 graycode: interval: "2.18 ms, 457 Hz"
151621-153805 graycode: average: "2.02 ms, 493 Hz"
153805-156033 graycode: phase: "0"
153805-156033 graycode: count: "105"
153805-156033 graycode: interval: "2.22 ms, 448 Hz"
153805-156033 graycode: average: "2.05 ms, 485 Hz"
156033-158308 graycode: phase: "1"
156033-158308 graycode: count: "106"
156033-158308 graycode: interval: "2.27 ms, 439 Hz"
156033-158308 graycode: average: "2.09 ms, 477 Hz"
158308-160635 graycode: phase: "2"
158308-160635 graycode: count: "107"
158308-160635 graycode: interval: "2.32 ms, 429 Hz"
158308-160635 graycode: average: "2.13 ms, 468 Hz"
160635-163017 graycode: phase: "3"
160635-163017 graycode: count: "108"
160635-163017 graycode: interval: "2.38 ms, 419 Hz"
160635-163017 graycode: average: "2.17 ms, 459 Hz"
163017-165459 graycode: phase: "0"
163017-165459 graycode: count: "109"
163017-165459 graycode: interval: "2.44 ms, 409 Hz"
163017-165459 graycode: average: "2.21 ms, 450 Hz"
165459-167967 graycode: phase: "1"
165459-167967 graycode: count: "110"
165459-167967 graycode: interval: "2.50 ms, 398 Hz"
165459-167967 graycode: average: "2.26 ms, 441 Hz"
167967-170546 graycode: phase: "2"
167967-170546 graycode: count: "111"
167967-170546 graycode: interval: "2.57 ms, 387 Hz"
167967-170546 graycode: average: "2.31 ms, 431 Hz"
170546-173204 graycode: phase: "3"
170546-173204 graycode: count: "112"
170546-173204 graycode: interval: "2.65 ms, 376 Hz"
170546-173204 graycode: average: "2.37 ms, 421 Hz"
173204-175951 graycode: phase: "0"
173204-175951 graycode: count: "113"
173204-175951 graycode: interval: "2.74 ms, 364 Hz"
173204-175951 graycode: average: "2.43 ms, 411 Hz"
175951-178795 graycode: phase: "1"
175951-178795 graycode: count: "114"
175951-178795 graycode: interval: "2.84 ms, 351 Hz"
175951-178795 graycode: average: "2.49 ms, 400 Hz"
178795-181749 graycode: phase: "2"
178795-181749 graycode: count: "115"
178795-181749 graycode: interval: "2.95 ms, 338 Hz"
178795-181749 graycode: average: "2.57 ms, 388 Hz"
181749-184828 graycode: phase: "3"
181749-184828 graycode: count: "116"
181749-184828 graycode: interval: "3.07 ms, 324 Hz"
181749-184828 graycode: average: "2.65 ms, 377 Hz"
184828-188051 graycode: phase: "0"
184828-188051 graycode: count: "117"
184828-188051 graycode: interval: "3.22 ms, 310 Hz"
184828-188051 graycode: average: "2.74 ms, 364 Hz"
188051-191441 graycode: phase: "1"
188051-191441 graycode: count: "118"
188051-191441 graycode: interval: "3.39 ms, 294 Hz"
188051-191441 graycode: average: "2.84 ms, 351 Hz"
191441-195031 graycode: phase: "2"
191441-195031 graycode: count: "119"
191441-195031 graycode: interval: "3.59 ms, 278 Hz"
191441-195031 graycode: average: "2.95 ms, 338 Hz"
195031-198861 graycode: phase: "3"
195031-198861 graycode: count: "120"
195031-198861 graycode: interval: "3.83 ms, 261 Hz"
195031-198861 graycode: average: "3.08 ms, 323 Hz"
198861-202990 graycode: phase: "0"
198861-202990 graycode: count: "121"
198861-202990 graycode: interval: "4.12 ms, 242 Hz"
198861-202990 graycode: average: "3.24 ms, 308 Hz"
202990-207506 graycode: phase: "1"
202990-207506 graycode: count: "122"
202990-207506 graycode: interval: "4.51 ms, 221 Hz"
202990-207506 graycode: average: "3.43 ms, 291 Hz"
207506-212549 graycode: phase: "2"
207506-212549 graycode: count: "123"
207506-212549 graycode: interval: "5.04 ms, 198 Hz"
207506-212549 graycode: average: "3.65 ms, 273 Hz"
212549-218369 graycode: phase: "3"
212549-218369 graycode: count: "124"
212549-218369 graycode: interval: "5.82 ms, 171 Hz"
212549-218369 graycode: average: "3.95 ms, 252 Hz"
218369-225515 graycode: phase: "0"
218369-225515 graycode: count: "125"
218369-225515 graycode: interval: "7.14 ms, 139 Hz"
218369-225515 graycode: average: "4.37 ms, 228 Hz"
225515-235873 graycode: phase: "1"
225515-235873 graycode: count: "126"
225515-235873 graycode: interval: "10.3 ms, 96.5 Hz"
225515-235873 graycode: average: "5.10 ms, 195 Hz"
235873-264128 graycode: phase: "2"
627-264128 graycode: increment: "+1"
235873-264128 graycode: count: "127"
235873-264128 graycode: interval: "28.2 ms, 35.3 Hz"
235873-264128 graycode: average: "7.60 ms, 131 Hz"
264128-274486 graycode: phase: "1"
264128-274486 graycode: count: "126"
264128-274486 graycode: interval: "10.3 ms, 96.5 Hz"
264128-274486 graycode: average: "8.30 ms, 120 Hz"
274486-281632 graycode: phase: "0"
274486-281632 graycode: count: "125"
274486-281632 graycode: interval: "7.14 ms, 139 Hz"
274486-281632 graycode: average: "8.66 ms, 115 Hz"
281632-287452 graycode: phase: "3"
281632-287452 graycode: count: "124"
281632-287452 graycode: interval: "5.82 ms, 171 Hz"
281632-287452 graycode: average: "8.85 ms, 112 Hz"
287452-292495 graycode: phase: "2"
287452-292495 graycode: count: "123"
287452-292495 graycode: interval: "5.04 ms, 198 Hz"
287452-292495 graycode: average: "8.95 ms, 111 Hz"
292495-297011 graycode: phase: "1"
292495-297011 graycode: count: "122"
292495-297011 graycode: interval: "4.51 ms, 221 Hz"
292495-297011 graycode: average: "8.95 ms, 111 Hz"
297011-301140 graycode: phase: "0"
297011-301140 graycode: count: "121"
297011-301140 graycode: interval: "4.12 ms, 242 Hz"
297011-301140 graycode: average: "8.85 ms, 112 Hz"
301140-304970 graycode: phase: "3"
301140-304970 graycode: count: "120"
301140-304970 graycode: interval: "3.83 ms, 261 Hz"
301140-304970 graycode: average: "8.66 ms, 115 Hz"
304970-308560 graycode: phase: "2"
304970-308560 graycode: count: "119"
304970-308560 graycode: interval: "3.59 ms, 278 Hz"
304970-308560 graycode: average: "8.30 ms, 120 Hz"
308560-311950 graycode: phase: "1"
308560-311950 graycode: count: "118"
308560-311950 graycode: interval: "3.39 ms, 294 Hz"
308560-311950 graycode: average: "7.60 ms, 131 Hz"
311950-315173 graycode: phase: "0"
311950-315173 graycode: count: "117"
311950-315173 graycode: interval: "3.22 ms, 310 Hz"
311950-315173 graycode: average: "5.10 ms, 195 Hz"
315173-318252 graycode: phase: "3"
315173-318252 graycode: count: "116"
315173-318252 graycode: interval: "3.07 ms, 324 Hz"
315173-318252 graycode: average: "4.37 ms, 228 Hz"
318252-321206 graycode: phase: "2"
318252-321206 graycode: count: "115"
318252-321206 graycode: interval: "2.95 ms, 338 Hz"
318252-321206 graycode: average: "3.95 ms, 252 Hz"
321206-324050 graycode: phase: "1"
321206-324050 graycode: count: "114"
321206-324050 graycode: interval: "2.84 ms, 351 Hz"
321206-324050 graycode: average: "3.65 ms, 273 Hz"
324050-326797 graycode: phase: "0"
324050-326797 graycode: count: "113"
324050-326797 graycode: interval: "2.74 ms, 364 Hz"
324050-326797 graycode: average: "3.43 ms, 291 Hz"
326797-329455 graycode: phase: "3"
326797-329455 graycode: count: "112"
326797-329455 graycode: interval: "2.65 ms, 376 Hz"
326797-329455 graycode: average: "3.24 ms, 308 Hz"
329455-332034 graycode: phase: "2"
329455-332034 graycode: count: "111"
329455-332034 graycode: interval: "2.57 ms, 387 Hz"
329455-332034 graycode: average: "3.08 ms, 323 Hz"
332034-334542 graycode: phase: "1"
332034-334542 graycode: count: "110"
332034-334542 graycode: interval: "2.50 ms, 398 Hz"
332034-334542 graycode: average: "2.95 ms, 338 Hz"
334542-336984 graycode: phase: "0"
334542-336984 graycode: count: "109"
334542-336984 graycode: interval: "2.44 ms, 409 Hz"
334542-336984 graycode: average: "2.84 ms, 351 Hz"
336984-339366 graycode: phase: "3"
336984-339366 graycode: count: "108"
336984-339366 graycode: interval: "2.38 ms, 419 Hz"
336984-339366 graycode: average: "2.74 ms, 364 Hz"
339366-341693 graycode: phase: "2"
339366-341693 graycode: count: "107"
339366-341693 graycode: interval: "2.32 ms, 429 Hz"
339366-341693 graycode: average: "2.65 ms, 377 Hz"
341693-343968 graycode: phase: "1"
341693-343968 graycode: count: "106"
341693-343968 graycode: interval: "2.27 ms, 439 Hz"
341693-343968 graycode: average: "2.57 ms, 388 Hz"
343968-346196 graycode: phase: "0"
343968-346196 graycode: count: "105"
343968-346196 graycode: interval: "2.22 ms, 448 Hz"
343968-346196 graycode: average: "2.49 ms, 400 Hz"
346196-348380 graycode: phase: "3"
346196-348380 graycode: count: "104"
346196-348380 graycode: interval: "2.18 ms, 457 Hz"
346196-348380 graycode: average: "2.43 ms, 411 Hz"
348380-350522 graycode: phase: "2"
348380-350522 graycode: count: "103"
348380-350522 graycode: interval: "2.14 ms, 466 Hz"
348380-350522 graycode: average: "2.37 ms, 421 Hz"
350522-352626 graycode: phase: "1"
350522-352626 graycode: count: "102"
350522-352626 graycode: interval: "2.10 ms, 475 Hz"
350522-352626 graycode: average: "2.31 ms, 431 Hz"
352626-354693 graycode: phase: "0"
352626-354693 graycode: count: "101"
352626-354693 graycode: interval: "2.06 ms, 483 Hz"
352626-354693 graycode: average: "2.26 ms, 441 Hz"
354693-356726 graycode: phase: "3"
354693-356726 graycode: count: "100"
354693-356726 graycode: interval: "2.03 ms, 491 Hz"
354693-356726 graycode: average: "2.21 ms, 450 Hz"
356726-358727 graycode: phase: "2"
356726-358727 graycode: count: "99"
356726-358727 graycode: interval: "2.00 ms, 499 Hz"
356726-358727 graycode: average: "2.17 ms, 459 Hz"
358727-360697 graycode: phase: "1"
358727-360697 graycode: count: "98"
358727-360697 graycode: interval: "1.97 ms, 507 Hz"
358727-360697 graycode: average: "2.13 ms, 468 Hz"
360697-362639 graycode: phase: "0"
360697-362639 graycode: count: "97"
360697-362639 graycode: interval: "1.94 ms, 514 Hz"
360697-362639 graycode: average: "2.09 ms, 477 Hz"
362639-364553 graycode: phase: "3"
362639-364553 graycode: count: "96"
362639-364553 graycode: interval: "1.91 ms, 522 Hz"
362639-364553 graycode: average: "2.05 ms, 485 Hz"
364553-366441 graycode: phase: "2"
364553-366441 graycode: count: "95"
364553-366441 graycode: interval: "1.88 ms, 529 Hz"
364553-366441 graycode: average: "2.02 ms, 493 Hz"
366441-368305 graycode: phase: "1"
366441-368305 graycode: count: "94"
366441-368305 graycode: interval: "1.86 ms, 536 Hz"
366441-368305 graycode: average: "1.99 ms, 501 Hz"
368305-370145 graycode: phase: "0"
368305-370145 graycode: count: "93"
368305-370145 graycode: interval: "1.84 ms, 543 Hz"
368305-370145 graycode: average: "1.96 ms, 509 Hz"
370145-371963 graycode: phase: "3"
370145-371963 graycode: count: "92"
370145-371963 graycode: interval: "1.81 ms, 550 Hz"
370145-371963 graycode: average: "1.93 ms, 517 Hz"
371963-373760 graycode: phase: "2"
371963-373760 graycode: count: "91"
371963-373760 graycode: interval: "1.79 ms, 556 Hz"
371963-373760 graycode: average: "1.90 ms, 524 Hz"
373760-375536 graycode: phase: "1"
373760-375536 graycode: count: "90"
373760-375536 graycode: interval: "1.77 ms, 563 Hz"
373760-375536 graycode: average: "1.88 ms, 531 Hz"
375536-377293 graycode: phase: "0"
375536-377293 graycode: count: "89"
375536-377293 graycode: interval: "1.75 ms, 569 Hz"
375536-377293 graycode: average: "1.85 ms, 538 Hz"
377293-379031 graycode: phase: "3"
377293-379031 graycode: count: "88"
377293-379031 graycode: interval: "1.73 ms, 575 Hz"
377293-379031 graycode: average: "1.83 ms, 545 Hz"
379031-380751 graycode: phase: "2"
379031-380751 graycode: count: "87"
379031-380751 graycode: interval: "1.72 ms, 581 Hz"
379031-380751 graycode: average: "1.81 ms, 552 Hz"
380751-382454 graycode: phase: "1"
380751-382454 graycode: count: "86"
380751-382454 graycode: interval: "1.70 ms, 587 Hz"
380751-382454 graycode: average: "1.79 ms, 558 Hz"
382454-384141 graycode: phase: "0"
382454-384141 graycode: count: "85"
382454-384141 graycode: interval: "1.68 ms, 592 Hz"
382454-384141 graycode: average: "1.77 ms, 564 Hz"
384141-385812 graycode: phase: "3"
384141-385812 graycode: count: "84"
384141-385812 graycode: interval: "1.67 ms, 598 Hz"
384141-385812 graycode: average: "1.75 ms, 571 Hz"
385812-387467 graycode: phase: "2"
385812-387467 graycode: count: "83"
385812-387467 graycode: interval: "1.65 ms, 604 Hz"
385812-387467 graycode: average: "1.73 ms, 577 Hz"
387467-389109 graycode: phase: "1"
387467-389109 graycode: count: "82"
387467-389109 graycode: interval: "1.64 ms, 609 Hz"
387467-389109 graycode: average: "1.71 ms, 583 Hz"
389109-390736 graycode: phase: "0"
389109-390736 graycode: count: "81"
389109-390736 graycode: interval: "1.62 ms, 614 Hz"
389109-390736 graycode: average: "1.69 ms, 589 Hz"
390736-392349 graycode: phase: "3"
390736-392349 graycode: count: "80"
390736-392349 graycode: interval: "1.61 ms, 619 Hz"
390736-392349 graycode: average: "1.68 ms, 594 Hz"
392349-393950 graycode: phase: "2"
392349-393950 graycode: count: "79"
392349-393950 graycode: interval: "1.60 ms, 624 Hz"
392349-393950 graycode: average: "1.66 ms, 600 Hz"
393950-395538 graycode: phase: "1"
393950-395538 graycode: count: "78"
393950-395538 graycode: interval: "1.58 ms, 629 Hz"
393950-395538 graycode: average: "1.65 ms, 605 Hz"
395538-397114 graycode: phase: "0"
395538-397114 graycode: count: "77"
395538-397114 graycode: interval: "1.57 ms, 634 Hz"
395538-397114 graycode: average: "1.63 ms, 611 Hz"
397114-398678 graycode: phase: "3"
397114-398678 graycode: count: "76"
397114-398678 graycode: interval: "1.56 ms, 639 Hz"
397114-398678 graycode: average: "1.62 ms, 616 Hz"
398678-400231 graycode: phase: "2"
398678-400231 graycode: count: "75"
398678-400231 graycode: interval: "1.55 ms, 643 Hz"
398678-400231 graycode: average: "1.60 ms, 621 Hz"
400231-401773 graycode: phase: "1"
400231-401773 graycode: count: "74"
400231-401773 graycode: interval: "1.54 ms, 648 Hz"
400231-401773 graycode: average: "1.59 ms, 626 Hz"
401773-403304 graycode: phase: "0"
401773-403304 graycode: count: "73"
401773-403304 graycode: interval: "1.53 ms, 653 Hz"
401773-403304 graycode: average: "1.58 ms, 631 Hz"
403304-404826 graycode: phase: "3"
403304-404826 graycode: count: "72"
403304-404826 graycode: interval: "1.52 ms, 657 Hz"
403304-404826 graycode: average: "1.57 ms, 636 Hz"
404826-406337 graycode: phase: "2"
404826-406337 graycode: count: "71"
404826-406337 graycode: interval: "1.51 ms, 661 Hz"
404826-406337 graycode: average: "1.56 ms, 640 Hz"
406337-407839 graycode: phase: "1"
406337-407839 graycode: count: "70"
406337-407839 graycode: interval: "1.50 ms, 665 Hz"
406337-407839 graycode: average: "1.54 ms, 645 Hz"
407839-409332 graycode: phase: "0"
407839-409332 graycode: count: "69"
407839-409332 graycode: interval: "1.49 ms, 669 Hz"
407839-409332 graycode: average: "1.53 ms, 650 Hz"
409332-410816 graycode: phase: "3"
409332-410816 graycode: count: "68"
409332-410816 graycode: interval: "1.48 ms, 673 Hz"
409332-410816 graycode: average: "1.52 ms, 654 Hz"
410816-412291 graycode: phase: "2"
410816-412291 graycode: count: "67"
410816-412291 graycode: interval: "1.47 ms, 677 Hz"
410816-412291 graycode: average: "1.51 ms, 658 Hz"
412291-413758 graycode: phase: "1"
412291-413758 graycode: count: "66"
412291-413758 graycode: interval: "1.46 ms, 681 Hz"
412291-413758 graycode: average: "1.50 ms, 663 Hz"
413758-415216 graycode: phase: "0"
413758-415216 graycode: count: "65"
413758-415216 graycode: interval: "1.45 ms, 685 Hz"
413758-415216 graycode: average: "1.49 ms, 667 Hz"
415216-416667 graycode: phase: "3"
415216-416667 graycode: count: "64"
415216-416667 graycode: interval: "1.45 ms, 689 Hz"
415216-416667 graycode: average: "1.48 ms, 671 Hz"
416667-418110 graycode: phase: "2"
416667-418110 graycode: count: "63"
416667-418110 graycode: interval: "1.44 ms, 693 Hz"
416667-418110 graycode: average: "1.48 ms, 675 Hz"
418110-419546 graycode: phase: "1"
418110-419546 graycode: count: "62"
418110-419546 graycode: interval: "1.43 ms, 696 Hz"
418110-419546 graycode: average: "1.47 ms, 679 Hz"
419546-420975 graycode: phase: "0"
419546-420975 graycode: count: "61"
419546-420975 graycode: interval: "1.42 ms, 699 Hz"
419546-420975 graycode: average: "1.46 ms, 683 Hz"
420975-422397 graycode: phase: "3"
420975-422397 graycode: count: "60"
420975-422397 graycode: interval: "1.42 ms, 703 Hz"
420975-422397 graycode: average: "1.45 ms, 686 Hz"
422397-423812 graycode: phase: "2"
422397-423812 graycode: count: "59"
422397-423812 graycode: interval: "1.41 ms, 706 Hz"
422397-423812 graycode: average: "1.44 ms, 690 Hz"
423812-425221 graycode: phase: "1"
423812-425221 graycode: count: "58"
423812-425221 graycode: interval: "1.40 ms, 709 Hz"
423812-425221 graycode: average: "1.44 ms, 694 Hz"
425221-426623 graycode: phase: "0"
425221-426623 graycode: count: "57"
425221-426623 graycode: interval: "1.40 ms, 713 Hz"
425221-426623 graycode: average: "1.43 ms, 697 Hz"
426623-428020 graycode: phase: "3"
426623-428020 graycode: count: "56"
426623-428020 graycode: interval: "1.39 ms, 715 Hz"
426623-428020 graycode: average: "1.42 ms, 701 Hz"
428020-429410 graycode: phase: "2"
428020-429410 graycode: count: "55"
428020-429410 graycode: interval: "1.39 ms, 719 Hz"
428020-429410 graycode: average: "1.41 ms, 704 Hz"
429410-430795 graycode: phase: "1"
429410-430795 graycode: count: "54"
429410-430795 graycode: interval: "1.38 ms, 722 Hz"
429410-430795 graycode: average: "1.41 ms, 707 Hz"
430795-432174 graycode: phase: "0"
430795-432174 graycode: count: "53"
430795-432174 graycode: interval: "1.37 ms, 725 Hz"
430795-432174 graycode: average: "1.40 ms, 711 Hz"
432174-433547 graycode: phase: "3"
432174-433547 graycode: count: "52"
432174-433547 graycode: interval: "1.37 ms, 728 Hz"
432174-433547 graycode: average: "1.40 ms, 714 Hz"
433547-434916 graycode: phase: "2"
433547-434916 graycode: count: "51"
433547-434916 graycode: interval: "1.36 ms, 730 Hz"
433547-434916 graycode: average: "1.39 ms, 717 Hz"
434916-436279 graycode: phase: "1"
434916-436279 graycode: count: "50"
434916-436279 graycode: interval: "1.36 ms, 733 Hz"
434916-436279 graycode: average: "1.38 ms, 720 Hz"
436279-437637 graycode: phase: "0"
436279-437637 graycode: count: "49"
436279-437637 graycode: interval: "1.35 ms, 736 Hz"
436279-437637 graycode: average: "1.38 ms, 723 Hz"
437637-438991 graycode: phase: "3"
437637-438991 graycode: count: "48"
437637-438991 graycode: interval: "1.35 ms, 738 Hz"
437637-438991 graycode: average: "1.37 ms, 726 Hz"
438991-440340 graycode: phase: "2"
438991-440340 graycode: count: "47"
438991-440340 graycode: interval: "1.34 ms, 741 Hz"
438991-440340 graycode: average: "1.37 ms, 729 Hz"
440340-441684 graycode: phase: "1"
440340-441684 graycode: count: "46"
440340-441684 graycode: interval: "1.34 ms, 744 Hz"
440340-441684 graycode: average: "1.36 ms, 731 Hz"
441684-443024 graycode: phase: "0"
441684-443024 graycode: count: "45"
441684-443024 graycode: interval: "1.34 ms, 746 Hz"
441684-443024 graycode: average: "1.36 ms, 734 Hz"
443024-444360 graycode: phase: "3"
443024-444360 graycode: count: "44"
443024-444360 graycode: interval: "1.33 ms, 748 Hz"
443024-444360 graycode: average: "1.35 ms, 737 Hz"
444360-445692 graycode: phase: "2"
444360-445692 graycode: count: "43"
444360-445692 graycode: interval: "1.33 ms, 750 Hz"
444360-445692 graycode: average: "1.35 ms, 739 Hz"
445692-447020 graycode: phase: "1"
445692-447020 graycode: count: "42"
445692-447020 graycode: interval: "1.32 ms, 753 Hz"
445692-447020 graycode: average: "1.34 ms, 742 Hz"
447020-448344 graycode: phase: "0"
447020-448344 graycode: count: "41"
447020-448344 graycode: interval: "1.32 ms, 755 Hz"
447020-448344 graycode: average: "1.34 ms, 744 Hz"
448344-449665 graycode: phase: "3"
448344-449665 graycode: count: "40"
448344-449665 graycode: interval: "1.32 ms, 757 Hz"
448344-449665 graycode: average: "1.33 ms, 747 Hz"
449665-450981 graycode: phase: "2"
449665-450981 graycode: count: "39"
449665-450981 graycode: interval: "1.31 ms, 759 Hz"
449665-450981 graycode: average: "1.33 ms, 749 Hz"
450981-452295 graycode: phase: "1"
450981-452295 graycode: count: "38"
450981-452295 graycode: interval: "1.31 ms, 761 Hz"
450981-452295 graycode: average: "1.33 ms, 751 Hz"
452295-453605 graycode: phase: "0"
452295-453605 graycode: count: "37"
452295-453605 graycode: interval: "1.31 ms, 763 Hz"
452295-453605 graycode: average: "1.32 ms, 753 Hz"
453605-454912 graycode: phase: "3"
453605-454912 graycode: count: "36"
453605-454912 graycode: interval: "1.30 ms, 765 Hz"
453605-454912 graycode: average: "1.32 ms, 755 Hz"
454912-456215 graycode: phase: "2"
454912-456215 graycode: count: "35"
454912-456215 graycode: interval: "1.30 ms, 767 Hz"
454912-456215 graycode: average: "1.31 ms, 758 Hz"
456215-457516 graycode: phase: "1"
456215-457516 graycode: count: "34"
456215-457516 graycode: interval: "1.30 ms, 768 Hz"
456215-457516 graycode: average: "1.31 ms, 760 Hz"
457516-458814 graycode: phase: "0"
457516-458814 graycode: count: "33"
457516-458814 graycode: interval: "1.29 ms, 770 Hz"
457516-458814 graycode: average: "1.31 ms, 762 Hz"
458814-460109 graycode: phase: "3"
458814-460109 graycode: count: "32"
458814-460109 graycode: interval: "1.29 ms, 772 Hz"
458814-460109 graycode: average: "1.30 ms, 764 Hz"
460109-461401 graycode: phase: "2"
460109-461401 graycode: count: "31"
460109-461401 graycode: interval: "1.29 ms, 773 Hz"
460109-461401 graycode: average: "1.30 ms, 765 Hz"
461401-462691 graycode: phase: "1"
461401-462691 graycode: count: "30"
461401-462691 graycode: interval: "1.29 ms, 775 Hz"
461401-462691 graycode: average: "1.30 ms, 767 Hz"
462691-463978 graycode: phase: "0"
462691-463978 graycode: count: "29"
462691-463978 graycode: interval: "1.28 ms, 777 Hz"
462691-463978 graycode: average: "1.29 ms, 769 Hz"
463978-465263 graycode: phase: "3"
463978-465263 graycode: count: "28"
463978-465263 graycode: interval: "1.28 ms, 778 Hz"
463978-465263 graycode: average: "1.29 ms, 771 Hz"
465263-466545 graycode: phase: "2"
465263-466545 graycode: count: "27"
465263-466545 graycode: interval: "1.28 ms, 780 Hz"
465263-466545 graycode: average: "1.29 ms, 772 Hz"
466545-467825 graycode: phase: "1"
466545-467825 graycode: count: "26"
466545-467825 graycode: interval: "1.28 ms, 781 Hz"
466545-467825 graycode: average: "1.29 ms, 774 Hz"
467825-469104 graycode: phase: "0"
467825-469104 graycode: count: "25"
467825-469104 graycode: interval: "1.27 ms, 781 Hz"
467825-469104 graycode: average: "1.28 ms, 775 Hz"
469104-470380 graycode: phase: "3"
469104-470380 graycode: count: "24"
469104-470380 graycode: interval: "1.27 ms, 783 Hz"
469104-470380 graycode: average: "1.28 ms, 777 Hz"
470380-471654 graycode: phase: "2"
470380-471654 graycode: count: "23"
470380-471654 graycode: interval: "1.27 ms, 784 Hz"
470380-471654 graycode: average: "1.28 ms, 778 Hz"
471654-472927 graycode: phase: "1"
471654-472927 graycode: count: "22"
471654-472927 graycode: interval: "1.27 ms, 785 Hz"
471654-472927 graycode: average: "1.28 ms, 780 Hz"
472927-474197 graycode: phase: "0"
472927-474197 graycode: count: "21"
472927-474197 graycode: interval: "1.27 ms, 787 Hz"
472927-474197 graycode: average: "1.27 ms, 781 Hz"
474197-475466 graycode: phase: "3"
474197-475466 graycode: count: "20"
474197-475466 graycode: interval: "1.26 ms, 788 Hz"
474197-475466 graycode: average: "1.27 ms, 782 Hz"
475466-476734 graycode: phase: "2"
475466-476734 graycode: count: "19"
475466-476734 graycode: interval: "1.26 ms, 788 Hz"
475466-476734 graycode: average: "1.27 ms, 783 Hz"
476734-478000 graycode: phase: "1"
476734-478000 graycode: count: "18"
476734-478000 graycode: interval: "1.26 ms, 789 Hz"
476734-478000 graycode: average: "1.27 ms, 785 Hz"
478000-479264 graycode: phase: "0"
478000-479264 graycode: count: "17"
478000-479264 graycode: interval: "1.26 ms, 791 Hz"
478000-479264 graycode: average: "1.27 ms, 786 Hz"
479264-480528 graycode: phase: "3"
479264-480528 graycode: count: "16"
479264-480528 graycode: interval: "1.26 ms, 791 Hz"
479264-480528 graycode: average: "1.27 ms, 787 Hz"
480528-481790 graycode: phase: "2"
480528-481790 graycode: count: "15"
480528-481790 graycode: interval: "1.26 ms, 792 Hz"
480528-481790 graycode: average: "1.26 ms, 788 Hz"
481790-483050 graycode: phase: "1"
481790-483050 graycode: count: "14"
481790-483050 graycode: interval: "1.26 ms, 793 Hz"
481790-483050 graycode: average: "1.26 ms, 789 Hz"
483050-484310 graycode: phase: "0"
483050-484310 graycode: count: "13"
483050-484310 graycode: interval: "1.26 ms, 793 Hz"
483050-484310 graycode: average: "1.26 ms, 790 Hz"
484310-485569 graycode: phase: "3"
484310-485569 graycode: count: "12"
484310-485569 graycode: interval: "1.25 ms, 794 Hz"
484310-485569 graycode: average: "1.26 ms, 791 Hz"
485569-486827 graycode: phase: "2"
485569-486827 graycode: count: "11"
485569-486827 graycode: interval: "1.25 ms, 794 Hz"
485569-486827 graycode: average: "1.26 ms, 791 Hz"
486827-488084 graycode: phase: "1"
486827-488084 graycode: count: "10"
486827-488084 graycode: interval: "1.25 ms, 795 Hz"
486827-488084 graycode: average: "1.26 ms, 792 Hz"
488084-489340 graycode: phase: "0"
488084-489340 graycode: count: "9"
488084-489340 graycode: interval: "1.25 ms, 796 Hz"
488084-489340 graycode: average: "1.26 ms, 793 Hz"
489340-490596 graycode: phase: "3"
489340-490596 graycode: count: "8"
489340-490596 graycode: interval: "1.25 ms, 796 Hz"
489340-490596 graycode: average: "1.25 ms, 793 Hz"
490596-491851 graycode: phase: "2"
490596-491851 graycode: count: "7"
490596-491851 graycode: interval: "1.25 ms, 796 Hz"
490596-491851 graycode: average: "1.25 ms, 794 Hz"
491851-493106 graycode: phase: "1"
491851-493106 graycode: count: "6"
491851-493106 graycode: interval: "1.25 ms, 796 Hz"
491851-493106 graycode: average: "1.25 ms, 795 Hz"
493106-494360 graycode: phase: "0"
493106-494360 graycode: count: "5"
493106-494360 graycode: interval: "1.25 ms, 797 Hz"
493106-494360 graycode: average: "1.25 ms, 795 Hz"
494360-495614 graycode: phase: "3"
494360-495614 graycode: count: "4"
494360-495614 graycode: interval: "1.25 ms, 797 Hz"
494360-495614 graycode: average: "1.25 ms, 795 Hz"
495614-496867 graycode: phase: "2"
495614-496867 graycode: count: "3"
495614-496867 graycode: interval: "1.25 ms, 798 Hz"
495614-496867 graycode: average: "1.25 ms, 796 Hz"
496867-498121 graycode: phase: "1"
496867-498121 graycode: count: "2"
496867-498121 graycode: interval: "1.25 ms, 797 Hz"
496867-498121 graycode: average: "1.25 ms, 796 Hz"
498121-499374 graycode: phase: "0"
498121-499374 graycode: count: "1"
498121-499374 graycode: interval: "1.25 ms, 798 Hz"
498121-499374 graycode: average: "1.25 ms, 797 Hz"
499374-500627 graycode: phase: "3"
499374-500627 graycode: count: "0"
499374-500627 graycode: interval: "1.25 ms, 798 Hz"
499374-500627 graycode: average: "1.25 ms, 797 Hz"
500627-501880 graycode: phase: "2"
500627-501880 graycode: count: "-1"
500627-501880 graycode: interval: "1.25 ms, 798 Hz"
500627-501880 graycode: average: "1.25 ms, 797 Hz"
501880-503134 graycode: phase: "1"
501880-503134 graycode: count: "-2"
501880-503134 graycode: interval: "1.25 ms, 797 Hz"
501880-503134 graycode: average: "1.25 ms, 797 Hz"
503134-504387 graycode: phase: "0"
503134-504387 graycode: count: "-3"
503134-504387 graycode: interval: "1.25 ms, 798 Hz"
503134-504387 graycode: average: "1.25 ms, 797 Hz"
504387-505641 graycode: phase: "3"
504387-505641 graycode: count: "-4"
504387-505641 graycode: interval: "1.25 ms, 797 Hz"
504387-505641 graycode: average: "1.25 ms, 797 Hz"
505641-506895 graycode: phase: "2"
505641-506895 graycode: count: "-5"
505641-506895 graycode: interval: "1.25 ms, 797 Hz"
505641-506895 graycode: average: "1.25 ms, 797 Hz"
506895-508150 graycode: phase: "1"
506895-508150 graycode: count: "-6"
506895-508150 graycode: interval: "1.25 ms, 796 Hz"
506895-508150 graycode: average: "1.25 ms, 797 Hz"
508150-509405 graycode: phase: "0"
508150-509405 graycode: count: "-7"
508150-509405 graycode: interval: "1.25 ms, 796 Hz"
508150-509405 graycode: average: "1.25 ms, 797 Hz"
509405-510661 graycode: phase: "3"
509405-510661 graycode: count: "-8"
509405-510661 graycode: interval: "1.25 ms, 796 Hz"
509405-510661 graycode: average: "1.25 ms, 797 Hz"
510661-511917 graycode: phase: "2"
510661-511917 graycode: count: "-9"
510661-511917 graycode: interval: "1.25 ms, 796 Hz"
510661-511917 graycode: average: "1.25 ms, 797 Hz"
511917-513174 graycode: phase: "1"
511917-513174 graycode: count: "-10"
511917-513174 graycode: interval: "1.25 ms, 795 Hz"
511917-513174 graycode: average: "1.25 ms, 797 Hz"
513174-514432 graycode: phase: "0"
513174-514432 graycode: count: "-11"
513174-514432 graycode: interval: "1.25 ms, 794 Hz"
513174-514432 graycode: average: "1.25 ms, 796 Hz"
514432-515691 graycode: phase: "3"
514432-515691 graycode: count: "-12"
514432-515691 graycode: interval: "1.25 ms, 794 Hz"
514432-515691 graycode: average: "1.25 ms, 796 Hz"
515691-516951 graycode: phase: "2"
515691-516951 graycode: count: "-13"
515691-516951 graycode: interval: "1.26 ms, 793 Hz"
515691-516951 graycode: average: "1.25 ms, 795 Hz"
516951-518211 graycode: phase: "1"
516951-518211 graycode: count: "-14"
516951-518211 graycode: interval: "1.26 ms, 793 Hz"
516951-518211 graycode: average: "1.25 ms, 795 Hz"
518211-519473 graycode: phase: "0"
518211-519473 graycode: count: "-15"
518211-519473 graycode: interval: "1.26 ms, 792 Hz"
518211-519473 graycode: average: "1.25 ms, 795 Hz"
519473-520737 graycode: phase: "3"
519473-520737 graycode: count: "-16"
519473-520737 graycode: interval: "1.26 ms, 791 Hz"
519473-520737 graycode: average: "1.25 ms, 794 Hz"
520737-522001 graycode: phase: "2"
520737-522001 graycode: count: "-17"
520737-522001 graycode: interval: "1.26 ms, 791 Hz"
520737-522001 graycode: average: "1.25 ms, 793 Hz"
522001-523267 graycode: phase: "1"
522001-523267 graycode: count: "-18"
522001-523267 graycode: interval: "1.26 ms, 789 Hz"
522001-523267 graycode: average: "1.26 ms, 793 Hz"
523267-524535 graycode: phase: "0"
523267-524535 graycode: count: "-19"
523267-524535 graycode: interval: "1.26 ms, 788 Hz"
523267-524535 graycode: average: "1.26 ms, 792 Hz"
524535-525804 graycode: phase: "3"
524535-525804 graycode: count: "-20"
524535-525804 graycode: interval: "1.26 ms, 788 Hz"
524535-525804 graycode: average: "1.26 ms, 791 Hz"
525804-527074 graycode: phase: "2"
525804-527074 graycode: count: "-21"
525804-527074 graycode: interval: "1.27 ms, 787 Hz"
525804-527074 graycode: average: "1.26 ms, 791 Hz"
527074-528347 graycode: phase: "1"
527074-528347 graycode: count: "-22"
527074-528347 graycode: interval: "1.27 ms, 785 Hz"
527074-528347 graycode: average: "1.26 ms, 790 Hz"
528347-529621 graycode: phase: "0"
528347-529621 graycode: count: "-23"
528347-529621 graycode: interval: "1.27 ms, 784 Hz"
528347-529621 graycode: average: "1.26 ms, 789 Hz"
529621-530897 graycode: phase: "3"
529621-530897 graycode: count: "-24"
529621-530897 graycode: interval: "1.27 ms, 783 Hz"
529621-530897 graycode: average: "1.26 ms, 788 Hz"
530897-532176 graycode: phase: "2"
530897-532176 graycode: count: "-25"
530897-532176 graycode: interval: "1.27 ms, 781 Hz"
530897-532176 graycode: average: "1.27 ms, 787 Hz"
532176-533456 graycode: phase: "1"
532176-533456 graycode: count: "-26"
532176-533456 graycode: interval: "1.28 ms, 781 Hz"
532176-533456 graycode: average: "1.27 ms, 786 Hz"
533456-534738 graycode: phase: "0"
533456-534738 graycode: count: "-27"
533456-534738 graycode: interval: "1.28 ms, 780 Hz"
533456-534738 graycode: average: "1.27 ms, 785 Hz"
534738-536023 graycode: phase: "3"
534738-536023 graycode: count: "-28"
534738-536023 graycode: interval: "1.28 ms, 778 Hz"
534738-536023 graycode: average: "1.27 ms, 783 Hz"
536023-537310 graycode: phase: "2"
536023-537310 graycode: count: "-29"
536023-537310 graycode: interval: "1.28 ms, 777 Hz"
536023-537310 graycode: average: "1.27 ms, 782 Hz"
537310-538600 graycode: phase: "1"
537310-538600 graycode: count: "-30"
537310-538600 graycode: interval: "1.29 ms, 775 Hz"
537310-538600 graycode: average: "1.27 ms, 781 Hz"
538600-539892 graycode: phase: "0"
538600-539892 graycode: count: "-31"
538600-539892 graycode: interval: "1.29 ms, 773 Hz"
538600-539892 graycode: average: "1.28 ms, 780 Hz"
539892-541187 graycode: phase: "3"
539892-541187 graycode: count: "-32"
539892-541187 graycode: interval: "1.29 ms, 772 Hz"
539892-541187 graycode: average: "1.28 ms, 778 Hz"
541187-542485 graycode: phase: "2"
541187-542485 graycode: count: "-33"
541187-542485 graycode: interval: "1.29 ms, 770 Hz"
541187-542485 graycode: average: "1.28 ms, 777 Hz"
542485-543786 graycode: phase: "1"
542485-543786 graycode: count: "-34"
542485-543786 graycode: interval: "1.30 ms, 768 Hz"
542485-543786 graycode: average: "1.28 ms, 775 Hz"
543786-545089 graycode: phase: "0"
543786-545089 graycode: count: "-35"
543786-545089 graycode: interval: "1.30 ms, 767 Hz"
543786-545089 graycode: average: "1.29 ms, 774 Hz"
545089-546396 graycode: phase: "3"
545089-546396 graycode: count: "-36"
545089-546396 graycode: interval: "1.30 ms, 765 Hz"
545089-546396 graycode: average: "1.29 ms, 772 Hz"
546396-547706 graycode: phase: "2"
546396-547706 graycode: count: "-37"
546396-547706 graycode: interval: "1.31 ms, 763 Hz"
546396-547706 graycode: average: "1.29 ms, 771 Hz"
547706-549020 graycode: phase: "1"
547706-549020 graycode: count: "-38"
547706-549020 graycode: interval: "1.31 ms, 761 Hz"
547706-549020 graycode: average: "1.29 ms, 769 Hz"
549020-550336 graycode: phase: "0"
549020-550336 graycode: count: "-39"
549020-550336 graycode: interval: "1.31 ms, 759 Hz"
549020-550336 graycode: average: "1.30 ms, 767 Hz"
550336-551657 graycode: phase: "3"
550336-551657 graycode: count: "-40"
550336-551657 graycode: interval: "1.32 ms, 757 Hz"
550336-551657 graycode: average: "1.30 ms, 765 Hz"
551657-552981 graycode: phase: "2"
551657-552981 graycode: count: "-41"
551657-552981 graycode: interval: "1.32 ms, 755 Hz"
551657-552981 graycode: average: "1.30 ms, 764 Hz"
552981-554309 graycode: phase: "1"
552981-554309 graycode: count: "-42"
552981-554309 graycode: interval: "1.32 ms, 753 Hz"
552981-554309 graycode: average: "1.31 ms, 762 Hz"
554309-555641 graycode: phase: "0"
554309-555641 graycode: count: "-43"
554309-555641 graycode: interval: "1.33 ms, 750 Hz"
554309-555641 graycode: average: "1.31 ms, 760 Hz"
555641-556977 graycode: phase: "3"
555641-556977 graycode: count: "-44"
555641-556977 graycode: interval: "1.33 ms, 748 Hz"
555641-556977 graycode: average: "1.31 ms, 758 Hz"
556977-558317 graycode: phase: "2"
556977-558317 graycode: count: "-45"
556977-558317 graycode: interval: "1.34 ms, 746 Hz"
556977-558317 graycode: average: "1.32 ms, 755 Hz"
558317-559661 graycode: phase: "1"
558317-559661 graycode: count: "-46"
558317-559661 graycode: interval: "1.34 ms, 744 Hz"
558317-559661 graycode: average: "1.32 ms, 753 Hz"
559661-561010 graycode: phase: "0"
559661-561010 graycode: count: "-47"
559661-561010 graycode: interval: "1.34 ms, 741 Hz"
559661-561010 graycode: average: "1.33 ms, 751 Hz"
561010-562364 graycode: phase: "3"
561010-562364 graycode: count: "-48"
561010-562364 graycode: interval: "1.35 ms, 738 Hz"
561010-562364 graycode: average: "1.33 ms, 749 Hz"
562364-563722 graycode: phase: "2"
562364-563722 graycode: count: "-49"
562364-563722 graycode: interval: "1.35 ms, 736 Hz"
562364-563722 graycode: average: "1.33 ms, 747 Hz"
563722-565085 graycode: phase: "1"
563722-565085 graycode: count: "-50"
563722-565085 graycode: interval: "1.36 ms, 733 Hz"
563722-565085 graycode: average: "1.34 ms, 744 Hz"
565085-566454 graycode: phase: "0"
565085-566454 graycode: count: "-51"
565085-566454 graycode: interval: "1.36 ms, 730 Hz"
565085-566454 graycode: average: "1.34 ms, 742 Hz"
566454-567827 graycode: phase: "3"
566454-567827 graycode: count: "-52"
566454-567827 graycode: interval: "1.37 ms, 728 Hz"
566454-567827 graycode: average: "1.35 ms, 739 Hz"
567827-569206 graycode: phase: "2"
567827-569206 graycode: count: "-53"
567827-569206 graycode: interval: "1.37 ms, 725 Hz"
567827-569206 graycode: average: "1.35 ms, 737 Hz"
569206-570591 graycode: phase: "1"
569206-570591 graycode: count: "-54"
569206-570591 graycode: interval: "1.38 ms, 722 Hz"
569206-570591 graycode: average: "1.36 ms, 734 Hz"
570591-571981 graycode: phase: "0"
570591-571981 graycode: count: "-55"
570591-571981 graycode: interval: "1.39 ms, 719 Hz"
570591-571981 graycode: average: "1.36 ms, 731 Hz"
571981-573378 graycode: phase: "3"
571981-573378 graycode: count: "-56"
571981-573378 graycode: interval: "1.39 ms, 715 Hz"
571981-573378 graycode: average: "1.37 ms, 729 Hz"
573378-574780 graycode: phase: "2"
573378-574780 graycode: count: "-57"
573378-574780 graycode: interval: "1.40 ms, 713 Hz"
573378-574780 graycode: average: "1.37 ms, 726 Hz"
574780-576189 graycode: phase: "1"
574780-576189 graycode: count: "-58"
574780-576189 graycode: interval: "1.40 ms, 709 Hz"
574780-576189 graycode: average: "1.38 ms, 723 Hz"
576189-577604 graycode: phase: "0"
576189-577604 graycode: count: "-59"
576189-577604 graycode: interval: "1.41 ms, 706 Hz"
576189-577604 graycode: average: "1.38 ms, 720 Hz"
577604-579026 graycode: phase: "3"
577604-579026 graycode: count: "-60"
577604-579026 graycode: interval: "1.42 ms, 703 Hz"
577604-579026 graycode: average: "1.39 ms, 717 Hz"
579026-580455 graycode: phase: "2"
579026-580455 graycode: count: "-61"
579026-580455 graycode: interval: "1.42 ms, 699 Hz"
579026-580455 graycode: average: "1.40 ms, 714 Hz"
580455-581891 graycode: phase: "1"
580455-581891 graycode: count: "-62"
580455-581891 graycode: interval: "1.43 ms, 696 Hz"
580455-581891 graycode: average: "1.40 ms, 711 Hz"
581891-583334 graycode: phase: "0"
581891-583334 graycode: count: "-63"
581891-583334 graycode: interval: "1.44 ms, 693 Hz"
581891-583334 graycode: average: "1.41 ms, 707 Hz"
583334-584785 graycode: phase: "3"
583334-584785 graycode: count: "-64"
583334-584785 graycode: interval: "1.45 ms, 689 Hz"
583334-584785 graycode: average: "1.41 ms, 704 Hz"
584785-586243 graycode: phase: "2"
584785-586243 graycode: count: "-65"
584785-586243 graycode: interval: "1.45 ms, 685 Hz"
584785-586243 graycode: average: "1.42 ms, 701 Hz"
586243-587710 graycode: phase: "1"
586243-587710 graycode: count: "-66"
586243-587710 graycode: interval: "1.46 ms, 681 Hz"
586243-587710 graycode: average: "1.43 ms, 697 Hz"
587710-589185 graycode: phase: "0"
587710-589185 graycode: count: "-67"
587710-589185 graycode: interval: "1.47 ms, 677 Hz"
587710-589185 graycode: average: "1.44 ms, 694 Hz"
589185-590669 graycode: phase: "3"
589185-590669 graycode: count: "-68"
589185-590669 graycode: interval: "1.48 ms, 673 Hz"
589185-590669 graycode: average: "1.44 ms, 690 Hz"
590669-592162 graycode: phase: "2"
590669-592162 graycode: count: "-69"
590669-592162 graycode: interval: "1.49 ms, 669 Hz"
590669-592162 graycode: average: "1.45 ms, 686 Hz"
592162-593664 graycode: phase: "1"
592162-593664 graycode: count: "-70"
592162-593664 graycode: interval: "1.50 ms, 665 Hz"
592162-593664 graycode: average: "1.46 ms, 683 Hz"
593664-595175 graycode: phase: "0"
593664-595175 graycode: count: "-71"
593664-595175 graycode: interval: "1.51 ms, 661 Hz"
593664-595175 graycode: average: "1.47 ms, 679 Hz"
595175-596697 graycode: phase: "3"
595175-596697 graycode: count: "-72"
595175-596697 graycode: interval: "1.52 ms, 657 Hz"
595175-596697 graycode: average: "1.48 ms, 675 Hz"
596697-598228 graycode: phase: "2"
596697-598228 graycode: count: "-73"
596697-598228 graycode: interval: "1.53 ms, 653 Hz"
596697-598228 graycode: average: "1.48 ms, 671 Hz"
598228-599770 graycode: phase: "1"
598228-599770 graycode: count: "-74"
598228-599770 graycode: interval: "1.54 ms, 648 Hz"
598228-599770 graycode: average: "1.49 ms, 667 Hz"
599770-601323 graycode: phase: "0"
599770-601323 graycode: count: "-75"
599770-601323 graycode: interval: "1.55 ms, 643 Hz"
599770-601323 graycode: average: "1.50 ms, 663 Hz"
601323-602887 graycode: phase: "3"
601323-602887 graycode: count: "-76"
601323-602887 graycode: interval: "1.56 ms, 639 Hz"
601323-602887 graycode: average: "1.51 ms, 658 Hz"
602887-604463 graycode: phase: "2"
602887-604463 graycode: count: "-77"
602887-604463 graycode: interval: "1.57 ms, 634 Hz"
602887-604463 graycode: average: "1.52 ms, 654 Hz"
604463-606051 graycode: phase: "1"
604463-606051 graycode: count: "-78"
604463-606051 graycode: interval: "1.58 ms, 629 Hz"
604463-606051 graycode: average: "1.53 ms, 650 Hz"
606051-607652 graycode: phase: "0"
606051-607652 graycode: count: "-79"
606051-607652 graycode: interval: "1.60 ms, 624 Hz"
606051-607652 graycode: average: "1.54 ms, 645 Hz"
607652-609265 graycode: phase: "3"
607652-609265 graycode: count: "-80"
607652-609265 graycode: interval: "1.61 ms, 619 Hz"
607652-609265 graycode: average: "1.56 ms, 640 Hz"
609265-610892 graycode: phase: "2"
609265-610892 graycode: count: "-81"
609265-610892 graycode: interval: "1.62 ms, 614 Hz"
609265-610892 graycode: average: "1.57 ms, 636 Hz"
610892-612534 graycode: phase: "1"
610892-612534 graycode: count: "-82"
610892-612534 graycode: interval: "1.64 ms, 609 Hz"
610892-612534 graycode: average: "1.58 ms, 631 Hz"
612534-614189 graycode: phase: "0"
612534-614189 graycode: count: "-83"
612534-614189 graycode: interval: "1.65 ms, 604 Hz"
612534-614189 graycode: average: "1.59 ms, 626 Hz"
614189-615860 graycode: phase: "3"
614189-615860 graycode: count: "-84"
614189-615860 graycode: interval: "1.67 ms, 598 Hz"
614189-615860 graycode: average: "1.60 ms, 621 Hz"
615860-617547 graycode: phase: "2"
615860-617547 graycode: count: "-85"
615860-617547 graycode: interval: "1.68 ms, 592 Hz"
615860-617547 graycode: average: "1.62 ms, 616 Hz"
617547-619250 graycode: phase: "1"
617547-619250 graycode: count: "-86"
617547-619250 graycode: interval: "1.70 ms, 587 Hz"
617547-619250 graycode: average: "1.63 ms, 611 Hz"
619250-620970 graycode: phase: "0"
619250-620970 graycode: count: "-87"
619250-620970 graycode: interval: "1.72 ms, 581 Hz"
619250-620970 graycode: average: "1.65 ms, 605 Hz"
620970-622708 graycode: phase: "3"
620970-622708 graycode: count: "-88"
620970-622708 graycode: interval: "1.73 ms, 575 Hz"
620970-622708 graycode: average: "1.66 ms, 600 Hz"
622708-624465 graycode: phase: "2"
622708-624465 graycode: count: "-89"
622708-624465 graycode: interval: "1.75 ms, 569 Hz"
622708-624465 graycode: average: "1.68 ms, 594 Hz"
624465-626241 graycode: phase: "1"
624465-626241 graycode: count: "-90"
624465-626241 graycode: interval: "1.77 ms, 563 Hz"
624465-626241 graycode: average: "1.69 ms, 589 Hz"
626241-628038 graycode: phase: "0"
626241-628038 graycode: count: "-91"
626241-628038 graycode: interval: "1.79 ms, 556 Hz"
626241-628038 graycode: average: "1.71 ms, 583 Hz"
628038-629856 graycode: phase: "3"
628038-629856 graycode: count: "-92"
628038-629856 graycode: interval: "1.81 ms, 550 Hz"
628038-629856 graycode: average: "1.73 ms, 577 Hz"
629856-631696 graycode: phase: "2"
629856-631696 graycode: count: "-93"
629856-631696 graycode: interval: "1.84 ms, 543 Hz"
629856-631696 graycode: average: "1.75 ms, 571 Hz"
631696-633560 graycode: phase: "1"
631696-633560 graycode: count: "-94"
631696-633560 graycode: interval: "1.86 ms, 536 Hz"
631696-633560 graycode: average: "1.77 ms, 564 Hz"
633560-635448 graycode: phase: "0"
633560-635448 graycode: count: "-95"
633560-635448 graycode: interval: "1.88 ms, 529 Hz"
633560-635448 graycode: average: "1.79 ms, 558 Hz"
635448-637362 graycode: phase: "3"
635448-637362 graycode: count: "-96"
635448-637362 graycode: interval: "1.91 ms, 522 Hz"
635448-637362 graycode: average: "1.81 ms, 552 Hz"
637362-639304 graycode: phase: "2"
637362-639304 graycode: count: "-97"
637362-639304 graycode: interval: "1.94 ms, 514 Hz"
637362-639304 graycode: average: "1.83 ms, 545 Hz"
639304-641274 graycode: phase: "1"
639304-641274 graycode: count: "-98"
639304-641274 graycode: interval: "1.97 ms, 507 Hz"
639304-641274 graycode: average: "1.85 ms, 538 Hz"
641274-643275 graycode: phase: "0"
641274-643275 graycode: count: "-99"
641274-643275 graycode: interval: "2.00 ms, 499 Hz"
641274-643275 graycode: average: "1.88 ms, 531 Hz"
643275-645308 graycode: phase: "3"
643275-645308 graycode: count: "-100"
643275-645308 graycode: interval: "2.03 ms, 491 Hz"
643275-645308 graycode: average: "1.90 ms, 524 Hz"
645308-647375 graycode: phase: "2"
645308-647375 graycode: count: "-101"
645308-647375 graycode: interval: "2.06 ms, 483 Hz"
645308-647375 graycode: average: "1.93 ms, 517 Hz"
647375-649479 graycode: phase: "1"
647375-649479 graycode: count: "-102"
647375-649479 graycode: interval: "2.10 ms, 475 Hz"
647375-649479 graycode: average: "1.96 ms, 509 Hz"
649479-651621 graycode: phase: "0"
649479-651621 graycode: count: "-103"
649479-651621 graycode: interval: "2.14 ms, 466 Hz"
649479-651621 graycode: average: "1.99 ms, 501 Hz"
651621-653805 graycode: phase: "3"
651621-653805 graycode: count: "-104"
651621-653805 graycode: interval: "2.18 ms, 457 Hz"
651621-653805 graycode: average: "2.02 ms, 493 Hz"
653805-656033 graycode: phase: "2"
653805-656033 graycode: count: "-105"
653805-656033 graycode: interval: "2.22 ms, 448 Hz"
653805-656033 graycode: average: "2.05 ms, 485 Hz"
656033-658308 graycode: phase: "1"
656033-658308 graycode: count: "-106"
656033-658308 graycode: interval: "2.27 ms, 439 Hz"
656033-658308 graycode: average: "2.09 ms, 477 Hz"
658308-660635 graycode: phase: "0"
658308-660635 graycode: count: "-107"
658308-660635 graycode: interval: "2.32 ms, 429 Hz"
658308-660635 graycode: average: "2.13 ms, 468 Hz"
660635-663017 graycode: phase: "3"
660635-663017 graycode: count: "-108"
660635-663017 graycode: interval: "2.38 ms, 419 Hz"
660635-663017 graycode: average: "2.17 ms, 459 Hz"
663017-665459 graycode: phase: "2"
663017-665459 graycode: count: "-109"
663017-665459 graycode: interval: "2.44 ms, 409 Hz"
663017-665459 graycode: average: "2.21 ms, 450 Hz"
665459-667967 graycode: phase: "1"
665459-667967 graycode: count: "-110"
665459-667967 graycode: interval: "2.50 ms, 398 Hz"
665459-667967 graycode: average: "2.26 ms, 441 Hz"
667967-670546 graycode: phase: "0"
667967-670546 graycode: count: "-111"
667967-670546 graycode: interval: "2.57 ms, 387 Hz"
667967-670546 graycode: average: "2.31 ms, 431 Hz"
670546-673204 graycode: phase: "3"
670546-673204 graycode: count: "-112"
670546-673204 graycode: interval: "2.65 ms, 376 Hz"
670546-673204 graycode: average: "2.37 ms, 421 Hz"
673204-675951 graycode: phase: "2"
673204-675951 graycode: count: "-113"
673204-675951 graycode: interval: "2.74 ms, 364 Hz"
673204-675951 graycode: average: "2.43 ms, 411 Hz"
675951-678795 graycode: phase: "1"
675951-678795 graycode: count: "-114"
675951-678795 graycode: interval: "2.84 ms, 351 Hz"
675951-678795 graycode: average: "2.49 ms, 400 Hz"
678795-681749 graycode: phase: "0"
678795-681749 graycode: count: "-115"
678795-681749 graycode: interval: "2.95 ms, 338 Hz"
678795-681749 graycode: average: "2.57 ms, 388 Hz"
681749-684828 graycode: phase: "3"
681749-684828 graycode: count: "-116"
681749-684828 graycode: interval: "3.07 ms, 324 Hz"
681749-684828 graycode: average: "2.65 ms, 377 Hz"
684828-688051 graycode: phase: "2"
684828-688051 graycode: count: "-117"
684828-688051 graycode: interval: "3.22 ms, 310 Hz"
684828-688051 graycode: average: "2.74 ms, 364 Hz"
688051-691441 graycode: phase: "1"
688051-691441 graycode: count: "-118"
688051-691441 graycode: interval: "3.39 ms, 294 Hz"
688051-691441 graycode: average: "2.84 ms, 351 Hz"
691441-695031 graycode: phase: "0"
691441-695031 graycode: count: "-119"
691441-695031 graycode: interval: "3.59 ms, 278 Hz"
691441-695031 graycode: average: "2.95 ms, 338 Hz"
695031-698861 graycode: phase: "3"
695031-698861 graycode: count: "-120"
695031-698861 graycode: interval: "3.83 ms, 261 Hz"
695031-698861 graycode: average: "3.08 ms, 323 Hz"
698861-702990 graycode: phase: "2"
698861-702990 graycode: count: "-121"
698861-702990 graycode: interval: "4.12 ms, 242 Hz"
698861-702990 graycode: average: "3.24 ms, 308 Hz"
702990-707506 graycode: phase: "1"
702990-707506 graycode: count: "-122"
702990-707506 graycode: interval: "4.51 ms, 221 Hz"
702990-707506 graycode: average: "3.43 ms, 291 Hz"
707506-712549 graycode: phase: "0"
707506-712549 graycode: count: "-123"
707506-712549 graycode: interval: "5.04 ms, 198 Hz"
707506-712549 graycode: average: "3.65 ms, 273 Hz"
712549-718369 graycode: phase: "3"
712549-718369 graycode: count: "-124"
712549-718369 graycode: interval: "5.82 ms, 171 Hz"
712549-718369 graycode: average: "3.95 ms, 252 Hz"
718369-725515 graycode: phase: "2"
718369-725515 graycode: count: "-125"
718369-725515 graycode: interval: "7.14 ms, 139 Hz"
718369-725515 graycode: average: "4.37 ms, 228 Hz"
725515-735873 graycode: phase: "1"
725515-735873 graycode: count: "-126"
725515-735873 graycode: interval: "10.3 ms, 96.5 Hz"
725515-735873 graycode: average: "5.10 ms, 195 Hz"
735873-764128 graycode: phase: "0"
264128-764128 graycode: increment: "-1"
735873-764128 graycode: count: "-127"
735873-764128 graycode: interval: "28.2 ms, 35.3 Hz"
735873-764128 graycode: average: "7.60 ms, 131 Hz"
764128-774486 graycode: phase: "1"
764128-774486 graycode: count: "-126"
764128-774486 graycode: interval: "10.3 ms, 96.5 Hz"
764128-774486 graycode: average: "8.30 ms, 120 Hz"
774486-781632 graycode: phase: "2"
774486-781632 graycode: count: "-125"
774486-781632 graycode: interval: "7.14 ms, 139 Hz"
774486-781632 graycode: average: "8.66 ms, 115 Hz"
781632-787452 graycode: phase: "3"
781632-787452 graycode: count: "-124"
781632-787452 graycode: interval: "5.82 ms, 171 Hz"
781632-787452 graycode: average: "8.85 ms, 112 Hz"
787452-792495 graycode: phase: "0"
787452-792495 graycode: count: "-123"
787452-792495 graycode: interval: "5.04 ms, 198 Hz"
787452-792495 graycode: average: "8.95 ms, 111 Hz"
792495-797011 graycode: phase: "1"
792495-797011 graycode: count: "-122"
792495-797011 graycode: interval: "4.51 ms, 221 Hz"
792495-797011 graycode: average: "8.95 ms, 111 Hz"
797011-801140 graycode: phase: "2"
797011-801140 graycode: count: "-121"
797011-801140 graycode: interval: "4.12 ms, 242 Hz"
797011-801140 graycode: average: "8.85 ms, 112 Hz"
801140-804970 graycode: phase: "3"
801140-804970 graycode: count: "-120"
801140-804970 graycode: interval: "3.83 ms, 261 Hz"
801140-804970 graycode: average: "8.66 ms, 115 Hz"
804970-808560 graycode: phase: "0"
804970-808560 graycode: count: "-119"
804970-808560 graycode: interval: "3.59 ms, 278 Hz"
804970-808560 graycode: average: "8.30 ms, 120 Hz"
808560-811950 graycode: phase: "1"
808560-811950 graycode: count: "-118"
808560-811950 graycode: interval: "3.39 ms, 294 Hz"
808560-811950 graycode: average: "7.60 ms, 131 Hz"
811950-815173 graycode: phase: "2"
811950-815173 graycode: count: "-117"
811950-815173 graycode: interval: "3.22 ms, 310 Hz"
811950-815173 graycode: average: "5.10 ms, 195 Hz"
815173-818252 graycode: phase: "3"
815173-818252 graycode: count: "-116"
815173-818252 graycode: interval: "3.07 ms, 324 Hz"
815173-818252 graycode: average: "4.37 ms, 228 Hz"
818252-821206 graycode: phase: "0"
818252-821206 graycode: count: "-115"
818252-821206 graycode: interval: "2.95 ms, 338 Hz"
818252-821206 graycode: average: "3.95 ms, 252 Hz"
821206-824050 graycode: phase: "1"
821206-824050 graycode: count: "-114"
821206-824050 graycode: interval: "2.84 ms, 351 Hz"
821206-824050 graycode: average: "3.65 ms, 273 Hz"
824050-826797 graycode: phase: "2"
824050-826797 graycode: count: "-113"
824050-826797 graycode: interval: "2.74 ms, 364 Hz"
824050-826797 graycode: average: "3.43 ms, 291 Hz"
826797-829455 graycode: phase: "3"
826797-829455 graycode: count: "-112"
826797-829455 graycode: interval: "2.65 ms, 376 Hz"
826797-829455 graycode: average: "3.24 ms, 308 Hz"
829455-832034 graycode: phase: "0"
829455-832034 graycode: count: "-111"
829455-832034 graycode: interval: "2.57 ms, 387 Hz"
829455-832034 graycode: average: "3.08 ms, 323 Hz"
832034-834542 graycode: phase: "1"
832034-834542 graycode: count: "-110"
832034-834542 graycode: interval: "2.50 ms, 398 Hz"
832034-834542 graycode: average: "2.95 ms, 338 Hz"
834542-836984 graycode: phase: "2"
834542-836984 graycode: count: "-109"
834542-836984 graycode: interval: "2.44 ms, 409 Hz"
834542-836984 graycode: average: "2.84 ms, 351 Hz"
836984-839366 graycode: phase: "3"
836984-839366 graycode: count: "-108"
836984-839366 graycode: interval: "2.38 ms, 419 Hz"
836984-839366 graycode: average: "2.74 ms, 364 Hz"
839366-841693 graycode: phase: "0"
839366-841693 graycode: count: "-107"
839366-841693 graycode: interval: "2.32 ms, 429 Hz"
839366-841693 graycode: average: "2.65 ms, 377 Hz"
841693-843968 graycode: phase: "1"
841693-843968 graycode: count: "-106"
841693-843968 graycode: interval: "2.27 ms, 439 Hz"
841693-843968 graycode: average: "2.57 ms, 388 Hz"
843968-846196 graycode: phase: "2"
843968-846196 graycode: count: "-105"
843968-846196 graycode: interval: "2.22 ms, 448 Hz"
843968-846196 graycode: average: "2.49 ms, 400 Hz"
846196-848380 graycode: phase: "3"
846196-848380 graycode: count: "-104"
846196-848380 graycode: interval: "2.18 ms, 457 Hz"
846196-848380 graycode: average: "2.43 ms, 411 Hz"
848380-850522 graycode: phase: "0"
848380-850522 graycode: count: "-103"
848380-850522 graycode: interval: "2.14 ms, 466 Hz"
848380-850522 graycode: average: "2.37 ms, 421 Hz"
850522-852626 graycode: phase: "1"
850522-852626 graycode: count: "-102"
850522-852626 graycode: interval: "2.10 ms, 475 Hz"
850522-852626 graycode: average: "2.31 ms, 431 Hz"
852626-854693 graycode: phase: "2"
852626-854693 graycode: count: "-101"
852626-854693 graycode: interval: "2.06 ms, 483 Hz"
852626-854693 graycode: average: "2.26 ms, 441 Hz"
854693-856726 graycode: phase: "3"
854693-856726 graycode: count: "-100"
854693-856726 graycode: interval: "2.03 ms, 491 Hz"
854693-856726 graycode: average: "2.21 ms, 450 Hz"
856726-858727 graycode: phase: "0"
856726-858727 graycode: count: "-99"
856726-858727 graycode: interval: "2.00 ms, 499 Hz"
856726-858727 graycode: average: "2.17 ms, 459 Hz"
858727-860697 graycode: phase: "1"
858727-860697 graycode: count: "-98"
858727-860697 graycode: interval: "1.97 ms, 507 Hz"
858727-860697 graycode: average: "2.13 ms, 468 Hz"
860697-862639 graycode: phase: "2"
860697-862639 graycode: count: "-97"
860697-862639 graycode: interval: "1.94 ms, 514 Hz"
860697-862639 graycode: average: "2.09 ms, 477 Hz"
862639-864553 graycode: phase: "3"
862639-864553 graycode: count: "-96"
862639-864553 graycode: interval: "1.91 ms, 522 Hz"
862639-864553 graycode: average: "2.05 ms, 485 Hz"
864553-866441 graycode: phase: "0"
864553-866441 graycode: count: "-95"
864553-866441 graycode: interval: "1.88 ms, 529 Hz"
864553-866441 graycode: average: "2.02 ms, 493 Hz"
866441-868305 graycode: phase: "1"
866441-868305 graycode: count: "-94"
866441-868305 graycode: interval: "1.86 ms, 536 Hz"
866441-868305 graycode: average: "1.99 ms, 501 Hz"
868305-870145 graycode: phase: "2"
868305-870145 graycode: count: "-93"
868305-870145 graycode: interval: "1.84 ms, 543 Hz"
868305-870145 graycode: average: "1.96 ms, 509 Hz"
870145-871963 graycode: phase: "3"
870145-871963 graycode: count: "-92"
870145-871963 graycode: interval: "1.81 ms, 550 Hz"
870145-871963 graycode: average: "1.93 ms, 517 Hz"
871963-873760 graycode: phase: "0"
871963-873760 graycode: count: "-91"
871963-873760 graycode: interval: "1.79 ms, 556 Hz"
871963-873760 graycode: average: "1.90 ms, 524 Hz"
873760-875536 graycode: phase: "1"
873760-875536 graycode: count: "-90"
873760-875536 graycode: interval: "1.77 ms, 563 Hz"
873760-875536 graycode: average: "1.88 ms, 531 Hz"
875536-877293 graycode: phase: "2"
875536-877293 graycode: count: "-89"
875536-877293 graycode: interval: "1.75 ms, 569 Hz"
875536-877293 graycode: average: "1.85 ms, 538 Hz"
877293-879031 graycode: phase: "3"
877293-879031 graycode: count: "-88"
877293-879031 graycode: interval: "1.73 ms, 575 Hz"
877293-879031 graycode: average: "1.83 ms, 545 Hz"
879031-880751 graycode: phase: "0"
879031-880751 graycode: count: "-87"
879031-880751 graycode: interval: "1.72 ms, 581 Hz"
879031-880751 graycode: average: "1.81 ms, 552 Hz"
880751-882454 graycode: phase: "1"
880751-882454 graycode: count: "-86"
880751-882454 graycode: interval: "1.70 ms, 587 Hz"
880751-882454 graycode: average: "1.79 ms, 558 Hz"
882454-884141 graycode: phase: "2"
882454-884141 graycode: count: "-85"
882454-884141 graycode: interval: "1.68 ms, 592 Hz"
882454-884141 graycode: average: "1.77 ms, 564 Hz"
884141-885812 graycode: phase: "3"
884141-885812 graycode: count: "-84"
884141-885812 graycode: interval: "1.67 ms, 598 Hz"
884141-885812 graycode: average: "1.75 ms, 571 Hz"
885812-887467 graycode: phase: "0"
885812-887467 graycode: count: "-83"
885812-887467 graycode: interval: "1.65 ms, 604 Hz"
885812-887467 graycode: average: "1.73 ms, 577 Hz"
887467-889109 graycode: phase: "1"
887467-889109 graycode: count: "-82"
887467-889109 graycode: interval: "1.64 ms, 609 Hz"
887467-889109 graycode: average: "1.71 ms, 583 Hz"
889109-890736 graycode: phase: "2"
889109-890736 graycode: count: "-81"
889109-890736 graycode: interval: "1.62 ms, 614 Hz"
889109-890736 graycode: average: "1.69 ms, 589 Hz"
890736-892349 graycode: phase: "3"
890736-892349 graycode: count: "-80"
890736-892349 graycode: interval: "1.61 ms, 619 Hz"
890736-892349 graycode: average: "1.68 ms, 594 Hz"
892349-893950 graycode: phase: "0"
892349-893950 graycode: count: "-79"
892349-893950 graycode: interval: "1.60 ms, 624 Hz"
892349-893950 graycode: average: "1.66 ms, 600 Hz"
893950-895538 graycode: phase: "1"
893950-895538 graycode: count: "-78"
893950-895538 graycode: interval: "1.58 ms, 629 Hz"
893950-895538 graycode: average: "1.65 ms, 605 Hz"
895538-897114 graycode: phase: "2"
895538-897114 graycode: count: "-77"
895538-897114 graycode: interval: "1.57 ms, 634 Hz"
895538-897114 graycode: average: "1.63 ms, 611 Hz"
897114-898678 graycode: phase: "3"
897114-898678 graycode: count: "-76"
897114-898678 graycode: interval: "1.56 ms, 639 Hz"
897114-898678 graycode: average: "1.62 ms, 616 Hz"
898678-900231 graycode: phase: "0"
898678-900231 graycode: count: "-75"
898678-900231 graycode: interval: "1.55 ms, 643 Hz"
898678-900231 graycode: average: "1.60 ms, 621 Hz"
900231-901773 graycode: phase: "1"
900231-901773 graycode: count: "-74"
900231-901773 graycode: interval: "1.54 ms, 648 Hz"
900231-901773 graycode: average: "1.59 ms, 626 Hz"
901773-903304 graycode: phase: "2"
901773-903304 graycode: count: "-73"
901773-903304 graycode: interval: "1.53 ms, 653 Hz"
901773-903304 graycode: average: "1.58 ms, 631 Hz"
903304-904826 graycode: phase: "3"
903304-904826 graycode: count: "-72"
903304-904826 graycode: interval: "1.52 ms, 657 Hz"
903304-904826 graycode: average: "1.57 ms, 636 Hz"
904826-906337 graycode: phase: "0"
904826-906337 graycode: count: "-71"
904826-906337 graycode: interval: "1.51 ms, 661 Hz"
904826-906337 graycode: average: "1.56 ms, 640 Hz"
906337-907839 graycode: phase: "1"
906337-907839 graycode: count: "-70"
906337-907839 graycode: interval: "1.50 ms, 665 Hz"
906337-907839 graycode: average: "1.54 ms, 645 Hz"
907839-909332 graycode: phase: "2"
907839-909332 graycode: count: "-69"
907839-909332 graycode: interval: "1.49 ms, 669 Hz"
907839-909332 graycode: average: "1.53 ms, 650 Hz"
909332-910816 graycode: phase: "3"
909332-910816 graycode: count: "-68"
909332-910816 graycode: interval: "1.48 ms, 673 Hz"
909332-910816 graycode: average: "1.52 ms, 654 Hz"
910816-912291 graycode: phase: "0"
910816-912291 graycode: count: "-67"
910816-912291 graycode: interval: "1.47 ms, 677 Hz"
910816-912291 graycode: average: "1.51 ms, 658 Hz"
912291-913758 graycode: phase: "1"
912291-913758 graycode: count: "-66"
912291-913758 graycode: interval: "1.46 ms, 681 Hz"
912291-913758 graycode: average: "1.50 ms, 663 Hz"
913758-915216 graycode: phase: "2"
913758-915216 graycode: count: "-65"
913758-915216 graycode: interval: "1.45 ms, 685 Hz"
913758-915216 graycode: average: "1.49 ms, 667 Hz"
915216-916667 graycode: phase: "3"
915216-916667 graycode: count: "-64"
915216-916667 graycode: interval: "1.45 ms, 689 Hz"
915216-916667 graycode: average: "1.48 ms, 671 Hz"
916667-918110 graycode: phase: "0"
916667-918110 graycode: count: "-63"
916667-918110 graycode: interval: "1.44 ms, 693 Hz"
916667-918110 graycode: average: "1.48 ms, 675 Hz"
918110-919546 graycode: phase: "1"
918110-919546 graycode: count: "-62"
918110-919546 graycode: interval: "1.43 ms, 696 Hz"
918110-919546 graycode: average: "1.47 ms, 679 Hz"
919546-920975 graycode: phase: "2"
919546-920975 graycode: count: "-61"
919546-920975 graycode: interval: "1.42 ms, 699 Hz"
919546-920975 graycode: average: "1.46 ms, 683 Hz"
920975-922397 graycode: phase: "3"
920975-922397 graycode: count: "-60"
920975-922397 graycode: interval: "1.42 ms, 703 Hz"
920975-922397 graycode: average: "1.45 ms, 686 Hz"
922397-923812 graycode: phase: "0"
922397-923812 graycode: count: "-59"
922397-923812 graycode: interval: "1.41 ms, 706 Hz"
922397-923812 graycode: average: "1.44 ms, 690 Hz"
923812-925221 graycode: phase: "1"
923812-925221 graycode: count: "-58"
923812-925221 graycode: interval: "1.40 ms, 709 Hz"
923812-925221 graycode: average: "1.44 ms, 694 Hz"
925221-926623 graycode: phase: "2"
925221-926623 graycode: count: "-57"
925221-926623 graycode: interval: "1.40 ms, 713 Hz"
925221-926623 graycode: average: "1.43 ms, 697 Hz"
926623-928020 graycode: phase: "3"
926623-928020 graycode: count: "-56"
926623-928020 graycode: interval: "1.39 ms, 715 Hz"
926623-928020 graycode: average: "1.42 ms, 701 Hz"
928020-929410 graycode: phase: "0"
928020-929410 graycode: count: "-55"
928020-929410 graycode: interval: "1.39 ms, 719 Hz"
928020-929410 graycode: average: "1.41 ms, 704 Hz"
929410-930795 graycode: phase: "1"
929410-930795 graycode: count: "-54"
929410-930795 graycode: interval: "1.38 ms, 722 Hz"
929410-930795 graycode: average: "1.41 ms, 707 Hz"
930795-932174 graycode: phase: "2"
930795-932174 graycode: count: "-53"
930795-932174 graycode: interval: "1.37 ms, 725 Hz"
930795-932174 graycode: average: "1.40 ms, 711 Hz"
932174-933547 graycode: phase: "3"
932174-933547 graycode: count: "-52"
932174-933547 graycode: interval: "1.37 ms, 728 Hz"
932174-933547 graycode: average: "1.40 ms, 714 Hz"
933547-934916 graycode: phase: "0"
933547-934916 graycode: count: "-51"
933547-934916 graycode: interval: "1.36 ms, 730 Hz"
933547-934916 graycode: average: "1.39 ms, 717 Hz"
934916-936279 graycode: phase: "1"
934916-936279 graycode: count: "-50"
934916-936279 graycode: interval: "1.36 ms, 733 Hz"
934916-936279 graycode: average: "1.38 ms, 720 Hz"
936279-937637 graycode: phase: "2"
936279-937637 graycode: count: "-49"
936279-937637 graycode: interval: "1.35 ms, 736 Hz"
936279-937637 graycode: average: "1.38 ms, 723 Hz"
937637-938991 graycode: phase: "3"
937637-938991 graycode: count: "-48"
937637-938991 graycode: interval: "1.35 ms, 738 Hz"
937637-938991 graycode: average: "1.37 ms, 726 Hz"
938991-940340 graycode: phase: "0"
938991-940340 graycode: count: "-47"
938991-940340 graycode: interval: "1.34 ms, 741 Hz"
938991-940340 graycode: average: "1.37 ms, 729 Hz"
940340-941684 graycode: phase: "1"
940340-941684 graycode: count: "-46"
940340-941684 graycode: interval: "1.34 ms, 744 Hz"
940340-941684 graycode: average: "1.36 ms, 731 Hz"
941684-943024 graycode: phase: "2"
941684-943024 graycode: count: "-45"
941684-943024 graycode: interval: "1.34 ms, 746 Hz"
941684-943024 graycode: average: "1.36 ms, 734 Hz"
943024-944360 graycode: phase: "3"
943024-944360 graycode: count: "-44"
943024-944360 graycode: interval: "1.33 ms, 748 Hz"
943024-944360 graycode: average: "1.35 ms, 737 Hz"
944360-945692 graycode: phase: "0"
944360-945692 graycode: count: "-43"
944360-945692 graycode: interval: "1.33 ms, 750 Hz"
944360-945692 graycode: average: "1.35 ms, 739 Hz"
945692-947020 graycode: phase: "1"
945692-947020 graycode: count: "-42"
945692-947020 graycode: interval: "1.32 ms, 753 Hz"
945692-947020 graycode: average: "1.34 ms, 742 Hz"
947020-948344 graycode: phase: "2"
947020-948344 graycode: count: "-41"
947020-948344 graycode: interval: "1.32 ms, 755 Hz"
947020-948344 graycode: average: "1.34 ms, 744 Hz"
948344-949665 graycode: phase: "3"
948344-949665 graycode: count: "-40"
948344-949665 graycode: interval: "1.32 ms, 757 Hz"
948344-949665 graycode: average: "1.33 ms, 747 Hz"
949665-950981 graycode: phase: "0"
949665-950981 graycode: count: "-39"
949665-950981 graycode: interval: "1.31 ms, 759 Hz"
949665-950981 graycode: average: "1.33 ms, 749 Hz"
950981-952295 graycode: phase: "1"
950981-952295 graycode: count: "-38"
950981-952295 graycode: interval: "1.31 ms, 761 Hz"
950981-952295 graycode: average: "1.33 ms, 751 Hz"
952295-953605 graycode: phase: "2"
952295-953605 graycode: count: "-37"
952295-953605 graycode: interval: "1.31 ms, 763 Hz"
952295-953605 graycode: average: "1.32 ms, 753 Hz"
953605-954912 graycode: phase: "3"
953605-954912 graycode: count: "-36"
953605-954912 graycode: interval: "1.30 ms, 765 Hz"
953605-954912 graycode: average: "1.32 ms, 755 Hz"
954912-956215 graycode: phase: "0"
954912-956215 graycode: count: "-35"
954912-956215 graycode: interval: "1.30 ms, 767 Hz"
954912-956215 graycode: average: "1.31 ms, 758 Hz"
956215-957516 graycode: phase: "1"
956215-957516 graycode: count: "-34"
956215-957516 graycode: interval: "1.30 ms, 768 Hz"
956215-957516 graycode: average: "1.31 ms, 760 Hz"
957516-958814 graycode: phase: "2"
957516-958814 graycode: count: "-33"
957516-958814 graycode: interval: "1.29 ms, 770 Hz"
957516-958814 graycode: average: "1.31 ms, 762 Hz"
958814-960109 graycode: phase: "3"
958814-960109 graycode: count: "-32"
958814-960109 graycode: interval: "1.29 ms, 772 Hz"
958814-960109 graycode: average: "1.30 ms, 764 Hz"
960109-961401 graycode: phase: "0"
960109-961401 graycode: count: "-31"
960109-961401 graycode: interval: "1.29 ms, 773 Hz"
960109-961401 graycode: average: "1.30 ms, 765 Hz"
961401-962691 graycode: phase: "1"
961401-962691 graycode: count: "-30"
961401-962691 graycode: interval: "1.29 ms, 775 Hz"
961401-962691 graycode: average: "1.30 ms, 767 Hz"
962691-963978 graycode: phase: "2"
962691-963978 graycode: count: "-29"
962691-963978 graycode: interval: "1.28 ms, 777 Hz"
962691-963978 graycode: average: "1.29 ms, 769 Hz"
963978-965263 graycode: phase: "3"
963978-965263 graycode: count: "-28"
963978-965263 graycode: interval: "1.28 ms, 778 Hz"
963978-965263 graycode: average: "1.29 ms, 771 Hz"
965263-966545 graycode: phase: "0"
965263-966545 graycode: count: "-27"
965263-966545 graycode: interval: "1.28 ms, 780 Hz"
965263-966545 graycode: average: "1.29 ms, 772 Hz"
966545-967825 graycode: phase: "1"
966545-967825 graycode: count: "-26"
966545-967825 graycode: interval: "1.28 ms, 781 Hz"
966545-967825 graycode: average: "1.29 ms, 774 Hz"
967825-969104 graycode: phase: "2"
967825-969104 graycode: count: "-25"
967825-969104 graycode: interval: "1.27 ms, 781 Hz"
967825-969104 graycode: average: "1.28 ms, 775 Hz"
969104-970380 graycode: phase: "3"
969104-970380 graycode: count: "-24"
969104-970380 graycode: interval: "1.27 ms, 783 Hz"
969104-970380 graycode: average: "1.28 ms, 777 Hz"
970380-971654 graycode: phase: "0"
970380-971654 graycode: count: "-23"
970380-971654 graycode: interval: "1.27 ms, 784 Hz"
970380-971654 graycode: average: "1.28 ms, 778 Hz"
971654-972927 graycode: phase: "1"
971654-972927 graycode: count: "-22"
971654-972927 graycode: interval: "1.27 ms, 785 Hz"
971654-972927 graycode: average: "1.28 ms, 780 Hz"
972927-974197 graycode: phase: "2"
972927-974197 graycode: count: "-21"
972927-974197 graycode: interval: "1.27 ms, 787 Hz"
972927-974197 graycode: average: "1.27 ms, 781 Hz"
974197-975466 graycode: phase: "3"
974197-975466 graycode: count: "-20"
974197-975466 graycode: interval: "1.26 ms, 788 Hz"
974197-975466 graycode: average: "1.27 ms, 782 Hz"
975466-976734 graycode: phase: "0"
975466-976734 graycode: count: "-19"
975466-976734 graycode: interval: "1.26 ms, 788 Hz"
975466-976734 graycode: average: "1.27 ms, 783 Hz"
976734-978000 graycode: phase: "1"
976734-978000 graycode: count: "-18"
976734-978000 graycode: interval: "1.26 ms, 789 Hz"
976734-978000 graycode: average: "1.27 ms, 785 Hz"
978000-979264 graycode: phase: "2"
978000-979264 graycode: count: "-17"
978000-979264 graycode: interval: "1.26 ms, 791 Hz"
978000-979264 graycode: average: "1.27 ms, 786 Hz"
979264-980528 graycode: phase: "3"
979264-980528 graycode: count: "-16"
979264-980528 graycode: interval: "1.26 ms, 791 Hz"
979264-980528 graycode: average: "1.27 ms, 787 Hz"
980528-981790 graycode: phase: "0"
980528-981790 graycode: count: "-15"
980528-981790 graycode: interval: "1.26 ms, 792 Hz"
980528-981790 graycode: average: "1.26 ms, 788 Hz"
981790-983050 graycode: phase: "1"
981790-983050 graycode: count: "-14"
981790-983050 graycode: interval: "1.26 ms, 793 Hz"
981790-983050 graycode: average: "1.26 ms, 789 Hz"
983050-984310 graycode: phase: "2"
983050-984310 graycode: count: "-13"
983050-984310 graycode: interval: "1.26 ms, 793 Hz"
983050-984310 graycode: average: "1.26 ms, 790 Hz"
984310-985569 graycode: phase: "3"
984310-985569 graycode: count: "-12"
984310-985569 graycode: interval: "1.25 ms, 794 Hz"
984310-985569 graycode: average: "1.26 ms, 791 Hz"
985569-986827 graycode: phase: "0"
985569-986827 graycode: count: "-11"
985569-986827 graycode: interval: "1.25 ms, 794 Hz"
985569-986827 graycode: average: "1.26 ms, 791 Hz"
986827-988084 graycode: phase: "1"
986827-988084 graycode: count: "-10"
986827-988084 graycode: interval: "1.25 ms, 795 Hz"
986827-988084 graycode: average: "1.26 ms, 792 Hz"
988084-989340 graycode: phase: "2"
988084-989340 graycode: count: "-9"
988084-989340 graycode: interval: "1.25 ms, 796 Hz"
988084-989340 graycode: average: "1.26 ms, 793 Hz"
989340-990596 graycode: phase: "3"
989340-990596 graycode: count: "-8"
989340-990596 graycode: interval: "1.25 ms, 796 Hz"
989340-990596 graycode: average: "1.25 ms, 793 Hz"
990596-991851 graycode: phase: "0"
990596-991851 graycode: count: "-7"
990596-991851 graycode: interval: "1.25 ms, 796 Hz"
990596-991851 graycode: average: "1.25 ms, 794 Hz"
991851-993106 graycode: phase: "1"
991851-993106 graycode: count: "-6"
991851-993106 graycode: interval: "1.25 ms, 796 Hz"
991851-993106 graycode: average: "1.25 ms, 795 Hz"
993106-994360 graycode: phase: "2"
993106-994360 graycode: count: "-5"
993106-994360 graycode: interval: "1.25 ms, 797 Hz"
993106-994360 graycode: average: "1.25 ms, 795 Hz"
994360-995614 graycode: phase: "3"
994360-995614 graycode: count: "-4"
994360-995614 graycode: interval: "1.25 ms, 797 Hz"
994360-995614 graycode: average: "1.25 ms, 795 Hz"
995614-996867 graycode: phase: "0"
995614-996867 graycode: count: "-3"
995614-996867 graycode: interval: "1.25 ms, 798 Hz"
995614-996867 graycode: average: "1.25 ms, 796 Hz"
996867-998121 graycode: phase: "1"
996867-998121 graycode: count: "-2"
996867-998121 graycode: interval: "1.25 ms, 797 Hz"
996867-998121 graycode: average: "1.25 ms, 796 Hz"
998121-999374 graycode: phase: "2"
998121-999374 graycode: count: "-1"
998121-999374 graycode: interval: "1.25 ms, 798 Hz"
998121-999374 graycode: average: "1.25 ms, 797 Hz"
999374-1000627 graycode: phase: "3"
999374-1000627 graycode: count: "0"
999374-1000627 graycode: interval: "1.25 ms, 798 Hz"
999374-1000627 graycode: average: "1.25 ms, 797 Hz"
1000627-1001880 graycode: phase: "0"
1000627-1001880 graycode: count: "1"
1000627-1001880 graycode: interval: "1.25 ms, 798 Hz"
1000627-1001880 graycode: average: "1.25 ms, 797 Hz"
1001880-1003134 graycode: phase: "1"
1001880-1003134 graycode: count: "2"
1001880-1003134 graycode: interval: "1.25 ms, 797 Hz"
1001880-1003134 graycode: average: "1.25 ms, 797 Hz"
1003134-1004387 graycode: phase: "2"
1003134-1004387 graycode: count: "3"
1003134-1004387 graycode: interval: "1.25 ms, 798 Hz"
1003134-1004387 graycode: average: "1.25 ms, 797 Hz"
1004387-1005641 graycode: phase: "3"
1004387-1005641 graycode: count: "4"
1004387-1005641 graycode: interval: "1.25 ms, 797 Hz"
1004387-1005641 graycode: average: "1.25 ms, 797 Hz"
1005641-1006895 graycode: phase: "0"
1005641-1006895 graycode: count: "5"
1005641-1006895 graycode: interval: "1.25 ms, 797 Hz"
1005641-1006895 graycode: average: "1.25 ms, 797 Hz"
1006895-1008150 graycode: phase: "1"
1006895-1008150 graycode: count: "6"
1006895-1008150 graycode: interval: "1.25 ms, 796 Hz"
1006895-1008150 graycode: average: "1.25 ms, 797 Hz"
1008150-1009405 graycode: phase: "2"
1008150-1009405 graycode: count: "7"
1008150-1009405 graycode: interval: "1.25 ms, 796 Hz"
1008150-1009405 graycode: average: "1.25 ms, 797 Hz"
1009405-1010661 graycode: phase: "3"
1009405-1010661 graycode: count: "8"
1009405-1010661 graycode: interval: "1.25 ms, 796 Hz"
1009405-1010661 graycode: average: "1.25 ms, 797 Hz"
1010661-1011917 graycode: phase: "0"
1010661-1011917 graycode: count: "9"
1010661-1011917 graycode: interval: "1.25 ms, 796 Hz"
1010661-1011917 graycode: average: "1.25 ms, 797 Hz"
1011917-1013174 graycode: phase: "1"
1011917-1013174 graycode: count: "10"
1011917-1013174 graycode: interval: "1.25 ms, 795 Hz"
1011917-1013174 graycode: average: "1.25 ms, 797 Hz"
1013174-1014432 graycode: phase: "2"
1013174-1014432 graycode: count: "11"
1013174-1014432 graycode: interval: "1.25 ms, 794 Hz"
1013174-1014432 graycode: average: "1.25 ms, 796 Hz"
1014432-1015691 graycode: phase: "3"
1014432-1015691 graycode: count: "12"
1014432-1015691 graycode: interval: "1.25 ms, 794 Hz"
1014432-1015691 graycode: average: "1.25 ms, 796 Hz"
1015691-1016951 graycode: phase: "0"
1015691-1016951 graycode: count: "13"
1015691-1016951 graycode: interval: "1.26 ms, 793 Hz"
1015691-1016951 graycode: average: "1.25 ms, 795 Hz"
1016951-1018211 graycode: phase: "1"
1016951-1018211 graycode: count: "14"
1016951-1018211 graycode: interval: "1.26 ms, 793 Hz"
1016951-1018211 graycode: average: "1.25 ms, 795 Hz"
1018211-1019473 graycode: phase: "2"
1018211-1019473 graycode: count: "15"
1018211-1019473 graycode: interval: "1.26 ms, 792 Hz"
1018211-1019473 graycode: average: "1.25 ms, 795 Hz"
1019473-1020737 graycode: phase: "3"
1019473-1020737 graycode: count: "16"
1019473-1020737 graycode: interval: "1.26 ms, 791 Hz"
1019473-1020737 graycode: average: "1.25 ms, 794 Hz"
1020737-1022001 graycode: phase: "0"
1020737-1022001 graycode: count: "17"
1020737-1022001 graycode: interval: "1.26 ms, 791 Hz"
1020737-1022001 graycode: average: "1.25 ms, 793 Hz"
1022001-1023267 graycode: phase: "1"
1022001-1023267 graycode: count: "18"
1022001-1023267 graycode: interval: "1.26 ms, 789 Hz"
1022001-1023267 graycode: average: "1.26 ms, 793 Hz"
1023267-1024535 graycode: phase: "2"
1023267-1024535 graycode: count: "19"
1023267-1024535 graycode: interval: "1.26 ms, 788 Hz"
1023267-1024535 graycode: average: "1.26 ms, 792 Hz"
1024535-1025804 graycode: phase: "3"
1024535-1025804 graycode: count: "20"
1024535-1025804 graycode: interval: "1.26 ms, 788 Hz"
1024535-1025804 graycode: average: "1.26 ms, 791 Hz"
1025804-1027074 graycode: phase: "0"
1025804-1027074 graycode: count: "21"
1025804-1027074 graycode: interval: "1.27 ms, 787 Hz"
1025804-1027074 graycode: average: "1.26 ms, 791 Hz"
1027074-1028347 graycode: phase: "1"
1027074-1028347 graycode: count: "22"
1027074-1028347 graycode: interval: "1.27 ms, 785 Hz"
1027074-1028347 graycode: average: "1.26 ms, 790 Hz"
1028347-1029621 graycode: phase: "2"
1028347-1029621 graycode: count: "23"
1028347-1029621 graycode: interval: "1.27 ms, 784 Hz"
1028347-1029621 graycode: average: "1.26 ms, 789 Hz"
1029621-1030897 graycode: phase: "3"
1029621-1030897 graycode: count: "24"
1029621-1030897 graycode: interval: "1.27 ms, 783 Hz"
1029621-1030897 graycode: average: "1.26 ms, 788 Hz"
1030897-1032176 graycode: phase: "0"
1030897-1032176 graycode: count: "25"
1030897-1032176 graycode: interval: "1.27 ms, 781 Hz"
1030897-1032176 graycode: average: "1.27 ms, 787 Hz"
1032176-1033456 graycode: phase: "1"
1032176-1033456 graycode: count: "26"
1032176-1033456 graycode: interval: "1.28 ms, 781 Hz"
1032176-1033456 graycode: average: "1.27 ms, 786 Hz"
1033456-1034738 graycode: phase: "2"
1033456-1034738 graycode: count: "27"
1033456-1034738 graycode: interval: "1.28 ms, 780 Hz"
1033456-1034738 graycode: average: "1.27 ms, 785 Hz"
1034738-1036023 graycode: phase: "3"
1034738-1036023 graycode: count: "28"
1034738-1036023 graycode: interval: "1.28 ms, 778 Hz"
1034738-1036023 graycode: average: "1.27 ms, 783 Hz"
1036023-1037310 graycode: phase: "0"
1036023-1037310 graycode: count: "29"
1036023-1037310 graycode: interval: "1.28 ms, 777 Hz"
1036023-1037310 graycode: average: "1.27 ms, 782 Hz"
1037310-1038600 graycode: phase: "1"
1037310-1038600 graycode: count: "30"
1037310-1038600 graycode: interval: "1.29 ms, 775 Hz"
1037310-1038600 graycode: average: "1.27 ms, 781 Hz"
1038600-1039892 graycode: phase: "2"
1038600-1039892 graycode: count: "31"
1038600-1039892 graycode: interval: "1.29 ms, 773 Hz"
1038600-1039892 graycode: average: "1.28 ms, 780 Hz"
1039892-1041187 graycode: phase: "3"
1039892-1041187 graycode: count: "32"
1039892-1041187 graycode: interval: "1.29 ms, 772 Hz"
1039892-1041187 graycode: average: "1.28 ms, 778 Hz"
1041187-1042485 graycode: phase: "0"
1041187-1042485 graycode: count: "33"
1041187-1042485 graycode: interval: "1.29 ms, 770 Hz"
1041187-1042485 graycode: average: "1.28 ms, 777 Hz"
1042485-1043786 graycode: phase: "1"
1042485-1043786 graycode: count: "34"
1042485-1043786 graycode: interval: "1.30 ms, 768 Hz"
1042485-1043786 graycode: average: "1.28 ms, 775 Hz"
1043786-1045089 graycode: phase: "2"
1043786-1045089 graycode: count: "35"
1043786-1045089 graycode: interval: "1.30 ms, 767 Hz"
1043786-1045089 graycode: average: "1.29 ms, 774 Hz"
1045089-1046396 graycode: phase: "3"
1045089-1046396 graycode: count: "36"
1045089-1046396 graycode: interval: "1.30 ms, 765 Hz"
1045089-1046396 graycode: average: "1.29 ms, 772 Hz"
1046396-1047706 graycode: phase: "0"
1046396-1047706 graycode: count: "37"
1046396-1047706 graycode: interval: "1.31 ms, 763 Hz"
1046396-1047706 graycode: average: "1.29 ms, 771 Hz"
1047706-1049020 graycode: phase: "1"
1047706-1049020 graycode: count: "38"
1047706-1049020 graycode: interval: "1.31 ms, 761 Hz"
1047706-1049020 graycode: average: "1.29 ms, 769 Hz"
1049020-1050336 graycode: phase: "2"
1049020-1050336 graycode: count: "39"
1049020-1050336 graycode: interval: "1.31 ms, 759 Hz"
1049020-1050336 graycode: average: "1.30 ms, 767 Hz"
1050336-1051657 graycode: phase: "3"
1050336-1051657 graycode: count: "40"
1050336-1051657 graycode: interval: "1.32 ms, 757 Hz"
1050336-1051657 graycode: average: "1.30 ms, 765 Hz"
1051657-1052981 graycode: phase: "0"
1051657-1052981 graycode: count: "41"
1051657-1052981 graycode: interval: "1.32 ms, 755 Hz"
1051657-1052981 graycode: average: "1.30 ms, 764 Hz"
1052981-1054309 graycode: phase: "1"
1052981-1054309 graycode: count: "42"
1052981-1054309 graycode: interval: "1.32 ms, 753 Hz"
1052981-1054309 graycode: average: "1.31 ms, 762 Hz"
1054309-1055641 graycode: phase: "2"
1054309-1055641 graycode: count: "43"
1054309-1055641 graycode: interval: "1.33 ms, 750 Hz"
1054309-1055641 graycode: average: "1.31 ms, 760 Hz"
1055641-1056977 graycode: phase: "3"
1055641-1056977 graycode: count: "44"
1055641-1056977 graycode: interval: "1.33 ms, 748 Hz"
1055641-1056977 graycode: average: "1.31 ms, 758 Hz"
1056977-1058317 graycode: phase: "0"
1056977-1058317 graycode: count: "45"
1056977-1058317 graycode: interval: "1.34 ms, 746 Hz"
1056977-1058317 graycode: average: "1.32 ms, 755 Hz"
1058317-1059661 graycode: phase: "1"
1058317-1059661 graycode: count: "46"
1058317-1059661 graycode: interval: "1.34 ms, 744 Hz"
1058317-1059661 graycode: average: "1.32 ms, 753 Hz"
1059661-1061010 graycode: phase: "2"
1059661-1061010 graycode: count: "47"
1059661-1061010 graycode: interval: "1.34 ms, 741 Hz"
1059661-1061010 graycode: average: "1.33 ms, 751 Hz"
1061010-1062364 graycode: phase: "3"
1061010-1062364 graycode: count: "48"
1061010-1062364 graycode: interval: "1.35 ms, 738 Hz"
1061010-1062364 graycode: average: "1.33 ms, 749 Hz"
1062364-1063722 graycode: phase: "0"
1062364-1063722 graycode: count: "49"
1062364-1063722 graycode: interval: "1.35 ms, 736 Hz"
1062364-1063722 graycode: average: "1.33 ms, 747 Hz"
1063722-1065085 graycode: phase: "1"
1063722-1065085 graycode: count: "50"
1063722-1065085 graycode: interval: "1.36 ms, 733 Hz"
1063722-1065085 graycode: average: "1.34 ms, 744 Hz"
1065085-1066454 graycode: phase: "2"
1065085-1066454 graycode: count: "51"
1065085-1066454 graycode: interval: "1.36 ms, 730 Hz"
1065085-1066454 graycode: average: "1.34 ms, 742 Hz"
1066454-1067827 graycode: phase: "3"
1066454-1067827 graycode: count: "52"
1066454-1067827 graycode: interval: "1.37 ms, 728 Hz"
1066454-1067827 graycode: average: "1.35 ms, 739 Hz"
1067827-1069206 graycode: phase: "0"
1067827-1069206 graycode: count: "53"
1067827-1069206 graycode: interval: "1.37 ms, 725 Hz"
1067827-1069206 graycode: average: "1.35 ms, 737 Hz"
1069206-1070591 graycode: phase: "1"
1069206-1070591 graycode: count: "54"
1069206-1070591 graycode: interval: "1.38 ms, 722 Hz"
1069206-1070591 graycode: average: "1.36 ms, 734 Hz"
1070591-1071981 graycode: phase: "2"
1070591-1071981 graycode: count: "55"
1070591-1071981 graycode: interval: "1.39 ms, 719 Hz"
1070591-1071981 graycode: average: "1.36 ms, 731 Hz"
1071981-1073378 graycode: phase: "3"
1071981-1073378 graycode: count: "56"
1071981-1073378 graycode: interval: "1.39 ms, 715 Hz"
1071981-1073378 graycode: average: "1.37 ms, 729 Hz"
1073378-1074780 graycode: phase: "0"
1073378-1074780 graycode: count: "57"
1073378-1074780 graycode: interval: "1.40 ms, 713 Hz"
1073378-1074780 graycode: average: "1.37 ms, 726 Hz"
1074780-1076189 graycode: phase: "1"
1074780-1076189 graycode: count: "58"
1074780-1076189 graycode: interval: "1.40 ms, 709 Hz"
1074780-1076189 graycode: average: "1.38 ms, 723 Hz"
1076189-1077604 graycode: phase: "2"
1076189-1077604 graycode: count: "59"
1076189-1077604 graycode: interval: "1.41 ms, 706 Hz"
1076189-1077604 graycode: average: "1.38 ms, 720 Hz"
1077604-1079026 graycode: phase: "3"
1077604-1079026 graycode: count: "60"
1077604-1079026 graycode: interval: "1.42 ms, 703 Hz"
1077604-1079026 graycode: average: "1.39 ms, 717 Hz"
1079026-1080455 graycode: phase: "0"
1079026-1080455 graycode: count: "61"
1079026-1080455 graycode: interval: "1.42 ms, 699 Hz"
1079026-1080455 graycode: average: "1.40 ms, 714 Hz"
1080455-1081891 graycode: phase: "1"
1080455-1081891 graycode: count: "62"
1080455-1081891 graycode: interval: "1.43 ms, 696 Hz"
1080455-1081891 graycode: average: "1.40 ms, 711 Hz"
1081891-1083334 graycode: phase: "2"
1081891-1083334 graycode: count: "63"
1081891-1083334 graycode: interval: "1.44 ms, 693 Hz"
1081891-1083334 graycode: average: "1.41 ms, 707 Hz"
1083334-1084785 graycode: phase: "3"
1083334-1084785 graycode: count: "64"
1083334-1084785 graycode: interval: "1.45 ms, 689 Hz"
1083334-1084785 graycode: average: "1.41 ms, 704 Hz"
1084785-1086243 graycode: phase: "0"
1084785-1086243 graycode: count: "65"
1084785-1086243 graycode: interval: "1.45 ms, 685 Hz"
1084785-1086243 graycode: average: "1.42 ms, 701 Hz"
1086243-1087710 graycode: phase: "1"
1086243-1087710 graycode: count: "66"
1086243-1087710 graycode: interval: "1.46 ms, 681 Hz"
1086243-1087710 graycode: average: "1.43 ms, 697 Hz"
1087710-1089185 graycode: phase: "2"
1087710-1089185 graycode: count: "67"
1087710-1089185 graycode: interval: "1.47 ms, 677 Hz"
1087710-1089185 graycode: average: "1.44 ms, 694 Hz"
1089185-1090669 graycode: phase: "3"
1089185-1090669 graycode: count: "68"
1089185-1090669 graycode: interval: "1.48 ms, 673 Hz"
1089185-1090669 graycode: average: "1.44 ms, 690 Hz"
1090669-1092162 graycode: phase: "0"
1090669-1092162 graycode: count: "69"
1090669-1092162 graycode: interval: "1.49 ms, 669 Hz"
1090669-1092162 graycode: average: "1.45 ms, 686 Hz"
1092162-1093664 graycode: phase: "1"
1092162-1093664 graycode: count: "70"
1092162-1093664 graycode: interval: "1.50 ms, 665 Hz"
1092162-1093664 graycode: average: "1.46 ms, 683 Hz"
1093664-1095175 graycode: phase: "2"
1093664-1095175 graycode: count: "71"
1093664-1095175 graycode: interval: "1.51 ms, 661 Hz"
1093664-1095175 graycode: average: "1.47 ms, 679 Hz"
1095175-1096697 graycode: phase: "3"
1095175-1096697 graycode: count: "72"
1095175-1096697 graycode: interval: "1.52 ms, 657 Hz"
1095175-1096697 graycode: average: "1.48 ms, 675 Hz"
1096697-1098228 graycode: phase: "0"
1096697-1098228 graycode: count: "73"
1096697-1098228 graycode: interval: "1.53 ms, 653 Hz"
1096697-1098228 graycode: average: "1.48 ms, 671 Hz"
1098228-1099770 graycode: phase: "1"
1098228-1099770 graycode: count: "74"
1098228-1099770 graycode: interval: "1.54 ms, 648 Hz"
1098228-1099770 graycode: average: "1.49 ms, 667 Hz"
1099770-1101323 graycode: phase: "2"
1099770-1101323 graycode: count: "75"
1099770-1101323 graycode: interval: "1.55 ms, 643 Hz"
1099770-1101323 graycode: average: "1.50 ms, 663 Hz"
1101323-1102887 graycode: phase: "3"
1101323-1102887 graycode: count: "76"
1101323-1102887 graycode: interval: "1.56 ms, 639 Hz"
1101323-1102887 graycode: average: "1.51 ms, 658 Hz"
1102887-1104463 graycode: phase: "0"
1102887-1104463 graycode: count: "77"
1102887-1104463 graycode: interval: "1.57 ms, 634 Hz"
1102887-1104463 graycode: average: "1.52 ms, 654 Hz"
1104463-1106051 graycode: phase: "1"
1104463-1106051 graycode: count: "78"
1104463-1106051 graycode: interval: "1.58 ms, 629 Hz"
1104463-1106051 graycode: average: "1.53 ms, 650 Hz"
1106051-1107652 graycode: phase: "2"
1106051-1107652 graycode: count: "79"
1106051-1107652 graycode: interval: "1.60 ms, 624 Hz"
1106051-1107652 graycode: average: "1.54 ms, 645 Hz"
1107652-1109265 graycode: phase: "3"
1107652-1109265 graycode: count: "80"
1107652-1109265 graycode: interval: "1.61 ms, 619 Hz"
1107652-1109265 graycode: average: "1.56 ms, 640 Hz"
1109265-1110892 graycode: phase: "0"
1109265-1110892 graycode: count: "81"
1109265-1110892 graycode: interval: "1.62 ms, 614 Hz"
1109265-1110892 graycode: average: "1.57 ms, 636 Hz"
1110892-1112534 graycode: phase: "1"
1110892-1112534 graycode: count: "82"
1110892-1112534 graycode: interval: "1.64 ms, 609 Hz"
1110892-1112534 graycode: average: "1.58 ms, 631 Hz"
1112534-1114189 graycode: phase: "2"
1112534-1114189 graycode: count: "83"
1112534-1114189 graycode: interval: "1.65 ms, 604 Hz"
1112534-1114189 graycode: average: "1.59 ms, 626 Hz"
1114189-1115860 graycode: phase: "3"
1114189-1115860 graycode: count: "84"
1114189-1115860 graycode: interval: "1.67 ms, 598 Hz"
1114189-1115860 graycode: average: "1.60 ms, 621 Hz"
1115860-1117547 graycode: phase: "0"
1115860-1117547 graycode: count: "85"
1115860-1117547 graycode: interval: "1.68 ms, 592 Hz"
1115860-1117547 graycode: average: "1.62 ms, 616 Hz"
1117547-1119250 graycode: phase: "1"
1117547-1119250 graycode: count: "86"
1117547-1119250 graycode: interval: "1.70 ms, 587 Hz"
1117547-1119250 graycode: average: "1.63 ms, 611 Hz"
1119250-1120970 graycode: phase: "2"
1119250-1120970 graycode: count: "87"
1119250-1120970 graycode: interval: "1.72 ms, 581 Hz"
1119250-1120970 graycode: average: "1.65 ms, 605 Hz"
1120970-1122708 graycode: phase: "3"
1120970-1122708 graycode: count: "88"
1120970-1122708 graycode: interval: "1.73 ms, 575 Hz"
1120970-1122708 graycode: average: "1.66 ms, 600 Hz"
1122708-1124465 graycode: phase: "0"
1122708-1124465 graycode: count: "89"
1122708-1124465 graycode: interval: "1.75 ms, 569 Hz"
1122708-1124465 graycode: average: "1.68 ms, 594 Hz"
1124465-1126241 graycode: phase: "1"
1124465-1126241 graycode: count: "90"
1124465-1126241 graycode: interval: "1.77 ms, 563 Hz"
1124465-1126241 graycode: average: "1.69 ms, 589 Hz"
1126241-1128038 graycode: phase: "2"
1126241-1128038 graycode: count: "91"
1126241-1128038 graycode: interval: "1.79 ms, 556 Hz"
1126241-1128038 graycode: average: "1.71 ms, 583 Hz"
1128038-1129856 graycode: phase: "3"
1128038-1129856 graycode: count: "92"
1128038-1129856 graycode: interval: "1.81 ms, 550 Hz"
1128038-1129856 graycode: average: "1.73 ms, 577 Hz"
1129856-1131696 graycode: phase: "0"
1129856-1131696 graycode: count: "93"
1129856-1131696 graycode: interval: "1.84 ms, 543 Hz"
1129856-1131696 graycode: average: "1.75 ms, 571 Hz"
1131696-1133560 graycode: phase: "1"
1131696-1133560 graycode: count: "94"
1131696-1133560 graycode: interval: "1.86 ms, 536 Hz"
1131696-1133560 graycode: average: "1.77 ms, 564 Hz"
1133560-1135448 graycode: phase: "2"
1133560-1135448 graycode: count: "95"
1133560-1135448 graycode: interval: "1.88 ms, 529 Hz"
1133560-1135448 graycode: average: "1.79 ms, 558 Hz"
1135448-1137362 graycode: phase: "3"
1135448-1137362 graycode: count: "96"
1135448-1137362 graycode: interval: "1.91 ms, 522 Hz"
1135448-1137362 graycode: average: "1.81 ms, 552 Hz"
1137362-1139304 graycode: phase: "0"
1137362-1139304 graycode: count: "97"
1137362-1139304 graycode: interval: "1.94 ms, 514 Hz"
1137362-1139304 graycode: average: "1.83 ms, 545 Hz"
1139304-1141274 graycode: phase: "1"
1139304-1141274 graycode: count: "98"
1139304-1141274 graycode: interval: "1.97 ms, 507 Hz"
1139304-1141274 graycode: average: "1.85 ms, 538 Hz"
1141274-1143275 graycode: phase: "2"
1141274-1143275 graycode: count: "99"
1141274-1143275 graycode: interval: "2.00 ms, 499 Hz"
1141274-1143275 graycode: average: "1.88 ms, 531 Hz"
1143275-1145308 graycode: phase: "3"
1143275-1145308 graycode: count: "100"
1143275-1145308 graycode: interval: "2.03 ms, 491 Hz"
1143275-1145308 graycode: average: "1.90 ms, 524 Hz"
1145308-1147375 graycode: phase: "0"
1145308-1147375 graycode: count: "101"
1145308-1147375 graycode: interval: "2.06 ms, 483 Hz"
1145308-1147375 graycode: average: "1.93 ms, 517 Hz"
1147375-1149479 graycode: phase: "1"
1147375-1149479 graycode: count: "102"
1147375-1149479 graycode: interval: "2.10 ms, 475 Hz"
1147375-1149479 graycode: average: "1.96 ms, 509 Hz"
1149479-1151621 graycode: phase: "2"
1149479-1151621 graycode: count: "103"
1149479-1151621 graycode: interval: "2.14 ms, 466 Hz"
1149479-1151621 graycode: average: "1.99 ms, 501 Hz"
1151621-1153805 graycode: phase: "3"
1151621-1153805 graycode: count: "104"
1151621-1153805 graycode: interval: "2.18 ms, 457 Hz"
1151621-1153805 graycode: average: "2.02 ms, 493 Hz"
1153805-1156033 graycode: phase: "0"
1153805-1156033 graycode: count: "105"
1153805-1156033 graycode: interval: "2.22 ms, 448 Hz"
1153805-1156033 graycode: average: "2.05 ms, 485 Hz"
1156033-1158308 graycode: phase: "1"
1156033-1158308 graycode: count: "106"
1156033-1158308 graycode: interval: "2.27 ms, 439 Hz"
1156033-1158308 graycode: average: "2.09 ms, 477 Hz"
1158308-1160635 graycode: phase: "2"
1158308-1160635 graycode: count: "107"
1158308-1160635 graycode: interval: "2.32 ms, 429 Hz"
1158308-1160635 graycode: average: "2.13 ms, 468 Hz"
1160635-1163017 graycode: phase: "3"
1160635-1163017 graycode: count: "108"
1160635-1163017 graycode: interval: "2.38 ms, 419 Hz"
1160635-1163017 graycode: average: "2.17 ms, 459 Hz"
1163017-1165459 graycode: phase: "0"
1163017-1165459 graycode: count: "109"
1163017-1165459 graycode: interval: "2.44 ms, 409 Hz"
1163017-1165459 graycode: average: "2.21 ms, 450 Hz"
1165459-1167967 graycode: phase: "1"
1165459-1167967 graycode: count: "110"
1165459-1167967 graycode: interval: "2.50 ms, 398 Hz"
1165459-1167967 graycode: average: "2.26 ms, 441 Hz"
1167967-1170546 graycode: phase: "2"
1167967-1170546 graycode: count: "111"
1167967-1170546 graycode: interval: "2.57 ms, 387 Hz"
1167967-1170546 graycode: average: "2.31 ms, 431 Hz"
1170546-1173204 graycode: phase: "3"
1170546-1173204 graycode: count: "112"
1170546-1173204 graycode: interval: "2.65 ms, 376 Hz"
1170546-1173204 graycode: average: "2.37 ms, 421 Hz"
1173204-1175951 graycode: phase: "0"
1173204-1175951 graycode: count: "113"
1173204-1175951 graycode: interval: "2.74 ms, 364 Hz"
1173204-1175951 graycode: average: "2.43 ms, 411 Hz"
1175951-1178795 graycode: phase: "1"
1175951-1178795 graycode: count: "114"
1175951-1178795 graycode: interval: "2.84 ms, 351 Hz"
1175951-1178795 graycode: average: "2.49 ms, 400 Hz"
1178795-1181749 graycode: phase: "2"
1178795-1181749 graycode: count: "115"
1178795-1181749 graycode: interval: "2.95 ms, 338 Hz"
1178795-1181749 graycode: average: "2.57 ms, 388 Hz"
1181749-1184828 graycode: phase: "3"
1181749-1184828 graycode: count: "116"
1181749-1184828 graycode: interval: "3.07 ms, 324 Hz"
1181749-1184828 graycode: average: "2.65 ms, 377 Hz"
1184828-1188051 graycode: phase: "0"
1184828-1188051 graycode: count: "117"
1184828-1188051 graycode: interval: "3.22 ms, 310 Hz"
1184828-1188051 graycode: average: "2.74 ms, 364 Hz"
1188051-1191441 graycode: phase: "1"
1188051-1191441 graycode: count: "118"
1188051-1191441 graycode: interval: "3.39 ms, 294 Hz"
1188051-1191441 graycode: average: "2.84 ms, 351 Hz"
1191441-1195031 graycode: phase: "2"
1191441-1195031 graycode: count: "119"
1191441-1195031 graycode: interval: "3.59 ms, 278 Hz"
1191441-1195031 graycode: average: "2.95 ms, 338 Hz"
1195031-1198861 graycode: phase: "3"
1195031-1198861 graycode: count: "120"
1195031-1198861 graycode: interval: "3.83 ms, 261 Hz"
1195031-1198861 graycode: average: "3.08 ms, 323 Hz"
1198861-1202990 graycode: phase: "0"
1198861-1202990 graycode: count: "121"
1198861-1202990 graycode: interval: "4.12 ms, 242 Hz"
1198861-1202990 graycode: average: "3.24 ms, 308 Hz"
1202990-1207506 graycode: phase: "1"
1202990-1207506 graycode: count: "122"
1202990-1207506 graycode: interval: "4.51 ms, 221 Hz"
1202990-1207506 graycode: average: "3.43 ms, 291 Hz"
1207506-1212549 graycode: phase: "2"
1207506-1212549 graycode: count: "123"
1207506-1212549 graycode: interval: "5.04 ms, 198 Hz"
1207506-1212549 graycode: average: "3.65 ms, 273 Hz"
1212549-1218369 graycode: phase: "3"
1212549-1218369 graycode: count: "124"
1212549-1218369 graycode: interval: "5.82 ms, 171 Hz"
1212549-1218369 graycode: average: "3.95 ms, 252 Hz"
1218369-1225515 graycode: phase: "0"
1218369-1225515 graycode: count: "125"
1218369-1225515 graycode: interval: "7.14 ms, 139 Hz"
1218369-1225515 graycode: average: "4.37 ms, 228 Hz"
1225515-1235873 graycode: phase: "1"
1225515-1235873 graycode: count: "126"
1225515-1235873 graycode: interval: "10.3 ms, 96.5 Hz"
1225515-1235873 graycode: average: "5.10 ms, 195 Hz"
1235873-1264128 graycode: phase: "2"
764128-1264128 graycode: increment: "+1"
1235873-1264128 graycode: count: "127"
1235873-1264128 graycode: interval: "28.2 ms, 35.3 Hz"
1235873-1264128 graycode: average: "7.60 ms, 131 Hz"
1264128-1274486 graycode: phase: "1"
1264128-1274486 graycode: count: "126"
1264128-1274486 graycode: interval: "10.3 ms, 96.5 Hz"
1264128-1274486 graycode: average: "8.30 ms, 120 Hz"
1274486-1281632 graycode: phase: "0"
1274486-1281632 graycode: count: "125"
1274486-1281632 graycode: interval: "7.14 ms, 139 Hz"
1274486-1281632 graycode: average: "8.66 ms, 115 Hz"
1281632-1287452 graycode: phase: "3"
1281632-1287452 graycode: count: "124"
1281632-1287452 graycode: interval: "5.82 ms, 171 Hz"
1281632-1287452 graycode: average: "8.85 ms, 112 Hz"
1287452-1292495 graycode: phase: "2"
1287452-1292495 graycode: count: "123"
1287452-1292495 graycode: interval: "5.04 ms, 198 Hz"
1287452-1292495 graycode: average: "8.95 ms, 111 Hz"
1292495-1297011 graycode: phase: "1"
1292495-1297011 graycode: count: "122"
1292495-1297011 graycode: interval: "4.51 ms, 221 Hz"
1292495-1297011 graycode: average: "8.95 ms, 111 Hz"
1297011-1301140 graycode: phase: "0"
1297011-1301140 graycode: count: "121"
1297011-1301140 graycode: interval: "4.12 ms, 242 Hz"
1297011-1301140 graycode: average: "8.85 ms, 112 Hz"
1301140-1304970 graycode: phase: "3"
1301140-1304970 graycode: count: "120"
1301140-1304970 graycode: interval: "3.83 ms, 261 Hz"
1301140-1304970 graycode: average: "8.66 ms, 115 Hz"
1304970-1308560 graycode: phase: "2"
1304970-1308560 graycode: count: "119"
1304970-1308560 graycode: interval: "3.59 ms, 278 Hz"
1304970-1308560 graycode: average: "8.30 ms, 120 Hz"
1308560-1311950 graycode: phase: "1"
1308560-1311950 graycode: count: "118"
1308560-1311950 graycode: interval: "3.39 ms, 294 Hz"
1308560-1311950 graycode: average: "7.60 ms, 131 Hz"
1311950-1315173 graycode: phase: "0"
1311950-1315173 graycode: count: "117"
1311950-1315173 graycode: interval: "3.22 ms, 310 Hz"
1311950-1315173 graycode: average: "5.10 ms, 195 Hz"
1315173-1318252 graycode: phase: "3"
1315173-1318252 graycode: count: "116"
1315173-1318252 graycode: interval: "3.07 ms, 324 Hz"
1315173-1318252 graycode: average: "4.37 ms, 228 Hz"
1318252-1321206 graycode: phase: "2"
1318252-1321206 graycode: count: "115"
1318252-1321206 graycode: interval: "2.95 ms, 338 Hz"
1318252-1321206 graycode: average: "3.95 ms, 252 Hz"
1321206-1324050 graycode: phase: "1"
1321206-1324050 graycode: count: "114"
1321206-1324050 graycode: interval: "2.84 ms, 351 Hz"
1321206-1324050 graycode: average: "3.65 ms, 273 Hz"
1324050-1326797 graycode: phase: "0"
1324050-1326797 graycode: count: "113"
1324050-1326797 graycode: interval: "2.74 ms, 364 Hz"
1324050-1326797 graycode: average: "3.43 ms, 291 Hz"
1326797-1329455 graycode: phase: "3"
1326797-1329455 graycode: count: "112"
1326797-1329455 graycode: interval: "2.65 ms, 376 Hz"
1326797-1329455 graycode: average: "3.24 ms, 308 Hz"
1329455-1332034 graycode: phase: "2"
1329455-1332034 graycode: count: "111"
1329455-1332034 graycode: interval: "2.57 ms, 387 Hz"
1329455-1332034 graycode: average: "3.08 ms, 323 Hz"
1332034-1334542 graycode: phase: "1"
1332034-1334542 graycode: count: "110"
1332034-1334542 graycode: interval: "2.50 ms, 398 Hz"
1332034-1334542 graycode: average: "2.95 ms, 338 Hz"
1334542-1336984 graycode: phase: "0"
1334542-1336984 graycode: count: "109"
1334542-1336984 graycode: interval: "2.44 ms, 409 Hz"
1334542-1336984 graycode: average: "2.84 ms, 351 Hz"
1336984-1339366 graycode: phase: "3"
1336984-1339366 graycode: count: "108"
1336984-1339366 graycode: interval: "2.38 ms, 419 Hz"
1336984-1339366 graycode: average: "2.74 ms, 364 Hz"
1339366-1341693 graycode: phase: "2"
1339366-1341693 graycode: count: "107"
1339366-1341693 graycode: interval: "2.32 ms, 429 Hz"
1339366-1341693 graycode: average: "2.65 ms, 377 Hz"
1341693-1343968 graycode: phase: "1"
1341693-1343968 graycode: count: "106"
1341693-1343968 graycode: interval: "2.27 ms, 439 Hz"
1341693-1343968 graycode: average: "2.57 ms, 388 Hz"
1343968-1346196 graycode: phase: "0"
1343968-1346196 graycode: count: "105"
1343968-1346196 graycode: interval: "2.22 ms, 448 Hz"
1343968-1346196 graycode: average: "2.49 ms, 400 Hz"
1346196-1348380 graycode: phase: "3"
1346196-1348380 graycode: count: "104"
1346196-1348380 graycode: interval: "2.18 ms, 457 Hz"
1346196-1348380 graycode: average: "2.43 ms, 411 Hz"
1348380-1350522 graycode: phase: "2"
1348380-1350522 graycode: count: "103"
1348380-1350522 graycode: interval: "2.14 ms, 466 Hz"
1348380-1350522 graycode: average: "2.37 ms, 421 Hz"
1350522-1352626 graycode: phase: "1"
1350522-1352626 graycode: count: "102"
1350522-1352626 graycode: interval: "2.10 ms, 475 Hz"
1350522-1352626 graycode: average: "2.31 ms, 431 Hz"
1352626-1354693 graycode: phase: "0"
1352626-1354693 graycode: count: "101"
1352626-1354693 graycode: interval: "2.06 ms, 483 Hz"
1352626-1354693 graycode: average: "2.26 ms, 441 Hz"
1354693-1356726 graycode: phase: "3"
1354693-1356726 graycode: count: "100"
1354693-1356726 graycode: interval: "2.03 ms, 491 Hz"
1354693-1356726 graycode: average: "2.21 ms, 450 Hz"
1356726-1358727 graycode: phase: "2"
1356726-1358727 graycode: count: "99"
1356726-1358727 graycode: interval: "2.00 ms, 499 Hz"
1356726-1358727 graycode: average: "2.17 ms, 459 Hz"
1358727-1360697 graycode: phase: "1"
1358727-1360697 graycode: count: "98"
1358727-1360697 graycode: interval: "1.97 ms, 507 Hz"
1358727-1360697 graycode: average: "2.13 ms, 468 Hz"
1360697-1362639 graycode: phase: "0"
1360697-1362639 graycode: count: "97"
1360697-1362639 graycode: interval: "1.94 ms, 514 Hz"
1360697-1362639 graycode: average: "2.09 ms, 477 Hz"
1362639-1364553 graycode: phase: "3"
1362639-1364553 graycode: count: "96"
1362639-1364553 graycode: interval: "1.91 ms, 522 Hz"
1362639-1364553 graycode: average: "2.05 ms, 485 Hz"
1364553-1366441 graycode: phase: "2"
1364553-1366441 graycode: count: "95"
1364553-1366441 graycode: interval: "1.88 ms, 529 Hz"
1364553-1366441 graycode: average: "2.02 ms, 493 Hz"
1366441-1368305 graycode: phase: "1"
1366441-1368305 graycode: count: "94"
1366441-1368305 graycode: interval: "1.86 ms, 536 Hz"
1366441-1368305 graycode: average: "1.99 ms, 501 Hz"
1368305-1370145 graycode: phase: "0"
1368305-1370145 graycode: count: "93"
1368305-1370145 graycode: interval: "1.84 ms, 543 Hz"
1368305-1370145 graycode: average: "1.96 ms, 509 Hz"
1370145-1371963 graycode: phase: "3"
1370145-1371963 graycode: count: "92"
1370145-1371963 graycode: interval: "1.81 ms, 550 Hz"
1370145-1371963 graycode: average: "1.93 ms, 517 Hz"
1371963-1373760 graycode: phase: "2"
1371963-1373760 graycode: count: "91"
1371963-1373760 graycode: interval: "1.79 ms, 556 Hz"
1371963-1373760 graycode: average: "1.90 ms, 524 Hz"
1373760-1375536 graycode: phase: "1"
1373760-1375536 graycode: count: "90"
1373760-1375536 graycode: interval: "1.77 ms, 563 Hz"
1373760-1375536 graycode: average: "1.88 ms, 531 Hz"
1375536-1377293 graycode: phase: "0"
1375536-1377293 graycode: count: "89"
1375536-1377293 graycode: interval: "1.75 ms, 569 Hz"
1375536-1377293 graycode: average: "1.85 ms, 538 Hz"
1377293-1379031 graycode: phase: "3"
1377293-1379031 graycode: count: "88"
1377293-1379031 graycode: interval: "1.73 ms, 575 Hz"
1377293-1379031 graycode: average: "1.83 ms, 545 Hz"
1379031-1380751 graycode: phase: "2"
1379031-1380751 graycode: count: "87"
1379031-1380751 graycode: interval: "1.72 ms, 581 Hz"
1379031-1380751 graycode: average: "1.81 ms, 552 Hz"
1380751-1382454 graycode: phase: "1"
1380751-1382454 graycode: count: "86"
1380751-1382454 graycode: interval: "1.70 ms, 587 Hz"
1380751-1382454 graycode: average: "1.79 ms, 558 Hz"
1382454-1384141 graycode: phase: "0"
1382454-1384141 graycode: count: "85"
1382454-1384141 graycode: interval: "1.68 ms, 592 Hz"
1382454-1384141 graycode: average: "1.77 ms, 564 Hz"
1384141-1385812 graycode: phase: "3"
1384141-1385812 graycode: count: "84"
1384141-1385812 graycode: interval: "1.67 ms, 598 Hz"
1384141-1385812 graycode: average: "1.75 ms, 571 Hz"
1385812-1387467 graycode: phase: "2"
1385812-1387467 graycode: count: "83"
1385812-1387467 graycode: interval: "1.65 ms, 604 Hz"
1385812-1387467 graycode: average: "1.73 ms, 577 Hz"
1387467-1389109 graycode: phase: "1"
1387467-1389109 graycode: count: "82"
1387467-1389109 graycode: interval: "1.64 ms, 609 Hz"
1387467-1389109 graycode: average: "1.71 ms, 583 Hz"
1389109-1390736 graycode: phase: "0"
1389109-1390736 graycode: count: "81"
1389109-1390736 graycode: interval: "1.62 ms, 614 Hz"
1389109-1390736 graycode: average: "1.69 ms, 589 Hz"
1390736-1392349 graycode: phase: "3"
1390736-1392349 graycode: count: "80"
1390736-1392349 graycode: interval: "1.61 ms, 619 Hz"
1390736-1392349 graycode: average: "1.68 ms, 594 Hz"
1392349-1393950 graycode: phase: "2"
1392349-1393950 graycode: count: "79"
1392349-1393950 graycode: interval: "1.60 ms, 624 Hz"
1392349-1393950 graycode: average: "1.66 ms, 600 Hz"
1393950-1395538 graycode: phase: "1"
1393950-1395538 graycode: count: "78"
1393950-1395538 graycode: interval: "1.58 ms, 629 Hz"
1393950-1395538 graycode: average: "1.65 ms, 605 Hz"
1395538-1397114 graycode: phase: "0"
1395538-1397114 graycode: count: "77"
1395538-1397114 graycode: interval: "1.57 ms, 634 Hz"
1395538-1397114 graycode: average: "1.63 ms, 611 Hz"
1397114-1398678 graycode: phase: "3"
1397114-1398678 graycode: count: "76"
1397114-1398678 graycode: interval: "1.56 ms, 639 Hz"
1397114-1398678 graycode: average: "1.62 ms, 616 Hz"
1398678-1400231 graycode: phase: "2"
1398678-1400231 graycode: count: "75"
1398678-1400231 graycode: interval: "1.55 ms, 643 Hz"
1398678-1400231 graycode: average: "1.60 ms, 621 Hz"
1400231-1401773 graycode: phase: "1"
1400231-1401773 graycode: count: "74"
1400231-1401773 graycode: interval: "1.54 ms, 648 Hz"
1400231-1401773 graycode: average: "1.59 ms, 626 Hz"
1401773-1403304 graycode: phase: "0"
1401773-1403304 graycode: count: "73"
1401773-1403304 graycode: interval: "1.53 ms, 653 Hz"
1401773-1403304 graycode: average: "1.58 ms, 631 Hz"
1403304-1404826 graycode: phase: "3"
1403304-1404826 graycode: count: "72"
1403304-1404826 graycode: interval: "1.52 ms, 657 Hz"
1403304-1404826 graycode: average: "1.57 ms, 636 Hz"
1404826-1406337 graycode: phase: "2"
1404826-1406337 graycode: count: "71"
1404826-1406337 graycode: interval: "1.51 ms, 661 Hz"
1404826-1406337 graycode: average: "1.56 ms, 640 Hz"
1406337-1407839 graycode: phase: "1"
1406337-1407839 graycode: count: "70"
1406337-1407839 graycode: interval: "1.50 ms, 665 Hz"
1406337-1407839 graycode: average: "1.54 ms, 645 Hz"
1407839-1409332 graycode: phase: "0"
1407839-1409332 graycode: count: "69"
1407839-1409332 graycode: interval: "1.49 ms, 669 Hz"
1407839-1409332 graycode: average: "1.53 ms, 650 Hz"
1409332-1410816 graycode: phase: "3"
1409332-1410816 graycode: count: "68"
1409332-1410816 graycode: interval: "1.48 ms, 673 Hz"
1409332-1410816 graycode: average: "1.52 ms, 654 Hz"
1410816-1412291 graycode: phase: "2"
1410816-1412291 graycode: count: "67"
1410816-1412291 graycode: interval: "1.47 ms, 677 Hz"
1410816-1412291 graycode: average: "1.51 ms, 658 Hz"
1412291-1413758 graycode: phase: "1"
1412291-1413758 graycode: count: "66"
1412291-1413758 graycode: interval: "1.46 ms, 681 Hz"
1412291-1413758 graycode: average: "1.50 ms, 663 Hz"
1413758-1415216 graycode: phase: "0"
1413758-1415216 graycode: count: "65"
1413758-1415216 graycode: interval: "1.45 ms, 685 Hz"
1413758-1415216 graycode: average: "1.49 ms, 667 Hz"
1415216-1416667 graycode: phase: "3"
1415216-1416667 graycode: count: "64"
1415216-1416667 graycode: interval: "1.45 ms, 689 Hz"
1415216-1416667 graycode: average: "1.48 ms, 671 Hz"
1416667-1418110 graycode: phase: "2"
1416667-1418110 graycode: count: "63"
1416667-1418110 graycode: interval: "1.44 ms, 693 Hz"
1416667-1418110 graycode: average: "1.48 ms, 675 Hz"
1418110-1419546 graycode: phase: "1"
1418110-1419546 graycode: count: "62"
1418110-1419546 graycode: interval: "1.43 ms, 696 Hz"
1418110-1419546 graycode: average: "1.47 ms, 679 Hz"
1419546-1420975 graycode: phase: "0"
1419546-1420975 graycode: count: "61"
1419546-1420975 graycode: interval: "1.42 ms, 699 Hz"
1419546-1420975 graycode: average: "1.46 ms, 683 Hz"
1420975-1422397 graycode: phase: "3"
1420975-1422397 graycode: count: "60"
1420975-1422397 graycode: interval: "1.42 ms, 703 Hz"
1420975-1422397 graycode: average: "1.45 ms, 686 Hz"
1422397-1423812 graycode: phase: "2"
1422397-1423812 graycode: count: "59"
1422397-1423812 graycode: interval: "1.41 ms, 706 Hz"
1422397-1423812 graycode: average: "1.44 ms, 690 Hz"
1423812-1425221 graycode: phase: "1"
1423812-1425221 graycode: count: "58"
1423812-1425221 graycode: interval: "1.40 ms, 709 Hz"
1423812-1425221 graycode: average: "1.44 ms, 694 Hz"
1425221-1426623 graycode: phase: "0"
1425221-1426623 graycode: count: "57"
1425221-1426623 graycode: interval: "1.40 ms, 713 Hz"
1425221-1426623 graycode: average: "1.43 ms, 697 Hz"
1426623-1428020 graycode: phase: "3"
1426623-1428020 graycode: count: "56"
1426623-1428020 graycode: interval: "1.39 ms, 715 Hz"
1426623-1428020 graycode: average: "1.42 ms, 701 Hz"
1428020-1429410 graycode: phase: "2"
1428020-1429410 graycode: count: "55"
1428020-1429410 graycode: interval: "1.39 ms, 719 Hz"
1428020-1429410 graycode: average: "1.41 ms, 704 Hz"
1429410-1430795 graycode: phase: "1"
1429410-1430795 graycode: count: "54"
1429410-1430795 graycode: interval: "1.38 ms, 722 Hz"
1429410-1430795 graycode: average: "1.41 ms, 707 Hz"
1430795-1432174 graycode: phase: "0"
1430795-1432174 graycode: count: "53"
1430795-1432174 graycode: interval: "1.37 ms, 725 Hz"
1430795-1432174 graycode: average: "1.40 ms, 711 Hz"
1432174-1433547 graycode: phase: "3"
1432174-1433547 graycode: count: "52"
1432174-1433547 graycode: interval: "1.37 ms, 728 Hz"
1432174-1433547 graycode: average: "1.40 ms, 714 Hz"
1433547-1434916 graycode: phase: "2"
1433547-1434916 graycode: count: "51"
1433547-1434916 graycode: interval: "1.36 ms, 730 Hz"
1433547-1434916 graycode: average: "1.39 ms, 717 Hz"
1434916-1436279 graycode: phase: "1"
1434916-1436279 graycode: count: "50"
1434916-1436279 graycode: interval: "1.36 ms, 733 Hz"
1434916-1436279 graycode: average: "1.38 ms, 720 Hz"
1436279-1437637 graycode: phase: "0"
1436279-1437637 graycode: count: "49"
1436279-1437637 graycode: interval: "1.35 ms, 736 Hz"
1436279-1437637 graycode: average: "1.38 ms, 723 Hz"
1437637-1438991 graycode: phase: "3"
1437637-1438991 graycode: count: "48"
1437637-1438991 graycode: interval: "1.35 ms, 738 Hz"
1437637-1438991 graycode: average: "1.37 ms, 726 Hz"
1438991-1440340 graycode: phase: "2"
1438991-1440340 graycode: count: "47"
1438991-1440340 graycode: interval: "1.34 ms, 741 Hz"
1438991-1440340 graycode: average: "1.37 ms, 729 Hz"
1440340-1441684 graycode: phase: "1"
1440340-1441684 graycode: count: "46"
1440340-1441684 graycode: interval: "1.34 ms, 744 Hz"
1440340-1441684 graycode: average: "1.36 ms, 731 Hz"
1441684-1443024 graycode: phase: "0"
1441684-1443024 graycode: count: "45"
1441684-1443024 graycode: interval: "1.34 ms, 746 Hz"
1441684-1443024 graycode: average: "1.36 ms, 734 Hz"
1443024-1444360 graycode: phase: "3"
1443024-1444360 graycode: count: "44"
1443024-1444360 graycode: interval: "1.33 ms, 748 Hz"
1443024-1444360 graycode: average: "1.35 ms, 737 Hz"
1444360-1445692 graycode: phase: "2"
1444360-1445692 graycode: count: "43"
1444360-1445692 graycode: interval: "1.33 ms, 750 Hz"
1444360-1445692 graycode: average: "1.35 ms, 739 Hz"
1445692-1447020 graycode: phase: "1"
1445692-1447020 graycode: count: "42"
1445692-1447020 graycode: interval: "1.32 ms, 753 Hz"
1445692-1447020 graycode: average: "1.34 ms, 742 Hz"
1447020-1448344 graycode: phase: "0"
1447020-1448344 graycode: count: "41"
1447020-1448344 graycode: interval: "1.32 ms, 755 Hz"
1447020-1448344 graycode: average: "1.34 ms, 744 Hz"
1448344-1449665 graycode: phase: "3"
1448344-1449665 graycode: count: "40"
1448344-1449665 graycode: interval: "1.32 ms, 757 Hz"
1448344-1449665 graycode: average: "1.33 ms, 747 Hz"
1449665-1450981 graycode: phase: "2"
1449665-1450981 graycode: count: "39"
1449665-1450981 graycode: interval: "1.31 ms, 759 Hz"
1449665-1450981 graycode: average: "1.33 ms, 749 Hz"
1450981-1452295 graycode: phase: "1"
1450981-1452295 graycode: count: "38"
1450981-1452295 graycode: interval: "1.31 ms, 761 Hz"
1450981-1452295 graycode: average: "1.33 ms, 751 Hz"
1452295-1453605 graycode: phase: "0"
1452295-1453605 graycode: count: "37"
1452295-1453605 graycode: interval: "1.31 ms, 763 Hz"
1452295-1453605 graycode: average: "1.32 ms, 753 Hz"
1453605-1454912 graycode: phase: "3"
1453605-1454912 graycode: count: "36"
1453605-1454912 graycode: interval: "1.30 ms, 765 Hz"
1453605-1454912 graycode: average: "1.32 ms, 755 Hz"
1454912-1456215 graycode: phase: "2"
1454912-1456215 graycode: count: "35"
1454912-1456215 graycode: interval: "1.30 ms, 767 Hz"
1454912-1456215 graycode: average: "1.31 ms, 758 Hz"
1456215-1457516 graycode: phase: "1"
1456215-1457516 graycode: count: "34"
1456215-1457516 graycode: interval: "1.30 ms, 768 Hz"
1456215-1457516 graycode: average: "1.31 ms, 760 Hz"
1457516-1458814 graycode: phase: "0"
1457516-1458814 graycode: count: "33"
1457516-1458814 graycode: interval: "1.29 ms, 770 Hz"
1457516-1458814 graycode: average: "1.31 ms, 762 Hz"
1458814-1460109 graycode: phase: "3"
1458814-1460109 graycode: count: "32"
1458814-1460109 graycode: interval: "1.29 ms, 772 Hz"
1458814-1460109 graycode: average: "1.30 ms, 764 Hz"
1460109-1461401 graycode: phase: "2"
1460109-1461401 graycode: count: "31"
1460109-1461401 graycode: interval: "1.29 ms, 773 Hz"
1460109-1461401 graycode: average: "1.30 ms, 765 Hz"
1461401-1462691 graycode: phase: "1"
1461401-1462691 graycode: count: "30"
1461401-1462691 graycode: interval: "1.29 ms, 775 Hz"
1461401-1462691 graycode: average: "1.30 ms, 767 Hz"
1462691-1463978 graycode: phase: "0"
1462691-1463978 graycode: count: "29"
1462691-1463978 graycode: interval: "1.28 ms, 777 Hz"
1462691-1463978 graycode: average: "1.29 ms, 769 Hz"
1463978-1465263 graycode: phase: "3"
1463978-1465263 graycode: count: "28"
1463978-1465263 graycode: interval: "1.28 ms, 778 Hz"
1463978-1465263 graycode: average: "1.29 ms, 771 Hz"
1465263-1466545 graycode: phase: "2"
1465263-1466545 graycode: count: "27"
1465263-1466545 graycode: interval: "1.28 ms, 780 Hz"
1465263-1466545 graycode: average: "1.29 ms, 772 Hz"
1466545-1467825 graycode: phase: "1"
1466545-1467825 graycode: count: "26"
1466545-1467825 graycode: interval: "1.28 ms, 781 Hz"
1466545-1467825 graycode: average: "1.29 ms, 774 Hz"
1467825-1469104 graycode: phase: "0"
1467825-1469104 graycode: count: "25"
1467825-1469104 graycode: interval: "1.27 ms, 781 Hz"
1467825-1469104 graycode: average: "1.28 ms, 775 Hz"
1469104-1470380 graycode: phase: "3"
1469104-1470380 graycode: count: "24"
1469104-1470380 graycode: interval: "1.27 ms, 783 Hz"
1469104-1470380 graycode: average: "1.28 ms, 777 Hz"
1470380-1471654 graycode: phase: "2"
1470380-1471654 graycode: count: "23"
1470380-1471654 graycode: interval: "1.27 ms, 784 Hz"
1470380-1471654 graycode: average: "1.28 ms, 778 Hz"
1471654-1472927 graycode: phase: "1"
1471654-1472927 graycode: count: "22"
1471654-1472927 graycode: interval: "1.27 ms, 785 Hz"
1471654-1472927 graycode: average: "1.28 ms, 780 Hz"
1472927-1474197 graycode: phase: "0"
1472927-1474197 graycode: count: "21"
1472927-1474197 graycode: interval: "1.27 ms, 787 Hz"
1472927-1474197 graycode: average: "1.27 ms, 781 Hz"
1474197-1475466 graycode: phase: "3"
1474197-1475466 graycode: count: "20"
1474197-1475466 graycode: interval: "1.26 ms, 788 Hz"
1474197-1475466 graycode: average: "1.27 ms, 782 Hz"
1475466-1476734 graycode: phase: "2"
1475466-1476734 graycode: count: "19"
1475466-1476734 graycode: interval: "1.26 ms, 788 Hz"
1475466-1476734 graycode: average: "1.27 ms, 783 Hz"
1476734-1478000 graycode: phase: "1"
1476734-1478000 graycode: count: "18"
1476734-1478000 graycode: interval: "1.26 ms, 789 Hz"
1476734-1478000 graycode: average: "1.27 ms, 785 Hz"
1478000-1479264 graycode: phase: "0"
1478000-1479264 graycode: count: "17"
1478000-1479264 graycode: interval: "1.26 ms, 791 Hz"
1478000-1479264 graycode: average: "1.27 ms, 786 Hz"
1479264-1480528 graycode: phase: "3"
1479264-1480528 graycode: count: "16"
1479264-1480528 graycode: interval: "1.26 ms, 791 Hz"
1479264-1480528 graycode: average: "1.27 ms, 787 Hz"
1480528-1481790 graycode: phase: "2"
1480528-1481790 graycode: count: "15"
1480528-1481790 graycode: interval: "1.26 ms, 792 Hz"
1480528-1481790 graycode: average: "1.26 ms, 788 Hz"
1481790-1483050 graycode: phase: "1"
1481790-1483050 graycode: count: "14"
1481790-1483050 graycode: interval: "1.26 ms, 793 Hz"
1481790-1483050 graycode: average: "1.26 ms, 789 Hz"
1483050-1484310 graycode: phase: "0"
1483050-1484310 graycode: count: "13"
1483050-1484310 graycode: interval: "1.26 ms, 793 Hz"
1483050-1484310 graycode: average: "1.26 ms, 790 Hz"
1484310-1485569 graycode: phase: "3"
1484310-1485569 graycode: count: "12"
1484310-1485569 graycode: interval: "1.25 ms, 794 Hz"
1484310-1485569 graycode: average: "1.26 ms, 791 Hz"
1485569-1486827 graycode: phase: "2"
1485569-1486827 graycode: count: "11"
1485569-1486827 graycode: interval: "1.25 ms, 794 Hz"
1485569-1486827 graycode: average: "1.26 ms, 791 Hz"
1486827-1488084 graycode: phase: "1"
1486827-1488084 graycode: count: "10"
1486827-1488084 graycode: interval: "1.25 ms, 795 Hz"
1486827-1488084 graycode: average: "1.26 ms, 792 Hz"
1488084-1489340 graycode: phase: "0"
1488084-1489340 graycode: count: "9"
1488084-1489340 graycode: interval: "1.25 ms, 796 Hz"
1488084-1489340 graycode: average: "1.26 ms, 793 Hz"
1489340-1490596 graycode: phase: "3"
1489340-1490596 graycode: count: "8"
1489340-1490596 graycode: interval: "1.25 ms, 796 Hz"
1489340-1490596 graycode: average: "1.25 ms, 793 Hz"
1490596-1491851 graycode: phase: "2"
1490596-1491851 graycode: count: "7"
1490596-1491851 graycode: interval: "1.25 ms, 796 Hz"
1490596-1491851 graycode: average: "1.25 ms, 794 Hz"
1491851-1493106 graycode: phase: "1"
1491851-1493106 graycode: count: "6"
1491851-1493106 graycode: interval: "1.25 ms, 796 Hz"
1491851-1493106 graycode: average: "1.25 ms, 795 Hz"
1493106-1494360 graycode: phase: "0"
1493106-1494360 graycode: count: "5"
1493106-1494360 graycode: interval: "1.25 ms, 797 Hz"
1493106-1494360 graycode: average: "1.25 ms, 795 Hz"
1494360-1495614 graycode: phase: "3"
1494360-1495614 graycode: count: "4"
1494360-1495614 graycode: interval: "1.25 ms, 797 Hz"
1494360-1495614 graycode: average: "1.25 ms, 795 Hz"
1495614-1496867 graycode: phase: "2"
1495614-1496867 graycode: count: "3"
1495614-1496867 graycode: interval: "1.25 ms, 798 Hz"
1495614-1496867 graycode: average: "1.25 ms, 796 Hz"
1496867-1498121 graycode: phase: "1"
1496867-1498121 graycode: count: "2"
1496867-1498121 graycode: interval: "1.25 ms, 797 Hz"
1496867-1498121 graycode: average: "1.25 ms, 796 Hz"
1498121-1499374 graycode: phase: "0"
1498121-1499374 graycode: count: "1"
1498121-1499374 graycode: interval: "1.25 ms, 798 Hz"
1498121-1499374 graycode: average: "1.25 ms, 797 Hz"
1499374-1500627 graycode: phase: "3"
1499374-1500627 graycode: count: "0"
1499374-1500627 graycode: interval: "1.25 ms, 798 Hz"
1499374-1500627 graycode: average: "1.25 ms, 797 Hz"
1500627-1501880 graycode: phase: "2"
1500627-1501880 graycode: count: "-1"
1500627-1501880 graycode: interval: "1.25 ms, 798 Hz"
1500627-1501880 graycode: average: "1.25 ms, 797 Hz"
1501880-1503134 graycode: phase: "1"
1501880-1503134 graycode: count: "-2"
1501880-1503134 graycode: interval: "1.25 ms, 797 Hz"
1501880-1503134 graycode: average: "1.25 ms, 797 Hz"
1503134-1504387 graycode: phase: "0"
1503134-1504387 graycode: count: "-3"
1503134-1504387 graycode: interval: "1.25 ms, 798 Hz"
1503134-1504387 graycode: average: "1.25 ms, 797 Hz"
1504387-1505641 graycode: phase: "3"
1504387-1505641 graycode: count: "-4"
1504387-1505641 graycode: interval: "1.25 ms, 797 Hz"
1504387-1505641 graycode: average: "1.25 ms, 797 Hz"
1505641-1506895 graycode: phase: "2"
1505641-1506895 graycode: count: "-5"
1505641-1506895 graycode: interval: "1.25 ms, 797 Hz"
1505641-1506895 graycode: average: "1.25 ms, 797 Hz"
1506895-1508150 graycode: phase: "1"
1506895-1508150 graycode: count: "-6"
1506895-1508150 graycode: interval: "1.25 ms, 796 Hz"
1506895-1508150 graycode: average: "1.25 ms, 797 Hz"
1508150-1509405 graycode: phase: "0"
1508150-1509405 graycode: count: "-7"
1508150-1509405 graycode: interval: "1.25 ms, 796 Hz"
1508150-1509405 graycode: average: "1.25 ms, 797 Hz"
1509405-1510661 graycode: phase: "3"
1509405-1510661 graycode: count: "-8"
1509405-1510661 graycode: interval: "1.25 ms, 796 Hz"
1509405-1510661 graycode: average: "1.25 ms, 797 Hz"
1510661-1511917 graycode: phase: "2"
1510661-1511917 graycode: count: "-9"
1510661-1511917 graycode: interval: "1.25 ms, 796 Hz"
1510661-1511917 graycode: average: "1.25 ms, 797 Hz"
1511917-1513174 graycode: phase: "1"
1511917-1513174 graycode: count: "-10"
1511917-1513174 graycode: interval: "1.25 ms, 795 Hz"
1511917-1513174 graycode: average: "1.25 ms, 797 Hz"
1513174-1514432 graycode: phase: "0"
1513174-1514432 graycode: count: "-11"
1513174-1514432 graycode: interval: "1.25 ms, 794 Hz"
1513174-1514432 graycode: average: "1.25 ms, 796 Hz"
1514432-1515691 graycode: phase: "3"
1514432-1515691 graycode: count: "-12"
1514432-1515691 graycode: interval: "1.25 ms, 794 Hz"
1514432-1515691 graycode: average: "1.25 ms, 796 Hz"
1515691-1516951 graycode: phase: "2"
1515691-1516951 graycode: count: "-13"
1515691-1516951 graycode: interval: "1.26 ms, 793 Hz"
1515691-1516951 graycode: average: "1.25 ms, 795 Hz"
1516951-1518211 graycode: phase: "1"
1516951-1518211 graycode: count: "-14"
1516951-1518211 graycode: interval: "1.26 ms, 793 Hz"
1516951-1518211 graycode: average: "1.25 ms, 795 Hz"
1518211-1519473 graycode: phase: "0"
1518211-1519473 graycode: count: "-15"
1518211-1519473 graycode: interval: "1.26 ms, 792 Hz"
1518211-1519473 graycode: average: "1.25 ms, 795 Hz"
1519473-1520737 graycode: phase: "3"
1519473-1520737 graycode: count: "-16"
1519473-1520737 graycode: interval: "1.26 ms, 791 Hz"
1519473-1520737 graycode: average: "1.25 ms, 794 Hz"
1520737-1522001 graycode: phase: "2"
1520737-1522001 graycode: count: "-17"
1520737-1522001 graycode: interval: "1.26 ms, 791 Hz"
1520737-1522001 graycode: average: "1.25 ms, 793 Hz"
1522001-1523267 graycode: phase: "1"
1522001-1523267 graycode: count: "-18"
1522001-1523267 graycode: interval: "1.26 ms, 789 Hz"
1522001-1523267 graycode: average: "1.26 ms, 793 Hz"
1523267-1524535 graycode: phase: "0"
1523267-1524535 graycode: count: "-19"
1523267-1524535 graycode: interval: "1.26 ms, 788 Hz"
1523267-1524535 graycode: average: "1.26 ms, 792 Hz"
1524535-1525804 graycode: phase: "3"
1524535-1525804 graycode: count: "-20"
1524535-1525804 graycode: interval: "1.26 ms, 788 Hz"
1524535-1525804 graycode: average: "1.26 ms, 791 Hz"
1525804-1527074 graycode: phase: "2"
1525804-1527074 graycode: count: "-21"
1525804-1527074 graycode: interval: "1.27 ms, 787 Hz"
1525804-1527074 graycode: average: "1.26 ms, 791 Hz"
1527074-1528347 graycode: phase: "1"
1527074-1528347 graycode: count: "-22"
1527074-1528347 graycode: interval: "1.27 ms, 785 Hz"
1527074-1528347 graycode: average: "1.26 ms, 790 Hz"
1528347-1529621 graycode: phase: "0"
1528347-1529621 graycode: count: "-23"
1528347-1529621 graycode: interval: "1.27 ms, 784 Hz"
1528347-1529621 graycode: average: "1.26 ms, 789 Hz"
1529621-1530897 graycode: phase: "3"
1529621-1530897 graycode: count: "-24"
1529621-1530897 graycode: interval: "1.27 ms, 783 Hz"
1529621-1530897 graycode: average: "1.26 ms, 788 Hz"
1530897-1532176 graycode: phase: "2"
1530897-1532176 graycode: count: "-25"
1530897-1532176 graycode: interval: "1.27 ms, 781 Hz"
1530897-1532176 graycode: average: "1.27 ms, 787 Hz"
1532176-1533456 graycode: phase: "1"
1532176-1533456 graycode: count: "-26"
1532176-1533456 graycode: interval: "1.28 ms, 781 Hz"
1532176-1533456 graycode: average: "1.27 ms, 786 Hz"
1533456-1534738 graycode: phase: "0"
1533456-1534738 graycode: count: "-27"
1533456-1534738 graycode: interval: "1.28 ms, 780 Hz"
1533456-1534738 graycode: average: "1.27 ms, 785 Hz"
1534738-1536023 graycode: phase: "3"
1534738-1536023 graycode: count: "-28"
1534738-1536023 graycode: interval: "1.28 ms, 778 Hz"
1534738-1536023 graycode: average: "1.27 ms, 783 Hz"
1536023-1537310 graycode: phase: "2"
1536023-1537310 graycode: count: "-29"
1536023-1537310 graycode: interval: "1.28 ms, 777 Hz"
1536023-1537310 graycode: average: "1.27 ms, 782 Hz"
1537310-1538600 graycode: phase: "1"
1537310-1538600 graycode: count: "-30"
1537310-1538600 graycode: interval: "1.29 ms, 775 Hz"
1537310-1538600 graycode: average: "1.27 ms, 781 Hz"
1538600-1539892 graycode: phase: "0"
1538600-1539892 graycode: count: "-31"
1538600-1539892 graycode: interval: "1.29 ms, 773 Hz"
1538600-1539892 graycode: average: "1.28 ms, 780 Hz"
1539892-1541187 graycode: phase: "3"
1539892-1541187 graycode: count: "-32"
1539892-1541187 graycode: interval: "1.29 ms, 772 Hz"
1539892-1541187 graycode: average: "1.28 ms, 778 Hz"
1541187-1542485 graycode: phase: "2"
1541187-1542485 graycode: count: "-33"
1541187-1542485 graycode: interval: "1.29 ms, 770 Hz"
1541187-1542485 graycode: average: "1.28 ms, 777 Hz"
1542485-1543786 graycode: phase: "1"
1542485-1543786 graycode: count: "-34"
1542485-1543786 graycode: interval: "1.30 ms, 768 Hz"
1542485-1543786 graycode: average: "1.28 ms, 775 Hz"
1543786-1545089 graycode: phase: "0"
1543786-1545089 graycode: count: "-35"
1543786-1545089 graycode: interval: "1.30 ms, 767 Hz"
1543786-1545089 graycode: average: "1.29 ms, 774 Hz"
1545089-1546396 graycode: phase: "3"
1545089-1546396 graycode: count: "-36"
1545089-1546396 graycode: interval: "1.30 ms, 765 Hz"
1545089-1546396 graycode: average: "1.29 ms, 772 Hz"
1546396-1547706 graycode: phase: "2"
1546396-1547706 graycode: count: "-37"
1546396-1547706 graycode: interval: "1.31 ms, 763 Hz"
1546396-1547706 graycode: average: "1.29 ms, 771 Hz"
1547706-1549020 graycode: phase: "1"
1547706-1549020 graycode: count: "-38"
1547706-1549020 graycode: interval: "1.31 ms, 761 Hz"
1547706-1549020 graycode: average: "1.29 ms, 769 Hz"
1549020-1550336 graycode: phase: "0"
1549020-1550336 graycode: count: "-39"
1549020-1550336 graycode: interval: "1.31 ms, 759 Hz"
1549020-1550336 graycode: average: "1.30 ms, 767 Hz"
1550336-1551657 graycode: phase: "3"
1550336-1551657 graycode: count: "-40"
1550336-1551657 graycode: interval: "1.32 ms, 757 Hz"
1550336-1551657 graycode: average: "1.30 ms, 765 Hz"
1551657-1552981 graycode: phase: "2"
1551657-1552981 graycode: count: "-41"
1551657-1552981 graycode: interval: "1.32 ms, 755 Hz"
1551657-1552981 graycode: average: "1.30 ms, 764 Hz"
1552981-1554309 graycode: phase: "1"
1552981-1554309 graycode: count: "-42"
1552981-1554309 graycode: interval: "1.32 ms, 753 Hz"
1552981-1554309 graycode: average: "1.31 ms, 762 Hz"
1554309-1555641 graycode: phase: "0"
1554309-1555641 graycode: count: "-43"
1554309-1555641 graycode: interval: "1.33 ms, 750 Hz"
1554309-1555641 graycode: average: "1.31 ms, 760 Hz"
1555641-1556977 graycode: phase: "3"
1555641-1556977 graycode: count: "-44"
1555641-1556977 graycode: interval: "1.33 ms, 748 Hz"
1555641-1556977 graycode: average: "1.31 ms, 758 Hz"
1556977-1558317 graycode: phase: "2"
1556977-1558317 graycode: count: "-45"
1556977-1558317 graycode: interval: "1.34 ms, 746 Hz"
1556977-1558317 graycode: average: "1.32 ms, 755 Hz"
1558317-1559661 graycode: phase: "1"
1558317-1559661 graycode: count: "-46"
1558317-1559661 graycode: interval: "1.34 ms, 744 Hz"
1558317-1559661 graycode: average: "1.32 ms, 753 Hz"
1559661-1561010 graycode: phase: "0"
1559661-1561010 graycode: count: "-47"
1559661-1561010 graycode: interval: "1.34 ms, 741 Hz"
1559661-1561010 graycode: average: "1.33 ms, 751 Hz"
1561010-1562364 graycode: phase: "3"
1561010-1562364 graycode: count: "-48"
1561010-1562364 graycode: interval: "1.35 ms, 738 Hz"
1561010-1562364 graycode: average: "1.33 ms, 749 Hz"
1562364-1563722 graycode: phase: "2"
1562364-1563722 graycode: count: "-49"
1562364-1563722 graycode: interval: "1.35 ms, 736 Hz"
1562364-1563722 graycode: average: "1.33 ms, 747 Hz"
1563722-1565085 graycode: phase: "1"
1563722-1565085 graycode: count: "-50"
1563722-1565085 graycode: interval: "1.36 ms, 733 Hz"
1563722-1565085 graycode: average: "1.34 ms, 744 Hz"
1565085-1566454 graycode: phase: "0"
1565085-1566454 graycode: count: "-51"
1565085-1566454 graycode: interval: "1.36 ms, 730 Hz"
1565085-1566454 graycode: average: "1.34 ms, 742 Hz"
1566454-1567827 graycode: phase: "3"
1566454-1567827 graycode: count: "-52"
1566454-1567827 graycode: interval: "1.37 ms, 728 Hz"
1566454-1567827 graycode: average: "1.35 ms, 739 Hz"
1567827-1569206 graycode: phase: "2"
1567827-1569206 graycode: count: "-53"
1567827-1569206 graycode: interval: "1.37 ms, 725 Hz"
1567827-1569206 graycode: average: "1.35 ms, 737 Hz"
1569206-1570591 graycode: phase: "1"
1569206-1570591 graycode: count: "-54"
1569206-1570591 graycode: interval: "1.38 ms, 722 Hz"
1569206-1570591 graycode: average: "1.36 ms, 734 Hz"
1570591-1571981 graycode: phase: "0"
1570591-1571981 graycode: count: "-55"
1570591-1571981 graycode: interval: "1.39 ms, 719 Hz"
1570591-1571981 graycode: average: "1.36 ms, 731 Hz"
1571981-1573378 graycode: phase: "3"
1571981-1573378 graycode: count: "-56"
1571981-1573378 graycode: interval: "1.39 ms, 715 Hz"
1571981-1573378 graycode: average: "1.37 ms, 729 Hz"
1573378-1574780 graycode: phase: "2"
1573378-1574780 graycode: count: "-57"
1573378-1574780 graycode: interval: "1.40 ms, 713 Hz"
1573378-1574780 graycode: average: "1.37 ms, 726 Hz"
1574780-1576189 graycode: phase: "1"
1574780-1576189 graycode: count: "-58"
1574780-1576189 graycode: interval: "1.40 ms, 709 Hz"
1574780-1576189 graycode: average: "1.38 ms, 723 Hz"
1576189-1577604 graycode: phase: "0"
1576189-1577604 graycode: count: "-59"
1576189-1577604 graycode: interval: "1.41 ms, 706 Hz"
1576189-1577604 graycode: average: "1.38 ms, 720 Hz"
1577604-1579026 graycode: phase: "3"
1577604-1579026 graycode: count: "-60"
1577604-1579026 graycode: interval: "1.42 ms, 703 Hz"
1577604-1579026 graycode: average: "1.39 ms, 717 Hz"
1579026-1580455 graycode: phase: "2"
1579026-1580455 graycode: count: "-61"
1579026-1580455 graycode: interval: "1.42 ms, 699 Hz"
1579026-1580455 graycode: average: "1.40 ms, 714 Hz"
1580455-1581891 graycode: phase: "1"
1580455-1581891 graycode: count: "-62"
1580455-1581891 graycode: interval: "1.43 ms, 696 Hz"
1580455-1581891 graycode: average: "1.40 ms, 711 Hz"
1581891-1583334 graycode: phase: "0"
1581891-1583334 graycode: count: "-63"
1581891-1583334 graycode: interval: "1.44 ms, 693 Hz"
1581891-1583334 graycode: average: "1.41 ms, 707 Hz"
1583334-1584785 graycode: phase: "3"
1583334-1584785 graycode: count: "-64"
1583334-1584785 graycode: interval: "1.45 ms, 689 Hz"
1583334-1584785 graycode: average: "1.41 ms, 704 Hz"
1584785-1586243 graycode: phase: "2"
1584785-1586243 graycode: count: "-65"
1584785-1586243 graycode: interval: "1.45 ms, 685 Hz"
1584785-1586243 graycode: average: "1.42 ms, 701 Hz"
1586243-1587710 graycode: phase: "1"
1586243-1587710 graycode: count: "-66"
1586243-1587710 graycode: interval: "1.46 ms, 681 Hz"
1586243-1587710 graycode: average: "1.43 ms, 697 Hz"
1587710-1589185 graycode: phase: "0"
1587710-1589185 graycode: count: "-67"
1587710-1589185 graycode: interval: "1.47 ms, 677 Hz"
1587710-1589185 graycode: average: "1.44 ms, 694 Hz"
1589185-1590669 graycode: phase: "3"
1589185-1590669 graycode: count: "-68"
1589185-1590669 graycode: interval: "1.48 ms, 673 Hz"
1589185-1590669 graycode: average: "1.44 ms, 690 Hz"
1590669-1592162 graycode: phase: "2"
1590669-1592162 graycode: count: "-69"
1590669-1592162 graycode: interval: "1.49 ms, 669 Hz"
1590669-1592162 graycode: average: "1.45 ms, 686 Hz"
1592162-1593664 graycode: phase: "1"
1592162-1593664 graycode: count: "-70"
1592162-1593664 graycode: interval: "1.50 ms, 665 Hz"
1592162-1593664 graycode: average: "1.46 ms, 683 Hz"
1593664-1595175 graycode: phase: "0"
1593664-1595175 graycode: count: "-71"
1593664-1595175 graycode: interval: "1.51 ms, 661 Hz"
1593664-1595175 graycode: average: "1.47 ms, 679 Hz"
1595175-1596697 graycode: phase: "3"
1595175-1596697 graycode: count: "-72"
1595175-1596697 graycode: interval: "1.52 ms, 657 Hz"
1595175-1596697 graycode: average: "1.48 ms, 675 Hz"
1596697-1598228 graycode: phase: "2"
1596697-1598228 graycode: count: "-73"
1596697-1598228 graycode: interval: "1.53 ms, 653 Hz"
1596697-1598228 graycode: average: "1.48 ms, 671 Hz"
1598228-1599770 graycode: phase: "1"
1598228-1599770 graycode: count: "-74"
1598228-1599770 graycode: interval: "1.54 ms, 648 Hz"
1598228-1599770 graycode: average: "1.49 ms, 667 Hz"
1599770-1601323 graycode: phase: "0"
1599770-1601323 graycode: count: "-75"
1599770-1601323 graycode: interval: "1.55 ms, 643 Hz"
1599770-1601323 graycode: average: "1.50 ms, 663 Hz"
1601323-1602887 graycode: phase: "3"
1601323-1602887 graycode: count: "-76"
1601323-1602887 graycode: interval: "1.56 ms, 639 Hz"
1601323-1602887 graycode: average: "1.51 ms, 658 Hz"
1602887-1604463 graycode: phase: "2"
1602887-1604463 graycode: count: "-77"
1602887-1604463 graycode: interval: "1.57 ms, 634 Hz"
1602887-1604463 graycode: average: "1.52 ms, 654 Hz"
1604463-1606051 graycode: phase: "1"
1604463-1606051 graycode: count: "-78"
1604463-1606051 graycode: interval: "1.58 ms, 629 Hz"
1604463-1606051 graycode: average: "1.53 ms, 650 Hz"
1606051-1607652 graycode: phase: "0"
1606051-1607652 graycode: count: "-79"
1606051-1607652 graycode: interval: "1.60 ms, 624 Hz"
1606051-1607652 graycode: average: "1.54 ms, 645 Hz"
1607652-1609265 graycode: phase: "3"
1607652-1609265 graycode: count: "-80"
1607652-1609265 graycode: interval: "1.61 ms, 619 Hz"
1607652-1609265 graycode: average: "1.56 ms, 640 Hz"
1609265-1610892 graycode: phase: "2"
1609265-1610892 graycode: count: "-81"
1609265-1610892 graycode: interval: "1.62 ms, 614 Hz"
1609265-1610892 graycode: average: "1.57 ms, 636 Hz"
1610892-1612534 graycode: phase: "1"
1610892-1612534 graycode: count: "-82"
1610892-1612534 graycode: interval: "1.64 ms, 609 Hz"
1610892-1612534 graycode: average: "1.58 ms, 631 Hz"
1612534-1614189 graycode: phase: "0"
1612534-1614189 graycode: count: "-83"
1612534-1614189 graycode: interval: "1.65 ms, 604 Hz"
1612534-1614189 graycode: average: "1.59 ms, 626 Hz"
1614189-1615860 graycode: phase: "3"
1614189-1615860 graycode: count: "-84"
1614189-1615860 graycode: interval: "1.67 ms, 598 Hz"
1614189-1615860 graycode: average: "1.60 ms, 621 Hz"
1615860-1617547 graycode: phase: "2"
1615860-1617547 graycode: count: "-85"
1615860-1617547 graycode: interval: "1.68 ms, 592 Hz"
1615860-1617547 graycode: average: "1.62 ms, 616 Hz"
1617547-1619250 graycode: phase: "1"
1617547-1619250 graycode: count: "-86"
1617547-1619250 graycode: interval: "1.70 ms, 587 Hz"
1617547-1619250 graycode: average: "1.63 ms, 611 Hz"
1619250-1620970 graycode: phase: "0"
1619250-1620970 graycode: count: "-87"
1619250-1620970 graycode: interval: "1.72 ms, 581 Hz"
1619250-1620970 graycode: average: "1.65 ms, 605 Hz"
1620970-1622708 graycode: phase: "3"
1620970-1622708 graycode: count: "-88"
1620970-1622708 graycode: interval: "1.73 ms, 575 Hz"
1620970-1622708 graycode: average: "1.66 ms, 600 Hz"
1622708-1624465 graycode: phase: "2"
1622708-1624465 graycode: count: "-89"
1622708-1624465 graycode: interval: "1.75 ms, 569 Hz"
1622708-1624465 graycode: average: "1.68 ms, 594 Hz"
1624465-1626241 graycode: phase: "1"
1624465-1626241 graycode: count: "-90"
1624465-1626241 graycode: interval: "1.77 ms, 563 Hz"
1624465-1626241 graycode: average: "1.69 ms, 589 Hz"
1626241-1628038 graycode: phase: "0"
1626241-1628038 graycode: count: "-91"
1626241-1628038 graycode: interval: "1.79 ms, 556 Hz"
1626241-1628038 graycode: average: "1.71 ms, 583 Hz"
1628038-1629856 graycode: phase: "3"
1628038-1629856 graycode: count: "-92"
1628038-1629856 graycode: interval: "1.81 ms, 550 Hz"
1628038-1629856 graycode: average: "1.73 ms, 577 Hz"
1629856-1631696 graycode: phase: "2"
1629856-1631696 graycode: count: "-93"
1629856-1631696 graycode: interval: "1.84 ms, 543 Hz"
1629856-1631696 graycode: average: "1.75 ms, 571 Hz"
1631696-1633560 graycode: phase: "1"
1631696-1633560 graycode: count: "-94"
1631696-1633560 graycode: interval: "1.86 ms, 536 Hz"
1631696-1633560 graycode: average: "1.77 ms, 564 Hz"
1633560-1635448 graycode: phase: "0"
1633560-1635448 graycode: count: "-95"
1633560-1635448 graycode: interval: "1.88 ms, 529 Hz"
1633560-1635448 graycode: average: "1.79 ms, 558 Hz"
1635448-1637362 graycode: phase: "3"
1635448-1637362 graycode: count: "-96"
1635448-1637362 graycode: interval: "1.91 ms, 522 Hz"
1635448-1637362 graycode: average: "1.81 ms, 552 Hz"
1637362-1639304 graycode: phase: "2"
1637362-1639304 graycode: count: "-97"
1637362-1639304 graycode: interval: "1.94 ms, 514 Hz"
1637362-1639304 graycode: average: "1.83 ms, 545 Hz"
1639304-1641274 graycode: phase: "1"
1639304-1641274 graycode: count: "-98"
1639304-1641274 graycode: interval: "1.97 ms, 507 Hz"
1639304-1641274 graycode: average: "1.85 ms, 538 Hz"
1641274-1643275 graycode: phase: "0"
1641274-1643275 graycode: count: "-99"
1641274-1643275 graycode: interval: "2.00 ms, 499 Hz"
1641274-1643275 graycode: average: "1.88 ms, 531 Hz"
1643275-1645308 graycode: phase: "3"
1643275-1645308 graycode: count: "-100"
1643275-1645308 graycode: interval: "2.03 ms, 491 Hz"
1643275-1645308 graycode: average: "1.90 ms, 524 Hz"
1645308-1647375 graycode: phase: "2"
1645308-1647375 graycode: count: "-101"
1645308-1647375 graycode: interval: "2.06 ms, 483 Hz"
1645308-1647375 graycode: average: "1.93 ms, 517 Hz"
1647375-1649479 graycode: phase: "1"
1647375-1649479 graycode: count: "-102"
1647375-1649479 graycode: interval: "2.10 ms, 475 Hz"
1647375-1649479 graycode: average: "1.96 ms, 509 Hz"
1649479-1651621 graycode: phase: "0"
1649479-1651621 graycode: count: "-103"
1649479-1651621 graycode: interval: "2.14 ms, 466 Hz"
1649479-1651621 graycode: average: "1.99 ms, 501 Hz"
1651621-1653805 graycode: phase: "3"
1651621-1653805 graycode: count: "-104"
1651621-1653805 graycode: interval: "2.18 ms, 457 Hz"
1651621-1653805 graycode: average: "2.02 ms, 493 Hz"
1653805-1656033 graycode: phase: "2"
1653805-1656033 graycode: count: "-105"
1653805-1656033 graycode: interval: "2.22 ms, 448 Hz"
1653805-1656033 graycode: average: "2.05 ms, 485 Hz"
1656033-1658308 graycode: phase: "1"
1656033-1658308 graycode: count: "-106"
1656033-1658308 graycode: interval: "2.27 ms, 439 Hz"
1656033-1658308 graycode: average: "2.09 ms, 477 Hz"
1658308-1660635 graycode: phase: "0"
1658308-1660635 graycode: count: "-107"
1658308-1660635 graycode: interval: "2.32 ms, 429 Hz"
1658308-1660635 graycode: average: "2.13 ms, 468 Hz"
1660635-1663017 graycode: phase: "3"
1660635-1663017 graycode: count: "-108"
1660635-1663017 graycode: interval: "2.38 ms, 419 Hz"
1660635-1663017 graycode: average: "2.17 ms, 459 Hz"
1663017-1665459 graycode: phase: "2"
1663017-1665459 graycode: count: "-109"
1663017-1665459 graycode: interval: "2.44 ms, 409 Hz"
1663017-1665459 graycode: average: "2.21 ms, 450 Hz"
1665459-1667967 graycode: phase: "1"
1665459-1667967 graycode: count: "-110"
1665459-1667967 graycode: interval: "2.50 ms, 398 Hz"
1665459-1667967 graycode: average: "2.26 ms, 441 Hz"
1667967-1670546 graycode: phase: "0"
1667967-1670546 graycode: count: "-111"
1667967-1670546 graycode: interval: "2.57 ms, 387 Hz"
1667967-1670546 graycode: average: "2.31 ms, 431 Hz"
1670546-1673204 graycode: phase: "3"
1670546-1673204 graycode: count: "-112"
1670546-1673204 graycode: interval: "2.65 ms, 376 Hz"
1670546-1673204 graycode: average: "2.37 ms, 421 Hz"
1673204-1675951 graycode: phase: "2"
1673204-1675951 graycode: count: "-113"
1673204-1675951 graycode: interval: "2.74 ms, 364 Hz"
1673204-1675951 graycode: average: "2.43 ms, 411 Hz"
1675951-1678795 graycode: phase: "1"
1675951-1678795 graycode: count: "-114"
1675951-1678795 graycode: interval: "2.84 ms, 351 Hz"
1675951-1678795 graycode: average: "2.49 ms, 400 Hz"
1678795-1681749 graycode: phase: "0"
1678795-1681749 graycode: count: "-115"
1678795-1681749 graycode: interval: "2.95 ms, 338 Hz"
1678795-1681749 graycode: average: "2.57 ms, 388 Hz"
1681749-1684828 graycode: phase: "3"
1681749-1684828 graycode: count: "-116"
1681749-1684828 graycode: interval: "3.07 ms, 324 Hz"
1681749-1684828 graycode: average: "2.65 ms, 377 Hz"
1684828-1688051 graycode: phase: "2"
1684828-1688051 graycode: count: "-117"
1684828-1688051 graycode: interval: "3.22 ms, 310 Hz"
1684828-1688051 graycode: average: "2.74 ms, 364 Hz"
1688051-1691441 graycode: phase: "1"
1688051-1691441 graycode: count: "-118"
1688051-1691441 graycode: interval: "3.39 ms, 294 Hz"
1688051-1691441 graycode: average: "2.84 ms, 351 Hz"
1691441-1695031 graycode: phase: "0"
1691441-1695031 graycode: count: "-119"
1691441-1695031 graycode: interval: "3.59 ms, 278 Hz"
1691441-1695031 graycode: average: "2.95 ms, 338 Hz"
1695031-1698861 graycode: phase: "3"
1695031-1698861 graycode: count: "-120"
1695031-1698861 graycode: interval: "3.83 ms, 261 Hz"
1695031-1698861 graycode: average: "3.08 ms, 323 Hz"
1698861-1702990 graycode: phase: "2"
1698861-1702990 graycode: count: "-121"
1698861-1702990 graycode: interval: "4.12 ms, 242 Hz"
1698861-1702990 graycode: average: "3.24 ms, 308 Hz"
1702990-1707506 graycode: phase: "1"
1702990-1707506 graycode: count: "-122"
1702990-1707506 graycode: interval: "4.51 ms, 221 Hz"
1702990-1707506 graycode: average: "3.43 ms, 291 Hz"
1707506-1712549 graycode: phase: "0"
1707506-1712549 graycode: count: "-123"
1707506-1712549 graycode: interval: "5.04 ms, 198 Hz"
1707506-1712549 graycode: average: "3.65 ms, 273 Hz"
1712549-1718369 graycode: phase: "3"
1712549-1718369 graycode: count: "-124"
1712549-1718369 graycode: interval: "5.82 ms, 171 Hz"
1712549-1718369 graycode: average: "3.95 ms, 252 Hz"
1718369-1725515 graycode: phase: "2"
1718369-1725515 graycode: count: "-125"
1718369-1725515 graycode: interval: "7.14 ms, 139 Hz"
1718369-1725515 graycode: average: "4.37 ms, 228 Hz"
1725515-1735873 graycode: phase: "1"
1725515-1735873 graycode: count: "-126"
1725515-1735873 graycode: interval: "10.3 ms, 96.5 Hz"
1725515-1735873 graycode: average: "5.10 ms, 195 Hz"
1735873-1764128 graycode: phase: "0"
1264128-1764128 graycode: increment: "-1"
1735873-1764128 graycode: count: "-127"
1735873-1764128 graycode: interval: "28.2 ms, 35.3 Hz"
1735873-1764128 graycode: average: "7.60 ms, 131 Hz"
1764128-1774486 graycode: phase: "1"
1764128-1774486 graycode: count: "-126"
1764128-1774486 graycode: interval: "10.3 ms, 96.5 Hz"
1764128-1774486 graycode: average: "8.30 ms, 120 Hz"
1774486-1781632 graycode: phase: "2"
1774486-1781632 graycode: count: "-125"
1774486-1781632 graycode: interval: "7.14 ms, 139 Hz"
1774486-1781632 graycode: average: "8.66 ms, 115 Hz"
1781632-1787452 graycode: phase: "3"
1781632-1787452 graycode: count: "-124"
1781632-1787452 graycode: interval: "5.82 ms, 171 Hz"
1781632-1787452 graycode: average: "8.85 ms, 112 Hz"
1787452-1792495 graycode: phase: "0"
1787452-1792495 graycode: count: "-123"
1787452-1792495 graycode: interval: "5.04 ms, 198 Hz"
1787452-1792495 graycode: average: "8.95 ms, 111 Hz"
1792495-1797011 graycode: phase: "1"
1792495-1797011 graycode: count: "-122"
1792495-1797011 graycode: interval: "4.51 ms, 221 Hz"
1792495-1797011 graycode: average: "8.95 ms, 111 Hz"
1797011-1801140 graycode: phase: "2"
1797011-1801140 graycode: count: "-121"
1797011-1801140 graycode: interval: "4.12 ms, 242 Hz"
1797011-1801140 graycode: average: "8.85 ms, 112 Hz"
1801140-1804970 graycode: phase: "3"
1801140-1804970 graycode: count: "-120"
1801140-1804970 graycode: interval: "3.83 ms, 261 Hz"
1801140-1804970 graycode: average: "8.66 ms, 115 Hz"
1804970-1808560 graycode: phase: "0"
1804970-1808560 graycode: count: "-119"
1804970-1808560 graycode: interval: "3.59 ms, 278 Hz"
1804970-1808560 graycode: average: "8.30 ms, 120 Hz"
1808560-1811950 graycode: phase: "1"
1808560-1811950 graycode: count: "-118"
1808560-1811950 graycode: interval: "3.39 ms, 294 Hz"
1808560-1811950 graycode: average: "7.60 ms, 131 Hz"
1811950-1815173 graycode: phase: "2"
1811950-1815173 graycode: count: "-117"
1811950-1815173 graycode: interval: "3.22 ms, 310 Hz"
1811950-1815173 graycode: average: "5.10 ms, 195 Hz"
1815173-1818252 graycode: phase: "3"
1815173-1818252 graycode: count: "-116"
1815173-1818252 graycode: interval: "3.07 ms, 324 Hz"
1815173-1818252 graycode: average: "4.37 ms, 228 Hz"
1818252-1821206 graycode: phase: "0"
1818252-1821206 graycode: count: "-115"
1818252-1821206 graycode: interval: "2.95 ms, 338 Hz"
1818252-1821206 graycode: average: "3.95 ms, 252 Hz"
1821206-1824050 graycode: phase: "1"
1821206-1824050 graycode: count: "-114"
1821206-1824050 graycode: interval: "2.84 ms, 351 Hz"
1821206-1824050 graycode: average: "3.65 ms, 273 Hz"
1824050-1826797 graycode: phase: "2"
1824050-1826797 graycode: count: "-113"
1824050-1826797 graycode: interval: "2.74 ms, 364 Hz"
1824050-1826797 graycode: average: "3.43 ms, 291 Hz"
1826797-1829455 graycode: phase: "3"
1826797-1829455 graycode: count: "-112"
1826797-1829455 graycode: interval: "2.65 ms, 376 Hz"
1826797-1829455 graycode: average: "3.24 ms, 308 Hz"
1829455-1832034 graycode: phase: "0"
1829455-1832034 graycode: count: "-111"
1829455-1832034 graycode: interval: "2.57 ms, 387 Hz"
1829455-1832034 graycode: average: "3.08 ms, 323 Hz"
1832034-1834542 graycode: phase: "1"
1832034-1834542 graycode: count: "-110"
1832034-1834542 graycode: interval: "2.50 ms, 398 Hz"
1832034-1834542 graycode: average: "2.95 ms, 338 Hz"
1834542-1836984 graycode: phase: "2"
1834542-1836984 graycode: count: "-109"
1834542-1836984 graycode: interval: "2.44 ms, 409 Hz"
1834542-1836984 graycode: average: "2.84 ms, 351 Hz"
1836984-1839366 graycode: phase: "3"
1836984-1839366 graycode: count: "-108"
1836984-1839366 graycode: interval: "2.38 ms, 419 Hz"
1836984-1839366 graycode: average: "2.74 ms, 364 Hz"
1839366-1841693 graycode: phase: "0"
1839366-1841693 graycode: count: "-107"
1839366-1841693 graycode: interval: "2.32 ms, 429 Hz"
1839366-1841693 graycode: average: "2.65 ms, 377 Hz"
1841693-1843968 graycode: phase: "1"
1841693-1843968 graycode: count: "-106"
1841693-1843968 graycode: interval: "2.27 ms, 439 Hz"
1841693-1843968 graycode: average: "2.57 ms, 388 Hz"
1843968-1846196 graycode: phase: "2"
1843968-1846196 graycode: count: "-105"
1843968-1846196 graycode: interval: "2.22 ms, 448 Hz"
1843968-1846196 graycode: average: "2.49 ms, 400 Hz"
1846196-1848380 graycode: phase: "3"
1846196-1848380 graycode: count: "-104"
1846196-1848380 graycode: interval: "2.18 ms, 457 Hz"
1846196-1848380 graycode: average: "2.43 ms, 411 Hz"
1848380-1850522 graycode: phase: "0"
1848380-1850522 graycode: count: "-103"
1848380-1850522 graycode: interval: "2.14 ms, 466 Hz"
1848380-1850522 graycode: average: "2.37 ms, 421 Hz"
1850522-1852626 graycode: phase: "1"
1850522-1852626 graycode: count: "-102"
1850522-1852626 graycode: interval: "2.10 ms, 475 Hz"
1850522-1852626 graycode: average: "2.31 ms, 431 Hz"
1852626-1854693 graycode: phase: "2"
1852626-1854693 graycode: count: "-101"
1852626-1854693 graycode: interval: "2.06 ms, 483 Hz"
1852626-1854693 graycode: average: "2.26 ms, 441 Hz"
1854693-1856726 graycode: phase: "3"
1854693-1856726 graycode: count: "-100"
1854693-1856726 graycode: interval: "2.03 ms, 491 Hz"
1854693-1856726 graycode: average: "2.21 ms, 450 Hz"
1856726-1858727 graycode: phase: "0"
1856726-1858727 graycode: count: "-99"
1856726-1858727 graycode: interval: "2.00 ms, 499 Hz"
1856726-1858727 graycode: average: "2.17 ms, 459 Hz"
1858727-1860697 graycode: phase: "1"
1858727-1860697 graycode: count: "-98"
1858727-1860697 graycode: interval: "1.97 ms, 507 Hz"
1858727-1860697 graycode: average: "2.13 ms, 468 Hz"
1860697-1862639 graycode: phase: "2"
1860697-1862639 graycode: count: "-97"
1860697-1862639 graycode: interval: "1.94 ms, 514 Hz"
1860697-1862639 graycode: average: "2.09 ms, 477 Hz"
1862639-1864553 graycode: phase: "3"
1862639-1864553 graycode: count: "-96"
1862639-1864553 graycode: interval: "1.91 ms, 522 Hz"
1862639-1864553 graycode: average: "2.05 ms, 485 Hz"
1864553-1866441 graycode: phase: "0"
1864553-1866441 graycode: count: "-95"
1864553-1866441 graycode: interval: "1.88 ms, 529 Hz"
1864553-1866441 graycode: average: "2.02 ms, 493 Hz"
1866441-1868305 graycode: phase: "1"
1866441-1868305 graycode: count: "-94"
1866441-1868305 graycode: interval: "1.86 ms, 536 Hz"
1866441-1868305 graycode: average: "1.99 ms, 501 Hz"
1868305-1870145 graycode: phase: "2"
1868305-1870145 graycode: count: "-93"
1868305-1870145 graycode: interval: "1.84 ms, 543 Hz"
1868305-1870145 graycode: average: "1.96 ms, 509 Hz"
1870145-1871963 graycode: phase: "3"
1870145-1871963 graycode: count: "-92"
1870145-1871963 graycode: interval: "1.81 ms, 550 Hz"
1870145-1871963 graycode: average: "1.93 ms, 517 Hz"
1871963-1873760 graycode: phase: "0"
1871963-1873760 graycode: count: "-91"
1871963-1873760 graycode: interval: "1.79 ms, 556 Hz"
1871963-1873760 graycode: average: "1.90 ms, 524 Hz"
1873760-1875536 graycode: phase: "1"
1873760-1875536 graycode: count: "-90"
1873760-1875536 graycode: interval: "1.77 ms, 563 Hz"
1873760-1875536 graycode: average: "1.88 ms, 531 Hz"
1875536-1877293 graycode: phase: "2"
1875536-1877293 graycode: count: "-89"
1875536-1877293 graycode: interval: "1.75 ms, 569 Hz"
1875536-1877293 graycode: average: "1.85 ms, 538 Hz"
1877293-1879031 graycode: phase: "3"
1877293-1879031 graycode: count: "-88"
1877293-1879031 graycode: interval: "1.73 ms, 575 Hz"
1877293-1879031 graycode: average: "1.83 ms, 545 Hz"
1879031-1880751 graycode: phase: "0"
1879031-1880751 graycode: count: "-87"
1879031-1880751 graycode: interval: "1.72 ms, 581 Hz"
1879031-1880751 graycode: average: "1.81 ms, 552 Hz"
1880751-1882454 graycode: phase: "1"
1880751-1882454 graycode: count: "-86"
1880751-1882454 graycode: interval: "1.70 ms, 587 Hz"
1880751-1882454 graycode: average: "1.79 ms, 558 Hz"
1882454-1884141 graycode: phase: "2"
1882454-1884141 graycode: count: "-85"
1882454-1884141 graycode: interval: "1.68 ms, 592 Hz"
1882454-1884141 graycode: average: "1.77 ms, 564 Hz"
1884141-1885812 graycode: phase: "3"
1884141-1885812 graycode: count: "-84"
1884141-1885812 graycode: interval: "1.67 ms, 598 Hz"
1884141-1885812 graycode: average: "1.75 ms, 571 Hz"
1885812-1887467 graycode: phase: "0"
1885812-1887467 graycode: count: "-83"
1885812-1887467 graycode: interval: "1.65 ms, 604 Hz"
1885812-1887467 graycode: average: "1.73 ms, 577 Hz"
1887467-1889109 graycode: phase: "1"
1887467-1889109 graycode: count: "-82"
1887467-1889109 graycode: interval: "1.64 ms, 609 Hz"
1887467-1889109 graycode: average: "1.71 ms, 583 Hz"
1889109-1890736 graycode: phase: "2"
1889109-1890736 graycode: count: "-81"
1889109-1890736 graycode: interval: "1.62 ms, 614 Hz"
1889109-1890736 graycode: average: "1.69 ms, 589 Hz"
1890736-1892349 graycode: phase: "3"
1890736-1892349 graycode: count: "-80"
1890736-1892349 graycode: interval: "1.61 ms, 619 Hz"
1890736-1892349 graycode: average: "1.68 ms, 594 Hz"
1892349-1893950 graycode: phase: "0"
1892349-1893950 graycode: count: "-79"
1892349-1893950 graycode: interval: "1.60 ms, 624 Hz"
1892349-1893950 graycode: average: "1.66 ms, 600 Hz"
1893950-1895538 graycode: phase: "1"
1893950-1895538 graycode: count: "-78"
1893950-1895538 graycode: interval: "1.58 ms, 629 Hz"
1893950-1895538 graycode: average: "1.65 ms, 605 Hz"
1895538-1897114 graycode: phase: "2"
1895538-1897114 graycode: count: "-77"
1895538-1897114 graycode: interval: "1.57 ms, 634 Hz"
1895538-1897114 graycode: average: "1.63 ms, 611 Hz"
1897114-1898678 graycode: phase: "3"
1897114-1898678 graycode: count: "-76"
1897114-1898678 graycode: interval: "1.56 ms, 639 Hz"
1897114-1898678 graycode: average: "1.62 ms, 616 Hz"
1898678-1900231 graycode: phase: "0"
1898678-1900231 graycode: count: "-75"
1898678-1900231 graycode: interval: "1.55 ms, 643 Hz"
1898678-1900231 graycode: average: "1.60 ms, 621 Hz"
1900231-1901773 graycode: phase: "1"
1900231-1901773 graycode: count: "-74"
1900231-1901773 graycode: interval: "1.54 ms, 648 Hz"
1900231-1901773 graycode: average: "1.59 ms, 626 Hz"
1901773-1903304 graycode: phase: "2"
1901773-1903304 graycode: count: "-73"
1901773-1903304 graycode: interval: "1.53 ms, 653 Hz"
1901773-1903304 graycode: average: "1.58 ms, 631 Hz"
1903304-1904826 graycode: phase: "3"
1903304-1904826 graycode: count: "-72"
1903304-1904826 graycode: interval: "1.52 ms, 657 Hz"
1903304-1904826 graycode: average: "1.57 ms, 636 Hz"
1904826-1906337 graycode: phase: "0"
1904826-1906337 graycode: count: "-71"
1904826-1906337 graycode: interval: "1.51 ms, 661 Hz"
1904826-1906337 graycode: average: "1.56 ms, 640 Hz"
1906337-1907839 graycode: phase: "1"
1906337-1907839 graycode: count: "-70"
1906337-1907839 graycode: interval: "1.50 ms, 665 Hz"
1906337-1907839 graycode: average: "1.54 ms, 645 Hz"
1907839-1909332 graycode: phase: "2"
1907839-1909332 graycode: count: "-69"
1907839-1909332 graycode: interval: "1.49 ms, 669 Hz"
1907839-1909332 graycode: average: "1.53 ms, 650 Hz"
1909332-1910816 graycode: phase: "3"
1909332-1910816 graycode: count: "-68"
1909332-1910816 graycode: interval: "1.48 ms, 673 Hz"
1909332-1910816 graycode: average: "1.52 ms, 654 Hz"
1910816-1912291 graycode: phase: "0"
1910816-1912291 graycode: count: "-67"
1910816-1912291 graycode: interval: "1.47 ms, 677 Hz"
1910816-1912291 graycode: average: "1.51 ms, 658 Hz"
1912291-1913758 graycode: phase: "1"
1912291-1913758 graycode: count: "-66"
1912291-1913758 graycode: interval: "1.46 ms, 681 Hz"
1912291-1913758 graycode: average: "1.50 ms, 663 Hz"
1913758-1915216 graycode: phase: "2"
1913758-1915216 graycode: count: "-65"
1913758-1915216 graycode: interval: "1.45 ms, 685 Hz"
1913758-1915216 graycode: average: "1.49 ms, 667 Hz"
1915216-1916667 graycode: phase: "3"
1915216-1916667 graycode: count: "-64"
1915216-1916667 graycode: interval: "1.45 ms, 689 Hz"
1915216-1916667 graycode: average: "1.48 ms, 671 Hz"
1916667-1918110 graycode: phase: "0"
1916667-1918110 graycode: count: "-63"
1916667-1918110 graycode: interval: "1.44 ms, 693 Hz"
1916667-1918110 graycode: average: "1.48 ms, 675 Hz"
1918110-1919546 graycode: phase: "1"
1918110-1919546 graycode: count: "-62"
1918110-1919546 graycode: interval: "1.43 ms, 696 Hz"
1918110-1919546 graycode: average: "1.47 ms, 679 Hz"
1919546-1920975 graycode: phase: "2"
1919546-1920975 graycode: count: "-61"
1919546-1920975 graycode: interval: "1.42 ms, 699 Hz"
1919546-1920975 graycode: average: "1.46 ms, 683 Hz"
1920975-1922397 graycode: phase: "3"
1920975-1922397 graycode: count: "-60"
1920975-1922397 graycode: interval: "1.42 ms, 703 Hz"
1920975-1922397 graycode: average: "1.45 ms, 686 Hz"
1922397-1923812 graycode: phase: "0"
1922397-1923812 graycode: count: "-59"
1922397-1923812 graycode: interval: "1.41 ms, 706 Hz"
1922397-1923812 graycode: average: "1.44 ms, 690 Hz"
1923812-1925221 graycode: phase: "1"
1923812-1925221 graycode: count: "-58"
1923812-1925221 graycode: interval: "1.40 ms, 709 Hz"
1923812-1925221 graycode: average: "1.44 ms, 694 Hz"
1925221-1926623 graycode: phase: "2"
1925221-1926623 graycode: count: "-57"
1925221-1926623 graycode: interval: "1.40 ms, 713 Hz"
1925221-1926623 graycode: average: "1.43 ms, 697 Hz"
1926623-1928020 graycode: phase: "3"
1926623-1928020 graycode: count: "-56"
1926623-1928020 graycode: interval: "1.39 ms, 715 Hz"
1926623-1928020 graycode: average: "1.42 ms, 701 Hz"
1928020-1929410 graycode: phase: "0"
1928020-1929410 graycode: count: "-55"
1928020-1929410 graycode: interval: "1.39 ms, 719 Hz"
1928020-1929410 graycode: average: "1.41 ms, 704 Hz"
1929410-1930795 graycode: phase: "1"
1929410-1930795 graycode: count: "-54"
1929410-1930795 graycode: interval: "1.38 ms, 722 Hz"
1929410-1930795 graycode: average: "1.41 ms, 707 Hz"
1930795-1932174 graycode: phase: "2"
1930795-1932174 graycode: count: "-53"
1930795-1932174 graycode: interval: "1.37 ms, 725 Hz"
1930795-1932174 graycode: average: "1.40 ms, 711 Hz"
1932174-1933547 graycode: phase: "3"
1932174-1933547 graycode: count: "-52"
1932174-1933547 graycode: interval: "1.37 ms, 728 Hz"
1932174-1933547 graycode: average: "1.40 ms, 714 Hz"
1933547-1934916 graycode: phase: "0"
1933547-1934916 graycode: count: "-51"
1933547-1934916 graycode: interval: "1.36 ms, 730 Hz"
1933547-1934916 graycode: average: "1.39 ms, 717 Hz"
1934916-1936279 graycode: phase: "1"
1934916-1936279 graycode: count: "-50"
1934916-1936279 graycode: interval: "1.36 ms, 733 Hz"
1934916-1936279 graycode: average: "1.38 ms, 720 Hz"
1936279-1937637 graycode: phase: "2"
1936279-1937637 graycode: count: "-49"
1936279-1937637 graycode: interval: "1.35 ms, 736 Hz"
1936279-1937637 graycode: average: "1.38 ms, 723 Hz"
1937637-1938991 graycode: phase: "3"
1937637-1938991 graycode: count: "-48"
1937637-1938991 graycode: interval: "1.35 ms, 738 Hz"
1937637-1938991 graycode: average: "1.37 ms, 726 Hz"
1938991-1940340 graycode: phase: "0"
1938991-1940340 graycode: count: "-47"
1938991-1940340 graycode: interval: "1.34 ms, 741 Hz"
1938991-1940340 graycode: average: "1.37 ms, 729 Hz"
1940340-1941684 graycode: phase: "1"
1940340-1941684 graycode: count: "-46"
1940340-1941684 graycode: interval: "1.34 ms, 744 Hz"
1940340-1941684 graycode: average: "1.36 ms, 731 Hz"
1941684-1943024 graycode: phase: "2"
1941684-1943024 graycode: count: "-45"
1941684-1943024 graycode: interval: "1.34 ms, 746 Hz"
1941684-1943024 graycode: average: "1.36 ms, 734 Hz"
1943024-1944360 graycode: phase: "3"
1943024-1944360 graycode: count: "-44"
1943024-1944360 graycode: interval: "1.33 ms, 748 Hz"
1943024-1944360 graycode: average: "1.35 ms, 737 Hz"
1944360-1945692 graycode: phase: "0"
1944360-1945692 graycode: count: "-43"
1944360-1945692 graycode: interval: "1.33 ms, 750 Hz"
1944360-1945692 graycode: average: "1.35 ms, 739 Hz"
1945692-1947020 graycode: phase: "1"
1945692-1947020 graycode: count: "-42"
1945692-1947020 graycode: interval: "1.32 ms, 753 Hz"
1945692-1947020 graycode: average: "1.34 ms, 742 Hz"
1947020-1948344 graycode: phase: "2"
1947020-1948344 graycode: count: "-41"
1947020-1948344 graycode: interval: "1.32 ms, 755 Hz"
1947020-1948344 graycode: average: "1.34 ms, 744 Hz"
1948344-1949665 graycode: phase: "3"
1948344-1949665 graycode: count: "-40"
1948344-1949665 graycode: interval: "1.32 ms, 757 Hz"
1948344-1949665 graycode: average: "1.33 ms, 747 Hz"
1949665-1950981 graycode: phase: "0"
1949665-1950981 graycode: count: "-39"
1949665-1950981 graycode: interval: "1.31 ms, 759 Hz"
1949665-1950981 graycode: average: "1.33 ms, 749 Hz"
1950981-1952295 graycode: phase: "1"
1950981-1952295 graycode: count: "-38"
1950981-1952295 graycode: interval: "1.31 ms, 761 Hz"
1950981-1952295 graycode: average: "1.33 ms, 751 Hz"
1952295-1953605 graycode: phase: "2"
1952295-1953605 graycode: count: "-37"
1952295-1953605 graycode: interval: "1.31 ms, 763 Hz"
1952295-1953605 graycode: average: "1.32 ms, 753 Hz"
1953605-1954912 graycode: phase: "3"
1953605-1954912 graycode: count: "-36"
1953605-1954912 graycode: interval: "1.30 ms, 765 Hz"
1953605-1954912 graycode: average: "1.32 ms, 755 Hz"
1954912-1956215 graycode: phase: "0"
1954912-1956215 graycode: count: "-35"
1954912-1956215 graycode: interval: "1.30 ms, 767 Hz"
1954912-1956215 graycode: average: "1.31 ms, 758 Hz"
1956215-1957516 graycode: phase: "1"
1956215-1957516 graycode: count: "-34"
1956215-1957516 graycode: interval: "1.30 ms, 768 Hz"
1956215-1957516 graycode: average: "1.31 ms, 760 Hz"
1957516-1958814 graycode: phase: "2"
1957516-1958814 graycode: count: "-33"
1957516-1958814 graycode: interval: "1.29 ms, 770 Hz"
1957516-1958814 graycode: average: "1.31 ms, 762 Hz"
1958814-1960109 graycode: phase: "3"
1958814-1960109 graycode: count: "-32"
1958814-1960109 graycode: interval: "1.29 ms, 772 Hz"
1958814-1960109 graycode: average: "1.30 ms, 764 Hz"
1960109-1961401 graycode: phase: "0"
1960109-1961401 graycode: count: "-31"
1960109-1961401 graycode: interval: "1.29 ms, 773 Hz"
1960109-1961401 graycode: average: "1.30 ms, 765 Hz"
1961401-1962691 graycode: phase: "1"
1961401-1962691 graycode: count: "-30"
1961401-1962691 graycode: interval: "1.29 ms, 775 Hz"
1961401-1962691 graycode: average: "1.30 ms, 767 Hz"
1962691-1963978 graycode: phase: "2"
1962691-1963978 graycode: count: "-29"
1962691-1963978 graycode: interval: "1.28 ms, 777 Hz"
1962691-1963978 graycode: average: "1.29 ms, 769 Hz"
1963978-1965263 graycode: phase: "3"
1963978-1965263 graycode: count: "-28"
1963978-1965263 graycode: interval: "1.28 ms, 778 Hz"
1963978-1965263 graycode: average: "1.29 ms, 771 Hz"
1965263-1966545 graycode: phase: "0"
1965263-1966545 graycode: count: "-27"
1965263-1966545 graycode: interval: "1.28 ms, 780 Hz"
1965263-1966545 graycode: average: "1.29 ms, 772 Hz"
1966545-1967825 graycode: phase: "1"
1966545-1967825 graycode: count: "-26"
1966545-1967825 graycode: interval: "1.28 ms, 781 Hz"
1966545-1967825 graycode: average: "1.29 ms, 774 Hz"
1967825-1969104 graycode: phase: "2"
1967825-1969104 graycode: count: "-25"
1967825-1969104 graycode: interval: "1.27 ms, 781 Hz"
1967825-1969104 graycode: average: "1.28 ms, 775 Hz"
1969104-1970380 graycode: phase: "3"
1969104-1970380 graycode: count: "-24"
1969104-1970380 graycode: interval: "1.27 ms, 783 Hz"
1969104-1970380 graycode: average: "1.28 ms, 777 Hz"
1970380-1971654 graycode: phase: "0"
1970380-1971654 graycode: count: "-23"
1970380-1971654 graycode: interval: "1.27 ms, 784 Hz"
1970380-1971654 graycode: average: "1.28 ms, 778 Hz"
1971654-1972927 graycode: phase: "1"
1971654-1972927 graycode: count: "-22"
1971654-1972927 graycode: interval: "1.27 ms, 785 Hz"
1971654-1972927 graycode: average: "1.28 ms, 780 Hz"
1972927-1974197 graycode: phase: "2"
1972927-1974197 graycode: count: "-21"
1972927-1974197 graycode: interval: "1.27 ms, 787 Hz"
1972927-1974197 graycode: average: "1.27 ms, 781 Hz"
1974197-1975466 graycode: phase: "3"
1974197-1975466 graycode: count: "-20"
1974197-1975466 graycode: interval: "1.26 ms, 788 Hz"
1974197-1975466 graycode: average: "1.27 ms, 782 Hz"
1975466-1976734 graycode: phase: "0"
1975466-1976734 graycode: count: "-19"
1975466-1976734 graycode: interval: "1.26 ms, 788 Hz"
1975466-1976734 graycode: average: "1.27 ms, 783 Hz"
1976734-1978000 graycode: phase: "1"
1976734-1978000 graycode: count: "-18"
1976734-1978000 graycode: interval: "1.26 ms, 789 Hz"
1976734-1978000 graycode: average: "1.27 ms, 785 Hz"
1978000-1979264 graycode: phase: "2"
1978000-1979264 graycode: count: "-17"
1978000-1979264 graycode: interval: "1.26 ms, 791 Hz"
1978000-1979264 graycode: average: "1.27 ms, 786 Hz"
1979264-1980528 graycode: phase: "3"
1979264-1980528 graycode: count: "-16"
1979264-1980528 graycode: interval: "1.26 ms, 791 Hz"
1979264-1980528 graycode: average: "1.27 ms, 787 Hz"
1980528-1981790 graycode: phase: "0"
1980528-1981790 graycode: count: "-15"
1980528-1981790 graycode: interval: "1.26 ms, 792 Hz"
1980528-1981790 graycode: average: "1.26 ms, 788 Hz"
1981790-1983050 graycode: phase: "1"
1981790-1983050 graycode: count: "-14"
1981790-1983050 graycode: interval: "1.26 ms, 793 Hz"
1981790-1983050 graycode: average: "1.26 ms, 789 Hz"
1983050-1984310 graycode: phase: "2"
1983050-1984310 graycode: count: "-13"
1983050-1984310 graycode: interval: "1.26 ms, 793 Hz"
1983050-1984310 graycode: average: "1.26 ms, 790 Hz"
1984310-1985569 graycode: phase: "3"
1984310-1985569 graycode: count: "-12"
1984310-1985569 graycode: interval: "1.25 ms, 794 Hz"
1984310-1985569 graycode: average: "1.26 ms, 791 Hz"
1985569-1986827 graycode: phase: "0"
1985569-1986827 graycode: count: "-11"
1985569-1986827 graycode: interval: "1.25 ms, 794 Hz"
1985569-1986827 graycode: average: "1.26 ms, 791 Hz"
1986827-1988084 graycode: phase: "1"
1986827-1988084 graycode: count: "-10"
1986827-1988084 graycode: interval: "1.25 ms, 795 Hz"
1986827-1988084 graycode: average: "1.26 ms, 792 Hz"
1988084-1989340 graycode: phase: "2"
1988084-1989340 graycode: count: "-9"
1988084-1989340 graycode: interval: "1.25 ms, 796 Hz"
1988084-1989340 graycode: average: "1.26 ms, 793 Hz"
1989340-1990596 graycode: phase: "3"
1989340-1990596 graycode: count: "-8"
1989340-1990596 graycode: interval: "1.25 ms, 796 Hz"
1989340-1990596 graycode: average: "1.25 ms, 793 Hz"
1990596-1991851 graycode: phase: "0"
1990596-1991851 graycode: count: "-7"
1990596-1991851 graycode: interval: "1.25 ms, 796 Hz"
1990596-1991851 graycode: average: "1.25 ms, 794 Hz"
1991851-1993106 graycode: phase: "1"
1991851-1993106 graycode: count: "-6"
1991851-1993106 graycode: interval: "1.25 ms, 796 Hz"
1991851-1993106 graycode: average: "1.25 ms, 795 Hz"
1993106-1994360 graycode: phase: "2"
1993106-1994360 graycode: count: "-5"
1993106-1994360 graycode: interval: "1.25 ms, 797 Hz"
1993106-1994360 graycode: average: "1.25 ms, 795 Hz"
1994360-1995614 graycode: phase: "3"
1994360-1995614 graycode: count: "-4"
1994360-1995614 graycode: interval: "1.25 ms, 797 Hz"
1994360-1995614 graycode: average: "1.25 ms, 795 Hz"
1995614-1996867 graycode: phase: "0"
1995614-1996867 graycode: count: "-3"
1995614-1996867 graycode: interval: "1.25 ms, 798 Hz"
1995614-1996867 graycode: average: "1.25 ms, 796 Hz"
1996867-1998121 graycode: phase: "1"
1996867-1998121 graycode: count: "-2"
1996867-1998121 graycode: interval: "1.25 ms, 797 Hz"
1996867-1998121 graycode: average: "1.25 ms, 796 Hz"
1998121-1999374 graycode: phase: "2"
1998121-1999374 graycode: count: "-1"
1998121-1999374 graycode: interval: "1.25 ms, 798 Hz"
1998121-1999374 graycode: average: "1.25 ms, 797 Hz"
