92666-92670 adxl345: read: "READ REG" "READ" "R"
92670-92674 adxl345: mb: "MULTIPLE BYTES" "MULTI BYTES" "n*BYTES" "n*B"
92674-92698 adxl345: reg-address: "ADDRESS: 0x32" "ADDR: 0x32" "0x32"
92698-92730 adxl345: reg-address: "DATAX0" "DX0" "X0"
92698-92730 adxl345: reg-data: "207"
92730-92762 adxl345: reg-address: "DATAX1" "DX1" "X1"
92698-92762 adxl345: reg-data: "X: 0xFFCF" "65280"
92762-92794 adxl345: reg-address: "DATAY0" "DY0" "Y0"
92762-92794 adxl345: reg-data: "233"
92794-92826 adxl345: reg-address: "DATAY1" "DY1" "Y1"
92762-92826 adxl345: reg-data: "Y: 0x00E9" "0"
92826-92858 adxl345: reg-address: "DATAZ0" "DZ0" "Z0"
92826-92858 adxl345: reg-data: "145"
92858-92890 adxl345: reg-address: "DATAZ1" "DZ1" "Z1"
92826-92890 adxl345: reg-data: "Z: 0xFF91" "65280"
108670-108674 adxl345: read: "READ REG" "READ" "R"
108674-108678 adxl345: mb: "MULTIPLE BYTES" "MULTI BYTES" "n*BYTES" "n*B"
108678-108702 adxl345: reg-address: "ADDRESS: 0x32" "ADDR: 0x32" "0x32"
108702-108734 adxl345: reg-address: "DATAX0" "DX0" "X0"
108702-108734 adxl345: reg-data: "207"
108734-108766 adxl345: reg-address: "DATAX1" "DX1" "X1"
108702-108766 adxl345: reg-data: "X: 0xFFCF" "65280"
108766-108798 adxl345: reg-address: "DATAY0" "DY0" "Y0"
108766-108798 adxl345: reg-data: "233"
108798-108830 adxl345: reg-address: "DATAY1" "DY1" "Y1"
108766-108830 adxl345: reg-data: "Y: 0x00E9" "0"
108830-108862 adxl345: reg-address: "DATAZ0" "DZ0" "Z0"
108830-108862 adxl345: reg-data: "145"
108862-108894 adxl345: reg-address: "DATAZ1" "DZ1" "Z1"
108830-108894 adxl345: reg-data: "Z: 0xFF91" "65280"
117601-117605 adxl345: read: "READ REG" "READ" "R"
117605-117609 adxl345: mb: "MULTIPLE BYTES" "MULTI BYTES" "n*BYTES" "n*B"
117609-117633 adxl345: reg-address: "ADDRESS: 0x32" "ADDR: 0x32" "0x32"
117633-117665 adxl345: reg-address: "DATAX0" "DX0" "X0"
117633-117665 adxl345: reg-data: "207"
117665-117697 adxl345: reg-address: "DATAX1" "DX1" "X1"
117633-117697 adxl345: reg-data: "X: 0xFFCF" "65280"
117697-117729 adxl345: reg-address: "DATAY0" "DY0" "Y0"
117697-117729 adxl345: reg-data: "234"
117729-117761 adxl345: reg-address: "DATAY1" "DY1" "Y1"
117697-117761 adxl345: reg-data: "Y: 0x00EA" "0"
117761-117793 adxl345: reg-address: "DATAZ0" "DZ0" "Z0"
117761-117793 adxl345: reg-data: "144"
117793-117825 adxl345: reg-address: "DATAZ1" "DZ1" "Z1"
117761-117825 adxl345: reg-data: "Z: 0xFF90" "65280"
126618-126622 adxl345: read: "READ REG" "READ" "R"
126622-126626 adxl345: mb: "MULTIPLE BYTES" "MULTI BYTES" "n*BYTES" "n*B"
126626-126650 adxl345: reg-address: "ADDRESS: 0x32" "ADDR: 0x32" "0x32"
126650-126682 adxl345: reg-address: "DATAX0" "DX0" "X0"
126650-126682 adxl345: reg-data: "206"
126682-126714 adxl345: reg-address: "DATAX1" "DX1" "X1"
126650-126714 adxl345: reg-data: "X: 0xFFCE" "65280"
126714-126746 adxl345: reg-address: "DATAY0" "DY0" "Y0"
126714-126746 adxl345: reg-data: "232"
126746-126778 adxl345: reg-address: "DATAY1" "DY1" "Y1"
126714-126778 adxl345: reg-data: "Y: 0x00E8" "0"
126778-126810 adxl345: reg-address: "DATAZ0" "DZ0" "Z0"
126778-126810 adxl345: reg-data: "144"
126810-126842 adxl345: reg-address: "DATAZ1" "DZ1" "Z1"
126778-126842 adxl345: reg-data: "Z: 0xFF90" "65280"
136889-136893 adxl345: read: "READ REG" "READ" "R"
136893-136897 adxl345: mb: "MULTIPLE BYTES" "MULTI BYTES" "n*BYTES" "n*B"
136897-136921 adxl345: reg-address: "ADDRESS: 0x32" "ADDR: 0x32" "0x32"
136921-136953 adxl345: reg-address: "DATAX0" "DX0" "X0"
136921-136953 adxl345: reg-data: "208"
136953-136985 adxl345: reg-address: "DATAX1" "DX1" "X1"
136921-136985 adxl345: reg-data: "X: 0xFFD0" "65280"
136985-137017 adxl345: reg-address: "DATAY0" "DY0" "Y0"
136985-137017 adxl345: reg-data: "234"
137017-137049 adxl345: reg-address: "DATAY1" "DY1" "Y1"
136985-137049 adxl345: reg-data: "Y: 0x00EA" "0"
137049-137081 adxl345: reg-address: "DATAZ0" "DZ0" "Z0"
137049-137081 adxl345: reg-data: "147"
137081-137113 adxl345: reg-address: "DATAZ1" "DZ1" "Z1"
137049-137113 adxl345: reg-data: "Z: 0xFF93" "65280"
145963-145967 adxl345: read: "READ REG" "READ" "R"
145967-145971 adxl345: mb: "MULTIPLE BYTES" "MULTI BYTES" "n*BYTES" "n*B"
145971-145995 adxl345: reg-address: "ADDRESS: 0x32" "ADDR: 0x32" "0x32"
145995-146027 adxl345: reg-address: "DATAX0" "DX0" "X0"
145995-146027 adxl345: reg-data: "209"
146027-146059 adxl345: reg-address: "DATAX1" "DX1" "X1"
145995-146059 adxl345: reg-data: "X: 0xFFD1" "65280"
146059-146091 adxl345: reg-address: "DATAY0" "DY0" "Y0"
146059-146091 adxl345: reg-data: "236"
146091-146123 adxl345: reg-address: "DATAY1" "DY1" "Y1"
146059-146123 adxl345: reg-data: "Y: 0x00EC" "0"
146123-146155 adxl345: reg-address: "DATAZ0" "DZ0" "Z0"
146123-146155 adxl345: reg-data: "145"
146155-146187 adxl345: reg-address: "DATAZ1" "DZ1" "Z1"
146123-146187 adxl345: reg-data: "Z: 0xFF91" "65280"
156299-156303 adxl345: read: "READ REG" "READ" "R"
156303-156307 adxl345: mb: "MULTIPLE BYTES" "MULTI BYTES" "n*BYTES" "n*B"
156307-156331 adxl345: reg-address: "ADDRESS: 0x32" "ADDR: 0x32" "0x32"
156331-156363 adxl345: reg-address: "DATAX0" "DX0" "X0"
156331-156363 adxl345: reg-data: "208"
156363-156395 adxl345: reg-address: "DATAX1" "DX1" "X1"
156331-156395 adxl345: reg-data: "X: 0xFFD0" "65280"
156395-156427 adxl345: reg-address: "DATAY0" "DY0" "Y0"
156395-156427 adxl345: reg-data: "236"
156427-156459 adxl345: reg-address: "DATAY1" "DY1" "Y1"
156395-156459 adxl345: reg-data: "Y: 0x00EC" "0"
156459-156491 adxl345: reg-address: "DATAZ0" "DZ0" "Z0"
156459-156491 adxl345: reg-data: "146"
156491-156523 adxl345: reg-address: "DATAZ1" "DZ1" "Z1"
156459-156523 adxl345: reg-data: "Z: 0xFF92" "65280"
165504-165508 adxl345: read: "READ REG" "READ" "R"
165508-165512 adxl345: mb: "MULTIPLE BYTES" "MULTI BYTES" "n*BYTES" "n*B"
165512-165536 adxl345: reg-address: "ADDRESS: 0x32" "ADDR: 0x32" "0x32"
165536-165568 adxl345: reg-address: "DATAX0" "DX0" "X0"
165536-165568 adxl345: reg-data: "208"
165568-165600 adxl345: reg-address: "DATAX1" "DX1" "X1"
165536-165600 adxl345: reg-data: "X: 0xFFD0" "65280"
165600-165632 adxl345: reg-address: "DATAY0" "DY0" "Y0"
165600-165632 adxl345: reg-data: "236"
165632-165664 adxl345: reg-address: "DATAY1" "DY1" "Y1"
165600-165664 adxl345: reg-data: "Y: 0x00EC" "0"
165664-165696 adxl345: reg-address: "DATAZ0" "DZ0" "Z0"
165664-165696 adxl345: reg-data: "146"
165696-165728 adxl345: reg-address: "DATAZ1" "DZ1" "Z1"
165664-165728 adxl345: reg-data: "Z: 0xFF92" "65280"
175924-175928 adxl345: read: "READ REG" "READ" "R"
175928-175932 adxl345: mb: "MULTIPLE BYTES" "MULTI BYTES" "n*BYTES" "n*B"
175932-175956 adxl345: reg-address: "ADDRESS: 0x32" "ADDR: 0x32" "0x32"
175956-175988 adxl345: reg-address: "DATAX0" "DX0" "X0"
175956-175988 adxl345: reg-data: "207"
175988-176020 adxl345: reg-address: "DATAX1" "DX1" "X1"
175956-176020 adxl345: reg-data: "X: 0xFFCF" "65280"
176020-176052 adxl345: reg-address: "DATAY0" "DY0" "Y0"
176020-176052 adxl345: reg-data: "232"
176052-176084 adxl345: reg-address: "DATAY1" "DY1" "Y1"
176020-176084 adxl345: reg-data: "Y: 0x00E8" "0"
176084-176116 adxl345: reg-address: "DATAZ0" "DZ0" "Z0"
176084-176116 adxl345: reg-data: "144"
176116-176148 adxl345: reg-address: "DATAZ1" "DZ1" "Z1"
176084-176148 adxl345: reg-data: "Z: 0xFF90" "65280"
185749-185753 adxl345: read: "READ REG" "READ" "R"
185753-185757 adxl345: mb: "MULTIPLE BYTES" "MULTI BYTES" "n*BYTES" "n*B"
185757-185781 adxl345: reg-address: "ADDRESS: 0x32" "ADDR: 0x32" "0x32"
185781-185813 adxl345: reg-address: "DATAX0" "DX0" "X0"
185781-185813 adxl345: reg-data: "207"
185813-185845 adxl345: reg-address: "DATAX1" "DX1" "X1"
185781-185845 adxl345: reg-data: "X: 0xFFCF" "65280"
185845-185877 adxl345: reg-address: "DATAY0" "DY0" "Y0"
185845-185877 adxl345: reg-data: "234"
185877-185909 adxl345: reg-address: "DATAY1" "DY1" "Y1"
185845-185909 adxl345: reg-data: "Y: 0x00EA" "0"
185909-185941 adxl345: reg-address: "DATAZ0" "DZ0" "Z0"
185909-185941 adxl345: reg-data: "146"
185941-185973 adxl345: reg-address: "DATAZ1" "DZ1" "Z1"
185909-185973 adxl345: reg-data: "Z: 0xFF92" "65280"
195593-195597 adxl345: read: "READ REG" "READ" "R"
195597-195601 adxl345: mb: "MULTIPLE BYTES" "MULTI BYTES" "n*BYTES" "n*B"
195601-195625 adxl345: reg-address: "ADDRESS: 0x32" "ADDR: 0x32" "0x32"
195625-195657 adxl345: reg-address: "DATAX0" "DX0" "X0"
195625-195657 adxl345: reg-data: "208"
195657-195689 adxl345: reg-address: "DATAX1" "DX1" "X1"
195625-195689 adxl345: reg-data: "X: 0xFFD0" "65280"
195689-195721 adxl345: reg-address: "DATAY0" "DY0" "Y0"
195689-195721 adxl345: reg-data: "239"
195721-195753 adxl345: reg-address: "DATAY1" "DY1" "Y1"
195689-195753 adxl345: reg-data: "Y: 0x00EF" "0"
195753-195785 adxl345: reg-address: "DATAZ0" "DZ0" "Z0"
195753-195785 adxl345: reg-data: "143"
195785-195817 adxl345: reg-address: "DATAZ1" "DZ1" "Z1"
195753-195817 adxl345: reg-data: "Z: 0xFF8F" "65280"
