94141-94269 usb_packet: sync-ok: "SYNC: 00000001" "SYNC" "S"
94269-94397 usb_packet: pid: "PID: SETUP" "SETUP" "S"
94397-94509 usb_packet: addr: "Address: 0" "Addr: 0" "Addr" "A"
94509-94573 usb_packet: ep: "Endpoint: 0" "EP: 0" "EP" "E"
94573-94653 usb_packet: crc5-ok: "CRC5: 0x02" "CRC5" "C"
94141-94701 usb_packet: packet-setup: "SETUP ADDR 0 EP 0"
94794-94922 usb_packet: sync-ok: "SYNC: 00000001" "SYNC" "S"
94922-95050 usb_packet: pid: "PID: DATA0" "DATA0" "D"
95050-95178 usb_packet: data: "Databyte: 00" "Data: 00" "DB: 00" "00"
95178-95306 usb_packet: data: "Databyte: 05" "Data: 05" "DB: 05" "05"
95306-95434 usb_packet: data: "Databyte: 5C" "Data: 5C" "DB: 5C" "5C"
95434-95562 usb_packet: data: "Databyte: 00" "Data: 00" "DB: 00" "00"
95562-95690 usb_packet: data: "Databyte: 00" "Data: 00" "DB: 00" "00"
95690-95818 usb_packet: data: "Databyte: 00" "Data: 00" "DB: 00" "00"
95818-95946 usb_packet: data: "Databyte: 00" "Data: 00" "DB: 00" "00"
95946-96074 usb_packet: data: "Databyte: 00" "Data: 00" "DB: 00" "00"
96074-96330 usb_packet: crc16-ok: "CRC16: 0x68E6" "CRC16" "C"
94794-96378 usb_packet: packet-data0: "DATA0 [ 00 05 5C 00 00 00 00 00 ]"
96441-96569 usb_packet: sync-ok: "SYNC: 00000001" "SYNC" "S"
96569-96697 usb_packet: pid: "PID: ACK" "ACK" "A"
96441-96745 usb_packet: packet-ack: "ACK"
97181-97309 usb_packet: sync-ok: "SYNC: 00000001" "SYNC" "S"
97309-97437 usb_packet: pid: "PID: IN" "IN" "I"
97437-97549 usb_packet: addr: "Address: 0" "Addr: 0" "Addr" "A"
97549-97613 usb_packet: ep: "Endpoint: 0" "EP: 0" "EP" "E"
97613-97693 usb_packet: crc5-ok: "CRC5: 0x02" "CRC5" "C"
97181-97741 usb_packet: packet-in: "IN ADDR 0 EP 0"
97801-97929 usb_packet: sync-ok: "SYNC: 00000001" "SYNC" "S"
97929-98057 usb_packet: pid: "PID: DATA1" "DATA1" "D"
98057-98313 usb_packet: crc16-ok: "CRC16: 0x0000" "CRC16" "C"
97801-98361 usb_packet: packet-data1: "DATA1 [ ]"
98427-98555 usb_packet: sync-ok: "SYNC: 00000001" "SYNC" "S"
98555-98683 usb_packet: pid: "PID: ACK" "ACK" "A"
98427-98731 usb_packet: packet-ack: "ACK"
550248-550376 usb_packet: sync-ok: "SYNC: 00000001" "SYNC" "S"
550376-550504 usb_packet: pid: "PID: SETUP" "SETUP" "S"
550504-550616 usb_packet: addr: "Address: 92" "Addr: 92" "Addr" "A"
550616-550680 usb_packet: ep: "Endpoint: 0" "EP: 0" "EP" "E"
550680-550760 usb_packet: crc5-ok: "CRC5: 0x1C" "CRC5" "C"
550248-550808 usb_packet: packet-setup: "SETUP ADDR 92 EP 0"
550901-551029 usb_packet: sync-ok: "SYNC: 00000001" "SYNC" "S"
551029-551157 usb_packet: pid: "PID: DATA0" "DATA0" "D"
551157-551285 usb_packet: data: "Databyte: 80" "Data: 80" "DB: 80" "80"
551285-551413 usb_packet: data: "Databyte: 06" "Data: 06" "DB: 06" "06"
551413-551541 usb_packet: data: "Databyte: 00" "Data: 00" "DB: 00" "00"
551541-551669 usb_packet: data: "Databyte: 01" "Data: 01" "DB: 01" "01"
551669-551797 usb_packet: data: "Databyte: 00" "Data: 00" "DB: 00" "00"
551797-551925 usb_packet: data: "Databyte: 00" "Data: 00" "DB: 00" "00"
551925-552053 usb_packet: data: "Databyte: 12" "Data: 12" "DB: 12" "12"
552053-552181 usb_packet: data: "Databyte: 00" "Data: 00" "DB: 00" "00"
552181-552437 usb_packet: crc16-ok: "CRC16: 0xF4E0" "CRC16" "C"
550901-552485 usb_packet: packet-data0: "DATA0 [ 80 06 00 01 00 00 12 00 ]"
552547-552675 usb_packet: sync-ok: "SYNC: 00000001" "SYNC" "S"
552675-552803 usb_packet: pid: "PID: ACK" "ACK" "A"
552547-552851 usb_packet: packet-ack: "ACK"
553271-553399 usb_packet: sync-ok: "SYNC: 00000001" "SYNC" "S"
553399-553527 usb_packet: pid: "PID: IN" "IN" "I"
553527-553639 usb_packet: addr: "Address: 92" "Addr: 92" "Addr" "A"
553639-553703 usb_packet: ep: "Endpoint: 0" "EP: 0" "EP" "E"
553703-553783 usb_packet: crc5-ok: "CRC5: 0x1C" "CRC5" "C"
553271-553831 usb_packet: packet-in: "IN ADDR 92 EP 0"
553893-554021 usb_packet: sync-ok: "SYNC: 00000001" "SYNC" "S"
554021-554149 usb_packet: pid: "PID: NAK" "NAK" "N"
553893-554197 usb_packet: packet-nak: "NAK"
554397-554525 usb_packet: sync-ok: "SYNC: 00000001" "SYNC" "S"
554525-554653 usb_packet: pid: "PID: IN" "IN" "I"
554653-554765 usb_packet: addr: "Address: 92" "Addr: 92" "Addr" "A"
554765-554829 usb_packet: ep: "Endpoint: 0" "EP: 0" "EP" "E"
554829-554909 usb_packet: crc5-ok: "CRC5: 0x1C" "CRC5" "C"
554397-554957 usb_packet: packet-in: "IN ADDR 92 EP 0"
555019-555147 usb_packet: sync-ok: "SYNC: 00000001" "SYNC" "S"
555147-555275 usb_packet: pid: "PID: NAK" "NAK" "N"
555019-555323 usb_packet: packet-nak: "NAK"
555474-555602 usb_packet: sync-ok: "SYNC: 00000001" "SYNC" "S"
555602-555730 usb_packet: pid: "PID: IN" "IN" "I"
555730-555842 usb_packet: addr: "Address: 92" "Addr: 92" "Addr" "A"
555842-555906 usb_packet: ep: "Endpoint: 0" "EP: 0" "EP" "E"
555906-555986 usb_packet: crc5-ok: "CRC5: 0x1C" "CRC5" "C"
555474-556034 usb_packet: packet-in: "IN ADDR 92 EP 0"
556097-556225 usb_packet: sync-ok: "SYNC: 00000001" "SYNC" "S"
556225-556353 usb_packet: pid: "PID: DATA1" "DATA1" "D"
556353-556481 usb_packet: data: "Databyte: 12" "Data: 12" "DB: 12" "12"
556481-556609 usb_packet: data: "Databyte: 01" "Data: 01" "DB: 01" "01"
556609-556737 usb_packet: data: "Databyte: 00" "Data: 00" "DB: 00" "00"
556737-556865 usb_packet: data: "Databyte: 02" "Data: 02" "DB: 02" "02"
556865-556993 usb_packet: data: "Databyte: 00" "Data: 00" "DB: 00" "00"
556993-557121 usb_packet: data: "Databyte: 00" "Data: 00" "DB: 00" "00"
557121-557249 usb_packet: data: "Databyte: 00" "Data: 00" "DB: 00" "00"
557249-557377 usb_packet: data: "Databyte: 08" "Data: 08" "DB: 08" "08"
557377-557633 usb_packet: crc16-ok: "CRC16: 0xE757" "CRC16" "C"
556097-557681 usb_packet: packet-data1: "DATA1 [ 12 01 00 02 00 00 00 08 ]"
557749-557877 usb_packet: sync-ok: "SYNC: 00000001" "SYNC" "S"
557877-558005 usb_packet: pid: "PID: ACK" "ACK" "A"
557749-558053 usb_packet: packet-ack: "ACK"
558230-558358 usb_packet: sync-ok: "SYNC: 00000001" "SYNC" "S"
558358-558486 usb_packet: pid: "PID: IN" "IN" "I"
558486-558598 usb_packet: addr: "Address: 92" "Addr: 92" "Addr" "A"
558598-558662 usb_packet: ep: "Endpoint: 0" "EP: 0" "EP" "E"
558662-558742 usb_packet: crc5-ok: "CRC5: 0x1C" "CRC5" "C"
558230-558790 usb_packet: packet-in: "IN ADDR 92 EP 0"
558851-558979 usb_packet: sync-ok: "SYNC: 00000001" "SYNC" "S"
558979-559107 usb_packet: pid: "PID: NAK" "NAK" "N"
558851-559155 usb_packet: packet-nak: "NAK"
559347-559475 usb_packet: sync-ok: "SYNC: 00000001" "SYNC" "S"
559475-559603 usb_packet: pid: "PID: IN" "IN" "I"
559603-559715 usb_packet: addr: "Address: 92" "Addr: 92" "Addr" "A"
559715-559779 usb_packet: ep: "Endpoint: 0" "EP: 0" "EP" "E"
559779-559859 usb_packet: crc5-ok: "CRC5: 0x1C" "CRC5" "C"
559347-559907 usb_packet: packet-in: "IN ADDR 92 EP 0"
559969-560097 usb_packet: sync-ok: "SYNC: 00000001" "SYNC" "S"
560097-560225 usb_packet: pid: "PID: DATA0" "DATA0" "D"
560225-560353 usb_packet: data: "Databyte: 97" "Data: 97" "DB: 97" "97"
560353-560481 usb_packet: data: "Databyte: 19" "Data: 19" "DB: 19" "19"
560481-560609 usb_packet: data: "Databyte: 09" "Data: 09" "DB: 09" "09"
560609-560737 usb_packet: data: "Databyte: 04" "Data: 04" "DB: 04" "04"
560737-560865 usb_packet: data: "Databyte: 00" "Data: 00" "DB: 00" "00"
560865-560993 usb_packet: data: "Databyte: 02" "Data: 02" "DB: 02" "02"
560993-561121 usb_packet: data: "Databyte: 01" "Data: 01" "DB: 01" "01"
561121-561249 usb_packet: data: "Databyte: 02" "Data: 02" "DB: 02" "02"
561249-561505 usb_packet: crc16-ok: "CRC16: 0x77AF" "CRC16" "C"
559969-561553 usb_packet: packet-data0: "DATA0 [ 97 19 09 04 00 02 01 02 ]"
561617-561745 usb_packet: sync-ok: "SYNC: 00000001" "SYNC" "S"
561745-561873 usb_packet: pid: "PID: ACK" "ACK" "A"
561617-561921 usb_packet: packet-ack: "ACK"
562219-562347 usb_packet: sync-ok: "SYNC: 00000001" "SYNC" "S"
562347-562475 usb_packet: pid: "PID: IN" "IN" "I"
562475-562587 usb_packet: addr: "Address: 92" "Addr: 92" "Addr" "A"
562587-562651 usb_packet: ep: "Endpoint: 0" "EP: 0" "EP" "E"
562651-562731 usb_packet: crc5-ok: "CRC5: 0x1C" "CRC5" "C"
562219-562779 usb_packet: packet-in: "IN ADDR 92 EP 0"
562841-562969 usb_packet: sync-ok: "SYNC: 00000001" "SYNC" "S"
562969-563097 usb_packet: pid: "PID: DATA1" "DATA1" "D"
563097-563225 usb_packet: data: "Databyte: 00" "Data: 00" "DB: 00" "00"
563225-563353 usb_packet: data: "Databyte: 01" "Data: 01" "DB: 01" "01"
563353-563625 usb_packet: crc16-ok: "CRC16: 0x8F3F" "CRC16" "C"
562841-563673 usb_packet: packet-data1: "DATA1 [ 00 01 ]"
563739-563867 usb_packet: sync-ok: "SYNC: 00000001" "SYNC" "S"
563867-563995 usb_packet: pid: "PID: ACK" "ACK" "A"
563739-564043 usb_packet: packet-ack: "ACK"
564287-564415 usb_packet: sync-ok: "SYNC: 00000001" "SYNC" "S"
564415-564543 usb_packet: pid: "PID: OUT" "OUT" "O"
564543-564655 usb_packet: addr: "Address: 92" "Addr: 92" "Addr" "A"
564655-564719 usb_packet: ep: "Endpoint: 0" "EP: 0" "EP" "E"
564719-564799 usb_packet: crc5-ok: "CRC5: 0x1C" "CRC5" "C"
564287-564847 usb_packet: packet-out: "OUT ADDR 92 EP 0"
564940-565068 usb_packet: sync-ok: "SYNC: 00000001" "SYNC" "S"
565068-565196 usb_packet: pid: "PID: DATA1" "DATA1" "D"
565196-565452 usb_packet: crc16-ok: "CRC16: 0x0000" "CRC16" "C"
564940-565500 usb_packet: packet-data1: "DATA1 [ ]"
565563-565691 usb_packet: sync-ok: "SYNC: 00000001" "SYNC" "S"
565691-565819 usb_packet: pid: "PID: ACK" "ACK" "A"
565563-565867 usb_packet: packet-ack: "ACK"
569009-569137 usb_packet: sync-ok: "SYNC: 00000001" "SYNC" "S"
569137-569265 usb_packet: pid: "PID: SETUP" "SETUP" "S"
569265-569377 usb_packet: addr: "Address: 92" "Addr: 92" "Addr" "A"
569377-569441 usb_packet: ep: "Endpoint: 0" "EP: 0" "EP" "E"
569441-569521 usb_packet: crc5-ok: "CRC5: 0x1C" "CRC5" "C"
569009-569569 usb_packet: packet-setup: "SETUP ADDR 92 EP 0"
569662-569790 usb_packet: sync-ok: "SYNC: 00000001" "SYNC" "S"
569790-569918 usb_packet: pid: "PID: DATA0" "DATA0" "D"
569918-570046 usb_packet: data: "Databyte: 80" "Data: 80" "DB: 80" "80"
570046-570174 usb_packet: data: "Databyte: 06" "Data: 06" "DB: 06" "06"
570174-570302 usb_packet: data: "Databyte: 00" "Data: 00" "DB: 00" "00"
570302-570430 usb_packet: data: "Databyte: 02" "Data: 02" "DB: 02" "02"
570430-570558 usb_packet: data: "Databyte: 00" "Data: 00" "DB: 00" "00"
570558-570686 usb_packet: data: "Databyte: 00" "Data: 00" "DB: 00" "00"
570686-570814 usb_packet: data: "Databyte: 09" "Data: 09" "DB: 09" "09"
570814-570942 usb_packet: data: "Databyte: 00" "Data: 00" "DB: 00" "00"
570942-571198 usb_packet: crc16-ok: "CRC16: 0x04AE" "CRC16" "C"
569662-571246 usb_packet: packet-data0: "DATA0 [ 80 06 00 02 00 00 09 00 ]"
571309-571437 usb_packet: sync-ok: "SYNC: 00000001" "SYNC" "S"
571437-571565 usb_packet: pid: "PID: ACK" "ACK" "A"
571309-571613 usb_packet: packet-ack: "ACK"
571805-571933 usb_packet: sync-ok: "SYNC: 00000001" "SYNC" "S"
571933-572061 usb_packet: pid: "PID: IN" "IN" "I"
572061-572173 usb_packet: addr: "Address: 92" "Addr: 92" "Addr" "A"
572173-572237 usb_packet: ep: "Endpoint: 0" "EP: 0" "EP" "E"
572237-572317 usb_packet: crc5-ok: "CRC5: 0x1C" "CRC5" "C"
571805-572365 usb_packet: packet-in: "IN ADDR 92 EP 0"
572427-572555 usb_packet: sync-ok: "SYNC: 00000001" "SYNC" "S"
572555-572683 usb_packet: pid: "PID: NAK" "NAK" "N"
572427-572731 usb_packet: packet-nak: "NAK"
572883-573011 usb_packet: sync-ok: "SYNC: 00000001" "SYNC" "S"
573011-573139 usb_packet: pid: "PID: IN" "IN" "I"
573139-573251 usb_packet: addr: "Address: 92" "Addr: 92" "Addr" "A"
573251-573315 usb_packet: ep: "Endpoint: 0" "EP: 0" "EP" "E"
573315-573395 usb_packet: crc5-ok: "CRC5: 0x1C" "CRC5" "C"
572883-573443 usb_packet: packet-in: "IN ADDR 92 EP 0"
573505-573633 usb_packet: sync-ok: "SYNC: 00000001" "SYNC" "S"
573633-573761 usb_packet: pid: "PID: NAK" "NAK" "N"
573505-573809 usb_packet: packet-nak: "NAK"
573960-574088 usb_packet: sync-ok: "SYNC: 00000001" "SYNC" "S"
574088-574216 usb_packet: pid: "PID: IN" "IN" "I"
574216-574328 usb_packet: addr: "Address: 92" "Addr: 92" "Addr" "A"
574328-574392 usb_packet: ep: "Endpoint: 0" "EP: 0" "EP" "E"
574392-574472 usb_packet: crc5-ok: "CRC5: 0x1C" "CRC5" "C"
573960-574520 usb_packet: packet-in: "IN ADDR 92 EP 0"
574580-574708 usb_packet: sync-ok: "SYNC: 00000001" "SYNC" "S"
574708-574836 usb_packet: pid: "PID: NAK" "NAK" "N"
574580-574884 usb_packet: packet-nak: "NAK"
577277-577405 usb_packet: sync-ok: "SYNC: 00000001" "SYNC" "S"
577405-577533 usb_packet: pid: "PID: IN" "IN" "I"
577533-577645 usb_packet: addr: "Address: 92" "Addr: 92" "Addr" "A"
577645-577709 usb_packet: ep: "Endpoint: 0" "EP: 0" "EP" "E"
577709-577789 usb_packet: crc5-ok: "CRC5: 0x1C" "CRC5" "C"
577277-577837 usb_packet: packet-in: "IN ADDR 92 EP 0"
577897-578025 usb_packet: sync-ok: "SYNC: 00000001" "SYNC" "S"
578025-578153 usb_packet: pid: "PID: DATA1" "DATA1" "D"
578153-578281 usb_packet: data: "Databyte: 09" "Data: 09" "DB: 09" "09"
578281-578409 usb_packet: data: "Databyte: 02" "Data: 02" "DB: 02" "02"
578409-578537 usb_packet: data: "Databyte: 3B" "Data: 3B" "DB: 3B" "3B"
578537-578665 usb_packet: data: "Databyte: 00" "Data: 00" "DB: 00" "00"
578665-578793 usb_packet: data: "Databyte: 02" "Data: 02" "DB: 02" "02"
578793-578921 usb_packet: data: "Databyte: 01" "Data: 01" "DB: 01" "01"
578921-579049 usb_packet: data: "Databyte: 00" "Data: 00" "DB: 00" "00"
579049-579177 usb_packet: data: "Databyte: A0" "Data: A0" "DB: A0" "A0"
579177-579433 usb_packet: crc16-ok: "CRC16: 0xD508" "CRC16" "C"
577897-579481 usb_packet: packet-data1: "DATA1 [ 09 02 3B 00 02 01 00 A0 ]"
579545-579673 usb_packet: sync-ok: "SYNC: 00000001" "SYNC" "S"
579673-579801 usb_packet: pid: "PID: ACK" "ACK" "A"
579545-579849 usb_packet: packet-ack: "ACK"
580223-580351 usb_packet: sync-ok: "SYNC: 00000001" "SYNC" "S"
580351-580479 usb_packet: pid: "PID: IN" "IN" "I"
580479-580591 usb_packet: addr: "Address: 92" "Addr: 92" "Addr" "A"
580591-580655 usb_packet: ep: "Endpoint: 0" "EP: 0" "EP" "E"
580655-580735 usb_packet: crc5-ok: "CRC5: 0x1C" "CRC5" "C"
580223-580783 usb_packet: packet-in: "IN ADDR 92 EP 0"
580846-580974 usb_packet: sync-ok: "SYNC: 00000001" "SYNC" "S"
580974-581102 usb_packet: pid: "PID: DATA0" "DATA0" "D"
581102-581230 usb_packet: data: "Databyte: 32" "Data: 32" "DB: 32" "32"
581230-581486 usb_packet: crc16-ok: "CRC16: 0x6AC1" "CRC16" "C"
580846-581534 usb_packet: packet-data0: "DATA0 [ 32 ]"
581602-581730 usb_packet: sync-ok: "SYNC: 00000001" "SYNC" "S"
581730-581858 usb_packet: pid: "PID: ACK" "ACK" "A"
581602-581906 usb_packet: packet-ack: "ACK"
582160-582288 usb_packet: sync-ok: "SYNC: 00000001" "SYNC" "S"
582288-582416 usb_packet: pid: "PID: OUT" "OUT" "O"
582416-582528 usb_packet: addr: "Address: 92" "Addr: 92" "Addr" "A"
582528-582592 usb_packet: ep: "Endpoint: 0" "EP: 0" "EP" "E"
582592-582672 usb_packet: crc5-ok: "CRC5: 0x1C" "CRC5" "C"
582160-582720 usb_packet: packet-out: "OUT ADDR 92 EP 0"
582813-582941 usb_packet: sync-ok: "SYNC: 00000001" "SYNC" "S"
582941-583069 usb_packet: pid: "PID: DATA1" "DATA1" "D"
583069-583325 usb_packet: crc16-ok: "CRC16: 0x0000" "CRC16" "C"
582813-583373 usb_packet: packet-data1: "DATA1 [ ]"
583435-583563 usb_packet: sync-ok: "SYNC: 00000001" "SYNC" "S"
583563-583691 usb_packet: pid: "PID: ACK" "ACK" "A"
583435-583739 usb_packet: packet-ack: "ACK"
586726-586854 usb_packet: sync-ok: "SYNC: 00000001" "SYNC" "S"
586854-586982 usb_packet: pid: "PID: SETUP" "SETUP" "S"
586982-587094 usb_packet: addr: "Address: 92" "Addr: 92" "Addr" "A"
587094-587158 usb_packet: ep: "Endpoint: 0" "EP: 0" "EP" "E"
587158-587238 usb_packet: crc5-ok: "CRC5: 0x1C" "CRC5" "C"
586726-587286 usb_packet: packet-setup: "SETUP ADDR 92 EP 0"
587380-587508 usb_packet: sync-ok: "SYNC: 00000001" "SYNC" "S"
587508-587636 usb_packet: pid: "PID: DATA0" "DATA0" "D"
587636-587764 usb_packet: data: "Databyte: 80" "Data: 80" "DB: 80" "80"
587764-587892 usb_packet: data: "Databyte: 06" "Data: 06" "DB: 06" "06"
587892-588020 usb_packet: data: "Databyte: 00" "Data: 00" "DB: 00" "00"
588020-588148 usb_packet: data: "Databyte: 02" "Data: 02" "DB: 02" "02"
588148-588276 usb_packet: data: "Databyte: 00" "Data: 00" "DB: 00" "00"
588276-588404 usb_packet: data: "Databyte: 00" "Data: 00" "DB: 00" "00"
588404-588532 usb_packet: data: "Databyte: 3B" "Data: 3B" "DB: 3B" "3B"
588532-588660 usb_packet: data: "Databyte: 00" "Data: 00" "DB: 00" "00"
588660-588916 usb_packet: crc16-ok: "CRC16: 0x64BB" "CRC16" "C"
587380-588964 usb_packet: packet-data0: "DATA0 [ 80 06 00 02 00 00 3B 00 ]"
589026-589154 usb_packet: sync-ok: "SYNC: 00000001" "SYNC" "S"
589154-589282 usb_packet: pid: "PID: ACK" "ACK" "A"
589026-589330 usb_packet: packet-ack: "ACK"
589498-589626 usb_packet: sync-ok: "SYNC: 00000001" "SYNC" "S"
589626-589754 usb_packet: pid: "PID: IN" "IN" "I"
589754-589866 usb_packet: addr: "Address: 92" "Addr: 92" "Addr" "A"
589866-589930 usb_packet: ep: "Endpoint: 0" "EP: 0" "EP" "E"
589930-590010 usb_packet: crc5-ok: "CRC5: 0x1C" "CRC5" "C"
589498-590058 usb_packet: packet-in: "IN ADDR 92 EP 0"
590120-590248 usb_packet: sync-ok: "SYNC: 00000001" "SYNC" "S"
590248-590376 usb_packet: pid: "PID: NAK" "NAK" "N"
590120-590424 usb_packet: packet-nak: "NAK"
590575-590703 usb_packet: sync-ok: "SYNC: 00000001" "SYNC" "S"
590703-590831 usb_packet: pid: "PID: IN" "IN" "I"
590831-590943 usb_packet: addr: "Address: 92" "Addr: 92" "Addr" "A"
590943-591007 usb_packet: ep: "Endpoint: 0" "EP: 0" "EP" "E"
591007-591087 usb_packet: crc5-ok: "CRC5: 0x1C" "CRC5" "C"
590575-591135 usb_packet: packet-in: "IN ADDR 92 EP 0"
591196-591324 usb_packet: sync-ok: "SYNC: 00000001" "SYNC" "S"
591324-591452 usb_packet: pid: "PID: NAK" "NAK" "N"
591196-591500 usb_packet: packet-nak: "NAK"
591653-591781 usb_packet: sync-ok: "SYNC: 00000001" "SYNC" "S"
591781-591909 usb_packet: pid: "PID: IN" "IN" "I"
591909-592021 usb_packet: addr: "Address: 92" "Addr: 92" "Addr" "A"
592021-592085 usb_packet: ep: "Endpoint: 0" "EP: 0" "EP" "E"
592085-592165 usb_packet: crc5-ok: "CRC5: 0x1C" "CRC5" "C"
591653-592213 usb_packet: packet-in: "IN ADDR 92 EP 0"
592274-592402 usb_packet: sync-ok: "SYNC: 00000001" "SYNC" "S"
592402-592530 usb_packet: pid: "PID: NAK" "NAK" "N"
592274-592578 usb_packet: packet-nak: "NAK"
592734-592862 usb_packet: sync-ok: "SYNC: 00000001" "SYNC" "S"
592862-592990 usb_packet: pid: "PID: IN" "IN" "I"
592990-593102 usb_packet: addr: "Address: 92" "Addr: 92" "Addr" "A"
593102-593166 usb_packet: ep: "Endpoint: 0" "EP: 0" "EP" "E"
593166-593246 usb_packet: crc5-ok: "CRC5: 0x1C" "CRC5" "C"
592734-593294 usb_packet: packet-in: "IN ADDR 92 EP 0"
593354-593482 usb_packet: sync-ok: "SYNC: 00000001" "SYNC" "S"
593482-593610 usb_packet: pid: "PID: DATA1" "DATA1" "D"
593610-593738 usb_packet: data: "Databyte: 09" "Data: 09" "DB: 09" "09"
593738-593866 usb_packet: data: "Databyte: 02" "Data: 02" "DB: 02" "02"
593866-593994 usb_packet: data: "Databyte: 3B" "Data: 3B" "DB: 3B" "3B"
593994-594122 usb_packet: data: "Databyte: 00" "Data: 00" "DB: 00" "00"
594122-594250 usb_packet: data: "Databyte: 02" "Data: 02" "DB: 02" "02"
594250-594378 usb_packet: data: "Databyte: 01" "Data: 01" "DB: 01" "01"
594378-594506 usb_packet: data: "Databyte: 00" "Data: 00" "DB: 00" "00"
594506-594634 usb_packet: data: "Databyte: A0" "Data: A0" "DB: A0" "A0"
594634-594890 usb_packet: crc16-ok: "CRC16: 0xD508" "CRC16" "C"
593354-594938 usb_packet: packet-data1: "DATA1 [ 09 02 3B 00 02 01 00 A0 ]"
595006-595134 usb_packet: sync-ok: "SYNC: 00000001" "SYNC" "S"
595134-595262 usb_packet: pid: "PID: ACK" "ACK" "A"
595006-595310 usb_packet: packet-ack: "ACK"
595491-595619 usb_packet: sync-ok: "SYNC: 00000001" "SYNC" "S"
595619-595747 usb_packet: pid: "PID: IN" "IN" "I"
595747-595859 usb_packet: addr: "Address: 92" "Addr: 92" "Addr" "A"
595859-595923 usb_packet: ep: "Endpoint: 0" "EP: 0" "EP" "E"
595923-596003 usb_packet: crc5-ok: "CRC5: 0x1C" "CRC5" "C"
595491-596051 usb_packet: packet-in: "IN ADDR 92 EP 0"
596113-596241 usb_packet: sync-ok: "SYNC: 00000001" "SYNC" "S"
596241-596369 usb_packet: pid: "PID: NAK" "NAK" "N"
596113-596417 usb_packet: packet-nak: "NAK"
596569-596697 usb_packet: sync-ok: "SYNC: 00000001" "SYNC" "S"
596697-596825 usb_packet: pid: "PID: IN" "IN" "I"
596825-596937 usb_packet: addr: "Address: 92" "Addr: 92" "Addr" "A"
596937-597001 usb_packet: ep: "Endpoint: 0" "EP: 0" "EP" "E"
597001-597081 usb_packet: crc5-ok: "CRC5: 0x1C" "CRC5" "C"
596569-597129 usb_packet: packet-in: "IN ADDR 92 EP 0"
597191-597319 usb_packet: sync-ok: "SYNC: 00000001" "SYNC" "S"
597319-597447 usb_packet: pid: "PID: DATA0" "DATA0" "D"
597447-597575 usb_packet: data: "Databyte: 32" "Data: 32" "DB: 32" "32"
597575-597703 usb_packet: data: "Databyte: 09" "Data: 09" "DB: 09" "09"
597703-597831 usb_packet: data: "Databyte: 04" "Data: 04" "DB: 04" "04"
597831-597959 usb_packet: data: "Databyte: 00" "Data: 00" "DB: 00" "00"
597959-598087 usb_packet: data: "Databyte: 00" "Data: 00" "DB: 00" "00"
598087-598215 usb_packet: data: "Databyte: 01" "Data: 01" "DB: 01" "01"
598215-598343 usb_packet: data: "Databyte: 03" "Data: 03" "DB: 03" "03"
598343-598471 usb_packet: data: "Databyte: 01" "Data: 01" "DB: 01" "01"
598471-598727 usb_packet: crc16-ok: "CRC16: 0x4D35" "CRC16" "C"
597191-598775 usb_packet: packet-data0: "DATA0 [ 32 09 04 00 00 01 03 01 ]"
598843-598971 usb_packet: sync-ok: "SYNC: 00000001" "SYNC" "S"
598971-599099 usb_packet: pid: "PID: ACK" "ACK" "A"
598843-599147 usb_packet: packet-ack: "ACK"
601281-601409 usb_packet: sync-ok: "SYNC: 00000001" "SYNC" "S"
601409-601537 usb_packet: pid: "PID: IN" "IN" "I"
601537-601649 usb_packet: addr: "Address: 92" "Addr: 92" "Addr" "A"
601649-601713 usb_packet: ep: "Endpoint: 0" "EP: 0" "EP" "E"
601713-601793 usb_packet: crc5-ok: "CRC5: 0x1C" "CRC5" "C"
601281-601841 usb_packet: packet-in: "IN ADDR 92 EP 0"
601903-602031 usb_packet: sync-ok: "SYNC: 00000001" "SYNC" "S"
602031-602159 usb_packet: pid: "PID: DATA1" "DATA1" "D"
602159-602287 usb_packet: data: "Databyte: 01" "Data: 01" "DB: 01" "01"
602287-602415 usb_packet: data: "Databyte: 00" "Data: 00" "DB: 00" "00"
602415-602543 usb_packet: data: "Databyte: 09" "Data: 09" "DB: 09" "09"
602543-602671 usb_packet: data: "Databyte: 21" "Data: 21" "DB: 21" "21"
602671-602799 usb_packet: data: "Databyte: 11" "Data: 11" "DB: 11" "11"
602799-602927 usb_packet: data: "Databyte: 01" "Data: 01" "DB: 01" "01"
602927-603055 usb_packet: data: "Databyte: 00" "Data: 00" "DB: 00" "00"
603055-603183 usb_packet: data: "Databyte: 01" "Data: 01" "DB: 01" "01"
603183-603439 usb_packet: crc16-ok: "CRC16: 0x9A57" "CRC16" "C"
601903-603487 usb_packet: packet-data1: "DATA1 [ 01 00 09 21 11 01 00 01 ]"
603555-603683 usb_packet: sync-ok: "SYNC: 00000001" "SYNC" "S"
603683-603811 usb_packet: pid: "PID: ACK" "ACK" "A"
603555-603859 usb_packet: packet-ack: "ACK"
604064-604192 usb_packet: sync-ok: "SYNC: 00000001" "SYNC" "S"
604192-604320 usb_packet: pid: "PID: IN" "IN" "I"
604320-604432 usb_packet: addr: "Address: 92" "Addr: 92" "Addr" "A"
604432-604496 usb_packet: ep: "Endpoint: 0" "EP: 0" "EP" "E"
604496-604576 usb_packet: crc5-ok: "CRC5: 0x1C" "CRC5" "C"
604064-604624 usb_packet: packet-in: "IN ADDR 92 EP 0"
604686-604814 usb_packet: sync-ok: "SYNC: 00000001" "SYNC" "S"
604814-604942 usb_packet: pid: "PID: NAK" "NAK" "N"
604686-604990 usb_packet: packet-nak: "NAK"
605153-605281 usb_packet: sync-ok: "SYNC: 00000001" "SYNC" "S"
605281-605409 usb_packet: pid: "PID: IN" "IN" "I"
605409-605521 usb_packet: addr: "Address: 92" "Addr: 92" "Addr" "A"
605521-605585 usb_packet: ep: "Endpoint: 0" "EP: 0" "EP" "E"
605585-605665 usb_packet: crc5-ok: "CRC5: 0x1C" "CRC5" "C"
605153-605713 usb_packet: packet-in: "IN ADDR 92 EP 0"
605773-605901 usb_packet: sync-ok: "SYNC: 00000001" "SYNC" "S"
605901-606029 usb_packet: pid: "PID: DATA0" "DATA0" "D"
606029-606157 usb_packet: data: "Databyte: 22" "Data: 22" "DB: 22" "22"
606157-606301 usb_packet: data: "Databyte: 3F" "Data: 3F" "DB: 3F" "3F"
606301-606429 usb_packet: data: "Databyte: 00" "Data: 00" "DB: 00" "00"
606429-606557 usb_packet: data: "Databyte: 07" "Data: 07" "DB: 07" "07"
606557-606685 usb_packet: data: "Databyte: 05" "Data: 05" "DB: 05" "05"
606685-606813 usb_packet: data: "Databyte: 81" "Data: 81" "DB: 81" "81"
606813-606941 usb_packet: data: "Databyte: 03" "Data: 03" "DB: 03" "03"
606941-607069 usb_packet: data: "Databyte: 08" "Data: 08" "DB: 08" "08"
607069-607325 usb_packet: crc16-ok: "CRC16: 0x2417" "CRC16" "C"
605773-607373 usb_packet: packet-data0: "DATA0 [ 22 3F 00 07 05 81 03 08 ]"
607438-607566 usb_packet: sync-ok: "SYNC: 00000001" "SYNC" "S"
607566-607694 usb_packet: pid: "PID: ACK" "ACK" "A"
607438-607742 usb_packet: packet-ack: "ACK"
607935-608063 usb_packet: sync-ok: "SYNC: 00000001" "SYNC" "S"
608063-608191 usb_packet: pid: "PID: IN" "IN" "I"
608191-608303 usb_packet: addr: "Address: 92" "Addr: 92" "Addr" "A"
608303-608367 usb_packet: ep: "Endpoint: 0" "EP: 0" "EP" "E"
608367-608447 usb_packet: crc5-ok: "CRC5: 0x1C" "CRC5" "C"
607935-608495 usb_packet: packet-in: "IN ADDR 92 EP 0"
608558-608686 usb_packet: sync-ok: "SYNC: 00000001" "SYNC" "S"
608686-608814 usb_packet: pid: "PID: NAK" "NAK" "N"
608558-608862 usb_packet: packet-nak: "NAK"
609011-609139 usb_packet: sync-ok: "SYNC: 00000001" "SYNC" "S"
609139-609267 usb_packet: pid: "PID: IN" "IN" "I"
609267-609379 usb_packet: addr: "Address: 92" "Addr: 92" "Addr" "A"
609379-609443 usb_packet: ep: "Endpoint: 0" "EP: 0" "EP" "E"
609443-609523 usb_packet: crc5-ok: "CRC5: 0x1C" "CRC5" "C"
609011-609571 usb_packet: packet-in: "IN ADDR 92 EP 0"
609632-609760 usb_packet: sync-ok: "SYNC: 00000001" "SYNC" "S"
609760-609888 usb_packet: pid: "PID: DATA1" "DATA1" "D"
609888-610016 usb_packet: data: "Databyte: 00" "Data: 00" "DB: 00" "00"
610016-610144 usb_packet: data: "Databyte: 0A" "Data: 0A" "DB: 0A" "0A"
610144-610272 usb_packet: data: "Databyte: 09" "Data: 09" "DB: 09" "09"
610272-610400 usb_packet: data: "Databyte: 04" "Data: 04" "DB: 04" "04"
610400-610528 usb_packet: data: "Databyte: 01" "Data: 01" "DB: 01" "01"
610528-610656 usb_packet: data: "Databyte: 00" "Data: 00" "DB: 00" "00"
610656-610784 usb_packet: data: "Databyte: 01" "Data: 01" "DB: 01" "01"
610784-610912 usb_packet: data: "Databyte: 03" "Data: 03" "DB: 03" "03"
610912-611168 usb_packet: crc16-ok: "CRC16: 0xC0A4" "CRC16" "C"
609632-611216 usb_packet: packet-data1: "DATA1 [ 00 0A 09 04 01 00 01 03 ]"
611283-611411 usb_packet: sync-ok: "SYNC: 00000001" "SYNC" "S"
611411-611539 usb_packet: pid: "PID: ACK" "ACK" "A"
611283-611587 usb_packet: packet-ack: "ACK"
611822-611950 usb_packet: sync-ok: "SYNC: 00000001" "SYNC" "S"
611950-612078 usb_packet: pid: "PID: IN" "IN" "I"
612078-612190 usb_packet: addr: "Address: 92" "Addr: 92" "Addr" "A"
612190-612254 usb_packet: ep: "Endpoint: 0" "EP: 0" "EP" "E"
612254-612334 usb_packet: crc5-ok: "CRC5: 0x1C" "CRC5" "C"
611822-612382 usb_packet: packet-in: "IN ADDR 92 EP 0"
612444-612572 usb_packet: sync-ok: "SYNC: 00000001" "SYNC" "S"
612572-612700 usb_packet: pid: "PID: NAK" "NAK" "N"
612444-612748 usb_packet: packet-nak: "NAK"
612900-613028 usb_packet: sync-ok: "SYNC: 00000001" "SYNC" "S"
613028-613156 usb_packet: pid: "PID: IN" "IN" "I"
613156-613268 usb_packet: addr: "Address: 92" "Addr: 92" "Addr" "A"
613268-613332 usb_packet: ep: "Endpoint: 0" "EP: 0" "EP" "E"
613332-613412 usb_packet: crc5-ok: "CRC5: 0x1C" "CRC5" "C"
612900-613460 usb_packet: packet-in: "IN ADDR 92 EP 0"
613522-613650 usb_packet: sync-ok: "SYNC: 00000001" "SYNC" "S"
613650-613778 usb_packet: pid: "PID: DATA0" "DATA0" "D"
613778-613906 usb_packet: data: "Databyte: 01" "Data: 01" "DB: 01" "01"
613906-614034 usb_packet: data: "Databyte: 02" "Data: 02" "DB: 02" "02"
614034-614162 usb_packet: data: "Databyte: 00" "Data: 00" "DB: 00" "00"
614162-614290 usb_packet: data: "Databyte: 09" "Data: 09" "DB: 09" "09"
614290-614418 usb_packet: data: "Databyte: 21" "Data: 21" "DB: 21" "21"
614418-614546 usb_packet: data: "Databyte: 11" "Data: 11" "DB: 11" "11"
614546-614674 usb_packet: data: "Databyte: 01" "Data: 01" "DB: 01" "01"
614674-614802 usb_packet: data: "Databyte: 00" "Data: 00" "DB: 00" "00"
614802-615058 usb_packet: crc16-ok: "CRC16: 0x50DA" "CRC16" "C"
613522-615106 usb_packet: packet-data0: "DATA0 [ 01 02 00 09 21 11 01 00 ]"
615170-615298 usb_packet: sync-ok: "SYNC: 00000001" "SYNC" "S"
615298-615426 usb_packet: pid: "PID: ACK" "ACK" "A"
615170-615474 usb_packet: packet-ack: "ACK"
615713-615841 usb_packet: sync-ok: "SYNC: 00000001" "SYNC" "S"
615841-615969 usb_packet: pid: "PID: IN" "IN" "I"
615969-616081 usb_packet: addr: "Address: 92" "Addr: 92" "Addr" "A"
616081-616145 usb_packet: ep: "Endpoint: 0" "EP: 0" "EP" "E"
616145-616225 usb_packet: crc5-ok: "CRC5: 0x1C" "CRC5" "C"
615713-616273 usb_packet: packet-in: "IN ADDR 92 EP 0"
616334-616462 usb_packet: sync-ok: "SYNC: 00000001" "SYNC" "S"
616462-616590 usb_packet: pid: "PID: NAK" "NAK" "N"
616334-616638 usb_packet: packet-nak: "NAK"
616802-616930 usb_packet: sync-ok: "SYNC: 00000001" "SYNC" "S"
616930-617058 usb_packet: pid: "PID: IN" "IN" "I"
617058-617170 usb_packet: addr: "Address: 92" "Addr: 92" "Addr" "A"
617170-617234 usb_packet: ep: "Endpoint: 0" "EP: 0" "EP" "E"
617234-617314 usb_packet: crc5-ok: "CRC5: 0x1C" "CRC5" "C"
616802-617362 usb_packet: packet-in: "IN ADDR 92 EP 0"
617423-617551 usb_packet: sync-ok: "SYNC: 00000001" "SYNC" "S"
617551-617679 usb_packet: pid: "PID: DATA1" "DATA1" "D"
617679-617807 usb_packet: data: "Databyte: 01" "Data: 01" "DB: 01" "01"
617807-617935 usb_packet: data: "Databyte: 22" "Data: 22" "DB: 22" "22"
617935-618063 usb_packet: data: "Databyte: 5E" "Data: 5E" "DB: 5E" "5E"
618063-618191 usb_packet: data: "Databyte: 00" "Data: 00" "DB: 00" "00"
618191-618319 usb_packet: data: "Databyte: 07" "Data: 07" "DB: 07" "07"
618319-618447 usb_packet: data: "Databyte: 05" "Data: 05" "DB: 05" "05"
618447-618575 usb_packet: data: "Databyte: 82" "Data: 82" "DB: 82" "82"
618575-618703 usb_packet: data: "Databyte: 03" "Data: 03" "DB: 03" "03"
618703-618959 usb_packet: crc16-ok: "CRC16: 0x9040" "CRC16" "C"
617423-619007 usb_packet: packet-data1: "DATA1 [ 01 22 5E 00 07 05 82 03 ]"
619072-619200 usb_packet: sync-ok: "SYNC: 00000001" "SYNC" "S"
619200-619328 usb_packet: pid: "PID: ACK" "ACK" "A"
619072-619376 usb_packet: packet-ack: "ACK"
619559-619687 usb_packet: sync-ok: "SYNC: 00000001" "SYNC" "S"
619687-619815 usb_packet: pid: "PID: IN" "IN" "I"
619815-619927 usb_packet: addr: "Address: 92" "Addr: 92" "Addr" "A"
619927-619991 usb_packet: ep: "Endpoint: 0" "EP: 0" "EP" "E"
619991-620071 usb_packet: crc5-ok: "CRC5: 0x1C" "CRC5" "C"
619559-620119 usb_packet: packet-in: "IN ADDR 92 EP 0"
620180-620308 usb_packet: sync-ok: "SYNC: 00000001" "SYNC" "S"
620308-620436 usb_packet: pid: "PID: NAK" "NAK" "N"
620180-620484 usb_packet: packet-nak: "NAK"
620636-620764 usb_packet: sync-ok: "SYNC: 00000001" "SYNC" "S"
620764-620892 usb_packet: pid: "PID: IN" "IN" "I"
620892-621004 usb_packet: addr: "Address: 92" "Addr: 92" "Addr" "A"
621004-621068 usb_packet: ep: "Endpoint: 0" "EP: 0" "EP" "E"
621068-621148 usb_packet: crc5-ok: "CRC5: 0x1C" "CRC5" "C"
620636-621196 usb_packet: packet-in: "IN ADDR 92 EP 0"
621257-621385 usb_packet: sync-ok: "SYNC: 00000001" "SYNC" "S"
621385-621513 usb_packet: pid: "PID: DATA0" "DATA0" "D"
621513-621641 usb_packet: data: "Databyte: 08" "Data: 08" "DB: 08" "08"
621641-621769 usb_packet: data: "Databyte: 00" "Data: 00" "DB: 00" "00"
621769-621897 usb_packet: data: "Databyte: 0A" "Data: 0A" "DB: 0A" "0A"
621897-622153 usb_packet: crc16-ok: "CRC16: 0xFA8F" "CRC16" "C"
621257-622201 usb_packet: packet-data0: "DATA0 [ 08 00 0A ]"
622267-622395 usb_packet: sync-ok: "SYNC: 00000001" "SYNC" "S"
622395-622523 usb_packet: pid: "PID: ACK" "ACK" "A"
622267-622571 usb_packet: packet-ack: "ACK"
625286-625414 usb_packet: sync-ok: "SYNC: 00000001" "SYNC" "S"
625414-625542 usb_packet: pid: "PID: OUT" "OUT" "O"
625542-625654 usb_packet: addr: "Address: 92" "Addr: 92" "Addr" "A"
625654-625718 usb_packet: ep: "Endpoint: 0" "EP: 0" "EP" "E"
625718-625798 usb_packet: crc5-ok: "CRC5: 0x1C" "CRC5" "C"
625286-625846 usb_packet: packet-out: "OUT ADDR 92 EP 0"
625939-626067 usb_packet: sync-ok: "SYNC: 00000001" "SYNC" "S"
626067-626195 usb_packet: pid: "PID: DATA1" "DATA1" "D"
626195-626451 usb_packet: crc16-ok: "CRC16: 0x0000" "CRC16" "C"
625939-626499 usb_packet: packet-data1: "DATA1 [ ]"
626562-626690 usb_packet: sync-ok: "SYNC: 00000001" "SYNC" "S"
626690-626818 usb_packet: pid: "PID: ACK" "ACK" "A"
626562-626866 usb_packet: packet-ack: "ACK"
629437-629565 usb_packet: sync-ok: "SYNC: 00000001" "SYNC" "S"
629565-629693 usb_packet: pid: "PID: SETUP" "SETUP" "S"
629693-629805 usb_packet: addr: "Address: 92" "Addr: 92" "Addr" "A"
629805-629869 usb_packet: ep: "Endpoint: 0" "EP: 0" "EP" "E"
629869-629949 usb_packet: crc5-ok: "CRC5: 0x1C" "CRC5" "C"
629437-629997 usb_packet: packet-setup: "SETUP ADDR 92 EP 0"
630091-630219 usb_packet: sync-ok: "SYNC: 00000001" "SYNC" "S"
630219-630347 usb_packet: pid: "PID: DATA0" "DATA0" "D"
630347-630475 usb_packet: data: "Databyte: 80" "Data: 80" "DB: 80" "80"
630475-630603 usb_packet: data: "Databyte: 06" "Data: 06" "DB: 06" "06"
630603-630731 usb_packet: data: "Databyte: 00" "Data: 00" "DB: 00" "00"
630731-630859 usb_packet: data: "Databyte: 03" "Data: 03" "DB: 03" "03"
630859-630987 usb_packet: data: "Databyte: 00" "Data: 00" "DB: 00" "00"
630987-631115 usb_packet: data: "Databyte: 00" "Data: 00" "DB: 00" "00"
631115-631259 usb_packet: data: "Databyte: FF" "Data: FF" "DB: FF" "FF"
631259-631387 usb_packet: data: "Databyte: 00" "Data: 00" "DB: 00" "00"
631387-631643 usb_packet: crc16-ok: "CRC16: 0x64D4" "CRC16" "C"
630091-631691 usb_packet: packet-data0: "DATA0 [ 80 06 00 03 00 00 FF 00 ]"
631753-631881 usb_packet: sync-ok: "SYNC: 00000001" "SYNC" "S"
631881-632009 usb_packet: pid: "PID: ACK" "ACK" "A"
631753-632057 usb_packet: packet-ack: "ACK"
632268-632396 usb_packet: sync-ok: "SYNC: 00000001" "SYNC" "S"
632396-632524 usb_packet: pid: "PID: IN" "IN" "I"
632524-632636 usb_packet: addr: "Address: 92" "Addr: 92" "Addr" "A"
632636-632700 usb_packet: ep: "Endpoint: 0" "EP: 0" "EP" "E"
632700-632780 usb_packet: crc5-ok: "CRC5: 0x1C" "CRC5" "C"
632268-632828 usb_packet: packet-in: "IN ADDR 92 EP 0"
632890-633018 usb_packet: sync-ok: "SYNC: 00000001" "SYNC" "S"
633018-633146 usb_packet: pid: "PID: NAK" "NAK" "N"
632890-633194 usb_packet: packet-nak: "NAK"
633346-633474 usb_packet: sync-ok: "SYNC: 00000001" "SYNC" "S"
633474-633602 usb_packet: pid: "PID: IN" "IN" "I"
633602-633714 usb_packet: addr: "Address: 92" "Addr: 92" "Addr" "A"
633714-633778 usb_packet: ep: "Endpoint: 0" "EP: 0" "EP" "E"
633778-633858 usb_packet: crc5-ok: "CRC5: 0x1C" "CRC5" "C"
633346-633906 usb_packet: packet-in: "IN ADDR 92 EP 0"
633968-634096 usb_packet: sync-ok: "SYNC: 00000001" "SYNC" "S"
634096-634224 usb_packet: pid: "PID: NAK" "NAK" "N"
633968-634272 usb_packet: packet-nak: "NAK"
634425-634553 usb_packet: sync-ok: "SYNC: 00000001" "SYNC" "S"
634553-634681 usb_packet: pid: "PID: IN" "IN" "I"
634681-634793 usb_packet: addr: "Address: 92" "Addr: 92" "Addr" "A"
634793-634857 usb_packet: ep: "Endpoint: 0" "EP: 0" "EP" "E"
634857-634937 usb_packet: crc5-ok: "CRC5: 0x1C" "CRC5" "C"
634425-634985 usb_packet: packet-in: "IN ADDR 92 EP 0"
635046-635174 usb_packet: sync-ok: "SYNC: 00000001" "SYNC" "S"
635174-635302 usb_packet: pid: "PID: DATA1" "DATA1" "D"
635302-635430 usb_packet: data: "Databyte: 04" "Data: 04" "DB: 04" "04"
635430-635558 usb_packet: data: "Databyte: 03" "Data: 03" "DB: 03" "03"
635558-635686 usb_packet: data: "Databyte: 09" "Data: 09" "DB: 09" "09"
635686-635814 usb_packet: data: "Databyte: 04" "Data: 04" "DB: 04" "04"
635814-636070 usb_packet: crc16-ok: "CRC16: 0x7809" "CRC16" "C"
635046-636118 usb_packet: packet-data1: "DATA1 [ 04 03 09 04 ]"
636183-636311 usb_packet: sync-ok: "SYNC: 00000001" "SYNC" "S"
636311-636439 usb_packet: pid: "PID: ACK" "ACK" "A"
636183-636487 usb_packet: packet-ack: "ACK"
636747-636875 usb_packet: sync-ok: "SYNC: 00000001" "SYNC" "S"
636875-637003 usb_packet: pid: "PID: OUT" "OUT" "O"
637003-637115 usb_packet: addr: "Address: 92" "Addr: 92" "Addr" "A"
637115-637179 usb_packet: ep: "Endpoint: 0" "EP: 0" "EP" "E"
637179-637259 usb_packet: crc5-ok: "CRC5: 0x1C" "CRC5" "C"
636747-637307 usb_packet: packet-out: "OUT ADDR 92 EP 0"
637400-637528 usb_packet: sync-ok: "SYNC: 00000001" "SYNC" "S"
637528-637656 usb_packet: pid: "PID: DATA1" "DATA1" "D"
637656-637912 usb_packet: crc16-ok: "CRC16: 0x0000" "CRC16" "C"
637400-637960 usb_packet: packet-data1: "DATA1 [ ]"
638022-638150 usb_packet: sync-ok: "SYNC: 00000001" "SYNC" "S"
638150-638278 usb_packet: pid: "PID: ACK" "ACK" "A"
638022-638326 usb_packet: packet-ack: "ACK"
640745-640873 usb_packet: sync-ok: "SYNC: 00000001" "SYNC" "S"
640873-641001 usb_packet: pid: "PID: SETUP" "SETUP" "S"
641001-641113 usb_packet: addr: "Address: 92" "Addr: 92" "Addr" "A"
641113-641177 usb_packet: ep: "Endpoint: 0" "EP: 0" "EP" "E"
641177-641257 usb_packet: crc5-ok: "CRC5: 0x1C" "CRC5" "C"
640745-641305 usb_packet: packet-setup: "SETUP ADDR 92 EP 0"
641398-641526 usb_packet: sync-ok: "SYNC: 00000001" "SYNC" "S"
641526-641654 usb_packet: pid: "PID: DATA0" "DATA0" "D"
641654-641782 usb_packet: data: "Databyte: 80" "Data: 80" "DB: 80" "80"
641782-641910 usb_packet: data: "Databyte: 06" "Data: 06" "DB: 06" "06"
641910-642038 usb_packet: data: "Databyte: 02" "Data: 02" "DB: 02" "02"
642038-642166 usb_packet: data: "Databyte: 03" "Data: 03" "DB: 03" "03"
642166-642294 usb_packet: data: "Databyte: 09" "Data: 09" "DB: 09" "09"
642294-642422 usb_packet: data: "Databyte: 04" "Data: 04" "DB: 04" "04"
642422-642566 usb_packet: data: "Databyte: FF" "Data: FF" "DB: FF" "FF"
642566-642694 usb_packet: data: "Databyte: 00" "Data: 00" "DB: 00" "00"
642694-642950 usb_packet: crc16-ok: "CRC16: 0xDB97" "CRC16" "C"
641398-642998 usb_packet: packet-data0: "DATA0 [ 80 06 02 03 09 04 FF 00 ]"
643061-643189 usb_packet: sync-ok: "SYNC: 00000001" "SYNC" "S"
643189-643317 usb_packet: pid: "PID: ACK" "ACK" "A"
643061-643365 usb_packet: packet-ack: "ACK"
643570-643698 usb_packet: sync-ok: "SYNC: 00000001" "SYNC" "S"
643698-643826 usb_packet: pid: "PID: IN" "IN" "I"
643826-643938 usb_packet: addr: "Address: 92" "Addr: 92" "Addr" "A"
643938-644002 usb_packet: ep: "Endpoint: 0" "EP: 0" "EP" "E"
644002-644082 usb_packet: crc5-ok: "CRC5: 0x1C" "CRC5" "C"
643570-644130 usb_packet: packet-in: "IN ADDR 92 EP 0"
644191-644319 usb_packet: sync-ok: "SYNC: 00000001" "SYNC" "S"
644319-644447 usb_packet: pid: "PID: NAK" "NAK" "N"
644191-644495 usb_packet: packet-nak: "NAK"
644648-644776 usb_packet: sync-ok: "SYNC: 00000001" "SYNC" "S"
644776-644904 usb_packet: pid: "PID: IN" "IN" "I"
644904-645016 usb_packet: addr: "Address: 92" "Addr: 92" "Addr" "A"
645016-645080 usb_packet: ep: "Endpoint: 0" "EP: 0" "EP" "E"
645080-645160 usb_packet: crc5-ok: "CRC5: 0x1C" "CRC5" "C"
644648-645208 usb_packet: packet-in: "IN ADDR 92 EP 0"
645268-645396 usb_packet: sync-ok: "SYNC: 00000001" "SYNC" "S"
645396-645524 usb_packet: pid: "PID: NAK" "NAK" "N"
645268-645572 usb_packet: packet-nak: "NAK"
645724-645852 usb_packet: sync-ok: "SYNC: 00000001" "SYNC" "S"
645852-645980 usb_packet: pid: "PID: IN" "IN" "I"
645980-646092 usb_packet: addr: "Address: 92" "Addr: 92" "Addr" "A"
646092-646156 usb_packet: ep: "Endpoint: 0" "EP: 0" "EP" "E"
646156-646236 usb_packet: crc5-ok: "CRC5: 0x1C" "CRC5" "C"
645724-646284 usb_packet: packet-in: "IN ADDR 92 EP 0"
646346-646474 usb_packet: sync-ok: "SYNC: 00000001" "SYNC" "S"
646474-646602 usb_packet: pid: "PID: NAK" "NAK" "N"
646346-646650 usb_packet: packet-nak: "NAK"
649291-649419 usb_packet: sync-ok: "SYNC: 00000001" "SYNC" "S"
649419-649547 usb_packet: pid: "PID: IN" "IN" "I"
649547-649659 usb_packet: addr: "Address: 92" "Addr: 92" "Addr" "A"
649659-649723 usb_packet: ep: "Endpoint: 0" "EP: 0" "EP" "E"
649723-649803 usb_packet: crc5-ok: "CRC5: 0x1C" "CRC5" "C"
649291-649851 usb_packet: packet-in: "IN ADDR 92 EP 0"
649913-650041 usb_packet: sync-ok: "SYNC: 00000001" "SYNC" "S"
650041-650169 usb_packet: pid: "PID: DATA1" "DATA1" "D"
650169-650297 usb_packet: data: "Databyte: 1E" "Data: 1E" "DB: 1E" "1E"
650297-650425 usb_packet: data: "Databyte: 03" "Data: 03" "DB: 03" "03"
650425-650553 usb_packet: data: "Databyte: 4D" "Data: 4D" "DB: 4D" "4D"
650553-650681 usb_packet: data: "Databyte: 00" "Data: 00" "DB: 00" "00"
650681-650809 usb_packet: data: "Databyte: 69" "Data: 69" "DB: 69" "69"
650809-650937 usb_packet: data: "Databyte: 00" "Data: 00" "DB: 00" "00"
650937-651065 usb_packet: data: "Databyte: 63" "Data: 63" "DB: 63" "63"
651065-651193 usb_packet: data: "Databyte: 00" "Data: 00" "DB: 00" "00"
651193-651449 usb_packet: crc16-ok: "CRC16: 0xC536" "CRC16" "C"
649913-651497 usb_packet: packet-data1: "DATA1 [ 1E 03 4D 00 69 00 63 00 ]"
651561-651689 usb_packet: sync-ok: "SYNC: 00000001" "SYNC" "S"
651689-651817 usb_packet: pid: "PID: ACK" "ACK" "A"
651561-651865 usb_packet: packet-ack: "ACK"
652073-652201 usb_packet: sync-ok: "SYNC: 00000001" "SYNC" "S"
652201-652329 usb_packet: pid: "PID: IN" "IN" "I"
652329-652441 usb_packet: addr: "Address: 92" "Addr: 92" "Addr" "A"
652441-652505 usb_packet: ep: "Endpoint: 0" "EP: 0" "EP" "E"
652505-652585 usb_packet: crc5-ok: "CRC5: 0x1C" "CRC5" "C"
652073-652633 usb_packet: packet-in: "IN ADDR 92 EP 0"
652695-652823 usb_packet: sync-ok: "SYNC: 00000001" "SYNC" "S"
652823-652951 usb_packet: pid: "PID: NAK" "NAK" "N"
652695-652999 usb_packet: packet-nak: "NAK"
653163-653291 usb_packet: sync-ok: "SYNC: 00000001" "SYNC" "S"
653291-653419 usb_packet: pid: "PID: IN" "IN" "I"
653419-653531 usb_packet: addr: "Address: 92" "Addr: 92" "Addr" "A"
653531-653595 usb_packet: ep: "Endpoint: 0" "EP: 0" "EP" "E"
653595-653675 usb_packet: crc5-ok: "CRC5: 0x1C" "CRC5" "C"
653163-653723 usb_packet: packet-in: "IN ADDR 92 EP 0"
653785-653913 usb_packet: sync-ok: "SYNC: 00000001" "SYNC" "S"
653913-654041 usb_packet: pid: "PID: DATA0" "DATA0" "D"
654041-654169 usb_packet: data: "Databyte: 72" "Data: 72" "DB: 72" "72"
654169-654297 usb_packet: data: "Databyte: 00" "Data: 00" "DB: 00" "00"
654297-654425 usb_packet: data: "Databyte: 6F" "Data: 6F" "DB: 6F" "6F"
654425-654553 usb_packet: data: "Databyte: 00" "Data: 00" "DB: 00" "00"
654553-654681 usb_packet: data: "Databyte: 20" "Data: 20" "DB: 20" "20"
654681-654809 usb_packet: data: "Databyte: 00" "Data: 00" "DB: 00" "00"
654809-654937 usb_packet: data: "Databyte: 4B" "Data: 4B" "DB: 4B" "4B"
654937-655065 usb_packet: data: "Databyte: 00" "Data: 00" "DB: 00" "00"
655065-655321 usb_packet: crc16-ok: "CRC16: 0x660D" "CRC16" "C"
653785-655369 usb_packet: packet-data0: "DATA0 [ 72 00 6F 00 20 00 4B 00 ]"
655433-655561 usb_packet: sync-ok: "SYNC: 00000001" "SYNC" "S"
655561-655689 usb_packet: pid: "PID: ACK" "ACK" "A"
655433-655737 usb_packet: packet-ack: "ACK"
655945-656073 usb_packet: sync-ok: "SYNC: 00000001" "SYNC" "S"
656073-656201 usb_packet: pid: "PID: IN" "IN" "I"
656201-656313 usb_packet: addr: "Address: 92" "Addr: 92" "Addr" "A"
656313-656377 usb_packet: ep: "Endpoint: 0" "EP: 0" "EP" "E"
656377-656457 usb_packet: crc5-ok: "CRC5: 0x1C" "CRC5" "C"
655945-656505 usb_packet: packet-in: "IN ADDR 92 EP 0"
656567-656695 usb_packet: sync-ok: "SYNC: 00000001" "SYNC" "S"
656695-656823 usb_packet: pid: "PID: NAK" "NAK" "N"
656567-656871 usb_packet: packet-nak: "NAK"
657022-657150 usb_packet: sync-ok: "SYNC: 00000001" "SYNC" "S"
657150-657278 usb_packet: pid: "PID: IN" "IN" "I"
657278-657390 usb_packet: addr: "Address: 92" "Addr: 92" "Addr" "A"
657390-657454 usb_packet: ep: "Endpoint: 0" "EP: 0" "EP" "E"
657454-657534 usb_packet: crc5-ok: "CRC5: 0x1C" "CRC5" "C"
657022-657582 usb_packet: packet-in: "IN ADDR 92 EP 0"
657644-657772 usb_packet: sync-ok: "SYNC: 00000001" "SYNC" "S"
657772-657900 usb_packet: pid: "PID: DATA1" "DATA1" "D"
657900-658028 usb_packet: data: "Databyte: 65" "Data: 65" "DB: 65" "65"
658028-658156 usb_packet: data: "Databyte: 00" "Data: 00" "DB: 00" "00"
658156-658284 usb_packet: data: "Databyte: 79" "Data: 79" "DB: 79" "79"
658284-658412 usb_packet: data: "Databyte: 00" "Data: 00" "DB: 00" "00"
658412-658540 usb_packet: data: "Databyte: 62" "Data: 62" "DB: 62" "62"
658540-658668 usb_packet: data: "Databyte: 00" "Data: 00" "DB: 00" "00"
658668-658796 usb_packet: data: "Databyte: 6F" "Data: 6F" "DB: 6F" "6F"
658796-658924 usb_packet: data: "Databyte: 00" "Data: 00" "DB: 00" "00"
658924-659180 usb_packet: crc16-ok: "CRC16: 0x0240" "CRC16" "C"
657644-659228 usb_packet: packet-data1: "DATA1 [ 65 00 79 00 62 00 6F 00 ]"
659293-659421 usb_packet: sync-ok: "SYNC: 00000001" "SYNC" "S"
659421-659549 usb_packet: pid: "PID: ACK" "ACK" "A"
659293-659597 usb_packet: packet-ack: "ACK"
659834-659962 usb_packet: sync-ok: "SYNC: 00000001" "SYNC" "S"
659962-660090 usb_packet: pid: "PID: IN" "IN" "I"
660090-660202 usb_packet: addr: "Address: 92" "Addr: 92" "Addr" "A"
660202-660266 usb_packet: ep: "Endpoint: 0" "EP: 0" "EP" "E"
660266-660346 usb_packet: crc5-ok: "CRC5: 0x1C" "CRC5" "C"
659834-660394 usb_packet: packet-in: "IN ADDR 92 EP 0"
660455-660583 usb_packet: sync-ok: "SYNC: 00000001" "SYNC" "S"
660583-660711 usb_packet: pid: "PID: NAK" "NAK" "N"
660455-660759 usb_packet: packet-nak: "NAK"
660911-661039 usb_packet: sync-ok: "SYNC: 00000001" "SYNC" "S"
661039-661167 usb_packet: pid: "PID: IN" "IN" "I"
661167-661279 usb_packet: addr: "Address: 92" "Addr: 92" "Addr" "A"
661279-661343 usb_packet: ep: "Endpoint: 0" "EP: 0" "EP" "E"
661343-661423 usb_packet: crc5-ok: "CRC5: 0x1C" "CRC5" "C"
660911-661471 usb_packet: packet-in: "IN ADDR 92 EP 0"
661532-661660 usb_packet: sync-ok: "SYNC: 00000001" "SYNC" "S"
661660-661788 usb_packet: pid: "PID: DATA0" "DATA0" "D"
661788-661916 usb_packet: data: "Databyte: 61" "Data: 61" "DB: 61" "61"
661916-662044 usb_packet: data: "Databyte: 00" "Data: 00" "DB: 00" "00"
662044-662172 usb_packet: data: "Databyte: 72" "Data: 72" "DB: 72" "72"
662172-662300 usb_packet: data: "Databyte: 00" "Data: 00" "DB: 00" "00"
662300-662428 usb_packet: data: "Databyte: 64" "Data: 64" "DB: 64" "64"
662428-662556 usb_packet: data: "Databyte: 00" "Data: 00" "DB: 00" "00"
662556-662812 usb_packet: crc16-ok: "CRC16: 0x2DC6" "CRC16" "C"
661532-662860 usb_packet: packet-data0: "DATA0 [ 61 00 72 00 64 00 ]"
662925-663053 usb_packet: sync-ok: "SYNC: 00000001" "SYNC" "S"
663053-663181 usb_packet: pid: "PID: ACK" "ACK" "A"
662925-663229 usb_packet: packet-ack: "ACK"
663496-663624 usb_packet: sync-ok: "SYNC: 00000001" "SYNC" "S"
663624-663752 usb_packet: pid: "PID: OUT" "OUT" "O"
663752-663864 usb_packet: addr: "Address: 92" "Addr: 92" "Addr" "A"
663864-663928 usb_packet: ep: "Endpoint: 0" "EP: 0" "EP" "E"
663928-664008 usb_packet: crc5-ok: "CRC5: 0x1C" "CRC5" "C"
663496-664056 usb_packet: packet-out: "OUT ADDR 92 EP 0"
664149-664277 usb_packet: sync-ok: "SYNC: 00000001" "SYNC" "S"
664277-664405 usb_packet: pid: "PID: DATA1" "DATA1" "D"
664405-664661 usb_packet: crc16-ok: "CRC16: 0x0000" "CRC16" "C"
664149-664709 usb_packet: packet-data1: "DATA1 [ ]"
664771-664899 usb_packet: sync-ok: "SYNC: 00000001" "SYNC" "S"
664899-665027 usb_packet: pid: "PID: ACK" "ACK" "A"
664771-665075 usb_packet: packet-ack: "ACK"
667772-667900 usb_packet: sync-ok: "SYNC: 00000001" "SYNC" "S"
667900-668028 usb_packet: pid: "PID: SETUP" "SETUP" "S"
668028-668140 usb_packet: addr: "Address: 92" "Addr: 92" "Addr" "A"
668140-668204 usb_packet: ep: "Endpoint: 0" "EP: 0" "EP" "E"
668204-668284 usb_packet: crc5-ok: "CRC5: 0x1C" "CRC5" "C"
667772-668332 usb_packet: packet-setup: "SETUP ADDR 92 EP 0"
668426-668554 usb_packet: sync-ok: "SYNC: 00000001" "SYNC" "S"
668554-668682 usb_packet: pid: "PID: DATA0" "DATA0" "D"
668682-668810 usb_packet: data: "Databyte: 80" "Data: 80" "DB: 80" "80"
668810-668938 usb_packet: data: "Databyte: 06" "Data: 06" "DB: 06" "06"
668938-669066 usb_packet: data: "Databyte: 01" "Data: 01" "DB: 01" "01"
669066-669194 usb_packet: data: "Databyte: 03" "Data: 03" "DB: 03" "03"
669194-669322 usb_packet: data: "Databyte: 09" "Data: 09" "DB: 09" "09"
669322-669450 usb_packet: data: "Databyte: 04" "Data: 04" "DB: 04" "04"
669450-669594 usb_packet: data: "Databyte: FF" "Data: FF" "DB: FF" "FF"
669594-669722 usb_packet: data: "Databyte: 00" "Data: 00" "DB: 00" "00"
669722-669978 usb_packet: crc16-ok: "CRC16: 0xE897" "CRC16" "C"
668426-670026 usb_packet: packet-data0: "DATA0 [ 80 06 01 03 09 04 FF 00 ]"
670088-670216 usb_packet: sync-ok: "SYNC: 00000001" "SYNC" "S"
670216-670344 usb_packet: pid: "PID: ACK" "ACK" "A"
670088-670392 usb_packet: packet-ack: "ACK"
673296-673424 usb_packet: sync-ok: "SYNC: 00000001" "SYNC" "S"
673424-673552 usb_packet: pid: "PID: IN" "IN" "I"
673552-673664 usb_packet: addr: "Address: 92" "Addr: 92" "Addr" "A"
673664-673728 usb_packet: ep: "Endpoint: 0" "EP: 0" "EP" "E"
673728-673808 usb_packet: crc5-ok: "CRC5: 0x1C" "CRC5" "C"
673296-673856 usb_packet: packet-in: "IN ADDR 92 EP 0"
673918-674046 usb_packet: sync-ok: "SYNC: 00000001" "SYNC" "S"
674046-674174 usb_packet: pid: "PID: DATA1" "DATA1" "D"
674174-674302 usb_packet: data: "Databyte: 0E" "Data: 0E" "DB: 0E" "0E"
674302-674430 usb_packet: data: "Databyte: 03" "Data: 03" "DB: 03" "03"
674430-674558 usb_packet: data: "Databyte: 52" "Data: 52" "DB: 52" "52"
674558-674686 usb_packet: data: "Databyte: 00" "Data: 00" "DB: 00" "00"
674686-674814 usb_packet: data: "Databyte: 69" "Data: 69" "DB: 69" "69"
674814-674942 usb_packet: data: "Databyte: 00" "Data: 00" "DB: 00" "00"
674942-675070 usb_packet: data: "Databyte: 69" "Data: 69" "DB: 69" "69"
675070-675198 usb_packet: data: "Databyte: 00" "Data: 00" "DB: 00" "00"
675198-675454 usb_packet: crc16-ok: "CRC16: 0x0633" "CRC16" "C"
673918-675502 usb_packet: packet-data1: "DATA1 [ 0E 03 52 00 69 00 69 00 ]"
675566-675694 usb_packet: sync-ok: "SYNC: 00000001" "SYNC" "S"
675694-675822 usb_packet: pid: "PID: ACK" "ACK" "A"
675566-675870 usb_packet: packet-ack: "ACK"
676242-676370 usb_packet: sync-ok: "SYNC: 00000001" "SYNC" "S"
676370-676498 usb_packet: pid: "PID: IN" "IN" "I"
676498-676610 usb_packet: addr: "Address: 92" "Addr: 92" "Addr" "A"
676610-676674 usb_packet: ep: "Endpoint: 0" "EP: 0" "EP" "E"
676674-676754 usb_packet: crc5-ok: "CRC5: 0x1C" "CRC5" "C"
676242-676802 usb_packet: packet-in: "IN ADDR 92 EP 0"
676864-676992 usb_packet: sync-ok: "SYNC: 00000001" "SYNC" "S"
676992-677120 usb_packet: pid: "PID: NAK" "NAK" "N"
676864-677168 usb_packet: packet-nak: "NAK"
677319-677447 usb_packet: sync-ok: "SYNC: 00000001" "SYNC" "S"
677447-677575 usb_packet: pid: "PID: IN" "IN" "I"
677575-677687 usb_packet: addr: "Address: 92" "Addr: 92" "Addr" "A"
677687-677751 usb_packet: ep: "Endpoint: 0" "EP: 0" "EP" "E"
677751-677831 usb_packet: crc5-ok: "CRC5: 0x1C" "CRC5" "C"
677319-677879 usb_packet: packet-in: "IN ADDR 92 EP 0"
677940-678068 usb_packet: sync-ok: "SYNC: 00000001" "SYNC" "S"
678068-678196 usb_packet: pid: "PID: DATA0" "DATA0" "D"
678196-678324 usb_packet: data: "Databyte: 74" "Data: 74" "DB: 74" "74"
678324-678452 usb_packet: data: "Databyte: 00" "Data: 00" "DB: 00" "00"
678452-678580 usb_packet: data: "Databyte: 65" "Data: 65" "DB: 65" "65"
678580-678708 usb_packet: data: "Databyte: 00" "Data: 00" "DB: 00" "00"
678708-678836 usb_packet: data: "Databyte: 6B" "Data: 6B" "DB: 6B" "6B"
678836-678964 usb_packet: data: "Databyte: 00" "Data: 00" "DB: 00" "00"
678964-679220 usb_packet: crc16-ok: "CRC16: 0xACC4" "CRC16" "C"
677940-679268 usb_packet: packet-data0: "DATA0 [ 74 00 65 00 6B 00 ]"
679336-679464 usb_packet: sync-ok: "SYNC: 00000001" "SYNC" "S"
679464-679592 usb_packet: pid: "PID: ACK" "ACK" "A"
679336-679640 usb_packet: packet-ack: "ACK"
679857-679985 usb_packet: sync-ok: "SYNC: 00000001" "SYNC" "S"
679985-680113 usb_packet: pid: "PID: OUT" "OUT" "O"
680113-680225 usb_packet: addr: "Address: 92" "Addr: 92" "Addr" "A"
680225-680289 usb_packet: ep: "Endpoint: 0" "EP: 0" "EP" "E"
680289-680369 usb_packet: crc5-ok: "CRC5: 0x1C" "CRC5" "C"
679857-680417 usb_packet: packet-out: "OUT ADDR 92 EP 0"
680511-680639 usb_packet: sync-ok: "SYNC: 00000001" "SYNC" "S"
680639-680767 usb_packet: pid: "PID: DATA1" "DATA1" "D"
680767-681023 usb_packet: crc16-ok: "CRC16: 0x0000" "CRC16" "C"
680511-681071 usb_packet: packet-data1: "DATA1 [ ]"
681133-681261 usb_packet: sync-ok: "SYNC: 00000001" "SYNC" "S"
681261-681389 usb_packet: pid: "PID: ACK" "ACK" "A"
681133-681437 usb_packet: packet-ack: "ACK"
686333-686461 usb_packet: sync-ok: "SYNC: 00000001" "SYNC" "S"
686461-686589 usb_packet: pid: "PID: SETUP" "SETUP" "S"
686589-686701 usb_packet: addr: "Address: 92" "Addr: 92" "Addr" "A"
686701-686765 usb_packet: ep: "Endpoint: 0" "EP: 0" "EP" "E"
686765-686845 usb_packet: crc5-ok: "CRC5: 0x1C" "CRC5" "C"
686333-686893 usb_packet: packet-setup: "SETUP ADDR 92 EP 0"
686986-687114 usb_packet: sync-ok: "SYNC: 00000001" "SYNC" "S"
687114-687242 usb_packet: pid: "PID: DATA0" "DATA0" "D"
687242-687370 usb_packet: data: "Databyte: 00" "Data: 00" "DB: 00" "00"
687370-687498 usb_packet: data: "Databyte: 09" "Data: 09" "DB: 09" "09"
687498-687626 usb_packet: data: "Databyte: 01" "Data: 01" "DB: 01" "01"
687626-687754 usb_packet: data: "Databyte: 00" "Data: 00" "DB: 00" "00"
687754-687882 usb_packet: data: "Databyte: 00" "Data: 00" "DB: 00" "00"
687882-688010 usb_packet: data: "Databyte: 00" "Data: 00" "DB: 00" "00"
688010-688138 usb_packet: data: "Databyte: 00" "Data: 00" "DB: 00" "00"
688138-688266 usb_packet: data: "Databyte: 00" "Data: 00" "DB: 00" "00"
688266-688522 usb_packet: crc16-ok: "CRC16: 0x2527" "CRC16" "C"
686986-688570 usb_packet: packet-data0: "DATA0 [ 00 09 01 00 00 00 00 00 ]"
688633-688761 usb_packet: sync-ok: "SYNC: 00000001" "SYNC" "S"
688761-688889 usb_packet: pid: "PID: ACK" "ACK" "A"
688633-688937 usb_packet: packet-ack: "ACK"
689141-689269 usb_packet: sync-ok: "SYNC: 00000001" "SYNC" "S"
689269-689397 usb_packet: pid: "PID: IN" "IN" "I"
689397-689509 usb_packet: addr: "Address: 92" "Addr: 92" "Addr" "A"
689509-689573 usb_packet: ep: "Endpoint: 0" "EP: 0" "EP" "E"
689573-689653 usb_packet: crc5-ok: "CRC5: 0x1C" "CRC5" "C"
689141-689701 usb_packet: packet-in: "IN ADDR 92 EP 0"
689762-689890 usb_packet: sync-ok: "SYNC: 00000001" "SYNC" "S"
689890-690018 usb_packet: pid: "PID: NAK" "NAK" "N"
689762-690066 usb_packet: packet-nak: "NAK"
690264-690392 usb_packet: sync-ok: "SYNC: 00000001" "SYNC" "S"
690392-690520 usb_packet: pid: "PID: IN" "IN" "I"
690520-690632 usb_packet: addr: "Address: 92" "Addr: 92" "Addr" "A"
690632-690696 usb_packet: ep: "Endpoint: 0" "EP: 0" "EP" "E"
690696-690776 usb_packet: crc5-ok: "CRC5: 0x1C" "CRC5" "C"
690264-690824 usb_packet: packet-in: "IN ADDR 92 EP 0"
690885-691013 usb_packet: sync-ok: "SYNC: 00000001" "SYNC" "S"
691013-691141 usb_packet: pid: "PID: NAK" "NAK" "N"
690885-691189 usb_packet: packet-nak: "NAK"
691371-691499 usb_packet: sync-ok: "SYNC: 00000001" "SYNC" "S"
691499-691627 usb_packet: pid: "PID: IN" "IN" "I"
691627-691739 usb_packet: addr: "Address: 92" "Addr: 92" "Addr" "A"
691739-691803 usb_packet: ep: "Endpoint: 0" "EP: 0" "EP" "E"
691803-691883 usb_packet: crc5-ok: "CRC5: 0x1C" "CRC5" "C"
691371-691931 usb_packet: packet-in: "IN ADDR 92 EP 0"
691995-692123 usb_packet: sync-ok: "SYNC: 00000001" "SYNC" "S"
692123-692251 usb_packet: pid: "PID: DATA1" "DATA1" "D"
692251-692507 usb_packet: crc16-ok: "CRC16: 0x0000" "CRC16" "C"
691995-692555 usb_packet: packet-data1: "DATA1 [ ]"
692629-692757 usb_packet: sync-ok: "SYNC: 00000001" "SYNC" "S"
692757-692885 usb_packet: pid: "PID: ACK" "ACK" "A"
692629-692933 usb_packet: packet-ack: "ACK"
730723-730851 usb_packet: sync-ok: "SYNC: 00000001" "SYNC" "S"
730851-730979 usb_packet: pid: "PID: SETUP" "SETUP" "S"
730979-731091 usb_packet: addr: "Address: 92" "Addr: 92" "Addr" "A"
731091-731155 usb_packet: ep: "Endpoint: 0" "EP: 0" "EP" "E"
731155-731235 usb_packet: crc5-ok: "CRC5: 0x1C" "CRC5" "C"
730723-731283 usb_packet: packet-setup: "SETUP ADDR 92 EP 0"
731376-731504 usb_packet: sync-ok: "SYNC: 00000001" "SYNC" "S"
731504-731632 usb_packet: pid: "PID: DATA0" "DATA0" "D"
731632-731760 usb_packet: data: "Databyte: 21" "Data: 21" "DB: 21" "21"
731760-731888 usb_packet: data: "Databyte: 0A" "Data: 0A" "DB: 0A" "0A"
731888-732016 usb_packet: data: "Databyte: 00" "Data: 00" "DB: 00" "00"
732016-732144 usb_packet: data: "Databyte: 00" "Data: 00" "DB: 00" "00"
732144-732272 usb_packet: data: "Databyte: 00" "Data: 00" "DB: 00" "00"
732272-732400 usb_packet: data: "Databyte: 00" "Data: 00" "DB: 00" "00"
732400-732528 usb_packet: data: "Databyte: 00" "Data: 00" "DB: 00" "00"
732528-732656 usb_packet: data: "Databyte: 00" "Data: 00" "DB: 00" "00"
732656-732912 usb_packet: crc16-ok: "CRC16: 0x20D6" "CRC16" "C"
731376-732960 usb_packet: packet-data0: "DATA0 [ 21 0A 00 00 00 00 00 00 ]"
733023-733151 usb_packet: sync-ok: "SYNC: 00000001" "SYNC" "S"
733151-733279 usb_packet: pid: "PID: ACK" "ACK" "A"
733023-733327 usb_packet: packet-ack: "ACK"
733526-733654 usb_packet: sync-ok: "SYNC: 00000001" "SYNC" "S"
733654-733782 usb_packet: pid: "PID: IN" "IN" "I"
733782-733894 usb_packet: addr: "Address: 92" "Addr: 92" "Addr" "A"
733894-733958 usb_packet: ep: "Endpoint: 0" "EP: 0" "EP" "E"
733958-734038 usb_packet: crc5-ok: "CRC5: 0x1C" "CRC5" "C"
733526-734086 usb_packet: packet-in: "IN ADDR 92 EP 0"
734147-734275 usb_packet: sync-ok: "SYNC: 00000001" "SYNC" "S"
734275-734403 usb_packet: pid: "PID: DATA1" "DATA1" "D"
734403-734659 usb_packet: crc16-ok: "CRC16: 0x0000" "CRC16" "C"
734147-734707 usb_packet: packet-data1: "DATA1 [ ]"
734774-734902 usb_packet: sync-ok: "SYNC: 00000001" "SYNC" "S"
734902-735030 usb_packet: pid: "PID: ACK" "ACK" "A"
734774-735078 usb_packet: packet-ack: "ACK"
736754-736882 usb_packet: sync-ok: "SYNC: 00000001" "SYNC" "S"
736882-737010 usb_packet: pid: "PID: SETUP" "SETUP" "S"
737010-737122 usb_packet: addr: "Address: 92" "Addr: 92" "Addr" "A"
737122-737186 usb_packet: ep: "Endpoint: 0" "EP: 0" "EP" "E"
737186-737266 usb_packet: crc5-ok: "CRC5: 0x1C" "CRC5" "C"
736754-737314 usb_packet: packet-setup: "SETUP ADDR 92 EP 0"
737407-737535 usb_packet: sync-ok: "SYNC: 00000001" "SYNC" "S"
737535-737663 usb_packet: pid: "PID: DATA0" "DATA0" "D"
737663-737791 usb_packet: data: "Databyte: 81" "Data: 81" "DB: 81" "81"
737791-737919 usb_packet: data: "Databyte: 06" "Data: 06" "DB: 06" "06"
737919-738047 usb_packet: data: "Databyte: 00" "Data: 00" "DB: 00" "00"
738047-738175 usb_packet: data: "Databyte: 22" "Data: 22" "DB: 22" "22"
738175-738303 usb_packet: data: "Databyte: 00" "Data: 00" "DB: 00" "00"
738303-738431 usb_packet: data: "Databyte: 00" "Data: 00" "DB: 00" "00"
738431-738575 usb_packet: data: "Databyte: 3F" "Data: 3F" "DB: 3F" "3F"
738575-738703 usb_packet: data: "Databyte: 00" "Data: 00" "DB: 00" "00"
738703-738975 usb_packet: crc16-ok: "CRC16: 0xAFF9" "CRC16" "C"
737407-739023 usb_packet: packet-data0: "DATA0 [ 81 06 00 22 00 00 3F 00 ]"
739085-739213 usb_packet: sync-ok: "SYNC: 00000001" "SYNC" "S"
739213-739341 usb_packet: pid: "PID: ACK" "ACK" "A"
739085-739389 usb_packet: packet-ack: "ACK"
739589-739717 usb_packet: sync-ok: "SYNC: 00000001" "SYNC" "S"
739717-739845 usb_packet: pid: "PID: IN" "IN" "I"
739845-739957 usb_packet: addr: "Address: 92" "Addr: 92" "Addr" "A"
739957-740021 usb_packet: ep: "Endpoint: 0" "EP: 0" "EP" "E"
740021-740101 usb_packet: crc5-ok: "CRC5: 0x1C" "CRC5" "C"
739589-740149 usb_packet: packet-in: "IN ADDR 92 EP 0"
740211-740339 usb_packet: sync-ok: "SYNC: 00000001" "SYNC" "S"
740339-740467 usb_packet: pid: "PID: NAK" "NAK" "N"
740211-740515 usb_packet: packet-nak: "NAK"
740667-740795 usb_packet: sync-ok: "SYNC: 00000001" "SYNC" "S"
740795-740923 usb_packet: pid: "PID: IN" "IN" "I"
740923-741035 usb_packet: addr: "Address: 92" "Addr: 92" "Addr" "A"
741035-741099 usb_packet: ep: "Endpoint: 0" "EP: 0" "EP" "E"
741099-741179 usb_packet: crc5-ok: "CRC5: 0x1C" "CRC5" "C"
740667-741227 usb_packet: packet-in: "IN ADDR 92 EP 0"
741289-741417 usb_packet: sync-ok: "SYNC: 00000001" "SYNC" "S"
741417-741545 usb_packet: pid: "PID: NAK" "NAK" "N"
741289-741593 usb_packet: packet-nak: "NAK"
741744-741872 usb_packet: sync-ok: "SYNC: 00000001" "SYNC" "S"
741872-742000 usb_packet: pid: "PID: IN" "IN" "I"
742000-742112 usb_packet: addr: "Address: 92" "Addr: 92" "Addr" "A"
742112-742176 usb_packet: ep: "Endpoint: 0" "EP: 0" "EP" "E"
742176-742256 usb_packet: crc5-ok: "CRC5: 0x1C" "CRC5" "C"
741744-742304 usb_packet: packet-in: "IN ADDR 92 EP 0"
742365-742493 usb_packet: sync-ok: "SYNC: 00000001" "SYNC" "S"
742493-742621 usb_packet: pid: "PID: NAK" "NAK" "N"
742365-742669 usb_packet: packet-nak: "NAK"
745310-745438 usb_packet: sync-ok: "SYNC: 00000001" "SYNC" "S"
745438-745566 usb_packet: pid: "PID: IN" "IN" "I"
745566-745678 usb_packet: addr: "Address: 92" "Addr: 92" "Addr" "A"
745678-745742 usb_packet: ep: "Endpoint: 0" "EP: 0" "EP" "E"
745742-745822 usb_packet: crc5-ok: "CRC5: 0x1C" "CRC5" "C"
745310-745870 usb_packet: packet-in: "IN ADDR 92 EP 0"
745932-746060 usb_packet: sync-ok: "SYNC: 00000001" "SYNC" "S"
746060-746188 usb_packet: pid: "PID: DATA1" "DATA1" "D"
746188-746316 usb_packet: data: "Databyte: 05" "Data: 05" "DB: 05" "05"
746316-746444 usb_packet: data: "Databyte: 01" "Data: 01" "DB: 01" "01"
746444-746572 usb_packet: data: "Databyte: 09" "Data: 09" "DB: 09" "09"
746572-746700 usb_packet: data: "Databyte: 06" "Data: 06" "DB: 06" "06"
746700-746828 usb_packet: data: "Databyte: A1" "Data: A1" "DB: A1" "A1"
746828-746956 usb_packet: data: "Databyte: 01" "Data: 01" "DB: 01" "01"
746956-747084 usb_packet: data: "Databyte: 05" "Data: 05" "DB: 05" "05"
747084-747212 usb_packet: data: "Databyte: 07" "Data: 07" "DB: 07" "07"
747212-747468 usb_packet: crc16-ok: "CRC16: 0x3CD7" "CRC16" "C"
745932-747516 usb_packet: packet-data1: "DATA1 [ 05 01 09 06 A1 01 05 07 ]"
747580-747708 usb_packet: sync-ok: "SYNC: 00000001" "SYNC" "S"
747708-747836 usb_packet: pid: "PID: ACK" "ACK" "A"
747580-747884 usb_packet: packet-ack: "ACK"
748092-748220 usb_packet: sync-ok: "SYNC: 00000001" "SYNC" "S"
748220-748348 usb_packet: pid: "PID: IN" "IN" "I"
748348-748460 usb_packet: addr: "Address: 92" "Addr: 92" "Addr" "A"
748460-748524 usb_packet: ep: "Endpoint: 0" "EP: 0" "EP" "E"
748524-748604 usb_packet: crc5-ok: "CRC5: 0x1C" "CRC5" "C"
748092-748652 usb_packet: packet-in: "IN ADDR 92 EP 0"
748714-748842 usb_packet: sync-ok: "SYNC: 00000001" "SYNC" "S"
748842-748970 usb_packet: pid: "PID: NAK" "NAK" "N"
748714-749018 usb_packet: packet-nak: "NAK"
749182-749310 usb_packet: sync-ok: "SYNC: 00000001" "SYNC" "S"
749310-749438 usb_packet: pid: "PID: IN" "IN" "I"
749438-749550 usb_packet: addr: "Address: 92" "Addr: 92" "Addr" "A"
749550-749614 usb_packet: ep: "Endpoint: 0" "EP: 0" "EP" "E"
749614-749694 usb_packet: crc5-ok: "CRC5: 0x1C" "CRC5" "C"
749182-749742 usb_packet: packet-in: "IN ADDR 92 EP 0"
749804-749932 usb_packet: sync-ok: "SYNC: 00000001" "SYNC" "S"
749932-750060 usb_packet: pid: "PID: DATA0" "DATA0" "D"
750060-750188 usb_packet: data: "Databyte: 19" "Data: 19" "DB: 19" "19"
750188-750316 usb_packet: data: "Databyte: E0" "Data: E0" "DB: E0" "E0"
750316-750444 usb_packet: data: "Databyte: 29" "Data: 29" "DB: 29" "29"
750444-750572 usb_packet: data: "Databyte: E7" "Data: E7" "DB: E7" "E7"
750572-750700 usb_packet: data: "Databyte: 15" "Data: 15" "DB: 15" "15"
750700-750828 usb_packet: data: "Databyte: 00" "Data: 00" "DB: 00" "00"
750828-750956 usb_packet: data: "Databyte: 25" "Data: 25" "DB: 25" "25"
750956-751084 usb_packet: data: "Databyte: 01" "Data: 01" "DB: 01" "01"
751084-751340 usb_packet: crc16-ok: "CRC16: 0xEF73" "CRC16" "C"
749804-751388 usb_packet: packet-data0: "DATA0 [ 19 E0 29 E7 15 00 25 01 ]"
751452-751580 usb_packet: sync-ok: "SYNC: 00000001" "SYNC" "S"
751580-751708 usb_packet: pid: "PID: ACK" "ACK" "A"
751452-751756 usb_packet: packet-ack: "ACK"
751964-752092 usb_packet: sync-ok: "SYNC: 00000001" "SYNC" "S"
752092-752220 usb_packet: pid: "PID: IN" "IN" "I"
752220-752332 usb_packet: addr: "Address: 92" "Addr: 92" "Addr" "A"
752332-752396 usb_packet: ep: "Endpoint: 0" "EP: 0" "EP" "E"
752396-752476 usb_packet: crc5-ok: "CRC5: 0x1C" "CRC5" "C"
751964-752524 usb_packet: packet-in: "IN ADDR 92 EP 0"
752586-752714 usb_packet: sync-ok: "SYNC: 00000001" "SYNC" "S"
752714-752842 usb_packet: pid: "PID: NAK" "NAK" "N"
752586-752890 usb_packet: packet-nak: "NAK"
753042-753170 usb_packet: sync-ok: "SYNC: 00000001" "SYNC" "S"
753170-753298 usb_packet: pid: "PID: IN" "IN" "I"
753298-753410 usb_packet: addr: "Address: 92" "Addr: 92" "Addr" "A"
753410-753474 usb_packet: ep: "Endpoint: 0" "EP: 0" "EP" "E"
753474-753554 usb_packet: crc5-ok: "CRC5: 0x1C" "CRC5" "C"
753042-753602 usb_packet: packet-in: "IN ADDR 92 EP 0"
753664-753792 usb_packet: sync-ok: "SYNC: 00000001" "SYNC" "S"
753792-753920 usb_packet: pid: "PID: DATA1" "DATA1" "D"
753920-754048 usb_packet: data: "Databyte: 75" "Data: 75" "DB: 75" "75"
754048-754176 usb_packet: data: "Databyte: 01" "Data: 01" "DB: 01" "01"
754176-754304 usb_packet: data: "Databyte: 95" "Data: 95" "DB: 95" "95"
754304-754432 usb_packet: data: "Databyte: 08" "Data: 08" "DB: 08" "08"
754432-754560 usb_packet: data: "Databyte: 81" "Data: 81" "DB: 81" "81"
754560-754688 usb_packet: data: "Databyte: 02" "Data: 02" "DB: 02" "02"
754688-754816 usb_packet: data: "Databyte: 95" "Data: 95" "DB: 95" "95"
754816-754944 usb_packet: data: "Databyte: 01" "Data: 01" "DB: 01" "01"
754944-755200 usb_packet: crc16-ok: "CRC16: 0x87B3" "CRC16" "C"
753664-755248 usb_packet: packet-data1: "DATA1 [ 75 01 95 08 81 02 95 01 ]"
755312-755440 usb_packet: sync-ok: "SYNC: 00000001" "SYNC" "S"
755440-755568 usb_packet: pid: "PID: ACK" "ACK" "A"
755312-755616 usb_packet: packet-ack: "ACK"
755853-755981 usb_packet: sync-ok: "SYNC: 00000001" "SYNC" "S"
755981-756109 usb_packet: pid: "PID: IN" "IN" "I"
756109-756221 usb_packet: addr: "Address: 92" "Addr: 92" "Addr" "A"
756221-756285 usb_packet: ep: "Endpoint: 0" "EP: 0" "EP" "E"
756285-756365 usb_packet: crc5-ok: "CRC5: 0x1C" "CRC5" "C"
755853-756413 usb_packet: packet-in: "IN ADDR 92 EP 0"
756474-756602 usb_packet: sync-ok: "SYNC: 00000001" "SYNC" "S"
756602-756730 usb_packet: pid: "PID: NAK" "NAK" "N"
756474-756778 usb_packet: packet-nak: "NAK"
756930-757058 usb_packet: sync-ok: "SYNC: 00000001" "SYNC" "S"
757058-757186 usb_packet: pid: "PID: IN" "IN" "I"
757186-757298 usb_packet: addr: "Address: 92" "Addr: 92" "Addr" "A"
757298-757362 usb_packet: ep: "Endpoint: 0" "EP: 0" "EP" "E"
757362-757442 usb_packet: crc5-ok: "CRC5: 0x1C" "CRC5" "C"
756930-757490 usb_packet: packet-in: "IN ADDR 92 EP 0"
757552-757680 usb_packet: sync-ok: "SYNC: 00000001" "SYNC" "S"
757680-757808 usb_packet: pid: "PID: DATA0" "DATA0" "D"
757808-757936 usb_packet: data: "Databyte: 75" "Data: 75" "DB: 75" "75"
757936-758064 usb_packet: data: "Databyte: 08" "Data: 08" "DB: 08" "08"
758064-758192 usb_packet: data: "Databyte: 81" "Data: 81" "DB: 81" "81"
758192-758320 usb_packet: data: "Databyte: 01" "Data: 01" "DB: 01" "01"
758320-758448 usb_packet: data: "Databyte: 95" "Data: 95" "DB: 95" "95"
758448-758576 usb_packet: data: "Databyte: 05" "Data: 05" "DB: 05" "05"
758576-758704 usb_packet: data: "Databyte: 75" "Data: 75" "DB: 75" "75"
758704-758832 usb_packet: data: "Databyte: 01" "Data: 01" "DB: 01" "01"
758832-759088 usb_packet: crc16-ok: "CRC16: 0x6308" "CRC16" "C"
757552-759136 usb_packet: packet-data0: "DATA0 [ 75 08 81 01 95 05 75 01 ]"
759204-759332 usb_packet: sync-ok: "SYNC: 00000001" "SYNC" "S"
759332-759460 usb_packet: pid: "PID: ACK" "ACK" "A"
759204-759508 usb_packet: packet-ack: "ACK"
759742-759870 usb_packet: sync-ok: "SYNC: 00000001" "SYNC" "S"
759870-759998 usb_packet: pid: "PID: IN" "IN" "I"
759998-760110 usb_packet: addr: "Address: 92" "Addr: 92" "Addr" "A"
760110-760174 usb_packet: ep: "Endpoint: 0" "EP: 0" "EP" "E"
760174-760254 usb_packet: crc5-ok: "CRC5: 0x1C" "CRC5" "C"
759742-760302 usb_packet: packet-in: "IN ADDR 92 EP 0"
760362-760490 usb_packet: sync-ok: "SYNC: 00000001" "SYNC" "S"
760490-760618 usb_packet: pid: "PID: NAK" "NAK" "N"
760362-760666 usb_packet: packet-nak: "NAK"
760831-760959 usb_packet: sync-ok: "SYNC: 00000001" "SYNC" "S"
760959-761087 usb_packet: pid: "PID: IN" "IN" "I"
761087-761199 usb_packet: addr: "Address: 92" "Addr: 92" "Addr" "A"
761199-761263 usb_packet: ep: "Endpoint: 0" "EP: 0" "EP" "E"
761263-761343 usb_packet: crc5-ok: "CRC5: 0x1C" "CRC5" "C"
760831-761391 usb_packet: packet-in: "IN ADDR 92 EP 0"
761452-761580 usb_packet: sync-ok: "SYNC: 00000001" "SYNC" "S"
761580-761708 usb_packet: pid: "PID: DATA1" "DATA1" "D"
761708-761836 usb_packet: data: "Databyte: 05" "Data: 05" "DB: 05" "05"
761836-761964 usb_packet: data: "Databyte: 08" "Data: 08" "DB: 08" "08"
761964-762092 usb_packet: data: "Databyte: 19" "Data: 19" "DB: 19" "19"
762092-762220 usb_packet: data: "Databyte: 01" "Data: 01" "DB: 01" "01"
762220-762348 usb_packet: data: "Databyte: 29" "Data: 29" "DB: 29" "29"
762348-762476 usb_packet: data: "Databyte: 05" "Data: 05" "DB: 05" "05"
762476-762604 usb_packet: data: "Databyte: 91" "Data: 91" "DB: 91" "91"
762604-762732 usb_packet: data: "Databyte: 02" "Data: 02" "DB: 02" "02"
762732-762988 usb_packet: crc16-ok: "CRC16: 0xCE3D" "CRC16" "C"
761452-763036 usb_packet: packet-data1: "DATA1 [ 05 08 19 01 29 05 91 02 ]"
763101-763229 usb_packet: sync-ok: "SYNC: 00000001" "SYNC" "S"
763229-763357 usb_packet: pid: "PID: ACK" "ACK" "A"
763101-763405 usb_packet: packet-ack: "ACK"
763586-763714 usb_packet: sync-ok: "SYNC: 00000001" "SYNC" "S"
763714-763842 usb_packet: pid: "PID: IN" "IN" "I"
763842-763954 usb_packet: addr: "Address: 92" "Addr: 92" "Addr" "A"
763954-764018 usb_packet: ep: "Endpoint: 0" "EP: 0" "EP" "E"
764018-764098 usb_packet: crc5-ok: "CRC5: 0x1C" "CRC5" "C"
763586-764146 usb_packet: packet-in: "IN ADDR 92 EP 0"
764209-764337 usb_packet: sync-ok: "SYNC: 00000001" "SYNC" "S"
764337-764465 usb_packet: pid: "PID: NAK" "NAK" "N"
764209-764513 usb_packet: packet-nak: "NAK"
764664-764792 usb_packet: sync-ok: "SYNC: 00000001" "SYNC" "S"
764792-764920 usb_packet: pid: "PID: IN" "IN" "I"
764920-765032 usb_packet: addr: "Address: 92" "Addr: 92" "Addr" "A"
765032-765096 usb_packet: ep: "Endpoint: 0" "EP: 0" "EP" "E"
765096-765176 usb_packet: crc5-ok: "CRC5: 0x1C" "CRC5" "C"
764664-765224 usb_packet: packet-in: "IN ADDR 92 EP 0"
765285-765413 usb_packet: sync-ok: "SYNC: 00000001" "SYNC" "S"
765413-765541 usb_packet: pid: "PID: DATA0" "DATA0" "D"
765541-765669 usb_packet: data: "Databyte: 95" "Data: 95" "DB: 95" "95"
765669-765797 usb_packet: data: "Databyte: 01" "Data: 01" "DB: 01" "01"
765797-765925 usb_packet: data: "Databyte: 75" "Data: 75" "DB: 75" "75"
765925-766053 usb_packet: data: "Databyte: 03" "Data: 03" "DB: 03" "03"
766053-766181 usb_packet: data: "Databyte: 91" "Data: 91" "DB: 91" "91"
766181-766309 usb_packet: data: "Databyte: 01" "Data: 01" "DB: 01" "01"
766309-766437 usb_packet: data: "Databyte: 95" "Data: 95" "DB: 95" "95"
766437-766565 usb_packet: data: "Databyte: 06" "Data: 06" "DB: 06" "06"
766565-766821 usb_packet: crc16-ok: "CRC16: 0x6CBB" "CRC16" "C"
765285-766869 usb_packet: packet-data0: "DATA0 [ 95 01 75 03 91 01 95 06 ]"
766936-767064 usb_packet: sync-ok: "SYNC: 00000001" "SYNC" "S"
767064-767192 usb_packet: pid: "PID: ACK" "ACK" "A"
766936-767240 usb_packet: packet-ack: "ACK"
769315-769443 usb_packet: sync-ok: "SYNC: 00000001" "SYNC" "S"
769443-769571 usb_packet: pid: "PID: IN" "IN" "I"
769571-769683 usb_packet: addr: "Address: 92" "Addr: 92" "Addr" "A"
769683-769747 usb_packet: ep: "Endpoint: 0" "EP: 0" "EP" "E"
769747-769827 usb_packet: crc5-ok: "CRC5: 0x1C" "CRC5" "C"
769315-769875 usb_packet: packet-in: "IN ADDR 92 EP 0"
769937-770065 usb_packet: sync-ok: "SYNC: 00000001" "SYNC" "S"
770065-770193 usb_packet: pid: "PID: DATA1" "DATA1" "D"
770193-770321 usb_packet: data: "Databyte: 75" "Data: 75" "DB: 75" "75"
770321-770449 usb_packet: data: "Databyte: 08" "Data: 08" "DB: 08" "08"
770449-770577 usb_packet: data: "Databyte: 15" "Data: 15" "DB: 15" "15"
770577-770705 usb_packet: data: "Databyte: 00" "Data: 00" "DB: 00" "00"
770705-770833 usb_packet: data: "Databyte: 25" "Data: 25" "DB: 25" "25"
770833-770961 usb_packet: data: "Databyte: 95" "Data: 95" "DB: 95" "95"
770961-771089 usb_packet: data: "Databyte: 05" "Data: 05" "DB: 05" "05"
771089-771217 usb_packet: data: "Databyte: 07" "Data: 07" "DB: 07" "07"
771217-771473 usb_packet: crc16-ok: "CRC16: 0x58AA" "CRC16" "C"
769937-771521 usb_packet: packet-data1: "DATA1 [ 75 08 15 00 25 95 05 07 ]"
771586-771714 usb_packet: sync-ok: "SYNC: 00000001" "SYNC" "S"
771714-771842 usb_packet: pid: "PID: ACK" "ACK" "A"
771586-771890 usb_packet: packet-ack: "ACK"
772261-772389 usb_packet: sync-ok: "SYNC: 00000001" "SYNC" "S"
772389-772517 usb_packet: pid: "PID: IN" "IN" "I"
772517-772629 usb_packet: addr: "Address: 92" "Addr: 92" "Addr" "A"
772629-772693 usb_packet: ep: "Endpoint: 0" "EP: 0" "EP" "E"
772693-772773 usb_packet: crc5-ok: "CRC5: 0x1C" "CRC5" "C"
772261-772821 usb_packet: packet-in: "IN ADDR 92 EP 0"
772883-773011 usb_packet: sync-ok: "SYNC: 00000001" "SYNC" "S"
773011-773139 usb_packet: pid: "PID: NAK" "NAK" "N"
772883-773187 usb_packet: packet-nak: "NAK"
773338-773466 usb_packet: sync-ok: "SYNC: 00000001" "SYNC" "S"
773466-773594 usb_packet: pid: "PID: IN" "IN" "I"
773594-773706 usb_packet: addr: "Address: 92" "Addr: 92" "Addr" "A"
773706-773770 usb_packet: ep: "Endpoint: 0" "EP: 0" "EP" "E"
773770-773850 usb_packet: crc5-ok: "CRC5: 0x1C" "CRC5" "C"
773338-773898 usb_packet: packet-in: "IN ADDR 92 EP 0"
773959-774087 usb_packet: sync-ok: "SYNC: 00000001" "SYNC" "S"
774087-774215 usb_packet: pid: "PID: DATA0" "DATA0" "D"
774215-774343 usb_packet: data: "Databyte: 19" "Data: 19" "DB: 19" "19"
774343-774471 usb_packet: data: "Databyte: 00" "Data: 00" "DB: 00" "00"
774471-774599 usb_packet: data: "Databyte: 29" "Data: 29" "DB: 29" "29"
774599-774727 usb_packet: data: "Databyte: 95" "Data: 95" "DB: 95" "95"
774727-774855 usb_packet: data: "Databyte: 81" "Data: 81" "DB: 81" "81"
774855-774983 usb_packet: data: "Databyte: 00" "Data: 00" "DB: 00" "00"
774983-775111 usb_packet: data: "Databyte: C0" "Data: C0" "DB: C0" "C0"
775111-775367 usb_packet: crc16-ok: "CRC16: 0x4C4C" "CRC16" "C"
773959-775415 usb_packet: packet-data0: "DATA0 [ 19 00 29 95 81 00 C0 ]"
775479-775607 usb_packet: sync-ok: "SYNC: 00000001" "SYNC" "S"
775607-775735 usb_packet: pid: "PID: ACK" "ACK" "A"
775479-775783 usb_packet: packet-ack: "ACK"
776000-776128 usb_packet: sync-ok: "SYNC: 00000001" "SYNC" "S"
776128-776256 usb_packet: pid: "PID: OUT" "OUT" "O"
776256-776368 usb_packet: addr: "Address: 92" "Addr: 92" "Addr" "A"
776368-776432 usb_packet: ep: "Endpoint: 0" "EP: 0" "EP" "E"
776432-776512 usb_packet: crc5-ok: "CRC5: 0x1C" "CRC5" "C"
776000-776560 usb_packet: packet-out: "OUT ADDR 92 EP 0"
776653-776781 usb_packet: sync-ok: "SYNC: 00000001" "SYNC" "S"
776781-776909 usb_packet: pid: "PID: DATA1" "DATA1" "D"
776909-777165 usb_packet: crc16-ok: "CRC16: 0x0000" "CRC16" "C"
776653-777213 usb_packet: packet-data1: "DATA1 [ ]"
777276-777404 usb_packet: sync-ok: "SYNC: 00000001" "SYNC" "S"
777404-777532 usb_packet: pid: "PID: ACK" "ACK" "A"
777276-777580 usb_packet: packet-ack: "ACK"
784489-784617 usb_packet: sync-ok: "SYNC: 00000001" "SYNC" "S"
784617-784745 usb_packet: pid: "PID: SETUP" "SETUP" "S"
784745-784857 usb_packet: addr: "Address: 92" "Addr: 92" "Addr" "A"
784857-784921 usb_packet: ep: "Endpoint: 0" "EP: 0" "EP" "E"
784921-785001 usb_packet: crc5-ok: "CRC5: 0x1C" "CRC5" "C"
784489-785049 usb_packet: packet-setup: "SETUP ADDR 92 EP 0"
785142-785270 usb_packet: sync-ok: "SYNC: 00000001" "SYNC" "S"
785270-785398 usb_packet: pid: "PID: DATA0" "DATA0" "D"
785398-785526 usb_packet: data: "Databyte: 21" "Data: 21" "DB: 21" "21"
785526-785654 usb_packet: data: "Databyte: 09" "Data: 09" "DB: 09" "09"
785654-785782 usb_packet: data: "Databyte: 00" "Data: 00" "DB: 00" "00"
785782-785910 usb_packet: data: "Databyte: 02" "Data: 02" "DB: 02" "02"
785910-786038 usb_packet: data: "Databyte: 00" "Data: 00" "DB: 00" "00"
786038-786166 usb_packet: data: "Databyte: 00" "Data: 00" "DB: 00" "00"
786166-786294 usb_packet: data: "Databyte: 01" "Data: 01" "DB: 01" "01"
786294-786422 usb_packet: data: "Databyte: 00" "Data: 00" "DB: 00" "00"
786422-786678 usb_packet: crc16-ok: "CRC16: 0x709D" "CRC16" "C"
785142-786726 usb_packet: packet-data0: "DATA0 [ 21 09 00 02 00 00 01 00 ]"
786789-786917 usb_packet: sync-ok: "SYNC: 00000001" "SYNC" "S"
786917-787045 usb_packet: pid: "PID: ACK" "ACK" "A"
786789-787093 usb_packet: packet-ack: "ACK"
787372-787500 usb_packet: sync-ok: "SYNC: 00000001" "SYNC" "S"
787500-787628 usb_packet: pid: "PID: OUT" "OUT" "O"
787628-787740 usb_packet: addr: "Address: 92" "Addr: 92" "Addr" "A"
787740-787804 usb_packet: ep: "Endpoint: 0" "EP: 0" "EP" "E"
787804-787884 usb_packet: crc5-ok: "CRC5: 0x1C" "CRC5" "C"
787372-787932 usb_packet: packet-out: "OUT ADDR 92 EP 0"
788025-788153 usb_packet: sync-ok: "SYNC: 00000001" "SYNC" "S"
788153-788281 usb_packet: pid: "PID: DATA1" "DATA1" "D"
788281-788409 usb_packet: data: "Databyte: 00" "Data: 00" "DB: 00" "00"
788409-788681 usb_packet: crc16-ok: "CRC16: 0xBF40" "CRC16" "C"
788025-788729 usb_packet: packet-data1: "DATA1 [ 00 ]"
788791-788919 usb_packet: sync-ok: "SYNC: 00000001" "SYNC" "S"
788919-789047 usb_packet: pid: "PID: NAK" "NAK" "N"
788791-789095 usb_packet: packet-nak: "NAK"
789263-789391 usb_packet: sync-ok: "SYNC: 00000001" "SYNC" "S"
789391-789519 usb_packet: pid: "PID: OUT" "OUT" "O"
789519-789631 usb_packet: addr: "Address: 92" "Addr: 92" "Addr" "A"
789631-789695 usb_packet: ep: "Endpoint: 0" "EP: 0" "EP" "E"
789695-789775 usb_packet: crc5-ok: "CRC5: 0x1C" "CRC5" "C"
789263-789823 usb_packet: packet-out: "OUT ADDR 92 EP 0"
789916-790044 usb_packet: sync-ok: "SYNC: 00000001" "SYNC" "S"
790044-790172 usb_packet: pid: "PID: DATA1" "DATA1" "D"
790172-790300 usb_packet: data: "Databyte: 00" "Data: 00" "DB: 00" "00"
790300-790572 usb_packet: crc16-ok: "CRC16: 0xBF40" "CRC16" "C"
789916-790620 usb_packet: packet-data1: "DATA1 [ 00 ]"
790682-790810 usb_packet: sync-ok: "SYNC: 00000001" "SYNC" "S"
790810-790938 usb_packet: pid: "PID: NAK" "NAK" "N"
790682-790986 usb_packet: packet-nak: "NAK"
793322-793450 usb_packet: sync-ok: "SYNC: 00000001" "SYNC" "S"
793450-793578 usb_packet: pid: "PID: OUT" "OUT" "O"
793578-793690 usb_packet: addr: "Address: 92" "Addr: 92" "Addr" "A"
793690-793754 usb_packet: ep: "Endpoint: 0" "EP: 0" "EP" "E"
793754-793834 usb_packet: crc5-ok: "CRC5: 0x1C" "CRC5" "C"
793322-793882 usb_packet: packet-out: "OUT ADDR 92 EP 0"
793975-794103 usb_packet: sync-ok: "SYNC: 00000001" "SYNC" "S"
794103-794231 usb_packet: pid: "PID: DATA1" "DATA1" "D"
794231-794359 usb_packet: data: "Databyte: 00" "Data: 00" "DB: 00" "00"
794359-794631 usb_packet: crc16-ok: "CRC16: 0xBF40" "CRC16" "C"
793975-794679 usb_packet: packet-data1: "DATA1 [ 00 ]"
794740-794868 usb_packet: sync-ok: "SYNC: 00000001" "SYNC" "S"
794868-794996 usb_packet: pid: "PID: ACK" "ACK" "A"
794740-795044 usb_packet: packet-ack: "ACK"
795259-795387 usb_packet: sync-ok: "SYNC: 00000001" "SYNC" "S"
795387-795515 usb_packet: pid: "PID: IN" "IN" "I"
795515-795627 usb_packet: addr: "Address: 92" "Addr: 92" "Addr" "A"
795627-795691 usb_packet: ep: "Endpoint: 0" "EP: 0" "EP" "E"
795691-795771 usb_packet: crc5-ok: "CRC5: 0x1C" "CRC5" "C"
795259-795819 usb_packet: packet-in: "IN ADDR 92 EP 0"
795881-796009 usb_packet: sync-ok: "SYNC: 00000001" "SYNC" "S"
796009-796137 usb_packet: pid: "PID: DATA1" "DATA1" "D"
796137-796393 usb_packet: crc16-ok: "CRC16: 0x0000" "CRC16" "C"
795881-796441 usb_packet: packet-data1: "DATA1 [ ]"
796508-796636 usb_packet: sync-ok: "SYNC: 00000001" "SYNC" "S"
796636-796764 usb_packet: pid: "PID: ACK" "ACK" "A"
796508-796812 usb_packet: packet-ack: "ACK"
797038-797166 usb_packet: sync-ok: "SYNC: 00000001" "SYNC" "S"
797166-797294 usb_packet: pid: "PID: SETUP" "SETUP" "S"
797294-797406 usb_packet: addr: "Address: 92" "Addr: 92" "Addr" "A"
797406-797470 usb_packet: ep: "Endpoint: 0" "EP: 0" "EP" "E"
797470-797550 usb_packet: crc5-ok: "CRC5: 0x1C" "CRC5" "C"
797038-797598 usb_packet: packet-setup: "SETUP ADDR 92 EP 0"
797691-797819 usb_packet: sync-ok: "SYNC: 00000001" "SYNC" "S"
797819-797947 usb_packet: pid: "PID: DATA0" "DATA0" "D"
797947-798075 usb_packet: data: "Databyte: 21" "Data: 21" "DB: 21" "21"
798075-798203 usb_packet: data: "Databyte: 0A" "Data: 0A" "DB: 0A" "0A"
798203-798331 usb_packet: data: "Databyte: 00" "Data: 00" "DB: 00" "00"
798331-798459 usb_packet: data: "Databyte: 00" "Data: 00" "DB: 00" "00"
798459-798587 usb_packet: data: "Databyte: 01" "Data: 01" "DB: 01" "01"
798587-798715 usb_packet: data: "Databyte: 00" "Data: 00" "DB: 00" "00"
798715-798843 usb_packet: data: "Databyte: 00" "Data: 00" "DB: 00" "00"
798843-798971 usb_packet: data: "Databyte: 00" "Data: 00" "DB: 00" "00"
798971-799227 usb_packet: crc16-ok: "CRC16: 0xDCD7" "CRC16" "C"
797691-799275 usb_packet: packet-data0: "DATA0 [ 21 0A 00 00 01 00 00 00 ]"
799338-799466 usb_packet: sync-ok: "SYNC: 00000001" "SYNC" "S"
799466-799594 usb_packet: pid: "PID: ACK" "ACK" "A"
799338-799642 usb_packet: packet-ack: "ACK"
799851-799979 usb_packet: sync-ok: "SYNC: 00000001" "SYNC" "S"
799979-800107 usb_packet: pid: "PID: IN" "IN" "I"
800107-800219 usb_packet: addr: "Address: 92" "Addr: 92" "Addr" "A"
800219-800283 usb_packet: ep: "Endpoint: 0" "EP: 0" "EP" "E"
800283-800363 usb_packet: crc5-ok: "CRC5: 0x1C" "CRC5" "C"
799851-800411 usb_packet: packet-in: "IN ADDR 92 EP 0"
800471-800599 usb_packet: sync-ok: "SYNC: 00000001" "SYNC" "S"
800599-800727 usb_packet: pid: "PID: DATA1" "DATA1" "D"
800727-800983 usb_packet: crc16-ok: "CRC16: 0x0000" "CRC16" "C"
800471-801031 usb_packet: packet-data1: "DATA1 [ ]"
801098-801226 usb_packet: sync-ok: "SYNC: 00000001" "SYNC" "S"
801226-801354 usb_packet: pid: "PID: ACK" "ACK" "A"
801098-801402 usb_packet: packet-ack: "ACK"
802773-802901 usb_packet: sync-ok: "SYNC: 00000001" "SYNC" "S"
802901-803029 usb_packet: pid: "PID: SETUP" "SETUP" "S"
803029-803141 usb_packet: addr: "Address: 92" "Addr: 92" "Addr" "A"
803141-803205 usb_packet: ep: "Endpoint: 0" "EP: 0" "EP" "E"
803205-803285 usb_packet: crc5-ok: "CRC5: 0x1C" "CRC5" "C"
802773-803333 usb_packet: packet-setup: "SETUP ADDR 92 EP 0"
803426-803554 usb_packet: sync-ok: "SYNC: 00000001" "SYNC" "S"
803554-803682 usb_packet: pid: "PID: DATA0" "DATA0" "D"
803682-803810 usb_packet: data: "Databyte: 81" "Data: 81" "DB: 81" "81"
803810-803938 usb_packet: data: "Databyte: 06" "Data: 06" "DB: 06" "06"
803938-804066 usb_packet: data: "Databyte: 00" "Data: 00" "DB: 00" "00"
804066-804194 usb_packet: data: "Databyte: 22" "Data: 22" "DB: 22" "22"
804194-804322 usb_packet: data: "Databyte: 01" "Data: 01" "DB: 01" "01"
804322-804450 usb_packet: data: "Databyte: 00" "Data: 00" "DB: 00" "00"
804450-804578 usb_packet: data: "Databyte: 5E" "Data: 5E" "DB: 5E" "5E"
804578-804706 usb_packet: data: "Databyte: 00" "Data: 00" "DB: 00" "00"
804706-804962 usb_packet: crc16-ok: "CRC16: 0xC3D1" "CRC16" "C"
803426-805010 usb_packet: packet-data0: "DATA0 [ 81 06 00 22 01 00 5E 00 ]"
805074-805202 usb_packet: sync-ok: "SYNC: 00000001" "SYNC" "S"
805202-805330 usb_packet: pid: "PID: ACK" "ACK" "A"
805074-805378 usb_packet: packet-ack: "ACK"
805602-805730 usb_packet: sync-ok: "SYNC: 00000001" "SYNC" "S"
805730-805858 usb_packet: pid: "PID: IN" "IN" "I"
805858-805970 usb_packet: addr: "Address: 92" "Addr: 92" "Addr" "A"
805970-806034 usb_packet: ep: "Endpoint: 0" "EP: 0" "EP" "E"
806034-806114 usb_packet: crc5-ok: "CRC5: 0x1C" "CRC5" "C"
805602-806162 usb_packet: packet-in: "IN ADDR 92 EP 0"
806224-806352 usb_packet: sync-ok: "SYNC: 00000001" "SYNC" "S"
806352-806480 usb_packet: pid: "PID: NAK" "NAK" "N"
806224-806528 usb_packet: packet-nak: "NAK"
806680-806808 usb_packet: sync-ok: "SYNC: 00000001" "SYNC" "S"
806808-806936 usb_packet: pid: "PID: IN" "IN" "I"
806936-807048 usb_packet: addr: "Address: 92" "Addr: 92" "Addr" "A"
807048-807112 usb_packet: ep: "Endpoint: 0" "EP: 0" "EP" "E"
807112-807192 usb_packet: crc5-ok: "CRC5: 0x1C" "CRC5" "C"
806680-807240 usb_packet: packet-in: "IN ADDR 92 EP 0"
807302-807430 usb_packet: sync-ok: "SYNC: 00000001" "SYNC" "S"
807430-807558 usb_packet: pid: "PID: NAK" "NAK" "N"
807302-807606 usb_packet: packet-nak: "NAK"
807757-807885 usb_packet: sync-ok: "SYNC: 00000001" "SYNC" "S"
807885-808013 usb_packet: pid: "PID: IN" "IN" "I"
808013-808125 usb_packet: addr: "Address: 92" "Addr: 92" "Addr" "A"
808125-808189 usb_packet: ep: "Endpoint: 0" "EP: 0" "EP" "E"
808189-808269 usb_packet: crc5-ok: "CRC5: 0x1C" "CRC5" "C"
807757-808317 usb_packet: packet-in: "IN ADDR 92 EP 0"
808378-808506 usb_packet: sync-ok: "SYNC: 00000001" "SYNC" "S"
808506-808634 usb_packet: pid: "PID: NAK" "NAK" "N"
808378-808682 usb_packet: packet-nak: "NAK"
808840-808968 usb_packet: sync-ok: "SYNC: 00000001" "SYNC" "S"
808968-809096 usb_packet: pid: "PID: IN" "IN" "I"
809096-809208 usb_packet: addr: "Address: 92" "Addr: 92" "Addr" "A"
809208-809272 usb_packet: ep: "Endpoint: 0" "EP: 0" "EP" "E"
809272-809352 usb_packet: crc5-ok: "CRC5: 0x1C" "CRC5" "C"
808840-809400 usb_packet: packet-in: "IN ADDR 92 EP 0"
809462-809590 usb_packet: sync-ok: "SYNC: 00000001" "SYNC" "S"
809590-809718 usb_packet: pid: "PID: NAK" "NAK" "N"
809462-809766 usb_packet: packet-nak: "NAK"
809917-810045 usb_packet: sync-ok: "SYNC: 00000001" "SYNC" "S"
810045-810173 usb_packet: pid: "PID: IN" "IN" "I"
810173-810285 usb_packet: addr: "Address: 92" "Addr: 92" "Addr" "A"
810285-810349 usb_packet: ep: "Endpoint: 0" "EP: 0" "EP" "E"
810349-810429 usb_packet: crc5-ok: "CRC5: 0x1C" "CRC5" "C"
809917-810477 usb_packet: packet-in: "IN ADDR 92 EP 0"
810538-810666 usb_packet: sync-ok: "SYNC: 00000001" "SYNC" "S"
810666-810794 usb_packet: pid: "PID: DATA1" "DATA1" "D"
810794-810922 usb_packet: data: "Databyte: 05" "Data: 05" "DB: 05" "05"
810922-811050 usb_packet: data: "Databyte: 01" "Data: 01" "DB: 01" "01"
811050-811178 usb_packet: data: "Databyte: 09" "Data: 09" "DB: 09" "09"
811178-811306 usb_packet: data: "Databyte: 02" "Data: 02" "DB: 02" "02"
811306-811434 usb_packet: data: "Databyte: A1" "Data: A1" "DB: A1" "A1"
811434-811562 usb_packet: data: "Databyte: 01" "Data: 01" "DB: 01" "01"
811562-811690 usb_packet: data: "Databyte: 09" "Data: 09" "DB: 09" "09"
811690-811818 usb_packet: data: "Databyte: 01" "Data: 01" "DB: 01" "01"
811818-812090 usb_packet: crc16-ok: "CRC16: 0xFEA3" "CRC16" "C"
810538-812138 usb_packet: packet-data1: "DATA1 [ 05 01 09 02 A1 01 09 01 ]"
812206-812334 usb_packet: sync-ok: "SYNC: 00000001" "SYNC" "S"
812334-812462 usb_packet: pid: "PID: ACK" "ACK" "A"
812206-812510 usb_packet: packet-ack: "ACK"
812738-812866 usb_packet: sync-ok: "SYNC: 00000001" "SYNC" "S"
812866-812994 usb_packet: pid: "PID: IN" "IN" "I"
812994-813106 usb_packet: addr: "Address: 92" "Addr: 92" "Addr" "A"
813106-813170 usb_packet: ep: "Endpoint: 0" "EP: 0" "EP" "E"
813170-813250 usb_packet: crc5-ok: "CRC5: 0x1C" "CRC5" "C"
812738-813298 usb_packet: packet-in: "IN ADDR 92 EP 0"
813361-813489 usb_packet: sync-ok: "SYNC: 00000001" "SYNC" "S"
813489-813617 usb_packet: pid: "PID: NAK" "NAK" "N"
813361-813665 usb_packet: packet-nak: "NAK"
813816-813944 usb_packet: sync-ok: "SYNC: 00000001" "SYNC" "S"
813944-814072 usb_packet: pid: "PID: IN" "IN" "I"
814072-814184 usb_packet: addr: "Address: 92" "Addr: 92" "Addr" "A"
814184-814248 usb_packet: ep: "Endpoint: 0" "EP: 0" "EP" "E"
814248-814328 usb_packet: crc5-ok: "CRC5: 0x1C" "CRC5" "C"
813816-814376 usb_packet: packet-in: "IN ADDR 92 EP 0"
814437-814565 usb_packet: sync-ok: "SYNC: 00000001" "SYNC" "S"
814565-814693 usb_packet: pid: "PID: DATA0" "DATA0" "D"
814693-814821 usb_packet: data: "Databyte: A1" "Data: A1" "DB: A1" "A1"
814821-814949 usb_packet: data: "Databyte: 00" "Data: 00" "DB: 00" "00"
814949-815077 usb_packet: data: "Databyte: 85" "Data: 85" "DB: 85" "85"
815077-815205 usb_packet: data: "Databyte: 01" "Data: 01" "DB: 01" "01"
815205-815333 usb_packet: data: "Databyte: 95" "Data: 95" "DB: 95" "95"
815333-815461 usb_packet: data: "Databyte: 03" "Data: 03" "DB: 03" "03"
815461-815589 usb_packet: data: "Databyte: 75" "Data: 75" "DB: 75" "75"
815589-815717 usb_packet: data: "Databyte: 01" "Data: 01" "DB: 01" "01"
815717-815973 usb_packet: crc16-ok: "CRC16: 0x896C" "CRC16" "C"
814437-816021 usb_packet: packet-data0: "DATA0 [ A1 00 85 01 95 03 75 01 ]"
816089-816217 usb_packet: sync-ok: "SYNC: 00000001" "SYNC" "S"
816217-816345 usb_packet: pid: "PID: ACK" "ACK" "A"
816089-816393 usb_packet: packet-ack: "ACK"
817324-817452 usb_packet: sync-ok: "SYNC: 00000001" "SYNC" "S"
817452-817580 usb_packet: pid: "PID: IN" "IN" "I"
817580-817692 usb_packet: addr: "Address: 92" "Addr: 92" "Addr" "A"
817692-817756 usb_packet: ep: "Endpoint: 0" "EP: 0" "EP" "E"
817756-817836 usb_packet: crc5-ok: "CRC5: 0x1C" "CRC5" "C"
817324-817884 usb_packet: packet-in: "IN ADDR 92 EP 0"
817945-818073 usb_packet: sync-ok: "SYNC: 00000001" "SYNC" "S"
818073-818201 usb_packet: pid: "PID: NAK" "NAK" "N"
817945-818249 usb_packet: packet-nak: "NAK"
818450-818578 usb_packet: sync-ok: "SYNC: 00000001" "SYNC" "S"
818578-818706 usb_packet: pid: "PID: IN" "IN" "I"
818706-818818 usb_packet: addr: "Address: 92" "Addr: 92" "Addr" "A"
818818-818882 usb_packet: ep: "Endpoint: 0" "EP: 0" "EP" "E"
818882-818962 usb_packet: crc5-ok: "CRC5: 0x1C" "CRC5" "C"
818450-819010 usb_packet: packet-in: "IN ADDR 92 EP 0"
819071-819199 usb_packet: sync-ok: "SYNC: 00000001" "SYNC" "S"
819199-819327 usb_packet: pid: "PID: DATA1" "DATA1" "D"
819327-819455 usb_packet: data: "Databyte: 05" "Data: 05" "DB: 05" "05"
819455-819583 usb_packet: data: "Databyte: 09" "Data: 09" "DB: 09" "09"
819583-819711 usb_packet: data: "Databyte: 19" "Data: 19" "DB: 19" "19"
819711-819839 usb_packet: data: "Databyte: 01" "Data: 01" "DB: 01" "01"
819839-819967 usb_packet: data: "Databyte: 29" "Data: 29" "DB: 29" "29"
819967-820095 usb_packet: data: "Databyte: 03" "Data: 03" "DB: 03" "03"
820095-820223 usb_packet: data: "Databyte: 15" "Data: 15" "DB: 15" "15"
820223-820351 usb_packet: data: "Databyte: 00" "Data: 00" "DB: 00" "00"
820351-820607 usb_packet: crc16-ok: "CRC16: 0xCE2F" "CRC16" "C"
819071-820655 usb_packet: packet-data1: "DATA1 [ 05 09 19 01 29 03 15 00 ]"
820719-820847 usb_packet: sync-ok: "SYNC: 00000001" "SYNC" "S"
820847-820975 usb_packet: pid: "PID: ACK" "ACK" "A"
820719-821023 usb_packet: packet-ack: "ACK"
821203-821331 usb_packet: sync-ok: "SYNC: 00000001" "SYNC" "S"
821331-821459 usb_packet: pid: "PID: IN" "IN" "I"
821459-821571 usb_packet: addr: "Address: 92" "Addr: 92" "Addr" "A"
821571-821635 usb_packet: ep: "Endpoint: 0" "EP: 0" "EP" "E"
821635-821715 usb_packet: crc5-ok: "CRC5: 0x1C" "CRC5" "C"
821203-821763 usb_packet: packet-in: "IN ADDR 92 EP 0"
821825-821953 usb_packet: sync-ok: "SYNC: 00000001" "SYNC" "S"
821953-822081 usb_packet: pid: "PID: NAK" "NAK" "N"
821825-822129 usb_packet: packet-nak: "NAK"
822281-822409 usb_packet: sync-ok: "SYNC: 00000001" "SYNC" "S"
822409-822537 usb_packet: pid: "PID: IN" "IN" "I"
822537-822649 usb_packet: addr: "Address: 92" "Addr: 92" "Addr" "A"
822649-822713 usb_packet: ep: "Endpoint: 0" "EP: 0" "EP" "E"
822713-822793 usb_packet: crc5-ok: "CRC5: 0x1C" "CRC5" "C"
822281-822841 usb_packet: packet-in: "IN ADDR 92 EP 0"
822903-823031 usb_packet: sync-ok: "SYNC: 00000001" "SYNC" "S"
823031-823159 usb_packet: pid: "PID: DATA0" "DATA0" "D"
823159-823287 usb_packet: data: "Databyte: 25" "Data: 25" "DB: 25" "25"
823287-823415 usb_packet: data: "Databyte: 01" "Data: 01" "DB: 01" "01"
823415-823543 usb_packet: data: "Databyte: 81" "Data: 81" "DB: 81" "81"
823543-823671 usb_packet: data: "Databyte: 02" "Data: 02" "DB: 02" "02"
823671-823799 usb_packet: data: "Databyte: 95" "Data: 95" "DB: 95" "95"
823799-823927 usb_packet: data: "Databyte: 01" "Data: 01" "DB: 01" "01"
823927-824055 usb_packet: data: "Databyte: 75" "Data: 75" "DB: 75" "75"
824055-824183 usb_packet: data: "Databyte: 05" "Data: 05" "DB: 05" "05"
824183-824439 usb_packet: crc16-ok: "CRC16: 0x5D90" "CRC16" "C"
822903-824487 usb_packet: packet-data0: "DATA0 [ 25 01 81 02 95 01 75 05 ]"
824551-824679 usb_packet: sync-ok: "SYNC: 00000001" "SYNC" "S"
824679-824807 usb_packet: pid: "PID: ACK" "ACK" "A"
824551-824855 usb_packet: packet-ack: "ACK"
825058-825186 usb_packet: sync-ok: "SYNC: 00000001" "SYNC" "S"
825186-825314 usb_packet: pid: "PID: IN" "IN" "I"
825314-825426 usb_packet: addr: "Address: 92" "Addr: 92" "Addr" "A"
825426-825490 usb_packet: ep: "Endpoint: 0" "EP: 0" "EP" "E"
825490-825570 usb_packet: crc5-ok: "CRC5: 0x1C" "CRC5" "C"
825058-825618 usb_packet: packet-in: "IN ADDR 92 EP 0"
825679-825807 usb_packet: sync-ok: "SYNC: 00000001" "SYNC" "S"
825807-825935 usb_packet: pid: "PID: NAK" "NAK" "N"
825679-825983 usb_packet: packet-nak: "NAK"
826272-826400 usb_packet: sync-ok: "SYNC: 00000001" "SYNC" "S"
826400-826528 usb_packet: pid: "PID: IN" "IN" "I"
826528-826640 usb_packet: addr: "Address: 92" "Addr: 92" "Addr" "A"
826640-826704 usb_packet: ep: "Endpoint: 0" "EP: 0" "EP" "E"
826704-826784 usb_packet: crc5-ok: "CRC5: 0x1C" "CRC5" "C"
826272-826832 usb_packet: packet-in: "IN ADDR 92 EP 0"
826893-827021 usb_packet: sync-ok: "SYNC: 00000001" "SYNC" "S"
827021-827149 usb_packet: pid: "PID: DATA1" "DATA1" "D"
827149-827277 usb_packet: data: "Databyte: 81" "Data: 81" "DB: 81" "81"
827277-827405 usb_packet: data: "Databyte: 01" "Data: 01" "DB: 01" "01"
827405-827533 usb_packet: data: "Databyte: 75" "Data: 75" "DB: 75" "75"
827533-827661 usb_packet: data: "Databyte: 08" "Data: 08" "DB: 08" "08"
827661-827789 usb_packet: data: "Databyte: 95" "Data: 95" "DB: 95" "95"
827789-827917 usb_packet: data: "Databyte: 02" "Data: 02" "DB: 02" "02"
827917-828045 usb_packet: data: "Databyte: 05" "Data: 05" "DB: 05" "05"
828045-828173 usb_packet: data: "Databyte: 01" "Data: 01" "DB: 01" "01"
828173-828429 usb_packet: crc16-ok: "CRC16: 0xA0C2" "CRC16" "C"
826893-828477 usb_packet: packet-data1: "DATA1 [ 81 01 75 08 95 02 05 01 ]"
828545-828673 usb_packet: sync-ok: "SYNC: 00000001" "SYNC" "S"
828673-828801 usb_packet: pid: "PID: ACK" "ACK" "A"
828545-828849 usb_packet: packet-ack: "ACK"
829068-829196 usb_packet: sync-ok: "SYNC: 00000001" "SYNC" "S"
829196-829324 usb_packet: pid: "PID: IN" "IN" "I"
829324-829436 usb_packet: addr: "Address: 92" "Addr: 92" "Addr" "A"
829436-829500 usb_packet: ep: "Endpoint: 0" "EP: 0" "EP" "E"
829500-829580 usb_packet: crc5-ok: "CRC5: 0x1C" "CRC5" "C"
829068-829628 usb_packet: packet-in: "IN ADDR 92 EP 0"
829690-829818 usb_packet: sync-ok: "SYNC: 00000001" "SYNC" "S"
829818-829946 usb_packet: pid: "PID: NAK" "NAK" "N"
829690-829994 usb_packet: packet-nak: "NAK"
830162-830290 usb_packet: sync-ok: "SYNC: 00000001" "SYNC" "S"
830290-830418 usb_packet: pid: "PID: IN" "IN" "I"
830418-830530 usb_packet: addr: "Address: 92" "Addr: 92" "Addr" "A"
830530-830594 usb_packet: ep: "Endpoint: 0" "EP: 0" "EP" "E"
830594-830674 usb_packet: crc5-ok: "CRC5: 0x1C" "CRC5" "C"
830162-830722 usb_packet: packet-in: "IN ADDR 92 EP 0"
830784-830912 usb_packet: sync-ok: "SYNC: 00000001" "SYNC" "S"
830912-831040 usb_packet: pid: "PID: DATA0" "DATA0" "D"
831040-831168 usb_packet: data: "Databyte: 09" "Data: 09" "DB: 09" "09"
831168-831296 usb_packet: data: "Databyte: 30" "Data: 30" "DB: 30" "30"
831296-831424 usb_packet: data: "Databyte: 09" "Data: 09" "DB: 09" "09"
831424-831552 usb_packet: data: "Databyte: 31" "Data: 31" "DB: 31" "31"
831552-831680 usb_packet: data: "Databyte: 15" "Data: 15" "DB: 15" "15"
831680-831808 usb_packet: data: "Databyte: 81" "Data: 81" "DB: 81" "81"
831808-831936 usb_packet: data: "Databyte: 25" "Data: 25" "DB: 25" "25"
831936-832080 usb_packet: data: "Databyte: 7F" "Data: 7F" "DB: 7F" "7F"
832080-832336 usb_packet: crc16-ok: "CRC16: 0x943D" "CRC16" "C"
830784-832384 usb_packet: packet-data0: "DATA0 [ 09 30 09 31 15 81 25 7F ]"
832452-832580 usb_packet: sync-ok: "SYNC: 00000001" "SYNC" "S"
832580-832708 usb_packet: pid: "PID: ACK" "ACK" "A"
832452-832756 usb_packet: packet-ack: "ACK"
832981-833109 usb_packet: sync-ok: "SYNC: 00000001" "SYNC" "S"
833109-833237 usb_packet: pid: "PID: IN" "IN" "I"
833237-833349 usb_packet: addr: "Address: 92" "Addr: 92" "Addr" "A"
833349-833413 usb_packet: ep: "Endpoint: 0" "EP: 0" "EP" "E"
833413-833493 usb_packet: crc5-ok: "CRC5: 0x1C" "CRC5" "C"
832981-833541 usb_packet: packet-in: "IN ADDR 92 EP 0"
833602-833730 usb_packet: sync-ok: "SYNC: 00000001" "SYNC" "S"
833730-833858 usb_packet: pid: "PID: NAK" "NAK" "N"
833602-833906 usb_packet: packet-nak: "NAK"
834059-834187 usb_packet: sync-ok: "SYNC: 00000001" "SYNC" "S"
834187-834315 usb_packet: pid: "PID: IN" "IN" "I"
834315-834427 usb_packet: addr: "Address: 92" "Addr: 92" "Addr" "A"
834427-834491 usb_packet: ep: "Endpoint: 0" "EP: 0" "EP" "E"
834491-834571 usb_packet: crc5-ok: "CRC5: 0x1C" "CRC5" "C"
834059-834619 usb_packet: packet-in: "IN ADDR 92 EP 0"
834681-834809 usb_packet: sync-ok: "SYNC: 00000001" "SYNC" "S"
834809-834937 usb_packet: pid: "PID: DATA1" "DATA1" "D"
834937-835065 usb_packet: data: "Databyte: 81" "Data: 81" "DB: 81" "81"
835065-835193 usb_packet: data: "Databyte: 06" "Data: 06" "DB: 06" "06"
835193-835321 usb_packet: data: "Databyte: C0" "Data: C0" "DB: C0" "C0"
835321-835449 usb_packet: data: "Databyte: A1" "Data: A1" "DB: A1" "A1"
835449-835577 usb_packet: data: "Databyte: 00" "Data: 00" "DB: 00" "00"
835577-835705 usb_packet: data: "Databyte: 95" "Data: 95" "DB: 95" "95"
835705-835833 usb_packet: data: "Databyte: 01" "Data: 01" "DB: 01" "01"
835833-835961 usb_packet: data: "Databyte: 75" "Data: 75" "DB: 75" "75"
835961-836217 usb_packet: crc16-ok: "CRC16: 0xDA6C" "CRC16" "C"
834681-836265 usb_packet: packet-data1: "DATA1 [ 81 06 C0 A1 00 95 01 75 ]"
836332-836460 usb_packet: sync-ok: "SYNC: 00000001" "SYNC" "S"
836460-836588 usb_packet: pid: "PID: ACK" "ACK" "A"
836332-836636 usb_packet: packet-ack: "ACK"
836870-836998 usb_packet: sync-ok: "SYNC: 00000001" "SYNC" "S"
836998-837126 usb_packet: pid: "PID: IN" "IN" "I"
837126-837238 usb_packet: addr: "Address: 92" "Addr: 92" "Addr" "A"
837238-837302 usb_packet: ep: "Endpoint: 0" "EP: 0" "EP" "E"
837302-837382 usb_packet: crc5-ok: "CRC5: 0x1C" "CRC5" "C"
836870-837430 usb_packet: packet-in: "IN ADDR 92 EP 0"
837491-837619 usb_packet: sync-ok: "SYNC: 00000001" "SYNC" "S"
837619-837747 usb_packet: pid: "PID: NAK" "NAK" "N"
837491-837795 usb_packet: packet-nak: "NAK"
837947-838075 usb_packet: sync-ok: "SYNC: 00000001" "SYNC" "S"
838075-838203 usb_packet: pid: "PID: IN" "IN" "I"
838203-838315 usb_packet: addr: "Address: 92" "Addr: 92" "Addr" "A"
838315-838379 usb_packet: ep: "Endpoint: 0" "EP: 0" "EP" "E"
838379-838459 usb_packet: crc5-ok: "CRC5: 0x1C" "CRC5" "C"
837947-838507 usb_packet: packet-in: "IN ADDR 92 EP 0"
838569-838697 usb_packet: sync-ok: "SYNC: 00000001" "SYNC" "S"
838697-838825 usb_packet: pid: "PID: DATA0" "DATA0" "D"
838825-838953 usb_packet: data: "Databyte: 08" "Data: 08" "DB: 08" "08"
838953-839081 usb_packet: data: "Databyte: 05" "Data: 05" "DB: 05" "05"
839081-839209 usb_packet: data: "Databyte: 01" "Data: 01" "DB: 01" "01"
839209-839337 usb_packet: data: "Databyte: 09" "Data: 09" "DB: 09" "09"
839337-839465 usb_packet: data: "Databyte: 38" "Data: 38" "DB: 38" "38"
839465-839593 usb_packet: data: "Databyte: 15" "Data: 15" "DB: 15" "15"
839593-839721 usb_packet: data: "Databyte: 81" "Data: 81" "DB: 81" "81"
839721-839849 usb_packet: data: "Databyte: 25" "Data: 25" "DB: 25" "25"
839849-840105 usb_packet: crc16-ok: "CRC16: 0xAD8B" "CRC16" "C"
838569-840153 usb_packet: packet-data0: "DATA0 [ 08 05 01 09 38 15 81 25 ]"
840221-840349 usb_packet: sync-ok: "SYNC: 00000001" "SYNC" "S"
840349-840477 usb_packet: pid: "PID: ACK" "ACK" "A"
840221-840525 usb_packet: packet-ack: "ACK"
841331-841459 usb_packet: sync-ok: "SYNC: 00000001" "SYNC" "S"
841459-841587 usb_packet: pid: "PID: IN" "IN" "I"
841587-841699 usb_packet: addr: "Address: 92" "Addr: 92" "Addr" "A"
841699-841763 usb_packet: ep: "Endpoint: 0" "EP: 0" "EP" "E"
841763-841843 usb_packet: crc5-ok: "CRC5: 0x1C" "CRC5" "C"
841331-841891 usb_packet: packet-in: "IN ADDR 92 EP 0"
841952-842080 usb_packet: sync-ok: "SYNC: 00000001" "SYNC" "S"
842080-842208 usb_packet: pid: "PID: NAK" "NAK" "N"
841952-842256 usb_packet: packet-nak: "NAK"
842452-842580 usb_packet: sync-ok: "SYNC: 00000001" "SYNC" "S"
842580-842708 usb_packet: pid: "PID: IN" "IN" "I"
842708-842820 usb_packet: addr: "Address: 92" "Addr: 92" "Addr" "A"
842820-842884 usb_packet: ep: "Endpoint: 0" "EP: 0" "EP" "E"
842884-842964 usb_packet: crc5-ok: "CRC5: 0x1C" "CRC5" "C"
842452-843012 usb_packet: packet-in: "IN ADDR 92 EP 0"
843073-843201 usb_packet: sync-ok: "SYNC: 00000001" "SYNC" "S"
843201-843329 usb_packet: pid: "PID: DATA1" "DATA1" "D"
843329-843473 usb_packet: data: "Databyte: 7F" "Data: 7F" "DB: 7F" "7F"
843473-843601 usb_packet: data: "Databyte: 81" "Data: 81" "DB: 81" "81"
843601-843729 usb_packet: data: "Databyte: 06" "Data: 06" "DB: 06" "06"
843729-843857 usb_packet: data: "Databyte: C0" "Data: C0" "DB: C0" "C0"
843857-843985 usb_packet: data: "Databyte: C0" "Data: C0" "DB: C0" "C0"
843985-844113 usb_packet: data: "Databyte: 05" "Data: 05" "DB: 05" "05"
844113-844241 usb_packet: data: "Databyte: 0C" "Data: 0C" "DB: 0C" "0C"
844241-844369 usb_packet: data: "Databyte: 09" "Data: 09" "DB: 09" "09"
844369-844625 usb_packet: crc16-ok: "CRC16: 0xE880" "CRC16" "C"
843073-844673 usb_packet: packet-data1: "DATA1 [ 7F 81 06 C0 C0 05 0C 09 ]"
844738-844866 usb_packet: sync-ok: "SYNC: 00000001" "SYNC" "S"
844866-844994 usb_packet: pid: "PID: ACK" "ACK" "A"
844738-845042 usb_packet: packet-ack: "ACK"
845273-845401 usb_packet: sync-ok: "SYNC: 00000001" "SYNC" "S"
845401-845529 usb_packet: pid: "PID: IN" "IN" "I"
845529-845641 usb_packet: addr: "Address: 92" "Addr: 92" "Addr" "A"
845641-845705 usb_packet: ep: "Endpoint: 0" "EP: 0" "EP" "E"
845705-845785 usb_packet: crc5-ok: "CRC5: 0x1C" "CRC5" "C"
845273-845833 usb_packet: packet-in: "IN ADDR 92 EP 0"
845894-846022 usb_packet: sync-ok: "SYNC: 00000001" "SYNC" "S"
846022-846150 usb_packet: pid: "PID: NAK" "NAK" "N"
845894-846198 usb_packet: packet-nak: "NAK"
846351-846479 usb_packet: sync-ok: "SYNC: 00000001" "SYNC" "S"
846479-846607 usb_packet: pid: "PID: IN" "IN" "I"
846607-846719 usb_packet: addr: "Address: 92" "Addr: 92" "Addr" "A"
846719-846783 usb_packet: ep: "Endpoint: 0" "EP: 0" "EP" "E"
846783-846863 usb_packet: crc5-ok: "CRC5: 0x1C" "CRC5" "C"
846351-846911 usb_packet: packet-in: "IN ADDR 92 EP 0"
846975-847103 usb_packet: sync-ok: "SYNC: 00000001" "SYNC" "S"
847103-847231 usb_packet: pid: "PID: DATA0" "DATA0" "D"
847231-847359 usb_packet: data: "Databyte: 01" "Data: 01" "DB: 01" "01"
847359-847487 usb_packet: data: "Databyte: A1" "Data: A1" "DB: A1" "A1"
847487-847615 usb_packet: data: "Databyte: 01" "Data: 01" "DB: 01" "01"
847615-847743 usb_packet: data: "Databyte: 09" "Data: 09" "DB: 09" "09"
847743-847871 usb_packet: data: "Databyte: 05" "Data: 05" "DB: 05" "05"
847871-847999 usb_packet: data: "Databyte: 32" "Data: 32" "DB: 32" "32"
847999-848127 usb_packet: data: "Databyte: 00" "Data: 00" "DB: 00" "00"
848127-848255 usb_packet: data: "Databyte: 54" "Data: 54" "DB: 54" "54"
848255-848383 usb_packet: data: "Databyte: 00" "Data: 00" "DB: 00" "00"
848271-848527 usb_packet: crc16-ok: "CRC16: 0x5D53" "CRC16" "C"
846975-848575 usb_packet: packet-data0: "DATA0 [ 01 A1 01 09 05 32 00 54 00 ]"
848647-848775 usb_packet: sync-ok: "SYNC: 00000001" "SYNC" "S"
848775-848903 usb_packet: pid: "PID: ACK" "ACK" "A"
848647-848951 usb_packet: packet-ack: "ACK"
849189-849317 usb_packet: sync-ok: "SYNC: 00000001" "SYNC" "S"
849317-849445 usb_packet: pid: "PID: IN" "IN" "I"
849445-849557 usb_packet: addr: "Address: 92" "Addr: 92" "Addr" "A"
849557-849621 usb_packet: ep: "Endpoint: 0" "EP: 0" "EP" "E"
849621-849701 usb_packet: crc5-ok: "CRC5: 0x1C" "CRC5" "C"
849189-849749 usb_packet: packet-in: "IN ADDR 92 EP 0"
849811-849939 usb_packet: sync-ok: "SYNC: 00000001" "SYNC" "S"
849939-850067 usb_packet: pid: "PID: NAK" "NAK" "N"
849811-850115 usb_packet: packet-nak: "NAK"
850341-850469 usb_packet: sync-ok: "SYNC: 00000001" "SYNC" "S"
850469-850597 usb_packet: pid: "PID: IN" "IN" "I"
850597-850709 usb_packet: addr: "Address: 92" "Addr: 92" "Addr" "A"
850709-850773 usb_packet: ep: "Endpoint: 0" "EP: 0" "EP" "E"
850773-850853 usb_packet: crc5-ok: "CRC5: 0x1C" "CRC5" "C"
850341-850901 usb_packet: packet-in: "IN ADDR 92 EP 0"
850963-851091 usb_packet: sync-ok: "SYNC: 00000001" "SYNC" "S"
851091-851219 usb_packet: pid: "PID: DATA1" "DATA1" "D"
851219-851347 usb_packet: data: "Databyte: 3C" "Data: 3C" "DB: 3C" "3C"
851347-851475 usb_packet: data: "Databyte: 02" "Data: 02" "DB: 02" "02"
851475-851603 usb_packet: data: "Databyte: 15" "Data: 15" "DB: 15" "15"
851603-851731 usb_packet: data: "Databyte: 00" "Data: 00" "DB: 00" "00"
851731-851859 usb_packet: data: "Databyte: 26" "Data: 26" "DB: 26" "26"
851859-851987 usb_packet: data: "Databyte: 3C" "Data: 3C" "DB: 3C" "3C"
851987-852115 usb_packet: data: "Databyte: 02" "Data: 02" "DB: 02" "02"
852115-852243 usb_packet: data: "Databyte: 95" "Data: 95" "DB: 95" "95"
852243-852499 usb_packet: crc16-ok: "CRC16: 0xFB97" "CRC16" "C"
850963-852547 usb_packet: packet-data1: "DATA1 [ 3C 02 15 00 26 3C 02 95 ]"
852615-852743 usb_packet: sync-ok: "SYNC: 00000001" "SYNC" "S"
852743-852871 usb_packet: pid: "PID: ACK" "ACK" "A"
852615-852919 usb_packet: packet-ack: "ACK"
853277-853405 usb_packet: sync-ok: "SYNC: 00000001" "SYNC" "S"
853405-853533 usb_packet: pid: "PID: IN" "IN" "I"
853533-853645 usb_packet: addr: "Address: 92" "Addr: 92" "Addr" "A"
853645-853709 usb_packet: ep: "Endpoint: 0" "EP: 0" "EP" "E"
853709-853789 usb_packet: crc5-ok: "CRC5: 0x1C" "CRC5" "C"
853277-853837 usb_packet: packet-in: "IN ADDR 92 EP 0"
853900-854028 usb_packet: sync-ok: "SYNC: 00000001" "SYNC" "S"
854028-854156 usb_packet: pid: "PID: NAK" "NAK" "N"
853900-854204 usb_packet: packet-nak: "NAK"
854355-854483 usb_packet: sync-ok: "SYNC: 00000001" "SYNC" "S"
854483-854611 usb_packet: pid: "PID: IN" "IN" "I"
854611-854723 usb_packet: addr: "Address: 92" "Addr: 92" "Addr" "A"
854723-854787 usb_packet: ep: "Endpoint: 0" "EP: 0" "EP" "E"
854787-854867 usb_packet: crc5-ok: "CRC5: 0x1C" "CRC5" "C"
854355-854915 usb_packet: packet-in: "IN ADDR 92 EP 0"
854976-855104 usb_packet: sync-ok: "SYNC: 00000001" "SYNC" "S"
855104-855232 usb_packet: pid: "PID: DATA0" "DATA0" "D"
855232-855360 usb_packet: data: "Databyte: 01" "Data: 01" "DB: 01" "01"
855360-855488 usb_packet: data: "Databyte: 75" "Data: 75" "DB: 75" "75"
855488-855616 usb_packet: data: "Databyte: 10" "Data: 10" "DB: 10" "10"
855616-855744 usb_packet: data: "Databyte: 81" "Data: 81" "DB: 81" "81"
855744-855872 usb_packet: data: "Databyte: 00" "Data: 00" "DB: 00" "00"
855872-856000 usb_packet: data: "Databyte: C0" "Data: C0" "DB: C0" "C0"
856000-856256 usb_packet: crc16-ok: "CRC16: 0x4627" "CRC16" "C"
854976-856304 usb_packet: packet-data0: "DATA0 [ 01 75 10 81 00 C0 ]"
856372-856500 usb_packet: sync-ok: "SYNC: 00000001" "SYNC" "S"
856500-856628 usb_packet: pid: "PID: ACK" "ACK" "A"
856372-856676 usb_packet: packet-ack: "ACK"
856890-857018 usb_packet: sync-ok: "SYNC: 00000001" "SYNC" "S"
857018-857146 usb_packet: pid: "PID: OUT" "OUT" "O"
857146-857258 usb_packet: addr: "Address: 92" "Addr: 92" "Addr" "A"
857258-857322 usb_packet: ep: "Endpoint: 0" "EP: 0" "EP" "E"
857322-857402 usb_packet: crc5-ok: "CRC5: 0x1C" "CRC5" "C"
856890-857450 usb_packet: packet-out: "OUT ADDR 92 EP 0"
857543-857671 usb_packet: sync-ok: "SYNC: 00000001" "SYNC" "S"
857671-857799 usb_packet: pid: "PID: DATA1" "DATA1" "D"
857799-858055 usb_packet: crc16-ok: "CRC16: 0x0000" "CRC16" "C"
857543-858103 usb_packet: packet-data1: "DATA1 [ ]"
858165-858293 usb_packet: sync-ok: "SYNC: 00000001" "SYNC" "S"
858293-858421 usb_packet: pid: "PID: ACK" "ACK" "A"
858165-858469 usb_packet: packet-ack: "ACK"
961351-961479 usb_packet: sync-ok: "SYNC: 00000001" "SYNC" "S"
961479-961607 usb_packet: pid: "PID: IN" "IN" "I"
961607-961719 usb_packet: addr: "Address: 92" "Addr: 92" "Addr" "A"
961719-961783 usb_packet: ep: "Endpoint: 1" "EP: 1" "EP" "E"
961783-961863 usb_packet: crc5-ok: "CRC5: 0x0A" "CRC5" "C"
961351-961911 usb_packet: packet-in: "IN ADDR 92 EP 1"
961973-962101 usb_packet: sync-ok: "SYNC: 00000001" "SYNC" "S"
962101-962229 usb_packet: pid: "PID: NAK" "NAK" "N"
961973-962277 usb_packet: packet-nak: "NAK"
985356-985484 usb_packet: sync-ok: "SYNC: 00000001" "SYNC" "S"
985484-985612 usb_packet: pid: "PID: IN" "IN" "I"
985612-985724 usb_packet: addr: "Address: 92" "Addr: 92" "Addr" "A"
985724-985788 usb_packet: ep: "Endpoint: 2" "EP: 2" "EP" "E"
985788-985868 usb_packet: crc5-ok: "CRC5: 0x19" "CRC5" "C"
985356-985916 usb_packet: packet-in: "IN ADDR 92 EP 2"
985979-986107 usb_packet: sync-ok: "SYNC: 00000001" "SYNC" "S"
986107-986235 usb_packet: pid: "PID: NAK" "NAK" "N"
985979-986283 usb_packet: packet-nak: "NAK"
