2704-2737 usb_packet: sync-ok: "SYNC: 00000001" "SYNC" "S"
2737-2771 usb_packet: pid: "PID: SETUP" "SETUP" "S"
2771-2800 usb_packet: addr: "Address: 55" "Addr: 55" "Addr" "A"
2800-2816 usb_packet: ep: "Endpoint: 0" "EP: 0" "EP" "E"
2816-2837 usb_packet: crc5-ok: "CRC5: 0x00" "CRC5" "C"
2704-2850 usb_packet: packet-setup: "SETUP ADDR 55 EP 0"
2861-2894 usb_packet: sync-ok: "SYNC: 00000001" "SYNC" "S"
2894-2927 usb_packet: pid: "PID: DATA0" "DATA0" "D"
2927-2960 usb_packet: data: "Databyte: 80" "Data: 80" "DB: 80" "80"
2960-2994 usb_packet: data: "Databyte: 06" "Data: 06" "DB: 06" "06"
2994-3027 usb_packet: data: "Databyte: 00" "Data: 00" "DB: 00" "00"
3027-3060 usb_packet: data: "Databyte: 06" "Data: 06" "DB: 06" "06"
3060-3094 usb_packet: data: "Databyte: 00" "Data: 00" "DB: 00" "00"
3094-3127 usb_packet: data: "Databyte: 00" "Data: 00" "DB: 00" "00"
3127-3161 usb_packet: data: "Databyte: 0A" "Data: 0A" "DB: 0A" "0A"
3161-3194 usb_packet: data: "Databyte: 00" "Data: 00" "DB: 00" "00"
3194-3261 usb_packet: crc16-ok: "CRC16: 0x345F" "CRC16" "C"
2861-3273 usb_packet: packet-data0: "DATA0 [ 80 06 00 06 00 00 0A 00 ]"
3283-3316 usb_packet: sync-ok: "SYNC: 00000001" "SYNC" "S"
3316-3349 usb_packet: pid: "PID: ACK" "ACK" "A"
3283-3361 usb_packet: packet-ack: "ACK"
3956-3989 usb_packet: sync-ok: "SYNC: 00000001" "SYNC" "S"
3989-4022 usb_packet: pid: "PID: IN" "IN" "I"
4022-4052 usb_packet: addr: "Address: 55" "Addr: 55" "Addr" "A"
4052-4068 usb_packet: ep: "Endpoint: 0" "EP: 0" "EP" "E"
4068-4089 usb_packet: crc5-ok: "CRC5: 0x00" "CRC5" "C"
3956-4101 usb_packet: packet-in: "IN ADDR 55 EP 0"
4111-4144 usb_packet: sync-ok: "SYNC: 00000001" "SYNC" "S"
4144-4177 usb_packet: pid: "PID: NAK" "NAK" "N"
4111-4189 usb_packet: packet-nak: "NAK"
7051-7084 usb_packet: sync-ok: "SYNC: 00000001" "SYNC" "S"
7084-7117 usb_packet: pid: "PID: IN" "IN" "I"
7117-7146 usb_packet: addr: "Address: 55" "Addr: 55" "Addr" "A"
7146-7163 usb_packet: ep: "Endpoint: 0" "EP: 0" "EP" "E"
7163-7184 usb_packet: crc5-ok: "CRC5: 0x00" "CRC5" "C"
7051-7196 usb_packet: packet-in: "IN ADDR 55 EP 0"
7206-7239 usb_packet: sync-ok: "SYNC: 00000001" "SYNC" "S"
7239-7272 usb_packet: pid: "PID: NAK" "NAK" "N"
7206-7284 usb_packet: packet-nak: "NAK"
9750-9783 usb_packet: sync-ok: "SYNC: 00000001" "SYNC" "S"
9783-9816 usb_packet: pid: "PID: IN" "IN" "I"
9816-9845 usb_packet: addr: "Address: 55" "Addr: 55" "Addr" "A"
9845-9861 usb_packet: ep: "Endpoint: 0" "EP: 0" "EP" "E"
9861-9882 usb_packet: crc5-ok: "CRC5: 0x00" "CRC5" "C"
9750-9895 usb_packet: packet-in: "IN ADDR 55 EP 0"
9905-9938 usb_packet: sync-ok: "SYNC: 00000001" "SYNC" "S"
9938-9971 usb_packet: pid: "PID: NAK" "NAK" "N"
9905-9983 usb_packet: packet-nak: "NAK"
12450-12483 usb_packet: sync-ok: "SYNC: 00000001" "SYNC" "S"
12483-12516 usb_packet: pid: "PID: IN" "IN" "I"
12516-12546 usb_packet: addr: "Address: 55" "Addr: 55" "Addr" "A"
12546-12562 usb_packet: ep: "Endpoint: 0" "EP: 0" "EP" "E"
12562-12583 usb_packet: crc5-ok: "CRC5: 0x00" "CRC5" "C"
12450-12596 usb_packet: packet-in: "IN ADDR 55 EP 0"
12605-12638 usb_packet: sync-ok: "SYNC: 00000001" "SYNC" "S"
12638-12671 usb_packet: pid: "PID: NAK" "NAK" "N"
12605-12683 usb_packet: packet-nak: "NAK"
14862-14895 usb_packet: sync-ok: "SYNC: 00000001" "SYNC" "S"
14895-14928 usb_packet: pid: "PID: IN" "IN" "I"
14928-14957 usb_packet: addr: "Address: 55" "Addr: 55" "Addr" "A"
14957-14974 usb_packet: ep: "Endpoint: 0" "EP: 0" "EP" "E"
14974-14995 usb_packet: crc5-ok: "CRC5: 0x00" "CRC5" "C"
14862-15007 usb_packet: packet-in: "IN ADDR 55 EP 0"
15017-15050 usb_packet: sync-ok: "SYNC: 00000001" "SYNC" "S"
15050-15083 usb_packet: pid: "PID: NAK" "NAK" "N"
15017-15096 usb_packet: packet-nak: "NAK"
17599-17632 usb_packet: sync-ok: "SYNC: 00000001" "SYNC" "S"
17632-17665 usb_packet: pid: "PID: IN" "IN" "I"
17665-17694 usb_packet: addr: "Address: 55" "Addr: 55" "Addr" "A"
17694-17711 usb_packet: ep: "Endpoint: 0" "EP: 0" "EP" "E"
17711-17732 usb_packet: crc5-ok: "CRC5: 0x00" "CRC5" "C"
17599-17744 usb_packet: packet-in: "IN ADDR 55 EP 0"
17754-17787 usb_packet: sync-ok: "SYNC: 00000001" "SYNC" "S"
17787-17820 usb_packet: pid: "PID: NAK" "NAK" "N"
17754-17832 usb_packet: packet-nak: "NAK"
20390-20423 usb_packet: sync-ok: "SYNC: 00000001" "SYNC" "S"
20423-20456 usb_packet: pid: "PID: IN" "IN" "I"
20456-20485 usb_packet: addr: "Address: 55" "Addr: 55" "Addr" "A"
20485-20502 usb_packet: ep: "Endpoint: 0" "EP: 0" "EP" "E"
20502-20523 usb_packet: crc5-ok: "CRC5: 0x00" "CRC5" "C"
20390-20535 usb_packet: packet-in: "IN ADDR 55 EP 0"
20544-20577 usb_packet: sync-ok: "SYNC: 00000001" "SYNC" "S"
20577-20610 usb_packet: pid: "PID: NAK" "NAK" "N"
20544-20623 usb_packet: packet-nak: "NAK"
23400-23433 usb_packet: sync-ok: "SYNC: 00000001" "SYNC" "S"
23433-23466 usb_packet: pid: "PID: IN" "IN" "I"
23466-23495 usb_packet: addr: "Address: 55" "Addr: 55" "Addr" "A"
23495-23512 usb_packet: ep: "Endpoint: 0" "EP: 0" "EP" "E"
23512-23533 usb_packet: crc5-ok: "CRC5: 0x00" "CRC5" "C"
23400-23545 usb_packet: packet-in: "IN ADDR 55 EP 0"
23555-23588 usb_packet: sync-ok: "SYNC: 00000001" "SYNC" "S"
23588-23621 usb_packet: pid: "PID: STALL" "STALL" "S"
23555-23633 usb_packet: packet-stall: "STALL"
27384-27417 usb_packet: sync-ok: "SYNC: 00000001" "SYNC" "S"
27417-27450 usb_packet: pid: "PID: SETUP" "SETUP" "S"
27450-27479 usb_packet: addr: "Address: 55" "Addr: 55" "Addr" "A"
27479-27495 usb_packet: ep: "Endpoint: 0" "EP: 0" "EP" "E"
27495-27516 usb_packet: crc5-ok: "CRC5: 0x00" "CRC5" "C"
27384-27529 usb_packet: packet-setup: "SETUP ADDR 55 EP 0"
27540-27573 usb_packet: sync-ok: "SYNC: 00000001" "SYNC" "S"
27573-27606 usb_packet: pid: "PID: DATA0" "DATA0" "D"
27606-27640 usb_packet: data: "Databyte: 80" "Data: 80" "DB: 80" "80"
27640-27673 usb_packet: data: "Databyte: 06" "Data: 06" "DB: 06" "06"
27673-27706 usb_packet: data: "Databyte: 00" "Data: 00" "DB: 00" "00"
27706-27740 usb_packet: data: "Databyte: 06" "Data: 06" "DB: 06" "06"
27740-27773 usb_packet: data: "Databyte: 00" "Data: 00" "DB: 00" "00"
27773-27807 usb_packet: data: "Databyte: 00" "Data: 00" "DB: 00" "00"
27807-27840 usb_packet: data: "Databyte: 0A" "Data: 0A" "DB: 0A" "0A"
27840-27873 usb_packet: data: "Databyte: 00" "Data: 00" "DB: 00" "00"
27873-27940 usb_packet: crc16-ok: "CRC16: 0x345F" "CRC16" "C"
27540-27952 usb_packet: packet-data0: "DATA0 [ 80 06 00 06 00 00 0A 00 ]"
27962-27995 usb_packet: sync-ok: "SYNC: 00000001" "SYNC" "S"
27995-28028 usb_packet: pid: "PID: ACK" "ACK" "A"
27962-28040 usb_packet: packet-ack: "ACK"
28637-28670 usb_packet: sync-ok: "SYNC: 00000001" "SYNC" "S"
28670-28703 usb_packet: pid: "PID: IN" "IN" "I"
28703-28732 usb_packet: addr: "Address: 55" "Addr: 55" "Addr" "A"
28732-28749 usb_packet: ep: "Endpoint: 0" "EP: 0" "EP" "E"
28749-28770 usb_packet: crc5-ok: "CRC5: 0x00" "CRC5" "C"
28637-28782 usb_packet: packet-in: "IN ADDR 55 EP 0"
28792-28825 usb_packet: sync-ok: "SYNC: 00000001" "SYNC" "S"
28825-28858 usb_packet: pid: "PID: NAK" "NAK" "N"
28792-28870 usb_packet: packet-nak: "NAK"
31749-31782 usb_packet: sync-ok: "SYNC: 00000001" "SYNC" "S"
31782-31815 usb_packet: pid: "PID: IN" "IN" "I"
31815-31844 usb_packet: addr: "Address: 55" "Addr: 55" "Addr" "A"
31844-31860 usb_packet: ep: "Endpoint: 0" "EP: 0" "EP" "E"
31860-31881 usb_packet: crc5-ok: "CRC5: 0x00" "CRC5" "C"
31749-31894 usb_packet: packet-in: "IN ADDR 55 EP 0"
31903-31936 usb_packet: sync-ok: "SYNC: 00000001" "SYNC" "S"
31936-31970 usb_packet: pid: "PID: NAK" "NAK" "N"
31903-31982 usb_packet: packet-nak: "NAK"
34140-34173 usb_packet: sync-ok: "SYNC: 00000001" "SYNC" "S"
34173-34206 usb_packet: pid: "PID: IN" "IN" "I"
34206-34236 usb_packet: addr: "Address: 55" "Addr: 55" "Addr" "A"
34236-34252 usb_packet: ep: "Endpoint: 0" "EP: 0" "EP" "E"
34252-34273 usb_packet: crc5-ok: "CRC5: 0x00" "CRC5" "C"
34140-34286 usb_packet: packet-in: "IN ADDR 55 EP 0"
34295-34328 usb_packet: sync-ok: "SYNC: 00000001" "SYNC" "S"
34328-34361 usb_packet: pid: "PID: NAK" "NAK" "N"
34295-34374 usb_packet: packet-nak: "NAK"
36851-36884 usb_packet: sync-ok: "SYNC: 00000001" "SYNC" "S"
36884-36917 usb_packet: pid: "PID: IN" "IN" "I"
36917-36946 usb_packet: addr: "Address: 55" "Addr: 55" "Addr" "A"
36946-36963 usb_packet: ep: "Endpoint: 0" "EP: 0" "EP" "E"
36963-36984 usb_packet: crc5-ok: "CRC5: 0x00" "CRC5" "C"
36851-36996 usb_packet: packet-in: "IN ADDR 55 EP 0"
37006-37039 usb_packet: sync-ok: "SYNC: 00000001" "SYNC" "S"
37039-37072 usb_packet: pid: "PID: NAK" "NAK" "N"
37006-37084 usb_packet: packet-nak: "NAK"
40424-40457 usb_packet: sync-ok: "SYNC: 00000001" "SYNC" "S"
40457-40490 usb_packet: pid: "PID: IN" "IN" "I"
40490-40519 usb_packet: addr: "Address: 55" "Addr: 55" "Addr" "A"
40519-40535 usb_packet: ep: "Endpoint: 0" "EP: 0" "EP" "E"
40535-40556 usb_packet: crc5-ok: "CRC5: 0x00" "CRC5" "C"
40424-40569 usb_packet: packet-in: "IN ADDR 55 EP 0"
40578-40611 usb_packet: sync-ok: "SYNC: 00000001" "SYNC" "S"
40611-40645 usb_packet: pid: "PID: NAK" "NAK" "N"
40578-40657 usb_packet: packet-nak: "NAK"
46038-46071 usb_packet: sync-ok: "SYNC: 00000001" "SYNC" "S"
46071-46104 usb_packet: pid: "PID: SOF" "SOF" "S"
46104-46150 usb_packet: framenum: "Frame: 1057" "Frame" "Fr" "F"
46150-46171 usb_packet: crc5-ok: "CRC5: 0x18" "CRC5" "C"
46038-46183 usb_packet: packet-sof: "SOF 1057"
46282-46315 usb_packet: sync-ok: "SYNC: 00000001" "SYNC" "S"
46315-46348 usb_packet: pid: "PID: IN" "IN" "I"
46348-46377 usb_packet: addr: "Address: 55" "Addr: 55" "Addr" "A"
46377-46394 usb_packet: ep: "Endpoint: 0" "EP: 0" "EP" "E"
46394-46415 usb_packet: crc5-ok: "CRC5: 0x00" "CRC5" "C"
46282-46427 usb_packet: packet-in: "IN ADDR 55 EP 0"
46437-46470 usb_packet: sync-ok: "SYNC: 00000001" "SYNC" "S"
46470-46503 usb_packet: pid: "PID: NAK" "NAK" "N"
46437-46515 usb_packet: packet-nak: "NAK"
48850-48883 usb_packet: sync-ok: "SYNC: 00000001" "SYNC" "S"
48883-48916 usb_packet: pid: "PID: IN" "IN" "I"
48916-48945 usb_packet: addr: "Address: 55" "Addr: 55" "Addr" "A"
48945-48961 usb_packet: ep: "Endpoint: 0" "EP: 0" "EP" "E"
48961-48982 usb_packet: crc5-ok: "CRC5: 0x00" "CRC5" "C"
48850-48995 usb_packet: packet-in: "IN ADDR 55 EP 0"
49004-49037 usb_packet: sync-ok: "SYNC: 00000001" "SYNC" "S"
49037-49071 usb_packet: pid: "PID: NAK" "NAK" "N"
49004-49083 usb_packet: packet-nak: "NAK"
51548-51581 usb_packet: sync-ok: "SYNC: 00000001" "SYNC" "S"
51581-51614 usb_packet: pid: "PID: IN" "IN" "I"
51614-51643 usb_packet: addr: "Address: 55" "Addr: 55" "Addr" "A"
51643-51660 usb_packet: ep: "Endpoint: 0" "EP: 0" "EP" "E"
51660-51681 usb_packet: crc5-ok: "CRC5: 0x00" "CRC5" "C"
51548-51693 usb_packet: packet-in: "IN ADDR 55 EP 0"
51702-51735 usb_packet: sync-ok: "SYNC: 00000001" "SYNC" "S"
51735-51769 usb_packet: pid: "PID: NAK" "NAK" "N"
51702-51781 usb_packet: packet-nak: "NAK"
54700-54733 usb_packet: sync-ok: "SYNC: 00000001" "SYNC" "S"
54733-54766 usb_packet: pid: "PID: IN" "IN" "I"
54766-54795 usb_packet: addr: "Address: 55" "Addr: 55" "Addr" "A"
54795-54812 usb_packet: ep: "Endpoint: 0" "EP: 0" "EP" "E"
54812-54832 usb_packet: crc5-ok: "CRC5: 0x00" "CRC5" "C"
54700-54845 usb_packet: packet-in: "IN ADDR 55 EP 0"
54854-54887 usb_packet: sync-ok: "SYNC: 00000001" "SYNC" "S"
54887-54921 usb_packet: pid: "PID: NAK" "NAK" "N"
54854-54933 usb_packet: packet-nak: "NAK"
57579-57612 usb_packet: sync-ok: "SYNC: 00000001" "SYNC" "S"
57612-57645 usb_packet: pid: "PID: IN" "IN" "I"
57645-57674 usb_packet: addr: "Address: 55" "Addr: 55" "Addr" "A"
57674-57690 usb_packet: ep: "Endpoint: 0" "EP: 0" "EP" "E"
57690-57711 usb_packet: crc5-ok: "CRC5: 0x00" "CRC5" "C"
57579-57724 usb_packet: packet-in: "IN ADDR 55 EP 0"
57734-57767 usb_packet: sync-ok: "SYNC: 00000001" "SYNC" "S"
57767-57800 usb_packet: pid: "PID: NAK" "NAK" "N"
57734-57812 usb_packet: packet-nak: "NAK"
60849-60882 usb_packet: sync-ok: "SYNC: 00000001" "SYNC" "S"
60882-60915 usb_packet: pid: "PID: IN" "IN" "I"
60915-60944 usb_packet: addr: "Address: 55" "Addr: 55" "Addr" "A"
60944-60961 usb_packet: ep: "Endpoint: 0" "EP: 0" "EP" "E"
60961-60982 usb_packet: crc5-ok: "CRC5: 0x00" "CRC5" "C"
60849-60994 usb_packet: packet-in: "IN ADDR 55 EP 0"
61003-61036 usb_packet: sync-ok: "SYNC: 00000001" "SYNC" "S"
61036-61070 usb_packet: pid: "PID: NAK" "NAK" "N"
61003-61082 usb_packet: packet-nak: "NAK"
63679-63712 usb_packet: sync-ok: "SYNC: 00000001" "SYNC" "S"
63712-63745 usb_packet: pid: "PID: IN" "IN" "I"
63745-63774 usb_packet: addr: "Address: 55" "Addr: 55" "Addr" "A"
63774-63791 usb_packet: ep: "Endpoint: 0" "EP: 0" "EP" "E"
63791-63812 usb_packet: crc5-ok: "CRC5: 0x00" "CRC5" "C"
63679-63824 usb_packet: packet-in: "IN ADDR 55 EP 0"
63834-63867 usb_packet: sync-ok: "SYNC: 00000001" "SYNC" "S"
63867-63900 usb_packet: pid: "PID: STALL" "STALL" "S"
63834-63912 usb_packet: packet-stall: "STALL"
67470-67503 usb_packet: sync-ok: "SYNC: 00000001" "SYNC" "S"
67503-67536 usb_packet: pid: "PID: SETUP" "SETUP" "S"
67536-67565 usb_packet: addr: "Address: 55" "Addr: 55" "Addr" "A"
67565-67582 usb_packet: ep: "Endpoint: 0" "EP: 0" "EP" "E"
67582-67603 usb_packet: crc5-ok: "CRC5: 0x00" "CRC5" "C"
67470-67615 usb_packet: packet-setup: "SETUP ADDR 55 EP 0"
67627-67660 usb_packet: sync-ok: "SYNC: 00000001" "SYNC" "S"
67660-67693 usb_packet: pid: "PID: DATA0" "DATA0" "D"
67693-67726 usb_packet: data: "Databyte: 80" "Data: 80" "DB: 80" "80"
67726-67759 usb_packet: data: "Databyte: 06" "Data: 06" "DB: 06" "06"
67759-67793 usb_packet: data: "Databyte: 00" "Data: 00" "DB: 00" "00"
67793-67826 usb_packet: data: "Databyte: 06" "Data: 06" "DB: 06" "06"
67826-67859 usb_packet: data: "Databyte: 00" "Data: 00" "DB: 00" "00"
67859-67893 usb_packet: data: "Databyte: 00" "Data: 00" "DB: 00" "00"
67893-67926 usb_packet: data: "Databyte: 0A" "Data: 0A" "DB: 0A" "0A"
67926-67959 usb_packet: data: "Databyte: 00" "Data: 00" "DB: 00" "00"
67959-68026 usb_packet: crc16-ok: "CRC16: 0x345F" "CRC16" "C"
67627-68039 usb_packet: packet-data0: "DATA0 [ 80 06 00 06 00 00 0A 00 ]"
68047-68080 usb_packet: sync-ok: "SYNC: 00000001" "SYNC" "S"
68080-68113 usb_packet: pid: "PID: ACK" "ACK" "A"
68047-68126 usb_packet: packet-ack: "ACK"
68967-69000 usb_packet: sync-ok: "SYNC: 00000001" "SYNC" "S"
69000-69033 usb_packet: pid: "PID: IN" "IN" "I"
69033-69062 usb_packet: addr: "Address: 55" "Addr: 55" "Addr" "A"
69062-69079 usb_packet: ep: "Endpoint: 0" "EP: 0" "EP" "E"
69079-69099 usb_packet: crc5-ok: "CRC5: 0x00" "CRC5" "C"
68967-69112 usb_packet: packet-in: "IN ADDR 55 EP 0"
69121-69154 usb_packet: sync-ok: "SYNC: 00000001" "SYNC" "S"
69154-69187 usb_packet: pid: "PID: NAK" "NAK" "N"
69121-69200 usb_packet: packet-nak: "NAK"
72799-72832 usb_packet: sync-ok: "SYNC: 00000001" "SYNC" "S"
72832-72865 usb_packet: pid: "PID: IN" "IN" "I"
72865-72894 usb_packet: addr: "Address: 55" "Addr: 55" "Addr" "A"
72894-72911 usb_packet: ep: "Endpoint: 0" "EP: 0" "EP" "E"
72911-72932 usb_packet: crc5-ok: "CRC5: 0x00" "CRC5" "C"
72799-72944 usb_packet: packet-in: "IN ADDR 55 EP 0"
72953-72986 usb_packet: sync-ok: "SYNC: 00000001" "SYNC" "S"
72986-73020 usb_packet: pid: "PID: NAK" "NAK" "N"
72953-73032 usb_packet: packet-nak: "NAK"
75627-75660 usb_packet: sync-ok: "SYNC: 00000001" "SYNC" "S"
75660-75693 usb_packet: pid: "PID: IN" "IN" "I"
75693-75722 usb_packet: addr: "Address: 55" "Addr: 55" "Addr" "A"
75722-75739 usb_packet: ep: "Endpoint: 0" "EP: 0" "EP" "E"
75739-75760 usb_packet: crc5-ok: "CRC5: 0x00" "CRC5" "C"
75627-75772 usb_packet: packet-in: "IN ADDR 55 EP 0"
75782-75815 usb_packet: sync-ok: "SYNC: 00000001" "SYNC" "S"
75815-75848 usb_packet: pid: "PID: NAK" "NAK" "N"
75782-75860 usb_packet: packet-nak: "NAK"
77891-77924 usb_packet: sync-ok: "SYNC: 00000001" "SYNC" "S"
77924-77957 usb_packet: pid: "PID: IN" "IN" "I"
77957-77986 usb_packet: addr: "Address: 55" "Addr: 55" "Addr" "A"
77986-78002 usb_packet: ep: "Endpoint: 0" "EP: 0" "EP" "E"
78002-78023 usb_packet: crc5-ok: "CRC5: 0x00" "CRC5" "C"
77891-78036 usb_packet: packet-in: "IN ADDR 55 EP 0"
78045-78078 usb_packet: sync-ok: "SYNC: 00000001" "SYNC" "S"
78078-78111 usb_packet: pid: "PID: NAK" "NAK" "N"
78045-78124 usb_packet: packet-nak: "NAK"
81300-81333 usb_packet: sync-ok: "SYNC: 00000001" "SYNC" "S"
81333-81366 usb_packet: pid: "PID: IN" "IN" "I"
81366-81395 usb_packet: addr: "Address: 55" "Addr: 55" "Addr" "A"
81395-81411 usb_packet: ep: "Endpoint: 0" "EP: 0" "EP" "E"
81411-81432 usb_packet: crc5-ok: "CRC5: 0x00" "CRC5" "C"
81300-81445 usb_packet: packet-in: "IN ADDR 55 EP 0"
81454-81487 usb_packet: sync-ok: "SYNC: 00000001" "SYNC" "S"
81487-81521 usb_packet: pid: "PID: NAK" "NAK" "N"
81454-81533 usb_packet: packet-nak: "NAK"
84188-84221 usb_packet: sync-ok: "SYNC: 00000001" "SYNC" "S"
84221-84254 usb_packet: pid: "PID: IN" "IN" "I"
84254-84283 usb_packet: addr: "Address: 55" "Addr: 55" "Addr" "A"
84283-84300 usb_packet: ep: "Endpoint: 0" "EP: 0" "EP" "E"
84300-84321 usb_packet: crc5-ok: "CRC5: 0x00" "CRC5" "C"
84188-84333 usb_packet: packet-in: "IN ADDR 55 EP 0"
84343-84376 usb_packet: sync-ok: "SYNC: 00000001" "SYNC" "S"
84376-84409 usb_packet: pid: "PID: NAK" "NAK" "N"
84343-84422 usb_packet: packet-nak: "NAK"
86900-86933 usb_packet: sync-ok: "SYNC: 00000001" "SYNC" "S"
86933-86966 usb_packet: pid: "PID: IN" "IN" "I"
86966-86995 usb_packet: addr: "Address: 55" "Addr: 55" "Addr" "A"
86995-87011 usb_packet: ep: "Endpoint: 0" "EP: 0" "EP" "E"
87011-87032 usb_packet: crc5-ok: "CRC5: 0x00" "CRC5" "C"
86900-87045 usb_packet: packet-in: "IN ADDR 55 EP 0"
87054-87087 usb_packet: sync-ok: "SYNC: 00000001" "SYNC" "S"
87087-87121 usb_packet: pid: "PID: NAK" "NAK" "N"
87054-87133 usb_packet: packet-nak: "NAK"
89139-89172 usb_packet: sync-ok: "SYNC: 00000001" "SYNC" "S"
89172-89206 usb_packet: pid: "PID: IN" "IN" "I"
89206-89235 usb_packet: addr: "Address: 55" "Addr: 55" "Addr" "A"
89235-89251 usb_packet: ep: "Endpoint: 0" "EP: 0" "EP" "E"
89251-89272 usb_packet: crc5-ok: "CRC5: 0x00" "CRC5" "C"
89139-89285 usb_packet: packet-in: "IN ADDR 55 EP 0"
89294-89327 usb_packet: sync-ok: "SYNC: 00000001" "SYNC" "S"
89327-89360 usb_packet: pid: "PID: NAK" "NAK" "N"
89294-89373 usb_packet: packet-nak: "NAK"
92128-92161 usb_packet: sync-ok: "SYNC: 00000001" "SYNC" "S"
92161-92194 usb_packet: pid: "PID: IN" "IN" "I"
92194-92223 usb_packet: addr: "Address: 55" "Addr: 55" "Addr" "A"
92223-92239 usb_packet: ep: "Endpoint: 0" "EP: 0" "EP" "E"
92239-92260 usb_packet: crc5-ok: "CRC5: 0x00" "CRC5" "C"
92128-92273 usb_packet: packet-in: "IN ADDR 55 EP 0"
92283-92316 usb_packet: sync-ok: "SYNC: 00000001" "SYNC" "S"
92316-92349 usb_packet: pid: "PID: NAK" "NAK" "N"
92283-92361 usb_packet: packet-nak: "NAK"
96038-96071 usb_packet: sync-ok: "SYNC: 00000001" "SYNC" "S"
96071-96104 usb_packet: pid: "PID: SOF" "SOF" "S"
96104-96150 usb_packet: framenum: "Frame: 1058" "Frame" "Fr" "F"
96150-96171 usb_packet: crc5-ok: "CRC5: 0x10" "CRC5" "C"
96038-96183 usb_packet: packet-sof: "SOF 1058"
96282-96315 usb_packet: sync-ok: "SYNC: 00000001" "SYNC" "S"
96315-96348 usb_packet: pid: "PID: IN" "IN" "I"
96348-96378 usb_packet: addr: "Address: 55" "Addr: 55" "Addr" "A"
96378-96394 usb_packet: ep: "Endpoint: 0" "EP: 0" "EP" "E"
96394-96415 usb_packet: crc5-ok: "CRC5: 0x00" "CRC5" "C"
96282-96428 usb_packet: packet-in: "IN ADDR 55 EP 0"
96437-96470 usb_packet: sync-ok: "SYNC: 00000001" "SYNC" "S"
96470-96503 usb_packet: pid: "PID: NAK" "NAK" "N"
96437-96515 usb_packet: packet-nak: "NAK"
99550-99583 usb_packet: sync-ok: "SYNC: 00000001" "SYNC" "S"
99583-99616 usb_packet: pid: "PID: IN" "IN" "I"
99616-99646 usb_packet: addr: "Address: 55" "Addr: 55" "Addr" "A"
99646-99662 usb_packet: ep: "Endpoint: 0" "EP: 0" "EP" "E"
99662-99683 usb_packet: crc5-ok: "CRC5: 0x00" "CRC5" "C"
99550-99695 usb_packet: packet-in: "IN ADDR 55 EP 0"
99704-99737 usb_packet: sync-ok: "SYNC: 00000001" "SYNC" "S"
99737-99771 usb_packet: pid: "PID: NAK" "NAK" "N"
99704-99783 usb_packet: packet-nak: "NAK"
101740-101773 usb_packet: sync-ok: "SYNC: 00000001" "SYNC" "S"
101773-101806 usb_packet: pid: "PID: IN" "IN" "I"
101806-101836 usb_packet: addr: "Address: 55" "Addr: 55" "Addr" "A"
101836-101852 usb_packet: ep: "Endpoint: 0" "EP: 0" "EP" "E"
101852-101873 usb_packet: crc5-ok: "CRC5: 0x00" "CRC5" "C"
101740-101886 usb_packet: packet-in: "IN ADDR 55 EP 0"
101895-101928 usb_packet: sync-ok: "SYNC: 00000001" "SYNC" "S"
101928-101961 usb_packet: pid: "PID: NAK" "NAK" "N"
101895-101974 usb_packet: packet-nak: "NAK"
105252-105285 usb_packet: sync-ok: "SYNC: 00000001" "SYNC" "S"
105285-105318 usb_packet: pid: "PID: IN" "IN" "I"
105318-105347 usb_packet: addr: "Address: 55" "Addr: 55" "Addr" "A"
105347-105363 usb_packet: ep: "Endpoint: 0" "EP: 0" "EP" "E"
105363-105384 usb_packet: crc5-ok: "CRC5: 0x00" "CRC5" "C"
105252-105397 usb_packet: packet-in: "IN ADDR 55 EP 0"
105407-105440 usb_packet: sync-ok: "SYNC: 00000001" "SYNC" "S"
105440-105473 usb_packet: pid: "PID: STALL" "STALL" "S"
105407-105485 usb_packet: packet-stall: "STALL"
110431-110464 usb_packet: sync-ok: "SYNC: 00000001" "SYNC" "S"
110464-110497 usb_packet: pid: "PID: SETUP" "SETUP" "S"
110497-110526 usb_packet: addr: "Address: 55" "Addr: 55" "Addr" "A"
110526-110542 usb_packet: ep: "Endpoint: 0" "EP: 0" "EP" "E"
110542-110563 usb_packet: crc5-ok: "CRC5: 0x00" "CRC5" "C"
110431-110576 usb_packet: packet-setup: "SETUP ADDR 55 EP 0"
110587-110620 usb_packet: sync-ok: "SYNC: 00000001" "SYNC" "S"
110620-110653 usb_packet: pid: "PID: DATA0" "DATA0" "D"
110653-110687 usb_packet: data: "Databyte: 80" "Data: 80" "DB: 80" "80"
110687-110720 usb_packet: data: "Databyte: 06" "Data: 06" "DB: 06" "06"
110720-110753 usb_packet: data: "Databyte: 00" "Data: 00" "DB: 00" "00"
110753-110787 usb_packet: data: "Databyte: 02" "Data: 02" "DB: 02" "02"
110787-110820 usb_packet: data: "Databyte: 00" "Data: 00" "DB: 00" "00"
110820-110853 usb_packet: data: "Databyte: 00" "Data: 00" "DB: 00" "00"
110853-110887 usb_packet: data: "Databyte: 09" "Data: 09" "DB: 09" "09"
110887-110920 usb_packet: data: "Databyte: 00" "Data: 00" "DB: 00" "00"
110920-110987 usb_packet: crc16-ok: "CRC16: 0x04AE" "CRC16" "C"
110587-110999 usb_packet: packet-data0: "DATA0 [ 80 06 00 02 00 00 09 00 ]"
111009-111042 usb_packet: sync-ok: "SYNC: 00000001" "SYNC" "S"
111042-111075 usb_packet: pid: "PID: ACK" "ACK" "A"
111009-111087 usb_packet: packet-ack: "ACK"
112130-112163 usb_packet: sync-ok: "SYNC: 00000001" "SYNC" "S"
112163-112197 usb_packet: pid: "PID: IN" "IN" "I"
112197-112226 usb_packet: addr: "Address: 55" "Addr: 55" "Addr" "A"
112226-112243 usb_packet: ep: "Endpoint: 0" "EP: 0" "EP" "E"
112243-112263 usb_packet: crc5-ok: "CRC5: 0x00" "CRC5" "C"
112130-112276 usb_packet: packet-in: "IN ADDR 55 EP 0"
112286-112319 usb_packet: sync-ok: "SYNC: 00000001" "SYNC" "S"
112319-112352 usb_packet: pid: "PID: NAK" "NAK" "N"
112286-112364 usb_packet: packet-nak: "NAK"
115449-115482 usb_packet: sync-ok: "SYNC: 00000001" "SYNC" "S"
115482-115515 usb_packet: pid: "PID: IN" "IN" "I"
115515-115544 usb_packet: addr: "Address: 55" "Addr: 55" "Addr" "A"
115544-115561 usb_packet: ep: "Endpoint: 0" "EP: 0" "EP" "E"
115561-115582 usb_packet: crc5-ok: "CRC5: 0x00" "CRC5" "C"
115449-115594 usb_packet: packet-in: "IN ADDR 55 EP 0"
115603-115636 usb_packet: sync-ok: "SYNC: 00000001" "SYNC" "S"
115636-115670 usb_packet: pid: "PID: NAK" "NAK" "N"
115603-115682 usb_packet: packet-nak: "NAK"
118201-118234 usb_packet: sync-ok: "SYNC: 00000001" "SYNC" "S"
118234-118267 usb_packet: pid: "PID: IN" "IN" "I"
118267-118296 usb_packet: addr: "Address: 55" "Addr: 55" "Addr" "A"
118296-118313 usb_packet: ep: "Endpoint: 0" "EP: 0" "EP" "E"
118313-118334 usb_packet: crc5-ok: "CRC5: 0x00" "CRC5" "C"
118201-118346 usb_packet: packet-in: "IN ADDR 55 EP 0"
118355-118388 usb_packet: sync-ok: "SYNC: 00000001" "SYNC" "S"
118388-118422 usb_packet: pid: "PID: NAK" "NAK" "N"
118355-118434 usb_packet: packet-nak: "NAK"
121663-121696 usb_packet: sync-ok: "SYNC: 00000001" "SYNC" "S"
121696-121729 usb_packet: pid: "PID: IN" "IN" "I"
121729-121759 usb_packet: addr: "Address: 55" "Addr: 55" "Addr" "A"
121759-121775 usb_packet: ep: "Endpoint: 0" "EP: 0" "EP" "E"
121775-121796 usb_packet: crc5-ok: "CRC5: 0x00" "CRC5" "C"
121663-121809 usb_packet: packet-in: "IN ADDR 55 EP 0"
121818-121851 usb_packet: sync-ok: "SYNC: 00000001" "SYNC" "S"
121851-121884 usb_packet: pid: "PID: NAK" "NAK" "N"
121818-121896 usb_packet: packet-nak: "NAK"
122930-122963 usb_packet: sync-ok: "SYNC: 00000001" "SYNC" "S"
122963-122996 usb_packet: pid: "PID: IN" "IN" "I"
122996-123026 usb_packet: addr: "Address: 55" "Addr: 55" "Addr" "A"
123026-123042 usb_packet: ep: "Endpoint: 0" "EP: 0" "EP" "E"
123042-123063 usb_packet: crc5-ok: "CRC5: 0x00" "CRC5" "C"
122930-123075 usb_packet: packet-in: "IN ADDR 55 EP 0"
123085-123118 usb_packet: sync-ok: "SYNC: 00000001" "SYNC" "S"
123118-123151 usb_packet: pid: "PID: NAK" "NAK" "N"
123085-123163 usb_packet: packet-nak: "NAK"
126099-126132 usb_packet: sync-ok: "SYNC: 00000001" "SYNC" "S"
126132-126165 usb_packet: pid: "PID: IN" "IN" "I"
126165-126194 usb_packet: addr: "Address: 55" "Addr: 55" "Addr" "A"
126194-126211 usb_packet: ep: "Endpoint: 0" "EP: 0" "EP" "E"
126211-126232 usb_packet: crc5-ok: "CRC5: 0x00" "CRC5" "C"
126099-126244 usb_packet: packet-in: "IN ADDR 55 EP 0"
126253-126286 usb_packet: sync-ok: "SYNC: 00000001" "SYNC" "S"
126286-126320 usb_packet: pid: "PID: NAK" "NAK" "N"
126253-126332 usb_packet: packet-nak: "NAK"
129128-129161 usb_packet: sync-ok: "SYNC: 00000001" "SYNC" "S"
129161-129194 usb_packet: pid: "PID: IN" "IN" "I"
129194-129223 usb_packet: addr: "Address: 55" "Addr: 55" "Addr" "A"
129223-129240 usb_packet: ep: "Endpoint: 0" "EP: 0" "EP" "E"
129240-129261 usb_packet: crc5-ok: "CRC5: 0x00" "CRC5" "C"
129128-129273 usb_packet: packet-in: "IN ADDR 55 EP 0"
129283-129316 usb_packet: sync-ok: "SYNC: 00000001" "SYNC" "S"
129316-129349 usb_packet: pid: "PID: NAK" "NAK" "N"
129283-129361 usb_packet: packet-nak: "NAK"
132398-132431 usb_packet: sync-ok: "SYNC: 00000001" "SYNC" "S"
132431-132464 usb_packet: pid: "PID: IN" "IN" "I"
132464-132493 usb_packet: addr: "Address: 55" "Addr: 55" "Addr" "A"
132493-132510 usb_packet: ep: "Endpoint: 0" "EP: 0" "EP" "E"
132510-132531 usb_packet: crc5-ok: "CRC5: 0x00" "CRC5" "C"
132398-132543 usb_packet: packet-in: "IN ADDR 55 EP 0"
132553-132586 usb_packet: sync-ok: "SYNC: 00000001" "SYNC" "S"
132586-132620 usb_packet: pid: "PID: NAK" "NAK" "N"
132553-132632 usb_packet: packet-nak: "NAK"
135949-135982 usb_packet: sync-ok: "SYNC: 00000001" "SYNC" "S"
135982-136015 usb_packet: pid: "PID: IN" "IN" "I"
136015-136045 usb_packet: addr: "Address: 55" "Addr: 55" "Addr" "A"
136045-136061 usb_packet: ep: "Endpoint: 0" "EP: 0" "EP" "E"
136061-136082 usb_packet: crc5-ok: "CRC5: 0x00" "CRC5" "C"
135949-136095 usb_packet: packet-in: "IN ADDR 55 EP 0"
136104-136137 usb_packet: sync-ok: "SYNC: 00000001" "SYNC" "S"
136137-136171 usb_packet: pid: "PID: NAK" "NAK" "N"
136104-136183 usb_packet: packet-nak: "NAK"
138649-138682 usb_packet: sync-ok: "SYNC: 00000001" "SYNC" "S"
138682-138716 usb_packet: pid: "PID: IN" "IN" "I"
138716-138745 usb_packet: addr: "Address: 55" "Addr: 55" "Addr" "A"
138745-138761 usb_packet: ep: "Endpoint: 0" "EP: 0" "EP" "E"
138761-138782 usb_packet: crc5-ok: "CRC5: 0x00" "CRC5" "C"
138649-138795 usb_packet: packet-in: "IN ADDR 55 EP 0"
138804-138837 usb_packet: sync-ok: "SYNC: 00000001" "SYNC" "S"
138837-138871 usb_packet: pid: "PID: NAK" "NAK" "N"
138804-138883 usb_packet: packet-nak: "NAK"
142200-142233 usb_packet: sync-ok: "SYNC: 00000001" "SYNC" "S"
142233-142266 usb_packet: pid: "PID: IN" "IN" "I"
142266-142296 usb_packet: addr: "Address: 55" "Addr: 55" "Addr" "A"
142296-142312 usb_packet: ep: "Endpoint: 0" "EP: 0" "EP" "E"
142312-142333 usb_packet: crc5-ok: "CRC5: 0x00" "CRC5" "C"
142200-142346 usb_packet: packet-in: "IN ADDR 55 EP 0"
142355-142388 usb_packet: sync-ok: "SYNC: 00000001" "SYNC" "S"
142388-142422 usb_packet: pid: "PID: NAK" "NAK" "N"
142355-142434 usb_packet: packet-nak: "NAK"
146037-146070 usb_packet: sync-ok: "SYNC: 00000001" "SYNC" "S"
146070-146103 usb_packet: pid: "PID: SOF" "SOF" "S"
146103-146149 usb_packet: framenum: "Frame: 1059" "Frame" "Fr" "F"
146149-146170 usb_packet: crc5-ok: "CRC5: 0x0F" "CRC5" "C"
146037-146182 usb_packet: packet-sof: "SOF 1059"
146281-146314 usb_packet: sync-ok: "SYNC: 00000001" "SYNC" "S"
146314-146347 usb_packet: pid: "PID: IN" "IN" "I"
146347-146377 usb_packet: addr: "Address: 55" "Addr: 55" "Addr" "A"
146377-146393 usb_packet: ep: "Endpoint: 0" "EP: 0" "EP" "E"
146393-146414 usb_packet: crc5-ok: "CRC5: 0x00" "CRC5" "C"
146281-146427 usb_packet: packet-in: "IN ADDR 55 EP 0"
146436-146469 usb_packet: sync-ok: "SYNC: 00000001" "SYNC" "S"
146469-146502 usb_packet: pid: "PID: NAK" "NAK" "N"
146436-146514 usb_packet: packet-nak: "NAK"
148848-148881 usb_packet: sync-ok: "SYNC: 00000001" "SYNC" "S"
148881-148915 usb_packet: pid: "PID: IN" "IN" "I"
148915-148944 usb_packet: addr: "Address: 55" "Addr: 55" "Addr" "A"
148944-148960 usb_packet: ep: "Endpoint: 0" "EP: 0" "EP" "E"
148960-148981 usb_packet: crc5-ok: "CRC5: 0x00" "CRC5" "C"
148848-148994 usb_packet: packet-in: "IN ADDR 55 EP 0"
149003-149036 usb_packet: sync-ok: "SYNC: 00000001" "SYNC" "S"
149036-149070 usb_packet: pid: "PID: NAK" "NAK" "N"
149003-149082 usb_packet: packet-nak: "NAK"
151640-151673 usb_packet: sync-ok: "SYNC: 00000001" "SYNC" "S"
151673-151706 usb_packet: pid: "PID: IN" "IN" "I"
151706-151735 usb_packet: addr: "Address: 55" "Addr: 55" "Addr" "A"
151735-151751 usb_packet: ep: "Endpoint: 0" "EP: 0" "EP" "E"
151751-151772 usb_packet: crc5-ok: "CRC5: 0x00" "CRC5" "C"
151640-151785 usb_packet: packet-in: "IN ADDR 55 EP 0"
151794-151827 usb_packet: sync-ok: "SYNC: 00000001" "SYNC" "S"
151827-151860 usb_packet: pid: "PID: NAK" "NAK" "N"
151794-151872 usb_packet: packet-nak: "NAK"
154700-154733 usb_packet: sync-ok: "SYNC: 00000001" "SYNC" "S"
154733-154766 usb_packet: pid: "PID: IN" "IN" "I"
154766-154795 usb_packet: addr: "Address: 55" "Addr: 55" "Addr" "A"
154795-154811 usb_packet: ep: "Endpoint: 0" "EP: 0" "EP" "E"
154811-154832 usb_packet: crc5-ok: "CRC5: 0x00" "CRC5" "C"
154700-154845 usb_packet: packet-in: "IN ADDR 55 EP 0"
154854-154887 usb_packet: sync-ok: "SYNC: 00000001" "SYNC" "S"
154887-154921 usb_packet: pid: "PID: NAK" "NAK" "N"
154854-154933 usb_packet: packet-nak: "NAK"
157400-157433 usb_packet: sync-ok: "SYNC: 00000001" "SYNC" "S"
157433-157466 usb_packet: pid: "PID: IN" "IN" "I"
157466-157495 usb_packet: addr: "Address: 55" "Addr: 55" "Addr" "A"
157495-157512 usb_packet: ep: "Endpoint: 0" "EP: 0" "EP" "E"
157512-157533 usb_packet: crc5-ok: "CRC5: 0x00" "CRC5" "C"
157400-157545 usb_packet: packet-in: "IN ADDR 55 EP 0"
157554-157587 usb_packet: sync-ok: "SYNC: 00000001" "SYNC" "S"
157587-157621 usb_packet: pid: "PID: NAK" "NAK" "N"
157554-157633 usb_packet: packet-nak: "NAK"
161256-161289 usb_packet: sync-ok: "SYNC: 00000001" "SYNC" "S"
161289-161322 usb_packet: pid: "PID: IN" "IN" "I"
161322-161351 usb_packet: addr: "Address: 55" "Addr: 55" "Addr" "A"
161351-161367 usb_packet: ep: "Endpoint: 0" "EP: 0" "EP" "E"
161367-161388 usb_packet: crc5-ok: "CRC5: 0x00" "CRC5" "C"
161256-161401 usb_packet: packet-in: "IN ADDR 55 EP 0"
161411-161444 usb_packet: sync-ok: "SYNC: 00000001" "SYNC" "S"
161444-161477 usb_packet: pid: "PID: NAK" "NAK" "N"
161411-161489 usb_packet: packet-nak: "NAK"
163949-163982 usb_packet: sync-ok: "SYNC: 00000001" "SYNC" "S"
163982-164015 usb_packet: pid: "PID: IN" "IN" "I"
164015-164045 usb_packet: addr: "Address: 55" "Addr: 55" "Addr" "A"
164045-164061 usb_packet: ep: "Endpoint: 0" "EP: 0" "EP" "E"
164061-164082 usb_packet: crc5-ok: "CRC5: 0x00" "CRC5" "C"
163949-164095 usb_packet: packet-in: "IN ADDR 55 EP 0"
164104-164137 usb_packet: sync-ok: "SYNC: 00000001" "SYNC" "S"
164137-164171 usb_packet: pid: "PID: NAK" "NAK" "N"
164104-164183 usb_packet: packet-nak: "NAK"
167150-167183 usb_packet: sync-ok: "SYNC: 00000001" "SYNC" "S"
167183-167216 usb_packet: pid: "PID: IN" "IN" "I"
167216-167245 usb_packet: addr: "Address: 55" "Addr: 55" "Addr" "A"
167245-167262 usb_packet: ep: "Endpoint: 0" "EP: 0" "EP" "E"
167262-167283 usb_packet: crc5-ok: "CRC5: 0x00" "CRC5" "C"
167150-167295 usb_packet: packet-in: "IN ADDR 55 EP 0"
167304-167337 usb_packet: sync-ok: "SYNC: 00000001" "SYNC" "S"
167337-167371 usb_packet: pid: "PID: NAK" "NAK" "N"
167304-167383 usb_packet: packet-nak: "NAK"
169979-170012 usb_packet: sync-ok: "SYNC: 00000001" "SYNC" "S"
170012-170045 usb_packet: pid: "PID: IN" "IN" "I"
170045-170074 usb_packet: addr: "Address: 55" "Addr: 55" "Addr" "A"
170074-170091 usb_packet: ep: "Endpoint: 0" "EP: 0" "EP" "E"
170091-170112 usb_packet: crc5-ok: "CRC5: 0x00" "CRC5" "C"
169979-170124 usb_packet: packet-in: "IN ADDR 55 EP 0"
170134-170167 usb_packet: sync-ok: "SYNC: 00000001" "SYNC" "S"
170167-170200 usb_packet: pid: "PID: NAK" "NAK" "N"
170134-170212 usb_packet: packet-nak: "NAK"
173349-173382 usb_packet: sync-ok: "SYNC: 00000001" "SYNC" "S"
173382-173416 usb_packet: pid: "PID: IN" "IN" "I"
173416-173445 usb_packet: addr: "Address: 55" "Addr: 55" "Addr" "A"
173445-173462 usb_packet: ep: "Endpoint: 0" "EP: 0" "EP" "E"
173462-173482 usb_packet: crc5-ok: "CRC5: 0x00" "CRC5" "C"
173349-173495 usb_packet: packet-in: "IN ADDR 55 EP 0"
173513-173546 usb_packet: sync-ok: "SYNC: 00000001" "SYNC" "S"
173546-173579 usb_packet: pid: "PID: DATA1" "DATA1" "D"
173579-173612 usb_packet: data: "Databyte: 09" "Data: 09" "DB: 09" "09"
173612-173645 usb_packet: data: "Databyte: 02" "Data: 02" "DB: 02" "02"
173645-173679 usb_packet: data: "Databyte: 29" "Data: 29" "DB: 29" "29"
173679-173712 usb_packet: data: "Databyte: 00" "Data: 00" "DB: 00" "00"
173712-173746 usb_packet: data: "Databyte: 01" "Data: 01" "DB: 01" "01"
173746-173779 usb_packet: data: "Databyte: 01" "Data: 01" "DB: 01" "01"
173779-173812 usb_packet: data: "Databyte: 00" "Data: 00" "DB: 00" "00"
173812-173846 usb_packet: data: "Databyte: 80" "Data: 80" "DB: 80" "80"
173846-173879 usb_packet: data: "Databyte: 32" "Data: 32" "DB: 32" "32"
173879-173945 usb_packet: crc16-ok: "CRC16: 0x6D7A" "CRC16" "C"
173513-173958 usb_packet: packet-data1: "DATA1 [ 09 02 29 00 01 01 00 80 32 ]"
173978-174011 usb_packet: sync-ok: "SYNC: 00000001" "SYNC" "S"
174011-174044 usb_packet: pid: "PID: ACK" "ACK" "A"
173978-174056 usb_packet: packet-ack: "ACK"
175071-175104 usb_packet: sync-ok: "SYNC: 00000001" "SYNC" "S"
175104-175137 usb_packet: pid: "PID: OUT" "OUT" "O"
175137-175171 usb_packet: addr: "Address: 55" "Addr: 55" "Addr" "A"
175171-175187 usb_packet: ep: "Endpoint: 0" "EP: 0" "EP" "E"
175187-175208 usb_packet: crc5-ok: "CRC5: 0x00" "CRC5" "C"
175071-175221 usb_packet: packet-out: "OUT ADDR 55 EP 0"
175232-175265 usb_packet: sync-ok: "SYNC: 00000001" "SYNC" "S"
175265-175298 usb_packet: pid: "PID: DATA1" "DATA1" "D"
175298-175365 usb_packet: crc16-ok: "CRC16: 0x0000" "CRC16" "C"
175232-175377 usb_packet: packet-data1: "DATA1 [ ]"
175387-175420 usb_packet: sync-ok: "SYNC: 00000001" "SYNC" "S"
175420-175453 usb_packet: pid: "PID: NAK" "NAK" "N"
175387-175465 usb_packet: packet-nak: "NAK"
177925-177958 usb_packet: sync-ok: "SYNC: 00000001" "SYNC" "S"
177958-177991 usb_packet: pid: "PID: OUT" "OUT" "O"
177991-178024 usb_packet: addr: "Address: 55" "Addr: 55" "Addr" "A"
178024-178041 usb_packet: ep: "Endpoint: 0" "EP: 0" "EP" "E"
178041-178061 usb_packet: crc5-ok: "CRC5: 0x00" "CRC5" "C"
177925-178074 usb_packet: packet-out: "OUT ADDR 55 EP 0"
178086-178119 usb_packet: sync-ok: "SYNC: 00000001" "SYNC" "S"
178119-178152 usb_packet: pid: "PID: DATA1" "DATA1" "D"
178152-178218 usb_packet: crc16-ok: "CRC16: 0x0000" "CRC16" "C"
178086-178230 usb_packet: packet-data1: "DATA1 [ ]"
178240-178273 usb_packet: sync-ok: "SYNC: 00000001" "SYNC" "S"
178273-178306 usb_packet: pid: "PID: NAK" "NAK" "N"
178240-178318 usb_packet: packet-nak: "NAK"
181264-181297 usb_packet: sync-ok: "SYNC: 00000001" "SYNC" "S"
181297-181330 usb_packet: pid: "PID: OUT" "OUT" "O"
181330-181363 usb_packet: addr: "Address: 55" "Addr: 55" "Addr" "A"
181363-181380 usb_packet: ep: "Endpoint: 0" "EP: 0" "EP" "E"
181380-181400 usb_packet: crc5-ok: "CRC5: 0x00" "CRC5" "C"
181264-181413 usb_packet: packet-out: "OUT ADDR 55 EP 0"
181424-181457 usb_packet: sync-ok: "SYNC: 00000001" "SYNC" "S"
181457-181490 usb_packet: pid: "PID: DATA1" "DATA1" "D"
181490-181557 usb_packet: crc16-ok: "CRC16: 0x0000" "CRC16" "C"
181424-181569 usb_packet: packet-data1: "DATA1 [ ]"
181578-181611 usb_packet: sync-ok: "SYNC: 00000001" "SYNC" "S"
181611-181644 usb_packet: pid: "PID: ACK" "ACK" "A"
181578-181657 usb_packet: packet-ack: "ACK"
190633-190666 usb_packet: sync-ok: "SYNC: 00000001" "SYNC" "S"
190666-190700 usb_packet: pid: "PID: SETUP" "SETUP" "S"
190700-190729 usb_packet: addr: "Address: 55" "Addr: 55" "Addr" "A"
190729-190745 usb_packet: ep: "Endpoint: 0" "EP: 0" "EP" "E"
190745-190766 usb_packet: crc5-ok: "CRC5: 0x00" "CRC5" "C"
190633-190779 usb_packet: packet-setup: "SETUP ADDR 55 EP 0"
190790-190823 usb_packet: sync-ok: "SYNC: 00000001" "SYNC" "S"
190823-190856 usb_packet: pid: "PID: DATA0" "DATA0" "D"
190856-190889 usb_packet: data: "Databyte: 80" "Data: 80" "DB: 80" "80"
190889-190923 usb_packet: data: "Databyte: 06" "Data: 06" "DB: 06" "06"
190923-190956 usb_packet: data: "Databyte: 00" "Data: 00" "DB: 00" "00"
190956-190990 usb_packet: data: "Databyte: 02" "Data: 02" "DB: 02" "02"
190990-191023 usb_packet: data: "Databyte: 00" "Data: 00" "DB: 00" "00"
191023-191056 usb_packet: data: "Databyte: 00" "Data: 00" "DB: 00" "00"
191056-191090 usb_packet: data: "Databyte: 29" "Data: 29" "DB: 29" "29"
191090-191123 usb_packet: data: "Databyte: 00" "Data: 00" "DB: 00" "00"
191123-191190 usb_packet: crc16-ok: "CRC16: 0xC4B7" "CRC16" "C"
190790-191202 usb_packet: packet-data0: "DATA0 [ 80 06 00 02 00 00 29 00 ]"
191212-191245 usb_packet: sync-ok: "SYNC: 00000001" "SYNC" "S"
191245-191278 usb_packet: pid: "PID: ACK" "ACK" "A"
191212-191290 usb_packet: packet-ack: "ACK"
192202-192235 usb_packet: sync-ok: "SYNC: 00000001" "SYNC" "S"
192235-192268 usb_packet: pid: "PID: IN" "IN" "I"
192268-192297 usb_packet: addr: "Address: 55" "Addr: 55" "Addr" "A"
192297-192314 usb_packet: ep: "Endpoint: 0" "EP: 0" "EP" "E"
192314-192335 usb_packet: crc5-ok: "CRC5: 0x00" "CRC5" "C"
192202-192347 usb_packet: packet-in: "IN ADDR 55 EP 0"
192356-192389 usb_packet: sync-ok: "SYNC: 00000001" "SYNC" "S"
192389-192423 usb_packet: pid: "PID: NAK" "NAK" "N"
192356-192435 usb_packet: packet-nak: "NAK"
196038-196071 usb_packet: sync-ok: "SYNC: 00000001" "SYNC" "S"
196071-196105 usb_packet: pid: "PID: SOF" "SOF" "S"
196105-196150 usb_packet: framenum: "Frame: 1060" "Frame" "Fr" "F"
196150-196171 usb_packet: crc5-ok: "CRC5: 0x00" "CRC5" "C"
196038-196184 usb_packet: packet-sof: "SOF 1060"
196283-196316 usb_packet: sync-ok: "SYNC: 00000001" "SYNC" "S"
196316-196349 usb_packet: pid: "PID: IN" "IN" "I"
196349-196378 usb_packet: addr: "Address: 55" "Addr: 55" "Addr" "A"
196378-196394 usb_packet: ep: "Endpoint: 0" "EP: 0" "EP" "E"
196394-196415 usb_packet: crc5-ok: "CRC5: 0x00" "CRC5" "C"
196283-196428 usb_packet: packet-in: "IN ADDR 55 EP 0"
196438-196471 usb_packet: sync-ok: "SYNC: 00000001" "SYNC" "S"
196471-196504 usb_packet: pid: "PID: NAK" "NAK" "N"
196438-196516 usb_packet: packet-nak: "NAK"
198298-198331 usb_packet: sync-ok: "SYNC: 00000001" "SYNC" "S"
198331-198364 usb_packet: pid: "PID: IN" "IN" "I"
198364-198394 usb_packet: addr: "Address: 55" "Addr: 55" "Addr" "A"
198394-198410 usb_packet: ep: "Endpoint: 0" "EP: 0" "EP" "E"
198410-198431 usb_packet: crc5-ok: "CRC5: 0x00" "CRC5" "C"
198298-198443 usb_packet: packet-in: "IN ADDR 55 EP 0"
198453-198486 usb_packet: sync-ok: "SYNC: 00000001" "SYNC" "S"
198486-198520 usb_packet: pid: "PID: NAK" "NAK" "N"
198453-198532 usb_packet: packet-nak: "NAK"
201600-201633 usb_packet: sync-ok: "SYNC: 00000001" "SYNC" "S"
201633-201666 usb_packet: pid: "PID: IN" "IN" "I"
201666-201695 usb_packet: addr: "Address: 55" "Addr: 55" "Addr" "A"
201695-201711 usb_packet: ep: "Endpoint: 0" "EP: 0" "EP" "E"
201711-201732 usb_packet: crc5-ok: "CRC5: 0x00" "CRC5" "C"
201600-201745 usb_packet: packet-in: "IN ADDR 55 EP 0"
201754-201787 usb_packet: sync-ok: "SYNC: 00000001" "SYNC" "S"
201787-201821 usb_packet: pid: "PID: STALL" "STALL" "S"
201754-201833 usb_packet: packet-stall: "STALL"
