41493-41559 usb_packet: sync-ok: "SYNC: 00000001" "SYNC" "S"
41559-41625 usb_packet: pid: "PID: SOF" "SOF" "S"
41625-41717 usb_packet: framenum: "Frame: 405" "Frame" "Fr" "F"
41717-41758 usb_packet: crc5-ok: "CRC5: 0x15" "CRC5" "C"
41493-41783 usb_packet: packet-sof: "SOF 405"
141493-141559 usb_packet: sync-ok: "SYNC: 00000001" "SYNC" "S"
141559-141625 usb_packet: pid: "PID: SOF" "SOF" "S"
141625-141716 usb_packet: framenum: "Frame: 406" "Frame" "Fr" "F"
141716-141758 usb_packet: crc5-ok: "CRC5: 0x1D" "CRC5" "C"
141493-141783 usb_packet: packet-sof: "SOF 406"
241492-241558 usb_packet: sync-ok: "SYNC: 00000001" "SYNC" "S"
241558-241624 usb_packet: pid: "PID: SOF" "SOF" "S"
241624-241716 usb_packet: framenum: "Frame: 407" "Frame" "Fr" "F"
241716-241757 usb_packet: crc5-ok: "CRC5: 0x02" "CRC5" "C"
241492-241783 usb_packet: packet-sof: "SOF 407"
245364-245430 usb_packet: sync-ok: "SYNC: 00000001" "SYNC" "S"
245430-245496 usb_packet: pid: "PID: PRE" "PRE" "P"
245364-245496 usb_packet: packet-pre: "PRE"
245599-246132 usb_packet: sync-ok: "SYNC: 00000001" "SYNC" "S"
246132-246665 usb_packet: pid: "PID: IN" "IN" "I"
246665-247131 usb_packet: addr: "Address: 1" "Addr: 1" "Addr" "A"
247131-247399 usb_packet: ep: "Endpoint: 3" "EP: 3" "EP" "E"
247399-247731 usb_packet: crc5-ok: "CRC5: 0x0E" "CRC5" "C"
245599-247932 usb_packet: packet-in: "IN ADDR 1 EP 3"
341492-342025 usb_packet: sync-err: "SYNC ERROR: 00111111" "SYNC ERR: 00111111" "SYNC ERR" "SE" "S"
341492-342092 usb_packet: packet-invalid: "Invalid packet (shorter than 16 bits)"
441492-442025 usb_packet: sync-err: "SYNC ERROR: 00010111" "SYNC ERR: 00010111" "SYNC ERR" "SE" "S"
441492-442292 usb_packet: packet-invalid: "Invalid packet (shorter than 16 bits)"
541491-542027 usb_packet: sync-err: "SYNC ERROR: 00010111" "SYNC ERR: 00010111" "SYNC ERR" "SE" "S"
541491-542295 usb_packet: packet-invalid: "Invalid packet (shorter than 16 bits)"
641491-642026 usb_packet: sync-err: "SYNC ERROR: 00111111" "SYNC ERR: 00111111" "SYNC ERR" "SE" "S"
641491-642093 usb_packet: packet-invalid: "Invalid packet (shorter than 16 bits)"
741491-742025 usb_packet: sync-err: "SYNC ERROR: 00010111" "SYNC ERR: 00010111" "SYNC ERR" "SE" "S"
741491-742292 usb_packet: packet-invalid: "Invalid packet (shorter than 16 bits)"
841491-842024 usb_packet: sync-err: "SYNC ERROR: 00111111" "SYNC ERR: 00111111" "SYNC ERR" "SE" "S"
841491-842091 usb_packet: packet-invalid: "Invalid packet (shorter than 16 bits)"
941490-942025 usb_packet: sync-err: "SYNC ERROR: 00111111" "SYNC ERR: 00111111" "SYNC ERR" "SE" "S"
941490-942092 usb_packet: packet-invalid: "Invalid packet (shorter than 16 bits)"
1041490-1042022 usb_packet: sync-err: "SYNC ERROR: 00010111" "SYNC ERR: 00010111" "SYNC ERR" "SE" "S"
1041490-1042289 usb_packet: packet-invalid: "Invalid packet (shorter than 16 bits)"
1045362-1045896 usb_packet: sync-err: "SYNC ERROR: 01000000" "SYNC ERR: 01000000" "SYNC ERR" "SE" "S"
1045896-1046436 usb_packet: pid: "PID: UNKNOWN" "UNKNOWN" "U"
1045362-1047918 usb_packet: packet-invalid: "UNKNOWN"
1141490-1142022 usb_packet: sync-err: "SYNC ERROR: 00100111" "SYNC ERR: 00100111" "SYNC ERR" "SE" "S"
1141490-1142289 usb_packet: packet-invalid: "Invalid packet (shorter than 16 bits)"
1241489-1242023 usb_packet: sync-err: "SYNC ERROR: 00001111" "SYNC ERR: 00001111" "SYNC ERR" "SE" "S"
1241489-1242223 usb_packet: packet-invalid: "Invalid packet (shorter than 16 bits)"
1341489-1342022 usb_packet: sync-err: "SYNC ERROR: 00001111" "SYNC ERR: 00001111" "SYNC ERR" "SE" "S"
1341489-1342222 usb_packet: packet-invalid: "Invalid packet (shorter than 16 bits)"
1441489-1442021 usb_packet: sync-err: "SYNC ERROR: 00100111" "SYNC ERR: 00100111" "SYNC ERR" "SE" "S"
1441489-1442288 usb_packet: packet-invalid: "Invalid packet (shorter than 16 bits)"
1541489-1542022 usb_packet: sync-err: "SYNC ERROR: 00001111" "SYNC ERR: 00001111" "SYNC ERR" "SE" "S"
1541489-1542222 usb_packet: packet-invalid: "Invalid packet (shorter than 16 bits)"
1641488-1642021 usb_packet: sync-err: "SYNC ERROR: 00000111" "SYNC ERR: 00000111" "SYNC ERR" "SE" "S"
1641488-1642288 usb_packet: packet-invalid: "Invalid packet (shorter than 16 bits)"
1741488-1742021 usb_packet: sync-err: "SYNC ERROR: 00000111" "SYNC ERR: 00000111" "SYNC ERR" "SE" "S"
1741488-1742288 usb_packet: packet-invalid: "Invalid packet (shorter than 16 bits)"
1841488-1842019 usb_packet: sync-err: "SYNC ERROR: 00001111" "SYNC ERR: 00001111" "SYNC ERR" "SE" "S"
1841488-1842219 usb_packet: packet-invalid: "Invalid packet (shorter than 16 bits)"
1845361-1845895 usb_packet: sync-err: "SYNC ERROR: 01000000" "SYNC ERR: 01000000" "SYNC ERR" "SE" "S"
1845895-1846435 usb_packet: pid: "PID: UNKNOWN" "UNKNOWN" "U"
1845361-1847917 usb_packet: packet-invalid: "UNKNOWN"
1941487-1942023 usb_packet: sync-err: "SYNC ERROR: 00010111" "SYNC ERR: 00010111" "SYNC ERR" "SE" "S"
1941487-1942291 usb_packet: packet-invalid: "Invalid packet (shorter than 16 bits)"
2041487-2042022 usb_packet: sync-err: "SYNC ERROR: 00001111" "SYNC ERR: 00001111" "SYNC ERR" "SE" "S"
2041487-2042223 usb_packet: packet-invalid: "Invalid packet (shorter than 16 bits)"
2141487-2142020 usb_packet: sync-err: "SYNC ERROR: 00111111" "SYNC ERR: 00111111" "SYNC ERR" "SE" "S"
2141487-2142087 usb_packet: packet-invalid: "Invalid packet (shorter than 16 bits)"
2241486-2242021 usb_packet: sync-err: "SYNC ERROR: 00010111" "SYNC ERR: 00010111" "SYNC ERR" "SE" "S"
2241486-2242287 usb_packet: packet-invalid: "Invalid packet (shorter than 16 bits)"
2341486-2342021 usb_packet: sync-err: "SYNC ERROR: 00001111" "SYNC ERR: 00001111" "SYNC ERR" "SE" "S"
2341486-2342222 usb_packet: packet-invalid: "Invalid packet (shorter than 16 bits)"
2441486-2442017 usb_packet: sync-err: "SYNC ERROR: 00010111" "SYNC ERR: 00010111" "SYNC ERR" "SE" "S"
2441486-2442284 usb_packet: packet-invalid: "Invalid packet (shorter than 16 bits)"
2541485-2542021 usb_packet: sync-err: "SYNC ERROR: 00010111" "SYNC ERR: 00010111" "SYNC ERR" "SE" "S"
2541485-2542289 usb_packet: packet-invalid: "Invalid packet (shorter than 16 bits)"
2641485-2642020 usb_packet: sync-err: "SYNC ERROR: 00111111" "SYNC ERR: 00111111" "SYNC ERR" "SE" "S"
2641485-2642087 usb_packet: packet-invalid: "Invalid packet (shorter than 16 bits)"
2645357-2645891 usb_packet: sync-err: "SYNC ERROR: 01000000" "SYNC ERR: 01000000" "SYNC ERR" "SE" "S"
2645891-2646431 usb_packet: pid: "PID: UNKNOWN" "UNKNOWN" "U"
2645357-2647913 usb_packet: packet-invalid: "UNKNOWN"
2741485-2742018 usb_packet: sync-err: "SYNC ERROR: 00001111" "SYNC ERR: 00001111" "SYNC ERR" "SE" "S"
2741485-2742218 usb_packet: packet-invalid: "Invalid packet (shorter than 16 bits)"
2841485-2842017 usb_packet: sync-err: "SYNC ERROR: 00100111" "SYNC ERR: 00100111" "SYNC ERR" "SE" "S"
2841485-2842284 usb_packet: packet-invalid: "Invalid packet (shorter than 16 bits)"
2941484-2942016 usb_packet: sync-err: "SYNC ERROR: 00100111" "SYNC ERR: 00100111" "SYNC ERR" "SE" "S"
2941484-2942283 usb_packet: packet-invalid: "Invalid packet (shorter than 16 bits)"
3041484-3042015 usb_packet: sync-err: "SYNC ERROR: 00001111" "SYNC ERR: 00001111" "SYNC ERR" "SE" "S"
3041484-3042215 usb_packet: packet-invalid: "Invalid packet (shorter than 16 bits)"
3141484-3142016 usb_packet: sync-err: "SYNC ERROR: 00100111" "SYNC ERR: 00100111" "SYNC ERR" "SE" "S"
3141484-3142283 usb_packet: packet-invalid: "Invalid packet (shorter than 16 bits)"
3241483-3242017 usb_packet: sync-err: "SYNC ERROR: 00001111" "SYNC ERR: 00001111" "SYNC ERR" "SE" "S"
3241483-3242217 usb_packet: packet-invalid: "Invalid packet (shorter than 16 bits)"
3341483-3342016 usb_packet: sync-err: "SYNC ERROR: 00001111" "SYNC ERR: 00001111" "SYNC ERR" "SE" "S"
3341483-3342216 usb_packet: packet-invalid: "Invalid packet (shorter than 16 bits)"
3441483-3442015 usb_packet: sync-err: "SYNC ERROR: 00100111" "SYNC ERR: 00100111" "SYNC ERR" "SE" "S"
3441483-3442282 usb_packet: packet-invalid: "Invalid packet (shorter than 16 bits)"
3445353-3445887 usb_packet: sync-err: "SYNC ERROR: 01000000" "SYNC ERR: 01000000" "SYNC ERR" "SE" "S"
3445887-3446427 usb_packet: pid: "PID: UNKNOWN" "UNKNOWN" "U"
3445353-3447909 usb_packet: packet-invalid: "UNKNOWN"
3541482-3542017 usb_packet: sync-err: "SYNC ERROR: 00111111" "SYNC ERR: 00111111" "SYNC ERR" "SE" "S"
3541482-3542084 usb_packet: packet-invalid: "Invalid packet (shorter than 16 bits)"
3641482-3642013 usb_packet: sync-err: "SYNC ERROR: 00010111" "SYNC ERR: 00010111" "SYNC ERR" "SE" "S"
3641482-3642280 usb_packet: packet-invalid: "Invalid packet (shorter than 16 bits)"
3741482-3742016 usb_packet: sync-err: "SYNC ERROR: 00010111" "SYNC ERR: 00010111" "SYNC ERR" "SE" "S"
3741482-3742283 usb_packet: packet-invalid: "Invalid packet (shorter than 16 bits)"
3841481-3842016 usb_packet: sync-err: "SYNC ERROR: 00111111" "SYNC ERR: 00111111" "SYNC ERR" "SE" "S"
3841481-3842083 usb_packet: packet-invalid: "Invalid packet (shorter than 16 bits)"
3941481-3942017 usb_packet: sync-err: "SYNC ERROR: 00010111" "SYNC ERR: 00010111" "SYNC ERR" "SE" "S"
3941481-3942285 usb_packet: packet-invalid: "Invalid packet (shorter than 16 bits)"
4041481-4042014 usb_packet: sync-err: "SYNC ERROR: 00111111" "SYNC ERR: 00111111" "SYNC ERR" "SE" "S"
4041481-4042081 usb_packet: packet-invalid: "Invalid packet (shorter than 16 bits)"
4141481-4142014 usb_packet: sync-err: "SYNC ERROR: 00111111" "SYNC ERR: 00111111" "SYNC ERR" "SE" "S"
4141481-4142081 usb_packet: packet-invalid: "Invalid packet (shorter than 16 bits)"
4241480-4242011 usb_packet: sync-err: "SYNC ERROR: 00010111" "SYNC ERR: 00010111" "SYNC ERR" "SE" "S"
4241480-4242278 usb_packet: packet-invalid: "Invalid packet (shorter than 16 bits)"
4245369-4245903 usb_packet: sync-err: "SYNC ERROR: 01000000" "SYNC ERR: 01000000" "SYNC ERR" "SE" "S"
4245903-4246443 usb_packet: pid: "PID: UNKNOWN" "UNKNOWN" "U"
4245369-4247925 usb_packet: packet-invalid: "UNKNOWN"
4255052-4255586 usb_packet: sync-err: "SYNC ERROR: 01000000" "SYNC ERR: 01000000" "SYNC ERR" "SE" "S"
4255586-4256127 usb_packet: pid: "PID: UNKNOWN" "UNKNOWN" "U"
4255052-4256532 usb_packet: packet-invalid: "UNKNOWN"
4341477-4342010 usb_packet: sync-err: "SYNC ERROR: 00111111" "SYNC ERR: 00111111" "SYNC ERR" "SE" "S"
4341477-4342077 usb_packet: packet-invalid: "Invalid packet (shorter than 16 bits)"
4441480-4442012 usb_packet: sync-err: "SYNC ERROR: 00010111" "SYNC ERR: 00010111" "SYNC ERR" "SE" "S"
4441480-4442279 usb_packet: packet-invalid: "Invalid packet (shorter than 16 bits)"
4541479-4542015 usb_packet: sync-err: "SYNC ERROR: 00010111" "SYNC ERR: 00010111" "SYNC ERR" "SE" "S"
4541479-4542283 usb_packet: packet-invalid: "Invalid packet (shorter than 16 bits)"
4641479-4642014 usb_packet: sync-err: "SYNC ERROR: 00001111" "SYNC ERR: 00001111" "SYNC ERR" "SE" "S"
4641479-4642215 usb_packet: packet-invalid: "Invalid packet (shorter than 16 bits)"
4741479-4742013 usb_packet: sync-err: "SYNC ERROR: 00010111" "SYNC ERR: 00010111" "SYNC ERR" "SE" "S"
4741479-4742280 usb_packet: packet-invalid: "Invalid packet (shorter than 16 bits)"
4841479-4842012 usb_packet: sync-err: "SYNC ERROR: 00111111" "SYNC ERR: 00111111" "SYNC ERR" "SE" "S"
4841479-4842079 usb_packet: packet-invalid: "Invalid packet (shorter than 16 bits)"
4941478-4942013 usb_packet: sync-err: "SYNC ERROR: 00001111" "SYNC ERR: 00001111" "SYNC ERR" "SE" "S"
4941478-4942214 usb_packet: packet-invalid: "Invalid packet (shorter than 16 bits)"
5041478-5042009 usb_packet: sync-err: "SYNC ERROR: 00010111" "SYNC ERR: 00010111" "SYNC ERR" "SE" "S"
5041478-5042276 usb_packet: packet-invalid: "Invalid packet (shorter than 16 bits)"
5045359-5045896 usb_packet: sync-err: "SYNC ERROR: 00000100" "SYNC ERR: 00000100" "SYNC ERR" "SE" "S"
5045896-5046436 usb_packet: pid: "PID: UNKNOWN" "UNKNOWN" "U"
5045359-5047933 usb_packet: packet-invalid: "UNKNOWN"
5055048-5055582 usb_packet: sync-err: "SYNC ERROR: 01000000" "SYNC ERR: 01000000" "SYNC ERR" "SE" "S"
5055582-5056123 usb_packet: pid: "PID: UNKNOWN" "UNKNOWN" "U"
5055048-5056528 usb_packet: packet-invalid: "UNKNOWN"
5141473-5142006 usb_packet: sync-err: "SYNC ERROR: 00001111" "SYNC ERR: 00001111" "SYNC ERR" "SE" "S"
5141473-5142206 usb_packet: packet-invalid: "Invalid packet (shorter than 16 bits)"
5241477-5242010 usb_packet: sync-err: "SYNC ERROR: 00000111" "SYNC ERR: 00000111" "SYNC ERR" "SE" "S"
5241477-5242277 usb_packet: packet-invalid: "Invalid packet (shorter than 16 bits)"
5341477-5342009 usb_packet: sync-err: "SYNC ERROR: 00100111" "SYNC ERR: 00100111" "SYNC ERR" "SE" "S"
5341477-5342276 usb_packet: packet-invalid: "Invalid packet (shorter than 16 bits)"
5441477-5442008 usb_packet: sync-err: "SYNC ERROR: 00001111" "SYNC ERR: 00001111" "SYNC ERR" "SE" "S"
5441477-5442208 usb_packet: packet-invalid: "Invalid packet (shorter than 16 bits)"
5541476-5542011 usb_packet: sync-err: "SYNC ERROR: 00100111" "SYNC ERR: 00100111" "SYNC ERR" "SE" "S"
5541476-5542278 usb_packet: packet-invalid: "Invalid packet (shorter than 16 bits)"
5641476-5642009 usb_packet: sync-err: "SYNC ERROR: 00001111" "SYNC ERR: 00001111" "SYNC ERR" "SE" "S"
5641476-5642209 usb_packet: packet-invalid: "Invalid packet (shorter than 16 bits)"
5741476-5742009 usb_packet: sync-err: "SYNC ERROR: 00001111" "SYNC ERR: 00001111" "SYNC ERR" "SE" "S"
5741476-5742209 usb_packet: packet-invalid: "Invalid packet (shorter than 16 bits)"
5841475-5842010 usb_packet: sync-err: "SYNC ERROR: 00100111" "SYNC ERR: 00100111" "SYNC ERR" "SE" "S"
5841475-5842277 usb_packet: packet-invalid: "Invalid packet (shorter than 16 bits)"
5845352-5845881 usb_packet: sync-err: "SYNC ERROR: 01010000" "SYNC ERR: 01010000" "SYNC ERR" "SE" "S"
5845881-5846406 usb_packet: pid: "PID: UNKNOWN" "UNKNOWN" "U"
5845352-5847909 usb_packet: packet-invalid: "UNKNOWN"
5854984-5855518 usb_packet: sync-err: "SYNC ERROR: 01000000" "SYNC ERR: 01000000" "SYNC ERR" "SE" "S"
5855518-5856059 usb_packet: pid: "PID: UNKNOWN" "UNKNOWN" "U"
5854984-5856464 usb_packet: packet-invalid: "UNKNOWN"
5941475-5942011 usb_packet: sync-err: "SYNC ERROR: 00010111" "SYNC ERR: 00010111" "SYNC ERR" "SE" "S"
5941475-5942279 usb_packet: packet-invalid: "Invalid packet (shorter than 16 bits)"
6041475-6042008 usb_packet: sync-err: "SYNC ERROR: 00111111" "SYNC ERR: 00111111" "SYNC ERR" "SE" "S"
6041475-6042075 usb_packet: packet-invalid: "Invalid packet (shorter than 16 bits)"
6141474-6142009 usb_packet: sync-err: "SYNC ERROR: 00111111" "SYNC ERR: 00111111" "SYNC ERR" "SE" "S"
6141474-6142076 usb_packet: packet-invalid: "Invalid packet (shorter than 16 bits)"
6241474-6242009 usb_packet: sync-err: "SYNC ERROR: 00010111" "SYNC ERR: 00010111" "SYNC ERR" "SE" "S"
6241474-6242275 usb_packet: packet-invalid: "Invalid packet (shorter than 16 bits)"
6341474-6342007 usb_packet: sync-err: "SYNC ERROR: 00111111" "SYNC ERR: 00111111" "SYNC ERR" "SE" "S"
6341474-6342074 usb_packet: packet-invalid: "Invalid packet (shorter than 16 bits)"
6441473-6442008 usb_packet: sync-err: "SYNC ERROR: 00010111" "SYNC ERR: 00010111" "SYNC ERR" "SE" "S"
6441473-6442274 usb_packet: packet-invalid: "Invalid packet (shorter than 16 bits)"
6541473-6542007 usb_packet: sync-err: "SYNC ERROR: 00010111" "SYNC ERR: 00010111" "SYNC ERR" "SE" "S"
6541473-6542274 usb_packet: packet-invalid: "Invalid packet (shorter than 16 bits)"
6641473-6642006 usb_packet: sync-err: "SYNC ERROR: 00111111" "SYNC ERR: 00111111" "SYNC ERR" "SE" "S"
6641473-6642073 usb_packet: packet-invalid: "Invalid packet (shorter than 16 bits)"
6645353-6645882 usb_packet: sync-err: "SYNC ERROR: 01010000" "SYNC ERR: 01010000" "SYNC ERR" "SE" "S"
6645882-6646407 usb_packet: pid: "PID: UNKNOWN" "UNKNOWN" "U"
6645353-6647910 usb_packet: packet-invalid: "UNKNOWN"
6654954-6655492 usb_packet: sync-err: "SYNC ERROR: 00000000" "SYNC ERR: 00000000" "SYNC ERR" "SE" "S"
6655492-6656033 usb_packet: pid: "PID: UNKNOWN" "UNKNOWN" "U"
6654954-6656440 usb_packet: packet-invalid: "UNKNOWN"
6741471-6742003 usb_packet: sync-err: "SYNC ERROR: 00100111" "SYNC ERR: 00100111" "SYNC ERR" "SE" "S"
6741471-6742270 usb_packet: packet-invalid: "Invalid packet (shorter than 16 bits)"
6841472-6842006 usb_packet: sync-err: "SYNC ERROR: 00001111" "SYNC ERR: 00001111" "SYNC ERR" "SE" "S"
6841472-6842206 usb_packet: packet-invalid: "Invalid packet (shorter than 16 bits)"
6941472-6942005 usb_packet: sync-err: "SYNC ERROR: 00001111" "SYNC ERR: 00001111" "SYNC ERR" "SE" "S"
6941472-6942205 usb_packet: packet-invalid: "Invalid packet (shorter than 16 bits)"
7041472-7042004 usb_packet: sync-err: "SYNC ERROR: 00100111" "SYNC ERR: 00100111" "SYNC ERR" "SE" "S"
7041472-7042271 usb_packet: packet-invalid: "Invalid packet (shorter than 16 bits)"
7141471-7142007 usb_packet: sync-err: "SYNC ERROR: 00001111" "SYNC ERR: 00001111" "SYNC ERR" "SE" "S"
7141471-7142207 usb_packet: packet-invalid: "Invalid packet (shorter than 16 bits)"
7241471-7242003 usb_packet: sync-err: "SYNC ERROR: 00100111" "SYNC ERR: 00100111" "SYNC ERR" "SE" "S"
7241471-7242270 usb_packet: packet-invalid: "Invalid packet (shorter than 16 bits)"
7341471-7342003 usb_packet: sync-err: "SYNC ERROR: 00100111" "SYNC ERR: 00100111" "SYNC ERR" "SE" "S"
7341471-7342270 usb_packet: packet-invalid: "Invalid packet (shorter than 16 bits)"
7441470-7442005 usb_packet: sync-err: "SYNC ERROR: 00010111" "SYNC ERR: 00010111" "SYNC ERR" "SE" "S"
7441470-7442273 usb_packet: packet-invalid: "Invalid packet (shorter than 16 bits)"
7445257-7445786 usb_packet: sync-err: "SYNC ERROR: 01010000" "SYNC ERR: 01010000" "SYNC ERR" "SE" "S"
7445786-7446311 usb_packet: pid: "PID: UNKNOWN" "UNKNOWN" "U"
7445257-7447814 usb_packet: packet-invalid: "UNKNOWN"
7454904-7455438 usb_packet: sync-err: "SYNC ERROR: 01000000" "SYNC ERR: 01000000" "SYNC ERR" "SE" "S"
7455438-7455979 usb_packet: pid: "PID: UNKNOWN" "UNKNOWN" "U"
7454904-7456384 usb_packet: packet-invalid: "UNKNOWN"
7541470-7542005 usb_packet: sync-err: "SYNC ERROR: 00111111" "SYNC ERR: 00111111" "SYNC ERR" "SE" "S"
7541470-7542072 usb_packet: packet-invalid: "Invalid packet (shorter than 16 bits)"
7641470-7642003 usb_packet: sync-err: "SYNC ERROR: 00000111" "SYNC ERR: 00000111" "SYNC ERR" "SE" "S"
7641470-7642270 usb_packet: packet-invalid: "Invalid packet (shorter than 16 bits)"
7741469-7742005 usb_packet: sync-err: "SYNC ERROR: 00010111" "SYNC ERR: 00010111" "SYNC ERR" "SE" "S"
7741469-7742273 usb_packet: packet-invalid: "Invalid packet (shorter than 16 bits)"
7841469-7842004 usb_packet: sync-err: "SYNC ERROR: 00111111" "SYNC ERR: 00111111" "SYNC ERR" "SE" "S"
7841469-7842071 usb_packet: packet-invalid: "Invalid packet (shorter than 16 bits)"
7941469-7942003 usb_packet: sync-err: "SYNC ERROR: 00010111" "SYNC ERR: 00010111" "SYNC ERR" "SE" "S"
7941469-7942270 usb_packet: packet-invalid: "Invalid packet (shorter than 16 bits)"
8041469-8042002 usb_packet: sync-err: "SYNC ERROR: 00111111" "SYNC ERR: 00111111" "SYNC ERR" "SE" "S"
8041469-8042069 usb_packet: packet-invalid: "Invalid packet (shorter than 16 bits)"
8141468-8142003 usb_packet: sync-err: "SYNC ERROR: 00111111" "SYNC ERR: 00111111" "SYNC ERR" "SE" "S"
8141468-8142070 usb_packet: packet-invalid: "Invalid packet (shorter than 16 bits)"
8241468-8242001 usb_packet: sync-err: "SYNC ERROR: 00000111" "SYNC ERR: 00000111" "SYNC ERR" "SE" "S"
8241468-8242268 usb_packet: packet-invalid: "Invalid packet (shorter than 16 bits)"
8245268-8245797 usb_packet: sync-err: "SYNC ERROR: 01010000" "SYNC ERR: 01010000" "SYNC ERR" "SE" "S"
8245797-8246322 usb_packet: pid: "PID: UNKNOWN" "UNKNOWN" "U"
8245268-8247825 usb_packet: packet-invalid: "UNKNOWN"
8254920-8255454 usb_packet: sync-err: "SYNC ERROR: 01000000" "SYNC ERR: 01000000" "SYNC ERR" "SE" "S"
8255454-8255995 usb_packet: pid: "PID: UNKNOWN" "UNKNOWN" "U"
8254920-8256400 usb_packet: packet-invalid: "UNKNOWN"
8341469-8342006 usb_packet: sync-err: "SYNC ERROR: 00001111" "SYNC ERR: 00001111" "SYNC ERR" "SE" "S"
8341469-8342207 usb_packet: packet-invalid: "Invalid packet (shorter than 16 bits)"
