41493-41559 usb_packet: sync-ok: "SYNC: 00000001" "SYNC" "S"
41559-41625 usb_packet: pid: "PID: SOF" "SOF" "S"
41625-41717 usb_packet: framenum: "Frame: 405" "Frame" "Fr" "F"
41717-41758 usb_packet: crc5-ok: "CRC5: 0x15" "CRC5" "C"
41493-41783 usb_packet: packet-sof: "SOF 405"
141493-141559 usb_packet: sync-ok: "SYNC: 00000001" "SYNC" "S"
141559-141625 usb_packet: pid: "PID: SOF" "SOF" "S"
141625-141716 usb_packet: framenum: "Frame: 406" "Frame" "Fr" "F"
141716-141758 usb_packet: crc5-ok: "CRC5: 0x1D" "CRC5" "C"
141493-141783 usb_packet: packet-sof: "SOF 406"
241492-241558 usb_packet: sync-ok: "SYNC: 00000001" "SYNC" "S"
241558-241624 usb_packet: pid: "PID: SOF" "SOF" "S"
241624-241716 usb_packet: framenum: "Frame: 407" "Frame" "Fr" "F"
241716-241757 usb_packet: crc5-ok: "CRC5: 0x02" "CRC5" "C"
241492-241783 usb_packet: packet-sof: "SOF 407"
245364-245430 usb_packet: sync-ok: "SYNC: 00000001" "SYNC" "S"
245430-245496 usb_packet: pid: "PID: PRE" "PRE" "P"
245364-245496 usb_packet: packet-pre: "PRE"
245599-246132 usb_packet: sync-ok: "SYNC: 00000001" "SYNC" "S"
246132-246665 usb_packet: pid: "PID: IN" "IN" "I"
246665-247131 usb_packet: addr: "Address: 1" "Addr: 1" "Addr" "A"
247131-247399 usb_packet: ep: "Endpoint: 3" "EP: 3" "EP" "E"
247399-247731 usb_packet: crc5-ok: "CRC5: 0x0E" "CRC5" "C"
245599-247932 usb_packet: packet-in: "IN ADDR 1 EP 3"
341492-341558 usb_packet: sync-ok: "SYNC: 00000001" "SYNC" "S"
341558-341624 usb_packet: pid: "PID: SOF" "SOF" "S"
341624-341716 usb_packet: framenum: "Frame: 408" "Frame" "Fr" "F"
341716-341757 usb_packet: crc5-ok: "CRC5: 0x03" "CRC5" "C"
341492-341782 usb_packet: packet-sof: "SOF 408"
441492-441558 usb_packet: sync-ok: "SYNC: 00000001" "SYNC" "S"
441558-441624 usb_packet: pid: "PID: SOF" "SOF" "S"
441624-441715 usb_packet: framenum: "Frame: 409" "Frame" "Fr" "F"
441715-441757 usb_packet: crc5-ok: "CRC5: 0x1C" "CRC5" "C"
441492-441782 usb_packet: packet-sof: "SOF 409"
541491-541557 usb_packet: sync-ok: "SYNC: 00000001" "SYNC" "S"
541557-541623 usb_packet: pid: "PID: SOF" "SOF" "S"
541623-541715 usb_packet: framenum: "Frame: 410" "Frame" "Fr" "F"
541715-541757 usb_packet: crc5-ok: "CRC5: 0x14" "CRC5" "C"
541491-541782 usb_packet: packet-sof: "SOF 410"
641491-641557 usb_packet: sync-ok: "SYNC: 00000001" "SYNC" "S"
641557-641623 usb_packet: pid: "PID: SOF" "SOF" "S"
641623-641715 usb_packet: framenum: "Frame: 411" "Frame" "Fr" "F"
641715-641756 usb_packet: crc5-ok: "CRC5: 0x0B" "CRC5" "C"
641491-641781 usb_packet: packet-sof: "SOF 411"
741491-741557 usb_packet: sync-ok: "SYNC: 00000001" "SYNC" "S"
741557-741623 usb_packet: pid: "PID: SOF" "SOF" "S"
741623-741715 usb_packet: framenum: "Frame: 412" "Frame" "Fr" "F"
741715-741756 usb_packet: crc5-ok: "CRC5: 0x04" "CRC5" "C"
741491-741781 usb_packet: packet-sof: "SOF 412"
841491-841557 usb_packet: sync-ok: "SYNC: 00000001" "SYNC" "S"
841557-841623 usb_packet: pid: "PID: SOF" "SOF" "S"
841623-841714 usb_packet: framenum: "Frame: 413" "Frame" "Fr" "F"
841714-841755 usb_packet: crc5-ok: "CRC5: 0x1B" "CRC5" "C"
841491-841780 usb_packet: packet-sof: "SOF 413"
941490-941556 usb_packet: sync-ok: "SYNC: 00000001" "SYNC" "S"
941556-941622 usb_packet: pid: "PID: SOF" "SOF" "S"
941622-941714 usb_packet: framenum: "Frame: 414" "Frame" "Fr" "F"
941714-941755 usb_packet: crc5-ok: "CRC5: 0x13" "CRC5" "C"
941490-941781 usb_packet: packet-sof: "SOF 414"
1041490-1041556 usb_packet: sync-ok: "SYNC: 00000001" "SYNC" "S"
1041556-1041622 usb_packet: pid: "PID: SOF" "SOF" "S"
1041622-1041722 usb_packet: framenum: "Frame: 415" "Frame" "Fr" "F"
1041722-1041763 usb_packet: crc5-ok: "CRC5: 0x0C" "CRC5" "C"
1041490-1041789 usb_packet: packet-sof: "SOF 415"
1045362-1045428 usb_packet: sync-ok: "SYNC: 00000001" "SYNC" "S"
1045428-1045494 usb_packet: pid: "PID: PRE" "PRE" "P"
1045362-1045494 usb_packet: packet-pre: "PRE"
1045578-1046110 usb_packet: sync-ok: "SYNC: 00000001" "SYNC" "S"
1046110-1046644 usb_packet: pid: "PID: IN" "IN" "I"
1046644-1047111 usb_packet: addr: "Address: 1" "Addr: 1" "Addr" "A"
1047111-1047377 usb_packet: ep: "Endpoint: 3" "EP: 3" "EP" "E"
1047377-1047711 usb_packet: crc5-ok: "CRC5: 0x0E" "CRC5" "C"
1045578-1047911 usb_packet: packet-in: "IN ADDR 1 EP 3"
1141490-1141556 usb_packet: sync-ok: "SYNC: 00000001" "SYNC" "S"
1141556-1141622 usb_packet: pid: "PID: SOF" "SOF" "S"
1141622-1141713 usb_packet: framenum: "Frame: 416" "Frame" "Fr" "F"
1141713-1141755 usb_packet: crc5-ok: "CRC5: 0x00" "CRC5" "C"
1141490-1141780 usb_packet: packet-sof: "SOF 416"
1241489-1241555 usb_packet: sync-ok: "SYNC: 00000001" "SYNC" "S"
1241555-1241621 usb_packet: pid: "PID: SOF" "SOF" "S"
1241621-1241713 usb_packet: framenum: "Frame: 417" "Frame" "Fr" "F"
1241713-1241754 usb_packet: crc5-ok: "CRC5: 0x1F" "CRC5" "C"
1241489-1241779 usb_packet: packet-sof: "SOF 417"
1341489-1341555 usb_packet: sync-ok: "SYNC: 00000001" "SYNC" "S"
1341555-1341621 usb_packet: pid: "PID: SOF" "SOF" "S"
1341621-1341713 usb_packet: framenum: "Frame: 418" "Frame" "Fr" "F"
1341713-1341754 usb_packet: crc5-ok: "CRC5: 0x17" "CRC5" "C"
1341489-1341779 usb_packet: packet-sof: "SOF 418"
1441489-1441555 usb_packet: sync-ok: "SYNC: 00000001" "SYNC" "S"
1441555-1441621 usb_packet: pid: "PID: SOF" "SOF" "S"
1441621-1441712 usb_packet: framenum: "Frame: 419" "Frame" "Fr" "F"
1441712-1441754 usb_packet: crc5-ok: "CRC5: 0x08" "CRC5" "C"
1441489-1441779 usb_packet: packet-sof: "SOF 419"
1541489-1541555 usb_packet: sync-ok: "SYNC: 00000001" "SYNC" "S"
1541555-1541621 usb_packet: pid: "PID: SOF" "SOF" "S"
1541621-1541712 usb_packet: framenum: "Frame: 420" "Frame" "Fr" "F"
1541712-1541753 usb_packet: crc5-ok: "CRC5: 0x07" "CRC5" "C"
1541489-1541778 usb_packet: packet-sof: "SOF 420"
1641488-1641554 usb_packet: sync-ok: "SYNC: 00000001" "SYNC" "S"
1641554-1641620 usb_packet: pid: "PID: SOF" "SOF" "S"
1641620-1641712 usb_packet: framenum: "Frame: 421" "Frame" "Fr" "F"
1641712-1641753 usb_packet: crc5-ok: "CRC5: 0x18" "CRC5" "C"
1641488-1641778 usb_packet: packet-sof: "SOF 421"
1741488-1741554 usb_packet: sync-ok: "SYNC: 00000001" "SYNC" "S"
1741554-1741620 usb_packet: pid: "PID: SOF" "SOF" "S"
1741620-1741712 usb_packet: framenum: "Frame: 422" "Frame" "Fr" "F"
1741712-1741753 usb_packet: crc5-ok: "CRC5: 0x10" "CRC5" "C"
1741488-1741778 usb_packet: packet-sof: "SOF 422"
1841488-1841554 usb_packet: sync-ok: "SYNC: 00000001" "SYNC" "S"
1841554-1841620 usb_packet: pid: "PID: SOF" "SOF" "S"
1841620-1841711 usb_packet: framenum: "Frame: 423" "Frame" "Fr" "F"
1841711-1841752 usb_packet: crc5-ok: "CRC5: 0x0F" "CRC5" "C"
1841488-1841777 usb_packet: packet-sof: "SOF 423"
1845361-1845427 usb_packet: sync-ok: "SYNC: 00000001" "SYNC" "S"
1845427-1845493 usb_packet: pid: "PID: PRE" "PRE" "P"
1845361-1845493 usb_packet: packet-pre: "PRE"
1845578-1846111 usb_packet: sync-ok: "SYNC: 00000001" "SYNC" "S"
1846111-1846643 usb_packet: pid: "PID: IN" "IN" "I"
1846643-1847109 usb_packet: addr: "Address: 1" "Addr: 1" "Addr" "A"
1847109-1847376 usb_packet: ep: "Endpoint: 3" "EP: 3" "EP" "E"
1847376-1847710 usb_packet: crc5-ok: "CRC5: 0x0E" "CRC5" "C"
1845578-1847910 usb_packet: packet-in: "IN ADDR 1 EP 3"
1941487-1941553 usb_packet: sync-ok: "SYNC: 00000001" "SYNC" "S"
1941553-1941619 usb_packet: pid: "PID: SOF" "SOF" "S"
1941619-1941711 usb_packet: framenum: "Frame: 424" "Frame" "Fr" "F"
1941711-1941752 usb_packet: crc5-ok: "CRC5: 0x0E" "CRC5" "C"
1941487-1941777 usb_packet: packet-sof: "SOF 424"
2041487-2041553 usb_packet: sync-ok: "SYNC: 00000001" "SYNC" "S"
2041553-2041619 usb_packet: pid: "PID: SOF" "SOF" "S"
2041619-2041711 usb_packet: framenum: "Frame: 425" "Frame" "Fr" "F"
2041711-2041752 usb_packet: crc5-ok: "CRC5: 0x11" "CRC5" "C"
2041487-2041777 usb_packet: packet-sof: "SOF 425"
2141487-2141553 usb_packet: sync-ok: "SYNC: 00000001" "SYNC" "S"
2141553-2141619 usb_packet: pid: "PID: SOF" "SOF" "S"
2141619-2141710 usb_packet: framenum: "Frame: 426" "Frame" "Fr" "F"
2141710-2141752 usb_packet: crc5-ok: "CRC5: 0x19" "CRC5" "C"
2141487-2141776 usb_packet: packet-sof: "SOF 426"
2241486-2241552 usb_packet: sync-ok: "SYNC: 00000001" "SYNC" "S"
2241552-2241618 usb_packet: pid: "PID: SOF" "SOF" "S"
2241618-2241710 usb_packet: framenum: "Frame: 427" "Frame" "Fr" "F"
2241710-2241751 usb_packet: crc5-ok: "CRC5: 0x06" "CRC5" "C"
2241486-2241777 usb_packet: packet-sof: "SOF 427"
2341486-2341552 usb_packet: sync-ok: "SYNC: 00000001" "SYNC" "S"
2341552-2341618 usb_packet: pid: "PID: SOF" "SOF" "S"
2341618-2341710 usb_packet: framenum: "Frame: 428" "Frame" "Fr" "F"
2341710-2341751 usb_packet: crc5-ok: "CRC5: 0x09" "CRC5" "C"
2341486-2341776 usb_packet: packet-sof: "SOF 428"
2441486-2441552 usb_packet: sync-ok: "SYNC: 00000001" "SYNC" "S"
2441552-2441618 usb_packet: pid: "PID: SOF" "SOF" "S"
2441618-2441709 usb_packet: framenum: "Frame: 429" "Frame" "Fr" "F"
2441709-2441751 usb_packet: crc5-ok: "CRC5: 0x16" "CRC5" "C"
2441486-2441775 usb_packet: packet-sof: "SOF 429"
2541485-2541551 usb_packet: sync-ok: "SYNC: 00000001" "SYNC" "S"
2541551-2541617 usb_packet: pid: "PID: SOF" "SOF" "S"
2541617-2541709 usb_packet: framenum: "Frame: 430" "Frame" "Fr" "F"
2541709-2541750 usb_packet: crc5-ok: "CRC5: 0x1E" "CRC5" "C"
2541485-2541775 usb_packet: packet-sof: "SOF 430"
2641485-2641551 usb_packet: sync-ok: "SYNC: 00000001" "SYNC" "S"
2641551-2641617 usb_packet: pid: "PID: SOF" "SOF" "S"
2641617-2641709 usb_packet: framenum: "Frame: 431" "Frame" "Fr" "F"
2641709-2641750 usb_packet: crc5-ok: "CRC5: 0x01" "CRC5" "C"
2641485-2641775 usb_packet: packet-sof: "SOF 431"
2645357-2645423 usb_packet: sync-ok: "SYNC: 00000001" "SYNC" "S"
2645423-2645489 usb_packet: pid: "PID: PRE" "PRE" "P"
2645357-2645489 usb_packet: packet-pre: "PRE"
2645573-2646105 usb_packet: sync-ok: "SYNC: 00000001" "SYNC" "S"
2646105-2646639 usb_packet: pid: "PID: IN" "IN" "I"
2646639-2647106 usb_packet: addr: "Address: 1" "Addr: 1" "Addr" "A"
2647106-2647372 usb_packet: ep: "Endpoint: 3" "EP: 3" "EP" "E"
2647372-2647706 usb_packet: crc5-ok: "CRC5: 0x0E" "CRC5" "C"
2645573-2647906 usb_packet: packet-in: "IN ADDR 1 EP 3"
2741485-2741551 usb_packet: sync-ok: "SYNC: 00000001" "SYNC" "S"
2741551-2741617 usb_packet: pid: "PID: SOF" "SOF" "S"
2741617-2741708 usb_packet: framenum: "Frame: 432" "Frame" "Fr" "F"
2741708-2741750 usb_packet: crc5-ok: "CRC5: 0x1C" "CRC5" "C"
2741485-2741775 usb_packet: packet-sof: "SOF 432"
2841485-2841551 usb_packet: sync-ok: "SYNC: 00000001" "SYNC" "S"
2841551-2841617 usb_packet: pid: "PID: SOF" "SOF" "S"
2841617-2841708 usb_packet: framenum: "Frame: 433" "Frame" "Fr" "F"
2841708-2841750 usb_packet: crc5-ok: "CRC5: 0x03" "CRC5" "C"
2841485-2841775 usb_packet: packet-sof: "SOF 433"
2941484-2941550 usb_packet: sync-ok: "SYNC: 00000001" "SYNC" "S"
2941550-2941616 usb_packet: pid: "PID: SOF" "SOF" "S"
2941616-2941708 usb_packet: framenum: "Frame: 434" "Frame" "Fr" "F"
2941708-2941749 usb_packet: crc5-ok: "CRC5: 0x0B" "CRC5" "C"
2941484-2941774 usb_packet: packet-sof: "SOF 434"
3041484-3041550 usb_packet: sync-ok: "SYNC: 00000001" "SYNC" "S"
3041550-3041616 usb_packet: pid: "PID: SOF" "SOF" "S"
3041616-3041708 usb_packet: framenum: "Frame: 435" "Frame" "Fr" "F"
3041708-3041749 usb_packet: crc5-ok: "CRC5: 0x14" "CRC5" "C"
3041484-3041774 usb_packet: packet-sof: "SOF 435"
3141484-3141550 usb_packet: sync-ok: "SYNC: 00000001" "SYNC" "S"
3141550-3141616 usb_packet: pid: "PID: SOF" "SOF" "S"
3141616-3141707 usb_packet: framenum: "Frame: 436" "Frame" "Fr" "F"
3141707-3141748 usb_packet: crc5-ok: "CRC5: 0x1B" "CRC5" "C"
3141484-3141773 usb_packet: packet-sof: "SOF 436"
3241483-3241549 usb_packet: sync-ok: "SYNC: 00000001" "SYNC" "S"
3241549-3241615 usb_packet: pid: "PID: SOF" "SOF" "S"
3241615-3241707 usb_packet: framenum: "Frame: 437" "Frame" "Fr" "F"
3241707-3241748 usb_packet: crc5-ok: "CRC5: 0x04" "CRC5" "C"
3241483-3241773 usb_packet: packet-sof: "SOF 437"
3341483-3341549 usb_packet: sync-ok: "SYNC: 00000001" "SYNC" "S"
3341549-3341615 usb_packet: pid: "PID: SOF" "SOF" "S"
3341615-3341707 usb_packet: framenum: "Frame: 438" "Frame" "Fr" "F"
3341707-3341748 usb_packet: crc5-ok: "CRC5: 0x0C" "CRC5" "C"
3341483-3341773 usb_packet: packet-sof: "SOF 438"
3441483-3441549 usb_packet: sync-ok: "SYNC: 00000001" "SYNC" "S"
3441549-3441615 usb_packet: pid: "PID: SOF" "SOF" "S"
3441615-3441706 usb_packet: framenum: "Frame: 439" "Frame" "Fr" "F"
3441706-3441748 usb_packet: crc5-ok: "CRC5: 0x13" "CRC5" "C"
3441483-3441772 usb_packet: packet-sof: "SOF 439"
3445353-3445419 usb_packet: sync-ok: "SYNC: 00000001" "SYNC" "S"
3445419-3445485 usb_packet: pid: "PID: PRE" "PRE" "P"
3445353-3445485 usb_packet: packet-pre: "PRE"
3445569-3446101 usb_packet: sync-ok: "SYNC: 00000001" "SYNC" "S"
3446101-3446635 usb_packet: pid: "PID: IN" "IN" "I"
3446635-3447102 usb_packet: addr: "Address: 1" "Addr: 1" "Addr" "A"
3447102-3447368 usb_packet: ep: "Endpoint: 3" "EP: 3" "EP" "E"
3447368-3447702 usb_packet: crc5-ok: "CRC5: 0x0E" "CRC5" "C"
3445569-3447902 usb_packet: packet-in: "IN ADDR 1 EP 3"
3541482-3541548 usb_packet: sync-ok: "SYNC: 00000001" "SYNC" "S"
3541548-3541614 usb_packet: pid: "PID: SOF" "SOF" "S"
3541614-3541706 usb_packet: framenum: "Frame: 440" "Frame" "Fr" "F"
3541706-3541747 usb_packet: crc5-ok: "CRC5: 0x12" "CRC5" "C"
3541482-3541772 usb_packet: packet-sof: "SOF 440"
3641482-3641548 usb_packet: sync-ok: "SYNC: 00000001" "SYNC" "S"
3641548-3641614 usb_packet: pid: "PID: SOF" "SOF" "S"
3641614-3641706 usb_packet: framenum: "Frame: 441" "Frame" "Fr" "F"
3641706-3641747 usb_packet: crc5-ok: "CRC5: 0x0D" "CRC5" "C"
3641482-3641772 usb_packet: packet-sof: "SOF 441"
3741482-3741548 usb_packet: sync-ok: "SYNC: 00000001" "SYNC" "S"
3741548-3741614 usb_packet: pid: "PID: SOF" "SOF" "S"
3741614-3741705 usb_packet: framenum: "Frame: 442" "Frame" "Fr" "F"
3741705-3741747 usb_packet: crc5-ok: "CRC5: 0x05" "CRC5" "C"
3741482-3741772 usb_packet: packet-sof: "SOF 442"
3841481-3841547 usb_packet: sync-ok: "SYNC: 00000001" "SYNC" "S"
3841547-3841613 usb_packet: pid: "PID: SOF" "SOF" "S"
3841613-3841705 usb_packet: framenum: "Frame: 443" "Frame" "Fr" "F"
3841705-3841746 usb_packet: crc5-ok: "CRC5: 0x1A" "CRC5" "C"
3841481-3841771 usb_packet: packet-sof: "SOF 443"
3941481-3941547 usb_packet: sync-ok: "SYNC: 00000001" "SYNC" "S"
3941547-3941613 usb_packet: pid: "PID: SOF" "SOF" "S"
3941613-3941705 usb_packet: framenum: "Frame: 444" "Frame" "Fr" "F"
3941705-3941746 usb_packet: crc5-ok: "CRC5: 0x15" "CRC5" "C"
3941481-3941771 usb_packet: packet-sof: "SOF 444"
4041481-4041547 usb_packet: sync-ok: "SYNC: 00000001" "SYNC" "S"
4041547-4041613 usb_packet: pid: "PID: SOF" "SOF" "S"
4041613-4041704 usb_packet: framenum: "Frame: 445" "Frame" "Fr" "F"
4041704-4041745 usb_packet: crc5-ok: "CRC5: 0x0A" "CRC5" "C"
4041481-4041770 usb_packet: packet-sof: "SOF 445"
4141481-4141547 usb_packet: sync-ok: "SYNC: 00000001" "SYNC" "S"
4141547-4141613 usb_packet: pid: "PID: SOF" "SOF" "S"
4141613-4141704 usb_packet: framenum: "Frame: 446" "Frame" "Fr" "F"
4141704-4141745 usb_packet: crc5-ok: "CRC5: 0x02" "CRC5" "C"
4141481-4141770 usb_packet: packet-sof: "SOF 446"
4241480-4241546 usb_packet: sync-ok: "SYNC: 00000001" "SYNC" "S"
4241546-4241612 usb_packet: pid: "PID: SOF" "SOF" "S"
4241612-4241712 usb_packet: framenum: "Frame: 447" "Frame" "Fr" "F"
4241712-4241754 usb_packet: crc5-ok: "CRC5: 0x1D" "CRC5" "C"
4241480-4241779 usb_packet: packet-sof: "SOF 447"
4245369-4245435 usb_packet: sync-ok: "SYNC: 00000001" "SYNC" "S"
4245435-4245501 usb_packet: pid: "PID: PRE" "PRE" "P"
4245369-4245501 usb_packet: packet-pre: "PRE"
4245585-4246118 usb_packet: sync-ok: "SYNC: 00000001" "SYNC" "S"
4246118-4246651 usb_packet: pid: "PID: IN" "IN" "I"
4246651-4247117 usb_packet: addr: "Address: 1" "Addr: 1" "Addr" "A"
4247117-4247384 usb_packet: ep: "Endpoint: 3" "EP: 3" "EP" "E"
4247384-4247717 usb_packet: crc5-ok: "CRC5: 0x0E" "CRC5" "C"
4245585-4247918 usb_packet: packet-in: "IN ADDR 1 EP 3"
4255052-4255118 usb_packet: sync-ok: "SYNC: 00000001" "SYNC" "S"
4255118-4255184 usb_packet: pid: "PID: PRE" "PRE" "P"
4255052-4255184 usb_packet: packet-pre: "PRE"
4255269-4255802 usb_packet: sync-ok: "SYNC: 00000001" "SYNC" "S"
4255802-4256334 usb_packet: pid: "PID: ACK" "ACK" "A"
4255269-4256534 usb_packet: packet-ack: "ACK"
4341477-4341543 usb_packet: sync-ok: "SYNC: 00000001" "SYNC" "S"
4341543-4341609 usb_packet: pid: "PID: SOF" "SOF" "S"
4341609-4341700 usb_packet: framenum: "Frame: 448" "Frame" "Fr" "F"
4341700-4341741 usb_packet: crc5-ok: "CRC5: 0x1A" "CRC5" "C"
4341477-4341766 usb_packet: packet-sof: "SOF 448"
4441480-4441546 usb_packet: sync-ok: "SYNC: 00000001" "SYNC" "S"
4441546-4441612 usb_packet: pid: "PID: SOF" "SOF" "S"
4441612-4441703 usb_packet: framenum: "Frame: 449" "Frame" "Fr" "F"
4441703-4441745 usb_packet: crc5-ok: "CRC5: 0x05" "CRC5" "C"
4441480-4441770 usb_packet: packet-sof: "SOF 449"
4541479-4541545 usb_packet: sync-ok: "SYNC: 00000001" "SYNC" "S"
4541545-4541611 usb_packet: pid: "PID: SOF" "SOF" "S"
4541611-4541703 usb_packet: framenum: "Frame: 450" "Frame" "Fr" "F"
4541703-4541745 usb_packet: crc5-ok: "CRC5: 0x0D" "CRC5" "C"
4541479-4541770 usb_packet: packet-sof: "SOF 450"
4641479-4641545 usb_packet: sync-ok: "SYNC: 00000001" "SYNC" "S"
4641545-4641611 usb_packet: pid: "PID: SOF" "SOF" "S"
4641611-4641703 usb_packet: framenum: "Frame: 451" "Frame" "Fr" "F"
4641703-4641744 usb_packet: crc5-ok: "CRC5: 0x12" "CRC5" "C"
4641479-4641769 usb_packet: packet-sof: "SOF 451"
4741479-4741545 usb_packet: sync-ok: "SYNC: 00000001" "SYNC" "S"
4741545-4741611 usb_packet: pid: "PID: SOF" "SOF" "S"
4741611-4741702 usb_packet: framenum: "Frame: 452" "Frame" "Fr" "F"
4741702-4741744 usb_packet: crc5-ok: "CRC5: 0x1D" "CRC5" "C"
4741479-4741768 usb_packet: packet-sof: "SOF 452"
4841479-4841545 usb_packet: sync-ok: "SYNC: 00000001" "SYNC" "S"
4841545-4841611 usb_packet: pid: "PID: SOF" "SOF" "S"
4841611-4841702 usb_packet: framenum: "Frame: 453" "Frame" "Fr" "F"
4841702-4841743 usb_packet: crc5-ok: "CRC5: 0x02" "CRC5" "C"
4841479-4841768 usb_packet: packet-sof: "SOF 453"
4941478-4941544 usb_packet: sync-ok: "SYNC: 00000001" "SYNC" "S"
4941544-4941610 usb_packet: pid: "PID: SOF" "SOF" "S"
4941610-4941702 usb_packet: framenum: "Frame: 454" "Frame" "Fr" "F"
4941702-4941743 usb_packet: crc5-ok: "CRC5: 0x0A" "CRC5" "C"
4941478-4941768 usb_packet: packet-sof: "SOF 454"
5041478-5041544 usb_packet: sync-ok: "SYNC: 00000001" "SYNC" "S"
5041544-5041610 usb_packet: pid: "PID: SOF" "SOF" "S"
5041610-5041701 usb_packet: framenum: "Frame: 455" "Frame" "Fr" "F"
5041701-5041743 usb_packet: crc5-ok: "CRC5: 0x15" "CRC5" "C"
5041478-5041767 usb_packet: packet-sof: "SOF 455"
5045359-5045425 usb_packet: sync-ok: "SYNC: 00000001" "SYNC" "S"
5045425-5045491 usb_packet: pid: "PID: PRE" "PRE" "P"
5045359-5045491 usb_packet: packet-pre: "PRE"
5045594-5046126 usb_packet: sync-ok: "SYNC: 00000001" "SYNC" "S"
5046126-5046660 usb_packet: pid: "PID: IN" "IN" "I"
5046660-5047127 usb_packet: addr: "Address: 1" "Addr: 1" "Addr" "A"
5047127-5047393 usb_packet: ep: "Endpoint: 3" "EP: 3" "EP" "E"
5047393-5047727 usb_packet: crc5-ok: "CRC5: 0x0E" "CRC5" "C"
5045594-5047927 usb_packet: packet-in: "IN ADDR 1 EP 3"
5055048-5055114 usb_packet: sync-ok: "SYNC: 00000001" "SYNC" "S"
5055114-5055180 usb_packet: pid: "PID: PRE" "PRE" "P"
5055048-5055180 usb_packet: packet-pre: "PRE"
5055264-5055796 usb_packet: sync-ok: "SYNC: 00000001" "SYNC" "S"
5055796-5056330 usb_packet: pid: "PID: ACK" "ACK" "A"
5055264-5056531 usb_packet: packet-ack: "ACK"
5141473-5141539 usb_packet: sync-ok: "SYNC: 00000001" "SYNC" "S"
5141539-5141605 usb_packet: pid: "PID: SOF" "SOF" "S"
5141605-5141696 usb_packet: framenum: "Frame: 456" "Frame" "Fr" "F"
5141696-5141737 usb_packet: crc5-ok: "CRC5: 0x14" "CRC5" "C"
5141473-5141762 usb_packet: packet-sof: "SOF 456"
5241477-5241543 usb_packet: sync-ok: "SYNC: 00000001" "SYNC" "S"
5241543-5241609 usb_packet: pid: "PID: SOF" "SOF" "S"
5241609-5241701 usb_packet: framenum: "Frame: 457" "Frame" "Fr" "F"
5241701-5241742 usb_packet: crc5-ok: "CRC5: 0x0B" "CRC5" "C"
5241477-5241767 usb_packet: packet-sof: "SOF 457"
5341477-5341543 usb_packet: sync-ok: "SYNC: 00000001" "SYNC" "S"
5341543-5341609 usb_packet: pid: "PID: SOF" "SOF" "S"
5341609-5341700 usb_packet: framenum: "Frame: 458" "Frame" "Fr" "F"
5341700-5341742 usb_packet: crc5-ok: "CRC5: 0x03" "CRC5" "C"
5341477-5341767 usb_packet: packet-sof: "SOF 458"
5441477-5441543 usb_packet: sync-ok: "SYNC: 00000001" "SYNC" "S"
5441543-5441609 usb_packet: pid: "PID: SOF" "SOF" "S"
5441609-5441700 usb_packet: framenum: "Frame: 459" "Frame" "Fr" "F"
5441700-5441742 usb_packet: crc5-ok: "CRC5: 0x1C" "CRC5" "C"
5441477-5441767 usb_packet: packet-sof: "SOF 459"
5541476-5541542 usb_packet: sync-ok: "SYNC: 00000001" "SYNC" "S"
5541542-5541608 usb_packet: pid: "PID: SOF" "SOF" "S"
5541608-5541700 usb_packet: framenum: "Frame: 460" "Frame" "Fr" "F"
5541700-5541741 usb_packet: crc5-ok: "CRC5: 0x13" "CRC5" "C"
5541476-5541766 usb_packet: packet-sof: "SOF 460"
5641476-5641542 usb_packet: sync-ok: "SYNC: 00000001" "SYNC" "S"
5641542-5641608 usb_packet: pid: "PID: SOF" "SOF" "S"
5641608-5641700 usb_packet: framenum: "Frame: 461" "Frame" "Fr" "F"
5641700-5641741 usb_packet: crc5-ok: "CRC5: 0x0C" "CRC5" "C"
5641476-5641766 usb_packet: packet-sof: "SOF 461"
5741476-5741542 usb_packet: sync-ok: "SYNC: 00000001" "SYNC" "S"
5741542-5741608 usb_packet: pid: "PID: SOF" "SOF" "S"
5741608-5741699 usb_packet: framenum: "Frame: 462" "Frame" "Fr" "F"
5741699-5741741 usb_packet: crc5-ok: "CRC5: 0x04" "CRC5" "C"
5741476-5741766 usb_packet: packet-sof: "SOF 462"
5841475-5841541 usb_packet: sync-ok: "SYNC: 00000001" "SYNC" "S"
5841541-5841607 usb_packet: pid: "PID: SOF" "SOF" "S"
5841607-5841699 usb_packet: framenum: "Frame: 463" "Frame" "Fr" "F"
5841699-5841740 usb_packet: crc5-ok: "CRC5: 0x1B" "CRC5" "C"
5841475-5841765 usb_packet: packet-sof: "SOF 463"
5845352-5845418 usb_packet: sync-ok: "SYNC: 00000001" "SYNC" "S"
5845418-5845484 usb_packet: pid: "PID: PRE" "PRE" "P"
5845352-5845484 usb_packet: packet-pre: "PRE"
5845587-5846120 usb_packet: sync-ok: "SYNC: 00000001" "SYNC" "S"
5846120-5846653 usb_packet: pid: "PID: IN" "IN" "I"
5846653-5847119 usb_packet: addr: "Address: 1" "Addr: 1" "Addr" "A"
5847119-5847387 usb_packet: ep: "Endpoint: 3" "EP: 3" "EP" "E"
5847387-5847719 usb_packet: crc5-ok: "CRC5: 0x0E" "CRC5" "C"
5845587-5847920 usb_packet: packet-in: "IN ADDR 1 EP 3"
5854984-5855050 usb_packet: sync-ok: "SYNC: 00000001" "SYNC" "S"
5855050-5855116 usb_packet: pid: "PID: PRE" "PRE" "P"
5854984-5855116 usb_packet: packet-pre: "PRE"
5855200-5855732 usb_packet: sync-ok: "SYNC: 00000001" "SYNC" "S"
5855732-5856266 usb_packet: pid: "PID: ACK" "ACK" "A"
5855200-5856467 usb_packet: packet-ack: "ACK"
5941475-5941541 usb_packet: sync-ok: "SYNC: 00000001" "SYNC" "S"
5941541-5941607 usb_packet: pid: "PID: SOF" "SOF" "S"
5941607-5941699 usb_packet: framenum: "Frame: 464" "Frame" "Fr" "F"
5941699-5941740 usb_packet: crc5-ok: "CRC5: 0x06" "CRC5" "C"
5941475-5941765 usb_packet: packet-sof: "SOF 464"
6041475-6041541 usb_packet: sync-ok: "SYNC: 00000001" "SYNC" "S"
6041541-6041607 usb_packet: pid: "PID: SOF" "SOF" "S"
6041607-6041698 usb_packet: framenum: "Frame: 465" "Frame" "Fr" "F"
6041698-6041740 usb_packet: crc5-ok: "CRC5: 0x19" "CRC5" "C"
6041475-6041765 usb_packet: packet-sof: "SOF 465"
6141474-6141540 usb_packet: sync-ok: "SYNC: 00000001" "SYNC" "S"
6141540-6141606 usb_packet: pid: "PID: SOF" "SOF" "S"
6141606-6141698 usb_packet: framenum: "Frame: 466" "Frame" "Fr" "F"
6141698-6141739 usb_packet: crc5-ok: "CRC5: 0x11" "CRC5" "C"
6141474-6141764 usb_packet: packet-sof: "SOF 466"
6241474-6241540 usb_packet: sync-ok: "SYNC: 00000001" "SYNC" "S"
6241540-6241606 usb_packet: pid: "PID: SOF" "SOF" "S"
6241606-6241698 usb_packet: framenum: "Frame: 467" "Frame" "Fr" "F"
6241698-6241739 usb_packet: crc5-ok: "CRC5: 0x0E" "CRC5" "C"
6241474-6241764 usb_packet: packet-sof: "SOF 467"
6341474-6341540 usb_packet: sync-ok: "SYNC: 00000001" "SYNC" "S"
6341540-6341606 usb_packet: pid: "PID: SOF" "SOF" "S"
6341606-6341697 usb_packet: framenum: "Frame: 468" "Frame" "Fr" "F"
6341697-6341739 usb_packet: crc5-ok: "CRC5: 0x01" "CRC5" "C"
6341474-6341764 usb_packet: packet-sof: "SOF 468"
6441473-6441539 usb_packet: sync-ok: "SYNC: 00000001" "SYNC" "S"
6441539-6441605 usb_packet: pid: "PID: SOF" "SOF" "S"
6441605-6441697 usb_packet: framenum: "Frame: 469" "Frame" "Fr" "F"
6441697-6441738 usb_packet: crc5-ok: "CRC5: 0x1E" "CRC5" "C"
6441473-6441763 usb_packet: packet-sof: "SOF 469"
6541473-6541539 usb_packet: sync-ok: "SYNC: 00000001" "SYNC" "S"
6541539-6541605 usb_packet: pid: "PID: SOF" "SOF" "S"
6541605-6541697 usb_packet: framenum: "Frame: 470" "Frame" "Fr" "F"
6541697-6541738 usb_packet: crc5-ok: "CRC5: 0x16" "CRC5" "C"
6541473-6541763 usb_packet: packet-sof: "SOF 470"
6641473-6641539 usb_packet: sync-ok: "SYNC: 00000001" "SYNC" "S"
6641539-6641605 usb_packet: pid: "PID: SOF" "SOF" "S"
6641605-6641697 usb_packet: framenum: "Frame: 471" "Frame" "Fr" "F"
6641697-6641738 usb_packet: crc5-ok: "CRC5: 0x09" "CRC5" "C"
6641473-6641763 usb_packet: packet-sof: "SOF 471"
6645353-6645419 usb_packet: sync-ok: "SYNC: 00000001" "SYNC" "S"
6645419-6645485 usb_packet: pid: "PID: PRE" "PRE" "P"
6645353-6645485 usb_packet: packet-pre: "PRE"
6645588-6646121 usb_packet: sync-ok: "SYNC: 00000001" "SYNC" "S"
6646121-6646654 usb_packet: pid: "PID: IN" "IN" "I"
6646654-6647120 usb_packet: addr: "Address: 1" "Addr: 1" "Addr" "A"
6647120-6647386 usb_packet: ep: "Endpoint: 3" "EP: 3" "EP" "E"
6647386-6647720 usb_packet: crc5-ok: "CRC5: 0x0E" "CRC5" "C"
6645588-6647921 usb_packet: packet-in: "IN ADDR 1 EP 3"
6654954-6655020 usb_packet: sync-ok: "SYNC: 00000001" "SYNC" "S"
6655020-6655086 usb_packet: pid: "PID: PRE" "PRE" "P"
6654954-6655086 usb_packet: packet-pre: "PRE"
6655171-6655703 usb_packet: sync-ok: "SYNC: 00000001" "SYNC" "S"
6655703-6656237 usb_packet: pid: "PID: ACK" "ACK" "A"
6655171-6656438 usb_packet: packet-ack: "ACK"
6741471-6741537 usb_packet: sync-ok: "SYNC: 00000001" "SYNC" "S"
6741537-6741603 usb_packet: pid: "PID: SOF" "SOF" "S"
6741603-6741695 usb_packet: framenum: "Frame: 472" "Frame" "Fr" "F"
6741695-6741736 usb_packet: crc5-ok: "CRC5: 0x08" "CRC5" "C"
6741471-6741761 usb_packet: packet-sof: "SOF 472"
6841472-6841538 usb_packet: sync-ok: "SYNC: 00000001" "SYNC" "S"
6841538-6841604 usb_packet: pid: "PID: SOF" "SOF" "S"
6841604-6841696 usb_packet: framenum: "Frame: 473" "Frame" "Fr" "F"
6841696-6841737 usb_packet: crc5-ok: "CRC5: 0x17" "CRC5" "C"
6841472-6841762 usb_packet: packet-sof: "SOF 473"
6941472-6941538 usb_packet: sync-ok: "SYNC: 00000001" "SYNC" "S"
6941538-6941604 usb_packet: pid: "PID: SOF" "SOF" "S"
6941604-6941696 usb_packet: framenum: "Frame: 474" "Frame" "Fr" "F"
6941696-6941737 usb_packet: crc5-ok: "CRC5: 0x1F" "CRC5" "C"
6941472-6941762 usb_packet: packet-sof: "SOF 474"
7041472-7041538 usb_packet: sync-ok: "SYNC: 00000001" "SYNC" "S"
7041538-7041604 usb_packet: pid: "PID: SOF" "SOF" "S"
7041604-7041695 usb_packet: framenum: "Frame: 475" "Frame" "Fr" "F"
7041695-7041737 usb_packet: crc5-ok: "CRC5: 0x00" "CRC5" "C"
7041472-7041762 usb_packet: packet-sof: "SOF 475"
7141471-7141537 usb_packet: sync-ok: "SYNC: 00000001" "SYNC" "S"
7141537-7141603 usb_packet: pid: "PID: SOF" "SOF" "S"
7141603-7141695 usb_packet: framenum: "Frame: 476" "Frame" "Fr" "F"
7141695-7141736 usb_packet: crc5-ok: "CRC5: 0x0F" "CRC5" "C"
7141471-7141762 usb_packet: packet-sof: "SOF 476"
7241471-7241537 usb_packet: sync-ok: "SYNC: 00000001" "SYNC" "S"
7241537-7241603 usb_packet: pid: "PID: SOF" "SOF" "S"
7241603-7241695 usb_packet: framenum: "Frame: 477" "Frame" "Fr" "F"
7241695-7241736 usb_packet: crc5-ok: "CRC5: 0x10" "CRC5" "C"
7241471-7241761 usb_packet: packet-sof: "SOF 477"
7341471-7341537 usb_packet: sync-ok: "SYNC: 00000001" "SYNC" "S"
7341537-7341603 usb_packet: pid: "PID: SOF" "SOF" "S"
7341603-7341694 usb_packet: framenum: "Frame: 478" "Frame" "Fr" "F"
7341694-7341736 usb_packet: crc5-ok: "CRC5: 0x18" "CRC5" "C"
7341471-7341761 usb_packet: packet-sof: "SOF 478"
7441470-7441536 usb_packet: sync-ok: "SYNC: 00000001" "SYNC" "S"
7441536-7441602 usb_packet: pid: "PID: SOF" "SOF" "S"
7441602-7441702 usb_packet: framenum: "Frame: 479" "Frame" "Fr" "F"
7441702-7441744 usb_packet: crc5-ok: "CRC5: 0x07" "CRC5" "C"
7441470-7441769 usb_packet: packet-sof: "SOF 479"
7445257-7445323 usb_packet: sync-ok: "SYNC: 00000001" "SYNC" "S"
7445323-7445389 usb_packet: pid: "PID: PRE" "PRE" "P"
7445257-7445389 usb_packet: packet-pre: "PRE"
7445492-7446025 usb_packet: sync-ok: "SYNC: 00000001" "SYNC" "S"
7446025-7446558 usb_packet: pid: "PID: IN" "IN" "I"
7446558-7447024 usb_packet: addr: "Address: 1" "Addr: 1" "Addr" "A"
7447024-7447292 usb_packet: ep: "Endpoint: 3" "EP: 3" "EP" "E"
7447292-7447624 usb_packet: crc5-ok: "CRC5: 0x0E" "CRC5" "C"
7445492-7447825 usb_packet: packet-in: "IN ADDR 1 EP 3"
7454904-7454970 usb_packet: sync-ok: "SYNC: 00000001" "SYNC" "S"
7454970-7455036 usb_packet: pid: "PID: PRE" "PRE" "P"
7454904-7455036 usb_packet: packet-pre: "PRE"
7455120-7455653 usb_packet: sync-ok: "SYNC: 00000001" "SYNC" "S"
7455653-7456186 usb_packet: pid: "PID: ACK" "ACK" "A"
7455120-7456387 usb_packet: packet-ack: "ACK"
7541470-7541536 usb_packet: sync-ok: "SYNC: 00000001" "SYNC" "S"
7541536-7541602 usb_packet: pid: "PID: SOF" "SOF" "S"
7541602-7541694 usb_packet: framenum: "Frame: 480" "Frame" "Fr" "F"
7541694-7541735 usb_packet: crc5-ok: "CRC5: 0x0B" "CRC5" "C"
7541470-7541760 usb_packet: packet-sof: "SOF 480"
7641470-7641536 usb_packet: sync-ok: "SYNC: 00000001" "SYNC" "S"
7641536-7641602 usb_packet: pid: "PID: SOF" "SOF" "S"
7641602-7641694 usb_packet: framenum: "Frame: 481" "Frame" "Fr" "F"
7641694-7641735 usb_packet: crc5-ok: "CRC5: 0x14" "CRC5" "C"
7641470-7641760 usb_packet: packet-sof: "SOF 481"
7741469-7741535 usb_packet: sync-ok: "SYNC: 00000001" "SYNC" "S"
7741535-7741602 usb_packet: pid: "PID: SOF" "SOF" "S"
7741602-7741693 usb_packet: framenum: "Frame: 482" "Frame" "Fr" "F"
7741693-7741735 usb_packet: crc5-ok: "CRC5: 0x1C" "CRC5" "C"
7741469-7741760 usb_packet: packet-sof: "SOF 482"
7841469-7841535 usb_packet: sync-ok: "SYNC: 00000001" "SYNC" "S"
7841535-7841601 usb_packet: pid: "PID: SOF" "SOF" "S"
7841601-7841693 usb_packet: framenum: "Frame: 483" "Frame" "Fr" "F"
7841693-7841734 usb_packet: crc5-ok: "CRC5: 0x03" "CRC5" "C"
7841469-7841759 usb_packet: packet-sof: "SOF 483"
7941469-7941535 usb_packet: sync-ok: "SYNC: 00000001" "SYNC" "S"
7941535-7941601 usb_packet: pid: "PID: SOF" "SOF" "S"
7941601-7941692 usb_packet: framenum: "Frame: 484" "Frame" "Fr" "F"
7941692-7941734 usb_packet: crc5-ok: "CRC5: 0x0C" "CRC5" "C"
7941469-7941759 usb_packet: packet-sof: "SOF 484"
8041469-8041535 usb_packet: sync-ok: "SYNC: 00000001" "SYNC" "S"
8041535-8041601 usb_packet: pid: "PID: SOF" "SOF" "S"
8041601-8041692 usb_packet: framenum: "Frame: 485" "Frame" "Fr" "F"
8041692-8041733 usb_packet: crc5-ok: "CRC5: 0x13" "CRC5" "C"
8041469-8041758 usb_packet: packet-sof: "SOF 485"
8141468-8141534 usb_packet: sync-ok: "SYNC: 00000001" "SYNC" "S"
8141534-8141600 usb_packet: pid: "PID: SOF" "SOF" "S"
8141600-8141692 usb_packet: framenum: "Frame: 486" "Frame" "Fr" "F"
8141692-8141733 usb_packet: crc5-ok: "CRC5: 0x1B" "CRC5" "C"
8141468-8141758 usb_packet: packet-sof: "SOF 486"
8241468-8241534 usb_packet: sync-ok: "SYNC: 00000001" "SYNC" "S"
8241534-8241600 usb_packet: pid: "PID: SOF" "SOF" "S"
8241600-8241692 usb_packet: framenum: "Frame: 487" "Frame" "Fr" "F"
8241692-8241733 usb_packet: crc5-ok: "CRC5: 0x04" "CRC5" "C"
8241468-8241758 usb_packet: packet-sof: "SOF 487"
8245268-8245334 usb_packet: sync-ok: "SYNC: 00000001" "SYNC" "S"
8245334-8245400 usb_packet: pid: "PID: PRE" "PRE" "P"
8245268-8245400 usb_packet: packet-pre: "PRE"
8245503-8246036 usb_packet: sync-ok: "SYNC: 00000001" "SYNC" "S"
8246036-8246569 usb_packet: pid: "PID: IN" "IN" "I"
8246569-8247035 usb_packet: addr: "Address: 1" "Addr: 1" "Addr" "A"
8247035-8247303 usb_packet: ep: "Endpoint: 3" "EP: 3" "EP" "E"
8247303-8247635 usb_packet: crc5-ok: "CRC5: 0x0E" "CRC5" "C"
8245503-8247836 usb_packet: packet-in: "IN ADDR 1 EP 3"
8254920-8254986 usb_packet: sync-ok: "SYNC: 00000001" "SYNC" "S"
8254986-8255052 usb_packet: pid: "PID: PRE" "PRE" "P"
8254920-8255052 usb_packet: packet-pre: "PRE"
8255136-8255668 usb_packet: sync-ok: "SYNC: 00000001" "SYNC" "S"
8255668-8256202 usb_packet: pid: "PID: ACK" "ACK" "A"
8255136-8256403 usb_packet: packet-ack: "ACK"
8341469-8341535 usb_packet: sync-ok: "SYNC: 00000001" "SYNC" "S"
8341535-8341601 usb_packet: pid: "PID: SOF" "SOF" "S"
8341601-8341693 usb_packet: framenum: "Frame: 488" "Frame" "Fr" "F"
8341693-8341734 usb_packet: crc5-ok: "CRC5: 0x05" "CRC5" "C"
8341469-8341759 usb_packet: packet-sof: "SOF 488"
