35104-35170 usb_packet: sync-ok: "SYNC: 00000001" "SYNC" "S"
35170-35236 usb_packet: pid: "PID: SOF" "SOF" "S"
35236-35328 usb_packet: framenum: "Frame: 14" "Frame" "Fr" "F"
35328-35370 usb_packet: crc5-ok: "CRC5: 0x1C" "CRC5" "C"
35104-35395 usb_packet: packet-sof: "SOF 14"
135104-135170 usb_packet: sync-ok: "SYNC: 00000001" "SYNC" "S"
135170-135236 usb_packet: pid: "PID: SOF" "SOF" "S"
135236-135328 usb_packet: framenum: "Frame: 15" "Frame" "Fr" "F"
135328-135369 usb_packet: crc5-ok: "CRC5: 0x03" "CRC5" "C"
135104-135395 usb_packet: packet-sof: "SOF 15"
235104-235170 usb_packet: sync-ok: "SYNC: 00000001" "SYNC" "S"
235170-235236 usb_packet: pid: "PID: SOF" "SOF" "S"
235236-235328 usb_packet: framenum: "Frame: 16" "Frame" "Fr" "F"
235328-235370 usb_packet: crc5-ok: "CRC5: 0x1E" "CRC5" "C"
235104-235395 usb_packet: packet-sof: "SOF 16"
335105-335171 usb_packet: sync-ok: "SYNC: 00000001" "SYNC" "S"
335171-335237 usb_packet: pid: "PID: SOF" "SOF" "S"
335237-335328 usb_packet: framenum: "Frame: 17" "Frame" "Fr" "F"
335328-335370 usb_packet: crc5-ok: "CRC5: 0x01" "CRC5" "C"
335105-335395 usb_packet: packet-sof: "SOF 17"
435104-435170 usb_packet: sync-ok: "SYNC: 00000001" "SYNC" "S"
435170-435236 usb_packet: pid: "PID: SOF" "SOF" "S"
435236-435328 usb_packet: framenum: "Frame: 18" "Frame" "Fr" "F"
435328-435370 usb_packet: crc5-ok: "CRC5: 0x09" "CRC5" "C"
435104-435395 usb_packet: packet-sof: "SOF 18"
535104-535170 usb_packet: sync-ok: "SYNC: 00000001" "SYNC" "S"
535170-535236 usb_packet: pid: "PID: SOF" "SOF" "S"
535236-535328 usb_packet: framenum: "Frame: 19" "Frame" "Fr" "F"
535328-535370 usb_packet: crc5-ok: "CRC5: 0x16" "CRC5" "C"
535104-535395 usb_packet: packet-sof: "SOF 19"
635105-635171 usb_packet: sync-ok: "SYNC: 00000001" "SYNC" "S"
635171-635237 usb_packet: pid: "PID: SOF" "SOF" "S"
635237-635328 usb_packet: framenum: "Frame: 20" "Frame" "Fr" "F"
635328-635370 usb_packet: crc5-ok: "CRC5: 0x19" "CRC5" "C"
635105-635394 usb_packet: packet-sof: "SOF 20"
647229-647295 usb_packet: sync-ok: "SYNC: 00000001" "SYNC" "S"
647295-647361 usb_packet: pid: "PID: IN" "IN" "I"
647361-647420 usb_packet: addr: "Address: 6" "Addr: 6" "Addr" "A"
647420-647453 usb_packet: ep: "Endpoint: 2" "EP: 2" "EP" "E"
647453-647495 usb_packet: crc5-ok: "CRC5: 0x17" "CRC5" "C"
647229-647520 usb_packet: packet-in: "IN ADDR 6 EP 2"
647558-647624 usb_packet: sync-ok: "SYNC: 00000001" "SYNC" "S"
647624-647690 usb_packet: pid: "PID: DATA0" "DATA0" "D"
647690-647756 usb_packet: data: "Databyte: F2" "Data: F2" "DB: F2" "F2"
647756-647823 usb_packet: data: "Databyte: 5E" "Data: 5E" "DB: 5E" "5E"
647823-647889 usb_packet: data: "Databyte: 62" "Data: 62" "DB: 62" "62"
647889-647956 usb_packet: data: "Databyte: 00" "Data: 00" "DB: 00" "00"
647956-648023 usb_packet: data: "Databyte: 00" "Data: 00" "DB: 00" "00"
648023-648090 usb_packet: data: "Databyte: 00" "Data: 00" "DB: 00" "00"
648090-648157 usb_packet: data: "Databyte: 00" "Data: 00" "DB: 00" "00"
648157-648224 usb_packet: data: "Databyte: 00" "Data: 00" "DB: 00" "00"
648224-648357 usb_packet: crc16-ok: "CRC16: 0xEE86" "CRC16" "C"
647558-648382 usb_packet: packet-data0: "DATA0 [ F2 5E 62 00 00 00 00 00 ]"
648429-648495 usb_packet: sync-ok: "SYNC: 00000001" "SYNC" "S"
648495-648562 usb_packet: pid: "PID: ACK" "ACK" "A"
648429-648587 usb_packet: packet-ack: "ACK"
735105-735171 usb_packet: sync-ok: "SYNC: 00000001" "SYNC" "S"
735171-735237 usb_packet: pid: "PID: SOF" "SOF" "S"
735237-735328 usb_packet: framenum: "Frame: 21" "Frame" "Fr" "F"
735328-735370 usb_packet: crc5-ok: "CRC5: 0x06" "CRC5" "C"
735105-735395 usb_packet: packet-sof: "SOF 21"
835105-835171 usb_packet: sync-ok: "SYNC: 00000001" "SYNC" "S"
835171-835237 usb_packet: pid: "PID: SOF" "SOF" "S"
835237-835328 usb_packet: framenum: "Frame: 22" "Frame" "Fr" "F"
835328-835370 usb_packet: crc5-ok: "CRC5: 0x0E" "CRC5" "C"
835105-835395 usb_packet: packet-sof: "SOF 22"
935105-935171 usb_packet: sync-ok: "SYNC: 00000001" "SYNC" "S"
935171-935237 usb_packet: pid: "PID: SOF" "SOF" "S"
935237-935328 usb_packet: framenum: "Frame: 23" "Frame" "Fr" "F"
935328-935370 usb_packet: crc5-ok: "CRC5: 0x11" "CRC5" "C"
935105-935395 usb_packet: packet-sof: "SOF 23"
1035105-1035171 usb_packet: sync-ok: "SYNC: 00000001" "SYNC" "S"
1035171-1035237 usb_packet: pid: "PID: SOF" "SOF" "S"
1035237-1035329 usb_packet: framenum: "Frame: 24" "Frame" "Fr" "F"
1035329-1035370 usb_packet: crc5-ok: "CRC5: 0x10" "CRC5" "C"
1035105-1035395 usb_packet: packet-sof: "SOF 24"
1135105-1135171 usb_packet: sync-ok: "SYNC: 00000001" "SYNC" "S"
1135171-1135237 usb_packet: pid: "PID: SOF" "SOF" "S"
1135237-1135328 usb_packet: framenum: "Frame: 25" "Frame" "Fr" "F"
1135328-1135370 usb_packet: crc5-ok: "CRC5: 0x0F" "CRC5" "C"
1135105-1135395 usb_packet: packet-sof: "SOF 25"
1235105-1235171 usb_packet: sync-ok: "SYNC: 00000001" "SYNC" "S"
1235171-1235237 usb_packet: pid: "PID: SOF" "SOF" "S"
1235237-1235328 usb_packet: framenum: "Frame: 26" "Frame" "Fr" "F"
1235328-1235370 usb_packet: crc5-ok: "CRC5: 0x07" "CRC5" "C"
1235105-1235395 usb_packet: packet-sof: "SOF 26"
1335105-1335171 usb_packet: sync-ok: "SYNC: 00000001" "SYNC" "S"
1335171-1335237 usb_packet: pid: "PID: SOF" "SOF" "S"
1335237-1335328 usb_packet: framenum: "Frame: 27" "Frame" "Fr" "F"
1335328-1335370 usb_packet: crc5-ok: "CRC5: 0x18" "CRC5" "C"
1335105-1335395 usb_packet: packet-sof: "SOF 27"
1435105-1435171 usb_packet: sync-ok: "SYNC: 00000001" "SYNC" "S"
1435171-1435237 usb_packet: pid: "PID: SOF" "SOF" "S"
1435237-1435328 usb_packet: framenum: "Frame: 28" "Frame" "Fr" "F"
1435328-1435370 usb_packet: crc5-ok: "CRC5: 0x17" "CRC5" "C"
1435105-1435395 usb_packet: packet-sof: "SOF 28"
1535105-1535171 usb_packet: sync-ok: "SYNC: 00000001" "SYNC" "S"
1535171-1535237 usb_packet: pid: "PID: SOF" "SOF" "S"
1535237-1535328 usb_packet: framenum: "Frame: 29" "Frame" "Fr" "F"
1535328-1535370 usb_packet: crc5-ok: "CRC5: 0x08" "CRC5" "C"
1535105-1535395 usb_packet: packet-sof: "SOF 29"
1635105-1635171 usb_packet: sync-ok: "SYNC: 00000001" "SYNC" "S"
1635171-1635237 usb_packet: pid: "PID: SOF" "SOF" "S"
1635237-1635328 usb_packet: framenum: "Frame: 30" "Frame" "Fr" "F"
1635328-1635370 usb_packet: crc5-ok: "CRC5: 0x00" "CRC5" "C"
1635105-1635395 usb_packet: packet-sof: "SOF 30"
1735105-1735171 usb_packet: sync-ok: "SYNC: 00000001" "SYNC" "S"
1735171-1735237 usb_packet: pid: "PID: SOF" "SOF" "S"
1735237-1735337 usb_packet: framenum: "Frame: 31" "Frame" "Fr" "F"
1735337-1735378 usb_packet: crc5-ok: "CRC5: 0x1F" "CRC5" "C"
1735105-1735403 usb_packet: packet-sof: "SOF 31"
1835105-1835171 usb_packet: sync-ok: "SYNC: 00000001" "SYNC" "S"
1835171-1835237 usb_packet: pid: "PID: SOF" "SOF" "S"
1835237-1835329 usb_packet: framenum: "Frame: 32" "Frame" "Fr" "F"
1835329-1835370 usb_packet: crc5-ok: "CRC5: 0x13" "CRC5" "C"
1835105-1835395 usb_packet: packet-sof: "SOF 32"
1847221-1847287 usb_packet: sync-ok: "SYNC: 00000001" "SYNC" "S"
1847287-1847353 usb_packet: pid: "PID: IN" "IN" "I"
1847353-1847412 usb_packet: addr: "Address: 6" "Addr: 6" "Addr" "A"
1847412-1847445 usb_packet: ep: "Endpoint: 2" "EP: 2" "EP" "E"
1847445-1847487 usb_packet: crc5-ok: "CRC5: 0x17" "CRC5" "C"
1847221-1847512 usb_packet: packet-in: "IN ADDR 6 EP 2"
1847549-1847615 usb_packet: sync-ok: "SYNC: 00000001" "SYNC" "S"
1847615-1847681 usb_packet: pid: "PID: DATA1" "DATA1" "D"
1847681-1847748 usb_packet: data: "Databyte: F3" "Data: F3" "DB: F3" "F3"
1847748-1847823 usb_packet: data: "Databyte: 77" "Data: 77" "DB: 77" "77"
1847823-1847889 usb_packet: data: "Databyte: 8F" "Data: 8F" "DB: 8F" "8F"
1847889-1847956 usb_packet: data: "Databyte: 9E" "Data: 9E" "DB: 9E" "9E"
1847956-1848023 usb_packet: data: "Databyte: 00" "Data: 00" "DB: 00" "00"
1848023-1848090 usb_packet: data: "Databyte: 00" "Data: 00" "DB: 00" "00"
1848090-1848156 usb_packet: data: "Databyte: 00" "Data: 00" "DB: 00" "00"
1848156-1848223 usb_packet: data: "Databyte: 00" "Data: 00" "DB: 00" "00"
1848223-1848356 usb_packet: crc16-ok: "CRC16: 0x4141" "CRC16" "C"
1847549-1848381 usb_packet: packet-data1: "DATA1 [ F3 77 8F 9E 00 00 00 00 ]"
1848421-1848487 usb_packet: sync-ok: "SYNC: 00000001" "SYNC" "S"
1848487-1848554 usb_packet: pid: "PID: ACK" "ACK" "A"
1848421-1848579 usb_packet: packet-ack: "ACK"
1935105-1935171 usb_packet: sync-ok: "SYNC: 00000001" "SYNC" "S"
1935171-1935237 usb_packet: pid: "PID: SOF" "SOF" "S"
1935237-1935329 usb_packet: framenum: "Frame: 33" "Frame" "Fr" "F"
1935329-1935370 usb_packet: crc5-ok: "CRC5: 0x0C" "CRC5" "C"
1935105-1935395 usb_packet: packet-sof: "SOF 33"
2035105-2035171 usb_packet: sync-ok: "SYNC: 00000001" "SYNC" "S"
2035171-2035237 usb_packet: pid: "PID: SOF" "SOF" "S"
2035237-2035329 usb_packet: framenum: "Frame: 34" "Frame" "Fr" "F"
2035329-2035370 usb_packet: crc5-ok: "CRC5: 0x04" "CRC5" "C"
2035105-2035395 usb_packet: packet-sof: "SOF 34"
2135105-2135171 usb_packet: sync-ok: "SYNC: 00000001" "SYNC" "S"
2135171-2135237 usb_packet: pid: "PID: SOF" "SOF" "S"
2135237-2135329 usb_packet: framenum: "Frame: 35" "Frame" "Fr" "F"
2135329-2135370 usb_packet: crc5-ok: "CRC5: 0x1B" "CRC5" "C"
2135105-2135395 usb_packet: packet-sof: "SOF 35"
2235105-2235171 usb_packet: sync-ok: "SYNC: 00000001" "SYNC" "S"
2235171-2235237 usb_packet: pid: "PID: SOF" "SOF" "S"
2235237-2235329 usb_packet: framenum: "Frame: 36" "Frame" "Fr" "F"
2235329-2235370 usb_packet: crc5-ok: "CRC5: 0x14" "CRC5" "C"
2235105-2235395 usb_packet: packet-sof: "SOF 36"
2335105-2335171 usb_packet: sync-ok: "SYNC: 00000001" "SYNC" "S"
2335171-2335237 usb_packet: pid: "PID: SOF" "SOF" "S"
2335237-2335329 usb_packet: framenum: "Frame: 37" "Frame" "Fr" "F"
2335329-2335370 usb_packet: crc5-ok: "CRC5: 0x0B" "CRC5" "C"
2335105-2335395 usb_packet: packet-sof: "SOF 37"
2435105-2435171 usb_packet: sync-ok: "SYNC: 00000001" "SYNC" "S"
2435171-2435237 usb_packet: pid: "PID: SOF" "SOF" "S"
2435237-2435329 usb_packet: framenum: "Frame: 38" "Frame" "Fr" "F"
2435329-2435370 usb_packet: crc5-ok: "CRC5: 0x03" "CRC5" "C"
2435105-2435395 usb_packet: packet-sof: "SOF 38"
2535105-2535171 usb_packet: sync-ok: "SYNC: 00000001" "SYNC" "S"
2535171-2535237 usb_packet: pid: "PID: SOF" "SOF" "S"
2535237-2535329 usb_packet: framenum: "Frame: 39" "Frame" "Fr" "F"
2535329-2535370 usb_packet: crc5-ok: "CRC5: 0x1C" "CRC5" "C"
2535105-2535395 usb_packet: packet-sof: "SOF 39"
2635105-2635171 usb_packet: sync-ok: "SYNC: 00000001" "SYNC" "S"
2635171-2635237 usb_packet: pid: "PID: SOF" "SOF" "S"
2635237-2635329 usb_packet: framenum: "Frame: 40" "Frame" "Fr" "F"
2635329-2635370 usb_packet: crc5-ok: "CRC5: 0x1D" "CRC5" "C"
2635105-2635395 usb_packet: packet-sof: "SOF 40"
2735105-2735171 usb_packet: sync-ok: "SYNC: 00000001" "SYNC" "S"
2735171-2735237 usb_packet: pid: "PID: SOF" "SOF" "S"
2735237-2735329 usb_packet: framenum: "Frame: 41" "Frame" "Fr" "F"
2735329-2735370 usb_packet: crc5-ok: "CRC5: 0x02" "CRC5" "C"
2735105-2735395 usb_packet: packet-sof: "SOF 41"
2835105-2835171 usb_packet: sync-ok: "SYNC: 00000001" "SYNC" "S"
2835171-2835237 usb_packet: pid: "PID: SOF" "SOF" "S"
2835237-2835329 usb_packet: framenum: "Frame: 42" "Frame" "Fr" "F"
2835329-2835370 usb_packet: crc5-ok: "CRC5: 0x0A" "CRC5" "C"
2835105-2835395 usb_packet: packet-sof: "SOF 42"
2935105-2935171 usb_packet: sync-ok: "SYNC: 00000001" "SYNC" "S"
2935171-2935237 usb_packet: pid: "PID: SOF" "SOF" "S"
2935237-2935329 usb_packet: framenum: "Frame: 43" "Frame" "Fr" "F"
2935329-2935371 usb_packet: crc5-ok: "CRC5: 0x15" "CRC5" "C"
2935105-2935396 usb_packet: packet-sof: "SOF 43"
3035105-3035171 usb_packet: sync-ok: "SYNC: 00000001" "SYNC" "S"
3035171-3035237 usb_packet: pid: "PID: SOF" "SOF" "S"
3035237-3035329 usb_packet: framenum: "Frame: 44" "Frame" "Fr" "F"
3035329-3035370 usb_packet: crc5-ok: "CRC5: 0x1A" "CRC5" "C"
3035105-3035396 usb_packet: packet-sof: "SOF 44"
3047230-3047296 usb_packet: sync-ok: "SYNC: 00000001" "SYNC" "S"
3047296-3047362 usb_packet: pid: "PID: IN" "IN" "I"
3047362-3047420 usb_packet: addr: "Address: 6" "Addr: 6" "Addr" "A"
3047420-3047454 usb_packet: ep: "Endpoint: 2" "EP: 2" "EP" "E"
3047454-3047495 usb_packet: crc5-ok: "CRC5: 0x17" "CRC5" "C"
3047230-3047520 usb_packet: packet-in: "IN ADDR 6 EP 2"
3047559-3047625 usb_packet: sync-ok: "SYNC: 00000001" "SYNC" "S"
3047625-3047691 usb_packet: pid: "PID: DATA0" "DATA0" "D"
3047691-3047757 usb_packet: data: "Databyte: F3" "Data: F3" "DB: F3" "F3"
3047757-3047823 usb_packet: data: "Databyte: A0" "Data: A0" "DB: A0" "A0"
3047823-3047890 usb_packet: data: "Databyte: B8" "Data: B8" "DB: B8" "B8"
3047890-3047956 usb_packet: data: "Databyte: C0" "Data: C0" "DB: C0" "C0"
3047956-3048023 usb_packet: data: "Databyte: 00" "Data: 00" "DB: 00" "00"
3048023-3048090 usb_packet: data: "Databyte: 00" "Data: 00" "DB: 00" "00"
3048090-3048158 usb_packet: data: "Databyte: 00" "Data: 00" "DB: 00" "00"
3048158-3048225 usb_packet: data: "Databyte: 00" "Data: 00" "DB: 00" "00"
3048225-3048358 usb_packet: crc16-ok: "CRC16: 0xC64B" "CRC16" "C"
3047559-3048383 usb_packet: packet-data0: "DATA0 [ F3 A0 B8 C0 00 00 00 00 ]"
3048430-3048496 usb_packet: sync-ok: "SYNC: 00000001" "SYNC" "S"
3048496-3048562 usb_packet: pid: "PID: ACK" "ACK" "A"
3048430-3048587 usb_packet: packet-ack: "ACK"
3135105-3135171 usb_packet: sync-ok: "SYNC: 00000001" "SYNC" "S"
3135171-3135237 usb_packet: pid: "PID: SOF" "SOF" "S"
3135237-3135329 usb_packet: framenum: "Frame: 45" "Frame" "Fr" "F"
3135329-3135371 usb_packet: crc5-ok: "CRC5: 0x05" "CRC5" "C"
3135105-3135396 usb_packet: packet-sof: "SOF 45"
3235105-3235171 usb_packet: sync-ok: "SYNC: 00000001" "SYNC" "S"
3235171-3235237 usb_packet: pid: "PID: SOF" "SOF" "S"
3235237-3235329 usb_packet: framenum: "Frame: 46" "Frame" "Fr" "F"
3235329-3235371 usb_packet: crc5-ok: "CRC5: 0x0D" "CRC5" "C"
3235105-3235396 usb_packet: packet-sof: "SOF 46"
3335105-3335171 usb_packet: sync-ok: "SYNC: 00000001" "SYNC" "S"
3335171-3335237 usb_packet: pid: "PID: SOF" "SOF" "S"
3335237-3335329 usb_packet: framenum: "Frame: 47" "Frame" "Fr" "F"
3335329-3335370 usb_packet: crc5-ok: "CRC5: 0x12" "CRC5" "C"
3335105-3335395 usb_packet: packet-sof: "SOF 47"
3435105-3435171 usb_packet: sync-ok: "SYNC: 00000001" "SYNC" "S"
3435171-3435237 usb_packet: pid: "PID: SOF" "SOF" "S"
3435237-3435329 usb_packet: framenum: "Frame: 48" "Frame" "Fr" "F"
3435329-3435371 usb_packet: crc5-ok: "CRC5: 0x0F" "CRC5" "C"
3435105-3435396 usb_packet: packet-sof: "SOF 48"
3535105-3535171 usb_packet: sync-ok: "SYNC: 00000001" "SYNC" "S"
3535171-3535237 usb_packet: pid: "PID: SOF" "SOF" "S"
3535237-3535329 usb_packet: framenum: "Frame: 49" "Frame" "Fr" "F"
3535329-3535371 usb_packet: crc5-ok: "CRC5: 0x10" "CRC5" "C"
3535105-3535396 usb_packet: packet-sof: "SOF 49"
3635105-3635171 usb_packet: sync-ok: "SYNC: 00000001" "SYNC" "S"
3635171-3635237 usb_packet: pid: "PID: SOF" "SOF" "S"
3635237-3635329 usb_packet: framenum: "Frame: 50" "Frame" "Fr" "F"
3635329-3635371 usb_packet: crc5-ok: "CRC5: 0x18" "CRC5" "C"
3635105-3635396 usb_packet: packet-sof: "SOF 50"
3735105-3735171 usb_packet: sync-ok: "SYNC: 00000001" "SYNC" "S"
3735171-3735237 usb_packet: pid: "PID: SOF" "SOF" "S"
3735237-3735329 usb_packet: framenum: "Frame: 51" "Frame" "Fr" "F"
3735329-3735371 usb_packet: crc5-ok: "CRC5: 0x07" "CRC5" "C"
3735105-3735396 usb_packet: packet-sof: "SOF 51"
3835105-3835171 usb_packet: sync-ok: "SYNC: 00000001" "SYNC" "S"
3835171-3835237 usb_packet: pid: "PID: SOF" "SOF" "S"
3835237-3835329 usb_packet: framenum: "Frame: 52" "Frame" "Fr" "F"
3835329-3835371 usb_packet: crc5-ok: "CRC5: 0x08" "CRC5" "C"
3835105-3835396 usb_packet: packet-sof: "SOF 52"
3935105-3935171 usb_packet: sync-ok: "SYNC: 00000001" "SYNC" "S"
3935171-3935237 usb_packet: pid: "PID: SOF" "SOF" "S"
3935237-3935329 usb_packet: framenum: "Frame: 53" "Frame" "Fr" "F"
3935329-3935371 usb_packet: crc5-ok: "CRC5: 0x17" "CRC5" "C"
3935105-3935396 usb_packet: packet-sof: "SOF 53"
4035105-4035171 usb_packet: sync-ok: "SYNC: 00000001" "SYNC" "S"
4035171-4035237 usb_packet: pid: "PID: SOF" "SOF" "S"
4035237-4035329 usb_packet: framenum: "Frame: 54" "Frame" "Fr" "F"
4035329-4035371 usb_packet: crc5-ok: "CRC5: 0x1F" "CRC5" "C"
4035105-4035396 usb_packet: packet-sof: "SOF 54"
4135105-4135171 usb_packet: sync-ok: "SYNC: 00000001" "SYNC" "S"
4135171-4135237 usb_packet: pid: "PID: SOF" "SOF" "S"
4135237-4135329 usb_packet: framenum: "Frame: 55" "Frame" "Fr" "F"
4135329-4135371 usb_packet: crc5-ok: "CRC5: 0x00" "CRC5" "C"
4135105-4135396 usb_packet: packet-sof: "SOF 55"
4235106-4235172 usb_packet: sync-ok: "SYNC: 00000001" "SYNC" "S"
4235172-4235238 usb_packet: pid: "PID: SOF" "SOF" "S"
4235238-4235329 usb_packet: framenum: "Frame: 56" "Frame" "Fr" "F"
4235329-4235371 usb_packet: crc5-ok: "CRC5: 0x01" "CRC5" "C"
4235106-4235396 usb_packet: packet-sof: "SOF 56"
4247247-4247313 usb_packet: sync-ok: "SYNC: 00000001" "SYNC" "S"
4247313-4247379 usb_packet: pid: "PID: IN" "IN" "I"
4247379-4247437 usb_packet: addr: "Address: 6" "Addr: 6" "Addr" "A"
4247437-4247471 usb_packet: ep: "Endpoint: 2" "EP: 2" "EP" "E"
4247471-4247512 usb_packet: crc5-ok: "CRC5: 0x17" "CRC5" "C"
4247247-4247537 usb_packet: packet-in: "IN ADDR 6 EP 2"
4247574-4247640 usb_packet: sync-ok: "SYNC: 00000001" "SYNC" "S"
4247640-4247706 usb_packet: pid: "PID: DATA1" "DATA1" "D"
4247706-4247773 usb_packet: data: "Databyte: F2" "Data: F2" "DB: F2" "F2"
4247773-4247840 usb_packet: data: "Databyte: D4" "Data: D4" "DB: D4" "D4"
4247840-4247906 usb_packet: data: "Databyte: E8" "Data: E8" "DB: E8" "E8"
4247906-4247973 usb_packet: data: "Databyte: 00" "Data: 00" "DB: 00" "00"
4247973-4248040 usb_packet: data: "Databyte: 00" "Data: 00" "DB: 00" "00"
4248040-4248107 usb_packet: data: "Databyte: 00" "Data: 00" "DB: 00" "00"
4248107-4248173 usb_packet: data: "Databyte: 00" "Data: 00" "DB: 00" "00"
4248173-4248240 usb_packet: data: "Databyte: 00" "Data: 00" "DB: 00" "00"
4248240-4248373 usb_packet: crc16-ok: "CRC16: 0x4CB2" "CRC16" "C"
4247574-4248398 usb_packet: packet-data1: "DATA1 [ F2 D4 E8 00 00 00 00 00 ]"
4248439-4248505 usb_packet: sync-ok: "SYNC: 00000001" "SYNC" "S"
4248505-4248571 usb_packet: pid: "PID: ACK" "ACK" "A"
4248439-4248596 usb_packet: packet-ack: "ACK"
4335106-4335172 usb_packet: sync-ok: "SYNC: 00000001" "SYNC" "S"
4335172-4335238 usb_packet: pid: "PID: SOF" "SOF" "S"
4335238-4335329 usb_packet: framenum: "Frame: 57" "Frame" "Fr" "F"
4335329-4335371 usb_packet: crc5-ok: "CRC5: 0x1E" "CRC5" "C"
4335106-4335396 usb_packet: packet-sof: "SOF 57"
4435106-4435172 usb_packet: sync-ok: "SYNC: 00000001" "SYNC" "S"
4435172-4435238 usb_packet: pid: "PID: SOF" "SOF" "S"
4435238-4435329 usb_packet: framenum: "Frame: 58" "Frame" "Fr" "F"
4435329-4435371 usb_packet: crc5-ok: "CRC5: 0x16" "CRC5" "C"
4435106-4435396 usb_packet: packet-sof: "SOF 58"
4535106-4535172 usb_packet: sync-ok: "SYNC: 00000001" "SYNC" "S"
4535172-4535238 usb_packet: pid: "PID: SOF" "SOF" "S"
4535238-4535329 usb_packet: framenum: "Frame: 59" "Frame" "Fr" "F"
4535329-4535371 usb_packet: crc5-ok: "CRC5: 0x09" "CRC5" "C"
4535106-4535396 usb_packet: packet-sof: "SOF 59"
4635106-4635172 usb_packet: sync-ok: "SYNC: 00000001" "SYNC" "S"
4635172-4635238 usb_packet: pid: "PID: SOF" "SOF" "S"
4635238-4635329 usb_packet: framenum: "Frame: 60" "Frame" "Fr" "F"
4635329-4635371 usb_packet: crc5-ok: "CRC5: 0x06" "CRC5" "C"
4635106-4635396 usb_packet: packet-sof: "SOF 60"
4735106-4735172 usb_packet: sync-ok: "SYNC: 00000001" "SYNC" "S"
4735172-4735238 usb_packet: pid: "PID: SOF" "SOF" "S"
4735238-4735329 usb_packet: framenum: "Frame: 61" "Frame" "Fr" "F"
4735329-4735371 usb_packet: crc5-ok: "CRC5: 0x19" "CRC5" "C"
4735106-4735396 usb_packet: packet-sof: "SOF 61"
4835106-4835172 usb_packet: sync-ok: "SYNC: 00000001" "SYNC" "S"
4835172-4835238 usb_packet: pid: "PID: SOF" "SOF" "S"
4835238-4835329 usb_packet: framenum: "Frame: 62" "Frame" "Fr" "F"
4835329-4835371 usb_packet: crc5-ok: "CRC5: 0x11" "CRC5" "C"
4835106-4835396 usb_packet: packet-sof: "SOF 62"
4935106-4935172 usb_packet: sync-ok: "SYNC: 00000001" "SYNC" "S"
4935172-4935238 usb_packet: pid: "PID: SOF" "SOF" "S"
4935238-4935337 usb_packet: framenum: "Frame: 63" "Frame" "Fr" "F"
4935337-4935379 usb_packet: crc5-ok: "CRC5: 0x0E" "CRC5" "C"
4935106-4935404 usb_packet: packet-sof: "SOF 63"
5035106-5035172 usb_packet: sync-ok: "SYNC: 00000001" "SYNC" "S"
5035172-5035238 usb_packet: pid: "PID: SOF" "SOF" "S"
5035238-5035329 usb_packet: framenum: "Frame: 64" "Frame" "Fr" "F"
5035329-5035371 usb_packet: crc5-ok: "CRC5: 0x09" "CRC5" "C"
5035106-5035396 usb_packet: packet-sof: "SOF 64"
5135106-5135172 usb_packet: sync-ok: "SYNC: 00000001" "SYNC" "S"
5135172-5135238 usb_packet: pid: "PID: SOF" "SOF" "S"
5135238-5135329 usb_packet: framenum: "Frame: 65" "Frame" "Fr" "F"
5135329-5135371 usb_packet: crc5-ok: "CRC5: 0x16" "CRC5" "C"
5135106-5135396 usb_packet: packet-sof: "SOF 65"
5235106-5235172 usb_packet: sync-ok: "SYNC: 00000001" "SYNC" "S"
5235172-5235238 usb_packet: pid: "PID: SOF" "SOF" "S"
5235238-5235329 usb_packet: framenum: "Frame: 66" "Frame" "Fr" "F"
5235329-5235371 usb_packet: crc5-ok: "CRC5: 0x1E" "CRC5" "C"
5235106-5235396 usb_packet: packet-sof: "SOF 66"
5335106-5335172 usb_packet: sync-ok: "SYNC: 00000001" "SYNC" "S"
5335172-5335238 usb_packet: pid: "PID: SOF" "SOF" "S"
5335238-5335329 usb_packet: framenum: "Frame: 67" "Frame" "Fr" "F"
5335329-5335371 usb_packet: crc5-ok: "CRC5: 0x01" "CRC5" "C"
5335106-5335396 usb_packet: packet-sof: "SOF 67"
5435106-5435172 usb_packet: sync-ok: "SYNC: 00000001" "SYNC" "S"
5435172-5435238 usb_packet: pid: "PID: SOF" "SOF" "S"
5435238-5435330 usb_packet: framenum: "Frame: 68" "Frame" "Fr" "F"
5435330-5435371 usb_packet: crc5-ok: "CRC5: 0x0E" "CRC5" "C"
5435106-5435396 usb_packet: packet-sof: "SOF 68"
5535106-5535172 usb_packet: sync-ok: "SYNC: 00000001" "SYNC" "S"
5535172-5535238 usb_packet: pid: "PID: SOF" "SOF" "S"
5535238-5535330 usb_packet: framenum: "Frame: 69" "Frame" "Fr" "F"
5535330-5535371 usb_packet: crc5-ok: "CRC5: 0x11" "CRC5" "C"
5535106-5535396 usb_packet: packet-sof: "SOF 69"
5635106-5635172 usb_packet: sync-ok: "SYNC: 00000001" "SYNC" "S"
5635172-5635238 usb_packet: pid: "PID: SOF" "SOF" "S"
5635238-5635329 usb_packet: framenum: "Frame: 70" "Frame" "Fr" "F"
5635329-5635371 usb_packet: crc5-ok: "CRC5: 0x19" "CRC5" "C"
5635106-5635396 usb_packet: packet-sof: "SOF 70"
5735106-5735172 usb_packet: sync-ok: "SYNC: 00000001" "SYNC" "S"
5735172-5735238 usb_packet: pid: "PID: SOF" "SOF" "S"
5735238-5735330 usb_packet: framenum: "Frame: 71" "Frame" "Fr" "F"
5735330-5735371 usb_packet: crc5-ok: "CRC5: 0x06" "CRC5" "C"
5735106-5735396 usb_packet: packet-sof: "SOF 71"
5835106-5835172 usb_packet: sync-ok: "SYNC: 00000001" "SYNC" "S"
5835172-5835238 usb_packet: pid: "PID: SOF" "SOF" "S"
5835238-5835330 usb_packet: framenum: "Frame: 72" "Frame" "Fr" "F"
5835330-5835371 usb_packet: crc5-ok: "CRC5: 0x07" "CRC5" "C"
5835106-5835396 usb_packet: packet-sof: "SOF 72"
5847247-5847313 usb_packet: sync-ok: "SYNC: 00000001" "SYNC" "S"
5847313-5847380 usb_packet: pid: "PID: IN" "IN" "I"
5847380-5847438 usb_packet: addr: "Address: 6" "Addr: 6" "Addr" "A"
5847438-5847471 usb_packet: ep: "Endpoint: 2" "EP: 2" "EP" "E"
5847471-5847513 usb_packet: crc5-ok: "CRC5: 0x17" "CRC5" "C"
5847247-5847538 usb_packet: packet-in: "IN ADDR 6 EP 2"
5847576-5847642 usb_packet: sync-ok: "SYNC: 00000001" "SYNC" "S"
5847642-5847708 usb_packet: pid: "PID: DATA0" "DATA0" "D"
5847708-5847775 usb_packet: data: "Databyte: F0" "Data: F0" "DB: F0" "F0"
5847775-5847841 usb_packet: data: "Databyte: 00" "Data: 00" "DB: 00" "00"
5847841-5847908 usb_packet: data: "Databyte: 00" "Data: 00" "DB: 00" "00"
5847908-5847975 usb_packet: data: "Databyte: 00" "Data: 00" "DB: 00" "00"
5847975-5848042 usb_packet: data: "Databyte: 00" "Data: 00" "DB: 00" "00"
5848042-5848108 usb_packet: data: "Databyte: 00" "Data: 00" "DB: 00" "00"
5848108-5848175 usb_packet: data: "Databyte: 00" "Data: 00" "DB: 00" "00"
5848175-5848241 usb_packet: data: "Databyte: 00" "Data: 00" "DB: 00" "00"
5848241-5848375 usb_packet: crc16-ok: "CRC16: 0xB0B0" "CRC16" "C"
5847576-5848400 usb_packet: packet-data0: "DATA0 [ F0 00 00 00 00 00 00 00 ]"
5848439-5848505 usb_packet: sync-ok: "SYNC: 00000001" "SYNC" "S"
5848505-5848572 usb_packet: pid: "PID: ACK" "ACK" "A"
5848439-5848597 usb_packet: packet-ack: "ACK"
5935106-5935172 usb_packet: sync-ok: "SYNC: 00000001" "SYNC" "S"
5935172-5935238 usb_packet: pid: "PID: SOF" "SOF" "S"
5935238-5935330 usb_packet: framenum: "Frame: 73" "Frame" "Fr" "F"
5935330-5935371 usb_packet: crc5-ok: "CRC5: 0x18" "CRC5" "C"
5935106-5935396 usb_packet: packet-sof: "SOF 73"
6035106-6035172 usb_packet: sync-ok: "SYNC: 00000001" "SYNC" "S"
6035172-6035238 usb_packet: pid: "PID: SOF" "SOF" "S"
6035238-6035330 usb_packet: framenum: "Frame: 74" "Frame" "Fr" "F"
6035330-6035371 usb_packet: crc5-ok: "CRC5: 0x10" "CRC5" "C"
6035106-6035396 usb_packet: packet-sof: "SOF 74"
6135106-6135172 usb_packet: sync-ok: "SYNC: 00000001" "SYNC" "S"
6135172-6135238 usb_packet: pid: "PID: SOF" "SOF" "S"
6135238-6135330 usb_packet: framenum: "Frame: 75" "Frame" "Fr" "F"
6135330-6135371 usb_packet: crc5-ok: "CRC5: 0x0F" "CRC5" "C"
6135106-6135396 usb_packet: packet-sof: "SOF 75"
6235106-6235172 usb_packet: sync-ok: "SYNC: 00000001" "SYNC" "S"
6235172-6235238 usb_packet: pid: "PID: SOF" "SOF" "S"
6235238-6235330 usb_packet: framenum: "Frame: 76" "Frame" "Fr" "F"
6235330-6235371 usb_packet: crc5-ok: "CRC5: 0x00" "CRC5" "C"
6235106-6235396 usb_packet: packet-sof: "SOF 76"
6335106-6335172 usb_packet: sync-ok: "SYNC: 00000001" "SYNC" "S"
6335172-6335238 usb_packet: pid: "PID: SOF" "SOF" "S"
6335238-6335330 usb_packet: framenum: "Frame: 77" "Frame" "Fr" "F"
6335330-6335371 usb_packet: crc5-ok: "CRC5: 0x1F" "CRC5" "C"
6335106-6335396 usb_packet: packet-sof: "SOF 77"
6435106-6435172 usb_packet: sync-ok: "SYNC: 00000001" "SYNC" "S"
6435172-6435238 usb_packet: pid: "PID: SOF" "SOF" "S"
6435238-6435330 usb_packet: framenum: "Frame: 78" "Frame" "Fr" "F"
6435330-6435371 usb_packet: crc5-ok: "CRC5: 0x17" "CRC5" "C"
6435106-6435396 usb_packet: packet-sof: "SOF 78"
6535106-6535172 usb_packet: sync-ok: "SYNC: 00000001" "SYNC" "S"
6535172-6535238 usb_packet: pid: "PID: SOF" "SOF" "S"
6535238-6535330 usb_packet: framenum: "Frame: 79" "Frame" "Fr" "F"
6535330-6535372 usb_packet: crc5-ok: "CRC5: 0x08" "CRC5" "C"
6535106-6535397 usb_packet: packet-sof: "SOF 79"
6635106-6635172 usb_packet: sync-ok: "SYNC: 00000001" "SYNC" "S"
6635172-6635238 usb_packet: pid: "PID: SOF" "SOF" "S"
6635238-6635330 usb_packet: framenum: "Frame: 80" "Frame" "Fr" "F"
6635330-6635371 usb_packet: crc5-ok: "CRC5: 0x15" "CRC5" "C"
6635106-6635397 usb_packet: packet-sof: "SOF 80"
6735106-6735172 usb_packet: sync-ok: "SYNC: 00000001" "SYNC" "S"
6735172-6735238 usb_packet: pid: "PID: SOF" "SOF" "S"
6735238-6735330 usb_packet: framenum: "Frame: 81" "Frame" "Fr" "F"
6735330-6735371 usb_packet: crc5-ok: "CRC5: 0x0A" "CRC5" "C"
6735106-6735396 usb_packet: packet-sof: "SOF 81"
6835106-6835172 usb_packet: sync-ok: "SYNC: 00000001" "SYNC" "S"
6835172-6835238 usb_packet: pid: "PID: SOF" "SOF" "S"
6835238-6835330 usb_packet: framenum: "Frame: 82" "Frame" "Fr" "F"
6835330-6835371 usb_packet: crc5-ok: "CRC5: 0x02" "CRC5" "C"
6835106-6835397 usb_packet: packet-sof: "SOF 82"
6935106-6935172 usb_packet: sync-ok: "SYNC: 00000001" "SYNC" "S"
6935172-6935238 usb_packet: pid: "PID: SOF" "SOF" "S"
6935238-6935330 usb_packet: framenum: "Frame: 83" "Frame" "Fr" "F"
6935330-6935371 usb_packet: crc5-ok: "CRC5: 0x1D" "CRC5" "C"
6935106-6935396 usb_packet: packet-sof: "SOF 83"
7035106-7035172 usb_packet: sync-ok: "SYNC: 00000001" "SYNC" "S"
7035172-7035238 usb_packet: pid: "PID: SOF" "SOF" "S"
7035238-7035330 usb_packet: framenum: "Frame: 84" "Frame" "Fr" "F"
7035330-7035372 usb_packet: crc5-ok: "CRC5: 0x12" "CRC5" "C"
7035106-7035397 usb_packet: packet-sof: "SOF 84"
7047248-7047314 usb_packet: sync-ok: "SYNC: 00000001" "SYNC" "S"
7047314-7047380 usb_packet: pid: "PID: IN" "IN" "I"
7047380-7047438 usb_packet: addr: "Address: 6" "Addr: 6" "Addr" "A"
7047438-7047472 usb_packet: ep: "Endpoint: 2" "EP: 2" "EP" "E"
7047472-7047513 usb_packet: crc5-ok: "CRC5: 0x17" "CRC5" "C"
7047248-7047538 usb_packet: packet-in: "IN ADDR 6 EP 2"
7047577-7047643 usb_packet: sync-ok: "SYNC: 00000001" "SYNC" "S"
7047643-7047709 usb_packet: pid: "PID: DATA1" "DATA1" "D"
7047709-7047776 usb_packet: data: "Databyte: F0" "Data: F0" "DB: F0" "F0"
7047776-7047843 usb_packet: data: "Databyte: 00" "Data: 00" "DB: 00" "00"
7047843-7047909 usb_packet: data: "Databyte: 00" "Data: 00" "DB: 00" "00"
7047909-7047976 usb_packet: data: "Databyte: 00" "Data: 00" "DB: 00" "00"
7047976-7048042 usb_packet: data: "Databyte: 00" "Data: 00" "DB: 00" "00"
7048042-7048109 usb_packet: data: "Databyte: 00" "Data: 00" "DB: 00" "00"
7048109-7048176 usb_packet: data: "Databyte: 00" "Data: 00" "DB: 00" "00"
7048176-7048243 usb_packet: data: "Databyte: 00" "Data: 00" "DB: 00" "00"
7048243-7048376 usb_packet: crc16-ok: "CRC16: 0xB0B0" "CRC16" "C"
7047577-7048401 usb_packet: packet-data1: "DATA1 [ F0 00 00 00 00 00 00 00 ]"
7048448-7048514 usb_packet: sync-ok: "SYNC: 00000001" "SYNC" "S"
7048514-7048580 usb_packet: pid: "PID: ACK" "ACK" "A"
7048448-7048605 usb_packet: packet-ack: "ACK"
7135106-7135172 usb_packet: sync-ok: "SYNC: 00000001" "SYNC" "S"
7135172-7135238 usb_packet: pid: "PID: SOF" "SOF" "S"
7135238-7135330 usb_packet: framenum: "Frame: 85" "Frame" "Fr" "F"
7135330-7135372 usb_packet: crc5-ok: "CRC5: 0x0D" "CRC5" "C"
7135106-7135397 usb_packet: packet-sof: "SOF 85"
7235106-7235172 usb_packet: sync-ok: "SYNC: 00000001" "SYNC" "S"
7235172-7235238 usb_packet: pid: "PID: SOF" "SOF" "S"
7235238-7235330 usb_packet: framenum: "Frame: 86" "Frame" "Fr" "F"
7235330-7235372 usb_packet: crc5-ok: "CRC5: 0x05" "CRC5" "C"
7235106-7235397 usb_packet: packet-sof: "SOF 86"
7335106-7335172 usb_packet: sync-ok: "SYNC: 00000001" "SYNC" "S"
7335172-7335238 usb_packet: pid: "PID: SOF" "SOF" "S"
7335238-7335330 usb_packet: framenum: "Frame: 87" "Frame" "Fr" "F"
7335330-7335371 usb_packet: crc5-ok: "CRC5: 0x1A" "CRC5" "C"
7335106-7335396 usb_packet: packet-sof: "SOF 87"
7435106-7435172 usb_packet: sync-ok: "SYNC: 00000001" "SYNC" "S"
7435172-7435238 usb_packet: pid: "PID: SOF" "SOF" "S"
7435238-7435330 usb_packet: framenum: "Frame: 88" "Frame" "Fr" "F"
7435330-7435371 usb_packet: crc5-ok: "CRC5: 0x1B" "CRC5" "C"
7435106-7435397 usb_packet: packet-sof: "SOF 88"
7535106-7535172 usb_packet: sync-ok: "SYNC: 00000001" "SYNC" "S"
7535172-7535238 usb_packet: pid: "PID: SOF" "SOF" "S"
7535238-7535330 usb_packet: framenum: "Frame: 89" "Frame" "Fr" "F"
7535330-7535372 usb_packet: crc5-ok: "CRC5: 0x04" "CRC5" "C"
7535106-7535397 usb_packet: packet-sof: "SOF 89"
7635106-7635172 usb_packet: sync-ok: "SYNC: 00000001" "SYNC" "S"
7635172-7635238 usb_packet: pid: "PID: SOF" "SOF" "S"
7635238-7635330 usb_packet: framenum: "Frame: 90" "Frame" "Fr" "F"
7635330-7635372 usb_packet: crc5-ok: "CRC5: 0x0C" "CRC5" "C"
7635106-7635397 usb_packet: packet-sof: "SOF 90"
7735106-7735172 usb_packet: sync-ok: "SYNC: 00000001" "SYNC" "S"
7735172-7735238 usb_packet: pid: "PID: SOF" "SOF" "S"
7735238-7735330 usb_packet: framenum: "Frame: 91" "Frame" "Fr" "F"
7735330-7735371 usb_packet: crc5-ok: "CRC5: 0x13" "CRC5" "C"
7735106-7735397 usb_packet: packet-sof: "SOF 91"
7835107-7835173 usb_packet: sync-ok: "SYNC: 00000001" "SYNC" "S"
7835173-7835239 usb_packet: pid: "PID: SOF" "SOF" "S"
7835239-7835330 usb_packet: framenum: "Frame: 92" "Frame" "Fr" "F"
7835330-7835371 usb_packet: crc5-ok: "CRC5: 0x1C" "CRC5" "C"
7835107-7835396 usb_packet: packet-sof: "SOF 92"
7935107-7935173 usb_packet: sync-ok: "SYNC: 00000001" "SYNC" "S"
7935173-7935239 usb_packet: pid: "PID: SOF" "SOF" "S"
7935239-7935330 usb_packet: framenum: "Frame: 93" "Frame" "Fr" "F"
7935330-7935372 usb_packet: crc5-ok: "CRC5: 0x03" "CRC5" "C"
7935107-7935397 usb_packet: packet-sof: "SOF 93"
8035107-8035173 usb_packet: sync-ok: "SYNC: 00000001" "SYNC" "S"
8035173-8035239 usb_packet: pid: "PID: SOF" "SOF" "S"
8035239-8035330 usb_packet: framenum: "Frame: 94" "Frame" "Fr" "F"
8035330-8035372 usb_packet: crc5-ok: "CRC5: 0x0B" "CRC5" "C"
8035107-8035397 usb_packet: packet-sof: "SOF 94"
8135106-8135172 usb_packet: sync-ok: "SYNC: 00000001" "SYNC" "S"
8135172-8135238 usb_packet: pid: "PID: SOF" "SOF" "S"
8135238-8135338 usb_packet: framenum: "Frame: 95" "Frame" "Fr" "F"
8135338-8135380 usb_packet: crc5-ok: "CRC5: 0x14" "CRC5" "C"
8135106-8135405 usb_packet: packet-sof: "SOF 95"
8235107-8235173 usb_packet: sync-ok: "SYNC: 00000001" "SYNC" "S"
8235173-8235239 usb_packet: pid: "PID: SOF" "SOF" "S"
8235239-8235330 usb_packet: framenum: "Frame: 96" "Frame" "Fr" "F"
8235330-8235372 usb_packet: crc5-ok: "CRC5: 0x18" "CRC5" "C"
8235107-8235397 usb_packet: packet-sof: "SOF 96"
8247231-8247297 usb_packet: sync-ok: "SYNC: 00000001" "SYNC" "S"
8247297-8247364 usb_packet: pid: "PID: IN" "IN" "I"
8247364-8247422 usb_packet: addr: "Address: 6" "Addr: 6" "Addr" "A"
8247422-8247455 usb_packet: ep: "Endpoint: 2" "EP: 2" "EP" "E"
8247455-8247497 usb_packet: crc5-ok: "CRC5: 0x17" "CRC5" "C"
8247231-8247522 usb_packet: packet-in: "IN ADDR 6 EP 2"
8247559-8247625 usb_packet: sync-ok: "SYNC: 00000001" "SYNC" "S"
8247625-8247692 usb_packet: pid: "PID: DATA0" "DATA0" "D"
8247692-8247758 usb_packet: data: "Databyte: F0" "Data: F0" "DB: F0" "F0"
8247758-8247825 usb_packet: data: "Databyte: 00" "Data: 00" "DB: 00" "00"
8247825-8247892 usb_packet: data: "Databyte: 00" "Data: 00" "DB: 00" "00"
8247892-8247958 usb_packet: data: "Databyte: 00" "Data: 00" "DB: 00" "00"
8247958-8248025 usb_packet: data: "Databyte: 00" "Data: 00" "DB: 00" "00"
8248025-8248092 usb_packet: data: "Databyte: 00" "Data: 00" "DB: 00" "00"
8248092-8248158 usb_packet: data: "Databyte: 00" "Data: 00" "DB: 00" "00"
8248158-8248225 usb_packet: data: "Databyte: 00" "Data: 00" "DB: 00" "00"
8248225-8248358 usb_packet: crc16-ok: "CRC16: 0xB0B0" "CRC16" "C"
8247559-8248383 usb_packet: packet-data0: "DATA0 [ F0 00 00 00 00 00 00 00 ]"
8248423-8248489 usb_packet: sync-ok: "SYNC: 00000001" "SYNC" "S"
8248489-8248555 usb_packet: pid: "PID: ACK" "ACK" "A"
8248423-8248580 usb_packet: packet-ack: "ACK"
8335107-8335173 usb_packet: sync-ok: "SYNC: 00000001" "SYNC" "S"
8335173-8335239 usb_packet: pid: "PID: SOF" "SOF" "S"
8335239-8335330 usb_packet: framenum: "Frame: 97" "Frame" "Fr" "F"
8335330-8335372 usb_packet: crc5-ok: "CRC5: 0x07" "CRC5" "C"
8335107-8335397 usb_packet: packet-sof: "SOF 97"
