3979018-3983133 onewire_link: reset: "Reset" "Rst" "R"
3983133-3986972 onewire_link: presence: "Presence: true" "Presence" "Pres" "P"
4092348-4092827 onewire_link: bit: "Bit: 0" "0"
4092874-4093353 onewire_link: bit: "Bit: 0" "0"
4093401-4093880 onewire_link: bit: "Bit: 0" "0"
4093927-4094406 onewire_link: bit: "Bit: 0" "0"
4094452-4094931 onewire_link: bit: "Bit: 1" "1"
4094996-4095475 onewire_link: bit: "Bit: 1" "1"
4095540-4096019 onewire_link: bit: "Bit: 1" "1"
4096079-4096558 onewire_link: bit: "Bit: 1" "1"
4100851-4101330 onewire_link: bit: "Bit: 1" "1"
4101391-4101870 onewire_link: bit: "Bit: 0" "0"
4101934-4102413 onewire_link: bit: "Bit: 1" "1"
4102475-4102954 onewire_link: bit: "Bit: 1" "1"
4103015-4103494 onewire_link: bit: "Bit: 0" "0"
4103558-4104037 onewire_link: bit: "Bit: 1" "1"
4104099-4104578 onewire_link: bit: "Bit: 0" "0"
4104639-4105118 onewire_link: bit: "Bit: 1" "1"
4109345-4109824 onewire_link: bit: "Bit: 0" "0"
4109869-4110348 onewire_link: bit: "Bit: 1" "1"
4110411-4110890 onewire_link: bit: "Bit: 0" "0"
4110955-4111434 onewire_link: bit: "Bit: 1" "1"
4111495-4111974 onewire_link: bit: "Bit: 0" "0"
4112036-4112515 onewire_link: bit: "Bit: 1" "1"
4112576-4113055 onewire_link: bit: "Bit: 0" "0"
4113099-4113578 onewire_link: bit: "Bit: 0" "0"
4117842-4118321 onewire_link: bit: "Bit: 1" "1"
4118382-4118861 onewire_link: bit: "Bit: 0" "0"
4118905-4119384 onewire_link: bit: "Bit: 0" "0"
4119448-4119927 onewire_link: bit: "Bit: 1" "1"
4119989-4120468 onewire_link: bit: "Bit: 0" "0"
4120512-4120991 onewire_link: bit: "Bit: 0" "0"
4121055-4121534 onewire_link: bit: "Bit: 1" "1"
4121599-4122078 onewire_link: bit: "Bit: 0" "0"
4126335-4126814 onewire_link: bit: "Bit: 0" "0"
4126878-4127357 onewire_link: bit: "Bit: 1" "1"
4127418-4127897 onewire_link: bit: "Bit: 0" "0"
4127941-4128420 onewire_link: bit: "Bit: 1" "1"
4128484-4128963 onewire_link: bit: "Bit: 0" "0"
4129027-4129506 onewire_link: bit: "Bit: 1" "1"
4129567-4130046 onewire_link: bit: "Bit: 0" "0"
4130107-4130586 onewire_link: bit: "Bit: 1" "1"
4134832-4135311 onewire_link: bit: "Bit: 0" "0"
4135352-4135831 onewire_link: bit: "Bit: 0" "0"
4135898-4136377 onewire_link: bit: "Bit: 1" "1"
4136438-4136917 onewire_link: bit: "Bit: 0" "0"
4136961-4137440 onewire_link: bit: "Bit: 0" "0"
4137503-4137982 onewire_link: bit: "Bit: 1" "1"
4138047-4138526 onewire_link: bit: "Bit: 0" "0"
4138569-4139048 onewire_link: bit: "Bit: 1" "1"
4143325-4143804 onewire_link: bit: "Bit: 0" "0"
4143868-4144347 onewire_link: bit: "Bit: 1" "1"
4144408-4144887 onewire_link: bit: "Bit: 1" "1"
4144948-4145427 onewire_link: bit: "Bit: 0" "0"
4145491-4145970 onewire_link: bit: "Bit: 1" "1"
4146031-4146510 onewire_link: bit: "Bit: 1" "1"
4146572-4147051 onewire_link: bit: "Bit: 0" "0"
4147112-4147591 onewire_link: bit: "Bit: 1" "1"
4151822-4152301 onewire_link: bit: "Bit: 0" "0"
4152361-4152840 onewire_link: bit: "Bit: 1" "1"
4152901-4153380 onewire_link: bit: "Bit: 0" "0"
4153423-4153902 onewire_link: bit: "Bit: 0" "0"
4153970-4154449 onewire_link: bit: "Bit: 1" "1"
4154511-4154990 onewire_link: bit: "Bit: 0" "0"
4155034-4155513 onewire_link: bit: "Bit: 1" "1"
4155576-4156055 onewire_link: bit: "Bit: 0" "0"
4160313-4160792 onewire_link: bit: "Bit: 1" "1"
4160856-4161335 onewire_link: bit: "Bit: 1" "1"
4161396-4161875 onewire_link: bit: "Bit: 0" "0"
4161937-4162416 onewire_link: bit: "Bit: 1" "1"
4162480-4162959 onewire_link: bit: "Bit: 0" "0"
4163020-4163499 onewire_link: bit: "Bit: 1" "1"
4163560-4164039 onewire_link: bit: "Bit: 0" "0"
4164083-4164562 onewire_link: bit: "Bit: 1" "1"
4168810-4169289 onewire_link: bit: "Bit: 0" "0"
4169350-4169829 onewire_link: bit: "Bit: 1" "1"
4169891-4170370 onewire_link: bit: "Bit: 1" "1"
4170430-4170909 onewire_link: bit: "Bit: 0" "0"
4170974-4171453 onewire_link: bit: "Bit: 1" "1"
4171514-4171993 onewire_link: bit: "Bit: 0" "0"
4172055-4172534 onewire_link: bit: "Bit: 1" "1"
4172595-4173074 onewire_link: bit: "Bit: 0" "0"
4177301-4177780 onewire_link: bit: "Bit: 0" "0"
4177845-4178324 onewire_link: bit: "Bit: 1" "1"
4178385-4178864 onewire_link: bit: "Bit: 0" "0"
4178908-4179387 onewire_link: bit: "Bit: 0" "0"
4179451-4179930 onewire_link: bit: "Bit: 1" "1"
4179992-4180471 onewire_link: bit: "Bit: 0" "0"
4180514-4180993 onewire_link: bit: "Bit: 0" "0"
4181060-4181539 onewire_link: bit: "Bit: 1" "1"
4185796-4186275 onewire_link: bit: "Bit: 0" "0"
4186319-4186798 onewire_link: bit: "Bit: 1" "1"
4186862-4187341 onewire_link: bit: "Bit: 0" "0"
4187406-4187885 onewire_link: bit: "Bit: 1" "1"
4187946-4188425 onewire_link: bit: "Bit: 1" "1"
4188486-4188965 onewire_link: bit: "Bit: 0" "0"
4189028-4189507 onewire_link: bit: "Bit: 1" "1"
4189570-4190049 onewire_link: bit: "Bit: 0" "0"
4194292-4194771 onewire_link: bit: "Bit: 1" "1"
4194832-4195311 onewire_link: bit: "Bit: 0" "0"
4195355-4195834 onewire_link: bit: "Bit: 1" "1"
4195897-4196376 onewire_link: bit: "Bit: 0" "0"
4196442-4196921 onewire_link: bit: "Bit: 1" "1"
4196982-4197461 onewire_link: bit: "Bit: 0" "0"
4197521-4198000 onewire_link: bit: "Bit: 1" "1"
4198065-4198544 onewire_link: bit: "Bit: 0" "0"
4202786-4203265 onewire_link: bit: "Bit: 0" "0"
4203326-4203805 onewire_link: bit: "Bit: 1" "1"
4203867-4204346 onewire_link: bit: "Bit: 0" "0"
4204389-4204868 onewire_link: bit: "Bit: 0" "0"
4204936-4205415 onewire_link: bit: "Bit: 1" "1"
4205476-4205955 onewire_link: bit: "Bit: 0" "0"
4205999-4206478 onewire_link: bit: "Bit: 0" "0"
4206542-4207021 onewire_link: bit: "Bit: 1" "1"
4211281-4211760 onewire_link: bit: "Bit: 0" "0"
4211804-4212283 onewire_link: bit: "Bit: 0" "0"
4212346-4212825 onewire_link: bit: "Bit: 1" "1"
4212887-4213366 onewire_link: bit: "Bit: 0" "0"
4213409-4213888 onewire_link: bit: "Bit: 0" "0"
4213956-4214435 onewire_link: bit: "Bit: 1" "1"
4214496-4214975 onewire_link: bit: "Bit: 0" "0"
4215019-4215498 onewire_link: bit: "Bit: 0" "0"
4233259-4233738 onewire_link: bit: "Bit: 1" "1"
4233800-4234279 onewire_link: bit: "Bit: 0" "0"
4234323-4234802 onewire_link: bit: "Bit: 0" "0"
4234870-4235349 onewire_link: bit: "Bit: 1" "1"
4235410-4235889 onewire_link: bit: "Bit: 0" "0"
4235934-4236413 onewire_link: bit: "Bit: 0" "0"
4236476-4236955 onewire_link: bit: "Bit: 1" "1"
4237016-4237495 onewire_link: bit: "Bit: 0" "0"
4241757-4242236 onewire_link: bit: "Bit: 0" "0"
4242300-4242779 onewire_link: bit: "Bit: 1" "1"
4242840-4243319 onewire_link: bit: "Bit: 0" "0"
4243363-4243842 onewire_link: bit: "Bit: 0" "0"
4243906-4244385 onewire_link: bit: "Bit: 1" "1"
4244447-4244926 onewire_link: bit: "Bit: 0" "0"
4244969-4245448 onewire_link: bit: "Bit: 0" "0"
4245516-4245995 onewire_link: bit: "Bit: 1" "1"
4250252-4250731 onewire_link: bit: "Bit: 0" "0"
4250774-4251253 onewire_link: bit: "Bit: 0" "0"
4251321-4251800 onewire_link: bit: "Bit: 1" "1"
4251862-4252341 onewire_link: bit: "Bit: 0" "0"
4252384-4252863 onewire_link: bit: "Bit: 0" "0"
4252927-4253406 onewire_link: bit: "Bit: 1" "1"
4253467-4253946 onewire_link: bit: "Bit: 0" "0"
4253989-4254468 onewire_link: bit: "Bit: 0" "0"
4258748-4259227 onewire_link: bit: "Bit: 1" "1"
4259287-4259766 onewire_link: bit: "Bit: 0" "0"
4259811-4260290 onewire_link: bit: "Bit: 0" "0"
4260354-4260833 onewire_link: bit: "Bit: 1" "1"
4260898-4261377 onewire_link: bit: "Bit: 0" "0"
4261420-4261899 onewire_link: bit: "Bit: 0" "0"
4261962-4262441 onewire_link: bit: "Bit: 1" "1"
4262502-4262981 onewire_link: bit: "Bit: 0" "0"
4267243-4267722 onewire_link: bit: "Bit: 0" "0"
4267782-4268261 onewire_link: bit: "Bit: 1" "1"
4268323-4268802 onewire_link: bit: "Bit: 0" "0"
4268846-4269325 onewire_link: bit: "Bit: 0" "0"
4269390-4269869 onewire_link: bit: "Bit: 1" "1"
4269933-4270412 onewire_link: bit: "Bit: 0" "0"
4270453-4270932 onewire_link: bit: "Bit: 0" "0"
4270999-4271478 onewire_link: bit: "Bit: 1" "1"
4275736-4276215 onewire_link: bit: "Bit: 0" "0"
4276259-4276738 onewire_link: bit: "Bit: 0" "0"
4276802-4277281 onewire_link: bit: "Bit: 1" "1"
4277346-4277825 onewire_link: bit: "Bit: 0" "0"
4277868-4278347 onewire_link: bit: "Bit: 0" "0"
4278411-4278890 onewire_link: bit: "Bit: 1" "1"
4278951-4279430 onewire_link: bit: "Bit: 0" "0"
4279474-4279953 onewire_link: bit: "Bit: 0" "0"
4284232-4284711 onewire_link: bit: "Bit: 1" "1"
4284771-4285250 onewire_link: bit: "Bit: 0" "0"
4285294-4285773 onewire_link: bit: "Bit: 0" "0"
4285840-4286319 onewire_link: bit: "Bit: 1" "1"
4286381-4286860 onewire_link: bit: "Bit: 0" "0"
4286904-4287383 onewire_link: bit: "Bit: 0" "0"
4287446-4287925 onewire_link: bit: "Bit: 1" "1"
4287986-4288465 onewire_link: bit: "Bit: 0" "0"
4292725-4293204 onewire_link: bit: "Bit: 1" "1"
4293265-4293744 onewire_link: bit: "Bit: 0" "0"
4293809-4294288 onewire_link: bit: "Bit: 1" "1"
4294349-4294828 onewire_link: bit: "Bit: 0" "0"
4294889-4295368 onewire_link: bit: "Bit: 1" "1"
4295432-4295911 onewire_link: bit: "Bit: 0" "0"
4295953-4296432 onewire_link: bit: "Bit: 1" "1"
4296498-4296977 onewire_link: bit: "Bit: 0" "0"
4301221-4301700 onewire_link: bit: "Bit: 1" "1"
4301761-4302240 onewire_link: bit: "Bit: 0" "0"
4302302-4302781 onewire_link: bit: "Bit: 1" "1"
4302845-4303324 onewire_link: bit: "Bit: 0" "0"
4303367-4303846 onewire_link: bit: "Bit: 0" "0"
4303909-4304388 onewire_link: bit: "Bit: 1" "1"
4304453-4304932 onewire_link: bit: "Bit: 0" "0"
4304972-4305451 onewire_link: bit: "Bit: 0" "0"
4309715-4310194 onewire_link: bit: "Bit: 1" "1"
4310255-4310734 onewire_link: bit: "Bit: 0" "0"
4310778-4311257 onewire_link: bit: "Bit: 0" "0"
4311323-4311802 onewire_link: bit: "Bit: 1" "1"
4311864-4312343 onewire_link: bit: "Bit: 0" "0"
4312387-4312866 onewire_link: bit: "Bit: 0" "0"
4312930-4313409 onewire_link: bit: "Bit: 1" "1"
4313470-4313949 onewire_link: bit: "Bit: 0" "0"
4345652-4349763 onewire_link: reset: "Reset" "Rst" "R"
4349763-4353602 onewire_link: presence: "Presence: true" "Presence" "Pres" "P"
4467433-4467912 onewire_link: bit: "Bit: 1" "1"
4467974-4468453 onewire_link: bit: "Bit: 0" "0"
4468498-4468977 onewire_link: bit: "Bit: 1" "1"
4469044-4469523 onewire_link: bit: "Bit: 0" "0"
4469567-4470046 onewire_link: bit: "Bit: 1" "1"
4470109-4470588 onewire_link: bit: "Bit: 0" "0"
4470632-4471111 onewire_link: bit: "Bit: 1" "1"
4471176-4471655 onewire_link: bit: "Bit: 0" "0"
4475934-4476413 onewire_link: bit: "Bit: 1" "1"
4476474-4476953 onewire_link: bit: "Bit: 1" "1"
4477014-4477493 onewire_link: bit: "Bit: 0" "0"
4477536-4478015 onewire_link: bit: "Bit: 1" "1"
4478083-4478562 onewire_link: bit: "Bit: 0" "0"
4478606-4479085 onewire_link: bit: "Bit: 0" "0"
4479131-4479610 onewire_link: bit: "Bit: 0" "0"
4479654-4480133 onewire_link: bit: "Bit: 0" "0"
4484430-4484909 onewire_link: bit: "Bit: 0" "0"
4484952-4485431 onewire_link: bit: "Bit: 1" "1"
4485495-4485974 onewire_link: bit: "Bit: 0" "0"
4486019-4486498 onewire_link: bit: "Bit: 0" "0"
4486543-4487022 onewire_link: bit: "Bit: 0" "0"
4487066-4487545 onewire_link: bit: "Bit: 1" "1"
4487612-4488091 onewire_link: bit: "Bit: 1" "1"
4488152-4488631 onewire_link: bit: "Bit: 1" "1"
4492922-4493401 onewire_link: bit: "Bit: 0" "0"
4493445-4493924 onewire_link: bit: "Bit: 0" "0"
4493971-4494450 onewire_link: bit: "Bit: 1" "1"
4494513-4494992 onewire_link: bit: "Bit: 1" "1"
4495056-4495535 onewire_link: bit: "Bit: 0" "0"
4495577-4496056 onewire_link: bit: "Bit: 1" "1"
4496123-4496602 onewire_link: bit: "Bit: 1" "1"
4496662-4497141 onewire_link: bit: "Bit: 0" "0"
4501417-4501896 onewire_link: bit: "Bit: 0" "0"
4501940-4502419 onewire_link: bit: "Bit: 0" "0"
4502466-4502945 onewire_link: bit: "Bit: 0" "0"
4502991-4503470 onewire_link: bit: "Bit: 1" "1"
4503534-4504013 onewire_link: bit: "Bit: 1" "1"
4504074-4504553 onewire_link: bit: "Bit: 0" "0"
4504597-4505076 onewire_link: bit: "Bit: 1" "1"
4505142-4505621 onewire_link: bit: "Bit: 0" "0"
4509912-4510391 onewire_link: bit: "Bit: 0" "0"
4510434-4510913 onewire_link: bit: "Bit: 0" "0"
4510960-4511439 onewire_link: bit: "Bit: 0" "0"
4511486-4511965 onewire_link: bit: "Bit: 0" "0"
4512012-4512491 onewire_link: bit: "Bit: 0" "0"
4512536-4513015 onewire_link: bit: "Bit: 0" "0"
4513059-4513538 onewire_link: bit: "Bit: 0" "0"
4513584-4514063 onewire_link: bit: "Bit: 0" "0"
4518407-4518886 onewire_link: bit: "Bit: 0" "0"
4518930-4519409 onewire_link: bit: "Bit: 0" "0"
4519455-4519934 onewire_link: bit: "Bit: 0" "0"
4519981-4520460 onewire_link: bit: "Bit: 0" "0"
4520506-4520985 onewire_link: bit: "Bit: 0" "0"
4521031-4521510 onewire_link: bit: "Bit: 0" "0"
4521556-4522035 onewire_link: bit: "Bit: 0" "0"
4522082-4522561 onewire_link: bit: "Bit: 0" "0"
4526901-4527380 onewire_link: bit: "Bit: 0" "0"
4527424-4527903 onewire_link: bit: "Bit: 0" "0"
4527949-4528428 onewire_link: bit: "Bit: 0" "0"
4528475-4528954 onewire_link: bit: "Bit: 0" "0"
4529000-4529479 onewire_link: bit: "Bit: 0" "0"
4529525-4530004 onewire_link: bit: "Bit: 0" "0"
4530048-4530527 onewire_link: bit: "Bit: 0" "0"
4530573-4531052 onewire_link: bit: "Bit: 0" "0"
4535397-4535876 onewire_link: bit: "Bit: 1" "1"
4535936-4536415 onewire_link: bit: "Bit: 0" "0"
4536459-4536938 onewire_link: bit: "Bit: 1" "1"
4537002-4537481 onewire_link: bit: "Bit: 0" "0"
4537525-4538004 onewire_link: bit: "Bit: 0" "0"
4538050-4538529 onewire_link: bit: "Bit: 0" "0"
4538576-4539055 onewire_link: bit: "Bit: 0" "0"
4539101-4539580 onewire_link: bit: "Bit: 0" "0"
4561132-4561611 onewire_link: bit: "Bit: 0" "0"
4561656-4562135 onewire_link: bit: "Bit: 1" "1"
4562199-4562678 onewire_link: bit: "Bit: 0" "0"
4562722-4563201 onewire_link: bit: "Bit: 1" "1"
4563265-4563744 onewire_link: bit: "Bit: 0" "0"
4563788-4564267 onewire_link: bit: "Bit: 1" "1"
4564331-4564810 onewire_link: bit: "Bit: 0" "0"
4564853-4565332 onewire_link: bit: "Bit: 1" "1"
4569631-4570110 onewire_link: bit: "Bit: 0" "0"
4570151-4570630 onewire_link: bit: "Bit: 0" "0"
4570678-4571157 onewire_link: bit: "Bit: 0" "0"
4571201-4571680 onewire_link: bit: "Bit: 0" "0"
4571726-4572205 onewire_link: bit: "Bit: 0" "0"
4572251-4572730 onewire_link: bit: "Bit: 0" "0"
4572778-4573257 onewire_link: bit: "Bit: 0" "0"
4573303-4573782 onewire_link: bit: "Bit: 0" "0"
4578123-4578602 onewire_link: bit: "Bit: 0" "0"
4578646-4579125 onewire_link: bit: "Bit: 0" "0"
4579171-4579650 onewire_link: bit: "Bit: 0" "0"
4579697-4580176 onewire_link: bit: "Bit: 0" "0"
4580222-4580701 onewire_link: bit: "Bit: 0" "0"
4580747-4581226 onewire_link: bit: "Bit: 0" "0"
4581273-4581752 onewire_link: bit: "Bit: 0" "0"
4581798-4582277 onewire_link: bit: "Bit: 0" "0"
4601127-4601606 onewire_link: bit: "Bit: 1" "1"
4601669-4602148 onewire_link: bit: "Bit: 1" "1"
4602211-4602690 onewire_link: bit: "Bit: 1" "1"
4602751-4603230 onewire_link: bit: "Bit: 1" "1"
4603292-4603771 onewire_link: bit: "Bit: 1" "1"
4603835-4604314 onewire_link: bit: "Bit: 1" "1"
4604375-4604854 onewire_link: bit: "Bit: 1" "1"
4604915-4605394 onewire_link: bit: "Bit: 1" "1"
4609623-4610102 onewire_link: bit: "Bit: 1" "1"
4610167-4610646 onewire_link: bit: "Bit: 1" "1"
4610707-4611186 onewire_link: bit: "Bit: 1" "1"
4611247-4611726 onewire_link: bit: "Bit: 1" "1"
4611789-4612268 onewire_link: bit: "Bit: 1" "1"
4612331-4612810 onewire_link: bit: "Bit: 1" "1"
4612870-4613349 onewire_link: bit: "Bit: 1" "1"
4613411-4613890 onewire_link: bit: "Bit: 1" "1"
4618118-4618597 onewire_link: bit: "Bit: 1" "1"
4618659-4619138 onewire_link: bit: "Bit: 1" "1"
4619203-4619682 onewire_link: bit: "Bit: 1" "1"
4619743-4620222 onewire_link: bit: "Bit: 1" "1"
4620283-4620762 onewire_link: bit: "Bit: 1" "1"
4620825-4621304 onewire_link: bit: "Bit: 1" "1"
4621368-4621847 onewire_link: bit: "Bit: 1" "1"
4621907-4622386 onewire_link: bit: "Bit: 1" "1"
4626615-4627094 onewire_link: bit: "Bit: 1" "1"
4627155-4627634 onewire_link: bit: "Bit: 1" "1"
4627696-4628175 onewire_link: bit: "Bit: 1" "1"
4628240-4628719 onewire_link: bit: "Bit: 1" "1"
4628779-4629258 onewire_link: bit: "Bit: 1" "1"
4629320-4629799 onewire_link: bit: "Bit: 1" "1"
4629861-4630340 onewire_link: bit: "Bit: 1" "1"
4630404-4630883 onewire_link: bit: "Bit: 1" "1"
4635109-4635588 onewire_link: bit: "Bit: 1" "1"
4635649-4636128 onewire_link: bit: "Bit: 1" "1"
4636193-4636672 onewire_link: bit: "Bit: 1" "1"
4636732-4637211 onewire_link: bit: "Bit: 1" "1"
4637273-4637752 onewire_link: bit: "Bit: 1" "1"
4637816-4638295 onewire_link: bit: "Bit: 1" "1"
4638356-4638835 onewire_link: bit: "Bit: 1" "1"
4638896-4639375 onewire_link: bit: "Bit: 1" "1"
4643603-4644082 onewire_link: bit: "Bit: 1" "1"
4644143-4644622 onewire_link: bit: "Bit: 1" "1"
4644686-4645165 onewire_link: bit: "Bit: 1" "1"
4645228-4645707 onewire_link: bit: "Bit: 1" "1"
4645768-4646247 onewire_link: bit: "Bit: 1" "1"
4646308-4646787 onewire_link: bit: "Bit: 1" "1"
4646851-4647330 onewire_link: bit: "Bit: 1" "1"
4647392-4647871 onewire_link: bit: "Bit: 1" "1"
4652099-4652578 onewire_link: bit: "Bit: 1" "1"
4652638-4653117 onewire_link: bit: "Bit: 1" "1"
4653178-4653657 onewire_link: bit: "Bit: 1" "1"
4653722-4654201 onewire_link: bit: "Bit: 1" "1"
4654263-4654742 onewire_link: bit: "Bit: 1" "1"
4654803-4655282 onewire_link: bit: "Bit: 1" "1"
4655343-4655822 onewire_link: bit: "Bit: 1" "1"
4655887-4656366 onewire_link: bit: "Bit: 1" "1"
4660591-4661070 onewire_link: bit: "Bit: 1" "1"
4661134-4661613 onewire_link: bit: "Bit: 1" "1"
4661674-4662153 onewire_link: bit: "Bit: 1" "1"
4662215-4662694 onewire_link: bit: "Bit: 1" "1"
4662757-4663236 onewire_link: bit: "Bit: 1" "1"
4663298-4663777 onewire_link: bit: "Bit: 1" "1"
4663837-4664316 onewire_link: bit: "Bit: 1" "1"
4664379-4664858 onewire_link: bit: "Bit: 1" "1"
4669084-4669563 onewire_link: bit: "Bit: 1" "1"
4669629-4670108 onewire_link: bit: "Bit: 0" "0"
4670169-4670648 onewire_link: bit: "Bit: 1" "1"
4670708-4671187 onewire_link: bit: "Bit: 1" "1"
4671252-4671731 onewire_link: bit: "Bit: 1" "1"
4671792-4672271 onewire_link: bit: "Bit: 0" "0"
4672333-4672812 onewire_link: bit: "Bit: 0" "0"
4672874-4673353 onewire_link: bit: "Bit: 1" "1"
4677581-4678060 onewire_link: bit: "Bit: 1" "1"
4678123-4678602 onewire_link: bit: "Bit: 0" "0"
4678663-4679142 onewire_link: bit: "Bit: 0" "0"
4679203-4679682 onewire_link: bit: "Bit: 0" "0"
4679745-4680224 onewire_link: bit: "Bit: 0" "0"
4680288-4680767 onewire_link: bit: "Bit: 1" "1"
4680828-4681307 onewire_link: bit: "Bit: 0" "0"
4681369-4681848 onewire_link: bit: "Bit: 1" "1"
