525822-539568 uart: rx-packet: "<Idle,MPos:-277.000,-277.000,-57.500,WPos:0.000,0.000,0.000,Buf:0,RX:0,Lim:000>[0D][0A]"
1773822-1787567 uart: rx-packet: "<Idle,MPos:-277.000,-277.000,-57.500,WPos:0.000,0.000,0.000,Buf:0,RX:0,Lim:000>[0D][0A]"
3021819-3035565 uart: rx-packet: "<Idle,MPos:-277.000,-277.000,-57.500,WPos:0.000,0.000,0.000,Buf:0,RX:0,Lim:000>[0D][0A]"
4269755-4283501 uart: rx-packet: "<Idle,MPos:-277.000,-277.000,-57.500,WPos:0.000,0.000,0.000,Buf:0,RX:0,Lim:000>[0D][0A]"
5523907-5524590 uart: rx-packet: "ok[0D][0A]"
5554696-5568272 uart: rx-packet: "<Run,MPos:-276.987,-277.000,-57.488,WPos:0.013,0.000,0.013,Buf:1,RX:0,Lim:000>[0D][0A]"
5612164-5612847 uart: rx-packet: "ok[0D][0A]"
5628849-5642425 uart: rx-packet: "<Run,MPos:-276.963,-277.000,-57.413,WPos:0.038,0.000,0.088,Buf:2,RX:0,Lim:000>[0D][0A]"
6890490-6904066 uart: rx-packet: "<Run,MPos:-273.800,-277.000,-50.075,WPos:3.200,0.000,7.425,Buf:2,RX:0,Lim:000>[0D][0A]"
8138514-8152260 uart: rx-packet: "<Run,MPos:-270.450,-277.000,-42.263,WPos:6.550,0.000,15.237,Buf:2,RX:0,Lim:000>[0D][0A]"
9386528-9400274 uart: rx-packet: "<Run,MPos:-267.088,-277.000,-34.450,WPos:9.913,0.000,23.050,Buf:2,RX:0,Lim:000>[0D][0A]"
10634425-10648341 uart: rx-packet: "<Run,MPos:-263.725,-277.000,-26.638,WPos:13.275,0.000,30.863,Buf:2,RX:0,Lim:000>[0D][0A]"
11882373-11896289 uart: rx-packet: "<Run,MPos:-260.375,-277.000,-18.825,WPos:16.625,0.000,38.675,Buf:2,RX:0,Lim:000>[0D][0A]"
13130478-13144564 uart: rx-packet: "<Run,MPos:-259.800,-254.363,-17.500,WPos:17.200,22.637,40.000,Buf:1,RX:0,Lim:000>[0D][0A]"
14378410-14392495 uart: rx-packet: "<Run,MPos:-259.800,-223.138,-17.500,WPos:17.200,53.863,40.000,Buf:1,RX:0,Lim:000>[0D][0A]"
15626415-15640500 uart: rx-packet: "<Run,MPos:-259.800,-191.900,-17.500,WPos:17.200,85.100,40.000,Buf:1,RX:0,Lim:000>[0D][0A]"
16874430-16888854 uart: rx-packet: "<Idle,MPos:-259.800,-168.200,-17.500,WPos:17.200,108.800,40.000,Buf:0,RX:0,Lim:000>[0D][0A]"
18126732-18127415 uart: rx-packet: "ok[0D][0A]"
18155116-18169371 uart: rx-packet: "<Run,MPos:-259.800,-168.200,-17.487,WPos:17.200,108.800,40.013,Buf:1,RX:0,Lim:000>[0D][0A]"
19401449-19415704 uart: rx-packet: "<Run,MPos:-259.800,-168.200,-14.963,WPos:17.200,108.800,42.538,Buf:1,RX:0,Lim:000>[0D][0A]"
20649410-20663665 uart: rx-packet: "<Run,MPos:-259.800,-168.200,-12.363,WPos:17.200,108.800,45.138,Buf:1,RX:0,Lim:000>[0D][0A]"
21897370-21911455 uart: rx-packet: "<Run,MPos:-259.800,-168.200,-9.763,WPos:17.200,108.800,47.738,Buf:1,RX:0,Lim:000>[0D][0A]"
23145388-23159473 uart: rx-packet: "<Run,MPos:-259.800,-168.200,-7.150,WPos:17.200,108.800,50.350,Buf:1,RX:0,Lim:000>[0D][0A]"
24393324-24407409 uart: rx-packet: "<Run,MPos:-259.800,-168.200,-4.550,WPos:17.200,108.800,52.950,Buf:1,RX:0,Lim:000>[0D][0A]"
25641306-25655391 uart: rx-packet: "<Run,MPos:-259.800,-168.200,-1.938,WPos:17.200,108.800,55.563,Buf:1,RX:0,Lim:000>[0D][0A]"
26889256-26903511 uart: rx-packet: "<Idle,MPos:-259.800,-168.200,-1.500,WPos:17.200,108.800,56.000,Buf:0,RX:0,Lim:000>[0D][0A]"
28137561-28151816 uart: rx-packet: "<Idle,MPos:-259.800,-168.200,-1.500,WPos:17.200,108.800,56.000,Buf:0,RX:0,Lim:000>[0D][0A]"
29385239-29399493 uart: rx-packet: "<Idle,MPos:-259.800,-168.200,-1.500,WPos:17.200,108.800,56.000,Buf:0,RX:0,Lim:000>[0D][0A]"
30633230-30647485 uart: rx-packet: "<Idle,MPos:-259.800,-168.200,-1.500,WPos:17.200,108.800,56.000,Buf:0,RX:0,Lim:000>[0D][0A]"
31881159-31895414 uart: rx-packet: "<Idle,MPos:-259.800,-168.200,-1.500,WPos:17.200,108.800,56.000,Buf:0,RX:0,Lim:000>[0D][0A]"
33129151-33143406 uart: rx-packet: "<Idle,MPos:-259.800,-168.200,-1.500,WPos:17.200,108.800,56.000,Buf:0,RX:0,Lim:000>[0D][0A]"
34377937-34392192 uart: rx-packet: "<Idle,MPos:-259.800,-168.200,-1.500,WPos:17.200,108.800,56.000,Buf:0,RX:0,Lim:000>[0D][0A]"
35625027-35639282 uart: rx-packet: "<Idle,MPos:-259.800,-168.200,-1.500,WPos:17.200,108.800,56.000,Buf:0,RX:0,Lim:000>[0D][0A]"
36873166-36887421 uart: rx-packet: "<Idle,MPos:-259.800,-168.200,-1.500,WPos:17.200,108.800,56.000,Buf:0,RX:0,Lim:000>[0D][0A]"
38125619-38126302 uart: rx-packet: "ok[0D][0A]"
38154824-38168909 uart: rx-packet: "<Run,MPos:-259.800,-168.200,-1.513,WPos:17.200,108.800,55.988,Buf:1,RX:0,Lim:000>[0D][0A]"
38207756-38208439 uart: rx-packet: "ok[0D][0A]"
38228432-38242517 uart: rx-packet: "<Run,MPos:-259.800,-168.200,-1.588,WPos:17.200,108.800,55.913,Buf:1,RX:0,Lim:000>[0D][0A]"
39479924-39494009 uart: rx-packet: "<Run,MPos:-259.800,-168.200,-4.200,WPos:17.200,108.800,53.300,Buf:1,RX:0,Lim:000>[0D][0A]"
40727812-40741898 uart: rx-packet: "<Run,MPos:-259.800,-168.200,-6.800,WPos:17.200,108.800,50.700,Buf:1,RX:0,Lim:000>[0D][0A]"
41975856-41989941 uart: rx-packet: "<Run,MPos:-259.800,-168.200,-9.413,WPos:17.200,108.800,48.088,Buf:1,RX:0,Lim:000>[0D][0A]"
43223785-43238040 uart: rx-packet: "<Run,MPos:-259.800,-168.200,-12.013,WPos:17.200,108.800,45.488,Buf:1,RX:0,Lim:000>[0D][0A]"
44471812-44486067 uart: rx-packet: "<Run,MPos:-259.800,-168.200,-14.625,WPos:17.200,108.800,42.875,Buf:1,RX:0,Lim:000>[0D][0A]"
45719720-45733974 uart: rx-packet: "<Run,MPos:-259.800,-168.200,-17.225,WPos:17.200,108.800,40.275,Buf:1,RX:0,Lim:000>[0D][0A]"
46967675-46982099 uart: rx-packet: "<Idle,MPos:-259.800,-168.200,-17.500,WPos:17.200,108.800,40.000,Buf:0,RX:0,Lim:000>[0D][0A]"
48222078-48222761 uart: rx-packet: "ok[0D][0A]"
48248599-48262854 uart: rx-packet: "<Run,MPos:-259.775,-168.200,-17.500,WPos:17.225,108.800,40.000,Buf:1,RX:0,Lim:000>[0D][0A]"
48303399-48304082 uart: rx-packet: "ok[0D][0A]"
48322188-48336443 uart: rx-packet: "<Run,MPos:-259.400,-168.200,-17.500,WPos:17.600,108.800,40.000,Buf:2,RX:0,Lim:000>[0D][0A]"
49557304-49571559 uart: rx-packet: "<Run,MPos:-229.913,-168.200,-17.500,WPos:47.087,108.800,40.000,Buf:2,RX:0,Lim:000>[0D][0A]"
50805220-50819475 uart: rx-packet: "<Run,MPos:-198.688,-168.200,-17.500,WPos:78.313,108.800,40.000,Buf:2,RX:0,Lim:000>[0D][0A]"
52053186-52067610 uart: rx-packet: "<Idle,MPos:-184.400,-168.550,-17.500,WPos:92.600,108.450,40.000,Buf:0,RX:0,Lim:000>[0D][0A]"
53306078-53306761 uart: rx-packet: "ok[0D][0A]"
53309524-53323779 uart: rx-packet: "<Run,MPos:-184.400,-168.550,-17.500,WPos:92.600,108.450,40.000,Buf:1,RX:0,Lim:000>[0D][0A]"
54549107-54563362 uart: rx-packet: "<Run,MPos:-184.400,-168.550,-15.038,WPos:92.600,108.450,42.463,Buf:1,RX:0,Lim:000>[0D][0A]"
55797056-55811310 uart: rx-packet: "<Run,MPos:-184.400,-168.550,-12.425,WPos:92.600,108.450,45.075,Buf:1,RX:0,Lim:000>[0D][0A]"
57045032-57059117 uart: rx-packet: "<Run,MPos:-184.400,-168.550,-9.825,WPos:92.600,108.450,47.675,Buf:1,RX:0,Lim:000>[0D][0A]"
58293025-58307110 uart: rx-packet: "<Run,MPos:-184.400,-168.550,-7.225,WPos:92.600,108.450,50.275,Buf:1,RX:0,Lim:000>[0D][0A]"
59540976-59555061 uart: rx-packet: "<Run,MPos:-184.400,-168.550,-4.613,WPos:92.600,108.450,52.888,Buf:1,RX:0,Lim:000>[0D][0A]"
60789000-60803085 uart: rx-packet: "<Run,MPos:-184.400,-168.550,-2.013,WPos:92.600,108.450,55.488,Buf:1,RX:0,Lim:000>[0D][0A]"
62036919-62051174 uart: rx-packet: "<Idle,MPos:-184.400,-168.550,-1.500,WPos:92.600,108.450,56.000,Buf:0,RX:0,Lim:000>[0D][0A]"
63266764-63281019 uart: rx-packet: "<Idle,MPos:-184.400,-168.550,-1.500,WPos:92.600,108.450,56.000,Buf:0,RX:0,Lim:000>[0D][0A]"
64510170-64524425 uart: rx-packet: "<Idle,MPos:-184.400,-168.550,-1.500,WPos:92.600,108.450,56.000,Buf:0,RX:0,Lim:000>[0D][0A]"
65758057-65772312 uart: rx-packet: "<Idle,MPos:-184.400,-168.550,-1.500,WPos:92.600,108.450,56.000,Buf:0,RX:0,Lim:000>[0D][0A]"
67006052-67020307 uart: rx-packet: "<Idle,MPos:-184.400,-168.550,-1.500,WPos:92.600,108.450,56.000,Buf:0,RX:0,Lim:000>[0D][0A]"
68254003-68268258 uart: rx-packet: "<Idle,MPos:-184.400,-168.550,-1.500,WPos:92.600,108.450,56.000,Buf:0,RX:0,Lim:000>[0D][0A]"
69501999-69516254 uart: rx-packet: "<Idle,MPos:-184.400,-168.550,-1.500,WPos:92.600,108.450,56.000,Buf:0,RX:0,Lim:000>[0D][0A]"
70750160-70764414 uart: rx-packet: "<Idle,MPos:-184.400,-168.550,-1.500,WPos:92.600,108.450,56.000,Buf:0,RX:0,Lim:000>[0D][0A]"
71997964-72012219 uart: rx-packet: "<Idle,MPos:-184.400,-168.550,-1.500,WPos:92.600,108.450,56.000,Buf:0,RX:0,Lim:000>[0D][0A]"
73245917-73260172 uart: rx-packet: "<Idle,MPos:-184.400,-168.550,-1.500,WPos:92.600,108.450,56.000,Buf:0,RX:0,Lim:000>[0D][0A]"
74498706-74499389 uart: rx-packet: "ok[0D][0A]"
74531633-74545718 uart: rx-packet: "<Run,MPos:-184.400,-168.550,-1.513,WPos:92.600,108.450,55.988,Buf:1,RX:0,Lim:000>[0D][0A]"
74584328-74585011 uart: rx-packet: "ok[0D][0A]"
74605371-74619456 uart: rx-packet: "<Run,MPos:-184.400,-168.550,-1.600,WPos:92.600,108.450,55.900,Buf:1,RX:0,Lim:000>[0D][0A]"
75831901-75845986 uart: rx-packet: "<Run,MPos:-184.400,-168.550,-4.150,WPos:92.600,108.450,53.350,Buf:1,RX:0,Lim:000>[0D][0A]"
77079849-77093934 uart: rx-packet: "<Run,MPos:-184.400,-168.550,-6.763,WPos:92.600,108.450,50.738,Buf:1,RX:0,Lim:000>[0D][0A]"
78327842-78341927 uart: rx-packet: "<Run,MPos:-184.400,-168.550,-9.363,WPos:92.600,108.450,48.138,Buf:1,RX:0,Lim:000>[0D][0A]"
79575810-79590064 uart: rx-packet: "<Run,MPos:-184.400,-168.550,-11.975,WPos:92.600,108.450,45.525,Buf:1,RX:0,Lim:000>[0D][0A]"
80823807-80838061 uart: rx-packet: "<Run,MPos:-184.400,-168.550,-14.575,WPos:92.600,108.450,42.925,Buf:1,RX:0,Lim:000>[0D][0A]"
82071810-82086065 uart: rx-packet: "<Run,MPos:-184.400,-168.550,-17.175,WPos:92.600,108.450,40.325,Buf:1,RX:0,Lim:000>[0D][0A]"
83319715-83334139 uart: rx-packet: "<Idle,MPos:-184.400,-168.550,-17.500,WPos:92.600,108.450,40.000,Buf:0,RX:0,Lim:000>[0D][0A]"
84573780-84574463 uart: rx-packet: "ok[0D][0A]"
84577376-84591631 uart: rx-packet: "<Run,MPos:-184.400,-168.550,-17.500,WPos:92.600,108.450,40.000,Buf:1,RX:0,Lim:000>[0D][0A]"
84632277-84632960 uart: rx-packet: "ok[0D][0A]"
84651129-84665384 uart: rx-packet: "<Run,MPos:-184.638,-168.550,-17.500,WPos:92.363,108.450,40.000,Buf:2,RX:0,Lim:000>[0D][0A]"
85909299-85923554 uart: rx-packet: "<Run,MPos:-214.288,-168.550,-17.500,WPos:62.712,108.450,40.000,Buf:2,RX:0,Lim:000>[0D][0A]"
87157296-87171551 uart: rx-packet: "<Run,MPos:-245.525,-168.550,-17.500,WPos:31.475,108.450,40.000,Buf:2,RX:0,Lim:000>[0D][0A]"
88405262-88419517 uart: rx-packet: "<Run,MPos:-259.700,-151.538,-17.500,WPos:17.300,125.462,40.000,Buf:1,RX:0,Lim:000>[0D][0A]"
89653215-89667640 uart: rx-packet: "<Idle,MPos:-259.700,-146.350,-17.500,WPos:17.300,130.650,40.000,Buf:0,RX:0,Lim:000>[0D][0A]"
90872447-90886872 uart: rx-packet: "<Idle,MPos:-259.700,-146.350,-17.500,WPos:17.300,130.650,40.000,Buf:0,RX:0,Lim:000>[0D][0A]"
92109702-92124127 uart: rx-packet: "<Idle,MPos:-259.700,-146.350,-17.500,WPos:17.300,130.650,40.000,Buf:0,RX:0,Lim:000>[0D][0A]"
