630435-644181 uart: rx-packet: "<Idle,MPos:-277.000,-277.000,-57.500,WPos:0.000,0.000,0.000,Buf:0,RX:0,Lim:000>[0D][0A]"
1878771-1892517 uart: rx-packet: "<Idle,MPos:-277.000,-277.000,-57.500,WPos:0.000,0.000,0.000,Buf:0,RX:0,Lim:000>[0D][0A]"
3126455-3140201 uart: rx-packet: "<Idle,MPos:-277.000,-277.000,-57.500,WPos:0.000,0.000,0.000,Buf:0,RX:0,Lim:000>[0D][0A]"
4383530-4384213 uart: rx-packet: "ok[0D][0A]"
4407665-4421241 uart: rx-packet: "<Run,MPos:-277.000,-276.987,-57.500,WPos:0.000,0.013,0.000,Buf:1,RX:0,Lim:000>[0D][0A]"
5653495-5667241 uart: rx-packet: "<Run,MPos:-270.888,-258.588,-50.725,WPos:6.112,18.413,6.775,Buf:1,RX:0,Lim:000>[0D][0A]"
6901437-6915522 uart: rx-packet: "<Run,MPos:-263.850,-237.363,-42.913,WPos:13.150,39.637,14.588,Buf:1,RX:0,Lim:000>[0D][0A]"
8149425-8163510 uart: rx-packet: "<Run,MPos:-256.813,-216.138,-35.100,WPos:20.188,60.863,22.400,Buf:1,RX:0,Lim:000>[0D][0A]"
9369057-9383142 uart: rx-packet: "<Run,MPos:-249.938,-195.400,-27.475,WPos:27.063,81.600,30.025,Buf:1,RX:0,Lim:000>[0D][0A]"
10577030-10591285 uart: rx-packet: "<Run,MPos:-243.125,-174.850,-19.913,WPos:33.875,102.150,37.588,Buf:1,RX:0,Lim:000>[0D][0A]"
11823525-11837950 uart: rx-packet: "<Idle,MPos:-240.950,-168.288,-17.500,WPos:36.050,108.712,40.000,Buf:0,RX:0,Lim:000>[0D][0A]"
13076298-13076981 uart: rx-packet: "ok[0D][0A]"
13106345-13120599 uart: rx-packet: "<Run,MPos:-240.950,-168.288,-17.487,WPos:36.050,108.712,40.013,Buf:1,RX:0,Lim:000>[0D][0A]"
14350583-14364838 uart: rx-packet: "<Run,MPos:-240.950,-168.288,-14.975,WPos:36.050,108.712,42.525,Buf:1,RX:0,Lim:000>[0D][0A]"
15598549-15612804 uart: rx-packet: "<Run,MPos:-240.950,-168.288,-12.363,WPos:36.050,108.712,45.138,Buf:1,RX:0,Lim:000>[0D][0A]"
16846550-16860635 uart: rx-packet: "<Run,MPos:-240.950,-168.288,-9.763,WPos:36.050,108.712,47.738,Buf:1,RX:0,Lim:000>[0D][0A]"
18094571-18108657 uart: rx-packet: "<Run,MPos:-240.950,-168.288,-7.150,WPos:36.050,108.712,50.350,Buf:1,RX:0,Lim:000>[0D][0A]"
19342568-19356653 uart: rx-packet: "<Run,MPos:-240.950,-168.288,-4.550,WPos:36.050,108.712,52.950,Buf:1,RX:0,Lim:000>[0D][0A]"
20590512-20604598 uart: rx-packet: "<Run,MPos:-240.950,-168.288,-1.950,WPos:36.050,108.712,55.550,Buf:1,RX:0,Lim:000>[0D][0A]"
21838487-21852742 uart: rx-packet: "<Idle,MPos:-240.950,-168.288,-1.500,WPos:36.050,108.712,56.000,Buf:0,RX:0,Lim:000>[0D][0A]"
23086437-23100692 uart: rx-packet: "<Idle,MPos:-240.950,-168.288,-1.500,WPos:36.050,108.712,56.000,Buf:0,RX:0,Lim:000>[0D][0A]"
24334408-24348663 uart: rx-packet: "<Idle,MPos:-240.950,-168.288,-1.500,WPos:36.050,108.712,56.000,Buf:0,RX:0,Lim:000>[0D][0A]"
25589754-25604009 uart: rx-packet: "<Idle,MPos:-240.950,-168.288,-1.500,WPos:36.050,108.712,56.000,Buf:0,RX:0,Lim:000>[0D][0A]"
26830265-26844519 uart: rx-packet: "<Idle,MPos:-240.950,-168.288,-1.500,WPos:36.050,108.712,56.000,Buf:0,RX:0,Lim:000>[0D][0A]"
28078236-28092490 uart: rx-packet: "<Idle,MPos:-240.950,-168.288,-1.500,WPos:36.050,108.712,56.000,Buf:0,RX:0,Lim:000>[0D][0A]"
29334672-29348927 uart: rx-packet: "<Idle,MPos:-240.950,-168.288,-1.500,WPos:36.050,108.712,56.000,Buf:0,RX:0,Lim:000>[0D][0A]"
30605444-30619699 uart: rx-packet: "<Idle,MPos:-240.950,-168.288,-1.500,WPos:36.050,108.712,56.000,Buf:0,RX:0,Lim:000>[0D][0A]"
31853729-31867984 uart: rx-packet: "<Idle,MPos:-240.950,-168.288,-1.500,WPos:36.050,108.712,56.000,Buf:0,RX:0,Lim:000>[0D][0A]"
33101384-33115639 uart: rx-packet: "<Idle,MPos:-240.950,-168.288,-1.500,WPos:36.050,108.712,56.000,Buf:0,RX:0,Lim:000>[0D][0A]"
34349502-34363756 uart: rx-packet: "<Idle,MPos:-240.950,-168.288,-1.500,WPos:36.050,108.712,56.000,Buf:0,RX:0,Lim:000>[0D][0A]"
35597348-35611602 uart: rx-packet: "<Idle,MPos:-240.950,-168.288,-1.500,WPos:36.050,108.712,56.000,Buf:0,RX:0,Lim:000>[0D][0A]"
36845465-36859720 uart: rx-packet: "<Idle,MPos:-240.950,-168.288,-1.500,WPos:36.050,108.712,56.000,Buf:0,RX:0,Lim:000>[0D][0A]"
38093373-38107628 uart: rx-packet: "<Idle,MPos:-240.950,-168.288,-1.500,WPos:36.050,108.712,56.000,Buf:0,RX:0,Lim:000>[0D][0A]"
39341804-39356059 uart: rx-packet: "<Idle,MPos:-240.950,-168.288,-1.500,WPos:36.050,108.712,56.000,Buf:0,RX:0,Lim:000>[0D][0A]"
40589313-40603568 uart: rx-packet: "<Idle,MPos:-240.950,-168.288,-1.500,WPos:36.050,108.712,56.000,Buf:0,RX:0,Lim:000>[0D][0A]"
41837348-41851603 uart: rx-packet: "<Idle,MPos:-240.950,-168.288,-1.500,WPos:36.050,108.712,56.000,Buf:0,RX:0,Lim:000>[0D][0A]"
43085213-43099468 uart: rx-packet: "<Idle,MPos:-240.950,-168.288,-1.500,WPos:36.050,108.712,56.000,Buf:0,RX:0,Lim:000>[0D][0A]"
44333185-44347440 uart: rx-packet: "<Idle,MPos:-240.950,-168.288,-1.500,WPos:36.050,108.712,56.000,Buf:0,RX:0,Lim:000>[0D][0A]"
45581114-45595369 uart: rx-packet: "<Idle,MPos:-240.950,-168.288,-1.500,WPos:36.050,108.712,56.000,Buf:0,RX:0,Lim:000>[0D][0A]"
46829125-46843380 uart: rx-packet: "<Idle,MPos:-240.950,-168.288,-1.500,WPos:36.050,108.712,56.000,Buf:0,RX:0,Lim:000>[0D][0A]"
48077286-48091541 uart: rx-packet: "<Idle,MPos:-240.950,-168.288,-1.500,WPos:36.050,108.712,56.000,Buf:0,RX:0,Lim:000>[0D][0A]"
49342923-49357178 uart: rx-packet: "<Idle,MPos:-240.950,-168.288,-1.500,WPos:36.050,108.712,56.000,Buf:0,RX:0,Lim:000>[0D][0A]"
50604264-50618518 uart: rx-packet: "<Idle,MPos:-240.950,-168.288,-1.500,WPos:36.050,108.712,56.000,Buf:0,RX:0,Lim:000>[0D][0A]"
51852214-51866469 uart: rx-packet: "<Idle,MPos:-240.950,-168.288,-1.500,WPos:36.050,108.712,56.000,Buf:0,RX:0,Lim:000>[0D][0A]"
53100249-53114504 uart: rx-packet: "<Idle,MPos:-240.950,-168.288,-1.500,WPos:36.050,108.712,56.000,Buf:0,RX:0,Lim:000>[0D][0A]"
54348219-54362474 uart: rx-packet: "<Idle,MPos:-240.950,-168.288,-1.500,WPos:36.050,108.712,56.000,Buf:0,RX:0,Lim:000>[0D][0A]"
55596108-55610363 uart: rx-packet: "<Idle,MPos:-240.950,-168.288,-1.500,WPos:36.050,108.712,56.000,Buf:0,RX:0,Lim:000>[0D][0A]"
56844414-56858669 uart: rx-packet: "<Idle,MPos:-240.950,-168.288,-1.500,WPos:36.050,108.712,56.000,Buf:0,RX:0,Lim:000>[0D][0A]"
58092195-58106450 uart: rx-packet: "<Idle,MPos:-240.950,-168.288,-1.500,WPos:36.050,108.712,56.000,Buf:0,RX:0,Lim:000>[0D][0A]"
59340020-59354275 uart: rx-packet: "<Idle,MPos:-240.950,-168.288,-1.500,WPos:36.050,108.712,56.000,Buf:0,RX:0,Lim:000>[0D][0A]"
60588138-60602393 uart: rx-packet: "<Idle,MPos:-240.950,-168.288,-1.500,WPos:36.050,108.712,56.000,Buf:0,RX:0,Lim:000>[0D][0A]"
61836046-61850301 uart: rx-packet: "<Idle,MPos:-240.950,-168.288,-1.500,WPos:36.050,108.712,56.000,Buf:0,RX:0,Lim:000>[0D][0A]"
63116542-63130797 uart: rx-packet: "<Idle,MPos:-240.950,-168.288,-1.500,WPos:36.050,108.712,56.000,Buf:0,RX:0,Lim:000>[0D][0A]"
64363152-64377407 uart: rx-packet: "<Idle,MPos:-240.950,-168.288,-1.500,WPos:36.050,108.712,56.000,Buf:0,RX:0,Lim:000>[0D][0A]"
65611122-65625377 uart: rx-packet: "<Idle,MPos:-240.950,-168.288,-1.500,WPos:36.050,108.712,56.000,Buf:0,RX:0,Lim:000>[0D][0A]"
66859450-66873705 uart: rx-packet: "<Idle,MPos:-240.950,-168.288,-1.500,WPos:36.050,108.712,56.000,Buf:0,RX:0,Lim:000>[0D][0A]"
68107379-68121634 uart: rx-packet: "<Idle,MPos:-240.950,-168.288,-1.500,WPos:36.050,108.712,56.000,Buf:0,RX:0,Lim:000>[0D][0A]"
69355205-69369460 uart: rx-packet: "<Idle,MPos:-240.950,-168.288,-1.500,WPos:36.050,108.712,56.000,Buf:0,RX:0,Lim:000>[0D][0A]"
70603533-70617788 uart: rx-packet: "<Idle,MPos:-240.950,-168.288,-1.500,WPos:36.050,108.712,56.000,Buf:0,RX:0,Lim:000>[0D][0A]"
71851399-71865654 uart: rx-packet: "<Idle,MPos:-240.950,-168.288,-1.500,WPos:36.050,108.712,56.000,Buf:0,RX:0,Lim:000>[0D][0A]"
73099097-73113352 uart: rx-packet: "<Idle,MPos:-240.950,-168.288,-1.500,WPos:36.050,108.712,56.000,Buf:0,RX:0,Lim:000>[0D][0A]"
74347027-74361282 uart: rx-packet: "<Idle,MPos:-240.950,-168.288,-1.500,WPos:36.050,108.712,56.000,Buf:0,RX:0,Lim:000>[0D][0A]"
75569808-75584062 uart: rx-packet: "<Idle,MPos:-240.950,-168.288,-1.500,WPos:36.050,108.712,56.000,Buf:0,RX:0,Lim:000>[0D][0A]"
76781146-76795401 uart: rx-packet: "<Idle,MPos:-240.950,-168.288,-1.500,WPos:36.050,108.712,56.000,Buf:0,RX:0,Lim:000>[0D][0A]"
77985003-77999258 uart: rx-packet: "<Idle,MPos:-240.950,-168.288,-1.500,WPos:36.050,108.712,56.000,Buf:0,RX:0,Lim:000>[0D][0A]"
79203048-79217303 uart: rx-packet: "<Idle,MPos:-240.950,-168.288,-1.500,WPos:36.050,108.712,56.000,Buf:0,RX:0,Lim:000>[0D][0A]"
80413067-80427322 uart: rx-packet: "<Idle,MPos:-240.950,-168.288,-1.500,WPos:36.050,108.712,56.000,Buf:0,RX:0,Lim:000>[0D][0A]"
81621052-81635307 uart: rx-packet: "<Idle,MPos:-240.950,-168.288,-1.500,WPos:36.050,108.712,56.000,Buf:0,RX:0,Lim:000>[0D][0A]"
82831363-82845618 uart: rx-packet: "<Idle,MPos:-240.950,-168.288,-1.500,WPos:36.050,108.712,56.000,Buf:0,RX:0,Lim:000>[0D][0A]"
84039141-84053395 uart: rx-packet: "<Idle,MPos:-240.950,-168.288,-1.500,WPos:36.050,108.712,56.000,Buf:0,RX:0,Lim:000>[0D][0A]"
85247229-85261484 uart: rx-packet: "<Idle,MPos:-240.950,-168.288,-1.500,WPos:36.050,108.712,56.000,Buf:0,RX:0,Lim:000>[0D][0A]"
86455278-86469533 uart: rx-packet: "<Idle,MPos:-240.950,-168.288,-1.500,WPos:36.050,108.712,56.000,Buf:0,RX:0,Lim:000>[0D][0A]"
87663473-87677728 uart: rx-packet: "<Idle,MPos:-240.950,-168.288,-1.500,WPos:36.050,108.712,56.000,Buf:0,RX:0,Lim:000>[0D][0A]"
88871354-88885609 uart: rx-packet: "<Idle,MPos:-240.950,-168.288,-1.500,WPos:36.050,108.712,56.000,Buf:0,RX:0,Lim:000>[0D][0A]"
90085313-90099568 uart: rx-packet: "<Idle,MPos:-240.950,-168.288,-1.500,WPos:36.050,108.712,56.000,Buf:0,RX:0,Lim:000>[0D][0A]"
91287430-91301685 uart: rx-packet: "<Idle,MPos:-240.950,-168.288,-1.500,WPos:36.050,108.712,56.000,Buf:0,RX:0,Lim:000>[0D][0A]"
92495540-92509795 uart: rx-packet: "<Idle,MPos:-240.950,-168.288,-1.500,WPos:36.050,108.712,56.000,Buf:0,RX:0,Lim:000>[0D][0A]"
93703527-93717782 uart: rx-packet: "<Idle,MPos:-240.950,-168.288,-1.500,WPos:36.050,108.712,56.000,Buf:0,RX:0,Lim:000>[0D][0A]"
94919663-94933918 uart: rx-packet: "<Idle,MPos:-240.950,-168.288,-1.500,WPos:36.050,108.712,56.000,Buf:0,RX:0,Lim:000>[0D][0A]"
96127523-96141778 uart: rx-packet: "<Idle,MPos:-240.950,-168.288,-1.500,WPos:36.050,108.712,56.000,Buf:0,RX:0,Lim:000>[0D][0A]"
97335654-97349909 uart: rx-packet: "<Idle,MPos:-240.950,-168.288,-1.500,WPos:36.050,108.712,56.000,Buf:0,RX:0,Lim:000>[0D][0A]"
98543682-98557936 uart: rx-packet: "<Idle,MPos:-240.950,-168.288,-1.500,WPos:36.050,108.712,56.000,Buf:0,RX:0,Lim:000>[0D][0A]"
99751668-99765923 uart: rx-packet: "<Idle,MPos:-240.950,-168.288,-1.500,WPos:36.050,108.712,56.000,Buf:0,RX:0,Lim:000>[0D][0A]"
100963886-100978141 uart: rx-packet: "<Idle,MPos:-240.950,-168.288,-1.500,WPos:36.050,108.712,56.000,Buf:0,RX:0,Lim:000>[0D][0A]"
102167827-102182082 uart: rx-packet: "<Idle,MPos:-240.950,-168.288,-1.500,WPos:36.050,108.712,56.000,Buf:0,RX:0,Lim:000>[0D][0A]"
103375875-103390130 uart: rx-packet: "<Idle,MPos:-240.950,-168.288,-1.500,WPos:36.050,108.712,56.000,Buf:0,RX:0,Lim:000>[0D][0A]"
104595492-104609747 uart: rx-packet: "<Idle,MPos:-240.950,-168.288,-1.500,WPos:36.050,108.712,56.000,Buf:0,RX:0,Lim:000>[0D][0A]"
105803854-105818109 uart: rx-packet: "<Idle,MPos:-240.950,-168.288,-1.500,WPos:36.050,108.712,56.000,Buf:0,RX:0,Lim:000>[0D][0A]"
107019971-107034226 uart: rx-packet: "<Idle,MPos:-240.950,-168.288,-1.500,WPos:36.050,108.712,56.000,Buf:0,RX:0,Lim:000>[0D][0A]"
108226547-108227230 uart: rx-packet: "ok[0D][0A]"
108237663-108251748 uart: rx-packet: "<Run,MPos:-240.950,-168.288,-1.500,WPos:36.050,108.712,56.000,Buf:1,RX:0,Lim:000>[0D][0A]"
108290666-108291349 uart: rx-packet: "ok[0D][0A]"
108311183-108325268 uart: rx-packet: "<Run,MPos:-240.950,-168.288,-1.563,WPos:36.050,108.712,55.938,Buf:1,RX:0,Lim:000>[0D][0A]"
109524123-109538208 uart: rx-packet: "<Run,MPos:-240.950,-168.288,-4.075,WPos:36.050,108.712,53.425,Buf:1,RX:0,Lim:000>[0D][0A]"
110726148-110740233 uart: rx-packet: "<Run,MPos:-240.950,-168.288,-6.588,WPos:36.050,108.712,50.913,Buf:1,RX:0,Lim:000>[0D][0A]"
111934183-111948268 uart: rx-packet: "<Run,MPos:-240.950,-168.288,-9.113,WPos:36.050,108.712,48.388,Buf:1,RX:0,Lim:000>[0D][0A]"
113142373-113156628 uart: rx-packet: "<Run,MPos:-240.950,-168.288,-11.638,WPos:36.050,108.712,45.863,Buf:1,RX:0,Lim:000>[0D][0A]"
114354281-114368536 uart: rx-packet: "<Run,MPos:-240.950,-168.288,-14.163,WPos:36.050,108.712,43.338,Buf:1,RX:0,Lim:000>[0D][0A]"
115558294-115572549 uart: rx-packet: "<Run,MPos:-240.950,-168.288,-16.675,WPos:36.050,108.712,40.825,Buf:1,RX:0,Lim:000>[0D][0A]"
116768338-116782763 uart: rx-packet: "<Idle,MPos:-240.950,-168.288,-17.500,WPos:36.050,108.712,40.000,Buf:0,RX:0,Lim:000>[0D][0A]"
117984852-117985535 uart: rx-packet: "ok[0D][0A]"
117989993-118004248 uart: rx-packet: "<Run,MPos:-240.950,-168.288,-17.500,WPos:36.050,108.712,40.000,Buf:1,RX:0,Lim:000>[0D][0A]"
119196429-119210684 uart: rx-packet: "<Run,MPos:-214.163,-168.413,-17.500,WPos:62.837,108.587,40.000,Buf:1,RX:0,Lim:000>[0D][0A]"
120404513-120418768 uart: rx-packet: "<Run,MPos:-185.013,-168.550,-17.500,WPos:91.988,108.450,40.000,Buf:1,RX:0,Lim:000>[0D][0A]"
121614500-121628924 uart: rx-packet: "<Idle,MPos:-184.400,-168.550,-17.500,WPos:92.600,108.450,40.000,Buf:0,RX:0,Lim:000>[0D][0A]"
122827114-122827797 uart: rx-packet: "ok[0D][0A]"
122836628-122850882 uart: rx-packet: "<Run,MPos:-184.400,-168.550,-17.500,WPos:92.600,108.450,40.000,Buf:1,RX:0,Lim:000>[0D][0A]"
124044570-124058825 uart: rx-packet: "<Run,MPos:-184.400,-168.550,-15.088,WPos:92.600,108.450,42.413,Buf:1,RX:0,Lim:000>[0D][0A]"
125252707-125266962 uart: rx-packet: "<Run,MPos:-184.400,-168.550,-12.563,WPos:92.600,108.450,44.938,Buf:1,RX:0,Lim:000>[0D][0A]"
126461053-126475308 uart: rx-packet: "<Run,MPos:-184.400,-168.550,-10.050,WPos:92.600,108.450,47.450,Buf:1,RX:0,Lim:000>[0D][0A]"
127668700-127682786 uart: rx-packet: "<Run,MPos:-184.400,-168.550,-7.525,WPos:92.600,108.450,49.975,Buf:1,RX:0,Lim:000>[0D][0A]"
128876762-128890847 uart: rx-packet: "<Run,MPos:-184.400,-168.550,-5.000,WPos:92.600,108.450,52.500,Buf:1,RX:0,Lim:000>[0D][0A]"
130084799-130098884 uart: rx-packet: "<Run,MPos:-184.400,-168.550,-2.488,WPos:92.600,108.450,55.013,Buf:1,RX:0,Lim:000>[0D][0A]"
131292901-131307155 uart: rx-packet: "<Idle,MPos:-184.400,-168.550,-1.500,WPos:92.600,108.450,56.000,Buf:0,RX:0,Lim:000>[0D][0A]"
132500932-132515187 uart: rx-packet: "<Idle,MPos:-184.400,-168.550,-1.500,WPos:92.600,108.450,56.000,Buf:0,RX:0,Lim:000>[0D][0A]"
133709004-133723259 uart: rx-packet: "<Idle,MPos:-184.400,-168.550,-1.500,WPos:92.600,108.450,56.000,Buf:0,RX:0,Lim:000>[0D][0A]"
134917036-134931291 uart: rx-packet: "<Idle,MPos:-184.400,-168.550,-1.500,WPos:92.600,108.450,56.000,Buf:0,RX:0,Lim:000>[0D][0A]"
136129048-136143303 uart: rx-packet: "<Idle,MPos:-184.400,-168.550,-1.500,WPos:92.600,108.450,56.000,Buf:0,RX:0,Lim:000>[0D][0A]"
137333034-137347289 uart: rx-packet: "<Idle,MPos:-184.400,-168.550,-1.500,WPos:92.600,108.450,56.000,Buf:0,RX:0,Lim:000>[0D][0A]"
138548861-138563116 uart: rx-packet: "<Idle,MPos:-184.400,-168.550,-1.500,WPos:92.600,108.450,56.000,Buf:0,RX:0,Lim:000>[0D][0A]"
139755279-139769534 uart: rx-packet: "<Idle,MPos:-184.400,-168.550,-1.500,WPos:92.600,108.450,56.000,Buf:0,RX:0,Lim:000>[0D][0A]"
140963183-140977438 uart: rx-packet: "<Idle,MPos:-184.400,-168.550,-1.500,WPos:92.600,108.450,56.000,Buf:0,RX:0,Lim:000>[0D][0A]"
142177186-142191441 uart: rx-packet: "<Idle,MPos:-184.400,-168.550,-1.500,WPos:92.600,108.450,56.000,Buf:0,RX:0,Lim:000>[0D][0A]"
143384377-143385060 uart: rx-packet: "ok[0D][0A]"
143396552-143410637 uart: rx-packet: "<Run,MPos:-184.400,-168.550,-1.500,WPos:92.600,108.450,56.000,Buf:1,RX:0,Lim:000>[0D][0A]"
143450960-143451643 uart: rx-packet: "ok[0D][0A]"
143470220-143484305 uart: rx-packet: "<Run,MPos:-184.400,-168.550,-1.563,WPos:92.600,108.450,55.938,Buf:1,RX:0,Lim:000>[0D][0A]"
144677369-144691454 uart: rx-packet: "<Run,MPos:-184.400,-168.550,-4.075,WPos:92.600,108.450,53.425,Buf:1,RX:0,Lim:000>[0D][0A]"
145885364-145899449 uart: rx-packet: "<Run,MPos:-184.400,-168.550,-6.600,WPos:92.600,108.450,50.900,Buf:1,RX:0,Lim:000>[0D][0A]"
147093377-147107462 uart: rx-packet: "<Run,MPos:-184.400,-168.550,-9.113,WPos:92.600,108.450,48.388,Buf:1,RX:0,Lim:000>[0D][0A]"
148301571-148315826 uart: rx-packet: "<Run,MPos:-184.400,-168.550,-11.638,WPos:92.600,108.450,45.863,Buf:1,RX:0,Lim:000>[0D][0A]"
149509588-149523843 uart: rx-packet: "<Run,MPos:-184.400,-168.550,-14.163,WPos:92.600,108.450,43.338,Buf:1,RX:0,Lim:000>[0D][0A]"
150717519-150731774 uart: rx-packet: "<Run,MPos:-184.400,-168.550,-16.675,WPos:92.600,108.450,40.825,Buf:1,RX:0,Lim:000>[0D][0A]"
151927559-151941984 uart: rx-packet: "<Idle,MPos:-184.400,-168.550,-17.500,WPos:92.600,108.450,40.000,Buf:0,RX:0,Lim:000>[0D][0A]"
153143467-153144150 uart: rx-packet: "ok[0D][0A]"
153148949-153163203 uart: rx-packet: "<Run,MPos:-184.400,-168.550,-17.500,WPos:92.600,108.450,40.000,Buf:1,RX:0,Lim:000>[0D][0A]"
154357662-154371917 uart: rx-packet: "<Run,MPos:-210.275,-160.925,-17.500,WPos:66.725,116.075,40.000,Buf:1,RX:0,Lim:000>[0D][0A]"
155565746-155580001 uart: rx-packet: "<Run,MPos:-239.288,-152.363,-17.500,WPos:37.712,124.638,40.000,Buf:1,RX:0,Lim:000>[0D][0A]"
156775704-156790128 uart: rx-packet: "<Idle,MPos:-259.700,-146.350,-17.500,WPos:17.300,130.650,40.000,Buf:0,RX:0,Lim:000>[0D][0A]"
157988365-157989048 uart: rx-packet: "ok[0D][0A]"
157997536-158011791 uart: rx-packet: "<Run,MPos:-259.700,-146.350,-17.500,WPos:17.300,130.650,40.000,Buf:1,RX:0,Lim:000>[0D][0A]"
159205922-159220177 uart: rx-packet: "<Run,MPos:-259.700,-146.350,-15.088,WPos:17.300,130.650,42.413,Buf:1,RX:0,Lim:000>[0D][0A]"
160413854-160428109 uart: rx-packet: "<Run,MPos:-259.700,-146.350,-12.563,WPos:17.300,130.650,44.938,Buf:1,RX:0,Lim:000>[0D][0A]"
161622040-161636295 uart: rx-packet: "<Run,MPos:-259.700,-146.350,-10.050,WPos:17.300,130.650,47.450,Buf:1,RX:0,Lim:000>[0D][0A]"
162830014-162844100 uart: rx-packet: "<Run,MPos:-259.700,-146.350,-7.525,WPos:17.300,130.650,49.975,Buf:1,RX:0,Lim:000>[0D][0A]"
164037978-164052063 uart: rx-packet: "<Run,MPos:-259.700,-146.350,-5.000,WPos:17.300,130.650,52.500,Buf:1,RX:0,Lim:000>[0D][0A]"
165246192-165260277 uart: rx-packet: "<Run,MPos:-259.700,-146.350,-2.475,WPos:17.300,130.650,55.025,Buf:1,RX:0,Lim:000>[0D][0A]"
166454100-166468355 uart: rx-packet: "<Idle,MPos:-259.700,-146.350,-1.500,WPos:17.300,130.650,56.000,Buf:0,RX:0,Lim:000>[0D][0A]"
167664210-167678464 uart: rx-packet: "<Idle,MPos:-259.700,-146.350,-1.500,WPos:17.300,130.650,56.000,Buf:0,RX:0,Lim:000>[0D][0A]"
168872184-168886439 uart: rx-packet: "<Idle,MPos:-259.700,-146.350,-1.500,WPos:17.300,130.650,56.000,Buf:0,RX:0,Lim:000>[0D][0A]"
170115281-170129535 uart: rx-packet: "<Idle,MPos:-259.700,-146.350,-1.500,WPos:17.300,130.650,56.000,Buf:0,RX:0,Lim:000>[0D][0A]"
171322248-171336503 uart: rx-packet: "<Idle,MPos:-259.700,-146.350,-1.500,WPos:17.300,130.650,56.000,Buf:0,RX:0,Lim:000>[0D][0A]"
172542209-172556463 uart: rx-packet: "<Idle,MPos:-259.700,-146.350,-1.500,WPos:17.300,130.650,56.000,Buf:0,RX:0,Lim:000>[0D][0A]"
173754248-173768503 uart: rx-packet: "<Idle,MPos:-259.700,-146.350,-1.500,WPos:17.300,130.650,56.000,Buf:0,RX:0,Lim:000>[0D][0A]"
174958387-174972642 uart: rx-packet: "<Idle,MPos:-259.700,-146.350,-1.500,WPos:17.300,130.650,56.000,Buf:0,RX:0,Lim:000>[0D][0A]"
176167784-176182039 uart: rx-packet: "<Idle,MPos:-259.700,-146.350,-1.500,WPos:17.300,130.650,56.000,Buf:0,RX:0,Lim:000>[0D][0A]"
177376846-177377529 uart: rx-packet: "ok[0D][0A]"
177390751-177404836 uart: rx-packet: "<Run,MPos:-259.700,-146.350,-1.513,WPos:17.300,130.650,55.988,Buf:1,RX:0,Lim:000>[0D][0A]"
177445017-177445700 uart: rx-packet: "ok[0D][0A]"
177464223-177478309 uart: rx-packet: "<Run,MPos:-259.700,-146.350,-1.575,WPos:17.300,130.650,55.925,Buf:1,RX:0,Lim:000>[0D][0A]"
178672797-178686883 uart: rx-packet: "<Run,MPos:-259.700,-146.350,-4.075,WPos:17.300,130.650,53.425,Buf:1,RX:0,Lim:000>[0D][0A]"
179880551-179894636 uart: rx-packet: "<Run,MPos:-259.700,-146.350,-6.600,WPos:17.300,130.650,50.900,Buf:1,RX:0,Lim:000>[0D][0A]"
181088574-181102659 uart: rx-packet: "<Run,MPos:-259.700,-146.350,-9.125,WPos:17.300,130.650,48.375,Buf:1,RX:0,Lim:000>[0D][0A]"
182296644-182310899 uart: rx-packet: "<Run,MPos:-259.700,-146.350,-11.650,WPos:17.300,130.650,45.850,Buf:1,RX:0,Lim:000>[0D][0A]"
183504756-183519011 uart: rx-packet: "<Run,MPos:-259.700,-146.350,-14.163,WPos:17.300,130.650,43.338,Buf:1,RX:0,Lim:000>[0D][0A]"
184712699-184726953 uart: rx-packet: "<Run,MPos:-259.700,-146.350,-16.688,WPos:17.300,130.650,40.813,Buf:1,RX:0,Lim:000>[0D][0A]"
185920737-185935161 uart: rx-packet: "<Idle,MPos:-259.700,-146.350,-17.500,WPos:17.300,130.650,40.000,Buf:0,RX:0,Lim:000>[0D][0A]"
187135881-187136564 uart: rx-packet: "ok[0D][0A]"
187146582-187160837 uart: rx-packet: "<Run,MPos:-259.700,-146.350,-17.500,WPos:17.300,130.650,40.000,Buf:1,RX:0,Lim:000>[0D][0A]"
188354884-188369139 uart: rx-packet: "<Run,MPos:-262.862,-170.238,-17.500,WPos:14.138,106.763,40.000,Buf:1,RX:0,Lim:000>[0D][0A]"
189565110-189579195 uart: rx-packet: "<Run,MPos:-266.838,-200.288,-17.500,WPos:10.163,76.712,40.000,Buf:1,RX:0,Lim:000>[0D][0A]"
190772924-190786839 uart: rx-packet: "<Run,MPos:-270.813,-230.275,-17.500,WPos:6.188,46.725,40.000,Buf:1,RX:0,Lim:000>[0D][0A]"
191983078-191996993 uart: rx-packet: "<Run,MPos:-274.788,-260.325,-17.500,WPos:2.212,16.675,40.000,Buf:1,RX:0,Lim:000>[0D][0A]"
193191010-193204926 uart: rx-packet: "<Idle,MPos:-277.000,-277.000,-17.500,WPos:0.000,0.000,40.000,Buf:0,RX:0,Lim:000>[0D][0A]"
194401095-194415011 uart: rx-packet: "<Idle,MPos:-277.000,-277.000,-17.500,WPos:0.000,0.000,40.000,Buf:0,RX:0,Lim:000>[0D][0A]"
