5-14 uart: tx-start: "Start bit" "Start" "S"
14-23 uart: tx-data-bits: "0"
23-32 uart: tx-data-bits: "0"
31-40 uart: tx-data-bits: "0"
40-49 uart: tx-data-bits: "1"
49-58 uart: tx-data-bits: "0"
57-66 uart: tx-data-bits: "0"
66-75 uart: tx-data-bits: "1"
75-84 uart: tx-data-bits: "0"
14-84 uart: tx-data: "H"
83-92 uart: tx-stop: "Stop bit" "Stop" "T"
92-101 uart: tx-start: "Start bit" "Start" "S"
101-110 uart: tx-data-bits: "1"
110-119 uart: tx-data-bits: "0"
118-127 uart: tx-data-bits: "1"
127-136 uart: tx-data-bits: "0"
136-145 uart: tx-data-bits: "0"
144-153 uart: tx-data-bits: "1"
153-162 uart: tx-data-bits: "1"
162-171 uart: tx-data-bits: "0"
101-171 uart: tx-data: "e"
170-179 uart: tx-stop: "Stop bit" "Stop" "T"
179-188 uart: tx-start: "Start bit" "Start" "S"
188-197 uart: tx-data-bits: "0"
197-206 uart: tx-data-bits: "0"
205-214 uart: tx-data-bits: "1"
214-223 uart: tx-data-bits: "1"
223-232 uart: tx-data-bits: "0"
231-240 uart: tx-data-bits: "1"
240-249 uart: tx-data-bits: "1"
249-258 uart: tx-data-bits: "0"
188-258 uart: tx-data: "l"
257-266 uart: tx-stop: "Stop bit" "Stop" "T"
265-274 uart: tx-start: "Start bit" "Start" "S"
274-283 uart: tx-data-bits: "0"
283-292 uart: tx-data-bits: "0"
291-300 uart: tx-data-bits: "1"
300-309 uart: tx-data-bits: "1"
309-318 uart: tx-data-bits: "0"
317-326 uart: tx-data-bits: "1"
326-335 uart: tx-data-bits: "1"
335-344 uart: tx-data-bits: "0"
274-344 uart: tx-data: "l"
343-352 uart: tx-stop: "Stop bit" "Stop" "T"
352-361 uart: tx-start: "Start bit" "Start" "S"
361-370 uart: tx-data-bits: "1"
370-379 uart: tx-data-bits: "1"
378-387 uart: tx-data-bits: "1"
387-396 uart: tx-data-bits: "1"
396-405 uart: tx-data-bits: "0"
404-413 uart: tx-data-bits: "1"
413-422 uart: tx-data-bits: "1"
422-431 uart: tx-data-bits: "0"
361-431 uart: tx-data: "o"
430-439 uart: tx-stop: "Stop bit" "Stop" "T"
439-448 uart: tx-start: "Start bit" "Start" "S"
448-457 uart: tx-data-bits: "0"
457-466 uart: tx-data-bits: "0"
465-474 uart: tx-data-bits: "0"
474-483 uart: tx-data-bits: "0"
483-492 uart: tx-data-bits: "0"
491-500 uart: tx-data-bits: "1"
500-509 uart: tx-data-bits: "0"
509-518 uart: tx-data-bits: "0"
448-518 uart: tx-data: " "
517-526 uart: tx-stop: "Stop bit" "Stop" "T"
526-535 uart: tx-start: "Start bit" "Start" "S"
535-544 uart: tx-data-bits: "1"
544-553 uart: tx-data-bits: "1"
552-561 uart: tx-data-bits: "1"
561-570 uart: tx-data-bits: "0"
570-579 uart: tx-data-bits: "1"
578-587 uart: tx-data-bits: "0"
587-596 uart: tx-data-bits: "1"
596-605 uart: tx-data-bits: "0"
535-605 uart: tx-data: "W"
604-613 uart: tx-stop: "Stop bit" "Stop" "T"
613-622 uart: tx-start: "Start bit" "Start" "S"
622-631 uart: tx-data-bits: "1"
631-640 uart: tx-data-bits: "1"
639-648 uart: tx-data-bits: "1"
648-657 uart: tx-data-bits: "1"
657-666 uart: tx-data-bits: "0"
665-674 uart: tx-data-bits: "1"
674-683 uart: tx-data-bits: "1"
683-692 uart: tx-data-bits: "0"
622-692 uart: tx-data: "o"
691-700 uart: tx-stop: "Stop bit" "Stop" "T"
699-708 uart: tx-start: "Start bit" "Start" "S"
708-717 uart: tx-data-bits: "0"
717-726 uart: tx-data-bits: "1"
725-734 uart: tx-data-bits: "0"
734-743 uart: tx-data-bits: "0"
743-752 uart: tx-data-bits: "1"
751-760 uart: tx-data-bits: "1"
760-769 uart: tx-data-bits: "1"
769-778 uart: tx-data-bits: "0"
708-778 uart: tx-data: "r"
777-786 uart: tx-stop: "Stop bit" "Stop" "T"
786-795 uart: tx-start: "Start bit" "Start" "S"
795-804 uart: tx-data-bits: "0"
804-813 uart: tx-data-bits: "0"
812-821 uart: tx-data-bits: "1"
821-830 uart: tx-data-bits: "1"
830-839 uart: tx-data-bits: "0"
838-847 uart: tx-data-bits: "1"
847-856 uart: tx-data-bits: "1"
856-865 uart: tx-data-bits: "0"
795-865 uart: tx-data: "l"
864-873 uart: tx-stop: "Stop bit" "Stop" "T"
873-882 uart: tx-start: "Start bit" "Start" "S"
882-891 uart: tx-data-bits: "0"
891-900 uart: tx-data-bits: "0"
899-908 uart: tx-data-bits: "1"
908-917 uart: tx-data-bits: "0"
917-926 uart: tx-data-bits: "0"
925-934 uart: tx-data-bits: "1"
934-943 uart: tx-data-bits: "1"
943-952 uart: tx-data-bits: "0"
882-952 uart: tx-data: "d"
951-960 uart: tx-stop: "Stop bit" "Stop" "T"
960-969 uart: tx-start: "Start bit" "Start" "S"
969-978 uart: tx-data-bits: "1"
978-987 uart: tx-data-bits: "0"
986-995 uart: tx-data-bits: "0"
995-1004 uart: tx-data-bits: "0"
1004-1013 uart: tx-data-bits: "0"
1012-1021 uart: tx-data-bits: "1"
1021-1030 uart: tx-data-bits: "0"
1030-1039 uart: tx-data-bits: "0"
969-1039 uart: tx-data: "!"
1038-1047 uart: tx-stop: "Stop bit" "Stop" "T"
1047-1056 uart: tx-start: "Start bit" "Start" "S"
1056-1065 uart: tx-data-bits: "1"
1065-1074 uart: tx-data-bits: "0"
1073-1082 uart: tx-data-bits: "1"
1082-1091 uart: tx-data-bits: "1"
1091-1100 uart: tx-data-bits: "0"
1099-1108 uart: tx-data-bits: "0"
1108-1117 uart: tx-data-bits: "0"
1117-1126 uart: tx-data-bits: "0"
1056-1126 uart: tx-data: "[0D]"
1125-1134 uart: tx-stop: "Stop bit" "Stop" "T"
1134-1143 uart: tx-start: "Start bit" "Start" "S"
1143-1152 uart: tx-data-bits: "0"
1152-1161 uart: tx-data-bits: "1"
1160-1169 uart: tx-data-bits: "0"
1169-1178 uart: tx-data-bits: "1"
1178-1187 uart: tx-data-bits: "0"
1186-1195 uart: tx-data-bits: "0"
1195-1204 uart: tx-data-bits: "0"
1204-1213 uart: tx-data-bits: "0"
1143-1213 uart: tx-data: "[0A]"
1212-1221 uart: tx-stop: "Stop bit" "Stop" "T"
1220-1229 uart: tx-start: "Start bit" "Start" "S"
1229-1238 uart: tx-data-bits: "0"
1238-1247 uart: tx-data-bits: "0"
1246-1255 uart: tx-data-bits: "0"
1255-1264 uart: tx-data-bits: "1"
1264-1273 uart: tx-data-bits: "0"
1272-1281 uart: tx-data-bits: "0"
1281-1290 uart: tx-data-bits: "1"
1290-1299 uart: tx-data-bits: "0"
1229-1299 uart: tx-data: "H"
1298-1307 uart: tx-stop: "Stop bit" "Stop" "T"
1307-1316 uart: tx-start: "Start bit" "Start" "S"
1316-1325 uart: tx-data-bits: "1"
1325-1334 uart: tx-data-bits: "0"
1333-1342 uart: tx-data-bits: "1"
1342-1351 uart: tx-data-bits: "0"
1351-1360 uart: tx-data-bits: "0"
1359-1368 uart: tx-data-bits: "1"
1368-1377 uart: tx-data-bits: "1"
1377-1386 uart: tx-data-bits: "0"
1316-1386 uart: tx-data: "e"
1385-1394 uart: tx-stop: "Stop bit" "Stop" "T"
1394-1403 uart: tx-start: "Start bit" "Start" "S"
1403-1412 uart: tx-data-bits: "0"
1412-1421 uart: tx-data-bits: "0"
1420-1429 uart: tx-data-bits: "1"
1429-1438 uart: tx-data-bits: "1"
1438-1447 uart: tx-data-bits: "0"
1446-1455 uart: tx-data-bits: "1"
1455-1464 uart: tx-data-bits: "1"
1464-1473 uart: tx-data-bits: "0"
1403-1473 uart: tx-data: "l"
1472-1481 uart: tx-stop: "Stop bit" "Stop" "T"
1481-1490 uart: tx-start: "Start bit" "Start" "S"
1490-1499 uart: tx-data-bits: "0"
1499-1508 uart: tx-data-bits: "0"
1507-1516 uart: tx-data-bits: "1"
1516-1525 uart: tx-data-bits: "1"
1525-1534 uart: tx-data-bits: "0"
1533-1542 uart: tx-data-bits: "1"
1542-1551 uart: tx-data-bits: "1"
1551-1560 uart: tx-data-bits: "0"
1490-1560 uart: tx-data: "l"
1559-1568 uart: tx-stop: "Stop bit" "Stop" "T"
1568-1577 uart: tx-start: "Start bit" "Start" "S"
1577-1586 uart: tx-data-bits: "1"
1586-1595 uart: tx-data-bits: "1"
1594-1603 uart: tx-data-bits: "1"
1603-1612 uart: tx-data-bits: "1"
1612-1621 uart: tx-data-bits: "0"
1620-1629 uart: tx-data-bits: "1"
1629-1638 uart: tx-data-bits: "1"
1638-1647 uart: tx-data-bits: "0"
1577-1647 uart: tx-data: "o"
1646-1655 uart: tx-stop: "Stop bit" "Stop" "T"
1654-1663 uart: tx-start: "Start bit" "Start" "S"
1663-1672 uart: tx-data-bits: "0"
1672-1681 uart: tx-data-bits: "0"
1680-1689 uart: tx-data-bits: "0"
1689-1698 uart: tx-data-bits: "0"
1698-1707 uart: tx-data-bits: "0"
1706-1715 uart: tx-data-bits: "1"
1715-1724 uart: tx-data-bits: "0"
1724-1733 uart: tx-data-bits: "0"
1663-1733 uart: tx-data: " "
1732-1741 uart: tx-stop: "Stop bit" "Stop" "T"
1741-1750 uart: tx-start: "Start bit" "Start" "S"
1750-1759 uart: tx-data-bits: "1"
1759-1768 uart: tx-data-bits: "1"
1767-1776 uart: tx-data-bits: "1"
1776-1785 uart: tx-data-bits: "0"
1785-1794 uart: tx-data-bits: "1"
1793-1802 uart: tx-data-bits: "0"
1802-1811 uart: tx-data-bits: "1"
1811-1820 uart: tx-data-bits: "0"
1750-1820 uart: tx-data: "W"
1819-1828 uart: tx-stop: "Stop bit" "Stop" "T"
1828-1837 uart: tx-start: "Start bit" "Start" "S"
1837-1846 uart: tx-data-bits: "1"
1846-1855 uart: tx-data-bits: "1"
1854-1863 uart: tx-data-bits: "1"
1863-1872 uart: tx-data-bits: "1"
1872-1881 uart: tx-data-bits: "0"
1880-1889 uart: tx-data-bits: "1"
1889-1898 uart: tx-data-bits: "1"
1898-1907 uart: tx-data-bits: "0"
1837-1907 uart: tx-data: "o"
1906-1915 uart: tx-stop: "Stop bit" "Stop" "T"
1915-1924 uart: tx-start: "Start bit" "Start" "S"
1924-1933 uart: tx-data-bits: "0"
1933-1942 uart: tx-data-bits: "1"
1941-1950 uart: tx-data-bits: "0"
1950-1959 uart: tx-data-bits: "0"
1959-1968 uart: tx-data-bits: "1"
1967-1976 uart: tx-data-bits: "1"
1976-1985 uart: tx-data-bits: "1"
1985-1994 uart: tx-data-bits: "0"
1924-1994 uart: tx-data: "r"
1993-2002 uart: tx-stop: "Stop bit" "Stop" "T"
2002-2011 uart: tx-start: "Start bit" "Start" "S"
2011-2020 uart: tx-data-bits: "0"
2020-2029 uart: tx-data-bits: "0"
2028-2037 uart: tx-data-bits: "1"
2037-2046 uart: tx-data-bits: "1"
2046-2055 uart: tx-data-bits: "0"
2054-2063 uart: tx-data-bits: "1"
2063-2072 uart: tx-data-bits: "1"
2072-2081 uart: tx-data-bits: "0"
2011-2081 uart: tx-data: "l"
2080-2089 uart: tx-stop: "Stop bit" "Stop" "T"
2088-2097 uart: tx-start: "Start bit" "Start" "S"
2097-2106 uart: tx-data-bits: "0"
2106-2115 uart: tx-data-bits: "0"
2114-2123 uart: tx-data-bits: "1"
2123-2132 uart: tx-data-bits: "0"
2132-2141 uart: tx-data-bits: "0"
2140-2149 uart: tx-data-bits: "1"
2149-2158 uart: tx-data-bits: "1"
2158-2167 uart: tx-data-bits: "0"
2097-2167 uart: tx-data: "d"
2166-2175 uart: tx-stop: "Stop bit" "Stop" "T"
2175-2184 uart: tx-start: "Start bit" "Start" "S"
2184-2193 uart: tx-data-bits: "1"
2193-2202 uart: tx-data-bits: "0"
2201-2210 uart: tx-data-bits: "0"
2210-2219 uart: tx-data-bits: "0"
2219-2228 uart: tx-data-bits: "0"
2227-2236 uart: tx-data-bits: "1"
2236-2245 uart: tx-data-bits: "0"
2245-2254 uart: tx-data-bits: "0"
2184-2254 uart: tx-data: "!"
2253-2262 uart: tx-stop: "Stop bit" "Stop" "T"
2262-2271 uart: tx-start: "Start bit" "Start" "S"
2271-2280 uart: tx-data-bits: "1"
2280-2289 uart: tx-data-bits: "0"
2288-2297 uart: tx-data-bits: "1"
2297-2306 uart: tx-data-bits: "1"
2306-2315 uart: tx-data-bits: "0"
2314-2323 uart: tx-data-bits: "0"
2323-2332 uart: tx-data-bits: "0"
2332-2341 uart: tx-data-bits: "0"
2271-2341 uart: tx-data: "[0D]"
2340-2349 uart: tx-stop: "Stop bit" "Stop" "T"
2349-2358 uart: tx-start: "Start bit" "Start" "S"
2358-2367 uart: tx-data-bits: "0"
2367-2376 uart: tx-data-bits: "1"
2375-2384 uart: tx-data-bits: "0"
2384-2393 uart: tx-data-bits: "1"
2393-2402 uart: tx-data-bits: "0"
2401-2410 uart: tx-data-bits: "0"
2410-2419 uart: tx-data-bits: "0"
2419-2428 uart: tx-data-bits: "0"
2358-2428 uart: tx-data: "[0A]"
2427-2436 uart: tx-stop: "Stop bit" "Stop" "T"
2436-2445 uart: tx-start: "Start bit" "Start" "S"
2445-2454 uart: tx-data-bits: "0"
2454-2463 uart: tx-data-bits: "0"
2462-2471 uart: tx-data-bits: "0"
2471-2480 uart: tx-data-bits: "1"
2480-2489 uart: tx-data-bits: "0"
2488-2497 uart: tx-data-bits: "0"
2497-2506 uart: tx-data-bits: "1"
2506-2515 uart: tx-data-bits: "0"
2445-2515 uart: tx-data: "H"
2514-2523 uart: tx-stop: "Stop bit" "Stop" "T"
2522-2531 uart: tx-start: "Start bit" "Start" "S"
2531-2540 uart: tx-data-bits: "1"
2540-2549 uart: tx-data-bits: "0"
2548-2557 uart: tx-data-bits: "1"
2557-2566 uart: tx-data-bits: "0"
2566-2575 uart: tx-data-bits: "0"
2574-2583 uart: tx-data-bits: "1"
2583-2592 uart: tx-data-bits: "1"
2592-2601 uart: tx-data-bits: "0"
2531-2601 uart: tx-data: "e"
2600-2609 uart: tx-stop: "Stop bit" "Stop" "T"
2609-2618 uart: tx-start: "Start bit" "Start" "S"
2618-2627 uart: tx-data-bits: "0"
2627-2636 uart: tx-data-bits: "0"
2635-2644 uart: tx-data-bits: "1"
2644-2653 uart: tx-data-bits: "1"
2653-2662 uart: tx-data-bits: "0"
2661-2670 uart: tx-data-bits: "1"
2670-2679 uart: tx-data-bits: "1"
2679-2688 uart: tx-data-bits: "0"
2618-2688 uart: tx-data: "l"
2687-2696 uart: tx-stop: "Stop bit" "Stop" "T"
2696-2705 uart: tx-start: "Start bit" "Start" "S"
2705-2714 uart: tx-data-bits: "0"
2714-2723 uart: tx-data-bits: "0"
2722-2731 uart: tx-data-bits: "1"
2731-2740 uart: tx-data-bits: "1"
2740-2749 uart: tx-data-bits: "0"
2748-2757 uart: tx-data-bits: "1"
2757-2766 uart: tx-data-bits: "1"
2766-2775 uart: tx-data-bits: "0"
2705-2775 uart: tx-data: "l"
2774-2783 uart: tx-stop: "Stop bit" "Stop" "T"
2783-2792 uart: tx-start: "Start bit" "Start" "S"
2792-2801 uart: tx-data-bits: "1"
2801-2810 uart: tx-data-bits: "1"
2809-2818 uart: tx-data-bits: "1"
2818-2827 uart: tx-data-bits: "1"
2827-2836 uart: tx-data-bits: "0"
2835-2844 uart: tx-data-bits: "1"
2844-2853 uart: tx-data-bits: "1"
2853-2862 uart: tx-data-bits: "0"
2792-2862 uart: tx-data: "o"
2861-2870 uart: tx-stop: "Stop bit" "Stop" "T"
2870-2879 uart: tx-start: "Start bit" "Start" "S"
2879-2888 uart: tx-data-bits: "0"
2888-2897 uart: tx-data-bits: "0"
2896-2905 uart: tx-data-bits: "0"
2905-2914 uart: tx-data-bits: "0"
2914-2923 uart: tx-data-bits: "0"
2922-2931 uart: tx-data-bits: "1"
2931-2940 uart: tx-data-bits: "0"
2940-2949 uart: tx-data-bits: "0"
2879-2949 uart: tx-data: " "
2948-2957 uart: tx-stop: "Stop bit" "Stop" "T"
2956-2965 uart: tx-start: "Start bit" "Start" "S"
2965-2974 uart: tx-data-bits: "1"
2974-2983 uart: tx-data-bits: "1"
2982-2991 uart: tx-data-bits: "1"
2991-3000 uart: tx-data-bits: "0"
3000-3009 uart: tx-data-bits: "1"
3008-3017 uart: tx-data-bits: "0"
3017-3026 uart: tx-data-bits: "1"
3026-3035 uart: tx-data-bits: "0"
2965-3035 uart: tx-data: "W"
3034-3043 uart: tx-stop: "Stop bit" "Stop" "T"
3043-3052 uart: tx-start: "Start bit" "Start" "S"
3052-3061 uart: tx-data-bits: "1"
3061-3070 uart: tx-data-bits: "1"
3069-3078 uart: tx-data-bits: "1"
3078-3087 uart: tx-data-bits: "1"
3087-3096 uart: tx-data-bits: "0"
3095-3104 uart: tx-data-bits: "1"
3104-3113 uart: tx-data-bits: "1"
3113-3122 uart: tx-data-bits: "0"
3052-3122 uart: tx-data: "o"
3121-3130 uart: tx-stop: "Stop bit" "Stop" "T"
3130-3139 uart: tx-start: "Start bit" "Start" "S"
3139-3148 uart: tx-data-bits: "0"
3148-3157 uart: tx-data-bits: "1"
3156-3165 uart: tx-data-bits: "0"
3165-3174 uart: tx-data-bits: "0"
3174-3183 uart: tx-data-bits: "1"
3182-3191 uart: tx-data-bits: "1"
3191-3200 uart: tx-data-bits: "1"
3200-3209 uart: tx-data-bits: "0"
3139-3209 uart: tx-data: "r"
3208-3217 uart: tx-stop: "Stop bit" "Stop" "T"
3217-3226 uart: tx-start: "Start bit" "Start" "S"
3226-3235 uart: tx-data-bits: "0"
3235-3244 uart: tx-data-bits: "0"
3243-3252 uart: tx-data-bits: "1"
3252-3261 uart: tx-data-bits: "1"
3261-3270 uart: tx-data-bits: "0"
3269-3278 uart: tx-data-bits: "1"
3278-3287 uart: tx-data-bits: "1"
3287-3296 uart: tx-data-bits: "0"
3226-3296 uart: tx-data: "l"
3295-3304 uart: tx-stop: "Stop bit" "Stop" "T"
3304-3313 uart: tx-start: "Start bit" "Start" "S"
3313-3322 uart: tx-data-bits: "0"
3322-3331 uart: tx-data-bits: "0"
3330-3339 uart: tx-data-bits: "1"
3339-3348 uart: tx-data-bits: "0"
3348-3357 uart: tx-data-bits: "0"
3356-3365 uart: tx-data-bits: "1"
3365-3374 uart: tx-data-bits: "1"
3374-3383 uart: tx-data-bits: "0"
3313-3383 uart: tx-data: "d"
3382-3391 uart: tx-stop: "Stop bit" "Stop" "T"
3390-3399 uart: tx-start: "Start bit" "Start" "S"
3399-3408 uart: tx-data-bits: "1"
3408-3417 uart: tx-data-bits: "0"
3416-3425 uart: tx-data-bits: "0"
3425-3434 uart: tx-data-bits: "0"
3434-3443 uart: tx-data-bits: "0"
3442-3451 uart: tx-data-bits: "1"
3451-3460 uart: tx-data-bits: "0"
3460-3469 uart: tx-data-bits: "0"
3399-3469 uart: tx-data: "!"
3468-3477 uart: tx-stop: "Stop bit" "Stop" "T"
3477-3486 uart: tx-start: "Start bit" "Start" "S"
3486-3495 uart: tx-data-bits: "1"
3495-3504 uart: tx-data-bits: "0"
3503-3512 uart: tx-data-bits: "1"
3512-3521 uart: tx-data-bits: "1"
3521-3530 uart: tx-data-bits: "0"
3529-3538 uart: tx-data-bits: "0"
3538-3547 uart: tx-data-bits: "0"
3547-3556 uart: tx-data-bits: "0"
3486-3556 uart: tx-data: "[0D]"
3555-3564 uart: tx-stop: "Stop bit" "Stop" "T"
3564-3573 uart: tx-start: "Start bit" "Start" "S"
3573-3582 uart: tx-data-bits: "0"
3582-3591 uart: tx-data-bits: "1"
3590-3599 uart: tx-data-bits: "0"
3599-3608 uart: tx-data-bits: "1"
3608-3617 uart: tx-data-bits: "0"
3616-3625 uart: tx-data-bits: "0"
3625-3634 uart: tx-data-bits: "0"
3634-3643 uart: tx-data-bits: "0"
3573-3643 uart: tx-data: "[0A]"
3642-3651 uart: tx-stop: "Stop bit" "Stop" "T"
