4-9 uart: tx-start: "Start bit" "Start" "S"
9-14 uart: tx-data-bits: "0"
15-20 uart: tx-data-bits: "0"
20-25 uart: tx-data-bits: "0"
25-30 uart: tx-data-bits: "1"
31-36 uart: tx-data-bits: "0"
36-41 uart: tx-data-bits: "0"
42-47 uart: tx-data-bits: "1"
47-52 uart: tx-data-bits: "0"
9-52 uart: tx-data: "H"
53-58 uart: tx-parity-ok: "Stop bit" "Stop" "T"
58-63 uart: tx-start: "Start bit" "Start" "S"
63-68 uart: tx-data-bits: "1"
69-74 uart: tx-data-bits: "0"
74-79 uart: tx-data-bits: "1"
79-84 uart: tx-data-bits: "0"
85-90 uart: tx-data-bits: "0"
90-95 uart: tx-data-bits: "1"
96-101 uart: tx-data-bits: "1"
101-106 uart: tx-data-bits: "0"
63-106 uart: tx-data: "e"
107-112 uart: tx-parity-ok: "Stop bit" "Stop" "T"
112-117 uart: tx-start: "Start bit" "Start" "S"
117-122 uart: tx-data-bits: "0"
123-128 uart: tx-data-bits: "0"
128-133 uart: tx-data-bits: "1"
133-138 uart: tx-data-bits: "1"
139-144 uart: tx-data-bits: "0"
144-149 uart: tx-data-bits: "1"
150-155 uart: tx-data-bits: "1"
155-160 uart: tx-data-bits: "0"
117-160 uart: tx-data: "l"
161-166 uart: tx-parity-ok: "Stop bit" "Stop" "T"
166-171 uart: tx-start: "Start bit" "Start" "S"
171-176 uart: tx-data-bits: "0"
177-182 uart: tx-data-bits: "0"
182-187 uart: tx-data-bits: "1"
187-192 uart: tx-data-bits: "1"
193-198 uart: tx-data-bits: "0"
198-203 uart: tx-data-bits: "1"
204-209 uart: tx-data-bits: "1"
209-214 uart: tx-data-bits: "0"
171-214 uart: tx-data: "l"
215-220 uart: tx-parity-ok: "Stop bit" "Stop" "T"
220-225 uart: tx-start: "Start bit" "Start" "S"
225-230 uart: tx-data-bits: "1"
231-236 uart: tx-data-bits: "1"
236-241 uart: tx-data-bits: "1"
241-246 uart: tx-data-bits: "1"
247-252 uart: tx-data-bits: "0"
252-257 uart: tx-data-bits: "1"
258-263 uart: tx-data-bits: "1"
263-268 uart: tx-data-bits: "0"
225-268 uart: tx-data: "o"
269-274 uart: tx-parity-ok: "Stop bit" "Stop" "T"
275-280 uart: tx-start: "Start bit" "Start" "S"
280-285 uart: tx-data-bits: "0"
286-291 uart: tx-data-bits: "0"
291-296 uart: tx-data-bits: "0"
296-301 uart: tx-data-bits: "0"
302-307 uart: tx-data-bits: "0"
307-312 uart: tx-data-bits: "1"
313-318 uart: tx-data-bits: "0"
318-323 uart: tx-data-bits: "0"
280-323 uart: tx-data: " "
324-329 uart: tx-parity-ok: "Stop bit" "Stop" "T"
329-334 uart: tx-start: "Start bit" "Start" "S"
334-339 uart: tx-data-bits: "1"
340-345 uart: tx-data-bits: "1"
345-350 uart: tx-data-bits: "1"
350-355 uart: tx-data-bits: "0"
356-361 uart: tx-data-bits: "1"
361-366 uart: tx-data-bits: "0"
367-372 uart: tx-data-bits: "1"
372-377 uart: tx-data-bits: "0"
334-377 uart: tx-data: "W"
378-383 uart: tx-parity-ok: "Stop bit" "Stop" "T"
383-388 uart: tx-start: "Start bit" "Start" "S"
388-393 uart: tx-data-bits: "1"
394-399 uart: tx-data-bits: "1"
399-404 uart: tx-data-bits: "1"
404-409 uart: tx-data-bits: "1"
410-415 uart: tx-data-bits: "0"
415-420 uart: tx-data-bits: "1"
421-426 uart: tx-data-bits: "1"
426-431 uart: tx-data-bits: "0"
388-431 uart: tx-data: "o"
432-437 uart: tx-parity-ok: "Stop bit" "Stop" "T"
437-442 uart: tx-start: "Start bit" "Start" "S"
442-447 uart: tx-data-bits: "0"
448-453 uart: tx-data-bits: "1"
453-458 uart: tx-data-bits: "0"
458-463 uart: tx-data-bits: "0"
464-469 uart: tx-data-bits: "1"
469-474 uart: tx-data-bits: "1"
475-480 uart: tx-data-bits: "1"
480-485 uart: tx-data-bits: "0"
442-485 uart: tx-data: "r"
486-491 uart: tx-parity-ok: "Stop bit" "Stop" "T"
491-496 uart: tx-start: "Start bit" "Start" "S"
496-501 uart: tx-data-bits: "0"
502-507 uart: tx-data-bits: "0"
507-512 uart: tx-data-bits: "1"
512-517 uart: tx-data-bits: "1"
518-523 uart: tx-data-bits: "0"
523-528 uart: tx-data-bits: "1"
529-534 uart: tx-data-bits: "1"
534-539 uart: tx-data-bits: "0"
496-539 uart: tx-data: "l"
540-545 uart: tx-parity-ok: "Stop bit" "Stop" "T"
545-550 uart: tx-start: "Start bit" "Start" "S"
550-555 uart: tx-data-bits: "0"
556-561 uart: tx-data-bits: "0"
561-566 uart: tx-data-bits: "1"
566-571 uart: tx-data-bits: "0"
572-577 uart: tx-data-bits: "0"
577-582 uart: tx-data-bits: "1"
583-588 uart: tx-data-bits: "1"
588-593 uart: tx-data-bits: "0"
550-593 uart: tx-data: "d"
594-599 uart: tx-parity-ok: "Stop bit" "Stop" "T"
600-605 uart: tx-start: "Start bit" "Start" "S"
605-610 uart: tx-data-bits: "1"
611-616 uart: tx-data-bits: "0"
616-621 uart: tx-data-bits: "0"
621-626 uart: tx-data-bits: "0"
627-632 uart: tx-data-bits: "0"
632-637 uart: tx-data-bits: "1"
638-643 uart: tx-data-bits: "0"
643-648 uart: tx-data-bits: "0"
605-648 uart: tx-data: "!"
649-654 uart: tx-parity-ok: "Stop bit" "Stop" "T"
654-659 uart: tx-start: "Start bit" "Start" "S"
659-664 uart: tx-data-bits: "1"
665-670 uart: tx-data-bits: "0"
670-675 uart: tx-data-bits: "1"
675-680 uart: tx-data-bits: "1"
681-686 uart: tx-data-bits: "0"
686-691 uart: tx-data-bits: "0"
692-697 uart: tx-data-bits: "0"
697-702 uart: tx-data-bits: "0"
659-702 uart: tx-data: "[0D]"
703-708 uart: tx-parity-ok: "Stop bit" "Stop" "T"
708-713 uart: tx-start: "Start bit" "Start" "S"
713-718 uart: tx-data-bits: "0"
719-724 uart: tx-data-bits: "1"
724-729 uart: tx-data-bits: "0"
729-734 uart: tx-data-bits: "1"
735-740 uart: tx-data-bits: "0"
740-745 uart: tx-data-bits: "0"
746-751 uart: tx-data-bits: "0"
751-756 uart: tx-data-bits: "0"
713-756 uart: tx-data: "[0A]"
757-762 uart: tx-parity-ok: "Stop bit" "Stop" "T"
762-767 uart: tx-start: "Start bit" "Start" "S"
767-772 uart: tx-data-bits: "0"
773-778 uart: tx-data-bits: "0"
778-783 uart: tx-data-bits: "0"
783-788 uart: tx-data-bits: "1"
789-794 uart: tx-data-bits: "0"
794-799 uart: tx-data-bits: "0"
800-805 uart: tx-data-bits: "1"
805-810 uart: tx-data-bits: "0"
767-810 uart: tx-data: "H"
811-816 uart: tx-parity-ok: "Stop bit" "Stop" "T"
816-821 uart: tx-start: "Start bit" "Start" "S"
821-826 uart: tx-data-bits: "1"
827-832 uart: tx-data-bits: "0"
832-837 uart: tx-data-bits: "1"
837-842 uart: tx-data-bits: "0"
843-848 uart: tx-data-bits: "0"
848-853 uart: tx-data-bits: "1"
854-859 uart: tx-data-bits: "1"
859-864 uart: tx-data-bits: "0"
821-864 uart: tx-data: "e"
865-870 uart: tx-parity-ok: "Stop bit" "Stop" "T"
870-875 uart: tx-start: "Start bit" "Start" "S"
875-880 uart: tx-data-bits: "0"
881-886 uart: tx-data-bits: "0"
886-891 uart: tx-data-bits: "1"
891-896 uart: tx-data-bits: "1"
897-902 uart: tx-data-bits: "0"
902-907 uart: tx-data-bits: "1"
908-913 uart: tx-data-bits: "1"
913-918 uart: tx-data-bits: "0"
875-918 uart: tx-data: "l"
919-924 uart: tx-parity-ok: "Stop bit" "Stop" "T"
925-930 uart: tx-start: "Start bit" "Start" "S"
930-935 uart: tx-data-bits: "0"
936-941 uart: tx-data-bits: "0"
941-946 uart: tx-data-bits: "1"
946-951 uart: tx-data-bits: "1"
952-957 uart: tx-data-bits: "0"
957-962 uart: tx-data-bits: "1"
963-968 uart: tx-data-bits: "1"
968-973 uart: tx-data-bits: "0"
930-973 uart: tx-data: "l"
974-979 uart: tx-parity-ok: "Stop bit" "Stop" "T"
979-984 uart: tx-start: "Start bit" "Start" "S"
984-989 uart: tx-data-bits: "1"
990-995 uart: tx-data-bits: "1"
995-1000 uart: tx-data-bits: "1"
1000-1005 uart: tx-data-bits: "1"
1006-1011 uart: tx-data-bits: "0"
1011-1016 uart: tx-data-bits: "1"
1017-1022 uart: tx-data-bits: "1"
1022-1027 uart: tx-data-bits: "0"
984-1027 uart: tx-data: "o"
1028-1033 uart: tx-parity-ok: "Stop bit" "Stop" "T"
1033-1038 uart: tx-start: "Start bit" "Start" "S"
1038-1043 uart: tx-data-bits: "0"
1044-1049 uart: tx-data-bits: "0"
1049-1054 uart: tx-data-bits: "0"
1054-1059 uart: tx-data-bits: "0"
1060-1065 uart: tx-data-bits: "0"
1065-1070 uart: tx-data-bits: "1"
1071-1076 uart: tx-data-bits: "0"
1076-1081 uart: tx-data-bits: "0"
1038-1081 uart: tx-data: " "
1082-1087 uart: tx-parity-ok: "Stop bit" "Stop" "T"
1087-1092 uart: tx-start: "Start bit" "Start" "S"
1092-1097 uart: tx-data-bits: "1"
1098-1103 uart: tx-data-bits: "1"
1103-1108 uart: tx-data-bits: "1"
1108-1113 uart: tx-data-bits: "0"
1114-1119 uart: tx-data-bits: "1"
1119-1124 uart: tx-data-bits: "0"
1125-1130 uart: tx-data-bits: "1"
1130-1135 uart: tx-data-bits: "0"
1092-1135 uart: tx-data: "W"
1136-1141 uart: tx-parity-ok: "Stop bit" "Stop" "T"
1141-1146 uart: tx-start: "Start bit" "Start" "S"
1146-1151 uart: tx-data-bits: "1"
1152-1157 uart: tx-data-bits: "1"
1157-1162 uart: tx-data-bits: "1"
1162-1167 uart: tx-data-bits: "1"
1168-1173 uart: tx-data-bits: "0"
1173-1178 uart: tx-data-bits: "1"
1179-1184 uart: tx-data-bits: "1"
1184-1189 uart: tx-data-bits: "0"
1146-1189 uart: tx-data: "o"
1190-1195 uart: tx-parity-ok: "Stop bit" "Stop" "T"
1195-1200 uart: tx-start: "Start bit" "Start" "S"
1200-1205 uart: tx-data-bits: "0"
1206-1211 uart: tx-data-bits: "1"
1211-1216 uart: tx-data-bits: "0"
1216-1221 uart: tx-data-bits: "0"
1222-1227 uart: tx-data-bits: "1"
1227-1232 uart: tx-data-bits: "1"
1233-1238 uart: tx-data-bits: "1"
1238-1243 uart: tx-data-bits: "0"
1200-1243 uart: tx-data: "r"
1244-1249 uart: tx-parity-ok: "Stop bit" "Stop" "T"
1250-1255 uart: tx-start: "Start bit" "Start" "S"
1255-1260 uart: tx-data-bits: "0"
1261-1266 uart: tx-data-bits: "0"
1266-1271 uart: tx-data-bits: "1"
1271-1276 uart: tx-data-bits: "1"
1277-1282 uart: tx-data-bits: "0"
1282-1287 uart: tx-data-bits: "1"
1288-1293 uart: tx-data-bits: "1"
1293-1298 uart: tx-data-bits: "0"
1255-1298 uart: tx-data: "l"
1299-1304 uart: tx-parity-ok: "Stop bit" "Stop" "T"
1304-1309 uart: tx-start: "Start bit" "Start" "S"
1309-1314 uart: tx-data-bits: "0"
1315-1320 uart: tx-data-bits: "0"
1320-1325 uart: tx-data-bits: "1"
1325-1330 uart: tx-data-bits: "0"
1331-1336 uart: tx-data-bits: "0"
1336-1341 uart: tx-data-bits: "1"
1342-1347 uart: tx-data-bits: "1"
1347-1352 uart: tx-data-bits: "0"
1309-1352 uart: tx-data: "d"
1353-1358 uart: tx-parity-ok: "Stop bit" "Stop" "T"
1358-1363 uart: tx-start: "Start bit" "Start" "S"
1363-1368 uart: tx-data-bits: "1"
1369-1374 uart: tx-data-bits: "0"
1374-1379 uart: tx-data-bits: "0"
1379-1384 uart: tx-data-bits: "0"
1385-1390 uart: tx-data-bits: "0"
1390-1395 uart: tx-data-bits: "1"
1396-1401 uart: tx-data-bits: "0"
1401-1406 uart: tx-data-bits: "0"
1363-1406 uart: tx-data: "!"
1407-1412 uart: tx-parity-ok: "Stop bit" "Stop" "T"
1412-1417 uart: tx-start: "Start bit" "Start" "S"
1417-1422 uart: tx-data-bits: "1"
1423-1428 uart: tx-data-bits: "0"
1428-1433 uart: tx-data-bits: "1"
1433-1438 uart: tx-data-bits: "1"
1439-1444 uart: tx-data-bits: "0"
1444-1449 uart: tx-data-bits: "0"
1450-1455 uart: tx-data-bits: "0"
1455-1460 uart: tx-data-bits: "0"
1417-1460 uart: tx-data: "[0D]"
1461-1466 uart: tx-parity-ok: "Stop bit" "Stop" "T"
1466-1471 uart: tx-start: "Start bit" "Start" "S"
1471-1476 uart: tx-data-bits: "0"
1477-1482 uart: tx-data-bits: "1"
1482-1487 uart: tx-data-bits: "0"
1487-1492 uart: tx-data-bits: "1"
1493-1498 uart: tx-data-bits: "0"
1498-1503 uart: tx-data-bits: "0"
1504-1509 uart: tx-data-bits: "0"
1509-1514 uart: tx-data-bits: "0"
1471-1514 uart: tx-data: "[0A]"
1515-1520 uart: tx-parity-ok: "Stop bit" "Stop" "T"
1520-1525 uart: tx-start: "Start bit" "Start" "S"
1525-1530 uart: tx-data-bits: "0"
1531-1536 uart: tx-data-bits: "0"
1536-1541 uart: tx-data-bits: "0"
1541-1546 uart: tx-data-bits: "1"
1547-1552 uart: tx-data-bits: "0"
1552-1557 uart: tx-data-bits: "0"
1558-1563 uart: tx-data-bits: "1"
1563-1568 uart: tx-data-bits: "0"
1525-1568 uart: tx-data: "H"
1569-1574 uart: tx-parity-ok: "Stop bit" "Stop" "T"
1575-1580 uart: tx-start: "Start bit" "Start" "S"
1580-1585 uart: tx-data-bits: "1"
1586-1591 uart: tx-data-bits: "0"
1591-1596 uart: tx-data-bits: "1"
1596-1601 uart: tx-data-bits: "0"
1602-1607 uart: tx-data-bits: "0"
1607-1612 uart: tx-data-bits: "1"
1613-1618 uart: tx-data-bits: "1"
1618-1623 uart: tx-data-bits: "0"
1580-1623 uart: tx-data: "e"
1624-1629 uart: tx-parity-ok: "Stop bit" "Stop" "T"
1629-1634 uart: tx-start: "Start bit" "Start" "S"
1634-1639 uart: tx-data-bits: "0"
1640-1645 uart: tx-data-bits: "0"
1645-1650 uart: tx-data-bits: "1"
1650-1655 uart: tx-data-bits: "1"
1656-1661 uart: tx-data-bits: "0"
1661-1666 uart: tx-data-bits: "1"
1667-1672 uart: tx-data-bits: "1"
1672-1677 uart: tx-data-bits: "0"
1634-1677 uart: tx-data: "l"
1678-1683 uart: tx-parity-ok: "Stop bit" "Stop" "T"
1683-1688 uart: tx-start: "Start bit" "Start" "S"
1688-1693 uart: tx-data-bits: "0"
1694-1699 uart: tx-data-bits: "0"
1699-1704 uart: tx-data-bits: "1"
1704-1709 uart: tx-data-bits: "1"
1710-1715 uart: tx-data-bits: "0"
1715-1720 uart: tx-data-bits: "1"
1721-1726 uart: tx-data-bits: "1"
1726-1731 uart: tx-data-bits: "0"
1688-1731 uart: tx-data: "l"
1732-1737 uart: tx-parity-ok: "Stop bit" "Stop" "T"
1737-1742 uart: tx-start: "Start bit" "Start" "S"
1742-1747 uart: tx-data-bits: "1"
1748-1753 uart: tx-data-bits: "1"
1753-1758 uart: tx-data-bits: "1"
1758-1763 uart: tx-data-bits: "1"
1764-1769 uart: tx-data-bits: "0"
1769-1774 uart: tx-data-bits: "1"
1775-1780 uart: tx-data-bits: "1"
1780-1785 uart: tx-data-bits: "0"
1742-1785 uart: tx-data: "o"
1786-1791 uart: tx-parity-ok: "Stop bit" "Stop" "T"
1791-1796 uart: tx-start: "Start bit" "Start" "S"
1796-1801 uart: tx-data-bits: "0"
1802-1807 uart: tx-data-bits: "0"
1807-1812 uart: tx-data-bits: "0"
1812-1817 uart: tx-data-bits: "0"
1818-1823 uart: tx-data-bits: "0"
1823-1828 uart: tx-data-bits: "1"
1829-1834 uart: tx-data-bits: "0"
1834-1839 uart: tx-data-bits: "0"
1796-1839 uart: tx-data: " "
1840-1845 uart: tx-parity-ok: "Stop bit" "Stop" "T"
1845-1850 uart: tx-start: "Start bit" "Start" "S"
1850-1855 uart: tx-data-bits: "1"
1856-1861 uart: tx-data-bits: "1"
1861-1866 uart: tx-data-bits: "1"
1866-1871 uart: tx-data-bits: "0"
1872-1877 uart: tx-data-bits: "1"
1877-1882 uart: tx-data-bits: "0"
1883-1888 uart: tx-data-bits: "1"
1888-1893 uart: tx-data-bits: "0"
1850-1893 uart: tx-data: "W"
1894-1899 uart: tx-parity-ok: "Stop bit" "Stop" "T"
1900-1905 uart: tx-start: "Start bit" "Start" "S"
1905-1910 uart: tx-data-bits: "1"
1911-1916 uart: tx-data-bits: "1"
1916-1921 uart: tx-data-bits: "1"
1921-1926 uart: tx-data-bits: "1"
1927-1932 uart: tx-data-bits: "0"
1932-1937 uart: tx-data-bits: "1"
1938-1943 uart: tx-data-bits: "1"
1943-1948 uart: tx-data-bits: "0"
1905-1948 uart: tx-data: "o"
1949-1954 uart: tx-parity-ok: "Stop bit" "Stop" "T"
1954-1959 uart: tx-start: "Start bit" "Start" "S"
1959-1964 uart: tx-data-bits: "0"
1965-1970 uart: tx-data-bits: "1"
1970-1975 uart: tx-data-bits: "0"
1975-1980 uart: tx-data-bits: "0"
1981-1986 uart: tx-data-bits: "1"
1986-1991 uart: tx-data-bits: "1"
1992-1997 uart: tx-data-bits: "1"
1997-2002 uart: tx-data-bits: "0"
1959-2002 uart: tx-data: "r"
2003-2008 uart: tx-parity-ok: "Stop bit" "Stop" "T"
2008-2013 uart: tx-start: "Start bit" "Start" "S"
2013-2018 uart: tx-data-bits: "0"
2019-2024 uart: tx-data-bits: "0"
2024-2029 uart: tx-data-bits: "1"
2029-2034 uart: tx-data-bits: "1"
2035-2040 uart: tx-data-bits: "0"
2040-2045 uart: tx-data-bits: "1"
2046-2051 uart: tx-data-bits: "1"
2051-2056 uart: tx-data-bits: "0"
2013-2056 uart: tx-data: "l"
2057-2062 uart: tx-parity-ok: "Stop bit" "Stop" "T"
2062-2067 uart: tx-start: "Start bit" "Start" "S"
2067-2072 uart: tx-data-bits: "0"
2073-2078 uart: tx-data-bits: "0"
2078-2083 uart: tx-data-bits: "1"
2083-2088 uart: tx-data-bits: "0"
2089-2094 uart: tx-data-bits: "0"
2094-2099 uart: tx-data-bits: "1"
2100-2105 uart: tx-data-bits: "1"
2105-2110 uart: tx-data-bits: "0"
2067-2110 uart: tx-data: "d"
2111-2116 uart: tx-parity-ok: "Stop bit" "Stop" "T"
2116-2121 uart: tx-start: "Start bit" "Start" "S"
2121-2126 uart: tx-data-bits: "1"
2127-2132 uart: tx-data-bits: "0"
2132-2137 uart: tx-data-bits: "0"
2137-2142 uart: tx-data-bits: "0"
2143-2148 uart: tx-data-bits: "0"
2148-2153 uart: tx-data-bits: "1"
2154-2159 uart: tx-data-bits: "0"
2159-2164 uart: tx-data-bits: "0"
2121-2164 uart: tx-data: "!"
2165-2170 uart: tx-parity-ok: "Stop bit" "Stop" "T"
2170-2175 uart: tx-start: "Start bit" "Start" "S"
2175-2180 uart: tx-data-bits: "1"
2181-2186 uart: tx-data-bits: "0"
2186-2191 uart: tx-data-bits: "1"
2191-2196 uart: tx-data-bits: "1"
2197-2202 uart: tx-data-bits: "0"
2202-2207 uart: tx-data-bits: "0"
2208-2213 uart: tx-data-bits: "0"
2213-2218 uart: tx-data-bits: "0"
2175-2218 uart: tx-data: "[0D]"
2219-2224 uart: tx-parity-ok: "Stop bit" "Stop" "T"
2225-2230 uart: tx-start: "Start bit" "Start" "S"
2230-2235 uart: tx-data-bits: "0"
2236-2241 uart: tx-data-bits: "1"
2241-2246 uart: tx-data-bits: "0"
2246-2251 uart: tx-data-bits: "1"
2252-2257 uart: tx-data-bits: "0"
2257-2262 uart: tx-data-bits: "0"
2263-2268 uart: tx-data-bits: "0"
2268-2273 uart: tx-data-bits: "0"
2230-2273 uart: tx-data: "[0A]"
2274-2279 uart: tx-parity-ok: "Stop bit" "Stop" "T"
