59-76 uart: rx-start: "Start bit" "Start" "S"
76-93 uart: rx-data-bits: "0"
93-110 uart: rx-data-bits: "1"
111-128 uart: rx-data-bits: "1"
128-145 uart: rx-data-bits: "1"
145-162 uart: rx-data-bits: "1"
163-180 uart: rx-data-bits: "1"
180-197 uart: rx-data-bits: "1"
198-215 uart: rx-data-bits: "0"
76-215 uart: rx-data: "7E"
215-232 uart: rx-parity-ok: "Stop bit" "Stop" "T"
232-249 uart: rx-start: "Start bit" "Start" "S"
249-266 uart: rx-data-bits: "0"
266-283 uart: rx-data-bits: "0"
284-301 uart: rx-data-bits: "0"
301-318 uart: rx-data-bits: "0"
318-335 uart: rx-data-bits: "0"
336-353 uart: rx-data-bits: "0"
353-370 uart: rx-data-bits: "0"
371-388 uart: rx-data-bits: "0"
249-388 uart: rx-data: "00"
388-405 uart: rx-parity-ok: "Stop bit" "Stop" "T"
405-422 uart: rx-start: "Start bit" "Start" "S"
422-439 uart: rx-data-bits: "0"
439-456 uart: rx-data-bits: "0"
457-474 uart: rx-data-bits: "0"
474-491 uart: rx-data-bits: "0"
491-508 uart: rx-data-bits: "1"
501-518 uart: tx-start: "Start bit" "Start" "S"
509-526 uart: rx-data-bits: "0"
518-535 uart: tx-data-bits: "0"
526-543 uart: rx-data-bits: "0"
535-552 uart: tx-data-bits: "1"
544-561 uart: rx-data-bits: "0"
422-561 uart: rx-data: "10"
553-570 uart: tx-data-bits: "1"
561-578 uart: rx-parity-ok: "Stop bit" "Stop" "T"
570-587 uart: tx-data-bits: "1"
578-595 uart: rx-start: "Start bit" "Start" "S"
587-604 uart: tx-data-bits: "1"
595-612 uart: rx-data-bits: "0"
605-622 uart: tx-data-bits: "1"
612-629 uart: rx-data-bits: "0"
622-639 uart: tx-data-bits: "1"
630-647 uart: rx-data-bits: "0"
640-657 uart: tx-data-bits: "0"
518-657 uart: tx-data: "7E"
647-664 uart: rx-data-bits: "0"
657-674 uart: tx-parity-ok: "Stop bit" "Stop" "T"
664-681 uart: rx-data-bits: "0"
674-691 uart: tx-start: "Start bit" "Start" "S"
682-699 uart: rx-data-bits: "1"
691-708 uart: tx-data-bits: "0"
699-716 uart: rx-data-bits: "0"
708-725 uart: tx-data-bits: "0"
717-734 uart: rx-data-bits: "0"
595-734 uart: rx-data: "20"
726-743 uart: tx-data-bits: "0"
734-751 uart: rx-parity-ok: "Stop bit" "Stop" "T"
743-760 uart: tx-data-bits: "0"
752-769 uart: rx-start: "Start bit" "Start" "S"
760-777 uart: tx-data-bits: "0"
769-786 uart: rx-data-bits: "1"
778-795 uart: tx-data-bits: "0"
786-803 uart: rx-data-bits: "0"
795-812 uart: tx-data-bits: "0"
804-821 uart: rx-data-bits: "0"
813-830 uart: tx-data-bits: "0"
691-830 uart: tx-data: "00"
821-838 uart: rx-data-bits: "0"
830-847 uart: tx-parity-ok: "Stop bit" "Stop" "T"
838-855 uart: rx-data-bits: "0"
847-864 uart: tx-start: "Start bit" "Start" "S"
856-873 uart: rx-data-bits: "0"
864-881 uart: tx-data-bits: "1"
873-890 uart: rx-data-bits: "0"
881-898 uart: tx-data-bits: "1"
891-908 uart: rx-data-bits: "0"
769-908 uart: rx-data: "01"
899-916 uart: tx-data-bits: "0"
908-925 uart: rx-parity-ok: "Stop bit" "Stop" "T"
916-933 uart: tx-data-bits: "0"
925-942 uart: rx-start: "Start bit" "Start" "S"
933-950 uart: tx-data-bits: "0"
942-959 uart: rx-data-bits: "0"
951-968 uart: tx-data-bits: "0"
959-976 uart: rx-data-bits: "0"
968-985 uart: tx-data-bits: "0"
977-994 uart: rx-data-bits: "0"
986-1003 uart: tx-data-bits: "0"
864-1003 uart: tx-data: "03"
994-1011 uart: rx-data-bits: "0"
1003-1020 uart: tx-parity-ok: "Stop bit" "Stop" "T"
1011-1028 uart: rx-data-bits: "0"
1021-1038 uart: tx-start: "Start bit" "Start" "S"
1029-1046 uart: rx-data-bits: "0"
1038-1055 uart: tx-data-bits: "1"
1046-1063 uart: rx-data-bits: "1"
1055-1072 uart: tx-data-bits: "0"
1064-1081 uart: rx-data-bits: "1"
942-1081 uart: rx-data: "C0"
1073-1090 uart: tx-data-bits: "0"
1081-1098 uart: rx-parity-ok: "Stop bit" "Stop" "T"
1090-1107 uart: tx-data-bits: "1"
1098-1115 uart: rx-start: "Start bit" "Start" "S"
1107-1124 uart: tx-data-bits: "0"
1115-1132 uart: rx-data-bits: "0"
1125-1142 uart: tx-data-bits: "0"
1132-1149 uart: rx-data-bits: "0"
1142-1159 uart: tx-data-bits: "0"
1150-1167 uart: rx-data-bits: "0"
1160-1177 uart: tx-data-bits: "1"
1038-1177 uart: tx-data: "89"
1167-1184 uart: rx-data-bits: "1"
1177-1194 uart: tx-parity-ok: "Stop bit" "Stop" "T"
1184-1201 uart: rx-data-bits: "0"
1194-1211 uart: tx-start: "Start bit" "Start" "S"
1202-1219 uart: rx-data-bits: "1"
1211-1228 uart: tx-data-bits: "1"
1219-1236 uart: rx-data-bits: "0"
1228-1245 uart: tx-data-bits: "0"
1237-1254 uart: rx-data-bits: "1"
1115-1254 uart: rx-data: "A8"
1246-1263 uart: tx-data-bits: "0"
1254-1271 uart: rx-parity-ok: "Stop bit" "Stop" "T"
1263-1280 uart: tx-data-bits: "0"
1272-1289 uart: rx-start: "Start bit" "Start" "S"
1280-1297 uart: tx-data-bits: "0"
1289-1306 uart: rx-data-bits: "0"
1298-1315 uart: tx-data-bits: "0"
1306-1323 uart: rx-data-bits: "0"
1315-1332 uart: tx-data-bits: "0"
1324-1341 uart: rx-data-bits: "0"
1333-1350 uart: tx-data-bits: "0"
1211-1350 uart: tx-data: "01"
1341-1358 uart: rx-data-bits: "0"
1350-1367 uart: tx-parity-ok: "Stop bit" "Stop" "T"
1358-1375 uart: rx-data-bits: "1"
1367-1384 uart: tx-start: "Start bit" "Start" "S"
1376-1393 uart: rx-data-bits: "1"
1384-1401 uart: tx-data-bits: "0"
1393-1410 uart: rx-data-bits: "0"
1401-1418 uart: tx-data-bits: "0"
1411-1428 uart: rx-data-bits: "1"
1289-1428 uart: rx-data: "B0"
1419-1436 uart: tx-data-bits: "0"
1428-1445 uart: rx-parity-ok: "Stop bit" "Stop" "T"
1436-1453 uart: tx-data-bits: "0"
1445-1462 uart: rx-start: "Start bit" "Start" "S"
1453-1470 uart: tx-data-bits: "0"
1462-1479 uart: rx-data-bits: "1"
1471-1488 uart: tx-data-bits: "0"
1479-1496 uart: rx-data-bits: "1"
1488-1505 uart: tx-data-bits: "0"
1497-1514 uart: rx-data-bits: "1"
1506-1523 uart: tx-data-bits: "0"
1384-1523 uart: tx-data: "00"
1514-1531 uart: rx-data-bits: "1"
1523-1540 uart: tx-parity-ok: "Stop bit" "Stop" "T"
1531-1548 uart: rx-data-bits: "1"
1541-1558 uart: tx-start: "Start bit" "Start" "S"
1549-1566 uart: rx-data-bits: "0"
1558-1575 uart: tx-data-bits: "1"
1566-1583 uart: rx-data-bits: "0"
1575-1592 uart: tx-data-bits: "0"
1584-1601 uart: rx-data-bits: "0"
1462-1601 uart: rx-data: "1F"
1593-1610 uart: tx-data-bits: "1"
1601-1618 uart: rx-parity-ok: "Stop bit" "Stop" "T"
1610-1627 uart: tx-data-bits: "0"
1618-1635 uart: rx-start: "Start bit" "Start" "S"
1627-1644 uart: tx-data-bits: "1"
1635-1652 uart: rx-data-bits: "0"
1645-1662 uart: tx-data-bits: "1"
1652-1669 uart: rx-data-bits: "1"
1662-1679 uart: tx-data-bits: "1"
1670-1687 uart: rx-data-bits: "0"
1680-1697 uart: tx-data-bits: "0"
1558-1697 uart: tx-data: "75"
1687-1704 uart: rx-data-bits: "1"
1697-1714 uart: tx-parity-ok: "Stop bit" "Stop" "T"
1704-1721 uart: rx-data-bits: "1"
1722-1739 uart: rx-data-bits: "0"
1739-1756 uart: rx-data-bits: "0"
1757-1774 uart: rx-data-bits: "1"
1635-1774 uart: rx-data: "9A"
1774-1791 uart: rx-parity-ok: "Stop bit" "Stop" "T"
