58-75 uart: rx-start: "Start bit" "Start" "S"
75-93 uart: rx-data-bit: "0"
93-110 uart: rx-data-bit: "1"
110-127 uart: rx-data-bit: "1"
127-145 uart: rx-data-bit: "1"
145-162 uart: rx-data-bit: "1"
162-180 uart: rx-data-bit: "1"
180-197 uart: rx-data-bit: "1"
197-214 uart: rx-data-bit: "0"
75-214 uart: rx-data: "7E"
214-232 uart: rx-stop: "Stop bit" "Stop" "T"
231-248 uart: rx-start: "Start bit" "Start" "S"
248-266 uart: rx-data-bit: "0"
266-283 uart: rx-data-bit: "0"
283-300 uart: rx-data-bit: "0"
300-318 uart: rx-data-bit: "0"
318-335 uart: rx-data-bit: "0"
335-353 uart: rx-data-bit: "0"
353-370 uart: rx-data-bit: "0"
370-387 uart: rx-data-bit: "0"
248-387 uart: rx-data: "00"
387-405 uart: rx-stop: "Stop bit" "Stop" "T"
404-421 uart: rx-start: "Start bit" "Start" "S"
421-439 uart: rx-data-bit: "0"
439-456 uart: rx-data-bit: "0"
456-473 uart: rx-data-bit: "0"
473-491 uart: rx-data-bit: "0"
491-508 uart: rx-data-bit: "1"
500-517 uart: tx-start: "Start bit" "Start" "S"
508-526 uart: rx-data-bit: "0"
517-535 uart: tx-data-bit: "0"
526-543 uart: rx-data-bit: "0"
535-552 uart: tx-data-bit: "1"
543-560 uart: rx-data-bit: "0"
421-560 uart: rx-data: "10"
552-569 uart: tx-data-bit: "1"
560-578 uart: rx-stop: "Stop bit" "Stop" "T"
569-587 uart: tx-data-bit: "1"
577-594 uart: rx-start: "Start bit" "Start" "S"
587-604 uart: tx-data-bit: "1"
594-612 uart: rx-data-bit: "0"
604-622 uart: tx-data-bit: "1"
612-629 uart: rx-data-bit: "0"
622-639 uart: tx-data-bit: "1"
629-646 uart: rx-data-bit: "0"
639-656 uart: tx-data-bit: "0"
517-656 uart: tx-data: "7E"
646-664 uart: rx-data-bit: "0"
656-674 uart: tx-stop: "Stop bit" "Stop" "T"
664-681 uart: rx-data-bit: "0"
673-690 uart: tx-start: "Start bit" "Start" "S"
681-699 uart: rx-data-bit: "1"
690-708 uart: tx-data-bit: "0"
699-716 uart: rx-data-bit: "0"
708-725 uart: tx-data-bit: "0"
716-733 uart: rx-data-bit: "0"
594-733 uart: rx-data: "20"
725-742 uart: tx-data-bit: "0"
733-751 uart: rx-stop: "Stop bit" "Stop" "T"
742-760 uart: tx-data-bit: "0"
751-768 uart: rx-start: "Start bit" "Start" "S"
760-777 uart: tx-data-bit: "0"
768-786 uart: rx-data-bit: "1"
777-795 uart: tx-data-bit: "0"
786-803 uart: rx-data-bit: "0"
795-812 uart: tx-data-bit: "0"
803-820 uart: rx-data-bit: "0"
812-829 uart: tx-data-bit: "0"
690-829 uart: tx-data: "00"
820-838 uart: rx-data-bit: "0"
829-847 uart: tx-stop: "Stop bit" "Stop" "T"
500-847 uart: tx-packet: "7E 00"
838-855 uart: rx-data-bit: "0"
846-863 uart: tx-start: "Start bit" "Start" "S"
855-873 uart: rx-data-bit: "0"
863-881 uart: tx-data-bit: "1"
873-890 uart: rx-data-bit: "0"
881-898 uart: tx-data-bit: "1"
890-907 uart: rx-data-bit: "0"
768-907 uart: rx-data: "01"
898-915 uart: tx-data-bit: "0"
907-925 uart: rx-stop: "Stop bit" "Stop" "T"
58-925 uart: rx-packet: "7E 00 10 20 01"
915-933 uart: tx-data-bit: "0"
924-941 uart: rx-start: "Start bit" "Start" "S"
933-950 uart: tx-data-bit: "0"
941-959 uart: rx-data-bit: "0"
950-968 uart: tx-data-bit: "0"
959-976 uart: rx-data-bit: "0"
968-985 uart: tx-data-bit: "0"
976-993 uart: rx-data-bit: "0"
985-1002 uart: tx-data-bit: "0"
863-1002 uart: tx-data: "03"
993-1011 uart: rx-data-bit: "0"
1002-1020 uart: tx-stop: "Stop bit" "Stop" "T"
1011-1028 uart: rx-data-bit: "0"
1020-1037 uart: tx-start: "Start bit" "Start" "S"
1028-1046 uart: rx-data-bit: "0"
1037-1055 uart: tx-data-bit: "1"
1046-1063 uart: rx-data-bit: "1"
1055-1072 uart: tx-data-bit: "0"
1063-1080 uart: rx-data-bit: "1"
941-1080 uart: rx-data: "C0"
1072-1089 uart: tx-data-bit: "0"
1080-1098 uart: rx-stop: "Stop bit" "Stop" "T"
1089-1107 uart: tx-data-bit: "1"
1097-1114 uart: rx-start: "Start bit" "Start" "S"
1107-1124 uart: tx-data-bit: "0"
1114-1132 uart: rx-data-bit: "0"
1124-1142 uart: tx-data-bit: "0"
1132-1149 uart: rx-data-bit: "0"
1142-1159 uart: tx-data-bit: "0"
1149-1166 uart: rx-data-bit: "0"
1159-1176 uart: tx-data-bit: "1"
1037-1176 uart: tx-data: "89"
1166-1184 uart: rx-data-bit: "1"
1176-1194 uart: tx-stop: "Stop bit" "Stop" "T"
846-1194 uart: tx-packet: "03 89"
1184-1201 uart: rx-data-bit: "0"
1193-1210 uart: tx-start: "Start bit" "Start" "S"
1201-1219 uart: rx-data-bit: "1"
1210-1228 uart: tx-data-bit: "1"
1219-1236 uart: rx-data-bit: "0"
1228-1245 uart: tx-data-bit: "0"
1236-1253 uart: rx-data-bit: "1"
1114-1253 uart: rx-data: "A8"
1245-1262 uart: tx-data-bit: "0"
1253-1271 uart: rx-stop: "Stop bit" "Stop" "T"
1262-1280 uart: tx-data-bit: "0"
1271-1288 uart: rx-start: "Start bit" "Start" "S"
1280-1297 uart: tx-data-bit: "0"
1288-1306 uart: rx-data-bit: "0"
1297-1315 uart: tx-data-bit: "0"
1306-1323 uart: rx-data-bit: "0"
1315-1332 uart: tx-data-bit: "0"
1323-1340 uart: rx-data-bit: "0"
1332-1349 uart: tx-data-bit: "0"
1210-1349 uart: tx-data: "01"
1340-1358 uart: rx-data-bit: "0"
1349-1367 uart: tx-stop: "Stop bit" "Stop" "T"
1358-1375 uart: rx-data-bit: "1"
1366-1383 uart: tx-start: "Start bit" "Start" "S"
1375-1393 uart: rx-data-bit: "1"
1383-1401 uart: tx-data-bit: "0"
1393-1410 uart: rx-data-bit: "0"
1401-1418 uart: tx-data-bit: "0"
1410-1427 uart: rx-data-bit: "1"
1288-1427 uart: rx-data: "B0"
1418-1435 uart: tx-data-bit: "0"
1427-1445 uart: rx-stop: "Stop bit" "Stop" "T"
1435-1453 uart: tx-data-bit: "0"
1444-1461 uart: rx-start: "Start bit" "Start" "S"
1453-1470 uart: tx-data-bit: "0"
1461-1479 uart: rx-data-bit: "1"
1470-1488 uart: tx-data-bit: "0"
1479-1496 uart: rx-data-bit: "1"
1488-1505 uart: tx-data-bit: "0"
1496-1513 uart: rx-data-bit: "1"
1505-1522 uart: tx-data-bit: "0"
1383-1522 uart: tx-data: "00"
1513-1531 uart: rx-data-bit: "1"
1522-1540 uart: tx-stop: "Stop bit" "Stop" "T"
1193-1540 uart: tx-packet: "01 00"
1531-1548 uart: rx-data-bit: "1"
1540-1557 uart: tx-start: "Start bit" "Start" "S"
1548-1566 uart: rx-data-bit: "0"
1557-1575 uart: tx-data-bit: "1"
1566-1583 uart: rx-data-bit: "0"
1575-1592 uart: tx-data-bit: "0"
1583-1600 uart: rx-data-bit: "0"
1461-1600 uart: rx-data: "1F"
1592-1609 uart: tx-data-bit: "1"
1600-1618 uart: rx-stop: "Stop bit" "Stop" "T"
1609-1627 uart: tx-data-bit: "0"
1617-1634 uart: rx-start: "Start bit" "Start" "S"
1627-1644 uart: tx-data-bit: "1"
1634-1652 uart: rx-data-bit: "0"
1644-1662 uart: tx-data-bit: "1"
1652-1669 uart: rx-data-bit: "1"
1662-1679 uart: tx-data-bit: "1"
1669-1686 uart: rx-data-bit: "0"
1679-1696 uart: tx-data-bit: "0"
1557-1696 uart: tx-data: "75"
1686-1704 uart: rx-data-bit: "1"
1696-1714 uart: tx-stop: "Stop bit" "Stop" "T"
1704-1721 uart: rx-data-bit: "1"
1721-1739 uart: rx-data-bit: "0"
1739-1756 uart: rx-data-bit: "0"
1756-1773 uart: rx-data-bit: "1"
1634-1773 uart: rx-data: "9A"
1773-1791 uart: rx-stop: "Stop bit" "Stop" "T"
924-1791 uart: rx-packet: "C0 A8 B0 1F 9A"
