117-144 uart: tx-start: "Start bit" "Start" "S"
143-170 uart: tx-data-bits: "0"
169-196 uart: tx-data-bits: "0"
195-222 uart: tx-data-bits: "0"
221-248 uart: tx-data-bits: "0"
247-274 uart: tx-data-bits: "0"
273-300 uart: tx-data-bits: "0"
299-326 uart: tx-data-bits: "0"
325-352 uart: tx-data-bits: "1"
143-352 uart: tx-data: "128"
351-378 uart: tx-parity-ok: "Stop bit" "Stop" "T"
632-659 uart: tx-start: "Start bit" "Start" "S"
658-685 uart: tx-data-bits: "1"
684-711 uart: tx-data-bits: "0"
710-737 uart: tx-data-bits: "0"
736-763 uart: tx-data-bits: "0"
762-789 uart: tx-data-bits: "0"
788-815 uart: tx-data-bits: "0"
814-841 uart: tx-data-bits: "0"
840-867 uart: tx-data-bits: "1"
658-867 uart: tx-data: "129"
866-893 uart: tx-parity-ok: "Stop bit" "Stop" "T"
1148-1175 uart: tx-start: "Start bit" "Start" "S"
1174-1201 uart: tx-data-bits: "0"
1200-1227 uart: tx-data-bits: "1"
1226-1253 uart: tx-data-bits: "0"
1252-1279 uart: tx-data-bits: "0"
1278-1305 uart: tx-data-bits: "0"
1304-1331 uart: tx-data-bits: "0"
1330-1357 uart: tx-data-bits: "0"
1356-1383 uart: tx-data-bits: "1"
1174-1383 uart: tx-data: "130"
1382-1409 uart: tx-parity-ok: "Stop bit" "Stop" "T"
1665-1692 uart: tx-start: "Start bit" "Start" "S"
1691-1718 uart: tx-data-bits: "1"
1717-1744 uart: tx-data-bits: "1"
1743-1770 uart: tx-data-bits: "0"
1769-1796 uart: tx-data-bits: "0"
1795-1822 uart: tx-data-bits: "0"
1821-1848 uart: tx-data-bits: "0"
1847-1874 uart: tx-data-bits: "0"
1873-1900 uart: tx-data-bits: "1"
1691-1900 uart: tx-data: "131"
1899-1926 uart: tx-parity-ok: "Stop bit" "Stop" "T"
2182-2209 uart: tx-start: "Start bit" "Start" "S"
2208-2235 uart: tx-data-bits: "0"
2234-2261 uart: tx-data-bits: "0"
2260-2287 uart: tx-data-bits: "1"
2286-2313 uart: tx-data-bits: "0"
2312-2339 uart: tx-data-bits: "0"
2338-2365 uart: tx-data-bits: "0"
2364-2391 uart: tx-data-bits: "0"
2390-2417 uart: tx-data-bits: "1"
2208-2417 uart: tx-data: "132"
2416-2443 uart: tx-parity-ok: "Stop bit" "Stop" "T"
2698-2725 uart: tx-start: "Start bit" "Start" "S"
2724-2751 uart: tx-data-bits: "1"
2750-2777 uart: tx-data-bits: "0"
2776-2803 uart: tx-data-bits: "1"
2802-2829 uart: tx-data-bits: "0"
2828-2855 uart: tx-data-bits: "0"
2854-2881 uart: tx-data-bits: "0"
2880-2907 uart: tx-data-bits: "0"
2906-2933 uart: tx-data-bits: "1"
2724-2933 uart: tx-data: "133"
2932-2959 uart: tx-parity-ok: "Stop bit" "Stop" "T"
3217-3244 uart: tx-start: "Start bit" "Start" "S"
3243-3270 uart: tx-data-bits: "0"
3269-3296 uart: tx-data-bits: "1"
3295-3322 uart: tx-data-bits: "1"
3321-3348 uart: tx-data-bits: "0"
3347-3374 uart: tx-data-bits: "0"
3373-3400 uart: tx-data-bits: "0"
3399-3426 uart: tx-data-bits: "0"
3425-3452 uart: tx-data-bits: "1"
3243-3452 uart: tx-data: "134"
3451-3478 uart: tx-parity-ok: "Stop bit" "Stop" "T"
3733-3760 uart: tx-start: "Start bit" "Start" "S"
3759-3786 uart: tx-data-bits: "1"
3785-3812 uart: tx-data-bits: "1"
3811-3838 uart: tx-data-bits: "1"
3837-3864 uart: tx-data-bits: "0"
3863-3890 uart: tx-data-bits: "0"
3889-3916 uart: tx-data-bits: "0"
3915-3942 uart: tx-data-bits: "0"
3941-3968 uart: tx-data-bits: "1"
3759-3968 uart: tx-data: "135"
3967-3994 uart: tx-parity-ok: "Stop bit" "Stop" "T"
4250-4277 uart: tx-start: "Start bit" "Start" "S"
4276-4303 uart: tx-data-bits: "0"
4302-4329 uart: tx-data-bits: "0"
4328-4355 uart: tx-data-bits: "0"
4354-4381 uart: tx-data-bits: "1"
4380-4407 uart: tx-data-bits: "0"
4406-4433 uart: tx-data-bits: "0"
4432-4459 uart: tx-data-bits: "0"
4458-4485 uart: tx-data-bits: "1"
4276-4485 uart: tx-data: "136"
4484-4511 uart: tx-parity-ok: "Stop bit" "Stop" "T"
4766-4793 uart: tx-start: "Start bit" "Start" "S"
4792-4819 uart: tx-data-bits: "1"
4818-4845 uart: tx-data-bits: "0"
4844-4871 uart: tx-data-bits: "0"
4870-4897 uart: tx-data-bits: "1"
4896-4923 uart: tx-data-bits: "0"
4922-4949 uart: tx-data-bits: "0"
4948-4975 uart: tx-data-bits: "0"
4974-5001 uart: tx-data-bits: "1"
4792-5001 uart: tx-data: "137"
5000-5027 uart: tx-parity-ok: "Stop bit" "Stop" "T"
5285-5312 uart: tx-start: "Start bit" "Start" "S"
5311-5338 uart: tx-data-bits: "0"
5337-5364 uart: tx-data-bits: "1"
5363-5390 uart: tx-data-bits: "0"
5389-5416 uart: tx-data-bits: "1"
5415-5442 uart: tx-data-bits: "0"
5441-5468 uart: tx-data-bits: "0"
5467-5494 uart: tx-data-bits: "0"
5493-5520 uart: tx-data-bits: "1"
5311-5520 uart: tx-data: "138"
5519-5546 uart: tx-parity-ok: "Stop bit" "Stop" "T"
5804-5831 uart: tx-start: "Start bit" "Start" "S"
5830-5857 uart: tx-data-bits: "1"
5856-5883 uart: tx-data-bits: "1"
5882-5909 uart: tx-data-bits: "0"
5908-5935 uart: tx-data-bits: "1"
5934-5961 uart: tx-data-bits: "0"
5960-5987 uart: tx-data-bits: "0"
5986-6013 uart: tx-data-bits: "0"
6012-6039 uart: tx-data-bits: "1"
5830-6039 uart: tx-data: "139"
6038-6065 uart: tx-parity-ok: "Stop bit" "Stop" "T"
6322-6349 uart: tx-start: "Start bit" "Start" "S"
6348-6375 uart: tx-data-bits: "0"
6374-6401 uart: tx-data-bits: "0"
6400-6427 uart: tx-data-bits: "1"
6426-6453 uart: tx-data-bits: "1"
6452-6479 uart: tx-data-bits: "0"
6478-6505 uart: tx-data-bits: "0"
6504-6531 uart: tx-data-bits: "0"
6530-6557 uart: tx-data-bits: "1"
6348-6557 uart: tx-data: "140"
6556-6583 uart: tx-parity-ok: "Stop bit" "Stop" "T"
6839-6866 uart: tx-start: "Start bit" "Start" "S"
6865-6892 uart: tx-data-bits: "1"
6891-6918 uart: tx-data-bits: "0"
6917-6944 uart: tx-data-bits: "1"
6943-6970 uart: tx-data-bits: "1"
6969-6996 uart: tx-data-bits: "0"
6995-7022 uart: tx-data-bits: "0"
7021-7048 uart: tx-data-bits: "0"
7047-7074 uart: tx-data-bits: "1"
6865-7074 uart: tx-data: "141"
7073-7100 uart: tx-parity-ok: "Stop bit" "Stop" "T"
7357-7384 uart: tx-start: "Start bit" "Start" "S"
7383-7410 uart: tx-data-bits: "0"
7409-7436 uart: tx-data-bits: "1"
7435-7462 uart: tx-data-bits: "1"
7461-7488 uart: tx-data-bits: "1"
7487-7514 uart: tx-data-bits: "0"
7513-7540 uart: tx-data-bits: "0"
7539-7566 uart: tx-data-bits: "0"
7565-7592 uart: tx-data-bits: "1"
7383-7592 uart: tx-data: "142"
7591-7618 uart: tx-parity-ok: "Stop bit" "Stop" "T"
7874-7901 uart: tx-start: "Start bit" "Start" "S"
7900-7927 uart: tx-data-bits: "1"
7926-7953 uart: tx-data-bits: "1"
7952-7979 uart: tx-data-bits: "1"
7978-8005 uart: tx-data-bits: "1"
8004-8031 uart: tx-data-bits: "0"
8030-8057 uart: tx-data-bits: "0"
8056-8083 uart: tx-data-bits: "0"
8082-8109 uart: tx-data-bits: "1"
7900-8109 uart: tx-data: "143"
143-8109 uart: tx-packet: "128 129 130 131 132 133 134 135 136 137 138 139 140 141 142 143"
8108-8135 uart: tx-parity-ok: "Stop bit" "Stop" "T"
8391-8418 uart: tx-start: "Start bit" "Start" "S"
8417-8444 uart: tx-data-bits: "0"
8443-8470 uart: tx-data-bits: "0"
8469-8496 uart: tx-data-bits: "0"
8495-8522 uart: tx-data-bits: "0"
8521-8548 uart: tx-data-bits: "1"
8547-8574 uart: tx-data-bits: "0"
8573-8600 uart: tx-data-bits: "0"
8599-8626 uart: tx-data-bits: "1"
8417-8626 uart: tx-data: "144"
8625-8652 uart: tx-parity-ok: "Stop bit" "Stop" "T"
8907-8934 uart: tx-start: "Start bit" "Start" "S"
8933-8960 uart: tx-data-bits: "1"
8959-8986 uart: tx-data-bits: "0"
8985-9012 uart: tx-data-bits: "0"
9011-9038 uart: tx-data-bits: "0"
9037-9064 uart: tx-data-bits: "1"
9063-9090 uart: tx-data-bits: "0"
9089-9116 uart: tx-data-bits: "0"
9115-9142 uart: tx-data-bits: "1"
8933-9142 uart: tx-data: "145"
9141-9168 uart: tx-parity-ok: "Stop bit" "Stop" "T"
9426-9453 uart: tx-start: "Start bit" "Start" "S"
9452-9479 uart: tx-data-bits: "0"
9478-9505 uart: tx-data-bits: "1"
9504-9531 uart: tx-data-bits: "0"
9530-9557 uart: tx-data-bits: "0"
9556-9583 uart: tx-data-bits: "1"
9582-9609 uart: tx-data-bits: "0"
9608-9635 uart: tx-data-bits: "0"
9634-9661 uart: tx-data-bits: "1"
9452-9661 uart: tx-data: "146"
9660-9687 uart: tx-parity-ok: "Stop bit" "Stop" "T"
9944-9971 uart: tx-start: "Start bit" "Start" "S"
9970-9997 uart: tx-data-bits: "1"
9996-10023 uart: tx-data-bits: "1"
10022-10049 uart: tx-data-bits: "0"
10048-10075 uart: tx-data-bits: "0"
10074-10101 uart: tx-data-bits: "1"
10100-10127 uart: tx-data-bits: "0"
10126-10153 uart: tx-data-bits: "0"
10152-10179 uart: tx-data-bits: "1"
9970-10179 uart: tx-data: "147"
10178-10205 uart: tx-parity-ok: "Stop bit" "Stop" "T"
10463-10490 uart: tx-start: "Start bit" "Start" "S"
10489-10516 uart: tx-data-bits: "0"
10515-10542 uart: tx-data-bits: "0"
10541-10568 uart: tx-data-bits: "1"
10567-10594 uart: tx-data-bits: "0"
10593-10620 uart: tx-data-bits: "1"
10619-10646 uart: tx-data-bits: "0"
10645-10672 uart: tx-data-bits: "0"
10671-10698 uart: tx-data-bits: "1"
10489-10698 uart: tx-data: "148"
10697-10724 uart: tx-parity-ok: "Stop bit" "Stop" "T"
10981-11008 uart: tx-start: "Start bit" "Start" "S"
11007-11034 uart: tx-data-bits: "1"
11033-11060 uart: tx-data-bits: "0"
11059-11086 uart: tx-data-bits: "1"
11085-11112 uart: tx-data-bits: "0"
11111-11138 uart: tx-data-bits: "1"
11137-11164 uart: tx-data-bits: "0"
11163-11190 uart: tx-data-bits: "0"
11189-11216 uart: tx-data-bits: "1"
11007-11216 uart: tx-data: "149"
11215-11242 uart: tx-parity-ok: "Stop bit" "Stop" "T"
11502-11529 uart: tx-start: "Start bit" "Start" "S"
11528-11555 uart: tx-data-bits: "0"
11554-11581 uart: tx-data-bits: "1"
11580-11607 uart: tx-data-bits: "1"
11606-11633 uart: tx-data-bits: "0"
11632-11659 uart: tx-data-bits: "1"
11658-11685 uart: tx-data-bits: "0"
11684-11711 uart: tx-data-bits: "0"
11710-11737 uart: tx-data-bits: "1"
11528-11737 uart: tx-data: "150"
11736-11763 uart: tx-parity-ok: "Stop bit" "Stop" "T"
12021-12048 uart: tx-start: "Start bit" "Start" "S"
12047-12074 uart: tx-data-bits: "1"
12073-12100 uart: tx-data-bits: "1"
12099-12126 uart: tx-data-bits: "1"
12125-12152 uart: tx-data-bits: "0"
12151-12178 uart: tx-data-bits: "1"
12177-12204 uart: tx-data-bits: "0"
12203-12230 uart: tx-data-bits: "0"
12229-12256 uart: tx-data-bits: "1"
12047-12256 uart: tx-data: "151"
12255-12282 uart: tx-parity-ok: "Stop bit" "Stop" "T"
12539-12566 uart: tx-start: "Start bit" "Start" "S"
12565-12592 uart: tx-data-bits: "0"
12591-12618 uart: tx-data-bits: "0"
12617-12644 uart: tx-data-bits: "0"
12643-12670 uart: tx-data-bits: "1"
12669-12696 uart: tx-data-bits: "1"
12695-12722 uart: tx-data-bits: "0"
12721-12748 uart: tx-data-bits: "0"
12747-12774 uart: tx-data-bits: "1"
12565-12774 uart: tx-data: "152"
12773-12800 uart: tx-parity-ok: "Stop bit" "Stop" "T"
13056-13083 uart: tx-start: "Start bit" "Start" "S"
13082-13109 uart: tx-data-bits: "1"
13108-13135 uart: tx-data-bits: "0"
13134-13161 uart: tx-data-bits: "0"
13160-13187 uart: tx-data-bits: "1"
13186-13213 uart: tx-data-bits: "1"
13212-13239 uart: tx-data-bits: "0"
13238-13265 uart: tx-data-bits: "0"
13264-13291 uart: tx-data-bits: "1"
13082-13291 uart: tx-data: "153"
13290-13317 uart: tx-parity-ok: "Stop bit" "Stop" "T"
13574-13601 uart: tx-start: "Start bit" "Start" "S"
13600-13627 uart: tx-data-bits: "0"
13626-13653 uart: tx-data-bits: "1"
13652-13679 uart: tx-data-bits: "0"
13678-13705 uart: tx-data-bits: "1"
13704-13731 uart: tx-data-bits: "1"
13730-13757 uart: tx-data-bits: "0"
13756-13783 uart: tx-data-bits: "0"
13782-13809 uart: tx-data-bits: "1"
13600-13809 uart: tx-data: "154"
13808-13835 uart: tx-parity-ok: "Stop bit" "Stop" "T"
14093-14120 uart: tx-start: "Start bit" "Start" "S"
14119-14146 uart: tx-data-bits: "1"
14145-14172 uart: tx-data-bits: "1"
14171-14198 uart: tx-data-bits: "0"
14197-14224 uart: tx-data-bits: "1"
14223-14250 uart: tx-data-bits: "1"
14249-14276 uart: tx-data-bits: "0"
14275-14302 uart: tx-data-bits: "0"
14301-14328 uart: tx-data-bits: "1"
14119-14328 uart: tx-data: "155"
14327-14354 uart: tx-parity-ok: "Stop bit" "Stop" "T"
14612-14639 uart: tx-start: "Start bit" "Start" "S"
14638-14665 uart: tx-data-bits: "0"
14664-14691 uart: tx-data-bits: "0"
14690-14717 uart: tx-data-bits: "1"
14716-14743 uart: tx-data-bits: "1"
14742-14769 uart: tx-data-bits: "1"
14768-14795 uart: tx-data-bits: "0"
14794-14821 uart: tx-data-bits: "0"
14820-14847 uart: tx-data-bits: "1"
14638-14847 uart: tx-data: "156"
14846-14873 uart: tx-parity-ok: "Stop bit" "Stop" "T"
15128-15155 uart: tx-start: "Start bit" "Start" "S"
15154-15181 uart: tx-data-bits: "1"
15180-15207 uart: tx-data-bits: "0"
15206-15233 uart: tx-data-bits: "1"
15232-15259 uart: tx-data-bits: "1"
15258-15285 uart: tx-data-bits: "1"
15284-15311 uart: tx-data-bits: "0"
15310-15337 uart: tx-data-bits: "0"
15336-15363 uart: tx-data-bits: "1"
15154-15363 uart: tx-data: "157"
15362-15389 uart: tx-parity-ok: "Stop bit" "Stop" "T"
15647-15674 uart: tx-start: "Start bit" "Start" "S"
15673-15700 uart: tx-data-bits: "0"
15699-15726 uart: tx-data-bits: "1"
15725-15752 uart: tx-data-bits: "1"
15751-15778 uart: tx-data-bits: "1"
15777-15804 uart: tx-data-bits: "1"
15803-15830 uart: tx-data-bits: "0"
15829-15856 uart: tx-data-bits: "0"
15855-15882 uart: tx-data-bits: "1"
15673-15882 uart: tx-data: "158"
15881-15908 uart: tx-parity-ok: "Stop bit" "Stop" "T"
16163-16190 uart: tx-start: "Start bit" "Start" "S"
16189-16216 uart: tx-data-bits: "1"
16215-16242 uart: tx-data-bits: "1"
16241-16268 uart: tx-data-bits: "1"
16267-16294 uart: tx-data-bits: "1"
16293-16320 uart: tx-data-bits: "1"
16319-16346 uart: tx-data-bits: "0"
16345-16372 uart: tx-data-bits: "0"
16371-16398 uart: tx-data-bits: "1"
16189-16398 uart: tx-data: "159"
8417-16398 uart: tx-packet: "144 145 146 147 148 149 150 151 152 153 154 155 156 157 158 159"
16397-16424 uart: tx-parity-ok: "Stop bit" "Stop" "T"
16680-16707 uart: tx-start: "Start bit" "Start" "S"
16706-16733 uart: tx-data-bits: "0"
16732-16759 uart: tx-data-bits: "0"
16758-16785 uart: tx-data-bits: "0"
16784-16811 uart: tx-data-bits: "0"
16810-16837 uart: tx-data-bits: "0"
16836-16863 uart: tx-data-bits: "1"
16862-16889 uart: tx-data-bits: "0"
16888-16915 uart: tx-data-bits: "1"
16706-16915 uart: tx-data: "160"
16914-16941 uart: tx-parity-ok: "Stop bit" "Stop" "T"
17196-17223 uart: tx-start: "Start bit" "Start" "S"
17222-17249 uart: tx-data-bits: "1"
17248-17275 uart: tx-data-bits: "0"
17274-17301 uart: tx-data-bits: "0"
17300-17327 uart: tx-data-bits: "0"
17326-17353 uart: tx-data-bits: "0"
17352-17379 uart: tx-data-bits: "1"
17378-17405 uart: tx-data-bits: "0"
17404-17431 uart: tx-data-bits: "1"
17222-17431 uart: tx-data: "161"
17430-17457 uart: tx-parity-ok: "Stop bit" "Stop" "T"
17715-17742 uart: tx-start: "Start bit" "Start" "S"
17741-17768 uart: tx-data-bits: "0"
17767-17794 uart: tx-data-bits: "1"
17793-17820 uart: tx-data-bits: "0"
17819-17846 uart: tx-data-bits: "0"
17845-17872 uart: tx-data-bits: "0"
17871-17898 uart: tx-data-bits: "1"
17897-17924 uart: tx-data-bits: "0"
17923-17950 uart: tx-data-bits: "1"
17741-17950 uart: tx-data: "162"
17949-17976 uart: tx-parity-ok: "Stop bit" "Stop" "T"
18234-18261 uart: tx-start: "Start bit" "Start" "S"
18260-18287 uart: tx-data-bits: "1"
18286-18313 uart: tx-data-bits: "1"
18312-18339 uart: tx-data-bits: "0"
18338-18365 uart: tx-data-bits: "0"
18364-18391 uart: tx-data-bits: "0"
18390-18417 uart: tx-data-bits: "1"
18416-18443 uart: tx-data-bits: "0"
18442-18469 uart: tx-data-bits: "1"
18260-18469 uart: tx-data: "163"
18468-18495 uart: tx-parity-ok: "Stop bit" "Stop" "T"
18752-18779 uart: tx-start: "Start bit" "Start" "S"
18778-18805 uart: tx-data-bits: "0"
18804-18831 uart: tx-data-bits: "0"
18830-18857 uart: tx-data-bits: "1"
18856-18883 uart: tx-data-bits: "0"
18882-18909 uart: tx-data-bits: "0"
18908-18935 uart: tx-data-bits: "1"
18934-18961 uart: tx-data-bits: "0"
18960-18987 uart: tx-data-bits: "1"
18778-18987 uart: tx-data: "164"
18986-19013 uart: tx-parity-ok: "Stop bit" "Stop" "T"
19271-19298 uart: tx-start: "Start bit" "Start" "S"
19297-19324 uart: tx-data-bits: "1"
19323-19350 uart: tx-data-bits: "0"
19349-19376 uart: tx-data-bits: "1"
19375-19402 uart: tx-data-bits: "0"
19401-19428 uart: tx-data-bits: "0"
19427-19454 uart: tx-data-bits: "1"
19453-19480 uart: tx-data-bits: "0"
19479-19506 uart: tx-data-bits: "1"
19297-19506 uart: tx-data: "165"
19505-19532 uart: tx-parity-ok: "Stop bit" "Stop" "T"
19791-19818 uart: tx-start: "Start bit" "Start" "S"
19817-19844 uart: tx-data-bits: "0"
19843-19870 uart: tx-data-bits: "1"
19869-19896 uart: tx-data-bits: "1"
19895-19922 uart: tx-data-bits: "0"
19921-19948 uart: tx-data-bits: "0"
19947-19974 uart: tx-data-bits: "1"
19973-20000 uart: tx-data-bits: "0"
19999-20026 uart: tx-data-bits: "1"
19817-20026 uart: tx-data: "166"
20025-20052 uart: tx-parity-ok: "Stop bit" "Stop" "T"
20310-20337 uart: tx-start: "Start bit" "Start" "S"
20336-20363 uart: tx-data-bits: "1"
20362-20389 uart: tx-data-bits: "1"
20388-20415 uart: tx-data-bits: "1"
20414-20441 uart: tx-data-bits: "0"
20440-20467 uart: tx-data-bits: "0"
20466-20493 uart: tx-data-bits: "1"
20492-20519 uart: tx-data-bits: "0"
20518-20545 uart: tx-data-bits: "1"
20336-20545 uart: tx-data: "167"
20544-20571 uart: tx-parity-ok: "Stop bit" "Stop" "T"
20829-20856 uart: tx-start: "Start bit" "Start" "S"
20855-20882 uart: tx-data-bits: "0"
20881-20908 uart: tx-data-bits: "0"
20907-20934 uart: tx-data-bits: "0"
20933-20960 uart: tx-data-bits: "1"
20959-20986 uart: tx-data-bits: "0"
20985-21012 uart: tx-data-bits: "1"
21011-21038 uart: tx-data-bits: "0"
21037-21064 uart: tx-data-bits: "1"
20855-21064 uart: tx-data: "168"
21063-21090 uart: tx-parity-ok: "Stop bit" "Stop" "T"
21347-21374 uart: tx-start: "Start bit" "Start" "S"
21373-21400 uart: tx-data-bits: "1"
21399-21426 uart: tx-data-bits: "0"
21425-21452 uart: tx-data-bits: "0"
21451-21478 uart: tx-data-bits: "1"
21477-21504 uart: tx-data-bits: "0"
21503-21530 uart: tx-data-bits: "1"
21529-21556 uart: tx-data-bits: "0"
21555-21582 uart: tx-data-bits: "1"
21373-21582 uart: tx-data: "169"
21581-21608 uart: tx-parity-ok: "Stop bit" "Stop" "T"
21868-21895 uart: tx-start: "Start bit" "Start" "S"
21894-21921 uart: tx-data-bits: "0"
21920-21947 uart: tx-data-bits: "1"
21946-21973 uart: tx-data-bits: "0"
21972-21999 uart: tx-data-bits: "1"
21998-22025 uart: tx-data-bits: "0"
22024-22051 uart: tx-data-bits: "1"
22050-22077 uart: tx-data-bits: "0"
22076-22103 uart: tx-data-bits: "1"
21894-22103 uart: tx-data: "170"
22102-22129 uart: tx-parity-ok: "Stop bit" "Stop" "T"
22388-22415 uart: tx-start: "Start bit" "Start" "S"
22414-22441 uart: tx-data-bits: "1"
22440-22467 uart: tx-data-bits: "1"
22466-22493 uart: tx-data-bits: "0"
22492-22519 uart: tx-data-bits: "1"
22518-22545 uart: tx-data-bits: "0"
22544-22571 uart: tx-data-bits: "1"
22570-22597 uart: tx-data-bits: "0"
22596-22623 uart: tx-data-bits: "1"
22414-22623 uart: tx-data: "171"
22622-22649 uart: tx-parity-ok: "Stop bit" "Stop" "T"
22909-22936 uart: tx-start: "Start bit" "Start" "S"
22935-22962 uart: tx-data-bits: "0"
22961-22988 uart: tx-data-bits: "0"
22987-23014 uart: tx-data-bits: "1"
23013-23040 uart: tx-data-bits: "1"
23039-23066 uart: tx-data-bits: "0"
23065-23092 uart: tx-data-bits: "1"
23091-23118 uart: tx-data-bits: "0"
23117-23144 uart: tx-data-bits: "1"
22935-23144 uart: tx-data: "172"
23143-23170 uart: tx-parity-ok: "Stop bit" "Stop" "T"
23427-23454 uart: tx-start: "Start bit" "Start" "S"
23453-23480 uart: tx-data-bits: "1"
23479-23506 uart: tx-data-bits: "0"
23505-23532 uart: tx-data-bits: "1"
23531-23558 uart: tx-data-bits: "1"
23557-23584 uart: tx-data-bits: "0"
23583-23610 uart: tx-data-bits: "1"
23609-23636 uart: tx-data-bits: "0"
23635-23662 uart: tx-data-bits: "1"
23453-23662 uart: tx-data: "173"
23661-23688 uart: tx-parity-ok: "Stop bit" "Stop" "T"
23948-23975 uart: tx-start: "Start bit" "Start" "S"
23974-24001 uart: tx-data-bits: "0"
24000-24027 uart: tx-data-bits: "1"
24026-24053 uart: tx-data-bits: "1"
24052-24079 uart: tx-data-bits: "1"
24078-24105 uart: tx-data-bits: "0"
24104-24131 uart: tx-data-bits: "1"
24130-24157 uart: tx-data-bits: "0"
24156-24183 uart: tx-data-bits: "1"
23974-24183 uart: tx-data: "174"
24182-24209 uart: tx-parity-ok: "Stop bit" "Stop" "T"
24467-24494 uart: tx-start: "Start bit" "Start" "S"
24493-24520 uart: tx-data-bits: "1"
24519-24546 uart: tx-data-bits: "1"
24545-24572 uart: tx-data-bits: "1"
24571-24598 uart: tx-data-bits: "1"
24597-24624 uart: tx-data-bits: "0"
24623-24650 uart: tx-data-bits: "1"
24649-24676 uart: tx-data-bits: "0"
24675-24702 uart: tx-data-bits: "1"
24493-24702 uart: tx-data: "175"
16706-24702 uart: tx-packet: "160 161 162 163 164 165 166 167 168 169 170 171 172 173 174 175"
24701-24728 uart: tx-parity-ok: "Stop bit" "Stop" "T"
24985-25012 uart: tx-start: "Start bit" "Start" "S"
25011-25038 uart: tx-data-bits: "0"
25037-25064 uart: tx-data-bits: "0"
25063-25090 uart: tx-data-bits: "0"
25089-25116 uart: tx-data-bits: "0"
25115-25142 uart: tx-data-bits: "1"
25141-25168 uart: tx-data-bits: "1"
25167-25194 uart: tx-data-bits: "0"
25193-25220 uart: tx-data-bits: "1"
25011-25220 uart: tx-data: "176"
25219-25246 uart: tx-parity-ok: "Stop bit" "Stop" "T"
25502-25529 uart: tx-start: "Start bit" "Start" "S"
25528-25555 uart: tx-data-bits: "1"
25554-25581 uart: tx-data-bits: "0"
25580-25607 uart: tx-data-bits: "0"
25606-25633 uart: tx-data-bits: "0"
25632-25659 uart: tx-data-bits: "1"
25658-25685 uart: tx-data-bits: "1"
25684-25711 uart: tx-data-bits: "0"
25710-25737 uart: tx-data-bits: "1"
25528-25737 uart: tx-data: "177"
25736-25763 uart: tx-parity-ok: "Stop bit" "Stop" "T"
26020-26047 uart: tx-start: "Start bit" "Start" "S"
26046-26073 uart: tx-data-bits: "0"
26072-26099 uart: tx-data-bits: "1"
26098-26125 uart: tx-data-bits: "0"
26124-26151 uart: tx-data-bits: "0"
26150-26177 uart: tx-data-bits: "1"
26176-26203 uart: tx-data-bits: "1"
26202-26229 uart: tx-data-bits: "0"
26228-26255 uart: tx-data-bits: "1"
26046-26255 uart: tx-data: "178"
26254-26281 uart: tx-parity-ok: "Stop bit" "Stop" "T"
26539-26566 uart: tx-start: "Start bit" "Start" "S"
26565-26592 uart: tx-data-bits: "1"
26591-26618 uart: tx-data-bits: "1"
26617-26644 uart: tx-data-bits: "0"
26643-26670 uart: tx-data-bits: "0"
26669-26696 uart: tx-data-bits: "1"
26695-26722 uart: tx-data-bits: "1"
26721-26748 uart: tx-data-bits: "0"
26747-26774 uart: tx-data-bits: "1"
26565-26774 uart: tx-data: "179"
26773-26800 uart: tx-parity-ok: "Stop bit" "Stop" "T"
27058-27085 uart: tx-start: "Start bit" "Start" "S"
27084-27111 uart: tx-data-bits: "0"
27110-27137 uart: tx-data-bits: "0"
27136-27163 uart: tx-data-bits: "1"
27162-27189 uart: tx-data-bits: "0"
27188-27215 uart: tx-data-bits: "1"
27214-27241 uart: tx-data-bits: "1"
27240-27267 uart: tx-data-bits: "0"
27266-27293 uart: tx-data-bits: "1"
27084-27293 uart: tx-data: "180"
27292-27319 uart: tx-parity-ok: "Stop bit" "Stop" "T"
27576-27603 uart: tx-start: "Start bit" "Start" "S"
27602-27629 uart: tx-data-bits: "1"
27628-27655 uart: tx-data-bits: "0"
27654-27681 uart: tx-data-bits: "1"
27680-27707 uart: tx-data-bits: "0"
27706-27733 uart: tx-data-bits: "1"
27732-27759 uart: tx-data-bits: "1"
27758-27785 uart: tx-data-bits: "0"
27784-27811 uart: tx-data-bits: "1"
27602-27811 uart: tx-data: "181"
27810-27837 uart: tx-parity-ok: "Stop bit" "Stop" "T"
28097-28124 uart: tx-start: "Start bit" "Start" "S"
28123-28150 uart: tx-data-bits: "0"
28149-28176 uart: tx-data-bits: "1"
28175-28202 uart: tx-data-bits: "1"
28201-28228 uart: tx-data-bits: "0"
28227-28254 uart: tx-data-bits: "1"
28253-28280 uart: tx-data-bits: "1"
28279-28306 uart: tx-data-bits: "0"
28305-28332 uart: tx-data-bits: "1"
28123-28332 uart: tx-data: "182"
28331-28358 uart: tx-parity-ok: "Stop bit" "Stop" "T"
28615-28642 uart: tx-start: "Start bit" "Start" "S"
28641-28668 uart: tx-data-bits: "1"
28667-28694 uart: tx-data-bits: "1"
28693-28720 uart: tx-data-bits: "1"
28719-28746 uart: tx-data-bits: "0"
28745-28772 uart: tx-data-bits: "1"
28771-28798 uart: tx-data-bits: "1"
28797-28824 uart: tx-data-bits: "0"
28823-28850 uart: tx-data-bits: "1"
28641-28850 uart: tx-data: "183"
28849-28876 uart: tx-parity-ok: "Stop bit" "Stop" "T"
29134-29161 uart: tx-start: "Start bit" "Start" "S"
29160-29187 uart: tx-data-bits: "0"
29186-29213 uart: tx-data-bits: "0"
29212-29239 uart: tx-data-bits: "0"
29238-29265 uart: tx-data-bits: "1"
29264-29291 uart: tx-data-bits: "1"
29290-29317 uart: tx-data-bits: "1"
29316-29343 uart: tx-data-bits: "0"
29342-29369 uart: tx-data-bits: "1"
29160-29369 uart: tx-data: "184"
29368-29395 uart: tx-parity-ok: "Stop bit" "Stop" "T"
29650-29677 uart: tx-start: "Start bit" "Start" "S"
29676-29703 uart: tx-data-bits: "1"
29702-29729 uart: tx-data-bits: "0"
29728-29755 uart: tx-data-bits: "0"
29754-29781 uart: tx-data-bits: "1"
29780-29807 uart: tx-data-bits: "1"
29806-29833 uart: tx-data-bits: "1"
29832-29859 uart: tx-data-bits: "0"
29858-29885 uart: tx-data-bits: "1"
29676-29885 uart: tx-data: "185"
29884-29911 uart: tx-parity-ok: "Stop bit" "Stop" "T"
30169-30196 uart: tx-start: "Start bit" "Start" "S"
30195-30222 uart: tx-data-bits: "0"
30221-30248 uart: tx-data-bits: "1"
30247-30274 uart: tx-data-bits: "0"
30273-30300 uart: tx-data-bits: "1"
30299-30326 uart: tx-data-bits: "1"
30325-30352 uart: tx-data-bits: "1"
30351-30378 uart: tx-data-bits: "0"
30377-30404 uart: tx-data-bits: "1"
30195-30404 uart: tx-data: "186"
30403-30430 uart: tx-parity-ok: "Stop bit" "Stop" "T"
30688-30715 uart: tx-start: "Start bit" "Start" "S"
30714-30741 uart: tx-data-bits: "1"
30740-30767 uart: tx-data-bits: "1"
30766-30793 uart: tx-data-bits: "0"
30792-30819 uart: tx-data-bits: "1"
30818-30845 uart: tx-data-bits: "1"
30844-30871 uart: tx-data-bits: "1"
30870-30897 uart: tx-data-bits: "0"
30896-30923 uart: tx-data-bits: "1"
30714-30923 uart: tx-data: "187"
30922-30949 uart: tx-parity-ok: "Stop bit" "Stop" "T"
31206-31233 uart: tx-start: "Start bit" "Start" "S"
31232-31259 uart: tx-data-bits: "0"
31258-31285 uart: tx-data-bits: "0"
31284-31311 uart: tx-data-bits: "1"
31310-31337 uart: tx-data-bits: "1"
31336-31363 uart: tx-data-bits: "1"
31362-31389 uart: tx-data-bits: "1"
31388-31415 uart: tx-data-bits: "0"
31414-31441 uart: tx-data-bits: "1"
31232-31441 uart: tx-data: "188"
31440-31467 uart: tx-parity-ok: "Stop bit" "Stop" "T"
31723-31750 uart: tx-start: "Start bit" "Start" "S"
31749-31776 uart: tx-data-bits: "1"
31775-31802 uart: tx-data-bits: "0"
31801-31828 uart: tx-data-bits: "1"
31827-31854 uart: tx-data-bits: "1"
31853-31880 uart: tx-data-bits: "1"
31879-31906 uart: tx-data-bits: "1"
31905-31932 uart: tx-data-bits: "0"
31931-31958 uart: tx-data-bits: "1"
31749-31958 uart: tx-data: "189"
31957-31984 uart: tx-parity-ok: "Stop bit" "Stop" "T"
32241-32268 uart: tx-start: "Start bit" "Start" "S"
32267-32294 uart: tx-data-bits: "0"
32293-32320 uart: tx-data-bits: "1"
32319-32346 uart: tx-data-bits: "1"
32345-32372 uart: tx-data-bits: "1"
32371-32398 uart: tx-data-bits: "1"
32397-32424 uart: tx-data-bits: "1"
32423-32450 uart: tx-data-bits: "0"
32449-32476 uart: tx-data-bits: "1"
32267-32476 uart: tx-data: "190"
32475-32502 uart: tx-parity-ok: "Stop bit" "Stop" "T"
32758-32785 uart: tx-start: "Start bit" "Start" "S"
32784-32811 uart: tx-data-bits: "1"
32810-32837 uart: tx-data-bits: "1"
32836-32863 uart: tx-data-bits: "1"
32862-32889 uart: tx-data-bits: "1"
32888-32915 uart: tx-data-bits: "1"
32914-32941 uart: tx-data-bits: "1"
32940-32967 uart: tx-data-bits: "0"
32966-32993 uart: tx-data-bits: "1"
32784-32993 uart: tx-data: "191"
25011-32993 uart: tx-packet: "176 177 178 179 180 181 182 183 184 185 186 187 188 189 190 191"
32992-33019 uart: tx-parity-ok: "Stop bit" "Stop" "T"
33275-33302 uart: tx-start: "Start bit" "Start" "S"
33301-33328 uart: tx-data-bits: "0"
33327-33354 uart: tx-data-bits: "0"
33353-33380 uart: tx-data-bits: "0"
33379-33406 uart: tx-data-bits: "0"
33405-33432 uart: tx-data-bits: "0"
33431-33458 uart: tx-data-bits: "0"
33457-33484 uart: tx-data-bits: "1"
33483-33510 uart: tx-data-bits: "1"
33301-33510 uart: tx-data: "192"
33509-33536 uart: tx-parity-ok: "Stop bit" "Stop" "T"
33789-33816 uart: tx-start: "Start bit" "Start" "S"
33815-33842 uart: tx-data-bits: "1"
33841-33868 uart: tx-data-bits: "0"
33867-33894 uart: tx-data-bits: "0"
33893-33920 uart: tx-data-bits: "0"
33919-33946 uart: tx-data-bits: "0"
33945-33972 uart: tx-data-bits: "0"
33971-33998 uart: tx-data-bits: "1"
33997-34024 uart: tx-data-bits: "1"
33815-34024 uart: tx-data: "193"
34023-34050 uart: tx-parity-ok: "Stop bit" "Stop" "T"
34306-34333 uart: tx-start: "Start bit" "Start" "S"
34332-34359 uart: tx-data-bits: "0"
34358-34385 uart: tx-data-bits: "1"
34384-34411 uart: tx-data-bits: "0"
34410-34437 uart: tx-data-bits: "0"
34436-34463 uart: tx-data-bits: "0"
34462-34489 uart: tx-data-bits: "0"
34488-34515 uart: tx-data-bits: "1"
34514-34541 uart: tx-data-bits: "1"
34332-34541 uart: tx-data: "194"
34540-34567 uart: tx-parity-ok: "Stop bit" "Stop" "T"
34822-34849 uart: tx-start: "Start bit" "Start" "S"
34848-34875 uart: tx-data-bits: "1"
34874-34901 uart: tx-data-bits: "1"
34900-34927 uart: tx-data-bits: "0"
34926-34953 uart: tx-data-bits: "0"
34952-34979 uart: tx-data-bits: "0"
34978-35005 uart: tx-data-bits: "0"
35004-35031 uart: tx-data-bits: "1"
35030-35057 uart: tx-data-bits: "1"
34848-35057 uart: tx-data: "195"
35056-35083 uart: tx-parity-ok: "Stop bit" "Stop" "T"
35339-35366 uart: tx-start: "Start bit" "Start" "S"
35365-35392 uart: tx-data-bits: "0"
35391-35418 uart: tx-data-bits: "0"
35417-35444 uart: tx-data-bits: "1"
35443-35470 uart: tx-data-bits: "0"
35469-35496 uart: tx-data-bits: "0"
35495-35522 uart: tx-data-bits: "0"
35521-35548 uart: tx-data-bits: "1"
35547-35574 uart: tx-data-bits: "1"
35365-35574 uart: tx-data: "196"
35573-35600 uart: tx-parity-ok: "Stop bit" "Stop" "T"
35856-35883 uart: tx-start: "Start bit" "Start" "S"
35882-35909 uart: tx-data-bits: "1"
35908-35935 uart: tx-data-bits: "0"
35934-35961 uart: tx-data-bits: "1"
35960-35987 uart: tx-data-bits: "0"
35986-36013 uart: tx-data-bits: "0"
36012-36039 uart: tx-data-bits: "0"
36038-36065 uart: tx-data-bits: "1"
36064-36091 uart: tx-data-bits: "1"
35882-36091 uart: tx-data: "197"
36090-36117 uart: tx-parity-ok: "Stop bit" "Stop" "T"
36374-36401 uart: tx-start: "Start bit" "Start" "S"
36400-36427 uart: tx-data-bits: "0"
36426-36453 uart: tx-data-bits: "1"
36452-36479 uart: tx-data-bits: "1"
36478-36505 uart: tx-data-bits: "0"
36504-36531 uart: tx-data-bits: "0"
36530-36557 uart: tx-data-bits: "0"
36556-36583 uart: tx-data-bits: "1"
36582-36609 uart: tx-data-bits: "1"
36400-36609 uart: tx-data: "198"
36608-36635 uart: tx-parity-ok: "Stop bit" "Stop" "T"
36891-36918 uart: tx-start: "Start bit" "Start" "S"
36917-36944 uart: tx-data-bits: "1"
36943-36970 uart: tx-data-bits: "1"
36969-36996 uart: tx-data-bits: "1"
36995-37022 uart: tx-data-bits: "0"
37021-37048 uart: tx-data-bits: "0"
37047-37074 uart: tx-data-bits: "0"
37073-37100 uart: tx-data-bits: "1"
37099-37126 uart: tx-data-bits: "1"
36917-37126 uart: tx-data: "199"
37125-37152 uart: tx-parity-ok: "Stop bit" "Stop" "T"
37407-37434 uart: tx-start: "Start bit" "Start" "S"
37433-37460 uart: tx-data-bits: "0"
37459-37486 uart: tx-data-bits: "0"
37485-37512 uart: tx-data-bits: "0"
37511-37538 uart: tx-data-bits: "1"
37537-37564 uart: tx-data-bits: "0"
37563-37590 uart: tx-data-bits: "0"
37589-37616 uart: tx-data-bits: "1"
37615-37642 uart: tx-data-bits: "1"
37433-37642 uart: tx-data: "200"
37641-37668 uart: tx-parity-ok: "Stop bit" "Stop" "T"
37924-37951 uart: tx-start: "Start bit" "Start" "S"
37950-37977 uart: tx-data-bits: "1"
37976-38003 uart: tx-data-bits: "0"
38002-38029 uart: tx-data-bits: "0"
38028-38055 uart: tx-data-bits: "1"
38054-38081 uart: tx-data-bits: "0"
38080-38107 uart: tx-data-bits: "0"
38106-38133 uart: tx-data-bits: "1"
38132-38159 uart: tx-data-bits: "1"
37950-38159 uart: tx-data: "201"
38158-38185 uart: tx-parity-ok: "Stop bit" "Stop" "T"
38442-38469 uart: tx-start: "Start bit" "Start" "S"
38468-38495 uart: tx-data-bits: "0"
38494-38521 uart: tx-data-bits: "1"
38520-38547 uart: tx-data-bits: "0"
38546-38573 uart: tx-data-bits: "1"
38572-38599 uart: tx-data-bits: "0"
38598-38625 uart: tx-data-bits: "0"
38624-38651 uart: tx-data-bits: "1"
38650-38677 uart: tx-data-bits: "1"
38468-38677 uart: tx-data: "202"
38676-38703 uart: tx-parity-ok: "Stop bit" "Stop" "T"
38961-38988 uart: tx-start: "Start bit" "Start" "S"
38987-39014 uart: tx-data-bits: "1"
39013-39040 uart: tx-data-bits: "1"
39039-39066 uart: tx-data-bits: "0"
39065-39092 uart: tx-data-bits: "1"
39091-39118 uart: tx-data-bits: "0"
39117-39144 uart: tx-data-bits: "0"
39143-39170 uart: tx-data-bits: "1"
39169-39196 uart: tx-data-bits: "1"
38987-39196 uart: tx-data: "203"
39195-39222 uart: tx-parity-ok: "Stop bit" "Stop" "T"
39480-39507 uart: tx-start: "Start bit" "Start" "S"
39506-39533 uart: tx-data-bits: "0"
39532-39559 uart: tx-data-bits: "0"
39558-39585 uart: tx-data-bits: "1"
39584-39611 uart: tx-data-bits: "1"
39610-39637 uart: tx-data-bits: "0"
39636-39663 uart: tx-data-bits: "0"
39662-39689 uart: tx-data-bits: "1"
39688-39715 uart: tx-data-bits: "1"
39506-39715 uart: tx-data: "204"
39714-39741 uart: tx-parity-ok: "Stop bit" "Stop" "T"
39996-40023 uart: tx-start: "Start bit" "Start" "S"
40022-40049 uart: tx-data-bits: "1"
40048-40075 uart: tx-data-bits: "0"
40074-40101 uart: tx-data-bits: "1"
40100-40127 uart: tx-data-bits: "1"
40126-40153 uart: tx-data-bits: "0"
40152-40179 uart: tx-data-bits: "0"
40178-40205 uart: tx-data-bits: "1"
40204-40231 uart: tx-data-bits: "1"
40022-40231 uart: tx-data: "205"
40230-40257 uart: tx-parity-ok: "Stop bit" "Stop" "T"
40515-40542 uart: tx-start: "Start bit" "Start" "S"
40541-40568 uart: tx-data-bits: "0"
40567-40594 uart: tx-data-bits: "1"
40593-40620 uart: tx-data-bits: "1"
40619-40646 uart: tx-data-bits: "1"
40645-40672 uart: tx-data-bits: "0"
40671-40698 uart: tx-data-bits: "0"
40697-40724 uart: tx-data-bits: "1"
40723-40750 uart: tx-data-bits: "1"
40541-40750 uart: tx-data: "206"
40749-40776 uart: tx-parity-ok: "Stop bit" "Stop" "T"
41031-41058 uart: tx-start: "Start bit" "Start" "S"
41057-41084 uart: tx-data-bits: "1"
41083-41110 uart: tx-data-bits: "1"
41109-41136 uart: tx-data-bits: "1"
41135-41162 uart: tx-data-bits: "1"
41161-41188 uart: tx-data-bits: "0"
41187-41214 uart: tx-data-bits: "0"
41213-41240 uart: tx-data-bits: "1"
41239-41266 uart: tx-data-bits: "1"
41057-41266 uart: tx-data: "207"
33301-41266 uart: tx-packet: "192 193 194 195 196 197 198 199 200 201 202 203 204 205 206 207"
41265-41292 uart: tx-parity-ok: "Stop bit" "Stop" "T"
41548-41575 uart: tx-start: "Start bit" "Start" "S"
41574-41601 uart: tx-data-bits: "0"
41600-41627 uart: tx-data-bits: "0"
41626-41653 uart: tx-data-bits: "0"
41652-41679 uart: tx-data-bits: "0"
41678-41705 uart: tx-data-bits: "1"
41704-41731 uart: tx-data-bits: "0"
41730-41757 uart: tx-data-bits: "1"
41756-41783 uart: tx-data-bits: "1"
41574-41783 uart: tx-data: "208"
41782-41809 uart: tx-parity-ok: "Stop bit" "Stop" "T"
42065-42092 uart: tx-start: "Start bit" "Start" "S"
42091-42118 uart: tx-data-bits: "1"
42117-42144 uart: tx-data-bits: "0"
42143-42170 uart: tx-data-bits: "0"
42169-42196 uart: tx-data-bits: "0"
42195-42222 uart: tx-data-bits: "1"
42221-42248 uart: tx-data-bits: "0"
42247-42274 uart: tx-data-bits: "1"
42273-42300 uart: tx-data-bits: "1"
42091-42300 uart: tx-data: "209"
42299-42326 uart: tx-parity-ok: "Stop bit" "Stop" "T"
42583-42610 uart: tx-start: "Start bit" "Start" "S"
42609-42636 uart: tx-data-bits: "0"
42635-42662 uart: tx-data-bits: "1"
42661-42688 uart: tx-data-bits: "0"
42687-42714 uart: tx-data-bits: "0"
42713-42740 uart: tx-data-bits: "1"
42739-42766 uart: tx-data-bits: "0"
42765-42792 uart: tx-data-bits: "1"
42791-42818 uart: tx-data-bits: "1"
42609-42818 uart: tx-data: "210"
42817-42844 uart: tx-parity-ok: "Stop bit" "Stop" "T"
43102-43129 uart: tx-start: "Start bit" "Start" "S"
43128-43155 uart: tx-data-bits: "1"
43154-43181 uart: tx-data-bits: "1"
43180-43207 uart: tx-data-bits: "0"
43206-43233 uart: tx-data-bits: "0"
43232-43259 uart: tx-data-bits: "1"
43258-43285 uart: tx-data-bits: "0"
43284-43311 uart: tx-data-bits: "1"
43310-43337 uart: tx-data-bits: "1"
43128-43337 uart: tx-data: "211"
43336-43363 uart: tx-parity-ok: "Stop bit" "Stop" "T"
43620-43647 uart: tx-start: "Start bit" "Start" "S"
43646-43673 uart: tx-data-bits: "0"
43672-43699 uart: tx-data-bits: "0"
43698-43725 uart: tx-data-bits: "1"
43724-43751 uart: tx-data-bits: "0"
43750-43777 uart: tx-data-bits: "1"
43776-43803 uart: tx-data-bits: "0"
43802-43829 uart: tx-data-bits: "1"
43828-43855 uart: tx-data-bits: "1"
43646-43855 uart: tx-data: "212"
43854-43881 uart: tx-parity-ok: "Stop bit" "Stop" "T"
44139-44166 uart: tx-start: "Start bit" "Start" "S"
44165-44192 uart: tx-data-bits: "1"
44191-44218 uart: tx-data-bits: "0"
44217-44244 uart: tx-data-bits: "1"
44243-44270 uart: tx-data-bits: "0"
44269-44296 uart: tx-data-bits: "1"
44295-44322 uart: tx-data-bits: "0"
44321-44348 uart: tx-data-bits: "1"
44347-44374 uart: tx-data-bits: "1"
44165-44374 uart: tx-data: "213"
44373-44400 uart: tx-parity-ok: "Stop bit" "Stop" "T"
44659-44686 uart: tx-start: "Start bit" "Start" "S"
44685-44712 uart: tx-data-bits: "0"
44711-44738 uart: tx-data-bits: "1"
44737-44764 uart: tx-data-bits: "1"
44763-44790 uart: tx-data-bits: "0"
44789-44816 uart: tx-data-bits: "1"
44815-44842 uart: tx-data-bits: "0"
44841-44868 uart: tx-data-bits: "1"
44867-44894 uart: tx-data-bits: "1"
44685-44894 uart: tx-data: "214"
44893-44920 uart: tx-parity-ok: "Stop bit" "Stop" "T"
45178-45205 uart: tx-start: "Start bit" "Start" "S"
45204-45231 uart: tx-data-bits: "1"
45230-45257 uart: tx-data-bits: "1"
45256-45283 uart: tx-data-bits: "1"
45282-45309 uart: tx-data-bits: "0"
45308-45335 uart: tx-data-bits: "1"
45334-45361 uart: tx-data-bits: "0"
45360-45387 uart: tx-data-bits: "1"
45386-45413 uart: tx-data-bits: "1"
45204-45413 uart: tx-data: "215"
45412-45439 uart: tx-parity-ok: "Stop bit" "Stop" "T"
45697-45724 uart: tx-start: "Start bit" "Start" "S"
45723-45750 uart: tx-data-bits: "0"
45749-45776 uart: tx-data-bits: "0"
45775-45802 uart: tx-data-bits: "0"
45801-45828 uart: tx-data-bits: "1"
45827-45854 uart: tx-data-bits: "1"
45853-45880 uart: tx-data-bits: "0"
45879-45906 uart: tx-data-bits: "1"
45905-45932 uart: tx-data-bits: "1"
45723-45932 uart: tx-data: "216"
45931-45958 uart: tx-parity-ok: "Stop bit" "Stop" "T"
46213-46240 uart: tx-start: "Start bit" "Start" "S"
46239-46266 uart: tx-data-bits: "1"
46265-46292 uart: tx-data-bits: "0"
46291-46318 uart: tx-data-bits: "0"
46317-46344 uart: tx-data-bits: "1"
46343-46370 uart: tx-data-bits: "1"
46369-46396 uart: tx-data-bits: "0"
46395-46422 uart: tx-data-bits: "1"
46421-46448 uart: tx-data-bits: "1"
46239-46448 uart: tx-data: "217"
46447-46474 uart: tx-parity-ok: "Stop bit" "Stop" "T"
46732-46759 uart: tx-start: "Start bit" "Start" "S"
46758-46785 uart: tx-data-bits: "0"
46784-46811 uart: tx-data-bits: "1"
46810-46837 uart: tx-data-bits: "0"
46836-46863 uart: tx-data-bits: "1"
46862-46889 uart: tx-data-bits: "1"
46888-46915 uart: tx-data-bits: "0"
46914-46941 uart: tx-data-bits: "1"
46940-46967 uart: tx-data-bits: "1"
46758-46967 uart: tx-data: "218"
46966-46993 uart: tx-parity-ok: "Stop bit" "Stop" "T"
47250-47277 uart: tx-start: "Start bit" "Start" "S"
47276-47303 uart: tx-data-bits: "1"
47302-47329 uart: tx-data-bits: "1"
47328-47355 uart: tx-data-bits: "0"
47354-47381 uart: tx-data-bits: "1"
47380-47407 uart: tx-data-bits: "1"
47406-47433 uart: tx-data-bits: "0"
47432-47459 uart: tx-data-bits: "1"
47458-47485 uart: tx-data-bits: "1"
47276-47485 uart: tx-data: "219"
47484-47511 uart: tx-parity-ok: "Stop bit" "Stop" "T"
47769-47796 uart: tx-start: "Start bit" "Start" "S"
47795-47822 uart: tx-data-bits: "0"
47821-47848 uart: tx-data-bits: "0"
47847-47874 uart: tx-data-bits: "1"
47873-47900 uart: tx-data-bits: "1"
47899-47926 uart: tx-data-bits: "1"
47925-47952 uart: tx-data-bits: "0"
47951-47978 uart: tx-data-bits: "1"
47977-48004 uart: tx-data-bits: "1"
47795-48004 uart: tx-data: "220"
48003-48030 uart: tx-parity-ok: "Stop bit" "Stop" "T"
48286-48313 uart: tx-start: "Start bit" "Start" "S"
48312-48339 uart: tx-data-bits: "1"
48338-48365 uart: tx-data-bits: "0"
48364-48391 uart: tx-data-bits: "1"
48390-48417 uart: tx-data-bits: "1"
48416-48443 uart: tx-data-bits: "1"
48442-48469 uart: tx-data-bits: "0"
48468-48495 uart: tx-data-bits: "1"
48494-48521 uart: tx-data-bits: "1"
48312-48521 uart: tx-data: "221"
48520-48547 uart: tx-parity-ok: "Stop bit" "Stop" "T"
48804-48831 uart: tx-start: "Start bit" "Start" "S"
48830-48857 uart: tx-data-bits: "0"
48856-48883 uart: tx-data-bits: "1"
48882-48909 uart: tx-data-bits: "1"
48908-48935 uart: tx-data-bits: "1"
48934-48961 uart: tx-data-bits: "1"
48960-48987 uart: tx-data-bits: "0"
48986-49013 uart: tx-data-bits: "1"
49012-49039 uart: tx-data-bits: "1"
48830-49039 uart: tx-data: "222"
49038-49065 uart: tx-parity-ok: "Stop bit" "Stop" "T"
49321-49348 uart: tx-start: "Start bit" "Start" "S"
49347-49374 uart: tx-data-bits: "1"
49373-49400 uart: tx-data-bits: "1"
49399-49426 uart: tx-data-bits: "1"
49425-49452 uart: tx-data-bits: "1"
49451-49478 uart: tx-data-bits: "1"
49477-49504 uart: tx-data-bits: "0"
49503-49530 uart: tx-data-bits: "1"
49529-49556 uart: tx-data-bits: "1"
49347-49556 uart: tx-data: "223"
41574-49556 uart: tx-packet: "208 209 210 211 212 213 214 215 216 217 218 219 220 221 222 223"
49555-49582 uart: tx-parity-ok: "Stop bit" "Stop" "T"
49837-49864 uart: tx-start: "Start bit" "Start" "S"
49863-49890 uart: tx-data-bits: "0"
49889-49916 uart: tx-data-bits: "0"
49915-49942 uart: tx-data-bits: "0"
49941-49968 uart: tx-data-bits: "0"
49967-49994 uart: tx-data-bits: "0"
49993-50020 uart: tx-data-bits: "1"
50019-50046 uart: tx-data-bits: "1"
50045-50072 uart: tx-data-bits: "1"
49863-50072 uart: tx-data: "224"
50071-50098 uart: tx-parity-ok: "Stop bit" "Stop" "T"
50352-50379 uart: tx-start: "Start bit" "Start" "S"
50378-50405 uart: tx-data-bits: "1"
50404-50431 uart: tx-data-bits: "0"
50430-50457 uart: tx-data-bits: "0"
50456-50483 uart: tx-data-bits: "0"
50482-50509 uart: tx-data-bits: "0"
50508-50535 uart: tx-data-bits: "1"
50534-50561 uart: tx-data-bits: "1"
50560-50587 uart: tx-data-bits: "1"
50378-50587 uart: tx-data: "225"
50586-50613 uart: tx-parity-ok: "Stop bit" "Stop" "T"
50868-50895 uart: tx-start: "Start bit" "Start" "S"
50894-50921 uart: tx-data-bits: "0"
50920-50947 uart: tx-data-bits: "1"
50946-50973 uart: tx-data-bits: "0"
50972-50999 uart: tx-data-bits: "0"
50998-51025 uart: tx-data-bits: "0"
51024-51051 uart: tx-data-bits: "1"
51050-51077 uart: tx-data-bits: "1"
51076-51103 uart: tx-data-bits: "1"
50894-51103 uart: tx-data: "226"
51102-51129 uart: tx-parity-ok: "Stop bit" "Stop" "T"
51385-51412 uart: tx-start: "Start bit" "Start" "S"
51411-51438 uart: tx-data-bits: "1"
51437-51464 uart: tx-data-bits: "1"
51463-51490 uart: tx-data-bits: "0"
51489-51516 uart: tx-data-bits: "0"
51515-51542 uart: tx-data-bits: "0"
51541-51568 uart: tx-data-bits: "1"
51567-51594 uart: tx-data-bits: "1"
51593-51620 uart: tx-data-bits: "1"
51411-51620 uart: tx-data: "227"
51619-51646 uart: tx-parity-ok: "Stop bit" "Stop" "T"
51902-51929 uart: tx-start: "Start bit" "Start" "S"
51928-51955 uart: tx-data-bits: "0"
51954-51981 uart: tx-data-bits: "0"
51980-52007 uart: tx-data-bits: "1"
52006-52033 uart: tx-data-bits: "0"
52032-52059 uart: tx-data-bits: "0"
52058-52085 uart: tx-data-bits: "1"
52084-52111 uart: tx-data-bits: "1"
52110-52137 uart: tx-data-bits: "1"
51928-52137 uart: tx-data: "228"
52136-52163 uart: tx-parity-ok: "Stop bit" "Stop" "T"
52418-52445 uart: tx-start: "Start bit" "Start" "S"
52444-52471 uart: tx-data-bits: "1"
52470-52497 uart: tx-data-bits: "0"
52496-52523 uart: tx-data-bits: "1"
52522-52549 uart: tx-data-bits: "0"
52548-52575 uart: tx-data-bits: "0"
52574-52601 uart: tx-data-bits: "1"
52600-52627 uart: tx-data-bits: "1"
52626-52653 uart: tx-data-bits: "1"
52444-52653 uart: tx-data: "229"
52652-52679 uart: tx-parity-ok: "Stop bit" "Stop" "T"
52937-52964 uart: tx-start: "Start bit" "Start" "S"
52963-52990 uart: tx-data-bits: "0"
52989-53016 uart: tx-data-bits: "1"
53015-53042 uart: tx-data-bits: "1"
53041-53068 uart: tx-data-bits: "0"
53067-53094 uart: tx-data-bits: "0"
53093-53120 uart: tx-data-bits: "1"
53119-53146 uart: tx-data-bits: "1"
53145-53172 uart: tx-data-bits: "1"
52963-53172 uart: tx-data: "230"
53171-53198 uart: tx-parity-ok: "Stop bit" "Stop" "T"
53453-53480 uart: tx-start: "Start bit" "Start" "S"
53479-53506 uart: tx-data-bits: "1"
53505-53532 uart: tx-data-bits: "1"
53531-53558 uart: tx-data-bits: "1"
53557-53584 uart: tx-data-bits: "0"
53583-53610 uart: tx-data-bits: "0"
53609-53636 uart: tx-data-bits: "1"
53635-53662 uart: tx-data-bits: "1"
53661-53688 uart: tx-data-bits: "1"
53479-53688 uart: tx-data: "231"
53687-53714 uart: tx-parity-ok: "Stop bit" "Stop" "T"
53970-53997 uart: tx-start: "Start bit" "Start" "S"
53996-54023 uart: tx-data-bits: "0"
54022-54049 uart: tx-data-bits: "0"
54048-54075 uart: tx-data-bits: "0"
54074-54101 uart: tx-data-bits: "1"
54100-54127 uart: tx-data-bits: "0"
54126-54153 uart: tx-data-bits: "1"
54152-54179 uart: tx-data-bits: "1"
54178-54205 uart: tx-data-bits: "1"
53996-54205 uart: tx-data: "232"
54204-54231 uart: tx-parity-ok: "Stop bit" "Stop" "T"
54487-54514 uart: tx-start: "Start bit" "Start" "S"
54513-54540 uart: tx-data-bits: "1"
54539-54566 uart: tx-data-bits: "0"
54565-54592 uart: tx-data-bits: "0"
54591-54618 uart: tx-data-bits: "1"
54617-54644 uart: tx-data-bits: "0"
54643-54670 uart: tx-data-bits: "1"
54669-54696 uart: tx-data-bits: "1"
54695-54722 uart: tx-data-bits: "1"
54513-54722 uart: tx-data: "233"
54721-54748 uart: tx-parity-ok: "Stop bit" "Stop" "T"
55005-55032 uart: tx-start: "Start bit" "Start" "S"
55031-55058 uart: tx-data-bits: "0"
55057-55084 uart: tx-data-bits: "1"
55083-55110 uart: tx-data-bits: "0"
55109-55136 uart: tx-data-bits: "1"
55135-55162 uart: tx-data-bits: "0"
55161-55188 uart: tx-data-bits: "1"
55187-55214 uart: tx-data-bits: "1"
55213-55240 uart: tx-data-bits: "1"
55031-55240 uart: tx-data: "234"
55239-55266 uart: tx-parity-ok: "Stop bit" "Stop" "T"
55524-55551 uart: tx-start: "Start bit" "Start" "S"
55550-55577 uart: tx-data-bits: "1"
55576-55603 uart: tx-data-bits: "1"
55602-55629 uart: tx-data-bits: "0"
55628-55655 uart: tx-data-bits: "1"
55654-55681 uart: tx-data-bits: "0"
55680-55707 uart: tx-data-bits: "1"
55706-55733 uart: tx-data-bits: "1"
55732-55759 uart: tx-data-bits: "1"
55550-55759 uart: tx-data: "235"
55758-55785 uart: tx-parity-ok: "Stop bit" "Stop" "T"
56042-56069 uart: tx-start: "Start bit" "Start" "S"
56068-56095 uart: tx-data-bits: "0"
56094-56121 uart: tx-data-bits: "0"
56120-56147 uart: tx-data-bits: "1"
56146-56173 uart: tx-data-bits: "1"
56172-56199 uart: tx-data-bits: "0"
56198-56225 uart: tx-data-bits: "1"
56224-56251 uart: tx-data-bits: "1"
56250-56277 uart: tx-data-bits: "1"
56068-56277 uart: tx-data: "236"
56276-56303 uart: tx-parity-ok: "Stop bit" "Stop" "T"
56559-56586 uart: tx-start: "Start bit" "Start" "S"
56585-56612 uart: tx-data-bits: "1"
56611-56638 uart: tx-data-bits: "0"
56637-56664 uart: tx-data-bits: "1"
56663-56690 uart: tx-data-bits: "1"
56689-56716 uart: tx-data-bits: "0"
56715-56742 uart: tx-data-bits: "1"
56741-56768 uart: tx-data-bits: "1"
56767-56794 uart: tx-data-bits: "1"
56585-56794 uart: tx-data: "237"
56793-56820 uart: tx-parity-ok: "Stop bit" "Stop" "T"
57077-57104 uart: tx-start: "Start bit" "Start" "S"
57103-57130 uart: tx-data-bits: "0"
57129-57156 uart: tx-data-bits: "1"
57155-57182 uart: tx-data-bits: "1"
57181-57208 uart: tx-data-bits: "1"
57207-57234 uart: tx-data-bits: "0"
57233-57260 uart: tx-data-bits: "1"
57259-57286 uart: tx-data-bits: "1"
57285-57312 uart: tx-data-bits: "1"
57103-57312 uart: tx-data: "238"
57311-57338 uart: tx-parity-ok: "Stop bit" "Stop" "T"
57594-57621 uart: tx-start: "Start bit" "Start" "S"
57620-57647 uart: tx-data-bits: "1"
57646-57673 uart: tx-data-bits: "1"
57672-57699 uart: tx-data-bits: "1"
57698-57725 uart: tx-data-bits: "1"
57724-57751 uart: tx-data-bits: "0"
57750-57777 uart: tx-data-bits: "1"
57776-57803 uart: tx-data-bits: "1"
57802-57829 uart: tx-data-bits: "1"
57620-57829 uart: tx-data: "239"
49863-57829 uart: tx-packet: "224 225 226 227 228 229 230 231 232 233 234 235 236 237 238 239"
57828-57855 uart: tx-parity-ok: "Stop bit" "Stop" "T"
58111-58138 uart: tx-start: "Start bit" "Start" "S"
58137-58164 uart: tx-data-bits: "0"
58163-58190 uart: tx-data-bits: "0"
58189-58216 uart: tx-data-bits: "0"
58215-58242 uart: tx-data-bits: "0"
58241-58268 uart: tx-data-bits: "1"
58267-58294 uart: tx-data-bits: "1"
58293-58320 uart: tx-data-bits: "1"
58319-58346 uart: tx-data-bits: "1"
58137-58346 uart: tx-data: "240"
58345-58372 uart: tx-parity-ok: "Stop bit" "Stop" "T"
58625-58652 uart: tx-start: "Start bit" "Start" "S"
58651-58678 uart: tx-data-bits: "1"
58677-58704 uart: tx-data-bits: "0"
58703-58730 uart: tx-data-bits: "0"
58729-58756 uart: tx-data-bits: "0"
58755-58782 uart: tx-data-bits: "1"
58781-58808 uart: tx-data-bits: "1"
58807-58834 uart: tx-data-bits: "1"
58833-58860 uart: tx-data-bits: "1"
58651-58860 uart: tx-data: "241"
58859-58886 uart: tx-parity-ok: "Stop bit" "Stop" "T"
59142-59169 uart: tx-start: "Start bit" "Start" "S"
59168-59195 uart: tx-data-bits: "0"
59194-59221 uart: tx-data-bits: "1"
59220-59247 uart: tx-data-bits: "0"
59246-59273 uart: tx-data-bits: "0"
59272-59299 uart: tx-data-bits: "1"
59298-59325 uart: tx-data-bits: "1"
59324-59351 uart: tx-data-bits: "1"
59350-59377 uart: tx-data-bits: "1"
59168-59377 uart: tx-data: "242"
59376-59403 uart: tx-parity-ok: "Stop bit" "Stop" "T"
59659-59686 uart: tx-start: "Start bit" "Start" "S"
59685-59712 uart: tx-data-bits: "1"
59711-59738 uart: tx-data-bits: "1"
59737-59764 uart: tx-data-bits: "0"
59763-59790 uart: tx-data-bits: "0"
59789-59816 uart: tx-data-bits: "1"
59815-59842 uart: tx-data-bits: "1"
59841-59868 uart: tx-data-bits: "1"
59867-59894 uart: tx-data-bits: "1"
59685-59894 uart: tx-data: "243"
59893-59920 uart: tx-parity-ok: "Stop bit" "Stop" "T"
60176-60203 uart: tx-start: "Start bit" "Start" "S"
60202-60229 uart: tx-data-bits: "0"
60228-60255 uart: tx-data-bits: "0"
60254-60281 uart: tx-data-bits: "1"
60280-60307 uart: tx-data-bits: "0"
60306-60333 uart: tx-data-bits: "1"
60332-60359 uart: tx-data-bits: "1"
60358-60385 uart: tx-data-bits: "1"
60384-60411 uart: tx-data-bits: "1"
60202-60411 uart: tx-data: "244"
60410-60437 uart: tx-parity-ok: "Stop bit" "Stop" "T"
60693-60720 uart: tx-start: "Start bit" "Start" "S"
60719-60746 uart: tx-data-bits: "1"
60745-60772 uart: tx-data-bits: "0"
60771-60798 uart: tx-data-bits: "1"
60797-60824 uart: tx-data-bits: "0"
60823-60850 uart: tx-data-bits: "1"
60849-60876 uart: tx-data-bits: "1"
60875-60902 uart: tx-data-bits: "1"
60901-60928 uart: tx-data-bits: "1"
60719-60928 uart: tx-data: "245"
60927-60954 uart: tx-parity-ok: "Stop bit" "Stop" "T"
61211-61238 uart: tx-start: "Start bit" "Start" "S"
61237-61264 uart: tx-data-bits: "0"
61263-61290 uart: tx-data-bits: "1"
61289-61316 uart: tx-data-bits: "1"
61315-61342 uart: tx-data-bits: "0"
61341-61368 uart: tx-data-bits: "1"
61367-61394 uart: tx-data-bits: "1"
61393-61420 uart: tx-data-bits: "1"
61419-61446 uart: tx-data-bits: "1"
61237-61446 uart: tx-data: "246"
61445-61472 uart: tx-parity-ok: "Stop bit" "Stop" "T"
61728-61755 uart: tx-start: "Start bit" "Start" "S"
61754-61781 uart: tx-data-bits: "1"
61780-61807 uart: tx-data-bits: "1"
61806-61833 uart: tx-data-bits: "1"
61832-61859 uart: tx-data-bits: "0"
61858-61885 uart: tx-data-bits: "1"
61884-61911 uart: tx-data-bits: "1"
61910-61937 uart: tx-data-bits: "1"
61936-61963 uart: tx-data-bits: "1"
61754-61963 uart: tx-data: "247"
61962-61989 uart: tx-parity-ok: "Stop bit" "Stop" "T"
62244-62271 uart: tx-start: "Start bit" "Start" "S"
62270-62297 uart: tx-data-bits: "0"
62296-62323 uart: tx-data-bits: "0"
62322-62349 uart: tx-data-bits: "0"
62348-62375 uart: tx-data-bits: "1"
62374-62401 uart: tx-data-bits: "1"
62400-62427 uart: tx-data-bits: "1"
62426-62453 uart: tx-data-bits: "1"
62452-62479 uart: tx-data-bits: "1"
62270-62479 uart: tx-data: "248"
62478-62505 uart: tx-parity-ok: "Stop bit" "Stop" "T"
62759-62786 uart: tx-start: "Start bit" "Start" "S"
62785-62812 uart: tx-data-bits: "1"
62811-62838 uart: tx-data-bits: "0"
62837-62864 uart: tx-data-bits: "0"
62863-62890 uart: tx-data-bits: "1"
62889-62916 uart: tx-data-bits: "1"
62915-62942 uart: tx-data-bits: "1"
62941-62968 uart: tx-data-bits: "1"
62967-62994 uart: tx-data-bits: "1"
62785-62994 uart: tx-data: "249"
62993-63020 uart: tx-parity-ok: "Stop bit" "Stop" "T"
63276-63303 uart: tx-start: "Start bit" "Start" "S"
63302-63329 uart: tx-data-bits: "0"
63328-63355 uart: tx-data-bits: "1"
63354-63381 uart: tx-data-bits: "0"
63380-63407 uart: tx-data-bits: "1"
63406-63433 uart: tx-data-bits: "1"
63432-63459 uart: tx-data-bits: "1"
63458-63485 uart: tx-data-bits: "1"
63484-63511 uart: tx-data-bits: "1"
63302-63511 uart: tx-data: "250"
63510-63537 uart: tx-parity-ok: "Stop bit" "Stop" "T"
63792-63819 uart: tx-start: "Start bit" "Start" "S"
63818-63845 uart: tx-data-bits: "1"
63844-63871 uart: tx-data-bits: "1"
63870-63897 uart: tx-data-bits: "0"
63896-63923 uart: tx-data-bits: "1"
63922-63949 uart: tx-data-bits: "1"
63948-63975 uart: tx-data-bits: "1"
63974-64001 uart: tx-data-bits: "1"
64000-64027 uart: tx-data-bits: "1"
63818-64027 uart: tx-data: "251"
64026-64053 uart: tx-parity-ok: "Stop bit" "Stop" "T"
64309-64336 uart: tx-start: "Start bit" "Start" "S"
64335-64362 uart: tx-data-bits: "0"
64361-64388 uart: tx-data-bits: "0"
64387-64414 uart: tx-data-bits: "1"
64413-64440 uart: tx-data-bits: "1"
64439-64466 uart: tx-data-bits: "1"
64465-64492 uart: tx-data-bits: "1"
64491-64518 uart: tx-data-bits: "1"
64517-64544 uart: tx-data-bits: "1"
64335-64544 uart: tx-data: "252"
64543-64570 uart: tx-parity-ok: "Stop bit" "Stop" "T"
64823-64850 uart: tx-start: "Start bit" "Start" "S"
64849-64876 uart: tx-data-bits: "1"
64875-64902 uart: tx-data-bits: "0"
64901-64928 uart: tx-data-bits: "1"
64927-64954 uart: tx-data-bits: "1"
64953-64980 uart: tx-data-bits: "1"
64979-65006 uart: tx-data-bits: "1"
65005-65032 uart: tx-data-bits: "1"
65031-65058 uart: tx-data-bits: "1"
64849-65058 uart: tx-data: "253"
65057-65084 uart: tx-parity-ok: "Stop bit" "Stop" "T"
65340-65367 uart: tx-start: "Start bit" "Start" "S"
65366-65393 uart: tx-data-bits: "0"
65392-65419 uart: tx-data-bits: "1"
65418-65445 uart: tx-data-bits: "1"
65444-65471 uart: tx-data-bits: "1"
65470-65497 uart: tx-data-bits: "1"
65496-65523 uart: tx-data-bits: "1"
65522-65549 uart: tx-data-bits: "1"
65548-65575 uart: tx-data-bits: "1"
65366-65575 uart: tx-data: "254"
65574-65601 uart: tx-parity-ok: "Stop bit" "Stop" "T"
65854-65881 uart: tx-start: "Start bit" "Start" "S"
65880-65907 uart: tx-data-bits: "1"
65906-65933 uart: tx-data-bits: "1"
65932-65959 uart: tx-data-bits: "1"
65958-65985 uart: tx-data-bits: "1"
65984-66011 uart: tx-data-bits: "1"
66010-66037 uart: tx-data-bits: "1"
66036-66063 uart: tx-data-bits: "1"
66062-66089 uart: tx-data-bits: "1"
65880-66089 uart: tx-data: "255"
58137-66089 uart: tx-packet: "240 241 242 243 244 245 246 247 248 249 250 251 252 253 254 255"
66088-66115 uart: tx-parity-ok: "Stop bit" "Stop" "T"
66369-66396 uart: tx-start: "Start bit" "Start" "S"
66395-66422 uart: tx-data-bits: "0"
66421-66448 uart: tx-data-bits: "0"
66447-66474 uart: tx-data-bits: "0"
66473-66500 uart: tx-data-bits: "0"
66499-66526 uart: tx-data-bits: "0"
66525-66552 uart: tx-data-bits: "0"
66551-66578 uart: tx-data-bits: "0"
66577-66604 uart: tx-data-bits: "0"
66395-66604 uart: tx-data: "0"
66603-66630 uart: tx-parity-ok: "Stop bit" "Stop" "T"
66884-66911 uart: tx-start: "Start bit" "Start" "S"
66910-66937 uart: tx-data-bits: "1"
66936-66963 uart: tx-data-bits: "0"
66962-66989 uart: tx-data-bits: "0"
66988-67015 uart: tx-data-bits: "0"
67014-67041 uart: tx-data-bits: "0"
67040-67067 uart: tx-data-bits: "0"
67066-67093 uart: tx-data-bits: "0"
67092-67119 uart: tx-data-bits: "0"
66910-67119 uart: tx-data: "1"
67118-67145 uart: tx-parity-ok: "Stop bit" "Stop" "T"
67400-67427 uart: tx-start: "Start bit" "Start" "S"
67426-67453 uart: tx-data-bits: "0"
67452-67479 uart: tx-data-bits: "1"
67478-67505 uart: tx-data-bits: "0"
67504-67531 uart: tx-data-bits: "0"
67530-67557 uart: tx-data-bits: "0"
67556-67583 uart: tx-data-bits: "0"
67582-67609 uart: tx-data-bits: "0"
67608-67635 uart: tx-data-bits: "0"
67426-67635 uart: tx-data: "2"
67634-67661 uart: tx-parity-ok: "Stop bit" "Stop" "T"
67917-67944 uart: tx-start: "Start bit" "Start" "S"
67943-67970 uart: tx-data-bits: "1"
67969-67996 uart: tx-data-bits: "1"
67995-68022 uart: tx-data-bits: "0"
68021-68048 uart: tx-data-bits: "0"
68047-68074 uart: tx-data-bits: "0"
68073-68100 uart: tx-data-bits: "0"
68099-68126 uart: tx-data-bits: "0"
68125-68152 uart: tx-data-bits: "0"
67943-68152 uart: tx-data: "3"
68151-68178 uart: tx-parity-ok: "Stop bit" "Stop" "T"
68433-68460 uart: tx-start: "Start bit" "Start" "S"
68459-68486 uart: tx-data-bits: "0"
68485-68512 uart: tx-data-bits: "0"
68511-68538 uart: tx-data-bits: "1"
68537-68564 uart: tx-data-bits: "0"
68563-68590 uart: tx-data-bits: "0"
68589-68616 uart: tx-data-bits: "0"
68615-68642 uart: tx-data-bits: "0"
68641-68668 uart: tx-data-bits: "0"
68459-68668 uart: tx-data: "4"
68667-68694 uart: tx-parity-ok: "Stop bit" "Stop" "T"
68950-68977 uart: tx-start: "Start bit" "Start" "S"
68976-69003 uart: tx-data-bits: "1"
69002-69029 uart: tx-data-bits: "0"
69028-69055 uart: tx-data-bits: "1"
69054-69081 uart: tx-data-bits: "0"
69080-69107 uart: tx-data-bits: "0"
69106-69133 uart: tx-data-bits: "0"
69132-69159 uart: tx-data-bits: "0"
69158-69185 uart: tx-data-bits: "0"
68976-69185 uart: tx-data: "5"
69184-69211 uart: tx-parity-ok: "Stop bit" "Stop" "T"
69469-69496 uart: tx-start: "Start bit" "Start" "S"
69495-69522 uart: tx-data-bits: "0"
69521-69548 uart: tx-data-bits: "1"
69547-69574 uart: tx-data-bits: "1"
69573-69600 uart: tx-data-bits: "0"
69599-69626 uart: tx-data-bits: "0"
69625-69652 uart: tx-data-bits: "0"
69651-69678 uart: tx-data-bits: "0"
69677-69704 uart: tx-data-bits: "0"
69495-69704 uart: tx-data: "6"
69703-69730 uart: tx-parity-ok: "Stop bit" "Stop" "T"
69985-70012 uart: tx-start: "Start bit" "Start" "S"
70011-70038 uart: tx-data-bits: "1"
70037-70064 uart: tx-data-bits: "1"
70063-70090 uart: tx-data-bits: "1"
70089-70116 uart: tx-data-bits: "0"
70115-70142 uart: tx-data-bits: "0"
70141-70168 uart: tx-data-bits: "0"
70167-70194 uart: tx-data-bits: "0"
70193-70220 uart: tx-data-bits: "0"
70011-70220 uart: tx-data: "7"
70219-70246 uart: tx-parity-ok: "Stop bit" "Stop" "T"
70502-70529 uart: tx-start: "Start bit" "Start" "S"
70528-70555 uart: tx-data-bits: "0"
70554-70581 uart: tx-data-bits: "0"
70580-70607 uart: tx-data-bits: "0"
70606-70633 uart: tx-data-bits: "1"
70632-70659 uart: tx-data-bits: "0"
70658-70685 uart: tx-data-bits: "0"
70684-70711 uart: tx-data-bits: "0"
70710-70737 uart: tx-data-bits: "0"
70528-70737 uart: tx-data: "8"
70736-70763 uart: tx-parity-ok: "Stop bit" "Stop" "T"
71018-71045 uart: tx-start: "Start bit" "Start" "S"
71044-71071 uart: tx-data-bits: "1"
71070-71097 uart: tx-data-bits: "0"
71096-71123 uart: tx-data-bits: "0"
71122-71149 uart: tx-data-bits: "1"
71148-71175 uart: tx-data-bits: "0"
71174-71201 uart: tx-data-bits: "0"
71200-71227 uart: tx-data-bits: "0"
71226-71253 uart: tx-data-bits: "0"
71044-71253 uart: tx-data: "9"
71252-71279 uart: tx-parity-ok: "Stop bit" "Stop" "T"
71537-71564 uart: tx-start: "Start bit" "Start" "S"
71563-71590 uart: tx-data-bits: "0"
71589-71616 uart: tx-data-bits: "1"
71615-71642 uart: tx-data-bits: "0"
71641-71668 uart: tx-data-bits: "1"
71667-71694 uart: tx-data-bits: "0"
71693-71720 uart: tx-data-bits: "0"
71719-71746 uart: tx-data-bits: "0"
71745-71772 uart: tx-data-bits: "0"
71563-71772 uart: tx-data: "10"
71771-71798 uart: tx-parity-ok: "Stop bit" "Stop" "T"
72055-72082 uart: tx-start: "Start bit" "Start" "S"
72081-72108 uart: tx-data-bits: "1"
72107-72134 uart: tx-data-bits: "1"
72133-72160 uart: tx-data-bits: "0"
72159-72186 uart: tx-data-bits: "1"
72185-72212 uart: tx-data-bits: "0"
72211-72238 uart: tx-data-bits: "0"
72237-72264 uart: tx-data-bits: "0"
72263-72290 uart: tx-data-bits: "0"
72081-72290 uart: tx-data: "11"
72289-72316 uart: tx-parity-ok: "Stop bit" "Stop" "T"
72574-72601 uart: tx-start: "Start bit" "Start" "S"
72600-72627 uart: tx-data-bits: "0"
72626-72653 uart: tx-data-bits: "0"
72652-72679 uart: tx-data-bits: "1"
72678-72705 uart: tx-data-bits: "1"
72704-72731 uart: tx-data-bits: "0"
72730-72757 uart: tx-data-bits: "0"
72756-72783 uart: tx-data-bits: "0"
72782-72809 uart: tx-data-bits: "0"
72600-72809 uart: tx-data: "12"
72808-72835 uart: tx-parity-ok: "Stop bit" "Stop" "T"
73091-73118 uart: tx-start: "Start bit" "Start" "S"
73117-73144 uart: tx-data-bits: "1"
73143-73170 uart: tx-data-bits: "0"
73169-73196 uart: tx-data-bits: "1"
73195-73222 uart: tx-data-bits: "1"
73221-73248 uart: tx-data-bits: "0"
73247-73274 uart: tx-data-bits: "0"
73273-73300 uart: tx-data-bits: "0"
73299-73326 uart: tx-data-bits: "0"
73117-73326 uart: tx-data: "13"
73325-73352 uart: tx-parity-ok: "Stop bit" "Stop" "T"
73609-73636 uart: tx-start: "Start bit" "Start" "S"
73635-73662 uart: tx-data-bits: "0"
73661-73688 uart: tx-data-bits: "1"
73687-73714 uart: tx-data-bits: "1"
73713-73740 uart: tx-data-bits: "1"
73739-73766 uart: tx-data-bits: "0"
73765-73792 uart: tx-data-bits: "0"
73791-73818 uart: tx-data-bits: "0"
73817-73844 uart: tx-data-bits: "0"
73635-73844 uart: tx-data: "14"
73843-73870 uart: tx-parity-ok: "Stop bit" "Stop" "T"
74126-74153 uart: tx-start: "Start bit" "Start" "S"
74152-74179 uart: tx-data-bits: "1"
74178-74205 uart: tx-data-bits: "1"
74204-74231 uart: tx-data-bits: "1"
74230-74257 uart: tx-data-bits: "1"
74256-74283 uart: tx-data-bits: "0"
74282-74309 uart: tx-data-bits: "0"
74308-74335 uart: tx-data-bits: "0"
74334-74361 uart: tx-data-bits: "0"
74152-74361 uart: tx-data: "15"
66395-74361 uart: tx-packet: "0 1 2 3 4 5 6 7 8 9 10 11 12 13 14 15"
74360-74387 uart: tx-parity-ok: "Stop bit" "Stop" "T"
74642-74669 uart: tx-start: "Start bit" "Start" "S"
74668-74695 uart: tx-data-bits: "0"
74694-74721 uart: tx-data-bits: "0"
74720-74747 uart: tx-data-bits: "0"
74746-74773 uart: tx-data-bits: "0"
74772-74799 uart: tx-data-bits: "1"
74798-74825 uart: tx-data-bits: "0"
74824-74851 uart: tx-data-bits: "0"
74850-74877 uart: tx-data-bits: "0"
74668-74877 uart: tx-data: "16"
74876-74903 uart: tx-parity-ok: "Stop bit" "Stop" "T"
75159-75186 uart: tx-start: "Start bit" "Start" "S"
75185-75212 uart: tx-data-bits: "1"
75211-75238 uart: tx-data-bits: "0"
75237-75264 uart: tx-data-bits: "0"
75263-75290 uart: tx-data-bits: "0"
75289-75316 uart: tx-data-bits: "1"
75315-75342 uart: tx-data-bits: "0"
75341-75368 uart: tx-data-bits: "0"
75367-75394 uart: tx-data-bits: "0"
75185-75394 uart: tx-data: "17"
75393-75420 uart: tx-parity-ok: "Stop bit" "Stop" "T"
75678-75705 uart: tx-start: "Start bit" "Start" "S"
75704-75731 uart: tx-data-bits: "0"
75730-75757 uart: tx-data-bits: "1"
75756-75783 uart: tx-data-bits: "0"
75782-75809 uart: tx-data-bits: "0"
75808-75835 uart: tx-data-bits: "1"
75834-75861 uart: tx-data-bits: "0"
75860-75887 uart: tx-data-bits: "0"
75886-75913 uart: tx-data-bits: "0"
75704-75913 uart: tx-data: "18"
75912-75939 uart: tx-parity-ok: "Stop bit" "Stop" "T"
76196-76223 uart: tx-start: "Start bit" "Start" "S"
76222-76249 uart: tx-data-bits: "1"
76248-76275 uart: tx-data-bits: "1"
76274-76301 uart: tx-data-bits: "0"
76300-76327 uart: tx-data-bits: "0"
76326-76353 uart: tx-data-bits: "1"
76352-76379 uart: tx-data-bits: "0"
76378-76405 uart: tx-data-bits: "0"
76404-76431 uart: tx-data-bits: "0"
76222-76431 uart: tx-data: "19"
76430-76457 uart: tx-parity-ok: "Stop bit" "Stop" "T"
76715-76742 uart: tx-start: "Start bit" "Start" "S"
76741-76768 uart: tx-data-bits: "0"
76767-76794 uart: tx-data-bits: "0"
76793-76820 uart: tx-data-bits: "1"
76819-76846 uart: tx-data-bits: "0"
76845-76872 uart: tx-data-bits: "1"
76871-76898 uart: tx-data-bits: "0"
76897-76924 uart: tx-data-bits: "0"
76923-76950 uart: tx-data-bits: "0"
76741-76950 uart: tx-data: "20"
76949-76976 uart: tx-parity-ok: "Stop bit" "Stop" "T"
77233-77260 uart: tx-start: "Start bit" "Start" "S"
77259-77286 uart: tx-data-bits: "1"
77285-77312 uart: tx-data-bits: "0"
77311-77338 uart: tx-data-bits: "1"
77337-77364 uart: tx-data-bits: "0"
77363-77390 uart: tx-data-bits: "1"
77389-77416 uart: tx-data-bits: "0"
77415-77442 uart: tx-data-bits: "0"
77441-77468 uart: tx-data-bits: "0"
77259-77468 uart: tx-data: "21"
77467-77494 uart: tx-parity-ok: "Stop bit" "Stop" "T"
77754-77781 uart: tx-start: "Start bit" "Start" "S"
77780-77807 uart: tx-data-bits: "0"
77806-77833 uart: tx-data-bits: "1"
77832-77859 uart: tx-data-bits: "1"
77858-77885 uart: tx-data-bits: "0"
77884-77911 uart: tx-data-bits: "1"
77910-77937 uart: tx-data-bits: "0"
77936-77963 uart: tx-data-bits: "0"
77962-77989 uart: tx-data-bits: "0"
77780-77989 uart: tx-data: "22"
77988-78015 uart: tx-parity-ok: "Stop bit" "Stop" "T"
78272-78299 uart: tx-start: "Start bit" "Start" "S"
78298-78325 uart: tx-data-bits: "1"
78324-78351 uart: tx-data-bits: "1"
78350-78377 uart: tx-data-bits: "1"
78376-78403 uart: tx-data-bits: "0"
78402-78429 uart: tx-data-bits: "1"
78428-78455 uart: tx-data-bits: "0"
78454-78481 uart: tx-data-bits: "0"
78480-78507 uart: tx-data-bits: "0"
78298-78507 uart: tx-data: "23"
78506-78533 uart: tx-parity-ok: "Stop bit" "Stop" "T"
78791-78818 uart: tx-start: "Start bit" "Start" "S"
78817-78844 uart: tx-data-bits: "0"
78843-78870 uart: tx-data-bits: "0"
78869-78896 uart: tx-data-bits: "0"
78895-78922 uart: tx-data-bits: "1"
78921-78948 uart: tx-data-bits: "1"
78947-78974 uart: tx-data-bits: "0"
78973-79000 uart: tx-data-bits: "0"
78999-79026 uart: tx-data-bits: "0"
78817-79026 uart: tx-data: "24"
79025-79052 uart: tx-parity-ok: "Stop bit" "Stop" "T"
79308-79335 uart: tx-start: "Start bit" "Start" "S"
79334-79361 uart: tx-data-bits: "1"
79360-79387 uart: tx-data-bits: "0"
79386-79413 uart: tx-data-bits: "0"
79412-79439 uart: tx-data-bits: "1"
79438-79465 uart: tx-data-bits: "1"
79464-79491 uart: tx-data-bits: "0"
79490-79517 uart: tx-data-bits: "0"
79516-79543 uart: tx-data-bits: "0"
79334-79543 uart: tx-data: "25"
79542-79569 uart: tx-parity-ok: "Stop bit" "Stop" "T"
79826-79853 uart: tx-start: "Start bit" "Start" "S"
79852-79879 uart: tx-data-bits: "0"
79878-79905 uart: tx-data-bits: "1"
79904-79931 uart: tx-data-bits: "0"
79930-79957 uart: tx-data-bits: "1"
79956-79983 uart: tx-data-bits: "1"
79982-80009 uart: tx-data-bits: "0"
80008-80035 uart: tx-data-bits: "0"
80034-80061 uart: tx-data-bits: "0"
79852-80061 uart: tx-data: "26"
80060-80087 uart: tx-parity-ok: "Stop bit" "Stop" "T"
80345-80372 uart: tx-start: "Start bit" "Start" "S"
80371-80398 uart: tx-data-bits: "1"
80397-80424 uart: tx-data-bits: "1"
80423-80450 uart: tx-data-bits: "0"
80449-80476 uart: tx-data-bits: "1"
80475-80502 uart: tx-data-bits: "1"
80501-80528 uart: tx-data-bits: "0"
80527-80554 uart: tx-data-bits: "0"
80553-80580 uart: tx-data-bits: "0"
80371-80580 uart: tx-data: "27"
80579-80606 uart: tx-parity-ok: "Stop bit" "Stop" "T"
80863-80890 uart: tx-start: "Start bit" "Start" "S"
80889-80916 uart: tx-data-bits: "0"
80915-80942 uart: tx-data-bits: "0"
80941-80968 uart: tx-data-bits: "1"
80967-80994 uart: tx-data-bits: "1"
80993-81020 uart: tx-data-bits: "1"
81019-81046 uart: tx-data-bits: "0"
81045-81072 uart: tx-data-bits: "0"
81071-81098 uart: tx-data-bits: "0"
80889-81098 uart: tx-data: "28"
81097-81124 uart: tx-parity-ok: "Stop bit" "Stop" "T"
81380-81407 uart: tx-start: "Start bit" "Start" "S"
81406-81433 uart: tx-data-bits: "1"
81432-81459 uart: tx-data-bits: "0"
81458-81485 uart: tx-data-bits: "1"
81484-81511 uart: tx-data-bits: "1"
81510-81537 uart: tx-data-bits: "1"
81536-81563 uart: tx-data-bits: "0"
81562-81589 uart: tx-data-bits: "0"
81588-81615 uart: tx-data-bits: "0"
81406-81615 uart: tx-data: "29"
81614-81641 uart: tx-parity-ok: "Stop bit" "Stop" "T"
81899-81926 uart: tx-start: "Start bit" "Start" "S"
81925-81952 uart: tx-data-bits: "0"
81951-81978 uart: tx-data-bits: "1"
81977-82004 uart: tx-data-bits: "1"
82003-82030 uart: tx-data-bits: "1"
82029-82056 uart: tx-data-bits: "1"
82055-82082 uart: tx-data-bits: "0"
82081-82108 uart: tx-data-bits: "0"
82107-82134 uart: tx-data-bits: "0"
81925-82134 uart: tx-data: "30"
82133-82160 uart: tx-parity-ok: "Stop bit" "Stop" "T"
82415-82442 uart: tx-start: "Start bit" "Start" "S"
82441-82468 uart: tx-data-bits: "1"
82467-82494 uart: tx-data-bits: "1"
82493-82520 uart: tx-data-bits: "1"
82519-82546 uart: tx-data-bits: "1"
82545-82572 uart: tx-data-bits: "1"
82571-82598 uart: tx-data-bits: "0"
82597-82624 uart: tx-data-bits: "0"
82623-82650 uart: tx-data-bits: "0"
82441-82650 uart: tx-data: "31"
74668-82650 uart: tx-packet: "16 17 18 19 20 21 22 23 24 25 26 27 28 29 30 31"
82649-82676 uart: tx-parity-ok: "Stop bit" "Stop" "T"
82932-82959 uart: tx-start: "Start bit" "Start" "S"
82958-82985 uart: tx-data-bits: "0"
82984-83011 uart: tx-data-bits: "0"
83010-83037 uart: tx-data-bits: "0"
83036-83063 uart: tx-data-bits: "0"
83062-83089 uart: tx-data-bits: "0"
83088-83115 uart: tx-data-bits: "1"
83114-83141 uart: tx-data-bits: "0"
83140-83167 uart: tx-data-bits: "0"
82958-83167 uart: tx-data: "32"
83166-83193 uart: tx-parity-ok: "Stop bit" "Stop" "T"
83448-83475 uart: tx-start: "Start bit" "Start" "S"
83474-83501 uart: tx-data-bits: "1"
83500-83527 uart: tx-data-bits: "0"
83526-83553 uart: tx-data-bits: "0"
83552-83579 uart: tx-data-bits: "0"
83578-83605 uart: tx-data-bits: "0"
83604-83631 uart: tx-data-bits: "1"
83630-83657 uart: tx-data-bits: "0"
83656-83683 uart: tx-data-bits: "0"
83474-83683 uart: tx-data: "33"
83682-83709 uart: tx-parity-ok: "Stop bit" "Stop" "T"
83967-83994 uart: tx-start: "Start bit" "Start" "S"
83993-84020 uart: tx-data-bits: "0"
84019-84046 uart: tx-data-bits: "1"
84045-84072 uart: tx-data-bits: "0"
84071-84098 uart: tx-data-bits: "0"
84097-84124 uart: tx-data-bits: "0"
84123-84150 uart: tx-data-bits: "1"
84149-84176 uart: tx-data-bits: "0"
84175-84202 uart: tx-data-bits: "0"
83993-84202 uart: tx-data: "34"
84201-84228 uart: tx-parity-ok: "Stop bit" "Stop" "T"
84485-84512 uart: tx-start: "Start bit" "Start" "S"
84511-84538 uart: tx-data-bits: "1"
84537-84564 uart: tx-data-bits: "1"
84563-84590 uart: tx-data-bits: "0"
84589-84616 uart: tx-data-bits: "0"
84615-84642 uart: tx-data-bits: "0"
84641-84668 uart: tx-data-bits: "1"
84667-84694 uart: tx-data-bits: "0"
84693-84720 uart: tx-data-bits: "0"
84511-84720 uart: tx-data: "35"
84719-84746 uart: tx-parity-ok: "Stop bit" "Stop" "T"
85004-85031 uart: tx-start: "Start bit" "Start" "S"
85030-85057 uart: tx-data-bits: "0"
85056-85083 uart: tx-data-bits: "0"
85082-85109 uart: tx-data-bits: "1"
85108-85135 uart: tx-data-bits: "0"
85134-85161 uart: tx-data-bits: "0"
85160-85187 uart: tx-data-bits: "1"
85186-85213 uart: tx-data-bits: "0"
85212-85239 uart: tx-data-bits: "0"
85030-85239 uart: tx-data: "36"
85238-85265 uart: tx-parity-ok: "Stop bit" "Stop" "T"
85523-85550 uart: tx-start: "Start bit" "Start" "S"
85549-85576 uart: tx-data-bits: "1"
85575-85602 uart: tx-data-bits: "0"
85601-85628 uart: tx-data-bits: "1"
85627-85654 uart: tx-data-bits: "0"
85653-85680 uart: tx-data-bits: "0"
85679-85706 uart: tx-data-bits: "1"
85705-85732 uart: tx-data-bits: "0"
85731-85758 uart: tx-data-bits: "0"
85549-85758 uart: tx-data: "37"
85757-85784 uart: tx-parity-ok: "Stop bit" "Stop" "T"
86043-86070 uart: tx-start: "Start bit" "Start" "S"
86069-86096 uart: tx-data-bits: "0"
86095-86122 uart: tx-data-bits: "1"
86121-86148 uart: tx-data-bits: "1"
86147-86174 uart: tx-data-bits: "0"
86173-86200 uart: tx-data-bits: "0"
86199-86226 uart: tx-data-bits: "1"
86225-86252 uart: tx-data-bits: "0"
86251-86278 uart: tx-data-bits: "0"
86069-86278 uart: tx-data: "38"
86277-86304 uart: tx-parity-ok: "Stop bit" "Stop" "T"
86562-86589 uart: tx-start: "Start bit" "Start" "S"
86588-86615 uart: tx-data-bits: "1"
86614-86641 uart: tx-data-bits: "1"
86640-86667 uart: tx-data-bits: "1"
86666-86693 uart: tx-data-bits: "0"
86692-86719 uart: tx-data-bits: "0"
86718-86745 uart: tx-data-bits: "1"
86744-86771 uart: tx-data-bits: "0"
86770-86797 uart: tx-data-bits: "0"
86588-86797 uart: tx-data: "39"
86796-86823 uart: tx-parity-ok: "Stop bit" "Stop" "T"
87080-87107 uart: tx-start: "Start bit" "Start" "S"
87106-87133 uart: tx-data-bits: "0"
87132-87159 uart: tx-data-bits: "0"
87158-87185 uart: tx-data-bits: "0"
87184-87211 uart: tx-data-bits: "1"
87210-87237 uart: tx-data-bits: "0"
87236-87263 uart: tx-data-bits: "1"
87262-87289 uart: tx-data-bits: "0"
87288-87315 uart: tx-data-bits: "0"
87106-87315 uart: tx-data: "40"
87314-87341 uart: tx-parity-ok: "Stop bit" "Stop" "T"
87599-87626 uart: tx-start: "Start bit" "Start" "S"
87625-87652 uart: tx-data-bits: "1"
87651-87678 uart: tx-data-bits: "0"
87677-87704 uart: tx-data-bits: "0"
87703-87730 uart: tx-data-bits: "1"
87729-87756 uart: tx-data-bits: "0"
87755-87782 uart: tx-data-bits: "1"
87781-87808 uart: tx-data-bits: "0"
87807-87834 uart: tx-data-bits: "0"
87625-87834 uart: tx-data: "41"
87833-87860 uart: tx-parity-ok: "Stop bit" "Stop" "T"
88120-88147 uart: tx-start: "Start bit" "Start" "S"
88146-88173 uart: tx-data-bits: "0"
88172-88199 uart: tx-data-bits: "1"
88198-88225 uart: tx-data-bits: "0"
88224-88251 uart: tx-data-bits: "1"
88250-88277 uart: tx-data-bits: "0"
88276-88303 uart: tx-data-bits: "1"
88302-88329 uart: tx-data-bits: "0"
88328-88355 uart: tx-data-bits: "0"
88146-88355 uart: tx-data: "42"
88354-88381 uart: tx-parity-ok: "Stop bit" "Stop" "T"
88640-88667 uart: tx-start: "Start bit" "Start" "S"
88666-88693 uart: tx-data-bits: "1"
88692-88719 uart: tx-data-bits: "1"
88718-88745 uart: tx-data-bits: "0"
88744-88771 uart: tx-data-bits: "1"
88770-88797 uart: tx-data-bits: "0"
88796-88823 uart: tx-data-bits: "1"
88822-88849 uart: tx-data-bits: "0"
88848-88875 uart: tx-data-bits: "0"
88666-88875 uart: tx-data: "43"
88874-88901 uart: tx-parity-ok: "Stop bit" "Stop" "T"
89161-89188 uart: tx-start: "Start bit" "Start" "S"
89187-89214 uart: tx-data-bits: "0"
89213-89240 uart: tx-data-bits: "0"
89239-89266 uart: tx-data-bits: "1"
89265-89292 uart: tx-data-bits: "1"
89291-89318 uart: tx-data-bits: "0"
89317-89344 uart: tx-data-bits: "1"
89343-89370 uart: tx-data-bits: "0"
89369-89396 uart: tx-data-bits: "0"
89187-89396 uart: tx-data: "44"
89395-89422 uart: tx-parity-ok: "Stop bit" "Stop" "T"
89679-89706 uart: tx-start: "Start bit" "Start" "S"
89705-89732 uart: tx-data-bits: "1"
89731-89758 uart: tx-data-bits: "0"
89757-89784 uart: tx-data-bits: "1"
89783-89810 uart: tx-data-bits: "1"
89809-89836 uart: tx-data-bits: "0"
89835-89862 uart: tx-data-bits: "1"
89861-89888 uart: tx-data-bits: "0"
89887-89914 uart: tx-data-bits: "0"
89705-89914 uart: tx-data: "45"
89913-89940 uart: tx-parity-ok: "Stop bit" "Stop" "T"
90200-90227 uart: tx-start: "Start bit" "Start" "S"
90226-90253 uart: tx-data-bits: "0"
90252-90279 uart: tx-data-bits: "1"
90278-90305 uart: tx-data-bits: "1"
90304-90331 uart: tx-data-bits: "1"
90330-90357 uart: tx-data-bits: "0"
90356-90383 uart: tx-data-bits: "1"
90382-90409 uart: tx-data-bits: "0"
90408-90435 uart: tx-data-bits: "0"
90226-90435 uart: tx-data: "46"
90434-90461 uart: tx-parity-ok: "Stop bit" "Stop" "T"
90719-90746 uart: tx-start: "Start bit" "Start" "S"
90745-90772 uart: tx-data-bits: "1"
90771-90798 uart: tx-data-bits: "1"
90797-90824 uart: tx-data-bits: "1"
90823-90850 uart: tx-data-bits: "1"
90849-90876 uart: tx-data-bits: "0"
90875-90902 uart: tx-data-bits: "1"
90901-90928 uart: tx-data-bits: "0"
90927-90954 uart: tx-data-bits: "0"
90745-90954 uart: tx-data: "47"
82958-90954 uart: tx-packet: "32 33 34 35 36 37 38 39 40 41 42 43 44 45 46 47"
90953-90980 uart: tx-parity-ok: "Stop bit" "Stop" "T"
91237-91264 uart: tx-start: "Start bit" "Start" "S"
91263-91290 uart: tx-data-bits: "0"
91289-91316 uart: tx-data-bits: "0"
91315-91342 uart: tx-data-bits: "0"
91341-91368 uart: tx-data-bits: "0"
91367-91394 uart: tx-data-bits: "1"
91393-91420 uart: tx-data-bits: "1"
91419-91446 uart: tx-data-bits: "0"
91445-91472 uart: tx-data-bits: "0"
91263-91472 uart: tx-data: "48"
91471-91498 uart: tx-parity-ok: "Stop bit" "Stop" "T"
91754-91781 uart: tx-start: "Start bit" "Start" "S"
91780-91807 uart: tx-data-bits: "1"
91806-91833 uart: tx-data-bits: "0"
91832-91859 uart: tx-data-bits: "0"
91858-91885 uart: tx-data-bits: "0"
91884-91911 uart: tx-data-bits: "1"
91910-91937 uart: tx-data-bits: "1"
91936-91963 uart: tx-data-bits: "0"
91962-91989 uart: tx-data-bits: "0"
91780-91989 uart: tx-data: "49"
91988-92015 uart: tx-parity-ok: "Stop bit" "Stop" "T"
92272-92299 uart: tx-start: "Start bit" "Start" "S"
92298-92325 uart: tx-data-bits: "0"
92324-92351 uart: tx-data-bits: "1"
92350-92377 uart: tx-data-bits: "0"
92376-92403 uart: tx-data-bits: "0"
92402-92429 uart: tx-data-bits: "1"
92428-92455 uart: tx-data-bits: "1"
92454-92481 uart: tx-data-bits: "0"
92480-92507 uart: tx-data-bits: "0"
92298-92507 uart: tx-data: "50"
92506-92533 uart: tx-parity-ok: "Stop bit" "Stop" "T"
92791-92818 uart: tx-start: "Start bit" "Start" "S"
92817-92844 uart: tx-data-bits: "1"
92843-92870 uart: tx-data-bits: "1"
92869-92896 uart: tx-data-bits: "0"
92895-92922 uart: tx-data-bits: "0"
92921-92948 uart: tx-data-bits: "1"
92947-92974 uart: tx-data-bits: "1"
92973-93000 uart: tx-data-bits: "0"
92999-93026 uart: tx-data-bits: "0"
92817-93026 uart: tx-data: "51"
93025-93052 uart: tx-parity-ok: "Stop bit" "Stop" "T"
93309-93336 uart: tx-start: "Start bit" "Start" "S"
93335-93362 uart: tx-data-bits: "0"
93361-93388 uart: tx-data-bits: "0"
93387-93414 uart: tx-data-bits: "1"
93413-93440 uart: tx-data-bits: "0"
93439-93466 uart: tx-data-bits: "1"
93465-93492 uart: tx-data-bits: "1"
93491-93518 uart: tx-data-bits: "0"
93517-93544 uart: tx-data-bits: "0"
93335-93544 uart: tx-data: "52"
93543-93570 uart: tx-parity-ok: "Stop bit" "Stop" "T"
93828-93855 uart: tx-start: "Start bit" "Start" "S"
93854-93881 uart: tx-data-bits: "1"
93880-93907 uart: tx-data-bits: "0"
93906-93933 uart: tx-data-bits: "1"
93932-93959 uart: tx-data-bits: "0"
93958-93985 uart: tx-data-bits: "1"
93984-94011 uart: tx-data-bits: "1"
94010-94037 uart: tx-data-bits: "0"
94036-94063 uart: tx-data-bits: "0"
93854-94063 uart: tx-data: "53"
94062-94089 uart: tx-parity-ok: "Stop bit" "Stop" "T"
94349-94376 uart: tx-start: "Start bit" "Start" "S"
94375-94402 uart: tx-data-bits: "0"
94401-94428 uart: tx-data-bits: "1"
94427-94454 uart: tx-data-bits: "1"
94453-94480 uart: tx-data-bits: "0"
94479-94506 uart: tx-data-bits: "1"
94505-94532 uart: tx-data-bits: "1"
94531-94558 uart: tx-data-bits: "0"
94557-94584 uart: tx-data-bits: "0"
94375-94584 uart: tx-data: "54"
94583-94610 uart: tx-parity-ok: "Stop bit" "Stop" "T"
94867-94894 uart: tx-start: "Start bit" "Start" "S"
94893-94920 uart: tx-data-bits: "1"
94919-94946 uart: tx-data-bits: "1"
94945-94972 uart: tx-data-bits: "1"
94971-94998 uart: tx-data-bits: "0"
94997-95024 uart: tx-data-bits: "1"
95023-95050 uart: tx-data-bits: "1"
95049-95076 uart: tx-data-bits: "0"
95075-95102 uart: tx-data-bits: "0"
94893-95102 uart: tx-data: "55"
95101-95128 uart: tx-parity-ok: "Stop bit" "Stop" "T"
95386-95413 uart: tx-start: "Start bit" "Start" "S"
95412-95439 uart: tx-data-bits: "0"
95438-95465 uart: tx-data-bits: "0"
95464-95491 uart: tx-data-bits: "0"
95490-95517 uart: tx-data-bits: "1"
95516-95543 uart: tx-data-bits: "1"
95542-95569 uart: tx-data-bits: "1"
95568-95595 uart: tx-data-bits: "0"
95594-95621 uart: tx-data-bits: "0"
95412-95621 uart: tx-data: "56"
95620-95647 uart: tx-parity-ok: "Stop bit" "Stop" "T"
95902-95929 uart: tx-start: "Start bit" "Start" "S"
95928-95955 uart: tx-data-bits: "1"
95954-95981 uart: tx-data-bits: "0"
95980-96007 uart: tx-data-bits: "0"
96006-96033 uart: tx-data-bits: "1"
96032-96059 uart: tx-data-bits: "1"
96058-96085 uart: tx-data-bits: "1"
96084-96111 uart: tx-data-bits: "0"
96110-96137 uart: tx-data-bits: "0"
95928-96137 uart: tx-data: "57"
96136-96163 uart: tx-parity-ok: "Stop bit" "Stop" "T"
96421-96448 uart: tx-start: "Start bit" "Start" "S"
96447-96474 uart: tx-data-bits: "0"
96473-96500 uart: tx-data-bits: "1"
96499-96526 uart: tx-data-bits: "0"
96525-96552 uart: tx-data-bits: "1"
96551-96578 uart: tx-data-bits: "1"
96577-96604 uart: tx-data-bits: "1"
96603-96630 uart: tx-data-bits: "0"
96629-96656 uart: tx-data-bits: "0"
96447-96656 uart: tx-data: "58"
96655-96682 uart: tx-parity-ok: "Stop bit" "Stop" "T"
96940-96967 uart: tx-start: "Start bit" "Start" "S"
96966-96993 uart: tx-data-bits: "1"
96992-97019 uart: tx-data-bits: "1"
97018-97045 uart: tx-data-bits: "0"
97044-97071 uart: tx-data-bits: "1"
97070-97097 uart: tx-data-bits: "1"
97096-97123 uart: tx-data-bits: "1"
97122-97149 uart: tx-data-bits: "0"
97148-97175 uart: tx-data-bits: "0"
96966-97175 uart: tx-data: "59"
97174-97201 uart: tx-parity-ok: "Stop bit" "Stop" "T"
97458-97485 uart: tx-start: "Start bit" "Start" "S"
97484-97511 uart: tx-data-bits: "0"
97510-97537 uart: tx-data-bits: "0"
97536-97563 uart: tx-data-bits: "1"
97562-97589 uart: tx-data-bits: "1"
97588-97615 uart: tx-data-bits: "1"
97614-97641 uart: tx-data-bits: "1"
97640-97667 uart: tx-data-bits: "0"
97666-97693 uart: tx-data-bits: "0"
97484-97693 uart: tx-data: "60"
97692-97719 uart: tx-parity-ok: "Stop bit" "Stop" "T"
97975-98002 uart: tx-start: "Start bit" "Start" "S"
98001-98028 uart: tx-data-bits: "1"
98027-98054 uart: tx-data-bits: "0"
98053-98080 uart: tx-data-bits: "1"
98079-98106 uart: tx-data-bits: "1"
98105-98132 uart: tx-data-bits: "1"
98131-98158 uart: tx-data-bits: "1"
98157-98184 uart: tx-data-bits: "0"
98183-98210 uart: tx-data-bits: "0"
98001-98210 uart: tx-data: "61"
98209-98236 uart: tx-parity-ok: "Stop bit" "Stop" "T"
98493-98520 uart: tx-start: "Start bit" "Start" "S"
98519-98546 uart: tx-data-bits: "0"
98545-98572 uart: tx-data-bits: "1"
98571-98598 uart: tx-data-bits: "1"
98597-98624 uart: tx-data-bits: "1"
98623-98650 uart: tx-data-bits: "1"
98649-98676 uart: tx-data-bits: "1"
98675-98702 uart: tx-data-bits: "0"
98701-98728 uart: tx-data-bits: "0"
98519-98728 uart: tx-data: "62"
98727-98754 uart: tx-parity-ok: "Stop bit" "Stop" "T"
99010-99037 uart: tx-start: "Start bit" "Start" "S"
99036-99063 uart: tx-data-bits: "1"
99062-99089 uart: tx-data-bits: "1"
99088-99115 uart: tx-data-bits: "1"
99114-99141 uart: tx-data-bits: "1"
99140-99167 uart: tx-data-bits: "1"
99166-99193 uart: tx-data-bits: "1"
99192-99219 uart: tx-data-bits: "0"
99218-99245 uart: tx-data-bits: "0"
99036-99245 uart: tx-data: "63"
91263-99245 uart: tx-packet: "48 49 50 51 52 53 54 55 56 57 58 59 60 61 62 63"
99244-99271 uart: tx-parity-ok: "Stop bit" "Stop" "T"
99526-99553 uart: tx-start: "Start bit" "Start" "S"
99552-99579 uart: tx-data-bits: "0"
99578-99605 uart: tx-data-bits: "0"
99604-99631 uart: tx-data-bits: "0"
99630-99657 uart: tx-data-bits: "0"
99656-99683 uart: tx-data-bits: "0"
99682-99709 uart: tx-data-bits: "0"
99708-99735 uart: tx-data-bits: "1"
99734-99761 uart: tx-data-bits: "0"
99552-99761 uart: tx-data: "64"
99760-99787 uart: tx-parity-ok: "Stop bit" "Stop" "T"
100043-100070 uart: tx-start: "Start bit" "Start" "S"
100069-100096 uart: tx-data-bits: "1"
100095-100122 uart: tx-data-bits: "0"
100121-100148 uart: tx-data-bits: "0"
100147-100174 uart: tx-data-bits: "0"
100173-100200 uart: tx-data-bits: "0"
100199-100226 uart: tx-data-bits: "0"
100225-100252 uart: tx-data-bits: "1"
100251-100278 uart: tx-data-bits: "0"
100069-100278 uart: tx-data: "65"
100277-100304 uart: tx-parity-ok: "Stop bit" "Stop" "T"
100562-100589 uart: tx-start: "Start bit" "Start" "S"
100588-100615 uart: tx-data-bits: "0"
100614-100641 uart: tx-data-bits: "1"
100640-100667 uart: tx-data-bits: "0"
100666-100693 uart: tx-data-bits: "0"
100692-100719 uart: tx-data-bits: "0"
100718-100745 uart: tx-data-bits: "0"
100744-100771 uart: tx-data-bits: "1"
100770-100797 uart: tx-data-bits: "0"
100588-100797 uart: tx-data: "66"
100796-100823 uart: tx-parity-ok: "Stop bit" "Stop" "T"
101080-101107 uart: tx-start: "Start bit" "Start" "S"
101106-101133 uart: tx-data-bits: "1"
101132-101159 uart: tx-data-bits: "1"
101158-101185 uart: tx-data-bits: "0"
101184-101211 uart: tx-data-bits: "0"
101210-101237 uart: tx-data-bits: "0"
101236-101263 uart: tx-data-bits: "0"
101262-101289 uart: tx-data-bits: "1"
101288-101315 uart: tx-data-bits: "0"
101106-101315 uart: tx-data: "67"
101314-101341 uart: tx-parity-ok: "Stop bit" "Stop" "T"
101599-101626 uart: tx-start: "Start bit" "Start" "S"
101625-101652 uart: tx-data-bits: "0"
101651-101678 uart: tx-data-bits: "0"
101677-101704 uart: tx-data-bits: "1"
101703-101730 uart: tx-data-bits: "0"
101729-101756 uart: tx-data-bits: "0"
101755-101782 uart: tx-data-bits: "0"
101781-101808 uart: tx-data-bits: "1"
101807-101834 uart: tx-data-bits: "0"
101625-101834 uart: tx-data: "68"
101833-101860 uart: tx-parity-ok: "Stop bit" "Stop" "T"
102117-102144 uart: tx-start: "Start bit" "Start" "S"
102143-102170 uart: tx-data-bits: "1"
102169-102196 uart: tx-data-bits: "0"
102195-102222 uart: tx-data-bits: "1"
102221-102248 uart: tx-data-bits: "0"
102247-102274 uart: tx-data-bits: "0"
102273-102300 uart: tx-data-bits: "0"
102299-102326 uart: tx-data-bits: "1"
102325-102352 uart: tx-data-bits: "0"
102143-102352 uart: tx-data: "69"
102351-102378 uart: tx-parity-ok: "Stop bit" "Stop" "T"
102638-102665 uart: tx-start: "Start bit" "Start" "S"
102664-102691 uart: tx-data-bits: "0"
102690-102717 uart: tx-data-bits: "1"
102716-102743 uart: tx-data-bits: "1"
102742-102769 uart: tx-data-bits: "0"
102768-102795 uart: tx-data-bits: "0"
102794-102821 uart: tx-data-bits: "0"
102820-102847 uart: tx-data-bits: "1"
102846-102873 uart: tx-data-bits: "0"
102664-102873 uart: tx-data: "70"
102872-102899 uart: tx-parity-ok: "Stop bit" "Stop" "T"
103157-103184 uart: tx-start: "Start bit" "Start" "S"
103183-103210 uart: tx-data-bits: "1"
103209-103236 uart: tx-data-bits: "1"
103235-103262 uart: tx-data-bits: "1"
103261-103288 uart: tx-data-bits: "0"
103287-103314 uart: tx-data-bits: "0"
103313-103340 uart: tx-data-bits: "0"
103339-103366 uart: tx-data-bits: "1"
103365-103392 uart: tx-data-bits: "0"
103183-103392 uart: tx-data: "71"
103391-103418 uart: tx-parity-ok: "Stop bit" "Stop" "T"
103675-103702 uart: tx-start: "Start bit" "Start" "S"
103701-103728 uart: tx-data-bits: "0"
103727-103754 uart: tx-data-bits: "0"
103753-103780 uart: tx-data-bits: "0"
103779-103806 uart: tx-data-bits: "1"
103805-103832 uart: tx-data-bits: "0"
103831-103858 uart: tx-data-bits: "0"
103857-103884 uart: tx-data-bits: "1"
103883-103910 uart: tx-data-bits: "0"
103701-103910 uart: tx-data: "72"
103909-103936 uart: tx-parity-ok: "Stop bit" "Stop" "T"
104194-104221 uart: tx-start: "Start bit" "Start" "S"
104220-104247 uart: tx-data-bits: "1"
104246-104273 uart: tx-data-bits: "0"
104272-104299 uart: tx-data-bits: "0"
104298-104325 uart: tx-data-bits: "1"
104324-104351 uart: tx-data-bits: "0"
104350-104377 uart: tx-data-bits: "0"
104376-104403 uart: tx-data-bits: "1"
104402-104429 uart: tx-data-bits: "0"
104220-104429 uart: tx-data: "73"
104428-104455 uart: tx-parity-ok: "Stop bit" "Stop" "T"
104714-104741 uart: tx-start: "Start bit" "Start" "S"
104740-104767 uart: tx-data-bits: "0"
104766-104793 uart: tx-data-bits: "1"
104792-104819 uart: tx-data-bits: "0"
104818-104845 uart: tx-data-bits: "1"
104844-104871 uart: tx-data-bits: "0"
104870-104897 uart: tx-data-bits: "0"
104896-104923 uart: tx-data-bits: "1"
104922-104949 uart: tx-data-bits: "0"
104740-104949 uart: tx-data: "74"
104948-104975 uart: tx-parity-ok: "Stop bit" "Stop" "T"
105235-105262 uart: tx-start: "Start bit" "Start" "S"
105261-105288 uart: tx-data-bits: "1"
105287-105314 uart: tx-data-bits: "1"
105313-105340 uart: tx-data-bits: "0"
105339-105366 uart: tx-data-bits: "1"
105365-105392 uart: tx-data-bits: "0"
105391-105418 uart: tx-data-bits: "0"
105417-105444 uart: tx-data-bits: "1"
105443-105470 uart: tx-data-bits: "0"
105261-105470 uart: tx-data: "75"
105469-105496 uart: tx-parity-ok: "Stop bit" "Stop" "T"
105755-105782 uart: tx-start: "Start bit" "Start" "S"
105781-105808 uart: tx-data-bits: "0"
105807-105834 uart: tx-data-bits: "0"
105833-105860 uart: tx-data-bits: "1"
105859-105886 uart: tx-data-bits: "1"
105885-105912 uart: tx-data-bits: "0"
105911-105938 uart: tx-data-bits: "0"
105937-105964 uart: tx-data-bits: "1"
105963-105990 uart: tx-data-bits: "0"
105781-105990 uart: tx-data: "76"
105989-106016 uart: tx-parity-ok: "Stop bit" "Stop" "T"
106274-106301 uart: tx-start: "Start bit" "Start" "S"
106300-106327 uart: tx-data-bits: "1"
106326-106353 uart: tx-data-bits: "0"
106352-106379 uart: tx-data-bits: "1"
106378-106405 uart: tx-data-bits: "1"
106404-106431 uart: tx-data-bits: "0"
106430-106457 uart: tx-data-bits: "0"
106456-106483 uart: tx-data-bits: "1"
106482-106509 uart: tx-data-bits: "0"
106300-106509 uart: tx-data: "77"
106508-106535 uart: tx-parity-ok: "Stop bit" "Stop" "T"
106795-106822 uart: tx-start: "Start bit" "Start" "S"
106821-106848 uart: tx-data-bits: "0"
106847-106874 uart: tx-data-bits: "1"
106873-106900 uart: tx-data-bits: "1"
106899-106926 uart: tx-data-bits: "1"
106925-106952 uart: tx-data-bits: "0"
106951-106978 uart: tx-data-bits: "0"
106977-107004 uart: tx-data-bits: "1"
107003-107030 uart: tx-data-bits: "0"
106821-107030 uart: tx-data: "78"
107029-107056 uart: tx-parity-ok: "Stop bit" "Stop" "T"
107313-107340 uart: tx-start: "Start bit" "Start" "S"
107339-107366 uart: tx-data-bits: "1"
107365-107392 uart: tx-data-bits: "1"
107391-107418 uart: tx-data-bits: "1"
107417-107444 uart: tx-data-bits: "1"
107443-107470 uart: tx-data-bits: "0"
107469-107496 uart: tx-data-bits: "0"
107495-107522 uart: tx-data-bits: "1"
107521-107548 uart: tx-data-bits: "0"
107339-107548 uart: tx-data: "79"
99552-107548 uart: tx-packet: "64 65 66 67 68 69 70 71 72 73 74 75 76 77 78 79"
107547-107574 uart: tx-parity-ok: "Stop bit" "Stop" "T"
107832-107859 uart: tx-start: "Start bit" "Start" "S"
107858-107885 uart: tx-data-bits: "0"
107884-107911 uart: tx-data-bits: "0"
107910-107937 uart: tx-data-bits: "0"
107936-107963 uart: tx-data-bits: "0"
107962-107989 uart: tx-data-bits: "1"
107988-108015 uart: tx-data-bits: "0"
108014-108041 uart: tx-data-bits: "1"
108040-108067 uart: tx-data-bits: "0"
107858-108067 uart: tx-data: "80"
108066-108093 uart: tx-parity-ok: "Stop bit" "Stop" "T"
108350-108377 uart: tx-start: "Start bit" "Start" "S"
108376-108403 uart: tx-data-bits: "1"
108402-108429 uart: tx-data-bits: "0"
108428-108455 uart: tx-data-bits: "0"
108454-108481 uart: tx-data-bits: "0"
108480-108507 uart: tx-data-bits: "1"
108506-108533 uart: tx-data-bits: "0"
108532-108559 uart: tx-data-bits: "1"
108558-108585 uart: tx-data-bits: "0"
108376-108585 uart: tx-data: "81"
108584-108611 uart: tx-parity-ok: "Stop bit" "Stop" "T"
108871-108898 uart: tx-start: "Start bit" "Start" "S"
108897-108924 uart: tx-data-bits: "0"
108923-108950 uart: tx-data-bits: "1"
108949-108976 uart: tx-data-bits: "0"
108975-109002 uart: tx-data-bits: "0"
109001-109028 uart: tx-data-bits: "1"
109027-109054 uart: tx-data-bits: "0"
109053-109080 uart: tx-data-bits: "1"
109079-109106 uart: tx-data-bits: "0"
108897-109106 uart: tx-data: "82"
109105-109132 uart: tx-parity-ok: "Stop bit" "Stop" "T"
109392-109419 uart: tx-start: "Start bit" "Start" "S"
109418-109445 uart: tx-data-bits: "1"
109444-109471 uart: tx-data-bits: "1"
109470-109497 uart: tx-data-bits: "0"
109496-109523 uart: tx-data-bits: "0"
109522-109549 uart: tx-data-bits: "1"
109548-109575 uart: tx-data-bits: "0"
109574-109601 uart: tx-data-bits: "1"
109600-109627 uart: tx-data-bits: "0"
109418-109627 uart: tx-data: "83"
109626-109653 uart: tx-parity-ok: "Stop bit" "Stop" "T"
109912-109939 uart: tx-start: "Start bit" "Start" "S"
109938-109965 uart: tx-data-bits: "0"
109964-109991 uart: tx-data-bits: "0"
109990-110017 uart: tx-data-bits: "1"
110016-110043 uart: tx-data-bits: "0"
110042-110069 uart: tx-data-bits: "1"
110068-110095 uart: tx-data-bits: "0"
110094-110121 uart: tx-data-bits: "1"
110120-110147 uart: tx-data-bits: "0"
109938-110147 uart: tx-data: "84"
110146-110173 uart: tx-parity-ok: "Stop bit" "Stop" "T"
110433-110460 uart: tx-start: "Start bit" "Start" "S"
110459-110486 uart: tx-data-bits: "1"
110485-110512 uart: tx-data-bits: "0"
110511-110538 uart: tx-data-bits: "1"
110537-110564 uart: tx-data-bits: "0"
110563-110590 uart: tx-data-bits: "1"
110589-110616 uart: tx-data-bits: "0"
110615-110642 uart: tx-data-bits: "1"
110641-110668 uart: tx-data-bits: "0"
110459-110668 uart: tx-data: "85"
110667-110694 uart: tx-parity-ok: "Stop bit" "Stop" "T"
110955-110982 uart: tx-start: "Start bit" "Start" "S"
110981-111008 uart: tx-data-bits: "0"
111007-111034 uart: tx-data-bits: "1"
111033-111060 uart: tx-data-bits: "1"
111059-111086 uart: tx-data-bits: "0"
111085-111112 uart: tx-data-bits: "1"
111111-111138 uart: tx-data-bits: "0"
111137-111164 uart: tx-data-bits: "1"
111163-111190 uart: tx-data-bits: "0"
110981-111190 uart: tx-data: "86"
111189-111216 uart: tx-parity-ok: "Stop bit" "Stop" "T"
111476-111503 uart: tx-start: "Start bit" "Start" "S"
111502-111529 uart: tx-data-bits: "1"
111528-111555 uart: tx-data-bits: "1"
111554-111581 uart: tx-data-bits: "1"
111580-111607 uart: tx-data-bits: "0"
111606-111633 uart: tx-data-bits: "1"
111632-111659 uart: tx-data-bits: "0"
111658-111685 uart: tx-data-bits: "1"
111684-111711 uart: tx-data-bits: "0"
111502-111711 uart: tx-data: "87"
111710-111737 uart: tx-parity-ok: "Stop bit" "Stop" "T"
111996-112023 uart: tx-start: "Start bit" "Start" "S"
112022-112049 uart: tx-data-bits: "0"
112048-112075 uart: tx-data-bits: "0"
112074-112101 uart: tx-data-bits: "0"
112100-112127 uart: tx-data-bits: "1"
112126-112153 uart: tx-data-bits: "1"
112152-112179 uart: tx-data-bits: "0"
112178-112205 uart: tx-data-bits: "1"
112204-112231 uart: tx-data-bits: "0"
112022-112231 uart: tx-data: "88"
112230-112257 uart: tx-parity-ok: "Stop bit" "Stop" "T"
112515-112542 uart: tx-start: "Start bit" "Start" "S"
112541-112568 uart: tx-data-bits: "1"
112567-112594 uart: tx-data-bits: "0"
112593-112620 uart: tx-data-bits: "0"
112619-112646 uart: tx-data-bits: "1"
112645-112672 uart: tx-data-bits: "1"
112671-112698 uart: tx-data-bits: "0"
112697-112724 uart: tx-data-bits: "1"
112723-112750 uart: tx-data-bits: "0"
112541-112750 uart: tx-data: "89"
112749-112776 uart: tx-parity-ok: "Stop bit" "Stop" "T"
113036-113063 uart: tx-start: "Start bit" "Start" "S"
113062-113089 uart: tx-data-bits: "0"
113088-113115 uart: tx-data-bits: "1"
113114-113141 uart: tx-data-bits: "0"
113140-113167 uart: tx-data-bits: "1"
113166-113193 uart: tx-data-bits: "1"
113192-113219 uart: tx-data-bits: "0"
113218-113245 uart: tx-data-bits: "1"
113244-113271 uart: tx-data-bits: "0"
113062-113271 uart: tx-data: "90"
113270-113297 uart: tx-parity-ok: "Stop bit" "Stop" "T"
113556-113583 uart: tx-start: "Start bit" "Start" "S"
113582-113609 uart: tx-data-bits: "1"
113608-113635 uart: tx-data-bits: "1"
113634-113661 uart: tx-data-bits: "0"
113660-113687 uart: tx-data-bits: "1"
113686-113713 uart: tx-data-bits: "1"
113712-113739 uart: tx-data-bits: "0"
113738-113765 uart: tx-data-bits: "1"
113764-113791 uart: tx-data-bits: "0"
113582-113791 uart: tx-data: "91"
113790-113817 uart: tx-parity-ok: "Stop bit" "Stop" "T"
114077-114104 uart: tx-start: "Start bit" "Start" "S"
114103-114130 uart: tx-data-bits: "0"
114129-114156 uart: tx-data-bits: "0"
114155-114182 uart: tx-data-bits: "1"
114181-114208 uart: tx-data-bits: "1"
114207-114234 uart: tx-data-bits: "1"
114233-114260 uart: tx-data-bits: "0"
114259-114286 uart: tx-data-bits: "1"
114285-114312 uart: tx-data-bits: "0"
114103-114312 uart: tx-data: "92"
114311-114338 uart: tx-parity-ok: "Stop bit" "Stop" "T"
114595-114622 uart: tx-start: "Start bit" "Start" "S"
114621-114648 uart: tx-data-bits: "1"
114647-114674 uart: tx-data-bits: "0"
114673-114700 uart: tx-data-bits: "1"
114699-114726 uart: tx-data-bits: "1"
114725-114752 uart: tx-data-bits: "1"
114751-114778 uart: tx-data-bits: "0"
114777-114804 uart: tx-data-bits: "1"
114803-114830 uart: tx-data-bits: "0"
114621-114830 uart: tx-data: "93"
114829-114856 uart: tx-parity-ok: "Stop bit" "Stop" "T"
115116-115143 uart: tx-start: "Start bit" "Start" "S"
115142-115169 uart: tx-data-bits: "0"
115168-115195 uart: tx-data-bits: "1"
115194-115221 uart: tx-data-bits: "1"
115220-115247 uart: tx-data-bits: "1"
115246-115273 uart: tx-data-bits: "1"
115272-115299 uart: tx-data-bits: "0"
115298-115325 uart: tx-data-bits: "1"
115324-115351 uart: tx-data-bits: "0"
115142-115351 uart: tx-data: "94"
115350-115377 uart: tx-parity-ok: "Stop bit" "Stop" "T"
115635-115662 uart: tx-start: "Start bit" "Start" "S"
115661-115688 uart: tx-data-bits: "1"
115687-115714 uart: tx-data-bits: "1"
115713-115740 uart: tx-data-bits: "1"
115739-115766 uart: tx-data-bits: "1"
115765-115792 uart: tx-data-bits: "1"
115791-115818 uart: tx-data-bits: "0"
115817-115844 uart: tx-data-bits: "1"
115843-115870 uart: tx-data-bits: "0"
115661-115870 uart: tx-data: "95"
107858-115870 uart: tx-packet: "80 81 82 83 84 85 86 87 88 89 90 91 92 93 94 95"
115869-115896 uart: tx-parity-ok: "Stop bit" "Stop" "T"
116153-116180 uart: tx-start: "Start bit" "Start" "S"
116179-116206 uart: tx-data-bits: "0"
116205-116232 uart: tx-data-bits: "0"
116231-116258 uart: tx-data-bits: "0"
116257-116284 uart: tx-data-bits: "0"
116283-116310 uart: tx-data-bits: "0"
116309-116336 uart: tx-data-bits: "1"
116335-116362 uart: tx-data-bits: "1"
116361-116388 uart: tx-data-bits: "0"
116179-116388 uart: tx-data: "96"
116387-116414 uart: tx-parity-ok: "Stop bit" "Stop" "T"
116670-116697 uart: tx-start: "Start bit" "Start" "S"
116696-116723 uart: tx-data-bits: "1"
116722-116749 uart: tx-data-bits: "0"
116748-116775 uart: tx-data-bits: "0"
116774-116801 uart: tx-data-bits: "0"
116800-116827 uart: tx-data-bits: "0"
116826-116853 uart: tx-data-bits: "1"
116852-116879 uart: tx-data-bits: "1"
116878-116905 uart: tx-data-bits: "0"
116696-116905 uart: tx-data: "97"
116904-116931 uart: tx-parity-ok: "Stop bit" "Stop" "T"
117188-117215 uart: tx-start: "Start bit" "Start" "S"
117214-117241 uart: tx-data-bits: "0"
117240-117267 uart: tx-data-bits: "1"
117266-117293 uart: tx-data-bits: "0"
117292-117319 uart: tx-data-bits: "0"
117318-117345 uart: tx-data-bits: "0"
117344-117371 uart: tx-data-bits: "1"
117370-117397 uart: tx-data-bits: "1"
117396-117423 uart: tx-data-bits: "0"
117214-117423 uart: tx-data: "98"
117422-117449 uart: tx-parity-ok: "Stop bit" "Stop" "T"
117707-117734 uart: tx-start: "Start bit" "Start" "S"
117733-117760 uart: tx-data-bits: "1"
117759-117786 uart: tx-data-bits: "1"
117785-117812 uart: tx-data-bits: "0"
117811-117838 uart: tx-data-bits: "0"
117837-117864 uart: tx-data-bits: "0"
117863-117890 uart: tx-data-bits: "1"
117889-117916 uart: tx-data-bits: "1"
117915-117942 uart: tx-data-bits: "0"
117733-117942 uart: tx-data: "99"
117941-117968 uart: tx-parity-ok: "Stop bit" "Stop" "T"
118226-118253 uart: tx-start: "Start bit" "Start" "S"
118252-118279 uart: tx-data-bits: "0"
118278-118305 uart: tx-data-bits: "0"
118304-118331 uart: tx-data-bits: "1"
118330-118357 uart: tx-data-bits: "0"
118356-118383 uart: tx-data-bits: "0"
118382-118409 uart: tx-data-bits: "1"
118408-118435 uart: tx-data-bits: "1"
118434-118461 uart: tx-data-bits: "0"
118252-118461 uart: tx-data: "100"
118460-118487 uart: tx-parity-ok: "Stop bit" "Stop" "T"
118744-118771 uart: tx-start: "Start bit" "Start" "S"
118770-118797 uart: tx-data-bits: "1"
118796-118823 uart: tx-data-bits: "0"
118822-118849 uart: tx-data-bits: "1"
118848-118875 uart: tx-data-bits: "0"
118874-118901 uart: tx-data-bits: "0"
118900-118927 uart: tx-data-bits: "1"
118926-118953 uart: tx-data-bits: "1"
118952-118979 uart: tx-data-bits: "0"
118770-118979 uart: tx-data: "101"
118978-119005 uart: tx-parity-ok: "Stop bit" "Stop" "T"
119265-119292 uart: tx-start: "Start bit" "Start" "S"
119291-119318 uart: tx-data-bits: "0"
119317-119344 uart: tx-data-bits: "1"
119343-119370 uart: tx-data-bits: "1"
119369-119396 uart: tx-data-bits: "0"
119395-119422 uart: tx-data-bits: "0"
119421-119448 uart: tx-data-bits: "1"
119447-119474 uart: tx-data-bits: "1"
119473-119500 uart: tx-data-bits: "0"
119291-119500 uart: tx-data: "102"
119499-119526 uart: tx-parity-ok: "Stop bit" "Stop" "T"
119783-119810 uart: tx-start: "Start bit" "Start" "S"
119809-119836 uart: tx-data-bits: "1"
119835-119862 uart: tx-data-bits: "1"
119861-119888 uart: tx-data-bits: "1"
119887-119914 uart: tx-data-bits: "0"
119913-119940 uart: tx-data-bits: "0"
119939-119966 uart: tx-data-bits: "1"
119965-119992 uart: tx-data-bits: "1"
119991-120018 uart: tx-data-bits: "0"
119809-120018 uart: tx-data: "103"
120017-120044 uart: tx-parity-ok: "Stop bit" "Stop" "T"
120302-120329 uart: tx-start: "Start bit" "Start" "S"
120328-120355 uart: tx-data-bits: "0"
120354-120381 uart: tx-data-bits: "0"
120380-120407 uart: tx-data-bits: "0"
120406-120433 uart: tx-data-bits: "1"
120432-120459 uart: tx-data-bits: "0"
120458-120485 uart: tx-data-bits: "1"
120484-120511 uart: tx-data-bits: "1"
120510-120537 uart: tx-data-bits: "0"
120328-120537 uart: tx-data: "104"
120536-120563 uart: tx-parity-ok: "Stop bit" "Stop" "T"
120820-120847 uart: tx-start: "Start bit" "Start" "S"
120846-120873 uart: tx-data-bits: "1"
120872-120899 uart: tx-data-bits: "0"
120898-120925 uart: tx-data-bits: "0"
120924-120951 uart: tx-data-bits: "1"
120950-120977 uart: tx-data-bits: "0"
120976-121003 uart: tx-data-bits: "1"
121002-121029 uart: tx-data-bits: "1"
121028-121055 uart: tx-data-bits: "0"
120846-121055 uart: tx-data: "105"
121054-121081 uart: tx-parity-ok: "Stop bit" "Stop" "T"
121341-121368 uart: tx-start: "Start bit" "Start" "S"
121367-121394 uart: tx-data-bits: "0"
121393-121420 uart: tx-data-bits: "1"
121419-121446 uart: tx-data-bits: "0"
121445-121472 uart: tx-data-bits: "1"
121471-121498 uart: tx-data-bits: "0"
121497-121524 uart: tx-data-bits: "1"
121523-121550 uart: tx-data-bits: "1"
121549-121576 uart: tx-data-bits: "0"
121367-121576 uart: tx-data: "106"
121575-121602 uart: tx-parity-ok: "Stop bit" "Stop" "T"
121862-121889 uart: tx-start: "Start bit" "Start" "S"
121888-121915 uart: tx-data-bits: "1"
121914-121941 uart: tx-data-bits: "1"
121940-121967 uart: tx-data-bits: "0"
121966-121993 uart: tx-data-bits: "1"
121992-122019 uart: tx-data-bits: "0"
122018-122045 uart: tx-data-bits: "1"
122044-122071 uart: tx-data-bits: "1"
122070-122097 uart: tx-data-bits: "0"
121888-122097 uart: tx-data: "107"
122096-122123 uart: tx-parity-ok: "Stop bit" "Stop" "T"
122382-122409 uart: tx-start: "Start bit" "Start" "S"
122408-122435 uart: tx-data-bits: "0"
122434-122461 uart: tx-data-bits: "0"
122460-122487 uart: tx-data-bits: "1"
122486-122513 uart: tx-data-bits: "1"
122512-122539 uart: tx-data-bits: "0"
122538-122565 uart: tx-data-bits: "1"
122564-122591 uart: tx-data-bits: "1"
122590-122617 uart: tx-data-bits: "0"
122408-122617 uart: tx-data: "108"
122616-122643 uart: tx-parity-ok: "Stop bit" "Stop" "T"
122901-122928 uart: tx-start: "Start bit" "Start" "S"
122927-122954 uart: tx-data-bits: "1"
122953-122980 uart: tx-data-bits: "0"
122979-123006 uart: tx-data-bits: "1"
123005-123032 uart: tx-data-bits: "1"
123031-123058 uart: tx-data-bits: "0"
123057-123084 uart: tx-data-bits: "1"
123083-123110 uart: tx-data-bits: "1"
123109-123136 uart: tx-data-bits: "0"
122927-123136 uart: tx-data: "109"
123135-123162 uart: tx-parity-ok: "Stop bit" "Stop" "T"
123421-123448 uart: tx-start: "Start bit" "Start" "S"
123447-123474 uart: tx-data-bits: "0"
123473-123500 uart: tx-data-bits: "1"
123499-123526 uart: tx-data-bits: "1"
123525-123552 uart: tx-data-bits: "1"
123551-123578 uart: tx-data-bits: "0"
123577-123604 uart: tx-data-bits: "1"
123603-123630 uart: tx-data-bits: "1"
123629-123656 uart: tx-data-bits: "0"
123447-123656 uart: tx-data: "110"
123655-123682 uart: tx-parity-ok: "Stop bit" "Stop" "T"
123940-123967 uart: tx-start: "Start bit" "Start" "S"
123966-123993 uart: tx-data-bits: "1"
123992-124019 uart: tx-data-bits: "1"
124018-124045 uart: tx-data-bits: "1"
124044-124071 uart: tx-data-bits: "1"
124070-124097 uart: tx-data-bits: "0"
124096-124123 uart: tx-data-bits: "1"
124122-124149 uart: tx-data-bits: "1"
124148-124175 uart: tx-data-bits: "0"
123966-124175 uart: tx-data: "111"
116179-124175 uart: tx-packet: "96 97 98 99 100 101 102 103 104 105 106 107 108 109 110 111"
124174-124201 uart: tx-parity-ok: "Stop bit" "Stop" "T"
124459-124486 uart: tx-start: "Start bit" "Start" "S"
124485-124512 uart: tx-data-bits: "0"
124511-124538 uart: tx-data-bits: "0"
124537-124564 uart: tx-data-bits: "0"
124563-124590 uart: tx-data-bits: "0"
124589-124616 uart: tx-data-bits: "1"
124615-124642 uart: tx-data-bits: "1"
124641-124668 uart: tx-data-bits: "1"
124667-124694 uart: tx-data-bits: "0"
124485-124694 uart: tx-data: "112"
124693-124720 uart: tx-parity-ok: "Stop bit" "Stop" "T"
124975-125002 uart: tx-start: "Start bit" "Start" "S"
125001-125028 uart: tx-data-bits: "1"
125027-125054 uart: tx-data-bits: "0"
125053-125080 uart: tx-data-bits: "0"
125079-125106 uart: tx-data-bits: "0"
125105-125132 uart: tx-data-bits: "1"
125131-125158 uart: tx-data-bits: "1"
125157-125184 uart: tx-data-bits: "1"
125183-125210 uart: tx-data-bits: "0"
125001-125210 uart: tx-data: "113"
125209-125236 uart: tx-parity-ok: "Stop bit" "Stop" "T"
125494-125521 uart: tx-start: "Start bit" "Start" "S"
125520-125547 uart: tx-data-bits: "0"
125546-125573 uart: tx-data-bits: "1"
125572-125599 uart: tx-data-bits: "0"
125598-125625 uart: tx-data-bits: "0"
125624-125651 uart: tx-data-bits: "1"
125650-125677 uart: tx-data-bits: "1"
125676-125703 uart: tx-data-bits: "1"
125702-125729 uart: tx-data-bits: "0"
125520-125729 uart: tx-data: "114"
125728-125755 uart: tx-parity-ok: "Stop bit" "Stop" "T"
126013-126040 uart: tx-start: "Start bit" "Start" "S"
126039-126066 uart: tx-data-bits: "1"
126065-126092 uart: tx-data-bits: "1"
126091-126118 uart: tx-data-bits: "0"
126117-126144 uart: tx-data-bits: "0"
126143-126170 uart: tx-data-bits: "1"
126169-126196 uart: tx-data-bits: "1"
126195-126222 uart: tx-data-bits: "1"
126221-126248 uart: tx-data-bits: "0"
126039-126248 uart: tx-data: "115"
126247-126274 uart: tx-parity-ok: "Stop bit" "Stop" "T"
126532-126559 uart: tx-start: "Start bit" "Start" "S"
126558-126585 uart: tx-data-bits: "0"
126584-126611 uart: tx-data-bits: "0"
126610-126637 uart: tx-data-bits: "1"
126636-126663 uart: tx-data-bits: "0"
126662-126689 uart: tx-data-bits: "1"
126688-126715 uart: tx-data-bits: "1"
126714-126741 uart: tx-data-bits: "1"
126740-126767 uart: tx-data-bits: "0"
126558-126767 uart: tx-data: "116"
126766-126793 uart: tx-parity-ok: "Stop bit" "Stop" "T"
127050-127077 uart: tx-start: "Start bit" "Start" "S"
127076-127103 uart: tx-data-bits: "1"
127102-127129 uart: tx-data-bits: "0"
127128-127155 uart: tx-data-bits: "1"
127154-127181 uart: tx-data-bits: "0"
127180-127207 uart: tx-data-bits: "1"
127206-127233 uart: tx-data-bits: "1"
127232-127259 uart: tx-data-bits: "1"
127258-127285 uart: tx-data-bits: "0"
127076-127285 uart: tx-data: "117"
127284-127311 uart: tx-parity-ok: "Stop bit" "Stop" "T"
127571-127598 uart: tx-start: "Start bit" "Start" "S"
127597-127624 uart: tx-data-bits: "0"
127623-127650 uart: tx-data-bits: "1"
127649-127676 uart: tx-data-bits: "1"
127675-127702 uart: tx-data-bits: "0"
127701-127728 uart: tx-data-bits: "1"
127727-127754 uart: tx-data-bits: "1"
127753-127780 uart: tx-data-bits: "1"
127779-127806 uart: tx-data-bits: "0"
127597-127806 uart: tx-data: "118"
127805-127832 uart: tx-parity-ok: "Stop bit" "Stop" "T"
128090-128117 uart: tx-start: "Start bit" "Start" "S"
128116-128143 uart: tx-data-bits: "1"
128142-128169 uart: tx-data-bits: "1"
128168-128195 uart: tx-data-bits: "1"
128194-128221 uart: tx-data-bits: "0"
128220-128247 uart: tx-data-bits: "1"
128246-128273 uart: tx-data-bits: "1"
128272-128299 uart: tx-data-bits: "1"
128298-128325 uart: tx-data-bits: "0"
128116-128325 uart: tx-data: "119"
128324-128351 uart: tx-parity-ok: "Stop bit" "Stop" "T"
128608-128635 uart: tx-start: "Start bit" "Start" "S"
128634-128661 uart: tx-data-bits: "0"
128660-128687 uart: tx-data-bits: "0"
128686-128713 uart: tx-data-bits: "0"
128712-128739 uart: tx-data-bits: "1"
128738-128765 uart: tx-data-bits: "1"
128764-128791 uart: tx-data-bits: "1"
128790-128817 uart: tx-data-bits: "1"
128816-128843 uart: tx-data-bits: "0"
128634-128843 uart: tx-data: "120"
128842-128869 uart: tx-parity-ok: "Stop bit" "Stop" "T"
129125-129152 uart: tx-start: "Start bit" "Start" "S"
129151-129178 uart: tx-data-bits: "1"
129177-129204 uart: tx-data-bits: "0"
129203-129230 uart: tx-data-bits: "0"
129229-129256 uart: tx-data-bits: "1"
129255-129282 uart: tx-data-bits: "1"
129281-129308 uart: tx-data-bits: "1"
129307-129334 uart: tx-data-bits: "1"
129333-129360 uart: tx-data-bits: "0"
129151-129360 uart: tx-data: "121"
129359-129386 uart: tx-parity-ok: "Stop bit" "Stop" "T"
129643-129670 uart: tx-start: "Start bit" "Start" "S"
129669-129696 uart: tx-data-bits: "0"
129695-129722 uart: tx-data-bits: "1"
129721-129748 uart: tx-data-bits: "0"
129747-129774 uart: tx-data-bits: "1"
129773-129800 uart: tx-data-bits: "1"
129799-129826 uart: tx-data-bits: "1"
129825-129852 uart: tx-data-bits: "1"
129851-129878 uart: tx-data-bits: "0"
129669-129878 uart: tx-data: "122"
129877-129904 uart: tx-parity-ok: "Stop bit" "Stop" "T"
130162-130189 uart: tx-start: "Start bit" "Start" "S"
130188-130215 uart: tx-data-bits: "1"
130214-130241 uart: tx-data-bits: "1"
130240-130267 uart: tx-data-bits: "0"
130266-130293 uart: tx-data-bits: "1"
130292-130319 uart: tx-data-bits: "1"
130318-130345 uart: tx-data-bits: "1"
130344-130371 uart: tx-data-bits: "1"
130370-130397 uart: tx-data-bits: "0"
130188-130397 uart: tx-data: "123"
130396-130423 uart: tx-parity-ok: "Stop bit" "Stop" "T"
130681-130708 uart: tx-start: "Start bit" "Start" "S"
130707-130734 uart: tx-data-bits: "0"
130733-130760 uart: tx-data-bits: "0"
130759-130786 uart: tx-data-bits: "1"
130785-130812 uart: tx-data-bits: "1"
130811-130838 uart: tx-data-bits: "1"
130837-130864 uart: tx-data-bits: "1"
130863-130890 uart: tx-data-bits: "1"
130889-130916 uart: tx-data-bits: "0"
130707-130916 uart: tx-data: "124"
130915-130942 uart: tx-parity-ok: "Stop bit" "Stop" "T"
131197-131224 uart: tx-start: "Start bit" "Start" "S"
131223-131250 uart: tx-data-bits: "1"
131249-131276 uart: tx-data-bits: "0"
131275-131302 uart: tx-data-bits: "1"
131301-131328 uart: tx-data-bits: "1"
131327-131354 uart: tx-data-bits: "1"
131353-131380 uart: tx-data-bits: "1"
131379-131406 uart: tx-data-bits: "1"
131405-131432 uart: tx-data-bits: "0"
131223-131432 uart: tx-data: "125"
131431-131458 uart: tx-parity-ok: "Stop bit" "Stop" "T"
131716-131743 uart: tx-start: "Start bit" "Start" "S"
131742-131769 uart: tx-data-bits: "0"
131768-131795 uart: tx-data-bits: "1"
131794-131821 uart: tx-data-bits: "1"
131820-131847 uart: tx-data-bits: "1"
131846-131873 uart: tx-data-bits: "1"
131872-131899 uart: tx-data-bits: "1"
131898-131925 uart: tx-data-bits: "1"
131924-131951 uart: tx-data-bits: "0"
131742-131951 uart: tx-data: "126"
131950-131977 uart: tx-parity-ok: "Stop bit" "Stop" "T"
132232-132259 uart: tx-start: "Start bit" "Start" "S"
132258-132285 uart: tx-data-bits: "1"
132284-132311 uart: tx-data-bits: "1"
132310-132337 uart: tx-data-bits: "1"
132336-132363 uart: tx-data-bits: "1"
132362-132389 uart: tx-data-bits: "1"
132388-132415 uart: tx-data-bits: "1"
132414-132441 uart: tx-data-bits: "1"
132440-132467 uart: tx-data-bits: "0"
132258-132467 uart: tx-data: "127"
124485-132467 uart: tx-packet: "112 113 114 115 116 117 118 119 120 121 122 123 124 125 126 127"
132466-132493 uart: tx-parity-ok: "Stop bit" "Stop" "T"
132749-132776 uart: tx-start: "Start bit" "Start" "S"
132775-132802 uart: tx-data-bits: "0"
132801-132828 uart: tx-data-bits: "0"
132827-132854 uart: tx-data-bits: "0"
132853-132880 uart: tx-data-bits: "0"
132879-132906 uart: tx-data-bits: "0"
132905-132932 uart: tx-data-bits: "0"
132931-132958 uart: tx-data-bits: "0"
132957-132984 uart: tx-data-bits: "1"
132775-132984 uart: tx-data: "128"
132983-133010 uart: tx-parity-ok: "Stop bit" "Stop" "T"
133263-133290 uart: tx-start: "Start bit" "Start" "S"
133289-133316 uart: tx-data-bits: "1"
133315-133342 uart: tx-data-bits: "0"
133341-133368 uart: tx-data-bits: "0"
133367-133394 uart: tx-data-bits: "0"
133393-133420 uart: tx-data-bits: "0"
133419-133446 uart: tx-data-bits: "0"
133445-133472 uart: tx-data-bits: "0"
133471-133498 uart: tx-data-bits: "1"
133289-133498 uart: tx-data: "129"
133497-133524 uart: tx-parity-ok: "Stop bit" "Stop" "T"
133780-133807 uart: tx-start: "Start bit" "Start" "S"
133806-133833 uart: tx-data-bits: "0"
133832-133859 uart: tx-data-bits: "1"
133858-133885 uart: tx-data-bits: "0"
133884-133911 uart: tx-data-bits: "0"
133910-133937 uart: tx-data-bits: "0"
133936-133963 uart: tx-data-bits: "0"
133962-133989 uart: tx-data-bits: "0"
133988-134015 uart: tx-data-bits: "1"
133806-134015 uart: tx-data: "130"
134014-134041 uart: tx-parity-ok: "Stop bit" "Stop" "T"
134297-134324 uart: tx-start: "Start bit" "Start" "S"
134323-134350 uart: tx-data-bits: "1"
134349-134376 uart: tx-data-bits: "1"
134375-134402 uart: tx-data-bits: "0"
134401-134428 uart: tx-data-bits: "0"
134427-134454 uart: tx-data-bits: "0"
134453-134480 uart: tx-data-bits: "0"
134479-134506 uart: tx-data-bits: "0"
134505-134532 uart: tx-data-bits: "1"
134323-134532 uart: tx-data: "131"
134531-134558 uart: tx-parity-ok: "Stop bit" "Stop" "T"
134813-134840 uart: tx-start: "Start bit" "Start" "S"
134839-134866 uart: tx-data-bits: "0"
134865-134892 uart: tx-data-bits: "0"
134891-134918 uart: tx-data-bits: "1"
134917-134944 uart: tx-data-bits: "0"
134943-134970 uart: tx-data-bits: "0"
134969-134996 uart: tx-data-bits: "0"
134995-135022 uart: tx-data-bits: "0"
135021-135048 uart: tx-data-bits: "1"
134839-135048 uart: tx-data: "132"
135047-135074 uart: tx-parity-ok: "Stop bit" "Stop" "T"
135330-135357 uart: tx-start: "Start bit" "Start" "S"
135356-135383 uart: tx-data-bits: "1"
135382-135409 uart: tx-data-bits: "0"
135408-135435 uart: tx-data-bits: "1"
135434-135461 uart: tx-data-bits: "0"
135460-135487 uart: tx-data-bits: "0"
135486-135513 uart: tx-data-bits: "0"
135512-135539 uart: tx-data-bits: "0"
135538-135565 uart: tx-data-bits: "1"
135356-135565 uart: tx-data: "133"
135564-135591 uart: tx-parity-ok: "Stop bit" "Stop" "T"
135848-135875 uart: tx-start: "Start bit" "Start" "S"
135874-135901 uart: tx-data-bits: "0"
135900-135927 uart: tx-data-bits: "1"
135926-135953 uart: tx-data-bits: "1"
135952-135979 uart: tx-data-bits: "0"
135978-136005 uart: tx-data-bits: "0"
136004-136031 uart: tx-data-bits: "0"
136030-136057 uart: tx-data-bits: "0"
136056-136083 uart: tx-data-bits: "1"
135874-136083 uart: tx-data: "134"
136082-136109 uart: tx-parity-ok: "Stop bit" "Stop" "T"
136365-136392 uart: tx-start: "Start bit" "Start" "S"
136391-136418 uart: tx-data-bits: "1"
136417-136444 uart: tx-data-bits: "1"
136443-136470 uart: tx-data-bits: "1"
136469-136496 uart: tx-data-bits: "0"
136495-136522 uart: tx-data-bits: "0"
136521-136548 uart: tx-data-bits: "0"
136547-136574 uart: tx-data-bits: "0"
136573-136600 uart: tx-data-bits: "1"
136391-136600 uart: tx-data: "135"
136599-136626 uart: tx-parity-ok: "Stop bit" "Stop" "T"
136882-136909 uart: tx-start: "Start bit" "Start" "S"
136908-136935 uart: tx-data-bits: "0"
136934-136961 uart: tx-data-bits: "0"
136960-136987 uart: tx-data-bits: "0"
136986-137013 uart: tx-data-bits: "1"
137012-137039 uart: tx-data-bits: "0"
137038-137065 uart: tx-data-bits: "0"
137064-137091 uart: tx-data-bits: "0"
137090-137117 uart: tx-data-bits: "1"
136908-137117 uart: tx-data: "136"
137116-137143 uart: tx-parity-ok: "Stop bit" "Stop" "T"
137398-137425 uart: tx-start: "Start bit" "Start" "S"
137424-137451 uart: tx-data-bits: "1"
137450-137477 uart: tx-data-bits: "0"
137476-137503 uart: tx-data-bits: "0"
137502-137529 uart: tx-data-bits: "1"
137528-137555 uart: tx-data-bits: "0"
137554-137581 uart: tx-data-bits: "0"
137580-137607 uart: tx-data-bits: "0"
137606-137633 uart: tx-data-bits: "1"
137424-137633 uart: tx-data: "137"
137632-137659 uart: tx-parity-ok: "Stop bit" "Stop" "T"
137917-137944 uart: tx-start: "Start bit" "Start" "S"
137943-137970 uart: tx-data-bits: "0"
137969-137996 uart: tx-data-bits: "1"
137995-138022 uart: tx-data-bits: "0"
138021-138048 uart: tx-data-bits: "1"
138047-138074 uart: tx-data-bits: "0"
138073-138100 uart: tx-data-bits: "0"
138099-138126 uart: tx-data-bits: "0"
138125-138152 uart: tx-data-bits: "1"
137943-138152 uart: tx-data: "138"
138151-138178 uart: tx-parity-ok: "Stop bit" "Stop" "T"
138435-138462 uart: tx-start: "Start bit" "Start" "S"
138461-138488 uart: tx-data-bits: "1"
138487-138514 uart: tx-data-bits: "1"
138513-138540 uart: tx-data-bits: "0"
138539-138566 uart: tx-data-bits: "1"
138565-138592 uart: tx-data-bits: "0"
138591-138618 uart: tx-data-bits: "0"
138617-138644 uart: tx-data-bits: "0"
138643-138670 uart: tx-data-bits: "1"
138461-138670 uart: tx-data: "139"
138669-138696 uart: tx-parity-ok: "Stop bit" "Stop" "T"
138954-138981 uart: tx-start: "Start bit" "Start" "S"
138980-139007 uart: tx-data-bits: "0"
139006-139033 uart: tx-data-bits: "0"
139032-139059 uart: tx-data-bits: "1"
139058-139085 uart: tx-data-bits: "1"
139084-139111 uart: tx-data-bits: "0"
139110-139137 uart: tx-data-bits: "0"
139136-139163 uart: tx-data-bits: "0"
139162-139189 uart: tx-data-bits: "1"
138980-139189 uart: tx-data: "140"
139188-139215 uart: tx-parity-ok: "Stop bit" "Stop" "T"
139470-139497 uart: tx-start: "Start bit" "Start" "S"
139496-139523 uart: tx-data-bits: "1"
139522-139549 uart: tx-data-bits: "0"
139548-139575 uart: tx-data-bits: "1"
139574-139601 uart: tx-data-bits: "1"
139600-139627 uart: tx-data-bits: "0"
139626-139653 uart: tx-data-bits: "0"
139652-139679 uart: tx-data-bits: "0"
139678-139705 uart: tx-data-bits: "1"
139496-139705 uart: tx-data: "141"
139704-139731 uart: tx-parity-ok: "Stop bit" "Stop" "T"
139989-140016 uart: tx-start: "Start bit" "Start" "S"
140015-140042 uart: tx-data-bits: "0"
140041-140068 uart: tx-data-bits: "1"
140067-140094 uart: tx-data-bits: "1"
140093-140120 uart: tx-data-bits: "1"
140119-140146 uart: tx-data-bits: "0"
140145-140172 uart: tx-data-bits: "0"
140171-140198 uart: tx-data-bits: "0"
140197-140224 uart: tx-data-bits: "1"
140015-140224 uart: tx-data: "142"
140223-140250 uart: tx-parity-ok: "Stop bit" "Stop" "T"
140506-140533 uart: tx-start: "Start bit" "Start" "S"
140532-140559 uart: tx-data-bits: "1"
140558-140585 uart: tx-data-bits: "1"
140584-140611 uart: tx-data-bits: "1"
140610-140637 uart: tx-data-bits: "1"
140636-140663 uart: tx-data-bits: "0"
140662-140689 uart: tx-data-bits: "0"
140688-140715 uart: tx-data-bits: "0"
140714-140741 uart: tx-data-bits: "1"
140532-140741 uart: tx-data: "143"
132775-140741 uart: tx-packet: "128 129 130 131 132 133 134 135 136 137 138 139 140 141 142 143"
140740-140767 uart: tx-parity-ok: "Stop bit" "Stop" "T"
141022-141049 uart: tx-start: "Start bit" "Start" "S"
141048-141075 uart: tx-data-bits: "0"
141074-141101 uart: tx-data-bits: "0"
141100-141127 uart: tx-data-bits: "0"
141126-141153 uart: tx-data-bits: "0"
141152-141179 uart: tx-data-bits: "1"
141178-141205 uart: tx-data-bits: "0"
141204-141231 uart: tx-data-bits: "0"
141230-141257 uart: tx-data-bits: "1"
141048-141257 uart: tx-data: "144"
141256-141283 uart: tx-parity-ok: "Stop bit" "Stop" "T"
141539-141566 uart: tx-start: "Start bit" "Start" "S"
141565-141592 uart: tx-data-bits: "1"
141591-141618 uart: tx-data-bits: "0"
141617-141644 uart: tx-data-bits: "0"
141643-141670 uart: tx-data-bits: "0"
141669-141696 uart: tx-data-bits: "1"
141695-141722 uart: tx-data-bits: "0"
141721-141748 uart: tx-data-bits: "0"
141747-141774 uart: tx-data-bits: "1"
141565-141774 uart: tx-data: "145"
141773-141800 uart: tx-parity-ok: "Stop bit" "Stop" "T"
142057-142084 uart: tx-start: "Start bit" "Start" "S"
142083-142110 uart: tx-data-bits: "0"
142109-142136 uart: tx-data-bits: "1"
142135-142162 uart: tx-data-bits: "0"
142161-142188 uart: tx-data-bits: "0"
142187-142214 uart: tx-data-bits: "1"
142213-142240 uart: tx-data-bits: "0"
142239-142266 uart: tx-data-bits: "0"
142265-142292 uart: tx-data-bits: "1"
142083-142292 uart: tx-data: "146"
142291-142318 uart: tx-parity-ok: "Stop bit" "Stop" "T"
142576-142603 uart: tx-start: "Start bit" "Start" "S"
142602-142629 uart: tx-data-bits: "1"
142628-142655 uart: tx-data-bits: "1"
142654-142681 uart: tx-data-bits: "0"
142680-142707 uart: tx-data-bits: "0"
142706-142733 uart: tx-data-bits: "1"
142732-142759 uart: tx-data-bits: "0"
142758-142785 uart: tx-data-bits: "0"
142784-142811 uart: tx-data-bits: "1"
142602-142811 uart: tx-data: "147"
142810-142837 uart: tx-parity-ok: "Stop bit" "Stop" "T"
143095-143122 uart: tx-start: "Start bit" "Start" "S"
143121-143148 uart: tx-data-bits: "0"
143147-143174 uart: tx-data-bits: "0"
143173-143200 uart: tx-data-bits: "1"
143199-143226 uart: tx-data-bits: "0"
143225-143252 uart: tx-data-bits: "1"
143251-143278 uart: tx-data-bits: "0"
143277-143304 uart: tx-data-bits: "0"
143303-143330 uart: tx-data-bits: "1"
143121-143330 uart: tx-data: "148"
143329-143356 uart: tx-parity-ok: "Stop bit" "Stop" "T"
143613-143640 uart: tx-start: "Start bit" "Start" "S"
143639-143666 uart: tx-data-bits: "1"
143665-143692 uart: tx-data-bits: "0"
143691-143718 uart: tx-data-bits: "1"
143717-143744 uart: tx-data-bits: "0"
143743-143770 uart: tx-data-bits: "1"
143769-143796 uart: tx-data-bits: "0"
143795-143822 uart: tx-data-bits: "0"
143821-143848 uart: tx-data-bits: "1"
143639-143848 uart: tx-data: "149"
143847-143874 uart: tx-parity-ok: "Stop bit" "Stop" "T"
144134-144161 uart: tx-start: "Start bit" "Start" "S"
144160-144187 uart: tx-data-bits: "0"
144186-144213 uart: tx-data-bits: "1"
144212-144239 uart: tx-data-bits: "1"
144238-144265 uart: tx-data-bits: "0"
144264-144291 uart: tx-data-bits: "1"
144290-144317 uart: tx-data-bits: "0"
144316-144343 uart: tx-data-bits: "0"
144342-144369 uart: tx-data-bits: "1"
144160-144369 uart: tx-data: "150"
144368-144395 uart: tx-parity-ok: "Stop bit" "Stop" "T"
144652-144679 uart: tx-start: "Start bit" "Start" "S"
144678-144705 uart: tx-data-bits: "1"
144704-144731 uart: tx-data-bits: "1"
144730-144757 uart: tx-data-bits: "1"
144756-144783 uart: tx-data-bits: "0"
144782-144809 uart: tx-data-bits: "1"
144808-144835 uart: tx-data-bits: "0"
144834-144861 uart: tx-data-bits: "0"
144860-144887 uart: tx-data-bits: "1"
144678-144887 uart: tx-data: "151"
144886-144913 uart: tx-parity-ok: "Stop bit" "Stop" "T"
145171-145198 uart: tx-start: "Start bit" "Start" "S"
145197-145224 uart: tx-data-bits: "0"
145223-145250 uart: tx-data-bits: "0"
145249-145276 uart: tx-data-bits: "0"
145275-145302 uart: tx-data-bits: "1"
145301-145328 uart: tx-data-bits: "1"
145327-145354 uart: tx-data-bits: "0"
145353-145380 uart: tx-data-bits: "0"
145379-145406 uart: tx-data-bits: "1"
145197-145406 uart: tx-data: "152"
145405-145432 uart: tx-parity-ok: "Stop bit" "Stop" "T"
145687-145714 uart: tx-start: "Start bit" "Start" "S"
145713-145740 uart: tx-data-bits: "1"
145739-145766 uart: tx-data-bits: "0"
145765-145792 uart: tx-data-bits: "0"
145791-145818 uart: tx-data-bits: "1"
145817-145844 uart: tx-data-bits: "1"
145843-145870 uart: tx-data-bits: "0"
145869-145896 uart: tx-data-bits: "0"
145895-145922 uart: tx-data-bits: "1"
145713-145922 uart: tx-data: "153"
145921-145948 uart: tx-parity-ok: "Stop bit" "Stop" "T"
146206-146233 uart: tx-start: "Start bit" "Start" "S"
146232-146259 uart: tx-data-bits: "0"
146258-146285 uart: tx-data-bits: "1"
146284-146311 uart: tx-data-bits: "0"
146310-146337 uart: tx-data-bits: "1"
146336-146363 uart: tx-data-bits: "1"
146362-146389 uart: tx-data-bits: "0"
146388-146415 uart: tx-data-bits: "0"
146414-146441 uart: tx-data-bits: "1"
146232-146441 uart: tx-data: "154"
146440-146467 uart: tx-parity-ok: "Stop bit" "Stop" "T"
146725-146752 uart: tx-start: "Start bit" "Start" "S"
146751-146778 uart: tx-data-bits: "1"
146777-146804 uart: tx-data-bits: "1"
146803-146830 uart: tx-data-bits: "0"
146829-146856 uart: tx-data-bits: "1"
146855-146882 uart: tx-data-bits: "1"
146881-146908 uart: tx-data-bits: "0"
146907-146934 uart: tx-data-bits: "0"
146933-146960 uart: tx-data-bits: "1"
146751-146960 uart: tx-data: "155"
146959-146986 uart: tx-parity-ok: "Stop bit" "Stop" "T"
147243-147270 uart: tx-start: "Start bit" "Start" "S"
147269-147296 uart: tx-data-bits: "0"
147295-147322 uart: tx-data-bits: "0"
147321-147348 uart: tx-data-bits: "1"
147347-147374 uart: tx-data-bits: "1"
147373-147400 uart: tx-data-bits: "1"
147399-147426 uart: tx-data-bits: "0"
147425-147452 uart: tx-data-bits: "0"
147451-147478 uart: tx-data-bits: "1"
147269-147478 uart: tx-data: "156"
147477-147504 uart: tx-parity-ok: "Stop bit" "Stop" "T"
147760-147787 uart: tx-start: "Start bit" "Start" "S"
147786-147813 uart: tx-data-bits: "1"
147812-147839 uart: tx-data-bits: "0"
147838-147865 uart: tx-data-bits: "1"
147864-147891 uart: tx-data-bits: "1"
147890-147917 uart: tx-data-bits: "1"
147916-147943 uart: tx-data-bits: "0"
147942-147969 uart: tx-data-bits: "0"
147968-147995 uart: tx-data-bits: "1"
147786-147995 uart: tx-data: "157"
147994-148021 uart: tx-parity-ok: "Stop bit" "Stop" "T"
148278-148305 uart: tx-start: "Start bit" "Start" "S"
148304-148331 uart: tx-data-bits: "0"
148330-148357 uart: tx-data-bits: "1"
148356-148383 uart: tx-data-bits: "1"
148382-148409 uart: tx-data-bits: "1"
148408-148435 uart: tx-data-bits: "1"
148434-148461 uart: tx-data-bits: "0"
148460-148487 uart: tx-data-bits: "0"
148486-148513 uart: tx-data-bits: "1"
148304-148513 uart: tx-data: "158"
148512-148539 uart: tx-parity-ok: "Stop bit" "Stop" "T"
148795-148822 uart: tx-start: "Start bit" "Start" "S"
148821-148848 uart: tx-data-bits: "1"
148847-148874 uart: tx-data-bits: "1"
148873-148900 uart: tx-data-bits: "1"
148899-148926 uart: tx-data-bits: "1"
148925-148952 uart: tx-data-bits: "1"
148951-148978 uart: tx-data-bits: "0"
148977-149004 uart: tx-data-bits: "0"
149003-149030 uart: tx-data-bits: "1"
148821-149030 uart: tx-data: "159"
141048-149030 uart: tx-packet: "144 145 146 147 148 149 150 151 152 153 154 155 156 157 158 159"
149029-149056 uart: tx-parity-ok: "Stop bit" "Stop" "T"
149312-149339 uart: tx-start: "Start bit" "Start" "S"
149338-149365 uart: tx-data-bits: "0"
149364-149391 uart: tx-data-bits: "0"
149390-149417 uart: tx-data-bits: "0"
149416-149443 uart: tx-data-bits: "0"
149442-149469 uart: tx-data-bits: "0"
149468-149495 uart: tx-data-bits: "1"
149494-149521 uart: tx-data-bits: "0"
149520-149547 uart: tx-data-bits: "1"
149338-149547 uart: tx-data: "160"
149546-149573 uart: tx-parity-ok: "Stop bit" "Stop" "T"
149828-149855 uart: tx-start: "Start bit" "Start" "S"
149854-149881 uart: tx-data-bits: "1"
149880-149907 uart: tx-data-bits: "0"
149906-149933 uart: tx-data-bits: "0"
149932-149959 uart: tx-data-bits: "0"
149958-149985 uart: tx-data-bits: "0"
149984-150011 uart: tx-data-bits: "1"
150010-150037 uart: tx-data-bits: "0"
150036-150063 uart: tx-data-bits: "1"
149854-150063 uart: tx-data: "161"
150062-150089 uart: tx-parity-ok: "Stop bit" "Stop" "T"
150347-150374 uart: tx-start: "Start bit" "Start" "S"
150373-150400 uart: tx-data-bits: "0"
150399-150426 uart: tx-data-bits: "1"
150425-150452 uart: tx-data-bits: "0"
150451-150478 uart: tx-data-bits: "0"
150477-150504 uart: tx-data-bits: "0"
150503-150530 uart: tx-data-bits: "1"
150529-150556 uart: tx-data-bits: "0"
150555-150582 uart: tx-data-bits: "1"
150373-150582 uart: tx-data: "162"
150581-150608 uart: tx-parity-ok: "Stop bit" "Stop" "T"
150865-150892 uart: tx-start: "Start bit" "Start" "S"
150891-150918 uart: tx-data-bits: "1"
150917-150944 uart: tx-data-bits: "1"
150943-150970 uart: tx-data-bits: "0"
150969-150996 uart: tx-data-bits: "0"
150995-151022 uart: tx-data-bits: "0"
151021-151048 uart: tx-data-bits: "1"
151047-151074 uart: tx-data-bits: "0"
151073-151100 uart: tx-data-bits: "1"
150891-151100 uart: tx-data: "163"
151099-151126 uart: tx-parity-ok: "Stop bit" "Stop" "T"
151384-151411 uart: tx-start: "Start bit" "Start" "S"
151410-151437 uart: tx-data-bits: "0"
151436-151463 uart: tx-data-bits: "0"
151462-151489 uart: tx-data-bits: "1"
151488-151515 uart: tx-data-bits: "0"
151514-151541 uart: tx-data-bits: "0"
151540-151567 uart: tx-data-bits: "1"
151566-151593 uart: tx-data-bits: "0"
151592-151619 uart: tx-data-bits: "1"
151410-151619 uart: tx-data: "164"
151618-151645 uart: tx-parity-ok: "Stop bit" "Stop" "T"
151903-151930 uart: tx-start: "Start bit" "Start" "S"
151929-151956 uart: tx-data-bits: "1"
151955-151982 uart: tx-data-bits: "0"
151981-152008 uart: tx-data-bits: "1"
152007-152034 uart: tx-data-bits: "0"
152033-152060 uart: tx-data-bits: "0"
152059-152086 uart: tx-data-bits: "1"
152085-152112 uart: tx-data-bits: "0"
152111-152138 uart: tx-data-bits: "1"
151929-152138 uart: tx-data: "165"
152137-152164 uart: tx-parity-ok: "Stop bit" "Stop" "T"
152423-152450 uart: tx-start: "Start bit" "Start" "S"
152449-152476 uart: tx-data-bits: "0"
152475-152502 uart: tx-data-bits: "1"
152501-152528 uart: tx-data-bits: "1"
152527-152554 uart: tx-data-bits: "0"
152553-152580 uart: tx-data-bits: "0"
152579-152606 uart: tx-data-bits: "1"
152605-152632 uart: tx-data-bits: "0"
152631-152658 uart: tx-data-bits: "1"
152449-152658 uart: tx-data: "166"
152657-152684 uart: tx-parity-ok: "Stop bit" "Stop" "T"
152942-152969 uart: tx-start: "Start bit" "Start" "S"
152968-152995 uart: tx-data-bits: "1"
152994-153021 uart: tx-data-bits: "1"
153020-153047 uart: tx-data-bits: "1"
153046-153073 uart: tx-data-bits: "0"
153072-153099 uart: tx-data-bits: "0"
153098-153125 uart: tx-data-bits: "1"
153124-153151 uart: tx-data-bits: "0"
153150-153177 uart: tx-data-bits: "1"
152968-153177 uart: tx-data: "167"
153176-153203 uart: tx-parity-ok: "Stop bit" "Stop" "T"
153460-153487 uart: tx-start: "Start bit" "Start" "S"
153486-153513 uart: tx-data-bits: "0"
153512-153539 uart: tx-data-bits: "0"
153538-153565 uart: tx-data-bits: "0"
153564-153591 uart: tx-data-bits: "1"
153590-153617 uart: tx-data-bits: "0"
153616-153643 uart: tx-data-bits: "1"
153642-153669 uart: tx-data-bits: "0"
153668-153695 uart: tx-data-bits: "1"
153486-153695 uart: tx-data: "168"
153694-153721 uart: tx-parity-ok: "Stop bit" "Stop" "T"
153979-154006 uart: tx-start: "Start bit" "Start" "S"
154005-154032 uart: tx-data-bits: "1"
154031-154058 uart: tx-data-bits: "0"
154057-154084 uart: tx-data-bits: "0"
154083-154110 uart: tx-data-bits: "1"
154109-154136 uart: tx-data-bits: "0"
154135-154162 uart: tx-data-bits: "1"
154161-154188 uart: tx-data-bits: "0"
154187-154214 uart: tx-data-bits: "1"
154005-154214 uart: tx-data: "169"
154213-154240 uart: tx-parity-ok: "Stop bit" "Stop" "T"
154499-154526 uart: tx-start: "Start bit" "Start" "S"
154525-154552 uart: tx-data-bits: "0"
154551-154578 uart: tx-data-bits: "1"
154577-154604 uart: tx-data-bits: "0"
154603-154630 uart: tx-data-bits: "1"
154629-154656 uart: tx-data-bits: "0"
154655-154682 uart: tx-data-bits: "1"
154681-154708 uart: tx-data-bits: "0"
154707-154734 uart: tx-data-bits: "1"
154525-154734 uart: tx-data: "170"
154733-154760 uart: tx-parity-ok: "Stop bit" "Stop" "T"
155020-155047 uart: tx-start: "Start bit" "Start" "S"
155046-155073 uart: tx-data-bits: "1"
155072-155099 uart: tx-data-bits: "1"
155098-155125 uart: tx-data-bits: "0"
155124-155151 uart: tx-data-bits: "1"
155150-155177 uart: tx-data-bits: "0"
155176-155203 uart: tx-data-bits: "1"
155202-155229 uart: tx-data-bits: "0"
155228-155255 uart: tx-data-bits: "1"
155046-155255 uart: tx-data: "171"
155254-155281 uart: tx-parity-ok: "Stop bit" "Stop" "T"
155541-155568 uart: tx-start: "Start bit" "Start" "S"
155567-155594 uart: tx-data-bits: "0"
155593-155620 uart: tx-data-bits: "0"
155619-155646 uart: tx-data-bits: "1"
155645-155672 uart: tx-data-bits: "1"
155671-155698 uart: tx-data-bits: "0"
155697-155724 uart: tx-data-bits: "1"
155723-155750 uart: tx-data-bits: "0"
155749-155776 uart: tx-data-bits: "1"
155567-155776 uart: tx-data: "172"
155775-155802 uart: tx-parity-ok: "Stop bit" "Stop" "T"
156059-156086 uart: tx-start: "Start bit" "Start" "S"
156085-156112 uart: tx-data-bits: "1"
156111-156138 uart: tx-data-bits: "0"
156137-156164 uart: tx-data-bits: "1"
156163-156190 uart: tx-data-bits: "1"
156189-156216 uart: tx-data-bits: "0"
156215-156242 uart: tx-data-bits: "1"
156241-156268 uart: tx-data-bits: "0"
156267-156294 uart: tx-data-bits: "1"
156085-156294 uart: tx-data: "173"
156293-156320 uart: tx-parity-ok: "Stop bit" "Stop" "T"
156580-156607 uart: tx-start: "Start bit" "Start" "S"
156606-156633 uart: tx-data-bits: "0"
156632-156659 uart: tx-data-bits: "1"
156658-156685 uart: tx-data-bits: "1"
156684-156711 uart: tx-data-bits: "1"
156710-156737 uart: tx-data-bits: "0"
156736-156763 uart: tx-data-bits: "1"
156762-156789 uart: tx-data-bits: "0"
156788-156815 uart: tx-data-bits: "1"
156606-156815 uart: tx-data: "174"
156814-156841 uart: tx-parity-ok: "Stop bit" "Stop" "T"
157098-157125 uart: tx-start: "Start bit" "Start" "S"
157124-157151 uart: tx-data-bits: "1"
157150-157177 uart: tx-data-bits: "1"
157176-157203 uart: tx-data-bits: "1"
157202-157229 uart: tx-data-bits: "1"
157228-157255 uart: tx-data-bits: "0"
157254-157281 uart: tx-data-bits: "1"
157280-157307 uart: tx-data-bits: "0"
157306-157333 uart: tx-data-bits: "1"
157124-157333 uart: tx-data: "175"
149338-157333 uart: tx-packet: "160 161 162 163 164 165 166 167 168 169 170 171 172 173 174 175"
157332-157359 uart: tx-parity-ok: "Stop bit" "Stop" "T"
157617-157644 uart: tx-start: "Start bit" "Start" "S"
157643-157670 uart: tx-data-bits: "0"
157669-157696 uart: tx-data-bits: "0"
157695-157722 uart: tx-data-bits: "0"
157721-157748 uart: tx-data-bits: "0"
157747-157774 uart: tx-data-bits: "1"
157773-157800 uart: tx-data-bits: "1"
157799-157826 uart: tx-data-bits: "0"
157825-157852 uart: tx-data-bits: "1"
157643-157852 uart: tx-data: "176"
157851-157878 uart: tx-parity-ok: "Stop bit" "Stop" "T"
158134-158161 uart: tx-start: "Start bit" "Start" "S"
158160-158187 uart: tx-data-bits: "1"
158186-158213 uart: tx-data-bits: "0"
158212-158239 uart: tx-data-bits: "0"
158238-158265 uart: tx-data-bits: "0"
158264-158291 uart: tx-data-bits: "1"
158290-158317 uart: tx-data-bits: "1"
158316-158343 uart: tx-data-bits: "0"
158342-158369 uart: tx-data-bits: "1"
158160-158369 uart: tx-data: "177"
158368-158395 uart: tx-parity-ok: "Stop bit" "Stop" "T"
158652-158679 uart: tx-start: "Start bit" "Start" "S"
158678-158705 uart: tx-data-bits: "0"
158704-158731 uart: tx-data-bits: "1"
158730-158757 uart: tx-data-bits: "0"
158756-158783 uart: tx-data-bits: "0"
158782-158809 uart: tx-data-bits: "1"
158808-158835 uart: tx-data-bits: "1"
158834-158861 uart: tx-data-bits: "0"
158860-158887 uart: tx-data-bits: "1"
158678-158887 uart: tx-data: "178"
158886-158913 uart: tx-parity-ok: "Stop bit" "Stop" "T"
159171-159198 uart: tx-start: "Start bit" "Start" "S"
159197-159224 uart: tx-data-bits: "1"
159223-159250 uart: tx-data-bits: "1"
159249-159276 uart: tx-data-bits: "0"
159275-159302 uart: tx-data-bits: "0"
159301-159328 uart: tx-data-bits: "1"
159327-159354 uart: tx-data-bits: "1"
159353-159380 uart: tx-data-bits: "0"
159379-159406 uart: tx-data-bits: "1"
159197-159406 uart: tx-data: "179"
159405-159432 uart: tx-parity-ok: "Stop bit" "Stop" "T"
159689-159716 uart: tx-start: "Start bit" "Start" "S"
159715-159742 uart: tx-data-bits: "0"
159741-159768 uart: tx-data-bits: "0"
159767-159794 uart: tx-data-bits: "1"
159793-159820 uart: tx-data-bits: "0"
159819-159846 uart: tx-data-bits: "1"
159845-159872 uart: tx-data-bits: "1"
159871-159898 uart: tx-data-bits: "0"
159897-159924 uart: tx-data-bits: "1"
159715-159924 uart: tx-data: "180"
159923-159950 uart: tx-parity-ok: "Stop bit" "Stop" "T"
160208-160235 uart: tx-start: "Start bit" "Start" "S"
160234-160261 uart: tx-data-bits: "1"
160260-160287 uart: tx-data-bits: "0"
160286-160313 uart: tx-data-bits: "1"
160312-160339 uart: tx-data-bits: "0"
160338-160365 uart: tx-data-bits: "1"
160364-160391 uart: tx-data-bits: "1"
160390-160417 uart: tx-data-bits: "0"
160416-160443 uart: tx-data-bits: "1"
160234-160443 uart: tx-data: "181"
160442-160469 uart: tx-parity-ok: "Stop bit" "Stop" "T"
160728-160755 uart: tx-start: "Start bit" "Start" "S"
160754-160781 uart: tx-data-bits: "0"
160780-160807 uart: tx-data-bits: "1"
160806-160833 uart: tx-data-bits: "1"
160832-160859 uart: tx-data-bits: "0"
160858-160885 uart: tx-data-bits: "1"
160884-160911 uart: tx-data-bits: "1"
160910-160937 uart: tx-data-bits: "0"
160936-160963 uart: tx-data-bits: "1"
160754-160963 uart: tx-data: "182"
160962-160989 uart: tx-parity-ok: "Stop bit" "Stop" "T"
161247-161274 uart: tx-start: "Start bit" "Start" "S"
161273-161300 uart: tx-data-bits: "1"
161299-161326 uart: tx-data-bits: "1"
161325-161352 uart: tx-data-bits: "1"
161351-161378 uart: tx-data-bits: "0"
161377-161404 uart: tx-data-bits: "1"
161403-161430 uart: tx-data-bits: "1"
161429-161456 uart: tx-data-bits: "0"
161455-161482 uart: tx-data-bits: "1"
161273-161482 uart: tx-data: "183"
161481-161508 uart: tx-parity-ok: "Stop bit" "Stop" "T"
161766-161793 uart: tx-start: "Start bit" "Start" "S"
161792-161819 uart: tx-data-bits: "0"
161818-161845 uart: tx-data-bits: "0"
161844-161871 uart: tx-data-bits: "0"
161870-161897 uart: tx-data-bits: "1"
161896-161923 uart: tx-data-bits: "1"
161922-161949 uart: tx-data-bits: "1"
161948-161975 uart: tx-data-bits: "0"
161974-162001 uart: tx-data-bits: "1"
161792-162001 uart: tx-data: "184"
162000-162027 uart: tx-parity-ok: "Stop bit" "Stop" "T"
162282-162309 uart: tx-start: "Start bit" "Start" "S"
162308-162335 uart: tx-data-bits: "1"
162334-162361 uart: tx-data-bits: "0"
162360-162387 uart: tx-data-bits: "0"
162386-162413 uart: tx-data-bits: "1"
162412-162439 uart: tx-data-bits: "1"
162438-162465 uart: tx-data-bits: "1"
162464-162491 uart: tx-data-bits: "0"
162490-162517 uart: tx-data-bits: "1"
162308-162517 uart: tx-data: "185"
162516-162543 uart: tx-parity-ok: "Stop bit" "Stop" "T"
162801-162828 uart: tx-start: "Start bit" "Start" "S"
162827-162854 uart: tx-data-bits: "0"
162853-162880 uart: tx-data-bits: "1"
162879-162906 uart: tx-data-bits: "0"
162905-162932 uart: tx-data-bits: "1"
162931-162958 uart: tx-data-bits: "1"
162957-162984 uart: tx-data-bits: "1"
162983-163010 uart: tx-data-bits: "0"
163009-163036 uart: tx-data-bits: "1"
162827-163036 uart: tx-data: "186"
163035-163062 uart: tx-parity-ok: "Stop bit" "Stop" "T"
163319-163346 uart: tx-start: "Start bit" "Start" "S"
163345-163372 uart: tx-data-bits: "1"
163371-163398 uart: tx-data-bits: "1"
163397-163424 uart: tx-data-bits: "0"
163423-163450 uart: tx-data-bits: "1"
163449-163476 uart: tx-data-bits: "1"
163475-163502 uart: tx-data-bits: "1"
163501-163528 uart: tx-data-bits: "0"
163527-163554 uart: tx-data-bits: "1"
163345-163554 uart: tx-data: "187"
163553-163580 uart: tx-parity-ok: "Stop bit" "Stop" "T"
163838-163865 uart: tx-start: "Start bit" "Start" "S"
163864-163891 uart: tx-data-bits: "0"
163890-163917 uart: tx-data-bits: "0"
163916-163943 uart: tx-data-bits: "1"
163942-163969 uart: tx-data-bits: "1"
163968-163995 uart: tx-data-bits: "1"
163994-164021 uart: tx-data-bits: "1"
164020-164047 uart: tx-data-bits: "0"
164046-164073 uart: tx-data-bits: "1"
163864-164073 uart: tx-data: "188"
164072-164099 uart: tx-parity-ok: "Stop bit" "Stop" "T"
164355-164382 uart: tx-start: "Start bit" "Start" "S"
164381-164408 uart: tx-data-bits: "1"
164407-164434 uart: tx-data-bits: "0"
164433-164460 uart: tx-data-bits: "1"
164459-164486 uart: tx-data-bits: "1"
164485-164512 uart: tx-data-bits: "1"
164511-164538 uart: tx-data-bits: "1"
164537-164564 uart: tx-data-bits: "0"
164563-164590 uart: tx-data-bits: "1"
164381-164590 uart: tx-data: "189"
164589-164616 uart: tx-parity-ok: "Stop bit" "Stop" "T"
164873-164900 uart: tx-start: "Start bit" "Start" "S"
164899-164926 uart: tx-data-bits: "0"
164925-164952 uart: tx-data-bits: "1"
164951-164978 uart: tx-data-bits: "1"
164977-165004 uart: tx-data-bits: "1"
165003-165030 uart: tx-data-bits: "1"
165029-165056 uart: tx-data-bits: "1"
165055-165082 uart: tx-data-bits: "0"
165081-165108 uart: tx-data-bits: "1"
164899-165108 uart: tx-data: "190"
165107-165134 uart: tx-parity-ok: "Stop bit" "Stop" "T"
165390-165417 uart: tx-start: "Start bit" "Start" "S"
165416-165443 uart: tx-data-bits: "1"
165442-165469 uart: tx-data-bits: "1"
165468-165495 uart: tx-data-bits: "1"
165494-165521 uart: tx-data-bits: "1"
165520-165547 uart: tx-data-bits: "1"
165546-165573 uart: tx-data-bits: "1"
165572-165599 uart: tx-data-bits: "0"
165598-165625 uart: tx-data-bits: "1"
165416-165625 uart: tx-data: "191"
157643-165625 uart: tx-packet: "176 177 178 179 180 181 182 183 184 185 186 187 188 189 190 191"
165624-165651 uart: tx-parity-ok: "Stop bit" "Stop" "T"
165906-165933 uart: tx-start: "Start bit" "Start" "S"
165932-165959 uart: tx-data-bits: "0"
165958-165985 uart: tx-data-bits: "0"
165984-166011 uart: tx-data-bits: "0"
166010-166037 uart: tx-data-bits: "0"
166036-166063 uart: tx-data-bits: "0"
166062-166089 uart: tx-data-bits: "0"
166088-166115 uart: tx-data-bits: "1"
166114-166141 uart: tx-data-bits: "1"
165932-166141 uart: tx-data: "192"
166140-166167 uart: tx-parity-ok: "Stop bit" "Stop" "T"
166421-166448 uart: tx-start: "Start bit" "Start" "S"
166447-166474 uart: tx-data-bits: "1"
166473-166500 uart: tx-data-bits: "0"
166499-166526 uart: tx-data-bits: "0"
166525-166552 uart: tx-data-bits: "0"
166551-166578 uart: tx-data-bits: "0"
166577-166604 uart: tx-data-bits: "0"
166603-166630 uart: tx-data-bits: "1"
166629-166656 uart: tx-data-bits: "1"
166447-166656 uart: tx-data: "193"
166655-166682 uart: tx-parity-ok: "Stop bit" "Stop" "T"
166937-166964 uart: tx-start: "Start bit" "Start" "S"
166963-166990 uart: tx-data-bits: "0"
166989-167016 uart: tx-data-bits: "1"
167015-167042 uart: tx-data-bits: "0"
167041-167068 uart: tx-data-bits: "0"
167067-167094 uart: tx-data-bits: "0"
167093-167120 uart: tx-data-bits: "0"
167119-167146 uart: tx-data-bits: "1"
167145-167172 uart: tx-data-bits: "1"
166963-167172 uart: tx-data: "194"
167171-167198 uart: tx-parity-ok: "Stop bit" "Stop" "T"
167454-167481 uart: tx-start: "Start bit" "Start" "S"
167480-167507 uart: tx-data-bits: "1"
167506-167533 uart: tx-data-bits: "1"
167532-167559 uart: tx-data-bits: "0"
167558-167585 uart: tx-data-bits: "0"
167584-167611 uart: tx-data-bits: "0"
167610-167637 uart: tx-data-bits: "0"
167636-167663 uart: tx-data-bits: "1"
167662-167689 uart: tx-data-bits: "1"
167480-167689 uart: tx-data: "195"
167688-167715 uart: tx-parity-ok: "Stop bit" "Stop" "T"
167971-167998 uart: tx-start: "Start bit" "Start" "S"
167997-168024 uart: tx-data-bits: "0"
168023-168050 uart: tx-data-bits: "0"
168049-168076 uart: tx-data-bits: "1"
168075-168102 uart: tx-data-bits: "0"
168101-168128 uart: tx-data-bits: "0"
168127-168154 uart: tx-data-bits: "0"
168153-168180 uart: tx-data-bits: "1"
168179-168206 uart: tx-data-bits: "1"
167997-168206 uart: tx-data: "196"
168205-168232 uart: tx-parity-ok: "Stop bit" "Stop" "T"
168487-168514 uart: tx-start: "Start bit" "Start" "S"
168513-168540 uart: tx-data-bits: "1"
168539-168566 uart: tx-data-bits: "0"
168565-168592 uart: tx-data-bits: "1"
168591-168618 uart: tx-data-bits: "0"
168617-168644 uart: tx-data-bits: "0"
168643-168670 uart: tx-data-bits: "0"
168669-168696 uart: tx-data-bits: "1"
168695-168722 uart: tx-data-bits: "1"
168513-168722 uart: tx-data: "197"
168721-168748 uart: tx-parity-ok: "Stop bit" "Stop" "T"
169006-169033 uart: tx-start: "Start bit" "Start" "S"
169032-169059 uart: tx-data-bits: "0"
169058-169085 uart: tx-data-bits: "1"
169084-169111 uart: tx-data-bits: "1"
169110-169137 uart: tx-data-bits: "0"
169136-169163 uart: tx-data-bits: "0"
169162-169189 uart: tx-data-bits: "0"
169188-169215 uart: tx-data-bits: "1"
169214-169241 uart: tx-data-bits: "1"
169032-169241 uart: tx-data: "198"
169240-169267 uart: tx-parity-ok: "Stop bit" "Stop" "T"
169522-169549 uart: tx-start: "Start bit" "Start" "S"
169548-169575 uart: tx-data-bits: "1"
169574-169601 uart: tx-data-bits: "1"
169600-169627 uart: tx-data-bits: "1"
169626-169653 uart: tx-data-bits: "0"
169652-169679 uart: tx-data-bits: "0"
169678-169705 uart: tx-data-bits: "0"
169704-169731 uart: tx-data-bits: "1"
169730-169757 uart: tx-data-bits: "1"
169548-169757 uart: tx-data: "199"
169756-169783 uart: tx-parity-ok: "Stop bit" "Stop" "T"
170039-170066 uart: tx-start: "Start bit" "Start" "S"
170065-170092 uart: tx-data-bits: "0"
170091-170118 uart: tx-data-bits: "0"
170117-170144 uart: tx-data-bits: "0"
170143-170170 uart: tx-data-bits: "1"
170169-170196 uart: tx-data-bits: "0"
170195-170222 uart: tx-data-bits: "0"
170221-170248 uart: tx-data-bits: "1"
170247-170274 uart: tx-data-bits: "1"
170065-170274 uart: tx-data: "200"
170273-170300 uart: tx-parity-ok: "Stop bit" "Stop" "T"
170556-170583 uart: tx-start: "Start bit" "Start" "S"
170582-170609 uart: tx-data-bits: "1"
170608-170635 uart: tx-data-bits: "0"
170634-170661 uart: tx-data-bits: "0"
170660-170687 uart: tx-data-bits: "1"
170686-170713 uart: tx-data-bits: "0"
170712-170739 uart: tx-data-bits: "0"
170738-170765 uart: tx-data-bits: "1"
170764-170791 uart: tx-data-bits: "1"
170582-170791 uart: tx-data: "201"
170790-170817 uart: tx-parity-ok: "Stop bit" "Stop" "T"
171074-171101 uart: tx-start: "Start bit" "Start" "S"
171100-171127 uart: tx-data-bits: "0"
171126-171153 uart: tx-data-bits: "1"
171152-171179 uart: tx-data-bits: "0"
171178-171205 uart: tx-data-bits: "1"
171204-171231 uart: tx-data-bits: "0"
171230-171257 uart: tx-data-bits: "0"
171256-171283 uart: tx-data-bits: "1"
171282-171309 uart: tx-data-bits: "1"
171100-171309 uart: tx-data: "202"
171308-171335 uart: tx-parity-ok: "Stop bit" "Stop" "T"
171593-171620 uart: tx-start: "Start bit" "Start" "S"
171619-171646 uart: tx-data-bits: "1"
171645-171672 uart: tx-data-bits: "1"
171671-171698 uart: tx-data-bits: "0"
171697-171724 uart: tx-data-bits: "1"
171723-171750 uart: tx-data-bits: "0"
171749-171776 uart: tx-data-bits: "0"
171775-171802 uart: tx-data-bits: "1"
171801-171828 uart: tx-data-bits: "1"
171619-171828 uart: tx-data: "203"
171827-171854 uart: tx-parity-ok: "Stop bit" "Stop" "T"
172111-172138 uart: tx-start: "Start bit" "Start" "S"
172137-172164 uart: tx-data-bits: "0"
172163-172190 uart: tx-data-bits: "0"
172189-172216 uart: tx-data-bits: "1"
172215-172242 uart: tx-data-bits: "1"
172241-172268 uart: tx-data-bits: "0"
172267-172294 uart: tx-data-bits: "0"
172293-172320 uart: tx-data-bits: "1"
172319-172346 uart: tx-data-bits: "1"
172137-172346 uart: tx-data: "204"
172345-172372 uart: tx-parity-ok: "Stop bit" "Stop" "T"
172628-172655 uart: tx-start: "Start bit" "Start" "S"
172654-172681 uart: tx-data-bits: "1"
172680-172707 uart: tx-data-bits: "0"
172706-172733 uart: tx-data-bits: "1"
172732-172759 uart: tx-data-bits: "1"
172758-172785 uart: tx-data-bits: "0"
172784-172811 uart: tx-data-bits: "0"
172810-172837 uart: tx-data-bits: "1"
172836-172863 uart: tx-data-bits: "1"
172654-172863 uart: tx-data: "205"
172862-172889 uart: tx-parity-ok: "Stop bit" "Stop" "T"
173146-173173 uart: tx-start: "Start bit" "Start" "S"
173172-173199 uart: tx-data-bits: "0"
173198-173225 uart: tx-data-bits: "1"
173224-173251 uart: tx-data-bits: "1"
173250-173277 uart: tx-data-bits: "1"
173276-173303 uart: tx-data-bits: "0"
173302-173329 uart: tx-data-bits: "0"
173328-173355 uart: tx-data-bits: "1"
173354-173381 uart: tx-data-bits: "1"
173172-173381 uart: tx-data: "206"
173380-173407 uart: tx-parity-ok: "Stop bit" "Stop" "T"
173663-173690 uart: tx-start: "Start bit" "Start" "S"
173689-173716 uart: tx-data-bits: "1"
173715-173742 uart: tx-data-bits: "1"
173741-173768 uart: tx-data-bits: "1"
173767-173794 uart: tx-data-bits: "1"
173793-173820 uart: tx-data-bits: "0"
173819-173846 uart: tx-data-bits: "0"
173845-173872 uart: tx-data-bits: "1"
173871-173898 uart: tx-data-bits: "1"
173689-173898 uart: tx-data: "207"
165932-173898 uart: tx-packet: "192 193 194 195 196 197 198 199 200 201 202 203 204 205 206 207"
173897-173924 uart: tx-parity-ok: "Stop bit" "Stop" "T"
174180-174207 uart: tx-start: "Start bit" "Start" "S"
174206-174233 uart: tx-data-bits: "0"
174232-174259 uart: tx-data-bits: "0"
174258-174285 uart: tx-data-bits: "0"
174284-174311 uart: tx-data-bits: "0"
174310-174337 uart: tx-data-bits: "1"
174336-174363 uart: tx-data-bits: "0"
174362-174389 uart: tx-data-bits: "1"
174388-174415 uart: tx-data-bits: "1"
174206-174415 uart: tx-data: "208"
174414-174441 uart: tx-parity-ok: "Stop bit" "Stop" "T"
174696-174723 uart: tx-start: "Start bit" "Start" "S"
174722-174749 uart: tx-data-bits: "1"
174748-174775 uart: tx-data-bits: "0"
174774-174801 uart: tx-data-bits: "0"
174800-174827 uart: tx-data-bits: "0"
174826-174853 uart: tx-data-bits: "1"
174852-174879 uart: tx-data-bits: "0"
174878-174905 uart: tx-data-bits: "1"
174904-174931 uart: tx-data-bits: "1"
174722-174931 uart: tx-data: "209"
174930-174957 uart: tx-parity-ok: "Stop bit" "Stop" "T"
175215-175242 uart: tx-start: "Start bit" "Start" "S"
175241-175268 uart: tx-data-bits: "0"
175267-175294 uart: tx-data-bits: "1"
175293-175320 uart: tx-data-bits: "0"
175319-175346 uart: tx-data-bits: "0"
175345-175372 uart: tx-data-bits: "1"
175371-175398 uart: tx-data-bits: "0"
175397-175424 uart: tx-data-bits: "1"
175423-175450 uart: tx-data-bits: "1"
175241-175450 uart: tx-data: "210"
175449-175476 uart: tx-parity-ok: "Stop bit" "Stop" "T"
175733-175760 uart: tx-start: "Start bit" "Start" "S"
175759-175786 uart: tx-data-bits: "1"
175785-175812 uart: tx-data-bits: "1"
175811-175838 uart: tx-data-bits: "0"
175837-175864 uart: tx-data-bits: "0"
175863-175890 uart: tx-data-bits: "1"
175889-175916 uart: tx-data-bits: "0"
175915-175942 uart: tx-data-bits: "1"
175941-175968 uart: tx-data-bits: "1"
175759-175968 uart: tx-data: "211"
175967-175994 uart: tx-parity-ok: "Stop bit" "Stop" "T"
176252-176279 uart: tx-start: "Start bit" "Start" "S"
176278-176305 uart: tx-data-bits: "0"
176304-176331 uart: tx-data-bits: "0"
176330-176357 uart: tx-data-bits: "1"
176356-176383 uart: tx-data-bits: "0"
176382-176409 uart: tx-data-bits: "1"
176408-176435 uart: tx-data-bits: "0"
176434-176461 uart: tx-data-bits: "1"
176460-176487 uart: tx-data-bits: "1"
176278-176487 uart: tx-data: "212"
176486-176513 uart: tx-parity-ok: "Stop bit" "Stop" "T"
176771-176798 uart: tx-start: "Start bit" "Start" "S"
176797-176824 uart: tx-data-bits: "1"
176823-176850 uart: tx-data-bits: "0"
176849-176876 uart: tx-data-bits: "1"
176875-176902 uart: tx-data-bits: "0"
176901-176928 uart: tx-data-bits: "1"
176927-176954 uart: tx-data-bits: "0"
176953-176980 uart: tx-data-bits: "1"
176979-177006 uart: tx-data-bits: "1"
176797-177006 uart: tx-data: "213"
177005-177032 uart: tx-parity-ok: "Stop bit" "Stop" "T"
177291-177318 uart: tx-start: "Start bit" "Start" "S"
177317-177344 uart: tx-data-bits: "0"
177343-177370 uart: tx-data-bits: "1"
177369-177396 uart: tx-data-bits: "1"
177395-177422 uart: tx-data-bits: "0"
177421-177448 uart: tx-data-bits: "1"
177447-177474 uart: tx-data-bits: "0"
177473-177500 uart: tx-data-bits: "1"
177499-177526 uart: tx-data-bits: "1"
177317-177526 uart: tx-data: "214"
177525-177552 uart: tx-parity-ok: "Stop bit" "Stop" "T"
177810-177837 uart: tx-start: "Start bit" "Start" "S"
177836-177863 uart: tx-data-bits: "1"
177862-177889 uart: tx-data-bits: "1"
177888-177915 uart: tx-data-bits: "1"
177914-177941 uart: tx-data-bits: "0"
177940-177967 uart: tx-data-bits: "1"
177966-177993 uart: tx-data-bits: "0"
177992-178019 uart: tx-data-bits: "1"
178018-178045 uart: tx-data-bits: "1"
177836-178045 uart: tx-data: "215"
178044-178071 uart: tx-parity-ok: "Stop bit" "Stop" "T"
178328-178355 uart: tx-start: "Start bit" "Start" "S"
178354-178381 uart: tx-data-bits: "0"
178380-178407 uart: tx-data-bits: "0"
178406-178433 uart: tx-data-bits: "0"
178432-178459 uart: tx-data-bits: "1"
178458-178485 uart: tx-data-bits: "1"
178484-178511 uart: tx-data-bits: "0"
178510-178537 uart: tx-data-bits: "1"
178536-178563 uart: tx-data-bits: "1"
178354-178563 uart: tx-data: "216"
178562-178589 uart: tx-parity-ok: "Stop bit" "Stop" "T"
178845-178872 uart: tx-start: "Start bit" "Start" "S"
178871-178898 uart: tx-data-bits: "1"
178897-178924 uart: tx-data-bits: "0"
178923-178950 uart: tx-data-bits: "0"
178949-178976 uart: tx-data-bits: "1"
178975-179002 uart: tx-data-bits: "1"
179001-179028 uart: tx-data-bits: "0"
179027-179054 uart: tx-data-bits: "1"
179053-179080 uart: tx-data-bits: "1"
178871-179080 uart: tx-data: "217"
179079-179106 uart: tx-parity-ok: "Stop bit" "Stop" "T"
179364-179391 uart: tx-start: "Start bit" "Start" "S"
179390-179417 uart: tx-data-bits: "0"
179416-179443 uart: tx-data-bits: "1"
179442-179469 uart: tx-data-bits: "0"
179468-179495 uart: tx-data-bits: "1"
179494-179521 uart: tx-data-bits: "1"
179520-179547 uart: tx-data-bits: "0"
179546-179573 uart: tx-data-bits: "1"
179572-179599 uart: tx-data-bits: "1"
179390-179599 uart: tx-data: "218"
179598-179625 uart: tx-parity-ok: "Stop bit" "Stop" "T"
179882-179909 uart: tx-start: "Start bit" "Start" "S"
179908-179935 uart: tx-data-bits: "1"
179934-179961 uart: tx-data-bits: "1"
179960-179987 uart: tx-data-bits: "0"
179986-180013 uart: tx-data-bits: "1"
180012-180039 uart: tx-data-bits: "1"
180038-180065 uart: tx-data-bits: "0"
180064-180091 uart: tx-data-bits: "1"
180090-180117 uart: tx-data-bits: "1"
179908-180117 uart: tx-data: "219"
180116-180143 uart: tx-parity-ok: "Stop bit" "Stop" "T"
180401-180428 uart: tx-start: "Start bit" "Start" "S"
180427-180454 uart: tx-data-bits: "0"
180453-180480 uart: tx-data-bits: "0"
180479-180506 uart: tx-data-bits: "1"
180505-180532 uart: tx-data-bits: "1"
180531-180558 uart: tx-data-bits: "1"
180557-180584 uart: tx-data-bits: "0"
180583-180610 uart: tx-data-bits: "1"
180609-180636 uart: tx-data-bits: "1"
180427-180636 uart: tx-data: "220"
180635-180662 uart: tx-parity-ok: "Stop bit" "Stop" "T"
180917-180944 uart: tx-start: "Start bit" "Start" "S"
180943-180970 uart: tx-data-bits: "1"
180969-180996 uart: tx-data-bits: "0"
180995-181022 uart: tx-data-bits: "1"
181021-181048 uart: tx-data-bits: "1"
181047-181074 uart: tx-data-bits: "1"
181073-181100 uart: tx-data-bits: "0"
181099-181126 uart: tx-data-bits: "1"
181125-181152 uart: tx-data-bits: "1"
180943-181152 uart: tx-data: "221"
181151-181178 uart: tx-parity-ok: "Stop bit" "Stop" "T"
181436-181463 uart: tx-start: "Start bit" "Start" "S"
181462-181489 uart: tx-data-bits: "0"
181488-181515 uart: tx-data-bits: "1"
181514-181541 uart: tx-data-bits: "1"
181540-181567 uart: tx-data-bits: "1"
181566-181593 uart: tx-data-bits: "1"
181592-181619 uart: tx-data-bits: "0"
181618-181645 uart: tx-data-bits: "1"
181644-181671 uart: tx-data-bits: "1"
181462-181671 uart: tx-data: "222"
181670-181697 uart: tx-parity-ok: "Stop bit" "Stop" "T"
181952-181979 uart: tx-start: "Start bit" "Start" "S"
181978-182005 uart: tx-data-bits: "1"
182004-182031 uart: tx-data-bits: "1"
182030-182057 uart: tx-data-bits: "1"
182056-182083 uart: tx-data-bits: "1"
182082-182109 uart: tx-data-bits: "1"
182108-182135 uart: tx-data-bits: "0"
182134-182161 uart: tx-data-bits: "1"
182160-182187 uart: tx-data-bits: "1"
181978-182187 uart: tx-data: "223"
174206-182187 uart: tx-packet: "208 209 210 211 212 213 214 215 216 217 218 219 220 221 222 223"
182186-182213 uart: tx-parity-ok: "Stop bit" "Stop" "T"
182469-182496 uart: tx-start: "Start bit" "Start" "S"
182495-182522 uart: tx-data-bits: "0"
182521-182548 uart: tx-data-bits: "0"
182547-182574 uart: tx-data-bits: "0"
182573-182600 uart: tx-data-bits: "0"
182599-182626 uart: tx-data-bits: "0"
182625-182652 uart: tx-data-bits: "1"
182651-182678 uart: tx-data-bits: "1"
182677-182704 uart: tx-data-bits: "1"
182495-182704 uart: tx-data: "224"
182703-182730 uart: tx-parity-ok: "Stop bit" "Stop" "T"
182984-183011 uart: tx-start: "Start bit" "Start" "S"
183010-183037 uart: tx-data-bits: "1"
183036-183063 uart: tx-data-bits: "0"
183062-183089 uart: tx-data-bits: "0"
183088-183115 uart: tx-data-bits: "0"
183114-183141 uart: tx-data-bits: "0"
183140-183167 uart: tx-data-bits: "1"
183166-183193 uart: tx-data-bits: "1"
183192-183219 uart: tx-data-bits: "1"
183010-183219 uart: tx-data: "225"
183218-183245 uart: tx-parity-ok: "Stop bit" "Stop" "T"
183500-183527 uart: tx-start: "Start bit" "Start" "S"
183526-183553 uart: tx-data-bits: "0"
183552-183579 uart: tx-data-bits: "1"
183578-183605 uart: tx-data-bits: "0"
183604-183631 uart: tx-data-bits: "0"
183630-183657 uart: tx-data-bits: "0"
183656-183683 uart: tx-data-bits: "1"
183682-183709 uart: tx-data-bits: "1"
183708-183735 uart: tx-data-bits: "1"
183526-183735 uart: tx-data: "226"
183734-183761 uart: tx-parity-ok: "Stop bit" "Stop" "T"
184017-184044 uart: tx-start: "Start bit" "Start" "S"
184043-184070 uart: tx-data-bits: "1"
184069-184096 uart: tx-data-bits: "1"
184095-184122 uart: tx-data-bits: "0"
184121-184148 uart: tx-data-bits: "0"
184147-184174 uart: tx-data-bits: "0"
184173-184200 uart: tx-data-bits: "1"
184199-184226 uart: tx-data-bits: "1"
184225-184252 uart: tx-data-bits: "1"
184043-184252 uart: tx-data: "227"
184251-184278 uart: tx-parity-ok: "Stop bit" "Stop" "T"
184533-184560 uart: tx-start: "Start bit" "Start" "S"
184559-184586 uart: tx-data-bits: "0"
184585-184612 uart: tx-data-bits: "0"
184611-184638 uart: tx-data-bits: "1"
184637-184664 uart: tx-data-bits: "0"
184663-184690 uart: tx-data-bits: "0"
184689-184716 uart: tx-data-bits: "1"
184715-184742 uart: tx-data-bits: "1"
184741-184768 uart: tx-data-bits: "1"
184559-184768 uart: tx-data: "228"
184767-184794 uart: tx-parity-ok: "Stop bit" "Stop" "T"
185050-185077 uart: tx-start: "Start bit" "Start" "S"
185076-185103 uart: tx-data-bits: "1"
185102-185129 uart: tx-data-bits: "0"
185128-185155 uart: tx-data-bits: "1"
185154-185181 uart: tx-data-bits: "0"
185180-185207 uart: tx-data-bits: "0"
185206-185233 uart: tx-data-bits: "1"
185232-185259 uart: tx-data-bits: "1"
185258-185285 uart: tx-data-bits: "1"
185076-185285 uart: tx-data: "229"
185284-185311 uart: tx-parity-ok: "Stop bit" "Stop" "T"
185569-185596 uart: tx-start: "Start bit" "Start" "S"
185595-185622 uart: tx-data-bits: "0"
185621-185648 uart: tx-data-bits: "1"
185647-185674 uart: tx-data-bits: "1"
185673-185700 uart: tx-data-bits: "0"
185699-185726 uart: tx-data-bits: "0"
185725-185752 uart: tx-data-bits: "1"
185751-185778 uart: tx-data-bits: "1"
185777-185804 uart: tx-data-bits: "1"
185595-185804 uart: tx-data: "230"
185803-185830 uart: tx-parity-ok: "Stop bit" "Stop" "T"
186085-186112 uart: tx-start: "Start bit" "Start" "S"
186111-186138 uart: tx-data-bits: "1"
186137-186164 uart: tx-data-bits: "1"
186163-186190 uart: tx-data-bits: "1"
186189-186216 uart: tx-data-bits: "0"
186215-186242 uart: tx-data-bits: "0"
186241-186268 uart: tx-data-bits: "1"
186267-186294 uart: tx-data-bits: "1"
186293-186320 uart: tx-data-bits: "1"
186111-186320 uart: tx-data: "231"
186319-186346 uart: tx-parity-ok: "Stop bit" "Stop" "T"
186602-186629 uart: tx-start: "Start bit" "Start" "S"
186628-186655 uart: tx-data-bits: "0"
186654-186681 uart: tx-data-bits: "0"
186680-186707 uart: tx-data-bits: "0"
186706-186733 uart: tx-data-bits: "1"
186732-186759 uart: tx-data-bits: "0"
186758-186785 uart: tx-data-bits: "1"
186784-186811 uart: tx-data-bits: "1"
186810-186837 uart: tx-data-bits: "1"
186628-186837 uart: tx-data: "232"
186836-186863 uart: tx-parity-ok: "Stop bit" "Stop" "T"
187118-187145 uart: tx-start: "Start bit" "Start" "S"
187144-187171 uart: tx-data-bits: "1"
187170-187197 uart: tx-data-bits: "0"
187196-187223 uart: tx-data-bits: "0"
187222-187249 uart: tx-data-bits: "1"
187248-187275 uart: tx-data-bits: "0"
187274-187301 uart: tx-data-bits: "1"
187300-187327 uart: tx-data-bits: "1"
187326-187353 uart: tx-data-bits: "1"
187144-187353 uart: tx-data: "233"
187352-187379 uart: tx-parity-ok: "Stop bit" "Stop" "T"
187637-187664 uart: tx-start: "Start bit" "Start" "S"
187663-187690 uart: tx-data-bits: "0"
187689-187716 uart: tx-data-bits: "1"
187715-187742 uart: tx-data-bits: "0"
187741-187768 uart: tx-data-bits: "1"
187767-187794 uart: tx-data-bits: "0"
187793-187820 uart: tx-data-bits: "1"
187819-187846 uart: tx-data-bits: "1"
187845-187872 uart: tx-data-bits: "1"
187663-187872 uart: tx-data: "234"
187871-187898 uart: tx-parity-ok: "Stop bit" "Stop" "T"
188155-188182 uart: tx-start: "Start bit" "Start" "S"
188181-188208 uart: tx-data-bits: "1"
188207-188234 uart: tx-data-bits: "1"
188233-188260 uart: tx-data-bits: "0"
188259-188286 uart: tx-data-bits: "1"
188285-188312 uart: tx-data-bits: "0"
188311-188338 uart: tx-data-bits: "1"
188337-188364 uart: tx-data-bits: "1"
188363-188390 uart: tx-data-bits: "1"
188181-188390 uart: tx-data: "235"
188389-188416 uart: tx-parity-ok: "Stop bit" "Stop" "T"
188674-188701 uart: tx-start: "Start bit" "Start" "S"
188700-188727 uart: tx-data-bits: "0"
188726-188753 uart: tx-data-bits: "0"
188752-188779 uart: tx-data-bits: "1"
188778-188805 uart: tx-data-bits: "1"
188804-188831 uart: tx-data-bits: "0"
188830-188857 uart: tx-data-bits: "1"
188856-188883 uart: tx-data-bits: "1"
188882-188909 uart: tx-data-bits: "1"
188700-188909 uart: tx-data: "236"
188908-188935 uart: tx-parity-ok: "Stop bit" "Stop" "T"
