117-143 uart: tx-start: "Start bit" "Start" "S"
143-169 uart: tx-data-bit: "1"
169-195 uart: tx-data-bit: "1"
195-221 uart: tx-data-bit: "1"
221-247 uart: tx-data-bit: "1"
247-273 uart: tx-data-bit: "1"
143-273 uart: tx-data: "[1F]"
273-299 uart: tx-stop: "Stop bit" "Stop" "T"
554-580 uart: tx-start: "Start bit" "Start" "S"
580-606 uart: tx-data-bit: "0"
606-632 uart: tx-data-bit: "0"
632-658 uart: tx-data-bit: "0"
658-684 uart: tx-data-bit: "0"
684-710 uart: tx-data-bit: "0"
580-710 uart: tx-data: "[00]"
710-736 uart: tx-stop: "Stop bit" "Stop" "T"
990-1016 uart: tx-start: "Start bit" "Start" "S"
1016-1042 uart: tx-data-bit: "1"
1042-1068 uart: tx-data-bit: "0"
1068-1094 uart: tx-data-bit: "0"
1094-1120 uart: tx-data-bit: "0"
1120-1146 uart: tx-data-bit: "0"
1016-1146 uart: tx-data: "[01]"
1146-1172 uart: tx-stop: "Stop bit" "Stop" "T"
1429-1455 uart: tx-start: "Start bit" "Start" "S"
1455-1481 uart: tx-data-bit: "0"
1481-1507 uart: tx-data-bit: "1"
1507-1533 uart: tx-data-bit: "0"
1533-1559 uart: tx-data-bit: "0"
1559-1585 uart: tx-data-bit: "0"
1455-1585 uart: tx-data: "[02]"
1585-1611 uart: tx-stop: "Stop bit" "Stop" "T"
1868-1894 uart: tx-start: "Start bit" "Start" "S"
1894-1920 uart: tx-data-bit: "1"
1920-1946 uart: tx-data-bit: "1"
1946-1972 uart: tx-data-bit: "0"
1972-1998 uart: tx-data-bit: "0"
1998-2024 uart: tx-data-bit: "0"
1894-2024 uart: tx-data: "[03]"
2024-2050 uart: tx-stop: "Stop bit" "Stop" "T"
2306-2332 uart: tx-start: "Start bit" "Start" "S"
2332-2358 uart: tx-data-bit: "0"
2358-2384 uart: tx-data-bit: "0"
2384-2410 uart: tx-data-bit: "1"
2410-2436 uart: tx-data-bit: "0"
2436-2462 uart: tx-data-bit: "0"
2332-2462 uart: tx-data: "[04]"
2462-2488 uart: tx-stop: "Stop bit" "Stop" "T"
2745-2771 uart: tx-start: "Start bit" "Start" "S"
2771-2797 uart: tx-data-bit: "1"
2797-2823 uart: tx-data-bit: "0"
2823-2849 uart: tx-data-bit: "1"
2849-2875 uart: tx-data-bit: "0"
2875-2901 uart: tx-data-bit: "0"
2771-2901 uart: tx-data: "[05]"
2901-2927 uart: tx-stop: "Stop bit" "Stop" "T"
3186-3212 uart: tx-start: "Start bit" "Start" "S"
3212-3238 uart: tx-data-bit: "0"
3238-3264 uart: tx-data-bit: "1"
3264-3290 uart: tx-data-bit: "1"
3290-3316 uart: tx-data-bit: "0"
3316-3342 uart: tx-data-bit: "0"
3212-3342 uart: tx-data: "[06]"
3342-3368 uart: tx-stop: "Stop bit" "Stop" "T"
3624-3650 uart: tx-start: "Start bit" "Start" "S"
3650-3676 uart: tx-data-bit: "1"
3676-3702 uart: tx-data-bit: "1"
3702-3728 uart: tx-data-bit: "1"
3728-3754 uart: tx-data-bit: "0"
3754-3780 uart: tx-data-bit: "0"
3650-3780 uart: tx-data: "[07]"
3780-3806 uart: tx-stop: "Stop bit" "Stop" "T"
4063-4089 uart: tx-start: "Start bit" "Start" "S"
4089-4115 uart: tx-data-bit: "0"
4115-4141 uart: tx-data-bit: "0"
4141-4167 uart: tx-data-bit: "0"
4167-4193 uart: tx-data-bit: "1"
4193-4219 uart: tx-data-bit: "0"
4089-4219 uart: tx-data: "[08]"
4219-4245 uart: tx-stop: "Stop bit" "Stop" "T"
4501-4527 uart: tx-start: "Start bit" "Start" "S"
4527-4553 uart: tx-data-bit: "1"
4553-4579 uart: tx-data-bit: "0"
4579-4605 uart: tx-data-bit: "0"
4605-4631 uart: tx-data-bit: "1"
4631-4657 uart: tx-data-bit: "0"
4527-4657 uart: tx-data: "[09]"
4657-4683 uart: tx-stop: "Stop bit" "Stop" "T"
4942-4968 uart: tx-start: "Start bit" "Start" "S"
4968-4994 uart: tx-data-bit: "0"
4994-5020 uart: tx-data-bit: "1"
5020-5046 uart: tx-data-bit: "0"
5046-5072 uart: tx-data-bit: "1"
5072-5098 uart: tx-data-bit: "0"
4968-5098 uart: tx-data: "[0A]"
5098-5124 uart: tx-stop: "Stop bit" "Stop" "T"
5383-5409 uart: tx-start: "Start bit" "Start" "S"
5409-5435 uart: tx-data-bit: "1"
5435-5461 uart: tx-data-bit: "1"
5461-5487 uart: tx-data-bit: "0"
5487-5513 uart: tx-data-bit: "1"
5513-5539 uart: tx-data-bit: "0"
5409-5539 uart: tx-data: "[0B]"
5539-5565 uart: tx-stop: "Stop bit" "Stop" "T"
5823-5849 uart: tx-start: "Start bit" "Start" "S"
5849-5875 uart: tx-data-bit: "0"
5875-5901 uart: tx-data-bit: "0"
5901-5927 uart: tx-data-bit: "1"
5927-5953 uart: tx-data-bit: "1"
5953-5979 uart: tx-data-bit: "0"
5849-5979 uart: tx-data: "[0C]"
5979-6005 uart: tx-stop: "Stop bit" "Stop" "T"
6262-6288 uart: tx-start: "Start bit" "Start" "S"
6288-6314 uart: tx-data-bit: "1"
6314-6340 uart: tx-data-bit: "0"
6340-6366 uart: tx-data-bit: "1"
6366-6392 uart: tx-data-bit: "1"
6392-6418 uart: tx-data-bit: "0"
6288-6418 uart: tx-data: "[0D]"
6418-6444 uart: tx-stop: "Stop bit" "Stop" "T"
6703-6729 uart: tx-start: "Start bit" "Start" "S"
6729-6755 uart: tx-data-bit: "0"
6755-6781 uart: tx-data-bit: "1"
6781-6807 uart: tx-data-bit: "1"
6807-6833 uart: tx-data-bit: "1"
6833-6859 uart: tx-data-bit: "0"
6729-6859 uart: tx-data: "[0E]"
6859-6885 uart: tx-stop: "Stop bit" "Stop" "T"
7141-7167 uart: tx-start: "Start bit" "Start" "S"
7167-7193 uart: tx-data-bit: "1"
7193-7219 uart: tx-data-bit: "1"
7219-7245 uart: tx-data-bit: "1"
7245-7271 uart: tx-data-bit: "1"
7271-7297 uart: tx-data-bit: "0"
7167-7297 uart: tx-data: "[0F]"
7297-7323 uart: tx-stop: "Stop bit" "Stop" "T"
7580-7606 uart: tx-start: "Start bit" "Start" "S"
7606-7632 uart: tx-data-bit: "0"
7632-7658 uart: tx-data-bit: "0"
7658-7684 uart: tx-data-bit: "0"
7684-7710 uart: tx-data-bit: "0"
7710-7736 uart: tx-data-bit: "1"
7606-7736 uart: tx-data: "[10]"
7736-7762 uart: tx-stop: "Stop bit" "Stop" "T"
8016-8042 uart: tx-start: "Start bit" "Start" "S"
8042-8068 uart: tx-data-bit: "1"
8068-8094 uart: tx-data-bit: "0"
8094-8120 uart: tx-data-bit: "0"
8120-8146 uart: tx-data-bit: "0"
8146-8172 uart: tx-data-bit: "1"
8042-8172 uart: tx-data: "[11]"
8172-8198 uart: tx-stop: "Stop bit" "Stop" "T"
8455-8481 uart: tx-start: "Start bit" "Start" "S"
8481-8507 uart: tx-data-bit: "0"
8507-8533 uart: tx-data-bit: "1"
8533-8559 uart: tx-data-bit: "0"
8559-8585 uart: tx-data-bit: "0"
8585-8611 uart: tx-data-bit: "1"
8481-8611 uart: tx-data: "[12]"
8611-8637 uart: tx-stop: "Stop bit" "Stop" "T"
8894-8920 uart: tx-start: "Start bit" "Start" "S"
8920-8946 uart: tx-data-bit: "1"
8946-8972 uart: tx-data-bit: "1"
8972-8998 uart: tx-data-bit: "0"
8998-9024 uart: tx-data-bit: "0"
9024-9050 uart: tx-data-bit: "1"
8920-9050 uart: tx-data: "[13]"
9050-9076 uart: tx-stop: "Stop bit" "Stop" "T"
9332-9358 uart: tx-start: "Start bit" "Start" "S"
9358-9384 uart: tx-data-bit: "0"
9384-9410 uart: tx-data-bit: "0"
9410-9436 uart: tx-data-bit: "1"
9436-9462 uart: tx-data-bit: "0"
9462-9488 uart: tx-data-bit: "1"
9358-9488 uart: tx-data: "[14]"
9488-9514 uart: tx-stop: "Stop bit" "Stop" "T"
9771-9797 uart: tx-start: "Start bit" "Start" "S"
9797-9823 uart: tx-data-bit: "1"
9823-9849 uart: tx-data-bit: "0"
9849-9875 uart: tx-data-bit: "1"
9875-9901 uart: tx-data-bit: "0"
9901-9927 uart: tx-data-bit: "1"
9797-9927 uart: tx-data: "[15]"
9927-9953 uart: tx-stop: "Stop bit" "Stop" "T"
10212-10238 uart: tx-start: "Start bit" "Start" "S"
10238-10264 uart: tx-data-bit: "0"
10264-10290 uart: tx-data-bit: "1"
10290-10316 uart: tx-data-bit: "1"
10316-10342 uart: tx-data-bit: "0"
10342-10368 uart: tx-data-bit: "1"
10238-10368 uart: tx-data: "[16]"
10368-10394 uart: tx-stop: "Stop bit" "Stop" "T"
10650-10676 uart: tx-start: "Start bit" "Start" "S"
10676-10702 uart: tx-data-bit: "1"
10702-10728 uart: tx-data-bit: "1"
10728-10754 uart: tx-data-bit: "1"
10754-10780 uart: tx-data-bit: "0"
10780-10806 uart: tx-data-bit: "1"
10676-10806 uart: tx-data: "[17]"
10806-10832 uart: tx-stop: "Stop bit" "Stop" "T"
11089-11115 uart: tx-start: "Start bit" "Start" "S"
11115-11141 uart: tx-data-bit: "0"
11141-11167 uart: tx-data-bit: "0"
11167-11193 uart: tx-data-bit: "0"
11193-11219 uart: tx-data-bit: "1"
11219-11245 uart: tx-data-bit: "1"
11115-11245 uart: tx-data: "[18]"
11245-11271 uart: tx-stop: "Stop bit" "Stop" "T"
11525-11551 uart: tx-start: "Start bit" "Start" "S"
11551-11577 uart: tx-data-bit: "1"
11577-11603 uart: tx-data-bit: "0"
11603-11629 uart: tx-data-bit: "0"
11629-11655 uart: tx-data-bit: "1"
11655-11681 uart: tx-data-bit: "1"
11551-11681 uart: tx-data: "[19]"
11681-11707 uart: tx-stop: "Stop bit" "Stop" "T"
11964-11990 uart: tx-start: "Start bit" "Start" "S"
11990-12016 uart: tx-data-bit: "0"
12016-12042 uart: tx-data-bit: "1"
12042-12068 uart: tx-data-bit: "0"
12068-12094 uart: tx-data-bit: "1"
12094-12120 uart: tx-data-bit: "1"
11990-12120 uart: tx-data: "[1A]"
12120-12146 uart: tx-stop: "Stop bit" "Stop" "T"
12403-12429 uart: tx-start: "Start bit" "Start" "S"
12429-12455 uart: tx-data-bit: "1"
12455-12481 uart: tx-data-bit: "1"
12481-12507 uart: tx-data-bit: "0"
12507-12533 uart: tx-data-bit: "1"
12533-12559 uart: tx-data-bit: "1"
12429-12559 uart: tx-data: "[1B]"
12559-12585 uart: tx-stop: "Stop bit" "Stop" "T"
12841-12867 uart: tx-start: "Start bit" "Start" "S"
12867-12893 uart: tx-data-bit: "0"
12893-12919 uart: tx-data-bit: "0"
12919-12945 uart: tx-data-bit: "1"
12945-12971 uart: tx-data-bit: "1"
12971-12997 uart: tx-data-bit: "1"
12867-12997 uart: tx-data: "[1C]"
12997-13023 uart: tx-stop: "Stop bit" "Stop" "T"
13278-13304 uart: tx-start: "Start bit" "Start" "S"
13304-13330 uart: tx-data-bit: "1"
13330-13356 uart: tx-data-bit: "0"
13356-13382 uart: tx-data-bit: "1"
13382-13408 uart: tx-data-bit: "1"
13408-13434 uart: tx-data-bit: "1"
13304-13434 uart: tx-data: "[1D]"
13434-13460 uart: tx-stop: "Stop bit" "Stop" "T"
13717-13743 uart: tx-start: "Start bit" "Start" "S"
13743-13769 uart: tx-data-bit: "0"
13769-13795 uart: tx-data-bit: "1"
13795-13821 uart: tx-data-bit: "1"
13821-13847 uart: tx-data-bit: "1"
13847-13873 uart: tx-data-bit: "1"
13743-13873 uart: tx-data: "[1E]"
13873-13899 uart: tx-stop: "Stop bit" "Stop" "T"
14153-14179 uart: tx-start: "Start bit" "Start" "S"
14179-14205 uart: tx-data-bit: "1"
14205-14231 uart: tx-data-bit: "1"
14231-14257 uart: tx-data-bit: "1"
14257-14283 uart: tx-data-bit: "1"
14283-14309 uart: tx-data-bit: "1"
14179-14309 uart: tx-data: "[1F]"
14309-14335 uart: tx-stop: "Stop bit" "Stop" "T"
14590-14616 uart: tx-start: "Start bit" "Start" "S"
14616-14642 uart: tx-data-bit: "0"
14642-14668 uart: tx-data-bit: "0"
14668-14694 uart: tx-data-bit: "0"
14694-14720 uart: tx-data-bit: "0"
14720-14746 uart: tx-data-bit: "0"
14616-14746 uart: tx-data: "[00]"
14746-14772 uart: tx-stop: "Stop bit" "Stop" "T"
15027-15053 uart: tx-start: "Start bit" "Start" "S"
15053-15079 uart: tx-data-bit: "1"
15079-15105 uart: tx-data-bit: "0"
15105-15131 uart: tx-data-bit: "0"
15131-15157 uart: tx-data-bit: "0"
15157-15183 uart: tx-data-bit: "0"
15053-15183 uart: tx-data: "[01]"
15183-15209 uart: tx-stop: "Stop bit" "Stop" "T"
15465-15491 uart: tx-start: "Start bit" "Start" "S"
15491-15517 uart: tx-data-bit: "0"
15517-15543 uart: tx-data-bit: "1"
15543-15569 uart: tx-data-bit: "0"
15569-15595 uart: tx-data-bit: "0"
15595-15621 uart: tx-data-bit: "0"
15491-15621 uart: tx-data: "[02]"
15621-15647 uart: tx-stop: "Stop bit" "Stop" "T"
15904-15930 uart: tx-start: "Start bit" "Start" "S"
15930-15956 uart: tx-data-bit: "1"
15956-15982 uart: tx-data-bit: "1"
15982-16008 uart: tx-data-bit: "0"
16008-16034 uart: tx-data-bit: "0"
16034-16060 uart: tx-data-bit: "0"
15930-16060 uart: tx-data: "[03]"
16060-16086 uart: tx-stop: "Stop bit" "Stop" "T"
16342-16368 uart: tx-start: "Start bit" "Start" "S"
16368-16394 uart: tx-data-bit: "0"
16394-16420 uart: tx-data-bit: "0"
16420-16446 uart: tx-data-bit: "1"
16446-16472 uart: tx-data-bit: "0"
16472-16498 uart: tx-data-bit: "0"
16368-16498 uart: tx-data: "[04]"
16498-16524 uart: tx-stop: "Stop bit" "Stop" "T"
16781-16807 uart: tx-start: "Start bit" "Start" "S"
16807-16833 uart: tx-data-bit: "1"
16833-16859 uart: tx-data-bit: "0"
16859-16885 uart: tx-data-bit: "1"
16885-16911 uart: tx-data-bit: "0"
16911-16937 uart: tx-data-bit: "0"
16807-16937 uart: tx-data: "[05]"
16937-16963 uart: tx-stop: "Stop bit" "Stop" "T"
17222-17248 uart: tx-start: "Start bit" "Start" "S"
17248-17274 uart: tx-data-bit: "0"
17274-17300 uart: tx-data-bit: "1"
17300-17326 uart: tx-data-bit: "1"
17326-17352 uart: tx-data-bit: "0"
17352-17378 uart: tx-data-bit: "0"
17248-17378 uart: tx-data: "[06]"
17378-17404 uart: tx-stop: "Stop bit" "Stop" "T"
17660-17686 uart: tx-start: "Start bit" "Start" "S"
17686-17712 uart: tx-data-bit: "1"
17712-17738 uart: tx-data-bit: "1"
17738-17764 uart: tx-data-bit: "1"
17764-17790 uart: tx-data-bit: "0"
17790-17816 uart: tx-data-bit: "0"
17686-17816 uart: tx-data: "[07]"
17816-17842 uart: tx-stop: "Stop bit" "Stop" "T"
18099-18125 uart: tx-start: "Start bit" "Start" "S"
18125-18151 uart: tx-data-bit: "0"
18151-18177 uart: tx-data-bit: "0"
18177-18203 uart: tx-data-bit: "0"
18203-18229 uart: tx-data-bit: "1"
18229-18255 uart: tx-data-bit: "0"
18125-18255 uart: tx-data: "[08]"
18255-18281 uart: tx-stop: "Stop bit" "Stop" "T"
18538-18564 uart: tx-start: "Start bit" "Start" "S"
18564-18590 uart: tx-data-bit: "1"
18590-18616 uart: tx-data-bit: "0"
18616-18642 uart: tx-data-bit: "0"
18642-18668 uart: tx-data-bit: "1"
18668-18694 uart: tx-data-bit: "0"
18564-18694 uart: tx-data: "[09]"
18694-18720 uart: tx-stop: "Stop bit" "Stop" "T"
18978-19004 uart: tx-start: "Start bit" "Start" "S"
19004-19030 uart: tx-data-bit: "0"
19030-19056 uart: tx-data-bit: "1"
19056-19082 uart: tx-data-bit: "0"
19082-19108 uart: tx-data-bit: "1"
19108-19134 uart: tx-data-bit: "0"
19004-19134 uart: tx-data: "[0A]"
19134-19160 uart: tx-stop: "Stop bit" "Stop" "T"
19419-19445 uart: tx-start: "Start bit" "Start" "S"
19445-19471 uart: tx-data-bit: "1"
19471-19497 uart: tx-data-bit: "1"
19497-19523 uart: tx-data-bit: "0"
19523-19549 uart: tx-data-bit: "1"
19549-19575 uart: tx-data-bit: "0"
19445-19575 uart: tx-data: "[0B]"
19575-19601 uart: tx-stop: "Stop bit" "Stop" "T"
19859-19885 uart: tx-start: "Start bit" "Start" "S"
19885-19911 uart: tx-data-bit: "0"
19911-19937 uart: tx-data-bit: "0"
19937-19963 uart: tx-data-bit: "1"
19963-19989 uart: tx-data-bit: "1"
19989-20015 uart: tx-data-bit: "0"
19885-20015 uart: tx-data: "[0C]"
20015-20041 uart: tx-stop: "Stop bit" "Stop" "T"
20298-20324 uart: tx-start: "Start bit" "Start" "S"
20324-20350 uart: tx-data-bit: "1"
20350-20376 uart: tx-data-bit: "0"
20376-20402 uart: tx-data-bit: "1"
20402-20428 uart: tx-data-bit: "1"
20428-20454 uart: tx-data-bit: "0"
20324-20454 uart: tx-data: "[0D]"
20454-20480 uart: tx-stop: "Stop bit" "Stop" "T"
20739-20765 uart: tx-start: "Start bit" "Start" "S"
20765-20791 uart: tx-data-bit: "0"
20791-20817 uart: tx-data-bit: "1"
20817-20843 uart: tx-data-bit: "1"
20843-20869 uart: tx-data-bit: "1"
20869-20895 uart: tx-data-bit: "0"
20765-20895 uart: tx-data: "[0E]"
20895-20921 uart: tx-stop: "Stop bit" "Stop" "T"
21177-21203 uart: tx-start: "Start bit" "Start" "S"
21203-21229 uart: tx-data-bit: "1"
21229-21255 uart: tx-data-bit: "1"
21255-21281 uart: tx-data-bit: "1"
21281-21307 uart: tx-data-bit: "1"
21307-21333 uart: tx-data-bit: "0"
21203-21333 uart: tx-data: "[0F]"
21333-21359 uart: tx-stop: "Stop bit" "Stop" "T"
21616-21642 uart: tx-start: "Start bit" "Start" "S"
21642-21668 uart: tx-data-bit: "0"
21668-21694 uart: tx-data-bit: "0"
21694-21720 uart: tx-data-bit: "0"
21720-21746 uart: tx-data-bit: "0"
21746-21772 uart: tx-data-bit: "1"
21642-21772 uart: tx-data: "[10]"
21772-21798 uart: tx-stop: "Stop bit" "Stop" "T"
22053-22079 uart: tx-start: "Start bit" "Start" "S"
22079-22105 uart: tx-data-bit: "1"
22105-22131 uart: tx-data-bit: "0"
22131-22157 uart: tx-data-bit: "0"
22157-22183 uart: tx-data-bit: "0"
22183-22209 uart: tx-data-bit: "1"
22079-22209 uart: tx-data: "[11]"
22209-22235 uart: tx-stop: "Stop bit" "Stop" "T"
22491-22517 uart: tx-start: "Start bit" "Start" "S"
22517-22543 uart: tx-data-bit: "0"
22543-22569 uart: tx-data-bit: "1"
22569-22595 uart: tx-data-bit: "0"
22595-22621 uart: tx-data-bit: "0"
22621-22647 uart: tx-data-bit: "1"
22517-22647 uart: tx-data: "[12]"
22647-22673 uart: tx-stop: "Stop bit" "Stop" "T"
22930-22956 uart: tx-start: "Start bit" "Start" "S"
22956-22982 uart: tx-data-bit: "1"
22982-23008 uart: tx-data-bit: "1"
23008-23034 uart: tx-data-bit: "0"
23034-23060 uart: tx-data-bit: "0"
23060-23086 uart: tx-data-bit: "1"
22956-23086 uart: tx-data: "[13]"
23086-23112 uart: tx-stop: "Stop bit" "Stop" "T"
23368-23394 uart: tx-start: "Start bit" "Start" "S"
23394-23420 uart: tx-data-bit: "0"
23420-23446 uart: tx-data-bit: "0"
23446-23472 uart: tx-data-bit: "1"
23472-23498 uart: tx-data-bit: "0"
23498-23524 uart: tx-data-bit: "1"
23394-23524 uart: tx-data: "[14]"
23524-23550 uart: tx-stop: "Stop bit" "Stop" "T"
23807-23833 uart: tx-start: "Start bit" "Start" "S"
23833-23859 uart: tx-data-bit: "1"
23859-23885 uart: tx-data-bit: "0"
23885-23911 uart: tx-data-bit: "1"
23911-23937 uart: tx-data-bit: "0"
23937-23963 uart: tx-data-bit: "1"
23833-23963 uart: tx-data: "[15]"
23963-23989 uart: tx-stop: "Stop bit" "Stop" "T"
24248-24274 uart: tx-start: "Start bit" "Start" "S"
24274-24300 uart: tx-data-bit: "0"
24300-24326 uart: tx-data-bit: "1"
24326-24352 uart: tx-data-bit: "1"
24352-24378 uart: tx-data-bit: "0"
24378-24404 uart: tx-data-bit: "1"
24274-24404 uart: tx-data: "[16]"
24404-24430 uart: tx-stop: "Stop bit" "Stop" "T"
24686-24712 uart: tx-start: "Start bit" "Start" "S"
24712-24738 uart: tx-data-bit: "1"
24738-24764 uart: tx-data-bit: "1"
24764-24790 uart: tx-data-bit: "1"
24790-24816 uart: tx-data-bit: "0"
24816-24842 uart: tx-data-bit: "1"
24712-24842 uart: tx-data: "[17]"
24842-24868 uart: tx-stop: "Stop bit" "Stop" "T"
25125-25151 uart: tx-start: "Start bit" "Start" "S"
25151-25177 uart: tx-data-bit: "0"
25177-25203 uart: tx-data-bit: "0"
25203-25229 uart: tx-data-bit: "0"
25229-25255 uart: tx-data-bit: "1"
25255-25281 uart: tx-data-bit: "1"
25151-25281 uart: tx-data: "[18]"
25281-25307 uart: tx-stop: "Stop bit" "Stop" "T"
25562-25588 uart: tx-start: "Start bit" "Start" "S"
25588-25614 uart: tx-data-bit: "1"
25614-25640 uart: tx-data-bit: "0"
25640-25666 uart: tx-data-bit: "0"
25666-25692 uart: tx-data-bit: "1"
25692-25718 uart: tx-data-bit: "1"
25588-25718 uart: tx-data: "[19]"
25718-25744 uart: tx-stop: "Stop bit" "Stop" "T"
26000-26026 uart: tx-start: "Start bit" "Start" "S"
26026-26052 uart: tx-data-bit: "0"
26052-26078 uart: tx-data-bit: "1"
26078-26104 uart: tx-data-bit: "0"
26104-26130 uart: tx-data-bit: "1"
26130-26156 uart: tx-data-bit: "1"
26026-26156 uart: tx-data: "[1A]"
26156-26182 uart: tx-stop: "Stop bit" "Stop" "T"
26439-26465 uart: tx-start: "Start bit" "Start" "S"
26465-26491 uart: tx-data-bit: "1"
26491-26517 uart: tx-data-bit: "1"
26517-26543 uart: tx-data-bit: "0"
26543-26569 uart: tx-data-bit: "1"
26569-26595 uart: tx-data-bit: "1"
26465-26595 uart: tx-data: "[1B]"
26595-26621 uart: tx-stop: "Stop bit" "Stop" "T"
26878-26904 uart: tx-start: "Start bit" "Start" "S"
26904-26930 uart: tx-data-bit: "0"
26930-26956 uart: tx-data-bit: "0"
26956-26982 uart: tx-data-bit: "1"
26982-27008 uart: tx-data-bit: "1"
27008-27034 uart: tx-data-bit: "1"
26904-27034 uart: tx-data: "[1C]"
27034-27060 uart: tx-stop: "Stop bit" "Stop" "T"
27314-27340 uart: tx-start: "Start bit" "Start" "S"
27340-27366 uart: tx-data-bit: "1"
27366-27392 uart: tx-data-bit: "0"
27392-27418 uart: tx-data-bit: "1"
27418-27444 uart: tx-data-bit: "1"
27444-27470 uart: tx-data-bit: "1"
27340-27470 uart: tx-data: "[1D]"
27470-27496 uart: tx-stop: "Stop bit" "Stop" "T"
27753-27779 uart: tx-start: "Start bit" "Start" "S"
27779-27805 uart: tx-data-bit: "0"
27805-27831 uart: tx-data-bit: "1"
27831-27857 uart: tx-data-bit: "1"
27857-27883 uart: tx-data-bit: "1"
27883-27909 uart: tx-data-bit: "1"
27779-27909 uart: tx-data: "[1E]"
27909-27935 uart: tx-stop: "Stop bit" "Stop" "T"
28189-28215 uart: tx-start: "Start bit" "Start" "S"
28215-28241 uart: tx-data-bit: "1"
28241-28267 uart: tx-data-bit: "1"
28267-28293 uart: tx-data-bit: "1"
28293-28319 uart: tx-data-bit: "1"
28319-28345 uart: tx-data-bit: "1"
28215-28345 uart: tx-data: "[1F]"
28345-28371 uart: tx-stop: "Stop bit" "Stop" "T"
28626-28652 uart: tx-start: "Start bit" "Start" "S"
28652-28678 uart: tx-data-bit: "0"
28678-28704 uart: tx-data-bit: "0"
28704-28730 uart: tx-data-bit: "0"
28730-28756 uart: tx-data-bit: "0"
28756-28782 uart: tx-data-bit: "0"
28652-28782 uart: tx-data: "[00]"
28782-28808 uart: tx-stop: "Stop bit" "Stop" "T"
29063-29089 uart: tx-start: "Start bit" "Start" "S"
29089-29115 uart: tx-data-bit: "1"
29115-29141 uart: tx-data-bit: "0"
29141-29167 uart: tx-data-bit: "0"
29167-29193 uart: tx-data-bit: "0"
29193-29219 uart: tx-data-bit: "0"
29089-29219 uart: tx-data: "[01]"
29219-29245 uart: tx-stop: "Stop bit" "Stop" "T"
29501-29527 uart: tx-start: "Start bit" "Start" "S"
29527-29553 uart: tx-data-bit: "0"
29553-29579 uart: tx-data-bit: "1"
29579-29605 uart: tx-data-bit: "0"
29605-29631 uart: tx-data-bit: "0"
29631-29657 uart: tx-data-bit: "0"
29527-29657 uart: tx-data: "[02]"
29657-29683 uart: tx-stop: "Stop bit" "Stop" "T"
