117-143 uart: tx-start: "Start bit" "Start" "S"
143-169 uart: tx-data-bit: "0"
169-195 uart: tx-data-bit: "0"
195-221 uart: tx-data-bit: "0"
221-247 uart: tx-data-bit: "0"
247-273 uart: tx-data-bit: "0"
273-299 uart: tx-data-bit: "0"
299-325 uart: tx-data-bit: "0"
325-351 uart: tx-data-bit: "1"
143-351 uart: tx-data: "10000000"
351-377 uart: tx-stop: "Stop bit" "Stop" "T"
632-658 uart: tx-start: "Start bit" "Start" "S"
658-684 uart: tx-data-bit: "1"
684-710 uart: tx-data-bit: "0"
710-736 uart: tx-data-bit: "0"
736-762 uart: tx-data-bit: "0"
762-788 uart: tx-data-bit: "0"
788-814 uart: tx-data-bit: "0"
814-840 uart: tx-data-bit: "0"
840-866 uart: tx-data-bit: "1"
658-866 uart: tx-data: "10000001"
866-892 uart: tx-stop: "Stop bit" "Stop" "T"
1148-1174 uart: tx-start: "Start bit" "Start" "S"
1174-1200 uart: tx-data-bit: "0"
1200-1226 uart: tx-data-bit: "1"
1226-1252 uart: tx-data-bit: "0"
1252-1278 uart: tx-data-bit: "0"
1278-1304 uart: tx-data-bit: "0"
1304-1330 uart: tx-data-bit: "0"
1330-1356 uart: tx-data-bit: "0"
1356-1382 uart: tx-data-bit: "1"
1174-1382 uart: tx-data: "10000010"
1382-1408 uart: tx-stop: "Stop bit" "Stop" "T"
1665-1691 uart: tx-start: "Start bit" "Start" "S"
1691-1717 uart: tx-data-bit: "1"
1717-1743 uart: tx-data-bit: "1"
1743-1769 uart: tx-data-bit: "0"
1769-1795 uart: tx-data-bit: "0"
1795-1821 uart: tx-data-bit: "0"
1821-1847 uart: tx-data-bit: "0"
1847-1873 uart: tx-data-bit: "0"
1873-1899 uart: tx-data-bit: "1"
1691-1899 uart: tx-data: "10000011"
1899-1925 uart: tx-stop: "Stop bit" "Stop" "T"
2182-2208 uart: tx-start: "Start bit" "Start" "S"
2208-2234 uart: tx-data-bit: "0"
2234-2260 uart: tx-data-bit: "0"
2260-2286 uart: tx-data-bit: "1"
2286-2312 uart: tx-data-bit: "0"
2312-2338 uart: tx-data-bit: "0"
2338-2364 uart: tx-data-bit: "0"
2364-2390 uart: tx-data-bit: "0"
2390-2416 uart: tx-data-bit: "1"
2208-2416 uart: tx-data: "10000100"
2416-2442 uart: tx-stop: "Stop bit" "Stop" "T"
2698-2724 uart: tx-start: "Start bit" "Start" "S"
2724-2750 uart: tx-data-bit: "1"
2750-2776 uart: tx-data-bit: "0"
2776-2802 uart: tx-data-bit: "1"
2802-2828 uart: tx-data-bit: "0"
2828-2854 uart: tx-data-bit: "0"
2854-2880 uart: tx-data-bit: "0"
2880-2906 uart: tx-data-bit: "0"
2906-2932 uart: tx-data-bit: "1"
2724-2932 uart: tx-data: "10000101"
2932-2958 uart: tx-stop: "Stop bit" "Stop" "T"
3217-3243 uart: tx-start: "Start bit" "Start" "S"
3243-3269 uart: tx-data-bit: "0"
3269-3295 uart: tx-data-bit: "1"
3295-3321 uart: tx-data-bit: "1"
3321-3347 uart: tx-data-bit: "0"
3347-3373 uart: tx-data-bit: "0"
3373-3399 uart: tx-data-bit: "0"
3399-3425 uart: tx-data-bit: "0"
3425-3451 uart: tx-data-bit: "1"
3243-3451 uart: tx-data: "10000110"
3451-3477 uart: tx-stop: "Stop bit" "Stop" "T"
3733-3759 uart: tx-start: "Start bit" "Start" "S"
3759-3785 uart: tx-data-bit: "1"
3785-3811 uart: tx-data-bit: "1"
3811-3837 uart: tx-data-bit: "1"
3837-3863 uart: tx-data-bit: "0"
3863-3889 uart: tx-data-bit: "0"
3889-3915 uart: tx-data-bit: "0"
3915-3941 uart: tx-data-bit: "0"
3941-3967 uart: tx-data-bit: "1"
3759-3967 uart: tx-data: "10000111"
3967-3993 uart: tx-stop: "Stop bit" "Stop" "T"
4250-4276 uart: tx-start: "Start bit" "Start" "S"
4276-4302 uart: tx-data-bit: "0"
4302-4328 uart: tx-data-bit: "0"
4328-4354 uart: tx-data-bit: "0"
4354-4380 uart: tx-data-bit: "1"
4380-4406 uart: tx-data-bit: "0"
4406-4432 uart: tx-data-bit: "0"
4432-4458 uart: tx-data-bit: "0"
4458-4484 uart: tx-data-bit: "1"
4276-4484 uart: tx-data: "10001000"
4484-4510 uart: tx-stop: "Stop bit" "Stop" "T"
4766-4792 uart: tx-start: "Start bit" "Start" "S"
4792-4818 uart: tx-data-bit: "1"
4818-4844 uart: tx-data-bit: "0"
4844-4870 uart: tx-data-bit: "0"
4870-4896 uart: tx-data-bit: "1"
4896-4922 uart: tx-data-bit: "0"
4922-4948 uart: tx-data-bit: "0"
4948-4974 uart: tx-data-bit: "0"
4974-5000 uart: tx-data-bit: "1"
4792-5000 uart: tx-data: "10001001"
5000-5026 uart: tx-stop: "Stop bit" "Stop" "T"
5285-5311 uart: tx-start: "Start bit" "Start" "S"
5311-5337 uart: tx-data-bit: "0"
5337-5363 uart: tx-data-bit: "1"
5363-5389 uart: tx-data-bit: "0"
5389-5415 uart: tx-data-bit: "1"
5415-5441 uart: tx-data-bit: "0"
5441-5467 uart: tx-data-bit: "0"
5467-5493 uart: tx-data-bit: "0"
5493-5519 uart: tx-data-bit: "1"
5311-5519 uart: tx-data: "10001010"
5519-5545 uart: tx-stop: "Stop bit" "Stop" "T"
5804-5830 uart: tx-start: "Start bit" "Start" "S"
5830-5856 uart: tx-data-bit: "1"
5856-5882 uart: tx-data-bit: "1"
5882-5908 uart: tx-data-bit: "0"
5908-5934 uart: tx-data-bit: "1"
5934-5960 uart: tx-data-bit: "0"
5960-5986 uart: tx-data-bit: "0"
5986-6012 uart: tx-data-bit: "0"
6012-6038 uart: tx-data-bit: "1"
5830-6038 uart: tx-data: "10001011"
6038-6064 uart: tx-stop: "Stop bit" "Stop" "T"
6322-6348 uart: tx-start: "Start bit" "Start" "S"
6348-6374 uart: tx-data-bit: "0"
6374-6400 uart: tx-data-bit: "0"
6400-6426 uart: tx-data-bit: "1"
6426-6452 uart: tx-data-bit: "1"
6452-6478 uart: tx-data-bit: "0"
6478-6504 uart: tx-data-bit: "0"
6504-6530 uart: tx-data-bit: "0"
6530-6556 uart: tx-data-bit: "1"
6348-6556 uart: tx-data: "10001100"
6556-6582 uart: tx-stop: "Stop bit" "Stop" "T"
6839-6865 uart: tx-start: "Start bit" "Start" "S"
6865-6891 uart: tx-data-bit: "1"
6891-6917 uart: tx-data-bit: "0"
6917-6943 uart: tx-data-bit: "1"
6943-6969 uart: tx-data-bit: "1"
6969-6995 uart: tx-data-bit: "0"
6995-7021 uart: tx-data-bit: "0"
7021-7047 uart: tx-data-bit: "0"
7047-7073 uart: tx-data-bit: "1"
6865-7073 uart: tx-data: "10001101"
7073-7099 uart: tx-stop: "Stop bit" "Stop" "T"
7357-7383 uart: tx-start: "Start bit" "Start" "S"
7383-7409 uart: tx-data-bit: "0"
7409-7435 uart: tx-data-bit: "1"
7435-7461 uart: tx-data-bit: "1"
7461-7487 uart: tx-data-bit: "1"
7487-7513 uart: tx-data-bit: "0"
7513-7539 uart: tx-data-bit: "0"
7539-7565 uart: tx-data-bit: "0"
7565-7591 uart: tx-data-bit: "1"
7383-7591 uart: tx-data: "10001110"
7591-7617 uart: tx-stop: "Stop bit" "Stop" "T"
7874-7900 uart: tx-start: "Start bit" "Start" "S"
7900-7926 uart: tx-data-bit: "1"
7926-7952 uart: tx-data-bit: "1"
7952-7978 uart: tx-data-bit: "1"
7978-8004 uart: tx-data-bit: "1"
8004-8030 uart: tx-data-bit: "0"
8030-8056 uart: tx-data-bit: "0"
8056-8082 uart: tx-data-bit: "0"
8082-8108 uart: tx-data-bit: "1"
7900-8108 uart: tx-data: "10001111"
8108-8134 uart: tx-stop: "Stop bit" "Stop" "T"
117-8134 uart: tx-packet: "10000000 10000001 10000010 10000011 10000100 10000101 10000110 10000111 10001000 10001001 10001010 10001011 10001100 10001101 10001110 10001111"
8391-8417 uart: tx-start: "Start bit" "Start" "S"
8417-8443 uart: tx-data-bit: "0"
8443-8469 uart: tx-data-bit: "0"
8469-8495 uart: tx-data-bit: "0"
8495-8521 uart: tx-data-bit: "0"
8521-8547 uart: tx-data-bit: "1"
8547-8573 uart: tx-data-bit: "0"
8573-8599 uart: tx-data-bit: "0"
8599-8625 uart: tx-data-bit: "1"
8417-8625 uart: tx-data: "10010000"
8625-8651 uart: tx-stop: "Stop bit" "Stop" "T"
8907-8933 uart: tx-start: "Start bit" "Start" "S"
8933-8959 uart: tx-data-bit: "1"
8959-8985 uart: tx-data-bit: "0"
8985-9011 uart: tx-data-bit: "0"
9011-9037 uart: tx-data-bit: "0"
9037-9063 uart: tx-data-bit: "1"
9063-9089 uart: tx-data-bit: "0"
9089-9115 uart: tx-data-bit: "0"
9115-9141 uart: tx-data-bit: "1"
8933-9141 uart: tx-data: "10010001"
9141-9167 uart: tx-stop: "Stop bit" "Stop" "T"
9426-9452 uart: tx-start: "Start bit" "Start" "S"
9452-9478 uart: tx-data-bit: "0"
9478-9504 uart: tx-data-bit: "1"
9504-9530 uart: tx-data-bit: "0"
9530-9556 uart: tx-data-bit: "0"
9556-9582 uart: tx-data-bit: "1"
9582-9608 uart: tx-data-bit: "0"
9608-9634 uart: tx-data-bit: "0"
9634-9660 uart: tx-data-bit: "1"
9452-9660 uart: tx-data: "10010010"
9660-9686 uart: tx-stop: "Stop bit" "Stop" "T"
9944-9970 uart: tx-start: "Start bit" "Start" "S"
9970-9996 uart: tx-data-bit: "1"
9996-10022 uart: tx-data-bit: "1"
10022-10048 uart: tx-data-bit: "0"
10048-10074 uart: tx-data-bit: "0"
10074-10100 uart: tx-data-bit: "1"
10100-10126 uart: tx-data-bit: "0"
10126-10152 uart: tx-data-bit: "0"
10152-10178 uart: tx-data-bit: "1"
9970-10178 uart: tx-data: "10010011"
10178-10204 uart: tx-stop: "Stop bit" "Stop" "T"
10463-10489 uart: tx-start: "Start bit" "Start" "S"
10489-10515 uart: tx-data-bit: "0"
10515-10541 uart: tx-data-bit: "0"
10541-10567 uart: tx-data-bit: "1"
10567-10593 uart: tx-data-bit: "0"
10593-10619 uart: tx-data-bit: "1"
10619-10645 uart: tx-data-bit: "0"
10645-10671 uart: tx-data-bit: "0"
10671-10697 uart: tx-data-bit: "1"
10489-10697 uart: tx-data: "10010100"
10697-10723 uart: tx-stop: "Stop bit" "Stop" "T"
10981-11007 uart: tx-start: "Start bit" "Start" "S"
11007-11033 uart: tx-data-bit: "1"
11033-11059 uart: tx-data-bit: "0"
11059-11085 uart: tx-data-bit: "1"
11085-11111 uart: tx-data-bit: "0"
11111-11137 uart: tx-data-bit: "1"
11137-11163 uart: tx-data-bit: "0"
11163-11189 uart: tx-data-bit: "0"
11189-11215 uart: tx-data-bit: "1"
11007-11215 uart: tx-data: "10010101"
11215-11241 uart: tx-stop: "Stop bit" "Stop" "T"
11502-11528 uart: tx-start: "Start bit" "Start" "S"
11528-11554 uart: tx-data-bit: "0"
11554-11580 uart: tx-data-bit: "1"
11580-11606 uart: tx-data-bit: "1"
11606-11632 uart: tx-data-bit: "0"
11632-11658 uart: tx-data-bit: "1"
11658-11684 uart: tx-data-bit: "0"
11684-11710 uart: tx-data-bit: "0"
11710-11736 uart: tx-data-bit: "1"
11528-11736 uart: tx-data: "10010110"
11736-11762 uart: tx-stop: "Stop bit" "Stop" "T"
12021-12047 uart: tx-start: "Start bit" "Start" "S"
12047-12073 uart: tx-data-bit: "1"
12073-12099 uart: tx-data-bit: "1"
12099-12125 uart: tx-data-bit: "1"
12125-12151 uart: tx-data-bit: "0"
12151-12177 uart: tx-data-bit: "1"
12177-12203 uart: tx-data-bit: "0"
12203-12229 uart: tx-data-bit: "0"
12229-12255 uart: tx-data-bit: "1"
12047-12255 uart: tx-data: "10010111"
12255-12281 uart: tx-stop: "Stop bit" "Stop" "T"
12539-12565 uart: tx-start: "Start bit" "Start" "S"
12565-12591 uart: tx-data-bit: "0"
12591-12617 uart: tx-data-bit: "0"
12617-12643 uart: tx-data-bit: "0"
12643-12669 uart: tx-data-bit: "1"
12669-12695 uart: tx-data-bit: "1"
12695-12721 uart: tx-data-bit: "0"
12721-12747 uart: tx-data-bit: "0"
12747-12773 uart: tx-data-bit: "1"
12565-12773 uart: tx-data: "10011000"
12773-12799 uart: tx-stop: "Stop bit" "Stop" "T"
13056-13082 uart: tx-start: "Start bit" "Start" "S"
13082-13108 uart: tx-data-bit: "1"
13108-13134 uart: tx-data-bit: "0"
13134-13160 uart: tx-data-bit: "0"
13160-13186 uart: tx-data-bit: "1"
13186-13212 uart: tx-data-bit: "1"
13212-13238 uart: tx-data-bit: "0"
13238-13264 uart: tx-data-bit: "0"
13264-13290 uart: tx-data-bit: "1"
13082-13290 uart: tx-data: "10011001"
13290-13316 uart: tx-stop: "Stop bit" "Stop" "T"
13574-13600 uart: tx-start: "Start bit" "Start" "S"
13600-13626 uart: tx-data-bit: "0"
13626-13652 uart: tx-data-bit: "1"
13652-13678 uart: tx-data-bit: "0"
13678-13704 uart: tx-data-bit: "1"
13704-13730 uart: tx-data-bit: "1"
13730-13756 uart: tx-data-bit: "0"
13756-13782 uart: tx-data-bit: "0"
13782-13808 uart: tx-data-bit: "1"
13600-13808 uart: tx-data: "10011010"
13808-13834 uart: tx-stop: "Stop bit" "Stop" "T"
14093-14119 uart: tx-start: "Start bit" "Start" "S"
14119-14145 uart: tx-data-bit: "1"
14145-14171 uart: tx-data-bit: "1"
14171-14197 uart: tx-data-bit: "0"
14197-14223 uart: tx-data-bit: "1"
14223-14249 uart: tx-data-bit: "1"
14249-14275 uart: tx-data-bit: "0"
14275-14301 uart: tx-data-bit: "0"
14301-14327 uart: tx-data-bit: "1"
14119-14327 uart: tx-data: "10011011"
14327-14353 uart: tx-stop: "Stop bit" "Stop" "T"
14612-14638 uart: tx-start: "Start bit" "Start" "S"
14638-14664 uart: tx-data-bit: "0"
14664-14690 uart: tx-data-bit: "0"
14690-14716 uart: tx-data-bit: "1"
14716-14742 uart: tx-data-bit: "1"
14742-14768 uart: tx-data-bit: "1"
14768-14794 uart: tx-data-bit: "0"
14794-14820 uart: tx-data-bit: "0"
14820-14846 uart: tx-data-bit: "1"
14638-14846 uart: tx-data: "10011100"
14846-14872 uart: tx-stop: "Stop bit" "Stop" "T"
15128-15154 uart: tx-start: "Start bit" "Start" "S"
15154-15180 uart: tx-data-bit: "1"
15180-15206 uart: tx-data-bit: "0"
15206-15232 uart: tx-data-bit: "1"
15232-15258 uart: tx-data-bit: "1"
15258-15284 uart: tx-data-bit: "1"
15284-15310 uart: tx-data-bit: "0"
15310-15336 uart: tx-data-bit: "0"
15336-15362 uart: tx-data-bit: "1"
15154-15362 uart: tx-data: "10011101"
15362-15388 uart: tx-stop: "Stop bit" "Stop" "T"
15647-15673 uart: tx-start: "Start bit" "Start" "S"
15673-15699 uart: tx-data-bit: "0"
15699-15725 uart: tx-data-bit: "1"
15725-15751 uart: tx-data-bit: "1"
15751-15777 uart: tx-data-bit: "1"
15777-15803 uart: tx-data-bit: "1"
15803-15829 uart: tx-data-bit: "0"
15829-15855 uart: tx-data-bit: "0"
15855-15881 uart: tx-data-bit: "1"
15673-15881 uart: tx-data: "10011110"
15881-15907 uart: tx-stop: "Stop bit" "Stop" "T"
16163-16189 uart: tx-start: "Start bit" "Start" "S"
16189-16215 uart: tx-data-bit: "1"
16215-16241 uart: tx-data-bit: "1"
16241-16267 uart: tx-data-bit: "1"
16267-16293 uart: tx-data-bit: "1"
16293-16319 uart: tx-data-bit: "1"
16319-16345 uart: tx-data-bit: "0"
16345-16371 uart: tx-data-bit: "0"
16371-16397 uart: tx-data-bit: "1"
16189-16397 uart: tx-data: "10011111"
16397-16423 uart: tx-stop: "Stop bit" "Stop" "T"
8391-16423 uart: tx-packet: "10010000 10010001 10010010 10010011 10010100 10010101 10010110 10010111 10011000 10011001 10011010 10011011 10011100 10011101 10011110 10011111"
16680-16706 uart: tx-start: "Start bit" "Start" "S"
16706-16732 uart: tx-data-bit: "0"
16732-16758 uart: tx-data-bit: "0"
16758-16784 uart: tx-data-bit: "0"
16784-16810 uart: tx-data-bit: "0"
16810-16836 uart: tx-data-bit: "0"
16836-16862 uart: tx-data-bit: "1"
16862-16888 uart: tx-data-bit: "0"
16888-16914 uart: tx-data-bit: "1"
16706-16914 uart: tx-data: "10100000"
16914-16940 uart: tx-stop: "Stop bit" "Stop" "T"
17196-17222 uart: tx-start: "Start bit" "Start" "S"
17222-17248 uart: tx-data-bit: "1"
17248-17274 uart: tx-data-bit: "0"
17274-17300 uart: tx-data-bit: "0"
17300-17326 uart: tx-data-bit: "0"
17326-17352 uart: tx-data-bit: "0"
17352-17378 uart: tx-data-bit: "1"
17378-17404 uart: tx-data-bit: "0"
17404-17430 uart: tx-data-bit: "1"
17222-17430 uart: tx-data: "10100001"
17430-17456 uart: tx-stop: "Stop bit" "Stop" "T"
17715-17741 uart: tx-start: "Start bit" "Start" "S"
17741-17767 uart: tx-data-bit: "0"
17767-17793 uart: tx-data-bit: "1"
17793-17819 uart: tx-data-bit: "0"
17819-17845 uart: tx-data-bit: "0"
17845-17871 uart: tx-data-bit: "0"
17871-17897 uart: tx-data-bit: "1"
17897-17923 uart: tx-data-bit: "0"
17923-17949 uart: tx-data-bit: "1"
17741-17949 uart: tx-data: "10100010"
17949-17975 uart: tx-stop: "Stop bit" "Stop" "T"
18234-18260 uart: tx-start: "Start bit" "Start" "S"
18260-18286 uart: tx-data-bit: "1"
18286-18312 uart: tx-data-bit: "1"
18312-18338 uart: tx-data-bit: "0"
18338-18364 uart: tx-data-bit: "0"
18364-18390 uart: tx-data-bit: "0"
18390-18416 uart: tx-data-bit: "1"
18416-18442 uart: tx-data-bit: "0"
18442-18468 uart: tx-data-bit: "1"
18260-18468 uart: tx-data: "10100011"
18468-18494 uart: tx-stop: "Stop bit" "Stop" "T"
18752-18778 uart: tx-start: "Start bit" "Start" "S"
18778-18804 uart: tx-data-bit: "0"
18804-18830 uart: tx-data-bit: "0"
18830-18856 uart: tx-data-bit: "1"
18856-18882 uart: tx-data-bit: "0"
18882-18908 uart: tx-data-bit: "0"
18908-18934 uart: tx-data-bit: "1"
18934-18960 uart: tx-data-bit: "0"
18960-18986 uart: tx-data-bit: "1"
18778-18986 uart: tx-data: "10100100"
18986-19012 uart: tx-stop: "Stop bit" "Stop" "T"
19271-19297 uart: tx-start: "Start bit" "Start" "S"
19297-19323 uart: tx-data-bit: "1"
19323-19349 uart: tx-data-bit: "0"
19349-19375 uart: tx-data-bit: "1"
19375-19401 uart: tx-data-bit: "0"
19401-19427 uart: tx-data-bit: "0"
19427-19453 uart: tx-data-bit: "1"
19453-19479 uart: tx-data-bit: "0"
19479-19505 uart: tx-data-bit: "1"
19297-19505 uart: tx-data: "10100101"
19505-19531 uart: tx-stop: "Stop bit" "Stop" "T"
19791-19817 uart: tx-start: "Start bit" "Start" "S"
19817-19843 uart: tx-data-bit: "0"
19843-19869 uart: tx-data-bit: "1"
19869-19895 uart: tx-data-bit: "1"
19895-19921 uart: tx-data-bit: "0"
19921-19947 uart: tx-data-bit: "0"
19947-19973 uart: tx-data-bit: "1"
19973-19999 uart: tx-data-bit: "0"
19999-20025 uart: tx-data-bit: "1"
19817-20025 uart: tx-data: "10100110"
20025-20051 uart: tx-stop: "Stop bit" "Stop" "T"
20310-20336 uart: tx-start: "Start bit" "Start" "S"
20336-20362 uart: tx-data-bit: "1"
20362-20388 uart: tx-data-bit: "1"
20388-20414 uart: tx-data-bit: "1"
20414-20440 uart: tx-data-bit: "0"
20440-20466 uart: tx-data-bit: "0"
20466-20492 uart: tx-data-bit: "1"
20492-20518 uart: tx-data-bit: "0"
20518-20544 uart: tx-data-bit: "1"
20336-20544 uart: tx-data: "10100111"
20544-20570 uart: tx-stop: "Stop bit" "Stop" "T"
20829-20855 uart: tx-start: "Start bit" "Start" "S"
20855-20881 uart: tx-data-bit: "0"
20881-20907 uart: tx-data-bit: "0"
20907-20933 uart: tx-data-bit: "0"
20933-20959 uart: tx-data-bit: "1"
20959-20985 uart: tx-data-bit: "0"
20985-21011 uart: tx-data-bit: "1"
21011-21037 uart: tx-data-bit: "0"
21037-21063 uart: tx-data-bit: "1"
20855-21063 uart: tx-data: "10101000"
21063-21089 uart: tx-stop: "Stop bit" "Stop" "T"
21347-21373 uart: tx-start: "Start bit" "Start" "S"
21373-21399 uart: tx-data-bit: "1"
21399-21425 uart: tx-data-bit: "0"
21425-21451 uart: tx-data-bit: "0"
21451-21477 uart: tx-data-bit: "1"
21477-21503 uart: tx-data-bit: "0"
21503-21529 uart: tx-data-bit: "1"
21529-21555 uart: tx-data-bit: "0"
21555-21581 uart: tx-data-bit: "1"
21373-21581 uart: tx-data: "10101001"
21581-21607 uart: tx-stop: "Stop bit" "Stop" "T"
21868-21894 uart: tx-start: "Start bit" "Start" "S"
21894-21920 uart: tx-data-bit: "0"
21920-21946 uart: tx-data-bit: "1"
21946-21972 uart: tx-data-bit: "0"
21972-21998 uart: tx-data-bit: "1"
21998-22024 uart: tx-data-bit: "0"
22024-22050 uart: tx-data-bit: "1"
22050-22076 uart: tx-data-bit: "0"
22076-22102 uart: tx-data-bit: "1"
21894-22102 uart: tx-data: "10101010"
22102-22128 uart: tx-stop: "Stop bit" "Stop" "T"
22388-22414 uart: tx-start: "Start bit" "Start" "S"
22414-22440 uart: tx-data-bit: "1"
22440-22466 uart: tx-data-bit: "1"
22466-22492 uart: tx-data-bit: "0"
22492-22518 uart: tx-data-bit: "1"
22518-22544 uart: tx-data-bit: "0"
22544-22570 uart: tx-data-bit: "1"
22570-22596 uart: tx-data-bit: "0"
22596-22622 uart: tx-data-bit: "1"
22414-22622 uart: tx-data: "10101011"
22622-22648 uart: tx-stop: "Stop bit" "Stop" "T"
22909-22935 uart: tx-start: "Start bit" "Start" "S"
22935-22961 uart: tx-data-bit: "0"
22961-22987 uart: tx-data-bit: "0"
22987-23013 uart: tx-data-bit: "1"
23013-23039 uart: tx-data-bit: "1"
23039-23065 uart: tx-data-bit: "0"
23065-23091 uart: tx-data-bit: "1"
23091-23117 uart: tx-data-bit: "0"
23117-23143 uart: tx-data-bit: "1"
22935-23143 uart: tx-data: "10101100"
23143-23169 uart: tx-stop: "Stop bit" "Stop" "T"
23427-23453 uart: tx-start: "Start bit" "Start" "S"
23453-23479 uart: tx-data-bit: "1"
23479-23505 uart: tx-data-bit: "0"
23505-23531 uart: tx-data-bit: "1"
23531-23557 uart: tx-data-bit: "1"
23557-23583 uart: tx-data-bit: "0"
23583-23609 uart: tx-data-bit: "1"
23609-23635 uart: tx-data-bit: "0"
23635-23661 uart: tx-data-bit: "1"
23453-23661 uart: tx-data: "10101101"
23661-23687 uart: tx-stop: "Stop bit" "Stop" "T"
23948-23974 uart: tx-start: "Start bit" "Start" "S"
23974-24000 uart: tx-data-bit: "0"
24000-24026 uart: tx-data-bit: "1"
24026-24052 uart: tx-data-bit: "1"
24052-24078 uart: tx-data-bit: "1"
24078-24104 uart: tx-data-bit: "0"
24104-24130 uart: tx-data-bit: "1"
24130-24156 uart: tx-data-bit: "0"
24156-24182 uart: tx-data-bit: "1"
23974-24182 uart: tx-data: "10101110"
24182-24208 uart: tx-stop: "Stop bit" "Stop" "T"
24467-24493 uart: tx-start: "Start bit" "Start" "S"
24493-24519 uart: tx-data-bit: "1"
24519-24545 uart: tx-data-bit: "1"
24545-24571 uart: tx-data-bit: "1"
24571-24597 uart: tx-data-bit: "1"
24597-24623 uart: tx-data-bit: "0"
24623-24649 uart: tx-data-bit: "1"
24649-24675 uart: tx-data-bit: "0"
24675-24701 uart: tx-data-bit: "1"
24493-24701 uart: tx-data: "10101111"
24701-24727 uart: tx-stop: "Stop bit" "Stop" "T"
16680-24727 uart: tx-packet: "10100000 10100001 10100010 10100011 10100100 10100101 10100110 10100111 10101000 10101001 10101010 10101011 10101100 10101101 10101110 10101111"
24985-25011 uart: tx-start: "Start bit" "Start" "S"
25011-25037 uart: tx-data-bit: "0"
25037-25063 uart: tx-data-bit: "0"
25063-25089 uart: tx-data-bit: "0"
25089-25115 uart: tx-data-bit: "0"
25115-25141 uart: tx-data-bit: "1"
25141-25167 uart: tx-data-bit: "1"
25167-25193 uart: tx-data-bit: "0"
25193-25219 uart: tx-data-bit: "1"
25011-25219 uart: tx-data: "10110000"
25219-25245 uart: tx-stop: "Stop bit" "Stop" "T"
25502-25528 uart: tx-start: "Start bit" "Start" "S"
25528-25554 uart: tx-data-bit: "1"
25554-25580 uart: tx-data-bit: "0"
25580-25606 uart: tx-data-bit: "0"
25606-25632 uart: tx-data-bit: "0"
25632-25658 uart: tx-data-bit: "1"
25658-25684 uart: tx-data-bit: "1"
25684-25710 uart: tx-data-bit: "0"
25710-25736 uart: tx-data-bit: "1"
25528-25736 uart: tx-data: "10110001"
25736-25762 uart: tx-stop: "Stop bit" "Stop" "T"
26020-26046 uart: tx-start: "Start bit" "Start" "S"
26046-26072 uart: tx-data-bit: "0"
26072-26098 uart: tx-data-bit: "1"
26098-26124 uart: tx-data-bit: "0"
26124-26150 uart: tx-data-bit: "0"
26150-26176 uart: tx-data-bit: "1"
26176-26202 uart: tx-data-bit: "1"
26202-26228 uart: tx-data-bit: "0"
26228-26254 uart: tx-data-bit: "1"
26046-26254 uart: tx-data: "10110010"
26254-26280 uart: tx-stop: "Stop bit" "Stop" "T"
26539-26565 uart: tx-start: "Start bit" "Start" "S"
26565-26591 uart: tx-data-bit: "1"
26591-26617 uart: tx-data-bit: "1"
26617-26643 uart: tx-data-bit: "0"
26643-26669 uart: tx-data-bit: "0"
26669-26695 uart: tx-data-bit: "1"
26695-26721 uart: tx-data-bit: "1"
26721-26747 uart: tx-data-bit: "0"
26747-26773 uart: tx-data-bit: "1"
26565-26773 uart: tx-data: "10110011"
26773-26799 uart: tx-stop: "Stop bit" "Stop" "T"
27058-27084 uart: tx-start: "Start bit" "Start" "S"
27084-27110 uart: tx-data-bit: "0"
27110-27136 uart: tx-data-bit: "0"
27136-27162 uart: tx-data-bit: "1"
27162-27188 uart: tx-data-bit: "0"
27188-27214 uart: tx-data-bit: "1"
27214-27240 uart: tx-data-bit: "1"
27240-27266 uart: tx-data-bit: "0"
27266-27292 uart: tx-data-bit: "1"
27084-27292 uart: tx-data: "10110100"
27292-27318 uart: tx-stop: "Stop bit" "Stop" "T"
27576-27602 uart: tx-start: "Start bit" "Start" "S"
27602-27628 uart: tx-data-bit: "1"
27628-27654 uart: tx-data-bit: "0"
27654-27680 uart: tx-data-bit: "1"
27680-27706 uart: tx-data-bit: "0"
27706-27732 uart: tx-data-bit: "1"
27732-27758 uart: tx-data-bit: "1"
27758-27784 uart: tx-data-bit: "0"
27784-27810 uart: tx-data-bit: "1"
27602-27810 uart: tx-data: "10110101"
27810-27836 uart: tx-stop: "Stop bit" "Stop" "T"
28097-28123 uart: tx-start: "Start bit" "Start" "S"
28123-28149 uart: tx-data-bit: "0"
28149-28175 uart: tx-data-bit: "1"
28175-28201 uart: tx-data-bit: "1"
28201-28227 uart: tx-data-bit: "0"
28227-28253 uart: tx-data-bit: "1"
28253-28279 uart: tx-data-bit: "1"
28279-28305 uart: tx-data-bit: "0"
28305-28331 uart: tx-data-bit: "1"
28123-28331 uart: tx-data: "10110110"
28331-28357 uart: tx-stop: "Stop bit" "Stop" "T"
28615-28641 uart: tx-start: "Start bit" "Start" "S"
28641-28667 uart: tx-data-bit: "1"
28667-28693 uart: tx-data-bit: "1"
28693-28719 uart: tx-data-bit: "1"
28719-28745 uart: tx-data-bit: "0"
28745-28771 uart: tx-data-bit: "1"
28771-28797 uart: tx-data-bit: "1"
28797-28823 uart: tx-data-bit: "0"
28823-28849 uart: tx-data-bit: "1"
28641-28849 uart: tx-data: "10110111"
28849-28875 uart: tx-stop: "Stop bit" "Stop" "T"
29134-29160 uart: tx-start: "Start bit" "Start" "S"
29160-29186 uart: tx-data-bit: "0"
29186-29212 uart: tx-data-bit: "0"
29212-29238 uart: tx-data-bit: "0"
29238-29264 uart: tx-data-bit: "1"
29264-29290 uart: tx-data-bit: "1"
29290-29316 uart: tx-data-bit: "1"
29316-29342 uart: tx-data-bit: "0"
29342-29368 uart: tx-data-bit: "1"
29160-29368 uart: tx-data: "10111000"
29368-29394 uart: tx-stop: "Stop bit" "Stop" "T"
29650-29676 uart: tx-start: "Start bit" "Start" "S"
29676-29702 uart: tx-data-bit: "1"
29702-29728 uart: tx-data-bit: "0"
29728-29754 uart: tx-data-bit: "0"
29754-29780 uart: tx-data-bit: "1"
29780-29806 uart: tx-data-bit: "1"
29806-29832 uart: tx-data-bit: "1"
29832-29858 uart: tx-data-bit: "0"
29858-29884 uart: tx-data-bit: "1"
29676-29884 uart: tx-data: "10111001"
29884-29910 uart: tx-stop: "Stop bit" "Stop" "T"
30169-30195 uart: tx-start: "Start bit" "Start" "S"
30195-30221 uart: tx-data-bit: "0"
30221-30247 uart: tx-data-bit: "1"
30247-30273 uart: tx-data-bit: "0"
30273-30299 uart: tx-data-bit: "1"
30299-30325 uart: tx-data-bit: "1"
30325-30351 uart: tx-data-bit: "1"
30351-30377 uart: tx-data-bit: "0"
30377-30403 uart: tx-data-bit: "1"
30195-30403 uart: tx-data: "10111010"
30403-30429 uart: tx-stop: "Stop bit" "Stop" "T"
30688-30714 uart: tx-start: "Start bit" "Start" "S"
30714-30740 uart: tx-data-bit: "1"
30740-30766 uart: tx-data-bit: "1"
30766-30792 uart: tx-data-bit: "0"
30792-30818 uart: tx-data-bit: "1"
30818-30844 uart: tx-data-bit: "1"
30844-30870 uart: tx-data-bit: "1"
30870-30896 uart: tx-data-bit: "0"
30896-30922 uart: tx-data-bit: "1"
30714-30922 uart: tx-data: "10111011"
30922-30948 uart: tx-stop: "Stop bit" "Stop" "T"
31206-31232 uart: tx-start: "Start bit" "Start" "S"
31232-31258 uart: tx-data-bit: "0"
31258-31284 uart: tx-data-bit: "0"
31284-31310 uart: tx-data-bit: "1"
31310-31336 uart: tx-data-bit: "1"
31336-31362 uart: tx-data-bit: "1"
31362-31388 uart: tx-data-bit: "1"
31388-31414 uart: tx-data-bit: "0"
31414-31440 uart: tx-data-bit: "1"
31232-31440 uart: tx-data: "10111100"
31440-31466 uart: tx-stop: "Stop bit" "Stop" "T"
31723-31749 uart: tx-start: "Start bit" "Start" "S"
31749-31775 uart: tx-data-bit: "1"
31775-31801 uart: tx-data-bit: "0"
31801-31827 uart: tx-data-bit: "1"
31827-31853 uart: tx-data-bit: "1"
31853-31879 uart: tx-data-bit: "1"
31879-31905 uart: tx-data-bit: "1"
31905-31931 uart: tx-data-bit: "0"
31931-31957 uart: tx-data-bit: "1"
31749-31957 uart: tx-data: "10111101"
31957-31983 uart: tx-stop: "Stop bit" "Stop" "T"
32241-32267 uart: tx-start: "Start bit" "Start" "S"
32267-32293 uart: tx-data-bit: "0"
32293-32319 uart: tx-data-bit: "1"
32319-32345 uart: tx-data-bit: "1"
32345-32371 uart: tx-data-bit: "1"
32371-32397 uart: tx-data-bit: "1"
32397-32423 uart: tx-data-bit: "1"
32423-32449 uart: tx-data-bit: "0"
32449-32475 uart: tx-data-bit: "1"
32267-32475 uart: tx-data: "10111110"
32475-32501 uart: tx-stop: "Stop bit" "Stop" "T"
32758-32784 uart: tx-start: "Start bit" "Start" "S"
32784-32810 uart: tx-data-bit: "1"
32810-32836 uart: tx-data-bit: "1"
32836-32862 uart: tx-data-bit: "1"
32862-32888 uart: tx-data-bit: "1"
32888-32914 uart: tx-data-bit: "1"
32914-32940 uart: tx-data-bit: "1"
32940-32966 uart: tx-data-bit: "0"
32966-32992 uart: tx-data-bit: "1"
32784-32992 uart: tx-data: "10111111"
32992-33018 uart: tx-stop: "Stop bit" "Stop" "T"
24985-33018 uart: tx-packet: "10110000 10110001 10110010 10110011 10110100 10110101 10110110 10110111 10111000 10111001 10111010 10111011 10111100 10111101 10111110 10111111"
33275-33301 uart: tx-start: "Start bit" "Start" "S"
33301-33327 uart: tx-data-bit: "0"
33327-33353 uart: tx-data-bit: "0"
33353-33379 uart: tx-data-bit: "0"
33379-33405 uart: tx-data-bit: "0"
33405-33431 uart: tx-data-bit: "0"
33431-33457 uart: tx-data-bit: "0"
33457-33483 uart: tx-data-bit: "1"
33483-33509 uart: tx-data-bit: "1"
33301-33509 uart: tx-data: "11000000"
33509-33535 uart: tx-stop: "Stop bit" "Stop" "T"
33789-33815 uart: tx-start: "Start bit" "Start" "S"
33815-33841 uart: tx-data-bit: "1"
33841-33867 uart: tx-data-bit: "0"
33867-33893 uart: tx-data-bit: "0"
33893-33919 uart: tx-data-bit: "0"
33919-33945 uart: tx-data-bit: "0"
33945-33971 uart: tx-data-bit: "0"
33971-33997 uart: tx-data-bit: "1"
33997-34023 uart: tx-data-bit: "1"
33815-34023 uart: tx-data: "11000001"
34023-34049 uart: tx-stop: "Stop bit" "Stop" "T"
34306-34332 uart: tx-start: "Start bit" "Start" "S"
34332-34358 uart: tx-data-bit: "0"
34358-34384 uart: tx-data-bit: "1"
34384-34410 uart: tx-data-bit: "0"
34410-34436 uart: tx-data-bit: "0"
34436-34462 uart: tx-data-bit: "0"
34462-34488 uart: tx-data-bit: "0"
34488-34514 uart: tx-data-bit: "1"
34514-34540 uart: tx-data-bit: "1"
34332-34540 uart: tx-data: "11000010"
34540-34566 uart: tx-stop: "Stop bit" "Stop" "T"
34822-34848 uart: tx-start: "Start bit" "Start" "S"
34848-34874 uart: tx-data-bit: "1"
34874-34900 uart: tx-data-bit: "1"
34900-34926 uart: tx-data-bit: "0"
34926-34952 uart: tx-data-bit: "0"
34952-34978 uart: tx-data-bit: "0"
34978-35004 uart: tx-data-bit: "0"
35004-35030 uart: tx-data-bit: "1"
35030-35056 uart: tx-data-bit: "1"
34848-35056 uart: tx-data: "11000011"
35056-35082 uart: tx-stop: "Stop bit" "Stop" "T"
35339-35365 uart: tx-start: "Start bit" "Start" "S"
35365-35391 uart: tx-data-bit: "0"
35391-35417 uart: tx-data-bit: "0"
35417-35443 uart: tx-data-bit: "1"
35443-35469 uart: tx-data-bit: "0"
35469-35495 uart: tx-data-bit: "0"
35495-35521 uart: tx-data-bit: "0"
35521-35547 uart: tx-data-bit: "1"
35547-35573 uart: tx-data-bit: "1"
35365-35573 uart: tx-data: "11000100"
35573-35599 uart: tx-stop: "Stop bit" "Stop" "T"
35856-35882 uart: tx-start: "Start bit" "Start" "S"
35882-35908 uart: tx-data-bit: "1"
35908-35934 uart: tx-data-bit: "0"
35934-35960 uart: tx-data-bit: "1"
35960-35986 uart: tx-data-bit: "0"
35986-36012 uart: tx-data-bit: "0"
36012-36038 uart: tx-data-bit: "0"
36038-36064 uart: tx-data-bit: "1"
36064-36090 uart: tx-data-bit: "1"
35882-36090 uart: tx-data: "11000101"
36090-36116 uart: tx-stop: "Stop bit" "Stop" "T"
36374-36400 uart: tx-start: "Start bit" "Start" "S"
36400-36426 uart: tx-data-bit: "0"
36426-36452 uart: tx-data-bit: "1"
36452-36478 uart: tx-data-bit: "1"
36478-36504 uart: tx-data-bit: "0"
36504-36530 uart: tx-data-bit: "0"
36530-36556 uart: tx-data-bit: "0"
36556-36582 uart: tx-data-bit: "1"
36582-36608 uart: tx-data-bit: "1"
36400-36608 uart: tx-data: "11000110"
36608-36634 uart: tx-stop: "Stop bit" "Stop" "T"
36891-36917 uart: tx-start: "Start bit" "Start" "S"
36917-36943 uart: tx-data-bit: "1"
36943-36969 uart: tx-data-bit: "1"
36969-36995 uart: tx-data-bit: "1"
36995-37021 uart: tx-data-bit: "0"
37021-37047 uart: tx-data-bit: "0"
37047-37073 uart: tx-data-bit: "0"
37073-37099 uart: tx-data-bit: "1"
37099-37125 uart: tx-data-bit: "1"
36917-37125 uart: tx-data: "11000111"
37125-37151 uart: tx-stop: "Stop bit" "Stop" "T"
37407-37433 uart: tx-start: "Start bit" "Start" "S"
37433-37459 uart: tx-data-bit: "0"
37459-37485 uart: tx-data-bit: "0"
37485-37511 uart: tx-data-bit: "0"
37511-37537 uart: tx-data-bit: "1"
37537-37563 uart: tx-data-bit: "0"
37563-37589 uart: tx-data-bit: "0"
37589-37615 uart: tx-data-bit: "1"
37615-37641 uart: tx-data-bit: "1"
37433-37641 uart: tx-data: "11001000"
37641-37667 uart: tx-stop: "Stop bit" "Stop" "T"
37924-37950 uart: tx-start: "Start bit" "Start" "S"
37950-37976 uart: tx-data-bit: "1"
37976-38002 uart: tx-data-bit: "0"
38002-38028 uart: tx-data-bit: "0"
38028-38054 uart: tx-data-bit: "1"
38054-38080 uart: tx-data-bit: "0"
38080-38106 uart: tx-data-bit: "0"
38106-38132 uart: tx-data-bit: "1"
38132-38158 uart: tx-data-bit: "1"
37950-38158 uart: tx-data: "11001001"
38158-38184 uart: tx-stop: "Stop bit" "Stop" "T"
38442-38468 uart: tx-start: "Start bit" "Start" "S"
38468-38494 uart: tx-data-bit: "0"
38494-38520 uart: tx-data-bit: "1"
38520-38546 uart: tx-data-bit: "0"
38546-38572 uart: tx-data-bit: "1"
38572-38598 uart: tx-data-bit: "0"
38598-38624 uart: tx-data-bit: "0"
38624-38650 uart: tx-data-bit: "1"
38650-38676 uart: tx-data-bit: "1"
38468-38676 uart: tx-data: "11001010"
38676-38702 uart: tx-stop: "Stop bit" "Stop" "T"
38961-38987 uart: tx-start: "Start bit" "Start" "S"
38987-39013 uart: tx-data-bit: "1"
39013-39039 uart: tx-data-bit: "1"
39039-39065 uart: tx-data-bit: "0"
39065-39091 uart: tx-data-bit: "1"
39091-39117 uart: tx-data-bit: "0"
39117-39143 uart: tx-data-bit: "0"
39143-39169 uart: tx-data-bit: "1"
39169-39195 uart: tx-data-bit: "1"
38987-39195 uart: tx-data: "11001011"
39195-39221 uart: tx-stop: "Stop bit" "Stop" "T"
39480-39506 uart: tx-start: "Start bit" "Start" "S"
39506-39532 uart: tx-data-bit: "0"
39532-39558 uart: tx-data-bit: "0"
39558-39584 uart: tx-data-bit: "1"
39584-39610 uart: tx-data-bit: "1"
39610-39636 uart: tx-data-bit: "0"
39636-39662 uart: tx-data-bit: "0"
39662-39688 uart: tx-data-bit: "1"
39688-39714 uart: tx-data-bit: "1"
39506-39714 uart: tx-data: "11001100"
39714-39740 uart: tx-stop: "Stop bit" "Stop" "T"
39996-40022 uart: tx-start: "Start bit" "Start" "S"
40022-40048 uart: tx-data-bit: "1"
40048-40074 uart: tx-data-bit: "0"
40074-40100 uart: tx-data-bit: "1"
40100-40126 uart: tx-data-bit: "1"
40126-40152 uart: tx-data-bit: "0"
40152-40178 uart: tx-data-bit: "0"
40178-40204 uart: tx-data-bit: "1"
40204-40230 uart: tx-data-bit: "1"
40022-40230 uart: tx-data: "11001101"
40230-40256 uart: tx-stop: "Stop bit" "Stop" "T"
40515-40541 uart: tx-start: "Start bit" "Start" "S"
40541-40567 uart: tx-data-bit: "0"
40567-40593 uart: tx-data-bit: "1"
40593-40619 uart: tx-data-bit: "1"
40619-40645 uart: tx-data-bit: "1"
40645-40671 uart: tx-data-bit: "0"
40671-40697 uart: tx-data-bit: "0"
40697-40723 uart: tx-data-bit: "1"
40723-40749 uart: tx-data-bit: "1"
40541-40749 uart: tx-data: "11001110"
40749-40775 uart: tx-stop: "Stop bit" "Stop" "T"
41031-41057 uart: tx-start: "Start bit" "Start" "S"
41057-41083 uart: tx-data-bit: "1"
41083-41109 uart: tx-data-bit: "1"
41109-41135 uart: tx-data-bit: "1"
41135-41161 uart: tx-data-bit: "1"
41161-41187 uart: tx-data-bit: "0"
41187-41213 uart: tx-data-bit: "0"
41213-41239 uart: tx-data-bit: "1"
41239-41265 uart: tx-data-bit: "1"
41057-41265 uart: tx-data: "11001111"
41265-41291 uart: tx-stop: "Stop bit" "Stop" "T"
33275-41291 uart: tx-packet: "11000000 11000001 11000010 11000011 11000100 11000101 11000110 11000111 11001000 11001001 11001010 11001011 11001100 11001101 11001110 11001111"
41548-41574 uart: tx-start: "Start bit" "Start" "S"
41574-41600 uart: tx-data-bit: "0"
41600-41626 uart: tx-data-bit: "0"
41626-41652 uart: tx-data-bit: "0"
41652-41678 uart: tx-data-bit: "0"
41678-41704 uart: tx-data-bit: "1"
41704-41730 uart: tx-data-bit: "0"
41730-41756 uart: tx-data-bit: "1"
41756-41782 uart: tx-data-bit: "1"
41574-41782 uart: tx-data: "11010000"
41782-41808 uart: tx-stop: "Stop bit" "Stop" "T"
42065-42091 uart: tx-start: "Start bit" "Start" "S"
42091-42117 uart: tx-data-bit: "1"
42117-42143 uart: tx-data-bit: "0"
42143-42169 uart: tx-data-bit: "0"
42169-42195 uart: tx-data-bit: "0"
42195-42221 uart: tx-data-bit: "1"
42221-42247 uart: tx-data-bit: "0"
42247-42273 uart: tx-data-bit: "1"
42273-42299 uart: tx-data-bit: "1"
42091-42299 uart: tx-data: "11010001"
42299-42325 uart: tx-stop: "Stop bit" "Stop" "T"
42583-42609 uart: tx-start: "Start bit" "Start" "S"
42609-42635 uart: tx-data-bit: "0"
42635-42661 uart: tx-data-bit: "1"
42661-42687 uart: tx-data-bit: "0"
42687-42713 uart: tx-data-bit: "0"
42713-42739 uart: tx-data-bit: "1"
42739-42765 uart: tx-data-bit: "0"
42765-42791 uart: tx-data-bit: "1"
42791-42817 uart: tx-data-bit: "1"
42609-42817 uart: tx-data: "11010010"
42817-42843 uart: tx-stop: "Stop bit" "Stop" "T"
43102-43128 uart: tx-start: "Start bit" "Start" "S"
43128-43154 uart: tx-data-bit: "1"
43154-43180 uart: tx-data-bit: "1"
43180-43206 uart: tx-data-bit: "0"
43206-43232 uart: tx-data-bit: "0"
43232-43258 uart: tx-data-bit: "1"
43258-43284 uart: tx-data-bit: "0"
43284-43310 uart: tx-data-bit: "1"
43310-43336 uart: tx-data-bit: "1"
43128-43336 uart: tx-data: "11010011"
43336-43362 uart: tx-stop: "Stop bit" "Stop" "T"
43620-43646 uart: tx-start: "Start bit" "Start" "S"
43646-43672 uart: tx-data-bit: "0"
43672-43698 uart: tx-data-bit: "0"
43698-43724 uart: tx-data-bit: "1"
43724-43750 uart: tx-data-bit: "0"
43750-43776 uart: tx-data-bit: "1"
43776-43802 uart: tx-data-bit: "0"
43802-43828 uart: tx-data-bit: "1"
43828-43854 uart: tx-data-bit: "1"
43646-43854 uart: tx-data: "11010100"
43854-43880 uart: tx-stop: "Stop bit" "Stop" "T"
44139-44165 uart: tx-start: "Start bit" "Start" "S"
44165-44191 uart: tx-data-bit: "1"
44191-44217 uart: tx-data-bit: "0"
44217-44243 uart: tx-data-bit: "1"
44243-44269 uart: tx-data-bit: "0"
44269-44295 uart: tx-data-bit: "1"
44295-44321 uart: tx-data-bit: "0"
44321-44347 uart: tx-data-bit: "1"
44347-44373 uart: tx-data-bit: "1"
44165-44373 uart: tx-data: "11010101"
44373-44399 uart: tx-stop: "Stop bit" "Stop" "T"
44659-44685 uart: tx-start: "Start bit" "Start" "S"
44685-44711 uart: tx-data-bit: "0"
44711-44737 uart: tx-data-bit: "1"
44737-44763 uart: tx-data-bit: "1"
44763-44789 uart: tx-data-bit: "0"
44789-44815 uart: tx-data-bit: "1"
44815-44841 uart: tx-data-bit: "0"
44841-44867 uart: tx-data-bit: "1"
44867-44893 uart: tx-data-bit: "1"
44685-44893 uart: tx-data: "11010110"
44893-44919 uart: tx-stop: "Stop bit" "Stop" "T"
45178-45204 uart: tx-start: "Start bit" "Start" "S"
45204-45230 uart: tx-data-bit: "1"
45230-45256 uart: tx-data-bit: "1"
45256-45282 uart: tx-data-bit: "1"
45282-45308 uart: tx-data-bit: "0"
45308-45334 uart: tx-data-bit: "1"
45334-45360 uart: tx-data-bit: "0"
45360-45386 uart: tx-data-bit: "1"
45386-45412 uart: tx-data-bit: "1"
45204-45412 uart: tx-data: "11010111"
45412-45438 uart: tx-stop: "Stop bit" "Stop" "T"
45697-45723 uart: tx-start: "Start bit" "Start" "S"
45723-45749 uart: tx-data-bit: "0"
45749-45775 uart: tx-data-bit: "0"
45775-45801 uart: tx-data-bit: "0"
45801-45827 uart: tx-data-bit: "1"
45827-45853 uart: tx-data-bit: "1"
45853-45879 uart: tx-data-bit: "0"
45879-45905 uart: tx-data-bit: "1"
45905-45931 uart: tx-data-bit: "1"
45723-45931 uart: tx-data: "11011000"
45931-45957 uart: tx-stop: "Stop bit" "Stop" "T"
46213-46239 uart: tx-start: "Start bit" "Start" "S"
46239-46265 uart: tx-data-bit: "1"
46265-46291 uart: tx-data-bit: "0"
46291-46317 uart: tx-data-bit: "0"
46317-46343 uart: tx-data-bit: "1"
46343-46369 uart: tx-data-bit: "1"
46369-46395 uart: tx-data-bit: "0"
46395-46421 uart: tx-data-bit: "1"
46421-46447 uart: tx-data-bit: "1"
46239-46447 uart: tx-data: "11011001"
46447-46473 uart: tx-stop: "Stop bit" "Stop" "T"
46732-46758 uart: tx-start: "Start bit" "Start" "S"
46758-46784 uart: tx-data-bit: "0"
46784-46810 uart: tx-data-bit: "1"
46810-46836 uart: tx-data-bit: "0"
46836-46862 uart: tx-data-bit: "1"
46862-46888 uart: tx-data-bit: "1"
46888-46914 uart: tx-data-bit: "0"
46914-46940 uart: tx-data-bit: "1"
46940-46966 uart: tx-data-bit: "1"
46758-46966 uart: tx-data: "11011010"
46966-46992 uart: tx-stop: "Stop bit" "Stop" "T"
47250-47276 uart: tx-start: "Start bit" "Start" "S"
47276-47302 uart: tx-data-bit: "1"
47302-47328 uart: tx-data-bit: "1"
47328-47354 uart: tx-data-bit: "0"
47354-47380 uart: tx-data-bit: "1"
47380-47406 uart: tx-data-bit: "1"
47406-47432 uart: tx-data-bit: "0"
47432-47458 uart: tx-data-bit: "1"
47458-47484 uart: tx-data-bit: "1"
47276-47484 uart: tx-data: "11011011"
47484-47510 uart: tx-stop: "Stop bit" "Stop" "T"
47769-47795 uart: tx-start: "Start bit" "Start" "S"
47795-47821 uart: tx-data-bit: "0"
47821-47847 uart: tx-data-bit: "0"
47847-47873 uart: tx-data-bit: "1"
47873-47899 uart: tx-data-bit: "1"
47899-47925 uart: tx-data-bit: "1"
47925-47951 uart: tx-data-bit: "0"
47951-47977 uart: tx-data-bit: "1"
47977-48003 uart: tx-data-bit: "1"
47795-48003 uart: tx-data: "11011100"
48003-48029 uart: tx-stop: "Stop bit" "Stop" "T"
48286-48312 uart: tx-start: "Start bit" "Start" "S"
48312-48338 uart: tx-data-bit: "1"
48338-48364 uart: tx-data-bit: "0"
48364-48390 uart: tx-data-bit: "1"
48390-48416 uart: tx-data-bit: "1"
48416-48442 uart: tx-data-bit: "1"
48442-48468 uart: tx-data-bit: "0"
48468-48494 uart: tx-data-bit: "1"
48494-48520 uart: tx-data-bit: "1"
48312-48520 uart: tx-data: "11011101"
48520-48546 uart: tx-stop: "Stop bit" "Stop" "T"
48804-48830 uart: tx-start: "Start bit" "Start" "S"
48830-48856 uart: tx-data-bit: "0"
48856-48882 uart: tx-data-bit: "1"
48882-48908 uart: tx-data-bit: "1"
48908-48934 uart: tx-data-bit: "1"
48934-48960 uart: tx-data-bit: "1"
48960-48986 uart: tx-data-bit: "0"
48986-49012 uart: tx-data-bit: "1"
49012-49038 uart: tx-data-bit: "1"
48830-49038 uart: tx-data: "11011110"
49038-49064 uart: tx-stop: "Stop bit" "Stop" "T"
49321-49347 uart: tx-start: "Start bit" "Start" "S"
49347-49373 uart: tx-data-bit: "1"
49373-49399 uart: tx-data-bit: "1"
49399-49425 uart: tx-data-bit: "1"
49425-49451 uart: tx-data-bit: "1"
49451-49477 uart: tx-data-bit: "1"
49477-49503 uart: tx-data-bit: "0"
49503-49529 uart: tx-data-bit: "1"
49529-49555 uart: tx-data-bit: "1"
49347-49555 uart: tx-data: "11011111"
49555-49581 uart: tx-stop: "Stop bit" "Stop" "T"
41548-49581 uart: tx-packet: "11010000 11010001 11010010 11010011 11010100 11010101 11010110 11010111 11011000 11011001 11011010 11011011 11011100 11011101 11011110 11011111"
49837-49863 uart: tx-start: "Start bit" "Start" "S"
49863-49889 uart: tx-data-bit: "0"
49889-49915 uart: tx-data-bit: "0"
49915-49941 uart: tx-data-bit: "0"
49941-49967 uart: tx-data-bit: "0"
49967-49993 uart: tx-data-bit: "0"
49993-50019 uart: tx-data-bit: "1"
50019-50045 uart: tx-data-bit: "1"
50045-50071 uart: tx-data-bit: "1"
49863-50071 uart: tx-data: "11100000"
50071-50097 uart: tx-stop: "Stop bit" "Stop" "T"
50352-50378 uart: tx-start: "Start bit" "Start" "S"
50378-50404 uart: tx-data-bit: "1"
50404-50430 uart: tx-data-bit: "0"
50430-50456 uart: tx-data-bit: "0"
50456-50482 uart: tx-data-bit: "0"
50482-50508 uart: tx-data-bit: "0"
50508-50534 uart: tx-data-bit: "1"
50534-50560 uart: tx-data-bit: "1"
50560-50586 uart: tx-data-bit: "1"
50378-50586 uart: tx-data: "11100001"
50586-50612 uart: tx-stop: "Stop bit" "Stop" "T"
50868-50894 uart: tx-start: "Start bit" "Start" "S"
50894-50920 uart: tx-data-bit: "0"
50920-50946 uart: tx-data-bit: "1"
50946-50972 uart: tx-data-bit: "0"
50972-50998 uart: tx-data-bit: "0"
50998-51024 uart: tx-data-bit: "0"
51024-51050 uart: tx-data-bit: "1"
51050-51076 uart: tx-data-bit: "1"
51076-51102 uart: tx-data-bit: "1"
50894-51102 uart: tx-data: "11100010"
51102-51128 uart: tx-stop: "Stop bit" "Stop" "T"
51385-51411 uart: tx-start: "Start bit" "Start" "S"
51411-51437 uart: tx-data-bit: "1"
51437-51463 uart: tx-data-bit: "1"
51463-51489 uart: tx-data-bit: "0"
51489-51515 uart: tx-data-bit: "0"
51515-51541 uart: tx-data-bit: "0"
51541-51567 uart: tx-data-bit: "1"
51567-51593 uart: tx-data-bit: "1"
51593-51619 uart: tx-data-bit: "1"
51411-51619 uart: tx-data: "11100011"
51619-51645 uart: tx-stop: "Stop bit" "Stop" "T"
51902-51928 uart: tx-start: "Start bit" "Start" "S"
51928-51954 uart: tx-data-bit: "0"
51954-51980 uart: tx-data-bit: "0"
51980-52006 uart: tx-data-bit: "1"
52006-52032 uart: tx-data-bit: "0"
52032-52058 uart: tx-data-bit: "0"
52058-52084 uart: tx-data-bit: "1"
52084-52110 uart: tx-data-bit: "1"
52110-52136 uart: tx-data-bit: "1"
51928-52136 uart: tx-data: "11100100"
52136-52162 uart: tx-stop: "Stop bit" "Stop" "T"
52418-52444 uart: tx-start: "Start bit" "Start" "S"
52444-52470 uart: tx-data-bit: "1"
52470-52496 uart: tx-data-bit: "0"
52496-52522 uart: tx-data-bit: "1"
52522-52548 uart: tx-data-bit: "0"
52548-52574 uart: tx-data-bit: "0"
52574-52600 uart: tx-data-bit: "1"
52600-52626 uart: tx-data-bit: "1"
52626-52652 uart: tx-data-bit: "1"
52444-52652 uart: tx-data: "11100101"
52652-52678 uart: tx-stop: "Stop bit" "Stop" "T"
52937-52963 uart: tx-start: "Start bit" "Start" "S"
52963-52989 uart: tx-data-bit: "0"
52989-53015 uart: tx-data-bit: "1"
53015-53041 uart: tx-data-bit: "1"
53041-53067 uart: tx-data-bit: "0"
53067-53093 uart: tx-data-bit: "0"
53093-53119 uart: tx-data-bit: "1"
53119-53145 uart: tx-data-bit: "1"
53145-53171 uart: tx-data-bit: "1"
52963-53171 uart: tx-data: "11100110"
53171-53197 uart: tx-stop: "Stop bit" "Stop" "T"
53453-53479 uart: tx-start: "Start bit" "Start" "S"
53479-53505 uart: tx-data-bit: "1"
53505-53531 uart: tx-data-bit: "1"
53531-53557 uart: tx-data-bit: "1"
53557-53583 uart: tx-data-bit: "0"
53583-53609 uart: tx-data-bit: "0"
53609-53635 uart: tx-data-bit: "1"
53635-53661 uart: tx-data-bit: "1"
53661-53687 uart: tx-data-bit: "1"
53479-53687 uart: tx-data: "11100111"
53687-53713 uart: tx-stop: "Stop bit" "Stop" "T"
53970-53996 uart: tx-start: "Start bit" "Start" "S"
53996-54022 uart: tx-data-bit: "0"
54022-54048 uart: tx-data-bit: "0"
54048-54074 uart: tx-data-bit: "0"
54074-54100 uart: tx-data-bit: "1"
54100-54126 uart: tx-data-bit: "0"
54126-54152 uart: tx-data-bit: "1"
54152-54178 uart: tx-data-bit: "1"
54178-54204 uart: tx-data-bit: "1"
53996-54204 uart: tx-data: "11101000"
54204-54230 uart: tx-stop: "Stop bit" "Stop" "T"
54487-54513 uart: tx-start: "Start bit" "Start" "S"
54513-54539 uart: tx-data-bit: "1"
54539-54565 uart: tx-data-bit: "0"
54565-54591 uart: tx-data-bit: "0"
54591-54617 uart: tx-data-bit: "1"
54617-54643 uart: tx-data-bit: "0"
54643-54669 uart: tx-data-bit: "1"
54669-54695 uart: tx-data-bit: "1"
54695-54721 uart: tx-data-bit: "1"
54513-54721 uart: tx-data: "11101001"
54721-54747 uart: tx-stop: "Stop bit" "Stop" "T"
55005-55031 uart: tx-start: "Start bit" "Start" "S"
55031-55057 uart: tx-data-bit: "0"
55057-55083 uart: tx-data-bit: "1"
55083-55109 uart: tx-data-bit: "0"
55109-55135 uart: tx-data-bit: "1"
55135-55161 uart: tx-data-bit: "0"
55161-55187 uart: tx-data-bit: "1"
55187-55213 uart: tx-data-bit: "1"
55213-55239 uart: tx-data-bit: "1"
55031-55239 uart: tx-data: "11101010"
55239-55265 uart: tx-stop: "Stop bit" "Stop" "T"
55524-55550 uart: tx-start: "Start bit" "Start" "S"
55550-55576 uart: tx-data-bit: "1"
55576-55602 uart: tx-data-bit: "1"
55602-55628 uart: tx-data-bit: "0"
55628-55654 uart: tx-data-bit: "1"
55654-55680 uart: tx-data-bit: "0"
55680-55706 uart: tx-data-bit: "1"
55706-55732 uart: tx-data-bit: "1"
55732-55758 uart: tx-data-bit: "1"
55550-55758 uart: tx-data: "11101011"
55758-55784 uart: tx-stop: "Stop bit" "Stop" "T"
56042-56068 uart: tx-start: "Start bit" "Start" "S"
56068-56094 uart: tx-data-bit: "0"
56094-56120 uart: tx-data-bit: "0"
56120-56146 uart: tx-data-bit: "1"
56146-56172 uart: tx-data-bit: "1"
56172-56198 uart: tx-data-bit: "0"
56198-56224 uart: tx-data-bit: "1"
56224-56250 uart: tx-data-bit: "1"
56250-56276 uart: tx-data-bit: "1"
56068-56276 uart: tx-data: "11101100"
56276-56302 uart: tx-stop: "Stop bit" "Stop" "T"
56559-56585 uart: tx-start: "Start bit" "Start" "S"
56585-56611 uart: tx-data-bit: "1"
56611-56637 uart: tx-data-bit: "0"
56637-56663 uart: tx-data-bit: "1"
56663-56689 uart: tx-data-bit: "1"
56689-56715 uart: tx-data-bit: "0"
56715-56741 uart: tx-data-bit: "1"
56741-56767 uart: tx-data-bit: "1"
56767-56793 uart: tx-data-bit: "1"
56585-56793 uart: tx-data: "11101101"
56793-56819 uart: tx-stop: "Stop bit" "Stop" "T"
57077-57103 uart: tx-start: "Start bit" "Start" "S"
57103-57129 uart: tx-data-bit: "0"
57129-57155 uart: tx-data-bit: "1"
57155-57181 uart: tx-data-bit: "1"
57181-57207 uart: tx-data-bit: "1"
57207-57233 uart: tx-data-bit: "0"
57233-57259 uart: tx-data-bit: "1"
57259-57285 uart: tx-data-bit: "1"
57285-57311 uart: tx-data-bit: "1"
57103-57311 uart: tx-data: "11101110"
57311-57337 uart: tx-stop: "Stop bit" "Stop" "T"
57594-57620 uart: tx-start: "Start bit" "Start" "S"
57620-57646 uart: tx-data-bit: "1"
57646-57672 uart: tx-data-bit: "1"
57672-57698 uart: tx-data-bit: "1"
57698-57724 uart: tx-data-bit: "1"
57724-57750 uart: tx-data-bit: "0"
57750-57776 uart: tx-data-bit: "1"
57776-57802 uart: tx-data-bit: "1"
57802-57828 uart: tx-data-bit: "1"
57620-57828 uart: tx-data: "11101111"
57828-57854 uart: tx-stop: "Stop bit" "Stop" "T"
49837-57854 uart: tx-packet: "11100000 11100001 11100010 11100011 11100100 11100101 11100110 11100111 11101000 11101001 11101010 11101011 11101100 11101101 11101110 11101111"
58111-58137 uart: tx-start: "Start bit" "Start" "S"
58137-58163 uart: tx-data-bit: "0"
58163-58189 uart: tx-data-bit: "0"
58189-58215 uart: tx-data-bit: "0"
58215-58241 uart: tx-data-bit: "0"
58241-58267 uart: tx-data-bit: "1"
58267-58293 uart: tx-data-bit: "1"
58293-58319 uart: tx-data-bit: "1"
58319-58345 uart: tx-data-bit: "1"
58137-58345 uart: tx-data: "11110000"
58345-58371 uart: tx-stop: "Stop bit" "Stop" "T"
58625-58651 uart: tx-start: "Start bit" "Start" "S"
58651-58677 uart: tx-data-bit: "1"
58677-58703 uart: tx-data-bit: "0"
58703-58729 uart: tx-data-bit: "0"
58729-58755 uart: tx-data-bit: "0"
58755-58781 uart: tx-data-bit: "1"
58781-58807 uart: tx-data-bit: "1"
58807-58833 uart: tx-data-bit: "1"
58833-58859 uart: tx-data-bit: "1"
58651-58859 uart: tx-data: "11110001"
58859-58885 uart: tx-stop: "Stop bit" "Stop" "T"
59142-59168 uart: tx-start: "Start bit" "Start" "S"
59168-59194 uart: tx-data-bit: "0"
59194-59220 uart: tx-data-bit: "1"
59220-59246 uart: tx-data-bit: "0"
59246-59272 uart: tx-data-bit: "0"
59272-59298 uart: tx-data-bit: "1"
59298-59324 uart: tx-data-bit: "1"
59324-59350 uart: tx-data-bit: "1"
59350-59376 uart: tx-data-bit: "1"
59168-59376 uart: tx-data: "11110010"
59376-59402 uart: tx-stop: "Stop bit" "Stop" "T"
59659-59685 uart: tx-start: "Start bit" "Start" "S"
59685-59711 uart: tx-data-bit: "1"
59711-59737 uart: tx-data-bit: "1"
59737-59763 uart: tx-data-bit: "0"
59763-59789 uart: tx-data-bit: "0"
59789-59815 uart: tx-data-bit: "1"
59815-59841 uart: tx-data-bit: "1"
59841-59867 uart: tx-data-bit: "1"
59867-59893 uart: tx-data-bit: "1"
59685-59893 uart: tx-data: "11110011"
59893-59919 uart: tx-stop: "Stop bit" "Stop" "T"
60176-60202 uart: tx-start: "Start bit" "Start" "S"
60202-60228 uart: tx-data-bit: "0"
60228-60254 uart: tx-data-bit: "0"
60254-60280 uart: tx-data-bit: "1"
60280-60306 uart: tx-data-bit: "0"
60306-60332 uart: tx-data-bit: "1"
60332-60358 uart: tx-data-bit: "1"
60358-60384 uart: tx-data-bit: "1"
60384-60410 uart: tx-data-bit: "1"
60202-60410 uart: tx-data: "11110100"
60410-60436 uart: tx-stop: "Stop bit" "Stop" "T"
60693-60719 uart: tx-start: "Start bit" "Start" "S"
60719-60745 uart: tx-data-bit: "1"
60745-60771 uart: tx-data-bit: "0"
60771-60797 uart: tx-data-bit: "1"
60797-60823 uart: tx-data-bit: "0"
60823-60849 uart: tx-data-bit: "1"
60849-60875 uart: tx-data-bit: "1"
60875-60901 uart: tx-data-bit: "1"
60901-60927 uart: tx-data-bit: "1"
60719-60927 uart: tx-data: "11110101"
60927-60953 uart: tx-stop: "Stop bit" "Stop" "T"
61211-61237 uart: tx-start: "Start bit" "Start" "S"
61237-61263 uart: tx-data-bit: "0"
61263-61289 uart: tx-data-bit: "1"
61289-61315 uart: tx-data-bit: "1"
61315-61341 uart: tx-data-bit: "0"
61341-61367 uart: tx-data-bit: "1"
61367-61393 uart: tx-data-bit: "1"
61393-61419 uart: tx-data-bit: "1"
61419-61445 uart: tx-data-bit: "1"
61237-61445 uart: tx-data: "11110110"
61445-61471 uart: tx-stop: "Stop bit" "Stop" "T"
61728-61754 uart: tx-start: "Start bit" "Start" "S"
61754-61780 uart: tx-data-bit: "1"
61780-61806 uart: tx-data-bit: "1"
61806-61832 uart: tx-data-bit: "1"
61832-61858 uart: tx-data-bit: "0"
61858-61884 uart: tx-data-bit: "1"
61884-61910 uart: tx-data-bit: "1"
61910-61936 uart: tx-data-bit: "1"
61936-61962 uart: tx-data-bit: "1"
61754-61962 uart: tx-data: "11110111"
61962-61988 uart: tx-stop: "Stop bit" "Stop" "T"
62244-62270 uart: tx-start: "Start bit" "Start" "S"
62270-62296 uart: tx-data-bit: "0"
62296-62322 uart: tx-data-bit: "0"
62322-62348 uart: tx-data-bit: "0"
62348-62374 uart: tx-data-bit: "1"
62374-62400 uart: tx-data-bit: "1"
62400-62426 uart: tx-data-bit: "1"
62426-62452 uart: tx-data-bit: "1"
62452-62478 uart: tx-data-bit: "1"
62270-62478 uart: tx-data: "11111000"
62478-62504 uart: tx-stop: "Stop bit" "Stop" "T"
62759-62785 uart: tx-start: "Start bit" "Start" "S"
62785-62811 uart: tx-data-bit: "1"
62811-62837 uart: tx-data-bit: "0"
62837-62863 uart: tx-data-bit: "0"
62863-62889 uart: tx-data-bit: "1"
62889-62915 uart: tx-data-bit: "1"
62915-62941 uart: tx-data-bit: "1"
62941-62967 uart: tx-data-bit: "1"
62967-62993 uart: tx-data-bit: "1"
62785-62993 uart: tx-data: "11111001"
62993-63019 uart: tx-stop: "Stop bit" "Stop" "T"
63276-63302 uart: tx-start: "Start bit" "Start" "S"
63302-63328 uart: tx-data-bit: "0"
63328-63354 uart: tx-data-bit: "1"
63354-63380 uart: tx-data-bit: "0"
63380-63406 uart: tx-data-bit: "1"
63406-63432 uart: tx-data-bit: "1"
63432-63458 uart: tx-data-bit: "1"
63458-63484 uart: tx-data-bit: "1"
63484-63510 uart: tx-data-bit: "1"
63302-63510 uart: tx-data: "11111010"
63510-63536 uart: tx-stop: "Stop bit" "Stop" "T"
63792-63818 uart: tx-start: "Start bit" "Start" "S"
63818-63844 uart: tx-data-bit: "1"
63844-63870 uart: tx-data-bit: "1"
63870-63896 uart: tx-data-bit: "0"
63896-63922 uart: tx-data-bit: "1"
63922-63948 uart: tx-data-bit: "1"
63948-63974 uart: tx-data-bit: "1"
63974-64000 uart: tx-data-bit: "1"
64000-64026 uart: tx-data-bit: "1"
63818-64026 uart: tx-data: "11111011"
64026-64052 uart: tx-stop: "Stop bit" "Stop" "T"
64309-64335 uart: tx-start: "Start bit" "Start" "S"
64335-64361 uart: tx-data-bit: "0"
64361-64387 uart: tx-data-bit: "0"
64387-64413 uart: tx-data-bit: "1"
64413-64439 uart: tx-data-bit: "1"
64439-64465 uart: tx-data-bit: "1"
64465-64491 uart: tx-data-bit: "1"
64491-64517 uart: tx-data-bit: "1"
64517-64543 uart: tx-data-bit: "1"
64335-64543 uart: tx-data: "11111100"
64543-64569 uart: tx-stop: "Stop bit" "Stop" "T"
64823-64849 uart: tx-start: "Start bit" "Start" "S"
64849-64875 uart: tx-data-bit: "1"
64875-64901 uart: tx-data-bit: "0"
64901-64927 uart: tx-data-bit: "1"
64927-64953 uart: tx-data-bit: "1"
64953-64979 uart: tx-data-bit: "1"
64979-65005 uart: tx-data-bit: "1"
65005-65031 uart: tx-data-bit: "1"
65031-65057 uart: tx-data-bit: "1"
64849-65057 uart: tx-data: "11111101"
65057-65083 uart: tx-stop: "Stop bit" "Stop" "T"
65340-65366 uart: tx-start: "Start bit" "Start" "S"
65366-65392 uart: tx-data-bit: "0"
65392-65418 uart: tx-data-bit: "1"
65418-65444 uart: tx-data-bit: "1"
65444-65470 uart: tx-data-bit: "1"
65470-65496 uart: tx-data-bit: "1"
65496-65522 uart: tx-data-bit: "1"
65522-65548 uart: tx-data-bit: "1"
65548-65574 uart: tx-data-bit: "1"
65366-65574 uart: tx-data: "11111110"
65574-65600 uart: tx-stop: "Stop bit" "Stop" "T"
65854-65880 uart: tx-start: "Start bit" "Start" "S"
65880-65906 uart: tx-data-bit: "1"
65906-65932 uart: tx-data-bit: "1"
65932-65958 uart: tx-data-bit: "1"
65958-65984 uart: tx-data-bit: "1"
65984-66010 uart: tx-data-bit: "1"
66010-66036 uart: tx-data-bit: "1"
66036-66062 uart: tx-data-bit: "1"
66062-66088 uart: tx-data-bit: "1"
65880-66088 uart: tx-data: "11111111"
66088-66114 uart: tx-stop: "Stop bit" "Stop" "T"
58111-66114 uart: tx-packet: "11110000 11110001 11110010 11110011 11110100 11110101 11110110 11110111 11111000 11111001 11111010 11111011 11111100 11111101 11111110 11111111"
66369-66395 uart: tx-start: "Start bit" "Start" "S"
66395-66421 uart: tx-data-bit: "0"
66421-66447 uart: tx-data-bit: "0"
66447-66473 uart: tx-data-bit: "0"
66473-66499 uart: tx-data-bit: "0"
66499-66525 uart: tx-data-bit: "0"
66525-66551 uart: tx-data-bit: "0"
66551-66577 uart: tx-data-bit: "0"
66577-66603 uart: tx-data-bit: "0"
66395-66603 uart: tx-data: "00000000"
66603-66629 uart: tx-stop: "Stop bit" "Stop" "T"
66884-66910 uart: tx-start: "Start bit" "Start" "S"
66910-66936 uart: tx-data-bit: "1"
66936-66962 uart: tx-data-bit: "0"
66962-66988 uart: tx-data-bit: "0"
66988-67014 uart: tx-data-bit: "0"
67014-67040 uart: tx-data-bit: "0"
67040-67066 uart: tx-data-bit: "0"
67066-67092 uart: tx-data-bit: "0"
67092-67118 uart: tx-data-bit: "0"
66910-67118 uart: tx-data: "00000001"
67118-67144 uart: tx-stop: "Stop bit" "Stop" "T"
67400-67426 uart: tx-start: "Start bit" "Start" "S"
67426-67452 uart: tx-data-bit: "0"
67452-67478 uart: tx-data-bit: "1"
67478-67504 uart: tx-data-bit: "0"
67504-67530 uart: tx-data-bit: "0"
67530-67556 uart: tx-data-bit: "0"
67556-67582 uart: tx-data-bit: "0"
67582-67608 uart: tx-data-bit: "0"
67608-67634 uart: tx-data-bit: "0"
67426-67634 uart: tx-data: "00000010"
67634-67660 uart: tx-stop: "Stop bit" "Stop" "T"
67917-67943 uart: tx-start: "Start bit" "Start" "S"
67943-67969 uart: tx-data-bit: "1"
67969-67995 uart: tx-data-bit: "1"
67995-68021 uart: tx-data-bit: "0"
68021-68047 uart: tx-data-bit: "0"
68047-68073 uart: tx-data-bit: "0"
68073-68099 uart: tx-data-bit: "0"
68099-68125 uart: tx-data-bit: "0"
68125-68151 uart: tx-data-bit: "0"
67943-68151 uart: tx-data: "00000011"
68151-68177 uart: tx-stop: "Stop bit" "Stop" "T"
68433-68459 uart: tx-start: "Start bit" "Start" "S"
68459-68485 uart: tx-data-bit: "0"
68485-68511 uart: tx-data-bit: "0"
68511-68537 uart: tx-data-bit: "1"
68537-68563 uart: tx-data-bit: "0"
68563-68589 uart: tx-data-bit: "0"
68589-68615 uart: tx-data-bit: "0"
68615-68641 uart: tx-data-bit: "0"
68641-68667 uart: tx-data-bit: "0"
68459-68667 uart: tx-data: "00000100"
68667-68693 uart: tx-stop: "Stop bit" "Stop" "T"
68950-68976 uart: tx-start: "Start bit" "Start" "S"
68976-69002 uart: tx-data-bit: "1"
69002-69028 uart: tx-data-bit: "0"
69028-69054 uart: tx-data-bit: "1"
69054-69080 uart: tx-data-bit: "0"
69080-69106 uart: tx-data-bit: "0"
69106-69132 uart: tx-data-bit: "0"
69132-69158 uart: tx-data-bit: "0"
69158-69184 uart: tx-data-bit: "0"
68976-69184 uart: tx-data: "00000101"
69184-69210 uart: tx-stop: "Stop bit" "Stop" "T"
69469-69495 uart: tx-start: "Start bit" "Start" "S"
69495-69521 uart: tx-data-bit: "0"
69521-69547 uart: tx-data-bit: "1"
69547-69573 uart: tx-data-bit: "1"
69573-69599 uart: tx-data-bit: "0"
69599-69625 uart: tx-data-bit: "0"
69625-69651 uart: tx-data-bit: "0"
69651-69677 uart: tx-data-bit: "0"
69677-69703 uart: tx-data-bit: "0"
69495-69703 uart: tx-data: "00000110"
69703-69729 uart: tx-stop: "Stop bit" "Stop" "T"
69985-70011 uart: tx-start: "Start bit" "Start" "S"
70011-70037 uart: tx-data-bit: "1"
70037-70063 uart: tx-data-bit: "1"
70063-70089 uart: tx-data-bit: "1"
70089-70115 uart: tx-data-bit: "0"
70115-70141 uart: tx-data-bit: "0"
70141-70167 uart: tx-data-bit: "0"
70167-70193 uart: tx-data-bit: "0"
70193-70219 uart: tx-data-bit: "0"
70011-70219 uart: tx-data: "00000111"
70219-70245 uart: tx-stop: "Stop bit" "Stop" "T"
70502-70528 uart: tx-start: "Start bit" "Start" "S"
70528-70554 uart: tx-data-bit: "0"
70554-70580 uart: tx-data-bit: "0"
70580-70606 uart: tx-data-bit: "0"
70606-70632 uart: tx-data-bit: "1"
70632-70658 uart: tx-data-bit: "0"
70658-70684 uart: tx-data-bit: "0"
70684-70710 uart: tx-data-bit: "0"
70710-70736 uart: tx-data-bit: "0"
70528-70736 uart: tx-data: "00001000"
70736-70762 uart: tx-stop: "Stop bit" "Stop" "T"
71018-71044 uart: tx-start: "Start bit" "Start" "S"
71044-71070 uart: tx-data-bit: "1"
71070-71096 uart: tx-data-bit: "0"
71096-71122 uart: tx-data-bit: "0"
71122-71148 uart: tx-data-bit: "1"
71148-71174 uart: tx-data-bit: "0"
71174-71200 uart: tx-data-bit: "0"
71200-71226 uart: tx-data-bit: "0"
71226-71252 uart: tx-data-bit: "0"
71044-71252 uart: tx-data: "00001001"
71252-71278 uart: tx-stop: "Stop bit" "Stop" "T"
71537-71563 uart: tx-start: "Start bit" "Start" "S"
71563-71589 uart: tx-data-bit: "0"
71589-71615 uart: tx-data-bit: "1"
71615-71641 uart: tx-data-bit: "0"
71641-71667 uart: tx-data-bit: "1"
71667-71693 uart: tx-data-bit: "0"
71693-71719 uart: tx-data-bit: "0"
71719-71745 uart: tx-data-bit: "0"
71745-71771 uart: tx-data-bit: "0"
71563-71771 uart: tx-data: "00001010"
71771-71797 uart: tx-stop: "Stop bit" "Stop" "T"
72055-72081 uart: tx-start: "Start bit" "Start" "S"
72081-72107 uart: tx-data-bit: "1"
72107-72133 uart: tx-data-bit: "1"
72133-72159 uart: tx-data-bit: "0"
72159-72185 uart: tx-data-bit: "1"
72185-72211 uart: tx-data-bit: "0"
72211-72237 uart: tx-data-bit: "0"
72237-72263 uart: tx-data-bit: "0"
72263-72289 uart: tx-data-bit: "0"
72081-72289 uart: tx-data: "00001011"
72289-72315 uart: tx-stop: "Stop bit" "Stop" "T"
72574-72600 uart: tx-start: "Start bit" "Start" "S"
72600-72626 uart: tx-data-bit: "0"
72626-72652 uart: tx-data-bit: "0"
72652-72678 uart: tx-data-bit: "1"
72678-72704 uart: tx-data-bit: "1"
72704-72730 uart: tx-data-bit: "0"
72730-72756 uart: tx-data-bit: "0"
72756-72782 uart: tx-data-bit: "0"
72782-72808 uart: tx-data-bit: "0"
72600-72808 uart: tx-data: "00001100"
72808-72834 uart: tx-stop: "Stop bit" "Stop" "T"
73091-73117 uart: tx-start: "Start bit" "Start" "S"
73117-73143 uart: tx-data-bit: "1"
73143-73169 uart: tx-data-bit: "0"
73169-73195 uart: tx-data-bit: "1"
73195-73221 uart: tx-data-bit: "1"
73221-73247 uart: tx-data-bit: "0"
73247-73273 uart: tx-data-bit: "0"
73273-73299 uart: tx-data-bit: "0"
73299-73325 uart: tx-data-bit: "0"
73117-73325 uart: tx-data: "00001101"
73325-73351 uart: tx-stop: "Stop bit" "Stop" "T"
73609-73635 uart: tx-start: "Start bit" "Start" "S"
73635-73661 uart: tx-data-bit: "0"
73661-73687 uart: tx-data-bit: "1"
73687-73713 uart: tx-data-bit: "1"
73713-73739 uart: tx-data-bit: "1"
73739-73765 uart: tx-data-bit: "0"
73765-73791 uart: tx-data-bit: "0"
73791-73817 uart: tx-data-bit: "0"
73817-73843 uart: tx-data-bit: "0"
73635-73843 uart: tx-data: "00001110"
73843-73869 uart: tx-stop: "Stop bit" "Stop" "T"
74126-74152 uart: tx-start: "Start bit" "Start" "S"
74152-74178 uart: tx-data-bit: "1"
74178-74204 uart: tx-data-bit: "1"
74204-74230 uart: tx-data-bit: "1"
74230-74256 uart: tx-data-bit: "1"
74256-74282 uart: tx-data-bit: "0"
74282-74308 uart: tx-data-bit: "0"
74308-74334 uart: tx-data-bit: "0"
74334-74360 uart: tx-data-bit: "0"
74152-74360 uart: tx-data: "00001111"
74360-74386 uart: tx-stop: "Stop bit" "Stop" "T"
66369-74386 uart: tx-packet: "00000000 00000001 00000010 00000011 00000100 00000101 00000110 00000111 00001000 00001001 00001010 00001011 00001100 00001101 00001110 00001111"
74642-74668 uart: tx-start: "Start bit" "Start" "S"
74668-74694 uart: tx-data-bit: "0"
74694-74720 uart: tx-data-bit: "0"
74720-74746 uart: tx-data-bit: "0"
74746-74772 uart: tx-data-bit: "0"
74772-74798 uart: tx-data-bit: "1"
74798-74824 uart: tx-data-bit: "0"
74824-74850 uart: tx-data-bit: "0"
74850-74876 uart: tx-data-bit: "0"
74668-74876 uart: tx-data: "00010000"
74876-74902 uart: tx-stop: "Stop bit" "Stop" "T"
75159-75185 uart: tx-start: "Start bit" "Start" "S"
75185-75211 uart: tx-data-bit: "1"
75211-75237 uart: tx-data-bit: "0"
75237-75263 uart: tx-data-bit: "0"
75263-75289 uart: tx-data-bit: "0"
75289-75315 uart: tx-data-bit: "1"
75315-75341 uart: tx-data-bit: "0"
75341-75367 uart: tx-data-bit: "0"
75367-75393 uart: tx-data-bit: "0"
75185-75393 uart: tx-data: "00010001"
75393-75419 uart: tx-stop: "Stop bit" "Stop" "T"
75678-75704 uart: tx-start: "Start bit" "Start" "S"
75704-75730 uart: tx-data-bit: "0"
75730-75756 uart: tx-data-bit: "1"
75756-75782 uart: tx-data-bit: "0"
75782-75808 uart: tx-data-bit: "0"
75808-75834 uart: tx-data-bit: "1"
75834-75860 uart: tx-data-bit: "0"
75860-75886 uart: tx-data-bit: "0"
75886-75912 uart: tx-data-bit: "0"
75704-75912 uart: tx-data: "00010010"
75912-75938 uart: tx-stop: "Stop bit" "Stop" "T"
76196-76222 uart: tx-start: "Start bit" "Start" "S"
76222-76248 uart: tx-data-bit: "1"
76248-76274 uart: tx-data-bit: "1"
76274-76300 uart: tx-data-bit: "0"
76300-76326 uart: tx-data-bit: "0"
76326-76352 uart: tx-data-bit: "1"
76352-76378 uart: tx-data-bit: "0"
76378-76404 uart: tx-data-bit: "0"
76404-76430 uart: tx-data-bit: "0"
76222-76430 uart: tx-data: "00010011"
76430-76456 uart: tx-stop: "Stop bit" "Stop" "T"
76715-76741 uart: tx-start: "Start bit" "Start" "S"
76741-76767 uart: tx-data-bit: "0"
76767-76793 uart: tx-data-bit: "0"
76793-76819 uart: tx-data-bit: "1"
76819-76845 uart: tx-data-bit: "0"
76845-76871 uart: tx-data-bit: "1"
76871-76897 uart: tx-data-bit: "0"
76897-76923 uart: tx-data-bit: "0"
76923-76949 uart: tx-data-bit: "0"
76741-76949 uart: tx-data: "00010100"
76949-76975 uart: tx-stop: "Stop bit" "Stop" "T"
77233-77259 uart: tx-start: "Start bit" "Start" "S"
77259-77285 uart: tx-data-bit: "1"
77285-77311 uart: tx-data-bit: "0"
77311-77337 uart: tx-data-bit: "1"
77337-77363 uart: tx-data-bit: "0"
77363-77389 uart: tx-data-bit: "1"
77389-77415 uart: tx-data-bit: "0"
77415-77441 uart: tx-data-bit: "0"
77441-77467 uart: tx-data-bit: "0"
77259-77467 uart: tx-data: "00010101"
77467-77493 uart: tx-stop: "Stop bit" "Stop" "T"
77754-77780 uart: tx-start: "Start bit" "Start" "S"
77780-77806 uart: tx-data-bit: "0"
77806-77832 uart: tx-data-bit: "1"
77832-77858 uart: tx-data-bit: "1"
77858-77884 uart: tx-data-bit: "0"
77884-77910 uart: tx-data-bit: "1"
77910-77936 uart: tx-data-bit: "0"
77936-77962 uart: tx-data-bit: "0"
77962-77988 uart: tx-data-bit: "0"
77780-77988 uart: tx-data: "00010110"
77988-78014 uart: tx-stop: "Stop bit" "Stop" "T"
78272-78298 uart: tx-start: "Start bit" "Start" "S"
78298-78324 uart: tx-data-bit: "1"
78324-78350 uart: tx-data-bit: "1"
78350-78376 uart: tx-data-bit: "1"
78376-78402 uart: tx-data-bit: "0"
78402-78428 uart: tx-data-bit: "1"
78428-78454 uart: tx-data-bit: "0"
78454-78480 uart: tx-data-bit: "0"
78480-78506 uart: tx-data-bit: "0"
78298-78506 uart: tx-data: "00010111"
78506-78532 uart: tx-stop: "Stop bit" "Stop" "T"
78791-78817 uart: tx-start: "Start bit" "Start" "S"
78817-78843 uart: tx-data-bit: "0"
78843-78869 uart: tx-data-bit: "0"
78869-78895 uart: tx-data-bit: "0"
78895-78921 uart: tx-data-bit: "1"
78921-78947 uart: tx-data-bit: "1"
78947-78973 uart: tx-data-bit: "0"
78973-78999 uart: tx-data-bit: "0"
78999-79025 uart: tx-data-bit: "0"
78817-79025 uart: tx-data: "00011000"
79025-79051 uart: tx-stop: "Stop bit" "Stop" "T"
79308-79334 uart: tx-start: "Start bit" "Start" "S"
79334-79360 uart: tx-data-bit: "1"
79360-79386 uart: tx-data-bit: "0"
79386-79412 uart: tx-data-bit: "0"
79412-79438 uart: tx-data-bit: "1"
79438-79464 uart: tx-data-bit: "1"
79464-79490 uart: tx-data-bit: "0"
79490-79516 uart: tx-data-bit: "0"
79516-79542 uart: tx-data-bit: "0"
79334-79542 uart: tx-data: "00011001"
79542-79568 uart: tx-stop: "Stop bit" "Stop" "T"
79826-79852 uart: tx-start: "Start bit" "Start" "S"
79852-79878 uart: tx-data-bit: "0"
79878-79904 uart: tx-data-bit: "1"
79904-79930 uart: tx-data-bit: "0"
79930-79956 uart: tx-data-bit: "1"
79956-79982 uart: tx-data-bit: "1"
79982-80008 uart: tx-data-bit: "0"
80008-80034 uart: tx-data-bit: "0"
80034-80060 uart: tx-data-bit: "0"
79852-80060 uart: tx-data: "00011010"
80060-80086 uart: tx-stop: "Stop bit" "Stop" "T"
80345-80371 uart: tx-start: "Start bit" "Start" "S"
80371-80397 uart: tx-data-bit: "1"
80397-80423 uart: tx-data-bit: "1"
80423-80449 uart: tx-data-bit: "0"
80449-80475 uart: tx-data-bit: "1"
80475-80501 uart: tx-data-bit: "1"
80501-80527 uart: tx-data-bit: "0"
80527-80553 uart: tx-data-bit: "0"
80553-80579 uart: tx-data-bit: "0"
80371-80579 uart: tx-data: "00011011"
80579-80605 uart: tx-stop: "Stop bit" "Stop" "T"
80863-80889 uart: tx-start: "Start bit" "Start" "S"
80889-80915 uart: tx-data-bit: "0"
80915-80941 uart: tx-data-bit: "0"
80941-80967 uart: tx-data-bit: "1"
80967-80993 uart: tx-data-bit: "1"
80993-81019 uart: tx-data-bit: "1"
81019-81045 uart: tx-data-bit: "0"
81045-81071 uart: tx-data-bit: "0"
81071-81097 uart: tx-data-bit: "0"
80889-81097 uart: tx-data: "00011100"
81097-81123 uart: tx-stop: "Stop bit" "Stop" "T"
81380-81406 uart: tx-start: "Start bit" "Start" "S"
81406-81432 uart: tx-data-bit: "1"
81432-81458 uart: tx-data-bit: "0"
81458-81484 uart: tx-data-bit: "1"
81484-81510 uart: tx-data-bit: "1"
81510-81536 uart: tx-data-bit: "1"
81536-81562 uart: tx-data-bit: "0"
81562-81588 uart: tx-data-bit: "0"
81588-81614 uart: tx-data-bit: "0"
81406-81614 uart: tx-data: "00011101"
81614-81640 uart: tx-stop: "Stop bit" "Stop" "T"
81899-81925 uart: tx-start: "Start bit" "Start" "S"
81925-81951 uart: tx-data-bit: "0"
81951-81977 uart: tx-data-bit: "1"
81977-82003 uart: tx-data-bit: "1"
82003-82029 uart: tx-data-bit: "1"
82029-82055 uart: tx-data-bit: "1"
82055-82081 uart: tx-data-bit: "0"
82081-82107 uart: tx-data-bit: "0"
82107-82133 uart: tx-data-bit: "0"
81925-82133 uart: tx-data: "00011110"
82133-82159 uart: tx-stop: "Stop bit" "Stop" "T"
82415-82441 uart: tx-start: "Start bit" "Start" "S"
82441-82467 uart: tx-data-bit: "1"
82467-82493 uart: tx-data-bit: "1"
82493-82519 uart: tx-data-bit: "1"
82519-82545 uart: tx-data-bit: "1"
82545-82571 uart: tx-data-bit: "1"
82571-82597 uart: tx-data-bit: "0"
82597-82623 uart: tx-data-bit: "0"
82623-82649 uart: tx-data-bit: "0"
82441-82649 uart: tx-data: "00011111"
82649-82675 uart: tx-stop: "Stop bit" "Stop" "T"
74642-82675 uart: tx-packet: "00010000 00010001 00010010 00010011 00010100 00010101 00010110 00010111 00011000 00011001 00011010 00011011 00011100 00011101 00011110 00011111"
82932-82958 uart: tx-start: "Start bit" "Start" "S"
82958-82984 uart: tx-data-bit: "0"
82984-83010 uart: tx-data-bit: "0"
83010-83036 uart: tx-data-bit: "0"
83036-83062 uart: tx-data-bit: "0"
83062-83088 uart: tx-data-bit: "0"
83088-83114 uart: tx-data-bit: "1"
83114-83140 uart: tx-data-bit: "0"
83140-83166 uart: tx-data-bit: "0"
82958-83166 uart: tx-data: "00100000"
83166-83192 uart: tx-stop: "Stop bit" "Stop" "T"
83448-83474 uart: tx-start: "Start bit" "Start" "S"
83474-83500 uart: tx-data-bit: "1"
83500-83526 uart: tx-data-bit: "0"
83526-83552 uart: tx-data-bit: "0"
83552-83578 uart: tx-data-bit: "0"
83578-83604 uart: tx-data-bit: "0"
83604-83630 uart: tx-data-bit: "1"
83630-83656 uart: tx-data-bit: "0"
83656-83682 uart: tx-data-bit: "0"
83474-83682 uart: tx-data: "00100001"
83682-83708 uart: tx-stop: "Stop bit" "Stop" "T"
83967-83993 uart: tx-start: "Start bit" "Start" "S"
83993-84019 uart: tx-data-bit: "0"
84019-84045 uart: tx-data-bit: "1"
84045-84071 uart: tx-data-bit: "0"
84071-84097 uart: tx-data-bit: "0"
84097-84123 uart: tx-data-bit: "0"
84123-84149 uart: tx-data-bit: "1"
84149-84175 uart: tx-data-bit: "0"
84175-84201 uart: tx-data-bit: "0"
83993-84201 uart: tx-data: "00100010"
84201-84227 uart: tx-stop: "Stop bit" "Stop" "T"
84485-84511 uart: tx-start: "Start bit" "Start" "S"
84511-84537 uart: tx-data-bit: "1"
84537-84563 uart: tx-data-bit: "1"
84563-84589 uart: tx-data-bit: "0"
84589-84615 uart: tx-data-bit: "0"
84615-84641 uart: tx-data-bit: "0"
84641-84667 uart: tx-data-bit: "1"
84667-84693 uart: tx-data-bit: "0"
84693-84719 uart: tx-data-bit: "0"
84511-84719 uart: tx-data: "00100011"
84719-84745 uart: tx-stop: "Stop bit" "Stop" "T"
85004-85030 uart: tx-start: "Start bit" "Start" "S"
85030-85056 uart: tx-data-bit: "0"
85056-85082 uart: tx-data-bit: "0"
85082-85108 uart: tx-data-bit: "1"
85108-85134 uart: tx-data-bit: "0"
85134-85160 uart: tx-data-bit: "0"
85160-85186 uart: tx-data-bit: "1"
85186-85212 uart: tx-data-bit: "0"
85212-85238 uart: tx-data-bit: "0"
85030-85238 uart: tx-data: "00100100"
85238-85264 uart: tx-stop: "Stop bit" "Stop" "T"
85523-85549 uart: tx-start: "Start bit" "Start" "S"
85549-85575 uart: tx-data-bit: "1"
85575-85601 uart: tx-data-bit: "0"
85601-85627 uart: tx-data-bit: "1"
85627-85653 uart: tx-data-bit: "0"
85653-85679 uart: tx-data-bit: "0"
85679-85705 uart: tx-data-bit: "1"
85705-85731 uart: tx-data-bit: "0"
85731-85757 uart: tx-data-bit: "0"
85549-85757 uart: tx-data: "00100101"
85757-85783 uart: tx-stop: "Stop bit" "Stop" "T"
86043-86069 uart: tx-start: "Start bit" "Start" "S"
86069-86095 uart: tx-data-bit: "0"
86095-86121 uart: tx-data-bit: "1"
86121-86147 uart: tx-data-bit: "1"
86147-86173 uart: tx-data-bit: "0"
86173-86199 uart: tx-data-bit: "0"
86199-86225 uart: tx-data-bit: "1"
86225-86251 uart: tx-data-bit: "0"
86251-86277 uart: tx-data-bit: "0"
86069-86277 uart: tx-data: "00100110"
86277-86303 uart: tx-stop: "Stop bit" "Stop" "T"
86562-86588 uart: tx-start: "Start bit" "Start" "S"
86588-86614 uart: tx-data-bit: "1"
86614-86640 uart: tx-data-bit: "1"
86640-86666 uart: tx-data-bit: "1"
86666-86692 uart: tx-data-bit: "0"
86692-86718 uart: tx-data-bit: "0"
86718-86744 uart: tx-data-bit: "1"
86744-86770 uart: tx-data-bit: "0"
86770-86796 uart: tx-data-bit: "0"
86588-86796 uart: tx-data: "00100111"
86796-86822 uart: tx-stop: "Stop bit" "Stop" "T"
87080-87106 uart: tx-start: "Start bit" "Start" "S"
87106-87132 uart: tx-data-bit: "0"
87132-87158 uart: tx-data-bit: "0"
87158-87184 uart: tx-data-bit: "0"
87184-87210 uart: tx-data-bit: "1"
87210-87236 uart: tx-data-bit: "0"
87236-87262 uart: tx-data-bit: "1"
87262-87288 uart: tx-data-bit: "0"
87288-87314 uart: tx-data-bit: "0"
87106-87314 uart: tx-data: "00101000"
87314-87340 uart: tx-stop: "Stop bit" "Stop" "T"
87599-87625 uart: tx-start: "Start bit" "Start" "S"
87625-87651 uart: tx-data-bit: "1"
87651-87677 uart: tx-data-bit: "0"
87677-87703 uart: tx-data-bit: "0"
87703-87729 uart: tx-data-bit: "1"
87729-87755 uart: tx-data-bit: "0"
87755-87781 uart: tx-data-bit: "1"
87781-87807 uart: tx-data-bit: "0"
87807-87833 uart: tx-data-bit: "0"
87625-87833 uart: tx-data: "00101001"
87833-87859 uart: tx-stop: "Stop bit" "Stop" "T"
88120-88146 uart: tx-start: "Start bit" "Start" "S"
88146-88172 uart: tx-data-bit: "0"
88172-88198 uart: tx-data-bit: "1"
88198-88224 uart: tx-data-bit: "0"
88224-88250 uart: tx-data-bit: "1"
88250-88276 uart: tx-data-bit: "0"
88276-88302 uart: tx-data-bit: "1"
88302-88328 uart: tx-data-bit: "0"
88328-88354 uart: tx-data-bit: "0"
88146-88354 uart: tx-data: "00101010"
88354-88380 uart: tx-stop: "Stop bit" "Stop" "T"
88640-88666 uart: tx-start: "Start bit" "Start" "S"
88666-88692 uart: tx-data-bit: "1"
88692-88718 uart: tx-data-bit: "1"
88718-88744 uart: tx-data-bit: "0"
88744-88770 uart: tx-data-bit: "1"
88770-88796 uart: tx-data-bit: "0"
88796-88822 uart: tx-data-bit: "1"
88822-88848 uart: tx-data-bit: "0"
88848-88874 uart: tx-data-bit: "0"
88666-88874 uart: tx-data: "00101011"
88874-88900 uart: tx-stop: "Stop bit" "Stop" "T"
89161-89187 uart: tx-start: "Start bit" "Start" "S"
89187-89213 uart: tx-data-bit: "0"
89213-89239 uart: tx-data-bit: "0"
89239-89265 uart: tx-data-bit: "1"
89265-89291 uart: tx-data-bit: "1"
89291-89317 uart: tx-data-bit: "0"
89317-89343 uart: tx-data-bit: "1"
89343-89369 uart: tx-data-bit: "0"
89369-89395 uart: tx-data-bit: "0"
89187-89395 uart: tx-data: "00101100"
89395-89421 uart: tx-stop: "Stop bit" "Stop" "T"
89679-89705 uart: tx-start: "Start bit" "Start" "S"
89705-89731 uart: tx-data-bit: "1"
89731-89757 uart: tx-data-bit: "0"
89757-89783 uart: tx-data-bit: "1"
89783-89809 uart: tx-data-bit: "1"
89809-89835 uart: tx-data-bit: "0"
89835-89861 uart: tx-data-bit: "1"
89861-89887 uart: tx-data-bit: "0"
89887-89913 uart: tx-data-bit: "0"
89705-89913 uart: tx-data: "00101101"
89913-89939 uart: tx-stop: "Stop bit" "Stop" "T"
90200-90226 uart: tx-start: "Start bit" "Start" "S"
90226-90252 uart: tx-data-bit: "0"
90252-90278 uart: tx-data-bit: "1"
90278-90304 uart: tx-data-bit: "1"
90304-90330 uart: tx-data-bit: "1"
90330-90356 uart: tx-data-bit: "0"
90356-90382 uart: tx-data-bit: "1"
90382-90408 uart: tx-data-bit: "0"
90408-90434 uart: tx-data-bit: "0"
90226-90434 uart: tx-data: "00101110"
90434-90460 uart: tx-stop: "Stop bit" "Stop" "T"
90719-90745 uart: tx-start: "Start bit" "Start" "S"
90745-90771 uart: tx-data-bit: "1"
90771-90797 uart: tx-data-bit: "1"
90797-90823 uart: tx-data-bit: "1"
90823-90849 uart: tx-data-bit: "1"
90849-90875 uart: tx-data-bit: "0"
90875-90901 uart: tx-data-bit: "1"
90901-90927 uart: tx-data-bit: "0"
90927-90953 uart: tx-data-bit: "0"
90745-90953 uart: tx-data: "00101111"
90953-90979 uart: tx-stop: "Stop bit" "Stop" "T"
82932-90979 uart: tx-packet: "00100000 00100001 00100010 00100011 00100100 00100101 00100110 00100111 00101000 00101001 00101010 00101011 00101100 00101101 00101110 00101111"
91237-91263 uart: tx-start: "Start bit" "Start" "S"
91263-91289 uart: tx-data-bit: "0"
91289-91315 uart: tx-data-bit: "0"
91315-91341 uart: tx-data-bit: "0"
91341-91367 uart: tx-data-bit: "0"
91367-91393 uart: tx-data-bit: "1"
91393-91419 uart: tx-data-bit: "1"
91419-91445 uart: tx-data-bit: "0"
91445-91471 uart: tx-data-bit: "0"
91263-91471 uart: tx-data: "00110000"
91471-91497 uart: tx-stop: "Stop bit" "Stop" "T"
91754-91780 uart: tx-start: "Start bit" "Start" "S"
91780-91806 uart: tx-data-bit: "1"
91806-91832 uart: tx-data-bit: "0"
91832-91858 uart: tx-data-bit: "0"
91858-91884 uart: tx-data-bit: "0"
91884-91910 uart: tx-data-bit: "1"
91910-91936 uart: tx-data-bit: "1"
91936-91962 uart: tx-data-bit: "0"
91962-91988 uart: tx-data-bit: "0"
91780-91988 uart: tx-data: "00110001"
91988-92014 uart: tx-stop: "Stop bit" "Stop" "T"
92272-92298 uart: tx-start: "Start bit" "Start" "S"
92298-92324 uart: tx-data-bit: "0"
92324-92350 uart: tx-data-bit: "1"
92350-92376 uart: tx-data-bit: "0"
92376-92402 uart: tx-data-bit: "0"
92402-92428 uart: tx-data-bit: "1"
92428-92454 uart: tx-data-bit: "1"
92454-92480 uart: tx-data-bit: "0"
92480-92506 uart: tx-data-bit: "0"
92298-92506 uart: tx-data: "00110010"
92506-92532 uart: tx-stop: "Stop bit" "Stop" "T"
92791-92817 uart: tx-start: "Start bit" "Start" "S"
92817-92843 uart: tx-data-bit: "1"
92843-92869 uart: tx-data-bit: "1"
92869-92895 uart: tx-data-bit: "0"
92895-92921 uart: tx-data-bit: "0"
92921-92947 uart: tx-data-bit: "1"
92947-92973 uart: tx-data-bit: "1"
92973-92999 uart: tx-data-bit: "0"
92999-93025 uart: tx-data-bit: "0"
92817-93025 uart: tx-data: "00110011"
93025-93051 uart: tx-stop: "Stop bit" "Stop" "T"
93309-93335 uart: tx-start: "Start bit" "Start" "S"
93335-93361 uart: tx-data-bit: "0"
93361-93387 uart: tx-data-bit: "0"
93387-93413 uart: tx-data-bit: "1"
93413-93439 uart: tx-data-bit: "0"
93439-93465 uart: tx-data-bit: "1"
93465-93491 uart: tx-data-bit: "1"
93491-93517 uart: tx-data-bit: "0"
93517-93543 uart: tx-data-bit: "0"
93335-93543 uart: tx-data: "00110100"
93543-93569 uart: tx-stop: "Stop bit" "Stop" "T"
93828-93854 uart: tx-start: "Start bit" "Start" "S"
93854-93880 uart: tx-data-bit: "1"
93880-93906 uart: tx-data-bit: "0"
93906-93932 uart: tx-data-bit: "1"
93932-93958 uart: tx-data-bit: "0"
93958-93984 uart: tx-data-bit: "1"
93984-94010 uart: tx-data-bit: "1"
94010-94036 uart: tx-data-bit: "0"
94036-94062 uart: tx-data-bit: "0"
93854-94062 uart: tx-data: "00110101"
94062-94088 uart: tx-stop: "Stop bit" "Stop" "T"
94349-94375 uart: tx-start: "Start bit" "Start" "S"
94375-94401 uart: tx-data-bit: "0"
94401-94427 uart: tx-data-bit: "1"
94427-94453 uart: tx-data-bit: "1"
94453-94479 uart: tx-data-bit: "0"
94479-94505 uart: tx-data-bit: "1"
94505-94531 uart: tx-data-bit: "1"
94531-94557 uart: tx-data-bit: "0"
94557-94583 uart: tx-data-bit: "0"
94375-94583 uart: tx-data: "00110110"
94583-94609 uart: tx-stop: "Stop bit" "Stop" "T"
94867-94893 uart: tx-start: "Start bit" "Start" "S"
94893-94919 uart: tx-data-bit: "1"
94919-94945 uart: tx-data-bit: "1"
94945-94971 uart: tx-data-bit: "1"
94971-94997 uart: tx-data-bit: "0"
94997-95023 uart: tx-data-bit: "1"
95023-95049 uart: tx-data-bit: "1"
95049-95075 uart: tx-data-bit: "0"
95075-95101 uart: tx-data-bit: "0"
94893-95101 uart: tx-data: "00110111"
95101-95127 uart: tx-stop: "Stop bit" "Stop" "T"
95386-95412 uart: tx-start: "Start bit" "Start" "S"
95412-95438 uart: tx-data-bit: "0"
95438-95464 uart: tx-data-bit: "0"
95464-95490 uart: tx-data-bit: "0"
95490-95516 uart: tx-data-bit: "1"
95516-95542 uart: tx-data-bit: "1"
95542-95568 uart: tx-data-bit: "1"
95568-95594 uart: tx-data-bit: "0"
95594-95620 uart: tx-data-bit: "0"
95412-95620 uart: tx-data: "00111000"
95620-95646 uart: tx-stop: "Stop bit" "Stop" "T"
95902-95928 uart: tx-start: "Start bit" "Start" "S"
95928-95954 uart: tx-data-bit: "1"
95954-95980 uart: tx-data-bit: "0"
95980-96006 uart: tx-data-bit: "0"
96006-96032 uart: tx-data-bit: "1"
96032-96058 uart: tx-data-bit: "1"
96058-96084 uart: tx-data-bit: "1"
96084-96110 uart: tx-data-bit: "0"
96110-96136 uart: tx-data-bit: "0"
95928-96136 uart: tx-data: "00111001"
96136-96162 uart: tx-stop: "Stop bit" "Stop" "T"
96421-96447 uart: tx-start: "Start bit" "Start" "S"
96447-96473 uart: tx-data-bit: "0"
96473-96499 uart: tx-data-bit: "1"
96499-96525 uart: tx-data-bit: "0"
96525-96551 uart: tx-data-bit: "1"
96551-96577 uart: tx-data-bit: "1"
96577-96603 uart: tx-data-bit: "1"
96603-96629 uart: tx-data-bit: "0"
96629-96655 uart: tx-data-bit: "0"
96447-96655 uart: tx-data: "00111010"
96655-96681 uart: tx-stop: "Stop bit" "Stop" "T"
96940-96966 uart: tx-start: "Start bit" "Start" "S"
96966-96992 uart: tx-data-bit: "1"
96992-97018 uart: tx-data-bit: "1"
97018-97044 uart: tx-data-bit: "0"
97044-97070 uart: tx-data-bit: "1"
97070-97096 uart: tx-data-bit: "1"
97096-97122 uart: tx-data-bit: "1"
97122-97148 uart: tx-data-bit: "0"
97148-97174 uart: tx-data-bit: "0"
96966-97174 uart: tx-data: "00111011"
97174-97200 uart: tx-stop: "Stop bit" "Stop" "T"
97458-97484 uart: tx-start: "Start bit" "Start" "S"
97484-97510 uart: tx-data-bit: "0"
97510-97536 uart: tx-data-bit: "0"
97536-97562 uart: tx-data-bit: "1"
97562-97588 uart: tx-data-bit: "1"
97588-97614 uart: tx-data-bit: "1"
97614-97640 uart: tx-data-bit: "1"
97640-97666 uart: tx-data-bit: "0"
97666-97692 uart: tx-data-bit: "0"
97484-97692 uart: tx-data: "00111100"
97692-97718 uart: tx-stop: "Stop bit" "Stop" "T"
97975-98001 uart: tx-start: "Start bit" "Start" "S"
98001-98027 uart: tx-data-bit: "1"
98027-98053 uart: tx-data-bit: "0"
98053-98079 uart: tx-data-bit: "1"
98079-98105 uart: tx-data-bit: "1"
98105-98131 uart: tx-data-bit: "1"
98131-98157 uart: tx-data-bit: "1"
98157-98183 uart: tx-data-bit: "0"
98183-98209 uart: tx-data-bit: "0"
98001-98209 uart: tx-data: "00111101"
98209-98235 uart: tx-stop: "Stop bit" "Stop" "T"
98493-98519 uart: tx-start: "Start bit" "Start" "S"
98519-98545 uart: tx-data-bit: "0"
98545-98571 uart: tx-data-bit: "1"
98571-98597 uart: tx-data-bit: "1"
98597-98623 uart: tx-data-bit: "1"
98623-98649 uart: tx-data-bit: "1"
98649-98675 uart: tx-data-bit: "1"
98675-98701 uart: tx-data-bit: "0"
98701-98727 uart: tx-data-bit: "0"
98519-98727 uart: tx-data: "00111110"
98727-98753 uart: tx-stop: "Stop bit" "Stop" "T"
99010-99036 uart: tx-start: "Start bit" "Start" "S"
99036-99062 uart: tx-data-bit: "1"
99062-99088 uart: tx-data-bit: "1"
99088-99114 uart: tx-data-bit: "1"
99114-99140 uart: tx-data-bit: "1"
99140-99166 uart: tx-data-bit: "1"
99166-99192 uart: tx-data-bit: "1"
99192-99218 uart: tx-data-bit: "0"
99218-99244 uart: tx-data-bit: "0"
99036-99244 uart: tx-data: "00111111"
99244-99270 uart: tx-stop: "Stop bit" "Stop" "T"
91237-99270 uart: tx-packet: "00110000 00110001 00110010 00110011 00110100 00110101 00110110 00110111 00111000 00111001 00111010 00111011 00111100 00111101 00111110 00111111"
99526-99552 uart: tx-start: "Start bit" "Start" "S"
99552-99578 uart: tx-data-bit: "0"
99578-99604 uart: tx-data-bit: "0"
99604-99630 uart: tx-data-bit: "0"
99630-99656 uart: tx-data-bit: "0"
99656-99682 uart: tx-data-bit: "0"
99682-99708 uart: tx-data-bit: "0"
99708-99734 uart: tx-data-bit: "1"
99734-99760 uart: tx-data-bit: "0"
99552-99760 uart: tx-data: "01000000"
99760-99786 uart: tx-stop: "Stop bit" "Stop" "T"
100043-100069 uart: tx-start: "Start bit" "Start" "S"
100069-100095 uart: tx-data-bit: "1"
100095-100121 uart: tx-data-bit: "0"
100121-100147 uart: tx-data-bit: "0"
100147-100173 uart: tx-data-bit: "0"
100173-100199 uart: tx-data-bit: "0"
100199-100225 uart: tx-data-bit: "0"
100225-100251 uart: tx-data-bit: "1"
100251-100277 uart: tx-data-bit: "0"
100069-100277 uart: tx-data: "01000001"
100277-100303 uart: tx-stop: "Stop bit" "Stop" "T"
100562-100588 uart: tx-start: "Start bit" "Start" "S"
100588-100614 uart: tx-data-bit: "0"
100614-100640 uart: tx-data-bit: "1"
100640-100666 uart: tx-data-bit: "0"
100666-100692 uart: tx-data-bit: "0"
100692-100718 uart: tx-data-bit: "0"
100718-100744 uart: tx-data-bit: "0"
100744-100770 uart: tx-data-bit: "1"
100770-100796 uart: tx-data-bit: "0"
100588-100796 uart: tx-data: "01000010"
100796-100822 uart: tx-stop: "Stop bit" "Stop" "T"
101080-101106 uart: tx-start: "Start bit" "Start" "S"
101106-101132 uart: tx-data-bit: "1"
101132-101158 uart: tx-data-bit: "1"
101158-101184 uart: tx-data-bit: "0"
101184-101210 uart: tx-data-bit: "0"
101210-101236 uart: tx-data-bit: "0"
101236-101262 uart: tx-data-bit: "0"
101262-101288 uart: tx-data-bit: "1"
101288-101314 uart: tx-data-bit: "0"
101106-101314 uart: tx-data: "01000011"
101314-101340 uart: tx-stop: "Stop bit" "Stop" "T"
101599-101625 uart: tx-start: "Start bit" "Start" "S"
101625-101651 uart: tx-data-bit: "0"
101651-101677 uart: tx-data-bit: "0"
101677-101703 uart: tx-data-bit: "1"
101703-101729 uart: tx-data-bit: "0"
101729-101755 uart: tx-data-bit: "0"
101755-101781 uart: tx-data-bit: "0"
101781-101807 uart: tx-data-bit: "1"
101807-101833 uart: tx-data-bit: "0"
101625-101833 uart: tx-data: "01000100"
101833-101859 uart: tx-stop: "Stop bit" "Stop" "T"
102117-102143 uart: tx-start: "Start bit" "Start" "S"
102143-102169 uart: tx-data-bit: "1"
102169-102195 uart: tx-data-bit: "0"
102195-102221 uart: tx-data-bit: "1"
102221-102247 uart: tx-data-bit: "0"
102247-102273 uart: tx-data-bit: "0"
102273-102299 uart: tx-data-bit: "0"
102299-102325 uart: tx-data-bit: "1"
102325-102351 uart: tx-data-bit: "0"
102143-102351 uart: tx-data: "01000101"
102351-102377 uart: tx-stop: "Stop bit" "Stop" "T"
102638-102664 uart: tx-start: "Start bit" "Start" "S"
102664-102690 uart: tx-data-bit: "0"
102690-102716 uart: tx-data-bit: "1"
102716-102742 uart: tx-data-bit: "1"
102742-102768 uart: tx-data-bit: "0"
102768-102794 uart: tx-data-bit: "0"
102794-102820 uart: tx-data-bit: "0"
102820-102846 uart: tx-data-bit: "1"
102846-102872 uart: tx-data-bit: "0"
102664-102872 uart: tx-data: "01000110"
102872-102898 uart: tx-stop: "Stop bit" "Stop" "T"
103157-103183 uart: tx-start: "Start bit" "Start" "S"
103183-103209 uart: tx-data-bit: "1"
103209-103235 uart: tx-data-bit: "1"
103235-103261 uart: tx-data-bit: "1"
103261-103287 uart: tx-data-bit: "0"
103287-103313 uart: tx-data-bit: "0"
103313-103339 uart: tx-data-bit: "0"
103339-103365 uart: tx-data-bit: "1"
103365-103391 uart: tx-data-bit: "0"
103183-103391 uart: tx-data: "01000111"
103391-103417 uart: tx-stop: "Stop bit" "Stop" "T"
103675-103701 uart: tx-start: "Start bit" "Start" "S"
103701-103727 uart: tx-data-bit: "0"
103727-103753 uart: tx-data-bit: "0"
103753-103779 uart: tx-data-bit: "0"
103779-103805 uart: tx-data-bit: "1"
103805-103831 uart: tx-data-bit: "0"
103831-103857 uart: tx-data-bit: "0"
103857-103883 uart: tx-data-bit: "1"
103883-103909 uart: tx-data-bit: "0"
103701-103909 uart: tx-data: "01001000"
103909-103935 uart: tx-stop: "Stop bit" "Stop" "T"
104194-104220 uart: tx-start: "Start bit" "Start" "S"
104220-104246 uart: tx-data-bit: "1"
104246-104272 uart: tx-data-bit: "0"
104272-104298 uart: tx-data-bit: "0"
104298-104324 uart: tx-data-bit: "1"
104324-104350 uart: tx-data-bit: "0"
104350-104376 uart: tx-data-bit: "0"
104376-104402 uart: tx-data-bit: "1"
104402-104428 uart: tx-data-bit: "0"
104220-104428 uart: tx-data: "01001001"
104428-104454 uart: tx-stop: "Stop bit" "Stop" "T"
104714-104740 uart: tx-start: "Start bit" "Start" "S"
104740-104766 uart: tx-data-bit: "0"
104766-104792 uart: tx-data-bit: "1"
104792-104818 uart: tx-data-bit: "0"
104818-104844 uart: tx-data-bit: "1"
104844-104870 uart: tx-data-bit: "0"
104870-104896 uart: tx-data-bit: "0"
104896-104922 uart: tx-data-bit: "1"
104922-104948 uart: tx-data-bit: "0"
104740-104948 uart: tx-data: "01001010"
104948-104974 uart: tx-stop: "Stop bit" "Stop" "T"
105235-105261 uart: tx-start: "Start bit" "Start" "S"
105261-105287 uart: tx-data-bit: "1"
105287-105313 uart: tx-data-bit: "1"
105313-105339 uart: tx-data-bit: "0"
105339-105365 uart: tx-data-bit: "1"
105365-105391 uart: tx-data-bit: "0"
105391-105417 uart: tx-data-bit: "0"
105417-105443 uart: tx-data-bit: "1"
105443-105469 uart: tx-data-bit: "0"
105261-105469 uart: tx-data: "01001011"
105469-105495 uart: tx-stop: "Stop bit" "Stop" "T"
105755-105781 uart: tx-start: "Start bit" "Start" "S"
105781-105807 uart: tx-data-bit: "0"
105807-105833 uart: tx-data-bit: "0"
105833-105859 uart: tx-data-bit: "1"
105859-105885 uart: tx-data-bit: "1"
105885-105911 uart: tx-data-bit: "0"
105911-105937 uart: tx-data-bit: "0"
105937-105963 uart: tx-data-bit: "1"
105963-105989 uart: tx-data-bit: "0"
105781-105989 uart: tx-data: "01001100"
105989-106015 uart: tx-stop: "Stop bit" "Stop" "T"
106274-106300 uart: tx-start: "Start bit" "Start" "S"
106300-106326 uart: tx-data-bit: "1"
106326-106352 uart: tx-data-bit: "0"
106352-106378 uart: tx-data-bit: "1"
106378-106404 uart: tx-data-bit: "1"
106404-106430 uart: tx-data-bit: "0"
106430-106456 uart: tx-data-bit: "0"
106456-106482 uart: tx-data-bit: "1"
106482-106508 uart: tx-data-bit: "0"
106300-106508 uart: tx-data: "01001101"
106508-106534 uart: tx-stop: "Stop bit" "Stop" "T"
106795-106821 uart: tx-start: "Start bit" "Start" "S"
106821-106847 uart: tx-data-bit: "0"
106847-106873 uart: tx-data-bit: "1"
106873-106899 uart: tx-data-bit: "1"
106899-106925 uart: tx-data-bit: "1"
106925-106951 uart: tx-data-bit: "0"
106951-106977 uart: tx-data-bit: "0"
106977-107003 uart: tx-data-bit: "1"
107003-107029 uart: tx-data-bit: "0"
106821-107029 uart: tx-data: "01001110"
107029-107055 uart: tx-stop: "Stop bit" "Stop" "T"
107313-107339 uart: tx-start: "Start bit" "Start" "S"
107339-107365 uart: tx-data-bit: "1"
107365-107391 uart: tx-data-bit: "1"
107391-107417 uart: tx-data-bit: "1"
107417-107443 uart: tx-data-bit: "1"
107443-107469 uart: tx-data-bit: "0"
107469-107495 uart: tx-data-bit: "0"
107495-107521 uart: tx-data-bit: "1"
107521-107547 uart: tx-data-bit: "0"
107339-107547 uart: tx-data: "01001111"
107547-107573 uart: tx-stop: "Stop bit" "Stop" "T"
99526-107573 uart: tx-packet: "01000000 01000001 01000010 01000011 01000100 01000101 01000110 01000111 01001000 01001001 01001010 01001011 01001100 01001101 01001110 01001111"
107832-107858 uart: tx-start: "Start bit" "Start" "S"
107858-107884 uart: tx-data-bit: "0"
107884-107910 uart: tx-data-bit: "0"
107910-107936 uart: tx-data-bit: "0"
107936-107962 uart: tx-data-bit: "0"
107962-107988 uart: tx-data-bit: "1"
107988-108014 uart: tx-data-bit: "0"
108014-108040 uart: tx-data-bit: "1"
108040-108066 uart: tx-data-bit: "0"
107858-108066 uart: tx-data: "01010000"
108066-108092 uart: tx-stop: "Stop bit" "Stop" "T"
108350-108376 uart: tx-start: "Start bit" "Start" "S"
108376-108402 uart: tx-data-bit: "1"
108402-108428 uart: tx-data-bit: "0"
108428-108454 uart: tx-data-bit: "0"
108454-108480 uart: tx-data-bit: "0"
108480-108506 uart: tx-data-bit: "1"
108506-108532 uart: tx-data-bit: "0"
108532-108558 uart: tx-data-bit: "1"
108558-108584 uart: tx-data-bit: "0"
108376-108584 uart: tx-data: "01010001"
108584-108610 uart: tx-stop: "Stop bit" "Stop" "T"
108871-108897 uart: tx-start: "Start bit" "Start" "S"
108897-108923 uart: tx-data-bit: "0"
108923-108949 uart: tx-data-bit: "1"
108949-108975 uart: tx-data-bit: "0"
108975-109001 uart: tx-data-bit: "0"
109001-109027 uart: tx-data-bit: "1"
109027-109053 uart: tx-data-bit: "0"
109053-109079 uart: tx-data-bit: "1"
109079-109105 uart: tx-data-bit: "0"
108897-109105 uart: tx-data: "01010010"
109105-109131 uart: tx-stop: "Stop bit" "Stop" "T"
109392-109418 uart: tx-start: "Start bit" "Start" "S"
109418-109444 uart: tx-data-bit: "1"
109444-109470 uart: tx-data-bit: "1"
109470-109496 uart: tx-data-bit: "0"
109496-109522 uart: tx-data-bit: "0"
109522-109548 uart: tx-data-bit: "1"
109548-109574 uart: tx-data-bit: "0"
109574-109600 uart: tx-data-bit: "1"
109600-109626 uart: tx-data-bit: "0"
109418-109626 uart: tx-data: "01010011"
109626-109652 uart: tx-stop: "Stop bit" "Stop" "T"
109912-109938 uart: tx-start: "Start bit" "Start" "S"
109938-109964 uart: tx-data-bit: "0"
109964-109990 uart: tx-data-bit: "0"
109990-110016 uart: tx-data-bit: "1"
110016-110042 uart: tx-data-bit: "0"
110042-110068 uart: tx-data-bit: "1"
110068-110094 uart: tx-data-bit: "0"
110094-110120 uart: tx-data-bit: "1"
110120-110146 uart: tx-data-bit: "0"
109938-110146 uart: tx-data: "01010100"
110146-110172 uart: tx-stop: "Stop bit" "Stop" "T"
110433-110459 uart: tx-start: "Start bit" "Start" "S"
110459-110485 uart: tx-data-bit: "1"
110485-110511 uart: tx-data-bit: "0"
110511-110537 uart: tx-data-bit: "1"
110537-110563 uart: tx-data-bit: "0"
110563-110589 uart: tx-data-bit: "1"
110589-110615 uart: tx-data-bit: "0"
110615-110641 uart: tx-data-bit: "1"
110641-110667 uart: tx-data-bit: "0"
110459-110667 uart: tx-data: "01010101"
110667-110693 uart: tx-stop: "Stop bit" "Stop" "T"
110955-110981 uart: tx-start: "Start bit" "Start" "S"
110981-111007 uart: tx-data-bit: "0"
111007-111033 uart: tx-data-bit: "1"
111033-111059 uart: tx-data-bit: "1"
111059-111085 uart: tx-data-bit: "0"
111085-111111 uart: tx-data-bit: "1"
111111-111137 uart: tx-data-bit: "0"
111137-111163 uart: tx-data-bit: "1"
111163-111189 uart: tx-data-bit: "0"
110981-111189 uart: tx-data: "01010110"
111189-111215 uart: tx-stop: "Stop bit" "Stop" "T"
111476-111502 uart: tx-start: "Start bit" "Start" "S"
111502-111528 uart: tx-data-bit: "1"
111528-111554 uart: tx-data-bit: "1"
111554-111580 uart: tx-data-bit: "1"
111580-111606 uart: tx-data-bit: "0"
111606-111632 uart: tx-data-bit: "1"
111632-111658 uart: tx-data-bit: "0"
111658-111684 uart: tx-data-bit: "1"
111684-111710 uart: tx-data-bit: "0"
111502-111710 uart: tx-data: "01010111"
111710-111736 uart: tx-stop: "Stop bit" "Stop" "T"
111996-112022 uart: tx-start: "Start bit" "Start" "S"
112022-112048 uart: tx-data-bit: "0"
112048-112074 uart: tx-data-bit: "0"
112074-112100 uart: tx-data-bit: "0"
112100-112126 uart: tx-data-bit: "1"
112126-112152 uart: tx-data-bit: "1"
112152-112178 uart: tx-data-bit: "0"
112178-112204 uart: tx-data-bit: "1"
112204-112230 uart: tx-data-bit: "0"
112022-112230 uart: tx-data: "01011000"
112230-112256 uart: tx-stop: "Stop bit" "Stop" "T"
112515-112541 uart: tx-start: "Start bit" "Start" "S"
112541-112567 uart: tx-data-bit: "1"
112567-112593 uart: tx-data-bit: "0"
112593-112619 uart: tx-data-bit: "0"
112619-112645 uart: tx-data-bit: "1"
112645-112671 uart: tx-data-bit: "1"
112671-112697 uart: tx-data-bit: "0"
112697-112723 uart: tx-data-bit: "1"
112723-112749 uart: tx-data-bit: "0"
112541-112749 uart: tx-data: "01011001"
112749-112775 uart: tx-stop: "Stop bit" "Stop" "T"
113036-113062 uart: tx-start: "Start bit" "Start" "S"
113062-113088 uart: tx-data-bit: "0"
113088-113114 uart: tx-data-bit: "1"
113114-113140 uart: tx-data-bit: "0"
113140-113166 uart: tx-data-bit: "1"
113166-113192 uart: tx-data-bit: "1"
113192-113218 uart: tx-data-bit: "0"
113218-113244 uart: tx-data-bit: "1"
113244-113270 uart: tx-data-bit: "0"
113062-113270 uart: tx-data: "01011010"
113270-113296 uart: tx-stop: "Stop bit" "Stop" "T"
113556-113582 uart: tx-start: "Start bit" "Start" "S"
113582-113608 uart: tx-data-bit: "1"
113608-113634 uart: tx-data-bit: "1"
113634-113660 uart: tx-data-bit: "0"
113660-113686 uart: tx-data-bit: "1"
113686-113712 uart: tx-data-bit: "1"
113712-113738 uart: tx-data-bit: "0"
113738-113764 uart: tx-data-bit: "1"
113764-113790 uart: tx-data-bit: "0"
113582-113790 uart: tx-data: "01011011"
113790-113816 uart: tx-stop: "Stop bit" "Stop" "T"
114077-114103 uart: tx-start: "Start bit" "Start" "S"
114103-114129 uart: tx-data-bit: "0"
114129-114155 uart: tx-data-bit: "0"
114155-114181 uart: tx-data-bit: "1"
114181-114207 uart: tx-data-bit: "1"
114207-114233 uart: tx-data-bit: "1"
114233-114259 uart: tx-data-bit: "0"
114259-114285 uart: tx-data-bit: "1"
114285-114311 uart: tx-data-bit: "0"
114103-114311 uart: tx-data: "01011100"
114311-114337 uart: tx-stop: "Stop bit" "Stop" "T"
114595-114621 uart: tx-start: "Start bit" "Start" "S"
114621-114647 uart: tx-data-bit: "1"
114647-114673 uart: tx-data-bit: "0"
114673-114699 uart: tx-data-bit: "1"
114699-114725 uart: tx-data-bit: "1"
114725-114751 uart: tx-data-bit: "1"
114751-114777 uart: tx-data-bit: "0"
114777-114803 uart: tx-data-bit: "1"
114803-114829 uart: tx-data-bit: "0"
114621-114829 uart: tx-data: "01011101"
114829-114855 uart: tx-stop: "Stop bit" "Stop" "T"
115116-115142 uart: tx-start: "Start bit" "Start" "S"
115142-115168 uart: tx-data-bit: "0"
115168-115194 uart: tx-data-bit: "1"
115194-115220 uart: tx-data-bit: "1"
115220-115246 uart: tx-data-bit: "1"
115246-115272 uart: tx-data-bit: "1"
115272-115298 uart: tx-data-bit: "0"
115298-115324 uart: tx-data-bit: "1"
115324-115350 uart: tx-data-bit: "0"
115142-115350 uart: tx-data: "01011110"
115350-115376 uart: tx-stop: "Stop bit" "Stop" "T"
115635-115661 uart: tx-start: "Start bit" "Start" "S"
115661-115687 uart: tx-data-bit: "1"
115687-115713 uart: tx-data-bit: "1"
115713-115739 uart: tx-data-bit: "1"
115739-115765 uart: tx-data-bit: "1"
115765-115791 uart: tx-data-bit: "1"
115791-115817 uart: tx-data-bit: "0"
115817-115843 uart: tx-data-bit: "1"
115843-115869 uart: tx-data-bit: "0"
115661-115869 uart: tx-data: "01011111"
115869-115895 uart: tx-stop: "Stop bit" "Stop" "T"
107832-115895 uart: tx-packet: "01010000 01010001 01010010 01010011 01010100 01010101 01010110 01010111 01011000 01011001 01011010 01011011 01011100 01011101 01011110 01011111"
116153-116179 uart: tx-start: "Start bit" "Start" "S"
116179-116205 uart: tx-data-bit: "0"
116205-116231 uart: tx-data-bit: "0"
116231-116257 uart: tx-data-bit: "0"
116257-116283 uart: tx-data-bit: "0"
116283-116309 uart: tx-data-bit: "0"
116309-116335 uart: tx-data-bit: "1"
116335-116361 uart: tx-data-bit: "1"
116361-116387 uart: tx-data-bit: "0"
116179-116387 uart: tx-data: "01100000"
116387-116413 uart: tx-stop: "Stop bit" "Stop" "T"
116670-116696 uart: tx-start: "Start bit" "Start" "S"
116696-116722 uart: tx-data-bit: "1"
116722-116748 uart: tx-data-bit: "0"
116748-116774 uart: tx-data-bit: "0"
116774-116800 uart: tx-data-bit: "0"
116800-116826 uart: tx-data-bit: "0"
116826-116852 uart: tx-data-bit: "1"
116852-116878 uart: tx-data-bit: "1"
116878-116904 uart: tx-data-bit: "0"
116696-116904 uart: tx-data: "01100001"
116904-116930 uart: tx-stop: "Stop bit" "Stop" "T"
117188-117214 uart: tx-start: "Start bit" "Start" "S"
117214-117240 uart: tx-data-bit: "0"
117240-117266 uart: tx-data-bit: "1"
117266-117292 uart: tx-data-bit: "0"
117292-117318 uart: tx-data-bit: "0"
117318-117344 uart: tx-data-bit: "0"
117344-117370 uart: tx-data-bit: "1"
117370-117396 uart: tx-data-bit: "1"
117396-117422 uart: tx-data-bit: "0"
117214-117422 uart: tx-data: "01100010"
117422-117448 uart: tx-stop: "Stop bit" "Stop" "T"
117707-117733 uart: tx-start: "Start bit" "Start" "S"
117733-117759 uart: tx-data-bit: "1"
117759-117785 uart: tx-data-bit: "1"
117785-117811 uart: tx-data-bit: "0"
117811-117837 uart: tx-data-bit: "0"
117837-117863 uart: tx-data-bit: "0"
117863-117889 uart: tx-data-bit: "1"
117889-117915 uart: tx-data-bit: "1"
117915-117941 uart: tx-data-bit: "0"
117733-117941 uart: tx-data: "01100011"
117941-117967 uart: tx-stop: "Stop bit" "Stop" "T"
118226-118252 uart: tx-start: "Start bit" "Start" "S"
118252-118278 uart: tx-data-bit: "0"
118278-118304 uart: tx-data-bit: "0"
118304-118330 uart: tx-data-bit: "1"
118330-118356 uart: tx-data-bit: "0"
118356-118382 uart: tx-data-bit: "0"
118382-118408 uart: tx-data-bit: "1"
118408-118434 uart: tx-data-bit: "1"
118434-118460 uart: tx-data-bit: "0"
118252-118460 uart: tx-data: "01100100"
118460-118486 uart: tx-stop: "Stop bit" "Stop" "T"
118744-118770 uart: tx-start: "Start bit" "Start" "S"
118770-118796 uart: tx-data-bit: "1"
118796-118822 uart: tx-data-bit: "0"
118822-118848 uart: tx-data-bit: "1"
118848-118874 uart: tx-data-bit: "0"
118874-118900 uart: tx-data-bit: "0"
118900-118926 uart: tx-data-bit: "1"
118926-118952 uart: tx-data-bit: "1"
118952-118978 uart: tx-data-bit: "0"
118770-118978 uart: tx-data: "01100101"
118978-119004 uart: tx-stop: "Stop bit" "Stop" "T"
119265-119291 uart: tx-start: "Start bit" "Start" "S"
119291-119317 uart: tx-data-bit: "0"
119317-119343 uart: tx-data-bit: "1"
119343-119369 uart: tx-data-bit: "1"
119369-119395 uart: tx-data-bit: "0"
119395-119421 uart: tx-data-bit: "0"
119421-119447 uart: tx-data-bit: "1"
119447-119473 uart: tx-data-bit: "1"
119473-119499 uart: tx-data-bit: "0"
119291-119499 uart: tx-data: "01100110"
119499-119525 uart: tx-stop: "Stop bit" "Stop" "T"
119783-119809 uart: tx-start: "Start bit" "Start" "S"
119809-119835 uart: tx-data-bit: "1"
119835-119861 uart: tx-data-bit: "1"
119861-119887 uart: tx-data-bit: "1"
119887-119913 uart: tx-data-bit: "0"
119913-119939 uart: tx-data-bit: "0"
119939-119965 uart: tx-data-bit: "1"
119965-119991 uart: tx-data-bit: "1"
119991-120017 uart: tx-data-bit: "0"
119809-120017 uart: tx-data: "01100111"
120017-120043 uart: tx-stop: "Stop bit" "Stop" "T"
120302-120328 uart: tx-start: "Start bit" "Start" "S"
120328-120354 uart: tx-data-bit: "0"
120354-120380 uart: tx-data-bit: "0"
120380-120406 uart: tx-data-bit: "0"
120406-120432 uart: tx-data-bit: "1"
120432-120458 uart: tx-data-bit: "0"
120458-120484 uart: tx-data-bit: "1"
120484-120510 uart: tx-data-bit: "1"
120510-120536 uart: tx-data-bit: "0"
120328-120536 uart: tx-data: "01101000"
120536-120562 uart: tx-stop: "Stop bit" "Stop" "T"
120820-120846 uart: tx-start: "Start bit" "Start" "S"
120846-120872 uart: tx-data-bit: "1"
120872-120898 uart: tx-data-bit: "0"
120898-120924 uart: tx-data-bit: "0"
120924-120950 uart: tx-data-bit: "1"
120950-120976 uart: tx-data-bit: "0"
120976-121002 uart: tx-data-bit: "1"
121002-121028 uart: tx-data-bit: "1"
121028-121054 uart: tx-data-bit: "0"
120846-121054 uart: tx-data: "01101001"
121054-121080 uart: tx-stop: "Stop bit" "Stop" "T"
121341-121367 uart: tx-start: "Start bit" "Start" "S"
121367-121393 uart: tx-data-bit: "0"
121393-121419 uart: tx-data-bit: "1"
121419-121445 uart: tx-data-bit: "0"
121445-121471 uart: tx-data-bit: "1"
121471-121497 uart: tx-data-bit: "0"
121497-121523 uart: tx-data-bit: "1"
121523-121549 uart: tx-data-bit: "1"
121549-121575 uart: tx-data-bit: "0"
121367-121575 uart: tx-data: "01101010"
121575-121601 uart: tx-stop: "Stop bit" "Stop" "T"
121862-121888 uart: tx-start: "Start bit" "Start" "S"
121888-121914 uart: tx-data-bit: "1"
121914-121940 uart: tx-data-bit: "1"
121940-121966 uart: tx-data-bit: "0"
121966-121992 uart: tx-data-bit: "1"
121992-122018 uart: tx-data-bit: "0"
122018-122044 uart: tx-data-bit: "1"
122044-122070 uart: tx-data-bit: "1"
122070-122096 uart: tx-data-bit: "0"
121888-122096 uart: tx-data: "01101011"
122096-122122 uart: tx-stop: "Stop bit" "Stop" "T"
122382-122408 uart: tx-start: "Start bit" "Start" "S"
122408-122434 uart: tx-data-bit: "0"
122434-122460 uart: tx-data-bit: "0"
122460-122486 uart: tx-data-bit: "1"
122486-122512 uart: tx-data-bit: "1"
122512-122538 uart: tx-data-bit: "0"
122538-122564 uart: tx-data-bit: "1"
122564-122590 uart: tx-data-bit: "1"
122590-122616 uart: tx-data-bit: "0"
122408-122616 uart: tx-data: "01101100"
122616-122642 uart: tx-stop: "Stop bit" "Stop" "T"
122901-122927 uart: tx-start: "Start bit" "Start" "S"
122927-122953 uart: tx-data-bit: "1"
122953-122979 uart: tx-data-bit: "0"
122979-123005 uart: tx-data-bit: "1"
123005-123031 uart: tx-data-bit: "1"
123031-123057 uart: tx-data-bit: "0"
123057-123083 uart: tx-data-bit: "1"
123083-123109 uart: tx-data-bit: "1"
123109-123135 uart: tx-data-bit: "0"
122927-123135 uart: tx-data: "01101101"
123135-123161 uart: tx-stop: "Stop bit" "Stop" "T"
123421-123447 uart: tx-start: "Start bit" "Start" "S"
123447-123473 uart: tx-data-bit: "0"
123473-123499 uart: tx-data-bit: "1"
123499-123525 uart: tx-data-bit: "1"
123525-123551 uart: tx-data-bit: "1"
123551-123577 uart: tx-data-bit: "0"
123577-123603 uart: tx-data-bit: "1"
123603-123629 uart: tx-data-bit: "1"
123629-123655 uart: tx-data-bit: "0"
123447-123655 uart: tx-data: "01101110"
123655-123681 uart: tx-stop: "Stop bit" "Stop" "T"
123940-123966 uart: tx-start: "Start bit" "Start" "S"
123966-123992 uart: tx-data-bit: "1"
123992-124018 uart: tx-data-bit: "1"
124018-124044 uart: tx-data-bit: "1"
124044-124070 uart: tx-data-bit: "1"
124070-124096 uart: tx-data-bit: "0"
124096-124122 uart: tx-data-bit: "1"
124122-124148 uart: tx-data-bit: "1"
124148-124174 uart: tx-data-bit: "0"
123966-124174 uart: tx-data: "01101111"
124174-124200 uart: tx-stop: "Stop bit" "Stop" "T"
116153-124200 uart: tx-packet: "01100000 01100001 01100010 01100011 01100100 01100101 01100110 01100111 01101000 01101001 01101010 01101011 01101100 01101101 01101110 01101111"
124459-124485 uart: tx-start: "Start bit" "Start" "S"
124485-124511 uart: tx-data-bit: "0"
124511-124537 uart: tx-data-bit: "0"
124537-124563 uart: tx-data-bit: "0"
124563-124589 uart: tx-data-bit: "0"
124589-124615 uart: tx-data-bit: "1"
124615-124641 uart: tx-data-bit: "1"
124641-124667 uart: tx-data-bit: "1"
124667-124693 uart: tx-data-bit: "0"
124485-124693 uart: tx-data: "01110000"
124693-124719 uart: tx-stop: "Stop bit" "Stop" "T"
124975-125001 uart: tx-start: "Start bit" "Start" "S"
125001-125027 uart: tx-data-bit: "1"
125027-125053 uart: tx-data-bit: "0"
125053-125079 uart: tx-data-bit: "0"
125079-125105 uart: tx-data-bit: "0"
125105-125131 uart: tx-data-bit: "1"
125131-125157 uart: tx-data-bit: "1"
125157-125183 uart: tx-data-bit: "1"
125183-125209 uart: tx-data-bit: "0"
125001-125209 uart: tx-data: "01110001"
125209-125235 uart: tx-stop: "Stop bit" "Stop" "T"
125494-125520 uart: tx-start: "Start bit" "Start" "S"
125520-125546 uart: tx-data-bit: "0"
125546-125572 uart: tx-data-bit: "1"
125572-125598 uart: tx-data-bit: "0"
125598-125624 uart: tx-data-bit: "0"
125624-125650 uart: tx-data-bit: "1"
125650-125676 uart: tx-data-bit: "1"
125676-125702 uart: tx-data-bit: "1"
125702-125728 uart: tx-data-bit: "0"
125520-125728 uart: tx-data: "01110010"
125728-125754 uart: tx-stop: "Stop bit" "Stop" "T"
126013-126039 uart: tx-start: "Start bit" "Start" "S"
126039-126065 uart: tx-data-bit: "1"
126065-126091 uart: tx-data-bit: "1"
126091-126117 uart: tx-data-bit: "0"
126117-126143 uart: tx-data-bit: "0"
126143-126169 uart: tx-data-bit: "1"
126169-126195 uart: tx-data-bit: "1"
126195-126221 uart: tx-data-bit: "1"
126221-126247 uart: tx-data-bit: "0"
126039-126247 uart: tx-data: "01110011"
126247-126273 uart: tx-stop: "Stop bit" "Stop" "T"
126532-126558 uart: tx-start: "Start bit" "Start" "S"
126558-126584 uart: tx-data-bit: "0"
126584-126610 uart: tx-data-bit: "0"
126610-126636 uart: tx-data-bit: "1"
126636-126662 uart: tx-data-bit: "0"
126662-126688 uart: tx-data-bit: "1"
126688-126714 uart: tx-data-bit: "1"
126714-126740 uart: tx-data-bit: "1"
126740-126766 uart: tx-data-bit: "0"
126558-126766 uart: tx-data: "01110100"
126766-126792 uart: tx-stop: "Stop bit" "Stop" "T"
127050-127076 uart: tx-start: "Start bit" "Start" "S"
127076-127102 uart: tx-data-bit: "1"
127102-127128 uart: tx-data-bit: "0"
127128-127154 uart: tx-data-bit: "1"
127154-127180 uart: tx-data-bit: "0"
127180-127206 uart: tx-data-bit: "1"
127206-127232 uart: tx-data-bit: "1"
127232-127258 uart: tx-data-bit: "1"
127258-127284 uart: tx-data-bit: "0"
127076-127284 uart: tx-data: "01110101"
127284-127310 uart: tx-stop: "Stop bit" "Stop" "T"
127571-127597 uart: tx-start: "Start bit" "Start" "S"
127597-127623 uart: tx-data-bit: "0"
127623-127649 uart: tx-data-bit: "1"
127649-127675 uart: tx-data-bit: "1"
127675-127701 uart: tx-data-bit: "0"
127701-127727 uart: tx-data-bit: "1"
127727-127753 uart: tx-data-bit: "1"
127753-127779 uart: tx-data-bit: "1"
127779-127805 uart: tx-data-bit: "0"
127597-127805 uart: tx-data: "01110110"
127805-127831 uart: tx-stop: "Stop bit" "Stop" "T"
128090-128116 uart: tx-start: "Start bit" "Start" "S"
128116-128142 uart: tx-data-bit: "1"
128142-128168 uart: tx-data-bit: "1"
128168-128194 uart: tx-data-bit: "1"
128194-128220 uart: tx-data-bit: "0"
128220-128246 uart: tx-data-bit: "1"
128246-128272 uart: tx-data-bit: "1"
128272-128298 uart: tx-data-bit: "1"
128298-128324 uart: tx-data-bit: "0"
128116-128324 uart: tx-data: "01110111"
128324-128350 uart: tx-stop: "Stop bit" "Stop" "T"
128608-128634 uart: tx-start: "Start bit" "Start" "S"
128634-128660 uart: tx-data-bit: "0"
128660-128686 uart: tx-data-bit: "0"
128686-128712 uart: tx-data-bit: "0"
128712-128738 uart: tx-data-bit: "1"
128738-128764 uart: tx-data-bit: "1"
128764-128790 uart: tx-data-bit: "1"
128790-128816 uart: tx-data-bit: "1"
128816-128842 uart: tx-data-bit: "0"
128634-128842 uart: tx-data: "01111000"
128842-128868 uart: tx-stop: "Stop bit" "Stop" "T"
129125-129151 uart: tx-start: "Start bit" "Start" "S"
129151-129177 uart: tx-data-bit: "1"
129177-129203 uart: tx-data-bit: "0"
129203-129229 uart: tx-data-bit: "0"
129229-129255 uart: tx-data-bit: "1"
129255-129281 uart: tx-data-bit: "1"
129281-129307 uart: tx-data-bit: "1"
129307-129333 uart: tx-data-bit: "1"
129333-129359 uart: tx-data-bit: "0"
129151-129359 uart: tx-data: "01111001"
129359-129385 uart: tx-stop: "Stop bit" "Stop" "T"
129643-129669 uart: tx-start: "Start bit" "Start" "S"
129669-129695 uart: tx-data-bit: "0"
129695-129721 uart: tx-data-bit: "1"
129721-129747 uart: tx-data-bit: "0"
129747-129773 uart: tx-data-bit: "1"
129773-129799 uart: tx-data-bit: "1"
129799-129825 uart: tx-data-bit: "1"
129825-129851 uart: tx-data-bit: "1"
129851-129877 uart: tx-data-bit: "0"
129669-129877 uart: tx-data: "01111010"
129877-129903 uart: tx-stop: "Stop bit" "Stop" "T"
130162-130188 uart: tx-start: "Start bit" "Start" "S"
130188-130214 uart: tx-data-bit: "1"
130214-130240 uart: tx-data-bit: "1"
130240-130266 uart: tx-data-bit: "0"
130266-130292 uart: tx-data-bit: "1"
130292-130318 uart: tx-data-bit: "1"
130318-130344 uart: tx-data-bit: "1"
130344-130370 uart: tx-data-bit: "1"
130370-130396 uart: tx-data-bit: "0"
130188-130396 uart: tx-data: "01111011"
130396-130422 uart: tx-stop: "Stop bit" "Stop" "T"
130681-130707 uart: tx-start: "Start bit" "Start" "S"
130707-130733 uart: tx-data-bit: "0"
130733-130759 uart: tx-data-bit: "0"
130759-130785 uart: tx-data-bit: "1"
130785-130811 uart: tx-data-bit: "1"
130811-130837 uart: tx-data-bit: "1"
130837-130863 uart: tx-data-bit: "1"
130863-130889 uart: tx-data-bit: "1"
130889-130915 uart: tx-data-bit: "0"
130707-130915 uart: tx-data: "01111100"
130915-130941 uart: tx-stop: "Stop bit" "Stop" "T"
131197-131223 uart: tx-start: "Start bit" "Start" "S"
131223-131249 uart: tx-data-bit: "1"
131249-131275 uart: tx-data-bit: "0"
131275-131301 uart: tx-data-bit: "1"
131301-131327 uart: tx-data-bit: "1"
131327-131353 uart: tx-data-bit: "1"
131353-131379 uart: tx-data-bit: "1"
131379-131405 uart: tx-data-bit: "1"
131405-131431 uart: tx-data-bit: "0"
131223-131431 uart: tx-data: "01111101"
131431-131457 uart: tx-stop: "Stop bit" "Stop" "T"
131716-131742 uart: tx-start: "Start bit" "Start" "S"
131742-131768 uart: tx-data-bit: "0"
131768-131794 uart: tx-data-bit: "1"
131794-131820 uart: tx-data-bit: "1"
131820-131846 uart: tx-data-bit: "1"
131846-131872 uart: tx-data-bit: "1"
131872-131898 uart: tx-data-bit: "1"
131898-131924 uart: tx-data-bit: "1"
131924-131950 uart: tx-data-bit: "0"
131742-131950 uart: tx-data: "01111110"
131950-131976 uart: tx-stop: "Stop bit" "Stop" "T"
132232-132258 uart: tx-start: "Start bit" "Start" "S"
132258-132284 uart: tx-data-bit: "1"
132284-132310 uart: tx-data-bit: "1"
132310-132336 uart: tx-data-bit: "1"
132336-132362 uart: tx-data-bit: "1"
132362-132388 uart: tx-data-bit: "1"
132388-132414 uart: tx-data-bit: "1"
132414-132440 uart: tx-data-bit: "1"
132440-132466 uart: tx-data-bit: "0"
132258-132466 uart: tx-data: "01111111"
132466-132492 uart: tx-stop: "Stop bit" "Stop" "T"
124459-132492 uart: tx-packet: "01110000 01110001 01110010 01110011 01110100 01110101 01110110 01110111 01111000 01111001 01111010 01111011 01111100 01111101 01111110 01111111"
132749-132775 uart: tx-start: "Start bit" "Start" "S"
132775-132801 uart: tx-data-bit: "0"
132801-132827 uart: tx-data-bit: "0"
132827-132853 uart: tx-data-bit: "0"
132853-132879 uart: tx-data-bit: "0"
132879-132905 uart: tx-data-bit: "0"
132905-132931 uart: tx-data-bit: "0"
132931-132957 uart: tx-data-bit: "0"
132957-132983 uart: tx-data-bit: "1"
132775-132983 uart: tx-data: "10000000"
132983-133009 uart: tx-stop: "Stop bit" "Stop" "T"
133263-133289 uart: tx-start: "Start bit" "Start" "S"
133289-133315 uart: tx-data-bit: "1"
133315-133341 uart: tx-data-bit: "0"
133341-133367 uart: tx-data-bit: "0"
133367-133393 uart: tx-data-bit: "0"
133393-133419 uart: tx-data-bit: "0"
133419-133445 uart: tx-data-bit: "0"
133445-133471 uart: tx-data-bit: "0"
133471-133497 uart: tx-data-bit: "1"
133289-133497 uart: tx-data: "10000001"
133497-133523 uart: tx-stop: "Stop bit" "Stop" "T"
133780-133806 uart: tx-start: "Start bit" "Start" "S"
133806-133832 uart: tx-data-bit: "0"
133832-133858 uart: tx-data-bit: "1"
133858-133884 uart: tx-data-bit: "0"
133884-133910 uart: tx-data-bit: "0"
133910-133936 uart: tx-data-bit: "0"
133936-133962 uart: tx-data-bit: "0"
133962-133988 uart: tx-data-bit: "0"
133988-134014 uart: tx-data-bit: "1"
133806-134014 uart: tx-data: "10000010"
134014-134040 uart: tx-stop: "Stop bit" "Stop" "T"
134297-134323 uart: tx-start: "Start bit" "Start" "S"
134323-134349 uart: tx-data-bit: "1"
134349-134375 uart: tx-data-bit: "1"
134375-134401 uart: tx-data-bit: "0"
134401-134427 uart: tx-data-bit: "0"
134427-134453 uart: tx-data-bit: "0"
134453-134479 uart: tx-data-bit: "0"
134479-134505 uart: tx-data-bit: "0"
134505-134531 uart: tx-data-bit: "1"
134323-134531 uart: tx-data: "10000011"
134531-134557 uart: tx-stop: "Stop bit" "Stop" "T"
134813-134839 uart: tx-start: "Start bit" "Start" "S"
134839-134865 uart: tx-data-bit: "0"
134865-134891 uart: tx-data-bit: "0"
134891-134917 uart: tx-data-bit: "1"
134917-134943 uart: tx-data-bit: "0"
134943-134969 uart: tx-data-bit: "0"
134969-134995 uart: tx-data-bit: "0"
134995-135021 uart: tx-data-bit: "0"
135021-135047 uart: tx-data-bit: "1"
134839-135047 uart: tx-data: "10000100"
135047-135073 uart: tx-stop: "Stop bit" "Stop" "T"
135330-135356 uart: tx-start: "Start bit" "Start" "S"
135356-135382 uart: tx-data-bit: "1"
135382-135408 uart: tx-data-bit: "0"
135408-135434 uart: tx-data-bit: "1"
135434-135460 uart: tx-data-bit: "0"
135460-135486 uart: tx-data-bit: "0"
135486-135512 uart: tx-data-bit: "0"
135512-135538 uart: tx-data-bit: "0"
135538-135564 uart: tx-data-bit: "1"
135356-135564 uart: tx-data: "10000101"
135564-135590 uart: tx-stop: "Stop bit" "Stop" "T"
135848-135874 uart: tx-start: "Start bit" "Start" "S"
135874-135900 uart: tx-data-bit: "0"
135900-135926 uart: tx-data-bit: "1"
135926-135952 uart: tx-data-bit: "1"
135952-135978 uart: tx-data-bit: "0"
135978-136004 uart: tx-data-bit: "0"
136004-136030 uart: tx-data-bit: "0"
136030-136056 uart: tx-data-bit: "0"
136056-136082 uart: tx-data-bit: "1"
135874-136082 uart: tx-data: "10000110"
136082-136108 uart: tx-stop: "Stop bit" "Stop" "T"
136365-136391 uart: tx-start: "Start bit" "Start" "S"
136391-136417 uart: tx-data-bit: "1"
136417-136443 uart: tx-data-bit: "1"
136443-136469 uart: tx-data-bit: "1"
136469-136495 uart: tx-data-bit: "0"
136495-136521 uart: tx-data-bit: "0"
136521-136547 uart: tx-data-bit: "0"
136547-136573 uart: tx-data-bit: "0"
136573-136599 uart: tx-data-bit: "1"
136391-136599 uart: tx-data: "10000111"
136599-136625 uart: tx-stop: "Stop bit" "Stop" "T"
136882-136908 uart: tx-start: "Start bit" "Start" "S"
136908-136934 uart: tx-data-bit: "0"
136934-136960 uart: tx-data-bit: "0"
136960-136986 uart: tx-data-bit: "0"
136986-137012 uart: tx-data-bit: "1"
137012-137038 uart: tx-data-bit: "0"
137038-137064 uart: tx-data-bit: "0"
137064-137090 uart: tx-data-bit: "0"
137090-137116 uart: tx-data-bit: "1"
136908-137116 uart: tx-data: "10001000"
137116-137142 uart: tx-stop: "Stop bit" "Stop" "T"
137398-137424 uart: tx-start: "Start bit" "Start" "S"
137424-137450 uart: tx-data-bit: "1"
137450-137476 uart: tx-data-bit: "0"
137476-137502 uart: tx-data-bit: "0"
137502-137528 uart: tx-data-bit: "1"
137528-137554 uart: tx-data-bit: "0"
137554-137580 uart: tx-data-bit: "0"
137580-137606 uart: tx-data-bit: "0"
137606-137632 uart: tx-data-bit: "1"
137424-137632 uart: tx-data: "10001001"
137632-137658 uart: tx-stop: "Stop bit" "Stop" "T"
137917-137943 uart: tx-start: "Start bit" "Start" "S"
137943-137969 uart: tx-data-bit: "0"
137969-137995 uart: tx-data-bit: "1"
137995-138021 uart: tx-data-bit: "0"
138021-138047 uart: tx-data-bit: "1"
138047-138073 uart: tx-data-bit: "0"
138073-138099 uart: tx-data-bit: "0"
138099-138125 uart: tx-data-bit: "0"
138125-138151 uart: tx-data-bit: "1"
137943-138151 uart: tx-data: "10001010"
138151-138177 uart: tx-stop: "Stop bit" "Stop" "T"
138435-138461 uart: tx-start: "Start bit" "Start" "S"
138461-138487 uart: tx-data-bit: "1"
138487-138513 uart: tx-data-bit: "1"
138513-138539 uart: tx-data-bit: "0"
138539-138565 uart: tx-data-bit: "1"
138565-138591 uart: tx-data-bit: "0"
138591-138617 uart: tx-data-bit: "0"
138617-138643 uart: tx-data-bit: "0"
138643-138669 uart: tx-data-bit: "1"
138461-138669 uart: tx-data: "10001011"
138669-138695 uart: tx-stop: "Stop bit" "Stop" "T"
138954-138980 uart: tx-start: "Start bit" "Start" "S"
138980-139006 uart: tx-data-bit: "0"
139006-139032 uart: tx-data-bit: "0"
139032-139058 uart: tx-data-bit: "1"
139058-139084 uart: tx-data-bit: "1"
139084-139110 uart: tx-data-bit: "0"
139110-139136 uart: tx-data-bit: "0"
139136-139162 uart: tx-data-bit: "0"
139162-139188 uart: tx-data-bit: "1"
138980-139188 uart: tx-data: "10001100"
139188-139214 uart: tx-stop: "Stop bit" "Stop" "T"
139470-139496 uart: tx-start: "Start bit" "Start" "S"
139496-139522 uart: tx-data-bit: "1"
139522-139548 uart: tx-data-bit: "0"
139548-139574 uart: tx-data-bit: "1"
139574-139600 uart: tx-data-bit: "1"
139600-139626 uart: tx-data-bit: "0"
139626-139652 uart: tx-data-bit: "0"
139652-139678 uart: tx-data-bit: "0"
139678-139704 uart: tx-data-bit: "1"
139496-139704 uart: tx-data: "10001101"
139704-139730 uart: tx-stop: "Stop bit" "Stop" "T"
139989-140015 uart: tx-start: "Start bit" "Start" "S"
140015-140041 uart: tx-data-bit: "0"
140041-140067 uart: tx-data-bit: "1"
140067-140093 uart: tx-data-bit: "1"
140093-140119 uart: tx-data-bit: "1"
140119-140145 uart: tx-data-bit: "0"
140145-140171 uart: tx-data-bit: "0"
140171-140197 uart: tx-data-bit: "0"
140197-140223 uart: tx-data-bit: "1"
140015-140223 uart: tx-data: "10001110"
140223-140249 uart: tx-stop: "Stop bit" "Stop" "T"
140506-140532 uart: tx-start: "Start bit" "Start" "S"
140532-140558 uart: tx-data-bit: "1"
140558-140584 uart: tx-data-bit: "1"
140584-140610 uart: tx-data-bit: "1"
140610-140636 uart: tx-data-bit: "1"
140636-140662 uart: tx-data-bit: "0"
140662-140688 uart: tx-data-bit: "0"
140688-140714 uart: tx-data-bit: "0"
140714-140740 uart: tx-data-bit: "1"
140532-140740 uart: tx-data: "10001111"
140740-140766 uart: tx-stop: "Stop bit" "Stop" "T"
132749-140766 uart: tx-packet: "10000000 10000001 10000010 10000011 10000100 10000101 10000110 10000111 10001000 10001001 10001010 10001011 10001100 10001101 10001110 10001111"
141022-141048 uart: tx-start: "Start bit" "Start" "S"
141048-141074 uart: tx-data-bit: "0"
141074-141100 uart: tx-data-bit: "0"
141100-141126 uart: tx-data-bit: "0"
141126-141152 uart: tx-data-bit: "0"
141152-141178 uart: tx-data-bit: "1"
141178-141204 uart: tx-data-bit: "0"
141204-141230 uart: tx-data-bit: "0"
141230-141256 uart: tx-data-bit: "1"
141048-141256 uart: tx-data: "10010000"
141256-141282 uart: tx-stop: "Stop bit" "Stop" "T"
141539-141565 uart: tx-start: "Start bit" "Start" "S"
141565-141591 uart: tx-data-bit: "1"
141591-141617 uart: tx-data-bit: "0"
141617-141643 uart: tx-data-bit: "0"
141643-141669 uart: tx-data-bit: "0"
141669-141695 uart: tx-data-bit: "1"
141695-141721 uart: tx-data-bit: "0"
141721-141747 uart: tx-data-bit: "0"
141747-141773 uart: tx-data-bit: "1"
141565-141773 uart: tx-data: "10010001"
141773-141799 uart: tx-stop: "Stop bit" "Stop" "T"
142057-142083 uart: tx-start: "Start bit" "Start" "S"
142083-142109 uart: tx-data-bit: "0"
142109-142135 uart: tx-data-bit: "1"
142135-142161 uart: tx-data-bit: "0"
142161-142187 uart: tx-data-bit: "0"
142187-142213 uart: tx-data-bit: "1"
142213-142239 uart: tx-data-bit: "0"
142239-142265 uart: tx-data-bit: "0"
142265-142291 uart: tx-data-bit: "1"
142083-142291 uart: tx-data: "10010010"
142291-142317 uart: tx-stop: "Stop bit" "Stop" "T"
142576-142602 uart: tx-start: "Start bit" "Start" "S"
142602-142628 uart: tx-data-bit: "1"
142628-142654 uart: tx-data-bit: "1"
142654-142680 uart: tx-data-bit: "0"
142680-142706 uart: tx-data-bit: "0"
142706-142732 uart: tx-data-bit: "1"
142732-142758 uart: tx-data-bit: "0"
142758-142784 uart: tx-data-bit: "0"
142784-142810 uart: tx-data-bit: "1"
142602-142810 uart: tx-data: "10010011"
142810-142836 uart: tx-stop: "Stop bit" "Stop" "T"
143095-143121 uart: tx-start: "Start bit" "Start" "S"
143121-143147 uart: tx-data-bit: "0"
143147-143173 uart: tx-data-bit: "0"
143173-143199 uart: tx-data-bit: "1"
143199-143225 uart: tx-data-bit: "0"
143225-143251 uart: tx-data-bit: "1"
143251-143277 uart: tx-data-bit: "0"
143277-143303 uart: tx-data-bit: "0"
143303-143329 uart: tx-data-bit: "1"
143121-143329 uart: tx-data: "10010100"
143329-143355 uart: tx-stop: "Stop bit" "Stop" "T"
143613-143639 uart: tx-start: "Start bit" "Start" "S"
143639-143665 uart: tx-data-bit: "1"
143665-143691 uart: tx-data-bit: "0"
143691-143717 uart: tx-data-bit: "1"
143717-143743 uart: tx-data-bit: "0"
143743-143769 uart: tx-data-bit: "1"
143769-143795 uart: tx-data-bit: "0"
143795-143821 uart: tx-data-bit: "0"
143821-143847 uart: tx-data-bit: "1"
143639-143847 uart: tx-data: "10010101"
143847-143873 uart: tx-stop: "Stop bit" "Stop" "T"
144134-144160 uart: tx-start: "Start bit" "Start" "S"
144160-144186 uart: tx-data-bit: "0"
144186-144212 uart: tx-data-bit: "1"
144212-144238 uart: tx-data-bit: "1"
144238-144264 uart: tx-data-bit: "0"
144264-144290 uart: tx-data-bit: "1"
144290-144316 uart: tx-data-bit: "0"
144316-144342 uart: tx-data-bit: "0"
144342-144368 uart: tx-data-bit: "1"
144160-144368 uart: tx-data: "10010110"
144368-144394 uart: tx-stop: "Stop bit" "Stop" "T"
144652-144678 uart: tx-start: "Start bit" "Start" "S"
144678-144704 uart: tx-data-bit: "1"
144704-144730 uart: tx-data-bit: "1"
144730-144756 uart: tx-data-bit: "1"
144756-144782 uart: tx-data-bit: "0"
144782-144808 uart: tx-data-bit: "1"
144808-144834 uart: tx-data-bit: "0"
144834-144860 uart: tx-data-bit: "0"
144860-144886 uart: tx-data-bit: "1"
144678-144886 uart: tx-data: "10010111"
144886-144912 uart: tx-stop: "Stop bit" "Stop" "T"
145171-145197 uart: tx-start: "Start bit" "Start" "S"
145197-145223 uart: tx-data-bit: "0"
145223-145249 uart: tx-data-bit: "0"
145249-145275 uart: tx-data-bit: "0"
145275-145301 uart: tx-data-bit: "1"
145301-145327 uart: tx-data-bit: "1"
145327-145353 uart: tx-data-bit: "0"
145353-145379 uart: tx-data-bit: "0"
145379-145405 uart: tx-data-bit: "1"
145197-145405 uart: tx-data: "10011000"
145405-145431 uart: tx-stop: "Stop bit" "Stop" "T"
145687-145713 uart: tx-start: "Start bit" "Start" "S"
145713-145739 uart: tx-data-bit: "1"
145739-145765 uart: tx-data-bit: "0"
145765-145791 uart: tx-data-bit: "0"
145791-145817 uart: tx-data-bit: "1"
145817-145843 uart: tx-data-bit: "1"
145843-145869 uart: tx-data-bit: "0"
145869-145895 uart: tx-data-bit: "0"
145895-145921 uart: tx-data-bit: "1"
145713-145921 uart: tx-data: "10011001"
145921-145947 uart: tx-stop: "Stop bit" "Stop" "T"
146206-146232 uart: tx-start: "Start bit" "Start" "S"
146232-146258 uart: tx-data-bit: "0"
146258-146284 uart: tx-data-bit: "1"
146284-146310 uart: tx-data-bit: "0"
146310-146336 uart: tx-data-bit: "1"
146336-146362 uart: tx-data-bit: "1"
146362-146388 uart: tx-data-bit: "0"
146388-146414 uart: tx-data-bit: "0"
146414-146440 uart: tx-data-bit: "1"
146232-146440 uart: tx-data: "10011010"
146440-146466 uart: tx-stop: "Stop bit" "Stop" "T"
146725-146751 uart: tx-start: "Start bit" "Start" "S"
146751-146777 uart: tx-data-bit: "1"
146777-146803 uart: tx-data-bit: "1"
146803-146829 uart: tx-data-bit: "0"
146829-146855 uart: tx-data-bit: "1"
146855-146881 uart: tx-data-bit: "1"
146881-146907 uart: tx-data-bit: "0"
146907-146933 uart: tx-data-bit: "0"
146933-146959 uart: tx-data-bit: "1"
146751-146959 uart: tx-data: "10011011"
146959-146985 uart: tx-stop: "Stop bit" "Stop" "T"
147243-147269 uart: tx-start: "Start bit" "Start" "S"
147269-147295 uart: tx-data-bit: "0"
147295-147321 uart: tx-data-bit: "0"
147321-147347 uart: tx-data-bit: "1"
147347-147373 uart: tx-data-bit: "1"
147373-147399 uart: tx-data-bit: "1"
147399-147425 uart: tx-data-bit: "0"
147425-147451 uart: tx-data-bit: "0"
147451-147477 uart: tx-data-bit: "1"
147269-147477 uart: tx-data: "10011100"
147477-147503 uart: tx-stop: "Stop bit" "Stop" "T"
147760-147786 uart: tx-start: "Start bit" "Start" "S"
147786-147812 uart: tx-data-bit: "1"
147812-147838 uart: tx-data-bit: "0"
147838-147864 uart: tx-data-bit: "1"
147864-147890 uart: tx-data-bit: "1"
147890-147916 uart: tx-data-bit: "1"
147916-147942 uart: tx-data-bit: "0"
147942-147968 uart: tx-data-bit: "0"
147968-147994 uart: tx-data-bit: "1"
147786-147994 uart: tx-data: "10011101"
147994-148020 uart: tx-stop: "Stop bit" "Stop" "T"
148278-148304 uart: tx-start: "Start bit" "Start" "S"
148304-148330 uart: tx-data-bit: "0"
148330-148356 uart: tx-data-bit: "1"
148356-148382 uart: tx-data-bit: "1"
148382-148408 uart: tx-data-bit: "1"
148408-148434 uart: tx-data-bit: "1"
148434-148460 uart: tx-data-bit: "0"
148460-148486 uart: tx-data-bit: "0"
148486-148512 uart: tx-data-bit: "1"
148304-148512 uart: tx-data: "10011110"
148512-148538 uart: tx-stop: "Stop bit" "Stop" "T"
148795-148821 uart: tx-start: "Start bit" "Start" "S"
148821-148847 uart: tx-data-bit: "1"
148847-148873 uart: tx-data-bit: "1"
148873-148899 uart: tx-data-bit: "1"
148899-148925 uart: tx-data-bit: "1"
148925-148951 uart: tx-data-bit: "1"
148951-148977 uart: tx-data-bit: "0"
148977-149003 uart: tx-data-bit: "0"
149003-149029 uart: tx-data-bit: "1"
148821-149029 uart: tx-data: "10011111"
149029-149055 uart: tx-stop: "Stop bit" "Stop" "T"
141022-149055 uart: tx-packet: "10010000 10010001 10010010 10010011 10010100 10010101 10010110 10010111 10011000 10011001 10011010 10011011 10011100 10011101 10011110 10011111"
149312-149338 uart: tx-start: "Start bit" "Start" "S"
149338-149364 uart: tx-data-bit: "0"
149364-149390 uart: tx-data-bit: "0"
149390-149416 uart: tx-data-bit: "0"
149416-149442 uart: tx-data-bit: "0"
149442-149468 uart: tx-data-bit: "0"
149468-149494 uart: tx-data-bit: "1"
149494-149520 uart: tx-data-bit: "0"
149520-149546 uart: tx-data-bit: "1"
149338-149546 uart: tx-data: "10100000"
149546-149572 uart: tx-stop: "Stop bit" "Stop" "T"
149828-149854 uart: tx-start: "Start bit" "Start" "S"
149854-149880 uart: tx-data-bit: "1"
149880-149906 uart: tx-data-bit: "0"
149906-149932 uart: tx-data-bit: "0"
149932-149958 uart: tx-data-bit: "0"
149958-149984 uart: tx-data-bit: "0"
149984-150010 uart: tx-data-bit: "1"
150010-150036 uart: tx-data-bit: "0"
150036-150062 uart: tx-data-bit: "1"
149854-150062 uart: tx-data: "10100001"
150062-150088 uart: tx-stop: "Stop bit" "Stop" "T"
150347-150373 uart: tx-start: "Start bit" "Start" "S"
150373-150399 uart: tx-data-bit: "0"
150399-150425 uart: tx-data-bit: "1"
150425-150451 uart: tx-data-bit: "0"
150451-150477 uart: tx-data-bit: "0"
150477-150503 uart: tx-data-bit: "0"
150503-150529 uart: tx-data-bit: "1"
150529-150555 uart: tx-data-bit: "0"
150555-150581 uart: tx-data-bit: "1"
150373-150581 uart: tx-data: "10100010"
150581-150607 uart: tx-stop: "Stop bit" "Stop" "T"
150865-150891 uart: tx-start: "Start bit" "Start" "S"
150891-150917 uart: tx-data-bit: "1"
150917-150943 uart: tx-data-bit: "1"
150943-150969 uart: tx-data-bit: "0"
150969-150995 uart: tx-data-bit: "0"
150995-151021 uart: tx-data-bit: "0"
151021-151047 uart: tx-data-bit: "1"
151047-151073 uart: tx-data-bit: "0"
151073-151099 uart: tx-data-bit: "1"
150891-151099 uart: tx-data: "10100011"
151099-151125 uart: tx-stop: "Stop bit" "Stop" "T"
151384-151410 uart: tx-start: "Start bit" "Start" "S"
151410-151436 uart: tx-data-bit: "0"
151436-151462 uart: tx-data-bit: "0"
151462-151488 uart: tx-data-bit: "1"
151488-151514 uart: tx-data-bit: "0"
151514-151540 uart: tx-data-bit: "0"
151540-151566 uart: tx-data-bit: "1"
151566-151592 uart: tx-data-bit: "0"
151592-151618 uart: tx-data-bit: "1"
151410-151618 uart: tx-data: "10100100"
151618-151644 uart: tx-stop: "Stop bit" "Stop" "T"
151903-151929 uart: tx-start: "Start bit" "Start" "S"
151929-151955 uart: tx-data-bit: "1"
151955-151981 uart: tx-data-bit: "0"
151981-152007 uart: tx-data-bit: "1"
152007-152033 uart: tx-data-bit: "0"
152033-152059 uart: tx-data-bit: "0"
152059-152085 uart: tx-data-bit: "1"
152085-152111 uart: tx-data-bit: "0"
152111-152137 uart: tx-data-bit: "1"
151929-152137 uart: tx-data: "10100101"
152137-152163 uart: tx-stop: "Stop bit" "Stop" "T"
152423-152449 uart: tx-start: "Start bit" "Start" "S"
152449-152475 uart: tx-data-bit: "0"
152475-152501 uart: tx-data-bit: "1"
152501-152527 uart: tx-data-bit: "1"
152527-152553 uart: tx-data-bit: "0"
152553-152579 uart: tx-data-bit: "0"
152579-152605 uart: tx-data-bit: "1"
152605-152631 uart: tx-data-bit: "0"
152631-152657 uart: tx-data-bit: "1"
152449-152657 uart: tx-data: "10100110"
152657-152683 uart: tx-stop: "Stop bit" "Stop" "T"
152942-152968 uart: tx-start: "Start bit" "Start" "S"
152968-152994 uart: tx-data-bit: "1"
152994-153020 uart: tx-data-bit: "1"
153020-153046 uart: tx-data-bit: "1"
153046-153072 uart: tx-data-bit: "0"
153072-153098 uart: tx-data-bit: "0"
153098-153124 uart: tx-data-bit: "1"
153124-153150 uart: tx-data-bit: "0"
153150-153176 uart: tx-data-bit: "1"
152968-153176 uart: tx-data: "10100111"
153176-153202 uart: tx-stop: "Stop bit" "Stop" "T"
153460-153486 uart: tx-start: "Start bit" "Start" "S"
153486-153512 uart: tx-data-bit: "0"
153512-153538 uart: tx-data-bit: "0"
153538-153564 uart: tx-data-bit: "0"
153564-153590 uart: tx-data-bit: "1"
153590-153616 uart: tx-data-bit: "0"
153616-153642 uart: tx-data-bit: "1"
153642-153668 uart: tx-data-bit: "0"
153668-153694 uart: tx-data-bit: "1"
153486-153694 uart: tx-data: "10101000"
153694-153720 uart: tx-stop: "Stop bit" "Stop" "T"
153979-154005 uart: tx-start: "Start bit" "Start" "S"
154005-154031 uart: tx-data-bit: "1"
154031-154057 uart: tx-data-bit: "0"
154057-154083 uart: tx-data-bit: "0"
154083-154109 uart: tx-data-bit: "1"
154109-154135 uart: tx-data-bit: "0"
154135-154161 uart: tx-data-bit: "1"
154161-154187 uart: tx-data-bit: "0"
154187-154213 uart: tx-data-bit: "1"
154005-154213 uart: tx-data: "10101001"
154213-154239 uart: tx-stop: "Stop bit" "Stop" "T"
154499-154525 uart: tx-start: "Start bit" "Start" "S"
154525-154551 uart: tx-data-bit: "0"
154551-154577 uart: tx-data-bit: "1"
154577-154603 uart: tx-data-bit: "0"
154603-154629 uart: tx-data-bit: "1"
154629-154655 uart: tx-data-bit: "0"
154655-154681 uart: tx-data-bit: "1"
154681-154707 uart: tx-data-bit: "0"
154707-154733 uart: tx-data-bit: "1"
154525-154733 uart: tx-data: "10101010"
154733-154759 uart: tx-stop: "Stop bit" "Stop" "T"
155020-155046 uart: tx-start: "Start bit" "Start" "S"
155046-155072 uart: tx-data-bit: "1"
155072-155098 uart: tx-data-bit: "1"
155098-155124 uart: tx-data-bit: "0"
155124-155150 uart: tx-data-bit: "1"
155150-155176 uart: tx-data-bit: "0"
155176-155202 uart: tx-data-bit: "1"
155202-155228 uart: tx-data-bit: "0"
155228-155254 uart: tx-data-bit: "1"
155046-155254 uart: tx-data: "10101011"
155254-155280 uart: tx-stop: "Stop bit" "Stop" "T"
155541-155567 uart: tx-start: "Start bit" "Start" "S"
155567-155593 uart: tx-data-bit: "0"
155593-155619 uart: tx-data-bit: "0"
155619-155645 uart: tx-data-bit: "1"
155645-155671 uart: tx-data-bit: "1"
155671-155697 uart: tx-data-bit: "0"
155697-155723 uart: tx-data-bit: "1"
155723-155749 uart: tx-data-bit: "0"
155749-155775 uart: tx-data-bit: "1"
155567-155775 uart: tx-data: "10101100"
155775-155801 uart: tx-stop: "Stop bit" "Stop" "T"
156059-156085 uart: tx-start: "Start bit" "Start" "S"
156085-156111 uart: tx-data-bit: "1"
156111-156137 uart: tx-data-bit: "0"
156137-156163 uart: tx-data-bit: "1"
156163-156189 uart: tx-data-bit: "1"
156189-156215 uart: tx-data-bit: "0"
156215-156241 uart: tx-data-bit: "1"
156241-156267 uart: tx-data-bit: "0"
156267-156293 uart: tx-data-bit: "1"
156085-156293 uart: tx-data: "10101101"
156293-156319 uart: tx-stop: "Stop bit" "Stop" "T"
156580-156606 uart: tx-start: "Start bit" "Start" "S"
156606-156632 uart: tx-data-bit: "0"
156632-156658 uart: tx-data-bit: "1"
156658-156684 uart: tx-data-bit: "1"
156684-156710 uart: tx-data-bit: "1"
156710-156736 uart: tx-data-bit: "0"
156736-156762 uart: tx-data-bit: "1"
156762-156788 uart: tx-data-bit: "0"
156788-156814 uart: tx-data-bit: "1"
156606-156814 uart: tx-data: "10101110"
156814-156840 uart: tx-stop: "Stop bit" "Stop" "T"
157098-157124 uart: tx-start: "Start bit" "Start" "S"
157124-157150 uart: tx-data-bit: "1"
157150-157176 uart: tx-data-bit: "1"
157176-157202 uart: tx-data-bit: "1"
157202-157228 uart: tx-data-bit: "1"
157228-157254 uart: tx-data-bit: "0"
157254-157280 uart: tx-data-bit: "1"
157280-157306 uart: tx-data-bit: "0"
157306-157332 uart: tx-data-bit: "1"
157124-157332 uart: tx-data: "10101111"
157332-157358 uart: tx-stop: "Stop bit" "Stop" "T"
149312-157358 uart: tx-packet: "10100000 10100001 10100010 10100011 10100100 10100101 10100110 10100111 10101000 10101001 10101010 10101011 10101100 10101101 10101110 10101111"
157617-157643 uart: tx-start: "Start bit" "Start" "S"
157643-157669 uart: tx-data-bit: "0"
157669-157695 uart: tx-data-bit: "0"
157695-157721 uart: tx-data-bit: "0"
157721-157747 uart: tx-data-bit: "0"
157747-157773 uart: tx-data-bit: "1"
157773-157799 uart: tx-data-bit: "1"
157799-157825 uart: tx-data-bit: "0"
157825-157851 uart: tx-data-bit: "1"
157643-157851 uart: tx-data: "10110000"
157851-157877 uart: tx-stop: "Stop bit" "Stop" "T"
158134-158160 uart: tx-start: "Start bit" "Start" "S"
158160-158186 uart: tx-data-bit: "1"
158186-158212 uart: tx-data-bit: "0"
158212-158238 uart: tx-data-bit: "0"
158238-158264 uart: tx-data-bit: "0"
158264-158290 uart: tx-data-bit: "1"
158290-158316 uart: tx-data-bit: "1"
158316-158342 uart: tx-data-bit: "0"
158342-158368 uart: tx-data-bit: "1"
158160-158368 uart: tx-data: "10110001"
158368-158394 uart: tx-stop: "Stop bit" "Stop" "T"
158652-158678 uart: tx-start: "Start bit" "Start" "S"
158678-158704 uart: tx-data-bit: "0"
158704-158730 uart: tx-data-bit: "1"
158730-158756 uart: tx-data-bit: "0"
158756-158782 uart: tx-data-bit: "0"
158782-158808 uart: tx-data-bit: "1"
158808-158834 uart: tx-data-bit: "1"
158834-158860 uart: tx-data-bit: "0"
158860-158886 uart: tx-data-bit: "1"
158678-158886 uart: tx-data: "10110010"
158886-158912 uart: tx-stop: "Stop bit" "Stop" "T"
159171-159197 uart: tx-start: "Start bit" "Start" "S"
159197-159223 uart: tx-data-bit: "1"
159223-159249 uart: tx-data-bit: "1"
159249-159275 uart: tx-data-bit: "0"
159275-159301 uart: tx-data-bit: "0"
159301-159327 uart: tx-data-bit: "1"
159327-159353 uart: tx-data-bit: "1"
159353-159379 uart: tx-data-bit: "0"
159379-159405 uart: tx-data-bit: "1"
159197-159405 uart: tx-data: "10110011"
159405-159431 uart: tx-stop: "Stop bit" "Stop" "T"
159689-159715 uart: tx-start: "Start bit" "Start" "S"
159715-159741 uart: tx-data-bit: "0"
159741-159767 uart: tx-data-bit: "0"
159767-159793 uart: tx-data-bit: "1"
159793-159819 uart: tx-data-bit: "0"
159819-159845 uart: tx-data-bit: "1"
159845-159871 uart: tx-data-bit: "1"
159871-159897 uart: tx-data-bit: "0"
159897-159923 uart: tx-data-bit: "1"
159715-159923 uart: tx-data: "10110100"
159923-159949 uart: tx-stop: "Stop bit" "Stop" "T"
160208-160234 uart: tx-start: "Start bit" "Start" "S"
160234-160260 uart: tx-data-bit: "1"
160260-160286 uart: tx-data-bit: "0"
160286-160312 uart: tx-data-bit: "1"
160312-160338 uart: tx-data-bit: "0"
160338-160364 uart: tx-data-bit: "1"
160364-160390 uart: tx-data-bit: "1"
160390-160416 uart: tx-data-bit: "0"
160416-160442 uart: tx-data-bit: "1"
160234-160442 uart: tx-data: "10110101"
160442-160468 uart: tx-stop: "Stop bit" "Stop" "T"
160728-160754 uart: tx-start: "Start bit" "Start" "S"
160754-160780 uart: tx-data-bit: "0"
160780-160806 uart: tx-data-bit: "1"
160806-160832 uart: tx-data-bit: "1"
160832-160858 uart: tx-data-bit: "0"
160858-160884 uart: tx-data-bit: "1"
160884-160910 uart: tx-data-bit: "1"
160910-160936 uart: tx-data-bit: "0"
160936-160962 uart: tx-data-bit: "1"
160754-160962 uart: tx-data: "10110110"
160962-160988 uart: tx-stop: "Stop bit" "Stop" "T"
161247-161273 uart: tx-start: "Start bit" "Start" "S"
161273-161299 uart: tx-data-bit: "1"
161299-161325 uart: tx-data-bit: "1"
161325-161351 uart: tx-data-bit: "1"
161351-161377 uart: tx-data-bit: "0"
161377-161403 uart: tx-data-bit: "1"
161403-161429 uart: tx-data-bit: "1"
161429-161455 uart: tx-data-bit: "0"
161455-161481 uart: tx-data-bit: "1"
161273-161481 uart: tx-data: "10110111"
161481-161507 uart: tx-stop: "Stop bit" "Stop" "T"
161766-161792 uart: tx-start: "Start bit" "Start" "S"
161792-161818 uart: tx-data-bit: "0"
161818-161844 uart: tx-data-bit: "0"
161844-161870 uart: tx-data-bit: "0"
161870-161896 uart: tx-data-bit: "1"
161896-161922 uart: tx-data-bit: "1"
161922-161948 uart: tx-data-bit: "1"
161948-161974 uart: tx-data-bit: "0"
161974-162000 uart: tx-data-bit: "1"
161792-162000 uart: tx-data: "10111000"
162000-162026 uart: tx-stop: "Stop bit" "Stop" "T"
162282-162308 uart: tx-start: "Start bit" "Start" "S"
162308-162334 uart: tx-data-bit: "1"
162334-162360 uart: tx-data-bit: "0"
162360-162386 uart: tx-data-bit: "0"
162386-162412 uart: tx-data-bit: "1"
162412-162438 uart: tx-data-bit: "1"
162438-162464 uart: tx-data-bit: "1"
162464-162490 uart: tx-data-bit: "0"
162490-162516 uart: tx-data-bit: "1"
162308-162516 uart: tx-data: "10111001"
162516-162542 uart: tx-stop: "Stop bit" "Stop" "T"
162801-162827 uart: tx-start: "Start bit" "Start" "S"
162827-162853 uart: tx-data-bit: "0"
162853-162879 uart: tx-data-bit: "1"
162879-162905 uart: tx-data-bit: "0"
162905-162931 uart: tx-data-bit: "1"
162931-162957 uart: tx-data-bit: "1"
162957-162983 uart: tx-data-bit: "1"
162983-163009 uart: tx-data-bit: "0"
163009-163035 uart: tx-data-bit: "1"
162827-163035 uart: tx-data: "10111010"
163035-163061 uart: tx-stop: "Stop bit" "Stop" "T"
163319-163345 uart: tx-start: "Start bit" "Start" "S"
163345-163371 uart: tx-data-bit: "1"
163371-163397 uart: tx-data-bit: "1"
163397-163423 uart: tx-data-bit: "0"
163423-163449 uart: tx-data-bit: "1"
163449-163475 uart: tx-data-bit: "1"
163475-163501 uart: tx-data-bit: "1"
163501-163527 uart: tx-data-bit: "0"
163527-163553 uart: tx-data-bit: "1"
163345-163553 uart: tx-data: "10111011"
163553-163579 uart: tx-stop: "Stop bit" "Stop" "T"
163838-163864 uart: tx-start: "Start bit" "Start" "S"
163864-163890 uart: tx-data-bit: "0"
163890-163916 uart: tx-data-bit: "0"
163916-163942 uart: tx-data-bit: "1"
163942-163968 uart: tx-data-bit: "1"
163968-163994 uart: tx-data-bit: "1"
163994-164020 uart: tx-data-bit: "1"
164020-164046 uart: tx-data-bit: "0"
164046-164072 uart: tx-data-bit: "1"
163864-164072 uart: tx-data: "10111100"
164072-164098 uart: tx-stop: "Stop bit" "Stop" "T"
164355-164381 uart: tx-start: "Start bit" "Start" "S"
164381-164407 uart: tx-data-bit: "1"
164407-164433 uart: tx-data-bit: "0"
164433-164459 uart: tx-data-bit: "1"
164459-164485 uart: tx-data-bit: "1"
164485-164511 uart: tx-data-bit: "1"
164511-164537 uart: tx-data-bit: "1"
164537-164563 uart: tx-data-bit: "0"
164563-164589 uart: tx-data-bit: "1"
164381-164589 uart: tx-data: "10111101"
164589-164615 uart: tx-stop: "Stop bit" "Stop" "T"
164873-164899 uart: tx-start: "Start bit" "Start" "S"
164899-164925 uart: tx-data-bit: "0"
164925-164951 uart: tx-data-bit: "1"
164951-164977 uart: tx-data-bit: "1"
164977-165003 uart: tx-data-bit: "1"
165003-165029 uart: tx-data-bit: "1"
165029-165055 uart: tx-data-bit: "1"
165055-165081 uart: tx-data-bit: "0"
165081-165107 uart: tx-data-bit: "1"
164899-165107 uart: tx-data: "10111110"
165107-165133 uart: tx-stop: "Stop bit" "Stop" "T"
165390-165416 uart: tx-start: "Start bit" "Start" "S"
165416-165442 uart: tx-data-bit: "1"
165442-165468 uart: tx-data-bit: "1"
165468-165494 uart: tx-data-bit: "1"
165494-165520 uart: tx-data-bit: "1"
165520-165546 uart: tx-data-bit: "1"
165546-165572 uart: tx-data-bit: "1"
165572-165598 uart: tx-data-bit: "0"
165598-165624 uart: tx-data-bit: "1"
165416-165624 uart: tx-data: "10111111"
165624-165650 uart: tx-stop: "Stop bit" "Stop" "T"
157617-165650 uart: tx-packet: "10110000 10110001 10110010 10110011 10110100 10110101 10110110 10110111 10111000 10111001 10111010 10111011 10111100 10111101 10111110 10111111"
165906-165932 uart: tx-start: "Start bit" "Start" "S"
165932-165958 uart: tx-data-bit: "0"
165958-165984 uart: tx-data-bit: "0"
165984-166010 uart: tx-data-bit: "0"
166010-166036 uart: tx-data-bit: "0"
166036-166062 uart: tx-data-bit: "0"
166062-166088 uart: tx-data-bit: "0"
166088-166114 uart: tx-data-bit: "1"
166114-166140 uart: tx-data-bit: "1"
165932-166140 uart: tx-data: "11000000"
166140-166166 uart: tx-stop: "Stop bit" "Stop" "T"
166421-166447 uart: tx-start: "Start bit" "Start" "S"
166447-166473 uart: tx-data-bit: "1"
166473-166499 uart: tx-data-bit: "0"
166499-166525 uart: tx-data-bit: "0"
166525-166551 uart: tx-data-bit: "0"
166551-166577 uart: tx-data-bit: "0"
166577-166603 uart: tx-data-bit: "0"
166603-166629 uart: tx-data-bit: "1"
166629-166655 uart: tx-data-bit: "1"
166447-166655 uart: tx-data: "11000001"
166655-166681 uart: tx-stop: "Stop bit" "Stop" "T"
166937-166963 uart: tx-start: "Start bit" "Start" "S"
166963-166989 uart: tx-data-bit: "0"
166989-167015 uart: tx-data-bit: "1"
167015-167041 uart: tx-data-bit: "0"
167041-167067 uart: tx-data-bit: "0"
167067-167093 uart: tx-data-bit: "0"
167093-167119 uart: tx-data-bit: "0"
167119-167145 uart: tx-data-bit: "1"
167145-167171 uart: tx-data-bit: "1"
166963-167171 uart: tx-data: "11000010"
167171-167197 uart: tx-stop: "Stop bit" "Stop" "T"
167454-167480 uart: tx-start: "Start bit" "Start" "S"
167480-167506 uart: tx-data-bit: "1"
167506-167532 uart: tx-data-bit: "1"
167532-167558 uart: tx-data-bit: "0"
167558-167584 uart: tx-data-bit: "0"
167584-167610 uart: tx-data-bit: "0"
167610-167636 uart: tx-data-bit: "0"
167636-167662 uart: tx-data-bit: "1"
167662-167688 uart: tx-data-bit: "1"
167480-167688 uart: tx-data: "11000011"
167688-167714 uart: tx-stop: "Stop bit" "Stop" "T"
167971-167997 uart: tx-start: "Start bit" "Start" "S"
167997-168023 uart: tx-data-bit: "0"
168023-168049 uart: tx-data-bit: "0"
168049-168075 uart: tx-data-bit: "1"
168075-168101 uart: tx-data-bit: "0"
168101-168127 uart: tx-data-bit: "0"
168127-168153 uart: tx-data-bit: "0"
168153-168179 uart: tx-data-bit: "1"
168179-168205 uart: tx-data-bit: "1"
167997-168205 uart: tx-data: "11000100"
168205-168231 uart: tx-stop: "Stop bit" "Stop" "T"
168487-168513 uart: tx-start: "Start bit" "Start" "S"
168513-168539 uart: tx-data-bit: "1"
168539-168565 uart: tx-data-bit: "0"
168565-168591 uart: tx-data-bit: "1"
168591-168617 uart: tx-data-bit: "0"
168617-168643 uart: tx-data-bit: "0"
168643-168669 uart: tx-data-bit: "0"
168669-168695 uart: tx-data-bit: "1"
168695-168721 uart: tx-data-bit: "1"
168513-168721 uart: tx-data: "11000101"
168721-168747 uart: tx-stop: "Stop bit" "Stop" "T"
169006-169032 uart: tx-start: "Start bit" "Start" "S"
169032-169058 uart: tx-data-bit: "0"
169058-169084 uart: tx-data-bit: "1"
169084-169110 uart: tx-data-bit: "1"
169110-169136 uart: tx-data-bit: "0"
169136-169162 uart: tx-data-bit: "0"
169162-169188 uart: tx-data-bit: "0"
169188-169214 uart: tx-data-bit: "1"
169214-169240 uart: tx-data-bit: "1"
169032-169240 uart: tx-data: "11000110"
169240-169266 uart: tx-stop: "Stop bit" "Stop" "T"
169522-169548 uart: tx-start: "Start bit" "Start" "S"
169548-169574 uart: tx-data-bit: "1"
169574-169600 uart: tx-data-bit: "1"
169600-169626 uart: tx-data-bit: "1"
169626-169652 uart: tx-data-bit: "0"
169652-169678 uart: tx-data-bit: "0"
169678-169704 uart: tx-data-bit: "0"
169704-169730 uart: tx-data-bit: "1"
169730-169756 uart: tx-data-bit: "1"
169548-169756 uart: tx-data: "11000111"
169756-169782 uart: tx-stop: "Stop bit" "Stop" "T"
170039-170065 uart: tx-start: "Start bit" "Start" "S"
170065-170091 uart: tx-data-bit: "0"
170091-170117 uart: tx-data-bit: "0"
170117-170143 uart: tx-data-bit: "0"
170143-170169 uart: tx-data-bit: "1"
170169-170195 uart: tx-data-bit: "0"
170195-170221 uart: tx-data-bit: "0"
170221-170247 uart: tx-data-bit: "1"
170247-170273 uart: tx-data-bit: "1"
170065-170273 uart: tx-data: "11001000"
170273-170299 uart: tx-stop: "Stop bit" "Stop" "T"
170556-170582 uart: tx-start: "Start bit" "Start" "S"
170582-170608 uart: tx-data-bit: "1"
170608-170634 uart: tx-data-bit: "0"
170634-170660 uart: tx-data-bit: "0"
170660-170686 uart: tx-data-bit: "1"
170686-170712 uart: tx-data-bit: "0"
170712-170738 uart: tx-data-bit: "0"
170738-170764 uart: tx-data-bit: "1"
170764-170790 uart: tx-data-bit: "1"
170582-170790 uart: tx-data: "11001001"
170790-170816 uart: tx-stop: "Stop bit" "Stop" "T"
171074-171100 uart: tx-start: "Start bit" "Start" "S"
171100-171126 uart: tx-data-bit: "0"
171126-171152 uart: tx-data-bit: "1"
171152-171178 uart: tx-data-bit: "0"
171178-171204 uart: tx-data-bit: "1"
171204-171230 uart: tx-data-bit: "0"
171230-171256 uart: tx-data-bit: "0"
171256-171282 uart: tx-data-bit: "1"
171282-171308 uart: tx-data-bit: "1"
171100-171308 uart: tx-data: "11001010"
171308-171334 uart: tx-stop: "Stop bit" "Stop" "T"
171593-171619 uart: tx-start: "Start bit" "Start" "S"
171619-171645 uart: tx-data-bit: "1"
171645-171671 uart: tx-data-bit: "1"
171671-171697 uart: tx-data-bit: "0"
171697-171723 uart: tx-data-bit: "1"
171723-171749 uart: tx-data-bit: "0"
171749-171775 uart: tx-data-bit: "0"
171775-171801 uart: tx-data-bit: "1"
171801-171827 uart: tx-data-bit: "1"
171619-171827 uart: tx-data: "11001011"
171827-171853 uart: tx-stop: "Stop bit" "Stop" "T"
172111-172137 uart: tx-start: "Start bit" "Start" "S"
172137-172163 uart: tx-data-bit: "0"
172163-172189 uart: tx-data-bit: "0"
172189-172215 uart: tx-data-bit: "1"
172215-172241 uart: tx-data-bit: "1"
172241-172267 uart: tx-data-bit: "0"
172267-172293 uart: tx-data-bit: "0"
172293-172319 uart: tx-data-bit: "1"
172319-172345 uart: tx-data-bit: "1"
172137-172345 uart: tx-data: "11001100"
172345-172371 uart: tx-stop: "Stop bit" "Stop" "T"
172628-172654 uart: tx-start: "Start bit" "Start" "S"
172654-172680 uart: tx-data-bit: "1"
172680-172706 uart: tx-data-bit: "0"
172706-172732 uart: tx-data-bit: "1"
172732-172758 uart: tx-data-bit: "1"
172758-172784 uart: tx-data-bit: "0"
172784-172810 uart: tx-data-bit: "0"
172810-172836 uart: tx-data-bit: "1"
172836-172862 uart: tx-data-bit: "1"
172654-172862 uart: tx-data: "11001101"
172862-172888 uart: tx-stop: "Stop bit" "Stop" "T"
173146-173172 uart: tx-start: "Start bit" "Start" "S"
173172-173198 uart: tx-data-bit: "0"
173198-173224 uart: tx-data-bit: "1"
173224-173250 uart: tx-data-bit: "1"
173250-173276 uart: tx-data-bit: "1"
173276-173302 uart: tx-data-bit: "0"
173302-173328 uart: tx-data-bit: "0"
173328-173354 uart: tx-data-bit: "1"
173354-173380 uart: tx-data-bit: "1"
173172-173380 uart: tx-data: "11001110"
173380-173406 uart: tx-stop: "Stop bit" "Stop" "T"
173663-173689 uart: tx-start: "Start bit" "Start" "S"
173689-173715 uart: tx-data-bit: "1"
173715-173741 uart: tx-data-bit: "1"
173741-173767 uart: tx-data-bit: "1"
173767-173793 uart: tx-data-bit: "1"
173793-173819 uart: tx-data-bit: "0"
173819-173845 uart: tx-data-bit: "0"
173845-173871 uart: tx-data-bit: "1"
173871-173897 uart: tx-data-bit: "1"
173689-173897 uart: tx-data: "11001111"
173897-173923 uart: tx-stop: "Stop bit" "Stop" "T"
165906-173923 uart: tx-packet: "11000000 11000001 11000010 11000011 11000100 11000101 11000110 11000111 11001000 11001001 11001010 11001011 11001100 11001101 11001110 11001111"
174180-174206 uart: tx-start: "Start bit" "Start" "S"
174206-174232 uart: tx-data-bit: "0"
174232-174258 uart: tx-data-bit: "0"
174258-174284 uart: tx-data-bit: "0"
174284-174310 uart: tx-data-bit: "0"
174310-174336 uart: tx-data-bit: "1"
174336-174362 uart: tx-data-bit: "0"
174362-174388 uart: tx-data-bit: "1"
174388-174414 uart: tx-data-bit: "1"
174206-174414 uart: tx-data: "11010000"
174414-174440 uart: tx-stop: "Stop bit" "Stop" "T"
174696-174722 uart: tx-start: "Start bit" "Start" "S"
174722-174748 uart: tx-data-bit: "1"
174748-174774 uart: tx-data-bit: "0"
174774-174800 uart: tx-data-bit: "0"
174800-174826 uart: tx-data-bit: "0"
174826-174852 uart: tx-data-bit: "1"
174852-174878 uart: tx-data-bit: "0"
174878-174904 uart: tx-data-bit: "1"
174904-174930 uart: tx-data-bit: "1"
174722-174930 uart: tx-data: "11010001"
174930-174956 uart: tx-stop: "Stop bit" "Stop" "T"
175215-175241 uart: tx-start: "Start bit" "Start" "S"
175241-175267 uart: tx-data-bit: "0"
175267-175293 uart: tx-data-bit: "1"
175293-175319 uart: tx-data-bit: "0"
175319-175345 uart: tx-data-bit: "0"
175345-175371 uart: tx-data-bit: "1"
175371-175397 uart: tx-data-bit: "0"
175397-175423 uart: tx-data-bit: "1"
175423-175449 uart: tx-data-bit: "1"
175241-175449 uart: tx-data: "11010010"
175449-175475 uart: tx-stop: "Stop bit" "Stop" "T"
175733-175759 uart: tx-start: "Start bit" "Start" "S"
175759-175785 uart: tx-data-bit: "1"
175785-175811 uart: tx-data-bit: "1"
175811-175837 uart: tx-data-bit: "0"
175837-175863 uart: tx-data-bit: "0"
175863-175889 uart: tx-data-bit: "1"
175889-175915 uart: tx-data-bit: "0"
175915-175941 uart: tx-data-bit: "1"
175941-175967 uart: tx-data-bit: "1"
175759-175967 uart: tx-data: "11010011"
175967-175993 uart: tx-stop: "Stop bit" "Stop" "T"
176252-176278 uart: tx-start: "Start bit" "Start" "S"
176278-176304 uart: tx-data-bit: "0"
176304-176330 uart: tx-data-bit: "0"
176330-176356 uart: tx-data-bit: "1"
176356-176382 uart: tx-data-bit: "0"
176382-176408 uart: tx-data-bit: "1"
176408-176434 uart: tx-data-bit: "0"
176434-176460 uart: tx-data-bit: "1"
176460-176486 uart: tx-data-bit: "1"
176278-176486 uart: tx-data: "11010100"
176486-176512 uart: tx-stop: "Stop bit" "Stop" "T"
176771-176797 uart: tx-start: "Start bit" "Start" "S"
176797-176823 uart: tx-data-bit: "1"
176823-176849 uart: tx-data-bit: "0"
176849-176875 uart: tx-data-bit: "1"
176875-176901 uart: tx-data-bit: "0"
176901-176927 uart: tx-data-bit: "1"
176927-176953 uart: tx-data-bit: "0"
176953-176979 uart: tx-data-bit: "1"
176979-177005 uart: tx-data-bit: "1"
176797-177005 uart: tx-data: "11010101"
177005-177031 uart: tx-stop: "Stop bit" "Stop" "T"
177291-177317 uart: tx-start: "Start bit" "Start" "S"
177317-177343 uart: tx-data-bit: "0"
177343-177369 uart: tx-data-bit: "1"
177369-177395 uart: tx-data-bit: "1"
177395-177421 uart: tx-data-bit: "0"
177421-177447 uart: tx-data-bit: "1"
177447-177473 uart: tx-data-bit: "0"
177473-177499 uart: tx-data-bit: "1"
177499-177525 uart: tx-data-bit: "1"
177317-177525 uart: tx-data: "11010110"
177525-177551 uart: tx-stop: "Stop bit" "Stop" "T"
177810-177836 uart: tx-start: "Start bit" "Start" "S"
177836-177862 uart: tx-data-bit: "1"
177862-177888 uart: tx-data-bit: "1"
177888-177914 uart: tx-data-bit: "1"
177914-177940 uart: tx-data-bit: "0"
177940-177966 uart: tx-data-bit: "1"
177966-177992 uart: tx-data-bit: "0"
177992-178018 uart: tx-data-bit: "1"
178018-178044 uart: tx-data-bit: "1"
177836-178044 uart: tx-data: "11010111"
178044-178070 uart: tx-stop: "Stop bit" "Stop" "T"
178328-178354 uart: tx-start: "Start bit" "Start" "S"
178354-178380 uart: tx-data-bit: "0"
178380-178406 uart: tx-data-bit: "0"
178406-178432 uart: tx-data-bit: "0"
178432-178458 uart: tx-data-bit: "1"
178458-178484 uart: tx-data-bit: "1"
178484-178510 uart: tx-data-bit: "0"
178510-178536 uart: tx-data-bit: "1"
178536-178562 uart: tx-data-bit: "1"
178354-178562 uart: tx-data: "11011000"
178562-178588 uart: tx-stop: "Stop bit" "Stop" "T"
178845-178871 uart: tx-start: "Start bit" "Start" "S"
178871-178897 uart: tx-data-bit: "1"
178897-178923 uart: tx-data-bit: "0"
178923-178949 uart: tx-data-bit: "0"
178949-178975 uart: tx-data-bit: "1"
178975-179001 uart: tx-data-bit: "1"
179001-179027 uart: tx-data-bit: "0"
179027-179053 uart: tx-data-bit: "1"
179053-179079 uart: tx-data-bit: "1"
178871-179079 uart: tx-data: "11011001"
179079-179105 uart: tx-stop: "Stop bit" "Stop" "T"
179364-179390 uart: tx-start: "Start bit" "Start" "S"
179390-179416 uart: tx-data-bit: "0"
179416-179442 uart: tx-data-bit: "1"
179442-179468 uart: tx-data-bit: "0"
179468-179494 uart: tx-data-bit: "1"
179494-179520 uart: tx-data-bit: "1"
179520-179546 uart: tx-data-bit: "0"
179546-179572 uart: tx-data-bit: "1"
179572-179598 uart: tx-data-bit: "1"
179390-179598 uart: tx-data: "11011010"
179598-179624 uart: tx-stop: "Stop bit" "Stop" "T"
179882-179908 uart: tx-start: "Start bit" "Start" "S"
179908-179934 uart: tx-data-bit: "1"
179934-179960 uart: tx-data-bit: "1"
179960-179986 uart: tx-data-bit: "0"
179986-180012 uart: tx-data-bit: "1"
180012-180038 uart: tx-data-bit: "1"
180038-180064 uart: tx-data-bit: "0"
180064-180090 uart: tx-data-bit: "1"
180090-180116 uart: tx-data-bit: "1"
179908-180116 uart: tx-data: "11011011"
180116-180142 uart: tx-stop: "Stop bit" "Stop" "T"
180401-180427 uart: tx-start: "Start bit" "Start" "S"
180427-180453 uart: tx-data-bit: "0"
180453-180479 uart: tx-data-bit: "0"
180479-180505 uart: tx-data-bit: "1"
180505-180531 uart: tx-data-bit: "1"
180531-180557 uart: tx-data-bit: "1"
180557-180583 uart: tx-data-bit: "0"
180583-180609 uart: tx-data-bit: "1"
180609-180635 uart: tx-data-bit: "1"
180427-180635 uart: tx-data: "11011100"
180635-180661 uart: tx-stop: "Stop bit" "Stop" "T"
180917-180943 uart: tx-start: "Start bit" "Start" "S"
180943-180969 uart: tx-data-bit: "1"
180969-180995 uart: tx-data-bit: "0"
180995-181021 uart: tx-data-bit: "1"
181021-181047 uart: tx-data-bit: "1"
181047-181073 uart: tx-data-bit: "1"
181073-181099 uart: tx-data-bit: "0"
181099-181125 uart: tx-data-bit: "1"
181125-181151 uart: tx-data-bit: "1"
180943-181151 uart: tx-data: "11011101"
181151-181177 uart: tx-stop: "Stop bit" "Stop" "T"
181436-181462 uart: tx-start: "Start bit" "Start" "S"
181462-181488 uart: tx-data-bit: "0"
181488-181514 uart: tx-data-bit: "1"
181514-181540 uart: tx-data-bit: "1"
181540-181566 uart: tx-data-bit: "1"
181566-181592 uart: tx-data-bit: "1"
181592-181618 uart: tx-data-bit: "0"
181618-181644 uart: tx-data-bit: "1"
181644-181670 uart: tx-data-bit: "1"
181462-181670 uart: tx-data: "11011110"
181670-181696 uart: tx-stop: "Stop bit" "Stop" "T"
181952-181978 uart: tx-start: "Start bit" "Start" "S"
181978-182004 uart: tx-data-bit: "1"
182004-182030 uart: tx-data-bit: "1"
182030-182056 uart: tx-data-bit: "1"
182056-182082 uart: tx-data-bit: "1"
182082-182108 uart: tx-data-bit: "1"
182108-182134 uart: tx-data-bit: "0"
182134-182160 uart: tx-data-bit: "1"
182160-182186 uart: tx-data-bit: "1"
181978-182186 uart: tx-data: "11011111"
182186-182212 uart: tx-stop: "Stop bit" "Stop" "T"
174180-182212 uart: tx-packet: "11010000 11010001 11010010 11010011 11010100 11010101 11010110 11010111 11011000 11011001 11011010 11011011 11011100 11011101 11011110 11011111"
182469-182495 uart: tx-start: "Start bit" "Start" "S"
182495-182521 uart: tx-data-bit: "0"
182521-182547 uart: tx-data-bit: "0"
182547-182573 uart: tx-data-bit: "0"
182573-182599 uart: tx-data-bit: "0"
182599-182625 uart: tx-data-bit: "0"
182625-182651 uart: tx-data-bit: "1"
182651-182677 uart: tx-data-bit: "1"
182677-182703 uart: tx-data-bit: "1"
182495-182703 uart: tx-data: "11100000"
182703-182729 uart: tx-stop: "Stop bit" "Stop" "T"
182984-183010 uart: tx-start: "Start bit" "Start" "S"
183010-183036 uart: tx-data-bit: "1"
183036-183062 uart: tx-data-bit: "0"
183062-183088 uart: tx-data-bit: "0"
183088-183114 uart: tx-data-bit: "0"
183114-183140 uart: tx-data-bit: "0"
183140-183166 uart: tx-data-bit: "1"
183166-183192 uart: tx-data-bit: "1"
183192-183218 uart: tx-data-bit: "1"
183010-183218 uart: tx-data: "11100001"
183218-183244 uart: tx-stop: "Stop bit" "Stop" "T"
183500-183526 uart: tx-start: "Start bit" "Start" "S"
183526-183552 uart: tx-data-bit: "0"
183552-183578 uart: tx-data-bit: "1"
183578-183604 uart: tx-data-bit: "0"
183604-183630 uart: tx-data-bit: "0"
183630-183656 uart: tx-data-bit: "0"
183656-183682 uart: tx-data-bit: "1"
183682-183708 uart: tx-data-bit: "1"
183708-183734 uart: tx-data-bit: "1"
183526-183734 uart: tx-data: "11100010"
183734-183760 uart: tx-stop: "Stop bit" "Stop" "T"
184017-184043 uart: tx-start: "Start bit" "Start" "S"
184043-184069 uart: tx-data-bit: "1"
184069-184095 uart: tx-data-bit: "1"
184095-184121 uart: tx-data-bit: "0"
184121-184147 uart: tx-data-bit: "0"
184147-184173 uart: tx-data-bit: "0"
184173-184199 uart: tx-data-bit: "1"
184199-184225 uart: tx-data-bit: "1"
184225-184251 uart: tx-data-bit: "1"
184043-184251 uart: tx-data: "11100011"
184251-184277 uart: tx-stop: "Stop bit" "Stop" "T"
184533-184559 uart: tx-start: "Start bit" "Start" "S"
184559-184585 uart: tx-data-bit: "0"
184585-184611 uart: tx-data-bit: "0"
184611-184637 uart: tx-data-bit: "1"
184637-184663 uart: tx-data-bit: "0"
184663-184689 uart: tx-data-bit: "0"
184689-184715 uart: tx-data-bit: "1"
184715-184741 uart: tx-data-bit: "1"
184741-184767 uart: tx-data-bit: "1"
184559-184767 uart: tx-data: "11100100"
184767-184793 uart: tx-stop: "Stop bit" "Stop" "T"
185050-185076 uart: tx-start: "Start bit" "Start" "S"
185076-185102 uart: tx-data-bit: "1"
185102-185128 uart: tx-data-bit: "0"
185128-185154 uart: tx-data-bit: "1"
185154-185180 uart: tx-data-bit: "0"
185180-185206 uart: tx-data-bit: "0"
185206-185232 uart: tx-data-bit: "1"
185232-185258 uart: tx-data-bit: "1"
185258-185284 uart: tx-data-bit: "1"
185076-185284 uart: tx-data: "11100101"
185284-185310 uart: tx-stop: "Stop bit" "Stop" "T"
185569-185595 uart: tx-start: "Start bit" "Start" "S"
185595-185621 uart: tx-data-bit: "0"
185621-185647 uart: tx-data-bit: "1"
185647-185673 uart: tx-data-bit: "1"
185673-185699 uart: tx-data-bit: "0"
185699-185725 uart: tx-data-bit: "0"
185725-185751 uart: tx-data-bit: "1"
185751-185777 uart: tx-data-bit: "1"
185777-185803 uart: tx-data-bit: "1"
185595-185803 uart: tx-data: "11100110"
185803-185829 uart: tx-stop: "Stop bit" "Stop" "T"
186085-186111 uart: tx-start: "Start bit" "Start" "S"
186111-186137 uart: tx-data-bit: "1"
186137-186163 uart: tx-data-bit: "1"
186163-186189 uart: tx-data-bit: "1"
186189-186215 uart: tx-data-bit: "0"
186215-186241 uart: tx-data-bit: "0"
186241-186267 uart: tx-data-bit: "1"
186267-186293 uart: tx-data-bit: "1"
186293-186319 uart: tx-data-bit: "1"
186111-186319 uart: tx-data: "11100111"
186319-186345 uart: tx-stop: "Stop bit" "Stop" "T"
186602-186628 uart: tx-start: "Start bit" "Start" "S"
186628-186654 uart: tx-data-bit: "0"
186654-186680 uart: tx-data-bit: "0"
186680-186706 uart: tx-data-bit: "0"
186706-186732 uart: tx-data-bit: "1"
186732-186758 uart: tx-data-bit: "0"
186758-186784 uart: tx-data-bit: "1"
186784-186810 uart: tx-data-bit: "1"
186810-186836 uart: tx-data-bit: "1"
186628-186836 uart: tx-data: "11101000"
186836-186862 uart: tx-stop: "Stop bit" "Stop" "T"
187118-187144 uart: tx-start: "Start bit" "Start" "S"
187144-187170 uart: tx-data-bit: "1"
187170-187196 uart: tx-data-bit: "0"
187196-187222 uart: tx-data-bit: "0"
187222-187248 uart: tx-data-bit: "1"
187248-187274 uart: tx-data-bit: "0"
187274-187300 uart: tx-data-bit: "1"
187300-187326 uart: tx-data-bit: "1"
187326-187352 uart: tx-data-bit: "1"
187144-187352 uart: tx-data: "11101001"
187352-187378 uart: tx-stop: "Stop bit" "Stop" "T"
187637-187663 uart: tx-start: "Start bit" "Start" "S"
187663-187689 uart: tx-data-bit: "0"
187689-187715 uart: tx-data-bit: "1"
187715-187741 uart: tx-data-bit: "0"
187741-187767 uart: tx-data-bit: "1"
187767-187793 uart: tx-data-bit: "0"
187793-187819 uart: tx-data-bit: "1"
187819-187845 uart: tx-data-bit: "1"
187845-187871 uart: tx-data-bit: "1"
187663-187871 uart: tx-data: "11101010"
187871-187897 uart: tx-stop: "Stop bit" "Stop" "T"
188155-188181 uart: tx-start: "Start bit" "Start" "S"
188181-188207 uart: tx-data-bit: "1"
188207-188233 uart: tx-data-bit: "1"
188233-188259 uart: tx-data-bit: "0"
188259-188285 uart: tx-data-bit: "1"
188285-188311 uart: tx-data-bit: "0"
188311-188337 uart: tx-data-bit: "1"
188337-188363 uart: tx-data-bit: "1"
188363-188389 uart: tx-data-bit: "1"
188181-188389 uart: tx-data: "11101011"
188389-188415 uart: tx-stop: "Stop bit" "Stop" "T"
188674-188700 uart: tx-start: "Start bit" "Start" "S"
188700-188726 uart: tx-data-bit: "0"
188726-188752 uart: tx-data-bit: "0"
188752-188778 uart: tx-data-bit: "1"
188778-188804 uart: tx-data-bit: "1"
188804-188830 uart: tx-data-bit: "0"
188830-188856 uart: tx-data-bit: "1"
188856-188882 uart: tx-data-bit: "1"
188882-188908 uart: tx-data-bit: "1"
188700-188908 uart: tx-data: "11101100"
188908-188934 uart: tx-stop: "Stop bit" "Stop" "T"
