144-171 uart: tx-start: "Start bit" "Start" "S"
170-197 uart: tx-data-bits: "0"
196-223 uart: tx-data-bits: "0"
222-249 uart: tx-data-bits: "1"
248-275 uart: tx-data-bits: "1"
274-301 uart: tx-data-bits: "1"
300-327 uart: tx-data-bits: "1"
170-327 uart: tx-data: "74"
326-353 uart: tx-stop: "Stop bit" "Stop" "T"
607-634 uart: tx-start: "Start bit" "Start" "S"
633-660 uart: tx-data-bits: "1"
659-686 uart: tx-data-bits: "0"
685-712 uart: tx-data-bits: "1"
711-738 uart: tx-data-bits: "1"
737-764 uart: tx-data-bits: "1"
763-790 uart: tx-data-bits: "1"
633-790 uart: tx-data: "75"
789-816 uart: tx-stop: "Stop bit" "Stop" "T"
1071-1098 uart: tx-start: "Start bit" "Start" "S"
1097-1124 uart: tx-data-bits: "0"
1123-1150 uart: tx-data-bits: "1"
1149-1176 uart: tx-data-bits: "1"
1175-1202 uart: tx-data-bits: "1"
1201-1228 uart: tx-data-bits: "1"
1227-1254 uart: tx-data-bits: "1"
1097-1254 uart: tx-data: "76"
1253-1280 uart: tx-stop: "Stop bit" "Stop" "T"
1534-1561 uart: tx-start: "Start bit" "Start" "S"
1560-1587 uart: tx-data-bits: "1"
1586-1613 uart: tx-data-bits: "1"
1612-1639 uart: tx-data-bits: "1"
1638-1665 uart: tx-data-bits: "1"
1664-1691 uart: tx-data-bits: "1"
1690-1717 uart: tx-data-bits: "1"
1560-1717 uart: tx-data: "77"
1716-1743 uart: tx-stop: "Stop bit" "Stop" "T"
1997-2024 uart: tx-start: "Start bit" "Start" "S"
2023-2050 uart: tx-data-bits: "0"
2049-2076 uart: tx-data-bits: "0"
2075-2102 uart: tx-data-bits: "0"
2101-2128 uart: tx-data-bits: "0"
2127-2154 uart: tx-data-bits: "0"
2153-2180 uart: tx-data-bits: "0"
2023-2180 uart: tx-data: "00"
2179-2206 uart: tx-stop: "Stop bit" "Stop" "T"
2459-2486 uart: tx-start: "Start bit" "Start" "S"
2485-2512 uart: tx-data-bits: "1"
2511-2538 uart: tx-data-bits: "0"
2537-2564 uart: tx-data-bits: "0"
2563-2590 uart: tx-data-bits: "0"
2589-2616 uart: tx-data-bits: "0"
2615-2642 uart: tx-data-bits: "0"
2485-2642 uart: tx-data: "01"
2641-2668 uart: tx-stop: "Stop bit" "Stop" "T"
2924-2951 uart: tx-start: "Start bit" "Start" "S"
2950-2977 uart: tx-data-bits: "0"
2976-3003 uart: tx-data-bits: "1"
3002-3029 uart: tx-data-bits: "0"
3028-3055 uart: tx-data-bits: "0"
3054-3081 uart: tx-data-bits: "0"
3080-3107 uart: tx-data-bits: "0"
2950-3107 uart: tx-data: "02"
3106-3133 uart: tx-stop: "Stop bit" "Stop" "T"
3388-3415 uart: tx-start: "Start bit" "Start" "S"
3414-3441 uart: tx-data-bits: "1"
3440-3467 uart: tx-data-bits: "1"
3466-3493 uart: tx-data-bits: "0"
3492-3519 uart: tx-data-bits: "0"
3518-3545 uart: tx-data-bits: "0"
3544-3571 uart: tx-data-bits: "0"
3414-3571 uart: tx-data: "03"
3570-3597 uart: tx-stop: "Stop bit" "Stop" "T"
3853-3880 uart: tx-start: "Start bit" "Start" "S"
3879-3906 uart: tx-data-bits: "0"
3905-3932 uart: tx-data-bits: "0"
3931-3958 uart: tx-data-bits: "1"
3957-3984 uart: tx-data-bits: "0"
3983-4010 uart: tx-data-bits: "0"
4009-4036 uart: tx-data-bits: "0"
3879-4036 uart: tx-data: "04"
4035-4062 uart: tx-stop: "Stop bit" "Stop" "T"
4318-4345 uart: tx-start: "Start bit" "Start" "S"
4344-4371 uart: tx-data-bits: "1"
4370-4397 uart: tx-data-bits: "0"
4396-4423 uart: tx-data-bits: "1"
4422-4449 uart: tx-data-bits: "0"
4448-4475 uart: tx-data-bits: "0"
4474-4501 uart: tx-data-bits: "0"
4344-4501 uart: tx-data: "05"
4500-4527 uart: tx-stop: "Stop bit" "Stop" "T"
4784-4811 uart: tx-start: "Start bit" "Start" "S"
4810-4837 uart: tx-data-bits: "0"
4836-4863 uart: tx-data-bits: "1"
4862-4889 uart: tx-data-bits: "1"
4888-4915 uart: tx-data-bits: "0"
4914-4941 uart: tx-data-bits: "0"
4940-4967 uart: tx-data-bits: "0"
4810-4967 uart: tx-data: "06"
4966-4993 uart: tx-stop: "Stop bit" "Stop" "T"
5249-5276 uart: tx-start: "Start bit" "Start" "S"
5275-5302 uart: tx-data-bits: "1"
5301-5328 uart: tx-data-bits: "1"
5327-5354 uart: tx-data-bits: "1"
5353-5380 uart: tx-data-bits: "0"
5379-5406 uart: tx-data-bits: "0"
5405-5432 uart: tx-data-bits: "0"
5275-5432 uart: tx-data: "07"
5431-5458 uart: tx-stop: "Stop bit" "Stop" "T"
5713-5740 uart: tx-start: "Start bit" "Start" "S"
5739-5766 uart: tx-data-bits: "0"
5765-5792 uart: tx-data-bits: "0"
5791-5818 uart: tx-data-bits: "0"
5817-5844 uart: tx-data-bits: "1"
5843-5870 uart: tx-data-bits: "0"
5869-5896 uart: tx-data-bits: "0"
5739-5896 uart: tx-data: "10"
5895-5922 uart: tx-stop: "Stop bit" "Stop" "T"
6178-6205 uart: tx-start: "Start bit" "Start" "S"
6204-6231 uart: tx-data-bits: "1"
6230-6257 uart: tx-data-bits: "0"
6256-6283 uart: tx-data-bits: "0"
6282-6309 uart: tx-data-bits: "1"
6308-6335 uart: tx-data-bits: "0"
6334-6361 uart: tx-data-bits: "0"
6204-6361 uart: tx-data: "11"
6360-6387 uart: tx-stop: "Stop bit" "Stop" "T"
6645-6672 uart: tx-start: "Start bit" "Start" "S"
6671-6698 uart: tx-data-bits: "0"
6697-6724 uart: tx-data-bits: "1"
6723-6750 uart: tx-data-bits: "0"
6749-6776 uart: tx-data-bits: "1"
6775-6802 uart: tx-data-bits: "0"
6801-6828 uart: tx-data-bits: "0"
6671-6828 uart: tx-data: "12"
6827-6854 uart: tx-stop: "Stop bit" "Stop" "T"
7111-7138 uart: tx-start: "Start bit" "Start" "S"
7137-7164 uart: tx-data-bits: "1"
7163-7190 uart: tx-data-bits: "1"
7189-7216 uart: tx-data-bits: "0"
7215-7242 uart: tx-data-bits: "1"
7241-7268 uart: tx-data-bits: "0"
7267-7294 uart: tx-data-bits: "0"
7137-7294 uart: tx-data: "13"
7293-7320 uart: tx-stop: "Stop bit" "Stop" "T"
7578-7605 uart: tx-start: "Start bit" "Start" "S"
7604-7631 uart: tx-data-bits: "0"
7630-7657 uart: tx-data-bits: "0"
7656-7683 uart: tx-data-bits: "1"
7682-7709 uart: tx-data-bits: "1"
7708-7735 uart: tx-data-bits: "0"
7734-7761 uart: tx-data-bits: "0"
7604-7761 uart: tx-data: "14"
7760-7787 uart: tx-stop: "Stop bit" "Stop" "T"
8042-8069 uart: tx-start: "Start bit" "Start" "S"
8068-8095 uart: tx-data-bits: "1"
8094-8121 uart: tx-data-bits: "0"
8120-8147 uart: tx-data-bits: "1"
8146-8173 uart: tx-data-bits: "1"
8172-8199 uart: tx-data-bits: "0"
8198-8225 uart: tx-data-bits: "0"
8068-8225 uart: tx-data: "15"
8224-8251 uart: tx-stop: "Stop bit" "Stop" "T"
8509-8536 uart: tx-start: "Start bit" "Start" "S"
8535-8562 uart: tx-data-bits: "0"
8561-8588 uart: tx-data-bits: "1"
8587-8614 uart: tx-data-bits: "1"
8613-8640 uart: tx-data-bits: "1"
8639-8666 uart: tx-data-bits: "0"
8665-8692 uart: tx-data-bits: "0"
8535-8692 uart: tx-data: "16"
8691-8718 uart: tx-stop: "Stop bit" "Stop" "T"
8974-9001 uart: tx-start: "Start bit" "Start" "S"
9000-9027 uart: tx-data-bits: "1"
9026-9053 uart: tx-data-bits: "1"
9052-9079 uart: tx-data-bits: "1"
9078-9105 uart: tx-data-bits: "1"
9104-9131 uart: tx-data-bits: "0"
9130-9157 uart: tx-data-bits: "0"
9000-9157 uart: tx-data: "17"
9156-9183 uart: tx-stop: "Stop bit" "Stop" "T"
9438-9465 uart: tx-start: "Start bit" "Start" "S"
9464-9491 uart: tx-data-bits: "0"
9490-9517 uart: tx-data-bits: "0"
9516-9543 uart: tx-data-bits: "0"
9542-9569 uart: tx-data-bits: "0"
9568-9595 uart: tx-data-bits: "1"
9594-9621 uart: tx-data-bits: "0"
9464-9621 uart: tx-data: "20"
9620-9647 uart: tx-stop: "Stop bit" "Stop" "T"
9903-9930 uart: tx-start: "Start bit" "Start" "S"
9929-9956 uart: tx-data-bits: "1"
9955-9982 uart: tx-data-bits: "0"
9981-10008 uart: tx-data-bits: "0"
10007-10034 uart: tx-data-bits: "0"
10033-10060 uart: tx-data-bits: "1"
10059-10086 uart: tx-data-bits: "0"
9929-10086 uart: tx-data: "21"
10085-10112 uart: tx-stop: "Stop bit" "Stop" "T"
10370-10397 uart: tx-start: "Start bit" "Start" "S"
10396-10423 uart: tx-data-bits: "0"
10422-10449 uart: tx-data-bits: "1"
10448-10475 uart: tx-data-bits: "0"
10474-10501 uart: tx-data-bits: "0"
10500-10527 uart: tx-data-bits: "1"
10526-10553 uart: tx-data-bits: "0"
10396-10553 uart: tx-data: "22"
10552-10579 uart: tx-stop: "Stop bit" "Stop" "T"
10836-10863 uart: tx-start: "Start bit" "Start" "S"
10862-10889 uart: tx-data-bits: "1"
10888-10915 uart: tx-data-bits: "1"
10914-10941 uart: tx-data-bits: "0"
10940-10967 uart: tx-data-bits: "0"
10966-10993 uart: tx-data-bits: "1"
10992-11019 uart: tx-data-bits: "0"
10862-11019 uart: tx-data: "23"
11018-11045 uart: tx-stop: "Stop bit" "Stop" "T"
11303-11330 uart: tx-start: "Start bit" "Start" "S"
11329-11356 uart: tx-data-bits: "0"
11355-11382 uart: tx-data-bits: "0"
11381-11408 uart: tx-data-bits: "1"
11407-11434 uart: tx-data-bits: "0"
11433-11460 uart: tx-data-bits: "1"
11459-11486 uart: tx-data-bits: "0"
11329-11486 uart: tx-data: "24"
11485-11512 uart: tx-stop: "Stop bit" "Stop" "T"
11769-11796 uart: tx-start: "Start bit" "Start" "S"
11795-11822 uart: tx-data-bits: "1"
11821-11848 uart: tx-data-bits: "0"
11847-11874 uart: tx-data-bits: "1"
11873-11900 uart: tx-data-bits: "0"
11899-11926 uart: tx-data-bits: "1"
11925-11952 uart: tx-data-bits: "0"
11795-11952 uart: tx-data: "25"
11951-11978 uart: tx-stop: "Stop bit" "Stop" "T"
12238-12265 uart: tx-start: "Start bit" "Start" "S"
12264-12291 uart: tx-data-bits: "0"
12290-12317 uart: tx-data-bits: "1"
12316-12343 uart: tx-data-bits: "1"
12342-12369 uart: tx-data-bits: "0"
12368-12395 uart: tx-data-bits: "1"
12394-12421 uart: tx-data-bits: "0"
12264-12421 uart: tx-data: "26"
12420-12447 uart: tx-stop: "Stop bit" "Stop" "T"
12705-12732 uart: tx-start: "Start bit" "Start" "S"
12731-12758 uart: tx-data-bits: "1"
12757-12784 uart: tx-data-bits: "1"
12783-12810 uart: tx-data-bits: "1"
12809-12836 uart: tx-data-bits: "0"
12835-12862 uart: tx-data-bits: "1"
12861-12888 uart: tx-data-bits: "0"
12731-12888 uart: tx-data: "27"
12887-12914 uart: tx-stop: "Stop bit" "Stop" "T"
13171-13198 uart: tx-start: "Start bit" "Start" "S"
13197-13224 uart: tx-data-bits: "0"
13223-13250 uart: tx-data-bits: "0"
13249-13276 uart: tx-data-bits: "0"
13275-13302 uart: tx-data-bits: "1"
13301-13328 uart: tx-data-bits: "1"
13327-13354 uart: tx-data-bits: "0"
13197-13354 uart: tx-data: "30"
13353-13380 uart: tx-stop: "Stop bit" "Stop" "T"
13636-13663 uart: tx-start: "Start bit" "Start" "S"
13662-13689 uart: tx-data-bits: "1"
13688-13715 uart: tx-data-bits: "0"
13714-13741 uart: tx-data-bits: "0"
13740-13767 uart: tx-data-bits: "1"
13766-13793 uart: tx-data-bits: "1"
13792-13819 uart: tx-data-bits: "0"
13662-13819 uart: tx-data: "31"
13818-13845 uart: tx-stop: "Stop bit" "Stop" "T"
14102-14129 uart: tx-start: "Start bit" "Start" "S"
14128-14155 uart: tx-data-bits: "0"
14154-14181 uart: tx-data-bits: "1"
14180-14207 uart: tx-data-bits: "0"
14206-14233 uart: tx-data-bits: "1"
14232-14259 uart: tx-data-bits: "1"
14258-14285 uart: tx-data-bits: "0"
14128-14285 uart: tx-data: "32"
14284-14311 uart: tx-stop: "Stop bit" "Stop" "T"
14569-14596 uart: tx-start: "Start bit" "Start" "S"
14595-14622 uart: tx-data-bits: "1"
14621-14648 uart: tx-data-bits: "1"
14647-14674 uart: tx-data-bits: "0"
14673-14700 uart: tx-data-bits: "1"
14699-14726 uart: tx-data-bits: "1"
14725-14752 uart: tx-data-bits: "0"
14595-14752 uart: tx-data: "33"
14751-14778 uart: tx-stop: "Stop bit" "Stop" "T"
15036-15063 uart: tx-start: "Start bit" "Start" "S"
15062-15089 uart: tx-data-bits: "0"
15088-15115 uart: tx-data-bits: "0"
15114-15141 uart: tx-data-bits: "1"
15140-15167 uart: tx-data-bits: "1"
15166-15193 uart: tx-data-bits: "1"
15192-15219 uart: tx-data-bits: "0"
15062-15219 uart: tx-data: "34"
15218-15245 uart: tx-stop: "Stop bit" "Stop" "T"
15500-15527 uart: tx-start: "Start bit" "Start" "S"
15526-15553 uart: tx-data-bits: "1"
15552-15579 uart: tx-data-bits: "0"
15578-15605 uart: tx-data-bits: "1"
15604-15631 uart: tx-data-bits: "1"
15630-15657 uart: tx-data-bits: "1"
15656-15683 uart: tx-data-bits: "0"
15526-15683 uart: tx-data: "35"
15682-15709 uart: tx-stop: "Stop bit" "Stop" "T"
15967-15994 uart: tx-start: "Start bit" "Start" "S"
15993-16020 uart: tx-data-bits: "0"
16019-16046 uart: tx-data-bits: "1"
16045-16072 uart: tx-data-bits: "1"
16071-16098 uart: tx-data-bits: "1"
16097-16124 uart: tx-data-bits: "1"
16123-16150 uart: tx-data-bits: "0"
15993-16150 uart: tx-data: "36"
16149-16176 uart: tx-stop: "Stop bit" "Stop" "T"
16432-16459 uart: tx-start: "Start bit" "Start" "S"
16458-16485 uart: tx-data-bits: "1"
16484-16511 uart: tx-data-bits: "1"
16510-16537 uart: tx-data-bits: "1"
16536-16563 uart: tx-data-bits: "1"
16562-16589 uart: tx-data-bits: "1"
16588-16615 uart: tx-data-bits: "0"
16458-16615 uart: tx-data: "37"
16614-16641 uart: tx-stop: "Stop bit" "Stop" "T"
16896-16923 uart: tx-start: "Start bit" "Start" "S"
16922-16949 uart: tx-data-bits: "0"
16948-16975 uart: tx-data-bits: "0"
16974-17001 uart: tx-data-bits: "0"
17000-17027 uart: tx-data-bits: "0"
17026-17053 uart: tx-data-bits: "0"
17052-17079 uart: tx-data-bits: "1"
16922-17079 uart: tx-data: "40"
17078-17105 uart: tx-stop: "Stop bit" "Stop" "T"
17359-17386 uart: tx-start: "Start bit" "Start" "S"
17385-17412 uart: tx-data-bits: "1"
17411-17438 uart: tx-data-bits: "0"
17437-17464 uart: tx-data-bits: "0"
17463-17490 uart: tx-data-bits: "0"
17489-17516 uart: tx-data-bits: "0"
17515-17542 uart: tx-data-bits: "1"
17385-17542 uart: tx-data: "41"
17541-17568 uart: tx-stop: "Stop bit" "Stop" "T"
17823-17850 uart: tx-start: "Start bit" "Start" "S"
17849-17876 uart: tx-data-bits: "0"
17875-17902 uart: tx-data-bits: "1"
17901-17928 uart: tx-data-bits: "0"
17927-17954 uart: tx-data-bits: "0"
17953-17980 uart: tx-data-bits: "0"
17979-18006 uart: tx-data-bits: "1"
17849-18006 uart: tx-data: "42"
18005-18032 uart: tx-stop: "Stop bit" "Stop" "T"
18288-18315 uart: tx-start: "Start bit" "Start" "S"
18314-18341 uart: tx-data-bits: "1"
18340-18367 uart: tx-data-bits: "1"
18366-18393 uart: tx-data-bits: "0"
18392-18419 uart: tx-data-bits: "0"
18418-18445 uart: tx-data-bits: "0"
18444-18471 uart: tx-data-bits: "1"
18314-18471 uart: tx-data: "43"
18470-18497 uart: tx-stop: "Stop bit" "Stop" "T"
18753-18780 uart: tx-start: "Start bit" "Start" "S"
18779-18806 uart: tx-data-bits: "0"
18805-18832 uart: tx-data-bits: "0"
18831-18858 uart: tx-data-bits: "1"
18857-18884 uart: tx-data-bits: "0"
18883-18910 uart: tx-data-bits: "0"
18909-18936 uart: tx-data-bits: "1"
18779-18936 uart: tx-data: "44"
18935-18962 uart: tx-stop: "Stop bit" "Stop" "T"
19217-19244 uart: tx-start: "Start bit" "Start" "S"
19243-19270 uart: tx-data-bits: "1"
19269-19296 uart: tx-data-bits: "0"
19295-19322 uart: tx-data-bits: "1"
19321-19348 uart: tx-data-bits: "0"
19347-19374 uart: tx-data-bits: "0"
19373-19400 uart: tx-data-bits: "1"
19243-19400 uart: tx-data: "45"
19399-19426 uart: tx-stop: "Stop bit" "Stop" "T"
19684-19711 uart: tx-start: "Start bit" "Start" "S"
19710-19737 uart: tx-data-bits: "0"
19736-19763 uart: tx-data-bits: "1"
19762-19789 uart: tx-data-bits: "1"
19788-19815 uart: tx-data-bits: "0"
19814-19841 uart: tx-data-bits: "0"
19840-19867 uart: tx-data-bits: "1"
19710-19867 uart: tx-data: "46"
19866-19893 uart: tx-stop: "Stop bit" "Stop" "T"
20148-20175 uart: tx-start: "Start bit" "Start" "S"
20174-20201 uart: tx-data-bits: "1"
20200-20227 uart: tx-data-bits: "1"
20226-20253 uart: tx-data-bits: "1"
20252-20279 uart: tx-data-bits: "0"
20278-20305 uart: tx-data-bits: "0"
20304-20331 uart: tx-data-bits: "1"
20174-20331 uart: tx-data: "47"
20330-20357 uart: tx-stop: "Stop bit" "Stop" "T"
20613-20640 uart: tx-start: "Start bit" "Start" "S"
20639-20666 uart: tx-data-bits: "0"
20665-20692 uart: tx-data-bits: "0"
20691-20718 uart: tx-data-bits: "0"
20717-20744 uart: tx-data-bits: "1"
20743-20770 uart: tx-data-bits: "0"
20769-20796 uart: tx-data-bits: "1"
20639-20796 uart: tx-data: "50"
20795-20822 uart: tx-stop: "Stop bit" "Stop" "T"
21078-21105 uart: tx-start: "Start bit" "Start" "S"
21104-21131 uart: tx-data-bits: "1"
21130-21157 uart: tx-data-bits: "0"
21156-21183 uart: tx-data-bits: "0"
21182-21209 uart: tx-data-bits: "1"
21208-21235 uart: tx-data-bits: "0"
21234-21261 uart: tx-data-bits: "1"
21104-21261 uart: tx-data: "51"
21260-21287 uart: tx-stop: "Stop bit" "Stop" "T"
21544-21571 uart: tx-start: "Start bit" "Start" "S"
21570-21597 uart: tx-data-bits: "0"
21596-21623 uart: tx-data-bits: "1"
21622-21649 uart: tx-data-bits: "0"
21648-21675 uart: tx-data-bits: "1"
21674-21701 uart: tx-data-bits: "0"
21700-21727 uart: tx-data-bits: "1"
21570-21727 uart: tx-data: "52"
21726-21753 uart: tx-stop: "Stop bit" "Stop" "T"
22011-22038 uart: tx-start: "Start bit" "Start" "S"
22037-22064 uart: tx-data-bits: "1"
22063-22090 uart: tx-data-bits: "1"
22089-22116 uart: tx-data-bits: "0"
22115-22142 uart: tx-data-bits: "1"
22141-22168 uart: tx-data-bits: "0"
22167-22194 uart: tx-data-bits: "1"
22037-22194 uart: tx-data: "53"
22193-22220 uart: tx-stop: "Stop bit" "Stop" "T"
22478-22505 uart: tx-start: "Start bit" "Start" "S"
22504-22531 uart: tx-data-bits: "0"
22530-22557 uart: tx-data-bits: "0"
22556-22583 uart: tx-data-bits: "1"
22582-22609 uart: tx-data-bits: "1"
22608-22635 uart: tx-data-bits: "0"
22634-22661 uart: tx-data-bits: "1"
22504-22661 uart: tx-data: "54"
22660-22687 uart: tx-stop: "Stop bit" "Stop" "T"
22942-22969 uart: tx-start: "Start bit" "Start" "S"
22968-22995 uart: tx-data-bits: "1"
22994-23021 uart: tx-data-bits: "0"
23020-23047 uart: tx-data-bits: "1"
23046-23073 uart: tx-data-bits: "1"
23072-23099 uart: tx-data-bits: "0"
23098-23125 uart: tx-data-bits: "1"
22968-23125 uart: tx-data: "55"
23124-23151 uart: tx-stop: "Stop bit" "Stop" "T"
23409-23436 uart: tx-start: "Start bit" "Start" "S"
23435-23462 uart: tx-data-bits: "0"
23461-23488 uart: tx-data-bits: "1"
23487-23514 uart: tx-data-bits: "1"
23513-23540 uart: tx-data-bits: "1"
23539-23566 uart: tx-data-bits: "0"
23565-23592 uart: tx-data-bits: "1"
23435-23592 uart: tx-data: "56"
23591-23618 uart: tx-stop: "Stop bit" "Stop" "T"
23873-23900 uart: tx-start: "Start bit" "Start" "S"
23899-23926 uart: tx-data-bits: "1"
23925-23952 uart: tx-data-bits: "1"
23951-23978 uart: tx-data-bits: "1"
23977-24004 uart: tx-data-bits: "1"
24003-24030 uart: tx-data-bits: "0"
24029-24056 uart: tx-data-bits: "1"
23899-24056 uart: tx-data: "57"
24055-24082 uart: tx-stop: "Stop bit" "Stop" "T"
24338-24365 uart: tx-start: "Start bit" "Start" "S"
24364-24391 uart: tx-data-bits: "0"
24390-24417 uart: tx-data-bits: "0"
24416-24443 uart: tx-data-bits: "0"
24442-24469 uart: tx-data-bits: "0"
24468-24495 uart: tx-data-bits: "1"
24494-24521 uart: tx-data-bits: "1"
24364-24521 uart: tx-data: "60"
24520-24547 uart: tx-stop: "Stop bit" "Stop" "T"
24801-24828 uart: tx-start: "Start bit" "Start" "S"
24827-24854 uart: tx-data-bits: "1"
24853-24880 uart: tx-data-bits: "0"
24879-24906 uart: tx-data-bits: "0"
24905-24932 uart: tx-data-bits: "0"
24931-24958 uart: tx-data-bits: "1"
24957-24984 uart: tx-data-bits: "1"
24827-24984 uart: tx-data: "61"
24983-25010 uart: tx-stop: "Stop bit" "Stop" "T"
25265-25292 uart: tx-start: "Start bit" "Start" "S"
25291-25318 uart: tx-data-bits: "0"
25317-25344 uart: tx-data-bits: "1"
25343-25370 uart: tx-data-bits: "0"
25369-25396 uart: tx-data-bits: "0"
25395-25422 uart: tx-data-bits: "1"
25421-25448 uart: tx-data-bits: "1"
25291-25448 uart: tx-data: "62"
25447-25474 uart: tx-stop: "Stop bit" "Stop" "T"
25730-25757 uart: tx-start: "Start bit" "Start" "S"
25756-25783 uart: tx-data-bits: "1"
25782-25809 uart: tx-data-bits: "1"
25808-25835 uart: tx-data-bits: "0"
25834-25861 uart: tx-data-bits: "0"
25860-25887 uart: tx-data-bits: "1"
25886-25913 uart: tx-data-bits: "1"
25756-25913 uart: tx-data: "63"
25912-25939 uart: tx-stop: "Stop bit" "Stop" "T"
26194-26221 uart: tx-start: "Start bit" "Start" "S"
26220-26247 uart: tx-data-bits: "0"
26246-26273 uart: tx-data-bits: "0"
26272-26299 uart: tx-data-bits: "1"
26298-26325 uart: tx-data-bits: "0"
26324-26351 uart: tx-data-bits: "1"
26350-26377 uart: tx-data-bits: "1"
26220-26377 uart: tx-data: "64"
26376-26403 uart: tx-stop: "Stop bit" "Stop" "T"
26659-26686 uart: tx-start: "Start bit" "Start" "S"
26685-26712 uart: tx-data-bits: "1"
26711-26738 uart: tx-data-bits: "0"
26737-26764 uart: tx-data-bits: "1"
26763-26790 uart: tx-data-bits: "0"
26789-26816 uart: tx-data-bits: "1"
26815-26842 uart: tx-data-bits: "1"
26685-26842 uart: tx-data: "65"
26841-26868 uart: tx-stop: "Stop bit" "Stop" "T"
27126-27153 uart: tx-start: "Start bit" "Start" "S"
27152-27179 uart: tx-data-bits: "0"
27178-27205 uart: tx-data-bits: "1"
27204-27231 uart: tx-data-bits: "1"
27230-27257 uart: tx-data-bits: "0"
27256-27283 uart: tx-data-bits: "1"
27282-27309 uart: tx-data-bits: "1"
27152-27309 uart: tx-data: "66"
27308-27335 uart: tx-stop: "Stop bit" "Stop" "T"
27590-27617 uart: tx-start: "Start bit" "Start" "S"
27616-27643 uart: tx-data-bits: "1"
27642-27669 uart: tx-data-bits: "1"
27668-27695 uart: tx-data-bits: "1"
27694-27721 uart: tx-data-bits: "0"
27720-27747 uart: tx-data-bits: "1"
27746-27773 uart: tx-data-bits: "1"
27616-27773 uart: tx-data: "67"
27772-27799 uart: tx-stop: "Stop bit" "Stop" "T"
28055-28082 uart: tx-start: "Start bit" "Start" "S"
28081-28108 uart: tx-data-bits: "0"
28107-28134 uart: tx-data-bits: "0"
28133-28160 uart: tx-data-bits: "0"
28159-28186 uart: tx-data-bits: "1"
28185-28212 uart: tx-data-bits: "1"
28211-28238 uart: tx-data-bits: "1"
28081-28238 uart: tx-data: "70"
28237-28264 uart: tx-stop: "Stop bit" "Stop" "T"
28518-28545 uart: tx-start: "Start bit" "Start" "S"
28544-28571 uart: tx-data-bits: "1"
28570-28597 uart: tx-data-bits: "0"
28596-28623 uart: tx-data-bits: "0"
28622-28649 uart: tx-data-bits: "1"
28648-28675 uart: tx-data-bits: "1"
28674-28701 uart: tx-data-bits: "1"
28544-28701 uart: tx-data: "71"
28700-28727 uart: tx-stop: "Stop bit" "Stop" "T"
28982-29009 uart: tx-start: "Start bit" "Start" "S"
29008-29035 uart: tx-data-bits: "0"
29034-29061 uart: tx-data-bits: "1"
29060-29087 uart: tx-data-bits: "0"
29086-29113 uart: tx-data-bits: "1"
29112-29139 uart: tx-data-bits: "1"
29138-29165 uart: tx-data-bits: "1"
29008-29165 uart: tx-data: "72"
29164-29191 uart: tx-stop: "Stop bit" "Stop" "T"
29447-29474 uart: tx-start: "Start bit" "Start" "S"
29473-29500 uart: tx-data-bits: "1"
29499-29526 uart: tx-data-bits: "1"
29525-29552 uart: tx-data-bits: "0"
29551-29578 uart: tx-data-bits: "1"
29577-29604 uart: tx-data-bits: "1"
29603-29630 uart: tx-data-bits: "1"
29473-29630 uart: tx-data: "73"
29629-29656 uart: tx-stop: "Stop bit" "Stop" "T"
29911-29938 uart: tx-start: "Start bit" "Start" "S"
29937-29964 uart: tx-data-bits: "0"
29963-29990 uart: tx-data-bits: "0"
29989-30016 uart: tx-data-bits: "1"
30015-30042 uart: tx-data-bits: "1"
30041-30068 uart: tx-data-bits: "1"
30067-30094 uart: tx-data-bits: "1"
29937-30094 uart: tx-data: "74"
30093-30120 uart: tx-stop: "Stop bit" "Stop" "T"
30374-30401 uart: tx-start: "Start bit" "Start" "S"
30400-30427 uart: tx-data-bits: "1"
30426-30453 uart: tx-data-bits: "0"
30452-30479 uart: tx-data-bits: "1"
30478-30505 uart: tx-data-bits: "1"
30504-30531 uart: tx-data-bits: "1"
30530-30557 uart: tx-data-bits: "1"
30400-30557 uart: tx-data: "75"
30556-30583 uart: tx-stop: "Stop bit" "Stop" "T"
30839-30866 uart: tx-start: "Start bit" "Start" "S"
30865-30892 uart: tx-data-bits: "0"
30891-30918 uart: tx-data-bits: "1"
30917-30944 uart: tx-data-bits: "1"
30943-30970 uart: tx-data-bits: "1"
30969-30996 uart: tx-data-bits: "1"
30995-31022 uart: tx-data-bits: "1"
30865-31022 uart: tx-data: "76"
31021-31048 uart: tx-stop: "Stop bit" "Stop" "T"
31301-31328 uart: tx-start: "Start bit" "Start" "S"
31327-31354 uart: tx-data-bits: "1"
31353-31380 uart: tx-data-bits: "1"
31379-31406 uart: tx-data-bits: "1"
31405-31432 uart: tx-data-bits: "1"
31431-31458 uart: tx-data-bits: "1"
31457-31484 uart: tx-data-bits: "1"
31327-31484 uart: tx-data: "77"
31483-31510 uart: tx-stop: "Stop bit" "Stop" "T"
31764-31791 uart: tx-start: "Start bit" "Start" "S"
31790-31817 uart: tx-data-bits: "0"
31816-31843 uart: tx-data-bits: "0"
31842-31869 uart: tx-data-bits: "0"
31868-31895 uart: tx-data-bits: "0"
31894-31921 uart: tx-data-bits: "0"
31920-31947 uart: tx-data-bits: "0"
31790-31947 uart: tx-data: "00"
31946-31973 uart: tx-stop: "Stop bit" "Stop" "T"
32226-32253 uart: tx-start: "Start bit" "Start" "S"
32252-32279 uart: tx-data-bits: "1"
32278-32305 uart: tx-data-bits: "0"
32304-32331 uart: tx-data-bits: "0"
32330-32357 uart: tx-data-bits: "0"
32356-32383 uart: tx-data-bits: "0"
32382-32409 uart: tx-data-bits: "0"
32252-32409 uart: tx-data: "01"
32408-32435 uart: tx-stop: "Stop bit" "Stop" "T"
32691-32718 uart: tx-start: "Start bit" "Start" "S"
32717-32744 uart: tx-data-bits: "0"
32743-32770 uart: tx-data-bits: "1"
32769-32796 uart: tx-data-bits: "0"
32795-32822 uart: tx-data-bits: "0"
32821-32848 uart: tx-data-bits: "0"
32847-32874 uart: tx-data-bits: "0"
32717-32874 uart: tx-data: "02"
32873-32900 uart: tx-stop: "Stop bit" "Stop" "T"
33156-33183 uart: tx-start: "Start bit" "Start" "S"
33182-33209 uart: tx-data-bits: "1"
33208-33235 uart: tx-data-bits: "1"
33234-33261 uart: tx-data-bits: "0"
33260-33287 uart: tx-data-bits: "0"
33286-33313 uart: tx-data-bits: "0"
33312-33339 uart: tx-data-bits: "0"
33182-33339 uart: tx-data: "03"
33338-33365 uart: tx-stop: "Stop bit" "Stop" "T"
33620-33647 uart: tx-start: "Start bit" "Start" "S"
33646-33673 uart: tx-data-bits: "0"
33672-33699 uart: tx-data-bits: "0"
33698-33725 uart: tx-data-bits: "1"
33724-33751 uart: tx-data-bits: "0"
33750-33777 uart: tx-data-bits: "0"
33776-33803 uart: tx-data-bits: "0"
33646-33803 uart: tx-data: "04"
33802-33829 uart: tx-stop: "Stop bit" "Stop" "T"
