148-175 uart: tx-start: "Start bit" "Start" "S"
174-201 uart: tx-data-bits: "0"
200-227 uart: tx-data-bits: "0"
226-253 uart: tx-data-bits: "1"
252-279 uart: tx-data-bits: "1"
278-305 uart: tx-data-bits: "1"
304-331 uart: tx-data-bits: "1"
330-357 uart: tx-data-bits: "1"
174-357 uart: tx-data: "|"
356-383 uart: tx-parity-ok: "Stop bit" "Stop" "T"
637-664 uart: tx-start: "Start bit" "Start" "S"
663-690 uart: tx-data-bits: "1"
689-716 uart: tx-data-bits: "0"
715-742 uart: tx-data-bits: "1"
741-768 uart: tx-data-bits: "1"
767-794 uart: tx-data-bits: "1"
793-820 uart: tx-data-bits: "1"
819-846 uart: tx-data-bits: "1"
663-846 uart: tx-data: "}"
845-872 uart: tx-parity-ok: "Stop bit" "Stop" "T"
1128-1155 uart: tx-start: "Start bit" "Start" "S"
1154-1181 uart: tx-data-bits: "0"
1180-1207 uart: tx-data-bits: "1"
1206-1233 uart: tx-data-bits: "1"
1232-1259 uart: tx-data-bits: "1"
1258-1285 uart: tx-data-bits: "1"
1284-1311 uart: tx-data-bits: "1"
1310-1337 uart: tx-data-bits: "1"
1154-1337 uart: tx-data: "~"
1336-1363 uart: tx-parity-ok: "Stop bit" "Stop" "T"
1616-1643 uart: tx-start: "Start bit" "Start" "S"
1642-1669 uart: tx-data-bits: "1"
1668-1695 uart: tx-data-bits: "1"
1694-1721 uart: tx-data-bits: "1"
1720-1747 uart: tx-data-bits: "1"
1746-1773 uart: tx-data-bits: "1"
1772-1799 uart: tx-data-bits: "1"
1798-1825 uart: tx-data-bits: "1"
1642-1825 uart: tx-data: "[7F]"
1824-1851 uart: tx-parity-ok: "Stop bit" "Stop" "T"
2105-2132 uart: tx-start: "Start bit" "Start" "S"
2131-2158 uart: tx-data-bits: "0"
2157-2184 uart: tx-data-bits: "0"
2183-2210 uart: tx-data-bits: "0"
2209-2236 uart: tx-data-bits: "0"
2235-2262 uart: tx-data-bits: "0"
2261-2288 uart: tx-data-bits: "0"
2287-2314 uart: tx-data-bits: "0"
2131-2314 uart: tx-data: "[00]"
2313-2340 uart: tx-parity-ok: "Stop bit" "Stop" "T"
2593-2620 uart: tx-start: "Start bit" "Start" "S"
2619-2646 uart: tx-data-bits: "1"
2645-2672 uart: tx-data-bits: "0"
2671-2698 uart: tx-data-bits: "0"
2697-2724 uart: tx-data-bits: "0"
2723-2750 uart: tx-data-bits: "0"
2749-2776 uart: tx-data-bits: "0"
2775-2802 uart: tx-data-bits: "0"
2619-2802 uart: tx-data: "[01]"
2801-2828 uart: tx-parity-ok: "Stop bit" "Stop" "T"
3084-3111 uart: tx-start: "Start bit" "Start" "S"
3110-3137 uart: tx-data-bits: "0"
3136-3163 uart: tx-data-bits: "1"
3162-3189 uart: tx-data-bits: "0"
3188-3215 uart: tx-data-bits: "0"
3214-3241 uart: tx-data-bits: "0"
3240-3267 uart: tx-data-bits: "0"
3266-3293 uart: tx-data-bits: "0"
3110-3293 uart: tx-data: "[02]"
3292-3319 uart: tx-parity-ok: "Stop bit" "Stop" "T"
3575-3602 uart: tx-start: "Start bit" "Start" "S"
3601-3628 uart: tx-data-bits: "1"
3627-3654 uart: tx-data-bits: "1"
3653-3680 uart: tx-data-bits: "0"
3679-3706 uart: tx-data-bits: "0"
3705-3732 uart: tx-data-bits: "0"
3731-3758 uart: tx-data-bits: "0"
3757-3784 uart: tx-data-bits: "0"
3601-3784 uart: tx-data: "[03]"
3783-3810 uart: tx-parity-ok: "Stop bit" "Stop" "T"
4065-4092 uart: tx-start: "Start bit" "Start" "S"
4091-4118 uart: tx-data-bits: "0"
4117-4144 uart: tx-data-bits: "0"
4143-4170 uart: tx-data-bits: "1"
4169-4196 uart: tx-data-bits: "0"
4195-4222 uart: tx-data-bits: "0"
4221-4248 uart: tx-data-bits: "0"
4247-4274 uart: tx-data-bits: "0"
4091-4274 uart: tx-data: "[04]"
4273-4300 uart: tx-parity-ok: "Stop bit" "Stop" "T"
4556-4583 uart: tx-start: "Start bit" "Start" "S"
4582-4609 uart: tx-data-bits: "1"
4608-4635 uart: tx-data-bits: "0"
4634-4661 uart: tx-data-bits: "1"
4660-4687 uart: tx-data-bits: "0"
4686-4713 uart: tx-data-bits: "0"
4712-4739 uart: tx-data-bits: "0"
4738-4765 uart: tx-data-bits: "0"
4582-4765 uart: tx-data: "[05]"
4764-4791 uart: tx-parity-ok: "Stop bit" "Stop" "T"
5048-5075 uart: tx-start: "Start bit" "Start" "S"
5074-5101 uart: tx-data-bits: "0"
5100-5127 uart: tx-data-bits: "1"
5126-5153 uart: tx-data-bits: "1"
5152-5179 uart: tx-data-bits: "0"
5178-5205 uart: tx-data-bits: "0"
5204-5231 uart: tx-data-bits: "0"
5230-5257 uart: tx-data-bits: "0"
5074-5257 uart: tx-data: "[06]"
5256-5283 uart: tx-parity-ok: "Stop bit" "Stop" "T"
5539-5566 uart: tx-start: "Start bit" "Start" "S"
5565-5592 uart: tx-data-bits: "1"
5591-5618 uart: tx-data-bits: "1"
5617-5644 uart: tx-data-bits: "1"
5643-5670 uart: tx-data-bits: "0"
5669-5696 uart: tx-data-bits: "0"
5695-5722 uart: tx-data-bits: "0"
5721-5748 uart: tx-data-bits: "0"
5565-5748 uart: tx-data: "[07]"
5747-5774 uart: tx-parity-ok: "Stop bit" "Stop" "T"
6030-6057 uart: tx-start: "Start bit" "Start" "S"
6056-6083 uart: tx-data-bits: "0"
6082-6109 uart: tx-data-bits: "0"
6108-6135 uart: tx-data-bits: "0"
6134-6161 uart: tx-data-bits: "1"
6160-6187 uart: tx-data-bits: "0"
6186-6213 uart: tx-data-bits: "0"
6212-6239 uart: tx-data-bits: "0"
6056-6239 uart: tx-data: "[08]"
6238-6265 uart: tx-parity-ok: "Stop bit" "Stop" "T"
6520-6547 uart: tx-start: "Start bit" "Start" "S"
6546-6573 uart: tx-data-bits: "1"
6572-6599 uart: tx-data-bits: "0"
6598-6625 uart: tx-data-bits: "0"
6624-6651 uart: tx-data-bits: "1"
6650-6677 uart: tx-data-bits: "0"
6676-6703 uart: tx-data-bits: "0"
6702-6729 uart: tx-data-bits: "0"
6546-6729 uart: tx-data: "[09]"
6728-6755 uart: tx-parity-ok: "Stop bit" "Stop" "T"
7013-7040 uart: tx-start: "Start bit" "Start" "S"
7039-7066 uart: tx-data-bits: "0"
7065-7092 uart: tx-data-bits: "1"
7091-7118 uart: tx-data-bits: "0"
7117-7144 uart: tx-data-bits: "1"
7143-7170 uart: tx-data-bits: "0"
7169-7196 uart: tx-data-bits: "0"
7195-7222 uart: tx-data-bits: "0"
7039-7222 uart: tx-data: "[0A]"
7221-7248 uart: tx-parity-ok: "Stop bit" "Stop" "T"
7505-7532 uart: tx-start: "Start bit" "Start" "S"
7531-7558 uart: tx-data-bits: "1"
7557-7584 uart: tx-data-bits: "1"
7583-7610 uart: tx-data-bits: "0"
7609-7636 uart: tx-data-bits: "1"
7635-7662 uart: tx-data-bits: "0"
7661-7688 uart: tx-data-bits: "0"
7687-7714 uart: tx-data-bits: "0"
7531-7714 uart: tx-data: "[0B]"
7713-7740 uart: tx-parity-ok: "Stop bit" "Stop" "T"
7998-8025 uart: tx-start: "Start bit" "Start" "S"
8024-8051 uart: tx-data-bits: "0"
8050-8077 uart: tx-data-bits: "0"
8076-8103 uart: tx-data-bits: "1"
8102-8129 uart: tx-data-bits: "1"
8128-8155 uart: tx-data-bits: "0"
8154-8181 uart: tx-data-bits: "0"
8180-8207 uart: tx-data-bits: "0"
8024-8207 uart: tx-data: "[0C]"
8206-8233 uart: tx-parity-ok: "Stop bit" "Stop" "T"
8489-8516 uart: tx-start: "Start bit" "Start" "S"
8515-8542 uart: tx-data-bits: "1"
8541-8568 uart: tx-data-bits: "0"
8567-8594 uart: tx-data-bits: "1"
8593-8620 uart: tx-data-bits: "1"
8619-8646 uart: tx-data-bits: "0"
8645-8672 uart: tx-data-bits: "0"
8671-8698 uart: tx-data-bits: "0"
8515-8698 uart: tx-data: "[0D]"
8697-8724 uart: tx-parity-ok: "Stop bit" "Stop" "T"
8981-9008 uart: tx-start: "Start bit" "Start" "S"
9007-9034 uart: tx-data-bits: "0"
9033-9060 uart: tx-data-bits: "1"
9059-9086 uart: tx-data-bits: "1"
9085-9112 uart: tx-data-bits: "1"
9111-9138 uart: tx-data-bits: "0"
9137-9164 uart: tx-data-bits: "0"
9163-9190 uart: tx-data-bits: "0"
9007-9190 uart: tx-data: "[0E]"
9189-9216 uart: tx-parity-ok: "Stop bit" "Stop" "T"
9472-9499 uart: tx-start: "Start bit" "Start" "S"
9498-9525 uart: tx-data-bits: "1"
9524-9551 uart: tx-data-bits: "1"
9550-9577 uart: tx-data-bits: "1"
9576-9603 uart: tx-data-bits: "1"
9602-9629 uart: tx-data-bits: "0"
9628-9655 uart: tx-data-bits: "0"
9654-9681 uart: tx-data-bits: "0"
9498-9681 uart: tx-data: "[0F]"
9680-9707 uart: tx-parity-ok: "Stop bit" "Stop" "T"
9962-9989 uart: tx-start: "Start bit" "Start" "S"
9988-10015 uart: tx-data-bits: "0"
10014-10041 uart: tx-data-bits: "0"
10040-10067 uart: tx-data-bits: "0"
10066-10093 uart: tx-data-bits: "0"
10092-10119 uart: tx-data-bits: "1"
10118-10145 uart: tx-data-bits: "0"
10144-10171 uart: tx-data-bits: "0"
9988-10171 uart: tx-data: "[10]"
10170-10197 uart: tx-parity-ok: "Stop bit" "Stop" "T"
10453-10480 uart: tx-start: "Start bit" "Start" "S"
10479-10506 uart: tx-data-bits: "1"
10505-10532 uart: tx-data-bits: "0"
10531-10558 uart: tx-data-bits: "0"
10557-10584 uart: tx-data-bits: "0"
10583-10610 uart: tx-data-bits: "1"
10609-10636 uart: tx-data-bits: "0"
10635-10662 uart: tx-data-bits: "0"
10479-10662 uart: tx-data: "[11]"
10661-10688 uart: tx-parity-ok: "Stop bit" "Stop" "T"
10945-10972 uart: tx-start: "Start bit" "Start" "S"
10971-10998 uart: tx-data-bits: "0"
10997-11024 uart: tx-data-bits: "1"
11023-11050 uart: tx-data-bits: "0"
11049-11076 uart: tx-data-bits: "0"
11075-11102 uart: tx-data-bits: "1"
11101-11128 uart: tx-data-bits: "0"
11127-11154 uart: tx-data-bits: "0"
10971-11154 uart: tx-data: "[12]"
11153-11180 uart: tx-parity-ok: "Stop bit" "Stop" "T"
11438-11465 uart: tx-start: "Start bit" "Start" "S"
11464-11491 uart: tx-data-bits: "1"
11490-11517 uart: tx-data-bits: "1"
11516-11543 uart: tx-data-bits: "0"
11542-11569 uart: tx-data-bits: "0"
11568-11595 uart: tx-data-bits: "1"
11594-11621 uart: tx-data-bits: "0"
11620-11647 uart: tx-data-bits: "0"
11464-11647 uart: tx-data: "[13]"
11646-11673 uart: tx-parity-ok: "Stop bit" "Stop" "T"
11931-11958 uart: tx-start: "Start bit" "Start" "S"
11957-11984 uart: tx-data-bits: "0"
11983-12010 uart: tx-data-bits: "0"
12009-12036 uart: tx-data-bits: "1"
12035-12062 uart: tx-data-bits: "0"
12061-12088 uart: tx-data-bits: "1"
12087-12114 uart: tx-data-bits: "0"
12113-12140 uart: tx-data-bits: "0"
11957-12140 uart: tx-data: "[14]"
12139-12166 uart: tx-parity-ok: "Stop bit" "Stop" "T"
12423-12450 uart: tx-start: "Start bit" "Start" "S"
12449-12476 uart: tx-data-bits: "1"
12475-12502 uart: tx-data-bits: "0"
12501-12528 uart: tx-data-bits: "1"
12527-12554 uart: tx-data-bits: "0"
12553-12580 uart: tx-data-bits: "1"
12579-12606 uart: tx-data-bits: "0"
12605-12632 uart: tx-data-bits: "0"
12449-12632 uart: tx-data: "[15]"
12631-12658 uart: tx-parity-ok: "Stop bit" "Stop" "T"
12918-12945 uart: tx-start: "Start bit" "Start" "S"
12944-12971 uart: tx-data-bits: "0"
12970-12997 uart: tx-data-bits: "1"
12996-13023 uart: tx-data-bits: "1"
13022-13049 uart: tx-data-bits: "0"
13048-13075 uart: tx-data-bits: "1"
13074-13101 uart: tx-data-bits: "0"
13100-13127 uart: tx-data-bits: "0"
12944-13127 uart: tx-data: "[16]"
13126-13153 uart: tx-parity-ok: "Stop bit" "Stop" "T"
13410-13437 uart: tx-start: "Start bit" "Start" "S"
13436-13463 uart: tx-data-bits: "1"
13462-13489 uart: tx-data-bits: "1"
13488-13515 uart: tx-data-bits: "1"
13514-13541 uart: tx-data-bits: "0"
13540-13567 uart: tx-data-bits: "1"
13566-13593 uart: tx-data-bits: "0"
13592-13619 uart: tx-data-bits: "0"
13436-13619 uart: tx-data: "[17]"
13618-13645 uart: tx-parity-ok: "Stop bit" "Stop" "T"
13903-13930 uart: tx-start: "Start bit" "Start" "S"
13929-13956 uart: tx-data-bits: "0"
13955-13982 uart: tx-data-bits: "0"
13981-14008 uart: tx-data-bits: "0"
14007-14034 uart: tx-data-bits: "1"
14033-14060 uart: tx-data-bits: "1"
14059-14086 uart: tx-data-bits: "0"
14085-14112 uart: tx-data-bits: "0"
13929-14112 uart: tx-data: "[18]"
14111-14138 uart: tx-parity-ok: "Stop bit" "Stop" "T"
14394-14421 uart: tx-start: "Start bit" "Start" "S"
14420-14447 uart: tx-data-bits: "1"
14446-14473 uart: tx-data-bits: "0"
14472-14499 uart: tx-data-bits: "0"
14498-14525 uart: tx-data-bits: "1"
14524-14551 uart: tx-data-bits: "1"
14550-14577 uart: tx-data-bits: "0"
14576-14603 uart: tx-data-bits: "0"
14420-14603 uart: tx-data: "[19]"
14602-14629 uart: tx-parity-ok: "Stop bit" "Stop" "T"
14886-14913 uart: tx-start: "Start bit" "Start" "S"
14912-14939 uart: tx-data-bits: "0"
14938-14965 uart: tx-data-bits: "1"
14964-14991 uart: tx-data-bits: "0"
14990-15017 uart: tx-data-bits: "1"
15016-15043 uart: tx-data-bits: "1"
15042-15069 uart: tx-data-bits: "0"
15068-15095 uart: tx-data-bits: "0"
14912-15095 uart: tx-data: "[1A]"
15094-15121 uart: tx-parity-ok: "Stop bit" "Stop" "T"
15379-15406 uart: tx-start: "Start bit" "Start" "S"
15405-15432 uart: tx-data-bits: "1"
15431-15458 uart: tx-data-bits: "1"
15457-15484 uart: tx-data-bits: "0"
15483-15510 uart: tx-data-bits: "1"
15509-15536 uart: tx-data-bits: "1"
15535-15562 uart: tx-data-bits: "0"
15561-15588 uart: tx-data-bits: "0"
15405-15588 uart: tx-data: "[1B]"
15587-15614 uart: tx-parity-ok: "Stop bit" "Stop" "T"
15871-15898 uart: tx-start: "Start bit" "Start" "S"
15897-15924 uart: tx-data-bits: "0"
15923-15950 uart: tx-data-bits: "0"
15949-15976 uart: tx-data-bits: "1"
15975-16002 uart: tx-data-bits: "1"
16001-16028 uart: tx-data-bits: "1"
16027-16054 uart: tx-data-bits: "0"
16053-16080 uart: tx-data-bits: "0"
15897-16080 uart: tx-data: "[1C]"
16079-16106 uart: tx-parity-ok: "Stop bit" "Stop" "T"
16362-16389 uart: tx-start: "Start bit" "Start" "S"
16388-16415 uart: tx-data-bits: "1"
16414-16441 uart: tx-data-bits: "0"
16440-16467 uart: tx-data-bits: "1"
16466-16493 uart: tx-data-bits: "1"
16492-16519 uart: tx-data-bits: "1"
16518-16545 uart: tx-data-bits: "0"
16544-16571 uart: tx-data-bits: "0"
16388-16571 uart: tx-data: "[1D]"
16570-16597 uart: tx-parity-ok: "Stop bit" "Stop" "T"
16855-16882 uart: tx-start: "Start bit" "Start" "S"
16881-16908 uart: tx-data-bits: "0"
16907-16934 uart: tx-data-bits: "1"
16933-16960 uart: tx-data-bits: "1"
16959-16986 uart: tx-data-bits: "1"
16985-17012 uart: tx-data-bits: "1"
17011-17038 uart: tx-data-bits: "0"
17037-17064 uart: tx-data-bits: "0"
16881-17064 uart: tx-data: "[1E]"
17063-17090 uart: tx-parity-ok: "Stop bit" "Stop" "T"
17345-17372 uart: tx-start: "Start bit" "Start" "S"
17371-17398 uart: tx-data-bits: "1"
17397-17424 uart: tx-data-bits: "1"
17423-17450 uart: tx-data-bits: "1"
17449-17476 uart: tx-data-bits: "1"
17475-17502 uart: tx-data-bits: "1"
17501-17528 uart: tx-data-bits: "0"
17527-17554 uart: tx-data-bits: "0"
17371-17554 uart: tx-data: "[1F]"
17553-17580 uart: tx-parity-ok: "Stop bit" "Stop" "T"
17836-17863 uart: tx-start: "Start bit" "Start" "S"
17862-17889 uart: tx-data-bits: "0"
17888-17915 uart: tx-data-bits: "0"
17914-17941 uart: tx-data-bits: "0"
17940-17967 uart: tx-data-bits: "0"
17966-17993 uart: tx-data-bits: "0"
17992-18019 uart: tx-data-bits: "1"
18018-18045 uart: tx-data-bits: "0"
17862-18045 uart: tx-data: " "
18044-18071 uart: tx-parity-ok: "Stop bit" "Stop" "T"
18326-18353 uart: tx-start: "Start bit" "Start" "S"
18352-18379 uart: tx-data-bits: "1"
18378-18405 uart: tx-data-bits: "0"
18404-18431 uart: tx-data-bits: "0"
18430-18457 uart: tx-data-bits: "0"
18456-18483 uart: tx-data-bits: "0"
18482-18509 uart: tx-data-bits: "1"
18508-18535 uart: tx-data-bits: "0"
18352-18535 uart: tx-data: "!"
18534-18561 uart: tx-parity-ok: "Stop bit" "Stop" "T"
18819-18846 uart: tx-start: "Start bit" "Start" "S"
18845-18872 uart: tx-data-bits: "0"
18871-18898 uart: tx-data-bits: "1"
18897-18924 uart: tx-data-bits: "0"
18923-18950 uart: tx-data-bits: "0"
18949-18976 uart: tx-data-bits: "0"
18975-19002 uart: tx-data-bits: "1"
19001-19028 uart: tx-data-bits: "0"
18845-19028 uart: tx-data: """
19027-19054 uart: tx-parity-ok: "Stop bit" "Stop" "T"
19312-19339 uart: tx-start: "Start bit" "Start" "S"
19338-19365 uart: tx-data-bits: "1"
19364-19391 uart: tx-data-bits: "1"
19390-19417 uart: tx-data-bits: "0"
19416-19443 uart: tx-data-bits: "0"
19442-19469 uart: tx-data-bits: "0"
19468-19495 uart: tx-data-bits: "1"
19494-19521 uart: tx-data-bits: "0"
19338-19521 uart: tx-data: "#"
19520-19547 uart: tx-parity-ok: "Stop bit" "Stop" "T"
19804-19831 uart: tx-start: "Start bit" "Start" "S"
19830-19857 uart: tx-data-bits: "0"
19856-19883 uart: tx-data-bits: "0"
19882-19909 uart: tx-data-bits: "1"
19908-19935 uart: tx-data-bits: "0"
19934-19961 uart: tx-data-bits: "0"
19960-19987 uart: tx-data-bits: "1"
19986-20013 uart: tx-data-bits: "0"
19830-20013 uart: tx-data: "$"
20012-20039 uart: tx-parity-ok: "Stop bit" "Stop" "T"
20297-20324 uart: tx-start: "Start bit" "Start" "S"
20323-20350 uart: tx-data-bits: "1"
20349-20376 uart: tx-data-bits: "0"
20375-20402 uart: tx-data-bits: "1"
20401-20428 uart: tx-data-bits: "0"
20427-20454 uart: tx-data-bits: "0"
20453-20480 uart: tx-data-bits: "1"
20479-20506 uart: tx-data-bits: "0"
20323-20506 uart: tx-data: "%"
20505-20532 uart: tx-parity-ok: "Stop bit" "Stop" "T"
20791-20818 uart: tx-start: "Start bit" "Start" "S"
20817-20844 uart: tx-data-bits: "0"
20843-20870 uart: tx-data-bits: "1"
20869-20896 uart: tx-data-bits: "1"
20895-20922 uart: tx-data-bits: "0"
20921-20948 uart: tx-data-bits: "0"
20947-20974 uart: tx-data-bits: "1"
20973-21000 uart: tx-data-bits: "0"
20817-21000 uart: tx-data: "&"
20999-21026 uart: tx-parity-ok: "Stop bit" "Stop" "T"
21284-21311 uart: tx-start: "Start bit" "Start" "S"
21310-21337 uart: tx-data-bits: "1"
21336-21363 uart: tx-data-bits: "1"
21362-21389 uart: tx-data-bits: "1"
21388-21415 uart: tx-data-bits: "0"
21414-21441 uart: tx-data-bits: "0"
21440-21467 uart: tx-data-bits: "1"
21466-21493 uart: tx-data-bits: "0"
21310-21493 uart: tx-data: "'"
21492-21519 uart: tx-parity-ok: "Stop bit" "Stop" "T"
21777-21804 uart: tx-start: "Start bit" "Start" "S"
21803-21830 uart: tx-data-bits: "0"
21829-21856 uart: tx-data-bits: "0"
21855-21882 uart: tx-data-bits: "0"
21881-21908 uart: tx-data-bits: "1"
21907-21934 uart: tx-data-bits: "0"
21933-21960 uart: tx-data-bits: "1"
21959-21986 uart: tx-data-bits: "0"
21803-21986 uart: tx-data: "("
21985-22012 uart: tx-parity-ok: "Stop bit" "Stop" "T"
22269-22296 uart: tx-start: "Start bit" "Start" "S"
22295-22322 uart: tx-data-bits: "1"
22321-22348 uart: tx-data-bits: "0"
22347-22374 uart: tx-data-bits: "0"
22373-22400 uart: tx-data-bits: "1"
22399-22426 uart: tx-data-bits: "0"
22425-22452 uart: tx-data-bits: "1"
22451-22478 uart: tx-data-bits: "0"
22295-22478 uart: tx-data: ")"
22477-22504 uart: tx-parity-ok: "Stop bit" "Stop" "T"
22764-22791 uart: tx-start: "Start bit" "Start" "S"
22790-22817 uart: tx-data-bits: "0"
22816-22843 uart: tx-data-bits: "1"
22842-22869 uart: tx-data-bits: "0"
22868-22895 uart: tx-data-bits: "1"
22894-22921 uart: tx-data-bits: "0"
22920-22947 uart: tx-data-bits: "1"
22946-22973 uart: tx-data-bits: "0"
22790-22973 uart: tx-data: "*"
22972-22999 uart: tx-parity-ok: "Stop bit" "Stop" "T"
23258-23285 uart: tx-start: "Start bit" "Start" "S"
23284-23311 uart: tx-data-bits: "1"
23310-23337 uart: tx-data-bits: "1"
23336-23363 uart: tx-data-bits: "0"
23362-23389 uart: tx-data-bits: "1"
23388-23415 uart: tx-data-bits: "0"
23414-23441 uart: tx-data-bits: "1"
23440-23467 uart: tx-data-bits: "0"
23284-23467 uart: tx-data: "+"
23466-23493 uart: tx-parity-ok: "Stop bit" "Stop" "T"
23753-23780 uart: tx-start: "Start bit" "Start" "S"
23779-23806 uart: tx-data-bits: "0"
23805-23832 uart: tx-data-bits: "0"
23831-23858 uart: tx-data-bits: "1"
23857-23884 uart: tx-data-bits: "1"
23883-23910 uart: tx-data-bits: "0"
23909-23936 uart: tx-data-bits: "1"
23935-23962 uart: tx-data-bits: "0"
23779-23962 uart: tx-data: ","
23961-23988 uart: tx-parity-ok: "Stop bit" "Stop" "T"
24246-24273 uart: tx-start: "Start bit" "Start" "S"
24272-24299 uart: tx-data-bits: "1"
24298-24325 uart: tx-data-bits: "0"
24324-24351 uart: tx-data-bits: "1"
24350-24377 uart: tx-data-bits: "1"
24376-24403 uart: tx-data-bits: "0"
24402-24429 uart: tx-data-bits: "1"
24428-24455 uart: tx-data-bits: "0"
24272-24455 uart: tx-data: "-"
24454-24481 uart: tx-parity-ok: "Stop bit" "Stop" "T"
24740-24767 uart: tx-start: "Start bit" "Start" "S"
24766-24793 uart: tx-data-bits: "0"
24792-24819 uart: tx-data-bits: "1"
24818-24845 uart: tx-data-bits: "1"
24844-24871 uart: tx-data-bits: "1"
24870-24897 uart: tx-data-bits: "0"
24896-24923 uart: tx-data-bits: "1"
24922-24949 uart: tx-data-bits: "0"
24766-24949 uart: tx-data: "."
24948-24975 uart: tx-parity-ok: "Stop bit" "Stop" "T"
25233-25260 uart: tx-start: "Start bit" "Start" "S"
25259-25286 uart: tx-data-bits: "1"
25285-25312 uart: tx-data-bits: "1"
25311-25338 uart: tx-data-bits: "1"
25337-25364 uart: tx-data-bits: "1"
25363-25390 uart: tx-data-bits: "0"
25389-25416 uart: tx-data-bits: "1"
25415-25442 uart: tx-data-bits: "0"
25259-25442 uart: tx-data: "/"
25441-25468 uart: tx-parity-ok: "Stop bit" "Stop" "T"
25725-25752 uart: tx-start: "Start bit" "Start" "S"
25751-25778 uart: tx-data-bits: "0"
25777-25804 uart: tx-data-bits: "0"
25803-25830 uart: tx-data-bits: "0"
25829-25856 uart: tx-data-bits: "0"
25855-25882 uart: tx-data-bits: "1"
25881-25908 uart: tx-data-bits: "1"
25907-25934 uart: tx-data-bits: "0"
25751-25934 uart: tx-data: "0"
25933-25960 uart: tx-parity-ok: "Stop bit" "Stop" "T"
26216-26243 uart: tx-start: "Start bit" "Start" "S"
26242-26269 uart: tx-data-bits: "1"
26268-26295 uart: tx-data-bits: "0"
26294-26321 uart: tx-data-bits: "0"
26320-26347 uart: tx-data-bits: "0"
26346-26373 uart: tx-data-bits: "1"
26372-26399 uart: tx-data-bits: "1"
26398-26425 uart: tx-data-bits: "0"
26242-26425 uart: tx-data: "1"
26424-26451 uart: tx-parity-ok: "Stop bit" "Stop" "T"
26709-26736 uart: tx-start: "Start bit" "Start" "S"
26735-26762 uart: tx-data-bits: "0"
26761-26788 uart: tx-data-bits: "1"
26787-26814 uart: tx-data-bits: "0"
26813-26840 uart: tx-data-bits: "0"
26839-26866 uart: tx-data-bits: "1"
26865-26892 uart: tx-data-bits: "1"
26891-26918 uart: tx-data-bits: "0"
26735-26918 uart: tx-data: "2"
26917-26944 uart: tx-parity-ok: "Stop bit" "Stop" "T"
27201-27228 uart: tx-start: "Start bit" "Start" "S"
27227-27254 uart: tx-data-bits: "1"
27253-27280 uart: tx-data-bits: "1"
27279-27306 uart: tx-data-bits: "0"
27305-27332 uart: tx-data-bits: "0"
27331-27358 uart: tx-data-bits: "1"
27357-27384 uart: tx-data-bits: "1"
27383-27410 uart: tx-data-bits: "0"
27227-27410 uart: tx-data: "3"
27409-27436 uart: tx-parity-ok: "Stop bit" "Stop" "T"
27694-27721 uart: tx-start: "Start bit" "Start" "S"
27720-27747 uart: tx-data-bits: "0"
27746-27773 uart: tx-data-bits: "0"
27772-27799 uart: tx-data-bits: "1"
27798-27825 uart: tx-data-bits: "0"
27824-27851 uart: tx-data-bits: "1"
27850-27877 uart: tx-data-bits: "1"
27876-27903 uart: tx-data-bits: "0"
27720-27903 uart: tx-data: "4"
27902-27929 uart: tx-parity-ok: "Stop bit" "Stop" "T"
28186-28213 uart: tx-start: "Start bit" "Start" "S"
28212-28239 uart: tx-data-bits: "1"
28238-28265 uart: tx-data-bits: "0"
28264-28291 uart: tx-data-bits: "1"
28290-28317 uart: tx-data-bits: "0"
28316-28343 uart: tx-data-bits: "1"
28342-28369 uart: tx-data-bits: "1"
28368-28395 uart: tx-data-bits: "0"
28212-28395 uart: tx-data: "5"
28394-28421 uart: tx-parity-ok: "Stop bit" "Stop" "T"
28681-28708 uart: tx-start: "Start bit" "Start" "S"
28707-28734 uart: tx-data-bits: "0"
28733-28760 uart: tx-data-bits: "1"
28759-28786 uart: tx-data-bits: "1"
28785-28812 uart: tx-data-bits: "0"
28811-28838 uart: tx-data-bits: "1"
28837-28864 uart: tx-data-bits: "1"
28863-28890 uart: tx-data-bits: "0"
28707-28890 uart: tx-data: "6"
28889-28916 uart: tx-parity-ok: "Stop bit" "Stop" "T"
29174-29201 uart: tx-start: "Start bit" "Start" "S"
29200-29227 uart: tx-data-bits: "1"
29226-29253 uart: tx-data-bits: "1"
29252-29279 uart: tx-data-bits: "1"
29278-29305 uart: tx-data-bits: "0"
29304-29331 uart: tx-data-bits: "1"
29330-29357 uart: tx-data-bits: "1"
29356-29383 uart: tx-data-bits: "0"
29200-29383 uart: tx-data: "7"
29382-29409 uart: tx-parity-ok: "Stop bit" "Stop" "T"
29666-29693 uart: tx-start: "Start bit" "Start" "S"
29692-29719 uart: tx-data-bits: "0"
29718-29745 uart: tx-data-bits: "0"
29744-29771 uart: tx-data-bits: "0"
29770-29797 uart: tx-data-bits: "1"
29796-29823 uart: tx-data-bits: "1"
29822-29849 uart: tx-data-bits: "1"
29848-29875 uart: tx-data-bits: "0"
29692-29875 uart: tx-data: "8"
29874-29901 uart: tx-parity-ok: "Stop bit" "Stop" "T"
30157-30184 uart: tx-start: "Start bit" "Start" "S"
30183-30210 uart: tx-data-bits: "1"
30209-30236 uart: tx-data-bits: "0"
30235-30262 uart: tx-data-bits: "0"
30261-30288 uart: tx-data-bits: "1"
30287-30314 uart: tx-data-bits: "1"
30313-30340 uart: tx-data-bits: "1"
30339-30366 uart: tx-data-bits: "0"
30183-30366 uart: tx-data: "9"
30365-30392 uart: tx-parity-ok: "Stop bit" "Stop" "T"
30649-30676 uart: tx-start: "Start bit" "Start" "S"
30675-30702 uart: tx-data-bits: "0"
30701-30728 uart: tx-data-bits: "1"
30727-30754 uart: tx-data-bits: "0"
30753-30780 uart: tx-data-bits: "1"
30779-30806 uart: tx-data-bits: "1"
30805-30832 uart: tx-data-bits: "1"
30831-30858 uart: tx-data-bits: "0"
30675-30858 uart: tx-data: ":"
30857-30884 uart: tx-parity-ok: "Stop bit" "Stop" "T"
31142-31169 uart: tx-start: "Start bit" "Start" "S"
31168-31195 uart: tx-data-bits: "1"
31194-31221 uart: tx-data-bits: "1"
31220-31247 uart: tx-data-bits: "0"
31246-31273 uart: tx-data-bits: "1"
31272-31299 uart: tx-data-bits: "1"
31298-31325 uart: tx-data-bits: "1"
31324-31351 uart: tx-data-bits: "0"
31168-31351 uart: tx-data: ";"
31350-31377 uart: tx-parity-ok: "Stop bit" "Stop" "T"
31635-31662 uart: tx-start: "Start bit" "Start" "S"
31661-31688 uart: tx-data-bits: "0"
31687-31714 uart: tx-data-bits: "0"
31713-31740 uart: tx-data-bits: "1"
31739-31766 uart: tx-data-bits: "1"
31765-31792 uart: tx-data-bits: "1"
31791-31818 uart: tx-data-bits: "1"
31817-31844 uart: tx-data-bits: "0"
31661-31844 uart: tx-data: "<"
31843-31870 uart: tx-parity-ok: "Stop bit" "Stop" "T"
32125-32152 uart: tx-start: "Start bit" "Start" "S"
32151-32178 uart: tx-data-bits: "1"
32177-32204 uart: tx-data-bits: "0"
32203-32230 uart: tx-data-bits: "1"
32229-32256 uart: tx-data-bits: "1"
32255-32282 uart: tx-data-bits: "1"
32281-32308 uart: tx-data-bits: "1"
32307-32334 uart: tx-data-bits: "0"
32151-32334 uart: tx-data: "="
32333-32360 uart: tx-parity-ok: "Stop bit" "Stop" "T"
32618-32645 uart: tx-start: "Start bit" "Start" "S"
32644-32671 uart: tx-data-bits: "0"
32670-32697 uart: tx-data-bits: "1"
32696-32723 uart: tx-data-bits: "1"
32722-32749 uart: tx-data-bits: "1"
32748-32775 uart: tx-data-bits: "1"
32774-32801 uart: tx-data-bits: "1"
32800-32827 uart: tx-data-bits: "0"
32644-32827 uart: tx-data: ">"
32826-32853 uart: tx-parity-ok: "Stop bit" "Stop" "T"
33108-33135 uart: tx-start: "Start bit" "Start" "S"
33134-33161 uart: tx-data-bits: "1"
33160-33187 uart: tx-data-bits: "1"
33186-33213 uart: tx-data-bits: "1"
33212-33239 uart: tx-data-bits: "1"
33238-33265 uart: tx-data-bits: "1"
33264-33291 uart: tx-data-bits: "1"
33290-33317 uart: tx-data-bits: "0"
33134-33317 uart: tx-data: "?"
33316-33343 uart: tx-parity-ok: "Stop bit" "Stop" "T"
33599-33626 uart: tx-start: "Start bit" "Start" "S"
33625-33652 uart: tx-data-bits: "0"
33651-33678 uart: tx-data-bits: "0"
33677-33704 uart: tx-data-bits: "0"
33703-33730 uart: tx-data-bits: "0"
33729-33756 uart: tx-data-bits: "0"
33755-33782 uart: tx-data-bits: "0"
33781-33808 uart: tx-data-bits: "1"
33625-33808 uart: tx-data: "@"
33807-33834 uart: tx-parity-ok: "Stop bit" "Stop" "T"
34088-34115 uart: tx-start: "Start bit" "Start" "S"
34114-34141 uart: tx-data-bits: "1"
34140-34167 uart: tx-data-bits: "0"
34166-34193 uart: tx-data-bits: "0"
34192-34219 uart: tx-data-bits: "0"
34218-34245 uart: tx-data-bits: "0"
34244-34271 uart: tx-data-bits: "0"
34270-34297 uart: tx-data-bits: "1"
34114-34297 uart: tx-data: "A"
34296-34323 uart: tx-parity-ok: "Stop bit" "Stop" "T"
34578-34605 uart: tx-start: "Start bit" "Start" "S"
34604-34631 uart: tx-data-bits: "0"
34630-34657 uart: tx-data-bits: "1"
34656-34683 uart: tx-data-bits: "0"
34682-34709 uart: tx-data-bits: "0"
34708-34735 uart: tx-data-bits: "0"
34734-34761 uart: tx-data-bits: "0"
34760-34787 uart: tx-data-bits: "1"
34604-34787 uart: tx-data: "B"
34786-34813 uart: tx-parity-ok: "Stop bit" "Stop" "T"
35069-35096 uart: tx-start: "Start bit" "Start" "S"
35095-35122 uart: tx-data-bits: "1"
35121-35148 uart: tx-data-bits: "1"
35147-35174 uart: tx-data-bits: "0"
35173-35200 uart: tx-data-bits: "0"
35199-35226 uart: tx-data-bits: "0"
35225-35252 uart: tx-data-bits: "0"
35251-35278 uart: tx-data-bits: "1"
35095-35278 uart: tx-data: "C"
35277-35304 uart: tx-parity-ok: "Stop bit" "Stop" "T"
35559-35586 uart: tx-start: "Start bit" "Start" "S"
35585-35612 uart: tx-data-bits: "0"
35611-35638 uart: tx-data-bits: "0"
35637-35664 uart: tx-data-bits: "1"
35663-35690 uart: tx-data-bits: "0"
35689-35716 uart: tx-data-bits: "0"
35715-35742 uart: tx-data-bits: "0"
35741-35768 uart: tx-data-bits: "1"
35585-35768 uart: tx-data: "D"
35767-35794 uart: tx-parity-ok: "Stop bit" "Stop" "T"
36050-36077 uart: tx-start: "Start bit" "Start" "S"
36076-36103 uart: tx-data-bits: "1"
36102-36129 uart: tx-data-bits: "0"
36128-36155 uart: tx-data-bits: "1"
36154-36181 uart: tx-data-bits: "0"
36180-36207 uart: tx-data-bits: "0"
36206-36233 uart: tx-data-bits: "0"
36232-36259 uart: tx-data-bits: "1"
36076-36259 uart: tx-data: "E"
36258-36285 uart: tx-parity-ok: "Stop bit" "Stop" "T"
36543-36570 uart: tx-start: "Start bit" "Start" "S"
36569-36596 uart: tx-data-bits: "0"
36595-36622 uart: tx-data-bits: "1"
36621-36648 uart: tx-data-bits: "1"
36647-36674 uart: tx-data-bits: "0"
36673-36700 uart: tx-data-bits: "0"
36699-36726 uart: tx-data-bits: "0"
36725-36752 uart: tx-data-bits: "1"
36569-36752 uart: tx-data: "F"
36751-36778 uart: tx-parity-ok: "Stop bit" "Stop" "T"
37033-37060 uart: tx-start: "Start bit" "Start" "S"
37059-37086 uart: tx-data-bits: "1"
37085-37112 uart: tx-data-bits: "1"
37111-37138 uart: tx-data-bits: "1"
37137-37164 uart: tx-data-bits: "0"
37163-37190 uart: tx-data-bits: "0"
37189-37216 uart: tx-data-bits: "0"
37215-37242 uart: tx-data-bits: "1"
37059-37242 uart: tx-data: "G"
37241-37268 uart: tx-parity-ok: "Stop bit" "Stop" "T"
37524-37551 uart: tx-start: "Start bit" "Start" "S"
37550-37577 uart: tx-data-bits: "0"
37576-37603 uart: tx-data-bits: "0"
37602-37629 uart: tx-data-bits: "0"
37628-37655 uart: tx-data-bits: "1"
37654-37681 uart: tx-data-bits: "0"
37680-37707 uart: tx-data-bits: "0"
37706-37733 uart: tx-data-bits: "1"
37550-37733 uart: tx-data: "H"
37732-37759 uart: tx-parity-ok: "Stop bit" "Stop" "T"
38014-38041 uart: tx-start: "Start bit" "Start" "S"
38040-38067 uart: tx-data-bits: "1"
38066-38093 uart: tx-data-bits: "0"
38092-38119 uart: tx-data-bits: "0"
38118-38145 uart: tx-data-bits: "1"
38144-38171 uart: tx-data-bits: "0"
38170-38197 uart: tx-data-bits: "0"
38196-38223 uart: tx-data-bits: "1"
38040-38223 uart: tx-data: "I"
38222-38249 uart: tx-parity-ok: "Stop bit" "Stop" "T"
38507-38534 uart: tx-start: "Start bit" "Start" "S"
38533-38560 uart: tx-data-bits: "0"
38559-38586 uart: tx-data-bits: "1"
38585-38612 uart: tx-data-bits: "0"
38611-38638 uart: tx-data-bits: "1"
38637-38664 uart: tx-data-bits: "0"
38663-38690 uart: tx-data-bits: "0"
38689-38716 uart: tx-data-bits: "1"
38533-38716 uart: tx-data: "J"
38715-38742 uart: tx-parity-ok: "Stop bit" "Stop" "T"
39000-39027 uart: tx-start: "Start bit" "Start" "S"
39026-39053 uart: tx-data-bits: "1"
39052-39079 uart: tx-data-bits: "1"
39078-39105 uart: tx-data-bits: "0"
39104-39131 uart: tx-data-bits: "1"
39130-39157 uart: tx-data-bits: "0"
39156-39183 uart: tx-data-bits: "0"
39182-39209 uart: tx-data-bits: "1"
39026-39209 uart: tx-data: "K"
39208-39235 uart: tx-parity-ok: "Stop bit" "Stop" "T"
39492-39519 uart: tx-start: "Start bit" "Start" "S"
39518-39545 uart: tx-data-bits: "0"
39544-39571 uart: tx-data-bits: "0"
39570-39597 uart: tx-data-bits: "1"
39596-39623 uart: tx-data-bits: "1"
39622-39649 uart: tx-data-bits: "0"
39648-39675 uart: tx-data-bits: "0"
39674-39701 uart: tx-data-bits: "1"
39518-39701 uart: tx-data: "L"
39700-39727 uart: tx-parity-ok: "Stop bit" "Stop" "T"
39983-40010 uart: tx-start: "Start bit" "Start" "S"
40009-40036 uart: tx-data-bits: "1"
40035-40062 uart: tx-data-bits: "0"
40061-40088 uart: tx-data-bits: "1"
40087-40114 uart: tx-data-bits: "1"
40113-40140 uart: tx-data-bits: "0"
40139-40166 uart: tx-data-bits: "0"
40165-40192 uart: tx-data-bits: "1"
40009-40192 uart: tx-data: "M"
40191-40218 uart: tx-parity-ok: "Stop bit" "Stop" "T"
40475-40502 uart: tx-start: "Start bit" "Start" "S"
40501-40528 uart: tx-data-bits: "0"
40527-40554 uart: tx-data-bits: "1"
40553-40580 uart: tx-data-bits: "1"
40579-40606 uart: tx-data-bits: "1"
40605-40632 uart: tx-data-bits: "0"
40631-40658 uart: tx-data-bits: "0"
40657-40684 uart: tx-data-bits: "1"
40501-40684 uart: tx-data: "N"
40683-40710 uart: tx-parity-ok: "Stop bit" "Stop" "T"
40966-40993 uart: tx-start: "Start bit" "Start" "S"
40992-41019 uart: tx-data-bits: "1"
41018-41045 uart: tx-data-bits: "1"
41044-41071 uart: tx-data-bits: "1"
41070-41097 uart: tx-data-bits: "1"
41096-41123 uart: tx-data-bits: "0"
41122-41149 uart: tx-data-bits: "0"
41148-41175 uart: tx-data-bits: "1"
40992-41175 uart: tx-data: "O"
41174-41201 uart: tx-parity-ok: "Stop bit" "Stop" "T"
41457-41484 uart: tx-start: "Start bit" "Start" "S"
41483-41510 uart: tx-data-bits: "0"
41509-41536 uart: tx-data-bits: "0"
41535-41562 uart: tx-data-bits: "0"
41561-41588 uart: tx-data-bits: "0"
41587-41614 uart: tx-data-bits: "1"
41613-41640 uart: tx-data-bits: "0"
41639-41666 uart: tx-data-bits: "1"
41483-41666 uart: tx-data: "P"
41665-41692 uart: tx-parity-ok: "Stop bit" "Stop" "T"
41947-41974 uart: tx-start: "Start bit" "Start" "S"
41973-42000 uart: tx-data-bits: "1"
41999-42026 uart: tx-data-bits: "0"
42025-42052 uart: tx-data-bits: "0"
42051-42078 uart: tx-data-bits: "0"
42077-42104 uart: tx-data-bits: "1"
42103-42130 uart: tx-data-bits: "0"
42129-42156 uart: tx-data-bits: "1"
41973-42156 uart: tx-data: "Q"
42155-42182 uart: tx-parity-ok: "Stop bit" "Stop" "T"
42440-42467 uart: tx-start: "Start bit" "Start" "S"
42466-42493 uart: tx-data-bits: "0"
42492-42519 uart: tx-data-bits: "1"
42518-42545 uart: tx-data-bits: "0"
42544-42571 uart: tx-data-bits: "0"
42570-42597 uart: tx-data-bits: "1"
42596-42623 uart: tx-data-bits: "0"
42622-42649 uart: tx-data-bits: "1"
42466-42649 uart: tx-data: "R"
42648-42675 uart: tx-parity-ok: "Stop bit" "Stop" "T"
42932-42959 uart: tx-start: "Start bit" "Start" "S"
42958-42985 uart: tx-data-bits: "1"
42984-43011 uart: tx-data-bits: "1"
43010-43037 uart: tx-data-bits: "0"
43036-43063 uart: tx-data-bits: "0"
43062-43089 uart: tx-data-bits: "1"
43088-43115 uart: tx-data-bits: "0"
43114-43141 uart: tx-data-bits: "1"
42958-43141 uart: tx-data: "S"
43140-43167 uart: tx-parity-ok: "Stop bit" "Stop" "T"
43426-43453 uart: tx-start: "Start bit" "Start" "S"
43452-43479 uart: tx-data-bits: "0"
43478-43505 uart: tx-data-bits: "0"
43504-43531 uart: tx-data-bits: "1"
43530-43557 uart: tx-data-bits: "0"
43556-43583 uart: tx-data-bits: "1"
43582-43609 uart: tx-data-bits: "0"
43608-43635 uart: tx-data-bits: "1"
43452-43635 uart: tx-data: "T"
43634-43661 uart: tx-parity-ok: "Stop bit" "Stop" "T"
43919-43946 uart: tx-start: "Start bit" "Start" "S"
43945-43972 uart: tx-data-bits: "1"
43971-43998 uart: tx-data-bits: "0"
43997-44024 uart: tx-data-bits: "1"
44023-44050 uart: tx-data-bits: "0"
44049-44076 uart: tx-data-bits: "1"
44075-44102 uart: tx-data-bits: "0"
44101-44128 uart: tx-data-bits: "1"
43945-44128 uart: tx-data: "U"
44127-44154 uart: tx-parity-ok: "Stop bit" "Stop" "T"
44413-44440 uart: tx-start: "Start bit" "Start" "S"
44439-44466 uart: tx-data-bits: "0"
44465-44492 uart: tx-data-bits: "1"
44491-44518 uart: tx-data-bits: "1"
44517-44544 uart: tx-data-bits: "0"
44543-44570 uart: tx-data-bits: "1"
44569-44596 uart: tx-data-bits: "0"
44595-44622 uart: tx-data-bits: "1"
44439-44622 uart: tx-data: "V"
44621-44648 uart: tx-parity-ok: "Stop bit" "Stop" "T"
44906-44933 uart: tx-start: "Start bit" "Start" "S"
44932-44959 uart: tx-data-bits: "1"
44958-44985 uart: tx-data-bits: "1"
44984-45011 uart: tx-data-bits: "1"
45010-45037 uart: tx-data-bits: "0"
45036-45063 uart: tx-data-bits: "1"
45062-45089 uart: tx-data-bits: "0"
45088-45115 uart: tx-data-bits: "1"
44932-45115 uart: tx-data: "W"
45114-45141 uart: tx-parity-ok: "Stop bit" "Stop" "T"
45398-45425 uart: tx-start: "Start bit" "Start" "S"
45424-45451 uart: tx-data-bits: "0"
45450-45477 uart: tx-data-bits: "0"
45476-45503 uart: tx-data-bits: "0"
45502-45529 uart: tx-data-bits: "1"
45528-45555 uart: tx-data-bits: "1"
45554-45581 uart: tx-data-bits: "0"
45580-45607 uart: tx-data-bits: "1"
45424-45607 uart: tx-data: "X"
45606-45633 uart: tx-parity-ok: "Stop bit" "Stop" "T"
45889-45916 uart: tx-start: "Start bit" "Start" "S"
45915-45942 uart: tx-data-bits: "1"
45941-45968 uart: tx-data-bits: "0"
45967-45994 uart: tx-data-bits: "0"
45993-46020 uart: tx-data-bits: "1"
46019-46046 uart: tx-data-bits: "1"
46045-46072 uart: tx-data-bits: "0"
46071-46098 uart: tx-data-bits: "1"
45915-46098 uart: tx-data: "Y"
46097-46124 uart: tx-parity-ok: "Stop bit" "Stop" "T"
46382-46409 uart: tx-start: "Start bit" "Start" "S"
46408-46435 uart: tx-data-bits: "0"
46434-46461 uart: tx-data-bits: "1"
46460-46487 uart: tx-data-bits: "0"
46486-46513 uart: tx-data-bits: "1"
46512-46539 uart: tx-data-bits: "1"
46538-46565 uart: tx-data-bits: "0"
46564-46591 uart: tx-data-bits: "1"
46408-46591 uart: tx-data: "Z"
46590-46617 uart: tx-parity-ok: "Stop bit" "Stop" "T"
46874-46901 uart: tx-start: "Start bit" "Start" "S"
46900-46927 uart: tx-data-bits: "1"
46926-46953 uart: tx-data-bits: "1"
46952-46979 uart: tx-data-bits: "0"
46978-47005 uart: tx-data-bits: "1"
47004-47031 uart: tx-data-bits: "1"
47030-47057 uart: tx-data-bits: "0"
47056-47083 uart: tx-data-bits: "1"
46900-47083 uart: tx-data: "["
47082-47109 uart: tx-parity-ok: "Stop bit" "Stop" "T"
47367-47394 uart: tx-start: "Start bit" "Start" "S"
47393-47420 uart: tx-data-bits: "0"
47419-47446 uart: tx-data-bits: "0"
47445-47472 uart: tx-data-bits: "1"
47471-47498 uart: tx-data-bits: "1"
47497-47524 uart: tx-data-bits: "1"
47523-47550 uart: tx-data-bits: "0"
47549-47576 uart: tx-data-bits: "1"
47393-47576 uart: tx-data: "\"
47575-47602 uart: tx-parity-ok: "Stop bit" "Stop" "T"
47857-47884 uart: tx-start: "Start bit" "Start" "S"
47883-47910 uart: tx-data-bits: "1"
47909-47936 uart: tx-data-bits: "0"
47935-47962 uart: tx-data-bits: "1"
47961-47988 uart: tx-data-bits: "1"
47987-48014 uart: tx-data-bits: "1"
48013-48040 uart: tx-data-bits: "0"
48039-48066 uart: tx-data-bits: "1"
47883-48066 uart: tx-data: "]"
48065-48092 uart: tx-parity-ok: "Stop bit" "Stop" "T"
48350-48377 uart: tx-start: "Start bit" "Start" "S"
48376-48403 uart: tx-data-bits: "0"
48402-48429 uart: tx-data-bits: "1"
48428-48455 uart: tx-data-bits: "1"
48454-48481 uart: tx-data-bits: "1"
48480-48507 uart: tx-data-bits: "1"
48506-48533 uart: tx-data-bits: "0"
48532-48559 uart: tx-data-bits: "1"
48376-48559 uart: tx-data: "^"
48558-48585 uart: tx-parity-ok: "Stop bit" "Stop" "T"
48841-48868 uart: tx-start: "Start bit" "Start" "S"
48867-48894 uart: tx-data-bits: "1"
48893-48920 uart: tx-data-bits: "1"
48919-48946 uart: tx-data-bits: "1"
48945-48972 uart: tx-data-bits: "1"
48971-48998 uart: tx-data-bits: "1"
48997-49024 uart: tx-data-bits: "0"
49023-49050 uart: tx-data-bits: "1"
48867-49050 uart: tx-data: "_"
49049-49076 uart: tx-parity-ok: "Stop bit" "Stop" "T"
49331-49358 uart: tx-start: "Start bit" "Start" "S"
49357-49384 uart: tx-data-bits: "0"
49383-49410 uart: tx-data-bits: "0"
49409-49436 uart: tx-data-bits: "0"
49435-49462 uart: tx-data-bits: "0"
49461-49488 uart: tx-data-bits: "0"
49487-49514 uart: tx-data-bits: "1"
49513-49540 uart: tx-data-bits: "1"
49357-49540 uart: tx-data: "`"
49539-49566 uart: tx-parity-ok: "Stop bit" "Stop" "T"
49820-49847 uart: tx-start: "Start bit" "Start" "S"
49846-49873 uart: tx-data-bits: "1"
49872-49899 uart: tx-data-bits: "0"
49898-49925 uart: tx-data-bits: "0"
49924-49951 uart: tx-data-bits: "0"
49950-49977 uart: tx-data-bits: "0"
49976-50003 uart: tx-data-bits: "1"
50002-50029 uart: tx-data-bits: "1"
49846-50029 uart: tx-data: "a"
50028-50055 uart: tx-parity-ok: "Stop bit" "Stop" "T"
50310-50337 uart: tx-start: "Start bit" "Start" "S"
50336-50363 uart: tx-data-bits: "0"
50362-50389 uart: tx-data-bits: "1"
50388-50415 uart: tx-data-bits: "0"
50414-50441 uart: tx-data-bits: "0"
50440-50467 uart: tx-data-bits: "0"
50466-50493 uart: tx-data-bits: "1"
50492-50519 uart: tx-data-bits: "1"
50336-50519 uart: tx-data: "b"
50518-50545 uart: tx-parity-ok: "Stop bit" "Stop" "T"
50801-50828 uart: tx-start: "Start bit" "Start" "S"
50827-50854 uart: tx-data-bits: "1"
50853-50880 uart: tx-data-bits: "1"
50879-50906 uart: tx-data-bits: "0"
50905-50932 uart: tx-data-bits: "0"
50931-50958 uart: tx-data-bits: "0"
50957-50984 uart: tx-data-bits: "1"
50983-51010 uart: tx-data-bits: "1"
50827-51010 uart: tx-data: "c"
51009-51036 uart: tx-parity-ok: "Stop bit" "Stop" "T"
51292-51319 uart: tx-start: "Start bit" "Start" "S"
51318-51345 uart: tx-data-bits: "0"
51344-51371 uart: tx-data-bits: "0"
51370-51397 uart: tx-data-bits: "1"
51396-51423 uart: tx-data-bits: "0"
51422-51449 uart: tx-data-bits: "0"
51448-51475 uart: tx-data-bits: "1"
51474-51501 uart: tx-data-bits: "1"
51318-51501 uart: tx-data: "d"
51500-51527 uart: tx-parity-ok: "Stop bit" "Stop" "T"
51782-51809 uart: tx-start: "Start bit" "Start" "S"
51808-51835 uart: tx-data-bits: "1"
51834-51861 uart: tx-data-bits: "0"
51860-51887 uart: tx-data-bits: "1"
51886-51913 uart: tx-data-bits: "0"
51912-51939 uart: tx-data-bits: "0"
51938-51965 uart: tx-data-bits: "1"
51964-51991 uart: tx-data-bits: "1"
51808-51991 uart: tx-data: "e"
51990-52017 uart: tx-parity-ok: "Stop bit" "Stop" "T"
52275-52302 uart: tx-start: "Start bit" "Start" "S"
52301-52328 uart: tx-data-bits: "0"
52327-52354 uart: tx-data-bits: "1"
52353-52380 uart: tx-data-bits: "1"
52379-52406 uart: tx-data-bits: "0"
52405-52432 uart: tx-data-bits: "0"
52431-52458 uart: tx-data-bits: "1"
52457-52484 uart: tx-data-bits: "1"
52301-52484 uart: tx-data: "f"
52483-52510 uart: tx-parity-ok: "Stop bit" "Stop" "T"
52765-52792 uart: tx-start: "Start bit" "Start" "S"
52791-52818 uart: tx-data-bits: "1"
52817-52844 uart: tx-data-bits: "1"
52843-52870 uart: tx-data-bits: "1"
52869-52896 uart: tx-data-bits: "0"
52895-52922 uart: tx-data-bits: "0"
52921-52948 uart: tx-data-bits: "1"
52947-52974 uart: tx-data-bits: "1"
52791-52974 uart: tx-data: "g"
52973-53000 uart: tx-parity-ok: "Stop bit" "Stop" "T"
53256-53283 uart: tx-start: "Start bit" "Start" "S"
53282-53309 uart: tx-data-bits: "0"
53308-53335 uart: tx-data-bits: "0"
53334-53361 uart: tx-data-bits: "0"
53360-53387 uart: tx-data-bits: "1"
53386-53413 uart: tx-data-bits: "0"
53412-53439 uart: tx-data-bits: "1"
53438-53465 uart: tx-data-bits: "1"
53282-53465 uart: tx-data: "h"
53464-53491 uart: tx-parity-ok: "Stop bit" "Stop" "T"
53747-53774 uart: tx-start: "Start bit" "Start" "S"
53773-53800 uart: tx-data-bits: "1"
53799-53826 uart: tx-data-bits: "0"
53825-53852 uart: tx-data-bits: "0"
53851-53878 uart: tx-data-bits: "1"
53877-53904 uart: tx-data-bits: "0"
53903-53930 uart: tx-data-bits: "1"
53929-53956 uart: tx-data-bits: "1"
53773-53956 uart: tx-data: "i"
53955-53982 uart: tx-parity-ok: "Stop bit" "Stop" "T"
54239-54266 uart: tx-start: "Start bit" "Start" "S"
54265-54292 uart: tx-data-bits: "0"
54291-54318 uart: tx-data-bits: "1"
54317-54344 uart: tx-data-bits: "0"
54343-54370 uart: tx-data-bits: "1"
54369-54396 uart: tx-data-bits: "0"
54395-54422 uart: tx-data-bits: "1"
54421-54448 uart: tx-data-bits: "1"
54265-54448 uart: tx-data: "j"
54447-54474 uart: tx-parity-ok: "Stop bit" "Stop" "T"
54732-54759 uart: tx-start: "Start bit" "Start" "S"
54758-54785 uart: tx-data-bits: "1"
54784-54811 uart: tx-data-bits: "1"
54810-54837 uart: tx-data-bits: "0"
54836-54863 uart: tx-data-bits: "1"
54862-54889 uart: tx-data-bits: "0"
54888-54915 uart: tx-data-bits: "1"
54914-54941 uart: tx-data-bits: "1"
54758-54941 uart: tx-data: "k"
54940-54967 uart: tx-parity-ok: "Stop bit" "Stop" "T"
55224-55251 uart: tx-start: "Start bit" "Start" "S"
55250-55277 uart: tx-data-bits: "0"
55276-55303 uart: tx-data-bits: "0"
55302-55329 uart: tx-data-bits: "1"
55328-55355 uart: tx-data-bits: "1"
55354-55381 uart: tx-data-bits: "0"
55380-55407 uart: tx-data-bits: "1"
55406-55433 uart: tx-data-bits: "1"
55250-55433 uart: tx-data: "l"
55432-55459 uart: tx-parity-ok: "Stop bit" "Stop" "T"
55715-55742 uart: tx-start: "Start bit" "Start" "S"
55741-55768 uart: tx-data-bits: "1"
55767-55794 uart: tx-data-bits: "0"
55793-55820 uart: tx-data-bits: "1"
55819-55846 uart: tx-data-bits: "1"
55845-55872 uart: tx-data-bits: "0"
55871-55898 uart: tx-data-bits: "1"
55897-55924 uart: tx-data-bits: "1"
55741-55924 uart: tx-data: "m"
55923-55950 uart: tx-parity-ok: "Stop bit" "Stop" "T"
56208-56235 uart: tx-start: "Start bit" "Start" "S"
56234-56261 uart: tx-data-bits: "0"
56260-56287 uart: tx-data-bits: "1"
56286-56313 uart: tx-data-bits: "1"
56312-56339 uart: tx-data-bits: "1"
56338-56365 uart: tx-data-bits: "0"
56364-56391 uart: tx-data-bits: "1"
56390-56417 uart: tx-data-bits: "1"
56234-56417 uart: tx-data: "n"
56416-56443 uart: tx-parity-ok: "Stop bit" "Stop" "T"
56698-56725 uart: tx-start: "Start bit" "Start" "S"
56724-56751 uart: tx-data-bits: "1"
56750-56777 uart: tx-data-bits: "1"
56776-56803 uart: tx-data-bits: "1"
56802-56829 uart: tx-data-bits: "1"
56828-56855 uart: tx-data-bits: "0"
56854-56881 uart: tx-data-bits: "1"
56880-56907 uart: tx-data-bits: "1"
56724-56907 uart: tx-data: "o"
56906-56933 uart: tx-parity-ok: "Stop bit" "Stop" "T"
57189-57216 uart: tx-start: "Start bit" "Start" "S"
57215-57242 uart: tx-data-bits: "0"
57241-57268 uart: tx-data-bits: "0"
57267-57294 uart: tx-data-bits: "0"
57293-57320 uart: tx-data-bits: "0"
57319-57346 uart: tx-data-bits: "1"
57345-57372 uart: tx-data-bits: "1"
57371-57398 uart: tx-data-bits: "1"
57215-57398 uart: tx-data: "p"
57397-57424 uart: tx-parity-ok: "Stop bit" "Stop" "T"
57677-57704 uart: tx-start: "Start bit" "Start" "S"
57703-57730 uart: tx-data-bits: "1"
57729-57756 uart: tx-data-bits: "0"
57755-57782 uart: tx-data-bits: "0"
57781-57808 uart: tx-data-bits: "0"
57807-57834 uart: tx-data-bits: "1"
57833-57860 uart: tx-data-bits: "1"
57859-57886 uart: tx-data-bits: "1"
57703-57886 uart: tx-data: "q"
57885-57912 uart: tx-parity-ok: "Stop bit" "Stop" "T"
58168-58195 uart: tx-start: "Start bit" "Start" "S"
58194-58221 uart: tx-data-bits: "0"
58220-58247 uart: tx-data-bits: "1"
58246-58273 uart: tx-data-bits: "0"
58272-58299 uart: tx-data-bits: "0"
58298-58325 uart: tx-data-bits: "1"
58324-58351 uart: tx-data-bits: "1"
58350-58377 uart: tx-data-bits: "1"
58194-58377 uart: tx-data: "r"
58376-58403 uart: tx-parity-ok: "Stop bit" "Stop" "T"
58659-58686 uart: tx-start: "Start bit" "Start" "S"
58685-58712 uart: tx-data-bits: "1"
58711-58738 uart: tx-data-bits: "1"
58737-58764 uart: tx-data-bits: "0"
58763-58790 uart: tx-data-bits: "0"
58789-58816 uart: tx-data-bits: "1"
58815-58842 uart: tx-data-bits: "1"
58841-58868 uart: tx-data-bits: "1"
58685-58868 uart: tx-data: "s"
58867-58894 uart: tx-parity-ok: "Stop bit" "Stop" "T"
59149-59176 uart: tx-start: "Start bit" "Start" "S"
59175-59202 uart: tx-data-bits: "0"
59201-59228 uart: tx-data-bits: "0"
59227-59254 uart: tx-data-bits: "1"
59253-59280 uart: tx-data-bits: "0"
59279-59306 uart: tx-data-bits: "1"
59305-59332 uart: tx-data-bits: "1"
59331-59358 uart: tx-data-bits: "1"
59175-59358 uart: tx-data: "t"
59357-59384 uart: tx-parity-ok: "Stop bit" "Stop" "T"
59640-59667 uart: tx-start: "Start bit" "Start" "S"
59666-59693 uart: tx-data-bits: "1"
59692-59719 uart: tx-data-bits: "0"
59718-59745 uart: tx-data-bits: "1"
59744-59771 uart: tx-data-bits: "0"
59770-59797 uart: tx-data-bits: "1"
59796-59823 uart: tx-data-bits: "1"
59822-59849 uart: tx-data-bits: "1"
59666-59849 uart: tx-data: "u"
59848-59875 uart: tx-parity-ok: "Stop bit" "Stop" "T"
60132-60159 uart: tx-start: "Start bit" "Start" "S"
60158-60185 uart: tx-data-bits: "0"
60184-60211 uart: tx-data-bits: "1"
60210-60237 uart: tx-data-bits: "1"
60236-60263 uart: tx-data-bits: "0"
60262-60289 uart: tx-data-bits: "1"
60288-60315 uart: tx-data-bits: "1"
60314-60341 uart: tx-data-bits: "1"
60158-60341 uart: tx-data: "v"
60340-60367 uart: tx-parity-ok: "Stop bit" "Stop" "T"
60623-60650 uart: tx-start: "Start bit" "Start" "S"
60649-60676 uart: tx-data-bits: "1"
60675-60702 uart: tx-data-bits: "1"
60701-60728 uart: tx-data-bits: "1"
60727-60754 uart: tx-data-bits: "0"
60753-60780 uart: tx-data-bits: "1"
60779-60806 uart: tx-data-bits: "1"
60805-60832 uart: tx-data-bits: "1"
60649-60832 uart: tx-data: "w"
60831-60858 uart: tx-parity-ok: "Stop bit" "Stop" "T"
61114-61141 uart: tx-start: "Start bit" "Start" "S"
61140-61167 uart: tx-data-bits: "0"
61166-61193 uart: tx-data-bits: "0"
61192-61219 uart: tx-data-bits: "0"
61218-61245 uart: tx-data-bits: "1"
61244-61271 uart: tx-data-bits: "1"
61270-61297 uart: tx-data-bits: "1"
61296-61323 uart: tx-data-bits: "1"
61140-61323 uart: tx-data: "x"
61322-61349 uart: tx-parity-ok: "Stop bit" "Stop" "T"
61602-61629 uart: tx-start: "Start bit" "Start" "S"
61628-61655 uart: tx-data-bits: "1"
61654-61681 uart: tx-data-bits: "0"
61680-61707 uart: tx-data-bits: "0"
61706-61733 uart: tx-data-bits: "1"
61732-61759 uart: tx-data-bits: "1"
61758-61785 uart: tx-data-bits: "1"
61784-61811 uart: tx-data-bits: "1"
61628-61811 uart: tx-data: "y"
61810-61837 uart: tx-parity-ok: "Stop bit" "Stop" "T"
62093-62120 uart: tx-start: "Start bit" "Start" "S"
62119-62146 uart: tx-data-bits: "0"
62145-62172 uart: tx-data-bits: "1"
62171-62198 uart: tx-data-bits: "0"
62197-62224 uart: tx-data-bits: "1"
62223-62250 uart: tx-data-bits: "1"
62249-62276 uart: tx-data-bits: "1"
62275-62302 uart: tx-data-bits: "1"
62119-62302 uart: tx-data: "z"
62301-62328 uart: tx-parity-ok: "Stop bit" "Stop" "T"
62583-62610 uart: tx-start: "Start bit" "Start" "S"
62609-62636 uart: tx-data-bits: "1"
62635-62662 uart: tx-data-bits: "1"
62661-62688 uart: tx-data-bits: "0"
62687-62714 uart: tx-data-bits: "1"
62713-62740 uart: tx-data-bits: "1"
62739-62766 uart: tx-data-bits: "1"
62765-62792 uart: tx-data-bits: "1"
62609-62792 uart: tx-data: "{"
62791-62818 uart: tx-parity-ok: "Stop bit" "Stop" "T"
63074-63101 uart: tx-start: "Start bit" "Start" "S"
63100-63127 uart: tx-data-bits: "0"
63126-63153 uart: tx-data-bits: "0"
63152-63179 uart: tx-data-bits: "1"
63178-63205 uart: tx-data-bits: "1"
63204-63231 uart: tx-data-bits: "1"
63230-63257 uart: tx-data-bits: "1"
63256-63283 uart: tx-data-bits: "1"
63100-63283 uart: tx-data: "|"
63282-63309 uart: tx-parity-ok: "Stop bit" "Stop" "T"
63563-63590 uart: tx-start: "Start bit" "Start" "S"
63589-63616 uart: tx-data-bits: "1"
63615-63642 uart: tx-data-bits: "0"
63641-63668 uart: tx-data-bits: "1"
63667-63694 uart: tx-data-bits: "1"
63693-63720 uart: tx-data-bits: "1"
63719-63746 uart: tx-data-bits: "1"
63745-63772 uart: tx-data-bits: "1"
63589-63772 uart: tx-data: "}"
63771-63798 uart: tx-parity-ok: "Stop bit" "Stop" "T"
64053-64080 uart: tx-start: "Start bit" "Start" "S"
64079-64106 uart: tx-data-bits: "0"
64105-64132 uart: tx-data-bits: "1"
64131-64158 uart: tx-data-bits: "1"
64157-64184 uart: tx-data-bits: "1"
64183-64210 uart: tx-data-bits: "1"
64209-64236 uart: tx-data-bits: "1"
64235-64262 uart: tx-data-bits: "1"
64079-64262 uart: tx-data: "~"
64261-64288 uart: tx-parity-ok: "Stop bit" "Stop" "T"
64542-64569 uart: tx-start: "Start bit" "Start" "S"
64568-64595 uart: tx-data-bits: "1"
64594-64621 uart: tx-data-bits: "1"
64620-64647 uart: tx-data-bits: "1"
64646-64673 uart: tx-data-bits: "1"
64672-64699 uart: tx-data-bits: "1"
64698-64725 uart: tx-data-bits: "1"
64724-64751 uart: tx-data-bits: "1"
64568-64751 uart: tx-data: "[7F]"
64750-64777 uart: tx-parity-ok: "Stop bit" "Stop" "T"
65030-65057 uart: tx-start: "Start bit" "Start" "S"
65056-65083 uart: tx-data-bits: "0"
65082-65109 uart: tx-data-bits: "0"
65108-65135 uart: tx-data-bits: "0"
65134-65161 uart: tx-data-bits: "0"
65160-65187 uart: tx-data-bits: "0"
65186-65213 uart: tx-data-bits: "0"
65212-65239 uart: tx-data-bits: "0"
65056-65239 uart: tx-data: "[00]"
65238-65265 uart: tx-parity-ok: "Stop bit" "Stop" "T"
65519-65546 uart: tx-start: "Start bit" "Start" "S"
65545-65572 uart: tx-data-bits: "1"
65571-65598 uart: tx-data-bits: "0"
65597-65624 uart: tx-data-bits: "0"
65623-65650 uart: tx-data-bits: "0"
65649-65676 uart: tx-data-bits: "0"
65675-65702 uart: tx-data-bits: "0"
65701-65728 uart: tx-data-bits: "0"
65545-65728 uart: tx-data: "[01]"
65727-65754 uart: tx-parity-ok: "Stop bit" "Stop" "T"
66010-66037 uart: tx-start: "Start bit" "Start" "S"
66036-66063 uart: tx-data-bits: "0"
66062-66089 uart: tx-data-bits: "1"
66088-66115 uart: tx-data-bits: "0"
66114-66141 uart: tx-data-bits: "0"
66140-66167 uart: tx-data-bits: "0"
66166-66193 uart: tx-data-bits: "0"
66192-66219 uart: tx-data-bits: "0"
66036-66219 uart: tx-data: "[02]"
66218-66245 uart: tx-parity-ok: "Stop bit" "Stop" "T"
66500-66527 uart: tx-start: "Start bit" "Start" "S"
66526-66553 uart: tx-data-bits: "1"
66552-66579 uart: tx-data-bits: "1"
66578-66605 uart: tx-data-bits: "0"
66604-66631 uart: tx-data-bits: "0"
66630-66657 uart: tx-data-bits: "0"
66656-66683 uart: tx-data-bits: "0"
66682-66709 uart: tx-data-bits: "0"
66526-66709 uart: tx-data: "[03]"
66708-66735 uart: tx-parity-ok: "Stop bit" "Stop" "T"
66991-67018 uart: tx-start: "Start bit" "Start" "S"
67017-67044 uart: tx-data-bits: "0"
67043-67070 uart: tx-data-bits: "0"
67069-67096 uart: tx-data-bits: "1"
67095-67122 uart: tx-data-bits: "0"
67121-67148 uart: tx-data-bits: "0"
67147-67174 uart: tx-data-bits: "0"
67173-67200 uart: tx-data-bits: "0"
67017-67200 uart: tx-data: "[04]"
67199-67226 uart: tx-parity-ok: "Stop bit" "Stop" "T"
67481-67508 uart: tx-start: "Start bit" "Start" "S"
67507-67534 uart: tx-data-bits: "1"
67533-67560 uart: tx-data-bits: "0"
67559-67586 uart: tx-data-bits: "1"
67585-67612 uart: tx-data-bits: "0"
67611-67638 uart: tx-data-bits: "0"
67637-67664 uart: tx-data-bits: "0"
67663-67690 uart: tx-data-bits: "0"
67507-67690 uart: tx-data: "[05]"
67689-67716 uart: tx-parity-ok: "Stop bit" "Stop" "T"
67974-68001 uart: tx-start: "Start bit" "Start" "S"
68000-68027 uart: tx-data-bits: "0"
68026-68053 uart: tx-data-bits: "1"
68052-68079 uart: tx-data-bits: "1"
68078-68105 uart: tx-data-bits: "0"
68104-68131 uart: tx-data-bits: "0"
68130-68157 uart: tx-data-bits: "0"
68156-68183 uart: tx-data-bits: "0"
68000-68183 uart: tx-data: "[06]"
68182-68209 uart: tx-parity-ok: "Stop bit" "Stop" "T"
68465-68492 uart: tx-start: "Start bit" "Start" "S"
68491-68518 uart: tx-data-bits: "1"
68517-68544 uart: tx-data-bits: "1"
68543-68570 uart: tx-data-bits: "1"
68569-68596 uart: tx-data-bits: "0"
68595-68622 uart: tx-data-bits: "0"
68621-68648 uart: tx-data-bits: "0"
68647-68674 uart: tx-data-bits: "0"
68491-68674 uart: tx-data: "[07]"
68673-68700 uart: tx-parity-ok: "Stop bit" "Stop" "T"
68955-68982 uart: tx-start: "Start bit" "Start" "S"
68981-69008 uart: tx-data-bits: "0"
69007-69034 uart: tx-data-bits: "0"
69033-69060 uart: tx-data-bits: "0"
69059-69086 uart: tx-data-bits: "1"
69085-69112 uart: tx-data-bits: "0"
69111-69138 uart: tx-data-bits: "0"
69137-69164 uart: tx-data-bits: "0"
68981-69164 uart: tx-data: "[08]"
69163-69190 uart: tx-parity-ok: "Stop bit" "Stop" "T"
