144-170 uart: tx-start: "Start bit" "Start" "S"
170-196 uart: tx-data-bit: "0"
196-222 uart: tx-data-bit: "0"
222-248 uart: tx-data-bit: "1"
248-274 uart: tx-data-bit: "1"
274-300 uart: tx-data-bit: "1"
300-326 uart: tx-data-bit: "1"
170-326 uart: tx-data: "3C"
326-352 uart: tx-stop: "Stop bit" "Stop" "T"
607-633 uart: tx-start: "Start bit" "Start" "S"
633-659 uart: tx-data-bit: "1"
659-685 uart: tx-data-bit: "0"
685-711 uart: tx-data-bit: "1"
711-737 uart: tx-data-bit: "1"
737-763 uart: tx-data-bit: "1"
763-789 uart: tx-data-bit: "1"
633-789 uart: tx-data: "3D"
789-815 uart: tx-stop: "Stop bit" "Stop" "T"
1071-1097 uart: tx-start: "Start bit" "Start" "S"
1097-1123 uart: tx-data-bit: "0"
1123-1149 uart: tx-data-bit: "1"
1149-1175 uart: tx-data-bit: "1"
1175-1201 uart: tx-data-bit: "1"
1201-1227 uart: tx-data-bit: "1"
1227-1253 uart: tx-data-bit: "1"
1097-1253 uart: tx-data: "3E"
1253-1279 uart: tx-stop: "Stop bit" "Stop" "T"
1534-1560 uart: tx-start: "Start bit" "Start" "S"
1560-1586 uart: tx-data-bit: "1"
1586-1612 uart: tx-data-bit: "1"
1612-1638 uart: tx-data-bit: "1"
1638-1664 uart: tx-data-bit: "1"
1664-1690 uart: tx-data-bit: "1"
1690-1716 uart: tx-data-bit: "1"
1560-1716 uart: tx-data: "3F"
1716-1742 uart: tx-stop: "Stop bit" "Stop" "T"
1997-2023 uart: tx-start: "Start bit" "Start" "S"
2023-2049 uart: tx-data-bit: "0"
2049-2075 uart: tx-data-bit: "0"
2075-2101 uart: tx-data-bit: "0"
2101-2127 uart: tx-data-bit: "0"
2127-2153 uart: tx-data-bit: "0"
2153-2179 uart: tx-data-bit: "0"
2023-2179 uart: tx-data: "00"
2179-2205 uart: tx-stop: "Stop bit" "Stop" "T"
2459-2485 uart: tx-start: "Start bit" "Start" "S"
2485-2511 uart: tx-data-bit: "1"
2511-2537 uart: tx-data-bit: "0"
2537-2563 uart: tx-data-bit: "0"
2563-2589 uart: tx-data-bit: "0"
2589-2615 uart: tx-data-bit: "0"
2615-2641 uart: tx-data-bit: "0"
2485-2641 uart: tx-data: "01"
2641-2667 uart: tx-stop: "Stop bit" "Stop" "T"
2924-2950 uart: tx-start: "Start bit" "Start" "S"
2950-2976 uart: tx-data-bit: "0"
2976-3002 uart: tx-data-bit: "1"
3002-3028 uart: tx-data-bit: "0"
3028-3054 uart: tx-data-bit: "0"
3054-3080 uart: tx-data-bit: "0"
3080-3106 uart: tx-data-bit: "0"
2950-3106 uart: tx-data: "02"
3106-3132 uart: tx-stop: "Stop bit" "Stop" "T"
3388-3414 uart: tx-start: "Start bit" "Start" "S"
3414-3440 uart: tx-data-bit: "1"
3440-3466 uart: tx-data-bit: "1"
3466-3492 uart: tx-data-bit: "0"
3492-3518 uart: tx-data-bit: "0"
3518-3544 uart: tx-data-bit: "0"
3544-3570 uart: tx-data-bit: "0"
3414-3570 uart: tx-data: "03"
3570-3596 uart: tx-stop: "Stop bit" "Stop" "T"
3853-3879 uart: tx-start: "Start bit" "Start" "S"
3879-3905 uart: tx-data-bit: "0"
3905-3931 uart: tx-data-bit: "0"
3931-3957 uart: tx-data-bit: "1"
3957-3983 uart: tx-data-bit: "0"
3983-4009 uart: tx-data-bit: "0"
4009-4035 uart: tx-data-bit: "0"
3879-4035 uart: tx-data: "04"
4035-4061 uart: tx-stop: "Stop bit" "Stop" "T"
4318-4344 uart: tx-start: "Start bit" "Start" "S"
4344-4370 uart: tx-data-bit: "1"
4370-4396 uart: tx-data-bit: "0"
4396-4422 uart: tx-data-bit: "1"
4422-4448 uart: tx-data-bit: "0"
4448-4474 uart: tx-data-bit: "0"
4474-4500 uart: tx-data-bit: "0"
4344-4500 uart: tx-data: "05"
4500-4526 uart: tx-stop: "Stop bit" "Stop" "T"
4784-4810 uart: tx-start: "Start bit" "Start" "S"
4810-4836 uart: tx-data-bit: "0"
4836-4862 uart: tx-data-bit: "1"
4862-4888 uart: tx-data-bit: "1"
4888-4914 uart: tx-data-bit: "0"
4914-4940 uart: tx-data-bit: "0"
4940-4966 uart: tx-data-bit: "0"
4810-4966 uart: tx-data: "06"
4966-4992 uart: tx-stop: "Stop bit" "Stop" "T"
5249-5275 uart: tx-start: "Start bit" "Start" "S"
5275-5301 uart: tx-data-bit: "1"
5301-5327 uart: tx-data-bit: "1"
5327-5353 uart: tx-data-bit: "1"
5353-5379 uart: tx-data-bit: "0"
5379-5405 uart: tx-data-bit: "0"
5405-5431 uart: tx-data-bit: "0"
5275-5431 uart: tx-data: "07"
5431-5457 uart: tx-stop: "Stop bit" "Stop" "T"
5713-5739 uart: tx-start: "Start bit" "Start" "S"
5739-5765 uart: tx-data-bit: "0"
5765-5791 uart: tx-data-bit: "0"
5791-5817 uart: tx-data-bit: "0"
5817-5843 uart: tx-data-bit: "1"
5843-5869 uart: tx-data-bit: "0"
5869-5895 uart: tx-data-bit: "0"
5739-5895 uart: tx-data: "08"
5895-5921 uart: tx-stop: "Stop bit" "Stop" "T"
6178-6204 uart: tx-start: "Start bit" "Start" "S"
6204-6230 uart: tx-data-bit: "1"
6230-6256 uart: tx-data-bit: "0"
6256-6282 uart: tx-data-bit: "0"
6282-6308 uart: tx-data-bit: "1"
6308-6334 uart: tx-data-bit: "0"
6334-6360 uart: tx-data-bit: "0"
6204-6360 uart: tx-data: "09"
6360-6386 uart: tx-stop: "Stop bit" "Stop" "T"
6645-6671 uart: tx-start: "Start bit" "Start" "S"
6671-6697 uart: tx-data-bit: "0"
6697-6723 uart: tx-data-bit: "1"
6723-6749 uart: tx-data-bit: "0"
6749-6775 uart: tx-data-bit: "1"
6775-6801 uart: tx-data-bit: "0"
6801-6827 uart: tx-data-bit: "0"
6671-6827 uart: tx-data: "0A"
6827-6853 uart: tx-stop: "Stop bit" "Stop" "T"
7111-7137 uart: tx-start: "Start bit" "Start" "S"
7137-7163 uart: tx-data-bit: "1"
7163-7189 uart: tx-data-bit: "1"
7189-7215 uart: tx-data-bit: "0"
7215-7241 uart: tx-data-bit: "1"
7241-7267 uart: tx-data-bit: "0"
7267-7293 uart: tx-data-bit: "0"
7137-7293 uart: tx-data: "0B"
7293-7319 uart: tx-stop: "Stop bit" "Stop" "T"
144-7319 uart: tx-packet: "3C 3D 3E 3F 00 01 02 03 04 05 06 07 08 09 0A 0B"
7578-7604 uart: tx-start: "Start bit" "Start" "S"
7604-7630 uart: tx-data-bit: "0"
7630-7656 uart: tx-data-bit: "0"
7656-7682 uart: tx-data-bit: "1"
7682-7708 uart: tx-data-bit: "1"
7708-7734 uart: tx-data-bit: "0"
7734-7760 uart: tx-data-bit: "0"
7604-7760 uart: tx-data: "0C"
7760-7786 uart: tx-stop: "Stop bit" "Stop" "T"
8042-8068 uart: tx-start: "Start bit" "Start" "S"
8068-8094 uart: tx-data-bit: "1"
8094-8120 uart: tx-data-bit: "0"
8120-8146 uart: tx-data-bit: "1"
8146-8172 uart: tx-data-bit: "1"
8172-8198 uart: tx-data-bit: "0"
8198-8224 uart: tx-data-bit: "0"
8068-8224 uart: tx-data: "0D"
8224-8250 uart: tx-stop: "Stop bit" "Stop" "T"
8509-8535 uart: tx-start: "Start bit" "Start" "S"
8535-8561 uart: tx-data-bit: "0"
8561-8587 uart: tx-data-bit: "1"
8587-8613 uart: tx-data-bit: "1"
8613-8639 uart: tx-data-bit: "1"
8639-8665 uart: tx-data-bit: "0"
8665-8691 uart: tx-data-bit: "0"
8535-8691 uart: tx-data: "0E"
8691-8717 uart: tx-stop: "Stop bit" "Stop" "T"
8974-9000 uart: tx-start: "Start bit" "Start" "S"
9000-9026 uart: tx-data-bit: "1"
9026-9052 uart: tx-data-bit: "1"
9052-9078 uart: tx-data-bit: "1"
9078-9104 uart: tx-data-bit: "1"
9104-9130 uart: tx-data-bit: "0"
9130-9156 uart: tx-data-bit: "0"
9000-9156 uart: tx-data: "0F"
9156-9182 uart: tx-stop: "Stop bit" "Stop" "T"
9438-9464 uart: tx-start: "Start bit" "Start" "S"
9464-9490 uart: tx-data-bit: "0"
9490-9516 uart: tx-data-bit: "0"
9516-9542 uart: tx-data-bit: "0"
9542-9568 uart: tx-data-bit: "0"
9568-9594 uart: tx-data-bit: "1"
9594-9620 uart: tx-data-bit: "0"
9464-9620 uart: tx-data: "10"
9620-9646 uart: tx-stop: "Stop bit" "Stop" "T"
9903-9929 uart: tx-start: "Start bit" "Start" "S"
9929-9955 uart: tx-data-bit: "1"
9955-9981 uart: tx-data-bit: "0"
9981-10007 uart: tx-data-bit: "0"
10007-10033 uart: tx-data-bit: "0"
10033-10059 uart: tx-data-bit: "1"
10059-10085 uart: tx-data-bit: "0"
9929-10085 uart: tx-data: "11"
10085-10111 uart: tx-stop: "Stop bit" "Stop" "T"
10370-10396 uart: tx-start: "Start bit" "Start" "S"
10396-10422 uart: tx-data-bit: "0"
10422-10448 uart: tx-data-bit: "1"
10448-10474 uart: tx-data-bit: "0"
10474-10500 uart: tx-data-bit: "0"
10500-10526 uart: tx-data-bit: "1"
10526-10552 uart: tx-data-bit: "0"
10396-10552 uart: tx-data: "12"
10552-10578 uart: tx-stop: "Stop bit" "Stop" "T"
10836-10862 uart: tx-start: "Start bit" "Start" "S"
10862-10888 uart: tx-data-bit: "1"
10888-10914 uart: tx-data-bit: "1"
10914-10940 uart: tx-data-bit: "0"
10940-10966 uart: tx-data-bit: "0"
10966-10992 uart: tx-data-bit: "1"
10992-11018 uart: tx-data-bit: "0"
10862-11018 uart: tx-data: "13"
11018-11044 uart: tx-stop: "Stop bit" "Stop" "T"
11303-11329 uart: tx-start: "Start bit" "Start" "S"
11329-11355 uart: tx-data-bit: "0"
11355-11381 uart: tx-data-bit: "0"
11381-11407 uart: tx-data-bit: "1"
11407-11433 uart: tx-data-bit: "0"
11433-11459 uart: tx-data-bit: "1"
11459-11485 uart: tx-data-bit: "0"
11329-11485 uart: tx-data: "14"
11485-11511 uart: tx-stop: "Stop bit" "Stop" "T"
11769-11795 uart: tx-start: "Start bit" "Start" "S"
11795-11821 uart: tx-data-bit: "1"
11821-11847 uart: tx-data-bit: "0"
11847-11873 uart: tx-data-bit: "1"
11873-11899 uart: tx-data-bit: "0"
11899-11925 uart: tx-data-bit: "1"
11925-11951 uart: tx-data-bit: "0"
11795-11951 uart: tx-data: "15"
11951-11977 uart: tx-stop: "Stop bit" "Stop" "T"
12238-12264 uart: tx-start: "Start bit" "Start" "S"
12264-12290 uart: tx-data-bit: "0"
12290-12316 uart: tx-data-bit: "1"
12316-12342 uart: tx-data-bit: "1"
12342-12368 uart: tx-data-bit: "0"
12368-12394 uart: tx-data-bit: "1"
12394-12420 uart: tx-data-bit: "0"
12264-12420 uart: tx-data: "16"
12420-12446 uart: tx-stop: "Stop bit" "Stop" "T"
12705-12731 uart: tx-start: "Start bit" "Start" "S"
12731-12757 uart: tx-data-bit: "1"
12757-12783 uart: tx-data-bit: "1"
12783-12809 uart: tx-data-bit: "1"
12809-12835 uart: tx-data-bit: "0"
12835-12861 uart: tx-data-bit: "1"
12861-12887 uart: tx-data-bit: "0"
12731-12887 uart: tx-data: "17"
12887-12913 uart: tx-stop: "Stop bit" "Stop" "T"
13171-13197 uart: tx-start: "Start bit" "Start" "S"
13197-13223 uart: tx-data-bit: "0"
13223-13249 uart: tx-data-bit: "0"
13249-13275 uart: tx-data-bit: "0"
13275-13301 uart: tx-data-bit: "1"
13301-13327 uart: tx-data-bit: "1"
13327-13353 uart: tx-data-bit: "0"
13197-13353 uart: tx-data: "18"
13353-13379 uart: tx-stop: "Stop bit" "Stop" "T"
13636-13662 uart: tx-start: "Start bit" "Start" "S"
13662-13688 uart: tx-data-bit: "1"
13688-13714 uart: tx-data-bit: "0"
13714-13740 uart: tx-data-bit: "0"
13740-13766 uart: tx-data-bit: "1"
13766-13792 uart: tx-data-bit: "1"
13792-13818 uart: tx-data-bit: "0"
13662-13818 uart: tx-data: "19"
13818-13844 uart: tx-stop: "Stop bit" "Stop" "T"
14102-14128 uart: tx-start: "Start bit" "Start" "S"
14128-14154 uart: tx-data-bit: "0"
14154-14180 uart: tx-data-bit: "1"
14180-14206 uart: tx-data-bit: "0"
14206-14232 uart: tx-data-bit: "1"
14232-14258 uart: tx-data-bit: "1"
14258-14284 uart: tx-data-bit: "0"
14128-14284 uart: tx-data: "1A"
14284-14310 uart: tx-stop: "Stop bit" "Stop" "T"
14569-14595 uart: tx-start: "Start bit" "Start" "S"
14595-14621 uart: tx-data-bit: "1"
14621-14647 uart: tx-data-bit: "1"
14647-14673 uart: tx-data-bit: "0"
14673-14699 uart: tx-data-bit: "1"
14699-14725 uart: tx-data-bit: "1"
14725-14751 uart: tx-data-bit: "0"
14595-14751 uart: tx-data: "1B"
14751-14777 uart: tx-stop: "Stop bit" "Stop" "T"
7578-14777 uart: tx-packet: "0C 0D 0E 0F 10 11 12 13 14 15 16 17 18 19 1A 1B"
15036-15062 uart: tx-start: "Start bit" "Start" "S"
15062-15088 uart: tx-data-bit: "0"
15088-15114 uart: tx-data-bit: "0"
15114-15140 uart: tx-data-bit: "1"
15140-15166 uart: tx-data-bit: "1"
15166-15192 uart: tx-data-bit: "1"
15192-15218 uart: tx-data-bit: "0"
15062-15218 uart: tx-data: "1C"
15218-15244 uart: tx-stop: "Stop bit" "Stop" "T"
15500-15526 uart: tx-start: "Start bit" "Start" "S"
15526-15552 uart: tx-data-bit: "1"
15552-15578 uart: tx-data-bit: "0"
15578-15604 uart: tx-data-bit: "1"
15604-15630 uart: tx-data-bit: "1"
15630-15656 uart: tx-data-bit: "1"
15656-15682 uart: tx-data-bit: "0"
15526-15682 uart: tx-data: "1D"
15682-15708 uart: tx-stop: "Stop bit" "Stop" "T"
15967-15993 uart: tx-start: "Start bit" "Start" "S"
15993-16019 uart: tx-data-bit: "0"
16019-16045 uart: tx-data-bit: "1"
16045-16071 uart: tx-data-bit: "1"
16071-16097 uart: tx-data-bit: "1"
16097-16123 uart: tx-data-bit: "1"
16123-16149 uart: tx-data-bit: "0"
15993-16149 uart: tx-data: "1E"
16149-16175 uart: tx-stop: "Stop bit" "Stop" "T"
16432-16458 uart: tx-start: "Start bit" "Start" "S"
16458-16484 uart: tx-data-bit: "1"
16484-16510 uart: tx-data-bit: "1"
16510-16536 uart: tx-data-bit: "1"
16536-16562 uart: tx-data-bit: "1"
16562-16588 uart: tx-data-bit: "1"
16588-16614 uart: tx-data-bit: "0"
16458-16614 uart: tx-data: "1F"
16614-16640 uart: tx-stop: "Stop bit" "Stop" "T"
16896-16922 uart: tx-start: "Start bit" "Start" "S"
16922-16948 uart: tx-data-bit: "0"
16948-16974 uart: tx-data-bit: "0"
16974-17000 uart: tx-data-bit: "0"
17000-17026 uart: tx-data-bit: "0"
17026-17052 uart: tx-data-bit: "0"
17052-17078 uart: tx-data-bit: "1"
16922-17078 uart: tx-data: "20"
17078-17104 uart: tx-stop: "Stop bit" "Stop" "T"
17359-17385 uart: tx-start: "Start bit" "Start" "S"
17385-17411 uart: tx-data-bit: "1"
17411-17437 uart: tx-data-bit: "0"
17437-17463 uart: tx-data-bit: "0"
17463-17489 uart: tx-data-bit: "0"
17489-17515 uart: tx-data-bit: "0"
17515-17541 uart: tx-data-bit: "1"
17385-17541 uart: tx-data: "21"
17541-17567 uart: tx-stop: "Stop bit" "Stop" "T"
17823-17849 uart: tx-start: "Start bit" "Start" "S"
17849-17875 uart: tx-data-bit: "0"
17875-17901 uart: tx-data-bit: "1"
17901-17927 uart: tx-data-bit: "0"
17927-17953 uart: tx-data-bit: "0"
17953-17979 uart: tx-data-bit: "0"
17979-18005 uart: tx-data-bit: "1"
17849-18005 uart: tx-data: "22"
18005-18031 uart: tx-stop: "Stop bit" "Stop" "T"
18288-18314 uart: tx-start: "Start bit" "Start" "S"
18314-18340 uart: tx-data-bit: "1"
18340-18366 uart: tx-data-bit: "1"
18366-18392 uart: tx-data-bit: "0"
18392-18418 uart: tx-data-bit: "0"
18418-18444 uart: tx-data-bit: "0"
18444-18470 uart: tx-data-bit: "1"
18314-18470 uart: tx-data: "23"
18470-18496 uart: tx-stop: "Stop bit" "Stop" "T"
18753-18779 uart: tx-start: "Start bit" "Start" "S"
18779-18805 uart: tx-data-bit: "0"
18805-18831 uart: tx-data-bit: "0"
18831-18857 uart: tx-data-bit: "1"
18857-18883 uart: tx-data-bit: "0"
18883-18909 uart: tx-data-bit: "0"
18909-18935 uart: tx-data-bit: "1"
18779-18935 uart: tx-data: "24"
18935-18961 uart: tx-stop: "Stop bit" "Stop" "T"
19217-19243 uart: tx-start: "Start bit" "Start" "S"
19243-19269 uart: tx-data-bit: "1"
19269-19295 uart: tx-data-bit: "0"
19295-19321 uart: tx-data-bit: "1"
19321-19347 uart: tx-data-bit: "0"
19347-19373 uart: tx-data-bit: "0"
19373-19399 uart: tx-data-bit: "1"
19243-19399 uart: tx-data: "25"
19399-19425 uart: tx-stop: "Stop bit" "Stop" "T"
19684-19710 uart: tx-start: "Start bit" "Start" "S"
19710-19736 uart: tx-data-bit: "0"
19736-19762 uart: tx-data-bit: "1"
19762-19788 uart: tx-data-bit: "1"
19788-19814 uart: tx-data-bit: "0"
19814-19840 uart: tx-data-bit: "0"
19840-19866 uart: tx-data-bit: "1"
19710-19866 uart: tx-data: "26"
19866-19892 uart: tx-stop: "Stop bit" "Stop" "T"
20148-20174 uart: tx-start: "Start bit" "Start" "S"
20174-20200 uart: tx-data-bit: "1"
20200-20226 uart: tx-data-bit: "1"
20226-20252 uart: tx-data-bit: "1"
20252-20278 uart: tx-data-bit: "0"
20278-20304 uart: tx-data-bit: "0"
20304-20330 uart: tx-data-bit: "1"
20174-20330 uart: tx-data: "27"
20330-20356 uart: tx-stop: "Stop bit" "Stop" "T"
20613-20639 uart: tx-start: "Start bit" "Start" "S"
20639-20665 uart: tx-data-bit: "0"
20665-20691 uart: tx-data-bit: "0"
20691-20717 uart: tx-data-bit: "0"
20717-20743 uart: tx-data-bit: "1"
20743-20769 uart: tx-data-bit: "0"
20769-20795 uart: tx-data-bit: "1"
20639-20795 uart: tx-data: "28"
20795-20821 uart: tx-stop: "Stop bit" "Stop" "T"
21078-21104 uart: tx-start: "Start bit" "Start" "S"
21104-21130 uart: tx-data-bit: "1"
21130-21156 uart: tx-data-bit: "0"
21156-21182 uart: tx-data-bit: "0"
21182-21208 uart: tx-data-bit: "1"
21208-21234 uart: tx-data-bit: "0"
21234-21260 uart: tx-data-bit: "1"
21104-21260 uart: tx-data: "29"
21260-21286 uart: tx-stop: "Stop bit" "Stop" "T"
21544-21570 uart: tx-start: "Start bit" "Start" "S"
21570-21596 uart: tx-data-bit: "0"
21596-21622 uart: tx-data-bit: "1"
21622-21648 uart: tx-data-bit: "0"
21648-21674 uart: tx-data-bit: "1"
21674-21700 uart: tx-data-bit: "0"
21700-21726 uart: tx-data-bit: "1"
21570-21726 uart: tx-data: "2A"
21726-21752 uart: tx-stop: "Stop bit" "Stop" "T"
22011-22037 uart: tx-start: "Start bit" "Start" "S"
22037-22063 uart: tx-data-bit: "1"
22063-22089 uart: tx-data-bit: "1"
22089-22115 uart: tx-data-bit: "0"
22115-22141 uart: tx-data-bit: "1"
22141-22167 uart: tx-data-bit: "0"
22167-22193 uart: tx-data-bit: "1"
22037-22193 uart: tx-data: "2B"
22193-22219 uart: tx-stop: "Stop bit" "Stop" "T"
15036-22219 uart: tx-packet: "1C 1D 1E 1F 20 21 22 23 24 25 26 27 28 29 2A 2B"
22478-22504 uart: tx-start: "Start bit" "Start" "S"
22504-22530 uart: tx-data-bit: "0"
22530-22556 uart: tx-data-bit: "0"
22556-22582 uart: tx-data-bit: "1"
22582-22608 uart: tx-data-bit: "1"
22608-22634 uart: tx-data-bit: "0"
22634-22660 uart: tx-data-bit: "1"
22504-22660 uart: tx-data: "2C"
22660-22686 uart: tx-stop: "Stop bit" "Stop" "T"
22942-22968 uart: tx-start: "Start bit" "Start" "S"
22968-22994 uart: tx-data-bit: "1"
22994-23020 uart: tx-data-bit: "0"
23020-23046 uart: tx-data-bit: "1"
23046-23072 uart: tx-data-bit: "1"
23072-23098 uart: tx-data-bit: "0"
23098-23124 uart: tx-data-bit: "1"
22968-23124 uart: tx-data: "2D"
23124-23150 uart: tx-stop: "Stop bit" "Stop" "T"
23409-23435 uart: tx-start: "Start bit" "Start" "S"
23435-23461 uart: tx-data-bit: "0"
23461-23487 uart: tx-data-bit: "1"
23487-23513 uart: tx-data-bit: "1"
23513-23539 uart: tx-data-bit: "1"
23539-23565 uart: tx-data-bit: "0"
23565-23591 uart: tx-data-bit: "1"
23435-23591 uart: tx-data: "2E"
23591-23617 uart: tx-stop: "Stop bit" "Stop" "T"
23873-23899 uart: tx-start: "Start bit" "Start" "S"
23899-23925 uart: tx-data-bit: "1"
23925-23951 uart: tx-data-bit: "1"
23951-23977 uart: tx-data-bit: "1"
23977-24003 uart: tx-data-bit: "1"
24003-24029 uart: tx-data-bit: "0"
24029-24055 uart: tx-data-bit: "1"
23899-24055 uart: tx-data: "2F"
24055-24081 uart: tx-stop: "Stop bit" "Stop" "T"
24338-24364 uart: tx-start: "Start bit" "Start" "S"
24364-24390 uart: tx-data-bit: "0"
24390-24416 uart: tx-data-bit: "0"
24416-24442 uart: tx-data-bit: "0"
24442-24468 uart: tx-data-bit: "0"
24468-24494 uart: tx-data-bit: "1"
24494-24520 uart: tx-data-bit: "1"
24364-24520 uart: tx-data: "30"
24520-24546 uart: tx-stop: "Stop bit" "Stop" "T"
24801-24827 uart: tx-start: "Start bit" "Start" "S"
24827-24853 uart: tx-data-bit: "1"
24853-24879 uart: tx-data-bit: "0"
24879-24905 uart: tx-data-bit: "0"
24905-24931 uart: tx-data-bit: "0"
24931-24957 uart: tx-data-bit: "1"
24957-24983 uart: tx-data-bit: "1"
24827-24983 uart: tx-data: "31"
24983-25009 uart: tx-stop: "Stop bit" "Stop" "T"
25265-25291 uart: tx-start: "Start bit" "Start" "S"
25291-25317 uart: tx-data-bit: "0"
25317-25343 uart: tx-data-bit: "1"
25343-25369 uart: tx-data-bit: "0"
25369-25395 uart: tx-data-bit: "0"
25395-25421 uart: tx-data-bit: "1"
25421-25447 uart: tx-data-bit: "1"
25291-25447 uart: tx-data: "32"
25447-25473 uart: tx-stop: "Stop bit" "Stop" "T"
25730-25756 uart: tx-start: "Start bit" "Start" "S"
25756-25782 uart: tx-data-bit: "1"
25782-25808 uart: tx-data-bit: "1"
25808-25834 uart: tx-data-bit: "0"
25834-25860 uart: tx-data-bit: "0"
25860-25886 uart: tx-data-bit: "1"
25886-25912 uart: tx-data-bit: "1"
25756-25912 uart: tx-data: "33"
25912-25938 uart: tx-stop: "Stop bit" "Stop" "T"
26194-26220 uart: tx-start: "Start bit" "Start" "S"
26220-26246 uart: tx-data-bit: "0"
26246-26272 uart: tx-data-bit: "0"
26272-26298 uart: tx-data-bit: "1"
26298-26324 uart: tx-data-bit: "0"
26324-26350 uart: tx-data-bit: "1"
26350-26376 uart: tx-data-bit: "1"
26220-26376 uart: tx-data: "34"
26376-26402 uart: tx-stop: "Stop bit" "Stop" "T"
26659-26685 uart: tx-start: "Start bit" "Start" "S"
26685-26711 uart: tx-data-bit: "1"
26711-26737 uart: tx-data-bit: "0"
26737-26763 uart: tx-data-bit: "1"
26763-26789 uart: tx-data-bit: "0"
26789-26815 uart: tx-data-bit: "1"
26815-26841 uart: tx-data-bit: "1"
26685-26841 uart: tx-data: "35"
26841-26867 uart: tx-stop: "Stop bit" "Stop" "T"
27126-27152 uart: tx-start: "Start bit" "Start" "S"
27152-27178 uart: tx-data-bit: "0"
27178-27204 uart: tx-data-bit: "1"
27204-27230 uart: tx-data-bit: "1"
27230-27256 uart: tx-data-bit: "0"
27256-27282 uart: tx-data-bit: "1"
27282-27308 uart: tx-data-bit: "1"
27152-27308 uart: tx-data: "36"
27308-27334 uart: tx-stop: "Stop bit" "Stop" "T"
27590-27616 uart: tx-start: "Start bit" "Start" "S"
27616-27642 uart: tx-data-bit: "1"
27642-27668 uart: tx-data-bit: "1"
27668-27694 uart: tx-data-bit: "1"
27694-27720 uart: tx-data-bit: "0"
27720-27746 uart: tx-data-bit: "1"
27746-27772 uart: tx-data-bit: "1"
27616-27772 uart: tx-data: "37"
27772-27798 uart: tx-stop: "Stop bit" "Stop" "T"
28055-28081 uart: tx-start: "Start bit" "Start" "S"
28081-28107 uart: tx-data-bit: "0"
28107-28133 uart: tx-data-bit: "0"
28133-28159 uart: tx-data-bit: "0"
28159-28185 uart: tx-data-bit: "1"
28185-28211 uart: tx-data-bit: "1"
28211-28237 uart: tx-data-bit: "1"
28081-28237 uart: tx-data: "38"
28237-28263 uart: tx-stop: "Stop bit" "Stop" "T"
28518-28544 uart: tx-start: "Start bit" "Start" "S"
28544-28570 uart: tx-data-bit: "1"
28570-28596 uart: tx-data-bit: "0"
28596-28622 uart: tx-data-bit: "0"
28622-28648 uart: tx-data-bit: "1"
28648-28674 uart: tx-data-bit: "1"
28674-28700 uart: tx-data-bit: "1"
28544-28700 uart: tx-data: "39"
28700-28726 uart: tx-stop: "Stop bit" "Stop" "T"
28982-29008 uart: tx-start: "Start bit" "Start" "S"
29008-29034 uart: tx-data-bit: "0"
29034-29060 uart: tx-data-bit: "1"
29060-29086 uart: tx-data-bit: "0"
29086-29112 uart: tx-data-bit: "1"
29112-29138 uart: tx-data-bit: "1"
29138-29164 uart: tx-data-bit: "1"
29008-29164 uart: tx-data: "3A"
29164-29190 uart: tx-stop: "Stop bit" "Stop" "T"
29447-29473 uart: tx-start: "Start bit" "Start" "S"
29473-29499 uart: tx-data-bit: "1"
29499-29525 uart: tx-data-bit: "1"
29525-29551 uart: tx-data-bit: "0"
29551-29577 uart: tx-data-bit: "1"
29577-29603 uart: tx-data-bit: "1"
29603-29629 uart: tx-data-bit: "1"
29473-29629 uart: tx-data: "3B"
29629-29655 uart: tx-stop: "Stop bit" "Stop" "T"
22478-29655 uart: tx-packet: "2C 2D 2E 2F 30 31 32 33 34 35 36 37 38 39 3A 3B"
29911-29937 uart: tx-start: "Start bit" "Start" "S"
29937-29963 uart: tx-data-bit: "0"
29963-29989 uart: tx-data-bit: "0"
29989-30015 uart: tx-data-bit: "1"
30015-30041 uart: tx-data-bit: "1"
30041-30067 uart: tx-data-bit: "1"
30067-30093 uart: tx-data-bit: "1"
29937-30093 uart: tx-data: "3C"
30093-30119 uart: tx-stop: "Stop bit" "Stop" "T"
30374-30400 uart: tx-start: "Start bit" "Start" "S"
30400-30426 uart: tx-data-bit: "1"
30426-30452 uart: tx-data-bit: "0"
30452-30478 uart: tx-data-bit: "1"
30478-30504 uart: tx-data-bit: "1"
30504-30530 uart: tx-data-bit: "1"
30530-30556 uart: tx-data-bit: "1"
30400-30556 uart: tx-data: "3D"
30556-30582 uart: tx-stop: "Stop bit" "Stop" "T"
30839-30865 uart: tx-start: "Start bit" "Start" "S"
30865-30891 uart: tx-data-bit: "0"
30891-30917 uart: tx-data-bit: "1"
30917-30943 uart: tx-data-bit: "1"
30943-30969 uart: tx-data-bit: "1"
30969-30995 uart: tx-data-bit: "1"
30995-31021 uart: tx-data-bit: "1"
30865-31021 uart: tx-data: "3E"
31021-31047 uart: tx-stop: "Stop bit" "Stop" "T"
31301-31327 uart: tx-start: "Start bit" "Start" "S"
31327-31353 uart: tx-data-bit: "1"
31353-31379 uart: tx-data-bit: "1"
31379-31405 uart: tx-data-bit: "1"
31405-31431 uart: tx-data-bit: "1"
31431-31457 uart: tx-data-bit: "1"
31457-31483 uart: tx-data-bit: "1"
31327-31483 uart: tx-data: "3F"
31483-31509 uart: tx-stop: "Stop bit" "Stop" "T"
31764-31790 uart: tx-start: "Start bit" "Start" "S"
31790-31816 uart: tx-data-bit: "0"
31816-31842 uart: tx-data-bit: "0"
31842-31868 uart: tx-data-bit: "0"
31868-31894 uart: tx-data-bit: "0"
31894-31920 uart: tx-data-bit: "0"
31920-31946 uart: tx-data-bit: "0"
31790-31946 uart: tx-data: "00"
31946-31972 uart: tx-stop: "Stop bit" "Stop" "T"
32226-32252 uart: tx-start: "Start bit" "Start" "S"
32252-32278 uart: tx-data-bit: "1"
32278-32304 uart: tx-data-bit: "0"
32304-32330 uart: tx-data-bit: "0"
32330-32356 uart: tx-data-bit: "0"
32356-32382 uart: tx-data-bit: "0"
32382-32408 uart: tx-data-bit: "0"
32252-32408 uart: tx-data: "01"
32408-32434 uart: tx-stop: "Stop bit" "Stop" "T"
32691-32717 uart: tx-start: "Start bit" "Start" "S"
32717-32743 uart: tx-data-bit: "0"
32743-32769 uart: tx-data-bit: "1"
32769-32795 uart: tx-data-bit: "0"
32795-32821 uart: tx-data-bit: "0"
32821-32847 uart: tx-data-bit: "0"
32847-32873 uart: tx-data-bit: "0"
32717-32873 uart: tx-data: "02"
32873-32899 uart: tx-stop: "Stop bit" "Stop" "T"
33156-33182 uart: tx-start: "Start bit" "Start" "S"
33182-33208 uart: tx-data-bit: "1"
33208-33234 uart: tx-data-bit: "1"
33234-33260 uart: tx-data-bit: "0"
33260-33286 uart: tx-data-bit: "0"
33286-33312 uart: tx-data-bit: "0"
33312-33338 uart: tx-data-bit: "0"
33182-33338 uart: tx-data: "03"
33338-33364 uart: tx-stop: "Stop bit" "Stop" "T"
33620-33646 uart: tx-start: "Start bit" "Start" "S"
33646-33672 uart: tx-data-bit: "0"
33672-33698 uart: tx-data-bit: "0"
33698-33724 uart: tx-data-bit: "1"
33724-33750 uart: tx-data-bit: "0"
33750-33776 uart: tx-data-bit: "0"
33776-33802 uart: tx-data-bit: "0"
33646-33802 uart: tx-data: "04"
33802-33828 uart: tx-stop: "Stop bit" "Stop" "T"
