137-164 uart: tx-start: "Start bit" "Start" "S"
163-190 uart: tx-data-bit: "0"
189-216 uart: tx-data-bit: "0"
215-242 uart: tx-data-bit: "1"
241-268 uart: tx-data-bit: "0"
267-294 uart: tx-data-bit: "1"
293-320 uart: tx-data-bit: "1"
319-346 uart: tx-data-bit: "1"
345-372 uart: tx-data-bit: "1"
371-398 uart: tx-data-bit: "1"
163-398 uart: tx-data: "500"
397-424 uart: tx-stop: "Stop bit" "Stop" "T"
679-706 uart: tx-start: "Start bit" "Start" "S"
705-732 uart: tx-data-bit: "1"
731-758 uart: tx-data-bit: "0"
757-784 uart: tx-data-bit: "1"
783-810 uart: tx-data-bit: "0"
809-836 uart: tx-data-bit: "1"
835-862 uart: tx-data-bit: "1"
861-888 uart: tx-data-bit: "1"
887-914 uart: tx-data-bit: "1"
913-940 uart: tx-data-bit: "1"
705-940 uart: tx-data: "501"
939-966 uart: tx-stop: "Stop bit" "Stop" "T"
1224-1251 uart: tx-start: "Start bit" "Start" "S"
1250-1277 uart: tx-data-bit: "0"
1276-1303 uart: tx-data-bit: "1"
1302-1329 uart: tx-data-bit: "1"
1328-1355 uart: tx-data-bit: "0"
1354-1381 uart: tx-data-bit: "1"
1380-1407 uart: tx-data-bit: "1"
1406-1433 uart: tx-data-bit: "1"
1432-1459 uart: tx-data-bit: "1"
1458-1485 uart: tx-data-bit: "1"
1250-1485 uart: tx-data: "502"
1484-1511 uart: tx-stop: "Stop bit" "Stop" "T"
1767-1794 uart: tx-start: "Start bit" "Start" "S"
1793-1820 uart: tx-data-bit: "1"
1819-1846 uart: tx-data-bit: "1"
1845-1872 uart: tx-data-bit: "1"
1871-1898 uart: tx-data-bit: "0"
1897-1924 uart: tx-data-bit: "1"
1923-1950 uart: tx-data-bit: "1"
1949-1976 uart: tx-data-bit: "1"
1975-2002 uart: tx-data-bit: "1"
2001-2028 uart: tx-data-bit: "1"
1793-2028 uart: tx-data: "503"
2027-2054 uart: tx-stop: "Stop bit" "Stop" "T"
2309-2336 uart: tx-start: "Start bit" "Start" "S"
2335-2362 uart: tx-data-bit: "0"
2361-2388 uart: tx-data-bit: "0"
2387-2414 uart: tx-data-bit: "0"
2413-2440 uart: tx-data-bit: "1"
2439-2466 uart: tx-data-bit: "1"
2465-2492 uart: tx-data-bit: "1"
2491-2518 uart: tx-data-bit: "1"
2517-2544 uart: tx-data-bit: "1"
2543-2570 uart: tx-data-bit: "1"
2335-2570 uart: tx-data: "504"
2569-2596 uart: tx-stop: "Stop bit" "Stop" "T"
2850-2877 uart: tx-start: "Start bit" "Start" "S"
2876-2903 uart: tx-data-bit: "1"
2902-2929 uart: tx-data-bit: "0"
2928-2955 uart: tx-data-bit: "0"
2954-2981 uart: tx-data-bit: "1"
2980-3007 uart: tx-data-bit: "1"
3006-3033 uart: tx-data-bit: "1"
3032-3059 uart: tx-data-bit: "1"
3058-3085 uart: tx-data-bit: "1"
3084-3111 uart: tx-data-bit: "1"
2876-3111 uart: tx-data: "505"
3110-3137 uart: tx-stop: "Stop bit" "Stop" "T"
3393-3420 uart: tx-start: "Start bit" "Start" "S"
3419-3446 uart: tx-data-bit: "0"
3445-3472 uart: tx-data-bit: "1"
3471-3498 uart: tx-data-bit: "0"
3497-3524 uart: tx-data-bit: "1"
3523-3550 uart: tx-data-bit: "1"
3549-3576 uart: tx-data-bit: "1"
3575-3602 uart: tx-data-bit: "1"
3601-3628 uart: tx-data-bit: "1"
3627-3654 uart: tx-data-bit: "1"
3419-3654 uart: tx-data: "506"
3653-3680 uart: tx-stop: "Stop bit" "Stop" "T"
3936-3963 uart: tx-start: "Start bit" "Start" "S"
3962-3989 uart: tx-data-bit: "1"
3988-4015 uart: tx-data-bit: "1"
4014-4041 uart: tx-data-bit: "0"
4040-4067 uart: tx-data-bit: "1"
4066-4093 uart: tx-data-bit: "1"
4092-4119 uart: tx-data-bit: "1"
4118-4145 uart: tx-data-bit: "1"
4144-4171 uart: tx-data-bit: "1"
4170-4197 uart: tx-data-bit: "1"
3962-4197 uart: tx-data: "507"
4196-4223 uart: tx-stop: "Stop bit" "Stop" "T"
4478-4505 uart: tx-start: "Start bit" "Start" "S"
4504-4531 uart: tx-data-bit: "0"
4530-4557 uart: tx-data-bit: "0"
4556-4583 uart: tx-data-bit: "1"
4582-4609 uart: tx-data-bit: "1"
4608-4635 uart: tx-data-bit: "1"
4634-4661 uart: tx-data-bit: "1"
4660-4687 uart: tx-data-bit: "1"
4686-4713 uart: tx-data-bit: "1"
4712-4739 uart: tx-data-bit: "1"
4504-4739 uart: tx-data: "508"
4738-4765 uart: tx-stop: "Stop bit" "Stop" "T"
5019-5046 uart: tx-start: "Start bit" "Start" "S"
5045-5072 uart: tx-data-bit: "1"
5071-5098 uart: tx-data-bit: "0"
5097-5124 uart: tx-data-bit: "1"
5123-5150 uart: tx-data-bit: "1"
5149-5176 uart: tx-data-bit: "1"
5175-5202 uart: tx-data-bit: "1"
5201-5228 uart: tx-data-bit: "1"
5227-5254 uart: tx-data-bit: "1"
5253-5280 uart: tx-data-bit: "1"
5045-5280 uart: tx-data: "509"
5279-5306 uart: tx-stop: "Stop bit" "Stop" "T"
5562-5589 uart: tx-start: "Start bit" "Start" "S"
5588-5615 uart: tx-data-bit: "0"
5614-5641 uart: tx-data-bit: "1"
5640-5667 uart: tx-data-bit: "1"
5666-5693 uart: tx-data-bit: "1"
5692-5719 uart: tx-data-bit: "1"
5718-5745 uart: tx-data-bit: "1"
5744-5771 uart: tx-data-bit: "1"
5770-5797 uart: tx-data-bit: "1"
5796-5823 uart: tx-data-bit: "1"
5588-5823 uart: tx-data: "510"
5822-5849 uart: tx-stop: "Stop bit" "Stop" "T"
6102-6129 uart: tx-start: "Start bit" "Start" "S"
6128-6155 uart: tx-data-bit: "1"
6154-6181 uart: tx-data-bit: "1"
6180-6207 uart: tx-data-bit: "1"
6206-6233 uart: tx-data-bit: "1"
6232-6259 uart: tx-data-bit: "1"
6258-6285 uart: tx-data-bit: "1"
6284-6311 uart: tx-data-bit: "1"
6310-6337 uart: tx-data-bit: "1"
6336-6363 uart: tx-data-bit: "1"
6128-6363 uart: tx-data: "511"
6362-6389 uart: tx-stop: "Stop bit" "Stop" "T"
6643-6670 uart: tx-start: "Start bit" "Start" "S"
6669-6696 uart: tx-data-bit: "0"
6695-6722 uart: tx-data-bit: "0"
6721-6748 uart: tx-data-bit: "0"
6747-6774 uart: tx-data-bit: "0"
6773-6800 uart: tx-data-bit: "0"
6799-6826 uart: tx-data-bit: "0"
6825-6852 uart: tx-data-bit: "0"
6851-6878 uart: tx-data-bit: "0"
6877-6904 uart: tx-data-bit: "0"
6669-6904 uart: tx-data: "0"
6903-6930 uart: tx-stop: "Stop bit" "Stop" "T"
7183-7210 uart: tx-start: "Start bit" "Start" "S"
7209-7236 uart: tx-data-bit: "1"
7235-7262 uart: tx-data-bit: "0"
7261-7288 uart: tx-data-bit: "0"
7287-7314 uart: tx-data-bit: "0"
7313-7340 uart: tx-data-bit: "0"
7339-7366 uart: tx-data-bit: "0"
7365-7392 uart: tx-data-bit: "0"
7391-7418 uart: tx-data-bit: "0"
7417-7444 uart: tx-data-bit: "0"
7209-7444 uart: tx-data: "1"
7443-7470 uart: tx-stop: "Stop bit" "Stop" "T"
7726-7753 uart: tx-start: "Start bit" "Start" "S"
7752-7779 uart: tx-data-bit: "0"
7778-7805 uart: tx-data-bit: "1"
7804-7831 uart: tx-data-bit: "0"
7830-7857 uart: tx-data-bit: "0"
7856-7883 uart: tx-data-bit: "0"
7882-7909 uart: tx-data-bit: "0"
7908-7935 uart: tx-data-bit: "0"
7934-7961 uart: tx-data-bit: "0"
7960-7987 uart: tx-data-bit: "0"
7752-7987 uart: tx-data: "2"
7986-8013 uart: tx-stop: "Stop bit" "Stop" "T"
8268-8295 uart: tx-start: "Start bit" "Start" "S"
8294-8321 uart: tx-data-bit: "1"
8320-8347 uart: tx-data-bit: "1"
8346-8373 uart: tx-data-bit: "0"
8372-8399 uart: tx-data-bit: "0"
8398-8425 uart: tx-data-bit: "0"
8424-8451 uart: tx-data-bit: "0"
8450-8477 uart: tx-data-bit: "0"
8476-8503 uart: tx-data-bit: "0"
8502-8529 uart: tx-data-bit: "0"
8294-8529 uart: tx-data: "3"
163-8529 uart: tx-packet: "500 501 502 503 504 505 506 507 508 509 510 511 0 1 2 3"
8528-8555 uart: tx-stop: "Stop bit" "Stop" "T"
8811-8838 uart: tx-start: "Start bit" "Start" "S"
8837-8864 uart: tx-data-bit: "0"
8863-8890 uart: tx-data-bit: "0"
8889-8916 uart: tx-data-bit: "1"
8915-8942 uart: tx-data-bit: "0"
8941-8968 uart: tx-data-bit: "0"
8967-8994 uart: tx-data-bit: "0"
8993-9020 uart: tx-data-bit: "0"
9019-9046 uart: tx-data-bit: "0"
9045-9072 uart: tx-data-bit: "0"
8837-9072 uart: tx-data: "4"
9071-9098 uart: tx-stop: "Stop bit" "Stop" "T"
9354-9381 uart: tx-start: "Start bit" "Start" "S"
9380-9407 uart: tx-data-bit: "1"
9406-9433 uart: tx-data-bit: "0"
9432-9459 uart: tx-data-bit: "1"
9458-9485 uart: tx-data-bit: "0"
9484-9511 uart: tx-data-bit: "0"
9510-9537 uart: tx-data-bit: "0"
9536-9563 uart: tx-data-bit: "0"
9562-9589 uart: tx-data-bit: "0"
9588-9615 uart: tx-data-bit: "0"
9380-9615 uart: tx-data: "5"
9614-9641 uart: tx-stop: "Stop bit" "Stop" "T"
9898-9925 uart: tx-start: "Start bit" "Start" "S"
9924-9951 uart: tx-data-bit: "0"
9950-9977 uart: tx-data-bit: "1"
9976-10003 uart: tx-data-bit: "1"
10002-10029 uart: tx-data-bit: "0"
10028-10055 uart: tx-data-bit: "0"
10054-10081 uart: tx-data-bit: "0"
10080-10107 uart: tx-data-bit: "0"
10106-10133 uart: tx-data-bit: "0"
10132-10159 uart: tx-data-bit: "0"
9924-10159 uart: tx-data: "6"
10158-10185 uart: tx-stop: "Stop bit" "Stop" "T"
10441-10468 uart: tx-start: "Start bit" "Start" "S"
10467-10494 uart: tx-data-bit: "1"
10493-10520 uart: tx-data-bit: "1"
10519-10546 uart: tx-data-bit: "1"
10545-10572 uart: tx-data-bit: "0"
10571-10598 uart: tx-data-bit: "0"
10597-10624 uart: tx-data-bit: "0"
10623-10650 uart: tx-data-bit: "0"
10649-10676 uart: tx-data-bit: "0"
10675-10702 uart: tx-data-bit: "0"
10467-10702 uart: tx-data: "7"
10701-10728 uart: tx-stop: "Stop bit" "Stop" "T"
10983-11010 uart: tx-start: "Start bit" "Start" "S"
11009-11036 uart: tx-data-bit: "0"
11035-11062 uart: tx-data-bit: "0"
11061-11088 uart: tx-data-bit: "0"
11087-11114 uart: tx-data-bit: "1"
11113-11140 uart: tx-data-bit: "0"
11139-11166 uart: tx-data-bit: "0"
11165-11192 uart: tx-data-bit: "0"
11191-11218 uart: tx-data-bit: "0"
11217-11244 uart: tx-data-bit: "0"
11009-11244 uart: tx-data: "8"
11243-11270 uart: tx-stop: "Stop bit" "Stop" "T"
11526-11553 uart: tx-start: "Start bit" "Start" "S"
11552-11579 uart: tx-data-bit: "1"
11578-11605 uart: tx-data-bit: "0"
11604-11631 uart: tx-data-bit: "0"
11630-11657 uart: tx-data-bit: "1"
11656-11683 uart: tx-data-bit: "0"
11682-11709 uart: tx-data-bit: "0"
11708-11735 uart: tx-data-bit: "0"
11734-11761 uart: tx-data-bit: "0"
11760-11787 uart: tx-data-bit: "0"
11552-11787 uart: tx-data: "9"
11786-11813 uart: tx-stop: "Stop bit" "Stop" "T"
12070-12097 uart: tx-start: "Start bit" "Start" "S"
12096-12123 uart: tx-data-bit: "0"
12122-12149 uart: tx-data-bit: "1"
12148-12175 uart: tx-data-bit: "0"
12174-12201 uart: tx-data-bit: "1"
12200-12227 uart: tx-data-bit: "0"
12226-12253 uart: tx-data-bit: "0"
12252-12279 uart: tx-data-bit: "0"
12278-12305 uart: tx-data-bit: "0"
12304-12331 uart: tx-data-bit: "0"
12096-12331 uart: tx-data: "10"
12330-12357 uart: tx-stop: "Stop bit" "Stop" "T"
12615-12642 uart: tx-start: "Start bit" "Start" "S"
12641-12668 uart: tx-data-bit: "1"
12667-12694 uart: tx-data-bit: "1"
12693-12720 uart: tx-data-bit: "0"
12719-12746 uart: tx-data-bit: "1"
12745-12772 uart: tx-data-bit: "0"
12771-12798 uart: tx-data-bit: "0"
12797-12824 uart: tx-data-bit: "0"
12823-12850 uart: tx-data-bit: "0"
12849-12876 uart: tx-data-bit: "0"
12641-12876 uart: tx-data: "11"
12875-12902 uart: tx-stop: "Stop bit" "Stop" "T"
13160-13187 uart: tx-start: "Start bit" "Start" "S"
13186-13213 uart: tx-data-bit: "0"
13212-13239 uart: tx-data-bit: "0"
13238-13265 uart: tx-data-bit: "1"
13264-13291 uart: tx-data-bit: "1"
13290-13317 uart: tx-data-bit: "0"
13316-13343 uart: tx-data-bit: "0"
13342-13369 uart: tx-data-bit: "0"
13368-13395 uart: tx-data-bit: "0"
13394-13421 uart: tx-data-bit: "0"
13186-13421 uart: tx-data: "12"
13420-13447 uart: tx-stop: "Stop bit" "Stop" "T"
13702-13729 uart: tx-start: "Start bit" "Start" "S"
13728-13755 uart: tx-data-bit: "1"
13754-13781 uart: tx-data-bit: "0"
13780-13807 uart: tx-data-bit: "1"
13806-13833 uart: tx-data-bit: "1"
13832-13859 uart: tx-data-bit: "0"
13858-13885 uart: tx-data-bit: "0"
13884-13911 uart: tx-data-bit: "0"
13910-13937 uart: tx-data-bit: "0"
13936-13963 uart: tx-data-bit: "0"
13728-13963 uart: tx-data: "13"
13962-13989 uart: tx-stop: "Stop bit" "Stop" "T"
14247-14274 uart: tx-start: "Start bit" "Start" "S"
14273-14300 uart: tx-data-bit: "0"
14299-14326 uart: tx-data-bit: "1"
14325-14352 uart: tx-data-bit: "1"
14351-14378 uart: tx-data-bit: "1"
14377-14404 uart: tx-data-bit: "0"
14403-14430 uart: tx-data-bit: "0"
14429-14456 uart: tx-data-bit: "0"
14455-14482 uart: tx-data-bit: "0"
14481-14508 uart: tx-data-bit: "0"
14273-14508 uart: tx-data: "14"
14507-14534 uart: tx-stop: "Stop bit" "Stop" "T"
14789-14816 uart: tx-start: "Start bit" "Start" "S"
14815-14842 uart: tx-data-bit: "1"
14841-14868 uart: tx-data-bit: "1"
14867-14894 uart: tx-data-bit: "1"
14893-14920 uart: tx-data-bit: "1"
14919-14946 uart: tx-data-bit: "0"
14945-14972 uart: tx-data-bit: "0"
14971-14998 uart: tx-data-bit: "0"
14997-15024 uart: tx-data-bit: "0"
15023-15050 uart: tx-data-bit: "0"
14815-15050 uart: tx-data: "15"
15049-15076 uart: tx-stop: "Stop bit" "Stop" "T"
15332-15359 uart: tx-start: "Start bit" "Start" "S"
15358-15385 uart: tx-data-bit: "0"
15384-15411 uart: tx-data-bit: "0"
15410-15437 uart: tx-data-bit: "0"
15436-15463 uart: tx-data-bit: "0"
15462-15489 uart: tx-data-bit: "1"
15488-15515 uart: tx-data-bit: "0"
15514-15541 uart: tx-data-bit: "0"
15540-15567 uart: tx-data-bit: "0"
15566-15593 uart: tx-data-bit: "0"
15358-15593 uart: tx-data: "16"
15592-15619 uart: tx-stop: "Stop bit" "Stop" "T"
15874-15901 uart: tx-start: "Start bit" "Start" "S"
15900-15927 uart: tx-data-bit: "1"
15926-15953 uart: tx-data-bit: "0"
15952-15979 uart: tx-data-bit: "0"
15978-16005 uart: tx-data-bit: "0"
16004-16031 uart: tx-data-bit: "1"
16030-16057 uart: tx-data-bit: "0"
16056-16083 uart: tx-data-bit: "0"
16082-16109 uart: tx-data-bit: "0"
16108-16135 uart: tx-data-bit: "0"
15900-16135 uart: tx-data: "17"
16134-16161 uart: tx-stop: "Stop bit" "Stop" "T"
16419-16446 uart: tx-start: "Start bit" "Start" "S"
16445-16472 uart: tx-data-bit: "0"
16471-16498 uart: tx-data-bit: "1"
16497-16524 uart: tx-data-bit: "0"
16523-16550 uart: tx-data-bit: "0"
16549-16576 uart: tx-data-bit: "1"
16575-16602 uart: tx-data-bit: "0"
16601-16628 uart: tx-data-bit: "0"
16627-16654 uart: tx-data-bit: "0"
16653-16680 uart: tx-data-bit: "0"
16445-16680 uart: tx-data: "18"
16679-16706 uart: tx-stop: "Stop bit" "Stop" "T"
16964-16991 uart: tx-start: "Start bit" "Start" "S"
16990-17017 uart: tx-data-bit: "1"
17016-17043 uart: tx-data-bit: "1"
17042-17069 uart: tx-data-bit: "0"
17068-17095 uart: tx-data-bit: "0"
17094-17121 uart: tx-data-bit: "1"
17120-17147 uart: tx-data-bit: "0"
17146-17173 uart: tx-data-bit: "0"
17172-17199 uart: tx-data-bit: "0"
17198-17225 uart: tx-data-bit: "0"
16990-17225 uart: tx-data: "19"
8837-17225 uart: tx-packet: "4 5 6 7 8 9 10 11 12 13 14 15 16 17 18 19"
17224-17251 uart: tx-stop: "Stop bit" "Stop" "T"
17508-17535 uart: tx-start: "Start bit" "Start" "S"
17534-17561 uart: tx-data-bit: "0"
17560-17587 uart: tx-data-bit: "0"
17586-17613 uart: tx-data-bit: "1"
17612-17639 uart: tx-data-bit: "0"
17638-17665 uart: tx-data-bit: "1"
17664-17691 uart: tx-data-bit: "0"
17690-17717 uart: tx-data-bit: "0"
17716-17743 uart: tx-data-bit: "0"
17742-17769 uart: tx-data-bit: "0"
17534-17769 uart: tx-data: "20"
17768-17795 uart: tx-stop: "Stop bit" "Stop" "T"
18053-18080 uart: tx-start: "Start bit" "Start" "S"
18079-18106 uart: tx-data-bit: "1"
18105-18132 uart: tx-data-bit: "0"
18131-18158 uart: tx-data-bit: "1"
18157-18184 uart: tx-data-bit: "0"
18183-18210 uart: tx-data-bit: "1"
18209-18236 uart: tx-data-bit: "0"
18235-18262 uart: tx-data-bit: "0"
18261-18288 uart: tx-data-bit: "0"
18287-18314 uart: tx-data-bit: "0"
18079-18314 uart: tx-data: "21"
18313-18340 uart: tx-stop: "Stop bit" "Stop" "T"
18599-18626 uart: tx-start: "Start bit" "Start" "S"
18625-18652 uart: tx-data-bit: "0"
18651-18678 uart: tx-data-bit: "1"
18677-18704 uart: tx-data-bit: "1"
18703-18730 uart: tx-data-bit: "0"
18729-18756 uart: tx-data-bit: "1"
18755-18782 uart: tx-data-bit: "0"
18781-18808 uart: tx-data-bit: "0"
18807-18834 uart: tx-data-bit: "0"
18833-18860 uart: tx-data-bit: "0"
18625-18860 uart: tx-data: "22"
18859-18886 uart: tx-stop: "Stop bit" "Stop" "T"
19144-19171 uart: tx-start: "Start bit" "Start" "S"
19170-19197 uart: tx-data-bit: "1"
19196-19223 uart: tx-data-bit: "1"
19222-19249 uart: tx-data-bit: "1"
19248-19275 uart: tx-data-bit: "0"
19274-19301 uart: tx-data-bit: "1"
19300-19327 uart: tx-data-bit: "0"
19326-19353 uart: tx-data-bit: "0"
19352-19379 uart: tx-data-bit: "0"
19378-19405 uart: tx-data-bit: "0"
19170-19405 uart: tx-data: "23"
19404-19431 uart: tx-stop: "Stop bit" "Stop" "T"
19688-19715 uart: tx-start: "Start bit" "Start" "S"
19714-19741 uart: tx-data-bit: "0"
19740-19767 uart: tx-data-bit: "0"
19766-19793 uart: tx-data-bit: "0"
19792-19819 uart: tx-data-bit: "1"
19818-19845 uart: tx-data-bit: "1"
19844-19871 uart: tx-data-bit: "0"
19870-19897 uart: tx-data-bit: "0"
19896-19923 uart: tx-data-bit: "0"
19922-19949 uart: tx-data-bit: "0"
19714-19949 uart: tx-data: "24"
19948-19975 uart: tx-stop: "Stop bit" "Stop" "T"
20231-20258 uart: tx-start: "Start bit" "Start" "S"
20257-20284 uart: tx-data-bit: "1"
20283-20310 uart: tx-data-bit: "0"
20309-20336 uart: tx-data-bit: "0"
20335-20362 uart: tx-data-bit: "1"
20361-20388 uart: tx-data-bit: "1"
20387-20414 uart: tx-data-bit: "0"
20413-20440 uart: tx-data-bit: "0"
20439-20466 uart: tx-data-bit: "0"
20465-20492 uart: tx-data-bit: "0"
20257-20492 uart: tx-data: "25"
20491-20518 uart: tx-stop: "Stop bit" "Stop" "T"
20776-20803 uart: tx-start: "Start bit" "Start" "S"
20802-20829 uart: tx-data-bit: "0"
20828-20855 uart: tx-data-bit: "1"
20854-20881 uart: tx-data-bit: "0"
20880-20907 uart: tx-data-bit: "1"
20906-20933 uart: tx-data-bit: "1"
20932-20959 uart: tx-data-bit: "0"
20958-20985 uart: tx-data-bit: "0"
20984-21011 uart: tx-data-bit: "0"
21010-21037 uart: tx-data-bit: "0"
20802-21037 uart: tx-data: "26"
21036-21063 uart: tx-stop: "Stop bit" "Stop" "T"
21320-21347 uart: tx-start: "Start bit" "Start" "S"
21346-21373 uart: tx-data-bit: "1"
21372-21399 uart: tx-data-bit: "1"
21398-21425 uart: tx-data-bit: "0"
21424-21451 uart: tx-data-bit: "1"
21450-21477 uart: tx-data-bit: "1"
21476-21503 uart: tx-data-bit: "0"
21502-21529 uart: tx-data-bit: "0"
21528-21555 uart: tx-data-bit: "0"
21554-21581 uart: tx-data-bit: "0"
21346-21581 uart: tx-data: "27"
21580-21607 uart: tx-stop: "Stop bit" "Stop" "T"
21865-21892 uart: tx-start: "Start bit" "Start" "S"
21891-21918 uart: tx-data-bit: "0"
21917-21944 uart: tx-data-bit: "0"
21943-21970 uart: tx-data-bit: "1"
21969-21996 uart: tx-data-bit: "1"
21995-22022 uart: tx-data-bit: "1"
22021-22048 uart: tx-data-bit: "0"
22047-22074 uart: tx-data-bit: "0"
22073-22100 uart: tx-data-bit: "0"
22099-22126 uart: tx-data-bit: "0"
21891-22126 uart: tx-data: "28"
22125-22152 uart: tx-stop: "Stop bit" "Stop" "T"
22407-22434 uart: tx-start: "Start bit" "Start" "S"
22433-22460 uart: tx-data-bit: "1"
22459-22486 uart: tx-data-bit: "0"
22485-22512 uart: tx-data-bit: "1"
22511-22538 uart: tx-data-bit: "1"
22537-22564 uart: tx-data-bit: "1"
22563-22590 uart: tx-data-bit: "0"
22589-22616 uart: tx-data-bit: "0"
22615-22642 uart: tx-data-bit: "0"
22641-22668 uart: tx-data-bit: "0"
22433-22668 uart: tx-data: "29"
22667-22694 uart: tx-stop: "Stop bit" "Stop" "T"
22952-22979 uart: tx-start: "Start bit" "Start" "S"
22978-23005 uart: tx-data-bit: "0"
23004-23031 uart: tx-data-bit: "1"
23030-23057 uart: tx-data-bit: "1"
23056-23083 uart: tx-data-bit: "1"
23082-23109 uart: tx-data-bit: "1"
23108-23135 uart: tx-data-bit: "0"
23134-23161 uart: tx-data-bit: "0"
23160-23187 uart: tx-data-bit: "0"
23186-23213 uart: tx-data-bit: "0"
22978-23213 uart: tx-data: "30"
23212-23239 uart: tx-stop: "Stop bit" "Stop" "T"
23494-23521 uart: tx-start: "Start bit" "Start" "S"
23520-23547 uart: tx-data-bit: "1"
23546-23573 uart: tx-data-bit: "1"
23572-23599 uart: tx-data-bit: "1"
23598-23625 uart: tx-data-bit: "1"
23624-23651 uart: tx-data-bit: "1"
23650-23677 uart: tx-data-bit: "0"
23676-23703 uart: tx-data-bit: "0"
23702-23729 uart: tx-data-bit: "0"
23728-23755 uart: tx-data-bit: "0"
23520-23755 uart: tx-data: "31"
23754-23781 uart: tx-stop: "Stop bit" "Stop" "T"
24037-24064 uart: tx-start: "Start bit" "Start" "S"
24063-24090 uart: tx-data-bit: "0"
24089-24116 uart: tx-data-bit: "0"
24115-24142 uart: tx-data-bit: "0"
24141-24168 uart: tx-data-bit: "0"
24167-24194 uart: tx-data-bit: "0"
24193-24220 uart: tx-data-bit: "1"
24219-24246 uart: tx-data-bit: "0"
24245-24272 uart: tx-data-bit: "0"
24271-24298 uart: tx-data-bit: "0"
24063-24298 uart: tx-data: "32"
24297-24324 uart: tx-stop: "Stop bit" "Stop" "T"
24580-24607 uart: tx-start: "Start bit" "Start" "S"
24606-24633 uart: tx-data-bit: "1"
24632-24659 uart: tx-data-bit: "0"
24658-24685 uart: tx-data-bit: "0"
24684-24711 uart: tx-data-bit: "0"
24710-24737 uart: tx-data-bit: "0"
24736-24763 uart: tx-data-bit: "1"
24762-24789 uart: tx-data-bit: "0"
24788-24815 uart: tx-data-bit: "0"
24814-24841 uart: tx-data-bit: "0"
24606-24841 uart: tx-data: "33"
24840-24867 uart: tx-stop: "Stop bit" "Stop" "T"
25124-25151 uart: tx-start: "Start bit" "Start" "S"
25150-25177 uart: tx-data-bit: "0"
25176-25203 uart: tx-data-bit: "1"
25202-25229 uart: tx-data-bit: "0"
25228-25255 uart: tx-data-bit: "0"
25254-25281 uart: tx-data-bit: "0"
25280-25307 uart: tx-data-bit: "1"
25306-25333 uart: tx-data-bit: "0"
25332-25359 uart: tx-data-bit: "0"
25358-25385 uart: tx-data-bit: "0"
25150-25385 uart: tx-data: "34"
25384-25411 uart: tx-stop: "Stop bit" "Stop" "T"
25669-25696 uart: tx-start: "Start bit" "Start" "S"
25695-25722 uart: tx-data-bit: "1"
25721-25748 uart: tx-data-bit: "1"
25747-25774 uart: tx-data-bit: "0"
25773-25800 uart: tx-data-bit: "0"
25799-25826 uart: tx-data-bit: "0"
25825-25852 uart: tx-data-bit: "1"
25851-25878 uart: tx-data-bit: "0"
25877-25904 uart: tx-data-bit: "0"
25903-25930 uart: tx-data-bit: "0"
25695-25930 uart: tx-data: "35"
17534-25930 uart: tx-packet: "20 21 22 23 24 25 26 27 28 29 30 31 32 33 34 35"
25929-25956 uart: tx-stop: "Stop bit" "Stop" "T"
26213-26240 uart: tx-start: "Start bit" "Start" "S"
26239-26266 uart: tx-data-bit: "0"
26265-26292 uart: tx-data-bit: "0"
26291-26318 uart: tx-data-bit: "1"
26317-26344 uart: tx-data-bit: "0"
26343-26370 uart: tx-data-bit: "0"
26369-26396 uart: tx-data-bit: "1"
26395-26422 uart: tx-data-bit: "0"
26421-26448 uart: tx-data-bit: "0"
26447-26474 uart: tx-data-bit: "0"
26239-26474 uart: tx-data: "36"
26473-26500 uart: tx-stop: "Stop bit" "Stop" "T"
26758-26785 uart: tx-start: "Start bit" "Start" "S"
26784-26811 uart: tx-data-bit: "1"
26810-26837 uart: tx-data-bit: "0"
26836-26863 uart: tx-data-bit: "1"
26862-26889 uart: tx-data-bit: "0"
26888-26915 uart: tx-data-bit: "0"
26914-26941 uart: tx-data-bit: "1"
26940-26967 uart: tx-data-bit: "0"
26966-26993 uart: tx-data-bit: "0"
26992-27019 uart: tx-data-bit: "0"
26784-27019 uart: tx-data: "37"
27018-27045 uart: tx-stop: "Stop bit" "Stop" "T"
27304-27331 uart: tx-start: "Start bit" "Start" "S"
27330-27357 uart: tx-data-bit: "0"
27356-27383 uart: tx-data-bit: "1"
27382-27409 uart: tx-data-bit: "1"
27408-27435 uart: tx-data-bit: "0"
27434-27461 uart: tx-data-bit: "0"
27460-27487 uart: tx-data-bit: "1"
27486-27513 uart: tx-data-bit: "0"
27512-27539 uart: tx-data-bit: "0"
27538-27565 uart: tx-data-bit: "0"
27330-27565 uart: tx-data: "38"
27564-27591 uart: tx-stop: "Stop bit" "Stop" "T"
27849-27876 uart: tx-start: "Start bit" "Start" "S"
27875-27902 uart: tx-data-bit: "1"
27901-27928 uart: tx-data-bit: "1"
27927-27954 uart: tx-data-bit: "1"
27953-27980 uart: tx-data-bit: "0"
27979-28006 uart: tx-data-bit: "0"
28005-28032 uart: tx-data-bit: "1"
28031-28058 uart: tx-data-bit: "0"
28057-28084 uart: tx-data-bit: "0"
28083-28110 uart: tx-data-bit: "0"
27875-28110 uart: tx-data: "39"
28109-28136 uart: tx-stop: "Stop bit" "Stop" "T"
28394-28421 uart: tx-start: "Start bit" "Start" "S"
28420-28447 uart: tx-data-bit: "0"
28446-28473 uart: tx-data-bit: "0"
28472-28499 uart: tx-data-bit: "0"
28498-28525 uart: tx-data-bit: "1"
28524-28551 uart: tx-data-bit: "0"
28550-28577 uart: tx-data-bit: "1"
28576-28603 uart: tx-data-bit: "0"
28602-28629 uart: tx-data-bit: "0"
28628-28655 uart: tx-data-bit: "0"
28420-28655 uart: tx-data: "40"
28654-28681 uart: tx-stop: "Stop bit" "Stop" "T"
28938-28965 uart: tx-start: "Start bit" "Start" "S"
28964-28991 uart: tx-data-bit: "1"
28990-29017 uart: tx-data-bit: "0"
29016-29043 uart: tx-data-bit: "0"
29042-29069 uart: tx-data-bit: "1"
29068-29095 uart: tx-data-bit: "0"
29094-29121 uart: tx-data-bit: "1"
29120-29147 uart: tx-data-bit: "0"
29146-29173 uart: tx-data-bit: "0"
29172-29199 uart: tx-data-bit: "0"
28964-29199 uart: tx-data: "41"
29198-29225 uart: tx-stop: "Stop bit" "Stop" "T"
29485-29512 uart: tx-start: "Start bit" "Start" "S"
29511-29538 uart: tx-data-bit: "0"
29537-29564 uart: tx-data-bit: "1"
29563-29590 uart: tx-data-bit: "0"
29589-29616 uart: tx-data-bit: "1"
29615-29642 uart: tx-data-bit: "0"
29641-29668 uart: tx-data-bit: "1"
29667-29694 uart: tx-data-bit: "0"
29693-29720 uart: tx-data-bit: "0"
29719-29746 uart: tx-data-bit: "0"
29511-29746 uart: tx-data: "42"
29745-29772 uart: tx-stop: "Stop bit" "Stop" "T"
30031-30058 uart: tx-start: "Start bit" "Start" "S"
30057-30084 uart: tx-data-bit: "1"
30083-30110 uart: tx-data-bit: "1"
30109-30136 uart: tx-data-bit: "0"
30135-30162 uart: tx-data-bit: "1"
30161-30188 uart: tx-data-bit: "0"
30187-30214 uart: tx-data-bit: "1"
30213-30240 uart: tx-data-bit: "0"
30239-30266 uart: tx-data-bit: "0"
30265-30292 uart: tx-data-bit: "0"
30057-30292 uart: tx-data: "43"
30291-30318 uart: tx-stop: "Stop bit" "Stop" "T"
30578-30605 uart: tx-start: "Start bit" "Start" "S"
30604-30631 uart: tx-data-bit: "0"
30630-30657 uart: tx-data-bit: "0"
30656-30683 uart: tx-data-bit: "1"
30682-30709 uart: tx-data-bit: "1"
30708-30735 uart: tx-data-bit: "0"
30734-30761 uart: tx-data-bit: "1"
30760-30787 uart: tx-data-bit: "0"
30786-30813 uart: tx-data-bit: "0"
30812-30839 uart: tx-data-bit: "0"
30604-30839 uart: tx-data: "44"
30838-30865 uart: tx-stop: "Stop bit" "Stop" "T"
31122-31149 uart: tx-start: "Start bit" "Start" "S"
31148-31175 uart: tx-data-bit: "1"
31174-31201 uart: tx-data-bit: "0"
31200-31227 uart: tx-data-bit: "1"
31226-31253 uart: tx-data-bit: "1"
31252-31279 uart: tx-data-bit: "0"
31278-31305 uart: tx-data-bit: "1"
31304-31331 uart: tx-data-bit: "0"
31330-31357 uart: tx-data-bit: "0"
31356-31383 uart: tx-data-bit: "0"
31148-31383 uart: tx-data: "45"
31382-31409 uart: tx-stop: "Stop bit" "Stop" "T"
31669-31696 uart: tx-start: "Start bit" "Start" "S"
31695-31722 uart: tx-data-bit: "0"
31721-31748 uart: tx-data-bit: "1"
31747-31774 uart: tx-data-bit: "1"
31773-31800 uart: tx-data-bit: "1"
31799-31826 uart: tx-data-bit: "0"
31825-31852 uart: tx-data-bit: "1"
31851-31878 uart: tx-data-bit: "0"
31877-31904 uart: tx-data-bit: "0"
31903-31930 uart: tx-data-bit: "0"
31695-31930 uart: tx-data: "46"
31929-31956 uart: tx-stop: "Stop bit" "Stop" "T"
32214-32241 uart: tx-start: "Start bit" "Start" "S"
32240-32267 uart: tx-data-bit: "1"
32266-32293 uart: tx-data-bit: "1"
32292-32319 uart: tx-data-bit: "1"
32318-32345 uart: tx-data-bit: "1"
32344-32371 uart: tx-data-bit: "0"
32370-32397 uart: tx-data-bit: "1"
32396-32423 uart: tx-data-bit: "0"
32422-32449 uart: tx-data-bit: "0"
32448-32475 uart: tx-data-bit: "0"
32240-32475 uart: tx-data: "47"
32474-32501 uart: tx-stop: "Stop bit" "Stop" "T"
32758-32785 uart: tx-start: "Start bit" "Start" "S"
32784-32811 uart: tx-data-bit: "0"
32810-32837 uart: tx-data-bit: "0"
32836-32863 uart: tx-data-bit: "0"
32862-32889 uart: tx-data-bit: "0"
32888-32915 uart: tx-data-bit: "1"
32914-32941 uart: tx-data-bit: "1"
32940-32967 uart: tx-data-bit: "0"
32966-32993 uart: tx-data-bit: "0"
32992-33019 uart: tx-data-bit: "0"
32784-33019 uart: tx-data: "48"
33018-33045 uart: tx-stop: "Stop bit" "Stop" "T"
33301-33328 uart: tx-start: "Start bit" "Start" "S"
33327-33354 uart: tx-data-bit: "1"
33353-33380 uart: tx-data-bit: "0"
33379-33406 uart: tx-data-bit: "0"
33405-33432 uart: tx-data-bit: "0"
33431-33458 uart: tx-data-bit: "1"
33457-33484 uart: tx-data-bit: "1"
33483-33510 uart: tx-data-bit: "0"
33509-33536 uart: tx-data-bit: "0"
33535-33562 uart: tx-data-bit: "0"
33327-33562 uart: tx-data: "49"
33561-33588 uart: tx-stop: "Stop bit" "Stop" "T"
33845-33872 uart: tx-start: "Start bit" "Start" "S"
33871-33898 uart: tx-data-bit: "0"
33897-33924 uart: tx-data-bit: "1"
33923-33950 uart: tx-data-bit: "0"
33949-33976 uart: tx-data-bit: "0"
33975-34002 uart: tx-data-bit: "1"
34001-34028 uart: tx-data-bit: "1"
34027-34054 uart: tx-data-bit: "0"
34053-34080 uart: tx-data-bit: "0"
34079-34106 uart: tx-data-bit: "0"
33871-34106 uart: tx-data: "50"
34105-34132 uart: tx-stop: "Stop bit" "Stop" "T"
34390-34417 uart: tx-start: "Start bit" "Start" "S"
34416-34443 uart: tx-data-bit: "1"
34442-34469 uart: tx-data-bit: "1"
34468-34495 uart: tx-data-bit: "0"
34494-34521 uart: tx-data-bit: "0"
34520-34547 uart: tx-data-bit: "1"
34546-34573 uart: tx-data-bit: "1"
34572-34599 uart: tx-data-bit: "0"
34598-34625 uart: tx-data-bit: "0"
34624-34651 uart: tx-data-bit: "0"
34416-34651 uart: tx-data: "51"
26239-34651 uart: tx-packet: "36 37 38 39 40 41 42 43 44 45 46 47 48 49 50 51"
34650-34677 uart: tx-stop: "Stop bit" "Stop" "T"
34934-34961 uart: tx-start: "Start bit" "Start" "S"
34960-34987 uart: tx-data-bit: "0"
34986-35013 uart: tx-data-bit: "0"
35012-35039 uart: tx-data-bit: "1"
35038-35065 uart: tx-data-bit: "0"
35064-35091 uart: tx-data-bit: "1"
35090-35117 uart: tx-data-bit: "1"
35116-35143 uart: tx-data-bit: "0"
35142-35169 uart: tx-data-bit: "0"
35168-35195 uart: tx-data-bit: "0"
34960-35195 uart: tx-data: "52"
35194-35221 uart: tx-stop: "Stop bit" "Stop" "T"
35479-35506 uart: tx-start: "Start bit" "Start" "S"
35505-35532 uart: tx-data-bit: "1"
35531-35558 uart: tx-data-bit: "0"
35557-35584 uart: tx-data-bit: "1"
35583-35610 uart: tx-data-bit: "0"
35609-35636 uart: tx-data-bit: "1"
35635-35662 uart: tx-data-bit: "1"
35661-35688 uart: tx-data-bit: "0"
35687-35714 uart: tx-data-bit: "0"
35713-35740 uart: tx-data-bit: "0"
35505-35740 uart: tx-data: "53"
35739-35766 uart: tx-stop: "Stop bit" "Stop" "T"
36026-36053 uart: tx-start: "Start bit" "Start" "S"
36052-36079 uart: tx-data-bit: "0"
36078-36105 uart: tx-data-bit: "1"
36104-36131 uart: tx-data-bit: "1"
36130-36157 uart: tx-data-bit: "0"
36156-36183 uart: tx-data-bit: "1"
36182-36209 uart: tx-data-bit: "1"
36208-36235 uart: tx-data-bit: "0"
36234-36261 uart: tx-data-bit: "0"
36260-36287 uart: tx-data-bit: "0"
36052-36287 uart: tx-data: "54"
36286-36313 uart: tx-stop: "Stop bit" "Stop" "T"
36570-36597 uart: tx-start: "Start bit" "Start" "S"
36596-36623 uart: tx-data-bit: "1"
36622-36649 uart: tx-data-bit: "1"
36648-36675 uart: tx-data-bit: "1"
36674-36701 uart: tx-data-bit: "0"
36700-36727 uart: tx-data-bit: "1"
36726-36753 uart: tx-data-bit: "1"
36752-36779 uart: tx-data-bit: "0"
36778-36805 uart: tx-data-bit: "0"
36804-36831 uart: tx-data-bit: "0"
36596-36831 uart: tx-data: "55"
36830-36857 uart: tx-stop: "Stop bit" "Stop" "T"
37115-37142 uart: tx-start: "Start bit" "Start" "S"
37141-37168 uart: tx-data-bit: "0"
37167-37194 uart: tx-data-bit: "0"
37193-37220 uart: tx-data-bit: "0"
37219-37246 uart: tx-data-bit: "1"
37245-37272 uart: tx-data-bit: "1"
37271-37298 uart: tx-data-bit: "1"
37297-37324 uart: tx-data-bit: "0"
37323-37350 uart: tx-data-bit: "0"
37349-37376 uart: tx-data-bit: "0"
37141-37376 uart: tx-data: "56"
37375-37402 uart: tx-stop: "Stop bit" "Stop" "T"
37657-37684 uart: tx-start: "Start bit" "Start" "S"
37683-37710 uart: tx-data-bit: "1"
37709-37736 uart: tx-data-bit: "0"
37735-37762 uart: tx-data-bit: "0"
37761-37788 uart: tx-data-bit: "1"
37787-37814 uart: tx-data-bit: "1"
37813-37840 uart: tx-data-bit: "1"
37839-37866 uart: tx-data-bit: "0"
37865-37892 uart: tx-data-bit: "0"
37891-37918 uart: tx-data-bit: "0"
37683-37918 uart: tx-data: "57"
37917-37944 uart: tx-stop: "Stop bit" "Stop" "T"
38202-38229 uart: tx-start: "Start bit" "Start" "S"
38228-38255 uart: tx-data-bit: "0"
38254-38281 uart: tx-data-bit: "1"
38280-38307 uart: tx-data-bit: "0"
38306-38333 uart: tx-data-bit: "1"
38332-38359 uart: tx-data-bit: "1"
38358-38385 uart: tx-data-bit: "1"
38384-38411 uart: tx-data-bit: "0"
38410-38437 uart: tx-data-bit: "0"
38436-38463 uart: tx-data-bit: "0"
38228-38463 uart: tx-data: "58"
38462-38489 uart: tx-stop: "Stop bit" "Stop" "T"
38746-38773 uart: tx-start: "Start bit" "Start" "S"
38772-38799 uart: tx-data-bit: "1"
38798-38825 uart: tx-data-bit: "1"
38824-38851 uart: tx-data-bit: "0"
38850-38877 uart: tx-data-bit: "1"
38876-38903 uart: tx-data-bit: "1"
38902-38929 uart: tx-data-bit: "1"
38928-38955 uart: tx-data-bit: "0"
38954-38981 uart: tx-data-bit: "0"
38980-39007 uart: tx-data-bit: "0"
38772-39007 uart: tx-data: "59"
39006-39033 uart: tx-stop: "Stop bit" "Stop" "T"
39291-39318 uart: tx-start: "Start bit" "Start" "S"
39317-39344 uart: tx-data-bit: "0"
39343-39370 uart: tx-data-bit: "0"
39369-39396 uart: tx-data-bit: "1"
39395-39422 uart: tx-data-bit: "1"
39421-39448 uart: tx-data-bit: "1"
39447-39474 uart: tx-data-bit: "1"
39473-39500 uart: tx-data-bit: "0"
39499-39526 uart: tx-data-bit: "0"
39525-39552 uart: tx-data-bit: "0"
39317-39552 uart: tx-data: "60"
39551-39578 uart: tx-stop: "Stop bit" "Stop" "T"
39834-39861 uart: tx-start: "Start bit" "Start" "S"
39860-39887 uart: tx-data-bit: "1"
39886-39913 uart: tx-data-bit: "0"
39912-39939 uart: tx-data-bit: "1"
39938-39965 uart: tx-data-bit: "1"
39964-39991 uart: tx-data-bit: "1"
39990-40017 uart: tx-data-bit: "1"
40016-40043 uart: tx-data-bit: "0"
40042-40069 uart: tx-data-bit: "0"
40068-40095 uart: tx-data-bit: "0"
39860-40095 uart: tx-data: "61"
40094-40121 uart: tx-stop: "Stop bit" "Stop" "T"
40378-40405 uart: tx-start: "Start bit" "Start" "S"
40404-40431 uart: tx-data-bit: "0"
40430-40457 uart: tx-data-bit: "1"
40456-40483 uart: tx-data-bit: "1"
40482-40509 uart: tx-data-bit: "1"
40508-40535 uart: tx-data-bit: "1"
40534-40561 uart: tx-data-bit: "1"
40560-40587 uart: tx-data-bit: "0"
40586-40613 uart: tx-data-bit: "0"
40612-40639 uart: tx-data-bit: "0"
40404-40639 uart: tx-data: "62"
40638-40665 uart: tx-stop: "Stop bit" "Stop" "T"
40921-40948 uart: tx-start: "Start bit" "Start" "S"
40947-40974 uart: tx-data-bit: "1"
40973-41000 uart: tx-data-bit: "1"
40999-41026 uart: tx-data-bit: "1"
41025-41052 uart: tx-data-bit: "1"
41051-41078 uart: tx-data-bit: "1"
41077-41104 uart: tx-data-bit: "1"
41103-41130 uart: tx-data-bit: "0"
41129-41156 uart: tx-data-bit: "0"
41155-41182 uart: tx-data-bit: "0"
40947-41182 uart: tx-data: "63"
41181-41208 uart: tx-stop: "Stop bit" "Stop" "T"
41463-41490 uart: tx-start: "Start bit" "Start" "S"
41489-41516 uart: tx-data-bit: "0"
41515-41542 uart: tx-data-bit: "0"
41541-41568 uart: tx-data-bit: "0"
41567-41594 uart: tx-data-bit: "0"
41593-41620 uart: tx-data-bit: "0"
41619-41646 uart: tx-data-bit: "0"
41645-41672 uart: tx-data-bit: "1"
41671-41698 uart: tx-data-bit: "0"
41697-41724 uart: tx-data-bit: "0"
41489-41724 uart: tx-data: "64"
41723-41750 uart: tx-stop: "Stop bit" "Stop" "T"
42006-42033 uart: tx-start: "Start bit" "Start" "S"
42032-42059 uart: tx-data-bit: "1"
42058-42085 uart: tx-data-bit: "0"
42084-42111 uart: tx-data-bit: "0"
42110-42137 uart: tx-data-bit: "0"
42136-42163 uart: tx-data-bit: "0"
42162-42189 uart: tx-data-bit: "0"
42188-42215 uart: tx-data-bit: "1"
42214-42241 uart: tx-data-bit: "0"
42240-42267 uart: tx-data-bit: "0"
42032-42267 uart: tx-data: "65"
42266-42293 uart: tx-stop: "Stop bit" "Stop" "T"
42550-42577 uart: tx-start: "Start bit" "Start" "S"
42576-42603 uart: tx-data-bit: "0"
42602-42629 uart: tx-data-bit: "1"
42628-42655 uart: tx-data-bit: "0"
42654-42681 uart: tx-data-bit: "0"
42680-42707 uart: tx-data-bit: "0"
42706-42733 uart: tx-data-bit: "0"
42732-42759 uart: tx-data-bit: "1"
42758-42785 uart: tx-data-bit: "0"
42784-42811 uart: tx-data-bit: "0"
42576-42811 uart: tx-data: "66"
42810-42837 uart: tx-stop: "Stop bit" "Stop" "T"
43095-43122 uart: tx-start: "Start bit" "Start" "S"
43121-43148 uart: tx-data-bit: "1"
43147-43174 uart: tx-data-bit: "1"
43173-43200 uart: tx-data-bit: "0"
43199-43226 uart: tx-data-bit: "0"
43225-43252 uart: tx-data-bit: "0"
43251-43278 uart: tx-data-bit: "0"
43277-43304 uart: tx-data-bit: "1"
43303-43330 uart: tx-data-bit: "0"
43329-43356 uart: tx-data-bit: "0"
43121-43356 uart: tx-data: "67"
34960-43356 uart: tx-packet: "52 53 54 55 56 57 58 59 60 61 62 63 64 65 66 67"
43355-43382 uart: tx-stop: "Stop bit" "Stop" "T"
43640-43667 uart: tx-start: "Start bit" "Start" "S"
43666-43693 uart: tx-data-bit: "0"
43692-43719 uart: tx-data-bit: "0"
43718-43745 uart: tx-data-bit: "1"
43744-43771 uart: tx-data-bit: "0"
43770-43797 uart: tx-data-bit: "0"
43796-43823 uart: tx-data-bit: "0"
43822-43849 uart: tx-data-bit: "1"
43848-43875 uart: tx-data-bit: "0"
43874-43901 uart: tx-data-bit: "0"
43666-43901 uart: tx-data: "68"
43900-43927 uart: tx-stop: "Stop bit" "Stop" "T"
44184-44211 uart: tx-start: "Start bit" "Start" "S"
44210-44237 uart: tx-data-bit: "1"
44236-44263 uart: tx-data-bit: "0"
44262-44289 uart: tx-data-bit: "1"
44288-44315 uart: tx-data-bit: "0"
44314-44341 uart: tx-data-bit: "0"
44340-44367 uart: tx-data-bit: "0"
44366-44393 uart: tx-data-bit: "1"
44392-44419 uart: tx-data-bit: "0"
44418-44445 uart: tx-data-bit: "0"
44210-44445 uart: tx-data: "69"
44444-44471 uart: tx-stop: "Stop bit" "Stop" "T"
44731-44758 uart: tx-start: "Start bit" "Start" "S"
44757-44784 uart: tx-data-bit: "0"
44783-44810 uart: tx-data-bit: "1"
44809-44836 uart: tx-data-bit: "1"
44835-44862 uart: tx-data-bit: "0"
44861-44888 uart: tx-data-bit: "0"
44887-44914 uart: tx-data-bit: "0"
44913-44940 uart: tx-data-bit: "1"
44939-44966 uart: tx-data-bit: "0"
44965-44992 uart: tx-data-bit: "0"
44757-44992 uart: tx-data: "70"
44991-45018 uart: tx-stop: "Stop bit" "Stop" "T"
45275-45302 uart: tx-start: "Start bit" "Start" "S"
45301-45328 uart: tx-data-bit: "1"
45327-45354 uart: tx-data-bit: "1"
45353-45380 uart: tx-data-bit: "1"
45379-45406 uart: tx-data-bit: "0"
45405-45432 uart: tx-data-bit: "0"
45431-45458 uart: tx-data-bit: "0"
45457-45484 uart: tx-data-bit: "1"
45483-45510 uart: tx-data-bit: "0"
45509-45536 uart: tx-data-bit: "0"
45301-45536 uart: tx-data: "71"
45535-45562 uart: tx-stop: "Stop bit" "Stop" "T"
45820-45847 uart: tx-start: "Start bit" "Start" "S"
45846-45873 uart: tx-data-bit: "0"
45872-45899 uart: tx-data-bit: "0"
45898-45925 uart: tx-data-bit: "0"
45924-45951 uart: tx-data-bit: "1"
45950-45977 uart: tx-data-bit: "0"
45976-46003 uart: tx-data-bit: "0"
46002-46029 uart: tx-data-bit: "1"
46028-46055 uart: tx-data-bit: "0"
46054-46081 uart: tx-data-bit: "0"
45846-46081 uart: tx-data: "72"
46080-46107 uart: tx-stop: "Stop bit" "Stop" "T"
46364-46391 uart: tx-start: "Start bit" "Start" "S"
46390-46417 uart: tx-data-bit: "1"
46416-46443 uart: tx-data-bit: "0"
46442-46469 uart: tx-data-bit: "0"
46468-46495 uart: tx-data-bit: "1"
46494-46521 uart: tx-data-bit: "0"
46520-46547 uart: tx-data-bit: "0"
46546-46573 uart: tx-data-bit: "1"
46572-46599 uart: tx-data-bit: "0"
46598-46625 uart: tx-data-bit: "0"
46390-46625 uart: tx-data: "73"
46624-46651 uart: tx-stop: "Stop bit" "Stop" "T"
46911-46938 uart: tx-start: "Start bit" "Start" "S"
46937-46964 uart: tx-data-bit: "0"
46963-46990 uart: tx-data-bit: "1"
46989-47016 uart: tx-data-bit: "0"
47015-47042 uart: tx-data-bit: "1"
47041-47068 uart: tx-data-bit: "0"
47067-47094 uart: tx-data-bit: "0"
47093-47120 uart: tx-data-bit: "1"
47119-47146 uart: tx-data-bit: "0"
47145-47172 uart: tx-data-bit: "0"
46937-47172 uart: tx-data: "74"
47171-47198 uart: tx-stop: "Stop bit" "Stop" "T"
47458-47485 uart: tx-start: "Start bit" "Start" "S"
47484-47511 uart: tx-data-bit: "1"
47510-47537 uart: tx-data-bit: "1"
47536-47563 uart: tx-data-bit: "0"
47562-47589 uart: tx-data-bit: "1"
47588-47615 uart: tx-data-bit: "0"
47614-47641 uart: tx-data-bit: "0"
47640-47667 uart: tx-data-bit: "1"
47666-47693 uart: tx-data-bit: "0"
47692-47719 uart: tx-data-bit: "0"
47484-47719 uart: tx-data: "75"
47718-47745 uart: tx-stop: "Stop bit" "Stop" "T"
48004-48031 uart: tx-start: "Start bit" "Start" "S"
48030-48057 uart: tx-data-bit: "0"
48056-48083 uart: tx-data-bit: "0"
48082-48109 uart: tx-data-bit: "1"
48108-48135 uart: tx-data-bit: "1"
48134-48161 uart: tx-data-bit: "0"
48160-48187 uart: tx-data-bit: "0"
48186-48213 uart: tx-data-bit: "1"
48212-48239 uart: tx-data-bit: "0"
48238-48265 uart: tx-data-bit: "0"
48030-48265 uart: tx-data: "76"
48264-48291 uart: tx-stop: "Stop bit" "Stop" "T"
48549-48576 uart: tx-start: "Start bit" "Start" "S"
48575-48602 uart: tx-data-bit: "1"
48601-48628 uart: tx-data-bit: "0"
48627-48654 uart: tx-data-bit: "1"
48653-48680 uart: tx-data-bit: "1"
48679-48706 uart: tx-data-bit: "0"
48705-48732 uart: tx-data-bit: "0"
48731-48758 uart: tx-data-bit: "1"
48757-48784 uart: tx-data-bit: "0"
48783-48810 uart: tx-data-bit: "0"
48575-48810 uart: tx-data: "77"
48809-48836 uart: tx-stop: "Stop bit" "Stop" "T"
49095-49122 uart: tx-start: "Start bit" "Start" "S"
49121-49148 uart: tx-data-bit: "0"
49147-49174 uart: tx-data-bit: "1"
49173-49200 uart: tx-data-bit: "1"
49199-49226 uart: tx-data-bit: "1"
49225-49252 uart: tx-data-bit: "0"
49251-49278 uart: tx-data-bit: "0"
49277-49304 uart: tx-data-bit: "1"
49303-49330 uart: tx-data-bit: "0"
49329-49356 uart: tx-data-bit: "0"
49121-49356 uart: tx-data: "78"
49355-49382 uart: tx-stop: "Stop bit" "Stop" "T"
49640-49667 uart: tx-start: "Start bit" "Start" "S"
49666-49693 uart: tx-data-bit: "1"
49692-49719 uart: tx-data-bit: "1"
49718-49745 uart: tx-data-bit: "1"
49744-49771 uart: tx-data-bit: "1"
49770-49797 uart: tx-data-bit: "0"
49796-49823 uart: tx-data-bit: "0"
49822-49849 uart: tx-data-bit: "1"
49848-49875 uart: tx-data-bit: "0"
49874-49901 uart: tx-data-bit: "0"
49666-49901 uart: tx-data: "79"
49900-49927 uart: tx-stop: "Stop bit" "Stop" "T"
50184-50211 uart: tx-start: "Start bit" "Start" "S"
50210-50237 uart: tx-data-bit: "0"
50236-50263 uart: tx-data-bit: "0"
50262-50289 uart: tx-data-bit: "0"
50288-50315 uart: tx-data-bit: "0"
50314-50341 uart: tx-data-bit: "1"
50340-50367 uart: tx-data-bit: "0"
50366-50393 uart: tx-data-bit: "1"
50392-50419 uart: tx-data-bit: "0"
50418-50445 uart: tx-data-bit: "0"
50210-50445 uart: tx-data: "80"
50444-50471 uart: tx-stop: "Stop bit" "Stop" "T"
50729-50756 uart: tx-start: "Start bit" "Start" "S"
50755-50782 uart: tx-data-bit: "1"
50781-50808 uart: tx-data-bit: "0"
50807-50834 uart: tx-data-bit: "0"
50833-50860 uart: tx-data-bit: "0"
50859-50886 uart: tx-data-bit: "1"
50885-50912 uart: tx-data-bit: "0"
50911-50938 uart: tx-data-bit: "1"
50937-50964 uart: tx-data-bit: "0"
50963-50990 uart: tx-data-bit: "0"
50755-50990 uart: tx-data: "81"
50989-51016 uart: tx-stop: "Stop bit" "Stop" "T"
51276-51303 uart: tx-start: "Start bit" "Start" "S"
51302-51329 uart: tx-data-bit: "0"
51328-51355 uart: tx-data-bit: "1"
51354-51381 uart: tx-data-bit: "0"
51380-51407 uart: tx-data-bit: "0"
51406-51433 uart: tx-data-bit: "1"
51432-51459 uart: tx-data-bit: "0"
51458-51485 uart: tx-data-bit: "1"
51484-51511 uart: tx-data-bit: "0"
51510-51537 uart: tx-data-bit: "0"
51302-51537 uart: tx-data: "82"
51536-51563 uart: tx-stop: "Stop bit" "Stop" "T"
51822-51849 uart: tx-start: "Start bit" "Start" "S"
51848-51875 uart: tx-data-bit: "1"
51874-51901 uart: tx-data-bit: "1"
51900-51927 uart: tx-data-bit: "0"
51926-51953 uart: tx-data-bit: "0"
51952-51979 uart: tx-data-bit: "1"
51978-52005 uart: tx-data-bit: "0"
52004-52031 uart: tx-data-bit: "1"
52030-52057 uart: tx-data-bit: "0"
52056-52083 uart: tx-data-bit: "0"
51848-52083 uart: tx-data: "83"
43666-52083 uart: tx-packet: "68 69 70 71 72 73 74 75 76 77 78 79 80 81 82 83"
52082-52109 uart: tx-stop: "Stop bit" "Stop" "T"
52369-52396 uart: tx-start: "Start bit" "Start" "S"
52395-52422 uart: tx-data-bit: "0"
52421-52448 uart: tx-data-bit: "0"
52447-52474 uart: tx-data-bit: "1"
52473-52500 uart: tx-data-bit: "0"
52499-52526 uart: tx-data-bit: "1"
52525-52552 uart: tx-data-bit: "0"
52551-52578 uart: tx-data-bit: "1"
52577-52604 uart: tx-data-bit: "0"
52603-52630 uart: tx-data-bit: "0"
52395-52630 uart: tx-data: "84"
52629-52656 uart: tx-stop: "Stop bit" "Stop" "T"
52915-52942 uart: tx-start: "Start bit" "Start" "S"
52941-52968 uart: tx-data-bit: "1"
52967-52994 uart: tx-data-bit: "0"
52993-53020 uart: tx-data-bit: "1"
53019-53046 uart: tx-data-bit: "0"
53045-53072 uart: tx-data-bit: "1"
53071-53098 uart: tx-data-bit: "0"
53097-53124 uart: tx-data-bit: "1"
53123-53150 uart: tx-data-bit: "0"
53149-53176 uart: tx-data-bit: "0"
52941-53176 uart: tx-data: "85"
53175-53202 uart: tx-stop: "Stop bit" "Stop" "T"
53464-53491 uart: tx-start: "Start bit" "Start" "S"
53490-53517 uart: tx-data-bit: "0"
53516-53543 uart: tx-data-bit: "1"
53542-53569 uart: tx-data-bit: "1"
53568-53595 uart: tx-data-bit: "0"
53594-53621 uart: tx-data-bit: "1"
53620-53647 uart: tx-data-bit: "0"
53646-53673 uart: tx-data-bit: "1"
53672-53699 uart: tx-data-bit: "0"
53698-53725 uart: tx-data-bit: "0"
53490-53725 uart: tx-data: "86"
53724-53751 uart: tx-stop: "Stop bit" "Stop" "T"
54010-54037 uart: tx-start: "Start bit" "Start" "S"
54036-54063 uart: tx-data-bit: "1"
54062-54089 uart: tx-data-bit: "1"
54088-54115 uart: tx-data-bit: "1"
54114-54141 uart: tx-data-bit: "0"
54140-54167 uart: tx-data-bit: "1"
54166-54193 uart: tx-data-bit: "0"
54192-54219 uart: tx-data-bit: "1"
54218-54245 uart: tx-data-bit: "0"
54244-54271 uart: tx-data-bit: "0"
54036-54271 uart: tx-data: "87"
54270-54297 uart: tx-stop: "Stop bit" "Stop" "T"
54557-54584 uart: tx-start: "Start bit" "Start" "S"
54583-54610 uart: tx-data-bit: "0"
54609-54636 uart: tx-data-bit: "0"
54635-54662 uart: tx-data-bit: "0"
54661-54688 uart: tx-data-bit: "1"
54687-54714 uart: tx-data-bit: "1"
54713-54740 uart: tx-data-bit: "0"
54739-54766 uart: tx-data-bit: "1"
54765-54792 uart: tx-data-bit: "0"
54791-54818 uart: tx-data-bit: "0"
54583-54818 uart: tx-data: "88"
54817-54844 uart: tx-stop: "Stop bit" "Stop" "T"
55102-55129 uart: tx-start: "Start bit" "Start" "S"
55128-55155 uart: tx-data-bit: "1"
55154-55181 uart: tx-data-bit: "0"
55180-55207 uart: tx-data-bit: "0"
55206-55233 uart: tx-data-bit: "1"
55232-55259 uart: tx-data-bit: "1"
55258-55285 uart: tx-data-bit: "0"
55284-55311 uart: tx-data-bit: "1"
55310-55337 uart: tx-data-bit: "0"
55336-55363 uart: tx-data-bit: "0"
55128-55363 uart: tx-data: "89"
55362-55389 uart: tx-stop: "Stop bit" "Stop" "T"
55648-55675 uart: tx-start: "Start bit" "Start" "S"
55674-55701 uart: tx-data-bit: "0"
55700-55727 uart: tx-data-bit: "1"
55726-55753 uart: tx-data-bit: "0"
55752-55779 uart: tx-data-bit: "1"
55778-55805 uart: tx-data-bit: "1"
55804-55831 uart: tx-data-bit: "0"
55830-55857 uart: tx-data-bit: "1"
55856-55883 uart: tx-data-bit: "0"
55882-55909 uart: tx-data-bit: "0"
55674-55909 uart: tx-data: "90"
55908-55935 uart: tx-stop: "Stop bit" "Stop" "T"
56195-56222 uart: tx-start: "Start bit" "Start" "S"
56221-56248 uart: tx-data-bit: "1"
56247-56274 uart: tx-data-bit: "1"
56273-56300 uart: tx-data-bit: "0"
56299-56326 uart: tx-data-bit: "1"
56325-56352 uart: tx-data-bit: "1"
56351-56378 uart: tx-data-bit: "0"
56377-56404 uart: tx-data-bit: "1"
56403-56430 uart: tx-data-bit: "0"
56429-56456 uart: tx-data-bit: "0"
56221-56456 uart: tx-data: "91"
56455-56482 uart: tx-stop: "Stop bit" "Stop" "T"
56741-56768 uart: tx-start: "Start bit" "Start" "S"
56767-56794 uart: tx-data-bit: "0"
56793-56820 uart: tx-data-bit: "0"
56819-56846 uart: tx-data-bit: "1"
56845-56872 uart: tx-data-bit: "1"
56871-56898 uart: tx-data-bit: "1"
56897-56924 uart: tx-data-bit: "0"
56923-56950 uart: tx-data-bit: "1"
56949-56976 uart: tx-data-bit: "0"
56975-57002 uart: tx-data-bit: "0"
56767-57002 uart: tx-data: "92"
57001-57028 uart: tx-stop: "Stop bit" "Stop" "T"
57286-57313 uart: tx-start: "Start bit" "Start" "S"
57312-57339 uart: tx-data-bit: "1"
57338-57365 uart: tx-data-bit: "0"
57364-57391 uart: tx-data-bit: "1"
57390-57417 uart: tx-data-bit: "1"
57416-57443 uart: tx-data-bit: "1"
57442-57469 uart: tx-data-bit: "0"
57468-57495 uart: tx-data-bit: "1"
57494-57521 uart: tx-data-bit: "0"
57520-57547 uart: tx-data-bit: "0"
57312-57547 uart: tx-data: "93"
57546-57573 uart: tx-stop: "Stop bit" "Stop" "T"
57832-57859 uart: tx-start: "Start bit" "Start" "S"
57858-57885 uart: tx-data-bit: "0"
57884-57911 uart: tx-data-bit: "1"
57910-57937 uart: tx-data-bit: "1"
57936-57963 uart: tx-data-bit: "1"
57962-57989 uart: tx-data-bit: "1"
57988-58015 uart: tx-data-bit: "0"
58014-58041 uart: tx-data-bit: "1"
58040-58067 uart: tx-data-bit: "0"
58066-58093 uart: tx-data-bit: "0"
57858-58093 uart: tx-data: "94"
58092-58119 uart: tx-stop: "Stop bit" "Stop" "T"
58377-58404 uart: tx-start: "Start bit" "Start" "S"
58403-58430 uart: tx-data-bit: "1"
58429-58456 uart: tx-data-bit: "1"
58455-58482 uart: tx-data-bit: "1"
58481-58508 uart: tx-data-bit: "1"
58507-58534 uart: tx-data-bit: "1"
58533-58560 uart: tx-data-bit: "0"
58559-58586 uart: tx-data-bit: "1"
58585-58612 uart: tx-data-bit: "0"
58611-58638 uart: tx-data-bit: "0"
58403-58638 uart: tx-data: "95"
58637-58664 uart: tx-stop: "Stop bit" "Stop" "T"
58922-58949 uart: tx-start: "Start bit" "Start" "S"
58948-58975 uart: tx-data-bit: "0"
58974-59001 uart: tx-data-bit: "0"
59000-59027 uart: tx-data-bit: "0"
59026-59053 uart: tx-data-bit: "0"
59052-59079 uart: tx-data-bit: "0"
59078-59105 uart: tx-data-bit: "1"
59104-59131 uart: tx-data-bit: "1"
59130-59157 uart: tx-data-bit: "0"
59156-59183 uart: tx-data-bit: "0"
58948-59183 uart: tx-data: "96"
59182-59209 uart: tx-stop: "Stop bit" "Stop" "T"
59464-59491 uart: tx-start: "Start bit" "Start" "S"
59490-59517 uart: tx-data-bit: "1"
59516-59543 uart: tx-data-bit: "0"
59542-59569 uart: tx-data-bit: "0"
59568-59595 uart: tx-data-bit: "0"
59594-59621 uart: tx-data-bit: "0"
59620-59647 uart: tx-data-bit: "1"
59646-59673 uart: tx-data-bit: "1"
59672-59699 uart: tx-data-bit: "0"
59698-59725 uart: tx-data-bit: "0"
59490-59725 uart: tx-data: "97"
59724-59751 uart: tx-stop: "Stop bit" "Stop" "T"
60009-60036 uart: tx-start: "Start bit" "Start" "S"
60035-60062 uart: tx-data-bit: "0"
60061-60088 uart: tx-data-bit: "1"
60087-60114 uart: tx-data-bit: "0"
60113-60140 uart: tx-data-bit: "0"
60139-60166 uart: tx-data-bit: "0"
60165-60192 uart: tx-data-bit: "1"
60191-60218 uart: tx-data-bit: "1"
60217-60244 uart: tx-data-bit: "0"
60243-60270 uart: tx-data-bit: "0"
60035-60270 uart: tx-data: "98"
60269-60296 uart: tx-stop: "Stop bit" "Stop" "T"
60553-60580 uart: tx-start: "Start bit" "Start" "S"
60579-60606 uart: tx-data-bit: "1"
60605-60632 uart: tx-data-bit: "1"
60631-60658 uart: tx-data-bit: "0"
60657-60684 uart: tx-data-bit: "0"
60683-60710 uart: tx-data-bit: "0"
60709-60736 uart: tx-data-bit: "1"
60735-60762 uart: tx-data-bit: "1"
60761-60788 uart: tx-data-bit: "0"
60787-60814 uart: tx-data-bit: "0"
60579-60814 uart: tx-data: "99"
52395-60814 uart: tx-packet: "84 85 86 87 88 89 90 91 92 93 94 95 96 97 98 99"
60813-60840 uart: tx-stop: "Stop bit" "Stop" "T"
61098-61125 uart: tx-start: "Start bit" "Start" "S"
61124-61151 uart: tx-data-bit: "0"
61150-61177 uart: tx-data-bit: "0"
61176-61203 uart: tx-data-bit: "1"
61202-61229 uart: tx-data-bit: "0"
61228-61255 uart: tx-data-bit: "0"
61254-61281 uart: tx-data-bit: "1"
61280-61307 uart: tx-data-bit: "1"
61306-61333 uart: tx-data-bit: "0"
61332-61359 uart: tx-data-bit: "0"
61124-61359 uart: tx-data: "100"
61358-61385 uart: tx-stop: "Stop bit" "Stop" "T"
61642-61669 uart: tx-start: "Start bit" "Start" "S"
61668-61695 uart: tx-data-bit: "1"
61694-61721 uart: tx-data-bit: "0"
61720-61747 uart: tx-data-bit: "1"
61746-61773 uart: tx-data-bit: "0"
61772-61799 uart: tx-data-bit: "0"
61798-61825 uart: tx-data-bit: "1"
61824-61851 uart: tx-data-bit: "1"
61850-61877 uart: tx-data-bit: "0"
61876-61903 uart: tx-data-bit: "0"
61668-61903 uart: tx-data: "101"
61902-61929 uart: tx-stop: "Stop bit" "Stop" "T"
62189-62216 uart: tx-start: "Start bit" "Start" "S"
62215-62242 uart: tx-data-bit: "0"
62241-62268 uart: tx-data-bit: "1"
62267-62294 uart: tx-data-bit: "1"
62293-62320 uart: tx-data-bit: "0"
62319-62346 uart: tx-data-bit: "0"
62345-62372 uart: tx-data-bit: "1"
62371-62398 uart: tx-data-bit: "1"
62397-62424 uart: tx-data-bit: "0"
62423-62450 uart: tx-data-bit: "0"
62215-62450 uart: tx-data: "102"
62449-62476 uart: tx-stop: "Stop bit" "Stop" "T"
62733-62760 uart: tx-start: "Start bit" "Start" "S"
62759-62786 uart: tx-data-bit: "1"
62785-62812 uart: tx-data-bit: "1"
62811-62838 uart: tx-data-bit: "1"
62837-62864 uart: tx-data-bit: "0"
62863-62890 uart: tx-data-bit: "0"
62889-62916 uart: tx-data-bit: "1"
62915-62942 uart: tx-data-bit: "1"
62941-62968 uart: tx-data-bit: "0"
62967-62994 uart: tx-data-bit: "0"
62759-62994 uart: tx-data: "103"
62993-63020 uart: tx-stop: "Stop bit" "Stop" "T"
63278-63305 uart: tx-start: "Start bit" "Start" "S"
63304-63331 uart: tx-data-bit: "0"
63330-63357 uart: tx-data-bit: "0"
63356-63383 uart: tx-data-bit: "0"
63382-63409 uart: tx-data-bit: "1"
63408-63435 uart: tx-data-bit: "0"
63434-63461 uart: tx-data-bit: "1"
63460-63487 uart: tx-data-bit: "1"
63486-63513 uart: tx-data-bit: "0"
63512-63539 uart: tx-data-bit: "0"
63304-63539 uart: tx-data: "104"
63538-63565 uart: tx-stop: "Stop bit" "Stop" "T"
63823-63850 uart: tx-start: "Start bit" "Start" "S"
63849-63876 uart: tx-data-bit: "1"
63875-63902 uart: tx-data-bit: "0"
63901-63928 uart: tx-data-bit: "0"
63927-63954 uart: tx-data-bit: "1"
63953-63980 uart: tx-data-bit: "0"
63979-64006 uart: tx-data-bit: "1"
64005-64032 uart: tx-data-bit: "1"
64031-64058 uart: tx-data-bit: "0"
64057-64084 uart: tx-data-bit: "0"
63849-64084 uart: tx-data: "105"
64083-64110 uart: tx-stop: "Stop bit" "Stop" "T"
64369-64396 uart: tx-start: "Start bit" "Start" "S"
64395-64422 uart: tx-data-bit: "0"
64421-64448 uart: tx-data-bit: "1"
64447-64474 uart: tx-data-bit: "0"
64473-64500 uart: tx-data-bit: "1"
64499-64526 uart: tx-data-bit: "0"
64525-64552 uart: tx-data-bit: "1"
64551-64578 uart: tx-data-bit: "1"
64577-64604 uart: tx-data-bit: "0"
64603-64630 uart: tx-data-bit: "0"
64395-64630 uart: tx-data: "106"
64629-64656 uart: tx-stop: "Stop bit" "Stop" "T"
64916-64943 uart: tx-start: "Start bit" "Start" "S"
64942-64969 uart: tx-data-bit: "1"
64968-64995 uart: tx-data-bit: "1"
64994-65021 uart: tx-data-bit: "0"
65020-65047 uart: tx-data-bit: "1"
65046-65073 uart: tx-data-bit: "0"
65072-65099 uart: tx-data-bit: "1"
65098-65125 uart: tx-data-bit: "1"
65124-65151 uart: tx-data-bit: "0"
65150-65177 uart: tx-data-bit: "0"
64942-65177 uart: tx-data: "107"
65176-65203 uart: tx-stop: "Stop bit" "Stop" "T"
65462-65489 uart: tx-start: "Start bit" "Start" "S"
65488-65515 uart: tx-data-bit: "0"
65514-65541 uart: tx-data-bit: "0"
65540-65567 uart: tx-data-bit: "1"
65566-65593 uart: tx-data-bit: "1"
65592-65619 uart: tx-data-bit: "0"
65618-65645 uart: tx-data-bit: "1"
65644-65671 uart: tx-data-bit: "1"
65670-65697 uart: tx-data-bit: "0"
65696-65723 uart: tx-data-bit: "0"
65488-65723 uart: tx-data: "108"
65722-65749 uart: tx-stop: "Stop bit" "Stop" "T"
66007-66034 uart: tx-start: "Start bit" "Start" "S"
66033-66060 uart: tx-data-bit: "1"
66059-66086 uart: tx-data-bit: "0"
66085-66112 uart: tx-data-bit: "1"
66111-66138 uart: tx-data-bit: "1"
66137-66164 uart: tx-data-bit: "0"
66163-66190 uart: tx-data-bit: "1"
66189-66216 uart: tx-data-bit: "1"
66215-66242 uart: tx-data-bit: "0"
66241-66268 uart: tx-data-bit: "0"
66033-66268 uart: tx-data: "109"
66267-66294 uart: tx-stop: "Stop bit" "Stop" "T"
66553-66580 uart: tx-start: "Start bit" "Start" "S"
66579-66606 uart: tx-data-bit: "0"
66605-66632 uart: tx-data-bit: "1"
66631-66658 uart: tx-data-bit: "1"
66657-66684 uart: tx-data-bit: "1"
66683-66710 uart: tx-data-bit: "0"
66709-66736 uart: tx-data-bit: "1"
66735-66762 uart: tx-data-bit: "1"
66761-66788 uart: tx-data-bit: "0"
66787-66814 uart: tx-data-bit: "0"
66579-66814 uart: tx-data: "110"
66813-66840 uart: tx-stop: "Stop bit" "Stop" "T"
67098-67125 uart: tx-start: "Start bit" "Start" "S"
67124-67151 uart: tx-data-bit: "1"
67150-67177 uart: tx-data-bit: "1"
67176-67203 uart: tx-data-bit: "1"
67202-67229 uart: tx-data-bit: "1"
67228-67255 uart: tx-data-bit: "0"
67254-67281 uart: tx-data-bit: "1"
67280-67307 uart: tx-data-bit: "1"
67306-67333 uart: tx-data-bit: "0"
67332-67359 uart: tx-data-bit: "0"
67124-67359 uart: tx-data: "111"
67358-67385 uart: tx-stop: "Stop bit" "Stop" "T"
67643-67670 uart: tx-start: "Start bit" "Start" "S"
67669-67696 uart: tx-data-bit: "0"
67695-67722 uart: tx-data-bit: "0"
67721-67748 uart: tx-data-bit: "0"
67747-67774 uart: tx-data-bit: "0"
67773-67800 uart: tx-data-bit: "1"
67799-67826 uart: tx-data-bit: "1"
67825-67852 uart: tx-data-bit: "1"
67851-67878 uart: tx-data-bit: "0"
67877-67904 uart: tx-data-bit: "0"
67669-67904 uart: tx-data: "112"
67903-67930 uart: tx-stop: "Stop bit" "Stop" "T"
68185-68212 uart: tx-start: "Start bit" "Start" "S"
68211-68238 uart: tx-data-bit: "1"
68237-68264 uart: tx-data-bit: "0"
68263-68290 uart: tx-data-bit: "0"
68289-68316 uart: tx-data-bit: "0"
68315-68342 uart: tx-data-bit: "1"
68341-68368 uart: tx-data-bit: "1"
68367-68394 uart: tx-data-bit: "1"
68393-68420 uart: tx-data-bit: "0"
68419-68446 uart: tx-data-bit: "0"
68211-68446 uart: tx-data: "113"
68445-68472 uart: tx-stop: "Stop bit" "Stop" "T"
68730-68757 uart: tx-start: "Start bit" "Start" "S"
68756-68783 uart: tx-data-bit: "0"
68782-68809 uart: tx-data-bit: "1"
68808-68835 uart: tx-data-bit: "0"
68834-68861 uart: tx-data-bit: "0"
68860-68887 uart: tx-data-bit: "1"
68886-68913 uart: tx-data-bit: "1"
68912-68939 uart: tx-data-bit: "1"
68938-68965 uart: tx-data-bit: "0"
68964-68991 uart: tx-data-bit: "0"
68756-68991 uart: tx-data: "114"
68990-69017 uart: tx-stop: "Stop bit" "Stop" "T"
69274-69301 uart: tx-start: "Start bit" "Start" "S"
69300-69327 uart: tx-data-bit: "1"
69326-69353 uart: tx-data-bit: "1"
69352-69379 uart: tx-data-bit: "0"
69378-69405 uart: tx-data-bit: "0"
69404-69431 uart: tx-data-bit: "1"
69430-69457 uart: tx-data-bit: "1"
69456-69483 uart: tx-data-bit: "1"
69482-69509 uart: tx-data-bit: "0"
69508-69535 uart: tx-data-bit: "0"
69300-69535 uart: tx-data: "115"
61124-69535 uart: tx-packet: "100 101 102 103 104 105 106 107 108 109 110 111 112 113 114 115"
69534-69561 uart: tx-stop: "Stop bit" "Stop" "T"
69820-69847 uart: tx-start: "Start bit" "Start" "S"
69846-69873 uart: tx-data-bit: "0"
69872-69899 uart: tx-data-bit: "0"
69898-69925 uart: tx-data-bit: "1"
69924-69951 uart: tx-data-bit: "0"
69950-69977 uart: tx-data-bit: "1"
69976-70003 uart: tx-data-bit: "1"
70002-70029 uart: tx-data-bit: "1"
70028-70055 uart: tx-data-bit: "0"
70054-70081 uart: tx-data-bit: "0"
69846-70081 uart: tx-data: "116"
70080-70107 uart: tx-stop: "Stop bit" "Stop" "T"
70364-70391 uart: tx-start: "Start bit" "Start" "S"
70390-70417 uart: tx-data-bit: "1"
70416-70443 uart: tx-data-bit: "0"
70442-70469 uart: tx-data-bit: "1"
70468-70495 uart: tx-data-bit: "0"
70494-70521 uart: tx-data-bit: "1"
70520-70547 uart: tx-data-bit: "1"
70546-70573 uart: tx-data-bit: "1"
70572-70599 uart: tx-data-bit: "0"
70598-70625 uart: tx-data-bit: "0"
70390-70625 uart: tx-data: "117"
70624-70651 uart: tx-stop: "Stop bit" "Stop" "T"
70911-70938 uart: tx-start: "Start bit" "Start" "S"
70937-70964 uart: tx-data-bit: "0"
70963-70990 uart: tx-data-bit: "1"
70989-71016 uart: tx-data-bit: "1"
71015-71042 uart: tx-data-bit: "0"
71041-71068 uart: tx-data-bit: "1"
71067-71094 uart: tx-data-bit: "1"
71093-71120 uart: tx-data-bit: "1"
71119-71146 uart: tx-data-bit: "0"
71145-71172 uart: tx-data-bit: "0"
70937-71172 uart: tx-data: "118"
71171-71198 uart: tx-stop: "Stop bit" "Stop" "T"
71456-71483 uart: tx-start: "Start bit" "Start" "S"
71482-71509 uart: tx-data-bit: "1"
71508-71535 uart: tx-data-bit: "1"
71534-71561 uart: tx-data-bit: "1"
71560-71587 uart: tx-data-bit: "0"
71586-71613 uart: tx-data-bit: "1"
71612-71639 uart: tx-data-bit: "1"
71638-71665 uart: tx-data-bit: "1"
71664-71691 uart: tx-data-bit: "0"
71690-71717 uart: tx-data-bit: "0"
71482-71717 uart: tx-data: "119"
71716-71743 uart: tx-stop: "Stop bit" "Stop" "T"
72000-72027 uart: tx-start: "Start bit" "Start" "S"
72026-72053 uart: tx-data-bit: "0"
72052-72079 uart: tx-data-bit: "0"
72078-72105 uart: tx-data-bit: "0"
72104-72131 uart: tx-data-bit: "1"
72130-72157 uart: tx-data-bit: "1"
72156-72183 uart: tx-data-bit: "1"
72182-72209 uart: tx-data-bit: "1"
72208-72235 uart: tx-data-bit: "0"
72234-72261 uart: tx-data-bit: "0"
72026-72261 uart: tx-data: "120"
72260-72287 uart: tx-stop: "Stop bit" "Stop" "T"
72543-72570 uart: tx-start: "Start bit" "Start" "S"
72569-72596 uart: tx-data-bit: "1"
72595-72622 uart: tx-data-bit: "0"
72621-72648 uart: tx-data-bit: "0"
72647-72674 uart: tx-data-bit: "1"
72673-72700 uart: tx-data-bit: "1"
72699-72726 uart: tx-data-bit: "1"
72725-72752 uart: tx-data-bit: "1"
72751-72778 uart: tx-data-bit: "0"
72777-72804 uart: tx-data-bit: "0"
72569-72804 uart: tx-data: "121"
72803-72830 uart: tx-stop: "Stop bit" "Stop" "T"
73087-73114 uart: tx-start: "Start bit" "Start" "S"
73113-73140 uart: tx-data-bit: "0"
73139-73166 uart: tx-data-bit: "1"
73165-73192 uart: tx-data-bit: "0"
73191-73218 uart: tx-data-bit: "1"
73217-73244 uart: tx-data-bit: "1"
73243-73270 uart: tx-data-bit: "1"
73269-73296 uart: tx-data-bit: "1"
73295-73322 uart: tx-data-bit: "0"
73321-73348 uart: tx-data-bit: "0"
73113-73348 uart: tx-data: "122"
73347-73374 uart: tx-stop: "Stop bit" "Stop" "T"
73632-73659 uart: tx-start: "Start bit" "Start" "S"
73658-73685 uart: tx-data-bit: "1"
73684-73711 uart: tx-data-bit: "1"
73710-73737 uart: tx-data-bit: "0"
73736-73763 uart: tx-data-bit: "1"
73762-73789 uart: tx-data-bit: "1"
73788-73815 uart: tx-data-bit: "1"
73814-73841 uart: tx-data-bit: "1"
73840-73867 uart: tx-data-bit: "0"
73866-73893 uart: tx-data-bit: "0"
73658-73893 uart: tx-data: "123"
73892-73919 uart: tx-stop: "Stop bit" "Stop" "T"
74176-74203 uart: tx-start: "Start bit" "Start" "S"
74202-74229 uart: tx-data-bit: "0"
74228-74255 uart: tx-data-bit: "0"
74254-74281 uart: tx-data-bit: "1"
74280-74307 uart: tx-data-bit: "1"
74306-74333 uart: tx-data-bit: "1"
74332-74359 uart: tx-data-bit: "1"
74358-74385 uart: tx-data-bit: "1"
74384-74411 uart: tx-data-bit: "0"
74410-74437 uart: tx-data-bit: "0"
74202-74437 uart: tx-data: "124"
74436-74463 uart: tx-stop: "Stop bit" "Stop" "T"
74719-74746 uart: tx-start: "Start bit" "Start" "S"
74745-74772 uart: tx-data-bit: "1"
74771-74798 uart: tx-data-bit: "0"
74797-74824 uart: tx-data-bit: "1"
74823-74850 uart: tx-data-bit: "1"
74849-74876 uart: tx-data-bit: "1"
74875-74902 uart: tx-data-bit: "1"
74901-74928 uart: tx-data-bit: "1"
74927-74954 uart: tx-data-bit: "0"
74953-74980 uart: tx-data-bit: "0"
74745-74980 uart: tx-data: "125"
74979-75006 uart: tx-stop: "Stop bit" "Stop" "T"
75264-75291 uart: tx-start: "Start bit" "Start" "S"
75290-75317 uart: tx-data-bit: "0"
75316-75343 uart: tx-data-bit: "1"
75342-75369 uart: tx-data-bit: "1"
75368-75395 uart: tx-data-bit: "1"
75394-75421 uart: tx-data-bit: "1"
75420-75447 uart: tx-data-bit: "1"
75446-75473 uart: tx-data-bit: "1"
75472-75499 uart: tx-data-bit: "0"
75498-75525 uart: tx-data-bit: "0"
75290-75525 uart: tx-data: "126"
75524-75551 uart: tx-stop: "Stop bit" "Stop" "T"
75806-75833 uart: tx-start: "Start bit" "Start" "S"
75832-75859 uart: tx-data-bit: "1"
75858-75885 uart: tx-data-bit: "1"
75884-75911 uart: tx-data-bit: "1"
75910-75937 uart: tx-data-bit: "1"
75936-75963 uart: tx-data-bit: "1"
75962-75989 uart: tx-data-bit: "1"
75988-76015 uart: tx-data-bit: "1"
76014-76041 uart: tx-data-bit: "0"
76040-76067 uart: tx-data-bit: "0"
75832-76067 uart: tx-data: "127"
76066-76093 uart: tx-stop: "Stop bit" "Stop" "T"
76349-76376 uart: tx-start: "Start bit" "Start" "S"
76375-76402 uart: tx-data-bit: "0"
76401-76428 uart: tx-data-bit: "0"
76427-76454 uart: tx-data-bit: "0"
76453-76480 uart: tx-data-bit: "0"
76479-76506 uart: tx-data-bit: "0"
76505-76532 uart: tx-data-bit: "0"
76531-76558 uart: tx-data-bit: "0"
76557-76584 uart: tx-data-bit: "1"
76583-76610 uart: tx-data-bit: "0"
76375-76610 uart: tx-data: "128"
76609-76636 uart: tx-stop: "Stop bit" "Stop" "T"
76891-76918 uart: tx-start: "Start bit" "Start" "S"
76917-76944 uart: tx-data-bit: "1"
76943-76970 uart: tx-data-bit: "0"
76969-76996 uart: tx-data-bit: "0"
76995-77022 uart: tx-data-bit: "0"
77021-77048 uart: tx-data-bit: "0"
77047-77074 uart: tx-data-bit: "0"
77073-77100 uart: tx-data-bit: "0"
77099-77126 uart: tx-data-bit: "1"
77125-77152 uart: tx-data-bit: "0"
76917-77152 uart: tx-data: "129"
77151-77178 uart: tx-stop: "Stop bit" "Stop" "T"
77436-77463 uart: tx-start: "Start bit" "Start" "S"
77462-77489 uart: tx-data-bit: "0"
77488-77515 uart: tx-data-bit: "1"
77514-77541 uart: tx-data-bit: "0"
77540-77567 uart: tx-data-bit: "0"
77566-77593 uart: tx-data-bit: "0"
77592-77619 uart: tx-data-bit: "0"
77618-77645 uart: tx-data-bit: "0"
77644-77671 uart: tx-data-bit: "1"
77670-77697 uart: tx-data-bit: "0"
77462-77697 uart: tx-data: "130"
77696-77723 uart: tx-stop: "Stop bit" "Stop" "T"
77980-78007 uart: tx-start: "Start bit" "Start" "S"
78006-78033 uart: tx-data-bit: "1"
78032-78059 uart: tx-data-bit: "1"
78058-78085 uart: tx-data-bit: "0"
78084-78111 uart: tx-data-bit: "0"
78110-78137 uart: tx-data-bit: "0"
78136-78163 uart: tx-data-bit: "0"
78162-78189 uart: tx-data-bit: "0"
78188-78215 uart: tx-data-bit: "1"
78214-78241 uart: tx-data-bit: "0"
78006-78241 uart: tx-data: "131"
69846-78241 uart: tx-packet: "116 117 118 119 120 121 122 123 124 125 126 127 128 129 130 131"
78240-78267 uart: tx-stop: "Stop bit" "Stop" "T"
78525-78552 uart: tx-start: "Start bit" "Start" "S"
78551-78578 uart: tx-data-bit: "0"
78577-78604 uart: tx-data-bit: "0"
78603-78630 uart: tx-data-bit: "1"
78629-78656 uart: tx-data-bit: "0"
78655-78682 uart: tx-data-bit: "0"
78681-78708 uart: tx-data-bit: "0"
78707-78734 uart: tx-data-bit: "0"
78733-78760 uart: tx-data-bit: "1"
78759-78786 uart: tx-data-bit: "0"
78551-78786 uart: tx-data: "132"
78785-78812 uart: tx-stop: "Stop bit" "Stop" "T"
79070-79097 uart: tx-start: "Start bit" "Start" "S"
79096-79123 uart: tx-data-bit: "1"
79122-79149 uart: tx-data-bit: "0"
79148-79175 uart: tx-data-bit: "1"
79174-79201 uart: tx-data-bit: "0"
79200-79227 uart: tx-data-bit: "0"
79226-79253 uart: tx-data-bit: "0"
79252-79279 uart: tx-data-bit: "0"
79278-79305 uart: tx-data-bit: "1"
79304-79331 uart: tx-data-bit: "0"
79096-79331 uart: tx-data: "133"
79330-79357 uart: tx-stop: "Stop bit" "Stop" "T"
79616-79643 uart: tx-start: "Start bit" "Start" "S"
79642-79669 uart: tx-data-bit: "0"
79668-79695 uart: tx-data-bit: "1"
79694-79721 uart: tx-data-bit: "1"
79720-79747 uart: tx-data-bit: "0"
79746-79773 uart: tx-data-bit: "0"
79772-79799 uart: tx-data-bit: "0"
79798-79825 uart: tx-data-bit: "0"
79824-79851 uart: tx-data-bit: "1"
79850-79877 uart: tx-data-bit: "0"
79642-79877 uart: tx-data: "134"
79876-79903 uart: tx-stop: "Stop bit" "Stop" "T"
80161-80188 uart: tx-start: "Start bit" "Start" "S"
80187-80214 uart: tx-data-bit: "1"
80213-80240 uart: tx-data-bit: "1"
80239-80266 uart: tx-data-bit: "1"
80265-80292 uart: tx-data-bit: "0"
80291-80318 uart: tx-data-bit: "0"
80317-80344 uart: tx-data-bit: "0"
80343-80370 uart: tx-data-bit: "0"
80369-80396 uart: tx-data-bit: "1"
80395-80422 uart: tx-data-bit: "0"
80187-80422 uart: tx-data: "135"
80421-80448 uart: tx-stop: "Stop bit" "Stop" "T"
80705-80732 uart: tx-start: "Start bit" "Start" "S"
80731-80758 uart: tx-data-bit: "0"
80757-80784 uart: tx-data-bit: "0"
80783-80810 uart: tx-data-bit: "0"
80809-80836 uart: tx-data-bit: "1"
80835-80862 uart: tx-data-bit: "0"
80861-80888 uart: tx-data-bit: "0"
80887-80914 uart: tx-data-bit: "0"
80913-80940 uart: tx-data-bit: "1"
80939-80966 uart: tx-data-bit: "0"
80731-80966 uart: tx-data: "136"
80965-80992 uart: tx-stop: "Stop bit" "Stop" "T"
81250-81277 uart: tx-start: "Start bit" "Start" "S"
81276-81303 uart: tx-data-bit: "1"
81302-81329 uart: tx-data-bit: "0"
81328-81355 uart: tx-data-bit: "0"
81354-81381 uart: tx-data-bit: "1"
81380-81407 uart: tx-data-bit: "0"
81406-81433 uart: tx-data-bit: "0"
81432-81459 uart: tx-data-bit: "0"
81458-81485 uart: tx-data-bit: "1"
81484-81511 uart: tx-data-bit: "0"
81276-81511 uart: tx-data: "137"
81510-81537 uart: tx-stop: "Stop bit" "Stop" "T"
81796-81823 uart: tx-start: "Start bit" "Start" "S"
81822-81849 uart: tx-data-bit: "0"
81848-81875 uart: tx-data-bit: "1"
81874-81901 uart: tx-data-bit: "0"
81900-81927 uart: tx-data-bit: "1"
81926-81953 uart: tx-data-bit: "0"
81952-81979 uart: tx-data-bit: "0"
81978-82005 uart: tx-data-bit: "0"
82004-82031 uart: tx-data-bit: "1"
82030-82057 uart: tx-data-bit: "0"
81822-82057 uart: tx-data: "138"
82056-82083 uart: tx-stop: "Stop bit" "Stop" "T"
82343-82370 uart: tx-start: "Start bit" "Start" "S"
82369-82396 uart: tx-data-bit: "1"
82395-82422 uart: tx-data-bit: "1"
82421-82448 uart: tx-data-bit: "0"
82447-82474 uart: tx-data-bit: "1"
82473-82500 uart: tx-data-bit: "0"
82499-82526 uart: tx-data-bit: "0"
82525-82552 uart: tx-data-bit: "0"
82551-82578 uart: tx-data-bit: "1"
82577-82604 uart: tx-data-bit: "0"
82369-82604 uart: tx-data: "139"
82603-82630 uart: tx-stop: "Stop bit" "Stop" "T"
82890-82917 uart: tx-start: "Start bit" "Start" "S"
82916-82943 uart: tx-data-bit: "0"
82942-82969 uart: tx-data-bit: "0"
82968-82995 uart: tx-data-bit: "1"
82994-83021 uart: tx-data-bit: "1"
83020-83047 uart: tx-data-bit: "0"
83046-83073 uart: tx-data-bit: "0"
83072-83099 uart: tx-data-bit: "0"
83098-83125 uart: tx-data-bit: "1"
83124-83151 uart: tx-data-bit: "0"
82916-83151 uart: tx-data: "140"
83150-83177 uart: tx-stop: "Stop bit" "Stop" "T"
83434-83461 uart: tx-start: "Start bit" "Start" "S"
83460-83487 uart: tx-data-bit: "1"
83486-83513 uart: tx-data-bit: "0"
83512-83539 uart: tx-data-bit: "1"
83538-83565 uart: tx-data-bit: "1"
83564-83591 uart: tx-data-bit: "0"
83590-83617 uart: tx-data-bit: "0"
83616-83643 uart: tx-data-bit: "0"
83642-83669 uart: tx-data-bit: "1"
83668-83695 uart: tx-data-bit: "0"
83460-83695 uart: tx-data: "141"
83694-83721 uart: tx-stop: "Stop bit" "Stop" "T"
83981-84008 uart: tx-start: "Start bit" "Start" "S"
84007-84034 uart: tx-data-bit: "0"
84033-84060 uart: tx-data-bit: "1"
84059-84086 uart: tx-data-bit: "1"
84085-84112 uart: tx-data-bit: "1"
84111-84138 uart: tx-data-bit: "0"
84137-84164 uart: tx-data-bit: "0"
84163-84190 uart: tx-data-bit: "0"
84189-84216 uart: tx-data-bit: "1"
84215-84242 uart: tx-data-bit: "0"
84007-84242 uart: tx-data: "142"
84241-84268 uart: tx-stop: "Stop bit" "Stop" "T"
84525-84552 uart: tx-start: "Start bit" "Start" "S"
84551-84578 uart: tx-data-bit: "1"
84577-84604 uart: tx-data-bit: "1"
84603-84630 uart: tx-data-bit: "1"
84629-84656 uart: tx-data-bit: "1"
84655-84682 uart: tx-data-bit: "0"
84681-84708 uart: tx-data-bit: "0"
84707-84734 uart: tx-data-bit: "0"
84733-84760 uart: tx-data-bit: "1"
84759-84786 uart: tx-data-bit: "0"
84551-84786 uart: tx-data: "143"
84785-84812 uart: tx-stop: "Stop bit" "Stop" "T"
85070-85097 uart: tx-start: "Start bit" "Start" "S"
85096-85123 uart: tx-data-bit: "0"
85122-85149 uart: tx-data-bit: "0"
85148-85175 uart: tx-data-bit: "0"
85174-85201 uart: tx-data-bit: "0"
85200-85227 uart: tx-data-bit: "1"
85226-85253 uart: tx-data-bit: "0"
85252-85279 uart: tx-data-bit: "0"
85278-85305 uart: tx-data-bit: "1"
85304-85331 uart: tx-data-bit: "0"
85096-85331 uart: tx-data: "144"
85330-85357 uart: tx-stop: "Stop bit" "Stop" "T"
85614-85641 uart: tx-start: "Start bit" "Start" "S"
85640-85667 uart: tx-data-bit: "1"
85666-85693 uart: tx-data-bit: "0"
85692-85719 uart: tx-data-bit: "0"
85718-85745 uart: tx-data-bit: "0"
85744-85771 uart: tx-data-bit: "1"
85770-85797 uart: tx-data-bit: "0"
85796-85823 uart: tx-data-bit: "0"
85822-85849 uart: tx-data-bit: "1"
85848-85875 uart: tx-data-bit: "0"
85640-85875 uart: tx-data: "145"
85874-85901 uart: tx-stop: "Stop bit" "Stop" "T"
86161-86188 uart: tx-start: "Start bit" "Start" "S"
86187-86214 uart: tx-data-bit: "0"
86213-86240 uart: tx-data-bit: "1"
86239-86266 uart: tx-data-bit: "0"
86265-86292 uart: tx-data-bit: "0"
86291-86318 uart: tx-data-bit: "1"
86317-86344 uart: tx-data-bit: "0"
86343-86370 uart: tx-data-bit: "0"
86369-86396 uart: tx-data-bit: "1"
86395-86422 uart: tx-data-bit: "0"
86187-86422 uart: tx-data: "146"
86421-86448 uart: tx-stop: "Stop bit" "Stop" "T"
86708-86735 uart: tx-start: "Start bit" "Start" "S"
86734-86761 uart: tx-data-bit: "1"
86760-86787 uart: tx-data-bit: "1"
86786-86813 uart: tx-data-bit: "0"
86812-86839 uart: tx-data-bit: "0"
86838-86865 uart: tx-data-bit: "1"
86864-86891 uart: tx-data-bit: "0"
86890-86917 uart: tx-data-bit: "0"
86916-86943 uart: tx-data-bit: "1"
86942-86969 uart: tx-data-bit: "0"
86734-86969 uart: tx-data: "147"
78551-86969 uart: tx-packet: "132 133 134 135 136 137 138 139 140 141 142 143 144 145 146 147"
86968-86995 uart: tx-stop: "Stop bit" "Stop" "T"
87254-87281 uart: tx-start: "Start bit" "Start" "S"
87280-87307 uart: tx-data-bit: "0"
87306-87333 uart: tx-data-bit: "0"
87332-87359 uart: tx-data-bit: "1"
87358-87385 uart: tx-data-bit: "0"
87384-87411 uart: tx-data-bit: "1"
87410-87437 uart: tx-data-bit: "0"
87436-87463 uart: tx-data-bit: "0"
87462-87489 uart: tx-data-bit: "1"
87488-87515 uart: tx-data-bit: "0"
87280-87515 uart: tx-data: "148"
87514-87541 uart: tx-stop: "Stop bit" "Stop" "T"
87801-87828 uart: tx-start: "Start bit" "Start" "S"
87827-87854 uart: tx-data-bit: "1"
87853-87880 uart: tx-data-bit: "0"
87879-87906 uart: tx-data-bit: "1"
87905-87932 uart: tx-data-bit: "0"
87931-87958 uart: tx-data-bit: "1"
87957-87984 uart: tx-data-bit: "0"
87983-88010 uart: tx-data-bit: "0"
88009-88036 uart: tx-data-bit: "1"
88035-88062 uart: tx-data-bit: "0"
87827-88062 uart: tx-data: "149"
88061-88088 uart: tx-stop: "Stop bit" "Stop" "T"
88349-88376 uart: tx-start: "Start bit" "Start" "S"
88375-88402 uart: tx-data-bit: "0"
88401-88428 uart: tx-data-bit: "1"
88427-88454 uart: tx-data-bit: "1"
88453-88480 uart: tx-data-bit: "0"
88479-88506 uart: tx-data-bit: "1"
88505-88532 uart: tx-data-bit: "0"
88531-88558 uart: tx-data-bit: "0"
88557-88584 uart: tx-data-bit: "1"
88583-88610 uart: tx-data-bit: "0"
88375-88610 uart: tx-data: "150"
88609-88636 uart: tx-stop: "Stop bit" "Stop" "T"
88896-88923 uart: tx-start: "Start bit" "Start" "S"
88922-88949 uart: tx-data-bit: "1"
88948-88975 uart: tx-data-bit: "1"
88974-89001 uart: tx-data-bit: "1"
89000-89027 uart: tx-data-bit: "0"
89026-89053 uart: tx-data-bit: "1"
89052-89079 uart: tx-data-bit: "0"
89078-89105 uart: tx-data-bit: "0"
89104-89131 uart: tx-data-bit: "1"
89130-89157 uart: tx-data-bit: "0"
88922-89157 uart: tx-data: "151"
89156-89183 uart: tx-stop: "Stop bit" "Stop" "T"
89442-89469 uart: tx-start: "Start bit" "Start" "S"
89468-89495 uart: tx-data-bit: "0"
89494-89521 uart: tx-data-bit: "0"
89520-89547 uart: tx-data-bit: "0"
89546-89573 uart: tx-data-bit: "1"
89572-89599 uart: tx-data-bit: "1"
89598-89625 uart: tx-data-bit: "0"
89624-89651 uart: tx-data-bit: "0"
89650-89677 uart: tx-data-bit: "1"
89676-89703 uart: tx-data-bit: "0"
89468-89703 uart: tx-data: "152"
89702-89729 uart: tx-stop: "Stop bit" "Stop" "T"
89987-90014 uart: tx-start: "Start bit" "Start" "S"
90013-90040 uart: tx-data-bit: "1"
90039-90066 uart: tx-data-bit: "0"
90065-90092 uart: tx-data-bit: "0"
90091-90118 uart: tx-data-bit: "1"
90117-90144 uart: tx-data-bit: "1"
90143-90170 uart: tx-data-bit: "0"
90169-90196 uart: tx-data-bit: "0"
90195-90222 uart: tx-data-bit: "1"
90221-90248 uart: tx-data-bit: "0"
90013-90248 uart: tx-data: "153"
90247-90274 uart: tx-stop: "Stop bit" "Stop" "T"
90534-90561 uart: tx-start: "Start bit" "Start" "S"
90560-90587 uart: tx-data-bit: "0"
90586-90613 uart: tx-data-bit: "1"
90612-90639 uart: tx-data-bit: "0"
90638-90665 uart: tx-data-bit: "1"
90664-90691 uart: tx-data-bit: "1"
90690-90717 uart: tx-data-bit: "0"
90716-90743 uart: tx-data-bit: "0"
90742-90769 uart: tx-data-bit: "1"
90768-90795 uart: tx-data-bit: "0"
90560-90795 uart: tx-data: "154"
90794-90821 uart: tx-stop: "Stop bit" "Stop" "T"
91080-91107 uart: tx-start: "Start bit" "Start" "S"
91106-91133 uart: tx-data-bit: "1"
91132-91159 uart: tx-data-bit: "1"
91158-91185 uart: tx-data-bit: "0"
91184-91211 uart: tx-data-bit: "1"
91210-91237 uart: tx-data-bit: "1"
91236-91263 uart: tx-data-bit: "0"
91262-91289 uart: tx-data-bit: "0"
91288-91315 uart: tx-data-bit: "1"
91314-91341 uart: tx-data-bit: "0"
91106-91341 uart: tx-data: "155"
91340-91367 uart: tx-stop: "Stop bit" "Stop" "T"
91627-91654 uart: tx-start: "Start bit" "Start" "S"
91653-91680 uart: tx-data-bit: "0"
91679-91706 uart: tx-data-bit: "0"
91705-91732 uart: tx-data-bit: "1"
91731-91758 uart: tx-data-bit: "1"
91757-91784 uart: tx-data-bit: "1"
91783-91810 uart: tx-data-bit: "0"
91809-91836 uart: tx-data-bit: "0"
91835-91862 uart: tx-data-bit: "1"
91861-91888 uart: tx-data-bit: "0"
91653-91888 uart: tx-data: "156"
91887-91914 uart: tx-stop: "Stop bit" "Stop" "T"
92171-92198 uart: tx-start: "Start bit" "Start" "S"
92197-92224 uart: tx-data-bit: "1"
92223-92250 uart: tx-data-bit: "0"
92249-92276 uart: tx-data-bit: "1"
92275-92302 uart: tx-data-bit: "1"
92301-92328 uart: tx-data-bit: "1"
92327-92354 uart: tx-data-bit: "0"
92353-92380 uart: tx-data-bit: "0"
92379-92406 uart: tx-data-bit: "1"
92405-92432 uart: tx-data-bit: "0"
92197-92432 uart: tx-data: "157"
92431-92458 uart: tx-stop: "Stop bit" "Stop" "T"
92718-92745 uart: tx-start: "Start bit" "Start" "S"
92744-92771 uart: tx-data-bit: "0"
92770-92797 uart: tx-data-bit: "1"
92796-92823 uart: tx-data-bit: "1"
92822-92849 uart: tx-data-bit: "1"
92848-92875 uart: tx-data-bit: "1"
92874-92901 uart: tx-data-bit: "0"
92900-92927 uart: tx-data-bit: "0"
92926-92953 uart: tx-data-bit: "1"
92952-92979 uart: tx-data-bit: "0"
92744-92979 uart: tx-data: "158"
92978-93005 uart: tx-stop: "Stop bit" "Stop" "T"
93262-93289 uart: tx-start: "Start bit" "Start" "S"
93288-93315 uart: tx-data-bit: "1"
93314-93341 uart: tx-data-bit: "1"
93340-93367 uart: tx-data-bit: "1"
93366-93393 uart: tx-data-bit: "1"
93392-93419 uart: tx-data-bit: "1"
93418-93445 uart: tx-data-bit: "0"
93444-93471 uart: tx-data-bit: "0"
93470-93497 uart: tx-data-bit: "1"
93496-93523 uart: tx-data-bit: "0"
93288-93523 uart: tx-data: "159"
93522-93549 uart: tx-stop: "Stop bit" "Stop" "T"
93807-93834 uart: tx-start: "Start bit" "Start" "S"
93833-93860 uart: tx-data-bit: "0"
93859-93886 uart: tx-data-bit: "0"
93885-93912 uart: tx-data-bit: "0"
93911-93938 uart: tx-data-bit: "0"
93937-93964 uart: tx-data-bit: "0"
93963-93990 uart: tx-data-bit: "1"
93989-94016 uart: tx-data-bit: "0"
94015-94042 uart: tx-data-bit: "1"
94041-94068 uart: tx-data-bit: "0"
93833-94068 uart: tx-data: "160"
94067-94094 uart: tx-stop: "Stop bit" "Stop" "T"
94352-94379 uart: tx-start: "Start bit" "Start" "S"
94378-94405 uart: tx-data-bit: "1"
94404-94431 uart: tx-data-bit: "0"
94430-94457 uart: tx-data-bit: "0"
94456-94483 uart: tx-data-bit: "0"
94482-94509 uart: tx-data-bit: "0"
94508-94535 uart: tx-data-bit: "1"
94534-94561 uart: tx-data-bit: "0"
94560-94587 uart: tx-data-bit: "1"
94586-94613 uart: tx-data-bit: "0"
94378-94613 uart: tx-data: "161"
94612-94639 uart: tx-stop: "Stop bit" "Stop" "T"
94898-94925 uart: tx-start: "Start bit" "Start" "S"
94924-94951 uart: tx-data-bit: "0"
94950-94977 uart: tx-data-bit: "1"
94976-95003 uart: tx-data-bit: "0"
95002-95029 uart: tx-data-bit: "0"
95028-95055 uart: tx-data-bit: "0"
95054-95081 uart: tx-data-bit: "1"
95080-95107 uart: tx-data-bit: "0"
95106-95133 uart: tx-data-bit: "1"
95132-95159 uart: tx-data-bit: "0"
94924-95159 uart: tx-data: "162"
95158-95185 uart: tx-stop: "Stop bit" "Stop" "T"
95445-95472 uart: tx-start: "Start bit" "Start" "S"
95471-95498 uart: tx-data-bit: "1"
95497-95524 uart: tx-data-bit: "1"
95523-95550 uart: tx-data-bit: "0"
95549-95576 uart: tx-data-bit: "0"
95575-95602 uart: tx-data-bit: "0"
95601-95628 uart: tx-data-bit: "1"
95627-95654 uart: tx-data-bit: "0"
95653-95680 uart: tx-data-bit: "1"
95679-95706 uart: tx-data-bit: "0"
95471-95706 uart: tx-data: "163"
87280-95706 uart: tx-packet: "148 149 150 151 152 153 154 155 156 157 158 159 160 161 162 163"
95705-95732 uart: tx-stop: "Stop bit" "Stop" "T"
95991-96018 uart: tx-start: "Start bit" "Start" "S"
96017-96044 uart: tx-data-bit: "0"
96043-96070 uart: tx-data-bit: "0"
96069-96096 uart: tx-data-bit: "1"
96095-96122 uart: tx-data-bit: "0"
96121-96148 uart: tx-data-bit: "0"
96147-96174 uart: tx-data-bit: "1"
96173-96200 uart: tx-data-bit: "0"
96199-96226 uart: tx-data-bit: "1"
96225-96252 uart: tx-data-bit: "0"
96017-96252 uart: tx-data: "164"
96251-96278 uart: tx-stop: "Stop bit" "Stop" "T"
96538-96565 uart: tx-start: "Start bit" "Start" "S"
96564-96591 uart: tx-data-bit: "1"
96590-96617 uart: tx-data-bit: "0"
96616-96643 uart: tx-data-bit: "1"
96642-96669 uart: tx-data-bit: "0"
96668-96695 uart: tx-data-bit: "0"
96694-96721 uart: tx-data-bit: "1"
96720-96747 uart: tx-data-bit: "0"
96746-96773 uart: tx-data-bit: "1"
96772-96799 uart: tx-data-bit: "0"
96564-96799 uart: tx-data: "165"
96798-96825 uart: tx-stop: "Stop bit" "Stop" "T"
97086-97113 uart: tx-start: "Start bit" "Start" "S"
97112-97139 uart: tx-data-bit: "0"
97138-97165 uart: tx-data-bit: "1"
97164-97191 uart: tx-data-bit: "1"
97190-97217 uart: tx-data-bit: "0"
97216-97243 uart: tx-data-bit: "0"
97242-97269 uart: tx-data-bit: "1"
97268-97295 uart: tx-data-bit: "0"
97294-97321 uart: tx-data-bit: "1"
97320-97347 uart: tx-data-bit: "0"
97112-97347 uart: tx-data: "166"
97346-97373 uart: tx-stop: "Stop bit" "Stop" "T"
97633-97660 uart: tx-start: "Start bit" "Start" "S"
97659-97686 uart: tx-data-bit: "1"
97685-97712 uart: tx-data-bit: "1"
97711-97738 uart: tx-data-bit: "1"
97737-97764 uart: tx-data-bit: "0"
97763-97790 uart: tx-data-bit: "0"
97789-97816 uart: tx-data-bit: "1"
97815-97842 uart: tx-data-bit: "0"
97841-97868 uart: tx-data-bit: "1"
97867-97894 uart: tx-data-bit: "0"
97659-97894 uart: tx-data: "167"
97893-97920 uart: tx-stop: "Stop bit" "Stop" "T"
98180-98207 uart: tx-start: "Start bit" "Start" "S"
98206-98233 uart: tx-data-bit: "0"
98232-98259 uart: tx-data-bit: "0"
98258-98285 uart: tx-data-bit: "0"
98284-98311 uart: tx-data-bit: "1"
98310-98337 uart: tx-data-bit: "0"
98336-98363 uart: tx-data-bit: "1"
98362-98389 uart: tx-data-bit: "0"
98388-98415 uart: tx-data-bit: "1"
98414-98441 uart: tx-data-bit: "0"
98206-98441 uart: tx-data: "168"
98440-98467 uart: tx-stop: "Stop bit" "Stop" "T"
98726-98753 uart: tx-start: "Start bit" "Start" "S"
98752-98779 uart: tx-data-bit: "1"
98778-98805 uart: tx-data-bit: "0"
98804-98831 uart: tx-data-bit: "0"
98830-98857 uart: tx-data-bit: "1"
98856-98883 uart: tx-data-bit: "0"
98882-98909 uart: tx-data-bit: "1"
98908-98935 uart: tx-data-bit: "0"
98934-98961 uart: tx-data-bit: "1"
98960-98987 uart: tx-data-bit: "0"
98752-98987 uart: tx-data: "169"
98986-99013 uart: tx-stop: "Stop bit" "Stop" "T"
99275-99302 uart: tx-start: "Start bit" "Start" "S"
99301-99328 uart: tx-data-bit: "0"
99327-99354 uart: tx-data-bit: "1"
99353-99380 uart: tx-data-bit: "0"
99379-99406 uart: tx-data-bit: "1"
99405-99432 uart: tx-data-bit: "0"
99431-99458 uart: tx-data-bit: "1"
99457-99484 uart: tx-data-bit: "0"
99483-99510 uart: tx-data-bit: "1"
99509-99536 uart: tx-data-bit: "0"
99301-99536 uart: tx-data: "170"
99535-99562 uart: tx-stop: "Stop bit" "Stop" "T"
99823-99850 uart: tx-start: "Start bit" "Start" "S"
99849-99876 uart: tx-data-bit: "1"
99875-99902 uart: tx-data-bit: "1"
99901-99928 uart: tx-data-bit: "0"
99927-99954 uart: tx-data-bit: "1"
99953-99980 uart: tx-data-bit: "0"
99979-100006 uart: tx-data-bit: "1"
100005-100032 uart: tx-data-bit: "0"
100031-100058 uart: tx-data-bit: "1"
100057-100084 uart: tx-data-bit: "0"
99849-100084 uart: tx-data: "171"
100083-100110 uart: tx-stop: "Stop bit" "Stop" "T"
100372-100399 uart: tx-start: "Start bit" "Start" "S"
100398-100425 uart: tx-data-bit: "0"
100424-100451 uart: tx-data-bit: "0"
100450-100477 uart: tx-data-bit: "1"
100476-100503 uart: tx-data-bit: "1"
100502-100529 uart: tx-data-bit: "0"
100528-100555 uart: tx-data-bit: "1"
100554-100581 uart: tx-data-bit: "0"
100580-100607 uart: tx-data-bit: "1"
100606-100633 uart: tx-data-bit: "0"
100398-100633 uart: tx-data: "172"
100632-100659 uart: tx-stop: "Stop bit" "Stop" "T"
100918-100945 uart: tx-start: "Start bit" "Start" "S"
100944-100971 uart: tx-data-bit: "1"
100970-100997 uart: tx-data-bit: "0"
100996-101023 uart: tx-data-bit: "1"
101022-101049 uart: tx-data-bit: "1"
101048-101075 uart: tx-data-bit: "0"
101074-101101 uart: tx-data-bit: "1"
101100-101127 uart: tx-data-bit: "0"
101126-101153 uart: tx-data-bit: "1"
101152-101179 uart: tx-data-bit: "0"
100944-101179 uart: tx-data: "173"
101178-101205 uart: tx-stop: "Stop bit" "Stop" "T"
101467-101494 uart: tx-start: "Start bit" "Start" "S"
101493-101520 uart: tx-data-bit: "0"
101519-101546 uart: tx-data-bit: "1"
101545-101572 uart: tx-data-bit: "1"
101571-101598 uart: tx-data-bit: "1"
101597-101624 uart: tx-data-bit: "0"
101623-101650 uart: tx-data-bit: "1"
101649-101676 uart: tx-data-bit: "0"
101675-101702 uart: tx-data-bit: "1"
101701-101728 uart: tx-data-bit: "0"
101493-101728 uart: tx-data: "174"
101727-101754 uart: tx-stop: "Stop bit" "Stop" "T"
102014-102041 uart: tx-start: "Start bit" "Start" "S"
102040-102067 uart: tx-data-bit: "1"
102066-102093 uart: tx-data-bit: "1"
102092-102119 uart: tx-data-bit: "1"
102118-102145 uart: tx-data-bit: "1"
102144-102171 uart: tx-data-bit: "0"
102170-102197 uart: tx-data-bit: "1"
102196-102223 uart: tx-data-bit: "0"
102222-102249 uart: tx-data-bit: "1"
102248-102275 uart: tx-data-bit: "0"
102040-102275 uart: tx-data: "175"
102274-102301 uart: tx-stop: "Stop bit" "Stop" "T"
102560-102587 uart: tx-start: "Start bit" "Start" "S"
102586-102613 uart: tx-data-bit: "0"
102612-102639 uart: tx-data-bit: "0"
102638-102665 uart: tx-data-bit: "0"
102664-102691 uart: tx-data-bit: "0"
102690-102717 uart: tx-data-bit: "1"
102716-102743 uart: tx-data-bit: "1"
102742-102769 uart: tx-data-bit: "0"
102768-102795 uart: tx-data-bit: "1"
102794-102821 uart: tx-data-bit: "0"
102586-102821 uart: tx-data: "176"
102820-102847 uart: tx-stop: "Stop bit" "Stop" "T"
103105-103132 uart: tx-start: "Start bit" "Start" "S"
103131-103158 uart: tx-data-bit: "1"
103157-103184 uart: tx-data-bit: "0"
103183-103210 uart: tx-data-bit: "0"
103209-103236 uart: tx-data-bit: "0"
103235-103262 uart: tx-data-bit: "1"
103261-103288 uart: tx-data-bit: "1"
103287-103314 uart: tx-data-bit: "0"
103313-103340 uart: tx-data-bit: "1"
103339-103366 uart: tx-data-bit: "0"
103131-103366 uart: tx-data: "177"
103365-103392 uart: tx-stop: "Stop bit" "Stop" "T"
103651-103678 uart: tx-start: "Start bit" "Start" "S"
103677-103704 uart: tx-data-bit: "0"
103703-103730 uart: tx-data-bit: "1"
103729-103756 uart: tx-data-bit: "0"
103755-103782 uart: tx-data-bit: "0"
103781-103808 uart: tx-data-bit: "1"
103807-103834 uart: tx-data-bit: "1"
103833-103860 uart: tx-data-bit: "0"
103859-103886 uart: tx-data-bit: "1"
103885-103912 uart: tx-data-bit: "0"
103677-103912 uart: tx-data: "178"
103911-103938 uart: tx-stop: "Stop bit" "Stop" "T"
104198-104225 uart: tx-start: "Start bit" "Start" "S"
104224-104251 uart: tx-data-bit: "1"
104250-104277 uart: tx-data-bit: "1"
104276-104303 uart: tx-data-bit: "0"
104302-104329 uart: tx-data-bit: "0"
104328-104355 uart: tx-data-bit: "1"
104354-104381 uart: tx-data-bit: "1"
104380-104407 uart: tx-data-bit: "0"
104406-104433 uart: tx-data-bit: "1"
104432-104459 uart: tx-data-bit: "0"
104224-104459 uart: tx-data: "179"
96017-104459 uart: tx-packet: "164 165 166 167 168 169 170 171 172 173 174 175 176 177 178 179"
104458-104485 uart: tx-stop: "Stop bit" "Stop" "T"
104744-104771 uart: tx-start: "Start bit" "Start" "S"
104770-104797 uart: tx-data-bit: "0"
104796-104823 uart: tx-data-bit: "0"
104822-104849 uart: tx-data-bit: "1"
104848-104875 uart: tx-data-bit: "0"
104874-104901 uart: tx-data-bit: "1"
104900-104927 uart: tx-data-bit: "1"
104926-104953 uart: tx-data-bit: "0"
104952-104979 uart: tx-data-bit: "1"
104978-105005 uart: tx-data-bit: "0"
104770-105005 uart: tx-data: "180"
105004-105031 uart: tx-stop: "Stop bit" "Stop" "T"
105291-105318 uart: tx-start: "Start bit" "Start" "S"
105317-105344 uart: tx-data-bit: "1"
105343-105370 uart: tx-data-bit: "0"
105369-105396 uart: tx-data-bit: "1"
105395-105422 uart: tx-data-bit: "0"
105421-105448 uart: tx-data-bit: "1"
105447-105474 uart: tx-data-bit: "1"
105473-105500 uart: tx-data-bit: "0"
105499-105526 uart: tx-data-bit: "1"
105525-105552 uart: tx-data-bit: "0"
105317-105552 uart: tx-data: "181"
105551-105578 uart: tx-stop: "Stop bit" "Stop" "T"
105840-105867 uart: tx-start: "Start bit" "Start" "S"
105866-105893 uart: tx-data-bit: "0"
105892-105919 uart: tx-data-bit: "1"
105918-105945 uart: tx-data-bit: "1"
105944-105971 uart: tx-data-bit: "0"
105970-105997 uart: tx-data-bit: "1"
105996-106023 uart: tx-data-bit: "1"
106022-106049 uart: tx-data-bit: "0"
106048-106075 uart: tx-data-bit: "1"
106074-106101 uart: tx-data-bit: "0"
105866-106101 uart: tx-data: "182"
106100-106127 uart: tx-stop: "Stop bit" "Stop" "T"
106386-106413 uart: tx-start: "Start bit" "Start" "S"
106412-106439 uart: tx-data-bit: "1"
106438-106465 uart: tx-data-bit: "1"
106464-106491 uart: tx-data-bit: "1"
106490-106517 uart: tx-data-bit: "0"
106516-106543 uart: tx-data-bit: "1"
106542-106569 uart: tx-data-bit: "1"
106568-106595 uart: tx-data-bit: "0"
106594-106621 uart: tx-data-bit: "1"
106620-106647 uart: tx-data-bit: "0"
106412-106647 uart: tx-data: "183"
106646-106673 uart: tx-stop: "Stop bit" "Stop" "T"
106933-106960 uart: tx-start: "Start bit" "Start" "S"
106959-106986 uart: tx-data-bit: "0"
106985-107012 uart: tx-data-bit: "0"
107011-107038 uart: tx-data-bit: "0"
107037-107064 uart: tx-data-bit: "1"
107063-107090 uart: tx-data-bit: "1"
107089-107116 uart: tx-data-bit: "1"
107115-107142 uart: tx-data-bit: "0"
107141-107168 uart: tx-data-bit: "1"
107167-107194 uart: tx-data-bit: "0"
106959-107194 uart: tx-data: "184"
107193-107220 uart: tx-stop: "Stop bit" "Stop" "T"
107477-107504 uart: tx-start: "Start bit" "Start" "S"
107503-107530 uart: tx-data-bit: "1"
107529-107556 uart: tx-data-bit: "0"
107555-107582 uart: tx-data-bit: "0"
107581-107608 uart: tx-data-bit: "1"
107607-107634 uart: tx-data-bit: "1"
107633-107660 uart: tx-data-bit: "1"
107659-107686 uart: tx-data-bit: "0"
107685-107712 uart: tx-data-bit: "1"
107711-107738 uart: tx-data-bit: "0"
107503-107738 uart: tx-data: "185"
107737-107764 uart: tx-stop: "Stop bit" "Stop" "T"
108024-108051 uart: tx-start: "Start bit" "Start" "S"
108050-108077 uart: tx-data-bit: "0"
108076-108103 uart: tx-data-bit: "1"
108102-108129 uart: tx-data-bit: "0"
108128-108155 uart: tx-data-bit: "1"
108154-108181 uart: tx-data-bit: "1"
108180-108207 uart: tx-data-bit: "1"
108206-108233 uart: tx-data-bit: "0"
108232-108259 uart: tx-data-bit: "1"
108258-108285 uart: tx-data-bit: "0"
108050-108285 uart: tx-data: "186"
108284-108311 uart: tx-stop: "Stop bit" "Stop" "T"
108570-108597 uart: tx-start: "Start bit" "Start" "S"
108596-108623 uart: tx-data-bit: "1"
108622-108649 uart: tx-data-bit: "1"
108648-108675 uart: tx-data-bit: "0"
108674-108701 uart: tx-data-bit: "1"
108700-108727 uart: tx-data-bit: "1"
108726-108753 uart: tx-data-bit: "1"
108752-108779 uart: tx-data-bit: "0"
108778-108805 uart: tx-data-bit: "1"
108804-108831 uart: tx-data-bit: "0"
108596-108831 uart: tx-data: "187"
108830-108857 uart: tx-stop: "Stop bit" "Stop" "T"
109117-109144 uart: tx-start: "Start bit" "Start" "S"
109143-109170 uart: tx-data-bit: "0"
109169-109196 uart: tx-data-bit: "0"
109195-109222 uart: tx-data-bit: "1"
109221-109248 uart: tx-data-bit: "1"
109247-109274 uart: tx-data-bit: "1"
109273-109300 uart: tx-data-bit: "1"
109299-109326 uart: tx-data-bit: "0"
109325-109352 uart: tx-data-bit: "1"
109351-109378 uart: tx-data-bit: "0"
109143-109378 uart: tx-data: "188"
109377-109404 uart: tx-stop: "Stop bit" "Stop" "T"
109662-109689 uart: tx-start: "Start bit" "Start" "S"
109688-109715 uart: tx-data-bit: "1"
109714-109741 uart: tx-data-bit: "0"
109740-109767 uart: tx-data-bit: "1"
109766-109793 uart: tx-data-bit: "1"
109792-109819 uart: tx-data-bit: "1"
109818-109845 uart: tx-data-bit: "1"
109844-109871 uart: tx-data-bit: "0"
109870-109897 uart: tx-data-bit: "1"
109896-109923 uart: tx-data-bit: "0"
109688-109923 uart: tx-data: "189"
109922-109949 uart: tx-stop: "Stop bit" "Stop" "T"
110208-110235 uart: tx-start: "Start bit" "Start" "S"
110234-110261 uart: tx-data-bit: "0"
110260-110287 uart: tx-data-bit: "1"
110286-110313 uart: tx-data-bit: "1"
110312-110339 uart: tx-data-bit: "1"
110338-110365 uart: tx-data-bit: "1"
110364-110391 uart: tx-data-bit: "1"
110390-110417 uart: tx-data-bit: "0"
110416-110443 uart: tx-data-bit: "1"
110442-110469 uart: tx-data-bit: "0"
110234-110469 uart: tx-data: "190"
110468-110495 uart: tx-stop: "Stop bit" "Stop" "T"
110753-110780 uart: tx-start: "Start bit" "Start" "S"
110779-110806 uart: tx-data-bit: "1"
110805-110832 uart: tx-data-bit: "1"
110831-110858 uart: tx-data-bit: "1"
110857-110884 uart: tx-data-bit: "1"
110883-110910 uart: tx-data-bit: "1"
110909-110936 uart: tx-data-bit: "1"
110935-110962 uart: tx-data-bit: "0"
110961-110988 uart: tx-data-bit: "1"
110987-111014 uart: tx-data-bit: "0"
110779-111014 uart: tx-data: "191"
111013-111040 uart: tx-stop: "Stop bit" "Stop" "T"
111297-111324 uart: tx-start: "Start bit" "Start" "S"
111323-111350 uart: tx-data-bit: "0"
111349-111376 uart: tx-data-bit: "0"
111375-111402 uart: tx-data-bit: "0"
111401-111428 uart: tx-data-bit: "0"
111427-111454 uart: tx-data-bit: "0"
111453-111480 uart: tx-data-bit: "0"
111479-111506 uart: tx-data-bit: "1"
111505-111532 uart: tx-data-bit: "1"
111531-111558 uart: tx-data-bit: "0"
111323-111558 uart: tx-data: "192"
111557-111584 uart: tx-stop: "Stop bit" "Stop" "T"
111840-111867 uart: tx-start: "Start bit" "Start" "S"
111866-111893 uart: tx-data-bit: "1"
111892-111919 uart: tx-data-bit: "0"
111918-111945 uart: tx-data-bit: "0"
111944-111971 uart: tx-data-bit: "0"
111970-111997 uart: tx-data-bit: "0"
111996-112023 uart: tx-data-bit: "0"
112022-112049 uart: tx-data-bit: "1"
112048-112075 uart: tx-data-bit: "1"
112074-112101 uart: tx-data-bit: "0"
111866-112101 uart: tx-data: "193"
112100-112127 uart: tx-stop: "Stop bit" "Stop" "T"
112384-112411 uart: tx-start: "Start bit" "Start" "S"
112410-112437 uart: tx-data-bit: "0"
112436-112463 uart: tx-data-bit: "1"
112462-112489 uart: tx-data-bit: "0"
112488-112515 uart: tx-data-bit: "0"
112514-112541 uart: tx-data-bit: "0"
112540-112567 uart: tx-data-bit: "0"
112566-112593 uart: tx-data-bit: "1"
112592-112619 uart: tx-data-bit: "1"
112618-112645 uart: tx-data-bit: "0"
112410-112645 uart: tx-data: "194"
112644-112671 uart: tx-stop: "Stop bit" "Stop" "T"
112929-112956 uart: tx-start: "Start bit" "Start" "S"
112955-112982 uart: tx-data-bit: "1"
112981-113008 uart: tx-data-bit: "1"
113007-113034 uart: tx-data-bit: "0"
113033-113060 uart: tx-data-bit: "0"
113059-113086 uart: tx-data-bit: "0"
113085-113112 uart: tx-data-bit: "0"
113111-113138 uart: tx-data-bit: "1"
113137-113164 uart: tx-data-bit: "1"
113163-113190 uart: tx-data-bit: "0"
112955-113190 uart: tx-data: "195"
104770-113190 uart: tx-packet: "180 181 182 183 184 185 186 187 188 189 190 191 192 193 194 195"
113189-113216 uart: tx-stop: "Stop bit" "Stop" "T"
113474-113501 uart: tx-start: "Start bit" "Start" "S"
113500-113527 uart: tx-data-bit: "0"
113526-113553 uart: tx-data-bit: "0"
113552-113579 uart: tx-data-bit: "1"
113578-113605 uart: tx-data-bit: "0"
113604-113631 uart: tx-data-bit: "0"
113630-113657 uart: tx-data-bit: "0"
113656-113683 uart: tx-data-bit: "1"
113682-113709 uart: tx-data-bit: "1"
113708-113735 uart: tx-data-bit: "0"
113500-113735 uart: tx-data: "196"
113734-113761 uart: tx-stop: "Stop bit" "Stop" "T"
114018-114045 uart: tx-start: "Start bit" "Start" "S"
114044-114071 uart: tx-data-bit: "1"
114070-114097 uart: tx-data-bit: "0"
114096-114123 uart: tx-data-bit: "1"
114122-114149 uart: tx-data-bit: "0"
114148-114175 uart: tx-data-bit: "0"
114174-114201 uart: tx-data-bit: "0"
114200-114227 uart: tx-data-bit: "1"
114226-114253 uart: tx-data-bit: "1"
114252-114279 uart: tx-data-bit: "0"
114044-114279 uart: tx-data: "197"
114278-114305 uart: tx-stop: "Stop bit" "Stop" "T"
114565-114592 uart: tx-start: "Start bit" "Start" "S"
114591-114618 uart: tx-data-bit: "0"
114617-114644 uart: tx-data-bit: "1"
114643-114670 uart: tx-data-bit: "1"
114669-114696 uart: tx-data-bit: "0"
114695-114722 uart: tx-data-bit: "0"
114721-114748 uart: tx-data-bit: "0"
114747-114774 uart: tx-data-bit: "1"
114773-114800 uart: tx-data-bit: "1"
114799-114826 uart: tx-data-bit: "0"
114591-114826 uart: tx-data: "198"
114825-114852 uart: tx-stop: "Stop bit" "Stop" "T"
115109-115136 uart: tx-start: "Start bit" "Start" "S"
115135-115162 uart: tx-data-bit: "1"
115161-115188 uart: tx-data-bit: "1"
115187-115214 uart: tx-data-bit: "1"
115213-115240 uart: tx-data-bit: "0"
115239-115266 uart: tx-data-bit: "0"
115265-115292 uart: tx-data-bit: "0"
115291-115318 uart: tx-data-bit: "1"
115317-115344 uart: tx-data-bit: "1"
115343-115370 uart: tx-data-bit: "0"
115135-115370 uart: tx-data: "199"
115369-115396 uart: tx-stop: "Stop bit" "Stop" "T"
115654-115681 uart: tx-start: "Start bit" "Start" "S"
115680-115707 uart: tx-data-bit: "0"
115706-115733 uart: tx-data-bit: "0"
115732-115759 uart: tx-data-bit: "0"
115758-115785 uart: tx-data-bit: "1"
115784-115811 uart: tx-data-bit: "0"
115810-115837 uart: tx-data-bit: "0"
115836-115863 uart: tx-data-bit: "1"
115862-115889 uart: tx-data-bit: "1"
115888-115915 uart: tx-data-bit: "0"
115680-115915 uart: tx-data: "200"
115914-115941 uart: tx-stop: "Stop bit" "Stop" "T"
116198-116225 uart: tx-start: "Start bit" "Start" "S"
116224-116251 uart: tx-data-bit: "1"
116250-116277 uart: tx-data-bit: "0"
116276-116303 uart: tx-data-bit: "0"
116302-116329 uart: tx-data-bit: "1"
116328-116355 uart: tx-data-bit: "0"
116354-116381 uart: tx-data-bit: "0"
116380-116407 uart: tx-data-bit: "1"
116406-116433 uart: tx-data-bit: "1"
116432-116459 uart: tx-data-bit: "0"
116224-116459 uart: tx-data: "201"
116458-116485 uart: tx-stop: "Stop bit" "Stop" "T"
116745-116772 uart: tx-start: "Start bit" "Start" "S"
116771-116798 uart: tx-data-bit: "0"
116797-116824 uart: tx-data-bit: "1"
116823-116850 uart: tx-data-bit: "0"
116849-116876 uart: tx-data-bit: "1"
116875-116902 uart: tx-data-bit: "0"
116901-116928 uart: tx-data-bit: "0"
116927-116954 uart: tx-data-bit: "1"
116953-116980 uart: tx-data-bit: "1"
116979-117006 uart: tx-data-bit: "0"
116771-117006 uart: tx-data: "202"
117005-117032 uart: tx-stop: "Stop bit" "Stop" "T"
117292-117319 uart: tx-start: "Start bit" "Start" "S"
117318-117345 uart: tx-data-bit: "1"
117344-117371 uart: tx-data-bit: "1"
117370-117397 uart: tx-data-bit: "0"
117396-117423 uart: tx-data-bit: "1"
117422-117449 uart: tx-data-bit: "0"
117448-117475 uart: tx-data-bit: "0"
117474-117501 uart: tx-data-bit: "1"
117500-117527 uart: tx-data-bit: "1"
117526-117553 uart: tx-data-bit: "0"
117318-117553 uart: tx-data: "203"
117552-117579 uart: tx-stop: "Stop bit" "Stop" "T"
117838-117865 uart: tx-start: "Start bit" "Start" "S"
117864-117891 uart: tx-data-bit: "0"
117890-117917 uart: tx-data-bit: "0"
117916-117943 uart: tx-data-bit: "1"
117942-117969 uart: tx-data-bit: "1"
117968-117995 uart: tx-data-bit: "0"
117994-118021 uart: tx-data-bit: "0"
118020-118047 uart: tx-data-bit: "1"
118046-118073 uart: tx-data-bit: "1"
118072-118099 uart: tx-data-bit: "0"
117864-118099 uart: tx-data: "204"
118098-118125 uart: tx-stop: "Stop bit" "Stop" "T"
118383-118410 uart: tx-start: "Start bit" "Start" "S"
118409-118436 uart: tx-data-bit: "1"
118435-118462 uart: tx-data-bit: "0"
118461-118488 uart: tx-data-bit: "1"
118487-118514 uart: tx-data-bit: "1"
118513-118540 uart: tx-data-bit: "0"
118539-118566 uart: tx-data-bit: "0"
118565-118592 uart: tx-data-bit: "1"
118591-118618 uart: tx-data-bit: "1"
118617-118644 uart: tx-data-bit: "0"
118409-118644 uart: tx-data: "205"
118643-118670 uart: tx-stop: "Stop bit" "Stop" "T"
118929-118956 uart: tx-start: "Start bit" "Start" "S"
118955-118982 uart: tx-data-bit: "0"
118981-119008 uart: tx-data-bit: "1"
119007-119034 uart: tx-data-bit: "1"
119033-119060 uart: tx-data-bit: "1"
119059-119086 uart: tx-data-bit: "0"
119085-119112 uart: tx-data-bit: "0"
119111-119138 uart: tx-data-bit: "1"
119137-119164 uart: tx-data-bit: "1"
119163-119190 uart: tx-data-bit: "0"
118955-119190 uart: tx-data: "206"
119189-119216 uart: tx-stop: "Stop bit" "Stop" "T"
119474-119501 uart: tx-start: "Start bit" "Start" "S"
119500-119527 uart: tx-data-bit: "1"
119526-119553 uart: tx-data-bit: "1"
119552-119579 uart: tx-data-bit: "1"
119578-119605 uart: tx-data-bit: "1"
119604-119631 uart: tx-data-bit: "0"
119630-119657 uart: tx-data-bit: "0"
119656-119683 uart: tx-data-bit: "1"
119682-119709 uart: tx-data-bit: "1"
119708-119735 uart: tx-data-bit: "0"
119500-119735 uart: tx-data: "207"
119734-119761 uart: tx-stop: "Stop bit" "Stop" "T"
120018-120045 uart: tx-start: "Start bit" "Start" "S"
120044-120071 uart: tx-data-bit: "0"
120070-120097 uart: tx-data-bit: "0"
120096-120123 uart: tx-data-bit: "0"
120122-120149 uart: tx-data-bit: "0"
120148-120175 uart: tx-data-bit: "1"
120174-120201 uart: tx-data-bit: "0"
120200-120227 uart: tx-data-bit: "1"
120226-120253 uart: tx-data-bit: "1"
120252-120279 uart: tx-data-bit: "0"
120044-120279 uart: tx-data: "208"
120278-120305 uart: tx-stop: "Stop bit" "Stop" "T"
120563-120590 uart: tx-start: "Start bit" "Start" "S"
120589-120616 uart: tx-data-bit: "1"
120615-120642 uart: tx-data-bit: "0"
120641-120668 uart: tx-data-bit: "0"
120667-120694 uart: tx-data-bit: "0"
120693-120720 uart: tx-data-bit: "1"
120719-120746 uart: tx-data-bit: "0"
120745-120772 uart: tx-data-bit: "1"
120771-120798 uart: tx-data-bit: "1"
120797-120824 uart: tx-data-bit: "0"
120589-120824 uart: tx-data: "209"
120823-120850 uart: tx-stop: "Stop bit" "Stop" "T"
121109-121136 uart: tx-start: "Start bit" "Start" "S"
121135-121162 uart: tx-data-bit: "0"
121161-121188 uart: tx-data-bit: "1"
121187-121214 uart: tx-data-bit: "0"
121213-121240 uart: tx-data-bit: "0"
121239-121266 uart: tx-data-bit: "1"
121265-121292 uart: tx-data-bit: "0"
121291-121318 uart: tx-data-bit: "1"
121317-121344 uart: tx-data-bit: "1"
121343-121370 uart: tx-data-bit: "0"
121135-121370 uart: tx-data: "210"
121369-121396 uart: tx-stop: "Stop bit" "Stop" "T"
121656-121683 uart: tx-start: "Start bit" "Start" "S"
121682-121709 uart: tx-data-bit: "1"
121708-121735 uart: tx-data-bit: "1"
121734-121761 uart: tx-data-bit: "0"
121760-121787 uart: tx-data-bit: "0"
121786-121813 uart: tx-data-bit: "1"
121812-121839 uart: tx-data-bit: "0"
121838-121865 uart: tx-data-bit: "1"
121864-121891 uart: tx-data-bit: "1"
121890-121917 uart: tx-data-bit: "0"
121682-121917 uart: tx-data: "211"
113500-121917 uart: tx-packet: "196 197 198 199 200 201 202 203 204 205 206 207 208 209 210 211"
121916-121943 uart: tx-stop: "Stop bit" "Stop" "T"
122203-122230 uart: tx-start: "Start bit" "Start" "S"
122229-122256 uart: tx-data-bit: "0"
122255-122282 uart: tx-data-bit: "0"
122281-122308 uart: tx-data-bit: "1"
122307-122334 uart: tx-data-bit: "0"
122333-122360 uart: tx-data-bit: "1"
122359-122386 uart: tx-data-bit: "0"
122385-122412 uart: tx-data-bit: "1"
122411-122438 uart: tx-data-bit: "1"
122437-122464 uart: tx-data-bit: "0"
122229-122464 uart: tx-data: "212"
122463-122490 uart: tx-stop: "Stop bit" "Stop" "T"
122749-122776 uart: tx-start: "Start bit" "Start" "S"
122775-122802 uart: tx-data-bit: "1"
122801-122828 uart: tx-data-bit: "0"
122827-122854 uart: tx-data-bit: "1"
122853-122880 uart: tx-data-bit: "0"
122879-122906 uart: tx-data-bit: "1"
122905-122932 uart: tx-data-bit: "0"
122931-122958 uart: tx-data-bit: "1"
122957-122984 uart: tx-data-bit: "1"
122983-123010 uart: tx-data-bit: "0"
122775-123010 uart: tx-data: "213"
123009-123036 uart: tx-stop: "Stop bit" "Stop" "T"
123298-123325 uart: tx-start: "Start bit" "Start" "S"
123324-123351 uart: tx-data-bit: "0"
123350-123377 uart: tx-data-bit: "1"
123376-123403 uart: tx-data-bit: "1"
123402-123429 uart: tx-data-bit: "0"
123428-123455 uart: tx-data-bit: "1"
123454-123481 uart: tx-data-bit: "0"
123480-123507 uart: tx-data-bit: "1"
123506-123533 uart: tx-data-bit: "1"
123532-123559 uart: tx-data-bit: "0"
123324-123559 uart: tx-data: "214"
123558-123585 uart: tx-stop: "Stop bit" "Stop" "T"
123844-123871 uart: tx-start: "Start bit" "Start" "S"
123870-123897 uart: tx-data-bit: "1"
123896-123923 uart: tx-data-bit: "1"
123922-123949 uart: tx-data-bit: "1"
123948-123975 uart: tx-data-bit: "0"
123974-124001 uart: tx-data-bit: "1"
124000-124027 uart: tx-data-bit: "0"
124026-124053 uart: tx-data-bit: "1"
124052-124079 uart: tx-data-bit: "1"
124078-124105 uart: tx-data-bit: "0"
123870-124105 uart: tx-data: "215"
124104-124131 uart: tx-stop: "Stop bit" "Stop" "T"
124391-124418 uart: tx-start: "Start bit" "Start" "S"
124417-124444 uart: tx-data-bit: "0"
124443-124470 uart: tx-data-bit: "0"
124469-124496 uart: tx-data-bit: "0"
124495-124522 uart: tx-data-bit: "1"
124521-124548 uart: tx-data-bit: "1"
124547-124574 uart: tx-data-bit: "0"
124573-124600 uart: tx-data-bit: "1"
124599-124626 uart: tx-data-bit: "1"
124625-124652 uart: tx-data-bit: "0"
124417-124652 uart: tx-data: "216"
124651-124678 uart: tx-stop: "Stop bit" "Stop" "T"
124935-124962 uart: tx-start: "Start bit" "Start" "S"
124961-124988 uart: tx-data-bit: "1"
124987-125014 uart: tx-data-bit: "0"
125013-125040 uart: tx-data-bit: "0"
125039-125066 uart: tx-data-bit: "1"
125065-125092 uart: tx-data-bit: "1"
125091-125118 uart: tx-data-bit: "0"
125117-125144 uart: tx-data-bit: "1"
125143-125170 uart: tx-data-bit: "1"
125169-125196 uart: tx-data-bit: "0"
124961-125196 uart: tx-data: "217"
125195-125222 uart: tx-stop: "Stop bit" "Stop" "T"
125482-125509 uart: tx-start: "Start bit" "Start" "S"
125508-125535 uart: tx-data-bit: "0"
125534-125561 uart: tx-data-bit: "1"
125560-125587 uart: tx-data-bit: "0"
125586-125613 uart: tx-data-bit: "1"
125612-125639 uart: tx-data-bit: "1"
125638-125665 uart: tx-data-bit: "0"
125664-125691 uart: tx-data-bit: "1"
125690-125717 uart: tx-data-bit: "1"
125716-125743 uart: tx-data-bit: "0"
125508-125743 uart: tx-data: "218"
125742-125769 uart: tx-stop: "Stop bit" "Stop" "T"
126029-126056 uart: tx-start: "Start bit" "Start" "S"
126055-126082 uart: tx-data-bit: "1"
126081-126108 uart: tx-data-bit: "1"
126107-126134 uart: tx-data-bit: "0"
126133-126160 uart: tx-data-bit: "1"
126159-126186 uart: tx-data-bit: "1"
126185-126212 uart: tx-data-bit: "0"
126211-126238 uart: tx-data-bit: "1"
126237-126264 uart: tx-data-bit: "1"
126263-126290 uart: tx-data-bit: "0"
126055-126290 uart: tx-data: "219"
126289-126316 uart: tx-stop: "Stop bit" "Stop" "T"
126575-126602 uart: tx-start: "Start bit" "Start" "S"
126601-126628 uart: tx-data-bit: "0"
126627-126654 uart: tx-data-bit: "0"
126653-126680 uart: tx-data-bit: "1"
126679-126706 uart: tx-data-bit: "1"
126705-126732 uart: tx-data-bit: "1"
126731-126758 uart: tx-data-bit: "0"
126757-126784 uart: tx-data-bit: "1"
126783-126810 uart: tx-data-bit: "1"
126809-126836 uart: tx-data-bit: "0"
126601-126836 uart: tx-data: "220"
126835-126862 uart: tx-stop: "Stop bit" "Stop" "T"
127120-127147 uart: tx-start: "Start bit" "Start" "S"
127146-127173 uart: tx-data-bit: "1"
127172-127199 uart: tx-data-bit: "0"
127198-127225 uart: tx-data-bit: "1"
127224-127251 uart: tx-data-bit: "1"
127250-127277 uart: tx-data-bit: "1"
127276-127303 uart: tx-data-bit: "0"
127302-127329 uart: tx-data-bit: "1"
127328-127355 uart: tx-data-bit: "1"
127354-127381 uart: tx-data-bit: "0"
127146-127381 uart: tx-data: "221"
127380-127407 uart: tx-stop: "Stop bit" "Stop" "T"
127666-127693 uart: tx-start: "Start bit" "Start" "S"
127692-127719 uart: tx-data-bit: "0"
127718-127745 uart: tx-data-bit: "1"
127744-127771 uart: tx-data-bit: "1"
127770-127797 uart: tx-data-bit: "1"
127796-127823 uart: tx-data-bit: "1"
127822-127849 uart: tx-data-bit: "0"
127848-127875 uart: tx-data-bit: "1"
127874-127901 uart: tx-data-bit: "1"
127900-127927 uart: tx-data-bit: "0"
127692-127927 uart: tx-data: "222"
127926-127953 uart: tx-stop: "Stop bit" "Stop" "T"
128211-128238 uart: tx-start: "Start bit" "Start" "S"
128237-128264 uart: tx-data-bit: "1"
128263-128290 uart: tx-data-bit: "1"
128289-128316 uart: tx-data-bit: "1"
128315-128342 uart: tx-data-bit: "1"
128341-128368 uart: tx-data-bit: "1"
128367-128394 uart: tx-data-bit: "0"
128393-128420 uart: tx-data-bit: "1"
128419-128446 uart: tx-data-bit: "1"
128445-128472 uart: tx-data-bit: "0"
128237-128472 uart: tx-data: "223"
128471-128498 uart: tx-stop: "Stop bit" "Stop" "T"
128755-128782 uart: tx-start: "Start bit" "Start" "S"
128781-128808 uart: tx-data-bit: "0"
128807-128834 uart: tx-data-bit: "0"
128833-128860 uart: tx-data-bit: "0"
128859-128886 uart: tx-data-bit: "0"
128885-128912 uart: tx-data-bit: "0"
128911-128938 uart: tx-data-bit: "1"
128937-128964 uart: tx-data-bit: "1"
128963-128990 uart: tx-data-bit: "1"
128989-129016 uart: tx-data-bit: "0"
128781-129016 uart: tx-data: "224"
129015-129042 uart: tx-stop: "Stop bit" "Stop" "T"
129298-129325 uart: tx-start: "Start bit" "Start" "S"
129324-129351 uart: tx-data-bit: "1"
129350-129377 uart: tx-data-bit: "0"
129376-129403 uart: tx-data-bit: "0"
129402-129429 uart: tx-data-bit: "0"
129428-129455 uart: tx-data-bit: "0"
129454-129481 uart: tx-data-bit: "1"
129480-129507 uart: tx-data-bit: "1"
129506-129533 uart: tx-data-bit: "1"
129532-129559 uart: tx-data-bit: "0"
129324-129559 uart: tx-data: "225"
129558-129585 uart: tx-stop: "Stop bit" "Stop" "T"
129843-129870 uart: tx-start: "Start bit" "Start" "S"
129869-129896 uart: tx-data-bit: "0"
129895-129922 uart: tx-data-bit: "1"
129921-129948 uart: tx-data-bit: "0"
129947-129974 uart: tx-data-bit: "0"
129973-130000 uart: tx-data-bit: "0"
129999-130026 uart: tx-data-bit: "1"
130025-130052 uart: tx-data-bit: "1"
130051-130078 uart: tx-data-bit: "1"
130077-130104 uart: tx-data-bit: "0"
129869-130104 uart: tx-data: "226"
130103-130130 uart: tx-stop: "Stop bit" "Stop" "T"
130387-130414 uart: tx-start: "Start bit" "Start" "S"
130413-130440 uart: tx-data-bit: "1"
130439-130466 uart: tx-data-bit: "1"
130465-130492 uart: tx-data-bit: "0"
130491-130518 uart: tx-data-bit: "0"
130517-130544 uart: tx-data-bit: "0"
130543-130570 uart: tx-data-bit: "1"
130569-130596 uart: tx-data-bit: "1"
130595-130622 uart: tx-data-bit: "1"
130621-130648 uart: tx-data-bit: "0"
130413-130648 uart: tx-data: "227"
122229-130648 uart: tx-packet: "212 213 214 215 216 217 218 219 220 221 222 223 224 225 226 227"
130647-130674 uart: tx-stop: "Stop bit" "Stop" "T"
130932-130959 uart: tx-start: "Start bit" "Start" "S"
130958-130985 uart: tx-data-bit: "0"
130984-131011 uart: tx-data-bit: "0"
131010-131037 uart: tx-data-bit: "1"
131036-131063 uart: tx-data-bit: "0"
131062-131089 uart: tx-data-bit: "0"
131088-131115 uart: tx-data-bit: "1"
131114-131141 uart: tx-data-bit: "1"
131140-131167 uart: tx-data-bit: "1"
131166-131193 uart: tx-data-bit: "0"
130958-131193 uart: tx-data: "228"
131192-131219 uart: tx-stop: "Stop bit" "Stop" "T"
131476-131503 uart: tx-start: "Start bit" "Start" "S"
131502-131529 uart: tx-data-bit: "1"
131528-131555 uart: tx-data-bit: "0"
131554-131581 uart: tx-data-bit: "1"
131580-131607 uart: tx-data-bit: "0"
131606-131633 uart: tx-data-bit: "0"
131632-131659 uart: tx-data-bit: "1"
131658-131685 uart: tx-data-bit: "1"
131684-131711 uart: tx-data-bit: "1"
131710-131737 uart: tx-data-bit: "0"
131502-131737 uart: tx-data: "229"
131736-131763 uart: tx-stop: "Stop bit" "Stop" "T"
132023-132050 uart: tx-start: "Start bit" "Start" "S"
132049-132076 uart: tx-data-bit: "0"
132075-132102 uart: tx-data-bit: "1"
132101-132128 uart: tx-data-bit: "1"
132127-132154 uart: tx-data-bit: "0"
132153-132180 uart: tx-data-bit: "0"
132179-132206 uart: tx-data-bit: "1"
132205-132232 uart: tx-data-bit: "1"
132231-132258 uart: tx-data-bit: "1"
132257-132284 uart: tx-data-bit: "0"
132049-132284 uart: tx-data: "230"
132283-132310 uart: tx-stop: "Stop bit" "Stop" "T"
132567-132594 uart: tx-start: "Start bit" "Start" "S"
132593-132620 uart: tx-data-bit: "1"
132619-132646 uart: tx-data-bit: "1"
132645-132672 uart: tx-data-bit: "1"
132671-132698 uart: tx-data-bit: "0"
132697-132724 uart: tx-data-bit: "0"
132723-132750 uart: tx-data-bit: "1"
132749-132776 uart: tx-data-bit: "1"
132775-132802 uart: tx-data-bit: "1"
132801-132828 uart: tx-data-bit: "0"
132593-132828 uart: tx-data: "231"
132827-132854 uart: tx-stop: "Stop bit" "Stop" "T"
133112-133139 uart: tx-start: "Start bit" "Start" "S"
133138-133165 uart: tx-data-bit: "0"
133164-133191 uart: tx-data-bit: "0"
133190-133217 uart: tx-data-bit: "0"
133216-133243 uart: tx-data-bit: "1"
133242-133269 uart: tx-data-bit: "0"
133268-133295 uart: tx-data-bit: "1"
133294-133321 uart: tx-data-bit: "1"
133320-133347 uart: tx-data-bit: "1"
133346-133373 uart: tx-data-bit: "0"
133138-133373 uart: tx-data: "232"
133372-133399 uart: tx-stop: "Stop bit" "Stop" "T"
133657-133684 uart: tx-start: "Start bit" "Start" "S"
133683-133710 uart: tx-data-bit: "1"
133709-133736 uart: tx-data-bit: "0"
133735-133762 uart: tx-data-bit: "0"
133761-133788 uart: tx-data-bit: "1"
133787-133814 uart: tx-data-bit: "0"
133813-133840 uart: tx-data-bit: "1"
133839-133866 uart: tx-data-bit: "1"
133865-133892 uart: tx-data-bit: "1"
133891-133918 uart: tx-data-bit: "0"
133683-133918 uart: tx-data: "233"
133917-133944 uart: tx-stop: "Stop bit" "Stop" "T"
134203-134230 uart: tx-start: "Start bit" "Start" "S"
134229-134256 uart: tx-data-bit: "0"
134255-134282 uart: tx-data-bit: "1"
134281-134308 uart: tx-data-bit: "0"
134307-134334 uart: tx-data-bit: "1"
134333-134360 uart: tx-data-bit: "0"
134359-134386 uart: tx-data-bit: "1"
134385-134412 uart: tx-data-bit: "1"
134411-134438 uart: tx-data-bit: "1"
134437-134464 uart: tx-data-bit: "0"
134229-134464 uart: tx-data: "234"
134463-134490 uart: tx-stop: "Stop bit" "Stop" "T"
134750-134777 uart: tx-start: "Start bit" "Start" "S"
134776-134803 uart: tx-data-bit: "1"
134802-134829 uart: tx-data-bit: "1"
134828-134855 uart: tx-data-bit: "0"
134854-134881 uart: tx-data-bit: "1"
134880-134907 uart: tx-data-bit: "0"
134906-134933 uart: tx-data-bit: "1"
134932-134959 uart: tx-data-bit: "1"
134958-134985 uart: tx-data-bit: "1"
134984-135011 uart: tx-data-bit: "0"
134776-135011 uart: tx-data: "235"
135010-135037 uart: tx-stop: "Stop bit" "Stop" "T"
135296-135323 uart: tx-start: "Start bit" "Start" "S"
135322-135349 uart: tx-data-bit: "0"
135348-135375 uart: tx-data-bit: "0"
135374-135401 uart: tx-data-bit: "1"
135400-135427 uart: tx-data-bit: "1"
135426-135453 uart: tx-data-bit: "0"
135452-135479 uart: tx-data-bit: "1"
135478-135505 uart: tx-data-bit: "1"
135504-135531 uart: tx-data-bit: "1"
135530-135557 uart: tx-data-bit: "0"
135322-135557 uart: tx-data: "236"
135556-135583 uart: tx-stop: "Stop bit" "Stop" "T"
135841-135868 uart: tx-start: "Start bit" "Start" "S"
135867-135894 uart: tx-data-bit: "1"
135893-135920 uart: tx-data-bit: "0"
135919-135946 uart: tx-data-bit: "1"
135945-135972 uart: tx-data-bit: "1"
135971-135998 uart: tx-data-bit: "0"
135997-136024 uart: tx-data-bit: "1"
136023-136050 uart: tx-data-bit: "1"
136049-136076 uart: tx-data-bit: "1"
136075-136102 uart: tx-data-bit: "0"
135867-136102 uart: tx-data: "237"
136101-136128 uart: tx-stop: "Stop bit" "Stop" "T"
136388-136415 uart: tx-start: "Start bit" "Start" "S"
136414-136441 uart: tx-data-bit: "0"
136440-136467 uart: tx-data-bit: "1"
136466-136493 uart: tx-data-bit: "1"
136492-136519 uart: tx-data-bit: "1"
136518-136545 uart: tx-data-bit: "0"
136544-136571 uart: tx-data-bit: "1"
136570-136597 uart: tx-data-bit: "1"
136596-136623 uart: tx-data-bit: "1"
136622-136649 uart: tx-data-bit: "0"
136414-136649 uart: tx-data: "238"
136648-136675 uart: tx-stop: "Stop bit" "Stop" "T"
136933-136960 uart: tx-start: "Start bit" "Start" "S"
136959-136986 uart: tx-data-bit: "1"
136985-137012 uart: tx-data-bit: "1"
137011-137038 uart: tx-data-bit: "1"
137037-137064 uart: tx-data-bit: "1"
137063-137090 uart: tx-data-bit: "0"
137089-137116 uart: tx-data-bit: "1"
137115-137142 uart: tx-data-bit: "1"
137141-137168 uart: tx-data-bit: "1"
137167-137194 uart: tx-data-bit: "0"
136959-137194 uart: tx-data: "239"
137193-137220 uart: tx-stop: "Stop bit" "Stop" "T"
137478-137505 uart: tx-start: "Start bit" "Start" "S"
137504-137531 uart: tx-data-bit: "0"
137530-137557 uart: tx-data-bit: "0"
137556-137583 uart: tx-data-bit: "0"
137582-137609 uart: tx-data-bit: "0"
137608-137635 uart: tx-data-bit: "1"
137634-137661 uart: tx-data-bit: "1"
137660-137687 uart: tx-data-bit: "1"
137686-137713 uart: tx-data-bit: "1"
137712-137739 uart: tx-data-bit: "0"
137504-137739 uart: tx-data: "240"
137738-137765 uart: tx-stop: "Stop bit" "Stop" "T"
138020-138047 uart: tx-start: "Start bit" "Start" "S"
138046-138073 uart: tx-data-bit: "1"
138072-138099 uart: tx-data-bit: "0"
138098-138125 uart: tx-data-bit: "0"
138124-138151 uart: tx-data-bit: "0"
138150-138177 uart: tx-data-bit: "1"
138176-138203 uart: tx-data-bit: "1"
138202-138229 uart: tx-data-bit: "1"
138228-138255 uart: tx-data-bit: "1"
138254-138281 uart: tx-data-bit: "0"
138046-138281 uart: tx-data: "241"
138280-138307 uart: tx-stop: "Stop bit" "Stop" "T"
138565-138592 uart: tx-start: "Start bit" "Start" "S"
138591-138618 uart: tx-data-bit: "0"
138617-138644 uart: tx-data-bit: "1"
138643-138670 uart: tx-data-bit: "0"
138669-138696 uart: tx-data-bit: "0"
138695-138722 uart: tx-data-bit: "1"
138721-138748 uart: tx-data-bit: "1"
138747-138774 uart: tx-data-bit: "1"
138773-138800 uart: tx-data-bit: "1"
138799-138826 uart: tx-data-bit: "0"
138591-138826 uart: tx-data: "242"
138825-138852 uart: tx-stop: "Stop bit" "Stop" "T"
139109-139136 uart: tx-start: "Start bit" "Start" "S"
139135-139162 uart: tx-data-bit: "1"
139161-139188 uart: tx-data-bit: "1"
139187-139214 uart: tx-data-bit: "0"
139213-139240 uart: tx-data-bit: "0"
139239-139266 uart: tx-data-bit: "1"
139265-139292 uart: tx-data-bit: "1"
139291-139318 uart: tx-data-bit: "1"
139317-139344 uart: tx-data-bit: "1"
139343-139370 uart: tx-data-bit: "0"
139135-139370 uart: tx-data: "243"
130958-139370 uart: tx-packet: "228 229 230 231 232 233 234 235 236 237 238 239 240 241 242 243"
139369-139396 uart: tx-stop: "Stop bit" "Stop" "T"
139654-139681 uart: tx-start: "Start bit" "Start" "S"
139680-139707 uart: tx-data-bit: "0"
139706-139733 uart: tx-data-bit: "0"
139732-139759 uart: tx-data-bit: "1"
139758-139785 uart: tx-data-bit: "0"
139784-139811 uart: tx-data-bit: "1"
139810-139837 uart: tx-data-bit: "1"
139836-139863 uart: tx-data-bit: "1"
139862-139889 uart: tx-data-bit: "1"
139888-139915 uart: tx-data-bit: "0"
139680-139915 uart: tx-data: "244"
139914-139941 uart: tx-stop: "Stop bit" "Stop" "T"
140198-140225 uart: tx-start: "Start bit" "Start" "S"
140224-140251 uart: tx-data-bit: "1"
140250-140277 uart: tx-data-bit: "0"
140276-140303 uart: tx-data-bit: "1"
140302-140329 uart: tx-data-bit: "0"
140328-140355 uart: tx-data-bit: "1"
140354-140381 uart: tx-data-bit: "1"
140380-140407 uart: tx-data-bit: "1"
140406-140433 uart: tx-data-bit: "1"
140432-140459 uart: tx-data-bit: "0"
140224-140459 uart: tx-data: "245"
140458-140485 uart: tx-stop: "Stop bit" "Stop" "T"
140745-140772 uart: tx-start: "Start bit" "Start" "S"
140771-140798 uart: tx-data-bit: "0"
140797-140824 uart: tx-data-bit: "1"
140823-140850 uart: tx-data-bit: "1"
140849-140876 uart: tx-data-bit: "0"
140875-140902 uart: tx-data-bit: "1"
140901-140928 uart: tx-data-bit: "1"
140927-140954 uart: tx-data-bit: "1"
140953-140980 uart: tx-data-bit: "1"
140979-141006 uart: tx-data-bit: "0"
140771-141006 uart: tx-data: "246"
141005-141032 uart: tx-stop: "Stop bit" "Stop" "T"
141290-141317 uart: tx-start: "Start bit" "Start" "S"
141316-141343 uart: tx-data-bit: "1"
141342-141369 uart: tx-data-bit: "1"
141368-141395 uart: tx-data-bit: "1"
141394-141421 uart: tx-data-bit: "0"
141420-141447 uart: tx-data-bit: "1"
141446-141473 uart: tx-data-bit: "1"
141472-141499 uart: tx-data-bit: "1"
141498-141525 uart: tx-data-bit: "1"
141524-141551 uart: tx-data-bit: "0"
141316-141551 uart: tx-data: "247"
141550-141577 uart: tx-stop: "Stop bit" "Stop" "T"
141834-141861 uart: tx-start: "Start bit" "Start" "S"
141860-141887 uart: tx-data-bit: "0"
141886-141913 uart: tx-data-bit: "0"
141912-141939 uart: tx-data-bit: "0"
141938-141965 uart: tx-data-bit: "1"
141964-141991 uart: tx-data-bit: "1"
141990-142017 uart: tx-data-bit: "1"
142016-142043 uart: tx-data-bit: "1"
142042-142069 uart: tx-data-bit: "1"
142068-142095 uart: tx-data-bit: "0"
141860-142095 uart: tx-data: "248"
142094-142121 uart: tx-stop: "Stop bit" "Stop" "T"
142377-142404 uart: tx-start: "Start bit" "Start" "S"
142403-142430 uart: tx-data-bit: "1"
142429-142456 uart: tx-data-bit: "0"
142455-142482 uart: tx-data-bit: "0"
142481-142508 uart: tx-data-bit: "1"
142507-142534 uart: tx-data-bit: "1"
142533-142560 uart: tx-data-bit: "1"
142559-142586 uart: tx-data-bit: "1"
142585-142612 uart: tx-data-bit: "1"
142611-142638 uart: tx-data-bit: "0"
142403-142638 uart: tx-data: "249"
142637-142664 uart: tx-stop: "Stop bit" "Stop" "T"
142921-142948 uart: tx-start: "Start bit" "Start" "S"
142947-142974 uart: tx-data-bit: "0"
142973-143000 uart: tx-data-bit: "1"
142999-143026 uart: tx-data-bit: "0"
143025-143052 uart: tx-data-bit: "1"
143051-143078 uart: tx-data-bit: "1"
143077-143104 uart: tx-data-bit: "1"
143103-143130 uart: tx-data-bit: "1"
143129-143156 uart: tx-data-bit: "1"
143155-143182 uart: tx-data-bit: "0"
142947-143182 uart: tx-data: "250"
143181-143208 uart: tx-stop: "Stop bit" "Stop" "T"
143466-143493 uart: tx-start: "Start bit" "Start" "S"
143492-143519 uart: tx-data-bit: "1"
143518-143545 uart: tx-data-bit: "1"
143544-143571 uart: tx-data-bit: "0"
143570-143597 uart: tx-data-bit: "1"
143596-143623 uart: tx-data-bit: "1"
143622-143649 uart: tx-data-bit: "1"
143648-143675 uart: tx-data-bit: "1"
143674-143701 uart: tx-data-bit: "1"
143700-143727 uart: tx-data-bit: "0"
143492-143727 uart: tx-data: "251"
143726-143753 uart: tx-stop: "Stop bit" "Stop" "T"
144010-144037 uart: tx-start: "Start bit" "Start" "S"
144036-144063 uart: tx-data-bit: "0"
144062-144089 uart: tx-data-bit: "0"
144088-144115 uart: tx-data-bit: "1"
144114-144141 uart: tx-data-bit: "1"
144140-144167 uart: tx-data-bit: "1"
144166-144193 uart: tx-data-bit: "1"
144192-144219 uart: tx-data-bit: "1"
144218-144245 uart: tx-data-bit: "1"
144244-144271 uart: tx-data-bit: "0"
144036-144271 uart: tx-data: "252"
144270-144297 uart: tx-stop: "Stop bit" "Stop" "T"
144553-144580 uart: tx-start: "Start bit" "Start" "S"
144579-144606 uart: tx-data-bit: "1"
144605-144632 uart: tx-data-bit: "0"
144631-144658 uart: tx-data-bit: "1"
144657-144684 uart: tx-data-bit: "1"
144683-144710 uart: tx-data-bit: "1"
144709-144736 uart: tx-data-bit: "1"
144735-144762 uart: tx-data-bit: "1"
144761-144788 uart: tx-data-bit: "1"
144787-144814 uart: tx-data-bit: "0"
144579-144814 uart: tx-data: "253"
144813-144840 uart: tx-stop: "Stop bit" "Stop" "T"
145098-145125 uart: tx-start: "Start bit" "Start" "S"
145124-145151 uart: tx-data-bit: "0"
145150-145177 uart: tx-data-bit: "1"
145176-145203 uart: tx-data-bit: "1"
145202-145229 uart: tx-data-bit: "1"
145228-145255 uart: tx-data-bit: "1"
145254-145281 uart: tx-data-bit: "1"
145280-145307 uart: tx-data-bit: "1"
145306-145333 uart: tx-data-bit: "1"
145332-145359 uart: tx-data-bit: "0"
145124-145359 uart: tx-data: "254"
145358-145385 uart: tx-stop: "Stop bit" "Stop" "T"
145640-145667 uart: tx-start: "Start bit" "Start" "S"
145666-145693 uart: tx-data-bit: "1"
145692-145719 uart: tx-data-bit: "1"
145718-145745 uart: tx-data-bit: "1"
145744-145771 uart: tx-data-bit: "1"
145770-145797 uart: tx-data-bit: "1"
145796-145823 uart: tx-data-bit: "1"
145822-145849 uart: tx-data-bit: "1"
145848-145875 uart: tx-data-bit: "1"
145874-145901 uart: tx-data-bit: "0"
145666-145901 uart: tx-data: "255"
145900-145927 uart: tx-stop: "Stop bit" "Stop" "T"
146183-146210 uart: tx-start: "Start bit" "Start" "S"
146209-146236 uart: tx-data-bit: "0"
146235-146262 uart: tx-data-bit: "0"
146261-146288 uart: tx-data-bit: "0"
146287-146314 uart: tx-data-bit: "0"
146313-146340 uart: tx-data-bit: "0"
146339-146366 uart: tx-data-bit: "0"
146365-146392 uart: tx-data-bit: "0"
146391-146418 uart: tx-data-bit: "0"
146417-146444 uart: tx-data-bit: "1"
146209-146444 uart: tx-data: "256"
146443-146470 uart: tx-stop: "Stop bit" "Stop" "T"
146723-146750 uart: tx-start: "Start bit" "Start" "S"
146749-146776 uart: tx-data-bit: "1"
146775-146802 uart: tx-data-bit: "0"
146801-146828 uart: tx-data-bit: "0"
146827-146854 uart: tx-data-bit: "0"
146853-146880 uart: tx-data-bit: "0"
146879-146906 uart: tx-data-bit: "0"
146905-146932 uart: tx-data-bit: "0"
146931-146958 uart: tx-data-bit: "0"
146957-146984 uart: tx-data-bit: "1"
146749-146984 uart: tx-data: "257"
146983-147010 uart: tx-stop: "Stop bit" "Stop" "T"
147266-147293 uart: tx-start: "Start bit" "Start" "S"
147292-147319 uart: tx-data-bit: "0"
147318-147345 uart: tx-data-bit: "1"
147344-147371 uart: tx-data-bit: "0"
147370-147397 uart: tx-data-bit: "0"
147396-147423 uart: tx-data-bit: "0"
147422-147449 uart: tx-data-bit: "0"
147448-147475 uart: tx-data-bit: "0"
147474-147501 uart: tx-data-bit: "0"
147500-147527 uart: tx-data-bit: "1"
147292-147527 uart: tx-data: "258"
147526-147553 uart: tx-stop: "Stop bit" "Stop" "T"
147808-147835 uart: tx-start: "Start bit" "Start" "S"
147834-147861 uart: tx-data-bit: "1"
147860-147887 uart: tx-data-bit: "1"
147886-147913 uart: tx-data-bit: "0"
147912-147939 uart: tx-data-bit: "0"
147938-147965 uart: tx-data-bit: "0"
147964-147991 uart: tx-data-bit: "0"
147990-148017 uart: tx-data-bit: "0"
148016-148043 uart: tx-data-bit: "0"
148042-148069 uart: tx-data-bit: "1"
147834-148069 uart: tx-data: "259"
139680-148069 uart: tx-packet: "244 245 246 247 248 249 250 251 252 253 254 255 256 257 258 259"
148068-148095 uart: tx-stop: "Stop bit" "Stop" "T"
148351-148378 uart: tx-start: "Start bit" "Start" "S"
148377-148404 uart: tx-data-bit: "0"
148403-148430 uart: tx-data-bit: "0"
148429-148456 uart: tx-data-bit: "1"
148455-148482 uart: tx-data-bit: "0"
148481-148508 uart: tx-data-bit: "0"
148507-148534 uart: tx-data-bit: "0"
148533-148560 uart: tx-data-bit: "0"
148559-148586 uart: tx-data-bit: "0"
148585-148612 uart: tx-data-bit: "1"
148377-148612 uart: tx-data: "260"
148611-148638 uart: tx-stop: "Stop bit" "Stop" "T"
148894-148921 uart: tx-start: "Start bit" "Start" "S"
148920-148947 uart: tx-data-bit: "1"
148946-148973 uart: tx-data-bit: "0"
148972-148999 uart: tx-data-bit: "1"
148998-149025 uart: tx-data-bit: "0"
149024-149051 uart: tx-data-bit: "0"
149050-149077 uart: tx-data-bit: "0"
149076-149103 uart: tx-data-bit: "0"
149102-149129 uart: tx-data-bit: "0"
149128-149155 uart: tx-data-bit: "1"
148920-149155 uart: tx-data: "261"
149154-149181 uart: tx-stop: "Stop bit" "Stop" "T"
149438-149465 uart: tx-start: "Start bit" "Start" "S"
149464-149491 uart: tx-data-bit: "0"
149490-149517 uart: tx-data-bit: "1"
149516-149543 uart: tx-data-bit: "1"
149542-149569 uart: tx-data-bit: "0"
149568-149595 uart: tx-data-bit: "0"
149594-149621 uart: tx-data-bit: "0"
149620-149647 uart: tx-data-bit: "0"
149646-149673 uart: tx-data-bit: "0"
149672-149699 uart: tx-data-bit: "1"
149464-149699 uart: tx-data: "262"
149698-149725 uart: tx-stop: "Stop bit" "Stop" "T"
149981-150008 uart: tx-start: "Start bit" "Start" "S"
150007-150034 uart: tx-data-bit: "1"
150033-150060 uart: tx-data-bit: "1"
150059-150086 uart: tx-data-bit: "1"
150085-150112 uart: tx-data-bit: "0"
150111-150138 uart: tx-data-bit: "0"
150137-150164 uart: tx-data-bit: "0"
150163-150190 uart: tx-data-bit: "0"
150189-150216 uart: tx-data-bit: "0"
150215-150242 uart: tx-data-bit: "1"
150007-150242 uart: tx-data: "263"
150241-150268 uart: tx-stop: "Stop bit" "Stop" "T"
150523-150550 uart: tx-start: "Start bit" "Start" "S"
150549-150576 uart: tx-data-bit: "0"
150575-150602 uart: tx-data-bit: "0"
150601-150628 uart: tx-data-bit: "0"
150627-150654 uart: tx-data-bit: "1"
150653-150680 uart: tx-data-bit: "0"
150679-150706 uart: tx-data-bit: "0"
150705-150732 uart: tx-data-bit: "0"
150731-150758 uart: tx-data-bit: "0"
150757-150784 uart: tx-data-bit: "1"
150549-150784 uart: tx-data: "264"
150783-150810 uart: tx-stop: "Stop bit" "Stop" "T"
151066-151093 uart: tx-start: "Start bit" "Start" "S"
151092-151119 uart: tx-data-bit: "1"
151118-151145 uart: tx-data-bit: "0"
151144-151171 uart: tx-data-bit: "0"
151170-151197 uart: tx-data-bit: "1"
151196-151223 uart: tx-data-bit: "0"
151222-151249 uart: tx-data-bit: "0"
151248-151275 uart: tx-data-bit: "0"
151274-151301 uart: tx-data-bit: "0"
151300-151327 uart: tx-data-bit: "1"
151092-151327 uart: tx-data: "265"
151326-151353 uart: tx-stop: "Stop bit" "Stop" "T"
151610-151637 uart: tx-start: "Start bit" "Start" "S"
151636-151663 uart: tx-data-bit: "0"
151662-151689 uart: tx-data-bit: "1"
151688-151715 uart: tx-data-bit: "0"
151714-151741 uart: tx-data-bit: "1"
151740-151767 uart: tx-data-bit: "0"
151766-151793 uart: tx-data-bit: "0"
151792-151819 uart: tx-data-bit: "0"
151818-151845 uart: tx-data-bit: "0"
151844-151871 uart: tx-data-bit: "1"
151636-151871 uart: tx-data: "266"
151870-151897 uart: tx-stop: "Stop bit" "Stop" "T"
152155-152182 uart: tx-start: "Start bit" "Start" "S"
152181-152208 uart: tx-data-bit: "1"
152207-152234 uart: tx-data-bit: "1"
152233-152260 uart: tx-data-bit: "0"
152259-152286 uart: tx-data-bit: "1"
152285-152312 uart: tx-data-bit: "0"
152311-152338 uart: tx-data-bit: "0"
152337-152364 uart: tx-data-bit: "0"
152363-152390 uart: tx-data-bit: "0"
152389-152416 uart: tx-data-bit: "1"
152181-152416 uart: tx-data: "267"
152415-152442 uart: tx-stop: "Stop bit" "Stop" "T"
152700-152727 uart: tx-start: "Start bit" "Start" "S"
152726-152753 uart: tx-data-bit: "0"
152752-152779 uart: tx-data-bit: "0"
152778-152805 uart: tx-data-bit: "1"
152804-152831 uart: tx-data-bit: "1"
152830-152857 uart: tx-data-bit: "0"
152856-152883 uart: tx-data-bit: "0"
152882-152909 uart: tx-data-bit: "0"
152908-152935 uart: tx-data-bit: "0"
152934-152961 uart: tx-data-bit: "1"
152726-152961 uart: tx-data: "268"
152960-152987 uart: tx-stop: "Stop bit" "Stop" "T"
153242-153269 uart: tx-start: "Start bit" "Start" "S"
153268-153295 uart: tx-data-bit: "1"
153294-153321 uart: tx-data-bit: "0"
153320-153347 uart: tx-data-bit: "1"
153346-153373 uart: tx-data-bit: "1"
153372-153399 uart: tx-data-bit: "0"
153398-153425 uart: tx-data-bit: "0"
153424-153451 uart: tx-data-bit: "0"
153450-153477 uart: tx-data-bit: "0"
153476-153503 uart: tx-data-bit: "1"
153268-153503 uart: tx-data: "269"
153502-153529 uart: tx-stop: "Stop bit" "Stop" "T"
153787-153814 uart: tx-start: "Start bit" "Start" "S"
153813-153840 uart: tx-data-bit: "0"
153839-153866 uart: tx-data-bit: "1"
153865-153892 uart: tx-data-bit: "1"
153891-153918 uart: tx-data-bit: "1"
153917-153944 uart: tx-data-bit: "0"
153943-153970 uart: tx-data-bit: "0"
153969-153996 uart: tx-data-bit: "0"
153995-154022 uart: tx-data-bit: "0"
154021-154048 uart: tx-data-bit: "1"
153813-154048 uart: tx-data: "270"
154047-154074 uart: tx-stop: "Stop bit" "Stop" "T"
154329-154356 uart: tx-start: "Start bit" "Start" "S"
154355-154382 uart: tx-data-bit: "1"
154381-154408 uart: tx-data-bit: "1"
154407-154434 uart: tx-data-bit: "1"
154433-154460 uart: tx-data-bit: "1"
154459-154486 uart: tx-data-bit: "0"
154485-154512 uart: tx-data-bit: "0"
154511-154538 uart: tx-data-bit: "0"
154537-154564 uart: tx-data-bit: "0"
154563-154590 uart: tx-data-bit: "1"
154355-154590 uart: tx-data: "271"
154589-154616 uart: tx-stop: "Stop bit" "Stop" "T"
154872-154899 uart: tx-start: "Start bit" "Start" "S"
154898-154925 uart: tx-data-bit: "0"
154924-154951 uart: tx-data-bit: "0"
154950-154977 uart: tx-data-bit: "0"
154976-155003 uart: tx-data-bit: "0"
155002-155029 uart: tx-data-bit: "1"
155028-155055 uart: tx-data-bit: "0"
155054-155081 uart: tx-data-bit: "0"
155080-155107 uart: tx-data-bit: "0"
155106-155133 uart: tx-data-bit: "1"
154898-155133 uart: tx-data: "272"
155132-155159 uart: tx-stop: "Stop bit" "Stop" "T"
155414-155441 uart: tx-start: "Start bit" "Start" "S"
155440-155467 uart: tx-data-bit: "1"
155466-155493 uart: tx-data-bit: "0"
155492-155519 uart: tx-data-bit: "0"
155518-155545 uart: tx-data-bit: "0"
155544-155571 uart: tx-data-bit: "1"
155570-155597 uart: tx-data-bit: "0"
155596-155623 uart: tx-data-bit: "0"
155622-155649 uart: tx-data-bit: "0"
155648-155675 uart: tx-data-bit: "1"
155440-155675 uart: tx-data: "273"
155674-155701 uart: tx-stop: "Stop bit" "Stop" "T"
155959-155986 uart: tx-start: "Start bit" "Start" "S"
155985-156012 uart: tx-data-bit: "0"
156011-156038 uart: tx-data-bit: "1"
156037-156064 uart: tx-data-bit: "0"
156063-156090 uart: tx-data-bit: "0"
156089-156116 uart: tx-data-bit: "1"
156115-156142 uart: tx-data-bit: "0"
156141-156168 uart: tx-data-bit: "0"
156167-156194 uart: tx-data-bit: "0"
156193-156220 uart: tx-data-bit: "1"
155985-156220 uart: tx-data: "274"
156219-156246 uart: tx-stop: "Stop bit" "Stop" "T"
156504-156531 uart: tx-start: "Start bit" "Start" "S"
156530-156557 uart: tx-data-bit: "1"
156556-156583 uart: tx-data-bit: "1"
156582-156609 uart: tx-data-bit: "0"
156608-156635 uart: tx-data-bit: "0"
156634-156661 uart: tx-data-bit: "1"
156660-156687 uart: tx-data-bit: "0"
156686-156713 uart: tx-data-bit: "0"
156712-156739 uart: tx-data-bit: "0"
156738-156765 uart: tx-data-bit: "1"
156530-156765 uart: tx-data: "275"
148377-156765 uart: tx-packet: "260 261 262 263 264 265 266 267 268 269 270 271 272 273 274 275"
156764-156791 uart: tx-stop: "Stop bit" "Stop" "T"
157048-157075 uart: tx-start: "Start bit" "Start" "S"
157074-157101 uart: tx-data-bit: "0"
157100-157127 uart: tx-data-bit: "0"
157126-157153 uart: tx-data-bit: "1"
157152-157179 uart: tx-data-bit: "0"
157178-157205 uart: tx-data-bit: "1"
157204-157231 uart: tx-data-bit: "0"
157230-157257 uart: tx-data-bit: "0"
157256-157283 uart: tx-data-bit: "0"
157282-157309 uart: tx-data-bit: "1"
157074-157309 uart: tx-data: "276"
157308-157335 uart: tx-stop: "Stop bit" "Stop" "T"
157593-157620 uart: tx-start: "Start bit" "Start" "S"
157619-157646 uart: tx-data-bit: "1"
157645-157672 uart: tx-data-bit: "0"
157671-157698 uart: tx-data-bit: "1"
157697-157724 uart: tx-data-bit: "0"
157723-157750 uart: tx-data-bit: "1"
157749-157776 uart: tx-data-bit: "0"
157775-157802 uart: tx-data-bit: "0"
157801-157828 uart: tx-data-bit: "0"
157827-157854 uart: tx-data-bit: "1"
157619-157854 uart: tx-data: "277"
157853-157880 uart: tx-stop: "Stop bit" "Stop" "T"
158139-158166 uart: tx-start: "Start bit" "Start" "S"
158165-158192 uart: tx-data-bit: "0"
158191-158218 uart: tx-data-bit: "1"
158217-158244 uart: tx-data-bit: "1"
158243-158270 uart: tx-data-bit: "0"
158269-158296 uart: tx-data-bit: "1"
158295-158322 uart: tx-data-bit: "0"
158321-158348 uart: tx-data-bit: "0"
158347-158374 uart: tx-data-bit: "0"
158373-158400 uart: tx-data-bit: "1"
158165-158400 uart: tx-data: "278"
158399-158426 uart: tx-stop: "Stop bit" "Stop" "T"
158684-158711 uart: tx-start: "Start bit" "Start" "S"
158710-158737 uart: tx-data-bit: "1"
158736-158763 uart: tx-data-bit: "1"
158762-158789 uart: tx-data-bit: "1"
158788-158815 uart: tx-data-bit: "0"
158814-158841 uart: tx-data-bit: "1"
158840-158867 uart: tx-data-bit: "0"
158866-158893 uart: tx-data-bit: "0"
158892-158919 uart: tx-data-bit: "0"
158918-158945 uart: tx-data-bit: "1"
158710-158945 uart: tx-data: "279"
158944-158971 uart: tx-stop: "Stop bit" "Stop" "T"
159228-159255 uart: tx-start: "Start bit" "Start" "S"
159254-159281 uart: tx-data-bit: "0"
159280-159307 uart: tx-data-bit: "0"
159306-159333 uart: tx-data-bit: "0"
159332-159359 uart: tx-data-bit: "1"
159358-159385 uart: tx-data-bit: "1"
159384-159411 uart: tx-data-bit: "0"
159410-159437 uart: tx-data-bit: "0"
159436-159463 uart: tx-data-bit: "0"
159462-159489 uart: tx-data-bit: "1"
159254-159489 uart: tx-data: "280"
159488-159515 uart: tx-stop: "Stop bit" "Stop" "T"
159771-159798 uart: tx-start: "Start bit" "Start" "S"
159797-159824 uart: tx-data-bit: "1"
159823-159850 uart: tx-data-bit: "0"
159849-159876 uart: tx-data-bit: "0"
159875-159902 uart: tx-data-bit: "1"
159901-159928 uart: tx-data-bit: "1"
159927-159954 uart: tx-data-bit: "0"
159953-159980 uart: tx-data-bit: "0"
159979-160006 uart: tx-data-bit: "0"
160005-160032 uart: tx-data-bit: "1"
159797-160032 uart: tx-data: "281"
160031-160058 uart: tx-stop: "Stop bit" "Stop" "T"
160316-160343 uart: tx-start: "Start bit" "Start" "S"
160342-160369 uart: tx-data-bit: "0"
160368-160395 uart: tx-data-bit: "1"
160394-160421 uart: tx-data-bit: "0"
160420-160447 uart: tx-data-bit: "1"
160446-160473 uart: tx-data-bit: "1"
160472-160499 uart: tx-data-bit: "0"
160498-160525 uart: tx-data-bit: "0"
160524-160551 uart: tx-data-bit: "0"
160550-160577 uart: tx-data-bit: "1"
160342-160577 uart: tx-data: "282"
160576-160603 uart: tx-stop: "Stop bit" "Stop" "T"
160860-160887 uart: tx-start: "Start bit" "Start" "S"
160886-160913 uart: tx-data-bit: "1"
160912-160939 uart: tx-data-bit: "1"
160938-160965 uart: tx-data-bit: "0"
160964-160991 uart: tx-data-bit: "1"
160990-161017 uart: tx-data-bit: "1"
161016-161043 uart: tx-data-bit: "0"
161042-161069 uart: tx-data-bit: "0"
161068-161095 uart: tx-data-bit: "0"
161094-161121 uart: tx-data-bit: "1"
160886-161121 uart: tx-data: "283"
161120-161147 uart: tx-stop: "Stop bit" "Stop" "T"
161405-161432 uart: tx-start: "Start bit" "Start" "S"
161431-161458 uart: tx-data-bit: "0"
161457-161484 uart: tx-data-bit: "0"
161483-161510 uart: tx-data-bit: "1"
161509-161536 uart: tx-data-bit: "1"
161535-161562 uart: tx-data-bit: "1"
161561-161588 uart: tx-data-bit: "0"
161587-161614 uart: tx-data-bit: "0"
161613-161640 uart: tx-data-bit: "0"
161639-161666 uart: tx-data-bit: "1"
161431-161666 uart: tx-data: "284"
161665-161692 uart: tx-stop: "Stop bit" "Stop" "T"
161947-161974 uart: tx-start: "Start bit" "Start" "S"
161973-162000 uart: tx-data-bit: "1"
161999-162026 uart: tx-data-bit: "0"
162025-162052 uart: tx-data-bit: "1"
162051-162078 uart: tx-data-bit: "1"
162077-162104 uart: tx-data-bit: "1"
162103-162130 uart: tx-data-bit: "0"
162129-162156 uart: tx-data-bit: "0"
162155-162182 uart: tx-data-bit: "0"
162181-162208 uart: tx-data-bit: "1"
161973-162208 uart: tx-data: "285"
162207-162234 uart: tx-stop: "Stop bit" "Stop" "T"
162492-162519 uart: tx-start: "Start bit" "Start" "S"
162518-162545 uart: tx-data-bit: "0"
162544-162571 uart: tx-data-bit: "1"
162570-162597 uart: tx-data-bit: "1"
162596-162623 uart: tx-data-bit: "1"
162622-162649 uart: tx-data-bit: "1"
162648-162675 uart: tx-data-bit: "0"
162674-162701 uart: tx-data-bit: "0"
162700-162727 uart: tx-data-bit: "0"
162726-162753 uart: tx-data-bit: "1"
162518-162753 uart: tx-data: "286"
162752-162779 uart: tx-stop: "Stop bit" "Stop" "T"
163034-163061 uart: tx-start: "Start bit" "Start" "S"
163060-163087 uart: tx-data-bit: "1"
163086-163113 uart: tx-data-bit: "1"
163112-163139 uart: tx-data-bit: "1"
163138-163165 uart: tx-data-bit: "1"
163164-163191 uart: tx-data-bit: "1"
163190-163217 uart: tx-data-bit: "0"
163216-163243 uart: tx-data-bit: "0"
163242-163269 uart: tx-data-bit: "0"
163268-163295 uart: tx-data-bit: "1"
163060-163295 uart: tx-data: "287"
163294-163321 uart: tx-stop: "Stop bit" "Stop" "T"
163577-163604 uart: tx-start: "Start bit" "Start" "S"
163603-163630 uart: tx-data-bit: "0"
163629-163656 uart: tx-data-bit: "0"
163655-163682 uart: tx-data-bit: "0"
163681-163708 uart: tx-data-bit: "0"
163707-163734 uart: tx-data-bit: "0"
163733-163760 uart: tx-data-bit: "1"
163759-163786 uart: tx-data-bit: "0"
163785-163812 uart: tx-data-bit: "0"
163811-163838 uart: tx-data-bit: "1"
163603-163838 uart: tx-data: "288"
163837-163864 uart: tx-stop: "Stop bit" "Stop" "T"
164120-164147 uart: tx-start: "Start bit" "Start" "S"
164146-164173 uart: tx-data-bit: "1"
164172-164199 uart: tx-data-bit: "0"
164198-164225 uart: tx-data-bit: "0"
164224-164251 uart: tx-data-bit: "0"
164250-164277 uart: tx-data-bit: "0"
164276-164303 uart: tx-data-bit: "1"
164302-164329 uart: tx-data-bit: "0"
164328-164355 uart: tx-data-bit: "0"
164354-164381 uart: tx-data-bit: "1"
164146-164381 uart: tx-data: "289"
164380-164407 uart: tx-stop: "Stop bit" "Stop" "T"
164664-164691 uart: tx-start: "Start bit" "Start" "S"
164690-164717 uart: tx-data-bit: "0"
164716-164743 uart: tx-data-bit: "1"
164742-164769 uart: tx-data-bit: "0"
164768-164795 uart: tx-data-bit: "0"
164794-164821 uart: tx-data-bit: "0"
164820-164847 uart: tx-data-bit: "1"
164846-164873 uart: tx-data-bit: "0"
164872-164899 uart: tx-data-bit: "0"
164898-164925 uart: tx-data-bit: "1"
164690-164925 uart: tx-data: "290"
164924-164951 uart: tx-stop: "Stop bit" "Stop" "T"
165209-165236 uart: tx-start: "Start bit" "Start" "S"
165235-165262 uart: tx-data-bit: "1"
165261-165288 uart: tx-data-bit: "1"
165287-165314 uart: tx-data-bit: "0"
165313-165340 uart: tx-data-bit: "0"
165339-165366 uart: tx-data-bit: "0"
165365-165392 uart: tx-data-bit: "1"
165391-165418 uart: tx-data-bit: "0"
165417-165444 uart: tx-data-bit: "0"
165443-165470 uart: tx-data-bit: "1"
165235-165470 uart: tx-data: "291"
157074-165470 uart: tx-packet: "276 277 278 279 280 281 282 283 284 285 286 287 288 289 290 291"
165469-165496 uart: tx-stop: "Stop bit" "Stop" "T"
165753-165780 uart: tx-start: "Start bit" "Start" "S"
165779-165806 uart: tx-data-bit: "0"
165805-165832 uart: tx-data-bit: "0"
165831-165858 uart: tx-data-bit: "1"
165857-165884 uart: tx-data-bit: "0"
165883-165910 uart: tx-data-bit: "0"
165909-165936 uart: tx-data-bit: "1"
165935-165962 uart: tx-data-bit: "0"
165961-165988 uart: tx-data-bit: "0"
165987-166014 uart: tx-data-bit: "1"
165779-166014 uart: tx-data: "292"
166013-166040 uart: tx-stop: "Stop bit" "Stop" "T"
166298-166325 uart: tx-start: "Start bit" "Start" "S"
166324-166351 uart: tx-data-bit: "1"
166350-166377 uart: tx-data-bit: "0"
166376-166403 uart: tx-data-bit: "1"
166402-166429 uart: tx-data-bit: "0"
166428-166455 uart: tx-data-bit: "0"
166454-166481 uart: tx-data-bit: "1"
166480-166507 uart: tx-data-bit: "0"
166506-166533 uart: tx-data-bit: "0"
166532-166559 uart: tx-data-bit: "1"
166324-166559 uart: tx-data: "293"
166558-166585 uart: tx-stop: "Stop bit" "Stop" "T"
166844-166871 uart: tx-start: "Start bit" "Start" "S"
166870-166897 uart: tx-data-bit: "0"
166896-166923 uart: tx-data-bit: "1"
166922-166949 uart: tx-data-bit: "1"
166948-166975 uart: tx-data-bit: "0"
166974-167001 uart: tx-data-bit: "0"
167000-167027 uart: tx-data-bit: "1"
167026-167053 uart: tx-data-bit: "0"
167052-167079 uart: tx-data-bit: "0"
167078-167105 uart: tx-data-bit: "1"
166870-167105 uart: tx-data: "294"
167104-167131 uart: tx-stop: "Stop bit" "Stop" "T"
167389-167416 uart: tx-start: "Start bit" "Start" "S"
167415-167442 uart: tx-data-bit: "1"
167441-167468 uart: tx-data-bit: "1"
167467-167494 uart: tx-data-bit: "1"
167493-167520 uart: tx-data-bit: "0"
167519-167546 uart: tx-data-bit: "0"
167545-167572 uart: tx-data-bit: "1"
167571-167598 uart: tx-data-bit: "0"
167597-167624 uart: tx-data-bit: "0"
167623-167650 uart: tx-data-bit: "1"
167415-167650 uart: tx-data: "295"
167649-167676 uart: tx-stop: "Stop bit" "Stop" "T"
167934-167961 uart: tx-start: "Start bit" "Start" "S"
167960-167987 uart: tx-data-bit: "0"
167986-168013 uart: tx-data-bit: "0"
168012-168039 uart: tx-data-bit: "0"
168038-168065 uart: tx-data-bit: "1"
168064-168091 uart: tx-data-bit: "0"
168090-168117 uart: tx-data-bit: "1"
168116-168143 uart: tx-data-bit: "0"
168142-168169 uart: tx-data-bit: "0"
168168-168195 uart: tx-data-bit: "1"
167960-168195 uart: tx-data: "296"
168194-168221 uart: tx-stop: "Stop bit" "Stop" "T"
168478-168505 uart: tx-start: "Start bit" "Start" "S"
168504-168531 uart: tx-data-bit: "1"
168530-168557 uart: tx-data-bit: "0"
168556-168583 uart: tx-data-bit: "0"
168582-168609 uart: tx-data-bit: "1"
168608-168635 uart: tx-data-bit: "0"
168634-168661 uart: tx-data-bit: "1"
168660-168687 uart: tx-data-bit: "0"
168686-168713 uart: tx-data-bit: "0"
168712-168739 uart: tx-data-bit: "1"
168504-168739 uart: tx-data: "297"
168738-168765 uart: tx-stop: "Stop bit" "Stop" "T"
169025-169052 uart: tx-start: "Start bit" "Start" "S"
169051-169078 uart: tx-data-bit: "0"
169077-169104 uart: tx-data-bit: "1"
169103-169130 uart: tx-data-bit: "0"
169129-169156 uart: tx-data-bit: "1"
169155-169182 uart: tx-data-bit: "0"
169181-169208 uart: tx-data-bit: "1"
169207-169234 uart: tx-data-bit: "0"
169233-169260 uart: tx-data-bit: "0"
169259-169286 uart: tx-data-bit: "1"
169051-169286 uart: tx-data: "298"
169285-169312 uart: tx-stop: "Stop bit" "Stop" "T"
169571-169598 uart: tx-start: "Start bit" "Start" "S"
169597-169624 uart: tx-data-bit: "1"
169623-169650 uart: tx-data-bit: "1"
169649-169676 uart: tx-data-bit: "0"
169675-169702 uart: tx-data-bit: "1"
169701-169728 uart: tx-data-bit: "0"
169727-169754 uart: tx-data-bit: "1"
169753-169780 uart: tx-data-bit: "0"
169779-169806 uart: tx-data-bit: "0"
169805-169832 uart: tx-data-bit: "1"
169597-169832 uart: tx-data: "299"
169831-169858 uart: tx-stop: "Stop bit" "Stop" "T"
170118-170145 uart: tx-start: "Start bit" "Start" "S"
170144-170171 uart: tx-data-bit: "0"
170170-170197 uart: tx-data-bit: "0"
170196-170223 uart: tx-data-bit: "1"
170222-170249 uart: tx-data-bit: "1"
170248-170275 uart: tx-data-bit: "0"
170274-170301 uart: tx-data-bit: "1"
170300-170327 uart: tx-data-bit: "0"
170326-170353 uart: tx-data-bit: "0"
170352-170379 uart: tx-data-bit: "1"
170144-170379 uart: tx-data: "300"
170378-170405 uart: tx-stop: "Stop bit" "Stop" "T"
170662-170689 uart: tx-start: "Start bit" "Start" "S"
170688-170715 uart: tx-data-bit: "1"
170714-170741 uart: tx-data-bit: "0"
170740-170767 uart: tx-data-bit: "1"
170766-170793 uart: tx-data-bit: "1"
170792-170819 uart: tx-data-bit: "0"
170818-170845 uart: tx-data-bit: "1"
170844-170871 uart: tx-data-bit: "0"
170870-170897 uart: tx-data-bit: "0"
170896-170923 uart: tx-data-bit: "1"
170688-170923 uart: tx-data: "301"
170922-170949 uart: tx-stop: "Stop bit" "Stop" "T"
171209-171236 uart: tx-start: "Start bit" "Start" "S"
171235-171262 uart: tx-data-bit: "0"
171261-171288 uart: tx-data-bit: "1"
171287-171314 uart: tx-data-bit: "1"
171313-171340 uart: tx-data-bit: "1"
171339-171366 uart: tx-data-bit: "0"
171365-171392 uart: tx-data-bit: "1"
171391-171418 uart: tx-data-bit: "0"
171417-171444 uart: tx-data-bit: "0"
171443-171470 uart: tx-data-bit: "1"
171235-171470 uart: tx-data: "302"
171469-171496 uart: tx-stop: "Stop bit" "Stop" "T"
171754-171781 uart: tx-start: "Start bit" "Start" "S"
171780-171807 uart: tx-data-bit: "1"
171806-171833 uart: tx-data-bit: "1"
171832-171859 uart: tx-data-bit: "1"
171858-171885 uart: tx-data-bit: "1"
171884-171911 uart: tx-data-bit: "0"
171910-171937 uart: tx-data-bit: "1"
171936-171963 uart: tx-data-bit: "0"
171962-171989 uart: tx-data-bit: "0"
171988-172015 uart: tx-data-bit: "1"
171780-172015 uart: tx-data: "303"
172014-172041 uart: tx-stop: "Stop bit" "Stop" "T"
172298-172325 uart: tx-start: "Start bit" "Start" "S"
172324-172351 uart: tx-data-bit: "0"
172350-172377 uart: tx-data-bit: "0"
172376-172403 uart: tx-data-bit: "0"
172402-172429 uart: tx-data-bit: "0"
172428-172455 uart: tx-data-bit: "1"
172454-172481 uart: tx-data-bit: "1"
172480-172507 uart: tx-data-bit: "0"
172506-172533 uart: tx-data-bit: "0"
172532-172559 uart: tx-data-bit: "1"
172324-172559 uart: tx-data: "304"
172558-172585 uart: tx-stop: "Stop bit" "Stop" "T"
172841-172868 uart: tx-start: "Start bit" "Start" "S"
172867-172894 uart: tx-data-bit: "1"
172893-172920 uart: tx-data-bit: "0"
172919-172946 uart: tx-data-bit: "0"
172945-172972 uart: tx-data-bit: "0"
172971-172998 uart: tx-data-bit: "1"
172997-173024 uart: tx-data-bit: "1"
173023-173050 uart: tx-data-bit: "0"
173049-173076 uart: tx-data-bit: "0"
173075-173102 uart: tx-data-bit: "1"
172867-173102 uart: tx-data: "305"
173101-173128 uart: tx-stop: "Stop bit" "Stop" "T"
173385-173412 uart: tx-start: "Start bit" "Start" "S"
173411-173438 uart: tx-data-bit: "0"
173437-173464 uart: tx-data-bit: "1"
173463-173490 uart: tx-data-bit: "0"
173489-173516 uart: tx-data-bit: "0"
173515-173542 uart: tx-data-bit: "1"
173541-173568 uart: tx-data-bit: "1"
173567-173594 uart: tx-data-bit: "0"
173593-173620 uart: tx-data-bit: "0"
173619-173646 uart: tx-data-bit: "1"
173411-173646 uart: tx-data: "306"
173645-173672 uart: tx-stop: "Stop bit" "Stop" "T"
173930-173957 uart: tx-start: "Start bit" "Start" "S"
173956-173983 uart: tx-data-bit: "1"
173982-174009 uart: tx-data-bit: "1"
174008-174035 uart: tx-data-bit: "0"
174034-174061 uart: tx-data-bit: "0"
174060-174087 uart: tx-data-bit: "1"
174086-174113 uart: tx-data-bit: "1"
174112-174139 uart: tx-data-bit: "0"
174138-174165 uart: tx-data-bit: "0"
174164-174191 uart: tx-data-bit: "1"
173956-174191 uart: tx-data: "307"
165779-174191 uart: tx-packet: "292 293 294 295 296 297 298 299 300 301 302 303 304 305 306 307"
174190-174217 uart: tx-stop: "Stop bit" "Stop" "T"
174474-174501 uart: tx-start: "Start bit" "Start" "S"
174500-174527 uart: tx-data-bit: "0"
174526-174553 uart: tx-data-bit: "0"
174552-174579 uart: tx-data-bit: "1"
174578-174605 uart: tx-data-bit: "0"
174604-174631 uart: tx-data-bit: "1"
174630-174657 uart: tx-data-bit: "1"
174656-174683 uart: tx-data-bit: "0"
174682-174709 uart: tx-data-bit: "0"
174708-174735 uart: tx-data-bit: "1"
174500-174735 uart: tx-data: "308"
174734-174761 uart: tx-stop: "Stop bit" "Stop" "T"
175019-175046 uart: tx-start: "Start bit" "Start" "S"
175045-175072 uart: tx-data-bit: "1"
175071-175098 uart: tx-data-bit: "0"
175097-175124 uart: tx-data-bit: "1"
175123-175150 uart: tx-data-bit: "0"
175149-175176 uart: tx-data-bit: "1"
175175-175202 uart: tx-data-bit: "1"
175201-175228 uart: tx-data-bit: "0"
175227-175254 uart: tx-data-bit: "0"
175253-175280 uart: tx-data-bit: "1"
175045-175280 uart: tx-data: "309"
175279-175306 uart: tx-stop: "Stop bit" "Stop" "T"
175566-175593 uart: tx-start: "Start bit" "Start" "S"
175592-175619 uart: tx-data-bit: "0"
175618-175645 uart: tx-data-bit: "1"
175644-175671 uart: tx-data-bit: "1"
175670-175697 uart: tx-data-bit: "0"
175696-175723 uart: tx-data-bit: "1"
175722-175749 uart: tx-data-bit: "1"
175748-175775 uart: tx-data-bit: "0"
175774-175801 uart: tx-data-bit: "0"
175800-175827 uart: tx-data-bit: "1"
175592-175827 uart: tx-data: "310"
175826-175853 uart: tx-stop: "Stop bit" "Stop" "T"
176110-176137 uart: tx-start: "Start bit" "Start" "S"
176136-176163 uart: tx-data-bit: "1"
176162-176189 uart: tx-data-bit: "1"
176188-176215 uart: tx-data-bit: "1"
176214-176241 uart: tx-data-bit: "0"
176240-176267 uart: tx-data-bit: "1"
176266-176293 uart: tx-data-bit: "1"
176292-176319 uart: tx-data-bit: "0"
176318-176345 uart: tx-data-bit: "0"
176344-176371 uart: tx-data-bit: "1"
176136-176371 uart: tx-data: "311"
176370-176397 uart: tx-stop: "Stop bit" "Stop" "T"
176655-176682 uart: tx-start: "Start bit" "Start" "S"
176681-176708 uart: tx-data-bit: "0"
176707-176734 uart: tx-data-bit: "0"
176733-176760 uart: tx-data-bit: "0"
176759-176786 uart: tx-data-bit: "1"
176785-176812 uart: tx-data-bit: "1"
176811-176838 uart: tx-data-bit: "1"
176837-176864 uart: tx-data-bit: "0"
176863-176890 uart: tx-data-bit: "0"
176889-176916 uart: tx-data-bit: "1"
176681-176916 uart: tx-data: "312"
176915-176942 uart: tx-stop: "Stop bit" "Stop" "T"
177197-177224 uart: tx-start: "Start bit" "Start" "S"
177223-177250 uart: tx-data-bit: "1"
177249-177276 uart: tx-data-bit: "0"
177275-177302 uart: tx-data-bit: "0"
177301-177328 uart: tx-data-bit: "1"
177327-177354 uart: tx-data-bit: "1"
177353-177380 uart: tx-data-bit: "1"
177379-177406 uart: tx-data-bit: "0"
177405-177432 uart: tx-data-bit: "0"
177431-177458 uart: tx-data-bit: "1"
177223-177458 uart: tx-data: "313"
177457-177484 uart: tx-stop: "Stop bit" "Stop" "T"
177742-177769 uart: tx-start: "Start bit" "Start" "S"
177768-177795 uart: tx-data-bit: "0"
177794-177821 uart: tx-data-bit: "1"
177820-177847 uart: tx-data-bit: "0"
177846-177873 uart: tx-data-bit: "1"
177872-177899 uart: tx-data-bit: "1"
177898-177925 uart: tx-data-bit: "1"
177924-177951 uart: tx-data-bit: "0"
177950-177977 uart: tx-data-bit: "0"
177976-178003 uart: tx-data-bit: "1"
177768-178003 uart: tx-data: "314"
178002-178029 uart: tx-stop: "Stop bit" "Stop" "T"
178286-178313 uart: tx-start: "Start bit" "Start" "S"
178312-178339 uart: tx-data-bit: "1"
178338-178365 uart: tx-data-bit: "1"
178364-178391 uart: tx-data-bit: "0"
178390-178417 uart: tx-data-bit: "1"
178416-178443 uart: tx-data-bit: "1"
178442-178469 uart: tx-data-bit: "1"
178468-178495 uart: tx-data-bit: "0"
178494-178521 uart: tx-data-bit: "0"
178520-178547 uart: tx-data-bit: "1"
178312-178547 uart: tx-data: "315"
178546-178573 uart: tx-stop: "Stop bit" "Stop" "T"
178831-178858 uart: tx-start: "Start bit" "Start" "S"
178857-178884 uart: tx-data-bit: "0"
178883-178910 uart: tx-data-bit: "0"
178909-178936 uart: tx-data-bit: "1"
178935-178962 uart: tx-data-bit: "1"
178961-178988 uart: tx-data-bit: "1"
178987-179014 uart: tx-data-bit: "1"
179013-179040 uart: tx-data-bit: "0"
179039-179066 uart: tx-data-bit: "0"
179065-179092 uart: tx-data-bit: "1"
178857-179092 uart: tx-data: "316"
179091-179118 uart: tx-stop: "Stop bit" "Stop" "T"
179374-179401 uart: tx-start: "Start bit" "Start" "S"
179400-179427 uart: tx-data-bit: "1"
179426-179453 uart: tx-data-bit: "0"
179452-179479 uart: tx-data-bit: "1"
179478-179505 uart: tx-data-bit: "1"
179504-179531 uart: tx-data-bit: "1"
179530-179557 uart: tx-data-bit: "1"
179556-179583 uart: tx-data-bit: "0"
179582-179609 uart: tx-data-bit: "0"
179608-179635 uart: tx-data-bit: "1"
179400-179635 uart: tx-data: "317"
179634-179661 uart: tx-stop: "Stop bit" "Stop" "T"
179918-179945 uart: tx-start: "Start bit" "Start" "S"
179944-179971 uart: tx-data-bit: "0"
179970-179997 uart: tx-data-bit: "1"
179996-180023 uart: tx-data-bit: "1"
180022-180049 uart: tx-data-bit: "1"
180048-180075 uart: tx-data-bit: "1"
180074-180101 uart: tx-data-bit: "1"
180100-180127 uart: tx-data-bit: "0"
180126-180153 uart: tx-data-bit: "0"
180152-180179 uart: tx-data-bit: "1"
179944-180179 uart: tx-data: "318"
180178-180205 uart: tx-stop: "Stop bit" "Stop" "T"
180461-180488 uart: tx-start: "Start bit" "Start" "S"
180487-180514 uart: tx-data-bit: "1"
180513-180540 uart: tx-data-bit: "1"
180539-180566 uart: tx-data-bit: "1"
180565-180592 uart: tx-data-bit: "1"
180591-180618 uart: tx-data-bit: "1"
180617-180644 uart: tx-data-bit: "1"
180643-180670 uart: tx-data-bit: "0"
180669-180696 uart: tx-data-bit: "0"
180695-180722 uart: tx-data-bit: "1"
180487-180722 uart: tx-data: "319"
180721-180748 uart: tx-stop: "Stop bit" "Stop" "T"
181003-181030 uart: tx-start: "Start bit" "Start" "S"
181029-181056 uart: tx-data-bit: "0"
181055-181082 uart: tx-data-bit: "0"
181081-181108 uart: tx-data-bit: "0"
181107-181134 uart: tx-data-bit: "0"
181133-181160 uart: tx-data-bit: "0"
181159-181186 uart: tx-data-bit: "0"
181185-181212 uart: tx-data-bit: "1"
181211-181238 uart: tx-data-bit: "0"
181237-181264 uart: tx-data-bit: "1"
181029-181264 uart: tx-data: "320"
181263-181290 uart: tx-stop: "Stop bit" "Stop" "T"
181546-181573 uart: tx-start: "Start bit" "Start" "S"
181572-181599 uart: tx-data-bit: "1"
181598-181625 uart: tx-data-bit: "0"
181624-181651 uart: tx-data-bit: "0"
181650-181677 uart: tx-data-bit: "0"
181676-181703 uart: tx-data-bit: "0"
181702-181729 uart: tx-data-bit: "0"
181728-181755 uart: tx-data-bit: "1"
181754-181781 uart: tx-data-bit: "0"
181780-181807 uart: tx-data-bit: "1"
181572-181807 uart: tx-data: "321"
181806-181833 uart: tx-stop: "Stop bit" "Stop" "T"
182090-182117 uart: tx-start: "Start bit" "Start" "S"
182116-182143 uart: tx-data-bit: "0"
182142-182169 uart: tx-data-bit: "1"
182168-182195 uart: tx-data-bit: "0"
182194-182221 uart: tx-data-bit: "0"
182220-182247 uart: tx-data-bit: "0"
182246-182273 uart: tx-data-bit: "0"
182272-182299 uart: tx-data-bit: "1"
182298-182325 uart: tx-data-bit: "0"
182324-182351 uart: tx-data-bit: "1"
182116-182351 uart: tx-data: "322"
182350-182377 uart: tx-stop: "Stop bit" "Stop" "T"
182635-182662 uart: tx-start: "Start bit" "Start" "S"
182661-182688 uart: tx-data-bit: "1"
182687-182714 uart: tx-data-bit: "1"
182713-182740 uart: tx-data-bit: "0"
182739-182766 uart: tx-data-bit: "0"
182765-182792 uart: tx-data-bit: "0"
182791-182818 uart: tx-data-bit: "0"
182817-182844 uart: tx-data-bit: "1"
182843-182870 uart: tx-data-bit: "0"
182869-182896 uart: tx-data-bit: "1"
182661-182896 uart: tx-data: "323"
174500-182896 uart: tx-packet: "308 309 310 311 312 313 314 315 316 317 318 319 320 321 322 323"
182895-182922 uart: tx-stop: "Stop bit" "Stop" "T"
183179-183206 uart: tx-start: "Start bit" "Start" "S"
183205-183232 uart: tx-data-bit: "0"
183231-183258 uart: tx-data-bit: "0"
183257-183284 uart: tx-data-bit: "1"
183283-183310 uart: tx-data-bit: "0"
183309-183336 uart: tx-data-bit: "0"
183335-183362 uart: tx-data-bit: "0"
183361-183388 uart: tx-data-bit: "1"
183387-183414 uart: tx-data-bit: "0"
183413-183440 uart: tx-data-bit: "1"
183205-183440 uart: tx-data: "324"
183439-183466 uart: tx-stop: "Stop bit" "Stop" "T"
183724-183751 uart: tx-start: "Start bit" "Start" "S"
183750-183777 uart: tx-data-bit: "1"
183776-183803 uart: tx-data-bit: "0"
183802-183829 uart: tx-data-bit: "1"
183828-183855 uart: tx-data-bit: "0"
183854-183881 uart: tx-data-bit: "0"
183880-183907 uart: tx-data-bit: "0"
183906-183933 uart: tx-data-bit: "1"
183932-183959 uart: tx-data-bit: "0"
183958-183985 uart: tx-data-bit: "1"
183750-183985 uart: tx-data: "325"
183984-184011 uart: tx-stop: "Stop bit" "Stop" "T"
184271-184298 uart: tx-start: "Start bit" "Start" "S"
184297-184324 uart: tx-data-bit: "0"
184323-184350 uart: tx-data-bit: "1"
184349-184376 uart: tx-data-bit: "1"
184375-184402 uart: tx-data-bit: "0"
184401-184428 uart: tx-data-bit: "0"
184427-184454 uart: tx-data-bit: "0"
184453-184480 uart: tx-data-bit: "1"
184479-184506 uart: tx-data-bit: "0"
184505-184532 uart: tx-data-bit: "1"
184297-184532 uart: tx-data: "326"
184531-184558 uart: tx-stop: "Stop bit" "Stop" "T"
184815-184842 uart: tx-start: "Start bit" "Start" "S"
184841-184868 uart: tx-data-bit: "1"
184867-184894 uart: tx-data-bit: "1"
184893-184920 uart: tx-data-bit: "1"
184919-184946 uart: tx-data-bit: "0"
184945-184972 uart: tx-data-bit: "0"
184971-184998 uart: tx-data-bit: "0"
184997-185024 uart: tx-data-bit: "1"
185023-185050 uart: tx-data-bit: "0"
185049-185076 uart: tx-data-bit: "1"
184841-185076 uart: tx-data: "327"
185075-185102 uart: tx-stop: "Stop bit" "Stop" "T"
185360-185387 uart: tx-start: "Start bit" "Start" "S"
185386-185413 uart: tx-data-bit: "0"
185412-185439 uart: tx-data-bit: "0"
185438-185465 uart: tx-data-bit: "0"
185464-185491 uart: tx-data-bit: "1"
185490-185517 uart: tx-data-bit: "0"
185516-185543 uart: tx-data-bit: "0"
185542-185569 uart: tx-data-bit: "1"
185568-185595 uart: tx-data-bit: "0"
185594-185621 uart: tx-data-bit: "1"
185386-185621 uart: tx-data: "328"
185620-185647 uart: tx-stop: "Stop bit" "Stop" "T"
185904-185931 uart: tx-start: "Start bit" "Start" "S"
185930-185957 uart: tx-data-bit: "1"
185956-185983 uart: tx-data-bit: "0"
185982-186009 uart: tx-data-bit: "0"
186008-186035 uart: tx-data-bit: "1"
186034-186061 uart: tx-data-bit: "0"
186060-186087 uart: tx-data-bit: "0"
186086-186113 uart: tx-data-bit: "1"
186112-186139 uart: tx-data-bit: "0"
186138-186165 uart: tx-data-bit: "1"
185930-186165 uart: tx-data: "329"
186164-186191 uart: tx-stop: "Stop bit" "Stop" "T"
186451-186478 uart: tx-start: "Start bit" "Start" "S"
186477-186504 uart: tx-data-bit: "0"
186503-186530 uart: tx-data-bit: "1"
186529-186556 uart: tx-data-bit: "0"
186555-186582 uart: tx-data-bit: "1"
186581-186608 uart: tx-data-bit: "0"
186607-186634 uart: tx-data-bit: "0"
186633-186660 uart: tx-data-bit: "1"
186659-186686 uart: tx-data-bit: "0"
186685-186712 uart: tx-data-bit: "1"
186477-186712 uart: tx-data: "330"
186711-186738 uart: tx-stop: "Stop bit" "Stop" "T"
186997-187024 uart: tx-start: "Start bit" "Start" "S"
187023-187050 uart: tx-data-bit: "1"
187049-187076 uart: tx-data-bit: "1"
187075-187102 uart: tx-data-bit: "0"
187101-187128 uart: tx-data-bit: "1"
187127-187154 uart: tx-data-bit: "0"
187153-187180 uart: tx-data-bit: "0"
187179-187206 uart: tx-data-bit: "1"
187205-187232 uart: tx-data-bit: "0"
187231-187258 uart: tx-data-bit: "1"
187023-187258 uart: tx-data: "331"
187257-187284 uart: tx-stop: "Stop bit" "Stop" "T"
187544-187571 uart: tx-start: "Start bit" "Start" "S"
187570-187597 uart: tx-data-bit: "0"
187596-187623 uart: tx-data-bit: "0"
187622-187649 uart: tx-data-bit: "1"
187648-187675 uart: tx-data-bit: "1"
187674-187701 uart: tx-data-bit: "0"
187700-187727 uart: tx-data-bit: "0"
187726-187753 uart: tx-data-bit: "1"
187752-187779 uart: tx-data-bit: "0"
187778-187805 uart: tx-data-bit: "1"
187570-187805 uart: tx-data: "332"
187804-187831 uart: tx-stop: "Stop bit" "Stop" "T"
188089-188116 uart: tx-start: "Start bit" "Start" "S"
188115-188142 uart: tx-data-bit: "1"
188141-188168 uart: tx-data-bit: "0"
188167-188194 uart: tx-data-bit: "1"
188193-188220 uart: tx-data-bit: "1"
188219-188246 uart: tx-data-bit: "0"
188245-188272 uart: tx-data-bit: "0"
188271-188298 uart: tx-data-bit: "1"
188297-188324 uart: tx-data-bit: "0"
188323-188350 uart: tx-data-bit: "1"
188115-188350 uart: tx-data: "333"
188349-188376 uart: tx-stop: "Stop bit" "Stop" "T"
188635-188662 uart: tx-start: "Start bit" "Start" "S"
188661-188688 uart: tx-data-bit: "0"
188687-188714 uart: tx-data-bit: "1"
188713-188740 uart: tx-data-bit: "1"
188739-188766 uart: tx-data-bit: "1"
188765-188792 uart: tx-data-bit: "0"
188791-188818 uart: tx-data-bit: "0"
188817-188844 uart: tx-data-bit: "1"
188843-188870 uart: tx-data-bit: "0"
188869-188896 uart: tx-data-bit: "1"
188661-188896 uart: tx-data: "334"
188895-188922 uart: tx-stop: "Stop bit" "Stop" "T"
189180-189207 uart: tx-start: "Start bit" "Start" "S"
189206-189233 uart: tx-data-bit: "1"
189232-189259 uart: tx-data-bit: "1"
189258-189285 uart: tx-data-bit: "1"
189284-189311 uart: tx-data-bit: "1"
189310-189337 uart: tx-data-bit: "0"
189336-189363 uart: tx-data-bit: "0"
189362-189389 uart: tx-data-bit: "1"
189388-189415 uart: tx-data-bit: "0"
189414-189441 uart: tx-data-bit: "1"
189206-189441 uart: tx-data: "335"
189440-189467 uart: tx-stop: "Stop bit" "Stop" "T"
189724-189751 uart: tx-start: "Start bit" "Start" "S"
189750-189777 uart: tx-data-bit: "0"
189776-189803 uart: tx-data-bit: "0"
189802-189829 uart: tx-data-bit: "0"
189828-189855 uart: tx-data-bit: "0"
189854-189881 uart: tx-data-bit: "1"
189880-189907 uart: tx-data-bit: "0"
189906-189933 uart: tx-data-bit: "1"
189932-189959 uart: tx-data-bit: "0"
189958-189985 uart: tx-data-bit: "1"
189750-189985 uart: tx-data: "336"
189984-190011 uart: tx-stop: "Stop bit" "Stop" "T"
190269-190296 uart: tx-start: "Start bit" "Start" "S"
190295-190322 uart: tx-data-bit: "1"
190321-190348 uart: tx-data-bit: "0"
190347-190374 uart: tx-data-bit: "0"
190373-190400 uart: tx-data-bit: "0"
190399-190426 uart: tx-data-bit: "1"
190425-190452 uart: tx-data-bit: "0"
190451-190478 uart: tx-data-bit: "1"
190477-190504 uart: tx-data-bit: "0"
190503-190530 uart: tx-data-bit: "1"
190295-190530 uart: tx-data: "337"
190529-190556 uart: tx-stop: "Stop bit" "Stop" "T"
190815-190842 uart: tx-start: "Start bit" "Start" "S"
190841-190868 uart: tx-data-bit: "0"
190867-190894 uart: tx-data-bit: "1"
190893-190920 uart: tx-data-bit: "0"
190919-190946 uart: tx-data-bit: "0"
190945-190972 uart: tx-data-bit: "1"
190971-190998 uart: tx-data-bit: "0"
190997-191024 uart: tx-data-bit: "1"
191023-191050 uart: tx-data-bit: "0"
191049-191076 uart: tx-data-bit: "1"
190841-191076 uart: tx-data: "338"
191075-191102 uart: tx-stop: "Stop bit" "Stop" "T"
191362-191389 uart: tx-start: "Start bit" "Start" "S"
191388-191415 uart: tx-data-bit: "1"
191414-191441 uart: tx-data-bit: "1"
191440-191467 uart: tx-data-bit: "0"
191466-191493 uart: tx-data-bit: "0"
191492-191519 uart: tx-data-bit: "1"
191518-191545 uart: tx-data-bit: "0"
191544-191571 uart: tx-data-bit: "1"
191570-191597 uart: tx-data-bit: "0"
191596-191623 uart: tx-data-bit: "1"
191388-191623 uart: tx-data: "339"
183205-191623 uart: tx-packet: "324 325 326 327 328 329 330 331 332 333 334 335 336 337 338 339"
191622-191649 uart: tx-stop: "Stop bit" "Stop" "T"
191909-191936 uart: tx-start: "Start bit" "Start" "S"
191935-191962 uart: tx-data-bit: "0"
191961-191988 uart: tx-data-bit: "0"
191987-192014 uart: tx-data-bit: "1"
192013-192040 uart: tx-data-bit: "0"
192039-192066 uart: tx-data-bit: "1"
192065-192092 uart: tx-data-bit: "0"
192091-192118 uart: tx-data-bit: "1"
192117-192144 uart: tx-data-bit: "0"
192143-192170 uart: tx-data-bit: "1"
191935-192170 uart: tx-data: "340"
192169-192196 uart: tx-stop: "Stop bit" "Stop" "T"
192455-192482 uart: tx-start: "Start bit" "Start" "S"
192481-192508 uart: tx-data-bit: "1"
192507-192534 uart: tx-data-bit: "0"
192533-192560 uart: tx-data-bit: "1"
192559-192586 uart: tx-data-bit: "0"
192585-192612 uart: tx-data-bit: "1"
192611-192638 uart: tx-data-bit: "0"
192637-192664 uart: tx-data-bit: "1"
192663-192690 uart: tx-data-bit: "0"
192689-192716 uart: tx-data-bit: "1"
192481-192716 uart: tx-data: "341"
192715-192742 uart: tx-stop: "Stop bit" "Stop" "T"
193004-193031 uart: tx-start: "Start bit" "Start" "S"
193030-193057 uart: tx-data-bit: "0"
193056-193083 uart: tx-data-bit: "1"
193082-193109 uart: tx-data-bit: "1"
193108-193135 uart: tx-data-bit: "0"
193134-193161 uart: tx-data-bit: "1"
193160-193187 uart: tx-data-bit: "0"
193186-193213 uart: tx-data-bit: "1"
193212-193239 uart: tx-data-bit: "0"
193238-193265 uart: tx-data-bit: "1"
193030-193265 uart: tx-data: "342"
193264-193291 uart: tx-stop: "Stop bit" "Stop" "T"
193550-193577 uart: tx-start: "Start bit" "Start" "S"
193576-193603 uart: tx-data-bit: "1"
193602-193629 uart: tx-data-bit: "1"
193628-193655 uart: tx-data-bit: "1"
193654-193681 uart: tx-data-bit: "0"
193680-193707 uart: tx-data-bit: "1"
193706-193733 uart: tx-data-bit: "0"
193732-193759 uart: tx-data-bit: "1"
193758-193785 uart: tx-data-bit: "0"
193784-193811 uart: tx-data-bit: "1"
193576-193811 uart: tx-data: "343"
193810-193837 uart: tx-stop: "Stop bit" "Stop" "T"
194097-194124 uart: tx-start: "Start bit" "Start" "S"
194123-194150 uart: tx-data-bit: "0"
194149-194176 uart: tx-data-bit: "0"
194175-194202 uart: tx-data-bit: "0"
194201-194228 uart: tx-data-bit: "1"
194227-194254 uart: tx-data-bit: "1"
194253-194280 uart: tx-data-bit: "0"
194279-194306 uart: tx-data-bit: "1"
194305-194332 uart: tx-data-bit: "0"
194331-194358 uart: tx-data-bit: "1"
194123-194358 uart: tx-data: "344"
194357-194384 uart: tx-stop: "Stop bit" "Stop" "T"
194641-194668 uart: tx-start: "Start bit" "Start" "S"
194667-194694 uart: tx-data-bit: "1"
194693-194720 uart: tx-data-bit: "0"
194719-194746 uart: tx-data-bit: "0"
194745-194772 uart: tx-data-bit: "1"
194771-194798 uart: tx-data-bit: "1"
194797-194824 uart: tx-data-bit: "0"
194823-194850 uart: tx-data-bit: "1"
194849-194876 uart: tx-data-bit: "0"
194875-194902 uart: tx-data-bit: "1"
194667-194902 uart: tx-data: "345"
194901-194928 uart: tx-stop: "Stop bit" "Stop" "T"
195188-195215 uart: tx-start: "Start bit" "Start" "S"
195214-195241 uart: tx-data-bit: "0"
195240-195267 uart: tx-data-bit: "1"
195266-195293 uart: tx-data-bit: "0"
195292-195319 uart: tx-data-bit: "1"
195318-195345 uart: tx-data-bit: "1"
195344-195371 uart: tx-data-bit: "0"
195370-195397 uart: tx-data-bit: "1"
195396-195423 uart: tx-data-bit: "0"
195422-195449 uart: tx-data-bit: "1"
195214-195449 uart: tx-data: "346"
195448-195475 uart: tx-stop: "Stop bit" "Stop" "T"
195735-195762 uart: tx-start: "Start bit" "Start" "S"
195761-195788 uart: tx-data-bit: "1"
195787-195814 uart: tx-data-bit: "1"
195813-195840 uart: tx-data-bit: "0"
195839-195866 uart: tx-data-bit: "1"
195865-195892 uart: tx-data-bit: "1"
195891-195918 uart: tx-data-bit: "0"
195917-195944 uart: tx-data-bit: "1"
195943-195970 uart: tx-data-bit: "0"
195969-195996 uart: tx-data-bit: "1"
195761-195996 uart: tx-data: "347"
195995-196022 uart: tx-stop: "Stop bit" "Stop" "T"
196281-196308 uart: tx-start: "Start bit" "Start" "S"
196307-196334 uart: tx-data-bit: "0"
196333-196360 uart: tx-data-bit: "0"
196359-196386 uart: tx-data-bit: "1"
196385-196412 uart: tx-data-bit: "1"
196411-196438 uart: tx-data-bit: "1"
196437-196464 uart: tx-data-bit: "0"
196463-196490 uart: tx-data-bit: "1"
196489-196516 uart: tx-data-bit: "0"
196515-196542 uart: tx-data-bit: "1"
196307-196542 uart: tx-data: "348"
196541-196568 uart: tx-stop: "Stop bit" "Stop" "T"
196826-196853 uart: tx-start: "Start bit" "Start" "S"
196852-196879 uart: tx-data-bit: "1"
196878-196905 uart: tx-data-bit: "0"
196904-196931 uart: tx-data-bit: "1"
196930-196957 uart: tx-data-bit: "1"
196956-196983 uart: tx-data-bit: "1"
196982-197009 uart: tx-data-bit: "0"
197008-197035 uart: tx-data-bit: "1"
197034-197061 uart: tx-data-bit: "0"
197060-197087 uart: tx-data-bit: "1"
196852-197087 uart: tx-data: "349"
197086-197113 uart: tx-stop: "Stop bit" "Stop" "T"
197372-197399 uart: tx-start: "Start bit" "Start" "S"
197398-197425 uart: tx-data-bit: "0"
197424-197451 uart: tx-data-bit: "1"
197450-197477 uart: tx-data-bit: "1"
197476-197503 uart: tx-data-bit: "1"
197502-197529 uart: tx-data-bit: "1"
197528-197555 uart: tx-data-bit: "0"
197554-197581 uart: tx-data-bit: "1"
197580-197607 uart: tx-data-bit: "0"
197606-197633 uart: tx-data-bit: "1"
197398-197633 uart: tx-data: "350"
197632-197659 uart: tx-stop: "Stop bit" "Stop" "T"
197917-197944 uart: tx-start: "Start bit" "Start" "S"
197943-197970 uart: tx-data-bit: "1"
197969-197996 uart: tx-data-bit: "1"
197995-198022 uart: tx-data-bit: "1"
198021-198048 uart: tx-data-bit: "1"
198047-198074 uart: tx-data-bit: "1"
198073-198100 uart: tx-data-bit: "0"
198099-198126 uart: tx-data-bit: "1"
198125-198152 uart: tx-data-bit: "0"
198151-198178 uart: tx-data-bit: "1"
197943-198178 uart: tx-data: "351"
198177-198204 uart: tx-stop: "Stop bit" "Stop" "T"
198461-198488 uart: tx-start: "Start bit" "Start" "S"
198487-198514 uart: tx-data-bit: "0"
198513-198540 uart: tx-data-bit: "0"
198539-198566 uart: tx-data-bit: "0"
198565-198592 uart: tx-data-bit: "0"
198591-198618 uart: tx-data-bit: "0"
198617-198644 uart: tx-data-bit: "1"
198643-198670 uart: tx-data-bit: "1"
198669-198696 uart: tx-data-bit: "0"
198695-198722 uart: tx-data-bit: "1"
198487-198722 uart: tx-data: "352"
198721-198748 uart: tx-stop: "Stop bit" "Stop" "T"
199004-199031 uart: tx-start: "Start bit" "Start" "S"
199030-199057 uart: tx-data-bit: "1"
199056-199083 uart: tx-data-bit: "0"
199082-199109 uart: tx-data-bit: "0"
199108-199135 uart: tx-data-bit: "0"
199134-199161 uart: tx-data-bit: "0"
199160-199187 uart: tx-data-bit: "1"
199186-199213 uart: tx-data-bit: "1"
199212-199239 uart: tx-data-bit: "0"
199238-199265 uart: tx-data-bit: "1"
199030-199265 uart: tx-data: "353"
199264-199291 uart: tx-stop: "Stop bit" "Stop" "T"
199549-199576 uart: tx-start: "Start bit" "Start" "S"
199575-199602 uart: tx-data-bit: "0"
199601-199628 uart: tx-data-bit: "1"
199627-199654 uart: tx-data-bit: "0"
199653-199680 uart: tx-data-bit: "0"
199679-199706 uart: tx-data-bit: "0"
199705-199732 uart: tx-data-bit: "1"
199731-199758 uart: tx-data-bit: "1"
199757-199784 uart: tx-data-bit: "0"
199783-199810 uart: tx-data-bit: "1"
199575-199810 uart: tx-data: "354"
199809-199836 uart: tx-stop: "Stop bit" "Stop" "T"
200093-200120 uart: tx-start: "Start bit" "Start" "S"
200119-200146 uart: tx-data-bit: "1"
200145-200172 uart: tx-data-bit: "1"
200171-200198 uart: tx-data-bit: "0"
200197-200224 uart: tx-data-bit: "0"
200223-200250 uart: tx-data-bit: "0"
200249-200276 uart: tx-data-bit: "1"
200275-200302 uart: tx-data-bit: "1"
200301-200328 uart: tx-data-bit: "0"
200327-200354 uart: tx-data-bit: "1"
200119-200354 uart: tx-data: "355"
191935-200354 uart: tx-packet: "340 341 342 343 344 345 346 347 348 349 350 351 352 353 354 355"
200353-200380 uart: tx-stop: "Stop bit" "Stop" "T"
200638-200665 uart: tx-start: "Start bit" "Start" "S"
200664-200691 uart: tx-data-bit: "0"
200690-200717 uart: tx-data-bit: "0"
200716-200743 uart: tx-data-bit: "1"
200742-200769 uart: tx-data-bit: "0"
200768-200795 uart: tx-data-bit: "0"
200794-200821 uart: tx-data-bit: "1"
200820-200847 uart: tx-data-bit: "1"
200846-200873 uart: tx-data-bit: "0"
200872-200899 uart: tx-data-bit: "1"
200664-200899 uart: tx-data: "356"
200898-200925 uart: tx-stop: "Stop bit" "Stop" "T"
201182-201209 uart: tx-start: "Start bit" "Start" "S"
201208-201235 uart: tx-data-bit: "1"
201234-201261 uart: tx-data-bit: "0"
201260-201287 uart: tx-data-bit: "1"
201286-201313 uart: tx-data-bit: "0"
201312-201339 uart: tx-data-bit: "0"
201338-201365 uart: tx-data-bit: "1"
201364-201391 uart: tx-data-bit: "1"
201390-201417 uart: tx-data-bit: "0"
201416-201443 uart: tx-data-bit: "1"
201208-201443 uart: tx-data: "357"
201442-201469 uart: tx-stop: "Stop bit" "Stop" "T"
201729-201756 uart: tx-start: "Start bit" "Start" "S"
201755-201782 uart: tx-data-bit: "0"
201781-201808 uart: tx-data-bit: "1"
201807-201834 uart: tx-data-bit: "1"
201833-201860 uart: tx-data-bit: "0"
201859-201886 uart: tx-data-bit: "0"
201885-201912 uart: tx-data-bit: "1"
201911-201938 uart: tx-data-bit: "1"
201937-201964 uart: tx-data-bit: "0"
201963-201990 uart: tx-data-bit: "1"
201755-201990 uart: tx-data: "358"
201989-202016 uart: tx-stop: "Stop bit" "Stop" "T"
202273-202300 uart: tx-start: "Start bit" "Start" "S"
202299-202326 uart: tx-data-bit: "1"
202325-202352 uart: tx-data-bit: "1"
202351-202378 uart: tx-data-bit: "1"
202377-202404 uart: tx-data-bit: "0"
202403-202430 uart: tx-data-bit: "0"
202429-202456 uart: tx-data-bit: "1"
202455-202482 uart: tx-data-bit: "1"
202481-202508 uart: tx-data-bit: "0"
202507-202534 uart: tx-data-bit: "1"
202299-202534 uart: tx-data: "359"
202533-202560 uart: tx-stop: "Stop bit" "Stop" "T"
202818-202845 uart: tx-start: "Start bit" "Start" "S"
202844-202871 uart: tx-data-bit: "0"
202870-202897 uart: tx-data-bit: "0"
202896-202923 uart: tx-data-bit: "0"
202922-202949 uart: tx-data-bit: "1"
202948-202975 uart: tx-data-bit: "0"
202974-203001 uart: tx-data-bit: "1"
203000-203027 uart: tx-data-bit: "1"
203026-203053 uart: tx-data-bit: "0"
203052-203079 uart: tx-data-bit: "1"
202844-203079 uart: tx-data: "360"
203078-203105 uart: tx-stop: "Stop bit" "Stop" "T"
203363-203390 uart: tx-start: "Start bit" "Start" "S"
203389-203416 uart: tx-data-bit: "1"
203415-203442 uart: tx-data-bit: "0"
203441-203468 uart: tx-data-bit: "0"
203467-203494 uart: tx-data-bit: "1"
203493-203520 uart: tx-data-bit: "0"
203519-203546 uart: tx-data-bit: "1"
203545-203572 uart: tx-data-bit: "1"
203571-203598 uart: tx-data-bit: "0"
203597-203624 uart: tx-data-bit: "1"
203389-203624 uart: tx-data: "361"
203623-203650 uart: tx-stop: "Stop bit" "Stop" "T"
203909-203936 uart: tx-start: "Start bit" "Start" "S"
203935-203962 uart: tx-data-bit: "0"
203961-203988 uart: tx-data-bit: "1"
203987-204014 uart: tx-data-bit: "0"
204013-204040 uart: tx-data-bit: "1"
204039-204066 uart: tx-data-bit: "0"
204065-204092 uart: tx-data-bit: "1"
204091-204118 uart: tx-data-bit: "1"
204117-204144 uart: tx-data-bit: "0"
204143-204170 uart: tx-data-bit: "1"
203935-204170 uart: tx-data: "362"
204169-204196 uart: tx-stop: "Stop bit" "Stop" "T"
204456-204483 uart: tx-start: "Start bit" "Start" "S"
204482-204509 uart: tx-data-bit: "1"
204508-204535 uart: tx-data-bit: "1"
204534-204561 uart: tx-data-bit: "0"
204560-204587 uart: tx-data-bit: "1"
204586-204613 uart: tx-data-bit: "0"
204612-204639 uart: tx-data-bit: "1"
204638-204665 uart: tx-data-bit: "1"
204664-204691 uart: tx-data-bit: "0"
204690-204717 uart: tx-data-bit: "1"
204482-204717 uart: tx-data: "363"
204716-204743 uart: tx-stop: "Stop bit" "Stop" "T"
205002-205029 uart: tx-start: "Start bit" "Start" "S"
205028-205055 uart: tx-data-bit: "0"
205054-205081 uart: tx-data-bit: "0"
205080-205107 uart: tx-data-bit: "1"
205106-205133 uart: tx-data-bit: "1"
205132-205159 uart: tx-data-bit: "0"
205158-205185 uart: tx-data-bit: "1"
205184-205211 uart: tx-data-bit: "1"
205210-205237 uart: tx-data-bit: "0"
205236-205263 uart: tx-data-bit: "1"
205028-205263 uart: tx-data: "364"
205262-205289 uart: tx-stop: "Stop bit" "Stop" "T"
205547-205574 uart: tx-start: "Start bit" "Start" "S"
205573-205600 uart: tx-data-bit: "1"
205599-205626 uart: tx-data-bit: "0"
205625-205652 uart: tx-data-bit: "1"
205651-205678 uart: tx-data-bit: "1"
205677-205704 uart: tx-data-bit: "0"
205703-205730 uart: tx-data-bit: "1"
205729-205756 uart: tx-data-bit: "1"
205755-205782 uart: tx-data-bit: "0"
205781-205808 uart: tx-data-bit: "1"
205573-205808 uart: tx-data: "365"
205807-205834 uart: tx-stop: "Stop bit" "Stop" "T"
206093-206120 uart: tx-start: "Start bit" "Start" "S"
206119-206146 uart: tx-data-bit: "0"
206145-206172 uart: tx-data-bit: "1"
206171-206198 uart: tx-data-bit: "1"
206197-206224 uart: tx-data-bit: "1"
206223-206250 uart: tx-data-bit: "0"
206249-206276 uart: tx-data-bit: "1"
206275-206302 uart: tx-data-bit: "1"
206301-206328 uart: tx-data-bit: "0"
206327-206354 uart: tx-data-bit: "1"
206119-206354 uart: tx-data: "366"
206353-206380 uart: tx-stop: "Stop bit" "Stop" "T"
206638-206665 uart: tx-start: "Start bit" "Start" "S"
206664-206691 uart: tx-data-bit: "1"
206690-206717 uart: tx-data-bit: "1"
206716-206743 uart: tx-data-bit: "1"
206742-206769 uart: tx-data-bit: "1"
206768-206795 uart: tx-data-bit: "0"
206794-206821 uart: tx-data-bit: "1"
206820-206847 uart: tx-data-bit: "1"
206846-206873 uart: tx-data-bit: "0"
206872-206899 uart: tx-data-bit: "1"
206664-206899 uart: tx-data: "367"
206898-206925 uart: tx-stop: "Stop bit" "Stop" "T"
207183-207210 uart: tx-start: "Start bit" "Start" "S"
207209-207236 uart: tx-data-bit: "0"
207235-207262 uart: tx-data-bit: "0"
207261-207288 uart: tx-data-bit: "0"
207287-207314 uart: tx-data-bit: "0"
207313-207340 uart: tx-data-bit: "1"
207339-207366 uart: tx-data-bit: "1"
207365-207392 uart: tx-data-bit: "1"
207391-207418 uart: tx-data-bit: "0"
207417-207444 uart: tx-data-bit: "1"
207209-207444 uart: tx-data: "368"
207443-207470 uart: tx-stop: "Stop bit" "Stop" "T"
207725-207752 uart: tx-start: "Start bit" "Start" "S"
207751-207778 uart: tx-data-bit: "1"
207777-207804 uart: tx-data-bit: "0"
207803-207830 uart: tx-data-bit: "0"
207829-207856 uart: tx-data-bit: "0"
207855-207882 uart: tx-data-bit: "1"
207881-207908 uart: tx-data-bit: "1"
207907-207934 uart: tx-data-bit: "1"
207933-207960 uart: tx-data-bit: "0"
207959-207986 uart: tx-data-bit: "1"
207751-207986 uart: tx-data: "369"
207985-208012 uart: tx-stop: "Stop bit" "Stop" "T"
208270-208297 uart: tx-start: "Start bit" "Start" "S"
208296-208323 uart: tx-data-bit: "0"
208322-208349 uart: tx-data-bit: "1"
208348-208375 uart: tx-data-bit: "0"
208374-208401 uart: tx-data-bit: "0"
208400-208427 uart: tx-data-bit: "1"
208426-208453 uart: tx-data-bit: "1"
208452-208479 uart: tx-data-bit: "1"
208478-208505 uart: tx-data-bit: "0"
208504-208531 uart: tx-data-bit: "1"
208296-208531 uart: tx-data: "370"
208530-208557 uart: tx-stop: "Stop bit" "Stop" "T"
208814-208841 uart: tx-start: "Start bit" "Start" "S"
208840-208867 uart: tx-data-bit: "1"
208866-208893 uart: tx-data-bit: "1"
208892-208919 uart: tx-data-bit: "0"
208918-208945 uart: tx-data-bit: "0"
208944-208971 uart: tx-data-bit: "1"
208970-208997 uart: tx-data-bit: "1"
208996-209023 uart: tx-data-bit: "1"
209022-209049 uart: tx-data-bit: "0"
209048-209075 uart: tx-data-bit: "1"
208840-209075 uart: tx-data: "371"
200664-209075 uart: tx-packet: "356 357 358 359 360 361 362 363 364 365 366 367 368 369 370 371"
209074-209101 uart: tx-stop: "Stop bit" "Stop" "T"
209359-209386 uart: tx-start: "Start bit" "Start" "S"
209385-209412 uart: tx-data-bit: "0"
209411-209438 uart: tx-data-bit: "0"
209437-209464 uart: tx-data-bit: "1"
209463-209490 uart: tx-data-bit: "0"
209489-209516 uart: tx-data-bit: "1"
209515-209542 uart: tx-data-bit: "1"
209541-209568 uart: tx-data-bit: "1"
209567-209594 uart: tx-data-bit: "0"
209593-209620 uart: tx-data-bit: "1"
209385-209620 uart: tx-data: "372"
209619-209646 uart: tx-stop: "Stop bit" "Stop" "T"
209903-209930 uart: tx-start: "Start bit" "Start" "S"
209929-209956 uart: tx-data-bit: "1"
209955-209982 uart: tx-data-bit: "0"
209981-210008 uart: tx-data-bit: "1"
210007-210034 uart: tx-data-bit: "0"
210033-210060 uart: tx-data-bit: "1"
210059-210086 uart: tx-data-bit: "1"
210085-210112 uart: tx-data-bit: "1"
210111-210138 uart: tx-data-bit: "0"
210137-210164 uart: tx-data-bit: "1"
209929-210164 uart: tx-data: "373"
210163-210190 uart: tx-stop: "Stop bit" "Stop" "T"
210450-210477 uart: tx-start: "Start bit" "Start" "S"
210476-210503 uart: tx-data-bit: "0"
210502-210529 uart: tx-data-bit: "1"
210528-210555 uart: tx-data-bit: "1"
210554-210581 uart: tx-data-bit: "0"
210580-210607 uart: tx-data-bit: "1"
210606-210633 uart: tx-data-bit: "1"
210632-210659 uart: tx-data-bit: "1"
210658-210685 uart: tx-data-bit: "0"
210684-210711 uart: tx-data-bit: "1"
210476-210711 uart: tx-data: "374"
210710-210737 uart: tx-stop: "Stop bit" "Stop" "T"
210995-211022 uart: tx-start: "Start bit" "Start" "S"
211021-211048 uart: tx-data-bit: "1"
211047-211074 uart: tx-data-bit: "1"
211073-211100 uart: tx-data-bit: "1"
211099-211126 uart: tx-data-bit: "0"
211125-211152 uart: tx-data-bit: "1"
211151-211178 uart: tx-data-bit: "1"
211177-211204 uart: tx-data-bit: "1"
211203-211230 uart: tx-data-bit: "0"
211229-211256 uart: tx-data-bit: "1"
211021-211256 uart: tx-data: "375"
211255-211282 uart: tx-stop: "Stop bit" "Stop" "T"
211539-211566 uart: tx-start: "Start bit" "Start" "S"
211565-211592 uart: tx-data-bit: "0"
211591-211618 uart: tx-data-bit: "0"
211617-211644 uart: tx-data-bit: "0"
211643-211670 uart: tx-data-bit: "1"
211669-211696 uart: tx-data-bit: "1"
211695-211722 uart: tx-data-bit: "1"
211721-211748 uart: tx-data-bit: "1"
211747-211774 uart: tx-data-bit: "0"
211773-211800 uart: tx-data-bit: "1"
211565-211800 uart: tx-data: "376"
211799-211826 uart: tx-stop: "Stop bit" "Stop" "T"
212082-212109 uart: tx-start: "Start bit" "Start" "S"
212108-212135 uart: tx-data-bit: "1"
212134-212161 uart: tx-data-bit: "0"
212160-212187 uart: tx-data-bit: "0"
212186-212213 uart: tx-data-bit: "1"
212212-212239 uart: tx-data-bit: "1"
212238-212265 uart: tx-data-bit: "1"
212264-212291 uart: tx-data-bit: "1"
212290-212317 uart: tx-data-bit: "0"
212316-212343 uart: tx-data-bit: "1"
212108-212343 uart: tx-data: "377"
212342-212369 uart: tx-stop: "Stop bit" "Stop" "T"
212626-212653 uart: tx-start: "Start bit" "Start" "S"
212652-212679 uart: tx-data-bit: "0"
212678-212705 uart: tx-data-bit: "1"
212704-212731 uart: tx-data-bit: "0"
212730-212757 uart: tx-data-bit: "1"
212756-212783 uart: tx-data-bit: "1"
212782-212809 uart: tx-data-bit: "1"
212808-212835 uart: tx-data-bit: "1"
212834-212861 uart: tx-data-bit: "0"
212860-212887 uart: tx-data-bit: "1"
212652-212887 uart: tx-data: "378"
212886-212913 uart: tx-stop: "Stop bit" "Stop" "T"
213171-213198 uart: tx-start: "Start bit" "Start" "S"
213197-213224 uart: tx-data-bit: "1"
213223-213250 uart: tx-data-bit: "1"
213249-213276 uart: tx-data-bit: "0"
213275-213302 uart: tx-data-bit: "1"
213301-213328 uart: tx-data-bit: "1"
213327-213354 uart: tx-data-bit: "1"
213353-213380 uart: tx-data-bit: "1"
213379-213406 uart: tx-data-bit: "0"
213405-213432 uart: tx-data-bit: "1"
213197-213432 uart: tx-data: "379"
213431-213458 uart: tx-stop: "Stop bit" "Stop" "T"
213715-213742 uart: tx-start: "Start bit" "Start" "S"
213741-213768 uart: tx-data-bit: "0"
213767-213794 uart: tx-data-bit: "0"
213793-213820 uart: tx-data-bit: "1"
213819-213846 uart: tx-data-bit: "1"
213845-213872 uart: tx-data-bit: "1"
213871-213898 uart: tx-data-bit: "1"
213897-213924 uart: tx-data-bit: "1"
213923-213950 uart: tx-data-bit: "0"
213949-213976 uart: tx-data-bit: "1"
213741-213976 uart: tx-data: "380"
213975-214002 uart: tx-stop: "Stop bit" "Stop" "T"
214258-214285 uart: tx-start: "Start bit" "Start" "S"
214284-214311 uart: tx-data-bit: "1"
214310-214337 uart: tx-data-bit: "0"
214336-214363 uart: tx-data-bit: "1"
214362-214389 uart: tx-data-bit: "1"
214388-214415 uart: tx-data-bit: "1"
214414-214441 uart: tx-data-bit: "1"
214440-214467 uart: tx-data-bit: "1"
214466-214493 uart: tx-data-bit: "0"
214492-214519 uart: tx-data-bit: "1"
214284-214519 uart: tx-data: "381"
214518-214545 uart: tx-stop: "Stop bit" "Stop" "T"
214803-214830 uart: tx-start: "Start bit" "Start" "S"
214829-214856 uart: tx-data-bit: "0"
214855-214882 uart: tx-data-bit: "1"
214881-214908 uart: tx-data-bit: "1"
214907-214934 uart: tx-data-bit: "1"
214933-214960 uart: tx-data-bit: "1"
214959-214986 uart: tx-data-bit: "1"
214985-215012 uart: tx-data-bit: "1"
215011-215038 uart: tx-data-bit: "0"
215037-215064 uart: tx-data-bit: "1"
214829-215064 uart: tx-data: "382"
215063-215090 uart: tx-stop: "Stop bit" "Stop" "T"
215345-215372 uart: tx-start: "Start bit" "Start" "S"
215371-215398 uart: tx-data-bit: "1"
215397-215424 uart: tx-data-bit: "1"
215423-215450 uart: tx-data-bit: "1"
215449-215476 uart: tx-data-bit: "1"
215475-215502 uart: tx-data-bit: "1"
215501-215528 uart: tx-data-bit: "1"
215527-215554 uart: tx-data-bit: "1"
215553-215580 uart: tx-data-bit: "0"
215579-215606 uart: tx-data-bit: "1"
215371-215606 uart: tx-data: "383"
215605-215632 uart: tx-stop: "Stop bit" "Stop" "T"
215888-215915 uart: tx-start: "Start bit" "Start" "S"
215914-215941 uart: tx-data-bit: "0"
215940-215967 uart: tx-data-bit: "0"
215966-215993 uart: tx-data-bit: "0"
215992-216019 uart: tx-data-bit: "0"
216018-216045 uart: tx-data-bit: "0"
216044-216071 uart: tx-data-bit: "0"
216070-216097 uart: tx-data-bit: "0"
216096-216123 uart: tx-data-bit: "1"
216122-216149 uart: tx-data-bit: "1"
215914-216149 uart: tx-data: "384"
216148-216175 uart: tx-stop: "Stop bit" "Stop" "T"
216428-216455 uart: tx-start: "Start bit" "Start" "S"
216454-216481 uart: tx-data-bit: "1"
216480-216507 uart: tx-data-bit: "0"
216506-216533 uart: tx-data-bit: "0"
216532-216559 uart: tx-data-bit: "0"
216558-216585 uart: tx-data-bit: "0"
216584-216611 uart: tx-data-bit: "0"
216610-216637 uart: tx-data-bit: "0"
216636-216663 uart: tx-data-bit: "1"
216662-216689 uart: tx-data-bit: "1"
216454-216689 uart: tx-data: "385"
216688-216715 uart: tx-stop: "Stop bit" "Stop" "T"
216971-216998 uart: tx-start: "Start bit" "Start" "S"
216997-217024 uart: tx-data-bit: "0"
217023-217050 uart: tx-data-bit: "1"
217049-217076 uart: tx-data-bit: "0"
217075-217102 uart: tx-data-bit: "0"
217101-217128 uart: tx-data-bit: "0"
217127-217154 uart: tx-data-bit: "0"
217153-217180 uart: tx-data-bit: "0"
217179-217206 uart: tx-data-bit: "1"
217205-217232 uart: tx-data-bit: "1"
216997-217232 uart: tx-data: "386"
217231-217258 uart: tx-stop: "Stop bit" "Stop" "T"
217513-217540 uart: tx-start: "Start bit" "Start" "S"
217539-217566 uart: tx-data-bit: "1"
217565-217592 uart: tx-data-bit: "1"
217591-217618 uart: tx-data-bit: "0"
217617-217644 uart: tx-data-bit: "0"
217643-217670 uart: tx-data-bit: "0"
217669-217696 uart: tx-data-bit: "0"
217695-217722 uart: tx-data-bit: "0"
217721-217748 uart: tx-data-bit: "1"
217747-217774 uart: tx-data-bit: "1"
217539-217774 uart: tx-data: "387"
209385-217774 uart: tx-packet: "372 373 374 375 376 377 378 379 380 381 382 383 384 385 386 387"
217773-217800 uart: tx-stop: "Stop bit" "Stop" "T"
218056-218083 uart: tx-start: "Start bit" "Start" "S"
218082-218109 uart: tx-data-bit: "0"
218108-218135 uart: tx-data-bit: "0"
218134-218161 uart: tx-data-bit: "1"
218160-218187 uart: tx-data-bit: "0"
218186-218213 uart: tx-data-bit: "0"
218212-218239 uart: tx-data-bit: "0"
218238-218265 uart: tx-data-bit: "0"
218264-218291 uart: tx-data-bit: "1"
218290-218317 uart: tx-data-bit: "1"
218082-218317 uart: tx-data: "388"
218316-218343 uart: tx-stop: "Stop bit" "Stop" "T"
218599-218626 uart: tx-start: "Start bit" "Start" "S"
218625-218652 uart: tx-data-bit: "1"
218651-218678 uart: tx-data-bit: "0"
218677-218704 uart: tx-data-bit: "1"
218703-218730 uart: tx-data-bit: "0"
218729-218756 uart: tx-data-bit: "0"
218755-218782 uart: tx-data-bit: "0"
218781-218808 uart: tx-data-bit: "0"
218807-218834 uart: tx-data-bit: "1"
218833-218860 uart: tx-data-bit: "1"
218625-218860 uart: tx-data: "389"
218859-218886 uart: tx-stop: "Stop bit" "Stop" "T"
219143-219170 uart: tx-start: "Start bit" "Start" "S"
219169-219196 uart: tx-data-bit: "0"
219195-219222 uart: tx-data-bit: "1"
219221-219248 uart: tx-data-bit: "1"
219247-219274 uart: tx-data-bit: "0"
219273-219300 uart: tx-data-bit: "0"
219299-219326 uart: tx-data-bit: "0"
219325-219352 uart: tx-data-bit: "0"
219351-219378 uart: tx-data-bit: "1"
219377-219404 uart: tx-data-bit: "1"
219169-219404 uart: tx-data: "390"
219403-219430 uart: tx-stop: "Stop bit" "Stop" "T"
219686-219713 uart: tx-start: "Start bit" "Start" "S"
219712-219739 uart: tx-data-bit: "1"
219738-219765 uart: tx-data-bit: "1"
219764-219791 uart: tx-data-bit: "1"
219790-219817 uart: tx-data-bit: "0"
219816-219843 uart: tx-data-bit: "0"
219842-219869 uart: tx-data-bit: "0"
219868-219895 uart: tx-data-bit: "0"
219894-219921 uart: tx-data-bit: "1"
219920-219947 uart: tx-data-bit: "1"
219712-219947 uart: tx-data: "391"
219946-219973 uart: tx-stop: "Stop bit" "Stop" "T"
220228-220255 uart: tx-start: "Start bit" "Start" "S"
220254-220281 uart: tx-data-bit: "0"
220280-220307 uart: tx-data-bit: "0"
220306-220333 uart: tx-data-bit: "0"
220332-220359 uart: tx-data-bit: "1"
220358-220385 uart: tx-data-bit: "0"
220384-220411 uart: tx-data-bit: "0"
220410-220437 uart: tx-data-bit: "0"
220436-220463 uart: tx-data-bit: "1"
220462-220489 uart: tx-data-bit: "1"
220254-220489 uart: tx-data: "392"
220488-220515 uart: tx-stop: "Stop bit" "Stop" "T"
220771-220798 uart: tx-start: "Start bit" "Start" "S"
220797-220824 uart: tx-data-bit: "1"
220823-220850 uart: tx-data-bit: "0"
220849-220876 uart: tx-data-bit: "0"
220875-220902 uart: tx-data-bit: "1"
220901-220928 uart: tx-data-bit: "0"
220927-220954 uart: tx-data-bit: "0"
220953-220980 uart: tx-data-bit: "0"
220979-221006 uart: tx-data-bit: "1"
221005-221032 uart: tx-data-bit: "1"
220797-221032 uart: tx-data: "393"
221031-221058 uart: tx-stop: "Stop bit" "Stop" "T"
221315-221342 uart: tx-start: "Start bit" "Start" "S"
221341-221368 uart: tx-data-bit: "0"
221367-221394 uart: tx-data-bit: "1"
221393-221420 uart: tx-data-bit: "0"
221419-221446 uart: tx-data-bit: "1"
221445-221472 uart: tx-data-bit: "0"
221471-221498 uart: tx-data-bit: "0"
221497-221524 uart: tx-data-bit: "0"
221523-221550 uart: tx-data-bit: "1"
221549-221576 uart: tx-data-bit: "1"
221341-221576 uart: tx-data: "394"
221575-221602 uart: tx-stop: "Stop bit" "Stop" "T"
221860-221887 uart: tx-start: "Start bit" "Start" "S"
221886-221913 uart: tx-data-bit: "1"
221912-221939 uart: tx-data-bit: "1"
221938-221965 uart: tx-data-bit: "0"
221964-221991 uart: tx-data-bit: "1"
221990-222017 uart: tx-data-bit: "0"
222016-222043 uart: tx-data-bit: "0"
222042-222069 uart: tx-data-bit: "0"
222068-222095 uart: tx-data-bit: "1"
222094-222121 uart: tx-data-bit: "1"
221886-222121 uart: tx-data: "395"
222120-222147 uart: tx-stop: "Stop bit" "Stop" "T"
222405-222432 uart: tx-start: "Start bit" "Start" "S"
222431-222458 uart: tx-data-bit: "0"
222457-222484 uart: tx-data-bit: "0"
222483-222510 uart: tx-data-bit: "1"
222509-222536 uart: tx-data-bit: "1"
222535-222562 uart: tx-data-bit: "0"
222561-222588 uart: tx-data-bit: "0"
222587-222614 uart: tx-data-bit: "0"
222613-222640 uart: tx-data-bit: "1"
222639-222666 uart: tx-data-bit: "1"
222431-222666 uart: tx-data: "396"
222665-222692 uart: tx-stop: "Stop bit" "Stop" "T"
222947-222974 uart: tx-start: "Start bit" "Start" "S"
222973-223000 uart: tx-data-bit: "1"
222999-223026 uart: tx-data-bit: "0"
223025-223052 uart: tx-data-bit: "1"
223051-223078 uart: tx-data-bit: "1"
223077-223104 uart: tx-data-bit: "0"
223103-223130 uart: tx-data-bit: "0"
223129-223156 uart: tx-data-bit: "0"
223155-223182 uart: tx-data-bit: "1"
223181-223208 uart: tx-data-bit: "1"
222973-223208 uart: tx-data: "397"
223207-223234 uart: tx-stop: "Stop bit" "Stop" "T"
223492-223519 uart: tx-start: "Start bit" "Start" "S"
223518-223545 uart: tx-data-bit: "0"
223544-223571 uart: tx-data-bit: "1"
223570-223597 uart: tx-data-bit: "1"
223596-223623 uart: tx-data-bit: "1"
223622-223649 uart: tx-data-bit: "0"
223648-223675 uart: tx-data-bit: "0"
223674-223701 uart: tx-data-bit: "0"
223700-223727 uart: tx-data-bit: "1"
223726-223753 uart: tx-data-bit: "1"
223518-223753 uart: tx-data: "398"
223752-223779 uart: tx-stop: "Stop bit" "Stop" "T"
224034-224061 uart: tx-start: "Start bit" "Start" "S"
224060-224087 uart: tx-data-bit: "1"
224086-224113 uart: tx-data-bit: "1"
224112-224139 uart: tx-data-bit: "1"
224138-224165 uart: tx-data-bit: "1"
224164-224191 uart: tx-data-bit: "0"
224190-224217 uart: tx-data-bit: "0"
224216-224243 uart: tx-data-bit: "0"
224242-224269 uart: tx-data-bit: "1"
224268-224295 uart: tx-data-bit: "1"
224060-224295 uart: tx-data: "399"
224294-224321 uart: tx-stop: "Stop bit" "Stop" "T"
224577-224604 uart: tx-start: "Start bit" "Start" "S"
224603-224630 uart: tx-data-bit: "0"
224629-224656 uart: tx-data-bit: "0"
224655-224682 uart: tx-data-bit: "0"
224681-224708 uart: tx-data-bit: "0"
224707-224734 uart: tx-data-bit: "1"
224733-224760 uart: tx-data-bit: "0"
224759-224786 uart: tx-data-bit: "0"
224785-224812 uart: tx-data-bit: "1"
224811-224838 uart: tx-data-bit: "1"
224603-224838 uart: tx-data: "400"
224837-224864 uart: tx-stop: "Stop bit" "Stop" "T"
225119-225146 uart: tx-start: "Start bit" "Start" "S"
225145-225172 uart: tx-data-bit: "1"
225171-225198 uart: tx-data-bit: "0"
225197-225224 uart: tx-data-bit: "0"
225223-225250 uart: tx-data-bit: "0"
225249-225276 uart: tx-data-bit: "1"
225275-225302 uart: tx-data-bit: "0"
225301-225328 uart: tx-data-bit: "0"
225327-225354 uart: tx-data-bit: "1"
225353-225380 uart: tx-data-bit: "1"
225145-225380 uart: tx-data: "401"
225379-225406 uart: tx-stop: "Stop bit" "Stop" "T"
225664-225691 uart: tx-start: "Start bit" "Start" "S"
225690-225717 uart: tx-data-bit: "0"
225716-225743 uart: tx-data-bit: "1"
225742-225769 uart: tx-data-bit: "0"
225768-225795 uart: tx-data-bit: "0"
225794-225821 uart: tx-data-bit: "1"
225820-225847 uart: tx-data-bit: "0"
225846-225873 uart: tx-data-bit: "0"
225872-225899 uart: tx-data-bit: "1"
225898-225925 uart: tx-data-bit: "1"
225690-225925 uart: tx-data: "402"
225924-225951 uart: tx-stop: "Stop bit" "Stop" "T"
226209-226236 uart: tx-start: "Start bit" "Start" "S"
226235-226262 uart: tx-data-bit: "1"
226261-226288 uart: tx-data-bit: "1"
226287-226314 uart: tx-data-bit: "0"
226313-226340 uart: tx-data-bit: "0"
226339-226366 uart: tx-data-bit: "1"
226365-226392 uart: tx-data-bit: "0"
226391-226418 uart: tx-data-bit: "0"
226417-226444 uart: tx-data-bit: "1"
226443-226470 uart: tx-data-bit: "1"
226235-226470 uart: tx-data: "403"
218082-226470 uart: tx-packet: "388 389 390 391 392 393 394 395 396 397 398 399 400 401 402 403"
226469-226496 uart: tx-stop: "Stop bit" "Stop" "T"
226753-226780 uart: tx-start: "Start bit" "Start" "S"
226779-226806 uart: tx-data-bit: "0"
226805-226832 uart: tx-data-bit: "0"
226831-226858 uart: tx-data-bit: "1"
226857-226884 uart: tx-data-bit: "0"
226883-226910 uart: tx-data-bit: "1"
226909-226936 uart: tx-data-bit: "0"
226935-226962 uart: tx-data-bit: "0"
226961-226988 uart: tx-data-bit: "1"
226987-227014 uart: tx-data-bit: "1"
226779-227014 uart: tx-data: "404"
227013-227040 uart: tx-stop: "Stop bit" "Stop" "T"
227298-227325 uart: tx-start: "Start bit" "Start" "S"
227324-227351 uart: tx-data-bit: "1"
227350-227377 uart: tx-data-bit: "0"
227376-227403 uart: tx-data-bit: "1"
227402-227429 uart: tx-data-bit: "0"
227428-227455 uart: tx-data-bit: "1"
227454-227481 uart: tx-data-bit: "0"
227480-227507 uart: tx-data-bit: "0"
227506-227533 uart: tx-data-bit: "1"
227532-227559 uart: tx-data-bit: "1"
227324-227559 uart: tx-data: "405"
227558-227585 uart: tx-stop: "Stop bit" "Stop" "T"
227844-227871 uart: tx-start: "Start bit" "Start" "S"
227870-227897 uart: tx-data-bit: "0"
227896-227923 uart: tx-data-bit: "1"
227922-227949 uart: tx-data-bit: "1"
227948-227975 uart: tx-data-bit: "0"
227974-228001 uart: tx-data-bit: "1"
228000-228027 uart: tx-data-bit: "0"
228026-228053 uart: tx-data-bit: "0"
228052-228079 uart: tx-data-bit: "1"
228078-228105 uart: tx-data-bit: "1"
227870-228105 uart: tx-data: "406"
228104-228131 uart: tx-stop: "Stop bit" "Stop" "T"
228389-228416 uart: tx-start: "Start bit" "Start" "S"
228415-228442 uart: tx-data-bit: "1"
228441-228468 uart: tx-data-bit: "1"
228467-228494 uart: tx-data-bit: "1"
228493-228520 uart: tx-data-bit: "0"
228519-228546 uart: tx-data-bit: "1"
228545-228572 uart: tx-data-bit: "0"
228571-228598 uart: tx-data-bit: "0"
228597-228624 uart: tx-data-bit: "1"
228623-228650 uart: tx-data-bit: "1"
228415-228650 uart: tx-data: "407"
228649-228676 uart: tx-stop: "Stop bit" "Stop" "T"
228933-228960 uart: tx-start: "Start bit" "Start" "S"
228959-228986 uart: tx-data-bit: "0"
228985-229012 uart: tx-data-bit: "0"
229011-229038 uart: tx-data-bit: "0"
229037-229064 uart: tx-data-bit: "1"
229063-229090 uart: tx-data-bit: "1"
229089-229116 uart: tx-data-bit: "0"
229115-229142 uart: tx-data-bit: "0"
229141-229168 uart: tx-data-bit: "1"
229167-229194 uart: tx-data-bit: "1"
228959-229194 uart: tx-data: "408"
229193-229220 uart: tx-stop: "Stop bit" "Stop" "T"
229476-229503 uart: tx-start: "Start bit" "Start" "S"
229502-229529 uart: tx-data-bit: "1"
229528-229555 uart: tx-data-bit: "0"
229554-229581 uart: tx-data-bit: "0"
229580-229607 uart: tx-data-bit: "1"
229606-229633 uart: tx-data-bit: "1"
229632-229659 uart: tx-data-bit: "0"
229658-229685 uart: tx-data-bit: "0"
229684-229711 uart: tx-data-bit: "1"
229710-229737 uart: tx-data-bit: "1"
229502-229737 uart: tx-data: "409"
229736-229763 uart: tx-stop: "Stop bit" "Stop" "T"
230021-230048 uart: tx-start: "Start bit" "Start" "S"
230047-230074 uart: tx-data-bit: "0"
230073-230100 uart: tx-data-bit: "1"
230099-230126 uart: tx-data-bit: "0"
230125-230152 uart: tx-data-bit: "1"
230151-230178 uart: tx-data-bit: "1"
230177-230204 uart: tx-data-bit: "0"
230203-230230 uart: tx-data-bit: "0"
230229-230256 uart: tx-data-bit: "1"
230255-230282 uart: tx-data-bit: "1"
230047-230282 uart: tx-data: "410"
230281-230308 uart: tx-stop: "Stop bit" "Stop" "T"
230565-230592 uart: tx-start: "Start bit" "Start" "S"
230591-230618 uart: tx-data-bit: "1"
230617-230644 uart: tx-data-bit: "1"
230643-230670 uart: tx-data-bit: "0"
230669-230696 uart: tx-data-bit: "1"
230695-230722 uart: tx-data-bit: "1"
230721-230748 uart: tx-data-bit: "0"
230747-230774 uart: tx-data-bit: "0"
230773-230800 uart: tx-data-bit: "1"
230799-230826 uart: tx-data-bit: "1"
230591-230826 uart: tx-data: "411"
230825-230852 uart: tx-stop: "Stop bit" "Stop" "T"
231110-231137 uart: tx-start: "Start bit" "Start" "S"
231136-231163 uart: tx-data-bit: "0"
231162-231189 uart: tx-data-bit: "0"
231188-231215 uart: tx-data-bit: "1"
231214-231241 uart: tx-data-bit: "1"
231240-231267 uart: tx-data-bit: "1"
231266-231293 uart: tx-data-bit: "0"
231292-231319 uart: tx-data-bit: "0"
231318-231345 uart: tx-data-bit: "1"
231344-231371 uart: tx-data-bit: "1"
231136-231371 uart: tx-data: "412"
231370-231397 uart: tx-stop: "Stop bit" "Stop" "T"
231652-231679 uart: tx-start: "Start bit" "Start" "S"
231678-231705 uart: tx-data-bit: "1"
231704-231731 uart: tx-data-bit: "0"
231730-231757 uart: tx-data-bit: "1"
231756-231783 uart: tx-data-bit: "1"
231782-231809 uart: tx-data-bit: "1"
231808-231835 uart: tx-data-bit: "0"
231834-231861 uart: tx-data-bit: "0"
231860-231887 uart: tx-data-bit: "1"
231886-231913 uart: tx-data-bit: "1"
231678-231913 uart: tx-data: "413"
231912-231939 uart: tx-stop: "Stop bit" "Stop" "T"
232197-232224 uart: tx-start: "Start bit" "Start" "S"
232223-232250 uart: tx-data-bit: "0"
232249-232276 uart: tx-data-bit: "1"
232275-232302 uart: tx-data-bit: "1"
232301-232328 uart: tx-data-bit: "1"
232327-232354 uart: tx-data-bit: "1"
232353-232380 uart: tx-data-bit: "0"
232379-232406 uart: tx-data-bit: "0"
232405-232432 uart: tx-data-bit: "1"
232431-232458 uart: tx-data-bit: "1"
232223-232458 uart: tx-data: "414"
232457-232484 uart: tx-stop: "Stop bit" "Stop" "T"
232739-232766 uart: tx-start: "Start bit" "Start" "S"
232765-232792 uart: tx-data-bit: "1"
232791-232818 uart: tx-data-bit: "1"
232817-232844 uart: tx-data-bit: "1"
232843-232870 uart: tx-data-bit: "1"
232869-232896 uart: tx-data-bit: "1"
232895-232922 uart: tx-data-bit: "0"
232921-232948 uart: tx-data-bit: "0"
232947-232974 uart: tx-data-bit: "1"
232973-233000 uart: tx-data-bit: "1"
232765-233000 uart: tx-data: "415"
232999-233026 uart: tx-stop: "Stop bit" "Stop" "T"
233282-233309 uart: tx-start: "Start bit" "Start" "S"
233308-233335 uart: tx-data-bit: "0"
233334-233361 uart: tx-data-bit: "0"
233360-233387 uart: tx-data-bit: "0"
233386-233413 uart: tx-data-bit: "0"
233412-233439 uart: tx-data-bit: "0"
233438-233465 uart: tx-data-bit: "1"
233464-233491 uart: tx-data-bit: "0"
233490-233517 uart: tx-data-bit: "1"
233516-233543 uart: tx-data-bit: "1"
233308-233543 uart: tx-data: "416"
233542-233569 uart: tx-stop: "Stop bit" "Stop" "T"
233825-233852 uart: tx-start: "Start bit" "Start" "S"
233851-233878 uart: tx-data-bit: "1"
233877-233904 uart: tx-data-bit: "0"
233903-233930 uart: tx-data-bit: "0"
233929-233956 uart: tx-data-bit: "0"
233955-233982 uart: tx-data-bit: "0"
233981-234008 uart: tx-data-bit: "1"
234007-234034 uart: tx-data-bit: "0"
234033-234060 uart: tx-data-bit: "1"
234059-234086 uart: tx-data-bit: "1"
233851-234086 uart: tx-data: "417"
234085-234112 uart: tx-stop: "Stop bit" "Stop" "T"
234369-234396 uart: tx-start: "Start bit" "Start" "S"
234395-234422 uart: tx-data-bit: "0"
234421-234448 uart: tx-data-bit: "1"
234447-234474 uart: tx-data-bit: "0"
234473-234500 uart: tx-data-bit: "0"
234499-234526 uart: tx-data-bit: "0"
234525-234552 uart: tx-data-bit: "1"
234551-234578 uart: tx-data-bit: "0"
234577-234604 uart: tx-data-bit: "1"
234603-234630 uart: tx-data-bit: "1"
234395-234630 uart: tx-data: "418"
234629-234656 uart: tx-stop: "Stop bit" "Stop" "T"
234914-234941 uart: tx-start: "Start bit" "Start" "S"
234940-234967 uart: tx-data-bit: "1"
234966-234993 uart: tx-data-bit: "1"
234992-235019 uart: tx-data-bit: "0"
235018-235045 uart: tx-data-bit: "0"
235044-235071 uart: tx-data-bit: "0"
235070-235097 uart: tx-data-bit: "1"
235096-235123 uart: tx-data-bit: "0"
235122-235149 uart: tx-data-bit: "1"
235148-235175 uart: tx-data-bit: "1"
234940-235175 uart: tx-data: "419"
226779-235175 uart: tx-packet: "404 405 406 407 408 409 410 411 412 413 414 415 416 417 418 419"
235174-235201 uart: tx-stop: "Stop bit" "Stop" "T"
235458-235485 uart: tx-start: "Start bit" "Start" "S"
235484-235511 uart: tx-data-bit: "0"
235510-235537 uart: tx-data-bit: "0"
235536-235563 uart: tx-data-bit: "1"
235562-235589 uart: tx-data-bit: "0"
235588-235615 uart: tx-data-bit: "0"
235614-235641 uart: tx-data-bit: "1"
235640-235667 uart: tx-data-bit: "0"
235666-235693 uart: tx-data-bit: "1"
235692-235719 uart: tx-data-bit: "1"
235484-235719 uart: tx-data: "420"
235718-235745 uart: tx-stop: "Stop bit" "Stop" "T"
236003-236030 uart: tx-start: "Start bit" "Start" "S"
236029-236056 uart: tx-data-bit: "1"
236055-236082 uart: tx-data-bit: "0"
236081-236108 uart: tx-data-bit: "1"
236107-236134 uart: tx-data-bit: "0"
236133-236160 uart: tx-data-bit: "0"
236159-236186 uart: tx-data-bit: "1"
236185-236212 uart: tx-data-bit: "0"
236211-236238 uart: tx-data-bit: "1"
236237-236264 uart: tx-data-bit: "1"
236029-236264 uart: tx-data: "421"
236263-236290 uart: tx-stop: "Stop bit" "Stop" "T"
236549-236576 uart: tx-start: "Start bit" "Start" "S"
236575-236602 uart: tx-data-bit: "0"
236601-236628 uart: tx-data-bit: "1"
236627-236654 uart: tx-data-bit: "1"
236653-236680 uart: tx-data-bit: "0"
236679-236706 uart: tx-data-bit: "0"
236705-236732 uart: tx-data-bit: "1"
236731-236758 uart: tx-data-bit: "0"
236757-236784 uart: tx-data-bit: "1"
236783-236810 uart: tx-data-bit: "1"
236575-236810 uart: tx-data: "422"
236809-236836 uart: tx-stop: "Stop bit" "Stop" "T"
237094-237121 uart: tx-start: "Start bit" "Start" "S"
237120-237147 uart: tx-data-bit: "1"
237146-237173 uart: tx-data-bit: "1"
237172-237199 uart: tx-data-bit: "1"
237198-237225 uart: tx-data-bit: "0"
237224-237251 uart: tx-data-bit: "0"
237250-237277 uart: tx-data-bit: "1"
237276-237303 uart: tx-data-bit: "0"
237302-237329 uart: tx-data-bit: "1"
237328-237355 uart: tx-data-bit: "1"
237120-237355 uart: tx-data: "423"
237354-237381 uart: tx-stop: "Stop bit" "Stop" "T"
237639-237666 uart: tx-start: "Start bit" "Start" "S"
237665-237692 uart: tx-data-bit: "0"
237691-237718 uart: tx-data-bit: "0"
237717-237744 uart: tx-data-bit: "0"
237743-237770 uart: tx-data-bit: "1"
237769-237796 uart: tx-data-bit: "0"
237795-237822 uart: tx-data-bit: "1"
237821-237848 uart: tx-data-bit: "0"
237847-237874 uart: tx-data-bit: "1"
237873-237900 uart: tx-data-bit: "1"
237665-237900 uart: tx-data: "424"
237899-237926 uart: tx-stop: "Stop bit" "Stop" "T"
238183-238210 uart: tx-start: "Start bit" "Start" "S"
238209-238236 uart: tx-data-bit: "1"
238235-238262 uart: tx-data-bit: "0"
238261-238288 uart: tx-data-bit: "0"
238287-238314 uart: tx-data-bit: "1"
238313-238340 uart: tx-data-bit: "0"
238339-238366 uart: tx-data-bit: "1"
238365-238392 uart: tx-data-bit: "0"
238391-238418 uart: tx-data-bit: "1"
238417-238444 uart: tx-data-bit: "1"
238209-238444 uart: tx-data: "425"
238443-238470 uart: tx-stop: "Stop bit" "Stop" "T"
238730-238757 uart: tx-start: "Start bit" "Start" "S"
238756-238783 uart: tx-data-bit: "0"
238782-238809 uart: tx-data-bit: "1"
238808-238835 uart: tx-data-bit: "0"
238834-238861 uart: tx-data-bit: "1"
238860-238887 uart: tx-data-bit: "0"
238886-238913 uart: tx-data-bit: "1"
238912-238939 uart: tx-data-bit: "0"
238938-238965 uart: tx-data-bit: "1"
238964-238991 uart: tx-data-bit: "1"
238756-238991 uart: tx-data: "426"
238990-239017 uart: tx-stop: "Stop bit" "Stop" "T"
239276-239303 uart: tx-start: "Start bit" "Start" "S"
239302-239329 uart: tx-data-bit: "1"
239328-239355 uart: tx-data-bit: "1"
239354-239381 uart: tx-data-bit: "0"
239380-239407 uart: tx-data-bit: "1"
239406-239433 uart: tx-data-bit: "0"
239432-239459 uart: tx-data-bit: "1"
239458-239485 uart: tx-data-bit: "0"
239484-239511 uart: tx-data-bit: "1"
239510-239537 uart: tx-data-bit: "1"
239302-239537 uart: tx-data: "427"
239536-239563 uart: tx-stop: "Stop bit" "Stop" "T"
239823-239850 uart: tx-start: "Start bit" "Start" "S"
239849-239876 uart: tx-data-bit: "0"
239875-239902 uart: tx-data-bit: "0"
239901-239928 uart: tx-data-bit: "1"
239927-239954 uart: tx-data-bit: "1"
239953-239980 uart: tx-data-bit: "0"
239979-240006 uart: tx-data-bit: "1"
240005-240032 uart: tx-data-bit: "0"
240031-240058 uart: tx-data-bit: "1"
240057-240084 uart: tx-data-bit: "1"
239849-240084 uart: tx-data: "428"
240083-240110 uart: tx-stop: "Stop bit" "Stop" "T"
240367-240394 uart: tx-start: "Start bit" "Start" "S"
240393-240420 uart: tx-data-bit: "1"
240419-240446 uart: tx-data-bit: "0"
240445-240472 uart: tx-data-bit: "1"
240471-240498 uart: tx-data-bit: "1"
240497-240524 uart: tx-data-bit: "0"
240523-240550 uart: tx-data-bit: "1"
240549-240576 uart: tx-data-bit: "0"
240575-240602 uart: tx-data-bit: "1"
240601-240628 uart: tx-data-bit: "1"
240393-240628 uart: tx-data: "429"
240627-240654 uart: tx-stop: "Stop bit" "Stop" "T"
240914-240941 uart: tx-start: "Start bit" "Start" "S"
240940-240967 uart: tx-data-bit: "0"
240966-240993 uart: tx-data-bit: "1"
240992-241019 uart: tx-data-bit: "1"
241018-241045 uart: tx-data-bit: "1"
241044-241071 uart: tx-data-bit: "0"
241070-241097 uart: tx-data-bit: "1"
241096-241123 uart: tx-data-bit: "0"
241122-241149 uart: tx-data-bit: "1"
241148-241175 uart: tx-data-bit: "1"
240940-241175 uart: tx-data: "430"
241174-241201 uart: tx-stop: "Stop bit" "Stop" "T"
241458-241485 uart: tx-start: "Start bit" "Start" "S"
241484-241511 uart: tx-data-bit: "1"
241510-241537 uart: tx-data-bit: "1"
241536-241563 uart: tx-data-bit: "1"
241562-241589 uart: tx-data-bit: "1"
241588-241615 uart: tx-data-bit: "0"
241614-241641 uart: tx-data-bit: "1"
241640-241667 uart: tx-data-bit: "0"
241666-241693 uart: tx-data-bit: "1"
241692-241719 uart: tx-data-bit: "1"
241484-241719 uart: tx-data: "431"
241718-241745 uart: tx-stop: "Stop bit" "Stop" "T"
242003-242030 uart: tx-start: "Start bit" "Start" "S"
242029-242056 uart: tx-data-bit: "0"
242055-242082 uart: tx-data-bit: "0"
242081-242108 uart: tx-data-bit: "0"
242107-242134 uart: tx-data-bit: "0"
242133-242160 uart: tx-data-bit: "1"
242159-242186 uart: tx-data-bit: "1"
242185-242212 uart: tx-data-bit: "0"
242211-242238 uart: tx-data-bit: "1"
242237-242264 uart: tx-data-bit: "1"
242029-242264 uart: tx-data: "432"
242263-242290 uart: tx-stop: "Stop bit" "Stop" "T"
242546-242573 uart: tx-start: "Start bit" "Start" "S"
242572-242599 uart: tx-data-bit: "1"
242598-242625 uart: tx-data-bit: "0"
242624-242651 uart: tx-data-bit: "0"
242650-242677 uart: tx-data-bit: "0"
242676-242703 uart: tx-data-bit: "1"
242702-242729 uart: tx-data-bit: "1"
242728-242755 uart: tx-data-bit: "0"
242754-242781 uart: tx-data-bit: "1"
242780-242807 uart: tx-data-bit: "1"
242572-242807 uart: tx-data: "433"
242806-242833 uart: tx-stop: "Stop bit" "Stop" "T"
243090-243117 uart: tx-start: "Start bit" "Start" "S"
243116-243143 uart: tx-data-bit: "0"
243142-243169 uart: tx-data-bit: "1"
243168-243195 uart: tx-data-bit: "0"
243194-243221 uart: tx-data-bit: "0"
243220-243247 uart: tx-data-bit: "1"
243246-243273 uart: tx-data-bit: "1"
243272-243299 uart: tx-data-bit: "0"
243298-243325 uart: tx-data-bit: "1"
243324-243351 uart: tx-data-bit: "1"
243116-243351 uart: tx-data: "434"
243350-243377 uart: tx-stop: "Stop bit" "Stop" "T"
243635-243662 uart: tx-start: "Start bit" "Start" "S"
243661-243688 uart: tx-data-bit: "1"
243687-243714 uart: tx-data-bit: "1"
243713-243740 uart: tx-data-bit: "0"
243739-243766 uart: tx-data-bit: "0"
243765-243792 uart: tx-data-bit: "1"
243791-243818 uart: tx-data-bit: "1"
243817-243844 uart: tx-data-bit: "0"
243843-243870 uart: tx-data-bit: "1"
243869-243896 uart: tx-data-bit: "1"
243661-243896 uart: tx-data: "435"
235484-243896 uart: tx-packet: "420 421 422 423 424 425 426 427 428 429 430 431 432 433 434 435"
243895-243922 uart: tx-stop: "Stop bit" "Stop" "T"
244179-244206 uart: tx-start: "Start bit" "Start" "S"
244205-244232 uart: tx-data-bit: "0"
244231-244258 uart: tx-data-bit: "0"
244257-244284 uart: tx-data-bit: "1"
244283-244310 uart: tx-data-bit: "0"
244309-244336 uart: tx-data-bit: "1"
244335-244362 uart: tx-data-bit: "1"
244361-244388 uart: tx-data-bit: "0"
244387-244414 uart: tx-data-bit: "1"
244413-244440 uart: tx-data-bit: "1"
244205-244440 uart: tx-data: "436"
244439-244466 uart: tx-stop: "Stop bit" "Stop" "T"
244724-244751 uart: tx-start: "Start bit" "Start" "S"
244750-244777 uart: tx-data-bit: "1"
244776-244803 uart: tx-data-bit: "0"
244802-244829 uart: tx-data-bit: "1"
244828-244855 uart: tx-data-bit: "0"
244854-244881 uart: tx-data-bit: "1"
244880-244907 uart: tx-data-bit: "1"
244906-244933 uart: tx-data-bit: "0"
244932-244959 uart: tx-data-bit: "1"
244958-244985 uart: tx-data-bit: "1"
244750-244985 uart: tx-data: "437"
244984-245011 uart: tx-stop: "Stop bit" "Stop" "T"
245270-245297 uart: tx-start: "Start bit" "Start" "S"
245296-245323 uart: tx-data-bit: "0"
245322-245349 uart: tx-data-bit: "1"
245348-245375 uart: tx-data-bit: "1"
245374-245401 uart: tx-data-bit: "0"
245400-245427 uart: tx-data-bit: "1"
245426-245453 uart: tx-data-bit: "1"
245452-245479 uart: tx-data-bit: "0"
245478-245505 uart: tx-data-bit: "1"
245504-245531 uart: tx-data-bit: "1"
245296-245531 uart: tx-data: "438"
245530-245557 uart: tx-stop: "Stop bit" "Stop" "T"
245815-245842 uart: tx-start: "Start bit" "Start" "S"
245841-245868 uart: tx-data-bit: "1"
245867-245894 uart: tx-data-bit: "1"
245893-245920 uart: tx-data-bit: "1"
245919-245946 uart: tx-data-bit: "0"
245945-245972 uart: tx-data-bit: "1"
245971-245998 uart: tx-data-bit: "1"
245997-246024 uart: tx-data-bit: "0"
246023-246050 uart: tx-data-bit: "1"
246049-246076 uart: tx-data-bit: "1"
245841-246076 uart: tx-data: "439"
246075-246102 uart: tx-stop: "Stop bit" "Stop" "T"
246360-246387 uart: tx-start: "Start bit" "Start" "S"
246386-246413 uart: tx-data-bit: "0"
246412-246439 uart: tx-data-bit: "0"
246438-246465 uart: tx-data-bit: "0"
246464-246491 uart: tx-data-bit: "1"
246490-246517 uart: tx-data-bit: "1"
246516-246543 uart: tx-data-bit: "1"
246542-246569 uart: tx-data-bit: "0"
246568-246595 uart: tx-data-bit: "1"
246594-246621 uart: tx-data-bit: "1"
246386-246621 uart: tx-data: "440"
246620-246647 uart: tx-stop: "Stop bit" "Stop" "T"
246902-246929 uart: tx-start: "Start bit" "Start" "S"
246928-246955 uart: tx-data-bit: "1"
246954-246981 uart: tx-data-bit: "0"
246980-247007 uart: tx-data-bit: "0"
247006-247033 uart: tx-data-bit: "1"
247032-247059 uart: tx-data-bit: "1"
247058-247085 uart: tx-data-bit: "1"
247084-247111 uart: tx-data-bit: "0"
247110-247137 uart: tx-data-bit: "1"
247136-247163 uart: tx-data-bit: "1"
246928-247163 uart: tx-data: "441"
247162-247189 uart: tx-stop: "Stop bit" "Stop" "T"
247447-247474 uart: tx-start: "Start bit" "Start" "S"
247473-247500 uart: tx-data-bit: "0"
247499-247526 uart: tx-data-bit: "1"
247525-247552 uart: tx-data-bit: "0"
247551-247578 uart: tx-data-bit: "1"
247577-247604 uart: tx-data-bit: "1"
247603-247630 uart: tx-data-bit: "1"
247629-247656 uart: tx-data-bit: "0"
247655-247682 uart: tx-data-bit: "1"
247681-247708 uart: tx-data-bit: "1"
247473-247708 uart: tx-data: "442"
247707-247734 uart: tx-stop: "Stop bit" "Stop" "T"
247991-248018 uart: tx-start: "Start bit" "Start" "S"
248017-248044 uart: tx-data-bit: "1"
248043-248070 uart: tx-data-bit: "1"
248069-248096 uart: tx-data-bit: "0"
248095-248122 uart: tx-data-bit: "1"
248121-248148 uart: tx-data-bit: "1"
248147-248174 uart: tx-data-bit: "1"
248173-248200 uart: tx-data-bit: "0"
248199-248226 uart: tx-data-bit: "1"
248225-248252 uart: tx-data-bit: "1"
248017-248252 uart: tx-data: "443"
248251-248278 uart: tx-stop: "Stop bit" "Stop" "T"
248536-248563 uart: tx-start: "Start bit" "Start" "S"
248562-248589 uart: tx-data-bit: "0"
248588-248615 uart: tx-data-bit: "0"
248614-248641 uart: tx-data-bit: "1"
248640-248667 uart: tx-data-bit: "1"
248666-248693 uart: tx-data-bit: "1"
248692-248719 uart: tx-data-bit: "1"
248718-248745 uart: tx-data-bit: "0"
248744-248771 uart: tx-data-bit: "1"
248770-248797 uart: tx-data-bit: "1"
248562-248797 uart: tx-data: "444"
248796-248823 uart: tx-stop: "Stop bit" "Stop" "T"
249078-249105 uart: tx-start: "Start bit" "Start" "S"
249104-249131 uart: tx-data-bit: "1"
249130-249157 uart: tx-data-bit: "0"
249156-249183 uart: tx-data-bit: "1"
249182-249209 uart: tx-data-bit: "1"
249208-249235 uart: tx-data-bit: "1"
249234-249261 uart: tx-data-bit: "1"
249260-249287 uart: tx-data-bit: "0"
249286-249313 uart: tx-data-bit: "1"
249312-249339 uart: tx-data-bit: "1"
249104-249339 uart: tx-data: "445"
249338-249365 uart: tx-stop: "Stop bit" "Stop" "T"
249623-249650 uart: tx-start: "Start bit" "Start" "S"
249649-249676 uart: tx-data-bit: "0"
249675-249702 uart: tx-data-bit: "1"
249701-249728 uart: tx-data-bit: "1"
249727-249754 uart: tx-data-bit: "1"
249753-249780 uart: tx-data-bit: "1"
249779-249806 uart: tx-data-bit: "1"
249805-249832 uart: tx-data-bit: "0"
249831-249858 uart: tx-data-bit: "1"
249857-249884 uart: tx-data-bit: "1"
249649-249884 uart: tx-data: "446"
249883-249910 uart: tx-stop: "Stop bit" "Stop" "T"
250166-250193 uart: tx-start: "Start bit" "Start" "S"
250192-250219 uart: tx-data-bit: "1"
250218-250245 uart: tx-data-bit: "1"
250244-250271 uart: tx-data-bit: "1"
250270-250297 uart: tx-data-bit: "1"
250296-250323 uart: tx-data-bit: "1"
250322-250349 uart: tx-data-bit: "1"
250348-250375 uart: tx-data-bit: "0"
250374-250401 uart: tx-data-bit: "1"
250400-250427 uart: tx-data-bit: "1"
250192-250427 uart: tx-data: "447"
250426-250453 uart: tx-stop: "Stop bit" "Stop" "T"
250708-250735 uart: tx-start: "Start bit" "Start" "S"
250734-250761 uart: tx-data-bit: "0"
250760-250787 uart: tx-data-bit: "0"
250786-250813 uart: tx-data-bit: "0"
250812-250839 uart: tx-data-bit: "0"
250838-250865 uart: tx-data-bit: "0"
250864-250891 uart: tx-data-bit: "0"
250890-250917 uart: tx-data-bit: "1"
250916-250943 uart: tx-data-bit: "1"
250942-250969 uart: tx-data-bit: "1"
250734-250969 uart: tx-data: "448"
250968-250995 uart: tx-stop: "Stop bit" "Stop" "T"
251249-251276 uart: tx-start: "Start bit" "Start" "S"
251275-251302 uart: tx-data-bit: "1"
251301-251328 uart: tx-data-bit: "0"
251327-251354 uart: tx-data-bit: "0"
251353-251380 uart: tx-data-bit: "0"
251379-251406 uart: tx-data-bit: "0"
251405-251432 uart: tx-data-bit: "0"
251431-251458 uart: tx-data-bit: "1"
251457-251484 uart: tx-data-bit: "1"
251483-251510 uart: tx-data-bit: "1"
251275-251510 uart: tx-data: "449"
251509-251536 uart: tx-stop: "Stop bit" "Stop" "T"
251791-251818 uart: tx-start: "Start bit" "Start" "S"
251817-251844 uart: tx-data-bit: "0"
251843-251870 uart: tx-data-bit: "1"
251869-251896 uart: tx-data-bit: "0"
251895-251922 uart: tx-data-bit: "0"
251921-251948 uart: tx-data-bit: "0"
251947-251974 uart: tx-data-bit: "0"
251973-252000 uart: tx-data-bit: "1"
251999-252026 uart: tx-data-bit: "1"
252025-252052 uart: tx-data-bit: "1"
251817-252052 uart: tx-data: "450"
252051-252078 uart: tx-stop: "Stop bit" "Stop" "T"
252334-252361 uart: tx-start: "Start bit" "Start" "S"
252360-252387 uart: tx-data-bit: "1"
252386-252413 uart: tx-data-bit: "1"
252412-252439 uart: tx-data-bit: "0"
252438-252465 uart: tx-data-bit: "0"
252464-252491 uart: tx-data-bit: "0"
252490-252517 uart: tx-data-bit: "0"
252516-252543 uart: tx-data-bit: "1"
252542-252569 uart: tx-data-bit: "1"
252568-252595 uart: tx-data-bit: "1"
252360-252595 uart: tx-data: "451"
244205-252595 uart: tx-packet: "436 437 438 439 440 441 442 443 444 445 446 447 448 449 450 451"
252594-252621 uart: tx-stop: "Stop bit" "Stop" "T"
252876-252903 uart: tx-start: "Start bit" "Start" "S"
252902-252929 uart: tx-data-bit: "0"
252928-252955 uart: tx-data-bit: "0"
252954-252981 uart: tx-data-bit: "1"
252980-253007 uart: tx-data-bit: "0"
253006-253033 uart: tx-data-bit: "0"
253032-253059 uart: tx-data-bit: "0"
253058-253085 uart: tx-data-bit: "1"
253084-253111 uart: tx-data-bit: "1"
253110-253137 uart: tx-data-bit: "1"
252902-253137 uart: tx-data: "452"
253136-253163 uart: tx-stop: "Stop bit" "Stop" "T"
253419-253446 uart: tx-start: "Start bit" "Start" "S"
253445-253472 uart: tx-data-bit: "1"
253471-253498 uart: tx-data-bit: "0"
253497-253524 uart: tx-data-bit: "1"
253523-253550 uart: tx-data-bit: "0"
253549-253576 uart: tx-data-bit: "0"
253575-253602 uart: tx-data-bit: "0"
253601-253628 uart: tx-data-bit: "1"
253627-253654 uart: tx-data-bit: "1"
253653-253680 uart: tx-data-bit: "1"
253445-253680 uart: tx-data: "453"
253679-253706 uart: tx-stop: "Stop bit" "Stop" "T"
253964-253991 uart: tx-start: "Start bit" "Start" "S"
253990-254017 uart: tx-data-bit: "0"
254016-254043 uart: tx-data-bit: "1"
254042-254069 uart: tx-data-bit: "1"
254068-254095 uart: tx-data-bit: "0"
254094-254121 uart: tx-data-bit: "0"
254120-254147 uart: tx-data-bit: "0"
254146-254173 uart: tx-data-bit: "1"
254172-254199 uart: tx-data-bit: "1"
254198-254225 uart: tx-data-bit: "1"
253990-254225 uart: tx-data: "454"
254224-254251 uart: tx-stop: "Stop bit" "Stop" "T"
254506-254533 uart: tx-start: "Start bit" "Start" "S"
254532-254559 uart: tx-data-bit: "1"
254558-254585 uart: tx-data-bit: "1"
254584-254611 uart: tx-data-bit: "1"
254610-254637 uart: tx-data-bit: "0"
254636-254663 uart: tx-data-bit: "0"
254662-254689 uart: tx-data-bit: "0"
254688-254715 uart: tx-data-bit: "1"
254714-254741 uart: tx-data-bit: "1"
254740-254767 uart: tx-data-bit: "1"
254532-254767 uart: tx-data: "455"
254766-254793 uart: tx-stop: "Stop bit" "Stop" "T"
255049-255076 uart: tx-start: "Start bit" "Start" "S"
255075-255102 uart: tx-data-bit: "0"
255101-255128 uart: tx-data-bit: "0"
255127-255154 uart: tx-data-bit: "0"
255153-255180 uart: tx-data-bit: "1"
255179-255206 uart: tx-data-bit: "0"
255205-255232 uart: tx-data-bit: "0"
255231-255258 uart: tx-data-bit: "1"
255257-255284 uart: tx-data-bit: "1"
255283-255310 uart: tx-data-bit: "1"
255075-255310 uart: tx-data: "456"
255309-255336 uart: tx-stop: "Stop bit" "Stop" "T"
255591-255618 uart: tx-start: "Start bit" "Start" "S"
255617-255644 uart: tx-data-bit: "1"
255643-255670 uart: tx-data-bit: "0"
255669-255696 uart: tx-data-bit: "0"
255695-255722 uart: tx-data-bit: "1"
255721-255748 uart: tx-data-bit: "0"
255747-255774 uart: tx-data-bit: "0"
255773-255800 uart: tx-data-bit: "1"
255799-255826 uart: tx-data-bit: "1"
255825-255852 uart: tx-data-bit: "1"
255617-255852 uart: tx-data: "457"
255851-255878 uart: tx-stop: "Stop bit" "Stop" "T"
256136-256163 uart: tx-start: "Start bit" "Start" "S"
256162-256189 uart: tx-data-bit: "0"
256188-256215 uart: tx-data-bit: "1"
256214-256241 uart: tx-data-bit: "0"
256240-256267 uart: tx-data-bit: "1"
256266-256293 uart: tx-data-bit: "0"
256292-256319 uart: tx-data-bit: "0"
256318-256345 uart: tx-data-bit: "1"
256344-256371 uart: tx-data-bit: "1"
256370-256397 uart: tx-data-bit: "1"
256162-256397 uart: tx-data: "458"
256396-256423 uart: tx-stop: "Stop bit" "Stop" "T"
256680-256707 uart: tx-start: "Start bit" "Start" "S"
256706-256733 uart: tx-data-bit: "1"
256732-256759 uart: tx-data-bit: "1"
256758-256785 uart: tx-data-bit: "0"
256784-256811 uart: tx-data-bit: "1"
256810-256837 uart: tx-data-bit: "0"
256836-256863 uart: tx-data-bit: "0"
256862-256889 uart: tx-data-bit: "1"
256888-256915 uart: tx-data-bit: "1"
256914-256941 uart: tx-data-bit: "1"
256706-256941 uart: tx-data: "459"
256940-256967 uart: tx-stop: "Stop bit" "Stop" "T"
257225-257252 uart: tx-start: "Start bit" "Start" "S"
257251-257278 uart: tx-data-bit: "0"
257277-257304 uart: tx-data-bit: "0"
257303-257330 uart: tx-data-bit: "1"
257329-257356 uart: tx-data-bit: "1"
257355-257382 uart: tx-data-bit: "0"
257381-257408 uart: tx-data-bit: "0"
257407-257434 uart: tx-data-bit: "1"
257433-257460 uart: tx-data-bit: "1"
257459-257486 uart: tx-data-bit: "1"
257251-257486 uart: tx-data: "460"
257485-257512 uart: tx-stop: "Stop bit" "Stop" "T"
257768-257795 uart: tx-start: "Start bit" "Start" "S"
257794-257821 uart: tx-data-bit: "1"
257820-257847 uart: tx-data-bit: "0"
257846-257873 uart: tx-data-bit: "1"
257872-257899 uart: tx-data-bit: "1"
257898-257925 uart: tx-data-bit: "0"
257924-257951 uart: tx-data-bit: "0"
257950-257977 uart: tx-data-bit: "1"
257976-258003 uart: tx-data-bit: "1"
258002-258029 uart: tx-data-bit: "1"
257794-258029 uart: tx-data: "461"
258028-258055 uart: tx-stop: "Stop bit" "Stop" "T"
258312-258339 uart: tx-start: "Start bit" "Start" "S"
258338-258365 uart: tx-data-bit: "0"
258364-258391 uart: tx-data-bit: "1"
258390-258417 uart: tx-data-bit: "1"
258416-258443 uart: tx-data-bit: "1"
258442-258469 uart: tx-data-bit: "0"
258468-258495 uart: tx-data-bit: "0"
258494-258521 uart: tx-data-bit: "1"
258520-258547 uart: tx-data-bit: "1"
258546-258573 uart: tx-data-bit: "1"
258338-258573 uart: tx-data: "462"
258572-258599 uart: tx-stop: "Stop bit" "Stop" "T"
258855-258882 uart: tx-start: "Start bit" "Start" "S"
258881-258908 uart: tx-data-bit: "1"
258907-258934 uart: tx-data-bit: "1"
258933-258960 uart: tx-data-bit: "1"
258959-258986 uart: tx-data-bit: "1"
258985-259012 uart: tx-data-bit: "0"
259011-259038 uart: tx-data-bit: "0"
259037-259064 uart: tx-data-bit: "1"
259063-259090 uart: tx-data-bit: "1"
259089-259116 uart: tx-data-bit: "1"
258881-259116 uart: tx-data: "463"
259115-259142 uart: tx-stop: "Stop bit" "Stop" "T"
259397-259424 uart: tx-start: "Start bit" "Start" "S"
259423-259450 uart: tx-data-bit: "0"
259449-259476 uart: tx-data-bit: "0"
259475-259502 uart: tx-data-bit: "0"
259501-259528 uart: tx-data-bit: "0"
259527-259554 uart: tx-data-bit: "1"
259553-259580 uart: tx-data-bit: "0"
259579-259606 uart: tx-data-bit: "1"
259605-259632 uart: tx-data-bit: "1"
259631-259658 uart: tx-data-bit: "1"
259423-259658 uart: tx-data: "464"
259657-259684 uart: tx-stop: "Stop bit" "Stop" "T"
259940-259967 uart: tx-start: "Start bit" "Start" "S"
259966-259993 uart: tx-data-bit: "1"
259992-260019 uart: tx-data-bit: "0"
260018-260045 uart: tx-data-bit: "0"
260044-260071 uart: tx-data-bit: "0"
260070-260097 uart: tx-data-bit: "1"
260096-260123 uart: tx-data-bit: "0"
260122-260149 uart: tx-data-bit: "1"
260148-260175 uart: tx-data-bit: "1"
260174-260201 uart: tx-data-bit: "1"
259966-260201 uart: tx-data: "465"
260200-260227 uart: tx-stop: "Stop bit" "Stop" "T"
260484-260511 uart: tx-start: "Start bit" "Start" "S"
260510-260537 uart: tx-data-bit: "0"
260536-260563 uart: tx-data-bit: "1"
260562-260589 uart: tx-data-bit: "0"
260588-260615 uart: tx-data-bit: "0"
260614-260641 uart: tx-data-bit: "1"
260640-260667 uart: tx-data-bit: "0"
260666-260693 uart: tx-data-bit: "1"
260692-260719 uart: tx-data-bit: "1"
260718-260745 uart: tx-data-bit: "1"
260510-260745 uart: tx-data: "466"
260744-260771 uart: tx-stop: "Stop bit" "Stop" "T"
261029-261056 uart: tx-start: "Start bit" "Start" "S"
261055-261082 uart: tx-data-bit: "1"
261081-261108 uart: tx-data-bit: "1"
261107-261134 uart: tx-data-bit: "0"
261133-261160 uart: tx-data-bit: "0"
261159-261186 uart: tx-data-bit: "1"
261185-261212 uart: tx-data-bit: "0"
261211-261238 uart: tx-data-bit: "1"
261237-261264 uart: tx-data-bit: "1"
261263-261290 uart: tx-data-bit: "1"
261055-261290 uart: tx-data: "467"
252902-261290 uart: tx-packet: "452 453 454 455 456 457 458 459 460 461 462 463 464 465 466 467"
261289-261316 uart: tx-stop: "Stop bit" "Stop" "T"
261574-261601 uart: tx-start: "Start bit" "Start" "S"
261600-261627 uart: tx-data-bit: "0"
261626-261653 uart: tx-data-bit: "0"
261652-261679 uart: tx-data-bit: "1"
261678-261705 uart: tx-data-bit: "0"
261704-261731 uart: tx-data-bit: "1"
261730-261757 uart: tx-data-bit: "0"
261756-261783 uart: tx-data-bit: "1"
261782-261809 uart: tx-data-bit: "1"
261808-261835 uart: tx-data-bit: "1"
261600-261835 uart: tx-data: "468"
261834-261861 uart: tx-stop: "Stop bit" "Stop" "T"
262118-262145 uart: tx-start: "Start bit" "Start" "S"
262144-262171 uart: tx-data-bit: "1"
262170-262197 uart: tx-data-bit: "0"
262196-262223 uart: tx-data-bit: "1"
262222-262249 uart: tx-data-bit: "0"
262248-262275 uart: tx-data-bit: "1"
262274-262301 uart: tx-data-bit: "0"
262300-262327 uart: tx-data-bit: "1"
262326-262353 uart: tx-data-bit: "1"
262352-262379 uart: tx-data-bit: "1"
262144-262379 uart: tx-data: "469"
262378-262405 uart: tx-stop: "Stop bit" "Stop" "T"
262665-262692 uart: tx-start: "Start bit" "Start" "S"
262691-262718 uart: tx-data-bit: "0"
262717-262744 uart: tx-data-bit: "1"
262743-262770 uart: tx-data-bit: "1"
262769-262796 uart: tx-data-bit: "0"
262795-262822 uart: tx-data-bit: "1"
262821-262848 uart: tx-data-bit: "0"
262847-262874 uart: tx-data-bit: "1"
262873-262900 uart: tx-data-bit: "1"
262899-262926 uart: tx-data-bit: "1"
262691-262926 uart: tx-data: "470"
262925-262952 uart: tx-stop: "Stop bit" "Stop" "T"
263209-263236 uart: tx-start: "Start bit" "Start" "S"
263235-263262 uart: tx-data-bit: "1"
263261-263288 uart: tx-data-bit: "1"
263287-263314 uart: tx-data-bit: "1"
263313-263340 uart: tx-data-bit: "0"
263339-263366 uart: tx-data-bit: "1"
263365-263392 uart: tx-data-bit: "0"
263391-263418 uart: tx-data-bit: "1"
263417-263444 uart: tx-data-bit: "1"
263443-263470 uart: tx-data-bit: "1"
263235-263470 uart: tx-data: "471"
263469-263496 uart: tx-stop: "Stop bit" "Stop" "T"
263754-263781 uart: tx-start: "Start bit" "Start" "S"
263780-263807 uart: tx-data-bit: "0"
263806-263833 uart: tx-data-bit: "0"
263832-263859 uart: tx-data-bit: "0"
263858-263885 uart: tx-data-bit: "1"
263884-263911 uart: tx-data-bit: "1"
263910-263937 uart: tx-data-bit: "0"
263936-263963 uart: tx-data-bit: "1"
263962-263989 uart: tx-data-bit: "1"
263988-264015 uart: tx-data-bit: "1"
263780-264015 uart: tx-data: "472"
264014-264041 uart: tx-stop: "Stop bit" "Stop" "T"
264296-264323 uart: tx-start: "Start bit" "Start" "S"
264322-264349 uart: tx-data-bit: "1"
264348-264375 uart: tx-data-bit: "0"
264374-264401 uart: tx-data-bit: "0"
264400-264427 uart: tx-data-bit: "1"
264426-264453 uart: tx-data-bit: "1"
264452-264479 uart: tx-data-bit: "0"
264478-264505 uart: tx-data-bit: "1"
264504-264531 uart: tx-data-bit: "1"
264530-264557 uart: tx-data-bit: "1"
264322-264557 uart: tx-data: "473"
264556-264583 uart: tx-stop: "Stop bit" "Stop" "T"
264841-264868 uart: tx-start: "Start bit" "Start" "S"
264867-264894 uart: tx-data-bit: "0"
264893-264920 uart: tx-data-bit: "1"
264919-264946 uart: tx-data-bit: "0"
264945-264972 uart: tx-data-bit: "1"
264971-264998 uart: tx-data-bit: "1"
264997-265024 uart: tx-data-bit: "0"
265023-265050 uart: tx-data-bit: "1"
265049-265076 uart: tx-data-bit: "1"
265075-265102 uart: tx-data-bit: "1"
264867-265102 uart: tx-data: "474"
265101-265128 uart: tx-stop: "Stop bit" "Stop" "T"
265386-265413 uart: tx-start: "Start bit" "Start" "S"
265412-265439 uart: tx-data-bit: "1"
265438-265465 uart: tx-data-bit: "1"
265464-265491 uart: tx-data-bit: "0"
265490-265517 uart: tx-data-bit: "1"
265516-265543 uart: tx-data-bit: "1"
265542-265569 uart: tx-data-bit: "0"
265568-265595 uart: tx-data-bit: "1"
265594-265621 uart: tx-data-bit: "1"
265620-265647 uart: tx-data-bit: "1"
265412-265647 uart: tx-data: "475"
265646-265673 uart: tx-stop: "Stop bit" "Stop" "T"
265930-265957 uart: tx-start: "Start bit" "Start" "S"
265956-265983 uart: tx-data-bit: "0"
265982-266009 uart: tx-data-bit: "0"
266008-266035 uart: tx-data-bit: "1"
266034-266061 uart: tx-data-bit: "1"
266060-266087 uart: tx-data-bit: "1"
266086-266113 uart: tx-data-bit: "0"
266112-266139 uart: tx-data-bit: "1"
266138-266165 uart: tx-data-bit: "1"
266164-266191 uart: tx-data-bit: "1"
265956-266191 uart: tx-data: "476"
266190-266217 uart: tx-stop: "Stop bit" "Stop" "T"
266473-266500 uart: tx-start: "Start bit" "Start" "S"
266499-266526 uart: tx-data-bit: "1"
266525-266552 uart: tx-data-bit: "0"
266551-266578 uart: tx-data-bit: "1"
266577-266604 uart: tx-data-bit: "1"
266603-266630 uart: tx-data-bit: "1"
266629-266656 uart: tx-data-bit: "0"
266655-266682 uart: tx-data-bit: "1"
266681-266708 uart: tx-data-bit: "1"
266707-266734 uart: tx-data-bit: "1"
266499-266734 uart: tx-data: "477"
266733-266760 uart: tx-stop: "Stop bit" "Stop" "T"
267017-267044 uart: tx-start: "Start bit" "Start" "S"
267043-267070 uart: tx-data-bit: "0"
267069-267096 uart: tx-data-bit: "1"
267095-267122 uart: tx-data-bit: "1"
267121-267148 uart: tx-data-bit: "1"
267147-267174 uart: tx-data-bit: "1"
267173-267200 uart: tx-data-bit: "0"
267199-267226 uart: tx-data-bit: "1"
267225-267252 uart: tx-data-bit: "1"
267251-267278 uart: tx-data-bit: "1"
267043-267278 uart: tx-data: "478"
267277-267304 uart: tx-stop: "Stop bit" "Stop" "T"
267560-267587 uart: tx-start: "Start bit" "Start" "S"
267586-267613 uart: tx-data-bit: "1"
267612-267639 uart: tx-data-bit: "1"
267638-267665 uart: tx-data-bit: "1"
267664-267691 uart: tx-data-bit: "1"
267690-267717 uart: tx-data-bit: "1"
267716-267743 uart: tx-data-bit: "0"
267742-267769 uart: tx-data-bit: "1"
267768-267795 uart: tx-data-bit: "1"
267794-267821 uart: tx-data-bit: "1"
267586-267821 uart: tx-data: "479"
267820-267847 uart: tx-stop: "Stop bit" "Stop" "T"
268102-268129 uart: tx-start: "Start bit" "Start" "S"
268128-268155 uart: tx-data-bit: "0"
268154-268181 uart: tx-data-bit: "0"
268180-268207 uart: tx-data-bit: "0"
268206-268233 uart: tx-data-bit: "0"
268232-268259 uart: tx-data-bit: "0"
268258-268285 uart: tx-data-bit: "1"
268284-268311 uart: tx-data-bit: "1"
268310-268337 uart: tx-data-bit: "1"
268336-268363 uart: tx-data-bit: "1"
268128-268363 uart: tx-data: "480"
268362-268389 uart: tx-stop: "Stop bit" "Stop" "T"
268644-268671 uart: tx-start: "Start bit" "Start" "S"
268670-268697 uart: tx-data-bit: "1"
268696-268723 uart: tx-data-bit: "0"
268722-268749 uart: tx-data-bit: "0"
268748-268775 uart: tx-data-bit: "0"
268774-268801 uart: tx-data-bit: "0"
268800-268827 uart: tx-data-bit: "1"
268826-268853 uart: tx-data-bit: "1"
268852-268879 uart: tx-data-bit: "1"
268878-268905 uart: tx-data-bit: "1"
268670-268905 uart: tx-data: "481"
268904-268931 uart: tx-stop: "Stop bit" "Stop" "T"
269187-269214 uart: tx-start: "Start bit" "Start" "S"
269213-269240 uart: tx-data-bit: "0"
269239-269266 uart: tx-data-bit: "1"
269265-269292 uart: tx-data-bit: "0"
269291-269318 uart: tx-data-bit: "0"
269317-269344 uart: tx-data-bit: "0"
269343-269370 uart: tx-data-bit: "1"
269369-269396 uart: tx-data-bit: "1"
269395-269422 uart: tx-data-bit: "1"
269421-269448 uart: tx-data-bit: "1"
269213-269448 uart: tx-data: "482"
269447-269474 uart: tx-stop: "Stop bit" "Stop" "T"
269729-269756 uart: tx-start: "Start bit" "Start" "S"
269755-269782 uart: tx-data-bit: "1"
269781-269808 uart: tx-data-bit: "1"
269807-269834 uart: tx-data-bit: "0"
269833-269860 uart: tx-data-bit: "0"
269859-269886 uart: tx-data-bit: "0"
269885-269912 uart: tx-data-bit: "1"
269911-269938 uart: tx-data-bit: "1"
269937-269964 uart: tx-data-bit: "1"
269963-269990 uart: tx-data-bit: "1"
269755-269990 uart: tx-data: "483"
261600-269990 uart: tx-packet: "468 469 470 471 472 473 474 475 476 477 478 479 480 481 482 483"
269989-270016 uart: tx-stop: "Stop bit" "Stop" "T"
270272-270299 uart: tx-start: "Start bit" "Start" "S"
270298-270325 uart: tx-data-bit: "0"
270324-270351 uart: tx-data-bit: "0"
270350-270377 uart: tx-data-bit: "1"
270376-270403 uart: tx-data-bit: "0"
270402-270429 uart: tx-data-bit: "0"
270428-270455 uart: tx-data-bit: "1"
270454-270481 uart: tx-data-bit: "1"
270480-270507 uart: tx-data-bit: "1"
270506-270533 uart: tx-data-bit: "1"
270298-270533 uart: tx-data: "484"
270532-270559 uart: tx-stop: "Stop bit" "Stop" "T"
270814-270841 uart: tx-start: "Start bit" "Start" "S"
270840-270867 uart: tx-data-bit: "1"
270866-270893 uart: tx-data-bit: "0"
270892-270919 uart: tx-data-bit: "1"
270918-270945 uart: tx-data-bit: "0"
270944-270971 uart: tx-data-bit: "0"
270970-270997 uart: tx-data-bit: "1"
270996-271023 uart: tx-data-bit: "1"
271022-271049 uart: tx-data-bit: "1"
271048-271075 uart: tx-data-bit: "1"
270840-271075 uart: tx-data: "485"
271074-271101 uart: tx-stop: "Stop bit" "Stop" "T"
271359-271386 uart: tx-start: "Start bit" "Start" "S"
271385-271412 uart: tx-data-bit: "0"
271411-271438 uart: tx-data-bit: "1"
271437-271464 uart: tx-data-bit: "1"
271463-271490 uart: tx-data-bit: "0"
271489-271516 uart: tx-data-bit: "0"
271515-271542 uart: tx-data-bit: "1"
271541-271568 uart: tx-data-bit: "1"
271567-271594 uart: tx-data-bit: "1"
271593-271620 uart: tx-data-bit: "1"
271385-271620 uart: tx-data: "486"
271619-271646 uart: tx-stop: "Stop bit" "Stop" "T"
271901-271928 uart: tx-start: "Start bit" "Start" "S"
271927-271954 uart: tx-data-bit: "1"
271953-271980 uart: tx-data-bit: "1"
271979-272006 uart: tx-data-bit: "1"
272005-272032 uart: tx-data-bit: "0"
272031-272058 uart: tx-data-bit: "0"
272057-272084 uart: tx-data-bit: "1"
272083-272110 uart: tx-data-bit: "1"
272109-272136 uart: tx-data-bit: "1"
272135-272162 uart: tx-data-bit: "1"
271927-272162 uart: tx-data: "487"
272161-272188 uart: tx-stop: "Stop bit" "Stop" "T"
272444-272471 uart: tx-start: "Start bit" "Start" "S"
272470-272497 uart: tx-data-bit: "0"
272496-272523 uart: tx-data-bit: "0"
272522-272549 uart: tx-data-bit: "0"
272548-272575 uart: tx-data-bit: "1"
272574-272601 uart: tx-data-bit: "0"
272600-272627 uart: tx-data-bit: "1"
272626-272653 uart: tx-data-bit: "1"
272652-272679 uart: tx-data-bit: "1"
272678-272705 uart: tx-data-bit: "1"
272470-272705 uart: tx-data: "488"
272704-272731 uart: tx-stop: "Stop bit" "Stop" "T"
272987-273014 uart: tx-start: "Start bit" "Start" "S"
273013-273040 uart: tx-data-bit: "1"
273039-273066 uart: tx-data-bit: "0"
273065-273092 uart: tx-data-bit: "0"
273091-273118 uart: tx-data-bit: "1"
273117-273144 uart: tx-data-bit: "0"
273143-273170 uart: tx-data-bit: "1"
273169-273196 uart: tx-data-bit: "1"
273195-273222 uart: tx-data-bit: "1"
273221-273248 uart: tx-data-bit: "1"
273013-273248 uart: tx-data: "489"
273247-273274 uart: tx-stop: "Stop bit" "Stop" "T"
273531-273558 uart: tx-start: "Start bit" "Start" "S"
273557-273584 uart: tx-data-bit: "0"
273583-273610 uart: tx-data-bit: "1"
273609-273636 uart: tx-data-bit: "0"
273635-273662 uart: tx-data-bit: "1"
273661-273688 uart: tx-data-bit: "0"
273687-273714 uart: tx-data-bit: "1"
273713-273740 uart: tx-data-bit: "1"
273739-273766 uart: tx-data-bit: "1"
273765-273792 uart: tx-data-bit: "1"
273557-273792 uart: tx-data: "490"
273791-273818 uart: tx-stop: "Stop bit" "Stop" "T"
274076-274103 uart: tx-start: "Start bit" "Start" "S"
274102-274129 uart: tx-data-bit: "1"
274128-274155 uart: tx-data-bit: "1"
274154-274181 uart: tx-data-bit: "0"
274180-274207 uart: tx-data-bit: "1"
274206-274233 uart: tx-data-bit: "0"
274232-274259 uart: tx-data-bit: "1"
274258-274285 uart: tx-data-bit: "1"
274284-274311 uart: tx-data-bit: "1"
274310-274337 uart: tx-data-bit: "1"
274102-274337 uart: tx-data: "491"
274336-274363 uart: tx-stop: "Stop bit" "Stop" "T"
274620-274647 uart: tx-start: "Start bit" "Start" "S"
274646-274673 uart: tx-data-bit: "0"
274672-274699 uart: tx-data-bit: "0"
274698-274725 uart: tx-data-bit: "1"
274724-274751 uart: tx-data-bit: "1"
274750-274777 uart: tx-data-bit: "0"
274776-274803 uart: tx-data-bit: "1"
274802-274829 uart: tx-data-bit: "1"
274828-274855 uart: tx-data-bit: "1"
274854-274881 uart: tx-data-bit: "1"
274646-274881 uart: tx-data: "492"
274880-274907 uart: tx-stop: "Stop bit" "Stop" "T"
275163-275190 uart: tx-start: "Start bit" "Start" "S"
275189-275216 uart: tx-data-bit: "1"
275215-275242 uart: tx-data-bit: "0"
275241-275268 uart: tx-data-bit: "1"
275267-275294 uart: tx-data-bit: "1"
275293-275320 uart: tx-data-bit: "0"
275319-275346 uart: tx-data-bit: "1"
275345-275372 uart: tx-data-bit: "1"
275371-275398 uart: tx-data-bit: "1"
275397-275424 uart: tx-data-bit: "1"
275189-275424 uart: tx-data: "493"
275423-275450 uart: tx-stop: "Stop bit" "Stop" "T"
275707-275734 uart: tx-start: "Start bit" "Start" "S"
275733-275760 uart: tx-data-bit: "0"
275759-275786 uart: tx-data-bit: "1"
275785-275812 uart: tx-data-bit: "1"
275811-275838 uart: tx-data-bit: "1"
275837-275864 uart: tx-data-bit: "0"
275863-275890 uart: tx-data-bit: "1"
275889-275916 uart: tx-data-bit: "1"
275915-275942 uart: tx-data-bit: "1"
275941-275968 uart: tx-data-bit: "1"
275733-275968 uart: tx-data: "494"
275967-275994 uart: tx-stop: "Stop bit" "Stop" "T"
276250-276277 uart: tx-start: "Start bit" "Start" "S"
276276-276303 uart: tx-data-bit: "1"
276302-276329 uart: tx-data-bit: "1"
276328-276355 uart: tx-data-bit: "1"
276354-276381 uart: tx-data-bit: "1"
276380-276407 uart: tx-data-bit: "0"
276406-276433 uart: tx-data-bit: "1"
276432-276459 uart: tx-data-bit: "1"
276458-276485 uart: tx-data-bit: "1"
276484-276511 uart: tx-data-bit: "1"
276276-276511 uart: tx-data: "495"
276510-276537 uart: tx-stop: "Stop bit" "Stop" "T"
276793-276820 uart: tx-start: "Start bit" "Start" "S"
276819-276846 uart: tx-data-bit: "0"
276845-276872 uart: tx-data-bit: "0"
276871-276898 uart: tx-data-bit: "0"
276897-276924 uart: tx-data-bit: "0"
276923-276950 uart: tx-data-bit: "1"
276949-276976 uart: tx-data-bit: "1"
276975-277002 uart: tx-data-bit: "1"
277001-277028 uart: tx-data-bit: "1"
277027-277054 uart: tx-data-bit: "1"
276819-277054 uart: tx-data: "496"
277053-277080 uart: tx-stop: "Stop bit" "Stop" "T"
277333-277360 uart: tx-start: "Start bit" "Start" "S"
277359-277386 uart: tx-data-bit: "1"
277385-277412 uart: tx-data-bit: "0"
277411-277438 uart: tx-data-bit: "0"
277437-277464 uart: tx-data-bit: "0"
277463-277490 uart: tx-data-bit: "1"
277489-277516 uart: tx-data-bit: "1"
277515-277542 uart: tx-data-bit: "1"
277541-277568 uart: tx-data-bit: "1"
277567-277594 uart: tx-data-bit: "1"
277359-277594 uart: tx-data: "497"
277593-277620 uart: tx-stop: "Stop bit" "Stop" "T"
277876-277903 uart: tx-start: "Start bit" "Start" "S"
277902-277929 uart: tx-data-bit: "0"
277928-277955 uart: tx-data-bit: "1"
277954-277981 uart: tx-data-bit: "0"
277980-278007 uart: tx-data-bit: "0"
278006-278033 uart: tx-data-bit: "1"
278032-278059 uart: tx-data-bit: "1"
278058-278085 uart: tx-data-bit: "1"
278084-278111 uart: tx-data-bit: "1"
278110-278137 uart: tx-data-bit: "1"
277902-278137 uart: tx-data: "498"
278136-278163 uart: tx-stop: "Stop bit" "Stop" "T"
278418-278445 uart: tx-start: "Start bit" "Start" "S"
278444-278471 uart: tx-data-bit: "1"
278470-278497 uart: tx-data-bit: "1"
278496-278523 uart: tx-data-bit: "0"
278522-278549 uart: tx-data-bit: "0"
278548-278575 uart: tx-data-bit: "1"
278574-278601 uart: tx-data-bit: "1"
278600-278627 uart: tx-data-bit: "1"
278626-278653 uart: tx-data-bit: "1"
278652-278679 uart: tx-data-bit: "1"
278444-278679 uart: tx-data: "499"
270298-278679 uart: tx-packet: "484 485 486 487 488 489 490 491 492 493 494 495 496 497 498 499"
278678-278705 uart: tx-stop: "Stop bit" "Stop" "T"
278961-278988 uart: tx-start: "Start bit" "Start" "S"
278987-279014 uart: tx-data-bit: "0"
279013-279040 uart: tx-data-bit: "0"
279039-279066 uart: tx-data-bit: "1"
279065-279092 uart: tx-data-bit: "0"
279091-279118 uart: tx-data-bit: "1"
279117-279144 uart: tx-data-bit: "1"
279143-279170 uart: tx-data-bit: "1"
279169-279196 uart: tx-data-bit: "1"
279195-279222 uart: tx-data-bit: "1"
278987-279222 uart: tx-data: "500"
279221-279248 uart: tx-stop: "Stop bit" "Stop" "T"
279503-279530 uart: tx-start: "Start bit" "Start" "S"
279529-279556 uart: tx-data-bit: "1"
279555-279582 uart: tx-data-bit: "0"
279581-279608 uart: tx-data-bit: "1"
279607-279634 uart: tx-data-bit: "0"
279633-279660 uart: tx-data-bit: "1"
279659-279686 uart: tx-data-bit: "1"
279685-279712 uart: tx-data-bit: "1"
279711-279738 uart: tx-data-bit: "1"
279737-279764 uart: tx-data-bit: "1"
279529-279764 uart: tx-data: "501"
279763-279790 uart: tx-stop: "Stop bit" "Stop" "T"
280048-280075 uart: tx-start: "Start bit" "Start" "S"
280074-280101 uart: tx-data-bit: "0"
280100-280127 uart: tx-data-bit: "1"
280126-280153 uart: tx-data-bit: "1"
280152-280179 uart: tx-data-bit: "0"
280178-280205 uart: tx-data-bit: "1"
280204-280231 uart: tx-data-bit: "1"
280230-280257 uart: tx-data-bit: "1"
280256-280283 uart: tx-data-bit: "1"
280282-280309 uart: tx-data-bit: "1"
280074-280309 uart: tx-data: "502"
280308-280335 uart: tx-stop: "Stop bit" "Stop" "T"
280591-280618 uart: tx-start: "Start bit" "Start" "S"
280617-280644 uart: tx-data-bit: "1"
280643-280670 uart: tx-data-bit: "1"
280669-280696 uart: tx-data-bit: "1"
280695-280722 uart: tx-data-bit: "0"
280721-280748 uart: tx-data-bit: "1"
280747-280774 uart: tx-data-bit: "1"
280773-280800 uart: tx-data-bit: "1"
280799-280826 uart: tx-data-bit: "1"
280825-280852 uart: tx-data-bit: "1"
280617-280852 uart: tx-data: "503"
280851-280878 uart: tx-stop: "Stop bit" "Stop" "T"
281133-281160 uart: tx-start: "Start bit" "Start" "S"
281159-281186 uart: tx-data-bit: "0"
281185-281212 uart: tx-data-bit: "0"
281211-281238 uart: tx-data-bit: "0"
281237-281264 uart: tx-data-bit: "1"
281263-281290 uart: tx-data-bit: "1"
281289-281316 uart: tx-data-bit: "1"
281315-281342 uart: tx-data-bit: "1"
281341-281368 uart: tx-data-bit: "1"
281367-281394 uart: tx-data-bit: "1"
281159-281394 uart: tx-data: "504"
281393-281420 uart: tx-stop: "Stop bit" "Stop" "T"
281674-281701 uart: tx-start: "Start bit" "Start" "S"
281700-281727 uart: tx-data-bit: "1"
281726-281753 uart: tx-data-bit: "0"
281752-281779 uart: tx-data-bit: "0"
281778-281805 uart: tx-data-bit: "1"
281804-281831 uart: tx-data-bit: "1"
281830-281857 uart: tx-data-bit: "1"
281856-281883 uart: tx-data-bit: "1"
281882-281909 uart: tx-data-bit: "1"
281908-281935 uart: tx-data-bit: "1"
281700-281935 uart: tx-data: "505"
281934-281961 uart: tx-stop: "Stop bit" "Stop" "T"
282216-282243 uart: tx-start: "Start bit" "Start" "S"
282242-282269 uart: tx-data-bit: "0"
282268-282295 uart: tx-data-bit: "1"
282294-282321 uart: tx-data-bit: "0"
282320-282347 uart: tx-data-bit: "1"
282346-282373 uart: tx-data-bit: "1"
282372-282399 uart: tx-data-bit: "1"
282398-282425 uart: tx-data-bit: "1"
282424-282451 uart: tx-data-bit: "1"
282450-282477 uart: tx-data-bit: "1"
282242-282477 uart: tx-data: "506"
282476-282503 uart: tx-stop: "Stop bit" "Stop" "T"
282759-282786 uart: tx-start: "Start bit" "Start" "S"
282785-282812 uart: tx-data-bit: "1"
282811-282838 uart: tx-data-bit: "1"
282837-282864 uart: tx-data-bit: "0"
282863-282890 uart: tx-data-bit: "1"
282889-282916 uart: tx-data-bit: "1"
282915-282942 uart: tx-data-bit: "1"
282941-282968 uart: tx-data-bit: "1"
282967-282994 uart: tx-data-bit: "1"
282993-283020 uart: tx-data-bit: "1"
282785-283020 uart: tx-data: "507"
283019-283046 uart: tx-stop: "Stop bit" "Stop" "T"
283301-283328 uart: tx-start: "Start bit" "Start" "S"
283327-283354 uart: tx-data-bit: "0"
283353-283380 uart: tx-data-bit: "0"
283379-283406 uart: tx-data-bit: "1"
283405-283432 uart: tx-data-bit: "1"
283431-283458 uart: tx-data-bit: "1"
283457-283484 uart: tx-data-bit: "1"
283483-283510 uart: tx-data-bit: "1"
283509-283536 uart: tx-data-bit: "1"
283535-283562 uart: tx-data-bit: "1"
283327-283562 uart: tx-data: "508"
283561-283588 uart: tx-stop: "Stop bit" "Stop" "T"
283842-283869 uart: tx-start: "Start bit" "Start" "S"
283868-283895 uart: tx-data-bit: "1"
283894-283921 uart: tx-data-bit: "0"
283920-283947 uart: tx-data-bit: "1"
283946-283973 uart: tx-data-bit: "1"
283972-283999 uart: tx-data-bit: "1"
283998-284025 uart: tx-data-bit: "1"
284024-284051 uart: tx-data-bit: "1"
284050-284077 uart: tx-data-bit: "1"
284076-284103 uart: tx-data-bit: "1"
283868-284103 uart: tx-data: "509"
284102-284129 uart: tx-stop: "Stop bit" "Stop" "T"
284385-284412 uart: tx-start: "Start bit" "Start" "S"
284411-284438 uart: tx-data-bit: "0"
284437-284464 uart: tx-data-bit: "1"
284463-284490 uart: tx-data-bit: "1"
284489-284516 uart: tx-data-bit: "1"
284515-284542 uart: tx-data-bit: "1"
284541-284568 uart: tx-data-bit: "1"
284567-284594 uart: tx-data-bit: "1"
284593-284620 uart: tx-data-bit: "1"
284619-284646 uart: tx-data-bit: "1"
284411-284646 uart: tx-data: "510"
284645-284672 uart: tx-stop: "Stop bit" "Stop" "T"
284925-284952 uart: tx-start: "Start bit" "Start" "S"
284951-284978 uart: tx-data-bit: "1"
284977-285004 uart: tx-data-bit: "1"
285003-285030 uart: tx-data-bit: "1"
285029-285056 uart: tx-data-bit: "1"
285055-285082 uart: tx-data-bit: "1"
285081-285108 uart: tx-data-bit: "1"
285107-285134 uart: tx-data-bit: "1"
285133-285160 uart: tx-data-bit: "1"
285159-285186 uart: tx-data-bit: "1"
284951-285186 uart: tx-data: "511"
285185-285212 uart: tx-stop: "Stop bit" "Stop" "T"
285466-285493 uart: tx-start: "Start bit" "Start" "S"
285492-285519 uart: tx-data-bit: "0"
285518-285545 uart: tx-data-bit: "0"
285544-285571 uart: tx-data-bit: "0"
285570-285597 uart: tx-data-bit: "0"
285596-285623 uart: tx-data-bit: "0"
285622-285649 uart: tx-data-bit: "0"
285648-285675 uart: tx-data-bit: "0"
285674-285701 uart: tx-data-bit: "0"
285700-285727 uart: tx-data-bit: "0"
285492-285727 uart: tx-data: "0"
285726-285753 uart: tx-stop: "Stop bit" "Stop" "T"
286006-286033 uart: tx-start: "Start bit" "Start" "S"
286032-286059 uart: tx-data-bit: "1"
286058-286085 uart: tx-data-bit: "0"
286084-286111 uart: tx-data-bit: "0"
286110-286137 uart: tx-data-bit: "0"
286136-286163 uart: tx-data-bit: "0"
286162-286189 uart: tx-data-bit: "0"
286188-286215 uart: tx-data-bit: "0"
286214-286241 uart: tx-data-bit: "0"
286240-286267 uart: tx-data-bit: "0"
286032-286267 uart: tx-data: "1"
286266-286293 uart: tx-stop: "Stop bit" "Stop" "T"
286549-286576 uart: tx-start: "Start bit" "Start" "S"
286575-286602 uart: tx-data-bit: "0"
286601-286628 uart: tx-data-bit: "1"
286627-286654 uart: tx-data-bit: "0"
286653-286680 uart: tx-data-bit: "0"
286679-286706 uart: tx-data-bit: "0"
286705-286732 uart: tx-data-bit: "0"
286731-286758 uart: tx-data-bit: "0"
286757-286784 uart: tx-data-bit: "0"
286783-286810 uart: tx-data-bit: "0"
286575-286810 uart: tx-data: "2"
286809-286836 uart: tx-stop: "Stop bit" "Stop" "T"
287091-287118 uart: tx-start: "Start bit" "Start" "S"
287117-287144 uart: tx-data-bit: "1"
287143-287170 uart: tx-data-bit: "1"
287169-287196 uart: tx-data-bit: "0"
287195-287222 uart: tx-data-bit: "0"
287221-287248 uart: tx-data-bit: "0"
287247-287274 uart: tx-data-bit: "0"
287273-287300 uart: tx-data-bit: "0"
287299-287326 uart: tx-data-bit: "0"
287325-287352 uart: tx-data-bit: "0"
287117-287352 uart: tx-data: "3"
278987-287352 uart: tx-packet: "500 501 502 503 504 505 506 507 508 509 510 511 0 1 2 3"
287351-287378 uart: tx-stop: "Stop bit" "Stop" "T"
287634-287661 uart: tx-start: "Start bit" "Start" "S"
287660-287687 uart: tx-data-bit: "0"
287686-287713 uart: tx-data-bit: "0"
287712-287739 uart: tx-data-bit: "1"
287738-287765 uart: tx-data-bit: "0"
287764-287791 uart: tx-data-bit: "0"
287790-287817 uart: tx-data-bit: "0"
287816-287843 uart: tx-data-bit: "0"
287842-287869 uart: tx-data-bit: "0"
287868-287895 uart: tx-data-bit: "0"
287660-287895 uart: tx-data: "4"
287894-287921 uart: tx-stop: "Stop bit" "Stop" "T"
288177-288204 uart: tx-start: "Start bit" "Start" "S"
288203-288230 uart: tx-data-bit: "1"
288229-288256 uart: tx-data-bit: "0"
288255-288282 uart: tx-data-bit: "1"
288281-288308 uart: tx-data-bit: "0"
288307-288334 uart: tx-data-bit: "0"
288333-288360 uart: tx-data-bit: "0"
288359-288386 uart: tx-data-bit: "0"
288385-288412 uart: tx-data-bit: "0"
288411-288438 uart: tx-data-bit: "0"
288203-288438 uart: tx-data: "5"
288437-288464 uart: tx-stop: "Stop bit" "Stop" "T"
288721-288748 uart: tx-start: "Start bit" "Start" "S"
288747-288774 uart: tx-data-bit: "0"
288773-288800 uart: tx-data-bit: "1"
288799-288826 uart: tx-data-bit: "1"
288825-288852 uart: tx-data-bit: "0"
288851-288878 uart: tx-data-bit: "0"
288877-288904 uart: tx-data-bit: "0"
288903-288930 uart: tx-data-bit: "0"
288929-288956 uart: tx-data-bit: "0"
288955-288982 uart: tx-data-bit: "0"
288747-288982 uart: tx-data: "6"
288981-289008 uart: tx-stop: "Stop bit" "Stop" "T"
289264-289291 uart: tx-start: "Start bit" "Start" "S"
289290-289317 uart: tx-data-bit: "1"
289316-289343 uart: tx-data-bit: "1"
289342-289369 uart: tx-data-bit: "1"
289368-289395 uart: tx-data-bit: "0"
289394-289421 uart: tx-data-bit: "0"
289420-289447 uart: tx-data-bit: "0"
289446-289473 uart: tx-data-bit: "0"
289472-289499 uart: tx-data-bit: "0"
289498-289525 uart: tx-data-bit: "0"
289290-289525 uart: tx-data: "7"
289524-289551 uart: tx-stop: "Stop bit" "Stop" "T"
289806-289833 uart: tx-start: "Start bit" "Start" "S"
289832-289859 uart: tx-data-bit: "0"
289858-289885 uart: tx-data-bit: "0"
289884-289911 uart: tx-data-bit: "0"
289910-289937 uart: tx-data-bit: "1"
289936-289963 uart: tx-data-bit: "0"
289962-289989 uart: tx-data-bit: "0"
289988-290015 uart: tx-data-bit: "0"
290014-290041 uart: tx-data-bit: "0"
290040-290067 uart: tx-data-bit: "0"
289832-290067 uart: tx-data: "8"
290066-290093 uart: tx-stop: "Stop bit" "Stop" "T"
290349-290376 uart: tx-start: "Start bit" "Start" "S"
290375-290402 uart: tx-data-bit: "1"
290401-290428 uart: tx-data-bit: "0"
290427-290454 uart: tx-data-bit: "0"
290453-290480 uart: tx-data-bit: "1"
290479-290506 uart: tx-data-bit: "0"
290505-290532 uart: tx-data-bit: "0"
290531-290558 uart: tx-data-bit: "0"
290557-290584 uart: tx-data-bit: "0"
290583-290610 uart: tx-data-bit: "0"
290375-290610 uart: tx-data: "9"
290609-290636 uart: tx-stop: "Stop bit" "Stop" "T"
290893-290920 uart: tx-start: "Start bit" "Start" "S"
290919-290946 uart: tx-data-bit: "0"
290945-290972 uart: tx-data-bit: "1"
290971-290998 uart: tx-data-bit: "0"
290997-291024 uart: tx-data-bit: "1"
291023-291050 uart: tx-data-bit: "0"
291049-291076 uart: tx-data-bit: "0"
291075-291102 uart: tx-data-bit: "0"
291101-291128 uart: tx-data-bit: "0"
291127-291154 uart: tx-data-bit: "0"
290919-291154 uart: tx-data: "10"
291153-291180 uart: tx-stop: "Stop bit" "Stop" "T"
291438-291465 uart: tx-start: "Start bit" "Start" "S"
291464-291491 uart: tx-data-bit: "1"
291490-291517 uart: tx-data-bit: "1"
291516-291543 uart: tx-data-bit: "0"
291542-291569 uart: tx-data-bit: "1"
291568-291595 uart: tx-data-bit: "0"
291594-291621 uart: tx-data-bit: "0"
291620-291647 uart: tx-data-bit: "0"
291646-291673 uart: tx-data-bit: "0"
291672-291699 uart: tx-data-bit: "0"
291464-291699 uart: tx-data: "11"
291698-291725 uart: tx-stop: "Stop bit" "Stop" "T"
291983-292010 uart: tx-start: "Start bit" "Start" "S"
292009-292036 uart: tx-data-bit: "0"
292035-292062 uart: tx-data-bit: "0"
292061-292088 uart: tx-data-bit: "1"
292087-292114 uart: tx-data-bit: "1"
292113-292140 uart: tx-data-bit: "0"
292139-292166 uart: tx-data-bit: "0"
292165-292192 uart: tx-data-bit: "0"
292191-292218 uart: tx-data-bit: "0"
292217-292244 uart: tx-data-bit: "0"
292009-292244 uart: tx-data: "12"
292243-292270 uart: tx-stop: "Stop bit" "Stop" "T"
292525-292552 uart: tx-start: "Start bit" "Start" "S"
292551-292578 uart: tx-data-bit: "1"
292577-292604 uart: tx-data-bit: "0"
292603-292630 uart: tx-data-bit: "1"
292629-292656 uart: tx-data-bit: "1"
292655-292682 uart: tx-data-bit: "0"
292681-292708 uart: tx-data-bit: "0"
292707-292734 uart: tx-data-bit: "0"
292733-292760 uart: tx-data-bit: "0"
292759-292786 uart: tx-data-bit: "0"
292551-292786 uart: tx-data: "13"
292785-292812 uart: tx-stop: "Stop bit" "Stop" "T"
293070-293097 uart: tx-start: "Start bit" "Start" "S"
293096-293123 uart: tx-data-bit: "0"
293122-293149 uart: tx-data-bit: "1"
293148-293175 uart: tx-data-bit: "1"
293174-293201 uart: tx-data-bit: "1"
293200-293227 uart: tx-data-bit: "0"
293226-293253 uart: tx-data-bit: "0"
293252-293279 uart: tx-data-bit: "0"
293278-293305 uart: tx-data-bit: "0"
293304-293331 uart: tx-data-bit: "0"
293096-293331 uart: tx-data: "14"
293330-293357 uart: tx-stop: "Stop bit" "Stop" "T"
293612-293639 uart: tx-start: "Start bit" "Start" "S"
293638-293665 uart: tx-data-bit: "1"
293664-293691 uart: tx-data-bit: "1"
293690-293717 uart: tx-data-bit: "1"
293716-293743 uart: tx-data-bit: "1"
293742-293769 uart: tx-data-bit: "0"
293768-293795 uart: tx-data-bit: "0"
293794-293821 uart: tx-data-bit: "0"
293820-293847 uart: tx-data-bit: "0"
293846-293873 uart: tx-data-bit: "0"
293638-293873 uart: tx-data: "15"
293872-293899 uart: tx-stop: "Stop bit" "Stop" "T"
294155-294182 uart: tx-start: "Start bit" "Start" "S"
294181-294208 uart: tx-data-bit: "0"
294207-294234 uart: tx-data-bit: "0"
294233-294260 uart: tx-data-bit: "0"
294259-294286 uart: tx-data-bit: "0"
294285-294312 uart: tx-data-bit: "1"
294311-294338 uart: tx-data-bit: "0"
294337-294364 uart: tx-data-bit: "0"
294363-294390 uart: tx-data-bit: "0"
294389-294416 uart: tx-data-bit: "0"
294181-294416 uart: tx-data: "16"
294415-294442 uart: tx-stop: "Stop bit" "Stop" "T"
294697-294724 uart: tx-start: "Start bit" "Start" "S"
294723-294750 uart: tx-data-bit: "1"
294749-294776 uart: tx-data-bit: "0"
294775-294802 uart: tx-data-bit: "0"
294801-294828 uart: tx-data-bit: "0"
294827-294854 uart: tx-data-bit: "1"
294853-294880 uart: tx-data-bit: "0"
294879-294906 uart: tx-data-bit: "0"
294905-294932 uart: tx-data-bit: "0"
294931-294958 uart: tx-data-bit: "0"
294723-294958 uart: tx-data: "17"
294957-294984 uart: tx-stop: "Stop bit" "Stop" "T"
295242-295269 uart: tx-start: "Start bit" "Start" "S"
295268-295295 uart: tx-data-bit: "0"
295294-295321 uart: tx-data-bit: "1"
295320-295347 uart: tx-data-bit: "0"
295346-295373 uart: tx-data-bit: "0"
295372-295399 uart: tx-data-bit: "1"
295398-295425 uart: tx-data-bit: "0"
295424-295451 uart: tx-data-bit: "0"
295450-295477 uart: tx-data-bit: "0"
295476-295503 uart: tx-data-bit: "0"
295268-295503 uart: tx-data: "18"
295502-295529 uart: tx-stop: "Stop bit" "Stop" "T"
295787-295814 uart: tx-start: "Start bit" "Start" "S"
295813-295840 uart: tx-data-bit: "1"
295839-295866 uart: tx-data-bit: "1"
295865-295892 uart: tx-data-bit: "0"
295891-295918 uart: tx-data-bit: "0"
295917-295944 uart: tx-data-bit: "1"
295943-295970 uart: tx-data-bit: "0"
295969-295996 uart: tx-data-bit: "0"
295995-296022 uart: tx-data-bit: "0"
296021-296048 uart: tx-data-bit: "0"
295813-296048 uart: tx-data: "19"
287660-296048 uart: tx-packet: "4 5 6 7 8 9 10 11 12 13 14 15 16 17 18 19"
296047-296074 uart: tx-stop: "Stop bit" "Stop" "T"
296331-296358 uart: tx-start: "Start bit" "Start" "S"
296357-296384 uart: tx-data-bit: "0"
296383-296410 uart: tx-data-bit: "0"
296409-296436 uart: tx-data-bit: "1"
296435-296462 uart: tx-data-bit: "0"
296461-296488 uart: tx-data-bit: "1"
296487-296514 uart: tx-data-bit: "0"
296513-296540 uart: tx-data-bit: "0"
296539-296566 uart: tx-data-bit: "0"
296565-296592 uart: tx-data-bit: "0"
296357-296592 uart: tx-data: "20"
296591-296618 uart: tx-stop: "Stop bit" "Stop" "T"
