117-144 uart: tx-start: "Start bit" "Start" "S"
143-170 uart: tx-data-bits: "1"
169-196 uart: tx-data-bits: "1"
195-222 uart: tx-data-bits: "1"
221-248 uart: tx-data-bits: "1"
247-274 uart: tx-data-bits: "1"
143-274 uart: tx-data: "1F"
273-300 uart: tx-parity-ok: "Stop bit" "Stop" "T"
554-581 uart: tx-start: "Start bit" "Start" "S"
580-607 uart: tx-data-bits: "0"
606-633 uart: tx-data-bits: "0"
632-659 uart: tx-data-bits: "0"
658-685 uart: tx-data-bits: "0"
684-711 uart: tx-data-bits: "0"
580-711 uart: tx-data: "00"
710-737 uart: tx-parity-ok: "Stop bit" "Stop" "T"
990-1017 uart: tx-start: "Start bit" "Start" "S"
1016-1043 uart: tx-data-bits: "1"
1042-1069 uart: tx-data-bits: "0"
1068-1095 uart: tx-data-bits: "0"
1094-1121 uart: tx-data-bits: "0"
1120-1147 uart: tx-data-bits: "0"
1016-1147 uart: tx-data: "01"
1146-1173 uart: tx-parity-ok: "Stop bit" "Stop" "T"
1429-1456 uart: tx-start: "Start bit" "Start" "S"
1455-1482 uart: tx-data-bits: "0"
1481-1508 uart: tx-data-bits: "1"
1507-1534 uart: tx-data-bits: "0"
1533-1560 uart: tx-data-bits: "0"
1559-1586 uart: tx-data-bits: "0"
1455-1586 uart: tx-data: "02"
1585-1612 uart: tx-parity-ok: "Stop bit" "Stop" "T"
1868-1895 uart: tx-start: "Start bit" "Start" "S"
1894-1921 uart: tx-data-bits: "1"
1920-1947 uart: tx-data-bits: "1"
1946-1973 uart: tx-data-bits: "0"
1972-1999 uart: tx-data-bits: "0"
1998-2025 uart: tx-data-bits: "0"
1894-2025 uart: tx-data: "03"
2024-2051 uart: tx-parity-ok: "Stop bit" "Stop" "T"
2306-2333 uart: tx-start: "Start bit" "Start" "S"
2332-2359 uart: tx-data-bits: "0"
2358-2385 uart: tx-data-bits: "0"
2384-2411 uart: tx-data-bits: "1"
2410-2437 uart: tx-data-bits: "0"
2436-2463 uart: tx-data-bits: "0"
2332-2463 uart: tx-data: "04"
2462-2489 uart: tx-parity-ok: "Stop bit" "Stop" "T"
2745-2772 uart: tx-start: "Start bit" "Start" "S"
2771-2798 uart: tx-data-bits: "1"
2797-2824 uart: tx-data-bits: "0"
2823-2850 uart: tx-data-bits: "1"
2849-2876 uart: tx-data-bits: "0"
2875-2902 uart: tx-data-bits: "0"
2771-2902 uart: tx-data: "05"
2901-2928 uart: tx-parity-ok: "Stop bit" "Stop" "T"
3186-3213 uart: tx-start: "Start bit" "Start" "S"
3212-3239 uart: tx-data-bits: "0"
3238-3265 uart: tx-data-bits: "1"
3264-3291 uart: tx-data-bits: "1"
3290-3317 uart: tx-data-bits: "0"
3316-3343 uart: tx-data-bits: "0"
3212-3343 uart: tx-data: "06"
3342-3369 uart: tx-parity-ok: "Stop bit" "Stop" "T"
3624-3651 uart: tx-start: "Start bit" "Start" "S"
3650-3677 uart: tx-data-bits: "1"
3676-3703 uart: tx-data-bits: "1"
3702-3729 uart: tx-data-bits: "1"
3728-3755 uart: tx-data-bits: "0"
3754-3781 uart: tx-data-bits: "0"
3650-3781 uart: tx-data: "07"
3780-3807 uart: tx-parity-ok: "Stop bit" "Stop" "T"
4063-4090 uart: tx-start: "Start bit" "Start" "S"
4089-4116 uart: tx-data-bits: "0"
4115-4142 uart: tx-data-bits: "0"
4141-4168 uart: tx-data-bits: "0"
4167-4194 uart: tx-data-bits: "1"
4193-4220 uart: tx-data-bits: "0"
4089-4220 uart: tx-data: "08"
4219-4246 uart: tx-parity-ok: "Stop bit" "Stop" "T"
4501-4528 uart: tx-start: "Start bit" "Start" "S"
4527-4554 uart: tx-data-bits: "1"
4553-4580 uart: tx-data-bits: "0"
4579-4606 uart: tx-data-bits: "0"
4605-4632 uart: tx-data-bits: "1"
4631-4658 uart: tx-data-bits: "0"
4527-4658 uart: tx-data: "09"
4657-4684 uart: tx-parity-ok: "Stop bit" "Stop" "T"
4942-4969 uart: tx-start: "Start bit" "Start" "S"
4968-4995 uart: tx-data-bits: "0"
4994-5021 uart: tx-data-bits: "1"
5020-5047 uart: tx-data-bits: "0"
5046-5073 uart: tx-data-bits: "1"
5072-5099 uart: tx-data-bits: "0"
4968-5099 uart: tx-data: "0A"
5098-5125 uart: tx-parity-ok: "Stop bit" "Stop" "T"
5383-5410 uart: tx-start: "Start bit" "Start" "S"
5409-5436 uart: tx-data-bits: "1"
5435-5462 uart: tx-data-bits: "1"
5461-5488 uart: tx-data-bits: "0"
5487-5514 uart: tx-data-bits: "1"
5513-5540 uart: tx-data-bits: "0"
5409-5540 uart: tx-data: "0B"
5539-5566 uart: tx-parity-ok: "Stop bit" "Stop" "T"
5823-5850 uart: tx-start: "Start bit" "Start" "S"
5849-5876 uart: tx-data-bits: "0"
5875-5902 uart: tx-data-bits: "0"
5901-5928 uart: tx-data-bits: "1"
5927-5954 uart: tx-data-bits: "1"
5953-5980 uart: tx-data-bits: "0"
5849-5980 uart: tx-data: "0C"
5979-6006 uart: tx-parity-ok: "Stop bit" "Stop" "T"
6262-6289 uart: tx-start: "Start bit" "Start" "S"
6288-6315 uart: tx-data-bits: "1"
6314-6341 uart: tx-data-bits: "0"
6340-6367 uart: tx-data-bits: "1"
6366-6393 uart: tx-data-bits: "1"
6392-6419 uart: tx-data-bits: "0"
6288-6419 uart: tx-data: "0D"
6418-6445 uart: tx-parity-ok: "Stop bit" "Stop" "T"
6703-6730 uart: tx-start: "Start bit" "Start" "S"
6729-6756 uart: tx-data-bits: "0"
6755-6782 uart: tx-data-bits: "1"
6781-6808 uart: tx-data-bits: "1"
6807-6834 uart: tx-data-bits: "1"
6833-6860 uart: tx-data-bits: "0"
6729-6860 uart: tx-data: "0E"
6859-6886 uart: tx-parity-ok: "Stop bit" "Stop" "T"
7141-7168 uart: tx-start: "Start bit" "Start" "S"
7167-7194 uart: tx-data-bits: "1"
7193-7220 uart: tx-data-bits: "1"
7219-7246 uart: tx-data-bits: "1"
7245-7272 uart: tx-data-bits: "1"
7271-7298 uart: tx-data-bits: "0"
7167-7298 uart: tx-data: "0F"
7297-7324 uart: tx-parity-ok: "Stop bit" "Stop" "T"
7580-7607 uart: tx-start: "Start bit" "Start" "S"
7606-7633 uart: tx-data-bits: "0"
7632-7659 uart: tx-data-bits: "0"
7658-7685 uart: tx-data-bits: "0"
7684-7711 uart: tx-data-bits: "0"
7710-7737 uart: tx-data-bits: "1"
7606-7737 uart: tx-data: "10"
7736-7763 uart: tx-parity-ok: "Stop bit" "Stop" "T"
8016-8043 uart: tx-start: "Start bit" "Start" "S"
8042-8069 uart: tx-data-bits: "1"
8068-8095 uart: tx-data-bits: "0"
8094-8121 uart: tx-data-bits: "0"
8120-8147 uart: tx-data-bits: "0"
8146-8173 uart: tx-data-bits: "1"
8042-8173 uart: tx-data: "11"
8172-8199 uart: tx-parity-ok: "Stop bit" "Stop" "T"
8455-8482 uart: tx-start: "Start bit" "Start" "S"
8481-8508 uart: tx-data-bits: "0"
8507-8534 uart: tx-data-bits: "1"
8533-8560 uart: tx-data-bits: "0"
8559-8586 uart: tx-data-bits: "0"
8585-8612 uart: tx-data-bits: "1"
8481-8612 uart: tx-data: "12"
8611-8638 uart: tx-parity-ok: "Stop bit" "Stop" "T"
8894-8921 uart: tx-start: "Start bit" "Start" "S"
8920-8947 uart: tx-data-bits: "1"
8946-8973 uart: tx-data-bits: "1"
8972-8999 uart: tx-data-bits: "0"
8998-9025 uart: tx-data-bits: "0"
9024-9051 uart: tx-data-bits: "1"
8920-9051 uart: tx-data: "13"
9050-9077 uart: tx-parity-ok: "Stop bit" "Stop" "T"
9332-9359 uart: tx-start: "Start bit" "Start" "S"
9358-9385 uart: tx-data-bits: "0"
9384-9411 uart: tx-data-bits: "0"
9410-9437 uart: tx-data-bits: "1"
9436-9463 uart: tx-data-bits: "0"
9462-9489 uart: tx-data-bits: "1"
9358-9489 uart: tx-data: "14"
9488-9515 uart: tx-parity-ok: "Stop bit" "Stop" "T"
9771-9798 uart: tx-start: "Start bit" "Start" "S"
9797-9824 uart: tx-data-bits: "1"
9823-9850 uart: tx-data-bits: "0"
9849-9876 uart: tx-data-bits: "1"
9875-9902 uart: tx-data-bits: "0"
9901-9928 uart: tx-data-bits: "1"
9797-9928 uart: tx-data: "15"
9927-9954 uart: tx-parity-ok: "Stop bit" "Stop" "T"
10212-10239 uart: tx-start: "Start bit" "Start" "S"
10238-10265 uart: tx-data-bits: "0"
10264-10291 uart: tx-data-bits: "1"
10290-10317 uart: tx-data-bits: "1"
10316-10343 uart: tx-data-bits: "0"
10342-10369 uart: tx-data-bits: "1"
10238-10369 uart: tx-data: "16"
10368-10395 uart: tx-parity-ok: "Stop bit" "Stop" "T"
10650-10677 uart: tx-start: "Start bit" "Start" "S"
10676-10703 uart: tx-data-bits: "1"
10702-10729 uart: tx-data-bits: "1"
10728-10755 uart: tx-data-bits: "1"
10754-10781 uart: tx-data-bits: "0"
10780-10807 uart: tx-data-bits: "1"
10676-10807 uart: tx-data: "17"
10806-10833 uart: tx-parity-ok: "Stop bit" "Stop" "T"
11089-11116 uart: tx-start: "Start bit" "Start" "S"
11115-11142 uart: tx-data-bits: "0"
11141-11168 uart: tx-data-bits: "0"
11167-11194 uart: tx-data-bits: "0"
11193-11220 uart: tx-data-bits: "1"
11219-11246 uart: tx-data-bits: "1"
11115-11246 uart: tx-data: "18"
11245-11272 uart: tx-parity-ok: "Stop bit" "Stop" "T"
11525-11552 uart: tx-start: "Start bit" "Start" "S"
11551-11578 uart: tx-data-bits: "1"
11577-11604 uart: tx-data-bits: "0"
11603-11630 uart: tx-data-bits: "0"
11629-11656 uart: tx-data-bits: "1"
11655-11682 uart: tx-data-bits: "1"
11551-11682 uart: tx-data: "19"
11681-11708 uart: tx-parity-ok: "Stop bit" "Stop" "T"
11964-11991 uart: tx-start: "Start bit" "Start" "S"
11990-12017 uart: tx-data-bits: "0"
12016-12043 uart: tx-data-bits: "1"
12042-12069 uart: tx-data-bits: "0"
12068-12095 uart: tx-data-bits: "1"
12094-12121 uart: tx-data-bits: "1"
11990-12121 uart: tx-data: "1A"
12120-12147 uart: tx-parity-ok: "Stop bit" "Stop" "T"
12403-12430 uart: tx-start: "Start bit" "Start" "S"
12429-12456 uart: tx-data-bits: "1"
12455-12482 uart: tx-data-bits: "1"
12481-12508 uart: tx-data-bits: "0"
12507-12534 uart: tx-data-bits: "1"
12533-12560 uart: tx-data-bits: "1"
12429-12560 uart: tx-data: "1B"
12559-12586 uart: tx-parity-ok: "Stop bit" "Stop" "T"
12841-12868 uart: tx-start: "Start bit" "Start" "S"
12867-12894 uart: tx-data-bits: "0"
12893-12920 uart: tx-data-bits: "0"
12919-12946 uart: tx-data-bits: "1"
12945-12972 uart: tx-data-bits: "1"
12971-12998 uart: tx-data-bits: "1"
12867-12998 uart: tx-data: "1C"
12997-13024 uart: tx-parity-ok: "Stop bit" "Stop" "T"
13278-13305 uart: tx-start: "Start bit" "Start" "S"
13304-13331 uart: tx-data-bits: "1"
13330-13357 uart: tx-data-bits: "0"
13356-13383 uart: tx-data-bits: "1"
13382-13409 uart: tx-data-bits: "1"
13408-13435 uart: tx-data-bits: "1"
13304-13435 uart: tx-data: "1D"
13434-13461 uart: tx-parity-ok: "Stop bit" "Stop" "T"
13717-13744 uart: tx-start: "Start bit" "Start" "S"
13743-13770 uart: tx-data-bits: "0"
13769-13796 uart: tx-data-bits: "1"
13795-13822 uart: tx-data-bits: "1"
13821-13848 uart: tx-data-bits: "1"
13847-13874 uart: tx-data-bits: "1"
13743-13874 uart: tx-data: "1E"
13873-13900 uart: tx-parity-ok: "Stop bit" "Stop" "T"
14153-14180 uart: tx-start: "Start bit" "Start" "S"
14179-14206 uart: tx-data-bits: "1"
14205-14232 uart: tx-data-bits: "1"
14231-14258 uart: tx-data-bits: "1"
14257-14284 uart: tx-data-bits: "1"
14283-14310 uart: tx-data-bits: "1"
14179-14310 uart: tx-data: "1F"
14309-14336 uart: tx-parity-ok: "Stop bit" "Stop" "T"
14590-14617 uart: tx-start: "Start bit" "Start" "S"
14616-14643 uart: tx-data-bits: "0"
14642-14669 uart: tx-data-bits: "0"
14668-14695 uart: tx-data-bits: "0"
14694-14721 uart: tx-data-bits: "0"
14720-14747 uart: tx-data-bits: "0"
14616-14747 uart: tx-data: "00"
14746-14773 uart: tx-parity-ok: "Stop bit" "Stop" "T"
15027-15054 uart: tx-start: "Start bit" "Start" "S"
15053-15080 uart: tx-data-bits: "1"
15079-15106 uart: tx-data-bits: "0"
15105-15132 uart: tx-data-bits: "0"
15131-15158 uart: tx-data-bits: "0"
15157-15184 uart: tx-data-bits: "0"
15053-15184 uart: tx-data: "01"
15183-15210 uart: tx-parity-ok: "Stop bit" "Stop" "T"
15465-15492 uart: tx-start: "Start bit" "Start" "S"
15491-15518 uart: tx-data-bits: "0"
15517-15544 uart: tx-data-bits: "1"
15543-15570 uart: tx-data-bits: "0"
15569-15596 uart: tx-data-bits: "0"
15595-15622 uart: tx-data-bits: "0"
15491-15622 uart: tx-data: "02"
15621-15648 uart: tx-parity-ok: "Stop bit" "Stop" "T"
15904-15931 uart: tx-start: "Start bit" "Start" "S"
15930-15957 uart: tx-data-bits: "1"
15956-15983 uart: tx-data-bits: "1"
15982-16009 uart: tx-data-bits: "0"
16008-16035 uart: tx-data-bits: "0"
16034-16061 uart: tx-data-bits: "0"
15930-16061 uart: tx-data: "03"
16060-16087 uart: tx-parity-ok: "Stop bit" "Stop" "T"
16342-16369 uart: tx-start: "Start bit" "Start" "S"
16368-16395 uart: tx-data-bits: "0"
16394-16421 uart: tx-data-bits: "0"
16420-16447 uart: tx-data-bits: "1"
16446-16473 uart: tx-data-bits: "0"
16472-16499 uart: tx-data-bits: "0"
16368-16499 uart: tx-data: "04"
16498-16525 uart: tx-parity-ok: "Stop bit" "Stop" "T"
16781-16808 uart: tx-start: "Start bit" "Start" "S"
16807-16834 uart: tx-data-bits: "1"
16833-16860 uart: tx-data-bits: "0"
16859-16886 uart: tx-data-bits: "1"
16885-16912 uart: tx-data-bits: "0"
16911-16938 uart: tx-data-bits: "0"
16807-16938 uart: tx-data: "05"
16937-16964 uart: tx-parity-ok: "Stop bit" "Stop" "T"
17222-17249 uart: tx-start: "Start bit" "Start" "S"
17248-17275 uart: tx-data-bits: "0"
17274-17301 uart: tx-data-bits: "1"
17300-17327 uart: tx-data-bits: "1"
17326-17353 uart: tx-data-bits: "0"
17352-17379 uart: tx-data-bits: "0"
17248-17379 uart: tx-data: "06"
17378-17405 uart: tx-parity-ok: "Stop bit" "Stop" "T"
17660-17687 uart: tx-start: "Start bit" "Start" "S"
17686-17713 uart: tx-data-bits: "1"
17712-17739 uart: tx-data-bits: "1"
17738-17765 uart: tx-data-bits: "1"
17764-17791 uart: tx-data-bits: "0"
17790-17817 uart: tx-data-bits: "0"
17686-17817 uart: tx-data: "07"
17816-17843 uart: tx-parity-ok: "Stop bit" "Stop" "T"
18099-18126 uart: tx-start: "Start bit" "Start" "S"
18125-18152 uart: tx-data-bits: "0"
18151-18178 uart: tx-data-bits: "0"
18177-18204 uart: tx-data-bits: "0"
18203-18230 uart: tx-data-bits: "1"
18229-18256 uart: tx-data-bits: "0"
18125-18256 uart: tx-data: "08"
18255-18282 uart: tx-parity-ok: "Stop bit" "Stop" "T"
18538-18565 uart: tx-start: "Start bit" "Start" "S"
18564-18591 uart: tx-data-bits: "1"
18590-18617 uart: tx-data-bits: "0"
18616-18643 uart: tx-data-bits: "0"
18642-18669 uart: tx-data-bits: "1"
18668-18695 uart: tx-data-bits: "0"
18564-18695 uart: tx-data: "09"
18694-18721 uart: tx-parity-ok: "Stop bit" "Stop" "T"
18978-19005 uart: tx-start: "Start bit" "Start" "S"
19004-19031 uart: tx-data-bits: "0"
19030-19057 uart: tx-data-bits: "1"
19056-19083 uart: tx-data-bits: "0"
19082-19109 uart: tx-data-bits: "1"
19108-19135 uart: tx-data-bits: "0"
19004-19135 uart: tx-data: "0A"
19134-19161 uart: tx-parity-ok: "Stop bit" "Stop" "T"
19419-19446 uart: tx-start: "Start bit" "Start" "S"
19445-19472 uart: tx-data-bits: "1"
19471-19498 uart: tx-data-bits: "1"
19497-19524 uart: tx-data-bits: "0"
19523-19550 uart: tx-data-bits: "1"
19549-19576 uart: tx-data-bits: "0"
19445-19576 uart: tx-data: "0B"
19575-19602 uart: tx-parity-ok: "Stop bit" "Stop" "T"
19859-19886 uart: tx-start: "Start bit" "Start" "S"
19885-19912 uart: tx-data-bits: "0"
19911-19938 uart: tx-data-bits: "0"
19937-19964 uart: tx-data-bits: "1"
19963-19990 uart: tx-data-bits: "1"
19989-20016 uart: tx-data-bits: "0"
19885-20016 uart: tx-data: "0C"
20015-20042 uart: tx-parity-ok: "Stop bit" "Stop" "T"
20298-20325 uart: tx-start: "Start bit" "Start" "S"
20324-20351 uart: tx-data-bits: "1"
20350-20377 uart: tx-data-bits: "0"
20376-20403 uart: tx-data-bits: "1"
20402-20429 uart: tx-data-bits: "1"
20428-20455 uart: tx-data-bits: "0"
20324-20455 uart: tx-data: "0D"
20454-20481 uart: tx-parity-ok: "Stop bit" "Stop" "T"
20739-20766 uart: tx-start: "Start bit" "Start" "S"
20765-20792 uart: tx-data-bits: "0"
20791-20818 uart: tx-data-bits: "1"
20817-20844 uart: tx-data-bits: "1"
20843-20870 uart: tx-data-bits: "1"
20869-20896 uart: tx-data-bits: "0"
20765-20896 uart: tx-data: "0E"
20895-20922 uart: tx-parity-ok: "Stop bit" "Stop" "T"
21177-21204 uart: tx-start: "Start bit" "Start" "S"
21203-21230 uart: tx-data-bits: "1"
21229-21256 uart: tx-data-bits: "1"
21255-21282 uart: tx-data-bits: "1"
21281-21308 uart: tx-data-bits: "1"
21307-21334 uart: tx-data-bits: "0"
21203-21334 uart: tx-data: "0F"
21333-21360 uart: tx-parity-ok: "Stop bit" "Stop" "T"
21616-21643 uart: tx-start: "Start bit" "Start" "S"
21642-21669 uart: tx-data-bits: "0"
21668-21695 uart: tx-data-bits: "0"
21694-21721 uart: tx-data-bits: "0"
21720-21747 uart: tx-data-bits: "0"
21746-21773 uart: tx-data-bits: "1"
21642-21773 uart: tx-data: "10"
21772-21799 uart: tx-parity-ok: "Stop bit" "Stop" "T"
22053-22080 uart: tx-start: "Start bit" "Start" "S"
22079-22106 uart: tx-data-bits: "1"
22105-22132 uart: tx-data-bits: "0"
22131-22158 uart: tx-data-bits: "0"
22157-22184 uart: tx-data-bits: "0"
22183-22210 uart: tx-data-bits: "1"
22079-22210 uart: tx-data: "11"
22209-22236 uart: tx-parity-ok: "Stop bit" "Stop" "T"
22491-22518 uart: tx-start: "Start bit" "Start" "S"
22517-22544 uart: tx-data-bits: "0"
22543-22570 uart: tx-data-bits: "1"
22569-22596 uart: tx-data-bits: "0"
22595-22622 uart: tx-data-bits: "0"
22621-22648 uart: tx-data-bits: "1"
22517-22648 uart: tx-data: "12"
22647-22674 uart: tx-parity-ok: "Stop bit" "Stop" "T"
22930-22957 uart: tx-start: "Start bit" "Start" "S"
22956-22983 uart: tx-data-bits: "1"
22982-23009 uart: tx-data-bits: "1"
23008-23035 uart: tx-data-bits: "0"
23034-23061 uart: tx-data-bits: "0"
23060-23087 uart: tx-data-bits: "1"
22956-23087 uart: tx-data: "13"
23086-23113 uart: tx-parity-ok: "Stop bit" "Stop" "T"
23368-23395 uart: tx-start: "Start bit" "Start" "S"
23394-23421 uart: tx-data-bits: "0"
23420-23447 uart: tx-data-bits: "0"
23446-23473 uart: tx-data-bits: "1"
23472-23499 uart: tx-data-bits: "0"
23498-23525 uart: tx-data-bits: "1"
23394-23525 uart: tx-data: "14"
23524-23551 uart: tx-parity-ok: "Stop bit" "Stop" "T"
23807-23834 uart: tx-start: "Start bit" "Start" "S"
23833-23860 uart: tx-data-bits: "1"
23859-23886 uart: tx-data-bits: "0"
23885-23912 uart: tx-data-bits: "1"
23911-23938 uart: tx-data-bits: "0"
23937-23964 uart: tx-data-bits: "1"
23833-23964 uart: tx-data: "15"
23963-23990 uart: tx-parity-ok: "Stop bit" "Stop" "T"
24248-24275 uart: tx-start: "Start bit" "Start" "S"
24274-24301 uart: tx-data-bits: "0"
24300-24327 uart: tx-data-bits: "1"
24326-24353 uart: tx-data-bits: "1"
24352-24379 uart: tx-data-bits: "0"
24378-24405 uart: tx-data-bits: "1"
24274-24405 uart: tx-data: "16"
24404-24431 uart: tx-parity-ok: "Stop bit" "Stop" "T"
24686-24713 uart: tx-start: "Start bit" "Start" "S"
24712-24739 uart: tx-data-bits: "1"
24738-24765 uart: tx-data-bits: "1"
24764-24791 uart: tx-data-bits: "1"
24790-24817 uart: tx-data-bits: "0"
24816-24843 uart: tx-data-bits: "1"
24712-24843 uart: tx-data: "17"
24842-24869 uart: tx-parity-ok: "Stop bit" "Stop" "T"
25125-25152 uart: tx-start: "Start bit" "Start" "S"
25151-25178 uart: tx-data-bits: "0"
25177-25204 uart: tx-data-bits: "0"
25203-25230 uart: tx-data-bits: "0"
25229-25256 uart: tx-data-bits: "1"
25255-25282 uart: tx-data-bits: "1"
25151-25282 uart: tx-data: "18"
25281-25308 uart: tx-parity-ok: "Stop bit" "Stop" "T"
25562-25589 uart: tx-start: "Start bit" "Start" "S"
25588-25615 uart: tx-data-bits: "1"
25614-25641 uart: tx-data-bits: "0"
25640-25667 uart: tx-data-bits: "0"
25666-25693 uart: tx-data-bits: "1"
25692-25719 uart: tx-data-bits: "1"
25588-25719 uart: tx-data: "19"
25718-25745 uart: tx-parity-ok: "Stop bit" "Stop" "T"
26000-26027 uart: tx-start: "Start bit" "Start" "S"
26026-26053 uart: tx-data-bits: "0"
26052-26079 uart: tx-data-bits: "1"
26078-26105 uart: tx-data-bits: "0"
26104-26131 uart: tx-data-bits: "1"
26130-26157 uart: tx-data-bits: "1"
26026-26157 uart: tx-data: "1A"
26156-26183 uart: tx-parity-ok: "Stop bit" "Stop" "T"
26439-26466 uart: tx-start: "Start bit" "Start" "S"
26465-26492 uart: tx-data-bits: "1"
26491-26518 uart: tx-data-bits: "1"
26517-26544 uart: tx-data-bits: "0"
26543-26570 uart: tx-data-bits: "1"
26569-26596 uart: tx-data-bits: "1"
26465-26596 uart: tx-data: "1B"
26595-26622 uart: tx-parity-ok: "Stop bit" "Stop" "T"
26878-26905 uart: tx-start: "Start bit" "Start" "S"
26904-26931 uart: tx-data-bits: "0"
26930-26957 uart: tx-data-bits: "0"
26956-26983 uart: tx-data-bits: "1"
26982-27009 uart: tx-data-bits: "1"
27008-27035 uart: tx-data-bits: "1"
26904-27035 uart: tx-data: "1C"
27034-27061 uart: tx-parity-ok: "Stop bit" "Stop" "T"
27314-27341 uart: tx-start: "Start bit" "Start" "S"
27340-27367 uart: tx-data-bits: "1"
27366-27393 uart: tx-data-bits: "0"
27392-27419 uart: tx-data-bits: "1"
27418-27445 uart: tx-data-bits: "1"
27444-27471 uart: tx-data-bits: "1"
27340-27471 uart: tx-data: "1D"
27470-27497 uart: tx-parity-ok: "Stop bit" "Stop" "T"
27753-27780 uart: tx-start: "Start bit" "Start" "S"
27779-27806 uart: tx-data-bits: "0"
27805-27832 uart: tx-data-bits: "1"
27831-27858 uart: tx-data-bits: "1"
27857-27884 uart: tx-data-bits: "1"
27883-27910 uart: tx-data-bits: "1"
27779-27910 uart: tx-data: "1E"
27909-27936 uart: tx-parity-ok: "Stop bit" "Stop" "T"
28189-28216 uart: tx-start: "Start bit" "Start" "S"
28215-28242 uart: tx-data-bits: "1"
28241-28268 uart: tx-data-bits: "1"
28267-28294 uart: tx-data-bits: "1"
28293-28320 uart: tx-data-bits: "1"
28319-28346 uart: tx-data-bits: "1"
28215-28346 uart: tx-data: "1F"
28345-28372 uart: tx-parity-ok: "Stop bit" "Stop" "T"
28626-28653 uart: tx-start: "Start bit" "Start" "S"
28652-28679 uart: tx-data-bits: "0"
28678-28705 uart: tx-data-bits: "0"
28704-28731 uart: tx-data-bits: "0"
28730-28757 uart: tx-data-bits: "0"
28756-28783 uart: tx-data-bits: "0"
28652-28783 uart: tx-data: "00"
28782-28809 uart: tx-parity-ok: "Stop bit" "Stop" "T"
29063-29090 uart: tx-start: "Start bit" "Start" "S"
29089-29116 uart: tx-data-bits: "1"
29115-29142 uart: tx-data-bits: "0"
29141-29168 uart: tx-data-bits: "0"
29167-29194 uart: tx-data-bits: "0"
29193-29220 uart: tx-data-bits: "0"
29089-29220 uart: tx-data: "01"
29219-29246 uart: tx-parity-ok: "Stop bit" "Stop" "T"
29501-29528 uart: tx-start: "Start bit" "Start" "S"
29527-29554 uart: tx-data-bits: "0"
29553-29580 uart: tx-data-bits: "1"
29579-29606 uart: tx-data-bits: "0"
29605-29632 uart: tx-data-bits: "0"
29631-29658 uart: tx-data-bits: "0"
29527-29658 uart: tx-data: "02"
29657-29684 uart: tx-parity-ok: "Stop bit" "Stop" "T"
