148-174 uart: tx-start: "Start bit" "Start" "S"
174-200 uart: tx-data-bit: "0"
200-226 uart: tx-data-bit: "0"
226-252 uart: tx-data-bit: "1"
252-278 uart: tx-data-bit: "1"
278-304 uart: tx-data-bit: "1"
304-330 uart: tx-data-bit: "1"
330-356 uart: tx-data-bit: "1"
174-356 uart: tx-data: "1111100"
356-382 uart: tx-stop: "Stop bit" "Stop" "T"
637-663 uart: tx-start: "Start bit" "Start" "S"
663-689 uart: tx-data-bit: "1"
689-715 uart: tx-data-bit: "0"
715-741 uart: tx-data-bit: "1"
741-767 uart: tx-data-bit: "1"
767-793 uart: tx-data-bit: "1"
793-819 uart: tx-data-bit: "1"
819-845 uart: tx-data-bit: "1"
663-845 uart: tx-data: "1111101"
845-871 uart: tx-stop: "Stop bit" "Stop" "T"
1128-1154 uart: tx-start: "Start bit" "Start" "S"
1154-1180 uart: tx-data-bit: "0"
1180-1206 uart: tx-data-bit: "1"
1206-1232 uart: tx-data-bit: "1"
1232-1258 uart: tx-data-bit: "1"
1258-1284 uart: tx-data-bit: "1"
1284-1310 uart: tx-data-bit: "1"
1310-1336 uart: tx-data-bit: "1"
1154-1336 uart: tx-data: "1111110"
1336-1362 uart: tx-stop: "Stop bit" "Stop" "T"
1616-1642 uart: tx-start: "Start bit" "Start" "S"
1642-1668 uart: tx-data-bit: "1"
1668-1694 uart: tx-data-bit: "1"
1694-1720 uart: tx-data-bit: "1"
1720-1746 uart: tx-data-bit: "1"
1746-1772 uart: tx-data-bit: "1"
1772-1798 uart: tx-data-bit: "1"
1798-1824 uart: tx-data-bit: "1"
1642-1824 uart: tx-data: "1111111"
1824-1850 uart: tx-stop: "Stop bit" "Stop" "T"
2105-2131 uart: tx-start: "Start bit" "Start" "S"
2131-2157 uart: tx-data-bit: "0"
2157-2183 uart: tx-data-bit: "0"
2183-2209 uart: tx-data-bit: "0"
2209-2235 uart: tx-data-bit: "0"
2235-2261 uart: tx-data-bit: "0"
2261-2287 uart: tx-data-bit: "0"
2287-2313 uart: tx-data-bit: "0"
2131-2313 uart: tx-data: "0000000"
2313-2339 uart: tx-stop: "Stop bit" "Stop" "T"
2593-2619 uart: tx-start: "Start bit" "Start" "S"
2619-2645 uart: tx-data-bit: "1"
2645-2671 uart: tx-data-bit: "0"
2671-2697 uart: tx-data-bit: "0"
2697-2723 uart: tx-data-bit: "0"
2723-2749 uart: tx-data-bit: "0"
2749-2775 uart: tx-data-bit: "0"
2775-2801 uart: tx-data-bit: "0"
2619-2801 uart: tx-data: "0000001"
2801-2827 uart: tx-stop: "Stop bit" "Stop" "T"
3084-3110 uart: tx-start: "Start bit" "Start" "S"
3110-3136 uart: tx-data-bit: "0"
3136-3162 uart: tx-data-bit: "1"
3162-3188 uart: tx-data-bit: "0"
3188-3214 uart: tx-data-bit: "0"
3214-3240 uart: tx-data-bit: "0"
3240-3266 uart: tx-data-bit: "0"
3266-3292 uart: tx-data-bit: "0"
3110-3292 uart: tx-data: "0000010"
3292-3318 uart: tx-stop: "Stop bit" "Stop" "T"
3575-3601 uart: tx-start: "Start bit" "Start" "S"
3601-3627 uart: tx-data-bit: "1"
3627-3653 uart: tx-data-bit: "1"
3653-3679 uart: tx-data-bit: "0"
3679-3705 uart: tx-data-bit: "0"
3705-3731 uart: tx-data-bit: "0"
3731-3757 uart: tx-data-bit: "0"
3757-3783 uart: tx-data-bit: "0"
3601-3783 uart: tx-data: "0000011"
3783-3809 uart: tx-stop: "Stop bit" "Stop" "T"
4065-4091 uart: tx-start: "Start bit" "Start" "S"
4091-4117 uart: tx-data-bit: "0"
4117-4143 uart: tx-data-bit: "0"
4143-4169 uart: tx-data-bit: "1"
4169-4195 uart: tx-data-bit: "0"
4195-4221 uart: tx-data-bit: "0"
4221-4247 uart: tx-data-bit: "0"
4247-4273 uart: tx-data-bit: "0"
4091-4273 uart: tx-data: "0000100"
4273-4299 uart: tx-stop: "Stop bit" "Stop" "T"
4556-4582 uart: tx-start: "Start bit" "Start" "S"
4582-4608 uart: tx-data-bit: "1"
4608-4634 uart: tx-data-bit: "0"
4634-4660 uart: tx-data-bit: "1"
4660-4686 uart: tx-data-bit: "0"
4686-4712 uart: tx-data-bit: "0"
4712-4738 uart: tx-data-bit: "0"
4738-4764 uart: tx-data-bit: "0"
4582-4764 uart: tx-data: "0000101"
4764-4790 uart: tx-stop: "Stop bit" "Stop" "T"
5048-5074 uart: tx-start: "Start bit" "Start" "S"
5074-5100 uart: tx-data-bit: "0"
5100-5126 uart: tx-data-bit: "1"
5126-5152 uart: tx-data-bit: "1"
5152-5178 uart: tx-data-bit: "0"
5178-5204 uart: tx-data-bit: "0"
5204-5230 uart: tx-data-bit: "0"
5230-5256 uart: tx-data-bit: "0"
5074-5256 uart: tx-data: "0000110"
5256-5282 uart: tx-stop: "Stop bit" "Stop" "T"
5539-5565 uart: tx-start: "Start bit" "Start" "S"
5565-5591 uart: tx-data-bit: "1"
5591-5617 uart: tx-data-bit: "1"
5617-5643 uart: tx-data-bit: "1"
5643-5669 uart: tx-data-bit: "0"
5669-5695 uart: tx-data-bit: "0"
5695-5721 uart: tx-data-bit: "0"
5721-5747 uart: tx-data-bit: "0"
5565-5747 uart: tx-data: "0000111"
5747-5773 uart: tx-stop: "Stop bit" "Stop" "T"
6030-6056 uart: tx-start: "Start bit" "Start" "S"
6056-6082 uart: tx-data-bit: "0"
6082-6108 uart: tx-data-bit: "0"
6108-6134 uart: tx-data-bit: "0"
6134-6160 uart: tx-data-bit: "1"
6160-6186 uart: tx-data-bit: "0"
6186-6212 uart: tx-data-bit: "0"
6212-6238 uart: tx-data-bit: "0"
6056-6238 uart: tx-data: "0001000"
6238-6264 uart: tx-stop: "Stop bit" "Stop" "T"
6520-6546 uart: tx-start: "Start bit" "Start" "S"
6546-6572 uart: tx-data-bit: "1"
6572-6598 uart: tx-data-bit: "0"
6598-6624 uart: tx-data-bit: "0"
6624-6650 uart: tx-data-bit: "1"
6650-6676 uart: tx-data-bit: "0"
6676-6702 uart: tx-data-bit: "0"
6702-6728 uart: tx-data-bit: "0"
6546-6728 uart: tx-data: "0001001"
6728-6754 uart: tx-stop: "Stop bit" "Stop" "T"
7013-7039 uart: tx-start: "Start bit" "Start" "S"
7039-7065 uart: tx-data-bit: "0"
7065-7091 uart: tx-data-bit: "1"
7091-7117 uart: tx-data-bit: "0"
7117-7143 uart: tx-data-bit: "1"
7143-7169 uart: tx-data-bit: "0"
7169-7195 uart: tx-data-bit: "0"
7195-7221 uart: tx-data-bit: "0"
7039-7221 uart: tx-data: "0001010"
7221-7247 uart: tx-stop: "Stop bit" "Stop" "T"
7505-7531 uart: tx-start: "Start bit" "Start" "S"
7531-7557 uart: tx-data-bit: "1"
7557-7583 uart: tx-data-bit: "1"
7583-7609 uart: tx-data-bit: "0"
7609-7635 uart: tx-data-bit: "1"
7635-7661 uart: tx-data-bit: "0"
7661-7687 uart: tx-data-bit: "0"
7687-7713 uart: tx-data-bit: "0"
7531-7713 uart: tx-data: "0001011"
7713-7739 uart: tx-stop: "Stop bit" "Stop" "T"
7998-8024 uart: tx-start: "Start bit" "Start" "S"
8024-8050 uart: tx-data-bit: "0"
8050-8076 uart: tx-data-bit: "0"
8076-8102 uart: tx-data-bit: "1"
8102-8128 uart: tx-data-bit: "1"
8128-8154 uart: tx-data-bit: "0"
8154-8180 uart: tx-data-bit: "0"
8180-8206 uart: tx-data-bit: "0"
8024-8206 uart: tx-data: "0001100"
8206-8232 uart: tx-stop: "Stop bit" "Stop" "T"
8489-8515 uart: tx-start: "Start bit" "Start" "S"
8515-8541 uart: tx-data-bit: "1"
8541-8567 uart: tx-data-bit: "0"
8567-8593 uart: tx-data-bit: "1"
8593-8619 uart: tx-data-bit: "1"
8619-8645 uart: tx-data-bit: "0"
8645-8671 uart: tx-data-bit: "0"
8671-8697 uart: tx-data-bit: "0"
8515-8697 uart: tx-data: "0001101"
8697-8723 uart: tx-stop: "Stop bit" "Stop" "T"
8981-9007 uart: tx-start: "Start bit" "Start" "S"
9007-9033 uart: tx-data-bit: "0"
9033-9059 uart: tx-data-bit: "1"
9059-9085 uart: tx-data-bit: "1"
9085-9111 uart: tx-data-bit: "1"
9111-9137 uart: tx-data-bit: "0"
9137-9163 uart: tx-data-bit: "0"
9163-9189 uart: tx-data-bit: "0"
9007-9189 uart: tx-data: "0001110"
9189-9215 uart: tx-stop: "Stop bit" "Stop" "T"
9472-9498 uart: tx-start: "Start bit" "Start" "S"
9498-9524 uart: tx-data-bit: "1"
9524-9550 uart: tx-data-bit: "1"
9550-9576 uart: tx-data-bit: "1"
9576-9602 uart: tx-data-bit: "1"
9602-9628 uart: tx-data-bit: "0"
9628-9654 uart: tx-data-bit: "0"
9654-9680 uart: tx-data-bit: "0"
9498-9680 uart: tx-data: "0001111"
9680-9706 uart: tx-stop: "Stop bit" "Stop" "T"
9962-9988 uart: tx-start: "Start bit" "Start" "S"
9988-10014 uart: tx-data-bit: "0"
10014-10040 uart: tx-data-bit: "0"
10040-10066 uart: tx-data-bit: "0"
10066-10092 uart: tx-data-bit: "0"
10092-10118 uart: tx-data-bit: "1"
10118-10144 uart: tx-data-bit: "0"
10144-10170 uart: tx-data-bit: "0"
9988-10170 uart: tx-data: "0010000"
10170-10196 uart: tx-stop: "Stop bit" "Stop" "T"
10453-10479 uart: tx-start: "Start bit" "Start" "S"
10479-10505 uart: tx-data-bit: "1"
10505-10531 uart: tx-data-bit: "0"
10531-10557 uart: tx-data-bit: "0"
10557-10583 uart: tx-data-bit: "0"
10583-10609 uart: tx-data-bit: "1"
10609-10635 uart: tx-data-bit: "0"
10635-10661 uart: tx-data-bit: "0"
10479-10661 uart: tx-data: "0010001"
10661-10687 uart: tx-stop: "Stop bit" "Stop" "T"
10945-10971 uart: tx-start: "Start bit" "Start" "S"
10971-10997 uart: tx-data-bit: "0"
10997-11023 uart: tx-data-bit: "1"
11023-11049 uart: tx-data-bit: "0"
11049-11075 uart: tx-data-bit: "0"
11075-11101 uart: tx-data-bit: "1"
11101-11127 uart: tx-data-bit: "0"
11127-11153 uart: tx-data-bit: "0"
10971-11153 uart: tx-data: "0010010"
11153-11179 uart: tx-stop: "Stop bit" "Stop" "T"
11438-11464 uart: tx-start: "Start bit" "Start" "S"
11464-11490 uart: tx-data-bit: "1"
11490-11516 uart: tx-data-bit: "1"
11516-11542 uart: tx-data-bit: "0"
11542-11568 uart: tx-data-bit: "0"
11568-11594 uart: tx-data-bit: "1"
11594-11620 uart: tx-data-bit: "0"
11620-11646 uart: tx-data-bit: "0"
11464-11646 uart: tx-data: "0010011"
11646-11672 uart: tx-stop: "Stop bit" "Stop" "T"
11931-11957 uart: tx-start: "Start bit" "Start" "S"
11957-11983 uart: tx-data-bit: "0"
11983-12009 uart: tx-data-bit: "0"
12009-12035 uart: tx-data-bit: "1"
12035-12061 uart: tx-data-bit: "0"
12061-12087 uart: tx-data-bit: "1"
12087-12113 uart: tx-data-bit: "0"
12113-12139 uart: tx-data-bit: "0"
11957-12139 uart: tx-data: "0010100"
12139-12165 uart: tx-stop: "Stop bit" "Stop" "T"
12423-12449 uart: tx-start: "Start bit" "Start" "S"
12449-12475 uart: tx-data-bit: "1"
12475-12501 uart: tx-data-bit: "0"
12501-12527 uart: tx-data-bit: "1"
12527-12553 uart: tx-data-bit: "0"
12553-12579 uart: tx-data-bit: "1"
12579-12605 uart: tx-data-bit: "0"
12605-12631 uart: tx-data-bit: "0"
12449-12631 uart: tx-data: "0010101"
12631-12657 uart: tx-stop: "Stop bit" "Stop" "T"
12918-12944 uart: tx-start: "Start bit" "Start" "S"
12944-12970 uart: tx-data-bit: "0"
12970-12996 uart: tx-data-bit: "1"
12996-13022 uart: tx-data-bit: "1"
13022-13048 uart: tx-data-bit: "0"
13048-13074 uart: tx-data-bit: "1"
13074-13100 uart: tx-data-bit: "0"
13100-13126 uart: tx-data-bit: "0"
12944-13126 uart: tx-data: "0010110"
13126-13152 uart: tx-stop: "Stop bit" "Stop" "T"
13410-13436 uart: tx-start: "Start bit" "Start" "S"
13436-13462 uart: tx-data-bit: "1"
13462-13488 uart: tx-data-bit: "1"
13488-13514 uart: tx-data-bit: "1"
13514-13540 uart: tx-data-bit: "0"
13540-13566 uart: tx-data-bit: "1"
13566-13592 uart: tx-data-bit: "0"
13592-13618 uart: tx-data-bit: "0"
13436-13618 uart: tx-data: "0010111"
13618-13644 uart: tx-stop: "Stop bit" "Stop" "T"
13903-13929 uart: tx-start: "Start bit" "Start" "S"
13929-13955 uart: tx-data-bit: "0"
13955-13981 uart: tx-data-bit: "0"
13981-14007 uart: tx-data-bit: "0"
14007-14033 uart: tx-data-bit: "1"
14033-14059 uart: tx-data-bit: "1"
14059-14085 uart: tx-data-bit: "0"
14085-14111 uart: tx-data-bit: "0"
13929-14111 uart: tx-data: "0011000"
14111-14137 uart: tx-stop: "Stop bit" "Stop" "T"
14394-14420 uart: tx-start: "Start bit" "Start" "S"
14420-14446 uart: tx-data-bit: "1"
14446-14472 uart: tx-data-bit: "0"
14472-14498 uart: tx-data-bit: "0"
14498-14524 uart: tx-data-bit: "1"
14524-14550 uart: tx-data-bit: "1"
14550-14576 uart: tx-data-bit: "0"
14576-14602 uart: tx-data-bit: "0"
14420-14602 uart: tx-data: "0011001"
14602-14628 uart: tx-stop: "Stop bit" "Stop" "T"
14886-14912 uart: tx-start: "Start bit" "Start" "S"
14912-14938 uart: tx-data-bit: "0"
14938-14964 uart: tx-data-bit: "1"
14964-14990 uart: tx-data-bit: "0"
14990-15016 uart: tx-data-bit: "1"
15016-15042 uart: tx-data-bit: "1"
15042-15068 uart: tx-data-bit: "0"
15068-15094 uart: tx-data-bit: "0"
14912-15094 uart: tx-data: "0011010"
15094-15120 uart: tx-stop: "Stop bit" "Stop" "T"
15379-15405 uart: tx-start: "Start bit" "Start" "S"
15405-15431 uart: tx-data-bit: "1"
15431-15457 uart: tx-data-bit: "1"
15457-15483 uart: tx-data-bit: "0"
15483-15509 uart: tx-data-bit: "1"
15509-15535 uart: tx-data-bit: "1"
15535-15561 uart: tx-data-bit: "0"
15561-15587 uart: tx-data-bit: "0"
15405-15587 uart: tx-data: "0011011"
15587-15613 uart: tx-stop: "Stop bit" "Stop" "T"
15871-15897 uart: tx-start: "Start bit" "Start" "S"
15897-15923 uart: tx-data-bit: "0"
15923-15949 uart: tx-data-bit: "0"
15949-15975 uart: tx-data-bit: "1"
15975-16001 uart: tx-data-bit: "1"
16001-16027 uart: tx-data-bit: "1"
16027-16053 uart: tx-data-bit: "0"
16053-16079 uart: tx-data-bit: "0"
15897-16079 uart: tx-data: "0011100"
16079-16105 uart: tx-stop: "Stop bit" "Stop" "T"
16362-16388 uart: tx-start: "Start bit" "Start" "S"
16388-16414 uart: tx-data-bit: "1"
16414-16440 uart: tx-data-bit: "0"
16440-16466 uart: tx-data-bit: "1"
16466-16492 uart: tx-data-bit: "1"
16492-16518 uart: tx-data-bit: "1"
16518-16544 uart: tx-data-bit: "0"
16544-16570 uart: tx-data-bit: "0"
16388-16570 uart: tx-data: "0011101"
16570-16596 uart: tx-stop: "Stop bit" "Stop" "T"
16855-16881 uart: tx-start: "Start bit" "Start" "S"
16881-16907 uart: tx-data-bit: "0"
16907-16933 uart: tx-data-bit: "1"
16933-16959 uart: tx-data-bit: "1"
16959-16985 uart: tx-data-bit: "1"
16985-17011 uart: tx-data-bit: "1"
17011-17037 uart: tx-data-bit: "0"
17037-17063 uart: tx-data-bit: "0"
16881-17063 uart: tx-data: "0011110"
17063-17089 uart: tx-stop: "Stop bit" "Stop" "T"
17345-17371 uart: tx-start: "Start bit" "Start" "S"
17371-17397 uart: tx-data-bit: "1"
17397-17423 uart: tx-data-bit: "1"
17423-17449 uart: tx-data-bit: "1"
17449-17475 uart: tx-data-bit: "1"
17475-17501 uart: tx-data-bit: "1"
17501-17527 uart: tx-data-bit: "0"
17527-17553 uart: tx-data-bit: "0"
17371-17553 uart: tx-data: "0011111"
17553-17579 uart: tx-stop: "Stop bit" "Stop" "T"
17836-17862 uart: tx-start: "Start bit" "Start" "S"
17862-17888 uart: tx-data-bit: "0"
17888-17914 uart: tx-data-bit: "0"
17914-17940 uart: tx-data-bit: "0"
17940-17966 uart: tx-data-bit: "0"
17966-17992 uart: tx-data-bit: "0"
17992-18018 uart: tx-data-bit: "1"
18018-18044 uart: tx-data-bit: "0"
17862-18044 uart: tx-data: "0100000"
18044-18070 uart: tx-stop: "Stop bit" "Stop" "T"
18326-18352 uart: tx-start: "Start bit" "Start" "S"
18352-18378 uart: tx-data-bit: "1"
18378-18404 uart: tx-data-bit: "0"
18404-18430 uart: tx-data-bit: "0"
18430-18456 uart: tx-data-bit: "0"
18456-18482 uart: tx-data-bit: "0"
18482-18508 uart: tx-data-bit: "1"
18508-18534 uart: tx-data-bit: "0"
18352-18534 uart: tx-data: "0100001"
18534-18560 uart: tx-stop: "Stop bit" "Stop" "T"
18819-18845 uart: tx-start: "Start bit" "Start" "S"
18845-18871 uart: tx-data-bit: "0"
18871-18897 uart: tx-data-bit: "1"
18897-18923 uart: tx-data-bit: "0"
18923-18949 uart: tx-data-bit: "0"
18949-18975 uart: tx-data-bit: "0"
18975-19001 uart: tx-data-bit: "1"
19001-19027 uart: tx-data-bit: "0"
18845-19027 uart: tx-data: "0100010"
19027-19053 uart: tx-stop: "Stop bit" "Stop" "T"
19312-19338 uart: tx-start: "Start bit" "Start" "S"
19338-19364 uart: tx-data-bit: "1"
19364-19390 uart: tx-data-bit: "1"
19390-19416 uart: tx-data-bit: "0"
19416-19442 uart: tx-data-bit: "0"
19442-19468 uart: tx-data-bit: "0"
19468-19494 uart: tx-data-bit: "1"
19494-19520 uart: tx-data-bit: "0"
19338-19520 uart: tx-data: "0100011"
19520-19546 uart: tx-stop: "Stop bit" "Stop" "T"
19804-19830 uart: tx-start: "Start bit" "Start" "S"
19830-19856 uart: tx-data-bit: "0"
19856-19882 uart: tx-data-bit: "0"
19882-19908 uart: tx-data-bit: "1"
19908-19934 uart: tx-data-bit: "0"
19934-19960 uart: tx-data-bit: "0"
19960-19986 uart: tx-data-bit: "1"
19986-20012 uart: tx-data-bit: "0"
19830-20012 uart: tx-data: "0100100"
20012-20038 uart: tx-stop: "Stop bit" "Stop" "T"
20297-20323 uart: tx-start: "Start bit" "Start" "S"
20323-20349 uart: tx-data-bit: "1"
20349-20375 uart: tx-data-bit: "0"
20375-20401 uart: tx-data-bit: "1"
20401-20427 uart: tx-data-bit: "0"
20427-20453 uart: tx-data-bit: "0"
20453-20479 uart: tx-data-bit: "1"
20479-20505 uart: tx-data-bit: "0"
20323-20505 uart: tx-data: "0100101"
20505-20531 uart: tx-stop: "Stop bit" "Stop" "T"
20791-20817 uart: tx-start: "Start bit" "Start" "S"
20817-20843 uart: tx-data-bit: "0"
20843-20869 uart: tx-data-bit: "1"
20869-20895 uart: tx-data-bit: "1"
20895-20921 uart: tx-data-bit: "0"
20921-20947 uart: tx-data-bit: "0"
20947-20973 uart: tx-data-bit: "1"
20973-20999 uart: tx-data-bit: "0"
20817-20999 uart: tx-data: "0100110"
20999-21025 uart: tx-stop: "Stop bit" "Stop" "T"
21284-21310 uart: tx-start: "Start bit" "Start" "S"
21310-21336 uart: tx-data-bit: "1"
21336-21362 uart: tx-data-bit: "1"
21362-21388 uart: tx-data-bit: "1"
21388-21414 uart: tx-data-bit: "0"
21414-21440 uart: tx-data-bit: "0"
21440-21466 uart: tx-data-bit: "1"
21466-21492 uart: tx-data-bit: "0"
21310-21492 uart: tx-data: "0100111"
21492-21518 uart: tx-stop: "Stop bit" "Stop" "T"
21777-21803 uart: tx-start: "Start bit" "Start" "S"
21803-21829 uart: tx-data-bit: "0"
21829-21855 uart: tx-data-bit: "0"
21855-21881 uart: tx-data-bit: "0"
21881-21907 uart: tx-data-bit: "1"
21907-21933 uart: tx-data-bit: "0"
21933-21959 uart: tx-data-bit: "1"
21959-21985 uart: tx-data-bit: "0"
21803-21985 uart: tx-data: "0101000"
21985-22011 uart: tx-stop: "Stop bit" "Stop" "T"
22269-22295 uart: tx-start: "Start bit" "Start" "S"
22295-22321 uart: tx-data-bit: "1"
22321-22347 uart: tx-data-bit: "0"
22347-22373 uart: tx-data-bit: "0"
22373-22399 uart: tx-data-bit: "1"
22399-22425 uart: tx-data-bit: "0"
22425-22451 uart: tx-data-bit: "1"
22451-22477 uart: tx-data-bit: "0"
22295-22477 uart: tx-data: "0101001"
22477-22503 uart: tx-stop: "Stop bit" "Stop" "T"
22764-22790 uart: tx-start: "Start bit" "Start" "S"
22790-22816 uart: tx-data-bit: "0"
22816-22842 uart: tx-data-bit: "1"
22842-22868 uart: tx-data-bit: "0"
22868-22894 uart: tx-data-bit: "1"
22894-22920 uart: tx-data-bit: "0"
22920-22946 uart: tx-data-bit: "1"
22946-22972 uart: tx-data-bit: "0"
22790-22972 uart: tx-data: "0101010"
22972-22998 uart: tx-stop: "Stop bit" "Stop" "T"
23258-23284 uart: tx-start: "Start bit" "Start" "S"
23284-23310 uart: tx-data-bit: "1"
23310-23336 uart: tx-data-bit: "1"
23336-23362 uart: tx-data-bit: "0"
23362-23388 uart: tx-data-bit: "1"
23388-23414 uart: tx-data-bit: "0"
23414-23440 uart: tx-data-bit: "1"
23440-23466 uart: tx-data-bit: "0"
23284-23466 uart: tx-data: "0101011"
23466-23492 uart: tx-stop: "Stop bit" "Stop" "T"
23753-23779 uart: tx-start: "Start bit" "Start" "S"
23779-23805 uart: tx-data-bit: "0"
23805-23831 uart: tx-data-bit: "0"
23831-23857 uart: tx-data-bit: "1"
23857-23883 uart: tx-data-bit: "1"
23883-23909 uart: tx-data-bit: "0"
23909-23935 uart: tx-data-bit: "1"
23935-23961 uart: tx-data-bit: "0"
23779-23961 uart: tx-data: "0101100"
23961-23987 uart: tx-stop: "Stop bit" "Stop" "T"
24246-24272 uart: tx-start: "Start bit" "Start" "S"
24272-24298 uart: tx-data-bit: "1"
24298-24324 uart: tx-data-bit: "0"
24324-24350 uart: tx-data-bit: "1"
24350-24376 uart: tx-data-bit: "1"
24376-24402 uart: tx-data-bit: "0"
24402-24428 uart: tx-data-bit: "1"
24428-24454 uart: tx-data-bit: "0"
24272-24454 uart: tx-data: "0101101"
24454-24480 uart: tx-stop: "Stop bit" "Stop" "T"
24740-24766 uart: tx-start: "Start bit" "Start" "S"
24766-24792 uart: tx-data-bit: "0"
24792-24818 uart: tx-data-bit: "1"
24818-24844 uart: tx-data-bit: "1"
24844-24870 uart: tx-data-bit: "1"
24870-24896 uart: tx-data-bit: "0"
24896-24922 uart: tx-data-bit: "1"
24922-24948 uart: tx-data-bit: "0"
24766-24948 uart: tx-data: "0101110"
24948-24974 uart: tx-stop: "Stop bit" "Stop" "T"
25233-25259 uart: tx-start: "Start bit" "Start" "S"
25259-25285 uart: tx-data-bit: "1"
25285-25311 uart: tx-data-bit: "1"
25311-25337 uart: tx-data-bit: "1"
25337-25363 uart: tx-data-bit: "1"
25363-25389 uart: tx-data-bit: "0"
25389-25415 uart: tx-data-bit: "1"
25415-25441 uart: tx-data-bit: "0"
25259-25441 uart: tx-data: "0101111"
25441-25467 uart: tx-stop: "Stop bit" "Stop" "T"
25725-25751 uart: tx-start: "Start bit" "Start" "S"
25751-25777 uart: tx-data-bit: "0"
25777-25803 uart: tx-data-bit: "0"
25803-25829 uart: tx-data-bit: "0"
25829-25855 uart: tx-data-bit: "0"
25855-25881 uart: tx-data-bit: "1"
25881-25907 uart: tx-data-bit: "1"
25907-25933 uart: tx-data-bit: "0"
25751-25933 uart: tx-data: "0110000"
25933-25959 uart: tx-stop: "Stop bit" "Stop" "T"
26216-26242 uart: tx-start: "Start bit" "Start" "S"
26242-26268 uart: tx-data-bit: "1"
26268-26294 uart: tx-data-bit: "0"
26294-26320 uart: tx-data-bit: "0"
26320-26346 uart: tx-data-bit: "0"
26346-26372 uart: tx-data-bit: "1"
26372-26398 uart: tx-data-bit: "1"
26398-26424 uart: tx-data-bit: "0"
26242-26424 uart: tx-data: "0110001"
26424-26450 uart: tx-stop: "Stop bit" "Stop" "T"
26709-26735 uart: tx-start: "Start bit" "Start" "S"
26735-26761 uart: tx-data-bit: "0"
26761-26787 uart: tx-data-bit: "1"
26787-26813 uart: tx-data-bit: "0"
26813-26839 uart: tx-data-bit: "0"
26839-26865 uart: tx-data-bit: "1"
26865-26891 uart: tx-data-bit: "1"
26891-26917 uart: tx-data-bit: "0"
26735-26917 uart: tx-data: "0110010"
26917-26943 uart: tx-stop: "Stop bit" "Stop" "T"
27201-27227 uart: tx-start: "Start bit" "Start" "S"
27227-27253 uart: tx-data-bit: "1"
27253-27279 uart: tx-data-bit: "1"
27279-27305 uart: tx-data-bit: "0"
27305-27331 uart: tx-data-bit: "0"
27331-27357 uart: tx-data-bit: "1"
27357-27383 uart: tx-data-bit: "1"
27383-27409 uart: tx-data-bit: "0"
27227-27409 uart: tx-data: "0110011"
27409-27435 uart: tx-stop: "Stop bit" "Stop" "T"
27694-27720 uart: tx-start: "Start bit" "Start" "S"
27720-27746 uart: tx-data-bit: "0"
27746-27772 uart: tx-data-bit: "0"
27772-27798 uart: tx-data-bit: "1"
27798-27824 uart: tx-data-bit: "0"
27824-27850 uart: tx-data-bit: "1"
27850-27876 uart: tx-data-bit: "1"
27876-27902 uart: tx-data-bit: "0"
27720-27902 uart: tx-data: "0110100"
27902-27928 uart: tx-stop: "Stop bit" "Stop" "T"
28186-28212 uart: tx-start: "Start bit" "Start" "S"
28212-28238 uart: tx-data-bit: "1"
28238-28264 uart: tx-data-bit: "0"
28264-28290 uart: tx-data-bit: "1"
28290-28316 uart: tx-data-bit: "0"
28316-28342 uart: tx-data-bit: "1"
28342-28368 uart: tx-data-bit: "1"
28368-28394 uart: tx-data-bit: "0"
28212-28394 uart: tx-data: "0110101"
28394-28420 uart: tx-stop: "Stop bit" "Stop" "T"
28681-28707 uart: tx-start: "Start bit" "Start" "S"
28707-28733 uart: tx-data-bit: "0"
28733-28759 uart: tx-data-bit: "1"
28759-28785 uart: tx-data-bit: "1"
28785-28811 uart: tx-data-bit: "0"
28811-28837 uart: tx-data-bit: "1"
28837-28863 uart: tx-data-bit: "1"
28863-28889 uart: tx-data-bit: "0"
28707-28889 uart: tx-data: "0110110"
28889-28915 uart: tx-stop: "Stop bit" "Stop" "T"
29174-29200 uart: tx-start: "Start bit" "Start" "S"
29200-29226 uart: tx-data-bit: "1"
29226-29252 uart: tx-data-bit: "1"
29252-29278 uart: tx-data-bit: "1"
29278-29304 uart: tx-data-bit: "0"
29304-29330 uart: tx-data-bit: "1"
29330-29356 uart: tx-data-bit: "1"
29356-29382 uart: tx-data-bit: "0"
29200-29382 uart: tx-data: "0110111"
29382-29408 uart: tx-stop: "Stop bit" "Stop" "T"
29666-29692 uart: tx-start: "Start bit" "Start" "S"
29692-29718 uart: tx-data-bit: "0"
29718-29744 uart: tx-data-bit: "0"
29744-29770 uart: tx-data-bit: "0"
29770-29796 uart: tx-data-bit: "1"
29796-29822 uart: tx-data-bit: "1"
29822-29848 uart: tx-data-bit: "1"
29848-29874 uart: tx-data-bit: "0"
29692-29874 uart: tx-data: "0111000"
29874-29900 uart: tx-stop: "Stop bit" "Stop" "T"
30157-30183 uart: tx-start: "Start bit" "Start" "S"
30183-30209 uart: tx-data-bit: "1"
30209-30235 uart: tx-data-bit: "0"
30235-30261 uart: tx-data-bit: "0"
30261-30287 uart: tx-data-bit: "1"
30287-30313 uart: tx-data-bit: "1"
30313-30339 uart: tx-data-bit: "1"
30339-30365 uart: tx-data-bit: "0"
30183-30365 uart: tx-data: "0111001"
30365-30391 uart: tx-stop: "Stop bit" "Stop" "T"
30649-30675 uart: tx-start: "Start bit" "Start" "S"
30675-30701 uart: tx-data-bit: "0"
30701-30727 uart: tx-data-bit: "1"
30727-30753 uart: tx-data-bit: "0"
30753-30779 uart: tx-data-bit: "1"
30779-30805 uart: tx-data-bit: "1"
30805-30831 uart: tx-data-bit: "1"
30831-30857 uart: tx-data-bit: "0"
30675-30857 uart: tx-data: "0111010"
30857-30883 uart: tx-stop: "Stop bit" "Stop" "T"
31142-31168 uart: tx-start: "Start bit" "Start" "S"
31168-31194 uart: tx-data-bit: "1"
31194-31220 uart: tx-data-bit: "1"
31220-31246 uart: tx-data-bit: "0"
31246-31272 uart: tx-data-bit: "1"
31272-31298 uart: tx-data-bit: "1"
31298-31324 uart: tx-data-bit: "1"
31324-31350 uart: tx-data-bit: "0"
31168-31350 uart: tx-data: "0111011"
31350-31376 uart: tx-stop: "Stop bit" "Stop" "T"
31635-31661 uart: tx-start: "Start bit" "Start" "S"
31661-31687 uart: tx-data-bit: "0"
31687-31713 uart: tx-data-bit: "0"
31713-31739 uart: tx-data-bit: "1"
31739-31765 uart: tx-data-bit: "1"
31765-31791 uart: tx-data-bit: "1"
31791-31817 uart: tx-data-bit: "1"
31817-31843 uart: tx-data-bit: "0"
31661-31843 uart: tx-data: "0111100"
31843-31869 uart: tx-stop: "Stop bit" "Stop" "T"
32125-32151 uart: tx-start: "Start bit" "Start" "S"
32151-32177 uart: tx-data-bit: "1"
32177-32203 uart: tx-data-bit: "0"
32203-32229 uart: tx-data-bit: "1"
32229-32255 uart: tx-data-bit: "1"
32255-32281 uart: tx-data-bit: "1"
32281-32307 uart: tx-data-bit: "1"
32307-32333 uart: tx-data-bit: "0"
32151-32333 uart: tx-data: "0111101"
32333-32359 uart: tx-stop: "Stop bit" "Stop" "T"
32618-32644 uart: tx-start: "Start bit" "Start" "S"
32644-32670 uart: tx-data-bit: "0"
32670-32696 uart: tx-data-bit: "1"
32696-32722 uart: tx-data-bit: "1"
32722-32748 uart: tx-data-bit: "1"
32748-32774 uart: tx-data-bit: "1"
32774-32800 uart: tx-data-bit: "1"
32800-32826 uart: tx-data-bit: "0"
32644-32826 uart: tx-data: "0111110"
32826-32852 uart: tx-stop: "Stop bit" "Stop" "T"
33108-33134 uart: tx-start: "Start bit" "Start" "S"
33134-33160 uart: tx-data-bit: "1"
33160-33186 uart: tx-data-bit: "1"
33186-33212 uart: tx-data-bit: "1"
33212-33238 uart: tx-data-bit: "1"
33238-33264 uart: tx-data-bit: "1"
33264-33290 uart: tx-data-bit: "1"
33290-33316 uart: tx-data-bit: "0"
33134-33316 uart: tx-data: "0111111"
33316-33342 uart: tx-stop: "Stop bit" "Stop" "T"
33599-33625 uart: tx-start: "Start bit" "Start" "S"
33625-33651 uart: tx-data-bit: "0"
33651-33677 uart: tx-data-bit: "0"
33677-33703 uart: tx-data-bit: "0"
33703-33729 uart: tx-data-bit: "0"
33729-33755 uart: tx-data-bit: "0"
33755-33781 uart: tx-data-bit: "0"
33781-33807 uart: tx-data-bit: "1"
33625-33807 uart: tx-data: "1000000"
33807-33833 uart: tx-stop: "Stop bit" "Stop" "T"
34088-34114 uart: tx-start: "Start bit" "Start" "S"
34114-34140 uart: tx-data-bit: "1"
34140-34166 uart: tx-data-bit: "0"
34166-34192 uart: tx-data-bit: "0"
34192-34218 uart: tx-data-bit: "0"
34218-34244 uart: tx-data-bit: "0"
34244-34270 uart: tx-data-bit: "0"
34270-34296 uart: tx-data-bit: "1"
34114-34296 uart: tx-data: "1000001"
34296-34322 uart: tx-stop: "Stop bit" "Stop" "T"
34578-34604 uart: tx-start: "Start bit" "Start" "S"
34604-34630 uart: tx-data-bit: "0"
34630-34656 uart: tx-data-bit: "1"
34656-34682 uart: tx-data-bit: "0"
34682-34708 uart: tx-data-bit: "0"
34708-34734 uart: tx-data-bit: "0"
34734-34760 uart: tx-data-bit: "0"
34760-34786 uart: tx-data-bit: "1"
34604-34786 uart: tx-data: "1000010"
34786-34812 uart: tx-stop: "Stop bit" "Stop" "T"
35069-35095 uart: tx-start: "Start bit" "Start" "S"
35095-35121 uart: tx-data-bit: "1"
35121-35147 uart: tx-data-bit: "1"
35147-35173 uart: tx-data-bit: "0"
35173-35199 uart: tx-data-bit: "0"
35199-35225 uart: tx-data-bit: "0"
35225-35251 uart: tx-data-bit: "0"
35251-35277 uart: tx-data-bit: "1"
35095-35277 uart: tx-data: "1000011"
35277-35303 uart: tx-stop: "Stop bit" "Stop" "T"
35559-35585 uart: tx-start: "Start bit" "Start" "S"
35585-35611 uart: tx-data-bit: "0"
35611-35637 uart: tx-data-bit: "0"
35637-35663 uart: tx-data-bit: "1"
35663-35689 uart: tx-data-bit: "0"
35689-35715 uart: tx-data-bit: "0"
35715-35741 uart: tx-data-bit: "0"
35741-35767 uart: tx-data-bit: "1"
35585-35767 uart: tx-data: "1000100"
35767-35793 uart: tx-stop: "Stop bit" "Stop" "T"
36050-36076 uart: tx-start: "Start bit" "Start" "S"
36076-36102 uart: tx-data-bit: "1"
36102-36128 uart: tx-data-bit: "0"
36128-36154 uart: tx-data-bit: "1"
36154-36180 uart: tx-data-bit: "0"
36180-36206 uart: tx-data-bit: "0"
36206-36232 uart: tx-data-bit: "0"
36232-36258 uart: tx-data-bit: "1"
36076-36258 uart: tx-data: "1000101"
36258-36284 uart: tx-stop: "Stop bit" "Stop" "T"
36543-36569 uart: tx-start: "Start bit" "Start" "S"
36569-36595 uart: tx-data-bit: "0"
36595-36621 uart: tx-data-bit: "1"
36621-36647 uart: tx-data-bit: "1"
36647-36673 uart: tx-data-bit: "0"
36673-36699 uart: tx-data-bit: "0"
36699-36725 uart: tx-data-bit: "0"
36725-36751 uart: tx-data-bit: "1"
36569-36751 uart: tx-data: "1000110"
36751-36777 uart: tx-stop: "Stop bit" "Stop" "T"
37033-37059 uart: tx-start: "Start bit" "Start" "S"
37059-37085 uart: tx-data-bit: "1"
37085-37111 uart: tx-data-bit: "1"
37111-37137 uart: tx-data-bit: "1"
37137-37163 uart: tx-data-bit: "0"
37163-37189 uart: tx-data-bit: "0"
37189-37215 uart: tx-data-bit: "0"
37215-37241 uart: tx-data-bit: "1"
37059-37241 uart: tx-data: "1000111"
37241-37267 uart: tx-stop: "Stop bit" "Stop" "T"
37524-37550 uart: tx-start: "Start bit" "Start" "S"
37550-37576 uart: tx-data-bit: "0"
37576-37602 uart: tx-data-bit: "0"
37602-37628 uart: tx-data-bit: "0"
37628-37654 uart: tx-data-bit: "1"
37654-37680 uart: tx-data-bit: "0"
37680-37706 uart: tx-data-bit: "0"
37706-37732 uart: tx-data-bit: "1"
37550-37732 uart: tx-data: "1001000"
37732-37758 uart: tx-stop: "Stop bit" "Stop" "T"
38014-38040 uart: tx-start: "Start bit" "Start" "S"
38040-38066 uart: tx-data-bit: "1"
38066-38092 uart: tx-data-bit: "0"
38092-38118 uart: tx-data-bit: "0"
38118-38144 uart: tx-data-bit: "1"
38144-38170 uart: tx-data-bit: "0"
38170-38196 uart: tx-data-bit: "0"
38196-38222 uart: tx-data-bit: "1"
38040-38222 uart: tx-data: "1001001"
38222-38248 uart: tx-stop: "Stop bit" "Stop" "T"
38507-38533 uart: tx-start: "Start bit" "Start" "S"
38533-38559 uart: tx-data-bit: "0"
38559-38585 uart: tx-data-bit: "1"
38585-38611 uart: tx-data-bit: "0"
38611-38637 uart: tx-data-bit: "1"
38637-38663 uart: tx-data-bit: "0"
38663-38689 uart: tx-data-bit: "0"
38689-38715 uart: tx-data-bit: "1"
38533-38715 uart: tx-data: "1001010"
38715-38741 uart: tx-stop: "Stop bit" "Stop" "T"
39000-39026 uart: tx-start: "Start bit" "Start" "S"
39026-39052 uart: tx-data-bit: "1"
39052-39078 uart: tx-data-bit: "1"
39078-39104 uart: tx-data-bit: "0"
39104-39130 uart: tx-data-bit: "1"
39130-39156 uart: tx-data-bit: "0"
39156-39182 uart: tx-data-bit: "0"
39182-39208 uart: tx-data-bit: "1"
39026-39208 uart: tx-data: "1001011"
39208-39234 uart: tx-stop: "Stop bit" "Stop" "T"
39492-39518 uart: tx-start: "Start bit" "Start" "S"
39518-39544 uart: tx-data-bit: "0"
39544-39570 uart: tx-data-bit: "0"
39570-39596 uart: tx-data-bit: "1"
39596-39622 uart: tx-data-bit: "1"
39622-39648 uart: tx-data-bit: "0"
39648-39674 uart: tx-data-bit: "0"
39674-39700 uart: tx-data-bit: "1"
39518-39700 uart: tx-data: "1001100"
39700-39726 uart: tx-stop: "Stop bit" "Stop" "T"
39983-40009 uart: tx-start: "Start bit" "Start" "S"
40009-40035 uart: tx-data-bit: "1"
40035-40061 uart: tx-data-bit: "0"
40061-40087 uart: tx-data-bit: "1"
40087-40113 uart: tx-data-bit: "1"
40113-40139 uart: tx-data-bit: "0"
40139-40165 uart: tx-data-bit: "0"
40165-40191 uart: tx-data-bit: "1"
40009-40191 uart: tx-data: "1001101"
40191-40217 uart: tx-stop: "Stop bit" "Stop" "T"
40475-40501 uart: tx-start: "Start bit" "Start" "S"
40501-40527 uart: tx-data-bit: "0"
40527-40553 uart: tx-data-bit: "1"
40553-40579 uart: tx-data-bit: "1"
40579-40605 uart: tx-data-bit: "1"
40605-40631 uart: tx-data-bit: "0"
40631-40657 uart: tx-data-bit: "0"
40657-40683 uart: tx-data-bit: "1"
40501-40683 uart: tx-data: "1001110"
40683-40709 uart: tx-stop: "Stop bit" "Stop" "T"
40966-40992 uart: tx-start: "Start bit" "Start" "S"
40992-41018 uart: tx-data-bit: "1"
41018-41044 uart: tx-data-bit: "1"
41044-41070 uart: tx-data-bit: "1"
41070-41096 uart: tx-data-bit: "1"
41096-41122 uart: tx-data-bit: "0"
41122-41148 uart: tx-data-bit: "0"
41148-41174 uart: tx-data-bit: "1"
40992-41174 uart: tx-data: "1001111"
41174-41200 uart: tx-stop: "Stop bit" "Stop" "T"
41457-41483 uart: tx-start: "Start bit" "Start" "S"
41483-41509 uart: tx-data-bit: "0"
41509-41535 uart: tx-data-bit: "0"
41535-41561 uart: tx-data-bit: "0"
41561-41587 uart: tx-data-bit: "0"
41587-41613 uart: tx-data-bit: "1"
41613-41639 uart: tx-data-bit: "0"
41639-41665 uart: tx-data-bit: "1"
41483-41665 uart: tx-data: "1010000"
41665-41691 uart: tx-stop: "Stop bit" "Stop" "T"
41947-41973 uart: tx-start: "Start bit" "Start" "S"
41973-41999 uart: tx-data-bit: "1"
41999-42025 uart: tx-data-bit: "0"
42025-42051 uart: tx-data-bit: "0"
42051-42077 uart: tx-data-bit: "0"
42077-42103 uart: tx-data-bit: "1"
42103-42129 uart: tx-data-bit: "0"
42129-42155 uart: tx-data-bit: "1"
41973-42155 uart: tx-data: "1010001"
42155-42181 uart: tx-stop: "Stop bit" "Stop" "T"
42440-42466 uart: tx-start: "Start bit" "Start" "S"
42466-42492 uart: tx-data-bit: "0"
42492-42518 uart: tx-data-bit: "1"
42518-42544 uart: tx-data-bit: "0"
42544-42570 uart: tx-data-bit: "0"
42570-42596 uart: tx-data-bit: "1"
42596-42622 uart: tx-data-bit: "0"
42622-42648 uart: tx-data-bit: "1"
42466-42648 uart: tx-data: "1010010"
42648-42674 uart: tx-stop: "Stop bit" "Stop" "T"
42932-42958 uart: tx-start: "Start bit" "Start" "S"
42958-42984 uart: tx-data-bit: "1"
42984-43010 uart: tx-data-bit: "1"
43010-43036 uart: tx-data-bit: "0"
43036-43062 uart: tx-data-bit: "0"
43062-43088 uart: tx-data-bit: "1"
43088-43114 uart: tx-data-bit: "0"
43114-43140 uart: tx-data-bit: "1"
42958-43140 uart: tx-data: "1010011"
43140-43166 uart: tx-stop: "Stop bit" "Stop" "T"
43426-43452 uart: tx-start: "Start bit" "Start" "S"
43452-43478 uart: tx-data-bit: "0"
43478-43504 uart: tx-data-bit: "0"
43504-43530 uart: tx-data-bit: "1"
43530-43556 uart: tx-data-bit: "0"
43556-43582 uart: tx-data-bit: "1"
43582-43608 uart: tx-data-bit: "0"
43608-43634 uart: tx-data-bit: "1"
43452-43634 uart: tx-data: "1010100"
43634-43660 uart: tx-stop: "Stop bit" "Stop" "T"
43919-43945 uart: tx-start: "Start bit" "Start" "S"
43945-43971 uart: tx-data-bit: "1"
43971-43997 uart: tx-data-bit: "0"
43997-44023 uart: tx-data-bit: "1"
44023-44049 uart: tx-data-bit: "0"
44049-44075 uart: tx-data-bit: "1"
44075-44101 uart: tx-data-bit: "0"
44101-44127 uart: tx-data-bit: "1"
43945-44127 uart: tx-data: "1010101"
44127-44153 uart: tx-stop: "Stop bit" "Stop" "T"
44413-44439 uart: tx-start: "Start bit" "Start" "S"
44439-44465 uart: tx-data-bit: "0"
44465-44491 uart: tx-data-bit: "1"
44491-44517 uart: tx-data-bit: "1"
44517-44543 uart: tx-data-bit: "0"
44543-44569 uart: tx-data-bit: "1"
44569-44595 uart: tx-data-bit: "0"
44595-44621 uart: tx-data-bit: "1"
44439-44621 uart: tx-data: "1010110"
44621-44647 uart: tx-stop: "Stop bit" "Stop" "T"
44906-44932 uart: tx-start: "Start bit" "Start" "S"
44932-44958 uart: tx-data-bit: "1"
44958-44984 uart: tx-data-bit: "1"
44984-45010 uart: tx-data-bit: "1"
45010-45036 uart: tx-data-bit: "0"
45036-45062 uart: tx-data-bit: "1"
45062-45088 uart: tx-data-bit: "0"
45088-45114 uart: tx-data-bit: "1"
44932-45114 uart: tx-data: "1010111"
45114-45140 uart: tx-stop: "Stop bit" "Stop" "T"
45398-45424 uart: tx-start: "Start bit" "Start" "S"
45424-45450 uart: tx-data-bit: "0"
45450-45476 uart: tx-data-bit: "0"
45476-45502 uart: tx-data-bit: "0"
45502-45528 uart: tx-data-bit: "1"
45528-45554 uart: tx-data-bit: "1"
45554-45580 uart: tx-data-bit: "0"
45580-45606 uart: tx-data-bit: "1"
45424-45606 uart: tx-data: "1011000"
45606-45632 uart: tx-stop: "Stop bit" "Stop" "T"
45889-45915 uart: tx-start: "Start bit" "Start" "S"
45915-45941 uart: tx-data-bit: "1"
45941-45967 uart: tx-data-bit: "0"
45967-45993 uart: tx-data-bit: "0"
45993-46019 uart: tx-data-bit: "1"
46019-46045 uart: tx-data-bit: "1"
46045-46071 uart: tx-data-bit: "0"
46071-46097 uart: tx-data-bit: "1"
45915-46097 uart: tx-data: "1011001"
46097-46123 uart: tx-stop: "Stop bit" "Stop" "T"
46382-46408 uart: tx-start: "Start bit" "Start" "S"
46408-46434 uart: tx-data-bit: "0"
46434-46460 uart: tx-data-bit: "1"
46460-46486 uart: tx-data-bit: "0"
46486-46512 uart: tx-data-bit: "1"
46512-46538 uart: tx-data-bit: "1"
46538-46564 uart: tx-data-bit: "0"
46564-46590 uart: tx-data-bit: "1"
46408-46590 uart: tx-data: "1011010"
46590-46616 uart: tx-stop: "Stop bit" "Stop" "T"
46874-46900 uart: tx-start: "Start bit" "Start" "S"
46900-46926 uart: tx-data-bit: "1"
46926-46952 uart: tx-data-bit: "1"
46952-46978 uart: tx-data-bit: "0"
46978-47004 uart: tx-data-bit: "1"
47004-47030 uart: tx-data-bit: "1"
47030-47056 uart: tx-data-bit: "0"
47056-47082 uart: tx-data-bit: "1"
46900-47082 uart: tx-data: "1011011"
47082-47108 uart: tx-stop: "Stop bit" "Stop" "T"
47367-47393 uart: tx-start: "Start bit" "Start" "S"
47393-47419 uart: tx-data-bit: "0"
47419-47445 uart: tx-data-bit: "0"
47445-47471 uart: tx-data-bit: "1"
47471-47497 uart: tx-data-bit: "1"
47497-47523 uart: tx-data-bit: "1"
47523-47549 uart: tx-data-bit: "0"
47549-47575 uart: tx-data-bit: "1"
47393-47575 uart: tx-data: "1011100"
47575-47601 uart: tx-stop: "Stop bit" "Stop" "T"
47857-47883 uart: tx-start: "Start bit" "Start" "S"
47883-47909 uart: tx-data-bit: "1"
47909-47935 uart: tx-data-bit: "0"
47935-47961 uart: tx-data-bit: "1"
47961-47987 uart: tx-data-bit: "1"
47987-48013 uart: tx-data-bit: "1"
48013-48039 uart: tx-data-bit: "0"
48039-48065 uart: tx-data-bit: "1"
47883-48065 uart: tx-data: "1011101"
48065-48091 uart: tx-stop: "Stop bit" "Stop" "T"
48350-48376 uart: tx-start: "Start bit" "Start" "S"
48376-48402 uart: tx-data-bit: "0"
48402-48428 uart: tx-data-bit: "1"
48428-48454 uart: tx-data-bit: "1"
48454-48480 uart: tx-data-bit: "1"
48480-48506 uart: tx-data-bit: "1"
48506-48532 uart: tx-data-bit: "0"
48532-48558 uart: tx-data-bit: "1"
48376-48558 uart: tx-data: "1011110"
48558-48584 uart: tx-stop: "Stop bit" "Stop" "T"
48841-48867 uart: tx-start: "Start bit" "Start" "S"
48867-48893 uart: tx-data-bit: "1"
48893-48919 uart: tx-data-bit: "1"
48919-48945 uart: tx-data-bit: "1"
48945-48971 uart: tx-data-bit: "1"
48971-48997 uart: tx-data-bit: "1"
48997-49023 uart: tx-data-bit: "0"
49023-49049 uart: tx-data-bit: "1"
48867-49049 uart: tx-data: "1011111"
49049-49075 uart: tx-stop: "Stop bit" "Stop" "T"
49331-49357 uart: tx-start: "Start bit" "Start" "S"
49357-49383 uart: tx-data-bit: "0"
49383-49409 uart: tx-data-bit: "0"
49409-49435 uart: tx-data-bit: "0"
49435-49461 uart: tx-data-bit: "0"
49461-49487 uart: tx-data-bit: "0"
49487-49513 uart: tx-data-bit: "1"
49513-49539 uart: tx-data-bit: "1"
49357-49539 uart: tx-data: "1100000"
49539-49565 uart: tx-stop: "Stop bit" "Stop" "T"
49820-49846 uart: tx-start: "Start bit" "Start" "S"
49846-49872 uart: tx-data-bit: "1"
49872-49898 uart: tx-data-bit: "0"
49898-49924 uart: tx-data-bit: "0"
49924-49950 uart: tx-data-bit: "0"
49950-49976 uart: tx-data-bit: "0"
49976-50002 uart: tx-data-bit: "1"
50002-50028 uart: tx-data-bit: "1"
49846-50028 uart: tx-data: "1100001"
50028-50054 uart: tx-stop: "Stop bit" "Stop" "T"
50310-50336 uart: tx-start: "Start bit" "Start" "S"
50336-50362 uart: tx-data-bit: "0"
50362-50388 uart: tx-data-bit: "1"
50388-50414 uart: tx-data-bit: "0"
50414-50440 uart: tx-data-bit: "0"
50440-50466 uart: tx-data-bit: "0"
50466-50492 uart: tx-data-bit: "1"
50492-50518 uart: tx-data-bit: "1"
50336-50518 uart: tx-data: "1100010"
50518-50544 uart: tx-stop: "Stop bit" "Stop" "T"
50801-50827 uart: tx-start: "Start bit" "Start" "S"
50827-50853 uart: tx-data-bit: "1"
50853-50879 uart: tx-data-bit: "1"
50879-50905 uart: tx-data-bit: "0"
50905-50931 uart: tx-data-bit: "0"
50931-50957 uart: tx-data-bit: "0"
50957-50983 uart: tx-data-bit: "1"
50983-51009 uart: tx-data-bit: "1"
50827-51009 uart: tx-data: "1100011"
51009-51035 uart: tx-stop: "Stop bit" "Stop" "T"
51292-51318 uart: tx-start: "Start bit" "Start" "S"
51318-51344 uart: tx-data-bit: "0"
51344-51370 uart: tx-data-bit: "0"
51370-51396 uart: tx-data-bit: "1"
51396-51422 uart: tx-data-bit: "0"
51422-51448 uart: tx-data-bit: "0"
51448-51474 uart: tx-data-bit: "1"
51474-51500 uart: tx-data-bit: "1"
51318-51500 uart: tx-data: "1100100"
51500-51526 uart: tx-stop: "Stop bit" "Stop" "T"
51782-51808 uart: tx-start: "Start bit" "Start" "S"
51808-51834 uart: tx-data-bit: "1"
51834-51860 uart: tx-data-bit: "0"
51860-51886 uart: tx-data-bit: "1"
51886-51912 uart: tx-data-bit: "0"
51912-51938 uart: tx-data-bit: "0"
51938-51964 uart: tx-data-bit: "1"
51964-51990 uart: tx-data-bit: "1"
51808-51990 uart: tx-data: "1100101"
51990-52016 uart: tx-stop: "Stop bit" "Stop" "T"
52275-52301 uart: tx-start: "Start bit" "Start" "S"
52301-52327 uart: tx-data-bit: "0"
52327-52353 uart: tx-data-bit: "1"
52353-52379 uart: tx-data-bit: "1"
52379-52405 uart: tx-data-bit: "0"
52405-52431 uart: tx-data-bit: "0"
52431-52457 uart: tx-data-bit: "1"
52457-52483 uart: tx-data-bit: "1"
52301-52483 uart: tx-data: "1100110"
52483-52509 uart: tx-stop: "Stop bit" "Stop" "T"
52765-52791 uart: tx-start: "Start bit" "Start" "S"
52791-52817 uart: tx-data-bit: "1"
52817-52843 uart: tx-data-bit: "1"
52843-52869 uart: tx-data-bit: "1"
52869-52895 uart: tx-data-bit: "0"
52895-52921 uart: tx-data-bit: "0"
52921-52947 uart: tx-data-bit: "1"
52947-52973 uart: tx-data-bit: "1"
52791-52973 uart: tx-data: "1100111"
52973-52999 uart: tx-stop: "Stop bit" "Stop" "T"
53256-53282 uart: tx-start: "Start bit" "Start" "S"
53282-53308 uart: tx-data-bit: "0"
53308-53334 uart: tx-data-bit: "0"
53334-53360 uart: tx-data-bit: "0"
53360-53386 uart: tx-data-bit: "1"
53386-53412 uart: tx-data-bit: "0"
53412-53438 uart: tx-data-bit: "1"
53438-53464 uart: tx-data-bit: "1"
53282-53464 uart: tx-data: "1101000"
53464-53490 uart: tx-stop: "Stop bit" "Stop" "T"
53747-53773 uart: tx-start: "Start bit" "Start" "S"
53773-53799 uart: tx-data-bit: "1"
53799-53825 uart: tx-data-bit: "0"
53825-53851 uart: tx-data-bit: "0"
53851-53877 uart: tx-data-bit: "1"
53877-53903 uart: tx-data-bit: "0"
53903-53929 uart: tx-data-bit: "1"
53929-53955 uart: tx-data-bit: "1"
53773-53955 uart: tx-data: "1101001"
53955-53981 uart: tx-stop: "Stop bit" "Stop" "T"
54239-54265 uart: tx-start: "Start bit" "Start" "S"
54265-54291 uart: tx-data-bit: "0"
54291-54317 uart: tx-data-bit: "1"
54317-54343 uart: tx-data-bit: "0"
54343-54369 uart: tx-data-bit: "1"
54369-54395 uart: tx-data-bit: "0"
54395-54421 uart: tx-data-bit: "1"
54421-54447 uart: tx-data-bit: "1"
54265-54447 uart: tx-data: "1101010"
54447-54473 uart: tx-stop: "Stop bit" "Stop" "T"
54732-54758 uart: tx-start: "Start bit" "Start" "S"
54758-54784 uart: tx-data-bit: "1"
54784-54810 uart: tx-data-bit: "1"
54810-54836 uart: tx-data-bit: "0"
54836-54862 uart: tx-data-bit: "1"
54862-54888 uart: tx-data-bit: "0"
54888-54914 uart: tx-data-bit: "1"
54914-54940 uart: tx-data-bit: "1"
54758-54940 uart: tx-data: "1101011"
54940-54966 uart: tx-stop: "Stop bit" "Stop" "T"
55224-55250 uart: tx-start: "Start bit" "Start" "S"
55250-55276 uart: tx-data-bit: "0"
55276-55302 uart: tx-data-bit: "0"
55302-55328 uart: tx-data-bit: "1"
55328-55354 uart: tx-data-bit: "1"
55354-55380 uart: tx-data-bit: "0"
55380-55406 uart: tx-data-bit: "1"
55406-55432 uart: tx-data-bit: "1"
55250-55432 uart: tx-data: "1101100"
55432-55458 uart: tx-stop: "Stop bit" "Stop" "T"
55715-55741 uart: tx-start: "Start bit" "Start" "S"
55741-55767 uart: tx-data-bit: "1"
55767-55793 uart: tx-data-bit: "0"
55793-55819 uart: tx-data-bit: "1"
55819-55845 uart: tx-data-bit: "1"
55845-55871 uart: tx-data-bit: "0"
55871-55897 uart: tx-data-bit: "1"
55897-55923 uart: tx-data-bit: "1"
55741-55923 uart: tx-data: "1101101"
55923-55949 uart: tx-stop: "Stop bit" "Stop" "T"
56208-56234 uart: tx-start: "Start bit" "Start" "S"
56234-56260 uart: tx-data-bit: "0"
56260-56286 uart: tx-data-bit: "1"
56286-56312 uart: tx-data-bit: "1"
56312-56338 uart: tx-data-bit: "1"
56338-56364 uart: tx-data-bit: "0"
56364-56390 uart: tx-data-bit: "1"
56390-56416 uart: tx-data-bit: "1"
56234-56416 uart: tx-data: "1101110"
56416-56442 uart: tx-stop: "Stop bit" "Stop" "T"
56698-56724 uart: tx-start: "Start bit" "Start" "S"
56724-56750 uart: tx-data-bit: "1"
56750-56776 uart: tx-data-bit: "1"
56776-56802 uart: tx-data-bit: "1"
56802-56828 uart: tx-data-bit: "1"
56828-56854 uart: tx-data-bit: "0"
56854-56880 uart: tx-data-bit: "1"
56880-56906 uart: tx-data-bit: "1"
56724-56906 uart: tx-data: "1101111"
56906-56932 uart: tx-stop: "Stop bit" "Stop" "T"
57189-57215 uart: tx-start: "Start bit" "Start" "S"
57215-57241 uart: tx-data-bit: "0"
57241-57267 uart: tx-data-bit: "0"
57267-57293 uart: tx-data-bit: "0"
57293-57319 uart: tx-data-bit: "0"
57319-57345 uart: tx-data-bit: "1"
57345-57371 uart: tx-data-bit: "1"
57371-57397 uart: tx-data-bit: "1"
57215-57397 uart: tx-data: "1110000"
57397-57423 uart: tx-stop: "Stop bit" "Stop" "T"
57677-57703 uart: tx-start: "Start bit" "Start" "S"
57703-57729 uart: tx-data-bit: "1"
57729-57755 uart: tx-data-bit: "0"
57755-57781 uart: tx-data-bit: "0"
57781-57807 uart: tx-data-bit: "0"
57807-57833 uart: tx-data-bit: "1"
57833-57859 uart: tx-data-bit: "1"
57859-57885 uart: tx-data-bit: "1"
57703-57885 uart: tx-data: "1110001"
57885-57911 uart: tx-stop: "Stop bit" "Stop" "T"
58168-58194 uart: tx-start: "Start bit" "Start" "S"
58194-58220 uart: tx-data-bit: "0"
58220-58246 uart: tx-data-bit: "1"
58246-58272 uart: tx-data-bit: "0"
58272-58298 uart: tx-data-bit: "0"
58298-58324 uart: tx-data-bit: "1"
58324-58350 uart: tx-data-bit: "1"
58350-58376 uart: tx-data-bit: "1"
58194-58376 uart: tx-data: "1110010"
58376-58402 uart: tx-stop: "Stop bit" "Stop" "T"
58659-58685 uart: tx-start: "Start bit" "Start" "S"
58685-58711 uart: tx-data-bit: "1"
58711-58737 uart: tx-data-bit: "1"
58737-58763 uart: tx-data-bit: "0"
58763-58789 uart: tx-data-bit: "0"
58789-58815 uart: tx-data-bit: "1"
58815-58841 uart: tx-data-bit: "1"
58841-58867 uart: tx-data-bit: "1"
58685-58867 uart: tx-data: "1110011"
58867-58893 uart: tx-stop: "Stop bit" "Stop" "T"
59149-59175 uart: tx-start: "Start bit" "Start" "S"
59175-59201 uart: tx-data-bit: "0"
59201-59227 uart: tx-data-bit: "0"
59227-59253 uart: tx-data-bit: "1"
59253-59279 uart: tx-data-bit: "0"
59279-59305 uart: tx-data-bit: "1"
59305-59331 uart: tx-data-bit: "1"
59331-59357 uart: tx-data-bit: "1"
59175-59357 uart: tx-data: "1110100"
59357-59383 uart: tx-stop: "Stop bit" "Stop" "T"
59640-59666 uart: tx-start: "Start bit" "Start" "S"
59666-59692 uart: tx-data-bit: "1"
59692-59718 uart: tx-data-bit: "0"
59718-59744 uart: tx-data-bit: "1"
59744-59770 uart: tx-data-bit: "0"
59770-59796 uart: tx-data-bit: "1"
59796-59822 uart: tx-data-bit: "1"
59822-59848 uart: tx-data-bit: "1"
59666-59848 uart: tx-data: "1110101"
59848-59874 uart: tx-stop: "Stop bit" "Stop" "T"
60132-60158 uart: tx-start: "Start bit" "Start" "S"
60158-60184 uart: tx-data-bit: "0"
60184-60210 uart: tx-data-bit: "1"
60210-60236 uart: tx-data-bit: "1"
60236-60262 uart: tx-data-bit: "0"
60262-60288 uart: tx-data-bit: "1"
60288-60314 uart: tx-data-bit: "1"
60314-60340 uart: tx-data-bit: "1"
60158-60340 uart: tx-data: "1110110"
60340-60366 uart: tx-stop: "Stop bit" "Stop" "T"
60623-60649 uart: tx-start: "Start bit" "Start" "S"
60649-60675 uart: tx-data-bit: "1"
60675-60701 uart: tx-data-bit: "1"
60701-60727 uart: tx-data-bit: "1"
60727-60753 uart: tx-data-bit: "0"
60753-60779 uart: tx-data-bit: "1"
60779-60805 uart: tx-data-bit: "1"
60805-60831 uart: tx-data-bit: "1"
60649-60831 uart: tx-data: "1110111"
60831-60857 uart: tx-stop: "Stop bit" "Stop" "T"
61114-61140 uart: tx-start: "Start bit" "Start" "S"
61140-61166 uart: tx-data-bit: "0"
61166-61192 uart: tx-data-bit: "0"
61192-61218 uart: tx-data-bit: "0"
61218-61244 uart: tx-data-bit: "1"
61244-61270 uart: tx-data-bit: "1"
61270-61296 uart: tx-data-bit: "1"
61296-61322 uart: tx-data-bit: "1"
61140-61322 uart: tx-data: "1111000"
61322-61348 uart: tx-stop: "Stop bit" "Stop" "T"
61602-61628 uart: tx-start: "Start bit" "Start" "S"
61628-61654 uart: tx-data-bit: "1"
61654-61680 uart: tx-data-bit: "0"
61680-61706 uart: tx-data-bit: "0"
61706-61732 uart: tx-data-bit: "1"
61732-61758 uart: tx-data-bit: "1"
61758-61784 uart: tx-data-bit: "1"
61784-61810 uart: tx-data-bit: "1"
61628-61810 uart: tx-data: "1111001"
61810-61836 uart: tx-stop: "Stop bit" "Stop" "T"
62093-62119 uart: tx-start: "Start bit" "Start" "S"
62119-62145 uart: tx-data-bit: "0"
62145-62171 uart: tx-data-bit: "1"
62171-62197 uart: tx-data-bit: "0"
62197-62223 uart: tx-data-bit: "1"
62223-62249 uart: tx-data-bit: "1"
62249-62275 uart: tx-data-bit: "1"
62275-62301 uart: tx-data-bit: "1"
62119-62301 uart: tx-data: "1111010"
62301-62327 uart: tx-stop: "Stop bit" "Stop" "T"
62583-62609 uart: tx-start: "Start bit" "Start" "S"
62609-62635 uart: tx-data-bit: "1"
62635-62661 uart: tx-data-bit: "1"
62661-62687 uart: tx-data-bit: "0"
62687-62713 uart: tx-data-bit: "1"
62713-62739 uart: tx-data-bit: "1"
62739-62765 uart: tx-data-bit: "1"
62765-62791 uart: tx-data-bit: "1"
62609-62791 uart: tx-data: "1111011"
62791-62817 uart: tx-stop: "Stop bit" "Stop" "T"
63074-63100 uart: tx-start: "Start bit" "Start" "S"
63100-63126 uart: tx-data-bit: "0"
63126-63152 uart: tx-data-bit: "0"
63152-63178 uart: tx-data-bit: "1"
63178-63204 uart: tx-data-bit: "1"
63204-63230 uart: tx-data-bit: "1"
63230-63256 uart: tx-data-bit: "1"
63256-63282 uart: tx-data-bit: "1"
63100-63282 uart: tx-data: "1111100"
63282-63308 uart: tx-stop: "Stop bit" "Stop" "T"
63563-63589 uart: tx-start: "Start bit" "Start" "S"
63589-63615 uart: tx-data-bit: "1"
63615-63641 uart: tx-data-bit: "0"
63641-63667 uart: tx-data-bit: "1"
63667-63693 uart: tx-data-bit: "1"
63693-63719 uart: tx-data-bit: "1"
63719-63745 uart: tx-data-bit: "1"
63745-63771 uart: tx-data-bit: "1"
63589-63771 uart: tx-data: "1111101"
63771-63797 uart: tx-stop: "Stop bit" "Stop" "T"
64053-64079 uart: tx-start: "Start bit" "Start" "S"
64079-64105 uart: tx-data-bit: "0"
64105-64131 uart: tx-data-bit: "1"
64131-64157 uart: tx-data-bit: "1"
64157-64183 uart: tx-data-bit: "1"
64183-64209 uart: tx-data-bit: "1"
64209-64235 uart: tx-data-bit: "1"
64235-64261 uart: tx-data-bit: "1"
64079-64261 uart: tx-data: "1111110"
64261-64287 uart: tx-stop: "Stop bit" "Stop" "T"
64542-64568 uart: tx-start: "Start bit" "Start" "S"
64568-64594 uart: tx-data-bit: "1"
64594-64620 uart: tx-data-bit: "1"
64620-64646 uart: tx-data-bit: "1"
64646-64672 uart: tx-data-bit: "1"
64672-64698 uart: tx-data-bit: "1"
64698-64724 uart: tx-data-bit: "1"
64724-64750 uart: tx-data-bit: "1"
64568-64750 uart: tx-data: "1111111"
64750-64776 uart: tx-stop: "Stop bit" "Stop" "T"
65030-65056 uart: tx-start: "Start bit" "Start" "S"
65056-65082 uart: tx-data-bit: "0"
65082-65108 uart: tx-data-bit: "0"
65108-65134 uart: tx-data-bit: "0"
65134-65160 uart: tx-data-bit: "0"
65160-65186 uart: tx-data-bit: "0"
65186-65212 uart: tx-data-bit: "0"
65212-65238 uart: tx-data-bit: "0"
65056-65238 uart: tx-data: "0000000"
65238-65264 uart: tx-stop: "Stop bit" "Stop" "T"
65519-65545 uart: tx-start: "Start bit" "Start" "S"
65545-65571 uart: tx-data-bit: "1"
65571-65597 uart: tx-data-bit: "0"
65597-65623 uart: tx-data-bit: "0"
65623-65649 uart: tx-data-bit: "0"
65649-65675 uart: tx-data-bit: "0"
65675-65701 uart: tx-data-bit: "0"
65701-65727 uart: tx-data-bit: "0"
65545-65727 uart: tx-data: "0000001"
65727-65753 uart: tx-stop: "Stop bit" "Stop" "T"
66010-66036 uart: tx-start: "Start bit" "Start" "S"
66036-66062 uart: tx-data-bit: "0"
66062-66088 uart: tx-data-bit: "1"
66088-66114 uart: tx-data-bit: "0"
66114-66140 uart: tx-data-bit: "0"
66140-66166 uart: tx-data-bit: "0"
66166-66192 uart: tx-data-bit: "0"
66192-66218 uart: tx-data-bit: "0"
66036-66218 uart: tx-data: "0000010"
66218-66244 uart: tx-stop: "Stop bit" "Stop" "T"
66500-66526 uart: tx-start: "Start bit" "Start" "S"
66526-66552 uart: tx-data-bit: "1"
66552-66578 uart: tx-data-bit: "1"
66578-66604 uart: tx-data-bit: "0"
66604-66630 uart: tx-data-bit: "0"
66630-66656 uart: tx-data-bit: "0"
66656-66682 uart: tx-data-bit: "0"
66682-66708 uart: tx-data-bit: "0"
66526-66708 uart: tx-data: "0000011"
66708-66734 uart: tx-stop: "Stop bit" "Stop" "T"
66991-67017 uart: tx-start: "Start bit" "Start" "S"
67017-67043 uart: tx-data-bit: "0"
67043-67069 uart: tx-data-bit: "0"
67069-67095 uart: tx-data-bit: "1"
67095-67121 uart: tx-data-bit: "0"
67121-67147 uart: tx-data-bit: "0"
67147-67173 uart: tx-data-bit: "0"
67173-67199 uart: tx-data-bit: "0"
67017-67199 uart: tx-data: "0000100"
67199-67225 uart: tx-stop: "Stop bit" "Stop" "T"
67481-67507 uart: tx-start: "Start bit" "Start" "S"
67507-67533 uart: tx-data-bit: "1"
67533-67559 uart: tx-data-bit: "0"
67559-67585 uart: tx-data-bit: "1"
67585-67611 uart: tx-data-bit: "0"
67611-67637 uart: tx-data-bit: "0"
67637-67663 uart: tx-data-bit: "0"
67663-67689 uart: tx-data-bit: "0"
67507-67689 uart: tx-data: "0000101"
67689-67715 uart: tx-stop: "Stop bit" "Stop" "T"
67974-68000 uart: tx-start: "Start bit" "Start" "S"
68000-68026 uart: tx-data-bit: "0"
68026-68052 uart: tx-data-bit: "1"
68052-68078 uart: tx-data-bit: "1"
68078-68104 uart: tx-data-bit: "0"
68104-68130 uart: tx-data-bit: "0"
68130-68156 uart: tx-data-bit: "0"
68156-68182 uart: tx-data-bit: "0"
68000-68182 uart: tx-data: "0000110"
68182-68208 uart: tx-stop: "Stop bit" "Stop" "T"
68465-68491 uart: tx-start: "Start bit" "Start" "S"
68491-68517 uart: tx-data-bit: "1"
68517-68543 uart: tx-data-bit: "1"
68543-68569 uart: tx-data-bit: "1"
68569-68595 uart: tx-data-bit: "0"
68595-68621 uart: tx-data-bit: "0"
68621-68647 uart: tx-data-bit: "0"
68647-68673 uart: tx-data-bit: "0"
68491-68673 uart: tx-data: "0000111"
68673-68699 uart: tx-stop: "Stop bit" "Stop" "T"
68955-68981 uart: tx-start: "Start bit" "Start" "S"
68981-69007 uart: tx-data-bit: "0"
69007-69033 uart: tx-data-bit: "0"
69033-69059 uart: tx-data-bit: "0"
69059-69085 uart: tx-data-bit: "1"
69085-69111 uart: tx-data-bit: "0"
69111-69137 uart: tx-data-bit: "0"
69137-69163 uart: tx-data-bit: "0"
68981-69163 uart: tx-data: "0001000"
69163-69189 uart: tx-stop: "Stop bit" "Stop" "T"
