167-207 ds1307: reg_seconds: "Seconds" "Sec" "S"
167-172 ds1307: bit_clock_halt: "Clock halt: 0" "Clk hlt: 0" "CH: 0" "CH"
172-207 ds1307: bit_seconds: "Second: 41" "Sec: 41" "S: 41" "S"
215-255 ds1307: reg_minutes: "Minutes" "Min" "M"
215-220 ds1307: bit_reserved: "Reserved bit" "Reserved" "Rsvd" "R"
220-255 ds1307: bit_minutes: "Minute: 39" "Min: 39" "M: 39" "M"
263-303 ds1307: reg_hours: "Hours" "H"
263-268 ds1307: bit_reserved: "Reserved bit" "Reserved" "Rsvd" "R"
268-273 ds1307: bit_12_24_hours: "12-hour mode" "12h mode" "12h"
273-278 ds1307: bit_am_pm: "PM" "P"
278-303 ds1307: bit_hours: "Hour: 8" "H: 8" "H"
310-350 ds1307: reg_day: "Day of week" "Day" "D"
310-315 ds1307: bit_reserved: "Reserved bit" "Reserved" "Rsvd" "R"
315-320 ds1307: bit_reserved: "Reserved bit" "Reserved" "Rsvd" "R"
320-325 ds1307: bit_reserved: "Reserved bit" "Reserved" "Rsvd" "R"
325-330 ds1307: bit_reserved: "Reserved bit" "Reserved" "Rsvd" "R"
330-335 ds1307: bit_reserved: "Reserved bit" "Reserved" "Rsvd" "R"
335-350 ds1307: bit_day: "Weekday: Friday" "WD: Friday" "WD" "W"
358-398 ds1307: reg_date: "Date" "D"
358-363 ds1307: bit_reserved: "Reserved bit" "Reserved" "Rsvd" "R"
363-368 ds1307: bit_reserved: "Reserved bit" "Reserved" "Rsvd" "R"
368-398 ds1307: bit_date: "Date: 2" "D: 2" "D"
406-446 ds1307: reg_month: "Month" "Mon" "M"
406-411 ds1307: bit_reserved: "Reserved bit" "Reserved" "Rsvd" "R"
411-416 ds1307: bit_reserved: "Reserved bit" "Reserved" "Rsvd" "R"
416-421 ds1307: bit_reserved: "Reserved bit" "Reserved" "Rsvd" "R"
421-446 ds1307: bit_month: "Month: 2" "Mon: 2" "M: 2" "M"
454-494 ds1307: reg_year: "Year" "Y"
454-494 ds1307: bit_year: "Year: 19" "Y: 19" "Y"
501-541 ds1307: reg_control: "Control" "Ctrl" "C"
506-511 ds1307: bit_reserved: "Reserved bit" "Reserved" "Rsvd" "R"
511-516 ds1307: bit_reserved: "Reserved bit" "Reserved" "Rsvd" "R"
521-526 ds1307: bit_reserved: "Reserved bit" "Reserved" "Rsvd" "R"
526-531 ds1307: bit_reserved: "Reserved bit" "Reserved" "Rsvd" "R"
501-506 ds1307: bit_out: "Output control: 0" "OUT: 0" "O: 0" "O"
516-521 ds1307: bit_sqwe: "Square wave output: disabled" "SQWE: disabled" "SQWE: 0" "S: 0" "S"
531-541 ds1307: bit_rs: "Square wave output rate: 32768Hz" "Square wave rate: 32768Hz" "SQW rate: 32768Hz" "Rate: 32768Hz" "RS: 0" "RS" "R"
10-552 ds1307: read_date_time: "Read date/time: Friday, 02.02.2019 08:39:41"
