4568584-4573071 cec: st: "ST"
4573071-4575452 cec: bit: "0"
4575452-4577833 cec: bit: "0"
4577833-4580214 cec: bit: "0"
4580214-4582595 cec: bit: "0"
4582595-4584976 cec: bit: "0"
4584976-4587357 cec: bit: "1"
4587357-4589738 cec: bit: "0"
4589738-4592119 cec: bit: "1"
4573071-4592119 cec: byte: "0x05"
4592119-4594500 cec: eom-0: "EOM=N"
4594500-4596880 cec: ack: "ACK"
4596880-4599261 cec: bit: "0"
4599261-4601642 cec: bit: "1"
4601642-4604023 cec: bit: "1"
4604023-4606404 cec: bit: "1"
4606404-4608785 cec: bit: "0"
4608785-4611166 cec: bit: "0"
4611166-4613547 cec: bit: "0"
4613547-4615928 cec: bit: "0"
4596880-4615928 cec: byte: "0x70"
4615928-4618309 cec: eom-0: "EOM=N"
4618309-4620690 cec: ack: "ACK"
4620690-4623071 cec: bit: "0"
4623071-4625452 cec: bit: "0"
4625452-4627833 cec: bit: "1"
4627833-4630214 cec: bit: "1"
4630214-4632595 cec: bit: "0"
4632595-4634976 cec: bit: "0"
4634976-4637357 cec: bit: "0"
4637357-4639738 cec: bit: "0"
4620690-4639738 cec: byte: "0x30"
4639738-4642119 cec: eom-0: "EOM=N"
4642119-4644500 cec: ack: "ACK"
4644500-4646881 cec: bit: "0"
4646881-4649262 cec: bit: "0"
4649262-4651643 cec: bit: "0"
4651643-4654024 cec: bit: "0"
4654024-4656405 cec: bit: "0"
4656405-4658786 cec: bit: "0"
4658786-4661167 cec: bit: "0"
4661167-4663548 cec: bit: "0"
4644500-4663548 cec: byte: "0x00"
4663548-4665929 cec: eom-1: "EOM=Y"
4665929-4670029 cec: ack: "ACK"
4573071-4665929 cec: frame: "05:70:30:00"
4573071-4665929 cec: section: "HDR: TV, AudioSystem | OPC: SYSTEM_AUDIO_MODE_REQUEST | OPS: 0x30, 0x00 | R: ACK"
4682761-4687267 cec: st: "ST"
4687267-4689673 cec: bit: "0"
4689673-4692079 cec: bit: "1"
4692079-4694485 cec: bit: "0"
4694485-4696891 cec: bit: "1"
4696891-4699297 cec: bit: "1"
4699297-4701703 cec: bit: "1"
4701703-4704109 cec: bit: "1"
4704109-4706515 cec: bit: "1"
4687267-4706515 cec: byte: "0x5f"
4706515-4708921 cec: eom-0: "EOM=N"
4708921-4711327 cec: ack: "ACK"
4711327-4713732 cec: bit: "0"
4713732-4716138 cec: bit: "1"
4716138-4718544 cec: bit: "1"
4718544-4720950 cec: bit: "1"
4720950-4723356 cec: bit: "0"
4723356-4725762 cec: bit: "0"
4725762-4728168 cec: bit: "1"
4728168-4730574 cec: bit: "0"
4711327-4730574 cec: byte: "0x72"
4730574-4732980 cec: eom-0: "EOM=N"
4732980-4735386 cec: ack: "ACK"
4735386-4737792 cec: bit: "0"
4737792-4740198 cec: bit: "0"
4740198-4742604 cec: bit: "0"
4742604-4745010 cec: bit: "0"
4745010-4747416 cec: bit: "0"
4747416-4749821 cec: bit: "0"
4749821-4752227 cec: bit: "0"
4752227-4754633 cec: bit: "1"
4735386-4754633 cec: byte: "0x01"
4754633-4757039 cec: eom-1: "EOM=Y"
4757039-4761139 cec: ack: "ACK"
4687267-4757039 cec: frame: "5f:72:01"
4687267-4757039 cec: section: "HDR: AudioSystem, Broadcast | OPC: SET_SYSTEM_AUDIO_MODE | OPS: 0x01 | R: ACK"
4771455-4775942 cec: st: "ST"
4775942-4778323 cec: bit: "0"
4778323-4780704 cec: bit: "0"
4780704-4783085 cec: bit: "0"
4783085-4785466 cec: bit: "0"
4785466-4787847 cec: bit: "0"
4787847-4790228 cec: bit: "1"
4790228-4792609 cec: bit: "0"
4792609-4794990 cec: bit: "1"
4775942-4794990 cec: byte: "0x05"
4794990-4797371 cec: eom-0: "EOM=N"
4797371-4799752 cec: ack: "ACK"
4799752-4802133 cec: bit: "0"
4802133-4804514 cec: bit: "1"
4804514-4806895 cec: bit: "1"
4806895-4809276 cec: bit: "1"
4809276-4811657 cec: bit: "0"
4811657-4814038 cec: bit: "0"
4814038-4816419 cec: bit: "0"
4816419-4818800 cec: bit: "1"
4799752-4818800 cec: byte: "0x71"
4818800-4821181 cec: eom-1: "EOM=Y"
4821181-4825281 cec: ack: "ACK"
4775942-4821181 cec: frame: "05:71"
4775942-4821181 cec: section: "HDR: TV, AudioSystem | OPC: GIVE_AUDIO_STATUS | R: ACK"
4857807-4862313 cec: st: "ST"
4862313-4864719 cec: bit: "0"
4864719-4867125 cec: bit: "1"
4867125-4869532 cec: bit: "0"
4869532-4871937 cec: bit: "1"
4871937-4874343 cec: bit: "0"
4874343-4876749 cec: bit: "0"
4876749-4879155 cec: bit: "0"
4879155-4881561 cec: bit: "0"
4862313-4881561 cec: byte: "0x50"
4881561-4883967 cec: eom-0: "EOM=N"
4883967-4886373 cec: ack: "ACK"
4886373-4888779 cec: bit: "0"
4888779-4891185 cec: bit: "1"
4891185-4893591 cec: bit: "1"
4893591-4895997 cec: bit: "1"
4895997-4898403 cec: bit: "1"
4898403-4900809 cec: bit: "0"
4900809-4903215 cec: bit: "1"
4903215-4905620 cec: bit: "0"
4886373-4905620 cec: byte: "0x7a"
4905620-4908026 cec: eom-0: "EOM=N"
4908026-4910432 cec: ack: "ACK"
4910432-4912838 cec: bit: "0"
4912838-4915244 cec: bit: "0"
4915244-4917650 cec: bit: "0"
4917650-4920056 cec: bit: "1"
4920056-4922462 cec: bit: "0"
4922462-4924868 cec: bit: "0"
4924868-4927274 cec: bit: "0"
4927274-4929680 cec: bit: "1"
4910432-4929680 cec: byte: "0x11"
4929680-4932086 cec: eom-1: "EOM=Y"
4932086-4936186 cec: ack: "ACK"
4862313-4932086 cec: frame: "50:7a:11"
4862313-4932086 cec: section: "HDR: AudioSystem, TV | OPC: REPORT_AUDIO_STATUS | OPS: 0x11 | R: ACK"
9651874-9656361 cec: st: "ST"
9656361-9658742 cec: bit: "0"
9658742-9661123 cec: bit: "0"
9661123-9663504 cec: bit: "0"
9663504-9665885 cec: bit: "0"
9665885-9668266 cec: bit: "0"
9668266-9670647 cec: bit: "0"
9670647-9673028 cec: bit: "0"
9673028-9675409 cec: bit: "1"
9656361-9675409 cec: byte: "0x01"
9675409-9677790 cec: eom-1: "EOM=Y"
9677790-9681890 cec: nack: "NACK"
9656361-9677790 cec: frame: "01"
9656361-9677790 cec: section: "HDR: TV, Recording_1 | OPC: PING | R: NACK"
9687436-9691923 cec: st: "ST"
9691923-9694304 cec: bit: "0"
9694304-9696685 cec: bit: "0"
9696685-9699066 cec: bit: "0"
9699066-9701447 cec: bit: "0"
9701447-9703828 cec: bit: "0"
9703828-9706209 cec: bit: "0"
9706209-9708590 cec: bit: "0"
9708590-9710971 cec: bit: "1"
9691923-9710971 cec: byte: "0x01"
9710971-9713352 cec: eom-1: "EOM=Y"
9713352-9717452 cec: nack: "NACK"
9691923-9713352 cec: frame: "01"
9691923-9713352 cec: section: "HDR: TV, Recording_1 | OPC: PING | R: NACK"
9732613-9737100 cec: st: "ST"
9737100-9739481 cec: bit: "0"
9739481-9741862 cec: bit: "0"
9741862-9744243 cec: bit: "0"
9744243-9746624 cec: bit: "0"
9746624-9749005 cec: bit: "0"
9749005-9751386 cec: bit: "0"
9751386-9753767 cec: bit: "1"
9753767-9756148 cec: bit: "0"
9737100-9756148 cec: byte: "0x02"
9756148-9758529 cec: eom-1: "EOM=Y"
9758529-9762629 cec: nack: "NACK"
9737100-9758529 cec: frame: "02"
9737100-9758529 cec: section: "HDR: TV, Recording_2 | OPC: PING | R: NACK"
9768175-9772662 cec: st: "ST"
9772662-9775043 cec: bit: "0"
9775043-9777424 cec: bit: "0"
9777424-9779805 cec: bit: "0"
9779805-9782186 cec: bit: "0"
9782186-9784567 cec: bit: "0"
9784567-9786948 cec: bit: "0"
9786948-9789329 cec: bit: "1"
9789329-9791710 cec: bit: "0"
9772662-9791710 cec: byte: "0x02"
9791710-9794091 cec: eom-1: "EOM=Y"
9794091-9798191 cec: nack: "NACK"
9772662-9794091 cec: frame: "02"
9772662-9794091 cec: section: "HDR: TV, Recording_2 | OPC: PING | R: NACK"
9813353-9817840 cec: st: "ST"
9817840-9820221 cec: bit: "0"
9820221-9822602 cec: bit: "0"
9822602-9824983 cec: bit: "0"
9824983-9827364 cec: bit: "0"
9827364-9829745 cec: bit: "0"
9829745-9832126 cec: bit: "0"
9832126-9834507 cec: bit: "1"
9834507-9836888 cec: bit: "1"
9817840-9836888 cec: byte: "0x03"
9836888-9839269 cec: eom-1: "EOM=Y"
9839269-9843369 cec: nack: "NACK"
9817840-9839269 cec: frame: "03"
9817840-9839269 cec: section: "HDR: TV, Tuner_1 | OPC: PING | R: NACK"
9848915-9853402 cec: st: "ST"
9853402-9855783 cec: bit: "0"
9855783-9858164 cec: bit: "0"
9858164-9860545 cec: bit: "0"
9860545-9862926 cec: bit: "0"
9862926-9865307 cec: bit: "0"
9865307-9867688 cec: bit: "0"
9867688-9870069 cec: bit: "1"
9870069-9872450 cec: bit: "1"
9853402-9872450 cec: byte: "0x03"
9872450-9874831 cec: eom-1: "EOM=Y"
9874831-9878931 cec: nack: "NACK"
9853402-9874831 cec: frame: "03"
9853402-9874831 cec: section: "HDR: TV, Tuner_1 | OPC: PING | R: NACK"
9894092-9898579 cec: st: "ST"
9898579-9900960 cec: bit: "0"
9900960-9903341 cec: bit: "0"
9903341-9905722 cec: bit: "0"
9905722-9908103 cec: bit: "0"
9908103-9910484 cec: bit: "0"
9910484-9912865 cec: bit: "1"
9912865-9915246 cec: bit: "0"
9915246-9917627 cec: bit: "0"
9898579-9917627 cec: byte: "0x04"
9917627-9920008 cec: eom-1: "EOM=Y"
9920008-9924108 cec: nack: "NACK"
9898579-9920008 cec: frame: "04"
9898579-9920008 cec: section: "HDR: TV, Playback_1 | OPC: PING | R: NACK"
9929654-9934141 cec: st: "ST"
9934141-9936522 cec: bit: "0"
9936522-9938903 cec: bit: "0"
9938903-9941284 cec: bit: "0"
9941284-9943665 cec: bit: "0"
9943665-9946046 cec: bit: "0"
9946046-9948427 cec: bit: "1"
9948427-9950808 cec: bit: "0"
9950808-9953189 cec: bit: "0"
9934141-9953189 cec: byte: "0x04"
9953189-9955570 cec: eom-1: "EOM=Y"
9955570-9959670 cec: nack: "NACK"
9934141-9955570 cec: frame: "04"
9934141-9955570 cec: section: "HDR: TV, Playback_1 | OPC: PING | R: NACK"
9974831-9979319 cec: st: "ST"
9979319-9981700 cec: bit: "0"
9981700-9984081 cec: bit: "0"
9984081-9986462 cec: bit: "0"
9986462-9988843 cec: bit: "0"
9988843-9991224 cec: bit: "0"
9991224-9993605 cec: bit: "1"
9993605-9995986 cec: bit: "0"
9995986-9998367 cec: bit: "1"
9979319-9998367 cec: byte: "0x05"
9998367-10000747 cec: eom-1: "EOM=Y"
10000747-10004847 cec: ack: "ACK"
9979319-10000747 cec: frame: "05"
9979319-10000747 cec: section: "HDR: TV, AudioSystem | OPC: PING | R: ACK"
10020009-10024496 cec: st: "ST"
10024496-10026877 cec: bit: "0"
10026877-10029258 cec: bit: "0"
10029258-10031639 cec: bit: "0"
10031639-10034020 cec: bit: "0"
10034020-10036401 cec: bit: "0"
10036401-10038782 cec: bit: "1"
10038782-10041163 cec: bit: "1"
10041163-10043544 cec: bit: "0"
10024496-10043544 cec: byte: "0x06"
10043544-10045925 cec: eom-1: "EOM=Y"
10045925-10050025 cec: nack: "NACK"
10024496-10045925 cec: frame: "06"
10024496-10045925 cec: section: "HDR: TV, Tuner2 | OPC: PING | R: NACK"
10055571-10060058 cec: st: "ST"
10060058-10062439 cec: bit: "0"
10062439-10064820 cec: bit: "0"
10064820-10067201 cec: bit: "0"
10067201-10069582 cec: bit: "0"
10069582-10071963 cec: bit: "0"
10071963-10074344 cec: bit: "1"
10074344-10076725 cec: bit: "1"
10076725-10079106 cec: bit: "0"
10060058-10079106 cec: byte: "0x06"
10079106-10081487 cec: eom-1: "EOM=Y"
10081487-10085587 cec: nack: "NACK"
10060058-10081487 cec: frame: "06"
10060058-10081487 cec: section: "HDR: TV, Tuner2 | OPC: PING | R: NACK"
10100748-10105236 cec: st: "ST"
10105236-10107617 cec: bit: "0"
10107617-10109998 cec: bit: "0"
10109998-10112379 cec: bit: "0"
10112379-10114760 cec: bit: "0"
10114760-10117141 cec: bit: "0"
10117141-10119522 cec: bit: "1"
10119522-10121902 cec: bit: "1"
10121902-10124283 cec: bit: "1"
10105236-10124283 cec: byte: "0x07"
10124283-10126664 cec: eom-1: "EOM=Y"
10126664-10130764 cec: nack: "NACK"
10105236-10126664 cec: frame: "07"
10105236-10126664 cec: section: "HDR: TV, Tuner3 | OPC: PING | R: NACK"
10136310-10140798 cec: st: "ST"
10140798-10143179 cec: bit: "0"
10143179-10145560 cec: bit: "0"
10145560-10147941 cec: bit: "0"
10147941-10150322 cec: bit: "0"
10150322-10152703 cec: bit: "0"
10152703-10155083 cec: bit: "1"
10155083-10157464 cec: bit: "1"
10157464-10159845 cec: bit: "1"
10140798-10159845 cec: byte: "0x07"
10159845-10162226 cec: eom-1: "EOM=Y"
10162226-10166326 cec: nack: "NACK"
10140798-10162226 cec: frame: "07"
10140798-10162226 cec: section: "HDR: TV, Tuner3 | OPC: PING | R: NACK"
10181488-10185975 cec: st: "ST"
10185975-10188356 cec: bit: "0"
10188356-10190737 cec: bit: "0"
10190737-10193118 cec: bit: "0"
10193118-10195499 cec: bit: "0"
10195499-10197880 cec: bit: "1"
10197880-10200261 cec: bit: "0"
10200261-10202642 cec: bit: "0"
10202642-10205023 cec: bit: "0"
10185975-10205023 cec: byte: "0x08"
10205023-10207404 cec: eom-1: "EOM=Y"
10207404-10211504 cec: nack: "NACK"
10185975-10207404 cec: frame: "08"
10185975-10207404 cec: section: "HDR: TV, Playback_2 | OPC: PING | R: NACK"
10217050-10221537 cec: st: "ST"
10221537-10223918 cec: bit: "0"
10223918-10226299 cec: bit: "0"
10226299-10228680 cec: bit: "0"
10228680-10231061 cec: bit: "0"
10231061-10233442 cec: bit: "1"
10233442-10235823 cec: bit: "0"
10235823-10238204 cec: bit: "0"
10238204-10240585 cec: bit: "0"
10221537-10240585 cec: byte: "0x08"
10240585-10242966 cec: eom-1: "EOM=Y"
10242966-10247066 cec: nack: "NACK"
10221537-10242966 cec: frame: "08"
10221537-10242966 cec: section: "HDR: TV, Playback_2 | OPC: PING | R: NACK"
10262227-10266715 cec: st: "ST"
10266715-10269096 cec: bit: "0"
10269096-10271477 cec: bit: "0"
10271477-10273858 cec: bit: "0"
10273858-10276238 cec: bit: "0"
10276238-10278619 cec: bit: "1"
10278619-10281000 cec: bit: "0"
10281000-10283381 cec: bit: "0"
10283381-10285762 cec: bit: "1"
10266715-10285762 cec: byte: "0x09"
10285762-10288143 cec: eom-1: "EOM=Y"
10288143-10292243 cec: nack: "NACK"
10266715-10288143 cec: frame: "09"
10266715-10288143 cec: section: "HDR: TV, Recording_3 | OPC: PING | R: NACK"
10297789-10302277 cec: st: "ST"
10302277-10304658 cec: bit: "0"
10304658-10307039 cec: bit: "0"
10307039-10309420 cec: bit: "0"
10309420-10311800 cec: bit: "0"
10311800-10314181 cec: bit: "1"
10314181-10316562 cec: bit: "0"
10316562-10318943 cec: bit: "0"
10318943-10321324 cec: bit: "1"
10302277-10321324 cec: byte: "0x09"
10321324-10323705 cec: eom-1: "EOM=Y"
10323705-10327805 cec: nack: "NACK"
10302277-10323705 cec: frame: "09"
10302277-10323705 cec: section: "HDR: TV, Recording_3 | OPC: PING | R: NACK"
10342967-10347454 cec: st: "ST"
10347454-10349835 cec: bit: "0"
10349835-10352216 cec: bit: "0"
10352216-10354597 cec: bit: "0"
10354597-10356978 cec: bit: "0"
10356978-10359359 cec: bit: "1"
10359359-10361740 cec: bit: "0"
10361740-10364121 cec: bit: "1"
10364121-10366502 cec: bit: "0"
10347454-10366502 cec: byte: "0x0a"
10366502-10368883 cec: eom-1: "EOM=Y"
10368883-10372983 cec: nack: "NACK"
10347454-10368883 cec: frame: "0a"
10347454-10368883 cec: section: "HDR: TV, Tuner_4 | OPC: PING | R: NACK"
10378529-10383016 cec: st: "ST"
10383016-10385397 cec: bit: "0"
10385397-10387778 cec: bit: "0"
10387778-10390159 cec: bit: "0"
10390159-10392540 cec: bit: "0"
10392540-10394921 cec: bit: "1"
10394921-10397302 cec: bit: "0"
10397302-10399683 cec: bit: "1"
10399683-10402064 cec: bit: "0"
10383016-10402064 cec: byte: "0x0a"
10402064-10404445 cec: eom-1: "EOM=Y"
10404445-10408545 cec: nack: "NACK"
10383016-10404445 cec: frame: "0a"
10383016-10404445 cec: section: "HDR: TV, Tuner_4 | OPC: PING | R: NACK"
10423706-10428194 cec: st: "ST"
10428194-10430575 cec: bit: "0"
10430575-10432955 cec: bit: "0"
10432955-10435336 cec: bit: "0"
10435336-10437717 cec: bit: "0"
10437717-10440098 cec: bit: "1"
10440098-10442479 cec: bit: "0"
10442479-10444860 cec: bit: "1"
10444860-10447241 cec: bit: "1"
10428194-10447241 cec: byte: "0x0b"
10447241-10449622 cec: eom-1: "EOM=Y"
10449622-10453722 cec: nack: "NACK"
10428194-10449622 cec: frame: "0b"
10428194-10449622 cec: section: "HDR: TV, Playback_3 | OPC: PING | R: NACK"
10459268-10463756 cec: st: "ST"
10463756-10466137 cec: bit: "0"
10466137-10468517 cec: bit: "0"
10468517-10470898 cec: bit: "0"
10470898-10473279 cec: bit: "0"
10473279-10475660 cec: bit: "1"
10475660-10478041 cec: bit: "0"
10478041-10480422 cec: bit: "1"
10480422-10482803 cec: bit: "1"
10463756-10482803 cec: byte: "0x0b"
10482803-10485184 cec: eom-1: "EOM=Y"
10485184-10489284 cec: nack: "NACK"
10463756-10485184 cec: frame: "0b"
10463756-10485184 cec: section: "HDR: TV, Playback_3 | OPC: PING | R: NACK"
10504446-10508933 cec: st: "ST"
10508933-10511314 cec: bit: "0"
10511314-10513695 cec: bit: "0"
10513695-10516076 cec: bit: "0"
10516076-10518457 cec: bit: "0"
10518457-10520838 cec: bit: "1"
10520838-10523219 cec: bit: "1"
10523219-10525600 cec: bit: "0"
10525600-10527981 cec: bit: "0"
10508933-10527981 cec: byte: "0x0c"
10527981-10530362 cec: eom-1: "EOM=Y"
10530362-10534462 cec: nack: "NACK"
10508933-10530362 cec: frame: "0c"
10508933-10530362 cec: section: "HDR: TV, Backup_1 | OPC: PING | R: NACK"
10540008-10544495 cec: st: "ST"
10544495-10546876 cec: bit: "0"
10546876-10549257 cec: bit: "0"
10549257-10551638 cec: bit: "0"
10551638-10554019 cec: bit: "0"
10554019-10556400 cec: bit: "1"
10556400-10558781 cec: bit: "1"
10558781-10561162 cec: bit: "0"
10561162-10563543 cec: bit: "0"
10544495-10563543 cec: byte: "0x0c"
10563543-10565924 cec: eom-1: "EOM=Y"
10565924-10570024 cec: nack: "NACK"
10544495-10565924 cec: frame: "0c"
10544495-10565924 cec: section: "HDR: TV, Backup_1 | OPC: PING | R: NACK"
10585185-10589672 cec: st: "ST"
10589672-10592053 cec: bit: "0"
10592053-10594434 cec: bit: "0"
10594434-10596815 cec: bit: "0"
10596815-10599196 cec: bit: "0"
10599196-10601577 cec: bit: "1"
10601577-10603958 cec: bit: "1"
10603958-10606339 cec: bit: "0"
10606339-10608720 cec: bit: "1"
10589672-10608720 cec: byte: "0x0d"
10608720-10611101 cec: eom-1: "EOM=Y"
10611101-10615201 cec: nack: "NACK"
10589672-10611101 cec: frame: "0d"
10589672-10611101 cec: section: "HDR: TV, Backup_2 | OPC: PING | R: NACK"
10620747-10625234 cec: st: "ST"
10625234-10627615 cec: bit: "0"
10627615-10629996 cec: bit: "0"
10629996-10632377 cec: bit: "0"
10632377-10634758 cec: bit: "0"
10634758-10637139 cec: bit: "1"
10637139-10639520 cec: bit: "1"
10639520-10641901 cec: bit: "0"
10641901-10644282 cec: bit: "1"
10625234-10644282 cec: byte: "0x0d"
10644282-10646663 cec: eom-1: "EOM=Y"
10646663-10650763 cec: nack: "NACK"
10625234-10646663 cec: frame: "0d"
10625234-10646663 cec: section: "HDR: TV, Backup_2 | OPC: PING | R: NACK"
10665925-10670412 cec: st: "ST"
10670412-10672793 cec: bit: "0"
10672793-10675174 cec: bit: "0"
10675174-10677555 cec: bit: "0"
10677555-10679936 cec: bit: "0"
10679936-10682317 cec: bit: "1"
10682317-10684698 cec: bit: "1"
10684698-10687079 cec: bit: "1"
10687079-10689460 cec: bit: "0"
10670412-10689460 cec: byte: "0x0e"
10689460-10691841 cec: eom-1: "EOM=Y"
10691841-10695941 cec: nack: "NACK"
10670412-10691841 cec: frame: "0e"
10670412-10691841 cec: section: "HDR: TV, FreeUse | OPC: PING | R: NACK"
10701487-10705974 cec: st: "ST"
10705974-10708355 cec: bit: "0"
10708355-10710736 cec: bit: "0"
10710736-10713117 cec: bit: "0"
10713117-10715498 cec: bit: "0"
10715498-10717879 cec: bit: "1"
10717879-10720260 cec: bit: "1"
10720260-10722641 cec: bit: "1"
10722641-10725022 cec: bit: "0"
10705974-10725022 cec: byte: "0x0e"
10725022-10727403 cec: eom-1: "EOM=Y"
10727403-10731503 cec: nack: "NACK"
10705974-10727403 cec: frame: "0e"
10705974-10727403 cec: section: "HDR: TV, FreeUse | OPC: PING | R: NACK"
