385306-389793 cec: st: "ST"
389793-392174 cec: bit: "0"
392174-394555 cec: bit: "0"
394555-396936 cec: bit: "0"
396936-399317 cec: bit: "0"
399317-401698 cec: bit: "0"
401698-404079 cec: bit: "1"
404079-406460 cec: bit: "0"
406460-408841 cec: bit: "1"
389793-408841 cec: byte: "0x05"
408841-411222 cec: eom-1: "EOM=Y"
411222-415322 cec: ack: "ACK"
389793-411222 cec: frame: "05"
389793-411222 cec: section: "HDR: TV, AudioSystem | OPC: PING | R: ACK"
3091584-3096071 cec: st: "ST"
3096071-3098452 cec: bit: "0"
3098452-3100833 cec: bit: "0"
3100833-3103214 cec: bit: "0"
3103214-3105595 cec: bit: "0"
3105595-3107976 cec: bit: "0"
3107976-3110357 cec: bit: "1"
3110357-3112738 cec: bit: "0"
3112738-3115119 cec: bit: "1"
3096071-3115119 cec: byte: "0x05"
3115119-3117500 cec: eom-0: "EOM=N"
3117500-3119881 cec: ack: "ACK"
3119881-3122262 cec: bit: "1"
3122262-3124643 cec: bit: "1"
3124643-3127024 cec: bit: "0"
3127024-3129405 cec: bit: "0"
3129405-3131786 cec: bit: "0"
3131786-3134167 cec: bit: "1"
3134167-3136548 cec: bit: "0"
3136548-3138929 cec: bit: "0"
3119881-3138929 cec: byte: "0xc4"
3138929-3141310 cec: eom-1: "EOM=Y"
3141310-3145410 cec: ack: "ACK"
3096071-3141310 cec: frame: "05:c4"
3096071-3141310 cec: section: "HDR: TV, AudioSystem | OPC: Invalid | R: ACK"
3158605-3163111 cec: st: "ST"
3163111-3165517 cec: bit: "0"
3165517-3167923 cec: bit: "1"
3167923-3170329 cec: bit: "0"
3170329-3172735 cec: bit: "1"
3172735-3175141 cec: bit: "0"
3175141-3177547 cec: bit: "0"
3177547-3179953 cec: bit: "0"
3179953-3182359 cec: bit: "0"
3163111-3182359 cec: byte: "0x50"
3182359-3184765 cec: eom-0: "EOM=N"
3184765-3187171 cec: ack: "ACK"
3187171-3189577 cec: bit: "1"
3189577-3191982 cec: bit: "0"
3191982-3194388 cec: bit: "0"
3194388-3196794 cec: bit: "0"
3196794-3199200 cec: bit: "1"
3199200-3201606 cec: bit: "1"
3201606-3204012 cec: bit: "0"
3204012-3206418 cec: bit: "0"
3187171-3206418 cec: byte: "0x8c"
3206418-3208824 cec: eom-1: "EOM=Y"
3208824-3212924 cec: ack: "ACK"
3163111-3208824 cec: frame: "50:8c"
3163111-3208824 cec: section: "HDR: AudioSystem, TV | OPC: GIVE_DEVICE_VENDOR_ID | R: ACK"
3223239-3227727 cec: st: "ST"
3227727-3230108 cec: bit: "0"
3230108-3232489 cec: bit: "0"
3232489-3234869 cec: bit: "0"
3234869-3237250 cec: bit: "0"
3237250-3239631 cec: bit: "1"
3239631-3242012 cec: bit: "1"
3242012-3244393 cec: bit: "1"
3244393-3246774 cec: bit: "1"
3227727-3246774 cec: byte: "0x0f"
3246774-3249155 cec: eom-0: "EOM=N"
3249155-3251536 cec: ack: "ACK"
3251536-3253917 cec: bit: "0"
3253917-3256298 cec: bit: "0"
3256298-3258679 cec: bit: "1"
3258679-3261060 cec: bit: "1"
3261060-3263441 cec: bit: "0"
3263441-3265822 cec: bit: "1"
3265822-3268203 cec: bit: "1"
3268203-3270584 cec: bit: "0"
3251536-3270584 cec: byte: "0x36"
3270584-3272965 cec: eom-1: "EOM=Y"
3272965-3277065 cec: ack: "ACK"
3227727-3272965 cec: frame: "0f:36"
3227727-3272965 cec: section: "HDR: TV, Broadcast | OPC: STANDBY | R: ACK"
3292226-3296714 cec: st: "ST"
3296714-3299095 cec: bit: "0"
3299095-3301476 cec: bit: "0"
3301476-3303857 cec: bit: "0"
3303857-3306238 cec: bit: "0"
3306238-3308619 cec: bit: "1"
3308619-3310999 cec: bit: "1"
3310999-3313380 cec: bit: "1"
3313380-3315761 cec: bit: "1"
3296714-3315761 cec: byte: "0x0f"
3315761-3318142 cec: eom-0: "EOM=N"
3318142-3320523 cec: ack: "ACK"
3320523-3322904 cec: bit: "1"
3322904-3325285 cec: bit: "0"
3325285-3327666 cec: bit: "1"
3327666-3330047 cec: bit: "0"
3330047-3332428 cec: bit: "0"
3332428-3334809 cec: bit: "0"
3334809-3337190 cec: bit: "0"
3337190-3339571 cec: bit: "0"
3320523-3339571 cec: byte: "0xa0"
3339571-3341952 cec: eom-0: "EOM=N"
3341952-3344333 cec: ack: "ACK"
3344333-3346714 cec: bit: "0"
3346714-3349095 cec: bit: "0"
3349095-3351476 cec: bit: "0"
3351476-3353857 cec: bit: "0"
3353857-3356238 cec: bit: "1"
3356238-3358619 cec: bit: "0"
3358619-3361000 cec: bit: "0"
3361000-3363381 cec: bit: "0"
3344333-3363381 cec: byte: "0x08"
3363381-3365762 cec: eom-0: "EOM=N"
3365762-3368143 cec: ack: "ACK"
3368143-3370524 cec: bit: "0"
3370524-3372905 cec: bit: "0"
3372905-3375286 cec: bit: "0"
3375286-3377667 cec: bit: "0"
3377667-3380048 cec: bit: "0"
3380048-3382429 cec: bit: "0"
3382429-3384810 cec: bit: "0"
3384810-3387191 cec: bit: "0"
3368143-3387191 cec: byte: "0x00"
3387191-3389572 cec: eom-0: "EOM=N"
3389572-3391952 cec: ack: "ACK"
3391952-3394333 cec: bit: "0"
3394333-3396714 cec: bit: "1"
3396714-3399095 cec: bit: "0"
3399095-3401476 cec: bit: "0"
3401476-3403857 cec: bit: "0"
3403857-3406238 cec: bit: "1"
3406238-3408619 cec: bit: "1"
3408619-3411000 cec: bit: "0"
3391952-3411000 cec: byte: "0x46"
3411000-3413381 cec: eom-0: "EOM=N"
3413381-3415762 cec: ack: "ACK"
3415762-3418143 cec: bit: "0"
3418143-3420524 cec: bit: "0"
3420524-3422905 cec: bit: "0"
3422905-3425286 cec: bit: "0"
3425286-3427667 cec: bit: "0"
3427667-3430048 cec: bit: "0"
3430048-3432429 cec: bit: "0"
3432429-3434810 cec: bit: "0"
3415762-3434810 cec: byte: "0x00"
3434810-3437191 cec: eom-0: "EOM=N"
3437191-3439572 cec: ack: "ACK"
3439572-3441953 cec: bit: "0"
3441953-3444334 cec: bit: "0"
3444334-3446715 cec: bit: "0"
3446715-3449096 cec: bit: "0"
3449096-3451477 cec: bit: "1"
3451477-3453858 cec: bit: "0"
3453858-3456239 cec: bit: "0"
3456239-3458620 cec: bit: "1"
3439572-3458620 cec: byte: "0x09"
3458620-3461001 cec: eom-0: "EOM=N"
3461001-3463382 cec: ack: "ACK"
3463382-3465763 cec: bit: "0"
3465763-3468144 cec: bit: "0"
3468144-3470524 cec: bit: "0"
3470524-3472905 cec: bit: "0"
3472905-3475286 cec: bit: "0"
3475286-3477667 cec: bit: "0"
3477667-3480048 cec: bit: "0"
3480048-3482429 cec: bit: "0"
3463382-3482429 cec: byte: "0x00"
3482429-3484810 cec: eom-0: "EOM=N"
3484810-3487191 cec: ack: "ACK"
3487191-3489572 cec: bit: "0"
3489572-3491953 cec: bit: "0"
3491953-3494334 cec: bit: "0"
3494334-3496715 cec: bit: "0"
3496715-3499096 cec: bit: "0"
3499096-3501477 cec: bit: "0"
3501477-3503858 cec: bit: "0"
3503858-3506239 cec: bit: "1"
3487191-3506239 cec: byte: "0x01"
3506239-3508620 cec: eom-1: "EOM=Y"
3508620-3512720 cec: ack: "ACK"
3296714-3508620 cec: frame: "0f:a0:08:00:46:00:09:00:01"
3296714-3508620 cec: section: "HDR: TV, Broadcast | OPC: VENDOR_COMMAND_WITH_ID | OPS: 0x08, 0x00, 0x46, 0x00, 0x09, 0x00, 0x01 | R: ACK"
3524696-3529202 cec: st: "ST"
3529202-3531608 cec: bit: "0"
3531608-3534014 cec: bit: "1"
3534014-3536420 cec: bit: "0"
3536420-3538826 cec: bit: "1"
3538826-3541232 cec: bit: "0"
3541232-3543638 cec: bit: "0"
3543638-3546044 cec: bit: "0"
3546044-3548450 cec: bit: "0"
3529202-3548450 cec: byte: "0x50"
3548450-3550856 cec: eom-0: "EOM=N"
3550856-3553262 cec: ack: "ACK"
3553262-3555667 cec: bit: "1"
3555667-3558073 cec: bit: "1"
3558073-3560479 cec: bit: "0"
3560479-3562885 cec: bit: "0"
3562885-3565291 cec: bit: "0"
3565291-3567697 cec: bit: "1"
3567697-3570103 cec: bit: "0"
3570103-3572509 cec: bit: "1"
3553262-3572509 cec: byte: "0xc5"
3572509-3574915 cec: eom-1: "EOM=Y"
3574915-3579015 cec: ack: "ACK"
3529202-3574915 cec: frame: "50:c5"
3529202-3574915 cec: section: "HDR: AudioSystem, TV | OPC: Invalid | R: ACK"
3589329-3593816 cec: st: "ST"
3593816-3596197 cec: bit: "0"
3596197-3598578 cec: bit: "0"
3598578-3600959 cec: bit: "0"
3600959-3603340 cec: bit: "0"
3603340-3605721 cec: bit: "0"
3605721-3608102 cec: bit: "1"
3608102-3610483 cec: bit: "0"
3610483-3612864 cec: bit: "1"
3593816-3612864 cec: byte: "0x05"
3612864-3615245 cec: eom-0: "EOM=N"
3615245-3617626 cec: ack: "ACK"
3617626-3620007 cec: bit: "0"
3620007-3622388 cec: bit: "0"
3622388-3624769 cec: bit: "0"
3624769-3627150 cec: bit: "0"
3627150-3629531 cec: bit: "0"
3629531-3631912 cec: bit: "0"
3631912-3634293 cec: bit: "0"
3634293-3636673 cec: bit: "0"
3617626-3636673 cec: byte: "0x00"
3636673-3639054 cec: eom-0: "EOM=N"
3639054-3641435 cec: ack: "ACK"
3641435-3643816 cec: bit: "1"
3643816-3646197 cec: bit: "1"
3646197-3648578 cec: bit: "0"
3648578-3650959 cec: bit: "0"
3650959-3653340 cec: bit: "0"
3653340-3655721 cec: bit: "1"
3655721-3658102 cec: bit: "0"
3658102-3660483 cec: bit: "1"
3641435-3660483 cec: byte: "0xc5"
3660483-3662864 cec: eom-0: "EOM=N"
3662864-3665245 cec: ack: "ACK"
3665245-3667626 cec: bit: "0"
3667626-3670007 cec: bit: "0"
3670007-3672388 cec: bit: "0"
3672388-3674769 cec: bit: "0"
3674769-3677150 cec: bit: "0"
3677150-3679531 cec: bit: "0"
3679531-3681912 cec: bit: "0"
3681912-3684293 cec: bit: "1"
3665245-3684293 cec: byte: "0x01"
3684293-3686674 cec: eom-1: "EOM=Y"
3686674-3690774 cec: ack: "ACK"
3593816-3686674 cec: frame: "05:00:c5:01"
3593816-3686674 cec: section: "HDR: TV, AudioSystem | OPC: FEATURE_ABORT | OPS: 0xc5, 0x01 | R: ACK"
3723745-3728252 cec: st: "ST"
3728252-3730657 cec: bit: "0"
3730657-3733063 cec: bit: "1"
3733063-3735469 cec: bit: "0"
3735469-3737875 cec: bit: "1"
3737875-3740281 cec: bit: "0"
3740281-3742687 cec: bit: "0"
3742687-3745093 cec: bit: "0"
3745093-3747499 cec: bit: "0"
3728252-3747499 cec: byte: "0x50"
3747499-3749905 cec: eom-0: "EOM=N"
3749905-3752311 cec: ack: "ACK"
3752311-3754717 cec: bit: "0"
3754717-3757123 cec: bit: "0"
3757123-3759529 cec: bit: "0"
3759529-3761935 cec: bit: "0"
3761935-3764340 cec: bit: "0"
3764340-3766746 cec: bit: "0"
3766746-3769152 cec: bit: "0"
3769152-3771558 cec: bit: "0"
3752311-3771558 cec: byte: "0x00"
3771558-3773964 cec: eom-0: "EOM=N"
3773964-3776370 cec: ack: "ACK"
3776370-3778776 cec: bit: "1"
3778776-3781182 cec: bit: "0"
3781182-3783588 cec: bit: "1"
3783588-3785994 cec: bit: "0"
3785994-3788400 cec: bit: "0"
3788400-3790806 cec: bit: "0"
3790806-3793212 cec: bit: "0"
3793212-3795618 cec: bit: "0"
3776370-3795618 cec: byte: "0xa0"
3795618-3798023 cec: eom-0: "EOM=N"
3798023-3800429 cec: ack: "ACK"
3800429-3802835 cec: bit: "0"
3802835-3805241 cec: bit: "0"
3805241-3807647 cec: bit: "0"
3807647-3810053 cec: bit: "0"
3810053-3812459 cec: bit: "0"
3812459-3814865 cec: bit: "0"
3814865-3817271 cec: bit: "0"
3817271-3819677 cec: bit: "0"
3800429-3819677 cec: byte: "0x00"
3819677-3822083 cec: eom-1: "EOM=Y"
3822083-3826183 cec: ack: "ACK"
3728252-3822083 cec: frame: "50:00:a0:00"
3728252-3822083 cec: section: "HDR: AudioSystem, TV | OPC: FEATURE_ABORT | OPS: 0xa0, 0x00 | R: ACK"
4304889-4309395 cec: st: "ST"
4309395-4311801 cec: bit: "0"
4311801-4314207 cec: bit: "1"
4314207-4316613 cec: bit: "0"
4316613-4319019 cec: bit: "1"
4319019-4321424 cec: bit: "0"
4321424-4323830 cec: bit: "0"
4323830-4326236 cec: bit: "0"
4326236-4328642 cec: bit: "0"
4309395-4328642 cec: byte: "0x50"
4328642-4331048 cec: eom-0: "EOM=N"
4331048-4333454 cec: ack: "ACK"
4333454-4335860 cec: bit: "1"
4335860-4338266 cec: bit: "0"
4338266-4340672 cec: bit: "0"
4340672-4343078 cec: bit: "1"
4343078-4345484 cec: bit: "1"
4345484-4347890 cec: bit: "1"
4347890-4350296 cec: bit: "1"
4350296-4352702 cec: bit: "1"
4333454-4352702 cec: byte: "0x9f"
4352702-4355107 cec: eom-1: "EOM=Y"
4355107-4359207 cec: ack: "ACK"
4309395-4355107 cec: frame: "50:9f"
4309395-4355107 cec: section: "HDR: AudioSystem, TV | OPC: GET_CEC_VERSION | R: ACK"
4369524-4374011 cec: st: "ST"
4374011-4376392 cec: bit: "0"
4376392-4378773 cec: bit: "0"
4378773-4381154 cec: bit: "0"
4381154-4383535 cec: bit: "0"
4383535-4385916 cec: bit: "0"
4385916-4388297 cec: bit: "1"
4388297-4390678 cec: bit: "0"
4390678-4393059 cec: bit: "1"
4374011-4393059 cec: byte: "0x05"
4393059-4395440 cec: eom-0: "EOM=N"
4395440-4397821 cec: ack: "ACK"
4397821-4400202 cec: bit: "1"
4400202-4402583 cec: bit: "0"
4402583-4404964 cec: bit: "0"
4404964-4407345 cec: bit: "1"
4407345-4409726 cec: bit: "1"
4409726-4412107 cec: bit: "1"
4412107-4414488 cec: bit: "1"
4414488-4416869 cec: bit: "0"
4397821-4416869 cec: byte: "0x9e"
4416869-4419250 cec: eom-0: "EOM=N"
4419250-4421631 cec: ack: "ACK"
4421631-4424012 cec: bit: "0"
4424012-4426393 cec: bit: "0"
4426393-4428773 cec: bit: "0"
4428773-4431154 cec: bit: "0"
4431154-4433535 cec: bit: "0"
4433535-4435916 cec: bit: "1"
4435916-4438297 cec: bit: "0"
4438297-4440678 cec: bit: "1"
4421631-4440678 cec: byte: "0x05"
4440678-4443059 cec: eom-1: "EOM=Y"
4443059-4447159 cec: ack: "ACK"
4374011-4443059 cec: frame: "05:9e:05"
4374011-4443059 cec: section: "HDR: TV, AudioSystem | OPC: CEC_VERSION | OPS: 0x05 | R: ACK"
4479932-4484438 cec: st: "ST"
4484438-4486844 cec: bit: "0"
4486844-4489250 cec: bit: "1"
4489250-4491656 cec: bit: "0"
4491656-4494062 cec: bit: "1"
4494062-4496468 cec: bit: "0"
4496468-4498874 cec: bit: "0"
4498874-4501280 cec: bit: "0"
4501280-4503686 cec: bit: "0"
4484438-4503686 cec: byte: "0x50"
4503686-4506092 cec: eom-0: "EOM=N"
4506092-4508497 cec: ack: "ACK"
4508497-4510903 cec: bit: "1"
4510903-4513309 cec: bit: "1"
4513309-4515715 cec: bit: "0"
4515715-4518121 cec: bit: "0"
4518121-4520527 cec: bit: "0"
4520527-4522933 cec: bit: "0"
4522933-4525339 cec: bit: "0"
4525339-4527745 cec: bit: "0"
4508497-4527745 cec: byte: "0xc0"
4527745-4530151 cec: eom-1: "EOM=Y"
4530151-4534251 cec: ack: "ACK"
4484438-4530151 cec: frame: "50:c0"
4484438-4530151 cec: section: "HDR: AudioSystem, TV | OPC: Invalid | R: ACK"
4544586-4549074 cec: st: "ST"
4549074-4551455 cec: bit: "0"
4551455-4553835 cec: bit: "0"
4553835-4556216 cec: bit: "0"
4556216-4558597 cec: bit: "0"
4558597-4560978 cec: bit: "0"
4560978-4563359 cec: bit: "1"
4563359-4565740 cec: bit: "0"
4565740-4568121 cec: bit: "1"
4549074-4568121 cec: byte: "0x05"
4568121-4570502 cec: eom-0: "EOM=N"
4570502-4572883 cec: ack: "ACK"
4572883-4575264 cec: bit: "0"
4575264-4577645 cec: bit: "0"
4577645-4580026 cec: bit: "0"
4580026-4582407 cec: bit: "0"
4582407-4584788 cec: bit: "0"
4584788-4587169 cec: bit: "0"
4587169-4589550 cec: bit: "0"
4589550-4591931 cec: bit: "0"
4572883-4591931 cec: byte: "0x00"
4591931-4594312 cec: eom-0: "EOM=N"
4594312-4596693 cec: ack: "ACK"
4596693-4599074 cec: bit: "1"
4599074-4601455 cec: bit: "1"
4601455-4603836 cec: bit: "0"
4603836-4606217 cec: bit: "0"
4606217-4608598 cec: bit: "0"
4608598-4610979 cec: bit: "0"
4610979-4613360 cec: bit: "0"
4613360-4615741 cec: bit: "0"
4596693-4615741 cec: byte: "0xc0"
4615741-4618122 cec: eom-0: "EOM=N"
4618122-4620503 cec: ack: "ACK"
4620503-4622884 cec: bit: "0"
4622884-4625265 cec: bit: "0"
4625265-4627646 cec: bit: "0"
4627646-4630027 cec: bit: "0"
4630027-4632407 cec: bit: "0"
4632407-4634788 cec: bit: "0"
4634788-4637169 cec: bit: "0"
4637169-4639550 cec: bit: "1"
4620503-4639550 cec: byte: "0x01"
4639550-4641931 cec: eom-1: "EOM=Y"
4641931-4646031 cec: ack: "ACK"
4549074-4641931 cec: frame: "05:00:c0:01"
4549074-4641931 cec: section: "HDR: TV, AudioSystem | OPC: FEATURE_ABORT | OPS: 0xc0, 0x01 | R: ACK"
4678982-4683488 cec: st: "ST"
4683488-4685894 cec: bit: "0"
4685894-4688300 cec: bit: "1"
4688300-4690706 cec: bit: "0"
4690706-4693112 cec: bit: "1"
4693112-4695518 cec: bit: "1"
4695518-4697924 cec: bit: "1"
4697924-4700330 cec: bit: "1"
4700330-4702736 cec: bit: "1"
4683488-4702736 cec: byte: "0x5f"
4702736-4705142 cec: eom-0: "EOM=N"
4705142-4707548 cec: ack: "ACK"
4707548-4709953 cec: bit: "1"
4709953-4712359 cec: bit: "0"
4712359-4714765 cec: bit: "0"
4714765-4717171 cec: bit: "0"
4717171-4719577 cec: bit: "0"
4719577-4721983 cec: bit: "0"
4721983-4724389 cec: bit: "0"
4724389-4726795 cec: bit: "0"
4707548-4726795 cec: byte: "0x80"
4726795-4729201 cec: eom-0: "EOM=N"
4729201-4731607 cec: ack: "ACK"
4731607-4734013 cec: bit: "0"
4734013-4736419 cec: bit: "0"
4736419-4738825 cec: bit: "0"
4738825-4741231 cec: bit: "1"
4741231-4743636 cec: bit: "0"
4743636-4746042 cec: bit: "0"
4746042-4748448 cec: bit: "0"
4748448-4750854 cec: bit: "0"
4731607-4750854 cec: byte: "0x10"
4750854-4753260 cec: eom-0: "EOM=N"
4753260-4755666 cec: ack: "ACK"
4755666-4758072 cec: bit: "0"
4758072-4760478 cec: bit: "0"
4760478-4762884 cec: bit: "0"
4762884-4765290 cec: bit: "0"
4765290-4767696 cec: bit: "0"
4767696-4770102 cec: bit: "0"
4770102-4772508 cec: bit: "0"
4772508-4774914 cec: bit: "0"
4755666-4774914 cec: byte: "0x00"
4774914-4777319 cec: eom-0: "EOM=N"
4777319-4779725 cec: ack: "ACK"
4779725-4782131 cec: bit: "0"
4782131-4784537 cec: bit: "0"
4784537-4786943 cec: bit: "0"
4786943-4789349 cec: bit: "1"
4789349-4791755 cec: bit: "0"
4791755-4794161 cec: bit: "0"
4794161-4796567 cec: bit: "0"
4796567-4798974 cec: bit: "1"
4779725-4798974 cec: byte: "0x11"
4798974-4801380 cec: eom-0: "EOM=N"
4801380-4803786 cec: ack: "ACK"
4803786-4806192 cec: bit: "0"
4806192-4808598 cec: bit: "0"
4808598-4811004 cec: bit: "0"
4811004-4813409 cec: bit: "0"
4813409-4815815 cec: bit: "0"
4815815-4818221 cec: bit: "0"
4818221-4820627 cec: bit: "0"
4820627-4823033 cec: bit: "0"
4803786-4823033 cec: byte: "0x00"
4823033-4825439 cec: eom-1: "EOM=Y"
4825439-4829539 cec: ack: "ACK"
4683488-4825439 cec: frame: "5f:80:10:00:11:00"
4683488-4825439 cec: section: "HDR: AudioSystem, Broadcast | OPC: ROUTING_CHANGE | OPS: 0x10, 0x00, 0x11, 0x00 | R: ACK"
