2394809-2399297 cec: st: "ST"
2399297-2401678 cec: bit: "0"
2401678-2404058 cec: bit: "0"
2404058-2406439 cec: bit: "0"
2406439-2408820 cec: bit: "0"
2408820-2411201 cec: bit: "0"
2411201-2413582 cec: bit: "1"
2413582-2415963 cec: bit: "0"
2415963-2418344 cec: bit: "1"
2399297-2418344 cec: byte: "0x05"
2418344-2420725 cec: eom-1: "EOM=Y"
2420725-2424825 cec: ack: "ACK"
2399297-2420725 cec: frame: "05"
2399297-2420725 cec: section: "HDR: TV, AudioSystem | OPC: PING | R: ACK"
3006810-3011298 cec: st: "ST"
3011298-3013679 cec: bit: "0"
3013679-3016060 cec: bit: "0"
3016060-3018441 cec: bit: "0"
3018441-3020822 cec: bit: "0"
3020822-3023203 cec: bit: "1"
3023203-3025583 cec: bit: "1"
3025583-3027964 cec: bit: "1"
3027964-3030345 cec: bit: "1"
3011298-3030345 cec: byte: "0x0f"
3030345-3032726 cec: eom-0: "EOM=N"
3032726-3035107 cec: ack: "ACK"
3035107-3037488 cec: bit: "0"
3037488-3039869 cec: bit: "0"
3039869-3042250 cec: bit: "1"
3042250-3044631 cec: bit: "1"
3044631-3047012 cec: bit: "0"
3047012-3049393 cec: bit: "1"
3049393-3051774 cec: bit: "1"
3051774-3054155 cec: bit: "0"
3035107-3054155 cec: byte: "0x36"
3054155-3056536 cec: eom-1: "EOM=Y"
3056536-3060636 cec: ack: "ACK"
3011298-3056536 cec: frame: "0f:36"
3011298-3056536 cec: section: "HDR: TV, Broadcast | OPC: STANDBY | R: ACK"
3075798-3080285 cec: st: "ST"
3080285-3082666 cec: bit: "0"
3082666-3085047 cec: bit: "0"
3085047-3087428 cec: bit: "0"
3087428-3089809 cec: bit: "0"
3089809-3092190 cec: bit: "1"
3092190-3094571 cec: bit: "1"
3094571-3096952 cec: bit: "1"
3096952-3099333 cec: bit: "1"
3080285-3099333 cec: byte: "0x0f"
3099333-3101714 cec: eom-0: "EOM=N"
3101714-3104094 cec: ack: "ACK"
3104094-3106475 cec: bit: "1"
3106475-3108856 cec: bit: "0"
3108856-3111237 cec: bit: "1"
3111237-3113618 cec: bit: "0"
3113618-3115999 cec: bit: "0"
3115999-3118380 cec: bit: "0"
3118380-3120761 cec: bit: "0"
3120761-3123142 cec: bit: "0"
3104094-3123142 cec: byte: "0xa0"
3123142-3125523 cec: eom-0: "EOM=N"
3125523-3127904 cec: ack: "ACK"
3127904-3130285 cec: bit: "0"
3130285-3132666 cec: bit: "0"
3132666-3135047 cec: bit: "0"
3135047-3137428 cec: bit: "0"
3137428-3139809 cec: bit: "1"
3139809-3142190 cec: bit: "0"
3142190-3144571 cec: bit: "0"
3144571-3146952 cec: bit: "0"
3127904-3146952 cec: byte: "0x08"
3146952-3149333 cec: eom-0: "EOM=N"
3149333-3151714 cec: ack: "ACK"
3151714-3154095 cec: bit: "0"
3154095-3156476 cec: bit: "0"
3156476-3158857 cec: bit: "0"
3158857-3161238 cec: bit: "0"
3161238-3163619 cec: bit: "0"
3163619-3166000 cec: bit: "0"
3166000-3168381 cec: bit: "0"
3168381-3170762 cec: bit: "0"
3151714-3170762 cec: byte: "0x00"
3170762-3173143 cec: eom-0: "EOM=N"
3173143-3175524 cec: ack: "ACK"
3175524-3177905 cec: bit: "0"
3177905-3180286 cec: bit: "1"
3180286-3182667 cec: bit: "0"
3182667-3185047 cec: bit: "0"
3185047-3187428 cec: bit: "0"
3187428-3189809 cec: bit: "1"
3189809-3192190 cec: bit: "1"
3192190-3194571 cec: bit: "0"
3175524-3194571 cec: byte: "0x46"
3194571-3196952 cec: eom-0: "EOM=N"
3196952-3199333 cec: ack: "ACK"
3199333-3201714 cec: bit: "0"
3201714-3204095 cec: bit: "0"
3204095-3206476 cec: bit: "0"
3206476-3208857 cec: bit: "0"
3208857-3211238 cec: bit: "0"
3211238-3213619 cec: bit: "0"
3213619-3216000 cec: bit: "0"
3216000-3218381 cec: bit: "0"
3199333-3218381 cec: byte: "0x00"
3218381-3220762 cec: eom-0: "EOM=N"
3220762-3223143 cec: ack: "ACK"
3223143-3225524 cec: bit: "0"
3225524-3227905 cec: bit: "0"
3227905-3230286 cec: bit: "0"
3230286-3232667 cec: bit: "0"
3232667-3235048 cec: bit: "1"
3235048-3237429 cec: bit: "0"
3237429-3239810 cec: bit: "0"
3239810-3242191 cec: bit: "1"
3223143-3242191 cec: byte: "0x09"
3242191-3244572 cec: eom-0: "EOM=N"
3244572-3246953 cec: ack: "ACK"
3246953-3249334 cec: bit: "0"
3249334-3251715 cec: bit: "0"
3251715-3254096 cec: bit: "0"
3254096-3256477 cec: bit: "0"
3256477-3258858 cec: bit: "0"
3258858-3261239 cec: bit: "0"
3261239-3263620 cec: bit: "0"
3263620-3266001 cec: bit: "0"
3246953-3266001 cec: byte: "0x00"
3266001-3268381 cec: eom-0: "EOM=N"
3268381-3270762 cec: ack: "ACK"
3270762-3273143 cec: bit: "0"
3273143-3275524 cec: bit: "0"
3275524-3277905 cec: bit: "0"
3277905-3280286 cec: bit: "0"
3280286-3282667 cec: bit: "0"
3282667-3285048 cec: bit: "0"
3285048-3287429 cec: bit: "0"
3287429-3289810 cec: bit: "1"
3270762-3289810 cec: byte: "0x01"
3289810-3292191 cec: eom-1: "EOM=Y"
3292191-3296291 cec: ack: "ACK"
3080285-3292191 cec: frame: "0f:a0:08:00:46:00:09:00:01"
3080285-3292191 cec: section: "HDR: TV, Broadcast | OPC: VENDOR_COMMAND_WITH_ID | OPS: 0x08, 0x00, 0x46, 0x00, 0x09, 0x00, 0x01 | R: ACK"
