100108-109210 ir_nec: agc-pulse: "AGC pulse" "AGC" "A"
109210-113690 ir_nec: longpause: "Long pause" "L-pause" "LP" "P"
100108-113690 ir_nec: leader-code: "Leader code" "Leader" "LC" "L"
113690-114853 ir_nec: bit: "0"
114853-116041 ir_nec: bit: "0"
116041-117176 ir_nec: bit: "0"
117176-118364 ir_nec: bit: "0"
118364-119526 ir_nec: bit: "0"
119526-120661 ir_nec: bit: "0"
120661-121849 ir_nec: bit: "0"
121849-123011 ir_nec: bit: "0"
113690-123011 ir_nec: addr: "Address: 0x00" "ADDR: 0x00" "A: 0x00" "A"
123011-125225 ir_nec: bit: "1"
125225-127466 ir_nec: bit: "1"
127466-129708 ir_nec: bit: "1"
129708-131949 ir_nec: bit: "1"
131949-134191 ir_nec: bit: "1"
134191-136432 ir_nec: bit: "1"
136432-138673 ir_nec: bit: "1"
138673-140914 ir_nec: bit: "1"
123011-140914 ir_nec: addr-inv: "Address#: 0xFF" "ADDR#: 0xFF" "A#: 0xFF" "A#"
140914-143156 ir_nec: bit: "1"
143156-144317 ir_nec: bit: "0"
144317-146558 ir_nec: bit: "1"
146558-147720 ir_nec: bit: "0"
147720-149961 ir_nec: bit: "1"
149961-151149 ir_nec: bit: "0"
151149-152284 ir_nec: bit: "0"
152284-153445 ir_nec: bit: "0"
140914-153445 ir_nec: cmd: "Command: 0x15" "CMD: 0x15" "C: 0x15" "C"
153445-154607 ir_nec: bit: "0"
154607-156848 ir_nec: bit: "1"
156848-158009 ir_nec: bit: "0"
158009-160250 ir_nec: bit: "1"
160250-161411 ir_nec: bit: "0"
161411-163652 ir_nec: bit: "1"
163652-165893 ir_nec: bit: "1"
165893-168134 ir_nec: bit: "1"
153445-168134 ir_nec: cmd-inv: "Command#: 0xEA" "CMD#: 0xEA" "C#: 0xEA" "C#"
168134-168785 ir_nec: stop-bit: "Stop bit" "Stop" "St" "S"
100108-168785 ir_nec: remote: "Joy-it SBC-IRC01: Enter" "Joy-it SBC-IRC01: E" "E"
789587-798686 ir_nec: agc-pulse: "AGC pulse" "AGC" "A"
798686-803171 ir_nec: longpause: "Long pause" "L-pause" "LP" "P"
789587-803171 ir_nec: leader-code: "Leader code" "Leader" "LC" "L"
803171-804334 ir_nec: bit: "0"
804334-805522 ir_nec: bit: "0"
805522-806657 ir_nec: bit: "0"
806657-807845 ir_nec: bit: "0"
807845-808980 ir_nec: bit: "0"
808980-810142 ir_nec: bit: "0"
810142-811330 ir_nec: bit: "0"
811330-812465 ir_nec: bit: "0"
803171-812465 ir_nec: addr: "Address: 0x00" "ADDR: 0x00" "A: 0x00" "A"
812465-814706 ir_nec: bit: "1"
814706-816947 ir_nec: bit: "1"
816947-819188 ir_nec: bit: "1"
819188-821429 ir_nec: bit: "1"
821429-823671 ir_nec: bit: "1"
823671-825912 ir_nec: bit: "1"
825912-828153 ir_nec: bit: "1"
828153-830394 ir_nec: bit: "1"
812465-830394 ir_nec: addr-inv: "Address#: 0xFF" "ADDR#: 0xFF" "A#: 0xFF" "A#"
830394-832635 ir_nec: bit: "1"
832635-833797 ir_nec: bit: "0"
833797-836037 ir_nec: bit: "1"
836037-837199 ir_nec: bit: "0"
837199-839440 ir_nec: bit: "1"
839440-840601 ir_nec: bit: "0"
840601-841763 ir_nec: bit: "0"
841763-842924 ir_nec: bit: "0"
830394-842924 ir_nec: cmd: "Command: 0x15" "CMD: 0x15" "C: 0x15" "C"
842924-844085 ir_nec: bit: "0"
844085-846326 ir_nec: bit: "1"
846326-847487 ir_nec: bit: "0"
847487-849728 ir_nec: bit: "1"
849728-850889 ir_nec: bit: "0"
850889-853130 ir_nec: bit: "1"
853130-855371 ir_nec: bit: "1"
855371-857612 ir_nec: bit: "1"
842924-857612 ir_nec: cmd-inv: "Command#: 0xEA" "CMD#: 0xEA" "C#: 0xEA" "C#"
857612-858263 ir_nec: stop-bit: "Stop bit" "Stop" "St" "S"
789587-858263 ir_nec: remote: "Joy-it SBC-IRC01: Enter" "Joy-it SBC-IRC01: E" "E"
1513732-1522827 ir_nec: agc-pulse: "AGC pulse" "AGC" "A"
1522827-1527311 ir_nec: longpause: "Long pause" "L-pause" "LP" "P"
1513732-1527311 ir_nec: leader-code: "Leader code" "Leader" "LC" "L"
1527311-1528473 ir_nec: bit: "0"
1528473-1529635 ir_nec: bit: "0"
1529635-1530823 ir_nec: bit: "0"
1530823-1531984 ir_nec: bit: "0"
1531984-1533119 ir_nec: bit: "0"
1533119-1534307 ir_nec: bit: "0"
1534307-1535469 ir_nec: bit: "0"
1535469-1536630 ir_nec: bit: "0"
1527311-1536630 ir_nec: addr: "Address: 0x00" "ADDR: 0x00" "A: 0x00" "A"
1536630-1538844 ir_nec: bit: "1"
1538844-1541086 ir_nec: bit: "1"
1541086-1543327 ir_nec: bit: "1"
1543327-1545568 ir_nec: bit: "1"
1545568-1547809 ir_nec: bit: "1"
1547809-1550050 ir_nec: bit: "1"
1550050-1552291 ir_nec: bit: "1"
1552291-1554532 ir_nec: bit: "1"
1536630-1554532 ir_nec: addr-inv: "Address#: 0xFF" "ADDR#: 0xFF" "A#: 0xFF" "A#"
1554532-1556773 ir_nec: bit: "1"
1556773-1557934 ir_nec: bit: "0"
1557934-1560176 ir_nec: bit: "1"
1560176-1561337 ir_nec: bit: "0"
1561337-1563578 ir_nec: bit: "1"
1563578-1564740 ir_nec: bit: "0"
1564740-1565901 ir_nec: bit: "0"
1565901-1567090 ir_nec: bit: "0"
1554532-1567090 ir_nec: cmd: "Command: 0x15" "CMD: 0x15" "C: 0x15" "C"
1567090-1568251 ir_nec: bit: "0"
1568251-1570465 ir_nec: bit: "1"
1570465-1571627 ir_nec: bit: "0"
1571627-1573868 ir_nec: bit: "1"
1573868-1575030 ir_nec: bit: "0"
1575030-1577271 ir_nec: bit: "1"
1577271-1579513 ir_nec: bit: "1"
1579513-1581754 ir_nec: bit: "1"
1567090-1581754 ir_nec: cmd-inv: "Command#: 0xEA" "CMD#: 0xEA" "C#: 0xEA" "C#"
1581754-1582405 ir_nec: stop-bit: "Stop bit" "Stop" "St" "S"
1513732-1582405 ir_nec: remote: "Joy-it SBC-IRC01: Enter" "Joy-it SBC-IRC01: E" "E"
2278801-2287900 ir_nec: agc-pulse: "AGC pulse" "AGC" "A"
2287900-2292385 ir_nec: longpause: "Long pause" "L-pause" "LP" "P"
2278801-2292385 ir_nec: leader-code: "Leader code" "Leader" "LC" "L"
2292385-2293548 ir_nec: bit: "0"
2293548-2294736 ir_nec: bit: "0"
2294736-2295898 ir_nec: bit: "0"
2295898-2297059 ir_nec: bit: "0"
2297059-2298194 ir_nec: bit: "0"
2298194-2299383 ir_nec: bit: "0"
2299383-2300544 ir_nec: bit: "0"
2300544-2301679 ir_nec: bit: "0"
2292385-2301679 ir_nec: addr: "Address: 0x00" "ADDR: 0x00" "A: 0x00" "A"
2301679-2303920 ir_nec: bit: "1"
2303920-2306161 ir_nec: bit: "1"
2306161-2308403 ir_nec: bit: "1"
2308403-2310645 ir_nec: bit: "1"
2310645-2312886 ir_nec: bit: "1"
2312886-2315128 ir_nec: bit: "1"
2315128-2317370 ir_nec: bit: "1"
2317370-2319611 ir_nec: bit: "1"
2301679-2319611 ir_nec: addr-inv: "Address#: 0xFF" "ADDR#: 0xFF" "A#: 0xFF" "A#"
2319611-2321852 ir_nec: bit: "1"
2321852-2323014 ir_nec: bit: "0"
2323014-2325255 ir_nec: bit: "1"
2325255-2326416 ir_nec: bit: "0"
2326416-2328658 ir_nec: bit: "1"
2328658-2329819 ir_nec: bit: "0"
2329819-2331007 ir_nec: bit: "0"
2331007-2332142 ir_nec: bit: "0"
2319611-2332142 ir_nec: cmd: "Command: 0x15" "CMD: 0x15" "C: 0x15" "C"
2332142-2333330 ir_nec: bit: "0"
2333330-2335545 ir_nec: bit: "1"
2335545-2336707 ir_nec: bit: "0"
2336707-2338948 ir_nec: bit: "1"
2338948-2340136 ir_nec: bit: "0"
2340136-2342351 ir_nec: bit: "1"
2342351-2344592 ir_nec: bit: "1"
2344592-2346833 ir_nec: bit: "1"
2332142-2346833 ir_nec: cmd-inv: "Command#: 0xEA" "CMD#: 0xEA" "C#: 0xEA" "C#"
2346833-2347484 ir_nec: stop-bit: "Stop bit" "Stop" "St" "S"
2278801-2347484 ir_nec: remote: "Joy-it SBC-IRC01: Enter" "Joy-it SBC-IRC01: E" "E"
3038362-3047457 ir_nec: agc-pulse: "AGC pulse" "AGC" "A"
3047457-3051940 ir_nec: longpause: "Long pause" "L-pause" "LP" "P"
3038362-3051940 ir_nec: leader-code: "Leader code" "Leader" "LC" "L"
3051940-3053102 ir_nec: bit: "0"
3053102-3054263 ir_nec: bit: "0"
3054263-3055424 ir_nec: bit: "0"
3055424-3056612 ir_nec: bit: "0"
3056612-3057747 ir_nec: bit: "0"
3057747-3058935 ir_nec: bit: "0"
3058935-3060069 ir_nec: bit: "0"
3060069-3061257 ir_nec: bit: "0"
3051940-3061257 ir_nec: addr: "Address: 0x00" "ADDR: 0x00" "A: 0x00" "A"
3061257-3063471 ir_nec: bit: "1"
3063471-3065713 ir_nec: bit: "1"
3065713-3067953 ir_nec: bit: "1"
3067953-3070195 ir_nec: bit: "1"
3070195-3072436 ir_nec: bit: "1"
3072436-3074677 ir_nec: bit: "1"
3074677-3076918 ir_nec: bit: "1"
3076918-3079157 ir_nec: bit: "1"
3061257-3079157 ir_nec: addr-inv: "Address#: 0xFF" "ADDR#: 0xFF" "A#: 0xFF" "A#"
3079157-3081399 ir_nec: bit: "1"
3081399-3082561 ir_nec: bit: "0"
3082561-3084801 ir_nec: bit: "1"
3084801-3085963 ir_nec: bit: "0"
3085963-3088204 ir_nec: bit: "1"
3088204-3089391 ir_nec: bit: "0"
3089391-3090526 ir_nec: bit: "0"
3090526-3091714 ir_nec: bit: "0"
3079157-3091714 ir_nec: cmd: "Command: 0x15" "CMD: 0x15" "C: 0x15" "C"
3091714-3092848 ir_nec: bit: "0"
3092848-3095089 ir_nec: bit: "1"
3095089-3096250 ir_nec: bit: "0"
3096250-3098491 ir_nec: bit: "1"
3098491-3099652 ir_nec: bit: "0"
3099652-3101893 ir_nec: bit: "1"
3101893-3104134 ir_nec: bit: "1"
3104134-3106375 ir_nec: bit: "1"
3091714-3106375 ir_nec: cmd-inv: "Command#: 0xEA" "CMD#: 0xEA" "C#: 0xEA" "C#"
3106375-3107026 ir_nec: stop-bit: "Stop bit" "Stop" "St" "S"
3038362-3107026 ir_nec: remote: "Joy-it SBC-IRC01: Enter" "Joy-it SBC-IRC01: E" "E"
