1000107-1009205 ir_nec: agc-pulse: "AGC pulse" "AGC" "A"
1009205-1013686 ir_nec: longpause: "Long pause" "L-pause" "LP" "P"
1000107-1013686 ir_nec: leader-code: "Leader code" "Leader" "LC" "L"
1013686-1014849 ir_nec: bit: "0"
1014849-1016037 ir_nec: bit: "0"
1016037-1017199 ir_nec: bit: "0"
1017199-1018360 ir_nec: bit: "0"
1018360-1019522 ir_nec: bit: "0"
1019522-1020683 ir_nec: bit: "0"
1020683-1021845 ir_nec: bit: "0"
1021845-1023007 ir_nec: bit: "0"
1013686-1023007 ir_nec: addr: "Address: 0x00" "ADDR: 0x00" "A: 0x00" "A"
1023007-1025221 ir_nec: bit: "1"
1025221-1027463 ir_nec: bit: "1"
1027463-1029704 ir_nec: bit: "1"
1029704-1031946 ir_nec: bit: "1"
1031946-1034187 ir_nec: bit: "1"
1034187-1036428 ir_nec: bit: "1"
1036428-1038670 ir_nec: bit: "1"
1038670-1040911 ir_nec: bit: "1"
1023007-1040911 ir_nec: addr-inv: "Address#: 0xFF" "ADDR#: 0xFF" "A#: 0xFF" "A#"
1040911-1043153 ir_nec: bit: "1"
1043153-1044314 ir_nec: bit: "0"
1044314-1046555 ir_nec: bit: "1"
1046555-1047744 ir_nec: bit: "0"
1047744-1048879 ir_nec: bit: "0"
1048879-1050067 ir_nec: bit: "0"
1050067-1052281 ir_nec: bit: "1"
1052281-1053443 ir_nec: bit: "0"
1040911-1053443 ir_nec: cmd: "Command: 0x45" "CMD: 0x45" "C: 0x45" "C"
1053443-1054631 ir_nec: bit: "0"
1054631-1056846 ir_nec: bit: "1"
1056846-1058007 ir_nec: bit: "0"
1058007-1060249 ir_nec: bit: "1"
1060249-1062490 ir_nec: bit: "1"
1062490-1064732 ir_nec: bit: "1"
1064732-1065920 ir_nec: bit: "0"
1065920-1068134 ir_nec: bit: "1"
1053443-1068134 ir_nec: cmd-inv: "Command#: 0xBA" "CMD#: 0xBA" "C#: 0xBA" "C#"
1068134-1068785 ir_nec: stop-bit: "Stop bit" "Stop" "St" "S"
1000107-1068785 ir_nec: remote: "Joy-it SBC-IRC01: Volume down" "Joy-it SBC-IRC01: Vol-" "Vol-"
1108223-1117320 ir_nec: agc-pulse: "AGC pulse" "AGC" "A"
1117320-1119539 ir_nec: shortpause: "Short pause" "S-pause" "SP" "P"
1119539-1120190 ir_nec: stop-bit: "Stop bit" "Stop" "St" "S"
1108223-1120190 ir_nec: repeat-code: "Repeat code" "Repeat" "RC" "R"
1595002-1604102 ir_nec: agc-pulse: "AGC pulse" "AGC" "A"
1604102-1608583 ir_nec: longpause: "Long pause" "L-pause" "LP" "P"
1595002-1608583 ir_nec: leader-code: "Leader code" "Leader" "LC" "L"
1608583-1609772 ir_nec: bit: "0"
1609772-1610933 ir_nec: bit: "0"
1610933-1612095 ir_nec: bit: "0"
1612095-1613257 ir_nec: bit: "0"
1613257-1614418 ir_nec: bit: "0"
1614418-1615580 ir_nec: bit: "0"
1615580-1616741 ir_nec: bit: "0"
1616741-1617903 ir_nec: bit: "0"
1608583-1617903 ir_nec: addr: "Address: 0x00" "ADDR: 0x00" "A: 0x00" "A"
1617903-1620118 ir_nec: bit: "1"
1620118-1622360 ir_nec: bit: "1"
1622360-1624601 ir_nec: bit: "1"
1624601-1626843 ir_nec: bit: "1"
1626843-1629084 ir_nec: bit: "1"
1629084-1631326 ir_nec: bit: "1"
1631326-1633567 ir_nec: bit: "1"
1633567-1635808 ir_nec: bit: "1"
1617903-1635808 ir_nec: addr-inv: "Address#: 0xFF" "ADDR#: 0xFF" "A#: 0xFF" "A#"
1635808-1636971 ir_nec: bit: "0"
1636971-1639212 ir_nec: bit: "1"
1639212-1641454 ir_nec: bit: "1"
1641454-1642642 ir_nec: bit: "0"
1642642-1643804 ir_nec: bit: "0"
1643804-1644966 ir_nec: bit: "0"
1644966-1647181 ir_nec: bit: "1"
1647181-1648343 ir_nec: bit: "0"
1635808-1648343 ir_nec: cmd: "Command: 0x46" "CMD: 0x46" "C: 0x46" "C"
1648343-1650584 ir_nec: bit: "1"
1650584-1651772 ir_nec: bit: "0"
1651772-1652934 ir_nec: bit: "0"
1652934-1655148 ir_nec: bit: "1"
1655148-1657390 ir_nec: bit: "1"
1657390-1659632 ir_nec: bit: "1"
1659632-1660793 ir_nec: bit: "0"
1660793-1663035 ir_nec: bit: "1"
1648343-1663035 ir_nec: cmd-inv: "Command#: 0xB9" "CMD#: 0xB9" "C#: 0xB9" "C#"
1663035-1663686 ir_nec: stop-bit: "Stop bit" "Stop" "St" "S"
1595002-1663686 ir_nec: remote: "Joy-it SBC-IRC01: Play/Pause" "Joy-it SBC-IRC01: P/P" "P/P"
1703129-1712221 ir_nec: agc-pulse: "AGC pulse" "AGC" "A"
1712221-1714444 ir_nec: shortpause: "Short pause" "S-pause" "SP" "P"
1714444-1715095 ir_nec: stop-bit: "Stop bit" "Stop" "St" "S"
1703129-1715095 ir_nec: repeat-code: "Repeat code" "Repeat" "RC" "R"
2198148-2207240 ir_nec: agc-pulse: "AGC pulse" "AGC" "A"
2207240-2211728 ir_nec: longpause: "Long pause" "L-pause" "LP" "P"
2198148-2211728 ir_nec: leader-code: "Leader code" "Leader" "LC" "L"
2211728-2212891 ir_nec: bit: "0"
2212891-2214079 ir_nec: bit: "0"
2214079-2215240 ir_nec: bit: "0"
2215240-2216402 ir_nec: bit: "0"
2216402-2217563 ir_nec: bit: "0"
2217563-2218725 ir_nec: bit: "0"
2218725-2219887 ir_nec: bit: "0"
2219887-2221048 ir_nec: bit: "0"
2211728-2221048 ir_nec: addr: "Address: 0x00" "ADDR: 0x00" "A: 0x00" "A"
2221048-2223263 ir_nec: bit: "1"
2223263-2225504 ir_nec: bit: "1"
2225504-2227746 ir_nec: bit: "1"
2227746-2229987 ir_nec: bit: "1"
2229987-2232229 ir_nec: bit: "1"
2232229-2234470 ir_nec: bit: "1"
2234470-2236712 ir_nec: bit: "1"
2236712-2238953 ir_nec: bit: "1"
2221048-2238953 ir_nec: addr-inv: "Address#: 0xFF" "ADDR#: 0xFF" "A#: 0xFF" "A#"
2238953-2241195 ir_nec: bit: "1"
2241195-2243436 ir_nec: bit: "1"
2243436-2245678 ir_nec: bit: "1"
2245678-2246839 ir_nec: bit: "0"
2246839-2248028 ir_nec: bit: "0"
2248028-2249189 ir_nec: bit: "0"
2249189-2251404 ir_nec: bit: "1"
2251404-2252593 ir_nec: bit: "0"
2238953-2252593 ir_nec: cmd: "Command: 0x47" "CMD: 0x47" "C: 0x47" "C"
2252593-2253755 ir_nec: bit: "0"
2253755-2254916 ir_nec: bit: "0"
2254916-2256078 ir_nec: bit: "0"
2256078-2258293 ir_nec: bit: "1"
2258293-2260535 ir_nec: bit: "1"
2260535-2262777 ir_nec: bit: "1"
2262777-2263966 ir_nec: bit: "0"
2263966-2266181 ir_nec: bit: "1"
2252593-2266181 ir_nec: cmd-inv: "Command#: 0xB8" "CMD#: 0xB8" "C#: 0xB8" "C#"
2266181-2266832 ir_nec: stop-bit: "Stop bit" "Stop" "St" "S"
2198148-2266832 ir_nec: remote: "Joy-it SBC-IRC01: Volume up" "Joy-it SBC-IRC01: Vol+" "Vol+"
2306280-2315377 ir_nec: agc-pulse: "AGC pulse" "AGC" "A"
2315377-2317595 ir_nec: shortpause: "Short pause" "S-pause" "SP" "P"
2317595-2318246 ir_nec: stop-bit: "Stop bit" "Stop" "St" "S"
2306280-2318246 ir_nec: repeat-code: "Repeat code" "Repeat" "RC" "R"
2808896-2817988 ir_nec: agc-pulse: "AGC pulse" "AGC" "A"
2817988-2822465 ir_nec: longpause: "Long pause" "L-pause" "LP" "P"
2808896-2822465 ir_nec: leader-code: "Leader code" "Leader" "LC" "L"
2822465-2823627 ir_nec: bit: "0"
2823627-2824814 ir_nec: bit: "0"
2824814-2825975 ir_nec: bit: "0"
2825975-2827135 ir_nec: bit: "0"
2827135-2828270 ir_nec: bit: "0"
2828270-2829457 ir_nec: bit: "0"
2829457-2830617 ir_nec: bit: "0"
2830617-2831778 ir_nec: bit: "0"
2822465-2831778 ir_nec: addr: "Address: 0x00" "ADDR: 0x00" "A: 0x00" "A"
2831778-2833991 ir_nec: bit: "1"
2833991-2836231 ir_nec: bit: "1"
2836231-2838470 ir_nec: bit: "1"
2838470-2840710 ir_nec: bit: "1"
2840710-2842950 ir_nec: bit: "1"
2842950-2845190 ir_nec: bit: "1"
2845190-2847430 ir_nec: bit: "1"
2847430-2849670 ir_nec: bit: "1"
2831778-2849670 ir_nec: addr-inv: "Address#: 0xFF" "ADDR#: 0xFF" "A#: 0xFF" "A#"
2849670-2850857 ir_nec: bit: "0"
2850857-2852017 ir_nec: bit: "0"
2852017-2854231 ir_nec: bit: "1"
2854231-2855418 ir_nec: bit: "0"
2855418-2856578 ir_nec: bit: "0"
2856578-2857739 ir_nec: bit: "0"
2857739-2859952 ir_nec: bit: "1"
2859952-2861112 ir_nec: bit: "0"
2849670-2861112 ir_nec: cmd: "Command: 0x44" "CMD: 0x44" "C: 0x44" "C"
2861112-2863352 ir_nec: bit: "1"
2863352-2865592 ir_nec: bit: "1"
2865592-2866779 ir_nec: bit: "0"
2866779-2868992 ir_nec: bit: "1"
2868992-2871231 ir_nec: bit: "1"
2871231-2873472 ir_nec: bit: "1"
2873472-2874659 ir_nec: bit: "0"
2874659-2876873 ir_nec: bit: "1"
2861112-2876873 ir_nec: cmd-inv: "Command#: 0xBB" "CMD#: 0xBB" "C#: 0xBB" "C#"
2876873-2877524 ir_nec: stop-bit: "Stop bit" "Stop" "St" "S"
2808896-2877524 ir_nec: remote: "Joy-it SBC-IRC01: Setup" "Joy-it SBC-IRC01: Set" "Set"
2916945-2926038 ir_nec: agc-pulse: "AGC pulse" "AGC" "A"
2926038-2928251 ir_nec: shortpause: "Short pause" "S-pause" "SP" "P"
2928251-2928902 ir_nec: stop-bit: "Stop bit" "Stop" "St" "S"
2916945-2928902 ir_nec: repeat-code: "Repeat code" "Repeat" "RC" "R"
3520313-3529406 ir_nec: agc-pulse: "AGC pulse" "AGC" "A"
3529406-3533891 ir_nec: longpause: "Long pause" "L-pause" "LP" "P"
3520313-3533891 ir_nec: leader-code: "Leader code" "Leader" "LC" "L"
3533891-3535080 ir_nec: bit: "0"
3535080-3536242 ir_nec: bit: "0"
3536242-3537404 ir_nec: bit: "0"
3537404-3538565 ir_nec: bit: "0"
3538565-3539727 ir_nec: bit: "0"
3539727-3540888 ir_nec: bit: "0"
3540888-3542050 ir_nec: bit: "0"
3542050-3543212 ir_nec: bit: "0"
3533891-3543212 ir_nec: addr: "Address: 0x00" "ADDR: 0x00" "A: 0x00" "A"
3543212-3545426 ir_nec: bit: "1"
3545426-3547668 ir_nec: bit: "1"
3547668-3549910 ir_nec: bit: "1"
3549910-3552152 ir_nec: bit: "1"
3552152-3554393 ir_nec: bit: "1"
3554393-3556635 ir_nec: bit: "1"
3556635-3558877 ir_nec: bit: "1"
3558877-3561118 ir_nec: bit: "1"
3543212-3561118 ir_nec: addr-inv: "Address#: 0xFF" "ADDR#: 0xFF" "A#: 0xFF" "A#"
3561118-3562280 ir_nec: bit: "0"
3562280-3563468 ir_nec: bit: "0"
3563468-3564630 ir_nec: bit: "0"
3564630-3565792 ir_nec: bit: "0"
3565792-3566954 ir_nec: bit: "0"
3566954-3568115 ir_nec: bit: "0"
3568115-3570330 ir_nec: bit: "1"
3570330-3571492 ir_nec: bit: "0"
3561118-3571492 ir_nec: cmd: "Command: 0x40" "CMD: 0x40" "C: 0x40" "C"
3571492-3573734 ir_nec: bit: "1"
3573734-3575976 ir_nec: bit: "1"
3575976-3578218 ir_nec: bit: "1"
3578218-3580460 ir_nec: bit: "1"
3580460-3582702 ir_nec: bit: "1"
3582702-3584943 ir_nec: bit: "1"
3584943-3586132 ir_nec: bit: "0"
3586132-3588347 ir_nec: bit: "1"
3571492-3588347 ir_nec: cmd-inv: "Command#: 0xBF" "CMD#: 0xBF" "C#: 0xBF" "C#"
3588347-3588998 ir_nec: stop-bit: "Stop bit" "Stop" "St" "S"
3520313-3588998 ir_nec: remote: "Joy-it SBC-IRC01: Up" "Joy-it SBC-IRC01: U" "U"
3628449-3637546 ir_nec: agc-pulse: "AGC pulse" "AGC" "A"
3637546-3639764 ir_nec: shortpause: "Short pause" "S-pause" "SP" "P"
3639764-3640415 ir_nec: stop-bit: "Stop bit" "Stop" "St" "S"
3628449-3640415 ir_nec: repeat-code: "Repeat code" "Repeat" "RC" "R"
4225948-4235042 ir_nec: agc-pulse: "AGC pulse" "AGC" "A"
4235042-4239521 ir_nec: longpause: "Long pause" "L-pause" "LP" "P"
4225948-4239521 ir_nec: leader-code: "Leader code" "Leader" "LC" "L"
4239521-4240683 ir_nec: bit: "0"
4240683-4241870 ir_nec: bit: "0"
4241870-4243031 ir_nec: bit: "0"
4243031-4244192 ir_nec: bit: "0"
4244192-4245354 ir_nec: bit: "0"
4245354-4246488 ir_nec: bit: "0"
4246488-4247676 ir_nec: bit: "0"
4247676-4248837 ir_nec: bit: "0"
4239521-4248837 ir_nec: addr: "Address: 0x00" "ADDR: 0x00" "A: 0x00" "A"
4248837-4251050 ir_nec: bit: "1"
4251050-4253291 ir_nec: bit: "1"
4253291-4255531 ir_nec: bit: "1"
4255531-4257772 ir_nec: bit: "1"
4257772-4260013 ir_nec: bit: "1"
4260013-4262253 ir_nec: bit: "1"
4262253-4264494 ir_nec: bit: "1"
4264494-4266734 ir_nec: bit: "1"
4248837-4266734 ir_nec: addr-inv: "Address#: 0xFF" "ADDR#: 0xFF" "A#: 0xFF" "A#"
4266734-4268975 ir_nec: bit: "1"
4268975-4271215 ir_nec: bit: "1"
4271215-4272376 ir_nec: bit: "0"
4272376-4273564 ir_nec: bit: "0"
4273564-4274725 ir_nec: bit: "0"
4274725-4275886 ir_nec: bit: "0"
4275886-4278099 ir_nec: bit: "1"
4278099-4279260 ir_nec: bit: "0"
4266734-4279260 ir_nec: cmd: "Command: 0x43" "CMD: 0x43" "C: 0x43" "C"
4279260-4280448 ir_nec: bit: "0"
4280448-4281609 ir_nec: bit: "0"
4281609-4283822 ir_nec: bit: "1"
4283822-4286063 ir_nec: bit: "1"
4286063-4288303 ir_nec: bit: "1"
4288303-4290543 ir_nec: bit: "1"
4290543-4291704 ir_nec: bit: "0"
4291704-4293945 ir_nec: bit: "1"
4279260-4293945 ir_nec: cmd-inv: "Command#: 0xBC" "CMD#: 0xBC" "C#: 0xBC" "C#"
4293945-4294596 ir_nec: stop-bit: "Stop bit" "Stop" "St" "S"
4225948-4294596 ir_nec: remote: "Joy-it SBC-IRC01: Stop / Mode" "Joy-it SBC-IRC01: S/M" "S/M"
4334021-4343114 ir_nec: agc-pulse: "AGC pulse" "AGC" "A"
4343114-4345329 ir_nec: shortpause: "Short pause" "S-pause" "SP" "P"
4345329-4345980 ir_nec: stop-bit: "Stop bit" "Stop" "St" "S"
4334021-4345980 ir_nec: repeat-code: "Repeat code" "Repeat" "RC" "R"
4905637-4914731 ir_nec: agc-pulse: "AGC pulse" "AGC" "A"
4914731-4919211 ir_nec: longpause: "Long pause" "L-pause" "LP" "P"
4905637-4919211 ir_nec: leader-code: "Leader code" "Leader" "LC" "L"
4919211-4920399 ir_nec: bit: "0"
4920399-4921561 ir_nec: bit: "0"
4921561-4922722 ir_nec: bit: "0"
4922722-4923883 ir_nec: bit: "0"
4923883-4925044 ir_nec: bit: "0"
4925044-4926205 ir_nec: bit: "0"
4926205-4927366 ir_nec: bit: "0"
4927366-4928527 ir_nec: bit: "0"
4919211-4928527 ir_nec: addr: "Address: 0x00" "ADDR: 0x00" "A: 0x00" "A"
4928527-4930741 ir_nec: bit: "1"
4930741-4932982 ir_nec: bit: "1"
4932982-4935223 ir_nec: bit: "1"
4935223-4937464 ir_nec: bit: "1"
4937464-4939705 ir_nec: bit: "1"
4939705-4941946 ir_nec: bit: "1"
4941946-4944187 ir_nec: bit: "1"
4944187-4946427 ir_nec: bit: "1"
4928527-4946427 ir_nec: addr-inv: "Address#: 0xFF" "ADDR#: 0xFF" "A#: 0xFF" "A#"
4946427-4948668 ir_nec: bit: "1"
4948668-4950909 ir_nec: bit: "1"
4950909-4953150 ir_nec: bit: "1"
4953150-4954311 ir_nec: bit: "0"
4954311-4955499 ir_nec: bit: "0"
4955499-4956660 ir_nec: bit: "0"
4956660-4957821 ir_nec: bit: "0"
4957821-4958982 ir_nec: bit: "0"
4946427-4958982 ir_nec: cmd: "Command: 0x07" "CMD: 0x07" "C: 0x07" "C"
4958982-4960144 ir_nec: bit: "0"
4960144-4961305 ir_nec: bit: "0"
4961305-4962466 ir_nec: bit: "0"
4962466-4964680 ir_nec: bit: "1"
4964680-4966921 ir_nec: bit: "1"
4966921-4969162 ir_nec: bit: "1"
4969162-4971403 ir_nec: bit: "1"
4971403-4973644 ir_nec: bit: "1"
4958982-4973644 ir_nec: cmd-inv: "Command#: 0xF8" "CMD#: 0xF8" "C#: 0xF8" "C#"
4973644-4974295 ir_nec: stop-bit: "Stop bit" "Stop" "St" "S"
4905637-4974295 ir_nec: remote: "Joy-it SBC-IRC01: Left" "Joy-it SBC-IRC01: L" "L"
5013728-5022815 ir_nec: agc-pulse: "AGC pulse" "AGC" "A"
5022815-5025038 ir_nec: shortpause: "Short pause" "S-pause" "SP" "P"
5025038-5025689 ir_nec: stop-bit: "Stop bit" "Stop" "St" "S"
5013728-5025689 ir_nec: repeat-code: "Repeat code" "Repeat" "RC" "R"
5499226-5508328 ir_nec: agc-pulse: "AGC pulse" "AGC" "A"
5508328-5512809 ir_nec: longpause: "Long pause" "L-pause" "LP" "P"
5499226-5512809 ir_nec: leader-code: "Leader code" "Leader" "LC" "L"
5512809-5513972 ir_nec: bit: "0"
5513972-5515160 ir_nec: bit: "0"
5515160-5516322 ir_nec: bit: "0"
5516322-5517484 ir_nec: bit: "0"
5517484-5518646 ir_nec: bit: "0"
5518646-5519808 ir_nec: bit: "0"
5519808-5520970 ir_nec: bit: "0"
5520970-5522132 ir_nec: bit: "0"
5512809-5522132 ir_nec: addr: "Address: 0x00" "ADDR: 0x00" "A: 0x00" "A"
5522132-5524347 ir_nec: bit: "1"
5524347-5526588 ir_nec: bit: "1"
5526588-5528831 ir_nec: bit: "1"
5528831-5531073 ir_nec: bit: "1"
5531073-5533314 ir_nec: bit: "1"
5533314-5535557 ir_nec: bit: "1"
5535557-5537799 ir_nec: bit: "1"
5537799-5540041 ir_nec: bit: "1"
5522132-5540041 ir_nec: addr-inv: "Address#: 0xFF" "ADDR#: 0xFF" "A#: 0xFF" "A#"
5540041-5542283 ir_nec: bit: "1"
5542283-5543445 ir_nec: bit: "0"
5543445-5545687 ir_nec: bit: "1"
5545687-5546849 ir_nec: bit: "0"
5546849-5549091 ir_nec: bit: "1"
5549091-5550280 ir_nec: bit: "0"
5550280-5551442 ir_nec: bit: "0"
5551442-5552604 ir_nec: bit: "0"
5540041-5552604 ir_nec: cmd: "Command: 0x15" "CMD: 0x15" "C: 0x15" "C"
5552604-5553766 ir_nec: bit: "0"
5553766-5555981 ir_nec: bit: "1"
5555981-5557143 ir_nec: bit: "0"
5557143-5559385 ir_nec: bit: "1"
5559385-5560548 ir_nec: bit: "0"
5560548-5562789 ir_nec: bit: "1"
5562789-5565031 ir_nec: bit: "1"
5565031-5567273 ir_nec: bit: "1"
5552604-5567273 ir_nec: cmd-inv: "Command#: 0xEA" "CMD#: 0xEA" "C#: 0xEA" "C#"
5567273-5567924 ir_nec: stop-bit: "Stop bit" "Stop" "St" "S"
5499226-5567924 ir_nec: remote: "Joy-it SBC-IRC01: Enter" "Joy-it SBC-IRC01: E" "E"
5607373-5616469 ir_nec: agc-pulse: "AGC pulse" "AGC" "A"
5616469-5618691 ir_nec: shortpause: "Short pause" "S-pause" "SP" "P"
5618691-5619342 ir_nec: stop-bit: "Stop bit" "Stop" "St" "S"
5607373-5619342 ir_nec: repeat-code: "Repeat code" "Repeat" "RC" "R"
6106887-6115982 ir_nec: agc-pulse: "AGC pulse" "AGC" "A"
6115982-6120465 ir_nec: longpause: "Long pause" "L-pause" "LP" "P"
6106887-6120465 ir_nec: leader-code: "Leader code" "Leader" "LC" "L"
6120465-6121627 ir_nec: bit: "0"
6121627-6122815 ir_nec: bit: "0"
6122815-6123950 ir_nec: bit: "0"
6123950-6125111 ir_nec: bit: "0"
6125111-6126272 ir_nec: bit: "0"
6126272-6127460 ir_nec: bit: "0"
6127460-6128621 ir_nec: bit: "0"
6128621-6129756 ir_nec: bit: "0"
6120465-6129756 ir_nec: addr: "Address: 0x00" "ADDR: 0x00" "A: 0x00" "A"
6129756-6131997 ir_nec: bit: "1"
6131997-6134238 ir_nec: bit: "1"
6134238-6136479 ir_nec: bit: "1"
6136479-6138720 ir_nec: bit: "1"
6138720-6140962 ir_nec: bit: "1"
6140962-6143203 ir_nec: bit: "1"
6143203-6145444 ir_nec: bit: "1"
6145444-6147685 ir_nec: bit: "1"
6129756-6147685 ir_nec: addr-inv: "Address#: 0xFF" "ADDR#: 0xFF" "A#: 0xFF" "A#"
6147685-6149926 ir_nec: bit: "1"
6149926-6151114 ir_nec: bit: "0"
6151114-6152275 ir_nec: bit: "0"
6152275-6154489 ir_nec: bit: "1"
6154489-6155651 ir_nec: bit: "0"
6155651-6156839 ir_nec: bit: "0"
6156839-6157973 ir_nec: bit: "0"
6157973-6159161 ir_nec: bit: "0"
6147685-6159161 ir_nec: cmd: "Command: 0x09" "CMD: 0x09" "C: 0x09" "C"
6159161-6160323 ir_nec: bit: "0"
6160323-6162537 ir_nec: bit: "1"
6162537-6164778 ir_nec: bit: "1"
6164778-6165939 ir_nec: bit: "0"
6165939-6168180 ir_nec: bit: "1"
6168180-6170421 ir_nec: bit: "1"
6170421-6172662 ir_nec: bit: "1"
6172662-6174903 ir_nec: bit: "1"
6159161-6174903 ir_nec: cmd-inv: "Command#: 0xF6" "CMD#: 0xF6" "C#: 0xF6" "C#"
6174903-6175554 ir_nec: stop-bit: "Stop bit" "Stop" "St" "S"
6106887-6175554 ir_nec: remote: "Joy-it SBC-IRC01: Right" "Joy-it SBC-IRC01: R" "R"
6214987-6224078 ir_nec: agc-pulse: "AGC pulse" "AGC" "A"
6224078-6226298 ir_nec: shortpause: "Short pause" "S-pause" "SP" "P"
6226298-6226949 ir_nec: stop-bit: "Stop bit" "Stop" "St" "S"
6214987-6226949 ir_nec: repeat-code: "Repeat code" "Repeat" "RC" "R"
6323003-6332097 ir_nec: agc-pulse: "AGC pulse" "AGC" "A"
6332097-6334312 ir_nec: shortpause: "Short pause" "S-pause" "SP" "P"
6334312-6334963 ir_nec: stop-bit: "Stop bit" "Stop" "St" "S"
6323003-6334963 ir_nec: repeat-code: "Repeat code" "Repeat" "RC" "R"
6843518-6852608 ir_nec: agc-pulse: "AGC pulse" "AGC" "A"
6852608-6857093 ir_nec: longpause: "Long pause" "L-pause" "LP" "P"
6843518-6857093 ir_nec: leader-code: "Leader code" "Leader" "LC" "L"
6857093-6858255 ir_nec: bit: "0"
6858255-6859443 ir_nec: bit: "0"
6859443-6860604 ir_nec: bit: "0"
6860604-6861739 ir_nec: bit: "0"
6861739-6862927 ir_nec: bit: "0"
6862927-6864088 ir_nec: bit: "0"
6864088-6865249 ir_nec: bit: "0"
6865249-6866411 ir_nec: bit: "0"
6857093-6866411 ir_nec: addr: "Address: 0x00" "ADDR: 0x00" "A: 0x00" "A"
6866411-6868624 ir_nec: bit: "1"
6868624-6870866 ir_nec: bit: "1"
6870866-6873107 ir_nec: bit: "1"
6873107-6875348 ir_nec: bit: "1"
6875348-6877590 ir_nec: bit: "1"
6877590-6879831 ir_nec: bit: "1"
6879831-6882072 ir_nec: bit: "1"
6882072-6884313 ir_nec: bit: "1"
6866411-6884313 ir_nec: addr-inv: "Address#: 0xFF" "ADDR#: 0xFF" "A#: 0xFF" "A#"
6884313-6885501 ir_nec: bit: "0"
6885501-6887715 ir_nec: bit: "1"
6887715-6889957 ir_nec: bit: "1"
6889957-6891144 ir_nec: bit: "0"
6891144-6893359 ir_nec: bit: "1"
6893359-6894547 ir_nec: bit: "0"
6894547-6895708 ir_nec: bit: "0"
6895708-6896869 ir_nec: bit: "0"
6884313-6896869 ir_nec: cmd: "Command: 0x16" "CMD: 0x16" "C: 0x16" "C"
6896869-6899084 ir_nec: bit: "1"
6899084-6900271 ir_nec: bit: "0"
6900271-6901433 ir_nec: bit: "0"
6901433-6903647 ir_nec: bit: "1"
6903647-6904835 ir_nec: bit: "0"
6904835-6907049 ir_nec: bit: "1"
6907049-6909291 ir_nec: bit: "1"
6909291-6911532 ir_nec: bit: "1"
6896869-6911532 ir_nec: cmd-inv: "Command#: 0xE9" "CMD#: 0xE9" "C#: 0xE9" "C#"
6911532-6912183 ir_nec: stop-bit: "Stop bit" "Stop" "St" "S"
6843518-6912183 ir_nec: remote: "Joy-it SBC-IRC01: 0 / 10+" "Joy-it SBC-IRC01: 0" "0"
6951621-6960713 ir_nec: agc-pulse: "AGC pulse" "AGC" "A"
6960713-6962933 ir_nec: shortpause: "Short pause" "S-pause" "SP" "P"
6962933-6963584 ir_nec: stop-bit: "Stop bit" "Stop" "St" "S"
6951621-6963584 ir_nec: repeat-code: "Repeat code" "Repeat" "RC" "R"
7059649-7068739 ir_nec: agc-pulse: "AGC pulse" "AGC" "A"
7068739-7070959 ir_nec: shortpause: "Short pause" "S-pause" "SP" "P"
7070959-7071610 ir_nec: stop-bit: "Stop bit" "Stop" "St" "S"
7059649-7071610 ir_nec: repeat-code: "Repeat code" "Repeat" "RC" "R"
7167675-7176766 ir_nec: agc-pulse: "AGC pulse" "AGC" "A"
7176766-7178986 ir_nec: shortpause: "Short pause" "S-pause" "SP" "P"
7178986-7179637 ir_nec: stop-bit: "Stop bit" "Stop" "St" "S"
7167675-7179637 ir_nec: repeat-code: "Repeat code" "Repeat" "RC" "R"
7507380-7516472 ir_nec: agc-pulse: "AGC pulse" "AGC" "A"
7516472-7520960 ir_nec: longpause: "Long pause" "L-pause" "LP" "P"
7507380-7520960 ir_nec: leader-code: "Leader code" "Leader" "LC" "L"
7520960-7522149 ir_nec: bit: "0"
7522149-7523284 ir_nec: bit: "0"
7523284-7524472 ir_nec: bit: "0"
7524472-7525634 ir_nec: bit: "0"
7525634-7526795 ir_nec: bit: "0"
7526795-7527957 ir_nec: bit: "0"
7527957-7529118 ir_nec: bit: "0"
7529118-7530280 ir_nec: bit: "0"
7520960-7530280 ir_nec: addr: "Address: 0x00" "ADDR: 0x00" "A: 0x00" "A"
7530280-7532494 ir_nec: bit: "1"
7532494-7534735 ir_nec: bit: "1"
7534735-7536977 ir_nec: bit: "1"
7536977-7539219 ir_nec: bit: "1"
7539219-7541460 ir_nec: bit: "1"
7541460-7543702 ir_nec: bit: "1"
7543702-7545944 ir_nec: bit: "1"
7545944-7548185 ir_nec: bit: "1"
7530280-7548185 ir_nec: addr-inv: "Address#: 0xFF" "ADDR#: 0xFF" "A#: 0xFF" "A#"
7548185-7550427 ir_nec: bit: "1"
7550427-7551589 ir_nec: bit: "0"
7551589-7552778 ir_nec: bit: "0"
7552778-7554993 ir_nec: bit: "1"
7554993-7557234 ir_nec: bit: "1"
7557234-7558396 ir_nec: bit: "0"
7558396-7559558 ir_nec: bit: "0"
7559558-7560747 ir_nec: bit: "0"
7548185-7560747 ir_nec: cmd: "Command: 0x19" "CMD: 0x19" "C: 0x19" "C"
7560747-7561908 ir_nec: bit: "0"
7561908-7564123 ir_nec: bit: "1"
7564123-7566365 ir_nec: bit: "1"
7566365-7567553 ir_nec: bit: "0"
7567553-7568715 ir_nec: bit: "0"
7568715-7570930 ir_nec: bit: "1"
7570930-7573172 ir_nec: bit: "1"
7573172-7575414 ir_nec: bit: "1"
7560747-7575414 ir_nec: cmd-inv: "Command#: 0xE6" "CMD#: 0xE6" "C#: 0xE6" "C#"
7575414-7576065 ir_nec: stop-bit: "Stop bit" "Stop" "St" "S"
7507380-7576065 ir_nec: remote: "Joy-it SBC-IRC01: Down" "Joy-it SBC-IRC01: D" "D"
7615508-7624610 ir_nec: agc-pulse: "AGC pulse" "AGC" "A"
7624610-7626824 ir_nec: shortpause: "Short pause" "S-pause" "SP" "P"
7626824-7627475 ir_nec: stop-bit: "Stop bit" "Stop" "St" "S"
7615508-7627475 ir_nec: repeat-code: "Repeat code" "Repeat" "RC" "R"
8164983-8174070 ir_nec: agc-pulse: "AGC pulse" "AGC" "A"
8174070-8178559 ir_nec: longpause: "Long pause" "L-pause" "LP" "P"
8164983-8178559 ir_nec: leader-code: "Leader code" "Leader" "LC" "L"
8178559-8179748 ir_nec: bit: "0"
8179748-8180909 ir_nec: bit: "0"
8180909-8182044 ir_nec: bit: "0"
8182044-8183232 ir_nec: bit: "0"
8183232-8184393 ir_nec: bit: "0"
8184393-8185555 ir_nec: bit: "0"
8185555-8186716 ir_nec: bit: "0"
8186716-8187877 ir_nec: bit: "0"
8178559-8187877 ir_nec: addr: "Address: 0x00" "ADDR: 0x00" "A: 0x00" "A"
8187877-8190092 ir_nec: bit: "1"
8190092-8192333 ir_nec: bit: "1"
8192333-8194574 ir_nec: bit: "1"
8194574-8196815 ir_nec: bit: "1"
8196815-8199056 ir_nec: bit: "1"
8199056-8201297 ir_nec: bit: "1"
8201297-8203538 ir_nec: bit: "1"
8203538-8205779 ir_nec: bit: "1"
8187877-8205779 ir_nec: addr-inv: "Address#: 0xFF" "ADDR#: 0xFF" "A#: 0xFF" "A#"
8205779-8208020 ir_nec: bit: "1"
8208020-8209208 ir_nec: bit: "0"
8209208-8211423 ir_nec: bit: "1"
8211423-8213662 ir_nec: bit: "1"
8213662-8214825 ir_nec: bit: "0"
8214825-8216013 ir_nec: bit: "0"
8216013-8217174 ir_nec: bit: "0"
8217174-8218336 ir_nec: bit: "0"
8205779-8218336 ir_nec: cmd: "Command: 0x0D" "CMD: 0x0D" "C: 0x0D" "C"
8218336-8219497 ir_nec: bit: "0"
8219497-8221712 ir_nec: bit: "1"
8221712-8222873 ir_nec: bit: "0"
8222873-8224061 ir_nec: bit: "0"
8224061-8226276 ir_nec: bit: "1"
8226276-8228517 ir_nec: bit: "1"
8228517-8230758 ir_nec: bit: "1"
8230758-8232999 ir_nec: bit: "1"
8218336-8232999 ir_nec: cmd-inv: "Command#: 0xF2" "CMD#: 0xF2" "C#: 0xF2" "C#"
8232999-8233650 ir_nec: stop-bit: "Stop bit" "Stop" "St" "S"
8164983-8233650 ir_nec: remote: "Joy-it SBC-IRC01: Back" "Joy-it SBC-IRC01: B" "B"
8273088-8282177 ir_nec: agc-pulse: "AGC pulse" "AGC" "A"
8282177-8284400 ir_nec: shortpause: "Short pause" "S-pause" "SP" "P"
8284400-8285051 ir_nec: stop-bit: "Stop bit" "Stop" "St" "S"
8273088-8285051 ir_nec: repeat-code: "Repeat code" "Repeat" "RC" "R"
8381115-8390203 ir_nec: agc-pulse: "AGC pulse" "AGC" "A"
8390203-8392424 ir_nec: shortpause: "Short pause" "S-pause" "SP" "P"
8392424-8393075 ir_nec: stop-bit: "Stop bit" "Stop" "St" "S"
8381115-8393075 ir_nec: repeat-code: "Repeat code" "Repeat" "RC" "R"
8876995-8886091 ir_nec: agc-pulse: "AGC pulse" "AGC" "A"
8886091-8890571 ir_nec: longpause: "Long pause" "L-pause" "LP" "P"
8876995-8890571 ir_nec: leader-code: "Leader code" "Leader" "LC" "L"
8890571-8891733 ir_nec: bit: "0"
8891733-8892921 ir_nec: bit: "0"
8892921-8894083 ir_nec: bit: "0"
8894083-8895244 ir_nec: bit: "0"
8895244-8896405 ir_nec: bit: "0"
8896405-8897540 ir_nec: bit: "0"
8897540-8898728 ir_nec: bit: "0"
8898728-8899889 ir_nec: bit: "0"
8890571-8899889 ir_nec: addr: "Address: 0x00" "ADDR: 0x00" "A: 0x00" "A"
8899889-8902103 ir_nec: bit: "1"
8902103-8904345 ir_nec: bit: "1"
8904345-8906586 ir_nec: bit: "1"
8906586-8908827 ir_nec: bit: "1"
8908827-8911068 ir_nec: bit: "1"
8911068-8913309 ir_nec: bit: "1"
8913309-8915550 ir_nec: bit: "1"
8915550-8917791 ir_nec: bit: "1"
8899889-8917791 ir_nec: addr-inv: "Address#: 0xFF" "ADDR#: 0xFF" "A#: 0xFF" "A#"
8917791-8918979 ir_nec: bit: "0"
8918979-8920140 ir_nec: bit: "0"
8920140-8922355 ir_nec: bit: "1"
8922355-8924596 ir_nec: bit: "1"
8924596-8925757 ir_nec: bit: "0"
8925757-8926945 ir_nec: bit: "0"
8926945-8928107 ir_nec: bit: "0"
8928107-8929268 ir_nec: bit: "0"
8917791-8929268 ir_nec: cmd: "Command: 0x0C" "CMD: 0x0C" "C: 0x0C" "C"
8929268-8931482 ir_nec: bit: "1"
8931482-8933724 ir_nec: bit: "1"
8933724-8934885 ir_nec: bit: "0"
8934885-8936073 ir_nec: bit: "0"
8936073-8938288 ir_nec: bit: "1"
8938288-8940529 ir_nec: bit: "1"
8940529-8942770 ir_nec: bit: "1"
8942770-8945012 ir_nec: bit: "1"
8929268-8945012 ir_nec: cmd-inv: "Command#: 0xF3" "CMD#: 0xF3" "C#: 0xF3" "C#"
8945012-8945663 ir_nec: stop-bit: "Stop bit" "Stop" "St" "S"
8876995-8945663 ir_nec: remote: "Joy-it SBC-IRC01: 1" "Joy-it SBC-IRC01: 1" "1"
8985103-8994195 ir_nec: agc-pulse: "AGC pulse" "AGC" "A"
8994195-8996415 ir_nec: shortpause: "Short pause" "S-pause" "SP" "P"
8996415-8997066 ir_nec: stop-bit: "Stop bit" "Stop" "St" "S"
8985103-8997066 ir_nec: repeat-code: "Repeat code" "Repeat" "RC" "R"
9474703-9483784 ir_nec: agc-pulse: "AGC pulse" "AGC" "A"
9483784-9488271 ir_nec: longpause: "Long pause" "L-pause" "LP" "P"
9474703-9488271 ir_nec: leader-code: "Leader code" "Leader" "LC" "L"
9488271-9489460 ir_nec: bit: "0"
9489460-9490621 ir_nec: bit: "0"
9490621-9491782 ir_nec: bit: "0"
9491782-9492943 ir_nec: bit: "0"
9492943-9494103 ir_nec: bit: "0"
9494103-9495264 ir_nec: bit: "0"
9495264-9496425 ir_nec: bit: "0"
9496425-9497586 ir_nec: bit: "0"
9488271-9497586 ir_nec: addr: "Address: 0x00" "ADDR: 0x00" "A: 0x00" "A"
9497586-9499800 ir_nec: bit: "1"
9499800-9502041 ir_nec: bit: "1"
9502041-9504282 ir_nec: bit: "1"
9504282-9506523 ir_nec: bit: "1"
9506523-9508763 ir_nec: bit: "1"
9508763-9511004 ir_nec: bit: "1"
9511004-9513245 ir_nec: bit: "1"
9513245-9515486 ir_nec: bit: "1"
9497586-9515486 ir_nec: addr-inv: "Address#: 0xFF" "ADDR#: 0xFF" "A#: 0xFF" "A#"
9515486-9516673 ir_nec: bit: "0"
9516673-9517834 ir_nec: bit: "0"
9517834-9518995 ir_nec: bit: "0"
9518995-9521209 ir_nec: bit: "1"
9521209-9523450 ir_nec: bit: "1"
9523450-9524637 ir_nec: bit: "0"
9524637-9525798 ir_nec: bit: "0"
9525798-9526959 ir_nec: bit: "0"
9515486-9526959 ir_nec: cmd: "Command: 0x18" "CMD: 0x18" "C: 0x18" "C"
9526959-9529173 ir_nec: bit: "1"
9529173-9531414 ir_nec: bit: "1"
9531414-9533655 ir_nec: bit: "1"
9533655-9534842 ir_nec: bit: "0"
9534842-9536003 ir_nec: bit: "0"
9536003-9538217 ir_nec: bit: "1"
9538217-9540458 ir_nec: bit: "1"
9540458-9542699 ir_nec: bit: "1"
9526959-9542699 ir_nec: cmd-inv: "Command#: 0xE7" "CMD#: 0xE7" "C#: 0xE7" "C#"
9542699-9543350 ir_nec: stop-bit: "Stop bit" "Stop" "St" "S"
9474703-9543350 ir_nec: remote: "Joy-it SBC-IRC01: 2" "Joy-it SBC-IRC01: 2" "2"
9582790-9591874 ir_nec: agc-pulse: "AGC pulse" "AGC" "A"
9591874-9594095 ir_nec: shortpause: "Short pause" "S-pause" "SP" "P"
9594095-9594746 ir_nec: stop-bit: "Stop bit" "Stop" "St" "S"
9582790-9594746 ir_nec: repeat-code: "Repeat code" "Repeat" "RC" "R"
10127155-10136240 ir_nec: agc-pulse: "AGC pulse" "AGC" "A"
10136240-10140722 ir_nec: longpause: "Long pause" "L-pause" "LP" "P"
10127155-10140722 ir_nec: leader-code: "Leader code" "Leader" "LC" "L"
10140722-10141883 ir_nec: bit: "0"
10141883-10143070 ir_nec: bit: "0"
10143070-10144231 ir_nec: bit: "0"
10144231-10145392 ir_nec: bit: "0"
10145392-10146552 ir_nec: bit: "0"
10146552-10147713 ir_nec: bit: "0"
10147713-10148873 ir_nec: bit: "0"
10148873-10150034 ir_nec: bit: "0"
10140722-10150034 ir_nec: addr: "Address: 0x00" "ADDR: 0x00" "A: 0x00" "A"
10150034-10152248 ir_nec: bit: "1"
10152248-10154488 ir_nec: bit: "1"
10154488-10156728 ir_nec: bit: "1"
10156728-10158969 ir_nec: bit: "1"
10158969-10161208 ir_nec: bit: "1"
10161208-10163450 ir_nec: bit: "1"
10163450-10165690 ir_nec: bit: "1"
10165690-10167931 ir_nec: bit: "1"
10150034-10167931 ir_nec: addr-inv: "Address#: 0xFF" "ADDR#: 0xFF" "A#: 0xFF" "A#"
10167931-10169118 ir_nec: bit: "0"
10169118-10171332 ir_nec: bit: "1"
10171332-10173573 ir_nec: bit: "1"
10173573-10175814 ir_nec: bit: "1"
10175814-10178054 ir_nec: bit: "1"
10178054-10179242 ir_nec: bit: "0"
10179242-10181456 ir_nec: bit: "1"
10181456-10182643 ir_nec: bit: "0"
10167931-10182643 ir_nec: cmd: "Command: 0x5E" "CMD: 0x5E" "C: 0x5E" "C"
10182643-10184857 ir_nec: bit: "1"
10184857-10186045 ir_nec: bit: "0"
10186045-10187205 ir_nec: bit: "0"
10187205-10188366 ir_nec: bit: "0"
10188366-10189527 ir_nec: bit: "0"
10189527-10191741 ir_nec: bit: "1"
10191741-10192929 ir_nec: bit: "0"
10192929-10195143 ir_nec: bit: "1"
10182643-10195143 ir_nec: cmd-inv: "Command#: 0xA1" "CMD#: 0xA1" "C#: 0xA1" "C#"
10195143-10195794 ir_nec: stop-bit: "Stop bit" "Stop" "St" "S"
10127155-10195794 ir_nec: remote: "Joy-it SBC-IRC01: 3" "Joy-it SBC-IRC01: 3" "3"
10235233-10244317 ir_nec: agc-pulse: "AGC pulse" "AGC" "A"
10244317-10246537 ir_nec: shortpause: "Short pause" "S-pause" "SP" "P"
10246537-10247188 ir_nec: stop-bit: "Stop bit" "Stop" "St" "S"
10235233-10247188 ir_nec: repeat-code: "Repeat code" "Repeat" "RC" "R"
10752969-10762055 ir_nec: agc-pulse: "AGC pulse" "AGC" "A"
10762055-10766540 ir_nec: longpause: "Long pause" "L-pause" "LP" "P"
10752969-10766540 ir_nec: leader-code: "Leader code" "Leader" "LC" "L"
10766540-10767728 ir_nec: bit: "0"
10767728-10768889 ir_nec: bit: "0"
10768889-10770050 ir_nec: bit: "0"
10770050-10771211 ir_nec: bit: "0"
10771211-10772372 ir_nec: bit: "0"
10772372-10773533 ir_nec: bit: "0"
10773533-10774694 ir_nec: bit: "0"
10774694-10775855 ir_nec: bit: "0"
10766540-10775855 ir_nec: addr: "Address: 0x00" "ADDR: 0x00" "A: 0x00" "A"
10775855-10778068 ir_nec: bit: "1"
10778068-10780309 ir_nec: bit: "1"
10780309-10782550 ir_nec: bit: "1"
10782550-10784790 ir_nec: bit: "1"
10784790-10787031 ir_nec: bit: "1"
10787031-10789272 ir_nec: bit: "1"
10789272-10791512 ir_nec: bit: "1"
10791512-10793753 ir_nec: bit: "1"
10775855-10793753 ir_nec: addr-inv: "Address#: 0xFF" "ADDR#: 0xFF" "A#: 0xFF" "A#"
10793753-10794914 ir_nec: bit: "0"
10794914-10796102 ir_nec: bit: "0"
10796102-10797263 ir_nec: bit: "0"
10797263-10799477 ir_nec: bit: "1"
10799477-10800638 ir_nec: bit: "0"
10800638-10801826 ir_nec: bit: "0"
10801826-10802987 ir_nec: bit: "0"
10802987-10804148 ir_nec: bit: "0"
10793753-10804148 ir_nec: cmd: "Command: 0x08" "CMD: 0x08" "C: 0x08" "C"
10804148-10806362 ir_nec: bit: "1"
10806362-10808602 ir_nec: bit: "1"
10808602-10810843 ir_nec: bit: "1"
10810843-10812031 ir_nec: bit: "0"
10812031-10814245 ir_nec: bit: "1"
10814245-10816486 ir_nec: bit: "1"
10816486-10818727 ir_nec: bit: "1"
10818727-10820967 ir_nec: bit: "1"
10804148-10820967 ir_nec: cmd-inv: "Command#: 0xF7" "CMD#: 0xF7" "C#: 0xF7" "C#"
10820967-10821618 ir_nec: stop-bit: "Stop bit" "Stop" "St" "S"
10752969-10821618 ir_nec: remote: "Joy-it SBC-IRC01: 4" "Joy-it SBC-IRC01: 4" "4"
10861051-10870132 ir_nec: agc-pulse: "AGC pulse" "AGC" "A"
10870132-10872354 ir_nec: shortpause: "Short pause" "S-pause" "SP" "P"
10872354-10873005 ir_nec: stop-bit: "Stop bit" "Stop" "St" "S"
10861051-10873005 ir_nec: repeat-code: "Repeat code" "Repeat" "RC" "R"
10969065-10978149 ir_nec: agc-pulse: "AGC pulse" "AGC" "A"
10978149-10980367 ir_nec: shortpause: "Short pause" "S-pause" "SP" "P"
10980367-10981018 ir_nec: stop-bit: "Stop bit" "Stop" "St" "S"
10969065-10981018 ir_nec: repeat-code: "Repeat code" "Repeat" "RC" "R"
11337877-11346964 ir_nec: agc-pulse: "AGC pulse" "AGC" "A"
11346964-11351444 ir_nec: longpause: "Long pause" "L-pause" "LP" "P"
11337877-11351444 ir_nec: leader-code: "Leader code" "Leader" "LC" "L"
11351444-11352632 ir_nec: bit: "0"
11352632-11353793 ir_nec: bit: "0"
11353793-11354954 ir_nec: bit: "0"
11354954-11356115 ir_nec: bit: "0"
11356115-11357275 ir_nec: bit: "0"
11357275-11358436 ir_nec: bit: "0"
11358436-11359597 ir_nec: bit: "0"
11359597-11360758 ir_nec: bit: "0"
11351444-11360758 ir_nec: addr: "Address: 0x00" "ADDR: 0x00" "A: 0x00" "A"
11360758-11362972 ir_nec: bit: "1"
11362972-11365212 ir_nec: bit: "1"
11365212-11367453 ir_nec: bit: "1"
11367453-11369693 ir_nec: bit: "1"
11369693-11371934 ir_nec: bit: "1"
11371934-11374175 ir_nec: bit: "1"
11374175-11376415 ir_nec: bit: "1"
11376415-11378656 ir_nec: bit: "1"
11360758-11378656 ir_nec: addr-inv: "Address#: 0xFF" "ADDR#: 0xFF" "A#: 0xFF" "A#"
11378656-11379844 ir_nec: bit: "0"
11379844-11381005 ir_nec: bit: "0"
11381005-11383219 ir_nec: bit: "1"
11383219-11385459 ir_nec: bit: "1"
11385459-11387700 ir_nec: bit: "1"
11387700-11388888 ir_nec: bit: "0"
11388888-11390049 ir_nec: bit: "0"
11390049-11391210 ir_nec: bit: "0"
11378656-11391210 ir_nec: cmd: "Command: 0x1C" "CMD: 0x1C" "C: 0x1C" "C"
11391210-11393424 ir_nec: bit: "1"
11393424-11395664 ir_nec: bit: "1"
11395664-11396852 ir_nec: bit: "0"
11396852-11398013 ir_nec: bit: "0"
11398013-11399174 ir_nec: bit: "0"
11399174-11401388 ir_nec: bit: "1"
11401388-11403629 ir_nec: bit: "1"
11403629-11405870 ir_nec: bit: "1"
11391210-11405870 ir_nec: cmd-inv: "Command#: 0xE3" "CMD#: 0xE3" "C#: 0xE3" "C#"
11405870-11406521 ir_nec: stop-bit: "Stop bit" "Stop" "St" "S"
11337877-11406521 ir_nec: remote: "Joy-it SBC-IRC01: 5" "Joy-it SBC-IRC01: 5" "5"
11445958-11455045 ir_nec: agc-pulse: "AGC pulse" "AGC" "A"
11455045-11457266 ir_nec: shortpause: "Short pause" "S-pause" "SP" "P"
11457266-11457917 ir_nec: stop-bit: "Stop bit" "Stop" "St" "S"
11445958-11457917 ir_nec: repeat-code: "Repeat code" "Repeat" "RC" "R"
11553982-11563068 ir_nec: agc-pulse: "AGC pulse" "AGC" "A"
11563068-11565287 ir_nec: shortpause: "Short pause" "S-pause" "SP" "P"
11565287-11565938 ir_nec: stop-bit: "Stop bit" "Stop" "St" "S"
11553982-11565938 ir_nec: repeat-code: "Repeat code" "Repeat" "RC" "R"
12086783-12095863 ir_nec: agc-pulse: "AGC pulse" "AGC" "A"
12095863-12100348 ir_nec: longpause: "Long pause" "L-pause" "LP" "P"
12086783-12100348 ir_nec: leader-code: "Leader code" "Leader" "LC" "L"
12100348-12101536 ir_nec: bit: "0"
12101536-12102670 ir_nec: bit: "0"
12102670-12103857 ir_nec: bit: "0"
12103857-12105018 ir_nec: bit: "0"
12105018-12106179 ir_nec: bit: "0"
12106179-12107339 ir_nec: bit: "0"
12107339-12108500 ir_nec: bit: "0"
12108500-12109660 ir_nec: bit: "0"
12100348-12109660 ir_nec: addr: "Address: 0x00" "ADDR: 0x00" "A: 0x00" "A"
12109660-12111874 ir_nec: bit: "1"
12111874-12114115 ir_nec: bit: "1"
12114115-12116355 ir_nec: bit: "1"
12116355-12118596 ir_nec: bit: "1"
12118596-12120836 ir_nec: bit: "1"
12120836-12123077 ir_nec: bit: "1"
12123077-12125317 ir_nec: bit: "1"
12125317-12127557 ir_nec: bit: "1"
12109660-12127557 ir_nec: addr-inv: "Address#: 0xFF" "ADDR#: 0xFF" "A#: 0xFF" "A#"
12127557-12128745 ir_nec: bit: "0"
12128745-12130959 ir_nec: bit: "1"
12130959-12132146 ir_nec: bit: "0"
12132146-12134360 ir_nec: bit: "1"
12134360-12136600 ir_nec: bit: "1"
12136600-12137761 ir_nec: bit: "0"
12137761-12140001 ir_nec: bit: "1"
12140001-12141188 ir_nec: bit: "0"
12127557-12141188 ir_nec: cmd: "Command: 0x5A" "CMD: 0x5A" "C: 0x5A" "C"
12141188-12143402 ir_nec: bit: "1"
12143402-12144589 ir_nec: bit: "0"
12144589-12146803 ir_nec: bit: "1"
12146803-12147990 ir_nec: bit: "0"
12147990-12149151 ir_nec: bit: "0"
12149151-12151365 ir_nec: bit: "1"
12151365-12152552 ir_nec: bit: "0"
12152552-12154766 ir_nec: bit: "1"
12141188-12154766 ir_nec: cmd-inv: "Command#: 0xA5" "CMD#: 0xA5" "C#: 0xA5" "C#"
12154766-12155417 ir_nec: stop-bit: "Stop bit" "Stop" "St" "S"
12086783-12155417 ir_nec: remote: "Joy-it SBC-IRC01: 6" "Joy-it SBC-IRC01: 6" "6"
12194851-12203936 ir_nec: agc-pulse: "AGC pulse" "AGC" "A"
12203936-12206152 ir_nec: shortpause: "Short pause" "S-pause" "SP" "P"
12206152-12206803 ir_nec: stop-bit: "Stop bit" "Stop" "St" "S"
12194851-12206803 ir_nec: repeat-code: "Repeat code" "Repeat" "RC" "R"
12768850-12777941 ir_nec: agc-pulse: "AGC pulse" "AGC" "A"
12777941-12782420 ir_nec: longpause: "Long pause" "L-pause" "LP" "P"
12768850-12782420 ir_nec: leader-code: "Leader code" "Leader" "LC" "L"
12782420-12783608 ir_nec: bit: "0"
12783608-12784770 ir_nec: bit: "0"
12784770-12785931 ir_nec: bit: "0"
12785931-12787092 ir_nec: bit: "0"
12787092-12788253 ir_nec: bit: "0"
12788253-12789414 ir_nec: bit: "0"
12789414-12790575 ir_nec: bit: "0"
12790575-12791736 ir_nec: bit: "0"
12782420-12791736 ir_nec: addr: "Address: 0x00" "ADDR: 0x00" "A: 0x00" "A"
12791736-12793950 ir_nec: bit: "1"
12793950-12796191 ir_nec: bit: "1"
12796191-12798432 ir_nec: bit: "1"
12798432-12800673 ir_nec: bit: "1"
12800673-12802914 ir_nec: bit: "1"
12802914-12805155 ir_nec: bit: "1"
12805155-12807395 ir_nec: bit: "1"
12807395-12809636 ir_nec: bit: "1"
12791736-12809636 ir_nec: addr-inv: "Address#: 0xFF" "ADDR#: 0xFF" "A#: 0xFF" "A#"
12809636-12810824 ir_nec: bit: "0"
12810824-12813038 ir_nec: bit: "1"
12813038-12814226 ir_nec: bit: "0"
12814226-12815387 ir_nec: bit: "0"
12815387-12816548 ir_nec: bit: "0"
12816548-12817709 ir_nec: bit: "0"
12817709-12819923 ir_nec: bit: "1"
12819923-12821111 ir_nec: bit: "0"
12809636-12821111 ir_nec: cmd: "Command: 0x42" "CMD: 0x42" "C: 0x42" "C"
12821111-12823326 ir_nec: bit: "1"
12823326-12824487 ir_nec: bit: "0"
12824487-12826728 ir_nec: bit: "1"
12826728-12828969 ir_nec: bit: "1"
12828969-12831209 ir_nec: bit: "1"
12831209-12833450 ir_nec: bit: "1"
12833450-12834638 ir_nec: bit: "0"
12834638-12836853 ir_nec: bit: "1"
12821111-12836853 ir_nec: cmd-inv: "Command#: 0xBD" "CMD#: 0xBD" "C#: 0xBD" "C#"
12836853-12837504 ir_nec: stop-bit: "Stop bit" "Stop" "St" "S"
12768850-12837504 ir_nec: remote: "Joy-it SBC-IRC01: 7" "Joy-it SBC-IRC01: 7" "7"
12876941-12886032 ir_nec: agc-pulse: "AGC pulse" "AGC" "A"
12886032-12888248 ir_nec: shortpause: "Short pause" "S-pause" "SP" "P"
12888248-12888899 ir_nec: stop-bit: "Stop bit" "Stop" "St" "S"
12876941-12888899 ir_nec: repeat-code: "Repeat code" "Repeat" "RC" "R"
12984965-12994047 ir_nec: agc-pulse: "AGC pulse" "AGC" "A"
12994047-12996270 ir_nec: shortpause: "Short pause" "S-pause" "SP" "P"
12996270-12996921 ir_nec: stop-bit: "Stop bit" "Stop" "St" "S"
12984965-12996921 ir_nec: repeat-code: "Repeat code" "Repeat" "RC" "R"
13375141-13384220 ir_nec: agc-pulse: "AGC pulse" "AGC" "A"
13384220-13388705 ir_nec: longpause: "Long pause" "L-pause" "LP" "P"
13375141-13388705 ir_nec: leader-code: "Leader code" "Leader" "LC" "L"
13388705-13389893 ir_nec: bit: "0"
13389893-13391054 ir_nec: bit: "0"
13391054-13392214 ir_nec: bit: "0"
13392214-13393348 ir_nec: bit: "0"
13393348-13394536 ir_nec: bit: "0"
13394536-13395696 ir_nec: bit: "0"
13395696-13396857 ir_nec: bit: "0"
13396857-13398017 ir_nec: bit: "0"
13388705-13398017 ir_nec: addr: "Address: 0x00" "ADDR: 0x00" "A: 0x00" "A"
13398017-13400231 ir_nec: bit: "1"
13400231-13402471 ir_nec: bit: "1"
13402471-13404712 ir_nec: bit: "1"
13404712-13406952 ir_nec: bit: "1"
13406952-13409193 ir_nec: bit: "1"
13409193-13411433 ir_nec: bit: "1"
13411433-13413674 ir_nec: bit: "1"
13413674-13415914 ir_nec: bit: "1"
13398017-13415914 ir_nec: addr-inv: "Address#: 0xFF" "ADDR#: 0xFF" "A#: 0xFF" "A#"
13415914-13417101 ir_nec: bit: "0"
13417101-13419315 ir_nec: bit: "1"
13419315-13420502 ir_nec: bit: "0"
13420502-13421663 ir_nec: bit: "0"
13421663-13423877 ir_nec: bit: "1"
13423877-13425064 ir_nec: bit: "0"
13425064-13427278 ir_nec: bit: "1"
13427278-13428465 ir_nec: bit: "0"
13415914-13428465 ir_nec: cmd: "Command: 0x52" "CMD: 0x52" "C: 0x52" "C"
13428465-13430679 ir_nec: bit: "1"
13430679-13431866 ir_nec: bit: "0"
13431866-13434080 ir_nec: bit: "1"
13434080-13436321 ir_nec: bit: "1"
13436321-13437508 ir_nec: bit: "0"
13437508-13439722 ir_nec: bit: "1"
13439722-13440909 ir_nec: bit: "0"
13440909-13443123 ir_nec: bit: "1"
13428465-13443123 ir_nec: cmd-inv: "Command#: 0xAD" "CMD#: 0xAD" "C#: 0xAD" "C#"
13443123-13443774 ir_nec: stop-bit: "Stop bit" "Stop" "St" "S"
13375141-13443774 ir_nec: remote: "Joy-it SBC-IRC01: 8" "Joy-it SBC-IRC01: 8" "8"
13483211-13492291 ir_nec: agc-pulse: "AGC pulse" "AGC" "A"
13492291-13494513 ir_nec: shortpause: "Short pause" "S-pause" "SP" "P"
13494513-13495164 ir_nec: stop-bit: "Stop bit" "Stop" "St" "S"
13483211-13495164 ir_nec: repeat-code: "Repeat code" "Repeat" "RC" "R"
13591227-13600308 ir_nec: agc-pulse: "AGC pulse" "AGC" "A"
13600308-13602528 ir_nec: shortpause: "Short pause" "S-pause" "SP" "P"
13602528-13603179 ir_nec: stop-bit: "Stop bit" "Stop" "St" "S"
13591227-13603179 ir_nec: repeat-code: "Repeat code" "Repeat" "RC" "R"
14043584-14052671 ir_nec: agc-pulse: "AGC pulse" "AGC" "A"
14052671-14057152 ir_nec: longpause: "Long pause" "L-pause" "LP" "P"
14043584-14057152 ir_nec: leader-code: "Leader code" "Leader" "LC" "L"
14057152-14058340 ir_nec: bit: "0"
14058340-14059501 ir_nec: bit: "0"
14059501-14060662 ir_nec: bit: "0"
14060662-14061822 ir_nec: bit: "0"
14061822-14062983 ir_nec: bit: "0"
14062983-14064144 ir_nec: bit: "0"
14064144-14065305 ir_nec: bit: "0"
14065305-14066465 ir_nec: bit: "0"
14057152-14066465 ir_nec: addr: "Address: 0x00" "ADDR: 0x00" "A: 0x00" "A"
14066465-14068679 ir_nec: bit: "1"
14068679-14070920 ir_nec: bit: "1"
14070920-14073159 ir_nec: bit: "1"
14073159-14075401 ir_nec: bit: "1"
14075401-14077640 ir_nec: bit: "1"
14077640-14079882 ir_nec: bit: "1"
14079882-14082122 ir_nec: bit: "1"
14082122-14084363 ir_nec: bit: "1"
14066465-14084363 ir_nec: addr-inv: "Address#: 0xFF" "ADDR#: 0xFF" "A#: 0xFF" "A#"
14084363-14085550 ir_nec: bit: "0"
14085550-14087764 ir_nec: bit: "1"
14087764-14088951 ir_nec: bit: "0"
14088951-14091165 ir_nec: bit: "1"
14091165-14092352 ir_nec: bit: "0"
14092352-14093513 ir_nec: bit: "0"
14093513-14095727 ir_nec: bit: "1"
14095727-14096914 ir_nec: bit: "0"
14084363-14096914 ir_nec: cmd: "Command: 0x4A" "CMD: 0x4A" "C: 0x4A" "C"
14096914-14099128 ir_nec: bit: "1"
14099128-14100315 ir_nec: bit: "0"
14100315-14102530 ir_nec: bit: "1"
14102530-14103717 ir_nec: bit: "0"
14103717-14105931 ir_nec: bit: "1"
14105931-14108172 ir_nec: bit: "1"
14108172-14109332 ir_nec: bit: "0"
14109332-14111573 ir_nec: bit: "1"
14096914-14111573 ir_nec: cmd-inv: "Command#: 0xB5" "CMD#: 0xB5" "C#: 0xB5" "C#"
14111573-14112224 ir_nec: stop-bit: "Stop bit" "Stop" "St" "S"
14043584-14112224 ir_nec: remote: "Joy-it SBC-IRC01: 9" "Joy-it SBC-IRC01: 9" "9"
14151659-14160741 ir_nec: agc-pulse: "AGC pulse" "AGC" "A"
14160741-14162962 ir_nec: shortpause: "Short pause" "S-pause" "SP" "P"
14162962-14163613 ir_nec: stop-bit: "Stop bit" "Stop" "St" "S"
14151659-14163613 ir_nec: repeat-code: "Repeat code" "Repeat" "RC" "R"
14259675-14268757 ir_nec: agc-pulse: "AGC pulse" "AGC" "A"
14268757-14270978 ir_nec: shortpause: "Short pause" "S-pause" "SP" "P"
14270978-14271629 ir_nec: stop-bit: "Stop bit" "Stop" "St" "S"
14259675-14271629 ir_nec: repeat-code: "Repeat code" "Repeat" "RC" "R"
