5502999-5502999 i2c: start: "Start" "S"
5503185-5503206 i2c: bit: "1"
5503164-5503185 i2c: bit: "1"
5503142-5503164 i2c: bit: "0"
5503121-5503142 i2c: bit: "1"
5503099-5503121 i2c: bit: "0"
5503078-5503099 i2c: bit: "0"
5503056-5503078 i2c: bit: "0"
5503034-5503056 i2c: bit: "1"
5503185-5503206 i2c: address-read: "Read" "Rd" "R"
5503034-5503185 i2c: address-read: "Address read: 45" "AR: 45" "45"
5503205-5503226 i2c: ack: "ACK" "A"
5503395-5503416 i2c: bit: "1"
5503374-5503395 i2c: bit: "1"
5503354-5503374 i2c: bit: "1"
5503334-5503354 i2c: bit: "0"
5503313-5503334 i2c: bit: "0"
5503293-5503313 i2c: bit: "1"
5503273-5503293 i2c: bit: "1"
5503253-5503273 i2c: bit: "0"
5503253-5503416 i2c: data-read: "Data read: 67" "DR: 67" "67"
5503417-5503438 i2c: ack: "ACK" "A"
5503609-5503629 i2c: bit: "0"
5503589-5503609 i2c: bit: "1"
5503568-5503589 i2c: bit: "0"
5503548-5503568 i2c: bit: "0"
5503528-5503548 i2c: bit: "0"
5503507-5503528 i2c: bit: "1"
5503487-5503507 i2c: bit: "0"
5503467-5503487 i2c: bit: "1"
5503467-5503629 i2c: data-read: "Data read: A2" "DR: A2" "A2"
5503632-5503652 i2c: ack: "ACK" "A"
5503823-5503843 i2c: bit: "0"
5503803-5503823 i2c: bit: "0"
5503782-5503803 i2c: bit: "1"
5503762-5503782 i2c: bit: "0"
5503742-5503762 i2c: bit: "0"
5503722-5503742 i2c: bit: "1"
5503701-5503722 i2c: bit: "1"
5503681-5503701 i2c: bit: "1"
5503681-5503843 i2c: data-read: "Data read: E4" "DR: E4" "E4"
5503846-5503866 i2c: ack: "ACK" "A"
5504037-5504057 i2c: bit: "0"
5504017-5504037 i2c: bit: "0"
5503997-5504017 i2c: bit: "0"
5503976-5503997 i2c: bit: "1"
5503956-5503976 i2c: bit: "0"
5503936-5503956 i2c: bit: "0"
5503915-5503936 i2c: bit: "1"
5503895-5503915 i2c: bit: "0"
5503895-5504057 i2c: data-read: "Data read: 48" "DR: 48" "48"
5504060-5504080 i2c: ack: "ACK" "A"
5504251-5504271 i2c: bit: "1"
5504231-5504251 i2c: bit: "1"
5504211-5504231 i2c: bit: "1"
5504191-5504211 i2c: bit: "1"
5504170-5504191 i2c: bit: "1"
5504150-5504170 i2c: bit: "1"
5504130-5504150 i2c: bit: "1"
5504109-5504130 i2c: bit: "0"
5504109-5504271 i2c: data-read: "Data read: 7F" "DR: 7F" "7F"
5504274-5504294 i2c: ack: "ACK" "A"
5504465-5504486 i2c: bit: "1"
5504444-5504465 i2c: bit: "0"
5504424-5504444 i2c: bit: "0"
5504404-5504424 i2c: bit: "1"
5504383-5504404 i2c: bit: "0"
5504363-5504383 i2c: bit: "1"
5504343-5504363 i2c: bit: "1"
5504323-5504343 i2c: bit: "1"
5504323-5504486 i2c: data-read: "Data read: E9" "DR: E9" "E9"
5504487-5504508 i2c: nack: "NACK" "N"
5504530-5504530 i2c: stop: "Stop" "P"
5509775-5509775 i2c: start: "Start" "S"
5509962-5509984 i2c: bit: "0"
5509940-5509962 i2c: bit: "1"
5509919-5509940 i2c: bit: "0"
5509897-5509919 i2c: bit: "1"
5509876-5509897 i2c: bit: "0"
5509854-5509876 i2c: bit: "0"
5509832-5509854 i2c: bit: "0"
5509810-5509832 i2c: bit: "1"
5509962-5509984 i2c: address-write: "Write" "Wr" "W"
5509810-5509962 i2c: address-write: "Address write: 45" "AW: 45" "45"
5509982-5510004 i2c: ack: "ACK" "A"
5510185-5510206 i2c: bit: "0"
5510164-5510185 i2c: bit: "0"
5510142-5510164 i2c: bit: "1"
5510121-5510142 i2c: bit: "0"
5510099-5510121 i2c: bit: "0"
5510077-5510099 i2c: bit: "1"
5510056-5510077 i2c: bit: "0"
5510034-5510056 i2c: bit: "0"
5510034-5510206 i2c: data-write: "Data write: 24" "DW: 24" "24"
5510206-5510227 i2c: ack: "ACK" "A"
5510410-5510432 i2c: bit: "0"
5510388-5510410 i2c: bit: "0"
5510366-5510388 i2c: bit: "0"
5510344-5510366 i2c: bit: "0"
5510322-5510344 i2c: bit: "0"
5510301-5510322 i2c: bit: "0"
5510279-5510301 i2c: bit: "0"
5510257-5510279 i2c: bit: "0"
5510257-5510432 i2c: data-write: "Data write: 00" "DW: 00" "00"
5510430-5510452 i2c: ack: "ACK" "A"
13502594-13502594 i2c: repeat-start: "Start repeat" "Sr"
13502779-13502800 i2c: bit: "1"
13502758-13502779 i2c: bit: "1"
13502737-13502758 i2c: bit: "0"
13502715-13502737 i2c: bit: "1"
13502694-13502715 i2c: bit: "0"
13502672-13502694 i2c: bit: "0"
13502650-13502672 i2c: bit: "0"
13502629-13502650 i2c: bit: "1"
13502779-13502800 i2c: address-read: "Read" "Rd" "R"
13502629-13502779 i2c: address-read: "Address read: 45" "AR: 45" "45"
13502800-13502821 i2c: ack: "ACK" "A"
13502989-13503009 i2c: bit: "1"
13502969-13502989 i2c: bit: "1"
13502949-13502969 i2c: bit: "1"
13502928-13502949 i2c: bit: "0"
13502908-13502928 i2c: bit: "0"
13502888-13502908 i2c: bit: "1"
13502867-13502888 i2c: bit: "1"
13502847-13502867 i2c: bit: "0"
13502847-13503009 i2c: data-read: "Data read: 67" "DR: 67" "67"
13503012-13503032 i2c: ack: "ACK" "A"
13503203-13503223 i2c: bit: "1"
13503183-13503203 i2c: bit: "0"
13503163-13503183 i2c: bit: "1"
13503142-13503163 i2c: bit: "1"
13503122-13503142 i2c: bit: "0"
13503102-13503122 i2c: bit: "1"
13503082-13503102 i2c: bit: "0"
13503061-13503082 i2c: bit: "1"
13503061-13503223 i2c: data-read: "Data read: AD" "DR: AD" "AD"
13503226-13503246 i2c: ack: "ACK" "A"
13503418-13503439 i2c: bit: "0"
13503397-13503418 i2c: bit: "1"
13503377-13503397 i2c: bit: "0"
13503357-13503377 i2c: bit: "1"
13503336-13503357 i2c: bit: "0"
13503316-13503336 i2c: bit: "0"
13503296-13503316 i2c: bit: "1"
13503276-13503296 i2c: bit: "1"
13503276-13503439 i2c: data-read: "Data read: CA" "DR: CA" "CA"
13503440-13503461 i2c: ack: "ACK" "A"
13503632-13503653 i2c: bit: "0"
13503611-13503632 i2c: bit: "0"
13503591-13503611 i2c: bit: "0"
13503571-13503591 i2c: bit: "1"
13503551-13503571 i2c: bit: "0"
13503530-13503551 i2c: bit: "0"
13503510-13503530 i2c: bit: "1"
13503490-13503510 i2c: bit: "0"
13503490-13503653 i2c: data-read: "Data read: 48" "DR: 48" "48"
13503654-13503675 i2c: ack: "ACK" "A"
13503846-13503866 i2c: bit: "0"
13503826-13503846 i2c: bit: "0"
13503805-13503826 i2c: bit: "1"
13503785-13503805 i2c: bit: "0"
13503765-13503785 i2c: bit: "1"
13503744-13503765 i2c: bit: "0"
13503724-13503744 i2c: bit: "1"
13503704-13503724 i2c: bit: "0"
13503704-13503866 i2c: data-read: "Data read: 54" "DR: 54" "54"
13503869-13503889 i2c: ack: "ACK" "A"
13504059-13504079 i2c: bit: "1"
13504039-13504059 i2c: bit: "0"
13504018-13504039 i2c: bit: "1"
13503998-13504018 i2c: bit: "0"
13503978-13503998 i2c: bit: "0"
13503958-13503978 i2c: bit: "0"
13503937-13503958 i2c: bit: "0"
13503917-13503937 i2c: bit: "1"
13503917-13504079 i2c: data-read: "Data read: 85" "DR: 85" "85"
13504081-13504101 i2c: nack: "NACK" "N"
13504124-13504124 i2c: stop: "Stop" "P"
13509365-13509365 i2c: start: "Start" "S"
13509552-13509574 i2c: bit: "0"
13509530-13509552 i2c: bit: "1"
13509509-13509530 i2c: bit: "0"
13509487-13509509 i2c: bit: "1"
13509466-13509487 i2c: bit: "0"
13509444-13509466 i2c: bit: "0"
13509422-13509444 i2c: bit: "0"
13509400-13509422 i2c: bit: "1"
13509552-13509574 i2c: address-write: "Write" "Wr" "W"
13509400-13509552 i2c: address-write: "Address write: 45" "AW: 45" "45"
13509572-13509594 i2c: ack: "ACK" "A"
13509776-13509798 i2c: bit: "0"
13509754-13509776 i2c: bit: "0"
13509732-13509754 i2c: bit: "1"
13509711-13509732 i2c: bit: "0"
13509689-13509711 i2c: bit: "0"
13509667-13509689 i2c: bit: "1"
13509646-13509667 i2c: bit: "0"
13509624-13509646 i2c: bit: "0"
13509624-13509798 i2c: data-write: "Data write: 24" "DW: 24" "24"
13509796-13509818 i2c: ack: "ACK" "A"
13510000-13510022 i2c: bit: "0"
13509978-13510000 i2c: bit: "0"
13509956-13509978 i2c: bit: "0"
13509934-13509956 i2c: bit: "0"
13509913-13509934 i2c: bit: "0"
13509891-13509913 i2c: bit: "0"
13509869-13509891 i2c: bit: "0"
13509847-13509869 i2c: bit: "0"
13509847-13510022 i2c: data-write: "Data write: 00" "DW: 00" "00"
13510020-13510042 i2c: ack: "ACK" "A"
21502188-21502188 i2c: repeat-start: "Start repeat" "Sr"
21502374-21502395 i2c: bit: "1"
21502353-21502374 i2c: bit: "1"
21502331-21502353 i2c: bit: "0"
21502309-21502331 i2c: bit: "1"
21502288-21502309 i2c: bit: "0"
21502267-21502288 i2c: bit: "0"
21502245-21502267 i2c: bit: "0"
21502223-21502245 i2c: bit: "1"
21502374-21502395 i2c: address-read: "Read" "Rd" "R"
21502223-21502374 i2c: address-read: "Address read: 45" "AR: 45" "45"
21502394-21502415 i2c: ack: "ACK" "A"
21502584-21502605 i2c: bit: "1"
21502563-21502584 i2c: bit: "1"
21502543-21502563 i2c: bit: "1"
21502523-21502543 i2c: bit: "0"
21502502-21502523 i2c: bit: "0"
21502482-21502502 i2c: bit: "1"
21502462-21502482 i2c: bit: "1"
21502442-21502462 i2c: bit: "0"
21502442-21502605 i2c: data-read: "Data read: 67" "DR: 67" "67"
21502606-21502627 i2c: ack: "ACK" "A"
21502798-21502819 i2c: bit: "1"
21502777-21502798 i2c: bit: "1"
21502757-21502777 i2c: bit: "1"
21502737-21502757 i2c: bit: "0"
21502717-21502737 i2c: bit: "1"
21502696-21502717 i2c: bit: "1"
21502676-21502696 i2c: bit: "0"
21502656-21502676 i2c: bit: "1"
21502656-21502819 i2c: data-read: "Data read: B7" "DR: B7" "B7"
21502821-21502842 i2c: ack: "ACK" "A"
21503012-21503032 i2c: bit: "0"
21502992-21503012 i2c: bit: "1"
21502971-21502992 i2c: bit: "0"
21502951-21502971 i2c: bit: "0"
21502931-21502951 i2c: bit: "1"
21502911-21502931 i2c: bit: "0"
21502890-21502911 i2c: bit: "1"
21502870-21502890 i2c: bit: "0"
21502870-21503032 i2c: data-read: "Data read: 52" "DR: 52" "52"
21503035-21503055 i2c: ack: "ACK" "A"
21503226-21503246 i2c: bit: "0"
21503206-21503226 i2c: bit: "0"
21503186-21503206 i2c: bit: "0"
21503165-21503186 i2c: bit: "1"
21503145-21503165 i2c: bit: "0"
21503125-21503145 i2c: bit: "0"
21503104-21503125 i2c: bit: "1"
21503084-21503104 i2c: bit: "0"
21503084-21503246 i2c: data-read: "Data read: 48" "DR: 48" "48"
21503249-21503269 i2c: ack: "ACK" "A"
21503440-21503460 i2c: bit: "1"
21503420-21503440 i2c: bit: "1"
21503400-21503420 i2c: bit: "0"
21503379-21503400 i2c: bit: "0"
21503359-21503379 i2c: bit: "1"
21503339-21503359 i2c: bit: "1"
21503319-21503339 i2c: bit: "0"
21503298-21503319 i2c: bit: "0"
21503298-21503460 i2c: data-read: "Data read: 33" "DR: 33" "33"
21503463-21503483 i2c: ack: "ACK" "A"
21503654-21503675 i2c: bit: "1"
21503633-21503654 i2c: bit: "0"
21503613-21503633 i2c: bit: "0"
21503593-21503613 i2c: bit: "1"
21503572-21503593 i2c: bit: "0"
21503552-21503572 i2c: bit: "1"
21503532-21503552 i2c: bit: "0"
21503512-21503532 i2c: bit: "1"
21503512-21503675 i2c: data-read: "Data read: A9" "DR: A9" "A9"
21503676-21503697 i2c: nack: "NACK" "N"
21503719-21503719 i2c: stop: "Stop" "P"
21508960-21508960 i2c: start: "Start" "S"
21509147-21509169 i2c: bit: "0"
21509125-21509147 i2c: bit: "1"
21509104-21509125 i2c: bit: "0"
21509082-21509104 i2c: bit: "1"
21509061-21509082 i2c: bit: "0"
21509039-21509061 i2c: bit: "0"
21509017-21509039 i2c: bit: "0"
21508995-21509017 i2c: bit: "1"
21509147-21509169 i2c: address-write: "Write" "Wr" "W"
21508995-21509147 i2c: address-write: "Address write: 45" "AW: 45" "45"
21509167-21509189 i2c: ack: "ACK" "A"
21509370-21509391 i2c: bit: "0"
21509349-21509370 i2c: bit: "0"
21509327-21509349 i2c: bit: "1"
21509305-21509327 i2c: bit: "0"
21509284-21509305 i2c: bit: "0"
21509262-21509284 i2c: bit: "1"
21509241-21509262 i2c: bit: "0"
21509219-21509241 i2c: bit: "0"
21509219-21509391 i2c: data-write: "Data write: 24" "DW: 24" "24"
21509391-21509412 i2c: ack: "ACK" "A"
21509594-21509615 i2c: bit: "0"
21509573-21509594 i2c: bit: "0"
21509551-21509573 i2c: bit: "0"
21509529-21509551 i2c: bit: "0"
21509507-21509529 i2c: bit: "0"
21509486-21509507 i2c: bit: "0"
21509464-21509486 i2c: bit: "0"
21509442-21509464 i2c: bit: "0"
21509442-21509615 i2c: data-write: "Data write: 00" "DW: 00" "00"
21509615-21509636 i2c: ack: "ACK" "A"
29501783-29501783 i2c: repeat-start: "Start repeat" "Sr"
29501968-29501989 i2c: bit: "1"
29501947-29501968 i2c: bit: "1"
29501926-29501947 i2c: bit: "0"
29501904-29501926 i2c: bit: "1"
29501883-29501904 i2c: bit: "0"
29501861-29501883 i2c: bit: "0"
29501839-29501861 i2c: bit: "0"
29501817-29501839 i2c: bit: "1"
29501968-29501989 i2c: address-read: "Read" "Rd" "R"
29501817-29501968 i2c: address-read: "Address read: 45" "AR: 45" "45"
29501989-29502010 i2c: ack: "ACK" "A"
29502178-29502198 i2c: bit: "1"
29502158-29502178 i2c: bit: "1"
29502138-29502158 i2c: bit: "1"
29502117-29502138 i2c: bit: "0"
29502097-29502117 i2c: bit: "0"
29502077-29502097 i2c: bit: "1"
29502056-29502077 i2c: bit: "1"
29502036-29502056 i2c: bit: "0"
29502036-29502198 i2c: data-read: "Data read: 67" "DR: 67" "67"
29502201-29502221 i2c: ack: "ACK" "A"
29502392-29502412 i2c: bit: "0"
29502372-29502392 i2c: bit: "1"
29502352-29502372 i2c: bit: "0"
29502331-29502352 i2c: bit: "0"
29502311-29502331 i2c: bit: "0"
29502291-29502311 i2c: bit: "0"
29502271-29502291 i2c: bit: "1"
29502250-29502271 i2c: bit: "1"
29502250-29502412 i2c: data-read: "Data read: C2" "DR: C2" "C2"
29502415-29502435 i2c: ack: "ACK" "A"
29502606-29502626 i2c: bit: "1"
29502586-29502606 i2c: bit: "1"
29502566-29502586 i2c: bit: "1"
29502546-29502566 i2c: bit: "1"
29502525-29502546 i2c: bit: "1"
29502505-29502525 i2c: bit: "0"
29502485-29502505 i2c: bit: "1"
29502465-29502485 i2c: bit: "0"
29502465-29502626 i2c: data-read: "Data read: 5F" "DR: 5F" "5F"
29502629-29502649 i2c: ack: "ACK" "A"
29502821-29502842 i2c: bit: "1"
29502800-29502821 i2c: bit: "1"
29502780-29502800 i2c: bit: "1"
29502760-29502780 i2c: bit: "0"
29502740-29502760 i2c: bit: "0"
29502719-29502740 i2c: bit: "0"
29502699-29502719 i2c: bit: "1"
29502679-29502699 i2c: bit: "0"
29502679-29502842 i2c: data-read: "Data read: 47" "DR: 47" "47"
29502843-29502864 i2c: ack: "ACK" "A"
29503035-29503055 i2c: bit: "1"
29503015-29503035 i2c: bit: "0"
29502994-29503015 i2c: bit: "1"
29502974-29502994 i2c: bit: "1"
29502954-29502974 i2c: bit: "1"
29502933-29502954 i2c: bit: "1"
29502913-29502933 i2c: bit: "1"
29502893-29502913 i2c: bit: "1"
29502893-29503055 i2c: data-read: "Data read: FD" "DR: FD" "FD"
29503058-29503078 i2c: ack: "ACK" "A"
29503248-29503268 i2c: bit: "0"
29503228-29503248 i2c: bit: "0"
29503207-29503228 i2c: bit: "0"
29503187-29503207 i2c: bit: "1"
29503167-29503187 i2c: bit: "0"
29503147-29503167 i2c: bit: "1"
29503126-29503147 i2c: bit: "1"
29503106-29503126 i2c: bit: "0"
29503106-29503268 i2c: data-read: "Data read: 68" "DR: 68" "68"
29503270-29503290 i2c: nack: "NACK" "N"
29503313-29503313 i2c: stop: "Stop" "P"
29508539-29508539 i2c: start: "Start" "S"
29508725-29508747 i2c: bit: "0"
29508703-29508725 i2c: bit: "1"
29508682-29508703 i2c: bit: "0"
29508660-29508682 i2c: bit: "1"
29508639-29508660 i2c: bit: "0"
29508617-29508639 i2c: bit: "0"
29508595-29508617 i2c: bit: "0"
29508574-29508595 i2c: bit: "1"
29508725-29508747 i2c: address-write: "Write" "Wr" "W"
29508574-29508725 i2c: address-write: "Address write: 45" "AW: 45" "45"
29508745-29508767 i2c: ack: "ACK" "A"
29508949-29508971 i2c: bit: "0"
29508927-29508949 i2c: bit: "0"
29508905-29508927 i2c: bit: "1"
29508884-29508905 i2c: bit: "0"
29508862-29508884 i2c: bit: "0"
29508840-29508862 i2c: bit: "1"
29508819-29508840 i2c: bit: "0"
29508797-29508819 i2c: bit: "0"
29508797-29508971 i2c: data-write: "Data write: 24" "DW: 24" "24"
29508969-29508991 i2c: ack: "ACK" "A"
29509173-29509195 i2c: bit: "0"
29509151-29509173 i2c: bit: "0"
29509129-29509151 i2c: bit: "0"
29509107-29509129 i2c: bit: "0"
29509086-29509107 i2c: bit: "0"
29509064-29509086 i2c: bit: "0"
29509042-29509064 i2c: bit: "0"
29509020-29509042 i2c: bit: "0"
29509020-29509195 i2c: data-write: "Data write: 00" "DW: 00" "00"
29509193-29509215 i2c: ack: "ACK" "A"
37501377-37501377 i2c: repeat-start: "Start repeat" "Sr"
37501563-37501584 i2c: bit: "1"
37501542-37501563 i2c: bit: "1"
37501520-37501542 i2c: bit: "0"
37501499-37501520 i2c: bit: "1"
37501477-37501499 i2c: bit: "0"
37501456-37501477 i2c: bit: "0"
37501434-37501456 i2c: bit: "0"
37501412-37501434 i2c: bit: "1"
37501563-37501584 i2c: address-read: "Read" "Rd" "R"
37501412-37501563 i2c: address-read: "Address read: 45" "AR: 45" "45"
37501583-37501604 i2c: ack: "ACK" "A"
37501773-37501794 i2c: bit: "1"
37501752-37501773 i2c: bit: "1"
37501732-37501752 i2c: bit: "1"
37501712-37501732 i2c: bit: "0"
37501692-37501712 i2c: bit: "0"
37501671-37501692 i2c: bit: "1"
37501651-37501671 i2c: bit: "1"
37501631-37501651 i2c: bit: "0"
37501631-37501794 i2c: data-read: "Data read: 67" "DR: 67" "67"
37501795-37501816 i2c: ack: "ACK" "A"
37501987-37502007 i2c: bit: "0"
37501967-37501987 i2c: bit: "1"
37501946-37501967 i2c: bit: "0"
37501926-37501946 i2c: bit: "0"
37501906-37501926 i2c: bit: "1"
37501885-37501906 i2c: bit: "0"
37501865-37501885 i2c: bit: "1"
37501845-37501865 i2c: bit: "1"
37501845-37502007 i2c: data-read: "Data read: D2" "DR: D2" "D2"
37502010-37502030 i2c: ack: "ACK" "A"
37502201-37502221 i2c: bit: "0"
37502181-37502201 i2c: bit: "0"
37502160-37502181 i2c: bit: "1"
37502140-37502160 i2c: bit: "1"
37502120-37502140 i2c: bit: "1"
37502100-37502120 i2c: bit: "0"
37502079-37502100 i2c: bit: "0"
37502059-37502079 i2c: bit: "0"
37502059-37502221 i2c: data-read: "Data read: 1C" "DR: 1C" "1C"
37502224-37502244 i2c: ack: "ACK" "A"
37502415-37502435 i2c: bit: "1"
37502395-37502415 i2c: bit: "1"
37502375-37502395 i2c: bit: "1"
37502354-37502375 i2c: bit: "0"
37502334-37502354 i2c: bit: "0"
37502314-37502334 i2c: bit: "0"
37502293-37502314 i2c: bit: "1"
37502273-37502293 i2c: bit: "0"
37502273-37502435 i2c: data-read: "Data read: 47" "DR: 47" "47"
37502438-37502458 i2c: ack: "ACK" "A"
37502629-37502649 i2c: bit: "1"
37502609-37502629 i2c: bit: "0"
37502589-37502609 i2c: bit: "1"
37502569-37502589 i2c: bit: "1"
37502548-37502569 i2c: bit: "1"
37502528-37502548 i2c: bit: "0"
37502508-37502528 i2c: bit: "1"
37502487-37502508 i2c: bit: "1"
37502487-37502649 i2c: data-read: "Data read: DD" "DR: DD" "DD"
37502652-37502672 i2c: ack: "ACK" "A"
37502843-37502864 i2c: bit: "0"
37502822-37502843 i2c: bit: "1"
37502802-37502822 i2c: bit: "1"
37502782-37502802 i2c: bit: "1"
37502761-37502782 i2c: bit: "0"
37502741-37502761 i2c: bit: "1"
37502721-37502741 i2c: bit: "1"
37502701-37502721 i2c: bit: "1"
37502701-37502864 i2c: data-read: "Data read: EE" "DR: EE" "EE"
37502865-37502886 i2c: nack: "NACK" "N"
37502908-37502908 i2c: stop: "Stop" "P"
37508140-37508140 i2c: start: "Start" "S"
37508326-37508348 i2c: bit: "0"
37508304-37508326 i2c: bit: "1"
37508283-37508304 i2c: bit: "0"
37508261-37508283 i2c: bit: "1"
37508240-37508261 i2c: bit: "0"
37508218-37508240 i2c: bit: "0"
37508197-37508218 i2c: bit: "0"
37508175-37508197 i2c: bit: "1"
37508326-37508348 i2c: address-write: "Write" "Wr" "W"
37508175-37508326 i2c: address-write: "Address write: 45" "AW: 45" "45"
37508347-37508369 i2c: ack: "ACK" "A"
37508550-37508572 i2c: bit: "0"
37508528-37508550 i2c: bit: "0"
37508506-37508528 i2c: bit: "1"
37508485-37508506 i2c: bit: "0"
37508463-37508485 i2c: bit: "0"
37508441-37508463 i2c: bit: "1"
37508420-37508441 i2c: bit: "0"
37508398-37508420 i2c: bit: "0"
37508398-37508572 i2c: data-write: "Data write: 24" "DW: 24" "24"
37508570-37508592 i2c: ack: "ACK" "A"
37508772-37508793 i2c: bit: "0"
37508751-37508772 i2c: bit: "1"
37508729-37508751 i2c: bit: "1"
37508708-37508729 i2c: bit: "0"
37508686-37508708 i2c: bit: "1"
37508665-37508686 i2c: bit: "0"
37508643-37508665 i2c: bit: "0"
37508622-37508643 i2c: bit: "0"
37508622-37508793 i2c: data-write: "Data write: 16" "DW: 16" "16"
37508793-37508814 i2c: ack: "ACK" "A"
45500972-45500972 i2c: repeat-start: "Start repeat" "Sr"
45501158-45501180 i2c: bit: "1"
45501136-45501158 i2c: bit: "1"
45501115-45501136 i2c: bit: "0"
45501093-45501115 i2c: bit: "1"
45501072-45501093 i2c: bit: "0"
45501050-45501072 i2c: bit: "0"
45501029-45501050 i2c: bit: "0"
45501007-45501029 i2c: bit: "1"
45501158-45501180 i2c: address-read: "Read" "Rd" "R"
45501007-45501158 i2c: address-read: "Address read: 45" "AR: 45" "45"
45501178-45501200 i2c: ack: "ACK" "A"
45501367-45501387 i2c: bit: "1"
45501347-45501367 i2c: bit: "1"
45501327-45501347 i2c: bit: "1"
45501307-45501327 i2c: bit: "0"
45501286-45501307 i2c: bit: "0"
45501266-45501286 i2c: bit: "1"
45501246-45501266 i2c: bit: "1"
45501225-45501246 i2c: bit: "0"
45501225-45501387 i2c: data-read: "Data read: 67" "DR: 67" "67"
45501390-45501410 i2c: ack: "ACK" "A"
45501582-45501603 i2c: bit: "1"
45501561-45501582 i2c: bit: "0"
45501541-45501561 i2c: bit: "0"
45501521-45501541 i2c: bit: "0"
45501500-45501521 i2c: bit: "0"
45501480-45501500 i2c: bit: "1"
45501460-45501480 i2c: bit: "1"
45501440-45501460 i2c: bit: "1"
45501440-45501603 i2c: data-read: "Data read: E1" "DR: E1" "E1"
45501604-45501625 i2c: ack: "ACK" "A"
45501796-45501817 i2c: bit: "0"
45501775-45501796 i2c: bit: "1"
45501755-45501775 i2c: bit: "0"
45501735-45501755 i2c: bit: "1"
45501715-45501735 i2c: bit: "0"
45501694-45501715 i2c: bit: "0"
45501674-45501694 i2c: bit: "0"
45501654-45501674 i2c: bit: "1"
45501654-45501817 i2c: data-read: "Data read: 8A" "DR: 8A" "8A"
45501818-45501839 i2c: ack: "ACK" "A"
45502010-45502030 i2c: bit: "1"
45501990-45502010 i2c: bit: "1"
45501969-45501990 i2c: bit: "1"
45501949-45501969 i2c: bit: "0"
45501929-45501949 i2c: bit: "0"
45501908-45501929 i2c: bit: "0"
45501888-45501908 i2c: bit: "1"
45501868-45501888 i2c: bit: "0"
45501868-45502030 i2c: data-read: "Data read: 47" "DR: 47" "47"
45502033-45502053 i2c: ack: "ACK" "A"
45502224-45502244 i2c: bit: "1"
45502204-45502224 i2c: bit: "1"
45502183-45502204 i2c: bit: "1"
45502163-45502183 i2c: bit: "1"
45502143-45502163 i2c: bit: "1"
45502123-45502143 i2c: bit: "0"
45502102-45502123 i2c: bit: "1"
45502082-45502102 i2c: bit: "1"
45502082-45502244 i2c: data-read: "Data read: DF" "DR: DF" "DF"
45502247-45502267 i2c: ack: "ACK" "A"
45502437-45502457 i2c: bit: "0"
45502417-45502437 i2c: bit: "0"
45502397-45502417 i2c: bit: "1"
45502376-45502397 i2c: bit: "1"
45502356-45502376 i2c: bit: "0"
45502336-45502356 i2c: bit: "0"
45502316-45502336 i2c: bit: "0"
45502295-45502316 i2c: bit: "1"
45502295-45502457 i2c: data-read: "Data read: 8C" "DR: 8C" "8C"
45502460-45502480 i2c: nack: "NACK" "N"
45502502-45502502 i2c: stop: "Stop" "P"
45504803-45504803 i2c: start: "Start" "S"
45504990-45505012 i2c: bit: "0"
45504968-45504990 i2c: bit: "1"
45504947-45504968 i2c: bit: "0"
45504925-45504947 i2c: bit: "1"
45504904-45504925 i2c: bit: "0"
45504882-45504904 i2c: bit: "0"
45504860-45504882 i2c: bit: "0"
45504838-45504860 i2c: bit: "1"
45504990-45505012 i2c: address-write: "Write" "Wr" "W"
45504838-45504990 i2c: address-write: "Address write: 45" "AW: 45" "45"
45505010-45505032 i2c: ack: "ACK" "A"
45505213-45505235 i2c: bit: "0"
45505191-45505213 i2c: bit: "0"
45505170-45505191 i2c: bit: "1"
45505148-45505170 i2c: bit: "0"
45505127-45505148 i2c: bit: "0"
45505105-45505127 i2c: bit: "1"
45505084-45505105 i2c: bit: "0"
45505062-45505084 i2c: bit: "0"
45505062-45505235 i2c: data-write: "Data write: 24" "DW: 24" "24"
45505234-45505256 i2c: ack: "ACK" "A"
45505436-45505458 i2c: bit: "0"
45505414-45505436 i2c: bit: "1"
45505393-45505414 i2c: bit: "1"
45505372-45505393 i2c: bit: "0"
45505350-45505372 i2c: bit: "1"
45505328-45505350 i2c: bit: "0"
45505307-45505328 i2c: bit: "0"
45505285-45505307 i2c: bit: "0"
45505285-45505458 i2c: data-write: "Data write: 16" "DW: 16" "16"
45505456-45505478 i2c: ack: "ACK" "A"
53500566-53500566 i2c: repeat-start: "Start repeat" "Sr"
53500752-53500774 i2c: bit: "1"
53500730-53500752 i2c: bit: "1"
53500709-53500730 i2c: bit: "0"
53500687-53500709 i2c: bit: "1"
53500666-53500687 i2c: bit: "0"
53500645-53500666 i2c: bit: "0"
53500623-53500645 i2c: bit: "0"
53500601-53500623 i2c: bit: "1"
53500752-53500774 i2c: address-read: "Read" "Rd" "R"
53500601-53500752 i2c: address-read: "Address read: 45" "AR: 45" "45"
53500772-53500794 i2c: ack: "ACK" "A"
53500962-53500983 i2c: bit: "1"
53500941-53500962 i2c: bit: "1"
53500921-53500941 i2c: bit: "1"
53500901-53500921 i2c: bit: "0"
53500880-53500901 i2c: bit: "0"
53500860-53500880 i2c: bit: "1"
53500840-53500860 i2c: bit: "1"
53500820-53500840 i2c: bit: "0"
53500820-53500983 i2c: data-read: "Data read: 67" "DR: 67" "67"
53500984-53501005 i2c: ack: "ACK" "A"
53501176-53501197 i2c: bit: "1"
53501155-53501176 i2c: bit: "0"
53501135-53501155 i2c: bit: "0"
53501115-53501135 i2c: bit: "0"
53501095-53501115 i2c: bit: "0"
53501074-53501095 i2c: bit: "1"
53501054-53501074 i2c: bit: "1"
53501034-53501054 i2c: bit: "1"
53501034-53501197 i2c: data-read: "Data read: E1" "DR: E1" "E1"
53501199-53501220 i2c: ack: "ACK" "A"
53501390-53501410 i2c: bit: "0"
53501370-53501390 i2c: bit: "1"
53501349-53501370 i2c: bit: "0"
53501329-53501349 i2c: bit: "1"
53501309-53501329 i2c: bit: "0"
53501289-53501309 i2c: bit: "0"
53501268-53501289 i2c: bit: "0"
53501248-53501268 i2c: bit: "1"
53501248-53501410 i2c: data-read: "Data read: 8A" "DR: 8A" "8A"
53501413-53501433 i2c: ack: "ACK" "A"
53501604-53501624 i2c: bit: "1"
53501584-53501604 i2c: bit: "1"
53501564-53501584 i2c: bit: "1"
53501543-53501564 i2c: bit: "0"
53501523-53501543 i2c: bit: "0"
53501503-53501523 i2c: bit: "0"
53501482-53501503 i2c: bit: "1"
53501462-53501482 i2c: bit: "0"
53501462-53501624 i2c: data-read: "Data read: 47" "DR: 47" "47"
53501627-53501647 i2c: ack: "ACK" "A"
53501818-53501838 i2c: bit: "0"
53501798-53501818 i2c: bit: "1"
53501778-53501798 i2c: bit: "0"
53501757-53501778 i2c: bit: "1"
53501737-53501757 i2c: bit: "1"
53501717-53501737 i2c: bit: "0"
53501697-53501717 i2c: bit: "0"
53501676-53501697 i2c: bit: "1"
53501676-53501838 i2c: data-read: "Data read: 9A" "DR: 9A" "9A"
53501841-53501861 i2c: ack: "ACK" "A"
53502031-53502051 i2c: bit: "0"
53502011-53502031 i2c: bit: "0"
53501991-53502011 i2c: bit: "1"
53501971-53501991 i2c: bit: "0"
53501950-53501971 i2c: bit: "0"
53501930-53501950 i2c: bit: "0"
53501910-53501930 i2c: bit: "1"
53501890-53501910 i2c: bit: "0"
53501890-53502051 i2c: data-read: "Data read: 44" "DR: 44" "44"
53502054-53502074 i2c: nack: "NACK" "N"
53502096-53502096 i2c: stop: "Stop" "P"
53504410-53504410 i2c: start: "Start" "S"
53504597-53504619 i2c: bit: "0"
53504575-53504597 i2c: bit: "1"
53504554-53504575 i2c: bit: "0"
53504532-53504554 i2c: bit: "1"
53504511-53504532 i2c: bit: "0"
53504489-53504511 i2c: bit: "0"
53504467-53504489 i2c: bit: "0"
53504445-53504467 i2c: bit: "1"
53504597-53504619 i2c: address-write: "Write" "Wr" "W"
53504445-53504597 i2c: address-write: "Address write: 45" "AW: 45" "45"
53504617-53504639 i2c: ack: "ACK" "A"
53504820-53504841 i2c: bit: "0"
53504799-53504820 i2c: bit: "0"
53504777-53504799 i2c: bit: "1"
53504756-53504777 i2c: bit: "0"
53504734-53504756 i2c: bit: "0"
53504712-53504734 i2c: bit: "1"
53504691-53504712 i2c: bit: "0"
53504669-53504691 i2c: bit: "0"
53504669-53504841 i2c: data-write: "Data write: 24" "DW: 24" "24"
53504841-53504862 i2c: ack: "ACK" "A"
53505043-53505065 i2c: bit: "0"
53505021-53505043 i2c: bit: "1"
53505000-53505021 i2c: bit: "1"
53504979-53505000 i2c: bit: "0"
53504957-53504979 i2c: bit: "1"
53504936-53504957 i2c: bit: "0"
53504914-53504936 i2c: bit: "0"
53504892-53504914 i2c: bit: "0"
53504892-53505065 i2c: data-write: "Data write: 16" "DW: 16" "16"
53505063-53505085 i2c: ack: "ACK" "A"
61500161-61500161 i2c: repeat-start: "Start repeat" "Sr"
61500347-61500368 i2c: bit: "1"
61500326-61500347 i2c: bit: "1"
61500305-61500326 i2c: bit: "0"
61500283-61500305 i2c: bit: "1"
61500262-61500283 i2c: bit: "0"
61500240-61500262 i2c: bit: "0"
61500218-61500240 i2c: bit: "0"
61500196-61500218 i2c: bit: "1"
61500347-61500368 i2c: address-read: "Read" "Rd" "R"
61500196-61500347 i2c: address-read: "Address read: 45" "AR: 45" "45"
61500368-61500389 i2c: ack: "ACK" "A"
61500557-61500577 i2c: bit: "1"
61500537-61500557 i2c: bit: "1"
61500516-61500537 i2c: bit: "1"
61500496-61500516 i2c: bit: "0"
61500476-61500496 i2c: bit: "0"
61500456-61500476 i2c: bit: "1"
61500435-61500456 i2c: bit: "1"
61500415-61500435 i2c: bit: "0"
61500415-61500577 i2c: data-read: "Data read: 67" "DR: 67" "67"
61500580-61500600 i2c: ack: "ACK" "A"
61500771-61500791 i2c: bit: "0"
61500751-61500771 i2c: bit: "1"
61500731-61500751 i2c: bit: "1"
61500710-61500731 i2c: bit: "0"
61500690-61500710 i2c: bit: "1"
61500670-61500690 i2c: bit: "1"
61500650-61500670 i2c: bit: "1"
61500629-61500650 i2c: bit: "1"
61500629-61500791 i2c: data-read: "Data read: F6" "DR: F6" "F6"
61500794-61500814 i2c: ack: "ACK" "A"
61500985-61501005 i2c: bit: "0"
61500965-61500985 i2c: bit: "1"
61500945-61500965 i2c: bit: "1"
61500925-61500945 i2c: bit: "1"
61500904-61500925 i2c: bit: "1"
61500884-61500904 i2c: bit: "0"
61500864-61500884 i2c: bit: "1"
61500843-61500864 i2c: bit: "0"
61500843-61501005 i2c: data-read: "Data read: 5E" "DR: 5E" "5E"
61501008-61501028 i2c: ack: "ACK" "A"
61501200-61501221 i2c: bit: "1"
61501179-61501200 i2c: bit: "1"
61501159-61501179 i2c: bit: "1"
61501139-61501159 i2c: bit: "0"
61501118-61501139 i2c: bit: "0"
61501098-61501118 i2c: bit: "0"
61501078-61501098 i2c: bit: "1"
61501058-61501078 i2c: bit: "0"
61501058-61501221 i2c: data-read: "Data read: 47" "DR: 47" "47"
61501222-61501243 i2c: ack: "ACK" "A"
61501414-61501435 i2c: bit: "1"
61501393-61501414 i2c: bit: "0"
61501373-61501393 i2c: bit: "0"
61501353-61501373 i2c: bit: "1"
61501333-61501353 i2c: bit: "0"
61501312-61501333 i2c: bit: "1"
61501292-61501312 i2c: bit: "0"
61501272-61501292 i2c: bit: "1"
61501272-61501435 i2c: data-read: "Data read: A9" "DR: A9" "A9"
61501436-61501457 i2c: ack: "ACK" "A"
61501627-61501647 i2c: bit: "0"
61501607-61501627 i2c: bit: "1"
61501586-61501607 i2c: bit: "0"
61501566-61501586 i2c: bit: "0"
61501546-61501566 i2c: bit: "1"
61501526-61501546 i2c: bit: "0"
61501505-61501526 i2c: bit: "1"
61501485-61501505 i2c: bit: "1"
61501485-61501647 i2c: data-read: "Data read: D2" "DR: D2" "D2"
61501649-61501669 i2c: nack: "NACK" "N"
61501692-61501692 i2c: stop: "Stop" "P"
61504004-61504004 i2c: start: "Start" "S"
61504191-61504213 i2c: bit: "0"
61504169-61504191 i2c: bit: "1"
61504148-61504169 i2c: bit: "0"
61504126-61504148 i2c: bit: "1"
61504105-61504126 i2c: bit: "0"
61504083-61504105 i2c: bit: "0"
61504061-61504083 i2c: bit: "0"
61504039-61504061 i2c: bit: "1"
61504191-61504213 i2c: address-write: "Write" "Wr" "W"
61504039-61504191 i2c: address-write: "Address write: 45" "AW: 45" "45"
61504211-61504233 i2c: ack: "ACK" "A"
61504414-61504435 i2c: bit: "0"
61504393-61504414 i2c: bit: "0"
61504371-61504393 i2c: bit: "1"
61504350-61504371 i2c: bit: "0"
61504328-61504350 i2c: bit: "0"
61504306-61504328 i2c: bit: "1"
61504285-61504306 i2c: bit: "0"
61504263-61504285 i2c: bit: "0"
61504263-61504435 i2c: data-write: "Data write: 24" "DW: 24" "24"
61504435-61504456 i2c: ack: "ACK" "A"
61504637-61504659 i2c: bit: "0"
61504615-61504637 i2c: bit: "1"
61504594-61504615 i2c: bit: "1"
61504573-61504594 i2c: bit: "0"
61504551-61504573 i2c: bit: "1"
61504530-61504551 i2c: bit: "0"
61504508-61504530 i2c: bit: "0"
61504486-61504508 i2c: bit: "0"
61504486-61504659 i2c: data-write: "Data write: 16" "DW: 16" "16"
61504657-61504679 i2c: ack: "ACK" "A"
69499756-69499756 i2c: repeat-start: "Start repeat" "Sr"
69499942-69499963 i2c: bit: "1"
69499921-69499942 i2c: bit: "1"
69499900-69499921 i2c: bit: "0"
69499878-69499900 i2c: bit: "1"
69499857-69499878 i2c: bit: "0"
69499835-69499857 i2c: bit: "0"
69499813-69499835 i2c: bit: "0"
69499791-69499813 i2c: bit: "1"
69499942-69499963 i2c: address-read: "Read" "Rd" "R"
69499791-69499942 i2c: address-read: "Address read: 45" "AR: 45" "45"
69499962-69499983 i2c: ack: "ACK" "A"
69500152-69500172 i2c: bit: "1"
69500132-69500152 i2c: bit: "1"
69500111-69500132 i2c: bit: "1"
69500091-69500111 i2c: bit: "0"
69500071-69500091 i2c: bit: "0"
69500050-69500071 i2c: bit: "1"
69500030-69500050 i2c: bit: "1"
69500010-69500030 i2c: bit: "0"
69500010-69500172 i2c: data-read: "Data read: 67" "DR: 67" "67"
69500175-69500195 i2c: ack: "ACK" "A"
69500366-69500386 i2c: bit: "1"
69500346-69500366 i2c: bit: "0"
69500325-69500346 i2c: bit: "0"
69500305-69500325 i2c: bit: "0"
69500285-69500305 i2c: bit: "1"
69500265-69500285 i2c: bit: "1"
69500244-69500265 i2c: bit: "1"
69500224-69500244 i2c: bit: "1"
69500224-69500386 i2c: data-read: "Data read: F1" "DR: F1" "F1"
69500389-69500409 i2c: ack: "ACK" "A"
69500580-69500600 i2c: bit: "1"
69500560-69500580 i2c: bit: "0"
69500540-69500560 i2c: bit: "0"
69500519-69500540 i2c: bit: "1"
69500499-69500519 i2c: bit: "0"
69500479-69500499 i2c: bit: "0"
69500458-69500479 i2c: bit: "1"
69500438-69500458 i2c: bit: "1"
69500438-69500600 i2c: data-read: "Data read: C9" "DR: C9" "C9"
69500603-69500623 i2c: ack: "ACK" "A"
69500794-69500814 i2c: bit: "0"
69500774-69500794 i2c: bit: "1"
69500754-69500774 i2c: bit: "1"
69500734-69500754 i2c: bit: "0"
69500713-69500734 i2c: bit: "0"
69500693-69500713 i2c: bit: "0"
69500673-69500693 i2c: bit: "1"
69500652-69500673 i2c: bit: "0"
69500652-69500814 i2c: data-read: "Data read: 46" "DR: 46" "46"
69500817-69500837 i2c: ack: "ACK" "A"
69501009-69501030 i2c: bit: "1"
69500988-69501009 i2c: bit: "1"
69500968-69500988 i2c: bit: "0"
69500948-69500968 i2c: bit: "0"
69500927-69500948 i2c: bit: "1"
69500907-69500927 i2c: bit: "1"
69500887-69500907 i2c: bit: "1"
69500867-69500887 i2c: bit: "1"
69500867-69501030 i2c: data-read: "Data read: F3" "DR: F3" "F3"
69501031-69501052 i2c: ack: "ACK" "A"
69501222-69501243 i2c: bit: "1"
69501201-69501222 i2c: bit: "1"
69501181-69501201 i2c: bit: "0"
69501161-69501181 i2c: bit: "0"
69501141-69501161 i2c: bit: "0"
69501120-69501141 i2c: bit: "0"
69501100-69501120 i2c: bit: "0"
69501080-69501100 i2c: bit: "1"
69501080-69501243 i2c: data-read: "Data read: 83" "DR: 83" "83"
69501244-69501265 i2c: nack: "NACK" "N"
69501287-69501287 i2c: stop: "Stop" "P"
69503600-69503600 i2c: start: "Start" "S"
69503786-69503808 i2c: bit: "0"
69503764-69503786 i2c: bit: "1"
69503743-69503764 i2c: bit: "0"
69503721-69503743 i2c: bit: "1"
69503700-69503721 i2c: bit: "0"
69503678-69503700 i2c: bit: "0"
69503656-69503678 i2c: bit: "0"
69503635-69503656 i2c: bit: "1"
69503786-69503808 i2c: address-write: "Write" "Wr" "W"
69503635-69503786 i2c: address-write: "Address write: 45" "AW: 45" "45"
69503806-69503828 i2c: ack: "ACK" "A"
69504010-69504032 i2c: bit: "0"
69503988-69504010 i2c: bit: "0"
69503966-69503988 i2c: bit: "1"
69503945-69503966 i2c: bit: "0"
69503923-69503945 i2c: bit: "0"
69503901-69503923 i2c: bit: "1"
69503880-69503901 i2c: bit: "0"
69503858-69503880 i2c: bit: "0"
69503858-69504032 i2c: data-write: "Data write: 24" "DW: 24" "24"
69504030-69504052 i2c: ack: "ACK" "A"
69504232-69504253 i2c: bit: "0"
69504211-69504232 i2c: bit: "1"
69504189-69504211 i2c: bit: "1"
69504168-69504189 i2c: bit: "0"
69504146-69504168 i2c: bit: "1"
69504125-69504146 i2c: bit: "0"
69504103-69504125 i2c: bit: "0"
69504081-69504103 i2c: bit: "0"
69504081-69504253 i2c: data-write: "Data write: 16" "DW: 16" "16"
69504253-69504274 i2c: ack: "ACK" "A"
77499350-77499350 i2c: repeat-start: "Start repeat" "Sr"
77499536-77499557 i2c: bit: "1"
77499515-77499536 i2c: bit: "1"
77499494-77499515 i2c: bit: "0"
77499472-77499494 i2c: bit: "1"
77499451-77499472 i2c: bit: "0"
77499429-77499451 i2c: bit: "0"
77499407-77499429 i2c: bit: "0"
77499385-77499407 i2c: bit: "1"
77499536-77499557 i2c: address-read: "Read" "Rd" "R"
77499385-77499536 i2c: address-read: "Address read: 45" "AR: 45" "45"
77499557-77499578 i2c: ack: "ACK" "A"
77499746-77499766 i2c: bit: "0"
77499726-77499746 i2c: bit: "0"
77499705-77499726 i2c: bit: "0"
77499685-77499705 i2c: bit: "1"
77499665-77499685 i2c: bit: "0"
77499645-77499665 i2c: bit: "1"
77499624-77499645 i2c: bit: "1"
77499604-77499624 i2c: bit: "0"
77499604-77499766 i2c: data-read: "Data read: 68" "DR: 68" "68"
77499769-77499789 i2c: ack: "ACK" "A"
77499960-77499980 i2c: bit: "1"
77499940-77499960 i2c: bit: "0"
77499920-77499940 i2c: bit: "0"
77499899-77499920 i2c: bit: "0"
77499879-77499899 i2c: bit: "0"
77499859-77499879 i2c: bit: "1"
77499839-77499859 i2c: bit: "0"
77499818-77499839 i2c: bit: "0"
77499818-77499980 i2c: data-read: "Data read: 21" "DR: 21" "21"
77499983-77500003 i2c: ack: "ACK" "A"
77500174-77500194 i2c: bit: "0"
77500154-77500174 i2c: bit: "0"
77500134-77500154 i2c: bit: "1"
77500114-77500134 i2c: bit: "0"
77500093-77500114 i2c: bit: "1"
77500073-77500093 i2c: bit: "0"
77500053-77500073 i2c: bit: "1"
77500033-77500053 i2c: bit: "0"
77500033-77500194 i2c: data-read: "Data read: 54" "DR: 54" "54"
77500197-77500217 i2c: ack: "ACK" "A"
77500389-77500410 i2c: bit: "0"
77500368-77500389 i2c: bit: "1"
77500348-77500368 i2c: bit: "1"
77500328-77500348 i2c: bit: "0"
77500308-77500328 i2c: bit: "0"
77500287-77500308 i2c: bit: "0"
77500267-77500287 i2c: bit: "1"
77500247-77500267 i2c: bit: "0"
77500247-77500410 i2c: data-read: "Data read: 46" "DR: 46" "46"
77500411-77500432 i2c: ack: "ACK" "A"
77500603-77500623 i2c: bit: "1"
77500583-77500603 i2c: bit: "1"
77500562-77500583 i2c: bit: "0"
77500542-77500562 i2c: bit: "1"
77500522-77500542 i2c: bit: "1"
77500501-77500522 i2c: bit: "1"
77500481-77500501 i2c: bit: "1"
77500461-77500481 i2c: bit: "1"
77500461-77500623 i2c: data-read: "Data read: FB" "DR: FB" "FB"
77500626-77500646 i2c: ack: "ACK" "A"
77500816-77500836 i2c: bit: "0"
77500796-77500816 i2c: bit: "1"
77500775-77500796 i2c: bit: "0"
77500755-77500775 i2c: bit: "1"
77500735-77500755 i2c: bit: "1"
77500715-77500735 i2c: bit: "1"
77500694-77500715 i2c: bit: "0"
77500674-77500694 i2c: bit: "0"
77500674-77500836 i2c: data-read: "Data read: 3A" "DR: 3A" "3A"
77500838-77500858 i2c: nack: "NACK" "N"
77500881-77500881 i2c: stop: "Stop" "P"
77503194-77503194 i2c: start: "Start" "S"
77503381-77503403 i2c: bit: "0"
77503359-77503381 i2c: bit: "1"
77503338-77503359 i2c: bit: "0"
77503316-77503338 i2c: bit: "1"
77503295-77503316 i2c: bit: "0"
77503273-77503295 i2c: bit: "0"
77503251-77503273 i2c: bit: "0"
77503229-77503251 i2c: bit: "1"
77503381-77503403 i2c: address-write: "Write" "Wr" "W"
77503229-77503381 i2c: address-write: "Address write: 45" "AW: 45" "45"
77503401-77503423 i2c: ack: "ACK" "A"
77503604-77503625 i2c: bit: "0"
77503583-77503604 i2c: bit: "0"
77503561-77503583 i2c: bit: "1"
77503540-77503561 i2c: bit: "0"
77503518-77503540 i2c: bit: "0"
77503496-77503518 i2c: bit: "1"
77503475-77503496 i2c: bit: "0"
77503453-77503475 i2c: bit: "0"
77503453-77503625 i2c: data-write: "Data write: 24" "DW: 24" "24"
77503625-77503646 i2c: ack: "ACK" "A"
77503827-77503849 i2c: bit: "0"
77503805-77503827 i2c: bit: "1"
77503784-77503805 i2c: bit: "1"
77503763-77503784 i2c: bit: "0"
77503741-77503763 i2c: bit: "1"
77503720-77503741 i2c: bit: "0"
77503698-77503720 i2c: bit: "0"
77503676-77503698 i2c: bit: "0"
77503676-77503849 i2c: data-write: "Data write: 16" "DW: 16" "16"
77503847-77503869 i2c: ack: "ACK" "A"
85498946-85498946 i2c: repeat-start: "Start repeat" "Sr"
85499132-85499153 i2c: bit: "1"
85499111-85499132 i2c: bit: "1"
85499089-85499111 i2c: bit: "0"
85499068-85499089 i2c: bit: "1"
85499046-85499068 i2c: bit: "0"
85499025-85499046 i2c: bit: "0"
85499003-85499025 i2c: bit: "0"
85498981-85499003 i2c: bit: "1"
85499132-85499153 i2c: address-read: "Read" "Rd" "R"
85498981-85499132 i2c: address-read: "Address read: 45" "AR: 45" "45"
85499152-85499173 i2c: ack: "ACK" "A"
85499342-85499363 i2c: bit: "0"
85499321-85499342 i2c: bit: "0"
85499301-85499321 i2c: bit: "0"
85499281-85499301 i2c: bit: "1"
85499261-85499281 i2c: bit: "0"
85499240-85499261 i2c: bit: "1"
85499220-85499240 i2c: bit: "1"
85499200-85499220 i2c: bit: "0"
85499200-85499363 i2c: data-read: "Data read: 68" "DR: 68" "68"
85499364-85499385 i2c: ack: "ACK" "A"
85499556-85499576 i2c: bit: "0"
85499536-85499556 i2c: bit: "0"
85499515-85499536 i2c: bit: "1"
85499495-85499515 i2c: bit: "1"
85499475-85499495 i2c: bit: "1"
85499454-85499475 i2c: bit: "0"
85499434-85499454 i2c: bit: "0"
85499414-85499434 i2c: bit: "0"
85499414-85499576 i2c: data-read: "Data read: 1C" "DR: 1C" "1C"
85499579-85499599 i2c: ack: "ACK" "A"
85499770-85499790 i2c: bit: "1"
85499750-85499770 i2c: bit: "0"
85499729-85499750 i2c: bit: "1"
85499709-85499729 i2c: bit: "1"
85499689-85499709 i2c: bit: "1"
85499669-85499689 i2c: bit: "0"
85499648-85499669 i2c: bit: "1"
85499628-85499648 i2c: bit: "1"
85499628-85499790 i2c: data-read: "Data read: DD" "DR: DD" "DD"
85499793-85499813 i2c: ack: "ACK" "A"
85499984-85500004 i2c: bit: "0"
85499964-85499984 i2c: bit: "1"
85499944-85499964 i2c: bit: "1"
85499923-85499944 i2c: bit: "0"
85499903-85499923 i2c: bit: "0"
85499883-85499903 i2c: bit: "0"
85499862-85499883 i2c: bit: "1"
85499842-85499862 i2c: bit: "0"
85499842-85500004 i2c: data-read: "Data read: 46" "DR: 46" "46"
85500007-85500027 i2c: ack: "ACK" "A"
85500198-85500218 i2c: bit: "1"
85500178-85500198 i2c: bit: "0"
85500158-85500178 i2c: bit: "0"
85500138-85500158 i2c: bit: "1"
85500117-85500138 i2c: bit: "0"
85500097-85500117 i2c: bit: "0"
85500077-85500097 i2c: bit: "0"
85500056-85500077 i2c: bit: "1"
85500056-85500218 i2c: data-read: "Data read: 89" "DR: 89" "89"
85500221-85500241 i2c: ack: "ACK" "A"
85500412-85500433 i2c: bit: "0"
85500391-85500412 i2c: bit: "0"
85500371-85500391 i2c: bit: "0"
85500351-85500371 i2c: bit: "0"
85500330-85500351 i2c: bit: "0"
85500310-85500330 i2c: bit: "1"
85500290-85500310 i2c: bit: "0"
85500270-85500290 i2c: bit: "1"
85500270-85500433 i2c: data-read: "Data read: A0" "DR: A0" "A0"
85500434-85500455 i2c: nack: "NACK" "N"
85500477-85500477 i2c: stop: "Stop" "P"
85502789-85502789 i2c: start: "Start" "S"
85502975-85502996 i2c: bit: "0"
85502954-85502975 i2c: bit: "1"
85502932-85502954 i2c: bit: "0"
85502911-85502932 i2c: bit: "1"
85502889-85502911 i2c: bit: "0"
85502868-85502889 i2c: bit: "0"
85502846-85502868 i2c: bit: "0"
85502824-85502846 i2c: bit: "1"
85502975-85502996 i2c: address-write: "Write" "Wr" "W"
85502824-85502975 i2c: address-write: "Address write: 45" "AW: 45" "45"
85502996-85503017 i2c: ack: "ACK" "A"
85503199-85503221 i2c: bit: "0"
85503177-85503199 i2c: bit: "0"
85503155-85503177 i2c: bit: "1"
85503134-85503155 i2c: bit: "0"
85503112-85503134 i2c: bit: "0"
85503091-85503112 i2c: bit: "1"
85503069-85503091 i2c: bit: "0"
85503048-85503069 i2c: bit: "0"
85503048-85503221 i2c: data-write: "Data write: 24" "DW: 24" "24"
85503219-85503241 i2c: ack: "ACK" "A"
85503422-85503444 i2c: bit: "0"
85503400-85503422 i2c: bit: "1"
85503379-85503400 i2c: bit: "1"
85503357-85503379 i2c: bit: "0"
85503336-85503357 i2c: bit: "1"
85503314-85503336 i2c: bit: "0"
85503293-85503314 i2c: bit: "0"
85503271-85503293 i2c: bit: "0"
85503271-85503444 i2c: data-write: "Data write: 16" "DW: 16" "16"
85503442-85503464 i2c: ack: "ACK" "A"
93498541-93498541 i2c: repeat-start: "Start repeat" "Sr"
93498727-93498749 i2c: bit: "1"
93498705-93498727 i2c: bit: "1"
93498684-93498705 i2c: bit: "0"
93498662-93498684 i2c: bit: "1"
93498641-93498662 i2c: bit: "0"
93498619-93498641 i2c: bit: "0"
93498598-93498619 i2c: bit: "0"
93498576-93498598 i2c: bit: "1"
93498727-93498749 i2c: address-read: "Read" "Rd" "R"
93498576-93498727 i2c: address-read: "Address read: 45" "AR: 45" "45"
93498747-93498769 i2c: ack: "ACK" "A"
93498936-93498956 i2c: bit: "0"
93498916-93498936 i2c: bit: "0"
93498896-93498916 i2c: bit: "0"
93498876-93498896 i2c: bit: "1"
93498855-93498876 i2c: bit: "0"
93498835-93498855 i2c: bit: "1"
93498815-93498835 i2c: bit: "1"
93498794-93498815 i2c: bit: "0"
93498794-93498956 i2c: data-read: "Data read: 68" "DR: 68" "68"
93498959-93498979 i2c: ack: "ACK" "A"
93499151-93499172 i2c: bit: "1"
93499130-93499151 i2c: bit: "1"
93499110-93499130 i2c: bit: "1"
93499090-93499110 i2c: bit: "0"
93499069-93499090 i2c: bit: "1"
93499049-93499069 i2c: bit: "1"
93499029-93499049 i2c: bit: "0"
93499009-93499029 i2c: bit: "0"
93499009-93499172 i2c: data-read: "Data read: 37" "DR: 37" "37"
93499173-93499194 i2c: ack: "ACK" "A"
93499365-93499386 i2c: bit: "1"
93499344-93499365 i2c: bit: "0"
93499324-93499344 i2c: bit: "0"
93499304-93499324 i2c: bit: "0"
93499284-93499304 i2c: bit: "1"
93499263-93499284 i2c: bit: "1"
93499243-93499263 i2c: bit: "0"
93499223-93499243 i2c: bit: "1"
93499223-93499386 i2c: data-read: "Data read: B1" "DR: B1" "B1"
93499387-93499408 i2c: ack: "ACK" "A"
93499579-93499599 i2c: bit: "0"
93499559-93499579 i2c: bit: "1"
93499538-93499559 i2c: bit: "1"
93499518-93499538 i2c: bit: "0"
93499498-93499518 i2c: bit: "0"
93499477-93499498 i2c: bit: "0"
93499457-93499477 i2c: bit: "1"
93499437-93499457 i2c: bit: "0"
93499437-93499599 i2c: data-read: "Data read: 46" "DR: 46" "46"
93499602-93499622 i2c: ack: "ACK" "A"
93499793-93499813 i2c: bit: "1"
93499773-93499793 i2c: bit: "0"
93499752-93499773 i2c: bit: "1"
93499732-93499752 i2c: bit: "0"
93499712-93499732 i2c: bit: "0"
93499692-93499712 i2c: bit: "0"
93499671-93499692 i2c: bit: "1"
93499651-93499671 i2c: bit: "1"
93499651-93499813 i2c: data-read: "Data read: C5" "DR: C5" "C5"
93499816-93499836 i2c: ack: "ACK" "A"
93500006-93500026 i2c: bit: "0"
93499986-93500006 i2c: bit: "0"
93499966-93499986 i2c: bit: "0"
93499945-93499966 i2c: bit: "0"
93499925-93499945 i2c: bit: "0"
93499905-93499925 i2c: bit: "1"
93499885-93499905 i2c: bit: "1"
93499864-93499885 i2c: bit: "1"
93499864-93500026 i2c: data-read: "Data read: E0" "DR: E0" "E0"
93500029-93500049 i2c: nack: "NACK" "N"
93500071-93500071 i2c: stop: "Stop" "P"
93502383-93502383 i2c: start: "Start" "S"
93502569-93502590 i2c: bit: "0"
93502548-93502569 i2c: bit: "1"
93502526-93502548 i2c: bit: "0"
93502505-93502526 i2c: bit: "1"
93502483-93502505 i2c: bit: "0"
93502462-93502483 i2c: bit: "0"
93502440-93502462 i2c: bit: "0"
93502418-93502440 i2c: bit: "1"
93502569-93502590 i2c: address-write: "Write" "Wr" "W"
93502418-93502569 i2c: address-write: "Address write: 45" "AW: 45" "45"
93502590-93502611 i2c: ack: "ACK" "A"
93502793-93502815 i2c: bit: "0"
93502771-93502793 i2c: bit: "0"
93502749-93502771 i2c: bit: "1"
93502728-93502749 i2c: bit: "0"
93502706-93502728 i2c: bit: "0"
93502685-93502706 i2c: bit: "1"
93502663-93502685 i2c: bit: "0"
93502642-93502663 i2c: bit: "0"
93502642-93502815 i2c: data-write: "Data write: 24" "DW: 24" "24"
93502813-93502835 i2c: ack: "ACK" "A"
93503016-93503038 i2c: bit: "0"
93502994-93503016 i2c: bit: "1"
93502972-93502994 i2c: bit: "1"
93502951-93502972 i2c: bit: "0"
93502929-93502951 i2c: bit: "1"
93502908-93502929 i2c: bit: "0"
93502886-93502908 i2c: bit: "0"
93502865-93502886 i2c: bit: "0"
93502865-93503038 i2c: data-write: "Data write: 16" "DW: 16" "16"
93503036-93503058 i2c: ack: "ACK" "A"
