645807-645807 i2c: start: "Start" "S"
646142-646153 i2c: bit: "0"
646131-646142 i2c: bit: "0"
646121-646131 i2c: bit: "1"
646111-646121 i2c: bit: "0"
646100-646111 i2c: bit: "0"
646090-646100 i2c: bit: "1"
646080-646090 i2c: bit: "0"
646069-646080 i2c: bit: "1"
646142-646153 i2c: address-write: "Write" "Wr" "W"
646069-646142 i2c: address-write: "Address write: 52" "AW: 52" "52"
646152-646163 i2c: ack: "ACK" "A"
646399-646410 i2c: bit: "0"
646388-646399 i2c: bit: "0"
646378-646388 i2c: bit: "0"
646368-646378 i2c: bit: "0"
646357-646368 i2c: bit: "0"
646347-646357 i2c: bit: "0"
646337-646347 i2c: bit: "1"
646327-646337 i2c: bit: "0"
646327-646410 i2c: data-write: "Data write: 40" "DW: 40" "40"
646409-646420 i2c: ack: "ACK" "A"
646663-646673 i2c: bit: "0"
646653-646663 i2c: bit: "0"
646643-646653 i2c: bit: "0"
646633-646643 i2c: bit: "0"
646622-646633 i2c: bit: "0"
646612-646622 i2c: bit: "0"
646602-646612 i2c: bit: "0"
646591-646602 i2c: bit: "0"
646591-646673 i2c: data-write: "Data write: 00" "DW: 00" "00"
646674-646684 i2c: ack: "ACK" "A"
646743-646743 i2c: stop: "Stop" "P"
