3116254-3116305 tlc5620: dac-select: "DAC select: DACA" "DAC sel: DACA" "DAC: DACA" "D: DACA" "DACA" "A"
3116305-3116331 tlc5620: gain: "Gain: x1" "G: x1" "x1"
3116331-3116536 tlc5620: value: "DAC value: 149" "Value: 149" "Val: 149" "V: 149" "149"
3116254-3116279 tlc5620: bit: "0"
3116279-3116305 tlc5620: bit: "0"
3116305-3116331 tlc5620: bit: "0"
3116331-3116356 tlc5620: bit: "1"
3116356-3116382 tlc5620: bit: "0"
3116382-3116407 tlc5620: bit: "0"
3116407-3116433 tlc5620: bit: "1"
3116433-3116459 tlc5620: bit: "0"
3116459-3116484 tlc5620: bit: "1"
3116484-3116510 tlc5620: bit: "0"
3116510-3116536 tlc5620: bit: "1"
3116523-3116523 tlc5620: data-latch: "Falling edge on LOAD" "LOAD fall" "F"
3116254-3116536 tlc5620: reg-write: "Setting DACA register value to 1.92V" "DACA=1.92V"
3122148-3122199 tlc5620: dac-select: "DAC select: DACD" "DAC sel: DACD" "DAC: DACD" "D: DACD" "DACD" "D"
3122199-3122225 tlc5620: gain: "Gain: x2" "G: x2" "x2"
3122225-3122430 tlc5620: value: "DAC value: 122" "Value: 122" "Val: 122" "V: 122" "122"
3122148-3122173 tlc5620: bit: "1"
3122173-3122199 tlc5620: bit: "1"
3122199-3122225 tlc5620: bit: "1"
3122225-3122250 tlc5620: bit: "0"
3122250-3122276 tlc5620: bit: "1"
3122276-3122301 tlc5620: bit: "1"
3122301-3122327 tlc5620: bit: "1"
3122327-3122353 tlc5620: bit: "1"
3122353-3122378 tlc5620: bit: "0"
3122378-3122404 tlc5620: bit: "1"
3122404-3122430 tlc5620: bit: "0"
3122417-3122417 tlc5620: data-latch: "Falling edge on LOAD" "LOAD fall" "F"
3122148-3122430 tlc5620: reg-write: "Setting DACD register value to 3.15V" "DACD=3.15V"
3132711-3132763 tlc5620: dac-select: "DAC select: DACC" "DAC sel: DACC" "DAC: DACC" "D: DACC" "DACC" "C"
3132763-3132788 tlc5620: gain: "Gain: x2" "G: x2" "x2"
3132788-3132992 tlc5620: value: "DAC value: 108" "Value: 108" "Val: 108" "V: 108" "108"
3132711-3132737 tlc5620: bit: "1"
3132737-3132763 tlc5620: bit: "0"
3132763-3132788 tlc5620: bit: "1"
3132788-3132814 tlc5620: bit: "0"
3132814-3132839 tlc5620: bit: "1"
3132839-3132865 tlc5620: bit: "1"
3132865-3132891 tlc5620: bit: "0"
3132891-3132916 tlc5620: bit: "1"
3132916-3132942 tlc5620: bit: "1"
3132942-3132967 tlc5620: bit: "0"
3132967-3132992 tlc5620: bit: "0"
3132980-3132980 tlc5620: data-latch: "Falling edge on LOAD" "LOAD fall" "F"
3132711-3132992 tlc5620: reg-write: "Setting DACC register value to 2.78V" "DACC=2.78V"
3137622-3137622 tlc5620: ldac-fall: "Falling edge on LDAC" "LDAC fall" "LDAC" "L"
3116254-3137622 tlc5620: voltage-update-all: "Updating voltages: DACA=1.92V DACB=? DACC=2.78V DACD=3.15V" "DACA=1.92V DACB=? DACC=2.78V DACD=3.15V" "A=1.92V B=? C=2.78V D=3.15V"
3257663-3257714 tlc5620: dac-select: "DAC select: DACA" "DAC sel: DACA" "DAC: DACA" "D: DACA" "DACA" "A"
3257714-3257740 tlc5620: gain: "Gain: x1" "G: x1" "x1"
3257740-3257945 tlc5620: value: "DAC value: 149" "Value: 149" "Val: 149" "V: 149" "149"
3257663-3257689 tlc5620: bit: "0"
3257689-3257714 tlc5620: bit: "0"
3257714-3257740 tlc5620: bit: "0"
3257740-3257766 tlc5620: bit: "1"
3257766-3257791 tlc5620: bit: "0"
3257791-3257817 tlc5620: bit: "0"
3257817-3257842 tlc5620: bit: "1"
3257842-3257868 tlc5620: bit: "0"
3257868-3257894 tlc5620: bit: "1"
3257894-3257919 tlc5620: bit: "0"
3257919-3257945 tlc5620: bit: "1"
3257932-3257932 tlc5620: data-latch: "Falling edge on LOAD" "LOAD fall" "F"
3257663-3257945 tlc5620: reg-write: "Setting DACA register value to 1.92V" "DACA=1.92V"
3260903-3260955 tlc5620: dac-select: "DAC select: DACD" "DAC sel: DACD" "DAC: DACD" "D: DACD" "DACD" "D"
3260955-3260980 tlc5620: gain: "Gain: x2" "G: x2" "x2"
3260980-3261185 tlc5620: value: "DAC value: 122" "Value: 122" "Val: 122" "V: 122" "122"
3260903-3260929 tlc5620: bit: "1"
3260929-3260955 tlc5620: bit: "1"
3260955-3260980 tlc5620: bit: "1"
3260980-3261006 tlc5620: bit: "0"
3261006-3261032 tlc5620: bit: "1"
3261032-3261057 tlc5620: bit: "1"
3261057-3261083 tlc5620: bit: "1"
3261083-3261108 tlc5620: bit: "1"
3261108-3261134 tlc5620: bit: "0"
3261134-3261160 tlc5620: bit: "1"
3261160-3261185 tlc5620: bit: "0"
3261172-3261172 tlc5620: data-latch: "Falling edge on LOAD" "LOAD fall" "F"
3260903-3261185 tlc5620: reg-write: "Setting DACD register value to 3.15V" "DACD=3.15V"
3264971-3265022 tlc5620: dac-select: "DAC select: DACC" "DAC sel: DACC" "DAC: DACC" "D: DACC" "DACC" "C"
3265022-3265048 tlc5620: gain: "Gain: x2" "G: x2" "x2"
3265048-3265253 tlc5620: value: "DAC value: 108" "Value: 108" "Val: 108" "V: 108" "108"
3264971-3264997 tlc5620: bit: "1"
3264997-3265022 tlc5620: bit: "0"
3265022-3265048 tlc5620: bit: "1"
3265048-3265074 tlc5620: bit: "0"
3265074-3265099 tlc5620: bit: "1"
3265099-3265125 tlc5620: bit: "1"
3265125-3265150 tlc5620: bit: "0"
3265150-3265176 tlc5620: bit: "1"
3265176-3265202 tlc5620: bit: "1"
3265202-3265227 tlc5620: bit: "0"
3265227-3265253 tlc5620: bit: "0"
3265240-3265240 tlc5620: data-latch: "Falling edge on LOAD" "LOAD fall" "F"
3264971-3265253 tlc5620: reg-write: "Setting DACC register value to 2.78V" "DACC=2.78V"
3269912-3269912 tlc5620: ldac-fall: "Falling edge on LDAC" "LDAC fall" "LDAC" "L"
3257663-3269912 tlc5620: voltage-update-all: "Updating voltages: DACA=1.92V DACB=? DACC=2.78V DACD=3.15V" "DACA=1.92V DACB=? DACC=2.78V DACD=3.15V" "A=1.92V B=? C=2.78V D=3.15V"
6628937-6628988 tlc5620: dac-select: "DAC select: DACA" "DAC sel: DACA" "DAC: DACA" "D: DACA" "DACA" "A"
6628988-6629014 tlc5620: gain: "Gain: x1" "G: x1" "x1"
6629014-6629219 tlc5620: value: "DAC value: 149" "Value: 149" "Val: 149" "V: 149" "149"
6628937-6628963 tlc5620: bit: "0"
6628963-6628988 tlc5620: bit: "0"
6628988-6629014 tlc5620: bit: "0"
6629014-6629040 tlc5620: bit: "1"
6629040-6629065 tlc5620: bit: "0"
6629065-6629091 tlc5620: bit: "0"
6629091-6629116 tlc5620: bit: "1"
6629116-6629142 tlc5620: bit: "0"
6629142-6629168 tlc5620: bit: "1"
6629168-6629193 tlc5620: bit: "0"
6629193-6629219 tlc5620: bit: "1"
6629206-6629206 tlc5620: data-latch: "Falling edge on LOAD" "LOAD fall" "F"
6628937-6629219 tlc5620: reg-write: "Setting DACA register value to 1.92V" "DACA=1.92V"
6632979-6633030 tlc5620: dac-select: "DAC select: DACD" "DAC sel: DACD" "DAC: DACD" "D: DACD" "DACD" "D"
6633030-6633056 tlc5620: gain: "Gain: x2" "G: x2" "x2"
6633056-6633261 tlc5620: value: "DAC value: 122" "Value: 122" "Val: 122" "V: 122" "122"
6632979-6633005 tlc5620: bit: "1"
6633005-6633030 tlc5620: bit: "1"
6633030-6633056 tlc5620: bit: "1"
6633056-6633082 tlc5620: bit: "0"
6633082-6633107 tlc5620: bit: "1"
6633107-6633133 tlc5620: bit: "1"
6633133-6633159 tlc5620: bit: "1"
6633159-6633184 tlc5620: bit: "1"
6633184-6633210 tlc5620: bit: "0"
6633210-6633235 tlc5620: bit: "1"
6633235-6633261 tlc5620: bit: "0"
6633248-6633248 tlc5620: data-latch: "Falling edge on LOAD" "LOAD fall" "F"
6632979-6633261 tlc5620: reg-write: "Setting DACD register value to 3.15V" "DACD=3.15V"
6636980-6637031 tlc5620: dac-select: "DAC select: DACC" "DAC sel: DACC" "DAC: DACC" "D: DACC" "DACC" "C"
6637031-6637057 tlc5620: gain: "Gain: x2" "G: x2" "x2"
6637057-6637262 tlc5620: value: "DAC value: 108" "Value: 108" "Val: 108" "V: 108" "108"
6636980-6637006 tlc5620: bit: "1"
6637006-6637031 tlc5620: bit: "0"
6637031-6637057 tlc5620: bit: "1"
6637057-6637083 tlc5620: bit: "0"
6637083-6637108 tlc5620: bit: "1"
6637108-6637134 tlc5620: bit: "1"
6637134-6637160 tlc5620: bit: "0"
6637160-6637185 tlc5620: bit: "1"
6637185-6637211 tlc5620: bit: "1"
6637211-6637236 tlc5620: bit: "0"
6637236-6637262 tlc5620: bit: "0"
6637249-6637249 tlc5620: data-latch: "Falling edge on LOAD" "LOAD fall" "F"
6636980-6637262 tlc5620: reg-write: "Setting DACC register value to 2.78V" "DACC=2.78V"
6641686-6641686 tlc5620: ldac-fall: "Falling edge on LDAC" "LDAC fall" "LDAC" "L"
6628937-6641686 tlc5620: voltage-update-all: "Updating voltages: DACA=1.92V DACB=? DACC=2.78V DACD=3.15V" "DACA=1.92V DACB=? DACC=2.78V DACD=3.15V" "A=1.92V B=? C=2.78V D=3.15V"
6881072-6881123 tlc5620: dac-select: "DAC select: DACA" "DAC sel: DACA" "DAC: DACA" "D: DACA" "DACA" "A"
6881123-6881149 tlc5620: gain: "Gain: x1" "G: x1" "x1"
6881149-6881354 tlc5620: value: "DAC value: 149" "Value: 149" "Val: 149" "V: 149" "149"
6881072-6881098 tlc5620: bit: "0"
6881098-6881123 tlc5620: bit: "0"
6881123-6881149 tlc5620: bit: "0"
6881149-6881174 tlc5620: bit: "1"
6881174-6881200 tlc5620: bit: "0"
6881200-6881226 tlc5620: bit: "0"
6881226-6881251 tlc5620: bit: "1"
6881251-6881277 tlc5620: bit: "0"
6881277-6881302 tlc5620: bit: "1"
6881302-6881328 tlc5620: bit: "0"
6881328-6881354 tlc5620: bit: "1"
6881341-6881341 tlc5620: data-latch: "Falling edge on LOAD" "LOAD fall" "F"
6881072-6881354 tlc5620: reg-write: "Setting DACA register value to 1.92V" "DACA=1.92V"
6885011-6885063 tlc5620: dac-select: "DAC select: DACD" "DAC sel: DACD" "DAC: DACD" "D: DACD" "DACD" "D"
6885063-6885088 tlc5620: gain: "Gain: x2" "G: x2" "x2"
6885088-6885293 tlc5620: value: "DAC value: 122" "Value: 122" "Val: 122" "V: 122" "122"
6885011-6885037 tlc5620: bit: "1"
6885037-6885063 tlc5620: bit: "1"
6885063-6885088 tlc5620: bit: "1"
6885088-6885114 tlc5620: bit: "0"
6885114-6885140 tlc5620: bit: "1"
6885140-6885165 tlc5620: bit: "1"
6885165-6885191 tlc5620: bit: "1"
6885191-6885216 tlc5620: bit: "1"
6885216-6885242 tlc5620: bit: "0"
6885242-6885268 tlc5620: bit: "1"
6885268-6885293 tlc5620: bit: "0"
6885280-6885280 tlc5620: data-latch: "Falling edge on LOAD" "LOAD fall" "F"
6885011-6885293 tlc5620: reg-write: "Setting DACD register value to 3.15V" "DACD=3.15V"
6889048-6889100 tlc5620: dac-select: "DAC select: DACC" "DAC sel: DACC" "DAC: DACC" "D: DACC" "DACC" "C"
6889100-6889125 tlc5620: gain: "Gain: x2" "G: x2" "x2"
6889125-6889330 tlc5620: value: "DAC value: 108" "Value: 108" "Val: 108" "V: 108" "108"
6889048-6889074 tlc5620: bit: "1"
6889074-6889100 tlc5620: bit: "0"
6889100-6889125 tlc5620: bit: "1"
6889125-6889151 tlc5620: bit: "0"
6889151-6889176 tlc5620: bit: "1"
6889176-6889202 tlc5620: bit: "1"
6889202-6889228 tlc5620: bit: "0"
6889228-6889253 tlc5620: bit: "1"
6889253-6889279 tlc5620: bit: "1"
6889279-6889305 tlc5620: bit: "0"
6889305-6889330 tlc5620: bit: "0"
6889317-6889317 tlc5620: data-latch: "Falling edge on LOAD" "LOAD fall" "F"
6889048-6889330 tlc5620: reg-write: "Setting DACC register value to 2.78V" "DACC=2.78V"
6893920-6893920 tlc5620: ldac-fall: "Falling edge on LDAC" "LDAC fall" "LDAC" "L"
6881072-6893920 tlc5620: voltage-update-all: "Updating voltages: DACA=1.92V DACB=? DACC=2.78V DACD=3.15V" "DACA=1.92V DACB=? DACC=2.78V DACD=3.15V" "A=1.92V B=? C=2.78V D=3.15V"
6915063-6915114 tlc5620: dac-select: "DAC select: DACA" "DAC sel: DACA" "DAC: DACA" "D: DACA" "DACA" "A"
6915114-6915140 tlc5620: gain: "Gain: x1" "G: x1" "x1"
6915140-6915345 tlc5620: value: "DAC value: 148" "Value: 148" "Val: 148" "V: 148" "148"
6915063-6915088 tlc5620: bit: "0"
6915088-6915114 tlc5620: bit: "0"
6915114-6915140 tlc5620: bit: "0"
6915140-6915165 tlc5620: bit: "1"
6915165-6915191 tlc5620: bit: "0"
6915191-6915217 tlc5620: bit: "0"
6915217-6915242 tlc5620: bit: "1"
6915242-6915268 tlc5620: bit: "0"
6915268-6915293 tlc5620: bit: "1"
6915293-6915319 tlc5620: bit: "0"
6915319-6915345 tlc5620: bit: "0"
6915332-6915332 tlc5620: data-latch: "Falling edge on LOAD" "LOAD fall" "F"
6915063-6915345 tlc5620: reg-write: "Setting DACA register value to 1.91V" "DACA=1.91V"
6919107-6919159 tlc5620: dac-select: "DAC select: DACD" "DAC sel: DACD" "DAC: DACD" "D: DACD" "DACD" "D"
6919159-6919184 tlc5620: gain: "Gain: x2" "G: x2" "x2"
6919184-6919389 tlc5620: value: "DAC value: 122" "Value: 122" "Val: 122" "V: 122" "122"
6919107-6919133 tlc5620: bit: "1"
6919133-6919159 tlc5620: bit: "1"
6919159-6919184 tlc5620: bit: "1"
6919184-6919210 tlc5620: bit: "0"
6919210-6919236 tlc5620: bit: "1"
6919236-6919261 tlc5620: bit: "1"
6919261-6919287 tlc5620: bit: "1"
6919287-6919312 tlc5620: bit: "1"
6919312-6919338 tlc5620: bit: "0"
6919338-6919364 tlc5620: bit: "1"
6919364-6919389 tlc5620: bit: "0"
6919376-6919376 tlc5620: data-latch: "Falling edge on LOAD" "LOAD fall" "F"
6919107-6919389 tlc5620: reg-write: "Setting DACD register value to 3.15V" "DACD=3.15V"
6924971-6925022 tlc5620: dac-select: "DAC select: DACC" "DAC sel: DACC" "DAC: DACC" "D: DACC" "DACC" "C"
6925022-6925048 tlc5620: gain: "Gain: x2" "G: x2" "x2"
6925048-6925253 tlc5620: value: "DAC value: 108" "Value: 108" "Val: 108" "V: 108" "108"
6924971-6924996 tlc5620: bit: "1"
6924996-6925022 tlc5620: bit: "0"
6925022-6925048 tlc5620: bit: "1"
6925048-6925073 tlc5620: bit: "0"
6925073-6925099 tlc5620: bit: "1"
6925099-6925124 tlc5620: bit: "1"
6925124-6925150 tlc5620: bit: "0"
6925150-6925176 tlc5620: bit: "1"
6925176-6925201 tlc5620: bit: "1"
6925201-6925227 tlc5620: bit: "0"
6925227-6925253 tlc5620: bit: "0"
6925240-6925240 tlc5620: data-latch: "Falling edge on LOAD" "LOAD fall" "F"
6924971-6925253 tlc5620: reg-write: "Setting DACC register value to 2.78V" "DACC=2.78V"
6929804-6929804 tlc5620: ldac-fall: "Falling edge on LDAC" "LDAC fall" "LDAC" "L"
6915063-6929804 tlc5620: voltage-update-all: "Updating voltages: DACA=1.91V DACB=? DACC=2.78V DACD=3.15V" "DACA=1.91V DACB=? DACC=2.78V DACD=3.15V" "A=1.91V B=? C=2.78V D=3.15V"
6937025-6937076 tlc5620: dac-select: "DAC select: DACA" "DAC sel: DACA" "DAC: DACA" "D: DACA" "DACA" "A"
6937076-6937102 tlc5620: gain: "Gain: x1" "G: x1" "x1"
6937102-6937307 tlc5620: value: "DAC value: 147" "Value: 147" "Val: 147" "V: 147" "147"
6937025-6937051 tlc5620: bit: "0"
6937051-6937076 tlc5620: bit: "0"
6937076-6937102 tlc5620: bit: "0"
6937102-6937127 tlc5620: bit: "1"
6937127-6937153 tlc5620: bit: "0"
6937153-6937179 tlc5620: bit: "0"
6937179-6937204 tlc5620: bit: "1"
6937204-6937230 tlc5620: bit: "0"
6937230-6937256 tlc5620: bit: "0"
6937256-6937281 tlc5620: bit: "1"
6937281-6937307 tlc5620: bit: "1"
6937294-6937294 tlc5620: data-latch: "Falling edge on LOAD" "LOAD fall" "F"
6937025-6937307 tlc5620: reg-write: "Setting DACA register value to 1.89V" "DACA=1.89V"
6941080-6941131 tlc5620: dac-select: "DAC select: DACD" "DAC sel: DACD" "DAC: DACD" "D: DACD" "DACD" "D"
6941131-6941157 tlc5620: gain: "Gain: x2" "G: x2" "x2"
6941157-6941362 tlc5620: value: "DAC value: 122" "Value: 122" "Val: 122" "V: 122" "122"
6941080-6941105 tlc5620: bit: "1"
6941105-6941131 tlc5620: bit: "1"
6941131-6941157 tlc5620: bit: "1"
6941157-6941182 tlc5620: bit: "0"
6941182-6941208 tlc5620: bit: "1"
6941208-6941234 tlc5620: bit: "1"
6941234-6941259 tlc5620: bit: "1"
6941259-6941285 tlc5620: bit: "1"
6941285-6941310 tlc5620: bit: "0"
6941310-6941336 tlc5620: bit: "1"
6941336-6941362 tlc5620: bit: "0"
6941349-6941349 tlc5620: data-latch: "Falling edge on LOAD" "LOAD fall" "F"
6941080-6941362 tlc5620: reg-write: "Setting DACD register value to 3.15V" "DACD=3.15V"
6947166-6947217 tlc5620: dac-select: "DAC select: DACC" "DAC sel: DACC" "DAC: DACC" "D: DACC" "DACC" "C"
6947217-6947243 tlc5620: gain: "Gain: x2" "G: x2" "x2"
6947243-6947448 tlc5620: value: "DAC value: 108" "Value: 108" "Val: 108" "V: 108" "108"
6947166-6947192 tlc5620: bit: "1"
6947192-6947217 tlc5620: bit: "0"
6947217-6947243 tlc5620: bit: "1"
6947243-6947268 tlc5620: bit: "0"
6947268-6947294 tlc5620: bit: "1"
6947294-6947320 tlc5620: bit: "1"
6947320-6947345 tlc5620: bit: "0"
6947345-6947371 tlc5620: bit: "1"
6947371-6947396 tlc5620: bit: "1"
6947396-6947422 tlc5620: bit: "0"
6947422-6947448 tlc5620: bit: "0"
6947435-6947435 tlc5620: data-latch: "Falling edge on LOAD" "LOAD fall" "F"
6947166-6947448 tlc5620: reg-write: "Setting DACC register value to 2.78V" "DACC=2.78V"
6951789-6951789 tlc5620: ldac-fall: "Falling edge on LDAC" "LDAC fall" "LDAC" "L"
6937025-6951789 tlc5620: voltage-update-all: "Updating voltages: DACA=1.89V DACB=? DACC=2.78V DACD=3.15V" "DACA=1.89V DACB=? DACC=2.78V DACD=3.15V" "A=1.89V B=? C=2.78V D=3.15V"
6959492-6959543 tlc5620: dac-select: "DAC select: DACA" "DAC sel: DACA" "DAC: DACA" "D: DACA" "DACA" "A"
6959543-6959569 tlc5620: gain: "Gain: x1" "G: x1" "x1"
6959569-6959774 tlc5620: value: "DAC value: 146" "Value: 146" "Val: 146" "V: 146" "146"
6959492-6959517 tlc5620: bit: "0"
6959517-6959543 tlc5620: bit: "0"
6959543-6959569 tlc5620: bit: "0"
6959569-6959594 tlc5620: bit: "1"
6959594-6959620 tlc5620: bit: "0"
6959620-6959646 tlc5620: bit: "0"
6959646-6959671 tlc5620: bit: "1"
6959671-6959697 tlc5620: bit: "0"
6959697-6959722 tlc5620: bit: "0"
6959722-6959748 tlc5620: bit: "1"
6959748-6959774 tlc5620: bit: "0"
6959761-6959761 tlc5620: data-latch: "Falling edge on LOAD" "LOAD fall" "F"
6959492-6959774 tlc5620: reg-write: "Setting DACA register value to 1.88V" "DACA=1.88V"
6963068-6963119 tlc5620: dac-select: "DAC select: DACD" "DAC sel: DACD" "DAC: DACD" "D: DACD" "DACD" "D"
6963119-6963144 tlc5620: gain: "Gain: x2" "G: x2" "x2"
6963144-6963349 tlc5620: value: "DAC value: 122" "Value: 122" "Val: 122" "V: 122" "122"
6963068-6963093 tlc5620: bit: "1"
6963093-6963119 tlc5620: bit: "1"
6963119-6963144 tlc5620: bit: "1"
6963144-6963170 tlc5620: bit: "0"
6963170-6963196 tlc5620: bit: "1"
6963196-6963221 tlc5620: bit: "1"
6963221-6963247 tlc5620: bit: "1"
6963247-6963273 tlc5620: bit: "1"
6963273-6963298 tlc5620: bit: "0"
6963298-6963324 tlc5620: bit: "1"
6963324-6963349 tlc5620: bit: "0"
6963337-6963337 tlc5620: data-latch: "Falling edge on LOAD" "LOAD fall" "F"
6963068-6963349 tlc5620: reg-write: "Setting DACD register value to 3.15V" "DACD=3.15V"
6967122-6967174 tlc5620: dac-select: "DAC select: DACC" "DAC sel: DACC" "DAC: DACC" "D: DACC" "DACC" "C"
6967174-6967199 tlc5620: gain: "Gain: x2" "G: x2" "x2"
6967199-6967404 tlc5620: value: "DAC value: 108" "Value: 108" "Val: 108" "V: 108" "108"
6967122-6967148 tlc5620: bit: "1"
6967148-6967174 tlc5620: bit: "0"
6967174-6967199 tlc5620: bit: "1"
6967199-6967225 tlc5620: bit: "0"
6967225-6967251 tlc5620: bit: "1"
6967251-6967276 tlc5620: bit: "1"
6967276-6967302 tlc5620: bit: "0"
6967302-6967327 tlc5620: bit: "1"
6967327-6967353 tlc5620: bit: "1"
6967353-6967379 tlc5620: bit: "0"
6967379-6967404 tlc5620: bit: "0"
6967391-6967391 tlc5620: data-latch: "Falling edge on LOAD" "LOAD fall" "F"
6967122-6967404 tlc5620: reg-write: "Setting DACC register value to 2.78V" "DACC=2.78V"
6972033-6972033 tlc5620: ldac-fall: "Falling edge on LDAC" "LDAC fall" "LDAC" "L"
6959492-6972033 tlc5620: voltage-update-all: "Updating voltages: DACA=1.88V DACB=? DACC=2.78V DACD=3.15V" "DACA=1.88V DACB=? DACC=2.78V DACD=3.15V" "A=1.88V B=? C=2.78V D=3.15V"
6979005-6979056 tlc5620: dac-select: "DAC select: DACA" "DAC sel: DACA" "DAC: DACA" "D: DACA" "DACA" "A"
6979056-6979082 tlc5620: gain: "Gain: x1" "G: x1" "x1"
6979082-6979287 tlc5620: value: "DAC value: 144" "Value: 144" "Val: 144" "V: 144" "144"
6979005-6979031 tlc5620: bit: "0"
6979031-6979056 tlc5620: bit: "0"
6979056-6979082 tlc5620: bit: "0"
6979082-6979108 tlc5620: bit: "1"
6979108-6979133 tlc5620: bit: "0"
6979133-6979159 tlc5620: bit: "0"
6979159-6979185 tlc5620: bit: "1"
6979185-6979210 tlc5620: bit: "0"
6979210-6979236 tlc5620: bit: "0"
6979236-6979261 tlc5620: bit: "0"
6979261-6979287 tlc5620: bit: "0"
6979274-6979274 tlc5620: data-latch: "Falling edge on LOAD" "LOAD fall" "F"
6979005-6979287 tlc5620: reg-write: "Setting DACA register value to 1.86V" "DACA=1.86V"
6983024-6983075 tlc5620: dac-select: "DAC select: DACD" "DAC sel: DACD" "DAC: DACD" "D: DACD" "DACD" "D"
6983075-6983101 tlc5620: gain: "Gain: x2" "G: x2" "x2"
6983101-6983306 tlc5620: value: "DAC value: 122" "Value: 122" "Val: 122" "V: 122" "122"
6983024-6983050 tlc5620: bit: "1"
6983050-6983075 tlc5620: bit: "1"
6983075-6983101 tlc5620: bit: "1"
6983101-6983127 tlc5620: bit: "0"
6983127-6983152 tlc5620: bit: "1"
6983152-6983178 tlc5620: bit: "1"
6983178-6983203 tlc5620: bit: "1"
6983203-6983229 tlc5620: bit: "1"
6983229-6983255 tlc5620: bit: "0"
6983255-6983280 tlc5620: bit: "1"
6983280-6983306 tlc5620: bit: "0"
6983293-6983293 tlc5620: data-latch: "Falling edge on LOAD" "LOAD fall" "F"
6983024-6983306 tlc5620: reg-write: "Setting DACD register value to 3.15V" "DACD=3.15V"
6987079-6987130 tlc5620: dac-select: "DAC select: DACC" "DAC sel: DACC" "DAC: DACC" "D: DACC" "DACC" "C"
6987130-6987156 tlc5620: gain: "Gain: x2" "G: x2" "x2"
6987156-6987361 tlc5620: value: "DAC value: 108" "Value: 108" "Val: 108" "V: 108" "108"
6987079-6987105 tlc5620: bit: "1"
6987105-6987130 tlc5620: bit: "0"
6987130-6987156 tlc5620: bit: "1"
6987156-6987181 tlc5620: bit: "0"
6987181-6987207 tlc5620: bit: "1"
6987207-6987233 tlc5620: bit: "1"
6987233-6987258 tlc5620: bit: "0"
6987258-6987284 tlc5620: bit: "1"
6987284-6987310 tlc5620: bit: "1"
6987310-6987335 tlc5620: bit: "0"
6987335-6987361 tlc5620: bit: "0"
6987348-6987348 tlc5620: data-latch: "Falling edge on LOAD" "LOAD fall" "F"
6987079-6987361 tlc5620: reg-write: "Setting DACC register value to 2.78V" "DACC=2.78V"
6992007-6992007 tlc5620: ldac-fall: "Falling edge on LDAC" "LDAC fall" "LDAC" "L"
6979005-6992007 tlc5620: voltage-update-all: "Updating voltages: DACA=1.86V DACB=? DACC=2.78V DACD=3.15V" "DACA=1.86V DACB=? DACC=2.78V DACD=3.15V" "A=1.86V B=? C=2.78V D=3.15V"
6998959-6999010 tlc5620: dac-select: "DAC select: DACA" "DAC sel: DACA" "DAC: DACA" "D: DACA" "DACA" "A"
6999010-6999036 tlc5620: gain: "Gain: x1" "G: x1" "x1"
6999036-6999241 tlc5620: value: "DAC value: 143" "Value: 143" "Val: 143" "V: 143" "143"
6998959-6998985 tlc5620: bit: "0"
6998985-6999010 tlc5620: bit: "0"
6999010-6999036 tlc5620: bit: "0"
6999036-6999062 tlc5620: bit: "1"
6999062-6999087 tlc5620: bit: "0"
6999087-6999113 tlc5620: bit: "0"
6999113-6999138 tlc5620: bit: "0"
6999138-6999164 tlc5620: bit: "1"
6999164-6999190 tlc5620: bit: "1"
6999190-6999215 tlc5620: bit: "1"
6999215-6999241 tlc5620: bit: "1"
6999228-6999228 tlc5620: data-latch: "Falling edge on LOAD" "LOAD fall" "F"
6998959-6999241 tlc5620: reg-write: "Setting DACA register value to 1.84V" "DACA=1.84V"
7003024-7003075 tlc5620: dac-select: "DAC select: DACD" "DAC sel: DACD" "DAC: DACD" "D: DACD" "DACD" "D"
7003075-7003101 tlc5620: gain: "Gain: x2" "G: x2" "x2"
7003101-7003306 tlc5620: value: "DAC value: 122" "Value: 122" "Val: 122" "V: 122" "122"
7003024-7003050 tlc5620: bit: "1"
7003050-7003075 tlc5620: bit: "1"
7003075-7003101 tlc5620: bit: "1"
7003101-7003127 tlc5620: bit: "0"
7003127-7003152 tlc5620: bit: "1"
7003152-7003178 tlc5620: bit: "1"
7003178-7003204 tlc5620: bit: "1"
7003204-7003229 tlc5620: bit: "1"
7003229-7003255 tlc5620: bit: "0"
7003255-7003280 tlc5620: bit: "1"
7003280-7003306 tlc5620: bit: "0"
7003293-7003293 tlc5620: data-latch: "Falling edge on LOAD" "LOAD fall" "F"
7003024-7003306 tlc5620: reg-write: "Setting DACD register value to 3.15V" "DACD=3.15V"
7007053-7007105 tlc5620: dac-select: "DAC select: DACC" "DAC sel: DACC" "DAC: DACC" "D: DACC" "DACC" "C"
7007105-7007130 tlc5620: gain: "Gain: x2" "G: x2" "x2"
7007130-7007335 tlc5620: value: "DAC value: 108" "Value: 108" "Val: 108" "V: 108" "108"
7007053-7007079 tlc5620: bit: "1"
7007079-7007105 tlc5620: bit: "0"
7007105-7007130 tlc5620: bit: "1"
7007130-7007156 tlc5620: bit: "0"
7007156-7007182 tlc5620: bit: "1"
7007182-7007207 tlc5620: bit: "1"
7007207-7007233 tlc5620: bit: "0"
7007233-7007258 tlc5620: bit: "1"
7007258-7007284 tlc5620: bit: "1"
7007284-7007310 tlc5620: bit: "0"
7007310-7007335 tlc5620: bit: "0"
7007322-7007322 tlc5620: data-latch: "Falling edge on LOAD" "LOAD fall" "F"
7007053-7007335 tlc5620: reg-write: "Setting DACC register value to 2.78V" "DACC=2.78V"
7011969-7011969 tlc5620: ldac-fall: "Falling edge on LDAC" "LDAC fall" "LDAC" "L"
6998959-7011969 tlc5620: voltage-update-all: "Updating voltages: DACA=1.84V DACB=? DACC=2.78V DACD=3.15V" "DACA=1.84V DACB=? DACC=2.78V DACD=3.15V" "A=1.84V B=? C=2.78V D=3.15V"
7019203-7019254 tlc5620: dac-select: "DAC select: DACA" "DAC sel: DACA" "DAC: DACA" "D: DACA" "DACA" "A"
7019254-7019279 tlc5620: gain: "Gain: x1" "G: x1" "x1"
7019279-7019484 tlc5620: value: "DAC value: 142" "Value: 142" "Val: 142" "V: 142" "142"
7019203-7019228 tlc5620: bit: "0"
7019228-7019254 tlc5620: bit: "0"
7019254-7019279 tlc5620: bit: "0"
7019279-7019305 tlc5620: bit: "1"
7019305-7019331 tlc5620: bit: "0"
7019331-7019356 tlc5620: bit: "0"
7019356-7019382 tlc5620: bit: "0"
7019382-7019408 tlc5620: bit: "1"
7019408-7019433 tlc5620: bit: "1"
7019433-7019459 tlc5620: bit: "1"
7019459-7019484 tlc5620: bit: "0"
7019472-7019472 tlc5620: data-latch: "Falling edge on LOAD" "LOAD fall" "F"
7019203-7019484 tlc5620: reg-write: "Setting DACA register value to 1.83V" "DACA=1.83V"
7022978-7023029 tlc5620: dac-select: "DAC select: DACD" "DAC sel: DACD" "DAC: DACD" "D: DACD" "DACD" "D"
7023029-7023055 tlc5620: gain: "Gain: x2" "G: x2" "x2"
7023055-7023260 tlc5620: value: "DAC value: 122" "Value: 122" "Val: 122" "V: 122" "122"
7022978-7023004 tlc5620: bit: "1"
7023004-7023029 tlc5620: bit: "1"
7023029-7023055 tlc5620: bit: "1"
7023055-7023081 tlc5620: bit: "0"
7023081-7023106 tlc5620: bit: "1"
7023106-7023132 tlc5620: bit: "1"
7023132-7023158 tlc5620: bit: "1"
7023158-7023183 tlc5620: bit: "1"
7023183-7023209 tlc5620: bit: "0"
7023209-7023234 tlc5620: bit: "1"
7023234-7023260 tlc5620: bit: "0"
7023247-7023247 tlc5620: data-latch: "Falling edge on LOAD" "LOAD fall" "F"
7022978-7023260 tlc5620: reg-write: "Setting DACD register value to 3.15V" "DACD=3.15V"
7027031-7027082 tlc5620: dac-select: "DAC select: DACC" "DAC sel: DACC" "DAC: DACC" "D: DACC" "DACC" "C"
7027082-7027107 tlc5620: gain: "Gain: x2" "G: x2" "x2"
7027107-7027312 tlc5620: value: "DAC value: 108" "Value: 108" "Val: 108" "V: 108" "108"
7027031-7027056 tlc5620: bit: "1"
7027056-7027082 tlc5620: bit: "0"
7027082-7027107 tlc5620: bit: "1"
7027107-7027133 tlc5620: bit: "0"
7027133-7027159 tlc5620: bit: "1"
7027159-7027184 tlc5620: bit: "1"
7027184-7027210 tlc5620: bit: "0"
7027210-7027235 tlc5620: bit: "1"
7027235-7027261 tlc5620: bit: "1"
7027261-7027287 tlc5620: bit: "0"
7027287-7027312 tlc5620: bit: "0"
7027299-7027299 tlc5620: data-latch: "Falling edge on LOAD" "LOAD fall" "F"
7027031-7027312 tlc5620: reg-write: "Setting DACC register value to 2.78V" "DACC=2.78V"
7031933-7031933 tlc5620: ldac-fall: "Falling edge on LDAC" "LDAC fall" "LDAC" "L"
7019203-7031933 tlc5620: voltage-update-all: "Updating voltages: DACA=1.83V DACB=? DACC=2.78V DACD=3.15V" "DACA=1.83V DACB=? DACC=2.78V DACD=3.15V" "A=1.83V B=? C=2.78V D=3.15V"
7039428-7039479 tlc5620: dac-select: "DAC select: DACA" "DAC sel: DACA" "DAC: DACA" "D: DACA" "DACA" "A"
7039479-7039505 tlc5620: gain: "Gain: x1" "G: x1" "x1"
7039505-7039710 tlc5620: value: "DAC value: 141" "Value: 141" "Val: 141" "V: 141" "141"
7039428-7039454 tlc5620: bit: "0"
7039454-7039479 tlc5620: bit: "0"
7039479-7039505 tlc5620: bit: "0"
7039505-7039531 tlc5620: bit: "1"
7039531-7039556 tlc5620: bit: "0"
7039556-7039582 tlc5620: bit: "0"
7039582-7039607 tlc5620: bit: "0"
7039607-7039633 tlc5620: bit: "1"
7039633-7039659 tlc5620: bit: "1"
7039659-7039684 tlc5620: bit: "0"
7039684-7039710 tlc5620: bit: "1"
7039697-7039697 tlc5620: data-latch: "Falling edge on LOAD" "LOAD fall" "F"
7039428-7039710 tlc5620: reg-write: "Setting DACA register value to 1.82V" "DACA=1.82V"
7043222-7043273 tlc5620: dac-select: "DAC select: DACD" "DAC sel: DACD" "DAC: DACD" "D: DACD" "DACD" "D"
7043273-7043299 tlc5620: gain: "Gain: x2" "G: x2" "x2"
7043299-7043504 tlc5620: value: "DAC value: 122" "Value: 122" "Val: 122" "V: 122" "122"
7043222-7043247 tlc5620: bit: "1"
7043247-7043273 tlc5620: bit: "1"
7043273-7043299 tlc5620: bit: "1"
7043299-7043324 tlc5620: bit: "0"
7043324-7043350 tlc5620: bit: "1"
7043350-7043375 tlc5620: bit: "1"
7043375-7043401 tlc5620: bit: "1"
7043401-7043427 tlc5620: bit: "1"
7043427-7043452 tlc5620: bit: "0"
7043452-7043478 tlc5620: bit: "1"
7043478-7043504 tlc5620: bit: "0"
7043491-7043491 tlc5620: data-latch: "Falling edge on LOAD" "LOAD fall" "F"
7043222-7043504 tlc5620: reg-write: "Setting DACD register value to 3.15V" "DACD=3.15V"
7046979-7047031 tlc5620: dac-select: "DAC select: DACC" "DAC sel: DACC" "DAC: DACC" "D: DACC" "DACC" "C"
7047031-7047056 tlc5620: gain: "Gain: x2" "G: x2" "x2"
7047056-7047261 tlc5620: value: "DAC value: 108" "Value: 108" "Val: 108" "V: 108" "108"
7046979-7047005 tlc5620: bit: "1"
7047005-7047031 tlc5620: bit: "0"
7047031-7047056 tlc5620: bit: "1"
7047056-7047082 tlc5620: bit: "0"
7047082-7047107 tlc5620: bit: "1"
7047107-7047133 tlc5620: bit: "1"
7047133-7047159 tlc5620: bit: "0"
7047159-7047184 tlc5620: bit: "1"
7047184-7047210 tlc5620: bit: "1"
7047210-7047236 tlc5620: bit: "0"
7047236-7047261 tlc5620: bit: "0"
7047248-7047248 tlc5620: data-latch: "Falling edge on LOAD" "LOAD fall" "F"
7046979-7047261 tlc5620: reg-write: "Setting DACC register value to 2.78V" "DACC=2.78V"
7051913-7051913 tlc5620: ldac-fall: "Falling edge on LDAC" "LDAC fall" "LDAC" "L"
7039428-7051913 tlc5620: voltage-update-all: "Updating voltages: DACA=1.82V DACB=? DACC=2.78V DACD=3.15V" "DACA=1.82V DACB=? DACC=2.78V DACD=3.15V" "A=1.82V B=? C=2.78V D=3.15V"
7059126-7059177 tlc5620: dac-select: "DAC select: DACA" "DAC sel: DACA" "DAC: DACA" "D: DACA" "DACA" "A"
7059177-7059203 tlc5620: gain: "Gain: x1" "G: x1" "x1"
7059203-7059408 tlc5620: value: "DAC value: 138" "Value: 138" "Val: 138" "V: 138" "138"
7059126-7059152 tlc5620: bit: "0"
7059152-7059177 tlc5620: bit: "0"
7059177-7059203 tlc5620: bit: "0"
7059203-7059228 tlc5620: bit: "1"
7059228-7059254 tlc5620: bit: "0"
7059254-7059280 tlc5620: bit: "0"
7059280-7059305 tlc5620: bit: "0"
7059305-7059331 tlc5620: bit: "1"
7059331-7059356 tlc5620: bit: "0"
7059356-7059382 tlc5620: bit: "1"
7059382-7059408 tlc5620: bit: "0"
7059395-7059395 tlc5620: data-latch: "Falling edge on LOAD" "LOAD fall" "F"
7059126-7059408 tlc5620: reg-write: "Setting DACA register value to 1.78V" "DACA=1.78V"
7063165-7063217 tlc5620: dac-select: "DAC select: DACD" "DAC sel: DACD" "DAC: DACD" "D: DACD" "DACD" "D"
7063217-7063242 tlc5620: gain: "Gain: x2" "G: x2" "x2"
7063242-7063447 tlc5620: value: "DAC value: 122" "Value: 122" "Val: 122" "V: 122" "122"
7063165-7063191 tlc5620: bit: "1"
7063191-7063217 tlc5620: bit: "1"
7063217-7063242 tlc5620: bit: "1"
7063242-7063268 tlc5620: bit: "0"
7063268-7063293 tlc5620: bit: "1"
7063293-7063319 tlc5620: bit: "1"
7063319-7063345 tlc5620: bit: "1"
7063345-7063370 tlc5620: bit: "1"
7063370-7063396 tlc5620: bit: "0"
7063396-7063422 tlc5620: bit: "1"
7063422-7063447 tlc5620: bit: "0"
7063434-7063434 tlc5620: data-latch: "Falling edge on LOAD" "LOAD fall" "F"
7063165-7063447 tlc5620: reg-write: "Setting DACD register value to 3.15V" "DACD=3.15V"
7067213-7067264 tlc5620: dac-select: "DAC select: DACC" "DAC sel: DACC" "DAC: DACC" "D: DACC" "DACC" "C"
7067264-7067289 tlc5620: gain: "Gain: x2" "G: x2" "x2"
7067289-7067494 tlc5620: value: "DAC value: 108" "Value: 108" "Val: 108" "V: 108" "108"
7067213-7067238 tlc5620: bit: "1"
7067238-7067264 tlc5620: bit: "0"
7067264-7067289 tlc5620: bit: "1"
7067289-7067315 tlc5620: bit: "0"
7067315-7067341 tlc5620: bit: "1"
7067341-7067366 tlc5620: bit: "1"
7067366-7067392 tlc5620: bit: "0"
7067392-7067417 tlc5620: bit: "1"
7067417-7067443 tlc5620: bit: "1"
7067443-7067469 tlc5620: bit: "0"
7067469-7067494 tlc5620: bit: "0"
7067481-7067481 tlc5620: data-latch: "Falling edge on LOAD" "LOAD fall" "F"
7067213-7067494 tlc5620: reg-write: "Setting DACC register value to 2.78V" "DACC=2.78V"
7071892-7071892 tlc5620: ldac-fall: "Falling edge on LDAC" "LDAC fall" "LDAC" "L"
7059126-7071892 tlc5620: voltage-update-all: "Updating voltages: DACA=1.78V DACB=? DACC=2.78V DACD=3.15V" "DACA=1.78V DACB=? DACC=2.78V DACD=3.15V" "A=1.78V B=? C=2.78V D=3.15V"
7079106-7079157 tlc5620: dac-select: "DAC select: DACA" "DAC sel: DACA" "DAC: DACA" "D: DACA" "DACA" "A"
7079157-7079182 tlc5620: gain: "Gain: x1" "G: x1" "x1"
7079182-7079387 tlc5620: value: "DAC value: 137" "Value: 137" "Val: 137" "V: 137" "137"
7079106-7079131 tlc5620: bit: "0"
7079131-7079157 tlc5620: bit: "0"
7079157-7079182 tlc5620: bit: "0"
7079182-7079208 tlc5620: bit: "1"
7079208-7079234 tlc5620: bit: "0"
7079234-7079259 tlc5620: bit: "0"
7079259-7079285 tlc5620: bit: "0"
7079285-7079310 tlc5620: bit: "1"
7079310-7079336 tlc5620: bit: "0"
7079336-7079362 tlc5620: bit: "0"
7079362-7079387 tlc5620: bit: "1"
7079374-7079374 tlc5620: data-latch: "Falling edge on LOAD" "LOAD fall" "F"
7079106-7079387 tlc5620: reg-write: "Setting DACA register value to 1.77V" "DACA=1.77V"
7083145-7083196 tlc5620: dac-select: "DAC select: DACD" "DAC sel: DACD" "DAC: DACD" "D: DACD" "DACD" "D"
7083196-7083222 tlc5620: gain: "Gain: x2" "G: x2" "x2"
7083222-7083427 tlc5620: value: "DAC value: 122" "Value: 122" "Val: 122" "V: 122" "122"
7083145-7083171 tlc5620: bit: "1"
7083171-7083196 tlc5620: bit: "1"
7083196-7083222 tlc5620: bit: "1"
7083222-7083247 tlc5620: bit: "0"
7083247-7083273 tlc5620: bit: "1"
7083273-7083299 tlc5620: bit: "1"
7083299-7083324 tlc5620: bit: "1"
7083324-7083350 tlc5620: bit: "1"
7083350-7083376 tlc5620: bit: "0"
7083376-7083401 tlc5620: bit: "1"
7083401-7083427 tlc5620: bit: "0"
7083414-7083414 tlc5620: data-latch: "Falling edge on LOAD" "LOAD fall" "F"
7083145-7083427 tlc5620: reg-write: "Setting DACD register value to 3.15V" "DACD=3.15V"
7089001-7089052 tlc5620: dac-select: "DAC select: DACC" "DAC sel: DACC" "DAC: DACC" "D: DACC" "DACC" "C"
7089052-7089077 tlc5620: gain: "Gain: x2" "G: x2" "x2"
7089077-7089282 tlc5620: value: "DAC value: 108" "Value: 108" "Val: 108" "V: 108" "108"
7089001-7089026 tlc5620: bit: "1"
7089026-7089052 tlc5620: bit: "0"
7089052-7089077 tlc5620: bit: "1"
7089077-7089103 tlc5620: bit: "0"
7089103-7089129 tlc5620: bit: "1"
7089129-7089154 tlc5620: bit: "1"
7089154-7089180 tlc5620: bit: "0"
7089180-7089205 tlc5620: bit: "1"
7089205-7089231 tlc5620: bit: "1"
7089231-7089257 tlc5620: bit: "0"
7089257-7089282 tlc5620: bit: "0"
7089269-7089269 tlc5620: data-latch: "Falling edge on LOAD" "LOAD fall" "F"
7089001-7089282 tlc5620: reg-write: "Setting DACC register value to 2.78V" "DACC=2.78V"
7094124-7094124 tlc5620: ldac-fall: "Falling edge on LDAC" "LDAC fall" "LDAC" "L"
7079106-7094124 tlc5620: voltage-update-all: "Updating voltages: DACA=1.77V DACB=? DACC=2.78V DACD=3.15V" "DACA=1.77V DACB=? DACC=2.78V DACD=3.15V" "A=1.77V B=? C=2.78V D=3.15V"
7101086-7101137 tlc5620: dac-select: "DAC select: DACA" "DAC sel: DACA" "DAC: DACA" "D: DACA" "DACA" "A"
7101137-7101162 tlc5620: gain: "Gain: x1" "G: x1" "x1"
7101162-7101367 tlc5620: value: "DAC value: 136" "Value: 136" "Val: 136" "V: 136" "136"
7101086-7101111 tlc5620: bit: "0"
7101111-7101137 tlc5620: bit: "0"
7101137-7101162 tlc5620: bit: "0"
7101162-7101188 tlc5620: bit: "1"
7101188-7101214 tlc5620: bit: "0"
7101214-7101239 tlc5620: bit: "0"
7101239-7101265 tlc5620: bit: "0"
7101265-7101291 tlc5620: bit: "1"
7101291-7101316 tlc5620: bit: "0"
7101316-7101342 tlc5620: bit: "0"
7101342-7101367 tlc5620: bit: "0"
7101355-7101355 tlc5620: data-latch: "Falling edge on LOAD" "LOAD fall" "F"
7101086-7101367 tlc5620: reg-write: "Setting DACA register value to 1.75V" "DACA=1.75V"
7105153-7105205 tlc5620: dac-select: "DAC select: DACD" "DAC sel: DACD" "DAC: DACD" "D: DACD" "DACD" "D"
7105205-7105230 tlc5620: gain: "Gain: x2" "G: x2" "x2"
7105230-7105434 tlc5620: value: "DAC value: 122" "Value: 122" "Val: 122" "V: 122" "122"
7105153-7105179 tlc5620: bit: "1"
7105179-7105205 tlc5620: bit: "1"
7105205-7105230 tlc5620: bit: "1"
7105230-7105256 tlc5620: bit: "0"
7105256-7105281 tlc5620: bit: "1"
7105281-7105307 tlc5620: bit: "1"
7105307-7105333 tlc5620: bit: "1"
7105333-7105358 tlc5620: bit: "1"
7105358-7105384 tlc5620: bit: "0"
7105384-7105409 tlc5620: bit: "1"
7105409-7105434 tlc5620: bit: "0"
7105422-7105422 tlc5620: data-latch: "Falling edge on LOAD" "LOAD fall" "F"
7105153-7105434 tlc5620: reg-write: "Setting DACD register value to 3.15V" "DACD=3.15V"
7109188-7109239 tlc5620: dac-select: "DAC select: DACC" "DAC sel: DACC" "DAC: DACC" "D: DACC" "DACC" "C"
7109239-7109264 tlc5620: gain: "Gain: x2" "G: x2" "x2"
7109264-7109469 tlc5620: value: "DAC value: 108" "Value: 108" "Val: 108" "V: 108" "108"
7109188-7109213 tlc5620: bit: "1"
7109213-7109239 tlc5620: bit: "0"
7109239-7109264 tlc5620: bit: "1"
7109264-7109290 tlc5620: bit: "0"
7109290-7109316 tlc5620: bit: "1"
7109316-7109341 tlc5620: bit: "1"
7109341-7109367 tlc5620: bit: "0"
7109367-7109393 tlc5620: bit: "1"
7109393-7109418 tlc5620: bit: "1"
7109418-7109444 tlc5620: bit: "0"
7109444-7109469 tlc5620: bit: "0"
7109457-7109457 tlc5620: data-latch: "Falling edge on LOAD" "LOAD fall" "F"
7109188-7109469 tlc5620: reg-write: "Setting DACC register value to 2.78V" "DACC=2.78V"
7114088-7114088 tlc5620: ldac-fall: "Falling edge on LDAC" "LDAC fall" "LDAC" "L"
7101086-7114088 tlc5620: voltage-update-all: "Updating voltages: DACA=1.75V DACB=? DACC=2.78V DACD=3.15V" "DACA=1.75V DACB=? DACC=2.78V DACD=3.15V" "A=1.75V B=? C=2.78V D=3.15V"
7121106-7121157 tlc5620: dac-select: "DAC select: DACA" "DAC sel: DACA" "DAC: DACA" "D: DACA" "DACA" "A"
7121157-7121183 tlc5620: gain: "Gain: x1" "G: x1" "x1"
7121183-7121388 tlc5620: value: "DAC value: 135" "Value: 135" "Val: 135" "V: 135" "135"
7121106-7121132 tlc5620: bit: "0"
7121132-7121157 tlc5620: bit: "0"
7121157-7121183 tlc5620: bit: "0"
7121183-7121209 tlc5620: bit: "1"
7121209-7121234 tlc5620: bit: "0"
7121234-7121260 tlc5620: bit: "0"
7121260-7121286 tlc5620: bit: "0"
7121286-7121311 tlc5620: bit: "0"
7121311-7121337 tlc5620: bit: "1"
7121337-7121362 tlc5620: bit: "1"
7121362-7121388 tlc5620: bit: "1"
7121375-7121375 tlc5620: data-latch: "Falling edge on LOAD" "LOAD fall" "F"
7121106-7121388 tlc5620: reg-write: "Setting DACA register value to 1.74V" "DACA=1.74V"
7125089-7125141 tlc5620: dac-select: "DAC select: DACD" "DAC sel: DACD" "DAC: DACD" "D: DACD" "DACD" "D"
7125141-7125166 tlc5620: gain: "Gain: x2" "G: x2" "x2"
7125166-7125370 tlc5620: value: "DAC value: 122" "Value: 122" "Val: 122" "V: 122" "122"
7125089-7125115 tlc5620: bit: "1"
7125115-7125141 tlc5620: bit: "1"
7125141-7125166 tlc5620: bit: "1"
7125166-7125192 tlc5620: bit: "0"
7125192-7125217 tlc5620: bit: "1"
7125217-7125243 tlc5620: bit: "1"
7125243-7125269 tlc5620: bit: "1"
7125269-7125294 tlc5620: bit: "1"
7125294-7125320 tlc5620: bit: "0"
7125320-7125345 tlc5620: bit: "1"
7125345-7125370 tlc5620: bit: "0"
7125358-7125358 tlc5620: data-latch: "Falling edge on LOAD" "LOAD fall" "F"
7125089-7125370 tlc5620: reg-write: "Setting DACD register value to 3.15V" "DACD=3.15V"
7129139-7129190 tlc5620: dac-select: "DAC select: DACC" "DAC sel: DACC" "DAC: DACC" "D: DACC" "DACC" "C"
7129190-7129216 tlc5620: gain: "Gain: x2" "G: x2" "x2"
7129216-7129421 tlc5620: value: "DAC value: 108" "Value: 108" "Val: 108" "V: 108" "108"
7129139-7129165 tlc5620: bit: "1"
7129165-7129190 tlc5620: bit: "0"
7129190-7129216 tlc5620: bit: "1"
7129216-7129241 tlc5620: bit: "0"
7129241-7129267 tlc5620: bit: "1"
7129267-7129293 tlc5620: bit: "1"
7129293-7129318 tlc5620: bit: "0"
7129318-7129344 tlc5620: bit: "1"
7129344-7129370 tlc5620: bit: "1"
7129370-7129395 tlc5620: bit: "0"
7129395-7129421 tlc5620: bit: "0"
7129408-7129408 tlc5620: data-latch: "Falling edge on LOAD" "LOAD fall" "F"
7129139-7129421 tlc5620: reg-write: "Setting DACC register value to 2.78V" "DACC=2.78V"
7134060-7134060 tlc5620: ldac-fall: "Falling edge on LDAC" "LDAC fall" "LDAC" "L"
7121106-7134060 tlc5620: voltage-update-all: "Updating voltages: DACA=1.74V DACB=? DACC=2.78V DACD=3.15V" "DACA=1.74V DACB=? DACC=2.78V DACD=3.15V" "A=1.74V B=? C=2.78V D=3.15V"
7141298-7141350 tlc5620: dac-select: "DAC select: DACA" "DAC sel: DACA" "DAC: DACA" "D: DACA" "DACA" "A"
7141350-7141375 tlc5620: gain: "Gain: x1" "G: x1" "x1"
7141375-7141580 tlc5620: value: "DAC value: 133" "Value: 133" "Val: 133" "V: 133" "133"
7141298-7141324 tlc5620: bit: "0"
7141324-7141350 tlc5620: bit: "0"
7141350-7141375 tlc5620: bit: "0"
7141375-7141401 tlc5620: bit: "1"
7141401-7141426 tlc5620: bit: "0"
7141426-7141452 tlc5620: bit: "0"
7141452-7141478 tlc5620: bit: "0"
7141478-7141503 tlc5620: bit: "0"
7141503-7141529 tlc5620: bit: "1"
7141529-7141555 tlc5620: bit: "0"
7141555-7141580 tlc5620: bit: "1"
7141567-7141567 tlc5620: data-latch: "Falling edge on LOAD" "LOAD fall" "F"
7141298-7141580 tlc5620: reg-write: "Setting DACA register value to 1.71V" "DACA=1.71V"
7145056-7145107 tlc5620: dac-select: "DAC select: DACD" "DAC sel: DACD" "DAC: DACD" "D: DACD" "DACD" "D"
7145107-7145133 tlc5620: gain: "Gain: x2" "G: x2" "x2"
7145133-7145338 tlc5620: value: "DAC value: 122" "Value: 122" "Val: 122" "V: 122" "122"
7145056-7145082 tlc5620: bit: "1"
7145082-7145107 tlc5620: bit: "1"
7145107-7145133 tlc5620: bit: "1"
7145133-7145159 tlc5620: bit: "0"
7145159-7145184 tlc5620: bit: "1"
7145184-7145210 tlc5620: bit: "1"
7145210-7145235 tlc5620: bit: "1"
7145235-7145261 tlc5620: bit: "1"
7145261-7145287 tlc5620: bit: "0"
7145287-7145312 tlc5620: bit: "1"
7145312-7145338 tlc5620: bit: "0"
7145325-7145325 tlc5620: data-latch: "Falling edge on LOAD" "LOAD fall" "F"
7145056-7145338 tlc5620: reg-write: "Setting DACD register value to 3.15V" "DACD=3.15V"
7149103-7149154 tlc5620: dac-select: "DAC select: DACC" "DAC sel: DACC" "DAC: DACC" "D: DACC" "DACC" "C"
7149154-7149180 tlc5620: gain: "Gain: x2" "G: x2" "x2"
7149180-7149385 tlc5620: value: "DAC value: 108" "Value: 108" "Val: 108" "V: 108" "108"
7149103-7149129 tlc5620: bit: "1"
7149129-7149154 tlc5620: bit: "0"
7149154-7149180 tlc5620: bit: "1"
7149180-7149206 tlc5620: bit: "0"
7149206-7149231 tlc5620: bit: "1"
7149231-7149257 tlc5620: bit: "1"
7149257-7149283 tlc5620: bit: "0"
7149283-7149308 tlc5620: bit: "1"
7149308-7149334 tlc5620: bit: "1"
7149334-7149359 tlc5620: bit: "0"
7149359-7149385 tlc5620: bit: "0"
7149372-7149372 tlc5620: data-latch: "Falling edge on LOAD" "LOAD fall" "F"
7149103-7149385 tlc5620: reg-write: "Setting DACC register value to 2.78V" "DACC=2.78V"
7154019-7154019 tlc5620: ldac-fall: "Falling edge on LDAC" "LDAC fall" "LDAC" "L"
7141298-7154019 tlc5620: voltage-update-all: "Updating voltages: DACA=1.71V DACB=? DACC=2.78V DACD=3.15V" "DACA=1.71V DACB=? DACC=2.78V DACD=3.15V" "A=1.71V B=? C=2.78V D=3.15V"
7161306-7161357 tlc5620: dac-select: "DAC select: DACA" "DAC sel: DACA" "DAC: DACA" "D: DACA" "DACA" "A"
7161357-7161383 tlc5620: gain: "Gain: x1" "G: x1" "x1"
7161383-7161588 tlc5620: value: "DAC value: 132" "Value: 132" "Val: 132" "V: 132" "132"
7161306-7161332 tlc5620: bit: "0"
7161332-7161357 tlc5620: bit: "0"
7161357-7161383 tlc5620: bit: "0"
7161383-7161409 tlc5620: bit: "1"
7161409-7161434 tlc5620: bit: "0"
7161434-7161460 tlc5620: bit: "0"
7161460-7161485 tlc5620: bit: "0"
7161485-7161511 tlc5620: bit: "0"
7161511-7161537 tlc5620: bit: "1"
7161537-7161562 tlc5620: bit: "0"
7161562-7161588 tlc5620: bit: "0"
7161575-7161575 tlc5620: data-latch: "Falling edge on LOAD" "LOAD fall" "F"
7161306-7161588 tlc5620: reg-write: "Setting DACA register value to 1.70V" "DACA=1.70V"
7165289-7165341 tlc5620: dac-select: "DAC select: DACD" "DAC sel: DACD" "DAC: DACD" "D: DACD" "DACD" "D"
7165341-7165366 tlc5620: gain: "Gain: x2" "G: x2" "x2"
7165366-7165570 tlc5620: value: "DAC value: 122" "Value: 122" "Val: 122" "V: 122" "122"
7165289-7165315 tlc5620: bit: "1"
7165315-7165341 tlc5620: bit: "1"
7165341-7165366 tlc5620: bit: "1"
7165366-7165392 tlc5620: bit: "0"
7165392-7165417 tlc5620: bit: "1"
7165417-7165443 tlc5620: bit: "1"
7165443-7165469 tlc5620: bit: "1"
7165469-7165494 tlc5620: bit: "1"
7165494-7165520 tlc5620: bit: "0"
7165520-7165545 tlc5620: bit: "1"
7165545-7165570 tlc5620: bit: "0"
7165558-7165558 tlc5620: data-latch: "Falling edge on LOAD" "LOAD fall" "F"
7165289-7165570 tlc5620: reg-write: "Setting DACD register value to 3.15V" "DACD=3.15V"
7169280-7169331 tlc5620: dac-select: "DAC select: DACC" "DAC sel: DACC" "DAC: DACC" "D: DACC" "DACC" "C"
7169331-7169357 tlc5620: gain: "Gain: x2" "G: x2" "x2"
7169357-7169562 tlc5620: value: "DAC value: 108" "Value: 108" "Val: 108" "V: 108" "108"
7169280-7169306 tlc5620: bit: "1"
7169306-7169331 tlc5620: bit: "0"
7169331-7169357 tlc5620: bit: "1"
7169357-7169383 tlc5620: bit: "0"
7169383-7169408 tlc5620: bit: "1"
7169408-7169434 tlc5620: bit: "1"
7169434-7169459 tlc5620: bit: "0"
7169459-7169485 tlc5620: bit: "1"
7169485-7169511 tlc5620: bit: "1"
7169511-7169536 tlc5620: bit: "0"
7169536-7169562 tlc5620: bit: "0"
7169549-7169549 tlc5620: data-latch: "Falling edge on LOAD" "LOAD fall" "F"
7169280-7169562 tlc5620: reg-write: "Setting DACC register value to 2.78V" "DACC=2.78V"
7173996-7173996 tlc5620: ldac-fall: "Falling edge on LDAC" "LDAC fall" "LDAC" "L"
7161306-7173996 tlc5620: voltage-update-all: "Updating voltages: DACA=1.70V DACB=? DACC=2.78V DACD=3.15V" "DACA=1.70V DACB=? DACC=2.78V DACD=3.15V" "A=1.70V B=? C=2.78V D=3.15V"
7181222-7181273 tlc5620: dac-select: "DAC select: DACA" "DAC sel: DACA" "DAC: DACA" "D: DACA" "DACA" "A"
7181273-7181299 tlc5620: gain: "Gain: x1" "G: x1" "x1"
7181299-7181504 tlc5620: value: "DAC value: 131" "Value: 131" "Val: 131" "V: 131" "131"
7181222-7181247 tlc5620: bit: "0"
7181247-7181273 tlc5620: bit: "0"
7181273-7181299 tlc5620: bit: "0"
7181299-7181324 tlc5620: bit: "1"
7181324-7181350 tlc5620: bit: "0"
7181350-7181375 tlc5620: bit: "0"
7181375-7181401 tlc5620: bit: "0"
7181401-7181427 tlc5620: bit: "0"
7181427-7181452 tlc5620: bit: "0"
7181452-7181478 tlc5620: bit: "1"
7181478-7181504 tlc5620: bit: "1"
7181491-7181491 tlc5620: data-latch: "Falling edge on LOAD" "LOAD fall" "F"
7181222-7181504 tlc5620: reg-write: "Setting DACA register value to 1.69V" "DACA=1.69V"
7185264-7185315 tlc5620: dac-select: "DAC select: DACD" "DAC sel: DACD" "DAC: DACD" "D: DACD" "DACD" "D"
7185315-7185341 tlc5620: gain: "Gain: x2" "G: x2" "x2"
7185341-7185546 tlc5620: value: "DAC value: 122" "Value: 122" "Val: 122" "V: 122" "122"
7185264-7185289 tlc5620: bit: "1"
7185289-7185315 tlc5620: bit: "1"
7185315-7185341 tlc5620: bit: "1"
7185341-7185366 tlc5620: bit: "0"
7185366-7185392 tlc5620: bit: "1"
7185392-7185417 tlc5620: bit: "1"
7185417-7185443 tlc5620: bit: "1"
7185443-7185469 tlc5620: bit: "1"
7185469-7185494 tlc5620: bit: "0"
7185494-7185520 tlc5620: bit: "1"
7185520-7185546 tlc5620: bit: "0"
7185533-7185533 tlc5620: data-latch: "Falling edge on LOAD" "LOAD fall" "F"
7185264-7185546 tlc5620: reg-write: "Setting DACD register value to 3.15V" "DACD=3.15V"
7189311-7189362 tlc5620: dac-select: "DAC select: DACC" "DAC sel: DACC" "DAC: DACC" "D: DACC" "DACC" "C"
7189362-7189388 tlc5620: gain: "Gain: x2" "G: x2" "x2"
7189388-7189593 tlc5620: value: "DAC value: 108" "Value: 108" "Val: 108" "V: 108" "108"
7189311-7189337 tlc5620: bit: "1"
7189337-7189362 tlc5620: bit: "0"
7189362-7189388 tlc5620: bit: "1"
7189388-7189413 tlc5620: bit: "0"
7189413-7189439 tlc5620: bit: "1"
7189439-7189465 tlc5620: bit: "1"
7189465-7189490 tlc5620: bit: "0"
7189490-7189516 tlc5620: bit: "1"
7189516-7189541 tlc5620: bit: "1"
7189541-7189567 tlc5620: bit: "0"
7189567-7189593 tlc5620: bit: "0"
7189580-7189580 tlc5620: data-latch: "Falling edge on LOAD" "LOAD fall" "F"
7189311-7189593 tlc5620: reg-write: "Setting DACC register value to 2.78V" "DACC=2.78V"
7193952-7193952 tlc5620: ldac-fall: "Falling edge on LDAC" "LDAC fall" "LDAC" "L"
7181222-7193952 tlc5620: voltage-update-all: "Updating voltages: DACA=1.69V DACB=? DACC=2.78V DACD=3.15V" "DACA=1.69V DACB=? DACC=2.78V DACD=3.15V" "A=1.69V B=? C=2.78V D=3.15V"
7203225-7203276 tlc5620: dac-select: "DAC select: DACA" "DAC sel: DACA" "DAC: DACA" "D: DACA" "DACA" "A"
7203276-7203302 tlc5620: gain: "Gain: x1" "G: x1" "x1"
7203302-7203507 tlc5620: value: "DAC value: 128" "Value: 128" "Val: 128" "V: 128" "128"
7203225-7203250 tlc5620: bit: "0"
7203250-7203276 tlc5620: bit: "0"
7203276-7203302 tlc5620: bit: "0"
7203302-7203327 tlc5620: bit: "1"
7203327-7203353 tlc5620: bit: "0"
7203353-7203379 tlc5620: bit: "0"
7203379-7203404 tlc5620: bit: "0"
7203404-7203430 tlc5620: bit: "0"
7203430-7203455 tlc5620: bit: "0"
7203455-7203481 tlc5620: bit: "0"
7203481-7203507 tlc5620: bit: "0"
7203494-7203494 tlc5620: data-latch: "Falling edge on LOAD" "LOAD fall" "F"
7203225-7203507 tlc5620: reg-write: "Setting DACA register value to 1.65V" "DACA=1.65V"
7207264-7207316 tlc5620: dac-select: "DAC select: DACD" "DAC sel: DACD" "DAC: DACD" "D: DACD" "DACD" "D"
7207316-7207341 tlc5620: gain: "Gain: x2" "G: x2" "x2"
7207341-7207545 tlc5620: value: "DAC value: 122" "Value: 122" "Val: 122" "V: 122" "122"
7207264-7207290 tlc5620: bit: "1"
7207290-7207316 tlc5620: bit: "1"
7207316-7207341 tlc5620: bit: "1"
7207341-7207367 tlc5620: bit: "0"
7207367-7207392 tlc5620: bit: "1"
7207392-7207418 tlc5620: bit: "1"
7207418-7207444 tlc5620: bit: "1"
7207444-7207469 tlc5620: bit: "1"
7207469-7207495 tlc5620: bit: "0"
7207495-7207520 tlc5620: bit: "1"
7207520-7207545 tlc5620: bit: "0"
7207533-7207533 tlc5620: data-latch: "Falling edge on LOAD" "LOAD fall" "F"
7207264-7207545 tlc5620: reg-write: "Setting DACD register value to 3.15V" "DACD=3.15V"
7211309-7211360 tlc5620: dac-select: "DAC select: DACC" "DAC sel: DACC" "DAC: DACC" "D: DACC" "DACC" "C"
7211360-7211386 tlc5620: gain: "Gain: x2" "G: x2" "x2"
7211386-7211591 tlc5620: value: "DAC value: 108" "Value: 108" "Val: 108" "V: 108" "108"
7211309-7211335 tlc5620: bit: "1"
7211335-7211360 tlc5620: bit: "0"
7211360-7211386 tlc5620: bit: "1"
7211386-7211411 tlc5620: bit: "0"
7211411-7211437 tlc5620: bit: "1"
7211437-7211463 tlc5620: bit: "1"
7211463-7211488 tlc5620: bit: "0"
7211488-7211514 tlc5620: bit: "1"
7211514-7211539 tlc5620: bit: "1"
7211539-7211565 tlc5620: bit: "0"
7211565-7211591 tlc5620: bit: "0"
7211578-7211578 tlc5620: data-latch: "Falling edge on LOAD" "LOAD fall" "F"
7211309-7211591 tlc5620: reg-write: "Setting DACC register value to 2.78V" "DACC=2.78V"
7216363-7216363 tlc5620: ldac-fall: "Falling edge on LDAC" "LDAC fall" "LDAC" "L"
7203225-7216363 tlc5620: voltage-update-all: "Updating voltages: DACA=1.65V DACB=? DACC=2.78V DACD=3.15V" "DACA=1.65V DACB=? DACC=2.78V DACD=3.15V" "A=1.65V B=? C=2.78V D=3.15V"
7223181-7223233 tlc5620: dac-select: "DAC select: DACA" "DAC sel: DACA" "DAC: DACA" "D: DACA" "DACA" "A"
7223233-7223258 tlc5620: gain: "Gain: x1" "G: x1" "x1"
7223258-7223463 tlc5620: value: "DAC value: 126" "Value: 126" "Val: 126" "V: 126" "126"
7223181-7223207 tlc5620: bit: "0"
7223207-7223233 tlc5620: bit: "0"
7223233-7223258 tlc5620: bit: "0"
7223258-7223284 tlc5620: bit: "0"
7223284-7223309 tlc5620: bit: "1"
7223309-7223335 tlc5620: bit: "1"
7223335-7223361 tlc5620: bit: "1"
7223361-7223386 tlc5620: bit: "1"
7223386-7223412 tlc5620: bit: "1"
7223412-7223438 tlc5620: bit: "1"
7223438-7223463 tlc5620: bit: "0"
7223450-7223450 tlc5620: data-latch: "Falling edge on LOAD" "LOAD fall" "F"
7223181-7223463 tlc5620: reg-write: "Setting DACA register value to 1.62V" "DACA=1.62V"
7227226-7227277 tlc5620: dac-select: "DAC select: DACD" "DAC sel: DACD" "DAC: DACD" "D: DACD" "DACD" "D"
7227277-7227303 tlc5620: gain: "Gain: x2" "G: x2" "x2"
7227303-7227508 tlc5620: value: "DAC value: 122" "Value: 122" "Val: 122" "V: 122" "122"
7227226-7227252 tlc5620: bit: "1"
7227252-7227277 tlc5620: bit: "1"
7227277-7227303 tlc5620: bit: "1"
7227303-7227328 tlc5620: bit: "0"
7227328-7227354 tlc5620: bit: "1"
7227354-7227380 tlc5620: bit: "1"
7227380-7227405 tlc5620: bit: "1"
7227405-7227431 tlc5620: bit: "1"
7227431-7227457 tlc5620: bit: "0"
7227457-7227482 tlc5620: bit: "1"
7227482-7227508 tlc5620: bit: "0"
7227495-7227495 tlc5620: data-latch: "Falling edge on LOAD" "LOAD fall" "F"
7227226-7227508 tlc5620: reg-write: "Setting DACD register value to 3.15V" "DACD=3.15V"
7232052-7232103 tlc5620: dac-select: "DAC select: DACC" "DAC sel: DACC" "DAC: DACC" "D: DACC" "DACC" "C"
7232103-7232129 tlc5620: gain: "Gain: x2" "G: x2" "x2"
7232129-7232334 tlc5620: value: "DAC value: 108" "Value: 108" "Val: 108" "V: 108" "108"
7232052-7232077 tlc5620: bit: "1"
7232077-7232103 tlc5620: bit: "0"
7232103-7232129 tlc5620: bit: "1"
7232129-7232154 tlc5620: bit: "0"
7232154-7232180 tlc5620: bit: "1"
7232180-7232206 tlc5620: bit: "1"
7232206-7232231 tlc5620: bit: "0"
7232231-7232257 tlc5620: bit: "1"
7232257-7232282 tlc5620: bit: "1"
7232282-7232308 tlc5620: bit: "0"
7232308-7232334 tlc5620: bit: "0"
7232321-7232321 tlc5620: data-latch: "Falling edge on LOAD" "LOAD fall" "F"
7232052-7232334 tlc5620: reg-write: "Setting DACC register value to 2.78V" "DACC=2.78V"
7236194-7236194 tlc5620: ldac-fall: "Falling edge on LDAC" "LDAC fall" "LDAC" "L"
7223181-7236194 tlc5620: voltage-update-all: "Updating voltages: DACA=1.62V DACB=? DACC=2.78V DACD=3.15V" "DACA=1.62V DACB=? DACC=2.78V DACD=3.15V" "A=1.62V B=? C=2.78V D=3.15V"
7245167-7245218 tlc5620: dac-select: "DAC select: DACA" "DAC sel: DACA" "DAC: DACA" "D: DACA" "DACA" "A"
7245218-7245243 tlc5620: gain: "Gain: x1" "G: x1" "x1"
7245243-7245448 tlc5620: value: "DAC value: 124" "Value: 124" "Val: 124" "V: 124" "124"
7245167-7245192 tlc5620: bit: "0"
7245192-7245218 tlc5620: bit: "0"
7245218-7245243 tlc5620: bit: "0"
7245243-7245269 tlc5620: bit: "0"
7245269-7245295 tlc5620: bit: "1"
7245295-7245320 tlc5620: bit: "1"
7245320-7245346 tlc5620: bit: "1"
7245346-7245372 tlc5620: bit: "1"
7245372-7245397 tlc5620: bit: "1"
7245397-7245423 tlc5620: bit: "0"
7245423-7245448 tlc5620: bit: "0"
7245436-7245436 tlc5620: data-latch: "Falling edge on LOAD" "LOAD fall" "F"
7245167-7245448 tlc5620: reg-write: "Setting DACA register value to 1.60V" "DACA=1.60V"
7249219-7249270 tlc5620: dac-select: "DAC select: DACD" "DAC sel: DACD" "DAC: DACD" "D: DACD" "DACD" "D"
7249270-7249296 tlc5620: gain: "Gain: x2" "G: x2" "x2"
7249296-7249501 tlc5620: value: "DAC value: 122" "Value: 122" "Val: 122" "V: 122" "122"
7249219-7249245 tlc5620: bit: "1"
7249245-7249270 tlc5620: bit: "1"
7249270-7249296 tlc5620: bit: "1"
7249296-7249321 tlc5620: bit: "0"
7249321-7249347 tlc5620: bit: "1"
7249347-7249373 tlc5620: bit: "1"
7249373-7249398 tlc5620: bit: "1"
7249398-7249424 tlc5620: bit: "1"
7249424-7249449 tlc5620: bit: "0"
7249449-7249475 tlc5620: bit: "1"
7249475-7249501 tlc5620: bit: "0"
7249488-7249488 tlc5620: data-latch: "Falling edge on LOAD" "LOAD fall" "F"
7249219-7249501 tlc5620: reg-write: "Setting DACD register value to 3.15V" "DACD=3.15V"
7253266-7253317 tlc5620: dac-select: "DAC select: DACC" "DAC sel: DACC" "DAC: DACC" "D: DACC" "DACC" "C"
7253317-7253343 tlc5620: gain: "Gain: x2" "G: x2" "x2"
7253343-7253548 tlc5620: value: "DAC value: 108" "Value: 108" "Val: 108" "V: 108" "108"
7253266-7253292 tlc5620: bit: "1"
7253292-7253317 tlc5620: bit: "0"
7253317-7253343 tlc5620: bit: "1"
7253343-7253369 tlc5620: bit: "0"
7253369-7253394 tlc5620: bit: "1"
7253394-7253420 tlc5620: bit: "1"
7253420-7253445 tlc5620: bit: "0"
7253445-7253471 tlc5620: bit: "1"
7253471-7253497 tlc5620: bit: "1"
7253497-7253522 tlc5620: bit: "0"
7253522-7253548 tlc5620: bit: "0"
7253535-7253535 tlc5620: data-latch: "Falling edge on LOAD" "LOAD fall" "F"
7253266-7253548 tlc5620: reg-write: "Setting DACC register value to 2.78V" "DACC=2.78V"
7258179-7258179 tlc5620: ldac-fall: "Falling edge on LDAC" "LDAC fall" "LDAC" "L"
7245167-7258179 tlc5620: voltage-update-all: "Updating voltages: DACA=1.60V DACB=? DACC=2.78V DACD=3.15V" "DACA=1.60V DACB=? DACC=2.78V DACD=3.15V" "A=1.60V B=? C=2.78V D=3.15V"
7267177-7267229 tlc5620: dac-select: "DAC select: DACA" "DAC sel: DACA" "DAC: DACA" "D: DACA" "DACA" "A"
7267229-7267254 tlc5620: gain: "Gain: x1" "G: x1" "x1"
7267254-7267459 tlc5620: value: "DAC value: 122" "Value: 122" "Val: 122" "V: 122" "122"
7267177-7267203 tlc5620: bit: "0"
7267203-7267229 tlc5620: bit: "0"
7267229-7267254 tlc5620: bit: "0"
7267254-7267280 tlc5620: bit: "0"
7267280-7267306 tlc5620: bit: "1"
7267306-7267331 tlc5620: bit: "1"
7267331-7267357 tlc5620: bit: "1"
7267357-7267382 tlc5620: bit: "1"
7267382-7267408 tlc5620: bit: "0"
7267408-7267434 tlc5620: bit: "1"
7267434-7267459 tlc5620: bit: "0"
7267446-7267446 tlc5620: data-latch: "Falling edge on LOAD" "LOAD fall" "F"
7267177-7267459 tlc5620: reg-write: "Setting DACA register value to 1.57V" "DACA=1.57V"
7271196-7271248 tlc5620: dac-select: "DAC select: DACD" "DAC sel: DACD" "DAC: DACD" "D: DACD" "DACD" "D"
7271248-7271273 tlc5620: gain: "Gain: x2" "G: x2" "x2"
7271273-7271478 tlc5620: value: "DAC value: 122" "Value: 122" "Val: 122" "V: 122" "122"
7271196-7271222 tlc5620: bit: "1"
7271222-7271248 tlc5620: bit: "1"
7271248-7271273 tlc5620: bit: "1"
7271273-7271299 tlc5620: bit: "0"
7271299-7271325 tlc5620: bit: "1"
7271325-7271350 tlc5620: bit: "1"
7271350-7271376 tlc5620: bit: "1"
7271376-7271401 tlc5620: bit: "1"
7271401-7271427 tlc5620: bit: "0"
7271427-7271453 tlc5620: bit: "1"
7271453-7271478 tlc5620: bit: "0"
7271465-7271465 tlc5620: data-latch: "Falling edge on LOAD" "LOAD fall" "F"
7271196-7271478 tlc5620: reg-write: "Setting DACD register value to 3.15V" "DACD=3.15V"
7275251-7275303 tlc5620: dac-select: "DAC select: DACC" "DAC sel: DACC" "DAC: DACC" "D: DACC" "DACC" "C"
7275303-7275328 tlc5620: gain: "Gain: x2" "G: x2" "x2"
7275328-7275532 tlc5620: value: "DAC value: 108" "Value: 108" "Val: 108" "V: 108" "108"
7275251-7275277 tlc5620: bit: "1"
7275277-7275303 tlc5620: bit: "0"
7275303-7275328 tlc5620: bit: "1"
7275328-7275354 tlc5620: bit: "0"
7275354-7275379 tlc5620: bit: "1"
7275379-7275405 tlc5620: bit: "1"
7275405-7275431 tlc5620: bit: "0"
7275431-7275456 tlc5620: bit: "1"
7275456-7275482 tlc5620: bit: "1"
7275482-7275507 tlc5620: bit: "0"
7275507-7275532 tlc5620: bit: "0"
7275520-7275520 tlc5620: data-latch: "Falling edge on LOAD" "LOAD fall" "F"
7275251-7275532 tlc5620: reg-write: "Setting DACC register value to 2.78V" "DACC=2.78V"
7280169-7280169 tlc5620: ldac-fall: "Falling edge on LDAC" "LDAC fall" "LDAC" "L"
7267177-7280169 tlc5620: voltage-update-all: "Updating voltages: DACA=1.57V DACB=? DACC=2.78V DACD=3.15V" "DACA=1.57V DACB=? DACC=2.78V DACD=3.15V" "A=1.57V B=? C=2.78V D=3.15V"
7287121-7287172 tlc5620: dac-select: "DAC select: DACA" "DAC sel: DACA" "DAC: DACA" "D: DACA" "DACA" "A"
7287172-7287198 tlc5620: gain: "Gain: x1" "G: x1" "x1"
7287198-7287403 tlc5620: value: "DAC value: 119" "Value: 119" "Val: 119" "V: 119" "119"
7287121-7287147 tlc5620: bit: "0"
7287147-7287172 tlc5620: bit: "0"
7287172-7287198 tlc5620: bit: "0"
7287198-7287224 tlc5620: bit: "0"
7287224-7287249 tlc5620: bit: "1"
7287249-7287275 tlc5620: bit: "1"
7287275-7287301 tlc5620: bit: "1"
7287301-7287326 tlc5620: bit: "0"
7287326-7287352 tlc5620: bit: "1"
7287352-7287377 tlc5620: bit: "1"
7287377-7287403 tlc5620: bit: "1"
7287390-7287390 tlc5620: data-latch: "Falling edge on LOAD" "LOAD fall" "F"
7287121-7287403 tlc5620: reg-write: "Setting DACA register value to 1.53V" "DACA=1.53V"
7291189-7291240 tlc5620: dac-select: "DAC select: DACD" "DAC sel: DACD" "DAC: DACD" "D: DACD" "DACD" "D"
7291240-7291266 tlc5620: gain: "Gain: x2" "G: x2" "x2"
7291266-7291471 tlc5620: value: "DAC value: 122" "Value: 122" "Val: 122" "V: 122" "122"
7291189-7291214 tlc5620: bit: "1"
7291214-7291240 tlc5620: bit: "1"
7291240-7291266 tlc5620: bit: "1"
7291266-7291291 tlc5620: bit: "0"
7291291-7291317 tlc5620: bit: "1"
7291317-7291343 tlc5620: bit: "1"
7291343-7291368 tlc5620: bit: "1"
7291368-7291394 tlc5620: bit: "1"
7291394-7291419 tlc5620: bit: "0"
7291419-7291445 tlc5620: bit: "1"
7291445-7291471 tlc5620: bit: "0"
7291458-7291458 tlc5620: data-latch: "Falling edge on LOAD" "LOAD fall" "F"
7291189-7291471 tlc5620: reg-write: "Setting DACD register value to 3.15V" "DACD=3.15V"
7295226-7295277 tlc5620: dac-select: "DAC select: DACC" "DAC sel: DACC" "DAC: DACC" "D: DACC" "DACC" "C"
7295277-7295303 tlc5620: gain: "Gain: x2" "G: x2" "x2"
7295303-7295508 tlc5620: value: "DAC value: 108" "Value: 108" "Val: 108" "V: 108" "108"
7295226-7295251 tlc5620: bit: "1"
7295251-7295277 tlc5620: bit: "0"
7295277-7295303 tlc5620: bit: "1"
7295303-7295328 tlc5620: bit: "0"
7295328-7295354 tlc5620: bit: "1"
7295354-7295379 tlc5620: bit: "1"
7295379-7295405 tlc5620: bit: "0"
7295405-7295431 tlc5620: bit: "1"
7295431-7295456 tlc5620: bit: "1"
7295456-7295482 tlc5620: bit: "0"
7295482-7295508 tlc5620: bit: "0"
7295495-7295495 tlc5620: data-latch: "Falling edge on LOAD" "LOAD fall" "F"
7295226-7295508 tlc5620: reg-write: "Setting DACC register value to 2.78V" "DACC=2.78V"
7300144-7300144 tlc5620: ldac-fall: "Falling edge on LDAC" "LDAC fall" "LDAC" "L"
7287121-7300144 tlc5620: voltage-update-all: "Updating voltages: DACA=1.53V DACB=? DACC=2.78V DACD=3.15V" "DACA=1.53V DACB=? DACC=2.78V DACD=3.15V" "A=1.53V B=? C=2.78V D=3.15V"
7307365-7307416 tlc5620: dac-select: "DAC select: DACA" "DAC sel: DACA" "DAC: DACA" "D: DACA" "DACA" "A"
7307416-7307441 tlc5620: gain: "Gain: x1" "G: x1" "x1"
7307441-7307646 tlc5620: value: "DAC value: 119" "Value: 119" "Val: 119" "V: 119" "119"
7307365-7307390 tlc5620: bit: "0"
7307390-7307416 tlc5620: bit: "0"
7307416-7307441 tlc5620: bit: "0"
7307441-7307467 tlc5620: bit: "0"
7307467-7307493 tlc5620: bit: "1"
7307493-7307518 tlc5620: bit: "1"
7307518-7307544 tlc5620: bit: "1"
7307544-7307570 tlc5620: bit: "0"
7307570-7307595 tlc5620: bit: "1"
7307595-7307621 tlc5620: bit: "1"
7307621-7307646 tlc5620: bit: "1"
7307634-7307634 tlc5620: data-latch: "Falling edge on LOAD" "LOAD fall" "F"
7307365-7307646 tlc5620: reg-write: "Setting DACA register value to 1.53V" "DACA=1.53V"
7311489-7311540 tlc5620: dac-select: "DAC select: DACD" "DAC sel: DACD" "DAC: DACD" "D: DACD" "DACD" "D"
7311540-7311565 tlc5620: gain: "Gain: x2" "G: x2" "x2"
7311565-7311770 tlc5620: value: "DAC value: 122" "Value: 122" "Val: 122" "V: 122" "122"
7311489-7311514 tlc5620: bit: "1"
7311514-7311540 tlc5620: bit: "1"
7311540-7311565 tlc5620: bit: "1"
7311565-7311591 tlc5620: bit: "0"
7311591-7311617 tlc5620: bit: "1"
7311617-7311642 tlc5620: bit: "1"
7311642-7311668 tlc5620: bit: "1"
7311668-7311694 tlc5620: bit: "1"
7311694-7311719 tlc5620: bit: "0"
7311719-7311745 tlc5620: bit: "1"
7311745-7311770 tlc5620: bit: "0"
7311758-7311758 tlc5620: data-latch: "Falling edge on LOAD" "LOAD fall" "F"
7311489-7311770 tlc5620: reg-write: "Setting DACD register value to 3.15V" "DACD=3.15V"
7315203-7315254 tlc5620: dac-select: "DAC select: DACC" "DAC sel: DACC" "DAC: DACC" "D: DACC" "DACC" "C"
7315254-7315280 tlc5620: gain: "Gain: x2" "G: x2" "x2"
7315280-7315485 tlc5620: value: "DAC value: 108" "Value: 108" "Val: 108" "V: 108" "108"
7315203-7315228 tlc5620: bit: "1"
7315228-7315254 tlc5620: bit: "0"
7315254-7315280 tlc5620: bit: "1"
7315280-7315305 tlc5620: bit: "0"
7315305-7315331 tlc5620: bit: "1"
7315331-7315356 tlc5620: bit: "1"
7315356-7315382 tlc5620: bit: "0"
7315382-7315408 tlc5620: bit: "1"
7315408-7315433 tlc5620: bit: "1"
7315433-7315459 tlc5620: bit: "0"
7315459-7315485 tlc5620: bit: "0"
7315472-7315472 tlc5620: data-latch: "Falling edge on LOAD" "LOAD fall" "F"
7315203-7315485 tlc5620: reg-write: "Setting DACC register value to 2.78V" "DACC=2.78V"
7320105-7320105 tlc5620: ldac-fall: "Falling edge on LDAC" "LDAC fall" "LDAC" "L"
7307365-7320105 tlc5620: voltage-update-all: "Updating voltages: DACA=1.53V DACB=? DACC=2.78V DACD=3.15V" "DACA=1.53V DACB=? DACC=2.78V DACD=3.15V" "A=1.53V B=? C=2.78V D=3.15V"
7327360-7327411 tlc5620: dac-select: "DAC select: DACA" "DAC sel: DACA" "DAC: DACA" "D: DACA" "DACA" "A"
7327411-7327436 tlc5620: gain: "Gain: x1" "G: x1" "x1"
7327436-7327641 tlc5620: value: "DAC value: 118" "Value: 118" "Val: 118" "V: 118" "118"
7327360-7327385 tlc5620: bit: "0"
7327385-7327411 tlc5620: bit: "0"
7327411-7327436 tlc5620: bit: "0"
7327436-7327462 tlc5620: bit: "0"
7327462-7327488 tlc5620: bit: "1"
7327488-7327513 tlc5620: bit: "1"
7327513-7327539 tlc5620: bit: "1"
7327539-7327565 tlc5620: bit: "0"
7327565-7327590 tlc5620: bit: "1"
7327590-7327616 tlc5620: bit: "1"
7327616-7327641 tlc5620: bit: "0"
7327629-7327629 tlc5620: data-latch: "Falling edge on LOAD" "LOAD fall" "F"
7327360-7327641 tlc5620: reg-write: "Setting DACA register value to 1.52V" "DACA=1.52V"
7331386-7331437 tlc5620: dac-select: "DAC select: DACD" "DAC sel: DACD" "DAC: DACD" "D: DACD" "DACD" "D"
7331437-7331463 tlc5620: gain: "Gain: x2" "G: x2" "x2"
7331463-7331668 tlc5620: value: "DAC value: 122" "Value: 122" "Val: 122" "V: 122" "122"
7331386-7331412 tlc5620: bit: "1"
7331412-7331437 tlc5620: bit: "1"
7331437-7331463 tlc5620: bit: "1"
7331463-7331489 tlc5620: bit: "0"
7331489-7331514 tlc5620: bit: "1"
7331514-7331540 tlc5620: bit: "1"
7331540-7331566 tlc5620: bit: "1"
7331566-7331591 tlc5620: bit: "1"
7331591-7331617 tlc5620: bit: "0"
7331617-7331642 tlc5620: bit: "1"
7331642-7331668 tlc5620: bit: "0"
7331655-7331655 tlc5620: data-latch: "Falling edge on LOAD" "LOAD fall" "F"
7331386-7331668 tlc5620: reg-write: "Setting DACD register value to 3.15V" "DACD=3.15V"
7335141-7335193 tlc5620: dac-select: "DAC select: DACC" "DAC sel: DACC" "DAC: DACC" "D: DACC" "DACC" "C"
7335193-7335218 tlc5620: gain: "Gain: x2" "G: x2" "x2"
7335218-7335423 tlc5620: value: "DAC value: 108" "Value: 108" "Val: 108" "V: 108" "108"
7335141-7335167 tlc5620: bit: "1"
7335167-7335193 tlc5620: bit: "0"
7335193-7335218 tlc5620: bit: "1"
7335218-7335244 tlc5620: bit: "0"
7335244-7335269 tlc5620: bit: "1"
7335269-7335295 tlc5620: bit: "1"
7335295-7335321 tlc5620: bit: "0"
7335321-7335346 tlc5620: bit: "1"
7335346-7335372 tlc5620: bit: "1"
7335372-7335398 tlc5620: bit: "0"
7335398-7335423 tlc5620: bit: "0"
7335410-7335410 tlc5620: data-latch: "Falling edge on LOAD" "LOAD fall" "F"
7335141-7335423 tlc5620: reg-write: "Setting DACC register value to 2.78V" "DACC=2.78V"
7340085-7340085 tlc5620: ldac-fall: "Falling edge on LDAC" "LDAC fall" "LDAC" "L"
7327360-7340085 tlc5620: voltage-update-all: "Updating voltages: DACA=1.52V DACB=? DACC=2.78V DACD=3.15V" "DACA=1.52V DACB=? DACC=2.78V DACD=3.15V" "A=1.52V B=? C=2.78V D=3.15V"
7347293-7347344 tlc5620: dac-select: "DAC select: DACA" "DAC sel: DACA" "DAC: DACA" "D: DACA" "DACA" "A"
7347344-7347370 tlc5620: gain: "Gain: x1" "G: x1" "x1"
7347370-7347575 tlc5620: value: "DAC value: 117" "Value: 117" "Val: 117" "V: 117" "117"
7347293-7347319 tlc5620: bit: "0"
7347319-7347344 tlc5620: bit: "0"
7347344-7347370 tlc5620: bit: "0"
7347370-7347396 tlc5620: bit: "0"
7347396-7347421 tlc5620: bit: "1"
7347421-7347447 tlc5620: bit: "1"
7347447-7347472 tlc5620: bit: "1"
7347472-7347498 tlc5620: bit: "0"
7347498-7347524 tlc5620: bit: "1"
7347524-7347549 tlc5620: bit: "0"
7347549-7347575 tlc5620: bit: "1"
7347562-7347562 tlc5620: data-latch: "Falling edge on LOAD" "LOAD fall" "F"
7347293-7347575 tlc5620: reg-write: "Setting DACA register value to 1.51V" "DACA=1.51V"
7351343-7351394 tlc5620: dac-select: "DAC select: DACD" "DAC sel: DACD" "DAC: DACD" "D: DACD" "DACD" "D"
7351394-7351420 tlc5620: gain: "Gain: x2" "G: x2" "x2"
7351420-7351625 tlc5620: value: "DAC value: 122" "Value: 122" "Val: 122" "V: 122" "122"
7351343-7351368 tlc5620: bit: "1"
7351368-7351394 tlc5620: bit: "1"
7351394-7351420 tlc5620: bit: "1"
7351420-7351445 tlc5620: bit: "0"
7351445-7351471 tlc5620: bit: "1"
7351471-7351496 tlc5620: bit: "1"
7351496-7351522 tlc5620: bit: "1"
7351522-7351548 tlc5620: bit: "1"
7351548-7351573 tlc5620: bit: "0"
7351573-7351599 tlc5620: bit: "1"
7351599-7351625 tlc5620: bit: "0"
7351612-7351612 tlc5620: data-latch: "Falling edge on LOAD" "LOAD fall" "F"
7351343-7351625 tlc5620: reg-write: "Setting DACD register value to 3.15V" "DACD=3.15V"
7355385-7355436 tlc5620: dac-select: "DAC select: DACC" "DAC sel: DACC" "DAC: DACC" "D: DACC" "DACC" "C"
7355436-7355462 tlc5620: gain: "Gain: x2" "G: x2" "x2"
7355462-7355667 tlc5620: value: "DAC value: 108" "Value: 108" "Val: 108" "V: 108" "108"
7355385-7355410 tlc5620: bit: "1"
7355410-7355436 tlc5620: bit: "0"
7355436-7355462 tlc5620: bit: "1"
7355462-7355487 tlc5620: bit: "0"
7355487-7355513 tlc5620: bit: "1"
7355513-7355539 tlc5620: bit: "1"
7355539-7355564 tlc5620: bit: "0"
7355564-7355590 tlc5620: bit: "1"
7355590-7355615 tlc5620: bit: "1"
7355615-7355641 tlc5620: bit: "0"
7355641-7355667 tlc5620: bit: "0"
7355654-7355654 tlc5620: data-latch: "Falling edge on LOAD" "LOAD fall" "F"
7355385-7355667 tlc5620: reg-write: "Setting DACC register value to 2.78V" "DACC=2.78V"
7360036-7360036 tlc5620: ldac-fall: "Falling edge on LDAC" "LDAC fall" "LDAC" "L"
7347293-7360036 tlc5620: voltage-update-all: "Updating voltages: DACA=1.51V DACB=? DACC=2.78V DACD=3.15V" "DACA=1.51V DACB=? DACC=2.78V DACD=3.15V" "A=1.51V B=? C=2.78V D=3.15V"
7427462-7427514 tlc5620: dac-select: "DAC select: DACA" "DAC sel: DACA" "DAC: DACA" "D: DACA" "DACA" "A"
7427514-7427539 tlc5620: gain: "Gain: x1" "G: x1" "x1"
7427539-7427744 tlc5620: value: "DAC value: 116" "Value: 116" "Val: 116" "V: 116" "116"
7427462-7427488 tlc5620: bit: "0"
7427488-7427514 tlc5620: bit: "0"
7427514-7427539 tlc5620: bit: "0"
7427539-7427565 tlc5620: bit: "0"
7427565-7427591 tlc5620: bit: "1"
7427591-7427616 tlc5620: bit: "1"
7427616-7427642 tlc5620: bit: "1"
7427642-7427667 tlc5620: bit: "0"
7427667-7427693 tlc5620: bit: "1"
7427693-7427719 tlc5620: bit: "0"
7427719-7427744 tlc5620: bit: "0"
7427731-7427731 tlc5620: data-latch: "Falling edge on LOAD" "LOAD fall" "F"
7427462-7427744 tlc5620: reg-write: "Setting DACA register value to 1.50V" "DACA=1.50V"
7431200-7431251 tlc5620: dac-select: "DAC select: DACD" "DAC sel: DACD" "DAC: DACD" "D: DACD" "DACD" "D"
7431251-7431277 tlc5620: gain: "Gain: x2" "G: x2" "x2"
7431277-7431482 tlc5620: value: "DAC value: 122" "Value: 122" "Val: 122" "V: 122" "122"
7431200-7431225 tlc5620: bit: "1"
7431225-7431251 tlc5620: bit: "1"
7431251-7431277 tlc5620: bit: "1"
7431277-7431302 tlc5620: bit: "0"
7431302-7431328 tlc5620: bit: "1"
7431328-7431353 tlc5620: bit: "1"
7431353-7431379 tlc5620: bit: "1"
7431379-7431405 tlc5620: bit: "1"
7431405-7431430 tlc5620: bit: "0"
7431430-7431456 tlc5620: bit: "1"
7431456-7431482 tlc5620: bit: "0"
7431469-7431469 tlc5620: data-latch: "Falling edge on LOAD" "LOAD fall" "F"
7431200-7431482 tlc5620: reg-write: "Setting DACD register value to 3.15V" "DACD=3.15V"
7435275-7435326 tlc5620: dac-select: "DAC select: DACC" "DAC sel: DACC" "DAC: DACC" "D: DACC" "DACC" "C"
7435326-7435352 tlc5620: gain: "Gain: x2" "G: x2" "x2"
7435352-7435557 tlc5620: value: "DAC value: 108" "Value: 108" "Val: 108" "V: 108" "108"
7435275-7435301 tlc5620: bit: "1"
7435301-7435326 tlc5620: bit: "0"
7435326-7435352 tlc5620: bit: "1"
7435352-7435377 tlc5620: bit: "0"
7435377-7435403 tlc5620: bit: "1"
7435403-7435429 tlc5620: bit: "1"
7435429-7435454 tlc5620: bit: "0"
7435454-7435480 tlc5620: bit: "1"
7435480-7435506 tlc5620: bit: "1"
7435506-7435531 tlc5620: bit: "0"
7435531-7435557 tlc5620: bit: "0"
7435544-7435544 tlc5620: data-latch: "Falling edge on LOAD" "LOAD fall" "F"
7435275-7435557 tlc5620: reg-write: "Setting DACC register value to 2.78V" "DACC=2.78V"
7440190-7440190 tlc5620: ldac-fall: "Falling edge on LDAC" "LDAC fall" "LDAC" "L"
7427462-7440190 tlc5620: voltage-update-all: "Updating voltages: DACA=1.50V DACB=? DACC=2.78V DACD=3.15V" "DACA=1.50V DACB=? DACC=2.78V DACD=3.15V" "A=1.50V B=? C=2.78V D=3.15V"
7447411-7447463 tlc5620: dac-select: "DAC select: DACA" "DAC sel: DACA" "DAC: DACA" "D: DACA" "DACA" "A"
7447463-7447488 tlc5620: gain: "Gain: x1" "G: x1" "x1"
7447488-7447692 tlc5620: value: "DAC value: 115" "Value: 115" "Val: 115" "V: 115" "115"
7447411-7447437 tlc5620: bit: "0"
7447437-7447463 tlc5620: bit: "0"
7447463-7447488 tlc5620: bit: "0"
7447488-7447514 tlc5620: bit: "0"
7447514-7447539 tlc5620: bit: "1"
7447539-7447565 tlc5620: bit: "1"
7447565-7447591 tlc5620: bit: "1"
7447591-7447616 tlc5620: bit: "0"
7447616-7447642 tlc5620: bit: "0"
7447642-7447667 tlc5620: bit: "1"
7447667-7447692 tlc5620: bit: "1"
7447680-7447680 tlc5620: data-latch: "Falling edge on LOAD" "LOAD fall" "F"
7447411-7447692 tlc5620: reg-write: "Setting DACA register value to 1.48V" "DACA=1.48V"
7451443-7451494 tlc5620: dac-select: "DAC select: DACD" "DAC sel: DACD" "DAC: DACD" "D: DACD" "DACD" "D"
7451494-7451520 tlc5620: gain: "Gain: x2" "G: x2" "x2"
7451520-7451725 tlc5620: value: "DAC value: 122" "Value: 122" "Val: 122" "V: 122" "122"
7451443-7451469 tlc5620: bit: "1"
7451469-7451494 tlc5620: bit: "1"
7451494-7451520 tlc5620: bit: "1"
7451520-7451546 tlc5620: bit: "0"
7451546-7451571 tlc5620: bit: "1"
7451571-7451597 tlc5620: bit: "1"
7451597-7451622 tlc5620: bit: "1"
7451622-7451648 tlc5620: bit: "1"
7451648-7451674 tlc5620: bit: "0"
7451674-7451699 tlc5620: bit: "1"
7451699-7451725 tlc5620: bit: "0"
7451712-7451712 tlc5620: data-latch: "Falling edge on LOAD" "LOAD fall" "F"
7451443-7451725 tlc5620: reg-write: "Setting DACD register value to 3.15V" "DACD=3.15V"
7457409-7457460 tlc5620: dac-select: "DAC select: DACC" "DAC sel: DACC" "DAC: DACC" "D: DACC" "DACC" "C"
7457460-7457486 tlc5620: gain: "Gain: x2" "G: x2" "x2"
7457486-7457691 tlc5620: value: "DAC value: 108" "Value: 108" "Val: 108" "V: 108" "108"
7457409-7457434 tlc5620: bit: "1"
7457434-7457460 tlc5620: bit: "0"
7457460-7457486 tlc5620: bit: "1"
7457486-7457511 tlc5620: bit: "0"
7457511-7457537 tlc5620: bit: "1"
7457537-7457562 tlc5620: bit: "1"
7457562-7457588 tlc5620: bit: "0"
7457588-7457614 tlc5620: bit: "1"
7457614-7457639 tlc5620: bit: "1"
7457639-7457665 tlc5620: bit: "0"
7457665-7457691 tlc5620: bit: "0"
7457678-7457678 tlc5620: data-latch: "Falling edge on LOAD" "LOAD fall" "F"
7457409-7457691 tlc5620: reg-write: "Setting DACC register value to 2.78V" "DACC=2.78V"
7461356-7461356 tlc5620: ldac-fall: "Falling edge on LDAC" "LDAC fall" "LDAC" "L"
7447411-7461356 tlc5620: voltage-update-all: "Updating voltages: DACA=1.48V DACB=? DACC=2.78V DACD=3.15V" "DACA=1.48V DACB=? DACC=2.78V DACD=3.15V" "A=1.48V B=? C=2.78V D=3.15V"
7468564-7468615 tlc5620: dac-select: "DAC select: DACA" "DAC sel: DACA" "DAC: DACA" "D: DACA" "DACA" "A"
7468615-7468641 tlc5620: gain: "Gain: x1" "G: x1" "x1"
7468641-7468846 tlc5620: value: "DAC value: 114" "Value: 114" "Val: 114" "V: 114" "114"
7468564-7468590 tlc5620: bit: "0"
7468590-7468615 tlc5620: bit: "0"
7468615-7468641 tlc5620: bit: "0"
7468641-7468667 tlc5620: bit: "0"
7468667-7468692 tlc5620: bit: "1"
7468692-7468718 tlc5620: bit: "1"
7468718-7468743 tlc5620: bit: "1"
7468743-7468769 tlc5620: bit: "0"
7468769-7468795 tlc5620: bit: "0"
7468795-7468820 tlc5620: bit: "1"
7468820-7468846 tlc5620: bit: "0"
7468833-7468833 tlc5620: data-latch: "Falling edge on LOAD" "LOAD fall" "F"
7468564-7468846 tlc5620: reg-write: "Setting DACA register value to 1.47V" "DACA=1.47V"
7472696-7472747 tlc5620: dac-select: "DAC select: DACD" "DAC sel: DACD" "DAC: DACD" "D: DACD" "DACD" "D"
7472747-7472773 tlc5620: gain: "Gain: x2" "G: x2" "x2"
7472773-7472978 tlc5620: value: "DAC value: 122" "Value: 122" "Val: 122" "V: 122" "122"
7472696-7472721 tlc5620: bit: "1"
7472721-7472747 tlc5620: bit: "1"
7472747-7472773 tlc5620: bit: "1"
7472773-7472798 tlc5620: bit: "0"
7472798-7472824 tlc5620: bit: "1"
7472824-7472849 tlc5620: bit: "1"
7472849-7472875 tlc5620: bit: "1"
7472875-7472901 tlc5620: bit: "1"
7472901-7472926 tlc5620: bit: "0"
7472926-7472952 tlc5620: bit: "1"
7472952-7472978 tlc5620: bit: "0"
7472965-7472965 tlc5620: data-latch: "Falling edge on LOAD" "LOAD fall" "F"
7472696-7472978 tlc5620: reg-write: "Setting DACD register value to 3.15V" "DACD=3.15V"
7476666-7476717 tlc5620: dac-select: "DAC select: DACC" "DAC sel: DACC" "DAC: DACC" "D: DACC" "DACC" "C"
7476717-7476743 tlc5620: gain: "Gain: x2" "G: x2" "x2"
7476743-7476948 tlc5620: value: "DAC value: 108" "Value: 108" "Val: 108" "V: 108" "108"
7476666-7476692 tlc5620: bit: "1"
7476692-7476717 tlc5620: bit: "0"
7476717-7476743 tlc5620: bit: "1"
7476743-7476769 tlc5620: bit: "0"
7476769-7476794 tlc5620: bit: "1"
7476794-7476820 tlc5620: bit: "1"
7476820-7476845 tlc5620: bit: "0"
7476845-7476871 tlc5620: bit: "1"
7476871-7476897 tlc5620: bit: "1"
7476897-7476922 tlc5620: bit: "0"
7476922-7476948 tlc5620: bit: "0"
7476935-7476935 tlc5620: data-latch: "Falling edge on LOAD" "LOAD fall" "F"
7476666-7476948 tlc5620: reg-write: "Setting DACC register value to 2.78V" "DACC=2.78V"
7481318-7481318 tlc5620: ldac-fall: "Falling edge on LDAC" "LDAC fall" "LDAC" "L"
7468564-7481318 tlc5620: voltage-update-all: "Updating voltages: DACA=1.47V DACB=? DACC=2.78V DACD=3.15V" "DACA=1.47V DACB=? DACC=2.78V DACD=3.15V" "A=1.47V B=? C=2.78V D=3.15V"
7488562-7488613 tlc5620: dac-select: "DAC select: DACA" "DAC sel: DACA" "DAC: DACA" "D: DACA" "DACA" "A"
7488613-7488638 tlc5620: gain: "Gain: x1" "G: x1" "x1"
7488638-7488843 tlc5620: value: "DAC value: 113" "Value: 113" "Val: 113" "V: 113" "113"
7488562-7488587 tlc5620: bit: "0"
7488587-7488613 tlc5620: bit: "0"
7488613-7488638 tlc5620: bit: "0"
7488638-7488664 tlc5620: bit: "0"
7488664-7488690 tlc5620: bit: "1"
7488690-7488715 tlc5620: bit: "1"
7488715-7488741 tlc5620: bit: "1"
7488741-7488767 tlc5620: bit: "0"
7488767-7488792 tlc5620: bit: "0"
7488792-7488818 tlc5620: bit: "0"
7488818-7488843 tlc5620: bit: "1"
7488831-7488831 tlc5620: data-latch: "Falling edge on LOAD" "LOAD fall" "F"
7488562-7488843 tlc5620: reg-write: "Setting DACA register value to 1.46V" "DACA=1.46V"
7492591-7492642 tlc5620: dac-select: "DAC select: DACD" "DAC sel: DACD" "DAC: DACD" "D: DACD" "DACD" "D"
7492642-7492668 tlc5620: gain: "Gain: x2" "G: x2" "x2"
7492668-7492873 tlc5620: value: "DAC value: 122" "Value: 122" "Val: 122" "V: 122" "122"
7492591-7492616 tlc5620: bit: "1"
7492616-7492642 tlc5620: bit: "1"
7492642-7492668 tlc5620: bit: "1"
7492668-7492693 tlc5620: bit: "0"
7492693-7492719 tlc5620: bit: "1"
7492719-7492745 tlc5620: bit: "1"
7492745-7492770 tlc5620: bit: "1"
7492770-7492796 tlc5620: bit: "1"
7492796-7492821 tlc5620: bit: "0"
7492821-7492847 tlc5620: bit: "1"
7492847-7492873 tlc5620: bit: "0"
7492860-7492860 tlc5620: data-latch: "Falling edge on LOAD" "LOAD fall" "F"
7492591-7492873 tlc5620: reg-write: "Setting DACD register value to 3.15V" "DACD=3.15V"
7496635-7496687 tlc5620: dac-select: "DAC select: DACC" "DAC sel: DACC" "DAC: DACC" "D: DACC" "DACC" "C"
7496687-7496712 tlc5620: gain: "Gain: x2" "G: x2" "x2"
7496712-7496917 tlc5620: value: "DAC value: 108" "Value: 108" "Val: 108" "V: 108" "108"
7496635-7496661 tlc5620: bit: "1"
7496661-7496687 tlc5620: bit: "0"
7496687-7496712 tlc5620: bit: "1"
7496712-7496738 tlc5620: bit: "0"
7496738-7496763 tlc5620: bit: "1"
7496763-7496789 tlc5620: bit: "1"
7496789-7496815 tlc5620: bit: "0"
7496815-7496840 tlc5620: bit: "1"
7496840-7496866 tlc5620: bit: "1"
7496866-7496892 tlc5620: bit: "0"
7496892-7496917 tlc5620: bit: "0"
7496904-7496904 tlc5620: data-latch: "Falling edge on LOAD" "LOAD fall" "F"
7496635-7496917 tlc5620: reg-write: "Setting DACC register value to 2.78V" "DACC=2.78V"
7501556-7501556 tlc5620: ldac-fall: "Falling edge on LDAC" "LDAC fall" "LDAC" "L"
7488562-7501556 tlc5620: voltage-update-all: "Updating voltages: DACA=1.46V DACB=? DACC=2.78V DACD=3.15V" "DACA=1.46V DACB=? DACC=2.78V DACD=3.15V" "A=1.46V B=? C=2.78V D=3.15V"
7508500-7508551 tlc5620: dac-select: "DAC select: DACA" "DAC sel: DACA" "DAC: DACA" "D: DACA" "DACA" "A"
7508551-7508577 tlc5620: gain: "Gain: x1" "G: x1" "x1"
7508577-7508782 tlc5620: value: "DAC value: 110" "Value: 110" "Val: 110" "V: 110" "110"
7508500-7508526 tlc5620: bit: "0"
7508526-7508551 tlc5620: bit: "0"
7508551-7508577 tlc5620: bit: "0"
7508577-7508603 tlc5620: bit: "0"
7508603-7508628 tlc5620: bit: "1"
7508628-7508654 tlc5620: bit: "1"
7508654-7508680 tlc5620: bit: "0"
7508680-7508705 tlc5620: bit: "1"
7508705-7508731 tlc5620: bit: "1"
7508731-7508756 tlc5620: bit: "1"
7508756-7508782 tlc5620: bit: "0"
7508769-7508769 tlc5620: data-latch: "Falling edge on LOAD" "LOAD fall" "F"
7508500-7508782 tlc5620: reg-write: "Setting DACA register value to 1.42V" "DACA=1.42V"
7512535-7512586 tlc5620: dac-select: "DAC select: DACD" "DAC sel: DACD" "DAC: DACD" "D: DACD" "DACD" "D"
7512586-7512611 tlc5620: gain: "Gain: x2" "G: x2" "x2"
7512611-7512816 tlc5620: value: "DAC value: 122" "Value: 122" "Val: 122" "V: 122" "122"
7512535-7512560 tlc5620: bit: "1"
7512560-7512586 tlc5620: bit: "1"
7512586-7512611 tlc5620: bit: "1"
7512611-7512637 tlc5620: bit: "0"
7512637-7512663 tlc5620: bit: "1"
7512663-7512688 tlc5620: bit: "1"
7512688-7512714 tlc5620: bit: "1"
7512714-7512739 tlc5620: bit: "1"
7512739-7512765 tlc5620: bit: "0"
7512765-7512791 tlc5620: bit: "1"
7512791-7512816 tlc5620: bit: "0"
7512804-7512804 tlc5620: data-latch: "Falling edge on LOAD" "LOAD fall" "F"
7512535-7512816 tlc5620: reg-write: "Setting DACD register value to 3.15V" "DACD=3.15V"
7516592-7516643 tlc5620: dac-select: "DAC select: DACC" "DAC sel: DACC" "DAC: DACC" "D: DACC" "DACC" "C"
7516643-7516669 tlc5620: gain: "Gain: x2" "G: x2" "x2"
7516669-7516874 tlc5620: value: "DAC value: 108" "Value: 108" "Val: 108" "V: 108" "108"
7516592-7516618 tlc5620: bit: "1"
7516618-7516643 tlc5620: bit: "0"
7516643-7516669 tlc5620: bit: "1"
7516669-7516694 tlc5620: bit: "0"
7516694-7516720 tlc5620: bit: "1"
7516720-7516746 tlc5620: bit: "1"
7516746-7516771 tlc5620: bit: "0"
7516771-7516797 tlc5620: bit: "1"
7516797-7516822 tlc5620: bit: "1"
7516822-7516848 tlc5620: bit: "0"
7516848-7516874 tlc5620: bit: "0"
7516861-7516861 tlc5620: data-latch: "Falling edge on LOAD" "LOAD fall" "F"
7516592-7516874 tlc5620: reg-write: "Setting DACC register value to 2.78V" "DACC=2.78V"
7521554-7521554 tlc5620: ldac-fall: "Falling edge on LDAC" "LDAC fall" "LDAC" "L"
7508500-7521554 tlc5620: voltage-update-all: "Updating voltages: DACA=1.42V DACB=? DACC=2.78V DACD=3.15V" "DACA=1.42V DACB=? DACC=2.78V DACD=3.15V" "A=1.42V B=? C=2.78V D=3.15V"
7528459-7528511 tlc5620: dac-select: "DAC select: DACA" "DAC sel: DACA" "DAC: DACA" "D: DACA" "DACA" "A"
7528511-7528536 tlc5620: gain: "Gain: x1" "G: x1" "x1"
7528536-7528740 tlc5620: value: "DAC value: 109" "Value: 109" "Val: 109" "V: 109" "109"
7528459-7528485 tlc5620: bit: "0"
7528485-7528511 tlc5620: bit: "0"
7528511-7528536 tlc5620: bit: "0"
7528536-7528562 tlc5620: bit: "0"
7528562-7528587 tlc5620: bit: "1"
7528587-7528613 tlc5620: bit: "1"
7528613-7528639 tlc5620: bit: "0"
7528639-7528664 tlc5620: bit: "1"
7528664-7528690 tlc5620: bit: "1"
7528690-7528715 tlc5620: bit: "0"
7528715-7528740 tlc5620: bit: "1"
7528728-7528728 tlc5620: data-latch: "Falling edge on LOAD" "LOAD fall" "F"
7528459-7528740 tlc5620: reg-write: "Setting DACA register value to 1.41V" "DACA=1.41V"
7532509-7532560 tlc5620: dac-select: "DAC select: DACD" "DAC sel: DACD" "DAC: DACD" "D: DACD" "DACD" "D"
7532560-7532586 tlc5620: gain: "Gain: x2" "G: x2" "x2"
7532586-7532791 tlc5620: value: "DAC value: 122" "Value: 122" "Val: 122" "V: 122" "122"
7532509-7532535 tlc5620: bit: "1"
7532535-7532560 tlc5620: bit: "1"
7532560-7532586 tlc5620: bit: "1"
7532586-7532611 tlc5620: bit: "0"
7532611-7532637 tlc5620: bit: "1"
7532637-7532663 tlc5620: bit: "1"
7532663-7532688 tlc5620: bit: "1"
7532688-7532714 tlc5620: bit: "1"
7532714-7532740 tlc5620: bit: "0"
7532740-7532765 tlc5620: bit: "1"
7532765-7532791 tlc5620: bit: "0"
7532778-7532778 tlc5620: data-latch: "Falling edge on LOAD" "LOAD fall" "F"
7532509-7532791 tlc5620: reg-write: "Setting DACD register value to 3.15V" "DACD=3.15V"
7536584-7536636 tlc5620: dac-select: "DAC select: DACC" "DAC sel: DACC" "DAC: DACC" "D: DACC" "DACC" "C"
7536636-7536661 tlc5620: gain: "Gain: x2" "G: x2" "x2"
7536661-7536865 tlc5620: value: "DAC value: 108" "Value: 108" "Val: 108" "V: 108" "108"
7536584-7536610 tlc5620: bit: "1"
7536610-7536636 tlc5620: bit: "0"
7536636-7536661 tlc5620: bit: "1"
7536661-7536687 tlc5620: bit: "0"
7536687-7536712 tlc5620: bit: "1"
7536712-7536738 tlc5620: bit: "1"
7536738-7536764 tlc5620: bit: "0"
7536764-7536789 tlc5620: bit: "1"
7536789-7536815 tlc5620: bit: "1"
7536815-7536840 tlc5620: bit: "0"
7536840-7536865 tlc5620: bit: "0"
7536853-7536853 tlc5620: data-latch: "Falling edge on LOAD" "LOAD fall" "F"
7536584-7536865 tlc5620: reg-write: "Setting DACC register value to 2.78V" "DACC=2.78V"
7541472-7541472 tlc5620: ldac-fall: "Falling edge on LDAC" "LDAC fall" "LDAC" "L"
7528459-7541472 tlc5620: voltage-update-all: "Updating voltages: DACA=1.41V DACB=? DACC=2.78V DACD=3.15V" "DACA=1.41V DACB=? DACC=2.78V DACD=3.15V" "A=1.41V B=? C=2.78V D=3.15V"
7548695-7548746 tlc5620: dac-select: "DAC select: DACA" "DAC sel: DACA" "DAC: DACA" "D: DACA" "DACA" "A"
7548746-7548772 tlc5620: gain: "Gain: x1" "G: x1" "x1"
7548772-7548977 tlc5620: value: "DAC value: 108" "Value: 108" "Val: 108" "V: 108" "108"
7548695-7548721 tlc5620: bit: "0"
7548721-7548746 tlc5620: bit: "0"
7548746-7548772 tlc5620: bit: "0"
7548772-7548798 tlc5620: bit: "0"
7548798-7548823 tlc5620: bit: "1"
7548823-7548849 tlc5620: bit: "1"
7548849-7548874 tlc5620: bit: "0"
7548874-7548900 tlc5620: bit: "1"
7548900-7548926 tlc5620: bit: "1"
7548926-7548951 tlc5620: bit: "0"
7548951-7548977 tlc5620: bit: "0"
7548964-7548964 tlc5620: data-latch: "Falling edge on LOAD" "LOAD fall" "F"
7548695-7548977 tlc5620: reg-write: "Setting DACA register value to 1.39V" "DACA=1.39V"
7552483-7552535 tlc5620: dac-select: "DAC select: DACD" "DAC sel: DACD" "DAC: DACD" "D: DACD" "DACD" "D"
7552535-7552560 tlc5620: gain: "Gain: x2" "G: x2" "x2"
7552560-7552765 tlc5620: value: "DAC value: 122" "Value: 122" "Val: 122" "V: 122" "122"
7552483-7552509 tlc5620: bit: "1"
7552509-7552535 tlc5620: bit: "1"
7552535-7552560 tlc5620: bit: "1"
7552560-7552586 tlc5620: bit: "0"
7552586-7552612 tlc5620: bit: "1"
7552612-7552637 tlc5620: bit: "1"
7552637-7552663 tlc5620: bit: "1"
7552663-7552688 tlc5620: bit: "1"
7552688-7552714 tlc5620: bit: "0"
7552714-7552740 tlc5620: bit: "1"
7552740-7552765 tlc5620: bit: "0"
7552752-7552752 tlc5620: data-latch: "Falling edge on LOAD" "LOAD fall" "F"
7552483-7552765 tlc5620: reg-write: "Setting DACD register value to 3.15V" "DACD=3.15V"
7556531-7556582 tlc5620: dac-select: "DAC select: DACC" "DAC sel: DACC" "DAC: DACC" "D: DACC" "DACC" "C"
7556582-7556607 tlc5620: gain: "Gain: x2" "G: x2" "x2"
7556607-7556812 tlc5620: value: "DAC value: 108" "Value: 108" "Val: 108" "V: 108" "108"
7556531-7556556 tlc5620: bit: "1"
7556556-7556582 tlc5620: bit: "0"
7556582-7556607 tlc5620: bit: "1"
7556607-7556633 tlc5620: bit: "0"
7556633-7556659 tlc5620: bit: "1"
7556659-7556684 tlc5620: bit: "1"
7556684-7556710 tlc5620: bit: "0"
7556710-7556736 tlc5620: bit: "1"
7556736-7556761 tlc5620: bit: "1"
7556761-7556787 tlc5620: bit: "0"
7556787-7556812 tlc5620: bit: "0"
7556800-7556800 tlc5620: data-latch: "Falling edge on LOAD" "LOAD fall" "F"
7556531-7556812 tlc5620: reg-write: "Setting DACC register value to 2.78V" "DACC=2.78V"
7561472-7561472 tlc5620: ldac-fall: "Falling edge on LDAC" "LDAC fall" "LDAC" "L"
7548695-7561472 tlc5620: voltage-update-all: "Updating voltages: DACA=1.39V DACB=? DACC=2.78V DACD=3.15V" "DACA=1.39V DACB=? DACC=2.78V DACD=3.15V" "A=1.39V B=? C=2.78V D=3.15V"
7568703-7568754 tlc5620: dac-select: "DAC select: DACA" "DAC sel: DACA" "DAC: DACA" "D: DACA" "DACA" "A"
7568754-7568780 tlc5620: gain: "Gain: x1" "G: x1" "x1"
7568780-7568985 tlc5620: value: "DAC value: 106" "Value: 106" "Val: 106" "V: 106" "106"
7568703-7568728 tlc5620: bit: "0"
7568728-7568754 tlc5620: bit: "0"
7568754-7568780 tlc5620: bit: "0"
7568780-7568805 tlc5620: bit: "0"
7568805-7568831 tlc5620: bit: "1"
7568831-7568856 tlc5620: bit: "1"
7568856-7568882 tlc5620: bit: "0"
7568882-7568908 tlc5620: bit: "1"
7568908-7568933 tlc5620: bit: "0"
7568933-7568959 tlc5620: bit: "1"
7568959-7568985 tlc5620: bit: "0"
7568972-7568972 tlc5620: data-latch: "Falling edge on LOAD" "LOAD fall" "F"
7568703-7568985 tlc5620: reg-write: "Setting DACA register value to 1.37V" "DACA=1.37V"
7572719-7572770 tlc5620: dac-select: "DAC select: DACD" "DAC sel: DACD" "DAC: DACD" "D: DACD" "DACD" "D"
7572770-7572796 tlc5620: gain: "Gain: x2" "G: x2" "x2"
7572796-7573001 tlc5620: value: "DAC value: 122" "Value: 122" "Val: 122" "V: 122" "122"
7572719-7572745 tlc5620: bit: "1"
7572745-7572770 tlc5620: bit: "1"
7572770-7572796 tlc5620: bit: "1"
7572796-7572822 tlc5620: bit: "0"
7572822-7572847 tlc5620: bit: "1"
7572847-7572873 tlc5620: bit: "1"
7572873-7572899 tlc5620: bit: "1"
7572899-7572924 tlc5620: bit: "1"
7572924-7572950 tlc5620: bit: "0"
7572950-7572975 tlc5620: bit: "1"
7572975-7573001 tlc5620: bit: "0"
7572988-7572988 tlc5620: data-latch: "Falling edge on LOAD" "LOAD fall" "F"
7572719-7573001 tlc5620: reg-write: "Setting DACD register value to 3.15V" "DACD=3.15V"
7576490-7576541 tlc5620: dac-select: "DAC select: DACC" "DAC sel: DACC" "DAC: DACC" "D: DACC" "DACC" "C"
7576541-7576567 tlc5620: gain: "Gain: x2" "G: x2" "x2"
7576567-7576772 tlc5620: value: "DAC value: 108" "Value: 108" "Val: 108" "V: 108" "108"
7576490-7576515 tlc5620: bit: "1"
7576515-7576541 tlc5620: bit: "0"
7576541-7576567 tlc5620: bit: "1"
7576567-7576592 tlc5620: bit: "0"
7576592-7576618 tlc5620: bit: "1"
7576618-7576643 tlc5620: bit: "1"
7576643-7576669 tlc5620: bit: "0"
7576669-7576695 tlc5620: bit: "1"
7576695-7576720 tlc5620: bit: "1"
7576720-7576746 tlc5620: bit: "0"
7576746-7576772 tlc5620: bit: "0"
7576759-7576759 tlc5620: data-latch: "Falling edge on LOAD" "LOAD fall" "F"
7576490-7576772 tlc5620: reg-write: "Setting DACC register value to 2.78V" "DACC=2.78V"
7581408-7581408 tlc5620: ldac-fall: "Falling edge on LDAC" "LDAC fall" "LDAC" "L"
7568703-7581408 tlc5620: voltage-update-all: "Updating voltages: DACA=1.37V DACB=? DACC=2.78V DACD=3.15V" "DACA=1.37V DACB=? DACC=2.78V DACD=3.15V" "A=1.37V B=? C=2.78V D=3.15V"
7588647-7588698 tlc5620: dac-select: "DAC select: DACA" "DAC sel: DACA" "DAC: DACA" "D: DACA" "DACA" "A"
7588698-7588723 tlc5620: gain: "Gain: x1" "G: x1" "x1"
7588723-7588928 tlc5620: value: "DAC value: 105" "Value: 105" "Val: 105" "V: 105" "105"
7588647-7588672 tlc5620: bit: "0"
7588672-7588698 tlc5620: bit: "0"
7588698-7588723 tlc5620: bit: "0"
7588723-7588749 tlc5620: bit: "0"
7588749-7588775 tlc5620: bit: "1"
7588775-7588800 tlc5620: bit: "1"
7588800-7588826 tlc5620: bit: "0"
7588826-7588851 tlc5620: bit: "1"
7588851-7588877 tlc5620: bit: "0"
7588877-7588903 tlc5620: bit: "0"
7588903-7588928 tlc5620: bit: "1"
7588915-7588915 tlc5620: data-latch: "Falling edge on LOAD" "LOAD fall" "F"
7588647-7588928 tlc5620: reg-write: "Setting DACA register value to 1.35V" "DACA=1.35V"
7592689-7592740 tlc5620: dac-select: "DAC select: DACD" "DAC sel: DACD" "DAC: DACD" "D: DACD" "DACD" "D"
7592740-7592765 tlc5620: gain: "Gain: x2" "G: x2" "x2"
7592765-7592970 tlc5620: value: "DAC value: 122" "Value: 122" "Val: 122" "V: 122" "122"
7592689-7592714 tlc5620: bit: "1"
7592714-7592740 tlc5620: bit: "1"
7592740-7592765 tlc5620: bit: "1"
7592765-7592791 tlc5620: bit: "0"
7592791-7592817 tlc5620: bit: "1"
7592817-7592842 tlc5620: bit: "1"
7592842-7592868 tlc5620: bit: "1"
7592868-7592893 tlc5620: bit: "1"
7592893-7592919 tlc5620: bit: "0"
7592919-7592945 tlc5620: bit: "1"
7592945-7592970 tlc5620: bit: "0"
7592958-7592958 tlc5620: data-latch: "Falling edge on LOAD" "LOAD fall" "F"
7592689-7592970 tlc5620: reg-write: "Setting DACD register value to 3.15V" "DACD=3.15V"
7596733-7596784 tlc5620: dac-select: "DAC select: DACC" "DAC sel: DACC" "DAC: DACC" "D: DACC" "DACC" "C"
7596784-7596810 tlc5620: gain: "Gain: x2" "G: x2" "x2"
7596810-7597015 tlc5620: value: "DAC value: 108" "Value: 108" "Val: 108" "V: 108" "108"
7596733-7596759 tlc5620: bit: "1"
7596759-7596784 tlc5620: bit: "0"
7596784-7596810 tlc5620: bit: "1"
7596810-7596836 tlc5620: bit: "0"
7596836-7596861 tlc5620: bit: "1"
7596861-7596887 tlc5620: bit: "1"
7596887-7596912 tlc5620: bit: "0"
7596912-7596938 tlc5620: bit: "1"
7596938-7596964 tlc5620: bit: "1"
7596964-7596989 tlc5620: bit: "0"
7596989-7597015 tlc5620: bit: "0"
7597002-7597002 tlc5620: data-latch: "Falling edge on LOAD" "LOAD fall" "F"
7596733-7597015 tlc5620: reg-write: "Setting DACC register value to 2.78V" "DACC=2.78V"
7601392-7601392 tlc5620: ldac-fall: "Falling edge on LDAC" "LDAC fall" "LDAC" "L"
7588647-7601392 tlc5620: voltage-update-all: "Updating voltages: DACA=1.35V DACB=? DACC=2.78V DACD=3.15V" "DACA=1.35V DACB=? DACC=2.78V DACD=3.15V" "A=1.35V B=? C=2.78V D=3.15V"
7608629-7608680 tlc5620: dac-select: "DAC select: DACA" "DAC sel: DACA" "DAC: DACA" "D: DACA" "DACA" "A"
7608680-7608706 tlc5620: gain: "Gain: x1" "G: x1" "x1"
7608706-7608911 tlc5620: value: "DAC value: 104" "Value: 104" "Val: 104" "V: 104" "104"
7608629-7608654 tlc5620: bit: "0"
7608654-7608680 tlc5620: bit: "0"
7608680-7608706 tlc5620: bit: "0"
7608706-7608731 tlc5620: bit: "0"
7608731-7608757 tlc5620: bit: "1"
7608757-7608782 tlc5620: bit: "1"
7608782-7608808 tlc5620: bit: "0"
7608808-7608834 tlc5620: bit: "1"
7608834-7608859 tlc5620: bit: "0"
7608859-7608885 tlc5620: bit: "0"
7608885-7608911 tlc5620: bit: "0"
7608898-7608898 tlc5620: data-latch: "Falling edge on LOAD" "LOAD fall" "F"
7608629-7608911 tlc5620: reg-write: "Setting DACA register value to 1.34V" "DACA=1.34V"
7612650-7612701 tlc5620: dac-select: "DAC select: DACD" "DAC sel: DACD" "DAC: DACD" "D: DACD" "DACD" "D"
7612701-7612727 tlc5620: gain: "Gain: x2" "G: x2" "x2"
7612727-7612932 tlc5620: value: "DAC value: 122" "Value: 122" "Val: 122" "V: 122" "122"
7612650-7612676 tlc5620: bit: "1"
7612676-7612701 tlc5620: bit: "1"
7612701-7612727 tlc5620: bit: "1"
7612727-7612753 tlc5620: bit: "0"
7612753-7612778 tlc5620: bit: "1"
7612778-7612804 tlc5620: bit: "1"
7612804-7612830 tlc5620: bit: "1"
7612830-7612855 tlc5620: bit: "1"
7612855-7612881 tlc5620: bit: "0"
7612881-7612906 tlc5620: bit: "1"
7612906-7612932 tlc5620: bit: "0"
7612919-7612919 tlc5620: data-latch: "Falling edge on LOAD" "LOAD fall" "F"
7612650-7612932 tlc5620: reg-write: "Setting DACD register value to 3.15V" "DACD=3.15V"
7616746-7616797 tlc5620: dac-select: "DAC select: DACC" "DAC sel: DACC" "DAC: DACC" "D: DACC" "DACC" "C"
7616797-7616823 tlc5620: gain: "Gain: x2" "G: x2" "x2"
7616823-7617028 tlc5620: value: "DAC value: 108" "Value: 108" "Val: 108" "V: 108" "108"
7616746-7616772 tlc5620: bit: "1"
7616772-7616797 tlc5620: bit: "0"
7616797-7616823 tlc5620: bit: "1"
7616823-7616848 tlc5620: bit: "0"
7616848-7616874 tlc5620: bit: "1"
7616874-7616900 tlc5620: bit: "1"
7616900-7616925 tlc5620: bit: "0"
7616925-7616951 tlc5620: bit: "1"
7616951-7616977 tlc5620: bit: "1"
7616977-7617002 tlc5620: bit: "0"
7617002-7617028 tlc5620: bit: "0"
7617015-7617015 tlc5620: data-latch: "Falling edge on LOAD" "LOAD fall" "F"
7616746-7617028 tlc5620: reg-write: "Setting DACC register value to 2.78V" "DACC=2.78V"
7621626-7621626 tlc5620: ldac-fall: "Falling edge on LDAC" "LDAC fall" "LDAC" "L"
7608629-7621626 tlc5620: voltage-update-all: "Updating voltages: DACA=1.34V DACB=? DACC=2.78V DACD=3.15V" "DACA=1.34V DACB=? DACC=2.78V DACD=3.15V" "A=1.34V B=? C=2.78V D=3.15V"
7628565-7628616 tlc5620: dac-select: "DAC select: DACA" "DAC sel: DACA" "DAC: DACA" "D: DACA" "DACA" "A"
7628616-7628642 tlc5620: gain: "Gain: x1" "G: x1" "x1"
7628642-7628847 tlc5620: value: "DAC value: 103" "Value: 103" "Val: 103" "V: 103" "103"
7628565-7628590 tlc5620: bit: "0"
7628590-7628616 tlc5620: bit: "0"
7628616-7628642 tlc5620: bit: "0"
7628642-7628667 tlc5620: bit: "0"
7628667-7628693 tlc5620: bit: "1"
7628693-7628718 tlc5620: bit: "1"
7628718-7628744 tlc5620: bit: "0"
7628744-7628770 tlc5620: bit: "0"
7628770-7628795 tlc5620: bit: "1"
7628795-7628821 tlc5620: bit: "1"
7628821-7628847 tlc5620: bit: "1"
7628834-7628834 tlc5620: data-latch: "Falling edge on LOAD" "LOAD fall" "F"
7628565-7628847 tlc5620: reg-write: "Setting DACA register value to 1.33V" "DACA=1.33V"
7632717-7632768 tlc5620: dac-select: "DAC select: DACD" "DAC sel: DACD" "DAC: DACD" "D: DACD" "DACD" "D"
7632768-7632794 tlc5620: gain: "Gain: x2" "G: x2" "x2"
7632794-7632999 tlc5620: value: "DAC value: 122" "Value: 122" "Val: 122" "V: 122" "122"
7632717-7632743 tlc5620: bit: "1"
7632743-7632768 tlc5620: bit: "1"
7632768-7632794 tlc5620: bit: "1"
7632794-7632819 tlc5620: bit: "0"
7632819-7632845 tlc5620: bit: "1"
7632845-7632871 tlc5620: bit: "1"
7632871-7632896 tlc5620: bit: "1"
7632896-7632922 tlc5620: bit: "1"
7632922-7632947 tlc5620: bit: "0"
7632947-7632973 tlc5620: bit: "1"
7632973-7632999 tlc5620: bit: "0"
7632986-7632986 tlc5620: data-latch: "Falling edge on LOAD" "LOAD fall" "F"
7632717-7632999 tlc5620: reg-write: "Setting DACD register value to 3.15V" "DACD=3.15V"
7636654-7636705 tlc5620: dac-select: "DAC select: DACC" "DAC sel: DACC" "DAC: DACC" "D: DACC" "DACC" "C"
7636705-7636731 tlc5620: gain: "Gain: x2" "G: x2" "x2"
7636731-7636936 tlc5620: value: "DAC value: 108" "Value: 108" "Val: 108" "V: 108" "108"
7636654-7636680 tlc5620: bit: "1"
7636680-7636705 tlc5620: bit: "0"
7636705-7636731 tlc5620: bit: "1"
7636731-7636756 tlc5620: bit: "0"
7636756-7636782 tlc5620: bit: "1"
7636782-7636808 tlc5620: bit: "1"
7636808-7636833 tlc5620: bit: "0"
7636833-7636859 tlc5620: bit: "1"
7636859-7636884 tlc5620: bit: "1"
7636884-7636910 tlc5620: bit: "0"
7636910-7636936 tlc5620: bit: "0"
7636923-7636923 tlc5620: data-latch: "Falling edge on LOAD" "LOAD fall" "F"
7636654-7636936 tlc5620: reg-write: "Setting DACC register value to 2.78V" "DACC=2.78V"
7641569-7641569 tlc5620: ldac-fall: "Falling edge on LDAC" "LDAC fall" "LDAC" "L"
7628565-7641569 tlc5620: voltage-update-all: "Updating voltages: DACA=1.33V DACB=? DACC=2.78V DACD=3.15V" "DACA=1.33V DACB=? DACC=2.78V DACD=3.15V" "A=1.33V B=? C=2.78V D=3.15V"
7648542-7648593 tlc5620: dac-select: "DAC select: DACA" "DAC sel: DACA" "DAC: DACA" "D: DACA" "DACA" "A"
7648593-7648619 tlc5620: gain: "Gain: x1" "G: x1" "x1"
7648619-7648824 tlc5620: value: "DAC value: 102" "Value: 102" "Val: 102" "V: 102" "102"
7648542-7648567 tlc5620: bit: "0"
7648567-7648593 tlc5620: bit: "0"
7648593-7648619 tlc5620: bit: "0"
7648619-7648644 tlc5620: bit: "0"
7648644-7648670 tlc5620: bit: "1"
7648670-7648695 tlc5620: bit: "1"
7648695-7648721 tlc5620: bit: "0"
7648721-7648747 tlc5620: bit: "0"
7648747-7648772 tlc5620: bit: "1"
7648772-7648798 tlc5620: bit: "1"
7648798-7648824 tlc5620: bit: "0"
7648811-7648811 tlc5620: data-latch: "Falling edge on LOAD" "LOAD fall" "F"
7648542-7648824 tlc5620: reg-write: "Setting DACA register value to 1.31V" "DACA=1.31V"
7652586-7652638 tlc5620: dac-select: "DAC select: DACD" "DAC sel: DACD" "DAC: DACD" "D: DACD" "DACD" "D"
7652638-7652663 tlc5620: gain: "Gain: x2" "G: x2" "x2"
7652663-7652867 tlc5620: value: "DAC value: 122" "Value: 122" "Val: 122" "V: 122" "122"
7652586-7652612 tlc5620: bit: "1"
7652612-7652638 tlc5620: bit: "1"
7652638-7652663 tlc5620: bit: "1"
7652663-7652689 tlc5620: bit: "0"
7652689-7652714 tlc5620: bit: "1"
7652714-7652740 tlc5620: bit: "1"
7652740-7652766 tlc5620: bit: "1"
7652766-7652791 tlc5620: bit: "1"
7652791-7652817 tlc5620: bit: "0"
7652817-7652842 tlc5620: bit: "1"
7652842-7652867 tlc5620: bit: "0"
7652855-7652855 tlc5620: data-latch: "Falling edge on LOAD" "LOAD fall" "F"
7652586-7652867 tlc5620: reg-write: "Setting DACD register value to 3.15V" "DACD=3.15V"
7656626-7656677 tlc5620: dac-select: "DAC select: DACC" "DAC sel: DACC" "DAC: DACC" "D: DACC" "DACC" "C"
7656677-7656703 tlc5620: gain: "Gain: x2" "G: x2" "x2"
7656703-7656908 tlc5620: value: "DAC value: 108" "Value: 108" "Val: 108" "V: 108" "108"
7656626-7656651 tlc5620: bit: "1"
7656651-7656677 tlc5620: bit: "0"
7656677-7656703 tlc5620: bit: "1"
7656703-7656728 tlc5620: bit: "0"
7656728-7656754 tlc5620: bit: "1"
7656754-7656779 tlc5620: bit: "1"
7656779-7656805 tlc5620: bit: "0"
7656805-7656831 tlc5620: bit: "1"
7656831-7656856 tlc5620: bit: "1"
7656856-7656882 tlc5620: bit: "0"
7656882-7656908 tlc5620: bit: "0"
7656895-7656895 tlc5620: data-latch: "Falling edge on LOAD" "LOAD fall" "F"
7656626-7656908 tlc5620: reg-write: "Setting DACC register value to 2.78V" "DACC=2.78V"
7661546-7661546 tlc5620: ldac-fall: "Falling edge on LDAC" "LDAC fall" "LDAC" "L"
7648542-7661546 tlc5620: voltage-update-all: "Updating voltages: DACA=1.31V DACB=? DACC=2.78V DACD=3.15V" "DACA=1.31V DACB=? DACC=2.78V DACD=3.15V" "A=1.31V B=? C=2.78V D=3.15V"
7780794-7780845 tlc5620: dac-select: "DAC select: DACA" "DAC sel: DACA" "DAC: DACA" "D: DACA" "DACA" "A"
7780845-7780871 tlc5620: gain: "Gain: x1" "G: x1" "x1"
7780871-7781076 tlc5620: value: "DAC value: 100" "Value: 100" "Val: 100" "V: 100" "100"
7780794-7780819 tlc5620: bit: "0"
7780819-7780845 tlc5620: bit: "0"
7780845-7780871 tlc5620: bit: "0"
7780871-7780896 tlc5620: bit: "0"
7780896-7780922 tlc5620: bit: "1"
7780922-7780948 tlc5620: bit: "1"
7780948-7780973 tlc5620: bit: "0"
7780973-7780999 tlc5620: bit: "0"
7780999-7781024 tlc5620: bit: "1"
7781024-7781050 tlc5620: bit: "0"
7781050-7781076 tlc5620: bit: "0"
7781063-7781063 tlc5620: data-latch: "Falling edge on LOAD" "LOAD fall" "F"
7780794-7781076 tlc5620: reg-write: "Setting DACA register value to 1.29V" "DACA=1.29V"
7784780-7784831 tlc5620: dac-select: "DAC select: DACD" "DAC sel: DACD" "DAC: DACD" "D: DACD" "DACD" "D"
7784831-7784856 tlc5620: gain: "Gain: x2" "G: x2" "x2"
7784856-7785061 tlc5620: value: "DAC value: 122" "Value: 122" "Val: 122" "V: 122" "122"
7784780-7784805 tlc5620: bit: "1"
7784805-7784831 tlc5620: bit: "1"
7784831-7784856 tlc5620: bit: "1"
7784856-7784882 tlc5620: bit: "0"
7784882-7784908 tlc5620: bit: "1"
7784908-7784933 tlc5620: bit: "1"
7784933-7784959 tlc5620: bit: "1"
7784959-7784984 tlc5620: bit: "1"
7784984-7785010 tlc5620: bit: "0"
7785010-7785036 tlc5620: bit: "1"
7785036-7785061 tlc5620: bit: "0"
7785048-7785048 tlc5620: data-latch: "Falling edge on LOAD" "LOAD fall" "F"
7784780-7785061 tlc5620: reg-write: "Setting DACD register value to 3.15V" "DACD=3.15V"
7788857-7788909 tlc5620: dac-select: "DAC select: DACC" "DAC sel: DACC" "DAC: DACC" "D: DACC" "DACC" "C"
7788909-7788934 tlc5620: gain: "Gain: x2" "G: x2" "x2"
7788934-7789139 tlc5620: value: "DAC value: 108" "Value: 108" "Val: 108" "V: 108" "108"
7788857-7788883 tlc5620: bit: "1"
7788883-7788909 tlc5620: bit: "0"
7788909-7788934 tlc5620: bit: "1"
7788934-7788960 tlc5620: bit: "0"
7788960-7788985 tlc5620: bit: "1"
7788985-7789011 tlc5620: bit: "1"
7789011-7789037 tlc5620: bit: "0"
7789037-7789062 tlc5620: bit: "1"
7789062-7789088 tlc5620: bit: "1"
7789088-7789114 tlc5620: bit: "0"
7789114-7789139 tlc5620: bit: "0"
7789126-7789126 tlc5620: data-latch: "Falling edge on LOAD" "LOAD fall" "F"
7788857-7789139 tlc5620: reg-write: "Setting DACC register value to 2.78V" "DACC=2.78V"
7793473-7793473 tlc5620: ldac-fall: "Falling edge on LDAC" "LDAC fall" "LDAC" "L"
7780794-7793473 tlc5620: voltage-update-all: "Updating voltages: DACA=1.29V DACB=? DACC=2.78V DACD=3.15V" "DACA=1.29V DACB=? DACC=2.78V DACD=3.15V" "A=1.29V B=? C=2.78V D=3.15V"
7800748-7800799 tlc5620: dac-select: "DAC select: DACA" "DAC sel: DACA" "DAC: DACA" "D: DACA" "DACA" "A"
7800799-7800825 tlc5620: gain: "Gain: x1" "G: x1" "x1"
7800825-7801030 tlc5620: value: "DAC value: 99" "Value: 99" "Val: 99" "V: 99" "99"
7800748-7800773 tlc5620: bit: "0"
7800773-7800799 tlc5620: bit: "0"
7800799-7800825 tlc5620: bit: "0"
7800825-7800850 tlc5620: bit: "0"
7800850-7800876 tlc5620: bit: "1"
7800876-7800902 tlc5620: bit: "1"
7800902-7800927 tlc5620: bit: "0"
7800927-7800953 tlc5620: bit: "0"
7800953-7800978 tlc5620: bit: "0"
7800978-7801004 tlc5620: bit: "1"
7801004-7801030 tlc5620: bit: "1"
7801017-7801017 tlc5620: data-latch: "Falling edge on LOAD" "LOAD fall" "F"
7800748-7801030 tlc5620: reg-write: "Setting DACA register value to 1.28V" "DACA=1.28V"
7804751-7804803 tlc5620: dac-select: "DAC select: DACD" "DAC sel: DACD" "DAC: DACD" "D: DACD" "DACD" "D"
7804803-7804828 tlc5620: gain: "Gain: x2" "G: x2" "x2"
7804828-7805033 tlc5620: value: "DAC value: 122" "Value: 122" "Val: 122" "V: 122" "122"
7804751-7804777 tlc5620: bit: "1"
7804777-7804803 tlc5620: bit: "1"
7804803-7804828 tlc5620: bit: "1"
7804828-7804854 tlc5620: bit: "0"
7804854-7804879 tlc5620: bit: "1"
7804879-7804905 tlc5620: bit: "1"
7804905-7804931 tlc5620: bit: "1"
7804931-7804956 tlc5620: bit: "1"
7804956-7804982 tlc5620: bit: "0"
7804982-7805008 tlc5620: bit: "1"
7805008-7805033 tlc5620: bit: "0"
7805020-7805020 tlc5620: data-latch: "Falling edge on LOAD" "LOAD fall" "F"
7804751-7805033 tlc5620: reg-write: "Setting DACD register value to 3.15V" "DACD=3.15V"
7808860-7808911 tlc5620: dac-select: "DAC select: DACC" "DAC sel: DACC" "DAC: DACC" "D: DACC" "DACC" "C"
7808911-7808937 tlc5620: gain: "Gain: x2" "G: x2" "x2"
7808937-7809142 tlc5620: value: "DAC value: 108" "Value: 108" "Val: 108" "V: 108" "108"
7808860-7808886 tlc5620: bit: "1"
7808886-7808911 tlc5620: bit: "0"
7808911-7808937 tlc5620: bit: "1"
7808937-7808962 tlc5620: bit: "0"
7808962-7808988 tlc5620: bit: "1"
7808988-7809014 tlc5620: bit: "1"
7809014-7809039 tlc5620: bit: "0"
7809039-7809065 tlc5620: bit: "1"
7809065-7809091 tlc5620: bit: "1"
7809091-7809116 tlc5620: bit: "0"
7809116-7809142 tlc5620: bit: "0"
7809129-7809129 tlc5620: data-latch: "Falling edge on LOAD" "LOAD fall" "F"
7808860-7809142 tlc5620: reg-write: "Setting DACC register value to 2.78V" "DACC=2.78V"
7813796-7813796 tlc5620: ldac-fall: "Falling edge on LDAC" "LDAC fall" "LDAC" "L"
7800748-7813796 tlc5620: voltage-update-all: "Updating voltages: DACA=1.28V DACB=? DACC=2.78V DACD=3.15V" "DACA=1.28V DACB=? DACC=2.78V DACD=3.15V" "A=1.28V B=? C=2.78V D=3.15V"
7820679-7820730 tlc5620: dac-select: "DAC select: DACA" "DAC sel: DACA" "DAC: DACA" "D: DACA" "DACA" "A"
7820730-7820756 tlc5620: gain: "Gain: x1" "G: x1" "x1"
7820756-7820961 tlc5620: value: "DAC value: 98" "Value: 98" "Val: 98" "V: 98" "98"
7820679-7820704 tlc5620: bit: "0"
7820704-7820730 tlc5620: bit: "0"
7820730-7820756 tlc5620: bit: "0"
7820756-7820781 tlc5620: bit: "0"
7820781-7820807 tlc5620: bit: "1"
7820807-7820832 tlc5620: bit: "1"
7820832-7820858 tlc5620: bit: "0"
7820858-7820884 tlc5620: bit: "0"
7820884-7820909 tlc5620: bit: "0"
7820909-7820935 tlc5620: bit: "1"
7820935-7820961 tlc5620: bit: "0"
7820948-7820948 tlc5620: data-latch: "Falling edge on LOAD" "LOAD fall" "F"
7820679-7820961 tlc5620: reg-write: "Setting DACA register value to 1.26V" "DACA=1.26V"
7825082-7825133 tlc5620: dac-select: "DAC select: DACD" "DAC sel: DACD" "DAC: DACD" "D: DACD" "DACD" "D"
7825133-7825159 tlc5620: gain: "Gain: x2" "G: x2" "x2"
7825159-7825364 tlc5620: value: "DAC value: 122" "Value: 122" "Val: 122" "V: 122" "122"
7825082-7825108 tlc5620: bit: "1"
7825108-7825133 tlc5620: bit: "1"
7825133-7825159 tlc5620: bit: "1"
7825159-7825184 tlc5620: bit: "0"
7825184-7825210 tlc5620: bit: "1"
7825210-7825236 tlc5620: bit: "1"
7825236-7825261 tlc5620: bit: "1"
7825261-7825287 tlc5620: bit: "1"
7825287-7825312 tlc5620: bit: "0"
7825312-7825338 tlc5620: bit: "1"
7825338-7825364 tlc5620: bit: "0"
7825351-7825351 tlc5620: data-latch: "Falling edge on LOAD" "LOAD fall" "F"
7825082-7825364 tlc5620: reg-write: "Setting DACD register value to 3.15V" "DACD=3.15V"
7828760-7828811 tlc5620: dac-select: "DAC select: DACC" "DAC sel: DACC" "DAC: DACC" "D: DACC" "DACC" "C"
7828811-7828837 tlc5620: gain: "Gain: x2" "G: x2" "x2"
7828837-7829042 tlc5620: value: "DAC value: 108" "Value: 108" "Val: 108" "V: 108" "108"
7828760-7828786 tlc5620: bit: "1"
7828786-7828811 tlc5620: bit: "0"
7828811-7828837 tlc5620: bit: "1"
7828837-7828863 tlc5620: bit: "0"
7828863-7828888 tlc5620: bit: "1"
7828888-7828914 tlc5620: bit: "1"
7828914-7828940 tlc5620: bit: "0"
7828940-7828965 tlc5620: bit: "1"
7828965-7828991 tlc5620: bit: "1"
7828991-7829016 tlc5620: bit: "0"
7829016-7829042 tlc5620: bit: "0"
7829029-7829029 tlc5620: data-latch: "Falling edge on LOAD" "LOAD fall" "F"
7828760-7829042 tlc5620: reg-write: "Setting DACC register value to 2.78V" "DACC=2.78V"
7833704-7833704 tlc5620: ldac-fall: "Falling edge on LDAC" "LDAC fall" "LDAC" "L"
7820679-7833704 tlc5620: voltage-update-all: "Updating voltages: DACA=1.26V DACB=? DACC=2.78V DACD=3.15V" "DACA=1.26V DACB=? DACC=2.78V DACD=3.15V" "A=1.26V B=? C=2.78V D=3.15V"
7840646-7840697 tlc5620: dac-select: "DAC select: DACA" "DAC sel: DACA" "DAC: DACA" "D: DACA" "DACA" "A"
7840697-7840722 tlc5620: gain: "Gain: x1" "G: x1" "x1"
7840722-7840927 tlc5620: value: "DAC value: 97" "Value: 97" "Val: 97" "V: 97" "97"
7840646-7840671 tlc5620: bit: "0"
7840671-7840697 tlc5620: bit: "0"
7840697-7840722 tlc5620: bit: "0"
7840722-7840748 tlc5620: bit: "0"
7840748-7840774 tlc5620: bit: "1"
7840774-7840799 tlc5620: bit: "1"
7840799-7840825 tlc5620: bit: "0"
7840825-7840850 tlc5620: bit: "0"
7840850-7840876 tlc5620: bit: "0"
7840876-7840902 tlc5620: bit: "0"
7840902-7840927 tlc5620: bit: "1"
7840914-7840914 tlc5620: data-latch: "Falling edge on LOAD" "LOAD fall" "F"
7840646-7840927 tlc5620: reg-write: "Setting DACA register value to 1.25V" "DACA=1.25V"
7844682-7844734 tlc5620: dac-select: "DAC select: DACD" "DAC sel: DACD" "DAC: DACD" "D: DACD" "DACD" "D"
7844734-7844759 tlc5620: gain: "Gain: x2" "G: x2" "x2"
7844759-7844964 tlc5620: value: "DAC value: 122" "Value: 122" "Val: 122" "V: 122" "122"
7844682-7844708 tlc5620: bit: "1"
7844708-7844734 tlc5620: bit: "1"
7844734-7844759 tlc5620: bit: "1"
7844759-7844785 tlc5620: bit: "0"
7844785-7844810 tlc5620: bit: "1"
7844810-7844836 tlc5620: bit: "1"
7844836-7844862 tlc5620: bit: "1"
7844862-7844887 tlc5620: bit: "1"
7844887-7844913 tlc5620: bit: "0"
7844913-7844939 tlc5620: bit: "1"
7844939-7844964 tlc5620: bit: "0"
7844951-7844951 tlc5620: data-latch: "Falling edge on LOAD" "LOAD fall" "F"
7844682-7844964 tlc5620: reg-write: "Setting DACD register value to 3.15V" "DACD=3.15V"
7848778-7848829 tlc5620: dac-select: "DAC select: DACC" "DAC sel: DACC" "DAC: DACC" "D: DACC" "DACC" "C"
7848829-7848855 tlc5620: gain: "Gain: x2" "G: x2" "x2"
7848855-7849060 tlc5620: value: "DAC value: 108" "Value: 108" "Val: 108" "V: 108" "108"
7848778-7848804 tlc5620: bit: "1"
7848804-7848829 tlc5620: bit: "0"
7848829-7848855 tlc5620: bit: "1"
7848855-7848881 tlc5620: bit: "0"
7848881-7848906 tlc5620: bit: "1"
7848906-7848932 tlc5620: bit: "1"
7848932-7848958 tlc5620: bit: "0"
7848958-7848983 tlc5620: bit: "1"
7848983-7849009 tlc5620: bit: "1"
7849009-7849034 tlc5620: bit: "0"
7849034-7849060 tlc5620: bit: "0"
7849047-7849047 tlc5620: data-latch: "Falling edge on LOAD" "LOAD fall" "F"
7848778-7849060 tlc5620: reg-write: "Setting DACC register value to 2.78V" "DACC=2.78V"
7853678-7853678 tlc5620: ldac-fall: "Falling edge on LDAC" "LDAC fall" "LDAC" "L"
7840646-7853678 tlc5620: voltage-update-all: "Updating voltages: DACA=1.25V DACB=? DACC=2.78V DACD=3.15V" "DACA=1.25V DACB=? DACC=2.78V DACD=3.15V" "A=1.25V B=? C=2.78V D=3.15V"
7860889-7860940 tlc5620: dac-select: "DAC select: DACA" "DAC sel: DACA" "DAC: DACA" "D: DACA" "DACA" "A"
7860940-7860966 tlc5620: gain: "Gain: x1" "G: x1" "x1"
7860966-7861171 tlc5620: value: "DAC value: 95" "Value: 95" "Val: 95" "V: 95" "95"
7860889-7860915 tlc5620: bit: "0"
7860915-7860940 tlc5620: bit: "0"
7860940-7860966 tlc5620: bit: "0"
7860966-7860991 tlc5620: bit: "0"
7860991-7861017 tlc5620: bit: "1"
7861017-7861043 tlc5620: bit: "0"
7861043-7861068 tlc5620: bit: "1"
7861068-7861094 tlc5620: bit: "1"
7861094-7861119 tlc5620: bit: "1"
7861119-7861145 tlc5620: bit: "1"
7861145-7861171 tlc5620: bit: "1"
7861158-7861158 tlc5620: data-latch: "Falling edge on LOAD" "LOAD fall" "F"
7860889-7861171 tlc5620: reg-write: "Setting DACA register value to 1.22V" "DACA=1.22V"
7864685-7864736 tlc5620: dac-select: "DAC select: DACD" "DAC sel: DACD" "DAC: DACD" "D: DACD" "DACD" "D"
7864736-7864762 tlc5620: gain: "Gain: x2" "G: x2" "x2"
7864762-7864967 tlc5620: value: "DAC value: 122" "Value: 122" "Val: 122" "V: 122" "122"
7864685-7864711 tlc5620: bit: "1"
7864711-7864736 tlc5620: bit: "1"
7864736-7864762 tlc5620: bit: "1"
7864762-7864788 tlc5620: bit: "0"
7864788-7864813 tlc5620: bit: "1"
7864813-7864839 tlc5620: bit: "1"
7864839-7864864 tlc5620: bit: "1"
7864864-7864890 tlc5620: bit: "1"
7864890-7864916 tlc5620: bit: "0"
7864916-7864941 tlc5620: bit: "1"
7864941-7864967 tlc5620: bit: "0"
7864954-7864954 tlc5620: data-latch: "Falling edge on LOAD" "LOAD fall" "F"
7864685-7864967 tlc5620: reg-write: "Setting DACD register value to 3.15V" "DACD=3.15V"
7868709-7868760 tlc5620: dac-select: "DAC select: DACC" "DAC sel: DACC" "DAC: DACC" "D: DACC" "DACC" "C"
7868760-7868786 tlc5620: gain: "Gain: x2" "G: x2" "x2"
7868786-7868991 tlc5620: value: "DAC value: 108" "Value: 108" "Val: 108" "V: 108" "108"
7868709-7868735 tlc5620: bit: "1"
7868735-7868760 tlc5620: bit: "0"
7868760-7868786 tlc5620: bit: "1"
7868786-7868812 tlc5620: bit: "0"
7868812-7868837 tlc5620: bit: "1"
7868837-7868863 tlc5620: bit: "1"
7868863-7868888 tlc5620: bit: "0"
7868888-7868914 tlc5620: bit: "1"
7868914-7868940 tlc5620: bit: "1"
7868940-7868965 tlc5620: bit: "0"
7868965-7868991 tlc5620: bit: "0"
7868978-7868978 tlc5620: data-latch: "Falling edge on LOAD" "LOAD fall" "F"
7868709-7868991 tlc5620: reg-write: "Setting DACC register value to 2.78V" "DACC=2.78V"
7873658-7873658 tlc5620: ldac-fall: "Falling edge on LDAC" "LDAC fall" "LDAC" "L"
7860889-7873658 tlc5620: voltage-update-all: "Updating voltages: DACA=1.22V DACB=? DACC=2.78V DACD=3.15V" "DACA=1.22V DACB=? DACC=2.78V DACD=3.15V" "A=1.22V B=? C=2.78V D=3.15V"
7880858-7880910 tlc5620: dac-select: "DAC select: DACA" "DAC sel: DACA" "DAC: DACA" "D: DACA" "DACA" "A"
7880910-7880935 tlc5620: gain: "Gain: x1" "G: x1" "x1"
7880935-7881139 tlc5620: value: "DAC value: 94" "Value: 94" "Val: 94" "V: 94" "94"
7880858-7880884 tlc5620: bit: "0"
7880884-7880910 tlc5620: bit: "0"
7880910-7880935 tlc5620: bit: "0"
7880935-7880961 tlc5620: bit: "0"
7880961-7880986 tlc5620: bit: "1"
7880986-7881012 tlc5620: bit: "0"
7881012-7881038 tlc5620: bit: "1"
7881038-7881063 tlc5620: bit: "1"
7881063-7881089 tlc5620: bit: "1"
7881089-7881114 tlc5620: bit: "1"
7881114-7881139 tlc5620: bit: "0"
7881127-7881127 tlc5620: data-latch: "Falling edge on LOAD" "LOAD fall" "F"
7880858-7881139 tlc5620: reg-write: "Setting DACA register value to 1.21V" "DACA=1.21V"
7884895-7884946 tlc5620: dac-select: "DAC select: DACD" "DAC sel: DACD" "DAC: DACD" "D: DACD" "DACD" "D"
7884946-7884972 tlc5620: gain: "Gain: x2" "G: x2" "x2"
7884972-7885177 tlc5620: value: "DAC value: 122" "Value: 122" "Val: 122" "V: 122" "122"
7884895-7884921 tlc5620: bit: "1"
7884921-7884946 tlc5620: bit: "1"
7884946-7884972 tlc5620: bit: "1"
7884972-7884998 tlc5620: bit: "0"
7884998-7885023 tlc5620: bit: "1"
7885023-7885049 tlc5620: bit: "1"
7885049-7885074 tlc5620: bit: "1"
7885074-7885100 tlc5620: bit: "1"
7885100-7885126 tlc5620: bit: "0"
7885126-7885151 tlc5620: bit: "1"
7885151-7885177 tlc5620: bit: "0"
7885164-7885164 tlc5620: data-latch: "Falling edge on LOAD" "LOAD fall" "F"
7884895-7885177 tlc5620: reg-write: "Setting DACD register value to 3.15V" "DACD=3.15V"
7890692-7890743 tlc5620: dac-select: "DAC select: DACC" "DAC sel: DACC" "DAC: DACC" "D: DACC" "DACC" "C"
7890743-7890769 tlc5620: gain: "Gain: x2" "G: x2" "x2"
7890769-7890974 tlc5620: value: "DAC value: 108" "Value: 108" "Val: 108" "V: 108" "108"
7890692-7890717 tlc5620: bit: "1"
7890717-7890743 tlc5620: bit: "0"
7890743-7890769 tlc5620: bit: "1"
7890769-7890794 tlc5620: bit: "0"
7890794-7890820 tlc5620: bit: "1"
7890820-7890846 tlc5620: bit: "1"
7890846-7890871 tlc5620: bit: "0"
7890871-7890897 tlc5620: bit: "1"
7890897-7890922 tlc5620: bit: "1"
7890922-7890948 tlc5620: bit: "0"
7890948-7890974 tlc5620: bit: "0"
7890961-7890961 tlc5620: data-latch: "Falling edge on LOAD" "LOAD fall" "F"
7890692-7890974 tlc5620: reg-write: "Setting DACC register value to 2.78V" "DACC=2.78V"
7895674-7895674 tlc5620: ldac-fall: "Falling edge on LDAC" "LDAC fall" "LDAC" "L"
7880858-7895674 tlc5620: voltage-update-all: "Updating voltages: DACA=1.21V DACB=? DACC=2.78V DACD=3.15V" "DACA=1.21V DACB=? DACC=2.78V DACD=3.15V" "A=1.21V B=? C=2.78V D=3.15V"
7903059-7903110 tlc5620: dac-select: "DAC select: DACA" "DAC sel: DACA" "DAC: DACA" "D: DACA" "DACA" "A"
7903110-7903136 tlc5620: gain: "Gain: x1" "G: x1" "x1"
7903136-7903341 tlc5620: value: "DAC value: 93" "Value: 93" "Val: 93" "V: 93" "93"
7903059-7903084 tlc5620: bit: "0"
7903084-7903110 tlc5620: bit: "0"
7903110-7903136 tlc5620: bit: "0"
7903136-7903161 tlc5620: bit: "0"
7903161-7903187 tlc5620: bit: "1"
7903187-7903212 tlc5620: bit: "0"
7903212-7903238 tlc5620: bit: "1"
7903238-7903264 tlc5620: bit: "1"
7903264-7903289 tlc5620: bit: "1"
7903289-7903315 tlc5620: bit: "0"
7903315-7903341 tlc5620: bit: "1"
7903328-7903328 tlc5620: data-latch: "Falling edge on LOAD" "LOAD fall" "F"
7903059-7903341 tlc5620: reg-write: "Setting DACA register value to 1.20V" "DACA=1.20V"
7906988-7907039 tlc5620: dac-select: "DAC select: DACD" "DAC sel: DACD" "DAC: DACD" "D: DACD" "DACD" "D"
7907039-7907065 tlc5620: gain: "Gain: x2" "G: x2" "x2"
7907065-7907270 tlc5620: value: "DAC value: 122" "Value: 122" "Val: 122" "V: 122" "122"
7906988-7907014 tlc5620: bit: "1"
7907014-7907039 tlc5620: bit: "1"
7907039-7907065 tlc5620: bit: "1"
7907065-7907090 tlc5620: bit: "0"
7907090-7907116 tlc5620: bit: "1"
7907116-7907142 tlc5620: bit: "1"
7907142-7907167 tlc5620: bit: "1"
7907167-7907193 tlc5620: bit: "1"
7907193-7907219 tlc5620: bit: "0"
7907219-7907244 tlc5620: bit: "1"
7907244-7907270 tlc5620: bit: "0"
7907257-7907257 tlc5620: data-latch: "Falling edge on LOAD" "LOAD fall" "F"
7906988-7907270 tlc5620: reg-write: "Setting DACD register value to 3.15V" "DACD=3.15V"
7910910-7910961 tlc5620: dac-select: "DAC select: DACC" "DAC sel: DACC" "DAC: DACC" "D: DACC" "DACC" "C"
7910961-7910986 tlc5620: gain: "Gain: x2" "G: x2" "x2"
7910986-7911191 tlc5620: value: "DAC value: 108" "Value: 108" "Val: 108" "V: 108" "108"
7910910-7910935 tlc5620: bit: "1"
7910935-7910961 tlc5620: bit: "0"
7910961-7910986 tlc5620: bit: "1"
7910986-7911012 tlc5620: bit: "0"
7911012-7911038 tlc5620: bit: "1"
7911038-7911063 tlc5620: bit: "1"
7911063-7911089 tlc5620: bit: "0"
7911089-7911115 tlc5620: bit: "1"
7911115-7911140 tlc5620: bit: "1"
7911140-7911166 tlc5620: bit: "0"
7911166-7911191 tlc5620: bit: "0"
7911179-7911179 tlc5620: data-latch: "Falling edge on LOAD" "LOAD fall" "F"
7910910-7911191 tlc5620: reg-write: "Setting DACC register value to 2.78V" "DACC=2.78V"
7915569-7915569 tlc5620: ldac-fall: "Falling edge on LDAC" "LDAC fall" "LDAC" "L"
7903059-7915569 tlc5620: voltage-update-all: "Updating voltages: DACA=1.20V DACB=? DACC=2.78V DACD=3.15V" "DACA=1.20V DACB=? DACC=2.78V DACD=3.15V" "A=1.20V B=? C=2.78V D=3.15V"
7922833-7922885 tlc5620: dac-select: "DAC select: DACA" "DAC sel: DACA" "DAC: DACA" "D: DACA" "DACA" "A"
7922885-7922910 tlc5620: gain: "Gain: x1" "G: x1" "x1"
7922910-7923115 tlc5620: value: "DAC value: 93" "Value: 93" "Val: 93" "V: 93" "93"
7922833-7922859 tlc5620: bit: "0"
7922859-7922885 tlc5620: bit: "0"
7922885-7922910 tlc5620: bit: "0"
7922910-7922936 tlc5620: bit: "0"
7922936-7922961 tlc5620: bit: "1"
7922961-7922987 tlc5620: bit: "0"
7922987-7923013 tlc5620: bit: "1"
7923013-7923038 tlc5620: bit: "1"
7923038-7923064 tlc5620: bit: "1"
7923064-7923090 tlc5620: bit: "0"
7923090-7923115 tlc5620: bit: "1"
7923102-7923102 tlc5620: data-latch: "Falling edge on LOAD" "LOAD fall" "F"
7922833-7923115 tlc5620: reg-write: "Setting DACA register value to 1.20V" "DACA=1.20V"
7926860-7926911 tlc5620: dac-select: "DAC select: DACD" "DAC sel: DACD" "DAC: DACD" "D: DACD" "DACD" "D"
7926911-7926937 tlc5620: gain: "Gain: x2" "G: x2" "x2"
7926937-7927142 tlc5620: value: "DAC value: 122" "Value: 122" "Val: 122" "V: 122" "122"
7926860-7926886 tlc5620: bit: "1"
7926886-7926911 tlc5620: bit: "1"
7926911-7926937 tlc5620: bit: "1"
7926937-7926962 tlc5620: bit: "0"
7926962-7926988 tlc5620: bit: "1"
7926988-7927014 tlc5620: bit: "1"
7927014-7927039 tlc5620: bit: "1"
7927039-7927065 tlc5620: bit: "1"
7927065-7927091 tlc5620: bit: "0"
7927091-7927116 tlc5620: bit: "1"
7927116-7927142 tlc5620: bit: "0"
7927129-7927129 tlc5620: data-latch: "Falling edge on LOAD" "LOAD fall" "F"
7926860-7927142 tlc5620: reg-write: "Setting DACD register value to 3.15V" "DACD=3.15V"
7930905-7930956 tlc5620: dac-select: "DAC select: DACC" "DAC sel: DACC" "DAC: DACC" "D: DACC" "DACC" "C"
7930956-7930981 tlc5620: gain: "Gain: x2" "G: x2" "x2"
7930981-7931186 tlc5620: value: "DAC value: 108" "Value: 108" "Val: 108" "V: 108" "108"
7930905-7930930 tlc5620: bit: "1"
7930930-7930956 tlc5620: bit: "0"
7930956-7930981 tlc5620: bit: "1"
7930981-7931007 tlc5620: bit: "0"
7931007-7931033 tlc5620: bit: "1"
7931033-7931058 tlc5620: bit: "1"
7931058-7931084 tlc5620: bit: "0"
7931084-7931110 tlc5620: bit: "1"
7931110-7931135 tlc5620: bit: "1"
7931135-7931161 tlc5620: bit: "0"
7931161-7931186 tlc5620: bit: "0"
7931174-7931174 tlc5620: data-latch: "Falling edge on LOAD" "LOAD fall" "F"
7930905-7931186 tlc5620: reg-write: "Setting DACC register value to 2.78V" "DACC=2.78V"
7935833-7935833 tlc5620: ldac-fall: "Falling edge on LDAC" "LDAC fall" "LDAC" "L"
7922833-7935833 tlc5620: voltage-update-all: "Updating voltages: DACA=1.20V DACB=? DACC=2.78V DACD=3.15V" "DACA=1.20V DACB=? DACC=2.78V DACD=3.15V" "A=1.20V B=? C=2.78V D=3.15V"
7942782-7942833 tlc5620: dac-select: "DAC select: DACA" "DAC sel: DACA" "DAC: DACA" "D: DACA" "DACA" "A"
7942833-7942859 tlc5620: gain: "Gain: x1" "G: x1" "x1"
7942859-7943064 tlc5620: value: "DAC value: 92" "Value: 92" "Val: 92" "V: 92" "92"
7942782-7942808 tlc5620: bit: "0"
7942808-7942833 tlc5620: bit: "0"
7942833-7942859 tlc5620: bit: "0"
7942859-7942885 tlc5620: bit: "0"
7942885-7942910 tlc5620: bit: "1"
7942910-7942936 tlc5620: bit: "0"
7942936-7942962 tlc5620: bit: "1"
7942962-7942987 tlc5620: bit: "1"
7942987-7943013 tlc5620: bit: "1"
7943013-7943038 tlc5620: bit: "0"
7943038-7943064 tlc5620: bit: "0"
7943051-7943051 tlc5620: data-latch: "Falling edge on LOAD" "LOAD fall" "F"
7942782-7943064 tlc5620: reg-write: "Setting DACA register value to 1.19V" "DACA=1.19V"
7946834-7946886 tlc5620: dac-select: "DAC select: DACD" "DAC sel: DACD" "DAC: DACD" "D: DACD" "DACD" "D"
7946886-7946911 tlc5620: gain: "Gain: x2" "G: x2" "x2"
7946911-7947116 tlc5620: value: "DAC value: 122" "Value: 122" "Val: 122" "V: 122" "122"
7946834-7946860 tlc5620: bit: "1"
7946860-7946886 tlc5620: bit: "1"
7946886-7946911 tlc5620: bit: "1"
7946911-7946937 tlc5620: bit: "0"
7946937-7946963 tlc5620: bit: "1"
7946963-7946988 tlc5620: bit: "1"
7946988-7947014 tlc5620: bit: "1"
7947014-7947039 tlc5620: bit: "1"
7947039-7947065 tlc5620: bit: "0"
7947065-7947091 tlc5620: bit: "1"
7947091-7947116 tlc5620: bit: "0"
7947103-7947103 tlc5620: data-latch: "Falling edge on LOAD" "LOAD fall" "F"
7946834-7947116 tlc5620: reg-write: "Setting DACD register value to 3.15V" "DACD=3.15V"
7950869-7950920 tlc5620: dac-select: "DAC select: DACC" "DAC sel: DACC" "DAC: DACC" "D: DACC" "DACC" "C"
7950920-7950946 tlc5620: gain: "Gain: x2" "G: x2" "x2"
7950946-7951151 tlc5620: value: "DAC value: 108" "Value: 108" "Val: 108" "V: 108" "108"
7950869-7950894 tlc5620: bit: "1"
7950894-7950920 tlc5620: bit: "0"
7950920-7950946 tlc5620: bit: "1"
7950946-7950971 tlc5620: bit: "0"
7950971-7950997 tlc5620: bit: "1"
7950997-7951023 tlc5620: bit: "1"
7951023-7951048 tlc5620: bit: "0"
7951048-7951074 tlc5620: bit: "1"
7951074-7951099 tlc5620: bit: "1"
7951099-7951125 tlc5620: bit: "0"
7951125-7951151 tlc5620: bit: "0"
7951138-7951138 tlc5620: data-latch: "Falling edge on LOAD" "LOAD fall" "F"
7950869-7951151 tlc5620: reg-write: "Setting DACC register value to 2.78V" "DACC=2.78V"
7955777-7955777 tlc5620: ldac-fall: "Falling edge on LDAC" "LDAC fall" "LDAC" "L"
7942782-7955777 tlc5620: voltage-update-all: "Updating voltages: DACA=1.19V DACB=? DACC=2.78V DACD=3.15V" "DACA=1.19V DACB=? DACC=2.78V DACD=3.15V" "A=1.19V B=? C=2.78V D=3.15V"
8707206-8707258 tlc5620: dac-select: "DAC select: DACA" "DAC sel: DACA" "DAC: DACA" "D: DACA" "DACA" "A"
8707258-8707283 tlc5620: gain: "Gain: x1" "G: x1" "x1"
8707283-8707488 tlc5620: value: "DAC value: 92" "Value: 92" "Val: 92" "V: 92" "92"
8707206-8707232 tlc5620: bit: "0"
8707232-8707258 tlc5620: bit: "0"
8707258-8707283 tlc5620: bit: "0"
8707283-8707309 tlc5620: bit: "0"
8707309-8707335 tlc5620: bit: "1"
8707335-8707360 tlc5620: bit: "0"
8707360-8707386 tlc5620: bit: "1"
8707386-8707411 tlc5620: bit: "1"
8707411-8707437 tlc5620: bit: "1"
8707437-8707463 tlc5620: bit: "0"
8707463-8707488 tlc5620: bit: "0"
8707475-8707475 tlc5620: data-latch: "Falling edge on LOAD" "LOAD fall" "F"
8707206-8707488 tlc5620: reg-write: "Setting DACA register value to 1.19V" "DACA=1.19V"
8711236-8711287 tlc5620: dac-select: "DAC select: DACD" "DAC sel: DACD" "DAC: DACD" "D: DACD" "DACD" "D"
8711287-8711312 tlc5620: gain: "Gain: x2" "G: x2" "x2"
8711312-8711517 tlc5620: value: "DAC value: 122" "Value: 122" "Val: 122" "V: 122" "122"
8711236-8711261 tlc5620: bit: "1"
8711261-8711287 tlc5620: bit: "1"
8711287-8711312 tlc5620: bit: "1"
8711312-8711338 tlc5620: bit: "0"
8711338-8711364 tlc5620: bit: "1"
8711364-8711389 tlc5620: bit: "1"
8711389-8711415 tlc5620: bit: "1"
8711415-8711441 tlc5620: bit: "1"
8711441-8711466 tlc5620: bit: "0"
8711466-8711492 tlc5620: bit: "1"
8711492-8711517 tlc5620: bit: "0"
8711505-8711505 tlc5620: data-latch: "Falling edge on LOAD" "LOAD fall" "F"
8711236-8711517 tlc5620: reg-write: "Setting DACD register value to 3.15V" "DACD=3.15V"
8715288-8715339 tlc5620: dac-select: "DAC select: DACC" "DAC sel: DACC" "DAC: DACC" "D: DACC" "DACC" "C"
8715339-8715365 tlc5620: gain: "Gain: x2" "G: x2" "x2"
8715365-8715570 tlc5620: value: "DAC value: 108" "Value: 108" "Val: 108" "V: 108" "108"
8715288-8715314 tlc5620: bit: "1"
8715314-8715339 tlc5620: bit: "0"
8715339-8715365 tlc5620: bit: "1"
8715365-8715390 tlc5620: bit: "0"
8715390-8715416 tlc5620: bit: "1"
8715416-8715442 tlc5620: bit: "1"
8715442-8715467 tlc5620: bit: "0"
8715467-8715493 tlc5620: bit: "1"
8715493-8715518 tlc5620: bit: "1"
8715518-8715544 tlc5620: bit: "0"
8715544-8715570 tlc5620: bit: "0"
8715557-8715557 tlc5620: data-latch: "Falling edge on LOAD" "LOAD fall" "F"
8715288-8715570 tlc5620: reg-write: "Setting DACC register value to 2.78V" "DACC=2.78V"
8720214-8720214 tlc5620: ldac-fall: "Falling edge on LDAC" "LDAC fall" "LDAC" "L"
8707206-8720214 tlc5620: voltage-update-all: "Updating voltages: DACA=1.19V DACB=? DACC=2.78V DACD=3.15V" "DACA=1.19V DACB=? DACC=2.78V DACD=3.15V" "A=1.19V B=? C=2.78V D=3.15V"
8727406-8727458 tlc5620: dac-select: "DAC select: DACA" "DAC sel: DACA" "DAC: DACA" "D: DACA" "DACA" "A"
8727458-8727483 tlc5620: gain: "Gain: x1" "G: x1" "x1"
8727483-8727687 tlc5620: value: "DAC value: 92" "Value: 92" "Val: 92" "V: 92" "92"
8727406-8727432 tlc5620: bit: "0"
8727432-8727458 tlc5620: bit: "0"
8727458-8727483 tlc5620: bit: "0"
8727483-8727509 tlc5620: bit: "0"
8727509-8727534 tlc5620: bit: "1"
8727534-8727560 tlc5620: bit: "0"
8727560-8727586 tlc5620: bit: "1"
8727586-8727611 tlc5620: bit: "1"
8727611-8727637 tlc5620: bit: "1"
8727637-8727662 tlc5620: bit: "0"
8727662-8727687 tlc5620: bit: "0"
8727675-8727675 tlc5620: data-latch: "Falling edge on LOAD" "LOAD fall" "F"
8727406-8727687 tlc5620: reg-write: "Setting DACA register value to 1.19V" "DACA=1.19V"
8731223-8731274 tlc5620: dac-select: "DAC select: DACD" "DAC sel: DACD" "DAC: DACD" "D: DACD" "DACD" "D"
8731274-8731300 tlc5620: gain: "Gain: x2" "G: x2" "x2"
8731300-8731505 tlc5620: value: "DAC value: 122" "Value: 122" "Val: 122" "V: 122" "122"
8731223-8731249 tlc5620: bit: "1"
8731249-8731274 tlc5620: bit: "1"
8731274-8731300 tlc5620: bit: "1"
8731300-8731325 tlc5620: bit: "0"
8731325-8731351 tlc5620: bit: "1"
8731351-8731377 tlc5620: bit: "1"
8731377-8731402 tlc5620: bit: "1"
8731402-8731428 tlc5620: bit: "1"
8731428-8731453 tlc5620: bit: "0"
8731453-8731479 tlc5620: bit: "1"
8731479-8731505 tlc5620: bit: "0"
8731492-8731492 tlc5620: data-latch: "Falling edge on LOAD" "LOAD fall" "F"
8731223-8731505 tlc5620: reg-write: "Setting DACD register value to 3.15V" "DACD=3.15V"
8735234-8735285 tlc5620: dac-select: "DAC select: DACC" "DAC sel: DACC" "DAC: DACC" "D: DACC" "DACC" "C"
8735285-8735311 tlc5620: gain: "Gain: x2" "G: x2" "x2"
8735311-8735516 tlc5620: value: "DAC value: 108" "Value: 108" "Val: 108" "V: 108" "108"
8735234-8735260 tlc5620: bit: "1"
8735260-8735285 tlc5620: bit: "0"
8735285-8735311 tlc5620: bit: "1"
8735311-8735337 tlc5620: bit: "0"
8735337-8735362 tlc5620: bit: "1"
8735362-8735388 tlc5620: bit: "1"
8735388-8735414 tlc5620: bit: "0"
8735414-8735439 tlc5620: bit: "1"
8735439-8735465 tlc5620: bit: "1"
8735465-8735490 tlc5620: bit: "0"
8735490-8735516 tlc5620: bit: "0"
8735503-8735503 tlc5620: data-latch: "Falling edge on LOAD" "LOAD fall" "F"
8735234-8735516 tlc5620: reg-write: "Setting DACC register value to 2.78V" "DACC=2.78V"
8740173-8740173 tlc5620: ldac-fall: "Falling edge on LDAC" "LDAC fall" "LDAC" "L"
8727406-8740173 tlc5620: voltage-update-all: "Updating voltages: DACA=1.19V DACB=? DACC=2.78V DACD=3.15V" "DACA=1.19V DACB=? DACC=2.78V DACD=3.15V" "A=1.19V B=? C=2.78V D=3.15V"
11511050-11511101 tlc5620: dac-select: "DAC select: DACA" "DAC sel: DACA" "DAC: DACA" "D: DACA" "DACA" "A"
11511101-11511127 tlc5620: gain: "Gain: x1" "G: x1" "x1"
11511127-11511332 tlc5620: value: "DAC value: 92" "Value: 92" "Val: 92" "V: 92" "92"
11511050-11511075 tlc5620: bit: "0"
11511075-11511101 tlc5620: bit: "0"
11511101-11511127 tlc5620: bit: "0"
11511127-11511152 tlc5620: bit: "0"
11511152-11511178 tlc5620: bit: "1"
11511178-11511204 tlc5620: bit: "0"
11511204-11511229 tlc5620: bit: "1"
11511229-11511255 tlc5620: bit: "1"
11511255-11511280 tlc5620: bit: "1"
11511280-11511306 tlc5620: bit: "0"
11511306-11511332 tlc5620: bit: "0"
11511319-11511319 tlc5620: data-latch: "Falling edge on LOAD" "LOAD fall" "F"
11511050-11511332 tlc5620: reg-write: "Setting DACA register value to 1.19V" "DACA=1.19V"
11514772-11514823 tlc5620: dac-select: "DAC select: DACD" "DAC sel: DACD" "DAC: DACD" "D: DACD" "DACD" "D"
11514823-11514849 tlc5620: gain: "Gain: x2" "G: x2" "x2"
11514849-11515054 tlc5620: value: "DAC value: 122" "Value: 122" "Val: 122" "V: 122" "122"
11514772-11514797 tlc5620: bit: "1"
11514797-11514823 tlc5620: bit: "1"
11514823-11514849 tlc5620: bit: "1"
11514849-11514874 tlc5620: bit: "0"
11514874-11514900 tlc5620: bit: "1"
11514900-11514925 tlc5620: bit: "1"
11514925-11514951 tlc5620: bit: "1"
11514951-11514977 tlc5620: bit: "1"
11514977-11515002 tlc5620: bit: "0"
11515002-11515028 tlc5620: bit: "1"
11515028-11515054 tlc5620: bit: "0"
11515041-11515041 tlc5620: data-latch: "Falling edge on LOAD" "LOAD fall" "F"
11514772-11515054 tlc5620: reg-write: "Setting DACD register value to 3.15V" "DACD=3.15V"
11518832-11518883 tlc5620: dac-select: "DAC select: DACC" "DAC sel: DACC" "DAC: DACC" "D: DACC" "DACC" "C"
11518883-11518908 tlc5620: gain: "Gain: x2" "G: x2" "x2"
11518908-11519113 tlc5620: value: "DAC value: 108" "Value: 108" "Val: 108" "V: 108" "108"
11518832-11518857 tlc5620: bit: "1"
11518857-11518883 tlc5620: bit: "0"
11518883-11518908 tlc5620: bit: "1"
11518908-11518934 tlc5620: bit: "0"
11518934-11518960 tlc5620: bit: "1"
11518960-11518985 tlc5620: bit: "1"
11518985-11519011 tlc5620: bit: "0"
11519011-11519037 tlc5620: bit: "1"
11519037-11519062 tlc5620: bit: "1"
11519062-11519088 tlc5620: bit: "0"
11519088-11519113 tlc5620: bit: "0"
11519101-11519101 tlc5620: data-latch: "Falling edge on LOAD" "LOAD fall" "F"
11518832-11519113 tlc5620: reg-write: "Setting DACC register value to 2.78V" "DACC=2.78V"
11523780-11523780 tlc5620: ldac-fall: "Falling edge on LDAC" "LDAC fall" "LDAC" "L"
11511050-11523780 tlc5620: voltage-update-all: "Updating voltages: DACA=1.19V DACB=? DACC=2.78V DACD=3.15V" "DACA=1.19V DACB=? DACC=2.78V DACD=3.15V" "A=1.19V B=? C=2.78V D=3.15V"
11655103-11655154 tlc5620: dac-select: "DAC select: DACA" "DAC sel: DACA" "DAC: DACA" "D: DACA" "DACA" "A"
11655154-11655180 tlc5620: gain: "Gain: x1" "G: x1" "x1"
11655180-11655385 tlc5620: value: "DAC value: 91" "Value: 91" "Val: 91" "V: 91" "91"
11655103-11655128 tlc5620: bit: "0"
11655128-11655154 tlc5620: bit: "0"
11655154-11655180 tlc5620: bit: "0"
11655180-11655205 tlc5620: bit: "0"
11655205-11655231 tlc5620: bit: "1"
11655231-11655256 tlc5620: bit: "0"
11655256-11655282 tlc5620: bit: "1"
11655282-11655308 tlc5620: bit: "1"
11655308-11655333 tlc5620: bit: "0"
11655333-11655359 tlc5620: bit: "1"
11655359-11655385 tlc5620: bit: "1"
11655372-11655372 tlc5620: data-latch: "Falling edge on LOAD" "LOAD fall" "F"
11655103-11655385 tlc5620: reg-write: "Setting DACA register value to 1.17V" "DACA=1.17V"
11658848-11658899 tlc5620: dac-select: "DAC select: DACD" "DAC sel: DACD" "DAC: DACD" "D: DACD" "DACD" "D"
11658899-11658924 tlc5620: gain: "Gain: x2" "G: x2" "x2"
11658924-11659129 tlc5620: value: "DAC value: 122" "Value: 122" "Val: 122" "V: 122" "122"
11658848-11658873 tlc5620: bit: "1"
11658873-11658899 tlc5620: bit: "1"
11658899-11658924 tlc5620: bit: "1"
11658924-11658950 tlc5620: bit: "0"
11658950-11658976 tlc5620: bit: "1"
11658976-11659001 tlc5620: bit: "1"
11659001-11659027 tlc5620: bit: "1"
11659027-11659053 tlc5620: bit: "1"
11659053-11659078 tlc5620: bit: "0"
11659078-11659104 tlc5620: bit: "1"
11659104-11659129 tlc5620: bit: "0"
11659117-11659117 tlc5620: data-latch: "Falling edge on LOAD" "LOAD fall" "F"
11658848-11659129 tlc5620: reg-write: "Setting DACD register value to 3.15V" "DACD=3.15V"
11662910-11662961 tlc5620: dac-select: "DAC select: DACC" "DAC sel: DACC" "DAC: DACC" "D: DACC" "DACC" "C"
11662961-11662987 tlc5620: gain: "Gain: x2" "G: x2" "x2"
11662987-11663192 tlc5620: value: "DAC value: 108" "Value: 108" "Val: 108" "V: 108" "108"
11662910-11662936 tlc5620: bit: "1"
11662936-11662961 tlc5620: bit: "0"
11662961-11662987 tlc5620: bit: "1"
11662987-11663013 tlc5620: bit: "0"
11663013-11663038 tlc5620: bit: "1"
11663038-11663064 tlc5620: bit: "1"
11663064-11663089 tlc5620: bit: "0"
11663089-11663115 tlc5620: bit: "1"
11663115-11663141 tlc5620: bit: "1"
11663141-11663166 tlc5620: bit: "0"
11663166-11663192 tlc5620: bit: "0"
11663179-11663179 tlc5620: data-latch: "Falling edge on LOAD" "LOAD fall" "F"
11662910-11663192 tlc5620: reg-write: "Setting DACC register value to 2.78V" "DACC=2.78V"
11667936-11667936 tlc5620: ldac-fall: "Falling edge on LDAC" "LDAC fall" "LDAC" "L"
11655103-11667936 tlc5620: voltage-update-all: "Updating voltages: DACA=1.17V DACB=? DACC=2.78V DACD=3.15V" "DACA=1.17V DACB=? DACC=2.78V DACD=3.15V" "A=1.17V B=? C=2.78V D=3.15V"
11675052-11675103 tlc5620: dac-select: "DAC select: DACA" "DAC sel: DACA" "DAC: DACA" "D: DACA" "DACA" "A"
11675103-11675128 tlc5620: gain: "Gain: x1" "G: x1" "x1"
11675128-11675333 tlc5620: value: "DAC value: 89" "Value: 89" "Val: 89" "V: 89" "89"
11675052-11675077 tlc5620: bit: "0"
11675077-11675103 tlc5620: bit: "0"
11675103-11675128 tlc5620: bit: "0"
11675128-11675154 tlc5620: bit: "0"
11675154-11675180 tlc5620: bit: "1"
11675180-11675205 tlc5620: bit: "0"
11675205-11675231 tlc5620: bit: "1"
11675231-11675256 tlc5620: bit: "1"
11675256-11675282 tlc5620: bit: "0"
11675282-11675308 tlc5620: bit: "0"
11675308-11675333 tlc5620: bit: "1"
11675321-11675321 tlc5620: data-latch: "Falling edge on LOAD" "LOAD fall" "F"
11675052-11675333 tlc5620: reg-write: "Setting DACA register value to 1.15V" "DACA=1.15V"
11679073-11679124 tlc5620: dac-select: "DAC select: DACD" "DAC sel: DACD" "DAC: DACD" "D: DACD" "DACD" "D"
11679124-11679150 tlc5620: gain: "Gain: x2" "G: x2" "x2"
11679150-11679355 tlc5620: value: "DAC value: 122" "Value: 122" "Val: 122" "V: 122" "122"
11679073-11679099 tlc5620: bit: "1"
11679099-11679124 tlc5620: bit: "1"
11679124-11679150 tlc5620: bit: "1"
11679150-11679176 tlc5620: bit: "0"
11679176-11679201 tlc5620: bit: "1"
11679201-11679227 tlc5620: bit: "1"
11679227-11679252 tlc5620: bit: "1"
11679252-11679278 tlc5620: bit: "1"
11679278-11679304 tlc5620: bit: "0"
11679304-11679329 tlc5620: bit: "1"
11679329-11679355 tlc5620: bit: "0"
11679342-11679342 tlc5620: data-latch: "Falling edge on LOAD" "LOAD fall" "F"
11679073-11679355 tlc5620: reg-write: "Setting DACD register value to 3.15V" "DACD=3.15V"
11682941-11682992 tlc5620: dac-select: "DAC select: DACC" "DAC sel: DACC" "DAC: DACC" "D: DACC" "DACC" "C"
11682992-11683018 tlc5620: gain: "Gain: x2" "G: x2" "x2"
11683018-11683223 tlc5620: value: "DAC value: 108" "Value: 108" "Val: 108" "V: 108" "108"
11682941-11682967 tlc5620: bit: "1"
11682967-11682992 tlc5620: bit: "0"
11682992-11683018 tlc5620: bit: "1"
11683018-11683043 tlc5620: bit: "0"
11683043-11683069 tlc5620: bit: "1"
11683069-11683095 tlc5620: bit: "1"
11683095-11683120 tlc5620: bit: "0"
11683120-11683146 tlc5620: bit: "1"
11683146-11683171 tlc5620: bit: "1"
11683171-11683197 tlc5620: bit: "0"
11683197-11683223 tlc5620: bit: "0"
11683210-11683210 tlc5620: data-latch: "Falling edge on LOAD" "LOAD fall" "F"
11682941-11683223 tlc5620: reg-write: "Setting DACC register value to 2.78V" "DACC=2.78V"
11687805-11687805 tlc5620: ldac-fall: "Falling edge on LDAC" "LDAC fall" "LDAC" "L"
11675052-11687805 tlc5620: voltage-update-all: "Updating voltages: DACA=1.15V DACB=? DACC=2.78V DACD=3.15V" "DACA=1.15V DACB=? DACC=2.78V DACD=3.15V" "A=1.15V B=? C=2.78V D=3.15V"
11695006-11695057 tlc5620: dac-select: "DAC select: DACA" "DAC sel: DACA" "DAC: DACA" "D: DACA" "DACA" "A"
11695057-11695082 tlc5620: gain: "Gain: x1" "G: x1" "x1"
11695082-11695287 tlc5620: value: "DAC value: 87" "Value: 87" "Val: 87" "V: 87" "87"
11695006-11695031 tlc5620: bit: "0"
11695031-11695057 tlc5620: bit: "0"
11695057-11695082 tlc5620: bit: "0"
11695082-11695108 tlc5620: bit: "0"
11695108-11695134 tlc5620: bit: "1"
11695134-11695159 tlc5620: bit: "0"
11695159-11695185 tlc5620: bit: "1"
11695185-11695210 tlc5620: bit: "0"
11695210-11695236 tlc5620: bit: "1"
11695236-11695262 tlc5620: bit: "1"
11695262-11695287 tlc5620: bit: "1"
11695274-11695274 tlc5620: data-latch: "Falling edge on LOAD" "LOAD fall" "F"
11695006-11695287 tlc5620: reg-write: "Setting DACA register value to 1.12V" "DACA=1.12V"
11699065-11699117 tlc5620: dac-select: "DAC select: DACD" "DAC sel: DACD" "DAC: DACD" "D: DACD" "DACD" "D"
11699117-11699142 tlc5620: gain: "Gain: x2" "G: x2" "x2"
11699142-11699347 tlc5620: value: "DAC value: 122" "Value: 122" "Val: 122" "V: 122" "122"
11699065-11699091 tlc5620: bit: "1"
11699091-11699117 tlc5620: bit: "1"
11699117-11699142 tlc5620: bit: "1"
11699142-11699168 tlc5620: bit: "0"
11699168-11699194 tlc5620: bit: "1"
11699194-11699219 tlc5620: bit: "1"
11699219-11699245 tlc5620: bit: "1"
11699245-11699270 tlc5620: bit: "1"
11699270-11699296 tlc5620: bit: "0"
11699296-11699322 tlc5620: bit: "1"
11699322-11699347 tlc5620: bit: "0"
11699334-11699334 tlc5620: data-latch: "Falling edge on LOAD" "LOAD fall" "F"
11699065-11699347 tlc5620: reg-write: "Setting DACD register value to 3.15V" "DACD=3.15V"
11703118-11703169 tlc5620: dac-select: "DAC select: DACC" "DAC sel: DACC" "DAC: DACC" "D: DACC" "DACC" "C"
11703169-11703195 tlc5620: gain: "Gain: x2" "G: x2" "x2"
11703195-11703400 tlc5620: value: "DAC value: 108" "Value: 108" "Val: 108" "V: 108" "108"
11703118-11703143 tlc5620: bit: "1"
11703143-11703169 tlc5620: bit: "0"
11703169-11703195 tlc5620: bit: "1"
11703195-11703220 tlc5620: bit: "0"
11703220-11703246 tlc5620: bit: "1"
11703246-11703271 tlc5620: bit: "1"
11703271-11703297 tlc5620: bit: "0"
11703297-11703323 tlc5620: bit: "1"
11703323-11703348 tlc5620: bit: "1"
11703348-11703374 tlc5620: bit: "0"
11703374-11703400 tlc5620: bit: "0"
11703387-11703387 tlc5620: data-latch: "Falling edge on LOAD" "LOAD fall" "F"
11703118-11703400 tlc5620: reg-write: "Setting DACC register value to 2.78V" "DACC=2.78V"
11707749-11707749 tlc5620: ldac-fall: "Falling edge on LDAC" "LDAC fall" "LDAC" "L"
11695006-11707749 tlc5620: voltage-update-all: "Updating voltages: DACA=1.12V DACB=? DACC=2.78V DACD=3.15V" "DACA=1.12V DACB=? DACC=2.78V DACD=3.15V" "A=1.12V B=? C=2.78V D=3.15V"
11715129-11715180 tlc5620: dac-select: "DAC select: DACA" "DAC sel: DACA" "DAC: DACA" "D: DACA" "DACA" "A"
11715180-11715205 tlc5620: gain: "Gain: x1" "G: x1" "x1"
11715205-11715410 tlc5620: value: "DAC value: 86" "Value: 86" "Val: 86" "V: 86" "86"
11715129-11715154 tlc5620: bit: "0"
11715154-11715180 tlc5620: bit: "0"
11715180-11715205 tlc5620: bit: "0"
11715205-11715231 tlc5620: bit: "0"
11715231-11715257 tlc5620: bit: "1"
11715257-11715282 tlc5620: bit: "0"
11715282-11715308 tlc5620: bit: "1"
11715308-11715333 tlc5620: bit: "0"
11715333-11715359 tlc5620: bit: "1"
11715359-11715385 tlc5620: bit: "1"
11715385-11715410 tlc5620: bit: "0"
11715398-11715398 tlc5620: data-latch: "Falling edge on LOAD" "LOAD fall" "F"
11715129-11715410 tlc5620: reg-write: "Setting DACA register value to 1.11V" "DACA=1.11V"
11719030-11719081 tlc5620: dac-select: "DAC select: DACD" "DAC sel: DACD" "DAC: DACD" "D: DACD" "DACD" "D"
11719081-11719107 tlc5620: gain: "Gain: x2" "G: x2" "x2"
11719107-11719312 tlc5620: value: "DAC value: 122" "Value: 122" "Val: 122" "V: 122" "122"
11719030-11719055 tlc5620: bit: "1"
11719055-11719081 tlc5620: bit: "1"
11719081-11719107 tlc5620: bit: "1"
11719107-11719132 tlc5620: bit: "0"
11719132-11719158 tlc5620: bit: "1"
11719158-11719183 tlc5620: bit: "1"
11719183-11719209 tlc5620: bit: "1"
11719209-11719235 tlc5620: bit: "1"
11719235-11719260 tlc5620: bit: "0"
11719260-11719286 tlc5620: bit: "1"
11719286-11719312 tlc5620: bit: "0"
11719299-11719299 tlc5620: data-latch: "Falling edge on LOAD" "LOAD fall" "F"
11719030-11719312 tlc5620: reg-write: "Setting DACD register value to 3.15V" "DACD=3.15V"
11723082-11723133 tlc5620: dac-select: "DAC select: DACC" "DAC sel: DACC" "DAC: DACC" "D: DACC" "DACC" "C"
11723133-11723159 tlc5620: gain: "Gain: x2" "G: x2" "x2"
11723159-11723364 tlc5620: value: "DAC value: 108" "Value: 108" "Val: 108" "V: 108" "108"
11723082-11723108 tlc5620: bit: "1"
11723108-11723133 tlc5620: bit: "0"
11723133-11723159 tlc5620: bit: "1"
11723159-11723184 tlc5620: bit: "0"
11723184-11723210 tlc5620: bit: "1"
11723210-11723236 tlc5620: bit: "1"
11723236-11723261 tlc5620: bit: "0"
11723261-11723287 tlc5620: bit: "1"
11723287-11723313 tlc5620: bit: "1"
11723313-11723338 tlc5620: bit: "0"
11723338-11723364 tlc5620: bit: "0"
11723351-11723351 tlc5620: data-latch: "Falling edge on LOAD" "LOAD fall" "F"
11723082-11723364 tlc5620: reg-write: "Setting DACC register value to 2.78V" "DACC=2.78V"
11727990-11727990 tlc5620: ldac-fall: "Falling edge on LDAC" "LDAC fall" "LDAC" "L"
11715129-11727990 tlc5620: voltage-update-all: "Updating voltages: DACA=1.11V DACB=? DACC=2.78V DACD=3.15V" "DACA=1.11V DACB=? DACC=2.78V DACD=3.15V" "A=1.11V B=? C=2.78V D=3.15V"
11734967-11735018 tlc5620: dac-select: "DAC select: DACA" "DAC sel: DACA" "DAC: DACA" "D: DACA" "DACA" "A"
11735018-11735044 tlc5620: gain: "Gain: x1" "G: x1" "x1"
11735044-11735249 tlc5620: value: "DAC value: 84" "Value: 84" "Val: 84" "V: 84" "84"
11734967-11734993 tlc5620: bit: "0"
11734993-11735018 tlc5620: bit: "0"
11735018-11735044 tlc5620: bit: "0"
11735044-11735070 tlc5620: bit: "0"
11735070-11735095 tlc5620: bit: "1"
11735095-11735121 tlc5620: bit: "0"
11735121-11735147 tlc5620: bit: "1"
11735147-11735172 tlc5620: bit: "0"
11735172-11735198 tlc5620: bit: "1"
11735198-11735223 tlc5620: bit: "0"
11735223-11735249 tlc5620: bit: "0"
11735236-11735236 tlc5620: data-latch: "Falling edge on LOAD" "LOAD fall" "F"
11734967-11735249 tlc5620: reg-write: "Setting DACA register value to 1.08V" "DACA=1.08V"
11738994-11739045 tlc5620: dac-select: "DAC select: DACD" "DAC sel: DACD" "DAC: DACD" "D: DACD" "DACD" "D"
11739045-11739071 tlc5620: gain: "Gain: x2" "G: x2" "x2"
11739071-11739276 tlc5620: value: "DAC value: 122" "Value: 122" "Val: 122" "V: 122" "122"
11738994-11739020 tlc5620: bit: "1"
11739020-11739045 tlc5620: bit: "1"
11739045-11739071 tlc5620: bit: "1"
11739071-11739096 tlc5620: bit: "0"
11739096-11739122 tlc5620: bit: "1"
11739122-11739148 tlc5620: bit: "1"
11739148-11739173 tlc5620: bit: "1"
11739173-11739199 tlc5620: bit: "1"
11739199-11739224 tlc5620: bit: "0"
11739224-11739250 tlc5620: bit: "1"
11739250-11739276 tlc5620: bit: "0"
11739263-11739263 tlc5620: data-latch: "Falling edge on LOAD" "LOAD fall" "F"
11738994-11739276 tlc5620: reg-write: "Setting DACD register value to 3.15V" "DACD=3.15V"
11743041-11743092 tlc5620: dac-select: "DAC select: DACC" "DAC sel: DACC" "DAC: DACC" "D: DACC" "DACC" "C"
11743092-11743118 tlc5620: gain: "Gain: x2" "G: x2" "x2"
11743118-11743323 tlc5620: value: "DAC value: 108" "Value: 108" "Val: 108" "V: 108" "108"
11743041-11743067 tlc5620: bit: "1"
11743067-11743092 tlc5620: bit: "0"
11743092-11743118 tlc5620: bit: "1"
11743118-11743144 tlc5620: bit: "0"
11743144-11743169 tlc5620: bit: "1"
11743169-11743195 tlc5620: bit: "1"
11743195-11743220 tlc5620: bit: "0"
11743220-11743246 tlc5620: bit: "1"
11743246-11743272 tlc5620: bit: "1"
11743272-11743297 tlc5620: bit: "0"
11743297-11743323 tlc5620: bit: "0"
11743310-11743310 tlc5620: data-latch: "Falling edge on LOAD" "LOAD fall" "F"
11743041-11743323 tlc5620: reg-write: "Setting DACC register value to 2.78V" "DACC=2.78V"
11747962-11747962 tlc5620: ldac-fall: "Falling edge on LDAC" "LDAC fall" "LDAC" "L"
11734967-11747962 tlc5620: voltage-update-all: "Updating voltages: DACA=1.08V DACB=? DACC=2.78V DACD=3.15V" "DACA=1.08V DACB=? DACC=2.78V DACD=3.15V" "A=1.08V B=? C=2.78V D=3.15V"
11754926-11754978 tlc5620: dac-select: "DAC select: DACA" "DAC sel: DACA" "DAC: DACA" "D: DACA" "DACA" "A"
11754978-11755003 tlc5620: gain: "Gain: x1" "G: x1" "x1"
11755003-11755208 tlc5620: value: "DAC value: 83" "Value: 83" "Val: 83" "V: 83" "83"
11754926-11754952 tlc5620: bit: "0"
11754952-11754978 tlc5620: bit: "0"
11754978-11755003 tlc5620: bit: "0"
11755003-11755029 tlc5620: bit: "0"
11755029-11755054 tlc5620: bit: "1"
11755054-11755080 tlc5620: bit: "0"
11755080-11755106 tlc5620: bit: "1"
11755106-11755131 tlc5620: bit: "0"
11755131-11755157 tlc5620: bit: "0"
11755157-11755183 tlc5620: bit: "1"
11755183-11755208 tlc5620: bit: "1"
11755195-11755195 tlc5620: data-latch: "Falling edge on LOAD" "LOAD fall" "F"
11754926-11755208 tlc5620: reg-write: "Setting DACA register value to 1.07V" "DACA=1.07V"
11759025-11759076 tlc5620: dac-select: "DAC select: DACD" "DAC sel: DACD" "DAC: DACD" "D: DACD" "DACD" "D"
11759076-11759102 tlc5620: gain: "Gain: x2" "G: x2" "x2"
11759102-11759307 tlc5620: value: "DAC value: 122" "Value: 122" "Val: 122" "V: 122" "122"
11759025-11759050 tlc5620: bit: "1"
11759050-11759076 tlc5620: bit: "1"
11759076-11759102 tlc5620: bit: "1"
11759102-11759127 tlc5620: bit: "0"
11759127-11759153 tlc5620: bit: "1"
11759153-11759178 tlc5620: bit: "1"
11759178-11759204 tlc5620: bit: "1"
11759204-11759230 tlc5620: bit: "1"
11759230-11759255 tlc5620: bit: "0"
11759255-11759281 tlc5620: bit: "1"
11759281-11759307 tlc5620: bit: "0"
11759294-11759294 tlc5620: data-latch: "Falling edge on LOAD" "LOAD fall" "F"
11759025-11759307 tlc5620: reg-write: "Setting DACD register value to 3.15V" "DACD=3.15V"
11763218-11763269 tlc5620: dac-select: "DAC select: DACC" "DAC sel: DACC" "DAC: DACC" "D: DACC" "DACC" "C"
11763269-11763295 tlc5620: gain: "Gain: x2" "G: x2" "x2"
11763295-11763500 tlc5620: value: "DAC value: 108" "Value: 108" "Val: 108" "V: 108" "108"
11763218-11763244 tlc5620: bit: "1"
11763244-11763269 tlc5620: bit: "0"
11763269-11763295 tlc5620: bit: "1"
11763295-11763320 tlc5620: bit: "0"
11763320-11763346 tlc5620: bit: "1"
11763346-11763372 tlc5620: bit: "1"
11763372-11763397 tlc5620: bit: "0"
11763397-11763423 tlc5620: bit: "1"
11763423-11763448 tlc5620: bit: "1"
11763448-11763474 tlc5620: bit: "0"
11763474-11763500 tlc5620: bit: "0"
11763487-11763487 tlc5620: data-latch: "Falling edge on LOAD" "LOAD fall" "F"
11763218-11763500 tlc5620: reg-write: "Setting DACC register value to 2.78V" "DACC=2.78V"
11768044-11768044 tlc5620: ldac-fall: "Falling edge on LDAC" "LDAC fall" "LDAC" "L"
11754926-11768044 tlc5620: voltage-update-all: "Updating voltages: DACA=1.07V DACB=? DACC=2.78V DACD=3.15V" "DACA=1.07V DACB=? DACC=2.78V DACD=3.15V" "A=1.07V B=? C=2.78V D=3.15V"
11775149-11775201 tlc5620: dac-select: "DAC select: DACA" "DAC sel: DACA" "DAC: DACA" "D: DACA" "DACA" "A"
11775201-11775226 tlc5620: gain: "Gain: x1" "G: x1" "x1"
11775226-11775430 tlc5620: value: "DAC value: 80" "Value: 80" "Val: 80" "V: 80" "80"
11775149-11775175 tlc5620: bit: "0"
11775175-11775201 tlc5620: bit: "0"
11775201-11775226 tlc5620: bit: "0"
11775226-11775252 tlc5620: bit: "0"
11775252-11775277 tlc5620: bit: "1"
11775277-11775303 tlc5620: bit: "0"
11775303-11775329 tlc5620: bit: "1"
11775329-11775354 tlc5620: bit: "0"
11775354-11775380 tlc5620: bit: "0"
11775380-11775405 tlc5620: bit: "0"
11775405-11775430 tlc5620: bit: "0"
11775418-11775418 tlc5620: data-latch: "Falling edge on LOAD" "LOAD fall" "F"
11775149-11775430 tlc5620: reg-write: "Setting DACA register value to 1.03V" "DACA=1.03V"
11778966-11779017 tlc5620: dac-select: "DAC select: DACD" "DAC sel: DACD" "DAC: DACD" "D: DACD" "DACD" "D"
11779017-11779043 tlc5620: gain: "Gain: x2" "G: x2" "x2"
11779043-11779248 tlc5620: value: "DAC value: 122" "Value: 122" "Val: 122" "V: 122" "122"
11778966-11778992 tlc5620: bit: "1"
11778992-11779017 tlc5620: bit: "1"
11779017-11779043 tlc5620: bit: "1"
11779043-11779068 tlc5620: bit: "0"
11779068-11779094 tlc5620: bit: "1"
11779094-11779120 tlc5620: bit: "1"
11779120-11779145 tlc5620: bit: "1"
11779145-11779171 tlc5620: bit: "1"
11779171-11779196 tlc5620: bit: "0"
11779196-11779222 tlc5620: bit: "1"
11779222-11779248 tlc5620: bit: "0"
11779235-11779235 tlc5620: data-latch: "Falling edge on LOAD" "LOAD fall" "F"
11778966-11779248 tlc5620: reg-write: "Setting DACD register value to 3.15V" "DACD=3.15V"
11782970-11783021 tlc5620: dac-select: "DAC select: DACC" "DAC sel: DACC" "DAC: DACC" "D: DACC" "DACC" "C"
11783021-11783046 tlc5620: gain: "Gain: x2" "G: x2" "x2"
11783046-11783251 tlc5620: value: "DAC value: 108" "Value: 108" "Val: 108" "V: 108" "108"
11782970-11782995 tlc5620: bit: "1"
11782995-11783021 tlc5620: bit: "0"
11783021-11783046 tlc5620: bit: "1"
11783046-11783072 tlc5620: bit: "0"
11783072-11783098 tlc5620: bit: "1"
11783098-11783123 tlc5620: bit: "1"
11783123-11783149 tlc5620: bit: "0"
11783149-11783174 tlc5620: bit: "1"
11783174-11783200 tlc5620: bit: "1"
11783200-11783226 tlc5620: bit: "0"
11783226-11783251 tlc5620: bit: "0"
11783238-11783238 tlc5620: data-latch: "Falling edge on LOAD" "LOAD fall" "F"
11782970-11783251 tlc5620: reg-write: "Setting DACC register value to 2.78V" "DACC=2.78V"
11787885-11787885 tlc5620: ldac-fall: "Falling edge on LDAC" "LDAC fall" "LDAC" "L"
11775149-11787885 tlc5620: voltage-update-all: "Updating voltages: DACA=1.03V DACB=? DACC=2.78V DACD=3.15V" "DACA=1.03V DACB=? DACC=2.78V DACD=3.15V" "A=1.03V B=? C=2.78V D=3.15V"
11795155-11795206 tlc5620: dac-select: "DAC select: DACA" "DAC sel: DACA" "DAC: DACA" "D: DACA" "DACA" "A"
11795206-11795231 tlc5620: gain: "Gain: x1" "G: x1" "x1"
11795231-11795436 tlc5620: value: "DAC value: 78" "Value: 78" "Val: 78" "V: 78" "78"
11795155-11795180 tlc5620: bit: "0"
11795180-11795206 tlc5620: bit: "0"
11795206-11795231 tlc5620: bit: "0"
11795231-11795257 tlc5620: bit: "0"
11795257-11795283 tlc5620: bit: "1"
11795283-11795308 tlc5620: bit: "0"
11795308-11795334 tlc5620: bit: "0"
11795334-11795359 tlc5620: bit: "1"
11795359-11795385 tlc5620: bit: "1"
11795385-11795411 tlc5620: bit: "1"
11795411-11795436 tlc5620: bit: "0"
11795423-11795423 tlc5620: data-latch: "Falling edge on LOAD" "LOAD fall" "F"
11795155-11795436 tlc5620: reg-write: "Setting DACA register value to 1.01V" "DACA=1.01V"
11799163-11799214 tlc5620: dac-select: "DAC select: DACD" "DAC sel: DACD" "DAC: DACD" "D: DACD" "DACD" "D"
11799214-11799240 tlc5620: gain: "Gain: x2" "G: x2" "x2"
11799240-11799445 tlc5620: value: "DAC value: 122" "Value: 122" "Val: 122" "V: 122" "122"
11799163-11799189 tlc5620: bit: "1"
11799189-11799214 tlc5620: bit: "1"
11799214-11799240 tlc5620: bit: "1"
11799240-11799266 tlc5620: bit: "0"
11799266-11799291 tlc5620: bit: "1"
11799291-11799317 tlc5620: bit: "1"
11799317-11799343 tlc5620: bit: "1"
11799343-11799368 tlc5620: bit: "1"
11799368-11799394 tlc5620: bit: "0"
11799394-11799419 tlc5620: bit: "1"
11799419-11799445 tlc5620: bit: "0"
11799432-11799432 tlc5620: data-latch: "Falling edge on LOAD" "LOAD fall" "F"
11799163-11799445 tlc5620: reg-write: "Setting DACD register value to 3.15V" "DACD=3.15V"
11802939-11802990 tlc5620: dac-select: "DAC select: DACC" "DAC sel: DACC" "DAC: DACC" "D: DACC" "DACC" "C"
11802990-11803016 tlc5620: gain: "Gain: x2" "G: x2" "x2"
11803016-11803221 tlc5620: value: "DAC value: 108" "Value: 108" "Val: 108" "V: 108" "108"
11802939-11802964 tlc5620: bit: "1"
11802964-11802990 tlc5620: bit: "0"
11802990-11803016 tlc5620: bit: "1"
11803016-11803041 tlc5620: bit: "0"
11803041-11803067 tlc5620: bit: "1"
11803067-11803093 tlc5620: bit: "1"
11803093-11803118 tlc5620: bit: "0"
11803118-11803144 tlc5620: bit: "1"
11803144-11803169 tlc5620: bit: "1"
11803169-11803195 tlc5620: bit: "0"
11803195-11803221 tlc5620: bit: "0"
11803208-11803208 tlc5620: data-latch: "Falling edge on LOAD" "LOAD fall" "F"
11802939-11803221 tlc5620: reg-write: "Setting DACC register value to 2.78V" "DACC=2.78V"
11807844-11807844 tlc5620: ldac-fall: "Falling edge on LDAC" "LDAC fall" "LDAC" "L"
11795155-11807844 tlc5620: voltage-update-all: "Updating voltages: DACA=1.01V DACB=? DACC=2.78V DACD=3.15V" "DACA=1.01V DACB=? DACC=2.78V DACD=3.15V" "A=1.01V B=? C=2.78V D=3.15V"
11815080-11815132 tlc5620: dac-select: "DAC select: DACA" "DAC sel: DACA" "DAC: DACA" "D: DACA" "DACA" "A"
11815132-11815157 tlc5620: gain: "Gain: x1" "G: x1" "x1"
11815157-11815361 tlc5620: value: "DAC value: 73" "Value: 73" "Val: 73" "V: 73" "73"
11815080-11815106 tlc5620: bit: "0"
11815106-11815132 tlc5620: bit: "0"
11815132-11815157 tlc5620: bit: "0"
11815157-11815183 tlc5620: bit: "0"
11815183-11815208 tlc5620: bit: "1"
11815208-11815234 tlc5620: bit: "0"
11815234-11815260 tlc5620: bit: "0"
11815260-11815285 tlc5620: bit: "1"
11815285-11815311 tlc5620: bit: "0"
11815311-11815336 tlc5620: bit: "0"
11815336-11815361 tlc5620: bit: "1"
11815349-11815349 tlc5620: data-latch: "Falling edge on LOAD" "LOAD fall" "F"
11815080-11815361 tlc5620: reg-write: "Setting DACA register value to 0.94V" "DACA=0.94V"
11819156-11819207 tlc5620: dac-select: "DAC select: DACD" "DAC sel: DACD" "DAC: DACD" "D: DACD" "DACD" "D"
11819207-11819232 tlc5620: gain: "Gain: x2" "G: x2" "x2"
11819232-11819437 tlc5620: value: "DAC value: 122" "Value: 122" "Val: 122" "V: 122" "122"
11819156-11819181 tlc5620: bit: "1"
11819181-11819207 tlc5620: bit: "1"
11819207-11819232 tlc5620: bit: "1"
11819232-11819258 tlc5620: bit: "0"
11819258-11819284 tlc5620: bit: "1"
11819284-11819309 tlc5620: bit: "1"
11819309-11819335 tlc5620: bit: "1"
11819335-11819361 tlc5620: bit: "1"
11819361-11819386 tlc5620: bit: "0"
11819386-11819412 tlc5620: bit: "1"
11819412-11819437 tlc5620: bit: "0"
11819425-11819425 tlc5620: data-latch: "Falling edge on LOAD" "LOAD fall" "F"
11819156-11819437 tlc5620: reg-write: "Setting DACD register value to 3.15V" "DACD=3.15V"
11823177-11823228 tlc5620: dac-select: "DAC select: DACC" "DAC sel: DACC" "DAC: DACC" "D: DACC" "DACC" "C"
11823228-11823254 tlc5620: gain: "Gain: x2" "G: x2" "x2"
11823254-11823459 tlc5620: value: "DAC value: 108" "Value: 108" "Val: 108" "V: 108" "108"
11823177-11823203 tlc5620: bit: "1"
11823203-11823228 tlc5620: bit: "0"
11823228-11823254 tlc5620: bit: "1"
11823254-11823280 tlc5620: bit: "0"
11823280-11823305 tlc5620: bit: "1"
11823305-11823331 tlc5620: bit: "1"
11823331-11823356 tlc5620: bit: "0"
11823356-11823382 tlc5620: bit: "1"
11823382-11823408 tlc5620: bit: "1"
11823408-11823433 tlc5620: bit: "0"
11823433-11823459 tlc5620: bit: "0"
11823446-11823446 tlc5620: data-latch: "Falling edge on LOAD" "LOAD fall" "F"
11823177-11823459 tlc5620: reg-write: "Setting DACC register value to 2.78V" "DACC=2.78V"
11827888-11827888 tlc5620: ldac-fall: "Falling edge on LDAC" "LDAC fall" "LDAC" "L"
11815080-11827888 tlc5620: voltage-update-all: "Updating voltages: DACA=0.94V DACB=? DACC=2.78V DACD=3.15V" "DACA=0.94V DACB=? DACC=2.78V DACD=3.15V" "A=0.94V B=? C=2.78V D=3.15V"
11835047-11835098 tlc5620: dac-select: "DAC select: DACA" "DAC sel: DACA" "DAC: DACA" "D: DACA" "DACA" "A"
11835098-11835124 tlc5620: gain: "Gain: x1" "G: x1" "x1"
11835124-11835329 tlc5620: value: "DAC value: 69" "Value: 69" "Val: 69" "V: 69" "69"
11835047-11835073 tlc5620: bit: "0"
11835073-11835098 tlc5620: bit: "0"
11835098-11835124 tlc5620: bit: "0"
11835124-11835150 tlc5620: bit: "0"
11835150-11835175 tlc5620: bit: "1"
11835175-11835201 tlc5620: bit: "0"
11835201-11835226 tlc5620: bit: "0"
11835226-11835252 tlc5620: bit: "0"
11835252-11835278 tlc5620: bit: "1"
11835278-11835303 tlc5620: bit: "0"
11835303-11835329 tlc5620: bit: "1"
11835316-11835316 tlc5620: data-latch: "Falling edge on LOAD" "LOAD fall" "F"
11835047-11835329 tlc5620: reg-write: "Setting DACA register value to 0.89V" "DACA=0.89V"
11839102-11839153 tlc5620: dac-select: "DAC select: DACD" "DAC sel: DACD" "DAC: DACD" "D: DACD" "DACD" "D"
11839153-11839179 tlc5620: gain: "Gain: x2" "G: x2" "x2"
11839179-11839384 tlc5620: value: "DAC value: 122" "Value: 122" "Val: 122" "V: 122" "122"
11839102-11839128 tlc5620: bit: "1"
11839128-11839153 tlc5620: bit: "1"
11839153-11839179 tlc5620: bit: "1"
11839179-11839204 tlc5620: bit: "0"
11839204-11839230 tlc5620: bit: "1"
11839230-11839256 tlc5620: bit: "1"
11839256-11839281 tlc5620: bit: "1"
11839281-11839307 tlc5620: bit: "1"
11839307-11839332 tlc5620: bit: "0"
11839332-11839358 tlc5620: bit: "1"
11839358-11839384 tlc5620: bit: "0"
11839371-11839371 tlc5620: data-latch: "Falling edge on LOAD" "LOAD fall" "F"
11839102-11839384 tlc5620: reg-write: "Setting DACD register value to 3.15V" "DACD=3.15V"
11843203-11843254 tlc5620: dac-select: "DAC select: DACC" "DAC sel: DACC" "DAC: DACC" "D: DACC" "DACC" "C"
11843254-11843280 tlc5620: gain: "Gain: x2" "G: x2" "x2"
11843280-11843485 tlc5620: value: "DAC value: 108" "Value: 108" "Val: 108" "V: 108" "108"
11843203-11843228 tlc5620: bit: "1"
11843228-11843254 tlc5620: bit: "0"
11843254-11843280 tlc5620: bit: "1"
11843280-11843305 tlc5620: bit: "0"
11843305-11843331 tlc5620: bit: "1"
11843331-11843357 tlc5620: bit: "1"
11843357-11843382 tlc5620: bit: "0"
11843382-11843408 tlc5620: bit: "1"
11843408-11843433 tlc5620: bit: "1"
11843433-11843459 tlc5620: bit: "0"
11843459-11843485 tlc5620: bit: "0"
11843472-11843472 tlc5620: data-latch: "Falling edge on LOAD" "LOAD fall" "F"
11843203-11843485 tlc5620: reg-write: "Setting DACC register value to 2.78V" "DACC=2.78V"
11848067-11848067 tlc5620: ldac-fall: "Falling edge on LDAC" "LDAC fall" "LDAC" "L"
11835047-11848067 tlc5620: voltage-update-all: "Updating voltages: DACA=0.89V DACB=? DACC=2.78V DACD=3.15V" "DACA=0.89V DACB=? DACC=2.78V DACD=3.15V" "A=0.89V B=? C=2.78V D=3.15V"
11855022-11855073 tlc5620: dac-select: "DAC select: DACA" "DAC sel: DACA" "DAC: DACA" "D: DACA" "DACA" "A"
11855073-11855098 tlc5620: gain: "Gain: x1" "G: x1" "x1"
11855098-11855303 tlc5620: value: "DAC value: 66" "Value: 66" "Val: 66" "V: 66" "66"
11855022-11855047 tlc5620: bit: "0"
11855047-11855073 tlc5620: bit: "0"
11855073-11855098 tlc5620: bit: "0"
11855098-11855124 tlc5620: bit: "0"
11855124-11855150 tlc5620: bit: "1"
11855150-11855175 tlc5620: bit: "0"
11855175-11855201 tlc5620: bit: "0"
11855201-11855226 tlc5620: bit: "0"
11855226-11855252 tlc5620: bit: "0"
11855252-11855278 tlc5620: bit: "1"
11855278-11855303 tlc5620: bit: "0"
11855291-11855291 tlc5620: data-latch: "Falling edge on LOAD" "LOAD fall" "F"
11855022-11855303 tlc5620: reg-write: "Setting DACA register value to 0.85V" "DACA=0.85V"
11864456-11864507 tlc5620: dac-select: "DAC select: DACD" "DAC sel: DACD" "DAC: DACD" "D: DACD" "DACD" "D"
11864507-11864532 tlc5620: gain: "Gain: x2" "G: x2" "x2"
11864532-11864737 tlc5620: value: "DAC value: 122" "Value: 122" "Val: 122" "V: 122" "122"
11864456-11864481 tlc5620: bit: "1"
11864481-11864507 tlc5620: bit: "1"
11864507-11864532 tlc5620: bit: "1"
11864532-11864558 tlc5620: bit: "0"
11864558-11864584 tlc5620: bit: "1"
11864584-11864609 tlc5620: bit: "1"
11864609-11864635 tlc5620: bit: "1"
11864635-11864660 tlc5620: bit: "1"
11864660-11864686 tlc5620: bit: "0"
11864686-11864712 tlc5620: bit: "1"
11864712-11864737 tlc5620: bit: "0"
11864724-11864724 tlc5620: data-latch: "Falling edge on LOAD" "LOAD fall" "F"
11864456-11864737 tlc5620: reg-write: "Setting DACD register value to 3.15V" "DACD=3.15V"
11868474-11868526 tlc5620: dac-select: "DAC select: DACC" "DAC sel: DACC" "DAC: DACC" "D: DACC" "DACC" "C"
11868526-11868551 tlc5620: gain: "Gain: x2" "G: x2" "x2"
11868551-11868756 tlc5620: value: "DAC value: 108" "Value: 108" "Val: 108" "V: 108" "108"
11868474-11868500 tlc5620: bit: "1"
11868500-11868526 tlc5620: bit: "0"
11868526-11868551 tlc5620: bit: "1"
11868551-11868577 tlc5620: bit: "0"
11868577-11868603 tlc5620: bit: "1"
11868603-11868628 tlc5620: bit: "1"
11868628-11868654 tlc5620: bit: "0"
11868654-11868679 tlc5620: bit: "1"
11868679-11868705 tlc5620: bit: "1"
11868705-11868731 tlc5620: bit: "0"
11868731-11868756 tlc5620: bit: "0"
11868743-11868743 tlc5620: data-latch: "Falling edge on LOAD" "LOAD fall" "F"
11868474-11868756 tlc5620: reg-write: "Setting DACC register value to 2.78V" "DACC=2.78V"
11873390-11873390 tlc5620: ldac-fall: "Falling edge on LDAC" "LDAC fall" "LDAC" "L"
11855022-11873390 tlc5620: voltage-update-all: "Updating voltages: DACA=0.85V DACB=? DACC=2.78V DACD=3.15V" "DACA=0.85V DACB=? DACC=2.78V DACD=3.15V" "A=0.85V B=? C=2.78V D=3.15V"
11882760-11882811 tlc5620: dac-select: "DAC select: DACA" "DAC sel: DACA" "DAC: DACA" "D: DACA" "DACA" "A"
11882811-11882837 tlc5620: gain: "Gain: x1" "G: x1" "x1"
11882837-11883042 tlc5620: value: "DAC value: 58" "Value: 58" "Val: 58" "V: 58" "58"
11882760-11882785 tlc5620: bit: "0"
11882785-11882811 tlc5620: bit: "0"
11882811-11882837 tlc5620: bit: "0"
11882837-11882862 tlc5620: bit: "0"
11882862-11882888 tlc5620: bit: "0"
11882888-11882914 tlc5620: bit: "1"
11882914-11882939 tlc5620: bit: "1"
11882939-11882965 tlc5620: bit: "1"
11882965-11882990 tlc5620: bit: "0"
11882990-11883016 tlc5620: bit: "1"
11883016-11883042 tlc5620: bit: "0"
11883029-11883029 tlc5620: data-latch: "Falling edge on LOAD" "LOAD fall" "F"
11882760-11883042 tlc5620: reg-write: "Setting DACA register value to 0.75V" "DACA=0.75V"
11886430-11886482 tlc5620: dac-select: "DAC select: DACD" "DAC sel: DACD" "DAC: DACD" "D: DACD" "DACD" "D"
11886482-11886507 tlc5620: gain: "Gain: x2" "G: x2" "x2"
11886507-11886712 tlc5620: value: "DAC value: 122" "Value: 122" "Val: 122" "V: 122" "122"
11886430-11886456 tlc5620: bit: "1"
11886456-11886482 tlc5620: bit: "1"
11886482-11886507 tlc5620: bit: "1"
11886507-11886533 tlc5620: bit: "0"
11886533-11886559 tlc5620: bit: "1"
11886559-11886584 tlc5620: bit: "1"
11886584-11886610 tlc5620: bit: "1"
11886610-11886635 tlc5620: bit: "1"
11886635-11886661 tlc5620: bit: "0"
11886661-11886687 tlc5620: bit: "1"
11886687-11886712 tlc5620: bit: "0"
11886699-11886699 tlc5620: data-latch: "Falling edge on LOAD" "LOAD fall" "F"
11886430-11886712 tlc5620: reg-write: "Setting DACD register value to 3.15V" "DACD=3.15V"
11890675-11890726 tlc5620: dac-select: "DAC select: DACC" "DAC sel: DACC" "DAC: DACC" "D: DACC" "DACC" "C"
11890726-11890752 tlc5620: gain: "Gain: x2" "G: x2" "x2"
11890752-11890957 tlc5620: value: "DAC value: 108" "Value: 108" "Val: 108" "V: 108" "108"
11890675-11890700 tlc5620: bit: "1"
11890700-11890726 tlc5620: bit: "0"
11890726-11890752 tlc5620: bit: "1"
11890752-11890777 tlc5620: bit: "0"
11890777-11890803 tlc5620: bit: "1"
11890803-11890829 tlc5620: bit: "1"
11890829-11890854 tlc5620: bit: "0"
11890854-11890880 tlc5620: bit: "1"
11890880-11890905 tlc5620: bit: "1"
11890905-11890931 tlc5620: bit: "0"
11890931-11890957 tlc5620: bit: "0"
11890944-11890944 tlc5620: data-latch: "Falling edge on LOAD" "LOAD fall" "F"
11890675-11890957 tlc5620: reg-write: "Setting DACC register value to 2.78V" "DACC=2.78V"
11895375-11895375 tlc5620: ldac-fall: "Falling edge on LDAC" "LDAC fall" "LDAC" "L"
11882760-11895375 tlc5620: voltage-update-all: "Updating voltages: DACA=0.75V DACB=? DACC=2.78V DACD=3.15V" "DACA=0.75V DACB=? DACC=2.78V DACD=3.15V" "A=0.75V B=? C=2.78V D=3.15V"
11902342-11902394 tlc5620: dac-select: "DAC select: DACA" "DAC sel: DACA" "DAC: DACA" "D: DACA" "DACA" "A"
11902394-11902419 tlc5620: gain: "Gain: x1" "G: x1" "x1"
11902419-11902624 tlc5620: value: "DAC value: 56" "Value: 56" "Val: 56" "V: 56" "56"
11902342-11902368 tlc5620: bit: "0"
11902368-11902394 tlc5620: bit: "0"
11902394-11902419 tlc5620: bit: "0"
11902419-11902445 tlc5620: bit: "0"
11902445-11902471 tlc5620: bit: "0"
11902471-11902496 tlc5620: bit: "1"
11902496-11902522 tlc5620: bit: "1"
11902522-11902547 tlc5620: bit: "1"
11902547-11902573 tlc5620: bit: "0"
11902573-11902599 tlc5620: bit: "0"
11902599-11902624 tlc5620: bit: "0"
11902611-11902611 tlc5620: data-latch: "Falling edge on LOAD" "LOAD fall" "F"
11902342-11902624 tlc5620: reg-write: "Setting DACA register value to 0.72V" "DACA=0.72V"
11906402-11906454 tlc5620: dac-select: "DAC select: DACD" "DAC sel: DACD" "DAC: DACD" "D: DACD" "DACD" "D"
11906454-11906479 tlc5620: gain: "Gain: x2" "G: x2" "x2"
11906479-11906684 tlc5620: value: "DAC value: 122" "Value: 122" "Val: 122" "V: 122" "122"
11906402-11906428 tlc5620: bit: "1"
11906428-11906454 tlc5620: bit: "1"
11906454-11906479 tlc5620: bit: "1"
11906479-11906505 tlc5620: bit: "0"
11906505-11906530 tlc5620: bit: "1"
11906530-11906556 tlc5620: bit: "1"
11906556-11906582 tlc5620: bit: "1"
11906582-11906607 tlc5620: bit: "1"
11906607-11906633 tlc5620: bit: "0"
11906633-11906659 tlc5620: bit: "1"
11906659-11906684 tlc5620: bit: "0"
11906671-11906671 tlc5620: data-latch: "Falling edge on LOAD" "LOAD fall" "F"
11906402-11906684 tlc5620: reg-write: "Setting DACD register value to 3.15V" "DACD=3.15V"
11910447-11910498 tlc5620: dac-select: "DAC select: DACC" "DAC sel: DACC" "DAC: DACC" "D: DACC" "DACC" "C"
11910498-11910524 tlc5620: gain: "Gain: x2" "G: x2" "x2"
11910524-11910729 tlc5620: value: "DAC value: 108" "Value: 108" "Val: 108" "V: 108" "108"
11910447-11910473 tlc5620: bit: "1"
11910473-11910498 tlc5620: bit: "0"
11910498-11910524 tlc5620: bit: "1"
11910524-11910549 tlc5620: bit: "0"
11910549-11910575 tlc5620: bit: "1"
11910575-11910601 tlc5620: bit: "1"
11910601-11910626 tlc5620: bit: "0"
11910626-11910652 tlc5620: bit: "1"
11910652-11910678 tlc5620: bit: "1"
11910678-11910703 tlc5620: bit: "0"
11910703-11910729 tlc5620: bit: "0"
11910716-11910716 tlc5620: data-latch: "Falling edge on LOAD" "LOAD fall" "F"
11910447-11910729 tlc5620: reg-write: "Setting DACC register value to 2.78V" "DACC=2.78V"
11915352-11915352 tlc5620: ldac-fall: "Falling edge on LDAC" "LDAC fall" "LDAC" "L"
11902342-11915352 tlc5620: voltage-update-all: "Updating voltages: DACA=0.72V DACB=? DACC=2.78V DACD=3.15V" "DACA=0.72V DACB=? DACC=2.78V DACD=3.15V" "A=0.72V B=? C=2.78V D=3.15V"
11922376-11922427 tlc5620: dac-select: "DAC select: DACA" "DAC sel: DACA" "DAC: DACA" "D: DACA" "DACA" "A"
11922427-11922453 tlc5620: gain: "Gain: x1" "G: x1" "x1"
11922453-11922658 tlc5620: value: "DAC value: 54" "Value: 54" "Val: 54" "V: 54" "54"
11922376-11922401 tlc5620: bit: "0"
11922401-11922427 tlc5620: bit: "0"
11922427-11922453 tlc5620: bit: "0"
11922453-11922478 tlc5620: bit: "0"
11922478-11922504 tlc5620: bit: "0"
11922504-11922530 tlc5620: bit: "1"
11922530-11922555 tlc5620: bit: "1"
11922555-11922581 tlc5620: bit: "0"
11922581-11922606 tlc5620: bit: "1"
11922606-11922632 tlc5620: bit: "1"
11922632-11922658 tlc5620: bit: "0"
11922645-11922645 tlc5620: data-latch: "Falling edge on LOAD" "LOAD fall" "F"
11922376-11922658 tlc5620: reg-write: "Setting DACA register value to 0.70V" "DACA=0.70V"
11926346-11926397 tlc5620: dac-select: "DAC select: DACD" "DAC sel: DACD" "DAC: DACD" "D: DACD" "DACD" "D"
11926397-11926423 tlc5620: gain: "Gain: x2" "G: x2" "x2"
11926423-11926628 tlc5620: value: "DAC value: 122" "Value: 122" "Val: 122" "V: 122" "122"
11926346-11926372 tlc5620: bit: "1"
11926372-11926397 tlc5620: bit: "1"
11926397-11926423 tlc5620: bit: "1"
11926423-11926449 tlc5620: bit: "0"
11926449-11926474 tlc5620: bit: "1"
11926474-11926500 tlc5620: bit: "1"
11926500-11926525 tlc5620: bit: "1"
11926525-11926551 tlc5620: bit: "1"
11926551-11926577 tlc5620: bit: "0"
11926577-11926602 tlc5620: bit: "1"
11926602-11926628 tlc5620: bit: "0"
11926615-11926615 tlc5620: data-latch: "Falling edge on LOAD" "LOAD fall" "F"
11926346-11926628 tlc5620: reg-write: "Setting DACD register value to 3.15V" "DACD=3.15V"
11930380-11930432 tlc5620: dac-select: "DAC select: DACC" "DAC sel: DACC" "DAC: DACC" "D: DACC" "DACC" "C"
11930432-11930457 tlc5620: gain: "Gain: x2" "G: x2" "x2"
11930457-11930662 tlc5620: value: "DAC value: 108" "Value: 108" "Val: 108" "V: 108" "108"
11930380-11930406 tlc5620: bit: "1"
11930406-11930432 tlc5620: bit: "0"
11930432-11930457 tlc5620: bit: "1"
11930457-11930483 tlc5620: bit: "0"
11930483-11930509 tlc5620: bit: "1"
11930509-11930534 tlc5620: bit: "1"
11930534-11930560 tlc5620: bit: "0"
11930560-11930585 tlc5620: bit: "1"
11930585-11930611 tlc5620: bit: "1"
11930611-11930637 tlc5620: bit: "0"
11930637-11930662 tlc5620: bit: "0"
11930649-11930649 tlc5620: data-latch: "Falling edge on LOAD" "LOAD fall" "F"
11930380-11930662 tlc5620: reg-write: "Setting DACC register value to 2.78V" "DACC=2.78V"
11935329-11935329 tlc5620: ldac-fall: "Falling edge on LDAC" "LDAC fall" "LDAC" "L"
11922376-11935329 tlc5620: voltage-update-all: "Updating voltages: DACA=0.70V DACB=? DACC=2.78V DACD=3.15V" "DACA=0.70V DACB=? DACC=2.78V DACD=3.15V" "A=0.70V B=? C=2.78V D=3.15V"
11942571-11942622 tlc5620: dac-select: "DAC select: DACA" "DAC sel: DACA" "DAC: DACA" "D: DACA" "DACA" "A"
11942622-11942647 tlc5620: gain: "Gain: x1" "G: x1" "x1"
11942647-11942852 tlc5620: value: "DAC value: 48" "Value: 48" "Val: 48" "V: 48" "48"
11942571-11942596 tlc5620: bit: "0"
11942596-11942622 tlc5620: bit: "0"
11942622-11942647 tlc5620: bit: "0"
11942647-11942673 tlc5620: bit: "0"
11942673-11942699 tlc5620: bit: "0"
11942699-11942724 tlc5620: bit: "1"
11942724-11942750 tlc5620: bit: "1"
11942750-11942775 tlc5620: bit: "0"
11942775-11942801 tlc5620: bit: "0"
11942801-11942827 tlc5620: bit: "0"
11942827-11942852 tlc5620: bit: "0"
11942840-11942840 tlc5620: data-latch: "Falling edge on LOAD" "LOAD fall" "F"
11942571-11942852 tlc5620: reg-write: "Setting DACA register value to 0.62V" "DACA=0.62V"
11946410-11946461 tlc5620: dac-select: "DAC select: DACD" "DAC sel: DACD" "DAC: DACD" "D: DACD" "DACD" "D"
11946461-11946487 tlc5620: gain: "Gain: x2" "G: x2" "x2"
11946487-11946692 tlc5620: value: "DAC value: 122" "Value: 122" "Val: 122" "V: 122" "122"
11946410-11946436 tlc5620: bit: "1"
11946436-11946461 tlc5620: bit: "1"
11946461-11946487 tlc5620: bit: "1"
11946487-11946513 tlc5620: bit: "0"
11946513-11946538 tlc5620: bit: "1"
11946538-11946564 tlc5620: bit: "1"
11946564-11946590 tlc5620: bit: "1"
11946590-11946615 tlc5620: bit: "1"
11946615-11946641 tlc5620: bit: "0"
11946641-11946666 tlc5620: bit: "1"
11946666-11946692 tlc5620: bit: "0"
11946679-11946679 tlc5620: data-latch: "Falling edge on LOAD" "LOAD fall" "F"
11946410-11946692 tlc5620: reg-write: "Setting DACD register value to 3.15V" "DACD=3.15V"
11950486-11950537 tlc5620: dac-select: "DAC select: DACC" "DAC sel: DACC" "DAC: DACC" "D: DACC" "DACC" "C"
11950537-11950562 tlc5620: gain: "Gain: x2" "G: x2" "x2"
11950562-11950767 tlc5620: value: "DAC value: 108" "Value: 108" "Val: 108" "V: 108" "108"
11950486-11950511 tlc5620: bit: "1"
11950511-11950537 tlc5620: bit: "0"
11950537-11950562 tlc5620: bit: "1"
11950562-11950588 tlc5620: bit: "0"
11950588-11950614 tlc5620: bit: "1"
11950614-11950639 tlc5620: bit: "1"
11950639-11950665 tlc5620: bit: "0"
11950665-11950690 tlc5620: bit: "1"
11950690-11950716 tlc5620: bit: "1"
11950716-11950742 tlc5620: bit: "0"
11950742-11950767 tlc5620: bit: "0"
11950755-11950755 tlc5620: data-latch: "Falling edge on LOAD" "LOAD fall" "F"
11950486-11950767 tlc5620: reg-write: "Setting DACC register value to 2.78V" "DACC=2.78V"
11955337-11955337 tlc5620: ldac-fall: "Falling edge on LDAC" "LDAC fall" "LDAC" "L"
11942571-11955337 tlc5620: voltage-update-all: "Updating voltages: DACA=0.62V DACB=? DACC=2.78V DACD=3.15V" "DACA=0.62V DACB=? DACC=2.78V DACD=3.15V" "A=0.62V B=? C=2.78V D=3.15V"
11962727-11962778 tlc5620: dac-select: "DAC select: DACA" "DAC sel: DACA" "DAC: DACA" "D: DACA" "DACA" "A"
11962778-11962804 tlc5620: gain: "Gain: x1" "G: x1" "x1"
11962804-11963009 tlc5620: value: "DAC value: 46" "Value: 46" "Val: 46" "V: 46" "46"
11962727-11962753 tlc5620: bit: "0"
11962753-11962778 tlc5620: bit: "0"
11962778-11962804 tlc5620: bit: "0"
11962804-11962829 tlc5620: bit: "0"
11962829-11962855 tlc5620: bit: "0"
11962855-11962881 tlc5620: bit: "1"
11962881-11962906 tlc5620: bit: "0"
11962906-11962932 tlc5620: bit: "1"
11962932-11962957 tlc5620: bit: "1"
11962957-11962983 tlc5620: bit: "1"
11962983-11963009 tlc5620: bit: "0"
11962996-11962996 tlc5620: data-latch: "Falling edge on LOAD" "LOAD fall" "F"
11962727-11963009 tlc5620: reg-write: "Setting DACA register value to 0.59V" "DACA=0.59V"
11966567-11966618 tlc5620: dac-select: "DAC select: DACD" "DAC sel: DACD" "DAC: DACD" "D: DACD" "DACD" "D"
11966618-11966643 tlc5620: gain: "Gain: x2" "G: x2" "x2"
11966643-11966848 tlc5620: value: "DAC value: 122" "Value: 122" "Val: 122" "V: 122" "122"
11966567-11966592 tlc5620: bit: "1"
11966592-11966618 tlc5620: bit: "1"
11966618-11966643 tlc5620: bit: "1"
11966643-11966669 tlc5620: bit: "0"
11966669-11966695 tlc5620: bit: "1"
11966695-11966720 tlc5620: bit: "1"
11966720-11966746 tlc5620: bit: "1"
11966746-11966771 tlc5620: bit: "1"
11966771-11966797 tlc5620: bit: "0"
11966797-11966823 tlc5620: bit: "1"
11966823-11966848 tlc5620: bit: "0"
11966836-11966836 tlc5620: data-latch: "Falling edge on LOAD" "LOAD fall" "F"
11966567-11966848 tlc5620: reg-write: "Setting DACD register value to 3.15V" "DACD=3.15V"
11970329-11970381 tlc5620: dac-select: "DAC select: DACC" "DAC sel: DACC" "DAC: DACC" "D: DACC" "DACC" "C"
11970381-11970406 tlc5620: gain: "Gain: x2" "G: x2" "x2"
11970406-11970611 tlc5620: value: "DAC value: 108" "Value: 108" "Val: 108" "V: 108" "108"
11970329-11970355 tlc5620: bit: "1"
11970355-11970381 tlc5620: bit: "0"
11970381-11970406 tlc5620: bit: "1"
11970406-11970432 tlc5620: bit: "0"
11970432-11970457 tlc5620: bit: "1"
11970457-11970483 tlc5620: bit: "1"
11970483-11970509 tlc5620: bit: "0"
11970509-11970534 tlc5620: bit: "1"
11970534-11970560 tlc5620: bit: "1"
11970560-11970586 tlc5620: bit: "0"
11970586-11970611 tlc5620: bit: "0"
11970598-11970598 tlc5620: data-latch: "Falling edge on LOAD" "LOAD fall" "F"
11970329-11970611 tlc5620: reg-write: "Setting DACC register value to 2.78V" "DACC=2.78V"
11975237-11975237 tlc5620: ldac-fall: "Falling edge on LDAC" "LDAC fall" "LDAC" "L"
11962727-11975237 tlc5620: voltage-update-all: "Updating voltages: DACA=0.59V DACB=? DACC=2.78V DACD=3.15V" "DACA=0.59V DACB=? DACC=2.78V DACD=3.15V" "A=0.59V B=? C=2.78V D=3.15V"
11982494-11982545 tlc5620: dac-select: "DAC select: DACA" "DAC sel: DACA" "DAC: DACA" "D: DACA" "DACA" "A"
11982545-11982571 tlc5620: gain: "Gain: x1" "G: x1" "x1"
11982571-11982776 tlc5620: value: "DAC value: 44" "Value: 44" "Val: 44" "V: 44" "44"
11982494-11982520 tlc5620: bit: "0"
11982520-11982545 tlc5620: bit: "0"
11982545-11982571 tlc5620: bit: "0"
11982571-11982596 tlc5620: bit: "0"
11982596-11982622 tlc5620: bit: "0"
11982622-11982648 tlc5620: bit: "1"
11982648-11982673 tlc5620: bit: "0"
11982673-11982699 tlc5620: bit: "1"
11982699-11982724 tlc5620: bit: "1"
11982724-11982750 tlc5620: bit: "0"
11982750-11982776 tlc5620: bit: "0"
11982763-11982763 tlc5620: data-latch: "Falling edge on LOAD" "LOAD fall" "F"
11982494-11982776 tlc5620: reg-write: "Setting DACA register value to 0.57V" "DACA=0.57V"
11986746-11986797 tlc5620: dac-select: "DAC select: DACD" "DAC sel: DACD" "DAC: DACD" "D: DACD" "DACD" "D"
11986797-11986823 tlc5620: gain: "Gain: x2" "G: x2" "x2"
11986823-11987028 tlc5620: value: "DAC value: 122" "Value: 122" "Val: 122" "V: 122" "122"
11986746-11986772 tlc5620: bit: "1"
11986772-11986797 tlc5620: bit: "1"
11986797-11986823 tlc5620: bit: "1"
11986823-11986848 tlc5620: bit: "0"
11986848-11986874 tlc5620: bit: "1"
11986874-11986900 tlc5620: bit: "1"
11986900-11986925 tlc5620: bit: "1"
11986925-11986951 tlc5620: bit: "1"
11986951-11986976 tlc5620: bit: "0"
11986976-11987002 tlc5620: bit: "1"
11987002-11987028 tlc5620: bit: "0"
11987015-11987015 tlc5620: data-latch: "Falling edge on LOAD" "LOAD fall" "F"
11986746-11987028 tlc5620: reg-write: "Setting DACD register value to 3.15V" "DACD=3.15V"
11990547-11990598 tlc5620: dac-select: "DAC select: DACC" "DAC sel: DACC" "DAC: DACC" "D: DACC" "DACC" "C"
11990598-11990624 tlc5620: gain: "Gain: x2" "G: x2" "x2"
11990624-11990829 tlc5620: value: "DAC value: 108" "Value: 108" "Val: 108" "V: 108" "108"
11990547-11990573 tlc5620: bit: "1"
11990573-11990598 tlc5620: bit: "0"
11990598-11990624 tlc5620: bit: "1"
11990624-11990650 tlc5620: bit: "0"
11990650-11990675 tlc5620: bit: "1"
11990675-11990701 tlc5620: bit: "1"
11990701-11990727 tlc5620: bit: "0"
11990727-11990752 tlc5620: bit: "1"
11990752-11990778 tlc5620: bit: "1"
11990778-11990803 tlc5620: bit: "0"
11990803-11990829 tlc5620: bit: "0"
11990816-11990816 tlc5620: data-latch: "Falling edge on LOAD" "LOAD fall" "F"
11990547-11990829 tlc5620: reg-write: "Setting DACC register value to 2.78V" "DACC=2.78V"
11995212-11995212 tlc5620: ldac-fall: "Falling edge on LDAC" "LDAC fall" "LDAC" "L"
11982494-11995212 tlc5620: voltage-update-all: "Updating voltages: DACA=0.57V DACB=? DACC=2.78V DACD=3.15V" "DACA=0.57V DACB=? DACC=2.78V DACD=3.15V" "A=0.57V B=? C=2.78V D=3.15V"
12002453-12002504 tlc5620: dac-select: "DAC select: DACA" "DAC sel: DACA" "DAC: DACA" "D: DACA" "DACA" "A"
12002504-12002530 tlc5620: gain: "Gain: x1" "G: x1" "x1"
12002530-12002735 tlc5620: value: "DAC value: 41" "Value: 41" "Val: 41" "V: 41" "41"
12002453-12002479 tlc5620: bit: "0"
12002479-12002504 tlc5620: bit: "0"
12002504-12002530 tlc5620: bit: "0"
12002530-12002555 tlc5620: bit: "0"
12002555-12002581 tlc5620: bit: "0"
12002581-12002607 tlc5620: bit: "1"
12002607-12002632 tlc5620: bit: "0"
12002632-12002658 tlc5620: bit: "1"
12002658-12002684 tlc5620: bit: "0"
12002684-12002709 tlc5620: bit: "0"
12002709-12002735 tlc5620: bit: "1"
12002722-12002722 tlc5620: data-latch: "Falling edge on LOAD" "LOAD fall" "F"
12002453-12002735 tlc5620: reg-write: "Setting DACA register value to 0.53V" "DACA=0.53V"
12006505-12006556 tlc5620: dac-select: "DAC select: DACD" "DAC sel: DACD" "DAC: DACD" "D: DACD" "DACD" "D"
12006556-12006582 tlc5620: gain: "Gain: x2" "G: x2" "x2"
12006582-12006787 tlc5620: value: "DAC value: 122" "Value: 122" "Val: 122" "V: 122" "122"
12006505-12006531 tlc5620: bit: "1"
12006531-12006556 tlc5620: bit: "1"
12006556-12006582 tlc5620: bit: "1"
12006582-12006608 tlc5620: bit: "0"
12006608-12006633 tlc5620: bit: "1"
12006633-12006659 tlc5620: bit: "1"
12006659-12006685 tlc5620: bit: "1"
12006685-12006710 tlc5620: bit: "1"
12006710-12006736 tlc5620: bit: "0"
12006736-12006761 tlc5620: bit: "1"
12006761-12006787 tlc5620: bit: "0"
12006774-12006774 tlc5620: data-latch: "Falling edge on LOAD" "LOAD fall" "F"
12006505-12006787 tlc5620: reg-write: "Setting DACD register value to 3.15V" "DACD=3.15V"
12010529-12010581 tlc5620: dac-select: "DAC select: DACC" "DAC sel: DACC" "DAC: DACC" "D: DACC" "DACC" "C"
12010581-12010606 tlc5620: gain: "Gain: x2" "G: x2" "x2"
12010606-12010811 tlc5620: value: "DAC value: 108" "Value: 108" "Val: 108" "V: 108" "108"
12010529-12010555 tlc5620: bit: "1"
12010555-12010581 tlc5620: bit: "0"
12010581-12010606 tlc5620: bit: "1"
12010606-12010632 tlc5620: bit: "0"
12010632-12010657 tlc5620: bit: "1"
12010657-12010683 tlc5620: bit: "1"
12010683-12010709 tlc5620: bit: "0"
12010709-12010734 tlc5620: bit: "1"
12010734-12010760 tlc5620: bit: "1"
12010760-12010786 tlc5620: bit: "0"
12010786-12010811 tlc5620: bit: "0"
12010798-12010798 tlc5620: data-latch: "Falling edge on LOAD" "LOAD fall" "F"
12010529-12010811 tlc5620: reg-write: "Setting DACC register value to 2.78V" "DACC=2.78V"
12015447-12015447 tlc5620: ldac-fall: "Falling edge on LDAC" "LDAC fall" "LDAC" "L"
12002453-12015447 tlc5620: voltage-update-all: "Updating voltages: DACA=0.53V DACB=? DACC=2.78V DACD=3.15V" "DACA=0.53V DACB=? DACC=2.78V DACD=3.15V" "A=0.53V B=? C=2.78V D=3.15V"
12022415-12022466 tlc5620: dac-select: "DAC select: DACA" "DAC sel: DACA" "DAC: DACA" "D: DACA" "DACA" "A"
12022466-12022491 tlc5620: gain: "Gain: x1" "G: x1" "x1"
12022491-12022696 tlc5620: value: "DAC value: 37" "Value: 37" "Val: 37" "V: 37" "37"
12022415-12022440 tlc5620: bit: "0"
12022440-12022466 tlc5620: bit: "0"
12022466-12022491 tlc5620: bit: "0"
12022491-12022517 tlc5620: bit: "0"
12022517-12022543 tlc5620: bit: "0"
12022543-12022568 tlc5620: bit: "1"
12022568-12022594 tlc5620: bit: "0"
12022594-12022620 tlc5620: bit: "0"
12022620-12022645 tlc5620: bit: "1"
12022645-12022671 tlc5620: bit: "0"
12022671-12022696 tlc5620: bit: "1"
12022684-12022684 tlc5620: data-latch: "Falling edge on LOAD" "LOAD fall" "F"
12022415-12022696 tlc5620: reg-write: "Setting DACA register value to 0.48V" "DACA=0.48V"
12026462-12026513 tlc5620: dac-select: "DAC select: DACD" "DAC sel: DACD" "DAC: DACD" "D: DACD" "DACD" "D"
12026513-12026539 tlc5620: gain: "Gain: x2" "G: x2" "x2"
12026539-12026744 tlc5620: value: "DAC value: 122" "Value: 122" "Val: 122" "V: 122" "122"
12026462-12026487 tlc5620: bit: "1"
12026487-12026513 tlc5620: bit: "1"
12026513-12026539 tlc5620: bit: "1"
12026539-12026564 tlc5620: bit: "0"
12026564-12026590 tlc5620: bit: "1"
12026590-12026615 tlc5620: bit: "1"
12026615-12026641 tlc5620: bit: "1"
12026641-12026667 tlc5620: bit: "1"
12026667-12026692 tlc5620: bit: "0"
12026692-12026718 tlc5620: bit: "1"
12026718-12026744 tlc5620: bit: "0"
12026731-12026731 tlc5620: data-latch: "Falling edge on LOAD" "LOAD fall" "F"
12026462-12026744 tlc5620: reg-write: "Setting DACD register value to 3.15V" "DACD=3.15V"
12030517-12030568 tlc5620: dac-select: "DAC select: DACC" "DAC sel: DACC" "DAC: DACC" "D: DACC" "DACC" "C"
12030568-12030593 tlc5620: gain: "Gain: x2" "G: x2" "x2"
12030593-12030798 tlc5620: value: "DAC value: 108" "Value: 108" "Val: 108" "V: 108" "108"
12030517-12030542 tlc5620: bit: "1"
12030542-12030568 tlc5620: bit: "0"
12030568-12030593 tlc5620: bit: "1"
12030593-12030619 tlc5620: bit: "0"
12030619-12030645 tlc5620: bit: "1"
12030645-12030670 tlc5620: bit: "1"
12030670-12030696 tlc5620: bit: "0"
12030696-12030722 tlc5620: bit: "1"
12030722-12030747 tlc5620: bit: "1"
12030747-12030773 tlc5620: bit: "0"
12030773-12030798 tlc5620: bit: "0"
12030786-12030786 tlc5620: data-latch: "Falling edge on LOAD" "LOAD fall" "F"
12030517-12030798 tlc5620: reg-write: "Setting DACC register value to 2.78V" "DACC=2.78V"
12035627-12035627 tlc5620: ldac-fall: "Falling edge on LDAC" "LDAC fall" "LDAC" "L"
12022415-12035627 tlc5620: voltage-update-all: "Updating voltages: DACA=0.48V DACB=? DACC=2.78V DACD=3.15V" "DACA=0.48V DACB=? DACC=2.78V DACD=3.15V" "A=0.48V B=? C=2.78V D=3.15V"
12042384-12042435 tlc5620: dac-select: "DAC select: DACA" "DAC sel: DACA" "DAC: DACA" "D: DACA" "DACA" "A"
12042435-12042461 tlc5620: gain: "Gain: x1" "G: x1" "x1"
12042461-12042666 tlc5620: value: "DAC value: 36" "Value: 36" "Val: 36" "V: 36" "36"
12042384-12042410 tlc5620: bit: "0"
12042410-12042435 tlc5620: bit: "0"
12042435-12042461 tlc5620: bit: "0"
12042461-12042486 tlc5620: bit: "0"
12042486-12042512 tlc5620: bit: "0"
12042512-12042538 tlc5620: bit: "1"
12042538-12042563 tlc5620: bit: "0"
12042563-12042589 tlc5620: bit: "0"
12042589-12042615 tlc5620: bit: "1"
12042615-12042640 tlc5620: bit: "0"
12042640-12042666 tlc5620: bit: "0"
12042653-12042653 tlc5620: data-latch: "Falling edge on LOAD" "LOAD fall" "F"
12042384-12042666 tlc5620: reg-write: "Setting DACA register value to 0.46V" "DACA=0.46V"
12046413-12046464 tlc5620: dac-select: "DAC select: DACD" "DAC sel: DACD" "DAC: DACD" "D: DACD" "DACD" "D"
12046464-12046490 tlc5620: gain: "Gain: x2" "G: x2" "x2"
12046490-12046695 tlc5620: value: "DAC value: 122" "Value: 122" "Val: 122" "V: 122" "122"
12046413-12046439 tlc5620: bit: "1"
12046439-12046464 tlc5620: bit: "1"
12046464-12046490 tlc5620: bit: "1"
12046490-12046516 tlc5620: bit: "0"
12046516-12046541 tlc5620: bit: "1"
12046541-12046567 tlc5620: bit: "1"
12046567-12046593 tlc5620: bit: "1"
12046593-12046618 tlc5620: bit: "1"
12046618-12046644 tlc5620: bit: "0"
12046644-12046669 tlc5620: bit: "1"
12046669-12046695 tlc5620: bit: "0"
12046682-12046682 tlc5620: data-latch: "Falling edge on LOAD" "LOAD fall" "F"
12046413-12046695 tlc5620: reg-write: "Setting DACD register value to 3.15V" "DACD=3.15V"
12050471-12050522 tlc5620: dac-select: "DAC select: DACC" "DAC sel: DACC" "DAC: DACC" "D: DACC" "DACC" "C"
12050522-12050547 tlc5620: gain: "Gain: x2" "G: x2" "x2"
12050547-12050752 tlc5620: value: "DAC value: 108" "Value: 108" "Val: 108" "V: 108" "108"
12050471-12050496 tlc5620: bit: "1"
12050496-12050522 tlc5620: bit: "0"
12050522-12050547 tlc5620: bit: "1"
12050547-12050573 tlc5620: bit: "0"
12050573-12050599 tlc5620: bit: "1"
12050599-12050624 tlc5620: bit: "1"
12050624-12050650 tlc5620: bit: "0"
12050650-12050676 tlc5620: bit: "1"
12050676-12050701 tlc5620: bit: "1"
12050701-12050727 tlc5620: bit: "0"
12050727-12050752 tlc5620: bit: "0"
12050740-12050740 tlc5620: data-latch: "Falling edge on LOAD" "LOAD fall" "F"
12050471-12050752 tlc5620: reg-write: "Setting DACC register value to 2.78V" "DACC=2.78V"
12055396-12055396 tlc5620: ldac-fall: "Falling edge on LDAC" "LDAC fall" "LDAC" "L"
12042384-12055396 tlc5620: voltage-update-all: "Updating voltages: DACA=0.46V DACB=? DACC=2.78V DACD=3.15V" "DACA=0.46V DACB=? DACC=2.78V DACD=3.15V" "A=0.46V B=? C=2.78V D=3.15V"
12582911-12582963 tlc5620: dac-select: "DAC select: DACA" "DAC sel: DACA" "DAC: DACA" "D: DACA" "DACA" "A"
12582963-12582988 tlc5620: gain: "Gain: x1" "G: x1" "x1"
12582988-12583192 tlc5620: value: "DAC value: 36" "Value: 36" "Val: 36" "V: 36" "36"
12582911-12582937 tlc5620: bit: "0"
12582937-12582963 tlc5620: bit: "0"
12582963-12582988 tlc5620: bit: "0"
12582988-12583014 tlc5620: bit: "0"
12583014-12583039 tlc5620: bit: "0"
12583039-12583065 tlc5620: bit: "1"
12583065-12583091 tlc5620: bit: "0"
12583091-12583116 tlc5620: bit: "0"
12583116-12583142 tlc5620: bit: "1"
12583142-12583167 tlc5620: bit: "0"
12583167-12583192 tlc5620: bit: "0"
12583180-12583180 tlc5620: data-latch: "Falling edge on LOAD" "LOAD fall" "F"
12582911-12583192 tlc5620: reg-write: "Setting DACA register value to 0.46V" "DACA=0.46V"
12586884-12586935 tlc5620: dac-select: "DAC select: DACD" "DAC sel: DACD" "DAC: DACD" "D: DACD" "DACD" "D"
12586935-12586961 tlc5620: gain: "Gain: x2" "G: x2" "x2"
12586961-12587166 tlc5620: value: "DAC value: 122" "Value: 122" "Val: 122" "V: 122" "122"
12586884-12586910 tlc5620: bit: "1"
12586910-12586935 tlc5620: bit: "1"
12586935-12586961 tlc5620: bit: "1"
12586961-12586987 tlc5620: bit: "0"
12586987-12587012 tlc5620: bit: "1"
12587012-12587038 tlc5620: bit: "1"
12587038-12587063 tlc5620: bit: "1"
12587063-12587089 tlc5620: bit: "1"
12587089-12587115 tlc5620: bit: "0"
12587115-12587140 tlc5620: bit: "1"
12587140-12587166 tlc5620: bit: "0"
12587153-12587153 tlc5620: data-latch: "Falling edge on LOAD" "LOAD fall" "F"
12586884-12587166 tlc5620: reg-write: "Setting DACD register value to 3.15V" "DACD=3.15V"
12590906-12590957 tlc5620: dac-select: "DAC select: DACC" "DAC sel: DACC" "DAC: DACC" "D: DACC" "DACC" "C"
12590957-12590983 tlc5620: gain: "Gain: x2" "G: x2" "x2"
12590983-12591188 tlc5620: value: "DAC value: 108" "Value: 108" "Val: 108" "V: 108" "108"
12590906-12590931 tlc5620: bit: "1"
12590931-12590957 tlc5620: bit: "0"
12590957-12590983 tlc5620: bit: "1"
12590983-12591008 tlc5620: bit: "0"
12591008-12591034 tlc5620: bit: "1"
12591034-12591059 tlc5620: bit: "1"
12591059-12591085 tlc5620: bit: "0"
12591085-12591111 tlc5620: bit: "1"
12591111-12591136 tlc5620: bit: "1"
12591136-12591162 tlc5620: bit: "0"
12591162-12591188 tlc5620: bit: "0"
12591175-12591175 tlc5620: data-latch: "Falling edge on LOAD" "LOAD fall" "F"
12590906-12591188 tlc5620: reg-write: "Setting DACC register value to 2.78V" "DACC=2.78V"
12595550-12595550 tlc5620: ldac-fall: "Falling edge on LDAC" "LDAC fall" "LDAC" "L"
12582911-12595550 tlc5620: voltage-update-all: "Updating voltages: DACA=0.46V DACB=? DACC=2.78V DACD=3.15V" "DACA=0.46V DACB=? DACC=2.78V DACD=3.15V" "A=0.46V B=? C=2.78V D=3.15V"
12612919-12612970 tlc5620: dac-select: "DAC select: DACA" "DAC sel: DACA" "DAC: DACA" "D: DACA" "DACA" "A"
12612970-12612996 tlc5620: gain: "Gain: x1" "G: x1" "x1"
12612996-12613201 tlc5620: value: "DAC value: 36" "Value: 36" "Val: 36" "V: 36" "36"
12612919-12612945 tlc5620: bit: "0"
12612945-12612970 tlc5620: bit: "0"
12612970-12612996 tlc5620: bit: "0"
12612996-12613022 tlc5620: bit: "0"
12613022-12613047 tlc5620: bit: "0"
12613047-12613073 tlc5620: bit: "1"
12613073-12613098 tlc5620: bit: "0"
12613098-12613124 tlc5620: bit: "0"
12613124-12613150 tlc5620: bit: "1"
12613150-12613175 tlc5620: bit: "0"
12613175-12613201 tlc5620: bit: "0"
12613188-12613188 tlc5620: data-latch: "Falling edge on LOAD" "LOAD fall" "F"
12612919-12613201 tlc5620: reg-write: "Setting DACA register value to 0.46V" "DACA=0.46V"
12617117-12617169 tlc5620: dac-select: "DAC select: DACD" "DAC sel: DACD" "DAC: DACD" "D: DACD" "DACD" "D"
12617169-12617194 tlc5620: gain: "Gain: x2" "G: x2" "x2"
12617194-12617399 tlc5620: value: "DAC value: 122" "Value: 122" "Val: 122" "V: 122" "122"
12617117-12617143 tlc5620: bit: "1"
12617143-12617169 tlc5620: bit: "1"
12617169-12617194 tlc5620: bit: "1"
12617194-12617220 tlc5620: bit: "0"
12617220-12617245 tlc5620: bit: "1"
12617245-12617271 tlc5620: bit: "1"
12617271-12617297 tlc5620: bit: "1"
12617297-12617322 tlc5620: bit: "1"
12617322-12617348 tlc5620: bit: "0"
12617348-12617374 tlc5620: bit: "1"
12617374-12617399 tlc5620: bit: "0"
12617386-12617386 tlc5620: data-latch: "Falling edge on LOAD" "LOAD fall" "F"
12617117-12617399 tlc5620: reg-write: "Setting DACD register value to 3.15V" "DACD=3.15V"
12620714-12620765 tlc5620: dac-select: "DAC select: DACC" "DAC sel: DACC" "DAC: DACC" "D: DACC" "DACC" "C"
12620765-12620791 tlc5620: gain: "Gain: x2" "G: x2" "x2"
12620791-12620996 tlc5620: value: "DAC value: 108" "Value: 108" "Val: 108" "V: 108" "108"
12620714-12620739 tlc5620: bit: "1"
12620739-12620765 tlc5620: bit: "0"
12620765-12620791 tlc5620: bit: "1"
12620791-12620816 tlc5620: bit: "0"
12620816-12620842 tlc5620: bit: "1"
12620842-12620867 tlc5620: bit: "1"
12620867-12620893 tlc5620: bit: "0"
12620893-12620919 tlc5620: bit: "1"
12620919-12620944 tlc5620: bit: "1"
12620944-12620970 tlc5620: bit: "0"
12620970-12620996 tlc5620: bit: "0"
12620983-12620983 tlc5620: data-latch: "Falling edge on LOAD" "LOAD fall" "F"
12620714-12620996 tlc5620: reg-write: "Setting DACC register value to 2.78V" "DACC=2.78V"
12625693-12625693 tlc5620: ldac-fall: "Falling edge on LDAC" "LDAC fall" "LDAC" "L"
12612919-12625693 tlc5620: voltage-update-all: "Updating voltages: DACA=0.46V DACB=? DACC=2.78V DACD=3.15V" "DACA=0.46V DACB=? DACC=2.78V DACD=3.15V" "A=0.46V B=? C=2.78V D=3.15V"
12632868-12632919 tlc5620: dac-select: "DAC select: DACA" "DAC sel: DACA" "DAC: DACA" "D: DACA" "DACA" "A"
12632919-12632945 tlc5620: gain: "Gain: x1" "G: x1" "x1"
12632945-12633150 tlc5620: value: "DAC value: 36" "Value: 36" "Val: 36" "V: 36" "36"
12632868-12632894 tlc5620: bit: "0"
12632894-12632919 tlc5620: bit: "0"
12632919-12632945 tlc5620: bit: "0"
12632945-12632970 tlc5620: bit: "0"
12632970-12632996 tlc5620: bit: "0"
12632996-12633022 tlc5620: bit: "1"
12633022-12633047 tlc5620: bit: "0"
12633047-12633073 tlc5620: bit: "0"
12633073-12633099 tlc5620: bit: "1"
12633099-12633124 tlc5620: bit: "0"
12633124-12633150 tlc5620: bit: "0"
12633137-12633137 tlc5620: data-latch: "Falling edge on LOAD" "LOAD fall" "F"
12632868-12633150 tlc5620: reg-write: "Setting DACA register value to 0.46V" "DACA=0.46V"
12636928-12636979 tlc5620: dac-select: "DAC select: DACD" "DAC sel: DACD" "DAC: DACD" "D: DACD" "DACD" "D"
12636979-12637005 tlc5620: gain: "Gain: x2" "G: x2" "x2"
12637005-12637210 tlc5620: value: "DAC value: 122" "Value: 122" "Val: 122" "V: 122" "122"
12636928-12636954 tlc5620: bit: "1"
12636954-12636979 tlc5620: bit: "1"
12636979-12637005 tlc5620: bit: "1"
12637005-12637030 tlc5620: bit: "0"
12637030-12637056 tlc5620: bit: "1"
12637056-12637082 tlc5620: bit: "1"
12637082-12637107 tlc5620: bit: "1"
12637107-12637133 tlc5620: bit: "1"
12637133-12637158 tlc5620: bit: "0"
12637158-12637184 tlc5620: bit: "1"
12637184-12637210 tlc5620: bit: "0"
12637197-12637197 tlc5620: data-latch: "Falling edge on LOAD" "LOAD fall" "F"
12636928-12637210 tlc5620: reg-write: "Setting DACD register value to 3.15V" "DACD=3.15V"
12641131-12641183 tlc5620: dac-select: "DAC select: DACC" "DAC sel: DACC" "DAC: DACC" "D: DACC" "DACC" "C"
12641183-12641208 tlc5620: gain: "Gain: x2" "G: x2" "x2"
12641208-12641412 tlc5620: value: "DAC value: 108" "Value: 108" "Val: 108" "V: 108" "108"
12641131-12641157 tlc5620: bit: "1"
12641157-12641183 tlc5620: bit: "0"
12641183-12641208 tlc5620: bit: "1"
12641208-12641234 tlc5620: bit: "0"
12641234-12641259 tlc5620: bit: "1"
12641259-12641285 tlc5620: bit: "1"
12641285-12641311 tlc5620: bit: "0"
12641311-12641336 tlc5620: bit: "1"
12641336-12641362 tlc5620: bit: "1"
12641362-12641387 tlc5620: bit: "0"
12641387-12641412 tlc5620: bit: "0"
12641400-12641400 tlc5620: data-latch: "Falling edge on LOAD" "LOAD fall" "F"
12641131-12641412 tlc5620: reg-write: "Setting DACC register value to 2.78V" "DACC=2.78V"
12645632-12645632 tlc5620: ldac-fall: "Falling edge on LDAC" "LDAC fall" "LDAC" "L"
12632868-12645632 tlc5620: voltage-update-all: "Updating voltages: DACA=0.46V DACB=? DACC=2.78V DACD=3.15V" "DACA=0.46V DACB=? DACC=2.78V DACD=3.15V" "A=0.46V B=? C=2.78V D=3.15V"
13195462-13195514 tlc5620: dac-select: "DAC select: DACA" "DAC sel: DACA" "DAC: DACA" "D: DACA" "DACA" "A"
13195514-13195539 tlc5620: gain: "Gain: x1" "G: x1" "x1"
13195539-13195744 tlc5620: value: "DAC value: 36" "Value: 36" "Val: 36" "V: 36" "36"
13195462-13195488 tlc5620: bit: "0"
13195488-13195514 tlc5620: bit: "0"
13195514-13195539 tlc5620: bit: "0"
13195539-13195565 tlc5620: bit: "0"
13195565-13195591 tlc5620: bit: "0"
13195591-13195616 tlc5620: bit: "1"
13195616-13195642 tlc5620: bit: "0"
13195642-13195667 tlc5620: bit: "0"
13195667-13195693 tlc5620: bit: "1"
13195693-13195719 tlc5620: bit: "0"
13195719-13195744 tlc5620: bit: "0"
13195731-13195731 tlc5620: data-latch: "Falling edge on LOAD" "LOAD fall" "F"
13195462-13195744 tlc5620: reg-write: "Setting DACA register value to 0.46V" "DACA=0.46V"
13199120-13199172 tlc5620: dac-select: "DAC select: DACD" "DAC sel: DACD" "DAC: DACD" "D: DACD" "DACD" "D"
13199172-13199197 tlc5620: gain: "Gain: x2" "G: x2" "x2"
13199197-13199401 tlc5620: value: "DAC value: 122" "Value: 122" "Val: 122" "V: 122" "122"
13199120-13199146 tlc5620: bit: "1"
13199146-13199172 tlc5620: bit: "1"
13199172-13199197 tlc5620: bit: "1"
13199197-13199223 tlc5620: bit: "0"
13199223-13199248 tlc5620: bit: "1"
13199248-13199274 tlc5620: bit: "1"
13199274-13199300 tlc5620: bit: "1"
13199300-13199325 tlc5620: bit: "1"
13199325-13199351 tlc5620: bit: "0"
13199351-13199376 tlc5620: bit: "1"
13199376-13199401 tlc5620: bit: "0"
13199389-13199389 tlc5620: data-latch: "Falling edge on LOAD" "LOAD fall" "F"
13199120-13199401 tlc5620: reg-write: "Setting DACD register value to 3.15V" "DACD=3.15V"
13203211-13203262 tlc5620: dac-select: "DAC select: DACC" "DAC sel: DACC" "DAC: DACC" "D: DACC" "DACC" "C"
13203262-13203288 tlc5620: gain: "Gain: x2" "G: x2" "x2"
13203288-13203493 tlc5620: value: "DAC value: 108" "Value: 108" "Val: 108" "V: 108" "108"
13203211-13203237 tlc5620: bit: "1"
13203237-13203262 tlc5620: bit: "0"
13203262-13203288 tlc5620: bit: "1"
13203288-13203313 tlc5620: bit: "0"
13203313-13203339 tlc5620: bit: "1"
13203339-13203365 tlc5620: bit: "1"
13203365-13203390 tlc5620: bit: "0"
13203390-13203416 tlc5620: bit: "1"
13203416-13203442 tlc5620: bit: "1"
13203442-13203467 tlc5620: bit: "0"
13203467-13203493 tlc5620: bit: "0"
13203480-13203480 tlc5620: data-latch: "Falling edge on LOAD" "LOAD fall" "F"
13203211-13203493 tlc5620: reg-write: "Setting DACC register value to 2.78V" "DACC=2.78V"
13208039-13208039 tlc5620: ldac-fall: "Falling edge on LDAC" "LDAC fall" "LDAC" "L"
13195462-13208039 tlc5620: voltage-update-all: "Updating voltages: DACA=0.46V DACB=? DACC=2.78V DACD=3.15V" "DACA=0.46V DACB=? DACC=2.78V DACD=3.15V" "A=0.46V B=? C=2.78V D=3.15V"
13726492-13726543 tlc5620: dac-select: "DAC select: DACA" "DAC sel: DACA" "DAC: DACA" "D: DACA" "DACA" "A"
13726543-13726569 tlc5620: gain: "Gain: x1" "G: x1" "x1"
13726569-13726774 tlc5620: value: "DAC value: 36" "Value: 36" "Val: 36" "V: 36" "36"
13726492-13726517 tlc5620: bit: "0"
13726517-13726543 tlc5620: bit: "0"
13726543-13726569 tlc5620: bit: "0"
13726569-13726594 tlc5620: bit: "0"
13726594-13726620 tlc5620: bit: "0"
13726620-13726645 tlc5620: bit: "1"
13726645-13726671 tlc5620: bit: "0"
13726671-13726697 tlc5620: bit: "0"
13726697-13726722 tlc5620: bit: "1"
13726722-13726748 tlc5620: bit: "0"
13726748-13726774 tlc5620: bit: "0"
13726761-13726761 tlc5620: data-latch: "Falling edge on LOAD" "LOAD fall" "F"
13726492-13726774 tlc5620: reg-write: "Setting DACA register value to 0.46V" "DACA=0.46V"
13729404-13729455 tlc5620: dac-select: "DAC select: DACD" "DAC sel: DACD" "DAC: DACD" "D: DACD" "DACD" "D"
13729455-13729481 tlc5620: gain: "Gain: x2" "G: x2" "x2"
13729481-13729686 tlc5620: value: "DAC value: 122" "Value: 122" "Val: 122" "V: 122" "122"
13729404-13729430 tlc5620: bit: "1"
13729430-13729455 tlc5620: bit: "1"
13729455-13729481 tlc5620: bit: "1"
13729481-13729507 tlc5620: bit: "0"
13729507-13729532 tlc5620: bit: "1"
13729532-13729558 tlc5620: bit: "1"
13729558-13729584 tlc5620: bit: "1"
13729584-13729609 tlc5620: bit: "1"
13729609-13729635 tlc5620: bit: "0"
13729635-13729660 tlc5620: bit: "1"
13729660-13729686 tlc5620: bit: "0"
13729673-13729673 tlc5620: data-latch: "Falling edge on LOAD" "LOAD fall" "F"
13729404-13729686 tlc5620: reg-write: "Setting DACD register value to 3.15V" "DACD=3.15V"
13733469-13733521 tlc5620: dac-select: "DAC select: DACC" "DAC sel: DACC" "DAC: DACC" "D: DACC" "DACC" "C"
13733521-13733546 tlc5620: gain: "Gain: x2" "G: x2" "x2"
13733546-13733750 tlc5620: value: "DAC value: 108" "Value: 108" "Val: 108" "V: 108" "108"
13733469-13733495 tlc5620: bit: "1"
13733495-13733521 tlc5620: bit: "0"
13733521-13733546 tlc5620: bit: "1"
13733546-13733572 tlc5620: bit: "0"
13733572-13733597 tlc5620: bit: "1"
13733597-13733623 tlc5620: bit: "1"
13733623-13733649 tlc5620: bit: "0"
13733649-13733674 tlc5620: bit: "1"
13733674-13733700 tlc5620: bit: "1"
13733700-13733725 tlc5620: bit: "0"
13733725-13733750 tlc5620: bit: "0"
13733738-13733738 tlc5620: data-latch: "Falling edge on LOAD" "LOAD fall" "F"
13733469-13733750 tlc5620: reg-write: "Setting DACC register value to 2.78V" "DACC=2.78V"
13738369-13738369 tlc5620: ldac-fall: "Falling edge on LDAC" "LDAC fall" "LDAC" "L"
13726492-13738369 tlc5620: voltage-update-all: "Updating voltages: DACA=0.46V DACB=? DACC=2.78V DACD=3.15V" "DACA=0.46V DACB=? DACC=2.78V DACD=3.15V" "A=0.46V B=? C=2.78V D=3.15V"
14251937-14251988 tlc5620: dac-select: "DAC select: DACA" "DAC sel: DACA" "DAC: DACA" "D: DACA" "DACA" "A"
14251988-14252014 tlc5620: gain: "Gain: x1" "G: x1" "x1"
14252014-14252219 tlc5620: value: "DAC value: 36" "Value: 36" "Val: 36" "V: 36" "36"
14251937-14251963 tlc5620: bit: "0"
14251963-14251988 tlc5620: bit: "0"
14251988-14252014 tlc5620: bit: "0"
14252014-14252040 tlc5620: bit: "0"
14252040-14252065 tlc5620: bit: "0"
14252065-14252091 tlc5620: bit: "1"
14252091-14252116 tlc5620: bit: "0"
14252116-14252142 tlc5620: bit: "0"
14252142-14252168 tlc5620: bit: "1"
14252168-14252193 tlc5620: bit: "0"
14252193-14252219 tlc5620: bit: "0"
14252206-14252206 tlc5620: data-latch: "Falling edge on LOAD" "LOAD fall" "F"
14251937-14252219 tlc5620: reg-write: "Setting DACA register value to 0.46V" "DACA=0.46V"
14255731-14255782 tlc5620: dac-select: "DAC select: DACD" "DAC sel: DACD" "DAC: DACD" "D: DACD" "DACD" "D"
14255782-14255807 tlc5620: gain: "Gain: x2" "G: x2" "x2"
14255807-14256012 tlc5620: value: "DAC value: 122" "Value: 122" "Val: 122" "V: 122" "122"
14255731-14255756 tlc5620: bit: "1"
14255756-14255782 tlc5620: bit: "1"
14255782-14255807 tlc5620: bit: "1"
14255807-14255833 tlc5620: bit: "0"
14255833-14255859 tlc5620: bit: "1"
14255859-14255884 tlc5620: bit: "1"
14255884-14255910 tlc5620: bit: "1"
14255910-14255936 tlc5620: bit: "1"
14255936-14255961 tlc5620: bit: "0"
14255961-14255987 tlc5620: bit: "1"
14255987-14256012 tlc5620: bit: "0"
14256000-14256000 tlc5620: data-latch: "Falling edge on LOAD" "LOAD fall" "F"
14255731-14256012 tlc5620: reg-write: "Setting DACD register value to 3.15V" "DACD=3.15V"
14259747-14259798 tlc5620: dac-select: "DAC select: DACC" "DAC sel: DACC" "DAC: DACC" "D: DACC" "DACC" "C"
14259798-14259824 tlc5620: gain: "Gain: x2" "G: x2" "x2"
14259824-14260029 tlc5620: value: "DAC value: 108" "Value: 108" "Val: 108" "V: 108" "108"
14259747-14259773 tlc5620: bit: "1"
14259773-14259798 tlc5620: bit: "0"
14259798-14259824 tlc5620: bit: "1"
14259824-14259850 tlc5620: bit: "0"
14259850-14259875 tlc5620: bit: "1"
14259875-14259901 tlc5620: bit: "1"
14259901-14259926 tlc5620: bit: "0"
14259926-14259952 tlc5620: bit: "1"
14259952-14259978 tlc5620: bit: "1"
14259978-14260003 tlc5620: bit: "0"
14260003-14260029 tlc5620: bit: "0"
14260016-14260016 tlc5620: data-latch: "Falling edge on LOAD" "LOAD fall" "F"
14259747-14260029 tlc5620: reg-write: "Setting DACC register value to 2.78V" "DACC=2.78V"
14264683-14264683 tlc5620: ldac-fall: "Falling edge on LDAC" "LDAC fall" "LDAC" "L"
14251937-14264683 tlc5620: voltage-update-all: "Updating voltages: DACA=0.46V DACB=? DACC=2.78V DACD=3.15V" "DACA=0.46V DACB=? DACC=2.78V DACD=3.15V" "A=0.46V B=? C=2.78V D=3.15V"
14779949-14780000 tlc5620: dac-select: "DAC select: DACA" "DAC sel: DACA" "DAC: DACA" "D: DACA" "DACA" "A"
14780000-14780026 tlc5620: gain: "Gain: x1" "G: x1" "x1"
14780026-14780231 tlc5620: value: "DAC value: 36" "Value: 36" "Val: 36" "V: 36" "36"
14779949-14779975 tlc5620: bit: "0"
14779975-14780000 tlc5620: bit: "0"
14780000-14780026 tlc5620: bit: "0"
14780026-14780051 tlc5620: bit: "0"
14780051-14780077 tlc5620: bit: "0"
14780077-14780103 tlc5620: bit: "1"
14780103-14780128 tlc5620: bit: "0"
14780128-14780154 tlc5620: bit: "0"
14780154-14780180 tlc5620: bit: "1"
14780180-14780205 tlc5620: bit: "0"
14780205-14780231 tlc5620: bit: "0"
14780218-14780218 tlc5620: data-latch: "Falling edge on LOAD" "LOAD fall" "F"
14779949-14780231 tlc5620: reg-write: "Setting DACA register value to 0.46V" "DACA=0.46V"
14784001-14784052 tlc5620: dac-select: "DAC select: DACD" "DAC sel: DACD" "DAC: DACD" "D: DACD" "DACD" "D"
14784052-14784078 tlc5620: gain: "Gain: x2" "G: x2" "x2"
14784078-14784283 tlc5620: value: "DAC value: 122" "Value: 122" "Val: 122" "V: 122" "122"
14784001-14784027 tlc5620: bit: "1"
14784027-14784052 tlc5620: bit: "1"
14784052-14784078 tlc5620: bit: "1"
14784078-14784104 tlc5620: bit: "0"
14784104-14784129 tlc5620: bit: "1"
14784129-14784155 tlc5620: bit: "1"
14784155-14784181 tlc5620: bit: "1"
14784181-14784206 tlc5620: bit: "1"
14784206-14784232 tlc5620: bit: "0"
14784232-14784257 tlc5620: bit: "1"
14784257-14784283 tlc5620: bit: "0"
14784270-14784270 tlc5620: data-latch: "Falling edge on LOAD" "LOAD fall" "F"
14784001-14784283 tlc5620: reg-write: "Setting DACD register value to 3.15V" "DACD=3.15V"
14788036-14788087 tlc5620: dac-select: "DAC select: DACC" "DAC sel: DACC" "DAC: DACC" "D: DACC" "DACC" "C"
14788087-14788112 tlc5620: gain: "Gain: x2" "G: x2" "x2"
14788112-14788317 tlc5620: value: "DAC value: 108" "Value: 108" "Val: 108" "V: 108" "108"
14788036-14788061 tlc5620: bit: "1"
14788061-14788087 tlc5620: bit: "0"
14788087-14788112 tlc5620: bit: "1"
14788112-14788138 tlc5620: bit: "0"
14788138-14788164 tlc5620: bit: "1"
14788164-14788189 tlc5620: bit: "1"
14788189-14788215 tlc5620: bit: "0"
14788215-14788241 tlc5620: bit: "1"
14788241-14788266 tlc5620: bit: "1"
14788266-14788292 tlc5620: bit: "0"
14788292-14788317 tlc5620: bit: "0"
14788305-14788305 tlc5620: data-latch: "Falling edge on LOAD" "LOAD fall" "F"
14788036-14788317 tlc5620: reg-write: "Setting DACC register value to 2.78V" "DACC=2.78V"
14792959-14792959 tlc5620: ldac-fall: "Falling edge on LDAC" "LDAC fall" "LDAC" "L"
14779949-14792959 tlc5620: voltage-update-all: "Updating voltages: DACA=0.46V DACB=? DACC=2.78V DACD=3.15V" "DACA=0.46V DACB=? DACC=2.78V DACD=3.15V" "A=0.46V B=? C=2.78V D=3.15V"
15304710-15304762 tlc5620: dac-select: "DAC select: DACA" "DAC sel: DACA" "DAC: DACA" "D: DACA" "DACA" "A"
15304762-15304787 tlc5620: gain: "Gain: x1" "G: x1" "x1"
15304787-15304991 tlc5620: value: "DAC value: 36" "Value: 36" "Val: 36" "V: 36" "36"
15304710-15304736 tlc5620: bit: "0"
15304736-15304762 tlc5620: bit: "0"
15304762-15304787 tlc5620: bit: "0"
15304787-15304813 tlc5620: bit: "0"
15304813-15304838 tlc5620: bit: "0"
15304838-15304864 tlc5620: bit: "1"
15304864-15304890 tlc5620: bit: "0"
15304890-15304915 tlc5620: bit: "0"
15304915-15304941 tlc5620: bit: "1"
15304941-15304966 tlc5620: bit: "0"
15304966-15304991 tlc5620: bit: "0"
15304979-15304979 tlc5620: data-latch: "Falling edge on LOAD" "LOAD fall" "F"
15304710-15304991 tlc5620: reg-write: "Setting DACA register value to 0.46V" "DACA=0.46V"
15308276-15308327 tlc5620: dac-select: "DAC select: DACD" "DAC sel: DACD" "DAC: DACD" "D: DACD" "DACD" "D"
15308327-15308353 tlc5620: gain: "Gain: x2" "G: x2" "x2"
15308353-15308558 tlc5620: value: "DAC value: 122" "Value: 122" "Val: 122" "V: 122" "122"
15308276-15308302 tlc5620: bit: "1"
15308302-15308327 tlc5620: bit: "1"
15308327-15308353 tlc5620: bit: "1"
15308353-15308378 tlc5620: bit: "0"
15308378-15308404 tlc5620: bit: "1"
15308404-15308430 tlc5620: bit: "1"
15308430-15308455 tlc5620: bit: "1"
15308455-15308481 tlc5620: bit: "1"
15308481-15308506 tlc5620: bit: "0"
15308506-15308532 tlc5620: bit: "1"
15308532-15308558 tlc5620: bit: "0"
15308545-15308545 tlc5620: data-latch: "Falling edge on LOAD" "LOAD fall" "F"
15308276-15308558 tlc5620: reg-write: "Setting DACD register value to 3.15V" "DACD=3.15V"
15312336-15312387 tlc5620: dac-select: "DAC select: DACC" "DAC sel: DACC" "DAC: DACC" "D: DACC" "DACC" "C"
15312387-15312413 tlc5620: gain: "Gain: x2" "G: x2" "x2"
15312413-15312618 tlc5620: value: "DAC value: 108" "Value: 108" "Val: 108" "V: 108" "108"
15312336-15312362 tlc5620: bit: "1"
15312362-15312387 tlc5620: bit: "0"
15312387-15312413 tlc5620: bit: "1"
15312413-15312438 tlc5620: bit: "0"
15312438-15312464 tlc5620: bit: "1"
15312464-15312490 tlc5620: bit: "1"
15312490-15312515 tlc5620: bit: "0"
15312515-15312541 tlc5620: bit: "1"
15312541-15312566 tlc5620: bit: "1"
15312566-15312592 tlc5620: bit: "0"
15312592-15312618 tlc5620: bit: "0"
15312605-15312605 tlc5620: data-latch: "Falling edge on LOAD" "LOAD fall" "F"
15312336-15312618 tlc5620: reg-write: "Setting DACC register value to 2.78V" "DACC=2.78V"
15317292-15317292 tlc5620: ldac-fall: "Falling edge on LDAC" "LDAC fall" "LDAC" "L"
15304710-15317292 tlc5620: voltage-update-all: "Updating voltages: DACA=0.46V DACB=? DACC=2.78V DACD=3.15V" "DACA=0.46V DACB=? DACC=2.78V DACD=3.15V" "A=0.46V B=? C=2.78V D=3.15V"
15832786-15832838 tlc5620: dac-select: "DAC select: DACA" "DAC sel: DACA" "DAC: DACA" "D: DACA" "DACA" "A"
15832838-15832863 tlc5620: gain: "Gain: x1" "G: x1" "x1"
15832863-15833067 tlc5620: value: "DAC value: 36" "Value: 36" "Val: 36" "V: 36" "36"
15832786-15832812 tlc5620: bit: "0"
15832812-15832838 tlc5620: bit: "0"
15832838-15832863 tlc5620: bit: "0"
15832863-15832889 tlc5620: bit: "0"
15832889-15832914 tlc5620: bit: "0"
15832914-15832940 tlc5620: bit: "1"
15832940-15832966 tlc5620: bit: "0"
15832966-15832991 tlc5620: bit: "0"
15832991-15833017 tlc5620: bit: "1"
15833017-15833042 tlc5620: bit: "0"
15833042-15833067 tlc5620: bit: "0"
15833055-15833055 tlc5620: data-latch: "Falling edge on LOAD" "LOAD fall" "F"
15832786-15833067 tlc5620: reg-write: "Setting DACA register value to 0.46V" "DACA=0.46V"
15836554-15836605 tlc5620: dac-select: "DAC select: DACD" "DAC sel: DACD" "DAC: DACD" "D: DACD" "DACD" "D"
15836605-15836631 tlc5620: gain: "Gain: x2" "G: x2" "x2"
15836631-15836836 tlc5620: value: "DAC value: 122" "Value: 122" "Val: 122" "V: 122" "122"
15836554-15836580 tlc5620: bit: "1"
15836580-15836605 tlc5620: bit: "1"
15836605-15836631 tlc5620: bit: "1"
15836631-15836657 tlc5620: bit: "0"
15836657-15836682 tlc5620: bit: "1"
15836682-15836708 tlc5620: bit: "1"
15836708-15836734 tlc5620: bit: "1"
15836734-15836759 tlc5620: bit: "1"
15836759-15836785 tlc5620: bit: "0"
15836785-15836810 tlc5620: bit: "1"
15836810-15836836 tlc5620: bit: "0"
15836823-15836823 tlc5620: data-latch: "Falling edge on LOAD" "LOAD fall" "F"
15836554-15836836 tlc5620: reg-write: "Setting DACD register value to 3.15V" "DACD=3.15V"
15840630-15840681 tlc5620: dac-select: "DAC select: DACC" "DAC sel: DACC" "DAC: DACC" "D: DACC" "DACC" "C"
15840681-15840706 tlc5620: gain: "Gain: x2" "G: x2" "x2"
15840706-15840911 tlc5620: value: "DAC value: 108" "Value: 108" "Val: 108" "V: 108" "108"
15840630-15840655 tlc5620: bit: "1"
15840655-15840681 tlc5620: bit: "0"
15840681-15840706 tlc5620: bit: "1"
15840706-15840732 tlc5620: bit: "0"
15840732-15840758 tlc5620: bit: "1"
15840758-15840783 tlc5620: bit: "1"
15840783-15840809 tlc5620: bit: "0"
15840809-15840834 tlc5620: bit: "1"
15840834-15840860 tlc5620: bit: "1"
15840860-15840886 tlc5620: bit: "0"
15840886-15840911 tlc5620: bit: "0"
15840899-15840899 tlc5620: data-latch: "Falling edge on LOAD" "LOAD fall" "F"
15840630-15840911 tlc5620: reg-write: "Setting DACC register value to 2.78V" "DACC=2.78V"
15845550-15845550 tlc5620: ldac-fall: "Falling edge on LDAC" "LDAC fall" "LDAC" "L"
15832786-15845550 tlc5620: voltage-update-all: "Updating voltages: DACA=0.46V DACB=? DACC=2.78V DACD=3.15V" "DACA=0.46V DACB=? DACC=2.78V DACD=3.15V" "A=0.46V B=? C=2.78V D=3.15V"
