423-507 xfp: field-name-and-val: "Module identifier: XFP"
423-507 xfp: field-val: "XFP"
1920-3382 xfp: field-name-and-val: "Temp high alarm: 80.0 C"
1920-3382 xfp: field-val: "80.0 C"
4717-6184 xfp: field-name-and-val: "Temp low alarm: -15.0 C"
4717-6184 xfp: field-val: "-15.0 C"
7397-8260 xfp: field-name-and-val: "Temp high warning: 75.0 C"
7397-8260 xfp: field-val: "75.0 C"
9109-10211 xfp: field-name-and-val: "Temp low warning: -10.0 C"
9109-10211 xfp: field-val: "-10.0 C"
18994-20074 xfp: field-name-and-val: "Bias high alarm: 0.1 mA"
18994-20074 xfp: field-val: "0.1 mA"
22833-23897 xfp: field-name-and-val: "Bias high warning: 0.1 mA"
22833-23897 xfp: field-val: "0.1 mA"
26607-27675 xfp: field-name-and-val: "TX power high alarm: 1.58 mW"
26607-27675 xfp: field-val: "1.58 mW"
28514-29584 xfp: field-name-and-val: "TX power low alarm: 0.13 mW"
28514-29584 xfp: field-val: "0.13 mW"
30407-31330 xfp: field-name-and-val: "TX power high warning: 1.00 mW"
30407-31330 xfp: field-val: "1.00 mW"
31928-32892 xfp: field-name-and-val: "TX power low warning: 0.20 mW"
31928-32892 xfp: field-val: "0.20 mW"
33686-34584 xfp: field-name-and-val: "RX power high alarm: 1.78 mW"
33686-34584 xfp: field-val: "1.78 mW"
37099-38065 xfp: field-name-and-val: "RX power high warning: 1.41 mW"
37099-38065 xfp: field-val: "1.41 mW"
38819-39790 xfp: field-name-and-val: "RX power low warning: 0.03 mW"
38819-39790 xfp: field-val: "0.03 mW"
73716-86277 xfp: field-name-and-val: "Interrupt bits: 00 80 00 80 a2 00 00 00 00 00 00 00 00 00 00 00"
73716-86277 xfp: field-val: "00 80 00 80 a2 00 00 00 00 00 00 00 00 00 00 00"
87084-87980 xfp: field-name-and-val: "Module temperature: 35.8 C"
87084-87980 xfp: field-val: "35.8 C"
93487-94448 xfp: field-name-and-val: "Measured RX input power: 2.20 mW"
93487-94448 xfp: field-val: "2.20 mW"
95184-96147 xfp: field-name-and-val: "AUX 1 measurement: 33105"
95184-96147 xfp: field-val: "33105"
98505-99390 xfp: field-name-and-val: "General Control/Status: TX disable, MOD_NR, P_Down, TX_NR, TX_CDR not locked"
98505-99390 xfp: field-val: "TX disable, MOD_NR, P_Down, TX_NR, TX_CDR not locked"
113792-113877 xfp: field-name-and-val: "Module identifier: XFP"
113792-113877 xfp: field-val: "XFP"
114585-114670 xfp: field-name-and-val: "Extended id: Power level 2 module, CDR"
114585-114670 xfp: field-val: "Power level 2 module, CDR"
115379-115464 xfp: field-name-and-val: "Connector: LC"
115379-115464 xfp: field-val: "LC"
116293-122315 xfp: field-name-and-val: "Transceiver compliance: 10GBASE-LR, 10GBASE-LW"
116293-122315 xfp: field-val: "10GBASE-LR, 10GBASE-LW"
123080-123165 xfp: field-name-and-val: "Serial encoding support: 64B/66B"
123080-123165 xfp: field-val: "64B/66B"
123964-124049 xfp: field-name-and-val: "Minimum bit rate: 10.000 GB/s"
123964-124049 xfp: field-val: "10.000 GB/s"
124777-124860 xfp: field-name-and-val: "Maximum bit rate: 10.800 GB/s"
124777-124860 xfp: field-val: "10.800 GB/s"
125683-125768 xfp: field-name-and-val: "Link length (SMF): 10 km"
125683-125768 xfp: field-val: "10 km"
126502-126587 xfp: field-name-and-val: "Link length (extended, 50μm MMF): (standard)"
126502-126587 xfp: field-val: "(standard)"
127455-127538 xfp: field-name-and-val: "Link length (50μm MMF): (standard)"
127455-127538 xfp: field-val: "(standard)"
128306-128391 xfp: field-name-and-val: "Link length (62.5μm MMF): (standard)"
128306-128391 xfp: field-val: "(standard)"
129205-129290 xfp: field-name-and-val: "Link length (copper): (unknown)"
129205-129290 xfp: field-val: "(unknown)"
130038-130123 xfp: field-name-and-val: "Device technology: 1310 nm DFB transmitter, no wavelength control, uncooled transmitter device, PIN detector, transmitter not tunable"
130038-130123 xfp: field-val: "1310 nm DFB transmitter, no wavelength control, uncooled transmitter device, PIN detector, transmitter not tunable"
130893-143893 xfp: field-name-and-val: "Vendor: SumitomoElectric"
130893-143893 xfp: field-val: "SumitomoElectric"
144602-144687 xfp: field-name-and-val: "CDR support: 9.95Gb/s, 10.3Gb/s, 10.5Gb/s, 10.7Gb/s"
144602-144687 xfp: field-val: "9.95Gb/s, 10.3Gb/s, 10.5Gb/s, 10.7Gb/s"
145406-147212 xfp: field-name-and-val: "Vendor OUI: 00-0A-1D"
145406-147212 xfp: field-val: "00-0A-1D"
147991-160926 xfp: field-name-and-val: "Vendor part number: SXP3101LX-A4"
147991-160926 xfp: field-val: "SXP3101LX-A4"
161675-162649 xfp: field-name-and-val: "Vendor revision: A"
161675-162649 xfp: field-val: "A"
163418-164309 xfp: field-name-and-val: "Wavelength: 1310 nm"
163418-164309 xfp: field-val: "1310 nm"
165143-166113 xfp: field-name-and-val: "Wavelength tolerance: 20.0 nm"
165143-166113 xfp: field-val: "20.0 nm"
166846-166929 xfp: field-name-and-val: "Maximum case temperature: 70 C"
166846-166929 xfp: field-val: "70 C"
168620-168703 xfp: field-name-and-val: "Max power dissipation: 2.500 W"
168620-168703 xfp: field-val: "2.500 W"
169445-169530 xfp: field-name-and-val: "Max power dissipation (powered down): 1.500 W"
169445-169530 xfp: field-val: "1.500 W"
170347-170431 xfp: field-name-and-val: "Max current required (5V supply): 0.000 A"
170347-170431 xfp: field-val: "0.000 A"
170347-170431 xfp: field-name-and-val: "Max current required (3.3V supply): 0.800 A"
170347-170431 xfp: field-val: "0.800 A"
171185-171270 xfp: field-name-and-val: "Max current required (1.8V supply): 0.000 A"
171185-171270 xfp: field-val: "0.000 A"
171185-171270 xfp: field-name-and-val: "Max current required (-5.2V supply): 0.000 A"
171185-171270 xfp: field-val: "0.000 A"
171981-184609 xfp: field-name-and-val: "Vendor serial number: 833012A00388"
171981-184609 xfp: field-val: "833012A00388"
185331-191269 xfp: field-name-and-val: "Manufacturing date: 2008-03-21 lot A5"
185331-191269 xfp: field-val: "2008-03-21 lot A5"
192082-192167 xfp: field-name-and-val: "Diagnostic monitoring: no BER support, average power measurement"
192082-192167 xfp: field-val: "no BER support, average power measurement"
192944-193027 xfp: field-name-and-val: "Enhanced option support: soft TX_DISABLE, soft P_Down"
192944-193027 xfp: field-val: "soft TX_DISABLE, soft P_Down"
193917-194000 xfp: field-name-and-val: "AUX1 monitoring: 3.3V supply voltage"
193917-194000 xfp: field-val: "3.3V supply voltage"
193917-194000 xfp: field-name-and-val: "AUX2 monitoring: not implemented"
193917-194000 xfp: field-val: "not implemented"
195798-195881 xfp: field-name-and-val: "Vendor ID: 3"
195798-195881 xfp: field-val: "3"
195798-195881 xfp: field-name-and-val: "Vendor ID: H"
195798-195881 xfp: field-val: "H"
195798-195881 xfp: field-name-and-val: "Vendor ID: E"
195798-195881 xfp: field-val: "E"
195798-195881 xfp: field-name-and-val: "Vendor ID: 0"
195798-195881 xfp: field-val: "0"
195798-195881 xfp: field-name-and-val: "Vendor ID: 0"
195798-195881 xfp: field-val: "0"
195798-195881 xfp: field-name-and-val: "Vendor ID: 5"
195798-195881 xfp: field-val: "5"
195798-195881 xfp: field-name-and-val: "Vendor ID: 6"
195798-195881 xfp: field-val: "6"
195798-195881 xfp: field-name-and-val: "Vendor ID: 4"
195798-195881 xfp: field-val: "4"
195798-195881 xfp: field-name-and-val: "Vendor ID: A"
195798-195881 xfp: field-val: "A"
195798-195881 xfp: field-name-and-val: "Vendor ID: A"
195798-195881 xfp: field-val: "A"
195798-195881 xfp: field-name-and-val: "Vendor ID: A"
195798-195881 xfp: field-val: "A"
195798-195881 xfp: field-name-and-val: "Vendor ID: A"
195798-195881 xfp: field-val: "A"
195798-195881 xfp: field-name-and-val: "Vendor ID: 0"
195798-195881 xfp: field-val: "0"
195798-195881 xfp: field-name-and-val: "Vendor ID: 1"
195798-195881 xfp: field-val: "1"
195798-195881 xfp: field-name-and-val: "Vendor ID:  "
195798-195881 xfp: field-val: " "
195798-195881 xfp: field-name-and-val: "Vendor ID:  "
195798-195881 xfp: field-val: " "
195798-195881 xfp: field-name-and-val: "Vendor ID: A"
195798-195881 xfp: field-val: "A"
195798-195881 xfp: field-name-and-val: "Vendor ID: L"
195798-195881 xfp: field-val: "L"
195798-195881 xfp: field-name-and-val: "Vendor ID: A"
195798-195881 xfp: field-val: "A"
195798-195881 xfp: field-name-and-val: "Vendor ID:  "
195798-195881 xfp: field-val: " "
195798-195881 xfp: field-name-and-val: "Vendor ID:  "
195798-195881 xfp: field-val: " "
195798-195881 xfp: field-name-and-val: "Vendor ID: I"
195798-195881 xfp: field-val: "I"
195798-195881 xfp: field-name-and-val: "Vendor ID: P"
195798-195881 xfp: field-val: "P"
195798-195881 xfp: field-name-and-val: "Vendor ID: U"
195798-195881 xfp: field-val: "U"
195798-195881 xfp: field-name-and-val: "Vendor ID: I"
195798-195881 xfp: field-val: "I"
195798-195881 xfp: field-name-and-val: "Vendor ID: A"
195798-195881 xfp: field-val: "A"
195798-195881 xfp: field-name-and-val: "Vendor ID: R"
195798-195881 xfp: field-val: "R"
195798-195881 xfp: field-name-and-val: "Vendor ID: R"
195798-195881 xfp: field-val: "R"
195798-195881 xfp: field-name-and-val: "Vendor ID: D"
195798-195881 xfp: field-val: "D"
195798-195881 xfp: field-name-and-val: "Vendor ID: A"
195798-195881 xfp: field-val: "A"
195798-195881 xfp: field-name-and-val: "Vendor ID: A"
195798-195881 xfp: field-val: "A"
195798-195881 xfp: field-name-and-val: "Vendor ID: T"
195798-195881 xfp: field-val: "T"
