532-541 sent: fast-channel1-error: "Channel 1: Value OK (0)" "Ch1: OK (0)"
1108-1117 sent: fast-channel1-error: "Channel 1: Value OK (0)" "Ch1: OK (0)"
1684-1693 sent: fast-channel1-error: "Channel 1: Value OK (0)" "Ch1: OK (0)"
2260-2269 sent: fast-channel1-error: "Channel 1: Value OK (0)" "Ch1: OK (0)"
2836-2845 sent: fast-channel1-error: "Channel 1: Value OK (0)" "Ch1: OK (0)"
3412-3421 sent: fast-channel1-error: "Channel 1: Value OK (0)" "Ch1: OK (0)"
3988-3997 sent: fast-channel1-error: "Channel 1: Value OK (0)" "Ch1: OK (0)"
4564-4573 sent: fast-channel1-error: "Channel 1: Value OK (0)" "Ch1: OK (0)"
5140-5149 sent: fast-channel1-error: "Channel 1: Value OK (0)" "Ch1: OK (0)"
5716-5725 sent: fast-channel1-error: "Channel 1: Value OK (0)" "Ch1: OK (0)"
6292-6301 sent: fast-channel1-error: "Channel 1: Value OK (0)" "Ch1: OK (0)"
6868-6877 sent: fast-channel1-error: "Channel 1: Value OK (0)" "Ch1: OK (0)"
7444-7453 sent: fast-channel1-error: "Channel 1: Value OK (0)" "Ch1: OK (0)"
8021-8030 sent: fast-channel1-error: "Channel 1: Value OK (0)" "Ch1: OK (0)"
8597-8606 sent: fast-channel1-error: "Channel 1: Value OK (0)" "Ch1: OK (0)"
9173-9182 sent: fast-channel1-error: "Channel 1: Value OK (0)" "Ch1: OK (0)"
9749-9758 sent: fast-channel1-error: "Channel 1: Value OK (0)" "Ch1: OK (0)"
10325-10334 sent: fast-channel1-error: "Channel 1: Value OK (0)" "Ch1: OK (0)"
10901-10910 sent: fast-channel1-error: "Channel 1: Value OK (0)" "Ch1: OK (0)"
11477-11486 sent: fast-channel1-error: "Channel 1: Value OK (0)" "Ch1: OK (0)"
12053-12062 sent: fast-channel1-error: "Channel 1: Value OK (0)" "Ch1: OK (0)"
12629-12638 sent: fast-channel1-error: "Channel 1: Value OK (0)" "Ch1: OK (0)"
13205-13214 sent: fast-channel1-error: "Channel 1: Value OK (0)" "Ch1: OK (0)"
13781-13790 sent: fast-channel1-error: "Channel 1: Value OK (0)" "Ch1: OK (0)"
14357-14366 sent: fast-channel1-error: "Channel 1: Value OK (0)" "Ch1: OK (0)"
14933-14942 sent: fast-channel1-error: "Channel 1: Value OK (0)" "Ch1: OK (0)"
15510-15519 sent: fast-channel1-error: "Channel 1: Value OK (0)" "Ch1: OK (0)"
16086-16095 sent: fast-channel1-error: "Channel 1: Value OK (0)" "Ch1: OK (0)"
16662-16671 sent: fast-channel1-error: "Channel 1: Value OK (0)" "Ch1: OK (0)"
17238-17247 sent: fast-channel1-error: "Channel 1: Value OK (0)" "Ch1: OK (0)"
17814-17823 sent: fast-channel1-error: "Channel 1: Value OK (0)" "Ch1: OK (0)"
18390-18399 sent: fast-channel1-error: "Channel 1: Value OK (0)" "Ch1: OK (0)"
18966-18975 sent: fast-channel1-error: "Channel 1: Value OK (0)" "Ch1: OK (0)"
19542-19551 sent: fast-channel1-error: "Channel 1: Value OK (0)" "Ch1: OK (0)"
20118-20127 sent: fast-channel1-error: "Channel 1: Value OK (0)" "Ch1: OK (0)"
20694-20703 sent: fast-channel1-error: "Channel 1: Value OK (0)" "Ch1: OK (0)"
21270-21279 sent: fast-channel1-error: "Channel 1: Value OK (0)" "Ch1: OK (0)"
21846-21855 sent: fast-channel1-error: "Channel 1: Value OK (0)" "Ch1: OK (0)"
22422-22431 sent: fast-channel1-error: "Channel 1: Value OK (0)" "Ch1: OK (0)"
22999-23008 sent: fast-channel1-error: "Channel 1: Value OK (0)" "Ch1: OK (0)"
23575-23584 sent: fast-channel1-error: "Channel 1: Value OK (0)" "Ch1: OK (0)"
24151-24160 sent: fast-channel1-error: "Channel 1: Value OK (0)" "Ch1: OK (0)"
24727-24736 sent: fast-channel1-error: "Channel 1: Value OK (0)" "Ch1: OK (0)"
25303-25312 sent: fast-channel1-error: "Channel 1: Value OK (0)" "Ch1: OK (0)"
25879-25888 sent: fast-channel1-error: "Channel 1: Value OK (0)" "Ch1: OK (0)"
26455-26464 sent: fast-channel1-error: "Channel 1: Value OK (0)" "Ch1: OK (0)"
27031-27040 sent: fast-channel1-error: "Channel 1: Value OK (0)" "Ch1: OK (0)"
27607-27616 sent: fast-channel1-error: "Channel 1: Value OK (0)" "Ch1: OK (0)"
28183-28192 sent: fast-channel1-error: "Channel 1: Value OK (0)" "Ch1: OK (0)"
28759-28768 sent: fast-channel1-error: "Channel 1: Value OK (0)" "Ch1: OK (0)"
29335-29344 sent: fast-channel1-error: "Channel 1: Value OK (0)" "Ch1: OK (0)"
29911-29920 sent: fast-channel1-error: "Channel 1: Value OK (0)" "Ch1: OK (0)"
30487-30496 sent: fast-channel1-error: "Channel 1: Value OK (0)" "Ch1: OK (0)"
31064-31073 sent: fast-channel1-error: "Channel 1: Value OK (0)" "Ch1: OK (0)"
31640-31649 sent: fast-channel1-error: "Channel 1: Value OK (0)" "Ch1: OK (0)"
32216-32225 sent: fast-channel1-error: "Channel 1: Value OK (0)" "Ch1: OK (0)"
32792-32801 sent: fast-channel1-error: "Channel 1: Value OK (0)" "Ch1: OK (0)"
33368-33377 sent: fast-channel1-error: "Channel 1: Value OK (0)" "Ch1: OK (0)"
33944-33953 sent: fast-channel1-error: "Channel 1: Value OK (0)" "Ch1: OK (0)"
34520-34529 sent: fast-channel1-error: "Channel 1: Value OK (0)" "Ch1: OK (0)"
35096-35105 sent: fast-channel1-error: "Channel 1: Value OK (0)" "Ch1: OK (0)"
35672-35681 sent: fast-channel1-error: "Channel 1: Value OK (0)" "Ch1: OK (0)"
36248-36257 sent: fast-channel1-error: "Channel 1: Value OK (0)" "Ch1: OK (0)"
36824-36833 sent: fast-channel1-error: "Channel 1: Value OK (0)" "Ch1: OK (0)"
37400-37409 sent: fast-channel1-error: "Channel 1: Value OK (0)" "Ch1: OK (0)"
37976-37985 sent: fast-channel1-error: "Channel 1: Value OK (0)" "Ch1: OK (0)"
38553-38562 sent: fast-channel1-error: "Channel 1: Value OK (0)" "Ch1: OK (0)"
39129-39138 sent: fast-channel1-error: "Channel 1: Value OK (0)" "Ch1: OK (0)"
39705-39714 sent: fast-channel1-error: "Channel 1: Value OK (0)" "Ch1: OK (0)"
40281-40290 sent: fast-channel1-error: "Channel 1: Value OK (0)" "Ch1: OK (0)"
40857-40866 sent: fast-channel1-error: "Channel 1: Value OK (0)" "Ch1: OK (0)"
41433-41442 sent: fast-channel1-error: "Channel 1: Value OK (0)" "Ch1: OK (0)"
42009-42018 sent: fast-channel1-error: "Channel 1: Value OK (0)" "Ch1: OK (0)"
42585-42594 sent: fast-channel1-error: "Channel 1: Value OK (0)" "Ch1: OK (0)"
43161-43170 sent: fast-channel1-error: "Channel 1: Value OK (0)" "Ch1: OK (0)"
43737-43746 sent: fast-channel1-error: "Channel 1: Value OK (0)" "Ch1: OK (0)"
44313-44322 sent: fast-channel1-error: "Channel 1: Value OK (0)" "Ch1: OK (0)"
44889-44898 sent: fast-channel1-error: "Channel 1: Value OK (0)" "Ch1: OK (0)"
45465-45474 sent: fast-channel1-error: "Channel 1: Value OK (0)" "Ch1: OK (0)"
46042-46051 sent: fast-channel1-error: "Channel 1: Value OK (0)" "Ch1: OK (0)"
46618-46627 sent: fast-channel1-error: "Channel 1: Value OK (0)" "Ch1: OK (0)"
47194-47203 sent: fast-channel1-error: "Channel 1: Value OK (0)" "Ch1: OK (0)"
47770-47779 sent: fast-channel1-error: "Channel 1: Value OK (0)" "Ch1: OK (0)"
48346-48355 sent: fast-channel1-error: "Channel 1: Value OK (0)" "Ch1: OK (0)"
48922-48931 sent: fast-channel1-error: "Channel 1: Value OK (0)" "Ch1: OK (0)"
49498-49507 sent: fast-channel1-error: "Channel 1: Value OK (0)" "Ch1: OK (0)"
50074-50083 sent: fast-channel1-error: "Channel 1: Value OK (0)" "Ch1: OK (0)"
50650-50659 sent: fast-channel1-error: "Channel 1: Value OK (0)" "Ch1: OK (0)"
51226-51235 sent: fast-channel1-error: "Channel 1: Value OK (0)" "Ch1: OK (0)"
51802-51811 sent: fast-channel1-error: "Channel 1: Value OK (0)" "Ch1: OK (0)"
52378-52387 sent: fast-channel1-error: "Channel 1: Value OK (0)" "Ch1: OK (0)"
52954-52963 sent: fast-channel1-error: "Channel 1: Value OK (0)" "Ch1: OK (0)"
53530-53539 sent: fast-channel1-error: "Channel 1: Value OK (0)" "Ch1: OK (0)"
54107-54116 sent: fast-channel1-error: "Channel 1: Value OK (0)" "Ch1: OK (0)"
54683-54692 sent: fast-channel1-error: "Channel 1: Value OK (0)" "Ch1: OK (0)"
55259-55268 sent: fast-channel1-error: "Channel 1: Value OK (0)" "Ch1: OK (0)"
55835-55844 sent: fast-channel1-error: "Channel 1: Value OK (0)" "Ch1: OK (0)"
56411-56420 sent: fast-channel1-error: "Channel 1: Value OK (0)" "Ch1: OK (0)"
56987-56996 sent: fast-channel1-error: "Channel 1: Value OK (0)" "Ch1: OK (0)"
57563-57572 sent: fast-channel1-error: "Channel 1: Value OK (0)" "Ch1: OK (0)"
58139-58148 sent: fast-channel1-error: "Channel 1: Value OK (0)" "Ch1: OK (0)"
58715-58724 sent: fast-channel1-error: "Channel 1: Value OK (0)" "Ch1: OK (0)"
59291-59300 sent: fast-channel1-error: "Channel 1: Value OK (0)" "Ch1: OK (0)"
59867-59876 sent: fast-channel1-error: "Channel 1: Value OK (0)" "Ch1: OK (0)"
60443-60452 sent: fast-channel1-error: "Channel 1: Value OK (0)" "Ch1: OK (0)"
61019-61028 sent: fast-channel1-error: "Channel 1: Value OK (0)" "Ch1: OK (0)"
61596-61605 sent: fast-channel1-error: "Channel 1: Value OK (0)" "Ch1: OK (0)"
62172-62181 sent: fast-channel1-error: "Channel 1: Value OK (0)" "Ch1: OK (0)"
62748-62757 sent: fast-channel1-error: "Channel 1: Value OK (0)" "Ch1: OK (0)"
63324-63333 sent: fast-channel1-error: "Channel 1: Value OK (0)" "Ch1: OK (0)"
63900-63909 sent: fast-channel1-error: "Channel 1: Value OK (0)" "Ch1: OK (0)"
64476-64485 sent: fast-channel1-error: "Channel 1: Value OK (0)" "Ch1: OK (0)"
65052-65061 sent: fast-channel1-error: "Channel 1: Value OK (0)" "Ch1: OK (0)"
65628-65637 sent: fast-channel1-error: "Channel 1: Value OK (0)" "Ch1: OK (0)"
66204-66213 sent: fast-channel1-error: "Channel 1: Value OK (0)" "Ch1: OK (0)"
66780-66789 sent: fast-channel1-error: "Channel 1: Value OK (0)" "Ch1: OK (0)"
67356-67365 sent: fast-channel1-error: "Channel 1: Value OK (0)" "Ch1: OK (0)"
67932-67941 sent: fast-channel1-error: "Channel 1: Value OK (0)" "Ch1: OK (0)"
68508-68517 sent: fast-channel1-error: "Channel 1: Value OK (0)" "Ch1: OK (0)"
69085-69094 sent: fast-channel1-error: "Channel 1: Value OK (0)" "Ch1: OK (0)"
69661-69670 sent: fast-channel1-error: "Channel 1: Value OK (0)" "Ch1: OK (0)"
70237-70246 sent: fast-channel1-error: "Channel 1: Value OK (0)" "Ch1: OK (0)"
70813-70822 sent: fast-channel1-error: "Channel 1: Value OK (0)" "Ch1: OK (0)"
71389-71398 sent: fast-channel1-error: "Channel 1: Value OK (0)" "Ch1: OK (0)"
71965-71974 sent: fast-channel1-error: "Channel 1: Value OK (0)" "Ch1: OK (0)"
72541-72550 sent: fast-channel1-error: "Channel 1: Value OK (0)" "Ch1: OK (0)"
73117-73126 sent: fast-channel1-error: "Channel 1: Value OK (0)" "Ch1: OK (0)"
73693-73702 sent: fast-channel1-error: "Channel 1: Value OK (0)" "Ch1: OK (0)"
74269-74278 sent: fast-channel1-error: "Channel 1: Value OK (0)" "Ch1: OK (0)"
74845-74854 sent: fast-channel1-error: "Channel 1: Value OK (0)" "Ch1: OK (0)"
75421-75430 sent: fast-channel1-error: "Channel 1: Value OK (0)" "Ch1: OK (0)"
75997-76006 sent: fast-channel1-error: "Channel 1: Value OK (0)" "Ch1: OK (0)"
76573-76582 sent: fast-channel1-error: "Channel 1: Value OK (0)" "Ch1: OK (0)"
77150-77159 sent: fast-channel1-error: "Channel 1: Value OK (0)" "Ch1: OK (0)"
77726-77735 sent: fast-channel1-error: "Channel 1: Value OK (0)" "Ch1: OK (0)"
78302-78311 sent: fast-channel1-error: "Channel 1: Value OK (0)" "Ch1: OK (0)"
78878-78887 sent: fast-channel1-error: "Channel 1: Value OK (0)" "Ch1: OK (0)"
79454-79463 sent: fast-channel1-error: "Channel 1: Value OK (0)" "Ch1: OK (0)"
80030-80039 sent: fast-channel1-error: "Channel 1: Value OK (0)" "Ch1: OK (0)"
80606-80615 sent: fast-channel1-error: "Channel 1: Value OK (0)" "Ch1: OK (0)"
81182-81191 sent: fast-channel1-error: "Channel 1: Value OK (0)" "Ch1: OK (0)"
81758-81767 sent: fast-channel1-error: "Channel 1: Value OK (0)" "Ch1: OK (0)"
82334-82343 sent: fast-channel1-error: "Channel 1: Value OK (0)" "Ch1: OK (0)"
82910-82919 sent: fast-channel1-error: "Channel 1: Value OK (0)" "Ch1: OK (0)"
83486-83495 sent: fast-channel1-error: "Channel 1: Value OK (0)" "Ch1: OK (0)"
84062-84071 sent: fast-channel1-error: "Channel 1: Value OK (0)" "Ch1: OK (0)"
84639-84648 sent: fast-channel1-error: "Channel 1: Value OK (0)" "Ch1: OK (0)"
85215-85224 sent: fast-channel1-error: "Channel 1: Value OK (0)" "Ch1: OK (0)"
85791-85800 sent: fast-channel1-error: "Channel 1: Value OK (0)" "Ch1: OK (0)"
86367-86376 sent: fast-channel1-error: "Channel 1: Value OK (0)" "Ch1: OK (0)"
86943-86952 sent: fast-channel1-error: "Channel 1: Value OK (0)" "Ch1: OK (0)"
87519-87528 sent: fast-channel1-error: "Channel 1: Value OK (0)" "Ch1: OK (0)"
88095-88104 sent: fast-channel1-error: "Channel 1: Value OK (0)" "Ch1: OK (0)"
88671-88680 sent: fast-channel1-error: "Channel 1: Value OK (0)" "Ch1: OK (0)"
89247-89256 sent: fast-channel1-error: "Channel 1: Value OK (0)" "Ch1: OK (0)"
89823-89832 sent: fast-channel1-error: "Channel 1: Value OK (0)" "Ch1: OK (0)"
90399-90408 sent: fast-channel1-error: "Channel 1: Value OK (0)" "Ch1: OK (0)"
90975-90984 sent: fast-channel1-error: "Channel 1: Value OK (0)" "Ch1: OK (0)"
91551-91560 sent: fast-channel1-error: "Channel 1: Value OK (0)" "Ch1: OK (0)"
92128-92137 sent: fast-channel1-error: "Channel 1: Value OK (0)" "Ch1: OK (0)"
92704-92713 sent: fast-channel1-error: "Channel 1: Value OK (0)" "Ch1: OK (0)"
93280-93289 sent: fast-channel1-error: "Channel 1: Value OK (0)" "Ch1: OK (0)"
93856-93865 sent: fast-channel1-error: "Channel 1: Value OK (0)" "Ch1: OK (0)"
94432-94441 sent: fast-channel1-error: "Channel 1: Value OK (0)" "Ch1: OK (0)"
95008-95017 sent: fast-channel1-error: "Channel 1: Value OK (0)" "Ch1: OK (0)"
95584-95593 sent: fast-channel1-error: "Channel 1: Value OK (0)" "Ch1: OK (0)"
96160-96169 sent: fast-channel1-error: "Channel 1: Value OK (0)" "Ch1: OK (0)"
96736-96745 sent: fast-channel1-error: "Channel 1: Value OK (0)" "Ch1: OK (0)"
97312-97321 sent: fast-channel1-error: "Channel 1: Value OK (0)" "Ch1: OK (0)"
97888-97897 sent: fast-channel1-error: "Channel 1: Value OK (0)" "Ch1: OK (0)"
98464-98473 sent: fast-channel1-error: "Channel 1: Value OK (0)" "Ch1: OK (0)"
99040-99049 sent: fast-channel1-error: "Channel 1: Value OK (0)" "Ch1: OK (0)"
99616-99625 sent: fast-channel1-error: "Channel 1: Value OK (0)" "Ch1: OK (0)"
