362-428 sent: data: "Data" "D"
428-497 sent: data: "Data" "D"
497-569 sent: data: "Data" "D"
569-650 sent: data: "Data" "D"
650-728 sent: data: "Data" "D"
728-803 sent: data: "Data" "D"
3390-3456 sent: data: "Data" "D"
3456-3525 sent: data: "Data" "D"
3525-3597 sent: data: "Data" "D"
3597-3678 sent: data: "Data" "D"
3678-3756 sent: data: "Data" "D"
3756-3831 sent: data: "Data" "D"
6417-6483 sent: data: "Data" "D"
6483-6552 sent: data: "Data" "D"
6552-6624 sent: data: "Data" "D"
6624-6705 sent: data: "Data" "D"
6705-6783 sent: data: "Data" "D"
6783-6858 sent: data: "Data" "D"
9444-9510 sent: data: "Data" "D"
9510-9579 sent: data: "Data" "D"
9579-9651 sent: data: "Data" "D"
9651-9732 sent: data: "Data" "D"
9732-9810 sent: data: "Data" "D"
9810-9885 sent: data: "Data" "D"
12472-12538 sent: data: "Data" "D"
12538-12607 sent: data: "Data" "D"
12607-12679 sent: data: "Data" "D"
12679-12760 sent: data: "Data" "D"
12760-12838 sent: data: "Data" "D"
12838-12913 sent: data: "Data" "D"
15499-15565 sent: data: "Data" "D"
15565-15634 sent: data: "Data" "D"
15634-15706 sent: data: "Data" "D"
15706-15787 sent: data: "Data" "D"
15787-15865 sent: data: "Data" "D"
15865-15940 sent: data: "Data" "D"
18527-18593 sent: data: "Data" "D"
18593-18662 sent: data: "Data" "D"
18662-18734 sent: data: "Data" "D"
18734-18815 sent: data: "Data" "D"
18815-18893 sent: data: "Data" "D"
18893-18968 sent: data: "Data" "D"
21554-21620 sent: data: "Data" "D"
21620-21689 sent: data: "Data" "D"
21689-21761 sent: data: "Data" "D"
21761-21842 sent: data: "Data" "D"
21842-21920 sent: data: "Data" "D"
21920-21995 sent: data: "Data" "D"
24581-24647 sent: data: "Data" "D"
24647-24716 sent: data: "Data" "D"
24716-24788 sent: data: "Data" "D"
24788-24869 sent: data: "Data" "D"
24869-24947 sent: data: "Data" "D"
24947-25022 sent: data: "Data" "D"
27609-27675 sent: data: "Data" "D"
27675-27744 sent: data: "Data" "D"
27744-27816 sent: data: "Data" "D"
27816-27897 sent: data: "Data" "D"
27897-27975 sent: data: "Data" "D"
27975-28050 sent: data: "Data" "D"
30636-30702 sent: data: "Data" "D"
30702-30771 sent: data: "Data" "D"
30771-30843 sent: data: "Data" "D"
30843-30924 sent: data: "Data" "D"
30924-31002 sent: data: "Data" "D"
31002-31077 sent: data: "Data" "D"
33664-33730 sent: data: "Data" "D"
33730-33799 sent: data: "Data" "D"
33799-33871 sent: data: "Data" "D"
33871-33952 sent: data: "Data" "D"
33952-34030 sent: data: "Data" "D"
34030-34105 sent: data: "Data" "D"
36691-36757 sent: data: "Data" "D"
36757-36826 sent: data: "Data" "D"
36826-36898 sent: data: "Data" "D"
36898-36979 sent: data: "Data" "D"
36979-37057 sent: data: "Data" "D"
37057-37132 sent: data: "Data" "D"
39718-39784 sent: data: "Data" "D"
39784-39853 sent: data: "Data" "D"
39853-39925 sent: data: "Data" "D"
39925-40006 sent: data: "Data" "D"
40006-40084 sent: data: "Data" "D"
40084-40159 sent: data: "Data" "D"
42746-42812 sent: data: "Data" "D"
42812-42881 sent: data: "Data" "D"
42881-42953 sent: data: "Data" "D"
42953-43034 sent: data: "Data" "D"
43034-43112 sent: data: "Data" "D"
43112-43187 sent: data: "Data" "D"
45773-45839 sent: data: "Data" "D"
45839-45908 sent: data: "Data" "D"
45908-45980 sent: data: "Data" "D"
45980-46061 sent: data: "Data" "D"
46061-46139 sent: data: "Data" "D"
46139-46214 sent: data: "Data" "D"
48801-48867 sent: data: "Data" "D"
48867-48936 sent: data: "Data" "D"
48936-49008 sent: data: "Data" "D"
49008-49089 sent: data: "Data" "D"
49089-49167 sent: data: "Data" "D"
49167-49242 sent: data: "Data" "D"
51828-51894 sent: data: "Data" "D"
51894-51963 sent: data: "Data" "D"
51963-52035 sent: data: "Data" "D"
52035-52116 sent: data: "Data" "D"
52116-52194 sent: data: "Data" "D"
52194-52269 sent: data: "Data" "D"
54855-54921 sent: data: "Data" "D"
54921-54990 sent: data: "Data" "D"
54990-55062 sent: data: "Data" "D"
55062-55143 sent: data: "Data" "D"
55143-55221 sent: data: "Data" "D"
55221-55296 sent: data: "Data" "D"
57883-57949 sent: data: "Data" "D"
57949-58018 sent: data: "Data" "D"
58018-58090 sent: data: "Data" "D"
58090-58171 sent: data: "Data" "D"
58171-58249 sent: data: "Data" "D"
58249-58324 sent: data: "Data" "D"
60910-60976 sent: data: "Data" "D"
60976-61045 sent: data: "Data" "D"
61045-61117 sent: data: "Data" "D"
61117-61198 sent: data: "Data" "D"
61198-61276 sent: data: "Data" "D"
61276-61351 sent: data: "Data" "D"
63937-64004 sent: data: "Data" "D"
64004-64073 sent: data: "Data" "D"
64073-64145 sent: data: "Data" "D"
64145-64226 sent: data: "Data" "D"
64226-64304 sent: data: "Data" "D"
64304-64379 sent: data: "Data" "D"
66965-67031 sent: data: "Data" "D"
67031-67100 sent: data: "Data" "D"
67100-67172 sent: data: "Data" "D"
67172-67253 sent: data: "Data" "D"
67253-67331 sent: data: "Data" "D"
67331-67406 sent: data: "Data" "D"
69992-70058 sent: data: "Data" "D"
70058-70127 sent: data: "Data" "D"
70127-70199 sent: data: "Data" "D"
70199-70280 sent: data: "Data" "D"
70280-70358 sent: data: "Data" "D"
70358-70433 sent: data: "Data" "D"
73020-73086 sent: data: "Data" "D"
73086-73155 sent: data: "Data" "D"
73155-73227 sent: data: "Data" "D"
73227-73308 sent: data: "Data" "D"
73308-73386 sent: data: "Data" "D"
73386-73461 sent: data: "Data" "D"
76047-76113 sent: data: "Data" "D"
76113-76182 sent: data: "Data" "D"
76182-76254 sent: data: "Data" "D"
76254-76335 sent: data: "Data" "D"
76335-76413 sent: data: "Data" "D"
76413-76488 sent: data: "Data" "D"
79074-79140 sent: data: "Data" "D"
79140-79209 sent: data: "Data" "D"
79209-79281 sent: data: "Data" "D"
79281-79363 sent: data: "Data" "D"
79363-79441 sent: data: "Data" "D"
79441-79516 sent: data: "Data" "D"
82102-82168 sent: data: "Data" "D"
82168-82237 sent: data: "Data" "D"
82237-82309 sent: data: "Data" "D"
82309-82390 sent: data: "Data" "D"
82390-82468 sent: data: "Data" "D"
82468-82543 sent: data: "Data" "D"
85129-85195 sent: data: "Data" "D"
85195-85264 sent: data: "Data" "D"
85264-85336 sent: data: "Data" "D"
85336-85417 sent: data: "Data" "D"
85417-85495 sent: data: "Data" "D"
85495-85570 sent: data: "Data" "D"
88157-88223 sent: data: "Data" "D"
88223-88292 sent: data: "Data" "D"
88292-88364 sent: data: "Data" "D"
88364-88445 sent: data: "Data" "D"
88445-88523 sent: data: "Data" "D"
88523-88598 sent: data: "Data" "D"
91184-91250 sent: data: "Data" "D"
91250-91319 sent: data: "Data" "D"
91319-91391 sent: data: "Data" "D"
91391-91472 sent: data: "Data" "D"
91472-91550 sent: data: "Data" "D"
91550-91625 sent: data: "Data" "D"
94211-94277 sent: data: "Data" "D"
94277-94346 sent: data: "Data" "D"
94346-94418 sent: data: "Data" "D"
94418-94499 sent: data: "Data" "D"
94499-94577 sent: data: "Data" "D"
94577-94652 sent: data: "Data" "D"
97239-97305 sent: data: "Data" "D"
97305-97374 sent: data: "Data" "D"
97374-97446 sent: data: "Data" "D"
97446-97527 sent: data: "Data" "D"
97527-97605 sent: data: "Data" "D"
97605-97680 sent: data: "Data" "D"
