822-891 sent: pulse-pause: "Pulse Pause" "Pause" "P"
1722-1791 sent: pulse-pause: "Pulse Pause" "Pause" "P"
2622-2691 sent: pulse-pause: "Pulse Pause" "Pause" "P"
3522-3591 sent: pulse-pause: "Pulse Pause" "Pause" "P"
4423-4492 sent: pulse-pause: "Pulse Pause" "Pause" "P"
5323-5392 sent: pulse-pause: "Pulse Pause" "Pause" "P"
6223-6292 sent: pulse-pause: "Pulse Pause" "Pause" "P"
7123-7192 sent: pulse-pause: "Pulse Pause" "Pause" "P"
8023-8092 sent: pulse-pause: "Pulse Pause" "Pause" "P"
8923-8992 sent: pulse-pause: "Pulse Pause" "Pause" "P"
9823-9892 sent: pulse-pause: "Pulse Pause" "Pause" "P"
10723-10792 sent: pulse-pause: "Pulse Pause" "Pause" "P"
11624-11693 sent: pulse-pause: "Pulse Pause" "Pause" "P"
12524-12593 sent: pulse-pause: "Pulse Pause" "Pause" "P"
13424-13493 sent: pulse-pause: "Pulse Pause" "Pause" "P"
14324-14393 sent: pulse-pause: "Pulse Pause" "Pause" "P"
15224-15293 sent: pulse-pause: "Pulse Pause" "Pause" "P"
16124-16193 sent: pulse-pause: "Pulse Pause" "Pause" "P"
17024-17093 sent: pulse-pause: "Pulse Pause" "Pause" "P"
17924-17993 sent: pulse-pause: "Pulse Pause" "Pause" "P"
18824-18893 sent: pulse-pause: "Pulse Pause" "Pause" "P"
19725-19794 sent: pulse-pause: "Pulse Pause" "Pause" "P"
20625-20694 sent: pulse-pause: "Pulse Pause" "Pause" "P"
21525-21594 sent: pulse-pause: "Pulse Pause" "Pause" "P"
22425-22494 sent: pulse-pause: "Pulse Pause" "Pause" "P"
23325-23394 sent: pulse-pause: "Pulse Pause" "Pause" "P"
24225-24294 sent: pulse-pause: "Pulse Pause" "Pause" "P"
25125-25194 sent: pulse-pause: "Pulse Pause" "Pause" "P"
26025-26094 sent: pulse-pause: "Pulse Pause" "Pause" "P"
26926-26995 sent: pulse-pause: "Pulse Pause" "Pause" "P"
27826-27895 sent: pulse-pause: "Pulse Pause" "Pause" "P"
28726-28795 sent: pulse-pause: "Pulse Pause" "Pause" "P"
29626-29695 sent: pulse-pause: "Pulse Pause" "Pause" "P"
30526-30595 sent: pulse-pause: "Pulse Pause" "Pause" "P"
31426-31495 sent: pulse-pause: "Pulse Pause" "Pause" "P"
32326-32395 sent: pulse-pause: "Pulse Pause" "Pause" "P"
33226-33295 sent: pulse-pause: "Pulse Pause" "Pause" "P"
34126-34195 sent: pulse-pause: "Pulse Pause" "Pause" "P"
35027-35096 sent: pulse-pause: "Pulse Pause" "Pause" "P"
35927-35996 sent: pulse-pause: "Pulse Pause" "Pause" "P"
36827-36896 sent: pulse-pause: "Pulse Pause" "Pause" "P"
37727-37796 sent: pulse-pause: "Pulse Pause" "Pause" "P"
38627-38696 sent: pulse-pause: "Pulse Pause" "Pause" "P"
39527-39596 sent: pulse-pause: "Pulse Pause" "Pause" "P"
40427-40496 sent: pulse-pause: "Pulse Pause" "Pause" "P"
41327-41396 sent: pulse-pause: "Pulse Pause" "Pause" "P"
42228-42297 sent: pulse-pause: "Pulse Pause" "Pause" "P"
43128-43197 sent: pulse-pause: "Pulse Pause" "Pause" "P"
44028-44097 sent: pulse-pause: "Pulse Pause" "Pause" "P"
44928-44997 sent: pulse-pause: "Pulse Pause" "Pause" "P"
45828-45897 sent: pulse-pause: "Pulse Pause" "Pause" "P"
46728-46797 sent: pulse-pause: "Pulse Pause" "Pause" "P"
47628-47697 sent: pulse-pause: "Pulse Pause" "Pause" "P"
48528-48597 sent: pulse-pause: "Pulse Pause" "Pause" "P"
49428-49497 sent: pulse-pause: "Pulse Pause" "Pause" "P"
50329-50398 sent: pulse-pause: "Pulse Pause" "Pause" "P"
51229-51298 sent: pulse-pause: "Pulse Pause" "Pause" "P"
52129-52198 sent: pulse-pause: "Pulse Pause" "Pause" "P"
53029-53098 sent: pulse-pause: "Pulse Pause" "Pause" "P"
53929-53998 sent: pulse-pause: "Pulse Pause" "Pause" "P"
54829-54898 sent: pulse-pause: "Pulse Pause" "Pause" "P"
55729-55798 sent: pulse-pause: "Pulse Pause" "Pause" "P"
56629-56698 sent: pulse-pause: "Pulse Pause" "Pause" "P"
57529-57599 sent: pulse-pause: "Pulse Pause" "Pause" "P"
58430-58499 sent: pulse-pause: "Pulse Pause" "Pause" "P"
59330-59399 sent: pulse-pause: "Pulse Pause" "Pause" "P"
60230-60299 sent: pulse-pause: "Pulse Pause" "Pause" "P"
61130-61199 sent: pulse-pause: "Pulse Pause" "Pause" "P"
62030-62099 sent: pulse-pause: "Pulse Pause" "Pause" "P"
62930-62999 sent: pulse-pause: "Pulse Pause" "Pause" "P"
63830-63899 sent: pulse-pause: "Pulse Pause" "Pause" "P"
64730-64799 sent: pulse-pause: "Pulse Pause" "Pause" "P"
65631-65700 sent: pulse-pause: "Pulse Pause" "Pause" "P"
66531-66600 sent: pulse-pause: "Pulse Pause" "Pause" "P"
67431-67500 sent: pulse-pause: "Pulse Pause" "Pause" "P"
68331-68400 sent: pulse-pause: "Pulse Pause" "Pause" "P"
69231-69300 sent: pulse-pause: "Pulse Pause" "Pause" "P"
70131-70200 sent: pulse-pause: "Pulse Pause" "Pause" "P"
71031-71100 sent: pulse-pause: "Pulse Pause" "Pause" "P"
71931-72000 sent: pulse-pause: "Pulse Pause" "Pause" "P"
72831-72900 sent: pulse-pause: "Pulse Pause" "Pause" "P"
73732-73801 sent: pulse-pause: "Pulse Pause" "Pause" "P"
74632-74701 sent: pulse-pause: "Pulse Pause" "Pause" "P"
75532-75601 sent: pulse-pause: "Pulse Pause" "Pause" "P"
76432-76501 sent: pulse-pause: "Pulse Pause" "Pause" "P"
77332-77401 sent: pulse-pause: "Pulse Pause" "Pause" "P"
78232-78301 sent: pulse-pause: "Pulse Pause" "Pause" "P"
79132-79201 sent: pulse-pause: "Pulse Pause" "Pause" "P"
80032-80101 sent: pulse-pause: "Pulse Pause" "Pause" "P"
80933-81002 sent: pulse-pause: "Pulse Pause" "Pause" "P"
81833-81902 sent: pulse-pause: "Pulse Pause" "Pause" "P"
82733-82802 sent: pulse-pause: "Pulse Pause" "Pause" "P"
83633-83702 sent: pulse-pause: "Pulse Pause" "Pause" "P"
84533-84602 sent: pulse-pause: "Pulse Pause" "Pause" "P"
85433-85502 sent: pulse-pause: "Pulse Pause" "Pause" "P"
86333-86402 sent: pulse-pause: "Pulse Pause" "Pause" "P"
87233-87302 sent: pulse-pause: "Pulse Pause" "Pause" "P"
88133-88202 sent: pulse-pause: "Pulse Pause" "Pause" "P"
89034-89103 sent: pulse-pause: "Pulse Pause" "Pause" "P"
89934-90003 sent: pulse-pause: "Pulse Pause" "Pause" "P"
90834-90903 sent: pulse-pause: "Pulse Pause" "Pause" "P"
91734-91803 sent: pulse-pause: "Pulse Pause" "Pause" "P"
92634-92703 sent: pulse-pause: "Pulse Pause" "Pause" "P"
93534-93603 sent: pulse-pause: "Pulse Pause" "Pause" "P"
94434-94503 sent: pulse-pause: "Pulse Pause" "Pause" "P"
95334-95403 sent: pulse-pause: "Pulse Pause" "Pause" "P"
96235-96304 sent: pulse-pause: "Pulse Pause" "Pause" "P"
97135-97204 sent: pulse-pause: "Pulse Pause" "Pause" "P"
98035-98104 sent: pulse-pause: "Pulse Pause" "Pause" "P"
98935-99004 sent: pulse-pause: "Pulse Pause" "Pause" "P"
99835-99904 sent: pulse-pause: "Pulse Pause" "Pause" "P"
