550-757 sent: fast-channel1-value: "Channel 1: 2748 (0xABC)" "Ch1: 2748 (0xABC)" "Ch1: (0xABC)"
1126-1333 sent: fast-channel1-value: "Channel 1: 2748 (0xABC)" "Ch1: 2748 (0xABC)" "Ch1: (0xABC)"
1702-1909 sent: fast-channel1-value: "Channel 1: 2748 (0xABC)" "Ch1: 2748 (0xABC)" "Ch1: (0xABC)"
2278-2485 sent: fast-channel1-value: "Channel 1: 2748 (0xABC)" "Ch1: 2748 (0xABC)" "Ch1: (0xABC)"
2854-3061 sent: fast-channel1-value: "Channel 1: 2748 (0xABC)" "Ch1: 2748 (0xABC)" "Ch1: (0xABC)"
3430-3637 sent: fast-channel1-value: "Channel 1: 2748 (0xABC)" "Ch1: 2748 (0xABC)" "Ch1: (0xABC)"
4006-4213 sent: fast-channel1-value: "Channel 1: 2748 (0xABC)" "Ch1: 2748 (0xABC)" "Ch1: (0xABC)"
4582-4789 sent: fast-channel1-value: "Channel 1: 2748 (0xABC)" "Ch1: 2748 (0xABC)" "Ch1: (0xABC)"
5158-5365 sent: fast-channel1-value: "Channel 1: 2748 (0xABC)" "Ch1: 2748 (0xABC)" "Ch1: (0xABC)"
5734-5941 sent: fast-channel1-value: "Channel 1: 2748 (0xABC)" "Ch1: 2748 (0xABC)" "Ch1: (0xABC)"
6310-6517 sent: fast-channel1-value: "Channel 1: 2748 (0xABC)" "Ch1: 2748 (0xABC)" "Ch1: (0xABC)"
6886-7093 sent: fast-channel1-value: "Channel 1: 2748 (0xABC)" "Ch1: 2748 (0xABC)" "Ch1: (0xABC)"
7462-7670 sent: fast-channel1-value: "Channel 1: 2748 (0xABC)" "Ch1: 2748 (0xABC)" "Ch1: (0xABC)"
8039-8246 sent: fast-channel1-value: "Channel 1: 2748 (0xABC)" "Ch1: 2748 (0xABC)" "Ch1: (0xABC)"
8615-8822 sent: fast-channel1-value: "Channel 1: 2748 (0xABC)" "Ch1: 2748 (0xABC)" "Ch1: (0xABC)"
9191-9398 sent: fast-channel1-value: "Channel 1: 2748 (0xABC)" "Ch1: 2748 (0xABC)" "Ch1: (0xABC)"
9767-9974 sent: fast-channel1-value: "Channel 1: 2748 (0xABC)" "Ch1: 2748 (0xABC)" "Ch1: (0xABC)"
10343-10550 sent: fast-channel1-value: "Channel 1: 2748 (0xABC)" "Ch1: 2748 (0xABC)" "Ch1: (0xABC)"
10919-11126 sent: fast-channel1-value: "Channel 1: 2748 (0xABC)" "Ch1: 2748 (0xABC)" "Ch1: (0xABC)"
11495-11702 sent: fast-channel1-value: "Channel 1: 2748 (0xABC)" "Ch1: 2748 (0xABC)" "Ch1: (0xABC)"
12071-12278 sent: fast-channel1-value: "Channel 1: 2748 (0xABC)" "Ch1: 2748 (0xABC)" "Ch1: (0xABC)"
12647-12854 sent: fast-channel1-value: "Channel 1: 2748 (0xABC)" "Ch1: 2748 (0xABC)" "Ch1: (0xABC)"
13223-13430 sent: fast-channel1-value: "Channel 1: 2748 (0xABC)" "Ch1: 2748 (0xABC)" "Ch1: (0xABC)"
13799-14006 sent: fast-channel1-value: "Channel 1: 2748 (0xABC)" "Ch1: 2748 (0xABC)" "Ch1: (0xABC)"
14375-14582 sent: fast-channel1-value: "Channel 1: 2748 (0xABC)" "Ch1: 2748 (0xABC)" "Ch1: (0xABC)"
14951-15159 sent: fast-channel1-value: "Channel 1: 2748 (0xABC)" "Ch1: 2748 (0xABC)" "Ch1: (0xABC)"
15528-15735 sent: fast-channel1-value: "Channel 1: 2748 (0xABC)" "Ch1: 2748 (0xABC)" "Ch1: (0xABC)"
16104-16311 sent: fast-channel1-value: "Channel 1: 2748 (0xABC)" "Ch1: 2748 (0xABC)" "Ch1: (0xABC)"
16680-16887 sent: fast-channel1-value: "Channel 1: 2748 (0xABC)" "Ch1: 2748 (0xABC)" "Ch1: (0xABC)"
17256-17463 sent: fast-channel1-value: "Channel 1: 2748 (0xABC)" "Ch1: 2748 (0xABC)" "Ch1: (0xABC)"
17832-18039 sent: fast-channel1-value: "Channel 1: 2748 (0xABC)" "Ch1: 2748 (0xABC)" "Ch1: (0xABC)"
18408-18615 sent: fast-channel1-value: "Channel 1: 2748 (0xABC)" "Ch1: 2748 (0xABC)" "Ch1: (0xABC)"
18984-19191 sent: fast-channel1-value: "Channel 1: 2748 (0xABC)" "Ch1: 2748 (0xABC)" "Ch1: (0xABC)"
19560-19767 sent: fast-channel1-value: "Channel 1: 2748 (0xABC)" "Ch1: 2748 (0xABC)" "Ch1: (0xABC)"
20136-20343 sent: fast-channel1-value: "Channel 1: 2748 (0xABC)" "Ch1: 2748 (0xABC)" "Ch1: (0xABC)"
20712-20919 sent: fast-channel1-value: "Channel 1: 2748 (0xABC)" "Ch1: 2748 (0xABC)" "Ch1: (0xABC)"
21288-21495 sent: fast-channel1-value: "Channel 1: 2748 (0xABC)" "Ch1: 2748 (0xABC)" "Ch1: (0xABC)"
21864-22071 sent: fast-channel1-value: "Channel 1: 2748 (0xABC)" "Ch1: 2748 (0xABC)" "Ch1: (0xABC)"
22440-22647 sent: fast-channel1-value: "Channel 1: 2748 (0xABC)" "Ch1: 2748 (0xABC)" "Ch1: (0xABC)"
23017-23224 sent: fast-channel1-value: "Channel 1: 2748 (0xABC)" "Ch1: 2748 (0xABC)" "Ch1: (0xABC)"
23593-23800 sent: fast-channel1-value: "Channel 1: 2748 (0xABC)" "Ch1: 2748 (0xABC)" "Ch1: (0xABC)"
24169-24376 sent: fast-channel1-value: "Channel 1: 2748 (0xABC)" "Ch1: 2748 (0xABC)" "Ch1: (0xABC)"
24745-24952 sent: fast-channel1-value: "Channel 1: 2748 (0xABC)" "Ch1: 2748 (0xABC)" "Ch1: (0xABC)"
25321-25528 sent: fast-channel1-value: "Channel 1: 2748 (0xABC)" "Ch1: 2748 (0xABC)" "Ch1: (0xABC)"
25897-26104 sent: fast-channel1-value: "Channel 1: 2748 (0xABC)" "Ch1: 2748 (0xABC)" "Ch1: (0xABC)"
26473-26680 sent: fast-channel1-value: "Channel 1: 2748 (0xABC)" "Ch1: 2748 (0xABC)" "Ch1: (0xABC)"
27049-27256 sent: fast-channel1-value: "Channel 1: 2748 (0xABC)" "Ch1: 2748 (0xABC)" "Ch1: (0xABC)"
27625-27832 sent: fast-channel1-value: "Channel 1: 2748 (0xABC)" "Ch1: 2748 (0xABC)" "Ch1: (0xABC)"
28201-28408 sent: fast-channel1-value: "Channel 1: 2748 (0xABC)" "Ch1: 2748 (0xABC)" "Ch1: (0xABC)"
28777-28984 sent: fast-channel1-value: "Channel 1: 2748 (0xABC)" "Ch1: 2748 (0xABC)" "Ch1: (0xABC)"
29353-29560 sent: fast-channel1-value: "Channel 1: 2748 (0xABC)" "Ch1: 2748 (0xABC)" "Ch1: (0xABC)"
29929-30136 sent: fast-channel1-value: "Channel 1: 2748 (0xABC)" "Ch1: 2748 (0xABC)" "Ch1: (0xABC)"
30505-30713 sent: fast-channel1-value: "Channel 1: 2748 (0xABC)" "Ch1: 2748 (0xABC)" "Ch1: (0xABC)"
31082-31289 sent: fast-channel1-value: "Channel 1: 2748 (0xABC)" "Ch1: 2748 (0xABC)" "Ch1: (0xABC)"
31658-31865 sent: fast-channel1-value: "Channel 1: 2748 (0xABC)" "Ch1: 2748 (0xABC)" "Ch1: (0xABC)"
32234-32441 sent: fast-channel1-value: "Channel 1: 2748 (0xABC)" "Ch1: 2748 (0xABC)" "Ch1: (0xABC)"
32810-33017 sent: fast-channel1-value: "Channel 1: 2748 (0xABC)" "Ch1: 2748 (0xABC)" "Ch1: (0xABC)"
33386-33593 sent: fast-channel1-value: "Channel 1: 2748 (0xABC)" "Ch1: 2748 (0xABC)" "Ch1: (0xABC)"
33962-34169 sent: fast-channel1-value: "Channel 1: 2748 (0xABC)" "Ch1: 2748 (0xABC)" "Ch1: (0xABC)"
34538-34745 sent: fast-channel1-value: "Channel 1: 2748 (0xABC)" "Ch1: 2748 (0xABC)" "Ch1: (0xABC)"
35114-35321 sent: fast-channel1-value: "Channel 1: 2748 (0xABC)" "Ch1: 2748 (0xABC)" "Ch1: (0xABC)"
35690-35897 sent: fast-channel1-value: "Channel 1: 2748 (0xABC)" "Ch1: 2748 (0xABC)" "Ch1: (0xABC)"
36266-36473 sent: fast-channel1-value: "Channel 1: 2748 (0xABC)" "Ch1: 2748 (0xABC)" "Ch1: (0xABC)"
36842-37049 sent: fast-channel1-value: "Channel 1: 2748 (0xABC)" "Ch1: 2748 (0xABC)" "Ch1: (0xABC)"
37418-37625 sent: fast-channel1-value: "Channel 1: 2748 (0xABC)" "Ch1: 2748 (0xABC)" "Ch1: (0xABC)"
37994-38201 sent: fast-channel1-value: "Channel 1: 2748 (0xABC)" "Ch1: 2748 (0xABC)" "Ch1: (0xABC)"
38571-38778 sent: fast-channel1-value: "Channel 1: 2748 (0xABC)" "Ch1: 2748 (0xABC)" "Ch1: (0xABC)"
39147-39354 sent: fast-channel1-value: "Channel 1: 2748 (0xABC)" "Ch1: 2748 (0xABC)" "Ch1: (0xABC)"
39723-39930 sent: fast-channel1-value: "Channel 1: 2748 (0xABC)" "Ch1: 2748 (0xABC)" "Ch1: (0xABC)"
40299-40506 sent: fast-channel1-value: "Channel 1: 2748 (0xABC)" "Ch1: 2748 (0xABC)" "Ch1: (0xABC)"
40875-41082 sent: fast-channel1-value: "Channel 1: 2748 (0xABC)" "Ch1: 2748 (0xABC)" "Ch1: (0xABC)"
41451-41658 sent: fast-channel1-value: "Channel 1: 2748 (0xABC)" "Ch1: 2748 (0xABC)" "Ch1: (0xABC)"
42027-42234 sent: fast-channel1-value: "Channel 1: 2748 (0xABC)" "Ch1: 2748 (0xABC)" "Ch1: (0xABC)"
42603-42810 sent: fast-channel1-value: "Channel 1: 2748 (0xABC)" "Ch1: 2748 (0xABC)" "Ch1: (0xABC)"
43179-43386 sent: fast-channel1-value: "Channel 1: 2748 (0xABC)" "Ch1: 2748 (0xABC)" "Ch1: (0xABC)"
43755-43962 sent: fast-channel1-value: "Channel 1: 2748 (0xABC)" "Ch1: 2748 (0xABC)" "Ch1: (0xABC)"
44331-44538 sent: fast-channel1-value: "Channel 1: 2748 (0xABC)" "Ch1: 2748 (0xABC)" "Ch1: (0xABC)"
44907-45114 sent: fast-channel1-value: "Channel 1: 2748 (0xABC)" "Ch1: 2748 (0xABC)" "Ch1: (0xABC)"
45483-45690 sent: fast-channel1-value: "Channel 1: 2748 (0xABC)" "Ch1: 2748 (0xABC)" "Ch1: (0xABC)"
46060-46267 sent: fast-channel1-value: "Channel 1: 2748 (0xABC)" "Ch1: 2748 (0xABC)" "Ch1: (0xABC)"
46636-46843 sent: fast-channel1-value: "Channel 1: 2748 (0xABC)" "Ch1: 2748 (0xABC)" "Ch1: (0xABC)"
47212-47419 sent: fast-channel1-value: "Channel 1: 2748 (0xABC)" "Ch1: 2748 (0xABC)" "Ch1: (0xABC)"
47788-47995 sent: fast-channel1-value: "Channel 1: 2748 (0xABC)" "Ch1: 2748 (0xABC)" "Ch1: (0xABC)"
48364-48571 sent: fast-channel1-value: "Channel 1: 2748 (0xABC)" "Ch1: 2748 (0xABC)" "Ch1: (0xABC)"
48940-49147 sent: fast-channel1-value: "Channel 1: 2748 (0xABC)" "Ch1: 2748 (0xABC)" "Ch1: (0xABC)"
49516-49723 sent: fast-channel1-value: "Channel 1: 2748 (0xABC)" "Ch1: 2748 (0xABC)" "Ch1: (0xABC)"
50092-50299 sent: fast-channel1-value: "Channel 1: 2748 (0xABC)" "Ch1: 2748 (0xABC)" "Ch1: (0xABC)"
50668-50875 sent: fast-channel1-value: "Channel 1: 2748 (0xABC)" "Ch1: 2748 (0xABC)" "Ch1: (0xABC)"
51244-51451 sent: fast-channel1-value: "Channel 1: 2748 (0xABC)" "Ch1: 2748 (0xABC)" "Ch1: (0xABC)"
51820-52027 sent: fast-channel1-value: "Channel 1: 2748 (0xABC)" "Ch1: 2748 (0xABC)" "Ch1: (0xABC)"
52396-52603 sent: fast-channel1-value: "Channel 1: 2748 (0xABC)" "Ch1: 2748 (0xABC)" "Ch1: (0xABC)"
52972-53179 sent: fast-channel1-value: "Channel 1: 2748 (0xABC)" "Ch1: 2748 (0xABC)" "Ch1: (0xABC)"
53548-53756 sent: fast-channel1-value: "Channel 1: 2748 (0xABC)" "Ch1: 2748 (0xABC)" "Ch1: (0xABC)"
54125-54332 sent: fast-channel1-value: "Channel 1: 2748 (0xABC)" "Ch1: 2748 (0xABC)" "Ch1: (0xABC)"
54701-54908 sent: fast-channel1-value: "Channel 1: 2748 (0xABC)" "Ch1: 2748 (0xABC)" "Ch1: (0xABC)"
55277-55484 sent: fast-channel1-value: "Channel 1: 2748 (0xABC)" "Ch1: 2748 (0xABC)" "Ch1: (0xABC)"
55853-56060 sent: fast-channel1-value: "Channel 1: 2748 (0xABC)" "Ch1: 2748 (0xABC)" "Ch1: (0xABC)"
56429-56636 sent: fast-channel1-value: "Channel 1: 2748 (0xABC)" "Ch1: 2748 (0xABC)" "Ch1: (0xABC)"
57005-57212 sent: fast-channel1-value: "Channel 1: 2748 (0xABC)" "Ch1: 2748 (0xABC)" "Ch1: (0xABC)"
57581-57788 sent: fast-channel1-value: "Channel 1: 2748 (0xABC)" "Ch1: 2748 (0xABC)" "Ch1: (0xABC)"
58157-58364 sent: fast-channel1-value: "Channel 1: 2748 (0xABC)" "Ch1: 2748 (0xABC)" "Ch1: (0xABC)"
58733-58940 sent: fast-channel1-value: "Channel 1: 2748 (0xABC)" "Ch1: 2748 (0xABC)" "Ch1: (0xABC)"
59309-59516 sent: fast-channel1-value: "Channel 1: 2748 (0xABC)" "Ch1: 2748 (0xABC)" "Ch1: (0xABC)"
59885-60092 sent: fast-channel1-value: "Channel 1: 2748 (0xABC)" "Ch1: 2748 (0xABC)" "Ch1: (0xABC)"
60461-60668 sent: fast-channel1-value: "Channel 1: 2748 (0xABC)" "Ch1: 2748 (0xABC)" "Ch1: (0xABC)"
61037-61244 sent: fast-channel1-value: "Channel 1: 2748 (0xABC)" "Ch1: 2748 (0xABC)" "Ch1: (0xABC)"
61614-61821 sent: fast-channel1-value: "Channel 1: 2748 (0xABC)" "Ch1: 2748 (0xABC)" "Ch1: (0xABC)"
62190-62397 sent: fast-channel1-value: "Channel 1: 2748 (0xABC)" "Ch1: 2748 (0xABC)" "Ch1: (0xABC)"
62766-62973 sent: fast-channel1-value: "Channel 1: 2748 (0xABC)" "Ch1: 2748 (0xABC)" "Ch1: (0xABC)"
63342-63549 sent: fast-channel1-value: "Channel 1: 2748 (0xABC)" "Ch1: 2748 (0xABC)" "Ch1: (0xABC)"
63918-64125 sent: fast-channel1-value: "Channel 1: 2748 (0xABC)" "Ch1: 2748 (0xABC)" "Ch1: (0xABC)"
64494-64701 sent: fast-channel1-value: "Channel 1: 2748 (0xABC)" "Ch1: 2748 (0xABC)" "Ch1: (0xABC)"
65070-65277 sent: fast-channel1-value: "Channel 1: 2748 (0xABC)" "Ch1: 2748 (0xABC)" "Ch1: (0xABC)"
65646-65853 sent: fast-channel1-value: "Channel 1: 2748 (0xABC)" "Ch1: 2748 (0xABC)" "Ch1: (0xABC)"
66222-66429 sent: fast-channel1-value: "Channel 1: 2748 (0xABC)" "Ch1: 2748 (0xABC)" "Ch1: (0xABC)"
66798-67005 sent: fast-channel1-value: "Channel 1: 2748 (0xABC)" "Ch1: 2748 (0xABC)" "Ch1: (0xABC)"
67374-67581 sent: fast-channel1-value: "Channel 1: 2748 (0xABC)" "Ch1: 2748 (0xABC)" "Ch1: (0xABC)"
67950-68157 sent: fast-channel1-value: "Channel 1: 2748 (0xABC)" "Ch1: 2748 (0xABC)" "Ch1: (0xABC)"
68526-68733 sent: fast-channel1-value: "Channel 1: 2748 (0xABC)" "Ch1: 2748 (0xABC)" "Ch1: (0xABC)"
69103-69310 sent: fast-channel1-value: "Channel 1: 2748 (0xABC)" "Ch1: 2748 (0xABC)" "Ch1: (0xABC)"
69679-69886 sent: fast-channel1-value: "Channel 1: 2748 (0xABC)" "Ch1: 2748 (0xABC)" "Ch1: (0xABC)"
70255-70462 sent: fast-channel1-value: "Channel 1: 2748 (0xABC)" "Ch1: 2748 (0xABC)" "Ch1: (0xABC)"
70831-71038 sent: fast-channel1-value: "Channel 1: 2748 (0xABC)" "Ch1: 2748 (0xABC)" "Ch1: (0xABC)"
71407-71614 sent: fast-channel1-value: "Channel 1: 2748 (0xABC)" "Ch1: 2748 (0xABC)" "Ch1: (0xABC)"
71983-72190 sent: fast-channel1-value: "Channel 1: 2748 (0xABC)" "Ch1: 2748 (0xABC)" "Ch1: (0xABC)"
72559-72766 sent: fast-channel1-value: "Channel 1: 2748 (0xABC)" "Ch1: 2748 (0xABC)" "Ch1: (0xABC)"
73135-73342 sent: fast-channel1-value: "Channel 1: 2748 (0xABC)" "Ch1: 2748 (0xABC)" "Ch1: (0xABC)"
73711-73918 sent: fast-channel1-value: "Channel 1: 2748 (0xABC)" "Ch1: 2748 (0xABC)" "Ch1: (0xABC)"
74287-74494 sent: fast-channel1-value: "Channel 1: 2748 (0xABC)" "Ch1: 2748 (0xABC)" "Ch1: (0xABC)"
74863-75070 sent: fast-channel1-value: "Channel 1: 2748 (0xABC)" "Ch1: 2748 (0xABC)" "Ch1: (0xABC)"
75439-75646 sent: fast-channel1-value: "Channel 1: 2748 (0xABC)" "Ch1: 2748 (0xABC)" "Ch1: (0xABC)"
76015-76222 sent: fast-channel1-value: "Channel 1: 2748 (0xABC)" "Ch1: 2748 (0xABC)" "Ch1: (0xABC)"
76591-76799 sent: fast-channel1-value: "Channel 1: 2748 (0xABC)" "Ch1: 2748 (0xABC)" "Ch1: (0xABC)"
77168-77375 sent: fast-channel1-value: "Channel 1: 2748 (0xABC)" "Ch1: 2748 (0xABC)" "Ch1: (0xABC)"
77744-77951 sent: fast-channel1-value: "Channel 1: 2748 (0xABC)" "Ch1: 2748 (0xABC)" "Ch1: (0xABC)"
78320-78527 sent: fast-channel1-value: "Channel 1: 2748 (0xABC)" "Ch1: 2748 (0xABC)" "Ch1: (0xABC)"
78896-79103 sent: fast-channel1-value: "Channel 1: 2748 (0xABC)" "Ch1: 2748 (0xABC)" "Ch1: (0xABC)"
79472-79679 sent: fast-channel1-value: "Channel 1: 2748 (0xABC)" "Ch1: 2748 (0xABC)" "Ch1: (0xABC)"
80048-80255 sent: fast-channel1-value: "Channel 1: 2748 (0xABC)" "Ch1: 2748 (0xABC)" "Ch1: (0xABC)"
80624-80831 sent: fast-channel1-value: "Channel 1: 2748 (0xABC)" "Ch1: 2748 (0xABC)" "Ch1: (0xABC)"
81200-81407 sent: fast-channel1-value: "Channel 1: 2748 (0xABC)" "Ch1: 2748 (0xABC)" "Ch1: (0xABC)"
81776-81983 sent: fast-channel1-value: "Channel 1: 2748 (0xABC)" "Ch1: 2748 (0xABC)" "Ch1: (0xABC)"
82352-82559 sent: fast-channel1-value: "Channel 1: 2748 (0xABC)" "Ch1: 2748 (0xABC)" "Ch1: (0xABC)"
82928-83135 sent: fast-channel1-value: "Channel 1: 2748 (0xABC)" "Ch1: 2748 (0xABC)" "Ch1: (0xABC)"
83504-83711 sent: fast-channel1-value: "Channel 1: 2748 (0xABC)" "Ch1: 2748 (0xABC)" "Ch1: (0xABC)"
84080-84287 sent: fast-channel1-value: "Channel 1: 2748 (0xABC)" "Ch1: 2748 (0xABC)" "Ch1: (0xABC)"
84657-84864 sent: fast-channel1-value: "Channel 1: 2748 (0xABC)" "Ch1: 2748 (0xABC)" "Ch1: (0xABC)"
85233-85440 sent: fast-channel1-value: "Channel 1: 2748 (0xABC)" "Ch1: 2748 (0xABC)" "Ch1: (0xABC)"
85809-86016 sent: fast-channel1-value: "Channel 1: 2748 (0xABC)" "Ch1: 2748 (0xABC)" "Ch1: (0xABC)"
86385-86592 sent: fast-channel1-value: "Channel 1: 2748 (0xABC)" "Ch1: 2748 (0xABC)" "Ch1: (0xABC)"
86961-87168 sent: fast-channel1-value: "Channel 1: 2748 (0xABC)" "Ch1: 2748 (0xABC)" "Ch1: (0xABC)"
87537-87744 sent: fast-channel1-value: "Channel 1: 2748 (0xABC)" "Ch1: 2748 (0xABC)" "Ch1: (0xABC)"
88113-88320 sent: fast-channel1-value: "Channel 1: 2748 (0xABC)" "Ch1: 2748 (0xABC)" "Ch1: (0xABC)"
88689-88896 sent: fast-channel1-value: "Channel 1: 2748 (0xABC)" "Ch1: 2748 (0xABC)" "Ch1: (0xABC)"
89265-89472 sent: fast-channel1-value: "Channel 1: 2748 (0xABC)" "Ch1: 2748 (0xABC)" "Ch1: (0xABC)"
89841-90048 sent: fast-channel1-value: "Channel 1: 2748 (0xABC)" "Ch1: 2748 (0xABC)" "Ch1: (0xABC)"
90417-90624 sent: fast-channel1-value: "Channel 1: 2748 (0xABC)" "Ch1: 2748 (0xABC)" "Ch1: (0xABC)"
90993-91200 sent: fast-channel1-value: "Channel 1: 2748 (0xABC)" "Ch1: 2748 (0xABC)" "Ch1: (0xABC)"
91569-91776 sent: fast-channel1-value: "Channel 1: 2748 (0xABC)" "Ch1: 2748 (0xABC)" "Ch1: (0xABC)"
92146-92353 sent: fast-channel1-value: "Channel 1: 2748 (0xABC)" "Ch1: 2748 (0xABC)" "Ch1: (0xABC)"
92722-92929 sent: fast-channel1-value: "Channel 1: 2748 (0xABC)" "Ch1: 2748 (0xABC)" "Ch1: (0xABC)"
93298-93505 sent: fast-channel1-value: "Channel 1: 2748 (0xABC)" "Ch1: 2748 (0xABC)" "Ch1: (0xABC)"
93874-94081 sent: fast-channel1-value: "Channel 1: 2748 (0xABC)" "Ch1: 2748 (0xABC)" "Ch1: (0xABC)"
94450-94657 sent: fast-channel1-value: "Channel 1: 2748 (0xABC)" "Ch1: 2748 (0xABC)" "Ch1: (0xABC)"
95026-95233 sent: fast-channel1-value: "Channel 1: 2748 (0xABC)" "Ch1: 2748 (0xABC)" "Ch1: (0xABC)"
95602-95809 sent: fast-channel1-value: "Channel 1: 2748 (0xABC)" "Ch1: 2748 (0xABC)" "Ch1: (0xABC)"
96178-96385 sent: fast-channel1-value: "Channel 1: 2748 (0xABC)" "Ch1: 2748 (0xABC)" "Ch1: (0xABC)"
96754-96961 sent: fast-channel1-value: "Channel 1: 2748 (0xABC)" "Ch1: 2748 (0xABC)" "Ch1: (0xABC)"
97330-97537 sent: fast-channel1-value: "Channel 1: 2748 (0xABC)" "Ch1: 2748 (0xABC)" "Ch1: (0xABC)"
97906-98113 sent: fast-channel1-value: "Channel 1: 2748 (0xABC)" "Ch1: 2748 (0xABC)" "Ch1: (0xABC)"
98482-98689 sent: fast-channel1-value: "Channel 1: 2748 (0xABC)" "Ch1: 2748 (0xABC)" "Ch1: (0xABC)"
99058-99265 sent: fast-channel1-value: "Channel 1: 2748 (0xABC)" "Ch1: 2748 (0xABC)" "Ch1: (0xABC)"
99634-99842 sent: fast-channel1-value: "Channel 1: 2748 (0xABC)" "Ch1: 2748 (0xABC)" "Ch1: (0xABC)"
