726-762 sent: nibble: "0x0"
762-828 sent: nibble: "0xA"
828-897 sent: nibble: "0xB"
897-970 sent: nibble: "0xC"
970-1036 sent: nibble: "0xA"
1036-1117 sent: nibble: "0xF"
1117-1168 sent: nibble: "0x5"
1168-1237 sent: nibble: "0xB"
1405-1441 sent: nibble: "0x0"
1441-1507 sent: nibble: "0xA"
1507-1576 sent: nibble: "0xB"
1576-1648 sent: nibble: "0xC"
1648-1717 sent: nibble: "0xB"
1717-1753 sent: nibble: "0x0"
1753-1804 sent: nibble: "0x5"
1804-1885 sent: nibble: "0xF"
2053-2089 sent: nibble: "0x0"
2089-2155 sent: nibble: "0xA"
2155-2224 sent: nibble: "0xB"
2224-2296 sent: nibble: "0xC"
2296-2365 sent: nibble: "0xB"
2365-2404 sent: nibble: "0x1"
2404-2455 sent: nibble: "0x5"
2455-2530 sent: nibble: "0xD"
2698-2734 sent: nibble: "0x0"
2734-2800 sent: nibble: "0xA"
2800-2869 sent: nibble: "0xB"
2869-2941 sent: nibble: "0xC"
2941-3010 sent: nibble: "0xB"
3010-3052 sent: nibble: "0x2"
3052-3103 sent: nibble: "0x5"
3103-3172 sent: nibble: "0xB"
3340-3376 sent: nibble: "0x0"
3376-3442 sent: nibble: "0xA"
3442-3511 sent: nibble: "0xB"
3511-3583 sent: nibble: "0xC"
3583-3652 sent: nibble: "0xB"
3652-3697 sent: nibble: "0x3"
3697-3748 sent: nibble: "0x5"
3748-3811 sent: nibble: "0x9"
3979-4015 sent: nibble: "0x0"
4015-4081 sent: nibble: "0xA"
4081-4150 sent: nibble: "0xB"
4150-4222 sent: nibble: "0xC"
4222-4291 sent: nibble: "0xB"
4291-4339 sent: nibble: "0x4"
4339-4390 sent: nibble: "0x5"
4390-4447 sent: nibble: "0x7"
4615-4651 sent: nibble: "0x0"
4651-4717 sent: nibble: "0xA"
4717-4786 sent: nibble: "0xB"
4786-4858 sent: nibble: "0xC"
4858-4927 sent: nibble: "0xB"
4927-4978 sent: nibble: "0x5"
4978-5029 sent: nibble: "0x5"
5029-5080 sent: nibble: "0x5"
5248-5284 sent: nibble: "0x0"
5284-5350 sent: nibble: "0xA"
5350-5419 sent: nibble: "0xB"
5419-5491 sent: nibble: "0xC"
5491-5560 sent: nibble: "0xB"
5560-5614 sent: nibble: "0x6"
5614-5665 sent: nibble: "0x5"
5665-5710 sent: nibble: "0x3"
5878-5914 sent: nibble: "0x0"
5914-5980 sent: nibble: "0xA"
5980-6049 sent: nibble: "0xB"
6049-6121 sent: nibble: "0xC"
6121-6190 sent: nibble: "0xB"
6190-6247 sent: nibble: "0x7"
6247-6298 sent: nibble: "0x5"
6298-6337 sent: nibble: "0x1"
6505-6541 sent: nibble: "0x0"
6541-6607 sent: nibble: "0xA"
6607-6676 sent: nibble: "0xB"
6676-6748 sent: nibble: "0xC"
6748-6817 sent: nibble: "0xB"
6817-6877 sent: nibble: "0x8"
6877-6928 sent: nibble: "0x5"
6928-6970 sent: nibble: "0x2"
7138-7174 sent: nibble: "0x0"
7174-7240 sent: nibble: "0xA"
7240-7309 sent: nibble: "0xB"
7309-7381 sent: nibble: "0xC"
7381-7450 sent: nibble: "0xB"
7450-7513 sent: nibble: "0x9"
7513-7564 sent: nibble: "0x5"
7564-7600 sent: nibble: "0x0"
7768-7804 sent: nibble: "0x0"
7804-7870 sent: nibble: "0xA"
7870-7939 sent: nibble: "0xB"
7939-8011 sent: nibble: "0xC"
8011-8080 sent: nibble: "0xB"
8080-8146 sent: nibble: "0xA"
8146-8197 sent: nibble: "0x5"
8197-8251 sent: nibble: "0x6"
8419-8455 sent: nibble: "0x0"
8455-8521 sent: nibble: "0xA"
8521-8590 sent: nibble: "0xB"
8590-8663 sent: nibble: "0xC"
8663-8732 sent: nibble: "0xB"
8732-8801 sent: nibble: "0xB"
8801-8852 sent: nibble: "0x5"
8852-8900 sent: nibble: "0x4"
9068-9104 sent: nibble: "0x0"
9104-9170 sent: nibble: "0xA"
9170-9239 sent: nibble: "0xB"
9239-9311 sent: nibble: "0xC"
9311-9380 sent: nibble: "0xB"
9380-9452 sent: nibble: "0xC"
9452-9503 sent: nibble: "0x5"
9503-9569 sent: nibble: "0xA"
9737-9773 sent: nibble: "0x0"
9773-9839 sent: nibble: "0xA"
9839-9908 sent: nibble: "0xB"
9908-9980 sent: nibble: "0xC"
9980-10049 sent: nibble: "0xB"
10049-10124 sent: nibble: "0xD"
10124-10175 sent: nibble: "0x5"
10175-10235 sent: nibble: "0x8"
10403-10439 sent: nibble: "0x0"
10439-10505 sent: nibble: "0xA"
10505-10574 sent: nibble: "0xB"
10574-10646 sent: nibble: "0xC"
10646-10715 sent: nibble: "0xB"
10715-10793 sent: nibble: "0xE"
10793-10844 sent: nibble: "0x5"
10844-10922 sent: nibble: "0xE"
11090-11126 sent: nibble: "0x0"
11126-11192 sent: nibble: "0xA"
11192-11261 sent: nibble: "0xB"
11261-11333 sent: nibble: "0xC"
11333-11402 sent: nibble: "0xB"
11402-11483 sent: nibble: "0xF"
11483-11534 sent: nibble: "0x5"
11534-11606 sent: nibble: "0xC"
11774-11810 sent: nibble: "0x0"
11810-11876 sent: nibble: "0xA"
11876-11945 sent: nibble: "0xB"
11945-12017 sent: nibble: "0xC"
12017-12089 sent: nibble: "0xC"
12089-12125 sent: nibble: "0x0"
12125-12176 sent: nibble: "0x5"
12176-12233 sent: nibble: "0x7"
12401-12437 sent: nibble: "0x0"
12437-12503 sent: nibble: "0xA"
12503-12572 sent: nibble: "0xB"
12572-12644 sent: nibble: "0xC"
12644-12716 sent: nibble: "0xC"
12716-12755 sent: nibble: "0x1"
12755-12806 sent: nibble: "0x5"
12806-12857 sent: nibble: "0x5"
13025-13061 sent: nibble: "0x0"
13061-13127 sent: nibble: "0xA"
13127-13196 sent: nibble: "0xB"
13196-13268 sent: nibble: "0xC"
13268-13340 sent: nibble: "0xC"
13340-13382 sent: nibble: "0x2"
13382-13433 sent: nibble: "0x5"
13433-13478 sent: nibble: "0x3"
13646-13682 sent: nibble: "0x0"
13682-13748 sent: nibble: "0xA"
13748-13817 sent: nibble: "0xB"
13817-13889 sent: nibble: "0xC"
13889-13961 sent: nibble: "0xC"
13961-14006 sent: nibble: "0x3"
14006-14057 sent: nibble: "0x5"
14057-14096 sent: nibble: "0x1"
14264-14300 sent: nibble: "0x0"
14300-14366 sent: nibble: "0xA"
14366-14435 sent: nibble: "0xB"
14435-14507 sent: nibble: "0xC"
14507-14579 sent: nibble: "0xC"
14579-14627 sent: nibble: "0x4"
14627-14678 sent: nibble: "0x5"
14678-14759 sent: nibble: "0xF"
14927-14963 sent: nibble: "0x0"
14963-15029 sent: nibble: "0xA"
15029-15098 sent: nibble: "0xB"
15098-15170 sent: nibble: "0xC"
15170-15242 sent: nibble: "0xC"
15242-15293 sent: nibble: "0x5"
15293-15344 sent: nibble: "0x5"
15344-15419 sent: nibble: "0xD"
15587-15623 sent: nibble: "0x0"
15623-15689 sent: nibble: "0xA"
15689-15758 sent: nibble: "0xB"
15758-15830 sent: nibble: "0xC"
15830-15902 sent: nibble: "0xC"
15902-15956 sent: nibble: "0x6"
15956-16007 sent: nibble: "0x5"
16007-16076 sent: nibble: "0xB"
16244-16280 sent: nibble: "0x0"
16280-16347 sent: nibble: "0xA"
16347-16416 sent: nibble: "0xB"
16416-16488 sent: nibble: "0xC"
16488-16560 sent: nibble: "0xC"
16560-16617 sent: nibble: "0x7"
16617-16668 sent: nibble: "0x5"
16668-16731 sent: nibble: "0x9"
16899-16935 sent: nibble: "0x0"
16935-17001 sent: nibble: "0xA"
17001-17070 sent: nibble: "0xB"
17070-17142 sent: nibble: "0xC"
17142-17214 sent: nibble: "0xC"
17214-17274 sent: nibble: "0x8"
17274-17325 sent: nibble: "0x5"
17325-17391 sent: nibble: "0xA"
17559-17595 sent: nibble: "0x0"
17595-17661 sent: nibble: "0xA"
17661-17730 sent: nibble: "0xB"
17730-17802 sent: nibble: "0xC"
17802-17874 sent: nibble: "0xC"
17874-17937 sent: nibble: "0x9"
17937-17988 sent: nibble: "0x5"
17988-18048 sent: nibble: "0x8"
18216-18252 sent: nibble: "0x0"
18252-18318 sent: nibble: "0xA"
18318-18387 sent: nibble: "0xB"
18387-18459 sent: nibble: "0xC"
18459-18531 sent: nibble: "0xC"
18531-18597 sent: nibble: "0xA"
18597-18648 sent: nibble: "0x5"
18648-18726 sent: nibble: "0xE"
18894-18930 sent: nibble: "0x0"
18930-18996 sent: nibble: "0xA"
18996-19065 sent: nibble: "0xB"
19065-19137 sent: nibble: "0xC"
19137-19209 sent: nibble: "0xC"
19209-19278 sent: nibble: "0xB"
19278-19329 sent: nibble: "0x5"
19329-19401 sent: nibble: "0xC"
19569-19605 sent: nibble: "0x0"
19605-19671 sent: nibble: "0xA"
19671-19740 sent: nibble: "0xB"
19740-19812 sent: nibble: "0xC"
19812-19884 sent: nibble: "0xC"
19884-19956 sent: nibble: "0xC"
19956-20007 sent: nibble: "0x5"
20007-20049 sent: nibble: "0x2"
20217-20253 sent: nibble: "0x0"
20253-20319 sent: nibble: "0xA"
20319-20388 sent: nibble: "0xB"
20388-20460 sent: nibble: "0xC"
20460-20532 sent: nibble: "0xC"
20532-20607 sent: nibble: "0xD"
20607-20658 sent: nibble: "0x5"
20658-20694 sent: nibble: "0x0"
20862-20898 sent: nibble: "0x0"
20898-20964 sent: nibble: "0xA"
20964-21033 sent: nibble: "0xB"
21033-21105 sent: nibble: "0xC"
21105-21177 sent: nibble: "0xC"
21177-21255 sent: nibble: "0xE"
21255-21306 sent: nibble: "0x5"
21306-21360 sent: nibble: "0x6"
21528-21564 sent: nibble: "0x0"
21564-21630 sent: nibble: "0xA"
21630-21699 sent: nibble: "0xB"
21699-21771 sent: nibble: "0xC"
21771-21843 sent: nibble: "0xC"
21843-21924 sent: nibble: "0xF"
21924-21975 sent: nibble: "0x5"
21975-22023 sent: nibble: "0x4"
22191-22227 sent: nibble: "0x0"
22227-22293 sent: nibble: "0xA"
22293-22362 sent: nibble: "0xB"
22362-22434 sent: nibble: "0xC"
22434-22509 sent: nibble: "0xD"
22509-22545 sent: nibble: "0x0"
22545-22596 sent: nibble: "0x5"
22596-22632 sent: nibble: "0x0"
22800-22836 sent: nibble: "0x0"
22836-22902 sent: nibble: "0xA"
22902-22971 sent: nibble: "0xB"
22971-23043 sent: nibble: "0xC"
23043-23118 sent: nibble: "0xD"
23118-23157 sent: nibble: "0x1"
23157-23208 sent: nibble: "0x5"
23208-23250 sent: nibble: "0x2"
23418-23454 sent: nibble: "0x0"
23454-23520 sent: nibble: "0xA"
23520-23589 sent: nibble: "0xB"
23589-23661 sent: nibble: "0xC"
23661-23736 sent: nibble: "0xD"
23736-23778 sent: nibble: "0x2"
23778-23829 sent: nibble: "0x5"
23829-23878 sent: nibble: "0x4"
24046-24082 sent: nibble: "0x0"
24082-24148 sent: nibble: "0xA"
24148-24217 sent: nibble: "0xB"
24217-24289 sent: nibble: "0xC"
24289-24364 sent: nibble: "0xD"
24364-24409 sent: nibble: "0x3"
24409-24460 sent: nibble: "0x5"
24460-24514 sent: nibble: "0x6"
24682-24718 sent: nibble: "0x0"
24718-24784 sent: nibble: "0xA"
24784-24853 sent: nibble: "0xB"
24853-24925 sent: nibble: "0xC"
24925-25000 sent: nibble: "0xD"
25000-25048 sent: nibble: "0x4"
25048-25099 sent: nibble: "0x5"
25099-25159 sent: nibble: "0x8"
25327-25363 sent: nibble: "0x0"
25363-25429 sent: nibble: "0xA"
25429-25498 sent: nibble: "0xB"
25498-25570 sent: nibble: "0xC"
25570-25645 sent: nibble: "0xD"
25645-25696 sent: nibble: "0x5"
25696-25747 sent: nibble: "0x5"
25747-25813 sent: nibble: "0xA"
25981-26017 sent: nibble: "0x0"
26017-26083 sent: nibble: "0xA"
26083-26152 sent: nibble: "0xB"
26152-26224 sent: nibble: "0xC"
26224-26299 sent: nibble: "0xD"
26299-26353 sent: nibble: "0x6"
26353-26404 sent: nibble: "0x5"
26404-26476 sent: nibble: "0xC"
26644-26680 sent: nibble: "0x0"
26680-26746 sent: nibble: "0xA"
26746-26815 sent: nibble: "0xB"
26815-26887 sent: nibble: "0xC"
26887-26962 sent: nibble: "0xD"
26962-27019 sent: nibble: "0x7"
27019-27070 sent: nibble: "0x5"
27070-27148 sent: nibble: "0xE"
27316-27352 sent: nibble: "0x0"
27352-27418 sent: nibble: "0xA"
27418-27487 sent: nibble: "0xB"
27487-27559 sent: nibble: "0xC"
27559-27634 sent: nibble: "0xD"
27634-27694 sent: nibble: "0x8"
27694-27745 sent: nibble: "0x5"
27745-27820 sent: nibble: "0xD"
27988-28024 sent: nibble: "0x0"
28024-28090 sent: nibble: "0xA"
28090-28159 sent: nibble: "0xB"
28159-28231 sent: nibble: "0xC"
28231-28306 sent: nibble: "0xD"
28306-28369 sent: nibble: "0x9"
28369-28420 sent: nibble: "0x5"
28420-28501 sent: nibble: "0xF"
28669-28705 sent: nibble: "0x0"
28705-28771 sent: nibble: "0xA"
28771-28840 sent: nibble: "0xB"
28840-28912 sent: nibble: "0xC"
28912-28987 sent: nibble: "0xD"
28987-29053 sent: nibble: "0xA"
29053-29104 sent: nibble: "0x5"
29104-29167 sent: nibble: "0x9"
29335-29371 sent: nibble: "0x0"
29371-29437 sent: nibble: "0xA"
29437-29506 sent: nibble: "0xB"
29506-29578 sent: nibble: "0xC"
29578-29653 sent: nibble: "0xD"
29653-29722 sent: nibble: "0xB"
29722-29773 sent: nibble: "0x5"
29773-29842 sent: nibble: "0xB"
30010-30046 sent: nibble: "0x0"
30046-30112 sent: nibble: "0xA"
30112-30181 sent: nibble: "0xB"
30181-30253 sent: nibble: "0xC"
30253-30328 sent: nibble: "0xD"
30328-30400 sent: nibble: "0xC"
30400-30451 sent: nibble: "0x5"
30451-30502 sent: nibble: "0x5"
30670-30706 sent: nibble: "0x0"
30706-30772 sent: nibble: "0xA"
30772-30841 sent: nibble: "0xB"
30841-30913 sent: nibble: "0xC"
30913-30988 sent: nibble: "0xD"
30988-31063 sent: nibble: "0xD"
31063-31114 sent: nibble: "0x5"
31114-31171 sent: nibble: "0x7"
31339-31375 sent: nibble: "0x0"
31375-31441 sent: nibble: "0xA"
31441-31510 sent: nibble: "0xB"
31510-31582 sent: nibble: "0xC"
31582-31658 sent: nibble: "0xD"
31658-31736 sent: nibble: "0xE"
31736-31787 sent: nibble: "0x5"
31787-31826 sent: nibble: "0x1"
31994-32030 sent: nibble: "0x0"
32030-32096 sent: nibble: "0xA"
32096-32165 sent: nibble: "0xB"
32165-32237 sent: nibble: "0xC"
32237-32312 sent: nibble: "0xD"
32312-32393 sent: nibble: "0xF"
32393-32444 sent: nibble: "0x5"
32444-32489 sent: nibble: "0x3"
32657-32693 sent: nibble: "0x0"
32693-32759 sent: nibble: "0xA"
32759-32828 sent: nibble: "0xB"
32828-32900 sent: nibble: "0xC"
32900-32978 sent: nibble: "0xE"
32978-33014 sent: nibble: "0x0"
33014-33065 sent: nibble: "0x5"
33065-33128 sent: nibble: "0x9"
33296-33332 sent: nibble: "0x0"
33332-33398 sent: nibble: "0xA"
33398-33467 sent: nibble: "0xB"
33467-33539 sent: nibble: "0xC"
33539-33617 sent: nibble: "0xE"
33617-33656 sent: nibble: "0x1"
33656-33707 sent: nibble: "0x5"
33707-33776 sent: nibble: "0xB"
33944-33980 sent: nibble: "0x0"
33980-34046 sent: nibble: "0xA"
34046-34115 sent: nibble: "0xB"
34115-34187 sent: nibble: "0xC"
34187-34265 sent: nibble: "0xE"
34265-34307 sent: nibble: "0x2"
34307-34358 sent: nibble: "0x5"
34358-34433 sent: nibble: "0xD"
34601-34637 sent: nibble: "0x0"
34637-34703 sent: nibble: "0xA"
34703-34772 sent: nibble: "0xB"
34772-34844 sent: nibble: "0xC"
34844-34922 sent: nibble: "0xE"
34922-34967 sent: nibble: "0x3"
34967-35018 sent: nibble: "0x5"
35018-35099 sent: nibble: "0xF"
35267-35303 sent: nibble: "0x0"
35303-35369 sent: nibble: "0xA"
35369-35438 sent: nibble: "0xB"
35438-35510 sent: nibble: "0xC"
35510-35588 sent: nibble: "0xE"
35588-35636 sent: nibble: "0x4"
35636-35687 sent: nibble: "0x5"
35687-35726 sent: nibble: "0x1"
35894-35930 sent: nibble: "0x0"
35930-35996 sent: nibble: "0xA"
35996-36065 sent: nibble: "0xB"
36065-36137 sent: nibble: "0xC"
36137-36215 sent: nibble: "0xE"
36215-36266 sent: nibble: "0x5"
36266-36317 sent: nibble: "0x5"
36317-36362 sent: nibble: "0x3"
36530-36566 sent: nibble: "0x0"
36566-36632 sent: nibble: "0xA"
36632-36701 sent: nibble: "0xB"
36701-36773 sent: nibble: "0xC"
36773-36851 sent: nibble: "0xE"
36851-36905 sent: nibble: "0x6"
36905-36956 sent: nibble: "0x5"
36956-37007 sent: nibble: "0x5"
37175-37211 sent: nibble: "0x0"
37211-37277 sent: nibble: "0xA"
37277-37346 sent: nibble: "0xB"
37346-37418 sent: nibble: "0xC"
37418-37496 sent: nibble: "0xE"
37496-37553 sent: nibble: "0x7"
37553-37604 sent: nibble: "0x5"
37604-37661 sent: nibble: "0x7"
37829-37865 sent: nibble: "0x0"
37865-37931 sent: nibble: "0xA"
37931-38000 sent: nibble: "0xB"
38000-38072 sent: nibble: "0xC"
38072-38150 sent: nibble: "0xE"
38150-38210 sent: nibble: "0x8"
38210-38261 sent: nibble: "0x5"
38261-38309 sent: nibble: "0x4"
38477-38513 sent: nibble: "0x0"
38513-38579 sent: nibble: "0xA"
38579-38648 sent: nibble: "0xB"
38648-38720 sent: nibble: "0xC"
38720-38798 sent: nibble: "0xE"
38798-38861 sent: nibble: "0x9"
38861-38912 sent: nibble: "0x5"
38912-38966 sent: nibble: "0x6"
39134-39170 sent: nibble: "0x0"
39170-39236 sent: nibble: "0xA"
39236-39306 sent: nibble: "0xB"
39306-39378 sent: nibble: "0xC"
39378-39456 sent: nibble: "0xE"
39456-39522 sent: nibble: "0xA"
39522-39573 sent: nibble: "0x5"
39573-39609 sent: nibble: "0x0"
39777-39813 sent: nibble: "0x0"
39813-39879 sent: nibble: "0xA"
39879-39948 sent: nibble: "0xB"
39948-40020 sent: nibble: "0xC"
40020-40098 sent: nibble: "0xE"
40098-40167 sent: nibble: "0xB"
40167-40218 sent: nibble: "0x5"
40218-40260 sent: nibble: "0x2"
40428-40464 sent: nibble: "0x0"
40464-40530 sent: nibble: "0xA"
40530-40599 sent: nibble: "0xB"
40599-40671 sent: nibble: "0xC"
40671-40749 sent: nibble: "0xE"
40749-40821 sent: nibble: "0xC"
40821-40872 sent: nibble: "0x5"
40872-40944 sent: nibble: "0xC"
41112-41148 sent: nibble: "0x0"
41148-41214 sent: nibble: "0xA"
41214-41283 sent: nibble: "0xB"
41283-41355 sent: nibble: "0xC"
41355-41433 sent: nibble: "0xE"
41433-41508 sent: nibble: "0xD"
41508-41559 sent: nibble: "0x5"
41559-41637 sent: nibble: "0xE"
41805-41841 sent: nibble: "0x0"
41841-41907 sent: nibble: "0xA"
41907-41976 sent: nibble: "0xB"
41976-42048 sent: nibble: "0xC"
42048-42126 sent: nibble: "0xE"
42126-42204 sent: nibble: "0xE"
42204-42255 sent: nibble: "0x5"
42255-42315 sent: nibble: "0x8"
42483-42519 sent: nibble: "0x0"
42519-42585 sent: nibble: "0xA"
42585-42654 sent: nibble: "0xB"
42654-42726 sent: nibble: "0xC"
42726-42804 sent: nibble: "0xE"
42804-42885 sent: nibble: "0xF"
42885-42936 sent: nibble: "0x5"
42936-43002 sent: nibble: "0xA"
43170-43206 sent: nibble: "0x0"
43206-43272 sent: nibble: "0xA"
43272-43341 sent: nibble: "0xB"
43341-43413 sent: nibble: "0xC"
43413-43494 sent: nibble: "0xF"
43494-43530 sent: nibble: "0x0"
43530-43581 sent: nibble: "0x5"
43581-43659 sent: nibble: "0xE"
43827-43863 sent: nibble: "0x0"
43863-43929 sent: nibble: "0xA"
43929-43998 sent: nibble: "0xB"
43998-44070 sent: nibble: "0xC"
44070-44151 sent: nibble: "0xF"
44151-44190 sent: nibble: "0x1"
44190-44241 sent: nibble: "0x5"
44241-44313 sent: nibble: "0xC"
44481-44517 sent: nibble: "0x0"
44517-44583 sent: nibble: "0xA"
44583-44652 sent: nibble: "0xB"
44652-44724 sent: nibble: "0xC"
44724-44805 sent: nibble: "0xF"
44805-44847 sent: nibble: "0x2"
44847-44898 sent: nibble: "0x5"
44898-44964 sent: nibble: "0xA"
45132-45168 sent: nibble: "0x0"
45168-45234 sent: nibble: "0xA"
45234-45303 sent: nibble: "0xB"
45303-45375 sent: nibble: "0xC"
45375-45456 sent: nibble: "0xF"
45456-45501 sent: nibble: "0x3"
45501-45552 sent: nibble: "0x5"
45552-45612 sent: nibble: "0x8"
45780-45816 sent: nibble: "0x0"
45816-45882 sent: nibble: "0xA"
45882-45951 sent: nibble: "0xB"
45951-46023 sent: nibble: "0xC"
46023-46104 sent: nibble: "0xF"
46104-46152 sent: nibble: "0x4"
46152-46203 sent: nibble: "0x5"
46203-46257 sent: nibble: "0x6"
46425-46461 sent: nibble: "0x0"
46461-46527 sent: nibble: "0xA"
46527-46596 sent: nibble: "0xB"
46596-46668 sent: nibble: "0xC"
46668-46749 sent: nibble: "0xF"
46749-46800 sent: nibble: "0x5"
46800-46851 sent: nibble: "0x5"
46851-46900 sent: nibble: "0x4"
47068-47104 sent: nibble: "0x0"
47104-47170 sent: nibble: "0xA"
47170-47239 sent: nibble: "0xB"
47239-47311 sent: nibble: "0xC"
47311-47392 sent: nibble: "0xF"
47392-47446 sent: nibble: "0x6"
47446-47497 sent: nibble: "0x5"
47497-47539 sent: nibble: "0x2"
47707-47743 sent: nibble: "0x0"
47743-47809 sent: nibble: "0xA"
47809-47878 sent: nibble: "0xB"
47878-47950 sent: nibble: "0xC"
47950-48031 sent: nibble: "0xF"
48031-48088 sent: nibble: "0x7"
48088-48139 sent: nibble: "0x5"
48139-48175 sent: nibble: "0x0"
48343-48379 sent: nibble: "0x0"
48379-48445 sent: nibble: "0xA"
48445-48514 sent: nibble: "0xB"
48514-48586 sent: nibble: "0xC"
48586-48667 sent: nibble: "0xF"
48667-48727 sent: nibble: "0x8"
48727-48778 sent: nibble: "0x5"
48778-48823 sent: nibble: "0x3"
48991-49027 sent: nibble: "0x0"
49027-49093 sent: nibble: "0xA"
49093-49162 sent: nibble: "0xB"
49162-49234 sent: nibble: "0xC"
49234-49315 sent: nibble: "0xF"
49315-49378 sent: nibble: "0x9"
49378-49429 sent: nibble: "0x5"
49429-49468 sent: nibble: "0x1"
49636-49672 sent: nibble: "0x0"
49672-49738 sent: nibble: "0xA"
49738-49807 sent: nibble: "0xB"
49807-49879 sent: nibble: "0xC"
49879-49960 sent: nibble: "0xF"
49960-50026 sent: nibble: "0xA"
50026-50077 sent: nibble: "0x5"
50077-50134 sent: nibble: "0x7"
50302-50338 sent: nibble: "0x0"
50338-50404 sent: nibble: "0xA"
50404-50473 sent: nibble: "0xB"
50473-50545 sent: nibble: "0xC"
50545-50626 sent: nibble: "0xF"
50626-50695 sent: nibble: "0xB"
50695-50746 sent: nibble: "0x5"
50746-50797 sent: nibble: "0x5"
50965-51001 sent: nibble: "0x0"
51001-51067 sent: nibble: "0xA"
51067-51136 sent: nibble: "0xB"
51136-51208 sent: nibble: "0xC"
51208-51289 sent: nibble: "0xF"
51289-51361 sent: nibble: "0xC"
51361-51412 sent: nibble: "0x5"
51412-51481 sent: nibble: "0xB"
51649-51685 sent: nibble: "0x0"
51685-51751 sent: nibble: "0xA"
51751-51820 sent: nibble: "0xB"
51820-51892 sent: nibble: "0xC"
51892-51973 sent: nibble: "0xF"
51973-52048 sent: nibble: "0xD"
52048-52099 sent: nibble: "0x5"
52099-52162 sent: nibble: "0x9"
52330-52366 sent: nibble: "0x0"
52366-52432 sent: nibble: "0xA"
52432-52501 sent: nibble: "0xB"
52501-52573 sent: nibble: "0xC"
52573-52654 sent: nibble: "0xF"
52654-52732 sent: nibble: "0xE"
52732-52783 sent: nibble: "0x5"
52783-52864 sent: nibble: "0xF"
53032-53068 sent: nibble: "0x0"
53068-53134 sent: nibble: "0xA"
53134-53203 sent: nibble: "0xB"
53203-53275 sent: nibble: "0xC"
53275-53356 sent: nibble: "0xF"
53356-53437 sent: nibble: "0xF"
53437-53488 sent: nibble: "0x5"
53488-53563 sent: nibble: "0xD"
53731-53767 sent: nibble: "0x0"
53767-53833 sent: nibble: "0xA"
53833-53902 sent: nibble: "0xB"
53902-53974 sent: nibble: "0xC"
53974-54010 sent: nibble: "0x0"
54010-54046 sent: nibble: "0x0"
54046-54097 sent: nibble: "0x5"
54097-54145 sent: nibble: "0x4"
54313-54349 sent: nibble: "0x0"
54349-54415 sent: nibble: "0xA"
54415-54484 sent: nibble: "0xB"
54484-54556 sent: nibble: "0xC"
54556-54592 sent: nibble: "0x0"
54592-54631 sent: nibble: "0x1"
54631-54683 sent: nibble: "0x5"
54683-54737 sent: nibble: "0x6"
54905-54941 sent: nibble: "0x0"
54941-55007 sent: nibble: "0xA"
55007-55076 sent: nibble: "0xB"
55076-55148 sent: nibble: "0xC"
55148-55184 sent: nibble: "0x0"
55184-55226 sent: nibble: "0x2"
55226-55277 sent: nibble: "0x5"
55277-55313 sent: nibble: "0x0"
55481-55517 sent: nibble: "0x0"
55517-55583 sent: nibble: "0xA"
55583-55652 sent: nibble: "0xB"
55652-55724 sent: nibble: "0xC"
55724-55760 sent: nibble: "0x0"
55760-55805 sent: nibble: "0x3"
55805-55856 sent: nibble: "0x5"
55856-55898 sent: nibble: "0x2"
56066-56102 sent: nibble: "0x0"
56102-56168 sent: nibble: "0xA"
56168-56237 sent: nibble: "0xB"
56237-56309 sent: nibble: "0xC"
56309-56345 sent: nibble: "0x0"
56345-56393 sent: nibble: "0x4"
56393-56444 sent: nibble: "0x5"
56444-56516 sent: nibble: "0xC"
56684-56720 sent: nibble: "0x0"
56720-56786 sent: nibble: "0xA"
56786-56855 sent: nibble: "0xB"
56855-56927 sent: nibble: "0xC"
56927-56963 sent: nibble: "0x0"
56963-57014 sent: nibble: "0x5"
57014-57065 sent: nibble: "0x5"
57065-57143 sent: nibble: "0xE"
57311-57347 sent: nibble: "0x0"
57347-57413 sent: nibble: "0xA"
57413-57482 sent: nibble: "0xB"
57482-57554 sent: nibble: "0xC"
57554-57590 sent: nibble: "0x0"
57590-57644 sent: nibble: "0x6"
57644-57695 sent: nibble: "0x5"
57695-57755 sent: nibble: "0x8"
57923-57959 sent: nibble: "0x0"
57959-58025 sent: nibble: "0xA"
58025-58094 sent: nibble: "0xB"
58094-58166 sent: nibble: "0xC"
58166-58202 sent: nibble: "0x0"
58202-58259 sent: nibble: "0x7"
58259-58310 sent: nibble: "0x5"
58310-58376 sent: nibble: "0xA"
58544-58580 sent: nibble: "0x0"
58580-58646 sent: nibble: "0xA"
58646-58715 sent: nibble: "0xB"
58715-58787 sent: nibble: "0xC"
58787-58823 sent: nibble: "0x0"
58823-58883 sent: nibble: "0x8"
58883-58934 sent: nibble: "0x5"
58934-58997 sent: nibble: "0x9"
59165-59201 sent: nibble: "0x0"
59201-59267 sent: nibble: "0xA"
59267-59336 sent: nibble: "0xB"
59336-59408 sent: nibble: "0xC"
59408-59444 sent: nibble: "0x0"
59444-59507 sent: nibble: "0x9"
59507-59558 sent: nibble: "0x5"
59558-59627 sent: nibble: "0xB"
59795-59831 sent: nibble: "0x0"
59831-59897 sent: nibble: "0xA"
59897-59966 sent: nibble: "0xB"
59966-60038 sent: nibble: "0xC"
60038-60074 sent: nibble: "0x0"
60074-60140 sent: nibble: "0xA"
60140-60191 sent: nibble: "0x5"
60191-60266 sent: nibble: "0xD"
60434-60470 sent: nibble: "0x0"
60470-60536 sent: nibble: "0xA"
60536-60605 sent: nibble: "0xB"
60605-60677 sent: nibble: "0xC"
60677-60713 sent: nibble: "0x0"
60713-60782 sent: nibble: "0xB"
60782-60833 sent: nibble: "0x5"
60833-60914 sent: nibble: "0xF"
61082-61118 sent: nibble: "0x0"
61118-61184 sent: nibble: "0xA"
61184-61253 sent: nibble: "0xB"
61253-61325 sent: nibble: "0xC"
61325-61361 sent: nibble: "0x0"
61361-61433 sent: nibble: "0xC"
61433-61484 sent: nibble: "0x5"
61484-61523 sent: nibble: "0x1"
61691-61727 sent: nibble: "0x0"
61727-61793 sent: nibble: "0xA"
61793-61862 sent: nibble: "0xB"
61862-61934 sent: nibble: "0xC"
61934-61970 sent: nibble: "0x0"
61970-62045 sent: nibble: "0xD"
62045-62096 sent: nibble: "0x5"
62096-62141 sent: nibble: "0x3"
62310-62345 sent: nibble: "0x0"
62345-62412 sent: nibble: "0xA"
62412-62481 sent: nibble: "0xB"
62481-62553 sent: nibble: "0xC"
62553-62589 sent: nibble: "0x0"
62589-62667 sent: nibble: "0xE"
62667-62718 sent: nibble: "0x5"
62718-62769 sent: nibble: "0x5"
62937-62973 sent: nibble: "0x0"
62973-63039 sent: nibble: "0xA"
63039-63108 sent: nibble: "0xB"
63108-63180 sent: nibble: "0xC"
63180-63216 sent: nibble: "0x0"
63216-63297 sent: nibble: "0xF"
63297-63348 sent: nibble: "0x5"
63348-63405 sent: nibble: "0x7"
63573-63609 sent: nibble: "0x0"
63609-63675 sent: nibble: "0xA"
63675-63744 sent: nibble: "0xB"
63744-63816 sent: nibble: "0xC"
63816-63855 sent: nibble: "0x1"
63855-63891 sent: nibble: "0x0"
63891-63942 sent: nibble: "0x5"
63942-63987 sent: nibble: "0x3"
64155-64191 sent: nibble: "0x0"
64191-64257 sent: nibble: "0xA"
64257-64326 sent: nibble: "0xB"
64326-64398 sent: nibble: "0xC"
64398-64437 sent: nibble: "0x1"
64437-64476 sent: nibble: "0x1"
64476-64527 sent: nibble: "0x5"
64527-64566 sent: nibble: "0x1"
64734-64770 sent: nibble: "0x0"
64770-64836 sent: nibble: "0xA"
64836-64905 sent: nibble: "0xB"
64905-64977 sent: nibble: "0xC"
64977-65016 sent: nibble: "0x1"
65016-65058 sent: nibble: "0x2"
65058-65109 sent: nibble: "0x5"
65109-65166 sent: nibble: "0x7"
65334-65370 sent: nibble: "0x0"
65370-65436 sent: nibble: "0xA"
65436-65505 sent: nibble: "0xB"
65505-65577 sent: nibble: "0xC"
65577-65616 sent: nibble: "0x1"
65616-65661 sent: nibble: "0x3"
65661-65712 sent: nibble: "0x5"
65712-65763 sent: nibble: "0x5"
65931-65967 sent: nibble: "0x0"
65967-66033 sent: nibble: "0xA"
66033-66102 sent: nibble: "0xB"
66102-66174 sent: nibble: "0xC"
66174-66213 sent: nibble: "0x1"
66213-66261 sent: nibble: "0x4"
66261-66312 sent: nibble: "0x5"
66312-66381 sent: nibble: "0xB"
66549-66585 sent: nibble: "0x0"
66585-66651 sent: nibble: "0xA"
66651-66720 sent: nibble: "0xB"
66720-66792 sent: nibble: "0xC"
66792-66831 sent: nibble: "0x1"
66831-66882 sent: nibble: "0x5"
66882-66933 sent: nibble: "0x5"
66933-66996 sent: nibble: "0x9"
67164-67200 sent: nibble: "0x0"
67200-67266 sent: nibble: "0xA"
67266-67335 sent: nibble: "0xB"
67335-67407 sent: nibble: "0xC"
67407-67446 sent: nibble: "0x1"
67446-67500 sent: nibble: "0x6"
67500-67551 sent: nibble: "0x5"
67551-67632 sent: nibble: "0xF"
67800-67836 sent: nibble: "0x0"
67836-67902 sent: nibble: "0xA"
67902-67971 sent: nibble: "0xB"
67971-68043 sent: nibble: "0xC"
68043-68082 sent: nibble: "0x1"
68082-68139 sent: nibble: "0x7"
68139-68190 sent: nibble: "0x5"
68190-68265 sent: nibble: "0xD"
68433-68469 sent: nibble: "0x0"
68469-68535 sent: nibble: "0xA"
68535-68604 sent: nibble: "0xB"
68604-68676 sent: nibble: "0xC"
68676-68715 sent: nibble: "0x1"
68715-68775 sent: nibble: "0x8"
68775-68826 sent: nibble: "0x5"
68826-68904 sent: nibble: "0xE"
69072-69108 sent: nibble: "0x0"
69108-69174 sent: nibble: "0xA"
69174-69243 sent: nibble: "0xB"
69243-69315 sent: nibble: "0xC"
69315-69354 sent: nibble: "0x1"
69354-69417 sent: nibble: "0x9"
69417-69468 sent: nibble: "0x5"
69468-69540 sent: nibble: "0xC"
69708-69744 sent: nibble: "0x0"
69744-69810 sent: nibble: "0xA"
69810-69879 sent: nibble: "0xB"
69879-69951 sent: nibble: "0xC"
69951-69990 sent: nibble: "0x1"
69990-70057 sent: nibble: "0xA"
70057-70108 sent: nibble: "0x5"
70108-70174 sent: nibble: "0xA"
70342-70378 sent: nibble: "0x0"
70378-70444 sent: nibble: "0xA"
70444-70513 sent: nibble: "0xB"
70513-70585 sent: nibble: "0xC"
70585-70624 sent: nibble: "0x1"
70624-70693 sent: nibble: "0xB"
70693-70744 sent: nibble: "0x5"
70744-70804 sent: nibble: "0x8"
70972-71008 sent: nibble: "0x0"
71008-71074 sent: nibble: "0xA"
71074-71143 sent: nibble: "0xB"
71143-71215 sent: nibble: "0xC"
71215-71254 sent: nibble: "0x1"
71254-71326 sent: nibble: "0xC"
71326-71377 sent: nibble: "0x5"
71377-71431 sent: nibble: "0x6"
71599-71635 sent: nibble: "0x0"
71635-71701 sent: nibble: "0xA"
71701-71770 sent: nibble: "0xB"
71770-71842 sent: nibble: "0xC"
71842-71881 sent: nibble: "0x1"
71881-71956 sent: nibble: "0xD"
71956-72007 sent: nibble: "0x5"
72007-72055 sent: nibble: "0x4"
72223-72259 sent: nibble: "0x0"
72259-72325 sent: nibble: "0xA"
72325-72394 sent: nibble: "0xB"
72394-72466 sent: nibble: "0xC"
72466-72505 sent: nibble: "0x1"
72505-72583 sent: nibble: "0xE"
72583-72634 sent: nibble: "0x5"
72634-72676 sent: nibble: "0x2"
72844-72880 sent: nibble: "0x0"
72880-72946 sent: nibble: "0xA"
72946-73015 sent: nibble: "0xB"
73015-73087 sent: nibble: "0xC"
73087-73126 sent: nibble: "0x1"
73126-73207 sent: nibble: "0xF"
73207-73258 sent: nibble: "0x5"
73258-73294 sent: nibble: "0x0"
73462-73498 sent: nibble: "0x0"
73498-73564 sent: nibble: "0xA"
73564-73633 sent: nibble: "0xB"
73633-73705 sent: nibble: "0xC"
73705-73747 sent: nibble: "0x2"
73747-73783 sent: nibble: "0x0"
73783-73834 sent: nibble: "0x5"
73834-73900 sent: nibble: "0xA"
74068-74104 sent: nibble: "0x0"
74104-74170 sent: nibble: "0xA"
74170-74239 sent: nibble: "0xB"
74239-74311 sent: nibble: "0xC"
74311-74353 sent: nibble: "0x2"
74353-74392 sent: nibble: "0x1"
74392-74443 sent: nibble: "0x5"
74443-74503 sent: nibble: "0x8"
74671-74707 sent: nibble: "0x0"
74707-74773 sent: nibble: "0xA"
74773-74842 sent: nibble: "0xB"
74842-74914 sent: nibble: "0xC"
74914-74956 sent: nibble: "0x2"
74956-74998 sent: nibble: "0x2"
74998-75049 sent: nibble: "0x5"
75049-75127 sent: nibble: "0xE"
75295-75331 sent: nibble: "0x0"
75331-75397 sent: nibble: "0xA"
75397-75466 sent: nibble: "0xB"
75466-75538 sent: nibble: "0xC"
75538-75580 sent: nibble: "0x2"
75580-75625 sent: nibble: "0x3"
75625-75676 sent: nibble: "0x5"
75676-75748 sent: nibble: "0xC"
75916-75952 sent: nibble: "0x0"
75952-76018 sent: nibble: "0xA"
76018-76087 sent: nibble: "0xB"
76087-76159 sent: nibble: "0xC"
76159-76201 sent: nibble: "0x2"
76201-76249 sent: nibble: "0x4"
76249-76300 sent: nibble: "0x5"
76300-76342 sent: nibble: "0x2"
76510-76546 sent: nibble: "0x0"
76546-76612 sent: nibble: "0xA"
76612-76681 sent: nibble: "0xB"
76681-76753 sent: nibble: "0xC"
76753-76795 sent: nibble: "0x2"
76795-76846 sent: nibble: "0x5"
76846-76897 sent: nibble: "0x5"
76897-76933 sent: nibble: "0x0"
77101-77137 sent: nibble: "0x0"
77137-77203 sent: nibble: "0xA"
77203-77272 sent: nibble: "0xB"
77272-77344 sent: nibble: "0xC"
77344-77386 sent: nibble: "0x2"
77386-77440 sent: nibble: "0x6"
77440-77491 sent: nibble: "0x5"
77491-77545 sent: nibble: "0x6"
77714-77750 sent: nibble: "0x0"
77750-77816 sent: nibble: "0xA"
77816-77885 sent: nibble: "0xB"
77885-77957 sent: nibble: "0xC"
77957-77999 sent: nibble: "0x2"
77999-78056 sent: nibble: "0x7"
78056-78107 sent: nibble: "0x5"
78107-78155 sent: nibble: "0x4"
78323-78359 sent: nibble: "0x0"
78359-78425 sent: nibble: "0xA"
78425-78494 sent: nibble: "0xB"
78494-78566 sent: nibble: "0xC"
78566-78608 sent: nibble: "0x2"
78608-78668 sent: nibble: "0x8"
78668-78719 sent: nibble: "0x5"
78719-78776 sent: nibble: "0x7"
78944-78980 sent: nibble: "0x0"
78980-79046 sent: nibble: "0xA"
79046-79115 sent: nibble: "0xB"
79115-79187 sent: nibble: "0xC"
79187-79229 sent: nibble: "0x2"
79229-79292 sent: nibble: "0x9"
79292-79343 sent: nibble: "0x5"
79343-79394 sent: nibble: "0x5"
79562-79598 sent: nibble: "0x0"
79598-79664 sent: nibble: "0xA"
79664-79733 sent: nibble: "0xB"
79733-79805 sent: nibble: "0xC"
79805-79847 sent: nibble: "0x2"
79847-79913 sent: nibble: "0xA"
79913-79964 sent: nibble: "0x5"
79964-80009 sent: nibble: "0x3"
80177-80213 sent: nibble: "0x0"
80213-80279 sent: nibble: "0xA"
80279-80348 sent: nibble: "0xB"
80348-80420 sent: nibble: "0xC"
80420-80462 sent: nibble: "0x2"
80462-80531 sent: nibble: "0xB"
80531-80582 sent: nibble: "0x5"
80582-80621 sent: nibble: "0x1"
80789-80825 sent: nibble: "0x0"
80825-80891 sent: nibble: "0xA"
80891-80960 sent: nibble: "0xB"
80960-81032 sent: nibble: "0xC"
81032-81074 sent: nibble: "0x2"
81074-81146 sent: nibble: "0xC"
81146-81197 sent: nibble: "0x5"
81197-81278 sent: nibble: "0xF"
81446-81482 sent: nibble: "0x0"
81482-81548 sent: nibble: "0xA"
81548-81617 sent: nibble: "0xB"
81617-81689 sent: nibble: "0xC"
81689-81731 sent: nibble: "0x2"
81731-81806 sent: nibble: "0xD"
81806-81857 sent: nibble: "0x5"
81857-81932 sent: nibble: "0xD"
82100-82136 sent: nibble: "0x0"
82136-82202 sent: nibble: "0xA"
82202-82271 sent: nibble: "0xB"
82271-82343 sent: nibble: "0xC"
82343-82385 sent: nibble: "0x2"
82385-82463 sent: nibble: "0xE"
82463-82514 sent: nibble: "0x5"
82514-82583 sent: nibble: "0xB"
82751-82787 sent: nibble: "0x0"
82787-82853 sent: nibble: "0xA"
82853-82922 sent: nibble: "0xB"
82922-82994 sent: nibble: "0xC"
82994-83036 sent: nibble: "0x2"
83036-83117 sent: nibble: "0xF"
83117-83168 sent: nibble: "0x5"
83168-83231 sent: nibble: "0x9"
83399-83435 sent: nibble: "0x0"
83435-83501 sent: nibble: "0xA"
83501-83570 sent: nibble: "0xB"
83570-83642 sent: nibble: "0xC"
83642-83687 sent: nibble: "0x3"
83687-83723 sent: nibble: "0x0"
83723-83774 sent: nibble: "0x5"
83774-83849 sent: nibble: "0xD"
84017-84053 sent: nibble: "0x0"
84053-84119 sent: nibble: "0xA"
84119-84188 sent: nibble: "0xB"
84188-84260 sent: nibble: "0xC"
84260-84305 sent: nibble: "0x3"
84305-84344 sent: nibble: "0x1"
84344-84395 sent: nibble: "0x5"
84395-84476 sent: nibble: "0xF"
84644-84680 sent: nibble: "0x0"
84680-84746 sent: nibble: "0xA"
84746-84815 sent: nibble: "0xB"
84815-84887 sent: nibble: "0xC"
84887-84932 sent: nibble: "0x3"
84932-84974 sent: nibble: "0x2"
84974-85025 sent: nibble: "0x5"
85025-85088 sent: nibble: "0x9"
85256-85292 sent: nibble: "0x0"
85292-85359 sent: nibble: "0xA"
85359-85428 sent: nibble: "0xB"
85428-85500 sent: nibble: "0xC"
85500-85545 sent: nibble: "0x3"
85545-85590 sent: nibble: "0x3"
85590-85641 sent: nibble: "0x5"
85641-85710 sent: nibble: "0xB"
85878-85914 sent: nibble: "0x0"
85914-85980 sent: nibble: "0xA"
85980-86049 sent: nibble: "0xB"
86049-86121 sent: nibble: "0xC"
86121-86166 sent: nibble: "0x3"
86166-86214 sent: nibble: "0x4"
86214-86265 sent: nibble: "0x5"
86265-86316 sent: nibble: "0x5"
86484-86520 sent: nibble: "0x0"
86520-86586 sent: nibble: "0xA"
86586-86655 sent: nibble: "0xB"
86655-86727 sent: nibble: "0xC"
86727-86772 sent: nibble: "0x3"
86772-86823 sent: nibble: "0x5"
86823-86874 sent: nibble: "0x5"
86874-86931 sent: nibble: "0x7"
87099-87135 sent: nibble: "0x0"
87135-87201 sent: nibble: "0xA"
87201-87270 sent: nibble: "0xB"
87270-87342 sent: nibble: "0xC"
87342-87387 sent: nibble: "0x3"
87387-87441 sent: nibble: "0x6"
87441-87492 sent: nibble: "0x5"
87492-87531 sent: nibble: "0x1"
87699-87735 sent: nibble: "0x0"
87735-87801 sent: nibble: "0xA"
87801-87870 sent: nibble: "0xB"
87870-87942 sent: nibble: "0xC"
87942-87987 sent: nibble: "0x3"
87987-88044 sent: nibble: "0x7"
88044-88095 sent: nibble: "0x5"
88095-88140 sent: nibble: "0x3"
88308-88344 sent: nibble: "0x0"
88344-88410 sent: nibble: "0xA"
88410-88479 sent: nibble: "0xB"
88479-88551 sent: nibble: "0xC"
88551-88596 sent: nibble: "0x3"
88596-88656 sent: nibble: "0x8"
88656-88707 sent: nibble: "0x5"
88707-88743 sent: nibble: "0x0"
88911-88947 sent: nibble: "0x0"
88947-89013 sent: nibble: "0xA"
89013-89082 sent: nibble: "0xB"
89082-89154 sent: nibble: "0xC"
89154-89199 sent: nibble: "0x3"
89199-89262 sent: nibble: "0x9"
89262-89313 sent: nibble: "0x5"
89313-89355 sent: nibble: "0x2"
89523-89559 sent: nibble: "0x0"
89559-89625 sent: nibble: "0xA"
89625-89694 sent: nibble: "0xB"
89694-89766 sent: nibble: "0xC"
89766-89811 sent: nibble: "0x3"
89811-89877 sent: nibble: "0xA"
89877-89928 sent: nibble: "0x5"
89928-89976 sent: nibble: "0x4"
90144-90180 sent: nibble: "0x0"
90180-90246 sent: nibble: "0xA"
90246-90315 sent: nibble: "0xB"
90315-90387 sent: nibble: "0xC"
90387-90432 sent: nibble: "0x3"
90432-90501 sent: nibble: "0xB"
90501-90552 sent: nibble: "0x5"
90552-90606 sent: nibble: "0x6"
90774-90810 sent: nibble: "0x0"
90810-90876 sent: nibble: "0xA"
90876-90945 sent: nibble: "0xB"
90945-91017 sent: nibble: "0xC"
91017-91062 sent: nibble: "0x3"
91062-91134 sent: nibble: "0xC"
91134-91185 sent: nibble: "0x5"
91185-91245 sent: nibble: "0x8"
91413-91449 sent: nibble: "0x0"
91449-91515 sent: nibble: "0xA"
91515-91584 sent: nibble: "0xB"
91584-91656 sent: nibble: "0xC"
91656-91701 sent: nibble: "0x3"
91701-91776 sent: nibble: "0xD"
91776-91827 sent: nibble: "0x5"
91827-91893 sent: nibble: "0xA"
92061-92097 sent: nibble: "0x0"
92097-92163 sent: nibble: "0xA"
92163-92232 sent: nibble: "0xB"
92232-92304 sent: nibble: "0xC"
92304-92349 sent: nibble: "0x3"
92349-92427 sent: nibble: "0xE"
92427-92478 sent: nibble: "0x5"
92478-92550 sent: nibble: "0xC"
92718-92754 sent: nibble: "0x0"
92754-92820 sent: nibble: "0xA"
92820-92889 sent: nibble: "0xB"
92889-92961 sent: nibble: "0xC"
92961-93007 sent: nibble: "0x3"
93007-93088 sent: nibble: "0xF"
93088-93139 sent: nibble: "0x5"
93139-93217 sent: nibble: "0xE"
93385-93421 sent: nibble: "0x0"
93421-93487 sent: nibble: "0xA"
93487-93556 sent: nibble: "0xB"
93556-93628 sent: nibble: "0xC"
93628-93676 sent: nibble: "0x4"
93676-93712 sent: nibble: "0x0"
93712-93763 sent: nibble: "0x5"
93763-93814 sent: nibble: "0x5"
93982-94018 sent: nibble: "0x0"
94018-94084 sent: nibble: "0xA"
94084-94153 sent: nibble: "0xB"
94153-94225 sent: nibble: "0xC"
94225-94273 sent: nibble: "0x4"
94273-94312 sent: nibble: "0x1"
94312-94363 sent: nibble: "0x5"
94363-94420 sent: nibble: "0x7"
94588-94624 sent: nibble: "0x0"
94624-94690 sent: nibble: "0xA"
94690-94759 sent: nibble: "0xB"
94759-94831 sent: nibble: "0xC"
94831-94879 sent: nibble: "0x4"
94879-94921 sent: nibble: "0x2"
94921-94972 sent: nibble: "0x5"
94972-95011 sent: nibble: "0x1"
95179-95215 sent: nibble: "0x0"
95215-95281 sent: nibble: "0xA"
95281-95350 sent: nibble: "0xB"
95350-95422 sent: nibble: "0xC"
95422-95470 sent: nibble: "0x4"
95470-95515 sent: nibble: "0x3"
95515-95566 sent: nibble: "0x5"
95566-95611 sent: nibble: "0x3"
95779-95815 sent: nibble: "0x0"
95815-95881 sent: nibble: "0xA"
95881-95950 sent: nibble: "0xB"
95950-96022 sent: nibble: "0xC"
96022-96070 sent: nibble: "0x4"
96070-96118 sent: nibble: "0x4"
96118-96169 sent: nibble: "0x5"
96169-96244 sent: nibble: "0xD"
96412-96448 sent: nibble: "0x0"
96448-96514 sent: nibble: "0xA"
96514-96583 sent: nibble: "0xB"
96583-96655 sent: nibble: "0xC"
96655-96703 sent: nibble: "0x4"
96703-96754 sent: nibble: "0x5"
96754-96805 sent: nibble: "0x5"
96805-96886 sent: nibble: "0xF"
97054-97090 sent: nibble: "0x0"
97090-97156 sent: nibble: "0xA"
97156-97225 sent: nibble: "0xB"
97225-97297 sent: nibble: "0xC"
97297-97345 sent: nibble: "0x4"
97345-97399 sent: nibble: "0x6"
97399-97450 sent: nibble: "0x5"
97450-97513 sent: nibble: "0x9"
97681-97717 sent: nibble: "0x0"
97717-97783 sent: nibble: "0xA"
97783-97852 sent: nibble: "0xB"
97852-97924 sent: nibble: "0xC"
97924-97972 sent: nibble: "0x4"
97972-98029 sent: nibble: "0x7"
98029-98080 sent: nibble: "0x5"
98080-98149 sent: nibble: "0xB"
98317-98353 sent: nibble: "0x0"
98353-98419 sent: nibble: "0xA"
98419-98488 sent: nibble: "0xB"
98488-98560 sent: nibble: "0xC"
98560-98608 sent: nibble: "0x4"
98608-98668 sent: nibble: "0x8"
98668-98719 sent: nibble: "0x5"
98719-98779 sent: nibble: "0x8"
98947-98983 sent: nibble: "0x0"
98983-99049 sent: nibble: "0xA"
99049-99118 sent: nibble: "0xB"
99118-99190 sent: nibble: "0xC"
99190-99238 sent: nibble: "0x4"
99238-99301 sent: nibble: "0x9"
99301-99352 sent: nibble: "0x5"
99352-99418 sent: nibble: "0xA"
99586-99622 sent: nibble: "0x0"
99622-99688 sent: nibble: "0xA"
99688-99757 sent: nibble: "0xB"
99757-99829 sent: nibble: "0xC"
99829-99877 sent: nibble: "0x4"
99877-99943 sent: nibble: "0xA"
99943-99994 sent: nibble: "0x5"
