257-428 sent: fast-channel1-value: "Channel 1: 171 (0x0AB)" "Ch1: 171 (0x0AB)" "Ch1: (0x0AB)"
908-1079 sent: fast-channel1-value: "Channel 1: 171 (0x0AB)" "Ch1: 171 (0x0AB)" "Ch1: (0x0AB)"
1559-1731 sent: fast-channel1-value: "Channel 1: 171 (0x0AB)" "Ch1: 171 (0x0AB)" "Ch1: (0x0AB)"
2211-2382 sent: fast-channel1-value: "Channel 1: 171 (0x0AB)" "Ch1: 171 (0x0AB)" "Ch1: (0x0AB)"
2862-3033 sent: fast-channel1-value: "Channel 1: 171 (0x0AB)" "Ch1: 171 (0x0AB)" "Ch1: (0x0AB)"
3513-3684 sent: fast-channel1-value: "Channel 1: 171 (0x0AB)" "Ch1: 171 (0x0AB)" "Ch1: (0x0AB)"
4164-4335 sent: fast-channel1-value: "Channel 1: 171 (0x0AB)" "Ch1: 171 (0x0AB)" "Ch1: (0x0AB)"
4815-4986 sent: fast-channel1-value: "Channel 1: 171 (0x0AB)" "Ch1: 171 (0x0AB)" "Ch1: (0x0AB)"
5466-5637 sent: fast-channel1-value: "Channel 1: 171 (0x0AB)" "Ch1: 171 (0x0AB)" "Ch1: (0x0AB)"
6117-6288 sent: fast-channel1-value: "Channel 1: 171 (0x0AB)" "Ch1: 171 (0x0AB)" "Ch1: (0x0AB)"
6768-6939 sent: fast-channel1-value: "Channel 1: 171 (0x0AB)" "Ch1: 171 (0x0AB)" "Ch1: (0x0AB)"
7419-7590 sent: fast-channel1-value: "Channel 1: 171 (0x0AB)" "Ch1: 171 (0x0AB)" "Ch1: (0x0AB)"
8070-8241 sent: fast-channel1-value: "Channel 1: 171 (0x0AB)" "Ch1: 171 (0x0AB)" "Ch1: (0x0AB)"
8721-8892 sent: fast-channel1-value: "Channel 1: 171 (0x0AB)" "Ch1: 171 (0x0AB)" "Ch1: (0x0AB)"
9372-9544 sent: fast-channel1-value: "Channel 1: 171 (0x0AB)" "Ch1: 171 (0x0AB)" "Ch1: (0x0AB)"
10024-10195 sent: fast-channel1-value: "Channel 1: 171 (0x0AB)" "Ch1: 171 (0x0AB)" "Ch1: (0x0AB)"
10675-10846 sent: fast-channel1-value: "Channel 1: 171 (0x0AB)" "Ch1: 171 (0x0AB)" "Ch1: (0x0AB)"
11326-11497 sent: fast-channel1-value: "Channel 1: 171 (0x0AB)" "Ch1: 171 (0x0AB)" "Ch1: (0x0AB)"
11977-12148 sent: fast-channel1-value: "Channel 1: 171 (0x0AB)" "Ch1: 171 (0x0AB)" "Ch1: (0x0AB)"
12628-12799 sent: fast-channel1-value: "Channel 1: 171 (0x0AB)" "Ch1: 171 (0x0AB)" "Ch1: (0x0AB)"
13279-13450 sent: fast-channel1-value: "Channel 1: 171 (0x0AB)" "Ch1: 171 (0x0AB)" "Ch1: (0x0AB)"
13930-14101 sent: fast-channel1-value: "Channel 1: 171 (0x0AB)" "Ch1: 171 (0x0AB)" "Ch1: (0x0AB)"
14581-14752 sent: fast-channel1-value: "Channel 1: 171 (0x0AB)" "Ch1: 171 (0x0AB)" "Ch1: (0x0AB)"
15232-15403 sent: fast-channel1-value: "Channel 1: 171 (0x0AB)" "Ch1: 171 (0x0AB)" "Ch1: (0x0AB)"
15883-16054 sent: fast-channel1-value: "Channel 1: 171 (0x0AB)" "Ch1: 171 (0x0AB)" "Ch1: (0x0AB)"
16534-16705 sent: fast-channel1-value: "Channel 1: 171 (0x0AB)" "Ch1: 171 (0x0AB)" "Ch1: (0x0AB)"
17186-17357 sent: fast-channel1-value: "Channel 1: 171 (0x0AB)" "Ch1: 171 (0x0AB)" "Ch1: (0x0AB)"
17837-18008 sent: fast-channel1-value: "Channel 1: 171 (0x0AB)" "Ch1: 171 (0x0AB)" "Ch1: (0x0AB)"
18488-18659 sent: fast-channel1-value: "Channel 1: 171 (0x0AB)" "Ch1: 171 (0x0AB)" "Ch1: (0x0AB)"
19139-19310 sent: fast-channel1-value: "Channel 1: 171 (0x0AB)" "Ch1: 171 (0x0AB)" "Ch1: (0x0AB)"
19790-19961 sent: fast-channel1-value: "Channel 1: 171 (0x0AB)" "Ch1: 171 (0x0AB)" "Ch1: (0x0AB)"
20441-20612 sent: fast-channel1-value: "Channel 1: 171 (0x0AB)" "Ch1: 171 (0x0AB)" "Ch1: (0x0AB)"
21092-21263 sent: fast-channel1-value: "Channel 1: 171 (0x0AB)" "Ch1: 171 (0x0AB)" "Ch1: (0x0AB)"
21743-21914 sent: fast-channel1-value: "Channel 1: 171 (0x0AB)" "Ch1: 171 (0x0AB)" "Ch1: (0x0AB)"
22394-22565 sent: fast-channel1-value: "Channel 1: 171 (0x0AB)" "Ch1: 171 (0x0AB)" "Ch1: (0x0AB)"
23045-23216 sent: fast-channel1-value: "Channel 1: 171 (0x0AB)" "Ch1: 171 (0x0AB)" "Ch1: (0x0AB)"
23696-23867 sent: fast-channel1-value: "Channel 1: 171 (0x0AB)" "Ch1: 171 (0x0AB)" "Ch1: (0x0AB)"
24347-24518 sent: fast-channel1-value: "Channel 1: 171 (0x0AB)" "Ch1: 171 (0x0AB)" "Ch1: (0x0AB)"
24999-25170 sent: fast-channel1-value: "Channel 1: 171 (0x0AB)" "Ch1: 171 (0x0AB)" "Ch1: (0x0AB)"
25650-25821 sent: fast-channel1-value: "Channel 1: 171 (0x0AB)" "Ch1: 171 (0x0AB)" "Ch1: (0x0AB)"
26301-26472 sent: fast-channel1-value: "Channel 1: 171 (0x0AB)" "Ch1: 171 (0x0AB)" "Ch1: (0x0AB)"
26952-27123 sent: fast-channel1-value: "Channel 1: 171 (0x0AB)" "Ch1: 171 (0x0AB)" "Ch1: (0x0AB)"
27603-27774 sent: fast-channel1-value: "Channel 1: 171 (0x0AB)" "Ch1: 171 (0x0AB)" "Ch1: (0x0AB)"
28254-28425 sent: fast-channel1-value: "Channel 1: 171 (0x0AB)" "Ch1: 171 (0x0AB)" "Ch1: (0x0AB)"
28905-29076 sent: fast-channel1-value: "Channel 1: 171 (0x0AB)" "Ch1: 171 (0x0AB)" "Ch1: (0x0AB)"
29556-29727 sent: fast-channel1-value: "Channel 1: 171 (0x0AB)" "Ch1: 171 (0x0AB)" "Ch1: (0x0AB)"
30207-30378 sent: fast-channel1-value: "Channel 1: 171 (0x0AB)" "Ch1: 171 (0x0AB)" "Ch1: (0x0AB)"
30858-31029 sent: fast-channel1-value: "Channel 1: 171 (0x0AB)" "Ch1: 171 (0x0AB)" "Ch1: (0x0AB)"
31509-31680 sent: fast-channel1-value: "Channel 1: 171 (0x0AB)" "Ch1: 171 (0x0AB)" "Ch1: (0x0AB)"
32160-32331 sent: fast-channel1-value: "Channel 1: 171 (0x0AB)" "Ch1: 171 (0x0AB)" "Ch1: (0x0AB)"
32812-32983 sent: fast-channel1-value: "Channel 1: 171 (0x0AB)" "Ch1: 171 (0x0AB)" "Ch1: (0x0AB)"
33463-33634 sent: fast-channel1-value: "Channel 1: 171 (0x0AB)" "Ch1: 171 (0x0AB)" "Ch1: (0x0AB)"
34114-34285 sent: fast-channel1-value: "Channel 1: 171 (0x0AB)" "Ch1: 171 (0x0AB)" "Ch1: (0x0AB)"
34765-34936 sent: fast-channel1-value: "Channel 1: 171 (0x0AB)" "Ch1: 171 (0x0AB)" "Ch1: (0x0AB)"
35416-35587 sent: fast-channel1-value: "Channel 1: 171 (0x0AB)" "Ch1: 171 (0x0AB)" "Ch1: (0x0AB)"
36067-36238 sent: fast-channel1-value: "Channel 1: 171 (0x0AB)" "Ch1: 171 (0x0AB)" "Ch1: (0x0AB)"
36718-36889 sent: fast-channel1-value: "Channel 1: 171 (0x0AB)" "Ch1: 171 (0x0AB)" "Ch1: (0x0AB)"
37369-37540 sent: fast-channel1-value: "Channel 1: 171 (0x0AB)" "Ch1: 171 (0x0AB)" "Ch1: (0x0AB)"
38020-38191 sent: fast-channel1-value: "Channel 1: 171 (0x0AB)" "Ch1: 171 (0x0AB)" "Ch1: (0x0AB)"
38671-38842 sent: fast-channel1-value: "Channel 1: 171 (0x0AB)" "Ch1: 171 (0x0AB)" "Ch1: (0x0AB)"
39322-39493 sent: fast-channel1-value: "Channel 1: 171 (0x0AB)" "Ch1: 171 (0x0AB)" "Ch1: (0x0AB)"
39973-40144 sent: fast-channel1-value: "Channel 1: 171 (0x0AB)" "Ch1: 171 (0x0AB)" "Ch1: (0x0AB)"
40625-40796 sent: fast-channel1-value: "Channel 1: 171 (0x0AB)" "Ch1: 171 (0x0AB)" "Ch1: (0x0AB)"
41276-41447 sent: fast-channel1-value: "Channel 1: 171 (0x0AB)" "Ch1: 171 (0x0AB)" "Ch1: (0x0AB)"
41927-42098 sent: fast-channel1-value: "Channel 1: 171 (0x0AB)" "Ch1: 171 (0x0AB)" "Ch1: (0x0AB)"
42578-42749 sent: fast-channel1-value: "Channel 1: 171 (0x0AB)" "Ch1: 171 (0x0AB)" "Ch1: (0x0AB)"
43229-43400 sent: fast-channel1-value: "Channel 1: 171 (0x0AB)" "Ch1: 171 (0x0AB)" "Ch1: (0x0AB)"
43880-44051 sent: fast-channel1-value: "Channel 1: 171 (0x0AB)" "Ch1: 171 (0x0AB)" "Ch1: (0x0AB)"
44531-44702 sent: fast-channel1-value: "Channel 1: 171 (0x0AB)" "Ch1: 171 (0x0AB)" "Ch1: (0x0AB)"
45182-45353 sent: fast-channel1-value: "Channel 1: 171 (0x0AB)" "Ch1: 171 (0x0AB)" "Ch1: (0x0AB)"
45833-46004 sent: fast-channel1-value: "Channel 1: 171 (0x0AB)" "Ch1: 171 (0x0AB)" "Ch1: (0x0AB)"
46484-46655 sent: fast-channel1-value: "Channel 1: 171 (0x0AB)" "Ch1: 171 (0x0AB)" "Ch1: (0x0AB)"
47135-47306 sent: fast-channel1-value: "Channel 1: 171 (0x0AB)" "Ch1: 171 (0x0AB)" "Ch1: (0x0AB)"
47786-47958 sent: fast-channel1-value: "Channel 1: 171 (0x0AB)" "Ch1: 171 (0x0AB)" "Ch1: (0x0AB)"
48438-48609 sent: fast-channel1-value: "Channel 1: 171 (0x0AB)" "Ch1: 171 (0x0AB)" "Ch1: (0x0AB)"
49089-49260 sent: fast-channel1-value: "Channel 1: 171 (0x0AB)" "Ch1: 171 (0x0AB)" "Ch1: (0x0AB)"
49740-49911 sent: fast-channel1-value: "Channel 1: 171 (0x0AB)" "Ch1: 171 (0x0AB)" "Ch1: (0x0AB)"
50391-50562 sent: fast-channel1-value: "Channel 1: 171 (0x0AB)" "Ch1: 171 (0x0AB)" "Ch1: (0x0AB)"
51042-51213 sent: fast-channel1-value: "Channel 1: 171 (0x0AB)" "Ch1: 171 (0x0AB)" "Ch1: (0x0AB)"
51693-51864 sent: fast-channel1-value: "Channel 1: 171 (0x0AB)" "Ch1: 171 (0x0AB)" "Ch1: (0x0AB)"
52344-52515 sent: fast-channel1-value: "Channel 1: 171 (0x0AB)" "Ch1: 171 (0x0AB)" "Ch1: (0x0AB)"
52995-53166 sent: fast-channel1-value: "Channel 1: 171 (0x0AB)" "Ch1: 171 (0x0AB)" "Ch1: (0x0AB)"
53646-53817 sent: fast-channel1-value: "Channel 1: 171 (0x0AB)" "Ch1: 171 (0x0AB)" "Ch1: (0x0AB)"
54297-54468 sent: fast-channel1-value: "Channel 1: 171 (0x0AB)" "Ch1: 171 (0x0AB)" "Ch1: (0x0AB)"
54948-55119 sent: fast-channel1-value: "Channel 1: 171 (0x0AB)" "Ch1: 171 (0x0AB)" "Ch1: (0x0AB)"
55599-55771 sent: fast-channel1-value: "Channel 1: 171 (0x0AB)" "Ch1: 171 (0x0AB)" "Ch1: (0x0AB)"
56251-56422 sent: fast-channel1-value: "Channel 1: 171 (0x0AB)" "Ch1: 171 (0x0AB)" "Ch1: (0x0AB)"
56902-57073 sent: fast-channel1-value: "Channel 1: 171 (0x0AB)" "Ch1: 171 (0x0AB)" "Ch1: (0x0AB)"
57553-57724 sent: fast-channel1-value: "Channel 1: 171 (0x0AB)" "Ch1: 171 (0x0AB)" "Ch1: (0x0AB)"
58204-58375 sent: fast-channel1-value: "Channel 1: 171 (0x0AB)" "Ch1: 171 (0x0AB)" "Ch1: (0x0AB)"
58855-59026 sent: fast-channel1-value: "Channel 1: 171 (0x0AB)" "Ch1: 171 (0x0AB)" "Ch1: (0x0AB)"
59506-59677 sent: fast-channel1-value: "Channel 1: 171 (0x0AB)" "Ch1: 171 (0x0AB)" "Ch1: (0x0AB)"
60157-60328 sent: fast-channel1-value: "Channel 1: 171 (0x0AB)" "Ch1: 171 (0x0AB)" "Ch1: (0x0AB)"
60808-60979 sent: fast-channel1-value: "Channel 1: 171 (0x0AB)" "Ch1: 171 (0x0AB)" "Ch1: (0x0AB)"
61459-61630 sent: fast-channel1-value: "Channel 1: 171 (0x0AB)" "Ch1: 171 (0x0AB)" "Ch1: (0x0AB)"
62110-62281 sent: fast-channel1-value: "Channel 1: 171 (0x0AB)" "Ch1: 171 (0x0AB)" "Ch1: (0x0AB)"
62761-62932 sent: fast-channel1-value: "Channel 1: 171 (0x0AB)" "Ch1: 171 (0x0AB)" "Ch1: (0x0AB)"
63413-63584 sent: fast-channel1-value: "Channel 1: 171 (0x0AB)" "Ch1: 171 (0x0AB)" "Ch1: (0x0AB)"
64064-64235 sent: fast-channel1-value: "Channel 1: 171 (0x0AB)" "Ch1: 171 (0x0AB)" "Ch1: (0x0AB)"
64715-64886 sent: fast-channel1-value: "Channel 1: 171 (0x0AB)" "Ch1: 171 (0x0AB)" "Ch1: (0x0AB)"
65366-65537 sent: fast-channel1-value: "Channel 1: 171 (0x0AB)" "Ch1: 171 (0x0AB)" "Ch1: (0x0AB)"
66017-66188 sent: fast-channel1-value: "Channel 1: 171 (0x0AB)" "Ch1: 171 (0x0AB)" "Ch1: (0x0AB)"
66668-66839 sent: fast-channel1-value: "Channel 1: 171 (0x0AB)" "Ch1: 171 (0x0AB)" "Ch1: (0x0AB)"
67319-67490 sent: fast-channel1-value: "Channel 1: 171 (0x0AB)" "Ch1: 171 (0x0AB)" "Ch1: (0x0AB)"
67970-68141 sent: fast-channel1-value: "Channel 1: 171 (0x0AB)" "Ch1: 171 (0x0AB)" "Ch1: (0x0AB)"
68621-68792 sent: fast-channel1-value: "Channel 1: 171 (0x0AB)" "Ch1: 171 (0x0AB)" "Ch1: (0x0AB)"
69272-69443 sent: fast-channel1-value: "Channel 1: 171 (0x0AB)" "Ch1: 171 (0x0AB)" "Ch1: (0x0AB)"
69923-70094 sent: fast-channel1-value: "Channel 1: 171 (0x0AB)" "Ch1: 171 (0x0AB)" "Ch1: (0x0AB)"
70574-70745 sent: fast-channel1-value: "Channel 1: 171 (0x0AB)" "Ch1: 171 (0x0AB)" "Ch1: (0x0AB)"
71226-71397 sent: fast-channel1-value: "Channel 1: 171 (0x0AB)" "Ch1: 171 (0x0AB)" "Ch1: (0x0AB)"
71877-72048 sent: fast-channel1-value: "Channel 1: 171 (0x0AB)" "Ch1: 171 (0x0AB)" "Ch1: (0x0AB)"
72528-72699 sent: fast-channel1-value: "Channel 1: 171 (0x0AB)" "Ch1: 171 (0x0AB)" "Ch1: (0x0AB)"
73179-73350 sent: fast-channel1-value: "Channel 1: 171 (0x0AB)" "Ch1: 171 (0x0AB)" "Ch1: (0x0AB)"
73830-74001 sent: fast-channel1-value: "Channel 1: 171 (0x0AB)" "Ch1: 171 (0x0AB)" "Ch1: (0x0AB)"
74481-74652 sent: fast-channel1-value: "Channel 1: 171 (0x0AB)" "Ch1: 171 (0x0AB)" "Ch1: (0x0AB)"
75132-75303 sent: fast-channel1-value: "Channel 1: 171 (0x0AB)" "Ch1: 171 (0x0AB)" "Ch1: (0x0AB)"
75783-75954 sent: fast-channel1-value: "Channel 1: 171 (0x0AB)" "Ch1: 171 (0x0AB)" "Ch1: (0x0AB)"
76434-76605 sent: fast-channel1-value: "Channel 1: 171 (0x0AB)" "Ch1: 171 (0x0AB)" "Ch1: (0x0AB)"
77085-77256 sent: fast-channel1-value: "Channel 1: 171 (0x0AB)" "Ch1: 171 (0x0AB)" "Ch1: (0x0AB)"
77736-77907 sent: fast-channel1-value: "Channel 1: 171 (0x0AB)" "Ch1: 171 (0x0AB)" "Ch1: (0x0AB)"
78387-78558 sent: fast-channel1-value: "Channel 1: 171 (0x0AB)" "Ch1: 171 (0x0AB)" "Ch1: (0x0AB)"
79039-79210 sent: fast-channel1-value: "Channel 1: 171 (0x0AB)" "Ch1: 171 (0x0AB)" "Ch1: (0x0AB)"
79690-79861 sent: fast-channel1-value: "Channel 1: 171 (0x0AB)" "Ch1: 171 (0x0AB)" "Ch1: (0x0AB)"
80341-80512 sent: fast-channel1-value: "Channel 1: 171 (0x0AB)" "Ch1: 171 (0x0AB)" "Ch1: (0x0AB)"
80992-81163 sent: fast-channel1-value: "Channel 1: 171 (0x0AB)" "Ch1: 171 (0x0AB)" "Ch1: (0x0AB)"
81643-81814 sent: fast-channel1-value: "Channel 1: 171 (0x0AB)" "Ch1: 171 (0x0AB)" "Ch1: (0x0AB)"
82294-82465 sent: fast-channel1-value: "Channel 1: 171 (0x0AB)" "Ch1: 171 (0x0AB)" "Ch1: (0x0AB)"
82945-83116 sent: fast-channel1-value: "Channel 1: 171 (0x0AB)" "Ch1: 171 (0x0AB)" "Ch1: (0x0AB)"
83596-83767 sent: fast-channel1-value: "Channel 1: 171 (0x0AB)" "Ch1: 171 (0x0AB)" "Ch1: (0x0AB)"
84247-84418 sent: fast-channel1-value: "Channel 1: 171 (0x0AB)" "Ch1: 171 (0x0AB)" "Ch1: (0x0AB)"
84898-85069 sent: fast-channel1-value: "Channel 1: 171 (0x0AB)" "Ch1: 171 (0x0AB)" "Ch1: (0x0AB)"
85549-85720 sent: fast-channel1-value: "Channel 1: 171 (0x0AB)" "Ch1: 171 (0x0AB)" "Ch1: (0x0AB)"
86200-86371 sent: fast-channel1-value: "Channel 1: 171 (0x0AB)" "Ch1: 171 (0x0AB)" "Ch1: (0x0AB)"
86852-87023 sent: fast-channel1-value: "Channel 1: 171 (0x0AB)" "Ch1: 171 (0x0AB)" "Ch1: (0x0AB)"
87503-87674 sent: fast-channel1-value: "Channel 1: 171 (0x0AB)" "Ch1: 171 (0x0AB)" "Ch1: (0x0AB)"
88154-88325 sent: fast-channel1-value: "Channel 1: 171 (0x0AB)" "Ch1: 171 (0x0AB)" "Ch1: (0x0AB)"
88805-88976 sent: fast-channel1-value: "Channel 1: 171 (0x0AB)" "Ch1: 171 (0x0AB)" "Ch1: (0x0AB)"
89456-89627 sent: fast-channel1-value: "Channel 1: 171 (0x0AB)" "Ch1: 171 (0x0AB)" "Ch1: (0x0AB)"
90107-90278 sent: fast-channel1-value: "Channel 1: 171 (0x0AB)" "Ch1: 171 (0x0AB)" "Ch1: (0x0AB)"
90758-90929 sent: fast-channel1-value: "Channel 1: 171 (0x0AB)" "Ch1: 171 (0x0AB)" "Ch1: (0x0AB)"
91409-91580 sent: fast-channel1-value: "Channel 1: 171 (0x0AB)" "Ch1: 171 (0x0AB)" "Ch1: (0x0AB)"
92060-92231 sent: fast-channel1-value: "Channel 1: 171 (0x0AB)" "Ch1: 171 (0x0AB)" "Ch1: (0x0AB)"
92711-92882 sent: fast-channel1-value: "Channel 1: 171 (0x0AB)" "Ch1: 171 (0x0AB)" "Ch1: (0x0AB)"
93362-93533 sent: fast-channel1-value: "Channel 1: 171 (0x0AB)" "Ch1: 171 (0x0AB)" "Ch1: (0x0AB)"
94013-94185 sent: fast-channel1-value: "Channel 1: 171 (0x0AB)" "Ch1: 171 (0x0AB)" "Ch1: (0x0AB)"
94665-94836 sent: fast-channel1-value: "Channel 1: 171 (0x0AB)" "Ch1: 171 (0x0AB)" "Ch1: (0x0AB)"
95316-95487 sent: fast-channel1-value: "Channel 1: 171 (0x0AB)" "Ch1: 171 (0x0AB)" "Ch1: (0x0AB)"
95967-96138 sent: fast-channel1-value: "Channel 1: 171 (0x0AB)" "Ch1: 171 (0x0AB)" "Ch1: (0x0AB)"
96618-96789 sent: fast-channel1-value: "Channel 1: 171 (0x0AB)" "Ch1: 171 (0x0AB)" "Ch1: (0x0AB)"
97269-97440 sent: fast-channel1-value: "Channel 1: 171 (0x0AB)" "Ch1: 171 (0x0AB)" "Ch1: (0x0AB)"
97920-98091 sent: fast-channel1-value: "Channel 1: 171 (0x0AB)" "Ch1: 171 (0x0AB)" "Ch1: (0x0AB)"
98571-98742 sent: fast-channel1-value: "Channel 1: 171 (0x0AB)" "Ch1: 171 (0x0AB)" "Ch1: (0x0AB)"
99222-99393 sent: fast-channel1-value: "Channel 1: 171 (0x0AB)" "Ch1: 171 (0x0AB)" "Ch1: (0x0AB)"
