428-659 sent: fast-channel2-value: "Channel 2: 3836 (0xEFC)" "Ch2: 3836 (0xEFC)" "Ch2: (0xEFC)"
1079-1310 sent: fast-channel2-value: "Channel 2: 3836 (0xEFC)" "Ch2: 3836 (0xEFC)" "Ch2: (0xEFC)"
1731-1962 sent: fast-channel2-value: "Channel 2: 3836 (0xEFC)" "Ch2: 3836 (0xEFC)" "Ch2: (0xEFC)"
2382-2613 sent: fast-channel2-value: "Channel 2: 3836 (0xEFC)" "Ch2: 3836 (0xEFC)" "Ch2: (0xEFC)"
3033-3264 sent: fast-channel2-value: "Channel 2: 3836 (0xEFC)" "Ch2: 3836 (0xEFC)" "Ch2: (0xEFC)"
3684-3915 sent: fast-channel2-value: "Channel 2: 3836 (0xEFC)" "Ch2: 3836 (0xEFC)" "Ch2: (0xEFC)"
4335-4566 sent: fast-channel2-value: "Channel 2: 3836 (0xEFC)" "Ch2: 3836 (0xEFC)" "Ch2: (0xEFC)"
4986-5217 sent: fast-channel2-value: "Channel 2: 3836 (0xEFC)" "Ch2: 3836 (0xEFC)" "Ch2: (0xEFC)"
5637-5868 sent: fast-channel2-value: "Channel 2: 3836 (0xEFC)" "Ch2: 3836 (0xEFC)" "Ch2: (0xEFC)"
6288-6519 sent: fast-channel2-value: "Channel 2: 3836 (0xEFC)" "Ch2: 3836 (0xEFC)" "Ch2: (0xEFC)"
6939-7170 sent: fast-channel2-value: "Channel 2: 3836 (0xEFC)" "Ch2: 3836 (0xEFC)" "Ch2: (0xEFC)"
7590-7821 sent: fast-channel2-value: "Channel 2: 3836 (0xEFC)" "Ch2: 3836 (0xEFC)" "Ch2: (0xEFC)"
8241-8472 sent: fast-channel2-value: "Channel 2: 3836 (0xEFC)" "Ch2: 3836 (0xEFC)" "Ch2: (0xEFC)"
8892-9123 sent: fast-channel2-value: "Channel 2: 3836 (0xEFC)" "Ch2: 3836 (0xEFC)" "Ch2: (0xEFC)"
9544-9775 sent: fast-channel2-value: "Channel 2: 3836 (0xEFC)" "Ch2: 3836 (0xEFC)" "Ch2: (0xEFC)"
10195-10426 sent: fast-channel2-value: "Channel 2: 3836 (0xEFC)" "Ch2: 3836 (0xEFC)" "Ch2: (0xEFC)"
10846-11077 sent: fast-channel2-value: "Channel 2: 3836 (0xEFC)" "Ch2: 3836 (0xEFC)" "Ch2: (0xEFC)"
11497-11728 sent: fast-channel2-value: "Channel 2: 3836 (0xEFC)" "Ch2: 3836 (0xEFC)" "Ch2: (0xEFC)"
12148-12379 sent: fast-channel2-value: "Channel 2: 3836 (0xEFC)" "Ch2: 3836 (0xEFC)" "Ch2: (0xEFC)"
12799-13030 sent: fast-channel2-value: "Channel 2: 3836 (0xEFC)" "Ch2: 3836 (0xEFC)" "Ch2: (0xEFC)"
13450-13681 sent: fast-channel2-value: "Channel 2: 3836 (0xEFC)" "Ch2: 3836 (0xEFC)" "Ch2: (0xEFC)"
14101-14332 sent: fast-channel2-value: "Channel 2: 3836 (0xEFC)" "Ch2: 3836 (0xEFC)" "Ch2: (0xEFC)"
14752-14983 sent: fast-channel2-value: "Channel 2: 3836 (0xEFC)" "Ch2: 3836 (0xEFC)" "Ch2: (0xEFC)"
15403-15634 sent: fast-channel2-value: "Channel 2: 3836 (0xEFC)" "Ch2: 3836 (0xEFC)" "Ch2: (0xEFC)"
16054-16285 sent: fast-channel2-value: "Channel 2: 3836 (0xEFC)" "Ch2: 3836 (0xEFC)" "Ch2: (0xEFC)"
16705-16936 sent: fast-channel2-value: "Channel 2: 3836 (0xEFC)" "Ch2: 3836 (0xEFC)" "Ch2: (0xEFC)"
17357-17588 sent: fast-channel2-value: "Channel 2: 3836 (0xEFC)" "Ch2: 3836 (0xEFC)" "Ch2: (0xEFC)"
18008-18239 sent: fast-channel2-value: "Channel 2: 3836 (0xEFC)" "Ch2: 3836 (0xEFC)" "Ch2: (0xEFC)"
18659-18890 sent: fast-channel2-value: "Channel 2: 3836 (0xEFC)" "Ch2: 3836 (0xEFC)" "Ch2: (0xEFC)"
19310-19541 sent: fast-channel2-value: "Channel 2: 3836 (0xEFC)" "Ch2: 3836 (0xEFC)" "Ch2: (0xEFC)"
19961-20192 sent: fast-channel2-value: "Channel 2: 3836 (0xEFC)" "Ch2: 3836 (0xEFC)" "Ch2: (0xEFC)"
20612-20843 sent: fast-channel2-value: "Channel 2: 3836 (0xEFC)" "Ch2: 3836 (0xEFC)" "Ch2: (0xEFC)"
21263-21494 sent: fast-channel2-value: "Channel 2: 3836 (0xEFC)" "Ch2: 3836 (0xEFC)" "Ch2: (0xEFC)"
21914-22145 sent: fast-channel2-value: "Channel 2: 3836 (0xEFC)" "Ch2: 3836 (0xEFC)" "Ch2: (0xEFC)"
22565-22796 sent: fast-channel2-value: "Channel 2: 3836 (0xEFC)" "Ch2: 3836 (0xEFC)" "Ch2: (0xEFC)"
23216-23447 sent: fast-channel2-value: "Channel 2: 3836 (0xEFC)" "Ch2: 3836 (0xEFC)" "Ch2: (0xEFC)"
23867-24098 sent: fast-channel2-value: "Channel 2: 3836 (0xEFC)" "Ch2: 3836 (0xEFC)" "Ch2: (0xEFC)"
24518-24749 sent: fast-channel2-value: "Channel 2: 3836 (0xEFC)" "Ch2: 3836 (0xEFC)" "Ch2: (0xEFC)"
25170-25401 sent: fast-channel2-value: "Channel 2: 3836 (0xEFC)" "Ch2: 3836 (0xEFC)" "Ch2: (0xEFC)"
25821-26052 sent: fast-channel2-value: "Channel 2: 3836 (0xEFC)" "Ch2: 3836 (0xEFC)" "Ch2: (0xEFC)"
26472-26703 sent: fast-channel2-value: "Channel 2: 3836 (0xEFC)" "Ch2: 3836 (0xEFC)" "Ch2: (0xEFC)"
27123-27354 sent: fast-channel2-value: "Channel 2: 3836 (0xEFC)" "Ch2: 3836 (0xEFC)" "Ch2: (0xEFC)"
27774-28005 sent: fast-channel2-value: "Channel 2: 3836 (0xEFC)" "Ch2: 3836 (0xEFC)" "Ch2: (0xEFC)"
28425-28656 sent: fast-channel2-value: "Channel 2: 3836 (0xEFC)" "Ch2: 3836 (0xEFC)" "Ch2: (0xEFC)"
29076-29307 sent: fast-channel2-value: "Channel 2: 3836 (0xEFC)" "Ch2: 3836 (0xEFC)" "Ch2: (0xEFC)"
29727-29958 sent: fast-channel2-value: "Channel 2: 3836 (0xEFC)" "Ch2: 3836 (0xEFC)" "Ch2: (0xEFC)"
30378-30609 sent: fast-channel2-value: "Channel 2: 3836 (0xEFC)" "Ch2: 3836 (0xEFC)" "Ch2: (0xEFC)"
31029-31260 sent: fast-channel2-value: "Channel 2: 3836 (0xEFC)" "Ch2: 3836 (0xEFC)" "Ch2: (0xEFC)"
31680-31911 sent: fast-channel2-value: "Channel 2: 3836 (0xEFC)" "Ch2: 3836 (0xEFC)" "Ch2: (0xEFC)"
32331-32563 sent: fast-channel2-value: "Channel 2: 3836 (0xEFC)" "Ch2: 3836 (0xEFC)" "Ch2: (0xEFC)"
32983-33214 sent: fast-channel2-value: "Channel 2: 3836 (0xEFC)" "Ch2: 3836 (0xEFC)" "Ch2: (0xEFC)"
33634-33865 sent: fast-channel2-value: "Channel 2: 3836 (0xEFC)" "Ch2: 3836 (0xEFC)" "Ch2: (0xEFC)"
34285-34516 sent: fast-channel2-value: "Channel 2: 3836 (0xEFC)" "Ch2: 3836 (0xEFC)" "Ch2: (0xEFC)"
34936-35167 sent: fast-channel2-value: "Channel 2: 3836 (0xEFC)" "Ch2: 3836 (0xEFC)" "Ch2: (0xEFC)"
35587-35818 sent: fast-channel2-value: "Channel 2: 3836 (0xEFC)" "Ch2: 3836 (0xEFC)" "Ch2: (0xEFC)"
36238-36469 sent: fast-channel2-value: "Channel 2: 3836 (0xEFC)" "Ch2: 3836 (0xEFC)" "Ch2: (0xEFC)"
36889-37120 sent: fast-channel2-value: "Channel 2: 3836 (0xEFC)" "Ch2: 3836 (0xEFC)" "Ch2: (0xEFC)"
37540-37771 sent: fast-channel2-value: "Channel 2: 3836 (0xEFC)" "Ch2: 3836 (0xEFC)" "Ch2: (0xEFC)"
38191-38422 sent: fast-channel2-value: "Channel 2: 3836 (0xEFC)" "Ch2: 3836 (0xEFC)" "Ch2: (0xEFC)"
38842-39073 sent: fast-channel2-value: "Channel 2: 3836 (0xEFC)" "Ch2: 3836 (0xEFC)" "Ch2: (0xEFC)"
39493-39724 sent: fast-channel2-value: "Channel 2: 3836 (0xEFC)" "Ch2: 3836 (0xEFC)" "Ch2: (0xEFC)"
40144-40376 sent: fast-channel2-value: "Channel 2: 3836 (0xEFC)" "Ch2: 3836 (0xEFC)" "Ch2: (0xEFC)"
40796-41027 sent: fast-channel2-value: "Channel 2: 3836 (0xEFC)" "Ch2: 3836 (0xEFC)" "Ch2: (0xEFC)"
41447-41678 sent: fast-channel2-value: "Channel 2: 3836 (0xEFC)" "Ch2: 3836 (0xEFC)" "Ch2: (0xEFC)"
42098-42329 sent: fast-channel2-value: "Channel 2: 3836 (0xEFC)" "Ch2: 3836 (0xEFC)" "Ch2: (0xEFC)"
42749-42980 sent: fast-channel2-value: "Channel 2: 3836 (0xEFC)" "Ch2: 3836 (0xEFC)" "Ch2: (0xEFC)"
43400-43631 sent: fast-channel2-value: "Channel 2: 3836 (0xEFC)" "Ch2: 3836 (0xEFC)" "Ch2: (0xEFC)"
44051-44282 sent: fast-channel2-value: "Channel 2: 3836 (0xEFC)" "Ch2: 3836 (0xEFC)" "Ch2: (0xEFC)"
44702-44933 sent: fast-channel2-value: "Channel 2: 3836 (0xEFC)" "Ch2: 3836 (0xEFC)" "Ch2: (0xEFC)"
45353-45584 sent: fast-channel2-value: "Channel 2: 3836 (0xEFC)" "Ch2: 3836 (0xEFC)" "Ch2: (0xEFC)"
46004-46235 sent: fast-channel2-value: "Channel 2: 3836 (0xEFC)" "Ch2: 3836 (0xEFC)" "Ch2: (0xEFC)"
46655-46886 sent: fast-channel2-value: "Channel 2: 3836 (0xEFC)" "Ch2: 3836 (0xEFC)" "Ch2: (0xEFC)"
47306-47537 sent: fast-channel2-value: "Channel 2: 3836 (0xEFC)" "Ch2: 3836 (0xEFC)" "Ch2: (0xEFC)"
47958-48189 sent: fast-channel2-value: "Channel 2: 3836 (0xEFC)" "Ch2: 3836 (0xEFC)" "Ch2: (0xEFC)"
48609-48840 sent: fast-channel2-value: "Channel 2: 3836 (0xEFC)" "Ch2: 3836 (0xEFC)" "Ch2: (0xEFC)"
49260-49491 sent: fast-channel2-value: "Channel 2: 3836 (0xEFC)" "Ch2: 3836 (0xEFC)" "Ch2: (0xEFC)"
49911-50142 sent: fast-channel2-value: "Channel 2: 3836 (0xEFC)" "Ch2: 3836 (0xEFC)" "Ch2: (0xEFC)"
50562-50793 sent: fast-channel2-value: "Channel 2: 3836 (0xEFC)" "Ch2: 3836 (0xEFC)" "Ch2: (0xEFC)"
51213-51444 sent: fast-channel2-value: "Channel 2: 3836 (0xEFC)" "Ch2: 3836 (0xEFC)" "Ch2: (0xEFC)"
51864-52095 sent: fast-channel2-value: "Channel 2: 3836 (0xEFC)" "Ch2: 3836 (0xEFC)" "Ch2: (0xEFC)"
52515-52746 sent: fast-channel2-value: "Channel 2: 3836 (0xEFC)" "Ch2: 3836 (0xEFC)" "Ch2: (0xEFC)"
53166-53397 sent: fast-channel2-value: "Channel 2: 3836 (0xEFC)" "Ch2: 3836 (0xEFC)" "Ch2: (0xEFC)"
53817-54048 sent: fast-channel2-value: "Channel 2: 3836 (0xEFC)" "Ch2: 3836 (0xEFC)" "Ch2: (0xEFC)"
54468-54699 sent: fast-channel2-value: "Channel 2: 3836 (0xEFC)" "Ch2: 3836 (0xEFC)" "Ch2: (0xEFC)"
55119-55350 sent: fast-channel2-value: "Channel 2: 3836 (0xEFC)" "Ch2: 3836 (0xEFC)" "Ch2: (0xEFC)"
55771-56002 sent: fast-channel2-value: "Channel 2: 3836 (0xEFC)" "Ch2: 3836 (0xEFC)" "Ch2: (0xEFC)"
56422-56653 sent: fast-channel2-value: "Channel 2: 3836 (0xEFC)" "Ch2: 3836 (0xEFC)" "Ch2: (0xEFC)"
57073-57304 sent: fast-channel2-value: "Channel 2: 3836 (0xEFC)" "Ch2: 3836 (0xEFC)" "Ch2: (0xEFC)"
57724-57955 sent: fast-channel2-value: "Channel 2: 3836 (0xEFC)" "Ch2: 3836 (0xEFC)" "Ch2: (0xEFC)"
58375-58606 sent: fast-channel2-value: "Channel 2: 3836 (0xEFC)" "Ch2: 3836 (0xEFC)" "Ch2: (0xEFC)"
59026-59257 sent: fast-channel2-value: "Channel 2: 3836 (0xEFC)" "Ch2: 3836 (0xEFC)" "Ch2: (0xEFC)"
59677-59908 sent: fast-channel2-value: "Channel 2: 3836 (0xEFC)" "Ch2: 3836 (0xEFC)" "Ch2: (0xEFC)"
60328-60559 sent: fast-channel2-value: "Channel 2: 3836 (0xEFC)" "Ch2: 3836 (0xEFC)" "Ch2: (0xEFC)"
60979-61210 sent: fast-channel2-value: "Channel 2: 3836 (0xEFC)" "Ch2: 3836 (0xEFC)" "Ch2: (0xEFC)"
61630-61861 sent: fast-channel2-value: "Channel 2: 3836 (0xEFC)" "Ch2: 3836 (0xEFC)" "Ch2: (0xEFC)"
62281-62512 sent: fast-channel2-value: "Channel 2: 3836 (0xEFC)" "Ch2: 3836 (0xEFC)" "Ch2: (0xEFC)"
62932-63163 sent: fast-channel2-value: "Channel 2: 3836 (0xEFC)" "Ch2: 3836 (0xEFC)" "Ch2: (0xEFC)"
63584-63815 sent: fast-channel2-value: "Channel 2: 3836 (0xEFC)" "Ch2: 3836 (0xEFC)" "Ch2: (0xEFC)"
64235-64466 sent: fast-channel2-value: "Channel 2: 3836 (0xEFC)" "Ch2: 3836 (0xEFC)" "Ch2: (0xEFC)"
64886-65117 sent: fast-channel2-value: "Channel 2: 3836 (0xEFC)" "Ch2: 3836 (0xEFC)" "Ch2: (0xEFC)"
65537-65768 sent: fast-channel2-value: "Channel 2: 3836 (0xEFC)" "Ch2: 3836 (0xEFC)" "Ch2: (0xEFC)"
66188-66419 sent: fast-channel2-value: "Channel 2: 3836 (0xEFC)" "Ch2: 3836 (0xEFC)" "Ch2: (0xEFC)"
66839-67070 sent: fast-channel2-value: "Channel 2: 3836 (0xEFC)" "Ch2: 3836 (0xEFC)" "Ch2: (0xEFC)"
67490-67721 sent: fast-channel2-value: "Channel 2: 3836 (0xEFC)" "Ch2: 3836 (0xEFC)" "Ch2: (0xEFC)"
68141-68372 sent: fast-channel2-value: "Channel 2: 3836 (0xEFC)" "Ch2: 3836 (0xEFC)" "Ch2: (0xEFC)"
68792-69023 sent: fast-channel2-value: "Channel 2: 3836 (0xEFC)" "Ch2: 3836 (0xEFC)" "Ch2: (0xEFC)"
69443-69674 sent: fast-channel2-value: "Channel 2: 3836 (0xEFC)" "Ch2: 3836 (0xEFC)" "Ch2: (0xEFC)"
70094-70325 sent: fast-channel2-value: "Channel 2: 3836 (0xEFC)" "Ch2: 3836 (0xEFC)" "Ch2: (0xEFC)"
70745-70976 sent: fast-channel2-value: "Channel 2: 3836 (0xEFC)" "Ch2: 3836 (0xEFC)" "Ch2: (0xEFC)"
71397-71628 sent: fast-channel2-value: "Channel 2: 3836 (0xEFC)" "Ch2: 3836 (0xEFC)" "Ch2: (0xEFC)"
72048-72279 sent: fast-channel2-value: "Channel 2: 3836 (0xEFC)" "Ch2: 3836 (0xEFC)" "Ch2: (0xEFC)"
72699-72930 sent: fast-channel2-value: "Channel 2: 3836 (0xEFC)" "Ch2: 3836 (0xEFC)" "Ch2: (0xEFC)"
73350-73581 sent: fast-channel2-value: "Channel 2: 3836 (0xEFC)" "Ch2: 3836 (0xEFC)" "Ch2: (0xEFC)"
74001-74232 sent: fast-channel2-value: "Channel 2: 3836 (0xEFC)" "Ch2: 3836 (0xEFC)" "Ch2: (0xEFC)"
74652-74883 sent: fast-channel2-value: "Channel 2: 3836 (0xEFC)" "Ch2: 3836 (0xEFC)" "Ch2: (0xEFC)"
75303-75534 sent: fast-channel2-value: "Channel 2: 3836 (0xEFC)" "Ch2: 3836 (0xEFC)" "Ch2: (0xEFC)"
75954-76185 sent: fast-channel2-value: "Channel 2: 3836 (0xEFC)" "Ch2: 3836 (0xEFC)" "Ch2: (0xEFC)"
76605-76836 sent: fast-channel2-value: "Channel 2: 3836 (0xEFC)" "Ch2: 3836 (0xEFC)" "Ch2: (0xEFC)"
77256-77487 sent: fast-channel2-value: "Channel 2: 3836 (0xEFC)" "Ch2: 3836 (0xEFC)" "Ch2: (0xEFC)"
77907-78138 sent: fast-channel2-value: "Channel 2: 3836 (0xEFC)" "Ch2: 3836 (0xEFC)" "Ch2: (0xEFC)"
78558-78790 sent: fast-channel2-value: "Channel 2: 3836 (0xEFC)" "Ch2: 3836 (0xEFC)" "Ch2: (0xEFC)"
79210-79441 sent: fast-channel2-value: "Channel 2: 3836 (0xEFC)" "Ch2: 3836 (0xEFC)" "Ch2: (0xEFC)"
79861-80092 sent: fast-channel2-value: "Channel 2: 3836 (0xEFC)" "Ch2: 3836 (0xEFC)" "Ch2: (0xEFC)"
80512-80743 sent: fast-channel2-value: "Channel 2: 3836 (0xEFC)" "Ch2: 3836 (0xEFC)" "Ch2: (0xEFC)"
81163-81394 sent: fast-channel2-value: "Channel 2: 3836 (0xEFC)" "Ch2: 3836 (0xEFC)" "Ch2: (0xEFC)"
81814-82045 sent: fast-channel2-value: "Channel 2: 3836 (0xEFC)" "Ch2: 3836 (0xEFC)" "Ch2: (0xEFC)"
82465-82696 sent: fast-channel2-value: "Channel 2: 3836 (0xEFC)" "Ch2: 3836 (0xEFC)" "Ch2: (0xEFC)"
83116-83347 sent: fast-channel2-value: "Channel 2: 3836 (0xEFC)" "Ch2: 3836 (0xEFC)" "Ch2: (0xEFC)"
83767-83998 sent: fast-channel2-value: "Channel 2: 3836 (0xEFC)" "Ch2: 3836 (0xEFC)" "Ch2: (0xEFC)"
84418-84649 sent: fast-channel2-value: "Channel 2: 3836 (0xEFC)" "Ch2: 3836 (0xEFC)" "Ch2: (0xEFC)"
85069-85300 sent: fast-channel2-value: "Channel 2: 3836 (0xEFC)" "Ch2: 3836 (0xEFC)" "Ch2: (0xEFC)"
85720-85951 sent: fast-channel2-value: "Channel 2: 3836 (0xEFC)" "Ch2: 3836 (0xEFC)" "Ch2: (0xEFC)"
86371-86603 sent: fast-channel2-value: "Channel 2: 3836 (0xEFC)" "Ch2: 3836 (0xEFC)" "Ch2: (0xEFC)"
87023-87254 sent: fast-channel2-value: "Channel 2: 3836 (0xEFC)" "Ch2: 3836 (0xEFC)" "Ch2: (0xEFC)"
87674-87905 sent: fast-channel2-value: "Channel 2: 3836 (0xEFC)" "Ch2: 3836 (0xEFC)" "Ch2: (0xEFC)"
88325-88556 sent: fast-channel2-value: "Channel 2: 3836 (0xEFC)" "Ch2: 3836 (0xEFC)" "Ch2: (0xEFC)"
88976-89207 sent: fast-channel2-value: "Channel 2: 3836 (0xEFC)" "Ch2: 3836 (0xEFC)" "Ch2: (0xEFC)"
89627-89858 sent: fast-channel2-value: "Channel 2: 3836 (0xEFC)" "Ch2: 3836 (0xEFC)" "Ch2: (0xEFC)"
90278-90509 sent: fast-channel2-value: "Channel 2: 3836 (0xEFC)" "Ch2: 3836 (0xEFC)" "Ch2: (0xEFC)"
90929-91160 sent: fast-channel2-value: "Channel 2: 3836 (0xEFC)" "Ch2: 3836 (0xEFC)" "Ch2: (0xEFC)"
91580-91811 sent: fast-channel2-value: "Channel 2: 3836 (0xEFC)" "Ch2: 3836 (0xEFC)" "Ch2: (0xEFC)"
92231-92462 sent: fast-channel2-value: "Channel 2: 3836 (0xEFC)" "Ch2: 3836 (0xEFC)" "Ch2: (0xEFC)"
92882-93113 sent: fast-channel2-value: "Channel 2: 3836 (0xEFC)" "Ch2: 3836 (0xEFC)" "Ch2: (0xEFC)"
93533-93764 sent: fast-channel2-value: "Channel 2: 3836 (0xEFC)" "Ch2: 3836 (0xEFC)" "Ch2: (0xEFC)"
94185-94416 sent: fast-channel2-value: "Channel 2: 3836 (0xEFC)" "Ch2: 3836 (0xEFC)" "Ch2: (0xEFC)"
94836-95067 sent: fast-channel2-value: "Channel 2: 3836 (0xEFC)" "Ch2: 3836 (0xEFC)" "Ch2: (0xEFC)"
95487-95718 sent: fast-channel2-value: "Channel 2: 3836 (0xEFC)" "Ch2: 3836 (0xEFC)" "Ch2: (0xEFC)"
96138-96369 sent: fast-channel2-value: "Channel 2: 3836 (0xEFC)" "Ch2: 3836 (0xEFC)" "Ch2: (0xEFC)"
96789-97020 sent: fast-channel2-value: "Channel 2: 3836 (0xEFC)" "Ch2: 3836 (0xEFC)" "Ch2: (0xEFC)"
97440-97671 sent: fast-channel2-value: "Channel 2: 3836 (0xEFC)" "Ch2: 3836 (0xEFC)" "Ch2: (0xEFC)"
98091-98322 sent: fast-channel2-value: "Channel 2: 3836 (0xEFC)" "Ch2: 3836 (0xEFC)" "Ch2: (0xEFC)"
98742-98973 sent: fast-channel2-value: "Channel 2: 3836 (0xEFC)" "Ch2: 3836 (0xEFC)" "Ch2: (0xEFC)"
99393-99624 sent: fast-channel2-value: "Channel 2: 3836 (0xEFC)" "Ch2: 3836 (0xEFC)" "Ch2: (0xEFC)"
