511-700 sent: fast-channel1-value: "Channel 1: 687 (0x2AF)" "Ch1: 687 (0x2AF)" "Ch1: (0x2AF)"
1150-1339 sent: fast-channel1-value: "Channel 1: 687 (0x2AF)" "Ch1: 687 (0x2AF)" "Ch1: (0x2AF)"
1790-1979 sent: fast-channel1-value: "Channel 1: 687 (0x2AF)" "Ch1: 687 (0x2AF)" "Ch1: (0x2AF)"
2429-2618 sent: fast-channel1-value: "Channel 1: 687 (0x2AF)" "Ch1: 687 (0x2AF)" "Ch1: (0x2AF)"
3068-3257 sent: fast-channel1-value: "Channel 1: 687 (0x2AF)" "Ch1: 687 (0x2AF)" "Ch1: (0x2AF)"
3707-3896 sent: fast-channel1-value: "Channel 1: 687 (0x2AF)" "Ch1: 687 (0x2AF)" "Ch1: (0x2AF)"
4346-4535 sent: fast-channel1-value: "Channel 1: 687 (0x2AF)" "Ch1: 687 (0x2AF)" "Ch1: (0x2AF)"
4985-5174 sent: fast-channel1-value: "Channel 1: 687 (0x2AF)" "Ch1: 687 (0x2AF)" "Ch1: (0x2AF)"
5624-5813 sent: fast-channel1-value: "Channel 1: 687 (0x2AF)" "Ch1: 687 (0x2AF)" "Ch1: (0x2AF)"
6263-6452 sent: fast-channel1-value: "Channel 1: 687 (0x2AF)" "Ch1: 687 (0x2AF)" "Ch1: (0x2AF)"
6902-7091 sent: fast-channel1-value: "Channel 1: 687 (0x2AF)" "Ch1: 687 (0x2AF)" "Ch1: (0x2AF)"
7541-7730 sent: fast-channel1-value: "Channel 1: 687 (0x2AF)" "Ch1: 687 (0x2AF)" "Ch1: (0x2AF)"
8180-8369 sent: fast-channel1-value: "Channel 1: 687 (0x2AF)" "Ch1: 687 (0x2AF)" "Ch1: (0x2AF)"
8819-9008 sent: fast-channel1-value: "Channel 1: 687 (0x2AF)" "Ch1: 687 (0x2AF)" "Ch1: (0x2AF)"
9458-9648 sent: fast-channel1-value: "Channel 1: 687 (0x2AF)" "Ch1: 687 (0x2AF)" "Ch1: (0x2AF)"
10098-10287 sent: fast-channel1-value: "Channel 1: 687 (0x2AF)" "Ch1: 687 (0x2AF)" "Ch1: (0x2AF)"
10737-10926 sent: fast-channel1-value: "Channel 1: 687 (0x2AF)" "Ch1: 687 (0x2AF)" "Ch1: (0x2AF)"
11376-11565 sent: fast-channel1-value: "Channel 1: 687 (0x2AF)" "Ch1: 687 (0x2AF)" "Ch1: (0x2AF)"
12015-12204 sent: fast-channel1-value: "Channel 1: 687 (0x2AF)" "Ch1: 687 (0x2AF)" "Ch1: (0x2AF)"
12654-12843 sent: fast-channel1-value: "Channel 1: 687 (0x2AF)" "Ch1: 687 (0x2AF)" "Ch1: (0x2AF)"
13293-13482 sent: fast-channel1-value: "Channel 1: 687 (0x2AF)" "Ch1: 687 (0x2AF)" "Ch1: (0x2AF)"
13932-14121 sent: fast-channel1-value: "Channel 1: 687 (0x2AF)" "Ch1: 687 (0x2AF)" "Ch1: (0x2AF)"
14571-14760 sent: fast-channel1-value: "Channel 1: 687 (0x2AF)" "Ch1: 687 (0x2AF)" "Ch1: (0x2AF)"
15210-15399 sent: fast-channel1-value: "Channel 1: 687 (0x2AF)" "Ch1: 687 (0x2AF)" "Ch1: (0x2AF)"
15849-16038 sent: fast-channel1-value: "Channel 1: 687 (0x2AF)" "Ch1: 687 (0x2AF)" "Ch1: (0x2AF)"
16488-16677 sent: fast-channel1-value: "Channel 1: 687 (0x2AF)" "Ch1: 687 (0x2AF)" "Ch1: (0x2AF)"
17127-17317 sent: fast-channel1-value: "Channel 1: 687 (0x2AF)" "Ch1: 687 (0x2AF)" "Ch1: (0x2AF)"
17767-17956 sent: fast-channel1-value: "Channel 1: 687 (0x2AF)" "Ch1: 687 (0x2AF)" "Ch1: (0x2AF)"
18406-18595 sent: fast-channel1-value: "Channel 1: 687 (0x2AF)" "Ch1: 687 (0x2AF)" "Ch1: (0x2AF)"
19045-19234 sent: fast-channel1-value: "Channel 1: 687 (0x2AF)" "Ch1: 687 (0x2AF)" "Ch1: (0x2AF)"
19684-19873 sent: fast-channel1-value: "Channel 1: 687 (0x2AF)" "Ch1: 687 (0x2AF)" "Ch1: (0x2AF)"
20323-20512 sent: fast-channel1-value: "Channel 1: 687 (0x2AF)" "Ch1: 687 (0x2AF)" "Ch1: (0x2AF)"
20962-21151 sent: fast-channel1-value: "Channel 1: 687 (0x2AF)" "Ch1: 687 (0x2AF)" "Ch1: (0x2AF)"
21601-21790 sent: fast-channel1-value: "Channel 1: 687 (0x2AF)" "Ch1: 687 (0x2AF)" "Ch1: (0x2AF)"
22240-22429 sent: fast-channel1-value: "Channel 1: 687 (0x2AF)" "Ch1: 687 (0x2AF)" "Ch1: (0x2AF)"
22879-23068 sent: fast-channel1-value: "Channel 1: 687 (0x2AF)" "Ch1: 687 (0x2AF)" "Ch1: (0x2AF)"
23518-23707 sent: fast-channel1-value: "Channel 1: 687 (0x2AF)" "Ch1: 687 (0x2AF)" "Ch1: (0x2AF)"
24157-24346 sent: fast-channel1-value: "Channel 1: 687 (0x2AF)" "Ch1: 687 (0x2AF)" "Ch1: (0x2AF)"
24796-24986 sent: fast-channel1-value: "Channel 1: 687 (0x2AF)" "Ch1: 687 (0x2AF)" "Ch1: (0x2AF)"
25436-25625 sent: fast-channel1-value: "Channel 1: 687 (0x2AF)" "Ch1: 687 (0x2AF)" "Ch1: (0x2AF)"
26075-26264 sent: fast-channel1-value: "Channel 1: 687 (0x2AF)" "Ch1: 687 (0x2AF)" "Ch1: (0x2AF)"
26714-26903 sent: fast-channel1-value: "Channel 1: 687 (0x2AF)" "Ch1: 687 (0x2AF)" "Ch1: (0x2AF)"
27353-27542 sent: fast-channel1-value: "Channel 1: 687 (0x2AF)" "Ch1: 687 (0x2AF)" "Ch1: (0x2AF)"
27992-28181 sent: fast-channel1-value: "Channel 1: 687 (0x2AF)" "Ch1: 687 (0x2AF)" "Ch1: (0x2AF)"
28631-28820 sent: fast-channel1-value: "Channel 1: 687 (0x2AF)" "Ch1: 687 (0x2AF)" "Ch1: (0x2AF)"
29270-29459 sent: fast-channel1-value: "Channel 1: 687 (0x2AF)" "Ch1: 687 (0x2AF)" "Ch1: (0x2AF)"
29909-30098 sent: fast-channel1-value: "Channel 1: 687 (0x2AF)" "Ch1: 687 (0x2AF)" "Ch1: (0x2AF)"
30548-30737 sent: fast-channel1-value: "Channel 1: 687 (0x2AF)" "Ch1: 687 (0x2AF)" "Ch1: (0x2AF)"
31187-31376 sent: fast-channel1-value: "Channel 1: 687 (0x2AF)" "Ch1: 687 (0x2AF)" "Ch1: (0x2AF)"
31826-32015 sent: fast-channel1-value: "Channel 1: 687 (0x2AF)" "Ch1: 687 (0x2AF)" "Ch1: (0x2AF)"
32465-32655 sent: fast-channel1-value: "Channel 1: 687 (0x2AF)" "Ch1: 687 (0x2AF)" "Ch1: (0x2AF)"
33105-33294 sent: fast-channel1-value: "Channel 1: 687 (0x2AF)" "Ch1: 687 (0x2AF)" "Ch1: (0x2AF)"
33744-33933 sent: fast-channel1-value: "Channel 1: 687 (0x2AF)" "Ch1: 687 (0x2AF)" "Ch1: (0x2AF)"
34383-34572 sent: fast-channel1-value: "Channel 1: 687 (0x2AF)" "Ch1: 687 (0x2AF)" "Ch1: (0x2AF)"
35022-35211 sent: fast-channel1-value: "Channel 1: 687 (0x2AF)" "Ch1: 687 (0x2AF)" "Ch1: (0x2AF)"
35661-35850 sent: fast-channel1-value: "Channel 1: 687 (0x2AF)" "Ch1: 687 (0x2AF)" "Ch1: (0x2AF)"
36300-36489 sent: fast-channel1-value: "Channel 1: 687 (0x2AF)" "Ch1: 687 (0x2AF)" "Ch1: (0x2AF)"
36939-37128 sent: fast-channel1-value: "Channel 1: 687 (0x2AF)" "Ch1: 687 (0x2AF)" "Ch1: (0x2AF)"
37578-37767 sent: fast-channel1-value: "Channel 1: 687 (0x2AF)" "Ch1: 687 (0x2AF)" "Ch1: (0x2AF)"
38217-38406 sent: fast-channel1-value: "Channel 1: 687 (0x2AF)" "Ch1: 687 (0x2AF)" "Ch1: (0x2AF)"
38856-39045 sent: fast-channel1-value: "Channel 1: 687 (0x2AF)" "Ch1: 687 (0x2AF)" "Ch1: (0x2AF)"
39495-39684 sent: fast-channel1-value: "Channel 1: 687 (0x2AF)" "Ch1: 687 (0x2AF)" "Ch1: (0x2AF)"
40134-40324 sent: fast-channel1-value: "Channel 1: 687 (0x2AF)" "Ch1: 687 (0x2AF)" "Ch1: (0x2AF)"
40774-40963 sent: fast-channel1-value: "Channel 1: 687 (0x2AF)" "Ch1: 687 (0x2AF)" "Ch1: (0x2AF)"
41413-41602 sent: fast-channel1-value: "Channel 1: 687 (0x2AF)" "Ch1: 687 (0x2AF)" "Ch1: (0x2AF)"
42052-42241 sent: fast-channel1-value: "Channel 1: 687 (0x2AF)" "Ch1: 687 (0x2AF)" "Ch1: (0x2AF)"
42691-42880 sent: fast-channel1-value: "Channel 1: 687 (0x2AF)" "Ch1: 687 (0x2AF)" "Ch1: (0x2AF)"
43330-43519 sent: fast-channel1-value: "Channel 1: 687 (0x2AF)" "Ch1: 687 (0x2AF)" "Ch1: (0x2AF)"
43969-44158 sent: fast-channel1-value: "Channel 1: 687 (0x2AF)" "Ch1: 687 (0x2AF)" "Ch1: (0x2AF)"
44608-44797 sent: fast-channel1-value: "Channel 1: 687 (0x2AF)" "Ch1: 687 (0x2AF)" "Ch1: (0x2AF)"
45247-45436 sent: fast-channel1-value: "Channel 1: 687 (0x2AF)" "Ch1: 687 (0x2AF)" "Ch1: (0x2AF)"
45886-46075 sent: fast-channel1-value: "Channel 1: 687 (0x2AF)" "Ch1: 687 (0x2AF)" "Ch1: (0x2AF)"
46525-46714 sent: fast-channel1-value: "Channel 1: 687 (0x2AF)" "Ch1: 687 (0x2AF)" "Ch1: (0x2AF)"
47164-47353 sent: fast-channel1-value: "Channel 1: 687 (0x2AF)" "Ch1: 687 (0x2AF)" "Ch1: (0x2AF)"
47803-47993 sent: fast-channel1-value: "Channel 1: 687 (0x2AF)" "Ch1: 687 (0x2AF)" "Ch1: (0x2AF)"
48443-48632 sent: fast-channel1-value: "Channel 1: 687 (0x2AF)" "Ch1: 687 (0x2AF)" "Ch1: (0x2AF)"
49082-49271 sent: fast-channel1-value: "Channel 1: 687 (0x2AF)" "Ch1: 687 (0x2AF)" "Ch1: (0x2AF)"
49721-49910 sent: fast-channel1-value: "Channel 1: 687 (0x2AF)" "Ch1: 687 (0x2AF)" "Ch1: (0x2AF)"
50360-50549 sent: fast-channel1-value: "Channel 1: 687 (0x2AF)" "Ch1: 687 (0x2AF)" "Ch1: (0x2AF)"
50999-51188 sent: fast-channel1-value: "Channel 1: 687 (0x2AF)" "Ch1: 687 (0x2AF)" "Ch1: (0x2AF)"
51638-51827 sent: fast-channel1-value: "Channel 1: 687 (0x2AF)" "Ch1: 687 (0x2AF)" "Ch1: (0x2AF)"
52277-52466 sent: fast-channel1-value: "Channel 1: 687 (0x2AF)" "Ch1: 687 (0x2AF)" "Ch1: (0x2AF)"
52916-53105 sent: fast-channel1-value: "Channel 1: 687 (0x2AF)" "Ch1: 687 (0x2AF)" "Ch1: (0x2AF)"
53555-53744 sent: fast-channel1-value: "Channel 1: 687 (0x2AF)" "Ch1: 687 (0x2AF)" "Ch1: (0x2AF)"
54194-54383 sent: fast-channel1-value: "Channel 1: 687 (0x2AF)" "Ch1: 687 (0x2AF)" "Ch1: (0x2AF)"
54833-55022 sent: fast-channel1-value: "Channel 1: 687 (0x2AF)" "Ch1: 687 (0x2AF)" "Ch1: (0x2AF)"
55472-55662 sent: fast-channel1-value: "Channel 1: 687 (0x2AF)" "Ch1: 687 (0x2AF)" "Ch1: (0x2AF)"
56112-56301 sent: fast-channel1-value: "Channel 1: 687 (0x2AF)" "Ch1: 687 (0x2AF)" "Ch1: (0x2AF)"
56751-56940 sent: fast-channel1-value: "Channel 1: 687 (0x2AF)" "Ch1: 687 (0x2AF)" "Ch1: (0x2AF)"
57390-57579 sent: fast-channel1-value: "Channel 1: 687 (0x2AF)" "Ch1: 687 (0x2AF)" "Ch1: (0x2AF)"
58029-58218 sent: fast-channel1-value: "Channel 1: 687 (0x2AF)" "Ch1: 687 (0x2AF)" "Ch1: (0x2AF)"
58668-58857 sent: fast-channel1-value: "Channel 1: 687 (0x2AF)" "Ch1: 687 (0x2AF)" "Ch1: (0x2AF)"
59307-59496 sent: fast-channel1-value: "Channel 1: 687 (0x2AF)" "Ch1: 687 (0x2AF)" "Ch1: (0x2AF)"
59946-60135 sent: fast-channel1-value: "Channel 1: 687 (0x2AF)" "Ch1: 687 (0x2AF)" "Ch1: (0x2AF)"
60585-60774 sent: fast-channel1-value: "Channel 1: 687 (0x2AF)" "Ch1: 687 (0x2AF)" "Ch1: (0x2AF)"
61224-61413 sent: fast-channel1-value: "Channel 1: 687 (0x2AF)" "Ch1: 687 (0x2AF)" "Ch1: (0x2AF)"
61863-62052 sent: fast-channel1-value: "Channel 1: 687 (0x2AF)" "Ch1: 687 (0x2AF)" "Ch1: (0x2AF)"
62502-62691 sent: fast-channel1-value: "Channel 1: 687 (0x2AF)" "Ch1: 687 (0x2AF)" "Ch1: (0x2AF)"
63141-63331 sent: fast-channel1-value: "Channel 1: 687 (0x2AF)" "Ch1: 687 (0x2AF)" "Ch1: (0x2AF)"
63781-63970 sent: fast-channel1-value: "Channel 1: 687 (0x2AF)" "Ch1: 687 (0x2AF)" "Ch1: (0x2AF)"
64420-64609 sent: fast-channel1-value: "Channel 1: 687 (0x2AF)" "Ch1: 687 (0x2AF)" "Ch1: (0x2AF)"
65059-65248 sent: fast-channel1-value: "Channel 1: 687 (0x2AF)" "Ch1: 687 (0x2AF)" "Ch1: (0x2AF)"
65698-65887 sent: fast-channel1-value: "Channel 1: 687 (0x2AF)" "Ch1: 687 (0x2AF)" "Ch1: (0x2AF)"
66337-66526 sent: fast-channel1-value: "Channel 1: 687 (0x2AF)" "Ch1: 687 (0x2AF)" "Ch1: (0x2AF)"
66976-67165 sent: fast-channel1-value: "Channel 1: 687 (0x2AF)" "Ch1: 687 (0x2AF)" "Ch1: (0x2AF)"
67615-67804 sent: fast-channel1-value: "Channel 1: 687 (0x2AF)" "Ch1: 687 (0x2AF)" "Ch1: (0x2AF)"
68254-68443 sent: fast-channel1-value: "Channel 1: 687 (0x2AF)" "Ch1: 687 (0x2AF)" "Ch1: (0x2AF)"
68893-69082 sent: fast-channel1-value: "Channel 1: 687 (0x2AF)" "Ch1: 687 (0x2AF)" "Ch1: (0x2AF)"
69532-69721 sent: fast-channel1-value: "Channel 1: 687 (0x2AF)" "Ch1: 687 (0x2AF)" "Ch1: (0x2AF)"
70171-70360 sent: fast-channel1-value: "Channel 1: 687 (0x2AF)" "Ch1: 687 (0x2AF)" "Ch1: (0x2AF)"
70810-71000 sent: fast-channel1-value: "Channel 1: 687 (0x2AF)" "Ch1: 687 (0x2AF)" "Ch1: (0x2AF)"
71450-71639 sent: fast-channel1-value: "Channel 1: 687 (0x2AF)" "Ch1: 687 (0x2AF)" "Ch1: (0x2AF)"
72089-72278 sent: fast-channel1-value: "Channel 1: 687 (0x2AF)" "Ch1: 687 (0x2AF)" "Ch1: (0x2AF)"
72728-72917 sent: fast-channel1-value: "Channel 1: 687 (0x2AF)" "Ch1: 687 (0x2AF)" "Ch1: (0x2AF)"
73367-73556 sent: fast-channel1-value: "Channel 1: 687 (0x2AF)" "Ch1: 687 (0x2AF)" "Ch1: (0x2AF)"
74006-74195 sent: fast-channel1-value: "Channel 1: 687 (0x2AF)" "Ch1: 687 (0x2AF)" "Ch1: (0x2AF)"
74645-74834 sent: fast-channel1-value: "Channel 1: 687 (0x2AF)" "Ch1: 687 (0x2AF)" "Ch1: (0x2AF)"
75284-75473 sent: fast-channel1-value: "Channel 1: 687 (0x2AF)" "Ch1: 687 (0x2AF)" "Ch1: (0x2AF)"
75923-76112 sent: fast-channel1-value: "Channel 1: 687 (0x2AF)" "Ch1: 687 (0x2AF)" "Ch1: (0x2AF)"
76562-76751 sent: fast-channel1-value: "Channel 1: 687 (0x2AF)" "Ch1: 687 (0x2AF)" "Ch1: (0x2AF)"
77201-77390 sent: fast-channel1-value: "Channel 1: 687 (0x2AF)" "Ch1: 687 (0x2AF)" "Ch1: (0x2AF)"
77840-78029 sent: fast-channel1-value: "Channel 1: 687 (0x2AF)" "Ch1: 687 (0x2AF)" "Ch1: (0x2AF)"
78479-78668 sent: fast-channel1-value: "Channel 1: 687 (0x2AF)" "Ch1: 687 (0x2AF)" "Ch1: (0x2AF)"
79119-79308 sent: fast-channel1-value: "Channel 1: 687 (0x2AF)" "Ch1: 687 (0x2AF)" "Ch1: (0x2AF)"
79758-79947 sent: fast-channel1-value: "Channel 1: 687 (0x2AF)" "Ch1: 687 (0x2AF)" "Ch1: (0x2AF)"
80397-80586 sent: fast-channel1-value: "Channel 1: 687 (0x2AF)" "Ch1: 687 (0x2AF)" "Ch1: (0x2AF)"
81036-81225 sent: fast-channel1-value: "Channel 1: 687 (0x2AF)" "Ch1: 687 (0x2AF)" "Ch1: (0x2AF)"
81675-81864 sent: fast-channel1-value: "Channel 1: 687 (0x2AF)" "Ch1: 687 (0x2AF)" "Ch1: (0x2AF)"
82314-82503 sent: fast-channel1-value: "Channel 1: 687 (0x2AF)" "Ch1: 687 (0x2AF)" "Ch1: (0x2AF)"
82953-83142 sent: fast-channel1-value: "Channel 1: 687 (0x2AF)" "Ch1: 687 (0x2AF)" "Ch1: (0x2AF)"
83592-83781 sent: fast-channel1-value: "Channel 1: 687 (0x2AF)" "Ch1: 687 (0x2AF)" "Ch1: (0x2AF)"
84231-84420 sent: fast-channel1-value: "Channel 1: 687 (0x2AF)" "Ch1: 687 (0x2AF)" "Ch1: (0x2AF)"
84870-85059 sent: fast-channel1-value: "Channel 1: 687 (0x2AF)" "Ch1: 687 (0x2AF)" "Ch1: (0x2AF)"
85509-85698 sent: fast-channel1-value: "Channel 1: 687 (0x2AF)" "Ch1: 687 (0x2AF)" "Ch1: (0x2AF)"
86148-86337 sent: fast-channel1-value: "Channel 1: 687 (0x2AF)" "Ch1: 687 (0x2AF)" "Ch1: (0x2AF)"
86788-86977 sent: fast-channel1-value: "Channel 1: 687 (0x2AF)" "Ch1: 687 (0x2AF)" "Ch1: (0x2AF)"
87427-87616 sent: fast-channel1-value: "Channel 1: 687 (0x2AF)" "Ch1: 687 (0x2AF)" "Ch1: (0x2AF)"
88066-88255 sent: fast-channel1-value: "Channel 1: 687 (0x2AF)" "Ch1: 687 (0x2AF)" "Ch1: (0x2AF)"
88705-88894 sent: fast-channel1-value: "Channel 1: 687 (0x2AF)" "Ch1: 687 (0x2AF)" "Ch1: (0x2AF)"
89344-89533 sent: fast-channel1-value: "Channel 1: 687 (0x2AF)" "Ch1: 687 (0x2AF)" "Ch1: (0x2AF)"
89983-90172 sent: fast-channel1-value: "Channel 1: 687 (0x2AF)" "Ch1: 687 (0x2AF)" "Ch1: (0x2AF)"
90622-90811 sent: fast-channel1-value: "Channel 1: 687 (0x2AF)" "Ch1: 687 (0x2AF)" "Ch1: (0x2AF)"
91261-91450 sent: fast-channel1-value: "Channel 1: 687 (0x2AF)" "Ch1: 687 (0x2AF)" "Ch1: (0x2AF)"
91900-92089 sent: fast-channel1-value: "Channel 1: 687 (0x2AF)" "Ch1: 687 (0x2AF)" "Ch1: (0x2AF)"
92539-92728 sent: fast-channel1-value: "Channel 1: 687 (0x2AF)" "Ch1: 687 (0x2AF)" "Ch1: (0x2AF)"
93178-93367 sent: fast-channel1-value: "Channel 1: 687 (0x2AF)" "Ch1: 687 (0x2AF)" "Ch1: (0x2AF)"
93817-94006 sent: fast-channel1-value: "Channel 1: 687 (0x2AF)" "Ch1: 687 (0x2AF)" "Ch1: (0x2AF)"
94457-94646 sent: fast-channel1-value: "Channel 1: 687 (0x2AF)" "Ch1: 687 (0x2AF)" "Ch1: (0x2AF)"
95096-95285 sent: fast-channel1-value: "Channel 1: 687 (0x2AF)" "Ch1: 687 (0x2AF)" "Ch1: (0x2AF)"
95735-95924 sent: fast-channel1-value: "Channel 1: 687 (0x2AF)" "Ch1: 687 (0x2AF)" "Ch1: (0x2AF)"
96374-96563 sent: fast-channel1-value: "Channel 1: 687 (0x2AF)" "Ch1: 687 (0x2AF)" "Ch1: (0x2AF)"
97013-97202 sent: fast-channel1-value: "Channel 1: 687 (0x2AF)" "Ch1: 687 (0x2AF)" "Ch1: (0x2AF)"
97652-97841 sent: fast-channel1-value: "Channel 1: 687 (0x2AF)" "Ch1: 687 (0x2AF)" "Ch1: (0x2AF)"
98291-98480 sent: fast-channel1-value: "Channel 1: 687 (0x2AF)" "Ch1: 687 (0x2AF)" "Ch1: (0x2AF)"
98930-99119 sent: fast-channel1-value: "Channel 1: 687 (0x2AF)" "Ch1: 687 (0x2AF)" "Ch1: (0x2AF)"
99569-99758 sent: fast-channel1-value: "Channel 1: 687 (0x2AF)" "Ch1: 687 (0x2AF)" "Ch1: (0x2AF)"
