541-550 sent: fast-channel2-error: "Channel 2: Value OK (0)" "Ch2: OK (0)"
1117-1126 sent: fast-channel2-error: "Channel 2: Value OK (0)" "Ch2: OK (0)"
1693-1702 sent: fast-channel2-error: "Channel 2: Value OK (0)" "Ch2: OK (0)"
2269-2278 sent: fast-channel2-error: "Channel 2: Value OK (0)" "Ch2: OK (0)"
2845-2854 sent: fast-channel2-error: "Channel 2: Value OK (0)" "Ch2: OK (0)"
3421-3430 sent: fast-channel2-error: "Channel 2: Value OK (0)" "Ch2: OK (0)"
3997-4006 sent: fast-channel2-error: "Channel 2: Value OK (0)" "Ch2: OK (0)"
4573-4582 sent: fast-channel2-error: "Channel 2: Value OK (0)" "Ch2: OK (0)"
5149-5158 sent: fast-channel2-error: "Channel 2: Value OK (0)" "Ch2: OK (0)"
5725-5734 sent: fast-channel2-error: "Channel 2: Value OK (0)" "Ch2: OK (0)"
6301-6310 sent: fast-channel2-error: "Channel 2: Value OK (0)" "Ch2: OK (0)"
6877-6886 sent: fast-channel2-error: "Channel 2: Value OK (0)" "Ch2: OK (0)"
7453-7462 sent: fast-channel2-error: "Channel 2: Value OK (0)" "Ch2: OK (0)"
8030-8039 sent: fast-channel2-error: "Channel 2: Value OK (0)" "Ch2: OK (0)"
8606-8615 sent: fast-channel2-error: "Channel 2: Value OK (0)" "Ch2: OK (0)"
9182-9191 sent: fast-channel2-error: "Channel 2: Value OK (0)" "Ch2: OK (0)"
9758-9767 sent: fast-channel2-error: "Channel 2: Value OK (0)" "Ch2: OK (0)"
10334-10343 sent: fast-channel2-error: "Channel 2: Value OK (0)" "Ch2: OK (0)"
10910-10919 sent: fast-channel2-error: "Channel 2: Value OK (0)" "Ch2: OK (0)"
11486-11495 sent: fast-channel2-error: "Channel 2: Value OK (0)" "Ch2: OK (0)"
12062-12071 sent: fast-channel2-error: "Channel 2: Value OK (0)" "Ch2: OK (0)"
12638-12647 sent: fast-channel2-error: "Channel 2: Value OK (0)" "Ch2: OK (0)"
13214-13223 sent: fast-channel2-error: "Channel 2: Value OK (0)" "Ch2: OK (0)"
13790-13799 sent: fast-channel2-error: "Channel 2: Value OK (0)" "Ch2: OK (0)"
14366-14375 sent: fast-channel2-error: "Channel 2: Value OK (0)" "Ch2: OK (0)"
14942-14951 sent: fast-channel2-error: "Channel 2: Value OK (0)" "Ch2: OK (0)"
15519-15528 sent: fast-channel2-error: "Channel 2: Value OK (0)" "Ch2: OK (0)"
16095-16104 sent: fast-channel2-error: "Channel 2: Value OK (0)" "Ch2: OK (0)"
16671-16680 sent: fast-channel2-error: "Channel 2: Value OK (0)" "Ch2: OK (0)"
17247-17256 sent: fast-channel2-error: "Channel 2: Value OK (0)" "Ch2: OK (0)"
17823-17832 sent: fast-channel2-error: "Channel 2: Value OK (0)" "Ch2: OK (0)"
18399-18408 sent: fast-channel2-error: "Channel 2: Value OK (0)" "Ch2: OK (0)"
18975-18984 sent: fast-channel2-error: "Channel 2: Value OK (0)" "Ch2: OK (0)"
19551-19560 sent: fast-channel2-error: "Channel 2: Value OK (0)" "Ch2: OK (0)"
20127-20136 sent: fast-channel2-error: "Channel 2: Value OK (0)" "Ch2: OK (0)"
20703-20712 sent: fast-channel2-error: "Channel 2: Value OK (0)" "Ch2: OK (0)"
21279-21288 sent: fast-channel2-error: "Channel 2: Value OK (0)" "Ch2: OK (0)"
21855-21864 sent: fast-channel2-error: "Channel 2: Value OK (0)" "Ch2: OK (0)"
22431-22440 sent: fast-channel2-error: "Channel 2: Value OK (0)" "Ch2: OK (0)"
23008-23017 sent: fast-channel2-error: "Channel 2: Value OK (0)" "Ch2: OK (0)"
23584-23593 sent: fast-channel2-error: "Channel 2: Value OK (0)" "Ch2: OK (0)"
24160-24169 sent: fast-channel2-error: "Channel 2: Value OK (0)" "Ch2: OK (0)"
24736-24745 sent: fast-channel2-error: "Channel 2: Value OK (0)" "Ch2: OK (0)"
25312-25321 sent: fast-channel2-error: "Channel 2: Value OK (0)" "Ch2: OK (0)"
25888-25897 sent: fast-channel2-error: "Channel 2: Value OK (0)" "Ch2: OK (0)"
26464-26473 sent: fast-channel2-error: "Channel 2: Value OK (0)" "Ch2: OK (0)"
27040-27049 sent: fast-channel2-error: "Channel 2: Value OK (0)" "Ch2: OK (0)"
27616-27625 sent: fast-channel2-error: "Channel 2: Value OK (0)" "Ch2: OK (0)"
28192-28201 sent: fast-channel2-error: "Channel 2: Value OK (0)" "Ch2: OK (0)"
28768-28777 sent: fast-channel2-error: "Channel 2: Value OK (0)" "Ch2: OK (0)"
29344-29353 sent: fast-channel2-error: "Channel 2: Value OK (0)" "Ch2: OK (0)"
29920-29929 sent: fast-channel2-error: "Channel 2: Value OK (0)" "Ch2: OK (0)"
30496-30505 sent: fast-channel2-error: "Channel 2: Value OK (0)" "Ch2: OK (0)"
31073-31082 sent: fast-channel2-error: "Channel 2: Value OK (0)" "Ch2: OK (0)"
31649-31658 sent: fast-channel2-error: "Channel 2: Value OK (0)" "Ch2: OK (0)"
32225-32234 sent: fast-channel2-error: "Channel 2: Value OK (0)" "Ch2: OK (0)"
32801-32810 sent: fast-channel2-error: "Channel 2: Value OK (0)" "Ch2: OK (0)"
33377-33386 sent: fast-channel2-error: "Channel 2: Value OK (0)" "Ch2: OK (0)"
33953-33962 sent: fast-channel2-error: "Channel 2: Value OK (0)" "Ch2: OK (0)"
34529-34538 sent: fast-channel2-error: "Channel 2: Value OK (0)" "Ch2: OK (0)"
35105-35114 sent: fast-channel2-error: "Channel 2: Value OK (0)" "Ch2: OK (0)"
35681-35690 sent: fast-channel2-error: "Channel 2: Value OK (0)" "Ch2: OK (0)"
36257-36266 sent: fast-channel2-error: "Channel 2: Value OK (0)" "Ch2: OK (0)"
36833-36842 sent: fast-channel2-error: "Channel 2: Value OK (0)" "Ch2: OK (0)"
37409-37418 sent: fast-channel2-error: "Channel 2: Value OK (0)" "Ch2: OK (0)"
37985-37994 sent: fast-channel2-error: "Channel 2: Value OK (0)" "Ch2: OK (0)"
38562-38571 sent: fast-channel2-error: "Channel 2: Value OK (0)" "Ch2: OK (0)"
39138-39147 sent: fast-channel2-error: "Channel 2: Value OK (0)" "Ch2: OK (0)"
39714-39723 sent: fast-channel2-error: "Channel 2: Value OK (0)" "Ch2: OK (0)"
40290-40299 sent: fast-channel2-error: "Channel 2: Value OK (0)" "Ch2: OK (0)"
40866-40875 sent: fast-channel2-error: "Channel 2: Value OK (0)" "Ch2: OK (0)"
41442-41451 sent: fast-channel2-error: "Channel 2: Value OK (0)" "Ch2: OK (0)"
42018-42027 sent: fast-channel2-error: "Channel 2: Value OK (0)" "Ch2: OK (0)"
42594-42603 sent: fast-channel2-error: "Channel 2: Value OK (0)" "Ch2: OK (0)"
43170-43179 sent: fast-channel2-error: "Channel 2: Value OK (0)" "Ch2: OK (0)"
43746-43755 sent: fast-channel2-error: "Channel 2: Value OK (0)" "Ch2: OK (0)"
44322-44331 sent: fast-channel2-error: "Channel 2: Value OK (0)" "Ch2: OK (0)"
44898-44907 sent: fast-channel2-error: "Channel 2: Value OK (0)" "Ch2: OK (0)"
45474-45483 sent: fast-channel2-error: "Channel 2: Value OK (0)" "Ch2: OK (0)"
46051-46060 sent: fast-channel2-error: "Channel 2: Value OK (0)" "Ch2: OK (0)"
46627-46636 sent: fast-channel2-error: "Channel 2: Value OK (0)" "Ch2: OK (0)"
47203-47212 sent: fast-channel2-error: "Channel 2: Value OK (0)" "Ch2: OK (0)"
47779-47788 sent: fast-channel2-error: "Channel 2: Value OK (0)" "Ch2: OK (0)"
48355-48364 sent: fast-channel2-error: "Channel 2: Value OK (0)" "Ch2: OK (0)"
48931-48940 sent: fast-channel2-error: "Channel 2: Value OK (0)" "Ch2: OK (0)"
49507-49516 sent: fast-channel2-error: "Channel 2: Value OK (0)" "Ch2: OK (0)"
50083-50092 sent: fast-channel2-error: "Channel 2: Value OK (0)" "Ch2: OK (0)"
50659-50668 sent: fast-channel2-error: "Channel 2: Value OK (0)" "Ch2: OK (0)"
51235-51244 sent: fast-channel2-error: "Channel 2: Value OK (0)" "Ch2: OK (0)"
51811-51820 sent: fast-channel2-error: "Channel 2: Value OK (0)" "Ch2: OK (0)"
52387-52396 sent: fast-channel2-error: "Channel 2: Value OK (0)" "Ch2: OK (0)"
52963-52972 sent: fast-channel2-error: "Channel 2: Value OK (0)" "Ch2: OK (0)"
53539-53548 sent: fast-channel2-error: "Channel 2: Value OK (0)" "Ch2: OK (0)"
54116-54125 sent: fast-channel2-error: "Channel 2: Value OK (0)" "Ch2: OK (0)"
54692-54701 sent: fast-channel2-error: "Channel 2: Value OK (0)" "Ch2: OK (0)"
55268-55277 sent: fast-channel2-error: "Channel 2: Value OK (0)" "Ch2: OK (0)"
55844-55853 sent: fast-channel2-error: "Channel 2: Value OK (0)" "Ch2: OK (0)"
56420-56429 sent: fast-channel2-error: "Channel 2: Value OK (0)" "Ch2: OK (0)"
56996-57005 sent: fast-channel2-error: "Channel 2: Value OK (0)" "Ch2: OK (0)"
57572-57581 sent: fast-channel2-error: "Channel 2: Value OK (0)" "Ch2: OK (0)"
58148-58157 sent: fast-channel2-error: "Channel 2: Value OK (0)" "Ch2: OK (0)"
58724-58733 sent: fast-channel2-error: "Channel 2: Value OK (0)" "Ch2: OK (0)"
59300-59309 sent: fast-channel2-error: "Channel 2: Value OK (0)" "Ch2: OK (0)"
59876-59885 sent: fast-channel2-error: "Channel 2: Value OK (0)" "Ch2: OK (0)"
60452-60461 sent: fast-channel2-error: "Channel 2: Value OK (0)" "Ch2: OK (0)"
61028-61037 sent: fast-channel2-error: "Channel 2: Value OK (0)" "Ch2: OK (0)"
61605-61614 sent: fast-channel2-error: "Channel 2: Value OK (0)" "Ch2: OK (0)"
62181-62190 sent: fast-channel2-error: "Channel 2: Value OK (0)" "Ch2: OK (0)"
62757-62766 sent: fast-channel2-error: "Channel 2: Value OK (0)" "Ch2: OK (0)"
63333-63342 sent: fast-channel2-error: "Channel 2: Value OK (0)" "Ch2: OK (0)"
63909-63918 sent: fast-channel2-error: "Channel 2: Value OK (0)" "Ch2: OK (0)"
64485-64494 sent: fast-channel2-error: "Channel 2: Value OK (0)" "Ch2: OK (0)"
65061-65070 sent: fast-channel2-error: "Channel 2: Value OK (0)" "Ch2: OK (0)"
65637-65646 sent: fast-channel2-error: "Channel 2: Value OK (0)" "Ch2: OK (0)"
66213-66222 sent: fast-channel2-error: "Channel 2: Value OK (0)" "Ch2: OK (0)"
66789-66798 sent: fast-channel2-error: "Channel 2: Value OK (0)" "Ch2: OK (0)"
67365-67374 sent: fast-channel2-error: "Channel 2: Value OK (0)" "Ch2: OK (0)"
67941-67950 sent: fast-channel2-error: "Channel 2: Value OK (0)" "Ch2: OK (0)"
68517-68526 sent: fast-channel2-error: "Channel 2: Value OK (0)" "Ch2: OK (0)"
69094-69103 sent: fast-channel2-error: "Channel 2: Value OK (0)" "Ch2: OK (0)"
69670-69679 sent: fast-channel2-error: "Channel 2: Value OK (0)" "Ch2: OK (0)"
70246-70255 sent: fast-channel2-error: "Channel 2: Value OK (0)" "Ch2: OK (0)"
70822-70831 sent: fast-channel2-error: "Channel 2: Value OK (0)" "Ch2: OK (0)"
71398-71407 sent: fast-channel2-error: "Channel 2: Value OK (0)" "Ch2: OK (0)"
71974-71983 sent: fast-channel2-error: "Channel 2: Value OK (0)" "Ch2: OK (0)"
72550-72559 sent: fast-channel2-error: "Channel 2: Value OK (0)" "Ch2: OK (0)"
73126-73135 sent: fast-channel2-error: "Channel 2: Value OK (0)" "Ch2: OK (0)"
73702-73711 sent: fast-channel2-error: "Channel 2: Value OK (0)" "Ch2: OK (0)"
74278-74287 sent: fast-channel2-error: "Channel 2: Value OK (0)" "Ch2: OK (0)"
74854-74863 sent: fast-channel2-error: "Channel 2: Value OK (0)" "Ch2: OK (0)"
75430-75439 sent: fast-channel2-error: "Channel 2: Value OK (0)" "Ch2: OK (0)"
76006-76015 sent: fast-channel2-error: "Channel 2: Value OK (0)" "Ch2: OK (0)"
76582-76591 sent: fast-channel2-error: "Channel 2: Value OK (0)" "Ch2: OK (0)"
77159-77168 sent: fast-channel2-error: "Channel 2: Value OK (0)" "Ch2: OK (0)"
77735-77744 sent: fast-channel2-error: "Channel 2: Value OK (0)" "Ch2: OK (0)"
78311-78320 sent: fast-channel2-error: "Channel 2: Value OK (0)" "Ch2: OK (0)"
78887-78896 sent: fast-channel2-error: "Channel 2: Value OK (0)" "Ch2: OK (0)"
79463-79472 sent: fast-channel2-error: "Channel 2: Value OK (0)" "Ch2: OK (0)"
80039-80048 sent: fast-channel2-error: "Channel 2: Value OK (0)" "Ch2: OK (0)"
80615-80624 sent: fast-channel2-error: "Channel 2: Value OK (0)" "Ch2: OK (0)"
81191-81200 sent: fast-channel2-error: "Channel 2: Value OK (0)" "Ch2: OK (0)"
81767-81776 sent: fast-channel2-error: "Channel 2: Value OK (0)" "Ch2: OK (0)"
82343-82352 sent: fast-channel2-error: "Channel 2: Value OK (0)" "Ch2: OK (0)"
82919-82928 sent: fast-channel2-error: "Channel 2: Value OK (0)" "Ch2: OK (0)"
83495-83504 sent: fast-channel2-error: "Channel 2: Value OK (0)" "Ch2: OK (0)"
84071-84080 sent: fast-channel2-error: "Channel 2: Value OK (0)" "Ch2: OK (0)"
84648-84657 sent: fast-channel2-error: "Channel 2: Value OK (0)" "Ch2: OK (0)"
85224-85233 sent: fast-channel2-error: "Channel 2: Value OK (0)" "Ch2: OK (0)"
85800-85809 sent: fast-channel2-error: "Channel 2: Value OK (0)" "Ch2: OK (0)"
86376-86385 sent: fast-channel2-error: "Channel 2: Value OK (0)" "Ch2: OK (0)"
86952-86961 sent: fast-channel2-error: "Channel 2: Value OK (0)" "Ch2: OK (0)"
87528-87537 sent: fast-channel2-error: "Channel 2: Value OK (0)" "Ch2: OK (0)"
88104-88113 sent: fast-channel2-error: "Channel 2: Value OK (0)" "Ch2: OK (0)"
88680-88689 sent: fast-channel2-error: "Channel 2: Value OK (0)" "Ch2: OK (0)"
89256-89265 sent: fast-channel2-error: "Channel 2: Value OK (0)" "Ch2: OK (0)"
89832-89841 sent: fast-channel2-error: "Channel 2: Value OK (0)" "Ch2: OK (0)"
90408-90417 sent: fast-channel2-error: "Channel 2: Value OK (0)" "Ch2: OK (0)"
90984-90993 sent: fast-channel2-error: "Channel 2: Value OK (0)" "Ch2: OK (0)"
91560-91569 sent: fast-channel2-error: "Channel 2: Value OK (0)" "Ch2: OK (0)"
92137-92146 sent: fast-channel2-error: "Channel 2: Value OK (0)" "Ch2: OK (0)"
92713-92722 sent: fast-channel2-error: "Channel 2: Value OK (0)" "Ch2: OK (0)"
93289-93298 sent: fast-channel2-error: "Channel 2: Value OK (0)" "Ch2: OK (0)"
93865-93874 sent: fast-channel2-error: "Channel 2: Value OK (0)" "Ch2: OK (0)"
94441-94450 sent: fast-channel2-error: "Channel 2: Value OK (0)" "Ch2: OK (0)"
95017-95026 sent: fast-channel2-error: "Channel 2: Value OK (0)" "Ch2: OK (0)"
95593-95602 sent: fast-channel2-error: "Channel 2: Value OK (0)" "Ch2: OK (0)"
96169-96178 sent: fast-channel2-error: "Channel 2: Value OK (0)" "Ch2: OK (0)"
96745-96754 sent: fast-channel2-error: "Channel 2: Value OK (0)" "Ch2: OK (0)"
97321-97330 sent: fast-channel2-error: "Channel 2: Value OK (0)" "Ch2: OK (0)"
97897-97906 sent: fast-channel2-error: "Channel 2: Value OK (0)" "Ch2: OK (0)"
98473-98482 sent: fast-channel2-error: "Channel 2: Value OK (0)" "Ch2: OK (0)"
99049-99058 sent: fast-channel2-error: "Channel 2: Value OK (0)" "Ch2: OK (0)"
99625-99634 sent: fast-channel2-error: "Channel 2: Value OK (0)" "Ch2: OK (0)"
