102-270 sent: calibration: "Calibration" "Cal" "C"
891-963 sent: calibration: "Calibration" "Cal" "C"
963-1002 sent: calibration: "Calibration" "Cal" "C"
1002-1170 sent: calibration: "Calibration" "Cal" "C"
1791-1863 sent: calibration: "Calibration" "Cal" "C"
1863-1902 sent: calibration: "Calibration" "Cal" "C"
1902-2070 sent: calibration: "Calibration" "Cal" "C"
2691-2763 sent: calibration: "Calibration" "Cal" "C"
2763-2802 sent: calibration: "Calibration" "Cal" "C"
2802-2970 sent: calibration: "Calibration" "Cal" "C"
3591-3663 sent: calibration: "Calibration" "Cal" "C"
3663-3702 sent: calibration: "Calibration" "Cal" "C"
3702-3871 sent: calibration: "Calibration" "Cal" "C"
4492-4564 sent: calibration: "Calibration" "Cal" "C"
4564-4603 sent: calibration: "Calibration" "Cal" "C"
4603-4771 sent: calibration: "Calibration" "Cal" "C"
5392-5464 sent: calibration: "Calibration" "Cal" "C"
5464-5503 sent: calibration: "Calibration" "Cal" "C"
5503-5671 sent: calibration: "Calibration" "Cal" "C"
6292-6364 sent: calibration: "Calibration" "Cal" "C"
6364-6403 sent: calibration: "Calibration" "Cal" "C"
6403-6571 sent: calibration: "Calibration" "Cal" "C"
7192-7264 sent: calibration: "Calibration" "Cal" "C"
7264-7303 sent: calibration: "Calibration" "Cal" "C"
7303-7471 sent: calibration: "Calibration" "Cal" "C"
8092-8164 sent: calibration: "Calibration" "Cal" "C"
8164-8203 sent: calibration: "Calibration" "Cal" "C"
8203-8371 sent: calibration: "Calibration" "Cal" "C"
8992-9064 sent: calibration: "Calibration" "Cal" "C"
9064-9103 sent: calibration: "Calibration" "Cal" "C"
9103-9271 sent: calibration: "Calibration" "Cal" "C"
9892-9964 sent: calibration: "Calibration" "Cal" "C"
9964-10003 sent: calibration: "Calibration" "Cal" "C"
10003-10171 sent: calibration: "Calibration" "Cal" "C"
10792-10864 sent: calibration: "Calibration" "Cal" "C"
10864-10903 sent: calibration: "Calibration" "Cal" "C"
10903-11071 sent: calibration: "Calibration" "Cal" "C"
11693-11765 sent: calibration: "Calibration" "Cal" "C"
11765-11804 sent: calibration: "Calibration" "Cal" "C"
11804-11972 sent: calibration: "Calibration" "Cal" "C"
12593-12665 sent: calibration: "Calibration" "Cal" "C"
12665-12704 sent: calibration: "Calibration" "Cal" "C"
12704-12872 sent: calibration: "Calibration" "Cal" "C"
13493-13565 sent: calibration: "Calibration" "Cal" "C"
13565-13604 sent: calibration: "Calibration" "Cal" "C"
13604-13772 sent: calibration: "Calibration" "Cal" "C"
14393-14465 sent: calibration: "Calibration" "Cal" "C"
14465-14504 sent: calibration: "Calibration" "Cal" "C"
14504-14672 sent: calibration: "Calibration" "Cal" "C"
15293-15365 sent: calibration: "Calibration" "Cal" "C"
15365-15404 sent: calibration: "Calibration" "Cal" "C"
15404-15572 sent: calibration: "Calibration" "Cal" "C"
16193-16265 sent: calibration: "Calibration" "Cal" "C"
16265-16304 sent: calibration: "Calibration" "Cal" "C"
16304-16472 sent: calibration: "Calibration" "Cal" "C"
17093-17165 sent: calibration: "Calibration" "Cal" "C"
17165-17204 sent: calibration: "Calibration" "Cal" "C"
17204-17372 sent: calibration: "Calibration" "Cal" "C"
17993-18065 sent: calibration: "Calibration" "Cal" "C"
18065-18104 sent: calibration: "Calibration" "Cal" "C"
18104-18272 sent: calibration: "Calibration" "Cal" "C"
18893-18965 sent: calibration: "Calibration" "Cal" "C"
18965-19004 sent: calibration: "Calibration" "Cal" "C"
19004-19173 sent: calibration: "Calibration" "Cal" "C"
19794-19866 sent: calibration: "Calibration" "Cal" "C"
19866-19905 sent: calibration: "Calibration" "Cal" "C"
19905-20073 sent: calibration: "Calibration" "Cal" "C"
20694-20766 sent: calibration: "Calibration" "Cal" "C"
20766-20805 sent: calibration: "Calibration" "Cal" "C"
20805-20973 sent: calibration: "Calibration" "Cal" "C"
21594-21666 sent: calibration: "Calibration" "Cal" "C"
21666-21705 sent: calibration: "Calibration" "Cal" "C"
21705-21873 sent: calibration: "Calibration" "Cal" "C"
22494-22566 sent: calibration: "Calibration" "Cal" "C"
22566-22605 sent: calibration: "Calibration" "Cal" "C"
22605-22773 sent: calibration: "Calibration" "Cal" "C"
23394-23466 sent: calibration: "Calibration" "Cal" "C"
23466-23505 sent: calibration: "Calibration" "Cal" "C"
23505-23673 sent: calibration: "Calibration" "Cal" "C"
24294-24366 sent: calibration: "Calibration" "Cal" "C"
24366-24405 sent: calibration: "Calibration" "Cal" "C"
24405-24573 sent: calibration: "Calibration" "Cal" "C"
25194-25266 sent: calibration: "Calibration" "Cal" "C"
25266-25305 sent: calibration: "Calibration" "Cal" "C"
25305-25473 sent: calibration: "Calibration" "Cal" "C"
26094-26166 sent: calibration: "Calibration" "Cal" "C"
26166-26205 sent: calibration: "Calibration" "Cal" "C"
26205-26373 sent: calibration: "Calibration" "Cal" "C"
26995-27067 sent: calibration: "Calibration" "Cal" "C"
27067-27106 sent: calibration: "Calibration" "Cal" "C"
27106-27274 sent: calibration: "Calibration" "Cal" "C"
27895-27967 sent: calibration: "Calibration" "Cal" "C"
27967-28006 sent: calibration: "Calibration" "Cal" "C"
28006-28174 sent: calibration: "Calibration" "Cal" "C"
28795-28867 sent: calibration: "Calibration" "Cal" "C"
28867-28906 sent: calibration: "Calibration" "Cal" "C"
28906-29074 sent: calibration: "Calibration" "Cal" "C"
29695-29767 sent: calibration: "Calibration" "Cal" "C"
29767-29806 sent: calibration: "Calibration" "Cal" "C"
29806-29974 sent: calibration: "Calibration" "Cal" "C"
30595-30667 sent: calibration: "Calibration" "Cal" "C"
30667-30706 sent: calibration: "Calibration" "Cal" "C"
30706-30874 sent: calibration: "Calibration" "Cal" "C"
31495-31567 sent: calibration: "Calibration" "Cal" "C"
31567-31606 sent: calibration: "Calibration" "Cal" "C"
31606-31774 sent: calibration: "Calibration" "Cal" "C"
32395-32467 sent: calibration: "Calibration" "Cal" "C"
32467-32506 sent: calibration: "Calibration" "Cal" "C"
32506-32674 sent: calibration: "Calibration" "Cal" "C"
33295-33367 sent: calibration: "Calibration" "Cal" "C"
33367-33406 sent: calibration: "Calibration" "Cal" "C"
33406-33574 sent: calibration: "Calibration" "Cal" "C"
34195-34267 sent: calibration: "Calibration" "Cal" "C"
34267-34306 sent: calibration: "Calibration" "Cal" "C"
34306-34474 sent: calibration: "Calibration" "Cal" "C"
35096-35168 sent: calibration: "Calibration" "Cal" "C"
35168-35207 sent: calibration: "Calibration" "Cal" "C"
35207-35375 sent: calibration: "Calibration" "Cal" "C"
35996-36068 sent: calibration: "Calibration" "Cal" "C"
36068-36107 sent: calibration: "Calibration" "Cal" "C"
36107-36275 sent: calibration: "Calibration" "Cal" "C"
36896-36968 sent: calibration: "Calibration" "Cal" "C"
36968-37007 sent: calibration: "Calibration" "Cal" "C"
37007-37175 sent: calibration: "Calibration" "Cal" "C"
37796-37868 sent: calibration: "Calibration" "Cal" "C"
37868-37907 sent: calibration: "Calibration" "Cal" "C"
37907-38075 sent: calibration: "Calibration" "Cal" "C"
38696-38768 sent: calibration: "Calibration" "Cal" "C"
38768-38807 sent: calibration: "Calibration" "Cal" "C"
38807-38975 sent: calibration: "Calibration" "Cal" "C"
39596-39668 sent: calibration: "Calibration" "Cal" "C"
39668-39707 sent: calibration: "Calibration" "Cal" "C"
39707-39875 sent: calibration: "Calibration" "Cal" "C"
40496-40568 sent: calibration: "Calibration" "Cal" "C"
40568-40607 sent: calibration: "Calibration" "Cal" "C"
40607-40775 sent: calibration: "Calibration" "Cal" "C"
41396-41468 sent: calibration: "Calibration" "Cal" "C"
41468-41507 sent: calibration: "Calibration" "Cal" "C"
41507-41675 sent: calibration: "Calibration" "Cal" "C"
42297-42369 sent: calibration: "Calibration" "Cal" "C"
42369-42408 sent: calibration: "Calibration" "Cal" "C"
42408-42576 sent: calibration: "Calibration" "Cal" "C"
43197-43269 sent: calibration: "Calibration" "Cal" "C"
43269-43308 sent: calibration: "Calibration" "Cal" "C"
43308-43476 sent: calibration: "Calibration" "Cal" "C"
44097-44169 sent: calibration: "Calibration" "Cal" "C"
44169-44208 sent: calibration: "Calibration" "Cal" "C"
44208-44376 sent: calibration: "Calibration" "Cal" "C"
44997-45069 sent: calibration: "Calibration" "Cal" "C"
45069-45108 sent: calibration: "Calibration" "Cal" "C"
45108-45276 sent: calibration: "Calibration" "Cal" "C"
45897-45969 sent: calibration: "Calibration" "Cal" "C"
45969-46008 sent: calibration: "Calibration" "Cal" "C"
46008-46176 sent: calibration: "Calibration" "Cal" "C"
46797-46869 sent: calibration: "Calibration" "Cal" "C"
46869-46908 sent: calibration: "Calibration" "Cal" "C"
46908-47076 sent: calibration: "Calibration" "Cal" "C"
47697-47769 sent: calibration: "Calibration" "Cal" "C"
47769-47808 sent: calibration: "Calibration" "Cal" "C"
47808-47976 sent: calibration: "Calibration" "Cal" "C"
48597-48669 sent: calibration: "Calibration" "Cal" "C"
48669-48708 sent: calibration: "Calibration" "Cal" "C"
48708-48876 sent: calibration: "Calibration" "Cal" "C"
49497-49569 sent: calibration: "Calibration" "Cal" "C"
49569-49608 sent: calibration: "Calibration" "Cal" "C"
49608-49776 sent: calibration: "Calibration" "Cal" "C"
50398-50470 sent: calibration: "Calibration" "Cal" "C"
50470-50509 sent: calibration: "Calibration" "Cal" "C"
50509-50677 sent: calibration: "Calibration" "Cal" "C"
51298-51370 sent: calibration: "Calibration" "Cal" "C"
51370-51409 sent: calibration: "Calibration" "Cal" "C"
51409-51577 sent: calibration: "Calibration" "Cal" "C"
52198-52270 sent: calibration: "Calibration" "Cal" "C"
52270-52309 sent: calibration: "Calibration" "Cal" "C"
52309-52477 sent: calibration: "Calibration" "Cal" "C"
53098-53170 sent: calibration: "Calibration" "Cal" "C"
53170-53209 sent: calibration: "Calibration" "Cal" "C"
53209-53377 sent: calibration: "Calibration" "Cal" "C"
53998-54070 sent: calibration: "Calibration" "Cal" "C"
54070-54109 sent: calibration: "Calibration" "Cal" "C"
54109-54277 sent: calibration: "Calibration" "Cal" "C"
54898-54970 sent: calibration: "Calibration" "Cal" "C"
54970-55009 sent: calibration: "Calibration" "Cal" "C"
55009-55177 sent: calibration: "Calibration" "Cal" "C"
55798-55870 sent: calibration: "Calibration" "Cal" "C"
55870-55909 sent: calibration: "Calibration" "Cal" "C"
55909-56077 sent: calibration: "Calibration" "Cal" "C"
56698-56770 sent: calibration: "Calibration" "Cal" "C"
56770-56809 sent: calibration: "Calibration" "Cal" "C"
56809-56977 sent: calibration: "Calibration" "Cal" "C"
57599-57671 sent: calibration: "Calibration" "Cal" "C"
57671-57710 sent: calibration: "Calibration" "Cal" "C"
57710-57878 sent: calibration: "Calibration" "Cal" "C"
58499-58571 sent: calibration: "Calibration" "Cal" "C"
58571-58610 sent: calibration: "Calibration" "Cal" "C"
58610-58778 sent: calibration: "Calibration" "Cal" "C"
59399-59471 sent: calibration: "Calibration" "Cal" "C"
59471-59510 sent: calibration: "Calibration" "Cal" "C"
59510-59678 sent: calibration: "Calibration" "Cal" "C"
60299-60371 sent: calibration: "Calibration" "Cal" "C"
60371-60410 sent: calibration: "Calibration" "Cal" "C"
60410-60578 sent: calibration: "Calibration" "Cal" "C"
61199-61271 sent: calibration: "Calibration" "Cal" "C"
61271-61310 sent: calibration: "Calibration" "Cal" "C"
61310-61478 sent: calibration: "Calibration" "Cal" "C"
62099-62171 sent: calibration: "Calibration" "Cal" "C"
62171-62210 sent: calibration: "Calibration" "Cal" "C"
62210-62378 sent: calibration: "Calibration" "Cal" "C"
62999-63071 sent: calibration: "Calibration" "Cal" "C"
63071-63110 sent: calibration: "Calibration" "Cal" "C"
63110-63278 sent: calibration: "Calibration" "Cal" "C"
63899-63971 sent: calibration: "Calibration" "Cal" "C"
63971-64010 sent: calibration: "Calibration" "Cal" "C"
64010-64178 sent: calibration: "Calibration" "Cal" "C"
64799-64871 sent: calibration: "Calibration" "Cal" "C"
64871-64910 sent: calibration: "Calibration" "Cal" "C"
64910-65078 sent: calibration: "Calibration" "Cal" "C"
65700-65772 sent: calibration: "Calibration" "Cal" "C"
65772-65811 sent: calibration: "Calibration" "Cal" "C"
65811-65979 sent: calibration: "Calibration" "Cal" "C"
66600-66672 sent: calibration: "Calibration" "Cal" "C"
66672-66711 sent: calibration: "Calibration" "Cal" "C"
66711-66879 sent: calibration: "Calibration" "Cal" "C"
67500-67572 sent: calibration: "Calibration" "Cal" "C"
67572-67611 sent: calibration: "Calibration" "Cal" "C"
67611-67779 sent: calibration: "Calibration" "Cal" "C"
68400-68472 sent: calibration: "Calibration" "Cal" "C"
68472-68511 sent: calibration: "Calibration" "Cal" "C"
68511-68679 sent: calibration: "Calibration" "Cal" "C"
69300-69372 sent: calibration: "Calibration" "Cal" "C"
69372-69411 sent: calibration: "Calibration" "Cal" "C"
69411-69579 sent: calibration: "Calibration" "Cal" "C"
70200-70272 sent: calibration: "Calibration" "Cal" "C"
70272-70311 sent: calibration: "Calibration" "Cal" "C"
70311-70479 sent: calibration: "Calibration" "Cal" "C"
71100-71172 sent: calibration: "Calibration" "Cal" "C"
71172-71211 sent: calibration: "Calibration" "Cal" "C"
71211-71379 sent: calibration: "Calibration" "Cal" "C"
72000-72072 sent: calibration: "Calibration" "Cal" "C"
72072-72111 sent: calibration: "Calibration" "Cal" "C"
72111-72279 sent: calibration: "Calibration" "Cal" "C"
72900-72973 sent: calibration: "Calibration" "Cal" "C"
72973-73012 sent: calibration: "Calibration" "Cal" "C"
73012-73180 sent: calibration: "Calibration" "Cal" "C"
73801-73873 sent: calibration: "Calibration" "Cal" "C"
73873-73912 sent: calibration: "Calibration" "Cal" "C"
73912-74080 sent: calibration: "Calibration" "Cal" "C"
74701-74773 sent: calibration: "Calibration" "Cal" "C"
74773-74812 sent: calibration: "Calibration" "Cal" "C"
74812-74980 sent: calibration: "Calibration" "Cal" "C"
75601-75673 sent: calibration: "Calibration" "Cal" "C"
75673-75712 sent: calibration: "Calibration" "Cal" "C"
75712-75880 sent: calibration: "Calibration" "Cal" "C"
76501-76573 sent: calibration: "Calibration" "Cal" "C"
76573-76612 sent: calibration: "Calibration" "Cal" "C"
76612-76780 sent: calibration: "Calibration" "Cal" "C"
77401-77473 sent: calibration: "Calibration" "Cal" "C"
77473-77512 sent: calibration: "Calibration" "Cal" "C"
77512-77680 sent: calibration: "Calibration" "Cal" "C"
78301-78373 sent: calibration: "Calibration" "Cal" "C"
78373-78412 sent: calibration: "Calibration" "Cal" "C"
78412-78580 sent: calibration: "Calibration" "Cal" "C"
79201-79273 sent: calibration: "Calibration" "Cal" "C"
79273-79312 sent: calibration: "Calibration" "Cal" "C"
79312-79480 sent: calibration: "Calibration" "Cal" "C"
80101-80173 sent: calibration: "Calibration" "Cal" "C"
80173-80212 sent: calibration: "Calibration" "Cal" "C"
80212-80380 sent: calibration: "Calibration" "Cal" "C"
81002-81074 sent: calibration: "Calibration" "Cal" "C"
81074-81113 sent: calibration: "Calibration" "Cal" "C"
81113-81281 sent: calibration: "Calibration" "Cal" "C"
81902-81974 sent: calibration: "Calibration" "Cal" "C"
81974-82013 sent: calibration: "Calibration" "Cal" "C"
82013-82181 sent: calibration: "Calibration" "Cal" "C"
82802-82874 sent: calibration: "Calibration" "Cal" "C"
82874-82913 sent: calibration: "Calibration" "Cal" "C"
82913-83081 sent: calibration: "Calibration" "Cal" "C"
83702-83774 sent: calibration: "Calibration" "Cal" "C"
83774-83813 sent: calibration: "Calibration" "Cal" "C"
83813-83981 sent: calibration: "Calibration" "Cal" "C"
84602-84674 sent: calibration: "Calibration" "Cal" "C"
84674-84713 sent: calibration: "Calibration" "Cal" "C"
84713-84881 sent: calibration: "Calibration" "Cal" "C"
85502-85574 sent: calibration: "Calibration" "Cal" "C"
85574-85613 sent: calibration: "Calibration" "Cal" "C"
85613-85781 sent: calibration: "Calibration" "Cal" "C"
86402-86474 sent: calibration: "Calibration" "Cal" "C"
86474-86513 sent: calibration: "Calibration" "Cal" "C"
86513-86681 sent: calibration: "Calibration" "Cal" "C"
87302-87374 sent: calibration: "Calibration" "Cal" "C"
87374-87413 sent: calibration: "Calibration" "Cal" "C"
87413-87581 sent: calibration: "Calibration" "Cal" "C"
88202-88274 sent: calibration: "Calibration" "Cal" "C"
88274-88313 sent: calibration: "Calibration" "Cal" "C"
88313-88482 sent: calibration: "Calibration" "Cal" "C"
89103-89175 sent: calibration: "Calibration" "Cal" "C"
89175-89214 sent: calibration: "Calibration" "Cal" "C"
89214-89382 sent: calibration: "Calibration" "Cal" "C"
90003-90075 sent: calibration: "Calibration" "Cal" "C"
90075-90114 sent: calibration: "Calibration" "Cal" "C"
90114-90282 sent: calibration: "Calibration" "Cal" "C"
90903-90975 sent: calibration: "Calibration" "Cal" "C"
90975-91014 sent: calibration: "Calibration" "Cal" "C"
91014-91182 sent: calibration: "Calibration" "Cal" "C"
91803-91875 sent: calibration: "Calibration" "Cal" "C"
91875-91914 sent: calibration: "Calibration" "Cal" "C"
91914-92082 sent: calibration: "Calibration" "Cal" "C"
92703-92775 sent: calibration: "Calibration" "Cal" "C"
92775-92814 sent: calibration: "Calibration" "Cal" "C"
92814-92982 sent: calibration: "Calibration" "Cal" "C"
93603-93675 sent: calibration: "Calibration" "Cal" "C"
93675-93714 sent: calibration: "Calibration" "Cal" "C"
93714-93882 sent: calibration: "Calibration" "Cal" "C"
94503-94575 sent: calibration: "Calibration" "Cal" "C"
94575-94614 sent: calibration: "Calibration" "Cal" "C"
94614-94782 sent: calibration: "Calibration" "Cal" "C"
95403-95475 sent: calibration: "Calibration" "Cal" "C"
95475-95514 sent: calibration: "Calibration" "Cal" "C"
95514-95682 sent: calibration: "Calibration" "Cal" "C"
96304-96376 sent: calibration: "Calibration" "Cal" "C"
96376-96415 sent: calibration: "Calibration" "Cal" "C"
96415-96583 sent: calibration: "Calibration" "Cal" "C"
97204-97276 sent: calibration: "Calibration" "Cal" "C"
97276-97315 sent: calibration: "Calibration" "Cal" "C"
97315-97483 sent: calibration: "Calibration" "Cal" "C"
98104-98176 sent: calibration: "Calibration" "Cal" "C"
98176-98215 sent: calibration: "Calibration" "Cal" "C"
98215-98383 sent: calibration: "Calibration" "Cal" "C"
99004-99076 sent: calibration: "Calibration" "Cal" "C"
99076-99115 sent: calibration: "Calibration" "Cal" "C"
99115-99283 sent: calibration: "Calibration" "Cal" "C"
99904-99976 sent: calibration: "Calibration" "Cal" "C"
