703-937 sent: fast-channel2-value: "Channel 2: 3567 (0xDEF)" "Ch2: 3567 (0xDEF)" "Ch2: (0xDEF)"
1426-1660 sent: fast-channel2-value: "Channel 2: 3567 (0xDEF)" "Ch2: 3567 (0xDEF)" "Ch2: (0xDEF)"
2149-2383 sent: fast-channel2-value: "Channel 2: 3567 (0xDEF)" "Ch2: 3567 (0xDEF)" "Ch2: (0xDEF)"
2872-3106 sent: fast-channel2-value: "Channel 2: 3567 (0xDEF)" "Ch2: 3567 (0xDEF)" "Ch2: (0xDEF)"
3595-3829 sent: fast-channel2-value: "Channel 2: 3567 (0xDEF)" "Ch2: 3567 (0xDEF)" "Ch2: (0xDEF)"
4318-4552 sent: fast-channel2-value: "Channel 2: 3567 (0xDEF)" "Ch2: 3567 (0xDEF)" "Ch2: (0xDEF)"
5041-5275 sent: fast-channel2-value: "Channel 2: 3567 (0xDEF)" "Ch2: 3567 (0xDEF)" "Ch2: (0xDEF)"
5764-5998 sent: fast-channel2-value: "Channel 2: 3567 (0xDEF)" "Ch2: 3567 (0xDEF)" "Ch2: (0xDEF)"
6488-6722 sent: fast-channel2-value: "Channel 2: 3567 (0xDEF)" "Ch2: 3567 (0xDEF)" "Ch2: (0xDEF)"
7211-7445 sent: fast-channel2-value: "Channel 2: 3567 (0xDEF)" "Ch2: 3567 (0xDEF)" "Ch2: (0xDEF)"
7934-8168 sent: fast-channel2-value: "Channel 2: 3567 (0xDEF)" "Ch2: 3567 (0xDEF)" "Ch2: (0xDEF)"
8657-8891 sent: fast-channel2-value: "Channel 2: 3567 (0xDEF)" "Ch2: 3567 (0xDEF)" "Ch2: (0xDEF)"
9380-9614 sent: fast-channel2-value: "Channel 2: 3567 (0xDEF)" "Ch2: 3567 (0xDEF)" "Ch2: (0xDEF)"
10103-10337 sent: fast-channel2-value: "Channel 2: 3567 (0xDEF)" "Ch2: 3567 (0xDEF)" "Ch2: (0xDEF)"
10826-11060 sent: fast-channel2-value: "Channel 2: 3567 (0xDEF)" "Ch2: 3567 (0xDEF)" "Ch2: (0xDEF)"
11549-11783 sent: fast-channel2-value: "Channel 2: 3567 (0xDEF)" "Ch2: 3567 (0xDEF)" "Ch2: (0xDEF)"
12272-12506 sent: fast-channel2-value: "Channel 2: 3567 (0xDEF)" "Ch2: 3567 (0xDEF)" "Ch2: (0xDEF)"
12995-13229 sent: fast-channel2-value: "Channel 2: 3567 (0xDEF)" "Ch2: 3567 (0xDEF)" "Ch2: (0xDEF)"
13718-13953 sent: fast-channel2-value: "Channel 2: 3567 (0xDEF)" "Ch2: 3567 (0xDEF)" "Ch2: (0xDEF)"
14442-14676 sent: fast-channel2-value: "Channel 2: 3567 (0xDEF)" "Ch2: 3567 (0xDEF)" "Ch2: (0xDEF)"
15165-15399 sent: fast-channel2-value: "Channel 2: 3567 (0xDEF)" "Ch2: 3567 (0xDEF)" "Ch2: (0xDEF)"
15888-16122 sent: fast-channel2-value: "Channel 2: 3567 (0xDEF)" "Ch2: 3567 (0xDEF)" "Ch2: (0xDEF)"
16611-16845 sent: fast-channel2-value: "Channel 2: 3567 (0xDEF)" "Ch2: 3567 (0xDEF)" "Ch2: (0xDEF)"
17334-17568 sent: fast-channel2-value: "Channel 2: 3567 (0xDEF)" "Ch2: 3567 (0xDEF)" "Ch2: (0xDEF)"
18057-18291 sent: fast-channel2-value: "Channel 2: 3567 (0xDEF)" "Ch2: 3567 (0xDEF)" "Ch2: (0xDEF)"
18780-19014 sent: fast-channel2-value: "Channel 2: 3567 (0xDEF)" "Ch2: 3567 (0xDEF)" "Ch2: (0xDEF)"
19503-19737 sent: fast-channel2-value: "Channel 2: 3567 (0xDEF)" "Ch2: 3567 (0xDEF)" "Ch2: (0xDEF)"
20226-20460 sent: fast-channel2-value: "Channel 2: 3567 (0xDEF)" "Ch2: 3567 (0xDEF)" "Ch2: (0xDEF)"
20949-21183 sent: fast-channel2-value: "Channel 2: 3567 (0xDEF)" "Ch2: 3567 (0xDEF)" "Ch2: (0xDEF)"
21673-21907 sent: fast-channel2-value: "Channel 2: 3567 (0xDEF)" "Ch2: 3567 (0xDEF)" "Ch2: (0xDEF)"
22396-22630 sent: fast-channel2-value: "Channel 2: 3567 (0xDEF)" "Ch2: 3567 (0xDEF)" "Ch2: (0xDEF)"
23119-23353 sent: fast-channel2-value: "Channel 2: 3567 (0xDEF)" "Ch2: 3567 (0xDEF)" "Ch2: (0xDEF)"
23842-24076 sent: fast-channel2-value: "Channel 2: 3567 (0xDEF)" "Ch2: 3567 (0xDEF)" "Ch2: (0xDEF)"
24565-24799 sent: fast-channel2-value: "Channel 2: 3567 (0xDEF)" "Ch2: 3567 (0xDEF)" "Ch2: (0xDEF)"
25288-25522 sent: fast-channel2-value: "Channel 2: 3567 (0xDEF)" "Ch2: 3567 (0xDEF)" "Ch2: (0xDEF)"
26011-26245 sent: fast-channel2-value: "Channel 2: 3567 (0xDEF)" "Ch2: 3567 (0xDEF)" "Ch2: (0xDEF)"
26734-26968 sent: fast-channel2-value: "Channel 2: 3567 (0xDEF)" "Ch2: 3567 (0xDEF)" "Ch2: (0xDEF)"
27457-27691 sent: fast-channel2-value: "Channel 2: 3567 (0xDEF)" "Ch2: 3567 (0xDEF)" "Ch2: (0xDEF)"
28180-28414 sent: fast-channel2-value: "Channel 2: 3567 (0xDEF)" "Ch2: 3567 (0xDEF)" "Ch2: (0xDEF)"
28903-29137 sent: fast-channel2-value: "Channel 2: 3567 (0xDEF)" "Ch2: 3567 (0xDEF)" "Ch2: (0xDEF)"
29627-29861 sent: fast-channel2-value: "Channel 2: 3567 (0xDEF)" "Ch2: 3567 (0xDEF)" "Ch2: (0xDEF)"
30350-30584 sent: fast-channel2-value: "Channel 2: 3567 (0xDEF)" "Ch2: 3567 (0xDEF)" "Ch2: (0xDEF)"
31073-31307 sent: fast-channel2-value: "Channel 2: 3567 (0xDEF)" "Ch2: 3567 (0xDEF)" "Ch2: (0xDEF)"
31796-32030 sent: fast-channel2-value: "Channel 2: 3567 (0xDEF)" "Ch2: 3567 (0xDEF)" "Ch2: (0xDEF)"
32519-32753 sent: fast-channel2-value: "Channel 2: 3567 (0xDEF)" "Ch2: 3567 (0xDEF)" "Ch2: (0xDEF)"
33242-33476 sent: fast-channel2-value: "Channel 2: 3567 (0xDEF)" "Ch2: 3567 (0xDEF)" "Ch2: (0xDEF)"
33965-34199 sent: fast-channel2-value: "Channel 2: 3567 (0xDEF)" "Ch2: 3567 (0xDEF)" "Ch2: (0xDEF)"
34688-34922 sent: fast-channel2-value: "Channel 2: 3567 (0xDEF)" "Ch2: 3567 (0xDEF)" "Ch2: (0xDEF)"
35411-35645 sent: fast-channel2-value: "Channel 2: 3567 (0xDEF)" "Ch2: 3567 (0xDEF)" "Ch2: (0xDEF)"
36134-36368 sent: fast-channel2-value: "Channel 2: 3567 (0xDEF)" "Ch2: 3567 (0xDEF)" "Ch2: (0xDEF)"
36857-37092 sent: fast-channel2-value: "Channel 2: 3567 (0xDEF)" "Ch2: 3567 (0xDEF)" "Ch2: (0xDEF)"
37581-37815 sent: fast-channel2-value: "Channel 2: 3567 (0xDEF)" "Ch2: 3567 (0xDEF)" "Ch2: (0xDEF)"
38304-38538 sent: fast-channel2-value: "Channel 2: 3567 (0xDEF)" "Ch2: 3567 (0xDEF)" "Ch2: (0xDEF)"
39027-39261 sent: fast-channel2-value: "Channel 2: 3567 (0xDEF)" "Ch2: 3567 (0xDEF)" "Ch2: (0xDEF)"
39750-39984 sent: fast-channel2-value: "Channel 2: 3567 (0xDEF)" "Ch2: 3567 (0xDEF)" "Ch2: (0xDEF)"
40473-40707 sent: fast-channel2-value: "Channel 2: 3567 (0xDEF)" "Ch2: 3567 (0xDEF)" "Ch2: (0xDEF)"
41196-41430 sent: fast-channel2-value: "Channel 2: 3567 (0xDEF)" "Ch2: 3567 (0xDEF)" "Ch2: (0xDEF)"
41919-42153 sent: fast-channel2-value: "Channel 2: 3567 (0xDEF)" "Ch2: 3567 (0xDEF)" "Ch2: (0xDEF)"
42642-42876 sent: fast-channel2-value: "Channel 2: 3567 (0xDEF)" "Ch2: 3567 (0xDEF)" "Ch2: (0xDEF)"
43365-43599 sent: fast-channel2-value: "Channel 2: 3567 (0xDEF)" "Ch2: 3567 (0xDEF)" "Ch2: (0xDEF)"
44088-44322 sent: fast-channel2-value: "Channel 2: 3567 (0xDEF)" "Ch2: 3567 (0xDEF)" "Ch2: (0xDEF)"
44812-45046 sent: fast-channel2-value: "Channel 2: 3567 (0xDEF)" "Ch2: 3567 (0xDEF)" "Ch2: (0xDEF)"
45535-45769 sent: fast-channel2-value: "Channel 2: 3567 (0xDEF)" "Ch2: 3567 (0xDEF)" "Ch2: (0xDEF)"
46258-46492 sent: fast-channel2-value: "Channel 2: 3567 (0xDEF)" "Ch2: 3567 (0xDEF)" "Ch2: (0xDEF)"
46981-47215 sent: fast-channel2-value: "Channel 2: 3567 (0xDEF)" "Ch2: 3567 (0xDEF)" "Ch2: (0xDEF)"
47704-47938 sent: fast-channel2-value: "Channel 2: 3567 (0xDEF)" "Ch2: 3567 (0xDEF)" "Ch2: (0xDEF)"
48427-48661 sent: fast-channel2-value: "Channel 2: 3567 (0xDEF)" "Ch2: 3567 (0xDEF)" "Ch2: (0xDEF)"
49150-49384 sent: fast-channel2-value: "Channel 2: 3567 (0xDEF)" "Ch2: 3567 (0xDEF)" "Ch2: (0xDEF)"
49873-50107 sent: fast-channel2-value: "Channel 2: 3567 (0xDEF)" "Ch2: 3567 (0xDEF)" "Ch2: (0xDEF)"
50596-50830 sent: fast-channel2-value: "Channel 2: 3567 (0xDEF)" "Ch2: 3567 (0xDEF)" "Ch2: (0xDEF)"
51319-51553 sent: fast-channel2-value: "Channel 2: 3567 (0xDEF)" "Ch2: 3567 (0xDEF)" "Ch2: (0xDEF)"
52042-52276 sent: fast-channel2-value: "Channel 2: 3567 (0xDEF)" "Ch2: 3567 (0xDEF)" "Ch2: (0xDEF)"
52766-53000 sent: fast-channel2-value: "Channel 2: 3567 (0xDEF)" "Ch2: 3567 (0xDEF)" "Ch2: (0xDEF)"
53489-53723 sent: fast-channel2-value: "Channel 2: 3567 (0xDEF)" "Ch2: 3567 (0xDEF)" "Ch2: (0xDEF)"
54212-54446 sent: fast-channel2-value: "Channel 2: 3567 (0xDEF)" "Ch2: 3567 (0xDEF)" "Ch2: (0xDEF)"
54935-55169 sent: fast-channel2-value: "Channel 2: 3567 (0xDEF)" "Ch2: 3567 (0xDEF)" "Ch2: (0xDEF)"
55658-55892 sent: fast-channel2-value: "Channel 2: 3567 (0xDEF)" "Ch2: 3567 (0xDEF)" "Ch2: (0xDEF)"
56381-56615 sent: fast-channel2-value: "Channel 2: 3567 (0xDEF)" "Ch2: 3567 (0xDEF)" "Ch2: (0xDEF)"
57104-57338 sent: fast-channel2-value: "Channel 2: 3567 (0xDEF)" "Ch2: 3567 (0xDEF)" "Ch2: (0xDEF)"
57827-58061 sent: fast-channel2-value: "Channel 2: 3567 (0xDEF)" "Ch2: 3567 (0xDEF)" "Ch2: (0xDEF)"
58550-58784 sent: fast-channel2-value: "Channel 2: 3567 (0xDEF)" "Ch2: 3567 (0xDEF)" "Ch2: (0xDEF)"
59273-59507 sent: fast-channel2-value: "Channel 2: 3567 (0xDEF)" "Ch2: 3567 (0xDEF)" "Ch2: (0xDEF)"
59996-60231 sent: fast-channel2-value: "Channel 2: 3567 (0xDEF)" "Ch2: 3567 (0xDEF)" "Ch2: (0xDEF)"
60720-60954 sent: fast-channel2-value: "Channel 2: 3567 (0xDEF)" "Ch2: 3567 (0xDEF)" "Ch2: (0xDEF)"
61443-61677 sent: fast-channel2-value: "Channel 2: 3567 (0xDEF)" "Ch2: 3567 (0xDEF)" "Ch2: (0xDEF)"
62166-62400 sent: fast-channel2-value: "Channel 2: 3567 (0xDEF)" "Ch2: 3567 (0xDEF)" "Ch2: (0xDEF)"
62889-63123 sent: fast-channel2-value: "Channel 2: 3567 (0xDEF)" "Ch2: 3567 (0xDEF)" "Ch2: (0xDEF)"
63612-63846 sent: fast-channel2-value: "Channel 2: 3567 (0xDEF)" "Ch2: 3567 (0xDEF)" "Ch2: (0xDEF)"
64335-64569 sent: fast-channel2-value: "Channel 2: 3567 (0xDEF)" "Ch2: 3567 (0xDEF)" "Ch2: (0xDEF)"
65058-65292 sent: fast-channel2-value: "Channel 2: 3567 (0xDEF)" "Ch2: 3567 (0xDEF)" "Ch2: (0xDEF)"
65781-66015 sent: fast-channel2-value: "Channel 2: 3567 (0xDEF)" "Ch2: 3567 (0xDEF)" "Ch2: (0xDEF)"
66504-66738 sent: fast-channel2-value: "Channel 2: 3567 (0xDEF)" "Ch2: 3567 (0xDEF)" "Ch2: (0xDEF)"
67227-67461 sent: fast-channel2-value: "Channel 2: 3567 (0xDEF)" "Ch2: 3567 (0xDEF)" "Ch2: (0xDEF)"
67951-68185 sent: fast-channel2-value: "Channel 2: 3567 (0xDEF)" "Ch2: 3567 (0xDEF)" "Ch2: (0xDEF)"
68674-68908 sent: fast-channel2-value: "Channel 2: 3567 (0xDEF)" "Ch2: 3567 (0xDEF)" "Ch2: (0xDEF)"
69397-69631 sent: fast-channel2-value: "Channel 2: 3567 (0xDEF)" "Ch2: 3567 (0xDEF)" "Ch2: (0xDEF)"
70120-70354 sent: fast-channel2-value: "Channel 2: 3567 (0xDEF)" "Ch2: 3567 (0xDEF)" "Ch2: (0xDEF)"
70843-71077 sent: fast-channel2-value: "Channel 2: 3567 (0xDEF)" "Ch2: 3567 (0xDEF)" "Ch2: (0xDEF)"
71566-71800 sent: fast-channel2-value: "Channel 2: 3567 (0xDEF)" "Ch2: 3567 (0xDEF)" "Ch2: (0xDEF)"
72289-72523 sent: fast-channel2-value: "Channel 2: 3567 (0xDEF)" "Ch2: 3567 (0xDEF)" "Ch2: (0xDEF)"
73012-73246 sent: fast-channel2-value: "Channel 2: 3567 (0xDEF)" "Ch2: 3567 (0xDEF)" "Ch2: (0xDEF)"
73735-73969 sent: fast-channel2-value: "Channel 2: 3567 (0xDEF)" "Ch2: 3567 (0xDEF)" "Ch2: (0xDEF)"
74458-74692 sent: fast-channel2-value: "Channel 2: 3567 (0xDEF)" "Ch2: 3567 (0xDEF)" "Ch2: (0xDEF)"
75181-75415 sent: fast-channel2-value: "Channel 2: 3567 (0xDEF)" "Ch2: 3567 (0xDEF)" "Ch2: (0xDEF)"
75905-76139 sent: fast-channel2-value: "Channel 2: 3567 (0xDEF)" "Ch2: 3567 (0xDEF)" "Ch2: (0xDEF)"
76628-76862 sent: fast-channel2-value: "Channel 2: 3567 (0xDEF)" "Ch2: 3567 (0xDEF)" "Ch2: (0xDEF)"
77351-77585 sent: fast-channel2-value: "Channel 2: 3567 (0xDEF)" "Ch2: 3567 (0xDEF)" "Ch2: (0xDEF)"
78074-78308 sent: fast-channel2-value: "Channel 2: 3567 (0xDEF)" "Ch2: 3567 (0xDEF)" "Ch2: (0xDEF)"
78797-79031 sent: fast-channel2-value: "Channel 2: 3567 (0xDEF)" "Ch2: 3567 (0xDEF)" "Ch2: (0xDEF)"
79520-79754 sent: fast-channel2-value: "Channel 2: 3567 (0xDEF)" "Ch2: 3567 (0xDEF)" "Ch2: (0xDEF)"
80243-80477 sent: fast-channel2-value: "Channel 2: 3567 (0xDEF)" "Ch2: 3567 (0xDEF)" "Ch2: (0xDEF)"
80966-81200 sent: fast-channel2-value: "Channel 2: 3567 (0xDEF)" "Ch2: 3567 (0xDEF)" "Ch2: (0xDEF)"
81689-81923 sent: fast-channel2-value: "Channel 2: 3567 (0xDEF)" "Ch2: 3567 (0xDEF)" "Ch2: (0xDEF)"
82412-82646 sent: fast-channel2-value: "Channel 2: 3567 (0xDEF)" "Ch2: 3567 (0xDEF)" "Ch2: (0xDEF)"
83135-83370 sent: fast-channel2-value: "Channel 2: 3567 (0xDEF)" "Ch2: 3567 (0xDEF)" "Ch2: (0xDEF)"
83859-84093 sent: fast-channel2-value: "Channel 2: 3567 (0xDEF)" "Ch2: 3567 (0xDEF)" "Ch2: (0xDEF)"
84582-84816 sent: fast-channel2-value: "Channel 2: 3567 (0xDEF)" "Ch2: 3567 (0xDEF)" "Ch2: (0xDEF)"
85305-85539 sent: fast-channel2-value: "Channel 2: 3567 (0xDEF)" "Ch2: 3567 (0xDEF)" "Ch2: (0xDEF)"
86028-86262 sent: fast-channel2-value: "Channel 2: 3567 (0xDEF)" "Ch2: 3567 (0xDEF)" "Ch2: (0xDEF)"
86751-86985 sent: fast-channel2-value: "Channel 2: 3567 (0xDEF)" "Ch2: 3567 (0xDEF)" "Ch2: (0xDEF)"
87474-87708 sent: fast-channel2-value: "Channel 2: 3567 (0xDEF)" "Ch2: 3567 (0xDEF)" "Ch2: (0xDEF)"
88197-88431 sent: fast-channel2-value: "Channel 2: 3567 (0xDEF)" "Ch2: 3567 (0xDEF)" "Ch2: (0xDEF)"
88920-89154 sent: fast-channel2-value: "Channel 2: 3567 (0xDEF)" "Ch2: 3567 (0xDEF)" "Ch2: (0xDEF)"
89643-89877 sent: fast-channel2-value: "Channel 2: 3567 (0xDEF)" "Ch2: 3567 (0xDEF)" "Ch2: (0xDEF)"
90366-90600 sent: fast-channel2-value: "Channel 2: 3567 (0xDEF)" "Ch2: 3567 (0xDEF)" "Ch2: (0xDEF)"
91090-91324 sent: fast-channel2-value: "Channel 2: 3567 (0xDEF)" "Ch2: 3567 (0xDEF)" "Ch2: (0xDEF)"
91813-92047 sent: fast-channel2-value: "Channel 2: 3567 (0xDEF)" "Ch2: 3567 (0xDEF)" "Ch2: (0xDEF)"
92536-92770 sent: fast-channel2-value: "Channel 2: 3567 (0xDEF)" "Ch2: 3567 (0xDEF)" "Ch2: (0xDEF)"
93259-93493 sent: fast-channel2-value: "Channel 2: 3567 (0xDEF)" "Ch2: 3567 (0xDEF)" "Ch2: (0xDEF)"
93982-94216 sent: fast-channel2-value: "Channel 2: 3567 (0xDEF)" "Ch2: 3567 (0xDEF)" "Ch2: (0xDEF)"
94705-94939 sent: fast-channel2-value: "Channel 2: 3567 (0xDEF)" "Ch2: 3567 (0xDEF)" "Ch2: (0xDEF)"
95428-95662 sent: fast-channel2-value: "Channel 2: 3567 (0xDEF)" "Ch2: 3567 (0xDEF)" "Ch2: (0xDEF)"
96151-96385 sent: fast-channel2-value: "Channel 2: 3567 (0xDEF)" "Ch2: 3567 (0xDEF)" "Ch2: (0xDEF)"
96874-97108 sent: fast-channel2-value: "Channel 2: 3567 (0xDEF)" "Ch2: 3567 (0xDEF)" "Ch2: (0xDEF)"
97597-97831 sent: fast-channel2-value: "Channel 2: 3567 (0xDEF)" "Ch2: 3567 (0xDEF)" "Ch2: (0xDEF)"
98320-98555 sent: fast-channel2-value: "Channel 2: 3567 (0xDEF)" "Ch2: 3567 (0xDEF)" "Ch2: (0xDEF)"
99044-99278 sent: fast-channel2-value: "Channel 2: 3567 (0xDEF)" "Ch2: 3567 (0xDEF)" "Ch2: (0xDEF)"
