865-922 sent: crc: "CRC"
1441-1498 sent: crc: "CRC"
2017-2074 sent: crc: "CRC"
2593-2650 sent: crc: "CRC"
3169-3226 sent: crc: "CRC"
3745-3802 sent: crc: "CRC"
4321-4378 sent: crc: "CRC"
4897-4954 sent: crc: "CRC"
5473-5530 sent: crc: "CRC"
6049-6106 sent: crc: "CRC"
6625-6682 sent: crc: "CRC"
7201-7258 sent: crc: "CRC"
7778-7835 sent: crc: "CRC"
8354-8411 sent: crc: "CRC"
8930-8987 sent: crc: "CRC"
9506-9563 sent: crc: "CRC"
10082-10139 sent: crc: "CRC"
10658-10715 sent: crc: "CRC"
11234-11291 sent: crc: "CRC"
11810-11867 sent: crc: "CRC"
12386-12443 sent: crc: "CRC"
12962-13019 sent: crc: "CRC"
13538-13595 sent: crc: "CRC"
14114-14171 sent: crc: "CRC"
14690-14747 sent: crc: "CRC"
15267-15324 sent: crc: "CRC"
15843-15900 sent: crc: "CRC"
16419-16476 sent: crc: "CRC"
16995-17052 sent: crc: "CRC"
17571-17628 sent: crc: "CRC"
18147-18204 sent: crc: "CRC"
18723-18780 sent: crc: "CRC"
19299-19356 sent: crc: "CRC"
19875-19932 sent: crc: "CRC"
20451-20508 sent: crc: "CRC"
21027-21084 sent: crc: "CRC"
21603-21660 sent: crc: "CRC"
22179-22236 sent: crc: "CRC"
22755-22813 sent: crc: "CRC"
23332-23389 sent: crc: "CRC"
23908-23965 sent: crc: "CRC"
24484-24541 sent: crc: "CRC"
25060-25117 sent: crc: "CRC"
25636-25693 sent: crc: "CRC"
26212-26269 sent: crc: "CRC"
26788-26845 sent: crc: "CRC"
27364-27421 sent: crc: "CRC"
27940-27997 sent: crc: "CRC"
28516-28573 sent: crc: "CRC"
29092-29149 sent: crc: "CRC"
29668-29725 sent: crc: "CRC"
30244-30301 sent: crc: "CRC"
30821-30878 sent: crc: "CRC"
31397-31454 sent: crc: "CRC"
31973-32030 sent: crc: "CRC"
32549-32606 sent: crc: "CRC"
33125-33182 sent: crc: "CRC"
33701-33758 sent: crc: "CRC"
34277-34334 sent: crc: "CRC"
34853-34910 sent: crc: "CRC"
35429-35486 sent: crc: "CRC"
36005-36062 sent: crc: "CRC"
36581-36638 sent: crc: "CRC"
37157-37214 sent: crc: "CRC"
37733-37790 sent: crc: "CRC"
38310-38367 sent: crc: "CRC"
38886-38943 sent: crc: "CRC"
39462-39519 sent: crc: "CRC"
40038-40095 sent: crc: "CRC"
40614-40671 sent: crc: "CRC"
41190-41247 sent: crc: "CRC"
41766-41823 sent: crc: "CRC"
42342-42399 sent: crc: "CRC"
42918-42975 sent: crc: "CRC"
43494-43551 sent: crc: "CRC"
44070-44127 sent: crc: "CRC"
44646-44703 sent: crc: "CRC"
45222-45279 sent: crc: "CRC"
45798-45856 sent: crc: "CRC"
46375-46432 sent: crc: "CRC"
46951-47008 sent: crc: "CRC"
47527-47584 sent: crc: "CRC"
48103-48160 sent: crc: "CRC"
48679-48736 sent: crc: "CRC"
49255-49312 sent: crc: "CRC"
49831-49888 sent: crc: "CRC"
50407-50464 sent: crc: "CRC"
50983-51040 sent: crc: "CRC"
51559-51616 sent: crc: "CRC"
52135-52192 sent: crc: "CRC"
52711-52768 sent: crc: "CRC"
53287-53344 sent: crc: "CRC"
53864-53921 sent: crc: "CRC"
54440-54497 sent: crc: "CRC"
55016-55073 sent: crc: "CRC"
55592-55649 sent: crc: "CRC"
56168-56225 sent: crc: "CRC"
56744-56801 sent: crc: "CRC"
57320-57377 sent: crc: "CRC"
57896-57953 sent: crc: "CRC"
58472-58529 sent: crc: "CRC"
59048-59105 sent: crc: "CRC"
59624-59681 sent: crc: "CRC"
60200-60257 sent: crc: "CRC"
60776-60833 sent: crc: "CRC"
61352-61410 sent: crc: "CRC"
61929-61986 sent: crc: "CRC"
62505-62562 sent: crc: "CRC"
63081-63138 sent: crc: "CRC"
63657-63714 sent: crc: "CRC"
64233-64290 sent: crc: "CRC"
64809-64866 sent: crc: "CRC"
65385-65442 sent: crc: "CRC"
65961-66018 sent: crc: "CRC"
66537-66594 sent: crc: "CRC"
67113-67170 sent: crc: "CRC"
67689-67746 sent: crc: "CRC"
68265-68322 sent: crc: "CRC"
68841-68898 sent: crc: "CRC"
69418-69475 sent: crc: "CRC"
69994-70051 sent: crc: "CRC"
70570-70627 sent: crc: "CRC"
71146-71203 sent: crc: "CRC"
71722-71779 sent: crc: "CRC"
72298-72355 sent: crc: "CRC"
72874-72931 sent: crc: "CRC"
73450-73507 sent: crc: "CRC"
74026-74083 sent: crc: "CRC"
74602-74659 sent: crc: "CRC"
75178-75235 sent: crc: "CRC"
75754-75811 sent: crc: "CRC"
76330-76387 sent: crc: "CRC"
76907-76964 sent: crc: "CRC"
77483-77540 sent: crc: "CRC"
78059-78116 sent: crc: "CRC"
78635-78692 sent: crc: "CRC"
79211-79268 sent: crc: "CRC"
79787-79844 sent: crc: "CRC"
80363-80420 sent: crc: "CRC"
80939-80996 sent: crc: "CRC"
81515-81572 sent: crc: "CRC"
82091-82148 sent: crc: "CRC"
82667-82724 sent: crc: "CRC"
83243-83300 sent: crc: "CRC"
83819-83876 sent: crc: "CRC"
84395-84453 sent: crc: "CRC"
84972-85029 sent: crc: "CRC"
85548-85605 sent: crc: "CRC"
86124-86181 sent: crc: "CRC"
86700-86757 sent: crc: "CRC"
87276-87333 sent: crc: "CRC"
87852-87909 sent: crc: "CRC"
88428-88485 sent: crc: "CRC"
89004-89061 sent: crc: "CRC"
89580-89637 sent: crc: "CRC"
90156-90213 sent: crc: "CRC"
90732-90789 sent: crc: "CRC"
91308-91365 sent: crc: "CRC"
91884-91941 sent: crc: "CRC"
92461-92518 sent: crc: "CRC"
93037-93094 sent: crc: "CRC"
93613-93670 sent: crc: "CRC"
94189-94246 sent: crc: "CRC"
94765-94822 sent: crc: "CRC"
95341-95398 sent: crc: "CRC"
95917-95974 sent: crc: "CRC"
96493-96550 sent: crc: "CRC"
97069-97126 sent: crc: "CRC"
97645-97702 sent: crc: "CRC"
98221-98278 sent: crc: "CRC"
98797-98854 sent: crc: "CRC"
99373-99430 sent: crc: "CRC"
