326-362 sent: nibble: "0x0"
362-428 sent: nibble: "0xA"
428-497 sent: nibble: "0xB"
497-569 sent: nibble: "0xC"
569-650 sent: nibble: "0xF"
650-728 sent: nibble: "0xE"
728-803 sent: nibble: "0xD"
803-881 sent: nibble: "0xE"
3354-3390 sent: nibble: "0x0"
3390-3456 sent: nibble: "0xA"
3456-3525 sent: nibble: "0xB"
3525-3597 sent: nibble: "0xC"
3597-3678 sent: nibble: "0xF"
3678-3756 sent: nibble: "0xE"
3756-3831 sent: nibble: "0xD"
3831-3909 sent: nibble: "0xE"
6381-6417 sent: nibble: "0x0"
6417-6483 sent: nibble: "0xA"
6483-6552 sent: nibble: "0xB"
6552-6624 sent: nibble: "0xC"
6624-6705 sent: nibble: "0xF"
6705-6783 sent: nibble: "0xE"
6783-6858 sent: nibble: "0xD"
6858-6936 sent: nibble: "0xE"
9408-9444 sent: nibble: "0x0"
9444-9510 sent: nibble: "0xA"
9510-9579 sent: nibble: "0xB"
9579-9651 sent: nibble: "0xC"
9651-9732 sent: nibble: "0xF"
9732-9810 sent: nibble: "0xE"
9810-9885 sent: nibble: "0xD"
9885-9964 sent: nibble: "0xE"
12436-12472 sent: nibble: "0x0"
12472-12538 sent: nibble: "0xA"
12538-12607 sent: nibble: "0xB"
12607-12679 sent: nibble: "0xC"
12679-12760 sent: nibble: "0xF"
12760-12838 sent: nibble: "0xE"
12838-12913 sent: nibble: "0xD"
12913-12991 sent: nibble: "0xE"
15463-15499 sent: nibble: "0x0"
15499-15565 sent: nibble: "0xA"
15565-15634 sent: nibble: "0xB"
15634-15706 sent: nibble: "0xC"
15706-15787 sent: nibble: "0xF"
15787-15865 sent: nibble: "0xE"
15865-15940 sent: nibble: "0xD"
15940-16018 sent: nibble: "0xE"
18491-18527 sent: nibble: "0x0"
18527-18593 sent: nibble: "0xA"
18593-18662 sent: nibble: "0xB"
18662-18734 sent: nibble: "0xC"
18734-18815 sent: nibble: "0xF"
18815-18893 sent: nibble: "0xE"
18893-18968 sent: nibble: "0xD"
18968-19046 sent: nibble: "0xE"
21518-21554 sent: nibble: "0x0"
21554-21620 sent: nibble: "0xA"
21620-21689 sent: nibble: "0xB"
21689-21761 sent: nibble: "0xC"
21761-21842 sent: nibble: "0xF"
21842-21920 sent: nibble: "0xE"
21920-21995 sent: nibble: "0xD"
21995-22073 sent: nibble: "0xE"
24545-24581 sent: nibble: "0x0"
24581-24647 sent: nibble: "0xA"
24647-24716 sent: nibble: "0xB"
24716-24788 sent: nibble: "0xC"
24788-24869 sent: nibble: "0xF"
24869-24947 sent: nibble: "0xE"
24947-25022 sent: nibble: "0xD"
25022-25100 sent: nibble: "0xE"
27573-27609 sent: nibble: "0x0"
27609-27675 sent: nibble: "0xA"
27675-27744 sent: nibble: "0xB"
27744-27816 sent: nibble: "0xC"
27816-27897 sent: nibble: "0xF"
27897-27975 sent: nibble: "0xE"
27975-28050 sent: nibble: "0xD"
28050-28128 sent: nibble: "0xE"
30600-30636 sent: nibble: "0x0"
30636-30702 sent: nibble: "0xA"
30702-30771 sent: nibble: "0xB"
30771-30843 sent: nibble: "0xC"
30843-30924 sent: nibble: "0xF"
30924-31002 sent: nibble: "0xE"
31002-31077 sent: nibble: "0xD"
31077-31155 sent: nibble: "0xE"
33628-33664 sent: nibble: "0x0"
33664-33730 sent: nibble: "0xA"
33730-33799 sent: nibble: "0xB"
33799-33871 sent: nibble: "0xC"
33871-33952 sent: nibble: "0xF"
33952-34030 sent: nibble: "0xE"
34030-34105 sent: nibble: "0xD"
34105-34183 sent: nibble: "0xE"
36655-36691 sent: nibble: "0x0"
36691-36757 sent: nibble: "0xA"
36757-36826 sent: nibble: "0xB"
36826-36898 sent: nibble: "0xC"
36898-36979 sent: nibble: "0xF"
36979-37057 sent: nibble: "0xE"
37057-37132 sent: nibble: "0xD"
37132-37210 sent: nibble: "0xE"
39682-39718 sent: nibble: "0x0"
39718-39784 sent: nibble: "0xA"
39784-39853 sent: nibble: "0xB"
39853-39925 sent: nibble: "0xC"
39925-40006 sent: nibble: "0xF"
40006-40084 sent: nibble: "0xE"
40084-40159 sent: nibble: "0xD"
40159-40237 sent: nibble: "0xE"
42710-42746 sent: nibble: "0x0"
42746-42812 sent: nibble: "0xA"
42812-42881 sent: nibble: "0xB"
42881-42953 sent: nibble: "0xC"
42953-43034 sent: nibble: "0xF"
43034-43112 sent: nibble: "0xE"
43112-43187 sent: nibble: "0xD"
43187-43265 sent: nibble: "0xE"
45737-45773 sent: nibble: "0x0"
45773-45839 sent: nibble: "0xA"
45839-45908 sent: nibble: "0xB"
45908-45980 sent: nibble: "0xC"
45980-46061 sent: nibble: "0xF"
46061-46139 sent: nibble: "0xE"
46139-46214 sent: nibble: "0xD"
46214-46292 sent: nibble: "0xE"
48765-48801 sent: nibble: "0x0"
48801-48867 sent: nibble: "0xA"
48867-48936 sent: nibble: "0xB"
48936-49008 sent: nibble: "0xC"
49008-49089 sent: nibble: "0xF"
49089-49167 sent: nibble: "0xE"
49167-49242 sent: nibble: "0xD"
49242-49320 sent: nibble: "0xE"
51792-51828 sent: nibble: "0x0"
51828-51894 sent: nibble: "0xA"
51894-51963 sent: nibble: "0xB"
51963-52035 sent: nibble: "0xC"
52035-52116 sent: nibble: "0xF"
52116-52194 sent: nibble: "0xE"
52194-52269 sent: nibble: "0xD"
52269-52347 sent: nibble: "0xE"
54819-54855 sent: nibble: "0x0"
54855-54921 sent: nibble: "0xA"
54921-54990 sent: nibble: "0xB"
54990-55062 sent: nibble: "0xC"
55062-55143 sent: nibble: "0xF"
55143-55221 sent: nibble: "0xE"
55221-55296 sent: nibble: "0xD"
55296-55374 sent: nibble: "0xE"
57847-57883 sent: nibble: "0x0"
57883-57949 sent: nibble: "0xA"
57949-58018 sent: nibble: "0xB"
58018-58090 sent: nibble: "0xC"
58090-58171 sent: nibble: "0xF"
58171-58249 sent: nibble: "0xE"
58249-58324 sent: nibble: "0xD"
58324-58402 sent: nibble: "0xE"
60874-60910 sent: nibble: "0x0"
60910-60976 sent: nibble: "0xA"
60976-61045 sent: nibble: "0xB"
61045-61117 sent: nibble: "0xC"
61117-61198 sent: nibble: "0xF"
61198-61276 sent: nibble: "0xE"
61276-61351 sent: nibble: "0xD"
61351-61429 sent: nibble: "0xE"
63902-63937 sent: nibble: "0x0"
63937-64004 sent: nibble: "0xA"
64004-64073 sent: nibble: "0xB"
64073-64145 sent: nibble: "0xC"
64145-64226 sent: nibble: "0xF"
64226-64304 sent: nibble: "0xE"
64304-64379 sent: nibble: "0xD"
64379-64457 sent: nibble: "0xE"
66929-66965 sent: nibble: "0x0"
66965-67031 sent: nibble: "0xA"
67031-67100 sent: nibble: "0xB"
67100-67172 sent: nibble: "0xC"
67172-67253 sent: nibble: "0xF"
67253-67331 sent: nibble: "0xE"
67331-67406 sent: nibble: "0xD"
67406-67484 sent: nibble: "0xE"
69956-69992 sent: nibble: "0x0"
69992-70058 sent: nibble: "0xA"
70058-70127 sent: nibble: "0xB"
70127-70199 sent: nibble: "0xC"
70199-70280 sent: nibble: "0xF"
70280-70358 sent: nibble: "0xE"
70358-70433 sent: nibble: "0xD"
70433-70511 sent: nibble: "0xE"
72984-73020 sent: nibble: "0x0"
73020-73086 sent: nibble: "0xA"
73086-73155 sent: nibble: "0xB"
73155-73227 sent: nibble: "0xC"
73227-73308 sent: nibble: "0xF"
73308-73386 sent: nibble: "0xE"
73386-73461 sent: nibble: "0xD"
73461-73539 sent: nibble: "0xE"
76011-76047 sent: nibble: "0x0"
76047-76113 sent: nibble: "0xA"
76113-76182 sent: nibble: "0xB"
76182-76254 sent: nibble: "0xC"
76254-76335 sent: nibble: "0xF"
76335-76413 sent: nibble: "0xE"
76413-76488 sent: nibble: "0xD"
76488-76566 sent: nibble: "0xE"
79038-79074 sent: nibble: "0x0"
79074-79140 sent: nibble: "0xA"
79140-79209 sent: nibble: "0xB"
79209-79281 sent: nibble: "0xC"
79281-79363 sent: nibble: "0xF"
79363-79441 sent: nibble: "0xE"
79441-79516 sent: nibble: "0xD"
79516-79594 sent: nibble: "0xE"
82066-82102 sent: nibble: "0x0"
82102-82168 sent: nibble: "0xA"
82168-82237 sent: nibble: "0xB"
82237-82309 sent: nibble: "0xC"
82309-82390 sent: nibble: "0xF"
82390-82468 sent: nibble: "0xE"
82468-82543 sent: nibble: "0xD"
82543-82621 sent: nibble: "0xE"
85093-85129 sent: nibble: "0x0"
85129-85195 sent: nibble: "0xA"
85195-85264 sent: nibble: "0xB"
85264-85336 sent: nibble: "0xC"
85336-85417 sent: nibble: "0xF"
85417-85495 sent: nibble: "0xE"
85495-85570 sent: nibble: "0xD"
85570-85648 sent: nibble: "0xE"
88121-88157 sent: nibble: "0x0"
88157-88223 sent: nibble: "0xA"
88223-88292 sent: nibble: "0xB"
88292-88364 sent: nibble: "0xC"
88364-88445 sent: nibble: "0xF"
88445-88523 sent: nibble: "0xE"
88523-88598 sent: nibble: "0xD"
88598-88676 sent: nibble: "0xE"
91148-91184 sent: nibble: "0x0"
91184-91250 sent: nibble: "0xA"
91250-91319 sent: nibble: "0xB"
91319-91391 sent: nibble: "0xC"
91391-91472 sent: nibble: "0xF"
91472-91550 sent: nibble: "0xE"
91550-91625 sent: nibble: "0xD"
91625-91703 sent: nibble: "0xE"
94175-94211 sent: nibble: "0x0"
94211-94277 sent: nibble: "0xA"
94277-94346 sent: nibble: "0xB"
94346-94418 sent: nibble: "0xC"
94418-94499 sent: nibble: "0xF"
94499-94577 sent: nibble: "0xE"
94577-94652 sent: nibble: "0xD"
94652-94730 sent: nibble: "0xE"
97203-97239 sent: nibble: "0x0"
97239-97305 sent: nibble: "0xA"
97305-97374 sent: nibble: "0xB"
97374-97446 sent: nibble: "0xC"
97446-97527 sent: nibble: "0xF"
97527-97605 sent: nibble: "0xE"
97605-97680 sent: nibble: "0xD"
97680-97758 sent: nibble: "0xE"
