446-596 sent: fast-channel1-value: "Channel 1: 1319 (0x527)" "Ch1: 1319 (0x527)" "Ch1: (0x527)"
1388-1538 sent: fast-channel1-value: "Channel 1: 1319 (0x527)" "Ch1: 1319 (0x527)" "Ch1: (0x527)"
2330-2480 sent: fast-channel1-value: "Channel 1: 1319 (0x527)" "Ch1: 1319 (0x527)" "Ch1: (0x527)"
3272-3422 sent: fast-channel1-value: "Channel 1: 1319 (0x527)" "Ch1: 1319 (0x527)" "Ch1: (0x527)"
4214-4364 sent: fast-channel1-value: "Channel 1: 1319 (0x527)" "Ch1: 1319 (0x527)" "Ch1: (0x527)"
5156-5307 sent: fast-channel1-value: "Channel 1: 1319 (0x527)" "Ch1: 1319 (0x527)" "Ch1: (0x527)"
6099-6249 sent: fast-channel1-value: "Channel 1: 1319 (0x527)" "Ch1: 1319 (0x527)" "Ch1: (0x527)"
7041-7191 sent: fast-channel1-value: "Channel 1: 1319 (0x527)" "Ch1: 1319 (0x527)" "Ch1: (0x527)"
7983-8133 sent: fast-channel1-value: "Channel 1: 1319 (0x527)" "Ch1: 1319 (0x527)" "Ch1: (0x527)"
8925-9075 sent: fast-channel1-value: "Channel 1: 1319 (0x527)" "Ch1: 1319 (0x527)" "Ch1: (0x527)"
9867-10017 sent: fast-channel1-value: "Channel 1: 1319 (0x527)" "Ch1: 1319 (0x527)" "Ch1: (0x527)"
10809-10959 sent: fast-channel1-value: "Channel 1: 1319 (0x527)" "Ch1: 1319 (0x527)" "Ch1: (0x527)"
11751-11901 sent: fast-channel1-value: "Channel 1: 1319 (0x527)" "Ch1: 1319 (0x527)" "Ch1: (0x527)"
12693-12843 sent: fast-channel1-value: "Channel 1: 1319 (0x527)" "Ch1: 1319 (0x527)" "Ch1: (0x527)"
13636-13786 sent: fast-channel1-value: "Channel 1: 1319 (0x527)" "Ch1: 1319 (0x527)" "Ch1: (0x527)"
14578-14728 sent: fast-channel1-value: "Channel 1: 1319 (0x527)" "Ch1: 1319 (0x527)" "Ch1: (0x527)"
15520-15670 sent: fast-channel1-value: "Channel 1: 1319 (0x527)" "Ch1: 1319 (0x527)" "Ch1: (0x527)"
16462-16612 sent: fast-channel1-value: "Channel 1: 1319 (0x527)" "Ch1: 1319 (0x527)" "Ch1: (0x527)"
17404-17554 sent: fast-channel1-value: "Channel 1: 1319 (0x527)" "Ch1: 1319 (0x527)" "Ch1: (0x527)"
18346-18496 sent: fast-channel1-value: "Channel 1: 1319 (0x527)" "Ch1: 1319 (0x527)" "Ch1: (0x527)"
19288-19438 sent: fast-channel1-value: "Channel 1: 1319 (0x527)" "Ch1: 1319 (0x527)" "Ch1: (0x527)"
20230-20380 sent: fast-channel1-value: "Channel 1: 1319 (0x527)" "Ch1: 1319 (0x527)" "Ch1: (0x527)"
21173-21323 sent: fast-channel1-value: "Channel 1: 1319 (0x527)" "Ch1: 1319 (0x527)" "Ch1: (0x527)"
22115-22265 sent: fast-channel1-value: "Channel 1: 1319 (0x527)" "Ch1: 1319 (0x527)" "Ch1: (0x527)"
23057-23207 sent: fast-channel1-value: "Channel 1: 1319 (0x527)" "Ch1: 1319 (0x527)" "Ch1: (0x527)"
23999-24149 sent: fast-channel1-value: "Channel 1: 1319 (0x527)" "Ch1: 1319 (0x527)" "Ch1: (0x527)"
24941-25091 sent: fast-channel1-value: "Channel 1: 1319 (0x527)" "Ch1: 1319 (0x527)" "Ch1: (0x527)"
25883-26033 sent: fast-channel1-value: "Channel 1: 1319 (0x527)" "Ch1: 1319 (0x527)" "Ch1: (0x527)"
26825-26975 sent: fast-channel1-value: "Channel 1: 1319 (0x527)" "Ch1: 1319 (0x527)" "Ch1: (0x527)"
27767-27917 sent: fast-channel1-value: "Channel 1: 1319 (0x527)" "Ch1: 1319 (0x527)" "Ch1: (0x527)"
28710-28860 sent: fast-channel1-value: "Channel 1: 1319 (0x527)" "Ch1: 1319 (0x527)" "Ch1: (0x527)"
29652-29802 sent: fast-channel1-value: "Channel 1: 1319 (0x527)" "Ch1: 1319 (0x527)" "Ch1: (0x527)"
30594-30744 sent: fast-channel1-value: "Channel 1: 1319 (0x527)" "Ch1: 1319 (0x527)" "Ch1: (0x527)"
31536-31686 sent: fast-channel1-value: "Channel 1: 1319 (0x527)" "Ch1: 1319 (0x527)" "Ch1: (0x527)"
32478-32628 sent: fast-channel1-value: "Channel 1: 1319 (0x527)" "Ch1: 1319 (0x527)" "Ch1: (0x527)"
33420-33570 sent: fast-channel1-value: "Channel 1: 1319 (0x527)" "Ch1: 1319 (0x527)" "Ch1: (0x527)"
34362-34512 sent: fast-channel1-value: "Channel 1: 1319 (0x527)" "Ch1: 1319 (0x527)" "Ch1: (0x527)"
35304-35454 sent: fast-channel1-value: "Channel 1: 1319 (0x527)" "Ch1: 1319 (0x527)" "Ch1: (0x527)"
36247-36397 sent: fast-channel1-value: "Channel 1: 1319 (0x527)" "Ch1: 1319 (0x527)" "Ch1: (0x527)"
37189-37339 sent: fast-channel1-value: "Channel 1: 1319 (0x527)" "Ch1: 1319 (0x527)" "Ch1: (0x527)"
38131-38281 sent: fast-channel1-value: "Channel 1: 1319 (0x527)" "Ch1: 1319 (0x527)" "Ch1: (0x527)"
39073-39223 sent: fast-channel1-value: "Channel 1: 1319 (0x527)" "Ch1: 1319 (0x527)" "Ch1: (0x527)"
40015-40165 sent: fast-channel1-value: "Channel 1: 1319 (0x527)" "Ch1: 1319 (0x527)" "Ch1: (0x527)"
40957-41107 sent: fast-channel1-value: "Channel 1: 1319 (0x527)" "Ch1: 1319 (0x527)" "Ch1: (0x527)"
41899-42049 sent: fast-channel1-value: "Channel 1: 1319 (0x527)" "Ch1: 1319 (0x527)" "Ch1: (0x527)"
42841-42991 sent: fast-channel1-value: "Channel 1: 1319 (0x527)" "Ch1: 1319 (0x527)" "Ch1: (0x527)"
43784-43934 sent: fast-channel1-value: "Channel 1: 1319 (0x527)" "Ch1: 1319 (0x527)" "Ch1: (0x527)"
44726-44876 sent: fast-channel1-value: "Channel 1: 1319 (0x527)" "Ch1: 1319 (0x527)" "Ch1: (0x527)"
45668-45818 sent: fast-channel1-value: "Channel 1: 1319 (0x527)" "Ch1: 1319 (0x527)" "Ch1: (0x527)"
46610-46760 sent: fast-channel1-value: "Channel 1: 1319 (0x527)" "Ch1: 1319 (0x527)" "Ch1: (0x527)"
47552-47702 sent: fast-channel1-value: "Channel 1: 1319 (0x527)" "Ch1: 1319 (0x527)" "Ch1: (0x527)"
48494-48644 sent: fast-channel1-value: "Channel 1: 1319 (0x527)" "Ch1: 1319 (0x527)" "Ch1: (0x527)"
49436-49586 sent: fast-channel1-value: "Channel 1: 1319 (0x527)" "Ch1: 1319 (0x527)" "Ch1: (0x527)"
50378-50528 sent: fast-channel1-value: "Channel 1: 1319 (0x527)" "Ch1: 1319 (0x527)" "Ch1: (0x527)"
51320-51471 sent: fast-channel1-value: "Channel 1: 1319 (0x527)" "Ch1: 1319 (0x527)" "Ch1: (0x527)"
52263-52413 sent: fast-channel1-value: "Channel 1: 1319 (0x527)" "Ch1: 1319 (0x527)" "Ch1: (0x527)"
53205-53355 sent: fast-channel1-value: "Channel 1: 1319 (0x527)" "Ch1: 1319 (0x527)" "Ch1: (0x527)"
54147-54297 sent: fast-channel1-value: "Channel 1: 1319 (0x527)" "Ch1: 1319 (0x527)" "Ch1: (0x527)"
55089-55239 sent: fast-channel1-value: "Channel 1: 1319 (0x527)" "Ch1: 1319 (0x527)" "Ch1: (0x527)"
56031-56181 sent: fast-channel1-value: "Channel 1: 1319 (0x527)" "Ch1: 1319 (0x527)" "Ch1: (0x527)"
56973-57123 sent: fast-channel1-value: "Channel 1: 1319 (0x527)" "Ch1: 1319 (0x527)" "Ch1: (0x527)"
57915-58065 sent: fast-channel1-value: "Channel 1: 1319 (0x527)" "Ch1: 1319 (0x527)" "Ch1: (0x527)"
58857-59008 sent: fast-channel1-value: "Channel 1: 1319 (0x527)" "Ch1: 1319 (0x527)" "Ch1: (0x527)"
59800-59950 sent: fast-channel1-value: "Channel 1: 1319 (0x527)" "Ch1: 1319 (0x527)" "Ch1: (0x527)"
60742-60892 sent: fast-channel1-value: "Channel 1: 1319 (0x527)" "Ch1: 1319 (0x527)" "Ch1: (0x527)"
61684-61834 sent: fast-channel1-value: "Channel 1: 1319 (0x527)" "Ch1: 1319 (0x527)" "Ch1: (0x527)"
62626-62776 sent: fast-channel1-value: "Channel 1: 1319 (0x527)" "Ch1: 1319 (0x527)" "Ch1: (0x527)"
63568-63718 sent: fast-channel1-value: "Channel 1: 1319 (0x527)" "Ch1: 1319 (0x527)" "Ch1: (0x527)"
64510-64660 sent: fast-channel1-value: "Channel 1: 1319 (0x527)" "Ch1: 1319 (0x527)" "Ch1: (0x527)"
65452-65602 sent: fast-channel1-value: "Channel 1: 1319 (0x527)" "Ch1: 1319 (0x527)" "Ch1: (0x527)"
66394-66544 sent: fast-channel1-value: "Channel 1: 1319 (0x527)" "Ch1: 1319 (0x527)" "Ch1: (0x527)"
67337-67487 sent: fast-channel1-value: "Channel 1: 1319 (0x527)" "Ch1: 1319 (0x527)" "Ch1: (0x527)"
68279-68429 sent: fast-channel1-value: "Channel 1: 1319 (0x527)" "Ch1: 1319 (0x527)" "Ch1: (0x527)"
69221-69371 sent: fast-channel1-value: "Channel 1: 1319 (0x527)" "Ch1: 1319 (0x527)" "Ch1: (0x527)"
70163-70313 sent: fast-channel1-value: "Channel 1: 1319 (0x527)" "Ch1: 1319 (0x527)" "Ch1: (0x527)"
71105-71255 sent: fast-channel1-value: "Channel 1: 1319 (0x527)" "Ch1: 1319 (0x527)" "Ch1: (0x527)"
72047-72197 sent: fast-channel1-value: "Channel 1: 1319 (0x527)" "Ch1: 1319 (0x527)" "Ch1: (0x527)"
72989-73139 sent: fast-channel1-value: "Channel 1: 1319 (0x527)" "Ch1: 1319 (0x527)" "Ch1: (0x527)"
73931-74081 sent: fast-channel1-value: "Channel 1: 1319 (0x527)" "Ch1: 1319 (0x527)" "Ch1: (0x527)"
74874-75024 sent: fast-channel1-value: "Channel 1: 1319 (0x527)" "Ch1: 1319 (0x527)" "Ch1: (0x527)"
75816-75966 sent: fast-channel1-value: "Channel 1: 1319 (0x527)" "Ch1: 1319 (0x527)" "Ch1: (0x527)"
76758-76908 sent: fast-channel1-value: "Channel 1: 1319 (0x527)" "Ch1: 1319 (0x527)" "Ch1: (0x527)"
77700-77850 sent: fast-channel1-value: "Channel 1: 1319 (0x527)" "Ch1: 1319 (0x527)" "Ch1: (0x527)"
78642-78792 sent: fast-channel1-value: "Channel 1: 1319 (0x527)" "Ch1: 1319 (0x527)" "Ch1: (0x527)"
79584-79734 sent: fast-channel1-value: "Channel 1: 1319 (0x527)" "Ch1: 1319 (0x527)" "Ch1: (0x527)"
80526-80676 sent: fast-channel1-value: "Channel 1: 1319 (0x527)" "Ch1: 1319 (0x527)" "Ch1: (0x527)"
81468-81618 sent: fast-channel1-value: "Channel 1: 1319 (0x527)" "Ch1: 1319 (0x527)" "Ch1: (0x527)"
82411-82561 sent: fast-channel1-value: "Channel 1: 1319 (0x527)" "Ch1: 1319 (0x527)" "Ch1: (0x527)"
83353-83503 sent: fast-channel1-value: "Channel 1: 1319 (0x527)" "Ch1: 1319 (0x527)" "Ch1: (0x527)"
84295-84445 sent: fast-channel1-value: "Channel 1: 1319 (0x527)" "Ch1: 1319 (0x527)" "Ch1: (0x527)"
85237-85387 sent: fast-channel1-value: "Channel 1: 1319 (0x527)" "Ch1: 1319 (0x527)" "Ch1: (0x527)"
86179-86329 sent: fast-channel1-value: "Channel 1: 1319 (0x527)" "Ch1: 1319 (0x527)" "Ch1: (0x527)"
87121-87271 sent: fast-channel1-value: "Channel 1: 1319 (0x527)" "Ch1: 1319 (0x527)" "Ch1: (0x527)"
88063-88213 sent: fast-channel1-value: "Channel 1: 1319 (0x527)" "Ch1: 1319 (0x527)" "Ch1: (0x527)"
89005-89155 sent: fast-channel1-value: "Channel 1: 1319 (0x527)" "Ch1: 1319 (0x527)" "Ch1: (0x527)"
89948-90098 sent: fast-channel1-value: "Channel 1: 1319 (0x527)" "Ch1: 1319 (0x527)" "Ch1: (0x527)"
90890-91040 sent: fast-channel1-value: "Channel 1: 1319 (0x527)" "Ch1: 1319 (0x527)" "Ch1: (0x527)"
91832-91982 sent: fast-channel1-value: "Channel 1: 1319 (0x527)" "Ch1: 1319 (0x527)" "Ch1: (0x527)"
92774-92924 sent: fast-channel1-value: "Channel 1: 1319 (0x527)" "Ch1: 1319 (0x527)" "Ch1: (0x527)"
93716-93866 sent: fast-channel1-value: "Channel 1: 1319 (0x527)" "Ch1: 1319 (0x527)" "Ch1: (0x527)"
94658-94808 sent: fast-channel1-value: "Channel 1: 1319 (0x527)" "Ch1: 1319 (0x527)" "Ch1: (0x527)"
95600-95750 sent: fast-channel1-value: "Channel 1: 1319 (0x527)" "Ch1: 1319 (0x527)" "Ch1: (0x527)"
96542-96692 sent: fast-channel1-value: "Channel 1: 1319 (0x527)" "Ch1: 1319 (0x527)" "Ch1: (0x527)"
97485-97635 sent: fast-channel1-value: "Channel 1: 1319 (0x527)" "Ch1: 1319 (0x527)" "Ch1: (0x527)"
98427-98577 sent: fast-channel1-value: "Channel 1: 1319 (0x527)" "Ch1: 1319 (0x527)" "Ch1: (0x527)"
99369-99519 sent: fast-channel1-value: "Channel 1: 1319 (0x527)" "Ch1: 1319 (0x527)" "Ch1: (0x527)"
