700-871 sent: fast-channel2-value: "Channel 2: 1971 (0x7B3)" "Ch2: 1971 (0x7B3)" "Ch2: (0x7B3)"
1339-1510 sent: fast-channel2-value: "Channel 2: 1971 (0x7B3)" "Ch2: 1971 (0x7B3)" "Ch2: (0x7B3)"
1979-2150 sent: fast-channel2-value: "Channel 2: 1971 (0x7B3)" "Ch2: 1971 (0x7B3)" "Ch2: (0x7B3)"
2618-2789 sent: fast-channel2-value: "Channel 2: 1971 (0x7B3)" "Ch2: 1971 (0x7B3)" "Ch2: (0x7B3)"
3257-3428 sent: fast-channel2-value: "Channel 2: 1971 (0x7B3)" "Ch2: 1971 (0x7B3)" "Ch2: (0x7B3)"
3896-4067 sent: fast-channel2-value: "Channel 2: 1971 (0x7B3)" "Ch2: 1971 (0x7B3)" "Ch2: (0x7B3)"
4535-4706 sent: fast-channel2-value: "Channel 2: 1971 (0x7B3)" "Ch2: 1971 (0x7B3)" "Ch2: (0x7B3)"
5174-5345 sent: fast-channel2-value: "Channel 2: 1971 (0x7B3)" "Ch2: 1971 (0x7B3)" "Ch2: (0x7B3)"
5813-5984 sent: fast-channel2-value: "Channel 2: 1971 (0x7B3)" "Ch2: 1971 (0x7B3)" "Ch2: (0x7B3)"
6452-6623 sent: fast-channel2-value: "Channel 2: 1971 (0x7B3)" "Ch2: 1971 (0x7B3)" "Ch2: (0x7B3)"
7091-7262 sent: fast-channel2-value: "Channel 2: 1971 (0x7B3)" "Ch2: 1971 (0x7B3)" "Ch2: (0x7B3)"
7730-7901 sent: fast-channel2-value: "Channel 2: 1971 (0x7B3)" "Ch2: 1971 (0x7B3)" "Ch2: (0x7B3)"
8369-8540 sent: fast-channel2-value: "Channel 2: 1971 (0x7B3)" "Ch2: 1971 (0x7B3)" "Ch2: (0x7B3)"
9008-9179 sent: fast-channel2-value: "Channel 2: 1971 (0x7B3)" "Ch2: 1971 (0x7B3)" "Ch2: (0x7B3)"
9648-9819 sent: fast-channel2-value: "Channel 2: 1971 (0x7B3)" "Ch2: 1971 (0x7B3)" "Ch2: (0x7B3)"
10287-10458 sent: fast-channel2-value: "Channel 2: 1971 (0x7B3)" "Ch2: 1971 (0x7B3)" "Ch2: (0x7B3)"
10926-11097 sent: fast-channel2-value: "Channel 2: 1971 (0x7B3)" "Ch2: 1971 (0x7B3)" "Ch2: (0x7B3)"
11565-11736 sent: fast-channel2-value: "Channel 2: 1971 (0x7B3)" "Ch2: 1971 (0x7B3)" "Ch2: (0x7B3)"
12204-12375 sent: fast-channel2-value: "Channel 2: 1971 (0x7B3)" "Ch2: 1971 (0x7B3)" "Ch2: (0x7B3)"
12843-13014 sent: fast-channel2-value: "Channel 2: 1971 (0x7B3)" "Ch2: 1971 (0x7B3)" "Ch2: (0x7B3)"
13482-13653 sent: fast-channel2-value: "Channel 2: 1971 (0x7B3)" "Ch2: 1971 (0x7B3)" "Ch2: (0x7B3)"
14121-14292 sent: fast-channel2-value: "Channel 2: 1971 (0x7B3)" "Ch2: 1971 (0x7B3)" "Ch2: (0x7B3)"
14760-14931 sent: fast-channel2-value: "Channel 2: 1971 (0x7B3)" "Ch2: 1971 (0x7B3)" "Ch2: (0x7B3)"
15399-15570 sent: fast-channel2-value: "Channel 2: 1971 (0x7B3)" "Ch2: 1971 (0x7B3)" "Ch2: (0x7B3)"
16038-16209 sent: fast-channel2-value: "Channel 2: 1971 (0x7B3)" "Ch2: 1971 (0x7B3)" "Ch2: (0x7B3)"
16677-16848 sent: fast-channel2-value: "Channel 2: 1971 (0x7B3)" "Ch2: 1971 (0x7B3)" "Ch2: (0x7B3)"
17317-17488 sent: fast-channel2-value: "Channel 2: 1971 (0x7B3)" "Ch2: 1971 (0x7B3)" "Ch2: (0x7B3)"
17956-18127 sent: fast-channel2-value: "Channel 2: 1971 (0x7B3)" "Ch2: 1971 (0x7B3)" "Ch2: (0x7B3)"
18595-18766 sent: fast-channel2-value: "Channel 2: 1971 (0x7B3)" "Ch2: 1971 (0x7B3)" "Ch2: (0x7B3)"
19234-19405 sent: fast-channel2-value: "Channel 2: 1971 (0x7B3)" "Ch2: 1971 (0x7B3)" "Ch2: (0x7B3)"
19873-20044 sent: fast-channel2-value: "Channel 2: 1971 (0x7B3)" "Ch2: 1971 (0x7B3)" "Ch2: (0x7B3)"
20512-20683 sent: fast-channel2-value: "Channel 2: 1971 (0x7B3)" "Ch2: 1971 (0x7B3)" "Ch2: (0x7B3)"
21151-21322 sent: fast-channel2-value: "Channel 2: 1971 (0x7B3)" "Ch2: 1971 (0x7B3)" "Ch2: (0x7B3)"
21790-21961 sent: fast-channel2-value: "Channel 2: 1971 (0x7B3)" "Ch2: 1971 (0x7B3)" "Ch2: (0x7B3)"
22429-22600 sent: fast-channel2-value: "Channel 2: 1971 (0x7B3)" "Ch2: 1971 (0x7B3)" "Ch2: (0x7B3)"
23068-23239 sent: fast-channel2-value: "Channel 2: 1971 (0x7B3)" "Ch2: 1971 (0x7B3)" "Ch2: (0x7B3)"
23707-23878 sent: fast-channel2-value: "Channel 2: 1971 (0x7B3)" "Ch2: 1971 (0x7B3)" "Ch2: (0x7B3)"
24346-24517 sent: fast-channel2-value: "Channel 2: 1971 (0x7B3)" "Ch2: 1971 (0x7B3)" "Ch2: (0x7B3)"
24986-25157 sent: fast-channel2-value: "Channel 2: 1971 (0x7B3)" "Ch2: 1971 (0x7B3)" "Ch2: (0x7B3)"
25625-25796 sent: fast-channel2-value: "Channel 2: 1971 (0x7B3)" "Ch2: 1971 (0x7B3)" "Ch2: (0x7B3)"
26264-26435 sent: fast-channel2-value: "Channel 2: 1971 (0x7B3)" "Ch2: 1971 (0x7B3)" "Ch2: (0x7B3)"
26903-27074 sent: fast-channel2-value: "Channel 2: 1971 (0x7B3)" "Ch2: 1971 (0x7B3)" "Ch2: (0x7B3)"
27542-27713 sent: fast-channel2-value: "Channel 2: 1971 (0x7B3)" "Ch2: 1971 (0x7B3)" "Ch2: (0x7B3)"
28181-28352 sent: fast-channel2-value: "Channel 2: 1971 (0x7B3)" "Ch2: 1971 (0x7B3)" "Ch2: (0x7B3)"
28820-28991 sent: fast-channel2-value: "Channel 2: 1971 (0x7B3)" "Ch2: 1971 (0x7B3)" "Ch2: (0x7B3)"
29459-29630 sent: fast-channel2-value: "Channel 2: 1971 (0x7B3)" "Ch2: 1971 (0x7B3)" "Ch2: (0x7B3)"
30098-30269 sent: fast-channel2-value: "Channel 2: 1971 (0x7B3)" "Ch2: 1971 (0x7B3)" "Ch2: (0x7B3)"
30737-30908 sent: fast-channel2-value: "Channel 2: 1971 (0x7B3)" "Ch2: 1971 (0x7B3)" "Ch2: (0x7B3)"
31376-31547 sent: fast-channel2-value: "Channel 2: 1971 (0x7B3)" "Ch2: 1971 (0x7B3)" "Ch2: (0x7B3)"
32015-32186 sent: fast-channel2-value: "Channel 2: 1971 (0x7B3)" "Ch2: 1971 (0x7B3)" "Ch2: (0x7B3)"
32655-32826 sent: fast-channel2-value: "Channel 2: 1971 (0x7B3)" "Ch2: 1971 (0x7B3)" "Ch2: (0x7B3)"
33294-33465 sent: fast-channel2-value: "Channel 2: 1971 (0x7B3)" "Ch2: 1971 (0x7B3)" "Ch2: (0x7B3)"
33933-34104 sent: fast-channel2-value: "Channel 2: 1971 (0x7B3)" "Ch2: 1971 (0x7B3)" "Ch2: (0x7B3)"
34572-34743 sent: fast-channel2-value: "Channel 2: 1971 (0x7B3)" "Ch2: 1971 (0x7B3)" "Ch2: (0x7B3)"
35211-35382 sent: fast-channel2-value: "Channel 2: 1971 (0x7B3)" "Ch2: 1971 (0x7B3)" "Ch2: (0x7B3)"
35850-36021 sent: fast-channel2-value: "Channel 2: 1971 (0x7B3)" "Ch2: 1971 (0x7B3)" "Ch2: (0x7B3)"
36489-36660 sent: fast-channel2-value: "Channel 2: 1971 (0x7B3)" "Ch2: 1971 (0x7B3)" "Ch2: (0x7B3)"
37128-37299 sent: fast-channel2-value: "Channel 2: 1971 (0x7B3)" "Ch2: 1971 (0x7B3)" "Ch2: (0x7B3)"
37767-37938 sent: fast-channel2-value: "Channel 2: 1971 (0x7B3)" "Ch2: 1971 (0x7B3)" "Ch2: (0x7B3)"
38406-38577 sent: fast-channel2-value: "Channel 2: 1971 (0x7B3)" "Ch2: 1971 (0x7B3)" "Ch2: (0x7B3)"
39045-39216 sent: fast-channel2-value: "Channel 2: 1971 (0x7B3)" "Ch2: 1971 (0x7B3)" "Ch2: (0x7B3)"
39684-39855 sent: fast-channel2-value: "Channel 2: 1971 (0x7B3)" "Ch2: 1971 (0x7B3)" "Ch2: (0x7B3)"
40324-40495 sent: fast-channel2-value: "Channel 2: 1971 (0x7B3)" "Ch2: 1971 (0x7B3)" "Ch2: (0x7B3)"
40963-41134 sent: fast-channel2-value: "Channel 2: 1971 (0x7B3)" "Ch2: 1971 (0x7B3)" "Ch2: (0x7B3)"
41602-41773 sent: fast-channel2-value: "Channel 2: 1971 (0x7B3)" "Ch2: 1971 (0x7B3)" "Ch2: (0x7B3)"
42241-42412 sent: fast-channel2-value: "Channel 2: 1971 (0x7B3)" "Ch2: 1971 (0x7B3)" "Ch2: (0x7B3)"
42880-43051 sent: fast-channel2-value: "Channel 2: 1971 (0x7B3)" "Ch2: 1971 (0x7B3)" "Ch2: (0x7B3)"
43519-43690 sent: fast-channel2-value: "Channel 2: 1971 (0x7B3)" "Ch2: 1971 (0x7B3)" "Ch2: (0x7B3)"
44158-44329 sent: fast-channel2-value: "Channel 2: 1971 (0x7B3)" "Ch2: 1971 (0x7B3)" "Ch2: (0x7B3)"
44797-44968 sent: fast-channel2-value: "Channel 2: 1971 (0x7B3)" "Ch2: 1971 (0x7B3)" "Ch2: (0x7B3)"
45436-45607 sent: fast-channel2-value: "Channel 2: 1971 (0x7B3)" "Ch2: 1971 (0x7B3)" "Ch2: (0x7B3)"
46075-46246 sent: fast-channel2-value: "Channel 2: 1971 (0x7B3)" "Ch2: 1971 (0x7B3)" "Ch2: (0x7B3)"
46714-46885 sent: fast-channel2-value: "Channel 2: 1971 (0x7B3)" "Ch2: 1971 (0x7B3)" "Ch2: (0x7B3)"
47353-47524 sent: fast-channel2-value: "Channel 2: 1971 (0x7B3)" "Ch2: 1971 (0x7B3)" "Ch2: (0x7B3)"
47993-48164 sent: fast-channel2-value: "Channel 2: 1971 (0x7B3)" "Ch2: 1971 (0x7B3)" "Ch2: (0x7B3)"
48632-48803 sent: fast-channel2-value: "Channel 2: 1971 (0x7B3)" "Ch2: 1971 (0x7B3)" "Ch2: (0x7B3)"
49271-49442 sent: fast-channel2-value: "Channel 2: 1971 (0x7B3)" "Ch2: 1971 (0x7B3)" "Ch2: (0x7B3)"
49910-50081 sent: fast-channel2-value: "Channel 2: 1971 (0x7B3)" "Ch2: 1971 (0x7B3)" "Ch2: (0x7B3)"
50549-50720 sent: fast-channel2-value: "Channel 2: 1971 (0x7B3)" "Ch2: 1971 (0x7B3)" "Ch2: (0x7B3)"
51188-51359 sent: fast-channel2-value: "Channel 2: 1971 (0x7B3)" "Ch2: 1971 (0x7B3)" "Ch2: (0x7B3)"
51827-51998 sent: fast-channel2-value: "Channel 2: 1971 (0x7B3)" "Ch2: 1971 (0x7B3)" "Ch2: (0x7B3)"
52466-52637 sent: fast-channel2-value: "Channel 2: 1971 (0x7B3)" "Ch2: 1971 (0x7B3)" "Ch2: (0x7B3)"
53105-53276 sent: fast-channel2-value: "Channel 2: 1971 (0x7B3)" "Ch2: 1971 (0x7B3)" "Ch2: (0x7B3)"
53744-53915 sent: fast-channel2-value: "Channel 2: 1971 (0x7B3)" "Ch2: 1971 (0x7B3)" "Ch2: (0x7B3)"
54383-54554 sent: fast-channel2-value: "Channel 2: 1971 (0x7B3)" "Ch2: 1971 (0x7B3)" "Ch2: (0x7B3)"
55022-55193 sent: fast-channel2-value: "Channel 2: 1971 (0x7B3)" "Ch2: 1971 (0x7B3)" "Ch2: (0x7B3)"
55662-55833 sent: fast-channel2-value: "Channel 2: 1971 (0x7B3)" "Ch2: 1971 (0x7B3)" "Ch2: (0x7B3)"
56301-56472 sent: fast-channel2-value: "Channel 2: 1971 (0x7B3)" "Ch2: 1971 (0x7B3)" "Ch2: (0x7B3)"
56940-57111 sent: fast-channel2-value: "Channel 2: 1971 (0x7B3)" "Ch2: 1971 (0x7B3)" "Ch2: (0x7B3)"
57579-57750 sent: fast-channel2-value: "Channel 2: 1971 (0x7B3)" "Ch2: 1971 (0x7B3)" "Ch2: (0x7B3)"
58218-58389 sent: fast-channel2-value: "Channel 2: 1971 (0x7B3)" "Ch2: 1971 (0x7B3)" "Ch2: (0x7B3)"
58857-59028 sent: fast-channel2-value: "Channel 2: 1971 (0x7B3)" "Ch2: 1971 (0x7B3)" "Ch2: (0x7B3)"
59496-59667 sent: fast-channel2-value: "Channel 2: 1971 (0x7B3)" "Ch2: 1971 (0x7B3)" "Ch2: (0x7B3)"
60135-60306 sent: fast-channel2-value: "Channel 2: 1971 (0x7B3)" "Ch2: 1971 (0x7B3)" "Ch2: (0x7B3)"
60774-60945 sent: fast-channel2-value: "Channel 2: 1971 (0x7B3)" "Ch2: 1971 (0x7B3)" "Ch2: (0x7B3)"
61413-61584 sent: fast-channel2-value: "Channel 2: 1971 (0x7B3)" "Ch2: 1971 (0x7B3)" "Ch2: (0x7B3)"
62052-62223 sent: fast-channel2-value: "Channel 2: 1971 (0x7B3)" "Ch2: 1971 (0x7B3)" "Ch2: (0x7B3)"
62691-62862 sent: fast-channel2-value: "Channel 2: 1971 (0x7B3)" "Ch2: 1971 (0x7B3)" "Ch2: (0x7B3)"
63331-63502 sent: fast-channel2-value: "Channel 2: 1971 (0x7B3)" "Ch2: 1971 (0x7B3)" "Ch2: (0x7B3)"
63970-64141 sent: fast-channel2-value: "Channel 2: 1971 (0x7B3)" "Ch2: 1971 (0x7B3)" "Ch2: (0x7B3)"
64609-64780 sent: fast-channel2-value: "Channel 2: 1971 (0x7B3)" "Ch2: 1971 (0x7B3)" "Ch2: (0x7B3)"
65248-65419 sent: fast-channel2-value: "Channel 2: 1971 (0x7B3)" "Ch2: 1971 (0x7B3)" "Ch2: (0x7B3)"
65887-66058 sent: fast-channel2-value: "Channel 2: 1971 (0x7B3)" "Ch2: 1971 (0x7B3)" "Ch2: (0x7B3)"
66526-66697 sent: fast-channel2-value: "Channel 2: 1971 (0x7B3)" "Ch2: 1971 (0x7B3)" "Ch2: (0x7B3)"
67165-67336 sent: fast-channel2-value: "Channel 2: 1971 (0x7B3)" "Ch2: 1971 (0x7B3)" "Ch2: (0x7B3)"
67804-67975 sent: fast-channel2-value: "Channel 2: 1971 (0x7B3)" "Ch2: 1971 (0x7B3)" "Ch2: (0x7B3)"
68443-68614 sent: fast-channel2-value: "Channel 2: 1971 (0x7B3)" "Ch2: 1971 (0x7B3)" "Ch2: (0x7B3)"
69082-69253 sent: fast-channel2-value: "Channel 2: 1971 (0x7B3)" "Ch2: 1971 (0x7B3)" "Ch2: (0x7B3)"
69721-69892 sent: fast-channel2-value: "Channel 2: 1971 (0x7B3)" "Ch2: 1971 (0x7B3)" "Ch2: (0x7B3)"
70360-70531 sent: fast-channel2-value: "Channel 2: 1971 (0x7B3)" "Ch2: 1971 (0x7B3)" "Ch2: (0x7B3)"
71000-71171 sent: fast-channel2-value: "Channel 2: 1971 (0x7B3)" "Ch2: 1971 (0x7B3)" "Ch2: (0x7B3)"
71639-71810 sent: fast-channel2-value: "Channel 2: 1971 (0x7B3)" "Ch2: 1971 (0x7B3)" "Ch2: (0x7B3)"
72278-72449 sent: fast-channel2-value: "Channel 2: 1971 (0x7B3)" "Ch2: 1971 (0x7B3)" "Ch2: (0x7B3)"
72917-73088 sent: fast-channel2-value: "Channel 2: 1971 (0x7B3)" "Ch2: 1971 (0x7B3)" "Ch2: (0x7B3)"
73556-73727 sent: fast-channel2-value: "Channel 2: 1971 (0x7B3)" "Ch2: 1971 (0x7B3)" "Ch2: (0x7B3)"
74195-74366 sent: fast-channel2-value: "Channel 2: 1971 (0x7B3)" "Ch2: 1971 (0x7B3)" "Ch2: (0x7B3)"
74834-75005 sent: fast-channel2-value: "Channel 2: 1971 (0x7B3)" "Ch2: 1971 (0x7B3)" "Ch2: (0x7B3)"
75473-75644 sent: fast-channel2-value: "Channel 2: 1971 (0x7B3)" "Ch2: 1971 (0x7B3)" "Ch2: (0x7B3)"
76112-76283 sent: fast-channel2-value: "Channel 2: 1971 (0x7B3)" "Ch2: 1971 (0x7B3)" "Ch2: (0x7B3)"
76751-76922 sent: fast-channel2-value: "Channel 2: 1971 (0x7B3)" "Ch2: 1971 (0x7B3)" "Ch2: (0x7B3)"
77390-77561 sent: fast-channel2-value: "Channel 2: 1971 (0x7B3)" "Ch2: 1971 (0x7B3)" "Ch2: (0x7B3)"
78029-78200 sent: fast-channel2-value: "Channel 2: 1971 (0x7B3)" "Ch2: 1971 (0x7B3)" "Ch2: (0x7B3)"
78668-78840 sent: fast-channel2-value: "Channel 2: 1971 (0x7B3)" "Ch2: 1971 (0x7B3)" "Ch2: (0x7B3)"
79308-79479 sent: fast-channel2-value: "Channel 2: 1971 (0x7B3)" "Ch2: 1971 (0x7B3)" "Ch2: (0x7B3)"
79947-80118 sent: fast-channel2-value: "Channel 2: 1971 (0x7B3)" "Ch2: 1971 (0x7B3)" "Ch2: (0x7B3)"
80586-80757 sent: fast-channel2-value: "Channel 2: 1971 (0x7B3)" "Ch2: 1971 (0x7B3)" "Ch2: (0x7B3)"
81225-81396 sent: fast-channel2-value: "Channel 2: 1971 (0x7B3)" "Ch2: 1971 (0x7B3)" "Ch2: (0x7B3)"
81864-82035 sent: fast-channel2-value: "Channel 2: 1971 (0x7B3)" "Ch2: 1971 (0x7B3)" "Ch2: (0x7B3)"
82503-82674 sent: fast-channel2-value: "Channel 2: 1971 (0x7B3)" "Ch2: 1971 (0x7B3)" "Ch2: (0x7B3)"
83142-83313 sent: fast-channel2-value: "Channel 2: 1971 (0x7B3)" "Ch2: 1971 (0x7B3)" "Ch2: (0x7B3)"
83781-83952 sent: fast-channel2-value: "Channel 2: 1971 (0x7B3)" "Ch2: 1971 (0x7B3)" "Ch2: (0x7B3)"
84420-84591 sent: fast-channel2-value: "Channel 2: 1971 (0x7B3)" "Ch2: 1971 (0x7B3)" "Ch2: (0x7B3)"
85059-85230 sent: fast-channel2-value: "Channel 2: 1971 (0x7B3)" "Ch2: 1971 (0x7B3)" "Ch2: (0x7B3)"
85698-85869 sent: fast-channel2-value: "Channel 2: 1971 (0x7B3)" "Ch2: 1971 (0x7B3)" "Ch2: (0x7B3)"
86337-86509 sent: fast-channel2-value: "Channel 2: 1971 (0x7B3)" "Ch2: 1971 (0x7B3)" "Ch2: (0x7B3)"
86977-87148 sent: fast-channel2-value: "Channel 2: 1971 (0x7B3)" "Ch2: 1971 (0x7B3)" "Ch2: (0x7B3)"
87616-87787 sent: fast-channel2-value: "Channel 2: 1971 (0x7B3)" "Ch2: 1971 (0x7B3)" "Ch2: (0x7B3)"
88255-88426 sent: fast-channel2-value: "Channel 2: 1971 (0x7B3)" "Ch2: 1971 (0x7B3)" "Ch2: (0x7B3)"
88894-89065 sent: fast-channel2-value: "Channel 2: 1971 (0x7B3)" "Ch2: 1971 (0x7B3)" "Ch2: (0x7B3)"
89533-89704 sent: fast-channel2-value: "Channel 2: 1971 (0x7B3)" "Ch2: 1971 (0x7B3)" "Ch2: (0x7B3)"
90172-90343 sent: fast-channel2-value: "Channel 2: 1971 (0x7B3)" "Ch2: 1971 (0x7B3)" "Ch2: (0x7B3)"
90811-90982 sent: fast-channel2-value: "Channel 2: 1971 (0x7B3)" "Ch2: 1971 (0x7B3)" "Ch2: (0x7B3)"
91450-91621 sent: fast-channel2-value: "Channel 2: 1971 (0x7B3)" "Ch2: 1971 (0x7B3)" "Ch2: (0x7B3)"
92089-92260 sent: fast-channel2-value: "Channel 2: 1971 (0x7B3)" "Ch2: 1971 (0x7B3)" "Ch2: (0x7B3)"
92728-92899 sent: fast-channel2-value: "Channel 2: 1971 (0x7B3)" "Ch2: 1971 (0x7B3)" "Ch2: (0x7B3)"
93367-93538 sent: fast-channel2-value: "Channel 2: 1971 (0x7B3)" "Ch2: 1971 (0x7B3)" "Ch2: (0x7B3)"
94006-94178 sent: fast-channel2-value: "Channel 2: 1971 (0x7B3)" "Ch2: 1971 (0x7B3)" "Ch2: (0x7B3)"
94646-94817 sent: fast-channel2-value: "Channel 2: 1971 (0x7B3)" "Ch2: 1971 (0x7B3)" "Ch2: (0x7B3)"
95285-95456 sent: fast-channel2-value: "Channel 2: 1971 (0x7B3)" "Ch2: 1971 (0x7B3)" "Ch2: (0x7B3)"
95924-96095 sent: fast-channel2-value: "Channel 2: 1971 (0x7B3)" "Ch2: 1971 (0x7B3)" "Ch2: (0x7B3)"
96563-96734 sent: fast-channel2-value: "Channel 2: 1971 (0x7B3)" "Ch2: 1971 (0x7B3)" "Ch2: (0x7B3)"
97202-97373 sent: fast-channel2-value: "Channel 2: 1971 (0x7B3)" "Ch2: 1971 (0x7B3)" "Ch2: (0x7B3)"
97841-98012 sent: fast-channel2-value: "Channel 2: 1971 (0x7B3)" "Ch2: 1971 (0x7B3)" "Ch2: (0x7B3)"
98480-98651 sent: fast-channel2-value: "Channel 2: 1971 (0x7B3)" "Ch2: 1971 (0x7B3)" "Ch2: (0x7B3)"
99119-99290 sent: fast-channel2-value: "Channel 2: 1971 (0x7B3)" "Ch2: 1971 (0x7B3)" "Ch2: (0x7B3)"
99758-99929 sent: fast-channel2-value: "Channel 2: 1971 (0x7B3)" "Ch2: 1971 (0x7B3)" "Ch2: (0x7B3)"
