514-550 sent: status: "Status" "S"
1090-1126 sent: status: "Status" "S"
1666-1702 sent: status: "Status" "S"
2242-2278 sent: status: "Status" "S"
2818-2854 sent: status: "Status" "S"
3394-3430 sent: status: "Status" "S"
3970-4006 sent: status: "Status" "S"
4546-4582 sent: status: "Status" "S"
5122-5158 sent: status: "Status" "S"
5698-5734 sent: status: "Status" "S"
6274-6310 sent: status: "Status" "S"
6850-6886 sent: status: "Status" "S"
7426-7462 sent: status: "Status" "S"
8003-8039 sent: status: "Status" "S"
8579-8615 sent: status: "Status" "S"
9155-9191 sent: status: "Status" "S"
9731-9767 sent: status: "Status" "S"
10307-10343 sent: status: "Status" "S"
10883-10919 sent: status: "Status" "S"
11459-11495 sent: status: "Status" "S"
12035-12071 sent: status: "Status" "S"
12611-12647 sent: status: "Status" "S"
13187-13223 sent: status: "Status" "S"
13763-13799 sent: status: "Status" "S"
14339-14375 sent: status: "Status" "S"
14915-14951 sent: status: "Status" "S"
15492-15528 sent: status: "Status" "S"
16068-16104 sent: status: "Status" "S"
16644-16680 sent: status: "Status" "S"
17220-17256 sent: status: "Status" "S"
17796-17832 sent: status: "Status" "S"
18372-18408 sent: status: "Status" "S"
18948-18984 sent: status: "Status" "S"
19524-19560 sent: status: "Status" "S"
20100-20136 sent: status: "Status" "S"
20676-20712 sent: status: "Status" "S"
21252-21288 sent: status: "Status" "S"
21828-21864 sent: status: "Status" "S"
22404-22440 sent: status: "Status" "S"
22981-23017 sent: status: "Status" "S"
23557-23593 sent: status: "Status" "S"
24133-24169 sent: status: "Status" "S"
24709-24745 sent: status: "Status" "S"
25285-25321 sent: status: "Status" "S"
25861-25897 sent: status: "Status" "S"
26437-26473 sent: status: "Status" "S"
27013-27049 sent: status: "Status" "S"
27589-27625 sent: status: "Status" "S"
28165-28201 sent: status: "Status" "S"
28741-28777 sent: status: "Status" "S"
29317-29353 sent: status: "Status" "S"
29893-29929 sent: status: "Status" "S"
30469-30505 sent: status: "Status" "S"
31046-31082 sent: status: "Status" "S"
31622-31658 sent: status: "Status" "S"
32198-32234 sent: status: "Status" "S"
32774-32810 sent: status: "Status" "S"
33350-33386 sent: status: "Status" "S"
33926-33962 sent: status: "Status" "S"
34502-34538 sent: status: "Status" "S"
35078-35114 sent: status: "Status" "S"
35654-35690 sent: status: "Status" "S"
36230-36266 sent: status: "Status" "S"
36806-36842 sent: status: "Status" "S"
37382-37418 sent: status: "Status" "S"
37958-37994 sent: status: "Status" "S"
38535-38571 sent: status: "Status" "S"
39111-39147 sent: status: "Status" "S"
39687-39723 sent: status: "Status" "S"
40263-40299 sent: status: "Status" "S"
40839-40875 sent: status: "Status" "S"
41415-41451 sent: status: "Status" "S"
41991-42027 sent: status: "Status" "S"
42567-42603 sent: status: "Status" "S"
43143-43179 sent: status: "Status" "S"
43719-43755 sent: status: "Status" "S"
44295-44331 sent: status: "Status" "S"
44871-44907 sent: status: "Status" "S"
45447-45483 sent: status: "Status" "S"
46024-46060 sent: status: "Status" "S"
46600-46636 sent: status: "Status" "S"
47176-47212 sent: status: "Status" "S"
47752-47788 sent: status: "Status" "S"
48328-48364 sent: status: "Status" "S"
48904-48940 sent: status: "Status" "S"
49480-49516 sent: status: "Status" "S"
50056-50092 sent: status: "Status" "S"
50632-50668 sent: status: "Status" "S"
51208-51244 sent: status: "Status" "S"
51784-51820 sent: status: "Status" "S"
52360-52396 sent: status: "Status" "S"
52936-52972 sent: status: "Status" "S"
53512-53548 sent: status: "Status" "S"
54089-54125 sent: status: "Status" "S"
54665-54701 sent: status: "Status" "S"
55241-55277 sent: status: "Status" "S"
55817-55853 sent: status: "Status" "S"
56393-56429 sent: status: "Status" "S"
56969-57005 sent: status: "Status" "S"
57545-57581 sent: status: "Status" "S"
58121-58157 sent: status: "Status" "S"
58697-58733 sent: status: "Status" "S"
59273-59309 sent: status: "Status" "S"
59849-59885 sent: status: "Status" "S"
60425-60461 sent: status: "Status" "S"
61001-61037 sent: status: "Status" "S"
61578-61614 sent: status: "Status" "S"
62154-62190 sent: status: "Status" "S"
62730-62766 sent: status: "Status" "S"
63306-63342 sent: status: "Status" "S"
63882-63918 sent: status: "Status" "S"
64458-64494 sent: status: "Status" "S"
65034-65070 sent: status: "Status" "S"
65610-65646 sent: status: "Status" "S"
66186-66222 sent: status: "Status" "S"
66762-66798 sent: status: "Status" "S"
67338-67374 sent: status: "Status" "S"
67914-67950 sent: status: "Status" "S"
68490-68526 sent: status: "Status" "S"
69067-69103 sent: status: "Status" "S"
69643-69679 sent: status: "Status" "S"
70219-70255 sent: status: "Status" "S"
70795-70831 sent: status: "Status" "S"
71371-71407 sent: status: "Status" "S"
71947-71983 sent: status: "Status" "S"
72523-72559 sent: status: "Status" "S"
73099-73135 sent: status: "Status" "S"
73675-73711 sent: status: "Status" "S"
74251-74287 sent: status: "Status" "S"
74827-74863 sent: status: "Status" "S"
75403-75439 sent: status: "Status" "S"
75979-76015 sent: status: "Status" "S"
76555-76591 sent: status: "Status" "S"
77132-77168 sent: status: "Status" "S"
77708-77744 sent: status: "Status" "S"
78284-78320 sent: status: "Status" "S"
78860-78896 sent: status: "Status" "S"
79436-79472 sent: status: "Status" "S"
80012-80048 sent: status: "Status" "S"
80588-80624 sent: status: "Status" "S"
81164-81200 sent: status: "Status" "S"
81740-81776 sent: status: "Status" "S"
82316-82352 sent: status: "Status" "S"
82892-82928 sent: status: "Status" "S"
83468-83504 sent: status: "Status" "S"
84044-84080 sent: status: "Status" "S"
84621-84657 sent: status: "Status" "S"
85197-85233 sent: status: "Status" "S"
85773-85809 sent: status: "Status" "S"
86349-86385 sent: status: "Status" "S"
86925-86961 sent: status: "Status" "S"
87501-87537 sent: status: "Status" "S"
88077-88113 sent: status: "Status" "S"
88653-88689 sent: status: "Status" "S"
89229-89265 sent: status: "Status" "S"
89805-89841 sent: status: "Status" "S"
90381-90417 sent: status: "Status" "S"
90957-90993 sent: status: "Status" "S"
91533-91569 sent: status: "Status" "S"
92110-92146 sent: status: "Status" "S"
92686-92722 sent: status: "Status" "S"
93262-93298 sent: status: "Status" "S"
93838-93874 sent: status: "Status" "S"
94414-94450 sent: status: "Status" "S"
94990-95026 sent: status: "Status" "S"
95566-95602 sent: status: "Status" "S"
96142-96178 sent: status: "Status" "S"
96718-96754 sent: status: "Status" "S"
97294-97330 sent: status: "Status" "S"
97870-97906 sent: status: "Status" "S"
98446-98482 sent: status: "Status" "S"
99022-99058 sent: status: "Status" "S"
99598-99634 sent: status: "Status" "S"
