0-193 em4100: bit: "0"
193-663 em4100: bit: "1"
663-1158 em4100: bit: "1"
1158-1721 em4100: bit: "1"
1721-2213 em4100: bit: "1"
2213-2713 em4100: bit: "1"
2713-3226 em4100: bit: "1"
3226-3735 em4100: bit: "1"
3735-4237 em4100: bit: "1"
4237-4735 em4100: bit: "1"
193-4735 em4100: header: "Header" "Head" "He" "H"
4735-5264 em4100: bit: "1"
5264-5762 em4100: bit: "0"
5762-6287 em4100: bit: "0"
6287-6824 em4100: bit: "0"
6824-7347 em4100: bit: "1"
4735-6824 em4100: version-customer: "Version/customer: 8" "8"
6824-7347 em4100: rowparity-ok: "Row parity: OK" "RP: OK" "RP" "R"
7347-7834 em4100: bit: "0"
7834-8330 em4100: bit: "1"
8330-8840 em4100: bit: "0"
8840-9355 em4100: bit: "0"
9355-9863 em4100: bit: "1"
7347-9355 em4100: version-customer: "Version/customer: 4" "4"
9355-9863 em4100: rowparity-ok: "Row parity: OK" "RP: OK" "RP" "R"
9863-10392 em4100: bit: "0"
10392-10986 em4100: bit: "0"
10986-11405 em4100: bit: "0"
11405-11929 em4100: bit: "0"
11929-12471 em4100: bit: "0"
9863-11929 em4100: data: "Data: 0" "0"
11929-12471 em4100: rowparity-ok: "Row parity: OK" "RP: OK" "RP" "R"
12471-12964 em4100: bit: "0"
12964-13508 em4100: bit: "0"
13508-13958 em4100: bit: "0"
13958-14480 em4100: bit: "0"
14480-15015 em4100: bit: "0"
12471-14480 em4100: data: "Data: 0" "0"
14480-15015 em4100: rowparity-ok: "Row parity: OK" "RP: OK" "RP" "R"
15015-15481 em4100: bit: "0"
15481-16001 em4100: bit: "0"
16001-16528 em4100: bit: "0"
16528-17040 em4100: bit: "0"
17040-17554 em4100: bit: "0"
15015-17040 em4100: data: "Data: 0" "0"
17040-17554 em4100: rowparity-ok: "Row parity: OK" "RP: OK" "RP" "R"
17554-18079 em4100: bit: "0"
18079-18573 em4100: bit: "1"
18573-19071 em4100: bit: "0"
19071-19602 em4100: bit: "0"
19602-20133 em4100: bit: "1"
17554-19602 em4100: data: "Data: 4" "4"
19602-20133 em4100: rowparity-ok: "Row parity: OK" "RP: OK" "RP" "R"
20133-20633 em4100: bit: "0"
20633-21149 em4100: bit: "0"
21149-21688 em4100: bit: "1"
21688-22172 em4100: bit: "1"
22172-22684 em4100: bit: "0"
20133-22172 em4100: data: "Data: 3" "3"
22172-22684 em4100: rowparity-ok: "Row parity: OK" "RP: OK" "RP" "R"
22684-23196 em4100: bit: "1"
23196-23714 em4100: bit: "0"
23714-24219 em4100: bit: "0"
24219-24715 em4100: bit: "1"
24715-25224 em4100: bit: "0"
22684-24715 em4100: data: "Data: 9" "9"
24715-25224 em4100: rowparity-ok: "Row parity: OK" "RP: OK" "RP" "R"
25224-25745 em4100: bit: "0"
25745-26265 em4100: bit: "0"
26265-26782 em4100: bit: "0"
26782-27289 em4100: bit: "1"
27289-27793 em4100: bit: "1"
25224-27289 em4100: data: "Data: 1" "1"
27289-27793 em4100: rowparity-ok: "Row parity: OK" "RP: OK" "RP" "R"
27793-28306 em4100: bit: "0"
28306-28814 em4100: bit: "1"
28814-29323 em4100: bit: "1"
29323-29830 em4100: bit: "0"
29830-30352 em4100: bit: "0"
27793-29830 em4100: data: "Data: 6" "6"
29830-30352 em4100: rowparity-ok: "Row parity: OK" "RP: OK" "RP" "R"
30352-30861 em4100: bit: "0"
30861-31376 em4100: bit: "1"
31376-31892 em4100: bit: "0"
31892-32403 em4100: bit: "1"
32403-32920 em4100: bit: "0"
32403-32920 em4100: stopbit: "Stop bit" "SB" "S"
30352-30861 em4100: colparity-ok: "Column parity 1: OK" "CP1: OK" "CP1" "C"
30861-31376 em4100: colparity-ok: "Column parity 2: OK" "CP2: OK" "CP2" "C"
31376-31892 em4100: colparity-ok: "Column parity 3: OK" "CP3: OK" "CP3" "C"
31892-32403 em4100: colparity-ok: "Column parity 4: OK" "CP4: OK" "CP4" "C"
193-32920 em4100: tag: "Tag: 8400043916" "Tag" "T"
32920-33447 em4100: bit: "1"
33447-33960 em4100: bit: "1"
33960-34458 em4100: bit: "1"
34458-34963 em4100: bit: "1"
34963-35461 em4100: bit: "1"
35461-35993 em4100: bit: "1"
35993-36536 em4100: bit: "1"
36536-37032 em4100: bit: "1"
37032-37530 em4100: bit: "1"
32920-37530 em4100: header: "Header" "Head" "He" "H"
37530-38032 em4100: bit: "1"
38032-38574 em4100: bit: "0"
38574-39057 em4100: bit: "0"
39057-39583 em4100: bit: "0"
39583-40098 em4100: bit: "1"
37530-39583 em4100: version-customer: "Version/customer: 8" "8"
39583-40098 em4100: rowparity-ok: "Row parity: OK" "RP: OK" "RP" "R"
40098-40605 em4100: bit: "0"
40605-41109 em4100: bit: "1"
41109-41626 em4100: bit: "0"
41626-42138 em4100: bit: "0"
42138-42644 em4100: bit: "1"
40098-42138 em4100: version-customer: "Version/customer: 4" "4"
42138-42644 em4100: rowparity-ok: "Row parity: OK" "RP: OK" "RP" "R"
42644-43138 em4100: bit: "0"
43138-43651 em4100: bit: "0"
43651-44185 em4100: bit: "0"
44185-44678 em4100: bit: "0"
44678-45197 em4100: bit: "0"
42644-44678 em4100: data: "Data: 0" "0"
44678-45197 em4100: rowparity-ok: "Row parity: OK" "RP: OK" "RP" "R"
45197-45717 em4100: bit: "0"
45717-46232 em4100: bit: "0"
46232-46754 em4100: bit: "0"
46754-47278 em4100: bit: "0"
47278-47773 em4100: bit: "0"
45197-47278 em4100: data: "Data: 0" "0"
47278-47773 em4100: rowparity-ok: "Row parity: OK" "RP: OK" "RP" "R"
47773-48305 em4100: bit: "0"
48305-48802 em4100: bit: "0"
48802-49283 em4100: bit: "0"
49283-49804 em4100: bit: "0"
49804-50322 em4100: bit: "0"
47773-49804 em4100: data: "Data: 0" "0"
49804-50322 em4100: rowparity-ok: "Row parity: OK" "RP: OK" "RP" "R"
50322-50839 em4100: bit: "0"
50839-51343 em4100: bit: "1"
51343-51874 em4100: bit: "0"
51874-52380 em4100: bit: "0"
52380-52880 em4100: bit: "1"
50322-52380 em4100: data: "Data: 4" "4"
52380-52880 em4100: rowparity-ok: "Row parity: OK" "RP: OK" "RP" "R"
52880-53421 em4100: bit: "0"
53421-53922 em4100: bit: "0"
53922-54445 em4100: bit: "1"
54445-54941 em4100: bit: "1"
54941-55458 em4100: bit: "0"
52880-54941 em4100: data: "Data: 3" "3"
54941-55458 em4100: rowparity-ok: "Row parity: OK" "RP: OK" "RP" "R"
55458-55973 em4100: bit: "1"
55973-56475 em4100: bit: "0"
56475-56989 em4100: bit: "0"
56989-57485 em4100: bit: "1"
57485-57988 em4100: bit: "0"
55458-57485 em4100: data: "Data: 9" "9"
57485-57988 em4100: rowparity-ok: "Row parity: OK" "RP: OK" "RP" "R"
57988-58522 em4100: bit: "0"
58522-59042 em4100: bit: "0"
59042-59553 em4100: bit: "0"
59553-60081 em4100: bit: "1"
60081-60568 em4100: bit: "1"
57988-60081 em4100: data: "Data: 1" "1"
60081-60568 em4100: rowparity-ok: "Row parity: OK" "RP: OK" "RP" "R"
60568-61080 em4100: bit: "0"
61080-61634 em4100: bit: "1"
61634-62111 em4100: bit: "1"
62111-62612 em4100: bit: "0"
62612-63131 em4100: bit: "0"
60568-62612 em4100: data: "Data: 6" "6"
62612-63131 em4100: rowparity-ok: "Row parity: OK" "RP: OK" "RP" "R"
63131-63645 em4100: bit: "0"
63645-64147 em4100: bit: "1"
64147-64659 em4100: bit: "0"
64659-65169 em4100: bit: "1"
65169-65694 em4100: bit: "0"
65169-65694 em4100: stopbit: "Stop bit" "SB" "S"
63131-63645 em4100: colparity-ok: "Column parity 1: OK" "CP1: OK" "CP1" "C"
63645-64147 em4100: colparity-ok: "Column parity 2: OK" "CP2: OK" "CP2" "C"
64147-64659 em4100: colparity-ok: "Column parity 3: OK" "CP3: OK" "CP3" "C"
64659-65169 em4100: colparity-ok: "Column parity 4: OK" "CP4: OK" "CP4" "C"
32920-65694 em4100: tag: "Tag: 8400043916" "Tag" "T"
65694-66223 em4100: bit: "1"
66223-66711 em4100: bit: "1"
66711-67205 em4100: bit: "1"
67205-67723 em4100: bit: "1"
67723-68259 em4100: bit: "1"
68259-68781 em4100: bit: "1"
68781-69266 em4100: bit: "1"
69266-69776 em4100: bit: "1"
69776-70283 em4100: bit: "1"
65694-70283 em4100: header: "Header" "Head" "He" "H"
70283-70803 em4100: bit: "1"
70803-71349 em4100: bit: "0"
71349-71865 em4100: bit: "0"
71865-72353 em4100: bit: "0"
72353-72852 em4100: bit: "1"
70283-72353 em4100: version-customer: "Version/customer: 8" "8"
72353-72852 em4100: rowparity-ok: "Row parity: OK" "RP: OK" "RP" "R"
72852-73388 em4100: bit: "0"
73388-73923 em4100: bit: "1"
73923-74425 em4100: bit: "0"
74425-74903 em4100: bit: "0"
74903-75411 em4100: bit: "1"
72852-74903 em4100: version-customer: "Version/customer: 4" "4"
74903-75411 em4100: rowparity-ok: "Row parity: OK" "RP: OK" "RP" "R"
75411-75910 em4100: bit: "0"
75910-76427 em4100: bit: "0"
76427-76940 em4100: bit: "0"
76940-77460 em4100: bit: "0"
77460-77987 em4100: bit: "0"
75411-77460 em4100: data: "Data: 0" "0"
77460-77987 em4100: rowparity-ok: "Row parity: OK" "RP: OK" "RP" "R"
77987-78505 em4100: bit: "0"
78505-79020 em4100: bit: "0"
79020-79576 em4100: bit: "0"
79576-80005 em4100: bit: "0"
80005-80524 em4100: bit: "0"
77987-80005 em4100: data: "Data: 0" "0"
80005-80524 em4100: rowparity-ok: "Row parity: OK" "RP: OK" "RP" "R"
80524-81037 em4100: bit: "0"
81037-81563 em4100: bit: "0"
81563-82063 em4100: bit: "0"
82063-82564 em4100: bit: "0"
82564-83084 em4100: bit: "0"
80524-82564 em4100: data: "Data: 0" "0"
82564-83084 em4100: rowparity-ok: "Row parity: OK" "RP: OK" "RP" "R"
83084-83642 em4100: bit: "0"
83642-84166 em4100: bit: "1"
84166-84644 em4100: bit: "0"
84644-85150 em4100: bit: "0"
85150-85651 em4100: bit: "1"
83084-85150 em4100: data: "Data: 4" "4"
85150-85651 em4100: rowparity-ok: "Row parity: OK" "RP: OK" "RP" "R"
85651-86163 em4100: bit: "0"
86163-86696 em4100: bit: "0"
86696-87204 em4100: bit: "1"
87204-87738 em4100: bit: "1"
87738-88231 em4100: bit: "0"
85651-87738 em4100: data: "Data: 3" "3"
87738-88231 em4100: rowparity-ok: "Row parity: OK" "RP: OK" "RP" "R"
88231-88720 em4100: bit: "1"
88720-89235 em4100: bit: "0"
89235-89737 em4100: bit: "0"
89737-90276 em4100: bit: "1"
90276-90829 em4100: bit: "0"
88231-90276 em4100: data: "Data: 9" "9"
90276-90829 em4100: rowparity-ok: "Row parity: OK" "RP: OK" "RP" "R"
90829-91313 em4100: bit: "0"
91313-91789 em4100: bit: "0"
91789-92341 em4100: bit: "0"
92341-92821 em4100: bit: "1"
92821-93329 em4100: bit: "1"
90829-92821 em4100: data: "Data: 1" "1"
92821-93329 em4100: rowparity-ok: "Row parity: OK" "RP: OK" "RP" "R"
93329-93853 em4100: bit: "0"
93853-94405 em4100: bit: "1"
94405-94870 em4100: bit: "1"
94870-95381 em4100: bit: "0"
95381-95892 em4100: bit: "0"
93329-95381 em4100: data: "Data: 6" "6"
95381-95892 em4100: rowparity-ok: "Row parity: OK" "RP: OK" "RP" "R"
95892-96396 em4100: bit: "0"
96396-96920 em4100: bit: "1"
96920-97450 em4100: bit: "0"
97450-97946 em4100: bit: "1"
