39333758-39339529 usb_request: request-setup-read: "SETUP in: [ 80 06 00 03 00 00 40 00 ][ 04 03 09 04 ] : ACK"
39342570-39348332 usb_request: request-setup-read: "SETUP in: [ 80 06 00 03 00 00 40 00 ][ 04 03 09 04 ] : ACK"
39350858-39360792 usb_request: request-setup-read: "SETUP in: [ 80 06 03 03 09 04 00 02 ][ 12 03 30 00 30 00 33 00 44 00 39 00 34 00 34 00 41 00 ] : ACK"
39367519-39375645 usb_request: request-setup-read: "SETUP in: [ 80 06 00 03 00 00 40 00 ][ 04 03 09 04 ] : ACK"
39380037-39388148 usb_request: request-setup-read: "SETUP in: [ 80 06 00 03 00 00 40 00 ][ 04 03 09 04 ] : ACK"
39391279-39405641 usb_request: request-setup-read: "SETUP in: [ 80 06 01 03 09 04 00 02 ][ 2A 03 53 00 69 00 6C 00 69 00 63 00 6F 00 6E 00 20 00 4C 00 61 00 62 00 6F 00 72 00 61 00 74 00 6F 00 72 00 69 00 65 00 73 00 ] : ACK"
39410192-39417881 usb_request: request-setup-read: "SETUP in: [ 80 06 00 03 00 00 40 00 ][ 04 03 09 04 ] : ACK"
39421726-39429481 usb_request: request-setup-read: "SETUP in: [ 80 06 00 03 00 00 40 00 ][ 04 03 09 04 ] : ACK"
39433328-39454540 usb_request: request-setup-read: "SETUP in: [ 80 06 02 03 09 04 00 02 ][ 3C 03 43 00 50 00 32 00 31 00 31 00 30 00 20 00 48 00 49 00 44 00 20 00 55 00 53 00 42 00 2D 00 74 00 6F 00 2D 00 55 00 41 00 52 00 54 00 20 00 42 00 72 00 69 00 64 00 67 00 65 00 ] : ACK"
39481084-39488930 usb_request: request-setup-write: "SETUP out: [ 21 09 41 03 00 00 02 00 ][ 41 01 ] : ACK"
39494290-39505430 usb_request: request-setup-write: "SETUP out: [ 21 09 50 03 00 00 09 00 ][ 50 00 00 25 80 00 00 03 00 ] : ACK"
39550604-39553162 usb_request: request-bulk-write: "BULK out: [ 07 73 69 67 72 6F 6B 21 90 ED 2D B8 FF 7F 00 00 00 00 00 00 00 00 00 00 03 00 00 00 00 00 00 00 40 B1 56 1A 1A 7F 00 00 80 25 00 00 00 00 00 00 08 00 00 00 00 00 00 00 90 78 57 1A 1A 7F 00 00 ] : ACK"
39500334-53150865 usb_request: request-bulk-read: "BULK in: [ 01 00 ] : ACK"
53200390-53200857 usb_request: request-bulk-read: "BULK in: [ 01 0D ] : ACK"
53250389-53250860 usb_request: request-bulk-read: "BULK in: [ 01 E0 ] : ACK"
53300390-53300861 usb_request: request-bulk-read: "BULK in: [ 01 58 ] : ACK"
53350391-53350866 usb_request: request-bulk-read: "BULK in: [ 01 00 ] : ACK"
53400390-53400858 usb_request: request-bulk-read: "BULK in: [ 01 01 ] : ACK"
53450391-53450862 usb_request: request-bulk-read: "BULK in: [ 01 4E ] : ACK"
53500391-53500862 usb_request: request-bulk-read: "BULK in: [ 01 20 ] : ACK"
53550391-53550862 usb_request: request-bulk-read: "BULK in: [ 01 39 ] : ACK"
53600391-53650855 usb_request: request-bulk-read: "BULK in: [ 01 43 ] : ACK"
53700392-53700863 usb_request: request-bulk-read: "BULK in: [ 01 02 ] : ACK"
53750392-53750864 usb_request: request-bulk-read: "BULK in: [ 01 00 ] : ACK"
53800395-53800871 usb_request: request-bulk-read: "BULK in: [ 01 00 ] : ACK"
53850392-53850864 usb_request: request-bulk-read: "BULK in: [ 01 00 ] : ACK"
53900397-53900868 usb_request: request-bulk-read: "BULK in: [ 01 A2 ] : ACK"
53950392-53950858 usb_request: request-bulk-read: "BULK in: [ 01 0D ] : ACK"
54000393-54000865 usb_request: request-bulk-read: "BULK in: [ 01 0A ] : ACK"
54173189-54182283 usb_request: request-setup-read: "SETUP in: [ 80 06 00 03 00 00 40 00 ][ 04 03 09 04 ] : ACK"
54187810-54195737 usb_request: request-setup-read: "SETUP in: [ 80 06 00 03 00 00 40 00 ][ 04 03 09 04 ] : ACK"
54200587-54210552 usb_request: request-setup-read: "SETUP in: [ 80 06 03 03 09 04 00 02 ][ 12 03 30 00 30 00 33 00 44 00 39 00 34 00 34 00 41 00 ] : ACK"
54219060-54227042 usb_request: request-setup-read: "SETUP in: [ 80 06 00 03 00 00 40 00 ][ 04 03 09 04 ] : ACK"
54231739-54239604 usb_request: request-setup-read: "SETUP in: [ 80 06 00 03 00 00 40 00 ][ 04 03 09 04 ] : ACK"
54244264-54257537 usb_request: request-setup-read: "SETUP in: [ 80 06 01 03 09 04 00 02 ][ 2A 03 53 00 69 00 6C 00 69 00 63 00 6F 00 6E 00 20 00 4C 00 61 00 62 00 6F 00 72 00 61 00 74 00 6F 00 72 00 69 00 65 00 73 00 ] : ACK"
54267702-54275146 usb_request: request-setup-read: "SETUP in: [ 80 06 00 03 00 00 40 00 ][ 04 03 09 04 ] : ACK"
54280178-54287341 usb_request: request-setup-read: "SETUP in: [ 80 06 00 03 00 00 40 00 ][ 04 03 09 04 ] : ACK"
54292275-54312534 usb_request: request-setup-read: "SETUP in: [ 80 06 02 03 09 04 00 02 ][ 3C 03 43 00 50 00 32 00 31 00 31 00 30 00 20 00 48 00 49 00 44 00 20 00 55 00 53 00 42 00 2D 00 74 00 6F 00 2D 00 55 00 41 00 52 00 54 00 20 00 42 00 72 00 69 00 64 00 67 00 65 00 ] : ACK"
54378974-54384690 usb_request: request-setup-write: "SETUP out: [ 21 09 41 03 00 00 02 00 ][ 41 01 ] : ACK"
54394943-54405037 usb_request: request-setup-write: "SETUP out: [ 21 09 50 03 00 00 09 00 ][ 50 00 00 25 80 00 00 03 00 ] : ACK"
54450667-54453222 usb_request: request-bulk-write: "BULK out: [ 07 73 69 67 72 6F 6B 21 F0 EE 2D B8 FF 7F 00 00 00 00 00 00 00 00 00 00 03 00 00 00 00 00 00 00 40 B1 56 1A 1A 7F 00 00 80 25 00 00 00 00 00 00 08 00 00 00 00 00 00 00 90 78 57 1A 1A 7F 00 00 ] : ACK"
54400399-78300966 usb_request: request-bulk-read: "BULK in: [ 01 00 ] : ACK"
78350491-78350958 usb_request: request-bulk-read: "BULK in: [ 01 0D ] : ACK"
78400494-78400965 usb_request: request-bulk-read: "BULK in: [ 01 E0 ] : ACK"
78450491-78450962 usb_request: request-bulk-read: "BULK in: [ 01 58 ] : ACK"
78500492-78500964 usb_request: request-bulk-read: "BULK in: [ 01 00 ] : ACK"
78550491-78550958 usb_request: request-bulk-read: "BULK in: [ 01 01 ] : ACK"
78600492-78600960 usb_request: request-bulk-read: "BULK in: [ 01 4E ] : ACK"
78650492-78650963 usb_request: request-bulk-read: "BULK in: [ 01 20 ] : ACK"
78700492-78700963 usb_request: request-bulk-read: "BULK in: [ 01 39 ] : ACK"
78750493-78750956 usb_request: request-bulk-read: "BULK in: [ 01 43 ] : ACK"
78800493-78800961 usb_request: request-bulk-read: "BULK in: [ 01 02 ] : ACK"
78850493-78850965 usb_request: request-bulk-read: "BULK in: [ 01 00 ] : ACK"
78900493-78900968 usb_request: request-bulk-read: "BULK in: [ 01 00 ] : ACK"
78950492-78950966 usb_request: request-bulk-read: "BULK in: [ 01 00 ] : ACK"
79000493-79050965 usb_request: request-bulk-read: "BULK in: [ 01 A2 ] : ACK"
79100493-79100956 usb_request: request-bulk-read: "BULK in: [ 01 0D ] : ACK"
79150494-79150966 usb_request: request-bulk-read: "BULK in: [ 01 0A ] : ACK"
79200495-103401068 usb_request: request-bulk-read: "BULK in: [ 01 00 ] : ACK"
103450593-103451056 usb_request: request-bulk-read: "BULK in: [ 01 0D ] : ACK"
103500593-103501062 usb_request: request-bulk-read: "BULK in: [ 01 E0 ] : ACK"
103550594-103551065 usb_request: request-bulk-read: "BULK in: [ 01 58 ] : ACK"
103600593-103601068 usb_request: request-bulk-read: "BULK in: [ 01 00 ] : ACK"
103650594-103651061 usb_request: request-bulk-read: "BULK in: [ 01 01 ] : ACK"
103700594-103701065 usb_request: request-bulk-read: "BULK in: [ 01 4E ] : ACK"
103750594-103751065 usb_request: request-bulk-read: "BULK in: [ 01 20 ] : ACK"
103800594-103801062 usb_request: request-bulk-read: "BULK in: [ 01 39 ] : ACK"
103850593-103851058 usb_request: request-bulk-read: "BULK in: [ 01 43 ] : ACK"
103900595-103901065 usb_request: request-bulk-read: "BULK in: [ 01 02 ] : ACK"
103950595-104001070 usb_request: request-bulk-read: "BULK in: [ 01 00 ] : ACK"
104050595-104051067 usb_request: request-bulk-read: "BULK in: [ 01 00 ] : ACK"
104100596-104101068 usb_request: request-bulk-read: "BULK in: [ 01 00 ] : ACK"
104150595-104151063 usb_request: request-bulk-read: "BULK in: [ 01 A2 ] : ACK"
104200596-104201063 usb_request: request-bulk-read: "BULK in: [ 01 0D ] : ACK"
104250596-104251067 usb_request: request-bulk-read: "BULK in: [ 01 0A ] : ACK"
104300596-128501168 usb_request: request-bulk-read: "BULK in: [ 01 00 ] : ACK"
128550694-128551161 usb_request: request-bulk-read: "BULK in: [ 01 0D ] : ACK"
128600695-128601166 usb_request: request-bulk-read: "BULK in: [ 01 E0 ] : ACK"
128650694-128651165 usb_request: request-bulk-read: "BULK in: [ 01 58 ] : ACK"
128700695-128701170 usb_request: request-bulk-read: "BULK in: [ 01 00 ] : ACK"
128750695-128801162 usb_request: request-bulk-read: "BULK in: [ 01 01 ] : ACK"
128850695-128851166 usb_request: request-bulk-read: "BULK in: [ 01 4E ] : ACK"
128900694-128901165 usb_request: request-bulk-read: "BULK in: [ 01 20 ] : ACK"
128950696-128951167 usb_request: request-bulk-read: "BULK in: [ 01 39 ] : ACK"
129000696-129001163 usb_request: request-bulk-read: "BULK in: [ 01 43 ] : ACK"
129050695-129051166 usb_request: request-bulk-read: "BULK in: [ 01 02 ] : ACK"
129100696-129101171 usb_request: request-bulk-read: "BULK in: [ 01 00 ] : ACK"
129150697-129151169 usb_request: request-bulk-read: "BULK in: [ 01 00 ] : ACK"
129200696-129201172 usb_request: request-bulk-read: "BULK in: [ 01 00 ] : ACK"
129250697-129251165 usb_request: request-bulk-read: "BULK in: [ 01 A2 ] : ACK"
129300697-129301162 usb_request: request-bulk-read: "BULK in: [ 01 0D ] : ACK"
129350697-129351168 usb_request: request-bulk-read: "BULK in: [ 01 0A ] : ACK"
129400698-153601274 usb_request: request-bulk-read: "BULK in: [ 01 00 ] : ACK"
153650795-153651262 usb_request: request-bulk-read: "BULK in: [ 01 0D ] : ACK"
153700795-153751265 usb_request: request-bulk-read: "BULK in: [ 01 E0 ] : ACK"
153800795-153801266 usb_request: request-bulk-read: "BULK in: [ 01 58 ] : ACK"
153850796-153851268 usb_request: request-bulk-read: "BULK in: [ 01 00 ] : ACK"
153900795-153901258 usb_request: request-bulk-read: "BULK in: [ 01 01 ] : ACK"
153950796-153951265 usb_request: request-bulk-read: "BULK in: [ 01 4E ] : ACK"
154000797-154001268 usb_request: request-bulk-read: "BULK in: [ 01 20 ] : ACK"
154050795-154051266 usb_request: request-bulk-read: "BULK in: [ 01 39 ] : ACK"
154100797-154101260 usb_request: request-bulk-read: "BULK in: [ 01 43 ] : ACK"
154150797-154151266 usb_request: request-bulk-read: "BULK in: [ 01 02 ] : ACK"
154200797-154201271 usb_request: request-bulk-read: "BULK in: [ 01 00 ] : ACK"
154250797-154251272 usb_request: request-bulk-read: "BULK in: [ 01 00 ] : ACK"
154300798-154301270 usb_request: request-bulk-read: "BULK in: [ 01 00 ] : ACK"
154350798-154351269 usb_request: request-bulk-read: "BULK in: [ 01 A2 ] : ACK"
154400798-154401262 usb_request: request-bulk-read: "BULK in: [ 01 0D ] : ACK"
154450797-154501269 usb_request: request-bulk-read: "BULK in: [ 01 0A ] : ACK"
154550799-178751370 usb_request: request-bulk-read: "BULK in: [ 01 00 ] : ACK"
178800896-178801363 usb_request: request-bulk-read: "BULK in: [ 01 0D ] : ACK"
178850896-178851367 usb_request: request-bulk-read: "BULK in: [ 01 E0 ] : ACK"
178900896-178901367 usb_request: request-bulk-read: "BULK in: [ 01 58 ] : ACK"
178950897-178951372 usb_request: request-bulk-read: "BULK in: [ 01 00 ] : ACK"
179000897-179001360 usb_request: request-bulk-read: "BULK in: [ 01 01 ] : ACK"
179050897-179051369 usb_request: request-bulk-read: "BULK in: [ 01 4E ] : ACK"
179100897-179101365 usb_request: request-bulk-read: "BULK in: [ 01 20 ] : ACK"
179150900-179151368 usb_request: request-bulk-read: "BULK in: [ 01 39 ] : ACK"
179200902-179201365 usb_request: request-bulk-read: "BULK in: [ 01 43 ] : ACK"
179250898-179301364 usb_request: request-bulk-read: "BULK in: [ 01 02 ] : ACK"
179350898-179351369 usb_request: request-bulk-read: "BULK in: [ 01 00 ] : ACK"
179400899-179401371 usb_request: request-bulk-read: "BULK in: [ 01 00 ] : ACK"
179450897-179451373 usb_request: request-bulk-read: "BULK in: [ 01 00 ] : ACK"
179500899-179501370 usb_request: request-bulk-read: "BULK in: [ 01 A2 ] : ACK"
179550899-179551366 usb_request: request-bulk-read: "BULK in: [ 01 0D ] : ACK"
179600899-179601370 usb_request: request-bulk-read: "BULK in: [ 01 0A ] : ACK"
