194-297 usb_request: request-bulk-read: "BULK in: [ ] : timeout"
707-777 usb_request: errors: "ERR: received unhandled UNKNOWN token in state TOKEN RECEIVED"
451-554 usb_request: request-bulk-read: "BULK in: [ ] : timeout"
964-1067 usb_request: request-bulk-read: "BULK in: [ ] : timeout"
1219-1322 usb_request: request-bulk-read: "BULK in: [ ] : timeout"
1475-1578 usb_request: request-bulk-read: "BULK in: [ ] : timeout"
3161-3264 usb_request: request-bulk-read: "BULK in: [ ] : timeout"
3534-3603 usb_request: errors: "ERR: received unhandled UNKNOWN token in state TOKEN RECEIVED"
3291-3394 usb_request: request-bulk-read: "BULK in: [ ] : timeout"
3789-3892 usb_request: request-bulk-read: "BULK in: [ ] : timeout"
4046-4149 usb_request: request-bulk-read: "BULK in: [ ] : timeout"
4302-4405 usb_request: request-bulk-read: "BULK in: [ ] : timeout"
4557-4660 usb_request: request-bulk-read: "BULK in: [ ] : timeout"
4814-4917 usb_request: request-bulk-read: "BULK in: [ ] : timeout"
5070-5173 usb_request: request-bulk-read: "BULK in: [ ] : timeout"
5325-5428 usb_request: request-bulk-read: "BULK in: [ ] : timeout"
5582-5685 usb_request: request-bulk-read: "BULK in: [ ] : timeout"
5838-5941 usb_request: request-bulk-read: "BULK in: [ ] : timeout"
6214-6317 usb_request: request-bulk-read: "BULK in: [ ] : timeout"
6472-6575 usb_request: request-bulk-read: "BULK in: [ ] : timeout"
6727-6830 usb_request: request-bulk-read: "BULK in: [ ] : timeout"
6984-7087 usb_request: request-bulk-read: "BULK in: [ ] : timeout"
7240-7343 usb_request: request-bulk-read: "BULK in: [ ] : timeout"
7495-7598 usb_request: request-bulk-read: "BULK in: [ ] : timeout"
7752-7855 usb_request: request-bulk-read: "BULK in: [ ] : timeout"
8008-8111 usb_request: request-bulk-read: "BULK in: [ ] : timeout"
8263-8366 usb_request: request-bulk-read: "BULK in: [ ] : timeout"
8521-8624 usb_request: request-bulk-read: "BULK in: [ ] : timeout"
8776-8879 usb_request: request-bulk-read: "BULK in: [ ] : timeout"
9110-9213 usb_request: request-bulk-read: "BULK in: [ ] : timeout"
9365-9468 usb_request: request-bulk-read: "BULK in: [ ] : timeout"
9621-9724 usb_request: request-bulk-read: "BULK in: [ ] : timeout"
9876-9979 usb_request: request-bulk-read: "BULK in: [ ] : timeout"
10389-10492 usb_request: request-bulk-read: "BULK in: [ ] : timeout"
10644-10747 usb_request: request-bulk-read: "BULK in: [ ] : timeout"
10902-11005 usb_request: request-bulk-read: "BULK in: [ ] : timeout"
11155-11258 usb_request: request-bulk-read: "BULK in: [ ] : timeout"
11411-11514 usb_request: request-bulk-read: "BULK in: [ ] : timeout"
11666-11769 usb_request: request-bulk-read: "BULK in: [ ] : timeout"
11922-12025 usb_request: request-bulk-read: "BULK in: [ ] : timeout"
12175-12278 usb_request: request-bulk-read: "BULK in: [ ] : timeout"
12430-12533 usb_request: request-bulk-read: "BULK in: [ ] : timeout"
12688-12791 usb_request: request-bulk-read: "BULK in: [ ] : timeout"
12943-13046 usb_request: request-bulk-read: "BULK in: [ ] : timeout"
13198-13301 usb_request: request-bulk-read: "BULK in: [ ] : timeout"
13456-13559 usb_request: request-bulk-read: "BULK in: [ ] : timeout"
13711-13814 usb_request: request-bulk-read: "BULK in: [ ] : timeout"
13967-14070 usb_request: request-bulk-read: "BULK in: [ ] : timeout"
14221-14324 usb_request: request-bulk-read: "BULK in: [ ] : timeout"
14476-14579 usb_request: request-bulk-read: "BULK in: [ ] : timeout"
14733-14836 usb_request: request-bulk-read: "BULK in: [ ] : timeout"
15111-15214 usb_request: request-bulk-read: "BULK in: [ ] : timeout"
15367-15470 usb_request: request-bulk-read: "BULK in: [ ] : timeout"
15622-15725 usb_request: request-bulk-read: "BULK in: [ ] : timeout"
15877-15980 usb_request: request-bulk-read: "BULK in: [ ] : timeout"
16135-16238 usb_request: request-bulk-read: "BULK in: [ ] : timeout"
16390-16493 usb_request: request-bulk-read: "BULK in: [ ] : timeout"
16903-17006 usb_request: request-bulk-read: "BULK in: [ ] : timeout"
17157-17260 usb_request: request-bulk-read: "BULK in: [ ] : timeout"
17412-17515 usb_request: request-bulk-read: "BULK in: [ ] : timeout"
17668-17771 usb_request: request-bulk-read: "BULK in: [ ] : timeout"
17923-18026 usb_request: request-bulk-read: "BULK in: [ ] : timeout"
18176-18279 usb_request: request-bulk-read: "BULK in: [ ] : timeout"
18432-18535 usb_request: request-bulk-read: "BULK in: [ ] : timeout"
18689-18792 usb_request: request-bulk-read: "BULK in: [ ] : timeout"
18944-19047 usb_request: request-bulk-read: "BULK in: [ ] : timeout"
19200-19303 usb_request: request-bulk-read: "BULK in: [ ] : timeout"
19715-19784 usb_request: errors: "ERR: received unhandled UNKNOWN token in state TOKEN RECEIVED"
