427588-427934 eeprom24xx: control-code: "Control code bits: 1010" "Control code: 1010" "Ctrl code: 1010" "Ctrl code" "Ctrl" "C"
427934-428020 eeprom24xx: address-pin: "Address bit 2: 0" "Addr bit 2" "A2" "A"
428020-428107 eeprom24xx: address-pin: "Address bit 1: 0" "Addr bit 1" "A1" "A"
428107-428194 eeprom24xx: address-pin: "Address bit 0: 0" "Addr bit 0" "A0" "A"
428194-428281 eeprom24xx: rw-bit: "R/W bit: read" "R/W" "RW" "R"
427588-428281 eeprom24xx: control-word: "Control word" "Control" "CW" "C"
427502-428367 eeprom24xx: warning: "Warning: No reply from slave!"
428495-428841 eeprom24xx: control-code: "Control code bits: 1010" "Control code: 1010" "Ctrl code: 1010" "Ctrl code" "Ctrl" "C"
428841-428928 eeprom24xx: address-pin: "Address bit 2: 0" "Addr bit 2" "A2" "A"
428928-429014 eeprom24xx: address-pin: "Address bit 1: 0" "Addr bit 1" "A1" "A"
429014-429100 eeprom24xx: address-pin: "Address bit 0: 1" "Addr bit 0" "A0" "A"
429100-429186 eeprom24xx: rw-bit: "R/W bit: read" "R/W" "RW" "R"
428495-429186 eeprom24xx: control-word: "Control word" "Control" "CW" "C"
428410-430095 eeprom24xx: warning: "Warning: STOP expected (not RESTART)"
429273-429965 eeprom24xx: data-byte: "Data byte 00: FF" "Data byte: FF" "Byte: FF" "DB: FF" "FF"
429273-429965 eeprom24xx: data: "Data" "D"
428410-430095 eeprom24xx: cur-addr-read: "Current address read: FF" "Current address read" "Cur addr read" "CAR" "C"
430180-430527 eeprom24xx: control-code: "Control code bits: 1010" "Control code: 1010" "Ctrl code: 1010" "Ctrl code" "Ctrl" "C"
430527-430613 eeprom24xx: address-pin: "Address bit 2: 0" "Addr bit 2" "A2" "A"
430613-430700 eeprom24xx: address-pin: "Address bit 1: 0" "Addr bit 1" "A1" "A"
430700-430787 eeprom24xx: address-pin: "Address bit 0: 1" "Addr bit 0" "A0" "A"
430787-430874 eeprom24xx: rw-bit: "R/W bit: write" "R/W" "RW" "W"
430180-430874 eeprom24xx: control-word: "Control word" "Control" "CW" "C"
431740-432087 eeprom24xx: control-code: "Control code bits: 0000" "Control code: 0000" "Ctrl code: 0000" "Ctrl code" "Ctrl" "C"
432087-432174 eeprom24xx: address-pin: "Address bit 2: 0" "Addr bit 2" "A2" "A"
432174-432260 eeprom24xx: address-pin: "Address bit 1: 0" "Addr bit 1" "A1" "A"
432260-432347 eeprom24xx: address-pin: "Address bit 0: 0" "Addr bit 0" "A0" "A"
432347-432434 eeprom24xx: rw-bit: "R/W bit: write" "R/W" "RW" "W"
431740-432434 eeprom24xx: control-word: "Control word" "Control" "CW" "C"
430960-431654 eeprom24xx: word-addr-byte: "Word address byte: 00" "Word addr byte: 00" "Addr: 00" "A: 00" "00"
430960-431654 eeprom24xx: word-addr: "Word address" "Word addr" "Addr" "A"
432649-433342 eeprom24xx: data-byte: "Data byte 00: 51" "Data byte: 51" "Byte: 51" "DB: 51" "51"
433428-434120 eeprom24xx: data-byte: "Data byte 01: FF" "Data byte: FF" "Byte: FF" "DB: FF" "FF"
432649-434120 eeprom24xx: data: "Data" "D"
430095-434271 eeprom24xx: seq-random-read: "Sequential random read (addr=00, 2 bytes): 00 FF" "Sequential random read (addr=00, 2 bytes)" "Sequential random read" "SRR" "S"
