119-132 eeprom24xx: control-code: "Control code bits: 1010" "Control code: 1010" "Ctrl code: 1010" "Ctrl code" "Ctrl" "C"
132-135 eeprom24xx: address-pin: "Address bit 2: 0" "Addr bit 2" "A2" "A"
135-139 eeprom24xx: address-pin: "Address bit 1: 0" "Addr bit 1" "A1" "A"
139-142 eeprom24xx: address-pin: "Address bit 0: 1" "Addr bit 0" "A0" "A"
142-145 eeprom24xx: rw-bit: "R/W bit: write" "R/W" "RW" "W"
119-145 eeprom24xx: control-word: "Control word" "Control" "CW" "C"
246-259 eeprom24xx: control-code: "Control code bits: 1010" "Control code: 1010" "Ctrl code: 1010" "Ctrl code" "Ctrl" "C"
259-262 eeprom24xx: address-pin: "Address bit 2: 0" "Addr bit 2" "A2" "A"
262-265 eeprom24xx: address-pin: "Address bit 1: 0" "Addr bit 1" "A1" "A"
265-269 eeprom24xx: address-pin: "Address bit 0: 1" "Addr bit 0" "A0" "A"
269-273 eeprom24xx: rw-bit: "R/W bit: read" "R/W" "RW" "R"
246-273 eeprom24xx: control-word: "Control word" "Control" "CW" "C"
163-190 eeprom24xx: word-addr-byte: "Word address high byte: 20" "Word addr high byte: 20" "Addr high: 20" "AH: 20" "20"
201-227 eeprom24xx: word-addr-byte: "Word address low byte: 00" "Word addr low byte: 00" "Addr low: 00" "AL: 00" "00"
163-227 eeprom24xx: word-addr: "Word address" "Word addr" "Addr" "A"
286-312 eeprom24xx: data-byte: "Data byte 2000: FF" "Data byte: FF" "Byte: FF" "DB: FF" "FF"
323-350 eeprom24xx: data-byte: "Data byte 2001: FF" "Data byte: FF" "Byte: FF" "DB: FF" "FF"
359-386 eeprom24xx: data-byte: "Data byte 2002: FF" "Data byte: FF" "Byte: FF" "DB: FF" "FF"
395-422 eeprom24xx: data-byte: "Data byte 2003: FF" "Data byte: FF" "Byte: FF" "DB: FF" "FF"
431-457 eeprom24xx: data-byte: "Data byte 2004: FF" "Data byte: FF" "Byte: FF" "DB: FF" "FF"
467-493 eeprom24xx: data-byte: "Data byte 2005: FF" "Data byte: FF" "Byte: FF" "DB: FF" "FF"
503-529 eeprom24xx: data-byte: "Data byte 2006: FF" "Data byte: FF" "Byte: FF" "DB: FF" "FF"
539-565 eeprom24xx: data-byte: "Data byte 2007: FF" "Data byte: FF" "Byte: FF" "DB: FF" "FF"
575-601 eeprom24xx: data-byte: "Data byte 2008: FF" "Data byte: FF" "Byte: FF" "DB: FF" "FF"
611-637 eeprom24xx: data-byte: "Data byte 2009: FF" "Data byte: FF" "Byte: FF" "DB: FF" "FF"
647-673 eeprom24xx: data-byte: "Data byte 200A: FF" "Data byte: FF" "Byte: FF" "DB: FF" "FF"
683-709 eeprom24xx: data-byte: "Data byte 200B: FF" "Data byte: FF" "Byte: FF" "DB: FF" "FF"
720-745 eeprom24xx: data-byte: "Data byte 200C: FF" "Data byte: FF" "Byte: FF" "DB: FF" "FF"
756-783 eeprom24xx: data-byte: "Data byte 200D: FF" "Data byte: FF" "Byte: FF" "DB: FF" "FF"
792-819 eeprom24xx: data-byte: "Data byte 200E: FF" "Data byte: FF" "Byte: FF" "DB: FF" "FF"
828-855 eeprom24xx: data-byte: "Data byte 200F: FF" "Data byte: FF" "Byte: FF" "DB: FF" "FF"
864-890 eeprom24xx: data-byte: "Data byte 2010: FF" "Data byte: FF" "Byte: FF" "DB: FF" "FF"
900-926 eeprom24xx: data-byte: "Data byte 2011: FF" "Data byte: FF" "Byte: FF" "DB: FF" "FF"
936-962 eeprom24xx: data-byte: "Data byte 2012: FF" "Data byte: FF" "Byte: FF" "DB: FF" "FF"
972-998 eeprom24xx: data-byte: "Data byte 2013: FF" "Data byte: FF" "Byte: FF" "DB: FF" "FF"
1008-1034 eeprom24xx: data-byte: "Data byte 2014: FF" "Data byte: FF" "Byte: FF" "DB: FF" "FF"
1044-1070 eeprom24xx: data-byte: "Data byte 2015: FF" "Data byte: FF" "Byte: FF" "DB: FF" "FF"
1080-1106 eeprom24xx: data-byte: "Data byte 2016: FF" "Data byte: FF" "Byte: FF" "DB: FF" "FF"
1116-1142 eeprom24xx: data-byte: "Data byte 2017: FF" "Data byte: FF" "Byte: FF" "DB: FF" "FF"
1153-1178 eeprom24xx: data-byte: "Data byte 2018: FF" "Data byte: FF" "Byte: FF" "DB: FF" "FF"
1189-1216 eeprom24xx: data-byte: "Data byte 2019: FF" "Data byte: FF" "Byte: FF" "DB: FF" "FF"
1225-1252 eeprom24xx: data-byte: "Data byte 201A: FF" "Data byte: FF" "Byte: FF" "DB: FF" "FF"
1261-1288 eeprom24xx: data-byte: "Data byte 201B: FF" "Data byte: FF" "Byte: FF" "DB: FF" "FF"
1297-1324 eeprom24xx: data-byte: "Data byte 201C: FF" "Data byte: FF" "Byte: FF" "DB: FF" "FF"
1333-1359 eeprom24xx: data-byte: "Data byte 201D: FF" "Data byte: FF" "Byte: FF" "DB: FF" "FF"
1369-1395 eeprom24xx: data-byte: "Data byte 201E: FF" "Data byte: FF" "Byte: FF" "DB: FF" "FF"
1405-1431 eeprom24xx: data-byte: "Data byte 201F: FF" "Data byte: FF" "Byte: FF" "DB: FF" "FF"
1441-1467 eeprom24xx: data-byte: "Data byte 2020: FF" "Data byte: FF" "Byte: FF" "DB: FF" "FF"
1477-1503 eeprom24xx: data-byte: "Data byte 2021: FF" "Data byte: FF" "Byte: FF" "DB: FF" "FF"
1513-1539 eeprom24xx: data-byte: "Data byte 2022: FF" "Data byte: FF" "Byte: FF" "DB: FF" "FF"
1549-1575 eeprom24xx: data-byte: "Data byte 2023: FF" "Data byte: FF" "Byte: FF" "DB: FF" "FF"
1586-1611 eeprom24xx: data-byte: "Data byte 2024: FF" "Data byte: FF" "Byte: FF" "DB: FF" "FF"
1622-1647 eeprom24xx: data-byte: "Data byte 2025: FF" "Data byte: FF" "Byte: FF" "DB: FF" "FF"
1658-1685 eeprom24xx: data-byte: "Data byte 2026: FF" "Data byte: FF" "Byte: FF" "DB: FF" "FF"
1694-1721 eeprom24xx: data-byte: "Data byte 2027: FF" "Data byte: FF" "Byte: FF" "DB: FF" "FF"
1730-1757 eeprom24xx: data-byte: "Data byte 2028: FF" "Data byte: FF" "Byte: FF" "DB: FF" "FF"
1766-1792 eeprom24xx: data-byte: "Data byte 2029: FF" "Data byte: FF" "Byte: FF" "DB: FF" "FF"
1802-1828 eeprom24xx: data-byte: "Data byte 202A: FF" "Data byte: FF" "Byte: FF" "DB: FF" "FF"
1838-1864 eeprom24xx: data-byte: "Data byte 202B: FF" "Data byte: FF" "Byte: FF" "DB: FF" "FF"
1874-1900 eeprom24xx: data-byte: "Data byte 202C: FF" "Data byte: FF" "Byte: FF" "DB: FF" "FF"
1910-1936 eeprom24xx: data-byte: "Data byte 202D: FF" "Data byte: FF" "Byte: FF" "DB: FF" "FF"
1946-1972 eeprom24xx: data-byte: "Data byte 202E: FF" "Data byte: FF" "Byte: FF" "DB: FF" "FF"
1982-2008 eeprom24xx: data-byte: "Data byte 202F: FF" "Data byte: FF" "Byte: FF" "DB: FF" "FF"
2019-2044 eeprom24xx: data-byte: "Data byte 2030: FF" "Data byte: FF" "Byte: FF" "DB: FF" "FF"
2055-2080 eeprom24xx: data-byte: "Data byte 2031: FF" "Data byte: FF" "Byte: FF" "DB: FF" "FF"
2091-2118 eeprom24xx: data-byte: "Data byte 2032: FF" "Data byte: FF" "Byte: FF" "DB: FF" "FF"
2127-2154 eeprom24xx: data-byte: "Data byte 2033: FF" "Data byte: FF" "Byte: FF" "DB: FF" "FF"
2163-2190 eeprom24xx: data-byte: "Data byte 2034: FF" "Data byte: FF" "Byte: FF" "DB: FF" "FF"
2199-2225 eeprom24xx: data-byte: "Data byte 2035: FF" "Data byte: FF" "Byte: FF" "DB: FF" "FF"
2235-2261 eeprom24xx: data-byte: "Data byte 2036: FF" "Data byte: FF" "Byte: FF" "DB: FF" "FF"
2271-2297 eeprom24xx: data-byte: "Data byte 2037: FF" "Data byte: FF" "Byte: FF" "DB: FF" "FF"
2307-2333 eeprom24xx: data-byte: "Data byte 2038: FF" "Data byte: FF" "Byte: FF" "DB: FF" "FF"
2343-2369 eeprom24xx: data-byte: "Data byte 2039: FF" "Data byte: FF" "Byte: FF" "DB: FF" "FF"
2379-2405 eeprom24xx: data-byte: "Data byte 203A: FF" "Data byte: FF" "Byte: FF" "DB: FF" "FF"
2415-2441 eeprom24xx: data-byte: "Data byte 203B: FF" "Data byte: FF" "Byte: FF" "DB: FF" "FF"
2452-2477 eeprom24xx: data-byte: "Data byte 203C: FF" "Data byte: FF" "Byte: FF" "DB: FF" "FF"
2488-2513 eeprom24xx: data-byte: "Data byte 203D: FF" "Data byte: FF" "Byte: FF" "DB: FF" "FF"
2524-2551 eeprom24xx: data-byte: "Data byte 203E: FF" "Data byte: FF" "Byte: FF" "DB: FF" "FF"
2560-2586 eeprom24xx: data-byte: "Data byte 203F: FF" "Data byte: FF" "Byte: FF" "DB: FF" "FF"
286-2586 eeprom24xx: data: "Data" "D"
116-2598 eeprom24xx: seq-random-read: "Sequential random read (addr=2000, 64 bytes): FF FF FF FF FF FF FF FF FF FF FF FF FF FF FF FF FF FF FF FF FF FF FF FF FF FF FF FF FF FF FF FF FF FF FF FF FF FF FF FF FF FF FF FF FF FF FF FF FF FF FF FF FF FF FF FF FF FF FF FF FF FF FF FF" "Sequential random read (addr=2000, 64 bytes)" "Sequential random read" "SRR" "S"
2643-2656 eeprom24xx: control-code: "Control code bits: 1010" "Control code: 1010" "Ctrl code: 1010" "Ctrl code" "Ctrl" "C"
2656-2659 eeprom24xx: address-pin: "Address bit 2: 0" "Addr bit 2" "A2" "A"
2659-2662 eeprom24xx: address-pin: "Address bit 1: 0" "Addr bit 1" "A1" "A"
2662-2665 eeprom24xx: address-pin: "Address bit 0: 1" "Addr bit 0" "A0" "A"
2665-2668 eeprom24xx: rw-bit: "R/W bit: write" "R/W" "RW" "W"
2643-2668 eeprom24xx: control-word: "Control word" "Control" "CW" "C"
2769-2782 eeprom24xx: control-code: "Control code bits: 1010" "Control code: 1010" "Ctrl code: 1010" "Ctrl code" "Ctrl" "C"
2782-2786 eeprom24xx: address-pin: "Address bit 2: 0" "Addr bit 2" "A2" "A"
2786-2789 eeprom24xx: address-pin: "Address bit 1: 0" "Addr bit 1" "A1" "A"
2789-2792 eeprom24xx: address-pin: "Address bit 0: 1" "Addr bit 0" "A0" "A"
2792-2795 eeprom24xx: rw-bit: "R/W bit: read" "R/W" "RW" "R"
2769-2795 eeprom24xx: control-word: "Control word" "Control" "CW" "C"
2686-2712 eeprom24xx: word-addr-byte: "Word address high byte: 20" "Word addr high byte: 20" "Addr high: 20" "AH: 20" "20"
2725-2750 eeprom24xx: word-addr-byte: "Word address low byte: 40" "Word addr low byte: 40" "Addr low: 40" "AL: 40" "40"
2686-2750 eeprom24xx: word-addr: "Word address" "Word addr" "Addr" "A"
2810-2837 eeprom24xx: data-byte: "Data byte 2040: FF" "Data byte: FF" "Byte: FF" "DB: FF" "FF"
2846-2872 eeprom24xx: data-byte: "Data byte 2041: FF" "Data byte: FF" "Byte: FF" "DB: FF" "FF"
2882-2908 eeprom24xx: data-byte: "Data byte 2042: FF" "Data byte: FF" "Byte: FF" "DB: FF" "FF"
2918-2944 eeprom24xx: data-byte: "Data byte 2043: FF" "Data byte: FF" "Byte: FF" "DB: FF" "FF"
2954-2980 eeprom24xx: data-byte: "Data byte 2044: FF" "Data byte: FF" "Byte: FF" "DB: FF" "FF"
2991-3016 eeprom24xx: data-byte: "Data byte 2045: FF" "Data byte: FF" "Byte: FF" "DB: FF" "FF"
3027-3054 eeprom24xx: data-byte: "Data byte 2046: FF" "Data byte: FF" "Byte: FF" "DB: FF" "FF"
3063-3090 eeprom24xx: data-byte: "Data byte 2047: FF" "Data byte: FF" "Byte: FF" "DB: FF" "FF"
3099-3126 eeprom24xx: data-byte: "Data byte 2048: FF" "Data byte: FF" "Byte: FF" "DB: FF" "FF"
3135-3162 eeprom24xx: data-byte: "Data byte 2049: FF" "Data byte: FF" "Byte: FF" "DB: FF" "FF"
3171-3197 eeprom24xx: data-byte: "Data byte 204A: FF" "Data byte: FF" "Byte: FF" "DB: FF" "FF"
3207-3233 eeprom24xx: data-byte: "Data byte 204B: FF" "Data byte: FF" "Byte: FF" "DB: FF" "FF"
3243-3269 eeprom24xx: data-byte: "Data byte 204C: FF" "Data byte: FF" "Byte: FF" "DB: FF" "FF"
3279-3305 eeprom24xx: data-byte: "Data byte 204D: FF" "Data byte: FF" "Byte: FF" "DB: FF" "FF"
3315-3341 eeprom24xx: data-byte: "Data byte 204E: FF" "Data byte: FF" "Byte: FF" "DB: FF" "FF"
3351-3377 eeprom24xx: data-byte: "Data byte 204F: FF" "Data byte: FF" "Byte: FF" "DB: FF" "FF"
3387-3413 eeprom24xx: data-byte: "Data byte 2050: FF" "Data byte: FF" "Byte: FF" "DB: FF" "FF"
3424-3449 eeprom24xx: data-byte: "Data byte 2051: FF" "Data byte: FF" "Byte: FF" "DB: FF" "FF"
3460-3485 eeprom24xx: data-byte: "Data byte 2052: FF" "Data byte: FF" "Byte: FF" "DB: FF" "FF"
3496-3523 eeprom24xx: data-byte: "Data byte 2053: FF" "Data byte: FF" "Byte: FF" "DB: FF" "FF"
3532-3559 eeprom24xx: data-byte: "Data byte 2054: FF" "Data byte: FF" "Byte: FF" "DB: FF" "FF"
3568-3595 eeprom24xx: data-byte: "Data byte 2055: FF" "Data byte: FF" "Byte: FF" "DB: FF" "FF"
3604-3630 eeprom24xx: data-byte: "Data byte 2056: FF" "Data byte: FF" "Byte: FF" "DB: FF" "FF"
3640-3666 eeprom24xx: data-byte: "Data byte 2057: FF" "Data byte: FF" "Byte: FF" "DB: FF" "FF"
3676-3702 eeprom24xx: data-byte: "Data byte 2058: FF" "Data byte: FF" "Byte: FF" "DB: FF" "FF"
3712-3738 eeprom24xx: data-byte: "Data byte 2059: FF" "Data byte: FF" "Byte: FF" "DB: FF" "FF"
3748-3774 eeprom24xx: data-byte: "Data byte 205A: FF" "Data byte: FF" "Byte: FF" "DB: FF" "FF"
3784-3810 eeprom24xx: data-byte: "Data byte 205B: FF" "Data byte: FF" "Byte: FF" "DB: FF" "FF"
3820-3846 eeprom24xx: data-byte: "Data byte 205C: FF" "Data byte: FF" "Byte: FF" "DB: FF" "FF"
3856-3882 eeprom24xx: data-byte: "Data byte 205D: FF" "Data byte: FF" "Byte: FF" "DB: FF" "FF"
3893-3918 eeprom24xx: data-byte: "Data byte 205E: FF" "Data byte: FF" "Byte: FF" "DB: FF" "FF"
3929-3956 eeprom24xx: data-byte: "Data byte 205F: FF" "Data byte: FF" "Byte: FF" "DB: FF" "FF"
3965-3992 eeprom24xx: data-byte: "Data byte 2060: FF" "Data byte: FF" "Byte: FF" "DB: FF" "FF"
4001-4028 eeprom24xx: data-byte: "Data byte 2061: FF" "Data byte: FF" "Byte: FF" "DB: FF" "FF"
4037-4063 eeprom24xx: data-byte: "Data byte 2062: FF" "Data byte: FF" "Byte: FF" "DB: FF" "FF"
4073-4099 eeprom24xx: data-byte: "Data byte 2063: FF" "Data byte: FF" "Byte: FF" "DB: FF" "FF"
4109-4135 eeprom24xx: data-byte: "Data byte 2064: FF" "Data byte: FF" "Byte: FF" "DB: FF" "FF"
4145-4171 eeprom24xx: data-byte: "Data byte 2065: FF" "Data byte: FF" "Byte: FF" "DB: FF" "FF"
4181-4207 eeprom24xx: data-byte: "Data byte 2066: FF" "Data byte: FF" "Byte: FF" "DB: FF" "FF"
4217-4243 eeprom24xx: data-byte: "Data byte 2067: FF" "Data byte: FF" "Byte: FF" "DB: FF" "FF"
4253-4279 eeprom24xx: data-byte: "Data byte 2068: FF" "Data byte: FF" "Byte: FF" "DB: FF" "FF"
4289-4315 eeprom24xx: data-byte: "Data byte 2069: FF" "Data byte: FF" "Byte: FF" "DB: FF" "FF"
4326-4351 eeprom24xx: data-byte: "Data byte 206A: FF" "Data byte: FF" "Byte: FF" "DB: FF" "FF"
4362-4389 eeprom24xx: data-byte: "Data byte 206B: FF" "Data byte: FF" "Byte: FF" "DB: FF" "FF"
4398-4425 eeprom24xx: data-byte: "Data byte 206C: FF" "Data byte: FF" "Byte: FF" "DB: FF" "FF"
4434-4461 eeprom24xx: data-byte: "Data byte 206D: FF" "Data byte: FF" "Byte: FF" "DB: FF" "FF"
4470-4497 eeprom24xx: data-byte: "Data byte 206E: FF" "Data byte: FF" "Byte: FF" "DB: FF" "FF"
4506-4532 eeprom24xx: data-byte: "Data byte 206F: FF" "Data byte: FF" "Byte: FF" "DB: FF" "FF"
4542-4568 eeprom24xx: data-byte: "Data byte 2070: FF" "Data byte: FF" "Byte: FF" "DB: FF" "FF"
4578-4604 eeprom24xx: data-byte: "Data byte 2071: FF" "Data byte: FF" "Byte: FF" "DB: FF" "FF"
4614-4640 eeprom24xx: data-byte: "Data byte 2072: FF" "Data byte: FF" "Byte: FF" "DB: FF" "FF"
4650-4676 eeprom24xx: data-byte: "Data byte 2073: FF" "Data byte: FF" "Byte: FF" "DB: FF" "FF"
4686-4712 eeprom24xx: data-byte: "Data byte 2074: FF" "Data byte: FF" "Byte: FF" "DB: FF" "FF"
4722-4748 eeprom24xx: data-byte: "Data byte 2075: FF" "Data byte: FF" "Byte: FF" "DB: FF" "FF"
4759-4784 eeprom24xx: data-byte: "Data byte 2076: FF" "Data byte: FF" "Byte: FF" "DB: FF" "FF"
4795-4820 eeprom24xx: data-byte: "Data byte 2077: FF" "Data byte: FF" "Byte: FF" "DB: FF" "FF"
4831-4858 eeprom24xx: data-byte: "Data byte 2078: FF" "Data byte: FF" "Byte: FF" "DB: FF" "FF"
4867-4894 eeprom24xx: data-byte: "Data byte 2079: FF" "Data byte: FF" "Byte: FF" "DB: FF" "FF"
4903-4930 eeprom24xx: data-byte: "Data byte 207A: FF" "Data byte: FF" "Byte: FF" "DB: FF" "FF"
4939-4965 eeprom24xx: data-byte: "Data byte 207B: FF" "Data byte: FF" "Byte: FF" "DB: FF" "FF"
4975-5001 eeprom24xx: data-byte: "Data byte 207C: FF" "Data byte: FF" "Byte: FF" "DB: FF" "FF"
5011-5037 eeprom24xx: data-byte: "Data byte 207D: FF" "Data byte: FF" "Byte: FF" "DB: FF" "FF"
5047-5073 eeprom24xx: data-byte: "Data byte 207E: FF" "Data byte: FF" "Byte: FF" "DB: FF" "FF"
5084-5109 eeprom24xx: data-byte: "Data byte 207F: FF" "Data byte: FF" "Byte: FF" "DB: FF" "FF"
2810-5109 eeprom24xx: data: "Data" "D"
2639-5122 eeprom24xx: seq-random-read: "Sequential random read (addr=2040, 64 bytes): FF FF FF FF FF FF FF FF FF FF FF FF FF FF FF FF FF FF FF FF FF FF FF FF FF FF FF FF FF FF FF FF FF FF FF FF FF FF FF FF FF FF FF FF FF FF FF FF FF FF FF FF FF FF FF FF FF FF FF FF FF FF FF FF" "Sequential random read (addr=2040, 64 bytes)" "Sequential random read" "SRR" "S"
5181-5194 eeprom24xx: control-code: "Control code bits: 1010" "Control code: 1010" "Ctrl code: 1010" "Ctrl code" "Ctrl" "C"
5194-5197 eeprom24xx: address-pin: "Address bit 2: 0" "Addr bit 2" "A2" "A"
5197-5200 eeprom24xx: address-pin: "Address bit 1: 0" "Addr bit 1" "A1" "A"
5200-5204 eeprom24xx: address-pin: "Address bit 0: 1" "Addr bit 0" "A0" "A"
5204-5208 eeprom24xx: rw-bit: "R/W bit: write" "R/W" "RW" "W"
5181-5208 eeprom24xx: control-word: "Control word" "Control" "CW" "C"
5307-5321 eeprom24xx: control-code: "Control code bits: 1010" "Control code: 1010" "Ctrl code: 1010" "Ctrl code" "Ctrl" "C"
5321-5324 eeprom24xx: address-pin: "Address bit 2: 0" "Addr bit 2" "A2" "A"
5324-5327 eeprom24xx: address-pin: "Address bit 1: 0" "Addr bit 1" "A1" "A"
5327-5330 eeprom24xx: address-pin: "Address bit 0: 1" "Addr bit 0" "A0" "A"
5330-5333 eeprom24xx: rw-bit: "R/W bit: read" "R/W" "RW" "R"
5307-5333 eeprom24xx: control-word: "Control word" "Control" "CW" "C"
5225-5250 eeprom24xx: word-addr-byte: "Word address high byte: 20" "Word addr high byte: 20" "Addr high: 20" "AH: 20" "20"
5263-5290 eeprom24xx: word-addr-byte: "Word address low byte: 80" "Word addr low byte: 80" "Addr low: 80" "AL: 80" "80"
5225-5290 eeprom24xx: word-addr: "Word address" "Word addr" "Addr" "A"
5348-5375 eeprom24xx: data-byte: "Data byte 2080: FF" "Data byte: FF" "Byte: FF" "DB: FF" "FF"
5384-5410 eeprom24xx: data-byte: "Data byte 2081: FF" "Data byte: FF" "Byte: FF" "DB: FF" "FF"
5421-5446 eeprom24xx: data-byte: "Data byte 2082: FF" "Data byte: FF" "Byte: FF" "DB: FF" "FF"
5457-5482 eeprom24xx: data-byte: "Data byte 2083: FF" "Data byte: FF" "Byte: FF" "DB: FF" "FF"
5493-5520 eeprom24xx: data-byte: "Data byte 2084: FF" "Data byte: FF" "Byte: FF" "DB: FF" "FF"
5529-5556 eeprom24xx: data-byte: "Data byte 2085: FF" "Data byte: FF" "Byte: FF" "DB: FF" "FF"
5565-5592 eeprom24xx: data-byte: "Data byte 2086: FF" "Data byte: FF" "Byte: FF" "DB: FF" "FF"
5601-5627 eeprom24xx: data-byte: "Data byte 2087: FF" "Data byte: FF" "Byte: FF" "DB: FF" "FF"
5637-5663 eeprom24xx: data-byte: "Data byte 2088: FF" "Data byte: FF" "Byte: FF" "DB: FF" "FF"
5673-5699 eeprom24xx: data-byte: "Data byte 2089: FF" "Data byte: FF" "Byte: FF" "DB: FF" "FF"
5709-5735 eeprom24xx: data-byte: "Data byte 208A: FF" "Data byte: FF" "Byte: FF" "DB: FF" "FF"
5745-5771 eeprom24xx: data-byte: "Data byte 208B: FF" "Data byte: FF" "Byte: FF" "DB: FF" "FF"
5781-5807 eeprom24xx: data-byte: "Data byte 208C: FF" "Data byte: FF" "Byte: FF" "DB: FF" "FF"
5817-5843 eeprom24xx: data-byte: "Data byte 208D: FF" "Data byte: FF" "Byte: FF" "DB: FF" "FF"
5853-5879 eeprom24xx: data-byte: "Data byte 208E: FF" "Data byte: FF" "Byte: FF" "DB: FF" "FF"
5890-5915 eeprom24xx: data-byte: "Data byte 208F: FF" "Data byte: FF" "Byte: FF" "DB: FF" "FF"
5926-5953 eeprom24xx: data-byte: "Data byte 2090: FF" "Data byte: FF" "Byte: FF" "DB: FF" "FF"
5962-5989 eeprom24xx: data-byte: "Data byte 2091: FF" "Data byte: FF" "Byte: FF" "DB: FF" "FF"
5998-6025 eeprom24xx: data-byte: "Data byte 2092: FF" "Data byte: FF" "Byte: FF" "DB: FF" "FF"
6034-6061 eeprom24xx: data-byte: "Data byte 2093: FF" "Data byte: FF" "Byte: FF" "DB: FF" "FF"
6070-6096 eeprom24xx: data-byte: "Data byte 2094: FF" "Data byte: FF" "Byte: FF" "DB: FF" "FF"
6106-6132 eeprom24xx: data-byte: "Data byte 2095: FF" "Data byte: FF" "Byte: FF" "DB: FF" "FF"
6142-6168 eeprom24xx: data-byte: "Data byte 2096: FF" "Data byte: FF" "Byte: FF" "DB: FF" "FF"
6178-6204 eeprom24xx: data-byte: "Data byte 2097: FF" "Data byte: FF" "Byte: FF" "DB: FF" "FF"
6214-6240 eeprom24xx: data-byte: "Data byte 2098: FF" "Data byte: FF" "Byte: FF" "DB: FF" "FF"
6250-6276 eeprom24xx: data-byte: "Data byte 2099: FF" "Data byte: FF" "Byte: FF" "DB: FF" "FF"
6286-6312 eeprom24xx: data-byte: "Data byte 209A: FF" "Data byte: FF" "Byte: FF" "DB: FF" "FF"
6323-6348 eeprom24xx: data-byte: "Data byte 209B: FF" "Data byte: FF" "Byte: FF" "DB: FF" "FF"
6359-6384 eeprom24xx: data-byte: "Data byte 209C: FF" "Data byte: FF" "Byte: FF" "DB: FF" "FF"
6395-6422 eeprom24xx: data-byte: "Data byte 209D: FF" "Data byte: FF" "Byte: FF" "DB: FF" "FF"
6431-6458 eeprom24xx: data-byte: "Data byte 209E: FF" "Data byte: FF" "Byte: FF" "DB: FF" "FF"
6467-6494 eeprom24xx: data-byte: "Data byte 209F: FF" "Data byte: FF" "Byte: FF" "DB: FF" "FF"
6503-6529 eeprom24xx: data-byte: "Data byte 20A0: FF" "Data byte: FF" "Byte: FF" "DB: FF" "FF"
6539-6565 eeprom24xx: data-byte: "Data byte 20A1: FF" "Data byte: FF" "Byte: FF" "DB: FF" "FF"
6575-6601 eeprom24xx: data-byte: "Data byte 20A2: FF" "Data byte: FF" "Byte: FF" "DB: FF" "FF"
6611-6637 eeprom24xx: data-byte: "Data byte 20A3: FF" "Data byte: FF" "Byte: FF" "DB: FF" "FF"
6647-6673 eeprom24xx: data-byte: "Data byte 20A4: FF" "Data byte: FF" "Byte: FF" "DB: FF" "FF"
6683-6709 eeprom24xx: data-byte: "Data byte 20A5: FF" "Data byte: FF" "Byte: FF" "DB: FF" "FF"
6719-6745 eeprom24xx: data-byte: "Data byte 20A6: FF" "Data byte: FF" "Byte: FF" "DB: FF" "FF"
6756-6781 eeprom24xx: data-byte: "Data byte 20A7: FF" "Data byte: FF" "Byte: FF" "DB: FF" "FF"
6792-6817 eeprom24xx: data-byte: "Data byte 20A8: FF" "Data byte: FF" "Byte: FF" "DB: FF" "FF"
6828-6855 eeprom24xx: data-byte: "Data byte 20A9: FF" "Data byte: FF" "Byte: FF" "DB: FF" "FF"
6864-6891 eeprom24xx: data-byte: "Data byte 20AA: FF" "Data byte: FF" "Byte: FF" "DB: FF" "FF"
6900-6927 eeprom24xx: data-byte: "Data byte 20AB: FF" "Data byte: FF" "Byte: FF" "DB: FF" "FF"
6936-6962 eeprom24xx: data-byte: "Data byte 20AC: FF" "Data byte: FF" "Byte: FF" "DB: FF" "FF"
6972-6998 eeprom24xx: data-byte: "Data byte 20AD: FF" "Data byte: FF" "Byte: FF" "DB: FF" "FF"
7008-7034 eeprom24xx: data-byte: "Data byte 20AE: FF" "Data byte: FF" "Byte: FF" "DB: FF" "FF"
7044-7070 eeprom24xx: data-byte: "Data byte 20AF: FF" "Data byte: FF" "Byte: FF" "DB: FF" "FF"
7080-7106 eeprom24xx: data-byte: "Data byte 20B0: FF" "Data byte: FF" "Byte: FF" "DB: FF" "FF"
7116-7142 eeprom24xx: data-byte: "Data byte 20B1: FF" "Data byte: FF" "Byte: FF" "DB: FF" "FF"
7152-7178 eeprom24xx: data-byte: "Data byte 20B2: FF" "Data byte: FF" "Byte: FF" "DB: FF" "FF"
7188-7214 eeprom24xx: data-byte: "Data byte 20B3: FF" "Data byte: FF" "Byte: FF" "DB: FF" "FF"
7225-7250 eeprom24xx: data-byte: "Data byte 20B4: FF" "Data byte: FF" "Byte: FF" "DB: FF" "FF"
7261-7288 eeprom24xx: data-byte: "Data byte 20B5: FF" "Data byte: FF" "Byte: FF" "DB: FF" "FF"
7297-7324 eeprom24xx: data-byte: "Data byte 20B6: FF" "Data byte: FF" "Byte: FF" "DB: FF" "FF"
7333-7360 eeprom24xx: data-byte: "Data byte 20B7: FF" "Data byte: FF" "Byte: FF" "DB: FF" "FF"
7369-7395 eeprom24xx: data-byte: "Data byte 20B8: FF" "Data byte: FF" "Byte: FF" "DB: FF" "FF"
7405-7431 eeprom24xx: data-byte: "Data byte 20B9: FF" "Data byte: FF" "Byte: FF" "DB: FF" "FF"
7441-7467 eeprom24xx: data-byte: "Data byte 20BA: FF" "Data byte: FF" "Byte: FF" "DB: FF" "FF"
7477-7503 eeprom24xx: data-byte: "Data byte 20BB: FF" "Data byte: FF" "Byte: FF" "DB: FF" "FF"
7513-7539 eeprom24xx: data-byte: "Data byte 20BC: FF" "Data byte: FF" "Byte: FF" "DB: FF" "FF"
7549-7575 eeprom24xx: data-byte: "Data byte 20BD: FF" "Data byte: FF" "Byte: FF" "DB: FF" "FF"
7585-7611 eeprom24xx: data-byte: "Data byte 20BE: FF" "Data byte: FF" "Byte: FF" "DB: FF" "FF"
7622-7649 eeprom24xx: data-byte: "Data byte 20BF: FF" "Data byte: FF" "Byte: FF" "DB: FF" "FF"
5348-7649 eeprom24xx: data: "Data" "D"
5178-7660 eeprom24xx: seq-random-read: "Sequential random read (addr=2080, 64 bytes): FF FF FF FF FF FF FF FF FF FF FF FF FF FF FF FF FF FF FF FF FF FF FF FF FF FF FF FF FF FF FF FF FF FF FF FF FF FF FF FF FF FF FF FF FF FF FF FF FF FF FF FF FF FF FF FF FF FF FF FF FF FF FF FF" "Sequential random read (addr=2080, 64 bytes)" "Sequential random read" "SRR" "S"
7702-7715 eeprom24xx: control-code: "Control code bits: 1010" "Control code: 1010" "Ctrl code: 1010" "Ctrl code" "Ctrl" "C"
7715-7718 eeprom24xx: address-pin: "Address bit 2: 0" "Addr bit 2" "A2" "A"
7718-7721 eeprom24xx: address-pin: "Address bit 1: 0" "Addr bit 1" "A1" "A"
7721-7725 eeprom24xx: address-pin: "Address bit 0: 1" "Addr bit 0" "A0" "A"
7725-7729 eeprom24xx: rw-bit: "R/W bit: write" "R/W" "RW" "W"
7702-7729 eeprom24xx: control-word: "Control word" "Control" "CW" "C"
7829-7842 eeprom24xx: control-code: "Control code bits: 1010" "Control code: 1010" "Ctrl code: 1010" "Ctrl code" "Ctrl" "C"
7842-7845 eeprom24xx: address-pin: "Address bit 2: 0" "Addr bit 2" "A2" "A"
7845-7848 eeprom24xx: address-pin: "Address bit 1: 0" "Addr bit 1" "A1" "A"
7848-7851 eeprom24xx: address-pin: "Address bit 0: 1" "Addr bit 0" "A0" "A"
7851-7854 eeprom24xx: rw-bit: "R/W bit: read" "R/W" "RW" "R"
7829-7854 eeprom24xx: control-word: "Control word" "Control" "CW" "C"
7746-7771 eeprom24xx: word-addr-byte: "Word address high byte: 20" "Word addr high byte: 20" "Addr high: 20" "AH: 20" "20"
7784-7811 eeprom24xx: word-addr-byte: "Word address low byte: C0" "Word addr low byte: C0" "Addr low: C0" "AL: C0" "C0"
7746-7811 eeprom24xx: word-addr: "Word address" "Word addr" "Addr" "A"
7869-7896 eeprom24xx: data-byte: "Data byte 20C0: FF" "Data byte: FF" "Byte: FF" "DB: FF" "FF"
7905-7931 eeprom24xx: data-byte: "Data byte 20C1: FF" "Data byte: FF" "Byte: FF" "DB: FF" "FF"
7942-7967 eeprom24xx: data-byte: "Data byte 20C2: FF" "Data byte: FF" "Byte: FF" "DB: FF" "FF"
7978-8003 eeprom24xx: data-byte: "Data byte 20C3: FF" "Data byte: FF" "Byte: FF" "DB: FF" "FF"
8014-8041 eeprom24xx: data-byte: "Data byte 20C4: FF" "Data byte: FF" "Byte: FF" "DB: FF" "FF"
8050-8077 eeprom24xx: data-byte: "Data byte 20C5: FF" "Data byte: FF" "Byte: FF" "DB: FF" "FF"
8086-8113 eeprom24xx: data-byte: "Data byte 20C6: FF" "Data byte: FF" "Byte: FF" "DB: FF" "FF"
8122-8148 eeprom24xx: data-byte: "Data byte 20C7: FF" "Data byte: FF" "Byte: FF" "DB: FF" "FF"
8158-8184 eeprom24xx: data-byte: "Data byte 20C8: FF" "Data byte: FF" "Byte: FF" "DB: FF" "FF"
8194-8220 eeprom24xx: data-byte: "Data byte 20C9: FF" "Data byte: FF" "Byte: FF" "DB: FF" "FF"
8230-8256 eeprom24xx: data-byte: "Data byte 20CA: FF" "Data byte: FF" "Byte: FF" "DB: FF" "FF"
8266-8292 eeprom24xx: data-byte: "Data byte 20CB: FF" "Data byte: FF" "Byte: FF" "DB: FF" "FF"
8302-8328 eeprom24xx: data-byte: "Data byte 20CC: FF" "Data byte: FF" "Byte: FF" "DB: FF" "FF"
8338-8364 eeprom24xx: data-byte: "Data byte 20CD: FF" "Data byte: FF" "Byte: FF" "DB: FF" "FF"
8375-8400 eeprom24xx: data-byte: "Data byte 20CE: FF" "Data byte: FF" "Byte: FF" "DB: FF" "FF"
8411-8436 eeprom24xx: data-byte: "Data byte 20CF: FF" "Data byte: FF" "Byte: FF" "DB: FF" "FF"
8447-8474 eeprom24xx: data-byte: "Data byte 20D0: FF" "Data byte: FF" "Byte: FF" "DB: FF" "FF"
8483-8510 eeprom24xx: data-byte: "Data byte 20D1: FF" "Data byte: FF" "Byte: FF" "DB: FF" "FF"
8519-8546 eeprom24xx: data-byte: "Data byte 20D2: FF" "Data byte: FF" "Byte: FF" "DB: FF" "FF"
8555-8581 eeprom24xx: data-byte: "Data byte 20D3: FF" "Data byte: FF" "Byte: FF" "DB: FF" "FF"
8591-8617 eeprom24xx: data-byte: "Data byte 20D4: FF" "Data byte: FF" "Byte: FF" "DB: FF" "FF"
8627-8653 eeprom24xx: data-byte: "Data byte 20D5: FF" "Data byte: FF" "Byte: FF" "DB: FF" "FF"
8663-8689 eeprom24xx: data-byte: "Data byte 20D6: FF" "Data byte: FF" "Byte: FF" "DB: FF" "FF"
8704-8730 eeprom24xx: data-byte: "Data byte 20D7: FF" "Data byte: FF" "Byte: FF" "DB: FF" "FF"
8740-8766 eeprom24xx: data-byte: "Data byte 20D8: FF" "Data byte: FF" "Byte: FF" "DB: FF" "FF"
8776-8802 eeprom24xx: data-byte: "Data byte 20D9: FF" "Data byte: FF" "Byte: FF" "DB: FF" "FF"
8813-8838 eeprom24xx: data-byte: "Data byte 20DA: FF" "Data byte: FF" "Byte: FF" "DB: FF" "FF"
8849-8874 eeprom24xx: data-byte: "Data byte 20DB: FF" "Data byte: FF" "Byte: FF" "DB: FF" "FF"
8885-8912 eeprom24xx: data-byte: "Data byte 20DC: FF" "Data byte: FF" "Byte: FF" "DB: FF" "FF"
8921-8948 eeprom24xx: data-byte: "Data byte 20DD: FF" "Data byte: FF" "Byte: FF" "DB: FF" "FF"
8957-8984 eeprom24xx: data-byte: "Data byte 20DE: FF" "Data byte: FF" "Byte: FF" "DB: FF" "FF"
8993-9020 eeprom24xx: data-byte: "Data byte 20DF: FF" "Data byte: FF" "Byte: FF" "DB: FF" "FF"
9029-9055 eeprom24xx: data-byte: "Data byte 20E0: FF" "Data byte: FF" "Byte: FF" "DB: FF" "FF"
9065-9091 eeprom24xx: data-byte: "Data byte 20E1: FF" "Data byte: FF" "Byte: FF" "DB: FF" "FF"
9101-9127 eeprom24xx: data-byte: "Data byte 20E2: FF" "Data byte: FF" "Byte: FF" "DB: FF" "FF"
7869-9127 eeprom24xx: data: "Data" "D"
7699-9140 eeprom24xx: seq-random-read: "Sequential random read (addr=20C0, 35 bytes): FF FF FF FF FF FF FF FF FF FF FF FF FF FF FF FF FF FF FF FF FF FF FF FF FF FF FF FF FF FF FF FF FF FF FF" "Sequential random read (addr=20C0, 35 bytes)" "Sequential random read" "SRR" "S"
11649-11662 eeprom24xx: control-code: "Control code bits: 1010" "Control code: 1010" "Ctrl code: 1010" "Ctrl code" "Ctrl" "C"
11662-11665 eeprom24xx: address-pin: "Address bit 2: 0" "Addr bit 2" "A2" "A"
11665-11668 eeprom24xx: address-pin: "Address bit 1: 0" "Addr bit 1" "A1" "A"
11668-11672 eeprom24xx: address-pin: "Address bit 0: 1" "Addr bit 0" "A0" "A"
11672-11676 eeprom24xx: rw-bit: "R/W bit: write" "R/W" "RW" "W"
11649-11676 eeprom24xx: control-word: "Control word" "Control" "CW" "C"
11705-11730 eeprom24xx: word-addr-byte: "Word address high byte: 00" "Word addr high byte: 00" "Addr high: 00" "AH: 00" "00"
11743-11770 eeprom24xx: word-addr-byte: "Word address low byte: 4C" "Word addr low byte: 4C" "Addr low: 4C" "AL: 4C" "4C"
11705-11770 eeprom24xx: word-addr: "Word address" "Word addr" "Addr" "A"
11803-11830 eeprom24xx: data-byte: "Data byte 004C: 00" "Data byte: 00" "Byte: 00" "DB: 00" "00"
11840-11866 eeprom24xx: data-byte: "Data byte 004D: 06" "Data byte: 06" "Byte: 06" "DB: 06" "06"
11877-11903 eeprom24xx: data-byte: "Data byte 004E: 00" "Data byte: 00" "Byte: 00" "DB: 00" "00"
11915-11940 eeprom24xx: data-byte: "Data byte 004F: 00" "Data byte: 00" "Byte: 00" "DB: 00" "00"
11952-11979 eeprom24xx: data-byte: "Data byte 0050: 02" "Data byte: 02" "Byte: 02" "DB: 02" "02"
11989-12015 eeprom24xx: data-byte: "Data byte 0051: 00" "Data byte: 00" "Byte: 00" "DB: 00" "00"
12026-12052 eeprom24xx: data-byte: "Data byte 0052: 69" "Data byte: 69" "Byte: 69" "DB: 69" "69"
12064-12089 eeprom24xx: data-byte: "Data byte 0053: 02" "Data byte: 02" "Byte: 02" "DB: 02" "02"
12101-12128 eeprom24xx: data-byte: "Data byte 0054: 07" "Data byte: 07" "Byte: 07" "DB: 07" "07"
12138-12164 eeprom24xx: data-byte: "Data byte 0055: B6" "Data byte: B6" "Byte: B6" "DB: B6" "B6"
12175-12201 eeprom24xx: data-byte: "Data byte 0056: 00" "Data byte: 00" "Byte: 00" "DB: 00" "00"
12212-12238 eeprom24xx: data-byte: "Data byte 0057: 03" "Data byte: 03" "Byte: 03" "DB: 03" "03"
12250-12277 eeprom24xx: data-byte: "Data byte 0058: 00" "Data byte: 00" "Byte: 00" "DB: 00" "00"
12287-12313 eeprom24xx: data-byte: "Data byte 0059: 0B" "Data byte: 0B" "Byte: 0B" "DB: 0B" "0B"
12324-12350 eeprom24xx: data-byte: "Data byte 005A: 02" "Data byte: 02" "Byte: 02" "DB: 02" "02"
12361-12387 eeprom24xx: data-byte: "Data byte 005B: 1D" "Data byte: 1D" "Byte: 1D" "DB: 1D" "1D"
12399-12426 eeprom24xx: data-byte: "Data byte 005C: 14" "Data byte: 14" "Byte: 14" "DB: 14" "14"
12436-12462 eeprom24xx: data-byte: "Data byte 005D: 00" "Data byte: 00" "Byte: 00" "DB: 00" "00"
12473-12499 eeprom24xx: data-byte: "Data byte 005E: 03" "Data byte: 03" "Byte: 03" "DB: 03" "03"
12510-12536 eeprom24xx: data-byte: "Data byte 005F: 00" "Data byte: 00" "Byte: 00" "DB: 00" "00"
12548-12575 eeprom24xx: data-byte: "Data byte 0060: 13" "Data byte: 13" "Byte: 13" "DB: 13" "13"
12585-12611 eeprom24xx: data-byte: "Data byte 0061: 02" "Data byte: 02" "Byte: 02" "DB: 02" "02"
12622-12648 eeprom24xx: data-byte: "Data byte 0062: 1C" "Data byte: 1C" "Byte: 1C" "DB: 1C" "1C"
12659-12685 eeprom24xx: data-byte: "Data byte 0063: CF" "Data byte: CF" "Byte: CF" "DB: CF" "CF"
12697-12724 eeprom24xx: data-byte: "Data byte 0064: 00" "Data byte: 00" "Byte: 00" "DB: 00" "00"
12734-12760 eeprom24xx: data-byte: "Data byte 0065: 03" "Data byte: 03" "Byte: 03" "DB: 03" "03"
12771-12797 eeprom24xx: data-byte: "Data byte 0066: 00" "Data byte: 00" "Byte: 00" "DB: 00" "00"
12808-12834 eeprom24xx: data-byte: "Data byte 0067: 1B" "Data byte: 1B" "Byte: 1B" "DB: 1B" "1B"
12846-12873 eeprom24xx: data-byte: "Data byte 0068: 02" "Data byte: 02" "Byte: 02" "DB: 02" "02"
12883-12909 eeprom24xx: data-byte: "Data byte 0069: 1D" "Data byte: 1D" "Byte: 1D" "DB: 1D" "1D"
12920-12946 eeprom24xx: data-byte: "Data byte 006A: 32" "Data byte: 32" "Byte: 32" "DB: 32" "32"
12957-12983 eeprom24xx: data-byte: "Data byte 006B: 00" "Data byte: 00" "Byte: 00" "DB: 00" "00"
12995-13022 eeprom24xx: data-byte: "Data byte 006C: 03" "Data byte: 03" "Byte: 03" "DB: 03" "03"
13032-13058 eeprom24xx: data-byte: "Data byte 006D: 00" "Data byte: 00" "Byte: 00" "DB: 00" "00"
13069-13095 eeprom24xx: data-byte: "Data byte 006E: 23" "Data byte: 23" "Byte: 23" "DB: 23" "23"
13106-13132 eeprom24xx: data-byte: "Data byte 006F: 02" "Data byte: 02" "Byte: 02" "DB: 02" "02"
13144-13171 eeprom24xx: data-byte: "Data byte 0070: 1E" "Data byte: 1E" "Byte: 1E" "DB: 1E" "1E"
13181-13207 eeprom24xx: data-byte: "Data byte 0071: 37" "Data byte: 37" "Byte: 37" "DB: 37" "37"
13218-13244 eeprom24xx: data-byte: "Data byte 0072: 00" "Data byte: 00" "Byte: 00" "DB: 00" "00"
13255-13281 eeprom24xx: data-byte: "Data byte 0073: 03" "Data byte: 03" "Byte: 03" "DB: 03" "03"
13293-13320 eeprom24xx: data-byte: "Data byte 0074: 00" "Data byte: 00" "Byte: 00" "DB: 00" "00"
13330-13356 eeprom24xx: data-byte: "Data byte 0075: 2B" "Data byte: 2B" "Byte: 2B" "DB: 2B" "2B"
13367-13393 eeprom24xx: data-byte: "Data byte 0076: 02" "Data byte: 02" "Byte: 02" "DB: 02" "02"
13404-13430 eeprom24xx: data-byte: "Data byte 0077: 07" "Data byte: 07" "Byte: 07" "DB: 07" "07"
13442-13469 eeprom24xx: data-byte: "Data byte 0078: E0" "Data byte: E0" "Byte: E0" "DB: E0" "E0"
13479-13505 eeprom24xx: data-byte: "Data byte 0079: 00" "Data byte: 00" "Byte: 00" "DB: 00" "00"
13516-13542 eeprom24xx: data-byte: "Data byte 007A: 03" "Data byte: 03" "Byte: 03" "DB: 03" "03"
13553-13579 eeprom24xx: data-byte: "Data byte 007B: 00" "Data byte: 00" "Byte: 00" "DB: 00" "00"
13591-13618 eeprom24xx: data-byte: "Data byte 007C: 33" "Data byte: 33" "Byte: 33" "DB: 33" "33"
13628-13654 eeprom24xx: data-byte: "Data byte 007D: 02" "Data byte: 02" "Byte: 02" "DB: 02" "02"
13665-13691 eeprom24xx: data-byte: "Data byte 007E: 1D" "Data byte: 1D" "Byte: 1D" "DB: 1D" "1D"
13702-13728 eeprom24xx: data-byte: "Data byte 007F: 34" "Data byte: 34" "Byte: 34" "DB: 34" "34"
11803-13728 eeprom24xx: data: "Data" "D"
11646-13744 eeprom24xx: page-write: "Page write (addr=004C, 52 bytes): 00 06 00 00 02 00 69 02 07 B6 00 03 00 0B 02 1D 14 00 03 00 13 02 1C CF 00 03 00 1B 02 1D 32 00 03 00 23 02 1E 37 00 03 00 2B 02 07 E0 00 03 00 33 02 1D 34" "Page write (addr=004C, 52 bytes)" "Page write" "PW" "P"
13755-13768 eeprom24xx: control-code: "Control code bits: 1010" "Control code: 1010" "Ctrl code: 1010" "Ctrl code" "Ctrl" "C"
13768-13771 eeprom24xx: address-pin: "Address bit 2: 0" "Addr bit 2" "A2" "A"
13771-13774 eeprom24xx: address-pin: "Address bit 1: 0" "Addr bit 1" "A1" "A"
13774-13777 eeprom24xx: address-pin: "Address bit 0: 1" "Addr bit 0" "A0" "A"
13777-13780 eeprom24xx: rw-bit: "R/W bit: write" "R/W" "RW" "W"
13755-13780 eeprom24xx: control-word: "Control word" "Control" "CW" "C"
13751-13784 eeprom24xx: warning: "Warning: No reply from slave!"
13797-13810 eeprom24xx: control-code: "Control code bits: 1010" "Control code: 1010" "Ctrl code: 1010" "Ctrl code" "Ctrl" "C"
13810-13813 eeprom24xx: address-pin: "Address bit 2: 0" "Addr bit 2" "A2" "A"
13813-13816 eeprom24xx: address-pin: "Address bit 1: 0" "Addr bit 1" "A1" "A"
13816-13820 eeprom24xx: address-pin: "Address bit 0: 1" "Addr bit 0" "A0" "A"
13820-13824 eeprom24xx: rw-bit: "R/W bit: write" "R/W" "RW" "W"
13797-13824 eeprom24xx: control-word: "Control word" "Control" "CW" "C"
13794-13827 eeprom24xx: warning: "Warning: No reply from slave!"
13840-13853 eeprom24xx: control-code: "Control code bits: 1010" "Control code: 1010" "Ctrl code: 1010" "Ctrl code" "Ctrl" "C"
13853-13856 eeprom24xx: address-pin: "Address bit 2: 0" "Addr bit 2" "A2" "A"
13856-13859 eeprom24xx: address-pin: "Address bit 1: 0" "Addr bit 1" "A1" "A"
13859-13863 eeprom24xx: address-pin: "Address bit 0: 1" "Addr bit 0" "A0" "A"
13863-13867 eeprom24xx: rw-bit: "R/W bit: write" "R/W" "RW" "W"
13840-13867 eeprom24xx: control-word: "Control word" "Control" "CW" "C"
13837-13870 eeprom24xx: warning: "Warning: No reply from slave!"
13883-13896 eeprom24xx: control-code: "Control code bits: 1010" "Control code: 1010" "Ctrl code: 1010" "Ctrl code" "Ctrl" "C"
13896-13899 eeprom24xx: address-pin: "Address bit 2: 0" "Addr bit 2" "A2" "A"
13899-13902 eeprom24xx: address-pin: "Address bit 1: 0" "Addr bit 1" "A1" "A"
13902-13906 eeprom24xx: address-pin: "Address bit 0: 1" "Addr bit 0" "A0" "A"
13906-13910 eeprom24xx: rw-bit: "R/W bit: write" "R/W" "RW" "W"
13883-13910 eeprom24xx: control-word: "Control word" "Control" "CW" "C"
13880-13913 eeprom24xx: warning: "Warning: No reply from slave!"
13926-13939 eeprom24xx: control-code: "Control code bits: 1010" "Control code: 1010" "Ctrl code: 1010" "Ctrl code" "Ctrl" "C"
13939-13942 eeprom24xx: address-pin: "Address bit 2: 0" "Addr bit 2" "A2" "A"
13942-13945 eeprom24xx: address-pin: "Address bit 1: 0" "Addr bit 1" "A1" "A"
13945-13949 eeprom24xx: address-pin: "Address bit 0: 1" "Addr bit 0" "A0" "A"
13949-13953 eeprom24xx: rw-bit: "R/W bit: write" "R/W" "RW" "W"
13926-13953 eeprom24xx: control-word: "Control word" "Control" "CW" "C"
13923-13956 eeprom24xx: warning: "Warning: No reply from slave!"
13969-13982 eeprom24xx: control-code: "Control code bits: 1010" "Control code: 1010" "Ctrl code: 1010" "Ctrl code" "Ctrl" "C"
13982-13985 eeprom24xx: address-pin: "Address bit 2: 0" "Addr bit 2" "A2" "A"
13985-13988 eeprom24xx: address-pin: "Address bit 1: 0" "Addr bit 1" "A1" "A"
13988-13991 eeprom24xx: address-pin: "Address bit 0: 1" "Addr bit 0" "A0" "A"
13991-13994 eeprom24xx: rw-bit: "R/W bit: write" "R/W" "RW" "W"
13969-13994 eeprom24xx: control-word: "Control word" "Control" "CW" "C"
13965-13998 eeprom24xx: warning: "Warning: No reply from slave!"
14011-14025 eeprom24xx: control-code: "Control code bits: 1010" "Control code: 1010" "Ctrl code: 1010" "Ctrl code" "Ctrl" "C"
14025-14028 eeprom24xx: address-pin: "Address bit 2: 0" "Addr bit 2" "A2" "A"
14028-14031 eeprom24xx: address-pin: "Address bit 1: 0" "Addr bit 1" "A1" "A"
14031-14034 eeprom24xx: address-pin: "Address bit 0: 1" "Addr bit 0" "A0" "A"
14034-14037 eeprom24xx: rw-bit: "R/W bit: write" "R/W" "RW" "W"
14011-14037 eeprom24xx: control-word: "Control word" "Control" "CW" "C"
14008-14041 eeprom24xx: warning: "Warning: No reply from slave!"
14054-14067 eeprom24xx: control-code: "Control code bits: 1010" "Control code: 1010" "Ctrl code: 1010" "Ctrl code" "Ctrl" "C"
14067-14071 eeprom24xx: address-pin: "Address bit 2: 0" "Addr bit 2" "A2" "A"
14071-14074 eeprom24xx: address-pin: "Address bit 1: 0" "Addr bit 1" "A1" "A"
14074-14077 eeprom24xx: address-pin: "Address bit 0: 1" "Addr bit 0" "A0" "A"
14077-14080 eeprom24xx: rw-bit: "R/W bit: write" "R/W" "RW" "W"
14054-14080 eeprom24xx: control-word: "Control word" "Control" "CW" "C"
14051-14083 eeprom24xx: warning: "Warning: No reply from slave!"
14097-14110 eeprom24xx: control-code: "Control code bits: 1010" "Control code: 1010" "Ctrl code: 1010" "Ctrl code" "Ctrl" "C"
14110-14114 eeprom24xx: address-pin: "Address bit 2: 0" "Addr bit 2" "A2" "A"
14114-14117 eeprom24xx: address-pin: "Address bit 1: 0" "Addr bit 1" "A1" "A"
14117-14120 eeprom24xx: address-pin: "Address bit 0: 1" "Addr bit 0" "A0" "A"
14120-14123 eeprom24xx: rw-bit: "R/W bit: write" "R/W" "RW" "W"
14097-14123 eeprom24xx: control-word: "Control word" "Control" "CW" "C"
14094-14126 eeprom24xx: warning: "Warning: No reply from slave!"
14140-14153 eeprom24xx: control-code: "Control code bits: 1010" "Control code: 1010" "Ctrl code: 1010" "Ctrl code" "Ctrl" "C"
14153-14157 eeprom24xx: address-pin: "Address bit 2: 0" "Addr bit 2" "A2" "A"
14157-14160 eeprom24xx: address-pin: "Address bit 1: 0" "Addr bit 1" "A1" "A"
14160-14163 eeprom24xx: address-pin: "Address bit 0: 1" "Addr bit 0" "A0" "A"
14163-14166 eeprom24xx: rw-bit: "R/W bit: write" "R/W" "RW" "W"
14140-14166 eeprom24xx: control-word: "Control word" "Control" "CW" "C"
14137-14169 eeprom24xx: warning: "Warning: No reply from slave!"
14183-14196 eeprom24xx: control-code: "Control code bits: 1010" "Control code: 1010" "Ctrl code: 1010" "Ctrl code" "Ctrl" "C"
14196-14199 eeprom24xx: address-pin: "Address bit 2: 0" "Addr bit 2" "A2" "A"
14199-14203 eeprom24xx: address-pin: "Address bit 1: 0" "Addr bit 1" "A1" "A"
14203-14206 eeprom24xx: address-pin: "Address bit 0: 1" "Addr bit 0" "A0" "A"
14206-14209 eeprom24xx: rw-bit: "R/W bit: write" "R/W" "RW" "W"
14183-14209 eeprom24xx: control-word: "Control word" "Control" "CW" "C"
14180-14212 eeprom24xx: warning: "Warning: No reply from slave!"
14226-14239 eeprom24xx: control-code: "Control code bits: 1010" "Control code: 1010" "Ctrl code: 1010" "Ctrl code" "Ctrl" "C"
14239-14242 eeprom24xx: address-pin: "Address bit 2: 0" "Addr bit 2" "A2" "A"
14242-14246 eeprom24xx: address-pin: "Address bit 1: 0" "Addr bit 1" "A1" "A"
14246-14249 eeprom24xx: address-pin: "Address bit 0: 1" "Addr bit 0" "A0" "A"
14249-14252 eeprom24xx: rw-bit: "R/W bit: write" "R/W" "RW" "W"
14226-14252 eeprom24xx: control-word: "Control word" "Control" "CW" "C"
14223-14255 eeprom24xx: warning: "Warning: No reply from slave!"
14269-14282 eeprom24xx: control-code: "Control code bits: 1010" "Control code: 1010" "Ctrl code: 1010" "Ctrl code" "Ctrl" "C"
14282-14285 eeprom24xx: address-pin: "Address bit 2: 0" "Addr bit 2" "A2" "A"
14285-14289 eeprom24xx: address-pin: "Address bit 1: 0" "Addr bit 1" "A1" "A"
14289-14292 eeprom24xx: address-pin: "Address bit 0: 1" "Addr bit 0" "A0" "A"
14292-14295 eeprom24xx: rw-bit: "R/W bit: write" "R/W" "RW" "W"
14269-14295 eeprom24xx: control-word: "Control word" "Control" "CW" "C"
14266-14298 eeprom24xx: warning: "Warning: No reply from slave!"
14312-14325 eeprom24xx: control-code: "Control code bits: 1010" "Control code: 1010" "Ctrl code: 1010" "Ctrl code" "Ctrl" "C"
14325-14328 eeprom24xx: address-pin: "Address bit 2: 0" "Addr bit 2" "A2" "A"
14328-14331 eeprom24xx: address-pin: "Address bit 1: 0" "Addr bit 1" "A1" "A"
14331-14335 eeprom24xx: address-pin: "Address bit 0: 1" "Addr bit 0" "A0" "A"
14335-14339 eeprom24xx: rw-bit: "R/W bit: write" "R/W" "RW" "W"
14312-14339 eeprom24xx: control-word: "Control word" "Control" "CW" "C"
14309-14342 eeprom24xx: warning: "Warning: No reply from slave!"
14355-14368 eeprom24xx: control-code: "Control code bits: 1010" "Control code: 1010" "Ctrl code: 1010" "Ctrl code" "Ctrl" "C"
14368-14371 eeprom24xx: address-pin: "Address bit 2: 0" "Addr bit 2" "A2" "A"
14371-14374 eeprom24xx: address-pin: "Address bit 1: 0" "Addr bit 1" "A1" "A"
14374-14378 eeprom24xx: address-pin: "Address bit 0: 1" "Addr bit 0" "A0" "A"
14378-14382 eeprom24xx: rw-bit: "R/W bit: write" "R/W" "RW" "W"
14355-14382 eeprom24xx: control-word: "Control word" "Control" "CW" "C"
14352-14385 eeprom24xx: warning: "Warning: No reply from slave!"
14398-14411 eeprom24xx: control-code: "Control code bits: 1010" "Control code: 1010" "Ctrl code: 1010" "Ctrl code" "Ctrl" "C"
14411-14414 eeprom24xx: address-pin: "Address bit 2: 0" "Addr bit 2" "A2" "A"
14414-14417 eeprom24xx: address-pin: "Address bit 1: 0" "Addr bit 1" "A1" "A"
14417-14421 eeprom24xx: address-pin: "Address bit 0: 1" "Addr bit 0" "A0" "A"
14421-14425 eeprom24xx: rw-bit: "R/W bit: write" "R/W" "RW" "W"
14398-14425 eeprom24xx: control-word: "Control word" "Control" "CW" "C"
14395-14428 eeprom24xx: warning: "Warning: No reply from slave!"
14441-14454 eeprom24xx: control-code: "Control code bits: 1010" "Control code: 1010" "Ctrl code: 1010" "Ctrl code" "Ctrl" "C"
14454-14457 eeprom24xx: address-pin: "Address bit 2: 0" "Addr bit 2" "A2" "A"
14457-14460 eeprom24xx: address-pin: "Address bit 1: 0" "Addr bit 1" "A1" "A"
14460-14463 eeprom24xx: address-pin: "Address bit 0: 1" "Addr bit 0" "A0" "A"
14463-14466 eeprom24xx: rw-bit: "R/W bit: write" "R/W" "RW" "W"
14441-14466 eeprom24xx: control-word: "Control word" "Control" "CW" "C"
14438-14470 eeprom24xx: warning: "Warning: No reply from slave!"
14484-14497 eeprom24xx: control-code: "Control code bits: 1010" "Control code: 1010" "Ctrl code: 1010" "Ctrl code" "Ctrl" "C"
14497-14500 eeprom24xx: address-pin: "Address bit 2: 0" "Addr bit 2" "A2" "A"
14500-14503 eeprom24xx: address-pin: "Address bit 1: 0" "Addr bit 1" "A1" "A"
14503-14506 eeprom24xx: address-pin: "Address bit 0: 1" "Addr bit 0" "A0" "A"
14506-14509 eeprom24xx: rw-bit: "R/W bit: write" "R/W" "RW" "W"
14484-14509 eeprom24xx: control-word: "Control word" "Control" "CW" "C"
14480-14513 eeprom24xx: warning: "Warning: No reply from slave!"
14526-14540 eeprom24xx: control-code: "Control code bits: 1010" "Control code: 1010" "Ctrl code: 1010" "Ctrl code" "Ctrl" "C"
14540-14543 eeprom24xx: address-pin: "Address bit 2: 0" "Addr bit 2" "A2" "A"
14543-14546 eeprom24xx: address-pin: "Address bit 1: 0" "Addr bit 1" "A1" "A"
14546-14549 eeprom24xx: address-pin: "Address bit 0: 1" "Addr bit 0" "A0" "A"
14549-14552 eeprom24xx: rw-bit: "R/W bit: write" "R/W" "RW" "W"
14526-14552 eeprom24xx: control-word: "Control word" "Control" "CW" "C"
14523-14556 eeprom24xx: warning: "Warning: No reply from slave!"
14569-14582 eeprom24xx: control-code: "Control code bits: 1010" "Control code: 1010" "Ctrl code: 1010" "Ctrl code" "Ctrl" "C"
14582-14586 eeprom24xx: address-pin: "Address bit 2: 0" "Addr bit 2" "A2" "A"
14586-14589 eeprom24xx: address-pin: "Address bit 1: 0" "Addr bit 1" "A1" "A"
14589-14592 eeprom24xx: address-pin: "Address bit 0: 1" "Addr bit 0" "A0" "A"
14592-14595 eeprom24xx: rw-bit: "R/W bit: write" "R/W" "RW" "W"
14569-14595 eeprom24xx: control-word: "Control word" "Control" "CW" "C"
14566-14598 eeprom24xx: warning: "Warning: No reply from slave!"
14612-14625 eeprom24xx: control-code: "Control code bits: 1010" "Control code: 1010" "Ctrl code: 1010" "Ctrl code" "Ctrl" "C"
14625-14629 eeprom24xx: address-pin: "Address bit 2: 0" "Addr bit 2" "A2" "A"
14629-14632 eeprom24xx: address-pin: "Address bit 1: 0" "Addr bit 1" "A1" "A"
14632-14635 eeprom24xx: address-pin: "Address bit 0: 1" "Addr bit 0" "A0" "A"
14635-14638 eeprom24xx: rw-bit: "R/W bit: write" "R/W" "RW" "W"
14612-14638 eeprom24xx: control-word: "Control word" "Control" "CW" "C"
14609-14641 eeprom24xx: warning: "Warning: No reply from slave!"
14655-14668 eeprom24xx: control-code: "Control code bits: 1010" "Control code: 1010" "Ctrl code: 1010" "Ctrl code" "Ctrl" "C"
14668-14672 eeprom24xx: address-pin: "Address bit 2: 0" "Addr bit 2" "A2" "A"
14672-14675 eeprom24xx: address-pin: "Address bit 1: 0" "Addr bit 1" "A1" "A"
14675-14678 eeprom24xx: address-pin: "Address bit 0: 1" "Addr bit 0" "A0" "A"
14678-14681 eeprom24xx: rw-bit: "R/W bit: write" "R/W" "RW" "W"
14655-14681 eeprom24xx: control-word: "Control word" "Control" "CW" "C"
14652-14684 eeprom24xx: warning: "Warning: No reply from slave!"
14698-14711 eeprom24xx: control-code: "Control code bits: 1010" "Control code: 1010" "Ctrl code: 1010" "Ctrl code" "Ctrl" "C"
14711-14714 eeprom24xx: address-pin: "Address bit 2: 0" "Addr bit 2" "A2" "A"
14714-14718 eeprom24xx: address-pin: "Address bit 1: 0" "Addr bit 1" "A1" "A"
14718-14721 eeprom24xx: address-pin: "Address bit 0: 1" "Addr bit 0" "A0" "A"
14721-14724 eeprom24xx: rw-bit: "R/W bit: write" "R/W" "RW" "W"
14698-14724 eeprom24xx: control-word: "Control word" "Control" "CW" "C"
14695-14727 eeprom24xx: warning: "Warning: No reply from slave!"
14741-14754 eeprom24xx: control-code: "Control code bits: 1010" "Control code: 1010" "Ctrl code: 1010" "Ctrl code" "Ctrl" "C"
14754-14757 eeprom24xx: address-pin: "Address bit 2: 0" "Addr bit 2" "A2" "A"
14757-14761 eeprom24xx: address-pin: "Address bit 1: 0" "Addr bit 1" "A1" "A"
14761-14764 eeprom24xx: address-pin: "Address bit 0: 1" "Addr bit 0" "A0" "A"
14764-14767 eeprom24xx: rw-bit: "R/W bit: write" "R/W" "RW" "W"
14741-14767 eeprom24xx: control-word: "Control word" "Control" "CW" "C"
14738-14770 eeprom24xx: warning: "Warning: No reply from slave!"
14784-14797 eeprom24xx: control-code: "Control code bits: 1010" "Control code: 1010" "Ctrl code: 1010" "Ctrl code" "Ctrl" "C"
14797-14800 eeprom24xx: address-pin: "Address bit 2: 0" "Addr bit 2" "A2" "A"
14800-14804 eeprom24xx: address-pin: "Address bit 1: 0" "Addr bit 1" "A1" "A"
14804-14807 eeprom24xx: address-pin: "Address bit 0: 1" "Addr bit 0" "A0" "A"
14807-14810 eeprom24xx: rw-bit: "R/W bit: write" "R/W" "RW" "W"
14784-14810 eeprom24xx: control-word: "Control word" "Control" "CW" "C"
14781-14813 eeprom24xx: warning: "Warning: No reply from slave!"
14827-14840 eeprom24xx: control-code: "Control code bits: 1010" "Control code: 1010" "Ctrl code: 1010" "Ctrl code" "Ctrl" "C"
14840-14843 eeprom24xx: address-pin: "Address bit 2: 0" "Addr bit 2" "A2" "A"
14843-14846 eeprom24xx: address-pin: "Address bit 1: 0" "Addr bit 1" "A1" "A"
14846-14850 eeprom24xx: address-pin: "Address bit 0: 1" "Addr bit 0" "A0" "A"
14850-14854 eeprom24xx: rw-bit: "R/W bit: write" "R/W" "RW" "W"
14827-14854 eeprom24xx: control-word: "Control word" "Control" "CW" "C"
14824-14857 eeprom24xx: warning: "Warning: No reply from slave!"
14870-14883 eeprom24xx: control-code: "Control code bits: 1010" "Control code: 1010" "Ctrl code: 1010" "Ctrl code" "Ctrl" "C"
14883-14886 eeprom24xx: address-pin: "Address bit 2: 0" "Addr bit 2" "A2" "A"
14886-14889 eeprom24xx: address-pin: "Address bit 1: 0" "Addr bit 1" "A1" "A"
14889-14893 eeprom24xx: address-pin: "Address bit 0: 1" "Addr bit 0" "A0" "A"
14893-14897 eeprom24xx: rw-bit: "R/W bit: write" "R/W" "RW" "W"
14870-14897 eeprom24xx: control-word: "Control word" "Control" "CW" "C"
14867-14900 eeprom24xx: warning: "Warning: No reply from slave!"
14913-14926 eeprom24xx: control-code: "Control code bits: 1010" "Control code: 1010" "Ctrl code: 1010" "Ctrl code" "Ctrl" "C"
14926-14929 eeprom24xx: address-pin: "Address bit 2: 0" "Addr bit 2" "A2" "A"
14929-14932 eeprom24xx: address-pin: "Address bit 1: 0" "Addr bit 1" "A1" "A"
14932-14936 eeprom24xx: address-pin: "Address bit 0: 1" "Addr bit 0" "A0" "A"
14936-14940 eeprom24xx: rw-bit: "R/W bit: write" "R/W" "RW" "W"
14913-14940 eeprom24xx: control-word: "Control word" "Control" "CW" "C"
14910-14943 eeprom24xx: warning: "Warning: No reply from slave!"
14956-14969 eeprom24xx: control-code: "Control code bits: 1010" "Control code: 1010" "Ctrl code: 1010" "Ctrl code" "Ctrl" "C"
14969-14972 eeprom24xx: address-pin: "Address bit 2: 0" "Addr bit 2" "A2" "A"
14972-14975 eeprom24xx: address-pin: "Address bit 1: 0" "Addr bit 1" "A1" "A"
14975-14978 eeprom24xx: address-pin: "Address bit 0: 1" "Addr bit 0" "A0" "A"
14978-14981 eeprom24xx: rw-bit: "R/W bit: write" "R/W" "RW" "W"
14956-14981 eeprom24xx: control-word: "Control word" "Control" "CW" "C"
14952-14985 eeprom24xx: warning: "Warning: No reply from slave!"
14998-15012 eeprom24xx: control-code: "Control code bits: 1010" "Control code: 1010" "Ctrl code: 1010" "Ctrl code" "Ctrl" "C"
15012-15015 eeprom24xx: address-pin: "Address bit 2: 0" "Addr bit 2" "A2" "A"
15015-15018 eeprom24xx: address-pin: "Address bit 1: 0" "Addr bit 1" "A1" "A"
15018-15021 eeprom24xx: address-pin: "Address bit 0: 1" "Addr bit 0" "A0" "A"
15021-15024 eeprom24xx: rw-bit: "R/W bit: write" "R/W" "RW" "W"
14998-15024 eeprom24xx: control-word: "Control word" "Control" "CW" "C"
14995-15028 eeprom24xx: warning: "Warning: No reply from slave!"
15041-15054 eeprom24xx: control-code: "Control code bits: 1010" "Control code: 1010" "Ctrl code: 1010" "Ctrl code" "Ctrl" "C"
15054-15058 eeprom24xx: address-pin: "Address bit 2: 0" "Addr bit 2" "A2" "A"
15058-15061 eeprom24xx: address-pin: "Address bit 1: 0" "Addr bit 1" "A1" "A"
15061-15064 eeprom24xx: address-pin: "Address bit 0: 1" "Addr bit 0" "A0" "A"
15064-15067 eeprom24xx: rw-bit: "R/W bit: write" "R/W" "RW" "W"
15041-15067 eeprom24xx: control-word: "Control word" "Control" "CW" "C"
15038-15071 eeprom24xx: warning: "Warning: No reply from slave!"
15084-15097 eeprom24xx: control-code: "Control code bits: 1010" "Control code: 1010" "Ctrl code: 1010" "Ctrl code" "Ctrl" "C"
15097-15101 eeprom24xx: address-pin: "Address bit 2: 0" "Addr bit 2" "A2" "A"
15101-15104 eeprom24xx: address-pin: "Address bit 1: 0" "Addr bit 1" "A1" "A"
15104-15107 eeprom24xx: address-pin: "Address bit 0: 1" "Addr bit 0" "A0" "A"
15107-15110 eeprom24xx: rw-bit: "R/W bit: write" "R/W" "RW" "W"
15084-15110 eeprom24xx: control-word: "Control word" "Control" "CW" "C"
15081-15113 eeprom24xx: warning: "Warning: No reply from slave!"
15127-15140 eeprom24xx: control-code: "Control code bits: 1010" "Control code: 1010" "Ctrl code: 1010" "Ctrl code" "Ctrl" "C"
15140-15144 eeprom24xx: address-pin: "Address bit 2: 0" "Addr bit 2" "A2" "A"
15144-15147 eeprom24xx: address-pin: "Address bit 1: 0" "Addr bit 1" "A1" "A"
15147-15150 eeprom24xx: address-pin: "Address bit 0: 1" "Addr bit 0" "A0" "A"
15150-15153 eeprom24xx: rw-bit: "R/W bit: write" "R/W" "RW" "W"
15127-15153 eeprom24xx: control-word: "Control word" "Control" "CW" "C"
15124-15156 eeprom24xx: warning: "Warning: No reply from slave!"
15170-15183 eeprom24xx: control-code: "Control code bits: 1010" "Control code: 1010" "Ctrl code: 1010" "Ctrl code" "Ctrl" "C"
15183-15186 eeprom24xx: address-pin: "Address bit 2: 0" "Addr bit 2" "A2" "A"
15186-15190 eeprom24xx: address-pin: "Address bit 1: 0" "Addr bit 1" "A1" "A"
15190-15193 eeprom24xx: address-pin: "Address bit 0: 1" "Addr bit 0" "A0" "A"
15193-15196 eeprom24xx: rw-bit: "R/W bit: write" "R/W" "RW" "W"
15170-15196 eeprom24xx: control-word: "Control word" "Control" "CW" "C"
15167-15199 eeprom24xx: warning: "Warning: No reply from slave!"
15213-15226 eeprom24xx: control-code: "Control code bits: 1010" "Control code: 1010" "Ctrl code: 1010" "Ctrl code" "Ctrl" "C"
15226-15229 eeprom24xx: address-pin: "Address bit 2: 0" "Addr bit 2" "A2" "A"
15229-15233 eeprom24xx: address-pin: "Address bit 1: 0" "Addr bit 1" "A1" "A"
15233-15236 eeprom24xx: address-pin: "Address bit 0: 1" "Addr bit 0" "A0" "A"
15236-15239 eeprom24xx: rw-bit: "R/W bit: write" "R/W" "RW" "W"
15213-15239 eeprom24xx: control-word: "Control word" "Control" "CW" "C"
15210-15242 eeprom24xx: warning: "Warning: No reply from slave!"
15256-15269 eeprom24xx: control-code: "Control code bits: 1010" "Control code: 1010" "Ctrl code: 1010" "Ctrl code" "Ctrl" "C"
15269-15272 eeprom24xx: address-pin: "Address bit 2: 0" "Addr bit 2" "A2" "A"
15272-15276 eeprom24xx: address-pin: "Address bit 1: 0" "Addr bit 1" "A1" "A"
15276-15279 eeprom24xx: address-pin: "Address bit 0: 1" "Addr bit 0" "A0" "A"
15279-15282 eeprom24xx: rw-bit: "R/W bit: write" "R/W" "RW" "W"
15256-15282 eeprom24xx: control-word: "Control word" "Control" "CW" "C"
15253-15285 eeprom24xx: warning: "Warning: No reply from slave!"
15299-15312 eeprom24xx: control-code: "Control code bits: 1010" "Control code: 1010" "Ctrl code: 1010" "Ctrl code" "Ctrl" "C"
15312-15315 eeprom24xx: address-pin: "Address bit 2: 0" "Addr bit 2" "A2" "A"
15315-15319 eeprom24xx: address-pin: "Address bit 1: 0" "Addr bit 1" "A1" "A"
15319-15322 eeprom24xx: address-pin: "Address bit 0: 1" "Addr bit 0" "A0" "A"
15322-15325 eeprom24xx: rw-bit: "R/W bit: write" "R/W" "RW" "W"
15299-15325 eeprom24xx: control-word: "Control word" "Control" "CW" "C"
15296-15328 eeprom24xx: warning: "Warning: No reply from slave!"
15342-15355 eeprom24xx: control-code: "Control code bits: 1010" "Control code: 1010" "Ctrl code: 1010" "Ctrl code" "Ctrl" "C"
15355-15358 eeprom24xx: address-pin: "Address bit 2: 0" "Addr bit 2" "A2" "A"
15358-15361 eeprom24xx: address-pin: "Address bit 1: 0" "Addr bit 1" "A1" "A"
15361-15365 eeprom24xx: address-pin: "Address bit 0: 1" "Addr bit 0" "A0" "A"
15365-15369 eeprom24xx: rw-bit: "R/W bit: write" "R/W" "RW" "W"
15342-15369 eeprom24xx: control-word: "Control word" "Control" "CW" "C"
15339-15372 eeprom24xx: warning: "Warning: No reply from slave!"
15385-15398 eeprom24xx: control-code: "Control code bits: 1010" "Control code: 1010" "Ctrl code: 1010" "Ctrl code" "Ctrl" "C"
15398-15401 eeprom24xx: address-pin: "Address bit 2: 0" "Addr bit 2" "A2" "A"
15401-15404 eeprom24xx: address-pin: "Address bit 1: 0" "Addr bit 1" "A1" "A"
15404-15408 eeprom24xx: address-pin: "Address bit 0: 1" "Addr bit 0" "A0" "A"
15408-15412 eeprom24xx: rw-bit: "R/W bit: write" "R/W" "RW" "W"
15385-15412 eeprom24xx: control-word: "Control word" "Control" "CW" "C"
15382-15415 eeprom24xx: warning: "Warning: No reply from slave!"
15428-15441 eeprom24xx: control-code: "Control code bits: 1010" "Control code: 1010" "Ctrl code: 1010" "Ctrl code" "Ctrl" "C"
15441-15444 eeprom24xx: address-pin: "Address bit 2: 0" "Addr bit 2" "A2" "A"
15444-15447 eeprom24xx: address-pin: "Address bit 1: 0" "Addr bit 1" "A1" "A"
15447-15450 eeprom24xx: address-pin: "Address bit 0: 1" "Addr bit 0" "A0" "A"
15450-15453 eeprom24xx: rw-bit: "R/W bit: write" "R/W" "RW" "W"
15428-15453 eeprom24xx: control-word: "Control word" "Control" "CW" "C"
15425-15457 eeprom24xx: warning: "Warning: No reply from slave!"
15471-15484 eeprom24xx: control-code: "Control code bits: 1010" "Control code: 1010" "Ctrl code: 1010" "Ctrl code" "Ctrl" "C"
15484-15487 eeprom24xx: address-pin: "Address bit 2: 0" "Addr bit 2" "A2" "A"
15487-15490 eeprom24xx: address-pin: "Address bit 1: 0" "Addr bit 1" "A1" "A"
15490-15493 eeprom24xx: address-pin: "Address bit 0: 1" "Addr bit 0" "A0" "A"
15493-15496 eeprom24xx: rw-bit: "R/W bit: write" "R/W" "RW" "W"
15471-15496 eeprom24xx: control-word: "Control word" "Control" "CW" "C"
15467-15500 eeprom24xx: warning: "Warning: No reply from slave!"
15513-15527 eeprom24xx: control-code: "Control code bits: 1010" "Control code: 1010" "Ctrl code: 1010" "Ctrl code" "Ctrl" "C"
15527-15530 eeprom24xx: address-pin: "Address bit 2: 0" "Addr bit 2" "A2" "A"
15530-15533 eeprom24xx: address-pin: "Address bit 1: 0" "Addr bit 1" "A1" "A"
15533-15536 eeprom24xx: address-pin: "Address bit 0: 1" "Addr bit 0" "A0" "A"
15536-15539 eeprom24xx: rw-bit: "R/W bit: write" "R/W" "RW" "W"
15513-15539 eeprom24xx: control-word: "Control word" "Control" "CW" "C"
15510-15543 eeprom24xx: warning: "Warning: No reply from slave!"
15556-15569 eeprom24xx: control-code: "Control code bits: 1010" "Control code: 1010" "Ctrl code: 1010" "Ctrl code" "Ctrl" "C"
15569-15573 eeprom24xx: address-pin: "Address bit 2: 0" "Addr bit 2" "A2" "A"
15573-15576 eeprom24xx: address-pin: "Address bit 1: 0" "Addr bit 1" "A1" "A"
15576-15579 eeprom24xx: address-pin: "Address bit 0: 1" "Addr bit 0" "A0" "A"
15579-15582 eeprom24xx: rw-bit: "R/W bit: write" "R/W" "RW" "W"
15556-15582 eeprom24xx: control-word: "Control word" "Control" "CW" "C"
15553-15586 eeprom24xx: warning: "Warning: No reply from slave!"
15599-15612 eeprom24xx: control-code: "Control code bits: 1010" "Control code: 1010" "Ctrl code: 1010" "Ctrl code" "Ctrl" "C"
15612-15616 eeprom24xx: address-pin: "Address bit 2: 0" "Addr bit 2" "A2" "A"
15616-15619 eeprom24xx: address-pin: "Address bit 1: 0" "Addr bit 1" "A1" "A"
15619-15622 eeprom24xx: address-pin: "Address bit 0: 1" "Addr bit 0" "A0" "A"
15622-15625 eeprom24xx: rw-bit: "R/W bit: write" "R/W" "RW" "W"
15599-15625 eeprom24xx: control-word: "Control word" "Control" "CW" "C"
15596-15628 eeprom24xx: warning: "Warning: No reply from slave!"
15642-15655 eeprom24xx: control-code: "Control code bits: 1010" "Control code: 1010" "Ctrl code: 1010" "Ctrl code" "Ctrl" "C"
15655-15659 eeprom24xx: address-pin: "Address bit 2: 0" "Addr bit 2" "A2" "A"
15659-15662 eeprom24xx: address-pin: "Address bit 1: 0" "Addr bit 1" "A1" "A"
15662-15665 eeprom24xx: address-pin: "Address bit 0: 1" "Addr bit 0" "A0" "A"
15665-15668 eeprom24xx: rw-bit: "R/W bit: write" "R/W" "RW" "W"
15642-15668 eeprom24xx: control-word: "Control word" "Control" "CW" "C"
15639-15671 eeprom24xx: warning: "Warning: No reply from slave!"
15685-15698 eeprom24xx: control-code: "Control code bits: 1010" "Control code: 1010" "Ctrl code: 1010" "Ctrl code" "Ctrl" "C"
15698-15701 eeprom24xx: address-pin: "Address bit 2: 0" "Addr bit 2" "A2" "A"
15701-15705 eeprom24xx: address-pin: "Address bit 1: 0" "Addr bit 1" "A1" "A"
15705-15708 eeprom24xx: address-pin: "Address bit 0: 1" "Addr bit 0" "A0" "A"
15708-15711 eeprom24xx: rw-bit: "R/W bit: write" "R/W" "RW" "W"
15685-15711 eeprom24xx: control-word: "Control word" "Control" "CW" "C"
15682-15714 eeprom24xx: warning: "Warning: No reply from slave!"
15728-15741 eeprom24xx: control-code: "Control code bits: 1010" "Control code: 1010" "Ctrl code: 1010" "Ctrl code" "Ctrl" "C"
15741-15744 eeprom24xx: address-pin: "Address bit 2: 0" "Addr bit 2" "A2" "A"
15744-15748 eeprom24xx: address-pin: "Address bit 1: 0" "Addr bit 1" "A1" "A"
15748-15751 eeprom24xx: address-pin: "Address bit 0: 1" "Addr bit 0" "A0" "A"
15751-15754 eeprom24xx: rw-bit: "R/W bit: write" "R/W" "RW" "W"
15728-15754 eeprom24xx: control-word: "Control word" "Control" "CW" "C"
15725-15757 eeprom24xx: warning: "Warning: No reply from slave!"
15771-15784 eeprom24xx: control-code: "Control code bits: 1010" "Control code: 1010" "Ctrl code: 1010" "Ctrl code" "Ctrl" "C"
15784-15787 eeprom24xx: address-pin: "Address bit 2: 0" "Addr bit 2" "A2" "A"
15787-15791 eeprom24xx: address-pin: "Address bit 1: 0" "Addr bit 1" "A1" "A"
15791-15794 eeprom24xx: address-pin: "Address bit 0: 1" "Addr bit 0" "A0" "A"
15794-15797 eeprom24xx: rw-bit: "R/W bit: write" "R/W" "RW" "W"
15771-15797 eeprom24xx: control-word: "Control word" "Control" "CW" "C"
15768-15800 eeprom24xx: warning: "Warning: No reply from slave!"
15814-15827 eeprom24xx: control-code: "Control code bits: 1010" "Control code: 1010" "Ctrl code: 1010" "Ctrl code" "Ctrl" "C"
15827-15830 eeprom24xx: address-pin: "Address bit 2: 0" "Addr bit 2" "A2" "A"
15830-15833 eeprom24xx: address-pin: "Address bit 1: 0" "Addr bit 1" "A1" "A"
15833-15837 eeprom24xx: address-pin: "Address bit 0: 1" "Addr bit 0" "A0" "A"
15837-15841 eeprom24xx: rw-bit: "R/W bit: write" "R/W" "RW" "W"
15814-15841 eeprom24xx: control-word: "Control word" "Control" "CW" "C"
15811-15844 eeprom24xx: warning: "Warning: No reply from slave!"
15857-15870 eeprom24xx: control-code: "Control code bits: 1010" "Control code: 1010" "Ctrl code: 1010" "Ctrl code" "Ctrl" "C"
15870-15873 eeprom24xx: address-pin: "Address bit 2: 0" "Addr bit 2" "A2" "A"
15873-15876 eeprom24xx: address-pin: "Address bit 1: 0" "Addr bit 1" "A1" "A"
15876-15880 eeprom24xx: address-pin: "Address bit 0: 1" "Addr bit 0" "A0" "A"
15880-15884 eeprom24xx: rw-bit: "R/W bit: write" "R/W" "RW" "W"
15857-15884 eeprom24xx: control-word: "Control word" "Control" "CW" "C"
15854-15887 eeprom24xx: warning: "Warning: No reply from slave!"
15900-15913 eeprom24xx: control-code: "Control code bits: 1010" "Control code: 1010" "Ctrl code: 1010" "Ctrl code" "Ctrl" "C"
15913-15916 eeprom24xx: address-pin: "Address bit 2: 0" "Addr bit 2" "A2" "A"
15916-15919 eeprom24xx: address-pin: "Address bit 1: 0" "Addr bit 1" "A1" "A"
15919-15923 eeprom24xx: address-pin: "Address bit 0: 1" "Addr bit 0" "A0" "A"
15923-15927 eeprom24xx: rw-bit: "R/W bit: write" "R/W" "RW" "W"
15900-15927 eeprom24xx: control-word: "Control word" "Control" "CW" "C"
15897-15930 eeprom24xx: warning: "Warning: No reply from slave!"
15943-15956 eeprom24xx: control-code: "Control code bits: 1010" "Control code: 1010" "Ctrl code: 1010" "Ctrl code" "Ctrl" "C"
15956-15959 eeprom24xx: address-pin: "Address bit 2: 0" "Addr bit 2" "A2" "A"
15959-15962 eeprom24xx: address-pin: "Address bit 1: 0" "Addr bit 1" "A1" "A"
15962-15965 eeprom24xx: address-pin: "Address bit 0: 1" "Addr bit 0" "A0" "A"
15965-15968 eeprom24xx: rw-bit: "R/W bit: write" "R/W" "RW" "W"
15943-15968 eeprom24xx: control-word: "Control word" "Control" "CW" "C"
15940-15972 eeprom24xx: warning: "Warning: No reply from slave!"
15986-15999 eeprom24xx: control-code: "Control code bits: 1010" "Control code: 1010" "Ctrl code: 1010" "Ctrl code" "Ctrl" "C"
15999-16002 eeprom24xx: address-pin: "Address bit 2: 0" "Addr bit 2" "A2" "A"
16002-16005 eeprom24xx: address-pin: "Address bit 1: 0" "Addr bit 1" "A1" "A"
16005-16008 eeprom24xx: address-pin: "Address bit 0: 1" "Addr bit 0" "A0" "A"
16008-16011 eeprom24xx: rw-bit: "R/W bit: write" "R/W" "RW" "W"
15986-16011 eeprom24xx: control-word: "Control word" "Control" "CW" "C"
15982-16015 eeprom24xx: warning: "Warning: No reply from slave!"
16028-16041 eeprom24xx: control-code: "Control code bits: 1010" "Control code: 1010" "Ctrl code: 1010" "Ctrl code" "Ctrl" "C"
16041-16045 eeprom24xx: address-pin: "Address bit 2: 0" "Addr bit 2" "A2" "A"
16045-16048 eeprom24xx: address-pin: "Address bit 1: 0" "Addr bit 1" "A1" "A"
16048-16051 eeprom24xx: address-pin: "Address bit 0: 1" "Addr bit 0" "A0" "A"
16051-16054 eeprom24xx: rw-bit: "R/W bit: write" "R/W" "RW" "W"
16028-16054 eeprom24xx: control-word: "Control word" "Control" "CW" "C"
16078-16104 eeprom24xx: word-addr-byte: "Word address high byte: 00" "Word addr high byte: 00" "Addr high: 00" "AH: 00" "00"
16116-16142 eeprom24xx: word-addr-byte: "Word address low byte: 80" "Word addr low byte: 80" "Addr low: 80" "AL: 80" "80"
16078-16142 eeprom24xx: word-addr: "Word address" "Word addr" "Addr" "A"
16182-16208 eeprom24xx: data-byte: "Data byte 0080: 00" "Data byte: 00" "Byte: 00" "DB: 00" "00"
16219-16245 eeprom24xx: data-byte: "Data byte 0081: 03" "Data byte: 03" "Byte: 03" "DB: 03" "03"
16257-16282 eeprom24xx: data-byte: "Data byte 0082: 00" "Data byte: 00" "Byte: 00" "DB: 00" "00"
16294-16321 eeprom24xx: data-byte: "Data byte 0083: 3B" "Data byte: 3B" "Byte: 3B" "DB: 3B" "3B"
16331-16357 eeprom24xx: data-byte: "Data byte 0084: 02" "Data byte: 02" "Byte: 02" "DB: 02" "02"
16368-16394 eeprom24xx: data-byte: "Data byte 0085: 1E" "Data byte: 1E" "Byte: 1E" "DB: 1E" "1E"
16406-16431 eeprom24xx: data-byte: "Data byte 0086: 38" "Data byte: 38" "Byte: 38" "DB: 38" "38"
16443-16470 eeprom24xx: data-byte: "Data byte 0087: 00" "Data byte: 00" "Byte: 00" "DB: 00" "00"
16480-16506 eeprom24xx: data-byte: "Data byte 0088: 03" "Data byte: 03" "Byte: 03" "DB: 03" "03"
16517-16543 eeprom24xx: data-byte: "Data byte 0089: 00" "Data byte: 00" "Byte: 00" "DB: 00" "00"
16555-16580 eeprom24xx: data-byte: "Data byte 008A: 43" "Data byte: 43" "Byte: 43" "DB: 43" "43"
16592-16619 eeprom24xx: data-byte: "Data byte 008B: 02" "Data byte: 02" "Byte: 02" "DB: 02" "02"
16182-16619 eeprom24xx: data: "Data" "D"
16025-16633 eeprom24xx: page-write: "Page write (addr=0080, 12 bytes): 00 03 00 3B 02 1E 38 00 03 00 43 02" "Page write (addr=0080, 12 bytes)" "Page write" "PW" "P"
16644-16657 eeprom24xx: control-code: "Control code bits: 1010" "Control code: 1010" "Ctrl code: 1010" "Ctrl code" "Ctrl" "C"
16657-16660 eeprom24xx: address-pin: "Address bit 2: 0" "Addr bit 2" "A2" "A"
16660-16664 eeprom24xx: address-pin: "Address bit 1: 0" "Addr bit 1" "A1" "A"
16664-16667 eeprom24xx: address-pin: "Address bit 0: 1" "Addr bit 0" "A0" "A"
16667-16670 eeprom24xx: rw-bit: "R/W bit: write" "R/W" "RW" "W"
16644-16670 eeprom24xx: control-word: "Control word" "Control" "CW" "C"
16641-16673 eeprom24xx: warning: "Warning: No reply from slave!"
16686-16699 eeprom24xx: control-code: "Control code bits: 1010" "Control code: 1010" "Ctrl code: 1010" "Ctrl code" "Ctrl" "C"
16699-16703 eeprom24xx: address-pin: "Address bit 2: 0" "Addr bit 2" "A2" "A"
16703-16706 eeprom24xx: address-pin: "Address bit 1: 0" "Addr bit 1" "A1" "A"
16706-16709 eeprom24xx: address-pin: "Address bit 0: 1" "Addr bit 0" "A0" "A"
16709-16712 eeprom24xx: rw-bit: "R/W bit: write" "R/W" "RW" "W"
16686-16712 eeprom24xx: control-word: "Control word" "Control" "CW" "C"
16683-16715 eeprom24xx: warning: "Warning: No reply from slave!"
16729-16742 eeprom24xx: control-code: "Control code bits: 1010" "Control code: 1010" "Ctrl code: 1010" "Ctrl code" "Ctrl" "C"
16742-16745 eeprom24xx: address-pin: "Address bit 2: 0" "Addr bit 2" "A2" "A"
16745-16749 eeprom24xx: address-pin: "Address bit 1: 0" "Addr bit 1" "A1" "A"
16749-16752 eeprom24xx: address-pin: "Address bit 0: 1" "Addr bit 0" "A0" "A"
16752-16755 eeprom24xx: rw-bit: "R/W bit: write" "R/W" "RW" "W"
16729-16755 eeprom24xx: control-word: "Control word" "Control" "CW" "C"
16726-16758 eeprom24xx: warning: "Warning: No reply from slave!"
16772-16785 eeprom24xx: control-code: "Control code bits: 1010" "Control code: 1010" "Ctrl code: 1010" "Ctrl code" "Ctrl" "C"
16785-16788 eeprom24xx: address-pin: "Address bit 2: 0" "Addr bit 2" "A2" "A"
16788-16792 eeprom24xx: address-pin: "Address bit 1: 0" "Addr bit 1" "A1" "A"
16792-16795 eeprom24xx: address-pin: "Address bit 0: 1" "Addr bit 0" "A0" "A"
16795-16798 eeprom24xx: rw-bit: "R/W bit: write" "R/W" "RW" "W"
16772-16798 eeprom24xx: control-word: "Control word" "Control" "CW" "C"
16769-16801 eeprom24xx: warning: "Warning: No reply from slave!"
16815-16828 eeprom24xx: control-code: "Control code bits: 1010" "Control code: 1010" "Ctrl code: 1010" "Ctrl code" "Ctrl" "C"
16828-16831 eeprom24xx: address-pin: "Address bit 2: 0" "Addr bit 2" "A2" "A"
16831-16835 eeprom24xx: address-pin: "Address bit 1: 0" "Addr bit 1" "A1" "A"
16835-16838 eeprom24xx: address-pin: "Address bit 0: 1" "Addr bit 0" "A0" "A"
16838-16841 eeprom24xx: rw-bit: "R/W bit: write" "R/W" "RW" "W"
16815-16841 eeprom24xx: control-word: "Control word" "Control" "CW" "C"
16812-16844 eeprom24xx: warning: "Warning: No reply from slave!"
16858-16871 eeprom24xx: control-code: "Control code bits: 1010" "Control code: 1010" "Ctrl code: 1010" "Ctrl code" "Ctrl" "C"
16871-16874 eeprom24xx: address-pin: "Address bit 2: 0" "Addr bit 2" "A2" "A"
16874-16877 eeprom24xx: address-pin: "Address bit 1: 0" "Addr bit 1" "A1" "A"
16877-16881 eeprom24xx: address-pin: "Address bit 0: 1" "Addr bit 0" "A0" "A"
16881-16885 eeprom24xx: rw-bit: "R/W bit: write" "R/W" "RW" "W"
16858-16885 eeprom24xx: control-word: "Control word" "Control" "CW" "C"
16855-16888 eeprom24xx: warning: "Warning: No reply from slave!"
16901-16914 eeprom24xx: control-code: "Control code bits: 1010" "Control code: 1010" "Ctrl code: 1010" "Ctrl code" "Ctrl" "C"
16914-16917 eeprom24xx: address-pin: "Address bit 2: 0" "Addr bit 2" "A2" "A"
16917-16920 eeprom24xx: address-pin: "Address bit 1: 0" "Addr bit 1" "A1" "A"
16920-16924 eeprom24xx: address-pin: "Address bit 0: 1" "Addr bit 0" "A0" "A"
16924-16928 eeprom24xx: rw-bit: "R/W bit: write" "R/W" "RW" "W"
16901-16928 eeprom24xx: control-word: "Control word" "Control" "CW" "C"
16898-16931 eeprom24xx: warning: "Warning: No reply from slave!"
16944-16957 eeprom24xx: control-code: "Control code bits: 1010" "Control code: 1010" "Ctrl code: 1010" "Ctrl code" "Ctrl" "C"
16957-16960 eeprom24xx: address-pin: "Address bit 2: 0" "Addr bit 2" "A2" "A"
16960-16963 eeprom24xx: address-pin: "Address bit 1: 0" "Addr bit 1" "A1" "A"
16963-16967 eeprom24xx: address-pin: "Address bit 0: 1" "Addr bit 0" "A0" "A"
16967-16971 eeprom24xx: rw-bit: "R/W bit: write" "R/W" "RW" "W"
16944-16971 eeprom24xx: control-word: "Control word" "Control" "CW" "C"
16941-16974 eeprom24xx: warning: "Warning: No reply from slave!"
16987-17000 eeprom24xx: control-code: "Control code bits: 1010" "Control code: 1010" "Ctrl code: 1010" "Ctrl code" "Ctrl" "C"
17000-17003 eeprom24xx: address-pin: "Address bit 2: 0" "Addr bit 2" "A2" "A"
17003-17006 eeprom24xx: address-pin: "Address bit 1: 0" "Addr bit 1" "A1" "A"
17006-17010 eeprom24xx: address-pin: "Address bit 0: 1" "Addr bit 0" "A0" "A"
17010-17014 eeprom24xx: rw-bit: "R/W bit: write" "R/W" "RW" "W"
16987-17014 eeprom24xx: control-word: "Control word" "Control" "CW" "C"
16984-17017 eeprom24xx: warning: "Warning: No reply from slave!"
17030-17043 eeprom24xx: control-code: "Control code bits: 1010" "Control code: 1010" "Ctrl code: 1010" "Ctrl code" "Ctrl" "C"
17043-17046 eeprom24xx: address-pin: "Address bit 2: 0" "Addr bit 2" "A2" "A"
17046-17049 eeprom24xx: address-pin: "Address bit 1: 0" "Addr bit 1" "A1" "A"
17049-17052 eeprom24xx: address-pin: "Address bit 0: 1" "Addr bit 0" "A0" "A"
17052-17055 eeprom24xx: rw-bit: "R/W bit: write" "R/W" "RW" "W"
17030-17055 eeprom24xx: control-word: "Control word" "Control" "CW" "C"
17026-17059 eeprom24xx: warning: "Warning: No reply from slave!"
17072-17086 eeprom24xx: control-code: "Control code bits: 1010" "Control code: 1010" "Ctrl code: 1010" "Ctrl code" "Ctrl" "C"
17086-17089 eeprom24xx: address-pin: "Address bit 2: 0" "Addr bit 2" "A2" "A"
17089-17092 eeprom24xx: address-pin: "Address bit 1: 0" "Addr bit 1" "A1" "A"
17092-17095 eeprom24xx: address-pin: "Address bit 0: 1" "Addr bit 0" "A0" "A"
17095-17098 eeprom24xx: rw-bit: "R/W bit: write" "R/W" "RW" "W"
17072-17098 eeprom24xx: control-word: "Control word" "Control" "CW" "C"
17069-17102 eeprom24xx: warning: "Warning: No reply from slave!"
17115-17128 eeprom24xx: control-code: "Control code bits: 1010" "Control code: 1010" "Ctrl code: 1010" "Ctrl code" "Ctrl" "C"
17128-17132 eeprom24xx: address-pin: "Address bit 2: 0" "Addr bit 2" "A2" "A"
17132-17135 eeprom24xx: address-pin: "Address bit 1: 0" "Addr bit 1" "A1" "A"
17135-17138 eeprom24xx: address-pin: "Address bit 0: 1" "Addr bit 0" "A0" "A"
17138-17141 eeprom24xx: rw-bit: "R/W bit: write" "R/W" "RW" "W"
17115-17141 eeprom24xx: control-word: "Control word" "Control" "CW" "C"
17112-17145 eeprom24xx: warning: "Warning: No reply from slave!"
17158-17171 eeprom24xx: control-code: "Control code bits: 1010" "Control code: 1010" "Ctrl code: 1010" "Ctrl code" "Ctrl" "C"
17171-17175 eeprom24xx: address-pin: "Address bit 2: 0" "Addr bit 2" "A2" "A"
17175-17178 eeprom24xx: address-pin: "Address bit 1: 0" "Addr bit 1" "A1" "A"
17178-17181 eeprom24xx: address-pin: "Address bit 0: 1" "Addr bit 0" "A0" "A"
17181-17184 eeprom24xx: rw-bit: "R/W bit: write" "R/W" "RW" "W"
17158-17184 eeprom24xx: control-word: "Control word" "Control" "CW" "C"
17155-17187 eeprom24xx: warning: "Warning: No reply from slave!"
17201-17214 eeprom24xx: control-code: "Control code bits: 1010" "Control code: 1010" "Ctrl code: 1010" "Ctrl code" "Ctrl" "C"
17214-17218 eeprom24xx: address-pin: "Address bit 2: 0" "Addr bit 2" "A2" "A"
17218-17221 eeprom24xx: address-pin: "Address bit 1: 0" "Addr bit 1" "A1" "A"
17221-17224 eeprom24xx: address-pin: "Address bit 0: 1" "Addr bit 0" "A0" "A"
17224-17227 eeprom24xx: rw-bit: "R/W bit: write" "R/W" "RW" "W"
17201-17227 eeprom24xx: control-word: "Control word" "Control" "CW" "C"
17198-17230 eeprom24xx: warning: "Warning: No reply from slave!"
17244-17257 eeprom24xx: control-code: "Control code bits: 1010" "Control code: 1010" "Ctrl code: 1010" "Ctrl code" "Ctrl" "C"
17257-17260 eeprom24xx: address-pin: "Address bit 2: 0" "Addr bit 2" "A2" "A"
17260-17264 eeprom24xx: address-pin: "Address bit 1: 0" "Addr bit 1" "A1" "A"
17264-17267 eeprom24xx: address-pin: "Address bit 0: 1" "Addr bit 0" "A0" "A"
17267-17270 eeprom24xx: rw-bit: "R/W bit: write" "R/W" "RW" "W"
17244-17270 eeprom24xx: control-word: "Control word" "Control" "CW" "C"
17241-17273 eeprom24xx: warning: "Warning: No reply from slave!"
17287-17300 eeprom24xx: control-code: "Control code bits: 1010" "Control code: 1010" "Ctrl code: 1010" "Ctrl code" "Ctrl" "C"
17300-17303 eeprom24xx: address-pin: "Address bit 2: 0" "Addr bit 2" "A2" "A"
17303-17307 eeprom24xx: address-pin: "Address bit 1: 0" "Addr bit 1" "A1" "A"
17307-17310 eeprom24xx: address-pin: "Address bit 0: 1" "Addr bit 0" "A0" "A"
17310-17313 eeprom24xx: rw-bit: "R/W bit: write" "R/W" "RW" "W"
17287-17313 eeprom24xx: control-word: "Control word" "Control" "CW" "C"
17284-17316 eeprom24xx: warning: "Warning: No reply from slave!"
17330-17343 eeprom24xx: control-code: "Control code bits: 1010" "Control code: 1010" "Ctrl code: 1010" "Ctrl code" "Ctrl" "C"
17343-17346 eeprom24xx: address-pin: "Address bit 2: 0" "Addr bit 2" "A2" "A"
17346-17350 eeprom24xx: address-pin: "Address bit 1: 0" "Addr bit 1" "A1" "A"
17350-17353 eeprom24xx: address-pin: "Address bit 0: 1" "Addr bit 0" "A0" "A"
17353-17356 eeprom24xx: rw-bit: "R/W bit: write" "R/W" "RW" "W"
17330-17356 eeprom24xx: control-word: "Control word" "Control" "CW" "C"
17327-17359 eeprom24xx: warning: "Warning: No reply from slave!"
17373-17386 eeprom24xx: control-code: "Control code bits: 1010" "Control code: 1010" "Ctrl code: 1010" "Ctrl code" "Ctrl" "C"
17386-17389 eeprom24xx: address-pin: "Address bit 2: 0" "Addr bit 2" "A2" "A"
17389-17392 eeprom24xx: address-pin: "Address bit 1: 0" "Addr bit 1" "A1" "A"
17392-17396 eeprom24xx: address-pin: "Address bit 0: 1" "Addr bit 0" "A0" "A"
17396-17400 eeprom24xx: rw-bit: "R/W bit: write" "R/W" "RW" "W"
17373-17400 eeprom24xx: control-word: "Control word" "Control" "CW" "C"
17370-17403 eeprom24xx: warning: "Warning: No reply from slave!"
17416-17429 eeprom24xx: control-code: "Control code bits: 1010" "Control code: 1010" "Ctrl code: 1010" "Ctrl code" "Ctrl" "C"
17429-17432 eeprom24xx: address-pin: "Address bit 2: 0" "Addr bit 2" "A2" "A"
17432-17435 eeprom24xx: address-pin: "Address bit 1: 0" "Addr bit 1" "A1" "A"
17435-17439 eeprom24xx: address-pin: "Address bit 0: 1" "Addr bit 0" "A0" "A"
17439-17443 eeprom24xx: rw-bit: "R/W bit: write" "R/W" "RW" "W"
17416-17443 eeprom24xx: control-word: "Control word" "Control" "CW" "C"
17413-17446 eeprom24xx: warning: "Warning: No reply from slave!"
17459-17472 eeprom24xx: control-code: "Control code bits: 1010" "Control code: 1010" "Ctrl code: 1010" "Ctrl code" "Ctrl" "C"
17472-17475 eeprom24xx: address-pin: "Address bit 2: 0" "Addr bit 2" "A2" "A"
17475-17478 eeprom24xx: address-pin: "Address bit 1: 0" "Addr bit 1" "A1" "A"
17478-17482 eeprom24xx: address-pin: "Address bit 0: 1" "Addr bit 0" "A0" "A"
17482-17486 eeprom24xx: rw-bit: "R/W bit: write" "R/W" "RW" "W"
17459-17486 eeprom24xx: control-word: "Control word" "Control" "CW" "C"
17456-17489 eeprom24xx: warning: "Warning: No reply from slave!"
17502-17515 eeprom24xx: control-code: "Control code bits: 1010" "Control code: 1010" "Ctrl code: 1010" "Ctrl code" "Ctrl" "C"
17515-17518 eeprom24xx: address-pin: "Address bit 2: 0" "Addr bit 2" "A2" "A"
17518-17521 eeprom24xx: address-pin: "Address bit 1: 0" "Addr bit 1" "A1" "A"
17521-17524 eeprom24xx: address-pin: "Address bit 0: 1" "Addr bit 0" "A0" "A"
17524-17527 eeprom24xx: rw-bit: "R/W bit: write" "R/W" "RW" "W"
17502-17527 eeprom24xx: control-word: "Control word" "Control" "CW" "C"
17499-17531 eeprom24xx: warning: "Warning: No reply from slave!"
17545-17558 eeprom24xx: control-code: "Control code bits: 1010" "Control code: 1010" "Ctrl code: 1010" "Ctrl code" "Ctrl" "C"
17558-17561 eeprom24xx: address-pin: "Address bit 2: 0" "Addr bit 2" "A2" "A"
17561-17564 eeprom24xx: address-pin: "Address bit 1: 0" "Addr bit 1" "A1" "A"
17564-17567 eeprom24xx: address-pin: "Address bit 0: 1" "Addr bit 0" "A0" "A"
17567-17570 eeprom24xx: rw-bit: "R/W bit: write" "R/W" "RW" "W"
17545-17570 eeprom24xx: control-word: "Control word" "Control" "CW" "C"
17541-17574 eeprom24xx: warning: "Warning: No reply from slave!"
17587-17601 eeprom24xx: control-code: "Control code bits: 1010" "Control code: 1010" "Ctrl code: 1010" "Ctrl code" "Ctrl" "C"
17601-17604 eeprom24xx: address-pin: "Address bit 2: 0" "Addr bit 2" "A2" "A"
17604-17607 eeprom24xx: address-pin: "Address bit 1: 0" "Addr bit 1" "A1" "A"
17607-17610 eeprom24xx: address-pin: "Address bit 0: 1" "Addr bit 0" "A0" "A"
17610-17613 eeprom24xx: rw-bit: "R/W bit: write" "R/W" "RW" "W"
17587-17613 eeprom24xx: control-word: "Control word" "Control" "CW" "C"
17584-17617 eeprom24xx: warning: "Warning: No reply from slave!"
17630-17643 eeprom24xx: control-code: "Control code bits: 1010" "Control code: 1010" "Ctrl code: 1010" "Ctrl code" "Ctrl" "C"
17643-17647 eeprom24xx: address-pin: "Address bit 2: 0" "Addr bit 2" "A2" "A"
17647-17650 eeprom24xx: address-pin: "Address bit 1: 0" "Addr bit 1" "A1" "A"
17650-17653 eeprom24xx: address-pin: "Address bit 0: 1" "Addr bit 0" "A0" "A"
17653-17656 eeprom24xx: rw-bit: "R/W bit: write" "R/W" "RW" "W"
17630-17656 eeprom24xx: control-word: "Control word" "Control" "CW" "C"
17627-17659 eeprom24xx: warning: "Warning: No reply from slave!"
17673-17686 eeprom24xx: control-code: "Control code bits: 1010" "Control code: 1010" "Ctrl code: 1010" "Ctrl code" "Ctrl" "C"
17686-17690 eeprom24xx: address-pin: "Address bit 2: 0" "Addr bit 2" "A2" "A"
17690-17693 eeprom24xx: address-pin: "Address bit 1: 0" "Addr bit 1" "A1" "A"
17693-17696 eeprom24xx: address-pin: "Address bit 0: 1" "Addr bit 0" "A0" "A"
17696-17699 eeprom24xx: rw-bit: "R/W bit: write" "R/W" "RW" "W"
17673-17699 eeprom24xx: control-word: "Control word" "Control" "CW" "C"
17670-17702 eeprom24xx: warning: "Warning: No reply from slave!"
17716-17729 eeprom24xx: control-code: "Control code bits: 1010" "Control code: 1010" "Ctrl code: 1010" "Ctrl code" "Ctrl" "C"
17729-17733 eeprom24xx: address-pin: "Address bit 2: 0" "Addr bit 2" "A2" "A"
17733-17736 eeprom24xx: address-pin: "Address bit 1: 0" "Addr bit 1" "A1" "A"
17736-17739 eeprom24xx: address-pin: "Address bit 0: 1" "Addr bit 0" "A0" "A"
17739-17742 eeprom24xx: rw-bit: "R/W bit: write" "R/W" "RW" "W"
17716-17742 eeprom24xx: control-word: "Control word" "Control" "CW" "C"
17713-17745 eeprom24xx: warning: "Warning: No reply from slave!"
17759-17772 eeprom24xx: control-code: "Control code bits: 1010" "Control code: 1010" "Ctrl code: 1010" "Ctrl code" "Ctrl" "C"
17772-17775 eeprom24xx: address-pin: "Address bit 2: 0" "Addr bit 2" "A2" "A"
17775-17779 eeprom24xx: address-pin: "Address bit 1: 0" "Addr bit 1" "A1" "A"
17779-17782 eeprom24xx: address-pin: "Address bit 0: 1" "Addr bit 0" "A0" "A"
17782-17785 eeprom24xx: rw-bit: "R/W bit: write" "R/W" "RW" "W"
17759-17785 eeprom24xx: control-word: "Control word" "Control" "CW" "C"
17756-17788 eeprom24xx: warning: "Warning: No reply from slave!"
17802-17815 eeprom24xx: control-code: "Control code bits: 1010" "Control code: 1010" "Ctrl code: 1010" "Ctrl code" "Ctrl" "C"
17815-17818 eeprom24xx: address-pin: "Address bit 2: 0" "Addr bit 2" "A2" "A"
17818-17822 eeprom24xx: address-pin: "Address bit 1: 0" "Addr bit 1" "A1" "A"
17822-17825 eeprom24xx: address-pin: "Address bit 0: 1" "Addr bit 0" "A0" "A"
17825-17828 eeprom24xx: rw-bit: "R/W bit: write" "R/W" "RW" "W"
17802-17828 eeprom24xx: control-word: "Control word" "Control" "CW" "C"
17799-17831 eeprom24xx: warning: "Warning: No reply from slave!"
17845-17858 eeprom24xx: control-code: "Control code bits: 1010" "Control code: 1010" "Ctrl code: 1010" "Ctrl code" "Ctrl" "C"
17858-17861 eeprom24xx: address-pin: "Address bit 2: 0" "Addr bit 2" "A2" "A"
17861-17865 eeprom24xx: address-pin: "Address bit 1: 0" "Addr bit 1" "A1" "A"
17865-17868 eeprom24xx: address-pin: "Address bit 0: 1" "Addr bit 0" "A0" "A"
17868-17871 eeprom24xx: rw-bit: "R/W bit: write" "R/W" "RW" "W"
17845-17871 eeprom24xx: control-word: "Control word" "Control" "CW" "C"
17842-17874 eeprom24xx: warning: "Warning: No reply from slave!"
17888-17901 eeprom24xx: control-code: "Control code bits: 1010" "Control code: 1010" "Ctrl code: 1010" "Ctrl code" "Ctrl" "C"
17901-17904 eeprom24xx: address-pin: "Address bit 2: 0" "Addr bit 2" "A2" "A"
17904-17907 eeprom24xx: address-pin: "Address bit 1: 0" "Addr bit 1" "A1" "A"
17907-17911 eeprom24xx: address-pin: "Address bit 0: 1" "Addr bit 0" "A0" "A"
17911-17915 eeprom24xx: rw-bit: "R/W bit: write" "R/W" "RW" "W"
17888-17915 eeprom24xx: control-word: "Control word" "Control" "CW" "C"
17885-17918 eeprom24xx: warning: "Warning: No reply from slave!"
17931-17944 eeprom24xx: control-code: "Control code bits: 1010" "Control code: 1010" "Ctrl code: 1010" "Ctrl code" "Ctrl" "C"
17944-17947 eeprom24xx: address-pin: "Address bit 2: 0" "Addr bit 2" "A2" "A"
17947-17950 eeprom24xx: address-pin: "Address bit 1: 0" "Addr bit 1" "A1" "A"
17950-17954 eeprom24xx: address-pin: "Address bit 0: 1" "Addr bit 0" "A0" "A"
17954-17958 eeprom24xx: rw-bit: "R/W bit: write" "R/W" "RW" "W"
17931-17958 eeprom24xx: control-word: "Control word" "Control" "CW" "C"
17928-17961 eeprom24xx: warning: "Warning: No reply from slave!"
17974-17987 eeprom24xx: control-code: "Control code bits: 1010" "Control code: 1010" "Ctrl code: 1010" "Ctrl code" "Ctrl" "C"
17987-17990 eeprom24xx: address-pin: "Address bit 2: 0" "Addr bit 2" "A2" "A"
17990-17993 eeprom24xx: address-pin: "Address bit 1: 0" "Addr bit 1" "A1" "A"
17993-17997 eeprom24xx: address-pin: "Address bit 0: 1" "Addr bit 0" "A0" "A"
17997-18001 eeprom24xx: rw-bit: "R/W bit: write" "R/W" "RW" "W"
17974-18001 eeprom24xx: control-word: "Control word" "Control" "CW" "C"
17971-18004 eeprom24xx: warning: "Warning: No reply from slave!"
18017-18030 eeprom24xx: control-code: "Control code bits: 1010" "Control code: 1010" "Ctrl code: 1010" "Ctrl code" "Ctrl" "C"
18030-18033 eeprom24xx: address-pin: "Address bit 2: 0" "Addr bit 2" "A2" "A"
18033-18036 eeprom24xx: address-pin: "Address bit 1: 0" "Addr bit 1" "A1" "A"
18036-18039 eeprom24xx: address-pin: "Address bit 0: 1" "Addr bit 0" "A0" "A"
18039-18042 eeprom24xx: rw-bit: "R/W bit: write" "R/W" "RW" "W"
18017-18042 eeprom24xx: control-word: "Control word" "Control" "CW" "C"
18013-18046 eeprom24xx: warning: "Warning: No reply from slave!"
18059-18073 eeprom24xx: control-code: "Control code bits: 1010" "Control code: 1010" "Ctrl code: 1010" "Ctrl code" "Ctrl" "C"
18073-18076 eeprom24xx: address-pin: "Address bit 2: 0" "Addr bit 2" "A2" "A"
18076-18079 eeprom24xx: address-pin: "Address bit 1: 0" "Addr bit 1" "A1" "A"
18079-18082 eeprom24xx: address-pin: "Address bit 0: 1" "Addr bit 0" "A0" "A"
18082-18085 eeprom24xx: rw-bit: "R/W bit: write" "R/W" "RW" "W"
18059-18085 eeprom24xx: control-word: "Control word" "Control" "CW" "C"
18056-18089 eeprom24xx: warning: "Warning: No reply from slave!"
18102-18115 eeprom24xx: control-code: "Control code bits: 1010" "Control code: 1010" "Ctrl code: 1010" "Ctrl code" "Ctrl" "C"
18115-18119 eeprom24xx: address-pin: "Address bit 2: 0" "Addr bit 2" "A2" "A"
18119-18122 eeprom24xx: address-pin: "Address bit 1: 0" "Addr bit 1" "A1" "A"
18122-18125 eeprom24xx: address-pin: "Address bit 0: 1" "Addr bit 0" "A0" "A"
18125-18128 eeprom24xx: rw-bit: "R/W bit: write" "R/W" "RW" "W"
18102-18128 eeprom24xx: control-word: "Control word" "Control" "CW" "C"
18099-18132 eeprom24xx: warning: "Warning: No reply from slave!"
18145-18158 eeprom24xx: control-code: "Control code bits: 1010" "Control code: 1010" "Ctrl code: 1010" "Ctrl code" "Ctrl" "C"
18158-18162 eeprom24xx: address-pin: "Address bit 2: 0" "Addr bit 2" "A2" "A"
18162-18165 eeprom24xx: address-pin: "Address bit 1: 0" "Addr bit 1" "A1" "A"
18165-18168 eeprom24xx: address-pin: "Address bit 0: 1" "Addr bit 0" "A0" "A"
18168-18171 eeprom24xx: rw-bit: "R/W bit: write" "R/W" "RW" "W"
18145-18171 eeprom24xx: control-word: "Control word" "Control" "CW" "C"
18142-18174 eeprom24xx: warning: "Warning: No reply from slave!"
18188-18201 eeprom24xx: control-code: "Control code bits: 1010" "Control code: 1010" "Ctrl code: 1010" "Ctrl code" "Ctrl" "C"
18201-18205 eeprom24xx: address-pin: "Address bit 2: 0" "Addr bit 2" "A2" "A"
18205-18208 eeprom24xx: address-pin: "Address bit 1: 0" "Addr bit 1" "A1" "A"
18208-18211 eeprom24xx: address-pin: "Address bit 0: 1" "Addr bit 0" "A0" "A"
18211-18214 eeprom24xx: rw-bit: "R/W bit: write" "R/W" "RW" "W"
18188-18214 eeprom24xx: control-word: "Control word" "Control" "CW" "C"
18185-18217 eeprom24xx: warning: "Warning: No reply from slave!"
18231-18244 eeprom24xx: control-code: "Control code bits: 1010" "Control code: 1010" "Ctrl code: 1010" "Ctrl code" "Ctrl" "C"
18244-18247 eeprom24xx: address-pin: "Address bit 2: 0" "Addr bit 2" "A2" "A"
18247-18251 eeprom24xx: address-pin: "Address bit 1: 0" "Addr bit 1" "A1" "A"
18251-18254 eeprom24xx: address-pin: "Address bit 0: 1" "Addr bit 0" "A0" "A"
18254-18257 eeprom24xx: rw-bit: "R/W bit: write" "R/W" "RW" "W"
18231-18257 eeprom24xx: control-word: "Control word" "Control" "CW" "C"
18228-18260 eeprom24xx: warning: "Warning: No reply from slave!"
18274-18287 eeprom24xx: control-code: "Control code bits: 1010" "Control code: 1010" "Ctrl code: 1010" "Ctrl code" "Ctrl" "C"
18287-18290 eeprom24xx: address-pin: "Address bit 2: 0" "Addr bit 2" "A2" "A"
18290-18294 eeprom24xx: address-pin: "Address bit 1: 0" "Addr bit 1" "A1" "A"
18294-18297 eeprom24xx: address-pin: "Address bit 0: 1" "Addr bit 0" "A0" "A"
18297-18300 eeprom24xx: rw-bit: "R/W bit: write" "R/W" "RW" "W"
18274-18300 eeprom24xx: control-word: "Control word" "Control" "CW" "C"
18271-18303 eeprom24xx: warning: "Warning: No reply from slave!"
18317-18330 eeprom24xx: control-code: "Control code bits: 1010" "Control code: 1010" "Ctrl code: 1010" "Ctrl code" "Ctrl" "C"
18330-18333 eeprom24xx: address-pin: "Address bit 2: 0" "Addr bit 2" "A2" "A"
18333-18337 eeprom24xx: address-pin: "Address bit 1: 0" "Addr bit 1" "A1" "A"
18337-18340 eeprom24xx: address-pin: "Address bit 0: 1" "Addr bit 0" "A0" "A"
18340-18343 eeprom24xx: rw-bit: "R/W bit: write" "R/W" "RW" "W"
18317-18343 eeprom24xx: control-word: "Control word" "Control" "CW" "C"
18314-18346 eeprom24xx: warning: "Warning: No reply from slave!"
18360-18373 eeprom24xx: control-code: "Control code bits: 1010" "Control code: 1010" "Ctrl code: 1010" "Ctrl code" "Ctrl" "C"
18373-18376 eeprom24xx: address-pin: "Address bit 2: 0" "Addr bit 2" "A2" "A"
18376-18380 eeprom24xx: address-pin: "Address bit 1: 0" "Addr bit 1" "A1" "A"
18380-18383 eeprom24xx: address-pin: "Address bit 0: 1" "Addr bit 0" "A0" "A"
18383-18386 eeprom24xx: rw-bit: "R/W bit: write" "R/W" "RW" "W"
18360-18386 eeprom24xx: control-word: "Control word" "Control" "CW" "C"
18357-18389 eeprom24xx: warning: "Warning: No reply from slave!"
18403-18416 eeprom24xx: control-code: "Control code bits: 1010" "Control code: 1010" "Ctrl code: 1010" "Ctrl code" "Ctrl" "C"
18416-18419 eeprom24xx: address-pin: "Address bit 2: 0" "Addr bit 2" "A2" "A"
18419-18422 eeprom24xx: address-pin: "Address bit 1: 0" "Addr bit 1" "A1" "A"
18422-18426 eeprom24xx: address-pin: "Address bit 0: 1" "Addr bit 0" "A0" "A"
18426-18430 eeprom24xx: rw-bit: "R/W bit: write" "R/W" "RW" "W"
18403-18430 eeprom24xx: control-word: "Control word" "Control" "CW" "C"
18400-18433 eeprom24xx: warning: "Warning: No reply from slave!"
18446-18459 eeprom24xx: control-code: "Control code bits: 1010" "Control code: 1010" "Ctrl code: 1010" "Ctrl code" "Ctrl" "C"
18459-18462 eeprom24xx: address-pin: "Address bit 2: 0" "Addr bit 2" "A2" "A"
18462-18465 eeprom24xx: address-pin: "Address bit 1: 0" "Addr bit 1" "A1" "A"
18465-18469 eeprom24xx: address-pin: "Address bit 0: 1" "Addr bit 0" "A0" "A"
18469-18473 eeprom24xx: rw-bit: "R/W bit: write" "R/W" "RW" "W"
18446-18473 eeprom24xx: control-word: "Control word" "Control" "CW" "C"
18443-18476 eeprom24xx: warning: "Warning: No reply from slave!"
18489-18502 eeprom24xx: control-code: "Control code bits: 1010" "Control code: 1010" "Ctrl code: 1010" "Ctrl code" "Ctrl" "C"
18502-18505 eeprom24xx: address-pin: "Address bit 2: 0" "Addr bit 2" "A2" "A"
18505-18508 eeprom24xx: address-pin: "Address bit 1: 0" "Addr bit 1" "A1" "A"
18508-18512 eeprom24xx: address-pin: "Address bit 0: 1" "Addr bit 0" "A0" "A"
18512-18516 eeprom24xx: rw-bit: "R/W bit: write" "R/W" "RW" "W"
18489-18516 eeprom24xx: control-word: "Control word" "Control" "CW" "C"
18486-18519 eeprom24xx: warning: "Warning: No reply from slave!"
18532-18545 eeprom24xx: control-code: "Control code bits: 1010" "Control code: 1010" "Ctrl code: 1010" "Ctrl code" "Ctrl" "C"
18545-18548 eeprom24xx: address-pin: "Address bit 2: 0" "Addr bit 2" "A2" "A"
18548-18551 eeprom24xx: address-pin: "Address bit 1: 0" "Addr bit 1" "A1" "A"
18551-18554 eeprom24xx: address-pin: "Address bit 0: 1" "Addr bit 0" "A0" "A"
18554-18557 eeprom24xx: rw-bit: "R/W bit: write" "R/W" "RW" "W"
18532-18557 eeprom24xx: control-word: "Control word" "Control" "CW" "C"
18528-18561 eeprom24xx: warning: "Warning: No reply from slave!"
18574-18588 eeprom24xx: control-code: "Control code bits: 1010" "Control code: 1010" "Ctrl code: 1010" "Ctrl code" "Ctrl" "C"
18588-18591 eeprom24xx: address-pin: "Address bit 2: 0" "Addr bit 2" "A2" "A"
18591-18594 eeprom24xx: address-pin: "Address bit 1: 0" "Addr bit 1" "A1" "A"
18594-18597 eeprom24xx: address-pin: "Address bit 0: 1" "Addr bit 0" "A0" "A"
18597-18600 eeprom24xx: rw-bit: "R/W bit: write" "R/W" "RW" "W"
18574-18600 eeprom24xx: control-word: "Control word" "Control" "CW" "C"
18571-18604 eeprom24xx: warning: "Warning: No reply from slave!"
18617-18630 eeprom24xx: control-code: "Control code bits: 1010" "Control code: 1010" "Ctrl code: 1010" "Ctrl code" "Ctrl" "C"
18630-18634 eeprom24xx: address-pin: "Address bit 2: 0" "Addr bit 2" "A2" "A"
18634-18637 eeprom24xx: address-pin: "Address bit 1: 0" "Addr bit 1" "A1" "A"
18637-18640 eeprom24xx: address-pin: "Address bit 0: 1" "Addr bit 0" "A0" "A"
18640-18643 eeprom24xx: rw-bit: "R/W bit: write" "R/W" "RW" "W"
18617-18643 eeprom24xx: control-word: "Control word" "Control" "CW" "C"
18614-18647 eeprom24xx: warning: "Warning: No reply from slave!"
18660-18673 eeprom24xx: control-code: "Control code bits: 1010" "Control code: 1010" "Ctrl code: 1010" "Ctrl code" "Ctrl" "C"
18673-18677 eeprom24xx: address-pin: "Address bit 2: 0" "Addr bit 2" "A2" "A"
18677-18680 eeprom24xx: address-pin: "Address bit 1: 0" "Addr bit 1" "A1" "A"
18680-18683 eeprom24xx: address-pin: "Address bit 0: 1" "Addr bit 0" "A0" "A"
18683-18686 eeprom24xx: rw-bit: "R/W bit: write" "R/W" "RW" "W"
18660-18686 eeprom24xx: control-word: "Control word" "Control" "CW" "C"
18657-18689 eeprom24xx: warning: "Warning: No reply from slave!"
18703-18716 eeprom24xx: control-code: "Control code bits: 1010" "Control code: 1010" "Ctrl code: 1010" "Ctrl code" "Ctrl" "C"
18716-18720 eeprom24xx: address-pin: "Address bit 2: 0" "Addr bit 2" "A2" "A"
18720-18723 eeprom24xx: address-pin: "Address bit 1: 0" "Addr bit 1" "A1" "A"
18723-18726 eeprom24xx: address-pin: "Address bit 0: 1" "Addr bit 0" "A0" "A"
18726-18729 eeprom24xx: rw-bit: "R/W bit: write" "R/W" "RW" "W"
18703-18729 eeprom24xx: control-word: "Control word" "Control" "CW" "C"
18700-18732 eeprom24xx: warning: "Warning: No reply from slave!"
18746-18759 eeprom24xx: control-code: "Control code bits: 1010" "Control code: 1010" "Ctrl code: 1010" "Ctrl code" "Ctrl" "C"
18759-18762 eeprom24xx: address-pin: "Address bit 2: 0" "Addr bit 2" "A2" "A"
18762-18766 eeprom24xx: address-pin: "Address bit 1: 0" "Addr bit 1" "A1" "A"
18766-18769 eeprom24xx: address-pin: "Address bit 0: 1" "Addr bit 0" "A0" "A"
18769-18772 eeprom24xx: rw-bit: "R/W bit: write" "R/W" "RW" "W"
18746-18772 eeprom24xx: control-word: "Control word" "Control" "CW" "C"
18743-18775 eeprom24xx: warning: "Warning: No reply from slave!"
18789-18802 eeprom24xx: control-code: "Control code bits: 1010" "Control code: 1010" "Ctrl code: 1010" "Ctrl code" "Ctrl" "C"
18802-18805 eeprom24xx: address-pin: "Address bit 2: 0" "Addr bit 2" "A2" "A"
18805-18809 eeprom24xx: address-pin: "Address bit 1: 0" "Addr bit 1" "A1" "A"
18809-18812 eeprom24xx: address-pin: "Address bit 0: 1" "Addr bit 0" "A0" "A"
18812-18815 eeprom24xx: rw-bit: "R/W bit: write" "R/W" "RW" "W"
18789-18815 eeprom24xx: control-word: "Control word" "Control" "CW" "C"
18786-18818 eeprom24xx: warning: "Warning: No reply from slave!"
18832-18845 eeprom24xx: control-code: "Control code bits: 1010" "Control code: 1010" "Ctrl code: 1010" "Ctrl code" "Ctrl" "C"
18845-18848 eeprom24xx: address-pin: "Address bit 2: 0" "Addr bit 2" "A2" "A"
18848-18852 eeprom24xx: address-pin: "Address bit 1: 0" "Addr bit 1" "A1" "A"
18852-18855 eeprom24xx: address-pin: "Address bit 0: 1" "Addr bit 0" "A0" "A"
18855-18858 eeprom24xx: rw-bit: "R/W bit: write" "R/W" "RW" "W"
18832-18858 eeprom24xx: control-word: "Control word" "Control" "CW" "C"
18829-18861 eeprom24xx: warning: "Warning: No reply from slave!"
18875-18888 eeprom24xx: control-code: "Control code bits: 1010" "Control code: 1010" "Ctrl code: 1010" "Ctrl code" "Ctrl" "C"
18888-18891 eeprom24xx: address-pin: "Address bit 2: 0" "Addr bit 2" "A2" "A"
18891-18894 eeprom24xx: address-pin: "Address bit 1: 0" "Addr bit 1" "A1" "A"
18894-18898 eeprom24xx: address-pin: "Address bit 0: 1" "Addr bit 0" "A0" "A"
18898-18902 eeprom24xx: rw-bit: "R/W bit: write" "R/W" "RW" "W"
18875-18902 eeprom24xx: control-word: "Control word" "Control" "CW" "C"
18872-18905 eeprom24xx: warning: "Warning: No reply from slave!"
18918-18931 eeprom24xx: control-code: "Control code bits: 1010" "Control code: 1010" "Ctrl code: 1010" "Ctrl code" "Ctrl" "C"
18931-18934 eeprom24xx: address-pin: "Address bit 2: 0" "Addr bit 2" "A2" "A"
18934-18937 eeprom24xx: address-pin: "Address bit 1: 0" "Addr bit 1" "A1" "A"
18937-18941 eeprom24xx: address-pin: "Address bit 0: 1" "Addr bit 0" "A0" "A"
18941-18945 eeprom24xx: rw-bit: "R/W bit: write" "R/W" "RW" "W"
18918-18945 eeprom24xx: control-word: "Control word" "Control" "CW" "C"
18915-18960 eeprom24xx: warning: "Warning: Slave replied, but master aborted!"
18999-19013 eeprom24xx: control-code: "Control code bits: 1010" "Control code: 1010" "Ctrl code: 1010" "Ctrl code" "Ctrl" "C"
19013-19016 eeprom24xx: address-pin: "Address bit 2: 0" "Addr bit 2" "A2" "A"
19016-19019 eeprom24xx: address-pin: "Address bit 1: 0" "Addr bit 1" "A1" "A"
19019-19022 eeprom24xx: address-pin: "Address bit 0: 1" "Addr bit 0" "A0" "A"
19022-19025 eeprom24xx: rw-bit: "R/W bit: write" "R/W" "RW" "W"
18999-19025 eeprom24xx: control-word: "Control word" "Control" "CW" "C"
19055-19080 eeprom24xx: word-addr-byte: "Word address high byte: 00" "Word addr high byte: 00" "Addr high: 00" "AH: 00" "00"
19093-19120 eeprom24xx: word-addr-byte: "Word address low byte: 8C" "Word addr low byte: 8C" "Addr low: 8C" "AL: 8C" "8C"
19055-19120 eeprom24xx: word-addr: "Word address" "Word addr" "Addr" "A"
19172-19198 eeprom24xx: data-byte: "Data byte 008C: 01" "Data byte: 01" "Byte: 01" "DB: 01" "01"
19210-19237 eeprom24xx: data-byte: "Data byte 008D: 00" "Data byte: 00" "Byte: 00" "DB: 00" "00"
19247-19273 eeprom24xx: data-byte: "Data byte 008E: 00" "Data byte: 00" "Byte: 00" "DB: 00" "00"
19284-19310 eeprom24xx: data-byte: "Data byte 008F: 03" "Data byte: 03" "Byte: 03" "DB: 03" "03"
19321-19347 eeprom24xx: data-byte: "Data byte 0090: 00" "Data byte: 00" "Byte: 00" "DB: 00" "00"
19359-19386 eeprom24xx: data-byte: "Data byte 0091: 4B" "Data byte: 4B" "Byte: 4B" "DB: 4B" "4B"
19396-19422 eeprom24xx: data-byte: "Data byte 0092: 02" "Data byte: 02" "Byte: 02" "DB: 02" "02"
19433-19459 eeprom24xx: data-byte: "Data byte 0093: 1C" "Data byte: 1C" "Byte: 1C" "DB: 1C" "1C"
19470-19496 eeprom24xx: data-byte: "Data byte 0094: CE" "Data byte: CE" "Byte: CE" "DB: CE" "CE"
19508-19535 eeprom24xx: data-byte: "Data byte 0095: 00" "Data byte: 00" "Byte: 00" "DB: 00" "00"
19545-19571 eeprom24xx: data-byte: "Data byte 0096: 03" "Data byte: 03" "Byte: 03" "DB: 03" "03"
19582-19608 eeprom24xx: data-byte: "Data byte 0097: 00" "Data byte: 00" "Byte: 00" "DB: 00" "00"
19619-19645 eeprom24xx: data-byte: "Data byte 0098: 53" "Data byte: 53" "Byte: 53" "DB: 53" "53"
19657-19684 eeprom24xx: data-byte: "Data byte 0099: 02" "Data byte: 02" "Byte: 02" "DB: 02" "02"
19694-19720 eeprom24xx: data-byte: "Data byte 009A: 01" "Data byte: 01" "Byte: 01" "DB: 01" "01"
19731-19757 eeprom24xx: data-byte: "Data byte 009B: 00" "Data byte: 00" "Byte: 00" "DB: 00" "00"
19768-19794 eeprom24xx: data-byte: "Data byte 009C: 00" "Data byte: 00" "Byte: 00" "DB: 00" "00"
19806-19833 eeprom24xx: data-byte: "Data byte 009D: 03" "Data byte: 03" "Byte: 03" "DB: 03" "03"
19843-19869 eeprom24xx: data-byte: "Data byte 009E: 00" "Data byte: 00" "Byte: 00" "DB: 00" "00"
19880-19906 eeprom24xx: data-byte: "Data byte 009F: 5B" "Data byte: 5B" "Byte: 5B" "DB: 5B" "5B"
19917-19943 eeprom24xx: data-byte: "Data byte 00A0: 02" "Data byte: 02" "Byte: 02" "DB: 02" "02"
19955-19982 eeprom24xx: data-byte: "Data byte 00A1: 1C" "Data byte: 1C" "Byte: 1C" "DB: 1C" "1C"
19992-20018 eeprom24xx: data-byte: "Data byte 00A2: E2" "Data byte: E2" "Byte: E2" "DB: E2" "E2"
20029-20055 eeprom24xx: data-byte: "Data byte 00A3: 00" "Data byte: 00" "Byte: 00" "DB: 00" "00"
20066-20092 eeprom24xx: data-byte: "Data byte 00A4: 03" "Data byte: 03" "Byte: 03" "DB: 03" "03"
20104-20131 eeprom24xx: data-byte: "Data byte 00A5: 00" "Data byte: 00" "Byte: 00" "DB: 00" "00"
20141-20167 eeprom24xx: data-byte: "Data byte 00A6: 63" "Data byte: 63" "Byte: 63" "DB: 63" "63"
20178-20204 eeprom24xx: data-byte: "Data byte 00A7: 02" "Data byte: 02" "Byte: 02" "DB: 02" "02"
20215-20241 eeprom24xx: data-byte: "Data byte 00A8: 1C" "Data byte: 1C" "Byte: 1C" "DB: 1C" "1C"
20253-20280 eeprom24xx: data-byte: "Data byte 00A9: E3" "Data byte: E3" "Byte: E3" "DB: E3" "E3"
20290-20316 eeprom24xx: data-byte: "Data byte 00AA: 00" "Data byte: 00" "Byte: 00" "DB: 00" "00"
20327-20353 eeprom24xx: data-byte: "Data byte 00AB: 03" "Data byte: 03" "Byte: 03" "DB: 03" "03"
20364-20390 eeprom24xx: data-byte: "Data byte 00AC: 00" "Data byte: 00" "Byte: 00" "DB: 00" "00"
20402-20429 eeprom24xx: data-byte: "Data byte 00AD: C2" "Data byte: C2" "Byte: C2" "DB: C2" "C2"
20439-20465 eeprom24xx: data-byte: "Data byte 00AE: 02" "Data byte: 02" "Byte: 02" "DB: 02" "02"
20476-20502 eeprom24xx: data-byte: "Data byte 00AF: 00" "Data byte: 00" "Byte: 00" "DB: 00" "00"
20513-20539 eeprom24xx: data-byte: "Data byte 00B0: 66" "Data byte: 66" "Byte: 66" "DB: 66" "66"
20551-20576 eeprom24xx: data-byte: "Data byte 00B1: 00" "Data byte: 00" "Byte: 00" "DB: 00" "00"
20588-20615 eeprom24xx: data-byte: "Data byte 00B2: 03" "Data byte: 03" "Byte: 03" "DB: 03" "03"
20625-20651 eeprom24xx: data-byte: "Data byte 00B3: 00" "Data byte: 00" "Byte: 00" "DB: 00" "00"
20662-20688 eeprom24xx: data-byte: "Data byte 00B4: 66" "Data byte: 66" "Byte: 66" "DB: 66" "66"
20700-20725 eeprom24xx: data-byte: "Data byte 00B5: 02" "Data byte: 02" "Byte: 02" "DB: 02" "02"
20737-20764 eeprom24xx: data-byte: "Data byte 00B6: 09" "Data byte: 09" "Byte: 09" "DB: 09" "09"
20774-20800 eeprom24xx: data-byte: "Data byte 00B7: B4" "Data byte: B4" "Byte: B4" "DB: B4" "B4"
20811-20837 eeprom24xx: data-byte: "Data byte 00B8: 03" "Data byte: 03" "Byte: 03" "DB: 03" "03"
19172-20837 eeprom24xx: data: "Data" "D"
18996-20853 eeprom24xx: page-write: "Page write (addr=008C, 45 bytes): 01 00 00 03 00 4B 02 1C CE 00 03 00 53 02 01 00 00 03 00 5B 02 1C E2 00 03 00 63 02 1C E3 00 03 00 C2 02 00 66 00 03 00 66 02 09 B4 03" "Page write (addr=008C, 45 bytes)" "Page write" "PW" "P"
20864-20877 eeprom24xx: control-code: "Control code bits: 1010" "Control code: 1010" "Ctrl code: 1010" "Ctrl code" "Ctrl" "C"
20877-20880 eeprom24xx: address-pin: "Address bit 2: 0" "Addr bit 2" "A2" "A"
20880-20883 eeprom24xx: address-pin: "Address bit 1: 0" "Addr bit 1" "A1" "A"
20883-20886 eeprom24xx: address-pin: "Address bit 0: 1" "Addr bit 0" "A0" "A"
20886-20889 eeprom24xx: rw-bit: "R/W bit: write" "R/W" "RW" "W"
20864-20889 eeprom24xx: control-word: "Control word" "Control" "CW" "C"
20860-20893 eeprom24xx: warning: "Warning: No reply from slave!"
20906-20919 eeprom24xx: control-code: "Control code bits: 1010" "Control code: 1010" "Ctrl code: 1010" "Ctrl code" "Ctrl" "C"
20919-20922 eeprom24xx: address-pin: "Address bit 2: 0" "Addr bit 2" "A2" "A"
20922-20925 eeprom24xx: address-pin: "Address bit 1: 0" "Addr bit 1" "A1" "A"
20925-20929 eeprom24xx: address-pin: "Address bit 0: 1" "Addr bit 0" "A0" "A"
20929-20933 eeprom24xx: rw-bit: "R/W bit: write" "R/W" "RW" "W"
20906-20933 eeprom24xx: control-word: "Control word" "Control" "CW" "C"
20903-20936 eeprom24xx: warning: "Warning: No reply from slave!"
20949-20962 eeprom24xx: control-code: "Control code bits: 1010" "Control code: 1010" "Ctrl code: 1010" "Ctrl code" "Ctrl" "C"
20962-20965 eeprom24xx: address-pin: "Address bit 2: 0" "Addr bit 2" "A2" "A"
20965-20968 eeprom24xx: address-pin: "Address bit 1: 0" "Addr bit 1" "A1" "A"
20968-20972 eeprom24xx: address-pin: "Address bit 0: 1" "Addr bit 0" "A0" "A"
20972-20976 eeprom24xx: rw-bit: "R/W bit: write" "R/W" "RW" "W"
20949-20976 eeprom24xx: control-word: "Control word" "Control" "CW" "C"
20946-20979 eeprom24xx: warning: "Warning: No reply from slave!"
20992-21005 eeprom24xx: control-code: "Control code bits: 1010" "Control code: 1010" "Ctrl code: 1010" "Ctrl code" "Ctrl" "C"
21005-21008 eeprom24xx: address-pin: "Address bit 2: 0" "Addr bit 2" "A2" "A"
21008-21011 eeprom24xx: address-pin: "Address bit 1: 0" "Addr bit 1" "A1" "A"
21011-21015 eeprom24xx: address-pin: "Address bit 0: 1" "Addr bit 0" "A0" "A"
21015-21019 eeprom24xx: rw-bit: "R/W bit: write" "R/W" "RW" "W"
20992-21019 eeprom24xx: control-word: "Control word" "Control" "CW" "C"
20989-21022 eeprom24xx: warning: "Warning: No reply from slave!"
21035-21048 eeprom24xx: control-code: "Control code bits: 1010" "Control code: 1010" "Ctrl code: 1010" "Ctrl code" "Ctrl" "C"
21048-21051 eeprom24xx: address-pin: "Address bit 2: 0" "Addr bit 2" "A2" "A"
21051-21054 eeprom24xx: address-pin: "Address bit 1: 0" "Addr bit 1" "A1" "A"
21054-21057 eeprom24xx: address-pin: "Address bit 0: 1" "Addr bit 0" "A0" "A"
21057-21060 eeprom24xx: rw-bit: "R/W bit: write" "R/W" "RW" "W"
21035-21060 eeprom24xx: control-word: "Control word" "Control" "CW" "C"
21032-21064 eeprom24xx: warning: "Warning: No reply from slave!"
21078-21091 eeprom24xx: control-code: "Control code bits: 1010" "Control code: 1010" "Ctrl code: 1010" "Ctrl code" "Ctrl" "C"
21091-21094 eeprom24xx: address-pin: "Address bit 2: 0" "Addr bit 2" "A2" "A"
21094-21097 eeprom24xx: address-pin: "Address bit 1: 0" "Addr bit 1" "A1" "A"
21097-21100 eeprom24xx: address-pin: "Address bit 0: 1" "Addr bit 0" "A0" "A"
21100-21103 eeprom24xx: rw-bit: "R/W bit: write" "R/W" "RW" "W"
21078-21103 eeprom24xx: control-word: "Control word" "Control" "CW" "C"
21074-21107 eeprom24xx: warning: "Warning: No reply from slave!"
21120-21133 eeprom24xx: control-code: "Control code bits: 1010" "Control code: 1010" "Ctrl code: 1010" "Ctrl code" "Ctrl" "C"
21133-21137 eeprom24xx: address-pin: "Address bit 2: 0" "Addr bit 2" "A2" "A"
21137-21140 eeprom24xx: address-pin: "Address bit 1: 0" "Addr bit 1" "A1" "A"
21140-21143 eeprom24xx: address-pin: "Address bit 0: 1" "Addr bit 0" "A0" "A"
21143-21146 eeprom24xx: rw-bit: "R/W bit: write" "R/W" "RW" "W"
21120-21146 eeprom24xx: control-word: "Control word" "Control" "CW" "C"
21117-21150 eeprom24xx: warning: "Warning: No reply from slave!"
21163-21176 eeprom24xx: control-code: "Control code bits: 1010" "Control code: 1010" "Ctrl code: 1010" "Ctrl code" "Ctrl" "C"
21176-21180 eeprom24xx: address-pin: "Address bit 2: 0" "Addr bit 2" "A2" "A"
21180-21183 eeprom24xx: address-pin: "Address bit 1: 0" "Addr bit 1" "A1" "A"
21183-21186 eeprom24xx: address-pin: "Address bit 0: 1" "Addr bit 0" "A0" "A"
21186-21189 eeprom24xx: rw-bit: "R/W bit: write" "R/W" "RW" "W"
21163-21189 eeprom24xx: control-word: "Control word" "Control" "CW" "C"
21160-21192 eeprom24xx: warning: "Warning: No reply from slave!"
21206-21219 eeprom24xx: control-code: "Control code bits: 1010" "Control code: 1010" "Ctrl code: 1010" "Ctrl code" "Ctrl" "C"
21219-21223 eeprom24xx: address-pin: "Address bit 2: 0" "Addr bit 2" "A2" "A"
21223-21226 eeprom24xx: address-pin: "Address bit 1: 0" "Addr bit 1" "A1" "A"
21226-21229 eeprom24xx: address-pin: "Address bit 0: 1" "Addr bit 0" "A0" "A"
21229-21232 eeprom24xx: rw-bit: "R/W bit: write" "R/W" "RW" "W"
21206-21232 eeprom24xx: control-word: "Control word" "Control" "CW" "C"
21203-21235 eeprom24xx: warning: "Warning: No reply from slave!"
21249-21262 eeprom24xx: control-code: "Control code bits: 1010" "Control code: 1010" "Ctrl code: 1010" "Ctrl code" "Ctrl" "C"
21262-21265 eeprom24xx: address-pin: "Address bit 2: 0" "Addr bit 2" "A2" "A"
21265-21269 eeprom24xx: address-pin: "Address bit 1: 0" "Addr bit 1" "A1" "A"
21269-21272 eeprom24xx: address-pin: "Address bit 0: 1" "Addr bit 0" "A0" "A"
21272-21275 eeprom24xx: rw-bit: "R/W bit: write" "R/W" "RW" "W"
21249-21275 eeprom24xx: control-word: "Control word" "Control" "CW" "C"
21246-21278 eeprom24xx: warning: "Warning: No reply from slave!"
21292-21305 eeprom24xx: control-code: "Control code bits: 1010" "Control code: 1010" "Ctrl code: 1010" "Ctrl code" "Ctrl" "C"
21305-21308 eeprom24xx: address-pin: "Address bit 2: 0" "Addr bit 2" "A2" "A"
21308-21312 eeprom24xx: address-pin: "Address bit 1: 0" "Addr bit 1" "A1" "A"
21312-21315 eeprom24xx: address-pin: "Address bit 0: 1" "Addr bit 0" "A0" "A"
21315-21318 eeprom24xx: rw-bit: "R/W bit: write" "R/W" "RW" "W"
21292-21318 eeprom24xx: control-word: "Control word" "Control" "CW" "C"
21289-21321 eeprom24xx: warning: "Warning: No reply from slave!"
21335-21348 eeprom24xx: control-code: "Control code bits: 1010" "Control code: 1010" "Ctrl code: 1010" "Ctrl code" "Ctrl" "C"
21348-21351 eeprom24xx: address-pin: "Address bit 2: 0" "Addr bit 2" "A2" "A"
21351-21355 eeprom24xx: address-pin: "Address bit 1: 0" "Addr bit 1" "A1" "A"
21355-21358 eeprom24xx: address-pin: "Address bit 0: 1" "Addr bit 0" "A0" "A"
21358-21361 eeprom24xx: rw-bit: "R/W bit: write" "R/W" "RW" "W"
21335-21361 eeprom24xx: control-word: "Control word" "Control" "CW" "C"
21332-21364 eeprom24xx: warning: "Warning: No reply from slave!"
21378-21391 eeprom24xx: control-code: "Control code bits: 1010" "Control code: 1010" "Ctrl code: 1010" "Ctrl code" "Ctrl" "C"
21391-21394 eeprom24xx: address-pin: "Address bit 2: 0" "Addr bit 2" "A2" "A"
21394-21398 eeprom24xx: address-pin: "Address bit 1: 0" "Addr bit 1" "A1" "A"
21398-21401 eeprom24xx: address-pin: "Address bit 0: 1" "Addr bit 0" "A0" "A"
21401-21404 eeprom24xx: rw-bit: "R/W bit: write" "R/W" "RW" "W"
21378-21404 eeprom24xx: control-word: "Control word" "Control" "CW" "C"
21375-21407 eeprom24xx: warning: "Warning: No reply from slave!"
21421-21434 eeprom24xx: control-code: "Control code bits: 1010" "Control code: 1010" "Ctrl code: 1010" "Ctrl code" "Ctrl" "C"
21434-21437 eeprom24xx: address-pin: "Address bit 2: 0" "Addr bit 2" "A2" "A"
21437-21440 eeprom24xx: address-pin: "Address bit 1: 0" "Addr bit 1" "A1" "A"
21440-21444 eeprom24xx: address-pin: "Address bit 0: 1" "Addr bit 0" "A0" "A"
21444-21448 eeprom24xx: rw-bit: "R/W bit: write" "R/W" "RW" "W"
21421-21448 eeprom24xx: control-word: "Control word" "Control" "CW" "C"
21418-21451 eeprom24xx: warning: "Warning: No reply from slave!"
21464-21477 eeprom24xx: control-code: "Control code bits: 1010" "Control code: 1010" "Ctrl code: 1010" "Ctrl code" "Ctrl" "C"
21477-21480 eeprom24xx: address-pin: "Address bit 2: 0" "Addr bit 2" "A2" "A"
21480-21483 eeprom24xx: address-pin: "Address bit 1: 0" "Addr bit 1" "A1" "A"
21483-21487 eeprom24xx: address-pin: "Address bit 0: 1" "Addr bit 0" "A0" "A"
21487-21491 eeprom24xx: rw-bit: "R/W bit: write" "R/W" "RW" "W"
21464-21491 eeprom24xx: control-word: "Control word" "Control" "CW" "C"
21461-21494 eeprom24xx: warning: "Warning: No reply from slave!"
21507-21520 eeprom24xx: control-code: "Control code bits: 1010" "Control code: 1010" "Ctrl code: 1010" "Ctrl code" "Ctrl" "C"
21520-21523 eeprom24xx: address-pin: "Address bit 2: 0" "Addr bit 2" "A2" "A"
21523-21526 eeprom24xx: address-pin: "Address bit 1: 0" "Addr bit 1" "A1" "A"
21526-21530 eeprom24xx: address-pin: "Address bit 0: 1" "Addr bit 0" "A0" "A"
21530-21534 eeprom24xx: rw-bit: "R/W bit: write" "R/W" "RW" "W"
21507-21534 eeprom24xx: control-word: "Control word" "Control" "CW" "C"
21504-21537 eeprom24xx: warning: "Warning: No reply from slave!"
21550-21563 eeprom24xx: control-code: "Control code bits: 1010" "Control code: 1010" "Ctrl code: 1010" "Ctrl code" "Ctrl" "C"
21563-21566 eeprom24xx: address-pin: "Address bit 2: 0" "Addr bit 2" "A2" "A"
21566-21569 eeprom24xx: address-pin: "Address bit 1: 0" "Addr bit 1" "A1" "A"
21569-21572 eeprom24xx: address-pin: "Address bit 0: 1" "Addr bit 0" "A0" "A"
21572-21575 eeprom24xx: rw-bit: "R/W bit: write" "R/W" "RW" "W"
21550-21575 eeprom24xx: control-word: "Control word" "Control" "CW" "C"
21546-21579 eeprom24xx: warning: "Warning: No reply from slave!"
21592-21606 eeprom24xx: control-code: "Control code bits: 1010" "Control code: 1010" "Ctrl code: 1010" "Ctrl code" "Ctrl" "C"
21606-21609 eeprom24xx: address-pin: "Address bit 2: 0" "Addr bit 2" "A2" "A"
21609-21612 eeprom24xx: address-pin: "Address bit 1: 0" "Addr bit 1" "A1" "A"
21612-21615 eeprom24xx: address-pin: "Address bit 0: 1" "Addr bit 0" "A0" "A"
21615-21618 eeprom24xx: rw-bit: "R/W bit: write" "R/W" "RW" "W"
21592-21618 eeprom24xx: control-word: "Control word" "Control" "CW" "C"
21589-21622 eeprom24xx: warning: "Warning: No reply from slave!"
21635-21648 eeprom24xx: control-code: "Control code bits: 1010" "Control code: 1010" "Ctrl code: 1010" "Ctrl code" "Ctrl" "C"
21648-21652 eeprom24xx: address-pin: "Address bit 2: 0" "Addr bit 2" "A2" "A"
21652-21655 eeprom24xx: address-pin: "Address bit 1: 0" "Addr bit 1" "A1" "A"
21655-21658 eeprom24xx: address-pin: "Address bit 0: 1" "Addr bit 0" "A0" "A"
21658-21661 eeprom24xx: rw-bit: "R/W bit: write" "R/W" "RW" "W"
21635-21661 eeprom24xx: control-word: "Control word" "Control" "CW" "C"
21632-21665 eeprom24xx: warning: "Warning: No reply from slave!"
21678-21691 eeprom24xx: control-code: "Control code bits: 1010" "Control code: 1010" "Ctrl code: 1010" "Ctrl code" "Ctrl" "C"
21691-21695 eeprom24xx: address-pin: "Address bit 2: 0" "Addr bit 2" "A2" "A"
21695-21698 eeprom24xx: address-pin: "Address bit 1: 0" "Addr bit 1" "A1" "A"
21698-21701 eeprom24xx: address-pin: "Address bit 0: 1" "Addr bit 0" "A0" "A"
21701-21704 eeprom24xx: rw-bit: "R/W bit: write" "R/W" "RW" "W"
21678-21704 eeprom24xx: control-word: "Control word" "Control" "CW" "C"
21675-21707 eeprom24xx: warning: "Warning: No reply from slave!"
21721-21734 eeprom24xx: control-code: "Control code bits: 1010" "Control code: 1010" "Ctrl code: 1010" "Ctrl code" "Ctrl" "C"
21734-21738 eeprom24xx: address-pin: "Address bit 2: 0" "Addr bit 2" "A2" "A"
21738-21741 eeprom24xx: address-pin: "Address bit 1: 0" "Addr bit 1" "A1" "A"
21741-21744 eeprom24xx: address-pin: "Address bit 0: 1" "Addr bit 0" "A0" "A"
21744-21747 eeprom24xx: rw-bit: "R/W bit: write" "R/W" "RW" "W"
21721-21747 eeprom24xx: control-word: "Control word" "Control" "CW" "C"
21718-21750 eeprom24xx: warning: "Warning: No reply from slave!"
21764-21777 eeprom24xx: control-code: "Control code bits: 1010" "Control code: 1010" "Ctrl code: 1010" "Ctrl code" "Ctrl" "C"
21777-21780 eeprom24xx: address-pin: "Address bit 2: 0" "Addr bit 2" "A2" "A"
21780-21784 eeprom24xx: address-pin: "Address bit 1: 0" "Addr bit 1" "A1" "A"
21784-21787 eeprom24xx: address-pin: "Address bit 0: 1" "Addr bit 0" "A0" "A"
21787-21790 eeprom24xx: rw-bit: "R/W bit: write" "R/W" "RW" "W"
21764-21790 eeprom24xx: control-word: "Control word" "Control" "CW" "C"
21761-21793 eeprom24xx: warning: "Warning: No reply from slave!"
21807-21820 eeprom24xx: control-code: "Control code bits: 1010" "Control code: 1010" "Ctrl code: 1010" "Ctrl code" "Ctrl" "C"
21820-21823 eeprom24xx: address-pin: "Address bit 2: 0" "Addr bit 2" "A2" "A"
21823-21827 eeprom24xx: address-pin: "Address bit 1: 0" "Addr bit 1" "A1" "A"
21827-21830 eeprom24xx: address-pin: "Address bit 0: 1" "Addr bit 0" "A0" "A"
21830-21833 eeprom24xx: rw-bit: "R/W bit: write" "R/W" "RW" "W"
21807-21833 eeprom24xx: control-word: "Control word" "Control" "CW" "C"
21804-21836 eeprom24xx: warning: "Warning: No reply from slave!"
21850-21863 eeprom24xx: control-code: "Control code bits: 1010" "Control code: 1010" "Ctrl code: 1010" "Ctrl code" "Ctrl" "C"
21863-21866 eeprom24xx: address-pin: "Address bit 2: 0" "Addr bit 2" "A2" "A"
21866-21870 eeprom24xx: address-pin: "Address bit 1: 0" "Addr bit 1" "A1" "A"
21870-21873 eeprom24xx: address-pin: "Address bit 0: 1" "Addr bit 0" "A0" "A"
21873-21876 eeprom24xx: rw-bit: "R/W bit: write" "R/W" "RW" "W"
21850-21876 eeprom24xx: control-word: "Control word" "Control" "CW" "C"
21847-21879 eeprom24xx: warning: "Warning: No reply from slave!"
21893-21906 eeprom24xx: control-code: "Control code bits: 1010" "Control code: 1010" "Ctrl code: 1010" "Ctrl code" "Ctrl" "C"
21906-21909 eeprom24xx: address-pin: "Address bit 2: 0" "Addr bit 2" "A2" "A"
21909-21912 eeprom24xx: address-pin: "Address bit 1: 0" "Addr bit 1" "A1" "A"
21912-21916 eeprom24xx: address-pin: "Address bit 0: 1" "Addr bit 0" "A0" "A"
21916-21920 eeprom24xx: rw-bit: "R/W bit: write" "R/W" "RW" "W"
21893-21920 eeprom24xx: control-word: "Control word" "Control" "CW" "C"
21890-21923 eeprom24xx: warning: "Warning: No reply from slave!"
21936-21949 eeprom24xx: control-code: "Control code bits: 1010" "Control code: 1010" "Ctrl code: 1010" "Ctrl code" "Ctrl" "C"
21949-21952 eeprom24xx: address-pin: "Address bit 2: 0" "Addr bit 2" "A2" "A"
21952-21955 eeprom24xx: address-pin: "Address bit 1: 0" "Addr bit 1" "A1" "A"
21955-21959 eeprom24xx: address-pin: "Address bit 0: 1" "Addr bit 0" "A0" "A"
21959-21963 eeprom24xx: rw-bit: "R/W bit: write" "R/W" "RW" "W"
21936-21963 eeprom24xx: control-word: "Control word" "Control" "CW" "C"
21933-21966 eeprom24xx: warning: "Warning: No reply from slave!"
21979-21992 eeprom24xx: control-code: "Control code bits: 1010" "Control code: 1010" "Ctrl code: 1010" "Ctrl code" "Ctrl" "C"
21992-21995 eeprom24xx: address-pin: "Address bit 2: 0" "Addr bit 2" "A2" "A"
21995-21998 eeprom24xx: address-pin: "Address bit 1: 0" "Addr bit 1" "A1" "A"
21998-22002 eeprom24xx: address-pin: "Address bit 0: 1" "Addr bit 0" "A0" "A"
22002-22006 eeprom24xx: rw-bit: "R/W bit: write" "R/W" "RW" "W"
21979-22006 eeprom24xx: control-word: "Control word" "Control" "CW" "C"
21976-22009 eeprom24xx: warning: "Warning: No reply from slave!"
22022-22035 eeprom24xx: control-code: "Control code bits: 1010" "Control code: 1010" "Ctrl code: 1010" "Ctrl code" "Ctrl" "C"
22035-22038 eeprom24xx: address-pin: "Address bit 2: 0" "Addr bit 2" "A2" "A"
22038-22041 eeprom24xx: address-pin: "Address bit 1: 0" "Addr bit 1" "A1" "A"
22041-22044 eeprom24xx: address-pin: "Address bit 0: 1" "Addr bit 0" "A0" "A"
22044-22047 eeprom24xx: rw-bit: "R/W bit: write" "R/W" "RW" "W"
22022-22047 eeprom24xx: control-word: "Control word" "Control" "CW" "C"
22019-22051 eeprom24xx: warning: "Warning: No reply from slave!"
22065-22078 eeprom24xx: control-code: "Control code bits: 1010" "Control code: 1010" "Ctrl code: 1010" "Ctrl code" "Ctrl" "C"
22078-22081 eeprom24xx: address-pin: "Address bit 2: 0" "Addr bit 2" "A2" "A"
22081-22084 eeprom24xx: address-pin: "Address bit 1: 0" "Addr bit 1" "A1" "A"
22084-22087 eeprom24xx: address-pin: "Address bit 0: 1" "Addr bit 0" "A0" "A"
22087-22090 eeprom24xx: rw-bit: "R/W bit: write" "R/W" "RW" "W"
22065-22090 eeprom24xx: control-word: "Control word" "Control" "CW" "C"
22061-22094 eeprom24xx: warning: "Warning: No reply from slave!"
22107-22121 eeprom24xx: control-code: "Control code bits: 1010" "Control code: 1010" "Ctrl code: 1010" "Ctrl code" "Ctrl" "C"
22121-22124 eeprom24xx: address-pin: "Address bit 2: 0" "Addr bit 2" "A2" "A"
22124-22127 eeprom24xx: address-pin: "Address bit 1: 0" "Addr bit 1" "A1" "A"
22127-22130 eeprom24xx: address-pin: "Address bit 0: 1" "Addr bit 0" "A0" "A"
22130-22133 eeprom24xx: rw-bit: "R/W bit: write" "R/W" "RW" "W"
22107-22133 eeprom24xx: control-word: "Control word" "Control" "CW" "C"
22104-22137 eeprom24xx: warning: "Warning: No reply from slave!"
22150-22163 eeprom24xx: control-code: "Control code bits: 1010" "Control code: 1010" "Ctrl code: 1010" "Ctrl code" "Ctrl" "C"
22163-22167 eeprom24xx: address-pin: "Address bit 2: 0" "Addr bit 2" "A2" "A"
22167-22170 eeprom24xx: address-pin: "Address bit 1: 0" "Addr bit 1" "A1" "A"
22170-22173 eeprom24xx: address-pin: "Address bit 0: 1" "Addr bit 0" "A0" "A"
22173-22176 eeprom24xx: rw-bit: "R/W bit: write" "R/W" "RW" "W"
22150-22176 eeprom24xx: control-word: "Control word" "Control" "CW" "C"
22147-22180 eeprom24xx: warning: "Warning: No reply from slave!"
22193-22206 eeprom24xx: control-code: "Control code bits: 1010" "Control code: 1010" "Ctrl code: 1010" "Ctrl code" "Ctrl" "C"
22206-22210 eeprom24xx: address-pin: "Address bit 2: 0" "Addr bit 2" "A2" "A"
22210-22213 eeprom24xx: address-pin: "Address bit 1: 0" "Addr bit 1" "A1" "A"
22213-22216 eeprom24xx: address-pin: "Address bit 0: 1" "Addr bit 0" "A0" "A"
22216-22219 eeprom24xx: rw-bit: "R/W bit: write" "R/W" "RW" "W"
22193-22219 eeprom24xx: control-word: "Control word" "Control" "CW" "C"
22190-22222 eeprom24xx: warning: "Warning: No reply from slave!"
22236-22249 eeprom24xx: control-code: "Control code bits: 1010" "Control code: 1010" "Ctrl code: 1010" "Ctrl code" "Ctrl" "C"
22249-22253 eeprom24xx: address-pin: "Address bit 2: 0" "Addr bit 2" "A2" "A"
22253-22256 eeprom24xx: address-pin: "Address bit 1: 0" "Addr bit 1" "A1" "A"
22256-22259 eeprom24xx: address-pin: "Address bit 0: 1" "Addr bit 0" "A0" "A"
22259-22262 eeprom24xx: rw-bit: "R/W bit: write" "R/W" "RW" "W"
22236-22262 eeprom24xx: control-word: "Control word" "Control" "CW" "C"
22233-22265 eeprom24xx: warning: "Warning: No reply from slave!"
22279-22292 eeprom24xx: control-code: "Control code bits: 1010" "Control code: 1010" "Ctrl code: 1010" "Ctrl code" "Ctrl" "C"
22292-22295 eeprom24xx: address-pin: "Address bit 2: 0" "Addr bit 2" "A2" "A"
22295-22299 eeprom24xx: address-pin: "Address bit 1: 0" "Addr bit 1" "A1" "A"
22299-22302 eeprom24xx: address-pin: "Address bit 0: 1" "Addr bit 0" "A0" "A"
22302-22305 eeprom24xx: rw-bit: "R/W bit: write" "R/W" "RW" "W"
22279-22305 eeprom24xx: control-word: "Control word" "Control" "CW" "C"
22276-22308 eeprom24xx: warning: "Warning: No reply from slave!"
22322-22335 eeprom24xx: control-code: "Control code bits: 1010" "Control code: 1010" "Ctrl code: 1010" "Ctrl code" "Ctrl" "C"
22335-22338 eeprom24xx: address-pin: "Address bit 2: 0" "Addr bit 2" "A2" "A"
22338-22342 eeprom24xx: address-pin: "Address bit 1: 0" "Addr bit 1" "A1" "A"
22342-22345 eeprom24xx: address-pin: "Address bit 0: 1" "Addr bit 0" "A0" "A"
22345-22348 eeprom24xx: rw-bit: "R/W bit: write" "R/W" "RW" "W"
22322-22348 eeprom24xx: control-word: "Control word" "Control" "CW" "C"
22319-22351 eeprom24xx: warning: "Warning: No reply from slave!"
22365-22378 eeprom24xx: control-code: "Control code bits: 1010" "Control code: 1010" "Ctrl code: 1010" "Ctrl code" "Ctrl" "C"
22378-22381 eeprom24xx: address-pin: "Address bit 2: 0" "Addr bit 2" "A2" "A"
22381-22385 eeprom24xx: address-pin: "Address bit 1: 0" "Addr bit 1" "A1" "A"
22385-22388 eeprom24xx: address-pin: "Address bit 0: 1" "Addr bit 0" "A0" "A"
22388-22391 eeprom24xx: rw-bit: "R/W bit: write" "R/W" "RW" "W"
22365-22391 eeprom24xx: control-word: "Control word" "Control" "CW" "C"
22362-22394 eeprom24xx: warning: "Warning: No reply from slave!"
22408-22421 eeprom24xx: control-code: "Control code bits: 1010" "Control code: 1010" "Ctrl code: 1010" "Ctrl code" "Ctrl" "C"
22421-22424 eeprom24xx: address-pin: "Address bit 2: 0" "Addr bit 2" "A2" "A"
22424-22427 eeprom24xx: address-pin: "Address bit 1: 0" "Addr bit 1" "A1" "A"
22427-22431 eeprom24xx: address-pin: "Address bit 0: 1" "Addr bit 0" "A0" "A"
22431-22435 eeprom24xx: rw-bit: "R/W bit: write" "R/W" "RW" "W"
22408-22435 eeprom24xx: control-word: "Control word" "Control" "CW" "C"
22405-22438 eeprom24xx: warning: "Warning: No reply from slave!"
22451-22464 eeprom24xx: control-code: "Control code bits: 1010" "Control code: 1010" "Ctrl code: 1010" "Ctrl code" "Ctrl" "C"
22464-22467 eeprom24xx: address-pin: "Address bit 2: 0" "Addr bit 2" "A2" "A"
22467-22470 eeprom24xx: address-pin: "Address bit 1: 0" "Addr bit 1" "A1" "A"
22470-22474 eeprom24xx: address-pin: "Address bit 0: 1" "Addr bit 0" "A0" "A"
22474-22478 eeprom24xx: rw-bit: "R/W bit: write" "R/W" "RW" "W"
22451-22478 eeprom24xx: control-word: "Control word" "Control" "CW" "C"
22448-22481 eeprom24xx: warning: "Warning: No reply from slave!"
22494-22507 eeprom24xx: control-code: "Control code bits: 1010" "Control code: 1010" "Ctrl code: 1010" "Ctrl code" "Ctrl" "C"
22507-22510 eeprom24xx: address-pin: "Address bit 2: 0" "Addr bit 2" "A2" "A"
22510-22513 eeprom24xx: address-pin: "Address bit 1: 0" "Addr bit 1" "A1" "A"
22513-22517 eeprom24xx: address-pin: "Address bit 0: 1" "Addr bit 0" "A0" "A"
22517-22521 eeprom24xx: rw-bit: "R/W bit: write" "R/W" "RW" "W"
22494-22521 eeprom24xx: control-word: "Control word" "Control" "CW" "C"
22491-22524 eeprom24xx: warning: "Warning: No reply from slave!"
22537-22550 eeprom24xx: control-code: "Control code bits: 1010" "Control code: 1010" "Ctrl code: 1010" "Ctrl code" "Ctrl" "C"
22550-22553 eeprom24xx: address-pin: "Address bit 2: 0" "Addr bit 2" "A2" "A"
22553-22556 eeprom24xx: address-pin: "Address bit 1: 0" "Addr bit 1" "A1" "A"
22556-22559 eeprom24xx: address-pin: "Address bit 0: 1" "Addr bit 0" "A0" "A"
22559-22562 eeprom24xx: rw-bit: "R/W bit: write" "R/W" "RW" "W"
22537-22562 eeprom24xx: control-word: "Control word" "Control" "CW" "C"
22533-22566 eeprom24xx: warning: "Warning: No reply from slave!"
22580-22593 eeprom24xx: control-code: "Control code bits: 1010" "Control code: 1010" "Ctrl code: 1010" "Ctrl code" "Ctrl" "C"
22593-22596 eeprom24xx: address-pin: "Address bit 2: 0" "Addr bit 2" "A2" "A"
22596-22599 eeprom24xx: address-pin: "Address bit 1: 0" "Addr bit 1" "A1" "A"
22599-22602 eeprom24xx: address-pin: "Address bit 0: 1" "Addr bit 0" "A0" "A"
22602-22605 eeprom24xx: rw-bit: "R/W bit: write" "R/W" "RW" "W"
22580-22605 eeprom24xx: control-word: "Control word" "Control" "CW" "C"
22576-22609 eeprom24xx: warning: "Warning: No reply from slave!"
22622-22635 eeprom24xx: control-code: "Control code bits: 1010" "Control code: 1010" "Ctrl code: 1010" "Ctrl code" "Ctrl" "C"
22635-22639 eeprom24xx: address-pin: "Address bit 2: 0" "Addr bit 2" "A2" "A"
22639-22642 eeprom24xx: address-pin: "Address bit 1: 0" "Addr bit 1" "A1" "A"
22642-22645 eeprom24xx: address-pin: "Address bit 0: 1" "Addr bit 0" "A0" "A"
22645-22648 eeprom24xx: rw-bit: "R/W bit: write" "R/W" "RW" "W"
22622-22648 eeprom24xx: control-word: "Control word" "Control" "CW" "C"
22619-22652 eeprom24xx: warning: "Warning: No reply from slave!"
22665-22678 eeprom24xx: control-code: "Control code bits: 1010" "Control code: 1010" "Ctrl code: 1010" "Ctrl code" "Ctrl" "C"
22678-22682 eeprom24xx: address-pin: "Address bit 2: 0" "Addr bit 2" "A2" "A"
22682-22685 eeprom24xx: address-pin: "Address bit 1: 0" "Addr bit 1" "A1" "A"
22685-22688 eeprom24xx: address-pin: "Address bit 0: 1" "Addr bit 0" "A0" "A"
22688-22691 eeprom24xx: rw-bit: "R/W bit: write" "R/W" "RW" "W"
22665-22691 eeprom24xx: control-word: "Control word" "Control" "CW" "C"
22662-22694 eeprom24xx: warning: "Warning: No reply from slave!"
22708-22721 eeprom24xx: control-code: "Control code bits: 1010" "Control code: 1010" "Ctrl code: 1010" "Ctrl code" "Ctrl" "C"
22721-22725 eeprom24xx: address-pin: "Address bit 2: 0" "Addr bit 2" "A2" "A"
22725-22728 eeprom24xx: address-pin: "Address bit 1: 0" "Addr bit 1" "A1" "A"
22728-22731 eeprom24xx: address-pin: "Address bit 0: 1" "Addr bit 0" "A0" "A"
22731-22734 eeprom24xx: rw-bit: "R/W bit: write" "R/W" "RW" "W"
22708-22734 eeprom24xx: control-word: "Control word" "Control" "CW" "C"
22705-22737 eeprom24xx: warning: "Warning: No reply from slave!"
22751-22764 eeprom24xx: control-code: "Control code bits: 1010" "Control code: 1010" "Ctrl code: 1010" "Ctrl code" "Ctrl" "C"
22764-22768 eeprom24xx: address-pin: "Address bit 2: 0" "Addr bit 2" "A2" "A"
22768-22771 eeprom24xx: address-pin: "Address bit 1: 0" "Addr bit 1" "A1" "A"
22771-22774 eeprom24xx: address-pin: "Address bit 0: 1" "Addr bit 0" "A0" "A"
22774-22777 eeprom24xx: rw-bit: "R/W bit: write" "R/W" "RW" "W"
22751-22777 eeprom24xx: control-word: "Control word" "Control" "CW" "C"
22748-22780 eeprom24xx: warning: "Warning: No reply from slave!"
22794-22807 eeprom24xx: control-code: "Control code bits: 1010" "Control code: 1010" "Ctrl code: 1010" "Ctrl code" "Ctrl" "C"
22807-22810 eeprom24xx: address-pin: "Address bit 2: 0" "Addr bit 2" "A2" "A"
22810-22814 eeprom24xx: address-pin: "Address bit 1: 0" "Addr bit 1" "A1" "A"
22814-22817 eeprom24xx: address-pin: "Address bit 0: 1" "Addr bit 0" "A0" "A"
22817-22820 eeprom24xx: rw-bit: "R/W bit: write" "R/W" "RW" "W"
22794-22820 eeprom24xx: control-word: "Control word" "Control" "CW" "C"
22791-22823 eeprom24xx: warning: "Warning: No reply from slave!"
22837-22850 eeprom24xx: control-code: "Control code bits: 1010" "Control code: 1010" "Ctrl code: 1010" "Ctrl code" "Ctrl" "C"
22850-22853 eeprom24xx: address-pin: "Address bit 2: 0" "Addr bit 2" "A2" "A"
22853-22857 eeprom24xx: address-pin: "Address bit 1: 0" "Addr bit 1" "A1" "A"
22857-22860 eeprom24xx: address-pin: "Address bit 0: 1" "Addr bit 0" "A0" "A"
22860-22863 eeprom24xx: rw-bit: "R/W bit: write" "R/W" "RW" "W"
22837-22863 eeprom24xx: control-word: "Control word" "Control" "CW" "C"
22834-22866 eeprom24xx: warning: "Warning: No reply from slave!"
22880-22893 eeprom24xx: control-code: "Control code bits: 1010" "Control code: 1010" "Ctrl code: 1010" "Ctrl code" "Ctrl" "C"
22893-22896 eeprom24xx: address-pin: "Address bit 2: 0" "Addr bit 2" "A2" "A"
22896-22900 eeprom24xx: address-pin: "Address bit 1: 0" "Addr bit 1" "A1" "A"
22900-22903 eeprom24xx: address-pin: "Address bit 0: 1" "Addr bit 0" "A0" "A"
22903-22906 eeprom24xx: rw-bit: "R/W bit: write" "R/W" "RW" "W"
22880-22906 eeprom24xx: control-word: "Control word" "Control" "CW" "C"
22877-22909 eeprom24xx: warning: "Warning: No reply from slave!"
22923-22936 eeprom24xx: control-code: "Control code bits: 1010" "Control code: 1010" "Ctrl code: 1010" "Ctrl code" "Ctrl" "C"
22936-22939 eeprom24xx: address-pin: "Address bit 2: 0" "Addr bit 2" "A2" "A"
22939-22942 eeprom24xx: address-pin: "Address bit 1: 0" "Addr bit 1" "A1" "A"
22942-22946 eeprom24xx: address-pin: "Address bit 0: 1" "Addr bit 0" "A0" "A"
22946-22950 eeprom24xx: rw-bit: "R/W bit: write" "R/W" "RW" "W"
22923-22950 eeprom24xx: control-word: "Control word" "Control" "CW" "C"
22920-22953 eeprom24xx: warning: "Warning: No reply from slave!"
22966-22979 eeprom24xx: control-code: "Control code bits: 1010" "Control code: 1010" "Ctrl code: 1010" "Ctrl code" "Ctrl" "C"
22979-22982 eeprom24xx: address-pin: "Address bit 2: 0" "Addr bit 2" "A2" "A"
22982-22985 eeprom24xx: address-pin: "Address bit 1: 0" "Addr bit 1" "A1" "A"
22985-22989 eeprom24xx: address-pin: "Address bit 0: 1" "Addr bit 0" "A0" "A"
22989-22993 eeprom24xx: rw-bit: "R/W bit: write" "R/W" "RW" "W"
22966-22993 eeprom24xx: control-word: "Control word" "Control" "CW" "C"
22963-22996 eeprom24xx: warning: "Warning: No reply from slave!"
23009-23022 eeprom24xx: control-code: "Control code bits: 1010" "Control code: 1010" "Ctrl code: 1010" "Ctrl code" "Ctrl" "C"
23022-23025 eeprom24xx: address-pin: "Address bit 2: 0" "Addr bit 2" "A2" "A"
23025-23028 eeprom24xx: address-pin: "Address bit 1: 0" "Addr bit 1" "A1" "A"
23028-23032 eeprom24xx: address-pin: "Address bit 0: 1" "Addr bit 0" "A0" "A"
23032-23036 eeprom24xx: rw-bit: "R/W bit: write" "R/W" "RW" "W"
23009-23036 eeprom24xx: control-word: "Control word" "Control" "CW" "C"
23006-23039 eeprom24xx: warning: "Warning: No reply from slave!"
23052-23065 eeprom24xx: control-code: "Control code bits: 1010" "Control code: 1010" "Ctrl code: 1010" "Ctrl code" "Ctrl" "C"
23065-23068 eeprom24xx: address-pin: "Address bit 2: 0" "Addr bit 2" "A2" "A"
23068-23071 eeprom24xx: address-pin: "Address bit 1: 0" "Addr bit 1" "A1" "A"
23071-23074 eeprom24xx: address-pin: "Address bit 0: 1" "Addr bit 0" "A0" "A"
23074-23077 eeprom24xx: rw-bit: "R/W bit: write" "R/W" "RW" "W"
23052-23077 eeprom24xx: control-word: "Control word" "Control" "CW" "C"
23048-23081 eeprom24xx: warning: "Warning: No reply from slave!"
23094-23108 eeprom24xx: control-code: "Control code bits: 1010" "Control code: 1010" "Ctrl code: 1010" "Ctrl code" "Ctrl" "C"
23108-23111 eeprom24xx: address-pin: "Address bit 2: 0" "Addr bit 2" "A2" "A"
23111-23114 eeprom24xx: address-pin: "Address bit 1: 0" "Addr bit 1" "A1" "A"
23114-23117 eeprom24xx: address-pin: "Address bit 0: 1" "Addr bit 0" "A0" "A"
23117-23120 eeprom24xx: rw-bit: "R/W bit: write" "R/W" "RW" "W"
23094-23120 eeprom24xx: control-word: "Control word" "Control" "CW" "C"
23091-23124 eeprom24xx: warning: "Warning: No reply from slave!"
23137-23150 eeprom24xx: control-code: "Control code bits: 1010" "Control code: 1010" "Ctrl code: 1010" "Ctrl code" "Ctrl" "C"
23150-23154 eeprom24xx: address-pin: "Address bit 2: 0" "Addr bit 2" "A2" "A"
23154-23157 eeprom24xx: address-pin: "Address bit 1: 0" "Addr bit 1" "A1" "A"
23157-23160 eeprom24xx: address-pin: "Address bit 0: 1" "Addr bit 0" "A0" "A"
23160-23163 eeprom24xx: rw-bit: "R/W bit: write" "R/W" "RW" "W"
23137-23163 eeprom24xx: control-word: "Control word" "Control" "CW" "C"
23134-23180 eeprom24xx: warning: "Warning: Slave replied, but master aborted!"
