2946204-2946777 eeprom24xx: control-code: "Control code bits: 1010" "Control code: 1010" "Ctrl code: 1010" "Ctrl code" "Ctrl" "C"
2946777-2946920 eeprom24xx: address-pin: "Address bit 2: 0" "Addr bit 2" "A2" "A"
2946920-2947063 eeprom24xx: address-pin: "Address bit 1: 0" "Addr bit 1" "A1" "A"
2947063-2947206 eeprom24xx: address-pin: "Address bit 0: 0" "Addr bit 0" "A0" "A"
2947206-2947349 eeprom24xx: rw-bit: "R/W bit: write" "R/W" "RW" "W"
2946204-2947349 eeprom24xx: control-word: "Control word" "Control" "CW" "C"
2946046-3015403 eeprom24xx: warning: "Warning: STOP expected after a NACK (not ACK)"
2948982-2949555 eeprom24xx: control-code: "Control code bits: 1010" "Control code: 1010" "Ctrl code: 1010" "Ctrl code" "Ctrl" "C"
2949555-2949699 eeprom24xx: address-pin: "Address bit 2: 0" "Addr bit 2" "A2" "A"
2949699-2949842 eeprom24xx: address-pin: "Address bit 1: 0" "Addr bit 1" "A1" "A"
2949842-2949985 eeprom24xx: address-pin: "Address bit 0: 0" "Addr bit 0" "A0" "A"
2949985-2950128 eeprom24xx: rw-bit: "R/W bit: read" "R/W" "RW" "R"
2948982-2950128 eeprom24xx: control-word: "Control word" "Control" "CW" "C"
2947497-2948644 eeprom24xx: word-addr-byte: "Word address byte: 00" "Word addr byte: 00" "Addr: 00" "A: 00" "00"
2947497-2948644 eeprom24xx: word-addr: "Word address" "Word addr" "Addr" "A"
2950282-2951449 eeprom24xx: data-byte: "Data byte 00: FF" "Data byte: FF" "Byte: FF" "DB: FF" "FF"
2951641-2952808 eeprom24xx: data-byte: "Data byte 01: FF" "Data byte: FF" "Byte: FF" "DB: FF" "FF"
2953000-2954167 eeprom24xx: data-byte: "Data byte 02: FF" "Data byte: FF" "Byte: FF" "DB: FF" "FF"
2954359-2955526 eeprom24xx: data-byte: "Data byte 03: FF" "Data byte: FF" "Byte: FF" "DB: FF" "FF"
2955717-2956885 eeprom24xx: data-byte: "Data byte 04: FF" "Data byte: FF" "Byte: FF" "DB: FF" "FF"
2957076-2958244 eeprom24xx: data-byte: "Data byte 05: FF" "Data byte: FF" "Byte: FF" "DB: FF" "FF"
2958435-2959603 eeprom24xx: data-byte: "Data byte 06: FF" "Data byte: FF" "Byte: FF" "DB: FF" "FF"
2959794-2960962 eeprom24xx: data-byte: "Data byte 07: FF" "Data byte: FF" "Byte: FF" "DB: FF" "FF"
2961153-2962320 eeprom24xx: data-byte: "Data byte 08: FF" "Data byte: FF" "Byte: FF" "DB: FF" "FF"
2962512-2963679 eeprom24xx: data-byte: "Data byte 09: FF" "Data byte: FF" "Byte: FF" "DB: FF" "FF"
2963871-2965038 eeprom24xx: data-byte: "Data byte 0A: FF" "Data byte: FF" "Byte: FF" "DB: FF" "FF"
2965230-2966397 eeprom24xx: data-byte: "Data byte 0B: FF" "Data byte: FF" "Byte: FF" "DB: FF" "FF"
2966588-2967756 eeprom24xx: data-byte: "Data byte 0C: FF" "Data byte: FF" "Byte: FF" "DB: FF" "FF"
2967947-2969115 eeprom24xx: data-byte: "Data byte 0D: FF" "Data byte: FF" "Byte: FF" "DB: FF" "FF"
2969306-2970474 eeprom24xx: data-byte: "Data byte 0E: FF" "Data byte: FF" "Byte: FF" "DB: FF" "FF"
2970665-2971833 eeprom24xx: data-byte: "Data byte 0F: FF" "Data byte: FF" "Byte: FF" "DB: FF" "FF"
2972024-2973191 eeprom24xx: data-byte: "Data byte 10: FF" "Data byte: FF" "Byte: FF" "DB: FF" "FF"
2973383-2974550 eeprom24xx: data-byte: "Data byte 11: FF" "Data byte: FF" "Byte: FF" "DB: FF" "FF"
2974742-2975909 eeprom24xx: data-byte: "Data byte 12: FF" "Data byte: FF" "Byte: FF" "DB: FF" "FF"
2976101-2977268 eeprom24xx: data-byte: "Data byte 13: FF" "Data byte: FF" "Byte: FF" "DB: FF" "FF"
2977459-2978627 eeprom24xx: data-byte: "Data byte 14: FF" "Data byte: FF" "Byte: FF" "DB: FF" "FF"
2978818-2979986 eeprom24xx: data-byte: "Data byte 15: FF" "Data byte: FF" "Byte: FF" "DB: FF" "FF"
2980177-2981345 eeprom24xx: data-byte: "Data byte 16: FF" "Data byte: FF" "Byte: FF" "DB: FF" "FF"
2981536-2982704 eeprom24xx: data-byte: "Data byte 17: FF" "Data byte: FF" "Byte: FF" "DB: FF" "FF"
2982895-2984062 eeprom24xx: data-byte: "Data byte 18: FF" "Data byte: FF" "Byte: FF" "DB: FF" "FF"
2984254-2985421 eeprom24xx: data-byte: "Data byte 19: FF" "Data byte: FF" "Byte: FF" "DB: FF" "FF"
2985613-2986780 eeprom24xx: data-byte: "Data byte 1A: FF" "Data byte: FF" "Byte: FF" "DB: FF" "FF"
2986972-2988139 eeprom24xx: data-byte: "Data byte 1B: FF" "Data byte: FF" "Byte: FF" "DB: FF" "FF"
2988330-2989498 eeprom24xx: data-byte: "Data byte 1C: FF" "Data byte: FF" "Byte: FF" "DB: FF" "FF"
2989689-2990857 eeprom24xx: data-byte: "Data byte 1D: FF" "Data byte: FF" "Byte: FF" "DB: FF" "FF"
2991048-2992216 eeprom24xx: data-byte: "Data byte 1E: FF" "Data byte: FF" "Byte: FF" "DB: FF" "FF"
2992407-2993575 eeprom24xx: data-byte: "Data byte 1F: FF" "Data byte: FF" "Byte: FF" "DB: FF" "FF"
2993766-2994933 eeprom24xx: data-byte: "Data byte 20: FF" "Data byte: FF" "Byte: FF" "DB: FF" "FF"
2995125-2996292 eeprom24xx: data-byte: "Data byte 21: FF" "Data byte: FF" "Byte: FF" "DB: FF" "FF"
2996484-2997651 eeprom24xx: data-byte: "Data byte 22: FF" "Data byte: FF" "Byte: FF" "DB: FF" "FF"
2997843-2999010 eeprom24xx: data-byte: "Data byte 23: FF" "Data byte: FF" "Byte: FF" "DB: FF" "FF"
2999201-3000369 eeprom24xx: data-byte: "Data byte 24: FF" "Data byte: FF" "Byte: FF" "DB: FF" "FF"
3000560-3001728 eeprom24xx: data-byte: "Data byte 25: FF" "Data byte: FF" "Byte: FF" "DB: FF" "FF"
3001919-3003087 eeprom24xx: data-byte: "Data byte 26: FF" "Data byte: FF" "Byte: FF" "DB: FF" "FF"
3003278-3004446 eeprom24xx: data-byte: "Data byte 27: FF" "Data byte: FF" "Byte: FF" "DB: FF" "FF"
3004637-3005804 eeprom24xx: data-byte: "Data byte 28: FF" "Data byte: FF" "Byte: FF" "DB: FF" "FF"
3005996-3007163 eeprom24xx: data-byte: "Data byte 29: FF" "Data byte: FF" "Byte: FF" "DB: FF" "FF"
3007355-3008522 eeprom24xx: data-byte: "Data byte 2A: FF" "Data byte: FF" "Byte: FF" "DB: FF" "FF"
3008714-3009881 eeprom24xx: data-byte: "Data byte 2B: FF" "Data byte: FF" "Byte: FF" "DB: FF" "FF"
3010072-3011240 eeprom24xx: data-byte: "Data byte 2C: FF" "Data byte: FF" "Byte: FF" "DB: FF" "FF"
3011431-3012599 eeprom24xx: data-byte: "Data byte 2D: FF" "Data byte: FF" "Byte: FF" "DB: FF" "FF"
3012790-3013958 eeprom24xx: data-byte: "Data byte 2E: FF" "Data byte: FF" "Byte: FF" "DB: FF" "FF"
3014150-3015318 eeprom24xx: data-byte: "Data byte 2F: FF" "Data byte: FF" "Byte: FF" "DB: FF" "FF"
2950282-3015318 eeprom24xx: data: "Data" "D"
2946046-3015403 eeprom24xx: seq-random-read: "Sequential random read (addr=00, 48 bytes): FF FF FF FF FF FF FF FF FF FF FF FF FF FF FF FF FF FF FF FF FF FF FF FF FF FF FF FF FF FF FF FF FF FF FF FF FF FF FF FF FF FF FF FF FF FF FF FF" "Sequential random read (addr=00, 48 bytes)" "Sequential random read" "SRR" "S"
3015826-3016453 eeprom24xx: control-code: "Control code bits: 1010" "Control code: 1010" "Ctrl code: 1010" "Ctrl code" "Ctrl" "C"
3016453-3016610 eeprom24xx: address-pin: "Address bit 2: 0" "Addr bit 2" "A2" "A"
3016610-3016766 eeprom24xx: address-pin: "Address bit 1: 0" "Addr bit 1" "A1" "A"
3016766-3016923 eeprom24xx: address-pin: "Address bit 0: 0" "Addr bit 0" "A0" "A"
3016923-3017080 eeprom24xx: rw-bit: "R/W bit: write" "R/W" "RW" "W"
3015826-3017080 eeprom24xx: control-word: "Control word" "Control" "CW" "C"
3015670-3017275 eeprom24xx: warning: "Warning: Slave replied, but master aborted!"
3017516-3018143 eeprom24xx: control-code: "Control code bits: 1010" "Control code: 1010" "Ctrl code: 1010" "Ctrl code" "Ctrl" "C"
3018143-3018300 eeprom24xx: address-pin: "Address bit 2: 0" "Addr bit 2" "A2" "A"
3018300-3018457 eeprom24xx: address-pin: "Address bit 1: 0" "Addr bit 1" "A1" "A"
3018457-3018614 eeprom24xx: address-pin: "Address bit 0: 0" "Addr bit 0" "A0" "A"
3018614-3018771 eeprom24xx: rw-bit: "R/W bit: write" "R/W" "RW" "W"
3017516-3018771 eeprom24xx: control-word: "Control word" "Control" "CW" "C"
3018933-3020188 eeprom24xx: word-addr-byte: "Word address byte: 00" "Word addr byte: 00" "Addr: 00" "A: 00" "00"
3018933-3020188 eeprom24xx: word-addr: "Word address" "Word addr" "Addr" "A"
3020351-3021605 eeprom24xx: data-byte: "Data byte 00: 00" "Data byte: 00" "Byte: 00" "DB: 00" "00"
3020351-3021605 eeprom24xx: data: "Data" "D"
3017360-3021800 eeprom24xx: byte-write: "Byte write (addr=00, 1 byte): 00" "Byte write (addr=00, 1 byte)" "Byte write" "BW" "B"
10259284-10259857 eeprom24xx: control-code: "Control code bits: 1010" "Control code: 1010" "Ctrl code: 1010" "Ctrl code" "Ctrl" "C"
10259857-10260000 eeprom24xx: address-pin: "Address bit 2: 0" "Addr bit 2" "A2" "A"
10260000-10260143 eeprom24xx: address-pin: "Address bit 1: 0" "Addr bit 1" "A1" "A"
10260143-10260286 eeprom24xx: address-pin: "Address bit 0: 0" "Addr bit 0" "A0" "A"
10260286-10260429 eeprom24xx: rw-bit: "R/W bit: write" "R/W" "RW" "W"
10259284-10260429 eeprom24xx: control-word: "Control word" "Control" "CW" "C"
10259127-10260625 eeprom24xx: warning: "Warning: Slave replied, but master aborted!"
10261495-10262068 eeprom24xx: control-code: "Control code bits: 1010" "Control code: 1010" "Ctrl code: 1010" "Ctrl code" "Ctrl" "C"
10262068-10265011 eeprom24xx: address-pin: "Address bit 2: 0" "Addr bit 2" "A2" "A"
10265011-10265155 eeprom24xx: address-pin: "Address bit 1: 0" "Addr bit 1" "A1" "A"
10265155-10265298 eeprom24xx: address-pin: "Address bit 0: 0" "Addr bit 0" "A0" "A"
10265298-10265441 eeprom24xx: rw-bit: "R/W bit: write" "R/W" "RW" "W"
10261495-10265441 eeprom24xx: control-word: "Control word" "Control" "CW" "C"
10265589-10266734 eeprom24xx: word-addr-byte: "Word address byte: 29" "Word addr byte: 29" "Addr: 29" "A: 29" "29"
10265589-10266734 eeprom24xx: word-addr: "Word address" "Word addr" "Addr" "A"
10266882-10268028 eeprom24xx: data-byte: "Data byte 29: 01" "Data byte: 01" "Byte: 01" "DB: 01" "01"
10266882-10268028 eeprom24xx: data: "Data" "D"
10261337-10268223 eeprom24xx: byte-write: "Byte write (addr=29, 1 byte): 01" "Byte write (addr=29, 1 byte)" "Byte write" "BW" "B"
10281905-10282478 eeprom24xx: control-code: "Control code bits: 1010" "Control code: 1010" "Ctrl code: 1010" "Ctrl code" "Ctrl" "C"
10282478-10282621 eeprom24xx: address-pin: "Address bit 2: 0" "Addr bit 2" "A2" "A"
10282621-10282764 eeprom24xx: address-pin: "Address bit 1: 0" "Addr bit 1" "A1" "A"
10282764-10282907 eeprom24xx: address-pin: "Address bit 0: 0" "Addr bit 0" "A0" "A"
10282907-10283050 eeprom24xx: rw-bit: "R/W bit: write" "R/W" "RW" "W"
10281905-10283050 eeprom24xx: control-word: "Control word" "Control" "CW" "C"
10281748-10283245 eeprom24xx: warning: "Warning: Slave replied, but master aborted!"
10283508-10284081 eeprom24xx: control-code: "Control code bits: 1010" "Control code: 1010" "Ctrl code: 1010" "Ctrl code" "Ctrl" "C"
10284081-10284224 eeprom24xx: address-pin: "Address bit 2: 0" "Addr bit 2" "A2" "A"
10284224-10284368 eeprom24xx: address-pin: "Address bit 1: 0" "Addr bit 1" "A1" "A"
10284368-10284511 eeprom24xx: address-pin: "Address bit 0: 0" "Addr bit 0" "A0" "A"
10284511-10284654 eeprom24xx: rw-bit: "R/W bit: write" "R/W" "RW" "W"
10283508-10284654 eeprom24xx: control-word: "Control word" "Control" "CW" "C"
10284802-10285947 eeprom24xx: word-addr-byte: "Word address byte: 2A" "Word addr byte: 2A" "Addr: 2A" "A: 2A" "2A"
10284802-10285947 eeprom24xx: word-addr: "Word address" "Word addr" "Addr" "A"
10286095-10287241 eeprom24xx: data-byte: "Data byte 2A: 01" "Data byte: 01" "Byte: 01" "DB: 01" "01"
10286095-10287241 eeprom24xx: data: "Data" "D"
10283350-10287436 eeprom24xx: byte-write: "Byte write (addr=2A, 1 byte): 01" "Byte write (addr=2A, 1 byte)" "Byte write" "BW" "B"
10298166-10298738 eeprom24xx: control-code: "Control code bits: 1010" "Control code: 1010" "Ctrl code: 1010" "Ctrl code" "Ctrl" "C"
10298738-10298882 eeprom24xx: address-pin: "Address bit 2: 0" "Addr bit 2" "A2" "A"
10298882-10299025 eeprom24xx: address-pin: "Address bit 1: 0" "Addr bit 1" "A1" "A"
10299025-10299168 eeprom24xx: address-pin: "Address bit 0: 0" "Addr bit 0" "A0" "A"
10299168-10299311 eeprom24xx: rw-bit: "R/W bit: write" "R/W" "RW" "W"
10298166-10299311 eeprom24xx: control-word: "Control word" "Control" "CW" "C"
10298008-10299444 eeprom24xx: warning: "Warning: No reply from slave!"
10310762-10311335 eeprom24xx: control-code: "Control code bits: 1010" "Control code: 1010" "Ctrl code: 1010" "Ctrl code" "Ctrl" "C"
10311335-10311478 eeprom24xx: address-pin: "Address bit 2: 0" "Addr bit 2" "A2" "A"
10311478-10311622 eeprom24xx: address-pin: "Address bit 1: 0" "Addr bit 1" "A1" "A"
10311622-10311765 eeprom24xx: address-pin: "Address bit 0: 0" "Addr bit 0" "A0" "A"
10311765-10311908 eeprom24xx: rw-bit: "R/W bit: write" "R/W" "RW" "W"
10310762-10311908 eeprom24xx: control-word: "Control word" "Control" "CW" "C"
10299350-10312103 eeprom24xx: warning: "Warning: Slave replied, but master aborted!"
10312366-10312939 eeprom24xx: control-code: "Control code bits: 1010" "Control code: 1010" "Ctrl code: 1010" "Ctrl code" "Ctrl" "C"
10312939-10313082 eeprom24xx: address-pin: "Address bit 2: 0" "Addr bit 2" "A2" "A"
10313082-10313225 eeprom24xx: address-pin: "Address bit 1: 0" "Addr bit 1" "A1" "A"
10313225-10313368 eeprom24xx: address-pin: "Address bit 0: 0" "Addr bit 0" "A0" "A"
10313368-10313511 eeprom24xx: rw-bit: "R/W bit: write" "R/W" "RW" "W"
10312366-10313511 eeprom24xx: control-word: "Control word" "Control" "CW" "C"
10313659-10314805 eeprom24xx: word-addr-byte: "Word address byte: 2B" "Word addr byte: 2B" "Addr: 2B" "A: 2B" "2B"
10313659-10314805 eeprom24xx: word-addr: "Word address" "Word addr" "Addr" "A"
10314953-10320993 eeprom24xx: data-byte: "Data byte 2B: 00" "Data byte: 00" "Byte: 00" "DB: 00" "00"
10314953-10320993 eeprom24xx: data: "Data" "D"
10312208-10321188 eeprom24xx: byte-write: "Byte write (addr=2B, 1 byte): 00" "Byte write (addr=2B, 1 byte)" "Byte write" "BW" "B"
