2036189-2036230 eeprom24xx: control-code: "Control code bits: 0110" "Control code: 0110" "Ctrl code: 0110" "Ctrl code" "Ctrl" "C"
2036230-2036240 eeprom24xx: address-pin: "Address bit 2: 1" "Addr bit 2" "A2" "A"
2036240-2036250 eeprom24xx: address-pin: "Address bit 1: 0" "Addr bit 1" "A1" "A"
2036250-2036260 eeprom24xx: address-pin: "Address bit 0: 0" "Addr bit 0" "A0" "A"
2036260-2036270 eeprom24xx: rw-bit: "R/W bit: write" "R/W" "RW" "W"
2036189-2036270 eeprom24xx: control-word: "Control word" "Control" "CW" "C"
2036403-2036443 eeprom24xx: control-code: "Control code bits: 0110" "Control code: 0110" "Ctrl code: 0110" "Ctrl code" "Ctrl" "C"
2036443-2036453 eeprom24xx: address-pin: "Address bit 2: 1" "Addr bit 2" "A2" "A"
2036453-2036463 eeprom24xx: address-pin: "Address bit 1: 0" "Addr bit 1" "A1" "A"
2036463-2036474 eeprom24xx: address-pin: "Address bit 0: 0" "Addr bit 0" "A0" "A"
2036474-2036485 eeprom24xx: rw-bit: "R/W bit: read" "R/W" "RW" "R"
2036403-2036485 eeprom24xx: control-word: "Control word" "Control" "CW" "C"
2036287-2036368 eeprom24xx: word-addr-byte: "Word address byte: 01" "Word addr byte: 01" "Addr: 01" "A: 01" "01"
2036287-2036368 eeprom24xx: word-addr: "Word address" "Word addr" "Addr" "A"
2036500-2036581 eeprom24xx: data-byte: "Data byte 01: 70" "Data byte: 70" "Byte: 70" "DB: 70" "70"
2036500-2036581 eeprom24xx: data: "Data" "D"
2036167-2036604 eeprom24xx: random-read: "Random access read (addr=01, 1 byte): 70" "Random access read (addr=01, 1 byte)" "Random access read" "RAR" "R"
2036695-2036735 eeprom24xx: control-code: "Control code bits: 0110" "Control code: 0110" "Ctrl code: 0110" "Ctrl code" "Ctrl" "C"
2036735-2036745 eeprom24xx: address-pin: "Address bit 2: 1" "Addr bit 2" "A2" "A"
2036745-2036756 eeprom24xx: address-pin: "Address bit 1: 0" "Addr bit 1" "A1" "A"
2036756-2036766 eeprom24xx: address-pin: "Address bit 0: 0" "Addr bit 0" "A0" "A"
2036766-2036776 eeprom24xx: rw-bit: "R/W bit: write" "R/W" "RW" "W"
2036695-2036776 eeprom24xx: control-word: "Control word" "Control" "CW" "C"
2036902-2036943 eeprom24xx: control-code: "Control code bits: 0110" "Control code: 0110" "Ctrl code: 0110" "Ctrl code" "Ctrl" "C"
2036943-2036953 eeprom24xx: address-pin: "Address bit 2: 1" "Addr bit 2" "A2" "A"
2036953-2036963 eeprom24xx: address-pin: "Address bit 1: 0" "Addr bit 1" "A1" "A"
2036963-2036973 eeprom24xx: address-pin: "Address bit 0: 0" "Addr bit 0" "A0" "A"
2036973-2036983 eeprom24xx: rw-bit: "R/W bit: read" "R/W" "RW" "R"
2036902-2036983 eeprom24xx: control-word: "Control word" "Control" "CW" "C"
2036789-2036870 eeprom24xx: word-addr-byte: "Word address byte: 82" "Word addr byte: 82" "Addr: 82" "A: 82" "82"
2036789-2036870 eeprom24xx: word-addr: "Word address" "Word addr" "Addr" "A"
2036995-2037076 eeprom24xx: data-byte: "Data byte 82: FF" "Data byte: FF" "Byte: FF" "DB: FF" "FF"
2036995-2037076 eeprom24xx: data: "Data" "D"
2036682-2037100 eeprom24xx: random-read: "Random access read (addr=82, 1 byte): FF" "Random access read (addr=82, 1 byte)" "Random access read" "RAR" "R"
2037164-2037204 eeprom24xx: control-code: "Control code bits: 0110" "Control code: 0110" "Ctrl code: 0110" "Ctrl code" "Ctrl" "C"
2037204-2037214 eeprom24xx: address-pin: "Address bit 2: 1" "Addr bit 2" "A2" "A"
2037214-2037225 eeprom24xx: address-pin: "Address bit 1: 0" "Addr bit 1" "A1" "A"
2037225-2037235 eeprom24xx: address-pin: "Address bit 0: 0" "Addr bit 0" "A0" "A"
2037235-2037245 eeprom24xx: rw-bit: "R/W bit: write" "R/W" "RW" "W"
2037164-2037245 eeprom24xx: control-word: "Control word" "Control" "CW" "C"
2037371-2037412 eeprom24xx: control-code: "Control code bits: 0110" "Control code: 0110" "Ctrl code: 0110" "Ctrl code" "Ctrl" "C"
2037412-2037422 eeprom24xx: address-pin: "Address bit 2: 1" "Addr bit 2" "A2" "A"
2037422-2037432 eeprom24xx: address-pin: "Address bit 1: 0" "Addr bit 1" "A1" "A"
2037432-2037442 eeprom24xx: address-pin: "Address bit 0: 0" "Addr bit 0" "A0" "A"
2037442-2037452 eeprom24xx: rw-bit: "R/W bit: read" "R/W" "RW" "R"
2037371-2037452 eeprom24xx: control-word: "Control word" "Control" "CW" "C"
2037258-2037339 eeprom24xx: word-addr-byte: "Word address byte: 84" "Word addr byte: 84" "Addr: 84" "A: 84" "84"
2037258-2037339 eeprom24xx: word-addr: "Word address" "Word addr" "Addr" "A"
2037464-2037545 eeprom24xx: data-byte: "Data byte 84: B2" "Data byte: B2" "Byte: B2" "DB: B2" "B2"
2037464-2037545 eeprom24xx: data: "Data" "D"
2037151-2037568 eeprom24xx: random-read: "Random access read (addr=84, 1 byte): B2" "Random access read (addr=84, 1 byte)" "Random access read" "RAR" "R"
2037626-2037666 eeprom24xx: control-code: "Control code bits: 0110" "Control code: 0110" "Ctrl code: 0110" "Ctrl code" "Ctrl" "C"
2037666-2037676 eeprom24xx: address-pin: "Address bit 2: 1" "Addr bit 2" "A2" "A"
2037676-2037686 eeprom24xx: address-pin: "Address bit 1: 0" "Addr bit 1" "A1" "A"
2037686-2037696 eeprom24xx: address-pin: "Address bit 0: 0" "Addr bit 0" "A0" "A"
2037696-2037706 eeprom24xx: rw-bit: "R/W bit: write" "R/W" "RW" "W"
2037626-2037706 eeprom24xx: control-word: "Control word" "Control" "CW" "C"
2037833-2037873 eeprom24xx: control-code: "Control code bits: 0110" "Control code: 0110" "Ctrl code: 0110" "Ctrl code" "Ctrl" "C"
2037873-2037884 eeprom24xx: address-pin: "Address bit 2: 1" "Addr bit 2" "A2" "A"
2037884-2037894 eeprom24xx: address-pin: "Address bit 1: 0" "Addr bit 1" "A1" "A"
2037894-2037904 eeprom24xx: address-pin: "Address bit 0: 0" "Addr bit 0" "A0" "A"
2037904-2037914 eeprom24xx: rw-bit: "R/W bit: read" "R/W" "RW" "R"
2037833-2037914 eeprom24xx: control-word: "Control word" "Control" "CW" "C"
2037720-2037802 eeprom24xx: word-addr-byte: "Word address byte: 78" "Word addr byte: 78" "Addr: 78" "A: 78" "78"
2037720-2037802 eeprom24xx: word-addr: "Word address" "Word addr" "Addr" "A"
2037926-2038007 eeprom24xx: data-byte: "Data byte 78: ED" "Data byte: ED" "Byte: ED" "DB: ED" "ED"
2037926-2038007 eeprom24xx: data: "Data" "D"
2037613-2038027 eeprom24xx: random-read: "Random access read (addr=78, 1 byte): ED" "Random access read (addr=78, 1 byte)" "Random access read" "RAR" "R"
2038085-2038126 eeprom24xx: control-code: "Control code bits: 0110" "Control code: 0110" "Ctrl code: 0110" "Ctrl code" "Ctrl" "C"
2038126-2038136 eeprom24xx: address-pin: "Address bit 2: 1" "Addr bit 2" "A2" "A"
2038136-2038146 eeprom24xx: address-pin: "Address bit 1: 0" "Addr bit 1" "A1" "A"
2038146-2038156 eeprom24xx: address-pin: "Address bit 0: 0" "Addr bit 0" "A0" "A"
2038156-2038166 eeprom24xx: rw-bit: "R/W bit: write" "R/W" "RW" "W"
2038085-2038166 eeprom24xx: control-word: "Control word" "Control" "CW" "C"
2038294-2038334 eeprom24xx: control-code: "Control code bits: 0110" "Control code: 0110" "Ctrl code: 0110" "Ctrl code" "Ctrl" "C"
2038334-2038344 eeprom24xx: address-pin: "Address bit 2: 1" "Addr bit 2" "A2" "A"
2038344-2038354 eeprom24xx: address-pin: "Address bit 1: 0" "Addr bit 1" "A1" "A"
2038354-2038364 eeprom24xx: address-pin: "Address bit 0: 0" "Addr bit 0" "A0" "A"
2038364-2038374 eeprom24xx: rw-bit: "R/W bit: read" "R/W" "RW" "R"
2038294-2038374 eeprom24xx: control-word: "Control word" "Control" "CW" "C"
2038179-2038260 eeprom24xx: word-addr-byte: "Word address byte: 79" "Word addr byte: 79" "Addr: 79" "A: 79" "79"
2038179-2038260 eeprom24xx: word-addr: "Word address" "Word addr" "Addr" "A"
2038388-2038468 eeprom24xx: data-byte: "Data byte 79: 04" "Data byte: 04" "Byte: 04" "DB: 04" "04"
2038388-2038468 eeprom24xx: data: "Data" "D"
2038073-2038489 eeprom24xx: random-read: "Random access read (addr=79, 1 byte): 04" "Random access read (addr=79, 1 byte)" "Random access read" "RAR" "R"
2038556-2038596 eeprom24xx: control-code: "Control code bits: 0110" "Control code: 0110" "Ctrl code: 0110" "Ctrl code" "Ctrl" "C"
2038596-2038606 eeprom24xx: address-pin: "Address bit 2: 1" "Addr bit 2" "A2" "A"
2038606-2038616 eeprom24xx: address-pin: "Address bit 1: 0" "Addr bit 1" "A1" "A"
2038616-2038627 eeprom24xx: address-pin: "Address bit 0: 0" "Addr bit 0" "A0" "A"
2038627-2038638 eeprom24xx: rw-bit: "R/W bit: write" "R/W" "RW" "W"
2038556-2038638 eeprom24xx: control-word: "Control word" "Control" "CW" "C"
2038765-2038806 eeprom24xx: control-code: "Control code bits: 0110" "Control code: 0110" "Ctrl code: 0110" "Ctrl code" "Ctrl" "C"
2038806-2038816 eeprom24xx: address-pin: "Address bit 2: 1" "Addr bit 2" "A2" "A"
2038816-2038826 eeprom24xx: address-pin: "Address bit 1: 0" "Addr bit 1" "A1" "A"
2038826-2038836 eeprom24xx: address-pin: "Address bit 0: 0" "Addr bit 0" "A0" "A"
2038836-2038846 eeprom24xx: rw-bit: "R/W bit: read" "R/W" "RW" "R"
2038765-2038846 eeprom24xx: control-word: "Control word" "Control" "CW" "C"
2038651-2038732 eeprom24xx: word-addr-byte: "Word address byte: 00" "Word addr byte: 00" "Addr: 00" "A: 00" "00"
2038651-2038732 eeprom24xx: word-addr: "Word address" "Word addr" "Addr" "A"
2038859-2038940 eeprom24xx: data-byte: "Data byte 00: 3D" "Data byte: 3D" "Byte: 3D" "DB: 3D" "3D"
2038859-2038940 eeprom24xx: data: "Data" "D"
2038543-2038964 eeprom24xx: random-read: "Random access read (addr=00, 1 byte): 3D" "Random access read (addr=00, 1 byte)" "Random access read" "RAR" "R"
2039024-2039064 eeprom24xx: control-code: "Control code bits: 0110" "Control code: 0110" "Ctrl code: 0110" "Ctrl code" "Ctrl" "C"
2039064-2039074 eeprom24xx: address-pin: "Address bit 2: 1" "Addr bit 2" "A2" "A"
2039074-2039084 eeprom24xx: address-pin: "Address bit 1: 0" "Addr bit 1" "A1" "A"
2039084-2039095 eeprom24xx: address-pin: "Address bit 0: 0" "Addr bit 0" "A0" "A"
2039095-2039106 eeprom24xx: rw-bit: "R/W bit: write" "R/W" "RW" "W"
2039024-2039106 eeprom24xx: control-word: "Control word" "Control" "CW" "C"
2039231-2039272 eeprom24xx: control-code: "Control code bits: 0110" "Control code: 0110" "Ctrl code: 0110" "Ctrl code" "Ctrl" "C"
2039272-2039282 eeprom24xx: address-pin: "Address bit 2: 1" "Addr bit 2" "A2" "A"
2039282-2039292 eeprom24xx: address-pin: "Address bit 1: 0" "Addr bit 1" "A1" "A"
2039292-2039302 eeprom24xx: address-pin: "Address bit 0: 0" "Addr bit 0" "A0" "A"
2039302-2039312 eeprom24xx: rw-bit: "R/W bit: read" "R/W" "RW" "R"
2039231-2039312 eeprom24xx: control-word: "Control word" "Control" "CW" "C"
2039118-2039200 eeprom24xx: word-addr-byte: "Word address byte: 7A" "Word addr byte: 7A" "Addr: 7A" "A: 7A" "7A"
2039118-2039200 eeprom24xx: word-addr: "Word address" "Word addr" "Addr" "A"
2039325-2039406 eeprom24xx: data-byte: "Data byte 7A: 2D" "Data byte: 2D" "Byte: 2D" "DB: 2D" "2D"
2039325-2039406 eeprom24xx: data: "Data" "D"
2039011-2039426 eeprom24xx: random-read: "Random access read (addr=7A, 1 byte): 2D" "Random access read (addr=7A, 1 byte)" "Random access read" "RAR" "R"
2039486-2039527 eeprom24xx: control-code: "Control code bits: 0110" "Control code: 0110" "Ctrl code: 0110" "Ctrl code" "Ctrl" "C"
2039527-2039537 eeprom24xx: address-pin: "Address bit 2: 1" "Addr bit 2" "A2" "A"
2039537-2039547 eeprom24xx: address-pin: "Address bit 1: 0" "Addr bit 1" "A1" "A"
2039547-2039557 eeprom24xx: address-pin: "Address bit 0: 0" "Addr bit 0" "A0" "A"
2039557-2039567 eeprom24xx: rw-bit: "R/W bit: write" "R/W" "RW" "W"
2039486-2039567 eeprom24xx: control-word: "Control word" "Control" "CW" "C"
2039696-2039736 eeprom24xx: control-code: "Control code bits: 0110" "Control code: 0110" "Ctrl code: 0110" "Ctrl code" "Ctrl" "C"
2039736-2039746 eeprom24xx: address-pin: "Address bit 2: 1" "Addr bit 2" "A2" "A"
2039746-2039757 eeprom24xx: address-pin: "Address bit 1: 0" "Addr bit 1" "A1" "A"
2039757-2039767 eeprom24xx: address-pin: "Address bit 0: 0" "Addr bit 0" "A0" "A"
2039767-2039777 eeprom24xx: rw-bit: "R/W bit: read" "R/W" "RW" "R"
2039696-2039777 eeprom24xx: control-word: "Control word" "Control" "CW" "C"
2039582-2039662 eeprom24xx: word-addr-byte: "Word address byte: 7B" "Word addr byte: 7B" "Addr: 7B" "A: 7B" "7B"
2039582-2039662 eeprom24xx: word-addr: "Word address" "Word addr" "Addr" "A"
2039790-2039871 eeprom24xx: data-byte: "Data byte 7B: 08" "Data byte: 08" "Byte: 08" "DB: 08" "08"
2039790-2039871 eeprom24xx: data: "Data" "D"
2039474-2039891 eeprom24xx: random-read: "Random access read (addr=7B, 1 byte): 08" "Random access read (addr=7B, 1 byte)" "Random access read" "RAR" "R"
2040092-2040133 eeprom24xx: control-code: "Control code bits: 0110" "Control code: 0110" "Ctrl code: 0110" "Ctrl code" "Ctrl" "C"
2040133-2040143 eeprom24xx: address-pin: "Address bit 2: 1" "Addr bit 2" "A2" "A"
2040143-2040153 eeprom24xx: address-pin: "Address bit 1: 0" "Addr bit 1" "A1" "A"
2040153-2040163 eeprom24xx: address-pin: "Address bit 0: 0" "Addr bit 0" "A0" "A"
2040163-2040173 eeprom24xx: rw-bit: "R/W bit: write" "R/W" "RW" "W"
2040092-2040173 eeprom24xx: control-word: "Control word" "Control" "CW" "C"
2040303-2040343 eeprom24xx: control-code: "Control code bits: 0110" "Control code: 0110" "Ctrl code: 0110" "Ctrl code" "Ctrl" "C"
2040343-2040353 eeprom24xx: address-pin: "Address bit 2: 1" "Addr bit 2" "A2" "A"
2040353-2040363 eeprom24xx: address-pin: "Address bit 1: 0" "Addr bit 1" "A1" "A"
2040363-2040374 eeprom24xx: address-pin: "Address bit 0: 0" "Addr bit 0" "A0" "A"
2040374-2040385 eeprom24xx: rw-bit: "R/W bit: read" "R/W" "RW" "R"
2040303-2040385 eeprom24xx: control-word: "Control word" "Control" "CW" "C"
2040188-2040269 eeprom24xx: word-addr-byte: "Word address byte: 82" "Word addr byte: 82" "Addr: 82" "A: 82" "82"
2040188-2040269 eeprom24xx: word-addr: "Word address" "Word addr" "Addr" "A"
2040397-2040479 eeprom24xx: data-byte: "Data byte 82: FF" "Data byte: FF" "Byte: FF" "DB: FF" "FF"
2040397-2040479 eeprom24xx: data: "Data" "D"
2040079-2040499 eeprom24xx: random-read: "Random access read (addr=82, 1 byte): FF" "Random access read (addr=82, 1 byte)" "Random access read" "RAR" "R"
2040579-2040620 eeprom24xx: control-code: "Control code bits: 0110" "Control code: 0110" "Ctrl code: 0110" "Ctrl code" "Ctrl" "C"
2040620-2040630 eeprom24xx: address-pin: "Address bit 2: 1" "Addr bit 2" "A2" "A"
2040630-2040640 eeprom24xx: address-pin: "Address bit 1: 0" "Addr bit 1" "A1" "A"
2040640-2040650 eeprom24xx: address-pin: "Address bit 0: 0" "Addr bit 0" "A0" "A"
2040650-2040660 eeprom24xx: rw-bit: "R/W bit: write" "R/W" "RW" "W"
2040579-2040660 eeprom24xx: control-word: "Control word" "Control" "CW" "C"
2040675-2040756 eeprom24xx: word-addr-byte: "Word address byte: 82" "Word addr byte: 82" "Addr: 82" "A: 82" "82"
2040675-2040756 eeprom24xx: word-addr: "Word address" "Word addr" "Addr" "A"
2040772-2040853 eeprom24xx: data-byte: "Data byte 82: FF" "Data byte: FF" "Byte: FF" "DB: FF" "FF"
2040772-2040853 eeprom24xx: data: "Data" "D"
2040567-2040874 eeprom24xx: byte-write: "Byte write (addr=82, 1 byte): FF" "Byte write (addr=82, 1 byte)" "Byte write" "BW" "B"
2040956-2040996 eeprom24xx: control-code: "Control code bits: 0110" "Control code: 0110" "Ctrl code: 0110" "Ctrl code" "Ctrl" "C"
2040996-2041006 eeprom24xx: address-pin: "Address bit 2: 1" "Addr bit 2" "A2" "A"
2041006-2041017 eeprom24xx: address-pin: "Address bit 1: 0" "Addr bit 1" "A1" "A"
2041017-2041027 eeprom24xx: address-pin: "Address bit 0: 0" "Addr bit 0" "A0" "A"
2041027-2041037 eeprom24xx: rw-bit: "R/W bit: write" "R/W" "RW" "W"
2040956-2041037 eeprom24xx: control-word: "Control word" "Control" "CW" "C"
2041163-2041204 eeprom24xx: control-code: "Control code bits: 0110" "Control code: 0110" "Ctrl code: 0110" "Ctrl code" "Ctrl" "C"
2041204-2041214 eeprom24xx: address-pin: "Address bit 2: 1" "Addr bit 2" "A2" "A"
2041214-2041224 eeprom24xx: address-pin: "Address bit 1: 0" "Addr bit 1" "A1" "A"
2041224-2041234 eeprom24xx: address-pin: "Address bit 0: 0" "Addr bit 0" "A0" "A"
2041234-2041244 eeprom24xx: rw-bit: "R/W bit: read" "R/W" "RW" "R"
2041163-2041244 eeprom24xx: control-word: "Control word" "Control" "CW" "C"
2041050-2041131 eeprom24xx: word-addr-byte: "Word address byte: 00" "Word addr byte: 00" "Addr: 00" "A: 00" "00"
2041050-2041131 eeprom24xx: word-addr: "Word address" "Word addr" "Addr" "A"
2041258-2041339 eeprom24xx: data-byte: "Data byte 00: 3D" "Data byte: 3D" "Byte: 3D" "DB: 3D" "3D"
2041258-2041339 eeprom24xx: data: "Data" "D"
2040943-2041361 eeprom24xx: random-read: "Random access read (addr=00, 1 byte): 3D" "Random access read (addr=00, 1 byte)" "Random access read" "RAR" "R"
2041422-2041463 eeprom24xx: control-code: "Control code bits: 0110" "Control code: 0110" "Ctrl code: 0110" "Ctrl code" "Ctrl" "C"
2041463-2041473 eeprom24xx: address-pin: "Address bit 2: 1" "Addr bit 2" "A2" "A"
2041473-2041483 eeprom24xx: address-pin: "Address bit 1: 0" "Addr bit 1" "A1" "A"
2041483-2041493 eeprom24xx: address-pin: "Address bit 0: 0" "Addr bit 0" "A0" "A"
2041493-2041503 eeprom24xx: rw-bit: "R/W bit: write" "R/W" "RW" "W"
2041422-2041503 eeprom24xx: control-word: "Control word" "Control" "CW" "C"
2041631-2041671 eeprom24xx: control-code: "Control code bits: 0110" "Control code: 0110" "Ctrl code: 0110" "Ctrl code" "Ctrl" "C"
2041671-2041681 eeprom24xx: address-pin: "Address bit 2: 1" "Addr bit 2" "A2" "A"
2041681-2041691 eeprom24xx: address-pin: "Address bit 1: 0" "Addr bit 1" "A1" "A"
2041691-2041701 eeprom24xx: address-pin: "Address bit 0: 0" "Addr bit 0" "A0" "A"
2041701-2041711 eeprom24xx: rw-bit: "R/W bit: read" "R/W" "RW" "R"
2041631-2041711 eeprom24xx: control-word: "Control word" "Control" "CW" "C"
2041516-2041597 eeprom24xx: word-addr-byte: "Word address byte: 82" "Word addr byte: 82" "Addr: 82" "A: 82" "82"
2041516-2041597 eeprom24xx: word-addr: "Word address" "Word addr" "Addr" "A"
2041725-2041805 eeprom24xx: data-byte: "Data byte 82: FF" "Data byte: FF" "Byte: FF" "DB: FF" "FF"
2041725-2041805 eeprom24xx: data: "Data" "D"
2041410-2041826 eeprom24xx: random-read: "Random access read (addr=82, 1 byte): FF" "Random access read (addr=82, 1 byte)" "Random access read" "RAR" "R"
2041884-2041925 eeprom24xx: control-code: "Control code bits: 0110" "Control code: 0110" "Ctrl code: 0110" "Ctrl code" "Ctrl" "C"
2041925-2041935 eeprom24xx: address-pin: "Address bit 2: 1" "Addr bit 2" "A2" "A"
2041935-2041945 eeprom24xx: address-pin: "Address bit 1: 0" "Addr bit 1" "A1" "A"
2041945-2041955 eeprom24xx: address-pin: "Address bit 0: 0" "Addr bit 0" "A0" "A"
2041955-2041965 eeprom24xx: rw-bit: "R/W bit: write" "R/W" "RW" "W"
2041884-2041965 eeprom24xx: control-word: "Control word" "Control" "CW" "C"
2042093-2042133 eeprom24xx: control-code: "Control code bits: 0110" "Control code: 0110" "Ctrl code: 0110" "Ctrl code" "Ctrl" "C"
2042133-2042143 eeprom24xx: address-pin: "Address bit 2: 1" "Addr bit 2" "A2" "A"
2042143-2042154 eeprom24xx: address-pin: "Address bit 1: 0" "Addr bit 1" "A1" "A"
2042154-2042164 eeprom24xx: address-pin: "Address bit 0: 0" "Addr bit 0" "A0" "A"
2042164-2042174 eeprom24xx: rw-bit: "R/W bit: read" "R/W" "RW" "R"
2042093-2042174 eeprom24xx: control-word: "Control word" "Control" "CW" "C"
2041979-2042059 eeprom24xx: word-addr-byte: "Word address byte: 56" "Word addr byte: 56" "Addr: 56" "A: 56" "56"
2041979-2042059 eeprom24xx: word-addr: "Word address" "Word addr" "Addr" "A"
2042187-2042268 eeprom24xx: data-byte: "Data byte 56: 00" "Data byte: 00" "Byte: 00" "DB: 00" "00"
2042187-2042268 eeprom24xx: data: "Data" "D"
2041872-2042289 eeprom24xx: random-read: "Random access read (addr=56, 1 byte): 00" "Random access read (addr=56, 1 byte)" "Random access read" "RAR" "R"
2042346-2042387 eeprom24xx: control-code: "Control code bits: 0110" "Control code: 0110" "Ctrl code: 0110" "Ctrl code" "Ctrl" "C"
2042387-2042397 eeprom24xx: address-pin: "Address bit 2: 1" "Addr bit 2" "A2" "A"
2042397-2042407 eeprom24xx: address-pin: "Address bit 1: 0" "Addr bit 1" "A1" "A"
2042407-2042417 eeprom24xx: address-pin: "Address bit 0: 0" "Addr bit 0" "A0" "A"
2042417-2042427 eeprom24xx: rw-bit: "R/W bit: write" "R/W" "RW" "W"
2042346-2042427 eeprom24xx: control-word: "Control word" "Control" "CW" "C"
2042555-2042595 eeprom24xx: control-code: "Control code bits: 0110" "Control code: 0110" "Ctrl code: 0110" "Ctrl code" "Ctrl" "C"
2042595-2042605 eeprom24xx: address-pin: "Address bit 2: 1" "Addr bit 2" "A2" "A"
2042605-2042616 eeprom24xx: address-pin: "Address bit 1: 0" "Addr bit 1" "A1" "A"
2042616-2042626 eeprom24xx: address-pin: "Address bit 0: 0" "Addr bit 0" "A0" "A"
2042626-2042636 eeprom24xx: rw-bit: "R/W bit: read" "R/W" "RW" "R"
2042555-2042636 eeprom24xx: control-word: "Control word" "Control" "CW" "C"
2042441-2042521 eeprom24xx: word-addr-byte: "Word address byte: 57" "Word addr byte: 57" "Addr: 57" "A: 57" "57"
2042441-2042521 eeprom24xx: word-addr: "Word address" "Word addr" "Addr" "A"
2042649-2042730 eeprom24xx: data-byte: "Data byte 57: 00" "Data byte: 00" "Byte: 00" "DB: 00" "00"
2042649-2042730 eeprom24xx: data: "Data" "D"
2042334-2042751 eeprom24xx: random-read: "Random access read (addr=57, 1 byte): 00" "Random access read (addr=57, 1 byte)" "Random access read" "RAR" "R"
2042814-2042855 eeprom24xx: control-code: "Control code bits: 0110" "Control code: 0110" "Ctrl code: 0110" "Ctrl code" "Ctrl" "C"
2042855-2042865 eeprom24xx: address-pin: "Address bit 2: 1" "Addr bit 2" "A2" "A"
2042865-2042875 eeprom24xx: address-pin: "Address bit 1: 0" "Addr bit 1" "A1" "A"
2042875-2042885 eeprom24xx: address-pin: "Address bit 0: 0" "Addr bit 0" "A0" "A"
2042885-2042895 eeprom24xx: rw-bit: "R/W bit: write" "R/W" "RW" "W"
2042814-2042895 eeprom24xx: control-word: "Control word" "Control" "CW" "C"
2043022-2043062 eeprom24xx: control-code: "Control code bits: 0110" "Control code: 0110" "Ctrl code: 0110" "Ctrl code" "Ctrl" "C"
2043062-2043072 eeprom24xx: address-pin: "Address bit 2: 1" "Addr bit 2" "A2" "A"
2043072-2043082 eeprom24xx: address-pin: "Address bit 1: 0" "Addr bit 1" "A1" "A"
2043082-2043092 eeprom24xx: address-pin: "Address bit 0: 0" "Addr bit 0" "A0" "A"
2043092-2043102 eeprom24xx: rw-bit: "R/W bit: read" "R/W" "RW" "R"
2043022-2043102 eeprom24xx: control-word: "Control word" "Control" "CW" "C"
2042908-2042989 eeprom24xx: word-addr-byte: "Word address byte: 58" "Word addr byte: 58" "Addr: 58" "A: 58" "58"
2042908-2042989 eeprom24xx: word-addr: "Word address" "Word addr" "Addr" "A"
2043115-2043197 eeprom24xx: data-byte: "Data byte 58: 00" "Data byte: 00" "Byte: 00" "DB: 00" "00"
2043115-2043197 eeprom24xx: data: "Data" "D"
2042802-2043217 eeprom24xx: random-read: "Random access read (addr=58, 1 byte): 00" "Random access read (addr=58, 1 byte)" "Random access read" "RAR" "R"
2043279-2043319 eeprom24xx: control-code: "Control code bits: 0110" "Control code: 0110" "Ctrl code: 0110" "Ctrl code" "Ctrl" "C"
2043319-2043330 eeprom24xx: address-pin: "Address bit 2: 1" "Addr bit 2" "A2" "A"
2043330-2043340 eeprom24xx: address-pin: "Address bit 1: 0" "Addr bit 1" "A1" "A"
2043340-2043350 eeprom24xx: address-pin: "Address bit 0: 0" "Addr bit 0" "A0" "A"
2043350-2043360 eeprom24xx: rw-bit: "R/W bit: write" "R/W" "RW" "W"
2043279-2043360 eeprom24xx: control-word: "Control word" "Control" "CW" "C"
2043487-2043528 eeprom24xx: control-code: "Control code bits: 0110" "Control code: 0110" "Ctrl code: 0110" "Ctrl code" "Ctrl" "C"
2043528-2043538 eeprom24xx: address-pin: "Address bit 2: 1" "Addr bit 2" "A2" "A"
2043538-2043548 eeprom24xx: address-pin: "Address bit 1: 0" "Addr bit 1" "A1" "A"
2043548-2043558 eeprom24xx: address-pin: "Address bit 0: 0" "Addr bit 0" "A0" "A"
2043558-2043568 eeprom24xx: rw-bit: "R/W bit: read" "R/W" "RW" "R"
2043487-2043568 eeprom24xx: control-word: "Control word" "Control" "CW" "C"
2043373-2043454 eeprom24xx: word-addr-byte: "Word address byte: 59" "Word addr byte: 59" "Addr: 59" "A: 59" "59"
2043373-2043454 eeprom24xx: word-addr: "Word address" "Word addr" "Addr" "A"
2043581-2043662 eeprom24xx: data-byte: "Data byte 59: 00" "Data byte: 00" "Byte: 00" "DB: 00" "00"
2043581-2043662 eeprom24xx: data: "Data" "D"
2043267-2043684 eeprom24xx: random-read: "Random access read (addr=59, 1 byte): 00" "Random access read (addr=59, 1 byte)" "Random access read" "RAR" "R"
3716267-3716307 eeprom24xx: control-code: "Control code bits: 0110" "Control code: 0110" "Ctrl code: 0110" "Ctrl code" "Ctrl" "C"
3716307-3716317 eeprom24xx: address-pin: "Address bit 2: 1" "Addr bit 2" "A2" "A"
3716317-3716327 eeprom24xx: address-pin: "Address bit 1: 0" "Addr bit 1" "A1" "A"
3716327-3716337 eeprom24xx: address-pin: "Address bit 0: 0" "Addr bit 0" "A0" "A"
3716337-3716347 eeprom24xx: rw-bit: "R/W bit: write" "R/W" "RW" "W"
3716267-3716347 eeprom24xx: control-word: "Control word" "Control" "CW" "C"
3716480-3716520 eeprom24xx: control-code: "Control code bits: 0110" "Control code: 0110" "Ctrl code: 0110" "Ctrl code" "Ctrl" "C"
3716520-3716531 eeprom24xx: address-pin: "Address bit 2: 1" "Addr bit 2" "A2" "A"
3716531-3716541 eeprom24xx: address-pin: "Address bit 1: 0" "Addr bit 1" "A1" "A"
3716541-3716551 eeprom24xx: address-pin: "Address bit 0: 0" "Addr bit 0" "A0" "A"
3716551-3716561 eeprom24xx: rw-bit: "R/W bit: read" "R/W" "RW" "R"
3716480-3716561 eeprom24xx: control-word: "Control word" "Control" "CW" "C"
3716364-3716444 eeprom24xx: word-addr-byte: "Word address byte: 00" "Word addr byte: 00" "Addr: 00" "A: 00" "00"
3716364-3716444 eeprom24xx: word-addr: "Word address" "Word addr" "Addr" "A"
3716577-3716658 eeprom24xx: data-byte: "Data byte 00: 3D" "Data byte: 3D" "Byte: 3D" "DB: 3D" "3D"
3716676-3716757 eeprom24xx: data-byte: "Data byte 01: 70" "Data byte: 70" "Byte: 70" "DB: 70" "70"
3716577-3716757 eeprom24xx: data: "Data" "D"
3716252-3716776 eeprom24xx: seq-random-read: "Sequential random read (addr=00, 2 bytes): 3D 70" "Sequential random read (addr=00, 2 bytes)" "Sequential random read" "SRR" "S"
3716848-3716889 eeprom24xx: control-code: "Control code bits: 0110" "Control code: 0110" "Ctrl code: 0110" "Ctrl code" "Ctrl" "C"
3716889-3716899 eeprom24xx: address-pin: "Address bit 2: 1" "Addr bit 2" "A2" "A"
3716899-3716909 eeprom24xx: address-pin: "Address bit 1: 0" "Addr bit 1" "A1" "A"
3716909-3716919 eeprom24xx: address-pin: "Address bit 0: 0" "Addr bit 0" "A0" "A"
3716919-3716929 eeprom24xx: rw-bit: "R/W bit: write" "R/W" "RW" "W"
3716848-3716929 eeprom24xx: control-word: "Control word" "Control" "CW" "C"
3717058-3717098 eeprom24xx: control-code: "Control code bits: 0110" "Control code: 0110" "Ctrl code: 0110" "Ctrl code" "Ctrl" "C"
3717098-3717108 eeprom24xx: address-pin: "Address bit 2: 1" "Addr bit 2" "A2" "A"
3717108-3717118 eeprom24xx: address-pin: "Address bit 1: 0" "Addr bit 1" "A1" "A"
3717118-3717128 eeprom24xx: address-pin: "Address bit 0: 0" "Addr bit 0" "A0" "A"
3717128-3717138 eeprom24xx: rw-bit: "R/W bit: read" "R/W" "RW" "R"
3717058-3717138 eeprom24xx: control-word: "Control word" "Control" "CW" "C"
3716943-3717024 eeprom24xx: word-addr-byte: "Word address byte: 7A" "Word addr byte: 7A" "Addr: 7A" "A: 7A" "7A"
3716943-3717024 eeprom24xx: word-addr: "Word address" "Word addr" "Addr" "A"
3717153-3717235 eeprom24xx: data-byte: "Data byte 7A: 2D" "Data byte: 2D" "Byte: 2D" "DB: 2D" "2D"
3717247-3717328 eeprom24xx: data-byte: "Data byte 7B: 05" "Data byte: 05" "Byte: 05" "DB: 05" "05"
3717341-3717422 eeprom24xx: data-byte: "Data byte 7C: 00" "Data byte: 00" "Byte: 00" "DB: 00" "00"
3717435-3717516 eeprom24xx: data-byte: "Data byte 7D: 00" "Data byte: 00" "Byte: 00" "DB: 00" "00"
3717153-3717516 eeprom24xx: data: "Data" "D"
3716836-3717536 eeprom24xx: seq-random-read: "Sequential random read (addr=7A, 4 bytes): 2D 05 00 00" "Sequential random read (addr=7A, 4 bytes)" "Sequential random read" "SRR" "S"
3717604-3717645 eeprom24xx: control-code: "Control code bits: 0110" "Control code: 0110" "Ctrl code: 0110" "Ctrl code" "Ctrl" "C"
3717645-3717655 eeprom24xx: address-pin: "Address bit 2: 1" "Addr bit 2" "A2" "A"
3717655-3717665 eeprom24xx: address-pin: "Address bit 1: 0" "Addr bit 1" "A1" "A"
3717665-3717675 eeprom24xx: address-pin: "Address bit 0: 0" "Addr bit 0" "A0" "A"
3717675-3717685 eeprom24xx: rw-bit: "R/W bit: write" "R/W" "RW" "W"
3717604-3717685 eeprom24xx: control-word: "Control word" "Control" "CW" "C"
3717813-3717853 eeprom24xx: control-code: "Control code bits: 0110" "Control code: 0110" "Ctrl code: 0110" "Ctrl code" "Ctrl" "C"
3717853-3717863 eeprom24xx: address-pin: "Address bit 2: 1" "Addr bit 2" "A2" "A"
3717863-3717873 eeprom24xx: address-pin: "Address bit 1: 0" "Addr bit 1" "A1" "A"
3717873-3717883 eeprom24xx: address-pin: "Address bit 0: 0" "Addr bit 0" "A0" "A"
3717883-3717893 eeprom24xx: rw-bit: "R/W bit: read" "R/W" "RW" "R"
3717813-3717893 eeprom24xx: control-word: "Control word" "Control" "CW" "C"
3717698-3717779 eeprom24xx: word-addr-byte: "Word address byte: 78" "Word addr byte: 78" "Addr: 78" "A: 78" "78"
3717698-3717779 eeprom24xx: word-addr: "Word address" "Word addr" "Addr" "A"
3717908-3717988 eeprom24xx: data-byte: "Data byte 78: ED" "Data byte: ED" "Byte: ED" "DB: ED" "ED"
3718004-3718086 eeprom24xx: data-byte: "Data byte 79: 04" "Data byte: 04" "Byte: 04" "DB: 04" "04"
3717908-3718086 eeprom24xx: data: "Data" "D"
3717592-3718105 eeprom24xx: seq-random-read: "Sequential random read (addr=78, 2 bytes): ED 04" "Sequential random read (addr=78, 2 bytes)" "Sequential random read" "SRR" "S"
3718174-3718214 eeprom24xx: control-code: "Control code bits: 0110" "Control code: 0110" "Ctrl code: 0110" "Ctrl code" "Ctrl" "C"
3718214-3718224 eeprom24xx: address-pin: "Address bit 2: 1" "Addr bit 2" "A2" "A"
3718224-3718234 eeprom24xx: address-pin: "Address bit 1: 0" "Addr bit 1" "A1" "A"
3718234-3718244 eeprom24xx: address-pin: "Address bit 0: 0" "Addr bit 0" "A0" "A"
3718244-3718254 eeprom24xx: rw-bit: "R/W bit: write" "R/W" "RW" "W"
3718174-3718254 eeprom24xx: control-word: "Control word" "Control" "CW" "C"
3718382-3718423 eeprom24xx: control-code: "Control code bits: 0110" "Control code: 0110" "Ctrl code: 0110" "Ctrl code" "Ctrl" "C"
3718423-3718433 eeprom24xx: address-pin: "Address bit 2: 1" "Addr bit 2" "A2" "A"
3718433-3718443 eeprom24xx: address-pin: "Address bit 1: 0" "Addr bit 1" "A1" "A"
3718443-3718453 eeprom24xx: address-pin: "Address bit 0: 0" "Addr bit 0" "A0" "A"
3718453-3718463 eeprom24xx: rw-bit: "R/W bit: read" "R/W" "RW" "R"
3718382-3718463 eeprom24xx: control-word: "Control word" "Control" "CW" "C"
3718268-3718350 eeprom24xx: word-addr-byte: "Word address byte: 33" "Word addr byte: 33" "Addr: 33" "A: 33" "33"
3718268-3718350 eeprom24xx: word-addr: "Word address" "Word addr" "Addr" "A"
3718476-3718557 eeprom24xx: data-byte: "Data byte 33: C8" "Data byte: C8" "Byte: C8" "DB: C8" "C8"
3718476-3718557 eeprom24xx: data: "Data" "D"
3718161-3718578 eeprom24xx: random-read: "Random access read (addr=33, 1 byte): C8" "Random access read (addr=33, 1 byte)" "Random access read" "RAR" "R"
3718673-3718713 eeprom24xx: control-code: "Control code bits: 0110" "Control code: 0110" "Ctrl code: 0110" "Ctrl code" "Ctrl" "C"
3718713-3718723 eeprom24xx: address-pin: "Address bit 2: 1" "Addr bit 2" "A2" "A"
3718723-3718733 eeprom24xx: address-pin: "Address bit 1: 0" "Addr bit 1" "A1" "A"
3718733-3718743 eeprom24xx: address-pin: "Address bit 0: 0" "Addr bit 0" "A0" "A"
3718743-3718753 eeprom24xx: rw-bit: "R/W bit: write" "R/W" "RW" "W"
3718673-3718753 eeprom24xx: control-word: "Control word" "Control" "CW" "C"
3718881-3718921 eeprom24xx: control-code: "Control code bits: 0110" "Control code: 0110" "Ctrl code: 0110" "Ctrl code" "Ctrl" "C"
3718921-3718931 eeprom24xx: address-pin: "Address bit 2: 1" "Addr bit 2" "A2" "A"
3718931-3718942 eeprom24xx: address-pin: "Address bit 1: 0" "Addr bit 1" "A1" "A"
3718942-3718952 eeprom24xx: address-pin: "Address bit 0: 0" "Addr bit 0" "A0" "A"
3718952-3718962 eeprom24xx: rw-bit: "R/W bit: read" "R/W" "RW" "R"
3718881-3718962 eeprom24xx: control-word: "Control word" "Control" "CW" "C"
3718767-3718847 eeprom24xx: word-addr-byte: "Word address byte: 84" "Word addr byte: 84" "Addr: 84" "A: 84" "84"
3718767-3718847 eeprom24xx: word-addr: "Word address" "Word addr" "Addr" "A"
3718975-3719056 eeprom24xx: data-byte: "Data byte 84: B2" "Data byte: B2" "Byte: B2" "DB: B2" "B2"
3718975-3719056 eeprom24xx: data: "Data" "D"
3718660-3719076 eeprom24xx: random-read: "Random access read (addr=84, 1 byte): B2" "Random access read (addr=84, 1 byte)" "Random access read" "RAR" "R"
3719136-3719176 eeprom24xx: control-code: "Control code bits: 0110" "Control code: 0110" "Ctrl code: 0110" "Ctrl code" "Ctrl" "C"
3719176-3719186 eeprom24xx: address-pin: "Address bit 2: 1" "Addr bit 2" "A2" "A"
3719186-3719197 eeprom24xx: address-pin: "Address bit 1: 0" "Addr bit 1" "A1" "A"
3719197-3719207 eeprom24xx: address-pin: "Address bit 0: 0" "Addr bit 0" "A0" "A"
3719207-3719217 eeprom24xx: rw-bit: "R/W bit: write" "R/W" "RW" "W"
3719136-3719217 eeprom24xx: control-word: "Control word" "Control" "CW" "C"
3719344-3719385 eeprom24xx: control-code: "Control code bits: 0110" "Control code: 0110" "Ctrl code: 0110" "Ctrl code" "Ctrl" "C"
3719385-3719395 eeprom24xx: address-pin: "Address bit 2: 1" "Addr bit 2" "A2" "A"
3719395-3719405 eeprom24xx: address-pin: "Address bit 1: 0" "Addr bit 1" "A1" "A"
3719405-3719415 eeprom24xx: address-pin: "Address bit 0: 0" "Addr bit 0" "A0" "A"
3719415-3719425 eeprom24xx: rw-bit: "R/W bit: read" "R/W" "RW" "R"
3719344-3719425 eeprom24xx: control-word: "Control word" "Control" "CW" "C"
3719230-3719311 eeprom24xx: word-addr-byte: "Word address byte: 03" "Word addr byte: 03" "Addr: 03" "A: 03" "03"
3719230-3719311 eeprom24xx: word-addr: "Word address" "Word addr" "Addr" "A"
3719438-3719519 eeprom24xx: data-byte: "Data byte 03: 03" "Data byte: 03" "Byte: 03" "DB: 03" "03"
3719438-3719519 eeprom24xx: data: "Data" "D"
3719123-3719540 eeprom24xx: random-read: "Random access read (addr=03, 1 byte): 03" "Random access read (addr=03, 1 byte)" "Random access read" "RAR" "R"
3719595-3719636 eeprom24xx: control-code: "Control code bits: 0110" "Control code: 0110" "Ctrl code: 0110" "Ctrl code" "Ctrl" "C"
3719636-3719646 eeprom24xx: address-pin: "Address bit 2: 1" "Addr bit 2" "A2" "A"
3719646-3719656 eeprom24xx: address-pin: "Address bit 1: 0" "Addr bit 1" "A1" "A"
3719656-3719666 eeprom24xx: address-pin: "Address bit 0: 0" "Addr bit 0" "A0" "A"
3719666-3719676 eeprom24xx: rw-bit: "R/W bit: write" "R/W" "RW" "W"
3719595-3719676 eeprom24xx: control-word: "Control word" "Control" "CW" "C"
3719804-3719844 eeprom24xx: control-code: "Control code bits: 0110" "Control code: 0110" "Ctrl code: 0110" "Ctrl code" "Ctrl" "C"
3719844-3719854 eeprom24xx: address-pin: "Address bit 2: 1" "Addr bit 2" "A2" "A"
3719854-3719864 eeprom24xx: address-pin: "Address bit 1: 0" "Addr bit 1" "A1" "A"
3719864-3719874 eeprom24xx: address-pin: "Address bit 0: 0" "Addr bit 0" "A0" "A"
3719874-3719884 eeprom24xx: rw-bit: "R/W bit: read" "R/W" "RW" "R"
3719804-3719884 eeprom24xx: control-word: "Control word" "Control" "CW" "C"
3719689-3719770 eeprom24xx: word-addr-byte: "Word address byte: B0" "Word addr byte: B0" "Addr: B0" "A: B0" "B0"
3719689-3719770 eeprom24xx: word-addr: "Word address" "Word addr" "Addr" "A"
3719898-3719978 eeprom24xx: data-byte: "Data byte B0: 00" "Data byte: 00" "Byte: 00" "DB: 00" "00"
3719992-3720074 eeprom24xx: data-byte: "Data byte B1: 00" "Data byte: 00" "Byte: 00" "DB: 00" "00"
3720086-3720167 eeprom24xx: data-byte: "Data byte B2: 0A" "Data byte: 0A" "Byte: 0A" "DB: 0A" "0A"
3720180-3720261 eeprom24xx: data-byte: "Data byte B3: 28" "Data byte: 28" "Byte: 28" "DB: 28" "28"
3720274-3720355 eeprom24xx: data-byte: "Data byte B4: 00" "Data byte: 00" "Byte: 00" "DB: 00" "00"
3720368-3720449 eeprom24xx: data-byte: "Data byte B5: 00" "Data byte: 00" "Byte: 00" "DB: 00" "00"
3720462-3720543 eeprom24xx: data-byte: "Data byte B6: 00" "Data byte: 00" "Byte: 00" "DB: 00" "00"
3720557-3720638 eeprom24xx: data-byte: "Data byte B7: 11" "Data byte: 11" "Byte: 11" "DB: 11" "11"
3719898-3720638 eeprom24xx: data: "Data" "D"
3719583-3720658 eeprom24xx: seq-random-read: "Sequential random read (addr=B0, 8 bytes): 00 00 0A 28 00 00 00 11" "Sequential random read (addr=B0, 8 bytes)" "Sequential random read" "SRR" "S"
6038476-6038516 eeprom24xx: control-code: "Control code bits: 0110" "Control code: 0110" "Ctrl code: 0110" "Ctrl code" "Ctrl" "C"
6038516-6038526 eeprom24xx: address-pin: "Address bit 2: 1" "Addr bit 2" "A2" "A"
6038526-6038536 eeprom24xx: address-pin: "Address bit 1: 0" "Addr bit 1" "A1" "A"
6038536-6038546 eeprom24xx: address-pin: "Address bit 0: 0" "Addr bit 0" "A0" "A"
6038546-6038556 eeprom24xx: rw-bit: "R/W bit: write" "R/W" "RW" "W"
6038476-6038556 eeprom24xx: control-word: "Control word" "Control" "CW" "C"
6038693-6038734 eeprom24xx: control-code: "Control code bits: 0110" "Control code: 0110" "Ctrl code: 0110" "Ctrl code" "Ctrl" "C"
6038734-6038744 eeprom24xx: address-pin: "Address bit 2: 1" "Addr bit 2" "A2" "A"
6038744-6038754 eeprom24xx: address-pin: "Address bit 1: 0" "Addr bit 1" "A1" "A"
6038754-6038764 eeprom24xx: address-pin: "Address bit 0: 0" "Addr bit 0" "A0" "A"
6038764-6038774 eeprom24xx: rw-bit: "R/W bit: read" "R/W" "RW" "R"
6038693-6038774 eeprom24xx: control-word: "Control word" "Control" "CW" "C"
6038577-6038659 eeprom24xx: word-addr-byte: "Word address byte: 01" "Word addr byte: 01" "Addr: 01" "A: 01" "01"
6038577-6038659 eeprom24xx: word-addr: "Word address" "Word addr" "Addr" "A"
6038789-6038870 eeprom24xx: data-byte: "Data byte 01: 70" "Data byte: 70" "Byte: 70" "DB: 70" "70"
6038789-6038870 eeprom24xx: data: "Data" "D"
6038449-6038895 eeprom24xx: random-read: "Random access read (addr=01, 1 byte): 70" "Random access read (addr=01, 1 byte)" "Random access read" "RAR" "R"
6038980-6039020 eeprom24xx: control-code: "Control code bits: 0110" "Control code: 0110" "Ctrl code: 0110" "Ctrl code" "Ctrl" "C"
6039020-6039031 eeprom24xx: address-pin: "Address bit 2: 1" "Addr bit 2" "A2" "A"
6039031-6039041 eeprom24xx: address-pin: "Address bit 1: 0" "Addr bit 1" "A1" "A"
6039041-6039051 eeprom24xx: address-pin: "Address bit 0: 0" "Addr bit 0" "A0" "A"
6039051-6039061 eeprom24xx: rw-bit: "R/W bit: write" "R/W" "RW" "W"
6038980-6039061 eeprom24xx: control-word: "Control word" "Control" "CW" "C"
6039187-6039228 eeprom24xx: control-code: "Control code bits: 0110" "Control code: 0110" "Ctrl code: 0110" "Ctrl code" "Ctrl" "C"
6039228-6039238 eeprom24xx: address-pin: "Address bit 2: 1" "Addr bit 2" "A2" "A"
6039238-6039248 eeprom24xx: address-pin: "Address bit 1: 0" "Addr bit 1" "A1" "A"
6039248-6039258 eeprom24xx: address-pin: "Address bit 0: 0" "Addr bit 0" "A0" "A"
6039258-6039268 eeprom24xx: rw-bit: "R/W bit: read" "R/W" "RW" "R"
6039187-6039268 eeprom24xx: control-word: "Control word" "Control" "CW" "C"
6039074-6039155 eeprom24xx: word-addr-byte: "Word address byte: 82" "Word addr byte: 82" "Addr: 82" "A: 82" "82"
6039074-6039155 eeprom24xx: word-addr: "Word address" "Word addr" "Addr" "A"
6039280-6039361 eeprom24xx: data-byte: "Data byte 82: FF" "Data byte: FF" "Byte: FF" "DB: FF" "FF"
6039280-6039361 eeprom24xx: data: "Data" "D"
6038967-6039382 eeprom24xx: random-read: "Random access read (addr=82, 1 byte): FF" "Random access read (addr=82, 1 byte)" "Random access read" "RAR" "R"
6039446-6039487 eeprom24xx: control-code: "Control code bits: 0110" "Control code: 0110" "Ctrl code: 0110" "Ctrl code" "Ctrl" "C"
6039487-6039497 eeprom24xx: address-pin: "Address bit 2: 1" "Addr bit 2" "A2" "A"
6039497-6039507 eeprom24xx: address-pin: "Address bit 1: 0" "Addr bit 1" "A1" "A"
6039507-6039517 eeprom24xx: address-pin: "Address bit 0: 0" "Addr bit 0" "A0" "A"
6039517-6039527 eeprom24xx: rw-bit: "R/W bit: write" "R/W" "RW" "W"
6039446-6039527 eeprom24xx: control-word: "Control word" "Control" "CW" "C"
6039656-6039696 eeprom24xx: control-code: "Control code bits: 0110" "Control code: 0110" "Ctrl code: 0110" "Ctrl code" "Ctrl" "C"
6039696-6039706 eeprom24xx: address-pin: "Address bit 2: 1" "Addr bit 2" "A2" "A"
6039706-6039716 eeprom24xx: address-pin: "Address bit 1: 0" "Addr bit 1" "A1" "A"
6039716-6039726 eeprom24xx: address-pin: "Address bit 0: 0" "Addr bit 0" "A0" "A"
6039726-6039736 eeprom24xx: rw-bit: "R/W bit: read" "R/W" "RW" "R"
6039656-6039736 eeprom24xx: control-word: "Control word" "Control" "CW" "C"
6039541-6039622 eeprom24xx: word-addr-byte: "Word address byte: 84" "Word addr byte: 84" "Addr: 84" "A: 84" "84"
6039541-6039622 eeprom24xx: word-addr: "Word address" "Word addr" "Addr" "A"
6039750-6039830 eeprom24xx: data-byte: "Data byte 84: B2" "Data byte: B2" "Byte: B2" "DB: B2" "B2"
6039750-6039830 eeprom24xx: data: "Data" "D"
6039434-6039853 eeprom24xx: random-read: "Random access read (addr=84, 1 byte): B2" "Random access read (addr=84, 1 byte)" "Random access read" "RAR" "R"
6039913-6039953 eeprom24xx: control-code: "Control code bits: 0110" "Control code: 0110" "Ctrl code: 0110" "Ctrl code" "Ctrl" "C"
6039953-6039963 eeprom24xx: address-pin: "Address bit 2: 1" "Addr bit 2" "A2" "A"
6039963-6039974 eeprom24xx: address-pin: "Address bit 1: 0" "Addr bit 1" "A1" "A"
6039974-6039984 eeprom24xx: address-pin: "Address bit 0: 0" "Addr bit 0" "A0" "A"
6039984-6039994 eeprom24xx: rw-bit: "R/W bit: write" "R/W" "RW" "W"
6039913-6039994 eeprom24xx: control-word: "Control word" "Control" "CW" "C"
6040121-6040162 eeprom24xx: control-code: "Control code bits: 0110" "Control code: 0110" "Ctrl code: 0110" "Ctrl code" "Ctrl" "C"
6040162-6040172 eeprom24xx: address-pin: "Address bit 2: 1" "Addr bit 2" "A2" "A"
6040172-6040182 eeprom24xx: address-pin: "Address bit 1: 0" "Addr bit 1" "A1" "A"
6040182-6040192 eeprom24xx: address-pin: "Address bit 0: 0" "Addr bit 0" "A0" "A"
6040192-6040202 eeprom24xx: rw-bit: "R/W bit: read" "R/W" "RW" "R"
6040121-6040202 eeprom24xx: control-word: "Control word" "Control" "CW" "C"
6040007-6040088 eeprom24xx: word-addr-byte: "Word address byte: 78" "Word addr byte: 78" "Addr: 78" "A: 78" "78"
6040007-6040088 eeprom24xx: word-addr: "Word address" "Word addr" "Addr" "A"
6040215-6040296 eeprom24xx: data-byte: "Data byte 78: ED" "Data byte: ED" "Byte: ED" "DB: ED" "ED"
6040215-6040296 eeprom24xx: data: "Data" "D"
6039900-6040317 eeprom24xx: random-read: "Random access read (addr=78, 1 byte): ED" "Random access read (addr=78, 1 byte)" "Random access read" "RAR" "R"
6040373-6040414 eeprom24xx: control-code: "Control code bits: 0110" "Control code: 0110" "Ctrl code: 0110" "Ctrl code" "Ctrl" "C"
6040414-6040424 eeprom24xx: address-pin: "Address bit 2: 1" "Addr bit 2" "A2" "A"
6040424-6040434 eeprom24xx: address-pin: "Address bit 1: 0" "Addr bit 1" "A1" "A"
6040434-6040444 eeprom24xx: address-pin: "Address bit 0: 0" "Addr bit 0" "A0" "A"
6040444-6040454 eeprom24xx: rw-bit: "R/W bit: write" "R/W" "RW" "W"
6040373-6040454 eeprom24xx: control-word: "Control word" "Control" "CW" "C"
6040580-6040621 eeprom24xx: control-code: "Control code bits: 0110" "Control code: 0110" "Ctrl code: 0110" "Ctrl code" "Ctrl" "C"
6040621-6040631 eeprom24xx: address-pin: "Address bit 2: 1" "Addr bit 2" "A2" "A"
6040631-6040641 eeprom24xx: address-pin: "Address bit 1: 0" "Addr bit 1" "A1" "A"
6040641-6040651 eeprom24xx: address-pin: "Address bit 0: 0" "Addr bit 0" "A0" "A"
6040651-6040661 eeprom24xx: rw-bit: "R/W bit: read" "R/W" "RW" "R"
6040580-6040661 eeprom24xx: control-word: "Control word" "Control" "CW" "C"
6040467-6040548 eeprom24xx: word-addr-byte: "Word address byte: 79" "Word addr byte: 79" "Addr: 79" "A: 79" "79"
6040467-6040548 eeprom24xx: word-addr: "Word address" "Word addr" "Addr" "A"
6040674-6040754 eeprom24xx: data-byte: "Data byte 79: 03" "Data byte: 03" "Byte: 03" "DB: 03" "03"
6040674-6040754 eeprom24xx: data: "Data" "D"
6040361-6040775 eeprom24xx: random-read: "Random access read (addr=79, 1 byte): 03" "Random access read (addr=79, 1 byte)" "Random access read" "RAR" "R"
6040841-6040881 eeprom24xx: control-code: "Control code bits: 0110" "Control code: 0110" "Ctrl code: 0110" "Ctrl code" "Ctrl" "C"
6040881-6040891 eeprom24xx: address-pin: "Address bit 2: 1" "Addr bit 2" "A2" "A"
6040891-6040901 eeprom24xx: address-pin: "Address bit 1: 0" "Addr bit 1" "A1" "A"
6040901-6040911 eeprom24xx: address-pin: "Address bit 0: 0" "Addr bit 0" "A0" "A"
6040911-6040921 eeprom24xx: rw-bit: "R/W bit: write" "R/W" "RW" "W"
6040841-6040921 eeprom24xx: control-word: "Control word" "Control" "CW" "C"
6041050-6041090 eeprom24xx: control-code: "Control code bits: 0110" "Control code: 0110" "Ctrl code: 0110" "Ctrl code" "Ctrl" "C"
6041090-6041101 eeprom24xx: address-pin: "Address bit 2: 1" "Addr bit 2" "A2" "A"
6041101-6041111 eeprom24xx: address-pin: "Address bit 1: 0" "Addr bit 1" "A1" "A"
6041111-6041121 eeprom24xx: address-pin: "Address bit 0: 0" "Addr bit 0" "A0" "A"
6041121-6041131 eeprom24xx: rw-bit: "R/W bit: read" "R/W" "RW" "R"
6041050-6041131 eeprom24xx: control-word: "Control word" "Control" "CW" "C"
6040936-6041016 eeprom24xx: word-addr-byte: "Word address byte: 00" "Word addr byte: 00" "Addr: 00" "A: 00" "00"
6040936-6041016 eeprom24xx: word-addr: "Word address" "Word addr" "Addr" "A"
6041144-6041225 eeprom24xx: data-byte: "Data byte 00: 3D" "Data byte: 3D" "Byte: 3D" "DB: 3D" "3D"
6041144-6041225 eeprom24xx: data: "Data" "D"
6040828-6041246 eeprom24xx: random-read: "Random access read (addr=00, 1 byte): 3D" "Random access read (addr=00, 1 byte)" "Random access read" "RAR" "R"
6041307-6041347 eeprom24xx: control-code: "Control code bits: 0110" "Control code: 0110" "Ctrl code: 0110" "Ctrl code" "Ctrl" "C"
6041347-6041357 eeprom24xx: address-pin: "Address bit 2: 1" "Addr bit 2" "A2" "A"
6041357-6041367 eeprom24xx: address-pin: "Address bit 1: 0" "Addr bit 1" "A1" "A"
6041367-6041377 eeprom24xx: address-pin: "Address bit 0: 0" "Addr bit 0" "A0" "A"
6041377-6041387 eeprom24xx: rw-bit: "R/W bit: write" "R/W" "RW" "W"
6041307-6041387 eeprom24xx: control-word: "Control word" "Control" "CW" "C"
6041516-6041556 eeprom24xx: control-code: "Control code bits: 0110" "Control code: 0110" "Ctrl code: 0110" "Ctrl code" "Ctrl" "C"
6041556-6041567 eeprom24xx: address-pin: "Address bit 2: 1" "Addr bit 2" "A2" "A"
6041567-6041577 eeprom24xx: address-pin: "Address bit 1: 0" "Addr bit 1" "A1" "A"
6041577-6041587 eeprom24xx: address-pin: "Address bit 0: 0" "Addr bit 0" "A0" "A"
6041587-6041597 eeprom24xx: rw-bit: "R/W bit: read" "R/W" "RW" "R"
6041516-6041597 eeprom24xx: control-word: "Control word" "Control" "CW" "C"
6041402-6041482 eeprom24xx: word-addr-byte: "Word address byte: 7A" "Word addr byte: 7A" "Addr: 7A" "A: 7A" "7A"
6041402-6041482 eeprom24xx: word-addr: "Word address" "Word addr" "Addr" "A"
6041610-6041691 eeprom24xx: data-byte: "Data byte 7A: 2D" "Data byte: 2D" "Byte: 2D" "DB: 2D" "2D"
6041610-6041691 eeprom24xx: data: "Data" "D"
6041294-6041712 eeprom24xx: random-read: "Random access read (addr=7A, 1 byte): 2D" "Random access read (addr=7A, 1 byte)" "Random access read" "RAR" "R"
6041770-6041811 eeprom24xx: control-code: "Control code bits: 0110" "Control code: 0110" "Ctrl code: 0110" "Ctrl code" "Ctrl" "C"
6041811-6041821 eeprom24xx: address-pin: "Address bit 2: 1" "Addr bit 2" "A2" "A"
6041821-6041831 eeprom24xx: address-pin: "Address bit 1: 0" "Addr bit 1" "A1" "A"
6041831-6041841 eeprom24xx: address-pin: "Address bit 0: 0" "Addr bit 0" "A0" "A"
6041841-6041851 eeprom24xx: rw-bit: "R/W bit: write" "R/W" "RW" "W"
6041770-6041851 eeprom24xx: control-word: "Control word" "Control" "CW" "C"
6041979-6042020 eeprom24xx: control-code: "Control code bits: 0110" "Control code: 0110" "Ctrl code: 0110" "Ctrl code" "Ctrl" "C"
6042020-6042030 eeprom24xx: address-pin: "Address bit 2: 1" "Addr bit 2" "A2" "A"
6042030-6042040 eeprom24xx: address-pin: "Address bit 1: 0" "Addr bit 1" "A1" "A"
6042040-6042050 eeprom24xx: address-pin: "Address bit 0: 0" "Addr bit 0" "A0" "A"
6042050-6042060 eeprom24xx: rw-bit: "R/W bit: read" "R/W" "RW" "R"
6041979-6042060 eeprom24xx: control-word: "Control word" "Control" "CW" "C"
6041865-6041946 eeprom24xx: word-addr-byte: "Word address byte: 7B" "Word addr byte: 7B" "Addr: 7B" "A: 7B" "7B"
6041865-6041946 eeprom24xx: word-addr: "Word address" "Word addr" "Addr" "A"
6042074-6042154 eeprom24xx: data-byte: "Data byte 7B: 08" "Data byte: 08" "Byte: 08" "DB: 08" "08"
6042074-6042154 eeprom24xx: data: "Data" "D"
6041758-6042175 eeprom24xx: random-read: "Random access read (addr=7B, 1 byte): 08" "Random access read (addr=7B, 1 byte)" "Random access read" "RAR" "R"
6042383-6042423 eeprom24xx: control-code: "Control code bits: 0110" "Control code: 0110" "Ctrl code: 0110" "Ctrl code" "Ctrl" "C"
6042423-6042433 eeprom24xx: address-pin: "Address bit 2: 1" "Addr bit 2" "A2" "A"
6042433-6042443 eeprom24xx: address-pin: "Address bit 1: 0" "Addr bit 1" "A1" "A"
6042443-6042453 eeprom24xx: address-pin: "Address bit 0: 0" "Addr bit 0" "A0" "A"
6042453-6042463 eeprom24xx: rw-bit: "R/W bit: write" "R/W" "RW" "W"
6042383-6042463 eeprom24xx: control-word: "Control word" "Control" "CW" "C"
6042594-6042635 eeprom24xx: control-code: "Control code bits: 0110" "Control code: 0110" "Ctrl code: 0110" "Ctrl code" "Ctrl" "C"
6042635-6042645 eeprom24xx: address-pin: "Address bit 2: 1" "Addr bit 2" "A2" "A"
6042645-6042655 eeprom24xx: address-pin: "Address bit 1: 0" "Addr bit 1" "A1" "A"
6042655-6042665 eeprom24xx: address-pin: "Address bit 0: 0" "Addr bit 0" "A0" "A"
6042665-6042675 eeprom24xx: rw-bit: "R/W bit: read" "R/W" "RW" "R"
6042594-6042675 eeprom24xx: control-word: "Control word" "Control" "CW" "C"
6042480-6042562 eeprom24xx: word-addr-byte: "Word address byte: 82" "Word addr byte: 82" "Addr: 82" "A: 82" "82"
6042480-6042562 eeprom24xx: word-addr: "Word address" "Word addr" "Addr" "A"
6042688-6042769 eeprom24xx: data-byte: "Data byte 82: FF" "Data byte: FF" "Byte: FF" "DB: FF" "FF"
6042688-6042769 eeprom24xx: data: "Data" "D"
6042368-6042790 eeprom24xx: random-read: "Random access read (addr=82, 1 byte): FF" "Random access read (addr=82, 1 byte)" "Random access read" "RAR" "R"
6042868-6042909 eeprom24xx: control-code: "Control code bits: 0110" "Control code: 0110" "Ctrl code: 0110" "Ctrl code" "Ctrl" "C"
6042909-6042919 eeprom24xx: address-pin: "Address bit 2: 1" "Addr bit 2" "A2" "A"
6042919-6042929 eeprom24xx: address-pin: "Address bit 1: 0" "Addr bit 1" "A1" "A"
6042929-6042939 eeprom24xx: address-pin: "Address bit 0: 0" "Addr bit 0" "A0" "A"
6042939-6042949 eeprom24xx: rw-bit: "R/W bit: write" "R/W" "RW" "W"
6042868-6042949 eeprom24xx: control-word: "Control word" "Control" "CW" "C"
6042964-6043045 eeprom24xx: word-addr-byte: "Word address byte: 82" "Word addr byte: 82" "Addr: 82" "A: 82" "82"
6042964-6043045 eeprom24xx: word-addr: "Word address" "Word addr" "Addr" "A"
6043061-6043142 eeprom24xx: data-byte: "Data byte 82: FF" "Data byte: FF" "Byte: FF" "DB: FF" "FF"
6043061-6043142 eeprom24xx: data: "Data" "D"
6042856-6043163 eeprom24xx: byte-write: "Byte write (addr=82, 1 byte): FF" "Byte write (addr=82, 1 byte)" "Byte write" "BW" "B"
6043239-6043279 eeprom24xx: control-code: "Control code bits: 0110" "Control code: 0110" "Ctrl code: 0110" "Ctrl code" "Ctrl" "C"
6043279-6043289 eeprom24xx: address-pin: "Address bit 2: 1" "Addr bit 2" "A2" "A"
6043289-6043300 eeprom24xx: address-pin: "Address bit 1: 0" "Addr bit 1" "A1" "A"
6043300-6043310 eeprom24xx: address-pin: "Address bit 0: 0" "Addr bit 0" "A0" "A"
6043310-6043320 eeprom24xx: rw-bit: "R/W bit: write" "R/W" "RW" "W"
6043239-6043320 eeprom24xx: control-word: "Control word" "Control" "CW" "C"
6043447-6043488 eeprom24xx: control-code: "Control code bits: 0110" "Control code: 0110" "Ctrl code: 0110" "Ctrl code" "Ctrl" "C"
6043488-6043498 eeprom24xx: address-pin: "Address bit 2: 1" "Addr bit 2" "A2" "A"
6043498-6043508 eeprom24xx: address-pin: "Address bit 1: 0" "Addr bit 1" "A1" "A"
6043508-6043518 eeprom24xx: address-pin: "Address bit 0: 0" "Addr bit 0" "A0" "A"
6043518-6043528 eeprom24xx: rw-bit: "R/W bit: read" "R/W" "RW" "R"
6043447-6043528 eeprom24xx: control-word: "Control word" "Control" "CW" "C"
6043333-6043414 eeprom24xx: word-addr-byte: "Word address byte: 00" "Word addr byte: 00" "Addr: 00" "A: 00" "00"
6043333-6043414 eeprom24xx: word-addr: "Word address" "Word addr" "Addr" "A"
6043542-6043623 eeprom24xx: data-byte: "Data byte 00: 3D" "Data byte: 3D" "Byte: 3D" "DB: 3D" "3D"
6043542-6043623 eeprom24xx: data: "Data" "D"
6043226-6043644 eeprom24xx: random-read: "Random access read (addr=00, 1 byte): 3D" "Random access read (addr=00, 1 byte)" "Random access read" "RAR" "R"
6043702-6043743 eeprom24xx: control-code: "Control code bits: 0110" "Control code: 0110" "Ctrl code: 0110" "Ctrl code" "Ctrl" "C"
6043743-6043753 eeprom24xx: address-pin: "Address bit 2: 1" "Addr bit 2" "A2" "A"
6043753-6043763 eeprom24xx: address-pin: "Address bit 1: 0" "Addr bit 1" "A1" "A"
6043763-6043773 eeprom24xx: address-pin: "Address bit 0: 0" "Addr bit 0" "A0" "A"
6043773-6043783 eeprom24xx: rw-bit: "R/W bit: write" "R/W" "RW" "W"
6043702-6043783 eeprom24xx: control-word: "Control word" "Control" "CW" "C"
6043911-6043951 eeprom24xx: control-code: "Control code bits: 0110" "Control code: 0110" "Ctrl code: 0110" "Ctrl code" "Ctrl" "C"
6043951-6043961 eeprom24xx: address-pin: "Address bit 2: 1" "Addr bit 2" "A2" "A"
6043961-6043972 eeprom24xx: address-pin: "Address bit 1: 0" "Addr bit 1" "A1" "A"
6043972-6043982 eeprom24xx: address-pin: "Address bit 0: 0" "Addr bit 0" "A0" "A"
6043982-6043992 eeprom24xx: rw-bit: "R/W bit: read" "R/W" "RW" "R"
6043911-6043992 eeprom24xx: control-word: "Control word" "Control" "CW" "C"
6043797-6043877 eeprom24xx: word-addr-byte: "Word address byte: 82" "Word addr byte: 82" "Addr: 82" "A: 82" "82"
6043797-6043877 eeprom24xx: word-addr: "Word address" "Word addr" "Addr" "A"
6044005-6044086 eeprom24xx: data-byte: "Data byte 82: FF" "Data byte: FF" "Byte: FF" "DB: FF" "FF"
6044005-6044086 eeprom24xx: data: "Data" "D"
6043690-6044106 eeprom24xx: random-read: "Random access read (addr=82, 1 byte): FF" "Random access read (addr=82, 1 byte)" "Random access read" "RAR" "R"
6044164-6044205 eeprom24xx: control-code: "Control code bits: 0110" "Control code: 0110" "Ctrl code: 0110" "Ctrl code" "Ctrl" "C"
6044205-6044215 eeprom24xx: address-pin: "Address bit 2: 1" "Addr bit 2" "A2" "A"
6044215-6044225 eeprom24xx: address-pin: "Address bit 1: 0" "Addr bit 1" "A1" "A"
6044225-6044235 eeprom24xx: address-pin: "Address bit 0: 0" "Addr bit 0" "A0" "A"
6044235-6044245 eeprom24xx: rw-bit: "R/W bit: write" "R/W" "RW" "W"
6044164-6044245 eeprom24xx: control-word: "Control word" "Control" "CW" "C"
6044373-6044413 eeprom24xx: control-code: "Control code bits: 0110" "Control code: 0110" "Ctrl code: 0110" "Ctrl code" "Ctrl" "C"
6044413-6044423 eeprom24xx: address-pin: "Address bit 2: 1" "Addr bit 2" "A2" "A"
6044423-6044433 eeprom24xx: address-pin: "Address bit 1: 0" "Addr bit 1" "A1" "A"
6044433-6044443 eeprom24xx: address-pin: "Address bit 0: 0" "Addr bit 0" "A0" "A"
6044443-6044453 eeprom24xx: rw-bit: "R/W bit: read" "R/W" "RW" "R"
6044373-6044453 eeprom24xx: control-word: "Control word" "Control" "CW" "C"
6044258-6044339 eeprom24xx: word-addr-byte: "Word address byte: 56" "Word addr byte: 56" "Addr: 56" "A: 56" "56"
6044258-6044339 eeprom24xx: word-addr: "Word address" "Word addr" "Addr" "A"
6044467-6044547 eeprom24xx: data-byte: "Data byte 56: 00" "Data byte: 00" "Byte: 00" "DB: 00" "00"
6044467-6044547 eeprom24xx: data: "Data" "D"
6044152-6044568 eeprom24xx: random-read: "Random access read (addr=56, 1 byte): 00" "Random access read (addr=56, 1 byte)" "Random access read" "RAR" "R"
6044624-6044665 eeprom24xx: control-code: "Control code bits: 0110" "Control code: 0110" "Ctrl code: 0110" "Ctrl code" "Ctrl" "C"
6044665-6044675 eeprom24xx: address-pin: "Address bit 2: 1" "Addr bit 2" "A2" "A"
6044675-6044685 eeprom24xx: address-pin: "Address bit 1: 0" "Addr bit 1" "A1" "A"
6044685-6044695 eeprom24xx: address-pin: "Address bit 0: 0" "Addr bit 0" "A0" "A"
6044695-6044705 eeprom24xx: rw-bit: "R/W bit: write" "R/W" "RW" "W"
6044624-6044705 eeprom24xx: control-word: "Control word" "Control" "CW" "C"
6044832-6044873 eeprom24xx: control-code: "Control code bits: 0110" "Control code: 0110" "Ctrl code: 0110" "Ctrl code" "Ctrl" "C"
6044873-6044883 eeprom24xx: address-pin: "Address bit 2: 1" "Addr bit 2" "A2" "A"
6044883-6044893 eeprom24xx: address-pin: "Address bit 1: 0" "Addr bit 1" "A1" "A"
6044893-6044903 eeprom24xx: address-pin: "Address bit 0: 0" "Addr bit 0" "A0" "A"
6044903-6044913 eeprom24xx: rw-bit: "R/W bit: read" "R/W" "RW" "R"
6044832-6044913 eeprom24xx: control-word: "Control word" "Control" "CW" "C"
6044718-6044799 eeprom24xx: word-addr-byte: "Word address byte: 57" "Word addr byte: 57" "Addr: 57" "A: 57" "57"
6044718-6044799 eeprom24xx: word-addr: "Word address" "Word addr" "Addr" "A"
6044927-6045007 eeprom24xx: data-byte: "Data byte 57: 00" "Data byte: 00" "Byte: 00" "DB: 00" "00"
6044927-6045007 eeprom24xx: data: "Data" "D"
6044612-6045028 eeprom24xx: random-read: "Random access read (addr=57, 1 byte): 00" "Random access read (addr=57, 1 byte)" "Random access read" "RAR" "R"
6045093-6045134 eeprom24xx: control-code: "Control code bits: 0110" "Control code: 0110" "Ctrl code: 0110" "Ctrl code" "Ctrl" "C"
6045134-6045144 eeprom24xx: address-pin: "Address bit 2: 1" "Addr bit 2" "A2" "A"
6045144-6045154 eeprom24xx: address-pin: "Address bit 1: 0" "Addr bit 1" "A1" "A"
6045154-6045164 eeprom24xx: address-pin: "Address bit 0: 0" "Addr bit 0" "A0" "A"
6045164-6045174 eeprom24xx: rw-bit: "R/W bit: write" "R/W" "RW" "W"
6045093-6045174 eeprom24xx: control-word: "Control word" "Control" "CW" "C"
6045301-6045342 eeprom24xx: control-code: "Control code bits: 0110" "Control code: 0110" "Ctrl code: 0110" "Ctrl code" "Ctrl" "C"
6045342-6045352 eeprom24xx: address-pin: "Address bit 2: 1" "Addr bit 2" "A2" "A"
6045352-6045362 eeprom24xx: address-pin: "Address bit 1: 0" "Addr bit 1" "A1" "A"
6045362-6045372 eeprom24xx: address-pin: "Address bit 0: 0" "Addr bit 0" "A0" "A"
6045372-6045382 eeprom24xx: rw-bit: "R/W bit: read" "R/W" "RW" "R"
6045301-6045382 eeprom24xx: control-word: "Control word" "Control" "CW" "C"
6045188-6045269 eeprom24xx: word-addr-byte: "Word address byte: 58" "Word addr byte: 58" "Addr: 58" "A: 58" "58"
6045188-6045269 eeprom24xx: word-addr: "Word address" "Word addr" "Addr" "A"
6045394-6045475 eeprom24xx: data-byte: "Data byte 58: 00" "Data byte: 00" "Byte: 00" "DB: 00" "00"
6045394-6045475 eeprom24xx: data: "Data" "D"
6045081-6045496 eeprom24xx: random-read: "Random access read (addr=58, 1 byte): 00" "Random access read (addr=58, 1 byte)" "Random access read" "RAR" "R"
6045555-6045596 eeprom24xx: control-code: "Control code bits: 0110" "Control code: 0110" "Ctrl code: 0110" "Ctrl code" "Ctrl" "C"
6045596-6045606 eeprom24xx: address-pin: "Address bit 2: 1" "Addr bit 2" "A2" "A"
6045606-6045616 eeprom24xx: address-pin: "Address bit 1: 0" "Addr bit 1" "A1" "A"
6045616-6045626 eeprom24xx: address-pin: "Address bit 0: 0" "Addr bit 0" "A0" "A"
6045626-6045636 eeprom24xx: rw-bit: "R/W bit: write" "R/W" "RW" "W"
6045555-6045636 eeprom24xx: control-word: "Control word" "Control" "CW" "C"
6045764-6045805 eeprom24xx: control-code: "Control code bits: 0110" "Control code: 0110" "Ctrl code: 0110" "Ctrl code" "Ctrl" "C"
6045805-6045815 eeprom24xx: address-pin: "Address bit 2: 1" "Addr bit 2" "A2" "A"
6045815-6045825 eeprom24xx: address-pin: "Address bit 1: 0" "Addr bit 1" "A1" "A"
6045825-6045835 eeprom24xx: address-pin: "Address bit 0: 0" "Addr bit 0" "A0" "A"
6045835-6045845 eeprom24xx: rw-bit: "R/W bit: read" "R/W" "RW" "R"
6045764-6045845 eeprom24xx: control-word: "Control word" "Control" "CW" "C"
6045649-6045730 eeprom24xx: word-addr-byte: "Word address byte: 59" "Word addr byte: 59" "Addr: 59" "A: 59" "59"
6045649-6045730 eeprom24xx: word-addr: "Word address" "Word addr" "Addr" "A"
6045858-6045939 eeprom24xx: data-byte: "Data byte 59: 00" "Data byte: 00" "Byte: 00" "DB: 00" "00"
6045858-6045939 eeprom24xx: data: "Data" "D"
6045543-6045960 eeprom24xx: random-read: "Random access read (addr=59, 1 byte): 00" "Random access read (addr=59, 1 byte)" "Random access read" "RAR" "R"
