2817-8010 eeprom24xx: control-code: "Control code bits: 1010" "Control code: 1010" "Ctrl code: 1010" "Ctrl code" "Ctrl" "C"
8010-9120 eeprom24xx: address-pin: "Address bit 2: 0" "Addr bit 2" "A2" "A"
9120-10547 eeprom24xx: address-pin: "Address bit 1: 0" "Addr bit 1" "A1" "A"
10547-12459 eeprom24xx: address-pin: "Address bit 0: 0" "Addr bit 0" "A0" "A"
12459-14371 eeprom24xx: rw-bit: "R/W bit: write" "R/W" "RW" "W"
2817-14371 eeprom24xx: control-word: "Control word" "Control" "CW" "C"
31302-36257 eeprom24xx: control-code: "Control code bits: 1010" "Control code: 1010" "Ctrl code: 1010" "Ctrl code" "Ctrl" "C"
36257-37624 eeprom24xx: address-pin: "Address bit 2: 0" "Addr bit 2" "A2" "A"
37624-39209 eeprom24xx: address-pin: "Address bit 1: 0" "Addr bit 1" "A1" "A"
39209-40319 eeprom24xx: address-pin: "Address bit 0: 0" "Addr bit 0" "A0" "A"
40319-41429 eeprom24xx: rw-bit: "R/W bit: read" "R/W" "RW" "R"
31302-41429 eeprom24xx: control-word: "Control word" "Control" "CW" "C"
16430-26599 eeprom24xx: word-addr-byte: "Word address byte: 08" "Word addr byte: 08" "Addr: 08" "A: 08" "08"
16430-26599 eeprom24xx: word-addr: "Word address" "Word addr" "Addr" "A"
44283-55749 eeprom24xx: data-byte: "Data byte 08: 14" "Data byte: 14" "Byte: 14" "DB: 14" "14"
44283-55749 eeprom24xx: data: "Data" "D"
1093-57593 eeprom24xx: random-read: "Random access read (addr=08, 1 byte): 14" "Random access read (addr=08, 1 byte)" "Random access read" "RAR" "R"
61457-66758 eeprom24xx: control-code: "Control code bits: 1010" "Control code: 1010" "Ctrl code: 1010" "Ctrl code" "Ctrl" "C"
66758-67868 eeprom24xx: address-pin: "Address bit 2: 0" "Addr bit 2" "A2" "A"
67868-69239 eeprom24xx: address-pin: "Address bit 1: 0" "Addr bit 1" "A1" "A"
69239-70603 eeprom24xx: address-pin: "Address bit 0: 1" "Addr bit 0" "A0" "A"
70603-71967 eeprom24xx: rw-bit: "R/W bit: write" "R/W" "RW" "W"
61457-71967 eeprom24xx: control-word: "Control word" "Control" "CW" "C"
89381-94568 eeprom24xx: control-code: "Control code bits: 1010" "Control code: 1010" "Ctrl code: 1010" "Ctrl code" "Ctrl" "C"
94568-95936 eeprom24xx: address-pin: "Address bit 2: 0" "Addr bit 2" "A2" "A"
95936-97046 eeprom24xx: address-pin: "Address bit 1: 0" "Addr bit 1" "A1" "A"
97046-98414 eeprom24xx: address-pin: "Address bit 0: 1" "Addr bit 0" "A0" "A"
98414-99782 eeprom24xx: rw-bit: "R/W bit: read" "R/W" "RW" "R"
89381-99782 eeprom24xx: control-word: "Control word" "Control" "CW" "C"
74575-84685 eeprom24xx: word-addr-byte: "Word address byte: 08" "Word addr byte: 08" "Addr: 08" "A: 08" "08"
74575-84685 eeprom24xx: word-addr: "Word address" "Word addr" "Addr" "A"
102371-113865 eeprom24xx: data-byte: "Data byte 08: E9" "Data byte: E9" "Byte: E9" "DB: E9" "E9"
102371-113865 eeprom24xx: data: "Data" "D"
59976-115710 eeprom24xx: random-read: "Random access read (addr=08, 1 byte): E9" "Random access read (addr=08, 1 byte)" "Random access read" "RAR" "R"
119798-124973 eeprom24xx: control-code: "Control code bits: 1010" "Control code: 1010" "Ctrl code: 1010" "Ctrl code" "Ctrl" "C"
124973-126083 eeprom24xx: address-pin: "Address bit 2: 0" "Addr bit 2" "A2" "A"
126083-127439 eeprom24xx: address-pin: "Address bit 1: 1" "Addr bit 1" "A1" "A"
127439-128793 eeprom24xx: address-pin: "Address bit 0: 0" "Addr bit 0" "A0" "A"
128793-130147 eeprom24xx: rw-bit: "R/W bit: write" "R/W" "RW" "W"
119798-130147 eeprom24xx: control-word: "Control word" "Control" "CW" "C"
118315-132234 eeprom24xx: warnings: "Warning: No reply from slave!"
136688-141902 eeprom24xx: control-code: "Control code bits: 1010" "Control code: 1010" "Ctrl code: 1010" "Ctrl code" "Ctrl" "C"
141902-143479 eeprom24xx: address-pin: "Address bit 2: 0" "Addr bit 2" "A2" "A"
143479-144589 eeprom24xx: address-pin: "Address bit 1: 1" "Addr bit 1" "A1" "A"
144589-145956 eeprom24xx: address-pin: "Address bit 0: 0" "Addr bit 0" "A0" "A"
145956-147323 eeprom24xx: rw-bit: "R/W bit: write" "R/W" "RW" "W"
136688-147323 eeprom24xx: control-word: "Control word" "Control" "CW" "C"
135209-149420 eeprom24xx: warnings: "Warning: No reply from slave!"
154087-159013 eeprom24xx: control-code: "Control code bits: 1010" "Control code: 1010" "Ctrl code: 1010" "Ctrl code" "Ctrl" "C"
159013-160365 eeprom24xx: address-pin: "Address bit 2: 0" "Addr bit 2" "A2" "A"
160365-161476 eeprom24xx: address-pin: "Address bit 1: 1" "Addr bit 1" "A1" "A"
161476-162836 eeprom24xx: address-pin: "Address bit 0: 0" "Addr bit 0" "A0" "A"
162836-164196 eeprom24xx: rw-bit: "R/W bit: write" "R/W" "RW" "W"
154087-164196 eeprom24xx: control-word: "Control word" "Control" "CW" "C"
152362-166238 eeprom24xx: warnings: "Warning: No reply from slave!"
171070-176014 eeprom24xx: control-code: "Control code bits: 1010" "Control code: 1010" "Ctrl code: 1010" "Ctrl code" "Ctrl" "C"
176014-177368 eeprom24xx: address-pin: "Address bit 2: 0" "Addr bit 2" "A2" "A"
177368-178722 eeprom24xx: address-pin: "Address bit 1: 1" "Addr bit 1" "A1" "A"
178722-179833 eeprom24xx: address-pin: "Address bit 0: 0" "Addr bit 0" "A0" "A"
179833-180944 eeprom24xx: rw-bit: "R/W bit: write" "R/W" "RW" "W"
171070-180944 eeprom24xx: control-word: "Control word" "Control" "CW" "C"
169337-183027 eeprom24xx: warnings: "Warning: No reply from slave!"
187983-192936 eeprom24xx: control-code: "Control code bits: 1010" "Control code: 1010" "Ctrl code: 1010" "Ctrl code" "Ctrl" "C"
192936-194306 eeprom24xx: address-pin: "Address bit 2: 0" "Addr bit 2" "A2" "A"
194306-195881 eeprom24xx: address-pin: "Address bit 1: 1" "Addr bit 1" "A1" "A"
195881-196991 eeprom24xx: address-pin: "Address bit 0: 0" "Addr bit 0" "A0" "A"
196991-198101 eeprom24xx: rw-bit: "R/W bit: write" "R/W" "RW" "W"
187983-198101 eeprom24xx: control-word: "Control word" "Control" "CW" "C"
186245-200201 eeprom24xx: warnings: "Warning: No reply from slave!"
205157-210336 eeprom24xx: control-code: "Control code bits: 1010" "Control code: 1010" "Ctrl code: 1010" "Ctrl code" "Ctrl" "C"
210336-211447 eeprom24xx: address-pin: "Address bit 2: 0" "Addr bit 2" "A2" "A"
211447-212804 eeprom24xx: address-pin: "Address bit 1: 1" "Addr bit 1" "A1" "A"
212804-214156 eeprom24xx: address-pin: "Address bit 0: 0" "Addr bit 0" "A0" "A"
214156-215508 eeprom24xx: rw-bit: "R/W bit: write" "R/W" "RW" "W"
205157-215508 eeprom24xx: control-word: "Control word" "Control" "CW" "C"
203676-217592 eeprom24xx: warnings: "Warning: No reply from slave!"
222591-227548 eeprom24xx: control-code: "Control code bits: 1010" "Control code: 1010" "Ctrl code: 1010" "Ctrl code" "Ctrl" "C"
227548-228913 eeprom24xx: address-pin: "Address bit 2: 0" "Addr bit 2" "A2" "A"
228913-230025 eeprom24xx: address-pin: "Address bit 1: 0" "Addr bit 1" "A1" "A"
230025-231393 eeprom24xx: address-pin: "Address bit 0: 0" "Addr bit 0" "A0" "A"
231393-232761 eeprom24xx: rw-bit: "R/W bit: write" "R/W" "RW" "W"
222591-232761 eeprom24xx: control-word: "Control word" "Control" "CW" "C"
250434-255386 eeprom24xx: control-code: "Control code bits: 1010" "Control code: 1010" "Ctrl code: 1010" "Ctrl code" "Ctrl" "C"
255386-256754 eeprom24xx: address-pin: "Address bit 2: 0" "Addr bit 2" "A2" "A"
256754-258120 eeprom24xx: address-pin: "Address bit 1: 0" "Addr bit 1" "A1" "A"
258120-259231 eeprom24xx: address-pin: "Address bit 0: 0" "Addr bit 0" "A0" "A"
259231-260342 eeprom24xx: rw-bit: "R/W bit: read" "R/W" "RW" "R"
250434-260342 eeprom24xx: control-word: "Control word" "Control" "CW" "C"
235368-245516 eeprom24xx: word-addr-byte: "Word address byte: 08" "Word addr byte: 08" "Addr: 08" "A: 08" "08"
235368-245516 eeprom24xx: word-addr: "Word address" "Word addr" "Addr" "A"
263185-274660 eeprom24xx: data-byte: "Data byte 08: 14" "Data byte: 14" "Byte: 14" "DB: 14" "14"
276620-287607 eeprom24xx: data-byte: "Data byte 09: D7" "Data byte: D7" "Byte: D7" "DB: D7" "D7"
289594-301038 eeprom24xx: data-byte: "Data byte 0A: 07" "Data byte: 07" "Byte: 07" "DB: 07" "07"
302659-314162 eeprom24xx: data-byte: "Data byte 0B: F0" "Data byte: F0" "Byte: F0" "DB: F0" "F0"
315636-327133 eeprom24xx: data-byte: "Data byte 0C: 07" "Data byte: 07" "Byte: 07" "DB: 07" "07"
329064-340568 eeprom24xx: data-byte: "Data byte 0D: D0" "Data byte: D0" "Byte: D0" "DB: D0" "D0"
342061-353562 eeprom24xx: data-byte: "Data byte 0E: 07" "Data byte: 07" "Byte: 07" "DB: 07" "07"
355273-366784 eeprom24xx: data-byte: "Data byte 0F: EC" "Data byte: EC" "Byte: EC" "DB: EC" "EC"
368520-379501 eeprom24xx: data-byte: "Data byte 10: 07" "Data byte: 07" "Byte: 07" "DB: 07" "07"
381718-393219 eeprom24xx: data-byte: "Data byte 11: EE" "Data byte: EE" "Byte: EE" "DB: EE" "EE"
394701-406199 eeprom24xx: data-byte: "Data byte 12: 09" "Data byte: 09" "Byte: 09" "DB: 09" "09"
408165-419153 eeprom24xx: data-byte: "Data byte 13: C4" "Data byte: C4" "Byte: C4" "DB: C4" "C4"
421105-432832 eeprom24xx: data-byte: "Data byte 14: 09" "Data byte: 09" "Byte: 09" "DB: 09" "09"
434207-445698 eeprom24xx: data-byte: "Data byte 15: C4" "Data byte: C4" "Byte: C4" "DB: C4" "C4"
447418-458405 eeprom24xx: data-byte: "Data byte 16: 05" "Data byte: 05" "Byte: 05" "DB: 05" "05"
460606-472103 eeprom24xx: data-byte: "Data byte 17: E3" "Data byte: E3" "Byte: E3" "DB: E3" "E3"
473590-485508 eeprom24xx: data-byte: "Data byte 18: 05" "Data byte: 05" "Byte: 05" "DB: 05" "05"
487018-498000 eeprom24xx: data-byte: "Data byte 19: E8" "Data byte: E8" "Byte: E8" "DB: E8" "E8"
499993-511922 eeprom24xx: data-byte: "Data byte 1A: 0B" "Data byte: 0B" "Byte: 0B" "DB: 0B" "0B"
513194-524671 eeprom24xx: data-byte: "Data byte 1B: B8" "Data byte: B8" "Byte: B8" "DB: B8" "B8"
526163-537872 eeprom24xx: data-byte: "Data byte 1C: 0B" "Data byte: 0B" "Byte: 0B" "DB: 0B" "0B"
539635-551120 eeprom24xx: data-byte: "Data byte 1D: B8" "Data byte: B8" "Byte: B8" "DB: B8" "B8"
552604-564346 eeprom24xx: data-byte: "Data byte 1E: 07" "Data byte: 07" "Byte: 07" "DB: 07" "07"
565715-576933 eeprom24xx: data-byte: "Data byte 1F: 08" "Data byte: 08" "Byte: 08" "DB: 08" "08"
578927-590845 eeprom24xx: data-byte: "Data byte 20: 07" "Data byte: 07" "Byte: 07" "DB: 07" "07"
592120-603618 eeprom24xx: data-byte: "Data byte 21: 08" "Data byte: 08" "Byte: 08" "DB: 08" "08"
605092-617058 eeprom24xx: data-byte: "Data byte 22: 0B" "Data byte: 0B" "Byte: 0B" "DB: 0B" "0B"
618557-629548 eeprom24xx: data-byte: "Data byte 23: B8" "Data byte: B8" "Byte: B8" "DB: B8" "B8"
631549-643470 eeprom24xx: data-byte: "Data byte 24: 0B" "Data byte: 0B" "Byte: 0B" "DB: 0B" "0B"
644734-656244 eeprom24xx: data-byte: "Data byte 25: B8" "Data byte: B8" "Byte: B8" "DB: B8" "B8"
657979-669212 eeprom24xx: data-byte: "Data byte 26: 07" "Data byte: 07" "Byte: 07" "DB: 07" "07"
671074-682522 eeprom24xx: data-byte: "Data byte 27: 08" "Data byte: 08" "Byte: 08" "DB: 08" "08"
684018-696594 eeprom24xx: data-byte: "Data byte 28: 07" "Data byte: 07" "Byte: 07" "DB: 07" "07"
697766-709259 eeprom24xx: data-byte: "Data byte 29: 08" "Data byte: 08" "Byte: 08" "DB: 08" "08"
710760-722715 eeprom24xx: data-byte: "Data byte 2A: 0B" "Data byte: 0B" "Byte: 0B" "DB: 0B" "0B"
723976-735232 eeprom24xx: data-byte: "Data byte 2B: B8" "Data byte: B8" "Byte: B8" "DB: B8" "B8"
737227-748947 eeprom24xx: data-byte: "Data byte 2C: 0B" "Data byte: 0B" "Byte: 0B" "DB: 0B" "0B"
750429-761929 eeprom24xx: data-byte: "Data byte 2D: B8" "Data byte: B8" "Byte: B8" "DB: B8" "B8"
763402-774842 eeprom24xx: data-byte: "Data byte 2E: 07" "Data byte: 07" "Byte: 07" "DB: 07" "07"
776835-787781 eeprom24xx: data-byte: "Data byte 2F: 08" "Data byte: 08" "Byte: 08" "DB: 08" "08"
789770-801407 eeprom24xx: data-byte: "Data byte 30: 07" "Data byte: 07" "Byte: 07" "DB: 07" "07"
802891-814392 eeprom24xx: data-byte: "Data byte 31: 08" "Data byte: 08" "Byte: 08" "DB: 08" "08"
816106-827308 eeprom24xx: data-byte: "Data byte 32: 09" "Data byte: 09" "Byte: 09" "DB: 09" "09"
829297-840792 eeprom24xx: data-byte: "Data byte 33: C4" "Data byte: C4" "Byte: C4" "DB: C4" "C4"
842280-854011 eeprom24xx: data-byte: "Data byte 34: 09" "Data byte: 09" "Byte: 09" "DB: 09" "09"
855724-866699 eeprom24xx: data-byte: "Data byte 35: C4" "Data byte: C4" "Byte: C4" "DB: C4" "C4"
868694-880407 eeprom24xx: data-byte: "Data byte 36: 05" "Data byte: 05" "Byte: 05" "DB: 05" "05"
881896-893336 eeprom24xx: data-byte: "Data byte 37: ED" "Data byte: ED" "Byte: ED" "DB: ED" "ED"
894830-906308 eeprom24xx: data-byte: "Data byte 38: 05" "Data byte: 05" "Byte: 05" "DB: 05" "05"
908299-919790 eeprom24xx: data-byte: "Data byte 39: EF" "Data byte: EF" "Byte: EF" "DB: EF" "EF"
921275-932885 eeprom24xx: data-byte: "Data byte 3A: 0B" "Data byte: 0B" "Byte: 0B" "DB: 0B" "0B"
934378-945626 eeprom24xx: data-byte: "Data byte 3B: B8" "Data byte: B8" "Byte: B8" "DB: B8" "B8"
947623-959337 eeprom24xx: data-byte: "Data byte 3C: 0B" "Data byte: 0B" "Byte: 0B" "DB: 0B" "0B"
960823-972325 eeprom24xx: data-byte: "Data byte 3D: B8" "Data byte: B8" "Byte: B8" "DB: B8" "B8"
973798-985256 eeprom24xx: data-byte: "Data byte 3E: 07" "Data byte: 07" "Byte: 07" "DB: 07" "07"
987238-998235 eeprom24xx: data-byte: "Data byte 3F: 08" "Data byte: 08" "Byte: 08" "DB: 08" "08"
1000238-1011965 eeprom24xx: data-byte: "Data byte 40: 07" "Data byte: 07" "Byte: 07" "DB: 07" "07"
1013404-1024901 eeprom24xx: data-byte: "Data byte 41: 08" "Data byte: 08" "Byte: 08" "DB: 08" "08"
1026637-1037758 eeprom24xx: data-byte: "Data byte 42: 0B" "Data byte: 0B" "Byte: 0B" "DB: 0B" "0B"
1039750-1051231 eeprom24xx: data-byte: "Data byte 43: B8" "Data byte: B8" "Byte: B8" "DB: B8" "B8"
1052728-1063622 eeprom24xx: data-byte: "Data byte 44: 08" "Data byte: 08" "Byte: 08" "DB: 08" "08"
1065099-1075046 eeprom24xx: data-byte: "Data byte 45: CA" "Data byte: CA" "Byte: CA" "DB: CA" "CA"
1076528-1086475 eeprom24xx: data-byte: "Data byte 46: 07" "Data byte: 07" "Byte: 07" "DB: 07" "07"
1088177-1098122 eeprom24xx: data-byte: "Data byte 47: 08" "Data byte: 08" "Byte: 08" "DB: 08" "08"
1099601-1109544 eeprom24xx: data-byte: "Data byte 48: 04" "Data byte: 04" "Byte: 04" "DB: 04" "04"
1111025-1121198 eeprom24xx: data-byte: "Data byte 49: E2" "Data byte: E2" "Byte: E2" "DB: E2" "E2"
1122682-1132624 eeprom24xx: data-byte: "Data byte 4A: 0B" "Data byte: 0B" "Byte: 0B" "DB: 0B" "0B"
1134106-1144288 eeprom24xx: data-byte: "Data byte 4B: B8" "Data byte: B8" "Byte: B8" "DB: B8" "B8"
1145771-1155714 eeprom24xx: data-byte: "Data byte 4C: 08" "Data byte: 08" "Byte: 08" "DB: 08" "08"
1157196-1167387 eeprom24xx: data-byte: "Data byte 4D: CA" "Data byte: CA" "Byte: CA" "DB: CA" "CA"
1168749-1178691 eeprom24xx: data-byte: "Data byte 4E: 07" "Data byte: 07" "Byte: 07" "DB: 07" "07"
1180173-1190117 eeprom24xx: data-byte: "Data byte 4F: 08" "Data byte: 08" "Byte: 08" "DB: 08" "08"
1191824-1201776 eeprom24xx: data-byte: "Data byte 50: 04" "Data byte: 04" "Byte: 04" "DB: 04" "04"
1203259-1213207 eeprom24xx: data-byte: "Data byte 51: E2" "Data byte: E2" "Byte: E2" "DB: E2" "E2"
1214685-1224862 eeprom24xx: data-byte: "Data byte 52: 0B" "Data byte: 0B" "Byte: 0B" "DB: 0B" "0B"
1226339-1236284 eeprom24xx: data-byte: "Data byte 53: B8" "Data byte: B8" "Byte: B8" "DB: B8" "B8"
1237766-1247940 eeprom24xx: data-byte: "Data byte 54: 08" "Data byte: 08" "Byte: 08" "DB: 08" "08"
1249418-1259365 eeprom24xx: data-byte: "Data byte 55: CA" "Data byte: CA" "Byte: CA" "DB: CA" "CA"
1260843-1270790 eeprom24xx: data-byte: "Data byte 56: 07" "Data byte: 07" "Byte: 07" "DB: 07" "07"
1272500-1282445 eeprom24xx: data-byte: "Data byte 57: 08" "Data byte: 08" "Byte: 08" "DB: 08" "08"
1283926-1293870 eeprom24xx: data-byte: "Data byte 58: 04" "Data byte: 04" "Byte: 04" "DB: 04" "04"
1295351-1305426 eeprom24xx: data-byte: "Data byte 59: E2" "Data byte: E2" "Byte: E2" "DB: E2" "E2"
1306903-1316851 eeprom24xx: data-byte: "Data byte 5A: 0B" "Data byte: 0B" "Byte: 0B" "DB: 0B" "0B"
1318328-1328503 eeprom24xx: data-byte: "Data byte 5B: B8" "Data byte: B8" "Byte: B8" "DB: B8" "B8"
1329986-1339932 eeprom24xx: data-byte: "Data byte 5C: 08" "Data byte: 08" "Byte: 08" "DB: 08" "08"
1341412-1351937 eeprom24xx: data-byte: "Data byte 5D: CA" "Data byte: CA" "Byte: CA" "DB: CA" "CA"
1353414-1363354 eeprom24xx: data-byte: "Data byte 5E: 07" "Data byte: 07" "Byte: 07" "DB: 07" "07"
1364836-1374780 eeprom24xx: data-byte: "Data byte 5F: 08" "Data byte: 08" "Byte: 08" "DB: 08" "08"
1376479-1386422 eeprom24xx: data-byte: "Data byte 60: 04" "Data byte: 04" "Byte: 04" "DB: 04" "04"
1387901-1397848 eeprom24xx: data-byte: "Data byte 61: E2" "Data byte: E2" "Byte: E2" "DB: E2" "E2"
1399326-1409393 eeprom24xx: data-byte: "Data byte 62: 07" "Data byte: 07" "Byte: 07" "DB: 07" "07"
1410875-1420818 eeprom24xx: data-byte: "Data byte 63: D0" "Data byte: D0" "Byte: D0" "DB: D0" "D0"
1422297-1432465 eeprom24xx: data-byte: "Data byte 64: 07" "Data byte: 07" "Byte: 07" "DB: 07" "07"
1433943-1443893 eeprom24xx: data-byte: "Data byte 65: B0" "Data byte: B0" "Byte: B0" "DB: B0" "B0"
1445370-1455771 eeprom24xx: data-byte: "Data byte 66: 07" "Data byte: 07" "Byte: 07" "DB: 07" "07"
1457027-1466977 eeprom24xx: data-byte: "Data byte 67: B0" "Data byte: B0" "Byte: B0" "DB: B0" "B0"
1468455-1478402 eeprom24xx: data-byte: "Data byte 68: 07" "Data byte: 07" "Byte: 07" "DB: 07" "07"
1480113-1490063 eeprom24xx: data-byte: "Data byte 69: D5" "Data byte: D5" "Byte: D5" "DB: D5" "D5"
1491541-1501490 eeprom24xx: data-byte: "Data byte 6A: 07" "Data byte: 07" "Byte: 07" "DB: 07" "07"
1502968-1513139 eeprom24xx: data-byte: "Data byte 6B: D0" "Data byte: D0" "Byte: D0" "DB: D0" "D0"
1514621-1524562 eeprom24xx: data-byte: "Data byte 6C: 07" "Data byte: 07" "Byte: 07" "DB: 07" "07"
1526043-1536115 eeprom24xx: data-byte: "Data byte 6D: C0" "Data byte: C0" "Byte: C0" "DB: C0" "C0"
1537598-1547546 eeprom24xx: data-byte: "Data byte 6E: 07" "Data byte: 07" "Byte: 07" "DB: 07" "07"
1549024-1558976 eeprom24xx: data-byte: "Data byte 6F: BF" "Data byte: BF" "Byte: BF" "DB: BF" "BF"
1560679-1570623 eeprom24xx: data-byte: "Data byte 70: 07" "Data byte: 07" "Byte: 07" "DB: 07" "07"
1572107-1582055 eeprom24xx: data-byte: "Data byte 71: D8" "Data byte: D8" "Byte: D8" "DB: D8" "D8"
1583532-1593711 eeprom24xx: data-byte: "Data byte 72: 07" "Data byte: 07" "Byte: 07" "DB: 07" "07"
1595193-1605136 eeprom24xx: data-byte: "Data byte 73: D0" "Data byte: D0" "Byte: D0" "DB: D0" "D0"
1606619-1616793 eeprom24xx: data-byte: "Data byte 74: 07" "Data byte: 07" "Byte: 07" "DB: 07" "07"
1618274-1628216 eeprom24xx: data-byte: "Data byte 75: C8" "Data byte: C8" "Byte: C8" "DB: C8" "C8"
1629695-1639875 eeprom24xx: data-byte: "Data byte 76: 07" "Data byte: 07" "Byte: 07" "DB: 07" "07"
1641354-1651301 eeprom24xx: data-byte: "Data byte 77: C8" "Data byte: C8" "Byte: C8" "DB: C8" "C8"
1652778-1662725 eeprom24xx: data-byte: "Data byte 78: 07" "Data byte: 07" "Byte: 07" "DB: 07" "07"
1664330-1674277 eeprom24xx: data-byte: "Data byte 79: D9" "Data byte: D9" "Byte: D9" "DB: D9" "D9"
1675757-1685707 eeprom24xx: data-byte: "Data byte 7A: 07" "Data byte: 07" "Byte: 07" "DB: 07" "07"
1687189-1697368 eeprom24xx: data-byte: "Data byte 7B: D0" "Data byte: D0" "Byte: D0" "DB: D0" "D0"
1698845-1708794 eeprom24xx: data-byte: "Data byte 7C: 07" "Data byte: 07" "Byte: 07" "DB: 07" "07"
1710270-1720442 eeprom24xx: data-byte: "Data byte 7D: D0" "Data byte: D0" "Byte: D0" "DB: D0" "D0"
1721923-1731872 eeprom24xx: data-byte: "Data byte 7E: 07" "Data byte: 07" "Byte: 07" "DB: 07" "07"
1733349-1743757 eeprom24xx: data-byte: "Data byte 7F: D3" "Data byte: D3" "Byte: D3" "DB: D3" "D3"
1745014-1754954 eeprom24xx: data-byte: "Data byte 80: 07" "Data byte: 07" "Byte: 07" "DB: 07" "07"
1756436-1766385 eeprom24xx: data-byte: "Data byte 81: D4" "Data byte: D4" "Byte: D4" "DB: D4" "D4"
1767862-1777939 eeprom24xx: data-byte: "Data byte 82: 07" "Data byte: 07" "Byte: 07" "DB: 07" "07"
1779417-1789360 eeprom24xx: data-byte: "Data byte 83: D0" "Data byte: D0" "Byte: D0" "DB: D0" "D0"
1790841-1801014 eeprom24xx: data-byte: "Data byte 84: 07" "Data byte: 07" "Byte: 07" "DB: 07" "07"
1802490-1812434 eeprom24xx: data-byte: "Data byte 85: C7" "Data byte: C7" "Byte: C7" "DB: C7" "C7"
1813918-1824096 eeprom24xx: data-byte: "Data byte 86: 07" "Data byte: 07" "Byte: 07" "DB: 07" "07"
1825572-1835522 eeprom24xx: data-byte: "Data byte 87: CA" "Data byte: CA" "Byte: CA" "DB: CA" "CA"
1837004-1846951 eeprom24xx: data-byte: "Data byte 88: 07" "Data byte: 07" "Byte: 07" "DB: 07" "07"
1848658-1858606 eeprom24xx: data-byte: "Data byte 89: D9" "Data byte: D9" "Byte: D9" "DB: D9" "D9"
1860085-1870034 eeprom24xx: data-byte: "Data byte 8A: 07" "Data byte: 07" "Byte: 07" "DB: 07" "07"
1871514-1881695 eeprom24xx: data-byte: "Data byte 8B: B7" "Data byte: B7" "Byte: B7" "DB: B7" "B7"
1883173-1893120 eeprom24xx: data-byte: "Data byte 8C: 07" "Data byte: 07" "Byte: 07" "DB: 07" "07"
1894602-1904677 eeprom24xx: data-byte: "Data byte 8D: D0" "Data byte: D0" "Byte: D0" "DB: D0" "D0"
1906155-1916100 eeprom24xx: data-byte: "Data byte 8E: 07" "Data byte: 07" "Byte: 07" "DB: 07" "07"
1917583-1927997 eeprom24xx: data-byte: "Data byte 8F: D2" "Data byte: D2" "Byte: D2" "DB: D2" "D2"
1929243-1939190 eeprom24xx: data-byte: "Data byte 90: 07" "Data byte: 07" "Byte: 07" "DB: 07" "07"
1940673-1950621 eeprom24xx: data-byte: "Data byte 91: BF" "Data byte: BF" "Byte: BF" "DB: BF" "BF"
1952330-1962281 eeprom24xx: data-byte: "Data byte 92: 07" "Data byte: 07" "Byte: 07" "DB: 07" "07"
1963761-1973711 eeprom24xx: data-byte: "Data byte 93: D0" "Data byte: D0" "Byte: D0" "DB: D0" "D0"
1975188-1985361 eeprom24xx: data-byte: "Data byte 94: 07" "Data byte: 07" "Byte: 07" "DB: 07" "07"
1986838-1996786 eeprom24xx: data-byte: "Data byte 95: DB" "Data byte: DB" "Byte: DB" "DB: DB" "DB"
1998267-2008785 eeprom24xx: data-byte: "Data byte 96: 07" "Data byte: 07" "Byte: 07" "DB: 07" "07"
2010266-2020215 eeprom24xx: data-byte: "Data byte 97: DD" "Data byte: DD" "Byte: DD" "DB: DD" "DD"
2021698-2031899 eeprom24xx: data-byte: "Data byte 98: 07" "Data byte: 07" "Byte: 07" "DB: 07" "07"
2033250-2043198 eeprom24xx: data-byte: "Data byte 99: D7" "Data byte: D7" "Byte: D7" "DB: D7" "D7"
2044680-2054627 eeprom24xx: data-byte: "Data byte 9A: 07" "Data byte: 07" "Byte: 07" "DB: 07" "07"
2056105-2066283 eeprom24xx: data-byte: "Data byte 9B: D0" "Data byte: D0" "Byte: D0" "DB: D0" "D0"
2067764-2077706 eeprom24xx: data-byte: "Data byte 9C: 07" "Data byte: 07" "Byte: 07" "DB: 07" "07"
2079188-2089357 eeprom24xx: data-byte: "Data byte 9D: D7" "Data byte: D7" "Byte: D7" "DB: D7" "D7"
2090835-2100782 eeprom24xx: data-byte: "Data byte 9E: 07" "Data byte: 07" "Byte: 07" "DB: 07" "07"
2102260-2112440 eeprom24xx: data-byte: "Data byte 9F: DB" "Data byte: DB" "Byte: DB" "DB: DB" "DB"
2113921-2123868 eeprom24xx: data-byte: "Data byte A0: 07" "Data byte: 07" "Byte: 07" "DB: 07" "07"
2125346-2135296 eeprom24xx: data-byte: "Data byte A1: D4" "Data byte: D4" "Byte: D4" "DB: D4" "D4"
2136901-2146848 eeprom24xx: data-byte: "Data byte A2: 07" "Data byte: 07" "Byte: 07" "DB: 07" "07"
2148324-2158274 eeprom24xx: data-byte: "Data byte A3: D0" "Data byte: D0" "Byte: D0" "DB: D0" "D0"
2159756-2169934 eeprom24xx: data-byte: "Data byte A4: 07" "Data byte: 07" "Byte: 07" "DB: 07" "07"
2171413-2181362 eeprom24xx: data-byte: "Data byte A5: D9" "Data byte: D9" "Byte: D9" "DB: D9" "D9"
2182840-2193010 eeprom24xx: data-byte: "Data byte A6: 07" "Data byte: 07" "Byte: 07" "DB: 07" "07"
2194491-2204441 eeprom24xx: data-byte: "Data byte A7: DC" "Data byte: DC" "Byte: DC" "DB: DC" "DC"
2205919-2216332 eeprom24xx: data-byte: "Data byte A8: 07" "Data byte: 07" "Byte: 07" "DB: 07" "07"
2217583-2227531 eeprom24xx: data-byte: "Data byte A9: DA" "Data byte: DA" "Byte: DA" "DB: DA" "DA"
2229009-2238956 eeprom24xx: data-byte: "Data byte AA: 07" "Data byte: 07" "Byte: 07" "DB: 07" "07"
2240665-2250613 eeprom24xx: data-byte: "Data byte AB: D0" "Data byte: D0" "Byte: D0" "DB: D0" "D0"
2252095-2262039 eeprom24xx: data-byte: "Data byte AC: 07" "Data byte: 07" "Byte: 07" "DB: 07" "07"
2263517-2273591 eeprom24xx: data-byte: "Data byte AD: D6" "Data byte: D6" "Byte: D6" "DB: D6" "D6"
2275072-2285019 eeprom24xx: data-byte: "Data byte AE: 07" "Data byte: 07" "Byte: 07" "DB: 07" "07"
2286497-2296677 eeprom24xx: data-byte: "Data byte AF: DB" "Data byte: DB" "Byte: DB" "DB: DB" "DB"
2298158-2308099 eeprom24xx: data-byte: "Data byte B0: 07" "Data byte: 07" "Byte: 07" "DB: 07" "07"
2309581-2319530 eeprom24xx: data-byte: "Data byte B1: D4" "Data byte: D4" "Byte: D4" "DB: D4" "D4"
2321245-2331189 eeprom24xx: data-byte: "Data byte B2: 09" "Data byte: 09" "Byte: 09" "DB: 09" "09"
2332671-2342618 eeprom24xx: data-byte: "Data byte B3: B9" "Data byte: B9" "Byte: B9" "DB: B9" "B9"
2344099-2354275 eeprom24xx: data-byte: "Data byte B4: 09" "Data byte: 09" "Byte: 09" "DB: 09" "09"
2355757-2365700 eeprom24xx: data-byte: "Data byte B5: C4" "Data byte: C4" "Byte: C4" "DB: C4" "C4"
2367181-2377343 eeprom24xx: data-byte: "Data byte B6: 05" "Data byte: 05" "Byte: 05" "DB: 05" "05"
2378824-2388773 eeprom24xx: data-byte: "Data byte B7: E8" "Data byte: E8" "Byte: E8" "DB: E8" "E8"
2390250-2400325 eeprom24xx: data-byte: "Data byte B8: 05" "Data byte: 05" "Byte: 05" "DB: 05" "05"
2401803-2411749 eeprom24xx: data-byte: "Data byte B9: E3" "Data byte: E3" "Byte: E3" "DB: E3" "E3"
2413230-2423173 eeprom24xx: data-byte: "Data byte BA: 09" "Data byte: 09" "Byte: 09" "DB: 09" "09"
2424884-2434829 eeprom24xx: data-byte: "Data byte BB: BA" "Data byte: BA" "Byte: BA" "DB: BA" "BA"
2436310-2446257 eeprom24xx: data-byte: "Data byte BC: 09" "Data byte: 09" "Byte: 09" "DB: 09" "09"
2447734-2457911 eeprom24xx: data-byte: "Data byte BD: C4" "Data byte: C4" "Byte: C4" "DB: C4" "C4"
2459394-2469338 eeprom24xx: data-byte: "Data byte BE: 05" "Data byte: 05" "Byte: 05" "DB: 05" "05"
2470820-2480988 eeprom24xx: data-byte: "Data byte BF: EC" "Data byte: EC" "Byte: EC" "DB: EC" "EC"
2482466-2492414 eeprom24xx: data-byte: "Data byte C0: 05" "Data byte: 05" "Byte: 05" "DB: 05" "05"
2493893-2504097 eeprom24xx: data-byte: "Data byte C1: DE" "Data byte: DE" "Byte: DE" "DB: DE" "DE"
2505447-2515394 eeprom24xx: data-byte: "Data byte C2: 09" "Data byte: 09" "Byte: 09" "DB: 09" "09"
2516876-2526819 eeprom24xx: data-byte: "Data byte C3: B9" "Data byte: B9" "Byte: B9" "DB: B9" "B9"
2528531-2538482 eeprom24xx: data-byte: "Data byte C4: 09" "Data byte: 09" "Byte: 09" "DB: 09" "09"
2539960-2549905 eeprom24xx: data-byte: "Data byte C5: C4" "Data byte: C4" "Byte: C4" "DB: C4" "C4"
2551386-2561548 eeprom24xx: data-byte: "Data byte C6: 05" "Data byte: 05" "Byte: 05" "DB: 05" "05"
2563031-2572976 eeprom24xx: data-byte: "Data byte C7: EC" "Data byte: EC" "Byte: EC" "DB: EC" "EC"
2574455-2584618 eeprom24xx: data-byte: "Data byte C8: 05" "Data byte: 05" "Byte: 05" "DB: 05" "05"
2586099-2596046 eeprom24xx: data-byte: "Data byte C9: E7" "Data byte: E7" "Byte: E7" "DB: E7" "E7"
2597525-2607472 eeprom24xx: data-byte: "Data byte CA: 09" "Data byte: 09" "Byte: 09" "DB: 09" "09"
2609185-2619130 eeprom24xx: data-byte: "Data byte CB: B8" "Data byte: B8" "Byte: B8" "DB: B8" "B8"
2620609-2630557 eeprom24xx: data-byte: "Data byte CC: 09" "Data byte: 09" "Byte: 09" "DB: 09" "09"
2632035-2642113 eeprom24xx: data-byte: "Data byte CD: C4" "Data byte: C4" "Byte: C4" "DB: C4" "C4"
2643590-2653539 eeprom24xx: data-byte: "Data byte CE: 05" "Data byte: 05" "Byte: 05" "DB: 05" "05"
2655015-2665183 eeprom24xx: data-byte: "Data byte CF: ED" "Data byte: ED" "Byte: ED" "DB: ED" "ED"
2666665-2676608 eeprom24xx: data-byte: "Data byte D0: 05" "Data byte: 05" "Byte: 05" "DB: 05" "05"
2678091-2688620 eeprom24xx: data-byte: "Data byte D1: E4" "Data byte: E4" "Byte: E4" "DB: E4" "E4"
2690096-2700037 eeprom24xx: data-byte: "Data byte D2: 00" "Data byte: 00" "Byte: 00" "DB: 00" "00"
2701518-2711461 eeprom24xx: data-byte: "Data byte D3: 00" "Data byte: 00" "Byte: 00" "DB: 00" "00"
2713174-2723121 eeprom24xx: data-byte: "Data byte D4: 19" "Data byte: 19" "Byte: 19" "DB: 19" "19"
2724604-2734550 eeprom24xx: data-byte: "Data byte D5: 50" "Data byte: 50" "Byte: 50" "DB: 50" "50"
2736030-2746205 eeprom24xx: data-byte: "Data byte D6: 00" "Data byte: 00" "Byte: 00" "DB: 00" "00"
2747685-2757629 eeprom24xx: data-byte: "Data byte D7: 00" "Data byte: 00" "Byte: 00" "DB: 00" "00"
2759111-2769178 eeprom24xx: data-byte: "Data byte D8: 2D" "Data byte: 2D" "Byte: 2D" "DB: 2D" "2D"
2770657-2780604 eeprom24xx: data-byte: "Data byte D9: F0" "Data byte: F0" "Byte: F0" "DB: F0" "F0"
2782086-2792491 eeprom24xx: data-byte: "Data byte DA: 00" "Data byte: 00" "Byte: 00" "DB: 00" "00"
2793744-2803692 eeprom24xx: data-byte: "Data byte DB: 00" "Data byte: 00" "Byte: 00" "DB: 00" "00"
2805170-2815115 eeprom24xx: data-byte: "Data byte DC: 29" "Data byte: 29" "Byte: 29" "DB: 29" "29"
2816823-2826771 eeprom24xx: data-byte: "Data byte DD: 90" "Data byte: 90" "Byte: 90" "DB: 90" "90"
2828249-2838196 eeprom24xx: data-byte: "Data byte DE: 00" "Data byte: 00" "Byte: 00" "DB: 00" "00"
2839674-2849852 eeprom24xx: data-byte: "Data byte DF: 00" "Data byte: 00" "Byte: 00" "DB: 00" "00"
2851331-2861277 eeprom24xx: data-byte: "Data byte E0: 00" "Data byte: 00" "Byte: 00" "DB: 00" "00"
2862757-2872922 eeprom24xx: data-byte: "Data byte E1: 01" "Data byte: 01" "Byte: 01" "DB: 01" "01"
2874400-2884344 eeprom24xx: data-byte: "Data byte E2: 00" "Data byte: 00" "Byte: 00" "DB: 00" "00"
2885825-2895769 eeprom24xx: data-byte: "Data byte E3: 00" "Data byte: 00" "Byte: 00" "DB: 00" "00"
2897378-2907325 eeprom24xx: data-byte: "Data byte E4: 00" "Data byte: 00" "Byte: 00" "DB: 00" "00"
2908803-2918750 eeprom24xx: data-byte: "Data byte E5: 1E" "Data byte: 1E" "Byte: 1E" "DB: 1E" "1E"
2920232-2930408 eeprom24xx: data-byte: "Data byte E6: 39" "Data byte: 39" "Byte: 39" "DB: 39" "39"
2931886-2941832 eeprom24xx: data-byte: "Data byte E7: 03" "Data byte: 03" "Byte: 03" "DB: 03" "03"
2943313-2953484 eeprom24xx: data-byte: "Data byte E8: ED" "Data byte: ED" "Byte: ED" "DB: ED" "ED"
2954969-2964917 eeprom24xx: data-byte: "Data byte E9: 7A" "Data byte: 7A" "Byte: 7A" "DB: 7A" "7A"
2966394-2976566 eeprom24xx: data-byte: "Data byte EA: 2F" "Data byte: 2F" "Byte: 2F" "DB: 2F" "2F"
2978042-2987991 eeprom24xx: data-byte: "Data byte EB: 88" "Data byte: 88" "Byte: 88" "DB: 88" "88"
2989473-2999418 eeprom24xx: data-byte: "Data byte EC: 28" "Data byte: 28" "Byte: 28" "DB: 28" "28"
3001030-3010977 eeprom24xx: data-byte: "Data byte ED: 2C" "Data byte: 2C" "Byte: 2C" "DB: 2C" "2C"
3012459-3022403 eeprom24xx: data-byte: "Data byte EE: 00" "Data byte: 00" "Byte: 00" "DB: 00" "00"
3023880-3034059 eeprom24xx: data-byte: "Data byte EF: 00" "Data byte: 00" "Byte: 00" "DB: 00" "00"
3035541-3045485 eeprom24xx: data-byte: "Data byte F0: 00" "Data byte: 00" "Byte: 00" "DB: 00" "00"
3046967-3057136 eeprom24xx: data-byte: "Data byte F1: 23" "Data byte: 23" "Byte: 23" "DB: 23" "23"
3058613-3068561 eeprom24xx: data-byte: "Data byte F2: 36" "Data byte: 36" "Byte: 36" "DB: 36" "36"
3070040-3080444 eeprom24xx: data-byte: "Data byte F3: 17" "Data byte: 17" "Byte: 17" "DB: 17" "17"
3081702-3091649 eeprom24xx: data-byte: "Data byte F4: 88" "Data byte: 88" "Byte: 88" "DB: 88" "88"
3093125-3103075 eeprom24xx: data-byte: "Data byte F5: D5" "Data byte: D5" "Byte: D5" "DB: D5" "D5"
3104557-3114734 eeprom24xx: data-byte: "Data byte F6: 2F" "Data byte: 2F" "Byte: 2F" "DB: 2F" "2F"
3116212-3126159 eeprom24xx: data-byte: "Data byte F7: 83" "Data byte: 83" "Byte: 83" "DB: 83" "83"
3127638-3137716 eeprom24xx: data-byte: "Data byte F8: 73" "Data byte: 73" "Byte: 73" "DB: 73" "73"
3139193-3149143 eeprom24xx: data-byte: "Data byte F9: 76" "Data byte: 76" "Byte: 76" "DB: 76" "76"
3150624-3160790 eeprom24xx: data-byte: "Data byte FA: 33" "Data byte: 33" "Byte: 33" "DB: 33" "33"
3162272-3172219 eeprom24xx: data-byte: "Data byte FB: EB" "Data byte: EB" "Byte: EB" "DB: EB" "EB"
3173697-3183645 eeprom24xx: data-byte: "Data byte FC: E8" "Data byte: E8" "Byte: E8" "DB: E8" "E8"
3185358-3195302 eeprom24xx: data-byte: "Data byte FD: E0" "Data byte: E0" "Byte: E0" "DB: E0" "E0"
3196784-3206728 eeprom24xx: data-byte: "Data byte FE: 00" "Data byte: 00" "Byte: 00" "DB: 00" "00"
3208205-3218385 eeprom24xx: data-byte: "Data byte FF: 00" "Data byte: 00" "Byte: 00" "DB: 00" "00"
263185-3218385 eeprom24xx: data: "Data" "D"
220638-3220229 eeprom24xx: seq-random-read: "Sequential random read (addr=08, 248 bytes): 14 D7 07 F0 07 D0 07 EC 07 EE 09 C4 09 C4 05 E3 05 E8 0B B8 0B B8 07 08 07 08 0B B8 0B B8 07 08 07 08 0B B8 0B B8 07 08 07 08 09 C4 09 C4 05 ED 05 EF 0B B8 0B B8 07 08 07 08 0B B8 08 CA 07 08 04 E2 0B B8 08 CA 07 08 04 E2 0B B8 08 CA 07 08 04 E2 0B B8 08 CA 07 08 04 E2 07 D0 07 B0 07 B0 07 D5 07 D0 07 C0 07 BF 07 D8 07 D0 07 C8 07 C8 07 D9 07 D0 07 D0 07 D3 07 D4 07 D0 07 C7 07 CA 07 D9 07 B7 07 D0 07 D2 07 BF 07 D0 07 DB 07 DD 07 D7 07 D0 07 D7 07 DB 07 D4 07 D0 07 D9 07 DC 07 DA 07 D0 07 D6 07 DB 07 D4 09 B9 09 C4 05 E8 05 E3 09 BA 09 C4 05 EC 05 DE 09 B9 09 C4 05 EC 05 E7 09 B8 09 C4 05 ED 05 E4 00 00 19 50 00 00 2D F0 00 00 29 90 00 00 00 01 00 00 00 1E 39 03 ED 7A 2F 88 28 2C 00 00 00 23 36 17 88 D5 2F 83 73 76 33 EB E8 E0 00 00" "Sequential random read (addr=08, 248 bytes)" "Sequential random read" "SRR" "S"
3223592-3228023 eeprom24xx: control-code: "Control code bits: 1010" "Control code: 1010" "Ctrl code: 1010" "Ctrl code" "Ctrl" "C"
3228023-3229130 eeprom24xx: address-pin: "Address bit 2: 0" "Addr bit 2" "A2" "A"
3229130-3230238 eeprom24xx: address-pin: "Address bit 1: 0" "Addr bit 1" "A1" "A"
3230238-3231345 eeprom24xx: address-pin: "Address bit 0: 1" "Addr bit 0" "A0" "A"
3231345-3232452 eeprom24xx: rw-bit: "R/W bit: write" "R/W" "RW" "W"
3223592-3232452 eeprom24xx: control-word: "Control word" "Control" "CW" "C"
3248077-3252504 eeprom24xx: control-code: "Control code bits: 1010" "Control code: 1010" "Ctrl code: 1010" "Ctrl code" "Ctrl" "C"
3252504-3253611 eeprom24xx: address-pin: "Address bit 2: 0" "Addr bit 2" "A2" "A"
3253611-3254718 eeprom24xx: address-pin: "Address bit 1: 0" "Addr bit 1" "A1" "A"
3254718-3255826 eeprom24xx: address-pin: "Address bit 0: 1" "Addr bit 0" "A0" "A"
3255826-3256934 eeprom24xx: rw-bit: "R/W bit: read" "R/W" "RW" "R"
3248077-3256934 eeprom24xx: control-word: "Control word" "Control" "CW" "C"
3234806-3243896 eeprom24xx: word-addr-byte: "Word address byte: 00" "Word addr byte: 00" "Addr: 00" "A: 00" "00"
3234806-3243896 eeprom24xx: word-addr: "Word address" "Word addr" "Addr" "A"
3259273-3269347 eeprom24xx: data-byte: "Data byte 00: 00" "Data byte: 00" "Byte: 00" "DB: 00" "00"
3270830-3280779 eeprom24xx: data-byte: "Data byte 01: 22" "Data byte: 22" "Byte: 22" "DB: 22" "22"
3282256-3292437 eeprom24xx: data-byte: "Data byte 02: 39" "Data byte: 39" "Byte: 39" "DB: 39" "39"
3293920-3303861 eeprom24xx: data-byte: "Data byte 03: 05" "Data byte: 05" "Byte: 05" "DB: 05" "05"
3305343-3315292 eeprom24xx: data-byte: "Data byte 04: 85" "Data byte: 85" "Byte: 85" "DB: 85" "85"
3316989-3326937 eeprom24xx: data-byte: "Data byte 05: C4" "Data byte: C4" "Byte: C4" "DB: C4" "C4"
3328414-3338360 eeprom24xx: data-byte: "Data byte 06: 2F" "Data byte: 2F" "Byte: 2F" "DB: 2F" "2F"
3339843-3350360 eeprom24xx: data-byte: "Data byte 07: 6E" "Data byte: 6E" "Byte: 6E" "DB: 6E" "6E"
3351841-3361787 eeprom24xx: data-byte: "Data byte 08: E9" "Data byte: E9" "Byte: E9" "DB: E9" "E9"
3363265-3373334 eeprom24xx: data-byte: "Data byte 09: FB" "Data byte: FB" "Byte: FB" "DB: FB" "FB"
3374813-3384760 eeprom24xx: data-byte: "Data byte 0A: 00" "Data byte: 00" "Byte: 00" "DB: 00" "00"
3386237-3396415 eeprom24xx: data-byte: "Data byte 0B: 00" "Data byte: 00" "Byte: 00" "DB: 00" "00"
3397895-3407841 eeprom24xx: data-byte: "Data byte 0C: 00" "Data byte: 00" "Byte: 00" "DB: 00" "00"
3409321-3419273 eeprom24xx: data-byte: "Data byte 0D: 2B" "Data byte: 2B" "Byte: 2B" "DB: 2B" "2B"
3420984-3430930 eeprom24xx: data-byte: "Data byte 0E: 36" "Data byte: 36" "Byte: 36" "DB: 36" "36"
3432409-3442356 eeprom24xx: data-byte: "Data byte 0F: 1B" "Data byte: 1B" "Byte: 1B" "DB: 1B" "1B"
3443833-3454014 eeprom24xx: data-byte: "Data byte 10: 69" "Data byte: 69" "Byte: 69" "DB: 69" "69"
3455494-3465439 eeprom24xx: data-byte: "Data byte 11: 24" "Data byte: 24" "Byte: 24" "DB: 24" "24"
3466919-3477088 eeprom24xx: data-byte: "Data byte 12: 2F" "Data byte: 2F" "Byte: 2F" "DB: 2F" "2F"
3478565-3488514 eeprom24xx: data-byte: "Data byte 13: 86" "Data byte: 86" "Byte: 86" "DB: 86" "86"
3489992-3500195 eeprom24xx: data-byte: "Data byte 14: B3" "Data byte: B3" "Byte: B3" "DB: B3" "B3"
3501546-3511493 eeprom24xx: data-byte: "Data byte 15: EC" "Data byte: EC" "Byte: EC" "DB: EC" "EC"
3512975-3522920 eeprom24xx: data-byte: "Data byte 16: 34" "Data byte: 34" "Byte: 34" "DB: 34" "34"
3524631-3534581 eeprom24xx: data-byte: "Data byte 17: 00" "Data byte: 00" "Byte: 00" "DB: 00" "00"
3536059-3546004 eeprom24xx: data-byte: "Data byte 18: D7" "Data byte: D7" "Byte: D7" "DB: D7" "D7"
3547487-3557659 eeprom24xx: data-byte: "Data byte 19: 6D" "Data byte: 6D" "Byte: 6D" "DB: 6D" "6D"
3559138-3569085 eeprom24xx: data-byte: "Data byte 1A: 00" "Data byte: 00" "Byte: 00" "DB: 00" "00"
3570563-3580732 eeprom24xx: data-byte: "Data byte 1B: 00" "Data byte: 00" "Byte: 00" "DB: 00" "00"
3582210-3592158 eeprom24xx: data-byte: "Data byte 1C: 02" "Data byte: 02" "Byte: 02" "DB: 02" "02"
3593639-3603585 eeprom24xx: data-byte: "Data byte 1D: 24" "Data byte: 24" "Byte: 24" "DB: 24" "24"
3605296-3615246 eeprom24xx: data-byte: "Data byte 1E: 57" "Data byte: 57" "Byte: 57" "DB: 57" "57"
3616729-3626670 eeprom24xx: data-byte: "Data byte 1F: 00" "Data byte: 00" "Byte: 00" "DB: 00" "00"
3628151-3638225 eeprom24xx: data-byte: "Data byte 20: 00" "Data byte: 00" "Byte: 00" "DB: 00" "00"
3639706-3649652 eeprom24xx: data-byte: "Data byte 21: 00" "Data byte: 00" "Byte: 00" "DB: 00" "00"
3651132-3661297 eeprom24xx: data-byte: "Data byte 22: 02" "Data byte: 02" "Byte: 02" "DB: 02" "02"
3662775-3672719 eeprom24xx: data-byte: "Data byte 23: 24" "Data byte: 24" "Byte: 24" "DB: 24" "24"
3674200-3684381 eeprom24xx: data-byte: "Data byte 24: 00" "Data byte: 00" "Byte: 00" "DB: 00" "00"
3685858-3695799 eeprom24xx: data-byte: "Data byte 25: 00" "Data byte: 00" "Byte: 00" "DB: 00" "00"
3697280-3707224 eeprom24xx: data-byte: "Data byte 26: 02" "Data byte: 02" "Byte: 02" "DB: 02" "02"
3708936-3718883 eeprom24xx: data-byte: "Data byte 27: 24" "Data byte: 24" "Byte: 24" "DB: 24" "24"
3720366-3730312 eeprom24xx: data-byte: "Data byte 28: 3C" "Data byte: 3C" "Byte: 3C" "DB: 3C" "3C"
3731792-3741866 eeprom24xx: data-byte: "Data byte 29: 20" "Data byte: 20" "Byte: 20" "DB: 20" "20"
3743348-3753295 eeprom24xx: data-byte: "Data byte 2A: 71" "Data byte: 71" "Byte: 71" "DB: 71" "71"
3754773-3764940 eeprom24xx: data-byte: "Data byte 2B: 2F" "Data byte: 2F" "Byte: 2F" "DB: 2F" "2F"
3766417-3776364 eeprom24xx: data-byte: "Data byte 2C: 3D" "Data byte: 3D" "Byte: 3D" "DB: 3D" "3D"
3777841-3788249 eeprom24xx: data-byte: "Data byte 2D: C8" "Data byte: C8" "Byte: C8" "DB: C8" "C8"
3789503-3799455 eeprom24xx: data-byte: "Data byte 2E: 9A" "Data byte: 9A" "Byte: 9A" "DB: 9A" "9A"
3800932-3810877 eeprom24xx: data-byte: "Data byte 2F: 7B" "Data byte: 7B" "Byte: 7B" "DB: 7B" "7B"
3812360-3822544 eeprom24xx: data-byte: "Data byte 30: 3F" "Data byte: 3F" "Byte: 3F" "DB: 3F" "3F"
3824021-3833969 eeprom24xx: data-byte: "Data byte 31: 7B" "Data byte: 7B" "Byte: 7B" "DB: 7B" "7B"
3835450-3845626 eeprom24xx: data-byte: "Data byte 32: D4" "Data byte: D4" "Byte: D4" "DB: D4" "D4"
3847104-3857051 eeprom24xx: data-byte: "Data byte 33: 4A" "Data byte: 4A" "Byte: 4A" "DB: 4A" "4A"
3858530-3868601 eeprom24xx: data-byte: "Data byte 34: 0F" "Data byte: 0F" "Byte: 0F" "DB: 0F" "0F"
3870078-3880025 eeprom24xx: data-byte: "Data byte 35: FF" "Data byte: FF" "Byte: FF" "DB: FF" "FF"
3881503-3891450 eeprom24xx: data-byte: "Data byte 36: 0F" "Data byte: 0F" "Byte: 0F" "DB: 0F" "0F"
3893162-3903111 eeprom24xx: data-byte: "Data byte 37: FF" "Data byte: FF" "Byte: FF" "DB: FF" "FF"
3904589-3914538 eeprom24xx: data-byte: "Data byte 38: 0F" "Data byte: 0F" "Byte: 0F" "DB: 0F" "0F"
3916016-3926199 eeprom24xx: data-byte: "Data byte 39: FF" "Data byte: FF" "Byte: FF" "DB: FF" "FF"
3927676-3937622 eeprom24xx: data-byte: "Data byte 3A: 0F" "Data byte: 0F" "Byte: 0F" "DB: 0F" "0F"
3939101-3949267 eeprom24xx: data-byte: "Data byte 3B: FF" "Data byte: FF" "Byte: FF" "DB: FF" "FF"
3950744-3960692 eeprom24xx: data-byte: "Data byte 3C: 0F" "Data byte: 0F" "Byte: 0F" "DB: 0F" "0F"
3962174-3972592 eeprom24xx: data-byte: "Data byte 3D: FF" "Data byte: FF" "Byte: FF" "DB: FF" "FF"
3973836-3983784 eeprom24xx: data-byte: "Data byte 3E: 0F" "Data byte: 0F" "Byte: 0F" "DB: 0F" "0F"
3985266-3995215 eeprom24xx: data-byte: "Data byte 3F: FF" "Data byte: FF" "Byte: FF" "DB: FF" "FF"
3996824-4006769 eeprom24xx: data-byte: "Data byte 40: 0F" "Data byte: 0F" "Byte: 0F" "DB: 0F" "0F"
4008249-4018195 eeprom24xx: data-byte: "Data byte 41: FF" "Data byte: FF" "Byte: FF" "DB: FF" "FF"
4019676-4030197 eeprom24xx: data-byte: "Data byte 42: 0F" "Data byte: 0F" "Byte: 0F" "DB: 0F" "0F"
4031678-4041625 eeprom24xx: data-byte: "Data byte 43: FF" "Data byte: FF" "Byte: FF" "DB: FF" "FF"
4043104-4053270 eeprom24xx: data-byte: "Data byte 44: 0F" "Data byte: 0F" "Byte: 0F" "DB: 0F" "0F"
4054747-4064695 eeprom24xx: data-byte: "Data byte 45: FF" "Data byte: FF" "Byte: FF" "DB: FF" "FF"
4066176-4076581 eeprom24xx: data-byte: "Data byte 46: 0F" "Data byte: 0F" "Byte: 0F" "DB: 0F" "0F"
4077834-4087781 eeprom24xx: data-byte: "Data byte 47: FF" "Data byte: FF" "Byte: FF" "DB: FF" "FF"
4089260-4099205 eeprom24xx: data-byte: "Data byte 48: 0F" "Data byte: 0F" "Byte: 0F" "DB: 0F" "0F"
4100688-4110764 eeprom24xx: data-byte: "Data byte 49: FF" "Data byte: FF" "Byte: FF" "DB: FF" "FF"
4112247-4122194 eeprom24xx: data-byte: "Data byte 4A: 0F" "Data byte: 0F" "Byte: 0F" "DB: 0F" "0F"
4123673-4133854 eeprom24xx: data-byte: "Data byte 4B: FF" "Data byte: FF" "Byte: FF" "DB: FF" "FF"
4135337-4145278 eeprom24xx: data-byte: "Data byte 4C: 0F" "Data byte: 0F" "Byte: 0F" "DB: 0F" "0F"
4146760-4156929 eeprom24xx: data-byte: "Data byte 4D: FF" "Data byte: FF" "Byte: FF" "DB: FF" "FF"
4158406-4168352 eeprom24xx: data-byte: "Data byte 4E: 0F" "Data byte: 0F" "Byte: 0F" "DB: 0F" "0F"
4169831-4179778 eeprom24xx: data-byte: "Data byte 4F: FF" "Data byte: FF" "Byte: FF" "DB: FF" "FF"
4181491-4191440 eeprom24xx: data-byte: "Data byte 50: 0F" "Data byte: 0F" "Byte: 0F" "DB: 0F" "0F"
4192918-4202865 eeprom24xx: data-byte: "Data byte 51: FF" "Data byte: FF" "Byte: FF" "DB: FF" "FF"
4204344-4214522 eeprom24xx: data-byte: "Data byte 52: 0F" "Data byte: 0F" "Byte: 0F" "DB: 0F" "0F"
4216003-4225952 eeprom24xx: data-byte: "Data byte 53: FF" "Data byte: FF" "Byte: FF" "DB: FF" "FF"
4227429-4237501 eeprom24xx: data-byte: "Data byte 54: 0F" "Data byte: 0F" "Byte: 0F" "DB: 0F" "0F"
4238979-4248925 eeprom24xx: data-byte: "Data byte 55: FF" "Data byte: FF" "Byte: FF" "DB: FF" "FF"
4250407-4260810 eeprom24xx: data-byte: "Data byte 56: 0F" "Data byte: 0F" "Byte: 0F" "DB: 0F" "0F"
4262064-4272013 eeprom24xx: data-byte: "Data byte 57: FF" "Data byte: FF" "Byte: FF" "DB: FF" "FF"
4273490-4283436 eeprom24xx: data-byte: "Data byte 58: 0F" "Data byte: 0F" "Byte: 0F" "DB: 0F" "0F"
4285133-4295087 eeprom24xx: data-byte: "Data byte 59: FF" "Data byte: FF" "Byte: FF" "DB: FF" "FF"
4296569-4306516 eeprom24xx: data-byte: "Data byte 5A: 0F" "Data byte: 0F" "Byte: 0F" "DB: 0F" "0F"
4307996-4318178 eeprom24xx: data-byte: "Data byte 5B: FF" "Data byte: FF" "Byte: FF" "DB: FF" "FF"
4319663-4329603 eeprom24xx: data-byte: "Data byte 5C: 0F" "Data byte: 0F" "Byte: 0F" "DB: 0F" "0F"
4331085-4341254 eeprom24xx: data-byte: "Data byte 5D: FF" "Data byte: FF" "Byte: FF" "DB: FF" "FF"
4342732-4352679 eeprom24xx: data-byte: "Data byte 5E: 0F" "Data byte: 0F" "Byte: 0F" "DB: 0F" "0F"
4354157-4364104 eeprom24xx: data-byte: "Data byte 5F: FF" "Data byte: FF" "Byte: FF" "DB: FF" "FF"
4365712-4375661 eeprom24xx: data-byte: "Data byte 60: 0F" "Data byte: 0F" "Byte: 0F" "DB: 0F" "0F"
4377139-4387084 eeprom24xx: data-byte: "Data byte 61: FF" "Data byte: FF" "Byte: FF" "DB: FF" "FF"
4388567-4398746 eeprom24xx: data-byte: "Data byte 62: 0F" "Data byte: 0F" "Byte: 0F" "DB: 0F" "0F"
4400224-4410171 eeprom24xx: data-byte: "Data byte 63: FF" "Data byte: FF" "Byte: FF" "DB: FF" "FF"
4411653-4421831 eeprom24xx: data-byte: "Data byte 64: 0F" "Data byte: 0F" "Byte: 0F" "DB: 0F" "0F"
4423310-4433259 eeprom24xx: data-byte: "Data byte 65: FF" "Data byte: FF" "Byte: FF" "DB: FF" "FF"
4434737-4444912 eeprom24xx: data-byte: "Data byte 66: 0F" "Data byte: 0F" "Byte: 0F" "DB: 0F" "0F"
4446390-4456338 eeprom24xx: data-byte: "Data byte 67: FF" "Data byte: FF" "Byte: FF" "DB: FF" "FF"
4457815-4467763 eeprom24xx: data-byte: "Data byte 68: 0F" "Data byte: 0F" "Byte: 0F" "DB: 0F" "0F"
4469371-4479318 eeprom24xx: data-byte: "Data byte 69: FF" "Data byte: FF" "Byte: FF" "DB: FF" "FF"
4480796-4490743 eeprom24xx: data-byte: "Data byte 6A: 0F" "Data byte: 0F" "Byte: 0F" "DB: 0F" "0F"
4492223-4502405 eeprom24xx: data-byte: "Data byte 6B: FF" "Data byte: FF" "Byte: FF" "DB: FF" "FF"
4503883-4513830 eeprom24xx: data-byte: "Data byte 6C: 0F" "Data byte: 0F" "Byte: 0F" "DB: 0F" "0F"
4515308-4525484 eeprom24xx: data-byte: "Data byte 6D: FF" "Data byte: FF" "Byte: FF" "DB: FF" "FF"
4526966-4536912 eeprom24xx: data-byte: "Data byte 6E: 0F" "Data byte: 0F" "Byte: 0F" "DB: 0F" "0F"
4538391-4548801 eeprom24xx: data-byte: "Data byte 6F: FF" "Data byte: FF" "Byte: FF" "DB: FF" "FF"
4550055-4559996 eeprom24xx: data-byte: "Data byte 70: 0F" "Data byte: 0F" "Byte: 0F" "DB: 0F" "0F"
4561478-4571428 eeprom24xx: data-byte: "Data byte 71: FF" "Data byte: FF" "Byte: FF" "DB: FF" "FF"
4573133-4583083 eeprom24xx: data-byte: "Data byte 72: 0F" "Data byte: 0F" "Byte: 0F" "DB: 0F" "0F"
4584564-4594514 eeprom24xx: data-byte: "Data byte 73: FF" "Data byte: FF" "Byte: FF" "DB: FF" "FF"
4595992-4606071 eeprom24xx: data-byte: "Data byte 74: 0F" "Data byte: 0F" "Byte: 0F" "DB: 0F" "0F"
4607548-4617494 eeprom24xx: data-byte: "Data byte 75: FF" "Data byte: FF" "Byte: FF" "DB: FF" "FF"
4618973-4629152 eeprom24xx: data-byte: "Data byte 76: 0F" "Data byte: 0F" "Byte: 0F" "DB: 0F" "0F"
4630631-4640582 eeprom24xx: data-byte: "Data byte 77: FF" "Data byte: FF" "Byte: FF" "DB: FF" "FF"
4642060-4652007 eeprom24xx: data-byte: "Data byte 78: 0F" "Data byte: 0F" "Byte: 0F" "DB: 0F" "0F"
4653721-4663669 eeprom24xx: data-byte: "Data byte 79: FF" "Data byte: FF" "Byte: FF" "DB: FF" "FF"
4665146-4675094 eeprom24xx: data-byte: "Data byte 7A: 0F" "Data byte: 0F" "Byte: 0F" "DB: 0F" "0F"
4676571-4687091 eeprom24xx: data-byte: "Data byte 7B: FF" "Data byte: FF" "Byte: FF" "DB: FF" "FF"
4688571-4698517 eeprom24xx: data-byte: "Data byte 7C: 0F" "Data byte: 0F" "Byte: 0F" "DB: 0F" "0F"
4699999-4710181 eeprom24xx: data-byte: "Data byte 7D: FF" "Data byte: FF" "Byte: FF" "DB: FF" "FF"
4711662-4721609 eeprom24xx: data-byte: "Data byte 7E: 0F" "Data byte: 0F" "Byte: 0F" "DB: 0F" "0F"
4723086-4733159 eeprom24xx: data-byte: "Data byte 7F: FF" "Data byte: FF" "Byte: FF" "DB: FF" "FF"
4734638-4744586 eeprom24xx: data-byte: "Data byte 80: 0F" "Data byte: 0F" "Byte: 0F" "DB: 0F" "0F"
4746066-4756016 eeprom24xx: data-byte: "Data byte 81: FF" "Data byte: FF" "Byte: FF" "DB: FF" "FF"
4757718-4767660 eeprom24xx: data-byte: "Data byte 82: 0F" "Data byte: 0F" "Byte: 0F" "DB: 0F" "0F"
4769142-4779090 eeprom24xx: data-byte: "Data byte 83: FF" "Data byte: FF" "Byte: FF" "DB: FF" "FF"
4780568-4790746 eeprom24xx: data-byte: "Data byte 84: 0F" "Data byte: 0F" "Byte: 0F" "DB: 0F" "0F"
4792228-4802175 eeprom24xx: data-byte: "Data byte 85: FF" "Data byte: FF" "Byte: FF" "DB: FF" "FF"
4803655-4813839 eeprom24xx: data-byte: "Data byte 86: 0F" "Data byte: 0F" "Byte: 0F" "DB: 0F" "0F"
4815322-4825270 eeprom24xx: data-byte: "Data byte 87: FF" "Data byte: FF" "Byte: FF" "DB: FF" "FF"
4826747-4836949 eeprom24xx: data-byte: "Data byte 88: 0F" "Data byte: 0F" "Byte: 0F" "DB: 0F" "0F"
4838303-4848250 eeprom24xx: data-byte: "Data byte 89: FF" "Data byte: FF" "Byte: FF" "DB: FF" "FF"
4849728-4859675 eeprom24xx: data-byte: "Data byte 8A: 0F" "Data byte: 0F" "Byte: 0F" "DB: 0F" "0F"
4861376-4871324 eeprom24xx: data-byte: "Data byte 8B: FF" "Data byte: FF" "Byte: FF" "DB: FF" "FF"
4872807-4882748 eeprom24xx: data-byte: "Data byte 8C: 0F" "Data byte: 0F" "Byte: 0F" "DB: 0F" "0F"
4884230-4894412 eeprom24xx: data-byte: "Data byte 8D: FF" "Data byte: FF" "Byte: FF" "DB: FF" "FF"
4895894-4905841 eeprom24xx: data-byte: "Data byte 8E: 0F" "Data byte: 0F" "Byte: 0F" "DB: 0F" "0F"
4907320-4917503 eeprom24xx: data-byte: "Data byte 8F: FF" "Data byte: FF" "Byte: FF" "DB: FF" "FF"
4918986-4928928 eeprom24xx: data-byte: "Data byte 90: 0F" "Data byte: 0F" "Byte: 0F" "DB: 0F" "0F"
4930410-4940360 eeprom24xx: data-byte: "Data byte 91: FF" "Data byte: FF" "Byte: FF" "DB: FF" "FF"
4942071-4952018 eeprom24xx: data-byte: "Data byte 92: 0F" "Data byte: 0F" "Byte: 0F" "DB: 0F" "0F"
4953499-4963446 eeprom24xx: data-byte: "Data byte 93: FF" "Data byte: FF" "Byte: FF" "DB: FF" "FF"
4964924-4974998 eeprom24xx: data-byte: "Data byte 94: 0F" "Data byte: 0F" "Byte: 0F" "DB: 0F" "0F"
4976479-4986426 eeprom24xx: data-byte: "Data byte 95: FF" "Data byte: FF" "Byte: FF" "DB: FF" "FF"
4987905-4998082 eeprom24xx: data-byte: "Data byte 96: 0F" "Data byte: 0F" "Byte: 0F" "DB: 0F" "0F"
4999563-5009514 eeprom24xx: data-byte: "Data byte 97: FF" "Data byte: FF" "Byte: FF" "DB: FF" "FF"
5010992-5021166 eeprom24xx: data-byte: "Data byte 98: 0F" "Data byte: 0F" "Byte: 0F" "DB: 0F" "0F"
5022640-5032588 eeprom24xx: data-byte: "Data byte 99: FF" "Data byte: FF" "Byte: FF" "DB: FF" "FF"
5034071-5044012 eeprom24xx: data-byte: "Data byte 9A: 0F" "Data byte: 0F" "Byte: 0F" "DB: 0F" "0F"
5045730-5055678 eeprom24xx: data-byte: "Data byte 9B: FF" "Data byte: FF" "Byte: FF" "DB: FF" "FF"
5057161-5067109 eeprom24xx: data-byte: "Data byte 9C: 3F" "Data byte: 3F" "Byte: 3F" "DB: 3F" "3F"
5068587-5078762 eeprom24xx: data-byte: "Data byte 9D: 00" "Data byte: 00" "Byte: 00" "DB: 00" "00"
5080241-5090186 eeprom24xx: data-byte: "Data byte 9E: 31" "Data byte: 31" "Byte: 31" "DB: 31" "31"
5091669-5101735 eeprom24xx: data-byte: "Data byte 9F: CF" "Data byte: CF" "Byte: CF" "DB: CF" "CF"
5103214-5113161 eeprom24xx: data-byte: "Data byte A0: 00" "Data byte: 00" "Byte: 00" "DB: 00" "00"
5114643-5125020 eeprom24xx: data-byte: "Data byte A1: 00" "Data byte: 00" "Byte: 00" "DB: 00" "00"
5126290-5136236 eeprom24xx: data-byte: "Data byte A2: 00" "Data byte: 00" "Byte: 00" "DB: 00" "00"
5137716-5147659 eeprom24xx: data-byte: "Data byte A3: 00" "Data byte: 00" "Byte: 00" "DB: 00" "00"
5149140-5159315 eeprom24xx: data-byte: "Data byte A4: 44" "Data byte: 44" "Byte: 44" "DB: 44" "44"
5160797-5170742 eeprom24xx: data-byte: "Data byte A5: C6" "Data byte: C6" "Byte: C6" "DB: C6" "C6"
5172222-5182403 eeprom24xx: data-byte: "Data byte A6: 43" "Data byte: 43" "Byte: 43" "DB: 43" "43"
5183885-5193833 eeprom24xx: data-byte: "Data byte A7: D7" "Data byte: D7" "Byte: D7" "DB: D7" "D7"
5195311-5205476 eeprom24xx: data-byte: "Data byte A8: 00" "Data byte: 00" "Byte: 00" "DB: 00" "00"
5206957-5216901 eeprom24xx: data-byte: "Data byte A9: 00" "Data byte: 00" "Byte: 00" "DB: 00" "00"
5218382-5228333 eeprom24xx: data-byte: "Data byte AA: 0C" "Data byte: 0C" "Byte: 0C" "DB: 0C" "0C"
5229939-5239888 eeprom24xx: data-byte: "Data byte AB: 80" "Data byte: 80" "Byte: 80" "DB: 80" "80"
5241370-5251315 eeprom24xx: data-byte: "Data byte AC: 31" "Data byte: 31" "Byte: 31" "DB: 31" "31"
5252797-5262973 eeprom24xx: data-byte: "Data byte AD: 69" "Data byte: 69" "Byte: 69" "DB: 69" "69"
5264452-5274399 eeprom24xx: data-byte: "Data byte AE: A5" "Data byte: A5" "Byte: A5" "DB: A5" "A5"
5275881-5286062 eeprom24xx: data-byte: "Data byte AF: 6F" "Data byte: 6F" "Byte: 6F" "DB: 6F" "6F"
5287539-5297485 eeprom24xx: data-byte: "Data byte B0: 00" "Data byte: 00" "Byte: 00" "DB: 00" "00"
5298968-5309367 eeprom24xx: data-byte: "Data byte B1: 00" "Data byte: 00" "Byte: 00" "DB: 00" "00"
5310620-5320567 eeprom24xx: data-byte: "Data byte B2: 00" "Data byte: 00" "Byte: 00" "DB: 00" "00"
5322047-5331993 eeprom24xx: data-byte: "Data byte B3: 00" "Data byte: 00" "Byte: 00" "DB: 00" "00"
5333597-5343546 eeprom24xx: data-byte: "Data byte B4: 00" "Data byte: 00" "Byte: 00" "DB: 00" "00"
5345022-5354970 eeprom24xx: data-byte: "Data byte B5: 00" "Data byte: 00" "Byte: 00" "DB: 00" "00"
5356447-5366961 eeprom24xx: data-byte: "Data byte B6: 00" "Data byte: 00" "Byte: 00" "DB: 00" "00"
5368442-5378386 eeprom24xx: data-byte: "Data byte B7: 00" "Data byte: 00" "Byte: 00" "DB: 00" "00"
5379864-5390043 eeprom24xx: data-byte: "Data byte B8: 00" "Data byte: 00" "Byte: 00" "DB: 00" "00"
5391527-5401469 eeprom24xx: data-byte: "Data byte B9: 00" "Data byte: 00" "Byte: 00" "DB: 00" "00"
5402951-5413339 eeprom24xx: data-byte: "Data byte BA: 00" "Data byte: 00" "Byte: 00" "DB: 00" "00"
5414601-5424549 eeprom24xx: data-byte: "Data byte BB: 00" "Data byte: 00" "Byte: 00" "DB: 00" "00"
5426026-5435974 eeprom24xx: data-byte: "Data byte BC: FF" "Data byte: FF" "Byte: FF" "DB: FF" "FF"
5437455-5447623 eeprom24xx: data-byte: "Data byte BD: FF" "Data byte: FF" "Byte: FF" "DB: FF" "FF"
5449103-5459049 eeprom24xx: data-byte: "Data byte BE: FF" "Data byte: FF" "Byte: FF" "DB: FF" "FF"
5460531-5470609 eeprom24xx: data-byte: "Data byte BF: A6" "Data byte: A6" "Byte: A6" "DB: A6" "A6"
5472087-5482036 eeprom24xx: data-byte: "Data byte C0: 00" "Data byte: 00" "Byte: 00" "DB: 00" "00"
5483512-5493689 eeprom24xx: data-byte: "Data byte C1: 00" "Data byte: 00" "Byte: 00" "DB: 00" "00"
5495170-5505113 eeprom24xx: data-byte: "Data byte C2: 01" "Data byte: 01" "Byte: 01" "DB: 01" "01"
5506592-5516544 eeprom24xx: data-byte: "Data byte C3: BA" "Data byte: BA" "Byte: BA" "DB: BA" "BA"
3259273-5516544 eeprom24xx: data: "Data" "D"
3222113-5518600 eeprom24xx: seq-random-read: "Sequential random read (addr=00, 196 bytes): 00 22 39 05 85 C4 2F 6E E9 FB 00 00 00 2B 36 1B 69 24 2F 86 B3 EC 34 00 D7 6D 00 00 02 24 57 00 00 00 02 24 00 00 02 24 3C 20 71 2F 3D C8 9A 7B 3F 7B D4 4A 0F FF 0F FF 0F FF 0F FF 0F FF 0F FF 0F FF 0F FF 0F FF 0F FF 0F FF 0F FF 0F FF 0F FF 0F FF 0F FF 0F FF 0F FF 0F FF 0F FF 0F FF 0F FF 0F FF 0F FF 0F FF 0F FF 0F FF 0F FF 0F FF 0F FF 0F FF 0F FF 0F FF 0F FF 0F FF 0F FF 0F FF 0F FF 0F FF 0F FF 0F FF 0F FF 0F FF 0F FF 0F FF 0F FF 0F FF 0F FF 0F FF 0F FF 0F FF 0F FF 3F 00 31 CF 00 00 00 00 44 C6 43 D7 00 00 0C 80 31 69 A5 6F 00 00 00 00 00 00 00 00 00 00 00 00 FF FF FF A6 00 00 01 BA" "Sequential random read (addr=00, 196 bytes)" "Sequential random read" "SRR" "S"
