0-238 swd: reset: "LINERESET"
320-577 swd: reset: "LINERESET"
6281-6518 swd: reset: "LINERESET"
6518-6614 swd: enable: "JTAG->SWD"
6621-6858 swd: reset: "LINERESET"
6874-6919 swd: read: "IDCODE"
6932-6943 swd: ack: "OK"
6952-7141 swd: data: "0x0bb11477"
7174-7220 swd: read: "R CTRL/STAT"
7233-7244 swd: ack: "OK"
7253-7435 swd: data: "0xf0000040"
7468-7514 swd: write: "W CTRL/STAT"
7526-7538 swd: ack: "OK"
7558-7764 swd: data: "0x50000000"
7784-7830 swd: read: "R CTRL/STAT"
7842-7854 swd: ack: "OK"
7862-8044 swd: data: "0xf0000040"
8081-8126 swd: write: "W SELECT"
8139-8150 swd: ack: "OK"
8170-8377 swd: data: "0x000000f0"
8399-8445 swd: read: "W APc"
8458-8469 swd: ack: "OK"
8478-8657 swd: data: "0x00000000"
8688-8735 swd: read: "W AP8"
8747-8759 swd: ack: "OK"
8768-8952 swd: data: "0x04770021"
8984-9030 swd: read: "RDBUFF"
9043-9054 swd: ack: "OK"
9063-9246 swd: data: "0xf0000003"
13512-13558 swd: write: "W SELECT"
13570-13582 swd: ack: "OK"
13602-13809 swd: data: "0x00000000"
13830-13876 swd: write: "W AP0"
13888-13900 swd: ack: "OK"
13920-14126 swd: data: "0x23000002"
14161-14207 swd: write: "W AP4"
14220-14231 swd: ack: "OK"
14251-14458 swd: data: "0xe000ed00"
14477-14524 swd: read: "W APc"
14536-14548 swd: ack: "OK"
14556-14735 swd: data: "0x00000000"
14767-14813 swd: read: "RDBUFF"
14826-14837 swd: ack: "OK"
14846-15029 swd: data: "0x410cc200"
21922-21968 swd: write: "W AP4"
21980-21992 swd: ack: "OK"
22012-22218 swd: data: "0xe000ed00"
22238-22284 swd: read: "W APc"
22297-22308 swd: ack: "OK"
22317-22496 swd: data: "0x00000000"
22528-22574 swd: read: "RDBUFF"
22586-22598 swd: ack: "OK"
22606-22790 swd: data: "0x410cc200"
26424-26470 swd: write: "W AP4"
26482-26494 swd: ack: "OK"
26514-26721 swd: data: "0xe0002000"
26741-26787 swd: read: "W APc"
26799-26811 swd: ack: "OK"
26819-26998 swd: data: "0x00000000"
27030-27076 swd: read: "RDBUFF"
27089-27100 swd: ack: "OK"
27109-27288 swd: data: "0x00000040"
31278-31323 swd: write: "W AP4"
31336-31347 swd: ack: "OK"
31368-31574 swd: data: "0xe0002008"
31593-31639 swd: write: "W APc"
31651-31663 swd: ack: "OK"
31683-31889 swd: data: "0x00000000"
31918-31964 swd: read: "R CTRL/STAT"
31977-31988 swd: ack: "OK"
31997-32179 swd: data: "0xf0000040"
35296-35342 swd: write: "W AP4"
35355-35366 swd: ack: "OK"
35386-35593 swd: data: "0xe000200c"
35612-35658 swd: write: "W APc"
35670-35682 swd: ack: "OK"
35702-35908 swd: data: "0x00000000"
35937-35983 swd: read: "R CTRL/STAT"
35996-36007 swd: ack: "OK"
36015-36198 swd: data: "0xf0000040"
39405-39451 swd: write: "W AP4"
39463-39475 swd: ack: "OK"
39495-39701 swd: data: "0xe0002010"
39720-39766 swd: write: "W APc"
39779-39790 swd: ack: "OK"
39810-40017 swd: data: "0x00000000"
40046-40092 swd: read: "R CTRL/STAT"
40104-40115 swd: ack: "OK"
40124-40306 swd: data: "0xf0000040"
43267-43312 swd: write: "W AP4"
43325-43336 swd: ack: "OK"
43357-43563 swd: data: "0xe0002014"
43582-43628 swd: write: "W APc"
43640-43652 swd: ack: "OK"
43672-43879 swd: data: "0x00000000"
43908-43953 swd: read: "R CTRL/STAT"
43966-43977 swd: ack: "OK"
43986-44168 swd: data: "0xf0000040"
46397-46443 swd: write: "W AP4"
46455-46467 swd: ack: "OK"
46487-46693 swd: data: "0xe0001000"
46713-46760 swd: read: "W APc"
46772-46784 swd: ack: "OK"
46792-46971 swd: data: "0x00000000"
47003-47049 swd: read: "RDBUFF"
47062-47073 swd: ack: "OK"
47082-47261 swd: data: "0x20000000"
51292-51338 swd: write: "W AP4"
51350-51362 swd: ack: "OK"
51382-51589 swd: data: "0xe0001028"
51607-51654 swd: write: "W APc"
51666-51678 swd: ack: "OK"
51698-51904 swd: data: "0x00000000"
51933-51979 swd: read: "R CTRL/STAT"
51991-52003 swd: ack: "OK"
52011-52194 swd: data: "0xf0000040"
55376-55422 swd: write: "W AP4"
55434-55446 swd: ack: "OK"
55466-55672 swd: data: "0xe0001038"
55691-55737 swd: write: "W APc"
55749-55761 swd: ack: "OK"
55781-55987 swd: data: "0x00000000"
56017-56062 swd: read: "R CTRL/STAT"
56075-56086 swd: ack: "OK"
56095-56277 swd: data: "0xf0000040"
59243-59289 swd: write: "W AP4"
59301-59313 swd: ack: "OK"
59333-59539 swd: data: "0xe000edf0"
59559-59605 swd: read: "W APc"
59617-59629 swd: ack: "OK"
59637-59816 swd: data: "0x00000000"
59848-59895 swd: read: "RDBUFF"
59907-59919 swd: ack: "OK"
59928-60109 swd: data: "0x00030003"
61486-61532 swd: write: "W AP4"
61544-61556 swd: ack: "OK"
61576-61782 swd: data: "0xe000edf8"
61802-61849 swd: read: "W APc"
61861-61873 swd: ack: "OK"
61881-62060 swd: data: "0x00000000"
62092-62138 swd: read: "RDBUFF"
62151-62162 swd: ack: "OK"
62171-62349 swd: data: "0x00000000"
65487-65533 swd: write: "W AP4"
65546-65557 swd: ack: "OK"
65577-65784 swd: data: "0xe000edf0"
65805-65851 swd: write: "W SELECT"
65863-65875 swd: ack: "OK"
65895-66101 swd: data: "0x00000010"
66122-66168 swd: write: "W AP4"
66180-66192 swd: ack: "OK"
66212-66418 swd: data: "0x00000000"
66439-66485 swd: read: "W AP8"
66497-66509 swd: ack: "OK"
66517-66696 swd: data: "0x00000000"
66728-66775 swd: read: "RDBUFF"
66787-66799 swd: ack: "OK"
66807-66986 swd: data: "0x00000000"
68366-68411 swd: write: "W SELECT"
68424-68435 swd: ack: "OK"
68456-68662 swd: data: "0x00000000"
68684-68730 swd: write: "W AP4"
68742-68754 swd: ack: "OK"
68774-68980 swd: data: "0xe000edf0"
69002-69047 swd: write: "W SELECT"
69060-69071 swd: ack: "OK"
69092-69298 swd: data: "0x00000010"
69319-69365 swd: write: "W AP4"
69377-69389 swd: ack: "OK"
69409-69615 swd: data: "0x00000001"
69635-69681 swd: read: "W AP8"
69694-69705 swd: ack: "OK"
69714-69893 swd: data: "0x00000000"
69925-69971 swd: read: "RDBUFF"
69984-69995 swd: ack: "OK"
70004-70184 swd: data: "0x20000020"
71501-71547 swd: write: "W SELECT"
71559-71571 swd: ack: "OK"
71591-71797 swd: data: "0x00000000"
71820-71865 swd: write: "W AP4"
71878-71889 swd: ack: "OK"
71909-72116 swd: data: "0xe000edf0"
72137-72183 swd: write: "W SELECT"
72195-72207 swd: ack: "OK"
72227-72433 swd: data: "0x00000010"
72454-72500 swd: write: "W AP4"
72512-72524 swd: ack: "OK"
72544-72750 swd: data: "0x00000002"
72770-72817 swd: read: "W AP8"
72829-72841 swd: ack: "OK"
72849-73028 swd: data: "0x00000000"
73060-73106 swd: read: "RDBUFF"
73119-73130 swd: ack: "OK"
73139-73320 swd: data: "0x20000420"
75360-75406 swd: write: "W SELECT"
75419-75430 swd: ack: "OK"
75450-75657 swd: data: "0x00000000"
75679-75725 swd: write: "W AP4"
75737-75749 swd: ack: "OK"
75769-75975 swd: data: "0xe000edf0"
75996-76042 swd: write: "W SELECT"
76055-76066 swd: ack: "OK"
76086-76293 swd: data: "0x00000010"
76314-76359 swd: write: "W AP4"
76372-76383 swd: ack: "OK"
76403-76610 swd: data: "0x00000003"
76630-76676 swd: read: "W AP8"
76689-76700 swd: ack: "OK"
76709-76888 swd: data: "0x00000000"
76920-76966 swd: read: "RDBUFF"
76978-76990 swd: ack: "OK"
76998-77179 swd: data: "0x00002400"
78375-78420 swd: write: "W SELECT"
78433-78444 swd: ack: "OK"
78464-78671 swd: data: "0x00000000"
78693-78739 swd: write: "W AP4"
78751-78763 swd: ack: "OK"
78783-78989 swd: data: "0xe000edf0"
79011-79056 swd: write: "W SELECT"
79069-79080 swd: ack: "OK"
79100-79307 swd: data: "0x00000010"
79328-79373 swd: write: "W AP4"
79386-79397 swd: ack: "OK"
79418-79624 swd: data: "0x00000004"
79644-79690 swd: read: "W AP8"
79703-79714 swd: ack: "OK"
79723-79901 swd: data: "0x00000000"
79934-79980 swd: read: "RDBUFF"
79992-80004 swd: ack: "OK"
80012-80194 swd: data: "0x20000038"
81491-81536 swd: write: "W SELECT"
81549-81560 swd: ack: "OK"
81580-81787 swd: data: "0x00000000"
81809-81855 swd: write: "W AP4"
81867-81879 swd: ack: "OK"
81899-82105 swd: data: "0xe000edf0"
82127-82172 swd: write: "W SELECT"
82185-82196 swd: ack: "OK"
82216-82423 swd: data: "0x00000010"
82444-82489 swd: write: "W AP4"
82502-82513 swd: ack: "OK"
82534-82740 swd: data: "0x00000005"
82760-82806 swd: read: "W AP8"
82819-82830 swd: ack: "OK"
82839-83018 swd: data: "0x00000000"
83050-83096 swd: read: "RDBUFF"
83109-83120 swd: ack: "OK"
83129-83307 swd: data: "0x00000000"
84359-84405 swd: write: "W SELECT"
84417-84429 swd: ack: "OK"
84449-84655 swd: data: "0x00000000"
84677-84723 swd: write: "W AP4"
84736-84747 swd: ack: "OK"
84767-84974 swd: data: "0xe000edf0"
84995-85041 swd: write: "W SELECT"
85053-85065 swd: ack: "OK"
85085-85291 swd: data: "0x00000010"
85312-85358 swd: write: "W AP4"
85370-85382 swd: ack: "OK"
85402-85608 swd: data: "0x00000006"
85629-85675 swd: read: "W AP8"
85687-85699 swd: ack: "OK"
85707-85886 swd: data: "0x00000000"
85918-85965 swd: read: "RDBUFF"
85977-85988 swd: ack: "OK"
85998-86197 swd: data: "0xffffffff"
87386-87432 swd: write: "W SELECT"
87444-87456 swd: ack: "OK"
87476-87682 swd: data: "0x00000000"
87705-87750 swd: write: "W AP4"
87763-87774 swd: ack: "OK"
87794-88001 swd: data: "0xe000edf0"
88022-88068 swd: write: "W SELECT"
88080-88092 swd: ack: "OK"
88112-88318 swd: data: "0x00000010"
88339-88385 swd: write: "W AP4"
88397-88409 swd: ack: "OK"
88429-88636 swd: data: "0x00000007"
88656-88702 swd: read: "W AP8"
88714-88726 swd: ack: "OK"
88734-88913 swd: data: "0x00000000"
88945-88991 swd: read: "RDBUFF"
89004-89015 swd: ack: "OK"
89025-89224 swd: data: "0xffffffff"
91435-91481 swd: write: "W SELECT"
91493-91505 swd: ack: "OK"
91525-91732 swd: data: "0x00000000"
91754-91799 swd: write: "W AP4"
91812-91823 swd: ack: "OK"
91844-92050 swd: data: "0xe000edf0"
92071-92117 swd: write: "W SELECT"
92129-92141 swd: ack: "OK"
92161-92368 swd: data: "0x00000010"
92388-92434 swd: write: "W AP4"
92447-92458 swd: ack: "OK"
92478-92685 swd: data: "0x00000008"
92705-92751 swd: read: "W AP8"
92763-92775 swd: ack: "OK"
92783-92962 swd: data: "0x00000000"
92995-93041 swd: read: "RDBUFF"
93053-93065 swd: ack: "OK"
93074-93273 swd: data: "0xffffffff"
94361-94407 swd: write: "W SELECT"
94419-94431 swd: ack: "OK"
94451-94657 swd: data: "0x00000000"
94679-94725 swd: write: "W AP4"
94737-94749 swd: ack: "OK"
94769-94976 swd: data: "0xe000edf0"
94997-95043 swd: write: "W SELECT"
95055-95067 swd: ack: "OK"
95087-95293 swd: data: "0x00000010"
95314-95360 swd: write: "W AP4"
95372-95384 swd: ack: "OK"
95404-95610 swd: data: "0x00000009"
95630-95677 swd: read: "W AP8"
95689-95701 swd: ack: "OK"
95709-95888 swd: data: "0x00000000"
95920-95966 swd: read: "RDBUFF"
95979-95990 swd: ack: "OK"
96000-96199 swd: data: "0xffffffff"
98096-98142 swd: write: "W SELECT"
98154-98166 swd: ack: "OK"
98186-98393 swd: data: "0x00000000"
98415-98460 swd: write: "W AP4"
98473-98484 swd: ack: "OK"
98505-98711 swd: data: "0xe000edf0"
98732-98778 swd: write: "W SELECT"
98790-98802 swd: ack: "OK"
98822-99029 swd: data: "0x00000010"
99049-99095 swd: write: "W AP4"
99108-99119 swd: ack: "OK"
99139-99346 swd: data: "0x0000000a"
99366-99412 swd: read: "W AP8"
99424-99436 swd: ack: "OK"
99444-99623 swd: data: "0x00000000"
99656-99702 swd: read: "RDBUFF"
99714-99726 swd: ack: "OK"
99735-99934 swd: data: "0xffffffff"
101509-101555 swd: write: "W SELECT"
101568-101579 swd: ack: "OK"
101599-101806 swd: data: "0x00000000"
101828-101874 swd: write: "W AP4"
101886-101898 swd: ack: "OK"
101918-102124 swd: data: "0xe000edf0"
102145-102191 swd: write: "W SELECT"
102204-102215 swd: ack: "OK"
102235-102442 swd: data: "0x00000010"
102463-102508 swd: write: "W AP4"
102521-102532 swd: ack: "OK"
102552-102759 swd: data: "0x0000000b"
102779-102825 swd: read: "W AP8"
102837-102849 swd: ack: "OK"
102857-103036 swd: data: "0x00000000"
103069-103115 swd: read: "RDBUFF"
103127-103139 swd: ack: "OK"
103148-103347 swd: data: "0xffffffff"
104495-104541 swd: write: "W SELECT"
104553-104565 swd: ack: "OK"
104585-104792 swd: data: "0x00000000"
104814-104859 swd: write: "W AP4"
104872-104883 swd: ack: "OK"
104904-105110 swd: data: "0xe000edf0"
105131-105177 swd: write: "W SELECT"
105189-105201 swd: ack: "OK"
105221-105428 swd: data: "0x00000010"
105448-105494 swd: write: "W AP4"
105507-105518 swd: ack: "OK"
105538-105745 swd: data: "0x0000000c"
105765-105811 swd: read: "W AP8"
105824-105835 swd: ack: "OK"
105843-106022 swd: data: "0x00000000"
106055-106101 swd: read: "RDBUFF"
106113-106125 swd: ack: "OK"
106134-106334 swd: data: "0xffffffff"
107500-107546 swd: write: "W SELECT"
107559-107570 swd: ack: "OK"
107590-107797 swd: data: "0x00000000"
107819-107865 swd: write: "W AP4"
107877-107889 swd: ack: "OK"
107909-108115 swd: data: "0xe000edf0"
108136-108182 swd: write: "W SELECT"
108195-108206 swd: ack: "OK"
108226-108433 swd: data: "0x00000010"
108454-108499 swd: write: "W AP4"
108512-108523 swd: ack: "OK"
108543-108750 swd: data: "0x0000000d"
108770-108816 swd: read: "W AP8"
108828-108840 swd: ack: "OK"
108848-109027 swd: data: "0x00000000"
109060-109106 swd: read: "RDBUFF"
109118-109130 swd: ack: "OK"
109138-109330 swd: data: "0xabbabee8"
110366-110412 swd: write: "W SELECT"
110424-110436 swd: ack: "OK"
110456-110662 swd: data: "0x00000000"
110684-110730 swd: write: "W AP4"
110743-110754 swd: ack: "OK"
110774-110981 swd: data: "0xe000edf0"
111002-111048 swd: write: "W SELECT"
111060-111072 swd: ack: "OK"
111092-111298 swd: data: "0x00000010"
111319-111365 swd: write: "W AP4"
111377-111389 swd: ack: "OK"
111409-111615 swd: data: "0x0000000e"
111635-111682 swd: read: "W AP8"
111694-111706 swd: ack: "OK"
111714-111893 swd: data: "0x00000000"
111925-111971 swd: read: "RDBUFF"
111984-111995 swd: ack: "OK"
112004-112204 swd: data: "0xffffffff"
113255-113301 swd: write: "W SELECT"
113314-113325 swd: ack: "OK"
113345-113552 swd: data: "0x00000000"
113574-113620 swd: write: "W AP4"
113632-113644 swd: ack: "OK"
113664-113870 swd: data: "0xe000edf0"
113891-113937 swd: write: "W SELECT"
113950-113961 swd: ack: "OK"
113981-114188 swd: data: "0x00000010"
114209-114254 swd: write: "W AP4"
114267-114278 swd: ack: "OK"
114298-114505 swd: data: "0x0000000f"
114525-114571 swd: read: "W AP8"
114584-114595 swd: ack: "OK"
114604-114782 swd: data: "0x00000000"
114815-114861 swd: read: "RDBUFF"
114873-114885 swd: ack: "OK"
114893-115076 swd: data: "0x2000001e"
116762-116807 swd: write: "W SELECT"
116820-116831 swd: ack: "OK"
116851-117058 swd: data: "0x00000000"
117080-117126 swd: write: "W AP4"
117138-117150 swd: ack: "OK"
117170-117376 swd: data: "0xe000edf0"
117398-117443 swd: write: "W SELECT"
117456-117467 swd: ack: "OK"
117487-117694 swd: data: "0x00000010"
117715-117760 swd: write: "W AP4"
117773-117784 swd: ack: "OK"
117805-118011 swd: data: "0x00000010"
118031-118077 swd: read: "W AP8"
118090-118101 swd: ack: "OK"
118110-118288 swd: data: "0x00000000"
118321-118367 swd: read: "RDBUFF"
118379-118391 swd: ack: "OK"
118399-118580 swd: data: "0x61000000"
120627-120672 swd: write: "W SELECT"
120685-120696 swd: ack: "OK"
120716-120923 swd: data: "0x00000000"
120945-120991 swd: write: "W AP4"
121003-121015 swd: ack: "OK"
121035-121241 swd: data: "0xe000edf0"
121263-121308 swd: write: "W SELECT"
121321-121332 swd: ack: "OK"
121352-121559 swd: data: "0x00000010"
121580-121625 swd: write: "W AP4"
121638-121649 swd: ack: "OK"
121670-121876 swd: data: "0x00000011"
121896-121942 swd: read: "W AP8"
121955-121966 swd: ack: "OK"
121975-122154 swd: data: "0x00000000"
122186-122232 swd: read: "RDBUFF"
122245-122256 swd: ack: "OK"
122265-122457 swd: data: "0xabbabee8"
123377-123423 swd: write: "W SELECT"
123436-123447 swd: ack: "OK"
123467-123674 swd: data: "0x00000000"
123696-123742 swd: write: "W AP4"
123754-123766 swd: ack: "OK"
123786-123992 swd: data: "0xe000edf0"
124013-124059 swd: write: "W SELECT"
124072-124083 swd: ack: "OK"
124103-124310 swd: data: "0x00000010"
124331-124376 swd: write: "W AP4"
124389-124400 swd: ack: "OK"
124420-124627 swd: data: "0x00000012"
124647-124693 swd: read: "W AP8"
124706-124717 swd: ack: "OK"
124726-124904 swd: data: "0x00000000"
124937-124983 swd: read: "RDBUFF"
124995-125007 swd: ack: "OK"
125015-125214 swd: data: "0xfffffffc"
126260-126305 swd: write: "W SELECT"
126318-126329 swd: ack: "OK"
126350-126556 swd: data: "0x00000000"
126578-126624 swd: write: "W AP4"
126636-126648 swd: ack: "OK"
126668-126874 swd: data: "0xe000edf0"
126896-126941 swd: write: "W SELECT"
126954-126965 swd: ack: "OK"
126986-127192 swd: data: "0x00000010"
127213-127259 swd: write: "W AP4"
127271-127283 swd: ack: "OK"
127303-127509 swd: data: "0x00000014"
127529-127576 swd: read: "W AP8"
127588-127599 swd: ack: "OK"
127608-127787 swd: data: "0x00000000"
127819-127865 swd: read: "RDBUFF"
127878-127889 swd: ack: "OK"
127898-128077 swd: data: "0x00000000"
129375-129421 swd: write: "W SELECT"
129433-129445 swd: ack: "OK"
129465-129671 swd: data: "0x00000000"
129694-129739 swd: write: "W AP4"
129752-129763 swd: ack: "OK"
129783-129990 swd: data: "0xe000edf0"
130011-130057 swd: write: "W SELECT"
130069-130081 swd: ack: "OK"
130101-130307 swd: data: "0x00000010"
130328-130374 swd: write: "W AP4"
130386-130398 swd: ack: "OK"
130418-130624 swd: data: "0x00000014"
130645-130691 swd: read: "W AP8"
130703-130715 swd: ack: "OK"
130723-130902 swd: data: "0x00000000"
130935-130981 swd: read: "RDBUFF"
130993-131005 swd: ack: "OK"
131013-131192 swd: data: "0x00000000"
132268-132314 swd: write: "W SELECT"
132326-132338 swd: ack: "OK"
132358-132565 swd: data: "0x00000000"
132587-132632 swd: write: "W AP4"
132645-132656 swd: ack: "OK"
132677-132883 swd: data: "0xe000edf0"
132904-132950 swd: write: "W SELECT"
132962-132974 swd: ack: "OK"
132994-133201 swd: data: "0x00000010"
133221-133267 swd: write: "W AP4"
133280-133291 swd: ack: "OK"
133311-133518 swd: data: "0x00000014"
133538-133584 swd: read: "W AP8"
133596-133608 swd: ack: "OK"
133616-133795 swd: data: "0x00000000"
133828-133874 swd: read: "RDBUFF"
133886-133898 swd: ack: "OK"
133906-134085 swd: data: "0x00000000"
135538-135584 swd: write: "W SELECT"
135597-135608 swd: ack: "OK"
135628-135835 swd: data: "0x00000000"
135857-135903 swd: write: "W AP4"
135915-135927 swd: ack: "OK"
135947-136153 swd: data: "0xe000edf0"
136175-136220 swd: write: "W SELECT"
136233-136244 swd: ack: "OK"
136264-136471 swd: data: "0x00000010"
136492-136537 swd: write: "W AP4"
136550-136561 swd: ack: "OK"
136582-136788 swd: data: "0x00000014"
136808-136854 swd: read: "W AP8"
136867-136878 swd: ack: "OK"
136887-137066 swd: data: "0x00000000"
137098-137144 swd: read: "RDBUFF"
137157-137168 swd: ack: "OK"
137176-137355 swd: data: "0x00000000"
139378-139424 swd: write: "W SELECT"
139436-139448 swd: ack: "OK"
139468-139674 swd: data: "0x00000000"
139696-139741 swd: write: "W AP4"
139754-139765 swd: ack: "OK"
139786-139992 swd: data: "0xe000edfc"
140011-140057 swd: write: "W APc"
140069-140081 swd: ack: "OK"
140101-140307 swd: data: "0x01000000"
140336-140382 swd: read: "R CTRL/STAT"
140394-140406 swd: ack: "OK"
140414-140596 swd: data: "0xf0000040"
142013-142059 swd: write: "W AP4"
142071-142083 swd: ack: "OK"
142103-142309 swd: data: "0xe000edf0"
142329-142375 swd: read: "W APc"
142388-142399 swd: ack: "OK"
142408-142586 swd: data: "0x00000000"
142619-142665 swd: read: "RDBUFF"
142677-142689 swd: ack: "OK"
142698-142879 swd: data: "0x00030003"
144506-144552 swd: write: "W AP4"
144564-144576 swd: ack: "OK"
144596-144802 swd: data: "0xe000edf0"
144822-144868 swd: read: "W APc"
144881-144892 swd: ack: "OK"
144901-145080 swd: data: "0x00000000"
145112-145158 swd: read: "RDBUFF"
145170-145182 swd: ack: "OK"
145191-145372 swd: data: "0x00030003"
147496-147541 swd: write: "W AP4"
147554-147565 swd: ack: "OK"
147586-147792 swd: data: "0xe000edf0"
147812-147858 swd: read: "W APc"
147870-147882 swd: ack: "OK"
147890-148069 swd: data: "0x00000000"
148101-148148 swd: read: "RDBUFF"
148160-148172 swd: ack: "OK"
148181-148362 swd: data: "0x00030003"
149770-149815 swd: write: "W AP4"
149828-149839 swd: ack: "OK"
149859-150066 swd: data: "0xe000edf0"
150086-150132 swd: read: "W APc"
150144-150156 swd: ack: "OK"
150164-150343 swd: data: "0x00000000"
150375-150421 swd: read: "RDBUFF"
150434-150445 swd: ack: "OK"
150454-150635 swd: data: "0x00030003"
152251-152296 swd: write: "W AP4"
152309-152320 swd: ack: "OK"
152341-152547 swd: data: "0xe000edf0"
152567-152613 swd: read: "W APc"
152625-152637 swd: ack: "OK"
152645-152824 swd: data: "0x00000000"
152856-152902 swd: read: "RDBUFF"
152915-152926 swd: ack: "OK"
152936-153116 swd: data: "0x00030003"
154504-154550 swd: write: "W AP4"
154562-154574 swd: ack: "OK"
154594-154800 swd: data: "0xe000edf0"
154820-154866 swd: read: "W APc"
154879-154890 swd: ack: "OK"
154899-155077 swd: data: "0x00000000"
155110-155156 swd: read: "RDBUFF"
155168-155180 swd: ack: "OK"
155189-155370 swd: data: "0x00030003"
158801-158847 swd: write: "W AP4"
158859-158871 swd: ack: "OK"
158891-159097 swd: data: "0x20000000"
159118-159164 swd: write: "W SELECT"
159177-159188 swd: ack: "OK"
159208-159415 swd: data: "0x00000010"
159436-159482 swd: write: "W AP0"
159494-159506 swd: ack: "OK"
159526-159732 swd: data: "0xabbabeeb"
159752-159798 swd: write: "W AP4"
159810-159822 swd: ack: "OK"
159842-160049 swd: data: "0xabbabeeb"
160068-160114 swd: write: "W AP8"
160127-160138 swd: ack: "OK"
160158-160365 swd: data: "0xabbabeeb"
160384-160431 swd: write: "W APc"
160443-160455 swd: ack: "OK"
160475-160681 swd: data: "0xabbabeeb"
160703-160749 swd: write: "W SELECT"
160761-160773 swd: ack: "OK"
160793-160999 swd: data: "0x00000000"
161021-161066 swd: write: "W AP4"
161079-161090 swd: ack: "OK"
161110-161317 swd: data: "0x20000010"
161338-161384 swd: write: "W SELECT"
161396-161408 swd: ack: "OK"
161428-161635 swd: data: "0x00000010"
161656-161702 swd: write: "W AP0"
161714-161726 swd: ack: "OK"
161746-161952 swd: data: "0xabbabeeb"
161972-162018 swd: write: "W AP4"
162030-162042 swd: ack: "OK"
162062-162268 swd: data: "0xabbabeeb"
162288-162334 swd: write: "W AP8"
162347-162358 swd: ack: "OK"
162378-162585 swd: data: "0xabbabeeb"
162604-162651 swd: write: "W APc"
162663-162674 swd: ack: "OK"
162695-162901 swd: data: "0xabbabeeb"
162923-162969 swd: write: "W SELECT"
162981-162993 swd: ack: "OK"
163013-163219 swd: data: "0x00000000"
163240-163286 swd: write: "W AP4"
163299-163310 swd: ack: "OK"
163330-163537 swd: data: "0x20000020"
163558-163604 swd: write: "W SELECT"
163616-163628 swd: ack: "OK"
163648-163854 swd: data: "0x00000010"
163876-163921 swd: write: "W AP0"
163934-163945 swd: ack: "OK"
163966-164172 swd: data: "0xabbabeeb"
164192-164238 swd: write: "W AP4"
164250-164262 swd: ack: "OK"
164282-164488 swd: data: "0xabbabeeb"
164508-164554 swd: write: "W AP8"
164566-164578 swd: ack: "OK"
164598-164804 swd: data: "0xabbabeeb"
164824-164870 swd: write: "W APc"
164883-164894 swd: ack: "OK"
164915-165121 swd: data: "0xabbabeeb"
165143-165189 swd: write: "W SELECT"
165201-165213 swd: ack: "OK"
165233-165439 swd: data: "0x00000000"
165460-165506 swd: write: "W AP4"
165518-165530 swd: ack: "OK"
165550-165757 swd: data: "0x20000030"
165778-165824 swd: write: "W SELECT"
165836-165848 swd: ack: "OK"
165868-166074 swd: data: "0x00000010"
166095-166141 swd: write: "W AP0"
166154-166165 swd: ack: "OK"
166185-166392 swd: data: "0xabbabeeb"
166412-166457 swd: write: "W AP4"
166470-166481 swd: ack: "OK"
166502-166708 swd: data: "0xabbabeeb"
166728-166774 swd: write: "W AP8"
166786-166798 swd: ack: "OK"
166818-167024 swd: data: "0xabbabeeb"
167044-167090 swd: write: "W APc"
167102-167114 swd: ack: "OK"
167134-167341 swd: data: "0xabbabeeb"
167661-167707 swd: write: "W SELECT"
167719-167731 swd: ack: "OK"
167751-167957 swd: data: "0x00000000"
167978-168024 swd: write: "W AP4"
168037-168048 swd: ack: "OK"
168068-168275 swd: data: "0x20000040"
168296-168342 swd: write: "W SELECT"
168354-168366 swd: ack: "OK"
168386-168592 swd: data: "0x00000010"
168614-168659 swd: write: "W AP0"
168672-168683 swd: ack: "OK"
168704-168910 swd: data: "0xabbabeeb"
168930-168976 swd: write: "W AP4"
168988-169000 swd: ack: "OK"
169020-169226 swd: data: "0xabbabeeb"
169246-169292 swd: write: "W AP8"
169304-169316 swd: ack: "OK"
169336-169543 swd: data: "0xabbabeeb"
169562-169608 swd: write: "W APc"
169621-169632 swd: ack: "OK"
169653-169859 swd: data: "0xabbabeeb"
175257-175302 swd: write: "W SELECT"
175315-175326 swd: ack: "OK"
175347-175553 swd: data: "0x00000000"
175575-175621 swd: write: "W AP4"
175633-175645 swd: ack: "OK"
175665-175871 swd: data: "0xe000edf0"
175891-175937 swd: read: "W APc"
175950-175961 swd: ack: "OK"
175970-176148 swd: data: "0x00000000"
176181-176227 swd: read: "RDBUFF"
176239-176251 swd: ack: "OK"
176260-176441 swd: data: "0x00030003"
