0-45 swd: write: "W SELECT"
58-69 swd: ack: "OK"
90-296 swd: data: "0x00000000"
318-363 swd: write: "W AP4"
376-387 swd: ack: "OK"
407-614 swd: data: "0x20000020"
633-679 swd: write: "W APc"
691-703 swd: ack: "OK"
723-929 swd: data: "0x20000240"
958-1004 swd: read: "R CTRL/STAT"
1016-1028 swd: ack: "OK"
1036-1218 swd: data: "0xf0000040"
4683-4729 swd: write: "W AP4"
4741-4753 swd: ack: "OK"
4773-4979 swd: data: "0x20000024"
4999-5045 swd: read: "R APc"
5058-5069 swd: ack: "OK"
5077-5256 swd: data: "0x00000000"
5289-5335 swd: read: "RDBUFF"
5347-5359 swd: ack: "WAIT"
5381-5427 swd: read: "RDBUFF"
5440-5451 swd: ack: "OK"
5460-5640 swd: data: "0x20000080"
12677-12723 swd: write: "W AP4"
12735-12747 swd: ack: "OK"
12767-12973 swd: data: "0x20000240"
12994-13040 swd: write: "W SELECT"
13053-13064 swd: ack: "OK"
13084-13291 swd: data: "0x00000010"
13312-13358 swd: write: "W AP0"
13370-13382 swd: ack: "OK"
13402-13608 swd: data: "0xabbabeeb"
13628-13674 swd: write: "W AP4"
13686-13698 swd: ack: "WAIT"
13720-13765 swd: write: "W AP4"
13778-13789 swd: ack: "OK"
13810-14016 swd: data: "0xabbabeeb"
14036-14082 swd: write: "W AP8"
14094-14106 swd: ack: "OK"
14126-14332 swd: data: "0xabbabeeb"
14352-14398 swd: write: "W APc"
14410-14422 swd: ack: "WAIT"
14444-14490 swd: write: "W APc"
14502-14514 swd: ack: "OK"
14534-14741 swd: data: "0xabbabeeb"
14763-14808 swd: write: "W SELECT"
14821-14832 swd: ack: "OK"
14852-15059 swd: data: "0x00000000"
15080-15126 swd: write: "W AP4"
15138-15150 swd: ack: "OK"
15170-15376 swd: data: "0x20000250"
15398-15443 swd: write: "W SELECT"
15456-15467 swd: ack: "OK"
15488-15694 swd: data: "0x00000010"
15715-15761 swd: write: "W AP0"
15773-15785 swd: ack: "OK"
15805-16011 swd: data: "0xabbabeeb"
16031-16077 swd: write: "W AP4"
16089-16101 swd: ack: "WAIT"
16123-16169 swd: write: "W AP4"
16181-16193 swd: ack: "WAIT"
16214-16260 swd: write: "W AP4"
16272-16284 swd: ack: "OK"
16304-16511 swd: data: "0xabbabeeb"
16531-16576 swd: write: "W AP8"
16589-16600 swd: ack: "OK"
16620-16827 swd: data: "0xabbabeeb"
16847-16893 swd: write: "W APc"
16905-16917 swd: ack: "WAIT"
16938-16985 swd: write: "W APc"
16997-17009 swd: ack: "OK"
17029-17235 swd: data: "0xabbabeeb"
17257-17303 swd: write: "W SELECT"
17315-17327 swd: ack: "OK"
17347-17553 swd: data: "0x00000000"
17574-17620 swd: write: "W AP4"
17633-17644 swd: ack: "OK"
17664-17871 swd: data: "0x20000260"
17892-17938 swd: write: "W SELECT"
17950-17962 swd: ack: "OK"
17982-18189 swd: data: "0x00000010"
18210-18256 swd: write: "W AP0"
18268-18280 swd: ack: "OK"
18300-18506 swd: data: "0xabbabeeb"
18526-18572 swd: write: "W AP4"
18584-18596 swd: ack: "OK"
18616-18822 swd: data: "0xabbabeeb"
18842-18888 swd: write: "W AP8"
18900-18912 swd: ack: "WAIT"
18934-18979 swd: write: "W AP8"
18992-19003 swd: ack: "OK"
19024-19230 swd: data: "0xabbabeeb"
19250-19296 swd: write: "W APc"
19308-19320 swd: ack: "OK"
19340-19546 swd: data: "0xabbabeeb"
19568-19614 swd: write: "W SELECT"
19626-19638 swd: ack: "WAIT"
19660-19706 swd: write: "W SELECT"
19718-19730 swd: ack: "OK"
19750-19956 swd: data: "0x00000000"
19977-20023 swd: write: "W AP4"
20035-20047 swd: ack: "OK"
20067-20273 swd: data: "0x20000270"
20295-20340 swd: write: "W SELECT"
20353-20364 swd: ack: "OK"
20385-20591 swd: data: "0x00000010"
20612-20658 swd: write: "W AP0"
20670-20682 swd: ack: "OK"
20702-20909 swd: data: "0xabbabeeb"
20929-20974 swd: write: "W AP4"
20986-20998 swd: ack: "WAIT"
21020-21066 swd: write: "W AP4"
21078-21090 swd: ack: "WAIT"
21111-21157 swd: write: "W AP4"
21170-21181 swd: ack: "OK"
21201-21408 swd: data: "0xabbabeeb"
21428-21473 swd: write: "W AP8"
21486-21497 swd: ack: "OK"
21518-21724 swd: data: "0xabbabeeb"
21744-21790 swd: write: "W APc"
21802-21814 swd: ack: "WAIT"
21836-21882 swd: write: "W APc"
21894-21906 swd: ack: "OK"
21926-22132 swd: data: "0xabbabeeb"
22954-23000 swd: write: "W SELECT"
23012-23024 swd: ack: "OK"
23044-23251 swd: data: "0x00000000"
23272-23317 swd: write: "W AP4"
23330-23341 swd: ack: "OK"
23362-23568 swd: data: "0x20000280"
23589-23635 swd: write: "W SELECT"
23647-23659 swd: ack: "OK"
23679-23885 swd: data: "0x00000010"
23907-23952 swd: write: "W AP0"
23965-23976 swd: ack: "OK"
23997-24203 swd: data: "0xabbabeeb"
24223-24269 swd: write: "W AP4"
24281-24293 swd: ack: "WAIT"
24314-24360 swd: write: "W AP4"
24373-24384 swd: ack: "OK"
24404-24611 swd: data: "0xabbabeeb"
24631-24676 swd: write: "W AP8"
24688-24700 swd: ack: "WAIT"
24722-24768 swd: write: "W AP8"
24780-24792 swd: ack: "OK"
24812-25018 swd: data: "0xabbabeeb"
25038-25084 swd: write: "W APc"
25096-25108 swd: ack: "WAIT"
25130-25176 swd: write: "W APc"
25188-25200 swd: ack: "WAIT"
25222-25268 swd: write: "W APc"
25280-25292 swd: ack: "OK"
25312-25519 swd: data: "0xabbabeeb"
25541-25586 swd: write: "W SELECT"
25599-25610 swd: ack: "OK"
25630-25837 swd: data: "0x00000000"
25858-25904 swd: write: "W AP4"
25916-25928 swd: ack: "OK"
25948-26154 swd: data: "0x20000290"
26176-26221 swd: write: "W SELECT"
26234-26245 swd: ack: "OK"
26266-26472 swd: data: "0x00000010"
26493-26539 swd: write: "W AP0"
26551-26563 swd: ack: "OK"
26583-26790 swd: data: "0xabbabeeb"
26809-26855 swd: write: "W AP4"
26868-26879 swd: ack: "OK"
26899-27106 swd: data: "0xabbabeeb"
27126-27171 swd: write: "W AP8"
27184-27195 swd: ack: "OK"
27216-27422 swd: data: "0xabbabeeb"
27442-27488 swd: write: "W APc"
27500-27512 swd: ack: "OK"
27532-27738 swd: data: "0xabbabeeb"
27760-27806 swd: write: "W SELECT"
27819-27830 swd: ack: "OK"
27850-28057 swd: data: "0x00000000"
28078-28123 swd: write: "W AP4"
28136-28147 swd: ack: "OK"
28168-28374 swd: data: "0x200002a0"
28396-28441 swd: write: "W SELECT"
28454-28465 swd: ack: "OK"
28485-28692 swd: data: "0x00000010"
28713-28759 swd: write: "W AP0"
28771-28783 swd: ack: "OK"
28803-29009 swd: data: "0xabbabeeb"
29029-29075 swd: write: "W AP4"
29087-29099 swd: ack: "OK"
29119-29326 swd: data: "0xabbabeeb"
29346-29391 swd: write: "W AP8"
29404-29415 swd: ack: "OK"
29435-29642 swd: data: "0xabbabeeb"
29662-29708 swd: write: "W APc"
29720-29732 swd: ack: "OK"
29752-29958 swd: data: "0xabbabeeb"
29980-30026 swd: write: "W SELECT"
30038-30050 swd: ack: "OK"
30070-30277 swd: data: "0x00000000"
30298-30343 swd: write: "W AP4"
30356-30367 swd: ack: "OK"
30388-30594 swd: data: "0x200002b0"
30615-30661 swd: write: "W SELECT"
30673-30685 swd: ack: "OK"
30705-30911 swd: data: "0x00000010"
30933-30978 swd: write: "W AP0"
30991-31002 swd: ack: "OK"
31023-31229 swd: data: "0xabbabeeb"
31249-31295 swd: write: "W AP4"
31307-31319 swd: ack: "OK"
31339-31545 swd: data: "0xabbabeeb"
31565-31611 swd: write: "W AP8"
31623-31635 swd: ack: "OK"
31655-31862 swd: data: "0xabbabeeb"
31881-31927 swd: write: "W APc"
31940-31951 swd: ack: "OK"
31972-32178 swd: data: "0xabbabeeb"
33143-33189 swd: write: "W SELECT"
33201-33213 swd: ack: "OK"
33233-33440 swd: data: "0x00000000"
33461-33506 swd: write: "W AP4"
33519-33530 swd: ack: "OK"
33551-33757 swd: data: "0x200002c0"
33778-33824 swd: write: "W SELECT"
33837-33848 swd: ack: "OK"
33868-34075 swd: data: "0x00000010"
34096-34142 swd: write: "W AP0"
34154-34166 swd: ack: "OK"
34186-34392 swd: data: "0xabbabeeb"
34412-34458 swd: write: "W AP4"
34470-34482 swd: ack: "OK"
34502-34709 swd: data: "0xabbabeeb"
34728-34774 swd: write: "W AP8"
34787-34798 swd: ack: "OK"
34818-35025 swd: data: "0xabbabeeb"
35045-35091 swd: write: "W APc"
35103-35115 swd: ack: "OK"
35135-35341 swd: data: "0xabbabeeb"
35363-35409 swd: write: "W SELECT"
35421-35433 swd: ack: "OK"
35453-35659 swd: data: "0x00000000"
35681-35726 swd: write: "W AP4"
35739-35750 swd: ack: "OK"
35770-35977 swd: data: "0x200002d0"
35998-36044 swd: write: "W SELECT"
36056-36068 swd: ack: "OK"
36088-36294 swd: data: "0x00000010"
36316-36361 swd: write: "W AP0"
36374-36385 swd: ack: "OK"
36406-36612 swd: data: "0xabbabeeb"
36632-36678 swd: write: "W AP4"
36690-36702 swd: ack: "OK"
36722-36928 swd: data: "0xabbabeeb"
36948-36994 swd: write: "W AP8"
37006-37018 swd: ack: "OK"
37038-37244 swd: data: "0xabbabeeb"
37264-37310 swd: write: "W APc"
37323-37334 swd: ack: "OK"
37354-37561 swd: data: "0xabbabeeb"
37583-37629 swd: write: "W SELECT"
37641-37653 swd: ack: "OK"
37673-37879 swd: data: "0x00000000"
37900-37946 swd: write: "W AP4"
37958-37970 swd: ack: "OK"
37990-38196 swd: data: "0x200002e0"
38218-38263 swd: write: "W SELECT"
38276-38287 swd: ack: "OK"
38308-38514 swd: data: "0x00000010"
38535-38581 swd: write: "W AP0"
38593-38605 swd: ack: "OK"
38625-38832 swd: data: "0xabbabeeb"
38852-38897 swd: write: "W AP4"
38910-38921 swd: ack: "OK"
38941-39148 swd: data: "0xabbabeeb"
39168-39214 swd: write: "W AP8"
39226-39237 swd: ack: "OK"
39258-39464 swd: data: "0xabbabeeb"
39484-39530 swd: write: "W APc"
39542-39554 swd: ack: "OK"
39574-39781 swd: data: "0xabbabeeb"
39802-39848 swd: write: "W SELECT"
39861-39872 swd: ack: "OK"
39892-40099 swd: data: "0x00000000"
40120-40166 swd: write: "W AP4"
40178-40190 swd: ack: "OK"
40210-40416 swd: data: "0x200002f0"
40438-40483 swd: write: "W SELECT"
40496-40507 swd: ack: "OK"
40528-40734 swd: data: "0x00000010"
40755-40801 swd: write: "W AP0"
40813-40825 swd: ack: "OK"
40845-41051 swd: data: "0xabbabeeb"
41071-41117 swd: write: "W AP4"
41130-41141 swd: ack: "OK"
41161-41368 swd: data: "0xabbabeeb"
41388-41433 swd: write: "W AP8"
41446-41457 swd: ack: "OK"
41478-41684 swd: data: "0xabbabeeb"
41704-41750 swd: write: "W APc"
41762-41774 swd: ack: "OK"
41794-42000 swd: data: "0xabbabeeb"
42583-42628 swd: write: "W SELECT"
42641-42652 swd: ack: "OK"
42673-42879 swd: data: "0x00000000"
42900-42946 swd: write: "W AP4"
42958-42970 swd: ack: "OK"
42990-43196 swd: data: "0x20000300"
43218-43263 swd: write: "W SELECT"
43276-43287 swd: ack: "OK"
43307-43514 swd: data: "0x00000010"
43535-43581 swd: write: "W AP0"
43593-43605 swd: ack: "OK"
43625-43831 swd: data: "0xabbabeeb"
43851-43897 swd: write: "W AP4"
43910-43921 swd: ack: "OK"
43941-44148 swd: data: "0xabbabeeb"
44168-44213 swd: write: "W AP8"
44226-44237 swd: ack: "OK"
44258-44464 swd: data: "0xabbabeeb"
44484-44530 swd: write: "W APc"
44542-44554 swd: ack: "OK"
44574-44780 swd: data: "0xabbabeeb"
44802-44848 swd: write: "W SELECT"
44861-44872 swd: ack: "OK"
44892-45099 swd: data: "0x00000000"
45120-45165 swd: write: "W AP4"
45178-45189 swd: ack: "OK"
45210-45416 swd: data: "0x20000310"
45437-45483 swd: write: "W SELECT"
45496-45507 swd: ack: "OK"
45527-45734 swd: data: "0x00000010"
45755-45801 swd: write: "W AP0"
45813-45825 swd: ack: "OK"
45845-46051 swd: data: "0xabbabeeb"
46071-46117 swd: write: "W AP4"
46129-46141 swd: ack: "OK"
46161-46368 swd: data: "0xabbabeeb"
46388-46433 swd: write: "W AP8"
46446-46457 swd: ack: "OK"
46477-46684 swd: data: "0xabbabeeb"
46704-46750 swd: write: "W APc"
46762-46774 swd: ack: "OK"
46794-47000 swd: data: "0xabbabeeb"
47022-47068 swd: write: "W SELECT"
47080-47092 swd: ack: "OK"
47112-47318 swd: data: "0x00000000"
47340-47385 swd: write: "W AP4"
47398-47409 swd: ack: "OK"
47429-47636 swd: data: "0x20000320"
47657-47703 swd: write: "W SELECT"
47716-47727 swd: ack: "OK"
47747-47954 swd: data: "0x00000010"
47975-48021 swd: write: "W AP0"
48033-48045 swd: ack: "OK"
48065-48271 swd: data: "0xabbabeeb"
48291-48337 swd: write: "W AP4"
48349-48361 swd: ack: "OK"
48381-48587 swd: data: "0xabbabeeb"
48607-48653 swd: write: "W AP8"
48666-48677 swd: ack: "OK"
48697-48904 swd: data: "0xabbabeeb"
48923-48970 swd: write: "W APc"
48982-48994 swd: ack: "OK"
49014-49220 swd: data: "0xabbabeeb"
49242-49288 swd: write: "W SELECT"
49300-49312 swd: ack: "OK"
49332-49538 swd: data: "0x00000000"
49559-49605 swd: write: "W AP4"
49618-49629 swd: ack: "OK"
49649-49856 swd: data: "0x20000330"
49877-49923 swd: write: "W SELECT"
49935-49947 swd: ack: "OK"
49967-50173 swd: data: "0x00000010"
50195-50240 swd: write: "W AP0"
50253-50264 swd: ack: "OK"
50284-50491 swd: data: "0xabbabeeb"
50511-50557 swd: write: "W AP4"
50569-50581 swd: ack: "OK"
50601-50807 swd: data: "0xabbabeeb"
50827-50873 swd: write: "W AP8"
50885-50897 swd: ack: "OK"
50917-51123 swd: data: "0xabbabeeb"
51143-51189 swd: write: "W APc"
51202-51213 swd: ack: "OK"
51233-51440 swd: data: "0xabbabeeb"
52133-52178 swd: write: "W SELECT"
52191-52202 swd: ack: "OK"
52222-52429 swd: data: "0x00000000"
52450-52496 swd: write: "W AP4"
52508-52520 swd: ack: "OK"
52540-52746 swd: data: "0x20000340"
52768-52813 swd: write: "W SELECT"
52826-52837 swd: ack: "OK"
52858-53064 swd: data: "0x00000010"
53085-53131 swd: write: "W AP0"
53143-53155 swd: ack: "OK"
53175-53382 swd: data: "0xabbabeeb"
53402-53447 swd: write: "W AP4"
53460-53471 swd: ack: "OK"
53491-53698 swd: data: "0xabbabeeb"
53718-53764 swd: write: "W AP8"
53776-53787 swd: ack: "OK"
53808-54014 swd: data: "0xabbabeeb"
54034-54080 swd: write: "W APc"
54092-54104 swd: ack: "OK"
54124-54331 swd: data: "0xabbabeeb"
54352-54398 swd: write: "W SELECT"
54411-54422 swd: ack: "OK"
54442-54649 swd: data: "0x00000000"
54670-54716 swd: write: "W AP4"
54728-54740 swd: ack: "OK"
54760-54966 swd: data: "0x20000350"
54987-55033 swd: write: "W SELECT"
55046-55057 swd: ack: "OK"
55077-55284 swd: data: "0x00000010"
55305-55351 swd: write: "W AP0"
55363-55375 swd: ack: "OK"
55395-55601 swd: data: "0xabbabeeb"
55621-55667 swd: write: "W AP4"
55679-55691 swd: ack: "OK"
55711-55917 swd: data: "0xabbabeeb"
55937-55983 swd: write: "W AP8"
55996-56007 swd: ack: "OK"
56027-56234 swd: data: "0xabbabeeb"
56253-56300 swd: write: "W APc"
56312-56324 swd: ack: "OK"
56344-56550 swd: data: "0xabbabeeb"
56572-56618 swd: write: "W SELECT"
56630-56642 swd: ack: "OK"
56662-56868 swd: data: "0x00000000"
56889-56935 swd: write: "W AP4"
56948-56959 swd: ack: "OK"
56979-57186 swd: data: "0x20000360"
57207-57253 swd: write: "W SELECT"
57265-57277 swd: ack: "OK"
57297-57503 swd: data: "0x00000010"
57525-57570 swd: write: "W AP0"
57583-57594 swd: ack: "OK"
57615-57821 swd: data: "0xabbabeeb"
57841-57887 swd: write: "W AP4"
57899-57911 swd: ack: "OK"
57931-58137 swd: data: "0xabbabeeb"
58157-58203 swd: write: "W AP8"
58215-58227 swd: ack: "OK"
58247-58453 swd: data: "0xabbabeeb"
58473-58519 swd: write: "W APc"
58532-58543 swd: ack: "OK"
58563-58770 swd: data: "0xabbabeeb"
58792-58838 swd: write: "W SELECT"
58850-58861 swd: ack: "OK"
58882-59088 swd: data: "0x00000000"
59109-59155 swd: write: "W AP4"
59167-59179 swd: ack: "OK"
59199-59405 swd: data: "0x20000370"
59427-59473 swd: write: "W SELECT"
59485-59497 swd: ack: "OK"
59517-59723 swd: data: "0x00000010"
59745-59790 swd: write: "W AP0"
59803-59814 swd: ack: "OK"
59834-60041 swd: data: "0xabbabeeb"
60061-60106 swd: write: "W AP4"
60119-60130 swd: ack: "OK"
60151-60357 swd: data: "0xabbabeeb"
60377-60423 swd: write: "W AP8"
60435-60447 swd: ack: "OK"
60467-60673 swd: data: "0xabbabeeb"
60693-60739 swd: write: "W APc"
60752-60763 swd: ack: "OK"
60783-60990 swd: data: "0xabbabeeb"
62127-62173 swd: write: "W SELECT"
62185-62197 swd: ack: "OK"
62217-62424 swd: data: "0x00000000"
62445-62490 swd: write: "W AP4"
62503-62514 swd: ack: "OK"
62534-62741 swd: data: "0x20000380"
62762-62808 swd: write: "W SELECT"
62821-62832 swd: ack: "OK"
62852-63059 swd: data: "0x00000010"
63080-63126 swd: write: "W AP0"
63138-63150 swd: ack: "OK"
63170-63376 swd: data: "0xabbabeeb"
63396-63442 swd: write: "W AP4"
63454-63466 swd: ack: "OK"
63486-63692 swd: data: "0xabbabeeb"
63712-63758 swd: write: "W AP8"
63771-63782 swd: ack: "OK"
63802-64009 swd: data: "0xabbabeeb"
64028-64075 swd: write: "W APc"
64087-64099 swd: ack: "OK"
64119-64325 swd: data: "0xabbabeeb"
64347-64393 swd: write: "W SELECT"
64405-64417 swd: ack: "OK"
64437-64643 swd: data: "0x00000000"
64664-64710 swd: write: "W AP4"
64723-64734 swd: ack: "OK"
64754-64961 swd: data: "0x20000390"
64982-65028 swd: write: "W SELECT"
65040-65052 swd: ack: "OK"
65072-65278 swd: data: "0x00000010"
65300-65345 swd: write: "W AP0"
65358-65369 swd: ack: "OK"
65389-65596 swd: data: "0xabbabeeb"
65616-65662 swd: write: "W AP4"
65674-65686 swd: ack: "OK"
65706-65912 swd: data: "0xabbabeeb"
65932-65978 swd: write: "W AP8"
65990-66002 swd: ack: "OK"
66022-66228 swd: data: "0xabbabeeb"
66248-66294 swd: write: "W APc"
66307-66318 swd: ack: "OK"
66338-66545 swd: data: "0xabbabeeb"
66567-66612 swd: write: "W SELECT"
66625-66636 swd: ack: "OK"
66657-66863 swd: data: "0x00000000"
66884-66930 swd: write: "W AP4"
66942-66954 swd: ack: "OK"
66974-67180 swd: data: "0x200003a0"
67202-67247 swd: write: "W SELECT"
67260-67271 swd: ack: "OK"
67292-67498 swd: data: "0x00000010"
67519-67565 swd: write: "W AP0"
67577-67589 swd: ack: "OK"
67609-67816 swd: data: "0xabbabeeb"
67835-67881 swd: write: "W AP4"
67894-67905 swd: ack: "OK"
67925-68132 swd: data: "0xabbabeeb"
68152-68197 swd: write: "W AP8"
68210-68221 swd: ack: "OK"
68242-68448 swd: data: "0xabbabeeb"
68468-68514 swd: write: "W APc"
68526-68538 swd: ack: "OK"
68558-68764 swd: data: "0xabbabeeb"
68786-68832 swd: write: "W SELECT"
68845-68856 swd: ack: "OK"
68876-69083 swd: data: "0x00000000"
69104-69149 swd: write: "W AP4"
69162-69173 swd: ack: "OK"
69194-69400 swd: data: "0x200003b0"
69422-69467 swd: write: "W SELECT"
69480-69491 swd: ack: "OK"
69511-69718 swd: data: "0x00000010"
69739-69785 swd: write: "W AP0"
69797-69809 swd: ack: "OK"
69829-70035 swd: data: "0xabbabeeb"
70055-70101 swd: write: "W AP4"
70114-70125 swd: ack: "OK"
70145-70352 swd: data: "0xabbabeeb"
70372-70417 swd: write: "W AP8"
70430-70441 swd: ack: "OK"
70461-70668 swd: data: "0xabbabeeb"
70688-70734 swd: write: "W APc"
70746-70758 swd: ack: "OK"
70778-70984 swd: data: "0xabbabeeb"
71601-71646 swd: write: "W SELECT"
71659-71670 swd: ack: "OK"
71690-71897 swd: data: "0x00000000"
71918-71964 swd: write: "W AP4"
71976-71988 swd: ack: "OK"
72008-72214 swd: data: "0x200003c0"
72236-72281 swd: write: "W SELECT"
72294-72305 swd: ack: "OK"
72325-72532 swd: data: "0x00000010"
72553-72599 swd: write: "W AP0"
72611-72623 swd: ack: "OK"
72643-72849 swd: data: "0xabbabeeb"
72869-72915 swd: write: "W AP4"
72927-72939 swd: ack: "OK"
72959-73166 swd: data: "0xabbabeeb"
73186-73231 swd: write: "W AP8"
73244-73255 swd: ack: "OK"
73275-73482 swd: data: "0xabbabeeb"
73502-73548 swd: write: "W APc"
73560-73572 swd: ack: "OK"
73592-73798 swd: data: "0xabbabeeb"
73820-73866 swd: write: "W SELECT"
73878-73890 swd: ack: "OK"
73910-74117 swd: data: "0x00000000"
74138-74183 swd: write: "W AP4"
74196-74207 swd: ack: "OK"
74227-74434 swd: data: "0x200003d0"
74455-74501 swd: write: "W SELECT"
74514-74525 swd: ack: "OK"
74545-74752 swd: data: "0x00000010"
74773-74819 swd: write: "W AP0"
74831-74843 swd: ack: "OK"
74863-75069 swd: data: "0xabbabeeb"
75089-75135 swd: write: "W AP4"
75147-75159 swd: ack: "OK"
75179-75385 swd: data: "0xabbabeeb"
75405-75451 swd: write: "W AP8"
75464-75475 swd: ack: "OK"
75495-75702 swd: data: "0xabbabeeb"
75721-75768 swd: write: "W APc"
75780-75792 swd: ack: "OK"
75812-76018 swd: data: "0xabbabeeb"
76040-76086 swd: write: "W SELECT"
76098-76110 swd: ack: "OK"
76130-76336 swd: data: "0x00000000"
76357-76403 swd: write: "W AP4"
76416-76427 swd: ack: "OK"
76447-76654 swd: data: "0x200003e0"
76675-76721 swd: write: "W SELECT"
76733-76745 swd: ack: "OK"
76765-76972 swd: data: "0x00000010"
76993-77039 swd: write: "W AP0"
77051-77063 swd: ack: "OK"
77083-77289 swd: data: "0xabbabeeb"
77309-77355 swd: write: "W AP4"
77367-77379 swd: ack: "OK"
77399-77605 swd: data: "0xabbabeeb"
77625-77671 swd: write: "W AP8"
77683-77695 swd: ack: "OK"
77715-77922 swd: data: "0xabbabeeb"
77941-77987 swd: write: "W APc"
78000-78011 swd: ack: "OK"
78032-78238 swd: data: "0xabbabeeb"
78260-78306 swd: write: "W SELECT"
78318-78330 swd: ack: "OK"
78350-78556 swd: data: "0x00000000"
78577-78623 swd: write: "W AP4"
78635-78647 swd: ack: "OK"
78667-78874 swd: data: "0x200003f0"
78895-78941 swd: write: "W SELECT"
78953-78965 swd: ack: "OK"
78985-79191 swd: data: "0x00000010"
79212-79258 swd: write: "W AP0"
79271-79282 swd: ack: "OK"
79302-79509 swd: data: "0xabbabeeb"
79529-79574 swd: write: "W AP4"
79587-79598 swd: ack: "OK"
79619-79825 swd: data: "0xabbabeeb"
79845-79891 swd: write: "W AP8"
79903-79915 swd: ack: "OK"
79935-80141 swd: data: "0xabbabeeb"
80161-80207 swd: write: "W APc"
80220-80231 swd: ack: "OK"
80251-80458 swd: data: "0xabbabeeb"
86738-86783 swd: write: "W SELECT"
86796-86807 swd: ack: "OK"
86827-87034 swd: data: "0x00000000"
87055-87101 swd: write: "W AP4"
87113-87125 swd: ack: "OK"
87145-87351 swd: data: "0x20000400"
87373-87418 swd: write: "W SELECT"
87431-87442 swd: ack: "OK"
87463-87669 swd: data: "0x00000010"
87690-87736 swd: write: "W AP0"
87748-87760 swd: ack: "OK"
87780-87987 swd: data: "0xabbabeeb"
88007-88052 swd: write: "W AP4"
88065-88076 swd: ack: "OK"
88096-88303 swd: data: "0xabbabeeb"
88323-88368 swd: write: "W AP8"
88381-88392 swd: ack: "OK"
88413-88619 swd: data: "0xabbabeeb"
88639-88685 swd: write: "W APc"
88697-88709 swd: ack: "OK"
88729-88935 swd: data: "0xabbabeeb"
88957-89003 swd: write: "W SELECT"
89016-89027 swd: ack: "OK"
89047-89254 swd: data: "0x00000000"
89275-89321 swd: write: "W AP4"
89333-89344 swd: ack: "OK"
89365-89571 swd: data: "0x20000410"
89592-89638 swd: write: "W SELECT"
89651-89662 swd: ack: "OK"
89682-89889 swd: data: "0x00000010"
89910-89956 swd: write: "W AP0"
89968-89980 swd: ack: "OK"
90000-90206 swd: data: "0xabbabeeb"
90226-90272 swd: write: "W AP4"
90284-90296 swd: ack: "OK"
90316-90522 swd: data: "0xabbabeeb"
90542-90588 swd: write: "W AP8"
90601-90612 swd: ack: "OK"
90632-90839 swd: data: "0xabbabeeb"
90858-90905 swd: write: "W APc"
90917-90929 swd: ack: "OK"
90949-91155 swd: data: "0xabbabeeb"
95579-95625 swd: write: "W SELECT"
95637-95649 swd: ack: "OK"
95669-95876 swd: data: "0x00000000"
95897-95943 swd: write: "W AP4"
95955-95967 swd: ack: "OK"
95987-96193 swd: data: "0x20000020"
96212-96258 swd: write: "W APc"
96271-96282 swd: ack: "OK"
96303-96509 swd: data: "0x20000028"
96538-96584 swd: read: "R CTRL/STAT"
96596-96608 swd: ack: "OK"
96616-96798 swd: data: "0xf0000040"
100201-100247 swd: write: "W AP4"
100259-100271 swd: ack: "OK"
100291-100497 swd: data: "0x20000024"
100517-100563 swd: read: "R APc"
100576-100587 swd: ack: "OK"
100596-100774 swd: data: "0x00000000"
100807-100853 swd: read: "RDBUFF"
100865-100877 swd: ack: "OK"
100885-101067 swd: data: "0x20000298"
106012-106058 swd: write: "W AP4"
106070-106082 swd: ack: "OK"
106102-106308 swd: data: "0x20000028"
106327-106373 swd: write: "W APc"
106386-106397 swd: ack: "OK"
106417-106624 swd: data: "0xabbabeeb"
106653-106698 swd: read: "R CTRL/STAT"
106711-106722 swd: ack: "OK"
106731-106913 swd: data: "0xf0000040"
106955-107001 swd: write: "W AP4"
107014-107025 swd: ack: "OK"
107045-107252 swd: data: "0x2000002c"
107271-107317 swd: write: "W APc"
107329-107341 swd: ack: "OK"
107361-107567 swd: data: "0xabbabeeb"
107596-107642 swd: read: "R CTRL/STAT"
107654-107666 swd: ack: "OK"
107674-107857 swd: data: "0xf0000040"
107901-107947 swd: write: "W AP4"
107959-107971 swd: ack: "OK"
107991-108197 swd: data: "0x20000030"
108216-108262 swd: write: "W APc"
108275-108286 swd: ack: "OK"
108306-108513 swd: data: "0xabbabeeb"
108542-108587 swd: read: "R CTRL/STAT"
108600-108611 swd: ack: "OK"
108620-108802 swd: data: "0xf0000040"
108845-108890 swd: write: "W AP4"
108903-108914 swd: ack: "OK"
108935-109141 swd: data: "0x20000034"
109160-109206 swd: write: "W APc"
109218-109230 swd: ack: "OK"
109250-109456 swd: data: "0xabbabeeb"
109486-109531 swd: read: "R CTRL/STAT"
109544-109555 swd: ack: "OK"
109564-109746 swd: data: "0xf0000040"
113060-113106 swd: write: "W AP4"
113118-113130 swd: ack: "OK"
113150-113356 swd: data: "0x20000020"
113375-113422 swd: write: "W APc"
113434-113445 swd: ack: "OK"
113466-113672 swd: data: "0x20000038"
113701-113747 swd: read: "R CTRL/STAT"
113759-113771 swd: ack: "OK"
113779-113961 swd: data: "0xf0000040"
116191-116237 swd: write: "W AP4"
116249-116261 swd: ack: "OK"
116281-116488 swd: data: "0xe000edf0"
116507-116553 swd: read: "R APc"
116566-116577 swd: ack: "OK"
116586-116765 swd: data: "0x00000000"
116797-116843 swd: read: "RDBUFF"
116856-116867 swd: ack: "OK"
116876-117056 swd: data: "0x01000001"
119195-119240 swd: write: "W AP4"
119253-119264 swd: ack: "OK"
119284-119491 swd: data: "0xe000edf0"
119511-119557 swd: read: "R APc"
119569-119581 swd: ack: "OK"
119589-119768 swd: data: "0x00000000"
119800-119846 swd: read: "RDBUFF"
119859-119870 swd: ack: "OK"
119879-120061 swd: data: "0x01030003"
121041-121087 swd: write: "W AP4"
121099-121111 swd: ack: "OK"
121131-121337 swd: data: "0xe000edf8"
121357-121403 swd: read: "R APc"
121416-121427 swd: ack: "OK"
121436-121615 swd: data: "0x00000000"
121647-121693 swd: read: "RDBUFF"
121705-121717 swd: ack: "OK"
121726-121906 swd: data: "0x20000021"
125074-125119 swd: write: "W AP4"
125132-125143 swd: ack: "OK"
125164-125370 swd: data: "0xe000edf0"
125391-125437 swd: write: "W SELECT"
125449-125461 swd: ack: "OK"
125481-125688 swd: data: "0x00000010"
125708-125754 swd: write: "W AP4"
125767-125778 swd: ack: "OK"
125798-126005 swd: data: "0x00000000"
126025-126071 swd: read: "R AP8"
126083-126095 swd: ack: "OK"
126103-126282 swd: data: "0x00000000"
126315-126361 swd: read: "RDBUFF"
126373-126385 swd: ack: "OK"
126393-126572 swd: data: "0x00000000"
128064-128109 swd: write: "W SELECT"
128122-128133 swd: ack: "OK"
128153-128360 swd: data: "0x00000000"
128382-128428 swd: write: "W AP4"
128440-128452 swd: ack: "OK"
128472-128678 swd: data: "0xe000edf0"
128700-128745 swd: write: "W SELECT"
128758-128769 swd: ack: "OK"
128790-128996 swd: data: "0x00000010"
129017-129062 swd: write: "W AP4"
129075-129086 swd: ack: "OK"
129107-129313 swd: data: "0x00000001"
129333-129379 swd: read: "R AP8"
129392-129403 swd: ack: "OK"
129412-129590 swd: data: "0x00000000"
129623-129669 swd: read: "RDBUFF"
129681-129693 swd: ack: "OK"
129701-129882 swd: data: "0x20000020"
131042-131088 swd: write: "W SELECT"
131100-131112 swd: ack: "OK"
131132-131338 swd: data: "0x00000000"
131361-131406 swd: write: "W AP4"
131419-131430 swd: ack: "OK"
131451-131657 swd: data: "0xe000edf0"
131678-131724 swd: write: "W SELECT"
131736-131748 swd: ack: "OK"
131768-131975 swd: data: "0x00000010"
131995-132041 swd: write: "W AP4"
132054-132065 swd: ack: "OK"
132085-132292 swd: data: "0x00000002"
132312-132358 swd: read: "R AP8"
132370-132382 swd: ack: "OK"
132390-132569 swd: data: "0x00000000"
132601-132648 swd: read: "RDBUFF"
132660-132672 swd: ack: "OK"
132680-132861 swd: data: "0x20000420"
135032-135078 swd: write: "W SELECT"
135090-135102 swd: ack: "OK"
135122-135328 swd: data: "0x00000000"
135350-135396 swd: write: "W AP4"
135409-135420 swd: ack: "OK"
135440-135647 swd: data: "0xe000edf0"
135668-135714 swd: write: "W SELECT"
135726-135738 swd: ack: "OK"
135758-135964 swd: data: "0x00000010"
135985-136031 swd: write: "W AP4"
136043-136055 swd: ack: "OK"
136075-136281 swd: data: "0x00000003"
136302-136348 swd: read: "R AP8"
136360-136372 swd: ack: "OK"
136380-136559 swd: data: "0x00000000"
136591-136638 swd: read: "RDBUFF"
136650-136661 swd: ack: "OK"
136670-136850 swd: data: "0x00001400"
138152-138198 swd: write: "W SELECT"
138210-138222 swd: ack: "OK"
138242-138448 swd: data: "0x00000000"
138471-138516 swd: write: "W AP4"
138529-138540 swd: ack: "OK"
138560-138767 swd: data: "0xe000edf0"
138788-138834 swd: write: "W SELECT"
138846-138858 swd: ack: "OK"
138878-139084 swd: data: "0x00000010"
139105-139151 swd: write: "W AP4"
139163-139175 swd: ack: "OK"
139195-139402 swd: data: "0x00000004"
139422-139468 swd: read: "R AP8"
139480-139492 swd: ack: "OK"
139500-139679 swd: data: "0x00000000"
139711-139757 swd: read: "RDBUFF"
139770-139781 swd: ack: "OK"
139790-139971 swd: data: "0x20000038"
141091-141137 swd: write: "W SELECT"
141149-141160 swd: ack: "OK"
141181-141387 swd: data: "0x00000000"
141409-141455 swd: write: "W AP4"
141467-141479 swd: ack: "OK"
141499-141706 swd: data: "0xe000edf0"
141727-141773 swd: write: "W SELECT"
141785-141796 swd: ack: "OK"
141817-142023 swd: data: "0x00000010"
142044-142090 swd: write: "W AP4"
142102-142114 swd: ack: "OK"
142134-142340 swd: data: "0x00000005"
142360-142407 swd: read: "R AP8"
142419-142431 swd: ack: "OK"
142439-142618 swd: data: "0x00000000"
142650-142696 swd: read: "RDBUFF"
142709-142720 swd: ack: "OK"
142729-142922 swd: data: "0xabbabeeb"
144270-144315 swd: write: "W SELECT"
144328-144339 swd: ack: "OK"
144359-144566 swd: data: "0x00000000"
144588-144634 swd: write: "W AP4"
144646-144658 swd: ack: "OK"
144678-144884 swd: data: "0xe000edf0"
144906-144951 swd: write: "W SELECT"
144964-144975 swd: ack: "OK"
144995-145202 swd: data: "0x00000010"
145223-145268 swd: write: "W AP4"
145281-145292 swd: ack: "OK"
145313-145519 swd: data: "0x00000006"
145539-145585 swd: read: "R AP8"
145598-145609 swd: ack: "OK"
145618-145797 swd: data: "0x00000000"
145829-145875 swd: read: "RDBUFF"
145888-145899 swd: ack: "OK"
145908-146108 swd: data: "0xffffffff"
147317-147363 swd: write: "W SELECT"
147375-147387 swd: ack: "OK"
147407-147613 swd: data: "0x00000000"
147635-147681 swd: write: "W AP4"
147694-147705 swd: ack: "OK"
147725-147932 swd: data: "0xe000edf0"
147953-147999 swd: write: "W SELECT"
148011-148023 swd: ack: "OK"
148043-148249 swd: data: "0x00000010"
148270-148316 swd: write: "W AP4"
148328-148340 swd: ack: "OK"
148360-148566 swd: data: "0x00000007"
148586-148633 swd: read: "R AP8"
148645-148657 swd: ack: "OK"
148665-148844 swd: data: "0x00000000"
148876-148922 swd: read: "RDBUFF"
148935-148946 swd: ack: "OK"
148955-149155 swd: data: "0xffffffff"
151058-151104 swd: write: "W SELECT"
151116-151128 swd: ack: "OK"
151148-151354 swd: data: "0x00000000"
151377-151422 swd: write: "W AP4"
151435-151446 swd: ack: "OK"
151466-151673 swd: data: "0xe000edf0"
151694-151740 swd: write: "W SELECT"
151752-151764 swd: ack: "OK"
151784-151990 swd: data: "0x00000010"
152011-152057 swd: write: "W AP4"
152069-152081 swd: ack: "OK"
152101-152308 swd: data: "0x00000008"
152328-152374 swd: read: "R AP8"
152386-152398 swd: ack: "OK"
152406-152585 swd: data: "0x00000000"
152617-152663 swd: read: "RDBUFF"
152676-152687 swd: ack: "OK"
152697-152896 swd: data: "0xffffffff"
154029-154074 swd: write: "W SELECT"
154087-154098 swd: ack: "OK"
154119-154325 swd: data: "0x00000000"
154347-154393 swd: write: "W AP4"
154405-154417 swd: ack: "OK"
154437-154643 swd: data: "0xe000edf0"
154665-154710 swd: write: "W SELECT"
154723-154734 swd: ack: "OK"
154755-154961 swd: data: "0x00000010"
154982-155028 swd: write: "W AP4"
155040-155052 swd: ack: "OK"
155072-155278 swd: data: "0x00000009"
155298-155345 swd: read: "R AP8"
155357-155368 swd: ack: "OK"
155377-155556 swd: data: "0x00000000"
155588-155634 swd: read: "RDBUFF"
155647-155658 swd: ack: "OK"
155667-155867 swd: data: "0xffffffff"
157822-157867 swd: write: "W SELECT"
157880-157891 swd: ack: "OK"
157911-158118 swd: data: "0x00000000"
158140-158186 swd: write: "W AP4"
158198-158210 swd: ack: "OK"
158230-158436 swd: data: "0xe000edf0"
158458-158503 swd: write: "W SELECT"
158516-158527 swd: ack: "OK"
158548-158754 swd: data: "0x00000010"
158775-158820 swd: write: "W AP4"
158833-158844 swd: ack: "OK"
158865-159071 swd: data: "0x0000000a"
159091-159137 swd: read: "R AP8"
159150-159161 swd: ack: "OK"
159170-159349 swd: data: "0x00000000"
159381-159427 swd: read: "RDBUFF"
159440-159451 swd: ack: "OK"
159460-159660 swd: data: "0xffffffff"
161252-161298 swd: write: "W SELECT"
161310-161322 swd: ack: "OK"
161342-161548 swd: data: "0x00000000"
161570-161616 swd: write: "W AP4"
161628-161640 swd: ack: "OK"
161660-161867 swd: data: "0xe000edf0"
161888-161934 swd: write: "W SELECT"
161946-161958 swd: ack: "OK"
161978-162184 swd: data: "0x00000010"
162205-162251 swd: write: "W AP4"
162263-162275 swd: ack: "OK"
162295-162501 swd: data: "0x0000000b"
162521-162567 swd: read: "R AP8"
162580-162591 swd: ack: "OK"
162600-162779 swd: data: "0x00000000"
162811-162857 swd: read: "RDBUFF"
162870-162881 swd: ack: "OK"
162890-163090 swd: data: "0xffffffff"
164039-164085 swd: write: "W SELECT"
164097-164109 swd: ack: "OK"
164129-164335 swd: data: "0x00000000"
164357-164403 swd: write: "W AP4"
164416-164427 swd: ack: "OK"
164447-164654 swd: data: "0xe000edf0"
164675-164721 swd: write: "W SELECT"
164733-164745 swd: ack: "OK"
164765-164971 swd: data: "0x00000010"
164992-165038 swd: write: "W AP4"
165050-165062 swd: ack: "OK"
165082-165288 swd: data: "0x0000000c"
165309-165355 swd: read: "R AP8"
165367-165379 swd: ack: "OK"
165387-165566 swd: data: "0x00000000"
165598-165645 swd: read: "RDBUFF"
165657-165668 swd: ack: "OK"
165678-165877 swd: data: "0xffffffff"
167360-167405 swd: write: "W SELECT"
167418-167429 swd: ack: "OK"
167450-167656 swd: data: "0x00000000"
167678-167724 swd: write: "W AP4"
167736-167748 swd: ack: "OK"
167768-167974 swd: data: "0xe000edf0"
167996-168041 swd: write: "W SELECT"
168054-168065 swd: ack: "OK"
168086-168292 swd: data: "0x00000010"
168313-168359 swd: write: "W AP4"
168371-168383 swd: ack: "OK"
168403-168609 swd: data: "0x0000000d"
168629-168675 swd: read: "R AP8"
168688-168699 swd: ack: "OK"
168708-168887 swd: data: "0x00000000"
168919-168965 swd: read: "RDBUFF"
168978-168989 swd: ack: "OK"
168998-169190 swd: data: "0xabbabee8"
171037-171082 swd: write: "W SELECT"
171095-171106 swd: ack: "OK"
171126-171333 swd: data: "0x00000000"
171355-171401 swd: write: "W AP4"
171413-171425 swd: ack: "OK"
171445-171651 swd: data: "0xe000edf0"
171673-171718 swd: write: "W SELECT"
171731-171742 swd: ack: "OK"
171762-171969 swd: data: "0x00000010"
171990-172035 swd: write: "W AP4"
172048-172059 swd: ack: "OK"
172080-172286 swd: data: "0x0000000e"
172306-172352 swd: read: "R AP8"
172364-172376 swd: ack: "OK"
172384-172563 swd: data: "0x00000000"
172596-172642 swd: read: "RDBUFF"
172654-172666 swd: ack: "OK"
172675-172874 swd: data: "0xffffffff"
175392-175438 swd: write: "W SELECT"
175451-175462 swd: ack: "OK"
175482-175689 swd: data: "0x00000000"
175711-175757 swd: write: "W AP4"
175769-175781 swd: ack: "OK"
175801-176007 swd: data: "0xe000edf0"
176028-176074 swd: write: "W SELECT"
176087-176098 swd: ack: "OK"
176118-176325 swd: data: "0x00000010"
176346-176391 swd: write: "W AP4"
176404-176415 swd: ack: "OK"
176435-176642 swd: data: "0x0000000f"
176662-176708 swd: read: "R AP8"
176721-176732 swd: ack: "OK"
176741-176919 swd: data: "0x00000000"
176952-176998 swd: read: "RDBUFF"
177010-177022 swd: ack: "OK"
177030-177213 swd: data: "0x2000001e"
179048-179094 swd: write: "W SELECT"
179106-179118 swd: ack: "OK"
179138-179345 swd: data: "0x00000000"
179367-179412 swd: write: "W AP4"
179425-179436 swd: ack: "OK"
179457-179663 swd: data: "0xe000edf0"
179684-179730 swd: write: "W SELECT"
179742-179754 swd: ack: "OK"
179774-179981 swd: data: "0x00000010"
180001-180047 swd: write: "W AP4"
180060-180071 swd: ack: "OK"
180091-180298 swd: data: "0x00000010"
180318-180364 swd: read: "R AP8"
180376-180388 swd: ack: "OK"
180396-180575 swd: data: "0x00000000"
180608-180654 swd: read: "RDBUFF"
180666-180678 swd: ack: "OK"
180686-180867 swd: data: "0x61000000"
183027-183073 swd: write: "W SELECT"
183085-183097 swd: ack: "OK"
183117-183323 swd: data: "0x00000000"
183345-183391 swd: write: "W AP4"
183403-183415 swd: ack: "OK"
183435-183642 swd: data: "0xe000edf0"
183663-183709 swd: write: "W SELECT"
183721-183733 swd: ack: "OK"
183753-183959 swd: data: "0x00000010"
183980-184026 swd: write: "W AP4"
184038-184050 swd: ack: "OK"
184070-184276 swd: data: "0x00000011"
184297-184343 swd: read: "R AP8"
184355-184367 swd: ack: "OK"
184375-184554 swd: data: "0x00000000"
184586-184632 swd: read: "RDBUFF"
184645-184656 swd: ack: "OK"
184665-184857 swd: data: "0xabbabee8"
186321-186367 swd: write: "W SELECT"
186379-186391 swd: ack: "OK"
186411-186617 swd: data: "0x00000000"
186639-186685 swd: write: "W AP4"
186697-186709 swd: ack: "OK"
186729-186936 swd: data: "0xe000edf0"
186957-187003 swd: write: "W SELECT"
187015-187027 swd: ack: "OK"
187047-187253 swd: data: "0x00000010"
187274-187320 swd: write: "W AP4"
187332-187344 swd: ack: "OK"
187364-187570 swd: data: "0x00000012"
187590-187637 swd: read: "R AP8"
187649-187661 swd: ack: "OK"
187669-187848 swd: data: "0x00000000"
187880-187926 swd: read: "RDBUFF"
187939-187950 swd: ack: "OK"
187959-188158 swd: data: "0xfffffffc"
189033-189079 swd: write: "W SELECT"
189091-189103 swd: ack: "OK"
189123-189329 swd: data: "0x00000000"
189351-189397 swd: write: "W AP4"
189410-189421 swd: ack: "OK"
189441-189648 swd: data: "0xe000edf0"
189669-189715 swd: write: "W SELECT"
189727-189739 swd: ack: "OK"
189759-189965 swd: data: "0x00000010"
189986-190032 swd: write: "W AP4"
190044-190056 swd: ack: "OK"
190076-190282 swd: data: "0x00000014"
190303-190349 swd: read: "R AP8"
190361-190373 swd: ack: "OK"
190381-190560 swd: data: "0x00000000"
190592-190639 swd: read: "RDBUFF"
190651-190663 swd: ack: "OK"
190671-190850 swd: data: "0x00000000"
192052-192097 swd: write: "W SELECT"
192110-192121 swd: ack: "OK"
192141-192348 swd: data: "0x00000000"
192370-192416 swd: write: "W AP4"
192428-192440 swd: ack: "OK"
192460-192666 swd: data: "0xe000edf0"
192688-192733 swd: write: "W SELECT"
192746-192757 swd: ack: "OK"
192777-192984 swd: data: "0x00000010"
193005-193050 swd: write: "W AP4"
193063-193074 swd: ack: "OK"
193095-193301 swd: data: "0x00000014"
193321-193367 swd: read: "R AP8"
193380-193391 swd: ack: "OK"
193400-193579 swd: data: "0x00000000"
193611-193657 swd: read: "RDBUFF"
193670-193681 swd: ack: "OK"
193690-193868 swd: data: "0x00000000"
195057-195102 swd: write: "W SELECT"
195115-195126 swd: ack: "OK"
195146-195353 swd: data: "0x00000000"
195375-195421 swd: write: "W AP4"
195433-195445 swd: ack: "OK"
195465-195671 swd: data: "0xe000edf0"
195693-195738 swd: write: "W SELECT"
195751-195762 swd: ack: "OK"
195782-195989 swd: data: "0x00000010"
196010-196055 swd: write: "W AP4"
196068-196079 swd: ack: "OK"
196100-196306 swd: data: "0x00000014"
196326-196372 swd: read: "R AP8"
196385-196396 swd: ack: "OK"
196405-196584 swd: data: "0x00000000"
196616-196662 swd: read: "RDBUFF"
196675-196686 swd: ack: "OK"
196695-196873 swd: data: "0x00000000"
199031-199077 swd: write: "W SELECT"
199089-199101 swd: ack: "OK"
199121-199328 swd: data: "0x00000000"
199350-199396 swd: write: "W AP4"
199408-199419 swd: ack: "OK"
199440-199646 swd: data: "0xe000edf0"
199667-199713 swd: write: "W SELECT"
199726-199737 swd: ack: "OK"
199757-199964 swd: data: "0x00000010"
199985-200030 swd: write: "W AP4"
200043-200054 swd: ack: "OK"
200074-200281 swd: data: "0x00000014"
200301-200347 swd: read: "R AP8"
200360-200371 swd: ack: "OK"
200380-200558 swd: data: "0x00000000"
200591-200637 swd: read: "RDBUFF"
200649-200661 swd: ack: "OK"
200669-200848 swd: data: "0x00000000"
202055-202101 swd: write: "W SELECT"
202114-202125 swd: ack: "OK"
202145-202352 swd: data: "0x00000000"
202373-202419 swd: write: "W AP4"
202431-202443 swd: ack: "OK"
202463-202670 swd: data: "0xe000edfc"
202688-202734 swd: write: "W APc"
202747-202758 swd: ack: "OK"
202778-202985 swd: data: "0x01000000"
203014-203059 swd: read: "R CTRL/STAT"
203072-203083 swd: ack: "OK"
203092-203274 swd: data: "0xf0000040"
205832-205878 swd: write: "W AP4"
205890-205902 swd: ack: "OK"
205922-206128 swd: data: "0xe000edf0"
206149-206195 swd: write: "W SELECT"
206208-206219 swd: ack: "OK"
206239-206446 swd: data: "0x00000010"
206467-206512 swd: write: "W AP4"
206525-206536 swd: ack: "OK"
206556-206763 swd: data: "0x0000000f"
206783-206829 swd: read: "R AP8"
206842-206853 swd: ack: "OK"
206862-207040 swd: data: "0x00000000"
207073-207119 swd: read: "RDBUFF"
207131-207143 swd: ack: "OK"
207151-207334 swd: data: "0x2000001e"
209950-209995 swd: write: "W SELECT"
210008-210019 swd: ack: "OK"
210040-210246 swd: data: "0x00000000"
210267-210313 swd: write: "W AP4"
210326-210337 swd: ack: "OK"
210357-210564 swd: data: "0x4001e504"
210583-210629 swd: write: "W APc"
210641-210653 swd: ack: "OK"
210673-210879 swd: data: "0x00000000"
210908-210954 swd: read: "R CTRL/STAT"
210966-210978 swd: ack: "OK"
210986-211169 swd: data: "0xf0000040"
215391-215437 swd: write: "W AP4"
215449-215461 swd: ack: "OK"
215481-215688 swd: data: "0x4001e400"
215708-215754 swd: read: "R APc"
215766-215778 swd: ack: "OK"
215786-215965 swd: data: "0x00000000"
215997-216043 swd: read: "RDBUFF"
216056-216067 swd: ack: "OK"
216076-216255 swd: data: "0x00000001"
219323-219368 swd: write: "W AP4"
219381-219392 swd: ack: "OK"
219413-219619 swd: data: "0x00000c00"
219641-219687 swd: write: "W SELECT"
219699-219711 swd: ack: "OK"
219731-219937 swd: data: "0x00000010"
219959-220005 swd: read: "R AP0"
220017-220029 swd: ack: "OK"
220037-220216 swd: data: "0x00000000"
220249-220295 swd: read: "R AP4"
220307-220319 swd: ack: "OK"
220328-220521 swd: data: "0xabbabeeb"
220554-220600 swd: read: "R AP8"
220612-220624 swd: ack: "OK"
220633-220826 swd: data: "0xabbabeeb"
220859-220905 swd: read: "R APc"
220917-220929 swd: ack: "OK"
220938-221131 swd: data: "0xabbabeeb"
221163-221209 swd: read: "RDBUFF"
221222-221233 swd: ack: "OK"
221242-221435 swd: data: "0xabbabeeb"
221470-221516 swd: write: "W SELECT"
221529-221540 swd: ack: "OK"
221560-221767 swd: data: "0x00000000"
221788-221833 swd: write: "W AP4"
221846-221857 swd: ack: "OK"
221878-222084 swd: data: "0x00000c10"
222106-222152 swd: write: "W SELECT"
222164-222176 swd: ack: "OK"
222196-222402 swd: data: "0x00000010"
222424-222470 swd: read: "R AP0"
222482-222494 swd: ack: "OK"
222502-222681 swd: data: "0x00000000"
222714-222760 swd: read: "R AP4"
222772-222784 swd: ack: "OK"
222793-222986 swd: data: "0xabbabeeb"
223019-223065 swd: read: "R AP8"
223077-223089 swd: ack: "OK"
223098-223291 swd: data: "0xabbabeeb"
223324-223370 swd: read: "R APc"
223382-223394 swd: ack: "OK"
223403-223596 swd: data: "0xabbabeeb"
223628-223674 swd: read: "RDBUFF"
223687-223698 swd: ack: "OK"
223707-223900 swd: data: "0xabbabeeb"
223935-223981 swd: write: "W SELECT"
223993-224005 swd: ack: "OK"
224025-224232 swd: data: "0x00000000"
224253-224298 swd: write: "W AP4"
224311-224322 swd: ack: "OK"
224343-224549 swd: data: "0x00000c20"
224571-224617 swd: write: "W SELECT"
224629-224641 swd: ack: "OK"
224661-224867 swd: data: "0x00000010"
224889-224935 swd: read: "R AP0"
224947-224959 swd: ack: "OK"
224967-225146 swd: data: "0x00000000"
225178-225225 swd: read: "R AP4"
225237-225249 swd: ack: "OK"
225258-225451 swd: data: "0xabbabeeb"
225483-225530 swd: read: "R AP8"
225542-225554 swd: ack: "OK"
225563-225755 swd: data: "0xabbabeeb"
225789-225835 swd: read: "R APc"
225847-225859 swd: ack: "OK"
225868-226061 swd: data: "0xabbabeeb"
226093-226139 swd: read: "RDBUFF"
226151-226163 swd: ack: "OK"
226172-226365 swd: data: "0xabbabeeb"
226400-226446 swd: write: "W SELECT"
226458-226470 swd: ack: "OK"
226490-226696 swd: data: "0x00000000"
226718-226763 swd: write: "W AP4"
226776-226787 swd: ack: "OK"
226807-227014 swd: data: "0x00000c30"
227036-227082 swd: write: "W SELECT"
227094-227106 swd: ack: "OK"
227126-227332 swd: data: "0x00000010"
227354-227400 swd: read: "R AP0"
227412-227424 swd: ack: "OK"
227432-227611 swd: data: "0x00000000"
227644-227690 swd: read: "R AP4"
227702-227714 swd: ack: "OK"
227723-227916 swd: data: "0xabbabeeb"
227948-227995 swd: read: "R AP8"
228007-228019 swd: ack: "OK"
228028-228221 swd: data: "0xabbabeeb"
228254-228300 swd: read: "R APc"
228312-228324 swd: ack: "OK"
228333-228526 swd: data: "0xabbabeeb"
228558-228604 swd: read: "RDBUFF"
228616-228628 swd: ack: "OK"
228637-228830 swd: data: "0xabbabeeb"
228865-228911 swd: write: "W SELECT"
228923-228935 swd: ack: "OK"
228955-229162 swd: data: "0x00000000"
229183-229228 swd: write: "W AP4"
229241-229252 swd: ack: "OK"
229272-229479 swd: data: "0x00000c40"
229501-229547 swd: write: "W SELECT"
229559-229571 swd: ack: "OK"
229591-229797 swd: data: "0x00000010"
229819-229865 swd: read: "R AP0"
229877-229889 swd: ack: "OK"
229897-230076 swd: data: "0x00000000"
230108-230155 swd: read: "R AP4"
230167-230179 swd: ack: "OK"
230188-230381 swd: data: "0xabbabeeb"
230413-230460 swd: read: "R AP8"
230472-230483 swd: ack: "OK"
230493-230685 swd: data: "0xabbabeeb"
230719-230765 swd: read: "R APc"
230777-230789 swd: ack: "OK"
230798-230991 swd: data: "0xabbabeeb"
231023-231069 swd: read: "RDBUFF"
231081-231093 swd: ack: "OK"
231102-231295 swd: data: "0xabbabeeb"
231330-231376 swd: write: "W SELECT"
231388-231400 swd: ack: "OK"
231420-231626 swd: data: "0x00000000"
231647-231693 swd: write: "W AP4"
231706-231717 swd: ack: "OK"
231737-231944 swd: data: "0x00000c50"
231966-232012 swd: write: "W SELECT"
232024-232036 swd: ack: "OK"
232056-232262 swd: data: "0x00000010"
232284-232330 swd: read: "R AP0"
232342-232354 swd: ack: "OK"
232362-232541 swd: data: "0x00000000"
232574-232620 swd: read: "R AP4"
232632-232644 swd: ack: "OK"
232653-232846 swd: data: "0xabbabeeb"
232878-232925 swd: read: "R AP8"
232937-232949 swd: ack: "OK"
232958-233151 swd: data: "0xabbabeeb"
233184-233230 swd: read: "R APc"
233242-233254 swd: ack: "OK"
233263-233456 swd: data: "0xabbabeeb"
233488-233534 swd: read: "RDBUFF"
233546-233558 swd: ack: "OK"
233567-233760 swd: data: "0xabbabeeb"
233795-233841 swd: write: "W SELECT"
233853-233865 swd: ack: "OK"
233885-234091 swd: data: "0x00000000"
234113-234158 swd: write: "W AP4"
234171-234182 swd: ack: "OK"
234202-234409 swd: data: "0x00000c60"
234431-234477 swd: write: "W SELECT"
234489-234501 swd: ack: "OK"
234521-234727 swd: data: "0x00000010"
234749-234795 swd: read: "R AP0"
234807-234819 swd: ack: "OK"
234827-235006 swd: data: "0x00000000"
235039-235085 swd: read: "R AP4"
235097-235109 swd: ack: "OK"
235118-235311 swd: data: "0xabbabeeb"
235344-235390 swd: read: "R AP8"
235402-235414 swd: ack: "OK"
235423-235616 swd: data: "0xabbabeeb"
235649-235695 swd: read: "R APc"
235707-235719 swd: ack: "OK"
235728-235921 swd: data: "0xabbabeeb"
235953-235999 swd: read: "RDBUFF"
236012-236023 swd: ack: "OK"
236032-236225 swd: data: "0xabbabeeb"
236260-236306 swd: write: "W SELECT"
236318-236330 swd: ack: "OK"
236350-236557 swd: data: "0x00000000"
236578-236623 swd: write: "W AP4"
236636-236647 swd: ack: "OK"
236668-236874 swd: data: "0x00000c70"
236896-236942 swd: write: "W SELECT"
236954-236966 swd: ack: "OK"
236986-237192 swd: data: "0x00000010"
237214-237260 swd: read: "R AP0"
237272-237284 swd: ack: "OK"
237292-237471 swd: data: "0x00000000"
237504-237550 swd: read: "R AP4"
237562-237574 swd: ack: "OK"
237583-237776 swd: data: "0xabbabeeb"
237808-237855 swd: read: "R AP8"
237867-237879 swd: ack: "OK"
237888-238081 swd: data: "0xabbabeeb"
238114-238160 swd: read: "R APc"
238172-238184 swd: ack: "OK"
238193-238386 swd: data: "0xabbabeeb"
238418-238464 swd: read: "RDBUFF"
238476-238488 swd: ack: "OK"
238497-238690 swd: data: "0xabbabeeb"
238725-238771 swd: write: "W SELECT"
238783-238795 swd: ack: "OK"
238815-239021 swd: data: "0x00000000"
239043-239088 swd: write: "W AP4"
239101-239112 swd: ack: "OK"
239132-239339 swd: data: "0x00000c80"
239361-239406 swd: write: "W SELECT"
239419-239430 swd: ack: "OK"
239451-239657 swd: data: "0x00000010"
239679-239725 swd: read: "R AP0"
239737-239749 swd: ack: "OK"
239757-239936 swd: data: "0x00000000"
239968-240015 swd: read: "R AP4"
240027-240039 swd: ack: "OK"
240048-240240 swd: data: "0xabbabeeb"
240273-240319 swd: read: "R AP8"
240332-240343 swd: ack: "OK"
240353-240545 swd: data: "0xabbabeeb"
240578-240625 swd: read: "R APc"
240637-240649 swd: ack: "OK"
240658-240851 swd: data: "0xabbabeeb"
240883-240929 swd: read: "RDBUFF"
240941-240953 swd: ack: "OK"
240962-241155 swd: data: "0xabbabeeb"
241190-241236 swd: write: "W SELECT"
241248-241260 swd: ack: "OK"
241280-241486 swd: data: "0x00000000"
241507-241553 swd: write: "W AP4"
241566-241577 swd: ack: "OK"
241597-241804 swd: data: "0x00000c90"
241826-241872 swd: write: "W SELECT"
241884-241896 swd: ack: "OK"
241916-242122 swd: data: "0x00000010"
242144-242190 swd: read: "R AP0"
242202-242214 swd: ack: "OK"
242222-242401 swd: data: "0x00000000"
242433-242480 swd: read: "R AP4"
242492-242504 swd: ack: "OK"
242513-242706 swd: data: "0xabbabeeb"
242738-242785 swd: read: "R AP8"
242797-242809 swd: ack: "OK"
242818-243010 swd: data: "0xabbabeeb"
243044-243090 swd: read: "R APc"
243102-243114 swd: ack: "OK"
243123-243316 swd: data: "0xabbabeeb"
243348-243394 swd: read: "RDBUFF"
243406-243418 swd: ack: "OK"
243427-243620 swd: data: "0xabbabeeb"
243655-243701 swd: write: "W SELECT"
243713-243725 swd: ack: "OK"
243745-243951 swd: data: "0x00000000"
243973-244018 swd: write: "W AP4"
244031-244042 swd: ack: "OK"
244062-244269 swd: data: "0x00000ca0"
244291-244337 swd: write: "W SELECT"
244349-244361 swd: ack: "OK"
244381-244587 swd: data: "0x00000010"
244609-244655 swd: read: "R AP0"
244667-244679 swd: ack: "OK"
244687-244866 swd: data: "0x00000000"
244899-244945 swd: read: "R AP4"
244957-244969 swd: ack: "OK"
244978-245171 swd: data: "0xabbabeeb"
245203-245250 swd: read: "R AP8"
245262-245274 swd: ack: "OK"
245283-245476 swd: data: "0xabbabeeb"
245509-245555 swd: read: "R APc"
245567-245579 swd: ack: "OK"
245588-245781 swd: data: "0xabbabeeb"
245813-245859 swd: read: "RDBUFF"
245871-245883 swd: ack: "OK"
245892-246085 swd: data: "0xabbabeeb"
246120-246166 swd: write: "W SELECT"
246178-246190 swd: ack: "OK"
246210-246417 swd: data: "0x00000000"
246438-246483 swd: write: "W AP4"
246496-246507 swd: ack: "OK"
246527-246734 swd: data: "0x00000cb0"
246756-246802 swd: write: "W SELECT"
246814-246826 swd: ack: "OK"
246846-247052 swd: data: "0x00000010"
247074-247120 swd: read: "R AP0"
247132-247144 swd: ack: "OK"
247152-247331 swd: data: "0x00000000"
247363-247410 swd: read: "R AP4"
247422-247434 swd: ack: "OK"
247443-247636 swd: data: "0xabbabeeb"
247668-247715 swd: read: "R AP8"
247727-247738 swd: ack: "OK"
247748-247940 swd: data: "0xabbabeeb"
247974-248020 swd: read: "R APc"
248032-248044 swd: ack: "OK"
248053-248246 swd: data: "0xabbabeeb"
248278-248324 swd: read: "RDBUFF"
248336-248348 swd: ack: "OK"
248357-248550 swd: data: "0xabbabeeb"
248585-248631 swd: write: "W SELECT"
248643-248655 swd: ack: "OK"
248675-248881 swd: data: "0x00000000"
248902-248948 swd: write: "W AP4"
248961-248972 swd: ack: "OK"
248992-249199 swd: data: "0x00000cc0"
249221-249267 swd: write: "W SELECT"
249279-249291 swd: ack: "OK"
249311-249517 swd: data: "0x00000010"
249539-249585 swd: read: "R AP0"
249597-249609 swd: ack: "OK"
249617-249796 swd: data: "0x00000000"
249829-249875 swd: read: "R AP4"
249887-249899 swd: ack: "OK"
249908-250101 swd: data: "0xabbabeeb"
250133-250180 swd: read: "R AP8"
250192-250204 swd: ack: "OK"
250213-250406 swd: data: "0xabbabeeb"
250439-250485 swd: read: "R APc"
250497-250509 swd: ack: "OK"
250518-250711 swd: data: "0xabbabeeb"
250743-250789 swd: read: "RDBUFF"
250801-250813 swd: ack: "OK"
250822-251015 swd: data: "0xabbabeeb"
251050-251096 swd: write: "W SELECT"
251108-251120 swd: ack: "OK"
251140-251346 swd: data: "0x00000000"
251368-251413 swd: write: "W AP4"
251426-251437 swd: ack: "OK"
251457-251664 swd: data: "0x00000cd0"
251686-251732 swd: write: "W SELECT"
251744-251755 swd: ack: "OK"
251776-251982 swd: data: "0x00000010"
252004-252050 swd: read: "R AP0"
252062-252074 swd: ack: "OK"
252082-252261 swd: data: "0x00000000"
252293-252340 swd: read: "R AP4"
252352-252364 swd: ack: "OK"
252373-252565 swd: data: "0xabbabeeb"
252598-252644 swd: read: "R AP8"
252657-252668 swd: ack: "OK"
252678-252870 swd: data: "0xabbabeeb"
252903-252950 swd: read: "R APc"
252962-252974 swd: ack: "OK"
252983-253176 swd: data: "0xabbabeeb"
253208-253254 swd: read: "RDBUFF"
253266-253278 swd: ack: "OK"
253287-253480 swd: data: "0xabbabeeb"
253515-253561 swd: write: "W SELECT"
253573-253585 swd: ack: "OK"
253605-253811 swd: data: "0x00000000"
253832-253878 swd: write: "W AP4"
253891-253902 swd: ack: "OK"
253922-254129 swd: data: "0x00000ce0"
254151-254196 swd: write: "W SELECT"
254209-254220 swd: ack: "OK"
254241-254447 swd: data: "0x00000010"
254469-254515 swd: read: "R AP0"
254527-254539 swd: ack: "OK"
254547-254726 swd: data: "0x00000000"
254758-254804 swd: read: "R AP4"
254817-254828 swd: ack: "OK"
254838-255030 swd: data: "0xabbabeeb"
255063-255109 swd: read: "R AP8"
255122-255133 swd: ack: "OK"
255142-255335 swd: data: "0xabbabeeb"
255368-255415 swd: read: "R APc"
255427-255438 swd: ack: "OK"
255448-255640 swd: data: "0xabbabeeb"
255673-255719 swd: read: "RDBUFF"
255731-255743 swd: ack: "OK"
255752-255945 swd: data: "0xabbabeeb"
255980-256026 swd: write: "W SELECT"
256038-256050 swd: ack: "OK"
256070-256276 swd: data: "0x00000000"
256297-256343 swd: write: "W AP4"
256355-256367 swd: ack: "OK"
256387-256594 swd: data: "0x00000cf0"
256616-256661 swd: write: "W SELECT"
256674-256685 swd: ack: "OK"
256706-256912 swd: data: "0x00000010"
256934-256980 swd: read: "R AP0"
256992-257004 swd: ack: "OK"
257012-257191 swd: data: "0x00000000"
257223-257270 swd: read: "R AP4"
257282-257294 swd: ack: "OK"
257303-257495 swd: data: "0xabbabeeb"
257528-257574 swd: read: "R AP8"
257587-257598 swd: ack: "OK"
257608-257800 swd: data: "0xabbabeeb"
257833-257880 swd: read: "R APc"
257892-257904 swd: ack: "OK"
257913-258106 swd: data: "0xabbabeeb"
258138-258184 swd: read: "RDBUFF"
258196-258208 swd: ack: "OK"
258217-258410 swd: data: "0xabbabeeb"
258445-258491 swd: write: "W SELECT"
258503-258515 swd: ack: "OK"
258535-258741 swd: data: "0x00000000"
258762-258808 swd: write: "W AP4"
258821-258832 swd: ack: "OK"
258852-259059 swd: data: "0x00000d00"
259081-259126 swd: write: "W SELECT"
259139-259150 swd: ack: "OK"
259171-259377 swd: data: "0x00000010"
259399-259445 swd: read: "R AP0"
259457-259469 swd: ack: "OK"
259477-259656 swd: data: "0x00000000"
259688-259734 swd: read: "R AP4"
259747-259758 swd: ack: "OK"
259767-259960 swd: data: "0xabbabeeb"
259993-260039 swd: read: "R AP8"
260052-260063 swd: ack: "OK"
260072-260265 swd: data: "0xabbabeeb"
260298-260344 swd: read: "R APc"
260357-260368 swd: ack: "OK"
260378-260570 swd: data: "0xabbabeeb"
260603-260649 swd: read: "RDBUFF"
260661-260673 swd: ack: "OK"
260682-260875 swd: data: "0xabbabeeb"
260910-260956 swd: write: "W SELECT"
260968-260980 swd: ack: "OK"
261000-261206 swd: data: "0x00000000"
261227-261273 swd: write: "W AP4"
261285-261297 swd: ack: "OK"
261317-261524 swd: data: "0x00000d10"
261546-261591 swd: write: "W SELECT"
261604-261615 swd: ack: "OK"
261636-261842 swd: data: "0x00000010"
261864-261910 swd: read: "R AP0"
261922-261934 swd: ack: "OK"
261942-262121 swd: data: "0x00000000"
262153-262200 swd: read: "R AP4"
262212-262223 swd: ack: "OK"
262233-262425 swd: data: "0xabbabeeb"
262458-262504 swd: read: "R AP8"
262517-262528 swd: ack: "OK"
262537-262730 swd: data: "0xabbabeeb"
262763-262810 swd: read: "R APc"
262822-262834 swd: ack: "OK"
262843-263035 swd: data: "0xabbabeeb"
263068-263114 swd: read: "RDBUFF"
263126-263138 swd: ack: "OK"
263147-263340 swd: data: "0xabbabeeb"
263375-263421 swd: write: "W SELECT"
263433-263445 swd: ack: "OK"
263465-263671 swd: data: "0x00000000"
263692-263738 swd: write: "W AP4"
263751-263762 swd: ack: "OK"
263782-263989 swd: data: "0x00000d20"
264011-264057 swd: write: "W SELECT"
264069-264081 swd: ack: "OK"
264101-264307 swd: data: "0x00000010"
264329-264375 swd: read: "R AP0"
264387-264399 swd: ack: "OK"
264407-264586 swd: data: "0x00000000"
264618-264665 swd: read: "R AP4"
264677-264689 swd: ack: "OK"
264698-264891 swd: data: "0xabbabeeb"
264923-264970 swd: read: "R AP8"
264982-264993 swd: ack: "OK"
265003-265195 swd: data: "0xabbabeeb"
265229-265275 swd: read: "R APc"
265287-265299 swd: ack: "OK"
265308-265501 swd: data: "0xabbabeeb"
265533-265579 swd: read: "RDBUFF"
265591-265603 swd: ack: "OK"
265612-265805 swd: data: "0xabbabeeb"
265840-265886 swd: write: "W SELECT"
265898-265910 swd: ack: "OK"
265930-266136 swd: data: "0x00000000"
266157-266203 swd: write: "W AP4"
266216-266227 swd: ack: "OK"
266247-266454 swd: data: "0x00000d30"
266476-266521 swd: write: "W SELECT"
266534-266545 swd: ack: "OK"
266566-266772 swd: data: "0x00000010"
266794-266840 swd: read: "R AP0"
266852-266864 swd: ack: "OK"
266872-267051 swd: data: "0x00000000"
267083-267129 swd: read: "R AP4"
267142-267153 swd: ack: "OK"
267163-267355 swd: data: "0xabbabeeb"
267388-267434 swd: read: "R AP8"
267447-267458 swd: ack: "OK"
267467-267660 swd: data: "0xabbabeeb"
267693-267740 swd: read: "R APc"
267752-267764 swd: ack: "OK"
267773-267965 swd: data: "0xabbabeeb"
267998-268044 swd: read: "RDBUFF"
268056-268068 swd: ack: "OK"
268077-268270 swd: data: "0xabbabeeb"
268305-268351 swd: write: "W SELECT"
268363-268375 swd: ack: "OK"
268395-268601 swd: data: "0x00000000"
268622-268668 swd: write: "W AP4"
268680-268692 swd: ack: "OK"
268712-268919 swd: data: "0x00000d40"
268941-268987 swd: write: "W SELECT"
268999-269010 swd: ack: "OK"
269031-269237 swd: data: "0x00000010"
269259-269305 swd: read: "R AP0"
269317-269329 swd: ack: "OK"
269337-269516 swd: data: "0x00000000"
269548-269595 swd: read: "R AP4"
269607-269619 swd: ack: "OK"
269628-269820 swd: data: "0xabbabeeb"
269853-269899 swd: read: "R AP8"
269912-269923 swd: ack: "OK"
269933-270125 swd: data: "0xabbabeeb"
270158-270205 swd: read: "R APc"
270217-270229 swd: ack: "OK"
270238-270431 swd: data: "0xabbabeeb"
270463-270509 swd: read: "RDBUFF"
270521-270533 swd: ack: "OK"
270542-270735 swd: data: "0xabbabeeb"
270770-270816 swd: write: "W SELECT"
270828-270840 swd: ack: "OK"
270860-271066 swd: data: "0x00000000"
271087-271133 swd: write: "W AP4"
271146-271157 swd: ack: "OK"
271177-271384 swd: data: "0x00000d50"
271406-271451 swd: write: "W SELECT"
271464-271475 swd: ack: "OK"
271496-271702 swd: data: "0x00000010"
271724-271770 swd: read: "R AP0"
271782-271794 swd: ack: "OK"
271802-271981 swd: data: "0x00000000"
272013-272059 swd: read: "R AP4"
272072-272083 swd: ack: "OK"
272093-272285 swd: data: "0xabbabeeb"
272318-272364 swd: read: "R AP8"
272377-272388 swd: ack: "OK"
272397-272590 swd: data: "0xabbabeeb"
272623-272670 swd: read: "R APc"
272682-272693 swd: ack: "OK"
272703-272895 swd: data: "0xabbabeeb"
272928-272974 swd: read: "RDBUFF"
272986-272998 swd: ack: "OK"
273007-273200 swd: data: "0xabbabeeb"
273235-273281 swd: write: "W SELECT"
273293-273305 swd: ack: "OK"
273325-273531 swd: data: "0x00000000"
273552-273598 swd: write: "W AP4"
273610-273622 swd: ack: "OK"
273642-273849 swd: data: "0x00000d60"
273871-273916 swd: write: "W SELECT"
273929-273940 swd: ack: "OK"
273960-274167 swd: data: "0x00000010"
274189-274234 swd: read: "R AP0"
274247-274258 swd: ack: "OK"
274267-274446 swd: data: "0x00000000"
274478-274524 swd: read: "R AP4"
274537-274548 swd: ack: "OK"
274557-274750 swd: data: "0xabbabeeb"
274783-274829 swd: read: "R AP8"
274842-274853 swd: ack: "OK"
274862-275055 swd: data: "0xabbabeeb"
275088-275134 swd: read: "R APc"
275147-275158 swd: ack: "OK"
275167-275360 swd: data: "0xabbabeeb"
275392-275439 swd: read: "RDBUFF"
275451-275463 swd: ack: "OK"
275472-275665 swd: data: "0xabbabeeb"
275700-275746 swd: write: "W SELECT"
275758-275770 swd: ack: "OK"
275790-275996 swd: data: "0x00000000"
276017-276063 swd: write: "W AP4"
276075-276087 swd: ack: "OK"
276107-276313 swd: data: "0x00000d70"
276336-276381 swd: write: "W SELECT"
276394-276405 swd: ack: "OK"
276426-276632 swd: data: "0x00000010"
276654-276700 swd: read: "R AP0"
276712-276724 swd: ack: "OK"
276732-276911 swd: data: "0x00000000"
276943-276989 swd: read: "R AP4"
277002-277013 swd: ack: "OK"
277022-277215 swd: data: "0xabbabeeb"
277248-277294 swd: read: "R AP8"
277307-277318 swd: ack: "OK"
277327-277520 swd: data: "0xabbabeeb"
277553-277599 swd: read: "R APc"
277612-277623 swd: ack: "OK"
277633-277825 swd: data: "0xabbabeeb"
277858-277904 swd: read: "RDBUFF"
277916-277928 swd: ack: "OK"
277937-278130 swd: data: "0xabbabeeb"
278165-278211 swd: write: "W SELECT"
278223-278235 swd: ack: "OK"
278255-278461 swd: data: "0x00000000"
278482-278528 swd: write: "W AP4"
278540-278552 swd: ack: "OK"
278572-278779 swd: data: "0x00000d80"
278801-278846 swd: write: "W SELECT"
278859-278870 swd: ack: "OK"
278891-279097 swd: data: "0x00000010"
279119-279165 swd: read: "R AP0"
279177-279189 swd: ack: "OK"
279197-279376 swd: data: "0x00000000"
279408-279455 swd: read: "R AP4"
279467-279478 swd: ack: "OK"
279488-279680 swd: data: "0xabbabeeb"
279713-279759 swd: read: "R AP8"
279772-279783 swd: ack: "OK"
279793-279985 swd: data: "0xabbabeeb"
280018-280065 swd: read: "R APc"
280077-280089 swd: ack: "OK"
280098-280290 swd: data: "0xabbabeeb"
280323-280369 swd: read: "RDBUFF"
280381-280393 swd: ack: "OK"
280402-280595 swd: data: "0xabbabeeb"
280630-280676 swd: write: "W SELECT"
280688-280700 swd: ack: "OK"
280720-280926 swd: data: "0x00000000"
280947-280993 swd: write: "W AP4"
281006-281017 swd: ack: "OK"
281037-281244 swd: data: "0x00000d90"
281266-281311 swd: write: "W SELECT"
281324-281335 swd: ack: "OK"
281355-281562 swd: data: "0x00000010"
281584-281630 swd: read: "R AP0"
281642-281654 swd: ack: "OK"
281662-281841 swd: data: "0x00000000"
281873-281919 swd: read: "R AP4"
281932-281943 swd: ack: "OK"
281952-282145 swd: data: "0xabbabeeb"
282178-282224 swd: read: "R AP8"
282237-282248 swd: ack: "OK"
282257-282450 swd: data: "0xabbabeeb"
282483-282529 swd: read: "R APc"
282542-282553 swd: ack: "OK"
282563-282755 swd: data: "0xabbabeeb"
282788-282834 swd: read: "RDBUFF"
282846-282858 swd: ack: "OK"
282867-283060 swd: data: "0xabbabeeb"
283095-283141 swd: write: "W SELECT"
283153-283165 swd: ack: "OK"
283185-283391 swd: data: "0x00000000"
283412-283458 swd: write: "W AP4"
283470-283482 swd: ack: "OK"
283502-283709 swd: data: "0x00000da0"
283730-283776 swd: write: "W SELECT"
283789-283800 swd: ack: "OK"
283820-284027 swd: data: "0x00000010"
284049-284094 swd: read: "R AP0"
284107-284118 swd: ack: "OK"
284127-284306 swd: data: "0x00000000"
284338-284384 swd: read: "R AP4"
284397-284408 swd: ack: "OK"
284417-284610 swd: data: "0xabbabeeb"
284643-284689 swd: read: "R AP8"
284702-284713 swd: ack: "OK"
284722-284915 swd: data: "0xabbabeeb"
284948-284994 swd: read: "R APc"
285007-285018 swd: ack: "OK"
285027-285220 swd: data: "0xabbabeeb"
285252-285299 swd: read: "RDBUFF"
285311-285323 swd: ack: "OK"
285332-285524 swd: data: "0xabbabeeb"
285560-285605 swd: write: "W SELECT"
285618-285629 swd: ack: "OK"
285650-285856 swd: data: "0x00000000"
285877-285923 swd: write: "W AP4"
285935-285947 swd: ack: "OK"
285967-286173 swd: data: "0x00000db0"
286196-286241 swd: write: "W SELECT"
286254-286265 swd: ack: "OK"
286285-286492 swd: data: "0x00000010"
286514-286560 swd: read: "R AP0"
286572-286583 swd: ack: "OK"
286592-286771 swd: data: "0x00000000"
286803-286849 swd: read: "R AP4"
286862-286873 swd: ack: "OK"
286882-287075 swd: data: "0xabbabeeb"
287108-287154 swd: read: "R AP8"
287167-287178 swd: ack: "OK"
287187-287380 swd: data: "0xabbabeeb"
287413-287459 swd: read: "R APc"
287472-287483 swd: ack: "OK"
287492-287685 swd: data: "0xabbabeeb"
287718-287764 swd: read: "RDBUFF"
287776-287788 swd: ack: "OK"
287797-287990 swd: data: "0xabbabeeb"
288025-288071 swd: write: "W SELECT"
288083-288095 swd: ack: "OK"
288115-288321 swd: data: "0x00000000"
288342-288388 swd: write: "W AP4"
288400-288412 swd: ack: "OK"
288432-288638 swd: data: "0x00000dc0"
288660-288706 swd: write: "W SELECT"
288719-288730 swd: ack: "OK"
288750-288957 swd: data: "0x00000010"
288979-289024 swd: read: "R AP0"
289037-289048 swd: ack: "OK"
289057-289236 swd: data: "0x00000000"
289268-289314 swd: read: "R AP4"
289327-289338 swd: ack: "OK"
289347-289540 swd: data: "0xabbabeeb"
289573-289619 swd: read: "R AP8"
289632-289643 swd: ack: "OK"
289652-289845 swd: data: "0xabbabeeb"
289878-289924 swd: read: "R APc"
289937-289948 swd: ack: "OK"
289957-290150 swd: data: "0xabbabeeb"
290182-290229 swd: read: "RDBUFF"
290241-290253 swd: ack: "OK"
290262-290454 swd: data: "0xabbabeeb"
290490-290535 swd: write: "W SELECT"
290548-290559 swd: ack: "OK"
290580-290786 swd: data: "0x00000000"
290807-290853 swd: write: "W AP4"
290865-290877 swd: ack: "OK"
290897-291103 swd: data: "0x00000dd0"
291126-291171 swd: write: "W SELECT"
291184-291195 swd: ack: "OK"
291215-291422 swd: data: "0x00000010"
291444-291489 swd: read: "R AP0"
291502-291513 swd: ack: "OK"
291522-291701 swd: data: "0x00000000"
291733-291779 swd: read: "R AP4"
291792-291803 swd: ack: "OK"
291812-292005 swd: data: "0xabbabeeb"
292038-292084 swd: read: "R AP8"
292097-292108 swd: ack: "OK"
292117-292310 swd: data: "0xabbabeeb"
292343-292389 swd: read: "R APc"
292402-292413 swd: ack: "OK"
292422-292615 swd: data: "0xabbabeeb"
292647-292694 swd: read: "RDBUFF"
292706-292718 swd: ack: "OK"
292727-292920 swd: data: "0xabbabeeb"
292955-293001 swd: write: "W SELECT"
293013-293025 swd: ack: "OK"
293045-293251 swd: data: "0x00000000"
293272-293318 swd: write: "W AP4"
293330-293342 swd: ack: "OK"
293362-293568 swd: data: "0x00000de0"
293591-293636 swd: write: "W SELECT"
293649-293660 swd: ack: "OK"
293681-293887 swd: data: "0x00000010"
293909-293955 swd: read: "R AP0"
293967-293979 swd: ack: "OK"
293987-294166 swd: data: "0x00000000"
294198-294244 swd: read: "R AP4"
294257-294268 swd: ack: "OK"
294277-294470 swd: data: "0xabbabeeb"
294503-294549 swd: read: "R AP8"
294562-294573 swd: ack: "OK"
294582-294775 swd: data: "0xabbabeeb"
294808-294854 swd: read: "R APc"
294867-294878 swd: ack: "OK"
294888-295080 swd: data: "0xabbabeeb"
295113-295159 swd: read: "RDBUFF"
295171-295183 swd: ack: "OK"
295192-295385 swd: data: "0xabbabeeb"
295420-295466 swd: write: "W SELECT"
295478-295490 swd: ack: "OK"
295510-295716 swd: data: "0x00000000"
295737-295783 swd: write: "W AP4"
295795-295807 swd: ack: "OK"
295827-296034 swd: data: "0x00000df0"
296056-296101 swd: write: "W SELECT"
296114-296125 swd: ack: "OK"
296145-296352 swd: data: "0x00000010"
296374-296419 swd: read: "R AP0"
296432-296443 swd: ack: "OK"
296452-296631 swd: data: "0x00000000"
296663-296709 swd: read: "R AP4"
296722-296733 swd: ack: "OK"
296742-296935 swd: data: "0xabbabeeb"
296968-297014 swd: read: "R AP8"
297027-297038 swd: ack: "OK"
297047-297240 swd: data: "0xabbabeeb"
297273-297319 swd: read: "R APc"
297332-297343 swd: ack: "OK"
297352-297545 swd: data: "0xabbabeeb"
297577-297624 swd: read: "RDBUFF"
297636-297648 swd: ack: "OK"
297657-297850 swd: data: "0xabbabeeb"
297885-297931 swd: write: "W SELECT"
297943-297954 swd: ack: "OK"
297975-298181 swd: data: "0x00000000"
298202-298248 swd: write: "W AP4"
298260-298272 swd: ack: "OK"
298292-298498 swd: data: "0x00000e00"
298520-298566 swd: write: "W SELECT"
298579-298590 swd: ack: "OK"
298610-298817 swd: data: "0x00000010"
298839-298884 swd: read: "R AP0"
298897-298908 swd: ack: "OK"
298917-299096 swd: data: "0x00000000"
299128-299174 swd: read: "R AP4"
299187-299198 swd: ack: "OK"
299207-299400 swd: data: "0xabbabeeb"
299433-299479 swd: read: "R AP8"
299492-299503 swd: ack: "OK"
299512-299705 swd: data: "0xabbabeeb"
299738-299784 swd: read: "R APc"
299797-299808 swd: ack: "OK"
299817-300010 swd: data: "0xabbabeeb"
300042-300088 swd: read: "RDBUFF"
300101-300112 swd: ack: "OK"
300122-300314 swd: data: "0xabbabeeb"
300350-300395 swd: write: "W SELECT"
300408-300419 swd: ack: "OK"
300440-300646 swd: data: "0x00000000"
300667-300713 swd: write: "W AP4"
300725-300737 swd: ack: "OK"
300757-300963 swd: data: "0x00000e10"
300985-301031 swd: write: "W SELECT"
301044-301055 swd: ack: "OK"
301075-301282 swd: data: "0x00000010"
301304-301349 swd: read: "R AP0"
301362-301373 swd: ack: "OK"
301382-301561 swd: data: "0x00000000"
301593-301639 swd: read: "R AP4"
301652-301663 swd: ack: "OK"
301672-301865 swd: data: "0xabbabeeb"
301898-301944 swd: read: "R AP8"
301957-301968 swd: ack: "OK"
301977-302170 swd: data: "0xabbabeeb"
302203-302249 swd: read: "R APc"
302262-302273 swd: ack: "OK"
302282-302475 swd: data: "0xabbabeeb"
302507-302554 swd: read: "RDBUFF"
302566-302578 swd: ack: "OK"
302587-302779 swd: data: "0xabbabeeb"
302815-302860 swd: write: "W SELECT"
302873-302884 swd: ack: "OK"
302905-303111 swd: data: "0x00000000"
303132-303178 swd: write: "W AP4"
303190-303202 swd: ack: "OK"
303222-303428 swd: data: "0x00000e20"
303451-303496 swd: write: "W SELECT"
303509-303520 swd: ack: "OK"
303540-303747 swd: data: "0x00000010"
303769-303815 swd: read: "R AP0"
303827-303838 swd: ack: "OK"
303847-304026 swd: data: "0x00000000"
304058-304104 swd: read: "R AP4"
304117-304128 swd: ack: "OK"
304137-304330 swd: data: "0xabbabeeb"
304363-304409 swd: read: "R AP8"
304422-304433 swd: ack: "OK"
304442-304635 swd: data: "0xabbabeeb"
304668-304714 swd: read: "R APc"
304727-304738 swd: ack: "OK"
304747-304940 swd: data: "0xabbabeeb"
304973-305019 swd: read: "RDBUFF"
305031-305043 swd: ack: "OK"
305052-305245 swd: data: "0xabbabeeb"
305280-305326 swd: write: "W SELECT"
305338-305350 swd: ack: "OK"
305370-305576 swd: data: "0x00000000"
305597-305643 swd: write: "W AP4"
305655-305667 swd: ack: "OK"
305687-305893 swd: data: "0x00000e30"
305915-305961 swd: write: "W SELECT"
305974-305985 swd: ack: "OK"
306005-306212 swd: data: "0x00000010"
306234-306279 swd: read: "R AP0"
306292-306303 swd: ack: "OK"
306312-306491 swd: data: "0x00000000"
306523-306569 swd: read: "R AP4"
306582-306593 swd: ack: "OK"
306602-306795 swd: data: "0xabbabeeb"
306828-306874 swd: read: "R AP8"
306887-306898 swd: ack: "OK"
306907-307100 swd: data: "0xabbabeeb"
307133-307179 swd: read: "R APc"
307192-307203 swd: ack: "OK"
307212-307405 swd: data: "0xabbabeeb"
307437-307484 swd: read: "RDBUFF"
307496-307508 swd: ack: "OK"
307517-307709 swd: data: "0xabbabeeb"
307745-307790 swd: write: "W SELECT"
307803-307814 swd: ack: "OK"
307835-308041 swd: data: "0x00000000"
308062-308108 swd: write: "W AP4"
308120-308132 swd: ack: "OK"
308152-308358 swd: data: "0x00000e40"
308381-308426 swd: write: "W SELECT"
308439-308450 swd: ack: "OK"
308470-308677 swd: data: "0x00000010"
308699-308744 swd: read: "R AP0"
308757-308768 swd: ack: "OK"
308777-308956 swd: data: "0x00000000"
308988-309034 swd: read: "R AP4"
309047-309058 swd: ack: "OK"
309067-309260 swd: data: "0xabbabeeb"
309293-309339 swd: read: "R AP8"
309352-309363 swd: ack: "OK"
309372-309565 swd: data: "0xabbabeeb"
309598-309644 swd: read: "R APc"
309657-309668 swd: ack: "OK"
309677-309870 swd: data: "0xabbabeeb"
309902-309949 swd: read: "RDBUFF"
309961-309973 swd: ack: "OK"
309982-310175 swd: data: "0xabbabeeb"
310210-310256 swd: write: "W SELECT"
310268-310280 swd: ack: "OK"
310300-310506 swd: data: "0x00000000"
310527-310573 swd: write: "W AP4"
310585-310597 swd: ack: "OK"
310617-310823 swd: data: "0x00000e50"
310845-310891 swd: write: "W SELECT"
310904-310915 swd: ack: "OK"
310935-311142 swd: data: "0x00000010"
311164-311209 swd: read: "R AP0"
311222-311233 swd: ack: "OK"
311242-311421 swd: data: "0x00000000"
311453-311499 swd: read: "R AP4"
311512-311523 swd: ack: "OK"
311532-311725 swd: data: "0xabbabeeb"
311758-311804 swd: read: "R AP8"
311817-311828 swd: ack: "OK"
311837-312030 swd: data: "0xabbabeeb"
312063-312109 swd: read: "R APc"
312122-312133 swd: ack: "OK"
312142-312335 swd: data: "0xabbabeeb"
312367-312414 swd: read: "RDBUFF"
312426-312437 swd: ack: "OK"
312447-312639 swd: data: "0xabbabeeb"
312675-312720 swd: write: "W SELECT"
312733-312744 swd: ack: "OK"
312765-312971 swd: data: "0x00000000"
312992-313038 swd: write: "W AP4"
313050-313062 swd: ack: "OK"
313082-313288 swd: data: "0x00000e60"
313310-313356 swd: write: "W SELECT"
313368-313380 swd: ack: "OK"
313400-313607 swd: data: "0x00000010"
313629-313674 swd: read: "R AP0"
313687-313698 swd: ack: "OK"
313707-313886 swd: data: "0x00000000"
313918-313964 swd: read: "R AP4"
313976-313988 swd: ack: "OK"
313997-314190 swd: data: "0xabbabeeb"
314223-314269 swd: read: "R AP8"
314281-314293 swd: ack: "OK"
314302-314495 swd: data: "0xabbabeeb"
314528-314574 swd: read: "R APc"
314587-314598 swd: ack: "OK"
314607-314800 swd: data: "0xabbabeeb"
314832-314878 swd: read: "RDBUFF"
314891-314902 swd: ack: "OK"
314911-315104 swd: data: "0xabbabeeb"
315140-315185 swd: write: "W SELECT"
315198-315209 swd: ack: "OK"
315229-315436 swd: data: "0x00000000"
315457-315503 swd: write: "W AP4"
315515-315527 swd: ack: "OK"
315547-315753 swd: data: "0x00000e70"
315775-315821 swd: write: "W SELECT"
315834-315845 swd: ack: "OK"
315865-316072 swd: data: "0x00000010"
316094-316139 swd: read: "R AP0"
316152-316163 swd: ack: "OK"
316172-316351 swd: data: "0x00000000"
316383-316429 swd: read: "R AP4"
316442-316453 swd: ack: "OK"
316462-316655 swd: data: "0xabbabeeb"
316688-316734 swd: read: "R AP8"
316747-316758 swd: ack: "OK"
316767-316960 swd: data: "0xabbabeeb"
316993-317039 swd: read: "R APc"
317052-317063 swd: ack: "OK"
317072-317265 swd: data: "0xabbabeeb"
317297-317343 swd: read: "RDBUFF"
317356-317367 swd: ack: "OK"
317377-317569 swd: data: "0xabbabeeb"
317605-317650 swd: write: "W SELECT"
317663-317674 swd: ack: "OK"
317695-317901 swd: data: "0x00000000"
317922-317968 swd: write: "W AP4"
317980-317992 swd: ack: "OK"
318012-318218 swd: data: "0x00000e80"
318240-318286 swd: write: "W SELECT"
318299-318310 swd: ack: "OK"
318330-318537 swd: data: "0x00000010"
318559-318604 swd: read: "R AP0"
318617-318628 swd: ack: "OK"
318637-318816 swd: data: "0x00000000"
318848-318894 swd: read: "R AP4"
318907-318918 swd: ack: "OK"
318927-319120 swd: data: "0xabbabeeb"
319153-319199 swd: read: "R AP8"
319212-319223 swd: ack: "OK"
319232-319425 swd: data: "0xabbabeeb"
319458-319504 swd: read: "R APc"
319517-319528 swd: ack: "OK"
319537-319730 swd: data: "0xabbabeeb"
319762-319809 swd: read: "RDBUFF"
319821-319833 swd: ack: "OK"
319842-320034 swd: data: "0xabbabeeb"
320070-320115 swd: write: "W SELECT"
320128-320139 swd: ack: "OK"
320160-320366 swd: data: "0x00000000"
320387-320433 swd: write: "W AP4"
320445-320457 swd: ack: "OK"
320477-320683 swd: data: "0x00000e90"
320705-320751 swd: write: "W SELECT"
320763-320775 swd: ack: "OK"
320795-321002 swd: data: "0x00000010"
321024-321069 swd: read: "R AP0"
321082-321093 swd: ack: "OK"
321102-321281 swd: data: "0x00000000"
321313-321359 swd: read: "R AP4"
321372-321383 swd: ack: "OK"
321392-321585 swd: data: "0xabbabeeb"
321618-321664 swd: read: "R AP8"
321676-321688 swd: ack: "OK"
321697-321890 swd: data: "0xabbabeeb"
321923-321969 swd: read: "R APc"
321982-321993 swd: ack: "OK"
322002-322195 swd: data: "0xabbabeeb"
322227-322273 swd: read: "RDBUFF"
322286-322297 swd: ack: "OK"
322307-322499 swd: data: "0xabbabeeb"
322535-322580 swd: write: "W SELECT"
322593-322604 swd: ack: "OK"
322625-322831 swd: data: "0x00000000"
322852-322898 swd: write: "W AP4"
322910-322922 swd: ack: "OK"
322942-323148 swd: data: "0x00000ea0"
323170-323216 swd: write: "W SELECT"
323228-323240 swd: ack: "OK"
323260-323466 swd: data: "0x00000010"
323488-323534 swd: read: "R AP0"
323547-323558 swd: ack: "OK"
323567-323745 swd: data: "0x00000000"
323778-323824 swd: read: "R AP4"
323836-323848 swd: ack: "OK"
323857-324050 swd: data: "0xabbabeeb"
324083-324129 swd: read: "R AP8"
324141-324153 swd: ack: "OK"
324162-324355 swd: data: "0xabbabeeb"
324388-324434 swd: read: "R APc"
324446-324458 swd: ack: "OK"
324467-324660 swd: data: "0xabbabeeb"
324692-324738 swd: read: "RDBUFF"
324751-324762 swd: ack: "OK"
324771-324964 swd: data: "0xabbabeeb"
325000-325045 swd: write: "W SELECT"
325058-325069 swd: ack: "OK"
325089-325296 swd: data: "0x00000000"
325317-325363 swd: write: "W AP4"
325375-325387 swd: ack: "OK"
325407-325613 swd: data: "0x00000eb0"
325635-325681 swd: write: "W SELECT"
325693-325705 swd: ack: "OK"
325725-325932 swd: data: "0x00000010"
325954-325999 swd: read: "R AP0"
326012-326023 swd: ack: "OK"
326032-326211 swd: data: "0x00000000"
326243-326289 swd: read: "R AP4"
326302-326313 swd: ack: "OK"
326322-326515 swd: data: "0xabbabeeb"
326548-326594 swd: read: "R AP8"
326606-326618 swd: ack: "OK"
326627-326820 swd: data: "0xabbabeeb"
326853-326899 swd: read: "R APc"
326912-326923 swd: ack: "OK"
326932-327125 swd: data: "0xabbabeeb"
327157-327203 swd: read: "RDBUFF"
327216-327227 swd: ack: "OK"
327236-327429 swd: data: "0xabbabeeb"
327465-327510 swd: write: "W SELECT"
327523-327534 swd: ack: "OK"
327554-327761 swd: data: "0x00000000"
327782-327828 swd: write: "W AP4"
327840-327852 swd: ack: "OK"
327872-328078 swd: data: "0x00000ec0"
328100-328146 swd: write: "W SELECT"
328158-328170 swd: ack: "OK"
328190-328396 swd: data: "0x00000010"
328418-328464 swd: read: "R AP0"
328477-328488 swd: ack: "OK"
328497-328675 swd: data: "0x00000000"
328708-328754 swd: read: "R AP4"
328766-328778 swd: ack: "OK"
328787-328980 swd: data: "0xabbabeeb"
329013-329059 swd: read: "R AP8"
329071-329083 swd: ack: "OK"
329092-329285 swd: data: "0xabbabeeb"
329318-329364 swd: read: "R APc"
329376-329388 swd: ack: "OK"
329397-329590 swd: data: "0xabbabeeb"
329622-329668 swd: read: "RDBUFF"
329681-329692 swd: ack: "OK"
329701-329894 swd: data: "0xabbabeeb"
329929-329975 swd: write: "W SELECT"
329988-329999 swd: ack: "OK"
330019-330226 swd: data: "0x00000000"
330247-330293 swd: write: "W AP4"
330305-330317 swd: ack: "OK"
330337-330543 swd: data: "0x00000ed0"
330565-330611 swd: write: "W SELECT"
330623-330635 swd: ack: "OK"
330655-330862 swd: data: "0x00000010"
330884-330929 swd: read: "R AP0"
330942-330953 swd: ack: "OK"
330962-331141 swd: data: "0x00000000"
331173-331219 swd: read: "R AP4"
331231-331243 swd: ack: "OK"
331252-331445 swd: data: "0xabbabeeb"
331478-331524 swd: read: "R AP8"
331536-331548 swd: ack: "OK"
331557-331750 swd: data: "0xabbabeeb"
331783-331829 swd: read: "R APc"
331842-331853 swd: ack: "OK"
331862-332055 swd: data: "0xabbabeeb"
332087-332133 swd: read: "RDBUFF"
332146-332157 swd: ack: "OK"
332166-332359 swd: data: "0xabbabeeb"
332395-332440 swd: write: "W SELECT"
332453-332464 swd: ack: "OK"
332484-332691 swd: data: "0x00000000"
332712-332758 swd: write: "W AP4"
332770-332782 swd: ack: "OK"
332802-333008 swd: data: "0x00000ee0"
333030-333076 swd: write: "W SELECT"
333089-333100 swd: ack: "OK"
333120-333327 swd: data: "0x00000010"
333349-333394 swd: read: "R AP0"
333407-333418 swd: ack: "OK"
333427-333606 swd: data: "0x00000000"
333638-333684 swd: read: "R AP4"
333697-333708 swd: ack: "OK"
333717-333910 swd: data: "0xabbabeeb"
333943-333989 swd: read: "R AP8"
334002-334013 swd: ack: "OK"
334022-334215 swd: data: "0xabbabeeb"
334248-334294 swd: read: "R APc"
334307-334318 swd: ack: "OK"
334327-334520 swd: data: "0xabbabeeb"
334552-334598 swd: read: "RDBUFF"
334611-334622 swd: ack: "OK"
334632-334824 swd: data: "0xabbabeeb"
334860-334905 swd: write: "W SELECT"
334918-334929 swd: ack: "OK"
334950-335156 swd: data: "0x00000000"
335177-335223 swd: write: "W AP4"
335235-335247 swd: ack: "OK"
335267-335473 swd: data: "0x00000ef0"
335495-335541 swd: write: "W SELECT"
335553-335565 swd: ack: "OK"
335585-335792 swd: data: "0x00000010"
335813-335859 swd: read: "R AP0"
335872-335883 swd: ack: "OK"
335892-336070 swd: data: "0x00000000"
336103-336149 swd: read: "R AP4"
336161-336173 swd: ack: "OK"
336182-336375 swd: data: "0xabbabeeb"
336408-336454 swd: read: "R AP8"
336466-336478 swd: ack: "OK"
336487-336680 swd: data: "0xabbabeeb"
336713-336759 swd: read: "R APc"
336772-336783 swd: ack: "OK"
336792-336985 swd: data: "0xabbabeeb"
337017-337063 swd: read: "RDBUFF"
337076-337087 swd: ack: "OK"
337096-337289 swd: data: "0xabbabeeb"
337325-337370 swd: write: "W SELECT"
337383-337394 swd: ack: "OK"
337414-337621 swd: data: "0x00000000"
337642-337688 swd: write: "W AP4"
337700-337712 swd: ack: "OK"
337732-337938 swd: data: "0x00000f00"
337960-338006 swd: write: "W SELECT"
338018-338030 swd: ack: "OK"
338050-338257 swd: data: "0x00000010"
338279-338324 swd: read: "R AP0"
338337-338348 swd: ack: "OK"
338357-338536 swd: data: "0x00000000"
338568-338614 swd: read: "R AP4"
338627-338638 swd: ack: "OK"
338647-338840 swd: data: "0xabbabeeb"
338873-338919 swd: read: "R AP8"
338931-338943 swd: ack: "OK"
338952-339145 swd: data: "0xabbabeeb"
339178-339224 swd: read: "R APc"
339237-339248 swd: ack: "OK"
339257-339450 swd: data: "0xabbabeeb"
339482-339528 swd: read: "RDBUFF"
339541-339552 swd: ack: "OK"
339562-339754 swd: data: "0xabbabeeb"
339790-339835 swd: write: "W SELECT"
339848-339859 swd: ack: "OK"
339880-340086 swd: data: "0x00000000"
340107-340153 swd: write: "W AP4"
340165-340177 swd: ack: "OK"
340197-340403 swd: data: "0x00000f10"
340425-340471 swd: write: "W SELECT"
340483-340495 swd: ack: "OK"
340515-340721 swd: data: "0x00000010"
340743-340789 swd: read: "R AP0"
340802-340813 swd: ack: "OK"
340822-341000 swd: data: "0x00000000"
341033-341079 swd: read: "R AP4"
341091-341103 swd: ack: "OK"
341112-341305 swd: data: "0xabbabeeb"
341338-341384 swd: read: "R AP8"
341396-341408 swd: ack: "OK"
341417-341610 swd: data: "0xabbabeeb"
341643-341689 swd: read: "R APc"
341701-341713 swd: ack: "OK"
341722-341915 swd: data: "0xabbabeeb"
341947-341993 swd: read: "RDBUFF"
342006-342017 swd: ack: "OK"
342026-342219 swd: data: "0xabbabeeb"
342255-342300 swd: write: "W SELECT"
342313-342324 swd: ack: "OK"
342344-342551 swd: data: "0x00000000"
342572-342618 swd: write: "W AP4"
342630-342642 swd: ack: "OK"
342662-342868 swd: data: "0x00000f20"
342890-342936 swd: write: "W SELECT"
342948-342960 swd: ack: "OK"
342980-343186 swd: data: "0x00000010"
343208-343254 swd: read: "R AP0"
343266-343278 swd: ack: "OK"
343286-343465 swd: data: "0x00000000"
343498-343544 swd: read: "R AP4"
343556-343568 swd: ack: "OK"
343577-343770 swd: data: "0xabbabeeb"
343803-343849 swd: read: "R AP8"
343861-343873 swd: ack: "OK"
343882-344075 swd: data: "0xabbabeeb"
344108-344154 swd: read: "R APc"
344166-344178 swd: ack: "OK"
344187-344380 swd: data: "0xabbabeeb"
344412-344458 swd: read: "RDBUFF"
344471-344482 swd: ack: "OK"
344491-344684 swd: data: "0xabbabeeb"
344719-344765 swd: write: "W SELECT"
344778-344789 swd: ack: "OK"
344809-345016 swd: data: "0x00000000"
345037-345082 swd: write: "W AP4"
345095-345106 swd: ack: "OK"
345127-345333 swd: data: "0x00000f30"
345355-345401 swd: write: "W SELECT"
345413-345425 swd: ack: "OK"
345445-345651 swd: data: "0x00000010"
345673-345719 swd: read: "R AP0"
345732-345743 swd: ack: "OK"
345752-345930 swd: data: "0x00000000"
345963-346009 swd: read: "R AP4"
346021-346033 swd: ack: "OK"
346042-346235 swd: data: "0xabbabeeb"
346268-346314 swd: read: "R AP8"
346326-346338 swd: ack: "OK"
346347-346540 swd: data: "0xabbabeeb"
346573-346619 swd: read: "R APc"
346631-346643 swd: ack: "OK"
346652-346845 swd: data: "0xabbabeeb"
346877-346923 swd: read: "RDBUFF"
346936-346947 swd: ack: "OK"
346956-347149 swd: data: "0xabbabeeb"
347184-347230 swd: write: "W SELECT"
347243-347254 swd: ack: "OK"
347274-347481 swd: data: "0x00000000"
347502-347548 swd: write: "W AP4"
347560-347572 swd: ack: "OK"
347592-347798 swd: data: "0x00000f40"
347820-347866 swd: write: "W SELECT"
347878-347890 swd: ack: "OK"
347910-348116 swd: data: "0x00000010"
348138-348184 swd: read: "R AP0"
348196-348208 swd: ack: "OK"
348216-348395 swd: data: "0x00000000"
348428-348474 swd: read: "R AP4"
348486-348498 swd: ack: "OK"
348507-348700 swd: data: "0xabbabeeb"
348733-348779 swd: read: "R AP8"
348791-348803 swd: ack: "OK"
348812-349005 swd: data: "0xabbabeeb"
349038-349084 swd: read: "R APc"
349096-349108 swd: ack: "OK"
349117-349310 swd: data: "0xabbabeeb"
349342-349388 swd: read: "RDBUFF"
349401-349412 swd: ack: "OK"
349421-349614 swd: data: "0xabbabeeb"
349649-349695 swd: write: "W SELECT"
349708-349719 swd: ack: "OK"
349739-349946 swd: data: "0x00000000"
349967-350012 swd: write: "W AP4"
350025-350036 swd: ack: "OK"
350057-350263 swd: data: "0x00000f50"
350285-350331 swd: write: "W SELECT"
350343-350355 swd: ack: "OK"
350375-350581 swd: data: "0x00000010"
350603-350649 swd: read: "R AP0"
350662-350673 swd: ack: "OK"
350682-350860 swd: data: "0x00000000"
350893-350939 swd: read: "R AP4"
350951-350963 swd: ack: "OK"
350972-351165 swd: data: "0xabbabeeb"
351198-351244 swd: read: "R AP8"
351256-351268 swd: ack: "OK"
351277-351470 swd: data: "0xabbabeeb"
351503-351549 swd: read: "R APc"
351561-351573 swd: ack: "OK"
351582-351775 swd: data: "0xabbabeeb"
351807-351853 swd: read: "RDBUFF"
351866-351877 swd: ack: "OK"
351886-352079 swd: data: "0xabbabeeb"
352114-352160 swd: write: "W SELECT"
352173-352184 swd: ack: "OK"
352204-352411 swd: data: "0x00000000"
352432-352478 swd: write: "W AP4"
352490-352501 swd: ack: "OK"
352522-352728 swd: data: "0x00000f60"
352750-352796 swd: write: "W SELECT"
352808-352820 swd: ack: "OK"
352840-353047 swd: data: "0x00000010"
353068-353114 swd: read: "R AP0"
353127-353138 swd: ack: "OK"
353147-353325 swd: data: "0x00000000"
353358-353404 swd: read: "R AP4"
353416-353428 swd: ack: "OK"
353437-353630 swd: data: "0xabbabeeb"
353663-353709 swd: read: "R AP8"
353721-353733 swd: ack: "OK"
353742-353935 swd: data: "0xabbabeeb"
353968-354014 swd: read: "R APc"
354027-354038 swd: ack: "OK"
354047-354240 swd: data: "0xabbabeeb"
354272-354318 swd: read: "RDBUFF"
354331-354342 swd: ack: "OK"
354351-354544 swd: data: "0xabbabeeb"
354580-354625 swd: write: "W SELECT"
354638-354649 swd: ack: "OK"
354669-354876 swd: data: "0x00000000"
354897-354943 swd: write: "W AP4"
354955-354967 swd: ack: "OK"
354987-355193 swd: data: "0x00000f70"
355215-355261 swd: write: "W SELECT"
355273-355285 swd: ack: "OK"
355305-355511 swd: data: "0x00000010"
355533-355579 swd: read: "R AP0"
355592-355603 swd: ack: "OK"
355611-355790 swd: data: "0x00000000"
355823-355869 swd: read: "R AP4"
355881-355893 swd: ack: "OK"
355902-356095 swd: data: "0xabbabeeb"
356128-356174 swd: read: "R AP8"
356186-356198 swd: ack: "OK"
356207-356400 swd: data: "0xabbabeeb"
356433-356479 swd: read: "R APc"
356491-356503 swd: ack: "OK"
356512-356705 swd: data: "0xabbabeeb"
356737-356783 swd: read: "RDBUFF"
356796-356807 swd: ack: "OK"
356816-357009 swd: data: "0xabbabeeb"
357044-357090 swd: write: "W SELECT"
357103-357114 swd: ack: "OK"
357134-357341 swd: data: "0x00000000"
357362-357407 swd: write: "W AP4"
357420-357431 swd: ack: "OK"
357452-357658 swd: data: "0x00000f80"
357680-357726 swd: write: "W SELECT"
357738-357750 swd: ack: "OK"
357770-357976 swd: data: "0x00000010"
357998-358044 swd: read: "R AP0"
358056-358068 swd: ack: "OK"
358076-358255 swd: data: "0x00000000"
358288-358334 swd: read: "R AP4"
358346-358358 swd: ack: "OK"
358367-358560 swd: data: "0xabbabeeb"
358593-358639 swd: read: "R AP8"
358651-358663 swd: ack: "OK"
358672-358865 swd: data: "0xabbabeeb"
358898-358944 swd: read: "R APc"
358956-358968 swd: ack: "OK"
358977-359170 swd: data: "0xabbabeeb"
359202-359248 swd: read: "RDBUFF"
359261-359272 swd: ack: "OK"
359281-359474 swd: data: "0xabbabeeb"
359509-359555 swd: write: "W SELECT"
359567-359579 swd: ack: "OK"
359599-359806 swd: data: "0x00000000"
359827-359872 swd: write: "W AP4"
359885-359896 swd: ack: "OK"
359917-360123 swd: data: "0x00000f90"
360145-360191 swd: write: "W SELECT"
360203-360215 swd: ack: "OK"
360235-360441 swd: data: "0x00000010"
360463-360509 swd: read: "R AP0"
360521-360533 swd: ack: "OK"
360541-360720 swd: data: "0x00000000"
360753-360799 swd: read: "R AP4"
360811-360823 swd: ack: "OK"
360832-361025 swd: data: "0xabbabeeb"
361058-361104 swd: read: "R AP8"
361116-361128 swd: ack: "OK"
361137-361330 swd: data: "0xabbabeeb"
361363-361409 swd: read: "R APc"
361421-361433 swd: ack: "OK"
361442-361635 swd: data: "0xabbabeeb"
361667-361713 swd: read: "RDBUFF"
361726-361737 swd: ack: "OK"
361746-361939 swd: data: "0xabbabeeb"
361974-362020 swd: write: "W SELECT"
362033-362044 swd: ack: "OK"
362064-362271 swd: data: "0x00000000"
362292-362337 swd: write: "W AP4"
362350-362361 swd: ack: "OK"
362382-362588 swd: data: "0x00000fa0"
362610-362656 swd: write: "W SELECT"
362668-362680 swd: ack: "OK"
362700-362906 swd: data: "0x00000010"
362928-362974 swd: read: "R AP0"
362987-362998 swd: ack: "OK"
363007-363185 swd: data: "0x00000000"
363218-363264 swd: read: "R AP4"
363276-363288 swd: ack: "OK"
363297-363490 swd: data: "0xabbabeeb"
363523-363569 swd: read: "R AP8"
363581-363593 swd: ack: "OK"
363602-363795 swd: data: "0xabbabeeb"
363828-363874 swd: read: "R APc"
363886-363898 swd: ack: "OK"
363907-364100 swd: data: "0xabbabeeb"
364132-364178 swd: read: "RDBUFF"
364191-364202 swd: ack: "OK"
364211-364404 swd: data: "0xabbabeeb"
364439-364485 swd: write: "W SELECT"
364498-364509 swd: ack: "OK"
364529-364736 swd: data: "0x00000000"
364757-364803 swd: write: "W AP4"
364815-364827 swd: ack: "OK"
364847-365053 swd: data: "0x00000fb0"
365075-365121 swd: write: "W SELECT"
365133-365145 swd: ack: "OK"
365165-365371 swd: data: "0x00000010"
365393-365439 swd: read: "R AP0"
365451-365463 swd: ack: "OK"
365471-365650 swd: data: "0x00000000"
365683-365729 swd: read: "R AP4"
365741-365753 swd: ack: "OK"
365762-365955 swd: data: "0xabbabeeb"
365988-366034 swd: read: "R AP8"
366046-366058 swd: ack: "OK"
366067-366260 swd: data: "0xabbabeeb"
366293-366339 swd: read: "R APc"
366351-366363 swd: ack: "OK"
366372-366565 swd: data: "0xabbabeeb"
366597-366643 swd: read: "RDBUFF"
366656-366667 swd: ack: "OK"
366676-366869 swd: data: "0xabbabeeb"
366904-366950 swd: write: "W SELECT"
366963-366974 swd: ack: "OK"
366994-367201 swd: data: "0x00000000"
367222-367267 swd: write: "W AP4"
367280-367291 swd: ack: "OK"
367312-367518 swd: data: "0x00000fc0"
367540-367586 swd: write: "W SELECT"
367598-367610 swd: ack: "OK"
367630-367836 swd: data: "0x00000010"
367858-367904 swd: read: "R AP0"
367917-367928 swd: ack: "OK"
367937-368115 swd: data: "0x00000000"
368148-368194 swd: read: "R AP4"
368206-368218 swd: ack: "OK"
368227-368420 swd: data: "0xabbabeeb"
368453-368499 swd: read: "R AP8"
368511-368523 swd: ack: "OK"
368532-368725 swd: data: "0xabbabeeb"
368758-368804 swd: read: "R APc"
368816-368828 swd: ack: "OK"
368837-369030 swd: data: "0xabbabeeb"
369062-369108 swd: read: "RDBUFF"
369121-369132 swd: ack: "OK"
369141-369334 swd: data: "0xabbabeeb"
369369-369415 swd: write: "W SELECT"
369428-369439 swd: ack: "OK"
369459-369666 swd: data: "0x00000000"
369687-369733 swd: write: "W AP4"
369745-369756 swd: ack: "OK"
369777-369983 swd: data: "0x00000fd0"
370005-370051 swd: write: "W SELECT"
370063-370075 swd: ack: "OK"
370095-370301 swd: data: "0x00000010"
370323-370369 swd: read: "R AP0"
370381-370393 swd: ack: "OK"
370401-370580 swd: data: "0x00000000"
370613-370659 swd: read: "R AP4"
370671-370683 swd: ack: "OK"
370692-370885 swd: data: "0xabbabeeb"
370918-370964 swd: read: "R AP8"
370976-370988 swd: ack: "OK"
370997-371190 swd: data: "0xabbabeeb"
371223-371269 swd: read: "R APc"
371281-371293 swd: ack: "OK"
371302-371495 swd: data: "0xabbabeeb"
371527-371573 swd: read: "RDBUFF"
371586-371597 swd: ack: "OK"
371606-371799 swd: data: "0xabbabeeb"
371834-371880 swd: write: "W SELECT"
371892-371904 swd: ack: "OK"
371924-372131 swd: data: "0x00000000"
372152-372197 swd: write: "W AP4"
372210-372221 swd: ack: "OK"
372242-372448 swd: data: "0x00000fe0"
372470-372516 swd: write: "W SELECT"
372528-372540 swd: ack: "OK"
372560-372766 swd: data: "0x00000010"
372788-372834 swd: read: "R AP0"
372846-372858 swd: ack: "OK"
372866-373045 swd: data: "0x00000000"
373078-373124 swd: read: "R AP4"
373136-373148 swd: ack: "OK"
373157-373350 swd: data: "0xabbabeeb"
373382-373429 swd: read: "R AP8"
373441-373453 swd: ack: "OK"
373462-373655 swd: data: "0xabbabeeb"
373688-373734 swd: read: "R APc"
373746-373758 swd: ack: "OK"
373767-373960 swd: data: "0xabbabeeb"
373992-374038 swd: read: "RDBUFF"
374050-374062 swd: ack: "OK"
374071-374264 swd: data: "0xabbabeeb"
374299-374345 swd: write: "W SELECT"
374357-374369 swd: ack: "OK"
374389-374595 swd: data: "0x00000000"
374617-374662 swd: write: "W AP4"
374675-374686 swd: ack: "OK"
374706-374913 swd: data: "0x00000ff0"
374935-374981 swd: write: "W SELECT"
374993-375005 swd: ack: "OK"
375025-375231 swd: data: "0x00000010"
375253-375299 swd: read: "R AP0"
375311-375323 swd: ack: "OK"
375331-375510 swd: data: "0x00000000"
375543-375589 swd: read: "R AP4"
375601-375613 swd: ack: "OK"
375622-375815 swd: data: "0xabbabeeb"
375848-375894 swd: read: "R AP8"
375906-375918 swd: ack: "OK"
375927-376120 swd: data: "0xabbabeeb"
376153-376199 swd: read: "R APc"
376211-376223 swd: ack: "OK"
376232-376425 swd: data: "0xabbabeeb"
376457-376503 swd: read: "RDBUFF"
376516-376527 swd: ack: "OK"
376536-376729 swd: data: "0xabbabeeb"
391755-391801 swd: write: "W SELECT"
391813-391825 swd: ack: "OK"
391845-392052 swd: data: "0x00000000"
392073-392119 swd: write: "W AP0"
392131-392143 swd: ack: "OK"
392163-392369 swd: data: "0x23000000"
392400-392445 swd: write: "W AP4"
392458-392469 swd: ack: "OK"
392490-392696 swd: data: "0x00001400"
392716-392762 swd: read: "R APc"
392775-392786 swd: ack: "OK"
392794-392973 swd: data: "0x00000000"
393006-393052 swd: read: "RDBUFF"
393064-393076 swd: ack: "OK"
393085-393278 swd: data: "0xabbabeeb"
393348-393393 swd: write: "W AP4"
393406-393417 swd: ack: "OK"
393438-393644 swd: data: "0x00001401"
393664-393710 swd: read: "R APc"
393722-393734 swd: ack: "OK"
393742-393921 swd: data: "0x00000000"
393953-394000 swd: read: "RDBUFF"
394012-394023 swd: ack: "OK"
394033-394225 swd: data: "0xabbabeeb"
394296-394341 swd: write: "W AP4"
394354-394365 swd: ack: "OK"
394385-394592 swd: data: "0x00001402"
394612-394658 swd: read: "R APc"
394670-394682 swd: ack: "OK"
394690-394869 swd: data: "0x00000000"
394901-394947 swd: read: "RDBUFF"
394960-394971 swd: ack: "OK"
394980-395173 swd: data: "0xabbabeeb"
395243-395289 swd: write: "W AP4"
395302-395313 swd: ack: "OK"
395333-395540 swd: data: "0x00001403"
395560-395606 swd: read: "R APc"
395618-395630 swd: ack: "OK"
395638-395817 swd: data: "0x00000000"
395849-395895 swd: read: "RDBUFF"
395908-395919 swd: ack: "OK"
395928-396121 swd: data: "0xabbabeeb"
396191-396237 swd: write: "W AP4"
396250-396261 swd: ack: "OK"
396281-396488 swd: data: "0x00001404"
396507-396554 swd: read: "R APc"
396566-396578 swd: ack: "OK"
396586-396765 swd: data: "0x00000000"
396797-396843 swd: read: "RDBUFF"
396856-396867 swd: ack: "OK"
396876-397069 swd: data: "0xabbabeeb"
397139-397185 swd: write: "W AP4"
397197-397209 swd: ack: "OK"
397229-397436 swd: data: "0x00001405"
397455-397502 swd: read: "R APc"
397514-397526 swd: ack: "OK"
397534-397713 swd: data: "0x00000000"
397745-397791 swd: read: "RDBUFF"
397804-397815 swd: ack: "OK"
397824-398017 swd: data: "0xabbabeeb"
398087-398133 swd: write: "W AP4"
398145-398157 swd: ack: "OK"
398177-398384 swd: data: "0x00001406"
398404-398450 swd: read: "R APc"
398462-398474 swd: ack: "OK"
398482-398661 swd: data: "0x00000000"
398693-398739 swd: read: "RDBUFF"
398752-398763 swd: ack: "OK"
398772-398965 swd: data: "0xabbabeeb"
399035-399081 swd: write: "W AP4"
399093-399105 swd: ack: "OK"
399125-399332 swd: data: "0x00001407"
399351-399398 swd: read: "R APc"
399410-399421 swd: ack: "OK"
399430-399609 swd: data: "0x00000000"
399641-399687 swd: read: "RDBUFF"
399700-399711 swd: ack: "OK"
399720-399913 swd: data: "0xabbabeeb"
399983-400029 swd: write: "W AP4"
400041-400053 swd: ack: "OK"
400073-400279 swd: data: "0x00001408"
400299-400345 swd: read: "R APc"
400358-400369 swd: ack: "OK"
400378-400557 swd: data: "0x00000000"
400589-400635 swd: read: "RDBUFF"
400647-400659 swd: ack: "OK"
400668-400861 swd: data: "0xabbabeeb"
400931-400977 swd: write: "W AP4"
400989-401001 swd: ack: "OK"
401021-401227 swd: data: "0x00001409"
401247-401293 swd: read: "R APc"
401306-401317 swd: ack: "OK"
401326-401505 swd: data: "0x00000000"
401537-401583 swd: read: "RDBUFF"
401595-401607 swd: ack: "OK"
401616-401809 swd: data: "0xabbabeeb"
401879-401925 swd: write: "W AP4"
401937-401949 swd: ack: "OK"
401969-402175 swd: data: "0x0000140a"
402195-402241 swd: read: "R APc"
402254-402265 swd: ack: "OK"
402274-402453 swd: data: "0x00000000"
402485-402531 swd: read: "RDBUFF"
402543-402555 swd: ack: "OK"
402564-402757 swd: data: "0xabbabeeb"
402827-402873 swd: write: "W AP4"
402885-402897 swd: ack: "OK"
402917-403123 swd: data: "0x0000140b"
403143-403189 swd: read: "R APc"
403202-403213 swd: ack: "OK"
403222-403401 swd: data: "0x00000000"
403433-403479 swd: read: "RDBUFF"
403491-403503 swd: ack: "OK"
403512-403705 swd: data: "0xabbabeeb"
403775-403821 swd: write: "W AP4"
403833-403845 swd: ack: "OK"
403865-404071 swd: data: "0x0000140c"
404091-404137 swd: read: "R APc"
404150-404161 swd: ack: "OK"
404170-404349 swd: data: "0x00000000"
404381-404427 swd: read: "RDBUFF"
404439-404451 swd: ack: "OK"
404460-404653 swd: data: "0xabbabeeb"
404723-404769 swd: write: "W AP4"
404781-404793 swd: ack: "OK"
404813-405019 swd: data: "0x0000140d"
405039-405085 swd: read: "R APc"
405098-405109 swd: ack: "OK"
405118-405296 swd: data: "0x00000000"
405329-405375 swd: read: "RDBUFF"
405387-405399 swd: ack: "OK"
405408-405601 swd: data: "0xabbabeeb"
405671-405716 swd: write: "W AP4"
405729-405740 swd: ack: "OK"
405761-405967 swd: data: "0x0000140e"
405987-406033 swd: read: "R APc"
406045-406057 swd: ack: "OK"
406065-406244 swd: data: "0x00000000"
406276-406323 swd: read: "RDBUFF"
406335-406347 swd: ack: "OK"
406356-406548 swd: data: "0xabbabeeb"
406619-406664 swd: write: "W AP4"
406677-406688 swd: ack: "OK"
406708-406915 swd: data: "0x0000140f"
406935-406981 swd: read: "R APc"
406993-407005 swd: ack: "OK"
407013-407192 swd: data: "0x00000000"
407224-407271 swd: read: "RDBUFF"
407283-407295 swd: ack: "OK"
407304-407497 swd: data: "0xabbabeeb"
407567-407612 swd: write: "W AP4"
407625-407636 swd: ack: "OK"
407657-407863 swd: data: "0x00001410"
407883-407929 swd: read: "R APc"
407941-407953 swd: ack: "OK"
407961-408140 swd: data: "0x00000000"
408172-408218 swd: read: "RDBUFF"
408231-408242 swd: ack: "OK"
408251-408444 swd: data: "0xabbabeeb"
408514-408560 swd: write: "W AP4"
408573-408584 swd: ack: "OK"
408604-408811 swd: data: "0x00001411"
408831-408877 swd: read: "R APc"
408889-408901 swd: ack: "OK"
408909-409088 swd: data: "0x00000000"
409120-409166 swd: read: "RDBUFF"
409179-409190 swd: ack: "OK"
409200-409392 swd: data: "0xabbabeeb"
409463-409508 swd: write: "W AP4"
409521-409532 swd: ack: "OK"
409552-409759 swd: data: "0x00001412"
409779-409825 swd: read: "R APc"
409837-409849 swd: ack: "OK"
409857-410036 swd: data: "0x00000000"
410068-410115 swd: read: "RDBUFF"
410127-410138 swd: ack: "OK"
410148-410340 swd: data: "0xabbabeeb"
410411-410456 swd: write: "W AP4"
410469-410480 swd: ack: "OK"
410500-410707 swd: data: "0x00001413"
410727-410773 swd: read: "R APc"
410785-410797 swd: ack: "OK"
410805-410984 swd: data: "0x00000000"
411016-411062 swd: read: "RDBUFF"
411075-411086 swd: ack: "OK"
411095-411288 swd: data: "0xabbabeeb"
411358-411404 swd: write: "W AP4"
411417-411428 swd: ack: "OK"
411448-411655 swd: data: "0x00001414"
411675-411721 swd: read: "R APc"
411733-411745 swd: ack: "OK"
411753-411932 swd: data: "0x00000000"
411964-412010 swd: read: "RDBUFF"
412023-412034 swd: ack: "OK"
412043-412236 swd: data: "0xabbabeeb"
412306-412352 swd: write: "W AP4"
412365-412376 swd: ack: "OK"
412396-412603 swd: data: "0x00001415"
412622-412669 swd: read: "R APc"
412681-412693 swd: ack: "OK"
412701-412880 swd: data: "0x00000000"
412912-412958 swd: read: "RDBUFF"
412971-412982 swd: ack: "OK"
412991-413184 swd: data: "0xabbabeeb"
413254-413300 swd: write: "W AP4"
413312-413324 swd: ack: "OK"
413344-413551 swd: data: "0x00001416"
413570-413616 swd: read: "R APc"
413629-413640 swd: ack: "OK"
413649-413828 swd: data: "0x00000000"
413860-413906 swd: read: "RDBUFF"
413918-413930 swd: ack: "OK"
413939-414132 swd: data: "0xabbabeeb"
414202-414248 swd: write: "W AP4"
414260-414272 swd: ack: "OK"
414292-414498 swd: data: "0x00001417"
414518-414564 swd: read: "R APc"
414577-414588 swd: ack: "OK"
414597-414776 swd: data: "0x00000000"
414808-414854 swd: read: "RDBUFF"
414867-414878 swd: ack: "OK"
414887-415080 swd: data: "0xabbabeeb"
415150-415196 swd: write: "W AP4"
415208-415220 swd: ack: "OK"
415240-415446 swd: data: "0x00001418"
415466-415513 swd: read: "R APc"
415525-415536 swd: ack: "OK"
415545-415724 swd: data: "0x00000000"
415756-415802 swd: read: "RDBUFF"
415815-415826 swd: ack: "OK"
415835-416028 swd: data: "0xabbabeeb"
416098-416144 swd: write: "W AP4"
416156-416168 swd: ack: "OK"
416188-416394 swd: data: "0x00001419"
416414-416460 swd: read: "R APc"
416473-416484 swd: ack: "OK"
416493-416672 swd: data: "0x00000000"
416704-416750 swd: read: "RDBUFF"
416762-416774 swd: ack: "OK"
416783-416976 swd: data: "0xabbabeeb"
417046-417092 swd: write: "W AP4"
417104-417116 swd: ack: "OK"
417136-417342 swd: data: "0x0000141a"
417362-417408 swd: read: "R APc"
417421-417432 swd: ack: "OK"
417441-417619 swd: data: "0x00000000"
417652-417698 swd: read: "RDBUFF"
417710-417722 swd: ack: "OK"
417731-417924 swd: data: "0xabbabeeb"
417994-418040 swd: write: "W AP4"
418052-418063 swd: ack: "OK"
418084-418290 swd: data: "0x0000141b"
418310-418356 swd: read: "R APc"
418369-418380 swd: ack: "OK"
418389-418567 swd: data: "0x00000000"
418600-418646 swd: read: "RDBUFF"
418658-418670 swd: ack: "OK"
418679-418872 swd: data: "0xabbabeeb"
418942-418988 swd: write: "W AP4"
419000-419012 swd: ack: "OK"
419032-419238 swd: data: "0x0000141c"
419258-419304 swd: read: "R APc"
419316-419328 swd: ack: "OK"
419336-419515 swd: data: "0x00000000"
419547-419594 swd: read: "RDBUFF"
419606-419618 swd: ack: "OK"
419627-419820 swd: data: "0xabbabeeb"
419890-419935 swd: write: "W AP4"
419948-419959 swd: ack: "OK"
419980-420186 swd: data: "0x0000141d"
420206-420252 swd: read: "R APc"
420264-420276 swd: ack: "OK"
420284-420463 swd: data: "0x00000000"
420496-420542 swd: read: "RDBUFF"
420554-420566 swd: ack: "OK"
420575-420768 swd: data: "0xabbabeeb"
420838-420883 swd: write: "W AP4"
420896-420907 swd: ack: "OK"
420928-421134 swd: data: "0x0000141e"
421154-421200 swd: read: "R APc"
421213-421224 swd: ack: "OK"
421233-421411 swd: data: "0x00000000"
421444-421490 swd: read: "RDBUFF"
421502-421514 swd: ack: "OK"
421523-421716 swd: data: "0xabbabeeb"
421786-421831 swd: write: "W AP4"
421844-421855 swd: ack: "OK"
421876-422082 swd: data: "0x0000141f"
422102-422148 swd: read: "R APc"
422160-422172 swd: ack: "OK"
422180-422359 swd: data: "0x00000000"
422391-422438 swd: read: "RDBUFF"
422450-422462 swd: ack: "OK"
422471-422663 swd: data: "0xabbabeeb"
422734-422779 swd: write: "W AP4"
422792-422803 swd: ack: "OK"
422823-423030 swd: data: "0x00001420"
423050-423096 swd: read: "R APc"
423108-423120 swd: ack: "OK"
423128-423307 swd: data: "0x00000000"
423339-423385 swd: read: "RDBUFF"
423398-423409 swd: ack: "OK"
423418-423611 swd: data: "0xabbabeeb"
423681-423727 swd: write: "W AP4"
423740-423751 swd: ack: "OK"
423771-423978 swd: data: "0x00001421"
423998-424044 swd: read: "R APc"
424056-424068 swd: ack: "OK"
424076-424255 swd: data: "0x00000000"
424287-424333 swd: read: "RDBUFF"
424346-424357 swd: ack: "OK"
424366-424559 swd: data: "0xabbabeeb"
424629-424675 swd: write: "W AP4"
424688-424699 swd: ack: "OK"
424719-424926 swd: data: "0x00001422"
424946-424992 swd: read: "R APc"
425004-425016 swd: ack: "OK"
425024-425203 swd: data: "0x00000000"
425235-425281 swd: read: "RDBUFF"
425294-425305 swd: ack: "OK"
425315-425507 swd: data: "0xabbabeeb"
425578-425623 swd: write: "W AP4"
425636-425647 swd: ack: "OK"
425667-425874 swd: data: "0x00001423"
425894-425940 swd: read: "R APc"
425952-425964 swd: ack: "OK"
425972-426151 swd: data: "0x00000000"
426183-426229 swd: read: "RDBUFF"
426242-426253 swd: ack: "OK"
426262-426455 swd: data: "0xabbabeeb"
426525-426571 swd: write: "W AP4"
426583-426595 swd: ack: "OK"
426615-426822 swd: data: "0x00001424"
426842-426888 swd: read: "R APc"
426900-426912 swd: ack: "OK"
426920-427099 swd: data: "0x00000000"
427131-427177 swd: read: "RDBUFF"
427190-427201 swd: ack: "OK"
427210-427403 swd: data: "0xabbabeeb"
427473-427519 swd: write: "W AP4"
427532-427543 swd: ack: "OK"
427563-427770 swd: data: "0x00001425"
427789-427836 swd: read: "R APc"
427848-427860 swd: ack: "OK"
427868-428047 swd: data: "0x00000000"
428079-428125 swd: read: "RDBUFF"
428138-428149 swd: ack: "OK"
428158-428351 swd: data: "0xabbabeeb"
428421-428467 swd: write: "W AP4"
428479-428491 swd: ack: "OK"
428511-428717 swd: data: "0x00001426"
428737-428783 swd: read: "R APc"
428796-428807 swd: ack: "OK"
428816-428995 swd: data: "0x00000000"
429027-429073 swd: read: "RDBUFF"
429085-429097 swd: ack: "OK"
429106-429299 swd: data: "0xabbabeeb"
429369-429415 swd: write: "W AP4"
429427-429439 swd: ack: "OK"
429459-429665 swd: data: "0x00001427"
429685-429731 swd: read: "R APc"
429744-429755 swd: ack: "OK"
429764-429943 swd: data: "0x00000000"
429975-430021 swd: read: "RDBUFF"
430033-430045 swd: ack: "OK"
430054-430247 swd: data: "0xabbabeeb"
430317-430363 swd: write: "W AP4"
430375-430387 swd: ack: "OK"
430407-430613 swd: data: "0x00001428"
430633-430679 swd: read: "R APc"
430692-430703 swd: ack: "OK"
430712-430891 swd: data: "0x00000000"
430923-430969 swd: read: "RDBUFF"
430981-430993 swd: ack: "OK"
431002-431195 swd: data: "0xabbabeeb"
431265-431311 swd: write: "W AP4"
431323-431335 swd: ack: "OK"
431355-431561 swd: data: "0x00001429"
431581-431627 swd: read: "R APc"
431640-431651 swd: ack: "OK"
431660-431839 swd: data: "0x00000000"
431871-431917 swd: read: "RDBUFF"
431929-431941 swd: ack: "OK"
431950-432143 swd: data: "0xabbabeeb"
432213-432259 swd: write: "W AP4"
432271-432283 swd: ack: "OK"
432303-432509 swd: data: "0x0000142a"
432529-432575 swd: read: "R APc"
432588-432599 swd: ack: "OK"
432608-432786 swd: data: "0x00000000"
432819-432865 swd: read: "RDBUFF"
432877-432889 swd: ack: "OK"
432898-433091 swd: data: "0xabbabeeb"
433161-433206 swd: write: "W AP4"
433219-433230 swd: ack: "OK"
433251-433457 swd: data: "0x0000142b"
433477-433523 swd: read: "R APc"
433536-433547 swd: ack: "OK"
433556-433734 swd: data: "0x00000000"
433767-433813 swd: read: "RDBUFF"
433825-433837 swd: ack: "OK"
433846-434039 swd: data: "0xabbabeeb"
434109-434155 swd: write: "W AP4"
434167-434178 swd: ack: "OK"
434199-434405 swd: data: "0x0000142c"
434425-434471 swd: read: "R APc"
434483-434495 swd: ack: "OK"
434503-434682 swd: data: "0x00000000"
434714-434761 swd: read: "RDBUFF"
434773-434785 swd: ack: "OK"
434794-434986 swd: data: "0xabbabeeb"
435057-435102 swd: write: "W AP4"
435115-435126 swd: ack: "OK"
435146-435353 swd: data: "0x0000142d"
435373-435419 swd: read: "R APc"
435431-435443 swd: ack: "OK"
435451-435630 swd: data: "0x00000000"
435662-435709 swd: read: "RDBUFF"
435721-435733 swd: ack: "OK"
435742-435935 swd: data: "0xabbabeeb"
436005-436050 swd: write: "W AP4"
436063-436074 swd: ack: "OK"
436095-436301 swd: data: "0x0000142e"
436321-436367 swd: read: "R APc"
436379-436391 swd: ack: "OK"
436399-436578 swd: data: "0x00000000"
436611-436657 swd: read: "RDBUFF"
436669-436681 swd: ack: "OK"
436690-436883 swd: data: "0xabbabeeb"
436953-436998 swd: write: "W AP4"
437011-437022 swd: ack: "OK"
437043-437249 swd: data: "0x0000142f"
437269-437315 swd: read: "R APc"
437327-437339 swd: ack: "OK"
437347-437526 swd: data: "0x00000000"
437558-437604 swd: read: "RDBUFF"
437617-437628 swd: ack: "OK"
437638-437830 swd: data: "0xabbabeeb"
437901-437946 swd: write: "W AP4"
437959-437970 swd: ack: "OK"
437990-438197 swd: data: "0x00001430"
438217-438263 swd: read: "R APc"
438275-438287 swd: ack: "OK"
438295-438474 swd: data: "0x00000000"
438506-438553 swd: read: "RDBUFF"
438565-438577 swd: ack: "OK"
438586-438778 swd: data: "0xabbabeeb"
438849-438894 swd: write: "W AP4"
438907-438918 swd: ack: "OK"
438938-439145 swd: data: "0x00001431"
439165-439211 swd: read: "R APc"
439223-439235 swd: ack: "OK"
439243-439422 swd: data: "0x00000000"
439454-439500 swd: read: "RDBUFF"
439513-439524 swd: ack: "OK"
439533-439726 swd: data: "0xabbabeeb"
439796-439842 swd: write: "W AP4"
439855-439866 swd: ack: "OK"
439886-440093 swd: data: "0x00001432"
440112-440159 swd: read: "R APc"
440171-440183 swd: ack: "OK"
440191-440370 swd: data: "0x00000000"
440402-440448 swd: read: "RDBUFF"
440461-440472 swd: ack: "OK"
440481-440674 swd: data: "0xabbabeeb"
440744-440790 swd: write: "W AP4"
440802-440814 swd: ack: "OK"
440834-441040 swd: data: "0x00001433"
441060-441107 swd: read: "R APc"
441119-441131 swd: ack: "OK"
441139-441318 swd: data: "0x00000000"
441350-441396 swd: read: "RDBUFF"
441409-441420 swd: ack: "OK"
441429-441622 swd: data: "0xabbabeeb"
441692-441738 swd: write: "W AP4"
441750-441762 swd: ack: "OK"
441782-441989 swd: data: "0x00001434"
442008-442054 swd: read: "R APc"
442067-442078 swd: ack: "OK"
442087-442266 swd: data: "0x00000000"
442298-442344 swd: read: "RDBUFF"
442356-442368 swd: ack: "OK"
442377-442570 swd: data: "0xabbabeeb"
442640-442686 swd: write: "W AP4"
442698-442710 swd: ack: "OK"
442730-442936 swd: data: "0x00001435"
442956-443002 swd: read: "R APc"
443015-443026 swd: ack: "OK"
443035-443214 swd: data: "0x00000000"
443246-443292 swd: read: "RDBUFF"
443305-443316 swd: ack: "OK"
443325-443518 swd: data: "0xabbabeeb"
443588-443634 swd: write: "W AP4"
443646-443658 swd: ack: "OK"
443678-443884 swd: data: "0x00001436"
443904-443951 swd: read: "R APc"
443963-443974 swd: ack: "OK"
443983-444162 swd: data: "0x00000000"
444194-444240 swd: read: "RDBUFF"
444253-444264 swd: ack: "OK"
444273-444466 swd: data: "0xabbabeeb"
444536-444582 swd: write: "W AP4"
444594-444606 swd: ack: "OK"
444626-444832 swd: data: "0x00001437"
444852-444898 swd: read: "R APc"
444911-444922 swd: ack: "OK"
444931-445110 swd: data: "0x00000000"
445142-445188 swd: read: "RDBUFF"
445200-445212 swd: ack: "OK"
445221-445414 swd: data: "0xabbabeeb"
445484-445530 swd: write: "W AP4"
445542-445554 swd: ack: "OK"
445574-445780 swd: data: "0x00001438"
445800-445846 swd: read: "R APc"
445859-445870 swd: ack: "OK"
445879-446057 swd: data: "0x00000000"
446090-446136 swd: read: "RDBUFF"
446148-446160 swd: ack: "OK"
446169-446362 swd: data: "0xabbabeeb"
446432-446478 swd: write: "W AP4"
446490-446502 swd: ack: "OK"
446522-446728 swd: data: "0x00001439"
446748-446794 swd: read: "R APc"
446807-446818 swd: ack: "OK"
446827-447005 swd: data: "0x00000000"
447038-447084 swd: read: "RDBUFF"
447096-447108 swd: ack: "OK"
447117-447310 swd: data: "0xabbabeeb"
447380-447426 swd: write: "W AP4"
447438-447450 swd: ack: "OK"
447470-447676 swd: data: "0x0000143a"
447696-447742 swd: read: "R APc"
447755-447766 swd: ack: "OK"
447775-447954 swd: data: "0x00000000"
447986-448032 swd: read: "RDBUFF"
448044-448056 swd: ack: "OK"
448065-448258 swd: data: "0xabbabeeb"
448328-448374 swd: write: "W AP4"
448386-448398 swd: ack: "OK"
448418-448624 swd: data: "0x0000143b"
448644-448690 swd: read: "R APc"
448703-448714 swd: ack: "OK"
448722-448901 swd: data: "0x00000000"
448934-448980 swd: read: "RDBUFF"
448992-449004 swd: ack: "OK"
449013-449206 swd: data: "0xabbabeeb"
449276-449321 swd: write: "W AP4"
449334-449345 swd: ack: "OK"
449366-449572 swd: data: "0x0000143c"
449592-449638 swd: read: "R APc"
449651-449662 swd: ack: "OK"
449671-449849 swd: data: "0x00000000"
449882-449928 swd: read: "RDBUFF"
449940-449952 swd: ack: "OK"
449961-450154 swd: data: "0xabbabeeb"
450224-450269 swd: write: "W AP4"
450282-450293 swd: ack: "OK"
450314-450520 swd: data: "0x0000143d"
450540-450586 swd: read: "R APc"
450598-450610 swd: ack: "OK"
450618-450797 swd: data: "0x00000000"
450829-450876 swd: read: "RDBUFF"
450888-450900 swd: ack: "OK"
450909-451101 swd: data: "0xabbabeeb"
451172-451217 swd: write: "W AP4"
451230-451241 swd: ack: "OK"
451261-451468 swd: data: "0x0000143e"
451488-451534 swd: read: "R APc"
451546-451558 swd: ack: "OK"
451566-451745 swd: data: "0x00000000"
451777-451823 swd: read: "RDBUFF"
451836-451847 swd: ack: "OK"
451856-452049 swd: data: "0xabbabeeb"
452119-452165 swd: write: "W AP4"
452178-452189 swd: ack: "OK"
452209-452416 swd: data: "0x0000143f"
452436-452482 swd: read: "R APc"
452494-452506 swd: ack: "OK"
452514-452693 swd: data: "0x00000000"
452725-452771 swd: read: "RDBUFF"
452784-452795 swd: ack: "OK"
452804-452997 swd: data: "0xabbabeeb"
460537-460582 swd: write: "W AP4"
460595-460606 swd: ack: "OK"
460627-460833 swd: data: "0x00001440"
460853-460899 swd: read: "R APc"
460911-460923 swd: ack: "OK"
460931-461110 swd: data: "0x00000000"
461142-461188 swd: read: "RDBUFF"
461201-461212 swd: ack: "OK"
461221-461414 swd: data: "0xabbabeeb"
461484-461530 swd: write: "W AP4"
461543-461554 swd: ack: "OK"
461574-461781 swd: data: "0x00001441"
461801-461847 swd: read: "R APc"
461859-461871 swd: ack: "OK"
461879-462058 swd: data: "0x00000000"
462090-462136 swd: read: "RDBUFF"
462149-462160 swd: ack: "OK"
462170-462362 swd: data: "0xabbabeeb"
462433-462478 swd: write: "W AP4"
462491-462502 swd: ack: "OK"
462522-462729 swd: data: "0x00001442"
462749-462795 swd: read: "R APc"
462807-462819 swd: ack: "OK"
462827-463006 swd: data: "0x00000000"
463038-463085 swd: read: "RDBUFF"
463097-463108 swd: ack: "OK"
463118-463310 swd: data: "0xabbabeeb"
463381-463426 swd: write: "W AP4"
463439-463450 swd: ack: "OK"
463470-463677 swd: data: "0x00001443"
463697-463743 swd: read: "R APc"
463755-463767 swd: ack: "OK"
463775-463954 swd: data: "0x00000000"
463986-464032 swd: read: "RDBUFF"
464045-464056 swd: ack: "OK"
464065-464258 swd: data: "0xabbabeeb"
464328-464374 swd: write: "W AP4"
464387-464398 swd: ack: "OK"
464418-464625 swd: data: "0x00001444"
464645-464691 swd: read: "R APc"
464703-464715 swd: ack: "OK"
464723-464902 swd: data: "0x00000000"
464934-464980 swd: read: "RDBUFF"
464993-465004 swd: ack: "OK"
465013-465206 swd: data: "0xabbabeeb"
465276-465322 swd: write: "W AP4"
465335-465346 swd: ack: "OK"
465366-465573 swd: data: "0x00001445"
465592-465639 swd: read: "R APc"
465651-465663 swd: ack: "OK"
465671-465850 swd: data: "0x00000000"
465882-465928 swd: read: "RDBUFF"
465941-465952 swd: ack: "OK"
465961-466154 swd: data: "0xabbabeeb"
466224-466270 swd: write: "W AP4"
466282-466294 swd: ack: "OK"
466314-466521 swd: data: "0x00001446"
466540-466586 swd: read: "R APc"
466599-466610 swd: ack: "OK"
466619-466798 swd: data: "0x00000000"
466830-466876 swd: read: "RDBUFF"
466888-466900 swd: ack: "OK"
466909-467102 swd: data: "0xabbabeeb"
467172-467218 swd: write: "W AP4"
467230-467242 swd: ack: "OK"
467262-467468 swd: data: "0x00001447"
467488-467534 swd: read: "R APc"
467547-467558 swd: ack: "OK"
467567-467746 swd: data: "0x00000000"
467778-467824 swd: read: "RDBUFF"
467837-467848 swd: ack: "OK"
467857-468050 swd: data: "0xabbabeeb"
468120-468166 swd: write: "W AP4"
468178-468190 swd: ack: "OK"
468210-468416 swd: data: "0x00001448"
468436-468483 swd: read: "R APc"
468495-468506 swd: ack: "OK"
468515-468694 swd: data: "0x00000000"
468726-468772 swd: read: "RDBUFF"
468785-468796 swd: ack: "OK"
468805-468998 swd: data: "0xabbabeeb"
469068-469114 swd: write: "W AP4"
469126-469138 swd: ack: "OK"
469158-469364 swd: data: "0x00001449"
469384-469430 swd: read: "R APc"
469443-469454 swd: ack: "OK"
469463-469642 swd: data: "0x00000000"
469674-469720 swd: read: "RDBUFF"
469732-469744 swd: ack: "OK"
469753-469946 swd: data: "0xabbabeeb"
470016-470062 swd: write: "W AP4"
470074-470086 swd: ack: "OK"
470106-470312 swd: data: "0x0000144a"
470332-470378 swd: read: "R APc"
470391-470402 swd: ack: "OK"
470411-470589 swd: data: "0x00000000"
470622-470668 swd: read: "RDBUFF"
470680-470692 swd: ack: "OK"
470701-470894 swd: data: "0xabbabeeb"
470964-471010 swd: write: "W AP4"
471022-471033 swd: ack: "OK"
471054-471260 swd: data: "0x0000144b"
471280-471326 swd: read: "R APc"
471339-471350 swd: ack: "OK"
471359-471537 swd: data: "0x00000000"
471570-471616 swd: read: "RDBUFF"
471628-471640 swd: ack: "OK"
471649-471842 swd: data: "0xabbabeeb"
471912-471958 swd: write: "W AP4"
471970-471982 swd: ack: "OK"
472002-472208 swd: data: "0x0000144c"
472228-472274 swd: read: "R APc"
472286-472298 swd: ack: "OK"
472306-472485 swd: data: "0x00000000"
472517-472564 swd: read: "RDBUFF"
472576-472588 swd: ack: "OK"
472597-472790 swd: data: "0xabbabeeb"
472860-472905 swd: write: "W AP4"
472918-472929 swd: ack: "OK"
472950-473156 swd: data: "0x0000144d"
473176-473222 swd: read: "R APc"
473235-473246 swd: ack: "OK"
473254-473433 swd: data: "0x00000000"
473466-473512 swd: read: "RDBUFF"
473524-473536 swd: ack: "OK"
473545-473738 swd: data: "0xabbabeeb"
473808-473853 swd: write: "W AP4"
473866-473877 swd: ack: "OK"
473898-474104 swd: data: "0x0000144e"
474124-474170 swd: read: "R APc"
474183-474194 swd: ack: "OK"
474203-474381 swd: data: "0x00000000"
474414-474460 swd: read: "RDBUFF"
474472-474484 swd: ack: "OK"
474493-474686 swd: data: "0xabbabeeb"
474756-474801 swd: write: "W AP4"
474814-474825 swd: ack: "OK"
474846-475052 swd: data: "0x0000144f"
475072-475118 swd: read: "R APc"
475130-475142 swd: ack: "OK"
475150-475329 swd: data: "0x00000000"
475361-475408 swd: read: "RDBUFF"
475420-475432 swd: ack: "OK"
475441-475633 swd: data: "0xabbabeeb"
475704-475749 swd: write: "W AP4"
475762-475773 swd: ack: "OK"
475793-476000 swd: data: "0x00001450"
476020-476066 swd: read: "R APc"
476078-476090 swd: ack: "OK"
476098-476277 swd: data: "0x00000000"
476309-476356 swd: read: "RDBUFF"
476368-476380 swd: ack: "OK"
476389-476582 swd: data: "0xabbabeeb"
476652-476697 swd: write: "W AP4"
476710-476721 swd: ack: "OK"
476742-476948 swd: data: "0x00001451"
476968-477014 swd: read: "R APc"
477026-477038 swd: ack: "OK"
477046-477225 swd: data: "0x00000000"
477257-477303 swd: read: "RDBUFF"
477316-477327 swd: ack: "OK"
477336-477529 swd: data: "0xabbabeeb"
477599-477645 swd: write: "W AP4"
477658-477669 swd: ack: "OK"
477689-477896 swd: data: "0x00001452"
477915-477962 swd: read: "R APc"
477974-477986 swd: ack: "OK"
477994-478173 swd: data: "0x00000000"
478205-478251 swd: read: "RDBUFF"
478264-478275 swd: ack: "OK"
478284-478477 swd: data: "0xabbabeeb"
478547-478593 swd: write: "W AP4"
478605-478617 swd: ack: "OK"
478637-478844 swd: data: "0x00001453"
478864-478910 swd: read: "R APc"
478922-478934 swd: ack: "OK"
478942-479121 swd: data: "0x00000000"
479153-479199 swd: read: "RDBUFF"
479212-479223 swd: ack: "OK"
479232-479425 swd: data: "0xabbabeeb"
479495-479541 swd: write: "W AP4"
479553-479565 swd: ack: "OK"
479585-479792 swd: data: "0x00001454"
479811-479858 swd: read: "R APc"
479870-479881 swd: ack: "OK"
479890-480069 swd: data: "0x00000000"
480101-480147 swd: read: "RDBUFF"
480160-480171 swd: ack: "OK"
480180-480373 swd: data: "0xabbabeeb"
480443-480489 swd: write: "W AP4"
480501-480513 swd: ack: "OK"
480533-480739 swd: data: "0x00001455"
480759-480806 swd: read: "R APc"
480818-480830 swd: ack: "OK"
480838-481017 swd: data: "0x00000000"
481049-481095 swd: read: "RDBUFF"
481108-481119 swd: ack: "OK"
481128-481321 swd: data: "0xabbabeeb"
481391-481437 swd: write: "W AP4"
481449-481461 swd: ack: "OK"
481481-481687 swd: data: "0x00001456"
481707-481754 swd: read: "R APc"
481766-481778 swd: ack: "OK"
481786-481965 swd: data: "0x00000000"
481997-482043 swd: read: "RDBUFF"
482056-482067 swd: ack: "OK"
482076-482269 swd: data: "0xabbabeeb"
482339-482385 swd: write: "W AP4"
482397-482409 swd: ack: "OK"
482429-482636 swd: data: "0x00001457"
482655-482701 swd: read: "R APc"
482714-482725 swd: ack: "OK"
482734-482913 swd: data: "0x00000000"
482945-482991 swd: read: "RDBUFF"
483003-483015 swd: ack: "OK"
483024-483217 swd: data: "0xabbabeeb"
483287-483333 swd: write: "W AP4"
483345-483357 swd: ack: "OK"
483377-483583 swd: data: "0x00001458"
483603-483649 swd: read: "R APc"
483662-483673 swd: ack: "OK"
483682-483861 swd: data: "0x00000000"
483893-483939 swd: read: "RDBUFF"
483951-483963 swd: ack: "OK"
483972-484165 swd: data: "0xabbabeeb"
484235-484281 swd: write: "W AP4"
484293-484305 swd: ack: "OK"
484325-484531 swd: data: "0x00001459"
484551-484597 swd: read: "R APc"
484610-484621 swd: ack: "OK"
484630-484809 swd: data: "0x00000000"
484841-484887 swd: read: "RDBUFF"
484899-484911 swd: ack: "OK"
484920-485113 swd: data: "0xabbabeeb"
485183-485229 swd: write: "W AP4"
485241-485253 swd: ack: "OK"
485273-485479 swd: data: "0x0000145a"
485499-485545 swd: read: "R APc"
485558-485569 swd: ack: "OK"
485578-485757 swd: data: "0x00000000"
485789-485835 swd: read: "RDBUFF"
485847-485859 swd: ack: "OK"
485868-486061 swd: data: "0xabbabeeb"
486131-486177 swd: write: "W AP4"
486189-486201 swd: ack: "OK"
486221-486427 swd: data: "0x0000145b"
486447-486493 swd: read: "R APc"
486506-486517 swd: ack: "OK"
486526-486704 swd: data: "0x00000000"
486737-486783 swd: read: "RDBUFF"
486795-486807 swd: ack: "OK"
486816-487009 swd: data: "0xabbabeeb"
487079-487125 swd: write: "W AP4"
487137-487148 swd: ack: "OK"
487169-487375 swd: data: "0x0000145c"
487395-487441 swd: read: "R APc"
487454-487465 swd: ack: "OK"
487474-487652 swd: data: "0x00000000"
487685-487731 swd: read: "RDBUFF"
487743-487755 swd: ack: "OK"
487764-487957 swd: data: "0xabbabeeb"
488027-488073 swd: write: "W AP4"
488085-488097 swd: ack: "OK"
488117-488323 swd: data: "0x0000145d"
488343-488389 swd: read: "R APc"
488401-488413 swd: ack: "OK"
488421-488600 swd: data: "0x00000000"
488632-488679 swd: read: "RDBUFF"
488691-488703 swd: ack: "OK"
488712-488905 swd: data: "0xabbabeeb"
488975-489020 swd: write: "W AP4"
489033-489044 swd: ack: "OK"
489065-489271 swd: data: "0x0000145e"
489291-489337 swd: read: "R APc"
489349-489361 swd: ack: "OK"
489369-489548 swd: data: "0x00000000"
489580-489626 swd: read: "RDBUFF"
489639-489650 swd: ack: "OK"
489660-489852 swd: data: "0xabbabeeb"
489922-489968 swd: write: "W AP4"
489981-489992 swd: ack: "OK"
490012-490219 swd: data: "0x0000145f"
490239-490285 swd: read: "R APc"
490297-490309 swd: ack: "OK"
490317-490496 swd: data: "0x00000000"
490528-490574 swd: read: "RDBUFF"
490587-490598 swd: ack: "OK"
490608-490800 swd: data: "0xabbabeeb"
490871-490916 swd: write: "W AP4"
490929-490940 swd: ack: "OK"
490960-491167 swd: data: "0x00001460"
491187-491233 swd: read: "R APc"
491245-491257 swd: ack: "OK"
491265-491444 swd: data: "0x00000000"
491476-491523 swd: read: "RDBUFF"
491535-491547 swd: ack: "OK"
491556-491748 swd: data: "0xabbabeeb"
491819-491864 swd: write: "W AP4"
491877-491888 swd: ack: "OK"
491908-492115 swd: data: "0x00001461"
492135-492181 swd: read: "R APc"
492193-492205 swd: ack: "OK"
492213-492392 swd: data: "0x00000000"
492424-492470 swd: read: "RDBUFF"
492483-492494 swd: ack: "OK"
492503-492696 swd: data: "0xabbabeeb"
492766-492812 swd: write: "W AP4"
492825-492836 swd: ack: "OK"
492856-493063 swd: data: "0x00001462"
493082-493129 swd: read: "R APc"
493141-493153 swd: ack: "OK"
493161-493340 swd: data: "0x00000000"
493372-493418 swd: read: "RDBUFF"
493431-493442 swd: ack: "OK"
493451-493644 swd: data: "0xabbabeeb"
493714-493760 swd: write: "W AP4"
493772-493784 swd: ack: "OK"
493804-494010 swd: data: "0x00001463"
494030-494077 swd: read: "R APc"
494089-494101 swd: ack: "OK"
494109-494288 swd: data: "0x00000000"
494320-494366 swd: read: "RDBUFF"
494379-494390 swd: ack: "OK"
494399-494592 swd: data: "0xabbabeeb"
494662-494708 swd: write: "W AP4"
494720-494732 swd: ack: "OK"
494752-494959 swd: data: "0x00001464"
494978-495024 swd: read: "R APc"
495037-495048 swd: ack: "OK"
495057-495236 swd: data: "0x00000000"
495268-495314 swd: read: "RDBUFF"
495326-495338 swd: ack: "OK"
495347-495540 swd: data: "0xabbabeeb"
495610-495656 swd: write: "W AP4"
495668-495680 swd: ack: "OK"
495700-495906 swd: data: "0x00001465"
495926-495972 swd: read: "R APc"
495985-495996 swd: ack: "OK"
496005-496184 swd: data: "0x00000000"
496216-496262 swd: read: "RDBUFF"
496275-496286 swd: ack: "OK"
496295-496488 swd: data: "0xabbabeeb"
496558-496604 swd: write: "W AP4"
496616-496628 swd: ack: "OK"
496648-496854 swd: data: "0x00001466"
496874-496921 swd: read: "R APc"
496933-496945 swd: ack: "OK"
496953-497132 swd: data: "0x00000000"
497164-497210 swd: read: "RDBUFF"
497223-497234 swd: ack: "OK"
497243-497436 swd: data: "0xabbabeeb"
497506-497552 swd: write: "W AP4"
497564-497576 swd: ack: "OK"
497596-497802 swd: data: "0x00001467"
497822-497868 swd: read: "R APc"
497881-497892 swd: ack: "OK"
497901-498080 swd: data: "0x00000000"
498112-498158 swd: read: "RDBUFF"
498170-498182 swd: ack: "OK"
498191-498384 swd: data: "0xabbabeeb"
498454-498500 swd: write: "W AP4"
498512-498524 swd: ack: "OK"
498544-498750 swd: data: "0x00001468"
498770-498816 swd: read: "R APc"
498829-498840 swd: ack: "OK"
498849-499027 swd: data: "0x00000000"
499060-499106 swd: read: "RDBUFF"
499118-499130 swd: ack: "OK"
499139-499332 swd: data: "0xabbabeeb"
499402-499448 swd: write: "W AP4"
499460-499472 swd: ack: "OK"
499492-499698 swd: data: "0x00001469"
499718-499764 swd: read: "R APc"
499777-499788 swd: ack: "OK"
499797-499976 swd: data: "0x00000000"
