1114-1367 rc_encode: bit-0: "0"
1114-1367 rc_encode: pin: "A0"
1367-1620 rc_encode: bit-f: "f"
1367-1620 rc_encode: pin: "A1"
1620-1872 rc_encode: bit-0: "0"
1620-1872 rc_encode: pin: "A2"
1872-2125 rc_encode: bit-f: "f"
1872-2125 rc_encode: pin: "A3"
2125-2377 rc_encode: bit-0: "0"
2125-2377 rc_encode: pin: "A4"
2377-2630 rc_encode: bit-f: "f"
2377-2630 rc_encode: pin: "A5"
2630-2882 rc_encode: bit-0: "0"
2630-2882 rc_encode: pin: "A6/D5"
2882-3135 rc_encode: bit-f: "f"
2882-3135 rc_encode: pin: "A7/D4"
3135-3388 rc_encode: bit-f: "f"
3135-3388 rc_encode: pin: "A8/D3"
3388-3640 rc_encode: bit-f: "f"
3388-3640 rc_encode: pin: "A9/D2"
3640-3893 rc_encode: bit-f: "f"
3640-3893 rc_encode: pin: "A10/D1"
3893-4145 rc_encode: bit-0: "0"
3893-4145 rc_encode: pin: "A11/D0"
4145-4397 rc_encode: bit-sync: "Sync"
5153-5406 rc_encode: bit-0: "0"
5153-5406 rc_encode: pin: "A0"
5406-5659 rc_encode: bit-f: "f"
5406-5659 rc_encode: pin: "A1"
5659-5911 rc_encode: bit-0: "0"
5659-5911 rc_encode: pin: "A2"
5911-6164 rc_encode: bit-f: "f"
5911-6164 rc_encode: pin: "A3"
6164-6416 rc_encode: bit-0: "0"
6164-6416 rc_encode: pin: "A4"
6416-6669 rc_encode: bit-f: "f"
6416-6669 rc_encode: pin: "A5"
6669-6921 rc_encode: bit-0: "0"
6669-6921 rc_encode: pin: "A6/D5"
6921-7174 rc_encode: bit-f: "f"
6921-7174 rc_encode: pin: "A7/D4"
7174-7426 rc_encode: bit-f: "f"
7174-7426 rc_encode: pin: "A8/D3"
7426-7679 rc_encode: bit-f: "f"
7426-7679 rc_encode: pin: "A9/D2"
7679-7932 rc_encode: bit-f: "f"
7679-7932 rc_encode: pin: "A10/D1"
7932-8184 rc_encode: bit-0: "0"
7932-8184 rc_encode: pin: "A11/D0"
8184-8436 rc_encode: bit-sync: "Sync"
9192-9445 rc_encode: bit-0: "0"
9192-9445 rc_encode: pin: "A0"
9445-9698 rc_encode: bit-f: "f"
9445-9698 rc_encode: pin: "A1"
9698-9950 rc_encode: bit-0: "0"
9698-9950 rc_encode: pin: "A2"
9950-10203 rc_encode: bit-f: "f"
9950-10203 rc_encode: pin: "A3"
10203-10455 rc_encode: bit-0: "0"
10203-10455 rc_encode: pin: "A4"
10455-10708 rc_encode: bit-f: "f"
10455-10708 rc_encode: pin: "A5"
10708-10960 rc_encode: bit-0: "0"
10708-10960 rc_encode: pin: "A6/D5"
10960-11213 rc_encode: bit-f: "f"
10960-11213 rc_encode: pin: "A7/D4"
11213-11465 rc_encode: bit-f: "f"
11213-11465 rc_encode: pin: "A8/D3"
11465-11718 rc_encode: bit-f: "f"
11465-11718 rc_encode: pin: "A9/D2"
11718-11971 rc_encode: bit-f: "f"
11718-11971 rc_encode: pin: "A10/D1"
11971-12223 rc_encode: bit-0: "0"
11971-12223 rc_encode: pin: "A11/D0"
12223-12475 rc_encode: bit-sync: "Sync"
