0-11 pwm: duty-cycle: "54.545455%"
0-11 pwm: period: "687.5 ns"
0-11 pwm: frequency: "1.455 MHz"
11-23 pwm: duty-cycle: "50.000000%"
11-23 pwm: period: "750.0 ns"
11-23 pwm: frequency: "1.333 MHz"
23-34 pwm: duty-cycle: "45.454545%"
23-34 pwm: period: "687.5 ns"
23-34 pwm: frequency: "1.455 MHz"
34-46 pwm: duty-cycle: "50.000000%"
34-46 pwm: period: "750.0 ns"
34-46 pwm: frequency: "1.333 MHz"
46-57 pwm: duty-cycle: "45.454545%"
46-57 pwm: period: "687.5 ns"
46-57 pwm: frequency: "1.455 MHz"
57-68 pwm: duty-cycle: "54.545455%"
57-68 pwm: period: "687.5 ns"
57-68 pwm: frequency: "1.455 MHz"
68-80 pwm: duty-cycle: "50.000000%"
68-80 pwm: period: "750.0 ns"
68-80 pwm: frequency: "1.333 MHz"
80-140 pwm: duty-cycle: "90.000000%"
80-140 pwm: period: "3.8 μs"
80-140 pwm: frequency: "266.667 kHz"
140-151 pwm: duty-cycle: "45.454545%"
140-151 pwm: period: "687.5 ns"
140-151 pwm: frequency: "1.455 MHz"
151-162 pwm: duty-cycle: "54.545455%"
151-162 pwm: period: "687.5 ns"
151-162 pwm: frequency: "1.455 MHz"
162-174 pwm: duty-cycle: "50.000000%"
162-174 pwm: period: "750.0 ns"
162-174 pwm: frequency: "1.333 MHz"
174-185 pwm: duty-cycle: "45.454545%"
174-185 pwm: period: "687.5 ns"
174-185 pwm: frequency: "1.455 MHz"
185-196 pwm: duty-cycle: "54.545455%"
185-196 pwm: period: "687.5 ns"
185-196 pwm: frequency: "1.455 MHz"
196-208 pwm: duty-cycle: "50.000000%"
196-208 pwm: period: "750.0 ns"
196-208 pwm: frequency: "1.333 MHz"
208-219 pwm: duty-cycle: "54.545455%"
208-219 pwm: period: "687.5 ns"
208-219 pwm: frequency: "1.455 MHz"
219-279 pwm: duty-cycle: "90.000000%"
219-279 pwm: period: "3.8 μs"
219-279 pwm: frequency: "266.667 kHz"
279-291 pwm: duty-cycle: "50.000000%"
279-291 pwm: period: "750.0 ns"
279-291 pwm: frequency: "1.333 MHz"
291-302 pwm: duty-cycle: "45.454545%"
291-302 pwm: period: "687.5 ns"
291-302 pwm: frequency: "1.455 MHz"
302-313 pwm: duty-cycle: "54.545455%"
302-313 pwm: period: "687.5 ns"
302-313 pwm: frequency: "1.455 MHz"
313-325 pwm: duty-cycle: "50.000000%"
313-325 pwm: period: "750.0 ns"
313-325 pwm: frequency: "1.333 MHz"
325-336 pwm: duty-cycle: "45.454545%"
325-336 pwm: period: "687.5 ns"
325-336 pwm: frequency: "1.455 MHz"
336-347 pwm: duty-cycle: "54.545455%"
336-347 pwm: period: "687.5 ns"
336-347 pwm: frequency: "1.455 MHz"
347-359 pwm: duty-cycle: "50.000000%"
347-359 pwm: period: "750.0 ns"
347-359 pwm: frequency: "1.333 MHz"
359-419 pwm: duty-cycle: "90.000000%"
359-419 pwm: period: "3.8 μs"
359-419 pwm: frequency: "266.667 kHz"
419-430 pwm: duty-cycle: "45.454545%"
419-430 pwm: period: "687.5 ns"
419-430 pwm: frequency: "1.455 MHz"
430-441 pwm: duty-cycle: "54.545455%"
430-441 pwm: period: "687.5 ns"
430-441 pwm: frequency: "1.455 MHz"
441-453 pwm: duty-cycle: "50.000000%"
441-453 pwm: period: "750.0 ns"
441-453 pwm: frequency: "1.333 MHz"
453-464 pwm: duty-cycle: "45.454545%"
453-464 pwm: period: "687.5 ns"
453-464 pwm: frequency: "1.455 MHz"
464-476 pwm: duty-cycle: "50.000000%"
464-476 pwm: period: "750.0 ns"
464-476 pwm: frequency: "1.333 MHz"
476-487 pwm: duty-cycle: "45.454545%"
476-487 pwm: period: "687.5 ns"
476-487 pwm: frequency: "1.455 MHz"
487-498 pwm: duty-cycle: "54.545455%"
487-498 pwm: period: "687.5 ns"
487-498 pwm: frequency: "1.455 MHz"
