0-11 pwm: duty-cycle: "54.545455%"
0-11 pwm: period: "687.5 ns"
11-23 pwm: duty-cycle: "50.000000%"
11-23 pwm: period: "750.0 ns"
23-34 pwm: duty-cycle: "45.454545%"
23-34 pwm: period: "687.5 ns"
34-45 pwm: duty-cycle: "54.545455%"
34-45 pwm: period: "687.5 ns"
45-57 pwm: duty-cycle: "50.000000%"
45-57 pwm: period: "750.0 ns"
57-68 pwm: duty-cycle: "45.454545%"
57-68 pwm: period: "687.5 ns"
68-79 pwm: duty-cycle: "54.545455%"
68-79 pwm: period: "687.5 ns"
79-139 pwm: duty-cycle: "10.000000%"
79-139 pwm: period: "3.8 μs"
139-151 pwm: duty-cycle: "50.000000%"
139-151 pwm: period: "750.0 ns"
151-162 pwm: duty-cycle: "45.454545%"
151-162 pwm: period: "687.5 ns"
162-173 pwm: duty-cycle: "54.545455%"
162-173 pwm: period: "687.5 ns"
173-185 pwm: duty-cycle: "50.000000%"
173-185 pwm: period: "750.0 ns"
185-196 pwm: duty-cycle: "54.545455%"
185-196 pwm: period: "687.5 ns"
196-208 pwm: duty-cycle: "50.000000%"
196-208 pwm: period: "750.0 ns"
208-219 pwm: duty-cycle: "45.454545%"
208-219 pwm: period: "687.5 ns"
219-279 pwm: duty-cycle: "10.000000%"
219-279 pwm: period: "3.8 μs"
279-290 pwm: duty-cycle: "54.545455%"
279-290 pwm: period: "687.5 ns"
290-302 pwm: duty-cycle: "50.000000%"
290-302 pwm: period: "750.0 ns"
302-313 pwm: duty-cycle: "45.454545%"
302-313 pwm: period: "687.5 ns"
313-324 pwm: duty-cycle: "54.545455%"
313-324 pwm: period: "687.5 ns"
324-336 pwm: duty-cycle: "50.000000%"
324-336 pwm: period: "750.0 ns"
336-347 pwm: duty-cycle: "45.454545%"
336-347 pwm: period: "687.5 ns"
347-359 pwm: duty-cycle: "50.000000%"
347-359 pwm: period: "750.0 ns"
359-418 pwm: duty-cycle: "8.474576%"
359-418 pwm: period: "3.7 μs"
418-430 pwm: duty-cycle: "50.000000%"
418-430 pwm: period: "750.0 ns"
430-441 pwm: duty-cycle: "54.545455%"
430-441 pwm: period: "687.5 ns"
441-453 pwm: duty-cycle: "50.000000%"
441-453 pwm: period: "750.0 ns"
453-464 pwm: duty-cycle: "45.454545%"
453-464 pwm: period: "687.5 ns"
464-475 pwm: duty-cycle: "54.545455%"
464-475 pwm: period: "687.5 ns"
475-487 pwm: duty-cycle: "50.000000%"
475-487 pwm: period: "750.0 ns"
487-498 pwm: duty-cycle: "45.454545%"
487-498 pwm: period: "687.5 ns"
