57-79 ook: 1111: "1"
79-104 ook: 1111: "1"
104-128 ook: 1111: "1"
128-152 ook: 1111: "1"
152-177 ook: 1111: "1"
177-201 ook: 1111: "1"
201-226 ook: 1111: "1"
226-250 ook: 1111: "1"
250-275 ook: 1111: "1"
275-299 ook: 1111: "1"
299-323 ook: 1111: "1"
323-348 ook: 1111: "1"
348-372 ook: 1111: "1"
372-397 ook: 1111: "1"
397-421 ook: 1111: "1"
421-445 ook: 1111: "1"
445-470 ook: 1111: "1"
470-495 ook: 1111: "1"
495-519 ook: 1111: "1"
519-544 ook: 1111: "1"
544-568 ook: 1111: "1"
568-592 ook: 1111: "1"
592-616 ook: 1111: "1"
616-639 ook: 1111: "1"
639-663 ook: 1111: "0"
663-688 ook: 1111: "1"
688-712 ook: 1111: "0"
712-737 ook: 1111: "1"
737-761 ook: 1111: "0"
761-786 ook: 1111: "1"
786-809 ook: 1111: "0"
809-834 ook: 1111: "0"
834-859 ook: 1111: "1"
859-882 ook: 1111: "0"
882-907 ook: 1111: "0"
907-935 ook: 1111: "1"
935-956 ook: 1111: "1"
956-980 ook: 1111: "0"
980-1004 ook: 1111: "0"
1004-1029 ook: 1111: "0"
1029-1053 ook: 1111: "0"
1053-1078 ook: 1111: "0"
1078-1103 ook: 1111: "1"
1103-1126 ook: 1111: "0"
1126-1150 ook: 1111: "0"
1150-1175 ook: 1111: "0"
1175-1199 ook: 1111: "0"
1199-1225 ook: 1111: "0"
1225-1249 ook: 1111: "1"
1249-1274 ook: 1111: "0"
1274-1300 ook: 1111: "1"
1300-1323 ook: 1111: "1"
1323-1347 ook: 1111: "0"
1347-1371 ook: 1111: "1"
1371-1394 ook: 1111: "0"
1394-1420 ook: 1111: "0"
1420-1444 ook: 1111: "0"
1444-1468 ook: 1111: "0"
1468-1492 ook: 1111: "0"
1492-1517 ook: 1111: "0"
1517-1541 ook: 1111: "0"
1541-1565 ook: 1111: "0"
1565-1590 ook: 1111: "0"
1590-1615 ook: 1111: "0"
1615-1639 ook: 1111: "0"
1639-1663 ook: 1111: "0"
1663-1688 ook: 1111: "0"
1688-1712 ook: 1111: "0"
1712-1736 ook: 1111: "0"
1736-1761 ook: 1111: "0"
1761-1785 ook: 1111: "0"
1785-1810 ook: 1111: "0"
1810-1834 ook: 1111: "0"
1834-1858 ook: 1111: "0"
1858-1883 ook: 1111: "0"
1883-1908 ook: 1111: "0"
1908-1933 ook: 1111: "1"
1933-1957 ook: 1111: "0"
1957-1982 ook: 1111: "1"
1982-2005 ook: 1111: "0"
2005-2029 ook: 1111: "0"
2029-2054 ook: 1111: "0"
2054-2080 ook: 1111: "0"
2080-2104 ook: 1111: "1"
2104-2127 ook: 1111: "0"
2127-2151 ook: 1111: "0"
2151-2177 ook: 1111: "0"
2177-2202 ook: 1111: "1"
2202-2225 ook: 1111: "0"
2225-2249 ook: 1111: "0"
2249-2274 ook: 1111: "0"
2274-2302 ook: 1111: "1"
2302-2326 ook: 1111: "1"
2326-2348 ook: 1111: "1"
2348-2371 ook: 1111: "0"
2371-2396 ook: 1111: "0"
2396-2420 ook: 1111: "0"
2420-2444 ook: 1111: "0"
2444-2469 ook: 1111: "0"
2469-2494 ook: 1111: "0"
2494-2521 ook: 1111: "1"
2521-2545 ook: 1111: "1"
2545-2570 ook: 1111: "1"
2570-2595 ook: 1111: "1"
2595-2618 ook: 1111: "1"
2618-2641 ook: 1111: "1"
2641-2664 ook: 1111: "0"
2664-2689 ook: 1111: "0"
2689-2714 ook: 1111: "0"
2714-2741 ook: 1111: "1"
2741-2765 ook: 1111: "1"
2765-2788 ook: 1111: "1"
2788-2811 ook: 1111: "0"
2811-2836 ook: 1111: "0"
2836-2861 ook: 1111: "1"
2861-2886 ook: 1111: "0"
2886-2898 ook: 1111: "1"
2898-2898 ook: frame: "T"
