62-88 ook: 1010: "1"
88-114 ook: 1010: "0"
114-140 ook: 1010: "1"
140-166 ook: 1010: "0"
166-191 ook: 1010: "1"
191-217 ook: 1010: "0"
217-243 ook: 1010: "1"
243-269 ook: 1010: "0"
269-295 ook: 1010: "1"
295-321 ook: 1010: "0"
321-346 ook: 1010: "1"
346-372 ook: 1010: "0"
372-398 ook: 1010: "1"
398-424 ook: 1010: "0"
424-450 ook: 1010: "1"
450-476 ook: 1010: "0"
476-501 ook: 1010: "1"
501-527 ook: 1010: "0"
527-553 ook: 1010: "1"
553-579 ook: 1010: "0"
579-604 ook: 1010: "1"
604-630 ook: 1010: "0"
630-656 ook: 1010: "1"
656-682 ook: 1010: "0"
682-708 ook: 1010: "1"
708-734 ook: 1010: "0"
734-759 ook: 1010: "1"
759-785 ook: 1010: "0"
785-811 ook: 1010: "1"
811-837 ook: 1010: "0"
837-863 ook: 1010: "1"
863-888 ook: 1010: "1"
888-915 ook: 1010: "0"
915-940 ook: 1010: "0"
940-966 ook: 1010: "1"
966-992 ook: 1010: "1"
992-1018 ook: 1010: "0"
1018-1043 ook: 1010: "0"
1043-1069 ook: 1010: "1"
1069-1095 ook: 1010: "0"
1095-1121 ook: 1010: "1"
1121-1146 ook: 1010: "1"
1146-1173 ook: 1010: "0"
1173-1198 ook: 1010: "0"
1198-1224 ook: 1010: "1"
1224-1250 ook: 1010: "1"
1250-1276 ook: 1010: "0"
1276-1302 ook: 1010: "0"
1302-1328 ook: 1010: "1"
1328-1353 ook: 1010: "1"
1353-1379 ook: 1010: "0"
1379-1405 ook: 1010: "0"
1405-1430 ook: 1010: "1"
1430-1456 ook: 1010: "0"
1456-1483 ook: 1010: "1"
1483-1508 ook: 1010: "1"
1508-1534 ook: 1010: "0"
1534-1560 ook: 1010: "0"
1560-1585 ook: 1010: "1"
1585-1611 ook: 1010: "0"
1611-1637 ook: 1010: "1"
1637-1663 ook: 1010: "1"
1663-1689 ook: 1010: "0"
1689-1714 ook: 1010: "1"
1714-1740 ook: 1010: "0"
1740-1766 ook: 1010: "1"
1766-1792 ook: 1010: "0"
1792-1818 ook: 1010: "1"
1818-1844 ook: 1010: "0"
1844-1869 ook: 1010: "1"
1869-1895 ook: 1010: "0"
1895-1921 ook: 1010: "1"
1921-1947 ook: 1010: "0"
1947-1973 ook: 1010: "0"
1973-1999 ook: 1010: "1"
1999-2024 ook: 1010: "1"
2024-2050 ook: 1010: "0"
2050-2076 ook: 1010: "1"
2076-2102 ook: 1010: "0"
2102-2128 ook: 1010: "0"
2128-2153 ook: 1010: "1"
2153-2179 ook: 1010: "0"
2179-2205 ook: 1010: "1"
2205-2231 ook: 1010: "1"
2231-2257 ook: 1010: "0"
2257-2282 ook: 1010: "0"
2282-2309 ook: 1010: "1"
2309-2334 ook: 1010: "1"
2334-2360 ook: 1010: "0"
2360-2386 ook: 1010: "1"
2386-2412 ook: 1010: "0"
2412-2437 ook: 1010: "0"
2437-2463 ook: 1010: "1"
2463-2489 ook: 1010: "0"
2489-2515 ook: 1010: "1"
2515-2540 ook: 1010: "1"
2540-2566 ook: 1010: "0"
2566-2592 ook: 1010: "1"
2592-2618 ook: 1010: "0"
2618-2644 ook: 1010: "1"
2644-2670 ook: 1010: "0"
2670-2695 ook: 1010: "1"
2695-2721 ook: 1010: "0"
2721-2747 ook: 1010: "1"
2747-2773 ook: 1010: "0"
2773-2799 ook: 1010: "0"
2799-2825 ook: 1010: "1"
2825-2850 ook: 1010: "1"
2850-2876 ook: 1010: "0"
2876-2902 ook: 1010: "1"
2902-2928 ook: 1010: "0"
2928-2954 ook: 1010: "0"
2954-2980 ook: 1010: "1"
2980-3005 ook: 1010: "1"
3005-3031 ook: 1010: "0"
3031-3057 ook: 1010: "1"
3057-3083 ook: 1010: "0"
3083-3108 ook: 1010: "1"
3108-3135 ook: 1010: "0"
3135-3160 ook: 1010: "0"
3160-3186 ook: 1010: "1"
3186-3211 ook: 1010: "1"
3211-3237 ook: 1010: "0"
3237-3263 ook: 1010: "1"
3263-3289 ook: 1010: "0"
3289-3315 ook: 1010: "1"
3315-3341 ook: 1010: "0"
3341-3366 ook: 1010: "1"
3366-3392 ook: 1010: "0"
3392-3418 ook: 1010: "1"
3418-3444 ook: 1010: "0"
3444-3470 ook: 1010: "1"
3470-3496 ook: 1010: "0"
3496-3521 ook: 1010: "1"
3521-3547 ook: 1010: "0"
3547-3573 ook: 1010: "1"
3573-3599 ook: 1010: "0"
3599-3625 ook: 1010: "0"
3625-3651 ook: 1010: "1"
3651-3676 ook: 1010: "1"
3676-3702 ook: 1010: "0"
3702-3728 ook: 1010: "1"
3728-3754 ook: 1010: "0"
3754-3779 ook: 1010: "0"
3779-3806 ook: 1010: "1"
3806-3831 ook: 1010: "1"
3831-3857 ook: 1010: "0"
3857-3883 ook: 1010: "0"
3883-3909 ook: 1010: "1"
3909-3934 ook: 1010: "1"
3934-3960 ook: 1010: "0"
3960-3986 ook: 1010: "1"
3986-4012 ook: 1010: "0"
4012-4037 ook: 1010: "1"
4037-4063 ook: 1010: "0"
4063-4089 ook: 1010: "1"
4089-4115 ook: 1010: "0"
4115-4141 ook: 1010: "1"
4141-4167 ook: 1010: "0"
4167-4192 ook: 1010: "0"
4192-4219 ook: 1010: "1"
4219-4244 ook: 1010: "1"
4244-4270 ook: 1010: "0"
4270-4296 ook: 1010: "0"
4296-4321 ook: 1010: "1"
4321-4347 ook: 1010: "0"
4347-4373 ook: 1010: "1"
4373-4399 ook: 1010: "0"
4399-4425 ook: 1010: "1"
4425-4450 ook: 1010: "1"
4450-4476 ook: 1010: "0"
4476-4502 ook: 1010: "1"
4502-4528 ook: 1010: "0"
4528-4554 ook: 1010: "0"
4554-4580 ook: 1010: "1"
4580-4605 ook: 1010: "1"
4605-4631 ook: 1010: "0"
4631-4657 ook: 1010: "1"
4657-4683 ook: 1010: "0"
4683-4709 ook: 1010: "1"
4709-4735 ook: 1010: "0"
4735-4760 ook: 1010: "1"
4760-4786 ook: 1010: "0"
4786-4812 ook: 1010: "1"
4812-4838 ook: 1010: "0"
4838-4863 ook: 1010: "1"
4863-4890 ook: 1010: "0"
4890-4915 ook: 1010: "0"
4915-4941 ook: 1010: "1"
4941-4967 ook: 1010: "0"
4967-4993 ook: 1010: "1"
4993-5018 ook: 1010: "1"
5018-5045 ook: 1010: "0"
5045-5070 ook: 1010: "0"
5070-5096 ook: 1010: "1"
5096-5122 ook: 1010: "0"
5122-5147 ook: 1010: "1"
5147-5173 ook: 1010: "0"
5173-5199 ook: 1010: "1"
5199-5225 ook: 1010: "0"
5225-5251 ook: 1010: "1"
5251-5276 ook: 1010: "1"
5276-5303 ook: 1010: "0"
5303-5328 ook: 1010: "0"
5328-5354 ook: 1010: "1"
5354-5380 ook: 1010: "1"
5380-5406 ook: 1010: "0"
5406-5431 ook: 1010: "1"
5431-5457 ook: 1010: "0"
5457-5483 ook: 1010: "1"
5483-5509 ook: 1010: "0"
5509-5535 ook: 1010: "1"
5535-5561 ook: 1010: "0"
5561-5586 ook: 1010: "1"
5586-5612 ook: 1010: "0"
5612-5638 ook: 1010: "1"
5638-5664 ook: 1010: "0"
5664-5690 ook: 1010: "1"
5690-5715 ook: 1010: "0"
5715-5741 ook: 1010: "1"
5741-5767 ook: 1010: "0"
5767-5793 ook: 1010: "1"
5793-5819 ook: 1010: "0"
5819-5845 ook: 1010: "1"
5845-5845 ook: frame: "T"
