7995267-7996743 lm75: celsius: "Temperature: 30.5 °C"
7995267-7996743 lm75: kelvin: "Temperature: 303.6 K"
8025988-8027464 lm75: celsius: "Temperature: 30.5 °C"
8025988-8027464 lm75: kelvin: "Temperature: 303.6 K"
8056708-8058184 lm75: celsius: "Temperature: 30.5 °C"
8056708-8058184 lm75: kelvin: "Temperature: 303.6 K"
8087141-8088617 lm75: celsius: "Temperature: 30.5 °C"
8087141-8088617 lm75: kelvin: "Temperature: 303.6 K"
8117862-8119337 lm75: celsius: "Temperature: 30.5 °C"
8117862-8119337 lm75: kelvin: "Temperature: 303.6 K"
8148294-8149770 lm75: celsius: "Temperature: 30.5 °C"
8148294-8149770 lm75: kelvin: "Temperature: 303.6 K"
8179015-8180491 lm75: celsius: "Temperature: 30.5 °C"
8179015-8180491 lm75: kelvin: "Temperature: 303.6 K"
8210959-8212435 lm75: celsius: "Temperature: 30.5 °C"
8210959-8212435 lm75: kelvin: "Temperature: 303.6 K"
8241392-8242868 lm75: celsius: "Temperature: 30.5 °C"
8241392-8242868 lm75: kelvin: "Temperature: 303.6 K"
8272112-8273588 lm75: celsius: "Temperature: 30.5 °C"
8272112-8273588 lm75: kelvin: "Temperature: 303.6 K"
8302545-8304021 lm75: celsius: "Temperature: 30.5 °C"
8302545-8304021 lm75: kelvin: "Temperature: 303.6 K"
8333266-8334741 lm75: celsius: "Temperature: 30.5 °C"
8333266-8334741 lm75: kelvin: "Temperature: 303.6 K"
8363858-8365334 lm75: celsius: "Temperature: 30.5 °C"
8363858-8365334 lm75: kelvin: "Temperature: 303.6 K"
8394435-8395911 lm75: celsius: "Temperature: 30.5 °C"
8394435-8395911 lm75: kelvin: "Temperature: 303.6 K"
8424867-8426343 lm75: celsius: "Temperature: 30.5 °C"
8424867-8426343 lm75: kelvin: "Temperature: 303.6 K"
8455588-8457064 lm75: celsius: "Temperature: 30.5 °C"
8455588-8457064 lm75: kelvin: "Temperature: 303.6 K"
8486956-8488432 lm75: celsius: "Temperature: 30.5 °C"
8486956-8488432 lm75: kelvin: "Temperature: 303.6 K"
8517389-8518865 lm75: celsius: "Temperature: 30.5 °C"
8517389-8518865 lm75: kelvin: "Temperature: 303.6 K"
8548110-8549586 lm75: celsius: "Temperature: 30.5 °C"
8548110-8549586 lm75: kelvin: "Temperature: 303.6 K"
8578542-8580018 lm75: celsius: "Temperature: 30.5 °C"
8578542-8580018 lm75: kelvin: "Temperature: 303.6 K"
8609263-8610739 lm75: celsius: "Temperature: 30.5 °C"
8609263-8610739 lm75: kelvin: "Temperature: 303.6 K"
8639696-8641171 lm75: celsius: "Temperature: 30.5 °C"
8639696-8641171 lm75: kelvin: "Temperature: 303.6 K"
8670416-8671892 lm75: celsius: "Temperature: 30.5 °C"
8670416-8671892 lm75: kelvin: "Temperature: 303.6 K"
8700849-8702325 lm75: celsius: "Temperature: 30.5 °C"
8700849-8702325 lm75: kelvin: "Temperature: 303.6 K"
8731569-8733045 lm75: celsius: "Temperature: 30.5 °C"
8731569-8733045 lm75: kelvin: "Temperature: 303.6 K"
8762938-8764414 lm75: celsius: "Temperature: 30.5 °C"
8762938-8764414 lm75: kelvin: "Temperature: 303.6 K"
8793370-8794846 lm75: celsius: "Temperature: 30.5 °C"
8793370-8794846 lm75: kelvin: "Temperature: 303.6 K"
8824091-8825567 lm75: celsius: "Temperature: 30.5 °C"
8824091-8825567 lm75: kelvin: "Temperature: 303.6 K"
8854524-8855999 lm75: celsius: "Temperature: 30.5 °C"
8854524-8855999 lm75: kelvin: "Temperature: 303.6 K"
8885404-8886880 lm75: celsius: "Temperature: 30.5 °C"
8885404-8886880 lm75: kelvin: "Temperature: 303.6 K"
8915693-8917169 lm75: celsius: "Temperature: 30.5 °C"
8915693-8917169 lm75: kelvin: "Temperature: 303.6 K"
8946413-8947889 lm75: celsius: "Temperature: 30.5 °C"
8946413-8947889 lm75: kelvin: "Temperature: 303.6 K"
22970559-22972034 lm75: celsius: "Temperature: 30.5 °C"
22970559-22972034 lm75: kelvin: "Temperature: 303.6 K"
23001279-23002755 lm75: celsius: "Temperature: 30.5 °C"
23001279-23002755 lm75: kelvin: "Temperature: 303.6 K"
23032160-23033636 lm75: celsius: "Temperature: 30.5 °C"
23032160-23033636 lm75: kelvin: "Temperature: 303.6 K"
23063024-23064500 lm75: celsius: "Temperature: 30.5 °C"
23063024-23064500 lm75: kelvin: "Temperature: 303.6 K"
23093737-23095213 lm75: celsius: "Temperature: 30.5 °C"
23093737-23095213 lm75: kelvin: "Temperature: 303.6 K"
23124241-23125717 lm75: celsius: "Temperature: 30.5 °C"
23124241-23125717 lm75: kelvin: "Temperature: 303.6 K"
23154890-23156366 lm75: celsius: "Temperature: 30.5 °C"
23154890-23156366 lm75: kelvin: "Temperature: 303.6 K"
23186259-23187734 lm75: celsius: "Temperature: 30.5 °C"
23186259-23187734 lm75: kelvin: "Temperature: 303.6 K"
23216691-23218167 lm75: celsius: "Temperature: 30.5 °C"
23216691-23218167 lm75: kelvin: "Temperature: 303.6 K"
23247412-23248888 lm75: celsius: "Temperature: 30.5 °C"
23247412-23248888 lm75: kelvin: "Temperature: 303.6 K"
23277844-23279320 lm75: celsius: "Temperature: 30.5 °C"
23277844-23279320 lm75: kelvin: "Temperature: 303.6 K"
23308565-23310041 lm75: celsius: "Temperature: 30.5 °C"
23308565-23310041 lm75: kelvin: "Temperature: 303.6 K"
23338998-23340473 lm75: celsius: "Temperature: 30.5 °C"
23338998-23340473 lm75: kelvin: "Temperature: 303.6 K"
23369718-23371194 lm75: celsius: "Temperature: 30.5 °C"
23369718-23371194 lm75: kelvin: "Temperature: 303.6 K"
23400151-23401627 lm75: celsius: "Temperature: 30.5 °C"
23400151-23401627 lm75: kelvin: "Temperature: 303.6 K"
23430871-23432347 lm75: celsius: "Temperature: 30.5 °C"
23430871-23432347 lm75: kelvin: "Temperature: 303.6 K"
23462240-23463716 lm75: celsius: "Temperature: 30.5 °C"
23462240-23463716 lm75: kelvin: "Temperature: 303.6 K"
23492673-23494148 lm75: celsius: "Temperature: 30.5 °C"
23492673-23494148 lm75: kelvin: "Temperature: 303.6 K"
23523393-23524869 lm75: celsius: "Temperature: 30.5 °C"
23523393-23524869 lm75: kelvin: "Temperature: 303.6 K"
23554058-23555534 lm75: celsius: "Temperature: 30.5 °C"
23554058-23555534 lm75: kelvin: "Temperature: 303.6 K"
23584562-23586038 lm75: celsius: "Temperature: 30.5 °C"
23584562-23586038 lm75: kelvin: "Temperature: 303.6 K"
23615059-23616535 lm75: celsius: "Temperature: 30.5 °C"
23615059-23616535 lm75: kelvin: "Temperature: 303.6 K"
23645707-23647183 lm75: celsius: "Temperature: 30.5 °C"
23645707-23647183 lm75: kelvin: "Temperature: 303.6 K"
23676140-23677616 lm75: celsius: "Temperature: 30.5 °C"
23676140-23677616 lm75: kelvin: "Temperature: 303.6 K"
23706861-23708337 lm75: celsius: "Temperature: 30.5 °C"
23706861-23708337 lm75: kelvin: "Temperature: 303.6 K"
23738229-23739705 lm75: celsius: "Temperature: 30.5 °C"
23738229-23739705 lm75: kelvin: "Temperature: 303.6 K"
23768662-23770138 lm75: celsius: "Temperature: 30.5 °C"
23768662-23770138 lm75: kelvin: "Temperature: 303.6 K"
23799382-23800858 lm75: celsius: "Temperature: 30.5 °C"
23799382-23800858 lm75: kelvin: "Temperature: 303.6 K"
23829815-23831291 lm75: celsius: "Temperature: 30.5 °C"
23829815-23831291 lm75: kelvin: "Temperature: 303.6 K"
23860536-23862011 lm75: celsius: "Temperature: 30.5 °C"
23860536-23862011 lm75: kelvin: "Temperature: 303.6 K"
23890968-23892444 lm75: celsius: "Temperature: 30.5 °C"
23890968-23892444 lm75: kelvin: "Temperature: 303.6 K"
23921761-23923237 lm75: celsius: "Temperature: 30.5 °C"
23921761-23923237 lm75: kelvin: "Temperature: 303.6 K"
37945806-37947282 lm75: celsius: "Temperature: 30.5 °C"
37945806-37947282 lm75: kelvin: "Temperature: 303.6 K"
37976527-37978002 lm75: celsius: "Temperature: 30.5 °C"
37976527-37978002 lm75: kelvin: "Temperature: 303.6 K"
38007319-38008795 lm75: celsius: "Temperature: 30.5 °C"
38007319-38008795 lm75: kelvin: "Temperature: 303.6 K"
38037680-38039156 lm75: celsius: "Temperature: 30.5 °C"
38037680-38039156 lm75: kelvin: "Temperature: 303.6 K"
38068472-38069948 lm75: celsius: "Temperature: 30.5 °C"
38068472-38069948 lm75: kelvin: "Temperature: 303.6 K"
38098905-38100381 lm75: celsius: "Temperature: 30.5 °C"
38098905-38100381 lm75: kelvin: "Temperature: 303.6 K"
38129625-38131101 lm75: celsius: "Temperature: 30.5 °C"
38129625-38131101 lm75: kelvin: "Temperature: 303.6 K"
38161570-38163046 lm75: celsius: "Temperature: 30.5 °C"
38161570-38163046 lm75: kelvin: "Temperature: 303.6 K"
38191931-38193406 lm75: celsius: "Temperature: 30.5 °C"
38191931-38193406 lm75: kelvin: "Temperature: 303.6 K"
38222883-38224359 lm75: celsius: "Temperature: 30.5 °C"
38222883-38224359 lm75: kelvin: "Temperature: 303.6 K"
38253748-38255224 lm75: celsius: "Temperature: 30.5 °C"
38253748-38255224 lm75: kelvin: "Temperature: 303.6 K"
38284468-38285944 lm75: celsius: "Temperature: 30.5 °C"
38284468-38285944 lm75: kelvin: "Temperature: 303.6 K"
38314901-38316377 lm75: celsius: "Temperature: 30.5 °C"
38314901-38316377 lm75: kelvin: "Temperature: 303.6 K"
38345621-38347097 lm75: celsius: "Temperature: 30.5 °C"
38345621-38347097 lm75: kelvin: "Temperature: 303.6 K"
38377494-38378970 lm75: celsius: "Temperature: 30.5 °C"
38377494-38378970 lm75: kelvin: "Temperature: 303.6 K"
38407927-38409402 lm75: celsius: "Temperature: 30.5 °C"
38407927-38409402 lm75: kelvin: "Temperature: 303.6 K"
38438719-38440195 lm75: celsius: "Temperature: 30.5 °C"
38438719-38440195 lm75: kelvin: "Temperature: 303.6 K"
38469152-38470628 lm75: celsius: "Temperature: 30.5 °C"
38469152-38470628 lm75: kelvin: "Temperature: 303.6 K"
38499872-38501348 lm75: celsius: "Temperature: 30.5 °C"
38499872-38501348 lm75: kelvin: "Temperature: 303.6 K"
38530305-38531781 lm75: celsius: "Temperature: 30.5 °C"
38530305-38531781 lm75: kelvin: "Temperature: 303.6 K"
38561026-38562501 lm75: celsius: "Temperature: 30.5 °C"
38561026-38562501 lm75: kelvin: "Temperature: 303.6 K"
38591458-38592934 lm75: celsius: "Temperature: 30.5 °C"
38591458-38592934 lm75: kelvin: "Temperature: 303.6 K"
38622179-38623655 lm75: celsius: "Temperature: 30.5 °C"
38622179-38623655 lm75: kelvin: "Temperature: 303.6 K"
38653547-38655023 lm75: celsius: "Temperature: 30.5 °C"
38653547-38655023 lm75: kelvin: "Temperature: 303.6 K"
38683908-38685384 lm75: celsius: "Temperature: 30.5 °C"
38683908-38685384 lm75: kelvin: "Temperature: 303.6 K"
38714700-38716176 lm75: celsius: "Temperature: 30.5 °C"
38714700-38716176 lm75: kelvin: "Temperature: 303.6 K"
38745293-38746769 lm75: celsius: "Temperature: 30.5 °C"
38745293-38746769 lm75: kelvin: "Temperature: 303.6 K"
38775870-38777346 lm75: celsius: "Temperature: 30.5 °C"
38775870-38777346 lm75: kelvin: "Temperature: 303.6 K"
38806302-38807778 lm75: celsius: "Temperature: 30.5 °C"
38806302-38807778 lm75: kelvin: "Temperature: 303.6 K"
38837023-38838499 lm75: celsius: "Temperature: 30.5 °C"
38837023-38838499 lm75: kelvin: "Temperature: 303.6 K"
38867455-38868931 lm75: celsius: "Temperature: 30.5 °C"
38867455-38868931 lm75: kelvin: "Temperature: 303.6 K"
38898176-38899652 lm75: celsius: "Temperature: 30.5 °C"
38898176-38899652 lm75: kelvin: "Temperature: 303.6 K"
52921281-52922757 lm75: celsius: "Temperature: 30.5 °C"
52921281-52922757 lm75: kelvin: "Temperature: 303.6 K"
52951858-52953334 lm75: celsius: "Temperature: 30.5 °C"
52951858-52953334 lm75: kelvin: "Temperature: 303.6 K"
52982578-52984054 lm75: celsius: "Temperature: 30.5 °C"
52982578-52984054 lm75: kelvin: "Temperature: 303.6 K"
53013083-53014559 lm75: celsius: "Temperature: 30.5 °C"
53013083-53014559 lm75: kelvin: "Temperature: 303.6 K"
53043732-53045208 lm75: celsius: "Temperature: 30.5 °C"
53043732-53045208 lm75: kelvin: "Temperature: 303.6 K"
53074164-53075640 lm75: celsius: "Temperature: 30.5 °C"
53074164-53075640 lm75: kelvin: "Temperature: 303.6 K"
53104957-53106433 lm75: celsius: "Temperature: 30.5 °C"
53104957-53106433 lm75: kelvin: "Temperature: 303.6 K"
53136829-53138305 lm75: celsius: "Temperature: 30.5 °C"
53136829-53138305 lm75: kelvin: "Temperature: 303.6 K"
53167262-53168738 lm75: celsius: "Temperature: 30.5 °C"
53167262-53168738 lm75: kelvin: "Temperature: 303.6 K"
53197983-53199458 lm75: celsius: "Temperature: 30.5 °C"
53197983-53199458 lm75: kelvin: "Temperature: 303.6 K"
53228415-53229891 lm75: celsius: "Temperature: 30.5 °C"
53228415-53229891 lm75: kelvin: "Temperature: 303.6 K"
53259136-53260612 lm75: celsius: "Temperature: 30.5 °C"
53259136-53260612 lm75: kelvin: "Temperature: 303.6 K"
53289568-53291044 lm75: celsius: "Temperature: 30.5 °C"
53289568-53291044 lm75: kelvin: "Temperature: 303.6 K"
53320361-53321837 lm75: celsius: "Temperature: 30.5 °C"
53320361-53321837 lm75: kelvin: "Temperature: 303.6 K"
53350722-53352197 lm75: celsius: "Temperature: 30.5 °C"
53350722-53352197 lm75: kelvin: "Temperature: 303.6 K"
53381514-53382990 lm75: celsius: "Temperature: 30.5 °C"
53381514-53382990 lm75: kelvin: "Temperature: 303.6 K"
53412811-53414286 lm75: celsius: "Temperature: 30.5 °C"
53412811-53414286 lm75: kelvin: "Temperature: 303.6 K"
53443403-53444879 lm75: celsius: "Temperature: 30.5 °C"
53443403-53444879 lm75: kelvin: "Temperature: 303.6 K"
53473980-53475456 lm75: celsius: "Temperature: 30.5 °C"
53473980-53475456 lm75: kelvin: "Temperature: 303.6 K"
53504412-53505888 lm75: celsius: "Temperature: 30.5 °C"
53504412-53505888 lm75: kelvin: "Temperature: 303.6 K"
53535133-53536609 lm75: celsius: "Temperature: 30.5 °C"
53535133-53536609 lm75: kelvin: "Temperature: 303.6 K"
53565566-53567042 lm75: celsius: "Temperature: 30.5 °C"
53565566-53567042 lm75: kelvin: "Temperature: 303.6 K"
53596286-53597762 lm75: celsius: "Temperature: 30.5 °C"
53596286-53597762 lm75: kelvin: "Temperature: 303.6 K"
53626719-53628195 lm75: celsius: "Temperature: 30.5 °C"
53626719-53628195 lm75: kelvin: "Temperature: 303.6 K"
53657511-53658987 lm75: celsius: "Temperature: 30.5 °C"
53657511-53658987 lm75: kelvin: "Temperature: 303.6 K"
53688808-53690284 lm75: celsius: "Temperature: 30.5 °C"
53688808-53690284 lm75: kelvin: "Temperature: 303.6 K"
53719241-53720716 lm75: celsius: "Temperature: 30.5 °C"
53719241-53720716 lm75: kelvin: "Temperature: 303.6 K"
53749961-53751437 lm75: celsius: "Temperature: 30.5 °C"
53749961-53751437 lm75: kelvin: "Temperature: 303.6 K"
53780394-53781870 lm75: celsius: "Temperature: 30.5 °C"
53780394-53781870 lm75: kelvin: "Temperature: 303.6 K"
53811114-53812590 lm75: celsius: "Temperature: 30.5 °C"
53811114-53812590 lm75: kelvin: "Temperature: 303.6 K"
53841547-53843023 lm75: celsius: "Temperature: 30.5 °C"
53841547-53843023 lm75: kelvin: "Temperature: 303.6 K"
53872268-53873743 lm75: celsius: "Temperature: 30.5 °C"
53872268-53873743 lm75: kelvin: "Temperature: 303.6 K"
