48151-49627 lm75: celsius: "Temperature: 29.5 °C"
48151-49627 lm75: kelvin: "Temperature: 302.6 K"
78728-80203 lm75: celsius: "Temperature: 29.5 °C"
78728-80203 lm75: kelvin: "Temperature: 302.6 K"
109520-110996 lm75: celsius: "Temperature: 29.5 °C"
109520-110996 lm75: kelvin: "Temperature: 302.6 K"
139881-141357 lm75: celsius: "Temperature: 29.5 °C"
139881-141357 lm75: kelvin: "Temperature: 302.6 K"
170673-172149 lm75: celsius: "Temperature: 29.5 °C"
170673-172149 lm75: kelvin: "Temperature: 302.6 K"
201034-202510 lm75: celsius: "Temperature: 29.5 °C"
201034-202510 lm75: kelvin: "Temperature: 302.6 K"
231827-233302 lm75: celsius: "Temperature: 29.5 °C"
231827-233302 lm75: kelvin: "Temperature: 302.6 K"
263859-265335 lm75: celsius: "Temperature: 29.5 °C"
263859-265335 lm75: kelvin: "Temperature: 302.6 K"
294148-295624 lm75: celsius: "Temperature: 29.5 °C"
294148-295624 lm75: kelvin: "Temperature: 302.6 K"
324940-326416 lm75: celsius: "Temperature: 29.5 °C"
324940-326416 lm75: kelvin: "Temperature: 302.6 K"
355301-356777 lm75: celsius: "Temperature: 29.5 °C"
355301-356777 lm75: kelvin: "Temperature: 302.6 K"
386093-387569 lm75: celsius: "Temperature: 29.5 °C"
386093-387569 lm75: kelvin: "Temperature: 302.6 K"
416454-417930 lm75: celsius: "Temperature: 29.5 °C"
416454-417930 lm75: kelvin: "Temperature: 302.6 K"
447247-448723 lm75: celsius: "Temperature: 29.5 °C"
447247-448723 lm75: kelvin: "Temperature: 302.6 K"
477607-479083 lm75: celsius: "Temperature: 29.5 °C"
477607-479083 lm75: kelvin: "Temperature: 302.6 K"
508400-509876 lm75: celsius: "Temperature: 29.5 °C"
508400-509876 lm75: kelvin: "Temperature: 302.6 K"
539696-541172 lm75: celsius: "Temperature: 29.5 °C"
539696-541172 lm75: kelvin: "Temperature: 302.6 K"
570129-571605 lm75: celsius: "Temperature: 29.5 °C"
570129-571605 lm75: kelvin: "Temperature: 302.6 K"
600922-602397 lm75: celsius: "Temperature: 29.5 °C"
600922-602397 lm75: kelvin: "Temperature: 302.6 K"
631282-632758 lm75: celsius: "Temperature: 29.5 °C"
631282-632758 lm75: kelvin: "Temperature: 302.6 K"
662075-663551 lm75: celsius: "Temperature: 29.5 °C"
662075-663551 lm75: kelvin: "Temperature: 302.6 K"
692435-693911 lm75: celsius: "Temperature: 29.5 °C"
692435-693911 lm75: kelvin: "Temperature: 302.6 K"
723228-724704 lm75: celsius: "Temperature: 29.5 °C"
723228-724704 lm75: kelvin: "Temperature: 302.6 K"
753661-755136 lm75: celsius: "Temperature: 29.5 °C"
753661-755136 lm75: kelvin: "Temperature: 302.6 K"
784541-786017 lm75: celsius: "Temperature: 29.5 °C"
784541-786017 lm75: kelvin: "Temperature: 302.6 K"
815694-817170 lm75: celsius: "Temperature: 29.5 °C"
815694-817170 lm75: kelvin: "Temperature: 302.6 K"
846126-847602 lm75: celsius: "Temperature: 29.5 °C"
846126-847602 lm75: kelvin: "Temperature: 302.6 K"
876847-878323 lm75: celsius: "Temperature: 29.5 °C"
876847-878323 lm75: kelvin: "Temperature: 302.6 K"
907280-908755 lm75: celsius: "Temperature: 29.5 °C"
907280-908755 lm75: kelvin: "Temperature: 302.6 K"
938000-939476 lm75: celsius: "Temperature: 29.5 °C"
938000-939476 lm75: kelvin: "Temperature: 302.6 K"
968433-969909 lm75: celsius: "Temperature: 29.5 °C"
968433-969909 lm75: kelvin: "Temperature: 302.6 K"
999225-1000701 lm75: celsius: "Temperature: 29.5 °C"
999225-1000701 lm75: kelvin: "Temperature: 302.6 K"
15023270-15024746 lm75: celsius: "Temperature: 29.5 °C"
15023270-15024746 lm75: kelvin: "Temperature: 302.6 K"
15054063-15055539 lm75: celsius: "Temperature: 29.5 °C"
15054063-15055539 lm75: kelvin: "Temperature: 302.6 K"
15084784-15086259 lm75: celsius: "Temperature: 29.5 °C"
15084784-15086259 lm75: kelvin: "Temperature: 302.6 K"
15115216-15116692 lm75: celsius: "Temperature: 29.5 °C"
15115216-15116692 lm75: kelvin: "Temperature: 302.6 K"
15145937-15147413 lm75: celsius: "Temperature: 29.5 °C"
15145937-15147413 lm75: kelvin: "Temperature: 302.6 K"
15176369-15177845 lm75: celsius: "Temperature: 29.5 °C"
15176369-15177845 lm75: kelvin: "Temperature: 302.6 K"
15207162-15208638 lm75: celsius: "Temperature: 29.5 °C"
15207162-15208638 lm75: kelvin: "Temperature: 302.6 K"
15239034-15240510 lm75: celsius: "Temperature: 29.5 °C"
15239034-15240510 lm75: kelvin: "Temperature: 302.6 K"
15269467-15270943 lm75: celsius: "Temperature: 29.5 °C"
15269467-15270943 lm75: kelvin: "Temperature: 302.6 K"
15300188-15301664 lm75: celsius: "Temperature: 29.5 °C"
15300188-15301664 lm75: kelvin: "Temperature: 302.6 K"
15330620-15332096 lm75: celsius: "Temperature: 29.5 °C"
15330620-15332096 lm75: kelvin: "Temperature: 302.6 K"
15361341-15362817 lm75: celsius: "Temperature: 29.5 °C"
15361341-15362817 lm75: kelvin: "Temperature: 302.6 K"
15391774-15393249 lm75: celsius: "Temperature: 29.5 °C"
15391774-15393249 lm75: kelvin: "Temperature: 302.6 K"
15422494-15423970 lm75: celsius: "Temperature: 29.5 °C"
15422494-15423970 lm75: kelvin: "Temperature: 302.6 K"
15452927-15454403 lm75: celsius: "Temperature: 29.5 °C"
15452927-15454403 lm75: kelvin: "Temperature: 302.6 K"
15483879-15485355 lm75: celsius: "Temperature: 29.5 °C"
15483879-15485355 lm75: kelvin: "Temperature: 302.6 K"
15515032-15516508 lm75: celsius: "Temperature: 29.5 °C"
15515032-15516508 lm75: kelvin: "Temperature: 302.6 K"
15545464-15546940 lm75: celsius: "Temperature: 29.5 °C"
15545464-15546940 lm75: kelvin: "Temperature: 302.6 K"
15576185-15577661 lm75: celsius: "Temperature: 29.5 °C"
15576185-15577661 lm75: kelvin: "Temperature: 302.6 K"
15606618-15608093 lm75: celsius: "Temperature: 29.5 °C"
15606618-15608093 lm75: kelvin: "Temperature: 302.6 K"
15637338-15638814 lm75: celsius: "Temperature: 29.5 °C"
15637338-15638814 lm75: kelvin: "Temperature: 302.6 K"
15667771-15669247 lm75: celsius: "Temperature: 29.5 °C"
15667771-15669247 lm75: kelvin: "Temperature: 302.6 K"
15698491-15699967 lm75: celsius: "Temperature: 29.5 °C"
15698491-15699967 lm75: kelvin: "Temperature: 302.6 K"
15728924-15730400 lm75: celsius: "Temperature: 29.5 °C"
15728924-15730400 lm75: kelvin: "Temperature: 302.6 K"
15759645-15761120 lm75: celsius: "Temperature: 29.5 °C"
15759645-15761120 lm75: kelvin: "Temperature: 302.6 K"
15791013-15792489 lm75: celsius: "Temperature: 29.5 °C"
15791013-15792489 lm75: kelvin: "Temperature: 302.6 K"
15821446-15822922 lm75: celsius: "Temperature: 29.5 °C"
15821446-15822922 lm75: kelvin: "Temperature: 302.6 K"
15852166-15853642 lm75: celsius: "Temperature: 29.5 °C"
15852166-15853642 lm75: kelvin: "Temperature: 302.6 K"
15882599-15884075 lm75: celsius: "Temperature: 29.5 °C"
15882599-15884075 lm75: kelvin: "Temperature: 302.6 K"
15913320-15914795 lm75: celsius: "Temperature: 29.5 °C"
15913320-15914795 lm75: kelvin: "Temperature: 302.6 K"
15943752-15945228 lm75: celsius: "Temperature: 29.5 °C"
15943752-15945228 lm75: kelvin: "Temperature: 302.6 K"
15974473-15975949 lm75: celsius: "Temperature: 29.5 °C"
15974473-15975949 lm75: kelvin: "Temperature: 302.6 K"
29998626-30000102 lm75: celsius: "Temperature: 29.5 °C"
29998626-30000102 lm75: kelvin: "Temperature: 302.6 K"
30029347-30030822 lm75: celsius: "Temperature: 29.5 °C"
30029347-30030822 lm75: kelvin: "Temperature: 302.6 K"
30060067-30061543 lm75: celsius: "Temperature: 29.5 °C"
30060067-30061543 lm75: kelvin: "Temperature: 302.6 K"
30090500-30091976 lm75: celsius: "Temperature: 29.5 °C"
30090500-30091976 lm75: kelvin: "Temperature: 302.6 K"
30121292-30122768 lm75: celsius: "Temperature: 29.5 °C"
30121292-30122768 lm75: kelvin: "Temperature: 302.6 K"
30151813-30153289 lm75: celsius: "Temperature: 29.5 °C"
30151813-30153289 lm75: kelvin: "Temperature: 302.6 K"
30182390-30183865 lm75: celsius: "Temperature: 29.5 °C"
30182390-30183865 lm75: kelvin: "Temperature: 302.6 K"
30214330-30215806 lm75: celsius: "Temperature: 29.5 °C"
30214330-30215806 lm75: kelvin: "Temperature: 302.6 K"
30244763-30246238 lm75: celsius: "Temperature: 29.5 °C"
30244763-30246238 lm75: kelvin: "Temperature: 302.6 K"
30275483-30276959 lm75: celsius: "Temperature: 29.5 °C"
30275483-30276959 lm75: kelvin: "Temperature: 302.6 K"
30305916-30307392 lm75: celsius: "Temperature: 29.5 °C"
30305916-30307392 lm75: kelvin: "Temperature: 302.6 K"
30336636-30338112 lm75: celsius: "Temperature: 29.5 °C"
30336636-30338112 lm75: kelvin: "Temperature: 302.6 K"
30367069-30368545 lm75: celsius: "Temperature: 29.5 °C"
30367069-30368545 lm75: kelvin: "Temperature: 302.6 K"
30397790-30399265 lm75: celsius: "Temperature: 29.5 °C"
30397790-30399265 lm75: kelvin: "Temperature: 302.6 K"
30428222-30429698 lm75: celsius: "Temperature: 29.5 °C"
30428222-30429698 lm75: kelvin: "Temperature: 302.6 K"
30459015-30460491 lm75: celsius: "Temperature: 29.5 °C"
30459015-30460491 lm75: kelvin: "Temperature: 302.6 K"
30490311-30491787 lm75: celsius: "Temperature: 29.5 °C"
30490311-30491787 lm75: kelvin: "Temperature: 302.6 K"
30520744-30522220 lm75: celsius: "Temperature: 29.5 °C"
30520744-30522220 lm75: kelvin: "Temperature: 302.6 K"
30551465-30552940 lm75: celsius: "Temperature: 29.5 °C"
30551465-30552940 lm75: kelvin: "Temperature: 302.6 K"
30581897-30583373 lm75: celsius: "Temperature: 29.5 °C"
30581897-30583373 lm75: kelvin: "Temperature: 302.6 K"
30612618-30614094 lm75: celsius: "Temperature: 29.5 °C"
30612618-30614094 lm75: kelvin: "Temperature: 302.6 K"
30643050-30644526 lm75: celsius: "Temperature: 29.5 °C"
30643050-30644526 lm75: kelvin: "Temperature: 302.6 K"
30673931-30675407 lm75: celsius: "Temperature: 29.5 °C"
30673931-30675407 lm75: kelvin: "Temperature: 302.6 K"
30704220-30705695 lm75: celsius: "Temperature: 29.5 °C"
30704220-30705695 lm75: kelvin: "Temperature: 302.6 K"
30735060-30736536 lm75: celsius: "Temperature: 29.5 °C"
30735060-30736536 lm75: kelvin: "Temperature: 302.6 K"
30766285-30767761 lm75: celsius: "Temperature: 29.5 °C"
30766285-30767761 lm75: kelvin: "Temperature: 302.6 K"
30796717-30798193 lm75: celsius: "Temperature: 29.5 °C"
30796717-30798193 lm75: kelvin: "Temperature: 302.6 K"
30827438-30828914 lm75: celsius: "Temperature: 29.5 °C"
30827438-30828914 lm75: kelvin: "Temperature: 302.6 K"
30857870-30859346 lm75: celsius: "Temperature: 29.5 °C"
30857870-30859346 lm75: kelvin: "Temperature: 302.6 K"
30888663-30890139 lm75: celsius: "Temperature: 29.5 °C"
30888663-30890139 lm75: kelvin: "Temperature: 302.6 K"
30919024-30920500 lm75: celsius: "Temperature: 29.5 °C"
30919024-30920500 lm75: kelvin: "Temperature: 302.6 K"
30949816-30951292 lm75: celsius: "Temperature: 29.5 °C"
30949816-30951292 lm75: kelvin: "Temperature: 302.6 K"
44973897-44975373 lm75: celsius: "Temperature: 29.5 °C"
44973897-44975373 lm75: kelvin: "Temperature: 302.6 K"
45004618-45006094 lm75: celsius: "Temperature: 29.5 °C"
45004618-45006094 lm75: kelvin: "Temperature: 302.6 K"
45035411-45036886 lm75: celsius: "Temperature: 29.5 °C"
45035411-45036886 lm75: kelvin: "Temperature: 302.6 K"
45065771-45067247 lm75: celsius: "Temperature: 29.5 °C"
45065771-45067247 lm75: kelvin: "Temperature: 302.6 K"
45096564-45098040 lm75: celsius: "Temperature: 29.5 °C"
45096564-45098040 lm75: kelvin: "Temperature: 302.6 K"
45126924-45128400 lm75: celsius: "Temperature: 29.5 °C"
45126924-45128400 lm75: kelvin: "Temperature: 302.6 K"
45157717-45159193 lm75: celsius: "Temperature: 29.5 °C"
45157717-45159193 lm75: kelvin: "Temperature: 302.6 K"
45189589-45191065 lm75: celsius: "Temperature: 29.5 °C"
45189589-45191065 lm75: kelvin: "Temperature: 302.6 K"
45220022-45221498 lm75: celsius: "Temperature: 29.5 °C"
45220022-45221498 lm75: kelvin: "Temperature: 302.6 K"
45250815-45252290 lm75: celsius: "Temperature: 29.5 °C"
45250815-45252290 lm75: kelvin: "Temperature: 302.6 K"
45281175-45282651 lm75: celsius: "Temperature: 29.5 °C"
45281175-45282651 lm75: kelvin: "Temperature: 302.6 K"
45311968-45313444 lm75: celsius: "Temperature: 29.5 °C"
45311968-45313444 lm75: kelvin: "Temperature: 302.6 K"
45342560-45344036 lm75: celsius: "Temperature: 29.5 °C"
45342560-45344036 lm75: kelvin: "Temperature: 302.6 K"
45373137-45374613 lm75: celsius: "Temperature: 29.5 °C"
45373137-45374613 lm75: kelvin: "Temperature: 302.6 K"
45403498-45404974 lm75: celsius: "Temperature: 29.5 °C"
45403498-45404974 lm75: kelvin: "Temperature: 302.6 K"
45434362-45435838 lm75: celsius: "Temperature: 29.5 °C"
45434362-45435838 lm75: kelvin: "Temperature: 302.6 K"
45465587-45467063 lm75: celsius: "Temperature: 29.5 °C"
45465587-45467063 lm75: kelvin: "Temperature: 302.6 K"
45496019-45497495 lm75: celsius: "Temperature: 29.5 °C"
45496019-45497495 lm75: kelvin: "Temperature: 302.6 K"
45526812-45528288 lm75: celsius: "Temperature: 29.5 °C"
45526812-45528288 lm75: kelvin: "Temperature: 302.6 K"
45557173-45558648 lm75: celsius: "Temperature: 29.5 °C"
45557173-45558648 lm75: kelvin: "Temperature: 302.6 K"
45587965-45589441 lm75: celsius: "Temperature: 29.5 °C"
45587965-45589441 lm75: kelvin: "Temperature: 302.6 K"
45618326-45619802 lm75: celsius: "Temperature: 29.5 °C"
45618326-45619802 lm75: kelvin: "Temperature: 302.6 K"
45649118-45650594 lm75: celsius: "Temperature: 29.5 °C"
45649118-45650594 lm75: kelvin: "Temperature: 302.6 K"
45679551-45681027 lm75: celsius: "Temperature: 29.5 °C"
45679551-45681027 lm75: kelvin: "Temperature: 302.6 K"
45710272-45711747 lm75: celsius: "Temperature: 29.5 °C"
45710272-45711747 lm75: kelvin: "Temperature: 302.6 K"
45741568-45743044 lm75: celsius: "Temperature: 29.5 °C"
45741568-45743044 lm75: kelvin: "Temperature: 302.6 K"
45772073-45773549 lm75: celsius: "Temperature: 29.5 °C"
45772073-45773549 lm75: kelvin: "Temperature: 302.6 K"
45802793-45804269 lm75: celsius: "Temperature: 29.5 °C"
45802793-45804269 lm75: kelvin: "Temperature: 302.6 K"
45833154-45834630 lm75: celsius: "Temperature: 29.5 °C"
45833154-45834630 lm75: kelvin: "Temperature: 302.6 K"
45864106-45865582 lm75: celsius: "Temperature: 29.5 °C"
45864106-45865582 lm75: kelvin: "Temperature: 302.6 K"
45894971-45896447 lm75: celsius: "Temperature: 29.5 °C"
45894971-45896447 lm75: kelvin: "Temperature: 302.6 K"
45925692-45927167 lm75: celsius: "Temperature: 29.5 °C"
45925692-45927167 lm75: kelvin: "Temperature: 302.6 K"
59949181-59950657 lm75: celsius: "Temperature: 29.5 °C"
59949181-59950657 lm75: kelvin: "Temperature: 302.6 K"
59979973-59981449 lm75: celsius: "Temperature: 29.5 °C"
59979973-59981449 lm75: kelvin: "Temperature: 302.6 K"
