23382-24370 am230x: start: "Start" "S"
24370-24530 am230x: response: "Response" "R"
24530-24611 am230x: bit: "Bit: 0" "0"
24611-24691 am230x: bit: "Bit: 0" "0"
24691-24772 am230x: bit: "Bit: 0" "0"
24772-24852 am230x: bit: "Bit: 0" "0"
24852-24933 am230x: bit: "Bit: 0" "0"
24933-25013 am230x: bit: "Bit: 0" "0"
25013-25140 am230x: bit: "Bit: 1" "1"
25140-25220 am230x: bit: "Bit: 0" "0"
24530-25220 am230x: byte: "Byte: 0x02" "0x02"
25220-25361 am230x: bit: "Bit: 1" "1"
25361-25488 am230x: bit: "Bit: 1" "1"
25488-25569 am230x: bit: "Bit: 0" "0"
25569-25696 am230x: bit: "Bit: 1" "1"
25696-25777 am230x: bit: "Bit: 0" "0"
25777-25857 am230x: bit: "Bit: 0" "0"
25857-25937 am230x: bit: "Bit: 0" "0"
25937-26064 am230x: bit: "Bit: 1" "1"
25220-26064 am230x: byte: "Byte: 0xd1" "0xd1"
24530-26064 am230x: humidity: "Humidity: 72.1 %" "RH = 72.1 %"
26064-26158 am230x: bit: "Bit: 0" "0"
26158-26238 am230x: bit: "Bit: 0" "0"
26238-26319 am230x: bit: "Bit: 0" "0"
26319-26399 am230x: bit: "Bit: 0" "0"
26399-26480 am230x: bit: "Bit: 0" "0"
26480-26560 am230x: bit: "Bit: 0" "0"
26560-26641 am230x: bit: "Bit: 0" "0"
26641-26720 am230x: bit: "Bit: 0" "0"
26064-26720 am230x: byte: "Byte: 0x00" "0x00"
26720-26861 am230x: bit: "Bit: 1" "1"
26861-26988 am230x: bit: "Bit: 1" "1"
26988-27116 am230x: bit: "Bit: 1" "1"
27116-27196 am230x: bit: "Bit: 0" "0"
27196-27324 am230x: bit: "Bit: 1" "1"
27324-27451 am230x: bit: "Bit: 1" "1"
27451-27579 am230x: bit: "Bit: 1" "1"
27579-27658 am230x: bit: "Bit: 0" "0"
26720-27658 am230x: byte: "Byte: 0xee" "0xee"
26064-27658 am230x: temperature: "Temperature: 23.8 °C" "T = 23.8 °C"
27658-27796 am230x: bit: "Bit: 1" "1"
27796-27923 am230x: bit: "Bit: 1" "1"
27923-28004 am230x: bit: "Bit: 0" "0"
28004-28084 am230x: bit: "Bit: 0" "0"
28084-28165 am230x: bit: "Bit: 0" "0"
28165-28245 am230x: bit: "Bit: 0" "0"
28245-28326 am230x: bit: "Bit: 0" "0"
28326-28452 am230x: bit: "Bit: 1" "1"
27658-28452 am230x: byte: "Byte: 0xc1" "0xc1"
27658-28452 am230x: checksum: "Checksum: OK" "OK"
28452-28499 am230x: end: "End" "E"
