44147-45138 am230x: start: "Start" "S"
45138-45298 am230x: response: "Response" "R"
45298-45378 am230x: bit: "Bit: 0" "0"
45378-45458 am230x: bit: "Bit: 0" "0"
45458-45538 am230x: bit: "Bit: 0" "0"
45538-45618 am230x: bit: "Bit: 0" "0"
45618-45698 am230x: bit: "Bit: 0" "0"
45698-45779 am230x: bit: "Bit: 0" "0"
45779-45906 am230x: bit: "Bit: 1" "1"
45906-45985 am230x: bit: "Bit: 0" "0"
45298-45985 am230x: byte: "Byte: 0x02" "0x02"
45985-46079 am230x: bit: "Bit: 0" "0"
46079-46159 am230x: bit: "Bit: 0" "0"
46159-46286 am230x: bit: "Bit: 1" "1"
46286-46366 am230x: bit: "Bit: 0" "0"
46366-46494 am230x: bit: "Bit: 1" "1"
46494-46574 am230x: bit: "Bit: 0" "0"
46574-46701 am230x: bit: "Bit: 1" "1"
46701-46827 am230x: bit: "Bit: 1" "1"
45985-46827 am230x: byte: "Byte: 0x2b" "0x2b"
45298-46827 am230x: humidity: "Humidity: 55.5 %" "RH = 55.5 %"
46827-46921 am230x: bit: "Bit: 0" "0"
46921-47001 am230x: bit: "Bit: 0" "0"
47001-47081 am230x: bit: "Bit: 0" "0"
47081-47161 am230x: bit: "Bit: 0" "0"
47161-47242 am230x: bit: "Bit: 0" "0"
47242-47322 am230x: bit: "Bit: 0" "0"
47322-47402 am230x: bit: "Bit: 0" "0"
47402-47481 am230x: bit: "Bit: 0" "0"
46827-47481 am230x: byte: "Byte: 0x00" "0x00"
47481-47622 am230x: bit: "Bit: 1" "1"
47622-47749 am230x: bit: "Bit: 1" "1"
47749-47876 am230x: bit: "Bit: 1" "1"
47876-47957 am230x: bit: "Bit: 0" "0"
47957-48084 am230x: bit: "Bit: 1" "1"
48084-48164 am230x: bit: "Bit: 0" "0"
48164-48244 am230x: bit: "Bit: 0" "0"
48244-48323 am230x: bit: "Bit: 0" "0"
47481-48323 am230x: byte: "Byte: 0xe8" "0xe8"
46827-48323 am230x: temperature: "Temperature: 23.2 °C" "T = 23.2 °C"
48323-48414 am230x: bit: "Bit: 0" "0"
48414-48495 am230x: bit: "Bit: 0" "0"
48495-48575 am230x: bit: "Bit: 0" "0"
48575-48702 am230x: bit: "Bit: 1" "1"
48702-48782 am230x: bit: "Bit: 0" "0"
48782-48909 am230x: bit: "Bit: 1" "1"
48909-48990 am230x: bit: "Bit: 0" "0"
48990-49116 am230x: bit: "Bit: 1" "1"
48323-49116 am230x: byte: "Byte: 0x15" "0x15"
48323-49116 am230x: checksum: "Checksum: OK" "OK"
49116-49163 am230x: end: "End" "E"
