42567-43569 am230x: start: "Start" "S"
43569-43730 am230x: response: "Response" "R"
43730-43810 am230x: bit: "Bit: 0" "0"
43810-43890 am230x: bit: "Bit: 0" "0"
43890-43970 am230x: bit: "Bit: 0" "0"
43970-44050 am230x: bit: "Bit: 0" "0"
44050-44130 am230x: bit: "Bit: 0" "0"
44130-44209 am230x: bit: "Bit: 0" "0"
44209-44289 am230x: bit: "Bit: 0" "0"
44289-44368 am230x: bit: "Bit: 0" "0"
43730-44368 am230x: byte: "Byte: 0x00" "0x00"
44368-44509 am230x: bit: "Bit: 1" "1"
44509-44635 am230x: bit: "Bit: 1" "1"
44635-44715 am230x: bit: "Bit: 0" "0"
44715-44842 am230x: bit: "Bit: 1" "1"
44842-44969 am230x: bit: "Bit: 1" "1"
44969-45095 am230x: bit: "Bit: 1" "1"
45095-45175 am230x: bit: "Bit: 0" "0"
45175-45301 am230x: bit: "Bit: 1" "1"
44368-45301 am230x: byte: "Byte: 0xdd" "0xdd"
43730-45301 am230x: humidity: "Humidity: 22.1 %" "RH = 22.1 %"
45301-45395 am230x: bit: "Bit: 0" "0"
45395-45474 am230x: bit: "Bit: 0" "0"
45474-45554 am230x: bit: "Bit: 0" "0"
45554-45634 am230x: bit: "Bit: 0" "0"
45634-45714 am230x: bit: "Bit: 0" "0"
45714-45794 am230x: bit: "Bit: 0" "0"
45794-45874 am230x: bit: "Bit: 0" "0"
45874-46000 am230x: bit: "Bit: 1" "1"
45301-46000 am230x: byte: "Byte: 0x01" "0x01"
46000-46140 am230x: bit: "Bit: 1" "1"
46140-46220 am230x: bit: "Bit: 0" "0"
46220-46347 am230x: bit: "Bit: 1" "1"
46347-46427 am230x: bit: "Bit: 0" "0"
46427-46554 am230x: bit: "Bit: 1" "1"
46554-46633 am230x: bit: "Bit: 0" "0"
46633-46713 am230x: bit: "Bit: 0" "0"
46713-46839 am230x: bit: "Bit: 1" "1"
46000-46839 am230x: byte: "Byte: 0xa9" "0xa9"
45301-46839 am230x: temperature: "Temperature: 42.5 °C" "T = 42.5 °C"
46839-46977 am230x: bit: "Bit: 1" "1"
46977-47057 am230x: bit: "Bit: 0" "0"
47057-47137 am230x: bit: "Bit: 0" "0"
47137-47217 am230x: bit: "Bit: 0" "0"
47217-47297 am230x: bit: "Bit: 0" "0"
47297-47423 am230x: bit: "Bit: 1" "1"
47423-47550 am230x: bit: "Bit: 1" "1"
47550-47676 am230x: bit: "Bit: 1" "1"
46839-47676 am230x: byte: "Byte: 0x87" "0x87"
46839-47676 am230x: checksum: "Checksum: OK" "OK"
47676-47723 am230x: end: "End" "E"
