49233-50224 am230x: start: "Start" "S"
50224-50388 am230x: response: "Response" "R"
50388-50468 am230x: bit: "Bit: 0" "0"
50468-50548 am230x: bit: "Bit: 0" "0"
50548-50629 am230x: bit: "Bit: 0" "0"
50629-50709 am230x: bit: "Bit: 0" "0"
50709-50789 am230x: bit: "Bit: 0" "0"
50789-50869 am230x: bit: "Bit: 0" "0"
50869-50950 am230x: bit: "Bit: 0" "0"
50950-51076 am230x: bit: "Bit: 1" "1"
50388-51076 am230x: byte: "Byte: 0x01" "0x01"
51076-51170 am230x: bit: "Bit: 0" "0"
51170-51250 am230x: bit: "Bit: 0" "0"
51250-51377 am230x: bit: "Bit: 1" "1"
51377-51504 am230x: bit: "Bit: 1" "1"
51504-51631 am230x: bit: "Bit: 1" "1"
51631-51712 am230x: bit: "Bit: 0" "0"
51712-51792 am230x: bit: "Bit: 0" "0"
51792-51918 am230x: bit: "Bit: 1" "1"
51076-51918 am230x: byte: "Byte: 0x39" "0x39"
50388-51918 am230x: humidity: "Humidity: 31.3 %" "RH = 31.3 %"
51918-52012 am230x: bit: "Bit: 0" "0"
52012-52092 am230x: bit: "Bit: 0" "0"
52092-52172 am230x: bit: "Bit: 0" "0"
52172-52253 am230x: bit: "Bit: 0" "0"
52253-52333 am230x: bit: "Bit: 0" "0"
52333-52413 am230x: bit: "Bit: 0" "0"
52413-52493 am230x: bit: "Bit: 0" "0"
52493-52573 am230x: bit: "Bit: 0" "0"
51918-52573 am230x: byte: "Byte: 0x00" "0x00"
52573-52713 am230x: bit: "Bit: 1" "1"
52713-52841 am230x: bit: "Bit: 1" "1"
52841-52921 am230x: bit: "Bit: 0" "0"
52921-53001 am230x: bit: "Bit: 0" "0"
53001-53081 am230x: bit: "Bit: 0" "0"
53081-53162 am230x: bit: "Bit: 0" "0"
53162-53242 am230x: bit: "Bit: 0" "0"
53242-53368 am230x: bit: "Bit: 1" "1"
52573-53368 am230x: byte: "Byte: 0xc1" "0xc1"
51918-53368 am230x: temperature: "Temperature: 19.3 °C" "T = 19.3 °C"
53368-53506 am230x: bit: "Bit: 1" "1"
53506-53633 am230x: bit: "Bit: 1" "1"
53633-53760 am230x: bit: "Bit: 1" "1"
53760-53887 am230x: bit: "Bit: 1" "1"
53887-54015 am230x: bit: "Bit: 1" "1"
54015-54095 am230x: bit: "Bit: 0" "0"
54095-54222 am230x: bit: "Bit: 1" "1"
54222-54348 am230x: bit: "Bit: 1" "1"
53368-54348 am230x: byte: "Byte: 0xfb" "0xfb"
53368-54348 am230x: checksum: "Checksum: OK" "OK"
54348-54395 am230x: end: "End" "E"
