673573-693643 am230x: start: "Start" "S"
693643-693783 am230x: response: "Response" "R"
693783-693870 am230x: bit: "Bit: 0" "0"
693870-693955 am230x: bit: "Bit: 0" "0"
693955-694040 am230x: bit: "Bit: 0" "0"
694040-694125 am230x: bit: "Bit: 0" "0"
694125-694210 am230x: bit: "Bit: 0" "0"
694210-694295 am230x: bit: "Bit: 0" "0"
694295-694429 am230x: bit: "Bit: 1" "1"
694429-694514 am230x: bit: "Bit: 0" "0"
693783-694514 am230x: byte: "Byte: 0x02" "0x02"
694514-694603 am230x: bit: "Bit: 0" "0"
694603-694689 am230x: bit: "Bit: 0" "0"
694689-694774 am230x: bit: "Bit: 0" "0"
694774-694859 am230x: bit: "Bit: 0" "0"
694859-694993 am230x: bit: "Bit: 1" "1"
694993-695127 am230x: bit: "Bit: 1" "1"
695127-695261 am230x: bit: "Bit: 1" "1"
695261-695346 am230x: bit: "Bit: 0" "0"
694514-695346 am230x: byte: "Byte: 0x0e" "0x0e"
693783-695346 am230x: humidity: "Humidity: 52.6 %" "RH = 52.6 %"
695346-695435 am230x: bit: "Bit: 0" "0"
695435-695520 am230x: bit: "Bit: 0" "0"
695520-695605 am230x: bit: "Bit: 0" "0"
695605-695690 am230x: bit: "Bit: 0" "0"
695690-695775 am230x: bit: "Bit: 0" "0"
695775-695860 am230x: bit: "Bit: 0" "0"
695860-695945 am230x: bit: "Bit: 0" "0"
695945-696079 am230x: bit: "Bit: 1" "1"
695346-696079 am230x: byte: "Byte: 0x01" "0x01"
696079-696168 am230x: bit: "Bit: 0" "0"
696168-696253 am230x: bit: "Bit: 0" "0"
696253-696338 am230x: bit: "Bit: 0" "0"
696338-696423 am230x: bit: "Bit: 0" "0"
696423-696508 am230x: bit: "Bit: 0" "0"
696508-696593 am230x: bit: "Bit: 0" "0"
696593-696679 am230x: bit: "Bit: 0" "0"
696679-696764 am230x: bit: "Bit: 0" "0"
696079-696764 am230x: byte: "Byte: 0x00" "0x00"
695346-696764 am230x: temperature: "Temperature: 25.6 째C" "T = 25.6 째C"
696764-696853 am230x: bit: "Bit: 0" "0"
696853-696938 am230x: bit: "Bit: 0" "0"
696938-697023 am230x: bit: "Bit: 0" "0"
697023-697157 am230x: bit: "Bit: 1" "1"
697157-697242 am230x: bit: "Bit: 0" "0"
697242-697327 am230x: bit: "Bit: 0" "0"
697327-697412 am230x: bit: "Bit: 0" "0"
697412-697546 am230x: bit: "Bit: 1" "1"
696764-697546 am230x: byte: "Byte: 0x11" "0x11"
696764-697546 am230x: checksum: "Checksum: OK" "OK"
697546-697609 am230x: end: "End" "E"
2956015-2976084 am230x: start: "Start" "S"
2976084-2976225 am230x: response: "Response" "R"
2976225-2976312 am230x: bit: "Bit: 0" "0"
2976312-2976397 am230x: bit: "Bit: 0" "0"
2976397-2976482 am230x: bit: "Bit: 0" "0"
2976482-2976567 am230x: bit: "Bit: 0" "0"
2976567-2976652 am230x: bit: "Bit: 0" "0"
2976652-2976737 am230x: bit: "Bit: 0" "0"
2976737-2976871 am230x: bit: "Bit: 1" "1"
2976871-2976956 am230x: bit: "Bit: 0" "0"
2976225-2976956 am230x: byte: "Byte: 0x02" "0x02"
2976956-2977045 am230x: bit: "Bit: 0" "0"
2977045-2977130 am230x: bit: "Bit: 0" "0"
2977130-2977215 am230x: bit: "Bit: 0" "0"
2977215-2977300 am230x: bit: "Bit: 0" "0"
2977300-2977434 am230x: bit: "Bit: 1" "1"
2977434-2977568 am230x: bit: "Bit: 1" "1"
2977568-2977702 am230x: bit: "Bit: 1" "1"
2977702-2977788 am230x: bit: "Bit: 0" "0"
2976956-2977788 am230x: byte: "Byte: 0x0e" "0x0e"
2976225-2977788 am230x: humidity: "Humidity: 52.6 %" "RH = 52.6 %"
2977788-2977877 am230x: bit: "Bit: 0" "0"
2977877-2977962 am230x: bit: "Bit: 0" "0"
2977962-2978047 am230x: bit: "Bit: 0" "0"
2978047-2978132 am230x: bit: "Bit: 0" "0"
2978132-2978217 am230x: bit: "Bit: 0" "0"
2978217-2978302 am230x: bit: "Bit: 0" "0"
2978302-2978387 am230x: bit: "Bit: 0" "0"
2978387-2978521 am230x: bit: "Bit: 1" "1"
2977788-2978521 am230x: byte: "Byte: 0x01" "0x01"
2978521-2978610 am230x: bit: "Bit: 0" "0"
2978610-2978695 am230x: bit: "Bit: 0" "0"
2978695-2978780 am230x: bit: "Bit: 0" "0"
2978780-2978865 am230x: bit: "Bit: 0" "0"
2978865-2978950 am230x: bit: "Bit: 0" "0"
2978950-2979035 am230x: bit: "Bit: 0" "0"
2979035-2979120 am230x: bit: "Bit: 0" "0"
2979120-2979205 am230x: bit: "Bit: 0" "0"
2978521-2979205 am230x: byte: "Byte: 0x00" "0x00"
2977788-2979205 am230x: temperature: "Temperature: 25.6 째C" "T = 25.6 째C"
2979205-2979294 am230x: bit: "Bit: 0" "0"
2979294-2979379 am230x: bit: "Bit: 0" "0"
2979379-2979464 am230x: bit: "Bit: 0" "0"
2979464-2979598 am230x: bit: "Bit: 1" "1"
2979598-2979683 am230x: bit: "Bit: 0" "0"
2979683-2979769 am230x: bit: "Bit: 0" "0"
2979769-2979854 am230x: bit: "Bit: 0" "0"
2979854-2979988 am230x: bit: "Bit: 1" "1"
2979205-2979988 am230x: byte: "Byte: 0x11" "0x11"
2979205-2979988 am230x: checksum: "Checksum: OK" "OK"
2979988-2980051 am230x: end: "End" "E"
