35940-36932 am230x: start: "Start" "S"
36932-37097 am230x: response: "Response" "R"
37097-37178 am230x: bit: "Bit: 0" "0"
37178-37259 am230x: bit: "Bit: 0" "0"
37259-37340 am230x: bit: "Bit: 0" "0"
37340-37421 am230x: bit: "Bit: 0" "0"
37421-37502 am230x: bit: "Bit: 0" "0"
37502-37583 am230x: bit: "Bit: 0" "0"
37583-37712 am230x: bit: "Bit: 1" "1"
37712-37792 am230x: bit: "Bit: 0" "0"
37097-37792 am230x: byte: "Byte: 0x02" "0x02"
37792-37934 am230x: bit: "Bit: 1" "1"
37934-38015 am230x: bit: "Bit: 0" "0"
38015-38143 am230x: bit: "Bit: 1" "1"
38143-38272 am230x: bit: "Bit: 1" "1"
38272-38400 am230x: bit: "Bit: 1" "1"
38400-38529 am230x: bit: "Bit: 1" "1"
38529-38657 am230x: bit: "Bit: 1" "1"
38657-38785 am230x: bit: "Bit: 1" "1"
37792-38785 am230x: byte: "Byte: 0xbf" "0xbf"
37097-38785 am230x: humidity: "Humidity: 70.3 %" "RH = 70.3 %"
38785-38927 am230x: bit: "Bit: 1" "1"
38927-39008 am230x: bit: "Bit: 0" "0"
39008-39089 am230x: bit: "Bit: 0" "0"
39089-39170 am230x: bit: "Bit: 0" "0"
39170-39251 am230x: bit: "Bit: 0" "0"
39251-39332 am230x: bit: "Bit: 0" "0"
39332-39413 am230x: bit: "Bit: 0" "0"
39413-39493 am230x: bit: "Bit: 0" "0"
38785-39493 am230x: byte: "Byte: 0x80" "0x80"
39493-39588 am230x: bit: "Bit: 0" "0"
39588-39717 am230x: bit: "Bit: 1" "1"
39717-39798 am230x: bit: "Bit: 0" "0"
39798-39879 am230x: bit: "Bit: 0" "0"
39879-40007 am230x: bit: "Bit: 1" "1"
40007-40136 am230x: bit: "Bit: 1" "1"
40136-40264 am230x: bit: "Bit: 1" "1"
40264-40344 am230x: bit: "Bit: 0" "0"
39493-40344 am230x: byte: "Byte: 0x4e" "0x4e"
38785-40344 am230x: temperature: "Temperature: -7.8 °C" "T = -7.8 °C"
40344-40483 am230x: bit: "Bit: 1" "1"
40483-40564 am230x: bit: "Bit: 0" "0"
40564-40645 am230x: bit: "Bit: 0" "0"
40645-40726 am230x: bit: "Bit: 0" "0"
40726-40855 am230x: bit: "Bit: 1" "1"
40855-40983 am230x: bit: "Bit: 1" "1"
40983-41112 am230x: bit: "Bit: 1" "1"
41112-41239 am230x: bit: "Bit: 1" "1"
40344-41239 am230x: byte: "Byte: 0x8f" "0x8f"
40344-41239 am230x: checksum: "Checksum: OK" "OK"
41239-41287 am230x: end: "End" "E"
