1892253-1912320 am230x: start: "Start" "S"
1912320-1912457 am230x: response: "Response" "R"
1912457-1912535 am230x: bit: "Bit: 0" "0"
1912535-1912613 am230x: bit: "Bit: 0" "0"
1912613-1912738 am230x: bit: "Bit: 1" "1"
1912738-1912816 am230x: bit: "Bit: 0" "0"
1912816-1912894 am230x: bit: "Bit: 0" "0"
1912894-1913019 am230x: bit: "Bit: 1" "1"
1913019-1913097 am230x: bit: "Bit: 0" "0"
1913097-1913175 am230x: bit: "Bit: 0" "0"
1912457-1913175 am230x: byte: "Byte: 0x24" "0x24"
1913175-1913253 am230x: bit: "Bit: 0" "0"
1913253-1913331 am230x: bit: "Bit: 0" "0"
1913331-1913409 am230x: bit: "Bit: 0" "0"
1913409-1913487 am230x: bit: "Bit: 0" "0"
1913487-1913564 am230x: bit: "Bit: 0" "0"
1913564-1913642 am230x: bit: "Bit: 0" "0"
1913642-1913720 am230x: bit: "Bit: 0" "0"
1913720-1913800 am230x: bit: "Bit: 0" "0"
1913175-1913800 am230x: byte: "Byte: 0x00" "0x00"
1912457-1913800 am230x: humidity: "Humidity: 36.0 %" "RH = 36.0 %"
1913800-1913878 am230x: bit: "Bit: 0" "0"
1913878-1913956 am230x: bit: "Bit: 0" "0"
1913956-1914034 am230x: bit: "Bit: 0" "0"
1914034-1914158 am230x: bit: "Bit: 1" "1"
1914158-1914283 am230x: bit: "Bit: 1" "1"
1914283-1914361 am230x: bit: "Bit: 0" "0"
1914361-1914486 am230x: bit: "Bit: 1" "1"
1914486-1914611 am230x: bit: "Bit: 1" "1"
1913800-1914611 am230x: byte: "Byte: 0x1b" "0x1b"
1914611-1914689 am230x: bit: "Bit: 0" "0"
1914689-1914767 am230x: bit: "Bit: 0" "0"
1914767-1914845 am230x: bit: "Bit: 0" "0"
1914845-1914923 am230x: bit: "Bit: 0" "0"
1914923-1915001 am230x: bit: "Bit: 0" "0"
1915001-1915079 am230x: bit: "Bit: 0" "0"
1915079-1915157 am230x: bit: "Bit: 0" "0"
1915157-1915236 am230x: bit: "Bit: 0" "0"
1914611-1915236 am230x: byte: "Byte: 0x00" "0x00"
1913800-1915236 am230x: temperature: "Temperature: 27.0 째C" "T = 27.0 째C"
1915236-1915314 am230x: bit: "Bit: 0" "0"
1915314-1915392 am230x: bit: "Bit: 0" "0"
1915392-1915517 am230x: bit: "Bit: 1" "1"
1915517-1915642 am230x: bit: "Bit: 1" "1"
1915642-1915767 am230x: bit: "Bit: 1" "1"
1915767-1915892 am230x: bit: "Bit: 1" "1"
1915892-1916016 am230x: bit: "Bit: 1" "1"
1916016-1916139 am230x: bit: "Bit: 1" "1"
1915236-1916139 am230x: byte: "Byte: 0x3f" "0x3f"
1915236-1916139 am230x: checksum: "Checksum: OK" "OK"
1916139-1916196 am230x: end: "End" "E"
4175472-4195539 am230x: start: "Start" "S"
4195539-4195677 am230x: response: "Response" "R"
4195677-4195755 am230x: bit: "Bit: 0" "0"
4195755-4195833 am230x: bit: "Bit: 0" "0"
4195833-4195957 am230x: bit: "Bit: 1" "1"
4195957-4196035 am230x: bit: "Bit: 0" "0"
4196035-4196113 am230x: bit: "Bit: 0" "0"
4196113-4196238 am230x: bit: "Bit: 1" "1"
4196238-4196316 am230x: bit: "Bit: 0" "0"
4196316-4196394 am230x: bit: "Bit: 0" "0"
4195677-4196394 am230x: byte: "Byte: 0x24" "0x24"
4196394-4196472 am230x: bit: "Bit: 0" "0"
4196472-4196550 am230x: bit: "Bit: 0" "0"
4196550-4196628 am230x: bit: "Bit: 0" "0"
4196628-4196706 am230x: bit: "Bit: 0" "0"
4196706-4196784 am230x: bit: "Bit: 0" "0"
4196784-4196862 am230x: bit: "Bit: 0" "0"
4196862-4196940 am230x: bit: "Bit: 0" "0"
4196940-4197019 am230x: bit: "Bit: 0" "0"
4196394-4197019 am230x: byte: "Byte: 0x00" "0x00"
4195677-4197019 am230x: humidity: "Humidity: 36.0 %" "RH = 36.0 %"
4197019-4197097 am230x: bit: "Bit: 0" "0"
4197097-4197175 am230x: bit: "Bit: 0" "0"
4197175-4197253 am230x: bit: "Bit: 0" "0"
4197253-4197378 am230x: bit: "Bit: 1" "1"
4197378-4197503 am230x: bit: "Bit: 1" "1"
4197503-4197581 am230x: bit: "Bit: 0" "0"
4197581-4197706 am230x: bit: "Bit: 1" "1"
4197706-4197830 am230x: bit: "Bit: 1" "1"
4197019-4197830 am230x: byte: "Byte: 0x1b" "0x1b"
4197830-4197908 am230x: bit: "Bit: 0" "0"
4197908-4197986 am230x: bit: "Bit: 0" "0"
4197986-4198064 am230x: bit: "Bit: 0" "0"
4198064-4198142 am230x: bit: "Bit: 0" "0"
4198142-4198220 am230x: bit: "Bit: 0" "0"
4198220-4198298 am230x: bit: "Bit: 0" "0"
4198298-4198376 am230x: bit: "Bit: 0" "0"
4198376-4198455 am230x: bit: "Bit: 0" "0"
4197830-4198455 am230x: byte: "Byte: 0x00" "0x00"
4197019-4198455 am230x: temperature: "Temperature: 27.0 째C" "T = 27.0 째C"
4198455-4198533 am230x: bit: "Bit: 0" "0"
4198533-4198611 am230x: bit: "Bit: 0" "0"
4198611-4198736 am230x: bit: "Bit: 1" "1"
4198736-4198861 am230x: bit: "Bit: 1" "1"
4198861-4198986 am230x: bit: "Bit: 1" "1"
4198986-4199111 am230x: bit: "Bit: 1" "1"
4199111-4199236 am230x: bit: "Bit: 1" "1"
4199236-4199358 am230x: bit: "Bit: 1" "1"
4198455-4199358 am230x: byte: "Byte: 0x3f" "0x3f"
4198455-4199358 am230x: checksum: "Checksum: OK" "OK"
4199358-4199415 am230x: end: "End" "E"
