0-40 counter: edge_count: "1"
40-44 counter: edge_count: "2"
44-48 counter: edge_count: "3"
48-52 counter: edge_count: "4"
52-56 counter: edge_count: "5"
56-60 counter: edge_count: "6"
60-64 counter: edge_count: "7"
64-68 counter: edge_count: "8"
68-72 counter: edge_count: "9"
0-72 counter: word_count: "1"
72-88 counter: edge_count: "10"
88-92 counter: edge_count: "11"
92-96 counter: edge_count: "12"
96-100 counter: edge_count: "13"
100-104 counter: edge_count: "14"
104-108 counter: edge_count: "15"
108-112 counter: edge_count: "16"
112-116 counter: edge_count: "17"
116-120 counter: edge_count: "18"
72-120 counter: word_count: "2"
120-135 counter: edge_count: "19"
135-139 counter: edge_count: "20"
139-143 counter: edge_count: "21"
143-147 counter: edge_count: "22"
147-151 counter: edge_count: "23"
151-155 counter: edge_count: "24"
155-159 counter: edge_count: "25"
159-163 counter: edge_count: "26"
163-167 counter: edge_count: "27"
120-167 counter: word_count: "3"
167-182 counter: edge_count: "28"
182-186 counter: edge_count: "29"
186-190 counter: edge_count: "30"
190-194 counter: edge_count: "31"
194-198 counter: edge_count: "32"
198-202 counter: edge_count: "33"
202-206 counter: edge_count: "34"
206-210 counter: edge_count: "35"
210-214 counter: edge_count: "36"
167-214 counter: word_count: "4"
214-230 counter: edge_count: "37"
230-234 counter: edge_count: "38"
234-238 counter: edge_count: "39"
238-242 counter: edge_count: "40"
242-246 counter: edge_count: "41"
246-250 counter: edge_count: "42"
250-254 counter: edge_count: "43"
254-258 counter: edge_count: "44"
258-262 counter: edge_count: "45"
214-262 counter: word_count: "5"
262-277 counter: edge_count: "46"
277-281 counter: edge_count: "47"
281-285 counter: edge_count: "48"
285-289 counter: edge_count: "49"
289-293 counter: edge_count: "50"
293-297 counter: edge_count: "51"
297-301 counter: edge_count: "52"
301-305 counter: edge_count: "53"
305-309 counter: edge_count: "54"
262-309 counter: word_count: "6"
309-324 counter: edge_count: "55"
324-328 counter: edge_count: "56"
328-332 counter: edge_count: "57"
332-336 counter: edge_count: "58"
336-340 counter: edge_count: "59"
340-344 counter: edge_count: "60"
344-348 counter: edge_count: "61"
348-352 counter: edge_count: "62"
352-356 counter: edge_count: "63"
309-356 counter: word_count: "7"
356-372 counter: edge_count: "64"
372-376 counter: edge_count: "65"
376-380 counter: edge_count: "66"
380-384 counter: edge_count: "67"
384-388 counter: edge_count: "68"
388-392 counter: edge_count: "69"
392-396 counter: edge_count: "70"
396-400 counter: edge_count: "71"
400-404 counter: edge_count: "72"
356-404 counter: word_count: "8"
404-419 counter: edge_count: "73"
419-423 counter: edge_count: "74"
423-427 counter: edge_count: "75"
427-431 counter: edge_count: "76"
431-435 counter: edge_count: "77"
435-439 counter: edge_count: "78"
439-443 counter: edge_count: "79"
443-447 counter: edge_count: "80"
447-451 counter: edge_count: "81"
404-451 counter: word_count: "9"
