38-38 counter: edge_count: "1"
40-40 counter: edge_count: "2"
42-42 counter: edge_count: "3"
44-44 counter: edge_count: "4"
46-46 counter: edge_count: "5"
48-48 counter: edge_count: "6"
50-50 counter: edge_count: "7"
52-52 counter: edge_count: "8"
54-54 counter: edge_count: "9"
56-56 counter: edge_count: "10"
58-58 counter: edge_count: "11"
60-60 counter: edge_count: "12"
62-62 counter: edge_count: "13"
64-64 counter: edge_count: "14"
66-66 counter: edge_count: "15"
68-68 counter: edge_count: "16"
70-70 counter: edge_count: "17"
72-72 counter: edge_count: "18"
86-86 counter: edge_count: "19"
88-88 counter: edge_count: "20"
90-90 counter: edge_count: "21"
92-92 counter: edge_count: "22"
94-94 counter: edge_count: "23"
96-96 counter: edge_count: "24"
98-98 counter: edge_count: "25"
100-100 counter: edge_count: "26"
102-102 counter: edge_count: "27"
104-104 counter: edge_count: "28"
106-106 counter: edge_count: "29"
108-108 counter: edge_count: "30"
110-110 counter: edge_count: "31"
112-112 counter: edge_count: "32"
114-114 counter: edge_count: "33"
116-116 counter: edge_count: "34"
118-118 counter: edge_count: "35"
120-120 counter: edge_count: "36"
133-133 counter: edge_count: "37"
135-135 counter: edge_count: "38"
137-137 counter: edge_count: "39"
139-139 counter: edge_count: "40"
141-141 counter: edge_count: "41"
143-143 counter: edge_count: "42"
145-145 counter: edge_count: "43"
147-147 counter: edge_count: "44"
149-149 counter: edge_count: "45"
151-151 counter: edge_count: "46"
153-153 counter: edge_count: "47"
155-155 counter: edge_count: "48"
157-157 counter: edge_count: "49"
159-159 counter: edge_count: "50"
161-161 counter: edge_count: "51"
163-163 counter: edge_count: "52"
165-165 counter: edge_count: "53"
167-167 counter: edge_count: "54"
180-180 counter: edge_count: "55"
182-182 counter: edge_count: "56"
184-184 counter: edge_count: "57"
186-186 counter: edge_count: "58"
188-188 counter: edge_count: "59"
190-190 counter: edge_count: "60"
192-192 counter: edge_count: "61"
194-194 counter: edge_count: "62"
196-196 counter: edge_count: "63"
198-198 counter: edge_count: "64"
200-200 counter: edge_count: "65"
202-202 counter: edge_count: "66"
204-204 counter: edge_count: "67"
206-206 counter: edge_count: "68"
208-208 counter: edge_count: "69"
210-210 counter: edge_count: "70"
212-212 counter: edge_count: "71"
214-214 counter: edge_count: "72"
228-228 counter: edge_count: "73"
230-230 counter: edge_count: "74"
232-232 counter: edge_count: "75"
234-234 counter: edge_count: "76"
236-236 counter: edge_count: "77"
238-238 counter: edge_count: "78"
240-240 counter: edge_count: "79"
242-242 counter: edge_count: "80"
244-244 counter: edge_count: "81"
246-246 counter: edge_count: "82"
248-248 counter: edge_count: "83"
250-250 counter: edge_count: "84"
252-252 counter: edge_count: "85"
254-254 counter: edge_count: "86"
256-256 counter: edge_count: "87"
258-258 counter: edge_count: "88"
260-260 counter: edge_count: "89"
262-262 counter: edge_count: "90"
275-275 counter: edge_count: "91"
277-277 counter: edge_count: "92"
279-279 counter: edge_count: "93"
281-281 counter: edge_count: "94"
283-283 counter: edge_count: "95"
285-285 counter: edge_count: "96"
287-287 counter: edge_count: "97"
289-289 counter: edge_count: "98"
291-291 counter: edge_count: "99"
293-293 counter: edge_count: "100"
295-295 counter: edge_count: "101"
297-297 counter: edge_count: "102"
299-299 counter: edge_count: "103"
301-301 counter: edge_count: "104"
303-303 counter: edge_count: "105"
305-305 counter: edge_count: "106"
307-307 counter: edge_count: "107"
309-309 counter: edge_count: "108"
322-322 counter: edge_count: "109"
324-324 counter: edge_count: "110"
326-326 counter: edge_count: "111"
328-328 counter: edge_count: "112"
330-330 counter: edge_count: "113"
332-332 counter: edge_count: "114"
334-334 counter: edge_count: "115"
336-336 counter: edge_count: "116"
338-338 counter: edge_count: "117"
340-340 counter: edge_count: "118"
342-342 counter: edge_count: "119"
344-344 counter: edge_count: "120"
346-346 counter: edge_count: "121"
348-348 counter: edge_count: "122"
350-350 counter: edge_count: "123"
352-352 counter: edge_count: "124"
354-354 counter: edge_count: "125"
356-356 counter: edge_count: "126"
370-370 counter: edge_count: "127"
372-372 counter: edge_count: "128"
374-374 counter: edge_count: "129"
376-376 counter: edge_count: "130"
378-378 counter: edge_count: "131"
380-380 counter: edge_count: "132"
382-382 counter: edge_count: "133"
384-384 counter: edge_count: "134"
386-386 counter: edge_count: "135"
388-388 counter: edge_count: "136"
390-390 counter: edge_count: "137"
392-392 counter: edge_count: "138"
394-394 counter: edge_count: "139"
396-396 counter: edge_count: "140"
398-398 counter: edge_count: "141"
400-400 counter: edge_count: "142"
402-402 counter: edge_count: "143"
404-404 counter: edge_count: "144"
417-417 counter: edge_count: "145"
419-419 counter: edge_count: "146"
421-421 counter: edge_count: "147"
423-423 counter: edge_count: "148"
425-425 counter: edge_count: "149"
427-427 counter: edge_count: "150"
429-429 counter: edge_count: "151"
431-431 counter: edge_count: "152"
433-433 counter: edge_count: "153"
435-435 counter: edge_count: "154"
437-437 counter: edge_count: "155"
439-439 counter: edge_count: "156"
441-441 counter: edge_count: "157"
443-443 counter: edge_count: "158"
445-445 counter: edge_count: "159"
447-447 counter: edge_count: "160"
449-449 counter: edge_count: "161"
451-451 counter: edge_count: "162"
