40-40 counter: edge_count: "1"
44-44 counter: edge_count: "2"
44-44 counter: word_count: "1"
48-48 counter: edge_count: "3"
52-52 counter: edge_count: "4"
52-52 counter: word_count: "2"
56-56 counter: edge_count: "5"
60-60 counter: edge_count: "6"
60-60 counter: word_count: "3"
64-64 counter: edge_count: "7"
68-68 counter: edge_count: "8"
68-68 counter: word_count: "4"
72-72 counter: edge_count: "9"
88-88 counter: edge_count: "10"
88-88 counter: word_count: "5"
92-92 counter: edge_count: "11"
96-96 counter: edge_count: "12"
96-96 counter: word_count: "6"
100-100 counter: edge_count: "13"
104-104 counter: edge_count: "14"
104-104 counter: word_count: "7"
108-108 counter: edge_count: "15"
112-112 counter: edge_count: "16"
112-112 counter: word_count: "8"
116-116 counter: edge_count: "17"
120-120 counter: edge_count: "18"
120-120 counter: word_count: "9"
135-135 counter: edge_count: "19"
139-139 counter: edge_count: "20"
139-139 counter: word_count: "10"
143-143 counter: edge_count: "21"
147-147 counter: edge_count: "22"
147-147 counter: word_count: "11"
151-151 counter: edge_count: "23"
155-155 counter: edge_count: "24"
155-155 counter: word_count: "12"
159-159 counter: edge_count: "25"
163-163 counter: edge_count: "26"
163-163 counter: word_count: "13"
167-167 counter: edge_count: "27"
182-182 counter: edge_count: "28"
182-182 counter: word_count: "14"
186-186 counter: edge_count: "29"
190-190 counter: edge_count: "30"
190-190 counter: word_count: "15"
194-194 counter: edge_count: "31"
198-198 counter: edge_count: "32"
198-198 counter: word_count: "16"
202-202 counter: edge_count: "33"
206-206 counter: edge_count: "34"
206-206 counter: word_count: "17"
210-210 counter: edge_count: "35"
214-214 counter: edge_count: "36"
214-214 counter: word_count: "18"
230-230 counter: edge_count: "37"
234-234 counter: edge_count: "38"
234-234 counter: word_count: "19"
238-238 counter: edge_count: "39"
242-242 counter: edge_count: "40"
242-242 counter: word_count: "20"
246-246 counter: edge_count: "41"
250-250 counter: edge_count: "42"
250-250 counter: word_count: "21"
254-254 counter: edge_count: "43"
258-258 counter: edge_count: "44"
258-258 counter: word_count: "22"
262-262 counter: edge_count: "45"
277-277 counter: edge_count: "46"
277-277 counter: word_count: "23"
281-281 counter: edge_count: "47"
285-285 counter: edge_count: "48"
285-285 counter: word_count: "24"
289-289 counter: edge_count: "49"
293-293 counter: edge_count: "50"
293-293 counter: word_count: "25"
297-297 counter: edge_count: "51"
301-301 counter: edge_count: "52"
301-301 counter: word_count: "26"
305-305 counter: edge_count: "53"
309-309 counter: edge_count: "54"
309-309 counter: word_count: "27"
324-324 counter: edge_count: "55"
328-328 counter: edge_count: "56"
328-328 counter: word_count: "28"
332-332 counter: edge_count: "57"
336-336 counter: edge_count: "58"
336-336 counter: word_count: "29"
340-340 counter: edge_count: "59"
344-344 counter: edge_count: "60"
344-344 counter: word_count: "30"
348-348 counter: edge_count: "61"
352-352 counter: edge_count: "62"
352-352 counter: word_count: "31"
356-356 counter: edge_count: "63"
372-372 counter: edge_count: "64"
372-372 counter: word_count: "32"
376-376 counter: edge_count: "65"
380-380 counter: edge_count: "66"
380-380 counter: word_count: "33"
384-384 counter: edge_count: "67"
388-388 counter: edge_count: "68"
388-388 counter: word_count: "34"
392-392 counter: edge_count: "69"
396-396 counter: edge_count: "70"
396-396 counter: word_count: "35"
400-400 counter: edge_count: "71"
404-404 counter: edge_count: "72"
404-404 counter: word_count: "36"
419-419 counter: edge_count: "73"
423-423 counter: edge_count: "74"
423-423 counter: word_count: "37"
427-427 counter: edge_count: "75"
431-431 counter: edge_count: "76"
431-431 counter: word_count: "38"
435-435 counter: edge_count: "77"
439-439 counter: edge_count: "78"
439-439 counter: word_count: "39"
443-443 counter: edge_count: "79"
447-447 counter: edge_count: "80"
447-447 counter: word_count: "40"
451-451 counter: edge_count: "81"
