129948-130023 mrf24j40: sread: "WAKECON: 0x80"
130096-130171 mrf24j40: swrite: "WAKECON: 0x80"
130244-130320 mrf24j40: swrite: "WAKECON: 0xc0"
146018-146092 mrf24j40: swrite: "WAKECON: 0x80"
178240-178368 mrf24j40: lwrite: "TX:0x0: 0x9"
178441-178569 mrf24j40: lwrite: "TX:0x1: 0x1f"
178642-178771 mrf24j40: lwrite: "TX:0x2: 0x61"
178842-178970 mrf24j40: lwrite: "TX:0x3: 0x88"
179046-179175 mrf24j40: lwrite: "TX:0x4: 0xc5"
179247-179321 mrf24j40: sread: "PANIDH: 0xca"
179393-179468 mrf24j40: sread: "PANIDL: 0xfe"
179547-179675 mrf24j40: lwrite: "TX:0x5: 0xfe"
179748-179877 mrf24j40: lwrite: "TX:0x6: 0xca"
179948-180077 mrf24j40: lwrite: "TX:0x7: 0x1"
180148-180276 mrf24j40: lwrite: "TX:0x8: 0x0"
180349-180423 mrf24j40: sread: "SADRH: 0x11"
180495-180570 mrf24j40: sread: "SADRL: 0x11"
180649-180777 mrf24j40: lwrite: "TX:0x9: 0x11"
180850-180978 mrf24j40: lwrite: "TX:0xa: 0x11"
181054-181183 mrf24j40: lwrite: "TX:0xb: 0x78"
181259-181388 mrf24j40: lwrite: "TX:0xc: 0x23"
181464-181593 mrf24j40: lwrite: "TX:0xd: 0x26"
181669-181798 mrf24j40: lwrite: "TX:0xe: 0x4"
181874-182003 mrf24j40: lwrite: "TX:0xf: 0x5b"
182079-182208 mrf24j40: lwrite: "TX:0x10: 0x0"
182284-182413 mrf24j40: lwrite: "TX:0x11: 0x0"
182489-182618 mrf24j40: lwrite: "TX:0x12: 0x27"
182694-182823 mrf24j40: lwrite: "TX:0x13: 0x64"
182899-183028 mrf24j40: lwrite: "TX:0x14: 0x96"
183104-183233 mrf24j40: lwrite: "TX:0x15: 0x0"
183309-183437 mrf24j40: lwrite: "TX:0x16: 0x0"
183514-183642 mrf24j40: lwrite: "TX:0x17: 0x28"
183719-183848 mrf24j40: lwrite: "TX:0x18: 0x1e"
183924-184052 mrf24j40: lwrite: "TX:0x19: 0x0"
184129-184257 mrf24j40: lwrite: "TX:0x1a: 0x0"
184334-184462 mrf24j40: lwrite: "TX:0x1b: 0x0"
184539-184667 mrf24j40: lwrite: "TX:0x1c: 0x0"
184744-184872 mrf24j40: lwrite: "TX:0x1d: 0x0"
184949-185077 mrf24j40: lwrite: "TX:0x1e: 0x0"
185154-185282 mrf24j40: lwrite: "TX:0x1f: 0x0"
185359-185487 mrf24j40: lwrite: "TX:0x20: 0x0"
178240-185487 mrf24j40: tx-frame: "TX frame: 09 1F 61 88 C5 FE CA 01 00 11 11 78 23 26 04 5B 00 00 27 64 96 00 00 28 1E 00 00 00 00 00 00 00 00"
185568-185643 mrf24j40: swrite: "TXNCON: 0x5"
223979-224054 mrf24j40: sread: "INTSTAT: 0x41"
224134-224209 mrf24j40: sread: "TXSTAT: 0x0"
261184-261259 mrf24j40: sread: "WAKECON: 0x80"
261331-261405 mrf24j40: swrite: "WAKECON: 0x80"
261475-261550 mrf24j40: sread: "SOFTRST: 0x0"
261623-261698 mrf24j40: swrite: "SOFTRST: 0x4"
261766-261842 mrf24j40: sread: "SLPACK: 0x0"
261916-261990 mrf24j40: swrite: "SLPACK: 0x80"
