7231072-7231767 amulet_ascii: warning: "Unknown command: 0x00"
7257174-7257869 amulet_ascii: warning: "Unknown command: 0xff"
7278577-7279272 amulet_ascii: warning: "Unknown command: 0x00"
7283967-7284662 amulet_ascii: warning: "Unknown command: 0xff"
7418743-7419438 amulet_ascii: warning: "Unknown command: 0xc0"
13357285-13357980 amulet_ascii: field: "Command: Set word variable (SWV)" "Command: Set word variable" "Cmd: Set word variable" "Cmd: SWV" "SWV"
13358237-13358932 amulet_ascii: bit: "Address high nibble: F" "Addr high 0xF" "Addr h 0xF"
13359188-13359883 amulet_ascii: bit: "Address low nibble: F" "Addr low 0xF" "Addr l 0xF"
13358237-13359883 amulet_ascii: field: "Address: 0xFF" "Addr: 0xFF" "0xFF"
13360139-13363689 amulet_ascii: field: "Value: 0x5a5a" "Val: 0x5a5a" "0x5a5a"
13357285-13363689 amulet_ascii: swv: "Command: Set word variable (SWV)" "Command: Set word variable" "Cmd: Set word variable" "Cmd: SWV" "SWV"
13363945-13364640 amulet_ascii: warning: "Unknown command: 0x00"
15356962-15357657 amulet_ascii: field: "Command: Set word variable (SWV)" "Command: Set word variable" "Cmd: Set word variable" "Cmd: SWV" "SWV"
15357913-15358608 amulet_ascii: bit: "Address high nibble: F" "Addr high 0xF" "Addr h 0xF"
15358865-15359560 amulet_ascii: bit: "Address low nibble: F" "Addr low 0xF" "Addr l 0xF"
15357913-15359560 amulet_ascii: field: "Address: 0xFF" "Addr: 0xFF" "0xFF"
15359816-15363366 amulet_ascii: field: "Value: 0x5a5a" "Val: 0x5a5a" "0x5a5a"
15356962-15363366 amulet_ascii: swv: "Command: Set word variable (SWV)" "Command: Set word variable" "Cmd: Set word variable" "Cmd: SWV" "SWV"
15363622-15364317 amulet_ascii: warning: "Unknown command: 0x00"
15557063-15557758 amulet_ascii: field: "Command: Set word variable (SWV)" "Command: Set word variable" "Cmd: Set word variable" "Cmd: SWV" "SWV"
15558014-15558709 amulet_ascii: bit: "Address high nibble: F" "Addr high 0xF" "Addr h 0xF"
15558966-15559661 amulet_ascii: bit: "Address low nibble: F" "Addr low 0xF" "Addr l 0xF"
15558014-15559661 amulet_ascii: field: "Address: 0xFF" "Addr: 0xFF" "0xFF"
15559917-15563466 amulet_ascii: field: "Value: 0x5a5a" "Val: 0x5a5a" "0x5a5a"
15557063-15563466 amulet_ascii: swv: "Command: Set word variable (SWV)" "Command: Set word variable" "Cmd: Set word variable" "Cmd: SWV" "SWV"
15563723-15564418 amulet_ascii: warning: "Unknown command: 0x00"
15755943-15756638 amulet_ascii: field: "Command: Set word variable (SWV)" "Command: Set word variable" "Cmd: Set word variable" "Cmd: SWV" "SWV"
15756894-15757589 amulet_ascii: bit: "Address high nibble: F" "Addr high 0xF" "Addr h 0xF"
15757846-15758541 amulet_ascii: bit: "Address low nibble: F" "Addr low 0xF" "Addr l 0xF"
15756894-15758541 amulet_ascii: field: "Address: 0xFF" "Addr: 0xFF" "0xFF"
15758797-15762346 amulet_ascii: field: "Value: 0x5a5a" "Val: 0x5a5a" "0x5a5a"
15755943-15762346 amulet_ascii: swv: "Command: Set word variable (SWV)" "Command: Set word variable" "Cmd: Set word variable" "Cmd: SWV" "SWV"
15762603-15763298 amulet_ascii: warning: "Unknown command: 0x00"
15957090-15957785 amulet_ascii: field: "Command: Set word variable (SWV)" "Command: Set word variable" "Cmd: Set word variable" "Cmd: SWV" "SWV"
15958042-15958737 amulet_ascii: bit: "Address high nibble: F" "Addr high 0xF" "Addr h 0xF"
15958993-15959688 amulet_ascii: bit: "Address low nibble: F" "Addr low 0xF" "Addr l 0xF"
15958042-15959688 amulet_ascii: field: "Address: 0xFF" "Addr: 0xFF" "0xFF"
15959944-15963494 amulet_ascii: field: "Value: 0x5a5a" "Val: 0x5a5a" "0x5a5a"
15957090-15963494 amulet_ascii: swv: "Command: Set word variable (SWV)" "Command: Set word variable" "Cmd: Set word variable" "Cmd: SWV" "SWV"
15963750-15964445 amulet_ascii: warning: "Unknown command: 0x00"
16157029-16157724 amulet_ascii: field: "Command: Set word variable (SWV)" "Command: Set word variable" "Cmd: Set word variable" "Cmd: SWV" "SWV"
16157981-16158676 amulet_ascii: bit: "Address high nibble: F" "Addr high 0xF" "Addr h 0xF"
16158932-16159627 amulet_ascii: bit: "Address low nibble: F" "Addr low 0xF" "Addr l 0xF"
16157981-16159627 amulet_ascii: field: "Address: 0xFF" "Addr: 0xFF" "0xFF"
16159883-16163433 amulet_ascii: field: "Value: 0x5a5a" "Val: 0x5a5a" "0x5a5a"
16157029-16163433 amulet_ascii: swv: "Command: Set word variable (SWV)" "Command: Set word variable" "Cmd: Set word variable" "Cmd: SWV" "SWV"
16163689-16164384 amulet_ascii: warning: "Unknown command: 0x00"
16357204-16357899 amulet_ascii: field: "Command: Set word variable (SWV)" "Command: Set word variable" "Cmd: Set word variable" "Cmd: SWV" "SWV"
16358156-16358851 amulet_ascii: bit: "Address high nibble: F" "Addr high 0xF" "Addr h 0xF"
16359107-16359802 amulet_ascii: bit: "Address low nibble: F" "Addr low 0xF" "Addr l 0xF"
16358156-16359802 amulet_ascii: field: "Address: 0xFF" "Addr: 0xFF" "0xFF"
16360059-16363608 amulet_ascii: field: "Value: 0x5a5a" "Val: 0x5a5a" "0x5a5a"
16357204-16363608 amulet_ascii: swv: "Command: Set word variable (SWV)" "Command: Set word variable" "Cmd: Set word variable" "Cmd: SWV" "SWV"
16363864-16364559 amulet_ascii: warning: "Unknown command: 0x00"
16557177-16557872 amulet_ascii: field: "Command: Set word variable (SWV)" "Command: Set word variable" "Cmd: Set word variable" "Cmd: SWV" "SWV"
16558128-16558823 amulet_ascii: bit: "Address high nibble: F" "Addr high 0xF" "Addr h 0xF"
16559080-16559775 amulet_ascii: bit: "Address low nibble: F" "Addr low 0xF" "Addr l 0xF"
16558128-16559775 amulet_ascii: field: "Address: 0xFF" "Addr: 0xFF" "0xFF"
16560031-16563580 amulet_ascii: field: "Value: 0x5a5a" "Val: 0x5a5a" "0x5a5a"
16557177-16563580 amulet_ascii: swv: "Command: Set word variable (SWV)" "Command: Set word variable" "Cmd: Set word variable" "Cmd: SWV" "SWV"
16563837-16564532 amulet_ascii: warning: "Unknown command: 0x00"
16757192-16757887 amulet_ascii: field: "Command: Set word variable (SWV)" "Command: Set word variable" "Cmd: Set word variable" "Cmd: SWV" "SWV"
16758144-16758839 amulet_ascii: bit: "Address high nibble: F" "Addr high 0xF" "Addr h 0xF"
16759095-16759790 amulet_ascii: bit: "Address low nibble: F" "Addr low 0xF" "Addr l 0xF"
16758144-16759790 amulet_ascii: field: "Address: 0xFF" "Addr: 0xFF" "0xFF"
16760046-16763596 amulet_ascii: field: "Value: 0x5a5a" "Val: 0x5a5a" "0x5a5a"
16757192-16763596 amulet_ascii: swv: "Command: Set word variable (SWV)" "Command: Set word variable" "Cmd: Set word variable" "Cmd: SWV" "SWV"
16763852-16764547 amulet_ascii: warning: "Unknown command: 0x00"
16956085-16956780 amulet_ascii: field: "Command: Set word variable (SWV)" "Command: Set word variable" "Cmd: Set word variable" "Cmd: SWV" "SWV"
16957036-16957731 amulet_ascii: bit: "Address high nibble: F" "Addr high 0xF" "Addr h 0xF"
16957988-16958683 amulet_ascii: bit: "Address low nibble: F" "Addr low 0xF" "Addr l 0xF"
16957036-16958683 amulet_ascii: field: "Address: 0xFF" "Addr: 0xFF" "0xFF"
16958939-16962488 amulet_ascii: field: "Value: 0x5a5a" "Val: 0x5a5a" "0x5a5a"
16956085-16962488 amulet_ascii: swv: "Command: Set word variable (SWV)" "Command: Set word variable" "Cmd: Set word variable" "Cmd: SWV" "SWV"
16962745-16963440 amulet_ascii: warning: "Unknown command: 0x00"
17157373-17158068 amulet_ascii: field: "Command: Set word variable (SWV)" "Command: Set word variable" "Cmd: Set word variable" "Cmd: SWV" "SWV"
17158325-17159020 amulet_ascii: bit: "Address high nibble: F" "Addr high 0xF" "Addr h 0xF"
17159276-17159971 amulet_ascii: bit: "Address low nibble: F" "Addr low 0xF" "Addr l 0xF"
17158325-17159971 amulet_ascii: field: "Address: 0xFF" "Addr: 0xFF" "0xFF"
17160227-17163777 amulet_ascii: field: "Value: 0x5a5a" "Val: 0x5a5a" "0x5a5a"
17157373-17163777 amulet_ascii: swv: "Command: Set word variable (SWV)" "Command: Set word variable" "Cmd: Set word variable" "Cmd: SWV" "SWV"
17164033-17164728 amulet_ascii: warning: "Unknown command: 0x00"
192207163-192207858 amulet_ascii: field: "Command: Set byte variable (SBV)" "Command: Set byte variable" "Cmd: Set byte variable" "Cmd: SBV" "SBV"
192208026-192208721 amulet_ascii: bit: "Address high nibble: 4" "Addr high 0x4" "Addr h 0x4"
192208888-192209583 amulet_ascii: bit: "Address low nibble: 0" "Addr low 0x0" "Addr l 0x0"
192208026-192209583 amulet_ascii: field: "Address: 0x40" "Addr: 0x40" "0x40"
192209751-192211309 amulet_ascii: field: "Value: 0x56" "Val: 0x56" "0x56"
192207163-192211309 amulet_ascii: sbv: "Command: Set byte variable (SBV)" "Command: Set byte variable" "Cmd: Set byte variable" "Cmd: SBV" "SBV"
194831551-194832246 amulet_ascii: field: "Command: Set byte variable (SBV)" "Command: Set byte variable" "Cmd: Set byte variable" "Cmd: SBV" "SBV"
194832414-194833109 amulet_ascii: bit: "Address high nibble: 4" "Addr high 0x4" "Addr h 0x4"
194833277-194833972 amulet_ascii: bit: "Address low nibble: 0" "Addr low 0x0" "Addr l 0x0"
194832414-194833972 amulet_ascii: field: "Address: 0x40" "Addr: 0x40" "0x40"
194834140-194835697 amulet_ascii: field: "Value: 0x56" "Val: 0x56" "0x56"
194831551-194835697 amulet_ascii: sbv: "Command: Set byte variable (SBV)" "Command: Set byte variable" "Cmd: Set byte variable" "Cmd: SBV" "SBV"
197457095-197457790 amulet_ascii: field: "Command: Set byte variable (SBV)" "Command: Set byte variable" "Cmd: Set byte variable" "Cmd: SBV" "SBV"
197457958-197458653 amulet_ascii: bit: "Address high nibble: 4" "Addr high 0x4" "Addr h 0x4"
197458821-197459516 amulet_ascii: bit: "Address low nibble: 0" "Addr low 0x0" "Addr l 0x0"
197457958-197459516 amulet_ascii: field: "Address: 0x40" "Addr: 0x40" "0x40"
197459684-197461242 amulet_ascii: field: "Value: 0x56" "Val: 0x56" "0x56"
197457095-197461242 amulet_ascii: sbv: "Command: Set byte variable (SBV)" "Command: Set byte variable" "Cmd: Set byte variable" "Cmd: SBV" "SBV"
199423218-199423913 amulet_ascii: field: "Command: Set word variable (SWV)" "Command: Set word variable" "Cmd: Set word variable" "Cmd: SWV" "SWV"
199424169-199424864 amulet_ascii: bit: "Address high nibble: F" "Addr high 0xF" "Addr h 0xF"
199425121-199425816 amulet_ascii: bit: "Address low nibble: F" "Addr low 0xF" "Addr l 0xF"
199424169-199425816 amulet_ascii: field: "Address: 0xFF" "Addr: 0xFF" "0xFF"
199426072-199429621 amulet_ascii: field: "Value: 0x5a5a" "Val: 0x5a5a" "0x5a5a"
199423218-199429621 amulet_ascii: swv: "Command: Set word variable (SWV)" "Command: Set word variable" "Cmd: Set word variable" "Cmd: SWV" "SWV"
199429878-199430573 amulet_ascii: warning: "Unknown command: 0x00"
200082547-200083242 amulet_ascii: field: "Command: Set byte variable (SBV)" "Command: Set byte variable" "Cmd: Set byte variable" "Cmd: SBV" "SBV"
200083410-200084105 amulet_ascii: bit: "Address high nibble: 4" "Addr high 0x4" "Addr h 0x4"
200084273-200084968 amulet_ascii: bit: "Address low nibble: 0" "Addr low 0x0" "Addr l 0x0"
200083410-200084968 amulet_ascii: field: "Address: 0x40" "Addr: 0x40" "0x40"
200085136-200086693 amulet_ascii: field: "Value: 0x56" "Val: 0x56" "0x56"
200082547-200086693 amulet_ascii: sbv: "Command: Set byte variable (SBV)" "Command: Set byte variable" "Cmd: Set byte variable" "Cmd: SBV" "SBV"
200125036-200125731 amulet_ascii: field: "Command: Acknowledgment (ACK)" "Command: Acknowledgment" "Cmd: Acknowledgment" "Cmd: ACK" "ACK"
200125036-200125731 amulet_ascii: ack: "Command: Acknowledgment (ACK)" "Command: Acknowledgment" "Cmd: Acknowledgment" "Cmd: ACK" "ACK"
200217986-200218681 amulet_ascii: field: "Command: Set byte variable (SBV)" "Command: Set byte variable" "Cmd: Set byte variable" "Cmd: SBV" "SBV"
200218849-200219544 amulet_ascii: bit: "Address high nibble: 4" "Addr high 0x4" "Addr h 0x4"
200219711-200220406 amulet_ascii: bit: "Address low nibble: 1" "Addr low 0x1" "Addr l 0x1"
200218849-200220406 amulet_ascii: field: "Address: 0x41" "Addr: 0x41" "0x41"
200220574-200222132 amulet_ascii: field: "Value: 0x5E" "Val: 0x5E" "0x5E"
200217986-200222132 amulet_ascii: sbv: "Command: Set byte variable (SBV)" "Command: Set byte variable" "Cmd: Set byte variable" "Cmd: SBV" "SBV"
200225072-200225767 amulet_ascii: field: "Command: Acknowledgment (ACK)" "Command: Acknowledgment" "Cmd: Acknowledgment" "Cmd: ACK" "ACK"
200225072-200225767 amulet_ascii: ack: "Command: Acknowledgment (ACK)" "Command: Acknowledgment" "Cmd: Acknowledgment" "Cmd: ACK" "ACK"
210845546-210846241 amulet_ascii: field: "Command: Set word variable (SWV)" "Command: Set word variable" "Cmd: Set word variable" "Cmd: SWV" "SWV"
210846409-210847104 amulet_ascii: bit: "Address high nibble: F" "Addr high 0xF" "Addr h 0xF"
210847272-210847967 amulet_ascii: bit: "Address low nibble: F" "Addr low 0xF" "Addr l 0xF"
210846409-210847967 amulet_ascii: field: "Address: 0xFF" "Addr: 0xFF" "0xFF"
210848135-210851418 amulet_ascii: field: "Value: 0x0050" "Val: 0x0050" "0x0050"
210845546-210851418 amulet_ascii: swv: "Command: Set word variable (SWV)" "Command: Set word variable" "Cmd: Set word variable" "Cmd: SWV" "SWV"
210852926-210853621 amulet_ascii: field: "Command: Acknowledgment (ACK)" "Command: Acknowledgment" "Cmd: Acknowledgment" "Cmd: ACK" "ACK"
210852926-210853621 amulet_ascii: ack: "Command: Acknowledgment (ACK)" "Command: Acknowledgment" "Cmd: Acknowledgment" "Cmd: ACK" "ACK"
213127621-213128316 amulet_ascii: field: "Command: Set word variable (SWV)" "Command: Set word variable" "Cmd: Set word variable" "Cmd: SWV" "SWV"
213189791-213190486 amulet_ascii: bit: "Address high nibble: F" "Addr high 0xF" "Addr h 0xF"
213190742-213191437 amulet_ascii: bit: "Address low nibble: F" "Addr low 0xF" "Addr l 0xF"
213189791-213191437 amulet_ascii: field: "Address: 0xFF" "Addr: 0xFF" "0xFF"
213191694-213255851 amulet_ascii: field: "Value: 0x5a5a" "Val: 0x5a5a" "0x5a5a"
213127621-213255851 amulet_ascii: swv: "Command: Set word variable (SWV)" "Command: Set word variable" "Cmd: Set word variable" "Cmd: SWV" "SWV"
213256107-213256802 amulet_ascii: warning: "Unknown command: 0x00"
213257200-213257895 amulet_ascii: field: "Command: Acknowledgment (ACK)" "Command: Acknowledgment" "Cmd: Acknowledgment" "Cmd: ACK" "ACK"
213257200-213257895 amulet_ascii: ack: "Command: Acknowledgment (ACK)" "Command: Acknowledgment" "Cmd: Acknowledgment" "Cmd: ACK" "ACK"
213273505-213274200 amulet_ascii: field: "Command: Set byte variable (SBV)" "Command: Set byte variable" "Cmd: Set byte variable" "Cmd: SBV" "SBV"
213274368-213275063 amulet_ascii: bit: "Address high nibble: A" "Addr high 0xA" "Addr h 0xA"
213275231-213275926 amulet_ascii: bit: "Address low nibble: 0" "Addr low 0x0" "Addr l 0x0"
213274368-213275926 amulet_ascii: field: "Address: 0xA0" "Addr: 0xA0" "0xA0"
213276094-213277651 amulet_ascii: field: "Value: 0x00" "Val: 0x00" "0x00"
213273505-213277651 amulet_ascii: sbv: "Command: Set byte variable (SBV)" "Command: Set byte variable" "Cmd: Set byte variable" "Cmd: SBV" "SBV"
213279197-213279892 amulet_ascii: field: "Command: Acknowledgment (ACK)" "Command: Acknowledgment" "Cmd: Acknowledgment" "Cmd: ACK" "ACK"
213279197-213279892 amulet_ascii: ack: "Command: Acknowledgment (ACK)" "Command: Acknowledgment" "Cmd: Acknowledgment" "Cmd: ACK" "ACK"
213398444-213399139 amulet_ascii: field: "Command: Set byte variable (SBV)" "Command: Set byte variable" "Cmd: Set byte variable" "Cmd: SBV" "SBV"
213399307-213400002 amulet_ascii: bit: "Address high nibble: A" "Addr high 0xA" "Addr h 0xA"
213400170-213400865 amulet_ascii: bit: "Address low nibble: 1" "Addr low 0x1" "Addr l 0x1"
213399307-213400865 amulet_ascii: field: "Address: 0xA1" "Addr: 0xA1" "0xA1"
213401033-213402590 amulet_ascii: field: "Value: 0x00" "Val: 0x00" "0x00"
213398444-213402590 amulet_ascii: sbv: "Command: Set byte variable (SBV)" "Command: Set byte variable" "Cmd: Set byte variable" "Cmd: SBV" "SBV"
213456652-213457347 amulet_ascii: field: "Command: Acknowledgment (ACK)" "Command: Acknowledgment" "Cmd: Acknowledgment" "Cmd: ACK" "ACK"
213456652-213457347 amulet_ascii: ack: "Command: Acknowledgment (ACK)" "Command: Acknowledgment" "Cmd: Acknowledgment" "Cmd: ACK" "ACK"
213523258-213523953 amulet_ascii: field: "Command: Set byte variable (SBV)" "Command: Set byte variable" "Cmd: Set byte variable" "Cmd: SBV" "SBV"
213524121-213524816 amulet_ascii: bit: "Address high nibble: A" "Addr high 0xA" "Addr h 0xA"
213524984-213525679 amulet_ascii: bit: "Address low nibble: 2" "Addr low 0x2" "Addr l 0x2"
213524121-213525679 amulet_ascii: field: "Address: 0xA2" "Addr: 0xA2" "0xA2"
213525847-213527404 amulet_ascii: field: "Value: 0x00" "Val: 0x00" "0x00"
213523258-213527404 amulet_ascii: sbv: "Command: Set byte variable (SBV)" "Command: Set byte variable" "Cmd: Set byte variable" "Cmd: SBV" "SBV"
213556490-213557185 amulet_ascii: field: "Command: Acknowledgment (ACK)" "Command: Acknowledgment" "Cmd: Acknowledgment" "Cmd: ACK" "ACK"
213556490-213557185 amulet_ascii: ack: "Command: Acknowledgment (ACK)" "Command: Acknowledgment" "Cmd: Acknowledgment" "Cmd: ACK" "ACK"
213658208-213658903 amulet_ascii: field: "Command: Set byte variable (SBV)" "Command: Set byte variable" "Cmd: Set byte variable" "Cmd: SBV" "SBV"
213659071-213659766 amulet_ascii: bit: "Address high nibble: A" "Addr high 0xA" "Addr h 0xA"
213659934-213660629 amulet_ascii: bit: "Address low nibble: 3" "Addr low 0x3" "Addr l 0x3"
213659071-213660629 amulet_ascii: field: "Address: 0xA3" "Addr: 0xA3" "0xA3"
213660797-213662355 amulet_ascii: field: "Value: 0x00" "Val: 0x00" "0x00"
213658208-213662355 amulet_ascii: sbv: "Command: Set byte variable (SBV)" "Command: Set byte variable" "Cmd: Set byte variable" "Cmd: SBV" "SBV"
213663855-213664550 amulet_ascii: field: "Command: Acknowledgment (ACK)" "Command: Acknowledgment" "Cmd: Acknowledgment" "Cmd: ACK" "ACK"
213663855-213664550 amulet_ascii: ack: "Command: Acknowledgment (ACK)" "Command: Acknowledgment" "Cmd: Acknowledgment" "Cmd: ACK" "ACK"
213773386-213774081 amulet_ascii: field: "Command: Set byte variable (SBV)" "Command: Set byte variable" "Cmd: Set byte variable" "Cmd: SBV" "SBV"
213774248-213774943 amulet_ascii: bit: "Address high nibble: A" "Addr high 0xA" "Addr h 0xA"
213775111-213775806 amulet_ascii: bit: "Address low nibble: 4" "Addr low 0x4" "Addr l 0x4"
213774248-213775806 amulet_ascii: field: "Address: 0xA4" "Addr: 0xA4" "0xA4"
213775974-213777532 amulet_ascii: field: "Value: 0x00" "Val: 0x00" "0x00"
213773386-213777532 amulet_ascii: sbv: "Command: Set byte variable (SBV)" "Command: Set byte variable" "Cmd: Set byte variable" "Cmd: SBV" "SBV"
213779080-213779775 amulet_ascii: field: "Command: Acknowledgment (ACK)" "Command: Acknowledgment" "Cmd: Acknowledgment" "Cmd: ACK" "ACK"
213779080-213779775 amulet_ascii: ack: "Command: Acknowledgment (ACK)" "Command: Acknowledgment" "Cmd: Acknowledgment" "Cmd: ACK" "ACK"
213898417-213899112 amulet_ascii: field: "Command: Set byte variable (SBV)" "Command: Set byte variable" "Cmd: Set byte variable" "Cmd: SBV" "SBV"
213899279-213899974 amulet_ascii: bit: "Address high nibble: A" "Addr high 0xA" "Addr h 0xA"
213900142-213900837 amulet_ascii: bit: "Address low nibble: 5" "Addr low 0x5" "Addr l 0x5"
213899279-213900837 amulet_ascii: field: "Address: 0xA5" "Addr: 0xA5" "0xA5"
213901005-213902563 amulet_ascii: field: "Value: 0x00" "Val: 0x00" "0x00"
213898417-213902563 amulet_ascii: sbv: "Command: Set byte variable (SBV)" "Command: Set byte variable" "Cmd: Set byte variable" "Cmd: SBV" "SBV"
213956534-213957229 amulet_ascii: field: "Command: Acknowledgment (ACK)" "Command: Acknowledgment" "Cmd: Acknowledgment" "Cmd: ACK" "ACK"
213956534-213957229 amulet_ascii: ack: "Command: Acknowledgment (ACK)" "Command: Acknowledgment" "Cmd: Acknowledgment" "Cmd: ACK" "ACK"
214023502-214024197 amulet_ascii: field: "Command: Set byte variable (SBV)" "Command: Set byte variable" "Cmd: Set byte variable" "Cmd: SBV" "SBV"
214024365-214025060 amulet_ascii: bit: "Address high nibble: A" "Addr high 0xA" "Addr h 0xA"
214025227-214025922 amulet_ascii: bit: "Address low nibble: 6" "Addr low 0x6" "Addr l 0x6"
214024365-214025922 amulet_ascii: field: "Address: 0xA6" "Addr: 0xA6" "0xA6"
214026090-214027648 amulet_ascii: field: "Value: 0x00" "Val: 0x00" "0x00"
214023502-214027648 amulet_ascii: sbv: "Command: Set byte variable (SBV)" "Command: Set byte variable" "Cmd: Set byte variable" "Cmd: SBV" "SBV"
214056679-214057374 amulet_ascii: field: "Command: Acknowledgment (ACK)" "Command: Acknowledgment" "Cmd: Acknowledgment" "Cmd: ACK" "ACK"
214056679-214057374 amulet_ascii: ack: "Command: Acknowledgment (ACK)" "Command: Acknowledgment" "Cmd: Acknowledgment" "Cmd: ACK" "ACK"
214148441-214149136 amulet_ascii: field: "Command: Set byte variable (SBV)" "Command: Set byte variable" "Cmd: Set byte variable" "Cmd: SBV" "SBV"
214149304-214149999 amulet_ascii: bit: "Address high nibble: A" "Addr high 0xA" "Addr h 0xA"
214150166-214150861 amulet_ascii: bit: "Address low nibble: 7" "Addr low 0x7" "Addr l 0x7"
214149304-214150861 amulet_ascii: field: "Address: 0xA7" "Addr: 0xA7" "0xA7"
214151029-214152587 amulet_ascii: field: "Value: 0x00" "Val: 0x00" "0x00"
214148441-214152587 amulet_ascii: sbv: "Command: Set byte variable (SBV)" "Command: Set byte variable" "Cmd: Set byte variable" "Cmd: SBV" "SBV"
214156746-214157441 amulet_ascii: field: "Command: Acknowledgment (ACK)" "Command: Acknowledgment" "Cmd: Acknowledgment" "Cmd: ACK" "ACK"
214156746-214157441 amulet_ascii: ack: "Command: Acknowledgment (ACK)" "Command: Acknowledgment" "Cmd: Acknowledgment" "Cmd: ACK" "ACK"
214283440-214284135 amulet_ascii: field: "Command: Set string variable (SSV)" "Command: Set string variable" "Cmd: Set string variable" "Cmd: SSV" "SSV"
214284303-214284998 amulet_ascii: bit: "Address high nibble: C" "Addr high 0xC" "Addr h 0xC"
214285165-214285860 amulet_ascii: bit: "Address low nibble: 5" "Addr low 0x5" "Addr l 0x5"
214284303-214285860 amulet_ascii: field: "Address: 0xC5" "Addr: 0xC5" "0xC5"
214286028-214286723 amulet_ascii: bit: "E"
214286891-214287586 amulet_ascii: bit: "N"
214287754-214288449 amulet_ascii: bit: "C"
214288616-214289311 amulet_ascii: bit: "O"
214289479-214290174 amulet_ascii: bit: "R"
214290342-214291037 amulet_ascii: bit: "E"
214291205-214291900 amulet_ascii: bit: " "
214292068-214292763 amulet_ascii: bit: "S"
214292930-214293625 amulet_ascii: bit: "Y"
214293793-214294488 amulet_ascii: bit: "S"
214294656-214295351 amulet_ascii: bit: "T"
214295519-214296214 amulet_ascii: bit: "E"
214296381-214297076 amulet_ascii: bit: "M"
214297244-214297939 amulet_ascii: bit: " "
214298107-214298802 amulet_ascii: bit: "S"
214298970-214299665 amulet_ascii: bit: "T"
214299832-214300527 amulet_ascii: bit: "A"
214300695-214301390 amulet_ascii: bit: "T"
214301558-214302253 amulet_ascii: bit: "U"
214302421-214303116 amulet_ascii: bit: "S"
214303284-214303979 amulet_ascii: bit: "NULL"
214286028-214303979 amulet_ascii: field: "Value: ENCORE SYSTEM STATUS" "Val: ENCORE SYSTEM STATUS" "ENCORE SYSTEM STATUS"
214283440-214303979 amulet_ascii: ssv: "Command: Set string variable (SSV)" "Command: Set string variable" "Cmd: Set string variable" "Cmd: SSV" "SSV"
214362791-214363486 amulet_ascii: field: "Command: Acknowledgment (ACK)" "Command: Acknowledgment" "Cmd: Acknowledgment" "Cmd: ACK" "ACK"
214362791-214363486 amulet_ascii: ack: "Command: Acknowledgment (ACK)" "Command: Acknowledgment" "Cmd: Acknowledgment" "Cmd: ACK" "ACK"
214461192-214461887 amulet_ascii: field: "Command: Set string variable (SSV)" "Command: Set string variable" "Cmd: Set string variable" "Cmd: SSV" "SSV"
214462055-214462750 amulet_ascii: bit: "Address high nibble: C" "Addr high 0xC" "Addr h 0xC"
214462918-214463613 amulet_ascii: bit: "Address low nibble: 5" "Addr low 0x5" "Addr l 0x5"
214462055-214463613 amulet_ascii: field: "Address: 0xC5" "Addr: 0xC5" "0xC5"
214463780-214464475 amulet_ascii: bit: "E"
214464643-214465338 amulet_ascii: bit: "N"
214465506-214466201 amulet_ascii: bit: "C"
214466369-214467064 amulet_ascii: bit: "O"
214467231-214467926 amulet_ascii: bit: "R"
214468094-214468789 amulet_ascii: bit: "E"
214468957-214469652 amulet_ascii: bit: " "
214469820-214470515 amulet_ascii: bit: "S"
214470683-214471378 amulet_ascii: bit: "Y"
214471545-214472240 amulet_ascii: bit: "S"
214472408-214473103 amulet_ascii: bit: "T"
214473271-214473966 amulet_ascii: bit: "E"
214474134-214474829 amulet_ascii: bit: "M"
214474996-214475691 amulet_ascii: bit: " "
214475859-214476554 amulet_ascii: bit: "S"
214476722-214477417 amulet_ascii: bit: "T"
214477585-214478280 amulet_ascii: bit: "A"
214478448-214479143 amulet_ascii: bit: "T"
214479310-214480005 amulet_ascii: bit: "U"
214480173-214480868 amulet_ascii: bit: "S"
214481036-214481731 amulet_ascii: bit: " "
214481899-214482594 amulet_ascii: bit: " "
214482761-214483456 amulet_ascii: bit: " "
214483624-214484319 amulet_ascii: bit: " "
214484487-214485182 amulet_ascii: bit: " "
214485350-214486045 amulet_ascii: bit: " "
214486212-214486907 amulet_ascii: bit: "V"
214487075-214487770 amulet_ascii: bit: "e"
214487938-214488633 amulet_ascii: bit: "r"
214488801-214489496 amulet_ascii: bit: " "
214489664-214490359 amulet_ascii: bit: "2"
214490526-214491221 amulet_ascii: bit: "."
214491389-214492084 amulet_ascii: bit: "3"
214492252-214492947 amulet_ascii: bit: "3"
214493115-214493810 amulet_ascii: bit: "."
214493977-214494672 amulet_ascii: bit: "0"
214494840-214495535 amulet_ascii: bit: "1"
214495703-214496398 amulet_ascii: bit: "NULL"
214463780-214496398 amulet_ascii: field: "Value: ENCORE SYSTEM STATUS      Ver 2.33.01" "Val: ENCORE SYSTEM STATUS      Ver 2.33.01" "ENCORE SYSTEM STATUS      Ver 2.33.01"
214461192-214496398 amulet_ascii: ssv: "Command: Set string variable (SSV)" "Command: Set string variable" "Cmd: Set string variable" "Cmd: SSV" "SSV"
214682854-214683549 amulet_ascii: field: "Command: Acknowledgment (ACK)" "Command: Acknowledgment" "Cmd: Acknowledgment" "Cmd: ACK" "ACK"
214682854-214683549 amulet_ascii: ack: "Command: Acknowledgment (ACK)" "Command: Acknowledgment" "Cmd: Acknowledgment" "Cmd: ACK" "ACK"
214773661-214774356 amulet_ascii: field: "Command: Set string variable (SSV)" "Command: Set string variable" "Cmd: Set string variable" "Cmd: SSV" "SSV"
214774524-214775219 amulet_ascii: bit: "Address high nibble: B" "Addr high 0xB" "Addr h 0xB"
214775387-214776082 amulet_ascii: bit: "Address low nibble: 0" "Addr low 0x0" "Addr l 0x0"
214774524-214776082 amulet_ascii: field: "Address: 0xB0" "Addr: 0xB0" "0xB0"
214776250-214776945 amulet_ascii: bit: " "
214777112-214777807 amulet_ascii: bit: " "
214777975-214778670 amulet_ascii: bit: " "
214778838-214779533 amulet_ascii: bit: " "
214779701-214780396 amulet_ascii: bit: " "
214780563-214781258 amulet_ascii: bit: " "
214781426-214782121 amulet_ascii: bit: " "
214782289-214782984 amulet_ascii: bit: " "
214783152-214783847 amulet_ascii: bit: " "
214784015-214784710 amulet_ascii: bit: " "
214784877-214785572 amulet_ascii: bit: " "
214785740-214786435 amulet_ascii: bit: " "
214786603-214787298 amulet_ascii: bit: " "
214787466-214788161 amulet_ascii: bit: " "
214788328-214789023 amulet_ascii: bit: " "
214789191-214789886 amulet_ascii: bit: " "
214790054-214790749 amulet_ascii: bit: " "
214790917-214791612 amulet_ascii: bit: " "
214791779-214792474 amulet_ascii: bit: " "
214792642-214793337 amulet_ascii: bit: "NULL"
214776250-214793337 amulet_ascii: field: "Value:                    " "Val:                    " "                   "
214773661-214793337 amulet_ascii: ssv: "Command: Set string variable (SSV)" "Command: Set string variable" "Cmd: Set string variable" "Cmd: SSV" "SSV"
215005310-215006005 amulet_ascii: field: "Command: Acknowledgment (ACK)" "Command: Acknowledgment" "Cmd: Acknowledgment" "Cmd: ACK" "ACK"
215005310-215006005 amulet_ascii: ack: "Command: Acknowledgment (ACK)" "Command: Acknowledgment" "Cmd: Acknowledgment" "Cmd: ACK" "ACK"
215086158-215086853 amulet_ascii: field: "Command: Set string variable (SSV)" "Command: Set string variable" "Cmd: Set string variable" "Cmd: SSV" "SSV"
215087020-215087715 amulet_ascii: bit: "Address high nibble: B" "Addr high 0xB" "Addr h 0xB"
215087883-215088578 amulet_ascii: bit: "Address low nibble: 0" "Addr low 0x0" "Addr l 0x0"
215087020-215088578 amulet_ascii: field: "Address: 0xB0" "Addr: 0xB0" "0xB0"
215088746-215089441 amulet_ascii: bit: "E"
215089609-215090304 amulet_ascii: bit: "N"
215090471-215091166 amulet_ascii: bit: "C"
215091334-215092029 amulet_ascii: bit: "O"
215092197-215092892 amulet_ascii: bit: "R"
215093060-215093755 amulet_ascii: bit: "E"
215093923-215094618 amulet_ascii: bit: " "
215094785-215095480 amulet_ascii: bit: "V"
215095648-215096343 amulet_ascii: bit: "P"
215096511-215097206 amulet_ascii: bit: "/"
215097374-215098069 amulet_ascii: bit: "3"
215098236-215098931 amulet_ascii: bit: "G"
215099099-215099794 amulet_ascii: bit: ":"
215099962-215100657 amulet_ascii: bit: " "
215100825-215101520 amulet_ascii: bit: "0"
215101687-215102382 amulet_ascii: bit: " "
215102550-215103245 amulet_ascii: bit: "NULL"
215088746-215103245 amulet_ascii: field: "Value: ENCORE VP/3G: 0 " "Val: ENCORE VP/3G: 0 " "ENCORE VP/3G: 0 "
215086158-215103245 amulet_ascii: ssv: "Command: Set string variable (SSV)" "Command: Set string variable" "Cmd: Set string variable" "Cmd: SSV" "SSV"
215334366-215335061 amulet_ascii: field: "Command: Acknowledgment (ACK)" "Command: Acknowledgment" "Cmd: Acknowledgment" "Cmd: ACK" "ACK"
215334366-215335061 amulet_ascii: ack: "Command: Acknowledgment (ACK)" "Command: Acknowledgment" "Cmd: Acknowledgment" "Cmd: ACK" "ACK"
215398746-215399441 amulet_ascii: field: "Command: Set string variable (SSV)" "Command: Set string variable" "Cmd: Set string variable" "Cmd: SSV" "SSV"
215399609-215400304 amulet_ascii: bit: "Address high nibble: B" "Addr high 0xB" "Addr h 0xB"
215400472-215401167 amulet_ascii: bit: "Address low nibble: 2" "Addr low 0x2" "Addr l 0x2"
215399609-215401167 amulet_ascii: field: "Address: 0xB2" "Addr: 0xB2" "0xB2"
215401334-215402029 amulet_ascii: bit: "E"
215402197-215402892 amulet_ascii: bit: "N"
215403060-215403755 amulet_ascii: bit: "C"
215403923-215404618 amulet_ascii: bit: "O"
215404786-215405481 amulet_ascii: bit: "R"
215405648-215406343 amulet_ascii: bit: "E"
215406511-215407206 amulet_ascii: bit: " "
215407374-215408069 amulet_ascii: bit: "V"
215408237-215408932 amulet_ascii: bit: "P"
215409099-215409794 amulet_ascii: bit: "X"
215409962-215410657 amulet_ascii: bit: "/"
215410825-215411520 amulet_ascii: bit: "3"
215411688-215412383 amulet_ascii: bit: "G"
215412550-215413245 amulet_ascii: bit: ":"
215413413-215414108 amulet_ascii: bit: " "
215414276-215414971 amulet_ascii: bit: "0"
215415139-215415834 amulet_ascii: bit: " "
215416002-215416697 amulet_ascii: bit: "NULL"
215401334-215416697 amulet_ascii: field: "Value: ENCORE VPX/3G: 0 " "Val: ENCORE VPX/3G: 0 " "ENCORE VPX/3G: 0 "
215398746-215416697 amulet_ascii: ssv: "Command: Set string variable (SSV)" "Command: Set string variable" "Cmd: Set string variable" "Cmd: SSV" "SSV"
215829291-215829986 amulet_ascii: field: "Command: Acknowledgment (ACK)" "Command: Acknowledgment" "Cmd: Acknowledgment" "Cmd: ACK" "ACK"
215829291-215829986 amulet_ascii: ack: "Command: Acknowledgment (ACK)" "Command: Acknowledgment" "Cmd: Acknowledgment" "Cmd: ACK" "ACK"
215898919-215899614 amulet_ascii: field: "Command: Set string variable (SSV)" "Command: Set string variable" "Cmd: Set string variable" "Cmd: SSV" "SSV"
215899782-215900477 amulet_ascii: bit: "Address high nibble: B" "Addr high 0xB" "Addr h 0xB"
215900645-215901340 amulet_ascii: bit: "Address low nibble: 4" "Addr low 0x4" "Addr l 0x4"
215899782-215901340 amulet_ascii: field: "Address: 0xB4" "Addr: 0xB4" "0xB4"
215901508-215902203 amulet_ascii: bit: "S"
215902370-215903065 amulet_ascii: bit: "C"
215903233-215903928 amulet_ascii: bit: "R"
215904096-215904791 amulet_ascii: bit: "E"
215904959-215905654 amulet_ascii: bit: "E"
215905821-215906516 amulet_ascii: bit: "N"
215906684-215907379 amulet_ascii: bit: "P"
215907547-215908242 amulet_ascii: bit: "R"
215908410-215909105 amulet_ascii: bit: "O"
215909273-215909968 amulet_ascii: bit: " "
215910135-215910830 amulet_ascii: bit: "I"
215910998-215911693 amulet_ascii: bit: "I"
215911861-215912556 amulet_ascii: bit: "/"
215912724-215913419 amulet_ascii: bit: "3"
215913586-215914281 amulet_ascii: bit: "G"
215914449-215915144 amulet_ascii: bit: ":"
215915312-215916007 amulet_ascii: bit: " "
215916175-215916870 amulet_ascii: bit: "0"
215917037-215917732 amulet_ascii: bit: " "
215917900-215918595 amulet_ascii: bit: "NULL"
215901508-215918595 amulet_ascii: field: "Value: SCREENPRO II/3G: 0 " "Val: SCREENPRO II/3G: 0 " "SCREENPRO II/3G: 0 "
215898919-215918595 amulet_ascii: ssv: "Command: Set string variable (SSV)" "Command: Set string variable" "Cmd: Set string variable" "Cmd: SSV" "SSV"
216365096-216365791 amulet_ascii: field: "Command: Acknowledgment (ACK)" "Command: Acknowledgment" "Cmd: Acknowledgment" "Cmd: ACK" "ACK"
216365096-216365791 amulet_ascii: ack: "Command: Acknowledgment (ACK)" "Command: Acknowledgment" "Cmd: Acknowledgment" "Cmd: ACK" "ACK"
216471055-216471750 amulet_ascii: field: "Command: Set string variable (SSV)" "Command: Set string variable" "Cmd: Set string variable" "Cmd: SSV" "SSV"
216471918-216472613 amulet_ascii: bit: "Address high nibble: B" "Addr high 0xB" "Addr h 0xB"
216472781-216473476 amulet_ascii: bit: "Address low nibble: 6" "Addr low 0x6" "Addr l 0x6"
216471918-216473476 amulet_ascii: field: "Address: 0xB6" "Addr: 0xB6" "0xB6"
216473643-216474338 amulet_ascii: bit: "P"
216474506-216475201 amulet_ascii: bit: "R"
216475369-216476064 amulet_ascii: bit: "E"
216476232-216476927 amulet_ascii: bit: "P"
216477094-216477789 amulet_ascii: bit: "R"
216477957-216478652 amulet_ascii: bit: "O"
216478820-216479515 amulet_ascii: bit: " "
216479683-216480378 amulet_ascii: bit: "I"
216480546-216481241 amulet_ascii: bit: "I"
216481408-216482103 amulet_ascii: bit: ":"
216482271-216482966 amulet_ascii: bit: " "
216483134-216483829 amulet_ascii: bit: "0"
216483997-216484692 amulet_ascii: bit: " "
216484859-216485554 amulet_ascii: bit: "NULL"
216473643-216485554 amulet_ascii: field: "Value: PREPRO II: 0 " "Val: PREPRO II: 0 " "PREPRO II: 0 "
216471055-216485554 amulet_ascii: ssv: "Command: Set string variable (SSV)" "Command: Set string variable" "Cmd: Set string variable" "Cmd: SSV" "SSV"
216980386-216981081 amulet_ascii: field: "Command: Acknowledgment (ACK)" "Command: Acknowledgment" "Cmd: Acknowledgment" "Cmd: ACK" "ACK"
216980386-216981081 amulet_ascii: ack: "Command: Acknowledgment (ACK)" "Command: Acknowledgment" "Cmd: Acknowledgment" "Cmd: ACK" "ACK"
217096818-217097513 amulet_ascii: field: "Command: Set string variable (SSV)" "Command: Set string variable" "Cmd: Set string variable" "Cmd: SSV" "SSV"
217097681-217098376 amulet_ascii: bit: "Address high nibble: B" "Addr high 0xB" "Addr h 0xB"
217098544-217099239 amulet_ascii: bit: "Address low nibble: 8" "Addr low 0x8" "Addr l 0x8"
217097681-217099239 amulet_ascii: field: "Address: 0xB8" "Addr: 0xB8" "0xB8"
217099407-217100102 amulet_ascii: bit: "I"
217100269-217100964 amulet_ascii: bit: "M"
217101132-217101827 amulet_ascii: bit: "A"
217101995-217102690 amulet_ascii: bit: "G"
217102858-217103553 amulet_ascii: bit: "E"
217103720-217104415 amulet_ascii: bit: "P"
217104583-217105278 amulet_ascii: bit: "R"
217105446-217106141 amulet_ascii: bit: "O"
217106309-217107004 amulet_ascii: bit: " "
217107171-217107866 amulet_ascii: bit: "H"
217108034-217108729 amulet_ascii: bit: "D"
217108897-217109592 amulet_ascii: bit: "/"
217109760-217110455 amulet_ascii: bit: "3"
217110623-217111318 amulet_ascii: bit: "G"
217111485-217112180 amulet_ascii: bit: ":"
217112348-217113043 amulet_ascii: bit: " "
217113211-217113906 amulet_ascii: bit: "0"
217114074-217114769 amulet_ascii: bit: "NULL"
217099407-217114769 amulet_ascii: field: "Value: IMAGEPRO HD/3G: 0" "Val: IMAGEPRO HD/3G: 0" "IMAGEPRO HD/3G: 0"
217096818-217114769 amulet_ascii: ssv: "Command: Set string variable (SSV)" "Command: Set string variable" "Cmd: Set string variable" "Cmd: SSV" "SSV"
217377601-217378296 amulet_ascii: field: "Command: Acknowledgment (ACK)" "Command: Acknowledgment" "Cmd: Acknowledgment" "Cmd: ACK" "ACK"
217377601-217378296 amulet_ascii: ack: "Command: Acknowledgment (ACK)" "Command: Acknowledgment" "Cmd: Acknowledgment" "Cmd: ACK" "ACK"
217461623-217462318 amulet_ascii: field: "Command: Set string variable (SSV)" "Command: Set string variable" "Cmd: Set string variable" "Cmd: SSV" "SSV"
217462486-217463181 amulet_ascii: bit: "Address high nibble: B" "Addr high 0xB" "Addr h 0xB"
217463349-217464044 amulet_ascii: bit: "Address low nibble: A" "Addr low 0xA" "Addr l 0xA"
217462486-217464044 amulet_ascii: field: "Address: 0xBA" "Addr: 0xBA" "0xBA"
217464212-217464907 amulet_ascii: bit: "I"
217465074-217465769 amulet_ascii: bit: "M"
217465937-217466632 amulet_ascii: bit: "A"
217466800-217467495 amulet_ascii: bit: "G"
217467663-217468358 amulet_ascii: bit: "E"
217468525-217469220 amulet_ascii: bit: "P"
217469388-217470083 amulet_ascii: bit: "R"
217470251-217470946 amulet_ascii: bit: "O"
217471114-217471809 amulet_ascii: bit: "-"
217471977-217472672 amulet_ascii: bit: "I"
217472839-217473534 amulet_ascii: bit: "I"
217473702-217474397 amulet_ascii: bit: "/"
217474565-217475260 amulet_ascii: bit: "D"
217475428-217476123 amulet_ascii: bit: "U"
217476290-217476985 amulet_ascii: bit: "A"
217477153-217477848 amulet_ascii: bit: "L"
217478016-217478711 amulet_ascii: bit: ":"
217478879-217479574 amulet_ascii: bit: " "
217479741-217480436 amulet_ascii: bit: "0"
217480604-217481299 amulet_ascii: bit: "NULL"
217464212-217481299 amulet_ascii: field: "Value: IMAGEPRO-II/DUAL: 0" "Val: IMAGEPRO-II/DUAL: 0" "IMAGEPRO-II/DUAL: 0"
217461623-217481299 amulet_ascii: ssv: "Command: Set string variable (SSV)" "Command: Set string variable" "Cmd: Set string variable" "Cmd: SSV" "SSV"
217942252-217942947 amulet_ascii: field: "Command: Acknowledgment (ACK)" "Command: Acknowledgment" "Cmd: Acknowledgment" "Cmd: ACK" "ACK"
217942252-217942947 amulet_ascii: ack: "Command: Acknowledgment (ACK)" "Command: Acknowledgment" "Cmd: Acknowledgment" "Cmd: ACK" "ACK"
218033862-218034557 amulet_ascii: field: "Command: Set string variable (SSV)" "Command: Set string variable" "Cmd: Set string variable" "Cmd: SSV" "SSV"
218034725-218035420 amulet_ascii: bit: "Address high nibble: B" "Addr high 0xB" "Addr h 0xB"
218035588-218036283 amulet_ascii: bit: "Address low nibble: C" "Addr low 0xC" "Addr l 0xC"
218034725-218036283 amulet_ascii: field: "Address: 0xBC" "Addr: 0xBC" "0xBC"
218036450-218037145 amulet_ascii: bit: "P"
218037313-218038008 amulet_ascii: bit: "D"
218038176-218038871 amulet_ascii: bit: "S"
218039039-218039734 amulet_ascii: bit: ":"
218039902-218040597 amulet_ascii: bit: " "
218040764-218041459 amulet_ascii: bit: "0"
218041627-218042322 amulet_ascii: bit: "NULL"
218036450-218042322 amulet_ascii: field: "Value: PDS: 0" "Val: PDS: 0" "PDS: 0"
218033862-218042322 amulet_ascii: ssv: "Command: Set string variable (SSV)" "Command: Set string variable" "Cmd: Set string variable" "Cmd: SSV" "SSV"
218589793-218590488 amulet_ascii: field: "Command: Acknowledgment (ACK)" "Command: Acknowledgment" "Cmd: Acknowledgment" "Cmd: ACK" "ACK"
218589793-218590488 amulet_ascii: ack: "Command: Acknowledgment (ACK)" "Command: Acknowledgment" "Cmd: Acknowledgment" "Cmd: ACK" "ACK"
218711750-218712445 amulet_ascii: field: "Command: Set string variable (SSV)" "Command: Set string variable" "Cmd: Set string variable" "Cmd: SSV" "SSV"
218712612-218713307 amulet_ascii: bit: "Address high nibble: B" "Addr high 0xB" "Addr h 0xB"
218713475-218714170 amulet_ascii: bit: "Address low nibble: E" "Addr low 0xE" "Addr l 0xE"
218712612-218714170 amulet_ascii: field: "Address: 0xBE" "Addr: 0xBE" "0xBE"
218714338-218715033 amulet_ascii: bit: "R"
218715201-218715896 amulet_ascii: bit: "O"
218716063-218716758 amulet_ascii: bit: "U"
218716926-218717621 amulet_ascii: bit: "T"
218717789-218718484 amulet_ascii: bit: "E"
218718652-218719347 amulet_ascii: bit: "R"
218719515-218720210 amulet_ascii: bit: "S"
218720377-218721072 amulet_ascii: bit: ":"
218721240-218721935 amulet_ascii: bit: " "
218722103-218722798 amulet_ascii: bit: "0"
218722966-218723661 amulet_ascii: bit: "NULL"
218714338-218723661 amulet_ascii: field: "Value: ROUTERS: 0" "Val: ROUTERS: 0" "ROUTERS: 0"
218711750-218723661 amulet_ascii: ssv: "Command: Set string variable (SSV)" "Command: Set string variable" "Cmd: Set string variable" "Cmd: SSV" "SSV"
218836575-218837270 amulet_ascii: field: "Command: Acknowledgment (ACK)" "Command: Acknowledgment" "Cmd: Acknowledgment" "Cmd: ACK" "ACK"
218836575-218837270 amulet_ascii: ack: "Command: Acknowledgment (ACK)" "Command: Acknowledgment" "Cmd: Acknowledgment" "Cmd: ACK" "ACK"
218971579-218972274 amulet_ascii: field: "Command: Set string variable (SSV)" "Command: Set string variable" "Cmd: Set string variable" "Cmd: SSV" "SSV"
218972442-218973137 amulet_ascii: bit: "Address high nibble: C" "Addr high 0xC" "Addr h 0xC"
218973305-218974000 amulet_ascii: bit: "Address low nibble: 0" "Addr low 0x0" "Addr l 0x0"
218972442-218974000 amulet_ascii: field: "Address: 0xC0" "Addr: 0xC0" "0xC0"
218974167-218974862 amulet_ascii: bit: "F"
218975030-218975725 amulet_ascii: bit: "S"
218975893-218976588 amulet_ascii: bit: "N"
218976756-218977451 amulet_ascii: bit: ":"
218977618-218978313 amulet_ascii: bit: " "
218978481-218979176 amulet_ascii: bit: "0"
218979344-218980039 amulet_ascii: bit: "NULL"
218974167-218980039 amulet_ascii: field: "Value: FSN: 0" "Val: FSN: 0" "FSN: 0"
218971579-218980039 amulet_ascii: ssv: "Command: Set string variable (SSV)" "Command: Set string variable" "Cmd: Set string variable" "Cmd: SSV" "SSV"
219177576-219178271 amulet_ascii: field: "Command: Acknowledgment (ACK)" "Command: Acknowledgment" "Cmd: Acknowledgment" "Cmd: ACK" "ACK"
219177576-219178271 amulet_ascii: ack: "Command: Acknowledgment (ACK)" "Command: Acknowledgment" "Cmd: Acknowledgment" "Cmd: ACK" "ACK"
219284667-219285362 amulet_ascii: field: "Command: Set string variable (SSV)" "Command: Set string variable" "Cmd: Set string variable" "Cmd: SSV" "SSV"
219285530-219286225 amulet_ascii: bit: "Address high nibble: C" "Addr high 0xC" "Addr h 0xC"
219286392-219287087 amulet_ascii: bit: "Address low nibble: 5" "Addr low 0x5" "Addr l 0x5"
219285530-219287087 amulet_ascii: field: "Address: 0xC5" "Addr: 0xC5" "0xC5"
219287255-219287950 amulet_ascii: bit: "E"
219288118-219288813 amulet_ascii: bit: "N"
219288981-219289676 amulet_ascii: bit: "C"
219289843-219290538 amulet_ascii: bit: "O"
219290706-219291401 amulet_ascii: bit: "R"
219291569-219292264 amulet_ascii: bit: "E"
219292432-219293127 amulet_ascii: bit: " "
219293294-219293989 amulet_ascii: bit: "S"
219294157-219294852 amulet_ascii: bit: "Y"
219295020-219295715 amulet_ascii: bit: "S"
219295883-219296578 amulet_ascii: bit: "T"
219296746-219297441 amulet_ascii: bit: "E"
219297608-219298303 amulet_ascii: bit: "M"
219298471-219299166 amulet_ascii: bit: " "
219299334-219300029 amulet_ascii: bit: "S"
219300197-219300892 amulet_ascii: bit: "T"
219301059-219301754 amulet_ascii: bit: "A"
219301922-219302617 amulet_ascii: bit: "T"
219302785-219303480 amulet_ascii: bit: "U"
219303648-219304343 amulet_ascii: bit: "S"
219304510-219305205 amulet_ascii: bit: " "
219305373-219306068 amulet_ascii: bit: " "
219306236-219306931 amulet_ascii: bit: " "
219307099-219307794 amulet_ascii: bit: " "
219307962-219308657 amulet_ascii: bit: " "
219308824-219309519 amulet_ascii: bit: " "
219309687-219310382 amulet_ascii: bit: "V"
219310550-219311245 amulet_ascii: bit: "e"
219311413-219312108 amulet_ascii: bit: "r"
219312275-219312970 amulet_ascii: bit: " "
219313138-219313833 amulet_ascii: bit: "2"
219314001-219314696 amulet_ascii: bit: "."
219314864-219315559 amulet_ascii: bit: "3"
219315726-219316421 amulet_ascii: bit: "3"
219316589-219317284 amulet_ascii: bit: "."
219317452-219318147 amulet_ascii: bit: "0"
219318315-219319010 amulet_ascii: bit: "1"
219319178-219319873 amulet_ascii: bit: "NULL"
219287255-219319873 amulet_ascii: field: "Value: ENCORE SYSTEM STATUS      Ver 2.33.01" "Val: ENCORE SYSTEM STATUS      Ver 2.33.01" "ENCORE SYSTEM STATUS      Ver 2.33.01"
219284667-219319873 amulet_ascii: ssv: "Command: Set string variable (SSV)" "Command: Set string variable" "Cmd: Set string variable" "Cmd: SSV" "SSV"
219441093-219441788 amulet_ascii: field: "Command: Acknowledgment (ACK)" "Command: Acknowledgment" "Cmd: Acknowledgment" "Cmd: ACK" "ACK"
219441093-219441788 amulet_ascii: ack: "Command: Acknowledgment (ACK)" "Command: Acknowledgment" "Cmd: Acknowledgment" "Cmd: ACK" "ACK"
219524647-219525342 amulet_ascii: field: "Command: Set string variable (SSV)" "Command: Set string variable" "Cmd: Set string variable" "Cmd: SSV" "SSV"
219525510-219526205 amulet_ascii: bit: "Address high nibble: B" "Addr high 0xB" "Addr h 0xB"
219526373-219527068 amulet_ascii: bit: "Address low nibble: 0" "Addr low 0x0" "Addr l 0x0"
219525510-219527068 amulet_ascii: field: "Address: 0xB0" "Addr: 0xB0" "0xB0"
219527235-219527930 amulet_ascii: bit: "E"
219528098-219528793 amulet_ascii: bit: "N"
219528961-219529656 amulet_ascii: bit: "C"
219529824-219530519 amulet_ascii: bit: "O"
219530686-219531381 amulet_ascii: bit: "R"
219531549-219532244 amulet_ascii: bit: "E"
219532412-219533107 amulet_ascii: bit: " "
219533275-219533970 amulet_ascii: bit: "V"
219534137-219534832 amulet_ascii: bit: "P"
219535000-219535695 amulet_ascii: bit: "/"
219535863-219536558 amulet_ascii: bit: "3"
219536726-219537421 amulet_ascii: bit: "G"
219537589-219538284 amulet_ascii: bit: ":"
219538451-219539146 amulet_ascii: bit: " "
219539314-219540009 amulet_ascii: bit: "0"
219540177-219540872 amulet_ascii: bit: " "
219541040-219541735 amulet_ascii: bit: "NULL"
219527235-219541735 amulet_ascii: field: "Value: ENCORE VP/3G: 0 " "Val: ENCORE VP/3G: 0 " "ENCORE VP/3G: 0 "
219524647-219541735 amulet_ascii: ssv: "Command: Set string variable (SSV)" "Command: Set string variable" "Cmd: Set string variable" "Cmd: SSV" "SSV"
219617289-219617984 amulet_ascii: field: "Command: Acknowledgment (ACK)" "Command: Acknowledgment" "Cmd: Acknowledgment" "Cmd: ACK" "ACK"
219617289-219617984 amulet_ascii: ack: "Command: Acknowledgment (ACK)" "Command: Acknowledgment" "Cmd: Acknowledgment" "Cmd: ACK" "ACK"
219711987-219712682 amulet_ascii: field: "Command: Set string variable (SSV)" "Command: Set string variable" "Cmd: Set string variable" "Cmd: SSV" "SSV"
219712850-219713545 amulet_ascii: bit: "Address high nibble: B" "Addr high 0xB" "Addr h 0xB"
219713713-219714408 amulet_ascii: bit: "Address low nibble: 2" "Addr low 0x2" "Addr l 0x2"
219712850-219714408 amulet_ascii: field: "Address: 0xB2" "Addr: 0xB2" "0xB2"
219714576-219715271 amulet_ascii: bit: "E"
219715439-219716134 amulet_ascii: bit: "N"
219716301-219716996 amulet_ascii: bit: "C"
219717164-219717859 amulet_ascii: bit: "O"
219718027-219718722 amulet_ascii: bit: "R"
219718890-219719585 amulet_ascii: bit: "E"
219719752-219720447 amulet_ascii: bit: " "
219720615-219721310 amulet_ascii: bit: "V"
219721478-219722173 amulet_ascii: bit: "P"
219722341-219723036 amulet_ascii: bit: "X"
219723203-219723898 amulet_ascii: bit: "/"
219724066-219724761 amulet_ascii: bit: "3"
219724929-219725624 amulet_ascii: bit: "G"
219725792-219726487 amulet_ascii: bit: ":"
219726655-219727350 amulet_ascii: bit: " "
219727517-219728212 amulet_ascii: bit: "0"
219728380-219729075 amulet_ascii: bit: " "
219729243-219729938 amulet_ascii: bit: "NULL"
219714576-219729938 amulet_ascii: field: "Value: ENCORE VPX/3G: 0 " "Val: ENCORE VPX/3G: 0 " "ENCORE VPX/3G: 0 "
219711987-219729938 amulet_ascii: ssv: "Command: Set string variable (SSV)" "Command: Set string variable" "Cmd: Set string variable" "Cmd: SSV" "SSV"
219793830-219794525 amulet_ascii: field: "Command: Acknowledgment (ACK)" "Command: Acknowledgment" "Cmd: Acknowledgment" "Cmd: ACK" "ACK"
219793830-219794525 amulet_ascii: ack: "Command: Acknowledgment (ACK)" "Command: Acknowledgment" "Cmd: Acknowledgment" "Cmd: ACK" "ACK"
219909448-219910143 amulet_ascii: field: "Command: Set string variable (SSV)" "Command: Set string variable" "Cmd: Set string variable" "Cmd: SSV" "SSV"
219910311-219911006 amulet_ascii: bit: "Address high nibble: B" "Addr high 0xB" "Addr h 0xB"
219911173-219911868 amulet_ascii: bit: "Address low nibble: 4" "Addr low 0x4" "Addr l 0x4"
219910311-219911868 amulet_ascii: field: "Address: 0xB4" "Addr: 0xB4" "0xB4"
219912036-219912731 amulet_ascii: bit: "S"
219912899-219913594 amulet_ascii: bit: "C"
219913762-219914457 amulet_ascii: bit: "R"
219914624-219915319 amulet_ascii: bit: "E"
219915487-219916182 amulet_ascii: bit: "E"
219916350-219917045 amulet_ascii: bit: "N"
219917213-219917908 amulet_ascii: bit: "P"
219918075-219918770 amulet_ascii: bit: "R"
219918938-219919633 amulet_ascii: bit: "O"
219919801-219920496 amulet_ascii: bit: " "
219920664-219921359 amulet_ascii: bit: "I"
219921527-219922222 amulet_ascii: bit: "I"
219922389-219923084 amulet_ascii: bit: "/"
219923252-219923947 amulet_ascii: bit: "3"
219924115-219924810 amulet_ascii: bit: "G"
219924978-219925673 amulet_ascii: bit: ":"
219925840-219926535 amulet_ascii: bit: " "
219926703-219927398 amulet_ascii: bit: "0"
219927566-219928261 amulet_ascii: bit: " "
219928429-219929124 amulet_ascii: bit: "NULL"
219912036-219929124 amulet_ascii: field: "Value: SCREENPRO II/3G: 0 " "Val: SCREENPRO II/3G: 0 " "SCREENPRO II/3G: 0 "
219909448-219929124 amulet_ascii: ssv: "Command: Set string variable (SSV)" "Command: Set string variable" "Cmd: Set string variable" "Cmd: SSV" "SSV"
219987426-219988121 amulet_ascii: field: "Command: Acknowledgment (ACK)" "Command: Acknowledgment" "Cmd: Acknowledgment" "Cmd: ACK" "ACK"
219987426-219988121 amulet_ascii: ack: "Command: Acknowledgment (ACK)" "Command: Acknowledgment" "Cmd: Acknowledgment" "Cmd: ACK" "ACK"
220086929-220087624 amulet_ascii: field: "Command: Set string variable (SSV)" "Command: Set string variable" "Cmd: Set string variable" "Cmd: SSV" "SSV"
220087792-220088487 amulet_ascii: bit: "Address high nibble: B" "Addr high 0xB" "Addr h 0xB"
220088654-220089349 amulet_ascii: bit: "Address low nibble: 6" "Addr low 0x6" "Addr l 0x6"
220087792-220089349 amulet_ascii: field: "Address: 0xB6" "Addr: 0xB6" "0xB6"
220089517-220090212 amulet_ascii: bit: "P"
220090380-220091075 amulet_ascii: bit: "R"
220091243-220091938 amulet_ascii: bit: "E"
220092105-220092800 amulet_ascii: bit: "P"
220092968-220093663 amulet_ascii: bit: "R"
220093831-220094526 amulet_ascii: bit: "O"
220094694-220095389 amulet_ascii: bit: " "
220095556-220096251 amulet_ascii: bit: "I"
220096419-220097114 amulet_ascii: bit: "I"
220097282-220097977 amulet_ascii: bit: ":"
220098145-220098840 amulet_ascii: bit: " "
220099008-220099703 amulet_ascii: bit: "0"
220099870-220100565 amulet_ascii: bit: " "
220100733-220101428 amulet_ascii: bit: "NULL"
220089517-220101428 amulet_ascii: field: "Value: PREPRO II: 0 " "Val: PREPRO II: 0 " "PREPRO II: 0 "
220086929-220101428 amulet_ascii: ssv: "Command: Set string variable (SSV)" "Command: Set string variable" "Cmd: Set string variable" "Cmd: SSV" "SSV"
220182422-220183117 amulet_ascii: field: "Command: Acknowledgment (ACK)" "Command: Acknowledgment" "Cmd: Acknowledgment" "Cmd: ACK" "ACK"
220182422-220183117 amulet_ascii: ack: "Command: Acknowledgment (ACK)" "Command: Acknowledgment" "Cmd: Acknowledgment" "Cmd: ACK" "ACK"
220274714-220275409 amulet_ascii: field: "Command: Set string variable (SSV)" "Command: Set string variable" "Cmd: Set string variable" "Cmd: SSV" "SSV"
220275577-220276272 amulet_ascii: bit: "Address high nibble: B" "Addr high 0xB" "Addr h 0xB"
220276440-220277135 amulet_ascii: bit: "Address low nibble: 8" "Addr low 0x8" "Addr l 0x8"
220275577-220277135 amulet_ascii: field: "Address: 0xB8" "Addr: 0xB8" "0xB8"
220277302-220277997 amulet_ascii: bit: "I"
220278165-220278860 amulet_ascii: bit: "M"
220279028-220279723 amulet_ascii: bit: "A"
220279891-220280586 amulet_ascii: bit: "G"
220280753-220281448 amulet_ascii: bit: "E"
220281616-220282311 amulet_ascii: bit: "P"
220282479-220283174 amulet_ascii: bit: "R"
220283342-220284037 amulet_ascii: bit: "O"
220284205-220284900 amulet_ascii: bit: " "
220285067-220285762 amulet_ascii: bit: "H"
220285930-220286625 amulet_ascii: bit: "D"
220286793-220287488 amulet_ascii: bit: "/"
220287656-220288351 amulet_ascii: bit: "3"
220288518-220289213 amulet_ascii: bit: "G"
220289381-220290076 amulet_ascii: bit: ":"
220290244-220290939 amulet_ascii: bit: " "
220291107-220291802 amulet_ascii: bit: "0"
220291970-220292665 amulet_ascii: bit: "NULL"
220277302-220292665 amulet_ascii: field: "Value: IMAGEPRO HD/3G: 0" "Val: IMAGEPRO HD/3G: 0" "IMAGEPRO HD/3G: 0"
220274714-220292665 amulet_ascii: ssv: "Command: Set string variable (SSV)" "Command: Set string variable" "Cmd: Set string variable" "Cmd: SSV" "SSV"
220296848-220297543 amulet_ascii: field: "Command: Acknowledgment (ACK)" "Command: Acknowledgment" "Cmd: Acknowledgment" "Cmd: ACK" "ACK"
220296848-220297543 amulet_ascii: ack: "Command: Acknowledgment (ACK)" "Command: Acknowledgment" "Cmd: Acknowledgment" "Cmd: ACK" "ACK"
220399648-220400343 amulet_ascii: field: "Command: Set string variable (SSV)" "Command: Set string variable" "Cmd: Set string variable" "Cmd: SSV" "SSV"
220400510-220401205 amulet_ascii: bit: "Address high nibble: B" "Addr high 0xB" "Addr h 0xB"
220401373-220402068 amulet_ascii: bit: "Address low nibble: A" "Addr low 0xA" "Addr l 0xA"
220400510-220402068 amulet_ascii: field: "Address: 0xBA" "Addr: 0xBA" "0xBA"
220402236-220402931 amulet_ascii: bit: "I"
220403099-220403794 amulet_ascii: bit: "M"
220403961-220404656 amulet_ascii: bit: "A"
220404824-220405519 amulet_ascii: bit: "G"
220405687-220406382 amulet_ascii: bit: "E"
220406550-220407245 amulet_ascii: bit: "P"
220407412-220408107 amulet_ascii: bit: "R"
220408275-220408970 amulet_ascii: bit: "O"
220409138-220409833 amulet_ascii: bit: "-"
220410001-220410696 amulet_ascii: bit: "I"
220410864-220411559 amulet_ascii: bit: "I"
220411726-220412421 amulet_ascii: bit: "/"
220412589-220413284 amulet_ascii: bit: "D"
220413452-220414147 amulet_ascii: bit: "U"
220414315-220415010 amulet_ascii: bit: "A"
220415177-220415872 amulet_ascii: bit: "L"
220416040-220416735 amulet_ascii: bit: ":"
220416903-220417598 amulet_ascii: bit: " "
220417766-220418461 amulet_ascii: bit: "0"
220418628-220419323 amulet_ascii: bit: "NULL"
220402236-220419323 amulet_ascii: field: "Value: IMAGEPRO-II/DUAL: 0" "Val: IMAGEPRO-II/DUAL: 0" "IMAGEPRO-II/DUAL: 0"
220399648-220419323 amulet_ascii: ssv: "Command: Set string variable (SSV)" "Command: Set string variable" "Cmd: Set string variable" "Cmd: SSV" "SSV"
220487461-220488156 amulet_ascii: field: "Command: Acknowledgment (ACK)" "Command: Acknowledgment" "Cmd: Acknowledgment" "Cmd: ACK" "ACK"
220487461-220488156 amulet_ascii: ack: "Command: Acknowledgment (ACK)" "Command: Acknowledgment" "Cmd: Acknowledgment" "Cmd: ACK" "ACK"
220587042-220587737 amulet_ascii: field: "Command: Set string variable (SSV)" "Command: Set string variable" "Cmd: Set string variable" "Cmd: SSV" "SSV"
220587905-220588600 amulet_ascii: bit: "Address high nibble: B" "Addr high 0xB" "Addr h 0xB"
220588768-220589463 amulet_ascii: bit: "Address low nibble: C" "Addr low 0xC" "Addr l 0xC"
220587905-220589463 amulet_ascii: field: "Address: 0xBC" "Addr: 0xBC" "0xBC"
220589631-220590326 amulet_ascii: bit: "P"
220590493-220591188 amulet_ascii: bit: "D"
220591356-220592051 amulet_ascii: bit: "S"
220592219-220592914 amulet_ascii: bit: ":"
220593082-220593777 amulet_ascii: bit: " "
220593944-220594639 amulet_ascii: bit: "0"
220594807-220595502 amulet_ascii: bit: "NULL"
220589631-220595502 amulet_ascii: field: "Value: PDS: 0" "Val: PDS: 0" "PDS: 0"
220587042-220595502 amulet_ascii: ssv: "Command: Set string variable (SSV)" "Command: Set string variable" "Cmd: Set string variable" "Cmd: SSV" "SSV"
220679234-220679929 amulet_ascii: field: "Command: Acknowledgment (ACK)" "Command: Acknowledgment" "Cmd: Acknowledgment" "Cmd: ACK" "ACK"
220679234-220679929 amulet_ascii: ack: "Command: Acknowledgment (ACK)" "Command: Acknowledgment" "Cmd: Acknowledgment" "Cmd: ACK" "ACK"
220774800-220775495 amulet_ascii: field: "Command: Set string variable (SSV)" "Command: Set string variable" "Cmd: Set string variable" "Cmd: SSV" "SSV"
220775663-220776358 amulet_ascii: bit: "Address high nibble: B" "Addr high 0xB" "Addr h 0xB"
220776526-220777221 amulet_ascii: bit: "Address low nibble: E" "Addr low 0xE" "Addr l 0xE"
220775663-220777221 amulet_ascii: field: "Address: 0xBE" "Addr: 0xBE" "0xBE"
220777389-220778084 amulet_ascii: bit: "R"
220778252-220778947 amulet_ascii: bit: "O"
220779114-220779809 amulet_ascii: bit: "U"
220779977-220780672 amulet_ascii: bit: "T"
220780840-220781535 amulet_ascii: bit: "E"
220781703-220782398 amulet_ascii: bit: "R"
220782565-220783260 amulet_ascii: bit: "S"
220783428-220784123 amulet_ascii: bit: ":"
220784291-220784986 amulet_ascii: bit: " "
220785154-220785849 amulet_ascii: bit: "0"
220786016-220786711 amulet_ascii: bit: "NULL"
220777389-220786711 amulet_ascii: field: "Value: ROUTERS: 0" "Val: ROUTERS: 0" "ROUTERS: 0"
220774800-220786711 amulet_ascii: ssv: "Command: Set string variable (SSV)" "Command: Set string variable" "Cmd: Set string variable" "Cmd: SSV" "SSV"
220789986-220790681 amulet_ascii: field: "Command: Acknowledgment (ACK)" "Command: Acknowledgment" "Cmd: Acknowledgment" "Cmd: ACK" "ACK"
220789986-220790681 amulet_ascii: ack: "Command: Acknowledgment (ACK)" "Command: Acknowledgment" "Cmd: Acknowledgment" "Cmd: ACK" "ACK"
220899756-220900451 amulet_ascii: field: "Command: Set string variable (SSV)" "Command: Set string variable" "Cmd: Set string variable" "Cmd: SSV" "SSV"
220900618-220901313 amulet_ascii: bit: "Address high nibble: C" "Addr high 0xC" "Addr h 0xC"
220901481-220902176 amulet_ascii: bit: "Address low nibble: 0" "Addr low 0x0" "Addr l 0x0"
220900618-220902176 amulet_ascii: field: "Address: 0xC0" "Addr: 0xC0" "0xC0"
220902344-220903039 amulet_ascii: bit: "F"
220903207-220903902 amulet_ascii: bit: "S"
220904069-220904764 amulet_ascii: bit: "N"
220904932-220905627 amulet_ascii: bit: ":"
220905795-220906490 amulet_ascii: bit: " "
220906658-220907353 amulet_ascii: bit: "0"
220907520-220908215 amulet_ascii: bit: "NULL"
220902344-220908215 amulet_ascii: field: "Value: FSN: 0" "Val: FSN: 0" "FSN: 0"
220899756-220908215 amulet_ascii: ssv: "Command: Set string variable (SSV)" "Command: Set string variable" "Cmd: Set string variable" "Cmd: SSV" "SSV"
220981656-220982351 amulet_ascii: field: "Command: Acknowledgment (ACK)" "Command: Acknowledgment" "Cmd: Acknowledgment" "Cmd: ACK" "ACK"
220981656-220982351 amulet_ascii: ack: "Command: Acknowledgment (ACK)" "Command: Acknowledgment" "Cmd: Acknowledgment" "Cmd: ACK" "ACK"
255032101-255032796 amulet_ascii: field: "Command: Get string variable (GSV)" "Command: Get string variable" "Cmd: Get string variable" "Cmd: GSV" "GSV"
255032101-255032796 amulet_ascii: field: "Command: Get string variable (GSV)" "Command: Get string variable" "Cmd: Get string variable" "Cmd: GSV" "GSV"
255032101-255032796 amulet_ascii: gsv: "Command: Get string variable (GSV)" "Command: Get string variable" "Cmd: Get string variable" "Cmd: GSV" "GSV"
255032964-255033659 amulet_ascii: warning: "Unknown command: 0x39"
255033827-255034522 amulet_ascii: warning: "Unknown command: 0x46"
255083719-255084414 amulet_ascii: field: "Command: Get string variable reply (GSVR)" "Command: Get string variable reply" "Cmd: Get string variable reply" "Cmd: GSVR" "GSVR"
255084671-255085366 amulet_ascii: bit: "Address high nibble: 9" "Addr high 0x9" "Addr h 0x9"
255085622-255086317 amulet_ascii: bit: "Address low nibble: F" "Addr low 0xF" "Addr l 0xF"
255084671-255086317 amulet_ascii: field: "Address: 0x9F" "Addr: 0x9F" "0x9F"
255086573-255087268 amulet_ascii: bit: "1"
255087525-255088220 amulet_ascii: bit: "."
255088476-255089171 amulet_ascii: bit: "2"
255089428-255090123 amulet_ascii: bit: "3"
255090379-255091074 amulet_ascii: bit: " "
255091330-255092025 amulet_ascii: bit: "NULL"
255086573-255092025 amulet_ascii: field: "Value: 1.23 " "Val: 1.23 " "1.23 "
255083719-255092025 amulet_ascii: gsvr: "Command: Get string variable reply (GSVR)" "Command: Get string variable reply" "Cmd: Get string variable reply" "Cmd: GSVR" "GSVR"
255092522-255093217 amulet_ascii: field: "Command: Acknowledgment (ACK)" "Command: Acknowledgment" "Cmd: Acknowledgment" "Cmd: ACK" "ACK"
255092522-255093217 amulet_ascii: ack: "Command: Acknowledgment (ACK)" "Command: Acknowledgment" "Cmd: Acknowledgment" "Cmd: ACK" "ACK"
