11591927-11592621 amulet_ascii: field: "Command: Set word variable (SWV)" "Command: Set word variable" "Cmd: Set word variable" "Cmd: SWV" "SWV"
11592790-11593484 amulet_ascii: bit: "Address high nibble: F" "Addr high 0xF" "Addr h 0xF"
11593653-11594347 amulet_ascii: bit: "Address low nibble: F" "Addr low 0xF" "Addr l 0xF"
11592790-11594347 amulet_ascii: field: "Address: 0xFF" "Addr: 0xFF" "0xFF"
11594516-11597798 amulet_ascii: field: "Value: 0x00fe" "Val: 0x00fe" "0x00fe"
11591927-11597798 amulet_ascii: swv: "Command: Set word variable (SWV)" "Command: Set word variable" "Cmd: Set word variable" "Cmd: SWV" "SWV"
11679707-11680401 amulet_ascii: field: "Command: Acknowledgment (ACK)" "Command: Acknowledgment" "Cmd: Acknowledgment" "Cmd: ACK" "ACK"
11679707-11680401 amulet_ascii: ack: "Command: Acknowledgment (ACK)" "Command: Acknowledgment" "Cmd: Acknowledgment" "Cmd: ACK" "ACK"
13496878-13497572 amulet_ascii: field: "Command: Set word variable (SWV)" "Command: Set word variable" "Cmd: Set word variable" "Cmd: SWV" "SWV"
13497829-13498523 amulet_ascii: bit: "Address high nibble: F" "Addr high 0xF" "Addr h 0xF"
13498780-13499474 amulet_ascii: bit: "Address low nibble: F" "Addr low 0xF" "Addr l 0xF"
13497829-13499474 amulet_ascii: field: "Address: 0xFF" "Addr: 0xFF" "0xFF"
13499732-13503280 amulet_ascii: field: "Value: 0x5a5a" "Val: 0x5a5a" "0x5a5a"
13496878-13503280 amulet_ascii: swv: "Command: Set word variable (SWV)" "Command: Set word variable" "Cmd: Set word variable" "Cmd: SWV" "SWV"
13503537-13504231 amulet_ascii: warning: "Unknown command: 0x00"
13504673-13505367 amulet_ascii: field: "Command: Acknowledgment (ACK)" "Command: Acknowledgment" "Cmd: Acknowledgment" "Cmd: ACK" "ACK"
13504673-13505367 amulet_ascii: ack: "Command: Acknowledgment (ACK)" "Command: Acknowledgment" "Cmd: Acknowledgment" "Cmd: ACK" "ACK"
13529580-13530274 amulet_ascii: field: "Command: Set string variable (SSV)" "Command: Set string variable" "Cmd: Set string variable" "Cmd: SSV" "SSV"
13530443-13531137 amulet_ascii: bit: "Address high nibble: 9" "Addr high 0x9" "Addr h 0x9"
13531305-13531999 amulet_ascii: bit: "Address low nibble: A" "Addr low 0xA" "Addr l 0xA"
13530443-13531999 amulet_ascii: field: "Address: 0x9A" "Addr: 0x9A" "0x9A"
13532168-13532862 amulet_ascii: bit: "A"
13533031-13533725 amulet_ascii: bit: " "
13533894-13534588 amulet_ascii: bit: "L"
13534756-13535450 amulet_ascii: bit: "a"
13535619-13536313 amulet_ascii: bit: "y"
13536482-13537176 amulet_ascii: bit: "e"
13537345-13538039 amulet_ascii: bit: "r"
13538208-13538902 amulet_ascii: bit: " "
13539070-13539764 amulet_ascii: bit: "m"
13539933-13540627 amulet_ascii: bit: "u"
13540796-13541490 amulet_ascii: bit: "s"
13541659-13542353 amulet_ascii: bit: "t"
13542521-13543215 amulet_ascii: bit: " "
13543384-13544078 amulet_ascii: bit: "b"
13544247-13544941 amulet_ascii: bit: "e"
13545110-13545804 amulet_ascii: bit: " "
13545972-13546666 amulet_ascii: bit: "s"
13546835-13547529 amulet_ascii: bit: "e"
13547698-13548392 amulet_ascii: bit: "l"
13548561-13549255 amulet_ascii: bit: "e"
13549424-13550118 amulet_ascii: bit: "c"
13550286-13550980 amulet_ascii: bit: "t"
13551149-13551843 amulet_ascii: bit: "e"
13552012-13552706 amulet_ascii: bit: "d"
13552875-13553569 amulet_ascii: bit: "."
13553737-13554431 amulet_ascii: bit: "NULL"
13532168-13554431 amulet_ascii: field: "Value: A Layer must be selected." "Val: A Layer must be selected." "A Layer must be selected."
13529580-13554431 amulet_ascii: ssv: "Command: Set string variable (SSV)" "Command: Set string variable" "Cmd: Set string variable" "Cmd: SSV" "SSV"
13561045-13561739 amulet_ascii: field: "Command: Acknowledgment (ACK)" "Command: Acknowledgment" "Cmd: Acknowledgment" "Cmd: ACK" "ACK"
13561045-13561739 amulet_ascii: ack: "Command: Acknowledgment (ACK)" "Command: Acknowledgment" "Cmd: Acknowledgment" "Cmd: ACK" "ACK"
26229595-26230289 amulet_ascii: field: "Command: Set word variable (SWV)" "Command: Set word variable" "Cmd: Set word variable" "Cmd: SWV" "SWV"
26230458-26231152 amulet_ascii: bit: "Address high nibble: F" "Addr high 0xF" "Addr h 0xF"
26231321-26232015 amulet_ascii: bit: "Address low nibble: F" "Addr low 0xF" "Addr l 0xF"
26230458-26232015 amulet_ascii: field: "Address: 0xFF" "Addr: 0xFF" "0xFF"
26232184-26235466 amulet_ascii: field: "Value: 0xffff" "Val: 0xffff" "0xffff"
26229595-26235466 amulet_ascii: swv: "Command: Set word variable (SWV)" "Command: Set word variable" "Cmd: Set word variable" "Cmd: SWV" "SWV"
26262506-26263200 amulet_ascii: field: "Command: Acknowledgment (ACK)" "Command: Acknowledgment" "Cmd: Acknowledgment" "Cmd: ACK" "ACK"
26262506-26263200 amulet_ascii: ack: "Command: Acknowledgment (ACK)" "Command: Acknowledgment" "Cmd: Acknowledgment" "Cmd: ACK" "ACK"
27407125-27407819 amulet_ascii: field: "Command: Set byte variable (SBV)" "Command: Set byte variable" "Cmd: Set byte variable" "Cmd: SBV" "SBV"
27407988-27408682 amulet_ascii: bit: "Address high nibble: A" "Addr high 0xA" "Addr h 0xA"
27408851-27409545 amulet_ascii: bit: "Address low nibble: 0" "Addr low 0x0" "Addr l 0x0"
27407988-27409545 amulet_ascii: field: "Address: 0xA0" "Addr: 0xA0" "0xA0"
27409714-27411270 amulet_ascii: field: "Value: 0x00" "Val: 0x00" "0x00"
27407125-27411270 amulet_ascii: sbv: "Command: Set byte variable (SBV)" "Command: Set byte variable" "Cmd: Set byte variable" "Cmd: SBV" "SBV"
27412790-27413484 amulet_ascii: field: "Command: Acknowledgment (ACK)" "Command: Acknowledgment" "Cmd: Acknowledgment" "Cmd: ACK" "ACK"
27412790-27413484 amulet_ascii: ack: "Command: Acknowledgment (ACK)" "Command: Acknowledgment" "Cmd: Acknowledgment" "Cmd: ACK" "ACK"
27532232-27532926 amulet_ascii: field: "Command: Set byte variable (SBV)" "Command: Set byte variable" "Cmd: Set byte variable" "Cmd: SBV" "SBV"
27533095-27533789 amulet_ascii: bit: "Address high nibble: A" "Addr high 0xA" "Addr h 0xA"
27533958-27534652 amulet_ascii: bit: "Address low nibble: 1" "Addr low 0x1" "Addr l 0x1"
27533095-27534652 amulet_ascii: field: "Address: 0xA1" "Addr: 0xA1" "0xA1"
27534821-27536377 amulet_ascii: field: "Value: 0x00" "Val: 0x00" "0x00"
27532232-27536377 amulet_ascii: sbv: "Command: Set byte variable (SBV)" "Command: Set byte variable" "Cmd: Set byte variable" "Cmd: SBV" "SBV"
30156927-30157621 amulet_ascii: field: "Command: Set byte variable (SBV)" "Command: Set byte variable" "Cmd: Set byte variable" "Cmd: SBV" "SBV"
30157790-30158484 amulet_ascii: bit: "Address high nibble: A" "Addr high 0xA" "Addr h 0xA"
30158653-30159347 amulet_ascii: bit: "Address low nibble: 1" "Addr low 0x1" "Addr l 0x1"
30157790-30159347 amulet_ascii: field: "Address: 0xA1" "Addr: 0xA1" "0xA1"
30159515-30161072 amulet_ascii: field: "Value: 0x00" "Val: 0x00" "0x00"
30156927-30161072 amulet_ascii: sbv: "Command: Set byte variable (SBV)" "Command: Set byte variable" "Cmd: Set byte variable" "Cmd: SBV" "SBV"
31061716-31062410 amulet_ascii: field: "Command: Acknowledgment (ACK)" "Command: Acknowledgment" "Cmd: Acknowledgment" "Cmd: ACK" "ACK"
31061716-31062410 amulet_ascii: ack: "Command: Acknowledgment (ACK)" "Command: Acknowledgment" "Cmd: Acknowledgment" "Cmd: ACK" "ACK"
31144930-31145624 amulet_ascii: field: "Command: Set word variable (SWV)" "Command: Set word variable" "Cmd: Set word variable" "Cmd: SWV" "SWV"
31157904-31158598 amulet_ascii: warning: "Command aborted by invalid byte" "Abort"
31157904-31158598 amulet_ascii: field: "Command: Set byte variable (SBV)" "Command: Set byte variable" "Cmd: Set byte variable" "Cmd: SBV" "SBV"
31158766-31159460 amulet_ascii: bit: "Address high nibble: A" "Addr high 0xA" "Addr h 0xA"
31159629-31160323 amulet_ascii: bit: "Address low nibble: 2" "Addr low 0x2" "Addr l 0x2"
31158766-31160323 amulet_ascii: field: "Address: 0xA2" "Addr: 0xA2" "0xA2"
31160492-31162049 amulet_ascii: field: "Value: 0x00" "Val: 0x00" "0x00"
31157904-31162049 amulet_ascii: sbv: "Command: Set byte variable (SBV)" "Command: Set byte variable" "Cmd: Set byte variable" "Cmd: SBV" "SBV"
31230703-31231397 amulet_ascii: field: "Command: Acknowledgment (ACK)" "Command: Acknowledgment" "Cmd: Acknowledgment" "Cmd: ACK" "ACK"
31230703-31231397 amulet_ascii: ack: "Command: Acknowledgment (ACK)" "Command: Acknowledgment" "Cmd: Acknowledgment" "Cmd: ACK" "ACK"
31313756-31314450 amulet_ascii: field: "Command: Set word variable (SWV)" "Command: Set word variable" "Cmd: Set word variable" "Cmd: SWV" "SWV"
31314708-31315402 amulet_ascii: bit: "Address high nibble: F" "Addr high 0xF" "Addr h 0xF"
31315659-31316353 amulet_ascii: bit: "Address low nibble: F" "Addr low 0xF" "Addr l 0xF"
31314708-31316353 amulet_ascii: field: "Address: 0xFF" "Addr: 0xFF" "0xFF"
31345630-31346324 amulet_ascii: warning: "Command aborted by invalid byte" "Abort"
31345630-31346324 amulet_ascii: field: "Command: Set byte variable (SBV)" "Command: Set byte variable" "Cmd: Set byte variable" "Cmd: SBV" "SBV"
31346492-31347186 amulet_ascii: bit: "Address high nibble: A" "Addr high 0xA" "Addr h 0xA"
31347355-31348049 amulet_ascii: bit: "Address low nibble: 3" "Addr low 0x3" "Addr l 0x3"
31346492-31348049 amulet_ascii: field: "Address: 0xA3" "Addr: 0xA3" "0xA3"
31348218-31349775 amulet_ascii: field: "Value: 0x00" "Val: 0x00" "0x00"
31345630-31349775 amulet_ascii: sbv: "Command: Set byte variable (SBV)" "Command: Set byte variable" "Cmd: Set byte variable" "Cmd: SBV" "SBV"
31403043-31403737 amulet_ascii: field: "Command: Acknowledgment (ACK)" "Command: Acknowledgment" "Cmd: Acknowledgment" "Cmd: ACK" "ACK"
31403043-31403737 amulet_ascii: ack: "Command: Acknowledgment (ACK)" "Command: Acknowledgment" "Cmd: Acknowledgment" "Cmd: ACK" "ACK"
31403994-31404688 amulet_ascii: field: "Command: Set word variable (SWV)" "Command: Set word variable" "Cmd: Set word variable" "Cmd: SWV" "SWV"
31404946-31405640 amulet_ascii: bit: "Address high nibble: F" "Addr high 0xF" "Addr h 0xF"
31405897-31406591 amulet_ascii: bit: "Address low nibble: F" "Addr low 0xF" "Addr l 0xF"
31404946-31406591 amulet_ascii: field: "Address: 0xFF" "Addr: 0xFF" "0xFF"
31406849-31410397 amulet_ascii: field: "Value: 0x5a5a" "Val: 0x5a5a" "0x5a5a"
31403994-31410397 amulet_ascii: swv: "Command: Set word variable (SWV)" "Command: Set word variable" "Cmd: Set word variable" "Cmd: SWV" "SWV"
31410654-31411348 amulet_ascii: warning: "Unknown command: 0x00"
31470194-31470888 amulet_ascii: field: "Command: Acknowledgment (ACK)" "Command: Acknowledgment" "Cmd: Acknowledgment" "Cmd: ACK" "ACK"
31470194-31470888 amulet_ascii: ack: "Command: Acknowledgment (ACK)" "Command: Acknowledgment" "Cmd: Acknowledgment" "Cmd: ACK" "ACK"
31471806-31472500 amulet_ascii: field: "Command: Set byte variable (SBV)" "Command: Set byte variable" "Cmd: Set byte variable" "Cmd: SBV" "SBV"
31472668-31473362 amulet_ascii: bit: "Address high nibble: A" "Addr high 0xA" "Addr h 0xA"
31473531-31474225 amulet_ascii: bit: "Address low nibble: 4" "Addr low 0x4" "Addr l 0x4"
31472668-31474225 amulet_ascii: field: "Address: 0xA4" "Addr: 0xA4" "0xA4"
31474394-31475951 amulet_ascii: field: "Value: 0x00" "Val: 0x00" "0x00"
31471806-31475951 amulet_ascii: sbv: "Command: Set byte variable (SBV)" "Command: Set byte variable" "Cmd: Set byte variable" "Cmd: SBV" "SBV"
31503320-31504014 amulet_ascii: field: "Command: Acknowledgment (ACK)" "Command: Acknowledgment" "Cmd: Acknowledgment" "Cmd: ACK" "ACK"
31503320-31504014 amulet_ascii: ack: "Command: Acknowledgment (ACK)" "Command: Acknowledgment" "Cmd: Acknowledgment" "Cmd: ACK" "ACK"
31595507-31596201 amulet_ascii: field: "Command: Set byte variable (SBV)" "Command: Set byte variable" "Cmd: Set byte variable" "Cmd: SBV" "SBV"
31596370-31597064 amulet_ascii: bit: "Address high nibble: A" "Addr high 0xA" "Addr h 0xA"
31597233-31597927 amulet_ascii: bit: "Address low nibble: 5" "Addr low 0x5" "Addr l 0x5"
31596370-31597927 amulet_ascii: field: "Address: 0xA5" "Addr: 0xA5" "0xA5"
31598096-31599653 amulet_ascii: field: "Value: 0x00" "Val: 0x00" "0x00"
31595507-31599653 amulet_ascii: sbv: "Command: Set byte variable (SBV)" "Command: Set byte variable" "Cmd: Set byte variable" "Cmd: SBV" "SBV"
31603128-31603822 amulet_ascii: field: "Command: Acknowledgment (ACK)" "Command: Acknowledgment" "Cmd: Acknowledgment" "Cmd: ACK" "ACK"
31603128-31603822 amulet_ascii: ack: "Command: Acknowledgment (ACK)" "Command: Acknowledgment" "Cmd: Acknowledgment" "Cmd: ACK" "ACK"
31720984-31721678 amulet_ascii: field: "Command: Set byte variable (SBV)" "Command: Set byte variable" "Cmd: Set byte variable" "Cmd: SBV" "SBV"
31721846-31722540 amulet_ascii: bit: "Address high nibble: A" "Addr high 0xA" "Addr h 0xA"
31722709-31723403 amulet_ascii: bit: "Address low nibble: 6" "Addr low 0x6" "Addr l 0x6"
31721846-31723403 amulet_ascii: field: "Address: 0xA6" "Addr: 0xA6" "0xA6"
31723572-31725129 amulet_ascii: field: "Value: 0x00" "Val: 0x00" "0x00"
31720984-31725129 amulet_ascii: sbv: "Command: Set byte variable (SBV)" "Command: Set byte variable" "Cmd: Set byte variable" "Cmd: SBV" "SBV"
31803073-31803767 amulet_ascii: field: "Command: Acknowledgment (ACK)" "Command: Acknowledgment" "Cmd: Acknowledgment" "Cmd: ACK" "ACK"
31803073-31803767 amulet_ascii: ack: "Command: Acknowledgment (ACK)" "Command: Acknowledgment" "Cmd: Acknowledgment" "Cmd: ACK" "ACK"
31908020-31908714 amulet_ascii: field: "Command: Set byte variable (SBV)" "Command: Set byte variable" "Cmd: Set byte variable" "Cmd: SBV" "SBV"
31908883-31909577 amulet_ascii: bit: "Address high nibble: A" "Addr high 0xA" "Addr h 0xA"
31909746-31910440 amulet_ascii: bit: "Address low nibble: 7" "Addr low 0x7" "Addr l 0x7"
31908883-31910440 amulet_ascii: field: "Address: 0xA7" "Addr: 0xA7" "0xA7"
31910609-31912165 amulet_ascii: field: "Value: 0x00" "Val: 0x00" "0x00"
31908020-31912165 amulet_ascii: sbv: "Command: Set byte variable (SBV)" "Command: Set byte variable" "Cmd: Set byte variable" "Cmd: SBV" "SBV"
31913676-31914370 amulet_ascii: field: "Command: Acknowledgment (ACK)" "Command: Acknowledgment" "Cmd: Acknowledgment" "Cmd: ACK" "ACK"
31913676-31914370 amulet_ascii: ack: "Command: Acknowledgment (ACK)" "Command: Acknowledgment" "Cmd: Acknowledgment" "Cmd: ACK" "ACK"
32033008-32033702 amulet_ascii: field: "Command: Set byte variable (SBV)" "Command: Set byte variable" "Cmd: Set byte variable" "Cmd: SBV" "SBV"
32033871-32034565 amulet_ascii: bit: "Address high nibble: B" "Addr high 0xB" "Addr h 0xB"
32034734-32035428 amulet_ascii: bit: "Address low nibble: 0" "Addr low 0x0" "Addr l 0x0"
32033871-32035428 amulet_ascii: field: "Address: 0xB0" "Addr: 0xB0" "0xB0"
32035596-32037153 amulet_ascii: field: "Value: 0x00" "Val: 0x00" "0x00"
32033008-32037153 amulet_ascii: sbv: "Command: Set byte variable (SBV)" "Command: Set byte variable" "Cmd: Set byte variable" "Cmd: SBV" "SBV"
32103028-32103722 amulet_ascii: field: "Command: Acknowledgment (ACK)" "Command: Acknowledgment" "Cmd: Acknowledgment" "Cmd: ACK" "ACK"
32103028-32103722 amulet_ascii: ack: "Command: Acknowledgment (ACK)" "Command: Acknowledgment" "Cmd: Acknowledgment" "Cmd: ACK" "ACK"
32221054-32221748 amulet_ascii: field: "Command: Set string variable (SSV)" "Command: Set string variable" "Cmd: Set string variable" "Cmd: SSV" "SSV"
32221917-32222611 amulet_ascii: bit: "Address high nibble: C" "Addr high 0xC" "Addr h 0xC"
32222780-32223474 amulet_ascii: bit: "Address low nibble: 5" "Addr low 0x5" "Addr l 0x5"
32221917-32223474 amulet_ascii: field: "Address: 0xC5" "Addr: 0xC5" "0xC5"
32223642-32224336 amulet_ascii: bit: "E"
32224505-32225199 amulet_ascii: bit: "N"
32225368-32226062 amulet_ascii: bit: "C"
32226231-32226925 amulet_ascii: bit: "O"
32227093-32227787 amulet_ascii: bit: "R"
32227956-32228650 amulet_ascii: bit: "E"
32228819-32229513 amulet_ascii: bit: " "
32229682-32230376 amulet_ascii: bit: "S"
32230545-32231239 amulet_ascii: bit: "Y"
32231407-32232101 amulet_ascii: bit: "S"
32232270-32232964 amulet_ascii: bit: "T"
32233133-32233827 amulet_ascii: bit: "E"
32233996-32234690 amulet_ascii: bit: "M"
32234858-32235552 amulet_ascii: bit: " "
32235721-32236415 amulet_ascii: bit: "S"
32236584-32237278 amulet_ascii: bit: "T"
32237447-32238141 amulet_ascii: bit: "A"
32238310-32239004 amulet_ascii: bit: "T"
32239172-32239866 amulet_ascii: bit: "U"
32240035-32240729 amulet_ascii: bit: "S"
32240898-32241592 amulet_ascii: bit: " "
32241761-32242455 amulet_ascii: bit: " "
32242623-32243317 amulet_ascii: bit: " "
32243486-32244180 amulet_ascii: bit: " "
32244349-32245043 amulet_ascii: bit: " "
32245212-32245906 amulet_ascii: bit: " "
32246074-32246768 amulet_ascii: bit: "V"
32246937-32247631 amulet_ascii: bit: "e"
32247800-32248494 amulet_ascii: bit: "r"
32248663-32249357 amulet_ascii: bit: " "
32249526-32250220 amulet_ascii: bit: "2"
32250388-32251082 amulet_ascii: bit: "."
32251251-32251945 amulet_ascii: bit: "3"
32252114-32252808 amulet_ascii: bit: "3"
32252977-32253671 amulet_ascii: bit: "."
32253839-32254533 amulet_ascii: bit: "0"
32254702-32255396 amulet_ascii: bit: "1"
32255565-32256259 amulet_ascii: bit: "NULL"
32223642-32256259 amulet_ascii: field: "Value: ENCORE SYSTEM STATUS      Ver 2.33.01" "Val: ENCORE SYSTEM STATUS      Ver 2.33.01" "ENCORE SYSTEM STATUS      Ver 2.33.01"
32221054-32256259 amulet_ascii: ssv: "Command: Set string variable (SSV)" "Command: Set string variable" "Cmd: Set string variable" "Cmd: SSV" "SSV"
32320512-32321206 amulet_ascii: field: "Command: Acknowledgment (ACK)" "Command: Acknowledgment" "Cmd: Acknowledgment" "Cmd: ACK" "ACK"
32320512-32321206 amulet_ascii: ack: "Command: Acknowledgment (ACK)" "Command: Acknowledgment" "Cmd: Acknowledgment" "Cmd: ACK" "ACK"
32408107-32408801 amulet_ascii: field: "Command: Set string variable (SSV)" "Command: Set string variable" "Cmd: Set string variable" "Cmd: SSV" "SSV"
32408970-32409664 amulet_ascii: bit: "Address high nibble: B" "Addr high 0xB" "Addr h 0xB"
32409833-32410527 amulet_ascii: bit: "Address low nibble: 0" "Addr low 0x0" "Addr l 0x0"
32408970-32410527 amulet_ascii: field: "Address: 0xB0" "Addr: 0xB0" "0xB0"
32410695-32411389 amulet_ascii: bit: "E"
32411558-32412252 amulet_ascii: bit: "N"
32412421-32413115 amulet_ascii: bit: "C"
32413284-32413978 amulet_ascii: bit: "O"
32414146-32414840 amulet_ascii: bit: "R"
32415009-32415703 amulet_ascii: bit: "E"
32415872-32416566 amulet_ascii: bit: " "
32416735-32417429 amulet_ascii: bit: "V"
32417598-32418292 amulet_ascii: bit: "P"
32418460-32419154 amulet_ascii: bit: "/"
32419323-32420017 amulet_ascii: bit: "3"
32420186-32420880 amulet_ascii: bit: "G"
32421049-32421743 amulet_ascii: bit: ":"
32421911-32422605 amulet_ascii: bit: " "
32422774-32423468 amulet_ascii: bit: "0"
32423637-32424331 amulet_ascii: bit: " "
32424500-32425194 amulet_ascii: bit: "NULL"
32410695-32425194 amulet_ascii: field: "Value: ENCORE VP/3G: 0 " "Val: ENCORE VP/3G: 0 " "ENCORE VP/3G: 0 "
32408107-32425194 amulet_ascii: ssv: "Command: Set string variable (SSV)" "Command: Set string variable" "Cmd: Set string variable" "Cmd: SSV" "SSV"
32507000-32507694 amulet_ascii: field: "Command: Acknowledgment (ACK)" "Command: Acknowledgment" "Cmd: Acknowledgment" "Cmd: ACK" "ACK"
32507000-32507694 amulet_ascii: ack: "Command: Acknowledgment (ACK)" "Command: Acknowledgment" "Cmd: Acknowledgment" "Cmd: ACK" "ACK"
32595779-32596473 amulet_ascii: field: "Command: Set string variable (SSV)" "Command: Set string variable" "Cmd: Set string variable" "Cmd: SSV" "SSV"
32596641-32597335 amulet_ascii: bit: "Address high nibble: B" "Addr high 0xB" "Addr h 0xB"
32597504-32598198 amulet_ascii: bit: "Address low nibble: 2" "Addr low 0x2" "Addr l 0x2"
32596641-32598198 amulet_ascii: field: "Address: 0xB2" "Addr: 0xB2" "0xB2"
32598367-32599061 amulet_ascii: bit: "E"
32599230-32599924 amulet_ascii: bit: "N"
32600093-32600787 amulet_ascii: bit: "C"
32600955-32601649 amulet_ascii: bit: "O"
32601818-32602512 amulet_ascii: bit: "R"
32602681-32603375 amulet_ascii: bit: "E"
32603544-32604238 amulet_ascii: bit: " "
32604406-32605100 amulet_ascii: bit: "V"
32605269-32605963 amulet_ascii: bit: "P"
32606132-32606826 amulet_ascii: bit: "X"
32606995-32607689 amulet_ascii: bit: "/"
32607857-32608551 amulet_ascii: bit: "3"
32608720-32609414 amulet_ascii: bit: "G"
32609583-32610277 amulet_ascii: bit: ":"
32610446-32611140 amulet_ascii: bit: " "
32611309-32612003 amulet_ascii: bit: "0"
32612171-32612865 amulet_ascii: bit: " "
32613034-32613728 amulet_ascii: bit: "NULL"
32598367-32613728 amulet_ascii: field: "Value: ENCORE VPX/3G: 0 " "Val: ENCORE VPX/3G: 0 " "ENCORE VPX/3G: 0 "
32595779-32613728 amulet_ascii: ssv: "Command: Set string variable (SSV)" "Command: Set string variable" "Cmd: Set string variable" "Cmd: SSV" "SSV"
32617936-32618630 amulet_ascii: field: "Command: Acknowledgment (ACK)" "Command: Acknowledgment" "Cmd: Acknowledgment" "Cmd: ACK" "ACK"
32617936-32618630 amulet_ascii: ack: "Command: Acknowledgment (ACK)" "Command: Acknowledgment" "Cmd: Acknowledgment" "Cmd: ACK" "ACK"
32720690-32721384 amulet_ascii: field: "Command: Set string variable (SSV)" "Command: Set string variable" "Cmd: Set string variable" "Cmd: SSV" "SSV"
32721553-32722247 amulet_ascii: bit: "Address high nibble: B" "Addr high 0xB" "Addr h 0xB"
32722416-32723110 amulet_ascii: bit: "Address low nibble: 4" "Addr low 0x4" "Addr l 0x4"
32721553-32723110 amulet_ascii: field: "Address: 0xB4" "Addr: 0xB4" "0xB4"
32723279-32723973 amulet_ascii: bit: "S"
32724142-32724836 amulet_ascii: bit: "C"
32725004-32725698 amulet_ascii: bit: "R"
32725867-32726561 amulet_ascii: bit: "E"
32726730-32727424 amulet_ascii: bit: "E"
32727593-32728287 amulet_ascii: bit: "N"
32728455-32729149 amulet_ascii: bit: "P"
32729318-32730012 amulet_ascii: bit: "R"
32730181-32730875 amulet_ascii: bit: "O"
32731044-32731738 amulet_ascii: bit: " "
32731907-32732601 amulet_ascii: bit: "I"
32732769-32733463 amulet_ascii: bit: "I"
32733632-32734326 amulet_ascii: bit: "/"
32734495-32735189 amulet_ascii: bit: "3"
32735358-32736052 amulet_ascii: bit: "G"
32736220-32736914 amulet_ascii: bit: ":"
32737083-32737777 amulet_ascii: bit: " "
32737946-32738640 amulet_ascii: bit: "0"
32738809-32739503 amulet_ascii: bit: " "
32739671-32740365 amulet_ascii: bit: "NULL"
32723279-32740365 amulet_ascii: field: "Value: SCREENPRO II/3G: 0 " "Val: SCREENPRO II/3G: 0 " "SCREENPRO II/3G: 0 "
32720690-32740365 amulet_ascii: ssv: "Command: Set string variable (SSV)" "Command: Set string variable" "Cmd: Set string variable" "Cmd: SSV" "SSV"
32812191-32812885 amulet_ascii: field: "Command: Acknowledgment (ACK)" "Command: Acknowledgment" "Cmd: Acknowledgment" "Cmd: ACK" "ACK"
32812191-32812885 amulet_ascii: ack: "Command: Acknowledgment (ACK)" "Command: Acknowledgment" "Cmd: Acknowledgment" "Cmd: ACK" "ACK"
32908134-32908828 amulet_ascii: field: "Command: Set string variable (SSV)" "Command: Set string variable" "Cmd: Set string variable" "Cmd: SSV" "SSV"
32908997-32909691 amulet_ascii: bit: "Address high nibble: B" "Addr high 0xB" "Addr h 0xB"
32909860-32910554 amulet_ascii: bit: "Address low nibble: 6" "Addr low 0x6" "Addr l 0x6"
32908997-32910554 amulet_ascii: field: "Address: 0xB6" "Addr: 0xB6" "0xB6"
32910722-32911416 amulet_ascii: bit: "P"
32911585-32912279 amulet_ascii: bit: "R"
32912448-32913142 amulet_ascii: bit: "E"
32913311-32914005 amulet_ascii: bit: "P"
32914174-32914868 amulet_ascii: bit: "R"
32915036-32915730 amulet_ascii: bit: "O"
32915899-32916593 amulet_ascii: bit: " "
32916762-32917456 amulet_ascii: bit: "I"
32917625-32918319 amulet_ascii: bit: "I"
32918487-32919181 amulet_ascii: bit: ":"
32919350-32920044 amulet_ascii: bit: " "
32920213-32920907 amulet_ascii: bit: "0"
32921076-32921770 amulet_ascii: bit: " "
32921939-32922633 amulet_ascii: bit: "NULL"
32910722-32922633 amulet_ascii: field: "Value: PREPRO II: 0 " "Val: PREPRO II: 0 " "PREPRO II: 0 "
32908134-32922633 amulet_ascii: ssv: "Command: Set string variable (SSV)" "Command: Set string variable" "Cmd: Set string variable" "Cmd: SSV" "SSV"
33005735-33006429 amulet_ascii: field: "Command: Acknowledgment (ACK)" "Command: Acknowledgment" "Cmd: Acknowledgment" "Cmd: ACK" "ACK"
33005735-33006429 amulet_ascii: ack: "Command: Acknowledgment (ACK)" "Command: Acknowledgment" "Cmd: Acknowledgment" "Cmd: ACK" "ACK"
33106088-33106782 amulet_ascii: field: "Command: Set string variable (SSV)" "Command: Set string variable" "Cmd: Set string variable" "Cmd: SSV" "SSV"
33106951-33107645 amulet_ascii: bit: "Address high nibble: B" "Addr high 0xB" "Addr h 0xB"
33107814-33108508 amulet_ascii: bit: "Address low nibble: 8" "Addr low 0x8" "Addr l 0x8"
33106951-33108508 amulet_ascii: field: "Address: 0xB8" "Addr: 0xB8" "0xB8"
33108677-33109371 amulet_ascii: bit: "I"
33109540-33110234 amulet_ascii: bit: "M"
33110402-33111096 amulet_ascii: bit: "A"
33111265-33111959 amulet_ascii: bit: "G"
33112128-33112822 amulet_ascii: bit: "E"
33112991-33113685 amulet_ascii: bit: "P"
33113853-33114547 amulet_ascii: bit: "R"
33114716-33115410 amulet_ascii: bit: "O"
33115579-33116273 amulet_ascii: bit: " "
33116442-33117136 amulet_ascii: bit: "H"
33117305-33117999 amulet_ascii: bit: "D"
33118167-33118861 amulet_ascii: bit: "/"
33119030-33119724 amulet_ascii: bit: "3"
33119893-33120587 amulet_ascii: bit: "G"
33120756-33121450 amulet_ascii: bit: ":"
33121618-33122312 amulet_ascii: bit: " "
33122481-33123175 amulet_ascii: bit: "0"
33123344-33124038 amulet_ascii: bit: "NULL"
33108677-33124038 amulet_ascii: field: "Value: IMAGEPRO HD/3G: 0" "Val: IMAGEPRO HD/3G: 0" "IMAGEPRO HD/3G: 0"
33106088-33124038 amulet_ascii: ssv: "Command: Set string variable (SSV)" "Command: Set string variable" "Cmd: Set string variable" "Cmd: SSV" "SSV"
33206893-33207587 amulet_ascii: field: "Command: Acknowledgment (ACK)" "Command: Acknowledgment" "Cmd: Acknowledgment" "Cmd: ACK" "ACK"
33206893-33207587 amulet_ascii: ack: "Command: Acknowledgment (ACK)" "Command: Acknowledgment" "Cmd: Acknowledgment" "Cmd: ACK" "ACK"
33283244-33283938 amulet_ascii: field: "Command: Set string variable (SSV)" "Command: Set string variable" "Cmd: Set string variable" "Cmd: SSV" "SSV"
33284107-33284801 amulet_ascii: bit: "Address high nibble: B" "Addr high 0xB" "Addr h 0xB"
33284970-33285664 amulet_ascii: bit: "Address low nibble: A" "Addr low 0xA" "Addr l 0xA"
33284107-33285664 amulet_ascii: field: "Address: 0xBA" "Addr: 0xBA" "0xBA"
33285832-33286526 amulet_ascii: bit: "I"
33286695-33287389 amulet_ascii: bit: "M"
33287558-33288252 amulet_ascii: bit: "A"
33288421-33289115 amulet_ascii: bit: "G"
33289283-33289977 amulet_ascii: bit: "E"
33290146-33290840 amulet_ascii: bit: "P"
33291009-33291703 amulet_ascii: bit: "R"
33291872-33292566 amulet_ascii: bit: "O"
33292735-33293429 amulet_ascii: bit: "-"
33293597-33294291 amulet_ascii: bit: "I"
33294460-33295154 amulet_ascii: bit: "I"
33295323-33296017 amulet_ascii: bit: "/"
33296186-33296880 amulet_ascii: bit: "D"
33297048-33297742 amulet_ascii: bit: "U"
33297911-33298605 amulet_ascii: bit: "A"
33298774-33299468 amulet_ascii: bit: "L"
33299637-33300331 amulet_ascii: bit: ":"
33300499-33301193 amulet_ascii: bit: " "
33301362-33302056 amulet_ascii: bit: "0"
33302225-33302919 amulet_ascii: bit: "NULL"
33285832-33302919 amulet_ascii: field: "Value: IMAGEPRO-II/DUAL: 0" "Val: IMAGEPRO-II/DUAL: 0" "IMAGEPRO-II/DUAL: 0"
33283244-33302919 amulet_ascii: ssv: "Command: Set string variable (SSV)" "Command: Set string variable" "Cmd: Set string variable" "Cmd: SSV" "SSV"
33312101-33312795 amulet_ascii: field: "Command: Acknowledgment (ACK)" "Command: Acknowledgment" "Cmd: Acknowledgment" "Cmd: ACK" "ACK"
33312101-33312795 amulet_ascii: ack: "Command: Acknowledgment (ACK)" "Command: Acknowledgment" "Cmd: Acknowledgment" "Cmd: ACK" "ACK"
33418270-33418964 amulet_ascii: field: "Command: Set string variable (SSV)" "Command: Set string variable" "Cmd: Set string variable" "Cmd: SSV" "SSV"
33419133-33419827 amulet_ascii: bit: "Address high nibble: B" "Addr high 0xB" "Addr h 0xB"
33419996-33420690 amulet_ascii: bit: "Address low nibble: C" "Addr low 0xC" "Addr l 0xC"
33419133-33420690 amulet_ascii: field: "Address: 0xBC" "Addr: 0xBC" "0xBC"
33420859-33421553 amulet_ascii: bit: "P"
33421721-33422415 amulet_ascii: bit: "D"
33422584-33423278 amulet_ascii: bit: "S"
33423447-33424141 amulet_ascii: bit: ":"
33424310-33425004 amulet_ascii: bit: " "
33425173-33425867 amulet_ascii: bit: "0"
33426035-33426729 amulet_ascii: bit: "NULL"
33420859-33426729 amulet_ascii: field: "Value: PDS: 0" "Val: PDS: 0" "PDS: 0"
33418270-33426729 amulet_ascii: ssv: "Command: Set string variable (SSV)" "Command: Set string variable" "Cmd: Set string variable" "Cmd: SSV" "SSV"
33506116-33506810 amulet_ascii: field: "Command: Acknowledgment (ACK)" "Command: Acknowledgment" "Cmd: Acknowledgment" "Cmd: ACK" "ACK"
33506116-33506810 amulet_ascii: ack: "Command: Acknowledgment (ACK)" "Command: Acknowledgment" "Cmd: Acknowledgment" "Cmd: ACK" "ACK"
33595784-33596478 amulet_ascii: field: "Command: Set string variable (SSV)" "Command: Set string variable" "Cmd: Set string variable" "Cmd: SSV" "SSV"
33596647-33597341 amulet_ascii: bit: "Address high nibble: B" "Addr high 0xB" "Addr h 0xB"
33597510-33598204 amulet_ascii: bit: "Address low nibble: E" "Addr low 0xE" "Addr l 0xE"
33596647-33598204 amulet_ascii: field: "Address: 0xBE" "Addr: 0xBE" "0xBE"
33598372-33599066 amulet_ascii: bit: "R"
33599235-33599929 amulet_ascii: bit: "O"
33600098-33600792 amulet_ascii: bit: "U"
33600961-33601655 amulet_ascii: bit: "T"
33601823-33602517 amulet_ascii: bit: "E"
33602686-33603380 amulet_ascii: bit: "R"
33603549-33604243 amulet_ascii: bit: "S"
33604412-33605106 amulet_ascii: bit: ":"
33605275-33605969 amulet_ascii: bit: " "
33606137-33606831 amulet_ascii: bit: "0"
33607000-33607694 amulet_ascii: bit: "NULL"
33598372-33607694 amulet_ascii: field: "Value: ROUTERS: 0" "Val: ROUTERS: 0" "ROUTERS: 0"
33595784-33607694 amulet_ascii: ssv: "Command: Set string variable (SSV)" "Command: Set string variable" "Cmd: Set string variable" "Cmd: SSV" "SSV"
33611120-33611814 amulet_ascii: field: "Command: Acknowledgment (ACK)" "Command: Acknowledgment" "Cmd: Acknowledgment" "Cmd: ACK" "ACK"
33611120-33611814 amulet_ascii: ack: "Command: Acknowledgment (ACK)" "Command: Acknowledgment" "Cmd: Acknowledgment" "Cmd: ACK" "ACK"
33730984-33731678 amulet_ascii: field: "Command: Set string variable (SSV)" "Command: Set string variable" "Cmd: Set string variable" "Cmd: SSV" "SSV"
33731847-33732541 amulet_ascii: bit: "Address high nibble: C" "Addr high 0xC" "Addr h 0xC"
33732710-33733404 amulet_ascii: bit: "Address low nibble: 0" "Addr low 0x0" "Addr l 0x0"
33731847-33733404 amulet_ascii: field: "Address: 0xC0" "Addr: 0xC0" "0xC0"
33733572-33734266 amulet_ascii: bit: "F"
33734435-33735129 amulet_ascii: bit: "S"
33735298-33735992 amulet_ascii: bit: "N"
33736161-33736855 amulet_ascii: bit: ":"
33737023-33737717 amulet_ascii: bit: " "
33737886-33738580 amulet_ascii: bit: "0"
33738749-33739443 amulet_ascii: bit: "NULL"
33733572-33739443 amulet_ascii: field: "Value: FSN: 0" "Val: FSN: 0" "FSN: 0"
33730984-33739443 amulet_ascii: ssv: "Command: Set string variable (SSV)" "Command: Set string variable" "Cmd: Set string variable" "Cmd: SSV" "SSV"
33806313-33807007 amulet_ascii: field: "Command: Acknowledgment (ACK)" "Command: Acknowledgment" "Cmd: Acknowledgment" "Cmd: ACK" "ACK"
33806313-33807007 amulet_ascii: ack: "Command: Acknowledgment (ACK)" "Command: Acknowledgment" "Cmd: Acknowledgment" "Cmd: ACK" "ACK"
33908454-33909148 amulet_ascii: field: "Command: Set word variable (SWV)" "Command: Set word variable" "Cmd: Set word variable" "Cmd: SWV" "SWV"
33909317-33910011 amulet_ascii: bit: "Address high nibble: F" "Addr high 0xF" "Addr h 0xF"
33910180-33910874 amulet_ascii: bit: "Address low nibble: F" "Addr low 0xF" "Addr l 0xF"
33909317-33910874 amulet_ascii: field: "Address: 0xFF" "Addr: 0xFF" "0xFF"
33911043-33914325 amulet_ascii: field: "Value: 0x00fe" "Val: 0x00fe" "0x00fe"
33908454-33914325 amulet_ascii: swv: "Command: Set word variable (SWV)" "Command: Set word variable" "Cmd: Set word variable" "Cmd: SWV" "SWV"
33915909-33916603 amulet_ascii: field: "Command: Acknowledgment (ACK)" "Command: Acknowledgment" "Cmd: Acknowledgment" "Cmd: ACK" "ACK"
33915909-33916603 amulet_ascii: ack: "Command: Acknowledgment (ACK)" "Command: Acknowledgment" "Cmd: Acknowledgment" "Cmd: ACK" "ACK"
35679055-35679749 amulet_ascii: field: "Command: Set word variable (SWV)" "Command: Set word variable" "Cmd: Set word variable" "Cmd: SWV" "SWV"
35680006-35680700 amulet_ascii: bit: "Address high nibble: F" "Addr high 0xF" "Addr h 0xF"
35680958-35681652 amulet_ascii: bit: "Address low nibble: F" "Addr low 0xF" "Addr l 0xF"
35680006-35681652 amulet_ascii: field: "Address: 0xFF" "Addr: 0xFF" "0xFF"
35681909-35685457 amulet_ascii: field: "Value: 0x5a5a" "Val: 0x5a5a" "0x5a5a"
35679055-35685457 amulet_ascii: swv: "Command: Set word variable (SWV)" "Command: Set word variable" "Cmd: Set word variable" "Cmd: SWV" "SWV"
35685715-35686409 amulet_ascii: warning: "Unknown command: 0x00"
35686852-35687546 amulet_ascii: field: "Command: Acknowledgment (ACK)" "Command: Acknowledgment" "Cmd: Acknowledgment" "Cmd: ACK" "ACK"
35686852-35687546 amulet_ascii: ack: "Command: Acknowledgment (ACK)" "Command: Acknowledgment" "Cmd: Acknowledgment" "Cmd: ACK" "ACK"
35721521-35722215 amulet_ascii: field: "Command: Set string variable (SSV)" "Command: Set string variable" "Cmd: Set string variable" "Cmd: SSV" "SSV"
35722383-35723077 amulet_ascii: bit: "Address high nibble: 9" "Addr high 0x9" "Addr h 0x9"
35723246-35723940 amulet_ascii: bit: "Address low nibble: A" "Addr low 0xA" "Addr l 0xA"
35722383-35723940 amulet_ascii: field: "Address: 0x9A" "Addr: 0x9A" "0x9A"
35724109-35724803 amulet_ascii: bit: "T"
35724972-35725666 amulet_ascii: bit: "h"
35725834-35726528 amulet_ascii: bit: "e"
35726697-35727391 amulet_ascii: bit: "r"
35727560-35728254 amulet_ascii: bit: "e"
35728423-35729117 amulet_ascii: bit: " "
35729285-35729979 amulet_ascii: bit: "a"
35730148-35730842 amulet_ascii: bit: "r"
35731011-35731705 amulet_ascii: bit: "e"
35731874-35732568 amulet_ascii: bit: " "
35732737-35733431 amulet_ascii: bit: "n"
35733599-35734293 amulet_ascii: bit: "o"
35734462-35735156 amulet_ascii: bit: " "
35735325-35736019 amulet_ascii: bit: "a"
35736188-35736882 amulet_ascii: bit: "c"
35737050-35737744 amulet_ascii: bit: "t"
35737913-35738607 amulet_ascii: bit: "i"
35738776-35739470 amulet_ascii: bit: "v"
35739639-35740333 amulet_ascii: bit: "e"
35740501-35741195 amulet_ascii: bit: " "
35741364-35742058 amulet_ascii: bit: "d"
35742227-35742921 amulet_ascii: bit: "e"
35743090-35743784 amulet_ascii: bit: "s"
35743953-35744647 amulet_ascii: bit: "t"
35744815-35745509 amulet_ascii: bit: "i"
35745678-35746372 amulet_ascii: bit: "n"
35746541-35747235 amulet_ascii: bit: "a"
35747404-35748098 amulet_ascii: bit: "t"
35748266-35748960 amulet_ascii: bit: "i"
35749129-35749823 amulet_ascii: bit: "o"
35749992-35750686 amulet_ascii: bit: "n"
35750855-35751549 amulet_ascii: bit: "s"
35751718-35752412 amulet_ascii: bit: "!"
35752580-35753274 amulet_ascii: bit: "NULL"
35724109-35753274 amulet_ascii: field: "Value: There are no active destinations!" "Val: There are no active destinations!" "There are no active destinations!"
35721521-35753274 amulet_ascii: ssv: "Command: Set string variable (SSV)" "Command: Set string variable" "Cmd: Set string variable" "Cmd: SSV" "SSV"
35782072-35782766 amulet_ascii: field: "Command: Acknowledgment (ACK)" "Command: Acknowledgment" "Cmd: Acknowledgment" "Cmd: ACK" "ACK"
35782072-35782766 amulet_ascii: ack: "Command: Acknowledgment (ACK)" "Command: Acknowledgment" "Cmd: Acknowledgment" "Cmd: ACK" "ACK"
54672515-54673209 amulet_ascii: field: "Command: Set word variable (SWV)" "Command: Set word variable" "Cmd: Set word variable" "Cmd: SWV" "SWV"
54673378-54674072 amulet_ascii: bit: "Address high nibble: F" "Addr high 0xF" "Addr h 0xF"
54674241-54674935 amulet_ascii: bit: "Address low nibble: F" "Addr low 0xF" "Addr l 0xF"
54673378-54674935 amulet_ascii: field: "Address: 0xFF" "Addr: 0xFF" "0xFF"
54675104-54678386 amulet_ascii: field: "Value: 0xffff" "Val: 0xffff" "0xffff"
54672515-54678386 amulet_ascii: swv: "Command: Set word variable (SWV)" "Command: Set word variable" "Cmd: Set word variable" "Cmd: SWV" "SWV"
54688058-54688752 amulet_ascii: field: "Command: Acknowledgment (ACK)" "Command: Acknowledgment" "Cmd: Acknowledgment" "Cmd: ACK" "ACK"
54688058-54688752 amulet_ascii: ack: "Command: Acknowledgment (ACK)" "Command: Acknowledgment" "Cmd: Acknowledgment" "Cmd: ACK" "ACK"
55850197-55850891 amulet_ascii: field: "Command: Set byte variable (SBV)" "Command: Set byte variable" "Cmd: Set byte variable" "Cmd: SBV" "SBV"
55851060-55851754 amulet_ascii: bit: "Address high nibble: A" "Addr high 0xA" "Addr h 0xA"
55851923-55852617 amulet_ascii: bit: "Address low nibble: 0" "Addr low 0x0" "Addr l 0x0"
55851060-55852617 amulet_ascii: field: "Address: 0xA0" "Addr: 0xA0" "0xA0"
55852785-55854342 amulet_ascii: field: "Value: 0x00" "Val: 0x00" "0x00"
55850197-55854342 amulet_ascii: sbv: "Command: Set byte variable (SBV)" "Command: Set byte variable" "Cmd: Set byte variable" "Cmd: SBV" "SBV"
58474941-58475635 amulet_ascii: field: "Command: Set byte variable (SBV)" "Command: Set byte variable" "Cmd: Set byte variable" "Cmd: SBV" "SBV"
58475803-58476497 amulet_ascii: bit: "Address high nibble: A" "Addr high 0xA" "Addr h 0xA"
58476666-58477360 amulet_ascii: bit: "Address low nibble: 0" "Addr low 0x0" "Addr l 0x0"
58475803-58477360 amulet_ascii: field: "Address: 0xA0" "Addr: 0xA0" "0xA0"
58477529-58479086 amulet_ascii: field: "Value: 0x00" "Val: 0x00" "0x00"
58474941-58479086 amulet_ascii: sbv: "Command: Set byte variable (SBV)" "Command: Set byte variable" "Cmd: Set byte variable" "Cmd: SBV" "SBV"
59486125-59486819 amulet_ascii: field: "Command: Acknowledgment (ACK)" "Command: Acknowledgment" "Cmd: Acknowledgment" "Cmd: ACK" "ACK"
59486125-59486819 amulet_ascii: ack: "Command: Acknowledgment (ACK)" "Command: Acknowledgment" "Cmd: Acknowledgment" "Cmd: ACK" "ACK"
59569298-59569992 amulet_ascii: field: "Command: Set word variable (SWV)" "Command: Set word variable" "Cmd: Set word variable" "Cmd: SWV" "SWV"
59600976-59601670 amulet_ascii: warning: "Command aborted by invalid byte" "Abort"
59600976-59601670 amulet_ascii: field: "Command: Set byte variable (SBV)" "Command: Set byte variable" "Cmd: Set byte variable" "Cmd: SBV" "SBV"
59601838-59602532 amulet_ascii: bit: "Address high nibble: A" "Addr high 0xA" "Addr h 0xA"
59602701-59603395 amulet_ascii: bit: "Address low nibble: 1" "Addr low 0x1" "Addr l 0x1"
59601838-59603395 amulet_ascii: field: "Address: 0xA1" "Addr: 0xA1" "0xA1"
59603564-59605121 amulet_ascii: field: "Value: 0x00" "Val: 0x00" "0x00"
59600976-59605121 amulet_ascii: sbv: "Command: Set byte variable (SBV)" "Command: Set byte variable" "Cmd: Set byte variable" "Cmd: SBV" "SBV"
59655060-59655754 amulet_ascii: field: "Command: Acknowledgment (ACK)" "Command: Acknowledgment" "Cmd: Acknowledgment" "Cmd: ACK" "ACK"
59655060-59655754 amulet_ascii: ack: "Command: Acknowledgment (ACK)" "Command: Acknowledgment" "Cmd: Acknowledgment" "Cmd: ACK" "ACK"
59725866-59726560 amulet_ascii: field: "Command: Set byte variable (SBV)" "Command: Set byte variable" "Cmd: Set byte variable" "Cmd: SBV" "SBV"
59726728-59727422 amulet_ascii: bit: "Address high nibble: A" "Addr high 0xA" "Addr h 0xA"
59727591-59728285 amulet_ascii: bit: "Address low nibble: 2" "Addr low 0x2" "Addr l 0x2"
59726728-59728285 amulet_ascii: field: "Address: 0xA2" "Addr: 0xA2" "0xA2"
59728454-59730011 amulet_ascii: field: "Value: 0x00" "Val: 0x00" "0x00"
59725866-59730011 amulet_ascii: sbv: "Command: Set byte variable (SBV)" "Command: Set byte variable" "Cmd: Set byte variable" "Cmd: SBV" "SBV"
59740736-59741430 amulet_ascii: field: "Command: Acknowledgment (ACK)" "Command: Acknowledgment" "Cmd: Acknowledgment" "Cmd: ACK" "ACK"
59740736-59741430 amulet_ascii: ack: "Command: Acknowledgment (ACK)" "Command: Acknowledgment" "Cmd: Acknowledgment" "Cmd: ACK" "ACK"
59741687-59742381 amulet_ascii: field: "Command: Set word variable (SWV)" "Command: Set word variable" "Cmd: Set word variable" "Cmd: SWV" "SWV"
59742638-59743332 amulet_ascii: bit: "Address high nibble: F" "Addr high 0xF" "Addr h 0xF"
59825276-59825970 amulet_ascii: bit: "Address low nibble: F" "Addr low 0xF" "Addr l 0xF"
59742638-59825970 amulet_ascii: field: "Address: 0xFF" "Addr: 0xFF" "0xFF"
59826227-59829775 amulet_ascii: field: "Value: 0x5a5a" "Val: 0x5a5a" "0x5a5a"
59741687-59829775 amulet_ascii: swv: "Command: Set word variable (SWV)" "Command: Set word variable" "Cmd: Set word variable" "Cmd: SWV" "SWV"
59830033-59830727 amulet_ascii: warning: "Unknown command: 0x00"
59850544-59851238 amulet_ascii: field: "Command: Acknowledgment (ACK)" "Command: Acknowledgment" "Cmd: Acknowledgment" "Cmd: ACK" "ACK"
59850544-59851238 amulet_ascii: ack: "Command: Acknowledgment (ACK)" "Command: Acknowledgment" "Cmd: Acknowledgment" "Cmd: ACK" "ACK"
59851700-59852394 amulet_ascii: field: "Command: Set byte variable (SBV)" "Command: Set byte variable" "Cmd: Set byte variable" "Cmd: SBV" "SBV"
59852563-59853257 amulet_ascii: bit: "Address high nibble: A" "Addr high 0xA" "Addr h 0xA"
59853426-59854120 amulet_ascii: bit: "Address low nibble: 3" "Addr low 0x3" "Addr l 0x3"
59852563-59854120 amulet_ascii: field: "Address: 0xA3" "Addr: 0xA3" "0xA3"
59854288-59855845 amulet_ascii: field: "Value: 0x00" "Val: 0x00" "0x00"
59851700-59855845 amulet_ascii: sbv: "Command: Set byte variable (SBV)" "Command: Set byte variable" "Cmd: Set byte variable" "Cmd: SBV" "SBV"
59927927-59928621 amulet_ascii: field: "Command: Acknowledgment (ACK)" "Command: Acknowledgment" "Cmd: Acknowledgment" "Cmd: ACK" "ACK"
59927927-59928621 amulet_ascii: ack: "Command: Acknowledgment (ACK)" "Command: Acknowledgment" "Cmd: Acknowledgment" "Cmd: ACK" "ACK"
60038319-60039013 amulet_ascii: field: "Command: Set byte variable (SBV)" "Command: Set byte variable" "Cmd: Set byte variable" "Cmd: SBV" "SBV"
60039182-60039876 amulet_ascii: bit: "Address high nibble: A" "Addr high 0xA" "Addr h 0xA"
60040044-60040738 amulet_ascii: bit: "Address low nibble: 4" "Addr low 0x4" "Addr l 0x4"
60039182-60040738 amulet_ascii: field: "Address: 0xA4" "Addr: 0xA4" "0xA4"
60040907-60042464 amulet_ascii: field: "Value: 0x00" "Val: 0x00" "0x00"
60038319-60042464 amulet_ascii: sbv: "Command: Set byte variable (SBV)" "Command: Set byte variable" "Cmd: Set byte variable" "Cmd: SBV" "SBV"
60126203-60126897 amulet_ascii: field: "Command: Acknowledgment (ACK)" "Command: Acknowledgment" "Cmd: Acknowledgment" "Cmd: ACK" "ACK"
60126203-60126897 amulet_ascii: ack: "Command: Acknowledgment (ACK)" "Command: Acknowledgment" "Cmd: Acknowledgment" "Cmd: ACK" "ACK"
60225855-60226549 amulet_ascii: field: "Command: Set byte variable (SBV)" "Command: Set byte variable" "Cmd: Set byte variable" "Cmd: SBV" "SBV"
60226718-60227412 amulet_ascii: bit: "Address high nibble: A" "Addr high 0xA" "Addr h 0xA"
60227580-60228274 amulet_ascii: bit: "Address low nibble: 5" "Addr low 0x5" "Addr l 0x5"
60226718-60228274 amulet_ascii: field: "Address: 0xA5" "Addr: 0xA5" "0xA5"
60228443-60230000 amulet_ascii: field: "Value: 0x00" "Val: 0x00" "0x00"
60225855-60230000 amulet_ascii: sbv: "Command: Set byte variable (SBV)" "Command: Set byte variable" "Cmd: Set byte variable" "Cmd: SBV" "SBV"
60231464-60232158 amulet_ascii: field: "Command: Acknowledgment (ACK)" "Command: Acknowledgment" "Cmd: Acknowledgment" "Cmd: ACK" "ACK"
60231464-60232158 amulet_ascii: ack: "Command: Acknowledgment (ACK)" "Command: Acknowledgment" "Cmd: Acknowledgment" "Cmd: ACK" "ACK"
60351054-60351748 amulet_ascii: field: "Command: Set byte variable (SBV)" "Command: Set byte variable" "Cmd: Set byte variable" "Cmd: SBV" "SBV"
60351917-60352611 amulet_ascii: bit: "Address high nibble: A" "Addr high 0xA" "Addr h 0xA"
60352780-60353474 amulet_ascii: bit: "Address low nibble: 6" "Addr low 0x6" "Addr l 0x6"
60351917-60353474 amulet_ascii: field: "Address: 0xA6" "Addr: 0xA6" "0xA6"
60353643-60355199 amulet_ascii: field: "Value: 0x00" "Val: 0x00" "0x00"
60351054-60355199 amulet_ascii: sbv: "Command: Set byte variable (SBV)" "Command: Set byte variable" "Cmd: Set byte variable" "Cmd: SBV" "SBV"
60427713-60428407 amulet_ascii: field: "Command: Acknowledgment (ACK)" "Command: Acknowledgment" "Cmd: Acknowledgment" "Cmd: ACK" "ACK"
60427713-60428407 amulet_ascii: ack: "Command: Acknowledgment (ACK)" "Command: Acknowledgment" "Cmd: Acknowledgment" "Cmd: ACK" "ACK"
60538704-60539398 amulet_ascii: field: "Command: Set byte variable (SBV)" "Command: Set byte variable" "Cmd: Set byte variable" "Cmd: SBV" "SBV"
60539567-60540261 amulet_ascii: bit: "Address high nibble: A" "Addr high 0xA" "Addr h 0xA"
60540430-60541124 amulet_ascii: bit: "Address low nibble: 7" "Addr low 0x7" "Addr l 0x7"
60539567-60541124 amulet_ascii: field: "Address: 0xA7" "Addr: 0xA7" "0xA7"
60541292-60542849 amulet_ascii: field: "Value: 0x00" "Val: 0x00" "0x00"
60538704-60542849 amulet_ascii: sbv: "Command: Set byte variable (SBV)" "Command: Set byte variable" "Cmd: Set byte variable" "Cmd: SBV" "SBV"
60626530-60627224 amulet_ascii: field: "Command: Acknowledgment (ACK)" "Command: Acknowledgment" "Cmd: Acknowledgment" "Cmd: ACK" "ACK"
60626530-60627224 amulet_ascii: ack: "Command: Acknowledgment (ACK)" "Command: Acknowledgment" "Cmd: Acknowledgment" "Cmd: ACK" "ACK"
60726066-60726760 amulet_ascii: field: "Command: Set byte variable (SBV)" "Command: Set byte variable" "Cmd: Set byte variable" "Cmd: SBV" "SBV"
60726929-60727623 amulet_ascii: bit: "Address high nibble: B" "Addr high 0xB" "Addr h 0xB"
60727792-60728486 amulet_ascii: bit: "Address low nibble: 0" "Addr low 0x0" "Addr l 0x0"
60726929-60728486 amulet_ascii: field: "Address: 0xB0" "Addr: 0xB0" "0xB0"
60728655-60730212 amulet_ascii: field: "Value: 0x00" "Val: 0x00" "0x00"
60726066-60730212 amulet_ascii: sbv: "Command: Set byte variable (SBV)" "Command: Set byte variable" "Cmd: Set byte variable" "Cmd: SBV" "SBV"
60731805-60732499 amulet_ascii: field: "Command: Acknowledgment (ACK)" "Command: Acknowledgment" "Cmd: Acknowledgment" "Cmd: ACK" "ACK"
60731805-60732499 amulet_ascii: ack: "Command: Acknowledgment (ACK)" "Command: Acknowledgment" "Cmd: Acknowledgment" "Cmd: ACK" "ACK"
60851385-60852079 amulet_ascii: field: "Command: Set string variable (SSV)" "Command: Set string variable" "Cmd: Set string variable" "Cmd: SSV" "SSV"
60852248-60852942 amulet_ascii: bit: "Address high nibble: C" "Addr high 0xC" "Addr h 0xC"
60853111-60853805 amulet_ascii: bit: "Address low nibble: 5" "Addr low 0x5" "Addr l 0x5"
60852248-60853805 amulet_ascii: field: "Address: 0xC5" "Addr: 0xC5" "0xC5"
60853974-60854668 amulet_ascii: bit: "E"
60854836-60855530 amulet_ascii: bit: "N"
60855699-60856393 amulet_ascii: bit: "C"
60856562-60857256 amulet_ascii: bit: "O"
60857425-60858119 amulet_ascii: bit: "R"
60858287-60858981 amulet_ascii: bit: "E"
60859150-60859844 amulet_ascii: bit: " "
60860013-60860707 amulet_ascii: bit: "S"
60860876-60861570 amulet_ascii: bit: "Y"
60861738-60862432 amulet_ascii: bit: "S"
60862601-60863295 amulet_ascii: bit: "T"
60863464-60864158 amulet_ascii: bit: "E"
60864327-60865021 amulet_ascii: bit: "M"
60865190-60865884 amulet_ascii: bit: " "
60866052-60866746 amulet_ascii: bit: "S"
60866915-60867609 amulet_ascii: bit: "T"
60867778-60868472 amulet_ascii: bit: "A"
60868641-60869335 amulet_ascii: bit: "T"
60869503-60870197 amulet_ascii: bit: "U"
60870366-60871060 amulet_ascii: bit: "S"
60871229-60871923 amulet_ascii: bit: " "
60872092-60872786 amulet_ascii: bit: " "
60872954-60873648 amulet_ascii: bit: " "
60873817-60874511 amulet_ascii: bit: " "
60874680-60875374 amulet_ascii: bit: " "
60875543-60876237 amulet_ascii: bit: " "
60876406-60877100 amulet_ascii: bit: "V"
60877268-60877962 amulet_ascii: bit: "e"
60878131-60878825 amulet_ascii: bit: "r"
60878994-60879688 amulet_ascii: bit: " "
60879857-60880551 amulet_ascii: bit: "2"
60880719-60881413 amulet_ascii: bit: "."
60881582-60882276 amulet_ascii: bit: "3"
60882445-60883139 amulet_ascii: bit: "3"
60883308-60884002 amulet_ascii: bit: "."
60884171-60884865 amulet_ascii: bit: "0"
60885033-60885727 amulet_ascii: bit: "1"
60885896-60886590 amulet_ascii: bit: "NULL"
60853974-60886590 amulet_ascii: field: "Value: ENCORE SYSTEM STATUS      Ver 2.33.01" "Val: ENCORE SYSTEM STATUS      Ver 2.33.01" "ENCORE SYSTEM STATUS      Ver 2.33.01"
60851385-60886590 amulet_ascii: ssv: "Command: Set string variable (SSV)" "Command: Set string variable" "Cmd: Set string variable" "Cmd: SSV" "SSV"
60945090-60945784 amulet_ascii: field: "Command: Acknowledgment (ACK)" "Command: Acknowledgment" "Cmd: Acknowledgment" "Cmd: ACK" "ACK"
60945090-60945784 amulet_ascii: ack: "Command: Acknowledgment (ACK)" "Command: Acknowledgment" "Cmd: Acknowledgment" "Cmd: ACK" "ACK"
61038536-61039230 amulet_ascii: field: "Command: Set string variable (SSV)" "Command: Set string variable" "Cmd: Set string variable" "Cmd: SSV" "SSV"
61039399-61040093 amulet_ascii: bit: "Address high nibble: B" "Addr high 0xB" "Addr h 0xB"
61040261-61040955 amulet_ascii: bit: "Address low nibble: 0" "Addr low 0x0" "Addr l 0x0"
61039399-61040955 amulet_ascii: field: "Address: 0xB0" "Addr: 0xB0" "0xB0"
61041124-61041818 amulet_ascii: bit: "E"
61041987-61042681 amulet_ascii: bit: "N"
61042850-61043544 amulet_ascii: bit: "C"
61043713-61044407 amulet_ascii: bit: "O"
61044575-61045269 amulet_ascii: bit: "R"
61045438-61046132 amulet_ascii: bit: "E"
61046301-61046995 amulet_ascii: bit: " "
61047164-61047858 amulet_ascii: bit: "V"
61048026-61048720 amulet_ascii: bit: "P"
61048889-61049583 amulet_ascii: bit: "/"
61049752-61050446 amulet_ascii: bit: "3"
61050615-61051309 amulet_ascii: bit: "G"
61051477-61052171 amulet_ascii: bit: ":"
61052340-61053034 amulet_ascii: bit: " "
61053203-61053897 amulet_ascii: bit: "0"
61054066-61054760 amulet_ascii: bit: " "
61054929-61055623 amulet_ascii: bit: "NULL"
61041124-61055623 amulet_ascii: field: "Value: ENCORE VP/3G: 0 " "Val: ENCORE VP/3G: 0 " "ENCORE VP/3G: 0 "
61038536-61055623 amulet_ascii: ssv: "Command: Set string variable (SSV)" "Command: Set string variable" "Cmd: Set string variable" "Cmd: SSV" "SSV"
61134026-61134720 amulet_ascii: field: "Command: Acknowledgment (ACK)" "Command: Acknowledgment" "Cmd: Acknowledgment" "Cmd: ACK" "ACK"
61134026-61134720 amulet_ascii: ack: "Command: Acknowledgment (ACK)" "Command: Acknowledgment" "Cmd: Acknowledgment" "Cmd: ACK" "ACK"
61236197-61236891 amulet_ascii: field: "Command: Set string variable (SSV)" "Command: Set string variable" "Cmd: Set string variable" "Cmd: SSV" "SSV"
61237060-61237754 amulet_ascii: bit: "Address high nibble: B" "Addr high 0xB" "Addr h 0xB"
61237923-61238617 amulet_ascii: bit: "Address low nibble: 2" "Addr low 0x2" "Addr l 0x2"
61237060-61238617 amulet_ascii: field: "Address: 0xB2" "Addr: 0xB2" "0xB2"
61238785-61239479 amulet_ascii: bit: "E"
61239648-61240342 amulet_ascii: bit: "N"
61240511-61241205 amulet_ascii: bit: "C"
61241374-61242068 amulet_ascii: bit: "O"
61242237-61242931 amulet_ascii: bit: "R"
61243099-61243793 amulet_ascii: bit: "E"
61243962-61244656 amulet_ascii: bit: " "
61244825-61245519 amulet_ascii: bit: "V"
61245688-61246382 amulet_ascii: bit: "P"
61246550-61247244 amulet_ascii: bit: "X"
61247413-61248107 amulet_ascii: bit: "/"
61248276-61248970 amulet_ascii: bit: "3"
61249139-61249833 amulet_ascii: bit: "G"
61250002-61250696 amulet_ascii: bit: ":"
61250864-61251558 amulet_ascii: bit: " "
61251727-61252421 amulet_ascii: bit: "0"
61252590-61253284 amulet_ascii: bit: " "
61253453-61254147 amulet_ascii: bit: "NULL"
61238785-61254147 amulet_ascii: field: "Value: ENCORE VPX/3G: 0 " "Val: ENCORE VPX/3G: 0 " "ENCORE VPX/3G: 0 "
61236197-61254147 amulet_ascii: ssv: "Command: Set string variable (SSV)" "Command: Set string variable" "Cmd: Set string variable" "Cmd: SSV" "SSV"
61333512-61334206 amulet_ascii: field: "Command: Acknowledgment (ACK)" "Command: Acknowledgment" "Cmd: Acknowledgment" "Cmd: ACK" "ACK"
61333512-61334206 amulet_ascii: ack: "Command: Acknowledgment (ACK)" "Command: Acknowledgment" "Cmd: Acknowledgment" "Cmd: ACK" "ACK"
61413657-61414351 amulet_ascii: field: "Command: Set string variable (SSV)" "Command: Set string variable" "Cmd: Set string variable" "Cmd: SSV" "SSV"
61414519-61415213 amulet_ascii: bit: "Address high nibble: B" "Addr high 0xB" "Addr h 0xB"
61415382-61416076 amulet_ascii: bit: "Address low nibble: 4" "Addr low 0x4" "Addr l 0x4"
61414519-61416076 amulet_ascii: field: "Address: 0xB4" "Addr: 0xB4" "0xB4"
61416245-61416939 amulet_ascii: bit: "S"
61417108-61417802 amulet_ascii: bit: "C"
61417970-61418664 amulet_ascii: bit: "R"
61418833-61419527 amulet_ascii: bit: "E"
61419696-61420390 amulet_ascii: bit: "E"
61420559-61421253 amulet_ascii: bit: "N"
61421422-61422116 amulet_ascii: bit: "P"
61422284-61422978 amulet_ascii: bit: "R"
61423147-61423841 amulet_ascii: bit: "O"
61424010-61424704 amulet_ascii: bit: " "
61424873-61425567 amulet_ascii: bit: "I"
61425735-61426429 amulet_ascii: bit: "I"
61426598-61427292 amulet_ascii: bit: "/"
61427461-61428155 amulet_ascii: bit: "3"
61428324-61429018 amulet_ascii: bit: "G"
61429186-61429880 amulet_ascii: bit: ":"
61430049-61430743 amulet_ascii: bit: " "
61430912-61431606 amulet_ascii: bit: "0"
61431775-61432469 amulet_ascii: bit: " "
61432638-61433332 amulet_ascii: bit: "NULL"
61416245-61433332 amulet_ascii: field: "Value: SCREENPRO II/3G: 0 " "Val: SCREENPRO II/3G: 0 " "SCREENPRO II/3G: 0 "
61413657-61433332 amulet_ascii: ssv: "Command: Set string variable (SSV)" "Command: Set string variable" "Cmd: Set string variable" "Cmd: SSV" "SSV"
61437746-61438440 amulet_ascii: field: "Command: Acknowledgment (ACK)" "Command: Acknowledgment" "Cmd: Acknowledgment" "Cmd: ACK" "ACK"
61437746-61438440 amulet_ascii: ack: "Command: Acknowledgment (ACK)" "Command: Acknowledgment" "Cmd: Acknowledgment" "Cmd: ACK" "ACK"
61548629-61549323 amulet_ascii: field: "Command: Set string variable (SSV)" "Command: Set string variable" "Cmd: Set string variable" "Cmd: SSV" "SSV"
61549491-61550185 amulet_ascii: bit: "Address high nibble: B" "Addr high 0xB" "Addr h 0xB"
61550354-61551048 amulet_ascii: bit: "Address low nibble: 6" "Addr low 0x6" "Addr l 0x6"
61549491-61551048 amulet_ascii: field: "Address: 0xB6" "Addr: 0xB6" "0xB6"
61551217-61551911 amulet_ascii: bit: "P"
61552080-61552774 amulet_ascii: bit: "R"
61552943-61553637 amulet_ascii: bit: "E"
61553805-61554499 amulet_ascii: bit: "P"
61554668-61555362 amulet_ascii: bit: "R"
61555531-61556225 amulet_ascii: bit: "O"
61556394-61557088 amulet_ascii: bit: " "
61557256-61557950 amulet_ascii: bit: "I"
61558119-61558813 amulet_ascii: bit: "I"
61558982-61559676 amulet_ascii: bit: ":"
61559845-61560539 amulet_ascii: bit: " "
61560707-61561401 amulet_ascii: bit: "0"
61561570-61562264 amulet_ascii: bit: " "
61562433-61563127 amulet_ascii: bit: "NULL"
61551217-61563127 amulet_ascii: field: "Value: PREPRO II: 0 " "Val: PREPRO II: 0 " "PREPRO II: 0 "
61548629-61563127 amulet_ascii: ssv: "Command: Set string variable (SSV)" "Command: Set string variable" "Cmd: Set string variable" "Cmd: SSV" "SSV"
61634048-61634742 amulet_ascii: field: "Command: Acknowledgment (ACK)" "Command: Acknowledgment" "Cmd: Acknowledgment" "Cmd: ACK" "ACK"
61634048-61634742 amulet_ascii: ack: "Command: Acknowledgment (ACK)" "Command: Acknowledgment" "Cmd: Acknowledgment" "Cmd: ACK" "ACK"
61726197-61726891 amulet_ascii: field: "Command: Set string variable (SSV)" "Command: Set string variable" "Cmd: Set string variable" "Cmd: SSV" "SSV"
61727059-61727753 amulet_ascii: bit: "Address high nibble: B" "Addr high 0xB" "Addr h 0xB"
61727922-61728616 amulet_ascii: bit: "Address low nibble: 8" "Addr low 0x8" "Addr l 0x8"
61727059-61728616 amulet_ascii: field: "Address: 0xB8" "Addr: 0xB8" "0xB8"
61728785-61729479 amulet_ascii: bit: "I"
61729648-61730342 amulet_ascii: bit: "M"
61730510-61731204 amulet_ascii: bit: "A"
61731373-61732067 amulet_ascii: bit: "G"
61732236-61732930 amulet_ascii: bit: "E"
61733099-61733793 amulet_ascii: bit: "P"
61733962-61734656 amulet_ascii: bit: "R"
61734824-61735518 amulet_ascii: bit: "O"
61735687-61736381 amulet_ascii: bit: " "
61736550-61737244 amulet_ascii: bit: "H"
61737413-61738107 amulet_ascii: bit: "D"
61738275-61738969 amulet_ascii: bit: "/"
61739138-61739832 amulet_ascii: bit: "3"
61740001-61740695 amulet_ascii: bit: "G"
61740864-61741558 amulet_ascii: bit: ":"
61741727-61742421 amulet_ascii: bit: " "
61742589-61743283 amulet_ascii: bit: "0"
61743452-61744146 amulet_ascii: bit: "NULL"
61728785-61744146 amulet_ascii: field: "Value: IMAGEPRO HD/3G: 0" "Val: IMAGEPRO HD/3G: 0" "IMAGEPRO HD/3G: 0"
61726197-61744146 amulet_ascii: ssv: "Command: Set string variable (SSV)" "Command: Set string variable" "Cmd: Set string variable" "Cmd: SSV" "SSV"
61829658-61830352 amulet_ascii: field: "Command: Acknowledgment (ACK)" "Command: Acknowledgment" "Cmd: Acknowledgment" "Cmd: ACK" "ACK"
61829658-61830352 amulet_ascii: ack: "Command: Acknowledgment (ACK)" "Command: Acknowledgment" "Cmd: Acknowledgment" "Cmd: ACK" "ACK"
61976118-61976812 amulet_ascii: field: "Command: Set string variable (SSV)" "Command: Set string variable" "Cmd: Set string variable" "Cmd: SSV" "SSV"
61976981-61977675 amulet_ascii: bit: "Address high nibble: A" "Addr high 0xA" "Addr h 0xA"
61977843-61978537 amulet_ascii: bit: "Address low nibble: 0" "Addr low 0x0" "Addr l 0x0"
61976981-61978537 amulet_ascii: field: "Address: 0xA0" "Addr: 0xA0" "0xA0"
61978706-61979400 amulet_ascii: bit: "H"
61979569-61980263 amulet_ascii: bit: "
"
61980432-61981126 amulet_ascii: bit: "O"
61981295-61981989 amulet_ascii: bit: "
"
61982157-61982851 amulet_ascii: bit: "M"
61983020-61983714 amulet_ascii: bit: "
"
61983883-61984577 amulet_ascii: bit: "E"
61984746-61985440 amulet_ascii: bit: "NULL"
61978706-61985440 amulet_ascii: field: "Value: H
O
M
E" "Val: H
O
M
E" "H
O
M
E"
61976118-61985440 amulet_ascii: ssv: "Command: Set string variable (SSV)" "Command: Set string variable" "Cmd: Set string variable" "Cmd: SSV" "SSV"
62031324-62032018 amulet_ascii: field: "Command: Acknowledgment (ACK)" "Command: Acknowledgment" "Cmd: Acknowledgment" "Cmd: ACK" "ACK"
62031324-62032018 amulet_ascii: ack: "Command: Acknowledgment (ACK)" "Command: Acknowledgment" "Cmd: Acknowledgment" "Cmd: ACK" "ACK"
62101138-62101832 amulet_ascii: field: "Command: Set string variable (SSV)" "Command: Set string variable" "Cmd: Set string variable" "Cmd: SSV" "SSV"
62102001-62102695 amulet_ascii: bit: "Address high nibble: A" "Addr high 0xA" "Addr h 0xA"
62102864-62103558 amulet_ascii: bit: "Address low nibble: 1" "Addr low 0x1" "Addr l 0x1"
62102001-62103558 amulet_ascii: field: "Address: 0xA1" "Addr: 0xA1" "0xA1"
62103727-62104421 amulet_ascii: bit: "R"
62104589-62105283 amulet_ascii: bit: "
"
62105452-62106146 amulet_ascii: bit: "E"
62106315-62107009 amulet_ascii: bit: "
"
62107178-62107872 amulet_ascii: bit: "S"
62108040-62108734 amulet_ascii: bit: "
"
62108903-62109597 amulet_ascii: bit: "E"
62109766-62110460 amulet_ascii: bit: "
"
62110629-62111323 amulet_ascii: bit: "T"
62111492-62112186 amulet_ascii: bit: "NULL"
62103727-62112186 amulet_ascii: field: "Value: R
E
S
E
T" "Val: R
E
S
E
T" "R
E
S
E
T"
62101138-62112186 amulet_ascii: ssv: "Command: Set string variable (SSV)" "Command: Set string variable" "Cmd: Set string variable" "Cmd: SSV" "SSV"
62132244-62132938 amulet_ascii: field: "Command: Acknowledgment (ACK)" "Command: Acknowledgment" "Cmd: Acknowledgment" "Cmd: ACK" "ACK"
62132244-62132938 amulet_ascii: ack: "Command: Acknowledgment (ACK)" "Command: Acknowledgment" "Cmd: Acknowledgment" "Cmd: ACK" "ACK"
62226859-62227553 amulet_ascii: field: "Command: Set string variable (SSV)" "Command: Set string variable" "Cmd: Set string variable" "Cmd: SSV" "SSV"
62227721-62228415 amulet_ascii: bit: "Address high nibble: A" "Addr high 0xA" "Addr h 0xA"
62228584-62229278 amulet_ascii: bit: "Address low nibble: 2" "Addr low 0x2" "Addr l 0x2"
62227721-62229278 amulet_ascii: field: "Address: 0xA2" "Addr: 0xA2" "0xA2"
62229447-62230141 amulet_ascii: bit: "S"
62230310-62231004 amulet_ascii: bit: "W"
62231172-62231866 amulet_ascii: bit: "
"
62232035-62232729 amulet_ascii: bit: "V"
62232898-62233592 amulet_ascii: bit: "
"
62233761-62234455 amulet_ascii: bit: "E"
62234624-62235318 amulet_ascii: bit: "
"
62235486-62236180 amulet_ascii: bit: "R"
62236349-62237043 amulet_ascii: bit: "NULL"
62229447-62237043 amulet_ascii: field: "Value: SW
V
E
R" "Val: SW
V
E
R" "SW
V
E
R"
62226859-62237043 amulet_ascii: ssv: "Command: Set string variable (SSV)" "Command: Set string variable" "Cmd: Set string variable" "Cmd: SSV" "SSV"
62240102-62240796 amulet_ascii: field: "Command: Acknowledgment (ACK)" "Command: Acknowledgment" "Cmd: Acknowledgment" "Cmd: ACK" "ACK"
62240102-62240796 amulet_ascii: ack: "Command: Acknowledgment (ACK)" "Command: Acknowledgment" "Cmd: Acknowledgment" "Cmd: ACK" "ACK"
62351266-62351960 amulet_ascii: field: "Command: Set string variable (SSV)" "Command: Set string variable" "Cmd: Set string variable" "Cmd: SSV" "SSV"
62352129-62352823 amulet_ascii: bit: "Address high nibble: A" "Addr high 0xA" "Addr h 0xA"
62352991-62353685 amulet_ascii: bit: "Address low nibble: 3" "Addr low 0x3" "Addr l 0x3"
62352129-62353685 amulet_ascii: field: "Address: 0xA3" "Addr: 0xA3" "0xA3"
62353854-62354548 amulet_ascii: bit: "D"
62354717-62355411 amulet_ascii: bit: "
"
62355580-62356274 amulet_ascii: bit: "I"
62356442-62357136 amulet_ascii: bit: "
"
62357305-62357999 amulet_ascii: bit: "A"
62358168-62358862 amulet_ascii: bit: "
"
62359031-62359725 amulet_ascii: bit: "G"
62359893-62360587 amulet_ascii: bit: "NULL"
62353854-62360587 amulet_ascii: field: "Value: D
I
A
G" "Val: D
I
A
G" "D
I
A
G"
62351266-62360587 amulet_ascii: ssv: "Command: Set string variable (SSV)" "Command: Set string variable" "Cmd: Set string variable" "Cmd: SSV" "SSV"
62431502-62432196 amulet_ascii: field: "Command: Acknowledgment (ACK)" "Command: Acknowledgment" "Cmd: Acknowledgment" "Cmd: ACK" "ACK"
62431502-62432196 amulet_ascii: ack: "Command: Acknowledgment (ACK)" "Command: Acknowledgment" "Cmd: Acknowledgment" "Cmd: ACK" "ACK"
62538731-62539425 amulet_ascii: field: "Command: Set string variable (SSV)" "Command: Set string variable" "Cmd: Set string variable" "Cmd: SSV" "SSV"
62539594-62540288 amulet_ascii: bit: "Address high nibble: A" "Addr high 0xA" "Addr h 0xA"
62540457-62541151 amulet_ascii: bit: "Address low nibble: 4" "Addr low 0x4" "Addr l 0x4"
62539594-62541151 amulet_ascii: field: "Address: 0xA4" "Addr: 0xA4" "0xA4"
62541320-62542014 amulet_ascii: bit: "D"
62542182-62542876 amulet_ascii: bit: "E"
62543045-62543739 amulet_ascii: bit: "S"
62543908-62544602 amulet_ascii: bit: "T"
62544771-62545465 amulet_ascii: bit: "
"
62545633-62546327 amulet_ascii: bit: "S"
62546496-62547190 amulet_ascii: bit: "E"
62547359-62548053 amulet_ascii: bit: "T"
62548222-62548916 amulet_ascii: bit: "U"
62549084-62549778 amulet_ascii: bit: "P"
62549947-62550641 amulet_ascii: bit: "NULL"
62541320-62550641 amulet_ascii: field: "Value: DEST
SETUP" "Val: DEST
SETUP" "DEST
SETUP"
62538731-62550641 amulet_ascii: ssv: "Command: Set string variable (SSV)" "Command: Set string variable" "Cmd: Set string variable" "Cmd: SSV" "SSV"
62631499-62632193 amulet_ascii: field: "Command: Acknowledgment (ACK)" "Command: Acknowledgment" "Cmd: Acknowledgment" "Cmd: ACK" "ACK"
62631499-62632193 amulet_ascii: ack: "Command: Acknowledgment (ACK)" "Command: Acknowledgment" "Cmd: Acknowledgment" "Cmd: ACK" "ACK"
62726408-62727102 amulet_ascii: field: "Command: Set string variable (SSV)" "Command: Set string variable" "Cmd: Set string variable" "Cmd: SSV" "SSV"
62727271-62727965 amulet_ascii: bit: "Address high nibble: A" "Addr high 0xA" "Addr h 0xA"
62728134-62728828 amulet_ascii: bit: "Address low nibble: 5" "Addr low 0x5" "Addr l 0x5"
62727271-62728828 amulet_ascii: field: "Address: 0xA5" "Addr: 0xA5" "0xA5"
62728997-62729691 amulet_ascii: bit: "N"
62729859-62730553 amulet_ascii: bit: "E"
62730722-62731416 amulet_ascii: bit: "T"
62731585-62732279 amulet_ascii: bit: "W"
62732448-62733142 amulet_ascii: bit: "O"
62733310-62734004 amulet_ascii: bit: "R"
62734173-62734867 amulet_ascii: bit: "K"
62735036-62735730 amulet_ascii: bit: "
"
62735899-62736593 amulet_ascii: bit: "S"
62736761-62737455 amulet_ascii: bit: "E"
62737624-62738318 amulet_ascii: bit: "T"
62738487-62739181 amulet_ascii: bit: "U"
62739350-62740044 amulet_ascii: bit: "P"
62740213-62740907 amulet_ascii: bit: "NULL"
62728997-62740907 amulet_ascii: field: "Value: NETWORK
SETUP" "Val: NETWORK
SETUP" "NETWORK
SETUP"
62726408-62740907 amulet_ascii: ssv: "Command: Set string variable (SSV)" "Command: Set string variable" "Cmd: Set string variable" "Cmd: SSV" "SSV"
62744505-62745199 amulet_ascii: field: "Command: Acknowledgment (ACK)" "Command: Acknowledgment" "Cmd: Acknowledgment" "Cmd: ACK" "ACK"
62744505-62745199 amulet_ascii: ack: "Command: Acknowledgment (ACK)" "Command: Acknowledgment" "Cmd: Acknowledgment" "Cmd: ACK" "ACK"
62851423-62852117 amulet_ascii: field: "Command: Set string variable (SSV)" "Command: Set string variable" "Cmd: Set string variable" "Cmd: SSV" "SSV"
62852286-62852980 amulet_ascii: bit: "Address high nibble: A" "Addr high 0xA" "Addr h 0xA"
62853149-62853843 amulet_ascii: bit: "Address low nibble: 6" "Addr low 0x6" "Addr l 0x6"
62852286-62853843 amulet_ascii: field: "Address: 0xA6" "Addr: 0xA6" "0xA6"
62854011-62854705 amulet_ascii: bit: "I"
62854874-62855568 amulet_ascii: bit: "N"
62855737-62856431 amulet_ascii: bit: "P"
62856600-62857294 amulet_ascii: bit: "U"
62857463-62858157 amulet_ascii: bit: "T"
62858325-62859019 amulet_ascii: bit: "
"
62859188-62859882 amulet_ascii: bit: "P"
62860051-62860745 amulet_ascii: bit: "A"
62860914-62861608 amulet_ascii: bit: "T"
62861776-62862470 amulet_ascii: bit: "C"
62862639-62863333 amulet_ascii: bit: "H"
62863502-62864196 amulet_ascii: bit: "NULL"
62854011-62864196 amulet_ascii: field: "Value: INPUT
PATCH" "Val: INPUT
PATCH" "INPUT
PATCH"
62851423-62864196 amulet_ascii: ssv: "Command: Set string variable (SSV)" "Command: Set string variable" "Cmd: Set string variable" "Cmd: SSV" "SSV"
62933324-62934018 amulet_ascii: field: "Command: Acknowledgment (ACK)" "Command: Acknowledgment" "Cmd: Acknowledgment" "Cmd: ACK" "ACK"
62933324-62934018 amulet_ascii: ack: "Command: Acknowledgment (ACK)" "Command: Acknowledgment" "Cmd: Acknowledgment" "Cmd: ACK" "ACK"
63039068-63039762 amulet_ascii: field: "Command: Set string variable (SSV)" "Command: Set string variable" "Cmd: Set string variable" "Cmd: SSV" "SSV"
63039930-63040624 amulet_ascii: bit: "Address high nibble: A" "Addr high 0xA" "Addr h 0xA"
63040793-63041487 amulet_ascii: bit: "Address low nibble: 7" "Addr low 0x7" "Addr l 0x7"
63039930-63041487 amulet_ascii: field: "Address: 0xA7" "Addr: 0xA7" "0xA7"
63041656-63042350 amulet_ascii: bit: "R"
63042519-63043213 amulet_ascii: bit: "O"
63043381-63044075 amulet_ascii: bit: "U"
63044244-63044938 amulet_ascii: bit: "T"
63045107-63045801 amulet_ascii: bit: "E"
63045970-63046664 amulet_ascii: bit: "R"
63046833-63047527 amulet_ascii: bit: "
"
63047695-63048389 amulet_ascii: bit: "S"
63048558-63049252 amulet_ascii: bit: "E"
63049421-63050115 amulet_ascii: bit: "T"
63050284-63050978 amulet_ascii: bit: "U"
63051146-63051840 amulet_ascii: bit: "P"
63052009-63052703 amulet_ascii: bit: "NULL"
63041656-63052703 amulet_ascii: field: "Value: ROUTER
SETUP" "Val: ROUTER
SETUP" "ROUTER
SETUP"
63039068-63052703 amulet_ascii: ssv: "Command: Set string variable (SSV)" "Command: Set string variable" "Cmd: Set string variable" "Cmd: SSV" "SSV"
63132510-63133204 amulet_ascii: field: "Command: Acknowledgment (ACK)" "Command: Acknowledgment" "Cmd: Acknowledgment" "Cmd: ACK" "ACK"
63132510-63133204 amulet_ascii: ack: "Command: Acknowledgment (ACK)" "Command: Acknowledgment" "Cmd: Acknowledgment" "Cmd: ACK" "ACK"
63226538-63227232 amulet_ascii: field: "Command: Set word variable (SWV)" "Command: Set word variable" "Cmd: Set word variable" "Cmd: SWV" "SWV"
63227401-63228095 amulet_ascii: bit: "Address high nibble: F" "Addr high 0xF" "Addr h 0xF"
63228264-63228958 amulet_ascii: bit: "Address low nibble: F" "Addr low 0xF" "Addr l 0xF"
63227401-63228958 amulet_ascii: field: "Address: 0xFF" "Addr: 0xFF" "0xFF"
63229127-63232409 amulet_ascii: field: "Value: 0x0010" "Val: 0x0010" "0x0010"
63226538-63232409 amulet_ascii: swv: "Command: Set word variable (SWV)" "Command: Set word variable" "Cmd: Set word variable" "Cmd: SWV" "SWV"
63234016-63234710 amulet_ascii: field: "Command: Acknowledgment (ACK)" "Command: Acknowledgment" "Cmd: Acknowledgment" "Cmd: ACK" "ACK"
63234016-63234710 amulet_ascii: ack: "Command: Acknowledgment (ACK)" "Command: Acknowledgment" "Cmd: Acknowledgment" "Cmd: ACK" "ACK"
67418198-67418892 amulet_ascii: field: "Command: Set word variable (SWV)" "Command: Set word variable" "Cmd: Set word variable" "Cmd: SWV" "SWV"
67599662-67600356 amulet_ascii: bit: "Address high nibble: F" "Addr high 0xF" "Addr h 0xF"
67781095-67781789 amulet_ascii: bit: "Address low nibble: F" "Addr low 0xF" "Addr l 0xF"
67599662-67781789 amulet_ascii: field: "Address: 0xFF" "Addr: 0xFF" "0xFF"
67962554-68507532 amulet_ascii: field: "Value: 0x5a5a" "Val: 0x5a5a" "0x5a5a"
67418198-68507532 amulet_ascii: swv: "Command: Set word variable (SWV)" "Command: Set word variable" "Cmd: Set word variable" "Cmd: SWV" "SWV"
68688166-68688860 amulet_ascii: warning: "Unknown command: 0x00"
68689358-68690052 amulet_ascii: field: "Command: Acknowledgment (ACK)" "Command: Acknowledgment" "Cmd: Acknowledgment" "Cmd: ACK" "ACK"
68689358-68690052 amulet_ascii: ack: "Command: Acknowledgment (ACK)" "Command: Acknowledgment" "Cmd: Acknowledgment" "Cmd: ACK" "ACK"
68737716-68738410 amulet_ascii: field: "Command: Set byte variable (SBV)" "Command: Set byte variable" "Cmd: Set byte variable" "Cmd: SBV" "SBV"
68738579-68739273 amulet_ascii: bit: "Address high nibble: A" "Addr high 0xA" "Addr h 0xA"
68739442-68740136 amulet_ascii: bit: "Address low nibble: 0" "Addr low 0x0" "Addr l 0x0"
68738579-68740136 amulet_ascii: field: "Address: 0xA0" "Addr: 0xA0" "0xA0"
68740305-68741861 amulet_ascii: field: "Value: 0x01" "Val: 0x01" "0x01"
68737716-68741861 amulet_ascii: sbv: "Command: Set byte variable (SBV)" "Command: Set byte variable" "Cmd: Set byte variable" "Cmd: SBV" "SBV"
68872587-68873281 amulet_ascii: field: "Command: Acknowledgment (ACK)" "Command: Acknowledgment" "Cmd: Acknowledgment" "Cmd: ACK" "ACK"
68872587-68873281 amulet_ascii: ack: "Command: Acknowledgment (ACK)" "Command: Acknowledgment" "Cmd: Acknowledgment" "Cmd: ACK" "ACK"
68977594-68978288 amulet_ascii: field: "Command: Set byte variable (SBV)" "Command: Set byte variable" "Cmd: Set byte variable" "Cmd: SBV" "SBV"
68978456-68979150 amulet_ascii: bit: "Address high nibble: A" "Addr high 0xA" "Addr h 0xA"
68979319-68980013 amulet_ascii: bit: "Address low nibble: 1" "Addr low 0x1" "Addr l 0x1"
68978456-68980013 amulet_ascii: field: "Address: 0xA1" "Addr: 0xA1" "0xA1"
68980182-68981739 amulet_ascii: field: "Value: 0x01" "Val: 0x01" "0x01"
68977594-68981739 amulet_ascii: sbv: "Command: Set byte variable (SBV)" "Command: Set byte variable" "Cmd: Set byte variable" "Cmd: SBV" "SBV"
69056734-69057428 amulet_ascii: field: "Command: Acknowledgment (ACK)" "Command: Acknowledgment" "Cmd: Acknowledgment" "Cmd: ACK" "ACK"
69056734-69057428 amulet_ascii: ack: "Command: Acknowledgment (ACK)" "Command: Acknowledgment" "Cmd: Acknowledgment" "Cmd: ACK" "ACK"
69165124-69165818 amulet_ascii: field: "Command: Set byte variable (SBV)" "Command: Set byte variable" "Cmd: Set byte variable" "Cmd: SBV" "SBV"
69165987-69166681 amulet_ascii: bit: "Address high nibble: A" "Addr high 0xA" "Addr h 0xA"
69166850-69167544 amulet_ascii: bit: "Address low nibble: 2" "Addr low 0x2" "Addr l 0x2"
69165987-69167544 amulet_ascii: field: "Address: 0xA2" "Addr: 0xA2" "0xA2"
69167712-69169269 amulet_ascii: field: "Value: 0x01" "Val: 0x01" "0x01"
69165124-69169269 amulet_ascii: sbv: "Command: Set byte variable (SBV)" "Command: Set byte variable" "Cmd: Set byte variable" "Cmd: SBV" "SBV"
69240877-69241571 amulet_ascii: field: "Command: Acknowledgment (ACK)" "Command: Acknowledgment" "Cmd: Acknowledgment" "Cmd: ACK" "ACK"
69240877-69241571 amulet_ascii: ack: "Command: Acknowledgment (ACK)" "Command: Acknowledgment" "Cmd: Acknowledgment" "Cmd: ACK" "ACK"
69363344-69364038 amulet_ascii: field: "Command: Set byte variable (SBV)" "Command: Set byte variable" "Cmd: Set byte variable" "Cmd: SBV" "SBV"
69364207-69364901 amulet_ascii: bit: "Address high nibble: A" "Addr high 0xA" "Addr h 0xA"
69365070-69365764 amulet_ascii: bit: "Address low nibble: 3" "Addr low 0x3" "Addr l 0x3"
69364207-69365764 amulet_ascii: field: "Address: 0xA3" "Addr: 0xA3" "0xA3"
69365933-69367489 amulet_ascii: field: "Value: 0x01" "Val: 0x01" "0x01"
69363344-69367489 amulet_ascii: sbv: "Command: Set byte variable (SBV)" "Command: Set byte variable" "Cmd: Set byte variable" "Cmd: SBV" "SBV"
69425008-69425702 amulet_ascii: field: "Command: Acknowledgment (ACK)" "Command: Acknowledgment" "Cmd: Acknowledgment" "Cmd: ACK" "ACK"
69425008-69425702 amulet_ascii: ack: "Command: Acknowledgment (ACK)" "Command: Acknowledgment" "Cmd: Acknowledgment" "Cmd: ACK" "ACK"
69540115-69540809 amulet_ascii: field: "Command: Set byte variable (SBV)" "Command: Set byte variable" "Cmd: Set byte variable" "Cmd: SBV" "SBV"
69540977-69541671 amulet_ascii: bit: "Address high nibble: A" "Addr high 0xA" "Addr h 0xA"
69541840-69542534 amulet_ascii: bit: "Address low nibble: 4" "Addr low 0x4" "Addr l 0x4"
69540977-69542534 amulet_ascii: field: "Address: 0xA4" "Addr: 0xA4" "0xA4"
69542703-69544260 amulet_ascii: field: "Value: 0x01" "Val: 0x01" "0x01"
69540115-69544260 amulet_ascii: sbv: "Command: Set byte variable (SBV)" "Command: Set byte variable" "Cmd: Set byte variable" "Cmd: SBV" "SBV"
69609140-69609834 amulet_ascii: field: "Command: Acknowledgment (ACK)" "Command: Acknowledgment" "Cmd: Acknowledgment" "Cmd: ACK" "ACK"
69609140-69609834 amulet_ascii: ack: "Command: Acknowledgment (ACK)" "Command: Acknowledgment" "Cmd: Acknowledgment" "Cmd: ACK" "ACK"
69727916-69728610 amulet_ascii: field: "Command: Set byte variable (SBV)" "Command: Set byte variable" "Cmd: Set byte variable" "Cmd: SBV" "SBV"
69728779-69729473 amulet_ascii: bit: "Address high nibble: A" "Addr high 0xA" "Addr h 0xA"
69729642-69730336 amulet_ascii: bit: "Address low nibble: 5" "Addr low 0x5" "Addr l 0x5"
69728779-69730336 amulet_ascii: field: "Address: 0xA5" "Addr: 0xA5" "0xA5"
69730505-69732061 amulet_ascii: field: "Value: 0x01" "Val: 0x01" "0x01"
69727916-69732061 amulet_ascii: sbv: "Command: Set byte variable (SBV)" "Command: Set byte variable" "Cmd: Set byte variable" "Cmd: SBV" "SBV"
69793154-69793848 amulet_ascii: field: "Command: Acknowledgment (ACK)" "Command: Acknowledgment" "Cmd: Acknowledgment" "Cmd: ACK" "ACK"
69793154-69793848 amulet_ascii: ack: "Command: Acknowledgment (ACK)" "Command: Acknowledgment" "Cmd: Acknowledgment" "Cmd: ACK" "ACK"
69915197-69915891 amulet_ascii: field: "Command: Set byte variable (SBV)" "Command: Set byte variable" "Cmd: Set byte variable" "Cmd: SBV" "SBV"
69916060-69916754 amulet_ascii: bit: "Address high nibble: A" "Addr high 0xA" "Addr h 0xA"
69916923-69917617 amulet_ascii: bit: "Address low nibble: 6" "Addr low 0x6" "Addr l 0x6"
69916060-69917617 amulet_ascii: field: "Address: 0xA6" "Addr: 0xA6" "0xA6"
69917786-69919342 amulet_ascii: field: "Value: 0x01" "Val: 0x01" "0x01"
69915197-69919342 amulet_ascii: sbv: "Command: Set byte variable (SBV)" "Command: Set byte variable" "Cmd: Set byte variable" "Cmd: SBV" "SBV"
69977286-69977980 amulet_ascii: field: "Command: Acknowledgment (ACK)" "Command: Acknowledgment" "Cmd: Acknowledgment" "Cmd: ACK" "ACK"
69977286-69977980 amulet_ascii: ack: "Command: Acknowledgment (ACK)" "Command: Acknowledgment" "Cmd: Acknowledgment" "Cmd: ACK" "ACK"
70040207-70040901 amulet_ascii: field: "Command: Set byte variable (SBV)" "Command: Set byte variable" "Cmd: Set byte variable" "Cmd: SBV" "SBV"
70041070-70041764 amulet_ascii: bit: "Address high nibble: A" "Addr high 0xA" "Addr h 0xA"
70041932-70042626 amulet_ascii: bit: "Address low nibble: 7" "Addr low 0x7" "Addr l 0x7"
70041070-70042626 amulet_ascii: field: "Address: 0xA7" "Addr: 0xA7" "0xA7"
70042795-70044352 amulet_ascii: field: "Value: 0x01" "Val: 0x01" "0x01"
70040207-70044352 amulet_ascii: sbv: "Command: Set byte variable (SBV)" "Command: Set byte variable" "Cmd: Set byte variable" "Cmd: SBV" "SBV"
70161418-70162112 amulet_ascii: field: "Command: Acknowledgment (ACK)" "Command: Acknowledgment" "Cmd: Acknowledgment" "Cmd: ACK" "ACK"
70161418-70162112 amulet_ascii: ack: "Command: Acknowledgment (ACK)" "Command: Acknowledgment" "Cmd: Acknowledgment" "Cmd: ACK" "ACK"
70227819-70228513 amulet_ascii: field: "Command: Set string variable (SSV)" "Command: Set string variable" "Cmd: Set string variable" "Cmd: SSV" "SSV"
70228681-70229375 amulet_ascii: bit: "Address high nibble: C" "Addr high 0xC" "Addr h 0xC"
70229544-70230238 amulet_ascii: bit: "Address low nibble: 5" "Addr low 0x5" "Addr l 0x5"
70228681-70230238 amulet_ascii: field: "Address: 0xC5" "Addr: 0xC5" "0xC5"
70230407-70231101 amulet_ascii: bit: "S"
70231270-70231964 amulet_ascii: bit: "Y"
70232133-70232827 amulet_ascii: bit: "S"
70232995-70233689 amulet_ascii: bit: "T"
70233858-70234552 amulet_ascii: bit: "E"
70234721-70235415 amulet_ascii: bit: "M"
70235584-70236278 amulet_ascii: bit: " "
70236446-70237140 amulet_ascii: bit: "M"
70237309-70238003 amulet_ascii: bit: "E"
70238172-70238866 amulet_ascii: bit: "N"
70239035-70239729 amulet_ascii: bit: "U"
70239897-70240591 amulet_ascii: bit: " "
70240760-70241454 amulet_ascii: bit: " "
70241623-70242317 amulet_ascii: bit: " "
70242486-70243180 amulet_ascii: bit: " "
70243349-70244043 amulet_ascii: bit: " "
70244211-70244905 amulet_ascii: bit: " "
70245074-70245768 amulet_ascii: bit: " "
70245937-70246631 amulet_ascii: bit: " "
70246800-70247494 amulet_ascii: bit: "NULL"
70230407-70247494 amulet_ascii: field: "Value: SYSTEM MENU        " "Val: SYSTEM MENU        " "SYSTEM MENU        "
70227819-70247494 amulet_ascii: ssv: "Command: Set string variable (SSV)" "Command: Set string variable" "Cmd: Set string variable" "Cmd: SSV" "SSV"
70354539-70355233 amulet_ascii: field: "Command: Acknowledgment (ACK)" "Command: Acknowledgment" "Cmd: Acknowledgment" "Cmd: ACK" "ACK"
70354539-70355233 amulet_ascii: ack: "Command: Acknowledgment (ACK)" "Command: Acknowledgment" "Cmd: Acknowledgment" "Cmd: ACK" "ACK"
70477930-70478624 amulet_ascii: field: "Command: Set byte variable (SBV)" "Command: Set byte variable" "Cmd: Set byte variable" "Cmd: SBV" "SBV"
70478793-70479487 amulet_ascii: bit: "Address high nibble: A" "Addr high 0xA" "Addr h 0xA"
70479655-70480349 amulet_ascii: bit: "Address low nibble: 0" "Addr low 0x0" "Addr l 0x0"
70478793-70480349 amulet_ascii: field: "Address: 0xA0" "Addr: 0xA0" "0xA0"
70480518-70482075 amulet_ascii: field: "Value: 0x01" "Val: 0x01" "0x01"
70477930-70482075 amulet_ascii: sbv: "Command: Set byte variable (SBV)" "Command: Set byte variable" "Cmd: Set byte variable" "Cmd: SBV" "SBV"
70681259-70681953 amulet_ascii: field: "Command: Acknowledgment (ACK)" "Command: Acknowledgment" "Cmd: Acknowledgment" "Cmd: ACK" "ACK"
70681259-70681953 amulet_ascii: ack: "Command: Acknowledgment (ACK)" "Command: Acknowledgment" "Cmd: Acknowledgment" "Cmd: ACK" "ACK"
70790470-70791164 amulet_ascii: field: "Command: Set string variable (SSV)" "Command: Set string variable" "Cmd: Set string variable" "Cmd: SSV" "SSV"
70791333-70792027 amulet_ascii: bit: "Address high nibble: B" "Addr high 0xB" "Addr h 0xB"
70792195-70792889 amulet_ascii: bit: "Address low nibble: 0" "Addr low 0x0" "Addr l 0x0"
70791333-70792889 amulet_ascii: field: "Address: 0xB0" "Addr: 0xB0" "0xB0"
70793058-70793752 amulet_ascii: bit: "M"
70793921-70794615 amulet_ascii: bit: "o"
70794784-70795478 amulet_ascii: bit: "d"
70795647-70796341 amulet_ascii: bit: "i"
70796509-70797203 amulet_ascii: bit: "f"
70797372-70798066 amulet_ascii: bit: "y"
70798235-70798929 amulet_ascii: bit: " "
70799098-70799792 amulet_ascii: bit: "L"
70799960-70800654 amulet_ascii: bit: "a"
70800823-70801517 amulet_ascii: bit: "y"
70801686-70802380 amulet_ascii: bit: "e"
70802549-70803243 amulet_ascii: bit: "r"
70803411-70804105 amulet_ascii: bit: "s"
70804274-70804968 amulet_ascii: bit: " "
70805137-70805831 amulet_ascii: bit: "O"
70806000-70806694 amulet_ascii: bit: "n"
70806863-70807557 amulet_ascii: bit: " "
70807725-70808419 amulet_ascii: bit: "P"
70808588-70809282 amulet_ascii: bit: "r"
70809451-70810145 amulet_ascii: bit: "o"
70810314-70811008 amulet_ascii: bit: "g"
70811176-70811870 amulet_ascii: bit: "r"
70812039-70812733 amulet_ascii: bit: "a"
70812902-70813596 amulet_ascii: bit: "m"
70813765-70814459 amulet_ascii: bit: "NULL"
70793058-70814459 amulet_ascii: field: "Value: Modify Layers On Program" "Val: Modify Layers On Program" "Modify Layers On Program"
70790470-70814459 amulet_ascii: ssv: "Command: Set string variable (SSV)" "Command: Set string variable" "Cmd: Set string variable" "Cmd: SSV" "SSV"
70879102-70879796 amulet_ascii: field: "Command: Acknowledgment (ACK)" "Command: Acknowledgment" "Cmd: Acknowledgment" "Cmd: ACK" "ACK"
70879102-70879796 amulet_ascii: ack: "Command: Acknowledgment (ACK)" "Command: Acknowledgment" "Cmd: Acknowledgment" "Cmd: ACK" "ACK"
70977973-70978667 amulet_ascii: field: "Command: Set byte variable (SBV)" "Command: Set byte variable" "Cmd: Set byte variable" "Cmd: SBV" "SBV"
70978836-70979530 amulet_ascii: bit: "Address high nibble: B" "Addr high 0xB" "Addr h 0xB"
70979699-70980393 amulet_ascii: bit: "Address low nibble: 0" "Addr low 0x0" "Addr l 0x0"
70978836-70980393 amulet_ascii: field: "Address: 0xB0" "Addr: 0xB0" "0xB0"
70980562-70982118 amulet_ascii: field: "Value: 0x01" "Val: 0x01" "0x01"
70977973-70982118 amulet_ascii: sbv: "Command: Set byte variable (SBV)" "Command: Set byte variable" "Cmd: Set byte variable" "Cmd: SBV" "SBV"
72651563-72652257 amulet_ascii: field: "Command: Acknowledgment (ACK)" "Command: Acknowledgment" "Cmd: Acknowledgment" "Cmd: ACK" "ACK"
72651563-72652257 amulet_ascii: ack: "Command: Acknowledgment (ACK)" "Command: Acknowledgment" "Cmd: Acknowledgment" "Cmd: ACK" "ACK"
72728600-72729294 amulet_ascii: field: "Command: Set string variable (SSV)" "Command: Set string variable" "Cmd: Set string variable" "Cmd: SSV" "SSV"
72729463-72730157 amulet_ascii: bit: "Address high nibble: B" "Addr high 0xB" "Addr h 0xB"
72730326-72731020 amulet_ascii: bit: "Address low nibble: 0" "Addr low 0x0" "Addr l 0x0"
72729463-72731020 amulet_ascii: field: "Address: 0xB0" "Addr: 0xB0" "0xB0"
72731188-72731882 amulet_ascii: bit: "M"
72732051-72732745 amulet_ascii: bit: "o"
72732914-72733608 amulet_ascii: bit: "d"
72733777-72734471 amulet_ascii: bit: "i"
72734639-72735333 amulet_ascii: bit: "f"
72735502-72736196 amulet_ascii: bit: "y"
72736365-72737059 amulet_ascii: bit: " "
72737228-72737922 amulet_ascii: bit: "L"
72738090-72738784 amulet_ascii: bit: "a"
72738953-72739647 amulet_ascii: bit: "y"
72739816-72740510 amulet_ascii: bit: "e"
72740679-72741373 amulet_ascii: bit: "r"
72741542-72742236 amulet_ascii: bit: "s"
72742404-72743098 amulet_ascii: bit: " "
72743267-72743961 amulet_ascii: bit: "O"
72744130-72744824 amulet_ascii: bit: "n"
72744993-72745687 amulet_ascii: bit: " "
72745855-72746549 amulet_ascii: bit: "P"
72746718-72747412 amulet_ascii: bit: "r"
72747581-72748275 amulet_ascii: bit: "o"
72748444-72749138 amulet_ascii: bit: "g"
72749306-72750000 amulet_ascii: bit: "r"
72750169-72750863 amulet_ascii: bit: "a"
72751032-72751726 amulet_ascii: bit: "m"
72751895-72752589 amulet_ascii: bit: " "
72752758-72753452 amulet_ascii: bit: " "
72753620-72754314 amulet_ascii: bit: " "
72754483-72755177 amulet_ascii: bit: " "
72755346-72756040 amulet_ascii: bit: "O"
72756209-72756903 amulet_ascii: bit: "f"
72757071-72757765 amulet_ascii: bit: "f"
72757934-72758628 amulet_ascii: bit: "NULL"
72731188-72758628 amulet_ascii: field: "Value: Modify Layers On Program    Off" "Val: Modify Layers On Program    Off" "Modify Layers On Program    Off"
72728600-72758628 amulet_ascii: ssv: "Command: Set string variable (SSV)" "Command: Set string variable" "Cmd: Set string variable" "Cmd: SSV" "SSV"
73053757-73054451 amulet_ascii: field: "Command: Acknowledgment (ACK)" "Command: Acknowledgment" "Cmd: Acknowledgment" "Cmd: ACK" "ACK"
73053757-73054451 amulet_ascii: ack: "Command: Acknowledgment (ACK)" "Command: Acknowledgment" "Cmd: Acknowledgment" "Cmd: ACK" "ACK"
73165889-73166583 amulet_ascii: field: "Command: Set string variable (SSV)" "Command: Set string variable" "Cmd: Set string variable" "Cmd: SSV" "SSV"
73166752-73167446 amulet_ascii: bit: "Address high nibble: B" "Addr high 0xB" "Addr h 0xB"
73167615-73168309 amulet_ascii: bit: "Address low nibble: 2" "Addr low 0x2" "Addr l 0x2"
73166752-73168309 amulet_ascii: field: "Address: 0xB2" "Addr: 0xB2" "0xB2"
73168477-73169171 amulet_ascii: bit: "T"
73169340-73170034 amulet_ascii: bit: "a"
73170203-73170897 amulet_ascii: bit: "l"
73171066-73171760 amulet_ascii: bit: "l"
73171928-73172622 amulet_ascii: bit: "y"
73172791-73173485 amulet_ascii: bit: " "
73173654-73174348 amulet_ascii: bit: "M"
73174517-73175211 amulet_ascii: bit: "o"
73175379-73176073 amulet_ascii: bit: "d"
73176242-73176936 amulet_ascii: bit: "e"
73177105-73177799 amulet_ascii: bit: " "
73177968-73178662 amulet_ascii: bit: " "
73178831-73179525 amulet_ascii: bit: " "
73179693-73180387 amulet_ascii: bit: " "
73180556-73181250 amulet_ascii: bit: " "
73181419-73182113 amulet_ascii: bit: " "
73182282-73182976 amulet_ascii: bit: " "
73183144-73183838 amulet_ascii: bit: " "
73184007-73184701 amulet_ascii: bit: " "
73184870-73185564 amulet_ascii: bit: "NULL"
73168477-73185564 amulet_ascii: field: "Value: Tally Mode         " "Val: Tally Mode         " "Tally Mode         "
73165889-73185564 amulet_ascii: ssv: "Command: Set string variable (SSV)" "Command: Set string variable" "Cmd: Set string variable" "Cmd: SSV" "SSV"
73460462-73461156 amulet_ascii: field: "Command: Acknowledgment (ACK)" "Command: Acknowledgment" "Cmd: Acknowledgment" "Cmd: ACK" "ACK"
73460462-73461156 amulet_ascii: ack: "Command: Acknowledgment (ACK)" "Command: Acknowledgment" "Cmd: Acknowledgment" "Cmd: ACK" "ACK"
73540863-73541557 amulet_ascii: field: "Command: Set string variable (SSV)" "Command: Set string variable" "Cmd: Set string variable" "Cmd: SSV" "SSV"
73541726-73542420 amulet_ascii: bit: "Address high nibble: B" "Addr high 0xB" "Addr h 0xB"
73542589-73543283 amulet_ascii: bit: "Address low nibble: 3" "Addr low 0x3" "Addr l 0x3"
73541726-73543283 amulet_ascii: field: "Address: 0xB3" "Addr: 0xB3" "0xB3"
73543452-73544146 amulet_ascii: bit: " "
73544314-73545008 amulet_ascii: bit: " "
73545177-73545871 amulet_ascii: bit: " "
73546040-73546734 amulet_ascii: bit: " "
73546903-73547597 amulet_ascii: bit: " "
73547765-73548459 amulet_ascii: bit: " "
73548628-73549322 amulet_ascii: bit: " "
73549491-73550185 amulet_ascii: bit: " "
73550354-73551048 amulet_ascii: bit: " "
73551216-73551910 amulet_ascii: bit: "O"
73552079-73552773 amulet_ascii: bit: "f"
73552942-73553636 amulet_ascii: bit: "f"
73553805-73554499 amulet_ascii: bit: "NULL"
73543452-73554499 amulet_ascii: field: "Value:          Off" "Val:          Off" "         Off"
73540863-73554499 amulet_ascii: ssv: "Command: Set string variable (SSV)" "Command: Set string variable" "Cmd: Set string variable" "Cmd: SSV" "SSV"
73782143-73782837 amulet_ascii: field: "Command: Acknowledgment (ACK)" "Command: Acknowledgment" "Cmd: Acknowledgment" "Cmd: ACK" "ACK"
73782143-73782837 amulet_ascii: ack: "Command: Acknowledgment (ACK)" "Command: Acknowledgment" "Cmd: Acknowledgment" "Cmd: ACK" "ACK"
73853474-73854168 amulet_ascii: field: "Command: Set string variable (SSV)" "Command: Set string variable" "Cmd: Set string variable" "Cmd: SSV" "SSV"
73854337-73855031 amulet_ascii: bit: "Address high nibble: A" "Addr high 0xA" "Addr h 0xA"
73855199-73855893 amulet_ascii: bit: "Address low nibble: 8" "Addr low 0x8" "Addr l 0x8"
73854337-73855893 amulet_ascii: field: "Address: 0xA8" "Addr: 0xA8" "0xA8"
73856062-73856756 amulet_ascii: bit: "N"
73856925-73857619 amulet_ascii: bit: "
"
73857788-73858482 amulet_ascii: bit: "a"
73858650-73859344 amulet_ascii: bit: "
"
73859513-73860207 amulet_ascii: bit: "v"
73860376-73861070 amulet_ascii: bit: "
"
73861239-73861933 amulet_ascii: bit: " "
73862101-73862795 amulet_ascii: bit: "NULL"
73856062-73862795 amulet_ascii: field: "Value: N
a
v
 " "Val: N
a
v
 " "N
a
v
 "
73853474-73862795 amulet_ascii: ssv: "Command: Set string variable (SSV)" "Command: Set string variable" "Cmd: Set string variable" "Cmd: SSV" "SSV"
74125176-74125870 amulet_ascii: field: "Command: Acknowledgment (ACK)" "Command: Acknowledgment" "Cmd: Acknowledgment" "Cmd: ACK" "ACK"
74125176-74125870 amulet_ascii: ack: "Command: Acknowledgment (ACK)" "Command: Acknowledgment" "Cmd: Acknowledgment" "Cmd: ACK" "ACK"
74228502-74229196 amulet_ascii: field: "Command: Set string variable (SSV)" "Command: Set string variable" "Cmd: Set string variable" "Cmd: SSV" "SSV"
74229365-74230059 amulet_ascii: bit: "Address high nibble: A" "Addr high 0xA" "Addr h 0xA"
74230228-74230922 amulet_ascii: bit: "Address low nibble: 9" "Addr low 0x9" "Addr l 0x9"
74229365-74230922 amulet_ascii: field: "Address: 0xA9" "Addr: 0xA9" "0xA9"
74231091-74231785 amulet_ascii: bit: "A"
74231953-74232647 amulet_ascii: bit: "
"
74232816-74233510 amulet_ascii: bit: "d"
74233679-74234373 amulet_ascii: bit: "
"
74234542-74235236 amulet_ascii: bit: "j"
74235404-74236098 amulet_ascii: bit: "NULL"
74231091-74236098 amulet_ascii: field: "Value: A
d
j" "Val: A
d
j" "A
d
j"
74228502-74236098 amulet_ascii: ssv: "Command: Set string variable (SSV)" "Command: Set string variable" "Cmd: Set string variable" "Cmd: SSV" "SSV"
74412579-74413273 amulet_ascii: field: "Command: Acknowledgment (ACK)" "Command: Acknowledgment" "Cmd: Acknowledgment" "Cmd: ACK" "ACK"
74412579-74413273 amulet_ascii: ack: "Command: Acknowledgment (ACK)" "Command: Acknowledgment" "Cmd: Acknowledgment" "Cmd: ACK" "ACK"
82802830-82803524 amulet_ascii: field: "Command: Set string variable (SSV)" "Command: Set string variable" "Cmd: Set string variable" "Cmd: SSV" "SSV"
82803693-82804387 amulet_ascii: bit: "Address high nibble: A" "Addr high 0xA" "Addr h 0xA"
82804556-82805250 amulet_ascii: bit: "Address low nibble: 0" "Addr low 0x0" "Addr l 0x0"
82803693-82805250 amulet_ascii: field: "Address: 0xA0" "Addr: 0xA0" "0xA0"
82805419-82806113 amulet_ascii: bit: "H"
82806281-82806975 amulet_ascii: bit: "
"
82807144-82807838 amulet_ascii: bit: "O"
82808007-82808701 amulet_ascii: bit: "
"
82808870-82809564 amulet_ascii: bit: "M"
82809733-82810427 amulet_ascii: bit: "
"
82810595-82811289 amulet_ascii: bit: "E"
82811458-82812152 amulet_ascii: bit: "NULL"
82805419-82812152 amulet_ascii: field: "Value: H
O
M
E" "Val: H
O
M
E" "H
O
M
E"
82802830-82812152 amulet_ascii: ssv: "Command: Set string variable (SSV)" "Command: Set string variable" "Cmd: Set string variable" "Cmd: SSV" "SSV"
82887600-82888294 amulet_ascii: field: "Command: Acknowledgment (ACK)" "Command: Acknowledgment" "Cmd: Acknowledgment" "Cmd: ACK" "ACK"
82887600-82888294 amulet_ascii: ack: "Command: Acknowledgment (ACK)" "Command: Acknowledgment" "Cmd: Acknowledgment" "Cmd: ACK" "ACK"
82980138-82980832 amulet_ascii: field: "Command: Set string variable (SSV)" "Command: Set string variable" "Cmd: Set string variable" "Cmd: SSV" "SSV"
82981001-82981695 amulet_ascii: bit: "Address high nibble: A" "Addr high 0xA" "Addr h 0xA"
82981863-82982557 amulet_ascii: bit: "Address low nibble: 1" "Addr low 0x1" "Addr l 0x1"
82981001-82982557 amulet_ascii: field: "Address: 0xA1" "Addr: 0xA1" "0xA1"
82982726-82983420 amulet_ascii: bit: "C"
82983589-82984283 amulet_ascii: bit: "
"
82984452-82985146 amulet_ascii: bit: "O"
82985315-82986009 amulet_ascii: bit: "
"
82986177-82986871 amulet_ascii: bit: "N"
82987040-82987734 amulet_ascii: bit: "
"
82987903-82988597 amulet_ascii: bit: "S"
82988766-82989460 amulet_ascii: bit: "
"
82989628-82990322 amulet_ascii: bit: "L"
82990491-82991185 amulet_ascii: bit: "NULL"
82982726-82991185 amulet_ascii: field: "Value: C
O
N
S
L" "Val: C
O
N
S
L" "C
O
N
S
L"
82980138-82991185 amulet_ascii: ssv: "Command: Set string variable (SSV)" "Command: Set string variable" "Cmd: Set string variable" "Cmd: SSV" "SSV"
83088045-83088739 amulet_ascii: field: "Command: Acknowledgment (ACK)" "Command: Acknowledgment" "Cmd: Acknowledgment" "Cmd: ACK" "ACK"
83088045-83088739 amulet_ascii: ack: "Command: Acknowledgment (ACK)" "Command: Acknowledgment" "Cmd: Acknowledgment" "Cmd: ACK" "ACK"
83167652-83168346 amulet_ascii: field: "Command: Set string variable (SSV)" "Command: Set string variable" "Cmd: Set string variable" "Cmd: SSV" "SSV"
83168515-83169209 amulet_ascii: bit: "Address high nibble: A" "Addr high 0xA" "Addr h 0xA"
83169378-83170072 amulet_ascii: bit: "Address low nibble: 2" "Addr low 0x2" "Addr l 0x2"
83168515-83170072 amulet_ascii: field: "Address: 0xA2" "Addr: 0xA2" "0xA2"
83170240-83170934 amulet_ascii: bit: "L"
83171103-83171797 amulet_ascii: bit: "
"
83171966-83172660 amulet_ascii: bit: "O"
83172829-83173523 amulet_ascii: bit: "
"
83173692-83174386 amulet_ascii: bit: "C"
83174554-83175248 amulet_ascii: bit: "
"
83175417-83176111 amulet_ascii: bit: "K"
83176280-83176974 amulet_ascii: bit: "NULL"
83170240-83176974 amulet_ascii: field: "Value: L
O
C
K" "Val: L
O
C
K" "L
O
C
K"
83167652-83176974 amulet_ascii: ssv: "Command: Set string variable (SSV)" "Command: Set string variable" "Cmd: Set string variable" "Cmd: SSV" "SSV"
83287532-83288226 amulet_ascii: field: "Command: Acknowledgment (ACK)" "Command: Acknowledgment" "Cmd: Acknowledgment" "Cmd: ACK" "ACK"
83287532-83288226 amulet_ascii: ack: "Command: Acknowledgment (ACK)" "Command: Acknowledgment" "Cmd: Acknowledgment" "Cmd: ACK" "ACK"
83355188-83355882 amulet_ascii: field: "Command: Set string variable (SSV)" "Command: Set string variable" "Cmd: Set string variable" "Cmd: SSV" "SSV"
83356051-83356745 amulet_ascii: bit: "Address high nibble: A" "Addr high 0xA" "Addr h 0xA"
83356914-83357608 amulet_ascii: bit: "Address low nibble: 3" "Addr low 0x3" "Addr l 0x3"
83356051-83357608 amulet_ascii: field: "Address: 0xA3" "Addr: 0xA3" "0xA3"
83357776-83358470 amulet_ascii: bit: "E"
83358639-83359333 amulet_ascii: bit: "
"
83359502-83360196 amulet_ascii: bit: "D"
83360365-83361059 amulet_ascii: bit: "
"
83361227-83361921 amulet_ascii: bit: "I"
83362090-83362784 amulet_ascii: bit: "
"
83362953-83363647 amulet_ascii: bit: "D"
83363816-83364510 amulet_ascii: bit: "NULL"
83357776-83364510 amulet_ascii: field: "Value: E
D
I
D" "Val: E
D
I
D" "E
D
I
D"
83355188-83364510 amulet_ascii: ssv: "Command: Set string variable (SSV)" "Command: Set string variable" "Cmd: Set string variable" "Cmd: SSV" "SSV"
83487076-83487770 amulet_ascii: field: "Command: Acknowledgment (ACK)" "Command: Acknowledgment" "Cmd: Acknowledgment" "Cmd: ACK" "ACK"
83487076-83487770 amulet_ascii: ack: "Command: Acknowledgment (ACK)" "Command: Acknowledgment" "Cmd: Acknowledgment" "Cmd: ACK" "ACK"
83605435-83606129 amulet_ascii: field: "Command: Set string variable (SSV)" "Command: Set string variable" "Cmd: Set string variable" "Cmd: SSV" "SSV"
83606298-83606992 amulet_ascii: bit: "Address high nibble: A" "Addr high 0xA" "Addr h 0xA"
83607161-83607855 amulet_ascii: bit: "Address low nibble: 4" "Addr low 0x4" "Addr l 0x4"
83606298-83607855 amulet_ascii: field: "Address: 0xA4" "Addr: 0xA4" "0xA4"
83608023-83608717 amulet_ascii: bit: "D"
83608886-83609580 amulet_ascii: bit: "E"
83609749-83610443 amulet_ascii: bit: "F"
83610612-83611306 amulet_ascii: bit: "I"
83611474-83612168 amulet_ascii: bit: "N"
83612337-83613031 amulet_ascii: bit: "E"
83613200-83613894 amulet_ascii: bit: "
"
83614063-83614757 amulet_ascii: bit: "V"
83614925-83615619 amulet_ascii: bit: "P"
83615788-83616482 amulet_ascii: bit: " "
83616651-83617345 amulet_ascii: bit: "I"
83617514-83618208 amulet_ascii: bit: "D"
83618377-83619071 amulet_ascii: bit: "NULL"
83608023-83619071 amulet_ascii: field: "Value: DEFINE
VP ID" "Val: DEFINE
VP ID" "DEFINE
VP ID"
83605435-83619071 amulet_ascii: ssv: "Command: Set string variable (SSV)" "Command: Set string variable" "Cmd: Set string variable" "Cmd: SSV" "SSV"
83688884-83689578 amulet_ascii: field: "Command: Acknowledgment (ACK)" "Command: Acknowledgment" "Cmd: Acknowledgment" "Cmd: ACK" "ACK"
83688884-83689578 amulet_ascii: ack: "Command: Acknowledgment (ACK)" "Command: Acknowledgment" "Cmd: Acknowledgment" "Cmd: ACK" "ACK"
83792922-83793616 amulet_ascii: field: "Command: Set string variable (SSV)" "Command: Set string variable" "Cmd: Set string variable" "Cmd: SSV" "SSV"
83793785-83794479 amulet_ascii: bit: "Address high nibble: A" "Addr high 0xA" "Addr h 0xA"
83794648-83795342 amulet_ascii: bit: "Address low nibble: 5" "Addr low 0x5" "Addr l 0x5"
83793785-83795342 amulet_ascii: field: "Address: 0xA5" "Addr: 0xA5" "0xA5"
83795510-83796204 amulet_ascii: bit: "L"
83796373-83797067 amulet_ascii: bit: "C"
83797236-83797930 amulet_ascii: bit: "D"
83798099-83798793 amulet_ascii: bit: "
"
83798961-83799655 amulet_ascii: bit: "S"
83799824-83800518 amulet_ascii: bit: "E"
83800687-83801381 amulet_ascii: bit: "T"
83801550-83802244 amulet_ascii: bit: "T"
83802413-83803107 amulet_ascii: bit: "I"
83803275-83803969 amulet_ascii: bit: "N"
83804138-83804832 amulet_ascii: bit: "G"
83805001-83805695 amulet_ascii: bit: "S"
83805864-83806558 amulet_ascii: bit: "NULL"
83795510-83806558 amulet_ascii: field: "Value: LCD
SETTINGS" "Val: LCD
SETTINGS" "LCD
SETTINGS"
83792922-83806558 amulet_ascii: ssv: "Command: Set string variable (SSV)" "Command: Set string variable" "Cmd: Set string variable" "Cmd: SSV" "SSV"
83890687-83891381 amulet_ascii: field: "Command: Acknowledgment (ACK)" "Command: Acknowledgment" "Cmd: Acknowledgment" "Cmd: ACK" "ACK"
83890687-83891381 amulet_ascii: ack: "Command: Acknowledgment (ACK)" "Command: Acknowledgment" "Cmd: Acknowledgment" "Cmd: ACK" "ACK"
83980409-83981103 amulet_ascii: field: "Command: Set string variable (SSV)" "Command: Set string variable" "Cmd: Set string variable" "Cmd: SSV" "SSV"
83981272-83981966 amulet_ascii: bit: "Address high nibble: A" "Addr high 0xA" "Addr h 0xA"
83982135-83982829 amulet_ascii: bit: "Address low nibble: 6" "Addr low 0x6" "Addr l 0x6"
83981272-83982829 amulet_ascii: field: "Address: 0xA6" "Addr: 0xA6" "0xA6"
83982997-83983691 amulet_ascii: bit: "U"
83983860-83984554 amulet_ascii: bit: "S"
83984723-83985417 amulet_ascii: bit: "E"
83985586-83986280 amulet_ascii: bit: "R"
83986449-83987143 amulet_ascii: bit: "
"
83987311-83988005 amulet_ascii: bit: "P"
83988174-83988868 amulet_ascii: bit: "R"
83989037-83989731 amulet_ascii: bit: "E"
83989900-83990594 amulet_ascii: bit: "F"
83990762-83991456 amulet_ascii: bit: "NULL"
83982997-83991456 amulet_ascii: field: "Value: USER
PREF" "Val: USER
PREF" "USER
PREF"
83980409-83991456 amulet_ascii: ssv: "Command: Set string variable (SSV)" "Command: Set string variable" "Cmd: Set string variable" "Cmd: SSV" "SSV"
84091138-84091832 amulet_ascii: field: "Command: Acknowledgment (ACK)" "Command: Acknowledgment" "Cmd: Acknowledgment" "Cmd: ACK" "ACK"
84091138-84091832 amulet_ascii: ack: "Command: Acknowledgment (ACK)" "Command: Acknowledgment" "Cmd: Acknowledgment" "Cmd: ACK" "ACK"
84168102-84168796 amulet_ascii: field: "Command: Set string variable (SSV)" "Command: Set string variable" "Cmd: Set string variable" "Cmd: SSV" "SSV"
84168965-84169659 amulet_ascii: bit: "Address high nibble: A" "Addr high 0xA" "Addr h 0xA"
84169828-84170522 amulet_ascii: bit: "Address low nibble: 7" "Addr low 0x7" "Addr l 0x7"
84168965-84170522 amulet_ascii: field: "Address: 0xA7" "Addr: 0xA7" "0xA7"
84170691-84171385 amulet_ascii: bit: "B"
84171554-84172248 amulet_ascii: bit: "A"
84172416-84173110 amulet_ascii: bit: "C"
84173279-84173973 amulet_ascii: bit: "K"
84174142-84174836 amulet_ascii: bit: "U"
84175005-84175699 amulet_ascii: bit: "P"
84175867-84176561 amulet_ascii: bit: "
"
84176730-84177424 amulet_ascii: bit: "R"
84177593-84178287 amulet_ascii: bit: "E"
84178456-84179150 amulet_ascii: bit: "S"
84179318-84180012 amulet_ascii: bit: "T"
84180181-84180875 amulet_ascii: bit: "O"
84181044-84181738 amulet_ascii: bit: "R"
84181907-84182601 amulet_ascii: bit: "E"
84182770-84183464 amulet_ascii: bit: "NULL"
84170691-84183464 amulet_ascii: field: "Value: BACKUP
RESTORE" "Val: BACKUP
RESTORE" "BACKUP
RESTORE"
84168102-84183464 amulet_ascii: ssv: "Command: Set string variable (SSV)" "Command: Set string variable" "Cmd: Set string variable" "Cmd: SSV" "SSV"
84293903-84294597 amulet_ascii: field: "Command: Acknowledgment (ACK)" "Command: Acknowledgment" "Cmd: Acknowledgment" "Cmd: ACK" "ACK"
84293903-84294597 amulet_ascii: ack: "Command: Acknowledgment (ACK)" "Command: Acknowledgment" "Cmd: Acknowledgment" "Cmd: ACK" "ACK"
84418078-84418772 amulet_ascii: field: "Command: Set word variable (SWV)" "Command: Set word variable" "Cmd: Set word variable" "Cmd: SWV" "SWV"
84418941-84419635 amulet_ascii: bit: "Address high nibble: F" "Addr high 0xF" "Addr h 0xF"
84419804-84420498 amulet_ascii: bit: "Address low nibble: F" "Addr low 0xF" "Addr l 0xF"
84418941-84420498 amulet_ascii: field: "Address: 0xFF" "Addr: 0xFF" "0xFF"
84420666-84423949 amulet_ascii: field: "Value: 0x0010" "Val: 0x0010" "0x0010"
84418078-84423949 amulet_ascii: swv: "Command: Set word variable (SWV)" "Command: Set word variable" "Cmd: Set word variable" "Cmd: SWV" "SWV"
84490847-84491541 amulet_ascii: field: "Command: Acknowledgment (ACK)" "Command: Acknowledgment" "Cmd: Acknowledgment" "Cmd: ACK" "ACK"
84490847-84491541 amulet_ascii: ack: "Command: Acknowledgment (ACK)" "Command: Acknowledgment" "Cmd: Acknowledgment" "Cmd: ACK" "ACK"
88125576-88126270 amulet_ascii: field: "Command: Set word variable (SWV)" "Command: Set word variable" "Cmd: Set word variable" "Cmd: SWV" "SWV"
88307106-88307800 amulet_ascii: bit: "Address high nibble: F" "Addr high 0xF" "Addr h 0xF"
88488514-88489208 amulet_ascii: bit: "Address low nibble: F" "Addr low 0xF" "Addr l 0xF"
88307106-88489208 amulet_ascii: field: "Address: 0xFF" "Addr: 0xFF" "0xFF"
88669916-89214821 amulet_ascii: field: "Value: 0x5a5a" "Val: 0x5a5a" "0x5a5a"
88125576-89214821 amulet_ascii: swv: "Command: Set word variable (SWV)" "Command: Set word variable" "Cmd: Set word variable" "Cmd: SWV" "SWV"
89395596-89396290 amulet_ascii: warning: "Unknown command: 0x00"
89396774-89397468 amulet_ascii: field: "Command: Acknowledgment (ACK)" "Command: Acknowledgment" "Cmd: Acknowledgment" "Cmd: ACK" "ACK"
89396774-89397468 amulet_ascii: ack: "Command: Acknowledgment (ACK)" "Command: Acknowledgment" "Cmd: Acknowledgment" "Cmd: ACK" "ACK"
89421263-89421957 amulet_ascii: field: "Command: Set byte variable (SBV)" "Command: Set byte variable" "Cmd: Set byte variable" "Cmd: SBV" "SBV"
89422126-89422820 amulet_ascii: bit: "Address high nibble: A" "Addr high 0xA" "Addr h 0xA"
89422989-89423683 amulet_ascii: bit: "Address low nibble: 0" "Addr low 0x0" "Addr l 0x0"
89422126-89423683 amulet_ascii: field: "Address: 0xA0" "Addr: 0xA0" "0xA0"
89423851-89425408 amulet_ascii: field: "Value: 0x01" "Val: 0x01" "0x01"
89421263-89425408 amulet_ascii: sbv: "Command: Set byte variable (SBV)" "Command: Set byte variable" "Cmd: Set byte variable" "Cmd: SBV" "SBV"
89580016-89580710 amulet_ascii: field: "Command: Acknowledgment (ACK)" "Command: Acknowledgment" "Cmd: Acknowledgment" "Cmd: ACK" "ACK"
89580016-89580710 amulet_ascii: ack: "Command: Acknowledgment (ACK)" "Command: Acknowledgment" "Cmd: Acknowledgment" "Cmd: ACK" "ACK"
89679340-89680034 amulet_ascii: field: "Command: Set byte variable (SBV)" "Command: Set byte variable" "Cmd: Set byte variable" "Cmd: SBV" "SBV"
89680203-89680897 amulet_ascii: bit: "Address high nibble: A" "Addr high 0xA" "Addr h 0xA"
89681066-89681760 amulet_ascii: bit: "Address low nibble: 1" "Addr low 0x1" "Addr l 0x1"
89680203-89681760 amulet_ascii: field: "Address: 0xA1" "Addr: 0xA1" "0xA1"
89681928-89683485 amulet_ascii: field: "Value: 0x01" "Val: 0x01" "0x01"
89679340-89683485 amulet_ascii: sbv: "Command: Set byte variable (SBV)" "Command: Set byte variable" "Cmd: Set byte variable" "Cmd: SBV" "SBV"
89764148-89764842 amulet_ascii: field: "Command: Acknowledgment (ACK)" "Command: Acknowledgment" "Cmd: Acknowledgment" "Cmd: ACK" "ACK"
89764148-89764842 amulet_ascii: ack: "Command: Acknowledgment (ACK)" "Command: Acknowledgment" "Cmd: Acknowledgment" "Cmd: ACK" "ACK"
89856561-89857255 amulet_ascii: field: "Command: Set byte variable (SBV)" "Command: Set byte variable" "Cmd: Set byte variable" "Cmd: SBV" "SBV"
89857423-89858117 amulet_ascii: bit: "Address high nibble: A" "Addr high 0xA" "Addr h 0xA"
89858286-89858980 amulet_ascii: bit: "Address low nibble: 2" "Addr low 0x2" "Addr l 0x2"
89857423-89858980 amulet_ascii: field: "Address: 0xA2" "Addr: 0xA2" "0xA2"
89859149-89860706 amulet_ascii: field: "Value: 0x01" "Val: 0x01" "0x01"
89856561-89860706 amulet_ascii: sbv: "Command: Set byte variable (SBV)" "Command: Set byte variable" "Cmd: Set byte variable" "Cmd: SBV" "SBV"
89948162-89948856 amulet_ascii: field: "Command: Acknowledgment (ACK)" "Command: Acknowledgment" "Cmd: Acknowledgment" "Cmd: ACK" "ACK"
89948162-89948856 amulet_ascii: ack: "Command: Acknowledgment (ACK)" "Command: Acknowledgment" "Cmd: Acknowledgment" "Cmd: ACK" "ACK"
90044026-90044720 amulet_ascii: field: "Command: Set byte variable (SBV)" "Command: Set byte variable" "Cmd: Set byte variable" "Cmd: SBV" "SBV"
90044889-90045583 amulet_ascii: bit: "Address high nibble: A" "Addr high 0xA" "Addr h 0xA"
90045752-90046446 amulet_ascii: bit: "Address low nibble: 3" "Addr low 0x3" "Addr l 0x3"
90044889-90046446 amulet_ascii: field: "Address: 0xA3" "Addr: 0xA3" "0xA3"
90046614-90048171 amulet_ascii: field: "Value: 0x01" "Val: 0x01" "0x01"
90044026-90048171 amulet_ascii: sbv: "Command: Set byte variable (SBV)" "Command: Set byte variable" "Cmd: Set byte variable" "Cmd: SBV" "SBV"
90132294-90132988 amulet_ascii: field: "Command: Acknowledgment (ACK)" "Command: Acknowledgment" "Cmd: Acknowledgment" "Cmd: ACK" "ACK"
90132294-90132988 amulet_ascii: ack: "Command: Acknowledgment (ACK)" "Command: Acknowledgment" "Cmd: Acknowledgment" "Cmd: ACK" "ACK"
90231546-90232240 amulet_ascii: field: "Command: Set byte variable (SBV)" "Command: Set byte variable" "Cmd: Set byte variable" "Cmd: SBV" "SBV"
90232409-90233103 amulet_ascii: bit: "Address high nibble: A" "Addr high 0xA" "Addr h 0xA"
90233271-90233965 amulet_ascii: bit: "Address low nibble: 4" "Addr low 0x4" "Addr l 0x4"
90232409-90233965 amulet_ascii: field: "Address: 0xA4" "Addr: 0xA4" "0xA4"
90234134-90235691 amulet_ascii: field: "Value: 0x01" "Val: 0x01" "0x01"
90231546-90235691 amulet_ascii: sbv: "Command: Set byte variable (SBV)" "Command: Set byte variable" "Cmd: Set byte variable" "Cmd: SBV" "SBV"
90316441-90317135 amulet_ascii: field: "Command: Acknowledgment (ACK)" "Command: Acknowledgment" "Cmd: Acknowledgment" "Cmd: ACK" "ACK"
90316441-90317135 amulet_ascii: ack: "Command: Acknowledgment (ACK)" "Command: Acknowledgment" "Cmd: Acknowledgment" "Cmd: ACK" "ACK"
90419071-90419765 amulet_ascii: field: "Command: Set byte variable (SBV)" "Command: Set byte variable" "Cmd: Set byte variable" "Cmd: SBV" "SBV"
90419934-90420628 amulet_ascii: bit: "Address high nibble: A" "Addr high 0xA" "Addr h 0xA"
90420796-90421490 amulet_ascii: bit: "Address low nibble: 5" "Addr low 0x5" "Addr l 0x5"
90419934-90421490 amulet_ascii: field: "Address: 0xA5" "Addr: 0xA5" "0xA5"
90421659-90423216 amulet_ascii: field: "Value: 0x01" "Val: 0x01" "0x01"
90419071-90423216 amulet_ascii: sbv: "Command: Set byte variable (SBV)" "Command: Set byte variable" "Cmd: Set byte variable" "Cmd: SBV" "SBV"
90500573-90501267 amulet_ascii: field: "Command: Acknowledgment (ACK)" "Command: Acknowledgment" "Cmd: Acknowledgment" "Cmd: ACK" "ACK"
90500573-90501267 amulet_ascii: ack: "Command: Acknowledgment (ACK)" "Command: Acknowledgment" "Cmd: Acknowledgment" "Cmd: ACK" "ACK"
90616879-90617573 amulet_ascii: field: "Command: Set byte variable (SBV)" "Command: Set byte variable" "Cmd: Set byte variable" "Cmd: SBV" "SBV"
90617741-90618435 amulet_ascii: bit: "Address high nibble: A" "Addr high 0xA" "Addr h 0xA"
90618604-90619298 amulet_ascii: bit: "Address low nibble: 6" "Addr low 0x6" "Addr l 0x6"
90617741-90619298 amulet_ascii: field: "Address: 0xA6" "Addr: 0xA6" "0xA6"
90619467-90621024 amulet_ascii: field: "Value: 0x01" "Val: 0x01" "0x01"
90616879-90621024 amulet_ascii: sbv: "Command: Set byte variable (SBV)" "Command: Set byte variable" "Cmd: Set byte variable" "Cmd: SBV" "SBV"
90684700-90685394 amulet_ascii: field: "Command: Acknowledgment (ACK)" "Command: Acknowledgment" "Cmd: Acknowledgment" "Cmd: ACK" "ACK"
90684700-90685394 amulet_ascii: ack: "Command: Acknowledgment (ACK)" "Command: Acknowledgment" "Cmd: Acknowledgment" "Cmd: ACK" "ACK"
90794094-90794788 amulet_ascii: field: "Command: Set byte variable (SBV)" "Command: Set byte variable" "Cmd: Set byte variable" "Cmd: SBV" "SBV"
90794957-90795651 amulet_ascii: bit: "Address high nibble: A" "Addr high 0xA" "Addr h 0xA"
90795819-90796513 amulet_ascii: bit: "Address low nibble: 7" "Addr low 0x7" "Addr l 0x7"
90794957-90796513 amulet_ascii: field: "Address: 0xA7" "Addr: 0xA7" "0xA7"
90796682-90798239 amulet_ascii: field: "Value: 0x01" "Val: 0x01" "0x01"
90794094-90798239 amulet_ascii: sbv: "Command: Set byte variable (SBV)" "Command: Set byte variable" "Cmd: Set byte variable" "Cmd: SBV" "SBV"
90868847-90869541 amulet_ascii: field: "Command: Acknowledgment (ACK)" "Command: Acknowledgment" "Cmd: Acknowledgment" "Cmd: ACK" "ACK"
90868847-90869541 amulet_ascii: ack: "Command: Acknowledgment (ACK)" "Command: Acknowledgment" "Cmd: Acknowledgment" "Cmd: ACK" "ACK"
90981841-90982535 amulet_ascii: field: "Command: Set string variable (SSV)" "Command: Set string variable" "Cmd: Set string variable" "Cmd: SSV" "SSV"
90982704-90983398 amulet_ascii: bit: "Address high nibble: C" "Addr high 0xC" "Addr h 0xC"
90983567-90984261 amulet_ascii: bit: "Address low nibble: 5" "Addr low 0x5" "Addr l 0x5"
90982704-90984261 amulet_ascii: field: "Address: 0xC5" "Addr: 0xC5" "0xC5"
90984430-90985124 amulet_ascii: bit: "M"
90985293-90985987 amulet_ascii: bit: "I"
90986155-90986849 amulet_ascii: bit: "S"
90987018-90987712 amulet_ascii: bit: "C"
90987881-90988575 amulet_ascii: bit: "E"
90988744-90989438 amulet_ascii: bit: "L"
90989606-90990300 amulet_ascii: bit: "L"
90990469-90991163 amulet_ascii: bit: "A"
90991332-90992026 amulet_ascii: bit: "N"
90992195-90992889 amulet_ascii: bit: "E"
90993057-90993751 amulet_ascii: bit: "O"
90993920-90994614 amulet_ascii: bit: "U"
90994783-90995477 amulet_ascii: bit: "S"
90995646-90996340 amulet_ascii: bit: " "
90996509-90997203 amulet_ascii: bit: "M"
90997371-90998065 amulet_ascii: bit: "E"
90998234-90998928 amulet_ascii: bit: "N"
90999097-90999791 amulet_ascii: bit: "U"
90999960-91000654 amulet_ascii: bit: "NULL"
90984430-91000654 amulet_ascii: field: "Value: MISCELLANEOUS MENU" "Val: MISCELLANEOUS MENU" "MISCELLANEOUS MENU"
90981841-91000654 amulet_ascii: ssv: "Command: Set string variable (SSV)" "Command: Set string variable" "Cmd: Set string variable" "Cmd: SSV" "SSV"
91061329-91062023 amulet_ascii: field: "Command: Acknowledgment (ACK)" "Command: Acknowledgment" "Cmd: Acknowledgment" "Cmd: ACK" "ACK"
91061329-91062023 amulet_ascii: ack: "Command: Acknowledgment (ACK)" "Command: Acknowledgment" "Cmd: Acknowledgment" "Cmd: ACK" "ACK"
108172839-108173533 amulet_ascii: field: "Command: Set string variable (SSV)" "Command: Set string variable" "Cmd: Set string variable" "Cmd: SSV" "SSV"
108173702-108174396 amulet_ascii: bit: "Address high nibble: A" "Addr high 0xA" "Addr h 0xA"
108174564-108175258 amulet_ascii: bit: "Address low nibble: 0" "Addr low 0x0" "Addr l 0x0"
108173702-108175258 amulet_ascii: field: "Address: 0xA0" "Addr: 0xA0" "0xA0"
108175427-108176121 amulet_ascii: bit: "H"
108176290-108176984 amulet_ascii: bit: "
"
108177153-108177847 amulet_ascii: bit: "O"
108178015-108178709 amulet_ascii: bit: "
"
108178878-108179572 amulet_ascii: bit: "M"
108179741-108180435 amulet_ascii: bit: "
"
108180604-108181298 amulet_ascii: bit: "E"
108181466-108182160 amulet_ascii: bit: "NULL"
108175427-108182160 amulet_ascii: field: "Value: H
O
M
E" "Val: H
O
M
E" "H
O
M
E"
108172839-108182160 amulet_ascii: ssv: "Command: Set string variable (SSV)" "Command: Set string variable" "Cmd: Set string variable" "Cmd: SSV" "SSV"
108195459-108196153 amulet_ascii: field: "Command: Acknowledgment (ACK)" "Command: Acknowledgment" "Cmd: Acknowledgment" "Cmd: ACK" "ACK"
108195459-108196153 amulet_ascii: ack: "Command: Acknowledgment (ACK)" "Command: Acknowledgment" "Cmd: Acknowledgment" "Cmd: ACK" "ACK"
108297306-108298000 amulet_ascii: field: "Command: Set string variable (SSV)" "Command: Set string variable" "Cmd: Set string variable" "Cmd: SSV" "SSV"
108298168-108298862 amulet_ascii: bit: "Address high nibble: A" "Addr high 0xA" "Addr h 0xA"
108299031-108299725 amulet_ascii: bit: "Address low nibble: 4" "Addr low 0x4" "Addr l 0x4"
108298168-108299725 amulet_ascii: field: "Address: 0xA4" "Addr: 0xA4" "0xA4"
108299894-108300588 amulet_ascii: bit: "A"
108300757-108301451 amulet_ascii: bit: "L"
108301619-108302313 amulet_ascii: bit: "L"
108302482-108303176 amulet_ascii: bit: "
"
108303345-108304039 amulet_ascii: bit: "O"
108304208-108304902 amulet_ascii: bit: "N"
108305071-108305765 amulet_ascii: bit: "NULL"
108299894-108305765 amulet_ascii: field: "Value: ALL
ON" "Val: ALL
ON" "ALL
ON"
108297306-108305765 amulet_ascii: ssv: "Command: Set string variable (SSV)" "Command: Set string variable" "Cmd: Set string variable" "Cmd: SSV" "SSV"
108384749-108385443 amulet_ascii: field: "Command: Acknowledgment (ACK)" "Command: Acknowledgment" "Cmd: Acknowledgment" "Cmd: ACK" "ACK"
108384749-108385443 amulet_ascii: ack: "Command: Acknowledgment (ACK)" "Command: Acknowledgment" "Cmd: Acknowledgment" "Cmd: ACK" "ACK"
108485010-108485704 amulet_ascii: field: "Command: Set string variable (SSV)" "Command: Set string variable" "Cmd: Set string variable" "Cmd: SSV" "SSV"
108485873-108486567 amulet_ascii: bit: "Address high nibble: A" "Addr high 0xA" "Addr h 0xA"
108486735-108487429 amulet_ascii: bit: "Address low nibble: 5" "Addr low 0x5" "Addr l 0x5"
108485873-108487429 amulet_ascii: field: "Address: 0xA5" "Addr: 0xA5" "0xA5"
108487598-108488292 amulet_ascii: bit: "A"
108488461-108489155 amulet_ascii: bit: "L"
108489324-108490018 amulet_ascii: bit: "L"
108490186-108490880 amulet_ascii: bit: "
"
108491049-108491743 amulet_ascii: bit: "O"
108491912-108492606 amulet_ascii: bit: "F"
108492775-108493469 amulet_ascii: bit: "F"
108493637-108494331 amulet_ascii: bit: "NULL"
108487598-108494331 amulet_ascii: field: "Value: ALL
OFF" "Val: ALL
OFF" "ALL
OFF"
108485010-108494331 amulet_ascii: ssv: "Command: Set string variable (SSV)" "Command: Set string variable" "Cmd: Set string variable" "Cmd: SSV" "SSV"
108574529-108575223 amulet_ascii: field: "Command: Acknowledgment (ACK)" "Command: Acknowledgment" "Cmd: Acknowledgment" "Cmd: ACK" "ACK"
108574529-108575223 amulet_ascii: ack: "Command: Acknowledgment (ACK)" "Command: Acknowledgment" "Cmd: Acknowledgment" "Cmd: ACK" "ACK"
108672795-108673489 amulet_ascii: field: "Command: Set word variable (SWV)" "Command: Set word variable" "Cmd: Set word variable" "Cmd: SWV" "SWV"
108673658-108674352 amulet_ascii: bit: "Address high nibble: F" "Addr high 0xF" "Addr h 0xF"
108674521-108675215 amulet_ascii: bit: "Address low nibble: F" "Addr low 0xF" "Addr l 0xF"
108673658-108675215 amulet_ascii: field: "Address: 0xFF" "Addr: 0xFF" "0xFF"
108675384-108678666 amulet_ascii: field: "Value: 0x0010" "Val: 0x0010" "0x0010"
108672795-108678666 amulet_ascii: swv: "Command: Set word variable (SWV)" "Command: Set word variable" "Cmd: Set word variable" "Cmd: SWV" "SWV"
108761678-108762372 amulet_ascii: field: "Command: Acknowledgment (ACK)" "Command: Acknowledgment" "Cmd: Acknowledgment" "Cmd: ACK" "ACK"
108761678-108762372 amulet_ascii: ack: "Command: Acknowledgment (ACK)" "Command: Acknowledgment" "Cmd: Acknowledgment" "Cmd: ACK" "ACK"
112388406-112389100 amulet_ascii: field: "Command: Set word variable (SWV)" "Command: Set word variable" "Cmd: Set word variable" "Cmd: SWV" "SWV"
112569896-112570590 amulet_ascii: bit: "Address high nibble: F" "Addr high 0xF" "Addr h 0xF"
112751303-112751997 amulet_ascii: bit: "Address low nibble: F" "Addr low 0xF" "Addr l 0xF"
112569896-112751997 amulet_ascii: field: "Address: 0xFF" "Addr: 0xFF" "0xFF"
112932762-113477663 amulet_ascii: field: "Value: 0x5a5a" "Val: 0x5a5a" "0x5a5a"
112388406-113477663 amulet_ascii: swv: "Command: Set word variable (SWV)" "Command: Set word variable" "Cmd: Set word variable" "Cmd: SWV" "SWV"
113658389-113659083 amulet_ascii: warning: "Unknown command: 0x00"
113659517-113660211 amulet_ascii: field: "Command: Acknowledgment (ACK)" "Command: Acknowledgment" "Cmd: Acknowledgment" "Cmd: ACK" "ACK"
113659517-113660211 amulet_ascii: ack: "Command: Acknowledgment (ACK)" "Command: Acknowledgment" "Cmd: Acknowledgment" "Cmd: ACK" "ACK"
113673658-113674352 amulet_ascii: field: "Command: Set byte variable (SBV)" "Command: Set byte variable" "Cmd: Set byte variable" "Cmd: SBV" "SBV"
113674521-113675215 amulet_ascii: bit: "Address high nibble: A" "Addr high 0xA" "Addr h 0xA"
113675383-113676077 amulet_ascii: bit: "Address low nibble: 0" "Addr low 0x0" "Addr l 0x0"
113674521-113676077 amulet_ascii: field: "Address: 0xA0" "Addr: 0xA0" "0xA0"
113676246-113677803 amulet_ascii: field: "Value: 0x01" "Val: 0x01" "0x01"
113673658-113677803 amulet_ascii: sbv: "Command: Set byte variable (SBV)" "Command: Set byte variable" "Cmd: Set byte variable" "Cmd: SBV" "SBV"
113842794-113843488 amulet_ascii: field: "Command: Acknowledgment (ACK)" "Command: Acknowledgment" "Cmd: Acknowledgment" "Cmd: ACK" "ACK"
113842794-113843488 amulet_ascii: ack: "Command: Acknowledgment (ACK)" "Command: Acknowledgment" "Cmd: Acknowledgment" "Cmd: ACK" "ACK"
113923623-113924317 amulet_ascii: field: "Command: Set byte variable (SBV)" "Command: Set byte variable" "Cmd: Set byte variable" "Cmd: SBV" "SBV"
113924485-113925179 amulet_ascii: bit: "Address high nibble: A" "Addr high 0xA" "Addr h 0xA"
113925348-113926042 amulet_ascii: bit: "Address low nibble: 1" "Addr low 0x1" "Addr l 0x1"
113924485-113926042 amulet_ascii: field: "Address: 0xA1" "Addr: 0xA1" "0xA1"
113926211-113927768 amulet_ascii: field: "Value: 0x00" "Val: 0x00" "0x00"
113923623-113927768 amulet_ascii: sbv: "Command: Set byte variable (SBV)" "Command: Set byte variable" "Cmd: Set byte variable" "Cmd: SBV" "SBV"
114026938-114027632 amulet_ascii: field: "Command: Acknowledgment (ACK)" "Command: Acknowledgment" "Cmd: Acknowledgment" "Cmd: ACK" "ACK"
114026938-114027632 amulet_ascii: ack: "Command: Acknowledgment (ACK)" "Command: Acknowledgment" "Cmd: Acknowledgment" "Cmd: ACK" "ACK"
114111159-114111853 amulet_ascii: field: "Command: Set byte variable (SBV)" "Command: Set byte variable" "Cmd: Set byte variable" "Cmd: SBV" "SBV"
114112021-114112715 amulet_ascii: bit: "Address high nibble: A" "Addr high 0xA" "Addr h 0xA"
114112884-114113578 amulet_ascii: bit: "Address low nibble: 2" "Addr low 0x2" "Addr l 0x2"
114112021-114113578 amulet_ascii: field: "Address: 0xA2" "Addr: 0xA2" "0xA2"
114113747-114115304 amulet_ascii: field: "Value: 0x00" "Val: 0x00" "0x00"
114111159-114115304 amulet_ascii: sbv: "Command: Set byte variable (SBV)" "Command: Set byte variable" "Cmd: Set byte variable" "Cmd: SBV" "SBV"
114210992-114211686 amulet_ascii: field: "Command: Acknowledgment (ACK)" "Command: Acknowledgment" "Cmd: Acknowledgment" "Cmd: ACK" "ACK"
114210992-114211686 amulet_ascii: ack: "Command: Acknowledgment (ACK)" "Command: Acknowledgment" "Cmd: Acknowledgment" "Cmd: ACK" "ACK"
114298760-114299454 amulet_ascii: field: "Command: Set byte variable (SBV)" "Command: Set byte variable" "Cmd: Set byte variable" "Cmd: SBV" "SBV"
114299622-114300316 amulet_ascii: bit: "Address high nibble: A" "Addr high 0xA" "Addr h 0xA"
114300485-114301179 amulet_ascii: bit: "Address low nibble: 3" "Addr low 0x3" "Addr l 0x3"
114299622-114301179 amulet_ascii: field: "Address: 0xA3" "Addr: 0xA3" "0xA3"
114301348-114302905 amulet_ascii: field: "Value: 0x00" "Val: 0x00" "0x00"
114298760-114302905 amulet_ascii: sbv: "Command: Set byte variable (SBV)" "Command: Set byte variable" "Cmd: Set byte variable" "Cmd: SBV" "SBV"
114395124-114395818 amulet_ascii: field: "Command: Acknowledgment (ACK)" "Command: Acknowledgment" "Cmd: Acknowledgment" "Cmd: ACK" "ACK"
114395124-114395818 amulet_ascii: ack: "Command: Acknowledgment (ACK)" "Command: Acknowledgment" "Cmd: Acknowledgment" "Cmd: ACK" "ACK"
114486230-114486924 amulet_ascii: field: "Command: Set byte variable (SBV)" "Command: Set byte variable" "Cmd: Set byte variable" "Cmd: SBV" "SBV"
114487093-114487787 amulet_ascii: bit: "Address high nibble: A" "Addr high 0xA" "Addr h 0xA"
114487956-114488650 amulet_ascii: bit: "Address low nibble: 4" "Addr low 0x4" "Addr l 0x4"
114487093-114488650 amulet_ascii: field: "Address: 0xA4" "Addr: 0xA4" "0xA4"
114488819-114490376 amulet_ascii: field: "Value: 0x01" "Val: 0x01" "0x01"
114486230-114490376 amulet_ascii: sbv: "Command: Set byte variable (SBV)" "Command: Set byte variable" "Cmd: Set byte variable" "Cmd: SBV" "SBV"
114579282-114579976 amulet_ascii: field: "Command: Acknowledgment (ACK)" "Command: Acknowledgment" "Cmd: Acknowledgment" "Cmd: ACK" "ACK"
114579282-114579976 amulet_ascii: ack: "Command: Acknowledgment (ACK)" "Command: Acknowledgment" "Cmd: Acknowledgment" "Cmd: ACK" "ACK"
114683908-114684602 amulet_ascii: field: "Command: Set byte variable (SBV)" "Command: Set byte variable" "Cmd: Set byte variable" "Cmd: SBV" "SBV"
114684771-114685465 amulet_ascii: bit: "Address high nibble: A" "Addr high 0xA" "Addr h 0xA"
114685634-114686328 amulet_ascii: bit: "Address low nibble: 5" "Addr low 0x5" "Addr l 0x5"
114684771-114686328 amulet_ascii: field: "Address: 0xA5" "Addr: 0xA5" "0xA5"
114686496-114688053 amulet_ascii: field: "Value: 0x01" "Val: 0x01" "0x01"
114683908-114688053 amulet_ascii: sbv: "Command: Set byte variable (SBV)" "Command: Set byte variable" "Cmd: Set byte variable" "Cmd: SBV" "SBV"
114763362-114764056 amulet_ascii: field: "Command: Acknowledgment (ACK)" "Command: Acknowledgment" "Cmd: Acknowledgment" "Cmd: ACK" "ACK"
114763362-114764056 amulet_ascii: ack: "Command: Acknowledgment (ACK)" "Command: Acknowledgment" "Cmd: Acknowledgment" "Cmd: ACK" "ACK"
114861237-114861931 amulet_ascii: field: "Command: Set byte variable (SBV)" "Command: Set byte variable" "Cmd: Set byte variable" "Cmd: SBV" "SBV"
114862100-114862794 amulet_ascii: bit: "Address high nibble: A" "Addr high 0xA" "Addr h 0xA"
114862963-114863657 amulet_ascii: bit: "Address low nibble: 6" "Addr low 0x6" "Addr l 0x6"
114862100-114863657 amulet_ascii: field: "Address: 0xA6" "Addr: 0xA6" "0xA6"
114863826-114865382 amulet_ascii: field: "Value: 0x00" "Val: 0x00" "0x00"
114861237-114865382 amulet_ascii: sbv: "Command: Set byte variable (SBV)" "Command: Set byte variable" "Cmd: Set byte variable" "Cmd: SBV" "SBV"
114947494-114948188 amulet_ascii: field: "Command: Acknowledgment (ACK)" "Command: Acknowledgment" "Cmd: Acknowledgment" "Cmd: ACK" "ACK"
114947494-114948188 amulet_ascii: ack: "Command: Acknowledgment (ACK)" "Command: Acknowledgment" "Cmd: Acknowledgment" "Cmd: ACK" "ACK"
115048752-115049446 amulet_ascii: field: "Command: Set byte variable (SBV)" "Command: Set byte variable" "Cmd: Set byte variable" "Cmd: SBV" "SBV"
115049614-115050308 amulet_ascii: bit: "Address high nibble: A" "Addr high 0xA" "Addr h 0xA"
115050477-115051171 amulet_ascii: bit: "Address low nibble: 7" "Addr low 0x7" "Addr l 0x7"
115049614-115051171 amulet_ascii: field: "Address: 0xA7" "Addr: 0xA7" "0xA7"
115051340-115052897 amulet_ascii: field: "Value: 0x00" "Val: 0x00" "0x00"
115048752-115052897 amulet_ascii: sbv: "Command: Set byte variable (SBV)" "Command: Set byte variable" "Cmd: Set byte variable" "Cmd: SBV" "SBV"
115131625-115132319 amulet_ascii: field: "Command: Acknowledgment (ACK)" "Command: Acknowledgment" "Cmd: Acknowledgment" "Cmd: ACK" "ACK"
115131625-115132319 amulet_ascii: ack: "Command: Acknowledgment (ACK)" "Command: Acknowledgment" "Cmd: Acknowledgment" "Cmd: ACK" "ACK"
115236385-115237079 amulet_ascii: field: "Command: Set string variable (SSV)" "Command: Set string variable" "Cmd: Set string variable" "Cmd: SSV" "SSV"
115237248-115237942 amulet_ascii: bit: "Address high nibble: C" "Addr high 0xC" "Addr h 0xC"
115238111-115238805 amulet_ascii: bit: "Address low nibble: 5" "Addr low 0x5" "Addr l 0x5"
115237248-115238805 amulet_ascii: field: "Address: 0xC5" "Addr: 0xC5" "0xC5"
115238973-115239667 amulet_ascii: bit: "P"
115239836-115240530 amulet_ascii: bit: "R"
115240699-115241393 amulet_ascii: bit: "E"
115241562-115242256 amulet_ascii: bit: "S"
115242425-115243119 amulet_ascii: bit: "E"
115243287-115243981 amulet_ascii: bit: "T"
115244150-115244844 amulet_ascii: bit: " "
115245013-115245707 amulet_ascii: bit: "O"
115245876-115246570 amulet_ascii: bit: "P"
115246738-115247432 amulet_ascii: bit: "T"
115247601-115248295 amulet_ascii: bit: "I"
115248464-115249158 amulet_ascii: bit: "O"
115249327-115250021 amulet_ascii: bit: "N"
115250189-115250883 amulet_ascii: bit: "S"
115251052-115251746 amulet_ascii: bit: "NULL"
115238973-115251746 amulet_ascii: field: "Value: PRESET OPTIONS" "Val: PRESET OPTIONS" "PRESET OPTIONS"
115236385-115251746 amulet_ascii: ssv: "Command: Set string variable (SSV)" "Command: Set string variable" "Cmd: Set string variable" "Cmd: SSV" "SSV"
115322317-115323011 amulet_ascii: field: "Command: Acknowledgment (ACK)" "Command: Acknowledgment" "Cmd: Acknowledgment" "Cmd: ACK" "ACK"
115322317-115323011 amulet_ascii: ack: "Command: Acknowledgment (ACK)" "Command: Acknowledgment" "Cmd: Acknowledgment" "Cmd: ACK" "ACK"
115423872-115424566 amulet_ascii: field: "Command: Set string variable (SSV)" "Command: Set string variable" "Cmd: Set string variable" "Cmd: SSV" "SSV"
115424735-115425429 amulet_ascii: bit: "Address high nibble: B" "Addr high 0xB" "Addr h 0xB"
115425598-115426292 amulet_ascii: bit: "Address low nibble: 0" "Addr low 0x0" "Addr l 0x0"
115424735-115426292 amulet_ascii: field: "Address: 0xB0" "Addr: 0xB0" "0xB0"
115426461-115427155 amulet_ascii: bit: " "
115427323-115428017 amulet_ascii: bit: " "
115428186-115428880 amulet_ascii: bit: " "
115429049-115429743 amulet_ascii: bit: " "
115429912-115430606 amulet_ascii: bit: " "
115430774-115431468 amulet_ascii: bit: " "
115431637-115432331 amulet_ascii: bit: " "
115432500-115433194 amulet_ascii: bit: " "
115433363-115434057 amulet_ascii: bit: " "
115434225-115434919 amulet_ascii: bit: " "
115435088-115435782 amulet_ascii: bit: " "
115435951-115436645 amulet_ascii: bit: " "
115436814-115437508 amulet_ascii: bit: " "
115437677-115438371 amulet_ascii: bit: " "
115438539-115439233 amulet_ascii: bit: " "
115439402-115440096 amulet_ascii: bit: " "
115440265-115440959 amulet_ascii: bit: " "
115441128-115441822 amulet_ascii: bit: " "
115441990-115442684 amulet_ascii: bit: " "
115442853-115443547 amulet_ascii: bit: "NULL"
115426461-115443547 amulet_ascii: field: "Value:                    " "Val:                    " "                   "
115423872-115443547 amulet_ascii: ssv: "Command: Set string variable (SSV)" "Command: Set string variable" "Cmd: Set string variable" "Cmd: SSV" "SSV"
115675900-115676594 amulet_ascii: field: "Command: Acknowledgment (ACK)" "Command: Acknowledgment" "Cmd: Acknowledgment" "Cmd: ACK" "ACK"
115675900-115676594 amulet_ascii: ack: "Command: Acknowledgment (ACK)" "Command: Acknowledgment" "Cmd: Acknowledgment" "Cmd: ACK" "ACK"
115798879-115799573 amulet_ascii: field: "Command: Set byte variable (SBV)" "Command: Set byte variable" "Cmd: Set byte variable" "Cmd: SBV" "SBV"
115799742-115800436 amulet_ascii: bit: "Address high nibble: B" "Addr high 0xB" "Addr h 0xB"
115800605-115801299 amulet_ascii: bit: "Address low nibble: 0" "Addr low 0x0" "Addr l 0x0"
115799742-115801299 amulet_ascii: field: "Address: 0xB0" "Addr: 0xB0" "0xB0"
115801467-115803024 amulet_ascii: field: "Value: 0x01" "Val: 0x01" "0x01"
115798879-115803024 amulet_ascii: sbv: "Command: Set byte variable (SBV)" "Command: Set byte variable" "Cmd: Set byte variable" "Cmd: SBV" "SBV"
115940461-115941155 amulet_ascii: field: "Command: Acknowledgment (ACK)" "Command: Acknowledgment" "Cmd: Acknowledgment" "Cmd: ACK" "ACK"
115940461-115941155 amulet_ascii: ack: "Command: Acknowledgment (ACK)" "Command: Acknowledgment" "Cmd: Acknowledgment" "Cmd: ACK" "ACK"
116049262-116049956 amulet_ascii: field: "Command: Set string variable (SSV)" "Command: Set string variable" "Cmd: Set string variable" "Cmd: SSV" "SSV"
116050124-116050818 amulet_ascii: bit: "Address high nibble: B" "Addr high 0xB" "Addr h 0xB"
116050987-116051681 amulet_ascii: bit: "Address low nibble: 0" "Addr low 0x0" "Addr l 0x0"
116050124-116051681 amulet_ascii: field: "Address: 0xB0" "Addr: 0xB0" "0xB0"
116051850-116052544 amulet_ascii: bit: "A"
116052713-116053407 amulet_ascii: bit: "u"
116053575-116054269 amulet_ascii: bit: "t"
116054438-116055132 amulet_ascii: bit: "o"
116055301-116055995 amulet_ascii: bit: " "
116056164-116056858 amulet_ascii: bit: "R"
116057026-116057720 amulet_ascii: bit: "e"
116057889-116058583 amulet_ascii: bit: "s"
116058752-116059446 amulet_ascii: bit: "o"
116059615-116060309 amulet_ascii: bit: "l"
116060478-116061172 amulet_ascii: bit: "v"
116061340-116062034 amulet_ascii: bit: "e"
116062203-116062897 amulet_ascii: bit: " "
116063066-116063760 amulet_ascii: bit: "C"
116063929-116064623 amulet_ascii: bit: "o"
116064791-116065485 amulet_ascii: bit: "n"
116065654-116066348 amulet_ascii: bit: "f"
116066517-116067211 amulet_ascii: bit: "l"
116067380-116068074 amulet_ascii: bit: "i"
116068243-116068937 amulet_ascii: bit: "c"
116069105-116069799 amulet_ascii: bit: "t"
116069968-116070662 amulet_ascii: bit: "s"
116070831-116071525 amulet_ascii: bit: " "
116071694-116072388 amulet_ascii: bit: " "
116072556-116073250 amulet_ascii: bit: " "
116073419-116074113 amulet_ascii: bit: " "
116074282-116074976 amulet_ascii: bit: " "
116075145-116075839 amulet_ascii: bit: " "
116076007-116076701 amulet_ascii: bit: "O"
116076870-116077564 amulet_ascii: bit: "f"
116077733-116078427 amulet_ascii: bit: "f"
116078596-116079290 amulet_ascii: bit: "NULL"
116051850-116079290 amulet_ascii: field: "Value: Auto Resolve Conflicts      Off" "Val: Auto Resolve Conflicts      Off" "Auto Resolve Conflicts      Off"
116049262-116079290 amulet_ascii: ssv: "Command: Set string variable (SSV)" "Command: Set string variable" "Cmd: Set string variable" "Cmd: SSV" "SSV"
116228554-116229248 amulet_ascii: field: "Command: Acknowledgment (ACK)" "Command: Acknowledgment" "Cmd: Acknowledgment" "Cmd: ACK" "ACK"
116228554-116229248 amulet_ascii: ack: "Command: Acknowledgment (ACK)" "Command: Acknowledgment" "Cmd: Acknowledgment" "Cmd: ACK" "ACK"
116299080-116299774 amulet_ascii: field: "Command: Set string variable (SSV)" "Command: Set string variable" "Cmd: Set string variable" "Cmd: SSV" "SSV"
116299943-116300637 amulet_ascii: bit: "Address high nibble: B" "Addr high 0xB" "Addr h 0xB"
116300805-116301499 amulet_ascii: bit: "Address low nibble: 2" "Addr low 0x2" "Addr l 0x2"
116299943-116301499 amulet_ascii: field: "Address: 0xB2" "Addr: 0xB2" "0xB2"
116301668-116302362 amulet_ascii: bit: "B"
116302531-116303225 amulet_ascii: bit: "a"
116303394-116304088 amulet_ascii: bit: "c"
116304256-116304950 amulet_ascii: bit: "k"
116305119-116305813 amulet_ascii: bit: "g"
116305982-116306676 amulet_ascii: bit: "r"
116306845-116307539 amulet_ascii: bit: "o"
116307707-116308401 amulet_ascii: bit: "u"
116308570-116309264 amulet_ascii: bit: "n"
116309433-116310127 amulet_ascii: bit: "d"
116310296-116310990 amulet_ascii: bit: " "
116311159-116311853 amulet_ascii: bit: "R"
116312021-116312715 amulet_ascii: bit: "e"
116312884-116313578 amulet_ascii: bit: "c"
116313747-116314441 amulet_ascii: bit: "a"
116314610-116315304 amulet_ascii: bit: "l"
116315472-116316166 amulet_ascii: bit: "l"
116316335-116317029 amulet_ascii: bit: " "
116317198-116317892 amulet_ascii: bit: " "
116318061-116318755 amulet_ascii: bit: "NULL"
116301668-116318755 amulet_ascii: field: "Value: Background Recall  " "Val: Background Recall  " "Background Recall  "
116299080-116318755 amulet_ascii: ssv: "Command: Set string variable (SSV)" "Command: Set string variable" "Cmd: Set string variable" "Cmd: SSV" "SSV"
116630841-116631535 amulet_ascii: field: "Command: Acknowledgment (ACK)" "Command: Acknowledgment" "Cmd: Acknowledgment" "Cmd: ACK" "ACK"
116630841-116631535 amulet_ascii: ack: "Command: Acknowledgment (ACK)" "Command: Acknowledgment" "Cmd: Acknowledgment" "Cmd: ACK" "ACK"
116736624-116737318 amulet_ascii: field: "Command: Set string variable (SSV)" "Command: Set string variable" "Cmd: Set string variable" "Cmd: SSV" "SSV"
116737487-116738181 amulet_ascii: bit: "Address high nibble: B" "Addr high 0xB" "Addr h 0xB"
116738349-116739043 amulet_ascii: bit: "Address low nibble: 3" "Addr low 0x3" "Addr l 0x3"
116737487-116739043 amulet_ascii: field: "Address: 0xB3" "Addr: 0xB3" "0xB3"
116739212-116739906 amulet_ascii: bit: " "
116740075-116740769 amulet_ascii: bit: " "
116740938-116741632 amulet_ascii: bit: " "
116741800-116742494 amulet_ascii: bit: " "
116742663-116743357 amulet_ascii: bit: " "
116743526-116744220 amulet_ascii: bit: " "
116744389-116745083 amulet_ascii: bit: " "
116745252-116745946 amulet_ascii: bit: " "
116746114-116746808 amulet_ascii: bit: " "
116746977-116747671 amulet_ascii: bit: " "
116747840-116748534 amulet_ascii: bit: "O"
116748703-116749397 amulet_ascii: bit: "n"
116749565-116750259 amulet_ascii: bit: "NULL"
116739212-116750259 amulet_ascii: field: "Value:           On" "Val:           On" "          On"
116736624-116750259 amulet_ascii: ssv: "Command: Set string variable (SSV)" "Command: Set string variable" "Cmd: Set string variable" "Cmd: SSV" "SSV"
117563266-117563960 amulet_ascii: field: "Command: Acknowledgment (ACK)" "Command: Acknowledgment" "Cmd: Acknowledgment" "Cmd: ACK" "ACK"
117563266-117563960 amulet_ascii: ack: "Command: Acknowledgment (ACK)" "Command: Acknowledgment" "Cmd: Acknowledgment" "Cmd: ACK" "ACK"
117674483-117675177 amulet_ascii: field: "Command: Set string variable (SSV)" "Command: Set string variable" "Cmd: Set string variable" "Cmd: SSV" "SSV"
117675345-117676039 amulet_ascii: bit: "Address high nibble: B" "Addr high 0xB" "Addr h 0xB"
117676208-117676902 amulet_ascii: bit: "Address low nibble: 4" "Addr low 0x4" "Addr l 0x4"
117675345-117676902 amulet_ascii: field: "Address: 0xB4" "Addr: 0xB4" "0xB4"
117677071-117677765 amulet_ascii: bit: "D"
117677934-117678628 amulet_ascii: bit: "S"
117678796-117679490 amulet_ascii: bit: "K"
117679659-117680353 amulet_ascii: bit: " "
117680522-117681216 amulet_ascii: bit: "R"
117681385-117682079 amulet_ascii: bit: "e"
117682248-117682942 amulet_ascii: bit: "c"
117683110-117683804 amulet_ascii: bit: "a"
117683973-117684667 amulet_ascii: bit: "l"
117684836-117685530 amulet_ascii: bit: "l"
117685699-117686393 amulet_ascii: bit: " "
117686561-117687255 amulet_ascii: bit: " "
117687424-117688118 amulet_ascii: bit: " "
117688287-117688981 amulet_ascii: bit: " "
117689150-117689844 amulet_ascii: bit: " "
117690013-117690707 amulet_ascii: bit: " "
117690875-117691569 amulet_ascii: bit: " "
117691738-117692432 amulet_ascii: bit: " "
117692601-117693295 amulet_ascii: bit: " "
117693464-117694158 amulet_ascii: bit: "NULL"
117677071-117694158 amulet_ascii: field: "Value: DSK Recall         " "Val: DSK Recall         " "DSK Recall         "
117674483-117694158 amulet_ascii: ssv: "Command: Set string variable (SSV)" "Command: Set string variable" "Cmd: Set string variable" "Cmd: SSV" "SSV"
117942638-117943332 amulet_ascii: field: "Command: Acknowledgment (ACK)" "Command: Acknowledgment" "Cmd: Acknowledgment" "Cmd: ACK" "ACK"
117942638-117943332 amulet_ascii: ack: "Command: Acknowledgment (ACK)" "Command: Acknowledgment" "Cmd: Acknowledgment" "Cmd: ACK" "ACK"
118049511-118050205 amulet_ascii: field: "Command: Set string variable (SSV)" "Command: Set string variable" "Cmd: Set string variable" "Cmd: SSV" "SSV"
118050374-118051068 amulet_ascii: bit: "Address high nibble: B" "Addr high 0xB" "Addr h 0xB"
118051237-118051931 amulet_ascii: bit: "Address low nibble: 5" "Addr low 0x5" "Addr l 0x5"
118050374-118051931 amulet_ascii: field: "Address: 0xB5" "Addr: 0xB5" "0xB5"
118052099-118052793 amulet_ascii: bit: " "
118052962-118053656 amulet_ascii: bit: " "
118053825-118054519 amulet_ascii: bit: " "
118054688-118055382 amulet_ascii: bit: " "
118055550-118056244 amulet_ascii: bit: " "
118056413-118057107 amulet_ascii: bit: " "
118057276-118057970 amulet_ascii: bit: " "
118058139-118058833 amulet_ascii: bit: " "
118059002-118059696 amulet_ascii: bit: " "
118059864-118060558 amulet_ascii: bit: " "
118060727-118061421 amulet_ascii: bit: "O"
118061590-118062284 amulet_ascii: bit: "n"
118062453-118063147 amulet_ascii: bit: "NULL"
118052099-118063147 amulet_ascii: field: "Value:           On" "Val:           On" "          On"
118049511-118063147 amulet_ascii: ssv: "Command: Set string variable (SSV)" "Command: Set string variable" "Cmd: Set string variable" "Cmd: SSV" "SSV"
118267949-118268643 amulet_ascii: field: "Command: Acknowledgment (ACK)" "Command: Acknowledgment" "Cmd: Acknowledgment" "Cmd: ACK" "ACK"
118267949-118268643 amulet_ascii: ack: "Command: Acknowledgment (ACK)" "Command: Acknowledgment" "Cmd: Acknowledgment" "Cmd: ACK" "ACK"
118362046-118362740 amulet_ascii: field: "Command: Set string variable (SSV)" "Command: Set string variable" "Cmd: Set string variable" "Cmd: SSV" "SSV"
118362908-118363602 amulet_ascii: bit: "Address high nibble: B" "Addr high 0xB" "Addr h 0xB"
118363771-118364465 amulet_ascii: bit: "Address low nibble: 6" "Addr low 0x6" "Addr l 0x6"
118362908-118364465 amulet_ascii: field: "Address: 0xB6" "Addr: 0xB6" "0xB6"
118364634-118365328 amulet_ascii: bit: "B"
118365497-118366191 amulet_ascii: bit: "o"
118366360-118367054 amulet_ascii: bit: "r"
118367222-118367916 amulet_ascii: bit: "d"
118368085-118368779 amulet_ascii: bit: "e"
118368948-118369642 amulet_ascii: bit: "r"
118369811-118370505 amulet_ascii: bit: " "
118370673-118371367 amulet_ascii: bit: "R"
118371536-118372230 amulet_ascii: bit: "e"
118372399-118373093 amulet_ascii: bit: "c"
118373262-118373956 amulet_ascii: bit: "a"
118374124-118374818 amulet_ascii: bit: "l"
118374987-118375681 amulet_ascii: bit: "l"
118375850-118376544 amulet_ascii: bit: " "
118376713-118377407 amulet_ascii: bit: " "
118377576-118378270 amulet_ascii: bit: " "
118378438-118379132 amulet_ascii: bit: " "
118379301-118379995 amulet_ascii: bit: " "
118380164-118380858 amulet_ascii: bit: " "
118381027-118381721 amulet_ascii: bit: "NULL"
118364634-118381721 amulet_ascii: field: "Value: Border Recall      " "Val: Border Recall      " "Border Recall      "
118362046-118381721 amulet_ascii: ssv: "Command: Set string variable (SSV)" "Command: Set string variable" "Cmd: Set string variable" "Cmd: SSV" "SSV"
118614973-118615667 amulet_ascii: field: "Command: Acknowledgment (ACK)" "Command: Acknowledgment" "Cmd: Acknowledgment" "Cmd: ACK" "ACK"
118614973-118615667 amulet_ascii: ack: "Command: Acknowledgment (ACK)" "Command: Acknowledgment" "Cmd: Acknowledgment" "Cmd: ACK" "ACK"
118747162-118747856 amulet_ascii: field: "Command: Set string variable (SSV)" "Command: Set string variable" "Cmd: Set string variable" "Cmd: SSV" "SSV"
118748024-118748718 amulet_ascii: bit: "Address high nibble: B" "Addr high 0xB" "Addr h 0xB"
118748887-118749581 amulet_ascii: bit: "Address low nibble: 7" "Addr low 0x7" "Addr l 0x7"
118748024-118749581 amulet_ascii: field: "Address: 0xB7" "Addr: 0xB7" "0xB7"
118749750-118750444 amulet_ascii: bit: " "
118750613-118751307 amulet_ascii: bit: " "
118751475-118752169 amulet_ascii: bit: " "
118752338-118753032 amulet_ascii: bit: " "
118753201-118753895 amulet_ascii: bit: " "
118754064-118754758 amulet_ascii: bit: " "
118754926-118755620 amulet_ascii: bit: " "
118755789-118756483 amulet_ascii: bit: " "
118756652-118757346 amulet_ascii: bit: " "
118757515-118758209 amulet_ascii: bit: " "
118758378-118759072 amulet_ascii: bit: "O"
118759240-118759934 amulet_ascii: bit: "n"
118760103-118760797 amulet_ascii: bit: "NULL"
118749750-118760797 amulet_ascii: field: "Value:           On" "Val:           On" "          On"
118747162-118760797 amulet_ascii: ssv: "Command: Set string variable (SSV)" "Command: Set string variable" "Cmd: Set string variable" "Cmd: SSV" "SSV"
118959702-118960396 amulet_ascii: field: "Command: Acknowledgment (ACK)" "Command: Acknowledgment" "Cmd: Acknowledgment" "Cmd: ACK" "ACK"
118959702-118960396 amulet_ascii: ack: "Command: Acknowledgment (ACK)" "Command: Acknowledgment" "Cmd: Acknowledgment" "Cmd: ACK" "ACK"
119059723-119060417 amulet_ascii: field: "Command: Set string variable (SSV)" "Command: Set string variable" "Cmd: Set string variable" "Cmd: SSV" "SSV"
119060586-119061280 amulet_ascii: bit: "Address high nibble: B" "Addr high 0xB" "Addr h 0xB"
119061449-119062143 amulet_ascii: bit: "Address low nibble: 8" "Addr low 0x8" "Addr l 0x8"
119060586-119062143 amulet_ascii: field: "Address: 0xB8" "Addr: 0xB8" "0xB8"
119062312-119063006 amulet_ascii: bit: "F"
119063174-119063868 amulet_ascii: bit: "S"
119064037-119064731 amulet_ascii: bit: "N"
119064900-119065594 amulet_ascii: bit: " "
119065763-119066457 amulet_ascii: bit: "P"
119066625-119067319 amulet_ascii: bit: "r"
119067488-119068182 amulet_ascii: bit: "e"
119068351-119069045 amulet_ascii: bit: "s"
119069214-119069908 amulet_ascii: bit: "e"
119070076-119070770 amulet_ascii: bit: "t"
119070939-119071633 amulet_ascii: bit: " "
119071802-119072496 amulet_ascii: bit: "R"
119072665-119073359 amulet_ascii: bit: "e"
119073528-119074222 amulet_ascii: bit: "c"
119074390-119075084 amulet_ascii: bit: "a"
119075253-119075947 amulet_ascii: bit: "l"
119076116-119076810 amulet_ascii: bit: "l"
119076979-119077673 amulet_ascii: bit: " "
119077841-119078535 amulet_ascii: bit: " "
119078704-119079398 amulet_ascii: bit: "NULL"
119062312-119079398 amulet_ascii: field: "Value: FSN Preset Recall  " "Val: FSN Preset Recall  " "FSN Preset Recall  "
119059723-119079398 amulet_ascii: ssv: "Command: Set string variable (SSV)" "Command: Set string variable" "Cmd: Set string variable" "Cmd: SSV" "SSV"
119326124-119326818 amulet_ascii: field: "Command: Acknowledgment (ACK)" "Command: Acknowledgment" "Cmd: Acknowledgment" "Cmd: ACK" "ACK"
119326124-119326818 amulet_ascii: ack: "Command: Acknowledgment (ACK)" "Command: Acknowledgment" "Cmd: Acknowledgment" "Cmd: ACK" "ACK"
119424664-119425358 amulet_ascii: field: "Command: Set string variable (SSV)" "Command: Set string variable" "Cmd: Set string variable" "Cmd: SSV" "SSV"
119425527-119426221 amulet_ascii: bit: "Address high nibble: B" "Addr high 0xB" "Addr h 0xB"
119426390-119427084 amulet_ascii: bit: "Address low nibble: 9" "Addr low 0x9" "Addr l 0x9"
119425527-119427084 amulet_ascii: field: "Address: 0xB9" "Addr: 0xB9" "0xB9"
119427253-119427947 amulet_ascii: bit: " "
119428115-119428809 amulet_ascii: bit: " "
119428978-119429672 amulet_ascii: bit: " "
119429841-119430535 amulet_ascii: bit: " "
119430704-119431398 amulet_ascii: bit: " "
119431567-119432261 amulet_ascii: bit: " "
119432429-119433123 amulet_ascii: bit: " "
119433292-119433986 amulet_ascii: bit: " "
119434155-119434849 amulet_ascii: bit: " "
119435018-119435712 amulet_ascii: bit: " "
119435880-119436574 amulet_ascii: bit: "O"
119436743-119437437 amulet_ascii: bit: "n"
119437606-119438300 amulet_ascii: bit: "NULL"
119427253-119438300 amulet_ascii: field: "Value:           On" "Val:           On" "          On"
119424664-119438300 amulet_ascii: ssv: "Command: Set string variable (SSV)" "Command: Set string variable" "Cmd: Set string variable" "Cmd: SSV" "SSV"
119690468-119691162 amulet_ascii: field: "Command: Acknowledgment (ACK)" "Command: Acknowledgment" "Cmd: Acknowledgment" "Cmd: ACK" "ACK"
119690468-119691162 amulet_ascii: ack: "Command: Acknowledgment (ACK)" "Command: Acknowledgment" "Cmd: Acknowledgment" "Cmd: ACK" "ACK"
119799801-119800495 amulet_ascii: field: "Command: Set string variable (SSV)" "Command: Set string variable" "Cmd: Set string variable" "Cmd: SSV" "SSV"
119800664-119801358 amulet_ascii: bit: "Address high nibble: B" "Addr high 0xB" "Addr h 0xB"
119801527-119802221 amulet_ascii: bit: "Address low nibble: A" "Addr low 0xA" "Addr l 0xA"
119800664-119802221 amulet_ascii: field: "Address: 0xBA" "Addr: 0xBA" "0xBA"
119802390-119803084 amulet_ascii: bit: " "
119803252-119803946 amulet_ascii: bit: " "
119804115-119804809 amulet_ascii: bit: " "
119804978-119805672 amulet_ascii: bit: " "
119805841-119806535 amulet_ascii: bit: " "
119806704-119807398 amulet_ascii: bit: " "
119807566-119808260 amulet_ascii: bit: " "
119808429-119809123 amulet_ascii: bit: " "
119809292-119809986 amulet_ascii: bit: " "
119810155-119810849 amulet_ascii: bit: " "
119811017-119811711 amulet_ascii: bit: " "
119811880-119812574 amulet_ascii: bit: " "
119812743-119813437 amulet_ascii: bit: " "
119813606-119814300 amulet_ascii: bit: " "
119814468-119815162 amulet_ascii: bit: " "
119815331-119816025 amulet_ascii: bit: " "
119816194-119816888 amulet_ascii: bit: " "
119817057-119817751 amulet_ascii: bit: " "
119817920-119818614 amulet_ascii: bit: " "
119818782-119819476 amulet_ascii: bit: "NULL"
119802390-119819476 amulet_ascii: field: "Value:                    " "Val:                    " "                   "
119799801-119819476 amulet_ascii: ssv: "Command: Set string variable (SSV)" "Command: Set string variable" "Cmd: Set string variable" "Cmd: SSV" "SSV"
120076536-120077230 amulet_ascii: field: "Command: Acknowledgment (ACK)" "Command: Acknowledgment" "Cmd: Acknowledgment" "Cmd: ACK" "ACK"
120076536-120077230 amulet_ascii: ack: "Command: Acknowledgment (ACK)" "Command: Acknowledgment" "Cmd: Acknowledgment" "Cmd: ACK" "ACK"
120175101-120175795 amulet_ascii: field: "Command: Set string variable (SSV)" "Command: Set string variable" "Cmd: Set string variable" "Cmd: SSV" "SSV"
120175964-120176658 amulet_ascii: bit: "Address high nibble: B" "Addr high 0xB" "Addr h 0xB"
120176827-120177521 amulet_ascii: bit: "Address low nibble: A" "Addr low 0xA" "Addr l 0xA"
120175964-120177521 amulet_ascii: field: "Address: 0xBA" "Addr: 0xBA" "0xBA"
120177689-120178383 amulet_ascii: bit: "_"
120178552-120179246 amulet_ascii: bit: "_"
120179415-120180109 amulet_ascii: bit: "_"
120180278-120180972 amulet_ascii: bit: "_"
120181141-120181835 amulet_ascii: bit: "_"
120182003-120182697 amulet_ascii: bit: "_"
120182866-120183560 amulet_ascii: bit: "_"
120183729-120184423 amulet_ascii: bit: "_"
120184592-120185286 amulet_ascii: bit: "_"
120185454-120186148 amulet_ascii: bit: "_"
120186317-120187011 amulet_ascii: bit: "_"
120187180-120187874 amulet_ascii: bit: "_"
120188043-120188737 amulet_ascii: bit: "_"
120188905-120189599 amulet_ascii: bit: "_"
120189768-120190462 amulet_ascii: bit: "_"
120190631-120191325 amulet_ascii: bit: "_"
120191494-120192188 amulet_ascii: bit: "_"
120192357-120193051 amulet_ascii: bit: "_"
120193219-120193913 amulet_ascii: bit: "_"
120194082-120194776 amulet_ascii: bit: "_"
120194945-120195639 amulet_ascii: bit: "_"
120195808-120196502 amulet_ascii: bit: "_"
120196670-120197364 amulet_ascii: bit: "_"
120197533-120198227 amulet_ascii: bit: "_"
120198396-120199090 amulet_ascii: bit: "_"
120199259-120199953 amulet_ascii: bit: "_"
120200121-120200815 amulet_ascii: bit: "_"
120200984-120201678 amulet_ascii: bit: "_"
120201847-120202541 amulet_ascii: bit: "_"
120202710-120203404 amulet_ascii: bit: "_"
120203573-120204267 amulet_ascii: bit: "_"
120204435-120205129 amulet_ascii: bit: "_"
120205298-120205992 amulet_ascii: bit: "_"
120206161-120206855 amulet_ascii: bit: "_"
120207024-120207718 amulet_ascii: bit: "_"
120207886-120208580 amulet_ascii: bit: "NULL"
120177689-120208580 amulet_ascii: field: "Value: ___________________________________" "Val: ___________________________________" "___________________________________"
120175101-120208580 amulet_ascii: ssv: "Command: Set string variable (SSV)" "Command: Set string variable" "Cmd: Set string variable" "Cmd: SSV" "SSV"
120377481-120378175 amulet_ascii: field: "Command: Acknowledgment (ACK)" "Command: Acknowledgment" "Cmd: Acknowledgment" "Cmd: ACK" "ACK"
120377481-120378175 amulet_ascii: ack: "Command: Acknowledgment (ACK)" "Command: Acknowledgment" "Cmd: Acknowledgment" "Cmd: ACK" "ACK"
120487533-120488227 amulet_ascii: field: "Command: Set string variable (SSV)" "Command: Set string variable" "Cmd: Set string variable" "Cmd: SSV" "SSV"
120488395-120489089 amulet_ascii: bit: "Address high nibble: B" "Addr high 0xB" "Addr h 0xB"
120489258-120489952 amulet_ascii: bit: "Address low nibble: C" "Addr low 0xC" "Addr l 0xC"
120488395-120489952 amulet_ascii: field: "Address: 0xBC" "Addr: 0xBC" "0xBC"
120490121-120490815 amulet_ascii: bit: "F"
120490984-120491678 amulet_ascii: bit: "S"
120491846-120492540 amulet_ascii: bit: "N"
120492709-120493403 amulet_ascii: bit: " "
120493572-120494266 amulet_ascii: bit: "P"
120494435-120495129 amulet_ascii: bit: "r"
120495298-120495992 amulet_ascii: bit: "e"
120496160-120496854 amulet_ascii: bit: "s"
120497023-120497717 amulet_ascii: bit: "e"
120497886-120498580 amulet_ascii: bit: "t"
120498749-120499443 amulet_ascii: bit: " "
120499611-120500305 amulet_ascii: bit: "S"
120500474-120501168 amulet_ascii: bit: "a"
120501337-120502031 amulet_ascii: bit: "v"
120502200-120502894 amulet_ascii: bit: "e"
120503063-120503757 amulet_ascii: bit: " "
120503925-120504619 amulet_ascii: bit: " "
120504788-120505482 amulet_ascii: bit: " "
120505651-120506345 amulet_ascii: bit: " "
120506514-120507208 amulet_ascii: bit: "NULL"
120490121-120507208 amulet_ascii: field: "Value: FSN Preset Save    " "Val: FSN Preset Save    " "FSN Preset Save    "
120487533-120507208 amulet_ascii: ssv: "Command: Set string variable (SSV)" "Command: Set string variable" "Cmd: Set string variable" "Cmd: SSV" "SSV"
120841535-120842229 amulet_ascii: field: "Command: Acknowledgment (ACK)" "Command: Acknowledgment" "Cmd: Acknowledgment" "Cmd: ACK" "ACK"
120841535-120842229 amulet_ascii: ack: "Command: Acknowledgment (ACK)" "Command: Acknowledgment" "Cmd: Acknowledgment" "Cmd: ACK" "ACK"
120935256-120935950 amulet_ascii: field: "Command: Set string variable (SSV)" "Command: Set string variable" "Cmd: Set string variable" "Cmd: SSV" "SSV"
120936119-120936813 amulet_ascii: bit: "Address high nibble: B" "Addr high 0xB" "Addr h 0xB"
120936982-120937676 amulet_ascii: bit: "Address low nibble: D" "Addr low 0xD" "Addr l 0xD"
120936119-120937676 amulet_ascii: field: "Address: 0xBD" "Addr: 0xBD" "0xBD"
120937845-120938539 amulet_ascii: bit: " "
120938707-120939401 amulet_ascii: bit: " "
120939570-120940264 amulet_ascii: bit: " "
120940433-120941127 amulet_ascii: bit: " "
120941296-120941990 amulet_ascii: bit: " "
120942158-120942852 amulet_ascii: bit: " "
120943021-120943715 amulet_ascii: bit: " "
120943884-120944578 amulet_ascii: bit: " "
120944747-120945441 amulet_ascii: bit: " "
120945610-120946304 amulet_ascii: bit: "O"
120946472-120947166 amulet_ascii: bit: "f"
120947335-120948029 amulet_ascii: bit: "f"
120948198-120948892 amulet_ascii: bit: "NULL"
120937845-120948892 amulet_ascii: field: "Value:          Off" "Val:          Off" "         Off"
120935256-120948892 amulet_ascii: ssv: "Command: Set string variable (SSV)" "Command: Set string variable" "Cmd: Set string variable" "Cmd: SSV" "SSV"
121203531-121204225 amulet_ascii: field: "Command: Acknowledgment (ACK)" "Command: Acknowledgment" "Cmd: Acknowledgment" "Cmd: ACK" "ACK"
121203531-121204225 amulet_ascii: ack: "Command: Acknowledgment (ACK)" "Command: Acknowledgment" "Cmd: Acknowledgment" "Cmd: ACK" "ACK"
121300121-121300815 amulet_ascii: field: "Command: Set string variable (SSV)" "Command: Set string variable" "Cmd: Set string variable" "Cmd: SSV" "SSV"
121300984-121301678 amulet_ascii: bit: "Address high nibble: B" "Addr high 0xB" "Addr h 0xB"
121301847-121302541 amulet_ascii: bit: "Address low nibble: E" "Addr low 0xE" "Addr l 0xE"
121300984-121302541 amulet_ascii: field: "Address: 0xBE" "Addr: 0xBE" "0xBE"
121302710-121303404 amulet_ascii: bit: "F"
121303573-121304267 amulet_ascii: bit: "S"
121304435-121305129 amulet_ascii: bit: "N"
121305298-121305992 amulet_ascii: bit: " "
121306161-121306855 amulet_ascii: bit: "N"
121307024-121307718 amulet_ascii: bit: "u"
121307886-121308580 amulet_ascii: bit: "m"
121308749-121309443 amulet_ascii: bit: "b"
121309612-121310306 amulet_ascii: bit: "e"
121310475-121311169 amulet_ascii: bit: "r"
121311337-121312031 amulet_ascii: bit: " "
121312200-121312894 amulet_ascii: bit: " "
121313063-121313757 amulet_ascii: bit: " "
121313926-121314620 amulet_ascii: bit: " "
121314789-121315483 amulet_ascii: bit: " "
121315651-121316345 amulet_ascii: bit: " "
121316514-121317208 amulet_ascii: bit: " "
121317377-121318071 amulet_ascii: bit: " "
121318240-121318934 amulet_ascii: bit: " "
121319102-121319796 amulet_ascii: bit: "NULL"
121302710-121319796 amulet_ascii: field: "Value: FSN Number         " "Val: FSN Number         " "FSN Number         "
121300121-121319796 amulet_ascii: ssv: "Command: Set string variable (SSV)" "Command: Set string variable" "Cmd: Set string variable" "Cmd: SSV" "SSV"
121592493-121593187 amulet_ascii: field: "Command: Acknowledgment (ACK)" "Command: Acknowledgment" "Cmd: Acknowledgment" "Cmd: ACK" "ACK"
121592493-121593187 amulet_ascii: ack: "Command: Acknowledgment (ACK)" "Command: Acknowledgment" "Cmd: Acknowledgment" "Cmd: ACK" "ACK"
121675231-121675925 amulet_ascii: field: "Command: Set string variable (SSV)" "Command: Set string variable" "Cmd: Set string variable" "Cmd: SSV" "SSV"
121676094-121676788 amulet_ascii: bit: "Address high nibble: B" "Addr high 0xB" "Addr h 0xB"
121676957-121677651 amulet_ascii: bit: "Address low nibble: F" "Addr low 0xF" "Addr l 0xF"
121676094-121677651 amulet_ascii: field: "Address: 0xBF" "Addr: 0xBF" "0xBF"
121677820-121678514 amulet_ascii: bit: " "
121678682-121679376 amulet_ascii: bit: " "
121679545-121680239 amulet_ascii: bit: " "
121680408-121681102 amulet_ascii: bit: " "
121681271-121681965 amulet_ascii: bit: " "
121682134-121682828 amulet_ascii: bit: " "
121682996-121683690 amulet_ascii: bit: " "
121683859-121684553 amulet_ascii: bit: " "
121684722-121685416 amulet_ascii: bit: " "
121685585-121686279 amulet_ascii: bit: " "
121686447-121687141 amulet_ascii: bit: " "
121687310-121688004 amulet_ascii: bit: "1"
121688173-121688867 amulet_ascii: bit: "NULL"
121677820-121688867 amulet_ascii: field: "Value:            1" "Val:            1" "           1"
121675231-121688867 amulet_ascii: ssv: "Command: Set string variable (SSV)" "Command: Set string variable" "Cmd: Set string variable" "Cmd: SSV" "SSV"
121979463-121980157 amulet_ascii: field: "Command: Acknowledgment (ACK)" "Command: Acknowledgment" "Cmd: Acknowledgment" "Cmd: ACK" "ACK"
121979463-121980157 amulet_ascii: ack: "Command: Acknowledgment (ACK)" "Command: Acknowledgment" "Cmd: Acknowledgment" "Cmd: ACK" "ACK"
122050233-122050927 amulet_ascii: field: "Command: Set string variable (SSV)" "Command: Set string variable" "Cmd: Set string variable" "Cmd: SSV" "SSV"
122051095-122051789 amulet_ascii: bit: "Address high nibble: C" "Addr high 0xC" "Addr h 0xC"
122051958-122052652 amulet_ascii: bit: "Address low nibble: 0" "Addr low 0x0" "Addr l 0x0"
122051095-122052652 amulet_ascii: field: "Address: 0xC0" "Addr: 0xC0" "0xC0"
122052821-122053515 amulet_ascii: bit: "F"
122053684-122054378 amulet_ascii: bit: "S"
122054547-122055241 amulet_ascii: bit: "N"
122055409-122056103 amulet_ascii: bit: " "
122056272-122056966 amulet_ascii: bit: "P"
122057135-122057829 amulet_ascii: bit: "r"
122057998-122058692 amulet_ascii: bit: "e"
122058860-122059554 amulet_ascii: bit: "s"
122059723-122060417 amulet_ascii: bit: "e"
122060586-122061280 amulet_ascii: bit: "t"
122061449-122062143 amulet_ascii: bit: " "
122062311-122063005 amulet_ascii: bit: "N"
122063174-122063868 amulet_ascii: bit: "u"
122064037-122064731 amulet_ascii: bit: "m"
122064900-122065594 amulet_ascii: bit: "b"
122065763-122066457 amulet_ascii: bit: "e"
122066625-122067319 amulet_ascii: bit: "r"
122067488-122068182 amulet_ascii: bit: " "
122068351-122069045 amulet_ascii: bit: " "
122069214-122069908 amulet_ascii: bit: "NULL"
122052821-122069908 amulet_ascii: field: "Value: FSN Preset Number  " "Val: FSN Preset Number  " "FSN Preset Number  "
122050233-122069908 amulet_ascii: ssv: "Command: Set string variable (SSV)" "Command: Set string variable" "Cmd: Set string variable" "Cmd: SSV" "SSV"
122341326-122342020 amulet_ascii: field: "Command: Acknowledgment (ACK)" "Command: Acknowledgment" "Cmd: Acknowledgment" "Cmd: ACK" "ACK"
122341326-122342020 amulet_ascii: ack: "Command: Acknowledgment (ACK)" "Command: Acknowledgment" "Cmd: Acknowledgment" "Cmd: ACK" "ACK"
122425163-122425857 amulet_ascii: field: "Command: Set string variable (SSV)" "Command: Set string variable" "Cmd: Set string variable" "Cmd: SSV" "SSV"
122426026-122426720 amulet_ascii: bit: "Address high nibble: C" "Addr high 0xC" "Addr h 0xC"
122426889-122427583 amulet_ascii: bit: "Address low nibble: 1" "Addr low 0x1" "Addr l 0x1"
122426026-122427583 amulet_ascii: field: "Address: 0xC1" "Addr: 0xC1" "0xC1"
122427752-122428446 amulet_ascii: bit: " "
122428615-122429309 amulet_ascii: bit: " "
122429477-122430171 amulet_ascii: bit: " "
122430340-122431034 amulet_ascii: bit: " "
122431203-122431897 amulet_ascii: bit: " "
122432066-122432760 amulet_ascii: bit: " "
122432928-122433622 amulet_ascii: bit: " "
122433791-122434485 amulet_ascii: bit: " "
122434654-122435348 amulet_ascii: bit: " "
122435517-122436211 amulet_ascii: bit: " "
122436380-122437074 amulet_ascii: bit: " "
122437242-122437936 amulet_ascii: bit: "1"
122438105-122438799 amulet_ascii: bit: "NULL"
122427752-122438799 amulet_ascii: field: "Value:            1" "Val:            1" "           1"
122425163-122438799 amulet_ascii: ssv: "Command: Set string variable (SSV)" "Command: Set string variable" "Cmd: Set string variable" "Cmd: SSV" "SSV"
122721880-122722574 amulet_ascii: field: "Command: Acknowledgment (ACK)" "Command: Acknowledgment" "Cmd: Acknowledgment" "Cmd: ACK" "ACK"
122721880-122722574 amulet_ascii: ack: "Command: Acknowledgment (ACK)" "Command: Acknowledgment" "Cmd: Acknowledgment" "Cmd: ACK" "ACK"
122810236-122810930 amulet_ascii: field: "Command: Set string variable (SSV)" "Command: Set string variable" "Cmd: Set string variable" "Cmd: SSV" "SSV"
122811099-122811793 amulet_ascii: bit: "Address high nibble: A" "Addr high 0xA" "Addr h 0xA"
122811961-122812655 amulet_ascii: bit: "Address low nibble: 8" "Addr low 0x8" "Addr l 0x8"
122811099-122812655 amulet_ascii: field: "Address: 0xA8" "Addr: 0xA8" "0xA8"
122812824-122813518 amulet_ascii: bit: "N"
122813687-122814381 amulet_ascii: bit: "
"
122814550-122815244 amulet_ascii: bit: "a"
122815413-122816107 amulet_ascii: bit: "
"
122816275-122816969 amulet_ascii: bit: "v"
122817138-122817832 amulet_ascii: bit: "
"
122818001-122818695 amulet_ascii: bit: " "
122818864-122819558 amulet_ascii: bit: "NULL"
122812824-122819558 amulet_ascii: field: "Value: N
a
v
 " "Val: N
a
v
 " "N
a
v
 "
122810236-122819558 amulet_ascii: ssv: "Command: Set string variable (SSV)" "Command: Set string variable" "Cmd: Set string variable" "Cmd: SSV" "SSV"
123113422-123114116 amulet_ascii: field: "Command: Acknowledgment (ACK)" "Command: Acknowledgment" "Cmd: Acknowledgment" "Cmd: ACK" "ACK"
123113422-123114116 amulet_ascii: ack: "Command: Acknowledgment (ACK)" "Command: Acknowledgment" "Cmd: Acknowledgment" "Cmd: ACK" "ACK"
123175286-123175980 amulet_ascii: field: "Command: Set string variable (SSV)" "Command: Set string variable" "Cmd: Set string variable" "Cmd: SSV" "SSV"
123176148-123176842 amulet_ascii: bit: "Address high nibble: A" "Addr high 0xA" "Addr h 0xA"
123177011-123177705 amulet_ascii: bit: "Address low nibble: 9" "Addr low 0x9" "Addr l 0x9"
123176148-123177705 amulet_ascii: field: "Address: 0xA9" "Addr: 0xA9" "0xA9"
123177874-123178568 amulet_ascii: bit: "A"
123178737-123179431 amulet_ascii: bit: "
"
123179599-123180293 amulet_ascii: bit: "d"
123180462-123181156 amulet_ascii: bit: "
"
123181325-123182019 amulet_ascii: bit: "j"
123182188-123182882 amulet_ascii: bit: "NULL"
123177874-123182882 amulet_ascii: field: "Value: A
d
j" "Val: A
d
j" "A
d
j"
123175286-123182882 amulet_ascii: ssv: "Command: Set string variable (SSV)" "Command: Set string variable" "Cmd: Set string variable" "Cmd: SSV" "SSV"
123428140-123428834 amulet_ascii: field: "Command: Acknowledgment (ACK)" "Command: Acknowledgment" "Cmd: Acknowledgment" "Cmd: ACK" "ACK"
123428140-123428834 amulet_ascii: ack: "Command: Acknowledgment (ACK)" "Command: Acknowledgment" "Cmd: Acknowledgment" "Cmd: ACK" "ACK"
128676582-128677276 amulet_ascii: field: "Command: Set word variable (SWV)" "Command: Set word variable" "Cmd: Set word variable" "Cmd: SWV" "SWV"
128677445-128678139 amulet_ascii: bit: "Address high nibble: F" "Addr high 0xF" "Addr h 0xF"
128678308-128679002 amulet_ascii: bit: "Address low nibble: F" "Addr low 0xF" "Addr l 0xF"
128677445-128679002 amulet_ascii: field: "Address: 0xFF" "Addr: 0xFF" "0xFF"
128679171-128682453 amulet_ascii: field: "Value: 0x00fe" "Val: 0x00fe" "0x00fe"
128676582-128682453 amulet_ascii: swv: "Command: Set word variable (SWV)" "Command: Set word variable" "Cmd: Set word variable" "Cmd: SWV" "SWV"
128843805-128844499 amulet_ascii: field: "Command: Acknowledgment (ACK)" "Command: Acknowledgment" "Cmd: Acknowledgment" "Cmd: ACK" "ACK"
128843805-128844499 amulet_ascii: ack: "Command: Acknowledgment (ACK)" "Command: Acknowledgment" "Cmd: Acknowledgment" "Cmd: ACK" "ACK"
130744627-130745321 amulet_ascii: field: "Command: Set word variable (SWV)" "Command: Set word variable" "Cmd: Set word variable" "Cmd: SWV" "SWV"
130745578-130746272 amulet_ascii: bit: "Address high nibble: F" "Addr high 0xF" "Addr h 0xF"
130746530-130747224 amulet_ascii: bit: "Address low nibble: F" "Addr low 0xF" "Addr l 0xF"
130745578-130747224 amulet_ascii: field: "Address: 0xFF" "Addr: 0xFF" "0xFF"
130747481-130751029 amulet_ascii: field: "Value: 0x5a5a" "Val: 0x5a5a" "0x5a5a"
130744627-130751029 amulet_ascii: swv: "Command: Set word variable (SWV)" "Command: Set word variable" "Cmd: Set word variable" "Cmd: SWV" "SWV"
130751287-130751981 amulet_ascii: warning: "Unknown command: 0x00"
130752392-130753086 amulet_ascii: field: "Command: Acknowledgment (ACK)" "Command: Acknowledgment" "Cmd: Acknowledgment" "Cmd: ACK" "ACK"
130752392-130753086 amulet_ascii: ack: "Command: Acknowledgment (ACK)" "Command: Acknowledgment" "Cmd: Acknowledgment" "Cmd: ACK" "ACK"
130801950-130802644 amulet_ascii: field: "Command: Set string variable (SSV)" "Command: Set string variable" "Cmd: Set string variable" "Cmd: SSV" "SSV"
130802813-130803507 amulet_ascii: bit: "Address high nibble: 9" "Addr high 0x9" "Addr h 0x9"
130803675-130804369 amulet_ascii: bit: "Address low nibble: A" "Addr low 0xA" "Addr l 0xA"
130802813-130804369 amulet_ascii: field: "Address: 0x9A" "Addr: 0x9A" "0x9A"
130804538-130805232 amulet_ascii: bit: "A"
130805401-130806095 amulet_ascii: bit: " "
130806264-130806958 amulet_ascii: bit: "D"
130807127-130807821 amulet_ascii: bit: "e"
130807989-130808683 amulet_ascii: bit: "s"
130808852-130809546 amulet_ascii: bit: "t"
130809715-130810409 amulet_ascii: bit: "i"
130810578-130811272 amulet_ascii: bit: "n"
130811440-130812134 amulet_ascii: bit: "a"
130812303-130812997 amulet_ascii: bit: "t"
130813166-130813860 amulet_ascii: bit: "i"
130814029-130814723 amulet_ascii: bit: "o"
130814891-130815585 amulet_ascii: bit: "n"
130815754-130816448 amulet_ascii: bit: " "
130816617-130817311 amulet_ascii: bit: "m"
130817480-130818174 amulet_ascii: bit: "u"
130818343-130819037 amulet_ascii: bit: "s"
130819205-130819899 amulet_ascii: bit: "t"
130820068-130820762 amulet_ascii: bit: " "
130820931-130821625 amulet_ascii: bit: "b"
130821794-130822488 amulet_ascii: bit: "e"
130822656-130823350 amulet_ascii: bit: " "
130823519-130824213 amulet_ascii: bit: "s"
130824382-130825076 amulet_ascii: bit: "e"
130825245-130825939 amulet_ascii: bit: "l"
130826107-130826801 amulet_ascii: bit: "e"
130826970-130827664 amulet_ascii: bit: "c"
130827833-130828527 amulet_ascii: bit: "t"
130828696-130829390 amulet_ascii: bit: "e"
130829559-130830253 amulet_ascii: bit: "d"
130830421-130831115 amulet_ascii: bit: "."
130831284-130831978 amulet_ascii: bit: "NULL"
130804538-130831978 amulet_ascii: field: "Value: A Destination must be selected." "Val: A Destination must be selected." "A Destination must be selected."
130801950-130831978 amulet_ascii: ssv: "Command: Set string variable (SSV)" "Command: Set string variable" "Cmd: Set string variable" "Cmd: SSV" "SSV"
130852270-130852964 amulet_ascii: field: "Command: Acknowledgment (ACK)" "Command: Acknowledgment" "Cmd: Acknowledgment" "Cmd: ACK" "ACK"
130852270-130852964 amulet_ascii: ack: "Command: Acknowledgment (ACK)" "Command: Acknowledgment" "Cmd: Acknowledgment" "Cmd: ACK" "ACK"
143491743-143492437 amulet_ascii: field: "Command: Set word variable (SWV)" "Command: Set word variable" "Cmd: Set word variable" "Cmd: SWV" "SWV"
143492606-143493300 amulet_ascii: bit: "Address high nibble: F" "Addr high 0xF" "Addr h 0xF"
143493468-143494162 amulet_ascii: bit: "Address low nibble: F" "Addr low 0xF" "Addr l 0xF"
143492606-143494162 amulet_ascii: field: "Address: 0xFF" "Addr: 0xFF" "0xFF"
143494331-143497614 amulet_ascii: field: "Value: 0xffff" "Val: 0xffff" "0xffff"
143491743-143497614 amulet_ascii: swv: "Command: Set word variable (SWV)" "Command: Set word variable" "Cmd: Set word variable" "Cmd: SWV" "SWV"
143499237-143499931 amulet_ascii: field: "Command: Acknowledgment (ACK)" "Command: Acknowledgment" "Cmd: Acknowledgment" "Cmd: ACK" "ACK"
143499237-143499931 amulet_ascii: ack: "Command: Acknowledgment (ACK)" "Command: Acknowledgment" "Cmd: Acknowledgment" "Cmd: ACK" "ACK"
144689719-144690413 amulet_ascii: field: "Command: Set byte variable (SBV)" "Command: Set byte variable" "Cmd: Set byte variable" "Cmd: SBV" "SBV"
144690582-144691276 amulet_ascii: bit: "Address high nibble: A" "Addr high 0xA" "Addr h 0xA"
144691444-144692138 amulet_ascii: bit: "Address low nibble: 0" "Addr low 0x0" "Addr l 0x0"
144690582-144692138 amulet_ascii: field: "Address: 0xA0" "Addr: 0xA0" "0xA0"
144692307-144693864 amulet_ascii: field: "Value: 0x01" "Val: 0x01" "0x01"
144689719-144693864 amulet_ascii: sbv: "Command: Set byte variable (SBV)" "Command: Set byte variable" "Cmd: Set byte variable" "Cmd: SBV" "SBV"
145706888-145707582 amulet_ascii: field: "Command: Acknowledgment (ACK)" "Command: Acknowledgment" "Cmd: Acknowledgment" "Cmd: ACK" "ACK"
145706888-145707582 amulet_ascii: ack: "Command: Acknowledgment (ACK)" "Command: Acknowledgment" "Cmd: Acknowledgment" "Cmd: ACK" "ACK"
145804560-145805254 amulet_ascii: field: "Command: Set byte variable (SBV)" "Command: Set byte variable" "Cmd: Set byte variable" "Cmd: SBV" "SBV"
145805422-145806116 amulet_ascii: bit: "Address high nibble: A" "Addr high 0xA" "Addr h 0xA"
145806285-145806979 amulet_ascii: bit: "Address low nibble: 1" "Addr low 0x1" "Addr l 0x1"
145805422-145806979 amulet_ascii: field: "Address: 0xA1" "Addr: 0xA1" "0xA1"
145807148-145808705 amulet_ascii: field: "Value: 0x00" "Val: 0x00" "0x00"
145804560-145808705 amulet_ascii: sbv: "Command: Set byte variable (SBV)" "Command: Set byte variable" "Cmd: Set byte variable" "Cmd: SBV" "SBV"
147921392-147922086 amulet_ascii: field: "Command: Acknowledgment (ACK)" "Command: Acknowledgment" "Cmd: Acknowledgment" "Cmd: ACK" "ACK"
147921392-147922086 amulet_ascii: ack: "Command: Acknowledgment (ACK)" "Command: Acknowledgment" "Cmd: Acknowledgment" "Cmd: ACK" "ACK"
147993382-147994076 amulet_ascii: field: "Command: Set byte variable (SBV)" "Command: Set byte variable" "Cmd: Set byte variable" "Cmd: SBV" "SBV"
147994244-147994938 amulet_ascii: bit: "Address high nibble: A" "Addr high 0xA" "Addr h 0xA"
147995107-147995801 amulet_ascii: bit: "Address low nibble: 2" "Addr low 0x2" "Addr l 0x2"
147994244-147995801 amulet_ascii: field: "Address: 0xA2" "Addr: 0xA2" "0xA2"
147995970-147997527 amulet_ascii: field: "Value: 0x00" "Val: 0x00" "0x00"
147993382-147997527 amulet_ascii: sbv: "Command: Set byte variable (SBV)" "Command: Set byte variable" "Cmd: Set byte variable" "Cmd: SBV" "SBV"
148144948-148145642 amulet_ascii: field: "Command: Acknowledgment (ACK)" "Command: Acknowledgment" "Cmd: Acknowledgment" "Cmd: ACK" "ACK"
148144948-148145642 amulet_ascii: ack: "Command: Acknowledgment (ACK)" "Command: Acknowledgment" "Cmd: Acknowledgment" "Cmd: ACK" "ACK"
148242625-148243319 amulet_ascii: field: "Command: Set byte variable (SBV)" "Command: Set byte variable" "Cmd: Set byte variable" "Cmd: SBV" "SBV"
148243487-148244181 amulet_ascii: bit: "Address high nibble: A" "Addr high 0xA" "Addr h 0xA"
148244350-148245044 amulet_ascii: bit: "Address low nibble: 3" "Addr low 0x3" "Addr l 0x3"
148243487-148245044 amulet_ascii: field: "Address: 0xA3" "Addr: 0xA3" "0xA3"
148245213-148246770 amulet_ascii: field: "Value: 0x00" "Val: 0x00" "0x00"
148242625-148246770 amulet_ascii: sbv: "Command: Set byte variable (SBV)" "Command: Set byte variable" "Cmd: Set byte variable" "Cmd: SBV" "SBV"
148368546-148369240 amulet_ascii: field: "Command: Acknowledgment (ACK)" "Command: Acknowledgment" "Cmd: Acknowledgment" "Cmd: ACK" "ACK"
148368546-148369240 amulet_ascii: ack: "Command: Acknowledgment (ACK)" "Command: Acknowledgment" "Cmd: Acknowledgment" "Cmd: ACK" "ACK"
148492855-148493549 amulet_ascii: field: "Command: Set byte variable (SBV)" "Command: Set byte variable" "Cmd: Set byte variable" "Cmd: SBV" "SBV"
148493718-148494412 amulet_ascii: bit: "Address high nibble: A" "Addr high 0xA" "Addr h 0xA"
148494581-148495275 amulet_ascii: bit: "Address low nibble: 4" "Addr low 0x4" "Addr l 0x4"
148493718-148495275 amulet_ascii: field: "Address: 0xA4" "Addr: 0xA4" "0xA4"
148495444-148497000 amulet_ascii: field: "Value: 0x01" "Val: 0x01" "0x01"
148492855-148497000 amulet_ascii: sbv: "Command: Set byte variable (SBV)" "Command: Set byte variable" "Cmd: Set byte variable" "Cmd: SBV" "SBV"
148592102-148592796 amulet_ascii: field: "Command: Acknowledgment (ACK)" "Command: Acknowledgment" "Cmd: Acknowledgment" "Cmd: ACK" "ACK"
148592102-148592796 amulet_ascii: ack: "Command: Acknowledgment (ACK)" "Command: Acknowledgment" "Cmd: Acknowledgment" "Cmd: ACK" "ACK"
148680304-148680998 amulet_ascii: field: "Command: Set byte variable (SBV)" "Command: Set byte variable" "Cmd: Set byte variable" "Cmd: SBV" "SBV"
148681167-148681861 amulet_ascii: bit: "Address high nibble: A" "Addr high 0xA" "Addr h 0xA"
148682030-148682724 amulet_ascii: bit: "Address low nibble: 5" "Addr low 0x5" "Addr l 0x5"
148681167-148682724 amulet_ascii: field: "Address: 0xA5" "Addr: 0xA5" "0xA5"
148682893-148684449 amulet_ascii: field: "Value: 0x01" "Val: 0x01" "0x01"
148680304-148684449 amulet_ascii: sbv: "Command: Set byte variable (SBV)" "Command: Set byte variable" "Cmd: Set byte variable" "Cmd: SBV" "SBV"
148815685-148816379 amulet_ascii: field: "Command: Acknowledgment (ACK)" "Command: Acknowledgment" "Cmd: Acknowledgment" "Cmd: ACK" "ACK"
148815685-148816379 amulet_ascii: ack: "Command: Acknowledgment (ACK)" "Command: Acknowledgment" "Cmd: Acknowledgment" "Cmd: ACK" "ACK"
148930329-148931023 amulet_ascii: field: "Command: Set byte variable (SBV)" "Command: Set byte variable" "Cmd: Set byte variable" "Cmd: SBV" "SBV"
148931191-148931885 amulet_ascii: bit: "Address high nibble: A" "Addr high 0xA" "Addr h 0xA"
148932054-148932748 amulet_ascii: bit: "Address low nibble: 6" "Addr low 0x6" "Addr l 0x6"
148931191-148932748 amulet_ascii: field: "Address: 0xA6" "Addr: 0xA6" "0xA6"
148932917-148934474 amulet_ascii: field: "Value: 0x00" "Val: 0x00" "0x00"
148930329-148934474 amulet_ascii: sbv: "Command: Set byte variable (SBV)" "Command: Set byte variable" "Cmd: Set byte variable" "Cmd: SBV" "SBV"
149039293-149039987 amulet_ascii: field: "Command: Acknowledgment (ACK)" "Command: Acknowledgment" "Cmd: Acknowledgment" "Cmd: ACK" "ACK"
149039293-149039987 amulet_ascii: ack: "Command: Acknowledgment (ACK)" "Command: Acknowledgment" "Cmd: Acknowledgment" "Cmd: ACK" "ACK"
149117838-149118532 amulet_ascii: field: "Command: Set byte variable (SBV)" "Command: Set byte variable" "Cmd: Set byte variable" "Cmd: SBV" "SBV"
149118700-149119394 amulet_ascii: bit: "Address high nibble: A" "Addr high 0xA" "Addr h 0xA"
149119563-149120257 amulet_ascii: bit: "Address low nibble: 7" "Addr low 0x7" "Addr l 0x7"
149118700-149120257 amulet_ascii: field: "Address: 0xA7" "Addr: 0xA7" "0xA7"
149120426-149121983 amulet_ascii: field: "Value: 0x00" "Val: 0x00" "0x00"
149117838-149121983 amulet_ascii: sbv: "Command: Set byte variable (SBV)" "Command: Set byte variable" "Cmd: Set byte variable" "Cmd: SBV" "SBV"
149262839-149263533 amulet_ascii: field: "Command: Acknowledgment (ACK)" "Command: Acknowledgment" "Cmd: Acknowledgment" "Cmd: ACK" "ACK"
149262839-149263533 amulet_ascii: ack: "Command: Acknowledgment (ACK)" "Command: Acknowledgment" "Cmd: Acknowledgment" "Cmd: ACK" "ACK"
149378530-149379224 amulet_ascii: field: "Command: Set byte variable (SBV)" "Command: Set byte variable" "Cmd: Set byte variable" "Cmd: SBV" "SBV"
149379393-149380087 amulet_ascii: bit: "Address high nibble: B" "Addr high 0xB" "Addr h 0xB"
149380255-149380949 amulet_ascii: bit: "Address low nibble: 0" "Addr low 0x0" "Addr l 0x0"
149379393-149380949 amulet_ascii: field: "Address: 0xB0" "Addr: 0xB0" "0xB0"
149381118-149382675 amulet_ascii: field: "Value: 0x01" "Val: 0x01" "0x01"
149378530-149382675 amulet_ascii: sbv: "Command: Set byte variable (SBV)" "Command: Set byte variable" "Cmd: Set byte variable" "Cmd: SBV" "SBV"
149486447-149487141 amulet_ascii: field: "Command: Acknowledgment (ACK)" "Command: Acknowledgment" "Cmd: Acknowledgment" "Cmd: ACK" "ACK"
149486447-149487141 amulet_ascii: ack: "Command: Acknowledgment (ACK)" "Command: Acknowledgment" "Cmd: Acknowledgment" "Cmd: ACK" "ACK"
149555485-149556179 amulet_ascii: field: "Command: Set string variable (SSV)" "Command: Set string variable" "Cmd: Set string variable" "Cmd: SSV" "SSV"
149556347-149557041 amulet_ascii: bit: "Address high nibble: B" "Addr high 0xB" "Addr h 0xB"
149557210-149557904 amulet_ascii: bit: "Address low nibble: 0" "Addr low 0x0" "Addr l 0x0"
149556347-149557904 amulet_ascii: field: "Address: 0xB0" "Addr: 0xB0" "0xB0"
149558073-149558767 amulet_ascii: bit: "A"
149558936-149559630 amulet_ascii: bit: "u"
149559799-149560493 amulet_ascii: bit: "t"
149560661-149561355 amulet_ascii: bit: "o"
149561524-149562218 amulet_ascii: bit: " "
149562387-149563081 amulet_ascii: bit: "R"
149563250-149563944 amulet_ascii: bit: "e"
149564112-149564806 amulet_ascii: bit: "s"
149564975-149565669 amulet_ascii: bit: "o"
149565838-149566532 amulet_ascii: bit: "l"
149566701-149567395 amulet_ascii: bit: "v"
149567564-149568258 amulet_ascii: bit: "e"
149568426-149569120 amulet_ascii: bit: " "
149569289-149569983 amulet_ascii: bit: "C"
149570152-149570846 amulet_ascii: bit: "o"
149571015-149571709 amulet_ascii: bit: "n"
149571877-149572571 amulet_ascii: bit: "f"
149572740-149573434 amulet_ascii: bit: "l"
149573603-149574297 amulet_ascii: bit: "i"
149574466-149575160 amulet_ascii: bit: "c"
149575328-149576022 amulet_ascii: bit: "t"
149576191-149576885 amulet_ascii: bit: "s"
149577054-149577748 amulet_ascii: bit: " "
149577917-149578611 amulet_ascii: bit: " "
149578780-149579474 amulet_ascii: bit: " "
149579642-149580336 amulet_ascii: bit: " "
149580505-149581199 amulet_ascii: bit: " "
149581368-149582062 amulet_ascii: bit: " "
149582231-149582925 amulet_ascii: bit: "O"
149583093-149583787 amulet_ascii: bit: "f"
149583956-149584650 amulet_ascii: bit: "f"
149584819-149585513 amulet_ascii: bit: "NULL"
149558073-149585513 amulet_ascii: field: "Value: Auto Resolve Conflicts      Off" "Val: Auto Resolve Conflicts      Off" "Auto Resolve Conflicts      Off"
149555485-149585513 amulet_ascii: ssv: "Command: Set string variable (SSV)" "Command: Set string variable" "Cmd: Set string variable" "Cmd: SSV" "SSV"
149937940-149938634 amulet_ascii: field: "Command: Acknowledgment (ACK)" "Command: Acknowledgment" "Cmd: Acknowledgment" "Cmd: ACK" "ACK"
149937940-149938634 amulet_ascii: ack: "Command: Acknowledgment (ACK)" "Command: Acknowledgment" "Cmd: Acknowledgment" "Cmd: ACK" "ACK"
150055403-150056097 amulet_ascii: field: "Command: Set string variable (SSV)" "Command: Set string variable" "Cmd: Set string variable" "Cmd: SSV" "SSV"
150056266-150056960 amulet_ascii: bit: "Address high nibble: B" "Addr high 0xB" "Addr h 0xB"
150057129-150057823 amulet_ascii: bit: "Address low nibble: 3" "Addr low 0x3" "Addr l 0x3"
150056266-150057823 amulet_ascii: field: "Address: 0xB3" "Addr: 0xB3" "0xB3"
150057992-150058686 amulet_ascii: bit: " "
150058854-150059548 amulet_ascii: bit: " "
150059717-150060411 amulet_ascii: bit: " "
150060580-150061274 amulet_ascii: bit: " "
150061443-150062137 amulet_ascii: bit: " "
150062305-150062999 amulet_ascii: bit: " "
150063168-150063862 amulet_ascii: bit: " "
150064031-150064725 amulet_ascii: bit: " "
150064894-150065588 amulet_ascii: bit: " "
150065757-150066451 amulet_ascii: bit: " "
150066619-150067313 amulet_ascii: bit: "O"
150067482-150068176 amulet_ascii: bit: "n"
150068345-150069039 amulet_ascii: bit: "NULL"
150057992-150069039 amulet_ascii: field: "Value:           On" "Val:           On" "          On"
150055403-150069039 amulet_ascii: ssv: "Command: Set string variable (SSV)" "Command: Set string variable" "Cmd: Set string variable" "Cmd: SSV" "SSV"
150167190-150167884 amulet_ascii: field: "Command: Acknowledgment (ACK)" "Command: Acknowledgment" "Cmd: Acknowledgment" "Cmd: ACK" "ACK"
150167190-150167884 amulet_ascii: ack: "Command: Acknowledgment (ACK)" "Command: Acknowledgment" "Cmd: Acknowledgment" "Cmd: ACK" "ACK"
150243032-150243726 amulet_ascii: field: "Command: Set string variable (SSV)" "Command: Set string variable" "Cmd: Set string variable" "Cmd: SSV" "SSV"
150243894-150244588 amulet_ascii: bit: "Address high nibble: B" "Addr high 0xB" "Addr h 0xB"
150244757-150245451 amulet_ascii: bit: "Address low nibble: 5" "Addr low 0x5" "Addr l 0x5"
150243894-150245451 amulet_ascii: field: "Address: 0xB5" "Addr: 0xB5" "0xB5"
150245620-150246314 amulet_ascii: bit: " "
150246483-150247177 amulet_ascii: bit: " "
150247345-150248039 amulet_ascii: bit: " "
150248208-150248902 amulet_ascii: bit: " "
150249071-150249765 amulet_ascii: bit: " "
150249934-150250628 amulet_ascii: bit: " "
150250796-150251490 amulet_ascii: bit: " "
150251659-150252353 amulet_ascii: bit: " "
150252522-150253216 amulet_ascii: bit: " "
150253385-150254079 amulet_ascii: bit: " "
150254248-150254942 amulet_ascii: bit: "O"
150255110-150255804 amulet_ascii: bit: "n"
150255973-150256667 amulet_ascii: bit: "NULL"
150245620-150256667 amulet_ascii: field: "Value:           On" "Val:           On" "          On"
150243032-150256667 amulet_ascii: ssv: "Command: Set string variable (SSV)" "Command: Set string variable" "Cmd: Set string variable" "Cmd: SSV" "SSV"
150396399-150397093 amulet_ascii: field: "Command: Acknowledgment (ACK)" "Command: Acknowledgment" "Cmd: Acknowledgment" "Cmd: ACK" "ACK"
150396399-150397093 amulet_ascii: ack: "Command: Acknowledgment (ACK)" "Command: Acknowledgment" "Cmd: Acknowledgment" "Cmd: ACK" "ACK"
150493034-150493728 amulet_ascii: field: "Command: Set string variable (SSV)" "Command: Set string variable" "Cmd: Set string variable" "Cmd: SSV" "SSV"
150493897-150494591 amulet_ascii: bit: "Address high nibble: B" "Addr high 0xB" "Addr h 0xB"
150494760-150495454 amulet_ascii: bit: "Address low nibble: 7" "Addr low 0x7" "Addr l 0x7"
150493897-150495454 amulet_ascii: field: "Address: 0xB7" "Addr: 0xB7" "0xB7"
150495623-150496317 amulet_ascii: bit: " "
150496485-150497179 amulet_ascii: bit: " "
150497348-150498042 amulet_ascii: bit: " "
150498211-150498905 amulet_ascii: bit: " "
150499074-150499768 amulet_ascii: bit: " "
150499936-150500630 amulet_ascii: bit: " "
150500799-150501493 amulet_ascii: bit: " "
150501662-150502356 amulet_ascii: bit: " "
150502525-150503219 amulet_ascii: bit: " "
150503387-150504081 amulet_ascii: bit: " "
150504250-150504944 amulet_ascii: bit: "O"
150505113-150505807 amulet_ascii: bit: "n"
150505976-150506670 amulet_ascii: bit: "NULL"
150495623-150506670 amulet_ascii: field: "Value:           On" "Val:           On" "          On"
150493034-150506670 amulet_ascii: ssv: "Command: Set string variable (SSV)" "Command: Set string variable" "Cmd: Set string variable" "Cmd: SSV" "SSV"
150625628-150626322 amulet_ascii: field: "Command: Acknowledgment (ACK)" "Command: Acknowledgment" "Cmd: Acknowledgment" "Cmd: ACK" "ACK"
150625628-150626322 amulet_ascii: ack: "Command: Acknowledgment (ACK)" "Command: Acknowledgment" "Cmd: Acknowledgment" "Cmd: ACK" "ACK"
150680760-150681454 amulet_ascii: field: "Command: Set string variable (SSV)" "Command: Set string variable" "Cmd: Set string variable" "Cmd: SSV" "SSV"
150681623-150682317 amulet_ascii: bit: "Address high nibble: B" "Addr high 0xB" "Addr h 0xB"
150682486-150683180 amulet_ascii: bit: "Address low nibble: 9" "Addr low 0x9" "Addr l 0x9"
150681623-150683180 amulet_ascii: field: "Address: 0xB9" "Addr: 0xB9" "0xB9"
150683348-150684042 amulet_ascii: bit: " "
150684211-150684905 amulet_ascii: bit: " "
150685074-150685768 amulet_ascii: bit: " "
150685937-150686631 amulet_ascii: bit: " "
150686799-150687493 amulet_ascii: bit: " "
150687662-150688356 amulet_ascii: bit: " "
150688525-150689219 amulet_ascii: bit: " "
150689388-150690082 amulet_ascii: bit: " "
150690251-150690945 amulet_ascii: bit: " "
150691113-150691807 amulet_ascii: bit: " "
150691976-150692670 amulet_ascii: bit: "O"
150692839-150693533 amulet_ascii: bit: "n"
150693702-150694396 amulet_ascii: bit: "NULL"
150683348-150694396 amulet_ascii: field: "Value:           On" "Val:           On" "          On"
150680760-150694396 amulet_ascii: ssv: "Command: Set string variable (SSV)" "Command: Set string variable" "Cmd: Set string variable" "Cmd: SSV" "SSV"
150854867-150855561 amulet_ascii: field: "Command: Acknowledgment (ACK)" "Command: Acknowledgment" "Cmd: Acknowledgment" "Cmd: ACK" "ACK"
150854867-150855561 amulet_ascii: ack: "Command: Acknowledgment (ACK)" "Command: Acknowledgment" "Cmd: Acknowledgment" "Cmd: ACK" "ACK"
150941040-150941734 amulet_ascii: field: "Command: Set string variable (SSV)" "Command: Set string variable" "Cmd: Set string variable" "Cmd: SSV" "SSV"
150941903-150942597 amulet_ascii: bit: "Address high nibble: B" "Addr high 0xB" "Addr h 0xB"
150942766-150943460 amulet_ascii: bit: "Address low nibble: A" "Addr low 0xA" "Addr l 0xA"
150941903-150943460 amulet_ascii: field: "Address: 0xBA" "Addr: 0xBA" "0xBA"
150943628-150944322 amulet_ascii: bit: "_"
150944491-150945185 amulet_ascii: bit: "_"
150945354-150946048 amulet_ascii: bit: "_"
150946217-150946911 amulet_ascii: bit: "_"
150947079-150947773 amulet_ascii: bit: "_"
150947942-150948636 amulet_ascii: bit: "_"
150948805-150949499 amulet_ascii: bit: "_"
150949668-150950362 amulet_ascii: bit: "_"
150950531-150951225 amulet_ascii: bit: "_"
150951393-150952087 amulet_ascii: bit: "_"
150952256-150952950 amulet_ascii: bit: "_"
150953119-150953813 amulet_ascii: bit: "_"
150953982-150954676 amulet_ascii: bit: "_"
150954844-150955538 amulet_ascii: bit: "_"
150955707-150956401 amulet_ascii: bit: "_"
150956570-150957264 amulet_ascii: bit: "_"
150957433-150958127 amulet_ascii: bit: "_"
150958295-150958989 amulet_ascii: bit: "_"
150959158-150959852 amulet_ascii: bit: "_"
150960021-150960715 amulet_ascii: bit: "_"
150960884-150961578 amulet_ascii: bit: "_"
150961747-150962441 amulet_ascii: bit: "_"
150962609-150963303 amulet_ascii: bit: "_"
150963472-150964166 amulet_ascii: bit: "_"
150964335-150965029 amulet_ascii: bit: "_"
150965198-150965892 amulet_ascii: bit: "_"
150966060-150966754 amulet_ascii: bit: "_"
150966923-150967617 amulet_ascii: bit: "_"
150967786-150968480 amulet_ascii: bit: "_"
150968649-150969343 amulet_ascii: bit: "_"
150969512-150970206 amulet_ascii: bit: "_"
150970374-150971068 amulet_ascii: bit: "_"
150971237-150971931 amulet_ascii: bit: "_"
150972100-150972794 amulet_ascii: bit: "_"
150972963-150973657 amulet_ascii: bit: "_"
150973825-150974519 amulet_ascii: bit: "NULL"
150943628-150974519 amulet_ascii: field: "Value: ___________________________________" "Val: ___________________________________" "___________________________________"
150941040-150974519 amulet_ascii: ssv: "Command: Set string variable (SSV)" "Command: Set string variable" "Cmd: Set string variable" "Cmd: SSV" "SSV"
151669408-151670102 amulet_ascii: field: "Command: Acknowledgment (ACK)" "Command: Acknowledgment" "Cmd: Acknowledgment" "Cmd: ACK" "ACK"
151669408-151670102 amulet_ascii: ack: "Command: Acknowledgment (ACK)" "Command: Acknowledgment" "Cmd: Acknowledgment" "Cmd: ACK" "ACK"
151743287-151743981 amulet_ascii: field: "Command: Set string variable (SSV)" "Command: Set string variable" "Cmd: Set string variable" "Cmd: SSV" "SSV"
151744149-151744843 amulet_ascii: bit: "Address high nibble: B" "Addr high 0xB" "Addr h 0xB"
151745012-151745706 amulet_ascii: bit: "Address low nibble: D" "Addr low 0xD" "Addr l 0xD"
151744149-151745706 amulet_ascii: field: "Address: 0xBD" "Addr: 0xBD" "0xBD"
151745875-151746569 amulet_ascii: bit: " "
151746738-151747432 amulet_ascii: bit: " "
151747600-151748294 amulet_ascii: bit: " "
151748463-151749157 amulet_ascii: bit: " "
151749326-151750020 amulet_ascii: bit: " "
151750189-151750883 amulet_ascii: bit: " "
151751051-151751745 amulet_ascii: bit: " "
151751914-151752608 amulet_ascii: bit: " "
151752777-151753471 amulet_ascii: bit: " "
151753640-151754334 amulet_ascii: bit: "O"
151754503-151755197 amulet_ascii: bit: "f"
151755365-151756059 amulet_ascii: bit: "f"
151756228-151756922 amulet_ascii: bit: "NULL"
151745875-151756922 amulet_ascii: field: "Value:          Off" "Val:          Off" "         Off"
151743287-151756922 amulet_ascii: ssv: "Command: Set string variable (SSV)" "Command: Set string variable" "Cmd: Set string variable" "Cmd: SSV" "SSV"
151898693-151899387 amulet_ascii: field: "Command: Acknowledgment (ACK)" "Command: Acknowledgment" "Cmd: Acknowledgment" "Cmd: ACK" "ACK"
151898693-151899387 amulet_ascii: ack: "Command: Acknowledgment (ACK)" "Command: Acknowledgment" "Cmd: Acknowledgment" "Cmd: ACK" "ACK"
151999562-152000256 amulet_ascii: field: "Command: Set string variable (SSV)" "Command: Set string variable" "Cmd: Set string variable" "Cmd: SSV" "SSV"
152000425-152001119 amulet_ascii: bit: "Address high nibble: B" "Addr high 0xB" "Addr h 0xB"
152001288-152001982 amulet_ascii: bit: "Address low nibble: F" "Addr low 0xF" "Addr l 0xF"
152000425-152001982 amulet_ascii: field: "Address: 0xBF" "Addr: 0xBF" "0xBF"
152002150-152002844 amulet_ascii: bit: " "
152003013-152003707 amulet_ascii: bit: " "
152003876-152004570 amulet_ascii: bit: " "
152004739-152005433 amulet_ascii: bit: " "
152005601-152006295 amulet_ascii: bit: " "
152006464-152007158 amulet_ascii: bit: " "
152007327-152008021 amulet_ascii: bit: " "
152008190-152008884 amulet_ascii: bit: " "
152009052-152009746 amulet_ascii: bit: " "
152009915-152010609 amulet_ascii: bit: " "
152010778-152011472 amulet_ascii: bit: " "
152011641-152012335 amulet_ascii: bit: "1"
152012504-152013198 amulet_ascii: bit: "NULL"
152002150-152013198 amulet_ascii: field: "Value:            1" "Val:            1" "           1"
151999562-152013198 amulet_ascii: ssv: "Command: Set string variable (SSV)" "Command: Set string variable" "Cmd: Set string variable" "Cmd: SSV" "SSV"
152128044-152128738 amulet_ascii: field: "Command: Acknowledgment (ACK)" "Command: Acknowledgment" "Cmd: Acknowledgment" "Cmd: ACK" "ACK"
152128044-152128738 amulet_ascii: ack: "Command: Acknowledgment (ACK)" "Command: Acknowledgment" "Cmd: Acknowledgment" "Cmd: ACK" "ACK"
152243493-152244187 amulet_ascii: field: "Command: Set string variable (SSV)" "Command: Set string variable" "Cmd: Set string variable" "Cmd: SSV" "SSV"
152244355-152245049 amulet_ascii: bit: "Address high nibble: C" "Addr high 0xC" "Addr h 0xC"
152245218-152245912 amulet_ascii: bit: "Address low nibble: 1" "Addr low 0x1" "Addr l 0x1"
152244355-152245912 amulet_ascii: field: "Address: 0xC1" "Addr: 0xC1" "0xC1"
152246081-152246775 amulet_ascii: bit: " "
152246944-152247638 amulet_ascii: bit: " "
152247807-152248501 amulet_ascii: bit: " "
152248669-152249363 amulet_ascii: bit: " "
152249532-152250226 amulet_ascii: bit: " "
152250395-152251089 amulet_ascii: bit: " "
152251258-152251952 amulet_ascii: bit: " "
152252120-152252814 amulet_ascii: bit: " "
152252983-152253677 amulet_ascii: bit: " "
152253846-152254540 amulet_ascii: bit: " "
152254709-152255403 amulet_ascii: bit: " "
152255572-152256266 amulet_ascii: bit: "1"
152256434-152257128 amulet_ascii: bit: "NULL"
152246081-152257128 amulet_ascii: field: "Value:            1" "Val:            1" "           1"
152243493-152257128 amulet_ascii: ssv: "Command: Set string variable (SSV)" "Command: Set string variable" "Cmd: Set string variable" "Cmd: SSV" "SSV"
152357310-152358004 amulet_ascii: field: "Command: Acknowledgment (ACK)" "Command: Acknowledgment" "Cmd: Acknowledgment" "Cmd: ACK" "ACK"
152357310-152358004 amulet_ascii: ack: "Command: Acknowledgment (ACK)" "Command: Acknowledgment" "Cmd: Acknowledgment" "Cmd: ACK" "ACK"
152578296-152578990 amulet_ascii: field: "Command: Set word variable (SWV)" "Command: Set word variable" "Cmd: Set word variable" "Cmd: SWV" "SWV"
152799220-152799914 amulet_ascii: bit: "Address high nibble: F" "Addr high 0xF" "Addr h 0xF"
153020093-153020787 amulet_ascii: bit: "Address low nibble: F" "Addr low 0xF" "Addr l 0xF"
152799220-153020787 amulet_ascii: field: "Address: 0xFF" "Addr: 0xFF" "0xFF"
153240961-153904295 amulet_ascii: field: "Value: 0x5a5a" "Val: 0x5a5a" "0x5a5a"
152578296-153904295 amulet_ascii: swv: "Command: Set word variable (SWV)" "Command: Set word variable" "Cmd: Set word variable" "Cmd: SWV" "SWV"
154124457-154125151 amulet_ascii: warning: "Unknown command: 0x00"
154180733-154181427 amulet_ascii: field: "Command: Acknowledgment (ACK)" "Command: Acknowledgment" "Cmd: Acknowledgment" "Cmd: ACK" "ACK"
154180733-154181427 amulet_ascii: ack: "Command: Acknowledgment (ACK)" "Command: Acknowledgment" "Cmd: Acknowledgment" "Cmd: ACK" "ACK"
206629102-206629796 amulet_ascii: field: "Command: Set word variable (SWV)" "Command: Set word variable" "Cmd: Set word variable" "Cmd: SWV" "SWV"
206629965-206630659 amulet_ascii: bit: "Address high nibble: F" "Addr high 0xF" "Addr h 0xF"
206630828-206631522 amulet_ascii: bit: "Address low nibble: F" "Addr low 0xF" "Addr l 0xF"
206629965-206631522 amulet_ascii: field: "Address: 0xFF" "Addr: 0xFF" "0xFF"
206631690-206634973 amulet_ascii: field: "Value: 0x0050" "Val: 0x0050" "0x0050"
206629102-206634973 amulet_ascii: swv: "Command: Set word variable (SWV)" "Command: Set word variable" "Cmd: Set word variable" "Cmd: SWV" "SWV"
206849999-206850693 amulet_ascii: field: "Command: Acknowledgment (ACK)" "Command: Acknowledgment" "Cmd: Acknowledgment" "Cmd: ACK" "ACK"
206849999-206850693 amulet_ascii: ack: "Command: Acknowledgment (ACK)" "Command: Acknowledgment" "Cmd: Acknowledgment" "Cmd: ACK" "ACK"
209272165-209272859 amulet_ascii: field: "Command: Set word variable (SWV)" "Command: Set word variable" "Cmd: Set word variable" "Cmd: SWV" "SWV"
209334386-209335080 amulet_ascii: bit: "Address high nibble: F" "Addr high 0xF" "Addr h 0xF"
209335337-209336031 amulet_ascii: bit: "Address low nibble: F" "Addr low 0xF" "Addr l 0xF"
209334386-209336031 amulet_ascii: field: "Address: 0xFF" "Addr: 0xFF" "0xFF"
209336289-209401207 amulet_ascii: field: "Value: 0x5a5a" "Val: 0x5a5a" "0x5a5a"
209272165-209401207 amulet_ascii: swv: "Command: Set word variable (SWV)" "Command: Set word variable" "Cmd: Set word variable" "Cmd: SWV" "SWV"
209401464-209402158 amulet_ascii: warning: "Unknown command: 0x00"
209402633-209403327 amulet_ascii: field: "Command: Acknowledgment (ACK)" "Command: Acknowledgment" "Cmd: Acknowledgment" "Cmd: ACK" "ACK"
209402633-209403327 amulet_ascii: ack: "Command: Acknowledgment (ACK)" "Command: Acknowledgment" "Cmd: Acknowledgment" "Cmd: ACK" "ACK"
209441799-209442493 amulet_ascii: field: "Command: Set byte variable (SBV)" "Command: Set byte variable" "Cmd: Set byte variable" "Cmd: SBV" "SBV"
209442662-209443356 amulet_ascii: bit: "Address high nibble: A" "Addr high 0xA" "Addr h 0xA"
209443525-209444219 amulet_ascii: bit: "Address low nibble: 0" "Addr low 0x0" "Addr l 0x0"
209442662-209444219 amulet_ascii: field: "Address: 0xA0" "Addr: 0xA0" "0xA0"
209444388-209445944 amulet_ascii: field: "Value: 0x00" "Val: 0x00" "0x00"
209441799-209445944 amulet_ascii: sbv: "Command: Set byte variable (SBV)" "Command: Set byte variable" "Cmd: Set byte variable" "Cmd: SBV" "SBV"
209501048-209501742 amulet_ascii: field: "Command: Acknowledgment (ACK)" "Command: Acknowledgment" "Cmd: Acknowledgment" "Cmd: ACK" "ACK"
209501048-209501742 amulet_ascii: ack: "Command: Acknowledgment (ACK)" "Command: Acknowledgment" "Cmd: Acknowledgment" "Cmd: ACK" "ACK"
209566668-209567362 amulet_ascii: field: "Command: Set byte variable (SBV)" "Command: Set byte variable" "Cmd: Set byte variable" "Cmd: SBV" "SBV"
209567531-209568225 amulet_ascii: bit: "Address high nibble: A" "Addr high 0xA" "Addr h 0xA"
209568393-209569087 amulet_ascii: bit: "Address low nibble: 1" "Addr low 0x1" "Addr l 0x1"
209567531-209569087 amulet_ascii: field: "Address: 0xA1" "Addr: 0xA1" "0xA1"
209569256-209570813 amulet_ascii: field: "Value: 0x00" "Val: 0x00" "0x00"
209566668-209570813 amulet_ascii: sbv: "Command: Set byte variable (SBV)" "Command: Set byte variable" "Cmd: Set byte variable" "Cmd: SBV" "SBV"
209601181-209601875 amulet_ascii: field: "Command: Acknowledgment (ACK)" "Command: Acknowledgment" "Cmd: Acknowledgment" "Cmd: ACK" "ACK"
209601181-209601875 amulet_ascii: ack: "Command: Acknowledgment (ACK)" "Command: Acknowledgment" "Cmd: Acknowledgment" "Cmd: ACK" "ACK"
209702058-209702752 amulet_ascii: field: "Command: Set byte variable (SBV)" "Command: Set byte variable" "Cmd: Set byte variable" "Cmd: SBV" "SBV"
209702920-209703614 amulet_ascii: bit: "Address high nibble: A" "Addr high 0xA" "Addr h 0xA"
209703783-209704477 amulet_ascii: bit: "Address low nibble: 2" "Addr low 0x2" "Addr l 0x2"
209702920-209704477 amulet_ascii: field: "Address: 0xA2" "Addr: 0xA2" "0xA2"
209704646-209706203 amulet_ascii: field: "Value: 0x00" "Val: 0x00" "0x00"
209702058-209706203 amulet_ascii: sbv: "Command: Set byte variable (SBV)" "Command: Set byte variable" "Cmd: Set byte variable" "Cmd: SBV" "SBV"
209707698-209708392 amulet_ascii: field: "Command: Acknowledgment (ACK)" "Command: Acknowledgment" "Cmd: Acknowledgment" "Cmd: ACK" "ACK"
209707698-209708392 amulet_ascii: ack: "Command: Acknowledgment (ACK)" "Command: Acknowledgment" "Cmd: Acknowledgment" "Cmd: ACK" "ACK"
209816768-209817462 amulet_ascii: field: "Command: Set byte variable (SBV)" "Command: Set byte variable" "Cmd: Set byte variable" "Cmd: SBV" "SBV"
209817631-209818325 amulet_ascii: bit: "Address high nibble: A" "Addr high 0xA" "Addr h 0xA"
209818494-209819188 amulet_ascii: bit: "Address low nibble: 3" "Addr low 0x3" "Addr l 0x3"
209817631-209819188 amulet_ascii: field: "Address: 0xA3" "Addr: 0xA3" "0xA3"
209819357-209820913 amulet_ascii: field: "Value: 0x00" "Val: 0x00" "0x00"
209816768-209820913 amulet_ascii: sbv: "Command: Set byte variable (SBV)" "Command: Set byte variable" "Cmd: Set byte variable" "Cmd: SBV" "SBV"
209822478-209823172 amulet_ascii: field: "Command: Acknowledgment (ACK)" "Command: Acknowledgment" "Cmd: Acknowledgment" "Cmd: ACK" "ACK"
209822478-209823172 amulet_ascii: ack: "Command: Acknowledgment (ACK)" "Command: Acknowledgment" "Cmd: Acknowledgment" "Cmd: ACK" "ACK"
209941707-209942401 amulet_ascii: field: "Command: Set byte variable (SBV)" "Command: Set byte variable" "Cmd: Set byte variable" "Cmd: SBV" "SBV"
209942570-209943264 amulet_ascii: bit: "Address high nibble: A" "Addr high 0xA" "Addr h 0xA"
209943433-209944127 amulet_ascii: bit: "Address low nibble: 4" "Addr low 0x4" "Addr l 0x4"
209942570-209944127 amulet_ascii: field: "Address: 0xA4" "Addr: 0xA4" "0xA4"
209944295-209945852 amulet_ascii: field: "Value: 0x00" "Val: 0x00" "0x00"
209941707-209945852 amulet_ascii: sbv: "Command: Set byte variable (SBV)" "Command: Set byte variable" "Cmd: Set byte variable" "Cmd: SBV" "SBV"
210001184-210001878 amulet_ascii: field: "Command: Acknowledgment (ACK)" "Command: Acknowledgment" "Cmd: Acknowledgment" "Cmd: ACK" "ACK"
210001184-210001878 amulet_ascii: ack: "Command: Acknowledgment (ACK)" "Command: Acknowledgment" "Cmd: Acknowledgment" "Cmd: ACK" "ACK"
210066825-210067519 amulet_ascii: field: "Command: Set byte variable (SBV)" "Command: Set byte variable" "Cmd: Set byte variable" "Cmd: SBV" "SBV"
210067688-210068382 amulet_ascii: bit: "Address high nibble: A" "Addr high 0xA" "Addr h 0xA"
210068551-210069245 amulet_ascii: bit: "Address low nibble: 5" "Addr low 0x5" "Addr l 0x5"
210067688-210069245 amulet_ascii: field: "Address: 0xA5" "Addr: 0xA5" "0xA5"
210069413-210070970 amulet_ascii: field: "Value: 0x00" "Val: 0x00" "0x00"
210066825-210070970 amulet_ascii: sbv: "Command: Set byte variable (SBV)" "Command: Set byte variable" "Cmd: Set byte variable" "Cmd: SBV" "SBV"
210101236-210101930 amulet_ascii: field: "Command: Acknowledgment (ACK)" "Command: Acknowledgment" "Cmd: Acknowledgment" "Cmd: ACK" "ACK"
210101236-210101930 amulet_ascii: ack: "Command: Acknowledgment (ACK)" "Command: Acknowledgment" "Cmd: Acknowledgment" "Cmd: ACK" "ACK"
210191938-210192632 amulet_ascii: field: "Command: Set byte variable (SBV)" "Command: Set byte variable" "Cmd: Set byte variable" "Cmd: SBV" "SBV"
210192801-210193495 amulet_ascii: bit: "Address high nibble: A" "Addr high 0xA" "Addr h 0xA"
210193663-210194357 amulet_ascii: bit: "Address low nibble: 6" "Addr low 0x6" "Addr l 0x6"
210192801-210194357 amulet_ascii: field: "Address: 0xA6" "Addr: 0xA6" "0xA6"
210194526-210196083 amulet_ascii: field: "Value: 0x00" "Val: 0x00" "0x00"
210191938-210196083 amulet_ascii: sbv: "Command: Set byte variable (SBV)" "Command: Set byte variable" "Cmd: Set byte variable" "Cmd: SBV" "SBV"
210201369-210202063 amulet_ascii: field: "Command: Acknowledgment (ACK)" "Command: Acknowledgment" "Cmd: Acknowledgment" "Cmd: ACK" "ACK"
210201369-210202063 amulet_ascii: ack: "Command: Acknowledgment (ACK)" "Command: Acknowledgment" "Cmd: Acknowledgment" "Cmd: ACK" "ACK"
210326915-210327609 amulet_ascii: field: "Command: Set byte variable (SBV)" "Command: Set byte variable" "Cmd: Set byte variable" "Cmd: SBV" "SBV"
210327778-210328472 amulet_ascii: bit: "Address high nibble: A" "Addr high 0xA" "Addr h 0xA"
210328641-210329335 amulet_ascii: bit: "Address low nibble: 7" "Addr low 0x7" "Addr l 0x7"
210327778-210329335 amulet_ascii: field: "Address: 0xA7" "Addr: 0xA7" "0xA7"
210329504-210331060 amulet_ascii: field: "Value: 0x00" "Val: 0x00" "0x00"
210326915-210331060 amulet_ascii: sbv: "Command: Set byte variable (SBV)" "Command: Set byte variable" "Cmd: Set byte variable" "Cmd: SBV" "SBV"
210332518-210333212 amulet_ascii: field: "Command: Acknowledgment (ACK)" "Command: Acknowledgment" "Cmd: Acknowledgment" "Cmd: ACK" "ACK"
210332518-210333212 amulet_ascii: ack: "Command: Acknowledgment (ACK)" "Command: Acknowledgment" "Cmd: Acknowledgment" "Cmd: ACK" "ACK"
210441924-210442618 amulet_ascii: field: "Command: Set string variable (SSV)" "Command: Set string variable" "Cmd: Set string variable" "Cmd: SSV" "SSV"
210442787-210443481 amulet_ascii: bit: "Address high nibble: C" "Addr high 0xC" "Addr h 0xC"
210443650-210444344 amulet_ascii: bit: "Address low nibble: 5" "Addr low 0x5" "Addr l 0x5"
210442787-210444344 amulet_ascii: field: "Address: 0xC5" "Addr: 0xC5" "0xC5"
210444513-210445207 amulet_ascii: bit: "E"
210445375-210446069 amulet_ascii: bit: "N"
210446238-210446932 amulet_ascii: bit: "C"
210447101-210447795 amulet_ascii: bit: "O"
210447964-210448658 amulet_ascii: bit: "R"
210448826-210449520 amulet_ascii: bit: "E"
210449689-210450383 amulet_ascii: bit: " "
210450552-210451246 amulet_ascii: bit: "S"
210451415-210452109 amulet_ascii: bit: "Y"
210452277-210452971 amulet_ascii: bit: "S"
210453140-210453834 amulet_ascii: bit: "T"
210454003-210454697 amulet_ascii: bit: "E"
210454866-210455560 amulet_ascii: bit: "M"
210455729-210456423 amulet_ascii: bit: " "
210456591-210457285 amulet_ascii: bit: "S"
210457454-210458148 amulet_ascii: bit: "T"
210458317-210459011 amulet_ascii: bit: "A"
210459180-210459874 amulet_ascii: bit: "T"
210460042-210460736 amulet_ascii: bit: "U"
210460905-210461599 amulet_ascii: bit: "S"
210461768-210462462 amulet_ascii: bit: "NULL"
210444513-210462462 amulet_ascii: field: "Value: ENCORE SYSTEM STATUS" "Val: ENCORE SYSTEM STATUS" "ENCORE SYSTEM STATUS"
210441924-210462462 amulet_ascii: ssv: "Command: Set string variable (SSV)" "Command: Set string variable" "Cmd: Set string variable" "Cmd: SSV" "SSV"
210510742-210511436 amulet_ascii: field: "Command: Acknowledgment (ACK)" "Command: Acknowledgment" "Cmd: Acknowledgment" "Cmd: ACK" "ACK"
210510742-210511436 amulet_ascii: ack: "Command: Acknowledgment (ACK)" "Command: Acknowledgment" "Cmd: Acknowledgment" "Cmd: ACK" "ACK"
210640068-210640762 amulet_ascii: field: "Command: Set string variable (SSV)" "Command: Set string variable" "Cmd: Set string variable" "Cmd: SSV" "SSV"
210640931-210641625 amulet_ascii: bit: "Address high nibble: C" "Addr high 0xC" "Addr h 0xC"
210641794-210642488 amulet_ascii: bit: "Address low nibble: 5" "Addr low 0x5" "Addr l 0x5"
210640931-210642488 amulet_ascii: field: "Address: 0xC5" "Addr: 0xC5" "0xC5"
210642657-210643351 amulet_ascii: bit: "E"
210643520-210644214 amulet_ascii: bit: "N"
210644382-210645076 amulet_ascii: bit: "C"
210645245-210645939 amulet_ascii: bit: "O"
210646108-210646802 amulet_ascii: bit: "R"
210646971-210647665 amulet_ascii: bit: "E"
210647833-210648527 amulet_ascii: bit: " "
210648696-210649390 amulet_ascii: bit: "S"
210649559-210650253 amulet_ascii: bit: "Y"
210650422-210651116 amulet_ascii: bit: "S"
210651284-210651978 amulet_ascii: bit: "T"
210652147-210652841 amulet_ascii: bit: "E"
210653010-210653704 amulet_ascii: bit: "M"
210653873-210654567 amulet_ascii: bit: " "
210654736-210655430 amulet_ascii: bit: "S"
210655598-210656292 amulet_ascii: bit: "T"
210656461-210657155 amulet_ascii: bit: "A"
210657324-210658018 amulet_ascii: bit: "T"
210658187-210658881 amulet_ascii: bit: "U"
210659049-210659743 amulet_ascii: bit: "S"
210659912-210660606 amulet_ascii: bit: " "
210660775-210661469 amulet_ascii: bit: " "
210661638-210662332 amulet_ascii: bit: " "
210662500-210663194 amulet_ascii: bit: " "
210663363-210664057 amulet_ascii: bit: " "
210664226-210664920 amulet_ascii: bit: " "
210665089-210665783 amulet_ascii: bit: "V"
210665952-210666646 amulet_ascii: bit: "e"
210666814-210667508 amulet_ascii: bit: "r"
210667677-210668371 amulet_ascii: bit: " "
210668540-210669234 amulet_ascii: bit: "2"
210669403-210670097 amulet_ascii: bit: "."
210670265-210670959 amulet_ascii: bit: "3"
210671128-210671822 amulet_ascii: bit: "3"
210671991-210672685 amulet_ascii: bit: "."
210672854-210673548 amulet_ascii: bit: "0"
210673717-210674411 amulet_ascii: bit: "1"
210674579-210675273 amulet_ascii: bit: "NULL"
210642657-210675273 amulet_ascii: field: "Value: ENCORE SYSTEM STATUS      Ver 2.33.01" "Val: ENCORE SYSTEM STATUS      Ver 2.33.01" "ENCORE SYSTEM STATUS      Ver 2.33.01"
210640068-210675273 amulet_ascii: ssv: "Command: Set string variable (SSV)" "Command: Set string variable" "Cmd: Set string variable" "Cmd: SSV" "SSV"
210827413-210828107 amulet_ascii: field: "Command: Acknowledgment (ACK)" "Command: Acknowledgment" "Cmd: Acknowledgment" "Cmd: ACK" "ACK"
210827413-210828107 amulet_ascii: ack: "Command: Acknowledgment (ACK)" "Command: Acknowledgment" "Cmd: Acknowledgment" "Cmd: ACK" "ACK"
210952218-210952912 amulet_ascii: field: "Command: Set string variable (SSV)" "Command: Set string variable" "Cmd: Set string variable" "Cmd: SSV" "SSV"
210953081-210953775 amulet_ascii: bit: "Address high nibble: B" "Addr high 0xB" "Addr h 0xB"
210953943-210954637 amulet_ascii: bit: "Address low nibble: 0" "Addr low 0x0" "Addr l 0x0"
210953081-210954637 amulet_ascii: field: "Address: 0xB0" "Addr: 0xB0" "0xB0"
210954806-210955500 amulet_ascii: bit: " "
210955669-210956363 amulet_ascii: bit: " "
210956532-210957226 amulet_ascii: bit: " "
210957394-210958088 amulet_ascii: bit: " "
210958257-210958951 amulet_ascii: bit: " "
210959120-210959814 amulet_ascii: bit: " "
210959983-210960677 amulet_ascii: bit: " "
210960845-210961539 amulet_ascii: bit: " "
210961708-210962402 amulet_ascii: bit: " "
210962571-210963265 amulet_ascii: bit: " "
210963434-210964128 amulet_ascii: bit: " "
210964297-210964991 amulet_ascii: bit: " "
210965159-210965853 amulet_ascii: bit: " "
210966022-210966716 amulet_ascii: bit: " "
210966885-210967579 amulet_ascii: bit: " "
210967748-210968442 amulet_ascii: bit: " "
210968610-210969304 amulet_ascii: bit: " "
210969473-210970167 amulet_ascii: bit: " "
210970336-210971030 amulet_ascii: bit: " "
210971199-210971893 amulet_ascii: bit: "NULL"
210954806-210971893 amulet_ascii: field: "Value:                    " "Val:                    " "                   "
210952218-210971893 amulet_ascii: ssv: "Command: Set string variable (SSV)" "Command: Set string variable" "Cmd: Set string variable" "Cmd: SSV" "SSV"
211149801-211150495 amulet_ascii: field: "Command: Acknowledgment (ACK)" "Command: Acknowledgment" "Cmd: Acknowledgment" "Cmd: ACK" "ACK"
211149801-211150495 amulet_ascii: ack: "Command: Acknowledgment (ACK)" "Command: Acknowledgment" "Cmd: Acknowledgment" "Cmd: ACK" "ACK"
211264704-211265398 amulet_ascii: field: "Command: Set string variable (SSV)" "Command: Set string variable" "Cmd: Set string variable" "Cmd: SSV" "SSV"
211265566-211266260 amulet_ascii: bit: "Address high nibble: B" "Addr high 0xB" "Addr h 0xB"
211266429-211267123 amulet_ascii: bit: "Address low nibble: 0" "Addr low 0x0" "Addr l 0x0"
211265566-211267123 amulet_ascii: field: "Address: 0xB0" "Addr: 0xB0" "0xB0"
211267292-211267986 amulet_ascii: bit: "E"
211268155-211268849 amulet_ascii: bit: "N"
211269017-211269711 amulet_ascii: bit: "C"
211269880-211270574 amulet_ascii: bit: "O"
211270743-211271437 amulet_ascii: bit: "R"
211271606-211272300 amulet_ascii: bit: "E"
211272468-211273162 amulet_ascii: bit: " "
211273331-211274025 amulet_ascii: bit: "V"
211274194-211274888 amulet_ascii: bit: "P"
211275057-211275751 amulet_ascii: bit: "/"
211275920-211276614 amulet_ascii: bit: "3"
211276782-211277476 amulet_ascii: bit: "G"
211277645-211278339 amulet_ascii: bit: ":"
211278508-211279202 amulet_ascii: bit: " "
211279371-211280065 amulet_ascii: bit: "0"
211280233-211280927 amulet_ascii: bit: " "
211281096-211281790 amulet_ascii: bit: "NULL"
211267292-211281790 amulet_ascii: field: "Value: ENCORE VP/3G: 0 " "Val: ENCORE VP/3G: 0 " "ENCORE VP/3G: 0 "
211264704-211281790 amulet_ascii: ssv: "Command: Set string variable (SSV)" "Command: Set string variable" "Cmd: Set string variable" "Cmd: SSV" "SSV"
211478918-211479612 amulet_ascii: field: "Command: Acknowledgment (ACK)" "Command: Acknowledgment" "Cmd: Acknowledgment" "Cmd: ACK" "ACK"
211478918-211479612 amulet_ascii: ack: "Command: Acknowledgment (ACK)" "Command: Acknowledgment" "Cmd: Acknowledgment" "Cmd: ACK" "ACK"
211577211-211577905 amulet_ascii: field: "Command: Set string variable (SSV)" "Command: Set string variable" "Cmd: Set string variable" "Cmd: SSV" "SSV"
211578074-211578768 amulet_ascii: bit: "Address high nibble: B" "Addr high 0xB" "Addr h 0xB"
211578937-211579631 amulet_ascii: bit: "Address low nibble: 2" "Addr low 0x2" "Addr l 0x2"
211578074-211579631 amulet_ascii: field: "Address: 0xB2" "Addr: 0xB2" "0xB2"
211579799-211580493 amulet_ascii: bit: "E"
211580662-211581356 amulet_ascii: bit: "N"
211581525-211582219 amulet_ascii: bit: "C"
211582388-211583082 amulet_ascii: bit: "O"
211583250-211583944 amulet_ascii: bit: "R"
211584113-211584807 amulet_ascii: bit: "E"
211584976-211585670 amulet_ascii: bit: " "
211585839-211586533 amulet_ascii: bit: "V"
211586701-211587395 amulet_ascii: bit: "P"
211587564-211588258 amulet_ascii: bit: "X"
211588427-211589121 amulet_ascii: bit: "/"
211589290-211589984 amulet_ascii: bit: "3"
211590153-211590847 amulet_ascii: bit: "G"
211591015-211591709 amulet_ascii: bit: ":"
211591878-211592572 amulet_ascii: bit: " "
211592741-211593435 amulet_ascii: bit: "0"
211593604-211594298 amulet_ascii: bit: " "
211594466-211595160 amulet_ascii: bit: "NULL"
211579799-211595160 amulet_ascii: field: "Value: ENCORE VPX/3G: 0 " "Val: ENCORE VPX/3G: 0 " "ENCORE VPX/3G: 0 "
211577211-211595160 amulet_ascii: ssv: "Command: Set string variable (SSV)" "Command: Set string variable" "Cmd: Set string variable" "Cmd: SSV" "SSV"
211973981-211974675 amulet_ascii: field: "Command: Acknowledgment (ACK)" "Command: Acknowledgment" "Cmd: Acknowledgment" "Cmd: ACK" "ACK"
211973981-211974675 amulet_ascii: ack: "Command: Acknowledgment (ACK)" "Command: Acknowledgment" "Cmd: Acknowledgment" "Cmd: ACK" "ACK"
212067335-212068029 amulet_ascii: field: "Command: Set string variable (SSV)" "Command: Set string variable" "Cmd: Set string variable" "Cmd: SSV" "SSV"
212068198-212068892 amulet_ascii: bit: "Address high nibble: B" "Addr high 0xB" "Addr h 0xB"
212069061-212069755 amulet_ascii: bit: "Address low nibble: 4" "Addr low 0x4" "Addr l 0x4"
212068198-212069755 amulet_ascii: field: "Address: 0xB4" "Addr: 0xB4" "0xB4"
212069924-212070618 amulet_ascii: bit: "S"
212070786-212071480 amulet_ascii: bit: "C"
212071649-212072343 amulet_ascii: bit: "R"
212072512-212073206 amulet_ascii: bit: "E"
212073375-212074069 amulet_ascii: bit: "E"
212074237-212074931 amulet_ascii: bit: "N"
212075100-212075794 amulet_ascii: bit: "P"
212075963-212076657 amulet_ascii: bit: "R"
212076826-212077520 amulet_ascii: bit: "O"
212077689-212078383 amulet_ascii: bit: " "
212078551-212079245 amulet_ascii: bit: "I"
212079414-212080108 amulet_ascii: bit: "I"
212080277-212080971 amulet_ascii: bit: "/"
212081140-212081834 amulet_ascii: bit: "3"
212082002-212082696 amulet_ascii: bit: "G"
212082865-212083559 amulet_ascii: bit: ":"
212083728-212084422 amulet_ascii: bit: " "
212084591-212085285 amulet_ascii: bit: "0"
212085453-212086147 amulet_ascii: bit: " "
212086316-212087010 amulet_ascii: bit: "NULL"
212069924-212087010 amulet_ascii: field: "Value: SCREENPRO II/3G: 0 " "Val: SCREENPRO II/3G: 0 " "SCREENPRO II/3G: 0 "
212067335-212087010 amulet_ascii: ssv: "Command: Set string variable (SSV)" "Command: Set string variable" "Cmd: Set string variable" "Cmd: SSV" "SSV"
212509686-212510380 amulet_ascii: field: "Command: Acknowledgment (ACK)" "Command: Acknowledgment" "Cmd: Acknowledgment" "Cmd: ACK" "ACK"
212509686-212510380 amulet_ascii: ack: "Command: Acknowledgment (ACK)" "Command: Acknowledgment" "Cmd: Acknowledgment" "Cmd: ACK" "ACK"
212567292-212567986 amulet_ascii: field: "Command: Set string variable (SSV)" "Command: Set string variable" "Cmd: Set string variable" "Cmd: SSV" "SSV"
212568155-212568849 amulet_ascii: bit: "Address high nibble: B" "Addr high 0xB" "Addr h 0xB"
212569017-212569711 amulet_ascii: bit: "Address low nibble: 6" "Addr low 0x6" "Addr l 0x6"
212568155-212569711 amulet_ascii: field: "Address: 0xB6" "Addr: 0xB6" "0xB6"
212569880-212570574 amulet_ascii: bit: "P"
212570743-212571437 amulet_ascii: bit: "R"
212571606-212572300 amulet_ascii: bit: "E"
212572468-212573162 amulet_ascii: bit: "P"
212573331-212574025 amulet_ascii: bit: "R"
212574194-212574888 amulet_ascii: bit: "O"
212575057-212575751 amulet_ascii: bit: " "
212575920-212576614 amulet_ascii: bit: "I"
212576782-212577476 amulet_ascii: bit: "I"
212577645-212578339 amulet_ascii: bit: ":"
212578508-212579202 amulet_ascii: bit: " "
212579371-212580065 amulet_ascii: bit: "0"
212580233-212580927 amulet_ascii: bit: " "
212581096-212581790 amulet_ascii: bit: "NULL"
212569880-212581790 amulet_ascii: field: "Value: PREPRO II: 0 " "Val: PREPRO II: 0 " "PREPRO II: 0 "
212567292-212581790 amulet_ascii: ssv: "Command: Set string variable (SSV)" "Command: Set string variable" "Cmd: Set string variable" "Cmd: SSV" "SSV"
213125010-213125704 amulet_ascii: field: "Command: Acknowledgment (ACK)" "Command: Acknowledgment" "Cmd: Acknowledgment" "Cmd: ACK" "ACK"
213125010-213125704 amulet_ascii: ack: "Command: Acknowledgment (ACK)" "Command: Acknowledgment" "Cmd: Acknowledgment" "Cmd: ACK" "ACK"
213192535-213193229 amulet_ascii: field: "Command: Set string variable (SSV)" "Command: Set string variable" "Cmd: Set string variable" "Cmd: SSV" "SSV"
213193397-213194091 amulet_ascii: bit: "Address high nibble: B" "Addr high 0xB" "Addr h 0xB"
213194260-213194954 amulet_ascii: bit: "Address low nibble: 8" "Addr low 0x8" "Addr l 0x8"
213193397-213194954 amulet_ascii: field: "Address: 0xB8" "Addr: 0xB8" "0xB8"
213195123-213195817 amulet_ascii: bit: "I"
213195986-213196680 amulet_ascii: bit: "M"
213196849-213197543 amulet_ascii: bit: "A"
213197711-213198405 amulet_ascii: bit: "G"
213198574-213199268 amulet_ascii: bit: "E"
213199437-213200131 amulet_ascii: bit: "P"
213200300-213200994 amulet_ascii: bit: "R"
213201162-213201856 amulet_ascii: bit: "O"
213202025-213202719 amulet_ascii: bit: " "
213202888-213203582 amulet_ascii: bit: "H"
213203751-213204445 amulet_ascii: bit: "D"
213204613-213205307 amulet_ascii: bit: "/"
213205476-213206170 amulet_ascii: bit: "3"
213206339-213207033 amulet_ascii: bit: "G"
213207202-213207896 amulet_ascii: bit: ":"
213208065-213208759 amulet_ascii: bit: " "
213208927-213209621 amulet_ascii: bit: "0"
213209790-213210484 amulet_ascii: bit: "NULL"
213195123-213210484 amulet_ascii: field: "Value: IMAGEPRO HD/3G: 0" "Val: IMAGEPRO HD/3G: 0" "IMAGEPRO HD/3G: 0"
213192535-213210484 amulet_ascii: ssv: "Command: Set string variable (SSV)" "Command: Set string variable" "Cmd: Set string variable" "Cmd: SSV" "SSV"
213522158-213522852 amulet_ascii: field: "Command: Acknowledgment (ACK)" "Command: Acknowledgment" "Cmd: Acknowledgment" "Cmd: ACK" "ACK"
213522158-213522852 amulet_ascii: ack: "Command: Acknowledgment (ACK)" "Command: Acknowledgment" "Cmd: Acknowledgment" "Cmd: ACK" "ACK"
213630122-213630816 amulet_ascii: field: "Command: Set string variable (SSV)" "Command: Set string variable" "Cmd: Set string variable" "Cmd: SSV" "SSV"
213630985-213631679 amulet_ascii: bit: "Address high nibble: B" "Addr high 0xB" "Addr h 0xB"
213631848-213632542 amulet_ascii: bit: "Address low nibble: A" "Addr low 0xA" "Addr l 0xA"
213630985-213632542 amulet_ascii: field: "Address: 0xBA" "Addr: 0xBA" "0xBA"
213632710-213633404 amulet_ascii: bit: "I"
213633573-213634267 amulet_ascii: bit: "M"
213634436-213635130 amulet_ascii: bit: "A"
213635299-213635993 amulet_ascii: bit: "G"
213636162-213636856 amulet_ascii: bit: "E"
213637024-213637718 amulet_ascii: bit: "P"
213637887-213638581 amulet_ascii: bit: "R"
213638750-213639444 amulet_ascii: bit: "O"
213639613-213640307 amulet_ascii: bit: "-"
213640475-213641169 amulet_ascii: bit: "I"
213641338-213642032 amulet_ascii: bit: "I"
213642201-213642895 amulet_ascii: bit: "/"
213643064-213643758 amulet_ascii: bit: "D"
213643927-213644621 amulet_ascii: bit: "U"
213644789-213645483 amulet_ascii: bit: "A"
213645652-213646346 amulet_ascii: bit: "L"
213646515-213647209 amulet_ascii: bit: ":"
213647378-213648072 amulet_ascii: bit: " "
213648240-213648934 amulet_ascii: bit: "0"
213649103-213649797 amulet_ascii: bit: "NULL"
213632710-213649797 amulet_ascii: field: "Value: IMAGEPRO-II/DUAL: 0" "Val: IMAGEPRO-II/DUAL: 0" "IMAGEPRO-II/DUAL: 0"
213630122-213649797 amulet_ascii: ssv: "Command: Set string variable (SSV)" "Command: Set string variable" "Cmd: Set string variable" "Cmd: SSV" "SSV"
214086778-214087472 amulet_ascii: field: "Command: Acknowledgment (ACK)" "Command: Acknowledgment" "Cmd: Acknowledgment" "Cmd: ACK" "ACK"
214086778-214087472 amulet_ascii: ack: "Command: Acknowledgment (ACK)" "Command: Acknowledgment" "Cmd: Acknowledgment" "Cmd: ACK" "ACK"
214192486-214193180 amulet_ascii: field: "Command: Set string variable (SSV)" "Command: Set string variable" "Cmd: Set string variable" "Cmd: SSV" "SSV"
214193349-214194043 amulet_ascii: bit: "Address high nibble: B" "Addr high 0xB" "Addr h 0xB"
214194211-214194905 amulet_ascii: bit: "Address low nibble: C" "Addr low 0xC" "Addr l 0xC"
214193349-214194905 amulet_ascii: field: "Address: 0xBC" "Addr: 0xBC" "0xBC"
214195074-214195768 amulet_ascii: bit: "P"
214195937-214196631 amulet_ascii: bit: "D"
214196800-214197494 amulet_ascii: bit: "S"
214197662-214198356 amulet_ascii: bit: ":"
214198525-214199219 amulet_ascii: bit: " "
214199388-214200082 amulet_ascii: bit: "0"
214200251-214200945 amulet_ascii: bit: "NULL"
214195074-214200945 amulet_ascii: field: "Value: PDS: 0" "Val: PDS: 0" "PDS: 0"
214192486-214200945 amulet_ascii: ssv: "Command: Set string variable (SSV)" "Command: Set string variable" "Cmd: Set string variable" "Cmd: SSV" "SSV"
214734426-214735120 amulet_ascii: field: "Command: Acknowledgment (ACK)" "Command: Acknowledgment" "Cmd: Acknowledgment" "Cmd: ACK" "ACK"
214734426-214735120 amulet_ascii: ack: "Command: Acknowledgment (ACK)" "Command: Acknowledgment" "Cmd: Acknowledgment" "Cmd: ACK" "ACK"
214817647-214818341 amulet_ascii: field: "Command: Set string variable (SSV)" "Command: Set string variable" "Cmd: Set string variable" "Cmd: SSV" "SSV"
214818510-214819204 amulet_ascii: bit: "Address high nibble: B" "Addr high 0xB" "Addr h 0xB"
214819373-214820067 amulet_ascii: bit: "Address low nibble: E" "Addr low 0xE" "Addr l 0xE"
214818510-214820067 amulet_ascii: field: "Address: 0xBE" "Addr: 0xBE" "0xBE"
214820236-214820930 amulet_ascii: bit: "R"
214821098-214821792 amulet_ascii: bit: "O"
214821961-214822655 amulet_ascii: bit: "U"
214822824-214823518 amulet_ascii: bit: "T"
214823687-214824381 amulet_ascii: bit: "E"
214824549-214825243 amulet_ascii: bit: "R"
214825412-214826106 amulet_ascii: bit: "S"
214826275-214826969 amulet_ascii: bit: ":"
214827138-214827832 amulet_ascii: bit: " "
214828001-214828695 amulet_ascii: bit: "0"
214828863-214829557 amulet_ascii: bit: "NULL"
214820236-214829557 amulet_ascii: field: "Value: ROUTERS: 0" "Val: ROUTERS: 0" "ROUTERS: 0"
214817647-214829557 amulet_ascii: ssv: "Command: Set string variable (SSV)" "Command: Set string variable" "Cmd: Set string variable" "Cmd: SSV" "SSV"
214981216-214981910 amulet_ascii: field: "Command: Acknowledgment (ACK)" "Command: Acknowledgment" "Cmd: Acknowledgment" "Cmd: ACK" "ACK"
214981216-214981910 amulet_ascii: ack: "Command: Acknowledgment (ACK)" "Command: Acknowledgment" "Cmd: Acknowledgment" "Cmd: ACK" "ACK"
215067737-215068431 amulet_ascii: field: "Command: Set string variable (SSV)" "Command: Set string variable" "Cmd: Set string variable" "Cmd: SSV" "SSV"
215068600-215069294 amulet_ascii: bit: "Address high nibble: C" "Addr high 0xC" "Addr h 0xC"
215069462-215070156 amulet_ascii: bit: "Address low nibble: 0" "Addr low 0x0" "Addr l 0x0"
215068600-215070156 amulet_ascii: field: "Address: 0xC0" "Addr: 0xC0" "0xC0"
215070325-215071019 amulet_ascii: bit: "F"
215071188-215071882 amulet_ascii: bit: "S"
215072051-215072745 amulet_ascii: bit: "N"
215072913-215073607 amulet_ascii: bit: ":"
215073776-215074470 amulet_ascii: bit: " "
215074639-215075333 amulet_ascii: bit: "0"
215075502-215076196 amulet_ascii: bit: "NULL"
215070325-215076196 amulet_ascii: field: "Value: FSN: 0" "Val: FSN: 0" "FSN: 0"
215067737-215076196 amulet_ascii: ssv: "Command: Set string variable (SSV)" "Command: Set string variable" "Cmd: Set string variable" "Cmd: SSV" "SSV"
215322162-215322856 amulet_ascii: field: "Command: Acknowledgment (ACK)" "Command: Acknowledgment" "Cmd: Acknowledgment" "Cmd: ACK" "ACK"
215322162-215322856 amulet_ascii: ack: "Command: Acknowledgment (ACK)" "Command: Acknowledgment" "Cmd: Acknowledgment" "Cmd: ACK" "ACK"
245030101-245030795 amulet_ascii: field: "Command: Set word variable (SWV)" "Command: Set word variable" "Cmd: Set word variable" "Cmd: SWV" "SWV"
245030964-245031658 amulet_ascii: bit: "Address high nibble: F" "Addr high 0xF" "Addr h 0xF"
245031826-245032520 amulet_ascii: bit: "Address low nibble: F" "Addr low 0xF" "Addr l 0xF"
245030964-245032520 amulet_ascii: field: "Address: 0xFF" "Addr: 0xFF" "0xFF"
245032689-245035971 amulet_ascii: field: "Value: 0x00fe" "Val: 0x00fe" "0x00fe"
245030101-245035971 amulet_ascii: swv: "Command: Set word variable (SWV)" "Command: Set word variable" "Cmd: Set word variable" "Cmd: SWV" "SWV"
245037634-245038328 amulet_ascii: field: "Command: Acknowledgment (ACK)" "Command: Acknowledgment" "Cmd: Acknowledgment" "Cmd: ACK" "ACK"
245037634-245038328 amulet_ascii: ack: "Command: Acknowledgment (ACK)" "Command: Acknowledgment" "Cmd: Acknowledgment" "Cmd: ACK" "ACK"
246803409-246804103 amulet_ascii: field: "Command: Set word variable (SWV)" "Command: Set word variable" "Cmd: Set word variable" "Cmd: SWV" "SWV"
246804361-246805055 amulet_ascii: bit: "Address high nibble: F" "Addr high 0xF" "Addr h 0xF"
246805312-246806006 amulet_ascii: bit: "Address low nibble: F" "Addr low 0xF" "Addr l 0xF"
246804361-246806006 amulet_ascii: field: "Address: 0xFF" "Addr: 0xFF" "0xFF"
246806263-246809812 amulet_ascii: field: "Value: 0x5a5a" "Val: 0x5a5a" "0x5a5a"
246803409-246809812 amulet_ascii: swv: "Command: Set word variable (SWV)" "Command: Set word variable" "Cmd: Set word variable" "Cmd: SWV" "SWV"
246810069-246810763 amulet_ascii: warning: "Unknown command: 0x00"
246811158-246811852 amulet_ascii: field: "Command: Acknowledgment (ACK)" "Command: Acknowledgment" "Cmd: Acknowledgment" "Cmd: ACK" "ACK"
246811158-246811852 amulet_ascii: ack: "Command: Acknowledgment (ACK)" "Command: Acknowledgment" "Cmd: Acknowledgment" "Cmd: ACK" "ACK"
246824127-246824821 amulet_ascii: field: "Command: Set string variable (SSV)" "Command: Set string variable" "Cmd: Set string variable" "Cmd: SSV" "SSV"
246824989-246825683 amulet_ascii: bit: "Address high nibble: 9" "Addr high 0x9" "Addr h 0x9"
246825852-246826546 amulet_ascii: bit: "Address low nibble: A" "Addr low 0xA" "Addr l 0xA"
246824989-246826546 amulet_ascii: field: "Address: 0x9A" "Addr: 0x9A" "0x9A"
246826715-246827409 amulet_ascii: bit: "S"
246827578-246828272 amulet_ascii: bit: "a"
246828440-246829134 amulet_ascii: bit: "v"
246829303-246829997 amulet_ascii: bit: "i"
246830166-246830860 amulet_ascii: bit: "n"
246831029-246831723 amulet_ascii: bit: "g"
246831891-246832585 amulet_ascii: bit: " "
246832754-246833448 amulet_ascii: bit: "R"
246833617-246834311 amulet_ascii: bit: "t"
246834480-246835174 amulet_ascii: bit: "r"
246835343-246836037 amulet_ascii: bit: "S"
246836205-246836899 amulet_ascii: bit: "p"
246837068-246837762 amulet_ascii: bit: "e"
246837931-246838625 amulet_ascii: bit: "c"
246838794-246839488 amulet_ascii: bit: " "
246839656-246840350 amulet_ascii: bit: "3"
246840519-246841213 amulet_ascii: bit: "."
246841382-246842076 amulet_ascii: bit: "."
246842245-246842939 amulet_ascii: bit: "."
246843107-246843801 amulet_ascii: bit: "NULL"
246826715-246843801 amulet_ascii: field: "Value: Saving RtrSpec 3..." "Val: Saving RtrSpec 3..." "Saving RtrSpec 3..."
246824127-246843801 amulet_ascii: ssv: "Command: Set string variable (SSV)" "Command: Set string variable" "Cmd: Set string variable" "Cmd: SSV" "SSV"
246848302-246848996 amulet_ascii: field: "Command: Acknowledgment (ACK)" "Command: Acknowledgment" "Cmd: Acknowledgment" "Cmd: ACK" "ACK"
246848302-246848996 amulet_ascii: ack: "Command: Acknowledgment (ACK)" "Command: Acknowledgment" "Cmd: Acknowledgment" "Cmd: ACK" "ACK"
263924637-263925331 amulet_ascii: field: "Command: Set word variable (SWV)" "Command: Set word variable" "Cmd: Set word variable" "Cmd: SWV" "SWV"
263925500-263926194 amulet_ascii: bit: "Address high nibble: F" "Addr high 0xF" "Addr h 0xF"
263926362-263927056 amulet_ascii: bit: "Address low nibble: F" "Addr low 0xF" "Addr l 0xF"
263925500-263927056 amulet_ascii: field: "Address: 0xFF" "Addr: 0xFF" "0xFF"
263927225-263930507 amulet_ascii: field: "Value: 0xffff" "Val: 0xffff" "0xffff"
263924637-263930507 amulet_ascii: swv: "Command: Set word variable (SWV)" "Command: Set word variable" "Cmd: Set word variable" "Cmd: SWV" "SWV"
263932127-263932821 amulet_ascii: field: "Command: Acknowledgment (ACK)" "Command: Acknowledgment" "Cmd: Acknowledgment" "Cmd: ACK" "ACK"
263932127-263932821 amulet_ascii: ack: "Command: Acknowledgment (ACK)" "Command: Acknowledgment" "Cmd: Acknowledgment" "Cmd: ACK" "ACK"
264141583-264142277 amulet_ascii: field: "Command: Set word variable (SWV)" "Command: Set word variable" "Cmd: Set word variable" "Cmd: SWV" "SWV"
264142446-264143140 amulet_ascii: bit: "Address high nibble: F" "Addr high 0xF" "Addr h 0xF"
264143309-264144003 amulet_ascii: bit: "Address low nibble: F" "Addr low 0xF" "Addr l 0xF"
264142446-264144003 amulet_ascii: field: "Address: 0xFF" "Addr: 0xFF" "0xFF"
264144171-264147454 amulet_ascii: field: "Value: 0x00fe" "Val: 0x00fe" "0x00fe"
264141583-264147454 amulet_ascii: swv: "Command: Set word variable (SWV)" "Command: Set word variable" "Cmd: Set word variable" "Cmd: SWV" "SWV"
265017438-265018132 amulet_ascii: field: "Command: Acknowledgment (ACK)" "Command: Acknowledgment" "Cmd: Acknowledgment" "Cmd: ACK" "ACK"
265017438-265018132 amulet_ascii: ack: "Command: Acknowledgment (ACK)" "Command: Acknowledgment" "Cmd: Acknowledgment" "Cmd: ACK" "ACK"
268712209-268712903 amulet_ascii: field: "Command: Set word variable (SWV)" "Command: Set word variable" "Cmd: Set word variable" "Cmd: SWV" "SWV"
268713161-268713855 amulet_ascii: bit: "Address high nibble: F" "Addr high 0xF" "Addr h 0xF"
268714112-268714806 amulet_ascii: bit: "Address low nibble: F" "Addr low 0xF" "Addr l 0xF"
268713161-268714806 amulet_ascii: field: "Address: 0xFF" "Addr: 0xFF" "0xFF"
268715063-268718612 amulet_ascii: field: "Value: 0x5a5a" "Val: 0x5a5a" "0x5a5a"
268712209-268718612 amulet_ascii: swv: "Command: Set word variable (SWV)" "Command: Set word variable" "Cmd: Set word variable" "Cmd: SWV" "SWV"
268718869-268719563 amulet_ascii: warning: "Unknown command: 0x00"
268720019-268720713 amulet_ascii: field: "Command: Acknowledgment (ACK)" "Command: Acknowledgment" "Cmd: Acknowledgment" "Cmd: ACK" "ACK"
268720019-268720713 amulet_ascii: ack: "Command: Acknowledgment (ACK)" "Command: Acknowledgment" "Cmd: Acknowledgment" "Cmd: ACK" "ACK"
268765811-268766505 amulet_ascii: field: "Command: Set string variable (SSV)" "Command: Set string variable" "Cmd: Set string variable" "Cmd: SSV" "SSV"
268766674-268767368 amulet_ascii: bit: "Address high nibble: 9" "Addr high 0x9" "Addr h 0x9"
268767537-268768231 amulet_ascii: bit: "Address low nibble: A" "Addr low 0xA" "Addr l 0xA"
268766674-268768231 amulet_ascii: field: "Address: 0x9A" "Addr: 0x9A" "0x9A"
268768399-268769093 amulet_ascii: bit: "S"
268769262-268769956 amulet_ascii: bit: "a"
268770125-268770819 amulet_ascii: bit: "v"
268770988-268771682 amulet_ascii: bit: "i"
268771851-268772545 amulet_ascii: bit: "n"
268772713-268773407 amulet_ascii: bit: "g"
268773576-268774270 amulet_ascii: bit: " "
268774439-268775133 amulet_ascii: bit: "S"
268775302-268775996 amulet_ascii: bit: "y"
268776164-268776858 amulet_ascii: bit: "s"
268777027-268777721 amulet_ascii: bit: "t"
268777890-268778584 amulet_ascii: bit: "e"
268778753-268779447 amulet_ascii: bit: "m"
268779616-268780310 amulet_ascii: bit: " "
268780478-268781172 amulet_ascii: bit: "C"
268781341-268782035 amulet_ascii: bit: "o"
268782204-268782898 amulet_ascii: bit: "n"
268783067-268783761 amulet_ascii: bit: "f"
268783929-268784623 amulet_ascii: bit: "i"
268784792-268785486 amulet_ascii: bit: "g"
268785655-268786349 amulet_ascii: bit: "u"
268786518-268787212 amulet_ascii: bit: "r"
268787380-268788074 amulet_ascii: bit: "a"
268788243-268788937 amulet_ascii: bit: "t"
268789106-268789800 amulet_ascii: bit: "i"
268789969-268790663 amulet_ascii: bit: "o"
268790832-268791526 amulet_ascii: bit: "n"
268791694-268792388 amulet_ascii: bit: "."
268792557-268793251 amulet_ascii: bit: "."
268793420-268794114 amulet_ascii: bit: "."
268794283-268794977 amulet_ascii: bit: "NULL"
268768399-268794977 amulet_ascii: field: "Value: Saving System Configuration..." "Val: Saving System Configuration..." "Saving System Configuration..."
268765811-268794977 amulet_ascii: ssv: "Command: Set string variable (SSV)" "Command: Set string variable" "Cmd: Set string variable" "Cmd: SSV" "SSV"
270302426-270303120 amulet_ascii: field: "Command: Acknowledgment (ACK)" "Command: Acknowledgment" "Cmd: Acknowledgment" "Cmd: ACK" "ACK"
270302426-270303120 amulet_ascii: ack: "Command: Acknowledgment (ACK)" "Command: Acknowledgment" "Cmd: Acknowledgment" "Cmd: ACK" "ACK"
270390837-270391531 amulet_ascii: field: "Command: Set byte variable (SBV)" "Command: Set byte variable" "Cmd: Set byte variable" "Cmd: SBV" "SBV"
270391700-270392394 amulet_ascii: bit: "Address high nibble: A" "Addr high 0xA" "Addr h 0xA"
270392563-270393257 amulet_ascii: bit: "Address low nibble: 0" "Addr low 0x0" "Addr l 0x0"
270391700-270393257 amulet_ascii: field: "Address: 0xA0" "Addr: 0xA0" "0xA0"
270393425-270394982 amulet_ascii: field: "Value: 0x00" "Val: 0x00" "0x00"
270390837-270394982 amulet_ascii: sbv: "Command: Set byte variable (SBV)" "Command: Set byte variable" "Cmd: Set byte variable" "Cmd: SBV" "SBV"
270400029-270400723 amulet_ascii: field: "Command: Acknowledgment (ACK)" "Command: Acknowledgment" "Cmd: Acknowledgment" "Cmd: ACK" "ACK"
270400029-270400723 amulet_ascii: ack: "Command: Acknowledgment (ACK)" "Command: Acknowledgment" "Cmd: Acknowledgment" "Cmd: ACK" "ACK"
270400980-270401674 amulet_ascii: field: "Command: Set word variable (SWV)" "Command: Set word variable" "Cmd: Set word variable" "Cmd: SWV" "SWV"
270401931-270402625 amulet_ascii: bit: "Address high nibble: F" "Addr high 0xF" "Addr h 0xF"
270402883-270403577 amulet_ascii: bit: "Address low nibble: F" "Addr low 0xF" "Addr l 0xF"
270401931-270403577 amulet_ascii: field: "Address: 0xFF" "Addr: 0xFF" "0xFF"
270403834-270407382 amulet_ascii: field: "Value: 0x5a5a" "Val: 0x5a5a" "0x5a5a"
270400980-270407382 amulet_ascii: swv: "Command: Set word variable (SWV)" "Command: Set word variable" "Cmd: Set word variable" "Cmd: SWV" "SWV"
270407640-270408334 amulet_ascii: warning: "Unknown command: 0x00"
270463825-270464519 amulet_ascii: field: "Command: Acknowledgment (ACK)" "Command: Acknowledgment" "Cmd: Acknowledgment" "Cmd: ACK" "ACK"
270463825-270464519 amulet_ascii: ack: "Command: Acknowledgment (ACK)" "Command: Acknowledgment" "Cmd: Acknowledgment" "Cmd: ACK" "ACK"
270516015-270516709 amulet_ascii: field: "Command: Set byte variable (SBV)" "Command: Set byte variable" "Cmd: Set byte variable" "Cmd: SBV" "SBV"
270516877-270517571 amulet_ascii: bit: "Address high nibble: A" "Addr high 0xA" "Addr h 0xA"
270517740-270518434 amulet_ascii: bit: "Address low nibble: 1" "Addr low 0x1" "Addr l 0x1"
270516877-270518434 amulet_ascii: field: "Address: 0xA1" "Addr: 0xA1" "0xA1"
270518603-270520160 amulet_ascii: field: "Value: 0x00" "Val: 0x00" "0x00"
270516015-270520160 amulet_ascii: sbv: "Command: Set byte variable (SBV)" "Command: Set byte variable" "Cmd: Set byte variable" "Cmd: SBV" "SBV"
270521647-270522341 amulet_ascii: field: "Command: Acknowledgment (ACK)" "Command: Acknowledgment" "Cmd: Acknowledgment" "Cmd: ACK" "ACK"
270521647-270522341 amulet_ascii: ack: "Command: Acknowledgment (ACK)" "Command: Acknowledgment" "Cmd: Acknowledgment" "Cmd: ACK" "ACK"
270640916-270641610 amulet_ascii: field: "Command: Set byte variable (SBV)" "Command: Set byte variable" "Cmd: Set byte variable" "Cmd: SBV" "SBV"
270641778-270642472 amulet_ascii: bit: "Address high nibble: A" "Addr high 0xA" "Addr h 0xA"
270642641-270643335 amulet_ascii: bit: "Address low nibble: 2" "Addr low 0x2" "Addr l 0x2"
270641778-270643335 amulet_ascii: field: "Address: 0xA2" "Addr: 0xA2" "0xA2"
270643504-270645061 amulet_ascii: field: "Value: 0x00" "Val: 0x00" "0x00"
270640916-270645061 amulet_ascii: sbv: "Command: Set byte variable (SBV)" "Command: Set byte variable" "Cmd: Set byte variable" "Cmd: SBV" "SBV"
270646624-270647318 amulet_ascii: field: "Command: Acknowledgment (ACK)" "Command: Acknowledgment" "Cmd: Acknowledgment" "Cmd: ACK" "ACK"
270646624-270647318 amulet_ascii: ack: "Command: Acknowledgment (ACK)" "Command: Acknowledgment" "Cmd: Acknowledgment" "Cmd: ACK" "ACK"
270776002-270776696 amulet_ascii: field: "Command: Set byte variable (SBV)" "Command: Set byte variable" "Cmd: Set byte variable" "Cmd: SBV" "SBV"
270776864-270777558 amulet_ascii: bit: "Address high nibble: A" "Addr high 0xA" "Addr h 0xA"
270777727-270778421 amulet_ascii: bit: "Address low nibble: 3" "Addr low 0x3" "Addr l 0x3"
270776864-270778421 amulet_ascii: field: "Address: 0xA3" "Addr: 0xA3" "0xA3"
270778590-270780147 amulet_ascii: field: "Value: 0x00" "Val: 0x00" "0x00"
270776002-270780147 amulet_ascii: sbv: "Command: Set byte variable (SBV)" "Command: Set byte variable" "Cmd: Set byte variable" "Cmd: SBV" "SBV"
270791287-270791981 amulet_ascii: field: "Command: Acknowledgment (ACK)" "Command: Acknowledgment" "Cmd: Acknowledgment" "Cmd: ACK" "ACK"
270791287-270791981 amulet_ascii: ack: "Command: Acknowledgment (ACK)" "Command: Acknowledgment" "Cmd: Acknowledgment" "Cmd: ACK" "ACK"
270891135-270891829 amulet_ascii: field: "Command: Set byte variable (SBV)" "Command: Set byte variable" "Cmd: Set byte variable" "Cmd: SBV" "SBV"
270891998-270892692 amulet_ascii: bit: "Address high nibble: A" "Addr high 0xA" "Addr h 0xA"
270892861-270893555 amulet_ascii: bit: "Address low nibble: 4" "Addr low 0x4" "Addr l 0x4"
270891998-270893555 amulet_ascii: field: "Address: 0xA4" "Addr: 0xA4" "0xA4"
270893724-270895281 amulet_ascii: field: "Value: 0x00" "Val: 0x00" "0x00"
270891135-270895281 amulet_ascii: sbv: "Command: Set byte variable (SBV)" "Command: Set byte variable" "Cmd: Set byte variable" "Cmd: SBV" "SBV"
270896864-270897558 amulet_ascii: field: "Command: Acknowledgment (ACK)" "Command: Acknowledgment" "Cmd: Acknowledgment" "Cmd: ACK" "ACK"
270896864-270897558 amulet_ascii: ack: "Command: Acknowledgment (ACK)" "Command: Acknowledgment" "Cmd: Acknowledgment" "Cmd: ACK" "ACK"
271015988-271016682 amulet_ascii: field: "Command: Set byte variable (SBV)" "Command: Set byte variable" "Cmd: Set byte variable" "Cmd: SBV" "SBV"
271016850-271017544 amulet_ascii: bit: "Address high nibble: A" "Addr high 0xA" "Addr h 0xA"
271017713-271018407 amulet_ascii: bit: "Address low nibble: 5" "Addr low 0x5" "Addr l 0x5"
271016850-271018407 amulet_ascii: field: "Address: 0xA5" "Addr: 0xA5" "0xA5"
271018576-271020133 amulet_ascii: field: "Value: 0x00" "Val: 0x00" "0x00"
271015988-271020133 amulet_ascii: sbv: "Command: Set byte variable (SBV)" "Command: Set byte variable" "Cmd: Set byte variable" "Cmd: SBV" "SBV"
271021679-271022373 amulet_ascii: field: "Command: Acknowledgment (ACK)" "Command: Acknowledgment" "Cmd: Acknowledgment" "Cmd: ACK" "ACK"
271021679-271022373 amulet_ascii: ack: "Command: Acknowledgment (ACK)" "Command: Acknowledgment" "Cmd: Acknowledgment" "Cmd: ACK" "ACK"
271140986-271141680 amulet_ascii: field: "Command: Set byte variable (SBV)" "Command: Set byte variable" "Cmd: Set byte variable" "Cmd: SBV" "SBV"
271141849-271142543 amulet_ascii: bit: "Address high nibble: A" "Addr high 0xA" "Addr h 0xA"
271142712-271143406 amulet_ascii: bit: "Address low nibble: 6" "Addr low 0x6" "Addr l 0x6"
271141849-271143406 amulet_ascii: field: "Address: 0xA6" "Addr: 0xA6" "0xA6"
271143575-271145131 amulet_ascii: field: "Value: 0x00" "Val: 0x00" "0x00"
271140986-271145131 amulet_ascii: sbv: "Command: Set byte variable (SBV)" "Command: Set byte variable" "Cmd: Set byte variable" "Cmd: SBV" "SBV"
271146778-271147472 amulet_ascii: field: "Command: Acknowledgment (ACK)" "Command: Acknowledgment" "Cmd: Acknowledgment" "Cmd: ACK" "ACK"
271146778-271147472 amulet_ascii: ack: "Command: Acknowledgment (ACK)" "Command: Acknowledgment" "Cmd: Acknowledgment" "Cmd: ACK" "ACK"
271265909-271266603 amulet_ascii: field: "Command: Set byte variable (SBV)" "Command: Set byte variable" "Cmd: Set byte variable" "Cmd: SBV" "SBV"
271266772-271267466 amulet_ascii: bit: "Address high nibble: A" "Addr high 0xA" "Addr h 0xA"
271267634-271268328 amulet_ascii: bit: "Address low nibble: 7" "Addr low 0x7" "Addr l 0x7"
271266772-271268328 amulet_ascii: field: "Address: 0xA7" "Addr: 0xA7" "0xA7"
271268497-271270054 amulet_ascii: field: "Value: 0x00" "Val: 0x00" "0x00"
271265909-271270054 amulet_ascii: sbv: "Command: Set byte variable (SBV)" "Command: Set byte variable" "Cmd: Set byte variable" "Cmd: SBV" "SBV"
271291278-271291972 amulet_ascii: field: "Command: Acknowledgment (ACK)" "Command: Acknowledgment" "Cmd: Acknowledgment" "Cmd: ACK" "ACK"
271291278-271291972 amulet_ascii: ack: "Command: Acknowledgment (ACK)" "Command: Acknowledgment" "Cmd: Acknowledgment" "Cmd: ACK" "ACK"
271401462-271402156 amulet_ascii: field: "Command: Set byte variable (SBV)" "Command: Set byte variable" "Cmd: Set byte variable" "Cmd: SBV" "SBV"
271402324-271403018 amulet_ascii: bit: "Address high nibble: B" "Addr high 0xB" "Addr h 0xB"
271403187-271403881 amulet_ascii: bit: "Address low nibble: 0" "Addr low 0x0" "Addr l 0x0"
271402324-271403881 amulet_ascii: field: "Address: 0xB0" "Addr: 0xB0" "0xB0"
271404050-271405607 amulet_ascii: field: "Value: 0x00" "Val: 0x00" "0x00"
271401462-271405607 amulet_ascii: sbv: "Command: Set byte variable (SBV)" "Command: Set byte variable" "Cmd: Set byte variable" "Cmd: SBV" "SBV"
271407209-271407903 amulet_ascii: field: "Command: Acknowledgment (ACK)" "Command: Acknowledgment" "Cmd: Acknowledgment" "Cmd: ACK" "ACK"
271407209-271407903 amulet_ascii: ack: "Command: Acknowledgment (ACK)" "Command: Acknowledgment" "Cmd: Acknowledgment" "Cmd: ACK" "ACK"
285218039-285218733 amulet_ascii: field: "Command: Set word variable (SWV)" "Command: Set word variable" "Cmd: Set word variable" "Cmd: SWV" "SWV"
285218902-285219596 amulet_ascii: bit: "Address high nibble: F" "Addr high 0xF" "Addr h 0xF"
285219765-285220459 amulet_ascii: bit: "Address low nibble: F" "Addr low 0xF" "Addr l 0xF"
285218902-285220459 amulet_ascii: field: "Address: 0xFF" "Addr: 0xFF" "0xFF"
285220627-285223910 amulet_ascii: field: "Value: 0xffff" "Val: 0xffff" "0xffff"
285218039-285223910 amulet_ascii: swv: "Command: Set word variable (SWV)" "Command: Set word variable" "Cmd: Set word variable" "Cmd: SWV" "SWV"
285225531-285226225 amulet_ascii: field: "Command: Acknowledgment (ACK)" "Command: Acknowledgment" "Cmd: Acknowledgment" "Cmd: ACK" "ACK"
285225531-285226225 amulet_ascii: ack: "Command: Acknowledgment (ACK)" "Command: Acknowledgment" "Cmd: Acknowledgment" "Cmd: ACK" "ACK"
285893995-285894689 amulet_ascii: field: "Command: Set byte variable (SBV)" "Command: Set byte variable" "Cmd: Set byte variable" "Cmd: SBV" "SBV"
285894858-285895552 amulet_ascii: bit: "Address high nibble: A" "Addr high 0xA" "Addr h 0xA"
285895721-285896415 amulet_ascii: bit: "Address low nibble: 0" "Addr low 0x0" "Addr l 0x0"
285894858-285896415 amulet_ascii: field: "Address: 0xA0" "Addr: 0xA0" "0xA0"
285896584-285898141 amulet_ascii: field: "Value: 0x00" "Val: 0x00" "0x00"
285893995-285898141 amulet_ascii: sbv: "Command: Set byte variable (SBV)" "Command: Set byte variable" "Cmd: Set byte variable" "Cmd: SBV" "SBV"
286311429-286312123 amulet_ascii: field: "Command: Acknowledgment (ACK)" "Command: Acknowledgment" "Cmd: Acknowledgment" "Cmd: ACK" "ACK"
286311429-286312123 amulet_ascii: ack: "Command: Acknowledgment (ACK)" "Command: Acknowledgment" "Cmd: Acknowledgment" "Cmd: ACK" "ACK"
286394028-286394722 amulet_ascii: field: "Command: Set byte variable (SBV)" "Command: Set byte variable" "Cmd: Set byte variable" "Cmd: SBV" "SBV"
286394891-286395585 amulet_ascii: bit: "Address high nibble: A" "Addr high 0xA" "Addr h 0xA"
286395754-286396448 amulet_ascii: bit: "Address low nibble: 1" "Addr low 0x1" "Addr l 0x1"
286394891-286396448 amulet_ascii: field: "Address: 0xA1" "Addr: 0xA1" "0xA1"
286396616-286398173 amulet_ascii: field: "Value: 0x00" "Val: 0x00" "0x00"
286394028-286398173 amulet_ascii: sbv: "Command: Set byte variable (SBV)" "Command: Set byte variable" "Cmd: Set byte variable" "Cmd: SBV" "SBV"
289018636-289019330 amulet_ascii: field: "Command: Set byte variable (SBV)" "Command: Set byte variable" "Cmd: Set byte variable" "Cmd: SBV" "SBV"
289019499-289020193 amulet_ascii: bit: "Address high nibble: A" "Addr high 0xA" "Addr h 0xA"
289020362-289021056 amulet_ascii: bit: "Address low nibble: 1" "Addr low 0x1" "Addr l 0x1"
289019499-289021056 amulet_ascii: field: "Address: 0xA1" "Addr: 0xA1" "0xA1"
289021224-289022781 amulet_ascii: field: "Value: 0x00" "Val: 0x00" "0x00"
289018636-289022781 amulet_ascii: sbv: "Command: Set byte variable (SBV)" "Command: Set byte variable" "Cmd: Set byte variable" "Cmd: SBV" "SBV"
290004209-290004903 amulet_ascii: field: "Command: Acknowledgment (ACK)" "Command: Acknowledgment" "Cmd: Acknowledgment" "Cmd: ACK" "ACK"
290004209-290004903 amulet_ascii: ack: "Command: Acknowledgment (ACK)" "Command: Acknowledgment" "Cmd: Acknowledgment" "Cmd: ACK" "ACK"
290082058-290082752 amulet_ascii: field: "Command: Set byte variable (SBV)" "Command: Set byte variable" "Cmd: Set byte variable" "Cmd: SBV" "SBV"
290082921-290083615 amulet_ascii: bit: "Address high nibble: A" "Addr high 0xA" "Addr h 0xA"
290083783-290084477 amulet_ascii: bit: "Address low nibble: 2" "Addr low 0x2" "Addr l 0x2"
290082921-290084477 amulet_ascii: field: "Address: 0xA2" "Addr: 0xA2" "0xA2"
290084646-290086203 amulet_ascii: field: "Value: 0x00" "Val: 0x00" "0x00"
290082058-290086203 amulet_ascii: sbv: "Command: Set byte variable (SBV)" "Command: Set byte variable" "Cmd: Set byte variable" "Cmd: SBV" "SBV"
290089982-290090676 amulet_ascii: field: "Command: Acknowledgment (ACK)" "Command: Acknowledgment" "Cmd: Acknowledgment" "Cmd: ACK" "ACK"
290089982-290090676 amulet_ascii: ack: "Command: Acknowledgment (ACK)" "Command: Acknowledgment" "Cmd: Acknowledgment" "Cmd: ACK" "ACK"
290173170-290173864 amulet_ascii: field: "Command: Set word variable (SWV)" "Command: Set word variable" "Cmd: Set word variable" "Cmd: SWV" "SWV"
290217507-290218201 amulet_ascii: warning: "Command aborted by invalid byte" "Abort"
290217507-290218201 amulet_ascii: field: "Command: Set byte variable (SBV)" "Command: Set byte variable" "Cmd: Set byte variable" "Cmd: SBV" "SBV"
290218370-290219064 amulet_ascii: bit: "Address high nibble: A" "Addr high 0xA" "Addr h 0xA"
290219233-290219927 amulet_ascii: bit: "Address low nibble: 3" "Addr low 0x3" "Addr l 0x3"
290218370-290219927 amulet_ascii: field: "Address: 0xA3" "Addr: 0xA3" "0xA3"
290220096-290221652 amulet_ascii: field: "Value: 0x00" "Val: 0x00" "0x00"
290217507-290221652 amulet_ascii: sbv: "Command: Set byte variable (SBV)" "Command: Set byte variable" "Cmd: Set byte variable" "Cmd: SBV" "SBV"
290258824-290259518 amulet_ascii: field: "Command: Acknowledgment (ACK)" "Command: Acknowledgment" "Cmd: Acknowledgment" "Cmd: ACK" "ACK"
290258824-290259518 amulet_ascii: ack: "Command: Acknowledgment (ACK)" "Command: Acknowledgment" "Cmd: Acknowledgment" "Cmd: ACK" "ACK"
290259775-290260469 amulet_ascii: field: "Command: Set word variable (SWV)" "Command: Set word variable" "Cmd: Set word variable" "Cmd: SWV" "SWV"
290332191-290332885 amulet_ascii: warning: "Command aborted by invalid byte" "Abort"
290332191-290332885 amulet_ascii: field: "Command: Set byte variable (SBV)" "Command: Set byte variable" "Cmd: Set byte variable" "Cmd: SBV" "SBV"
290333054-290333748 amulet_ascii: bit: "Address high nibble: A" "Addr high 0xA" "Addr h 0xA"
290333916-290334610 amulet_ascii: bit: "Address low nibble: 4" "Addr low 0x4" "Addr l 0x4"
290333054-290334610 amulet_ascii: field: "Address: 0xA4" "Addr: 0xA4" "0xA4"
290334779-290336336 amulet_ascii: field: "Value: 0x00" "Val: 0x00" "0x00"
290332191-290336336 amulet_ascii: sbv: "Command: Set byte variable (SBV)" "Command: Set byte variable" "Cmd: Set byte variable" "Cmd: SBV" "SBV"
290345259-290345953 amulet_ascii: field: "Command: Acknowledgment (ACK)" "Command: Acknowledgment" "Cmd: Acknowledgment" "Cmd: ACK" "ACK"
290345259-290345953 amulet_ascii: ack: "Command: Acknowledgment (ACK)" "Command: Acknowledgment" "Cmd: Acknowledgment" "Cmd: ACK" "ACK"
290346211-290346905 amulet_ascii: field: "Command: Set word variable (SWV)" "Command: Set word variable" "Cmd: Set word variable" "Cmd: SWV" "SWV"
290347162-290347856 amulet_ascii: bit: "Address high nibble: F" "Addr high 0xF" "Addr h 0xF"
290348113-290348807 amulet_ascii: bit: "Address low nibble: F" "Addr low 0xF" "Addr l 0xF"
290347162-290348807 amulet_ascii: field: "Address: 0xFF" "Addr: 0xFF" "0xFF"
290349065-290352613 amulet_ascii: field: "Value: 0x5a5a" "Val: 0x5a5a" "0x5a5a"
290346211-290352613 amulet_ascii: swv: "Command: Set word variable (SWV)" "Command: Set word variable" "Cmd: Set word variable" "Cmd: SWV" "SWV"
290352871-290353565 amulet_ascii: warning: "Unknown command: 0x00"
290394424-290395118 amulet_ascii: field: "Command: Acknowledgment (ACK)" "Command: Acknowledgment" "Cmd: Acknowledgment" "Cmd: ACK" "ACK"
290394424-290395118 amulet_ascii: ack: "Command: Acknowledgment (ACK)" "Command: Acknowledgment" "Cmd: Acknowledgment" "Cmd: ACK" "ACK"
290457162-290457856 amulet_ascii: field: "Command: Set byte variable (SBV)" "Command: Set byte variable" "Cmd: Set byte variable" "Cmd: SBV" "SBV"
290458025-290458719 amulet_ascii: bit: "Address high nibble: A" "Addr high 0xA" "Addr h 0xA"
290458888-290459582 amulet_ascii: bit: "Address low nibble: 5" "Addr low 0x5" "Addr l 0x5"
290458025-290459582 amulet_ascii: field: "Address: 0xA5" "Addr: 0xA5" "0xA5"
290459751-290461307 amulet_ascii: field: "Value: 0x00" "Val: 0x00" "0x00"
290457162-290461307 amulet_ascii: sbv: "Command: Set byte variable (SBV)" "Command: Set byte variable" "Cmd: Set byte variable" "Cmd: SBV" "SBV"
290544369-290545063 amulet_ascii: field: "Command: Acknowledgment (ACK)" "Command: Acknowledgment" "Cmd: Acknowledgment" "Cmd: ACK" "ACK"
290544369-290545063 amulet_ascii: ack: "Command: Acknowledgment (ACK)" "Command: Acknowledgment" "Cmd: Acknowledgment" "Cmd: ACK" "ACK"
290644715-290645409 amulet_ascii: field: "Command: Set byte variable (SBV)" "Command: Set byte variable" "Cmd: Set byte variable" "Cmd: SBV" "SBV"
290645577-290646271 amulet_ascii: bit: "Address high nibble: A" "Addr high 0xA" "Addr h 0xA"
290646440-290647134 amulet_ascii: bit: "Address low nibble: 6" "Addr low 0x6" "Addr l 0x6"
290645577-290647134 amulet_ascii: field: "Address: 0xA6" "Addr: 0xA6" "0xA6"
290647303-290648860 amulet_ascii: field: "Value: 0x00" "Val: 0x00" "0x00"
290644715-290648860 amulet_ascii: sbv: "Command: Set byte variable (SBV)" "Command: Set byte variable" "Cmd: Set byte variable" "Cmd: SBV" "SBV"
290650410-290651104 amulet_ascii: field: "Command: Acknowledgment (ACK)" "Command: Acknowledgment" "Cmd: Acknowledgment" "Cmd: ACK" "ACK"
290650410-290651104 amulet_ascii: ack: "Command: Acknowledgment (ACK)" "Command: Acknowledgment" "Cmd: Acknowledgment" "Cmd: ACK" "ACK"
290769599-290770293 amulet_ascii: field: "Command: Set byte variable (SBV)" "Command: Set byte variable" "Cmd: Set byte variable" "Cmd: SBV" "SBV"
290770462-290771156 amulet_ascii: bit: "Address high nibble: A" "Addr high 0xA" "Addr h 0xA"
290771325-290772019 amulet_ascii: bit: "Address low nibble: 7" "Addr low 0x7" "Addr l 0x7"
290770462-290772019 amulet_ascii: field: "Address: 0xA7" "Addr: 0xA7" "0xA7"
290772188-290773744 amulet_ascii: field: "Value: 0x00" "Val: 0x00" "0x00"
290769599-290773744 amulet_ascii: sbv: "Command: Set byte variable (SBV)" "Command: Set byte variable" "Cmd: Set byte variable" "Cmd: SBV" "SBV"
290845181-290845875 amulet_ascii: field: "Command: Acknowledgment (ACK)" "Command: Acknowledgment" "Cmd: Acknowledgment" "Cmd: ACK" "ACK"
290845181-290845875 amulet_ascii: ack: "Command: Acknowledgment (ACK)" "Command: Acknowledgment" "Cmd: Acknowledgment" "Cmd: ACK" "ACK"
290957255-290957949 amulet_ascii: field: "Command: Set byte variable (SBV)" "Command: Set byte variable" "Cmd: Set byte variable" "Cmd: SBV" "SBV"
290958117-290958811 amulet_ascii: bit: "Address high nibble: B" "Addr high 0xB" "Addr h 0xB"
290958980-290959674 amulet_ascii: bit: "Address low nibble: 0" "Addr low 0x0" "Addr l 0x0"
290958117-290959674 amulet_ascii: field: "Address: 0xB0" "Addr: 0xB0" "0xB0"
290959843-290961400 amulet_ascii: field: "Value: 0x00" "Val: 0x00" "0x00"
290957255-290961400 amulet_ascii: sbv: "Command: Set byte variable (SBV)" "Command: Set byte variable" "Cmd: Set byte variable" "Cmd: SBV" "SBV"
291044413-291045107 amulet_ascii: field: "Command: Acknowledgment (ACK)" "Command: Acknowledgment" "Cmd: Acknowledgment" "Cmd: ACK" "ACK"
291044413-291045107 amulet_ascii: ack: "Command: Acknowledgment (ACK)" "Command: Acknowledgment" "Cmd: Acknowledgment" "Cmd: ACK" "ACK"
291155182-291155876 amulet_ascii: field: "Command: Set string variable (SSV)" "Command: Set string variable" "Cmd: Set string variable" "Cmd: SSV" "SSV"
291156045-291156739 amulet_ascii: bit: "Address high nibble: C" "Addr high 0xC" "Addr h 0xC"
291156907-291157601 amulet_ascii: bit: "Address low nibble: 5" "Addr low 0x5" "Addr l 0x5"
291156045-291157601 amulet_ascii: field: "Address: 0xC5" "Addr: 0xC5" "0xC5"
291157770-291158464 amulet_ascii: bit: "E"
291158633-291159327 amulet_ascii: bit: "N"
291159496-291160190 amulet_ascii: bit: "C"
291160358-291161052 amulet_ascii: bit: "O"
291161221-291161915 amulet_ascii: bit: "R"
291162084-291162778 amulet_ascii: bit: "E"
291162947-291163641 amulet_ascii: bit: " "
291163809-291164503 amulet_ascii: bit: "S"
291164672-291165366 amulet_ascii: bit: "Y"
291165535-291166229 amulet_ascii: bit: "S"
291166398-291167092 amulet_ascii: bit: "T"
291167261-291167955 amulet_ascii: bit: "E"
291168123-291168817 amulet_ascii: bit: "M"
291168986-291169680 amulet_ascii: bit: " "
291169849-291170543 amulet_ascii: bit: "S"
291170712-291171406 amulet_ascii: bit: "T"
291171574-291172268 amulet_ascii: bit: "A"
291172437-291173131 amulet_ascii: bit: "T"
291173300-291173994 amulet_ascii: bit: "U"
291174163-291174857 amulet_ascii: bit: "S"
291175025-291175719 amulet_ascii: bit: " "
291175888-291176582 amulet_ascii: bit: " "
291176751-291177445 amulet_ascii: bit: " "
291177614-291178308 amulet_ascii: bit: " "
291178477-291179171 amulet_ascii: bit: " "
291179339-291180033 amulet_ascii: bit: " "
291180202-291180896 amulet_ascii: bit: "V"
291181065-291181759 amulet_ascii: bit: "e"
291181928-291182622 amulet_ascii: bit: "r"
291182790-291183484 amulet_ascii: bit: " "
291183653-291184347 amulet_ascii: bit: "2"
291184516-291185210 amulet_ascii: bit: "."
291185379-291186073 amulet_ascii: bit: "3"
291186241-291186935 amulet_ascii: bit: "3"
291187104-291187798 amulet_ascii: bit: "."
291187967-291188661 amulet_ascii: bit: "0"
291188830-291189524 amulet_ascii: bit: "1"
291189693-291190387 amulet_ascii: bit: "NULL"
291157770-291190387 amulet_ascii: field: "Value: ENCORE SYSTEM STATUS      Ver 2.33.01" "Val: ENCORE SYSTEM STATUS      Ver 2.33.01" "ENCORE SYSTEM STATUS      Ver 2.33.01"
291155182-291190387 amulet_ascii: ssv: "Command: Set string variable (SSV)" "Command: Set string variable" "Cmd: Set string variable" "Cmd: SSV" "SSV"
291260978-291261672 amulet_ascii: field: "Command: Acknowledgment (ACK)" "Command: Acknowledgment" "Cmd: Acknowledgment" "Cmd: ACK" "ACK"
291260978-291261672 amulet_ascii: ack: "Command: Acknowledgment (ACK)" "Command: Acknowledgment" "Cmd: Acknowledgment" "Cmd: ACK" "ACK"
291332283-291332977 amulet_ascii: field: "Command: Set string variable (SSV)" "Command: Set string variable" "Cmd: Set string variable" "Cmd: SSV" "SSV"
291333146-291333840 amulet_ascii: bit: "Address high nibble: B" "Addr high 0xB" "Addr h 0xB"
291334009-291334703 amulet_ascii: bit: "Address low nibble: 0" "Addr low 0x0" "Addr l 0x0"
291333146-291334703 amulet_ascii: field: "Address: 0xB0" "Addr: 0xB0" "0xB0"
291334871-291335565 amulet_ascii: bit: "E"
291335734-291336428 amulet_ascii: bit: "N"
291336597-291337291 amulet_ascii: bit: "C"
291337460-291338154 amulet_ascii: bit: "O"
291338322-291339016 amulet_ascii: bit: "R"
291339185-291339879 amulet_ascii: bit: "E"
291340048-291340742 amulet_ascii: bit: " "
291340911-291341605 amulet_ascii: bit: "V"
291341774-291342468 amulet_ascii: bit: "P"
291342636-291343330 amulet_ascii: bit: "/"
291343499-291344193 amulet_ascii: bit: "3"
291344362-291345056 amulet_ascii: bit: "G"
291345225-291345919 amulet_ascii: bit: ":"
291346087-291346781 amulet_ascii: bit: " "
291346950-291347644 amulet_ascii: bit: "0"
291347813-291348507 amulet_ascii: bit: " "
291348676-291349370 amulet_ascii: bit: "NULL"
291334871-291349370 amulet_ascii: field: "Value: ENCORE VP/3G: 0 " "Val: ENCORE VP/3G: 0 " "ENCORE VP/3G: 0 "
291332283-291349370 amulet_ascii: ssv: "Command: Set string variable (SSV)" "Command: Set string variable" "Cmd: Set string variable" "Cmd: SSV" "SSV"
291363993-291364687 amulet_ascii: field: "Command: Acknowledgment (ACK)" "Command: Acknowledgment" "Cmd: Acknowledgment" "Cmd: ACK" "ACK"
291363993-291364687 amulet_ascii: ack: "Command: Acknowledgment (ACK)" "Command: Acknowledgment" "Cmd: Acknowledgment" "Cmd: ACK" "ACK"
291467749-291468443 amulet_ascii: field: "Command: Set string variable (SSV)" "Command: Set string variable" "Cmd: Set string variable" "Cmd: SSV" "SSV"
291468612-291469306 amulet_ascii: bit: "Address high nibble: B" "Addr high 0xB" "Addr h 0xB"
291469474-291470168 amulet_ascii: bit: "Address low nibble: 2" "Addr low 0x2" "Addr l 0x2"
291468612-291470168 amulet_ascii: field: "Address: 0xB2" "Addr: 0xB2" "0xB2"
291470337-291471031 amulet_ascii: bit: "E"
291471200-291471894 amulet_ascii: bit: "N"
291472063-291472757 amulet_ascii: bit: "C"
291472926-291473620 amulet_ascii: bit: "O"
291473788-291474482 amulet_ascii: bit: "R"
291474651-291475345 amulet_ascii: bit: "E"
291475514-291476208 amulet_ascii: bit: " "
291476377-291477071 amulet_ascii: bit: "V"
291477239-291477933 amulet_ascii: bit: "P"
291478102-291478796 amulet_ascii: bit: "X"
291478965-291479659 amulet_ascii: bit: "/"
291479828-291480522 amulet_ascii: bit: "3"
291480690-291481384 amulet_ascii: bit: "G"
291481553-291482247 amulet_ascii: bit: ":"
291482416-291483110 amulet_ascii: bit: " "
291483279-291483973 amulet_ascii: bit: "0"
291484142-291484836 amulet_ascii: bit: " "
291485004-291485698 amulet_ascii: bit: "NULL"
291470337-291485698 amulet_ascii: field: "Value: ENCORE VPX/3G: 0 " "Val: ENCORE VPX/3G: 0 " "ENCORE VPX/3G: 0 "
291467749-291485698 amulet_ascii: ssv: "Command: Set string variable (SSV)" "Command: Set string variable" "Cmd: Set string variable" "Cmd: SSV" "SSV"
291553426-291554120 amulet_ascii: field: "Command: Acknowledgment (ACK)" "Command: Acknowledgment" "Cmd: Acknowledgment" "Cmd: ACK" "ACK"
291553426-291554120 amulet_ascii: ack: "Command: Acknowledgment (ACK)" "Command: Acknowledgment" "Cmd: Acknowledgment" "Cmd: ACK" "ACK"
291644888-291645582 amulet_ascii: field: "Command: Set string variable (SSV)" "Command: Set string variable" "Cmd: Set string variable" "Cmd: SSV" "SSV"
291645751-291646445 amulet_ascii: bit: "Address high nibble: B" "Addr high 0xB" "Addr h 0xB"
291646614-291647308 amulet_ascii: bit: "Address low nibble: 4" "Addr low 0x4" "Addr l 0x4"
291645751-291647308 amulet_ascii: field: "Address: 0xB4" "Addr: 0xB4" "0xB4"
291647477-291648171 amulet_ascii: bit: "S"
291648339-291649033 amulet_ascii: bit: "C"
291649202-291649896 amulet_ascii: bit: "R"
291650065-291650759 amulet_ascii: bit: "E"
291650928-291651622 amulet_ascii: bit: "E"
291651790-291652484 amulet_ascii: bit: "N"
291652653-291653347 amulet_ascii: bit: "P"
291653516-291654210 amulet_ascii: bit: "R"
291654379-291655073 amulet_ascii: bit: "O"
291655241-291655935 amulet_ascii: bit: " "
291656104-291656798 amulet_ascii: bit: "I"
291656967-291657661 amulet_ascii: bit: "I"
291657830-291658524 amulet_ascii: bit: "/"
291658693-291659387 amulet_ascii: bit: "3"
291659555-291660249 amulet_ascii: bit: "G"
291660418-291661112 amulet_ascii: bit: ":"
291661281-291661975 amulet_ascii: bit: " "
291662144-291662838 amulet_ascii: bit: "0"
291663006-291663700 amulet_ascii: bit: " "
291663869-291664563 amulet_ascii: bit: "NULL"
291647477-291664563 amulet_ascii: field: "Value: SCREENPRO II/3G: 0 " "Val: SCREENPRO II/3G: 0 " "SCREENPRO II/3G: 0 "
291644888-291664563 amulet_ascii: ssv: "Command: Set string variable (SSV)" "Command: Set string variable" "Cmd: Set string variable" "Cmd: SSV" "SSV"
291748762-291749456 amulet_ascii: field: "Command: Acknowledgment (ACK)" "Command: Acknowledgment" "Cmd: Acknowledgment" "Cmd: ACK" "ACK"
291748762-291749456 amulet_ascii: ack: "Command: Acknowledgment (ACK)" "Command: Acknowledgment" "Cmd: Acknowledgment" "Cmd: ACK" "ACK"
291832506-291833200 amulet_ascii: field: "Command: Set string variable (SSV)" "Command: Set string variable" "Cmd: Set string variable" "Cmd: SSV" "SSV"
291833368-291834062 amulet_ascii: bit: "Address high nibble: B" "Addr high 0xB" "Addr h 0xB"
291834231-291834925 amulet_ascii: bit: "Address low nibble: 6" "Addr low 0x6" "Addr l 0x6"
291833368-291834925 amulet_ascii: field: "Address: 0xB6" "Addr: 0xB6" "0xB6"
291835094-291835788 amulet_ascii: bit: "P"
291835957-291836651 amulet_ascii: bit: "R"
291836819-291837513 amulet_ascii: bit: "E"
291837682-291838376 amulet_ascii: bit: "P"
291838545-291839239 amulet_ascii: bit: "R"
291839408-291840102 amulet_ascii: bit: "O"
291840270-291840964 amulet_ascii: bit: " "
291841133-291841827 amulet_ascii: bit: "I"
291841996-291842690 amulet_ascii: bit: "I"
291842859-291843553 amulet_ascii: bit: ":"
291843722-291844416 amulet_ascii: bit: " "
291844584-291845278 amulet_ascii: bit: "0"
291845447-291846141 amulet_ascii: bit: " "
291846310-291847004 amulet_ascii: bit: "NULL"
291835094-291847004 amulet_ascii: field: "Value: PREPRO II: 0 " "Val: PREPRO II: 0 " "PREPRO II: 0 "
291832506-291847004 amulet_ascii: ssv: "Command: Set string variable (SSV)" "Command: Set string variable" "Cmd: Set string variable" "Cmd: SSV" "SSV"
291851517-291852211 amulet_ascii: field: "Command: Acknowledgment (ACK)" "Command: Acknowledgment" "Cmd: Acknowledgment" "Cmd: ACK" "ACK"
291851517-291852211 amulet_ascii: ack: "Command: Acknowledgment (ACK)" "Command: Acknowledgment" "Cmd: Acknowledgment" "Cmd: ACK" "ACK"
291957493-291958187 amulet_ascii: field: "Command: Set string variable (SSV)" "Command: Set string variable" "Cmd: Set string variable" "Cmd: SSV" "SSV"
291958356-291959050 amulet_ascii: bit: "Address high nibble: B" "Addr high 0xB" "Addr h 0xB"
291959219-291959913 amulet_ascii: bit: "Address low nibble: 8" "Addr low 0x8" "Addr l 0x8"
291958356-291959913 amulet_ascii: field: "Address: 0xB8" "Addr: 0xB8" "0xB8"
291960082-291960776 amulet_ascii: bit: "I"
291960944-291961638 amulet_ascii: bit: "M"
291961807-291962501 amulet_ascii: bit: "A"
291962670-291963364 amulet_ascii: bit: "G"
291963533-291964227 amulet_ascii: bit: "E"
291964396-291965090 amulet_ascii: bit: "P"
291965258-291965952 amulet_ascii: bit: "R"
291966121-291966815 amulet_ascii: bit: "O"
291966984-291967678 amulet_ascii: bit: " "
291967847-291968541 amulet_ascii: bit: "H"
291968709-291969403 amulet_ascii: bit: "D"
291969572-291970266 amulet_ascii: bit: "/"
291970435-291971129 amulet_ascii: bit: "3"
291971298-291971992 amulet_ascii: bit: "G"
291972160-291972854 amulet_ascii: bit: ":"
291973023-291973717 amulet_ascii: bit: " "
291973886-291974580 amulet_ascii: bit: "0"
291974749-291975443 amulet_ascii: bit: "NULL"
291960082-291975443 amulet_ascii: field: "Value: IMAGEPRO HD/3G: 0" "Val: IMAGEPRO HD/3G: 0" "IMAGEPRO HD/3G: 0"
291957493-291975443 amulet_ascii: ssv: "Command: Set string variable (SSV)" "Command: Set string variable" "Cmd: Set string variable" "Cmd: SSV" "SSV"
292052515-292053209 amulet_ascii: field: "Command: Acknowledgment (ACK)" "Command: Acknowledgment" "Cmd: Acknowledgment" "Cmd: ACK" "ACK"
292052515-292053209 amulet_ascii: ack: "Command: Acknowledgment (ACK)" "Command: Acknowledgment" "Cmd: Acknowledgment" "Cmd: ACK" "ACK"
292145013-292145707 amulet_ascii: field: "Command: Set string variable (SSV)" "Command: Set string variable" "Cmd: Set string variable" "Cmd: SSV" "SSV"
292145876-292146570 amulet_ascii: bit: "Address high nibble: B" "Addr high 0xB" "Addr h 0xB"
292146739-292147433 amulet_ascii: bit: "Address low nibble: A" "Addr low 0xA" "Addr l 0xA"
292145876-292147433 amulet_ascii: field: "Address: 0xBA" "Addr: 0xBA" "0xBA"
292147601-292148295 amulet_ascii: bit: "I"
292148464-292149158 amulet_ascii: bit: "M"
292149327-292150021 amulet_ascii: bit: "A"
292150190-292150884 amulet_ascii: bit: "G"
292151052-292151746 amulet_ascii: bit: "E"
292151915-292152609 amulet_ascii: bit: "P"
292152778-292153472 amulet_ascii: bit: "R"
292153641-292154335 amulet_ascii: bit: "O"
292154503-292155197 amulet_ascii: bit: "-"
292155366-292156060 amulet_ascii: bit: "I"
292156229-292156923 amulet_ascii: bit: "I"
292157092-292157786 amulet_ascii: bit: "/"
292157955-292158649 amulet_ascii: bit: "D"
292158817-292159511 amulet_ascii: bit: "U"
292159680-292160374 amulet_ascii: bit: "A"
292160543-292161237 amulet_ascii: bit: "L"
292161406-292162100 amulet_ascii: bit: ":"
292162268-292162962 amulet_ascii: bit: " "
292163131-292163825 amulet_ascii: bit: "0"
292163994-292164688 amulet_ascii: bit: "NULL"
292147601-292164688 amulet_ascii: field: "Value: IMAGEPRO-II/DUAL: 0" "Val: IMAGEPRO-II/DUAL: 0" "IMAGEPRO-II/DUAL: 0"
292145013-292164688 amulet_ascii: ssv: "Command: Set string variable (SSV)" "Command: Set string variable" "Cmd: Set string variable" "Cmd: SSV" "SSV"
292248722-292249416 amulet_ascii: field: "Command: Acknowledgment (ACK)" "Command: Acknowledgment" "Cmd: Acknowledgment" "Cmd: ACK" "ACK"
292248722-292249416 amulet_ascii: ack: "Command: Acknowledgment (ACK)" "Command: Acknowledgment" "Cmd: Acknowledgment" "Cmd: ACK" "ACK"
292332337-292333031 amulet_ascii: field: "Command: Set string variable (SSV)" "Command: Set string variable" "Cmd: Set string variable" "Cmd: SSV" "SSV"
292333200-292333894 amulet_ascii: bit: "Address high nibble: B" "Addr high 0xB" "Addr h 0xB"
292334063-292334757 amulet_ascii: bit: "Address low nibble: C" "Addr low 0xC" "Addr l 0xC"
292333200-292334757 amulet_ascii: field: "Address: 0xBC" "Addr: 0xBC" "0xBC"
292334926-292335620 amulet_ascii: bit: "P"
292335788-292336482 amulet_ascii: bit: "D"
292336651-292337345 amulet_ascii: bit: "S"
292337514-292338208 amulet_ascii: bit: ":"
292338377-292339071 amulet_ascii: bit: " "
292339239-292339933 amulet_ascii: bit: "0"
292340102-292340796 amulet_ascii: bit: "NULL"
292334926-292340796 amulet_ascii: field: "Value: PDS: 0" "Val: PDS: 0" "PDS: 0"
292332337-292340796 amulet_ascii: ssv: "Command: Set string variable (SSV)" "Command: Set string variable" "Cmd: Set string variable" "Cmd: SSV" "SSV"
292348533-292349227 amulet_ascii: field: "Command: Acknowledgment (ACK)" "Command: Acknowledgment" "Cmd: Acknowledgment" "Cmd: ACK" "ACK"
292348533-292349227 amulet_ascii: ack: "Command: Acknowledgment (ACK)" "Command: Acknowledgment" "Cmd: Acknowledgment" "Cmd: ACK" "ACK"
292457531-292458225 amulet_ascii: field: "Command: Set string variable (SSV)" "Command: Set string variable" "Cmd: Set string variable" "Cmd: SSV" "SSV"
292458394-292459088 amulet_ascii: bit: "Address high nibble: B" "Addr high 0xB" "Addr h 0xB"
292459257-292459951 amulet_ascii: bit: "Address low nibble: E" "Addr low 0xE" "Addr l 0xE"
292458394-292459951 amulet_ascii: field: "Address: 0xBE" "Addr: 0xBE" "0xBE"
292460120-292460814 amulet_ascii: bit: "R"
292460982-292461676 amulet_ascii: bit: "O"
292461845-292462539 amulet_ascii: bit: "U"
292462708-292463402 amulet_ascii: bit: "T"
292463571-292464265 amulet_ascii: bit: "E"
292464433-292465127 amulet_ascii: bit: "R"
292465296-292465990 amulet_ascii: bit: "S"
292466159-292466853 amulet_ascii: bit: ":"
292467022-292467716 amulet_ascii: bit: " "
292467885-292468579 amulet_ascii: bit: "0"
292468747-292469441 amulet_ascii: bit: "NULL"
292460120-292469441 amulet_ascii: field: "Value: ROUTERS: 0" "Val: ROUTERS: 0" "ROUTERS: 0"
292457531-292469441 amulet_ascii: ssv: "Command: Set string variable (SSV)" "Command: Set string variable" "Cmd: Set string variable" "Cmd: SSV" "SSV"
292549526-292550220 amulet_ascii: field: "Command: Acknowledgment (ACK)" "Command: Acknowledgment" "Cmd: Acknowledgment" "Cmd: ACK" "ACK"
292549526-292550220 amulet_ascii: ack: "Command: Acknowledgment (ACK)" "Command: Acknowledgment" "Cmd: Acknowledgment" "Cmd: ACK" "ACK"
292644942-292645636 amulet_ascii: field: "Command: Set string variable (SSV)" "Command: Set string variable" "Cmd: Set string variable" "Cmd: SSV" "SSV"
292645805-292646499 amulet_ascii: bit: "Address high nibble: C" "Addr high 0xC" "Addr h 0xC"
292646668-292647362 amulet_ascii: bit: "Address low nibble: 0" "Addr low 0x0" "Addr l 0x0"
292645805-292647362 amulet_ascii: field: "Address: 0xC0" "Addr: 0xC0" "0xC0"
292647531-292648225 amulet_ascii: bit: "F"
292648394-292649088 amulet_ascii: bit: "S"
292649256-292649950 amulet_ascii: bit: "N"
292650119-292650813 amulet_ascii: bit: ":"
292650982-292651676 amulet_ascii: bit: " "
292651845-292652539 amulet_ascii: bit: "0"
292652707-292653401 amulet_ascii: bit: "NULL"
292647531-292653401 amulet_ascii: field: "Value: FSN: 0" "Val: FSN: 0" "FSN: 0"
292644942-292653401 amulet_ascii: ssv: "Command: Set string variable (SSV)" "Command: Set string variable" "Cmd: Set string variable" "Cmd: SSV" "SSV"
292656206-292656900 amulet_ascii: field: "Command: Acknowledgment (ACK)" "Command: Acknowledgment" "Cmd: Acknowledgment" "Cmd: ACK" "ACK"
292656206-292656900 amulet_ascii: ack: "Command: Acknowledgment (ACK)" "Command: Acknowledgment" "Cmd: Acknowledgment" "Cmd: ACK" "ACK"
