79372-79498 qi: bit: "0"
79498-79639 qi: bit: "1"
79639-79770 qi: bit: "0"
79770-79903 qi: bit: "0"
79903-80039 qi: bit: "0"
80039-80175 qi: bit: "0"
80175-80309 qi: bit: "0"
80309-80445 qi: bit: "0"
80445-80583 qi: bit: "0"
80583-80721 qi: bit: "0"
79372-79498 qi: byte-start: "Start bit" "Start" "S"
79498-80583 qi: byte-data: "01"
80583-80721 qi: byte-info: "Parity bit" "Parity" "P"
80721-80857 qi: byte-info: "Stop bit" "Stop" "S"
80721-80857 qi: bit: "1"
80857-80990 qi: bit: "0"
80990-81126 qi: bit: "0"
81126-81270 qi: bit: "1"
81270-81405 qi: bit: "1"
81405-81531 qi: bit: "0"
81531-81668 qi: bit: "0"
81668-81812 qi: bit: "1"
81812-81950 qi: bit: "1"
81950-82079 qi: bit: "0"
82079-82221 qi: bit: "1"
80857-80990 qi: byte-start: "Start bit" "Start" "S"
80990-82079 qi: byte-data: "66"
82079-82221 qi: byte-info: "Parity bit" "Parity" "P"
82221-82362 qi: byte-info: "Stop bit" "Stop" "S"
82221-82362 qi: bit: "1"
82362-82486 qi: bit: "0"
82486-82627 qi: bit: "1"
82627-82769 qi: bit: "1"
82769-82903 qi: bit: "1"
82903-83033 qi: bit: "0"
83033-83166 qi: bit: "0"
83166-83311 qi: bit: "1"
83311-83447 qi: bit: "1"
83447-83579 qi: bit: "0"
83579-83713 qi: bit: "0"
82362-82486 qi: byte-start: "Start bit" "Start" "S"
82486-83579 qi: byte-data: "67"
83579-83713 qi: byte-info: "Parity bit" "Parity" "P"
83713-83850 qi: byte-info: "Stop bit" "Stop" "S"
79372-82362 qi: packet-data: "Signal Strength: 102" "SS: 102" "SS"
82362-83850 qi: packet-checksum-ok: "Checksum OK" "OK"
83713-83850 qi: bit: "1"
87589-87717 qi: bit: "0"
87717-87856 qi: bit: "1"
87856-87988 qi: bit: "0"
87988-88122 qi: bit: "0"
88122-88260 qi: bit: "0"
88260-88405 qi: bit: "1"
88405-88539 qi: bit: "1"
88539-88676 qi: bit: "1"
88676-88799 qi: bit: "0"
88799-88946 qi: bit: "1"
87589-87717 qi: byte-start: "Start bit" "Start" "S"
87717-88799 qi: byte-data: "71"
88799-88946 qi: byte-info: "Parity bit" "Parity" "P"
88946-89084 qi: byte-info: "Stop bit" "Stop" "S"
88946-89084 qi: bit: "1"
89084-89211 qi: bit: "0"
89211-89347 qi: bit: "0"
89347-89484 qi: bit: "0"
89484-89618 qi: bit: "0"
89618-89755 qi: bit: "0"
89755-89899 qi: bit: "1"
89899-90026 qi: bit: "0"
90026-90164 qi: bit: "0"
90164-90302 qi: bit: "0"
90302-90429 qi: bit: "0"
89084-89211 qi: byte-start: "Start bit" "Start" "S"
89211-90302 qi: byte-data: "10"
90302-90429 qi: byte-info: "Parity bit" "Parity" "P"
90429-90575 qi: byte-info: "Stop bit" "Stop" "S"
90429-90575 qi: bit: "1"
90575-90707 qi: bit: "0"
90707-90841 qi: bit: "0"
90841-90980 qi: bit: "0"
90980-91112 qi: bit: "0"
91112-91249 qi: bit: "0"
91249-91385 qi: bit: "0"
91385-91521 qi: bit: "0"
91521-91658 qi: bit: "0"
91658-91791 qi: bit: "0"
91791-91935 qi: bit: "1"
90575-90707 qi: byte-start: "Start bit" "Start" "S"
90707-91791 qi: byte-data: "00"
91791-91935 qi: byte-info: "Parity bit" "Parity" "P"
91935-92073 qi: byte-info: "Stop bit" "Stop" "S"
91935-92073 qi: bit: "1"
92073-92201 qi: bit: "0"
92201-92336 qi: bit: "0"
92336-92474 qi: bit: "0"
92474-92608 qi: bit: "0"
92608-92745 qi: bit: "0"
92745-92890 qi: bit: "1"
92890-93015 qi: bit: "0"
93015-93154 qi: bit: "0"
93154-93287 qi: bit: "0"
93287-93423 qi: bit: "0"
92073-92201 qi: byte-start: "Start bit" "Start" "S"
92201-93287 qi: byte-data: "10"
93287-93423 qi: byte-info: "Parity bit" "Parity" "P"
93423-93566 qi: byte-info: "Stop bit" "Stop" "S"
93423-93566 qi: bit: "1"
93566-93694 qi: bit: "0"
93694-93832 qi: bit: "0"
93832-93968 qi: bit: "0"
93968-94104 qi: bit: "0"
94104-94238 qi: bit: "0"
94238-94376 qi: bit: "0"
94376-94508 qi: bit: "0"
94508-94647 qi: bit: "0"
94647-94782 qi: bit: "0"
94782-94926 qi: bit: "1"
93566-93694 qi: byte-start: "Start bit" "Start" "S"
93694-94782 qi: byte-data: "00"
94782-94926 qi: byte-info: "Parity bit" "Parity" "P"
94926-95062 qi: byte-info: "Stop bit" "Stop" "S"
94926-95062 qi: bit: "1"
95062-95190 qi: bit: "0"
95190-95335 qi: bit: "1"
95335-95473 qi: bit: "1"
95473-95597 qi: bit: "0"
95597-95742 qi: bit: "1"
95742-95879 qi: bit: "1"
95879-96008 qi: bit: "0"
96008-96142 qi: bit: "0"
96142-96279 qi: bit: "0"
96279-96423 qi: bit: "1"
95062-95190 qi: byte-start: "Start bit" "Start" "S"
95190-96279 qi: byte-data: "1b"
96279-96423 qi: byte-info: "Parity bit" "Parity" "P"
96423-96560 qi: byte-info: "Stop bit" "Stop" "S"
96423-96560 qi: bit: "1"
96560-96686 qi: bit: "0"
96686-96824 qi: bit: "0"
96824-96958 qi: bit: "0"
96958-97102 qi: bit: "1"
97102-97231 qi: bit: "0"
97231-97377 qi: bit: "1"
97377-97514 qi: bit: "1"
97514-97650 qi: bit: "1"
97650-97787 qi: bit: "1"
97787-97911 qi: bit: "0"
96560-96686 qi: byte-start: "Start bit" "Start" "S"
96686-97787 qi: byte-data: "f4"
97787-97911 qi: byte-info: "Parity bit" "Parity" "P"
97911-98055 qi: byte-info: "Stop bit" "Stop" "S"
97911-98055 qi: bit: "1"
98055-98185 qi: bit: "0"
98185-98319 qi: bit: "0"
98319-98457 qi: bit: "0"
98457-98590 qi: bit: "0"
98590-98729 qi: bit: "0"
98729-98874 qi: bit: "1"
98874-98999 qi: bit: "0"
98999-99143 qi: bit: "1"
99143-99280 qi: bit: "1"
99280-99408 qi: bit: "0"
98055-98185 qi: byte-start: "Start bit" "Start" "S"
98185-99280 qi: byte-data: "d0"
99280-99408 qi: byte-info: "Parity bit" "Parity" "P"
99408-99554 qi: byte-info: "Stop bit" "Stop" "S"
99408-99554 qi: bit: "1"
99554-99680 qi: bit: "0"
99680-99817 qi: bit: "0"
99817-99961 qi: bit: "1"
99961-100098 qi: bit: "1"
100098-100234 qi: bit: "1"
100234-100359 qi: bit: "0"
100359-100499 qi: bit: "0"
100499-100642 qi: bit: "1"
100642-100767 qi: bit: "0"
100767-100912 qi: bit: "1"
99554-99680 qi: byte-start: "Start bit" "Start" "S"
99680-100767 qi: byte-data: "4e"
100767-100912 qi: byte-info: "Parity bit" "Parity" "P"
100912-101049 qi: byte-info: "Stop bit" "Stop" "S"
87589-99554 qi: packet-data: "Identification: Version = 1.0, Manufacturer = 0010, Device = 001bf4d0" "ID: 1.0 0010 001bf4d0" "ID"
99554-101049 qi: packet-checksum-ok: "Checksum OK" "OK"
100912-101049 qi: bit: "1"
104715-104909 qi: bit: "0"
104909-105053 qi: bit: "1"
105053-105183 qi: bit: "0"
105183-105317 qi: bit: "0"
105317-105455 qi: bit: "0"
105455-105599 qi: bit: "1"
105599-105724 qi: bit: "0"
105724-105869 qi: bit: "1"
105869-105998 qi: bit: "0"
105998-106133 qi: bit: "0"
104715-104909 qi: byte-start: "Start bit" "Start" "S"
104909-105998 qi: byte-data: "51"
105998-106133 qi: byte-info: "Parity bit" "Parity" "P"
106133-106276 qi: byte-info: "Stop bit" "Stop" "S"
106133-106276 qi: bit: "1"
106276-106407 qi: bit: "0"
106407-106541 qi: bit: "0"
106541-106685 qi: bit: "1"
106685-106813 qi: bit: "0"
106813-106958 qi: bit: "1"
106958-107083 qi: bit: "0"
107083-107223 qi: bit: "0"
107223-107356 qi: bit: "0"
107356-107495 qi: bit: "0"
107495-107639 qi: bit: "1"
106276-106407 qi: byte-start: "Start bit" "Start" "S"
106407-107495 qi: byte-data: "0a"
107495-107639 qi: byte-info: "Parity bit" "Parity" "P"
107639-107775 qi: byte-info: "Stop bit" "Stop" "S"
107639-107775 qi: bit: "1"
107775-107899 qi: bit: "0"
107899-108040 qi: bit: "0"
108040-108172 qi: bit: "0"
108172-108311 qi: bit: "0"
108311-108443 qi: bit: "0"
108443-108583 qi: bit: "0"
108583-108716 qi: bit: "0"
108716-108855 qi: bit: "0"
108855-108988 qi: bit: "0"
108988-109132 qi: bit: "1"
107775-107899 qi: byte-start: "Start bit" "Start" "S"
107899-108988 qi: byte-data: "00"
108988-109132 qi: byte-info: "Parity bit" "Parity" "P"
109132-109269 qi: byte-info: "Stop bit" "Stop" "S"
109132-109269 qi: bit: "1"
109269-109398 qi: bit: "0"
109398-109532 qi: bit: "0"
109532-109671 qi: bit: "0"
109671-109804 qi: bit: "0"
109804-109942 qi: bit: "0"
109942-110074 qi: bit: "0"
110074-110214 qi: bit: "0"
110214-110347 qi: bit: "0"
110347-110485 qi: bit: "0"
110485-110628 qi: bit: "1"
109269-109398 qi: byte-start: "Start bit" "Start" "S"
109398-110485 qi: byte-data: "00"
110485-110628 qi: byte-info: "Parity bit" "Parity" "P"
110628-110765 qi: byte-info: "Stop bit" "Stop" "S"
110628-110765 qi: bit: "1"
110765-110890 qi: bit: "0"
110890-111035 qi: bit: "1"
111035-111172 qi: bit: "1"
111172-111302 qi: bit: "0"
111302-111435 qi: bit: "0"
111435-111575 qi: bit: "0"
111575-111707 qi: bit: "0"
111707-111852 qi: bit: "1"
111852-111981 qi: bit: "0"
111981-112115 qi: bit: "0"
110765-110890 qi: byte-start: "Start bit" "Start" "S"
110890-111981 qi: byte-data: "43"
111981-112115 qi: byte-info: "Parity bit" "Parity" "P"
112115-112259 qi: byte-info: "Stop bit" "Stop" "S"
112115-112259 qi: bit: "1"
112259-112390 qi: bit: "0"
112390-112523 qi: bit: "0"
112523-112661 qi: bit: "0"
112661-112794 qi: bit: "0"
112794-112934 qi: bit: "0"
112934-113066 qi: bit: "0"
113066-113205 qi: bit: "0"
113205-113338 qi: bit: "0"
113338-113478 qi: bit: "0"
113478-113620 qi: bit: "1"
112259-112390 qi: byte-start: "Start bit" "Start" "S"
112390-113478 qi: byte-data: "00"
113478-113620 qi: byte-info: "Parity bit" "Parity" "P"
113620-113757 qi: byte-info: "Stop bit" "Stop" "S"
113620-113757 qi: bit: "1"
113757-113882 qi: bit: "0"
113882-114022 qi: bit: "0"
114022-114154 qi: bit: "0"
114154-114293 qi: bit: "0"
114293-114436 qi: bit: "1"
114436-114573 qi: bit: "1"
114573-114697 qi: bit: "0"
114697-114838 qi: bit: "0"
114838-114971 qi: bit: "0"
114971-115114 qi: bit: "1"
113757-113882 qi: byte-start: "Start bit" "Start" "S"
113882-114971 qi: byte-data: "18"
114971-115114 qi: byte-info: "Parity bit" "Parity" "P"
115114-115251 qi: byte-info: "Stop bit" "Stop" "S"
104715-113757 qi: packet-data: "Configuration: Power Class = 0, Maximum Power = 10, Prop = 0,Count = 0, Window Size = 8, Window Offset = 3" "C: PC = 0 MP = 10 P = 0 C = 0 WS = 8 WO = 3" "Configuration" "C"
113757-115251 qi: packet-checksum-ok: "Checksum OK" "OK"
115114-115251 qi: bit: "1"
126424-126549 qi: bit: "0"
126549-126694 qi: bit: "1"
126694-126831 qi: bit: "1"
126831-126961 qi: bit: "0"
126961-127095 qi: bit: "0"
127095-127234 qi: bit: "0"
127234-127366 qi: bit: "0"
127366-127505 qi: bit: "0"
127505-127639 qi: bit: "0"
127639-127783 qi: bit: "1"
126424-126549 qi: byte-start: "Start bit" "Start" "S"
126549-127639 qi: byte-data: "03"
127639-127783 qi: byte-info: "Parity bit" "Parity" "P"
127783-127920 qi: byte-info: "Stop bit" "Stop" "S"
127783-127920 qi: bit: "1"
127920-128049 qi: bit: "0"
128049-128183 qi: bit: "0"
128183-128327 qi: bit: "1"
128327-128464 qi: bit: "1"
128464-128600 qi: bit: "1"
128600-128737 qi: bit: "1"
128737-128865 qi: bit: "0"
128865-129000 qi: bit: "0"
129000-129138 qi: bit: "0"
129138-129281 qi: bit: "1"
127920-128049 qi: byte-start: "Start bit" "Start" "S"
128049-129138 qi: byte-data: "1e"
129138-129281 qi: byte-info: "Parity bit" "Parity" "P"
129281-129418 qi: byte-info: "Stop bit" "Stop" "S"
129281-129418 qi: bit: "1"
129418-129543 qi: bit: "0"
129543-129688 qi: bit: "1"
129688-129818 qi: bit: "0"
129818-129962 qi: bit: "1"
129962-130099 qi: bit: "1"
130099-130235 qi: bit: "1"
130235-130360 qi: bit: "0"
130360-130500 qi: bit: "0"
130500-130633 qi: bit: "0"
130633-130777 qi: bit: "1"
129418-129543 qi: byte-start: "Start bit" "Start" "S"
129543-130633 qi: byte-data: "1d"
130633-130777 qi: byte-info: "Parity bit" "Parity" "P"
130777-130914 qi: byte-info: "Stop bit" "Stop" "S"
126424-129418 qi: packet-data: "Control Error: 30" "CE: 30" "CE"
129418-130914 qi: packet-checksum-ok: "Checksum OK" "OK"
130777-130914 qi: bit: "1"
135341-135466 qi: bit: "0"
135466-135610 qi: bit: "1"
135610-135747 qi: bit: "1"
135747-135877 qi: bit: "0"
135877-136011 qi: bit: "0"
136011-136149 qi: bit: "0"
136149-136282 qi: bit: "0"
136282-136422 qi: bit: "0"
136422-136554 qi: bit: "0"
136554-136698 qi: bit: "1"
135341-135466 qi: byte-start: "Start bit" "Start" "S"
135466-136554 qi: byte-data: "03"
136554-136698 qi: byte-info: "Parity bit" "Parity" "P"
136698-136835 qi: byte-info: "Stop bit" "Stop" "S"
136698-136835 qi: bit: "1"
136835-136965 qi: bit: "0"
136965-137109 qi: bit: "1"
137109-137234 qi: bit: "0"
137234-137374 qi: bit: "0"
137374-137507 qi: bit: "0"
137507-137646 qi: bit: "0"
137646-137779 qi: bit: "0"
137779-137917 qi: bit: "0"
137917-138050 qi: bit: "0"
138050-138189 qi: bit: "0"
136835-136965 qi: byte-start: "Start bit" "Start" "S"
136965-138050 qi: byte-data: "01"
138050-138189 qi: byte-info: "Parity bit" "Parity" "P"
138189-138332 qi: byte-info: "Stop bit" "Stop" "S"
138189-138332 qi: bit: "1"
138332-138457 qi: bit: "0"
138457-138596 qi: bit: "0"
138596-138739 qi: bit: "1"
138739-138865 qi: bit: "0"
138865-139005 qi: bit: "0"
139005-139138 qi: bit: "0"
139138-139277 qi: bit: "0"
139277-139409 qi: bit: "0"
139409-139549 qi: bit: "0"
139549-139681 qi: bit: "0"
138332-138457 qi: byte-start: "Start bit" "Start" "S"
138457-139549 qi: byte-data: "02"
139549-139681 qi: byte-info: "Parity bit" "Parity" "P"
139681-139825 qi: byte-info: "Stop bit" "Stop" "S"
135341-138332 qi: packet-data: "Control Error: 1" "CE: 1" "CE"
138332-139825 qi: packet-checksum-ok: "Checksum OK" "OK"
139681-139825 qi: bit: "1"
148335-148459 qi: bit: "0"
148459-148603 qi: bit: "1"
148603-148740 qi: bit: "1"
148740-148872 qi: bit: "0"
148872-149004 qi: bit: "0"
149004-149145 qi: bit: "0"
149145-149276 qi: bit: "0"
149276-149417 qi: bit: "0"
149417-149548 qi: bit: "0"
149548-149691 qi: bit: "1"
148335-148459 qi: byte-start: "Start bit" "Start" "S"
148459-149548 qi: byte-data: "03"
149548-149691 qi: byte-info: "Parity bit" "Parity" "P"
149691-149828 qi: byte-info: "Stop bit" "Stop" "S"
149691-149828 qi: bit: "1"
149828-149960 qi: bit: "0"
149960-150103 qi: bit: "1"
150103-150228 qi: bit: "0"
150228-150369 qi: bit: "0"
150369-150500 qi: bit: "0"
150500-150641 qi: bit: "0"
150641-150772 qi: bit: "0"
150772-150912 qi: bit: "0"
150912-151043 qi: bit: "0"
151043-151184 qi: bit: "0"
149828-149960 qi: byte-start: "Start bit" "Start" "S"
149960-151043 qi: byte-data: "01"
151043-151184 qi: byte-info: "Parity bit" "Parity" "P"
151184-151326 qi: byte-info: "Stop bit" "Stop" "S"
151184-151326 qi: bit: "1"
151326-151450 qi: bit: "0"
151450-151592 qi: bit: "0"
151592-151734 qi: bit: "1"
151734-151858 qi: bit: "0"
151858-152000 qi: bit: "0"
152000-152131 qi: bit: "0"
152131-152271 qi: bit: "0"
152271-152402 qi: bit: "0"
152402-152543 qi: bit: "0"
152543-152674 qi: bit: "0"
151326-151450 qi: byte-start: "Start bit" "Start" "S"
151450-152543 qi: byte-data: "02"
152543-152674 qi: byte-info: "Parity bit" "Parity" "P"
152674-152818 qi: byte-info: "Stop bit" "Stop" "S"
148335-151326 qi: packet-data: "Control Error: 1" "CE: 1" "CE"
151326-152818 qi: packet-checksum-ok: "Checksum OK" "OK"
152674-152818 qi: bit: "1"
161328-161454 qi: bit: "0"
161454-161597 qi: bit: "1"
161597-161734 qi: bit: "1"
161734-161866 qi: bit: "0"
161866-162000 qi: bit: "0"
162000-162138 qi: bit: "0"
162138-162271 qi: bit: "0"
162271-162409 qi: bit: "0"
162409-162542 qi: bit: "0"
162542-162685 qi: bit: "1"
161328-161454 qi: byte-start: "Start bit" "Start" "S"
161454-162542 qi: byte-data: "03"
162542-162685 qi: byte-info: "Parity bit" "Parity" "P"
162685-162822 qi: byte-info: "Stop bit" "Stop" "S"
162685-162822 qi: bit: "1"
162822-162953 qi: bit: "0"
162953-163087 qi: bit: "0"
163087-163229 qi: bit: "1"
163229-163366 qi: bit: "1"
163366-163502 qi: bit: "1"
163502-163639 qi: bit: "1"
163639-163770 qi: bit: "0"
163770-163905 qi: bit: "0"
163905-164043 qi: bit: "0"
164043-164185 qi: bit: "1"
162822-162953 qi: byte-start: "Start bit" "Start" "S"
162953-164043 qi: byte-data: "1e"
164043-164185 qi: byte-info: "Parity bit" "Parity" "P"
164185-164322 qi: byte-info: "Stop bit" "Stop" "S"
164185-164322 qi: bit: "1"
164322-164447 qi: bit: "0"
164447-164591 qi: bit: "1"
164591-164723 qi: bit: "0"
164723-164866 qi: bit: "1"
164866-165003 qi: bit: "1"
165003-165139 qi: bit: "1"
165139-165265 qi: bit: "0"
165265-165405 qi: bit: "0"
165405-165538 qi: bit: "0"
165538-165679 qi: bit: "1"
164322-164447 qi: byte-start: "Start bit" "Start" "S"
164447-165538 qi: byte-data: "1d"
165538-165679 qi: byte-info: "Parity bit" "Parity" "P"
165679-165816 qi: byte-info: "Stop bit" "Stop" "S"
161328-164322 qi: packet-data: "Control Error: 30" "CE: 30" "CE"
164322-165816 qi: packet-checksum-ok: "Checksum OK" "OK"
165679-165816 qi: bit: "1"
170242-170362 qi: bit: "0"
170362-170509 qi: bit: "1"
170509-170645 qi: bit: "1"
170645-170782 qi: bit: "0"
170782-170909 qi: bit: "0"
170909-171054 qi: bit: "0"
171054-171180 qi: bit: "0"
171180-171325 qi: bit: "0"
171325-171452 qi: bit: "0"
171452-171597 qi: bit: "1"
170242-170362 qi: byte-start: "Start bit" "Start" "S"
170362-171452 qi: byte-data: "03"
171452-171597 qi: byte-info: "Parity bit" "Parity" "P"
171597-171735 qi: byte-info: "Stop bit" "Stop" "S"
171597-171735 qi: bit: "1"
171735-171868 qi: bit: "0"
171868-171998 qi: bit: "0"
171998-172142 qi: bit: "1"
172142-172279 qi: bit: "1"
172279-172415 qi: bit: "1"
172415-172552 qi: bit: "1"
172552-172685 qi: bit: "0"
172685-172816 qi: bit: "0"
172816-172958 qi: bit: "0"
172958-173099 qi: bit: "1"
171735-171868 qi: byte-start: "Start bit" "Start" "S"
171868-172958 qi: byte-data: "1e"
172958-173099 qi: byte-info: "Parity bit" "Parity" "P"
173099-173236 qi: byte-info: "Stop bit" "Stop" "S"
173099-173236 qi: bit: "1"
173236-173359 qi: bit: "0"
173359-173503 qi: bit: "1"
173503-173638 qi: bit: "0"
173638-173780 qi: bit: "1"
173780-173917 qi: bit: "1"
173917-174053 qi: bit: "1"
174053-174177 qi: bit: "0"
174177-174319 qi: bit: "0"
174319-174449 qi: bit: "0"
174449-174593 qi: bit: "1"
173236-173359 qi: byte-start: "Start bit" "Start" "S"
173359-174449 qi: byte-data: "1d"
174449-174593 qi: byte-info: "Parity bit" "Parity" "P"
174593-174730 qi: byte-info: "Stop bit" "Stop" "S"
170242-173236 qi: packet-data: "Control Error: 30" "CE: 30" "CE"
173236-174730 qi: packet-checksum-ok: "Checksum OK" "OK"
174593-174730 qi: bit: "1"
261411-261538 qi: bit: "0"
261538-261681 qi: bit: "1"
261681-261817 qi: bit: "1"
261817-261949 qi: bit: "0"
261949-262084 qi: bit: "0"
262084-262222 qi: bit: "0"
262222-262355 qi: bit: "0"
262355-262493 qi: bit: "0"
262493-262627 qi: bit: "0"
262627-262769 qi: bit: "1"
261411-261538 qi: byte-start: "Start bit" "Start" "S"
261538-262627 qi: byte-data: "03"
262627-262769 qi: byte-info: "Parity bit" "Parity" "P"
262769-262905 qi: byte-info: "Stop bit" "Stop" "S"
262769-262905 qi: bit: "1"
262905-263036 qi: bit: "0"
263036-263171 qi: bit: "0"
263171-263309 qi: bit: "0"
263309-263443 qi: bit: "0"
263443-263585 qi: bit: "1"
263585-263721 qi: bit: "1"
263721-263857 qi: bit: "1"
263857-263994 qi: bit: "1"
263994-264130 qi: bit: "1"
264130-264261 qi: bit: "0"
262905-263036 qi: byte-start: "Start bit" "Start" "S"
263036-264130 qi: byte-data: "f8"
264130-264261 qi: byte-info: "Parity bit" "Parity" "P"
264261-264404 qi: byte-info: "Stop bit" "Stop" "S"
264261-264404 qi: bit: "1"
264404-264532 qi: bit: "0"
264532-264674 qi: bit: "1"
264674-264811 qi: bit: "1"
264811-264942 qi: bit: "0"
264942-265084 qi: bit: "1"
265084-265221 qi: bit: "1"
265221-265358 qi: bit: "1"
265358-265494 qi: bit: "1"
265494-265631 qi: bit: "1"
265631-265758 qi: bit: "0"
264404-264532 qi: byte-start: "Start bit" "Start" "S"
264532-265631 qi: byte-data: "fb"
265631-265758 qi: byte-info: "Parity bit" "Parity" "P"
265758-265901 qi: byte-info: "Stop bit" "Stop" "S"
261411-264404 qi: packet-data: "Control Error: -8" "CE: -8" "CE"
264404-265901 qi: packet-checksum-ok: "Checksum OK" "OK"
265758-265901 qi: bit: "1"
359332-359459 qi: bit: "0"
359459-359602 qi: bit: "1"
359602-359739 qi: bit: "1"
359739-359870 qi: bit: "0"
359870-360005 qi: bit: "0"
360005-360142 qi: bit: "0"
360142-360276 qi: bit: "0"
360276-360414 qi: bit: "0"
360414-360547 qi: bit: "0"
360547-360690 qi: bit: "1"
359332-359459 qi: byte-start: "Start bit" "Start" "S"
359459-360547 qi: byte-data: "03"
360547-360690 qi: byte-info: "Parity bit" "Parity" "P"
360690-360826 qi: byte-info: "Stop bit" "Stop" "S"
360690-360826 qi: bit: "1"
360826-360957 qi: bit: "0"
360957-361093 qi: bit: "0"
361093-361230 qi: bit: "0"
361230-361363 qi: bit: "0"
361363-361506 qi: bit: "1"
361506-361642 qi: bit: "1"
361642-361779 qi: bit: "1"
361779-361915 qi: bit: "1"
361915-362051 qi: bit: "1"
362051-362183 qi: bit: "0"
360826-360957 qi: byte-start: "Start bit" "Start" "S"
360957-362051 qi: byte-data: "f8"
362051-362183 qi: byte-info: "Parity bit" "Parity" "P"
362183-362325 qi: byte-info: "Stop bit" "Stop" "S"
362183-362325 qi: bit: "1"
362325-362452 qi: bit: "0"
362452-362594 qi: bit: "1"
362594-362731 qi: bit: "1"
362731-362863 qi: bit: "0"
362863-363006 qi: bit: "1"
363006-363143 qi: bit: "1"
363143-363279 qi: bit: "1"
363279-363416 qi: bit: "1"
363416-363552 qi: bit: "1"
363552-363678 qi: bit: "0"
362325-362452 qi: byte-start: "Start bit" "Start" "S"
362452-363552 qi: byte-data: "fb"
363552-363678 qi: byte-info: "Parity bit" "Parity" "P"
363678-363821 qi: byte-info: "Stop bit" "Stop" "S"
359332-362325 qi: packet-data: "Control Error: -8" "CE: -8" "CE"
362325-363821 qi: packet-checksum-ok: "Checksum OK" "OK"
363678-363821 qi: bit: "1"
457251-457379 qi: bit: "0"
457379-457521 qi: bit: "1"
457521-457658 qi: bit: "1"
457658-457789 qi: bit: "0"
457789-457924 qi: bit: "0"
457924-458061 qi: bit: "0"
458061-458196 qi: bit: "0"
458196-458333 qi: bit: "0"
458333-458467 qi: bit: "0"
458467-458609 qi: bit: "1"
457251-457379 qi: byte-start: "Start bit" "Start" "S"
457379-458467 qi: byte-data: "03"
458467-458609 qi: byte-info: "Parity bit" "Parity" "P"
458609-458746 qi: byte-info: "Stop bit" "Stop" "S"
458609-458746 qi: bit: "1"
458746-458876 qi: bit: "0"
458876-459011 qi: bit: "0"
459011-459149 qi: bit: "0"
459149-459283 qi: bit: "0"
459283-459424 qi: bit: "1"
459424-459562 qi: bit: "1"
459562-459698 qi: bit: "1"
459698-459834 qi: bit: "1"
459834-459971 qi: bit: "1"
459971-460102 qi: bit: "0"
458746-458876 qi: byte-start: "Start bit" "Start" "S"
458876-459971 qi: byte-data: "f8"
459971-460102 qi: byte-info: "Parity bit" "Parity" "P"
460102-460245 qi: byte-info: "Stop bit" "Stop" "S"
460102-460245 qi: bit: "1"
460245-460372 qi: bit: "0"
460372-460515 qi: bit: "1"
460515-460651 qi: bit: "1"
460651-460783 qi: bit: "0"
460783-460925 qi: bit: "1"
460925-461062 qi: bit: "1"
461062-461198 qi: bit: "1"
461198-461334 qi: bit: "1"
461334-461471 qi: bit: "1"
461471-461598 qi: bit: "0"
460245-460372 qi: byte-start: "Start bit" "Start" "S"
460372-461471 qi: byte-data: "fb"
461471-461598 qi: byte-info: "Parity bit" "Parity" "P"
461598-461741 qi: byte-info: "Stop bit" "Stop" "S"
457251-460245 qi: packet-data: "Control Error: -8" "CE: -8" "CE"
460245-461741 qi: packet-checksum-ok: "Checksum OK" "OK"
461598-461741 qi: bit: "1"
490997-491124 qi: bit: "0"
491124-491262 qi: bit: "0"
491262-491397 qi: bit: "0"
491397-491538 qi: bit: "1"
491538-491669 qi: bit: "0"
491669-491805 qi: bit: "0"
491805-491942 qi: bit: "0"
491942-492076 qi: bit: "0"
492076-492214 qi: bit: "0"
492214-492347 qi: bit: "0"
490997-491124 qi: byte-start: "Start bit" "Start" "S"
491124-492214 qi: byte-data: "04"
492214-492347 qi: byte-info: "Parity bit" "Parity" "P"
492347-492489 qi: byte-info: "Stop bit" "Stop" "S"
492347-492489 qi: bit: "1"
492489-492621 qi: bit: "0"
492621-492755 qi: bit: "0"
492755-492894 qi: bit: "0"
492894-493036 qi: bit: "1"
493036-493172 qi: bit: "1"
493172-493308 qi: bit: "1"
493308-493435 qi: bit: "0"
493435-493577 qi: bit: "1"
493577-493709 qi: bit: "0"
493709-493852 qi: bit: "1"
492489-492621 qi: byte-start: "Start bit" "Start" "S"
492621-493709 qi: byte-data: "5c"
493709-493852 qi: byte-info: "Parity bit" "Parity" "P"
493852-493989 qi: byte-info: "Stop bit" "Stop" "S"
493852-493989 qi: bit: "1"
493989-494116 qi: bit: "0"
494116-494254 qi: bit: "0"
494254-494388 qi: bit: "0"
494388-494527 qi: bit: "0"
494527-494668 qi: bit: "1"
494668-494804 qi: bit: "1"
494804-494931 qi: bit: "0"
494931-495073 qi: bit: "1"
495073-495206 qi: bit: "0"
495206-495340 qi: bit: "0"
493989-494116 qi: byte-start: "Start bit" "Start" "S"
494116-495206 qi: byte-data: "58"
495206-495340 qi: byte-info: "Parity bit" "Parity" "P"
495340-495482 qi: byte-info: "Stop bit" "Stop" "S"
490997-493989 qi: packet-data: "Received Power: 92" "RP: 92" "RP"
493989-495482 qi: packet-checksum-ok: "Checksum OK" "OK"
495340-495482 qi: bit: "1"
566735-566862 qi: bit: "0"
566862-567005 qi: bit: "1"
567005-567142 qi: bit: "1"
567142-567273 qi: bit: "0"
567273-567407 qi: bit: "0"
567407-567545 qi: bit: "0"
567545-567679 qi: bit: "0"
567679-567816 qi: bit: "0"
567816-567950 qi: bit: "0"
567950-568091 qi: bit: "1"
566735-566862 qi: byte-start: "Start bit" "Start" "S"
566862-567950 qi: byte-data: "03"
567950-568091 qi: byte-info: "Parity bit" "Parity" "P"
568091-568228 qi: byte-info: "Stop bit" "Stop" "S"
568091-568228 qi: bit: "1"
568228-568359 qi: bit: "0"
568359-568494 qi: bit: "0"
568494-568633 qi: bit: "0"
568633-568766 qi: bit: "0"
568766-568907 qi: bit: "1"
568907-569044 qi: bit: "1"
569044-569180 qi: bit: "1"
569180-569316 qi: bit: "1"
569316-569453 qi: bit: "1"
569453-569584 qi: bit: "0"
568228-568359 qi: byte-start: "Start bit" "Start" "S"
568359-569453 qi: byte-data: "f8"
569453-569584 qi: byte-info: "Parity bit" "Parity" "P"
569584-569726 qi: byte-info: "Stop bit" "Stop" "S"
569584-569726 qi: bit: "1"
569726-569854 qi: bit: "0"
569854-569996 qi: bit: "1"
569996-570133 qi: bit: "1"
570133-570264 qi: bit: "0"
570264-570407 qi: bit: "1"
570407-570543 qi: bit: "1"
570543-570679 qi: bit: "1"
570679-570816 qi: bit: "1"
570816-570952 qi: bit: "1"
570952-571080 qi: bit: "0"
569726-569854 qi: byte-start: "Start bit" "Start" "S"
569854-570952 qi: byte-data: "fb"
570952-571080 qi: byte-info: "Parity bit" "Parity" "P"
571080-571222 qi: byte-info: "Stop bit" "Stop" "S"
566735-569726 qi: packet-data: "Control Error: -8" "CE: -8" "CE"
569726-571222 qi: packet-checksum-ok: "Checksum OK" "OK"
571080-571222 qi: bit: "1"
664633-664760 qi: bit: "0"
664760-664902 qi: bit: "1"
664902-665039 qi: bit: "1"
665039-665170 qi: bit: "0"
665170-665305 qi: bit: "0"
665305-665442 qi: bit: "0"
665442-665577 qi: bit: "0"
665577-665714 qi: bit: "0"
665714-665847 qi: bit: "0"
665847-665989 qi: bit: "1"
664633-664760 qi: byte-start: "Start bit" "Start" "S"
664760-665847 qi: byte-data: "03"
665847-665989 qi: byte-info: "Parity bit" "Parity" "P"
665989-666127 qi: byte-info: "Stop bit" "Stop" "S"
665989-666127 qi: bit: "1"
666127-666257 qi: bit: "0"
666257-666392 qi: bit: "0"
666392-666530 qi: bit: "0"
666530-666664 qi: bit: "0"
666664-666805 qi: bit: "1"
666805-666941 qi: bit: "1"
666941-667077 qi: bit: "1"
667077-667214 qi: bit: "1"
667214-667351 qi: bit: "1"
667351-667481 qi: bit: "0"
666127-666257 qi: byte-start: "Start bit" "Start" "S"
666257-667351 qi: byte-data: "f8"
667351-667481 qi: byte-info: "Parity bit" "Parity" "P"
667481-667624 qi: byte-info: "Stop bit" "Stop" "S"
667481-667624 qi: bit: "1"
667624-667751 qi: bit: "0"
667751-667894 qi: bit: "1"
667894-668031 qi: bit: "1"
668031-668161 qi: bit: "0"
668161-668304 qi: bit: "1"
668304-668441 qi: bit: "1"
668441-668578 qi: bit: "1"
668578-668714 qi: bit: "1"
668714-668850 qi: bit: "1"
668850-668977 qi: bit: "0"
667624-667751 qi: byte-start: "Start bit" "Start" "S"
667751-668850 qi: byte-data: "fb"
668850-668977 qi: byte-info: "Parity bit" "Parity" "P"
668977-669120 qi: byte-info: "Stop bit" "Stop" "S"
664633-667624 qi: packet-data: "Control Error: -8" "CE: -8" "CE"
667624-669120 qi: packet-checksum-ok: "Checksum OK" "OK"
668977-669120 qi: bit: "1"
762529-762657 qi: bit: "0"
762657-762799 qi: bit: "1"
762799-762936 qi: bit: "1"
762936-763067 qi: bit: "0"
763067-763202 qi: bit: "0"
763202-763339 qi: bit: "0"
763339-763473 qi: bit: "0"
763473-763611 qi: bit: "0"
763611-763745 qi: bit: "0"
763745-763886 qi: bit: "1"
762529-762657 qi: byte-start: "Start bit" "Start" "S"
762657-763745 qi: byte-data: "03"
763745-763886 qi: byte-info: "Parity bit" "Parity" "P"
763886-764023 qi: byte-info: "Stop bit" "Stop" "S"
763886-764023 qi: bit: "1"
764023-764154 qi: bit: "0"
764154-764289 qi: bit: "0"
764289-764427 qi: bit: "0"
764427-764560 qi: bit: "0"
764560-764702 qi: bit: "1"
764702-764838 qi: bit: "1"
764838-764975 qi: bit: "1"
764975-765111 qi: bit: "1"
765111-765247 qi: bit: "1"
765247-765379 qi: bit: "0"
764023-764154 qi: byte-start: "Start bit" "Start" "S"
764154-765247 qi: byte-data: "f8"
765247-765379 qi: byte-info: "Parity bit" "Parity" "P"
765379-765521 qi: byte-info: "Stop bit" "Stop" "S"
765379-765521 qi: bit: "1"
765521-765649 qi: bit: "0"
765649-765791 qi: bit: "1"
765791-765927 qi: bit: "1"
765927-766059 qi: bit: "0"
766059-766202 qi: bit: "1"
766202-766338 qi: bit: "1"
766338-766474 qi: bit: "1"
766474-766610 qi: bit: "1"
766610-766747 qi: bit: "1"
766747-766874 qi: bit: "0"
765521-765649 qi: byte-start: "Start bit" "Start" "S"
765649-766747 qi: byte-data: "fb"
766747-766874 qi: byte-info: "Parity bit" "Parity" "P"
766874-767017 qi: byte-info: "Stop bit" "Stop" "S"
762529-765521 qi: packet-data: "Control Error: -8" "CE: -8" "CE"
765521-767017 qi: packet-checksum-ok: "Checksum OK" "OK"
766874-767017 qi: bit: "1"
814346-814473 qi: bit: "0"
814473-814611 qi: bit: "0"
814611-814745 qi: bit: "0"
814745-814887 qi: bit: "1"
814887-815018 qi: bit: "0"
815018-815153 qi: bit: "0"
815153-815291 qi: bit: "0"
815291-815425 qi: bit: "0"
815425-815563 qi: bit: "0"
815563-815696 qi: bit: "0"
814346-814473 qi: byte-start: "Start bit" "Start" "S"
814473-815563 qi: byte-data: "04"
815563-815696 qi: byte-info: "Parity bit" "Parity" "P"
815696-815837 qi: byte-info: "Stop bit" "Stop" "S"
815696-815837 qi: bit: "1"
815837-815969 qi: bit: "0"
815969-816104 qi: bit: "0"
816104-816241 qi: bit: "0"
816241-816383 qi: bit: "1"
816383-816520 qi: bit: "1"
816520-816656 qi: bit: "1"
816656-816783 qi: bit: "0"
816783-816926 qi: bit: "1"
816926-817057 qi: bit: "0"
817057-817200 qi: bit: "1"
815837-815969 qi: byte-start: "Start bit" "Start" "S"
815969-817057 qi: byte-data: "5c"
817057-817200 qi: byte-info: "Parity bit" "Parity" "P"
817200-817337 qi: byte-info: "Stop bit" "Stop" "S"
817200-817337 qi: bit: "1"
817337-817463 qi: bit: "0"
817463-817602 qi: bit: "0"
817602-817735 qi: bit: "0"
817735-817874 qi: bit: "0"
817874-818015 qi: bit: "1"
818015-818152 qi: bit: "1"
818152-818278 qi: bit: "0"
818278-818422 qi: bit: "1"
818422-818553 qi: bit: "0"
818553-818688 qi: bit: "0"
817337-817463 qi: byte-start: "Start bit" "Start" "S"
817463-818553 qi: byte-data: "58"
818553-818688 qi: byte-info: "Parity bit" "Parity" "P"
818688-818829 qi: byte-info: "Stop bit" "Stop" "S"
814346-817337 qi: packet-data: "Received Power: 92" "RP: 92" "RP"
817337-818829 qi: packet-checksum-ok: "Checksum OK" "OK"
818688-818829 qi: bit: "1"
871994-872120 qi: bit: "0"
872120-872264 qi: bit: "1"
872264-872401 qi: bit: "1"
872401-872531 qi: bit: "0"
872531-872666 qi: bit: "0"
872666-872804 qi: bit: "0"
872804-872938 qi: bit: "0"
872938-873076 qi: bit: "0"
873076-873209 qi: bit: "0"
873209-873350 qi: bit: "1"
871994-872120 qi: byte-start: "Start bit" "Start" "S"
872120-873209 qi: byte-data: "03"
873209-873350 qi: byte-info: "Parity bit" "Parity" "P"
873350-873488 qi: byte-info: "Stop bit" "Stop" "S"
873350-873488 qi: bit: "1"
873488-873618 qi: bit: "0"
873618-873753 qi: bit: "0"
873753-873891 qi: bit: "0"
873891-874024 qi: bit: "0"
874024-874167 qi: bit: "1"
874167-874303 qi: bit: "1"
874303-874439 qi: bit: "1"
874439-874575 qi: bit: "1"
874575-874712 qi: bit: "1"
874712-874842 qi: bit: "0"
873488-873618 qi: byte-start: "Start bit" "Start" "S"
873618-874712 qi: byte-data: "f8"
874712-874842 qi: byte-info: "Parity bit" "Parity" "P"
874842-874986 qi: byte-info: "Stop bit" "Stop" "S"
874842-874986 qi: bit: "1"
874986-875113 qi: bit: "0"
875113-875255 qi: bit: "1"
875255-875392 qi: bit: "1"
875392-875523 qi: bit: "0"
875523-875666 qi: bit: "1"
875666-875803 qi: bit: "1"
875803-875939 qi: bit: "1"
875939-876075 qi: bit: "1"
876075-876211 qi: bit: "1"
876211-876338 qi: bit: "0"
874986-875113 qi: byte-start: "Start bit" "Start" "S"
875113-876211 qi: byte-data: "fb"
876211-876338 qi: byte-info: "Parity bit" "Parity" "P"
876338-876480 qi: byte-info: "Stop bit" "Stop" "S"
871994-874986 qi: packet-data: "Control Error: -8" "CE: -8" "CE"
874986-876480 qi: packet-checksum-ok: "Checksum OK" "OK"
876338-876480 qi: bit: "1"
969880-970007 qi: bit: "0"
970007-970150 qi: bit: "1"
970150-970287 qi: bit: "1"
970287-970417 qi: bit: "0"
970417-970552 qi: bit: "0"
970552-970690 qi: bit: "0"
970690-970824 qi: bit: "0"
970824-970962 qi: bit: "0"
970962-971095 qi: bit: "0"
971095-971237 qi: bit: "1"
969880-970007 qi: byte-start: "Start bit" "Start" "S"
970007-971095 qi: byte-data: "03"
971095-971237 qi: byte-info: "Parity bit" "Parity" "P"
971237-971373 qi: byte-info: "Stop bit" "Stop" "S"
971237-971373 qi: bit: "1"
971373-971504 qi: bit: "0"
971504-971640 qi: bit: "0"
971640-971777 qi: bit: "0"
971777-971910 qi: bit: "0"
971910-972053 qi: bit: "1"
972053-972190 qi: bit: "1"
972190-972326 qi: bit: "1"
972326-972462 qi: bit: "1"
972462-972598 qi: bit: "1"
972598-972728 qi: bit: "0"
971373-971504 qi: byte-start: "Start bit" "Start" "S"
971504-972598 qi: byte-data: "f8"
972598-972728 qi: byte-info: "Parity bit" "Parity" "P"
972728-972872 qi: byte-info: "Stop bit" "Stop" "S"
972728-972872 qi: bit: "1"
972872-972999 qi: bit: "0"
972999-973141 qi: bit: "1"
973141-973278 qi: bit: "1"
973278-973409 qi: bit: "0"
973409-973552 qi: bit: "1"
973552-973689 qi: bit: "1"
973689-973825 qi: bit: "1"
973825-973961 qi: bit: "1"
973961-974097 qi: bit: "1"
974097-974224 qi: bit: "0"
972872-972999 qi: byte-start: "Start bit" "Start" "S"
972999-974097 qi: byte-data: "fb"
974097-974224 qi: byte-info: "Parity bit" "Parity" "P"
974224-974366 qi: byte-info: "Stop bit" "Stop" "S"
969880-972872 qi: packet-data: "Control Error: -8" "CE: -8" "CE"
972872-974366 qi: packet-checksum-ok: "Checksum OK" "OK"
974224-974366 qi: bit: "1"
