52-412 max7219: chip: "Chip 1:"
417-777 max7219: chip: "Chip 2:"
783-1144 max7219: chip: "Chip 3:"
1148-1508 max7219: chip: "Chip 4:"
1548-1908 max7219: chip: "Chip 1:"
1913-2285 max7219: chip: "Chip 2:"
2290-2649 max7219: chip: "Chip 3:"
2655-3014 max7219: chip: "Chip 4:"
3054-3416 max7219: chip: "Chip 1:"
3420-3780 max7219: chip: "Chip 2:"
3785-4159 max7219: chip: "Chip 3:"
4163-4523 max7219: chip: "Chip 4:"
4563-4925 max7219: chip: "Chip 1:"
4929-5289 max7219: chip: "Chip 2:"
5295-5655 max7219: chip: "Chip 3:"
5660-6022 max7219: chip: "Chip 4:"
6061-6433 max7219: chip: "Chip 1:"
6438-6798 max7219: chip: "Chip 2:"
6804-7165 max7219: chip: "Chip 3:"
7169-7529 max7219: chip: "Chip 4:"
7569-7928 max7219: chip: "Chip 1:"
7933-8305 max7219: chip: "Chip 2:"
8310-8669 max7219: chip: "Chip 3:"
8675-9034 max7219: chip: "Chip 4:"
9074-9434 max7219: chip: "Chip 1:"
9439-9798 max7219: chip: "Chip 2:"
9803-10164 max7219: chip: "Chip 3:"
10168-10539 max7219: chip: "Chip 4:"
10580-10939 max7219: chip: "Chip 1:"
10945-11304 max7219: chip: "Chip 2:"
11309-11669 max7219: chip: "Chip 3:"
11674-12033 max7219: chip: "Chip 4:"
12074-12445 max7219: chip: "Chip 1:"
12451-12810 max7219: chip: "Chip 2:"
12815-13174 max7219: chip: "Chip 3:"
13180-13539 max7219: chip: "Chip 4:"
13579-13939 max7219: chip: "Chip 1:"
13944-14304 max7219: chip: "Chip 2:"
14309-14682 max7219: chip: "Chip 3:"
14686-15045 max7219: chip: "Chip 4:"
15086-15445 max7219: chip: "Chip 1:"
15451-15810 max7219: chip: "Chip 2:"
15815-16175 max7219: chip: "Chip 3:"
16180-16552 max7219: chip: "Chip 4:"
16592-16952 max7219: chip: "Chip 1:"
16957-17317 max7219: chip: "Chip 2:"
17322-17682 max7219: chip: "Chip 3:"
17687-18047 max7219: chip: "Chip 4:"
18088-18471 max7219: chip: "Chip 1:"
18464-18823 max7219: chip: "Chip 2:"
18829-19188 max7219: chip: "Chip 3:"
19193-19552 max7219: chip: "Chip 4:"
19593-19954 max7219: chip: "Chip 1:"
19958-20317 max7219: chip: "Chip 2:"
20323-20696 max7219: chip: "Chip 3:"
20700-21061 max7219: chip: "Chip 4:"
221104-221475 max7219: chip: "Chip 1:"
221480-221839 max7219: chip: "Chip 2:"
221845-222205 max7219: chip: "Chip 3:"
422244-422603 max7219: chip: "Chip 1:"
422609-422969 max7219: chip: "Chip 2:"
422973-423332 max7219: chip: "Chip 3:"
423337-423696 max7219: chip: "Chip 4:"
624117-624477 max7219: chip: "Chip 1:"
624482-624856 max7219: chip: "Chip 2:"
624860-625220 max7219: chip: "Chip 3:"
625225-625587 max7219: chip: "Chip 4:"
1625575-1625936 max7219: chip: "Chip 1:"
1625940-1626312 max7219: chip: "Chip 2:"
1626317-1626676 max7219: chip: "Chip 3:"
1626682-1627041 max7219: chip: "Chip 4:"
2627037-2627396 max7219: chip: "Chip 1:"
2627413-2627773 max7219: chip: "Chip 2:"
2627778-2628137 max7219: chip: "Chip 3:"
2628143-2628502 max7219: chip: "Chip 4:"
