52-412 max7219: register: "Display test: on"
417-777 max7219: register: "Display test: on"
783-1144 max7219: register: "Display test: on"
1148-1508 max7219: register: "Display test: on"
1548-1908 max7219: register: "Decode: 0b00000000"
1913-2285 max7219: register: "Decode: 0b00000000"
2290-2649 max7219: register: "Decode: 0b00000000"
2655-3014 max7219: register: "Decode: 0b00000000"
3054-3416 max7219: register: "Intensity: 7"
3420-3780 max7219: register: "Intensity: 7"
3785-4159 max7219: register: "Intensity: 7"
4163-4523 max7219: register: "Intensity: 7"
4563-4925 max7219: register: "Scan limit: 8"
4929-5289 max7219: register: "Scan limit: 8"
5295-5655 max7219: register: "Scan limit: 8"
5660-6022 max7219: register: "Scan limit: 8"
6061-6433 max7219: register: "Display test: off"
6438-6798 max7219: register: "Display test: off"
6804-7165 max7219: register: "Display test: off"
7169-7529 max7219: register: "Display test: off"
19593-19954 max7219: register: "Shutdown: off"
19958-20317 max7219: register: "Shutdown: off"
20323-20696 max7219: register: "Shutdown: off"
20700-21061 max7219: register: "Shutdown: off"
221104-221475 max7219: register: "No-op: "
221480-221839 max7219: register: "No-op: "
221845-222205 max7219: register: "No-op: "
422244-422603 max7219: register: "No-op: "
422609-422969 max7219: register: "No-op: "
422973-423332 max7219: register: "No-op: "
423337-423696 max7219: register: "No-op: "
