117-118 st7735: bit: "0"
120-121 st7735: bit: "0"
123-124 st7735: bit: "0"
126-127 st7735: bit: "0"
129-130 st7735: bit: "0"
132-133 st7735: bit: "0"
135-136 st7735: bit: "0"
138-139 st7735: bit: "1"
117-139 st7735: command: "01"
3601034-3601036 st7735: bit: "0"
3601037-3601039 st7735: bit: "0"
3601040-3601042 st7735: bit: "0"
3601043-3601045 st7735: bit: "1"
3601046-3601048 st7735: bit: "0"
3601049-3601051 st7735: bit: "0"
3601052-3601054 st7735: bit: "0"
3601055-3601057 st7735: bit: "1"
3601034-3601057 st7735: command: "11"
117-139 st7735: description: "SWRESET: Software reset"
15603004-15603006 st7735: bit: "1"
15603007-15603009 st7735: bit: "0"
15603010-15603012 st7735: bit: "1"
15603013-15603015 st7735: bit: "1"
15603016-15603018 st7735: bit: "0"
15603019-15603021 st7735: bit: "0"
15603022-15603024 st7735: bit: "0"
15603025-15603027 st7735: bit: "1"
15603004-15603027 st7735: command: "B1"
3601034-3601057 st7735: description: "SLPOUT: Sleep out & booster on"
15603295-15603297 st7735: bit: "0"
15603298-15603300 st7735: bit: "0"
15603301-15603303 st7735: bit: "0"
15603304-15603306 st7735: bit: "0"
15603307-15603309 st7735: bit: "0"
15603310-15603312 st7735: bit: "0"
15603313-15603315 st7735: bit: "0"
15603316-15603318 st7735: bit: "1"
15603295-15603318 st7735: data: "01"
15603571-15603573 st7735: bit: "0"
15603574-15603576 st7735: bit: "0"
15603577-15603579 st7735: bit: "1"
15603580-15603582 st7735: bit: "0"
15603583-15603585 st7735: bit: "1"
15603586-15603588 st7735: bit: "1"
15603589-15603591 st7735: bit: "0"
15603592-15603594 st7735: bit: "0"
15603571-15603594 st7735: data: "2C"
15603847-15603849 st7735: bit: "0"
15603850-15603852 st7735: bit: "0"
15603853-15603855 st7735: bit: "1"
15603856-15603858 st7735: bit: "0"
15603859-15603861 st7735: bit: "1"
15603862-15603864 st7735: bit: "1"
15603865-15603867 st7735: bit: "0"
15603868-15603870 st7735: bit: "1"
15603847-15603870 st7735: data: "2D"
15604135-15604137 st7735: bit: "1"
15604138-15604140 st7735: bit: "0"
15604141-15604143 st7735: bit: "1"
15604144-15604146 st7735: bit: "1"
15604147-15604149 st7735: bit: "0"
15604150-15604152 st7735: bit: "0"
15604153-15604155 st7735: bit: "1"
15604156-15604158 st7735: bit: "0"
15604135-15604158 st7735: command: "B2"
15603004-15603870 st7735: description: "FRMCTR1: Frame rate control (in normal mode / full colors)"
15604426-15604428 st7735: bit: "0"
15604429-15604431 st7735: bit: "0"
15604432-15604434 st7735: bit: "0"
15604435-15604437 st7735: bit: "0"
15604438-15604440 st7735: bit: "0"
15604441-15604443 st7735: bit: "0"
15604444-15604446 st7735: bit: "0"
15604447-15604449 st7735: bit: "1"
15604426-15604449 st7735: data: "01"
15604703-15604704 st7735: bit: "0"
15604706-15604707 st7735: bit: "0"
15604709-15604710 st7735: bit: "1"
15604712-15604713 st7735: bit: "0"
15604715-15604716 st7735: bit: "1"
15604718-15604719 st7735: bit: "1"
15604721-15604722 st7735: bit: "0"
15604724-15604725 st7735: bit: "0"
15604703-15604725 st7735: data: "2C"
15604979-15604980 st7735: bit: "0"
15604982-15604983 st7735: bit: "0"
15604985-15604986 st7735: bit: "1"
15604988-15604989 st7735: bit: "0"
15604991-15604992 st7735: bit: "1"
15604994-15604995 st7735: bit: "1"
15604997-15604998 st7735: bit: "0"
15605000-15605001 st7735: bit: "1"
15604979-15605001 st7735: data: "2D"
15605267-15605268 st7735: bit: "1"
15605270-15605271 st7735: bit: "0"
15605273-15605274 st7735: bit: "1"
15605276-15605277 st7735: bit: "1"
15605279-15605280 st7735: bit: "0"
15605282-15605283 st7735: bit: "0"
15605285-15605286 st7735: bit: "1"
15605288-15605289 st7735: bit: "1"
15605267-15605289 st7735: command: "B3"
15604135-15605001 st7735: description: "FRMCTR2: Frame rate control (in idle mode / 8-colors)"
15605558-15605559 st7735: bit: "0"
15605561-15605562 st7735: bit: "0"
15605564-15605565 st7735: bit: "0"
15605567-15605568 st7735: bit: "0"
15605570-15605571 st7735: bit: "0"
15605573-15605574 st7735: bit: "0"
15605576-15605577 st7735: bit: "0"
15605579-15605580 st7735: bit: "1"
15605558-15605580 st7735: data: "01"
15605834-15605835 st7735: bit: "0"
15605837-15605838 st7735: bit: "0"
15605840-15605841 st7735: bit: "1"
15605843-15605844 st7735: bit: "0"
15605846-15605847 st7735: bit: "1"
15605849-15605850 st7735: bit: "1"
15605852-15605853 st7735: bit: "0"
15605855-15605856 st7735: bit: "0"
15605834-15605856 st7735: data: "2C"
15606258-15606260 st7735: bit: "0"
15606261-15606263 st7735: bit: "0"
15606264-15606266 st7735: bit: "1"
15606267-15606269 st7735: bit: "0"
15606270-15606272 st7735: bit: "1"
15606273-15606275 st7735: bit: "1"
15606276-15606278 st7735: bit: "0"
15606279-15606281 st7735: bit: "1"
15606258-15606281 st7735: data: "2D"
15606534-15606536 st7735: bit: "0"
15606537-15606539 st7735: bit: "0"
15606540-15606542 st7735: bit: "0"
15606543-15606545 st7735: bit: "0"
15606546-15606548 st7735: bit: "0"
15606549-15606551 st7735: bit: "0"
15606552-15606554 st7735: bit: "0"
15606555-15606557 st7735: bit: "1"
15606534-15606557 st7735: data: "01"
15606810-15606812 st7735: bit: "0"
15606813-15606815 st7735: bit: "0"
15606816-15606818 st7735: bit: "1"
15606819-15606821 st7735: bit: "0"
15606822-15606824 st7735: bit: "1"
15606825-15606827 st7735: bit: "1"
15606828-15606830 st7735: bit: "0"
15606831-15606833 st7735: bit: "0"
15606810-15606833 st7735: data: "2C"
15607086-15607088 st7735: bit: "0"
15607089-15607091 st7735: bit: "0"
15607092-15607094 st7735: bit: "1"
15607095-15607097 st7735: bit: "0"
15607098-15607100 st7735: bit: "1"
15607101-15607103 st7735: bit: "1"
15607104-15607106 st7735: bit: "0"
15607107-15607109 st7735: bit: "1"
15607086-15607109 st7735: data: "2D"
15607374-15607376 st7735: bit: "1"
15607377-15607379 st7735: bit: "0"
15607380-15607382 st7735: bit: "1"
15607383-15607385 st7735: bit: "1"
15607386-15607388 st7735: bit: "0"
15607389-15607391 st7735: bit: "1"
15607392-15607394 st7735: bit: "0"
15607395-15607397 st7735: bit: "0"
15607374-15607397 st7735: command: "B4"
15605267-15607109 st7735: description: "FRMCTR3: Frame rate control (in partial mode / full colors) "
15607665-15607667 st7735: bit: "0"
15607668-15607670 st7735: bit: "0"
15607671-15607673 st7735: bit: "0"
15607674-15607676 st7735: bit: "0"
15607677-15607679 st7735: bit: "0"
15607680-15607682 st7735: bit: "1"
15607683-15607685 st7735: bit: "1"
15607686-15607688 st7735: bit: "1"
15607665-15607688 st7735: data: "07"
15607953-15607955 st7735: bit: "1"
15607956-15607958 st7735: bit: "1"
15607959-15607961 st7735: bit: "0"
15607962-15607964 st7735: bit: "0"
15607965-15607967 st7735: bit: "0"
15607968-15607970 st7735: bit: "0"
15607971-15607973 st7735: bit: "0"
15607974-15607976 st7735: bit: "0"
15607953-15607976 st7735: command: "C0"
15607374-15607688 st7735: description: "INVCTR: Display inversion control"
15608244-15608246 st7735: bit: "1"
15608247-15608249 st7735: bit: "0"
15608250-15608252 st7735: bit: "1"
15608253-15608255 st7735: bit: "0"
15608256-15608258 st7735: bit: "0"
15608259-15608261 st7735: bit: "0"
15608262-15608264 st7735: bit: "1"
15608265-15608267 st7735: bit: "0"
15608244-15608267 st7735: data: "A2"
15608521-15608522 st7735: bit: "0"
15608524-15608525 st7735: bit: "0"
15608527-15608528 st7735: bit: "0"
15608530-15608531 st7735: bit: "0"
15608533-15608534 st7735: bit: "0"
15608536-15608537 st7735: bit: "0"
15608539-15608540 st7735: bit: "1"
15608542-15608543 st7735: bit: "0"
15608521-15608543 st7735: data: "02"
15608797-15608798 st7735: bit: "1"
15608800-15608801 st7735: bit: "0"
15608803-15608804 st7735: bit: "0"
15608806-15608807 st7735: bit: "0"
15608809-15608810 st7735: bit: "0"
15608812-15608813 st7735: bit: "1"
15608815-15608816 st7735: bit: "0"
15608818-15608819 st7735: bit: "0"
15608797-15608819 st7735: data: "84"
15609085-15609086 st7735: bit: "1"
15609088-15609089 st7735: bit: "1"
15609091-15609092 st7735: bit: "0"
15609094-15609095 st7735: bit: "0"
15609097-15609098 st7735: bit: "0"
15609100-15609101 st7735: bit: "0"
15609103-15609104 st7735: bit: "0"
15609106-15609107 st7735: bit: "1"
15609085-15609107 st7735: command: "C1"
15607953-15608819 st7735: description: "PWCTR1: Power control 1"
15609376-15609377 st7735: bit: "1"
15609379-15609380 st7735: bit: "1"
15609382-15609383 st7735: bit: "0"
15609385-15609386 st7735: bit: "0"
15609388-15609389 st7735: bit: "0"
15609391-15609392 st7735: bit: "1"
15609394-15609395 st7735: bit: "0"
15609397-15609398 st7735: bit: "1"
15609376-15609398 st7735: data: "C5"
15609664-15609665 st7735: bit: "1"
15609667-15609668 st7735: bit: "1"
15609670-15609671 st7735: bit: "0"
15609673-15609674 st7735: bit: "0"
15609676-15609677 st7735: bit: "0"
15609679-15609680 st7735: bit: "0"
15609682-15609683 st7735: bit: "1"
15609685-15609686 st7735: bit: "0"
15609664-15609686 st7735: command: "C2"
15609085-15609398 st7735: description: "PWCTR2: Power control 2"
15609955-15609956 st7735: bit: "0"
15609958-15609959 st7735: bit: "0"
15609961-15609962 st7735: bit: "0"
15609964-15609965 st7735: bit: "0"
15609967-15609968 st7735: bit: "1"
15609970-15609971 st7735: bit: "0"
15609973-15609974 st7735: bit: "1"
15609976-15609977 st7735: bit: "0"
15609955-15609977 st7735: data: "0A"
15610231-15610232 st7735: bit: "0"
15610234-15610235 st7735: bit: "0"
15610237-15610238 st7735: bit: "0"
15610240-15610241 st7735: bit: "0"
15610243-15610244 st7735: bit: "0"
15610246-15610247 st7735: bit: "0"
15610249-15610250 st7735: bit: "0"
15610252-15610253 st7735: bit: "0"
15610231-15610253 st7735: data: "00"
15610519-15610520 st7735: bit: "1"
15610522-15610523 st7735: bit: "1"
15610525-15610526 st7735: bit: "0"
15610528-15610529 st7735: bit: "0"
15610531-15610532 st7735: bit: "0"
15610534-15610535 st7735: bit: "0"
15610537-15610538 st7735: bit: "1"
15610540-15610541 st7735: bit: "1"
15610519-15610541 st7735: command: "C3"
15609664-15610253 st7735: description: "PWCTR3: Power control 3"
15610810-15610811 st7735: bit: "1"
15610813-15610814 st7735: bit: "0"
15610816-15610817 st7735: bit: "0"
15610819-15610820 st7735: bit: "0"
15610822-15610823 st7735: bit: "1"
15610825-15610826 st7735: bit: "0"
15610828-15610829 st7735: bit: "1"
15610831-15610832 st7735: bit: "0"
15610810-15610832 st7735: data: "8A"
15611086-15611087 st7735: bit: "0"
15611089-15611090 st7735: bit: "0"
15611092-15611093 st7735: bit: "1"
15611095-15611096 st7735: bit: "0"
15611098-15611099 st7735: bit: "1"
15611101-15611102 st7735: bit: "0"
15611104-15611105 st7735: bit: "1"
15611107-15611108 st7735: bit: "0"
15611086-15611108 st7735: data: "2A"
15611374-15611375 st7735: bit: "1"
15611377-15611378 st7735: bit: "1"
15611380-15611381 st7735: bit: "0"
15611383-15611384 st7735: bit: "0"
15611386-15611387 st7735: bit: "0"
15611389-15611390 st7735: bit: "1"
15611392-15611393 st7735: bit: "0"
15611395-15611396 st7735: bit: "0"
15611374-15611396 st7735: command: "C4"
15610519-15611108 st7735: description: "PWCTR4: Power control 4"
15611665-15611666 st7735: bit: "1"
15611668-15611669 st7735: bit: "0"
15611671-15611672 st7735: bit: "0"
15611674-15611675 st7735: bit: "0"
15611677-15611678 st7735: bit: "1"
15611680-15611681 st7735: bit: "0"
15611683-15611684 st7735: bit: "1"
15611686-15611687 st7735: bit: "0"
15611665-15611687 st7735: data: "8A"
15611941-15611943 st7735: bit: "1"
15611944-15611946 st7735: bit: "1"
15611947-15611949 st7735: bit: "1"
15611950-15611952 st7735: bit: "0"
15611953-15611955 st7735: bit: "1"
15611956-15611958 st7735: bit: "1"
15611959-15611961 st7735: bit: "1"
15611962-15611964 st7735: bit: "0"
15611941-15611964 st7735: data: "EE"
15612229-15612231 st7735: bit: "1"
15612232-15612234 st7735: bit: "1"
15612235-15612237 st7735: bit: "0"
15612238-15612240 st7735: bit: "0"
15612241-15612243 st7735: bit: "0"
15612244-15612246 st7735: bit: "1"
15612247-15612249 st7735: bit: "0"
15612250-15612252 st7735: bit: "1"
15612229-15612252 st7735: command: "C5"
15611374-15611964 st7735: description: "PWCTR5: Power control 5"
15612520-15612522 st7735: bit: "0"
15612523-15612525 st7735: bit: "0"
15612526-15612528 st7735: bit: "0"
15612529-15612531 st7735: bit: "0"
15612532-15612534 st7735: bit: "1"
15612535-15612537 st7735: bit: "1"
15612538-15612540 st7735: bit: "1"
15612541-15612543 st7735: bit: "0"
15612520-15612543 st7735: data: "0E"
15612808-15612810 st7735: bit: "0"
15612811-15612813 st7735: bit: "0"
15612814-15612816 st7735: bit: "1"
15612817-15612819 st7735: bit: "0"
15612820-15612822 st7735: bit: "0"
15612823-15612825 st7735: bit: "0"
15612826-15612828 st7735: bit: "0"
15612829-15612831 st7735: bit: "0"
15612808-15612831 st7735: command: "20"
15612229-15612543 st7735: description: "VMCTR1: VCOM control 1"
15613111-15613113 st7735: bit: "0"
15613114-15613116 st7735: bit: "0"
15613117-15613119 st7735: bit: "1"
15613120-15613122 st7735: bit: "1"
15613123-15613125 st7735: bit: "0"
15613126-15613128 st7735: bit: "1"
15613129-15613131 st7735: bit: "1"
15613132-15613134 st7735: bit: "0"
15613111-15613134 st7735: command: "36"
15612808-15612831 st7735: description: "INVOFF: Display inversion off"
15613402-15613404 st7735: bit: "1"
15613405-15613407 st7735: bit: "1"
15613408-15613410 st7735: bit: "0"
15613411-15613413 st7735: bit: "0"
15613414-15613416 st7735: bit: "1"
15613417-15613419 st7735: bit: "0"
15613420-15613422 st7735: bit: "0"
15613423-15613425 st7735: bit: "0"
15613402-15613425 st7735: data: "C8"
15613690-15613692 st7735: bit: "0"
15613693-15613695 st7735: bit: "0"
15613696-15613698 st7735: bit: "1"
15613699-15613701 st7735: bit: "1"
15613702-15613704 st7735: bit: "1"
15613705-15613707 st7735: bit: "0"
15613708-15613710 st7735: bit: "1"
15613711-15613713 st7735: bit: "0"
15613690-15613713 st7735: command: "3A"
15613111-15613425 st7735: description: "MADCTL: Memory data address control"
15613981-15613983 st7735: bit: "0"
15613984-15613986 st7735: bit: "0"
15613987-15613989 st7735: bit: "0"
15613990-15613992 st7735: bit: "0"
15613993-15613995 st7735: bit: "0"
15613996-15613998 st7735: bit: "1"
15613999-15614001 st7735: bit: "0"
15614002-15614004 st7735: bit: "1"
15613981-15614004 st7735: data: "05"
15614364-15614365 st7735: bit: "0"
15614367-15614368 st7735: bit: "0"
15614370-15614371 st7735: bit: "1"
15614373-15614374 st7735: bit: "0"
15614376-15614377 st7735: bit: "1"
15614379-15614380 st7735: bit: "0"
15614382-15614383 st7735: bit: "1"
15614385-15614386 st7735: bit: "0"
15614364-15614386 st7735: command: "2A"
15613690-15614004 st7735: description: "COLMOD: Interface pixel format"
15614655-15614656 st7735: bit: "0"
15614658-15614659 st7735: bit: "0"
15614661-15614662 st7735: bit: "0"
15614664-15614665 st7735: bit: "0"
15614667-15614668 st7735: bit: "0"
15614670-15614671 st7735: bit: "0"
15614673-15614674 st7735: bit: "0"
15614676-15614677 st7735: bit: "0"
15614655-15614677 st7735: data: "00"
15614931-15614932 st7735: bit: "0"
15614934-15614935 st7735: bit: "0"
15614937-15614938 st7735: bit: "0"
15614940-15614941 st7735: bit: "0"
15614943-15614944 st7735: bit: "0"
15614946-15614947 st7735: bit: "0"
15614949-15614950 st7735: bit: "0"
15614952-15614953 st7735: bit: "0"
15614931-15614953 st7735: data: "00"
15615207-15615208 st7735: bit: "0"
15615210-15615211 st7735: bit: "0"
15615213-15615214 st7735: bit: "0"
15615216-15615217 st7735: bit: "0"
15615219-15615220 st7735: bit: "0"
15615222-15615223 st7735: bit: "0"
15615225-15615226 st7735: bit: "0"
15615228-15615229 st7735: bit: "0"
15615207-15615229 st7735: data: "00"
15615483-15615484 st7735: bit: "0"
15615486-15615487 st7735: bit: "1"
15615489-15615490 st7735: bit: "1"
15615492-15615493 st7735: bit: "1"
15615495-15615496 st7735: bit: "1"
15615498-15615499 st7735: bit: "1"
15615501-15615502 st7735: bit: "1"
15615504-15615505 st7735: bit: "1"
15615483-15615505 st7735: data: "7F"
15615771-15615772 st7735: bit: "0"
15615774-15615775 st7735: bit: "0"
15615777-15615779 st7735: bit: "1"
15615780-15615781 st7735: bit: "0"
15615783-15615785 st7735: bit: "1"
15615786-15615787 st7735: bit: "0"
15615789-15615790 st7735: bit: "1"
15615792-15615793 st7735: bit: "1"
15615771-15615793 st7735: command: "2B"
15614364-15615505 st7735: description: "CASET: Column address set"
15616062-15616064 st7735: bit: "0"
15616065-15616067 st7735: bit: "0"
15616068-15616070 st7735: bit: "0"
15616071-15616073 st7735: bit: "0"
15616074-15616076 st7735: bit: "0"
15616077-15616079 st7735: bit: "0"
15616080-15616082 st7735: bit: "0"
15616083-15616085 st7735: bit: "0"
15616062-15616085 st7735: data: "00"
15616338-15616340 st7735: bit: "0"
15616341-15616343 st7735: bit: "0"
15616344-15616346 st7735: bit: "0"
15616347-15616349 st7735: bit: "0"
15616350-15616352 st7735: bit: "0"
15616353-15616355 st7735: bit: "0"
15616356-15616358 st7735: bit: "0"
15616359-15616361 st7735: bit: "0"
15616338-15616361 st7735: data: "00"
15616614-15616616 st7735: bit: "0"
15616617-15616619 st7735: bit: "0"
15616620-15616622 st7735: bit: "0"
15616623-15616625 st7735: bit: "0"
15616626-15616628 st7735: bit: "0"
15616629-15616631 st7735: bit: "0"
15616632-15616634 st7735: bit: "0"
15616635-15616637 st7735: bit: "0"
15616614-15616637 st7735: data: "00"
15616890-15616892 st7735: bit: "0"
15616893-15616895 st7735: bit: "1"
15616896-15616898 st7735: bit: "1"
15616899-15616901 st7735: bit: "1"
15616902-15616904 st7735: bit: "1"
15616905-15616907 st7735: bit: "1"
15616908-15616910 st7735: bit: "1"
15616911-15616913 st7735: bit: "1"
15616890-15616913 st7735: data: "7F"
15617268-15617270 st7735: bit: "1"
15617271-15617273 st7735: bit: "1"
15617274-15617276 st7735: bit: "1"
15617277-15617279 st7735: bit: "0"
15617280-15617282 st7735: bit: "0"
15617283-15617285 st7735: bit: "0"
15617286-15617288 st7735: bit: "0"
15617289-15617291 st7735: bit: "0"
15617268-15617291 st7735: command: "E0"
15615771-15616913 st7735: description: "RASET: Row address set"
15617559-15617561 st7735: bit: "0"
15617562-15617564 st7735: bit: "0"
15617565-15617567 st7735: bit: "0"
15617568-15617570 st7735: bit: "0"
15617571-15617573 st7735: bit: "0"
15617574-15617576 st7735: bit: "0"
15617577-15617579 st7735: bit: "1"
15617580-15617582 st7735: bit: "0"
15617559-15617582 st7735: data: "02"
15617835-15617837 st7735: bit: "0"
15617838-15617840 st7735: bit: "0"
15617841-15617843 st7735: bit: "0"
15617844-15617846 st7735: bit: "1"
15617847-15617849 st7735: bit: "1"
15617850-15617852 st7735: bit: "1"
15617853-15617855 st7735: bit: "0"
15617856-15617858 st7735: bit: "0"
15617835-15617858 st7735: data: "1C"
15618111-15618113 st7735: bit: "0"
15618114-15618116 st7735: bit: "0"
15618117-15618119 st7735: bit: "0"
15618120-15618122 st7735: bit: "0"
15618123-15618125 st7735: bit: "0"
15618126-15618128 st7735: bit: "1"
15618129-15618131 st7735: bit: "1"
15618132-15618134 st7735: bit: "1"
15618111-15618134 st7735: data: "07"
15618387-15618389 st7735: bit: "0"
15618390-15618392 st7735: bit: "0"
15618393-15618395 st7735: bit: "0"
15618396-15618398 st7735: bit: "1"
15618399-15618401 st7735: bit: "0"
15618402-15618404 st7735: bit: "0"
15618405-15618407 st7735: bit: "1"
15618408-15618410 st7735: bit: "0"
15618387-15618410 st7735: data: "12"
15618663-15618665 st7735: bit: "0"
15618666-15618668 st7735: bit: "0"
15618669-15618671 st7735: bit: "1"
15618672-15618674 st7735: bit: "1"
15618675-15618677 st7735: bit: "0"
15618678-15618680 st7735: bit: "1"
15618681-15618683 st7735: bit: "1"
15618684-15618686 st7735: bit: "1"
15618663-15618686 st7735: data: "37"
15618939-15618941 st7735: bit: "0"
15618942-15618944 st7735: bit: "0"
15618945-15618947 st7735: bit: "1"
15618948-15618950 st7735: bit: "1"
15618951-15618953 st7735: bit: "0"
15618954-15618956 st7735: bit: "0"
15618957-15618959 st7735: bit: "1"
15618960-15618962 st7735: bit: "0"
15618939-15618962 st7735: data: "32"
15619215-15619217 st7735: bit: "0"
15619218-15619220 st7735: bit: "0"
15619221-15619223 st7735: bit: "1"
15619224-15619226 st7735: bit: "0"
15619227-15619229 st7735: bit: "1"
15619230-15619232 st7735: bit: "0"
15619233-15619235 st7735: bit: "0"
15619236-15619238 st7735: bit: "1"
15619215-15619238 st7735: data: "29"
15619491-15619493 st7735: bit: "0"
15619494-15619496 st7735: bit: "0"
15619497-15619499 st7735: bit: "1"
15619500-15619502 st7735: bit: "0"
15619503-15619505 st7735: bit: "1"
15619506-15619508 st7735: bit: "1"
15619509-15619511 st7735: bit: "0"
15619512-15619514 st7735: bit: "1"
15619491-15619514 st7735: data: "2D"
15619767-15619769 st7735: bit: "0"
15619770-15619772 st7735: bit: "0"
15619773-15619775 st7735: bit: "1"
15619776-15619778 st7735: bit: "0"
15619779-15619781 st7735: bit: "1"
15619782-15619784 st7735: bit: "0"
15619785-15619787 st7735: bit: "0"
15619788-15619790 st7735: bit: "1"
15619767-15619790 st7735: data: "29"
15620043-15620045 st7735: bit: "0"
15620046-15620048 st7735: bit: "0"
15620049-15620051 st7735: bit: "1"
15620052-15620054 st7735: bit: "0"
15620055-15620057 st7735: bit: "0"
15620058-15620060 st7735: bit: "1"
15620061-15620063 st7735: bit: "0"
15620064-15620066 st7735: bit: "1"
15620043-15620066 st7735: data: "25"
15620319-15620321 st7735: bit: "0"
15620322-15620324 st7735: bit: "0"
15620325-15620327 st7735: bit: "1"
15620328-15620330 st7735: bit: "0"
15620331-15620333 st7735: bit: "1"
15620334-15620336 st7735: bit: "0"
15620337-15620339 st7735: bit: "1"
15620340-15620342 st7735: bit: "1"
15620319-15620342 st7735: data: "2B"
15620595-15620597 st7735: bit: "0"
15620599-15620600 st7735: bit: "0"
15620602-15620603 st7735: bit: "1"
15620605-15620606 st7735: bit: "1"
15620608-15620609 st7735: bit: "1"
15620611-15620612 st7735: bit: "0"
15620614-15620615 st7735: bit: "0"
15620617-15620618 st7735: bit: "1"
15620595-15620618 st7735: data: "39"
15620872-15620873 st7735: bit: "0"
15620875-15620876 st7735: bit: "0"
15620878-15620879 st7735: bit: "0"
15620881-15620882 st7735: bit: "0"
15620884-15620885 st7735: bit: "0"
15620887-15620888 st7735: bit: "0"
15620890-15620891 st7735: bit: "0"
15620893-15620894 st7735: bit: "0"
15620872-15620894 st7735: data: "00"
15621148-15621149 st7735: bit: "0"
15621151-15621152 st7735: bit: "0"
15621154-15621155 st7735: bit: "0"
15621157-15621158 st7735: bit: "0"
15621160-15621161 st7735: bit: "0"
15621163-15621164 st7735: bit: "0"
15621166-15621167 st7735: bit: "0"
15621169-15621170 st7735: bit: "1"
15621148-15621170 st7735: data: "01"
15621424-15621425 st7735: bit: "0"
15621427-15621428 st7735: bit: "0"
15621430-15621431 st7735: bit: "0"
15621433-15621434 st7735: bit: "0"
15621436-15621437 st7735: bit: "0"
15621439-15621440 st7735: bit: "0"
15621442-15621443 st7735: bit: "1"
15621445-15621446 st7735: bit: "1"
15621424-15621446 st7735: data: "03"
15621700-15621701 st7735: bit: "0"
15621703-15621704 st7735: bit: "0"
15621706-15621707 st7735: bit: "0"
15621709-15621710 st7735: bit: "1"
15621712-15621713 st7735: bit: "0"
15621715-15621716 st7735: bit: "0"
15621718-15621719 st7735: bit: "0"
15621721-15621722 st7735: bit: "0"
15621700-15621722 st7735: data: "10"
15621988-15621989 st7735: bit: "1"
15621991-15621992 st7735: bit: "1"
15621994-15621995 st7735: bit: "1"
15621997-15621998 st7735: bit: "0"
15622000-15622001 st7735: bit: "0"
15622003-15622004 st7735: bit: "0"
15622006-15622007 st7735: bit: "0"
15622009-15622010 st7735: bit: "1"
15621988-15622010 st7735: command: "E1"
15617268-15621722 st7735: description: "GMCTRP1: Gamma '+'polarity correction characteristics setting"
15622279-15622280 st7735: bit: "0"
15622282-15622283 st7735: bit: "0"
15622285-15622286 st7735: bit: "0"
15622288-15622289 st7735: bit: "0"
15622291-15622292 st7735: bit: "0"
15622294-15622295 st7735: bit: "0"
15622297-15622298 st7735: bit: "1"
15622300-15622301 st7735: bit: "1"
15622279-15622301 st7735: data: "03"
15622555-15622556 st7735: bit: "0"
15622558-15622559 st7735: bit: "0"
15622561-15622562 st7735: bit: "0"
15622564-15622565 st7735: bit: "1"
15622567-15622568 st7735: bit: "1"
15622570-15622571 st7735: bit: "1"
15622573-15622574 st7735: bit: "0"
15622576-15622577 st7735: bit: "1"
15622555-15622577 st7735: data: "1D"
15622831-15622832 st7735: bit: "0"
15622834-15622835 st7735: bit: "0"
15622837-15622838 st7735: bit: "0"
15622840-15622841 st7735: bit: "0"
15622843-15622844 st7735: bit: "0"
15622846-15622847 st7735: bit: "1"
15622849-15622850 st7735: bit: "1"
15622852-15622853 st7735: bit: "1"
15622831-15622853 st7735: data: "07"
15623107-15623108 st7735: bit: "0"
15623110-15623111 st7735: bit: "0"
15623113-15623114 st7735: bit: "0"
15623116-15623117 st7735: bit: "0"
15623119-15623120 st7735: bit: "0"
15623122-15623123 st7735: bit: "1"
15623125-15623126 st7735: bit: "1"
15623128-15623129 st7735: bit: "0"
15623107-15623129 st7735: data: "06"
15623383-15623384 st7735: bit: "0"
15623386-15623387 st7735: bit: "0"
15623389-15623390 st7735: bit: "1"
15623392-15623393 st7735: bit: "0"
15623395-15623396 st7735: bit: "1"
15623398-15623399 st7735: bit: "1"
15623401-15623402 st7735: bit: "1"
15623404-15623405 st7735: bit: "0"
15623383-15623405 st7735: data: "2E"
15623659-15623660 st7735: bit: "0"
15623662-15623663 st7735: bit: "0"
15623665-15623666 st7735: bit: "1"
15623668-15623669 st7735: bit: "0"
15623671-15623672 st7735: bit: "1"
15623674-15623675 st7735: bit: "1"
15623677-15623678 st7735: bit: "0"
15623680-15623681 st7735: bit: "0"
15623659-15623681 st7735: data: "2C"
15623935-15623936 st7735: bit: "0"
15623938-15623940 st7735: bit: "0"
15623941-15623943 st7735: bit: "1"
15623944-15623946 st7735: bit: "0"
15623947-15623949 st7735: bit: "1"
15623950-15623951 st7735: bit: "0"
15623953-15623955 st7735: bit: "0"
15623956-15623957 st7735: bit: "1"
15623935-15623957 st7735: data: "29"
15624211-15624213 st7735: bit: "0"
15624214-15624216 st7735: bit: "0"
15624217-15624219 st7735: bit: "1"
15624220-15624222 st7735: bit: "0"
15624223-15624225 st7735: bit: "1"
15624226-15624228 st7735: bit: "1"
15624229-15624231 st7735: bit: "0"
15624232-15624234 st7735: bit: "1"
15624211-15624234 st7735: data: "2D"
15624487-15624489 st7735: bit: "0"
15624490-15624492 st7735: bit: "0"
15624493-15624495 st7735: bit: "1"
15624496-15624498 st7735: bit: "0"
15624499-15624501 st7735: bit: "1"
15624502-15624504 st7735: bit: "1"
15624505-15624507 st7735: bit: "1"
15624508-15624510 st7735: bit: "0"
15624487-15624510 st7735: data: "2E"
15624763-15624765 st7735: bit: "0"
15624766-15624768 st7735: bit: "0"
15624769-15624771 st7735: bit: "1"
15624772-15624774 st7735: bit: "0"
15624775-15624777 st7735: bit: "1"
15624778-15624780 st7735: bit: "1"
15624781-15624783 st7735: bit: "1"
15624784-15624786 st7735: bit: "0"
15624763-15624786 st7735: data: "2E"
15625039-15625041 st7735: bit: "0"
15625042-15625044 st7735: bit: "0"
15625045-15625047 st7735: bit: "1"
15625048-15625050 st7735: bit: "1"
15625051-15625053 st7735: bit: "0"
15625054-15625056 st7735: bit: "1"
15625057-15625059 st7735: bit: "1"
15625060-15625062 st7735: bit: "1"
15625039-15625062 st7735: data: "37"
15625315-15625317 st7735: bit: "0"
15625318-15625320 st7735: bit: "0"
15625321-15625323 st7735: bit: "1"
15625324-15625326 st7735: bit: "1"
15625327-15625329 st7735: bit: "1"
15625330-15625332 st7735: bit: "1"
15625333-15625335 st7735: bit: "1"
15625336-15625338 st7735: bit: "1"
15625315-15625338 st7735: data: "3F"
15625591-15625593 st7735: bit: "0"
15625594-15625596 st7735: bit: "0"
15625597-15625599 st7735: bit: "0"
15625600-15625602 st7735: bit: "0"
15625603-15625605 st7735: bit: "0"
15625606-15625608 st7735: bit: "0"
15625609-15625611 st7735: bit: "0"
15625612-15625614 st7735: bit: "0"
15625591-15625614 st7735: data: "00"
15625867-15625869 st7735: bit: "0"
15625870-15625872 st7735: bit: "0"
15625873-15625875 st7735: bit: "0"
15625876-15625878 st7735: bit: "0"
15625879-15625881 st7735: bit: "0"
15625882-15625884 st7735: bit: "0"
15625885-15625887 st7735: bit: "0"
15625888-15625890 st7735: bit: "0"
15625867-15625890 st7735: data: "00"
15626143-15626145 st7735: bit: "0"
15626146-15626148 st7735: bit: "0"
15626149-15626151 st7735: bit: "0"
15626152-15626154 st7735: bit: "0"
15626155-15626157 st7735: bit: "0"
15626158-15626160 st7735: bit: "0"
15626161-15626163 st7735: bit: "1"
15626164-15626166 st7735: bit: "0"
15626143-15626166 st7735: data: "02"
15626419-15626421 st7735: bit: "0"
15626422-15626424 st7735: bit: "0"
15626425-15626427 st7735: bit: "0"
15626428-15626430 st7735: bit: "1"
15626431-15626433 st7735: bit: "0"
15626434-15626436 st7735: bit: "0"
15626437-15626439 st7735: bit: "0"
15626440-15626442 st7735: bit: "0"
15626419-15626442 st7735: data: "10"
15626707-15626709 st7735: bit: "0"
15626710-15626712 st7735: bit: "0"
15626713-15626715 st7735: bit: "0"
15626716-15626718 st7735: bit: "1"
15626719-15626721 st7735: bit: "0"
15626722-15626724 st7735: bit: "0"
15626725-15626727 st7735: bit: "1"
15626728-15626730 st7735: bit: "1"
15626707-15626730 st7735: command: "13"
15621988-15626442 st7735: description: "GMCTRN1: Gamma '-'polarity correction characteristics setting"
15867258-15867259 st7735: bit: "0"
15867261-15867262 st7735: bit: "0"
15867264-15867265 st7735: bit: "1"
15867267-15867268 st7735: bit: "0"
15867270-15867271 st7735: bit: "1"
15867273-15867274 st7735: bit: "0"
15867276-15867277 st7735: bit: "0"
15867279-15867280 st7735: bit: "1"
15867258-15867280 st7735: command: "29"
15626707-15626730 st7735: description: "NORON: Partial off (normal)"
18268095-18268096 st7735: bit: "0"
18268098-18268099 st7735: bit: "0"
18268101-18268102 st7735: bit: "1"
18268104-18268105 st7735: bit: "1"
18268107-18268108 st7735: bit: "0"
18268110-18268111 st7735: bit: "1"
18268113-18268114 st7735: bit: "1"
18268116-18268117 st7735: bit: "0"
18268095-18268117 st7735: command: "36"
15867258-15867280 st7735: description: "DISPON: Display on"
18268383-18268384 st7735: bit: "1"
18268386-18268387 st7735: bit: "1"
18268389-18268390 st7735: bit: "0"
18268392-18268393 st7735: bit: "0"
18268395-18268396 st7735: bit: "1"
18268398-18268399 st7735: bit: "0"
18268401-18268402 st7735: bit: "0"
18268404-18268405 st7735: bit: "0"
18268383-18268405 st7735: data: "C8"
18271305-18271307 st7735: bit: "0"
18271308-18271310 st7735: bit: "0"
18271311-18271313 st7735: bit: "1"
18271314-18271316 st7735: bit: "0"
18271317-18271319 st7735: bit: "1"
18271320-18271322 st7735: bit: "0"
18271323-18271325 st7735: bit: "1"
18271326-18271328 st7735: bit: "0"
18271305-18271328 st7735: command: "2A"
18268095-18268405 st7735: description: "MADCTL: Memory data address control"
18271565-18271566 st7735: bit: "0"
18271568-18271569 st7735: bit: "0"
18271571-18271572 st7735: bit: "0"
18271574-18271575 st7735: bit: "0"
18271577-18271578 st7735: bit: "0"
18271580-18271581 st7735: bit: "0"
18271583-18271584 st7735: bit: "0"
18271586-18271587 st7735: bit: "0"
18271565-18271587 st7735: data: "00"
18271830-18271832 st7735: bit: "0"
18271833-18271835 st7735: bit: "0"
18271836-18271838 st7735: bit: "0"
18271839-18271841 st7735: bit: "0"
18271842-18271844 st7735: bit: "0"
18271845-18271847 st7735: bit: "0"
18271848-18271850 st7735: bit: "1"
18271851-18271853 st7735: bit: "0"
18271830-18271853 st7735: data: "02"
18272090-18272091 st7735: bit: "0"
18272093-18272094 st7735: bit: "0"
18272096-18272097 st7735: bit: "0"
18272099-18272100 st7735: bit: "0"
18272102-18272103 st7735: bit: "0"
18272105-18272106 st7735: bit: "0"
18272108-18272109 st7735: bit: "0"
18272111-18272112 st7735: bit: "0"
18272090-18272112 st7735: data: "00"
18272358-18272360 st7735: bit: "1"
18272361-18272363 st7735: bit: "0"
18272364-18272366 st7735: bit: "0"
18272367-18272369 st7735: bit: "0"
18272370-18272372 st7735: bit: "0"
18272373-18272375 st7735: bit: "0"
18272376-18272378 st7735: bit: "0"
18272379-18272381 st7735: bit: "1"
18272358-18272381 st7735: data: "81"
18272609-18272610 st7735: bit: "0"
18272612-18272613 st7735: bit: "0"
18272615-18272616 st7735: bit: "1"
18272618-18272619 st7735: bit: "0"
18272621-18272622 st7735: bit: "1"
18272624-18272625 st7735: bit: "0"
18272627-18272628 st7735: bit: "1"
18272630-18272631 st7735: bit: "1"
18272609-18272631 st7735: command: "2B"
18271305-18272381 st7735: description: "CASET: Column address set"
18272868-18272870 st7735: bit: "0"
18272871-18272873 st7735: bit: "0"
18272874-18272876 st7735: bit: "0"
18272877-18272879 st7735: bit: "0"
18272880-18272882 st7735: bit: "0"
18272883-18272885 st7735: bit: "0"
18272886-18272888 st7735: bit: "0"
18272889-18272891 st7735: bit: "0"
18272868-18272891 st7735: data: "00"
18273137-18273138 st7735: bit: "0"
18273140-18273141 st7735: bit: "0"
18273143-18273144 st7735: bit: "0"
18273146-18273147 st7735: bit: "0"
18273149-18273150 st7735: bit: "0"
18273152-18273153 st7735: bit: "0"
18273155-18273156 st7735: bit: "1"
18273158-18273159 st7735: bit: "1"
18273137-18273159 st7735: data: "03"
18273396-18273398 st7735: bit: "0"
18273399-18273401 st7735: bit: "0"
18273402-18273404 st7735: bit: "0"
18273405-18273407 st7735: bit: "0"
18273408-18273410 st7735: bit: "0"
18273411-18273413 st7735: bit: "0"
18273414-18273416 st7735: bit: "0"
18273417-18273419 st7735: bit: "0"
18273396-18273419 st7735: data: "00"
18273662-18273663 st7735: bit: "1"
18273665-18273666 st7735: bit: "0"
18273668-18273669 st7735: bit: "0"
18273671-18273672 st7735: bit: "0"
18273674-18273675 st7735: bit: "0"
18273677-18273678 st7735: bit: "0"
18273680-18273681 st7735: bit: "1"
18273683-18273684 st7735: bit: "0"
18273662-18273684 st7735: data: "82"
18273935-18273936 st7735: bit: "0"
18273938-18273939 st7735: bit: "0"
18273941-18273942 st7735: bit: "1"
18273944-18273945 st7735: bit: "0"
18273947-18273948 st7735: bit: "1"
18273950-18273951 st7735: bit: "1"
18273953-18273954 st7735: bit: "0"
18273956-18273957 st7735: bit: "0"
18273935-18273957 st7735: command: "2C"
18272609-18273684 st7735: description: "RASET: Row address set"
18274164-18274166 st7735: bit: "0"
18274167-18274169 st7735: bit: "0"
18274170-18274172 st7735: bit: "0"
18274173-18274175 st7735: bit: "0"
18274176-18274178 st7735: bit: "0"
18274179-18274181 st7735: bit: "0"
18274182-18274184 st7735: bit: "0"
18274185-18274187 st7735: bit: "0"
18274164-18274187 st7735: data: "00"
18274220-18274221 st7735: bit: "0"
18274223-18274224 st7735: bit: "0"
18274226-18274227 st7735: bit: "0"
18274229-18274230 st7735: bit: "0"
18274232-18274233 st7735: bit: "0"
18274235-18274236 st7735: bit: "0"
18274238-18274239 st7735: bit: "0"
18274241-18274242 st7735: bit: "0"
18274220-18274242 st7735: data: "00"
18274286-18274287 st7735: bit: "0"
18274289-18274290 st7735: bit: "0"
18274292-18274293 st7735: bit: "0"
18274295-18274296 st7735: bit: "0"
18274298-18274299 st7735: bit: "0"
18274301-18274302 st7735: bit: "0"
18274304-18274305 st7735: bit: "0"
18274307-18274308 st7735: bit: "0"
18274286-18274308 st7735: data: "00"
18274341-18274343 st7735: bit: "0"
18274344-18274346 st7735: bit: "0"
18274347-18274349 st7735: bit: "0"
18274350-18274352 st7735: bit: "0"
18274353-18274355 st7735: bit: "0"
18274356-18274358 st7735: bit: "0"
18274359-18274361 st7735: bit: "0"
18274362-18274364 st7735: bit: "0"
18274341-18274364 st7735: data: "00"
18274407-18274409 st7735: bit: "0"
18274410-18274412 st7735: bit: "0"
18274413-18274415 st7735: bit: "0"
18274416-18274418 st7735: bit: "0"
18274419-18274421 st7735: bit: "0"
18274422-18274424 st7735: bit: "0"
18274425-18274427 st7735: bit: "0"
18274428-18274430 st7735: bit: "0"
18274407-18274430 st7735: data: "00"
18274463-18274464 st7735: bit: "0"
18274466-18274467 st7735: bit: "0"
18274469-18274470 st7735: bit: "0"
18274472-18274473 st7735: bit: "0"
18274475-18274476 st7735: bit: "0"
18274478-18274479 st7735: bit: "0"
18274481-18274482 st7735: bit: "0"
18274484-18274485 st7735: bit: "0"
18274463-18274485 st7735: data: "00"
18274529-18274530 st7735: bit: "0"
18274532-18274533 st7735: bit: "0"
18274535-18274536 st7735: bit: "0"
18274538-18274539 st7735: bit: "0"
18274541-18274542 st7735: bit: "0"
18274544-18274545 st7735: bit: "0"
18274547-18274548 st7735: bit: "0"
18274550-18274551 st7735: bit: "0"
18274529-18274551 st7735: data: "00"
18274584-18274586 st7735: bit: "0"
18274587-18274589 st7735: bit: "0"
18274590-18274592 st7735: bit: "0"
18274593-18274595 st7735: bit: "0"
18274596-18274598 st7735: bit: "0"
18274599-18274601 st7735: bit: "0"
18274602-18274604 st7735: bit: "0"
18274605-18274607 st7735: bit: "0"
18274584-18274607 st7735: data: "00"
18274650-18274652 st7735: bit: "0"
18274653-18274655 st7735: bit: "0"
18274656-18274658 st7735: bit: "0"
18274659-18274661 st7735: bit: "0"
18274662-18274664 st7735: bit: "0"
18274665-18274667 st7735: bit: "0"
18274668-18274670 st7735: bit: "0"
18274671-18274673 st7735: bit: "0"
18274650-18274673 st7735: data: "00"
18274706-18274707 st7735: bit: "0"
18274709-18274710 st7735: bit: "0"
18274712-18274713 st7735: bit: "0"
18274715-18274716 st7735: bit: "0"
18274718-18274719 st7735: bit: "0"
18274721-18274722 st7735: bit: "0"
18274724-18274725 st7735: bit: "0"
18274727-18274728 st7735: bit: "0"
18274706-18274728 st7735: data: "00"
18274772-18274773 st7735: bit: "0"
18274775-18274776 st7735: bit: "0"
18274778-18274779 st7735: bit: "0"
18274781-18274782 st7735: bit: "0"
18274784-18274785 st7735: bit: "0"
18274787-18274788 st7735: bit: "0"
18274790-18274791 st7735: bit: "0"
18274793-18274795 st7735: bit: "0"
18274772-18274795 st7735: data: "00"
18274827-18274829 st7735: bit: "0"
18274830-18274832 st7735: bit: "0"
18274833-18274835 st7735: bit: "0"
18274836-18274838 st7735: bit: "0"
18274839-18274841 st7735: bit: "0"
18274842-18274844 st7735: bit: "0"
18274845-18274847 st7735: bit: "0"
18274848-18274850 st7735: bit: "0"
18274827-18274850 st7735: data: "00"
18274893-18274895 st7735: bit: "0"
18274896-18274898 st7735: bit: "0"
18274899-18274901 st7735: bit: "0"
18274902-18274904 st7735: bit: "0"
18274905-18274907 st7735: bit: "0"
18274908-18274910 st7735: bit: "0"
18274911-18274913 st7735: bit: "0"
18274914-18274916 st7735: bit: "0"
18274893-18274916 st7735: data: "00"
18274949-18274951 st7735: bit: "0"
18274952-18274954 st7735: bit: "0"
18274955-18274957 st7735: bit: "0"
18274958-18274960 st7735: bit: "0"
18274961-18274963 st7735: bit: "0"
18274964-18274966 st7735: bit: "0"
18274967-18274969 st7735: bit: "0"
18274970-18274972 st7735: bit: "0"
18274949-18274972 st7735: data: "00"
18275015-18275017 st7735: bit: "0"
18275018-18275020 st7735: bit: "0"
18275021-18275023 st7735: bit: "0"
18275024-18275026 st7735: bit: "0"
18275027-18275029 st7735: bit: "0"
18275030-18275032 st7735: bit: "0"
18275033-18275035 st7735: bit: "0"
18275036-18275038 st7735: bit: "0"
18275015-18275038 st7735: data: "00"
18275070-18275072 st7735: bit: "0"
18275073-18275075 st7735: bit: "0"
18275076-18275078 st7735: bit: "0"
18275079-18275081 st7735: bit: "0"
18275082-18275084 st7735: bit: "0"
18275085-18275087 st7735: bit: "0"
18275088-18275090 st7735: bit: "0"
18275091-18275093 st7735: bit: "0"
18275070-18275093 st7735: data: "00"
18275136-18275138 st7735: bit: "0"
18275139-18275141 st7735: bit: "0"
18275142-18275144 st7735: bit: "0"
18275145-18275147 st7735: bit: "0"
18275148-18275150 st7735: bit: "0"
18275151-18275153 st7735: bit: "0"
18275154-18275156 st7735: bit: "0"
18275157-18275159 st7735: bit: "0"
18275136-18275159 st7735: data: "00"
18275192-18275194 st7735: bit: "0"
18275195-18275197 st7735: bit: "0"
18275198-18275200 st7735: bit: "0"
18275201-18275203 st7735: bit: "0"
18275204-18275206 st7735: bit: "0"
18275207-18275209 st7735: bit: "0"
18275210-18275212 st7735: bit: "0"
18275213-18275215 st7735: bit: "0"
18275192-18275215 st7735: data: "00"
18275258-18275260 st7735: bit: "0"
18275261-18275263 st7735: bit: "0"
18275264-18275266 st7735: bit: "0"
18275267-18275269 st7735: bit: "0"
18275270-18275272 st7735: bit: "0"
18275273-18275275 st7735: bit: "0"
18275276-18275278 st7735: bit: "0"
18275279-18275281 st7735: bit: "0"
18275258-18275281 st7735: data: "00"
18275313-18275315 st7735: bit: "0"
18275316-18275318 st7735: bit: "0"
18275319-18275321 st7735: bit: "0"
18275322-18275324 st7735: bit: "0"
18275325-18275327 st7735: bit: "0"
18275328-18275330 st7735: bit: "0"
18275331-18275333 st7735: bit: "0"
18275334-18275336 st7735: bit: "0"
18275313-18275336 st7735: data: "00"
18275379-18275381 st7735: bit: "0"
18275382-18275384 st7735: bit: "0"
18275385-18275387 st7735: bit: "0"
18275388-18275390 st7735: bit: "0"
18275391-18275393 st7735: bit: "0"
18275394-18275396 st7735: bit: "0"
18275397-18275399 st7735: bit: "0"
18275400-18275402 st7735: bit: "0"
18275379-18275402 st7735: data: "00"
18275435-18275437 st7735: bit: "0"
18275438-18275440 st7735: bit: "0"
18275441-18275443 st7735: bit: "0"
18275444-18275446 st7735: bit: "0"
18275447-18275449 st7735: bit: "0"
18275450-18275452 st7735: bit: "0"
18275453-18275455 st7735: bit: "0"
18275456-18275458 st7735: bit: "0"
18275435-18275458 st7735: data: "00"
18275501-18275503 st7735: bit: "0"
18275504-18275506 st7735: bit: "0"
18275507-18275509 st7735: bit: "0"
18275510-18275512 st7735: bit: "0"
18275513-18275515 st7735: bit: "0"
18275516-18275518 st7735: bit: "0"
18275519-18275521 st7735: bit: "0"
18275522-18275524 st7735: bit: "0"
18275501-18275524 st7735: data: "00"
18275557-18275558 st7735: bit: "0"
18275560-18275561 st7735: bit: "0"
18275563-18275564 st7735: bit: "0"
18275566-18275567 st7735: bit: "0"
18275569-18275570 st7735: bit: "0"
18275572-18275573 st7735: bit: "0"
18275575-18275576 st7735: bit: "0"
18275578-18275579 st7735: bit: "0"
18275557-18275579 st7735: data: "00"
18275623-18275624 st7735: bit: "0"
18275626-18275627 st7735: bit: "0"
18275629-18275630 st7735: bit: "0"
18275632-18275633 st7735: bit: "0"
18275635-18275636 st7735: bit: "0"
18275638-18275639 st7735: bit: "0"
18275641-18275642 st7735: bit: "0"
18275644-18275645 st7735: bit: "0"
18275623-18275645 st7735: data: "00"
18275678-18275680 st7735: bit: "0"
18275681-18275683 st7735: bit: "0"
18275684-18275686 st7735: bit: "0"
18275687-18275689 st7735: bit: "0"
18275690-18275692 st7735: bit: "0"
18275693-18275695 st7735: bit: "0"
18275696-18275698 st7735: bit: "0"
18275699-18275701 st7735: bit: "0"
18275678-18275701 st7735: data: "00"
18275744-18275746 st7735: bit: "0"
18275747-18275749 st7735: bit: "0"
18275750-18275752 st7735: bit: "0"
18275753-18275755 st7735: bit: "0"
18275756-18275758 st7735: bit: "0"
18275759-18275761 st7735: bit: "0"
18275762-18275764 st7735: bit: "0"
18275765-18275767 st7735: bit: "0"
18275744-18275767 st7735: data: "00"
18275800-18275801 st7735: bit: "0"
18275803-18275804 st7735: bit: "0"
18275806-18275807 st7735: bit: "0"
18275809-18275810 st7735: bit: "0"
18275812-18275813 st7735: bit: "0"
18275815-18275816 st7735: bit: "0"
18275818-18275819 st7735: bit: "0"
18275821-18275822 st7735: bit: "0"
18275800-18275822 st7735: data: "00"
18275866-18275867 st7735: bit: "0"
18275869-18275870 st7735: bit: "0"
18275872-18275873 st7735: bit: "0"
18275875-18275876 st7735: bit: "0"
18275878-18275879 st7735: bit: "0"
18275881-18275882 st7735: bit: "0"
18275884-18275885 st7735: bit: "0"
18275887-18275888 st7735: bit: "0"
18275866-18275888 st7735: data: "00"
18275921-18275923 st7735: bit: "0"
18275924-18275926 st7735: bit: "0"
18275927-18275929 st7735: bit: "0"
18275930-18275932 st7735: bit: "0"
18275933-18275935 st7735: bit: "0"
18275936-18275938 st7735: bit: "0"
18275939-18275941 st7735: bit: "0"
18275942-18275944 st7735: bit: "0"
18275921-18275944 st7735: data: "00"
18275987-18275989 st7735: bit: "0"
18275990-18275992 st7735: bit: "0"
18275993-18275995 st7735: bit: "0"
18275996-18275998 st7735: bit: "0"
18275999-18276001 st7735: bit: "0"
18276002-18276004 st7735: bit: "0"
18276005-18276007 st7735: bit: "0"
18276008-18276010 st7735: bit: "0"
18275987-18276010 st7735: data: "00"
18276043-18276044 st7735: bit: "0"
18276046-18276047 st7735: bit: "0"
18276049-18276050 st7735: bit: "0"
18276052-18276053 st7735: bit: "0"
18276055-18276056 st7735: bit: "0"
18276058-18276059 st7735: bit: "0"
18276061-18276062 st7735: bit: "0"
18276064-18276065 st7735: bit: "0"
18276043-18276065 st7735: data: "00"
18276109-18276110 st7735: bit: "0"
18276112-18276113 st7735: bit: "0"
18276115-18276116 st7735: bit: "0"
18276118-18276119 st7735: bit: "0"
18276121-18276122 st7735: bit: "0"
18276124-18276125 st7735: bit: "0"
18276127-18276128 st7735: bit: "0"
18276130-18276131 st7735: bit: "0"
18276109-18276131 st7735: data: "00"
18276164-18276166 st7735: bit: "0"
18276167-18276169 st7735: bit: "0"
18276170-18276172 st7735: bit: "0"
18276173-18276175 st7735: bit: "0"
18276176-18276178 st7735: bit: "0"
18276179-18276181 st7735: bit: "0"
18276182-18276184 st7735: bit: "0"
18276185-18276187 st7735: bit: "0"
18276164-18276187 st7735: data: "00"
18276230-18276232 st7735: bit: "0"
18276233-18276235 st7735: bit: "0"
18276236-18276238 st7735: bit: "0"
18276239-18276241 st7735: bit: "0"
18276242-18276244 st7735: bit: "0"
18276245-18276247 st7735: bit: "0"
18276248-18276250 st7735: bit: "0"
18276251-18276253 st7735: bit: "0"
18276230-18276253 st7735: data: "00"
18276286-18276287 st7735: bit: "0"
18276289-18276290 st7735: bit: "0"
18276292-18276293 st7735: bit: "0"
18276295-18276296 st7735: bit: "0"
18276298-18276299 st7735: bit: "0"
18276301-18276302 st7735: bit: "0"
18276304-18276305 st7735: bit: "0"
18276307-18276308 st7735: bit: "0"
18276286-18276308 st7735: data: "00"
18276352-18276353 st7735: bit: "0"
18276355-18276356 st7735: bit: "0"
18276358-18276359 st7735: bit: "0"
18276361-18276362 st7735: bit: "0"
18276364-18276365 st7735: bit: "0"
18276367-18276368 st7735: bit: "0"
18276370-18276371 st7735: bit: "0"
18276373-18276374 st7735: bit: "0"
18276352-18276374 st7735: data: "00"
18276407-18276409 st7735: bit: "0"
18276410-18276412 st7735: bit: "0"
18276413-18276415 st7735: bit: "0"
18276416-18276418 st7735: bit: "0"
18276419-18276421 st7735: bit: "0"
18276422-18276424 st7735: bit: "0"
18276425-18276427 st7735: bit: "0"
18276428-18276430 st7735: bit: "0"
18276407-18276430 st7735: data: "00"
18276473-18276475 st7735: bit: "0"
18276476-18276478 st7735: bit: "0"
18276479-18276481 st7735: bit: "0"
18276482-18276484 st7735: bit: "0"
18276485-18276487 st7735: bit: "0"
18276488-18276490 st7735: bit: "0"
18276491-18276493 st7735: bit: "0"
18276494-18276496 st7735: bit: "0"
18276473-18276496 st7735: data: "00"
18276529-18276530 st7735: bit: "0"
18276532-18276533 st7735: bit: "0"
18276535-18276536 st7735: bit: "0"
18276538-18276539 st7735: bit: "0"
18276541-18276542 st7735: bit: "0"
18276544-18276545 st7735: bit: "0"
18276547-18276548 st7735: bit: "0"
18276550-18276551 st7735: bit: "0"
18276529-18276551 st7735: data: "00"
18276595-18276596 st7735: bit: "0"
18276598-18276599 st7735: bit: "0"
18276601-18276602 st7735: bit: "0"
18276604-18276605 st7735: bit: "0"
18276607-18276608 st7735: bit: "0"
18276610-18276611 st7735: bit: "0"
18276613-18276614 st7735: bit: "0"
18276616-18276617 st7735: bit: "0"
18276595-18276617 st7735: data: "00"
18276650-18276652 st7735: bit: "0"
18276653-18276655 st7735: bit: "0"
18276656-18276658 st7735: bit: "0"
18276659-18276661 st7735: bit: "0"
18276662-18276664 st7735: bit: "0"
18276665-18276667 st7735: bit: "0"
18276668-18276670 st7735: bit: "0"
18276671-18276673 st7735: bit: "0"
18276650-18276673 st7735: data: "00"
18276716-18276718 st7735: bit: "0"
18276719-18276721 st7735: bit: "0"
18276722-18276724 st7735: bit: "0"
18276725-18276727 st7735: bit: "0"
18276728-18276730 st7735: bit: "0"
18276731-18276733 st7735: bit: "0"
18276734-18276736 st7735: bit: "0"
18276737-18276739 st7735: bit: "0"
18276716-18276739 st7735: data: "00"
18276772-18276773 st7735: bit: "0"
18276775-18276776 st7735: bit: "0"
18276778-18276779 st7735: bit: "0"
18276781-18276782 st7735: bit: "0"
18276784-18276785 st7735: bit: "0"
18276787-18276788 st7735: bit: "0"
18276790-18276791 st7735: bit: "0"
18276793-18276794 st7735: bit: "0"
18276772-18276794 st7735: data: "00"
18276838-18276839 st7735: bit: "0"
18276841-18276842 st7735: bit: "0"
18276844-18276845 st7735: bit: "0"
18276847-18276848 st7735: bit: "0"
18276850-18276851 st7735: bit: "0"
18276853-18276854 st7735: bit: "0"
18276856-18276857 st7735: bit: "0"
18276859-18276860 st7735: bit: "0"
18276838-18276860 st7735: data: "00"
18276893-18276895 st7735: bit: "0"
18276896-18276898 st7735: bit: "0"
18276899-18276901 st7735: bit: "0"
18276902-18276904 st7735: bit: "0"
18276905-18276907 st7735: bit: "0"
18276908-18276910 st7735: bit: "0"
18276911-18276913 st7735: bit: "0"
18276914-18276916 st7735: bit: "0"
18276893-18276916 st7735: data: "00"
18276959-18276961 st7735: bit: "0"
18276962-18276964 st7735: bit: "0"
18276965-18276967 st7735: bit: "0"
18276968-18276970 st7735: bit: "0"
18276971-18276973 st7735: bit: "0"
18276974-18276976 st7735: bit: "0"
18276977-18276979 st7735: bit: "0"
18276980-18276982 st7735: bit: "0"
18276959-18276982 st7735: data: "00"
18277015-18277016 st7735: bit: "0"
18277018-18277019 st7735: bit: "0"
18277021-18277022 st7735: bit: "0"
18277024-18277025 st7735: bit: "0"
18277027-18277028 st7735: bit: "0"
18277030-18277031 st7735: bit: "0"
18277033-18277034 st7735: bit: "0"
18277036-18277037 st7735: bit: "0"
18277015-18277037 st7735: data: "00"
18277081-18277082 st7735: bit: "0"
18277084-18277085 st7735: bit: "0"
18277087-18277088 st7735: bit: "0"
18277090-18277091 st7735: bit: "0"
18277093-18277094 st7735: bit: "0"
18277096-18277097 st7735: bit: "0"
18277099-18277100 st7735: bit: "0"
18277102-18277103 st7735: bit: "0"
18277081-18277103 st7735: data: "00"
18277136-18277138 st7735: bit: "0"
18277139-18277141 st7735: bit: "0"
18277142-18277144 st7735: bit: "0"
18277145-18277147 st7735: bit: "0"
18277148-18277150 st7735: bit: "0"
18277151-18277153 st7735: bit: "0"
18277154-18277156 st7735: bit: "0"
18277157-18277159 st7735: bit: "0"
18277136-18277159 st7735: data: "00"
18277202-18277204 st7735: bit: "0"
18277205-18277207 st7735: bit: "0"
18277208-18277210 st7735: bit: "0"
18277211-18277213 st7735: bit: "0"
18277214-18277216 st7735: bit: "0"
18277217-18277219 st7735: bit: "0"
18277220-18277222 st7735: bit: "0"
18277223-18277225 st7735: bit: "0"
18277202-18277225 st7735: data: "00"
18277258-18277259 st7735: bit: "0"
18277261-18277262 st7735: bit: "0"
18277264-18277265 st7735: bit: "0"
18277267-18277268 st7735: bit: "0"
18277270-18277271 st7735: bit: "0"
18277273-18277274 st7735: bit: "0"
18277276-18277277 st7735: bit: "0"
18277279-18277280 st7735: bit: "0"
18277258-18277280 st7735: data: "00"
18277324-18277325 st7735: bit: "0"
18277327-18277328 st7735: bit: "0"
18277330-18277331 st7735: bit: "0"
18277333-18277334 st7735: bit: "0"
18277336-18277337 st7735: bit: "0"
18277339-18277340 st7735: bit: "0"
18277342-18277343 st7735: bit: "0"
18277345-18277346 st7735: bit: "0"
18277324-18277346 st7735: data: "00"
18277379-18277381 st7735: bit: "0"
18277382-18277384 st7735: bit: "0"
18277385-18277387 st7735: bit: "0"
18277388-18277390 st7735: bit: "0"
18277391-18277393 st7735: bit: "0"
18277394-18277396 st7735: bit: "0"
18277397-18277399 st7735: bit: "0"
18277400-18277402 st7735: bit: "0"
18277379-18277402 st7735: data: "00"
18277445-18277447 st7735: bit: "0"
18277448-18277450 st7735: bit: "0"
18277451-18277453 st7735: bit: "0"
18277454-18277456 st7735: bit: "0"
18277457-18277459 st7735: bit: "0"
18277460-18277462 st7735: bit: "0"
18277463-18277465 st7735: bit: "0"
18277466-18277468 st7735: bit: "0"
18277445-18277468 st7735: data: "00"
18277501-18277502 st7735: bit: "0"
18277504-18277505 st7735: bit: "0"
18277507-18277508 st7735: bit: "0"
18277510-18277511 st7735: bit: "0"
18277513-18277514 st7735: bit: "0"
18277516-18277517 st7735: bit: "0"
18277519-18277520 st7735: bit: "0"
18277522-18277523 st7735: bit: "0"
18277501-18277523 st7735: data: "00"
18277567-18277568 st7735: bit: "0"
18277570-18277571 st7735: bit: "0"
18277573-18277574 st7735: bit: "0"
18277576-18277577 st7735: bit: "0"
18277579-18277580 st7735: bit: "0"
18277582-18277583 st7735: bit: "0"
18277585-18277586 st7735: bit: "0"
18277588-18277589 st7735: bit: "0"
18277567-18277589 st7735: data: "00"
18277622-18277624 st7735: bit: "0"
18277625-18277627 st7735: bit: "0"
18277628-18277630 st7735: bit: "0"
18277631-18277633 st7735: bit: "0"
18277634-18277636 st7735: bit: "0"
18277637-18277639 st7735: bit: "0"
18277640-18277642 st7735: bit: "0"
18277643-18277645 st7735: bit: "0"
18277622-18277645 st7735: data: "00"
18277688-18277690 st7735: bit: "0"
18277691-18277693 st7735: bit: "0"
18277694-18277696 st7735: bit: "0"
18277697-18277699 st7735: bit: "0"
18277700-18277702 st7735: bit: "0"
18277703-18277705 st7735: bit: "0"
18277706-18277708 st7735: bit: "0"
18277709-18277711 st7735: bit: "0"
18277688-18277711 st7735: data: "00"
18277744-18277745 st7735: bit: "0"
18277747-18277748 st7735: bit: "0"
18277750-18277751 st7735: bit: "0"
18277753-18277754 st7735: bit: "0"
18277756-18277757 st7735: bit: "0"
18277759-18277760 st7735: bit: "0"
18277762-18277763 st7735: bit: "0"
18277765-18277766 st7735: bit: "0"
18277744-18277766 st7735: data: "00"
18277810-18277811 st7735: bit: "0"
18277813-18277814 st7735: bit: "0"
18277816-18277817 st7735: bit: "0"
18277819-18277820 st7735: bit: "0"
18277822-18277823 st7735: bit: "0"
18277825-18277826 st7735: bit: "0"
18277828-18277829 st7735: bit: "0"
18277831-18277832 st7735: bit: "0"
18277810-18277832 st7735: data: "00"
18277865-18277867 st7735: bit: "0"
18277868-18277870 st7735: bit: "0"
18277871-18277873 st7735: bit: "0"
18277874-18277876 st7735: bit: "0"
18277877-18277879 st7735: bit: "0"
18277880-18277882 st7735: bit: "0"
18277883-18277885 st7735: bit: "0"
18277886-18277888 st7735: bit: "0"
18277865-18277888 st7735: data: "00"
18277931-18277933 st7735: bit: "0"
18277934-18277936 st7735: bit: "0"
18277937-18277939 st7735: bit: "0"
18277940-18277942 st7735: bit: "0"
18277943-18277945 st7735: bit: "0"
18277946-18277948 st7735: bit: "0"
18277949-18277951 st7735: bit: "0"
18277952-18277954 st7735: bit: "0"
18277931-18277954 st7735: data: "00"
18277987-18277988 st7735: bit: "0"
18277990-18277991 st7735: bit: "0"
18277993-18277994 st7735: bit: "0"
18277996-18277997 st7735: bit: "0"
18277999-18278000 st7735: bit: "0"
18278002-18278003 st7735: bit: "0"
18278005-18278006 st7735: bit: "0"
18278008-18278009 st7735: bit: "0"
18277987-18278009 st7735: data: "00"
18278053-18278054 st7735: bit: "0"
18278056-18278057 st7735: bit: "0"
18278059-18278060 st7735: bit: "0"
18278062-18278063 st7735: bit: "0"
18278065-18278066 st7735: bit: "0"
18278068-18278069 st7735: bit: "0"
18278071-18278072 st7735: bit: "0"
18278074-18278075 st7735: bit: "0"
18278053-18278075 st7735: data: "00"
18278108-18278110 st7735: bit: "0"
18278111-18278113 st7735: bit: "0"
18278114-18278116 st7735: bit: "0"
18278117-18278119 st7735: bit: "0"
18278120-18278122 st7735: bit: "0"
18278123-18278125 st7735: bit: "0"
18278126-18278128 st7735: bit: "0"
18278129-18278131 st7735: bit: "0"
18278108-18278131 st7735: data: "00"
18278174-18278176 st7735: bit: "0"
18278177-18278179 st7735: bit: "0"
18278180-18278182 st7735: bit: "0"
18278183-18278185 st7735: bit: "0"
18278186-18278188 st7735: bit: "0"
18278189-18278191 st7735: bit: "0"
18278192-18278194 st7735: bit: "0"
18278195-18278197 st7735: bit: "0"
18278174-18278197 st7735: data: "00"
18278230-18278231 st7735: bit: "0"
18278233-18278234 st7735: bit: "0"
18278236-18278237 st7735: bit: "0"
18278239-18278240 st7735: bit: "0"
18278242-18278243 st7735: bit: "0"
18278245-18278246 st7735: bit: "0"
18278248-18278249 st7735: bit: "0"
18278251-18278252 st7735: bit: "0"
18278230-18278252 st7735: data: "00"
18278296-18278297 st7735: bit: "0"
18278299-18278300 st7735: bit: "0"
18278302-18278303 st7735: bit: "0"
18278305-18278306 st7735: bit: "0"
18278308-18278309 st7735: bit: "0"
18278311-18278312 st7735: bit: "0"
18278314-18278315 st7735: bit: "0"
18278317-18278318 st7735: bit: "0"
18278296-18278318 st7735: data: "00"
18278351-18278353 st7735: bit: "0"
18278354-18278356 st7735: bit: "0"
18278357-18278359 st7735: bit: "0"
18278360-18278362 st7735: bit: "0"
18278363-18278365 st7735: bit: "0"
18278366-18278368 st7735: bit: "0"
18278369-18278371 st7735: bit: "0"
18278372-18278374 st7735: bit: "0"
18278351-18278374 st7735: data: "00"
18278417-18278419 st7735: bit: "0"
18278420-18278422 st7735: bit: "0"
18278423-18278425 st7735: bit: "0"
18278426-18278428 st7735: bit: "0"
18278429-18278431 st7735: bit: "0"
18278432-18278434 st7735: bit: "0"
18278435-18278437 st7735: bit: "0"
18278438-18278440 st7735: bit: "0"
18278417-18278440 st7735: data: "00"
18278473-18278474 st7735: bit: "0"
18278476-18278477 st7735: bit: "0"
18278479-18278480 st7735: bit: "0"
18278482-18278483 st7735: bit: "0"
18278485-18278486 st7735: bit: "0"
18278488-18278489 st7735: bit: "0"
18278491-18278492 st7735: bit: "0"
18278494-18278495 st7735: bit: "0"
18278473-18278495 st7735: data: "00"
18278539-18278540 st7735: bit: "0"
18278542-18278543 st7735: bit: "0"
18278545-18278546 st7735: bit: "0"
18278548-18278549 st7735: bit: "0"
18278551-18278552 st7735: bit: "0"
18278554-18278555 st7735: bit: "0"
18278557-18278558 st7735: bit: "0"
18278560-18278561 st7735: bit: "0"
18278539-18278561 st7735: data: "00"
18278594-18278596 st7735: bit: "0"
18278597-18278599 st7735: bit: "0"
18278600-18278602 st7735: bit: "0"
18278603-18278605 st7735: bit: "0"
18278606-18278608 st7735: bit: "0"
18278609-18278611 st7735: bit: "0"
18278612-18278614 st7735: bit: "0"
18278615-18278617 st7735: bit: "0"
18278594-18278617 st7735: data: "00"
18278660-18278662 st7735: bit: "0"
18278663-18278665 st7735: bit: "0"
18278666-18278668 st7735: bit: "0"
18278669-18278671 st7735: bit: "0"
18278672-18278674 st7735: bit: "0"
18278675-18278677 st7735: bit: "0"
18278678-18278680 st7735: bit: "0"
18278681-18278683 st7735: bit: "0"
18278660-18278683 st7735: data: "00"
18278716-18278717 st7735: bit: "0"
18278719-18278720 st7735: bit: "0"
18278722-18278723 st7735: bit: "0"
18278725-18278726 st7735: bit: "0"
18278728-18278729 st7735: bit: "0"
18278731-18278732 st7735: bit: "0"
18278734-18278735 st7735: bit: "0"
18278737-18278738 st7735: bit: "0"
18278716-18278738 st7735: data: "00"
18278782-18278783 st7735: bit: "0"
18278785-18278786 st7735: bit: "0"
18278788-18278789 st7735: bit: "0"
18278791-18278792 st7735: bit: "0"
18278794-18278795 st7735: bit: "0"
18278797-18278798 st7735: bit: "0"
18278800-18278801 st7735: bit: "0"
18278803-18278805 st7735: bit: "0"
18278782-18278805 st7735: data: "00"
18278837-18278839 st7735: bit: "0"
18278840-18278842 st7735: bit: "0"
18278843-18278845 st7735: bit: "0"
18278846-18278848 st7735: bit: "0"
18278849-18278851 st7735: bit: "0"
18278852-18278854 st7735: bit: "0"
18278855-18278857 st7735: bit: "0"
18278858-18278860 st7735: bit: "0"
18278837-18278860 st7735: data: "00"
18278903-18278905 st7735: bit: "0"
18278906-18278908 st7735: bit: "0"
18278909-18278911 st7735: bit: "0"
18278912-18278914 st7735: bit: "0"
18278915-18278917 st7735: bit: "0"
18278918-18278920 st7735: bit: "0"
18278921-18278923 st7735: bit: "0"
18278924-18278926 st7735: bit: "0"
18278903-18278926 st7735: data: "00"
18278959-18278961 st7735: bit: "0"
18278962-18278964 st7735: bit: "0"
18278965-18278967 st7735: bit: "0"
18278968-18278970 st7735: bit: "0"
18278971-18278973 st7735: bit: "0"
18278974-18278976 st7735: bit: "0"
18278977-18278979 st7735: bit: "0"
18278980-18278982 st7735: bit: "0"
18278959-18278982 st7735: data: "00"
18279025-18279027 st7735: bit: "0"
18279028-18279030 st7735: bit: "0"
18279031-18279033 st7735: bit: "0"
18279034-18279036 st7735: bit: "0"
18279037-18279039 st7735: bit: "0"
18279040-18279042 st7735: bit: "0"
18279043-18279045 st7735: bit: "0"
18279046-18279048 st7735: bit: "0"
18279025-18279048 st7735: data: "00"
18279080-18279082 st7735: bit: "0"
18279083-18279085 st7735: bit: "0"
18279086-18279088 st7735: bit: "0"
18279089-18279091 st7735: bit: "0"
18279092-18279094 st7735: bit: "0"
18279095-18279097 st7735: bit: "0"
18279098-18279100 st7735: bit: "0"
18279101-18279103 st7735: bit: "0"
18279080-18279103 st7735: data: "00"
18279146-18279148 st7735: bit: "0"
18279149-18279151 st7735: bit: "0"
18279152-18279154 st7735: bit: "0"
18279155-18279157 st7735: bit: "0"
18279158-18279160 st7735: bit: "0"
18279161-18279163 st7735: bit: "0"
18279164-18279166 st7735: bit: "0"
18279167-18279169 st7735: bit: "0"
18279146-18279169 st7735: data: "00"
18279202-18279204 st7735: bit: "0"
18279205-18279207 st7735: bit: "0"
18279208-18279210 st7735: bit: "0"
18279211-18279213 st7735: bit: "0"
18279214-18279216 st7735: bit: "0"
18279217-18279219 st7735: bit: "0"
18279220-18279222 st7735: bit: "0"
18279223-18279225 st7735: bit: "0"
18279202-18279225 st7735: data: "00"
18279268-18279270 st7735: bit: "0"
18279271-18279273 st7735: bit: "0"
18279274-18279276 st7735: bit: "0"
18279277-18279279 st7735: bit: "0"
18279280-18279282 st7735: bit: "0"
18279283-18279285 st7735: bit: "0"
18279286-18279288 st7735: bit: "0"
18279289-18279291 st7735: bit: "0"
18279268-18279291 st7735: data: "00"
18279323-18279325 st7735: bit: "0"
18279326-18279328 st7735: bit: "0"
18279329-18279331 st7735: bit: "0"
18279332-18279334 st7735: bit: "0"
18279335-18279337 st7735: bit: "0"
18279338-18279340 st7735: bit: "0"
18279341-18279343 st7735: bit: "0"
18279344-18279346 st7735: bit: "0"
18279323-18279346 st7735: data: "00"
18279389-18279391 st7735: bit: "0"
18279392-18279394 st7735: bit: "0"
18279395-18279397 st7735: bit: "0"
18279398-18279400 st7735: bit: "0"
18279401-18279403 st7735: bit: "0"
18279404-18279406 st7735: bit: "0"
18279407-18279409 st7735: bit: "0"
18279410-18279412 st7735: bit: "0"
18279389-18279412 st7735: data: "00"
18279445-18279447 st7735: bit: "0"
18279448-18279450 st7735: bit: "0"
18279451-18279453 st7735: bit: "0"
18279454-18279456 st7735: bit: "0"
18279457-18279459 st7735: bit: "0"
18279460-18279462 st7735: bit: "0"
18279463-18279465 st7735: bit: "0"
18279466-18279468 st7735: bit: "0"
18279445-18279468 st7735: data: "00"
18279511-18279513 st7735: bit: "0"
18279514-18279516 st7735: bit: "0"
18279517-18279519 st7735: bit: "0"
18279520-18279522 st7735: bit: "0"
18279523-18279525 st7735: bit: "0"
18279526-18279528 st7735: bit: "0"
18279529-18279531 st7735: bit: "0"
18279532-18279534 st7735: bit: "0"
18279511-18279534 st7735: data: "00"
18279567-18279568 st7735: bit: "0"
18279570-18279571 st7735: bit: "0"
18279573-18279574 st7735: bit: "0"
18279576-18279577 st7735: bit: "0"
18279579-18279580 st7735: bit: "0"
18279582-18279583 st7735: bit: "0"
18279585-18279586 st7735: bit: "0"
18279588-18279589 st7735: bit: "0"
18279567-18279589 st7735: data: "00"
18279633-18279634 st7735: bit: "0"
18279636-18279637 st7735: bit: "0"
18279639-18279640 st7735: bit: "0"
18279642-18279643 st7735: bit: "0"
18279645-18279646 st7735: bit: "0"
18279648-18279649 st7735: bit: "0"
18279651-18279652 st7735: bit: "0"
18279654-18279655 st7735: bit: "0"
18279633-18279655 st7735: data: "00"
18279688-18279690 st7735: bit: "0"
18279691-18279693 st7735: bit: "0"
18279694-18279696 st7735: bit: "0"
18279697-18279699 st7735: bit: "0"
18279700-18279702 st7735: bit: "0"
18279703-18279705 st7735: bit: "0"
18279706-18279708 st7735: bit: "0"
18279709-18279711 st7735: bit: "0"
18279688-18279711 st7735: data: "00"
18279754-18279756 st7735: bit: "0"
18279757-18279759 st7735: bit: "0"
18279760-18279762 st7735: bit: "0"
18279763-18279765 st7735: bit: "0"
18279766-18279768 st7735: bit: "0"
18279769-18279771 st7735: bit: "0"
18279772-18279774 st7735: bit: "0"
18279775-18279777 st7735: bit: "0"
18279754-18279777 st7735: data: "00"
18279810-18279811 st7735: bit: "0"
18279813-18279814 st7735: bit: "0"
18279816-18279817 st7735: bit: "0"
18279819-18279820 st7735: bit: "0"
18279822-18279823 st7735: bit: "0"
18279825-18279826 st7735: bit: "0"
18279828-18279829 st7735: bit: "0"
18279831-18279832 st7735: bit: "0"
18279810-18279832 st7735: data: "00"
18279876-18279877 st7735: bit: "0"
18279879-18279880 st7735: bit: "0"
18279882-18279883 st7735: bit: "0"
18279885-18279886 st7735: bit: "0"
18279888-18279889 st7735: bit: "0"
18279891-18279892 st7735: bit: "0"
18279894-18279895 st7735: bit: "0"
18279897-18279898 st7735: bit: "0"
18279876-18279898 st7735: data: "00"
18279931-18279933 st7735: bit: "0"
18279934-18279936 st7735: bit: "0"
18279937-18279939 st7735: bit: "0"
18279940-18279942 st7735: bit: "0"
18279943-18279945 st7735: bit: "0"
18279946-18279948 st7735: bit: "0"
18279949-18279951 st7735: bit: "0"
18279952-18279954 st7735: bit: "0"
18279931-18279954 st7735: data: "00"
18279997-18279999 st7735: bit: "0"
18280000-18280002 st7735: bit: "0"
18280003-18280005 st7735: bit: "0"
18280006-18280008 st7735: bit: "0"
18280009-18280011 st7735: bit: "0"
18280012-18280014 st7735: bit: "0"
18280015-18280017 st7735: bit: "0"
18280018-18280020 st7735: bit: "0"
18279997-18280020 st7735: data: "00"
18280053-18280054 st7735: bit: "0"
18280056-18280057 st7735: bit: "0"
18280059-18280060 st7735: bit: "0"
18280062-18280063 st7735: bit: "0"
18280065-18280066 st7735: bit: "0"
18280068-18280069 st7735: bit: "0"
18280071-18280072 st7735: bit: "0"
18280074-18280075 st7735: bit: "0"
18280053-18280075 st7735: data: "00"
18280119-18280120 st7735: bit: "0"
18280122-18280123 st7735: bit: "0"
18280125-18280126 st7735: bit: "0"
18280128-18280129 st7735: bit: "0"
18280131-18280132 st7735: bit: "0"
18280134-18280135 st7735: bit: "0"
18280137-18280138 st7735: bit: "0"
18280140-18280141 st7735: bit: "0"
18280119-18280141 st7735: data: "00"
18280174-18280176 st7735: bit: "0"
18280177-18280179 st7735: bit: "0"
18280180-18280182 st7735: bit: "0"
18280183-18280185 st7735: bit: "0"
18280186-18280188 st7735: bit: "0"
18280189-18280191 st7735: bit: "0"
18280192-18280194 st7735: bit: "0"
18280195-18280197 st7735: bit: "0"
18280174-18280197 st7735: data: "00"
18280240-18280242 st7735: bit: "0"
18280243-18280245 st7735: bit: "0"
18280246-18280248 st7735: bit: "0"
18280249-18280251 st7735: bit: "0"
18280252-18280254 st7735: bit: "0"
18280255-18280257 st7735: bit: "0"
18280258-18280260 st7735: bit: "0"
18280261-18280263 st7735: bit: "0"
18280240-18280263 st7735: data: "00"
18280296-18280297 st7735: bit: "0"
18280299-18280300 st7735: bit: "0"
18280302-18280303 st7735: bit: "0"
18280305-18280306 st7735: bit: "0"
18280308-18280309 st7735: bit: "0"
18280311-18280312 st7735: bit: "0"
18280314-18280315 st7735: bit: "0"
18280317-18280318 st7735: bit: "0"
18280296-18280318 st7735: data: "00"
18280362-18280363 st7735: bit: "0"
18280365-18280366 st7735: bit: "0"
18280368-18280369 st7735: bit: "0"
18280371-18280372 st7735: bit: "0"
18280374-18280375 st7735: bit: "0"
18280377-18280378 st7735: bit: "0"
18280380-18280381 st7735: bit: "0"
18280383-18280384 st7735: bit: "0"
18280362-18280384 st7735: data: "00"
18280417-18280419 st7735: bit: "0"
18280420-18280422 st7735: bit: "0"
18280423-18280425 st7735: bit: "0"
18280426-18280428 st7735: bit: "0"
18280429-18280431 st7735: bit: "0"
18280432-18280434 st7735: bit: "0"
18280435-18280437 st7735: bit: "0"
18280438-18280440 st7735: bit: "0"
18280417-18280440 st7735: data: "00"
18280483-18280485 st7735: bit: "0"
18280486-18280488 st7735: bit: "0"
18280489-18280491 st7735: bit: "0"
18280492-18280494 st7735: bit: "0"
18280495-18280497 st7735: bit: "0"
18280498-18280500 st7735: bit: "0"
18280501-18280503 st7735: bit: "0"
18280504-18280506 st7735: bit: "0"
18280483-18280506 st7735: data: "00"
18280539-18280540 st7735: bit: "0"
18280542-18280543 st7735: bit: "0"
18280545-18280546 st7735: bit: "0"
18280548-18280549 st7735: bit: "0"
18280551-18280552 st7735: bit: "0"
18280554-18280555 st7735: bit: "0"
18280557-18280558 st7735: bit: "0"
18280560-18280561 st7735: bit: "0"
18280539-18280561 st7735: data: "00"
18280605-18280606 st7735: bit: "0"
18280608-18280609 st7735: bit: "0"
18280611-18280612 st7735: bit: "0"
18280614-18280615 st7735: bit: "0"
18280617-18280618 st7735: bit: "0"
18280620-18280621 st7735: bit: "0"
18280623-18280624 st7735: bit: "0"
18280626-18280627 st7735: bit: "0"
18280605-18280627 st7735: data: "00"
18280660-18280662 st7735: bit: "0"
18280663-18280665 st7735: bit: "0"
18280666-18280668 st7735: bit: "0"
18280669-18280671 st7735: bit: "0"
18280672-18280674 st7735: bit: "0"
18280675-18280677 st7735: bit: "0"
18280678-18280680 st7735: bit: "0"
18280681-18280683 st7735: bit: "0"
18280660-18280683 st7735: data: "00"
18280726-18280728 st7735: bit: "0"
18280729-18280731 st7735: bit: "0"
18280732-18280734 st7735: bit: "0"
18280735-18280737 st7735: bit: "0"
18280738-18280740 st7735: bit: "0"
18280741-18280743 st7735: bit: "0"
18280744-18280746 st7735: bit: "0"
18280747-18280749 st7735: bit: "0"
18280726-18280749 st7735: data: "00"
18280782-18280783 st7735: bit: "0"
18280785-18280786 st7735: bit: "0"
18280788-18280789 st7735: bit: "0"
18280791-18280792 st7735: bit: "0"
18280794-18280795 st7735: bit: "0"
18280797-18280798 st7735: bit: "0"
18280800-18280801 st7735: bit: "0"
18280803-18280804 st7735: bit: "0"
18280782-18280804 st7735: data: "00"
18280848-18280849 st7735: bit: "0"
18280851-18280852 st7735: bit: "0"
18280854-18280855 st7735: bit: "0"
18280857-18280858 st7735: bit: "0"
18280860-18280861 st7735: bit: "0"
18280863-18280864 st7735: bit: "0"
18280866-18280867 st7735: bit: "0"
18280869-18280870 st7735: bit: "0"
18280848-18280870 st7735: data: "00"
18280903-18280905 st7735: bit: "0"
18280906-18280908 st7735: bit: "0"
18280909-18280911 st7735: bit: "0"
18280912-18280914 st7735: bit: "0"
18280915-18280917 st7735: bit: "0"
18280918-18280920 st7735: bit: "0"
18280921-18280923 st7735: bit: "0"
18280924-18280926 st7735: bit: "0"
18280903-18280926 st7735: data: "00"
18280969-18280971 st7735: bit: "0"
18280972-18280974 st7735: bit: "0"
18280975-18280977 st7735: bit: "0"
18280978-18280980 st7735: bit: "0"
18280981-18280983 st7735: bit: "0"
18280984-18280986 st7735: bit: "0"
18280987-18280989 st7735: bit: "0"
18280990-18280992 st7735: bit: "0"
18280969-18280992 st7735: data: "00"
18281025-18281026 st7735: bit: "0"
18281028-18281029 st7735: bit: "0"
18281031-18281032 st7735: bit: "0"
18281034-18281035 st7735: bit: "0"
18281037-18281038 st7735: bit: "0"
18281040-18281041 st7735: bit: "0"
18281043-18281044 st7735: bit: "0"
18281046-18281047 st7735: bit: "0"
18281025-18281047 st7735: data: "00"
18281091-18281092 st7735: bit: "0"
18281094-18281095 st7735: bit: "0"
18281097-18281098 st7735: bit: "0"
18281100-18281101 st7735: bit: "0"
18281103-18281104 st7735: bit: "0"
18281106-18281107 st7735: bit: "0"
18281109-18281110 st7735: bit: "0"
18281112-18281113 st7735: bit: "0"
18281091-18281113 st7735: data: "00"
18281146-18281148 st7735: bit: "0"
18281149-18281151 st7735: bit: "0"
18281152-18281154 st7735: bit: "0"
18281155-18281157 st7735: bit: "0"
18281158-18281160 st7735: bit: "0"
18281161-18281163 st7735: bit: "0"
18281164-18281166 st7735: bit: "0"
18281167-18281169 st7735: bit: "0"
18281146-18281169 st7735: data: "00"
18281212-18281214 st7735: bit: "0"
18281215-18281217 st7735: bit: "0"
18281218-18281220 st7735: bit: "0"
18281221-18281223 st7735: bit: "0"
18281224-18281226 st7735: bit: "0"
18281227-18281229 st7735: bit: "0"
18281230-18281232 st7735: bit: "0"
18281233-18281235 st7735: bit: "0"
18281212-18281235 st7735: data: "00"
18281268-18281269 st7735: bit: "0"
18281271-18281272 st7735: bit: "0"
18281274-18281275 st7735: bit: "0"
18281277-18281278 st7735: bit: "0"
18281280-18281281 st7735: bit: "0"
18281283-18281284 st7735: bit: "0"
18281286-18281287 st7735: bit: "0"
18281289-18281290 st7735: bit: "0"
18281268-18281290 st7735: data: "00"
18281334-18281335 st7735: bit: "0"
18281337-18281338 st7735: bit: "0"
18281340-18281341 st7735: bit: "0"
18281343-18281344 st7735: bit: "0"
18281346-18281347 st7735: bit: "0"
18281349-18281350 st7735: bit: "0"
18281352-18281353 st7735: bit: "0"
18281355-18281356 st7735: bit: "0"
18281334-18281356 st7735: data: "00"
18281389-18281391 st7735: bit: "0"
18281392-18281394 st7735: bit: "0"
18281395-18281397 st7735: bit: "0"
18281398-18281400 st7735: bit: "0"
18281401-18281403 st7735: bit: "0"
18281404-18281406 st7735: bit: "0"
18281407-18281409 st7735: bit: "0"
18281410-18281412 st7735: bit: "0"
18281389-18281412 st7735: data: "00"
18281455-18281457 st7735: bit: "0"
18281458-18281460 st7735: bit: "0"
18281461-18281463 st7735: bit: "0"
18281464-18281466 st7735: bit: "0"
18281467-18281469 st7735: bit: "0"
18281470-18281472 st7735: bit: "0"
18281473-18281475 st7735: bit: "0"
18281476-18281478 st7735: bit: "0"
18281455-18281478 st7735: data: "00"
18281511-18281512 st7735: bit: "0"
18281514-18281515 st7735: bit: "0"
18281517-18281518 st7735: bit: "0"
18281520-18281521 st7735: bit: "0"
18281523-18281524 st7735: bit: "0"
18281526-18281527 st7735: bit: "0"
18281529-18281530 st7735: bit: "0"
18281532-18281533 st7735: bit: "0"
18281511-18281533 st7735: data: "00"
18281577-18281578 st7735: bit: "0"
18281580-18281581 st7735: bit: "0"
18281583-18281584 st7735: bit: "0"
18281586-18281587 st7735: bit: "0"
18281589-18281590 st7735: bit: "0"
18281592-18281593 st7735: bit: "0"
18281595-18281596 st7735: bit: "0"
18281598-18281599 st7735: bit: "0"
18281577-18281599 st7735: data: "00"
18281632-18281634 st7735: bit: "0"
18281635-18281637 st7735: bit: "0"
18281638-18281640 st7735: bit: "0"
18281641-18281643 st7735: bit: "0"
18281644-18281646 st7735: bit: "0"
18281647-18281649 st7735: bit: "0"
18281650-18281652 st7735: bit: "0"
18281653-18281655 st7735: bit: "0"
18281632-18281655 st7735: data: "00"
18281698-18281700 st7735: bit: "0"
18281701-18281703 st7735: bit: "0"
18281704-18281706 st7735: bit: "0"
18281707-18281709 st7735: bit: "0"
18281710-18281712 st7735: bit: "0"
18281713-18281715 st7735: bit: "0"
18281716-18281718 st7735: bit: "0"
18281719-18281721 st7735: bit: "0"
18281698-18281721 st7735: data: "00"
18281754-18281755 st7735: bit: "0"
18281757-18281758 st7735: bit: "0"
18281760-18281761 st7735: bit: "0"
18281763-18281764 st7735: bit: "0"
18281766-18281767 st7735: bit: "0"
18281769-18281770 st7735: bit: "0"
18281772-18281773 st7735: bit: "0"
18281775-18281776 st7735: bit: "0"
18281754-18281776 st7735: data: "00"
18281820-18281821 st7735: bit: "0"
18281823-18281824 st7735: bit: "0"
18281826-18281827 st7735: bit: "0"
18281829-18281830 st7735: bit: "0"
18281832-18281833 st7735: bit: "0"
18281835-18281836 st7735: bit: "0"
18281838-18281839 st7735: bit: "0"
18281841-18281842 st7735: bit: "0"
18281820-18281842 st7735: data: "00"
18281875-18281877 st7735: bit: "0"
18281878-18281880 st7735: bit: "0"
18281881-18281883 st7735: bit: "0"
18281884-18281886 st7735: bit: "0"
18281887-18281889 st7735: bit: "0"
18281890-18281892 st7735: bit: "0"
18281893-18281895 st7735: bit: "0"
18281896-18281898 st7735: bit: "0"
18281875-18281898 st7735: data: "00"
18281941-18281943 st7735: bit: "0"
18281944-18281946 st7735: bit: "0"
18281947-18281949 st7735: bit: "0"
18281950-18281952 st7735: bit: "0"
18281953-18281955 st7735: bit: "0"
18281956-18281958 st7735: bit: "0"
18281959-18281961 st7735: bit: "0"
18281962-18281964 st7735: bit: "0"
18281941-18281964 st7735: data: "00"
18281997-18281998 st7735: bit: "0"
18282000-18282001 st7735: bit: "0"
18282003-18282004 st7735: bit: "0"
18282006-18282007 st7735: bit: "0"
18282009-18282010 st7735: bit: "0"
18282012-18282013 st7735: bit: "0"
18282015-18282016 st7735: bit: "0"
18282018-18282019 st7735: bit: "0"
18281997-18282019 st7735: data: "00"
18282063-18282064 st7735: bit: "0"
18282066-18282067 st7735: bit: "0"
18282069-18282070 st7735: bit: "0"
18282072-18282073 st7735: bit: "0"
18282075-18282076 st7735: bit: "0"
18282078-18282079 st7735: bit: "0"
18282081-18282082 st7735: bit: "0"
18282084-18282085 st7735: bit: "0"
18282063-18282085 st7735: data: "00"
18282118-18282120 st7735: bit: "0"
18282121-18282123 st7735: bit: "0"
18282124-18282126 st7735: bit: "0"
18282127-18282129 st7735: bit: "0"
18282130-18282132 st7735: bit: "0"
18282133-18282135 st7735: bit: "0"
18282136-18282138 st7735: bit: "0"
18282139-18282141 st7735: bit: "0"
18282118-18282141 st7735: data: "00"
18282184-18282186 st7735: bit: "0"
18282187-18282189 st7735: bit: "0"
18282190-18282192 st7735: bit: "0"
18282193-18282195 st7735: bit: "0"
18282196-18282198 st7735: bit: "0"
18282199-18282201 st7735: bit: "0"
18282202-18282204 st7735: bit: "0"
18282205-18282207 st7735: bit: "0"
18282184-18282207 st7735: data: "00"
18282240-18282241 st7735: bit: "0"
18282243-18282244 st7735: bit: "0"
18282246-18282247 st7735: bit: "0"
18282249-18282250 st7735: bit: "0"
18282252-18282253 st7735: bit: "0"
18282255-18282256 st7735: bit: "0"
18282258-18282259 st7735: bit: "0"
18282261-18282262 st7735: bit: "0"
18282240-18282262 st7735: data: "00"
18282306-18282307 st7735: bit: "0"
18282309-18282310 st7735: bit: "0"
18282312-18282313 st7735: bit: "0"
18282315-18282316 st7735: bit: "0"
18282318-18282319 st7735: bit: "0"
18282321-18282322 st7735: bit: "0"
18282324-18282325 st7735: bit: "0"
18282327-18282328 st7735: bit: "0"
18282306-18282328 st7735: data: "00"
18282361-18282363 st7735: bit: "0"
18282364-18282366 st7735: bit: "0"
18282367-18282369 st7735: bit: "0"
18282370-18282372 st7735: bit: "0"
18282373-18282375 st7735: bit: "0"
18282376-18282378 st7735: bit: "0"
18282379-18282381 st7735: bit: "0"
18282382-18282384 st7735: bit: "0"
18282361-18282384 st7735: data: "00"
18282427-18282429 st7735: bit: "0"
18282430-18282432 st7735: bit: "0"
18282433-18282435 st7735: bit: "0"
18282436-18282438 st7735: bit: "0"
18282439-18282441 st7735: bit: "0"
18282442-18282444 st7735: bit: "0"
18282445-18282447 st7735: bit: "0"
18282448-18282450 st7735: bit: "0"
18282427-18282450 st7735: data: "00"
18282483-18282484 st7735: bit: "0"
18282486-18282487 st7735: bit: "0"
18282489-18282490 st7735: bit: "0"
18282492-18282493 st7735: bit: "0"
18282495-18282496 st7735: bit: "0"
18282498-18282499 st7735: bit: "0"
18282501-18282502 st7735: bit: "0"
18282504-18282505 st7735: bit: "0"
18282483-18282505 st7735: data: "00"
18282549-18282550 st7735: bit: "0"
18282552-18282553 st7735: bit: "0"
18282555-18282556 st7735: bit: "0"
18282558-18282559 st7735: bit: "0"
18282561-18282562 st7735: bit: "0"
18282564-18282565 st7735: bit: "0"
18282567-18282568 st7735: bit: "0"
18282570-18282571 st7735: bit: "0"
18282549-18282571 st7735: data: "00"
18282604-18282606 st7735: bit: "0"
18282607-18282609 st7735: bit: "0"
18282610-18282612 st7735: bit: "0"
18282613-18282615 st7735: bit: "0"
18282616-18282618 st7735: bit: "0"
18282619-18282621 st7735: bit: "0"
18282622-18282624 st7735: bit: "0"
18282625-18282627 st7735: bit: "0"
18282604-18282627 st7735: data: "00"
18282670-18282672 st7735: bit: "0"
18282673-18282675 st7735: bit: "0"
18282676-18282678 st7735: bit: "0"
18282679-18282681 st7735: bit: "0"
18282682-18282684 st7735: bit: "0"
18282685-18282687 st7735: bit: "0"
18282688-18282690 st7735: bit: "0"
18282691-18282693 st7735: bit: "0"
18282670-18282693 st7735: data: "00"
18282726-18282727 st7735: bit: "0"
18282729-18282730 st7735: bit: "0"
18282732-18282733 st7735: bit: "0"
18282735-18282736 st7735: bit: "0"
18282738-18282739 st7735: bit: "0"
18282741-18282742 st7735: bit: "0"
18282744-18282745 st7735: bit: "0"
18282747-18282748 st7735: bit: "0"
18282726-18282748 st7735: data: "00"
18282792-18282793 st7735: bit: "0"
18282795-18282796 st7735: bit: "0"
18282798-18282799 st7735: bit: "0"
18282801-18282802 st7735: bit: "0"
18282804-18282805 st7735: bit: "0"
18282807-18282808 st7735: bit: "0"
18282810-18282811 st7735: bit: "0"
18282813-18282814 st7735: bit: "0"
18282792-18282814 st7735: data: "00"
18282847-18282849 st7735: bit: "0"
18282850-18282852 st7735: bit: "0"
18282853-18282855 st7735: bit: "0"
18282856-18282858 st7735: bit: "0"
18282859-18282861 st7735: bit: "0"
18282862-18282864 st7735: bit: "0"
18282865-18282867 st7735: bit: "0"
18282868-18282870 st7735: bit: "0"
18282847-18282870 st7735: data: "00"
18282913-18282915 st7735: bit: "0"
18282916-18282918 st7735: bit: "0"
18282919-18282921 st7735: bit: "0"
18282922-18282924 st7735: bit: "0"
18282925-18282927 st7735: bit: "0"
18282928-18282930 st7735: bit: "0"
18282931-18282933 st7735: bit: "0"
18282934-18282936 st7735: bit: "0"
18282913-18282936 st7735: data: "00"
18282969-18282971 st7735: bit: "0"
18282972-18282974 st7735: bit: "0"
18282975-18282977 st7735: bit: "0"
18282978-18282980 st7735: bit: "0"
18282981-18282983 st7735: bit: "0"
18282984-18282986 st7735: bit: "0"
18282987-18282989 st7735: bit: "0"
18282990-18282992 st7735: bit: "0"
18282969-18282992 st7735: data: "00"
18283035-18283037 st7735: bit: "0"
18283038-18283040 st7735: bit: "0"
18283041-18283043 st7735: bit: "0"
18283044-18283046 st7735: bit: "0"
18283047-18283049 st7735: bit: "0"
18283050-18283052 st7735: bit: "0"
18283053-18283055 st7735: bit: "0"
18283056-18283058 st7735: bit: "0"
18283035-18283058 st7735: data: "00"
18283090-18283092 st7735: bit: "0"
18283093-18283095 st7735: bit: "0"
18283096-18283098 st7735: bit: "0"
18283099-18283101 st7735: bit: "0"
18283102-18283104 st7735: bit: "0"
18283105-18283107 st7735: bit: "0"
18283108-18283110 st7735: bit: "0"
18283111-18283113 st7735: bit: "0"
18283090-18283113 st7735: data: "00"
18283156-18283158 st7735: bit: "0"
18283159-18283161 st7735: bit: "0"
18283162-18283164 st7735: bit: "0"
18283165-18283167 st7735: bit: "0"
18283168-18283170 st7735: bit: "0"
18283171-18283173 st7735: bit: "0"
18283174-18283176 st7735: bit: "0"
18283177-18283179 st7735: bit: "0"
18283156-18283179 st7735: data: "00"
18283212-18283214 st7735: bit: "0"
18283215-18283217 st7735: bit: "0"
18283218-18283220 st7735: bit: "0"
18283221-18283223 st7735: bit: "0"
18283224-18283226 st7735: bit: "0"
18283227-18283229 st7735: bit: "0"
18283230-18283232 st7735: bit: "0"
18283233-18283235 st7735: bit: "0"
18283212-18283235 st7735: data: "00"
18283278-18283280 st7735: bit: "0"
18283281-18283283 st7735: bit: "0"
18283284-18283286 st7735: bit: "0"
18283287-18283289 st7735: bit: "0"
18283290-18283292 st7735: bit: "0"
18283293-18283295 st7735: bit: "0"
18283296-18283298 st7735: bit: "0"
18283299-18283301 st7735: bit: "0"
18283278-18283301 st7735: data: "00"
18283333-18283335 st7735: bit: "0"
18283336-18283338 st7735: bit: "0"
18283339-18283341 st7735: bit: "0"
18283342-18283344 st7735: bit: "0"
18283345-18283347 st7735: bit: "0"
18283348-18283350 st7735: bit: "0"
18283351-18283353 st7735: bit: "0"
18283354-18283356 st7735: bit: "0"
18283333-18283356 st7735: data: "00"
18283399-18283401 st7735: bit: "0"
18283402-18283404 st7735: bit: "0"
18283405-18283407 st7735: bit: "0"
18283408-18283410 st7735: bit: "0"
18283411-18283413 st7735: bit: "0"
18283414-18283416 st7735: bit: "0"
18283417-18283419 st7735: bit: "0"
18283420-18283422 st7735: bit: "0"
18283399-18283422 st7735: data: "00"
18283455-18283457 st7735: bit: "0"
18283458-18283460 st7735: bit: "0"
18283461-18283463 st7735: bit: "0"
18283464-18283466 st7735: bit: "0"
18283467-18283469 st7735: bit: "0"
18283470-18283472 st7735: bit: "0"
18283473-18283475 st7735: bit: "0"
18283476-18283478 st7735: bit: "0"
18283455-18283478 st7735: data: "00"
18283521-18283523 st7735: bit: "0"
18283524-18283526 st7735: bit: "0"
18283527-18283529 st7735: bit: "0"
18283530-18283532 st7735: bit: "0"
18283533-18283535 st7735: bit: "0"
18283536-18283538 st7735: bit: "0"
18283539-18283541 st7735: bit: "0"
18283542-18283544 st7735: bit: "0"
18283521-18283544 st7735: data: "00"
18283577-18283578 st7735: bit: "0"
18283580-18283581 st7735: bit: "0"
18283583-18283584 st7735: bit: "0"
18283586-18283587 st7735: bit: "0"
18283589-18283590 st7735: bit: "0"
18283592-18283593 st7735: bit: "0"
18283595-18283596 st7735: bit: "0"
18283598-18283599 st7735: bit: "0"
18283577-18283599 st7735: data: "00"
18283643-18283644 st7735: bit: "0"
18283646-18283647 st7735: bit: "0"
18283649-18283650 st7735: bit: "0"
18283652-18283653 st7735: bit: "0"
18283655-18283656 st7735: bit: "0"
18283658-18283659 st7735: bit: "0"
18283661-18283662 st7735: bit: "0"
18283664-18283665 st7735: bit: "0"
18283643-18283665 st7735: data: "00"
18283698-18283700 st7735: bit: "0"
18283701-18283703 st7735: bit: "0"
18283704-18283706 st7735: bit: "0"
18283707-18283709 st7735: bit: "0"
18283710-18283712 st7735: bit: "0"
18283713-18283715 st7735: bit: "0"
18283716-18283718 st7735: bit: "0"
18283719-18283721 st7735: bit: "0"
18283698-18283721 st7735: data: "00"
18283764-18283766 st7735: bit: "0"
18283767-18283769 st7735: bit: "0"
18283770-18283772 st7735: bit: "0"
18283773-18283775 st7735: bit: "0"
18283776-18283778 st7735: bit: "0"
18283779-18283781 st7735: bit: "0"
18283782-18283784 st7735: bit: "0"
18283785-18283787 st7735: bit: "0"
18283764-18283787 st7735: data: "00"
18283820-18283821 st7735: bit: "0"
18283823-18283824 st7735: bit: "0"
18283826-18283827 st7735: bit: "0"
18283829-18283830 st7735: bit: "0"
18283832-18283833 st7735: bit: "0"
18283835-18283836 st7735: bit: "0"
18283838-18283839 st7735: bit: "0"
18283841-18283842 st7735: bit: "0"
18283820-18283842 st7735: data: "00"
18283886-18283887 st7735: bit: "0"
18283889-18283890 st7735: bit: "0"
18283892-18283893 st7735: bit: "0"
18283895-18283896 st7735: bit: "0"
18283898-18283899 st7735: bit: "0"
18283901-18283902 st7735: bit: "0"
18283904-18283905 st7735: bit: "0"
18283907-18283908 st7735: bit: "0"
18283886-18283908 st7735: data: "00"
18283941-18283943 st7735: bit: "0"
18283944-18283946 st7735: bit: "0"
18283947-18283949 st7735: bit: "0"
18283950-18283952 st7735: bit: "0"
18283953-18283955 st7735: bit: "0"
18283956-18283958 st7735: bit: "0"
18283959-18283961 st7735: bit: "0"
18283962-18283964 st7735: bit: "0"
18283941-18283964 st7735: data: "00"
18284007-18284009 st7735: bit: "0"
18284010-18284012 st7735: bit: "0"
18284013-18284015 st7735: bit: "0"
18284016-18284018 st7735: bit: "0"
18284019-18284021 st7735: bit: "0"
18284022-18284024 st7735: bit: "0"
18284025-18284027 st7735: bit: "0"
18284028-18284030 st7735: bit: "0"
18284007-18284030 st7735: data: "00"
18284063-18284064 st7735: bit: "0"
18284066-18284067 st7735: bit: "0"
18284069-18284070 st7735: bit: "0"
18284072-18284073 st7735: bit: "0"
18284075-18284076 st7735: bit: "0"
18284078-18284079 st7735: bit: "0"
18284081-18284082 st7735: bit: "0"
18284084-18284085 st7735: bit: "0"
18284063-18284085 st7735: data: "00"
18284129-18284130 st7735: bit: "0"
18284132-18284133 st7735: bit: "0"
18284135-18284136 st7735: bit: "0"
18284138-18284139 st7735: bit: "0"
18284141-18284142 st7735: bit: "0"
18284144-18284145 st7735: bit: "0"
18284147-18284148 st7735: bit: "0"
18284150-18284151 st7735: bit: "0"
18284129-18284151 st7735: data: "00"
18284184-18284186 st7735: bit: "0"
18284187-18284189 st7735: bit: "0"
18284190-18284192 st7735: bit: "0"
18284193-18284195 st7735: bit: "0"
18284196-18284198 st7735: bit: "0"
18284199-18284201 st7735: bit: "0"
18284202-18284204 st7735: bit: "0"
18284205-18284207 st7735: bit: "0"
18284184-18284207 st7735: data: "00"
18284250-18284252 st7735: bit: "0"
18284253-18284255 st7735: bit: "0"
18284256-18284258 st7735: bit: "0"
18284259-18284261 st7735: bit: "0"
18284262-18284264 st7735: bit: "0"
18284265-18284267 st7735: bit: "0"
18284268-18284270 st7735: bit: "0"
18284271-18284273 st7735: bit: "0"
18284250-18284273 st7735: data: "00"
18284306-18284307 st7735: bit: "0"
18284309-18284310 st7735: bit: "0"
18284312-18284313 st7735: bit: "0"
18284315-18284316 st7735: bit: "0"
18284318-18284319 st7735: bit: "0"
18284321-18284322 st7735: bit: "0"
18284324-18284325 st7735: bit: "0"
18284327-18284328 st7735: bit: "0"
18284306-18284328 st7735: data: "00"
18284372-18284373 st7735: bit: "0"
18284375-18284376 st7735: bit: "0"
18284378-18284379 st7735: bit: "0"
18284381-18284382 st7735: bit: "0"
18284384-18284385 st7735: bit: "0"
18284387-18284388 st7735: bit: "0"
18284390-18284391 st7735: bit: "0"
18284393-18284394 st7735: bit: "0"
18284372-18284394 st7735: data: "00"
18284427-18284429 st7735: bit: "0"
18284430-18284432 st7735: bit: "0"
18284433-18284435 st7735: bit: "0"
18284436-18284438 st7735: bit: "0"
18284439-18284441 st7735: bit: "0"
18284442-18284444 st7735: bit: "0"
18284445-18284447 st7735: bit: "0"
18284448-18284450 st7735: bit: "0"
18284427-18284450 st7735: data: "00"
18284493-18284495 st7735: bit: "0"
18284496-18284498 st7735: bit: "0"
18284499-18284501 st7735: bit: "0"
18284502-18284504 st7735: bit: "0"
18284505-18284507 st7735: bit: "0"
18284508-18284510 st7735: bit: "0"
18284511-18284513 st7735: bit: "0"
18284514-18284516 st7735: bit: "0"
18284493-18284516 st7735: data: "00"
18284549-18284550 st7735: bit: "0"
18284552-18284553 st7735: bit: "0"
18284555-18284556 st7735: bit: "0"
18284558-18284559 st7735: bit: "0"
18284561-18284562 st7735: bit: "0"
18284564-18284565 st7735: bit: "0"
18284567-18284568 st7735: bit: "0"
18284570-18284571 st7735: bit: "0"
18284549-18284571 st7735: data: "00"
18284615-18284616 st7735: bit: "0"
18284618-18284619 st7735: bit: "0"
18284621-18284622 st7735: bit: "0"
18284624-18284625 st7735: bit: "0"
18284627-18284628 st7735: bit: "0"
18284630-18284631 st7735: bit: "0"
18284633-18284634 st7735: bit: "0"
18284636-18284637 st7735: bit: "0"
18284615-18284637 st7735: data: "00"
18284670-18284672 st7735: bit: "0"
18284673-18284675 st7735: bit: "0"
18284676-18284678 st7735: bit: "0"
18284679-18284681 st7735: bit: "0"
18284682-18284684 st7735: bit: "0"
18284685-18284687 st7735: bit: "0"
18284688-18284690 st7735: bit: "0"
18284691-18284693 st7735: bit: "0"
18284670-18284693 st7735: data: "00"
18284736-18284738 st7735: bit: "0"
18284739-18284741 st7735: bit: "0"
18284742-18284744 st7735: bit: "0"
18284745-18284747 st7735: bit: "0"
18284748-18284750 st7735: bit: "0"
18284751-18284753 st7735: bit: "0"
18284754-18284756 st7735: bit: "0"
18284757-18284759 st7735: bit: "0"
18284736-18284759 st7735: data: "00"
18284792-18284793 st7735: bit: "0"
18284795-18284796 st7735: bit: "0"
18284798-18284799 st7735: bit: "0"
18284801-18284802 st7735: bit: "0"
18284804-18284805 st7735: bit: "0"
18284807-18284808 st7735: bit: "0"
18284810-18284811 st7735: bit: "0"
18284813-18284814 st7735: bit: "0"
18284792-18284814 st7735: data: "00"
18284858-18284859 st7735: bit: "0"
18284861-18284862 st7735: bit: "0"
18284864-18284865 st7735: bit: "0"
18284867-18284868 st7735: bit: "0"
18284870-18284871 st7735: bit: "0"
18284873-18284874 st7735: bit: "0"
18284876-18284877 st7735: bit: "0"
18284879-18284880 st7735: bit: "0"
18284858-18284880 st7735: data: "00"
18284913-18284915 st7735: bit: "0"
18284916-18284918 st7735: bit: "0"
18284919-18284921 st7735: bit: "0"
18284922-18284924 st7735: bit: "0"
18284925-18284927 st7735: bit: "0"
18284928-18284930 st7735: bit: "0"
18284931-18284933 st7735: bit: "0"
18284934-18284936 st7735: bit: "0"
18284913-18284936 st7735: data: "00"
18284979-18284981 st7735: bit: "0"
18284982-18284984 st7735: bit: "0"
18284985-18284987 st7735: bit: "0"
18284988-18284990 st7735: bit: "0"
18284991-18284993 st7735: bit: "0"
18284994-18284996 st7735: bit: "0"
18284997-18284999 st7735: bit: "0"
18285000-18285002 st7735: bit: "0"
18284979-18285002 st7735: data: "00"
18285035-18285036 st7735: bit: "0"
18285038-18285039 st7735: bit: "0"
18285041-18285042 st7735: bit: "0"
18285044-18285045 st7735: bit: "0"
18285047-18285048 st7735: bit: "0"
18285050-18285051 st7735: bit: "0"
18285053-18285054 st7735: bit: "0"
18285056-18285057 st7735: bit: "0"
18285035-18285057 st7735: data: "00"
18285251-18285252 st7735: bit: "0"
18285254-18285255 st7735: bit: "0"
18285257-18285258 st7735: bit: "0"
18285260-18285261 st7735: bit: "0"
18285263-18285264 st7735: bit: "0"
18285266-18285267 st7735: bit: "0"
18285269-18285270 st7735: bit: "0"
18285272-18285273 st7735: bit: "0"
18285251-18285273 st7735: data: "00"
