37014208-37014211 st7735: bit: "0"
37014214-37014217 st7735: bit: "0"
37014220-37014223 st7735: bit: "0"
37014226-37014229 st7735: bit: "0"
37014232-37014235 st7735: bit: "0"
37014238-37014241 st7735: bit: "0"
37014244-37014247 st7735: bit: "0"
37014250-37014253 st7735: bit: "1"
37014208-37014253 st7735: command: "01"
38215102-38215105 st7735: bit: "0"
38215108-38215111 st7735: bit: "0"
38215114-38215117 st7735: bit: "0"
38215120-38215123 st7735: bit: "1"
38215126-38215129 st7735: bit: "0"
38215132-38215135 st7735: bit: "0"
38215138-38215141 st7735: bit: "0"
38215144-38215147 st7735: bit: "1"
38215102-38215147 st7735: command: "11"
37014208-37014253 st7735: description: "SWRESET: Software reset"
40616466-40616469 st7735: bit: "0"
40616472-40616475 st7735: bit: "0"
40616478-40616481 st7735: bit: "1"
40616484-40616487 st7735: bit: "0"
40616490-40616493 st7735: bit: "0"
40616496-40616499 st7735: bit: "1"
40616502-40616505 st7735: bit: "1"
40616508-40616511 st7735: bit: "0"
40616466-40616511 st7735: command: "26"
38215102-38215147 st7735: description: "SLPOUT: Sleep out & booster on"
40616695-40616699 st7735: bit: "0"
40616701-40616705 st7735: bit: "0"
40616707-40616711 st7735: bit: "0"
40616713-40616717 st7735: bit: "0"
40616719-40616723 st7735: bit: "0"
40616725-40616728 st7735: bit: "1"
40616731-40616735 st7735: bit: "0"
40616737-40616741 st7735: bit: "0"
40616695-40616741 st7735: data: "04"
40616929-40616932 st7735: bit: "1"
40616935-40616939 st7735: bit: "0"
40616941-40616945 st7735: bit: "1"
40616947-40616950 st7735: bit: "1"
40616953-40616957 st7735: bit: "0"
40616959-40616963 st7735: bit: "0"
40616965-40616969 st7735: bit: "0"
40616971-40616975 st7735: bit: "1"
40616929-40616975 st7735: command: "B1"
40616466-40616741 st7735: description: "Unknown command: 26. Data: 04"
40617159-40617162 st7735: bit: "0"
40617165-40617168 st7735: bit: "0"
40617171-40617174 st7735: bit: "0"
40617177-40617180 st7735: bit: "0"
40617183-40617186 st7735: bit: "1"
40617189-40617192 st7735: bit: "0"
40617195-40617198 st7735: bit: "1"
40617201-40617204 st7735: bit: "1"
40617159-40617204 st7735: data: "0B"
40617373-40617377 st7735: bit: "0"
40617379-40617383 st7735: bit: "0"
40617385-40617389 st7735: bit: "0"
40617391-40617395 st7735: bit: "1"
40617397-40617401 st7735: bit: "0"
40617403-40617407 st7735: bit: "1"
40617409-40617413 st7735: bit: "0"
40617415-40617419 st7735: bit: "0"
40617373-40617419 st7735: data: "14"
40617608-40617611 st7735: bit: "1"
40617614-40617617 st7735: bit: "1"
40617620-40617623 st7735: bit: "0"
40617626-40617629 st7735: bit: "0"
40617632-40617635 st7735: bit: "0"
40617638-40617641 st7735: bit: "0"
40617644-40617647 st7735: bit: "0"
40617650-40617653 st7735: bit: "0"
40617608-40617653 st7735: command: "C0"
40616929-40617419 st7735: description: "FRMCTR1: Frame rate control (in normal mode / full colors)"
40617837-40617840 st7735: bit: "0"
40617843-40617846 st7735: bit: "0"
40617849-40617852 st7735: bit: "0"
40617855-40617859 st7735: bit: "0"
40617861-40617864 st7735: bit: "1"
40617867-40617870 st7735: bit: "0"
40617873-40617876 st7735: bit: "0"
40617879-40617883 st7735: bit: "0"
40617837-40617883 st7735: data: "08"
40618052-40618055 st7735: bit: "0"
40618058-40618061 st7735: bit: "0"
40618064-40618067 st7735: bit: "0"
40618070-40618073 st7735: bit: "0"
40618076-40618079 st7735: bit: "0"
40618082-40618085 st7735: bit: "0"
40618088-40618091 st7735: bit: "0"
40618094-40618097 st7735: bit: "0"
40618052-40618097 st7735: data: "00"
40618286-40618289 st7735: bit: "1"
40618292-40618295 st7735: bit: "1"
40618298-40618301 st7735: bit: "0"
40618304-40618307 st7735: bit: "0"
40618310-40618313 st7735: bit: "0"
40618316-40618319 st7735: bit: "0"
40618322-40618325 st7735: bit: "0"
40618328-40618331 st7735: bit: "1"
40618286-40618331 st7735: command: "C1"
40617608-40618097 st7735: description: "PWCTR1: Power control 1"
40618515-40618519 st7735: bit: "0"
40618521-40618525 st7735: bit: "0"
40618527-40618531 st7735: bit: "0"
40618533-40618537 st7735: bit: "0"
40618539-40618543 st7735: bit: "0"
40618545-40618549 st7735: bit: "1"
40618551-40618555 st7735: bit: "0"
40618557-40618561 st7735: bit: "1"
40618515-40618561 st7735: data: "05"
40618749-40618753 st7735: bit: "1"
40618755-40618759 st7735: bit: "1"
40618761-40618765 st7735: bit: "0"
40618767-40618771 st7735: bit: "0"
40618773-40618777 st7735: bit: "0"
40618779-40618783 st7735: bit: "1"
40618785-40618789 st7735: bit: "0"
40618791-40618795 st7735: bit: "1"
40618749-40618795 st7735: command: "C5"
40618286-40618561 st7735: description: "PWCTR2: Power control 2"
40618979-40618983 st7735: bit: "0"
40618985-40618988 st7735: bit: "1"
40618991-40618994 st7735: bit: "0"
40618997-40619000 st7735: bit: "0"
40619003-40619006 st7735: bit: "0"
40619009-40619012 st7735: bit: "0"
40619015-40619019 st7735: bit: "0"
40619021-40619024 st7735: bit: "1"
40618979-40619024 st7735: data: "41"
40619194-40619197 st7735: bit: "0"
40619200-40619203 st7735: bit: "0"
40619206-40619209 st7735: bit: "1"
40619212-40619215 st7735: bit: "1"
40619218-40619221 st7735: bit: "0"
40619224-40619227 st7735: bit: "0"
40619230-40619233 st7735: bit: "0"
40619236-40619239 st7735: bit: "0"
40619194-40619239 st7735: data: "30"
40619428-40619431 st7735: bit: "1"
40619434-40619437 st7735: bit: "1"
40619440-40619443 st7735: bit: "0"
40619446-40619449 st7735: bit: "0"
40619452-40619455 st7735: bit: "0"
40619458-40619461 st7735: bit: "1"
40619464-40619467 st7735: bit: "1"
40619470-40619473 st7735: bit: "1"
40619428-40619473 st7735: command: "C7"
40618749-40619239 st7735: description: "VMCTR1: VCOM control 1"
40619657-40619661 st7735: bit: "1"
40619663-40619666 st7735: bit: "1"
40619669-40619673 st7735: bit: "0"
40619675-40619679 st7735: bit: "0"
40619681-40619685 st7735: bit: "0"
40619687-40619691 st7735: bit: "0"
40619693-40619697 st7735: bit: "0"
40619699-40619703 st7735: bit: "1"
40619657-40619703 st7735: data: "C1"
40619891-40619895 st7735: bit: "1"
40619897-40619901 st7735: bit: "1"
40619903-40619907 st7735: bit: "1"
40619909-40619913 st7735: bit: "0"
40619915-40619919 st7735: bit: "1"
40619921-40619925 st7735: bit: "1"
40619927-40619931 st7735: bit: "0"
40619933-40619937 st7735: bit: "0"
40619891-40619937 st7735: command: "EC"
40619428-40619703 st7735: description: "Unknown command: C7. Data: C1"
40620121-40620124 st7735: bit: "0"
40620127-40620130 st7735: bit: "0"
40620133-40620137 st7735: bit: "0"
40620139-40620142 st7735: bit: "1"
40620145-40620148 st7735: bit: "1"
40620151-40620155 st7735: bit: "0"
40620157-40620160 st7735: bit: "1"
40620163-40620166 st7735: bit: "1"
40620121-40620166 st7735: data: "1B"
40620355-40620358 st7735: bit: "0"
40620361-40620365 st7735: bit: "0"
40620367-40620370 st7735: bit: "1"
40620373-40620376 st7735: bit: "1"
40620379-40620382 st7735: bit: "1"
40620385-40620389 st7735: bit: "0"
40620391-40620394 st7735: bit: "1"
40620397-40620401 st7735: bit: "0"
40620355-40620401 st7735: command: "3A"
40619891-40620166 st7735: description: "Unknown command: EC. Data: 1B"
40620585-40620588 st7735: bit: "0"
40620591-40620594 st7735: bit: "1"
40620597-40620600 st7735: bit: "0"
40620603-40620606 st7735: bit: "1"
40620609-40620612 st7735: bit: "0"
40620615-40620618 st7735: bit: "1"
40620621-40620624 st7735: bit: "0"
40620627-40620630 st7735: bit: "1"
40620585-40620630 st7735: data: "55"
43021926-43021929 st7735: bit: "0"
43021932-43021936 st7735: bit: "0"
43021938-43021941 st7735: bit: "1"
43021944-43021948 st7735: bit: "0"
43021950-43021953 st7735: bit: "1"
43021956-43021960 st7735: bit: "0"
43021962-43021965 st7735: bit: "1"
43021968-43021972 st7735: bit: "0"
43021926-43021972 st7735: command: "2A"
40620355-40620630 st7735: description: "COLMOD: Interface pixel format"
43022156-43022159 st7735: bit: "0"
43022162-43022165 st7735: bit: "0"
43022168-43022171 st7735: bit: "0"
43022174-43022177 st7735: bit: "0"
43022180-43022183 st7735: bit: "0"
43022186-43022189 st7735: bit: "0"
43022192-43022195 st7735: bit: "0"
43022198-43022201 st7735: bit: "0"
43022156-43022201 st7735: data: "00"
43022370-43022373 st7735: bit: "0"
43022376-43022379 st7735: bit: "0"
43022382-43022385 st7735: bit: "0"
43022388-43022391 st7735: bit: "0"
43022394-43022397 st7735: bit: "0"
43022400-43022403 st7735: bit: "0"
43022406-43022409 st7735: bit: "0"
43022412-43022416 st7735: bit: "0"
43022370-43022416 st7735: data: "00"
43022585-43022588 st7735: bit: "0"
43022591-43022594 st7735: bit: "0"
43022597-43022600 st7735: bit: "0"
43022603-43022606 st7735: bit: "0"
43022609-43022612 st7735: bit: "0"
43022615-43022618 st7735: bit: "0"
43022621-43022624 st7735: bit: "0"
43022627-43022630 st7735: bit: "0"
43022585-43022630 st7735: data: "00"
43022799-43022803 st7735: bit: "0"
43022805-43022809 st7735: bit: "1"
43022811-43022815 st7735: bit: "1"
43022817-43022821 st7735: bit: "1"
43022823-43022827 st7735: bit: "1"
43022829-43022833 st7735: bit: "1"
43022835-43022839 st7735: bit: "1"
43022841-43022845 st7735: bit: "1"
43022799-43022845 st7735: data: "7F"
43023033-43023037 st7735: bit: "0"
43023039-43023043 st7735: bit: "0"
43023045-43023049 st7735: bit: "1"
43023051-43023055 st7735: bit: "0"
43023057-43023061 st7735: bit: "1"
43023063-43023067 st7735: bit: "0"
43023069-43023073 st7735: bit: "1"
43023075-43023079 st7735: bit: "1"
43023033-43023079 st7735: command: "2B"
43021926-43022845 st7735: description: "CASET: Column address set"
43023263-43023266 st7735: bit: "0"
43023269-43023272 st7735: bit: "0"
43023275-43023278 st7735: bit: "0"
43023281-43023284 st7735: bit: "0"
43023287-43023290 st7735: bit: "0"
43023293-43023296 st7735: bit: "0"
43023299-43023302 st7735: bit: "0"
43023305-43023309 st7735: bit: "0"
43023263-43023309 st7735: data: "00"
43023478-43023481 st7735: bit: "0"
43023484-43023487 st7735: bit: "0"
43023490-43023493 st7735: bit: "0"
43023496-43023499 st7735: bit: "0"
43023502-43023505 st7735: bit: "0"
43023508-43023511 st7735: bit: "0"
43023514-43023517 st7735: bit: "0"
43023520-43023523 st7735: bit: "0"
43023478-43023523 st7735: data: "00"
43023692-43023695 st7735: bit: "0"
43023698-43023701 st7735: bit: "0"
43023704-43023707 st7735: bit: "0"
43023710-43023713 st7735: bit: "0"
43023716-43023719 st7735: bit: "0"
43023722-43023725 st7735: bit: "0"
43023728-43023731 st7735: bit: "0"
43023734-43023738 st7735: bit: "0"
43023692-43023738 st7735: data: "00"
43023907-43023910 st7735: bit: "1"
43023913-43023916 st7735: bit: "0"
43023919-43023922 st7735: bit: "0"
43023925-43023928 st7735: bit: "1"
43023931-43023934 st7735: bit: "1"
43023937-43023940 st7735: bit: "1"
43023943-43023946 st7735: bit: "1"
43023949-43023952 st7735: bit: "1"
43023907-43023952 st7735: data: "9F"
43024141-43024144 st7735: bit: "0"
43024147-43024150 st7735: bit: "0"
43024153-43024156 st7735: bit: "1"
43024159-43024162 st7735: bit: "1"
43024165-43024168 st7735: bit: "0"
43024171-43024174 st7735: bit: "1"
43024177-43024180 st7735: bit: "1"
43024183-43024186 st7735: bit: "0"
43024141-43024186 st7735: command: "36"
43023033-43023952 st7735: description: "RASET: Row address set"
43024370-43024374 st7735: bit: "1"
43024376-43024379 st7735: bit: "1"
43024382-43024386 st7735: bit: "0"
43024388-43024392 st7735: bit: "0"
43024394-43024397 st7735: bit: "1"
43024400-43024404 st7735: bit: "0"
43024406-43024410 st7735: bit: "0"
43024412-43024416 st7735: bit: "0"
43024370-43024416 st7735: data: "C8"
43024604-43024608 st7735: bit: "1"
43024610-43024614 st7735: bit: "0"
43024616-43024620 st7735: bit: "1"
43024622-43024626 st7735: bit: "1"
43024628-43024632 st7735: bit: "0"
43024634-43024638 st7735: bit: "1"
43024640-43024644 st7735: bit: "1"
43024646-43024650 st7735: bit: "1"
43024604-43024650 st7735: command: "B7"
43024141-43024416 st7735: description: "MADCTL: Memory data address control"
43024834-43024837 st7735: bit: "0"
43024840-43024843 st7735: bit: "0"
43024846-43024849 st7735: bit: "0"
43024852-43024855 st7735: bit: "0"
43024858-43024861 st7735: bit: "0"
43024864-43024867 st7735: bit: "0"
43024870-43024873 st7735: bit: "0"
43024876-43024880 st7735: bit: "0"
43024834-43024880 st7735: data: "00"
43025068-43025071 st7735: bit: "1"
43025074-43025077 st7735: bit: "1"
43025080-43025083 st7735: bit: "1"
43025086-43025089 st7735: bit: "1"
43025092-43025095 st7735: bit: "0"
43025098-43025102 st7735: bit: "0"
43025104-43025107 st7735: bit: "1"
43025110-43025114 st7735: bit: "0"
43025068-43025114 st7735: command: "F2"
43024604-43024880 st7735: description: "Unknown command: B7. Data: 00"
43025298-43025301 st7735: bit: "0"
43025304-43025307 st7735: bit: "0"
43025310-43025313 st7735: bit: "0"
43025316-43025319 st7735: bit: "0"
43025322-43025325 st7735: bit: "0"
43025328-43025331 st7735: bit: "0"
43025334-43025337 st7735: bit: "0"
43025340-43025343 st7735: bit: "0"
43025298-43025343 st7735: data: "00"
43025532-43025535 st7735: bit: "1"
43025538-43025541 st7735: bit: "1"
43025544-43025547 st7735: bit: "1"
43025550-43025553 st7735: bit: "0"
43025556-43025559 st7735: bit: "0"
43025562-43025565 st7735: bit: "0"
43025568-43025571 st7735: bit: "0"
43025574-43025577 st7735: bit: "0"
43025532-43025577 st7735: command: "E0"
43025068-43025343 st7735: description: "Unknown command: F2. Data: 00"
43025761-43025765 st7735: bit: "0"
43025767-43025771 st7735: bit: "0"
43025773-43025776 st7735: bit: "1"
43025779-43025783 st7735: bit: "0"
43025785-43025789 st7735: bit: "1"
43025791-43025795 st7735: bit: "0"
43025797-43025801 st7735: bit: "0"
43025803-43025807 st7735: bit: "0"
43025761-43025807 st7735: data: "28"
43025976-43025979 st7735: bit: "0"
43025982-43025986 st7735: bit: "0"
43025988-43025991 st7735: bit: "1"
43025994-43025997 st7735: bit: "0"
43026000-43026004 st7735: bit: "0"
43026006-43026009 st7735: bit: "1"
43026012-43026015 st7735: bit: "0"
43026018-43026022 st7735: bit: "0"
43025976-43026022 st7735: data: "24"
43026191-43026194 st7735: bit: "0"
43026196-43026200 st7735: bit: "0"
43026202-43026206 st7735: bit: "1"
43026209-43026212 st7735: bit: "0"
43026215-43026218 st7735: bit: "0"
43026221-43026224 st7735: bit: "0"
43026227-43026230 st7735: bit: "1"
43026233-43026236 st7735: bit: "0"
43026191-43026236 st7735: data: "22"
43026405-43026408 st7735: bit: "0"
43026411-43026415 st7735: bit: "0"
43026417-43026420 st7735: bit: "1"
43026423-43026426 st7735: bit: "1"
43026429-43026432 st7735: bit: "0"
43026435-43026438 st7735: bit: "0"
43026441-43026445 st7735: bit: "0"
43026447-43026450 st7735: bit: "1"
43026405-43026450 st7735: data: "31"
43026620-43026623 st7735: bit: "0"
43026626-43026629 st7735: bit: "0"
43026632-43026635 st7735: bit: "1"
43026638-43026641 st7735: bit: "0"
43026644-43026647 st7735: bit: "1"
43026650-43026653 st7735: bit: "0"
43026656-43026659 st7735: bit: "1"
43026662-43026665 st7735: bit: "1"
43026620-43026665 st7735: data: "2B"
43026834-43026838 st7735: bit: "0"
43026840-43026844 st7735: bit: "0"
43026846-43026850 st7735: bit: "0"
43026852-43026856 st7735: bit: "0"
43026858-43026862 st7735: bit: "1"
43026864-43026868 st7735: bit: "1"
43026870-43026873 st7735: bit: "1"
43026876-43026880 st7735: bit: "0"
43026834-43026880 st7735: data: "0E"
43027049-43027052 st7735: bit: "0"
43027055-43027058 st7735: bit: "1"
43027061-43027064 st7735: bit: "0"
43027067-43027070 st7735: bit: "1"
43027073-43027076 st7735: bit: "0"
43027079-43027082 st7735: bit: "0"
43027085-43027088 st7735: bit: "1"
43027091-43027094 st7735: bit: "1"
43027049-43027094 st7735: data: "53"
43027263-43027267 st7735: bit: "1"
43027269-43027273 st7735: bit: "0"
43027275-43027279 st7735: bit: "1"
43027281-43027285 st7735: bit: "0"
43027287-43027291 st7735: bit: "0"
43027293-43027297 st7735: bit: "1"
43027299-43027303 st7735: bit: "0"
43027305-43027309 st7735: bit: "1"
43027263-43027309 st7735: data: "A5"
43027478-43027482 st7735: bit: "0"
43027484-43027487 st7735: bit: "1"
43027490-43027493 st7735: bit: "0"
43027496-43027499 st7735: bit: "0"
43027502-43027505 st7735: bit: "0"
43027508-43027512 st7735: bit: "0"
43027514-43027517 st7735: bit: "1"
43027520-43027524 st7735: bit: "0"
43027478-43027524 st7735: data: "42"
43027693-43027696 st7735: bit: "0"
43027699-43027702 st7735: bit: "0"
43027705-43027708 st7735: bit: "0"
43027711-43027714 st7735: bit: "1"
43027717-43027720 st7735: bit: "0"
43027723-43027726 st7735: bit: "1"
43027729-43027732 st7735: bit: "1"
43027735-43027738 st7735: bit: "0"
43027693-43027738 st7735: data: "16"
43027907-43027910 st7735: bit: "0"
43027913-43027916 st7735: bit: "0"
43027919-43027923 st7735: bit: "0"
43027925-43027928 st7735: bit: "1"
43027931-43027934 st7735: bit: "1"
43027937-43027941 st7735: bit: "0"
43027943-43027947 st7735: bit: "0"
43027949-43027953 st7735: bit: "0"
43027907-43027953 st7735: data: "18"
43028122-43028125 st7735: bit: "0"
43028128-43028131 st7735: bit: "0"
43028134-43028137 st7735: bit: "0"
43028140-43028143 st7735: bit: "1"
43028146-43028149 st7735: bit: "0"
43028152-43028155 st7735: bit: "0"
43028158-43028161 st7735: bit: "1"
43028164-43028167 st7735: bit: "0"
43028122-43028167 st7735: data: "12"
43028336-43028340 st7735: bit: "0"
43028342-43028346 st7735: bit: "0"
43028348-43028352 st7735: bit: "0"
43028354-43028358 st7735: bit: "1"
43028360-43028363 st7735: bit: "1"
43028366-43028370 st7735: bit: "0"
43028372-43028375 st7735: bit: "1"
43028378-43028382 st7735: bit: "0"
43028336-43028382 st7735: data: "1A"
43028551-43028554 st7735: bit: "0"
43028557-43028560 st7735: bit: "0"
43028563-43028566 st7735: bit: "0"
43028569-43028572 st7735: bit: "1"
43028575-43028578 st7735: bit: "0"
43028581-43028584 st7735: bit: "1"
43028587-43028590 st7735: bit: "0"
43028593-43028596 st7735: bit: "0"
43028551-43028596 st7735: data: "14"
43028765-43028769 st7735: bit: "0"
43028771-43028775 st7735: bit: "0"
43028777-43028781 st7735: bit: "0"
43028783-43028787 st7735: bit: "0"
43028789-43028793 st7735: bit: "0"
43028795-43028799 st7735: bit: "0"
43028801-43028805 st7735: bit: "1"
43028807-43028811 st7735: bit: "1"
43028765-43028811 st7735: data: "03"
44229638-44229641 st7735: bit: "1"
44229644-44229647 st7735: bit: "1"
44229650-44229653 st7735: bit: "1"
44229656-44229659 st7735: bit: "0"
44229662-44229665 st7735: bit: "0"
44229668-44229671 st7735: bit: "0"
44229674-44229678 st7735: bit: "0"
44229680-44229683 st7735: bit: "1"
44229638-44229683 st7735: command: "E1"
43025532-43028811 st7735: description: "GMCTRP1: Gamma '+'polarity correction characteristics setting"
44229868-44229871 st7735: bit: "0"
44229874-44229877 st7735: bit: "0"
44229880-44229883 st7735: bit: "0"
44229886-44229889 st7735: bit: "1"
44229892-44229895 st7735: bit: "0"
44229898-44229901 st7735: bit: "1"
44229904-44229907 st7735: bit: "1"
44229910-44229913 st7735: bit: "1"
44229868-44229913 st7735: data: "17"
44230082-44230086 st7735: bit: "0"
44230088-44230092 st7735: bit: "0"
44230094-44230098 st7735: bit: "0"
44230100-44230104 st7735: bit: "1"
44230106-44230109 st7735: bit: "1"
44230112-44230116 st7735: bit: "0"
44230118-44230122 st7735: bit: "1"
44230124-44230128 st7735: bit: "1"
44230082-44230128 st7735: data: "1B"
44230297-44230300 st7735: bit: "0"
44230303-44230306 st7735: bit: "0"
44230309-44230312 st7735: bit: "0"
44230315-44230318 st7735: bit: "1"
44230321-44230324 st7735: bit: "1"
44230327-44230330 st7735: bit: "1"
44230333-44230336 st7735: bit: "0"
44230339-44230342 st7735: bit: "1"
44230297-44230342 st7735: data: "1D"
44230511-44230515 st7735: bit: "0"
44230517-44230521 st7735: bit: "0"
44230523-44230527 st7735: bit: "0"
44230529-44230533 st7735: bit: "0"
44230535-44230539 st7735: bit: "1"
44230541-44230545 st7735: bit: "1"
44230547-44230550 st7735: bit: "1"
44230553-44230557 st7735: bit: "0"
44230511-44230557 st7735: data: "0E"
44230726-44230729 st7735: bit: "0"
44230732-44230735 st7735: bit: "0"
44230738-44230742 st7735: bit: "0"
44230744-44230747 st7735: bit: "1"
44230750-44230754 st7735: bit: "0"
44230756-44230759 st7735: bit: "1"
44230762-44230765 st7735: bit: "0"
44230768-44230772 st7735: bit: "0"
44230726-44230772 st7735: data: "14"
44230940-44230944 st7735: bit: "0"
44230946-44230950 st7735: bit: "0"
44230952-44230956 st7735: bit: "0"
44230958-44230962 st7735: bit: "1"
44230964-44230968 st7735: bit: "0"
44230970-44230974 st7735: bit: "0"
44230976-44230980 st7735: bit: "0"
44230982-44230986 st7735: bit: "1"
44230940-44230986 st7735: data: "11"
44231155-44231158 st7735: bit: "0"
44231161-44231165 st7735: bit: "0"
44231167-44231170 st7735: bit: "1"
44231173-44231177 st7735: bit: "0"
44231179-44231182 st7735: bit: "1"
44231185-44231188 st7735: bit: "1"
44231191-44231194 st7735: bit: "0"
44231197-44231201 st7735: bit: "0"
44231155-44231201 st7735: data: "2C"
44231370-44231373 st7735: bit: "1"
44231376-44231379 st7735: bit: "0"
44231382-44231385 st7735: bit: "1"
44231388-44231391 st7735: bit: "0"
44231394-44231397 st7735: bit: "0"
44231400-44231403 st7735: bit: "1"
44231406-44231409 st7735: bit: "0"
44231412-44231415 st7735: bit: "1"
44231370-44231415 st7735: data: "A5"
44231584-44231588 st7735: bit: "0"
44231590-44231594 st7735: bit: "0"
44231596-44231600 st7735: bit: "1"
44231602-44231606 st7735: bit: "1"
44231608-44231612 st7735: bit: "1"
44231614-44231617 st7735: bit: "1"
44231620-44231624 st7735: bit: "0"
44231626-44231630 st7735: bit: "1"
44231584-44231630 st7735: data: "3D"
44231799-44231802 st7735: bit: "0"
44231805-44231808 st7735: bit: "0"
44231811-44231814 st7735: bit: "0"
44231817-44231820 st7735: bit: "0"
44231823-44231826 st7735: bit: "1"
44231829-44231832 st7735: bit: "0"
44231835-44231838 st7735: bit: "0"
44231841-44231844 st7735: bit: "1"
44231799-44231844 st7735: data: "09"
44232013-44232017 st7735: bit: "0"
44232019-44232023 st7735: bit: "0"
44232025-44232029 st7735: bit: "1"
44232031-44232035 st7735: bit: "0"
44232037-44232041 st7735: bit: "0"
44232043-44232047 st7735: bit: "1"
44232049-44232053 st7735: bit: "1"
44232055-44232059 st7735: bit: "1"
44232013-44232059 st7735: data: "27"
44232228-44232231 st7735: bit: "0"
44232234-44232238 st7735: bit: "0"
44232240-44232243 st7735: bit: "1"
44232246-44232250 st7735: bit: "0"
44232252-44232255 st7735: bit: "1"
44232258-44232261 st7735: bit: "1"
44232264-44232268 st7735: bit: "0"
44232270-44232273 st7735: bit: "1"
44232228-44232273 st7735: data: "2D"
44232443-44232446 st7735: bit: "0"
44232449-44232452 st7735: bit: "0"
44232455-44232458 st7735: bit: "1"
44232461-44232464 st7735: bit: "0"
44232467-44232470 st7735: bit: "0"
44232473-44232476 st7735: bit: "1"
44232479-44232482 st7735: bit: "0"
44232485-44232488 st7735: bit: "1"
44232443-44232488 st7735: data: "25"
44232657-44232660 st7735: bit: "0"
44232663-44232667 st7735: bit: "0"
44232669-44232672 st7735: bit: "1"
44232675-44232679 st7735: bit: "0"
44232681-44232684 st7735: bit: "1"
44232687-44232691 st7735: bit: "0"
44232693-44232696 st7735: bit: "1"
44232699-44232702 st7735: bit: "1"
44232657-44232702 st7735: data: "2B"
44232872-44232875 st7735: bit: "0"
44232878-44232881 st7735: bit: "0"
44232884-44232887 st7735: bit: "1"
44232890-44232893 st7735: bit: "1"
44232896-44232899 st7735: bit: "1"
44232902-44232905 st7735: bit: "1"
44232908-44232911 st7735: bit: "0"
44232914-44232917 st7735: bit: "0"
44232872-44232917 st7735: data: "3C"
45433752-45433755 st7735: bit: "0"
45433758-45433761 st7735: bit: "0"
45433764-45433767 st7735: bit: "0"
45433770-45433773 st7735: bit: "1"
45433776-45433779 st7735: bit: "0"
45433782-45433785 st7735: bit: "0"
45433788-45433791 st7735: bit: "1"
45433794-45433797 st7735: bit: "1"
45433752-45433797 st7735: command: "13"
44229638-44232917 st7735: description: "GMCTRN1: Gamma '-'polarity correction characteristics setting"
45674253-45674257 st7735: bit: "0"
45674259-45674263 st7735: bit: "0"
45674265-45674268 st7735: bit: "1"
45674271-45674275 st7735: bit: "0"
45674277-45674280 st7735: bit: "1"
45674283-45674287 st7735: bit: "0"
45674289-45674293 st7735: bit: "0"
45674295-45674299 st7735: bit: "1"
45674253-45674299 st7735: command: "29"
45433752-45433797 st7735: description: "NORON: Partial off (normal)"
