1821743-1821837 ieee488: bit: "0"
1821837-1821932 ieee488: bit: "0"
1821932-1822026 ieee488: bit: "0"
1822026-1822119 ieee488: bit: "1"
1822119-1822214 ieee488: bit: "0"
1822214-1822308 ieee488: bit: "0"
1822308-1822402 ieee488: bit: "1"
1822402-1822496 ieee488: bit: "0"
1821728-1822496 ieee488: raw: "/48"
1821728-1822496 ieee488: taddr: "Talk 8" "T 8" "T8"
1822816-1822910 ieee488: bit: "1"
1822910-1823003 ieee488: bit: "1"
1823003-1823096 ieee488: bit: "1"
1823096-1823190 ieee488: bit: "1"
1823190-1823284 ieee488: bit: "0"
1823284-1823377 ieee488: bit: "1"
1823377-1823471 ieee488: bit: "1"
1823471-1823565 ieee488: bit: "0"
1822802-1823565 ieee488: raw: "/6f"
1822802-1823565 ieee488: saddr: "Secondary 15" "S 15" "S?"
1850936-1851154 ieee488: bit: "1"
1851154-1851343 ieee488: bit: "1"
1851343-1851532 ieee488: bit: "1"
1851532-1851723 ieee488: bit: "0"
1851723-1851912 ieee488: bit: "1"
1851912-1852102 ieee488: bit: "1"
1852102-1852293 ieee488: bit: "0"
1852293-1852484 ieee488: bit: "0"
1850886-1852484 ieee488: raw: "37"
1850886-1852484 ieee488: data: "7"
1853217-1853435 ieee488: bit: "1"
1853435-1853624 ieee488: bit: "1"
1853624-1853815 ieee488: bit: "0"
1853815-1854006 ieee488: bit: "0"
1854006-1854195 ieee488: bit: "1"
1854195-1854384 ieee488: bit: "1"
1854384-1854575 ieee488: bit: "0"
1854575-1854766 ieee488: bit: "0"
1853148-1854766 ieee488: raw: "33"
1853148-1854766 ieee488: data: "3"
1855349-1855569 ieee488: bit: "0"
1855569-1855760 ieee488: bit: "0"
1855760-1855949 ieee488: bit: "1"
1855949-1856138 ieee488: bit: "1"
1856138-1856329 ieee488: bit: "0"
1856329-1856518 ieee488: bit: "1"
1856518-1856709 ieee488: bit: "0"
1856709-1856900 ieee488: bit: "0"
1855267-1856900 ieee488: raw: "2c"
1855267-1856900 ieee488: data: ","
1857431-1857649 ieee488: bit: "1"
1857649-1857838 ieee488: bit: "1"
1857838-1858029 ieee488: bit: "0"
1858029-1858220 ieee488: bit: "0"
1858220-1858411 ieee488: bit: "0"
1858411-1858602 ieee488: bit: "0"
1858602-1858791 ieee488: bit: "1"
1858791-1858982 ieee488: bit: "0"
1857358-1858982 ieee488: raw: "43"
1857358-1858982 ieee488: data: "C"
1859461-1859681 ieee488: bit: "0"
1859681-1859870 ieee488: bit: "1"
1859870-1860061 ieee488: bit: "0"
1860061-1860252 ieee488: bit: "0"
1860252-1860443 ieee488: bit: "0"
1860443-1860634 ieee488: bit: "0"
1860634-1860823 ieee488: bit: "1"
1860823-1861014 ieee488: bit: "0"
1859384-1861014 ieee488: raw: "42"
1859384-1861014 ieee488: data: "B"
1861747-1861965 ieee488: bit: "1"
1861965-1862156 ieee488: bit: "0"
1862156-1862345 ieee488: bit: "1"
1862345-1862535 ieee488: bit: "1"
1862535-1862726 ieee488: bit: "0"
1862726-1862917 ieee488: bit: "0"
1862917-1863106 ieee488: bit: "1"
1863106-1863297 ieee488: bit: "0"
1861672-1863297 ieee488: raw: "4d"
1861672-1863297 ieee488: data: "M"
1863776-1863996 ieee488: bit: "0"
1863996-1864187 ieee488: bit: "0"
1864187-1864378 ieee488: bit: "0"
1864378-1864569 ieee488: bit: "0"
1864569-1864760 ieee488: bit: "0"
1864760-1864949 ieee488: bit: "1"
1864949-1865140 ieee488: bit: "0"
1865140-1865331 ieee488: bit: "0"
1863699-1865331 ieee488: raw: "20"
1863699-1865331 ieee488: data: " "
1865810-1866030 ieee488: bit: "0"
1866030-1866221 ieee488: bit: "0"
1866221-1866410 ieee488: bit: "1"
1866410-1866601 ieee488: bit: "0"
1866601-1866792 ieee488: bit: "0"
1866792-1866983 ieee488: bit: "0"
1866983-1867172 ieee488: bit: "1"
1867172-1867363 ieee488: bit: "0"
1865732-1867363 ieee488: raw: "44"
1865732-1867363 ieee488: data: "D"
1867842-1868060 ieee488: bit: "1"
1868060-1868249 ieee488: bit: "1"
1868249-1868438 ieee488: bit: "1"
1868438-1868627 ieee488: bit: "1"
1868627-1868818 ieee488: bit: "0"
1868818-1869009 ieee488: bit: "0"
1869009-1869198 ieee488: bit: "1"
1869198-1869389 ieee488: bit: "0"
1867765-1869389 ieee488: raw: "4f"
1867765-1869389 ieee488: data: "O"
1870122-1870340 ieee488: bit: "1"
1870340-1870529 ieee488: bit: "1"
1870529-1870720 ieee488: bit: "0"
1870720-1870911 ieee488: bit: "0"
1870911-1871100 ieee488: bit: "1"
1871100-1871291 ieee488: bit: "0"
1871291-1871480 ieee488: bit: "1"
1871480-1871671 ieee488: bit: "0"
1870046-1871671 ieee488: raw: "53"
1870046-1871671 ieee488: data: "S"
1872150-1872370 ieee488: bit: "0"
1872370-1872561 ieee488: bit: "0"
1872561-1872752 ieee488: bit: "0"
1872752-1872944 ieee488: bit: "0"
1872944-1873135 ieee488: bit: "0"
1873135-1873324 ieee488: bit: "1"
1873324-1873515 ieee488: bit: "0"
1873515-1873706 ieee488: bit: "0"
1872073-1873706 ieee488: raw: "20"
1872073-1873706 ieee488: data: " "
1874185-1874405 ieee488: bit: "0"
1874405-1874594 ieee488: bit: "1"
1874594-1874783 ieee488: bit: "1"
1874783-1874974 ieee488: bit: "0"
1874974-1875163 ieee488: bit: "1"
1875163-1875354 ieee488: bit: "0"
1875354-1875543 ieee488: bit: "1"
1875543-1875734 ieee488: bit: "0"
1874107-1875734 ieee488: raw: "56"
1874107-1875734 ieee488: data: "V"
1876213-1876431 ieee488: bit: "1"
1876431-1876620 ieee488: bit: "1"
1876620-1876811 ieee488: bit: "0"
1876811-1877002 ieee488: bit: "0"
1877002-1877191 ieee488: bit: "1"
1877191-1877380 ieee488: bit: "1"
1877380-1877571 ieee488: bit: "0"
1877571-1877762 ieee488: bit: "0"
1876136-1877762 ieee488: raw: "33"
1876136-1877762 ieee488: data: "3"
1878495-1878715 ieee488: bit: "0"
1878715-1878904 ieee488: bit: "1"
1878904-1879093 ieee488: bit: "1"
1879093-1879282 ieee488: bit: "1"
1879282-1879473 ieee488: bit: "0"
1879473-1879662 ieee488: bit: "1"
1879662-1879853 ieee488: bit: "0"
1879853-1880044 ieee488: bit: "0"
1878419-1880044 ieee488: raw: "2e"
1878419-1880044 ieee488: data: "."
1880523-1880743 ieee488: bit: "0"
1880743-1880934 ieee488: bit: "0"
1880934-1881125 ieee488: bit: "0"
1881125-1881316 ieee488: bit: "0"
1881316-1881505 ieee488: bit: "1"
1881505-1881694 ieee488: bit: "1"
1881694-1881885 ieee488: bit: "0"
1881885-1882076 ieee488: bit: "0"
1880446-1882076 ieee488: raw: "30"
1880446-1882076 ieee488: data: "0"
1882555-1882775 ieee488: bit: "0"
1882775-1882966 ieee488: bit: "0"
1882966-1883158 ieee488: bit: "0"
1883158-1883349 ieee488: bit: "0"
1883349-1883540 ieee488: bit: "0"
1883540-1883729 ieee488: bit: "1"
1883729-1883920 ieee488: bit: "0"
1883920-1884111 ieee488: bit: "0"
1882478-1884111 ieee488: raw: "20"
1882478-1884111 ieee488: data: " "
1884590-1884808 ieee488: bit: "1"
1884808-1884999 ieee488: bit: "0"
1884999-1885190 ieee488: bit: "0"
1885190-1885381 ieee488: bit: "0"
1885381-1885570 ieee488: bit: "1"
1885570-1885759 ieee488: bit: "1"
1885759-1885950 ieee488: bit: "0"
1885950-1886141 ieee488: bit: "0"
1884513-1886141 ieee488: raw: "31"
1884513-1886141 ieee488: data: "1"
1886874-1887092 ieee488: bit: "1"
1887092-1887283 ieee488: bit: "0"
1887283-1887472 ieee488: bit: "1"
1887472-1887663 ieee488: bit: "0"
1887663-1887852 ieee488: bit: "1"
1887852-1888041 ieee488: bit: "1"
1888041-1888232 ieee488: bit: "0"
1888232-1888423 ieee488: bit: "0"
1886816-1888423 ieee488: raw: "35"
1886816-1888423 ieee488: data: "5"
1888902-1889120 ieee488: bit: "1"
1889120-1889309 ieee488: bit: "1"
1889309-1889498 ieee488: bit: "1"
1889498-1889689 ieee488: bit: "0"
1889689-1889878 ieee488: bit: "1"
1889878-1890067 ieee488: bit: "1"
1890067-1890258 ieee488: bit: "0"
1890258-1890449 ieee488: bit: "0"
1888818-1890449 ieee488: raw: "37"
1888818-1890449 ieee488: data: "7"
1890991-1891209 ieee488: bit: "1"
1891209-1891400 ieee488: bit: "0"
1891400-1891591 ieee488: bit: "0"
1891591-1891782 ieee488: bit: "0"
1891782-1891971 ieee488: bit: "1"
1891971-1892160 ieee488: bit: "1"
1892160-1892351 ieee488: bit: "0"
1892351-1892542 ieee488: bit: "0"
1890940-1892542 ieee488: raw: "31"
1890940-1892542 ieee488: data: "1"
1893032-1893252 ieee488: bit: "0"
1893252-1893443 ieee488: bit: "0"
1893443-1893633 ieee488: bit: "1"
1893633-1893822 ieee488: bit: "1"
1893822-1894013 ieee488: bit: "0"
1894013-1894202 ieee488: bit: "1"
1894202-1894393 ieee488: bit: "0"
1894393-1894584 ieee488: bit: "0"
1892980-1894584 ieee488: raw: "2c"
1892980-1894584 ieee488: data: ","
1895369-1895589 ieee488: bit: "0"
1895589-1895780 ieee488: bit: "0"
1895780-1895971 ieee488: bit: "0"
1895971-1896162 ieee488: bit: "0"
1896162-1896351 ieee488: bit: "1"
1896351-1896540 ieee488: bit: "1"
1896540-1896731 ieee488: bit: "0"
1896731-1896922 ieee488: bit: "0"
1895300-1896922 ieee488: raw: "30"
1895300-1896922 ieee488: data: "0"
1897401-1897621 ieee488: bit: "0"
1897621-1897812 ieee488: bit: "0"
1897812-1898003 ieee488: bit: "0"
1898003-1898194 ieee488: bit: "0"
1898194-1898383 ieee488: bit: "1"
1898383-1898572 ieee488: bit: "1"
1898572-1898763 ieee488: bit: "0"
1898763-1898954 ieee488: bit: "0"
1897324-1898954 ieee488: raw: "30"
1897324-1898954 ieee488: data: "0"
1899433-1899653 ieee488: bit: "0"
1899653-1899844 ieee488: bit: "0"
1899844-1900033 ieee488: bit: "1"
1900033-1900222 ieee488: bit: "1"
1900222-1900413 ieee488: bit: "0"
1900413-1900602 ieee488: bit: "1"
1900602-1900793 ieee488: bit: "0"
1900793-1900984 ieee488: bit: "0"
1899355-1900984 ieee488: raw: "2c"
1899355-1900984 ieee488: data: ","
1901463-1901683 ieee488: bit: "0"
1901683-1901874 ieee488: bit: "0"
1901874-1902065 ieee488: bit: "0"
1902065-1902256 ieee488: bit: "0"
1902256-1902445 ieee488: bit: "1"
1902445-1902634 ieee488: bit: "1"
1902634-1902825 ieee488: bit: "0"
1902825-1903016 ieee488: bit: "0"
1901386-1903016 ieee488: raw: "30"
1901386-1903016 ieee488: data: "0"
1903874-1904094 ieee488: bit: "0"
1904094-1904285 ieee488: bit: "0"
1904285-1904476 ieee488: bit: "0"
1904476-1904667 ieee488: bit: "0"
1904667-1904856 ieee488: bit: "1"
1904856-1905045 ieee488: bit: "1"
1905045-1905236 ieee488: bit: "0"
1905236-1905427 ieee488: bit: "0"
1903819-1905427 ieee488: raw: "30"
1903819-1905427 ieee488: data: "0"
1906991-1907283 ieee488: bit: "1"
1907283-1907474 ieee488: bit: "0"
1907474-1907663 ieee488: bit: "1"
1907663-1907852 ieee488: bit: "1"
1907852-1908043 ieee488: bit: "0"
1908043-1908234 ieee488: bit: "0"
1908234-1908425 ieee488: bit: "0"
1908425-1908616 ieee488: bit: "0"
1906420-1908616 ieee488: raw: "0d"
1906420-1908616 ieee488: data: "[CR]"
1906921-1908616 ieee488: eoi: "EOI"
1850886-1908616 ieee488: text: "73,CBM DOS V3.0 1571,00,00[CR]"
1916146-1916239 ieee488: bit: "1"
1916239-1916332 ieee488: bit: "1"
1916332-1916426 ieee488: bit: "1"
1916426-1916519 ieee488: bit: "1"
1916519-1916612 ieee488: bit: "1"
1916612-1916707 ieee488: bit: "0"
1916707-1916800 ieee488: bit: "1"
1916800-1916895 ieee488: bit: "0"
1916131-1916895 ieee488: raw: "/5f"
1916131-1916895 ieee488: cmd: "Untalk" "UNT"
