109-123 ieee488: raw: "/3f"
109-123 ieee488: cmd: "Unlisten" "UNL"
154-168 ieee488: raw: "/2a"
154-168 ieee488: laddr: "Listen 10" "L 10" "L:"
199-213 ieee488: raw: "/40"
199-213 ieee488: taddr: "Talk 0" "T 0" "T0"
247-261 ieee488: raw: "2a"
247-261 ieee488: data: "*"
278-292 ieee488: raw: "69"
278-292 ieee488: data: "i"
312-326 ieee488: raw: "64"
312-326 ieee488: data: "d"
343-357 ieee488: raw: "6e"
343-357 ieee488: data: "n"
380-393 ieee488: raw: "3f"
380-393 ieee488: data: "?"
419-433 ieee488: raw: "0d"
419-433 ieee488: data: "[CR]"
458-472 ieee488: raw: "0a"
458-472 ieee488: data: "[LF]"
247-472 ieee488: text: "*idn?[CR][LF]"
520-535 ieee488: raw: "/3f"
520-535 ieee488: cmd: "Unlisten" "UNL"
565-579 ieee488: raw: "/5f"
565-579 ieee488: cmd: "Untalk" "UNT"
634-648 ieee488: raw: "/3f"
634-648 ieee488: cmd: "Unlisten" "UNL"
679-693 ieee488: raw: "/4a"
679-693 ieee488: taddr: "Talk 10" "T 10" "T:"
724-738 ieee488: raw: "/20"
724-738 ieee488: laddr: "Listen 0" "L 0" "L0"
9016-9022 ieee488: raw: "48"
9016-9022 ieee488: data: "H"
9077-9083 ieee488: raw: "45"
9077-9083 ieee488: data: "E"
9167-9173 ieee488: raw: "57"
9167-9173 ieee488: data: "W"
9203-9207 ieee488: raw: "4c"
9203-9207 ieee488: data: "L"
9231-9241 ieee488: raw: "45"
9231-9241 ieee488: data: "E"
9310-9315 ieee488: raw: "54"
9310-9315 ieee488: data: "T"
9346-9352 ieee488: raw: "54"
9346-9352 ieee488: data: "T"
9382-9388 ieee488: raw: "2d"
9382-9388 ieee488: data: "-"
9413-9422 ieee488: raw: "50"
9413-9422 ieee488: data: "P"
9488-9494 ieee488: raw: "41"
9488-9494 ieee488: data: "A"
9524-9531 ieee488: raw: "43"
9524-9531 ieee488: data: "C"
9564-9571 ieee488: raw: "4b"
9564-9571 ieee488: data: "K"
9604-9610 ieee488: raw: "41"
9604-9610 ieee488: data: "A"
9634-9644 ieee488: raw: "52"
9634-9644 ieee488: data: "R"
9710-9715 ieee488: raw: "44"
9710-9715 ieee488: data: "D"
9748-9752 ieee488: raw: "2c"
9748-9752 ieee488: data: ","
9878-9884 ieee488: raw: "33"
9878-9884 ieee488: data: "3"
9939-9945 ieee488: raw: "33"
9939-9945 ieee488: data: "3"
10005-10012 ieee488: raw: "31"
10005-10012 ieee488: data: "1"
10095-10099 ieee488: raw: "32"
10095-10099 ieee488: data: "2"
10131-10136 ieee488: raw: "30"
10131-10136 ieee488: data: "0"
10171-10175 ieee488: raw: "41"
10171-10175 ieee488: data: "A"
10200-10209 ieee488: raw: "2c"
10200-10209 ieee488: data: ","
10277-10283 ieee488: raw: "30"
10277-10283 ieee488: data: "0"
10317-10323 ieee488: raw: "2c"
10317-10323 ieee488: data: ","
10347-10357 ieee488: raw: "37"
10347-10357 ieee488: data: "7"
10423-10428 ieee488: raw: "2e"
10423-10428 ieee488: data: "."
10459-10465 ieee488: raw: "30"
10459-10465 ieee488: data: "0"
10499-10504 ieee488: raw: "2d"
10499-10504 ieee488: data: "-"
10539-10547 ieee488: raw: "35"
10539-10547 ieee488: data: "5"
10571-10581 ieee488: raw: "2e"
10571-10581 ieee488: data: "."
10647-10652 ieee488: raw: "30"
10647-10652 ieee488: data: "0"
10771-10777 ieee488: raw: "2d"
10771-10777 ieee488: data: "-"
10822-10827 ieee488: raw: "31"
10822-10827 ieee488: data: "1"
10887-10893 ieee488: raw: "2e"
10887-10893 ieee488: data: "."
10977-10983 ieee488: raw: "30"
10977-10983 ieee488: data: "0"
11007-11017 ieee488: raw: "0a"
11007-11017 ieee488: data: "[LF]"
9016-11017 ieee488: text: "HEWLETT-PACKARD,33120A,0,7.0-5.0-1.0[LF]"
10995-11067 ieee488: eoi: "EOI"
11086-11100 ieee488: raw: "/3f"
11086-11100 ieee488: cmd: "Unlisten" "UNL"
11131-11145 ieee488: raw: "/5f"
11131-11145 ieee488: cmd: "Untalk" "UNT"
