175-189 ieee488: raw: "/3f"
175-189 ieee488: cmd: "Unlisten" "UNL"
220-234 ieee488: raw: "/3e"
220-234 ieee488: laddr: "Listen 30" "L 30" "LN"
265-279 ieee488: raw: "/40"
265-279 ieee488: taddr: "Talk 0" "T 0" "T0"
316-330 ieee488: raw: "2a"
316-330 ieee488: data: "*"
347-361 ieee488: raw: "69"
347-361 ieee488: data: "i"
378-392 ieee488: raw: "64"
378-392 ieee488: data: "d"
409-423 ieee488: raw: "6e"
409-423 ieee488: data: "n"
440-454 ieee488: raw: "3f"
440-454 ieee488: data: "?"
510-524 ieee488: raw: "0d"
510-524 ieee488: data: "[CR]"
540-554 ieee488: raw: "0a"
540-554 ieee488: data: "[LF]"
316-554 ieee488: text: "*idn?[CR][LF]"
603-617 ieee488: raw: "/3f"
603-617 ieee488: cmd: "Unlisten" "UNL"
648-662 ieee488: raw: "/5f"
648-662 ieee488: cmd: "Untalk" "UNT"
716-730 ieee488: raw: "/3f"
716-730 ieee488: cmd: "Unlisten" "UNL"
761-775 ieee488: raw: "/5e"
761-775 ieee488: taddr: "Talk 30" "T 30" "TN"
806-824 ieee488: raw: "/20"
806-824 ieee488: laddr: "Listen 0" "L 0" "L0"
1306-1311 ieee488: raw: "48"
1306-1311 ieee488: data: "H"
1339-1348 ieee488: raw: "45"
1339-1348 ieee488: data: "E"
1373-1382 ieee488: raw: "57"
1373-1382 ieee488: data: "W"
1407-1416 ieee488: raw: "4c"
1407-1416 ieee488: data: "L"
1499-1504 ieee488: raw: "45"
1499-1504 ieee488: data: "E"
1528-1538 ieee488: raw: "54"
1528-1538 ieee488: data: "T"
1562-1572 ieee488: raw: "54"
1562-1572 ieee488: data: "T"
1596-1606 ieee488: raw: "2d"
1596-1606 ieee488: data: "-"
1631-1640 ieee488: raw: "50"
1631-1640 ieee488: data: "P"
1665-1674 ieee488: raw: "41"
1665-1674 ieee488: data: "A"
1699-1708 ieee488: raw: "43"
1699-1708 ieee488: data: "C"
1733-1742 ieee488: raw: "4b"
1733-1742 ieee488: data: "K"
1767-1777 ieee488: raw: "41"
1767-1777 ieee488: data: "A"
1801-1811 ieee488: raw: "52"
1801-1811 ieee488: data: "R"
1835-1848 ieee488: raw: "44"
1835-1848 ieee488: data: "D"
1872-1882 ieee488: raw: "2c"
1872-1882 ieee488: data: ","
1906-1916 ieee488: raw: "35"
1906-1916 ieee488: data: "5"
1987-1993 ieee488: raw: "33"
1987-1993 ieee488: data: "3"
2017-2027 ieee488: raw: "31"
2017-2027 ieee488: data: "1"
2051-2061 ieee488: raw: "33"
2051-2061 ieee488: data: "3"
2085-2095 ieee488: raw: "31"
2085-2095 ieee488: data: "1"
2119-2129 ieee488: raw: "41"
2119-2129 ieee488: data: "A"
2154-2163 ieee488: raw: "2c"
2154-2163 ieee488: data: ","
2188-2197 ieee488: raw: "30"
2188-2197 ieee488: data: "0"
2222-2231 ieee488: raw: "2c"
2222-2231 ieee488: data: ","
2256-2265 ieee488: raw: "33"
2256-2265 ieee488: data: "3"
2290-2300 ieee488: raw: "34"
2290-2300 ieee488: data: "4"
2324-2334 ieee488: raw: "32"
2324-2334 ieee488: data: "2"
2361-2371 ieee488: raw: "37"
2361-2371 ieee488: data: "7"
2599-2604 ieee488: raw: "0a"
2599-2604 ieee488: data: "[LF]"
1306-2604 ieee488: text: "HEWLETT-PACKARD,53131A,0,3427[LF]"
2598-2651 ieee488: eoi: "EOI"
2670-2684 ieee488: raw: "/3f"
2670-2684 ieee488: cmd: "Unlisten" "UNL"
2715-2729 ieee488: raw: "/5f"
2715-2729 ieee488: cmd: "Untalk" "UNT"
1480194-1480208 ieee488: raw: "/3f"
1480194-1480208 ieee488: cmd: "Unlisten" "UNL"
1480239-1480253 ieee488: raw: "/3e"
1480239-1480253 ieee488: laddr: "Listen 30" "L 30" "LN"
1480284-1480298 ieee488: raw: "/40"
1480284-1480298 ieee488: taddr: "Talk 0" "T 0" "T0"
1480332-1480346 ieee488: raw: "72"
1480332-1480346 ieee488: data: "r"
1480363-1480377 ieee488: raw: "65"
1480363-1480377 ieee488: data: "e"
1480394-1480408 ieee488: raw: "61"
1480394-1480408 ieee488: data: "a"
1480425-1480439 ieee488: raw: "64"
1480425-1480439 ieee488: data: "d"
1480456-1480470 ieee488: raw: "3f"
1480456-1480470 ieee488: data: "?"
1480536-1480550 ieee488: raw: "0d"
1480536-1480550 ieee488: data: "[CR]"
1480570-1480584 ieee488: raw: "0a"
1480570-1480584 ieee488: data: "[LF]"
1480332-1480584 ieee488: text: "read?[CR][LF]"
1480636-1480650 ieee488: raw: "/3f"
1480636-1480650 ieee488: cmd: "Unlisten" "UNL"
1480681-1480695 ieee488: raw: "/5f"
1480681-1480695 ieee488: cmd: "Untalk" "UNT"
1480749-1480763 ieee488: raw: "/3f"
1480749-1480763 ieee488: cmd: "Unlisten" "UNL"
1480794-1480808 ieee488: raw: "/5e"
1480794-1480808 ieee488: taddr: "Talk 30" "T 30" "TN"
1480839-1480853 ieee488: raw: "/20"
1480839-1480853 ieee488: laddr: "Listen 0" "L 0" "L0"
1840052-1840058 ieee488: raw: "2b"
1840052-1840058 ieee488: data: "+"
1840083-1840095 ieee488: raw: "39"
1840083-1840095 ieee488: data: "9"
1840120-1840129 ieee488: raw: "2e"
1840120-1840129 ieee488: data: "."
1840154-1840163 ieee488: raw: "39"
1840154-1840163 ieee488: data: "9"
1840188-1840197 ieee488: raw: "39"
1840188-1840197 ieee488: data: "9"
1840222-1840231 ieee488: raw: "39"
1840222-1840231 ieee488: data: "9"
1840256-1840266 ieee488: raw: "39"
1840256-1840266 ieee488: data: "9"
1840290-1840300 ieee488: raw: "37"
1840290-1840300 ieee488: data: "7"
1840324-1840334 ieee488: raw: "38"
1840324-1840334 ieee488: data: "8"
1840424-1840429 ieee488: raw: "34"
1840424-1840429 ieee488: data: "4"
1840453-1840463 ieee488: raw: "30"
1840453-1840463 ieee488: data: "0"
1840487-1840497 ieee488: raw: "45"
1840487-1840497 ieee488: data: "E"
1840521-1840531 ieee488: raw: "2b"
1840521-1840531 ieee488: data: "+"
1840555-1840568 ieee488: raw: "30"
1840555-1840568 ieee488: data: "0"
1840595-1840605 ieee488: raw: "30"
1840595-1840605 ieee488: data: "0"
1840630-1840639 ieee488: raw: "36"
1840630-1840639 ieee488: data: "6"
1840754-1840758 ieee488: raw: "0a"
1840754-1840758 ieee488: data: "[LF]"
1840052-1840758 ieee488: text: "+9.99997840E+006[LF]"
1840753-1840805 ieee488: eoi: "EOI"
1840824-1840838 ieee488: raw: "/3f"
1840824-1840838 ieee488: cmd: "Unlisten" "UNL"
1840869-1840883 ieee488: raw: "/5f"
1840869-1840883 ieee488: cmd: "Untalk" "UNT"
