1082998-1083012 ieee488: raw: "/3f"
1082998-1083012 ieee488: cmd: "Unlisten" "UNL"
1083043-1083089 ieee488: raw: "/37"
1083043-1083089 ieee488: laddr: "Listen 23" "L 23" "LG"
1083120-1083134 ieee488: raw: "/40"
1083120-1083134 ieee488: taddr: "Talk 0" "T 0" "T0"
1083168-1083182 ieee488: raw: "2a"
1083168-1083182 ieee488: data: "*"
1083224-1083238 ieee488: raw: "69"
1083224-1083238 ieee488: data: "i"
1083312-1083326 ieee488: raw: "64"
1083312-1083326 ieee488: data: "d"
1083422-1083436 ieee488: raw: "6e"
1083422-1083436 ieee488: data: "n"
1083507-1083521 ieee488: raw: "3f"
1083507-1083521 ieee488: data: "?"
1083593-1083607 ieee488: raw: "0d"
1083593-1083607 ieee488: data: "[CR]"
1083673-1083687 ieee488: raw: "0a"
1083673-1083687 ieee488: data: "[LF]"
1083168-1083687 ieee488: text: "*idn?[CR][LF]"
1083736-1083750 ieee488: raw: "/3f"
1083736-1083750 ieee488: cmd: "Unlisten" "UNL"
1083780-1083795 ieee488: raw: "/5f"
1083780-1083795 ieee488: cmd: "Untalk" "UNT"
1083849-1083863 ieee488: raw: "/3f"
1083849-1083863 ieee488: cmd: "Unlisten" "UNL"
1083897-1083964 ieee488: raw: "/57"
1083897-1083964 ieee488: taddr: "Talk 23" "T 23" "TG"
1083995-1084009 ieee488: raw: "/20"
1083995-1084009 ieee488: laddr: "Listen 0" "L 0" "L0"
1086234-1086239 ieee488: raw: "4b"
1086234-1086239 ieee488: data: "K"
1086309-1086315 ieee488: raw: "45"
1086309-1086315 ieee488: data: "E"
1086419-1086424 ieee488: raw: "49"
1086419-1086424 ieee488: data: "I"
1086501-1086506 ieee488: raw: "54"
1086501-1086506 ieee488: data: "T"
1086584-1086588 ieee488: raw: "48"
1086584-1086588 ieee488: data: "H"
1086666-1086673 ieee488: raw: "4c"
1086666-1086673 ieee488: data: "L"
1086749-1086755 ieee488: raw: "45"
1086749-1086755 ieee488: data: "E"
1086831-1086837 ieee488: raw: "59"
1086831-1086837 ieee488: data: "Y"
1086940-1086946 ieee488: raw: "20"
1086940-1086946 ieee488: data: " "
1087023-1087028 ieee488: raw: "49"
1087023-1087028 ieee488: data: "I"
1087105-1087112 ieee488: raw: "4e"
1087105-1087112 ieee488: data: "N"
1087188-1087195 ieee488: raw: "53"
1087188-1087195 ieee488: data: "S"
1087270-1087276 ieee488: raw: "54"
1087270-1087276 ieee488: data: "T"
1087353-1087358 ieee488: raw: "52"
1087353-1087358 ieee488: data: "R"
1087462-1087467 ieee488: raw: "55"
1087462-1087467 ieee488: data: "U"
1087545-1087549 ieee488: raw: "4d"
1087545-1087549 ieee488: data: "M"
1087627-1087634 ieee488: raw: "45"
1087627-1087634 ieee488: data: "E"
1087710-1087716 ieee488: raw: "4e"
1087710-1087716 ieee488: data: "N"
1087792-1087798 ieee488: raw: "54"
1087792-1087798 ieee488: data: "T"
1087874-1087880 ieee488: raw: "53"
1087874-1087880 ieee488: data: "S"
1087984-1087989 ieee488: raw: "20"
1087984-1087989 ieee488: data: " "
1088066-1088073 ieee488: raw: "49"
1088066-1088073 ieee488: data: "I"
1088149-1088155 ieee488: raw: "4e"
1088149-1088155 ieee488: data: "N"
1088231-1088237 ieee488: raw: "43"
1088231-1088237 ieee488: data: "C"
1088314-1088319 ieee488: raw: "2e"
1088314-1088319 ieee488: data: "."
1088423-1088428 ieee488: raw: "2c"
1088423-1088428 ieee488: data: ","
1088506-1088513 ieee488: raw: "4d"
1088506-1088513 ieee488: data: "M"
1088588-1088595 ieee488: raw: "4f"
1088588-1088595 ieee488: data: "O"
1088671-1088676 ieee488: raw: "44"
1088671-1088676 ieee488: data: "D"
1088753-1088759 ieee488: raw: "45"
1088753-1088759 ieee488: data: "E"
1088835-1088841 ieee488: raw: "4c"
1088835-1088841 ieee488: data: "L"
1088945-1088950 ieee488: raw: "20"
1088945-1088950 ieee488: data: " "
1089027-1089034 ieee488: raw: "32"
1089027-1089034 ieee488: data: "2"
1089110-1089116 ieee488: raw: "30"
1089110-1089116 ieee488: data: "0"
1089192-1089198 ieee488: raw: "31"
1089192-1089198 ieee488: data: "1"
1089275-1089280 ieee488: raw: "35"
1089275-1089280 ieee488: data: "5"
1089357-1089362 ieee488: raw: "2c"
1089357-1089362 ieee488: data: ","
1089467-1089474 ieee488: raw: "30"
1089467-1089474 ieee488: data: "0"
1089549-1089555 ieee488: raw: "39"
1089549-1089555 ieee488: data: "9"
1089632-1089637 ieee488: raw: "39"
1089632-1089637 ieee488: data: "9"
1089714-1089719 ieee488: raw: "33"
1089714-1089719 ieee488: data: "3"
1089796-1089802 ieee488: raw: "31"
1089796-1089802 ieee488: data: "1"
1089879-1089887 ieee488: raw: "39"
1089879-1089887 ieee488: data: "9"
1089988-1089995 ieee488: raw: "30"
1089988-1089995 ieee488: data: "0"
1090071-1090077 ieee488: raw: "2c"
1090071-1090077 ieee488: data: ","
1090153-1090159 ieee488: raw: "42"
1090153-1090159 ieee488: data: "B"
1090236-1090241 ieee488: raw: "31"
1090236-1090241 ieee488: data: "1"
1090318-1090323 ieee488: raw: "35"
1090318-1090323 ieee488: data: "5"
1090428-1090435 ieee488: raw: "20"
1090428-1090435 ieee488: data: " "
1090510-1090516 ieee488: raw: "20"
1090510-1090516 ieee488: data: " "
1090593-1090598 ieee488: raw: "2f"
1090593-1090598 ieee488: data: "/"
1090675-1090680 ieee488: raw: "41"
1090675-1090680 ieee488: data: "A"
1090758-1090765 ieee488: raw: "30"
1090758-1090765 ieee488: data: "0"
1090840-1090844 ieee488: raw: "32"
1090840-1090844 ieee488: data: "2"
1090949-1090956 ieee488: raw: "20"
1090949-1090956 ieee488: data: " "
1091032-1091038 ieee488: raw: "20"
1091032-1091038 ieee488: data: " "
1096778-1096785 ieee488: raw: "0a"
1096778-1096785 ieee488: data: "[LF]"
1086234-1096785 ieee488: text: "KEITHLEY INSTRUMENTS INC.,MODEL 2015,0993190,B15  /A02  [LF]"
1096776-1096831 ieee488: eoi: "EOI"
1096851-1096865 ieee488: raw: "/3f"
1096851-1096865 ieee488: cmd: "Unlisten" "UNL"
1096899-1096916 ieee488: raw: "/5f"
1096899-1096916 ieee488: cmd: "Untalk" "UNT"
