0-3 ieee488: raw: "/3f"
0-3 ieee488: cmd: "Unlisten" "UNL"
9-11 ieee488: raw: "/5f"
9-11 ieee488: cmd: "Untalk" "UNT"
18-20 ieee488: raw: "/24"
18-20 ieee488: laddr: "Listen 4" "L 4" "L4"
25-27 ieee488: raw: "49"
25-27 ieee488: data: "I"
4031-4033 ieee488: raw: "44"
4031-4033 ieee488: data: "D"
5843-5845 ieee488: raw: "0a"
5843-5845 ieee488: data: "[LF]"
4034-5845 ieee488: eoi: "EOI"
25-5845 ieee488: text: "ID[LF]"
5852-5854 ieee488: raw: "/3f"
5852-5854 ieee488: cmd: "Unlisten" "UNL"
5860-5863 ieee488: raw: "/5f"
5860-5863 ieee488: cmd: "Untalk" "UNT"
5869-5871 ieee488: raw: "/44"
5869-5871 ieee488: taddr: "Talk 4" "T 4" "T4"
14830-14834 ieee488: raw: "48"
14830-14834 ieee488: data: "H"
15417-15421 ieee488: raw: "50"
15417-15421 ieee488: data: "P"
15536-15541 ieee488: raw: "31"
15536-15541 ieee488: data: "1"
15656-15660 ieee488: raw: "36"
15656-15660 ieee488: data: "6"
15775-15779 ieee488: raw: "33"
15775-15779 ieee488: data: "3"
15895-15899 ieee488: raw: "31"
15895-15899 ieee488: data: "1"
16106-16111 ieee488: raw: "44"
16106-16111 ieee488: data: "D"
14830-16111 ieee488: text: "HP1631D"
16106-16121 ieee488: eoi: "EOI"
16123-16126 ieee488: raw: "/3f"
16123-16126 ieee488: cmd: "Unlisten" "UNL"
16130-16133 ieee488: raw: "/5f"
16130-16133 ieee488: cmd: "Untalk" "UNT"
