6431698-6431702 jtag: select-dr-scan: "SELECT-DR-SCAN"
6431702-6431706 jtag: select-ir-scan: "SELECT-IR-SCAN"
6431706-6431710 jtag: capture-ir: "CAPTURE-IR"
6431710-6431715 jtag: shift-ir: "SHIFT-IR"
6431710-6431715 jtag: bit-tdi: "0"
6431710-6431715 jtag: bit-tdo: "1"
6431715-6431719 jtag: shift-ir: "SHIFT-IR"
6431715-6431719 jtag: bit-tdi: "0"
6431715-6431719 jtag: bit-tdo: "1"
6431719-6431723 jtag: shift-ir: "SHIFT-IR"
6431719-6431723 jtag: bit-tdi: "1"
6431719-6431723 jtag: bit-tdo: "0"
6431723-6431727 jtag: shift-ir: "SHIFT-IR"
6431710-6431727 jtag: bitstring-tdi: "IR TDI: 1100 (0xc), 4 bits"
6431723-6431727 jtag: bit-tdi: "1"
6431710-6431727 jtag: bitstring-tdo: "IR TDO: 0011 (0x3), 4 bits"
6431723-6431727 jtag: bit-tdo: "0"
6431727-6431731 jtag: exit1-ir: "EXIT1-IR"
6431731-6431735 jtag: update-ir: "UPDATE-IR"
6431735-6432799 jtag: run-test/idle: "RUN-TEST/IDLE"
6432799-6432803 jtag: select-dr-scan: "SELECT-DR-SCAN"
6432803-6432807 jtag: capture-dr: "CAPTURE-DR"
6432807-6432812 jtag: shift-dr: "SHIFT-DR"
6432807-6432812 jtag: bit-tdi: "0"
6432807-6432812 jtag: bit-tdo: "1"
6432812-6432816 jtag: shift-dr: "SHIFT-DR"
6432812-6432816 jtag: bit-tdi: "0"
6432812-6432816 jtag: bit-tdo: "1"
6432816-6432820 jtag: shift-dr: "SHIFT-DR"
6432816-6432820 jtag: bit-tdi: "0"
6432816-6432820 jtag: bit-tdo: "0"
6432820-6432824 jtag: shift-dr: "SHIFT-DR"
6432820-6432824 jtag: bit-tdi: "0"
6432820-6432824 jtag: bit-tdo: "0"
6432824-6432828 jtag: shift-dr: "SHIFT-DR"
6432824-6432828 jtag: bit-tdi: "0"
6432824-6432828 jtag: bit-tdo: "0"
6432828-6432832 jtag: shift-dr: "SHIFT-DR"
6432828-6432832 jtag: bit-tdi: "0"
6432828-6432832 jtag: bit-tdo: "1"
6432832-6432836 jtag: shift-dr: "SHIFT-DR"
6432832-6432836 jtag: bit-tdi: "0"
6432832-6432836 jtag: bit-tdo: "1"
6432836-6432840 jtag: shift-dr: "SHIFT-DR"
6432836-6432840 jtag: bit-tdi: "0"
6432836-6432840 jtag: bit-tdo: "0"
6432840-6432844 jtag: shift-dr: "SHIFT-DR"
6432840-6432844 jtag: bit-tdi: "0"
6432840-6432844 jtag: bit-tdo: "0"
6432844-6432848 jtag: shift-dr: "SHIFT-DR"
6432844-6432848 jtag: bit-tdi: "0"
6432844-6432848 jtag: bit-tdo: "0"
6432848-6432852 jtag: shift-dr: "SHIFT-DR"
6432848-6432852 jtag: bit-tdi: "0"
6432848-6432852 jtag: bit-tdo: "0"
6432852-6432856 jtag: shift-dr: "SHIFT-DR"
6432852-6432856 jtag: bit-tdi: "0"
6432852-6432856 jtag: bit-tdo: "0"
6432856-6432860 jtag: shift-dr: "SHIFT-DR"
6432856-6432860 jtag: bit-tdi: "0"
6432856-6432860 jtag: bit-tdo: "0"
6432860-6432864 jtag: shift-dr: "SHIFT-DR"
6432860-6432864 jtag: bit-tdi: "0"
6432860-6432864 jtag: bit-tdo: "0"
6432864-6432868 jtag: shift-dr: "SHIFT-DR"
6432864-6432868 jtag: bit-tdi: "0"
6432864-6432868 jtag: bit-tdo: "1"
6432868-6432872 jtag: shift-dr: "SHIFT-DR"
6432868-6432872 jtag: bit-tdi: "0"
6432868-6432872 jtag: bit-tdo: "1"
6432872-6432876 jtag: shift-dr: "SHIFT-DR"
6432872-6432876 jtag: bit-tdi: "0"
6432872-6432876 jtag: bit-tdo: "0"
6432876-6432880 jtag: shift-dr: "SHIFT-DR"
6432876-6432880 jtag: bit-tdi: "0"
6432876-6432880 jtag: bit-tdo: "0"
6432880-6432884 jtag: shift-dr: "SHIFT-DR"
6432880-6432884 jtag: bit-tdi: "0"
6432880-6432884 jtag: bit-tdo: "1"
6432884-6432888 jtag: shift-dr: "SHIFT-DR"
6432884-6432888 jtag: bit-tdi: "0"
6432884-6432888 jtag: bit-tdo: "0"
6432888-6432892 jtag: shift-dr: "SHIFT-DR"
6432888-6432892 jtag: bit-tdi: "0"
6432888-6432892 jtag: bit-tdo: "0"
6432892-6432896 jtag: shift-dr: "SHIFT-DR"
6432892-6432896 jtag: bit-tdi: "0"
6432892-6432896 jtag: bit-tdo: "1"
6432896-6432900 jtag: shift-dr: "SHIFT-DR"
6432896-6432900 jtag: bit-tdi: "0"
6432896-6432900 jtag: bit-tdo: "0"
6432900-6432904 jtag: shift-dr: "SHIFT-DR"
6432900-6432904 jtag: bit-tdi: "0"
6432900-6432904 jtag: bit-tdo: "0"
6432904-6432909 jtag: shift-dr: "SHIFT-DR"
6432904-6432909 jtag: bit-tdi: "0"
6432904-6432909 jtag: bit-tdo: "1"
6432909-6432913 jtag: shift-dr: "SHIFT-DR"
6432909-6432913 jtag: bit-tdi: "0"
6432909-6432913 jtag: bit-tdo: "1"
6432913-6432917 jtag: shift-dr: "SHIFT-DR"
6432913-6432917 jtag: bit-tdi: "0"
6432913-6432917 jtag: bit-tdo: "1"
6432917-6432921 jtag: shift-dr: "SHIFT-DR"
6432917-6432921 jtag: bit-tdi: "0"
6432917-6432921 jtag: bit-tdo: "1"
6432921-6432925 jtag: shift-dr: "SHIFT-DR"
6432921-6432925 jtag: bit-tdi: "0"
6432921-6432925 jtag: bit-tdo: "0"
6432925-6432929 jtag: shift-dr: "SHIFT-DR"
6432925-6432929 jtag: bit-tdi: "0"
6432925-6432929 jtag: bit-tdo: "0"
6432929-6432933 jtag: shift-dr: "SHIFT-DR"
6432929-6432933 jtag: bit-tdi: "0"
6432929-6432933 jtag: bit-tdo: "0"
6432933-6432937 jtag: shift-dr: "SHIFT-DR"
6432807-6432937 jtag: bitstring-tdi: "DR TDI: 00000000000000000000000000000000 (0x0), 32 bits"
6432933-6432937 jtag: bit-tdi: "0"
6432807-6432937 jtag: bitstring-tdo: "DR TDO: 00001111001001001100000001100011 (0xf24c063), 32 bits"
6432933-6432937 jtag: bit-tdo: "0"
6432937-6432941 jtag: exit1-dr: "EXIT1-DR"
6432941-6432946 jtag: pause-dr: "PAUSE-DR"
6432946-6432950 jtag: exit2-dr: "EXIT2-DR"
6432950-6432954 jtag: update-dr: "UPDATE-DR"
