12754326-12754329 jtag: select-dr-scan: "SELECT-DR-SCAN"
12754329-12754331 jtag: select-ir-scan: "SELECT-IR-SCAN"
12754331-12754334 jtag: capture-ir: "CAPTURE-IR"
12754334-12754337 jtag: shift-ir: "SHIFT-IR"
12754337-12754340 jtag: shift-ir: "SHIFT-IR"
12754337-12754340 jtag: bit-tdi: "0"
12754337-12754340 jtag: bit-tdo: "1"
12754340-12754343 jtag: shift-ir: "SHIFT-IR"
12754340-12754343 jtag: bit-tdi: "1"
12754340-12754343 jtag: bit-tdo: "0"
12754343-12754346 jtag: shift-ir: "SHIFT-IR"
12754343-12754346 jtag: bit-tdi: "1"
12754343-12754346 jtag: bit-tdo: "0"
12754346-12754349 jtag: exit1-ir: "EXIT1-IR"
12754346-12754349 jtag: bit-tdi: "1"
12754346-12754349 jtag: bit-tdo: "0"
12754337-12754349 jtag: bitstring-tdi: "IR TDI: 1110 (0xe), 4 bits"
12754337-12754349 jtag: bitstring-tdo: "IR TDO: 0001 (0x1), 4 bits"
12754349-12754351 jtag: update-ir: "UPDATE-IR"
12754351-12755247 jtag: run-test/idle: "RUN-TEST/IDLE"
12755247-12755250 jtag: select-dr-scan: "SELECT-DR-SCAN"
12755250-12755253 jtag: capture-dr: "CAPTURE-DR"
12755253-12755256 jtag: shift-dr: "SHIFT-DR"
12755256-12755259 jtag: shift-dr: "SHIFT-DR"
12755256-12755259 jtag: bit-tdi: "0"
12755256-12755259 jtag: bit-tdo: "1"
12755259-12755261 jtag: shift-dr: "SHIFT-DR"
12755259-12755261 jtag: bit-tdi: "0"
12755259-12755261 jtag: bit-tdo: "1"
12755261-12755264 jtag: shift-dr: "SHIFT-DR"
12755261-12755264 jtag: bit-tdi: "0"
12755261-12755264 jtag: bit-tdo: "1"
12755264-12755267 jtag: shift-dr: "SHIFT-DR"
12755264-12755267 jtag: bit-tdi: "0"
12755264-12755267 jtag: bit-tdo: "1"
12755267-12755269 jtag: shift-dr: "SHIFT-DR"
12755267-12755269 jtag: bit-tdi: "0"
12755267-12755269 jtag: bit-tdo: "0"
12755269-12755272 jtag: shift-dr: "SHIFT-DR"
12755269-12755272 jtag: bit-tdi: "0"
12755269-12755272 jtag: bit-tdo: "0"
12755272-12755275 jtag: shift-dr: "SHIFT-DR"
12755272-12755275 jtag: bit-tdi: "0"
12755272-12755275 jtag: bit-tdo: "0"
12755275-12755278 jtag: shift-dr: "SHIFT-DR"
12755275-12755278 jtag: bit-tdi: "0"
12755275-12755278 jtag: bit-tdo: "0"
12755278-12755280 jtag: shift-dr: "SHIFT-DR"
12755278-12755280 jtag: bit-tdi: "0"
12755278-12755280 jtag: bit-tdo: "1"
12755280-12755283 jtag: shift-dr: "SHIFT-DR"
12755280-12755283 jtag: bit-tdi: "0"
12755280-12755283 jtag: bit-tdo: "1"
12755283-12755286 jtag: shift-dr: "SHIFT-DR"
12755283-12755286 jtag: bit-tdi: "0"
12755283-12755286 jtag: bit-tdo: "1"
12755286-12755288 jtag: shift-dr: "SHIFT-DR"
12755286-12755288 jtag: bit-tdi: "0"
12755286-12755288 jtag: bit-tdo: "1"
12755288-12755291 jtag: shift-dr: "SHIFT-DR"
12755288-12755291 jtag: bit-tdi: "0"
12755288-12755291 jtag: bit-tdo: "0"
12755291-12755294 jtag: shift-dr: "SHIFT-DR"
12755291-12755294 jtag: bit-tdi: "0"
12755291-12755294 jtag: bit-tdo: "0"
12755294-12755296 jtag: shift-dr: "SHIFT-DR"
12755294-12755296 jtag: bit-tdi: "0"
12755294-12755296 jtag: bit-tdo: "0"
12755296-12755299 jtag: shift-dr: "SHIFT-DR"
12755296-12755299 jtag: bit-tdi: "0"
12755296-12755299 jtag: bit-tdo: "0"
12755299-12755302 jtag: shift-dr: "SHIFT-DR"
12755299-12755302 jtag: bit-tdi: "0"
12755299-12755302 jtag: bit-tdo: "1"
12755302-12755304 jtag: shift-dr: "SHIFT-DR"
12755302-12755304 jtag: bit-tdi: "0"
12755302-12755304 jtag: bit-tdo: "1"
12755304-12755307 jtag: shift-dr: "SHIFT-DR"
12755304-12755307 jtag: bit-tdi: "0"
12755304-12755307 jtag: bit-tdo: "1"
12755307-12755310 jtag: shift-dr: "SHIFT-DR"
12755307-12755310 jtag: bit-tdi: "0"
12755307-12755310 jtag: bit-tdo: "1"
12755310-12755312 jtag: shift-dr: "SHIFT-DR"
12755310-12755312 jtag: bit-tdi: "0"
12755310-12755312 jtag: bit-tdo: "1"
12755312-12755315 jtag: shift-dr: "SHIFT-DR"
12755312-12755315 jtag: bit-tdi: "0"
12755312-12755315 jtag: bit-tdo: "0"
12755315-12755318 jtag: shift-dr: "SHIFT-DR"
12755315-12755318 jtag: bit-tdi: "0"
12755315-12755318 jtag: bit-tdo: "0"
12755318-12755321 jtag: shift-dr: "SHIFT-DR"
12755318-12755321 jtag: bit-tdi: "0"
12755318-12755321 jtag: bit-tdo: "0"
12755321-12755324 jtag: shift-dr: "SHIFT-DR"
12755321-12755324 jtag: bit-tdi: "0"
12755321-12755324 jtag: bit-tdo: "1"
12755324-12755326 jtag: shift-dr: "SHIFT-DR"
12755324-12755326 jtag: bit-tdi: "0"
12755324-12755326 jtag: bit-tdo: "1"
12755326-12755329 jtag: shift-dr: "SHIFT-DR"
12755326-12755329 jtag: bit-tdi: "0"
12755326-12755329 jtag: bit-tdo: "1"
12755329-12755332 jtag: shift-dr: "SHIFT-DR"
12755329-12755332 jtag: bit-tdi: "0"
12755329-12755332 jtag: bit-tdo: "1"
12755332-12755334 jtag: shift-dr: "SHIFT-DR"
12755332-12755334 jtag: bit-tdi: "0"
12755332-12755334 jtag: bit-tdo: "0"
12755334-12755337 jtag: shift-dr: "SHIFT-DR"
12755334-12755337 jtag: bit-tdi: "0"
12755334-12755337 jtag: bit-tdo: "0"
12755337-12755340 jtag: shift-dr: "SHIFT-DR"
12755337-12755340 jtag: bit-tdi: "0"
12755337-12755340 jtag: bit-tdo: "1"
12755340-12755343 jtag: exit1-dr: "EXIT1-DR"
12755340-12755343 jtag: bit-tdi: "0"
12755340-12755343 jtag: bit-tdo: "0"
12755343-12755346 jtag: pause-dr: "PAUSE-DR"
12755346-12755349 jtag: exit2-dr: "EXIT2-DR"
12755256-12755349 jtag: bitstring-tdi: "DR TDI: 00000000000000000000000000000000 (0x0), 32 bits"
12755256-12755349 jtag: bitstring-tdo: "DR TDO: 01001111000111110000111100001111 (0x4f1f0f0f), 32 bits"
12755349-12755352 jtag: update-dr: "UPDATE-DR"
