4554176-4554180 jtag: select-dr-scan: "SELECT-DR-SCAN"
4554180-4554184 jtag: select-ir-scan: "SELECT-IR-SCAN"
4554184-4554188 jtag: capture-ir: "CAPTURE-IR"
4554188-4554193 jtag: shift-ir: "SHIFT-IR"
4554188-4554193 jtag: bit-tdi: "0"
4554188-4554193 jtag: bit-tdo: "1"
4554193-4554197 jtag: shift-ir: "SHIFT-IR"
4554193-4554197 jtag: bit-tdi: "0"
4554193-4554197 jtag: bit-tdo: "1"
4554197-4554201 jtag: shift-ir: "SHIFT-IR"
4554197-4554201 jtag: bit-tdi: "1"
4554197-4554201 jtag: bit-tdo: "0"
4554201-4554205 jtag: shift-ir: "SHIFT-IR"
4554201-4554205 jtag: bit-tdi: "1"
4554201-4554205 jtag: bit-tdo: "0"
4554205-4554209 jtag: shift-ir: "SHIFT-IR"
4554205-4554209 jtag: bit-tdi: "1"
4554205-4554209 jtag: bit-tdo: "0"
4554209-4554213 jtag: shift-ir: "SHIFT-IR"
4554209-4554213 jtag: bit-tdi: "1"
4554209-4554213 jtag: bit-tdo: "1"
4554213-4554217 jtag: shift-ir: "SHIFT-IR"
4554213-4554217 jtag: bit-tdi: "1"
4554213-4554217 jtag: bit-tdo: "1"
4554217-4554221 jtag: shift-ir: "SHIFT-IR"
4554217-4554221 jtag: bit-tdi: "1"
4554217-4554221 jtag: bit-tdo: "1"
4554221-4554225 jtag: shift-ir: "SHIFT-IR"
4554188-4554225 jtag: bitstring-tdi: "IR TDI: 111111100 (0x1fc), 9 bits"
4554221-4554225 jtag: bit-tdi: "1"
4554188-4554225 jtag: bitstring-tdo: "IR TDO: 111100011 (0x1e3), 9 bits"
4554221-4554225 jtag: bit-tdo: "1"
4554225-4554229 jtag: exit1-ir: "EXIT1-IR"
4554229-4554233 jtag: update-ir: "UPDATE-IR"
4554233-4554593 jtag: run-test/idle: "RUN-TEST/IDLE"
4554593-4554597 jtag: select-dr-scan: "SELECT-DR-SCAN"
4554597-4554601 jtag: capture-dr: "CAPTURE-DR"
4554601-4554606 jtag: shift-dr: "SHIFT-DR"
4554601-4554606 jtag: bit-tdi: "0"
4554601-4554606 jtag: bit-tdo: "1"
4554606-4554610 jtag: shift-dr: "SHIFT-DR"
4554606-4554610 jtag: bit-tdi: "0"
4554606-4554610 jtag: bit-tdo: "1"
4554610-4554614 jtag: shift-dr: "SHIFT-DR"
4554610-4554614 jtag: bit-tdi: "0"
4554610-4554614 jtag: bit-tdo: "1"
4554614-4554618 jtag: shift-dr: "SHIFT-DR"
4554614-4554618 jtag: bit-tdi: "0"
4554614-4554618 jtag: bit-tdo: "1"
4554618-4554622 jtag: shift-dr: "SHIFT-DR"
4554618-4554622 jtag: bit-tdi: "0"
4554618-4554622 jtag: bit-tdo: "0"
4554622-4554626 jtag: shift-dr: "SHIFT-DR"
4554622-4554626 jtag: bit-tdi: "0"
4554622-4554626 jtag: bit-tdo: "1"
4554626-4554630 jtag: shift-dr: "SHIFT-DR"
4554626-4554630 jtag: bit-tdi: "0"
4554626-4554630 jtag: bit-tdo: "1"
4554630-4554634 jtag: shift-dr: "SHIFT-DR"
4554630-4554634 jtag: bit-tdi: "0"
4554630-4554634 jtag: bit-tdo: "1"
4554634-4554638 jtag: shift-dr: "SHIFT-DR"
4554634-4554638 jtag: bit-tdi: "0"
4554634-4554638 jtag: bit-tdo: "0"
4554638-4554642 jtag: shift-dr: "SHIFT-DR"
4554638-4554642 jtag: bit-tdi: "0"
4554638-4554642 jtag: bit-tdo: "0"
4554642-4554646 jtag: shift-dr: "SHIFT-DR"
4554642-4554646 jtag: bit-tdi: "0"
4554642-4554646 jtag: bit-tdo: "0"
4554646-4554650 jtag: shift-dr: "SHIFT-DR"
4554646-4554650 jtag: bit-tdi: "0"
4554646-4554650 jtag: bit-tdo: "1"
4554650-4554654 jtag: shift-dr: "SHIFT-DR"
4554650-4554654 jtag: bit-tdi: "0"
4554650-4554654 jtag: bit-tdo: "0"
4554654-4554658 jtag: shift-dr: "SHIFT-DR"
4554654-4554658 jtag: bit-tdi: "0"
4554654-4554658 jtag: bit-tdo: "0"
4554658-4554662 jtag: shift-dr: "SHIFT-DR"
4554658-4554662 jtag: bit-tdi: "0"
4554658-4554662 jtag: bit-tdo: "0"
4554662-4554666 jtag: shift-dr: "SHIFT-DR"
4554662-4554666 jtag: bit-tdi: "0"
4554662-4554666 jtag: bit-tdo: "0"
4554666-4554670 jtag: shift-dr: "SHIFT-DR"
4554666-4554670 jtag: bit-tdi: "0"
4554666-4554670 jtag: bit-tdo: "0"
4554670-4554674 jtag: shift-dr: "SHIFT-DR"
4554670-4554674 jtag: bit-tdi: "0"
4554670-4554674 jtag: bit-tdo: "0"
4554674-4554678 jtag: shift-dr: "SHIFT-DR"
4554674-4554678 jtag: bit-tdi: "0"
4554674-4554678 jtag: bit-tdo: "0"
4554678-4554682 jtag: shift-dr: "SHIFT-DR"
4554678-4554682 jtag: bit-tdi: "0"
4554678-4554682 jtag: bit-tdo: "0"
4554682-4554686 jtag: shift-dr: "SHIFT-DR"
4554682-4554686 jtag: bit-tdi: "0"
4554682-4554686 jtag: bit-tdo: "0"
4554686-4554690 jtag: shift-dr: "SHIFT-DR"
4554686-4554690 jtag: bit-tdi: "0"
4554686-4554690 jtag: bit-tdo: "0"
4554690-4554694 jtag: shift-dr: "SHIFT-DR"
4554690-4554694 jtag: bit-tdi: "0"
4554690-4554694 jtag: bit-tdo: "1"
4554694-4554698 jtag: shift-dr: "SHIFT-DR"
4554694-4554698 jtag: bit-tdi: "0"
4554694-4554698 jtag: bit-tdo: "0"
4554698-4554702 jtag: shift-dr: "SHIFT-DR"
4554698-4554702 jtag: bit-tdi: "0"
4554698-4554702 jtag: bit-tdo: "1"
4554702-4554706 jtag: shift-dr: "SHIFT-DR"
4554702-4554706 jtag: bit-tdi: "0"
4554702-4554706 jtag: bit-tdo: "1"
4554706-4554710 jtag: shift-dr: "SHIFT-DR"
4554706-4554710 jtag: bit-tdi: "0"
4554706-4554710 jtag: bit-tdo: "1"
4554710-4554714 jtag: shift-dr: "SHIFT-DR"
4554710-4554714 jtag: bit-tdi: "0"
4554710-4554714 jtag: bit-tdo: "0"
4554714-4554718 jtag: shift-dr: "SHIFT-DR"
4554714-4554718 jtag: bit-tdi: "0"
4554714-4554718 jtag: bit-tdo: "1"
4554718-4554722 jtag: shift-dr: "SHIFT-DR"
4554718-4554722 jtag: bit-tdi: "0"
4554718-4554722 jtag: bit-tdo: "1"
4554722-4554726 jtag: shift-dr: "SHIFT-DR"
4554722-4554726 jtag: bit-tdi: "0"
4554722-4554726 jtag: bit-tdo: "1"
4554726-4554730 jtag: shift-dr: "SHIFT-DR"
4554726-4554730 jtag: bit-tdi: "0"
4554726-4554730 jtag: bit-tdo: "0"
4554730-4554735 jtag: shift-dr: "SHIFT-DR"
4554601-4554735 jtag: bitstring-tdi: "DR TDI: 000000000000000000000000000000000 (0x0), 33 bits"
4554730-4554735 jtag: bit-tdi: "0"
4554601-4554735 jtag: bitstring-tdo: "DR TDO: 001110111010000000000100011101111 (0x774008ef), 33 bits"
4554730-4554735 jtag: bit-tdo: "0"
4554735-4554739 jtag: exit1-dr: "EXIT1-DR"
4554739-4554744 jtag: pause-dr: "PAUSE-DR"
4554744-4554748 jtag: exit2-dr: "EXIT2-DR"
4554748-4554752 jtag: update-dr: "UPDATE-DR"
