1355-1360 rgb_led_ws281x: bit: "0"
1360-1365 rgb_led_ws281x: bit: "0"
1365-1371 rgb_led_ws281x: bit: "0"
1371-1376 rgb_led_ws281x: bit: "0"
1376-1381 rgb_led_ws281x: bit: "0"
1381-1386 rgb_led_ws281x: bit: "0"
1386-1391 rgb_led_ws281x: bit: "0"
1391-1397 rgb_led_ws281x: bit: "0"
1397-1402 rgb_led_ws281x: bit: "0"
1402-1407 rgb_led_ws281x: bit: "0"
1407-1412 rgb_led_ws281x: bit: "0"
1412-1417 rgb_led_ws281x: bit: "0"
1417-1423 rgb_led_ws281x: bit: "0"
1423-1428 rgb_led_ws281x: bit: "0"
1428-1433 rgb_led_ws281x: bit: "0"
1433-1438 rgb_led_ws281x: bit: "0"
1438-1443 rgb_led_ws281x: bit: "0"
1443-1449 rgb_led_ws281x: bit: "0"
1449-1454 rgb_led_ws281x: bit: "0"
1454-1459 rgb_led_ws281x: bit: "0"
1459-1464 rgb_led_ws281x: bit: "0"
1464-1469 rgb_led_ws281x: bit: "0"
1469-1475 rgb_led_ws281x: bit: "0"
1475-1480 rgb_led_ws281x: bit: "0"
1480-1485 rgb_led_ws281x: bit: "0"
1485-1490 rgb_led_ws281x: bit: "0"
1490-1495 rgb_led_ws281x: bit: "0"
1495-1501 rgb_led_ws281x: bit: "0"
1501-1506 rgb_led_ws281x: bit: "0"
1506-1511 rgb_led_ws281x: bit: "0"
1511-1516 rgb_led_ws281x: bit: "0"
1516-1521 rgb_led_ws281x: bit: "0"
1355-1521 rgb_led_ws281x: rgb: "#00000000"
1521-1526 rgb_led_ws281x: bit: "0"
1526-1532 rgb_led_ws281x: bit: "0"
1532-1537 rgb_led_ws281x: bit: "1"
1537-1542 rgb_led_ws281x: bit: "1"
1542-1547 rgb_led_ws281x: bit: "1"
1547-1552 rgb_led_ws281x: bit: "1"
1552-1557 rgb_led_ws281x: bit: "1"
1557-1563 rgb_led_ws281x: bit: "1"
1563-1568 rgb_led_ws281x: bit: "0"
1568-1573 rgb_led_ws281x: bit: "0"
1573-1578 rgb_led_ws281x: bit: "0"
1578-1583 rgb_led_ws281x: bit: "0"
1583-1589 rgb_led_ws281x: bit: "0"
1589-1594 rgb_led_ws281x: bit: "0"
1594-1599 rgb_led_ws281x: bit: "0"
1599-1604 rgb_led_ws281x: bit: "0"
1604-1609 rgb_led_ws281x: bit: "0"
1609-1615 rgb_led_ws281x: bit: "0"
1615-1620 rgb_led_ws281x: bit: "0"
1620-1625 rgb_led_ws281x: bit: "0"
1625-1630 rgb_led_ws281x: bit: "0"
1630-1635 rgb_led_ws281x: bit: "0"
1635-1641 rgb_led_ws281x: bit: "0"
1641-1646 rgb_led_ws281x: bit: "0"
1646-1651 rgb_led_ws281x: bit: "0"
1651-1656 rgb_led_ws281x: bit: "0"
1656-1661 rgb_led_ws281x: bit: "0"
1661-1666 rgb_led_ws281x: bit: "0"
1666-1672 rgb_led_ws281x: bit: "0"
1672-1677 rgb_led_ws281x: bit: "0"
1677-1682 rgb_led_ws281x: bit: "0"
1682-1687 rgb_led_ws281x: bit: "0"
1521-1687 rgb_led_ws281x: rgb: "#3f000000"
1687-1692 rgb_led_ws281x: bit: "0"
1692-1698 rgb_led_ws281x: bit: "1"
1698-1703 rgb_led_ws281x: bit: "1"
1703-1708 rgb_led_ws281x: bit: "1"
1708-1713 rgb_led_ws281x: bit: "1"
1713-1718 rgb_led_ws281x: bit: "1"
1718-1723 rgb_led_ws281x: bit: "1"
1723-1728 rgb_led_ws281x: bit: "1"
1728-1734 rgb_led_ws281x: bit: "0"
1734-1739 rgb_led_ws281x: bit: "0"
1739-1744 rgb_led_ws281x: bit: "0"
1744-1749 rgb_led_ws281x: bit: "0"
1749-1754 rgb_led_ws281x: bit: "0"
1754-1760 rgb_led_ws281x: bit: "0"
1760-1765 rgb_led_ws281x: bit: "0"
1765-1770 rgb_led_ws281x: bit: "0"
1770-1775 rgb_led_ws281x: bit: "0"
1775-1780 rgb_led_ws281x: bit: "0"
1780-1786 rgb_led_ws281x: bit: "0"
1786-1791 rgb_led_ws281x: bit: "0"
1791-1796 rgb_led_ws281x: bit: "0"
1796-1801 rgb_led_ws281x: bit: "0"
1801-1806 rgb_led_ws281x: bit: "0"
1806-1812 rgb_led_ws281x: bit: "0"
1812-1817 rgb_led_ws281x: bit: "0"
1817-1822 rgb_led_ws281x: bit: "0"
1822-1827 rgb_led_ws281x: bit: "0"
1827-1832 rgb_led_ws281x: bit: "0"
1832-1838 rgb_led_ws281x: bit: "0"
1838-1843 rgb_led_ws281x: bit: "0"
1843-1848 rgb_led_ws281x: bit: "0"
1848-1853 rgb_led_ws281x: bit: "0"
1687-1853 rgb_led_ws281x: rgb: "#7f000000"
1853-1858 rgb_led_ws281x: bit: "1"
1858-1863 rgb_led_ws281x: bit: "1"
1863-1869 rgb_led_ws281x: bit: "1"
1869-1874 rgb_led_ws281x: bit: "1"
1874-1879 rgb_led_ws281x: bit: "1"
1879-1884 rgb_led_ws281x: bit: "1"
1884-1889 rgb_led_ws281x: bit: "1"
1889-1894 rgb_led_ws281x: bit: "1"
1894-1900 rgb_led_ws281x: bit: "0"
1900-1905 rgb_led_ws281x: bit: "0"
1905-1910 rgb_led_ws281x: bit: "0"
1910-1915 rgb_led_ws281x: bit: "0"
1915-1920 rgb_led_ws281x: bit: "0"
1920-1926 rgb_led_ws281x: bit: "0"
1926-1931 rgb_led_ws281x: bit: "0"
1931-1936 rgb_led_ws281x: bit: "0"
1936-1941 rgb_led_ws281x: bit: "0"
1941-1946 rgb_led_ws281x: bit: "0"
1946-1951 rgb_led_ws281x: bit: "0"
1951-1957 rgb_led_ws281x: bit: "0"
1957-1962 rgb_led_ws281x: bit: "0"
1962-1967 rgb_led_ws281x: bit: "0"
1967-1972 rgb_led_ws281x: bit: "0"
1972-1977 rgb_led_ws281x: bit: "0"
1977-1983 rgb_led_ws281x: bit: "0"
1983-1988 rgb_led_ws281x: bit: "0"
1988-1993 rgb_led_ws281x: bit: "0"
1993-1998 rgb_led_ws281x: bit: "0"
1998-2003 rgb_led_ws281x: bit: "0"
2003-2009 rgb_led_ws281x: bit: "0"
2009-2014 rgb_led_ws281x: bit: "0"
1853-2016 rgb_led_ws281x: rgb: "#ff000000"
2014-2016 rgb_led_ws281x: bit: "0"
2016-2217 rgb_led_ws281x: reset: "RESET" "RST" "R"
6105-6110 rgb_led_ws281x: bit: "0"
6110-6115 rgb_led_ws281x: bit: "0"
6115-6120 rgb_led_ws281x: bit: "0"
6120-6125 rgb_led_ws281x: bit: "0"
6125-6131 rgb_led_ws281x: bit: "0"
6131-6136 rgb_led_ws281x: bit: "0"
6136-6141 rgb_led_ws281x: bit: "0"
6141-6146 rgb_led_ws281x: bit: "0"
6146-6151 rgb_led_ws281x: bit: "0"
6151-6157 rgb_led_ws281x: bit: "0"
6157-6162 rgb_led_ws281x: bit: "0"
6162-6167 rgb_led_ws281x: bit: "0"
6167-6172 rgb_led_ws281x: bit: "0"
6172-6177 rgb_led_ws281x: bit: "0"
6177-6183 rgb_led_ws281x: bit: "0"
6183-6188 rgb_led_ws281x: bit: "0"
6188-6193 rgb_led_ws281x: bit: "0"
6193-6198 rgb_led_ws281x: bit: "0"
6198-6203 rgb_led_ws281x: bit: "0"
6203-6209 rgb_led_ws281x: bit: "0"
6209-6214 rgb_led_ws281x: bit: "0"
6214-6219 rgb_led_ws281x: bit: "0"
6219-6224 rgb_led_ws281x: bit: "0"
6224-6229 rgb_led_ws281x: bit: "0"
6229-6234 rgb_led_ws281x: bit: "0"
6234-6240 rgb_led_ws281x: bit: "0"
6240-6245 rgb_led_ws281x: bit: "0"
6245-6250 rgb_led_ws281x: bit: "0"
6250-6255 rgb_led_ws281x: bit: "0"
6255-6261 rgb_led_ws281x: bit: "0"
6261-6266 rgb_led_ws281x: bit: "0"
6266-6271 rgb_led_ws281x: bit: "0"
6105-6271 rgb_led_ws281x: rgb: "#00000000"
6271-6276 rgb_led_ws281x: bit: "0"
6276-6281 rgb_led_ws281x: bit: "0"
6281-6286 rgb_led_ws281x: bit: "0"
6286-6292 rgb_led_ws281x: bit: "0"
6292-6297 rgb_led_ws281x: bit: "0"
6297-6302 rgb_led_ws281x: bit: "0"
6302-6307 rgb_led_ws281x: bit: "0"
6307-6312 rgb_led_ws281x: bit: "0"
6312-6318 rgb_led_ws281x: bit: "0"
6318-6323 rgb_led_ws281x: bit: "0"
6323-6328 rgb_led_ws281x: bit: "0"
6328-6333 rgb_led_ws281x: bit: "0"
6333-6338 rgb_led_ws281x: bit: "0"
6338-6344 rgb_led_ws281x: bit: "0"
6344-6349 rgb_led_ws281x: bit: "0"
6349-6354 rgb_led_ws281x: bit: "0"
6354-6359 rgb_led_ws281x: bit: "0"
6359-6364 rgb_led_ws281x: bit: "0"
6364-6370 rgb_led_ws281x: bit: "1"
6370-6375 rgb_led_ws281x: bit: "1"
6375-6380 rgb_led_ws281x: bit: "1"
6380-6385 rgb_led_ws281x: bit: "1"
6385-6390 rgb_led_ws281x: bit: "1"
6390-6395 rgb_led_ws281x: bit: "1"
6395-6400 rgb_led_ws281x: bit: "0"
6400-6406 rgb_led_ws281x: bit: "0"
6406-6411 rgb_led_ws281x: bit: "0"
6411-6416 rgb_led_ws281x: bit: "0"
6416-6421 rgb_led_ws281x: bit: "0"
6421-6426 rgb_led_ws281x: bit: "0"
6426-6432 rgb_led_ws281x: bit: "0"
6432-6437 rgb_led_ws281x: bit: "0"
6271-6437 rgb_led_ws281x: rgb: "#003f0000"
6437-6442 rgb_led_ws281x: bit: "0"
6442-6447 rgb_led_ws281x: bit: "0"
6447-6452 rgb_led_ws281x: bit: "0"
6452-6458 rgb_led_ws281x: bit: "0"
6458-6463 rgb_led_ws281x: bit: "0"
6463-6468 rgb_led_ws281x: bit: "0"
6468-6473 rgb_led_ws281x: bit: "0"
6473-6478 rgb_led_ws281x: bit: "0"
6478-6484 rgb_led_ws281x: bit: "0"
6484-6489 rgb_led_ws281x: bit: "0"
6489-6494 rgb_led_ws281x: bit: "0"
6494-6499 rgb_led_ws281x: bit: "0"
6499-6504 rgb_led_ws281x: bit: "0"
6504-6510 rgb_led_ws281x: bit: "0"
6510-6515 rgb_led_ws281x: bit: "0"
6515-6520 rgb_led_ws281x: bit: "0"
6520-6525 rgb_led_ws281x: bit: "0"
6525-6530 rgb_led_ws281x: bit: "1"
6530-6535 rgb_led_ws281x: bit: "1"
6535-6541 rgb_led_ws281x: bit: "1"
6541-6546 rgb_led_ws281x: bit: "1"
6546-6551 rgb_led_ws281x: bit: "1"
6551-6556 rgb_led_ws281x: bit: "1"
6556-6561 rgb_led_ws281x: bit: "1"
6561-6566 rgb_led_ws281x: bit: "0"
6566-6572 rgb_led_ws281x: bit: "0"
6572-6577 rgb_led_ws281x: bit: "0"
6577-6582 rgb_led_ws281x: bit: "0"
6582-6587 rgb_led_ws281x: bit: "0"
6587-6592 rgb_led_ws281x: bit: "0"
6592-6598 rgb_led_ws281x: bit: "0"
6598-6603 rgb_led_ws281x: bit: "0"
6437-6603 rgb_led_ws281x: rgb: "#007f0000"
6603-6608 rgb_led_ws281x: bit: "0"
6608-6613 rgb_led_ws281x: bit: "0"
6613-6618 rgb_led_ws281x: bit: "0"
6618-6624 rgb_led_ws281x: bit: "0"
6624-6629 rgb_led_ws281x: bit: "0"
6629-6634 rgb_led_ws281x: bit: "0"
6634-6639 rgb_led_ws281x: bit: "0"
6639-6644 rgb_led_ws281x: bit: "0"
6644-6649 rgb_led_ws281x: bit: "0"
6649-6655 rgb_led_ws281x: bit: "0"
6655-6660 rgb_led_ws281x: bit: "0"
6660-6665 rgb_led_ws281x: bit: "0"
6665-6670 rgb_led_ws281x: bit: "0"
6670-6676 rgb_led_ws281x: bit: "0"
6676-6681 rgb_led_ws281x: bit: "0"
6681-6686 rgb_led_ws281x: bit: "0"
6686-6691 rgb_led_ws281x: bit: "1"
6691-6696 rgb_led_ws281x: bit: "1"
6696-6701 rgb_led_ws281x: bit: "1"
6701-6706 rgb_led_ws281x: bit: "1"
6706-6712 rgb_led_ws281x: bit: "1"
6712-6717 rgb_led_ws281x: bit: "1"
6717-6722 rgb_led_ws281x: bit: "1"
6722-6727 rgb_led_ws281x: bit: "1"
6727-6732 rgb_led_ws281x: bit: "0"
6732-6737 rgb_led_ws281x: bit: "0"
6737-6743 rgb_led_ws281x: bit: "0"
6743-6748 rgb_led_ws281x: bit: "0"
6748-6753 rgb_led_ws281x: bit: "0"
6753-6758 rgb_led_ws281x: bit: "0"
6758-6763 rgb_led_ws281x: bit: "0"
6603-6765 rgb_led_ws281x: rgb: "#00ff0000"
6763-6765 rgb_led_ws281x: bit: "0"
6765-6966 rgb_led_ws281x: reset: "RESET" "RST" "R"
10856-10861 rgb_led_ws281x: bit: "0"
10861-10866 rgb_led_ws281x: bit: "0"
10866-10872 rgb_led_ws281x: bit: "0"
10872-10877 rgb_led_ws281x: bit: "0"
10877-10882 rgb_led_ws281x: bit: "0"
10882-10887 rgb_led_ws281x: bit: "0"
10887-10892 rgb_led_ws281x: bit: "0"
10892-10897 rgb_led_ws281x: bit: "0"
10897-10903 rgb_led_ws281x: bit: "0"
10903-10908 rgb_led_ws281x: bit: "0"
10908-10913 rgb_led_ws281x: bit: "0"
10913-10918 rgb_led_ws281x: bit: "0"
10918-10923 rgb_led_ws281x: bit: "0"
10923-10929 rgb_led_ws281x: bit: "0"
10929-10934 rgb_led_ws281x: bit: "0"
10934-10939 rgb_led_ws281x: bit: "0"
10939-10944 rgb_led_ws281x: bit: "0"
10944-10949 rgb_led_ws281x: bit: "0"
10949-10955 rgb_led_ws281x: bit: "0"
10955-10960 rgb_led_ws281x: bit: "0"
10960-10965 rgb_led_ws281x: bit: "0"
10965-10970 rgb_led_ws281x: bit: "0"
10970-10975 rgb_led_ws281x: bit: "0"
10975-10981 rgb_led_ws281x: bit: "0"
10981-10986 rgb_led_ws281x: bit: "0"
10986-10991 rgb_led_ws281x: bit: "0"
10991-10996 rgb_led_ws281x: bit: "0"
10996-11001 rgb_led_ws281x: bit: "0"
11001-11007 rgb_led_ws281x: bit: "0"
11007-11012 rgb_led_ws281x: bit: "0"
11012-11017 rgb_led_ws281x: bit: "0"
11017-11022 rgb_led_ws281x: bit: "0"
10856-11022 rgb_led_ws281x: rgb: "#00000000"
11022-11027 rgb_led_ws281x: bit: "0"
11027-11033 rgb_led_ws281x: bit: "0"
11033-11038 rgb_led_ws281x: bit: "0"
11038-11043 rgb_led_ws281x: bit: "0"
11043-11048 rgb_led_ws281x: bit: "0"
11048-11053 rgb_led_ws281x: bit: "0"
11053-11059 rgb_led_ws281x: bit: "0"
11059-11064 rgb_led_ws281x: bit: "0"
11064-11069 rgb_led_ws281x: bit: "0"
11069-11074 rgb_led_ws281x: bit: "0"
11074-11079 rgb_led_ws281x: bit: "0"
11079-11085 rgb_led_ws281x: bit: "0"
11085-11090 rgb_led_ws281x: bit: "0"
11090-11095 rgb_led_ws281x: bit: "0"
11095-11100 rgb_led_ws281x: bit: "0"
11100-11105 rgb_led_ws281x: bit: "0"
11105-11111 rgb_led_ws281x: bit: "0"
11111-11116 rgb_led_ws281x: bit: "0"
11116-11121 rgb_led_ws281x: bit: "0"
11121-11126 rgb_led_ws281x: bit: "0"
11126-11131 rgb_led_ws281x: bit: "0"
11131-11137 rgb_led_ws281x: bit: "0"
11137-11142 rgb_led_ws281x: bit: "0"
11142-11147 rgb_led_ws281x: bit: "0"
11147-11152 rgb_led_ws281x: bit: "0"
11152-11157 rgb_led_ws281x: bit: "0"
11157-11162 rgb_led_ws281x: bit: "1"
11162-11168 rgb_led_ws281x: bit: "1"
11168-11173 rgb_led_ws281x: bit: "1"
11173-11178 rgb_led_ws281x: bit: "1"
11178-11183 rgb_led_ws281x: bit: "1"
11183-11188 rgb_led_ws281x: bit: "1"
11022-11188 rgb_led_ws281x: rgb: "#0000003f"
11188-11193 rgb_led_ws281x: bit: "0"
11193-11199 rgb_led_ws281x: bit: "0"
11199-11204 rgb_led_ws281x: bit: "0"
11204-11209 rgb_led_ws281x: bit: "0"
11209-11214 rgb_led_ws281x: bit: "0"
11214-11219 rgb_led_ws281x: bit: "0"
11219-11225 rgb_led_ws281x: bit: "0"
11225-11230 rgb_led_ws281x: bit: "0"
11230-11235 rgb_led_ws281x: bit: "0"
11235-11240 rgb_led_ws281x: bit: "0"
11240-11245 rgb_led_ws281x: bit: "0"
11245-11251 rgb_led_ws281x: bit: "0"
11251-11256 rgb_led_ws281x: bit: "0"
11256-11261 rgb_led_ws281x: bit: "0"
11261-11266 rgb_led_ws281x: bit: "0"
11266-11271 rgb_led_ws281x: bit: "0"
11271-11276 rgb_led_ws281x: bit: "0"
11276-11282 rgb_led_ws281x: bit: "0"
11282-11287 rgb_led_ws281x: bit: "0"
11287-11292 rgb_led_ws281x: bit: "0"
11292-11297 rgb_led_ws281x: bit: "0"
11297-11302 rgb_led_ws281x: bit: "0"
11302-11308 rgb_led_ws281x: bit: "0"
11308-11313 rgb_led_ws281x: bit: "0"
11313-11318 rgb_led_ws281x: bit: "0"
11318-11323 rgb_led_ws281x: bit: "1"
11323-11328 rgb_led_ws281x: bit: "1"
11328-11333 rgb_led_ws281x: bit: "1"
11333-11339 rgb_led_ws281x: bit: "1"
11339-11344 rgb_led_ws281x: bit: "1"
11344-11349 rgb_led_ws281x: bit: "1"
11349-11354 rgb_led_ws281x: bit: "1"
11188-11354 rgb_led_ws281x: rgb: "#0000007f"
11354-11359 rgb_led_ws281x: bit: "0"
11359-11364 rgb_led_ws281x: bit: "0"
11364-11370 rgb_led_ws281x: bit: "0"
11370-11375 rgb_led_ws281x: bit: "0"
11375-11380 rgb_led_ws281x: bit: "0"
11380-11385 rgb_led_ws281x: bit: "0"
11385-11390 rgb_led_ws281x: bit: "0"
11390-11396 rgb_led_ws281x: bit: "0"
11396-11401 rgb_led_ws281x: bit: "0"
11401-11406 rgb_led_ws281x: bit: "0"
11406-11411 rgb_led_ws281x: bit: "0"
11411-11416 rgb_led_ws281x: bit: "0"
11416-11422 rgb_led_ws281x: bit: "0"
11422-11427 rgb_led_ws281x: bit: "0"
11427-11432 rgb_led_ws281x: bit: "0"
11432-11437 rgb_led_ws281x: bit: "0"
11437-11442 rgb_led_ws281x: bit: "0"
11442-11448 rgb_led_ws281x: bit: "0"
11448-11453 rgb_led_ws281x: bit: "0"
11453-11458 rgb_led_ws281x: bit: "0"
11458-11463 rgb_led_ws281x: bit: "0"
11463-11468 rgb_led_ws281x: bit: "0"
11468-11474 rgb_led_ws281x: bit: "0"
11474-11479 rgb_led_ws281x: bit: "0"
11479-11484 rgb_led_ws281x: bit: "1"
11484-11489 rgb_led_ws281x: bit: "1"
11489-11494 rgb_led_ws281x: bit: "1"
11494-11499 rgb_led_ws281x: bit: "1"
11499-11504 rgb_led_ws281x: bit: "1"
11504-11510 rgb_led_ws281x: bit: "1"
11510-11515 rgb_led_ws281x: bit: "1"
11354-11518 rgb_led_ws281x: rgb: "#000000ff"
11515-11518 rgb_led_ws281x: bit: "1"
11518-11719 rgb_led_ws281x: reset: "RESET" "RST" "R"
15634-15640 rgb_led_ws281x: bit: "0"
15640-15645 rgb_led_ws281x: bit: "0"
15645-15650 rgb_led_ws281x: bit: "0"
15650-15655 rgb_led_ws281x: bit: "0"
15655-15660 rgb_led_ws281x: bit: "0"
15660-15666 rgb_led_ws281x: bit: "0"
15666-15671 rgb_led_ws281x: bit: "0"
15671-15676 rgb_led_ws281x: bit: "0"
15676-15681 rgb_led_ws281x: bit: "0"
15681-15686 rgb_led_ws281x: bit: "0"
15686-15691 rgb_led_ws281x: bit: "0"
15691-15697 rgb_led_ws281x: bit: "0"
15697-15702 rgb_led_ws281x: bit: "0"
15702-15707 rgb_led_ws281x: bit: "0"
15707-15712 rgb_led_ws281x: bit: "0"
15712-15717 rgb_led_ws281x: bit: "0"
15717-15723 rgb_led_ws281x: bit: "0"
15723-15728 rgb_led_ws281x: bit: "0"
15728-15733 rgb_led_ws281x: bit: "0"
15733-15738 rgb_led_ws281x: bit: "0"
15738-15743 rgb_led_ws281x: bit: "0"
15743-15749 rgb_led_ws281x: bit: "0"
15749-15754 rgb_led_ws281x: bit: "0"
15754-15759 rgb_led_ws281x: bit: "0"
15759-15764 rgb_led_ws281x: bit: "0"
15764-15769 rgb_led_ws281x: bit: "0"
15769-15775 rgb_led_ws281x: bit: "0"
15775-15780 rgb_led_ws281x: bit: "0"
15780-15785 rgb_led_ws281x: bit: "0"
15785-15790 rgb_led_ws281x: bit: "0"
15790-15795 rgb_led_ws281x: bit: "0"
15795-15801 rgb_led_ws281x: bit: "0"
15634-15801 rgb_led_ws281x: rgb: "#00000000"
15801-15806 rgb_led_ws281x: bit: "0"
15806-15811 rgb_led_ws281x: bit: "0"
15811-15816 rgb_led_ws281x: bit: "0"
15816-15821 rgb_led_ws281x: bit: "0"
15821-15827 rgb_led_ws281x: bit: "0"
15827-15832 rgb_led_ws281x: bit: "0"
15832-15837 rgb_led_ws281x: bit: "0"
15837-15842 rgb_led_ws281x: bit: "0"
15842-15847 rgb_led_ws281x: bit: "0"
15847-15853 rgb_led_ws281x: bit: "0"
15853-15858 rgb_led_ws281x: bit: "1"
15858-15863 rgb_led_ws281x: bit: "1"
15863-15868 rgb_led_ws281x: bit: "1"
15868-15873 rgb_led_ws281x: bit: "1"
15873-15878 rgb_led_ws281x: bit: "1"
15878-15883 rgb_led_ws281x: bit: "1"
15883-15889 rgb_led_ws281x: bit: "0"
15889-15894 rgb_led_ws281x: bit: "0"
15894-15899 rgb_led_ws281x: bit: "0"
15899-15904 rgb_led_ws281x: bit: "0"
15904-15909 rgb_led_ws281x: bit: "0"
15909-15915 rgb_led_ws281x: bit: "0"
15915-15920 rgb_led_ws281x: bit: "0"
15920-15925 rgb_led_ws281x: bit: "0"
15925-15930 rgb_led_ws281x: bit: "0"
15930-15935 rgb_led_ws281x: bit: "0"
15935-15941 rgb_led_ws281x: bit: "0"
15941-15946 rgb_led_ws281x: bit: "0"
15946-15951 rgb_led_ws281x: bit: "0"
15951-15956 rgb_led_ws281x: bit: "0"
15956-15961 rgb_led_ws281x: bit: "0"
15961-15967 rgb_led_ws281x: bit: "0"
15801-15967 rgb_led_ws281x: rgb: "#00003f00"
15967-15972 rgb_led_ws281x: bit: "0"
15972-15977 rgb_led_ws281x: bit: "0"
15977-15982 rgb_led_ws281x: bit: "0"
15982-15987 rgb_led_ws281x: bit: "0"
15987-15993 rgb_led_ws281x: bit: "0"
15993-15998 rgb_led_ws281x: bit: "0"
15998-16003 rgb_led_ws281x: bit: "0"
16003-16008 rgb_led_ws281x: bit: "0"
16008-16013 rgb_led_ws281x: bit: "0"
16013-16018 rgb_led_ws281x: bit: "1"
16018-16024 rgb_led_ws281x: bit: "1"
16024-16029 rgb_led_ws281x: bit: "1"
16029-16034 rgb_led_ws281x: bit: "1"
16034-16039 rgb_led_ws281x: bit: "1"
16039-16044 rgb_led_ws281x: bit: "1"
16044-16049 rgb_led_ws281x: bit: "1"
16049-16054 rgb_led_ws281x: bit: "0"
16054-16060 rgb_led_ws281x: bit: "0"
16060-16065 rgb_led_ws281x: bit: "0"
16065-16070 rgb_led_ws281x: bit: "0"
16070-16075 rgb_led_ws281x: bit: "0"
16075-16081 rgb_led_ws281x: bit: "0"
16081-16086 rgb_led_ws281x: bit: "0"
16086-16091 rgb_led_ws281x: bit: "0"
16091-16096 rgb_led_ws281x: bit: "0"
16096-16101 rgb_led_ws281x: bit: "0"
16101-16106 rgb_led_ws281x: bit: "0"
16106-16112 rgb_led_ws281x: bit: "0"
16112-16117 rgb_led_ws281x: bit: "0"
16117-16122 rgb_led_ws281x: bit: "0"
16122-16127 rgb_led_ws281x: bit: "0"
16127-16132 rgb_led_ws281x: bit: "0"
15967-16132 rgb_led_ws281x: rgb: "#00007f00"
16132-16138 rgb_led_ws281x: bit: "0"
16138-16143 rgb_led_ws281x: bit: "0"
16143-16148 rgb_led_ws281x: bit: "0"
16148-16153 rgb_led_ws281x: bit: "0"
16153-16158 rgb_led_ws281x: bit: "0"
16158-16164 rgb_led_ws281x: bit: "0"
16164-16169 rgb_led_ws281x: bit: "0"
16169-16174 rgb_led_ws281x: bit: "0"
16174-16179 rgb_led_ws281x: bit: "1"
16179-16184 rgb_led_ws281x: bit: "1"
16184-16189 rgb_led_ws281x: bit: "1"
16189-16195 rgb_led_ws281x: bit: "1"
16195-16200 rgb_led_ws281x: bit: "1"
16200-16205 rgb_led_ws281x: bit: "1"
16205-16210 rgb_led_ws281x: bit: "1"
16210-16215 rgb_led_ws281x: bit: "1"
16215-16220 rgb_led_ws281x: bit: "0"
16220-16226 rgb_led_ws281x: bit: "0"
16226-16231 rgb_led_ws281x: bit: "0"
16231-16236 rgb_led_ws281x: bit: "0"
16236-16241 rgb_led_ws281x: bit: "0"
16241-16246 rgb_led_ws281x: bit: "0"
16246-16252 rgb_led_ws281x: bit: "0"
16252-16257 rgb_led_ws281x: bit: "0"
16257-16262 rgb_led_ws281x: bit: "0"
16262-16267 rgb_led_ws281x: bit: "0"
16267-16272 rgb_led_ws281x: bit: "0"
16272-16278 rgb_led_ws281x: bit: "0"
16278-16283 rgb_led_ws281x: bit: "0"
16283-16288 rgb_led_ws281x: bit: "0"
16288-16293 rgb_led_ws281x: bit: "0"
16132-16295 rgb_led_ws281x: rgb: "#0000ff00"
16293-16295 rgb_led_ws281x: bit: "0"
16295-16496 rgb_led_ws281x: reset: "RESET" "RST" "R"
