2-3 z80: warn: "Illegal transition between control states"
5-8 z80: memrd: "0A"
6-9 z80: addr: "01AF"
8-10 z80: memrd: "F4"
9-13 z80: addr: "F40A"
10-15 z80: memrd: "38"
13-16 z80: addr: "F40B"
10-17 z80: instr: "JR C,$+9"
15-17 z80: memrd: "07"
16-22 z80: addr: "F40C"
17-23 z80: instr: "DEC BC"
17-23 z80: memrd: "0B"
22-26 z80: addr: "F40D"
23-27 z80: instr: "LD A,B"
23-27 z80: memrd: "78"
26-30 z80: addr: "F40E"
27-31 z80: instr: "OR C"
27-31 z80: memrd: "B1"
30-34 z80: addr: "F40F"
31-36 z80: memrd: "20"
34-42 z80: addr: "F410"
31-43 z80: instr: "JR NZ,$-8"
36-43 z80: memrd: "F6"
42-46 z80: addr: "F407"
43-48 z80: memrd: "CD"
46-49 z80: addr: "F408"
48-51 z80: memrd: "7F"
49-54 z80: addr: "F409"
43-55 z80: instr: "CALL 0E37Fh"
51-55 z80: memrd: "E3"
54-57 z80: addr: "01AF"
55-58 z80: memwr: "F4"
57-59 z80: addr: "01AE"
55-60 z80: wop: "F40A"
58-60 z80: memwr: "0A"
59-63 z80: addr: "E37F"
60-65 z80: memrd: "CD"
63-66 z80: addr: "E380"
65-68 z80: memrd: "74"
66-71 z80: addr: "E381"
60-72 z80: instr: "CALL 0E374h"
68-72 z80: memrd: "E3"
71-74 z80: addr: "01AD"
72-75 z80: memwr: "E3"
74-76 z80: addr: "01AC"
72-77 z80: wop: "E382"
75-77 z80: memwr: "82"
76-80 z80: addr: "E374"
77-81 z80: instr: "OR A"
77-81 z80: memrd: "B7"
80-84 z80: addr: "E375"
81-85 z80: memrd: "DD"
84-88 z80: addr: "E376"
85-90 z80: memrd: "CB"
88-91 z80: addr: "E377"
90-93 z80: memrd: "08"
91-96 z80: addr: "E378"
81-98 z80: instr: "BIT 0,(IX+8)"
93-98 z80: memrd: "46"
96-100 z80: addr: "01F8"
98-101 z80: rop: "80"
98-101 z80: memrd: "80"
100-105 z80: addr: "E379"
101-107 z80: instr: "RET Z"
101-107 z80: memrd: "C8"
105-108 z80: addr: "01AC"
107-110 z80: memrd: "82"
108-111 z80: addr: "01AD"
107-112 z80: rop: "E382"
110-112 z80: memrd: "E3"
111-116 z80: addr: "E382"
112-118 z80: instr: "RET NC"
112-118 z80: memrd: "D0"
116-119 z80: addr: "01AE"
118-121 z80: memrd: "0A"
119-122 z80: addr: "01AF"
118-123 z80: rop: "F40A"
121-123 z80: memrd: "F4"
122-126 z80: addr: "F40A"
123-128 z80: memrd: "38"
126-129 z80: addr: "F40B"
123-130 z80: instr: "JR C,$+9"
128-130 z80: memrd: "07"
129-135 z80: addr: "F40C"
130-136 z80: instr: "DEC BC"
130-136 z80: memrd: "0B"
135-139 z80: addr: "F40D"
136-140 z80: instr: "LD A,B"
136-140 z80: memrd: "78"
139-143 z80: addr: "F40E"
140-144 z80: instr: "OR C"
140-144 z80: memrd: "B1"
143-147 z80: addr: "F40F"
144-149 z80: memrd: "20"
147-155 z80: addr: "F410"
144-156 z80: instr: "JR NZ,$-8"
149-156 z80: memrd: "F6"
155-159 z80: addr: "F407"
156-161 z80: memrd: "CD"
159-162 z80: addr: "F408"
161-164 z80: memrd: "7F"
162-167 z80: addr: "F409"
156-168 z80: instr: "CALL 0E37Fh"
164-168 z80: memrd: "E3"
167-170 z80: addr: "01AF"
168-171 z80: memwr: "F4"
170-172 z80: addr: "01AE"
168-173 z80: wop: "F40A"
171-173 z80: memwr: "0A"
172-176 z80: addr: "E37F"
173-178 z80: memrd: "CD"
176-179 z80: addr: "E380"
178-181 z80: memrd: "74"
179-184 z80: addr: "E381"
173-185 z80: instr: "CALL 0E374h"
181-185 z80: memrd: "E3"
184-187 z80: addr: "01AD"
185-188 z80: memwr: "E3"
187-189 z80: addr: "01AC"
185-190 z80: wop: "E382"
188-190 z80: memwr: "82"
189-193 z80: addr: "E374"
190-194 z80: instr: "OR A"
190-194 z80: memrd: "B7"
193-197 z80: addr: "E375"
194-198 z80: memrd: "DD"
197-201 z80: addr: "E376"
198-203 z80: memrd: "CB"
201-204 z80: addr: "E377"
203-206 z80: memrd: "08"
204-209 z80: addr: "E378"
194-211 z80: instr: "BIT 0,(IX+8)"
206-211 z80: memrd: "46"
209-213 z80: addr: "01F8"
211-214 z80: rop: "80"
211-214 z80: memrd: "80"
213-218 z80: addr: "E379"
214-220 z80: instr: "RET Z"
214-220 z80: memrd: "C8"
218-221 z80: addr: "01AC"
220-223 z80: memrd: "82"
221-224 z80: addr: "01AD"
220-225 z80: rop: "E382"
223-225 z80: memrd: "E3"
224-229 z80: addr: "E382"
225-231 z80: instr: "RET NC"
225-231 z80: memrd: "D0"
229-232 z80: addr: "01AE"
231-234 z80: memrd: "0A"
232-235 z80: addr: "01AF"
231-236 z80: rop: "F40A"
234-236 z80: memrd: "F4"
235-239 z80: addr: "F40A"
236-241 z80: memrd: "38"
239-242 z80: addr: "F40B"
236-243 z80: instr: "JR C,$+9"
241-243 z80: memrd: "07"
242-248 z80: addr: "F40C"
243-249 z80: instr: "DEC BC"
243-249 z80: memrd: "0B"
248-252 z80: addr: "F40D"
249-253 z80: instr: "LD A,B"
249-253 z80: memrd: "78"
252-256 z80: addr: "F40E"
253-257 z80: instr: "OR C"
253-257 z80: memrd: "B1"
256-260 z80: addr: "F40F"
257-262 z80: memrd: "20"
260-268 z80: addr: "F410"
257-269 z80: instr: "JR NZ,$-8"
262-269 z80: memrd: "F6"
268-272 z80: addr: "F407"
269-274 z80: memrd: "CD"
272-275 z80: addr: "F408"
274-277 z80: memrd: "7F"
275-280 z80: addr: "F409"
269-281 z80: instr: "CALL 0E37Fh"
277-281 z80: memrd: "E3"
280-283 z80: addr: "01AF"
281-284 z80: memwr: "F4"
283-285 z80: addr: "01AE"
281-286 z80: wop: "F40A"
284-286 z80: memwr: "0A"
285-289 z80: addr: "E37F"
286-291 z80: memrd: "CD"
289-292 z80: addr: "E380"
291-294 z80: memrd: "74"
292-297 z80: addr: "E381"
286-298 z80: instr: "CALL 0E374h"
294-298 z80: memrd: "E3"
297-300 z80: addr: "01AD"
298-301 z80: memwr: "E3"
300-302 z80: addr: "01AC"
298-303 z80: wop: "E382"
301-303 z80: memwr: "82"
302-306 z80: addr: "E374"
303-307 z80: instr: "OR A"
303-307 z80: memrd: "B7"
306-310 z80: addr: "E375"
307-311 z80: memrd: "DD"
310-314 z80: addr: "E376"
311-316 z80: memrd: "CB"
314-317 z80: addr: "E377"
316-319 z80: memrd: "08"
317-322 z80: addr: "E378"
307-324 z80: instr: "BIT 0,(IX+8)"
319-324 z80: memrd: "46"
322-326 z80: addr: "01F8"
324-327 z80: rop: "80"
324-327 z80: memrd: "80"
326-331 z80: addr: "E379"
327-333 z80: instr: "RET Z"
327-333 z80: memrd: "C8"
331-334 z80: addr: "01AC"
333-336 z80: memrd: "82"
334-337 z80: addr: "01AD"
333-338 z80: rop: "E382"
336-338 z80: memrd: "E3"
337-342 z80: addr: "E382"
338-344 z80: instr: "RET NC"
338-344 z80: memrd: "D0"
342-345 z80: addr: "01AE"
344-347 z80: memrd: "0A"
345-348 z80: addr: "01AF"
344-349 z80: rop: "F40A"
347-349 z80: memrd: "F4"
348-352 z80: addr: "F40A"
349-354 z80: memrd: "38"
352-355 z80: addr: "F40B"
349-356 z80: instr: "JR C,$+9"
354-356 z80: memrd: "07"
355-361 z80: addr: "F40C"
356-362 z80: instr: "DEC BC"
356-362 z80: memrd: "0B"
361-365 z80: addr: "F40D"
362-366 z80: instr: "LD A,B"
362-366 z80: memrd: "78"
365-369 z80: addr: "F40E"
366-370 z80: instr: "OR C"
366-370 z80: memrd: "B1"
369-373 z80: addr: "F40F"
370-375 z80: memrd: "20"
373-381 z80: addr: "F410"
370-382 z80: instr: "JR NZ,$-8"
375-382 z80: memrd: "F6"
381-385 z80: addr: "F407"
382-387 z80: memrd: "CD"
385-388 z80: addr: "F408"
387-390 z80: memrd: "7F"
388-393 z80: addr: "F409"
382-394 z80: instr: "CALL 0E37Fh"
390-394 z80: memrd: "E3"
393-396 z80: addr: "01AF"
394-397 z80: memwr: "F4"
396-398 z80: addr: "01AE"
394-399 z80: wop: "F40A"
397-399 z80: memwr: "0A"
398-402 z80: addr: "E37F"
399-404 z80: memrd: "CD"
402-405 z80: addr: "E380"
404-407 z80: memrd: "74"
405-410 z80: addr: "E381"
399-411 z80: instr: "CALL 0E374h"
407-411 z80: memrd: "E3"
410-413 z80: addr: "01AD"
411-414 z80: memwr: "E3"
413-415 z80: addr: "01AC"
411-416 z80: wop: "E382"
414-416 z80: memwr: "82"
415-419 z80: addr: "E374"
416-420 z80: instr: "OR A"
416-420 z80: memrd: "B7"
419-423 z80: addr: "E375"
420-424 z80: memrd: "DD"
423-427 z80: addr: "E376"
424-429 z80: memrd: "CB"
427-430 z80: addr: "E377"
429-432 z80: memrd: "08"
430-435 z80: addr: "E378"
420-437 z80: instr: "BIT 0,(IX+8)"
432-437 z80: memrd: "46"
435-439 z80: addr: "01F8"
437-440 z80: rop: "80"
437-440 z80: memrd: "80"
439-444 z80: addr: "E379"
440-446 z80: instr: "RET Z"
440-446 z80: memrd: "C8"
444-447 z80: addr: "01AC"
446-449 z80: memrd: "82"
447-450 z80: addr: "01AD"
446-451 z80: rop: "E382"
449-451 z80: memrd: "E3"
450-455 z80: addr: "E382"
451-457 z80: instr: "RET NC"
451-457 z80: memrd: "D0"
455-458 z80: addr: "01AE"
457-460 z80: memrd: "0A"
458-461 z80: addr: "01AF"
457-462 z80: rop: "F40A"
460-462 z80: memrd: "F4"
461-465 z80: addr: "F40A"
462-467 z80: memrd: "38"
465-468 z80: addr: "F40B"
462-469 z80: instr: "JR C,$+9"
467-469 z80: memrd: "07"
468-474 z80: addr: "F40C"
469-475 z80: instr: "DEC BC"
469-475 z80: memrd: "0B"
474-478 z80: addr: "F40D"
475-479 z80: instr: "LD A,B"
475-479 z80: memrd: "78"
478-482 z80: addr: "F40E"
479-483 z80: instr: "OR C"
479-483 z80: memrd: "B1"
482-486 z80: addr: "F40F"
483-488 z80: memrd: "20"
486-494 z80: addr: "F410"
483-495 z80: instr: "JR NZ,$-8"
488-495 z80: memrd: "F6"
494-498 z80: addr: "F407"
495-500 z80: memrd: "CD"
498-501 z80: addr: "F408"
500-503 z80: memrd: "7F"
501-506 z80: addr: "F409"
495-507 z80: instr: "CALL 0E37Fh"
503-507 z80: memrd: "E3"
506-509 z80: addr: "01AF"
507-510 z80: memwr: "F4"
509-511 z80: addr: "01AE"
507-512 z80: wop: "F40A"
510-512 z80: memwr: "0A"
511-515 z80: addr: "E37F"
512-517 z80: memrd: "CD"
515-518 z80: addr: "E380"
517-520 z80: memrd: "74"
518-523 z80: addr: "E381"
512-524 z80: instr: "CALL 0E374h"
520-524 z80: memrd: "E3"
523-526 z80: addr: "01AD"
524-527 z80: memwr: "E3"
526-528 z80: addr: "01AC"
524-529 z80: wop: "E382"
527-529 z80: memwr: "82"
528-532 z80: addr: "E374"
529-533 z80: instr: "OR A"
529-533 z80: memrd: "B7"
532-536 z80: addr: "E375"
533-537 z80: memrd: "DD"
536-540 z80: addr: "E376"
537-542 z80: memrd: "CB"
540-543 z80: addr: "E377"
542-545 z80: memrd: "08"
543-548 z80: addr: "E378"
533-550 z80: instr: "BIT 0,(IX+8)"
545-550 z80: memrd: "46"
548-552 z80: addr: "01F8"
550-553 z80: rop: "80"
550-553 z80: memrd: "80"
552-557 z80: addr: "E379"
553-559 z80: instr: "RET Z"
553-559 z80: memrd: "C8"
557-560 z80: addr: "01AC"
559-562 z80: memrd: "82"
560-563 z80: addr: "01AD"
559-564 z80: rop: "E382"
562-564 z80: memrd: "E3"
563-568 z80: addr: "E382"
564-570 z80: instr: "RET NC"
564-570 z80: memrd: "D0"
568-571 z80: addr: "01AE"
570-573 z80: memrd: "0A"
571-574 z80: addr: "01AF"
570-575 z80: rop: "F40A"
573-575 z80: memrd: "F4"
574-578 z80: addr: "F40A"
575-580 z80: memrd: "38"
578-581 z80: addr: "F40B"
575-582 z80: instr: "JR C,$+9"
580-582 z80: memrd: "07"
581-587 z80: addr: "F40C"
582-588 z80: instr: "DEC BC"
582-588 z80: memrd: "0B"
587-591 z80: addr: "F40D"
588-592 z80: instr: "LD A,B"
588-592 z80: memrd: "78"
591-595 z80: addr: "F40E"
592-596 z80: instr: "OR C"
592-596 z80: memrd: "B1"
595-599 z80: addr: "F40F"
596-601 z80: memrd: "20"
599-607 z80: addr: "F410"
596-608 z80: instr: "JR NZ,$-8"
601-608 z80: memrd: "F6"
607-611 z80: addr: "F407"
608-613 z80: memrd: "CD"
611-614 z80: addr: "F408"
613-616 z80: memrd: "7F"
614-619 z80: addr: "F409"
608-620 z80: instr: "CALL 0E37Fh"
616-620 z80: memrd: "E3"
619-622 z80: addr: "01AF"
620-623 z80: memwr: "F4"
622-624 z80: addr: "01AE"
620-625 z80: wop: "F40A"
623-625 z80: memwr: "0A"
624-628 z80: addr: "E37F"
625-630 z80: memrd: "CD"
628-631 z80: addr: "E380"
630-633 z80: memrd: "74"
631-636 z80: addr: "E381"
625-637 z80: instr: "CALL 0E374h"
633-637 z80: memrd: "E3"
636-639 z80: addr: "01AD"
637-640 z80: memwr: "E3"
639-641 z80: addr: "01AC"
637-642 z80: wop: "E382"
640-642 z80: memwr: "82"
641-645 z80: addr: "E374"
642-646 z80: instr: "OR A"
642-646 z80: memrd: "B7"
645-649 z80: addr: "E375"
646-650 z80: memrd: "DD"
649-653 z80: addr: "E376"
650-655 z80: memrd: "CB"
653-656 z80: addr: "E377"
655-658 z80: memrd: "08"
656-661 z80: addr: "E378"
646-663 z80: instr: "BIT 0,(IX+8)"
658-663 z80: memrd: "46"
661-665 z80: addr: "01F8"
663-666 z80: rop: "80"
663-666 z80: memrd: "80"
665-670 z80: addr: "E379"
666-672 z80: instr: "RET Z"
666-672 z80: memrd: "C8"
670-673 z80: addr: "01AC"
672-675 z80: memrd: "82"
673-676 z80: addr: "01AD"
672-677 z80: rop: "E382"
675-677 z80: memrd: "E3"
676-681 z80: addr: "E382"
677-683 z80: instr: "RET NC"
677-683 z80: memrd: "D0"
681-684 z80: addr: "01AE"
683-686 z80: memrd: "0A"
684-687 z80: addr: "01AF"
683-688 z80: rop: "F40A"
686-688 z80: memrd: "F4"
687-691 z80: addr: "F40A"
688-693 z80: memrd: "38"
691-694 z80: addr: "F40B"
688-695 z80: instr: "JR C,$+9"
693-695 z80: memrd: "07"
694-700 z80: addr: "F40C"
695-701 z80: instr: "DEC BC"
695-701 z80: memrd: "0B"
700-704 z80: addr: "F40D"
701-705 z80: instr: "LD A,B"
701-705 z80: memrd: "78"
704-708 z80: addr: "F40E"
705-709 z80: instr: "OR C"
705-709 z80: memrd: "B1"
708-712 z80: addr: "F40F"
709-714 z80: memrd: "20"
712-720 z80: addr: "F410"
709-721 z80: instr: "JR NZ,$-8"
714-721 z80: memrd: "F6"
720-724 z80: addr: "F407"
721-726 z80: memrd: "CD"
724-727 z80: addr: "F408"
726-729 z80: memrd: "7F"
727-732 z80: addr: "F409"
721-733 z80: instr: "CALL 0E37Fh"
729-733 z80: memrd: "E3"
732-735 z80: addr: "01AF"
733-736 z80: memwr: "F4"
735-737 z80: addr: "01AE"
733-738 z80: wop: "F40A"
736-738 z80: memwr: "0A"
737-741 z80: addr: "E37F"
738-743 z80: memrd: "CD"
741-744 z80: addr: "E380"
743-746 z80: memrd: "74"
744-749 z80: addr: "E381"
738-750 z80: instr: "CALL 0E374h"
746-750 z80: memrd: "E3"
749-752 z80: addr: "01AD"
750-753 z80: memwr: "E3"
752-754 z80: addr: "01AC"
750-755 z80: wop: "E382"
753-755 z80: memwr: "82"
754-758 z80: addr: "E374"
755-759 z80: instr: "OR A"
755-759 z80: memrd: "B7"
758-762 z80: addr: "E375"
759-763 z80: memrd: "DD"
762-766 z80: addr: "E376"
763-768 z80: memrd: "CB"
766-769 z80: addr: "E377"
768-771 z80: memrd: "08"
769-774 z80: addr: "E378"
759-776 z80: instr: "BIT 0,(IX+8)"
771-776 z80: memrd: "46"
774-778 z80: addr: "01F8"
776-779 z80: rop: "80"
776-779 z80: memrd: "80"
778-783 z80: addr: "E379"
779-785 z80: instr: "RET Z"
779-785 z80: memrd: "C8"
783-786 z80: addr: "01AC"
785-788 z80: memrd: "82"
786-789 z80: addr: "01AD"
785-790 z80: rop: "E382"
788-790 z80: memrd: "E3"
789-794 z80: addr: "E382"
790-796 z80: instr: "RET NC"
790-796 z80: memrd: "D0"
794-797 z80: addr: "01AE"
796-799 z80: memrd: "0A"
797-800 z80: addr: "01AF"
796-801 z80: rop: "F40A"
799-801 z80: memrd: "F4"
800-804 z80: addr: "F40A"
801-806 z80: memrd: "38"
804-807 z80: addr: "F40B"
801-808 z80: instr: "JR C,$+9"
806-808 z80: memrd: "07"
807-813 z80: addr: "F40C"
808-814 z80: instr: "DEC BC"
808-814 z80: memrd: "0B"
813-817 z80: addr: "F40D"
814-818 z80: instr: "LD A,B"
814-818 z80: memrd: "78"
817-821 z80: addr: "F40E"
818-822 z80: instr: "OR C"
818-822 z80: memrd: "B1"
821-825 z80: addr: "F40F"
822-827 z80: memrd: "20"
825-833 z80: addr: "F410"
822-834 z80: instr: "JR NZ,$-8"
827-834 z80: memrd: "F6"
833-837 z80: addr: "F407"
834-839 z80: memrd: "CD"
837-840 z80: addr: "F408"
839-842 z80: memrd: "7F"
840-845 z80: addr: "F409"
834-846 z80: instr: "CALL 0E37Fh"
842-846 z80: memrd: "E3"
845-848 z80: addr: "01AF"
846-849 z80: memwr: "F4"
848-850 z80: addr: "01AE"
846-851 z80: wop: "F40A"
849-851 z80: memwr: "0A"
850-854 z80: addr: "E37F"
851-856 z80: memrd: "CD"
854-857 z80: addr: "E380"
856-859 z80: memrd: "74"
857-862 z80: addr: "E381"
851-863 z80: instr: "CALL 0E374h"
859-863 z80: memrd: "E3"
862-865 z80: addr: "01AD"
863-866 z80: memwr: "E3"
865-867 z80: addr: "01AC"
863-868 z80: wop: "E382"
866-868 z80: memwr: "82"
867-871 z80: addr: "E374"
868-872 z80: instr: "OR A"
868-872 z80: memrd: "B7"
871-875 z80: addr: "E375"
872-876 z80: memrd: "DD"
875-879 z80: addr: "E376"
876-881 z80: memrd: "CB"
879-882 z80: addr: "E377"
881-884 z80: memrd: "08"
882-887 z80: addr: "E378"
872-889 z80: instr: "BIT 0,(IX+8)"
884-889 z80: memrd: "46"
887-891 z80: addr: "01F8"
889-892 z80: rop: "80"
889-892 z80: memrd: "80"
891-896 z80: addr: "E379"
892-898 z80: instr: "RET Z"
892-898 z80: memrd: "C8"
896-899 z80: addr: "01AC"
898-901 z80: memrd: "82"
899-902 z80: addr: "01AD"
898-903 z80: rop: "E382"
901-903 z80: memrd: "E3"
902-907 z80: addr: "E382"
903-909 z80: instr: "RET NC"
903-909 z80: memrd: "D0"
907-910 z80: addr: "01AE"
909-912 z80: memrd: "0A"
910-913 z80: addr: "01AF"
909-914 z80: rop: "F40A"
912-914 z80: memrd: "F4"
913-917 z80: addr: "F40A"
914-919 z80: memrd: "38"
917-920 z80: addr: "F40B"
914-921 z80: instr: "JR C,$+9"
919-921 z80: memrd: "07"
920-926 z80: addr: "F40C"
921-927 z80: instr: "DEC BC"
921-927 z80: memrd: "0B"
926-930 z80: addr: "F40D"
927-931 z80: instr: "LD A,B"
927-931 z80: memrd: "78"
930-934 z80: addr: "F40E"
931-935 z80: instr: "OR C"
931-935 z80: memrd: "B1"
934-938 z80: addr: "F40F"
935-940 z80: memrd: "20"
938-946 z80: addr: "F410"
935-947 z80: instr: "JR NZ,$-8"
940-947 z80: memrd: "F6"
946-950 z80: addr: "F407"
947-952 z80: memrd: "CD"
950-953 z80: addr: "F408"
952-955 z80: memrd: "7F"
953-958 z80: addr: "F409"
947-959 z80: instr: "CALL 0E37Fh"
955-959 z80: memrd: "E3"
958-961 z80: addr: "01AF"
959-962 z80: memwr: "F4"
961-963 z80: addr: "01AE"
959-964 z80: wop: "F40A"
962-964 z80: memwr: "0A"
963-967 z80: addr: "E37F"
964-969 z80: memrd: "CD"
967-970 z80: addr: "E380"
969-972 z80: memrd: "74"
970-975 z80: addr: "E381"
964-976 z80: instr: "CALL 0E374h"
972-976 z80: memrd: "E3"
975-978 z80: addr: "01AD"
976-979 z80: memwr: "E3"
978-980 z80: addr: "01AC"
976-981 z80: wop: "E382"
979-981 z80: memwr: "82"
980-984 z80: addr: "E374"
981-985 z80: instr: "OR A"
981-985 z80: memrd: "B7"
984-988 z80: addr: "E375"
985-989 z80: memrd: "DD"
988-992 z80: addr: "E376"
989-994 z80: memrd: "CB"
992-995 z80: addr: "E377"
994-997 z80: memrd: "08"
995-1000 z80: addr: "E378"
985-1002 z80: instr: "BIT 0,(IX+8)"
997-1002 z80: memrd: "46"
1000-1004 z80: addr: "01F8"
1002-1005 z80: rop: "80"
1002-1005 z80: memrd: "80"
1004-1009 z80: addr: "E379"
1005-1011 z80: instr: "RET Z"
1005-1011 z80: memrd: "C8"
1009-1012 z80: addr: "01AC"
1011-1014 z80: memrd: "82"
1012-1015 z80: addr: "01AD"
1011-1016 z80: rop: "E382"
1014-1016 z80: memrd: "E3"
1015-1020 z80: addr: "E382"
1016-1022 z80: instr: "RET NC"
1016-1022 z80: memrd: "D0"
1020-1023 z80: addr: "01AE"
1022-1025 z80: memrd: "0A"
1023-1026 z80: addr: "01AF"
1022-1027 z80: rop: "F40A"
1025-1027 z80: memrd: "F4"
1026-1030 z80: addr: "F40A"
1027-1032 z80: memrd: "38"
1030-1033 z80: addr: "F40B"
1027-1034 z80: instr: "JR C,$+9"
1032-1034 z80: memrd: "07"
1033-1039 z80: addr: "F40C"
1034-1040 z80: instr: "DEC BC"
1034-1040 z80: memrd: "0B"
1039-1043 z80: addr: "F40D"
1040-1044 z80: instr: "LD A,B"
1040-1044 z80: memrd: "78"
1043-1047 z80: addr: "F40E"
1044-1048 z80: instr: "OR C"
1044-1048 z80: memrd: "B1"
1047-1051 z80: addr: "F40F"
1048-1053 z80: memrd: "20"
1051-1059 z80: addr: "F410"
1048-1060 z80: instr: "JR NZ,$-8"
1053-1060 z80: memrd: "F6"
1059-1063 z80: addr: "F407"
1060-1065 z80: memrd: "CD"
1063-1066 z80: addr: "F408"
1065-1068 z80: memrd: "7F"
1066-1071 z80: addr: "F409"
1060-1072 z80: instr: "CALL 0E37Fh"
1068-1072 z80: memrd: "E3"
1071-1074 z80: addr: "01AF"
1072-1075 z80: memwr: "F4"
1074-1076 z80: addr: "01AE"
1072-1077 z80: wop: "F40A"
1075-1077 z80: memwr: "0A"
1076-1080 z80: addr: "E37F"
1077-1082 z80: memrd: "CD"
1080-1083 z80: addr: "E380"
1082-1085 z80: memrd: "74"
1083-1088 z80: addr: "E381"
1077-1089 z80: instr: "CALL 0E374h"
1085-1089 z80: memrd: "E3"
1088-1091 z80: addr: "01AD"
1089-1092 z80: memwr: "E3"
1091-1093 z80: addr: "01AC"
1089-1094 z80: wop: "E382"
1092-1094 z80: memwr: "82"
1093-1097 z80: addr: "E374"
1094-1098 z80: instr: "OR A"
1094-1098 z80: memrd: "B7"
1097-1101 z80: addr: "E375"
1098-1102 z80: memrd: "DD"
1101-1105 z80: addr: "E376"
1102-1107 z80: memrd: "CB"
1105-1108 z80: addr: "E377"
1107-1110 z80: memrd: "08"
1108-1113 z80: addr: "E378"
1098-1115 z80: instr: "BIT 0,(IX+8)"
1110-1115 z80: memrd: "46"
1113-1117 z80: addr: "01F8"
1115-1118 z80: rop: "80"
1115-1118 z80: memrd: "80"
1117-1122 z80: addr: "E379"
1118-1124 z80: instr: "RET Z"
1118-1124 z80: memrd: "C8"
1122-1125 z80: addr: "01AC"
1124-1127 z80: memrd: "82"
1125-1128 z80: addr: "01AD"
1124-1129 z80: rop: "E382"
1127-1129 z80: memrd: "E3"
1128-1133 z80: addr: "E382"
1129-1135 z80: instr: "RET NC"
1129-1135 z80: memrd: "D0"
1133-1136 z80: addr: "01AE"
1135-1138 z80: memrd: "0A"
1136-1139 z80: addr: "01AF"
1135-1140 z80: rop: "F40A"
1138-1140 z80: memrd: "F4"
1139-1143 z80: addr: "F40A"
1140-1145 z80: memrd: "38"
1143-1146 z80: addr: "F40B"
1140-1147 z80: instr: "JR C,$+9"
1145-1147 z80: memrd: "07"
1146-1152 z80: addr: "F40C"
1147-1153 z80: instr: "DEC BC"
1147-1153 z80: memrd: "0B"
1152-1156 z80: addr: "F40D"
1153-1157 z80: instr: "LD A,B"
1153-1157 z80: memrd: "78"
1156-1160 z80: addr: "F40E"
1157-1161 z80: instr: "OR C"
1157-1161 z80: memrd: "B1"
1160-1164 z80: addr: "F40F"
1161-1166 z80: memrd: "20"
1164-1172 z80: addr: "F410"
1161-1173 z80: instr: "JR NZ,$-8"
1166-1173 z80: memrd: "F6"
1172-1176 z80: addr: "F407"
1173-1178 z80: memrd: "CD"
1176-1179 z80: addr: "F408"
1178-1181 z80: memrd: "7F"
1179-1184 z80: addr: "F409"
1173-1185 z80: instr: "CALL 0E37Fh"
1181-1185 z80: memrd: "E3"
1184-1187 z80: addr: "01AF"
1185-1188 z80: memwr: "F4"
1187-1189 z80: addr: "01AE"
1185-1190 z80: wop: "F40A"
1188-1190 z80: memwr: "0A"
1189-1193 z80: addr: "E37F"
1190-1195 z80: memrd: "CD"
1193-1196 z80: addr: "E380"
1195-1198 z80: memrd: "74"
1196-1201 z80: addr: "E381"
1190-1202 z80: instr: "CALL 0E374h"
1198-1202 z80: memrd: "E3"
1201-1204 z80: addr: "01AD"
1202-1205 z80: memwr: "E3"
1204-1206 z80: addr: "01AC"
1202-1207 z80: wop: "E382"
1205-1207 z80: memwr: "82"
1206-1210 z80: addr: "E374"
1207-1211 z80: instr: "OR A"
1207-1211 z80: memrd: "B7"
1210-1214 z80: addr: "E375"
1211-1215 z80: memrd: "DD"
1214-1218 z80: addr: "E376"
1215-1220 z80: memrd: "CB"
1218-1221 z80: addr: "E377"
1220-1223 z80: memrd: "08"
1221-1226 z80: addr: "E378"
1211-1228 z80: instr: "BIT 0,(IX+8)"
1223-1228 z80: memrd: "46"
1226-1230 z80: addr: "01F8"
1228-1231 z80: rop: "80"
1228-1231 z80: memrd: "80"
1230-1235 z80: addr: "E379"
1231-1237 z80: instr: "RET Z"
1231-1237 z80: memrd: "C8"
1235-1238 z80: addr: "01AC"
1237-1240 z80: memrd: "82"
1238-1241 z80: addr: "01AD"
1237-1242 z80: rop: "E382"
1240-1242 z80: memrd: "E3"
1241-1246 z80: addr: "E382"
1242-1248 z80: instr: "RET NC"
1242-1248 z80: memrd: "D0"
1246-1249 z80: addr: "01AE"
1248-1251 z80: memrd: "0A"
1249-1252 z80: addr: "01AF"
1248-1253 z80: rop: "F40A"
1251-1253 z80: memrd: "F4"
1252-1256 z80: addr: "F40A"
1253-1258 z80: memrd: "38"
1256-1259 z80: addr: "F40B"
1253-1260 z80: instr: "JR C,$+9"
1258-1260 z80: memrd: "07"
1259-1265 z80: addr: "F40C"
1260-1266 z80: instr: "DEC BC"
1260-1266 z80: memrd: "0B"
1265-1269 z80: addr: "F40D"
1266-1270 z80: instr: "LD A,B"
1266-1270 z80: memrd: "78"
1269-1273 z80: addr: "F40E"
1270-1274 z80: instr: "OR C"
1270-1274 z80: memrd: "B1"
1273-1277 z80: addr: "F40F"
1274-1279 z80: memrd: "20"
1277-1285 z80: addr: "F410"
1274-1286 z80: instr: "JR NZ,$-8"
1279-1286 z80: memrd: "F6"
1285-1289 z80: addr: "F407"
1286-1291 z80: memrd: "CD"
1289-1292 z80: addr: "F408"
1291-1294 z80: memrd: "7F"
1292-1297 z80: addr: "F409"
1286-1298 z80: instr: "CALL 0E37Fh"
1294-1298 z80: memrd: "E3"
1297-1300 z80: addr: "01AF"
1298-1301 z80: memwr: "F4"
1300-1302 z80: addr: "01AE"
1298-1303 z80: wop: "F40A"
1301-1303 z80: memwr: "0A"
1302-1306 z80: addr: "E37F"
1303-1308 z80: memrd: "CD"
1306-1309 z80: addr: "E380"
1308-1311 z80: memrd: "74"
1309-1314 z80: addr: "E381"
1303-1315 z80: instr: "CALL 0E374h"
1311-1315 z80: memrd: "E3"
1314-1317 z80: addr: "01AD"
1315-1318 z80: memwr: "E3"
1317-1319 z80: addr: "01AC"
1315-1320 z80: wop: "E382"
1318-1320 z80: memwr: "82"
1319-1323 z80: addr: "E374"
1320-1324 z80: instr: "OR A"
1320-1324 z80: memrd: "B7"
1323-1327 z80: addr: "E375"
1324-1328 z80: memrd: "DD"
1327-1331 z80: addr: "E376"
1328-1333 z80: memrd: "CB"
1331-1334 z80: addr: "E377"
1333-1336 z80: memrd: "08"
1334-1339 z80: addr: "E378"
1324-1341 z80: instr: "BIT 0,(IX+8)"
1336-1341 z80: memrd: "46"
1339-1343 z80: addr: "01F8"
1341-1344 z80: rop: "80"
1341-1344 z80: memrd: "80"
1343-1348 z80: addr: "E379"
1344-1350 z80: instr: "RET Z"
1344-1350 z80: memrd: "C8"
1348-1351 z80: addr: "01AC"
1350-1353 z80: memrd: "82"
1351-1354 z80: addr: "01AD"
1350-1355 z80: rop: "E382"
1353-1355 z80: memrd: "E3"
1354-1359 z80: addr: "E382"
1355-1361 z80: instr: "RET NC"
1355-1361 z80: memrd: "D0"
1359-1362 z80: addr: "01AE"
1361-1364 z80: memrd: "0A"
1362-1365 z80: addr: "01AF"
1361-1366 z80: rop: "F40A"
1364-1366 z80: memrd: "F4"
1365-1369 z80: addr: "F40A"
1366-1371 z80: memrd: "38"
1369-1372 z80: addr: "F40B"
1366-1373 z80: instr: "JR C,$+9"
1371-1373 z80: memrd: "07"
1372-1378 z80: addr: "F40C"
1373-1379 z80: instr: "DEC BC"
1373-1379 z80: memrd: "0B"
1378-1382 z80: addr: "F40D"
1379-1383 z80: instr: "LD A,B"
1379-1383 z80: memrd: "78"
1382-1386 z80: addr: "F40E"
1383-1387 z80: instr: "OR C"
1383-1387 z80: memrd: "B1"
1386-1390 z80: addr: "F40F"
1387-1392 z80: memrd: "20"
1390-1398 z80: addr: "F410"
1387-1399 z80: instr: "JR NZ,$-8"
1392-1399 z80: memrd: "F6"
1398-1402 z80: addr: "F407"
1399-1404 z80: memrd: "CD"
1402-1405 z80: addr: "F408"
1404-1407 z80: memrd: "7F"
1405-1410 z80: addr: "F409"
1399-1411 z80: instr: "CALL 0E37Fh"
1407-1411 z80: memrd: "E3"
1410-1413 z80: addr: "01AF"
1411-1414 z80: memwr: "F4"
1413-1415 z80: addr: "01AE"
1411-1416 z80: wop: "F40A"
1414-1416 z80: memwr: "0A"
1415-1419 z80: addr: "E37F"
1416-1421 z80: memrd: "CD"
1419-1422 z80: addr: "E380"
1421-1424 z80: memrd: "74"
1422-1427 z80: addr: "E381"
1416-1428 z80: instr: "CALL 0E374h"
1424-1428 z80: memrd: "E3"
1427-1430 z80: addr: "01AD"
1428-1431 z80: memwr: "E3"
1430-1432 z80: addr: "01AC"
1428-1433 z80: wop: "E382"
1431-1433 z80: memwr: "82"
1432-1436 z80: addr: "E374"
1433-1437 z80: instr: "OR A"
1433-1437 z80: memrd: "B7"
1436-1440 z80: addr: "E375"
1437-1441 z80: memrd: "DD"
1440-1444 z80: addr: "E376"
1441-1446 z80: memrd: "CB"
1444-1447 z80: addr: "E377"
1446-1449 z80: memrd: "08"
1447-1452 z80: addr: "E378"
1437-1454 z80: instr: "BIT 0,(IX+8)"
1449-1454 z80: memrd: "46"
1452-1456 z80: addr: "01F8"
1454-1457 z80: rop: "80"
1454-1457 z80: memrd: "80"
1456-1461 z80: addr: "E379"
1457-1463 z80: instr: "RET Z"
1457-1463 z80: memrd: "C8"
1461-1464 z80: addr: "01AC"
1463-1466 z80: memrd: "82"
1464-1467 z80: addr: "01AD"
1463-1468 z80: rop: "E382"
1466-1468 z80: memrd: "E3"
1467-1472 z80: addr: "E382"
1468-1474 z80: instr: "RET NC"
1468-1474 z80: memrd: "D0"
1472-1475 z80: addr: "01AE"
1474-1477 z80: memrd: "0A"
1475-1478 z80: addr: "01AF"
1474-1479 z80: rop: "F40A"
1477-1479 z80: memrd: "F4"
1478-1482 z80: addr: "F40A"
1479-1484 z80: memrd: "38"
1482-1485 z80: addr: "F40B"
1479-1486 z80: instr: "JR C,$+9"
1484-1486 z80: memrd: "07"
1485-1491 z80: addr: "F40C"
1486-1492 z80: instr: "DEC BC"
1486-1492 z80: memrd: "0B"
1491-1495 z80: addr: "F40D"
1492-1496 z80: instr: "LD A,B"
1492-1496 z80: memrd: "78"
1495-1499 z80: addr: "F40E"
1496-1500 z80: instr: "OR C"
1496-1500 z80: memrd: "B1"
1499-1503 z80: addr: "F40F"
1500-1505 z80: memrd: "20"
1503-1511 z80: addr: "F410"
1500-1512 z80: instr: "JR NZ,$-8"
1505-1512 z80: memrd: "F6"
1511-1515 z80: addr: "F407"
1512-1517 z80: memrd: "CD"
1515-1518 z80: addr: "F408"
1517-1520 z80: memrd: "7F"
1518-1523 z80: addr: "F409"
1512-1524 z80: instr: "CALL 0E37Fh"
1520-1524 z80: memrd: "E3"
1523-1526 z80: addr: "01AF"
1524-1527 z80: memwr: "F4"
1526-1528 z80: addr: "01AE"
1524-1529 z80: wop: "F40A"
1527-1529 z80: memwr: "0A"
1528-1532 z80: addr: "E37F"
1529-1534 z80: memrd: "CD"
1532-1535 z80: addr: "E380"
1534-1537 z80: memrd: "74"
1535-1540 z80: addr: "E381"
1529-1541 z80: instr: "CALL 0E374h"
1537-1541 z80: memrd: "E3"
1540-1543 z80: addr: "01AD"
1541-1544 z80: memwr: "E3"
1543-1545 z80: addr: "01AC"
1541-1546 z80: wop: "E382"
1544-1546 z80: memwr: "82"
1545-1549 z80: addr: "E374"
1546-1550 z80: instr: "OR A"
1546-1550 z80: memrd: "B7"
1549-1553 z80: addr: "E375"
1550-1554 z80: memrd: "DD"
1553-1557 z80: addr: "E376"
1554-1559 z80: memrd: "CB"
1557-1560 z80: addr: "E377"
1559-1562 z80: memrd: "08"
1560-1565 z80: addr: "E378"
1550-1567 z80: instr: "BIT 0,(IX+8)"
1562-1567 z80: memrd: "46"
1565-1569 z80: addr: "01F8"
1567-1570 z80: rop: "80"
1567-1570 z80: memrd: "80"
1569-1574 z80: addr: "E379"
1570-1576 z80: instr: "RET Z"
1570-1576 z80: memrd: "C8"
1574-1577 z80: addr: "01AC"
1576-1579 z80: memrd: "82"
1577-1580 z80: addr: "01AD"
1576-1581 z80: rop: "E382"
1579-1581 z80: memrd: "E3"
1580-1585 z80: addr: "E382"
1581-1587 z80: instr: "RET NC"
1581-1587 z80: memrd: "D0"
1585-1588 z80: addr: "01AE"
1587-1590 z80: memrd: "0A"
1588-1591 z80: addr: "01AF"
1587-1592 z80: rop: "F40A"
1590-1592 z80: memrd: "F4"
1591-1595 z80: addr: "F40A"
1592-1597 z80: memrd: "38"
1595-1598 z80: addr: "F40B"
1592-1599 z80: instr: "JR C,$+9"
1597-1599 z80: memrd: "07"
1598-1604 z80: addr: "F40C"
1599-1605 z80: instr: "DEC BC"
1599-1605 z80: memrd: "0B"
1604-1608 z80: addr: "F40D"
1605-1609 z80: instr: "LD A,B"
1605-1609 z80: memrd: "78"
1608-1612 z80: addr: "F40E"
1609-1613 z80: instr: "OR C"
1609-1613 z80: memrd: "B1"
1612-1616 z80: addr: "F40F"
1613-1618 z80: memrd: "20"
1616-1624 z80: addr: "F410"
1613-1625 z80: instr: "JR NZ,$-8"
1618-1625 z80: memrd: "F6"
1624-1628 z80: addr: "F407"
1625-1630 z80: memrd: "CD"
1628-1631 z80: addr: "F408"
1630-1633 z80: memrd: "7F"
1631-1636 z80: addr: "F409"
1625-1637 z80: instr: "CALL 0E37Fh"
1633-1637 z80: memrd: "E3"
1636-1639 z80: addr: "01AF"
1637-1640 z80: memwr: "F4"
1639-1641 z80: addr: "01AE"
1637-1642 z80: wop: "F40A"
1640-1642 z80: memwr: "0A"
1641-1645 z80: addr: "E37F"
1642-1647 z80: memrd: "CD"
1645-1648 z80: addr: "E380"
1647-1650 z80: memrd: "74"
1648-1653 z80: addr: "E381"
1642-1654 z80: instr: "CALL 0E374h"
1650-1654 z80: memrd: "E3"
1653-1656 z80: addr: "01AD"
1654-1657 z80: memwr: "E3"
1656-1658 z80: addr: "01AC"
1654-1659 z80: wop: "E382"
1657-1659 z80: memwr: "82"
1658-1662 z80: addr: "E374"
1659-1663 z80: instr: "OR A"
1659-1663 z80: memrd: "B7"
1662-1666 z80: addr: "E375"
1663-1667 z80: memrd: "DD"
1666-1670 z80: addr: "E376"
1667-1672 z80: memrd: "CB"
1670-1673 z80: addr: "E377"
1672-1675 z80: memrd: "08"
1673-1678 z80: addr: "E378"
1663-1680 z80: instr: "BIT 0,(IX+8)"
1675-1680 z80: memrd: "46"
1678-1682 z80: addr: "01F8"
1680-1683 z80: rop: "80"
1680-1683 z80: memrd: "80"
1682-1687 z80: addr: "E379"
1683-1689 z80: instr: "RET Z"
1683-1689 z80: memrd: "C8"
1687-1690 z80: addr: "01AC"
1689-1692 z80: memrd: "82"
1690-1693 z80: addr: "01AD"
1689-1694 z80: rop: "E382"
1692-1694 z80: memrd: "E3"
1693-1698 z80: addr: "E382"
1694-1700 z80: instr: "RET NC"
1694-1700 z80: memrd: "D0"
1698-1701 z80: addr: "01AE"
1700-1703 z80: memrd: "0A"
1701-1704 z80: addr: "01AF"
1700-1705 z80: rop: "F40A"
1703-1705 z80: memrd: "F4"
1704-1708 z80: addr: "F40A"
1705-1710 z80: memrd: "38"
1708-1711 z80: addr: "F40B"
1705-1712 z80: instr: "JR C,$+9"
1710-1712 z80: memrd: "07"
1711-1717 z80: addr: "F40C"
1712-1718 z80: instr: "DEC BC"
1712-1718 z80: memrd: "0B"
1717-1721 z80: addr: "F40D"
1718-1722 z80: instr: "LD A,B"
1718-1722 z80: memrd: "78"
1721-1725 z80: addr: "F40E"
1722-1726 z80: instr: "OR C"
1722-1726 z80: memrd: "B1"
1725-1729 z80: addr: "F40F"
1726-1731 z80: memrd: "20"
1729-1737 z80: addr: "F410"
1726-1738 z80: instr: "JR NZ,$-8"
1731-1738 z80: memrd: "F6"
1737-1741 z80: addr: "F407"
1738-1743 z80: memrd: "CD"
1741-1744 z80: addr: "F408"
1743-1746 z80: memrd: "7F"
1744-1749 z80: addr: "F409"
1738-1750 z80: instr: "CALL 0E37Fh"
1746-1750 z80: memrd: "E3"
1749-1752 z80: addr: "01AF"
1750-1753 z80: memwr: "F4"
1752-1754 z80: addr: "01AE"
1750-1755 z80: wop: "F40A"
1753-1755 z80: memwr: "0A"
1754-1758 z80: addr: "E37F"
1755-1760 z80: memrd: "CD"
1758-1761 z80: addr: "E380"
1760-1763 z80: memrd: "74"
1761-1766 z80: addr: "E381"
1755-1767 z80: instr: "CALL 0E374h"
1763-1767 z80: memrd: "E3"
1766-1769 z80: addr: "01AD"
1767-1770 z80: memwr: "E3"
1769-1771 z80: addr: "01AC"
1767-1772 z80: wop: "E382"
1770-1772 z80: memwr: "82"
1771-1775 z80: addr: "E374"
1772-1776 z80: instr: "OR A"
1772-1776 z80: memrd: "B7"
1775-1779 z80: addr: "E375"
1776-1780 z80: memrd: "DD"
1779-1783 z80: addr: "E376"
1780-1785 z80: memrd: "CB"
1783-1786 z80: addr: "E377"
1785-1788 z80: memrd: "08"
1786-1791 z80: addr: "E378"
1776-1793 z80: instr: "BIT 0,(IX+8)"
1788-1793 z80: memrd: "46"
1791-1795 z80: addr: "01F8"
1793-1796 z80: rop: "80"
1793-1796 z80: memrd: "80"
1795-1800 z80: addr: "E379"
1796-1802 z80: instr: "RET Z"
1796-1802 z80: memrd: "C8"
1800-1803 z80: addr: "01AC"
1802-1805 z80: memrd: "82"
1803-1806 z80: addr: "01AD"
1802-1807 z80: rop: "E382"
1805-1807 z80: memrd: "E3"
1806-1811 z80: addr: "E382"
1807-1813 z80: instr: "RET NC"
1807-1813 z80: memrd: "D0"
1811-1814 z80: addr: "01AE"
1813-1816 z80: memrd: "0A"
1814-1817 z80: addr: "01AF"
1813-1818 z80: rop: "F40A"
1816-1818 z80: memrd: "F4"
1817-1821 z80: addr: "F40A"
1818-1823 z80: memrd: "38"
1821-1824 z80: addr: "F40B"
1818-1825 z80: instr: "JR C,$+9"
1823-1825 z80: memrd: "07"
1824-1830 z80: addr: "F40C"
1825-1831 z80: instr: "DEC BC"
1825-1831 z80: memrd: "0B"
1830-1834 z80: addr: "F40D"
1831-1835 z80: instr: "LD A,B"
1831-1835 z80: memrd: "78"
1834-1838 z80: addr: "F40E"
1835-1839 z80: instr: "OR C"
1835-1839 z80: memrd: "B1"
1838-1842 z80: addr: "F40F"
1839-1844 z80: memrd: "20"
1842-1850 z80: addr: "F410"
1839-1851 z80: instr: "JR NZ,$-8"
1844-1851 z80: memrd: "F6"
1850-1854 z80: addr: "F407"
1851-1856 z80: memrd: "CD"
1854-1857 z80: addr: "F408"
1856-1859 z80: memrd: "7F"
1857-1862 z80: addr: "F409"
1851-1863 z80: instr: "CALL 0E37Fh"
1859-1863 z80: memrd: "E3"
1862-1865 z80: addr: "01AF"
1863-1866 z80: memwr: "F4"
1865-1867 z80: addr: "01AE"
1863-1868 z80: wop: "F40A"
1866-1868 z80: memwr: "0A"
1867-1871 z80: addr: "E37F"
1868-1873 z80: memrd: "CD"
1871-1874 z80: addr: "E380"
1873-1876 z80: memrd: "74"
1874-1879 z80: addr: "E381"
1868-1880 z80: instr: "CALL 0E374h"
1876-1880 z80: memrd: "E3"
1879-1882 z80: addr: "01AD"
1880-1883 z80: memwr: "E3"
1882-1884 z80: addr: "01AC"
1880-1885 z80: wop: "E382"
1883-1885 z80: memwr: "82"
1884-1888 z80: addr: "E374"
1885-1889 z80: instr: "OR A"
1885-1889 z80: memrd: "B7"
1888-1892 z80: addr: "E375"
1889-1893 z80: memrd: "DD"
1892-1896 z80: addr: "E376"
1893-1898 z80: memrd: "CB"
1896-1899 z80: addr: "E377"
1898-1901 z80: memrd: "08"
1899-1904 z80: addr: "E378"
1889-1906 z80: instr: "BIT 0,(IX+8)"
1901-1906 z80: memrd: "46"
1904-1908 z80: addr: "01F8"
1906-1909 z80: rop: "80"
1906-1909 z80: memrd: "80"
1908-1913 z80: addr: "E379"
1909-1915 z80: instr: "RET Z"
1909-1915 z80: memrd: "C8"
1913-1916 z80: addr: "01AC"
1915-1918 z80: memrd: "82"
1916-1919 z80: addr: "01AD"
1915-1920 z80: rop: "E382"
1918-1920 z80: memrd: "E3"
1919-1924 z80: addr: "E382"
1920-1926 z80: instr: "RET NC"
1920-1926 z80: memrd: "D0"
1924-1927 z80: addr: "01AE"
1926-1929 z80: memrd: "0A"
1927-1930 z80: addr: "01AF"
1926-1931 z80: rop: "F40A"
1929-1931 z80: memrd: "F4"
1930-1934 z80: addr: "F40A"
1931-1936 z80: memrd: "38"
1934-1937 z80: addr: "F40B"
1931-1938 z80: instr: "JR C,$+9"
1936-1938 z80: memrd: "07"
1937-1943 z80: addr: "F40C"
1938-1944 z80: instr: "DEC BC"
1938-1944 z80: memrd: "0B"
1943-1947 z80: addr: "F40D"
1944-1948 z80: instr: "LD A,B"
1944-1948 z80: memrd: "78"
1947-1951 z80: addr: "F40E"
1948-1952 z80: instr: "OR C"
1948-1952 z80: memrd: "B1"
1951-1955 z80: addr: "F40F"
1952-1957 z80: memrd: "20"
1955-1963 z80: addr: "F410"
1952-1964 z80: instr: "JR NZ,$-8"
1957-1964 z80: memrd: "F6"
1963-1967 z80: addr: "F407"
1964-1969 z80: memrd: "CD"
1967-1970 z80: addr: "F408"
1969-1972 z80: memrd: "7F"
1970-1975 z80: addr: "F409"
1964-1976 z80: instr: "CALL 0E37Fh"
1972-1976 z80: memrd: "E3"
1975-1978 z80: addr: "01AF"
1976-1979 z80: memwr: "F4"
1978-1980 z80: addr: "01AE"
1976-1981 z80: wop: "F40A"
1979-1981 z80: memwr: "0A"
1980-1984 z80: addr: "E37F"
1981-1986 z80: memrd: "CD"
1984-1987 z80: addr: "E380"
1986-1989 z80: memrd: "74"
1987-1992 z80: addr: "E381"
1981-1993 z80: instr: "CALL 0E374h"
1989-1993 z80: memrd: "E3"
1992-1995 z80: addr: "01AD"
1993-1996 z80: memwr: "E3"
1995-1997 z80: addr: "01AC"
1993-1998 z80: wop: "E382"
1996-1998 z80: memwr: "82"
1997-2001 z80: addr: "E374"
1998-2002 z80: instr: "OR A"
1998-2002 z80: memrd: "B7"
2001-2005 z80: addr: "E375"
2002-2006 z80: memrd: "DD"
2005-2009 z80: addr: "E376"
2006-2011 z80: memrd: "CB"
2009-2012 z80: addr: "E377"
2011-2014 z80: memrd: "08"
2012-2017 z80: addr: "E378"
2002-2019 z80: instr: "BIT 0,(IX+8)"
2014-2019 z80: memrd: "46"
2017-2021 z80: addr: "01F8"
2019-2022 z80: rop: "80"
2019-2022 z80: memrd: "80"
2021-2026 z80: addr: "E379"
2022-2028 z80: instr: "RET Z"
2022-2028 z80: memrd: "C8"
2026-2029 z80: addr: "01AC"
2028-2031 z80: memrd: "82"
2029-2032 z80: addr: "01AD"
2028-2033 z80: rop: "E382"
2031-2033 z80: memrd: "E3"
2032-2037 z80: addr: "E382"
2033-2039 z80: instr: "RET NC"
2033-2039 z80: memrd: "D0"
2037-2040 z80: addr: "01AE"
2039-2042 z80: memrd: "0A"
2040-2043 z80: addr: "01AF"
2039-2044 z80: rop: "F40A"
2042-2044 z80: memrd: "F4"
2043-2047 z80: addr: "F40A"
2044-2049 z80: memrd: "38"
2047-2050 z80: addr: "F40B"
2044-2051 z80: instr: "JR C,$+9"
2049-2051 z80: memrd: "07"
2050-2056 z80: addr: "F40C"
2051-2057 z80: instr: "DEC BC"
2051-2057 z80: memrd: "0B"
2056-2060 z80: addr: "F40D"
2057-2061 z80: instr: "LD A,B"
2057-2061 z80: memrd: "78"
2060-2064 z80: addr: "F40E"
2061-2065 z80: instr: "OR C"
2061-2065 z80: memrd: "B1"
2064-2068 z80: addr: "F40F"
2065-2070 z80: memrd: "20"
2068-2076 z80: addr: "F410"
2065-2077 z80: instr: "JR NZ,$-8"
2070-2077 z80: memrd: "F6"
2076-2080 z80: addr: "F407"
2077-2082 z80: memrd: "CD"
2080-2083 z80: addr: "F408"
2082-2085 z80: memrd: "7F"
2083-2088 z80: addr: "F409"
2077-2089 z80: instr: "CALL 0E37Fh"
2085-2089 z80: memrd: "E3"
2088-2091 z80: addr: "01AF"
2089-2092 z80: memwr: "F4"
2091-2093 z80: addr: "01AE"
2089-2094 z80: wop: "F40A"
2092-2094 z80: memwr: "0A"
2093-2097 z80: addr: "E37F"
2094-2099 z80: memrd: "CD"
2097-2100 z80: addr: "E380"
2099-2102 z80: memrd: "74"
2100-2105 z80: addr: "E381"
2094-2106 z80: instr: "CALL 0E374h"
2102-2106 z80: memrd: "E3"
2105-2108 z80: addr: "01AD"
2106-2109 z80: memwr: "E3"
2108-2110 z80: addr: "01AC"
2106-2111 z80: wop: "E382"
2109-2111 z80: memwr: "82"
2110-2114 z80: addr: "E374"
2111-2115 z80: instr: "OR A"
2111-2115 z80: memrd: "B7"
2114-2118 z80: addr: "E375"
2115-2119 z80: memrd: "DD"
2118-2122 z80: addr: "E376"
2119-2124 z80: memrd: "CB"
2122-2125 z80: addr: "E377"
2124-2127 z80: memrd: "08"
2125-2130 z80: addr: "E378"
2115-2132 z80: instr: "BIT 0,(IX+8)"
2127-2132 z80: memrd: "46"
2130-2134 z80: addr: "01F8"
2132-2135 z80: rop: "80"
2132-2135 z80: memrd: "80"
2134-2139 z80: addr: "E379"
2135-2141 z80: instr: "RET Z"
2135-2141 z80: memrd: "C8"
2139-2142 z80: addr: "01AC"
2141-2144 z80: memrd: "82"
2142-2145 z80: addr: "01AD"
2141-2146 z80: rop: "E382"
2144-2146 z80: memrd: "E3"
2145-2150 z80: addr: "E382"
2146-2152 z80: instr: "RET NC"
2146-2152 z80: memrd: "D0"
2150-2153 z80: addr: "01AE"
2152-2155 z80: memrd: "0A"
2153-2156 z80: addr: "01AF"
2152-2157 z80: rop: "F40A"
2155-2157 z80: memrd: "F4"
2156-2160 z80: addr: "F40A"
2157-2162 z80: memrd: "38"
2160-2163 z80: addr: "F40B"
2157-2164 z80: instr: "JR C,$+9"
2162-2164 z80: memrd: "07"
2163-2169 z80: addr: "F40C"
2164-2170 z80: instr: "DEC BC"
2164-2170 z80: memrd: "0B"
2169-2173 z80: addr: "F40D"
2170-2174 z80: instr: "LD A,B"
2170-2174 z80: memrd: "78"
2173-2177 z80: addr: "F40E"
2174-2178 z80: instr: "OR C"
2174-2178 z80: memrd: "B1"
2177-2181 z80: addr: "F40F"
2178-2183 z80: memrd: "20"
2181-2189 z80: addr: "F410"
2178-2190 z80: instr: "JR NZ,$-8"
2183-2190 z80: memrd: "F6"
2189-2193 z80: addr: "F407"
2190-2195 z80: memrd: "CD"
2193-2196 z80: addr: "F408"
2195-2198 z80: memrd: "7F"
2196-2201 z80: addr: "F409"
2190-2202 z80: instr: "CALL 0E37Fh"
2198-2202 z80: memrd: "E3"
2201-2204 z80: addr: "01AF"
2202-2205 z80: memwr: "F4"
2204-2206 z80: addr: "01AE"
2202-2207 z80: wop: "F40A"
2205-2207 z80: memwr: "0A"
2206-2210 z80: addr: "E37F"
2207-2212 z80: memrd: "CD"
2210-2213 z80: addr: "E380"
2212-2215 z80: memrd: "74"
2213-2218 z80: addr: "E381"
2207-2219 z80: instr: "CALL 0E374h"
2215-2219 z80: memrd: "E3"
2218-2221 z80: addr: "01AD"
2219-2222 z80: memwr: "E3"
2221-2223 z80: addr: "01AC"
2219-2224 z80: wop: "E382"
2222-2224 z80: memwr: "82"
2223-2227 z80: addr: "E374"
2224-2228 z80: instr: "OR A"
2224-2228 z80: memrd: "B7"
2227-2231 z80: addr: "E375"
2228-2232 z80: memrd: "DD"
2231-2235 z80: addr: "E376"
2232-2237 z80: memrd: "CB"
2235-2238 z80: addr: "E377"
2237-2240 z80: memrd: "08"
2238-2243 z80: addr: "E378"
2228-2245 z80: instr: "BIT 0,(IX+8)"
2240-2245 z80: memrd: "46"
2243-2247 z80: addr: "01F8"
2245-2248 z80: rop: "80"
2245-2248 z80: memrd: "80"
2247-2252 z80: addr: "E379"
2248-2254 z80: instr: "RET Z"
2248-2254 z80: memrd: "C8"
2252-2255 z80: addr: "01AC"
2254-2257 z80: memrd: "82"
2255-2258 z80: addr: "01AD"
2254-2259 z80: rop: "E382"
2257-2259 z80: memrd: "E3"
2258-2263 z80: addr: "E382"
2259-2265 z80: instr: "RET NC"
2259-2265 z80: memrd: "D0"
2263-2266 z80: addr: "01AE"
2265-2268 z80: memrd: "0A"
2266-2269 z80: addr: "01AF"
2265-2270 z80: rop: "F40A"
2268-2270 z80: memrd: "F4"
2269-2273 z80: addr: "F40A"
2270-2275 z80: memrd: "38"
2273-2276 z80: addr: "F40B"
2270-2277 z80: instr: "JR C,$+9"
2275-2277 z80: memrd: "07"
2276-2282 z80: addr: "F40C"
2277-2283 z80: instr: "DEC BC"
2277-2283 z80: memrd: "0B"
2282-2286 z80: addr: "F40D"
2283-2287 z80: instr: "LD A,B"
2283-2287 z80: memrd: "78"
2286-2290 z80: addr: "F40E"
2287-2291 z80: instr: "OR C"
2287-2291 z80: memrd: "B1"
2290-2294 z80: addr: "F40F"
2291-2296 z80: memrd: "20"
2294-2302 z80: addr: "F410"
2291-2303 z80: instr: "JR NZ,$-8"
2296-2303 z80: memrd: "F6"
2302-2306 z80: addr: "F407"
2303-2308 z80: memrd: "CD"
2306-2309 z80: addr: "F408"
2308-2311 z80: memrd: "7F"
2309-2314 z80: addr: "F409"
2303-2315 z80: instr: "CALL 0E37Fh"
2311-2315 z80: memrd: "E3"
2314-2317 z80: addr: "01AF"
2315-2318 z80: memwr: "F4"
2317-2319 z80: addr: "01AE"
2315-2320 z80: wop: "F40A"
2318-2320 z80: memwr: "0A"
2319-2323 z80: addr: "E37F"
2320-2325 z80: memrd: "CD"
2323-2326 z80: addr: "E380"
2325-2328 z80: memrd: "74"
2326-2331 z80: addr: "E381"
2320-2332 z80: instr: "CALL 0E374h"
2328-2332 z80: memrd: "E3"
2331-2334 z80: addr: "01AD"
2332-2335 z80: memwr: "E3"
2334-2336 z80: addr: "01AC"
2332-2337 z80: wop: "E382"
2335-2337 z80: memwr: "82"
2336-2340 z80: addr: "E374"
2337-2341 z80: instr: "OR A"
2337-2341 z80: memrd: "B7"
2340-2344 z80: addr: "E375"
2341-2345 z80: memrd: "DD"
2344-2348 z80: addr: "E376"
2345-2350 z80: memrd: "CB"
2348-2351 z80: addr: "E377"
2350-2353 z80: memrd: "08"
2351-2356 z80: addr: "E378"
2341-2358 z80: instr: "BIT 0,(IX+8)"
2353-2358 z80: memrd: "46"
2356-2360 z80: addr: "01F8"
2358-2361 z80: rop: "80"
2358-2361 z80: memrd: "80"
2360-2365 z80: addr: "E379"
2361-2367 z80: instr: "RET Z"
2361-2367 z80: memrd: "C8"
2365-2368 z80: addr: "01AC"
2367-2370 z80: memrd: "82"
2368-2371 z80: addr: "01AD"
2367-2372 z80: rop: "E382"
2370-2372 z80: memrd: "E3"
2371-2376 z80: addr: "E382"
2372-2378 z80: instr: "RET NC"
2372-2378 z80: memrd: "D0"
2376-2379 z80: addr: "01AE"
2378-2381 z80: memrd: "0A"
2379-2382 z80: addr: "01AF"
2378-2383 z80: rop: "F40A"
2381-2383 z80: memrd: "F4"
2382-2386 z80: addr: "F40A"
2383-2388 z80: memrd: "38"
2386-2389 z80: addr: "F40B"
2383-2390 z80: instr: "JR C,$+9"
2388-2390 z80: memrd: "07"
2389-2395 z80: addr: "F40C"
2390-2396 z80: instr: "DEC BC"
2390-2396 z80: memrd: "0B"
2395-2399 z80: addr: "F40D"
2396-2400 z80: instr: "LD A,B"
2396-2400 z80: memrd: "78"
2399-2403 z80: addr: "F40E"
2400-2404 z80: instr: "OR C"
2400-2404 z80: memrd: "B1"
2403-2407 z80: addr: "F40F"
2404-2409 z80: memrd: "20"
2407-2415 z80: addr: "F410"
2404-2416 z80: instr: "JR NZ,$-8"
2409-2416 z80: memrd: "F6"
2415-2419 z80: addr: "F407"
2416-2421 z80: memrd: "CD"
2419-2422 z80: addr: "F408"
2421-2424 z80: memrd: "7F"
2422-2427 z80: addr: "F409"
2416-2428 z80: instr: "CALL 0E37Fh"
2424-2428 z80: memrd: "E3"
2427-2430 z80: addr: "01AF"
2428-2431 z80: memwr: "F4"
2430-2432 z80: addr: "01AE"
2428-2433 z80: wop: "F40A"
2431-2433 z80: memwr: "0A"
2432-2436 z80: addr: "E37F"
2433-2438 z80: memrd: "CD"
2436-2439 z80: addr: "E380"
2438-2441 z80: memrd: "74"
2439-2444 z80: addr: "E381"
2433-2445 z80: instr: "CALL 0E374h"
2441-2445 z80: memrd: "E3"
2444-2447 z80: addr: "01AD"
2445-2448 z80: memwr: "E3"
2447-2449 z80: addr: "01AC"
2445-2450 z80: wop: "E382"
2448-2450 z80: memwr: "82"
2449-2453 z80: addr: "E374"
2450-2454 z80: instr: "OR A"
2450-2454 z80: memrd: "B7"
2453-2457 z80: addr: "E375"
2454-2458 z80: memrd: "DD"
2457-2461 z80: addr: "E376"
2458-2463 z80: memrd: "CB"
2461-2464 z80: addr: "E377"
2463-2466 z80: memrd: "08"
2464-2469 z80: addr: "E378"
2454-2471 z80: instr: "BIT 0,(IX+8)"
2466-2471 z80: memrd: "46"
2469-2473 z80: addr: "01F8"
2471-2474 z80: rop: "80"
2471-2474 z80: memrd: "80"
2473-2478 z80: addr: "E379"
2474-2480 z80: instr: "RET Z"
2474-2480 z80: memrd: "C8"
2478-2481 z80: addr: "01AC"
2480-2483 z80: memrd: "82"
2481-2484 z80: addr: "01AD"
2480-2485 z80: rop: "E382"
2483-2485 z80: memrd: "E3"
2484-2489 z80: addr: "E382"
2485-2491 z80: instr: "RET NC"
2485-2491 z80: memrd: "D0"
2489-2492 z80: addr: "01AE"
2491-2494 z80: memrd: "0A"
2492-2495 z80: addr: "01AF"
2491-2496 z80: rop: "F40A"
2494-2496 z80: memrd: "F4"
2495-2499 z80: addr: "F40A"
2496-2501 z80: memrd: "38"
2499-2502 z80: addr: "F40B"
2496-2503 z80: instr: "JR C,$+9"
2501-2503 z80: memrd: "07"
2502-2508 z80: addr: "F40C"
2503-2509 z80: instr: "DEC BC"
2503-2509 z80: memrd: "0B"
2508-2512 z80: addr: "F40D"
2509-2513 z80: instr: "LD A,B"
2509-2513 z80: memrd: "78"
2512-2516 z80: addr: "F40E"
2513-2517 z80: instr: "OR C"
2513-2517 z80: memrd: "B1"
2516-2520 z80: addr: "F40F"
2517-2522 z80: memrd: "20"
2520-2523 z80: addr: "F410"
2517-2524 z80: instr: "JR NZ,$-8"
2522-2524 z80: memrd: "F6"
2523-2527 z80: addr: "F411"
2524-2529 z80: memrd: "18"
2527-2535 z80: addr: "F412"
2524-2536 z80: instr: "JR $-16"
2529-2536 z80: memrd: "EE"
2535-2539 z80: addr: "F401"
2536-2541 z80: memrd: "CD"
2539-2542 z80: addr: "F402"
2541-2544 z80: memrd: "BE"
2542-2547 z80: addr: "F403"
2536-2548 z80: instr: "CALL 0F7BEh"
2544-2548 z80: memrd: "F7"
2547-2550 z80: addr: "01AF"
2548-2551 z80: memwr: "F4"
2550-2552 z80: addr: "01AE"
2548-2553 z80: wop: "F404"
2551-2553 z80: memwr: "04"
2552-2558 z80: addr: "F7BE"
2553-2559 z80: instr: "PUSH DE"
2553-2559 z80: memrd: "D5"
2558-2561 z80: addr: "01AD"
2559-2562 z80: memwr: "FB"
2561-2563 z80: addr: "01AC"
2559-2564 z80: wop: "FBC7"
2562-2564 z80: memwr: "C7"
2563-2569 z80: addr: "F7BF"
2564-2570 z80: instr: "PUSH AF"
2564-2570 z80: memrd: "F5"
2569-2572 z80: addr: "01AB"
2570-2573 z80: memwr: "00"
2572-2574 z80: addr: "01AA"
2570-2575 z80: wop: "0044"
2573-2575 z80: memwr: "44"
2574-2580 z80: addr: "F7C0"
2575-2581 z80: instr: "PUSH HL"
2575-2581 z80: memrd: "E5"
2580-2583 z80: addr: "01A9"
2581-2584 z80: memwr: "F3"
2583-2585 z80: addr: "01A8"
2581-2586 z80: wop: "F3F6"
2584-2586 z80: memwr: "F6"
2585-2589 z80: addr: "F7C1"
2586-2591 z80: memrd: "CD"
2589-2592 z80: addr: "F7C2"
2591-2594 z80: memrd: "52"
2592-2597 z80: addr: "F7C3"
2586-2598 z80: instr: "CALL 0E052h"
2594-2598 z80: memrd: "E0"
2597-2600 z80: addr: "01A7"
2598-2601 z80: memwr: "F7"
2600-2602 z80: addr: "01A6"
2598-2603 z80: wop: "F7C4"
2601-2603 z80: memwr: "C4"
2602-2606 z80: addr: "E052"
2603-2607 z80: memrd: "ED"
2606-2610 z80: addr: "E053"
2607-2612 z80: memrd: "5B"
2610-2613 z80: addr: "E054"
2612-2615 z80: memrd: "A0"
2613-2616 z80: addr: "E055"
2603-2619 z80: instr: "LD DE,(0B7A0h)"
2615-2619 z80: memrd: "B7"
2616-2620 z80: addr: "B7A0"
2619-2623 z80: memrd: "01"
2620-2624 z80: addr: "B7A1"
2619-2625 z80: rop: "1201"
2623-2625 z80: memrd: "12"
2624-2628 z80: addr: "E056"
2625-2630 z80: memrd: "2A"
2628-2631 z80: addr: "E057"
2630-2633 z80: memrd: "9C"
2631-2634 z80: addr: "E058"
2625-2636 z80: instr: "LD HL,(0B79Ch)"
2633-2636 z80: memrd: "B7"
2634-2637 z80: addr: "B79C"
2636-2640 z80: memrd: "00"
2637-2641 z80: addr: "B79D"
2636-2642 z80: rop: "0000"
2640-2642 z80: memrd: "00"
2641-2652 z80: addr: "E059"
2642-2653 z80: instr: "ADD HL,DE"
2642-2653 z80: memrd: "19"
2652-2656 z80: addr: "E05A"
2653-2657 z80: memrd: "CB"
2656-2660 z80: addr: "E05B"
2653-2661 z80: instr: "SLA H"
2657-2661 z80: memrd: "24"
2660-2664 z80: addr: "E05C"
2661-2665 z80: memrd: "CB"
2664-2668 z80: addr: "E05D"
2661-2669 z80: instr: "SLA H"
2665-2669 z80: memrd: "24"
2668-2672 z80: addr: "E05E"
2669-2673 z80: memrd: "CB"
2672-2676 z80: addr: "E05F"
2669-2677 z80: instr: "SLA H"
2673-2677 z80: memrd: "24"
2676-2682 z80: addr: "E060"
2677-2683 z80: instr: "PUSH AF"
2677-2683 z80: memrd: "F5"
2682-2685 z80: addr: "01A5"
2683-2686 z80: memwr: "00"
2685-2687 z80: addr: "01A4"
2683-2688 z80: wop: "0084"
2686-2688 z80: memwr: "84"
2687-2691 z80: addr: "E061"
2688-2692 z80: instr: "LD A,L"
2688-2692 z80: memrd: "7D"
2691-2695 z80: addr: "E062"
2692-2696 z80: instr: "LD L,H"
2692-2696 z80: memrd: "6C"
2695-2699 z80: addr: "E063"
2696-2701 z80: memrd: "FE"
2699-2702 z80: addr: "E064"
2696-2703 z80: instr: "CP 28h"
2701-2703 z80: memrd: "28"
2702-2706 z80: addr: "E065"
2703-2708 z80: memrd: "30"
2706-2709 z80: addr: "E066"
2703-2710 z80: instr: "JR NC,$+8"
2708-2710 z80: memrd: "06"
2709-2713 z80: addr: "E067"
2710-2715 z80: memrd: "F6"
2713-2716 z80: addr: "E068"
2710-2717 z80: instr: "OR 80h"
2715-2717 z80: memrd: "80"
2716-2720 z80: addr: "E069"
2717-2721 z80: instr: "LD H,A"
2717-2721 z80: memrd: "67"
2720-2724 z80: addr: "E06A"
2721-2726 z80: instr: "POP AF"
2721-2726 z80: memrd: "F1"
2724-2727 z80: addr: "01A4"
2726-2729 z80: memrd: "84"
2727-2730 z80: addr: "01A5"
2726-2731 z80: rop: "0084"
2729-2731 z80: memrd: "00"
2730-2734 z80: addr: "E06B"
2731-2735 z80: instr: "AND A"
2731-2735 z80: memrd: "A7"
2734-2738 z80: addr: "E06C"
2735-2740 z80: instr: "RET"
2735-2740 z80: memrd: "C9"
2738-2741 z80: addr: "01A6"
2740-2743 z80: memrd: "C4"
2741-2744 z80: addr: "01A7"
2740-2745 z80: rop: "F7C4"
2743-2745 z80: memrd: "F7"
2744-2748 z80: addr: "F7C4"
2745-2750 z80: memrd: "38"
2748-2751 z80: addr: "F7C5"
2745-2752 z80: instr: "JR C,$+36"
2750-2752 z80: memrd: "22"
2751-2757 z80: addr: "F7C6"
2752-2758 z80: instr: "PUSH HL"
2752-2758 z80: memrd: "E5"
2757-2760 z80: addr: "01A7"
2758-2761 z80: memwr: "81"
2760-2762 z80: addr: "01A6"
2758-2763 z80: wop: "8190"
2761-2763 z80: memwr: "90"
2762-2766 z80: addr: "F7C7"
2763-2768 z80: memrd: "CD"
2766-2769 z80: addr: "F7C8"
2768-2771 z80: memrd: "7C"
2769-2774 z80: addr: "F7C9"
2763-2775 z80: instr: "CALL 0E07Ch"
2771-2775 z80: memrd: "E0"
2774-2777 z80: addr: "01A5"
2775-2778 z80: memwr: "F7"
2777-2779 z80: addr: "01A4"
2775-2780 z80: wop: "F7CA"
2778-2780 z80: memwr: "CA"
2779-2785 z80: addr: "E07C"
2780-2786 z80: instr: "PUSH AF"
2780-2786 z80: memrd: "F5"
2785-2788 z80: addr: "01A3"
2786-2789 z80: memwr: "00"
2788-2790 z80: addr: "01A2"
2786-2791 z80: wop: "0054"
2789-2791 z80: memwr: "54"
2790-2794 z80: addr: "E07D"
2791-2796 z80: memrd: "CD"
2794-2797 z80: addr: "E07E"
2796-2799 z80: memrd: "70"
2797-2802 z80: addr: "E07F"
2791-2803 z80: instr: "CALL 0E070h"
2799-2803 z80: memrd: "E0"
2802-2805 z80: addr: "01A1"
2803-2806 z80: memwr: "E0"
2805-2807 z80: addr: "01A0"
2803-2808 z80: wop: "E080"
2806-2808 z80: memwr: "80"
2807-2811 z80: addr: "E070"
2808-2813 z80: memrd: "3A"
2811-2814 z80: addr: "E071"
2813-2816 z80: memrd: "9E"
2814-2817 z80: addr: "E072"
2808-2819 z80: instr: "LD A,(0B79Eh)"
2816-2819 z80: memrd: "B7"
2817-2820 z80: addr: "B79E"
2819-2821 z80: rop: "28"
2819-2821 z80: memrd: "28"
2820-2824 z80: addr: "E073"
2821-2825 z80: instr: "DEC A"
2821-2825 z80: memrd: "3D"
2824-2828 z80: addr: "E074"
2825-2829 z80: instr: "SUB E"
2825-2829 z80: memrd: "93"
2828-2833 z80: addr: "E075"
2829-2834 z80: instr: "RET C"
2829-2834 z80: memrd: "D8"
2833-2837 z80: addr: "E076"
2834-2839 z80: memrd: "3A"
2837-2840 z80: addr: "E077"
2839-2842 z80: memrd: "9F"
2840-2843 z80: addr: "E078"
2834-2845 z80: instr: "LD A,(0B79Fh)"
2842-2845 z80: memrd: "B7"
2843-2846 z80: addr: "B79F"
2845-2847 z80: rop: "20"
2845-2847 z80: memrd: "20"
2846-2850 z80: addr: "E079"
2847-2851 z80: instr: "DEC A"
2847-2851 z80: memrd: "3D"
2850-2854 z80: addr: "E07A"
2851-2855 z80: instr: "SUB D"
2851-2855 z80: memrd: "92"
2854-2858 z80: addr: "E07B"
2855-2860 z80: instr: "RET"
2855-2860 z80: memrd: "C9"
2858-2861 z80: addr: "01A0"
2860-2863 z80: memrd: "80"
2861-2864 z80: addr: "01A1"
2860-2865 z80: rop: "E080"
2863-2865 z80: memrd: "E0"
2864-2868 z80: addr: "E080"
2865-2870 z80: memrd: "38"
2868-2871 z80: addr: "E081"
2865-2872 z80: instr: "JR C,$-19"
2870-2872 z80: memrd: "EB"
2871-2875 z80: addr: "E082"
2872-2877 z80: memrd: "3A"
2875-2878 z80: addr: "E083"
2877-2880 z80: memrd: "9C"
2878-2881 z80: addr: "E084"
2872-2884 z80: instr: "LD A,(0B79Ch)"
2880-2884 z80: memrd: "B7"
2881-2885 z80: addr: "B79C"
2884-2886 z80: rop: "00"
2884-2886 z80: memrd: "00"
2885-2889 z80: addr: "E085"
2886-2890 z80: instr: "ADD A,E"
2886-2890 z80: memrd: "83"
2889-2895 z80: addr: "E086"
2890-2896 z80: instr: "PUSH DE"
2890-2896 z80: memrd: "D5"
2895-2898 z80: addr: "01A1"
2896-2899 z80: memwr: "12"
2898-2900 z80: addr: "01A0"
2896-2901 z80: wop: "1201"
2899-2901 z80: memwr: "01"
2900-2904 z80: addr: "E087"
2901-2905 z80: instr: "LD E,A"
2901-2905 z80: memrd: "5F"
2904-2908 z80: addr: "E088"
2905-2910 z80: memrd: "3A"
2908-2911 z80: addr: "E089"
2910-2913 z80: memrd: "9D"
2911-2914 z80: addr: "E08A"
2905-2916 z80: instr: "LD A,(0B79Dh)"
2913-2916 z80: memrd: "B7"
2914-2917 z80: addr: "B79D"
2916-2918 z80: rop: "00"
2916-2918 z80: memrd: "00"
2917-2921 z80: addr: "E08B"
2918-2922 z80: instr: "ADD A,D"
2918-2922 z80: memrd: "82"
2921-2925 z80: addr: "E08C"
2922-2926 z80: instr: "ADD A,A"
2922-2926 z80: memrd: "87"
2925-2929 z80: addr: "E08D"
2926-2930 z80: instr: "ADD A,A"
2926-2930 z80: memrd: "87"
2929-2933 z80: addr: "E08E"
2930-2934 z80: instr: "ADD A,A"
2930-2934 z80: memrd: "87"
2933-2937 z80: addr: "E08F"
2934-2938 z80: instr: "LD L,A"
2934-2938 z80: memrd: "6F"
2937-2941 z80: addr: "E090"
2938-2943 z80: memrd: "26"
2941-2944 z80: addr: "E091"
2938-2945 z80: instr: "LD H,00h"
2943-2945 z80: memrd: "00"
2944-2948 z80: addr: "E092"
2945-2949 z80: instr: "LD D,H"
2945-2949 z80: memrd: "54"
2948-2959 z80: addr: "E093"
2949-2960 z80: instr: "ADD HL,HL"
2949-2960 z80: memrd: "29"
2959-2970 z80: addr: "E094"
2960-2971 z80: instr: "ADD HL,HL"
2960-2971 z80: memrd: "29"
2970-2981 z80: addr: "E095"
2971-2982 z80: instr: "ADD HL,DE"
2971-2982 z80: memrd: "19"
2981-2985 z80: addr: "E096"
2982-2986 z80: instr: "LD E,A"
2982-2986 z80: memrd: "5F"
2985-2989 z80: addr: "E097"
2986-2991 z80: memrd: "3A"
2989-2992 z80: addr: "E098"
2991-2994 z80: memrd: "CC"
2992-2995 z80: addr: "E099"
2986-2997 z80: instr: "LD A,(0B7CCh)"
2994-2997 z80: memrd: "B7"
2995-2998 z80: addr: "B7CC"
2997-2999 z80: rop: "B2"
2997-2999 z80: memrd: "B2"
2998-3002 z80: addr: "E09A"
2999-3003 z80: instr: "LD D,A"
2999-3003 z80: memrd: "57"
3002-3013 z80: addr: "E09B"
3003-3014 z80: instr: "ADD HL,DE"
3003-3014 z80: memrd: "19"
3013-3017 z80: addr: "E09C"
3014-3019 z80: instr: "POP DE"
3014-3019 z80: memrd: "D1"
3017-3020 z80: addr: "01A0"
3019-3022 z80: memrd: "01"
3020-3023 z80: addr: "01A1"
3019-3024 z80: rop: "1201"
3022-3024 z80: memrd: "12"
3023-3027 z80: addr: "E09D"
3024-3029 z80: instr: "POP AF"
3024-3029 z80: memrd: "F1"
3027-3030 z80: addr: "01A2"
3029-3032 z80: memrd: "54"
3030-3033 z80: addr: "01A3"
3029-3034 z80: rop: "0054"
3032-3034 z80: memrd: "00"
3033-3037 z80: addr: "E09E"
3034-3038 z80: instr: "AND A"
3034-3038 z80: memrd: "A7"
3037-3041 z80: addr: "E09F"
3038-3043 z80: instr: "RET"
3038-3043 z80: memrd: "C9"
3041-3044 z80: addr: "01A4"
3043-3046 z80: memrd: "CA"
3044-3047 z80: addr: "01A5"
3043-3048 z80: rop: "F7CA"
3046-3048 z80: memrd: "F7"
3047-3051 z80: addr: "F7CA"
3048-3053 z80: instr: "LD A,(HL)"
3048-3053 z80: memrd: "7E"
3051-3054 z80: addr: "B4D1"
3053-3055 z80: rop: "00"
3053-3055 z80: memrd: "00"
3054-3058 z80: addr: "F7CB"
3055-3060 z80: instr: "POP HL"
3055-3060 z80: memrd: "E1"
3058-3061 z80: addr: "01A6"
3060-3063 z80: memrd: "90"
3061-3064 z80: addr: "01A7"
3060-3065 z80: rop: "8190"
3063-3065 z80: memrd: "81"
3064-3068 z80: addr: "F7CC"
3065-3069 z80: instr: "AND A"
3065-3069 z80: memrd: "A7"
3068-3072 z80: addr: "F7CD"
3069-3074 z80: memrd: "20"
3072-3075 z80: addr: "F7CE"
3069-3076 z80: instr: "JR NZ,$+12"
3074-3076 z80: memrd: "0A"
3075-3079 z80: addr: "F7CF"
3076-3081 z80: memrd: "3E"
3079-3082 z80: addr: "F7D0"
3076-3083 z80: instr: "LD A,06h"
3081-3083 z80: memrd: "06"
3082-3086 z80: addr: "F7D1"
3083-3087 z80: instr: "OR L"
3083-3087 z80: memrd: "B5"
3086-3090 z80: addr: "F7D2"
3087-3091 z80: instr: "LD L,A"
3087-3091 z80: memrd: "6F"
3090-3094 z80: addr: "F7D3"
3091-3096 z80: instr: "LD A,(HL)"
3091-3096 z80: memrd: "7E"
3094-3097 z80: addr: "8196"
3096-3098 z80: rop: "7F"
3096-3098 z80: memrd: "7F"
3097-3101 z80: addr: "F7D4"
3098-3103 z80: memrd: "EE"
3101-3104 z80: addr: "F7D5"
3098-3105 z80: instr: "XOR 7Fh"
3103-3105 z80: memrd: "7F"
3104-3109 z80: addr: "F7D6"
3105-3110 z80: instr: "LD (HL),A"
3105-3110 z80: memrd: "77"
3109-3111 z80: addr: "8196"
3110-3112 z80: wop: "00"
3110-3112 z80: memwr: "00"
3111-3115 z80: addr: "F7D7"
3112-3117 z80: memrd: "18"
3115-3123 z80: addr: "F7D8"
3112-3124 z80: instr: "JR $+17"
3117-3124 z80: memrd: "0F"
3123-3127 z80: addr: "F7E8"
3124-3129 z80: instr: "POP HL"
3124-3129 z80: memrd: "E1"
3127-3130 z80: addr: "01A8"
3129-3132 z80: memrd: "F6"
3130-3133 z80: addr: "01A9"
3129-3134 z80: rop: "F3F6"
3132-3134 z80: memrd: "F3"
3133-3137 z80: addr: "F7E9"
3134-3139 z80: instr: "POP AF"
3134-3139 z80: memrd: "F1"
3137-3140 z80: addr: "01AA"
3139-3142 z80: memrd: "44"
3140-3143 z80: addr: "01AB"
3139-3144 z80: rop: "0044"
3142-3144 z80: memrd: "00"
3143-3147 z80: addr: "F7EA"
3144-3149 z80: instr: "POP DE"
3144-3149 z80: memrd: "D1"
3147-3150 z80: addr: "01AC"
3149-3152 z80: memrd: "C7"
3150-3153 z80: addr: "01AD"
3149-3154 z80: rop: "FBC7"
3152-3154 z80: memrd: "FB"
3153-3157 z80: addr: "F7EB"
3154-3159 z80: instr: "RET"
3154-3159 z80: memrd: "C9"
3157-3160 z80: addr: "01AE"
3159-3162 z80: memrd: "04"
3160-3163 z80: addr: "01AF"
3159-3164 z80: rop: "F404"
3162-3164 z80: memrd: "F4"
3163-3167 z80: addr: "F404"
3164-3168 z80: instr: "INC E"
3164-3168 z80: memrd: "1C"
3167-3171 z80: addr: "F405"
3168-3173 z80: memrd: "06"
3171-3174 z80: addr: "F406"
3168-3175 z80: instr: "LD B,0Fh"
3173-3175 z80: memrd: "0F"
3174-3178 z80: addr: "F407"
3175-3180 z80: memrd: "CD"
3178-3181 z80: addr: "F408"
3180-3183 z80: memrd: "7F"
3181-3186 z80: addr: "F409"
3175-3187 z80: instr: "CALL 0E37Fh"
3183-3187 z80: memrd: "E3"
3186-3189 z80: addr: "01AF"
3187-3190 z80: memwr: "F4"
3189-3191 z80: addr: "01AE"
3187-3192 z80: wop: "F40A"
3190-3192 z80: memwr: "0A"
3191-3195 z80: addr: "E37F"
3192-3197 z80: memrd: "CD"
3195-3198 z80: addr: "E380"
3197-3200 z80: memrd: "74"
3198-3203 z80: addr: "E381"
3192-3204 z80: instr: "CALL 0E374h"
3200-3204 z80: memrd: "E3"
3203-3206 z80: addr: "01AD"
3204-3207 z80: memwr: "E3"
3206-3208 z80: addr: "01AC"
3204-3209 z80: wop: "E382"
3207-3209 z80: memwr: "82"
3208-3212 z80: addr: "E374"
3209-3213 z80: instr: "OR A"
3209-3213 z80: memrd: "B7"
3212-3216 z80: addr: "E375"
3213-3217 z80: memrd: "DD"
3216-3220 z80: addr: "E376"
3217-3222 z80: memrd: "CB"
3220-3223 z80: addr: "E377"
3222-3225 z80: memrd: "08"
3223-3228 z80: addr: "E378"
3213-3230 z80: instr: "BIT 0,(IX+8)"
3225-3230 z80: memrd: "46"
3228-3232 z80: addr: "01F8"
3230-3233 z80: rop: "80"
3230-3233 z80: memrd: "80"
3232-3237 z80: addr: "E379"
3233-3239 z80: instr: "RET Z"
3233-3239 z80: memrd: "C8"
3237-3240 z80: addr: "01AC"
3239-3242 z80: memrd: "82"
3240-3243 z80: addr: "01AD"
3239-3244 z80: rop: "E382"
3242-3244 z80: memrd: "E3"
3243-3248 z80: addr: "E382"
3244-3250 z80: instr: "RET NC"
3244-3250 z80: memrd: "D0"
3248-3251 z80: addr: "01AE"
3250-3253 z80: memrd: "0A"
3251-3254 z80: addr: "01AF"
3250-3255 z80: rop: "F40A"
3253-3255 z80: memrd: "F4"
3254-3258 z80: addr: "F40A"
3255-3260 z80: memrd: "38"
3258-3261 z80: addr: "F40B"
3255-3262 z80: instr: "JR C,$+9"
3260-3262 z80: memrd: "07"
3261-3267 z80: addr: "F40C"
3262-3268 z80: instr: "DEC BC"
3262-3268 z80: memrd: "0B"
3267-3271 z80: addr: "F40D"
3268-3272 z80: instr: "LD A,B"
3268-3272 z80: memrd: "78"
3271-3275 z80: addr: "F40E"
3272-3276 z80: instr: "OR C"
3272-3276 z80: memrd: "B1"
3275-3279 z80: addr: "F40F"
3276-3281 z80: memrd: "20"
3279-3287 z80: addr: "F410"
3276-3288 z80: instr: "JR NZ,$-8"
3281-3288 z80: memrd: "F6"
3287-3291 z80: addr: "F407"
3288-3293 z80: memrd: "CD"
3291-3294 z80: addr: "F408"
3293-3296 z80: memrd: "7F"
3294-3299 z80: addr: "F409"
3288-3300 z80: instr: "CALL 0E37Fh"
3296-3300 z80: memrd: "E3"
3299-3302 z80: addr: "01AF"
3300-3303 z80: memwr: "F4"
3302-3304 z80: addr: "01AE"
3300-3305 z80: wop: "F40A"
3303-3305 z80: memwr: "0A"
3304-3308 z80: addr: "E37F"
3305-3310 z80: memrd: "CD"
3308-3311 z80: addr: "E380"
3310-3313 z80: memrd: "74"
3311-3316 z80: addr: "E381"
3305-3317 z80: instr: "CALL 0E374h"
3313-3317 z80: memrd: "E3"
3316-3319 z80: addr: "01AD"
3317-3320 z80: memwr: "E3"
3319-3321 z80: addr: "01AC"
3317-3322 z80: wop: "E382"
3320-3322 z80: memwr: "82"
3321-3325 z80: addr: "E374"
3322-3326 z80: instr: "OR A"
3322-3326 z80: memrd: "B7"
3325-3329 z80: addr: "E375"
3326-3330 z80: memrd: "DD"
3329-3333 z80: addr: "E376"
3330-3335 z80: memrd: "CB"
3333-3336 z80: addr: "E377"
3335-3338 z80: memrd: "08"
3336-3341 z80: addr: "E378"
3326-3343 z80: instr: "BIT 0,(IX+8)"
3338-3343 z80: memrd: "46"
3341-3345 z80: addr: "01F8"
3343-3346 z80: rop: "80"
3343-3346 z80: memrd: "80"
3345-3350 z80: addr: "E379"
3346-3352 z80: instr: "RET Z"
3346-3352 z80: memrd: "C8"
3350-3353 z80: addr: "01AC"
3352-3355 z80: memrd: "82"
3353-3356 z80: addr: "01AD"
3352-3357 z80: rop: "E382"
3355-3357 z80: memrd: "E3"
3356-3361 z80: addr: "E382"
3357-3363 z80: instr: "RET NC"
3357-3363 z80: memrd: "D0"
3361-3364 z80: addr: "01AE"
3363-3366 z80: memrd: "0A"
3364-3367 z80: addr: "01AF"
3363-3368 z80: rop: "F40A"
3366-3368 z80: memrd: "F4"
3367-3371 z80: addr: "F40A"
3368-3373 z80: memrd: "38"
3371-3374 z80: addr: "F40B"
3368-3375 z80: instr: "JR C,$+9"
3373-3375 z80: memrd: "07"
3374-3380 z80: addr: "F40C"
3375-3381 z80: instr: "DEC BC"
3375-3381 z80: memrd: "0B"
3380-3384 z80: addr: "F40D"
3381-3385 z80: instr: "LD A,B"
3381-3385 z80: memrd: "78"
3384-3388 z80: addr: "F40E"
3385-3389 z80: instr: "OR C"
3385-3389 z80: memrd: "B1"
3388-3392 z80: addr: "F40F"
3389-3394 z80: memrd: "20"
3392-3400 z80: addr: "F410"
3389-3401 z80: instr: "JR NZ,$-8"
3394-3401 z80: memrd: "F6"
3400-3404 z80: addr: "F407"
3401-3406 z80: memrd: "CD"
3404-3407 z80: addr: "F408"
3406-3409 z80: memrd: "7F"
3407-3412 z80: addr: "F409"
3401-3413 z80: instr: "CALL 0E37Fh"
3409-3413 z80: memrd: "E3"
3412-3415 z80: addr: "01AF"
3413-3416 z80: memwr: "F4"
3415-3417 z80: addr: "01AE"
3413-3418 z80: wop: "F40A"
3416-3418 z80: memwr: "0A"
3417-3421 z80: addr: "E37F"
3418-3423 z80: memrd: "CD"
3421-3424 z80: addr: "E380"
3423-3426 z80: memrd: "74"
3424-3429 z80: addr: "E381"
3418-3430 z80: instr: "CALL 0E374h"
3426-3430 z80: memrd: "E3"
3429-3432 z80: addr: "01AD"
3430-3433 z80: memwr: "E3"
3432-3434 z80: addr: "01AC"
3430-3435 z80: wop: "E382"
3433-3435 z80: memwr: "82"
3434-3438 z80: addr: "E374"
3435-3439 z80: instr: "OR A"
3435-3439 z80: memrd: "B7"
3438-3442 z80: addr: "E375"
3439-3443 z80: memrd: "DD"
3442-3446 z80: addr: "E376"
3443-3448 z80: memrd: "CB"
3446-3449 z80: addr: "E377"
3448-3451 z80: memrd: "08"
3449-3454 z80: addr: "E378"
3439-3456 z80: instr: "BIT 0,(IX+8)"
3451-3456 z80: memrd: "46"
3454-3458 z80: addr: "01F8"
3456-3459 z80: rop: "80"
3456-3459 z80: memrd: "80"
3458-3463 z80: addr: "E379"
3459-3465 z80: instr: "RET Z"
3459-3465 z80: memrd: "C8"
3463-3466 z80: addr: "01AC"
3465-3468 z80: memrd: "82"
3466-3469 z80: addr: "01AD"
3465-3470 z80: rop: "E382"
3468-3470 z80: memrd: "E3"
3469-3474 z80: addr: "E382"
3470-3476 z80: instr: "RET NC"
3470-3476 z80: memrd: "D0"
3474-3477 z80: addr: "01AE"
3476-3479 z80: memrd: "0A"
3477-3480 z80: addr: "01AF"
3476-3481 z80: rop: "F40A"
3479-3481 z80: memrd: "F4"
3480-3484 z80: addr: "F40A"
3481-3486 z80: memrd: "38"
3484-3487 z80: addr: "F40B"
3481-3488 z80: instr: "JR C,$+9"
3486-3488 z80: memrd: "07"
3487-3493 z80: addr: "F40C"
3488-3494 z80: instr: "DEC BC"
3488-3494 z80: memrd: "0B"
3493-3497 z80: addr: "F40D"
3494-3498 z80: instr: "LD A,B"
3494-3498 z80: memrd: "78"
3497-3501 z80: addr: "F40E"
3498-3502 z80: instr: "OR C"
3498-3502 z80: memrd: "B1"
3501-3505 z80: addr: "F40F"
3502-3507 z80: memrd: "20"
3505-3513 z80: addr: "F410"
3502-3514 z80: instr: "JR NZ,$-8"
3507-3514 z80: memrd: "F6"
3513-3517 z80: addr: "F407"
3514-3519 z80: memrd: "CD"
3517-3520 z80: addr: "F408"
3519-3522 z80: memrd: "7F"
3520-3525 z80: addr: "F409"
3514-3526 z80: instr: "CALL 0E37Fh"
3522-3526 z80: memrd: "E3"
3525-3528 z80: addr: "01AF"
3526-3529 z80: memwr: "F4"
3528-3530 z80: addr: "01AE"
3526-3531 z80: wop: "F40A"
3529-3531 z80: memwr: "0A"
3530-3534 z80: addr: "E37F"
3531-3536 z80: memrd: "CD"
3534-3537 z80: addr: "E380"
3536-3539 z80: memrd: "74"
3537-3542 z80: addr: "E381"
3531-3543 z80: instr: "CALL 0E374h"
3539-3543 z80: memrd: "E3"
3542-3545 z80: addr: "01AD"
3543-3546 z80: memwr: "E3"
3545-3547 z80: addr: "01AC"
3543-3548 z80: wop: "E382"
3546-3548 z80: memwr: "82"
3547-3551 z80: addr: "E374"
3548-3552 z80: instr: "OR A"
3548-3552 z80: memrd: "B7"
3551-3555 z80: addr: "E375"
3552-3556 z80: memrd: "DD"
3555-3559 z80: addr: "E376"
3556-3561 z80: memrd: "CB"
3559-3562 z80: addr: "E377"
3561-3564 z80: memrd: "08"
3562-3567 z80: addr: "E378"
3552-3569 z80: instr: "BIT 0,(IX+8)"
3564-3569 z80: memrd: "46"
3567-3571 z80: addr: "01F8"
3569-3572 z80: rop: "80"
3569-3572 z80: memrd: "80"
3571-3576 z80: addr: "E379"
3572-3578 z80: instr: "RET Z"
3572-3578 z80: memrd: "C8"
3576-3579 z80: addr: "01AC"
3578-3581 z80: memrd: "82"
3579-3582 z80: addr: "01AD"
3578-3583 z80: rop: "E382"
3581-3583 z80: memrd: "E3"
3582-3587 z80: addr: "E382"
3583-3589 z80: instr: "RET NC"
3583-3589 z80: memrd: "D0"
3587-3590 z80: addr: "01AE"
3589-3592 z80: memrd: "0A"
3590-3593 z80: addr: "01AF"
3589-3594 z80: rop: "F40A"
3592-3594 z80: memrd: "F4"
3593-3597 z80: addr: "F40A"
3594-3599 z80: memrd: "38"
3597-3600 z80: addr: "F40B"
3594-3601 z80: instr: "JR C,$+9"
3599-3601 z80: memrd: "07"
3600-3606 z80: addr: "F40C"
3601-3607 z80: instr: "DEC BC"
3601-3607 z80: memrd: "0B"
3606-3610 z80: addr: "F40D"
3607-3611 z80: instr: "LD A,B"
3607-3611 z80: memrd: "78"
3610-3614 z80: addr: "F40E"
3611-3615 z80: instr: "OR C"
3611-3615 z80: memrd: "B1"
3614-3618 z80: addr: "F40F"
3615-3620 z80: memrd: "20"
3618-3626 z80: addr: "F410"
3615-3627 z80: instr: "JR NZ,$-8"
3620-3627 z80: memrd: "F6"
3626-3630 z80: addr: "F407"
3627-3632 z80: memrd: "CD"
3630-3633 z80: addr: "F408"
3632-3635 z80: memrd: "7F"
3633-3638 z80: addr: "F409"
3627-3639 z80: instr: "CALL 0E37Fh"
3635-3639 z80: memrd: "E3"
3638-3641 z80: addr: "01AF"
3639-3642 z80: memwr: "F4"
3641-3643 z80: addr: "01AE"
3639-3644 z80: wop: "F40A"
3642-3644 z80: memwr: "0A"
3643-3647 z80: addr: "E37F"
3644-3649 z80: memrd: "CD"
3647-3650 z80: addr: "E380"
3649-3652 z80: memrd: "74"
3650-3655 z80: addr: "E381"
3644-3656 z80: instr: "CALL 0E374h"
3652-3656 z80: memrd: "E3"
3655-3658 z80: addr: "01AD"
3656-3659 z80: memwr: "E3"
3658-3660 z80: addr: "01AC"
3656-3661 z80: wop: "E382"
3659-3661 z80: memwr: "82"
3660-3664 z80: addr: "E374"
3661-3665 z80: instr: "OR A"
3661-3665 z80: memrd: "B7"
3664-3668 z80: addr: "E375"
3665-3669 z80: memrd: "DD"
3668-3672 z80: addr: "E376"
3669-3674 z80: memrd: "CB"
3672-3675 z80: addr: "E377"
3674-3677 z80: memrd: "08"
3675-3680 z80: addr: "E378"
3665-3682 z80: instr: "BIT 0,(IX+8)"
3677-3682 z80: memrd: "46"
3680-3684 z80: addr: "01F8"
3682-3685 z80: rop: "80"
3682-3685 z80: memrd: "80"
3684-3689 z80: addr: "E379"
3685-3691 z80: instr: "RET Z"
3685-3691 z80: memrd: "C8"
3689-3692 z80: addr: "01AC"
3691-3694 z80: memrd: "82"
3692-3695 z80: addr: "01AD"
3691-3696 z80: rop: "E382"
3694-3696 z80: memrd: "E3"
3695-3700 z80: addr: "E382"
3696-3702 z80: instr: "RET NC"
3696-3702 z80: memrd: "D0"
3700-3703 z80: addr: "01AE"
3702-3705 z80: memrd: "0A"
3703-3706 z80: addr: "01AF"
3702-3707 z80: rop: "F40A"
3705-3707 z80: memrd: "F4"
3706-3710 z80: addr: "F40A"
3707-3712 z80: memrd: "38"
3710-3713 z80: addr: "F40B"
3707-3714 z80: instr: "JR C,$+9"
3712-3714 z80: memrd: "07"
3713-3719 z80: addr: "F40C"
3714-3720 z80: instr: "DEC BC"
3714-3720 z80: memrd: "0B"
3719-3723 z80: addr: "F40D"
3720-3724 z80: instr: "LD A,B"
3720-3724 z80: memrd: "78"
3723-3727 z80: addr: "F40E"
3724-3728 z80: instr: "OR C"
3724-3728 z80: memrd: "B1"
3727-3731 z80: addr: "F40F"
3728-3733 z80: memrd: "20"
3731-3739 z80: addr: "F410"
3728-3740 z80: instr: "JR NZ,$-8"
3733-3740 z80: memrd: "F6"
3739-3743 z80: addr: "F407"
3740-3745 z80: memrd: "CD"
3743-3746 z80: addr: "F408"
3745-3748 z80: memrd: "7F"
3746-3751 z80: addr: "F409"
3740-3752 z80: instr: "CALL 0E37Fh"
3748-3752 z80: memrd: "E3"
3751-3754 z80: addr: "01AF"
3752-3755 z80: memwr: "F4"
3754-3756 z80: addr: "01AE"
3752-3757 z80: wop: "F40A"
3755-3757 z80: memwr: "0A"
3756-3760 z80: addr: "E37F"
3757-3762 z80: memrd: "CD"
3760-3763 z80: addr: "E380"
3762-3765 z80: memrd: "74"
3763-3768 z80: addr: "E381"
3757-3769 z80: instr: "CALL 0E374h"
3765-3769 z80: memrd: "E3"
3768-3771 z80: addr: "01AD"
3769-3772 z80: memwr: "E3"
3771-3773 z80: addr: "01AC"
3769-3774 z80: wop: "E382"
3772-3774 z80: memwr: "82"
3773-3777 z80: addr: "E374"
3774-3778 z80: instr: "OR A"
3774-3778 z80: memrd: "B7"
3777-3781 z80: addr: "E375"
3778-3782 z80: memrd: "DD"
3781-3785 z80: addr: "E376"
3782-3787 z80: memrd: "CB"
3785-3788 z80: addr: "E377"
3787-3790 z80: memrd: "08"
3788-3793 z80: addr: "E378"
3778-3795 z80: instr: "BIT 0,(IX+8)"
3790-3795 z80: memrd: "46"
3793-3797 z80: addr: "01F8"
3795-3798 z80: rop: "80"
3795-3798 z80: memrd: "80"
3797-3802 z80: addr: "E379"
3798-3804 z80: instr: "RET Z"
3798-3804 z80: memrd: "C8"
3802-3805 z80: addr: "01AC"
3804-3807 z80: memrd: "82"
3805-3808 z80: addr: "01AD"
3804-3809 z80: rop: "E382"
3807-3809 z80: memrd: "E3"
3808-3813 z80: addr: "E382"
3809-3815 z80: instr: "RET NC"
3809-3815 z80: memrd: "D0"
3813-3816 z80: addr: "01AE"
3815-3818 z80: memrd: "0A"
3816-3819 z80: addr: "01AF"
3815-3820 z80: rop: "F40A"
3818-3820 z80: memrd: "F4"
3819-3823 z80: addr: "F40A"
3820-3825 z80: memrd: "38"
3823-3826 z80: addr: "F40B"
3820-3827 z80: instr: "JR C,$+9"
3825-3827 z80: memrd: "07"
3826-3832 z80: addr: "F40C"
3827-3833 z80: instr: "DEC BC"
3827-3833 z80: memrd: "0B"
3832-3836 z80: addr: "F40D"
3833-3837 z80: instr: "LD A,B"
3833-3837 z80: memrd: "78"
3836-3840 z80: addr: "F40E"
3837-3841 z80: instr: "OR C"
3837-3841 z80: memrd: "B1"
3840-3844 z80: addr: "F40F"
3841-3846 z80: memrd: "20"
3844-3852 z80: addr: "F410"
3841-3853 z80: instr: "JR NZ,$-8"
3846-3853 z80: memrd: "F6"
3852-3856 z80: addr: "F407"
3853-3858 z80: memrd: "CD"
3856-3859 z80: addr: "F408"
3858-3861 z80: memrd: "7F"
3859-3864 z80: addr: "F409"
3853-3865 z80: instr: "CALL 0E37Fh"
3861-3865 z80: memrd: "E3"
3864-3867 z80: addr: "01AF"
3865-3868 z80: memwr: "F4"
3867-3869 z80: addr: "01AE"
3865-3870 z80: wop: "F40A"
3868-3870 z80: memwr: "0A"
3869-3873 z80: addr: "E37F"
3870-3875 z80: memrd: "CD"
3873-3876 z80: addr: "E380"
3875-3878 z80: memrd: "74"
3876-3881 z80: addr: "E381"
3870-3882 z80: instr: "CALL 0E374h"
3878-3882 z80: memrd: "E3"
3881-3884 z80: addr: "01AD"
3882-3885 z80: memwr: "E3"
3884-3886 z80: addr: "01AC"
3882-3887 z80: wop: "E382"
3885-3887 z80: memwr: "82"
3886-3890 z80: addr: "E374"
3887-3891 z80: instr: "OR A"
3887-3891 z80: memrd: "B7"
3890-3894 z80: addr: "E375"
3891-3895 z80: memrd: "DD"
3894-3898 z80: addr: "E376"
3895-3900 z80: memrd: "CB"
3898-3901 z80: addr: "E377"
3900-3903 z80: memrd: "08"
3901-3906 z80: addr: "E378"
3891-3908 z80: instr: "BIT 0,(IX+8)"
3903-3908 z80: memrd: "46"
3906-3910 z80: addr: "01F8"
3908-3911 z80: rop: "80"
3908-3911 z80: memrd: "80"
3910-3915 z80: addr: "E379"
3911-3917 z80: instr: "RET Z"
3911-3917 z80: memrd: "C8"
3915-3918 z80: addr: "01AC"
3917-3920 z80: memrd: "82"
3918-3921 z80: addr: "01AD"
3917-3922 z80: rop: "E382"
3920-3922 z80: memrd: "E3"
3921-3926 z80: addr: "E382"
3922-3928 z80: instr: "RET NC"
3922-3928 z80: memrd: "D0"
3926-3929 z80: addr: "01AE"
3928-3931 z80: memrd: "0A"
3929-3932 z80: addr: "01AF"
3928-3933 z80: rop: "F40A"
3931-3933 z80: memrd: "F4"
3932-3936 z80: addr: "F40A"
3933-3938 z80: memrd: "38"
3936-3939 z80: addr: "F40B"
3933-3940 z80: instr: "JR C,$+9"
3938-3940 z80: memrd: "07"
3939-3945 z80: addr: "F40C"
3940-3946 z80: instr: "DEC BC"
3940-3946 z80: memrd: "0B"
3945-3949 z80: addr: "F40D"
3946-3950 z80: instr: "LD A,B"
3946-3950 z80: memrd: "78"
3949-3953 z80: addr: "F40E"
3950-3954 z80: instr: "OR C"
3950-3954 z80: memrd: "B1"
3953-3957 z80: addr: "F40F"
3954-3959 z80: memrd: "20"
3957-3965 z80: addr: "F410"
3954-3966 z80: instr: "JR NZ,$-8"
3959-3966 z80: memrd: "F6"
3965-3969 z80: addr: "F407"
3966-3971 z80: memrd: "CD"
3969-3972 z80: addr: "F408"
3971-3974 z80: memrd: "7F"
3972-3977 z80: addr: "F409"
3966-3978 z80: instr: "CALL 0E37Fh"
3974-3978 z80: memrd: "E3"
3977-3980 z80: addr: "01AF"
3978-3981 z80: memwr: "F4"
3980-3982 z80: addr: "01AE"
3978-3983 z80: wop: "F40A"
3981-3983 z80: memwr: "0A"
3982-3986 z80: addr: "E37F"
3983-3988 z80: memrd: "CD"
3986-3989 z80: addr: "E380"
3988-3991 z80: memrd: "74"
3989-3994 z80: addr: "E381"
3983-3995 z80: instr: "CALL 0E374h"
3991-3995 z80: memrd: "E3"
3994-3997 z80: addr: "01AD"
3995-3998 z80: memwr: "E3"
3997-3999 z80: addr: "01AC"
3995-4000 z80: wop: "E382"
3998-4000 z80: memwr: "82"
3999-4003 z80: addr: "E374"
4000-4004 z80: instr: "OR A"
4000-4004 z80: memrd: "B7"
4003-4007 z80: addr: "E375"
4004-4008 z80: memrd: "DD"
4007-4011 z80: addr: "E376"
4008-4013 z80: memrd: "CB"
4011-4014 z80: addr: "E377"
4013-4016 z80: memrd: "08"
4014-4019 z80: addr: "E378"
4004-4021 z80: instr: "BIT 0,(IX+8)"
4016-4021 z80: memrd: "46"
4019-4023 z80: addr: "01F8"
4021-4024 z80: rop: "80"
4021-4024 z80: memrd: "80"
4023-4028 z80: addr: "E379"
4024-4030 z80: instr: "RET Z"
4024-4030 z80: memrd: "C8"
4028-4031 z80: addr: "01AC"
4030-4033 z80: memrd: "82"
4031-4034 z80: addr: "01AD"
4030-4035 z80: rop: "E382"
4033-4035 z80: memrd: "E3"
4034-4039 z80: addr: "E382"
4035-4041 z80: instr: "RET NC"
4035-4041 z80: memrd: "D0"
4039-4042 z80: addr: "01AE"
4041-4044 z80: memrd: "0A"
4042-4045 z80: addr: "01AF"
4041-4046 z80: rop: "F40A"
4044-4046 z80: memrd: "F4"
4045-4049 z80: addr: "F40A"
4046-4051 z80: memrd: "38"
4049-4052 z80: addr: "F40B"
4046-4053 z80: instr: "JR C,$+9"
4051-4053 z80: memrd: "07"
4052-4058 z80: addr: "F40C"
4053-4059 z80: instr: "DEC BC"
4053-4059 z80: memrd: "0B"
4058-4062 z80: addr: "F40D"
4059-4063 z80: instr: "LD A,B"
4059-4063 z80: memrd: "78"
4062-4066 z80: addr: "F40E"
4063-4067 z80: instr: "OR C"
4063-4067 z80: memrd: "B1"
4066-4070 z80: addr: "F40F"
4067-4072 z80: memrd: "20"
4070-4078 z80: addr: "F410"
4067-4079 z80: instr: "JR NZ,$-8"
4072-4079 z80: memrd: "F6"
4078-4082 z80: addr: "F407"
4079-4084 z80: memrd: "CD"
4082-4085 z80: addr: "F408"
4084-4087 z80: memrd: "7F"
4085-4090 z80: addr: "F409"
4079-4091 z80: instr: "CALL 0E37Fh"
4087-4091 z80: memrd: "E3"
4090-4093 z80: addr: "01AF"
4091-4094 z80: memwr: "F4"
4093-4095 z80: addr: "01AE"
4091-4096 z80: wop: "F40A"
4094-4096 z80: memwr: "0A"
4095-4099 z80: addr: "E37F"
4096-4101 z80: memrd: "CD"
4099-4102 z80: addr: "E380"
4101-4104 z80: memrd: "74"
4102-4107 z80: addr: "E381"
4096-4108 z80: instr: "CALL 0E374h"
4104-4108 z80: memrd: "E3"
4107-4110 z80: addr: "01AD"
4108-4111 z80: memwr: "E3"
4110-4112 z80: addr: "01AC"
4108-4113 z80: wop: "E382"
4111-4113 z80: memwr: "82"
4112-4116 z80: addr: "E374"
4113-4117 z80: instr: "OR A"
4113-4117 z80: memrd: "B7"
4116-4120 z80: addr: "E375"
4117-4121 z80: memrd: "DD"
4120-4124 z80: addr: "E376"
4121-4126 z80: memrd: "CB"
4124-4127 z80: addr: "E377"
4126-4129 z80: memrd: "08"
4127-4132 z80: addr: "E378"
4117-4134 z80: instr: "BIT 0,(IX+8)"
4129-4134 z80: memrd: "46"
4132-4136 z80: addr: "01F8"
4134-4137 z80: rop: "80"
4134-4137 z80: memrd: "80"
4136-4141 z80: addr: "E379"
4137-4143 z80: instr: "RET Z"
4137-4143 z80: memrd: "C8"
4141-4144 z80: addr: "01AC"
4143-4146 z80: memrd: "82"
4144-4147 z80: addr: "01AD"
4143-4148 z80: rop: "E382"
4146-4148 z80: memrd: "E3"
4147-4152 z80: addr: "E382"
4148-4154 z80: instr: "RET NC"
4148-4154 z80: memrd: "D0"
4152-4155 z80: addr: "01AE"
4154-4157 z80: memrd: "0A"
4155-4158 z80: addr: "01AF"
4154-4159 z80: rop: "F40A"
4157-4159 z80: memrd: "F4"
4158-4162 z80: addr: "F40A"
4159-4164 z80: memrd: "38"
4162-4165 z80: addr: "F40B"
4159-4166 z80: instr: "JR C,$+9"
4164-4166 z80: memrd: "07"
4165-4171 z80: addr: "F40C"
4166-4172 z80: instr: "DEC BC"
4166-4172 z80: memrd: "0B"
4171-4175 z80: addr: "F40D"
4172-4176 z80: instr: "LD A,B"
4172-4176 z80: memrd: "78"
4175-4179 z80: addr: "F40E"
4176-4180 z80: instr: "OR C"
4176-4180 z80: memrd: "B1"
4179-4183 z80: addr: "F40F"
4180-4185 z80: memrd: "20"
4183-4191 z80: addr: "F410"
4180-4192 z80: instr: "JR NZ,$-8"
4185-4192 z80: memrd: "F6"
4191-4195 z80: addr: "F407"
4192-4197 z80: memrd: "CD"
4195-4198 z80: addr: "F408"
4197-4200 z80: memrd: "7F"
4198-4203 z80: addr: "F409"
4192-4204 z80: instr: "CALL 0E37Fh"
4200-4204 z80: memrd: "E3"
4203-4206 z80: addr: "01AF"
4204-4207 z80: memwr: "F4"
4206-4208 z80: addr: "01AE"
4204-4209 z80: wop: "F40A"
4207-4209 z80: memwr: "0A"
4208-4212 z80: addr: "E37F"
4209-4214 z80: memrd: "CD"
4212-4215 z80: addr: "E380"
4214-4217 z80: memrd: "74"
4215-4220 z80: addr: "E381"
4209-4221 z80: instr: "CALL 0E374h"
4217-4221 z80: memrd: "E3"
4220-4223 z80: addr: "01AD"
4221-4224 z80: memwr: "E3"
4223-4225 z80: addr: "01AC"
4221-4226 z80: wop: "E382"
4224-4226 z80: memwr: "82"
4225-4229 z80: addr: "E374"
4226-4230 z80: instr: "OR A"
4226-4230 z80: memrd: "B7"
4229-4233 z80: addr: "E375"
4230-4234 z80: memrd: "DD"
4233-4237 z80: addr: "E376"
4234-4239 z80: memrd: "CB"
4237-4240 z80: addr: "E377"
4239-4242 z80: memrd: "08"
4240-4245 z80: addr: "E378"
4230-4247 z80: instr: "BIT 0,(IX+8)"
4242-4247 z80: memrd: "46"
4245-4249 z80: addr: "01F8"
4247-4250 z80: rop: "80"
4247-4250 z80: memrd: "80"
4249-4254 z80: addr: "E379"
4250-4256 z80: instr: "RET Z"
4250-4256 z80: memrd: "C8"
4254-4257 z80: addr: "01AC"
4256-4259 z80: memrd: "82"
4257-4260 z80: addr: "01AD"
4256-4261 z80: rop: "E382"
4259-4261 z80: memrd: "E3"
4260-4265 z80: addr: "E382"
4261-4267 z80: instr: "RET NC"
4261-4267 z80: memrd: "D0"
4265-4268 z80: addr: "01AE"
4267-4270 z80: memrd: "0A"
4268-4271 z80: addr: "01AF"
4267-4272 z80: rop: "F40A"
4270-4272 z80: memrd: "F4"
4271-4275 z80: addr: "F40A"
4272-4277 z80: memrd: "38"
4275-4278 z80: addr: "F40B"
4272-4279 z80: instr: "JR C,$+9"
4277-4279 z80: memrd: "07"
4278-4284 z80: addr: "F40C"
4279-4285 z80: instr: "DEC BC"
4279-4285 z80: memrd: "0B"
4284-4288 z80: addr: "F40D"
4285-4289 z80: instr: "LD A,B"
4285-4289 z80: memrd: "78"
4288-4292 z80: addr: "F40E"
4289-4293 z80: instr: "OR C"
4289-4293 z80: memrd: "B1"
4292-4296 z80: addr: "F40F"
4293-4298 z80: memrd: "20"
4296-4304 z80: addr: "F410"
4293-4305 z80: instr: "JR NZ,$-8"
4298-4305 z80: memrd: "F6"
4304-4308 z80: addr: "F407"
4305-4310 z80: memrd: "CD"
4308-4311 z80: addr: "F408"
4310-4313 z80: memrd: "7F"
4311-4316 z80: addr: "F409"
4305-4317 z80: instr: "CALL 0E37Fh"
4313-4317 z80: memrd: "E3"
4316-4319 z80: addr: "01AF"
4317-4320 z80: memwr: "F4"
4319-4321 z80: addr: "01AE"
4317-4322 z80: wop: "F40A"
4320-4322 z80: memwr: "0A"
4321-4325 z80: addr: "E37F"
4322-4327 z80: memrd: "CD"
4325-4328 z80: addr: "E380"
4327-4330 z80: memrd: "74"
4328-4333 z80: addr: "E381"
4322-4334 z80: instr: "CALL 0E374h"
4330-4334 z80: memrd: "E3"
4333-4336 z80: addr: "01AD"
4334-4337 z80: memwr: "E3"
4336-4338 z80: addr: "01AC"
4334-4339 z80: wop: "E382"
4337-4339 z80: memwr: "82"
4338-4342 z80: addr: "E374"
4339-4343 z80: instr: "OR A"
4339-4343 z80: memrd: "B7"
4342-4346 z80: addr: "E375"
4343-4347 z80: memrd: "DD"
4346-4350 z80: addr: "E376"
4347-4352 z80: memrd: "CB"
4350-4353 z80: addr: "E377"
4352-4355 z80: memrd: "08"
4353-4358 z80: addr: "E378"
4343-4360 z80: instr: "BIT 0,(IX+8)"
4355-4360 z80: memrd: "46"
4358-4362 z80: addr: "01F8"
4360-4363 z80: rop: "80"
4360-4363 z80: memrd: "80"
4362-4367 z80: addr: "E379"
4363-4369 z80: instr: "RET Z"
4363-4369 z80: memrd: "C8"
4367-4370 z80: addr: "01AC"
4369-4372 z80: memrd: "82"
4370-4373 z80: addr: "01AD"
4369-4374 z80: rop: "E382"
4372-4374 z80: memrd: "E3"
4373-4378 z80: addr: "E382"
4374-4380 z80: instr: "RET NC"
4374-4380 z80: memrd: "D0"
4378-4381 z80: addr: "01AE"
4380-4383 z80: memrd: "0A"
4381-4384 z80: addr: "01AF"
4380-4385 z80: rop: "F40A"
4383-4385 z80: memrd: "F4"
4384-4388 z80: addr: "F40A"
4385-4390 z80: memrd: "38"
4388-4391 z80: addr: "F40B"
4385-4392 z80: instr: "JR C,$+9"
4390-4392 z80: memrd: "07"
4391-4397 z80: addr: "F40C"
4392-4398 z80: instr: "DEC BC"
4392-4398 z80: memrd: "0B"
4397-4401 z80: addr: "F40D"
4398-4402 z80: instr: "LD A,B"
4398-4402 z80: memrd: "78"
4401-4405 z80: addr: "F40E"
4402-4406 z80: instr: "OR C"
4402-4406 z80: memrd: "B1"
4405-4409 z80: addr: "F40F"
4406-4411 z80: memrd: "20"
4409-4417 z80: addr: "F410"
4406-4418 z80: instr: "JR NZ,$-8"
4411-4418 z80: memrd: "F6"
4417-4421 z80: addr: "F407"
4418-4423 z80: memrd: "CD"
4421-4424 z80: addr: "F408"
4423-4426 z80: memrd: "7F"
4424-4429 z80: addr: "F409"
4418-4430 z80: instr: "CALL 0E37Fh"
4426-4430 z80: memrd: "E3"
4429-4432 z80: addr: "01AF"
4430-4433 z80: memwr: "F4"
4432-4434 z80: addr: "01AE"
4430-4435 z80: wop: "F40A"
4433-4435 z80: memwr: "0A"
4434-4438 z80: addr: "E37F"
4435-4440 z80: memrd: "CD"
4438-4441 z80: addr: "E380"
4440-4443 z80: memrd: "74"
4441-4446 z80: addr: "E381"
4435-4447 z80: instr: "CALL 0E374h"
4443-4447 z80: memrd: "E3"
4446-4449 z80: addr: "01AD"
4447-4450 z80: memwr: "E3"
4449-4451 z80: addr: "01AC"
4447-4452 z80: wop: "E382"
4450-4452 z80: memwr: "82"
4451-4455 z80: addr: "E374"
4452-4456 z80: instr: "OR A"
4452-4456 z80: memrd: "B7"
4455-4459 z80: addr: "E375"
4456-4460 z80: memrd: "DD"
4459-4463 z80: addr: "E376"
4460-4465 z80: memrd: "CB"
4463-4466 z80: addr: "E377"
4465-4468 z80: memrd: "08"
4466-4471 z80: addr: "E378"
4456-4473 z80: instr: "BIT 0,(IX+8)"
4468-4473 z80: memrd: "46"
4471-4475 z80: addr: "01F8"
4473-4476 z80: rop: "80"
4473-4476 z80: memrd: "80"
4475-4480 z80: addr: "E379"
4476-4482 z80: instr: "RET Z"
4476-4482 z80: memrd: "C8"
4480-4483 z80: addr: "01AC"
4482-4485 z80: memrd: "82"
4483-4486 z80: addr: "01AD"
4482-4487 z80: rop: "E382"
4485-4487 z80: memrd: "E3"
4486-4491 z80: addr: "E382"
4487-4493 z80: instr: "RET NC"
4487-4493 z80: memrd: "D0"
4491-4494 z80: addr: "01AE"
4493-4496 z80: memrd: "0A"
4494-4497 z80: addr: "01AF"
4493-4498 z80: rop: "F40A"
4496-4498 z80: memrd: "F4"
4497-4501 z80: addr: "F40A"
4498-4503 z80: memrd: "38"
4501-4504 z80: addr: "F40B"
4498-4505 z80: instr: "JR C,$+9"
4503-4505 z80: memrd: "07"
4504-4510 z80: addr: "F40C"
4505-4511 z80: instr: "DEC BC"
4505-4511 z80: memrd: "0B"
4510-4514 z80: addr: "F40D"
4511-4515 z80: instr: "LD A,B"
4511-4515 z80: memrd: "78"
4514-4518 z80: addr: "F40E"
4515-4519 z80: instr: "OR C"
4515-4519 z80: memrd: "B1"
4518-4522 z80: addr: "F40F"
4519-4524 z80: memrd: "20"
4522-4530 z80: addr: "F410"
4519-4531 z80: instr: "JR NZ,$-8"
4524-4531 z80: memrd: "F6"
4530-4534 z80: addr: "F407"
4531-4536 z80: memrd: "CD"
4534-4537 z80: addr: "F408"
4536-4539 z80: memrd: "7F"
4537-4542 z80: addr: "F409"
4531-4543 z80: instr: "CALL 0E37Fh"
4539-4543 z80: memrd: "E3"
4542-4545 z80: addr: "01AF"
4543-4546 z80: memwr: "F4"
4545-4547 z80: addr: "01AE"
4543-4548 z80: wop: "F40A"
4546-4548 z80: memwr: "0A"
4547-4551 z80: addr: "E37F"
4548-4553 z80: memrd: "CD"
4551-4554 z80: addr: "E380"
4553-4556 z80: memrd: "74"
4554-4559 z80: addr: "E381"
4548-4560 z80: instr: "CALL 0E374h"
4556-4560 z80: memrd: "E3"
4559-4562 z80: addr: "01AD"
4560-4563 z80: memwr: "E3"
4562-4564 z80: addr: "01AC"
4560-4565 z80: wop: "E382"
4563-4565 z80: memwr: "82"
4564-4568 z80: addr: "E374"
4565-4569 z80: instr: "OR A"
4565-4569 z80: memrd: "B7"
4568-4572 z80: addr: "E375"
4569-4573 z80: memrd: "DD"
4572-4576 z80: addr: "E376"
4573-4578 z80: memrd: "CB"
4576-4579 z80: addr: "E377"
4578-4581 z80: memrd: "08"
4579-4584 z80: addr: "E378"
4569-4586 z80: instr: "BIT 0,(IX+8)"
4581-4586 z80: memrd: "46"
4584-4588 z80: addr: "01F8"
4586-4589 z80: rop: "80"
4586-4589 z80: memrd: "80"
4588-4593 z80: addr: "E379"
4589-4595 z80: instr: "RET Z"
4589-4595 z80: memrd: "C8"
4593-4596 z80: addr: "01AC"
4595-4598 z80: memrd: "82"
4596-4599 z80: addr: "01AD"
4595-4600 z80: rop: "E382"
4598-4600 z80: memrd: "E3"
4599-4604 z80: addr: "E382"
4600-4606 z80: instr: "RET NC"
4600-4606 z80: memrd: "D0"
4604-4607 z80: addr: "01AE"
4606-4609 z80: memrd: "0A"
4607-4610 z80: addr: "01AF"
4606-4611 z80: rop: "F40A"
4609-4611 z80: memrd: "F4"
4610-4614 z80: addr: "F40A"
4611-4616 z80: memrd: "38"
4614-4617 z80: addr: "F40B"
4611-4618 z80: instr: "JR C,$+9"
4616-4618 z80: memrd: "07"
4617-4623 z80: addr: "F40C"
4618-4624 z80: instr: "DEC BC"
4618-4624 z80: memrd: "0B"
4623-4627 z80: addr: "F40D"
4624-4628 z80: instr: "LD A,B"
4624-4628 z80: memrd: "78"
4627-4631 z80: addr: "F40E"
4628-4632 z80: instr: "OR C"
4628-4632 z80: memrd: "B1"
4631-4635 z80: addr: "F40F"
4632-4637 z80: memrd: "20"
4635-4643 z80: addr: "F410"
4632-4644 z80: instr: "JR NZ,$-8"
4637-4644 z80: memrd: "F6"
4643-4647 z80: addr: "F407"
4644-4649 z80: memrd: "CD"
4647-4650 z80: addr: "F408"
4649-4652 z80: memrd: "7F"
4650-4655 z80: addr: "F409"
4644-4656 z80: instr: "CALL 0E37Fh"
4652-4656 z80: memrd: "E3"
4655-4658 z80: addr: "01AF"
4656-4659 z80: memwr: "F4"
4658-4660 z80: addr: "01AE"
4656-4661 z80: wop: "F40A"
4659-4661 z80: memwr: "0A"
4660-4664 z80: addr: "E37F"
4661-4666 z80: memrd: "CD"
4664-4667 z80: addr: "E380"
4666-4669 z80: memrd: "74"
4667-4672 z80: addr: "E381"
4661-4673 z80: instr: "CALL 0E374h"
4669-4673 z80: memrd: "E3"
4672-4675 z80: addr: "01AD"
4673-4676 z80: memwr: "E3"
4675-4677 z80: addr: "01AC"
4673-4678 z80: wop: "E382"
4676-4678 z80: memwr: "82"
4677-4681 z80: addr: "E374"
4678-4682 z80: instr: "OR A"
4678-4682 z80: memrd: "B7"
4681-4685 z80: addr: "E375"
4682-4686 z80: memrd: "DD"
4685-4689 z80: addr: "E376"
4686-4691 z80: memrd: "CB"
4689-4692 z80: addr: "E377"
4691-4694 z80: memrd: "08"
4692-4697 z80: addr: "E378"
4682-4699 z80: instr: "BIT 0,(IX+8)"
4694-4699 z80: memrd: "46"
4697-4701 z80: addr: "01F8"
4699-4702 z80: rop: "80"
4699-4702 z80: memrd: "80"
4701-4706 z80: addr: "E379"
4702-4708 z80: instr: "RET Z"
4702-4708 z80: memrd: "C8"
4706-4709 z80: addr: "01AC"
4708-4711 z80: memrd: "82"
4709-4712 z80: addr: "01AD"
4708-4713 z80: rop: "E382"
4711-4713 z80: memrd: "E3"
4712-4717 z80: addr: "E382"
4713-4719 z80: instr: "RET NC"
4713-4719 z80: memrd: "D0"
4717-4720 z80: addr: "01AE"
4719-4722 z80: memrd: "0A"
4720-4723 z80: addr: "01AF"
4719-4724 z80: rop: "F40A"
4722-4724 z80: memrd: "F4"
4723-4727 z80: addr: "F40A"
4724-4729 z80: memrd: "38"
4727-4730 z80: addr: "F40B"
4724-4731 z80: instr: "JR C,$+9"
4729-4731 z80: memrd: "07"
4730-4736 z80: addr: "F40C"
4731-4737 z80: instr: "DEC BC"
4731-4737 z80: memrd: "0B"
4736-4740 z80: addr: "F40D"
4737-4741 z80: instr: "LD A,B"
4737-4741 z80: memrd: "78"
4740-4744 z80: addr: "F40E"
4741-4745 z80: instr: "OR C"
4741-4745 z80: memrd: "B1"
4744-4748 z80: addr: "F40F"
4745-4750 z80: memrd: "20"
4748-4756 z80: addr: "F410"
4745-4757 z80: instr: "JR NZ,$-8"
4750-4757 z80: memrd: "F6"
4756-4760 z80: addr: "F407"
4757-4762 z80: memrd: "CD"
4760-4763 z80: addr: "F408"
4762-4765 z80: memrd: "7F"
4763-4768 z80: addr: "F409"
4757-4769 z80: instr: "CALL 0E37Fh"
4765-4769 z80: memrd: "E3"
4768-4771 z80: addr: "01AF"
4769-4772 z80: memwr: "F4"
4771-4773 z80: addr: "01AE"
4769-4774 z80: wop: "F40A"
4772-4774 z80: memwr: "0A"
4773-4777 z80: addr: "E37F"
4774-4779 z80: memrd: "CD"
4777-4780 z80: addr: "E380"
4779-4782 z80: memrd: "74"
4780-4785 z80: addr: "E381"
4774-4786 z80: instr: "CALL 0E374h"
4782-4786 z80: memrd: "E3"
4785-4788 z80: addr: "01AD"
4786-4789 z80: memwr: "E3"
4788-4790 z80: addr: "01AC"
4786-4791 z80: wop: "E382"
4789-4791 z80: memwr: "82"
4790-4794 z80: addr: "E374"
4791-4795 z80: instr: "OR A"
4791-4795 z80: memrd: "B7"
4794-4798 z80: addr: "E375"
4795-4799 z80: memrd: "DD"
4798-4802 z80: addr: "E376"
4799-4804 z80: memrd: "CB"
4802-4805 z80: addr: "E377"
4804-4807 z80: memrd: "08"
4805-4810 z80: addr: "E378"
4795-4812 z80: instr: "BIT 0,(IX+8)"
4807-4812 z80: memrd: "46"
4810-4814 z80: addr: "01F8"
4812-4815 z80: rop: "80"
4812-4815 z80: memrd: "80"
4814-4819 z80: addr: "E379"
4815-4821 z80: instr: "RET Z"
4815-4821 z80: memrd: "C8"
4819-4822 z80: addr: "01AC"
4821-4824 z80: memrd: "82"
4822-4825 z80: addr: "01AD"
4821-4826 z80: rop: "E382"
4824-4826 z80: memrd: "E3"
4825-4830 z80: addr: "E382"
4826-4832 z80: instr: "RET NC"
4826-4832 z80: memrd: "D0"
4830-4833 z80: addr: "01AE"
4832-4835 z80: memrd: "0A"
4833-4836 z80: addr: "01AF"
4832-4837 z80: rop: "F40A"
4835-4837 z80: memrd: "F4"
4836-4840 z80: addr: "F40A"
4837-4842 z80: memrd: "38"
4840-4843 z80: addr: "F40B"
4837-4844 z80: instr: "JR C,$+9"
4842-4844 z80: memrd: "07"
4843-4849 z80: addr: "F40C"
4844-4850 z80: instr: "DEC BC"
4844-4850 z80: memrd: "0B"
4849-4853 z80: addr: "F40D"
4850-4854 z80: instr: "LD A,B"
4850-4854 z80: memrd: "78"
4853-4857 z80: addr: "F40E"
4854-4858 z80: instr: "OR C"
4854-4858 z80: memrd: "B1"
4857-4861 z80: addr: "F40F"
4858-4863 z80: memrd: "20"
4861-4869 z80: addr: "F410"
4858-4870 z80: instr: "JR NZ,$-8"
4863-4870 z80: memrd: "F6"
4869-4873 z80: addr: "F407"
4870-4875 z80: memrd: "CD"
4873-4876 z80: addr: "F408"
4875-4878 z80: memrd: "7F"
4876-4881 z80: addr: "F409"
4870-4882 z80: instr: "CALL 0E37Fh"
4878-4882 z80: memrd: "E3"
4881-4884 z80: addr: "01AF"
4882-4885 z80: memwr: "F4"
4884-4886 z80: addr: "01AE"
4882-4887 z80: wop: "F40A"
4885-4887 z80: memwr: "0A"
4886-4890 z80: addr: "E37F"
4887-4892 z80: memrd: "CD"
4890-4893 z80: addr: "E380"
4892-4895 z80: memrd: "74"
4893-4898 z80: addr: "E381"
4887-4899 z80: instr: "CALL 0E374h"
4895-4899 z80: memrd: "E3"
4898-4901 z80: addr: "01AD"
4899-4902 z80: memwr: "E3"
4901-4903 z80: addr: "01AC"
4899-4904 z80: wop: "E382"
4902-4904 z80: memwr: "82"
4903-4907 z80: addr: "E374"
4904-4908 z80: instr: "OR A"
4904-4908 z80: memrd: "B7"
4907-4911 z80: addr: "E375"
4908-4912 z80: memrd: "DD"
4911-4915 z80: addr: "E376"
4912-4917 z80: memrd: "CB"
4915-4918 z80: addr: "E377"
4917-4920 z80: memrd: "08"
4918-4923 z80: addr: "E378"
4908-4925 z80: instr: "BIT 0,(IX+8)"
4920-4925 z80: memrd: "46"
4923-4927 z80: addr: "01F8"
4925-4928 z80: rop: "80"
4925-4928 z80: memrd: "80"
4927-4932 z80: addr: "E379"
4928-4934 z80: instr: "RET Z"
4928-4934 z80: memrd: "C8"
4932-4935 z80: addr: "01AC"
4934-4937 z80: memrd: "82"
4935-4938 z80: addr: "01AD"
4934-4939 z80: rop: "E382"
4937-4939 z80: memrd: "E3"
4938-4943 z80: addr: "E382"
4939-4945 z80: instr: "RET NC"
4939-4945 z80: memrd: "D0"
4943-4946 z80: addr: "01AE"
4945-4948 z80: memrd: "0A"
4946-4949 z80: addr: "01AF"
4945-4950 z80: rop: "F40A"
4948-4950 z80: memrd: "F4"
4949-4953 z80: addr: "F40A"
4950-4955 z80: memrd: "38"
4953-4956 z80: addr: "F40B"
4950-4957 z80: instr: "JR C,$+9"
4955-4957 z80: memrd: "07"
4956-4962 z80: addr: "F40C"
4957-4963 z80: instr: "DEC BC"
4957-4963 z80: memrd: "0B"
4962-4966 z80: addr: "F40D"
4963-4967 z80: instr: "LD A,B"
4963-4967 z80: memrd: "78"
4966-4970 z80: addr: "F40E"
4967-4971 z80: instr: "OR C"
4967-4971 z80: memrd: "B1"
4970-4974 z80: addr: "F40F"
4971-4976 z80: memrd: "20"
4974-4982 z80: addr: "F410"
4971-4983 z80: instr: "JR NZ,$-8"
4976-4983 z80: memrd: "F6"
4982-4986 z80: addr: "F407"
4983-4988 z80: memrd: "CD"
4986-4989 z80: addr: "F408"
4988-4991 z80: memrd: "7F"
4989-4994 z80: addr: "F409"
4983-4995 z80: instr: "CALL 0E37Fh"
4991-4995 z80: memrd: "E3"
4994-4997 z80: addr: "01AF"
4995-4998 z80: memwr: "F4"
4997-4999 z80: addr: "01AE"
