0-1188 ir_sirc: agc: "AGC" "A"
1188-1503 ir_sirc: pause: "Pause" "P"
0-1503 ir_sirc: start: "Start" "S"
1503-2398 ir_sirc: bit: "1"
2398-2994 ir_sirc: bit: "0"
2994-3590 ir_sirc: bit: "0"
3590-4187 ir_sirc: bit: "0"
4187-4783 ir_sirc: bit: "0"
4783-5379 ir_sirc: bit: "0"
5379-5975 ir_sirc: bit: "0"
5975-6571 ir_sirc: bit: "0"
6571-7466 ir_sirc: bit: "1"
7466-8062 ir_sirc: bit: "0"
8062-8956 ir_sirc: bit: "1"
8956-9850 ir_sirc: bit: "1"
9850-10447 ir_sirc: bit: "0"
10447-11341 ir_sirc: bit: "1"
11341-11937 ir_sirc: bit: "0"
11937-12533 ir_sirc: bit: "0"
12533-13130 ir_sirc: bit: "0"
13130-14024 ir_sirc: bit: "1"
14024-14918 ir_sirc: bit: "1"
14918-15797 ir_sirc: bit: "1"
1503-5975 ir_sirc: command: "Command: 0x01" "C:0x01"
5975-9850 ir_sirc: address: "Address: 0x1A" "A:0x1A"
9850-15797 ir_sirc: extended: "Extended: 0xE2" "E:0xE2"
0-15797 ir_sirc: remote: "BlueRay: 2" "BD:2"
22386-23573 ir_sirc: agc: "AGC" "A"
23573-23889 ir_sirc: pause: "Pause" "P"
22386-23889 ir_sirc: start: "Start" "S"
23889-24783 ir_sirc: bit: "1"
24783-25379 ir_sirc: bit: "0"
25379-25975 ir_sirc: bit: "0"
25975-26571 ir_sirc: bit: "0"
26571-27167 ir_sirc: bit: "0"
27167-27764 ir_sirc: bit: "0"
27764-28360 ir_sirc: bit: "0"
28360-28956 ir_sirc: bit: "0"
28956-29850 ir_sirc: bit: "1"
29850-30447 ir_sirc: bit: "0"
30447-31341 ir_sirc: bit: "1"
31341-32235 ir_sirc: bit: "1"
32235-32832 ir_sirc: bit: "0"
32832-33726 ir_sirc: bit: "1"
33726-34322 ir_sirc: bit: "0"
34322-34918 ir_sirc: bit: "0"
34918-35514 ir_sirc: bit: "0"
35514-36408 ir_sirc: bit: "1"
36408-37303 ir_sirc: bit: "1"
37303-38182 ir_sirc: bit: "1"
23889-28360 ir_sirc: command: "Command: 0x01" "C:0x01"
28360-32235 ir_sirc: address: "Address: 0x1A" "A:0x1A"
32235-38182 ir_sirc: extended: "Extended: 0xE2" "E:0xE2"
22386-38182 ir_sirc: remote: "BlueRay: 2" "BD:2"
44771-45958 ir_sirc: agc: "AGC" "A"
45958-46274 ir_sirc: pause: "Pause" "P"
44771-46274 ir_sirc: start: "Start" "S"
46274-47168 ir_sirc: bit: "1"
47168-47764 ir_sirc: bit: "0"
47764-48361 ir_sirc: bit: "0"
48361-48957 ir_sirc: bit: "0"
48957-49553 ir_sirc: bit: "0"
