120-152 cc1101: strobe: "Strobe SFTX"
120-152 cc1101: status_reg: "Status = 0F; STATE is IDLE, 15 bytes free in TX FIFO" "Status = 0F"
263-295 cc1101: status_reg: "Status = 0F; STATE is IDLE, 15 bytes free in TX FIFO" "Status = 0F"
263-1107 cc1101: burst_write: "Burst write: FIFO (3F) = 0D 70 E8 D4 E6 86 CB B9 A0 F9 D3 AE 42 A4"
1540-1572 cc1101: strobe: "Strobe SIDLE"
1540-1572 cc1101: status_reg: "Status = 0F; STATE is IDLE, 15 bytes free in TX FIFO" "Status = 0F"
1656-1688 cc1101: status_reg: "Status = 0F; STATE is IDLE, 15 bytes free in TX FIFO" "Status = 0F"
1656-1739 cc1101: single_write: "Write: PKTCTRL1 (07) = 0C"
1779-1811 cc1101: status_reg: "Status = 00; STATE is IDLE, 0 bytes free in TX FIFO" "Status = 00"
1779-1862 cc1101: single_read: "Read: PKTCTRL1 (07) = 0C"
1978-2010 cc1101: status_reg: "Status = 0F; STATE is IDLE, 15 bytes free in TX FIFO" "Status = 0F"
1978-2061 cc1101: single_write: "Write: MCSM2 (16) = 07"
2101-2133 cc1101: status_reg: "Status = 00; STATE is IDLE, 0 bytes free in TX FIFO" "Status = 00"
2101-2183 cc1101: single_read: "Read: MCSM2 (16) = 07"
2300-2332 cc1101: status_reg: "Status = 0F; STATE is IDLE, 15 bytes free in TX FIFO" "Status = 0F"
2300-2383 cc1101: single_write: "Write: WOREVT1 (1E) = 87"
2423-2455 cc1101: status_reg: "Status = 00; STATE is IDLE, 0 bytes free in TX FIFO" "Status = 00"
2423-2505 cc1101: single_read: "Read: WOREVT1 (1E) = 87"
2622-2654 cc1101: status_reg: "Status = 0F; STATE is IDLE, 15 bytes free in TX FIFO" "Status = 0F"
2622-2704 cc1101: single_write: "Write: WOREVT0 (1F) = 6B"
2744-2776 cc1101: status_reg: "Status = 00; STATE is IDLE, 0 bytes free in TX FIFO" "Status = 00"
2744-2827 cc1101: single_read: "Read: WOREVT0 (1F) = 6B"
2935-2967 cc1101: status_reg: "Status = 0F; STATE is IDLE, 15 bytes free in TX FIFO" "Status = 0F"
2935-3018 cc1101: single_write: "Write: WORCTRL (20) = F8"
3058-3090 cc1101: status_reg: "Status = 00; STATE is IDLE, 0 bytes free in TX FIFO" "Status = 00"
3058-3140 cc1101: single_read: "Read: WORCTRL (20) = F8"
3285-3317 cc1101: strobe: "Strobe SIDLE"
3285-3317 cc1101: status_reg: "Status = 0F; STATE is IDLE, 15 bytes free in TX FIFO" "Status = 0F"
3367-3399 cc1101: strobe: "Strobe SFRX"
3367-3399 cc1101: status_reg: "Status = 0F; STATE is IDLE, 15 bytes free in TX FIFO" "Status = 0F"
3449-3482 cc1101: strobe: "Strobe STX"
3449-3482 cc1101: status_reg: "Status = 0F; STATE is IDLE, 15 bytes free in TX FIFO" "Status = 0F"
