50401-50980 ook_oregon: field: "Oregon v3 Preamble" "v3 Preamble" "v3 Pre" "v3"
50980-51078 ook_oregon: field: "Sync" "Syn" "S"
51078-51468 ook_oregon: field: "SensorID: f824" "f824"
51468-51565 ook_oregon: field: "Ch: 1" "1"
51565-51762 ook_oregon: field: "RollingCode: f6" "f6"
51762-51858 ook_oregon: field: "Flags1: 0" "0"
51858-51956 ook_oregon: field: "3" "3"
51956-52053 ook_oregon: field: "7" "7"
52053-52152 ook_oregon: field: "1" "1"
52152-52250 ook_oregon: field: "0" "0"
52250-52346 ook_oregon: field: "4" "4"
52346-52446 ook_oregon: field: "7" "7"
52446-52543 ook_oregon: field: "c" "c"
52543-52640 ook_oregon: field: "5" "5"
52640-52739 ook_oregon: field: "5" "5"
52739-52835 ook_oregon: field: "e" "e"
52835-52920 ook_oregon: field: "d" "d"
51078-51468 ook_oregon: l2: "THGN800,THGN801,THGR810 - Temp_Hum" "THGN800,THGN801,THGR810" "THGN800"
51468-51565 ook_oregon: l2: "Ch 1" "1"
51762-51858 ook_oregon: l2: "Batt OK" "OK"
51858-52250 ook_oregon: l2: "+17.3℃" "17.3"
52250-52446 ook_oregon: l2: "Hum 74%" "74"
52543-52739 ook_oregon: l2: "Checksum OK Calc 55 Rx 55 " "OK"
175817-176399 ook_oregon: field: "Oregon v3 Preamble" "v3 Preamble" "v3 Pre" "v3"
176399-176497 ook_oregon: field: "Sync" "Syn" "S"
176497-176888 ook_oregon: field: "SensorID: 1984" "1984"
176888-176985 ook_oregon: field: "Ch: 0" "0"
176985-177180 ook_oregon: field: "RollingCode: 5e" "5e"
177180-177278 ook_oregon: field: "Flags1: 0" "0"
177278-177376 ook_oregon: field: "2" "2"
177376-177473 ook_oregon: field: "0" "0"
177473-177572 ook_oregon: field: "c" "c"
177572-177669 ook_oregon: field: "3" "3"
177669-177767 ook_oregon: field: "3" "3"
177767-177864 ook_oregon: field: "0" "0"
177864-177962 ook_oregon: field: "0" "0"
177962-178059 ook_oregon: field: "2" "2"
178059-178157 ook_oregon: field: "0" "0"
178157-178256 ook_oregon: field: "f" "f"
178256-178352 ook_oregon: field: "3" "3"
178352-178450 ook_oregon: field: "d" "d"
178450-178536 ook_oregon: field: "e" "e"
176497-176888 ook_oregon: l2: "WGR800 - Wind" "WGR800" "WGR800"
176888-176985 ook_oregon: l2: "Ch 0" "0"
177180-177278 ook_oregon: l2: "Batt OK" "OK"
177278-177376 ook_oregon: l2: "NE (45°)" "NE"
177572-177864 ook_oregon: l2: "Gust 3.3 m/s" "3.3"
177864-178157 ook_oregon: l2: "Speed 2 m/s" "2"
178157-178352 ook_oregon: l2: "Checksum OK Calc 3F Rx 3F " "OK"
186358-186940 ook_oregon: field: "Oregon v3 Preamble" "v3 Preamble" "v3 Pre" "v3"
186940-187038 ook_oregon: field: "Sync" "Syn" "S"
187038-187427 ook_oregon: field: "SensorID: 2914" "2914"
187427-187526 ook_oregon: field: "Ch: 0" "0"
187526-187721 ook_oregon: field: "RollingCode: d2" "d2"
187721-187818 ook_oregon: field: "Flags1: 0" "0"
187818-187916 ook_oregon: field: "0" "0"
187916-188013 ook_oregon: field: "0" "0"
188013-188111 ook_oregon: field: "0" "0"
188111-188209 ook_oregon: field: "0" "0"
188209-188306 ook_oregon: field: "5" "5"
188306-188405 ook_oregon: field: "8" "8"
188405-188503 ook_oregon: field: "8" "8"
188503-188603 ook_oregon: field: "8" "8"
188603-188697 ook_oregon: field: "3" "3"
188697-188795 ook_oregon: field: "0" "0"
188795-188896 ook_oregon: field: "f" "f"
188896-188990 ook_oregon: field: "3" "3"
188990-189089 ook_oregon: field: "e" "e"
189089-189187 ook_oregon: field: "4" "4"
187038-187427 ook_oregon: l2: "PCR800 - Rain" "PCR800" "PCR800"
187427-187526 ook_oregon: l2: "Ch 0" "0"
187721-187818 ook_oregon: l2: "Batt OK" "OK"
187818-188209 ook_oregon: l2: "0 in/hr" "0"
188209-188795 ook_oregon: l2: "Total 38.885 in" "38.885"
188795-188990 ook_oregon: l2: "Checksum OK Calc 3F Rx 3F " "OK"
202887-203738 ook_oregon: field: "Oregon v2.1 Preamble" "v2.1 Preamble" "v2.1 Pre" "v2.1"
203738-203944 ook_oregon: field: "Sync" "Syn" "S"
203944-204770 ook_oregon: field: "SensorID: 5d60" "5d60"
204770-204977 ook_oregon: field: "Ch: 2" "2"
204977-205390 ook_oregon: field: "RollingCode: bc" "bc"
205390-205596 ook_oregon: field: "Flags1: 0" "0"
205596-205803 ook_oregon: field: "2" "2"
205803-206010 ook_oregon: field: "1" "1"
206010-206216 ook_oregon: field: "1" "1"
206216-206422 ook_oregon: field: "0" "0"
206422-206629 ook_oregon: field: "2" "2"
206629-206835 ook_oregon: field: "5" "5"
206835-207042 ook_oregon: field: "0" "0"
207042-207248 ook_oregon: field: "d" "d"
207248-207455 ook_oregon: field: "9" "9"
207455-207661 ook_oregon: field: "0" "0"
207661-207868 ook_oregon: field: "c" "c"
207868-208074 ook_oregon: field: "e" "e"
208074-208281 ook_oregon: field: "5" "5"
208281-208487 ook_oregon: field: "0" "0"
208487-208694 ook_oregon: field: "0" "0"
203944-204770 ook_oregon: l2: "BTHR968 - Temp_Hum_Baro" "BTHR968" "BTHR968"
204770-204977 ook_oregon: l2: "Ch 2" "2"
205390-205596 ook_oregon: l2: "Batt OK" "OK"
205596-206422 ook_oregon: l2: "+11.2℃" "11.2"
206422-206835 ook_oregon: l2: "Hum 52%" "52"
207042-207868 ook_oregon: l2: "1013 mb" "1013"
207868-208281 ook_oregon: l2: "Checksum OK Calc 5E Rx 5E " "OK"
