16632-19965 modbus: sc-server-id: "Slave ID: 247"
16632-19965 modbus: cs-server-id: "Slave ID: 247"
21303-24636 modbus: sc-function: "Function 3: Read Holding Registers"
21303-24636 modbus: cs-function: "Function 3: Read Holding Registers"
25953-29286 modbus: sc-length: "Byte count: 0"
25953-33957 modbus: cs-address: "Start at address 0x0 / 30001"
30624-38607 modbus: sc-error: "CRC should be 192 194"
35274-43279 modbus: cs-length: "Read 2 units of data"
39946-47929 modbus: sc-error: "Message too long"
44596-52600 modbus: cs-crc: "CRC correct"
69493-72826 modbus: sc-server-id: "Slave ID: 247"
69493-72826 modbus: cs-server-id: "Slave ID: 247"
74068-77401 modbus: sc-function: "Function 3: Read Holding Registers"
74068-77401 modbus: cs-function: "Function 3: Read Holding Registers"
78644-81977 modbus: sc-length: "Byte count: 4"
78644-86552 modbus: cs-address: "Start at address 0x400 / 31025"
83219-91128 modbus: sc-data: "0x0000 / 0"
87795-95704 modbus: cs-length: "Read 0 units of data"
92371-100279 modbus: sc-data: "0x0000 / 0"
96946-104855 modbus: cs-error: "CRC should be 80 108"
101522-109430 modbus: sc-crc: "CRC correct"
106097-109430 modbus: cs-error: "Unknown function"
266032-269365 modbus: sc-server-id: "Slave ID: 247"
266032-269365 modbus: cs-server-id: "Slave ID: 247"
270702-274035 modbus: sc-function: "Function 3: Read Holding Registers"
270702-274035 modbus: cs-function: "Function 3: Read Holding Registers"
275352-278685 modbus: sc-length: "Byte count: 0"
275352-283357 modbus: cs-address: "Start at address 0x6 / 30007"
280024-288007 modbus: sc-error: "CRC should be 192 194"
284674-292678 modbus: cs-length: "Read 2 units of data"
289345-297328 modbus: sc-error: "Message too long"
293995-302000 modbus: cs-crc: "CRC correct"
318889-322222 modbus: sc-server-id: "Slave ID: 247"
318889-322222 modbus: cs-server-id: "Slave ID: 247"
323465-326798 modbus: sc-function: "Function 3: Read Holding Registers"
323465-326798 modbus: cs-function: "Function 3: Read Holding Registers"
328041-331374 modbus: sc-length: "Byte count: 4"
328041-335949 modbus: cs-address: "Start at address 0x400 / 31025"
332616-340525 modbus: sc-data: "0x0000 / 0"
337192-345100 modbus: cs-length: "Read 0 units of data"
341767-349676 modbus: sc-data: "0x0000 / 0"
346343-354252 modbus: cs-error: "CRC should be 80 108"
350919-358827 modbus: sc-crc: "CRC correct"
355494-358827 modbus: cs-error: "Unknown function"
516264-519597 modbus: sc-server-id: "Slave ID: 247"
516264-519597 modbus: cs-server-id: "Slave ID: 247"
520934-524267 modbus: sc-function: "Function 3: Read Holding Registers"
520934-524267 modbus: cs-function: "Function 3: Read Holding Registers"
525584-528917 modbus: sc-length: "Byte count: 0"
525584-533588 modbus: cs-address: "Start at address 0xA / 30011"
530255-538238 modbus: sc-error: "CRC should be 192 194"
534905-542910 modbus: cs-length: "Read 2 units of data"
539577-547560 modbus: sc-error: "Message too long"
544227-552231 modbus: cs-crc: "CRC correct"
569118-572451 modbus: sc-server-id: "Slave ID: 247"
569118-572451 modbus: cs-server-id: "Slave ID: 247"
573694-577027 modbus: sc-function: "Function 3: Read Holding Registers"
573694-577027 modbus: cs-function: "Function 3: Read Holding Registers"
578269-581602 modbus: sc-length: "Byte count: 4"
578269-586178 modbus: cs-address: "Start at address 0x400 / 31025"
582845-590754 modbus: sc-data: "0x0000 / 0"
587421-595329 modbus: cs-length: "Read 0 units of data"
591996-599905 modbus: sc-data: "0x0000 / 0"
596572-604480 modbus: cs-error: "CRC should be 80 108"
601147-609056 modbus: sc-crc: "CRC correct"
605723-609056 modbus: cs-error: "Unknown function"
954633-957966 modbus: sc-server-id: "Slave ID: 247"
954633-957966 modbus: cs-server-id: "Slave ID: 247"
959303-962636 modbus: sc-function: "Function 3: Read Holding Registers"
959303-962636 modbus: cs-function: "Function 3: Read Holding Registers"
963953-967286 modbus: sc-length: "Byte count: 0"
963953-971958 modbus: cs-address: "Start at address 0x0 / 30001"
968625-976608 modbus: sc-error: "CRC should be 192 194"
973275-981279 modbus: cs-length: "Read 2 units of data"
977946-985929 modbus: sc-error: "Message too long"
982596-990601 modbus: cs-crc: "CRC correct"
1007493-1010826 modbus: sc-server-id: "Slave ID: 247"
1007493-1010826 modbus: cs-server-id: "Slave ID: 247"
1012069-1015402 modbus: sc-function: "Function 3: Read Holding Registers"
1012069-1015402 modbus: cs-function: "Function 3: Read Holding Registers"
1016644-1019977 modbus: sc-length: "Byte count: 4"
1016644-1024553 modbus: cs-address: "Start at address 0x400 / 31025"
1021220-1029128 modbus: sc-data: "0x0000 / 0"
1025795-1033704 modbus: cs-length: "Read 0 units of data"
1030371-1038280 modbus: sc-data: "0x0000 / 0"
1034947-1042855 modbus: cs-error: "CRC should be 80 108"
1039522-1047431 modbus: sc-crc: "CRC correct"
1044098-1047431 modbus: cs-error: "Unknown function"
1203307-1206640 modbus: sc-server-id: "Slave ID: 247"
1203307-1206640 modbus: cs-server-id: "Slave ID: 247"
1207977-1211310 modbus: sc-function: "Function 3: Read Holding Registers"
1207977-1211310 modbus: cs-function: "Function 3: Read Holding Registers"
1212627-1215960 modbus: sc-length: "Byte count: 0"
1212627-1220632 modbus: cs-address: "Start at address 0x6 / 30007"
1217299-1225282 modbus: sc-error: "CRC should be 192 194"
1221949-1229954 modbus: cs-length: "Read 2 units of data"
1226621-1234604 modbus: sc-error: "Message too long"
1231271-1239275 modbus: cs-crc: "CRC correct"
1256162-1259495 modbus: sc-server-id: "Slave ID: 247"
1256162-1259495 modbus: cs-server-id: "Slave ID: 247"
1260737-1264070 modbus: sc-function: "Function 3: Read Holding Registers"
1260737-1264070 modbus: cs-function: "Function 3: Read Holding Registers"
1265313-1268646 modbus: sc-length: "Byte count: 4"
1265313-1273222 modbus: cs-address: "Start at address 0x400 / 31025"
1269889-1277797 modbus: sc-data: "0x0000 / 0"
1274464-1282373 modbus: cs-length: "Read 0 units of data"
1279040-1286948 modbus: sc-data: "0x0000 / 0"
1283615-1291524 modbus: cs-error: "CRC should be 80 108"
1288191-1296100 modbus: sc-crc: "CRC correct"
1292767-1296100 modbus: cs-error: "Unknown function"
1453880-1457213 modbus: sc-server-id: "Slave ID: 247"
1453880-1457213 modbus: cs-server-id: "Slave ID: 247"
1458550-1461883 modbus: sc-function: "Function 3: Read Holding Registers"
1458550-1461883 modbus: cs-function: "Function 3: Read Holding Registers"
1463200-1466533 modbus: sc-length: "Byte count: 0"
1463200-1471205 modbus: cs-address: "Start at address 0xA / 30011"
1467872-1475855 modbus: sc-error: "CRC should be 192 194"
1472522-1480526 modbus: cs-length: "Read 2 units of data"
1477193-1485176 modbus: sc-error: "Message too long"
1481843-1489848 modbus: cs-crc: "CRC correct"
1506728-1510061 modbus: sc-server-id: "Slave ID: 247"
1506728-1510061 modbus: cs-server-id: "Slave ID: 247"
1511304-1514637 modbus: sc-function: "Function 3: Read Holding Registers"
1511304-1514637 modbus: cs-function: "Function 3: Read Holding Registers"
1515880-1519213 modbus: sc-length: "Byte count: 4"
1515880-1523788 modbus: cs-address: "Start at address 0x400 / 31025"
1520455-1528364 modbus: sc-data: "0x0000 / 0"
1525031-1532940 modbus: cs-length: "Read 0 units of data"
1529607-1537515 modbus: sc-data: "0x0000 / 0"
1534182-1542091 modbus: cs-error: "CRC should be 80 108"
1538758-1546666 modbus: sc-crc: "CRC correct"
1543333-1546666 modbus: cs-error: "Unknown function"
1891673-1895006 modbus: sc-server-id: "Slave ID: 247"
1891673-1895006 modbus: cs-server-id: "Slave ID: 247"
1896343-1899676 modbus: sc-function: "Function 3: Read Holding Registers"
1896343-1899676 modbus: cs-function: "Function 3: Read Holding Registers"
1900994-1904327 modbus: sc-length: "Byte count: 0"
1900994-1908998 modbus: cs-address: "Start at address 0x0 / 30001"
1905665-1913648 modbus: sc-error: "CRC should be 192 194"
1910315-1918320 modbus: cs-length: "Read 2 units of data"
1914987-1922970 modbus: sc-error: "Message too long"
1919637-1927641 modbus: cs-crc: "CRC correct"
1944531-1947864 modbus: sc-server-id: "Slave ID: 247"
1944531-1947864 modbus: cs-server-id: "Slave ID: 247"
1949107-1952440 modbus: sc-function: "Function 3: Read Holding Registers"
1949107-1952440 modbus: cs-function: "Function 3: Read Holding Registers"
1953683-1957016 modbus: sc-length: "Byte count: 4"
1953683-1961591 modbus: cs-address: "Start at address 0x400 / 31025"
1958258-1966167 modbus: sc-data: "0x0000 / 0"
1962834-1970742 modbus: cs-length: "Read 0 units of data"
1967409-1975318 modbus: sc-data: "0x0000 / 0"
1971985-1979894 modbus: cs-error: "CRC should be 80 108"
1976561-1984469 modbus: sc-crc: "CRC correct"
1981136-1984469 modbus: cs-error: "Unknown function"
2141585-2144918 modbus: sc-server-id: "Slave ID: 247"
2141585-2144918 modbus: cs-server-id: "Slave ID: 247"
2146255-2149588 modbus: sc-function: "Function 3: Read Holding Registers"
2146255-2149588 modbus: cs-function: "Function 3: Read Holding Registers"
2150905-2154238 modbus: sc-length: "Byte count: 0"
2150905-2158910 modbus: cs-address: "Start at address 0x6 / 30007"
2155577-2163560 modbus: sc-error: "CRC should be 192 194"
2160227-2168231 modbus: cs-length: "Read 2 units of data"
2164898-2172881 modbus: sc-error: "Message too long"
2169548-2177553 modbus: cs-crc: "CRC correct"
2194423-2197756 modbus: sc-server-id: "Slave ID: 247"
2194423-2197756 modbus: cs-server-id: "Slave ID: 247"
2198998-2202331 modbus: sc-function: "Function 3: Read Holding Registers"
2198998-2202331 modbus: cs-function: "Function 3: Read Holding Registers"
2203573-2206906 modbus: sc-length: "Byte count: 4"
2203573-2211482 modbus: cs-address: "Start at address 0x400 / 31025"
2208149-2216058 modbus: sc-data: "0x0000 / 0"
2212725-2220633 modbus: cs-length: "Read 0 units of data"
2217300-2225209 modbus: sc-data: "0x0000 / 0"
2221876-2229784 modbus: cs-error: "CRC should be 80 108"
2226451-2234360 modbus: sc-crc: "CRC correct"
2231027-2234360 modbus: cs-error: "Unknown function"
2391134-2394467 modbus: sc-server-id: "Slave ID: 247"
2391134-2394467 modbus: cs-server-id: "Slave ID: 247"
2395804-2399137 modbus: sc-function: "Function 3: Read Holding Registers"
2395804-2399137 modbus: cs-function: "Function 3: Read Holding Registers"
2400454-2403787 modbus: sc-length: "Byte count: 0"
2400454-2408459 modbus: cs-address: "Start at address 0xA / 30011"
2405126-2413109 modbus: sc-error: "CRC should be 192 194"
2409776-2417780 modbus: cs-length: "Read 2 units of data"
2414447-2422430 modbus: sc-error: "Message too long"
2419097-2427102 modbus: cs-crc: "CRC correct"
2444001-2447334 modbus: sc-server-id: "Slave ID: 247"
2444001-2447334 modbus: cs-server-id: "Slave ID: 247"
2448577-2451910 modbus: sc-function: "Function 3: Read Holding Registers"
2448577-2451910 modbus: cs-function: "Function 3: Read Holding Registers"
2453152-2456485 modbus: sc-length: "Byte count: 4"
2453152-2461061 modbus: cs-address: "Start at address 0x400 / 31025"
2457728-2465636 modbus: sc-data: "0x0000 / 0"
2462303-2470212 modbus: cs-length: "Read 0 units of data"
2466879-2474788 modbus: sc-data: "0x0000 / 0"
2471455-2479363 modbus: cs-error: "CRC should be 80 108"
2476030-2483939 modbus: sc-crc: "CRC correct"
2480606-2483939 modbus: cs-error: "Unknown function"
