113942-114776 modbus: cs-server-id: "Slave ID: 1"
114981-115815 modbus: cs-function: "Function 3: Read Holding Registers"
116021-117895 modbus: cs-address: "Start at address 0x3E8 / 31001"
118101-119974 modbus: cs-length: "Read 2 units of data"
120180-122053 modbus: cs-crc: "CRC correct"
125189-126023 modbus: sc-server-id: "Slave ID: 1"
126230-127064 modbus: sc-function: "Function 3: Read Holding Registers"
127272-128106 modbus: sc-length: "Byte count: 4"
128313-130189 modbus: sc-data: "0x5266 / 21094"
130396-132272 modbus: sc-data: "0x5707 / 22279"
132479-134355 modbus: sc-crc: "CRC correct"
138577-139411 modbus: cs-server-id: "Slave ID: 1"
139616-140450 modbus: cs-function: "Function 3: Read Holding Registers"
140655-142530 modbus: cs-address: "Start at address 0x3EA / 31003"
142735-144609 modbus: cs-length: "Read 2 units of data"
144815-146689 modbus: cs-crc: "CRC correct"
150060-150894 modbus: sc-server-id: "Slave ID: 1"
151101-151935 modbus: sc-function: "Function 3: Read Holding Registers"
152143-152977 modbus: sc-length: "Byte count: 4"
153184-155059 modbus: sc-data: "0xA471 / 42097"
155267-157142 modbus: sc-data: "0x462C / 17964"
157350-159225 modbus: sc-crc: "CRC correct"
163447-164281 modbus: cs-server-id: "Slave ID: 1"
164486-165320 modbus: cs-function: "Function 3: Read Holding Registers"
165526-167401 modbus: cs-address: "Start at address 0x3EC / 31005"
167606-169479 modbus: cs-length: "Read 2 units of data"
169686-171559 modbus: cs-crc: "CRC correct"
174922-175756 modbus: sc-server-id: "Slave ID: 1"
175964-176798 modbus: sc-function: "Function 3: Read Holding Registers"
177005-177839 modbus: sc-length: "Byte count: 4"
178047-179922 modbus: sc-data: "0x2038 / 8248"
180130-182005 modbus: sc-data: "0x46AD / 18093"
182213-184088 modbus: sc-crc: "CRC correct"
188319-189153 modbus: cs-server-id: "Slave ID: 1"
189358-190192 modbus: cs-function: "Function 3: Read Holding Registers"
190397-192272 modbus: cs-address: "Start at address 0x3EE / 31007"
192477-194350 modbus: cs-length: "Read 2 units of data"
194557-196432 modbus: cs-crc: "CRC correct"
199803-200637 modbus: sc-server-id: "Slave ID: 1"
200844-201678 modbus: sc-function: "Function 3: Read Holding Registers"
201886-202720 modbus: sc-length: "Byte count: 4"
202927-204803 modbus: sc-data: "0xF71C / 63260"
205010-206886 modbus: sc-data: "0x4701 / 18177"
207093-208969 modbus: sc-crc: "CRC correct"
213187-214021 modbus: cs-server-id: "Slave ID: 1"
214225-215059 modbus: cs-function: "Function 3: Read Holding Registers"
215266-217140 modbus: cs-address: "Start at address 0x3F0 / 31009"
217346-219219 modbus: cs-length: "Read 2 units of data"
219426-221300 modbus: cs-crc: "CRC correct"
224505-225339 modbus: sc-server-id: "Slave ID: 1"
225546-226380 modbus: sc-function: "Function 3: Read Holding Registers"
226588-227422 modbus: sc-length: "Byte count: 4"
227629-229505 modbus: sc-data: "0x5E1C / 24092"
229712-231588 modbus: sc-data: "0x472D / 18221"
231795-233671 modbus: sc-crc: "CRC correct"
237893-238727 modbus: cs-server-id: "Slave ID: 1"
238932-239766 modbus: cs-function: "Function 3: Read Holding Registers"
239971-241846 modbus: cs-address: "Start at address 0x3F2 / 31011"
242052-243925 modbus: cs-length: "Read 2 units of data"
244132-246006 modbus: cs-crc: "CRC correct"
249381-250215 modbus: sc-server-id: "Slave ID: 1"
250423-251257 modbus: sc-function: "Function 3: Read Holding Registers"
251464-252298 modbus: sc-length: "Byte count: 4"
252506-254381 modbus: sc-data: "0xA4E1 / 42209"
254589-256464 modbus: sc-data: "0x462C / 17964"
256672-258547 modbus: sc-crc: "CRC correct"
262768-263602 modbus: cs-server-id: "Slave ID: 1"
263807-264641 modbus: cs-function: "Function 3: Read Holding Registers"
264847-266722 modbus: cs-address: "Start at address 0x3F4 / 31013"
266928-268801 modbus: cs-length: "Read 2 units of data"
269007-270880 modbus: cs-crc: "CRC correct"
274265-275099 modbus: sc-server-id: "Slave ID: 1"
275306-276140 modbus: sc-function: "Function 3: Read Holding Registers"
276348-277182 modbus: sc-length: "Byte count: 4"
277389-279265 modbus: sc-data: "0x2071 / 8305"
279472-281347 modbus: sc-data: "0x46AD / 18093"
281555-283430 modbus: sc-crc: "CRC correct"
287664-288498 modbus: cs-server-id: "Slave ID: 1"
288704-289538 modbus: cs-function: "Function 3: Read Holding Registers"
289743-291617 modbus: cs-address: "Start at address 0x3F6 / 31015"
291823-293697 modbus: cs-length: "Read 2 units of data"
293903-295777 modbus: cs-crc: "CRC correct"
299204-300038 modbus: sc-server-id: "Slave ID: 1"
300245-301079 modbus: sc-function: "Function 3: Read Holding Registers"
301287-302121 modbus: sc-length: "Byte count: 4"
302328-304204 modbus: sc-data: "0xF738 / 63288"
304411-306287 modbus: sc-data: "0x4701 / 18177"
306494-308370 modbus: sc-crc: "CRC correct"
312584-313418 modbus: cs-server-id: "Slave ID: 1"
313623-314457 modbus: cs-function: "Function 3: Read Holding Registers"
314663-316538 modbus: cs-address: "Start at address 0x3F8 / 31017"
316744-318617 modbus: cs-length: "Read 2 units of data"
318823-320696 modbus: cs-crc: "CRC correct"
324070-324904 modbus: sc-server-id: "Slave ID: 1"
325111-325945 modbus: sc-function: "Function 3: Read Holding Registers"
326153-326987 modbus: sc-length: "Byte count: 4"
327194-329070 modbus: sc-data: "0x5E38 / 24120"
329277-331153 modbus: sc-data: "0x472D / 18221"
331360-333236 modbus: sc-crc: "CRC correct"
337453-338287 modbus: cs-server-id: "Slave ID: 1"
338492-339326 modbus: cs-function: "Function 3: Read Holding Registers"
339531-341406 modbus: cs-address: "Start at address 0x3FA / 31019"
341611-343485 modbus: cs-length: "Read 2 units of data"
343691-345565 modbus: cs-crc: "CRC correct"
348954-349788 modbus: sc-server-id: "Slave ID: 1"
349996-350830 modbus: sc-function: "Function 3: Read Holding Registers"
351037-351871 modbus: sc-length: "Byte count: 4"
352079-353954 modbus: sc-data: "0xA552 / 42322"
354162-356037 modbus: sc-data: "0x462C / 17964"
356245-358120 modbus: sc-crc: "CRC correct"
362353-363187 modbus: cs-server-id: "Slave ID: 1"
363392-364226 modbus: cs-function: "Function 3: Read Holding Registers"
364432-366307 modbus: cs-address: "Start at address 0x3FC / 31021"
366513-368385 modbus: cs-length: "Read 2 units of data"
368591-370465 modbus: cs-crc: "CRC correct"
373845-374679 modbus: sc-server-id: "Slave ID: 1"
374886-375720 modbus: sc-function: "Function 3: Read Holding Registers"
375928-376762 modbus: sc-length: "Byte count: 4"
376969-378845 modbus: sc-data: "0x20A9 / 8361"
379052-380928 modbus: sc-data: "0x46AD / 18093"
381135-383011 modbus: sc-crc: "CRC correct"
387229-388063 modbus: cs-server-id: "Slave ID: 1"
388269-389103 modbus: cs-function: "Function 3: Read Holding Registers"
389308-391183 modbus: cs-address: "Start at address 0x3FE / 31023"
391389-393263 modbus: cs-length: "Read 2 units of data"
393468-395342 modbus: cs-crc: "CRC correct"
398556-399390 modbus: sc-server-id: "Slave ID: 1"
399598-400432 modbus: sc-function: "Function 3: Read Holding Registers"
400639-401473 modbus: sc-length: "Byte count: 4"
401681-403556 modbus: sc-data: "0xF754 / 63316"
403764-405639 modbus: sc-data: "0x4701 / 18177"
405847-407722 modbus: sc-crc: "CRC correct"
411949-412783 modbus: cs-server-id: "Slave ID: 1"
412987-413821 modbus: cs-function: "Function 3: Read Holding Registers"
414028-415901 modbus: cs-address: "Start at address 0x400 / 31025"
416108-417981 modbus: cs-length: "Read 2 units of data"
418188-420062 modbus: cs-crc: "CRC correct"
423430-424264 modbus: sc-server-id: "Slave ID: 1"
424471-425305 modbus: sc-function: "Function 3: Read Holding Registers"
425513-426347 modbus: sc-length: "Byte count: 4"
426554-428430 modbus: sc-data: "0x5E54 / 24148"
428637-430513 modbus: sc-data: "0x472D / 18221"
430720-432595 modbus: sc-crc: "CRC correct"
436825-437659 modbus: cs-server-id: "Slave ID: 1"
437865-438699 modbus: cs-function: "Function 3: Read Holding Registers"
438904-440779 modbus: cs-address: "Start at address 0x405 / 31030"
440983-442857 modbus: cs-length: "Read 1 units of data"
443063-444937 modbus: cs-crc: "CRC correct"
448288-449122 modbus: sc-server-id: "Slave ID: 1"
449329-450163 modbus: sc-function: "Function 3: Read Holding Registers"
450371-451205 modbus: sc-length: "Byte count: 2"
451412-453288 modbus: sc-data: "0x0000 / 0"
453495-455371 modbus: sc-crc: "CRC correct"
459581-460415 modbus: cs-server-id: "Slave ID: 1"
460620-461454 modbus: cs-function: "Function 6: Write Single Register"
461659-463534 modbus: cs-address: "Address 0x404 / 31028"
463739-465613 modbus: cs-data: "Register Value 0x1 / 1"
465819-467697 modbus: cs-crc: "CRC correct"
471015-471849 modbus: sc-server-id: "Slave ID: 1"
472057-472891 modbus: sc-function: "Function 6: Write Single Register"
473098-474974 modbus: sc-address: "Address 0x404 / 31028"
475181-477057 modbus: sc-data: "Register Value 0x1 / 1"
477264-479140 modbus: sc-crc: "CRC correct"
483337-484171 modbus: cs-server-id: "Slave ID: 1"
484375-485209 modbus: cs-function: "Function 6: Write Single Register"
485416-487290 modbus: cs-address: "Address 0x405 / 31029"
487496-489370 modbus: cs-data: "Register Value 0x0 / 0"
489576-491451 modbus: cs-crc: "CRC correct"
494824-495658 modbus: sc-server-id: "Slave ID: 1"
495866-496700 modbus: sc-function: "Function 6: Write Single Register"
496907-498783 modbus: sc-address: "Address 0x405 / 31029"
498990-500866 modbus: sc-data: "Register Value 0x0 / 0"
501073-502949 modbus: sc-crc: "CRC correct"
507119-507953 modbus: cs-server-id: "Slave ID: 1"
508158-508992 modbus: cs-function: "Function 3: Read Holding Registers"
509197-511072 modbus: cs-address: "Start at address 0x406 / 31031"
511277-513151 modbus: cs-length: "Read 1 units of data"
513357-515231 modbus: cs-crc: "CRC correct"
518136-518970 modbus: sc-server-id: "Slave ID: 1"
519177-520011 modbus: sc-function: "Function 3: Read Holding Registers"
520219-521053 modbus: sc-length: "Byte count: 2"
521260-523136 modbus: sc-data: "0x002C / 44"
523343-525219 modbus: sc-crc: "CRC correct"
529401-530235 modbus: cs-server-id: "Slave ID: 1"
530441-531275 modbus: cs-function: "Function 3: Read Holding Registers"
531479-533354 modbus: cs-address: "Start at address 0x407 / 31032"
533560-535433 modbus: cs-length: "Read 1 units of data"
535639-537513 modbus: cs-crc: "CRC correct"
540883-541717 modbus: sc-server-id: "Slave ID: 1"
541925-542759 modbus: sc-function: "Function 3: Read Holding Registers"
542966-543800 modbus: sc-length: "Byte count: 2"
544008-545883 modbus: sc-data: "0x0000 / 0"
546091-547966 modbus: sc-crc: "CRC correct"
552148-552982 modbus: cs-server-id: "Slave ID: 1"
553187-554021 modbus: cs-function: "Function 3: Read Holding Registers"
554227-556101 modbus: cs-address: "Start at address 0x408 / 31033"
556307-558181 modbus: cs-length: "Read 1 units of data"
558387-560261 modbus: cs-crc: "CRC correct"
563167-564001 modbus: sc-server-id: "Slave ID: 1"
564209-565043 modbus: sc-function: "Function 3: Read Holding Registers"
565250-566084 modbus: sc-length: "Byte count: 2"
566292-568167 modbus: sc-data: "0x0000 / 0"
568374-570250 modbus: sc-crc: "CRC correct"
574428-575262 modbus: cs-server-id: "Slave ID: 1"
575466-576300 modbus: cs-function: "Function 3: Read Holding Registers"
576507-578382 modbus: cs-address: "Start at address 0x402 / 31027"
578587-580460 modbus: cs-length: "Read 1 units of data"
580666-582541 modbus: cs-crc: "CRC correct"
585908-586742 modbus: sc-server-id: "Slave ID: 1"
586949-587783 modbus: sc-function: "Function 3: Read Holding Registers"
587991-588825 modbus: sc-length: "Byte count: 2"
589032-590908 modbus: sc-data: "0x0002 / 2"
591115-592990 modbus: sc-crc: "CRC correct"
597167-598001 modbus: cs-server-id: "Slave ID: 1"
598207-599041 modbus: cs-function: "Function 3: Read Holding Registers"
599246-601120 modbus: cs-address: "Start at address 0x403 / 31028"
601325-603199 modbus: cs-length: "Read 1 units of data"
603405-605279 modbus: cs-crc: "CRC correct"
608192-609026 modbus: sc-server-id: "Slave ID: 1"
609234-610068 modbus: sc-function: "Function 3: Read Holding Registers"
610275-611109 modbus: sc-length: "Byte count: 2"
611317-613192 modbus: sc-data: "0x0001 / 1"
613400-615275 modbus: sc-crc: "CRC correct"
619455-620289 modbus: cs-server-id: "Slave ID: 1"
620494-621328 modbus: cs-function: "Function 3: Read Holding Registers"
621533-623408 modbus: cs-address: "Start at address 0x404 / 31029"
623613-625487 modbus: cs-length: "Read 1 units of data"
625692-627567 modbus: cs-crc: "CRC correct"
630945-631779 modbus: sc-server-id: "Slave ID: 1"
631986-632820 modbus: sc-function: "Function 3: Read Holding Registers"
633028-633862 modbus: sc-length: "Byte count: 2"
634069-635945 modbus: sc-data: "0x0001 / 1"
636152-638027 modbus: sc-crc: "CRC correct"
5113502-5114336 modbus: cs-server-id: "Slave ID: 1"
5114540-5115374 modbus: cs-function: "Function 3: Read Holding Registers"
5115580-5117455 modbus: cs-address: "Start at address 0x3E8 / 31001"
5117661-5119533 modbus: cs-length: "Read 2 units of data"
5119740-5121613 modbus: cs-crc: "CRC correct"
5125069-5125903 modbus: sc-server-id: "Slave ID: 1"
5126111-5126945 modbus: sc-function: "Function 3: Read Holding Registers"
5127152-5127986 modbus: sc-length: "Byte count: 4"
5128194-5130069 modbus: sc-data: "0x5266 / 21094"
5130277-5132152 modbus: sc-data: "0x5707 / 22279"
5132360-5134235 modbus: sc-crc: "CRC correct"
5138452-5139286 modbus: cs-server-id: "Slave ID: 1"
5139491-5140325 modbus: cs-function: "Function 3: Read Holding Registers"
5140530-5142405 modbus: cs-address: "Start at address 0x3EA / 31003"
5142610-5144484 modbus: cs-length: "Read 2 units of data"
5144690-5146564 modbus: cs-crc: "CRC correct"
5149941-5150775 modbus: sc-server-id: "Slave ID: 1"
5150983-5151817 modbus: sc-function: "Function 3: Read Holding Registers"
5152024-5152858 modbus: sc-length: "Byte count: 4"
5153066-5154941 modbus: sc-data: "0xA471 / 42097"
5155149-5157024 modbus: sc-data: "0x462C / 17964"
5157232-5159107 modbus: sc-crc: "CRC correct"
5163322-5164156 modbus: cs-server-id: "Slave ID: 1"
5164360-5165194 modbus: cs-function: "Function 3: Read Holding Registers"
5165400-5167275 modbus: cs-address: "Start at address 0x3EC / 31005"
5167480-5169353 modbus: cs-length: "Read 2 units of data"
5169560-5171433 modbus: cs-crc: "CRC correct"
5174633-5175467 modbus: sc-server-id: "Slave ID: 1"
5175674-5176508 modbus: sc-function: "Function 3: Read Holding Registers"
5176716-5177550 modbus: sc-length: "Byte count: 4"
5177757-5179633 modbus: sc-data: "0x2038 / 8248"
5179840-5181716 modbus: sc-data: "0x46AD / 18093"
5181923-5183799 modbus: sc-crc: "CRC correct"
5188014-5188848 modbus: cs-server-id: "Slave ID: 1"
5189054-5189888 modbus: cs-function: "Function 3: Read Holding Registers"
5190092-5191967 modbus: cs-address: "Start at address 0x3EE / 31007"
5192172-5194046 modbus: cs-length: "Read 2 units of data"
5194252-5196127 modbus: cs-crc: "CRC correct"
5199515-5200349 modbus: sc-server-id: "Slave ID: 1"
5200556-5201390 modbus: sc-function: "Function 3: Read Holding Registers"
5201598-5202432 modbus: sc-length: "Byte count: 4"
5202639-5204515 modbus: sc-data: "0xF71C / 63260"
5204722-5206598 modbus: sc-data: "0x4701 / 18177"
5206805-5208681 modbus: sc-crc: "CRC correct"
5212898-5213732 modbus: cs-server-id: "Slave ID: 1"
5213937-5214771 modbus: cs-function: "Function 3: Read Holding Registers"
5214977-5216851 modbus: cs-address: "Start at address 0x3F0 / 31009"
5217057-5218929 modbus: cs-length: "Read 2 units of data"
5219136-5221009 modbus: cs-crc: "CRC correct"
5224392-5225226 modbus: sc-server-id: "Slave ID: 1"
5225434-5226268 modbus: sc-function: "Function 3: Read Holding Registers"
5226475-5227309 modbus: sc-length: "Byte count: 4"
5227516-5229392 modbus: sc-data: "0x5E1C / 24092"
5229599-5231475 modbus: sc-data: "0x472D / 18221"
5231682-5233558 modbus: sc-crc: "CRC correct"
5237777-5238611 modbus: cs-server-id: "Slave ID: 1"
5238817-5239651 modbus: cs-function: "Function 3: Read Holding Registers"
5239855-5241729 modbus: cs-address: "Start at address 0x3F2 / 31011"
5241935-5243808 modbus: cs-length: "Read 2 units of data"
5244014-5245888 modbus: cs-crc: "CRC correct"
5249269-5250103 modbus: sc-server-id: "Slave ID: 1"
5250310-5251144 modbus: sc-function: "Function 3: Read Holding Registers"
5251352-5252186 modbus: sc-length: "Byte count: 4"
5252393-5254269 modbus: sc-data: "0xA4E1 / 42209"
5254476-5256352 modbus: sc-data: "0x462C / 17964"
5256559-5258435 modbus: sc-crc: "CRC correct"
5262648-5263482 modbus: cs-server-id: "Slave ID: 1"
5263687-5264521 modbus: cs-function: "Function 3: Read Holding Registers"
5264727-5266601 modbus: cs-address: "Start at address 0x3F4 / 31013"
5266807-5268681 modbus: cs-length: "Read 2 units of data"
5268887-5270760 modbus: cs-crc: "CRC correct"
5274140-5274974 modbus: sc-server-id: "Slave ID: 1"
5275181-5276015 modbus: sc-function: "Function 3: Read Holding Registers"
5276223-5277057 modbus: sc-length: "Byte count: 4"
5277264-5279140 modbus: sc-data: "0x2071 / 8305"
5279347-5281223 modbus: sc-data: "0x46AD / 18093"
5281430-5283306 modbus: sc-crc: "CRC correct"
5287526-5288360 modbus: cs-server-id: "Slave ID: 1"
5288565-5289399 modbus: cs-function: "Function 3: Read Holding Registers"
5289604-5291479 modbus: cs-address: "Start at address 0x3F6 / 31015"
5291684-5293557 modbus: cs-length: "Read 2 units of data"
5293764-5295637 modbus: cs-crc: "CRC correct"
5298855-5299689 modbus: sc-server-id: "Slave ID: 1"
5299897-5300731 modbus: sc-function: "Function 3: Read Holding Registers"
5300938-5301772 modbus: sc-length: "Byte count: 4"
5301980-5303855 modbus: sc-data: "0xF738 / 63288"
5304063-5305938 modbus: sc-data: "0x4701 / 18177"
5306146-5308021 modbus: sc-crc: "CRC correct"
5312233-5313067 modbus: cs-server-id: "Slave ID: 1"
5313272-5314106 modbus: cs-function: "Function 3: Read Holding Registers"
5314312-5316186 modbus: cs-address: "Start at address 0x3F8 / 31017"
5316392-5318265 modbus: cs-length: "Read 2 units of data"
5318471-5320344 modbus: cs-crc: "CRC correct"
5323721-5324555 modbus: sc-server-id: "Slave ID: 1"
5324763-5325597 modbus: sc-function: "Function 3: Read Holding Registers"
5325804-5326638 modbus: sc-length: "Byte count: 4"
5326846-5328721 modbus: sc-data: "0x5E38 / 24120"
5328929-5330804 modbus: sc-data: "0x472D / 18221"
5331011-5332887 modbus: sc-crc: "CRC correct"
5337117-5337951 modbus: cs-server-id: "Slave ID: 1"
5338157-5338991 modbus: cs-function: "Function 3: Read Holding Registers"
5339195-5341070 modbus: cs-address: "Start at address 0x3FA / 31019"
5341276-5343149 modbus: cs-length: "Read 2 units of data"
5343355-5345229 modbus: cs-crc: "CRC correct"
5348606-5349440 modbus: sc-server-id: "Slave ID: 1"
5349647-5350481 modbus: sc-function: "Function 3: Read Holding Registers"
5350689-5351523 modbus: sc-length: "Byte count: 4"
5351730-5353606 modbus: sc-data: "0xA552 / 42322"
5353813-5355689 modbus: sc-data: "0x462C / 17964"
5355896-5357772 modbus: sc-crc: "CRC correct"
5361998-5362832 modbus: cs-server-id: "Slave ID: 1"
5363036-5363870 modbus: cs-function: "Function 3: Read Holding Registers"
5364076-5365951 modbus: cs-address: "Start at address 0x3FC / 31021"
5366157-5368029 modbus: cs-length: "Read 2 units of data"
5368236-5370109 modbus: cs-crc: "CRC correct"
5373511-5374345 modbus: sc-server-id: "Slave ID: 1"
5374552-5375386 modbus: sc-function: "Function 3: Read Holding Registers"
5375594-5376428 modbus: sc-length: "Byte count: 4"
5376635-5378510 modbus: sc-data: "0x20A9 / 8361"
5378718-5380593 modbus: sc-data: "0x46AD / 18093"
5380801-5382676 modbus: sc-crc: "CRC correct"
5386907-5387741 modbus: cs-server-id: "Slave ID: 1"
5387946-5388780 modbus: cs-function: "Function 3: Read Holding Registers"
5388985-5390859 modbus: cs-address: "Start at address 0x3FE / 31023"
5391065-5392939 modbus: cs-length: "Read 2 units of data"
5393144-5395018 modbus: cs-crc: "CRC correct"
5398413-5399247 modbus: sc-server-id: "Slave ID: 1"
5399454-5400288 modbus: sc-function: "Function 3: Read Holding Registers"
5400495-5401329 modbus: sc-length: "Byte count: 4"
5401537-5403412 modbus: sc-data: "0xF754 / 63316"
5403620-5405495 modbus: sc-data: "0x4701 / 18177"
5405703-5407578 modbus: sc-crc: "CRC correct"
5411796-5412630 modbus: cs-server-id: "Slave ID: 1"
5412835-5413669 modbus: cs-function: "Function 3: Read Holding Registers"
5413875-5415748 modbus: cs-address: "Start at address 0x400 / 31025"
5415955-5417828 modbus: cs-length: "Read 2 units of data"
5418034-5419908 modbus: cs-crc: "CRC correct"
5423286-5424120 modbus: sc-server-id: "Slave ID: 1"
5424327-5425161 modbus: sc-function: "Function 3: Read Holding Registers"
5425369-5426203 modbus: sc-length: "Byte count: 4"
5426410-5428286 modbus: sc-data: "0x5E54 / 24148"
5428493-5430369 modbus: sc-data: "0x472D / 18221"
5430576-5432452 modbus: sc-crc: "CRC correct"
5436669-5437503 modbus: cs-server-id: "Slave ID: 1"
5437708-5438542 modbus: cs-function: "Function 3: Read Holding Registers"
5438747-5440622 modbus: cs-address: "Start at address 0x405 / 31030"
5440826-5442700 modbus: cs-length: "Read 1 units of data"
5442906-5444780 modbus: cs-crc: "CRC correct"
5447971-5448805 modbus: sc-server-id: "Slave ID: 1"
5449013-5449847 modbus: sc-function: "Function 3: Read Holding Registers"
5450054-5450888 modbus: sc-length: "Byte count: 2"
5451096-5452971 modbus: sc-data: "0x0000 / 0"
5453179-5455054 modbus: sc-crc: "CRC correct"
5459264-5460098 modbus: cs-server-id: "Slave ID: 1"
5460303-5461137 modbus: cs-function: "Function 6: Write Single Register"
5461342-5463217 modbus: cs-address: "Address 0x404 / 31028"
5463422-5465296 modbus: cs-data: "Register Value 0x1 / 1"
5465501-5467376 modbus: cs-crc: "CRC correct"
5470748-5471582 modbus: sc-server-id: "Slave ID: 1"
5471789-5472623 modbus: sc-function: "Function 6: Write Single Register"
5472831-5474706 modbus: sc-address: "Address 0x404 / 31028"
5474914-5476789 modbus: sc-data: "Register Value 0x1 / 1"
5476997-5478872 modbus: sc-crc: "CRC correct"
5483069-5483903 modbus: cs-server-id: "Slave ID: 1"
5484107-5484941 modbus: cs-function: "Function 6: Write Single Register"
5485147-5487021 modbus: cs-address: "Address 0x405 / 31029"
5487227-5489100 modbus: cs-data: "Register Value 0x0 / 0"
5489306-5491181 modbus: cs-crc: "CRC correct"
5494509-5495343 modbus: sc-server-id: "Slave ID: 1"
5495551-5496385 modbus: sc-function: "Function 6: Write Single Register"
5496592-5498468 modbus: sc-address: "Address 0x405 / 31029"
5498675-5500551 modbus: sc-data: "Register Value 0x0 / 0"
5500758-5502634 modbus: sc-crc: "CRC correct"
5506811-5507645 modbus: cs-server-id: "Slave ID: 1"
5507851-5508685 modbus: cs-function: "Function 3: Read Holding Registers"
5508889-5510764 modbus: cs-address: "Start at address 0x406 / 31031"
5510969-5512843 modbus: cs-length: "Read 1 units of data"
5513049-5514923 modbus: cs-crc: "CRC correct"
5518333-5519167 modbus: sc-server-id: "Slave ID: 1"
5519375-5520209 modbus: sc-function: "Function 3: Read Holding Registers"
5520416-5521250 modbus: sc-length: "Byte count: 2"
5521458-5523333 modbus: sc-data: "0x0030 / 48"
5523541-5525416 modbus: sc-crc: "CRC correct"
5529584-5530418 modbus: cs-server-id: "Slave ID: 1"
5530624-5531458 modbus: cs-function: "Function 3: Read Holding Registers"
5531663-5533538 modbus: cs-address: "Start at address 0x407 / 31032"
5533743-5535617 modbus: cs-length: "Read 1 units of data"
5535822-5537696 modbus: cs-crc: "CRC correct"
5541075-5541909 modbus: sc-server-id: "Slave ID: 1"
5542116-5542950 modbus: sc-function: "Function 3: Read Holding Registers"
5543158-5543992 modbus: sc-length: "Byte count: 2"
5544199-5546075 modbus: sc-data: "0x0000 / 0"
5546282-5548158 modbus: sc-crc: "CRC correct"
5552329-5553163 modbus: cs-server-id: "Slave ID: 1"
5553367-5554201 modbus: cs-function: "Function 3: Read Holding Registers"
5554408-5556281 modbus: cs-address: "Start at address 0x408 / 31033"
5556487-5558361 modbus: cs-length: "Read 1 units of data"
5558566-5560440 modbus: cs-crc: "CRC correct"
5563360-5564194 modbus: sc-server-id: "Slave ID: 1"
5564401-5565235 modbus: sc-function: "Function 3: Read Holding Registers"
5565443-5566277 modbus: sc-length: "Byte count: 2"
5566484-5568360 modbus: sc-data: "0x0000 / 0"
5568567-5570443 modbus: sc-crc: "CRC correct"
5574624-5575458 modbus: cs-server-id: "Slave ID: 1"
5575662-5576496 modbus: cs-function: "Function 3: Read Holding Registers"
5576702-5578577 modbus: cs-address: "Start at address 0x402 / 31027"
5578782-5580656 modbus: cs-length: "Read 1 units of data"
5580861-5582736 modbus: cs-crc: "CRC correct"
5586100-5586934 modbus: sc-server-id: "Slave ID: 1"
5587141-5587975 modbus: sc-function: "Function 3: Read Holding Registers"
5588183-5589017 modbus: sc-length: "Byte count: 2"
5589224-5591100 modbus: sc-data: "0x0002 / 2"
5591307-5593183 modbus: sc-crc: "CRC correct"
5597360-5598194 modbus: cs-server-id: "Slave ID: 1"
5598400-5599234 modbus: cs-function: "Function 3: Read Holding Registers"
5599438-5601313 modbus: cs-address: "Start at address 0x403 / 31028"
5601518-5603392 modbus: cs-length: "Read 1 units of data"
5603597-5605471 modbus: cs-crc: "CRC correct"
5608384-5609218 modbus: sc-server-id: "Slave ID: 1"
5609425-5610259 modbus: sc-function: "Function 3: Read Holding Registers"
5610467-5611301 modbus: sc-length: "Byte count: 2"
5611508-5613384 modbus: sc-data: "0x0001 / 1"
5613591-5615467 modbus: sc-crc: "CRC correct"
5619645-5620479 modbus: cs-server-id: "Slave ID: 1"
5620684-5621518 modbus: cs-function: "Function 3: Read Holding Registers"
5621723-5623598 modbus: cs-address: "Start at address 0x404 / 31029"
5623803-5625676 modbus: cs-length: "Read 1 units of data"
5625882-5627756 modbus: cs-crc: "CRC correct"
5631136-5631970 modbus: sc-server-id: "Slave ID: 1"
5632177-5633011 modbus: sc-function: "Function 3: Read Holding Registers"
5633219-5634053 modbus: sc-length: "Byte count: 2"
5634260-5636136 modbus: sc-data: "0x0001 / 1"
5636343-5638219 modbus: sc-crc: "CRC correct"
