3978-3998 flexray: tss: "Transmission start sequence" "TSS"
3998-4008 flexray: bit: "1"
3998-4008 flexray: fss: "FSS" "Frame start sequence"
4008-4018 flexray: bss: "1"
4017-4027 flexray: bss: "0"
4027-4037 flexray: bit: "0"
4027-4037 flexray: reserved-bit: "Reserved bit: 0" "RB: 0" "RB"
4037-4047 flexray: bit: "0"
4037-4047 flexray: ppi: "Payload preamble indicator: 0" "PPI: 0"
4047-4057 flexray: bit: "1"
4047-4057 flexray: null-frame: "Null frame indicator: data frame" "NF: 1" "NF"
4057-4067 flexray: bit: "1"
4057-4067 flexray: sync-frame: "Sync frame indicator: 1" "Sync: 1" "Sync"
4067-4077 flexray: bit: "1"
4067-4077 flexray: startup-frame: "Startup frame indicator: 1" "Startup: 1" "Startup"
4077-4087 flexray: bit: "0"
4087-4097 flexray: bit: "0"
4097-4107 flexray: bit: "0"
4107-4117 flexray: bss: "1"
4117-4127 flexray: bss: "0"
4127-4137 flexray: bit: "0"
4137-4147 flexray: bit: "0"
4147-4157 flexray: bit: "0"
4157-4167 flexray: bit: "0"
4167-4177 flexray: bit: "0"
4177-4187 flexray: bit: "0"
4187-4197 flexray: bit: "0"
4197-4207 flexray: bit: "1"
4077-4207 flexray: id: "Frame ID: 1" "ID: 1" "1"
4207-4217 flexray: bss: "1"
4217-4227 flexray: bss: "0"
4227-4237 flexray: bit: "0"
4237-4247 flexray: bit: "0"
4247-4257 flexray: bit: "0"
4257-4267 flexray: bit: "1"
4267-4277 flexray: bit: "0"
4277-4287 flexray: bit: "0"
4287-4297 flexray: bit: "0"
4227-4297 flexray: length: "Payload length: 8" "Length: 8" "8"
4297-4307 flexray: bit: "0"
4307-4317 flexray: bss: "1"
4317-4327 flexray: bss: "0"
4327-4337 flexray: bit: "0"
4337-4347 flexray: bit: "1"
4347-4357 flexray: bit: "0"
4357-4367 flexray: bit: "0"
4367-4377 flexray: bit: "0"
4377-4387 flexray: bit: "1"
4387-4397 flexray: bit: "1"
4397-4407 flexray: bit: "0"
4407-4417 flexray: bss: "1"
4417-4427 flexray: bss: "0"
4427-4437 flexray: bit: "1"
4437-4447 flexray: bit: "1"
4297-4447 flexray: header-crc: "Header CRC: 0x11B (OK)" "0x11B (OK)" "0x11B"
4447-4457 flexray: bit: "0"
4457-4467 flexray: bit: "1"
4467-4477 flexray: bit: "1"
4477-4487 flexray: bit: "1"
4487-4497 flexray: bit: "0"
4497-4507 flexray: bit: "0"
4447-4507 flexray: cycle: "Cycle: 28" "Cyc: 28" "28"
4507-4517 flexray: bss: "1"
4517-4527 flexray: bss: "0"
4527-4537 flexray: bit: "0"
4537-4547 flexray: bit: "0"
4547-4557 flexray: bit: "0"
4557-4567 flexray: bit: "0"
4567-4577 flexray: bit: "0"
4577-4587 flexray: bit: "0"
4587-4597 flexray: bit: "0"
4597-4607 flexray: bit: "0"
4607-4617 flexray: bss: "1"
4617-4627 flexray: bss: "0"
4627-4637 flexray: bit: "0"
4637-4647 flexray: bit: "0"
4647-4657 flexray: bit: "0"
4657-4667 flexray: bit: "0"
4667-4677 flexray: bit: "0"
4677-4687 flexray: bit: "0"
4687-4697 flexray: bit: "0"
4697-4707 flexray: bit: "1"
4707-4717 flexray: bss: "1"
4717-4727 flexray: bss: "0"
4727-4737 flexray: bit: "0"
4737-4747 flexray: bit: "0"
4747-4757 flexray: bit: "0"
4757-4767 flexray: bit: "0"
4767-4777 flexray: bit: "0"
4777-4787 flexray: bit: "0"
4787-4797 flexray: bit: "1"
4797-4807 flexray: bit: "0"
4807-4817 flexray: bss: "1"
4817-4827 flexray: bss: "0"
4827-4837 flexray: bit: "0"
4837-4847 flexray: bit: "0"
4847-4857 flexray: bit: "0"
4857-4867 flexray: bit: "0"
4867-4877 flexray: bit: "0"
4877-4887 flexray: bit: "0"
4887-4897 flexray: bit: "1"
4897-4907 flexray: bit: "1"
4907-4917 flexray: bss: "1"
4917-4927 flexray: bss: "0"
4927-4937 flexray: bit: "0"
4937-4947 flexray: bit: "0"
4947-4957 flexray: bit: "0"
4957-4967 flexray: bit: "0"
4967-4977 flexray: bit: "0"
4977-4987 flexray: bit: "0"
4987-4997 flexray: bit: "0"
4997-5007 flexray: bit: "0"
5007-5017 flexray: bss: "1"
5017-5027 flexray: bss: "0"
5027-5037 flexray: bit: "0"
5037-5047 flexray: bit: "0"
5047-5057 flexray: bit: "0"
5057-5067 flexray: bit: "0"
5067-5077 flexray: bit: "0"
5077-5087 flexray: bit: "0"
5087-5097 flexray: bit: "0"
5097-5107 flexray: bit: "0"
5107-5117 flexray: bss: "1"
5117-5127 flexray: bss: "0"
5127-5137 flexray: bit: "0"
5137-5147 flexray: bit: "0"
5147-5157 flexray: bit: "0"
5157-5167 flexray: bit: "0"
5167-5177 flexray: bit: "0"
5177-5187 flexray: bit: "0"
5187-5197 flexray: bit: "0"
5197-5207 flexray: bit: "0"
5207-5217 flexray: bss: "1"
5217-5227 flexray: bss: "0"
5227-5237 flexray: bit: "0"
5237-5247 flexray: bit: "0"
5247-5257 flexray: bit: "0"
5257-5267 flexray: bit: "0"
5267-5277 flexray: bit: "0"
5277-5287 flexray: bit: "0"
5287-5297 flexray: bit: "0"
5297-5307 flexray: bit: "0"
5307-5317 flexray: bss: "1"
5317-5327 flexray: bss: "0"
5327-5337 flexray: bit: "0"
5337-5347 flexray: bit: "0"
5347-5357 flexray: bit: "0"
5357-5367 flexray: bit: "0"
5367-5377 flexray: bit: "0"
5377-5387 flexray: bit: "0"
5387-5397 flexray: bit: "0"
5397-5407 flexray: bit: "0"
5407-5417 flexray: bss: "1"
5417-5427 flexray: bss: "0"
5427-5437 flexray: bit: "0"
5437-5447 flexray: bit: "0"
5447-5457 flexray: bit: "0"
5457-5467 flexray: bit: "0"
5467-5477 flexray: bit: "0"
5477-5487 flexray: bit: "0"
5487-5497 flexray: bit: "0"
5497-5507 flexray: bit: "0"
5507-5517 flexray: bss: "1"
5517-5527 flexray: bss: "0"
5527-5537 flexray: bit: "0"
5537-5547 flexray: bit: "0"
5547-5557 flexray: bit: "0"
5557-5567 flexray: bit: "0"
5567-5577 flexray: bit: "0"
5577-5587 flexray: bit: "0"
5587-5597 flexray: bit: "0"
5597-5607 flexray: bit: "0"
5607-5617 flexray: bss: "1"
5617-5627 flexray: bss: "0"
5627-5637 flexray: bit: "0"
5637-5647 flexray: bit: "0"
5647-5657 flexray: bit: "0"
5657-5667 flexray: bit: "0"
5667-5677 flexray: bit: "0"
5677-5687 flexray: bit: "0"
5687-5697 flexray: bit: "0"
5697-5707 flexray: bit: "0"
5707-5717 flexray: bss: "1"
5717-5727 flexray: bss: "0"
5727-5737 flexray: bit: "0"
5737-5747 flexray: bit: "0"
5747-5757 flexray: bit: "0"
5757-5767 flexray: bit: "0"
5767-5777 flexray: bit: "0"
5777-5787 flexray: bit: "0"
5787-5797 flexray: bit: "0"
5797-5807 flexray: bit: "0"
5807-5817 flexray: bss: "1"
5817-5827 flexray: bss: "0"
5827-5837 flexray: bit: "0"
5837-5847 flexray: bit: "0"
5847-5857 flexray: bit: "0"
5857-5867 flexray: bit: "0"
5867-5877 flexray: bit: "0"
5877-5887 flexray: bit: "0"
5887-5897 flexray: bit: "0"
5897-5907 flexray: bit: "0"
5907-5917 flexray: bss: "1"
5917-5927 flexray: bss: "0"
5927-5937 flexray: bit: "0"
5937-5947 flexray: bit: "0"
5947-5957 flexray: bit: "0"
5957-5967 flexray: bit: "0"
5967-5977 flexray: bit: "0"
5977-5987 flexray: bit: "0"
5987-5997 flexray: bit: "0"
5997-6007 flexray: bit: "0"
6007-6017 flexray: bss: "1"
6017-6027 flexray: bss: "0"
6027-6037 flexray: bit: "0"
6037-6047 flexray: bit: "0"
6047-6057 flexray: bit: "0"
6057-6067 flexray: bit: "0"
6067-6077 flexray: bit: "0"
6077-6087 flexray: bit: "0"
6087-6097 flexray: bit: "0"
6097-6107 flexray: bit: "0"
6107-6117 flexray: bss: "1"
6117-6127 flexray: bss: "0"
6127-6137 flexray: bit: "0"
4527-4607 flexray: data-byte: "Data byte 0: 0x00" "DB0: 0x00" "00"
4627-4707 flexray: data-byte: "Data byte 1: 0x01" "DB1: 0x01" "01"
4727-4807 flexray: data-byte: "Data byte 2: 0x02" "DB2: 0x02" "02"
4827-4907 flexray: data-byte: "Data byte 3: 0x03" "DB3: 0x03" "03"
4927-5007 flexray: data-byte: "Data byte 4: 0x00" "DB4: 0x00" "00"
5027-5107 flexray: data-byte: "Data byte 5: 0x00" "DB5: 0x00" "00"
5127-5207 flexray: data-byte: "Data byte 6: 0x00" "DB6: 0x00" "00"
5227-5307 flexray: data-byte: "Data byte 7: 0x00" "DB7: 0x00" "00"
5327-5407 flexray: data-byte: "Data byte 8: 0x00" "DB8: 0x00" "00"
5427-5507 flexray: data-byte: "Data byte 9: 0x00" "DB9: 0x00" "00"
5527-5607 flexray: data-byte: "Data byte 10: 0x00" "DB10: 0x00" "00"
5627-5707 flexray: data-byte: "Data byte 11: 0x00" "DB11: 0x00" "00"
5727-5807 flexray: data-byte: "Data byte 12: 0x00" "DB12: 0x00" "00"
5827-5907 flexray: data-byte: "Data byte 13: 0x00" "DB13: 0x00" "00"
5927-6007 flexray: data-byte: "Data byte 14: 0x00" "DB14: 0x00" "00"
6027-6107 flexray: data-byte: "Data byte 15: 0x00" "DB15: 0x00" "00"
6137-6147 flexray: bit: "0"
6147-6157 flexray: bit: "1"
6157-6167 flexray: bit: "1"
6167-6177 flexray: bit: "1"
6177-6187 flexray: bit: "1"
6187-6197 flexray: bit: "1"
6197-6207 flexray: bit: "0"
6207-6217 flexray: bss: "1"
6217-6227 flexray: bss: "0"
6227-6237 flexray: bit: "0"
6237-6247 flexray: bit: "1"
6247-6257 flexray: bit: "1"
6257-6267 flexray: bit: "1"
6267-6277 flexray: bit: "0"
6277-6287 flexray: bit: "0"
6287-6297 flexray: bit: "1"
6297-6307 flexray: bit: "0"
6307-6317 flexray: bss: "1"
6317-6327 flexray: bss: "0"
6327-6337 flexray: bit: "1"
6337-6347 flexray: bit: "0"
6347-6357 flexray: bit: "0"
6357-6367 flexray: bit: "1"
6367-6377 flexray: bit: "0"
6377-6387 flexray: bit: "0"
6387-6397 flexray: bit: "1"
6397-6407 flexray: bit: "0"
6127-6407 flexray: frame-crc: "Frame CRC: 0x3E7292 (OK)" "0x3E7292 (OK)" "0x3E7292"
6407-6417 flexray: bit: "0"
6417-6427 flexray: bit: "1"
6407-6427 flexray: cid-delimiter: "Frame end sequence" "FES"
6427-6437 flexray: bit: "1"
6437-6447 flexray: bit: "1"
6447-6457 flexray: bit: "1"
6457-6467 flexray: bit: "1"
6467-6477 flexray: bit: "1"
6477-6487 flexray: bit: "1"
6487-6497 flexray: bit: "1"
6497-6507 flexray: bit: "1"
6507-6517 flexray: bit: "1"
6517-6527 flexray: bit: "1"
6527-6537 flexray: bit: "1"
6427-6537 flexray: cid: "Channel idle delimiter" "CID"
7378-7398 flexray: tss: "Transmission start sequence" "TSS"
7398-7408 flexray: bit: "1"
7398-7408 flexray: fss: "FSS" "Frame start sequence"
7408-7418 flexray: bss: "1"
7418-7428 flexray: bss: "0"
7428-7438 flexray: bit: "0"
7428-7438 flexray: reserved-bit: "Reserved bit: 0" "RB: 0" "RB"
7438-7448 flexray: bit: "0"
7438-7448 flexray: ppi: "Payload preamble indicator: 0" "PPI: 0"
7448-7458 flexray: bit: "1"
7448-7458 flexray: null-frame: "Null frame indicator: data frame" "NF: 1" "NF"
7458-7468 flexray: bit: "1"
7458-7468 flexray: sync-frame: "Sync frame indicator: 1" "Sync: 1" "Sync"
7468-7478 flexray: bit: "1"
7468-7478 flexray: startup-frame: "Startup frame indicator: 1" "Startup: 1" "Startup"
7478-7488 flexray: bit: "0"
7488-7498 flexray: bit: "0"
7498-7508 flexray: bit: "0"
7508-7518 flexray: bss: "1"
7518-7528 flexray: bss: "0"
7528-7538 flexray: bit: "0"
7538-7548 flexray: bit: "0"
7548-7558 flexray: bit: "0"
7558-7568 flexray: bit: "0"
7568-7578 flexray: bit: "0"
7578-7588 flexray: bit: "0"
7588-7598 flexray: bit: "1"
7598-7608 flexray: bit: "0"
7478-7608 flexray: id: "Frame ID: 2" "ID: 2" "2"
7608-7618 flexray: bss: "1"
7618-7628 flexray: bss: "0"
7628-7638 flexray: bit: "0"
7638-7648 flexray: bit: "0"
7648-7658 flexray: bit: "0"
7658-7668 flexray: bit: "1"
7668-7678 flexray: bit: "0"
7678-7688 flexray: bit: "0"
7688-7698 flexray: bit: "0"
7628-7698 flexray: length: "Payload length: 8" "Length: 8" "8"
7698-7708 flexray: bit: "0"
7708-7718 flexray: bss: "1"
7718-7728 flexray: bss: "0"
7728-7738 flexray: bit: "1"
7738-7748 flexray: bit: "1"
7748-7758 flexray: bit: "0"
7758-7768 flexray: bit: "0"
7768-7778 flexray: bit: "0"
7778-7788 flexray: bit: "0"
7788-7798 flexray: bit: "0"
7798-7808 flexray: bit: "1"
7808-7818 flexray: bss: "1"
7818-7828 flexray: bss: "0"
7828-7838 flexray: bit: "0"
7838-7848 flexray: bit: "0"
7698-7848 flexray: header-crc: "Header CRC: 0x304 (OK)" "0x304 (OK)" "0x304"
7848-7858 flexray: bit: "0"
7858-7868 flexray: bit: "1"
7868-7878 flexray: bit: "1"
7878-7888 flexray: bit: "1"
7888-7898 flexray: bit: "0"
7898-7908 flexray: bit: "0"
7848-7908 flexray: cycle: "Cycle: 28" "Cyc: 28" "28"
7908-7918 flexray: bss: "1"
7918-7928 flexray: bss: "0"
7928-7938 flexray: bit: "0"
7938-7948 flexray: bit: "0"
7948-7958 flexray: bit: "0"
7958-7968 flexray: bit: "0"
7968-7978 flexray: bit: "0"
7978-7988 flexray: bit: "0"
7988-7998 flexray: bit: "0"
7998-8008 flexray: bit: "0"
8008-8018 flexray: bss: "1"
8018-8028 flexray: bss: "0"
8028-8038 flexray: bit: "0"
8038-8048 flexray: bit: "0"
8048-8058 flexray: bit: "0"
8058-8068 flexray: bit: "0"
8068-8078 flexray: bit: "0"
8078-8088 flexray: bit: "0"
8088-8098 flexray: bit: "0"
8098-8108 flexray: bit: "1"
8108-8118 flexray: bss: "1"
8118-8128 flexray: bss: "0"
8128-8138 flexray: bit: "0"
8138-8148 flexray: bit: "0"
8148-8158 flexray: bit: "0"
8158-8168 flexray: bit: "0"
8168-8178 flexray: bit: "0"
8178-8188 flexray: bit: "0"
8188-8198 flexray: bit: "1"
8198-8208 flexray: bit: "0"
8208-8218 flexray: bss: "1"
8218-8228 flexray: bss: "0"
8228-8238 flexray: bit: "0"
8238-8248 flexray: bit: "0"
8248-8258 flexray: bit: "0"
8258-8268 flexray: bit: "0"
8268-8278 flexray: bit: "0"
8278-8288 flexray: bit: "0"
8288-8298 flexray: bit: "1"
8298-8308 flexray: bit: "1"
8308-8318 flexray: bss: "1"
8318-8328 flexray: bss: "0"
8328-8338 flexray: bit: "0"
8338-8348 flexray: bit: "0"
8348-8358 flexray: bit: "0"
8358-8368 flexray: bit: "0"
8368-8378 flexray: bit: "0"
8378-8388 flexray: bit: "0"
8388-8398 flexray: bit: "0"
8398-8408 flexray: bit: "0"
8408-8418 flexray: bss: "1"
8418-8428 flexray: bss: "0"
8428-8438 flexray: bit: "0"
8438-8448 flexray: bit: "0"
8448-8458 flexray: bit: "0"
8458-8468 flexray: bit: "0"
8468-8478 flexray: bit: "0"
8478-8488 flexray: bit: "0"
8488-8498 flexray: bit: "0"
8498-8508 flexray: bit: "0"
8508-8518 flexray: bss: "1"
8518-8528 flexray: bss: "0"
8528-8538 flexray: bit: "0"
8538-8548 flexray: bit: "0"
8548-8558 flexray: bit: "0"
8558-8568 flexray: bit: "0"
8568-8578 flexray: bit: "0"
8578-8588 flexray: bit: "0"
8588-8598 flexray: bit: "0"
8598-8608 flexray: bit: "0"
8608-8618 flexray: bss: "1"
8618-8628 flexray: bss: "0"
8628-8638 flexray: bit: "0"
8638-8648 flexray: bit: "0"
8648-8658 flexray: bit: "0"
8658-8668 flexray: bit: "0"
8668-8678 flexray: bit: "0"
8678-8688 flexray: bit: "0"
8688-8698 flexray: bit: "0"
8698-8708 flexray: bit: "0"
8708-8718 flexray: bss: "1"
8718-8728 flexray: bss: "0"
8728-8738 flexray: bit: "0"
8738-8748 flexray: bit: "0"
8748-8758 flexray: bit: "0"
8758-8768 flexray: bit: "0"
8768-8778 flexray: bit: "0"
8778-8788 flexray: bit: "0"
8788-8798 flexray: bit: "0"
8798-8808 flexray: bit: "0"
8808-8818 flexray: bss: "1"
8818-8828 flexray: bss: "0"
8828-8838 flexray: bit: "0"
8838-8848 flexray: bit: "0"
8848-8858 flexray: bit: "0"
8858-8868 flexray: bit: "0"
8868-8878 flexray: bit: "0"
8878-8888 flexray: bit: "0"
8888-8898 flexray: bit: "0"
8898-8908 flexray: bit: "0"
8908-8918 flexray: bss: "1"
8918-8928 flexray: bss: "0"
8928-8938 flexray: bit: "0"
8938-8948 flexray: bit: "0"
8948-8958 flexray: bit: "0"
8958-8968 flexray: bit: "0"
8968-8978 flexray: bit: "0"
8978-8988 flexray: bit: "0"
8988-8998 flexray: bit: "0"
8998-9008 flexray: bit: "0"
9008-9018 flexray: bss: "1"
9018-9028 flexray: bss: "0"
9028-9038 flexray: bit: "0"
9038-9048 flexray: bit: "0"
9048-9058 flexray: bit: "0"
9058-9068 flexray: bit: "0"
9068-9078 flexray: bit: "0"
9078-9088 flexray: bit: "0"
9088-9098 flexray: bit: "0"
9098-9108 flexray: bit: "0"
9108-9118 flexray: bss: "1"
9118-9128 flexray: bss: "0"
9128-9138 flexray: bit: "0"
9138-9148 flexray: bit: "0"
9148-9158 flexray: bit: "0"
9158-9168 flexray: bit: "0"
9168-9178 flexray: bit: "0"
9178-9188 flexray: bit: "0"
9188-9198 flexray: bit: "0"
9198-9208 flexray: bit: "0"
9208-9218 flexray: bss: "1"
9218-9228 flexray: bss: "0"
9228-9238 flexray: bit: "0"
9238-9248 flexray: bit: "0"
9248-9258 flexray: bit: "0"
9258-9268 flexray: bit: "0"
9268-9278 flexray: bit: "0"
9278-9288 flexray: bit: "0"
9288-9298 flexray: bit: "0"
9298-9308 flexray: bit: "0"
9308-9318 flexray: bss: "1"
9318-9328 flexray: bss: "0"
9328-9338 flexray: bit: "0"
9338-9348 flexray: bit: "0"
9348-9358 flexray: bit: "0"
9358-9368 flexray: bit: "0"
9368-9378 flexray: bit: "0"
9378-9388 flexray: bit: "0"
9388-9398 flexray: bit: "0"
9398-9408 flexray: bit: "0"
9408-9418 flexray: bss: "1"
9418-9428 flexray: bss: "0"
9428-9438 flexray: bit: "0"
9438-9448 flexray: bit: "0"
9448-9458 flexray: bit: "0"
9458-9468 flexray: bit: "0"
9468-9478 flexray: bit: "0"
9478-9488 flexray: bit: "0"
9488-9498 flexray: bit: "0"
9498-9508 flexray: bit: "0"
9508-9518 flexray: bss: "1"
9518-9528 flexray: bss: "0"
9528-9538 flexray: bit: "0"
7928-8008 flexray: data-byte: "Data byte 0: 0x00" "DB0: 0x00" "00"
8028-8108 flexray: data-byte: "Data byte 1: 0x01" "DB1: 0x01" "01"
8128-8208 flexray: data-byte: "Data byte 2: 0x02" "DB2: 0x02" "02"
8228-8308 flexray: data-byte: "Data byte 3: 0x03" "DB3: 0x03" "03"
8328-8408 flexray: data-byte: "Data byte 4: 0x00" "DB4: 0x00" "00"
8428-8508 flexray: data-byte: "Data byte 5: 0x00" "DB5: 0x00" "00"
8528-8608 flexray: data-byte: "Data byte 6: 0x00" "DB6: 0x00" "00"
8628-8708 flexray: data-byte: "Data byte 7: 0x00" "DB7: 0x00" "00"
8728-8808 flexray: data-byte: "Data byte 8: 0x00" "DB8: 0x00" "00"
8828-8908 flexray: data-byte: "Data byte 9: 0x00" "DB9: 0x00" "00"
8928-9008 flexray: data-byte: "Data byte 10: 0x00" "DB10: 0x00" "00"
9028-9108 flexray: data-byte: "Data byte 11: 0x00" "DB11: 0x00" "00"
9128-9208 flexray: data-byte: "Data byte 12: 0x00" "DB12: 0x00" "00"
9228-9308 flexray: data-byte: "Data byte 13: 0x00" "DB13: 0x00" "00"
9328-9408 flexray: data-byte: "Data byte 14: 0x00" "DB14: 0x00" "00"
9428-9508 flexray: data-byte: "Data byte 15: 0x00" "DB15: 0x00" "00"
9538-9548 flexray: bit: "1"
9548-9558 flexray: bit: "0"
9558-9568 flexray: bit: "1"
9568-9578 flexray: bit: "0"
9578-9588 flexray: bit: "1"
9588-9598 flexray: bit: "0"
9598-9608 flexray: bit: "1"
9608-9618 flexray: bss: "1"
9618-9628 flexray: bss: "0"
9628-9638 flexray: bit: "1"
9638-9648 flexray: bit: "0"
9648-9658 flexray: bit: "0"
9658-9668 flexray: bit: "1"
9668-9678 flexray: bit: "0"
9678-9688 flexray: bit: "0"
9688-9698 flexray: bit: "0"
9698-9708 flexray: bit: "1"
9708-9718 flexray: bss: "1"
9718-9728 flexray: bss: "0"
9728-9738 flexray: bit: "0"
9738-9748 flexray: bit: "0"
9748-9758 flexray: bit: "0"
9758-9768 flexray: bit: "0"
9768-9778 flexray: bit: "1"
9778-9788 flexray: bit: "1"
9788-9798 flexray: bit: "1"
9798-9808 flexray: bit: "0"
9528-9808 flexray: frame-crc: "Frame CRC: 0x55910E (OK)" "0x55910E (OK)" "0x55910E"
9808-9818 flexray: bit: "0"
9818-9828 flexray: bit: "1"
9808-9828 flexray: cid-delimiter: "Frame end sequence" "FES"
9828-9838 flexray: bit: "1"
9838-9848 flexray: bit: "1"
9848-9858 flexray: bit: "1"
9858-9868 flexray: bit: "1"
9868-9878 flexray: bit: "1"
9878-9888 flexray: bit: "1"
9888-9898 flexray: bit: "1"
9898-9908 flexray: bit: "1"
9908-9918 flexray: bit: "1"
9918-9928 flexray: bit: "1"
9928-9938 flexray: bit: "1"
9828-9938 flexray: cid: "Channel idle delimiter" "CID"
11179-11199 flexray: tss: "Transmission start sequence" "TSS"
11199-11209 flexray: bit: "1"
11199-11209 flexray: fss: "FSS" "Frame start sequence"
11209-11219 flexray: bss: "1"
11218-11228 flexray: bss: "0"
11228-11238 flexray: bit: "0"
11228-11238 flexray: reserved-bit: "Reserved bit: 0" "RB: 0" "RB"
11238-11248 flexray: bit: "0"
11238-11248 flexray: ppi: "Payload preamble indicator: 0" "PPI: 0"
11248-11258 flexray: bit: "1"
11248-11258 flexray: null-frame: "Null frame indicator: data frame" "NF: 1" "NF"
11258-11268 flexray: bit: "0"
11258-11268 flexray: sync-frame: "Sync frame indicator: 0" "Sync: 0" "Sync"
11268-11278 flexray: bit: "0"
11268-11278 flexray: startup-frame: "Startup frame indicator: 0" "Startup: 0" "Startup"
11278-11288 flexray: bit: "0"
11288-11298 flexray: bit: "0"
11298-11308 flexray: bit: "0"
11308-11318 flexray: bss: "1"
11318-11328 flexray: bss: "0"
11328-11338 flexray: bit: "0"
11338-11348 flexray: bit: "0"
11348-11358 flexray: bit: "0"
11358-11368 flexray: bit: "0"
11368-11378 flexray: bit: "0"
11378-11388 flexray: bit: "1"
11388-11398 flexray: bit: "0"
11398-11408 flexray: bit: "0"
11278-11408 flexray: id: "Frame ID: 4" "ID: 4" "4"
11408-11418 flexray: bss: "1"
11418-11428 flexray: bss: "0"
11428-11438 flexray: bit: "0"
11438-11448 flexray: bit: "0"
11448-11458 flexray: bit: "0"
11458-11468 flexray: bit: "0"
11468-11478 flexray: bit: "0"
11478-11488 flexray: bit: "0"
11488-11498 flexray: bit: "1"
11428-11498 flexray: length: "Payload length: 1" "Length: 1" "1"
11498-11508 flexray: bit: "0"
11508-11518 flexray: bss: "1"
11518-11528 flexray: bss: "0"
11528-11538 flexray: bit: "1"
11538-11548 flexray: bit: "1"
11548-11558 flexray: bit: "0"
11558-11568 flexray: bit: "0"
11568-11578 flexray: bit: "1"
11578-11588 flexray: bit: "1"
11588-11598 flexray: bit: "1"
11598-11608 flexray: bit: "0"
11608-11618 flexray: bss: "1"
11618-11628 flexray: bss: "0"
11628-11638 flexray: bit: "1"
11638-11648 flexray: bit: "1"
11498-11648 flexray: header-crc: "Header CRC: 0x33B (OK)" "0x33B (OK)" "0x33B"
11648-11658 flexray: bit: "0"
11658-11668 flexray: bit: "1"
11668-11678 flexray: bit: "1"
11678-11688 flexray: bit: "1"
11688-11698 flexray: bit: "0"
11698-11708 flexray: bit: "0"
11648-11708 flexray: cycle: "Cycle: 28" "Cyc: 28" "28"
11708-11718 flexray: bss: "1"
11718-11728 flexray: bss: "0"
11728-11738 flexray: bit: "0"
11738-11748 flexray: bit: "0"
11748-11758 flexray: bit: "1"
11758-11768 flexray: bit: "0"
11768-11778 flexray: bit: "0"
11778-11788 flexray: bit: "0"
11788-11798 flexray: bit: "1"
11798-11808 flexray: bit: "1"
11808-11818 flexray: bss: "1"
11818-11828 flexray: bss: "0"
11828-11838 flexray: bit: "0"
11838-11848 flexray: bit: "1"
11848-11858 flexray: bit: "0"
11858-11868 flexray: bit: "0"
11868-11878 flexray: bit: "0"
11878-11888 flexray: bit: "0"
11888-11898 flexray: bit: "1"
11898-11908 flexray: bit: "0"
11908-11918 flexray: bss: "1"
11918-11928 flexray: bss: "0"
11928-11938 flexray: bit: "1"
11728-11808 flexray: data-byte: "Data byte 0: 0x23" "DB0: 0x23" "23"
11828-11908 flexray: data-byte: "Data byte 1: 0x42" "DB1: 0x42" "42"
11938-11948 flexray: bit: "1"
11948-11958 flexray: bit: "0"
11958-11968 flexray: bit: "0"
11968-11978 flexray: bit: "0"
11978-11988 flexray: bit: "1"
11988-11998 flexray: bit: "0"
11998-12008 flexray: bit: "0"
12008-12018 flexray: bss: "1"
12018-12028 flexray: bss: "0"
12028-12038 flexray: bit: "0"
12038-12048 flexray: bit: "0"
12048-12058 flexray: bit: "0"
12058-12068 flexray: bit: "0"
12068-12078 flexray: bit: "1"
12078-12088 flexray: bit: "1"
12088-12098 flexray: bit: "1"
12098-12108 flexray: bit: "0"
12108-12118 flexray: bss: "1"
12118-12128 flexray: bss: "0"
12128-12138 flexray: bit: "1"
12138-12148 flexray: bit: "1"
12148-12158 flexray: bit: "1"
12158-12168 flexray: bit: "1"
12168-12178 flexray: bit: "1"
12178-12188 flexray: bit: "1"
12188-12198 flexray: bit: "0"
12198-12208 flexray: bit: "1"
11928-12208 flexray: frame-crc: "Frame CRC: 0xC40EFD (OK)" "0xC40EFD (OK)" "0xC40EFD"
12208-12218 flexray: bit: "0"
12218-12228 flexray: bit: "1"
12208-12228 flexray: cid-delimiter: "Frame end sequence" "FES"
12228-12238 flexray: bit: "0"
12238-12248 flexray: bit: "0"
12248-12258 flexray: bit: "0"
12258-12268 flexray: bit: "0"
12268-12278 flexray: bit: "0"
12278-12288 flexray: bit: "0"
12288-12298 flexray: bit: "0"
12298-12308 flexray: bit: "0"
12308-12318 flexray: bit: "0"
12318-12328 flexray: bit: "0"
12328-12338 flexray: bit: "0"
12338-12348 flexray: bit: "0"
12348-12358 flexray: bit: "0"
12358-12368 flexray: bit: "1"
12228-12368 flexray: dts: "Dynamic trailing sequence" "DTS"
12368-12378 flexray: bit: "1"
12378-12388 flexray: bit: "1"
12388-12398 flexray: bit: "1"
12398-12408 flexray: bit: "1"
12408-12418 flexray: bit: "1"
12418-12428 flexray: bit: "1"
12428-12438 flexray: bit: "1"
12438-12448 flexray: bit: "1"
12448-12458 flexray: bit: "1"
12458-12468 flexray: bit: "1"
12468-12478 flexray: bit: "1"
12368-12478 flexray: cid: "Channel idle delimiter" "CID"
