0-201 tdm_audio: ch1: "Channel 1: dfee" "C1: dfee" "1: dfee"
201-331 tdm_audio: ch2: "Channel 2: 1100" "C2: 1100" "2: 1100"
331-461 tdm_audio: ch3: "Channel 3: 3322" "C3: 3322" "3: 3322"
461-591 tdm_audio: ch4: "Channel 4: 5544" "C4: 5544" "4: 5544"
591-721 tdm_audio: ch1: "Channel 1: 7988" "C1: 7988" "1: 7988"
721-852 tdm_audio: ch2: "Channel 2: bbaa" "C2: bbaa" "2: bbaa"
852-982 tdm_audio: ch3: "Channel 3: ddcc" "C3: ddcc" "3: ddcc"
982-1112 tdm_audio: ch4: "Channel 4: ffee" "C4: ffee" "4: ffee"
1112-1242 tdm_audio: ch1: "Channel 1: 1322" "C1: 1322" "1: 1322"
1242-1373 tdm_audio: ch2: "Channel 2: 5544" "C2: 5544" "2: 5544"
1373-1503 tdm_audio: ch3: "Channel 3: 7766" "C3: 7766" "3: 7766"
1503-1633 tdm_audio: ch4: "Channel 4: 9988" "C4: 9988" "4: 9988"
1633-1763 tdm_audio: ch1: "Channel 1: bdcc" "C1: bdcc" "1: bdcc"
1763-1893 tdm_audio: ch2: "Channel 2: ffee" "C2: ffee" "2: ffee"
1893-2024 tdm_audio: ch3: "Channel 3: 1100" "C3: 1100" "3: 1100"
2024-2154 tdm_audio: ch4: "Channel 4: 3322" "C4: 3322" "4: 3322"
2154-2284 tdm_audio: ch1: "Channel 1: 5766" "C1: 5766" "1: 5766"
2284-2414 tdm_audio: ch2: "Channel 2: 9988" "C2: 9988" "2: 9988"
2414-2544 tdm_audio: ch3: "Channel 3: bbaa" "C3: bbaa" "3: bbaa"
2544-2675 tdm_audio: ch4: "Channel 4: ddcc" "C4: ddcc" "4: ddcc"
2675-2805 tdm_audio: ch1: "Channel 1: f100" "C1: f100" "1: f100"
2805-2935 tdm_audio: ch2: "Channel 2: 3322" "C2: 3322" "2: 3322"
2935-3065 tdm_audio: ch3: "Channel 3: 5544" "C3: 5544" "3: 5544"
3065-3195 tdm_audio: ch4: "Channel 4: 7766" "C4: 7766" "4: 7766"
3195-3326 tdm_audio: ch1: "Channel 1: 9baa" "C1: 9baa" "1: 9baa"
3326-3456 tdm_audio: ch2: "Channel 2: ddcc" "C2: ddcc" "2: ddcc"
3456-3586 tdm_audio: ch3: "Channel 3: ffee" "C3: ffee" "3: ffee"
3586-3716 tdm_audio: ch4: "Channel 4: 1100" "C4: 1100" "4: 1100"
3716-3846 tdm_audio: ch1: "Channel 1: 3544" "C1: 3544" "1: 3544"
3846-3977 tdm_audio: ch2: "Channel 2: 7766" "C2: 7766" "2: 7766"
3977-4107 tdm_audio: ch3: "Channel 3: 9988" "C3: 9988" "3: 9988"
4107-4237 tdm_audio: ch4: "Channel 4: bbaa" "C4: bbaa" "4: bbaa"
4237-4367 tdm_audio: ch1: "Channel 1: dfee" "C1: dfee" "1: dfee"
4367-4498 tdm_audio: ch2: "Channel 2: 1100" "C2: 1100" "2: 1100"
4498-4628 tdm_audio: ch3: "Channel 3: 3322" "C3: 3322" "3: 3322"
4628-4758 tdm_audio: ch4: "Channel 4: 5544" "C4: 5544" "4: 5544"
4758-4888 tdm_audio: ch1: "Channel 1: 7988" "C1: 7988" "1: 7988"
4888-5018 tdm_audio: ch2: "Channel 2: bbaa" "C2: bbaa" "2: bbaa"
5018-5149 tdm_audio: ch3: "Channel 3: ddcc" "C3: ddcc" "3: ddcc"
5149-5279 tdm_audio: ch4: "Channel 4: ffee" "C4: ffee" "4: ffee"
5279-5409 tdm_audio: ch1: "Channel 1: 1322" "C1: 1322" "1: 1322"
5409-5539 tdm_audio: ch2: "Channel 2: 5544" "C2: 5544" "2: 5544"
5539-5669 tdm_audio: ch3: "Channel 3: 7766" "C3: 7766" "3: 7766"
5669-5800 tdm_audio: ch4: "Channel 4: 9988" "C4: 9988" "4: 9988"
5800-5930 tdm_audio: ch1: "Channel 1: bdcc" "C1: bdcc" "1: bdcc"
5930-6060 tdm_audio: ch2: "Channel 2: ffee" "C2: ffee" "2: ffee"
6060-6190 tdm_audio: ch3: "Channel 3: 1100" "C3: 1100" "3: 1100"
6190-6320 tdm_audio: ch4: "Channel 4: 3322" "C4: 3322" "4: 3322"
6320-6451 tdm_audio: ch1: "Channel 1: 5766" "C1: 5766" "1: 5766"
6451-6581 tdm_audio: ch2: "Channel 2: 9988" "C2: 9988" "2: 9988"
6581-6711 tdm_audio: ch3: "Channel 3: bbaa" "C3: bbaa" "3: bbaa"
6711-6841 tdm_audio: ch4: "Channel 4: ddcc" "C4: ddcc" "4: ddcc"
6841-6971 tdm_audio: ch1: "Channel 1: f100" "C1: f100" "1: f100"
6971-7102 tdm_audio: ch2: "Channel 2: 3322" "C2: 3322" "2: 3322"
7102-7232 tdm_audio: ch3: "Channel 3: 5544" "C3: 5544" "3: 5544"
7232-7362 tdm_audio: ch4: "Channel 4: 7766" "C4: 7766" "4: 7766"
7362-7492 tdm_audio: ch1: "Channel 1: 9baa" "C1: 9baa" "1: 9baa"
7492-7623 tdm_audio: ch2: "Channel 2: ddcc" "C2: ddcc" "2: ddcc"
7623-7753 tdm_audio: ch3: "Channel 3: ffee" "C3: ffee" "3: ffee"
7753-7883 tdm_audio: ch4: "Channel 4: 1100" "C4: 1100" "4: 1100"
7883-8013 tdm_audio: ch1: "Channel 1: 3544" "C1: 3544" "1: 3544"
8013-8143 tdm_audio: ch2: "Channel 2: 7766" "C2: 7766" "2: 7766"
8143-8274 tdm_audio: ch3: "Channel 3: 9988" "C3: 9988" "3: 9988"
8274-8404 tdm_audio: ch4: "Channel 4: bbaa" "C4: bbaa" "4: bbaa"
8404-8534 tdm_audio: ch1: "Channel 1: dfee" "C1: dfee" "1: dfee"
8534-8664 tdm_audio: ch2: "Channel 2: 1100" "C2: 1100" "2: 1100"
8664-8794 tdm_audio: ch3: "Channel 3: 3322" "C3: 3322" "3: 3322"
8794-8925 tdm_audio: ch4: "Channel 4: 5544" "C4: 5544" "4: 5544"
8925-9055 tdm_audio: ch1: "Channel 1: 7988" "C1: 7988" "1: 7988"
9055-9185 tdm_audio: ch2: "Channel 2: bbaa" "C2: bbaa" "2: bbaa"
9185-9315 tdm_audio: ch3: "Channel 3: ddcc" "C3: ddcc" "3: ddcc"
9315-9445 tdm_audio: ch4: "Channel 4: ffee" "C4: ffee" "4: ffee"
9445-9576 tdm_audio: ch1: "Channel 1: 1322" "C1: 1322" "1: 1322"
9576-9706 tdm_audio: ch2: "Channel 2: 5544" "C2: 5544" "2: 5544"
9706-9836 tdm_audio: ch3: "Channel 3: 7766" "C3: 7766" "3: 7766"
9836-9966 tdm_audio: ch4: "Channel 4: 9988" "C4: 9988" "4: 9988"
