21268317-21268321 mdio: bit-val: "1"
21268321-21268325 mdio: bit-val: "1"
21268325-21268329 mdio: bit-val: "1"
21268329-21268333 mdio: bit-val: "1"
21268333-21268337 mdio: bit-val: "1"
21268337-21268341 mdio: bit-val: "1"
21268341-21268345 mdio: bit-val: "1"
21268345-21268349 mdio: bit-val: "1"
21268349-21268353 mdio: bit-val: "1"
21268353-21268357 mdio: bit-val: "1"
21268357-21268361 mdio: bit-val: "1"
21268361-21268365 mdio: bit-val: "1"
21268365-21268369 mdio: bit-val: "1"
21268369-21268373 mdio: bit-val: "1"
21268373-21268377 mdio: bit-val: "1"
21268377-21268381 mdio: bit-val: "1"
21268381-21268385 mdio: bit-val: "1"
21268385-21268389 mdio: bit-val: "1"
21268389-21268393 mdio: bit-val: "1"
21268393-21268397 mdio: bit-val: "1"
21268397-21268401 mdio: bit-val: "1"
21268401-21268405 mdio: bit-val: "1"
21268405-21268409 mdio: bit-val: "1"
21268409-21268413 mdio: bit-val: "1"
21268413-21268417 mdio: bit-val: "1"
21268417-21268421 mdio: bit-val: "1"
21268421-21268425 mdio: bit-val: "1"
21268425-21268429 mdio: bit-val: "1"
21268429-21268433 mdio: bit-val: "1"
21268433-21268437 mdio: bit-val: "1"
21268437-21268441 mdio: bit-val: "1"
21268441-21268445 mdio: bit-val: "1"
21268317-21268445 mdio: frame: "PRE #32" "PRE" "P"
21268445-21268449 mdio: bit-val: "0"
21268449-21268453 mdio: bit-val: "1"
21268445-21268453 mdio: frame: "ST (Clause 22)" "ST 22" "ST" "S"
21268453-21268457 mdio: bit-val: "1"
21268457-21268461 mdio: bit-val: "0"
21268453-21268461 mdio: frame: "OP: READ" "OP: R" "OP" "O"
21268461-21268465 mdio: bit-val: "0"
21268465-21268469 mdio: bit-val: "0"
21268469-21268473 mdio: bit-val: "0"
21268473-21268477 mdio: bit-val: "0"
21268477-21268481 mdio: bit-val: "1"
21268461-21268481 mdio: frame: "PHYAD: 01" "PHY" "P"
21268481-21268485 mdio: bit-val: "1"
21268485-21268489 mdio: bit-val: "0"
21268489-21268493 mdio: bit-val: "0"
21268493-21268497 mdio: bit-val: "0"
21268497-21268501 mdio: bit-val: "1"
21268481-21268501 mdio: frame: "REGAD: 17" "REG" "R"
21268501-21268505 mdio: bit-val: "0"
21268505-21268509 mdio: bit-val: "0"
21268501-21268509 mdio: frame: "TURNAROUND" "TA" "T"
21268509-21268513 mdio: bit-val: "0"
21268513-21268517 mdio: bit-val: "0"
21268517-21268521 mdio: bit-val: "0"
21268521-21268525 mdio: bit-val: "0"
21268525-21268529 mdio: bit-val: "0"
21268529-21268533 mdio: bit-val: "0"
21268533-21268537 mdio: bit-val: "0"
21268537-21268541 mdio: bit-val: "0"
21268541-21268545 mdio: bit-val: "0"
21268545-21268549 mdio: bit-val: "0"
21268549-21268553 mdio: bit-val: "0"
21268553-21268557 mdio: bit-val: "0"
21268557-21268561 mdio: bit-val: "0"
21268561-21268565 mdio: bit-val: "0"
21268565-21268569 mdio: bit-val: "0"
21268569-21268573 mdio: bit-val: "1"
21268509-21268573 mdio: frame: "DATA: 0001" "DATA" "D"
21268317-21268573 mdio: decode: "READ:  0001 PHYAD: 01 REGAD: 17" "READ:  0001"
21268591-21268595 mdio: bit-val: "1"
21268595-21268599 mdio: bit-val: "1"
21268599-21268603 mdio: bit-val: "1"
21268603-21268607 mdio: bit-val: "1"
21268607-21268611 mdio: bit-val: "1"
21268611-21268615 mdio: bit-val: "1"
21268615-21268619 mdio: bit-val: "1"
21268619-21268623 mdio: bit-val: "1"
21268623-21268627 mdio: bit-val: "1"
21268627-21268631 mdio: bit-val: "1"
21268631-21268635 mdio: bit-val: "1"
21268635-21268639 mdio: bit-val: "1"
21268639-21268643 mdio: bit-val: "1"
21268643-21268647 mdio: bit-val: "1"
21268647-21268651 mdio: bit-val: "1"
21268651-21268655 mdio: bit-val: "1"
21268655-21268659 mdio: bit-val: "1"
21268659-21268663 mdio: bit-val: "1"
21268663-21268667 mdio: bit-val: "1"
21268667-21268671 mdio: bit-val: "1"
21268671-21268675 mdio: bit-val: "1"
21268675-21268679 mdio: bit-val: "1"
21268679-21268683 mdio: bit-val: "1"
21268683-21268687 mdio: bit-val: "1"
21268687-21268691 mdio: bit-val: "1"
21268691-21268695 mdio: bit-val: "1"
21268695-21268699 mdio: bit-val: "1"
21268699-21268703 mdio: bit-val: "1"
21268703-21268707 mdio: bit-val: "1"
21268707-21268711 mdio: bit-val: "1"
21268711-21268715 mdio: bit-val: "1"
21268715-21268719 mdio: bit-val: "1"
21268591-21268719 mdio: frame: "PRE #32" "PRE" "P"
21268719-21268723 mdio: bit-val: "0"
21268723-21268727 mdio: bit-val: "1"
21268719-21268727 mdio: frame: "ST (Clause 22)" "ST 22" "ST" "S"
21268727-21268731 mdio: bit-val: "0"
21268731-21268735 mdio: bit-val: "1"
21268727-21268735 mdio: frame: "OP: WRITE" "OP: W" "OP" "O"
21268735-21268739 mdio: bit-val: "0"
21268739-21268743 mdio: bit-val: "0"
21268743-21268747 mdio: bit-val: "0"
21268747-21268751 mdio: bit-val: "0"
21268751-21268755 mdio: bit-val: "1"
21268735-21268755 mdio: frame: "PHYAD: 01" "PHY" "P"
21268755-21268759 mdio: bit-val: "1"
21268759-21268763 mdio: bit-val: "0"
21268763-21268767 mdio: bit-val: "0"
21268767-21268771 mdio: bit-val: "0"
21268771-21268775 mdio: bit-val: "1"
21268755-21268775 mdio: frame: "REGAD: 17" "REG" "R"
21268775-21268779 mdio: bit-val: "1"
21268779-21268783 mdio: bit-val: "0"
21268775-21268783 mdio: frame: "TURNAROUND" "TA" "T"
21268783-21268787 mdio: bit-val: "0"
21268787-21268791 mdio: bit-val: "0"
21268791-21268795 mdio: bit-val: "0"
21268795-21268799 mdio: bit-val: "0"
21268799-21268803 mdio: bit-val: "0"
21268803-21268807 mdio: bit-val: "0"
21268807-21268811 mdio: bit-val: "0"
21268811-21268815 mdio: bit-val: "0"
21268815-21268819 mdio: bit-val: "0"
21268819-21268823 mdio: bit-val: "0"
21268823-21268827 mdio: bit-val: "0"
21268827-21268831 mdio: bit-val: "0"
21268831-21268835 mdio: bit-val: "0"
21268835-21268839 mdio: bit-val: "0"
21268839-21268843 mdio: bit-val: "1"
21268843-21268847 mdio: bit-val: "1"
21268783-21268847 mdio: frame: "DATA: 0003" "DATA" "D"
21268591-21268847 mdio: decode: "WRITE: 0003 PHYAD: 01 REGAD: 17" "WRITE: 0003"
21268863-21268867 mdio: bit-val: "1"
21268867-21268871 mdio: bit-val: "1"
21268871-21268875 mdio: bit-val: "1"
21268875-21268879 mdio: bit-val: "1"
21268879-21268883 mdio: bit-val: "1"
21268883-21268887 mdio: bit-val: "1"
21268887-21268891 mdio: bit-val: "1"
21268891-21268895 mdio: bit-val: "1"
21268895-21268899 mdio: bit-val: "1"
21268899-21268903 mdio: bit-val: "1"
21268903-21268907 mdio: bit-val: "1"
21268907-21268911 mdio: bit-val: "1"
21268911-21268915 mdio: bit-val: "1"
21268915-21268919 mdio: bit-val: "1"
21268919-21268923 mdio: bit-val: "1"
21268923-21268927 mdio: bit-val: "1"
21268927-21268931 mdio: bit-val: "1"
21268931-21268935 mdio: bit-val: "1"
21268935-21268939 mdio: bit-val: "1"
21268939-21268943 mdio: bit-val: "1"
21268943-21268947 mdio: bit-val: "1"
21268947-21268951 mdio: bit-val: "1"
21268951-21268955 mdio: bit-val: "1"
21268955-21268959 mdio: bit-val: "1"
21268959-21268963 mdio: bit-val: "1"
21268963-21268967 mdio: bit-val: "1"
21268967-21268971 mdio: bit-val: "1"
21268971-21268975 mdio: bit-val: "1"
21268975-21268979 mdio: bit-val: "1"
21268979-21268983 mdio: bit-val: "1"
21268983-21268987 mdio: bit-val: "1"
21268987-21268991 mdio: bit-val: "1"
21268863-21268991 mdio: frame: "PRE #32" "PRE" "P"
21268991-21268995 mdio: bit-val: "0"
21268995-21268999 mdio: bit-val: "1"
21268991-21268999 mdio: frame: "ST (Clause 22)" "ST 22" "ST" "S"
21268999-21269003 mdio: bit-val: "1"
21269003-21269007 mdio: bit-val: "0"
21268999-21269007 mdio: frame: "OP: READ" "OP: R" "OP" "O"
21269007-21269011 mdio: bit-val: "0"
21269011-21269015 mdio: bit-val: "0"
21269015-21269019 mdio: bit-val: "0"
21269019-21269023 mdio: bit-val: "0"
21269023-21269027 mdio: bit-val: "1"
21269007-21269027 mdio: frame: "PHYAD: 01" "PHY" "P"
21269027-21269031 mdio: bit-val: "1"
21269031-21269035 mdio: bit-val: "0"
21269035-21269039 mdio: bit-val: "0"
21269039-21269043 mdio: bit-val: "1"
21269043-21269047 mdio: bit-val: "0"
21269027-21269047 mdio: frame: "REGAD: 18" "REG" "R"
21269047-21269051 mdio: bit-val: "0"
21269051-21269055 mdio: bit-val: "0"
21269047-21269055 mdio: frame: "TURNAROUND" "TA" "T"
21269055-21269059 mdio: bit-val: "0"
21269059-21269063 mdio: bit-val: "0"
21269063-21269067 mdio: bit-val: "0"
21269067-21269071 mdio: bit-val: "0"
21269071-21269075 mdio: bit-val: "0"
21269075-21269079 mdio: bit-val: "0"
21269079-21269083 mdio: bit-val: "0"
21269083-21269087 mdio: bit-val: "0"
21269087-21269091 mdio: bit-val: "0"
21269091-21269095 mdio: bit-val: "0"
21269095-21269099 mdio: bit-val: "0"
21269099-21269103 mdio: bit-val: "0"
21269103-21269107 mdio: bit-val: "0"
21269107-21269111 mdio: bit-val: "0"
21269111-21269115 mdio: bit-val: "0"
21269115-21269119 mdio: bit-val: "1"
21269055-21269119 mdio: frame: "DATA: 0001" "DATA" "D"
21268863-21269119 mdio: decode: "READ:  0001 PHYAD: 01 REGAD: 18" "READ:  0001"
21269137-21269141 mdio: bit-val: "1"
21269141-21269145 mdio: bit-val: "1"
21269145-21269149 mdio: bit-val: "1"
21269149-21269153 mdio: bit-val: "1"
21269153-21269157 mdio: bit-val: "1"
21269157-21269161 mdio: bit-val: "1"
21269161-21269165 mdio: bit-val: "1"
21269165-21269169 mdio: bit-val: "1"
21269169-21269173 mdio: bit-val: "1"
21269173-21269177 mdio: bit-val: "1"
21269177-21269181 mdio: bit-val: "1"
21269181-21269185 mdio: bit-val: "1"
21269185-21269189 mdio: bit-val: "1"
21269189-21269193 mdio: bit-val: "1"
21269193-21269197 mdio: bit-val: "1"
21269197-21269201 mdio: bit-val: "1"
21269201-21269205 mdio: bit-val: "1"
21269205-21269209 mdio: bit-val: "1"
21269209-21269213 mdio: bit-val: "1"
21269213-21269217 mdio: bit-val: "1"
21269217-21269221 mdio: bit-val: "1"
21269221-21269225 mdio: bit-val: "1"
21269225-21269229 mdio: bit-val: "1"
21269229-21269233 mdio: bit-val: "1"
21269233-21269237 mdio: bit-val: "1"
21269237-21269241 mdio: bit-val: "1"
21269241-21269245 mdio: bit-val: "1"
21269245-21269249 mdio: bit-val: "1"
21269249-21269253 mdio: bit-val: "1"
21269253-21269257 mdio: bit-val: "1"
21269257-21269261 mdio: bit-val: "1"
21269261-21269265 mdio: bit-val: "1"
21269137-21269265 mdio: frame: "PRE #32" "PRE" "P"
21269265-21269269 mdio: bit-val: "0"
21269269-21269273 mdio: bit-val: "1"
21269265-21269273 mdio: frame: "ST (Clause 22)" "ST 22" "ST" "S"
21269273-21269277 mdio: bit-val: "0"
21269277-21269281 mdio: bit-val: "1"
21269273-21269281 mdio: frame: "OP: WRITE" "OP: W" "OP" "O"
21269281-21269285 mdio: bit-val: "0"
21269285-21269289 mdio: bit-val: "0"
21269289-21269293 mdio: bit-val: "0"
21269293-21269297 mdio: bit-val: "0"
21269297-21269301 mdio: bit-val: "1"
21269281-21269301 mdio: frame: "PHYAD: 01" "PHY" "P"
21269301-21269305 mdio: bit-val: "1"
21269305-21269309 mdio: bit-val: "0"
21269309-21269313 mdio: bit-val: "0"
21269313-21269317 mdio: bit-val: "1"
21269317-21269321 mdio: bit-val: "0"
21269301-21269321 mdio: frame: "REGAD: 18" "REG" "R"
21269321-21269325 mdio: bit-val: "1"
21269325-21269329 mdio: bit-val: "0"
21269321-21269329 mdio: frame: "TURNAROUND" "TA" "T"
21269329-21269333 mdio: bit-val: "0"
21269333-21269337 mdio: bit-val: "0"
21269337-21269341 mdio: bit-val: "0"
21269341-21269345 mdio: bit-val: "0"
21269345-21269349 mdio: bit-val: "0"
21269349-21269353 mdio: bit-val: "0"
21269353-21269357 mdio: bit-val: "0"
21269357-21269361 mdio: bit-val: "0"
21269361-21269365 mdio: bit-val: "0"
21269365-21269369 mdio: bit-val: "0"
21269369-21269373 mdio: bit-val: "1"
21269373-21269377 mdio: bit-val: "0"
21269377-21269381 mdio: bit-val: "0"
21269381-21269385 mdio: bit-val: "0"
21269385-21269389 mdio: bit-val: "0"
21269389-21269393 mdio: bit-val: "0"
21269329-21269393 mdio: frame: "DATA: 0020" "DATA" "D"
21269137-21269393 mdio: decode: "WRITE: 0020 PHYAD: 01 REGAD: 18" "WRITE: 0020"
101295742-101295746 mdio: bit-val: "1"
101295746-101295750 mdio: bit-val: "1"
101295750-101295754 mdio: bit-val: "1"
101295754-101295758 mdio: bit-val: "1"
101295758-101295762 mdio: bit-val: "1"
101295762-101295766 mdio: bit-val: "1"
101295766-101295770 mdio: bit-val: "1"
101295770-101295774 mdio: bit-val: "1"
101295774-101295778 mdio: bit-val: "1"
101295778-101295782 mdio: bit-val: "1"
101295782-101295786 mdio: bit-val: "1"
101295786-101295790 mdio: bit-val: "1"
101295790-101295794 mdio: bit-val: "1"
101295794-101295798 mdio: bit-val: "1"
101295798-101295802 mdio: bit-val: "1"
101295802-101295806 mdio: bit-val: "1"
101295806-101295810 mdio: bit-val: "1"
101295810-101295814 mdio: bit-val: "1"
101295814-101295818 mdio: bit-val: "1"
101295818-101295822 mdio: bit-val: "1"
101295822-101295826 mdio: bit-val: "1"
101295826-101295830 mdio: bit-val: "1"
101295830-101295834 mdio: bit-val: "1"
101295834-101295838 mdio: bit-val: "1"
101295838-101295842 mdio: bit-val: "1"
101295842-101295846 mdio: bit-val: "1"
101295846-101295850 mdio: bit-val: "1"
101295850-101295854 mdio: bit-val: "1"
101295854-101295858 mdio: bit-val: "1"
101295858-101295862 mdio: bit-val: "1"
101295862-101295866 mdio: bit-val: "1"
101295866-101295870 mdio: bit-val: "1"
101295742-101295870 mdio: frame: "PRE #32" "PRE" "P"
101295870-101295874 mdio: bit-val: "0"
101295874-101295878 mdio: bit-val: "1"
101295870-101295878 mdio: frame: "ST (Clause 22)" "ST 22" "ST" "S"
101295878-101295882 mdio: bit-val: "1"
101295882-101295886 mdio: bit-val: "0"
101295878-101295886 mdio: frame: "OP: READ" "OP: R" "OP" "O"
101295886-101295890 mdio: bit-val: "0"
101295890-101295894 mdio: bit-val: "0"
101295894-101295898 mdio: bit-val: "0"
101295898-101295902 mdio: bit-val: "0"
101295902-101295906 mdio: bit-val: "1"
101295886-101295906 mdio: frame: "PHYAD: 01" "PHY" "P"
101295906-101295910 mdio: bit-val: "1"
101295910-101295914 mdio: bit-val: "0"
101295914-101295918 mdio: bit-val: "0"
101295918-101295922 mdio: bit-val: "0"
101295922-101295926 mdio: bit-val: "1"
101295906-101295926 mdio: frame: "REGAD: 17" "REG" "R"
101295926-101295930 mdio: bit-val: "0"
101295930-101295934 mdio: bit-val: "0"
101295926-101295934 mdio: frame: "TURNAROUND" "TA" "T"
101295934-101295938 mdio: bit-val: "0"
101295938-101295942 mdio: bit-val: "0"
101295942-101295946 mdio: bit-val: "0"
101295946-101295950 mdio: bit-val: "0"
101295950-101295954 mdio: bit-val: "0"
101295954-101295958 mdio: bit-val: "0"
101295958-101295962 mdio: bit-val: "0"
101295962-101295966 mdio: bit-val: "0"
101295966-101295970 mdio: bit-val: "0"
101295970-101295974 mdio: bit-val: "0"
101295974-101295978 mdio: bit-val: "0"
101295978-101295982 mdio: bit-val: "0"
101295982-101295986 mdio: bit-val: "0"
101295986-101295990 mdio: bit-val: "1"
101295990-101295994 mdio: bit-val: "1"
101295994-101295998 mdio: bit-val: "1"
101295934-101295998 mdio: frame: "DATA: 0007" "DATA" "D"
101295742-101295998 mdio: decode: "READ:  0007 PHYAD: 01 REGAD: 17" "READ:  0007"
101296016-101296020 mdio: bit-val: "1"
101296020-101296024 mdio: bit-val: "1"
101296024-101296028 mdio: bit-val: "1"
101296028-101296032 mdio: bit-val: "1"
101296032-101296036 mdio: bit-val: "1"
101296036-101296040 mdio: bit-val: "1"
101296040-101296044 mdio: bit-val: "1"
101296044-101296048 mdio: bit-val: "1"
101296048-101296052 mdio: bit-val: "1"
101296052-101296056 mdio: bit-val: "1"
101296056-101296060 mdio: bit-val: "1"
101296060-101296064 mdio: bit-val: "1"
101296064-101296068 mdio: bit-val: "1"
101296068-101296072 mdio: bit-val: "1"
101296072-101296076 mdio: bit-val: "1"
101296076-101296080 mdio: bit-val: "1"
101296080-101296084 mdio: bit-val: "1"
101296084-101296088 mdio: bit-val: "1"
101296088-101296092 mdio: bit-val: "1"
101296092-101296096 mdio: bit-val: "1"
101296096-101296100 mdio: bit-val: "1"
101296100-101296104 mdio: bit-val: "1"
101296104-101296108 mdio: bit-val: "1"
101296108-101296112 mdio: bit-val: "1"
101296112-101296116 mdio: bit-val: "1"
101296116-101296120 mdio: bit-val: "1"
101296120-101296124 mdio: bit-val: "1"
101296124-101296128 mdio: bit-val: "1"
101296128-101296132 mdio: bit-val: "1"
101296132-101296136 mdio: bit-val: "1"
101296136-101296140 mdio: bit-val: "1"
101296140-101296144 mdio: bit-val: "1"
101296016-101296144 mdio: frame: "PRE #32" "PRE" "P"
101296144-101296148 mdio: bit-val: "0"
101296148-101296152 mdio: bit-val: "1"
101296144-101296152 mdio: frame: "ST (Clause 22)" "ST 22" "ST" "S"
101296152-101296156 mdio: bit-val: "0"
101296156-101296160 mdio: bit-val: "1"
101296152-101296160 mdio: frame: "OP: WRITE" "OP: W" "OP" "O"
101296160-101296164 mdio: bit-val: "0"
101296164-101296168 mdio: bit-val: "0"
101296168-101296172 mdio: bit-val: "0"
101296172-101296176 mdio: bit-val: "0"
101296176-101296180 mdio: bit-val: "1"
101296160-101296180 mdio: frame: "PHYAD: 01" "PHY" "P"
101296180-101296184 mdio: bit-val: "1"
101296184-101296188 mdio: bit-val: "0"
101296188-101296192 mdio: bit-val: "0"
101296192-101296196 mdio: bit-val: "0"
101296196-101296200 mdio: bit-val: "1"
101296180-101296200 mdio: frame: "REGAD: 17" "REG" "R"
101296200-101296204 mdio: bit-val: "1"
101296204-101296208 mdio: bit-val: "0"
101296200-101296208 mdio: frame: "TURNAROUND" "TA" "T"
101296208-101296212 mdio: bit-val: "0"
101296212-101296216 mdio: bit-val: "0"
101296216-101296220 mdio: bit-val: "0"
101296220-101296224 mdio: bit-val: "0"
101296224-101296228 mdio: bit-val: "0"
101296228-101296232 mdio: bit-val: "0"
101296232-101296236 mdio: bit-val: "0"
101296236-101296240 mdio: bit-val: "0"
101296240-101296244 mdio: bit-val: "0"
101296244-101296248 mdio: bit-val: "0"
101296248-101296252 mdio: bit-val: "0"
101296252-101296256 mdio: bit-val: "0"
101296256-101296260 mdio: bit-val: "0"
101296260-101296264 mdio: bit-val: "0"
101296264-101296268 mdio: bit-val: "1"
101296268-101296272 mdio: bit-val: "1"
101296208-101296272 mdio: frame: "DATA: 0003" "DATA" "D"
101296016-101296272 mdio: decode: "WRITE: 0003 PHYAD: 01 REGAD: 17" "WRITE: 0003"
101296290-101296294 mdio: bit-val: "1"
101296294-101296298 mdio: bit-val: "1"
101296298-101296302 mdio: bit-val: "1"
101296302-101296306 mdio: bit-val: "1"
101296306-101296310 mdio: bit-val: "1"
101296310-101296314 mdio: bit-val: "1"
101296314-101296318 mdio: bit-val: "1"
101296318-101296322 mdio: bit-val: "1"
101296322-101296326 mdio: bit-val: "1"
101296326-101296330 mdio: bit-val: "1"
101296330-101296334 mdio: bit-val: "1"
101296334-101296338 mdio: bit-val: "1"
101296338-101296342 mdio: bit-val: "1"
101296342-101296346 mdio: bit-val: "1"
101296346-101296350 mdio: bit-val: "1"
101296350-101296354 mdio: bit-val: "1"
101296354-101296358 mdio: bit-val: "1"
101296358-101296362 mdio: bit-val: "1"
101296362-101296366 mdio: bit-val: "1"
101296366-101296370 mdio: bit-val: "1"
101296370-101296374 mdio: bit-val: "1"
101296374-101296378 mdio: bit-val: "1"
101296378-101296382 mdio: bit-val: "1"
101296382-101296386 mdio: bit-val: "1"
101296386-101296390 mdio: bit-val: "1"
101296390-101296394 mdio: bit-val: "1"
101296394-101296398 mdio: bit-val: "1"
101296398-101296402 mdio: bit-val: "1"
101296402-101296406 mdio: bit-val: "1"
101296406-101296410 mdio: bit-val: "1"
101296410-101296414 mdio: bit-val: "1"
101296414-101296418 mdio: bit-val: "1"
101296290-101296418 mdio: frame: "PRE #32" "PRE" "P"
101296418-101296422 mdio: bit-val: "0"
101296422-101296426 mdio: bit-val: "1"
101296418-101296426 mdio: frame: "ST (Clause 22)" "ST 22" "ST" "S"
101296426-101296430 mdio: bit-val: "1"
101296430-101296434 mdio: bit-val: "0"
101296426-101296434 mdio: frame: "OP: READ" "OP: R" "OP" "O"
101296434-101296438 mdio: bit-val: "0"
101296438-101296442 mdio: bit-val: "0"
101296442-101296446 mdio: bit-val: "0"
101296446-101296450 mdio: bit-val: "0"
101296450-101296454 mdio: bit-val: "1"
101296434-101296454 mdio: frame: "PHYAD: 01" "PHY" "P"
101296454-101296458 mdio: bit-val: "1"
101296458-101296462 mdio: bit-val: "0"
101296462-101296466 mdio: bit-val: "0"
101296466-101296470 mdio: bit-val: "1"
101296470-101296474 mdio: bit-val: "0"
101296454-101296474 mdio: frame: "REGAD: 18" "REG" "R"
101296474-101296478 mdio: bit-val: "0"
101296478-101296482 mdio: bit-val: "0"
101296474-101296482 mdio: frame: "TURNAROUND" "TA" "T"
101296482-101296486 mdio: bit-val: "0"
101296486-101296490 mdio: bit-val: "0"
101296490-101296494 mdio: bit-val: "0"
101296494-101296498 mdio: bit-val: "0"
101296498-101296502 mdio: bit-val: "0"
101296502-101296506 mdio: bit-val: "0"
101296506-101296510 mdio: bit-val: "0"
101296510-101296514 mdio: bit-val: "0"
101296514-101296518 mdio: bit-val: "0"
101296518-101296522 mdio: bit-val: "1"
101296522-101296526 mdio: bit-val: "0"
101296526-101296530 mdio: bit-val: "0"
101296530-101296534 mdio: bit-val: "0"
101296534-101296538 mdio: bit-val: "0"
101296538-101296542 mdio: bit-val: "0"
101296542-101296546 mdio: bit-val: "0"
101296482-101296546 mdio: frame: "DATA: 0040" "DATA" "D"
101296290-101296546 mdio: decode: "READ:  0040 PHYAD: 01 REGAD: 18" "READ:  0040"
101296566-101296570 mdio: bit-val: "1"
101296570-101296574 mdio: bit-val: "1"
101296574-101296578 mdio: bit-val: "1"
101296578-101296582 mdio: bit-val: "1"
101296582-101296586 mdio: bit-val: "1"
101296586-101296590 mdio: bit-val: "1"
101296590-101296594 mdio: bit-val: "1"
101296594-101296598 mdio: bit-val: "1"
101296598-101296602 mdio: bit-val: "1"
101296602-101296606 mdio: bit-val: "1"
101296606-101296610 mdio: bit-val: "1"
101296610-101296614 mdio: bit-val: "1"
101296614-101296618 mdio: bit-val: "1"
101296618-101296622 mdio: bit-val: "1"
101296622-101296626 mdio: bit-val: "1"
101296626-101296630 mdio: bit-val: "1"
101296630-101296634 mdio: bit-val: "1"
101296634-101296638 mdio: bit-val: "1"
101296638-101296642 mdio: bit-val: "1"
101296642-101296646 mdio: bit-val: "1"
101296646-101296650 mdio: bit-val: "1"
101296650-101296654 mdio: bit-val: "1"
101296654-101296658 mdio: bit-val: "1"
101296658-101296662 mdio: bit-val: "1"
101296662-101296666 mdio: bit-val: "1"
101296666-101296670 mdio: bit-val: "1"
101296670-101296674 mdio: bit-val: "1"
101296674-101296678 mdio: bit-val: "1"
101296678-101296682 mdio: bit-val: "1"
101296682-101296686 mdio: bit-val: "1"
101296686-101296690 mdio: bit-val: "1"
101296690-101296694 mdio: bit-val: "1"
101296566-101296694 mdio: frame: "PRE #32" "PRE" "P"
101296694-101296698 mdio: bit-val: "0"
101296698-101296702 mdio: bit-val: "1"
101296694-101296702 mdio: frame: "ST (Clause 22)" "ST 22" "ST" "S"
101296702-101296706 mdio: bit-val: "0"
101296706-101296710 mdio: bit-val: "1"
101296702-101296710 mdio: frame: "OP: WRITE" "OP: W" "OP" "O"
101296710-101296714 mdio: bit-val: "0"
101296714-101296718 mdio: bit-val: "0"
101296718-101296722 mdio: bit-val: "0"
101296722-101296726 mdio: bit-val: "0"
101296726-101296730 mdio: bit-val: "1"
101296710-101296730 mdio: frame: "PHYAD: 01" "PHY" "P"
101296730-101296734 mdio: bit-val: "1"
101296734-101296738 mdio: bit-val: "0"
101296738-101296742 mdio: bit-val: "0"
101296742-101296746 mdio: bit-val: "1"
101296746-101296750 mdio: bit-val: "0"
101296730-101296750 mdio: frame: "REGAD: 18" "REG" "R"
101296750-101296754 mdio: bit-val: "1"
101296754-101296758 mdio: bit-val: "0"
101296750-101296758 mdio: frame: "TURNAROUND" "TA" "T"
101296758-101296762 mdio: bit-val: "0"
101296762-101296766 mdio: bit-val: "0"
101296766-101296770 mdio: bit-val: "0"
101296770-101296774 mdio: bit-val: "0"
101296774-101296778 mdio: bit-val: "0"
101296778-101296782 mdio: bit-val: "0"
101296782-101296786 mdio: bit-val: "0"
101296786-101296790 mdio: bit-val: "0"
101296790-101296794 mdio: bit-val: "0"
101296794-101296798 mdio: bit-val: "0"
101296798-101296802 mdio: bit-val: "1"
101296802-101296806 mdio: bit-val: "0"
101296806-101296810 mdio: bit-val: "0"
101296810-101296814 mdio: bit-val: "0"
101296814-101296818 mdio: bit-val: "0"
101296818-101296822 mdio: bit-val: "0"
101296758-101296822 mdio: frame: "DATA: 0020" "DATA" "D"
101296566-101296822 mdio: decode: "WRITE: 0020 PHYAD: 01 REGAD: 18" "WRITE: 0020"
