3000025-3036391 lin: control: "Break condition" "Break" "Brk" "B"
3047022-3067856 lin: data: "Sync" "S"
3082127-3102961 lin: data: "ID: 23 Parity: 2 (ok)" "ID: 0x23" "I: 35"
3109935-3130769 lin: data: "Data: 0x00" "D: 0x00"
3138538-3159372 lin: data: "Data: 0x00" "D: 0x00"
3167142-3187976 lin: data: "Checksum: 0x5C" "Checksum" "Chk" "C"
3253780-3290051 lin: control: "Break condition" "Break" "Brk" "B"
3301855-3322689 lin: data: "Sync" "S"
3507531-3543819 lin: control: "Break condition" "Break" "Brk" "B"
3555388-3576222 lin: data: "Sync" "S"
3590491-3611325 lin: data: "ID: 23 Parity: 2 (ok)" "ID: 0x23" "I: 35"
3761304-3797572 lin: control: "Break condition" "Break" "Brk" "B"
3808920-3829754 lin: data: "Sync" "S"
3844025-3864859 lin: data: "ID: 23 Parity: 2 (ok)" "ID: 0x23" "I: 35"
3871841-3892675 lin: data: "Data: 0x00" "D: 0x00"
3900446-3921280 lin: data: "Data: 0x00" "D: 0x00"
3929050-3949884 lin: data: "Checksum: 0x5C" "Checksum" "Chk" "C"
4015005-4051294 lin: control: "Break condition" "Break" "Brk" "B"
4062453-4083287 lin: data: "Sync" "S"
4270276-4306564 lin: control: "Break condition" "Break" "Brk" "B"
4317285-4338119 lin: data: "Sync" "S"
4352389-4373223 lin: data: "ID: 23 Parity: 2 (ok)" "ID: 0x23" "I: 35"
4524052-4560324 lin: control: "Break condition" "Break" "Brk" "B"
4572117-4592951 lin: data: "Sync" "S"
4607222-4628056 lin: data: "ID: 23 Parity: 2 (ok)" "ID: 0x23" "I: 35"
4633749-4654583 lin: data: "Data: 0x00" "D: 0x00"
4662353-4683187 lin: data: "Data: 0x00" "D: 0x00"
4690957-4711791 lin: data: "Checksum: 0x5C" "Checksum" "Chk" "C"
4777757-4814049 lin: control: "Break condition" "Break" "Brk" "B"
4825649-4846483 lin: data: "Sync" "S"
5031521-5067794 lin: control: "Break condition" "Break" "Brk" "B"
5079182-5100016 lin: data: "Sync" "S"
5114286-5135120 lin: data: "ID: 23 Parity: 2 (ok)" "ID: 0x23" "I: 35"
5285288-5321580 lin: control: "Break condition" "Break" "Brk" "B"
5332714-5353548 lin: data: "Sync" "S"
5367819-5388653 lin: data: "ID: 23 Parity: 2 (ok)" "ID: 0x23" "I: 35"
5395657-5416491 lin: data: "Data: 0x00" "D: 0x00"
5424261-5445095 lin: data: "Data: 0x00" "D: 0x00"
5452865-5473699 lin: data: "Checksum: 0x5C" "Checksum" "Chk" "C"
