118-798 lin: control: "Break condition" "Break" "Brk" "B"
957-1375 lin: data: "Sync" "S"
1584-2002 lin: data: "ID: 23 Parity: 2 (ok)" "ID: 0x23" "I: 35"
2232-2650 lin: data: "Data: 0x11" "D: 0x11"
2855-3273 lin: data: "Data: 0x22" "D: 0x22"
3482-3900 lin: data: "Checksum: 0x29" "Checksum" "Chk" "C"
4063-4742 lin: control: "Break condition" "Break" "Brk" "B"
4900-5318 lin: data: "Sync" "S"
5527-5945 lin: data: "ID: 23 Parity: 2 (ok)" "ID: 0x23" "I: 35"
6169-6587 lin: data: "Data: 0x11" "D: 0x11"
6796-7214 lin: data: "Data: 0x22" "D: 0x22"
7420-7838 lin: data: "Checksum: 0x29" "Checksum" "Chk" "C"
8000-8679 lin: control: "Break condition" "Break" "Brk" "B"
8837-9255 lin: data: "Sync" "S"
9464-9882 lin: data: "ID: 23 Parity: 2 (ok)" "ID: 0x23" "I: 35"
10106-10524 lin: data: "Data: 0x11" "D: 0x11"
10733-11151 lin: data: "Data: 0x22" "D: 0x22"
11357-11775 lin: data: "Checksum: 0x29" "Checksum" "Chk" "C"
11937-12616 lin: control: "Break condition" "Break" "Brk" "B"
12775-13193 lin: data: "Sync" "S"
13402-13820 lin: data: "ID: 23 Parity: 2 (ok)" "ID: 0x23" "I: 35"
14043-14461 lin: data: "Data: 0x11" "D: 0x11"
14670-15088 lin: data: "Data: 0x22" "D: 0x22"
15294-15712 lin: data: "Checksum: 0x29" "Checksum" "Chk" "C"
15874-16553 lin: control: "Break condition" "Break" "Brk" "B"
16712-17130 lin: data: "Sync" "S"
17339-17757 lin: data: "ID: 23 Parity: 2 (ok)" "ID: 0x23" "I: 35"
17977-18395 lin: data: "Data: 0x11" "D: 0x11"
18604-19022 lin: data: "Data: 0x22" "D: 0x22"
19228-19646 lin: data: "Checksum: 0x29" "Checksum" "Chk" "C"
19809-20488 lin: control: "Break condition" "Break" "Brk" "B"
20646-21064 lin: data: "Sync" "S"
21273-21691 lin: data: "ID: 23 Parity: 2 (ok)" "ID: 0x23" "I: 35"
21914-22332 lin: data: "Data: 0x11" "D: 0x11"
22541-22959 lin: data: "Data: 0x22" "D: 0x22"
23165-23583 lin: data: "Checksum: 0x29" "Checksum" "Chk" "C"
23745-24425 lin: control: "Break condition" "Break" "Brk" "B"
24583-25001 lin: data: "Sync" "S"
25210-25628 lin: data: "ID: 23 Parity: 2 (ok)" "ID: 0x23" "I: 35"
25851-26269 lin: data: "Data: 0x11" "D: 0x11"
26478-26896 lin: data: "Data: 0x22" "D: 0x22"
27102-27520 lin: data: "Checksum: 0x29" "Checksum" "Chk" "C"
27682-28362 lin: control: "Break condition" "Break" "Brk" "B"
28520-28938 lin: data: "Sync" "S"
29147-29565 lin: data: "ID: 23 Parity: 2 (ok)" "ID: 0x23" "I: 35"
29789-30207 lin: data: "Data: 0x11" "D: 0x11"
30416-30834 lin: data: "Data: 0x22" "D: 0x22"
31039-31457 lin: data: "Checksum: 0x29" "Checksum" "Chk" "C"
31620-32299 lin: control: "Break condition" "Break" "Brk" "B"
32457-32875 lin: data: "Sync" "S"
33084-33502 lin: data: "ID: 23 Parity: 2 (ok)" "ID: 0x23" "I: 35"
33726-34144 lin: data: "Data: 0x11" "D: 0x11"
34353-34771 lin: data: "Data: 0x22" "D: 0x22"
34976-35394 lin: data: "Checksum: 0x29" "Checksum" "Chk" "C"
35557-36236 lin: control: "Break condition" "Break" "Brk" "B"
36394-36812 lin: data: "Sync" "S"
37021-37439 lin: data: "ID: 23 Parity: 2 (ok)" "ID: 0x23" "I: 35"
37663-38081 lin: data: "Data: 0x11" "D: 0x11"
38290-38708 lin: data: "Data: 0x22" "D: 0x22"
38914-39332 lin: data: "Checksum: 0x29" "Checksum" "Chk" "C"
