9992-10092 can: bit: "0"
9992-10092 can: sof: "Start of frame" "SOF" "S"
10092-10192 can: bit: "0"
10192-10292 can: bit: "0"
10292-10392 can: bit: "0"
10392-10492 can: bit: "0"
10492-10592 can: stuff-bit: "1"
10592-10692 can: bit: "0"
10692-10792 can: bit: "0"
10792-10892 can: bit: "0"
10892-10992 can: bit: "0"
10992-11092 can: bit: "0"
11092-11192 can: stuff-bit: "1"
11192-11292 can: bit: "0"
11292-11392 can: bit: "0"
10092-11392 can: id: "Identifier: 0 (0x0)" "ID: 0 (0x0)" "ID"
11392-11492 can: bit: "1"
11492-11592 can: bit: "1"
11492-11592 can: ide: "Identifier extension bit: extended frame" "IDE: extended frame" "IDE"
11592-11692 can: bit: "0"
11692-11792 can: bit: "0"
11792-11892 can: bit: "0"
11892-11992 can: bit: "0"
11992-12092 can: bit: "0"
12092-12192 can: stuff-bit: "1"
12192-12292 can: bit: "0"
12292-12392 can: bit: "0"
12392-12492 can: bit: "0"
12492-12592 can: bit: "0"
12592-12692 can: bit: "0"
12692-12792 can: stuff-bit: "1"
12792-12892 can: bit: "0"
12892-12992 can: bit: "1"
12992-13092 can: bit: "0"
13092-13192 can: bit: "0"
13192-13292 can: bit: "0"
13292-13392 can: bit: "0"
13392-13492 can: bit: "1"
13492-13592 can: bit: "0"
11592-13592 can: ext-id: "Extended Identifier: 66 (0x42)" "Extended ID: 66 (0x42)" "Extended ID" "EID"
11592-13592 can: full-id: "Full Identifier: 66 (0x42)" "Full ID: 66 (0x42)" "Full ID" "FID"
11392-11492 can: srr: "Substitute remote request: 1" "SRR: 1" "SRR"
13592-13692 can: bit: "0"
13592-13692 can: rtr: "Remote transmission request: data frame" "RTR: data frame" "RTR"
13692-13792 can: bit: "1"
13692-13792 can: reserved-bit: "Flexible data format: 1" "FDF: 1" "FDF"
13592-13692 can: reserved-bit: "Reserved bit 1: 0" "RB1: 0" "RB1"
13792-13892 can: bit: "0"
13792-13892 can: reserved-bit: "Reserved bit 0: 0" "RB0: 0" "RB0"
13892-13992 can: bit: "0"
13892-13992 can: reserved-bit: "Bit rate switch: 0" "BRS: 0" "BRS"
13992-14092 can: bit: "0"
13992-14092 can: reserved-bit: "Error state indicator: 0" "ESI: 0" "ESI"
14092-14192 can: bit: "1"
14192-14292 can: bit: "1"
14292-14392 can: bit: "1"
14392-14492 can: bit: "1"
14092-14492 can: dlc: "Data length code: 15" "DLC: 15" "DLC"
14492-14592 can: bit: "0"
14592-14692 can: bit: "0"
14692-14792 can: bit: "0"
14792-14892 can: bit: "0"
14892-14992 can: bit: "0"
14992-15092 can: stuff-bit: "1"
15092-15192 can: bit: "0"
15192-15292 can: bit: "0"
15292-15392 can: bit: "0"
15392-15492 can: bit: "0"
15492-15592 can: bit: "0"
15592-15692 can: stuff-bit: "1"
15693-15793 can: bit: "0"
15793-15893 can: bit: "0"
15893-15993 can: bit: "0"
15993-16093 can: bit: "0"
16093-16193 can: bit: "0"
16193-16293 can: stuff-bit: "1"
16293-16393 can: bit: "1"
16393-16493 can: bit: "0"
16493-16593 can: bit: "0"
16593-16693 can: bit: "0"
16693-16793 can: bit: "0"
16793-16893 can: bit: "0"
16893-16993 can: stuff-bit: "1"
16993-17093 can: bit: "0"
17093-17193 can: bit: "1"
17193-17293 can: bit: "0"
17293-17393 can: bit: "0"
17393-17493 can: bit: "0"
17493-17593 can: bit: "0"
17593-17693 can: bit: "0"
17693-17793 can: stuff-bit: "1"
17793-17893 can: bit: "0"
17893-17993 can: bit: "0"
17993-18093 can: bit: "1"
18093-18193 can: bit: "1"
18193-18293 can: bit: "0"
18293-18393 can: bit: "0"
18393-18493 can: bit: "0"
18493-18593 can: bit: "0"
18593-18693 can: bit: "0"
18693-18793 can: stuff-bit: "1"
18793-18893 can: bit: "1"
18893-18993 can: bit: "0"
18993-19093 can: bit: "0"
19093-19193 can: bit: "0"
19193-19293 can: bit: "0"
19293-19393 can: bit: "0"
19393-19493 can: stuff-bit: "1"
19493-19593 can: bit: "0"
19593-19693 can: bit: "0"
19693-19793 can: bit: "1"
19793-19893 can: bit: "0"
19893-19993 can: bit: "1"
19993-20093 can: bit: "0"
20093-20193 can: bit: "0"
20193-20293 can: bit: "0"
20293-20393 can: bit: "0"
20393-20493 can: bit: "0"
20493-20593 can: stuff-bit: "1"
20593-20693 can: bit: "1"
20693-20793 can: bit: "1"
20793-20893 can: bit: "0"
20893-20993 can: bit: "0"
20993-21093 can: bit: "0"
21093-21193 can: bit: "0"
21193-21293 can: bit: "0"
21293-21393 can: stuff-bit: "1"
21393-21493 can: bit: "0"
21493-21593 can: bit: "1"
21593-21693 can: bit: "1"
21693-21793 can: bit: "1"
21793-21893 can: bit: "0"
21893-21993 can: bit: "0"
21993-22093 can: bit: "0"
22093-22193 can: bit: "0"
22193-22293 can: bit: "1"
22293-22393 can: bit: "0"
22393-22493 can: bit: "0"
22493-22593 can: bit: "0"
22593-22693 can: bit: "0"
22693-22793 can: bit: "0"
22793-22893 can: stuff-bit: "1"
22894-22994 can: bit: "0"
22994-23094 can: bit: "0"
23094-23194 can: bit: "1"
23194-23294 can: bit: "0"
23294-23394 can: bit: "0"
23394-23494 can: bit: "1"
23494-23594 can: bit: "0"
23594-23694 can: bit: "0"
23694-23794 can: bit: "0"
23794-23894 can: bit: "0"
23894-23994 can: bit: "1"
23994-24094 can: bit: "0"
24094-24194 can: bit: "1"
24194-24294 can: bit: "0"
24294-24394 can: bit: "0"
24394-24494 can: bit: "0"
24494-24594 can: bit: "0"
24594-24694 can: bit: "0"
24694-24794 can: stuff-bit: "1"
24794-24894 can: bit: "1"
24894-24994 can: bit: "0"
24994-25094 can: bit: "1"
25094-25194 can: bit: "1"
25194-25294 can: bit: "0"
25294-25394 can: bit: "0"
25394-25494 can: bit: "0"
25494-25594 can: bit: "0"
25594-25694 can: bit: "1"
25694-25794 can: bit: "1"
25794-25894 can: bit: "0"
25894-25994 can: bit: "0"
25994-26094 can: bit: "0"
26094-26194 can: bit: "0"
26194-26294 can: bit: "0"
26294-26394 can: stuff-bit: "1"
26394-26494 can: bit: "0"
26494-26594 can: bit: "1"
26594-26694 can: bit: "1"
26694-26794 can: bit: "0"
26794-26894 can: bit: "1"
26894-26994 can: bit: "0"
26994-27094 can: bit: "0"
27094-27194 can: bit: "0"
27194-27294 can: bit: "0"
27294-27394 can: bit: "1"
27394-27494 can: bit: "1"
27494-27594 can: bit: "1"
27594-27694 can: bit: "0"
27694-27794 can: bit: "0"
27794-27894 can: bit: "0"
27894-27994 can: bit: "0"
27994-28094 can: bit: "0"
28094-28194 can: stuff-bit: "1"
28194-28294 can: bit: "1"
28294-28394 can: bit: "1"
28394-28494 can: bit: "1"
28494-28594 can: bit: "1"
28594-28694 can: stuff-bit: "0"
28694-28794 can: bit: "0"
28794-28894 can: bit: "0"
28894-28994 can: bit: "0"
28994-29094 can: bit: "1"
29094-29194 can: bit: "0"
29194-29294 can: bit: "0"
29294-29394 can: bit: "0"
29394-29494 can: bit: "0"
29494-29594 can: bit: "0"
29594-29694 can: stuff-bit: "1"
29694-29794 can: bit: "0"
29794-29894 can: bit: "0"
29894-29994 can: bit: "1"
29994-30094 can: bit: "0"
30094-30194 can: bit: "0"
30194-30294 can: bit: "0"
30294-30394 can: bit: "1"
30395-30495 can: bit: "0"
30495-30595 can: bit: "0"
30595-30695 can: bit: "0"
30695-30795 can: bit: "1"
30795-30895 can: bit: "0"
30895-30995 can: bit: "0"
30995-31095 can: bit: "1"
31095-31195 can: bit: "0"
31195-31295 can: bit: "0"
31295-31395 can: bit: "0"
31395-31495 can: bit: "0"
31495-31595 can: bit: "1"
31595-31695 can: bit: "0"
31695-31795 can: bit: "0"
31795-31895 can: bit: "1"
31895-31995 can: bit: "1"
31995-32095 can: bit: "0"
32095-32195 can: bit: "0"
32195-32295 can: bit: "0"
32295-32395 can: bit: "1"
32395-32495 can: bit: "0"
32495-32595 can: bit: "1"
32595-32695 can: bit: "0"
32695-32795 can: bit: "0"
32795-32895 can: bit: "0"
32895-32995 can: bit: "0"
32995-33095 can: bit: "0"
33095-33195 can: stuff-bit: "1"
33195-33295 can: bit: "1"
33295-33395 can: bit: "0"
33395-33495 can: bit: "1"
33495-33595 can: bit: "0"
33595-33695 can: bit: "1"
33695-33795 can: bit: "0"
33795-33895 can: bit: "0"
33895-33995 can: bit: "0"
33995-34095 can: bit: "1"
34095-34195 can: bit: "0"
34195-34295 can: bit: "1"
34295-34395 can: bit: "1"
34395-34495 can: bit: "0"
34495-34595 can: bit: "0"
34595-34695 can: bit: "0"
34695-34795 can: bit: "0"
34795-34895 can: bit: "1"
34895-34995 can: bit: "0"
34995-35095 can: bit: "1"
35095-35195 can: bit: "1"
35195-35295 can: bit: "1"
35295-35395 can: bit: "0"
35395-35495 can: bit: "0"
35495-35595 can: bit: "0"
35595-35695 can: bit: "1"
35695-35795 can: bit: "1"
35795-35895 can: bit: "0"
35895-35995 can: bit: "0"
35995-36095 can: bit: "0"
36095-36195 can: bit: "0"
36195-36295 can: bit: "0"
36295-36395 can: stuff-bit: "1"
36395-36495 can: bit: "0"
36495-36595 can: bit: "1"
36595-36695 can: bit: "1"
36695-36795 can: bit: "0"
36795-36895 can: bit: "0"
36895-36995 can: bit: "1"
36995-37095 can: bit: "0"
37095-37195 can: bit: "0"
37195-37295 can: bit: "0"
37295-37395 can: bit: "1"
37395-37495 can: bit: "1"
37495-37595 can: bit: "0"
37595-37695 can: bit: "1"
37695-37795 can: bit: "0"
37795-37895 can: bit: "0"
37895-37995 can: bit: "0"
37995-38095 can: bit: "0"
38095-38195 can: bit: "1"
38195-38295 can: bit: "1"
38296-38396 can: bit: "0"
38396-38496 can: bit: "1"
38496-38596 can: bit: "1"
38596-38696 can: bit: "0"
38696-38796 can: bit: "0"
38796-38896 can: bit: "0"
38896-38996 can: bit: "1"
38996-39096 can: bit: "1"
39096-39196 can: bit: "1"
39196-39296 can: bit: "0"
39296-39396 can: bit: "0"
39396-39496 can: bit: "0"
39496-39596 can: bit: "0"
39596-39696 can: bit: "0"
39696-39796 can: stuff-bit: "1"
39796-39896 can: bit: "1"
39896-39996 can: bit: "1"
39996-40096 can: bit: "1"
40096-40196 can: bit: "0"
40196-40296 can: bit: "1"
40296-40396 can: bit: "0"
40396-40496 can: bit: "0"
40496-40596 can: bit: "0"
40596-40696 can: bit: "1"
40696-40796 can: bit: "1"
40796-40896 can: bit: "1"
40896-40996 can: bit: "1"
40996-41096 can: bit: "0"
41096-41196 can: bit: "0"
41196-41296 can: bit: "0"
41296-41396 can: bit: "0"
41396-41496 can: bit: "1"
41496-41596 can: bit: "1"
41596-41696 can: bit: "1"
41696-41796 can: bit: "1"
41796-41896 can: bit: "1"
41896-41996 can: stuff-bit: "0"
41996-42096 can: bit: "0"
42096-42196 can: bit: "0"
42196-42296 can: bit: "1"
42296-42396 can: bit: "0"
42396-42496 can: bit: "0"
42496-42596 can: bit: "0"
42596-42696 can: bit: "0"
42696-42796 can: bit: "0"
42796-42896 can: stuff-bit: "1"
42896-42996 can: bit: "0"
42996-43096 can: bit: "0"
43096-43196 can: bit: "1"
43196-43296 can: bit: "0"
43296-43396 can: bit: "0"
43396-43496 can: bit: "0"
43496-43596 can: bit: "0"
43596-43696 can: bit: "1"
43696-43796 can: bit: "0"
43796-43896 can: bit: "0"
43896-43996 can: bit: "1"
43996-44096 can: bit: "0"
44096-44196 can: bit: "0"
44196-44296 can: bit: "0"
44296-44396 can: bit: "1"
44396-44496 can: bit: "0"
44496-44596 can: bit: "0"
44596-44696 can: bit: "0"
44696-44796 can: bit: "1"
44796-44896 can: bit: "0"
44896-44996 can: bit: "0"
44996-45096 can: bit: "0"
45096-45196 can: bit: "1"
45196-45296 can: bit: "1"
45297-45397 can: bit: "0"
45397-45497 can: bit: "0"
45497-45597 can: bit: "1"
45597-45697 can: bit: "0"
45697-45797 can: bit: "0"
45797-45897 can: bit: "1"
45897-45997 can: bit: "0"
45997-46097 can: bit: "0"
46097-46197 can: bit: "0"
46197-46297 can: bit: "0"
46297-46397 can: bit: "1"
46397-46497 can: bit: "0"
46497-46597 can: bit: "0"
46597-46697 can: bit: "1"
46697-46797 can: bit: "0"
46797-46897 can: bit: "1"
46897-46997 can: bit: "0"
46997-47097 can: bit: "0"
47097-47197 can: bit: "1"
47197-47297 can: bit: "0"
47297-47397 can: bit: "0"
47397-47497 can: bit: "1"
47497-47597 can: bit: "1"
47597-47697 can: bit: "0"
47697-47797 can: bit: "0"
47797-47897 can: bit: "0"
47897-47997 can: bit: "1"
47997-48097 can: bit: "0"
48097-48197 can: bit: "0"
48197-48297 can: bit: "1"
48297-48397 can: bit: "1"
48397-48497 can: bit: "1"
48497-48597 can: bit: "0"
48597-48697 can: bit: "0"
48697-48797 can: bit: "1"
48797-48897 can: bit: "0"
48897-48997 can: bit: "1"
48997-49097 can: bit: "0"
49097-49197 can: bit: "0"
49197-49297 can: bit: "0"
49297-49397 can: bit: "0"
49397-49497 can: bit: "0"
49497-49597 can: stuff-bit: "1"
49597-49697 can: bit: "1"
49697-49797 can: bit: "0"
49797-49897 can: bit: "1"
49897-49997 can: bit: "0"
49997-50097 can: bit: "0"
50097-50197 can: bit: "1"
50197-50297 can: bit: "0"
50297-50397 can: bit: "0"
50397-50497 can: bit: "1"
50497-50597 can: bit: "0"
50597-50697 can: bit: "1"
50697-50797 can: bit: "0"
50797-50897 can: bit: "1"
50897-50997 can: bit: "0"
50997-51097 can: bit: "0"
51097-51197 can: bit: "0"
51197-51297 can: bit: "1"
51297-51397 can: bit: "0"
51397-51497 can: bit: "1"
51497-51597 can: bit: "0"
51597-51697 can: bit: "1"
51697-51797 can: bit: "1"
51797-51897 can: bit: "0"
51897-51997 can: bit: "0"
51997-52097 can: bit: "1"
52097-52197 can: bit: "0"
52197-52297 can: bit: "1"
52297-52397 can: bit: "1"
52397-52497 can: bit: "0"
52497-52597 can: bit: "0"
52597-52697 can: bit: "0"
52697-52797 can: bit: "0"
52797-52897 can: bit: "1"
52898-52998 can: bit: "0"
52998-53098 can: bit: "1"
53098-53198 can: bit: "1"
53198-53298 can: bit: "0"
53298-53398 can: bit: "1"
53398-53498 can: bit: "0"
53498-53598 can: bit: "0"
53598-53698 can: bit: "1"
53698-53798 can: bit: "0"
53798-53898 can: bit: "1"
53898-53998 can: bit: "1"
53998-54098 can: bit: "1"
54098-54198 can: bit: "0"
54198-54298 can: bit: "0"
54298-54398 can: bit: "0"
54398-54498 can: bit: "1"
54498-54598 can: bit: "0"
54598-54698 can: bit: "1"
54698-54798 can: bit: "1"
54798-54898 can: bit: "1"
54898-54998 can: bit: "1"
54998-55098 can: bit: "0"
55098-55198 can: bit: "0"
55198-55298 can: bit: "1"
55298-55398 can: bit: "1"
55398-55498 can: bit: "0"
55498-55598 can: bit: "0"
55598-55698 can: bit: "0"
55698-55798 can: bit: "0"
55798-55898 can: bit: "0"
55898-55998 can: stuff-bit: "1"
55998-56098 can: bit: "0"
56098-56198 can: bit: "1"
56198-56298 can: bit: "1"
56298-56398 can: bit: "0"
56398-56498 can: bit: "0"
56498-56598 can: bit: "0"
56598-56698 can: bit: "1"
56698-56798 can: bit: "0"
56798-56898 can: bit: "0"
56898-56998 can: bit: "1"
56998-57098 can: bit: "1"
57098-57198 can: bit: "0"
57198-57298 can: bit: "0"
57298-57398 can: bit: "1"
57398-57498 can: bit: "0"
57498-57598 can: bit: "0"
57598-57698 can: bit: "0"
57698-57798 can: bit: "1"
57798-57898 can: bit: "1"
57898-57998 can: bit: "0"
57998-58098 can: bit: "0"
58098-58198 can: bit: "1"
58198-58298 can: bit: "1"
58298-58398 can: bit: "0"
58398-58498 can: bit: "0"
58498-58598 can: bit: "1"
58598-58698 can: bit: "1"
58698-58798 can: bit: "0"
58798-58898 can: bit: "1"
58898-58998 can: bit: "0"
58998-59098 can: bit: "0"
59098-59198 can: bit: "0"
59198-59298 can: bit: "0"
59298-59398 can: bit: "1"
59398-59498 can: bit: "1"
59498-59598 can: bit: "0"
59598-59698 can: bit: "1"
59698-59798 can: bit: "0"
59798-59898 can: bit: "1"
59898-59998 can: bit: "0"
59998-60098 can: bit: "0"
60098-60198 can: bit: "1"
60198-60298 can: bit: "1"
60298-60398 can: bit: "0"
60398-60498 can: bit: "1"
60498-60598 can: bit: "1"
60599-60699 can: bit: "0"
60699-60799 can: bit: "0"
60799-60899 can: bit: "0"
60899-60999 can: bit: "1"
60999-61099 can: bit: "1"
61099-61199 can: bit: "0"
61199-61299 can: bit: "1"
61299-61399 can: bit: "1"
61399-61499 can: bit: "1"
61499-61599 can: bit: "0"
61599-61699 can: bit: "0"
61699-61799 can: bit: "1"
61799-61899 can: bit: "1"
61899-61999 can: bit: "1"
61999-62099 can: bit: "0"
62099-62199 can: bit: "0"
62199-62299 can: bit: "0"
62299-62399 can: bit: "0"
62399-62499 can: bit: "0"
62499-62599 can: stuff-bit: "1"
62599-62699 can: bit: "1"
62699-62799 can: bit: "1"
62799-62899 can: bit: "1"
62899-62999 can: bit: "0"
62999-63099 can: bit: "0"
63099-63199 can: bit: "1"
63199-63299 can: bit: "0"
63299-63399 can: bit: "0"
63399-63499 can: bit: "1"
63499-63599 can: bit: "1"
63599-63699 can: bit: "1"
63699-63799 can: bit: "0"
63799-63899 can: bit: "1"
63899-63999 can: bit: "0"
63999-64099 can: bit: "0"
64099-64199 can: bit: "0"
64199-64299 can: bit: "1"
64299-64399 can: bit: "1"
64399-64499 can: bit: "1"
64499-64599 can: bit: "0"
64599-64699 can: bit: "1"
64699-64799 can: bit: "1"
64799-64899 can: bit: "0"
64899-64999 can: bit: "0"
64999-65099 can: bit: "1"
65099-65199 can: bit: "1"
65199-65299 can: bit: "1"
65299-65399 can: bit: "1"
65399-65499 can: bit: "0"
65499-65599 can: bit: "0"
65599-65699 can: bit: "0"
65699-65799 can: bit: "0"
65799-65899 can: bit: "1"
65899-65999 can: bit: "1"
65999-66099 can: bit: "1"
66099-66199 can: bit: "1"
66199-66299 can: bit: "0"
66299-66399 can: bit: "1"
66399-66499 can: bit: "0"
66499-66599 can: bit: "0"
66599-66699 can: bit: "1"
66699-66799 can: bit: "1"
66799-66899 can: bit: "1"
66899-66999 can: bit: "1"
66999-67099 can: bit: "1"
67099-67199 can: stuff-bit: "0"
67199-67299 can: bit: "0"
67299-67399 can: bit: "0"
67399-67499 can: bit: "0"
67499-67599 can: bit: "1"
67599-67699 can: bit: "1"
67699-67799 can: bit: "1"
67799-67899 can: bit: "1"
67899-67999 can: bit: "1"
67999-68099 can: stuff-bit: "0"
68099-68199 can: bit: "1"
14492-15392 can: data: "Data byte 0: 0x00" "DB 0: 0x00" "DB"
15392-16393 can: data: "Data byte 1: 0x01" "DB 1: 0x01" "DB"
16393-17293 can: data: "Data byte 2: 0x02" "DB 2: 0x02" "DB"
17293-18193 can: data: "Data byte 3: 0x03" "DB 3: 0x03" "DB"
18193-19093 can: data: "Data byte 4: 0x04" "DB 4: 0x04" "DB"
19093-19993 can: data: "Data byte 5: 0x05" "DB 5: 0x05" "DB"
19993-20893 can: data: "Data byte 6: 0x06" "DB 6: 0x06" "DB"
20893-21793 can: data: "Data byte 7: 0x07" "DB 7: 0x07" "DB"
21793-22593 can: data: "Data byte 8: 0x08" "DB 8: 0x08" "DB"
22593-23494 can: data: "Data byte 9: 0x09" "DB 9: 0x09" "DB"
23494-24294 can: data: "Data byte 10: 0x0a" "DB 10: 0x0a" "DB"
24294-25194 can: data: "Data byte 11: 0x0b" "DB 11: 0x0b" "DB"
25194-25994 can: data: "Data byte 12: 0x0c" "DB 12: 0x0c" "DB"
25994-26894 can: data: "Data byte 13: 0x0d" "DB 13: 0x0d" "DB"
26894-27694 can: data: "Data byte 14: 0x0e" "DB 14: 0x0e" "DB"
27694-28594 can: data: "Data byte 15: 0x0f" "DB 15: 0x0f" "DB"
28694-29494 can: data: "Data byte 16: 0x10" "DB 16: 0x10" "DB"
29494-30394 can: data: "Data byte 17: 0x11" "DB 17: 0x11" "DB"
30395-31195 can: data: "Data byte 18: 0x12" "DB 18: 0x12" "DB"
31195-31995 can: data: "Data byte 19: 0x13" "DB 19: 0x13" "DB"
31995-32795 can: data: "Data byte 20: 0x14" "DB 20: 0x14" "DB"
32795-33695 can: data: "Data byte 21: 0x15" "DB 21: 0x15" "DB"
33695-34495 can: data: "Data byte 22: 0x16" "DB 22: 0x16" "DB"
34495-35295 can: data: "Data byte 23: 0x17" "DB 23: 0x17" "DB"
35295-36095 can: data: "Data byte 24: 0x18" "DB 24: 0x18" "DB"
36095-36995 can: data: "Data byte 25: 0x19" "DB 25: 0x19" "DB"
36995-37795 can: data: "Data byte 26: 0x1a" "DB 26: 0x1a" "DB"
37795-38596 can: data: "Data byte 27: 0x1b" "DB 27: 0x1b" "DB"
38596-39396 can: data: "Data byte 28: 0x1c" "DB 28: 0x1c" "DB"
39396-40296 can: data: "Data byte 29: 0x1d" "DB 29: 0x1d" "DB"
40296-41096 can: data: "Data byte 30: 0x1e" "DB 30: 0x1e" "DB"
41096-41896 can: data: "Data byte 31: 0x1f" "DB 31: 0x1f" "DB"
41996-42796 can: data: "Data byte 32: 0x20" "DB 32: 0x20" "DB"
42896-43696 can: data: "Data byte 33: 0x21" "DB 33: 0x21" "DB"
43696-44496 can: data: "Data byte 34: 0x22" "DB 34: 0x22" "DB"
44496-45296 can: data: "Data byte 35: 0x23" "DB 35: 0x23" "DB"
45297-46097 can: data: "Data byte 36: 0x24" "DB 36: 0x24" "DB"
46097-46897 can: data: "Data byte 37: 0x25" "DB 37: 0x25" "DB"
46897-47697 can: data: "Data byte 38: 0x26" "DB 38: 0x26" "DB"
47697-48497 can: data: "Data byte 39: 0x27" "DB 39: 0x27" "DB"
48497-49297 can: data: "Data byte 40: 0x28" "DB 40: 0x28" "DB"
49297-50197 can: data: "Data byte 41: 0x29" "DB 41: 0x29" "DB"
50197-50997 can: data: "Data byte 42: 0x2a" "DB 42: 0x2a" "DB"
50997-51797 can: data: "Data byte 43: 0x2b" "DB 43: 0x2b" "DB"
51797-52597 can: data: "Data byte 44: 0x2c" "DB 44: 0x2c" "DB"
52597-53398 can: data: "Data byte 45: 0x2d" "DB 45: 0x2d" "DB"
53398-54198 can: data: "Data byte 46: 0x2e" "DB 46: 0x2e" "DB"
54198-54998 can: data: "Data byte 47: 0x2f" "DB 47: 0x2f" "DB"
54998-55798 can: data: "Data byte 48: 0x30" "DB 48: 0x30" "DB"
55798-56698 can: data: "Data byte 49: 0x31" "DB 49: 0x31" "DB"
56698-57498 can: data: "Data byte 50: 0x32" "DB 50: 0x32" "DB"
57498-58298 can: data: "Data byte 51: 0x33" "DB 51: 0x33" "DB"
58298-59098 can: data: "Data byte 52: 0x34" "DB 52: 0x34" "DB"
59098-59898 can: data: "Data byte 53: 0x35" "DB 53: 0x35" "DB"
59898-60699 can: data: "Data byte 54: 0x36" "DB 54: 0x36" "DB"
60699-61499 can: data: "Data byte 55: 0x37" "DB 55: 0x37" "DB"
61499-62299 can: data: "Data byte 56: 0x38" "DB 56: 0x38" "DB"
62299-63199 can: data: "Data byte 57: 0x39" "DB 57: 0x39" "DB"
63199-63999 can: data: "Data byte 58: 0x3a" "DB 58: 0x3a" "DB"
63999-64799 can: data: "Data byte 59: 0x3b" "DB 59: 0x3b" "DB"
64799-65599 can: data: "Data byte 60: 0x3c" "DB 60: 0x3c" "DB"
65599-66399 can: data: "Data byte 61: 0x3d" "DB 61: 0x3d" "DB"
66399-67299 can: data: "Data byte 62: 0x3e" "DB 62: 0x3e" "DB"
67299-68199 can: data: "Data byte 63: 0x3f" "DB 63: 0x3f" "DB"
68199-68299 can: bit: "0"
68299-68399 can: bit: "1"
68399-68499 can: bit: "1"
68499-68599 can: bit: "1"
68599-68699 can: bit: "1"
68700-68800 can: bit: "0"
68800-68900 can: bit: "1"
68900-69000 can: bit: "1"
69000-69100 can: bit: "0"
69100-69200 can: bit: "1"
69200-69300 can: bit: "0"
69300-69400 can: bit: "1"
69400-69500 can: bit: "1"
69500-69600 can: bit: "1"
69600-69700 can: bit: "0"
69700-69800 can: bit: "1"
69800-69900 can: bit: "0"
69900-70000 can: bit: "0"
70000-70100 can: bit: "1"
70100-70200 can: bit: "1"
70200-70300 can: bit: "0"
70300-70400 can: bit: "1"
70400-70500 can: bit: "0"
70500-70600 can: bit: "1"
70600-70700 can: bit: "1"
70700-70800 can: bit: "0"
70800-70900 can: bit: "0"
70900-71000 can: bit: "1"
71000-71100 can: bit: "1"
71100-71200 can: bit: "1"
71200-71300 can: bit: "0"
71300-71400 can: bit: "1"
68199-71400 can: crc-sequence: "CRC-21 sequence: 0x7b5d359d" "CRC-21: 0x7b5d359d" "CRC-21"
71400-71500 can: bit: "1"
71400-71500 can: crc-delimiter: "CRC delimiter: 1" "CRC d: 1" "CRC d"
71506-71606 can: bit: "0"
71506-71606 can: ack-slot: "ACK slot: ACK" "ACK s: ACK" "ACK s"
71606-71706 can: bit: "1"
71606-71706 can: ack-delimiter: "ACK delimiter: 1" "ACK d: 1" "ACK d"
71706-71806 can: bit: "1"
71806-71906 can: bit: "1"
71906-72006 can: bit: "1"
72006-72106 can: bit: "1"
72106-72206 can: bit: "1"
72206-72306 can: bit: "1"
72306-72406 can: bit: "1"
71706-72406 can: eof: "End of frame" "EOF" "E"
