2040-2140 can: bit: "0"
2040-2140 can: sof: "Start of frame" "SOF" "S"
2140-2240 can: bit: "0"
2240-2340 can: bit: "0"
2340-2440 can: bit: "0"
2440-2540 can: bit: "0"
2540-2640 can: stuff-bit: "1"
2640-2740 can: bit: "0"
2740-2840 can: bit: "0"
2840-2940 can: bit: "0"
2940-3040 can: bit: "0"
3040-3140 can: bit: "0"
3140-3240 can: stuff-bit: "1"
3240-3340 can: bit: "0"
3340-3440 can: bit: "0"
2140-3440 can: id: "Identifier: 0 (0x0)" "ID: 0 (0x0)" "ID"
3440-3540 can: bit: "1"
3540-3640 can: bit: "1"
3540-3640 can: ide: "Identifier extension bit: extended frame" "IDE: extended frame" "IDE"
3640-3740 can: bit: "0"
3740-3840 can: bit: "0"
3840-3940 can: bit: "0"
3940-4040 can: bit: "0"
4040-4140 can: bit: "0"
4140-4240 can: stuff-bit: "1"
4240-4340 can: bit: "0"
4340-4440 can: bit: "0"
4440-4540 can: bit: "0"
4540-4640 can: bit: "0"
4640-4740 can: bit: "0"
4740-4840 can: stuff-bit: "1"
4840-4940 can: bit: "0"
4940-5040 can: bit: "1"
5040-5140 can: bit: "0"
5140-5240 can: bit: "0"
5240-5340 can: bit: "0"
5340-5440 can: bit: "0"
5440-5540 can: bit: "1"
5540-5640 can: bit: "0"
3640-5640 can: ext-id: "Extended Identifier: 66 (0x42)" "Extended ID: 66 (0x42)" "Extended ID" "EID"
3640-5640 can: full-id: "Full Identifier: 66 (0x42)" "Full ID: 66 (0x42)" "Full ID" "FID"
3440-3540 can: srr: "Substitute remote request: 1" "SRR: 1" "SRR"
5640-5740 can: bit: "0"
5640-5740 can: rtr: "Remote transmission request: data frame" "RTR: data frame" "RTR"
5740-5840 can: bit: "1"
5740-5840 can: reserved-bit: "Flexible data format: 1" "FDF: 1" "FDF"
5640-5740 can: reserved-bit: "Reserved bit 1: 0" "RB1: 0" "RB1"
5840-5940 can: bit: "0"
5840-5940 can: reserved-bit: "Reserved bit 0: 0" "RB0: 0" "RB0"
5940-6040 can: bit: "0"
5940-6040 can: reserved-bit: "Bit rate switch: 0" "BRS: 0" "BRS"
6040-6140 can: bit: "0"
6040-6140 can: reserved-bit: "Error state indicator: 0" "ESI: 0" "ESI"
6140-6240 can: bit: "1"
6240-6340 can: bit: "0"
6340-6440 can: bit: "0"
6440-6540 can: bit: "0"
6140-6540 can: dlc: "Data length code: 8" "DLC: 8" "DLC"
6540-6640 can: bit: "0"
6640-6740 can: bit: "0"
6740-6840 can: stuff-bit: "1"
6841-6941 can: bit: "0"
6941-7041 can: bit: "0"
7041-7141 can: bit: "0"
7141-7241 can: bit: "0"
7241-7341 can: bit: "0"
7341-7441 can: stuff-bit: "1"
7441-7541 can: bit: "0"
7541-7641 can: bit: "0"
7641-7741 can: bit: "0"
7741-7841 can: bit: "0"
7841-7941 can: bit: "0"
7941-8041 can: stuff-bit: "1"
8041-8141 can: bit: "0"
8141-8241 can: bit: "0"
8241-8341 can: bit: "0"
8341-8441 can: bit: "1"
8441-8541 can: bit: "0"
8541-8641 can: bit: "0"
8641-8741 can: bit: "0"
8741-8841 can: bit: "0"
8841-8941 can: bit: "0"
8941-9041 can: stuff-bit: "1"
9041-9141 can: bit: "0"
9141-9241 can: bit: "1"
9241-9341 can: bit: "0"
9341-9441 can: bit: "0"
9441-9541 can: bit: "0"
9541-9641 can: bit: "0"
9641-9741 can: bit: "0"
9741-9841 can: stuff-bit: "1"
9841-9941 can: bit: "0"
9941-10041 can: bit: "0"
10041-10141 can: bit: "1"
10141-10241 can: bit: "1"
10241-10341 can: bit: "0"
10341-10441 can: bit: "0"
10441-10541 can: bit: "0"
10541-10641 can: bit: "0"
10641-10741 can: bit: "0"
10741-10841 can: stuff-bit: "1"
10841-10941 can: bit: "1"
10941-11041 can: bit: "0"
11041-11141 can: bit: "0"
11141-11241 can: bit: "0"
11241-11341 can: bit: "0"
11341-11441 can: bit: "0"
11441-11541 can: stuff-bit: "1"
11541-11641 can: bit: "0"
11641-11741 can: bit: "0"
11741-11841 can: bit: "1"
11841-11941 can: bit: "0"
11941-12041 can: bit: "1"
12041-12141 can: bit: "0"
12141-12241 can: bit: "0"
12241-12341 can: bit: "0"
12341-12441 can: bit: "0"
12441-12541 can: bit: "0"
12541-12641 can: stuff-bit: "1"
12641-12741 can: bit: "1"
12741-12841 can: bit: "1"
12841-12941 can: bit: "0"
12941-13041 can: bit: "0"
13041-13141 can: bit: "0"
13141-13241 can: bit: "0"
13241-13341 can: bit: "0"
13341-13441 can: stuff-bit: "1"
13441-13541 can: bit: "0"
13541-13641 can: bit: "1"
13641-13741 can: bit: "1"
13741-13841 can: bit: "1"
6540-7541 can: data: "Data byte 0: 0x00" "DB 0: 0x00" "DB"
7541-8441 can: data: "Data byte 1: 0x01" "DB 1: 0x01" "DB"
8441-9341 can: data: "Data byte 2: 0x02" "DB 2: 0x02" "DB"
9341-10241 can: data: "Data byte 3: 0x03" "DB 3: 0x03" "DB"
10241-11141 can: data: "Data byte 4: 0x04" "DB 4: 0x04" "DB"
11141-12041 can: data: "Data byte 5: 0x05" "DB 5: 0x05" "DB"
12041-12941 can: data: "Data byte 6: 0x06" "DB 6: 0x06" "DB"
12941-13841 can: data: "Data byte 7: 0x07" "DB 7: 0x07" "DB"
13841-13941 can: bit: "0"
13941-14041 can: bit: "1"
14041-14141 can: bit: "1"
14141-14241 can: bit: "1"
14241-14341 can: bit: "1"
14341-14441 can: bit: "0"
14441-14541 can: bit: "0"
14541-14641 can: bit: "0"
14641-14741 can: bit: "0"
14741-14841 can: bit: "1"
14842-14942 can: bit: "0"
14942-15042 can: bit: "0"
15042-15142 can: bit: "1"
15142-15242 can: bit: "1"
15242-15342 can: bit: "0"
15342-15442 can: bit: "1"
15442-15542 can: bit: "1"
15542-15642 can: bit: "1"
15642-15742 can: bit: "0"
15742-15842 can: bit: "0"
15842-15942 can: bit: "1"
15942-16042 can: bit: "0"
16042-16142 can: bit: "1"
16142-16242 can: bit: "0"
16242-16342 can: bit: "1"
16342-16442 can: bit: "0"
16442-16542 can: bit: "1"
13841-16542 can: crc-sequence: "CRC-17 sequence: 0x3c26e55" "CRC-17: 0x3c26e55" "CRC-17"
16542-16642 can: bit: "1"
16542-16642 can: crc-delimiter: "CRC delimiter: 1" "CRC d: 1" "CRC d"
16648-16748 can: bit: "0"
16648-16748 can: ack-slot: "ACK slot: ACK" "ACK s: ACK" "ACK s"
16748-16848 can: bit: "1"
16748-16848 can: ack-delimiter: "ACK delimiter: 1" "ACK d: 1" "ACK d"
16848-16948 can: bit: "1"
16948-17048 can: bit: "1"
17048-17148 can: bit: "1"
17148-17248 can: bit: "1"
17248-17348 can: bit: "1"
17348-17448 can: bit: "1"
17448-17548 can: bit: "1"
16848-17548 can: eof: "End of frame" "EOF" "E"
