4007-4107 can: bit: "0"
4007-4107 can: sof: "Start of frame" "SOF" "S"
4107-4207 can: bit: "0"
4207-4307 can: bit: "0"
4307-4407 can: bit: "0"
4407-4507 can: bit: "0"
4507-4607 can: stuff-bit: "1"
4607-4707 can: bit: "1"
4707-4807 can: bit: "0"
4807-4907 can: bit: "0"
4907-5007 can: bit: "0"
5007-5107 can: bit: "0"
5107-5207 can: bit: "1"
5207-5307 can: bit: "0"
4107-5307 can: id: "Identifier: 66 (0x42)" "ID: 66 (0x42)" "ID"
5307-5407 can: bit: "0"
5407-5507 can: bit: "0"
5407-5507 can: ide: "Identifier extension bit: standard frame" "IDE: standard frame" "IDE"
5507-5607 can: bit: "1"
5507-5607 can: reserved-bit: "Flexible data format: 1" "FDF: 1" "FDF"
5307-5407 can: rtr: "Substitute remote request" "SRR"
5607-5707 can: bit: "0"
5607-5707 can: reserved-bit: "Reserved: 0" "R0: 0" "R0"
5707-5807 can: bit: "0"
5707-5807 can: reserved-bit: "Bit rate switch: 0" "BRS: 0" "BRS"
5807-5907 can: bit: "0"
5807-5907 can: reserved-bit: "Error state indicator: 0" "ESI: 0" "ESI"
5907-6007 can: bit: "1"
6007-6107 can: bit: "0"
6107-6207 can: bit: "0"
6207-6307 can: bit: "0"
5907-6307 can: dlc: "Data length code: 8" "DLC: 8" "DLC"
6307-6407 can: bit: "0"
6407-6507 can: bit: "0"
6507-6607 can: stuff-bit: "1"
6608-6708 can: bit: "0"
6708-6808 can: bit: "0"
6808-6908 can: bit: "0"
6908-7008 can: bit: "0"
7008-7108 can: bit: "0"
7108-7208 can: stuff-bit: "1"
7208-7308 can: bit: "0"
7308-7408 can: bit: "0"
7408-7508 can: bit: "0"
7508-7608 can: bit: "0"
7608-7708 can: bit: "0"
7708-7808 can: stuff-bit: "1"
7808-7908 can: bit: "0"
7908-8008 can: bit: "0"
8008-8108 can: bit: "0"
8108-8208 can: bit: "1"
8208-8308 can: bit: "0"
8308-8408 can: bit: "0"
8408-8508 can: bit: "0"
8508-8608 can: bit: "0"
8608-8708 can: bit: "0"
8708-8808 can: stuff-bit: "1"
8808-8908 can: bit: "0"
8908-9008 can: bit: "1"
9008-9108 can: bit: "0"
9108-9208 can: bit: "0"
9208-9308 can: bit: "0"
9308-9408 can: bit: "0"
9408-9508 can: bit: "0"
9508-9608 can: stuff-bit: "1"
9608-9708 can: bit: "0"
9708-9808 can: bit: "0"
9808-9908 can: bit: "1"
9908-10008 can: bit: "1"
10008-10108 can: bit: "0"
10108-10208 can: bit: "0"
10208-10308 can: bit: "0"
10308-10408 can: bit: "0"
10408-10508 can: bit: "0"
10508-10608 can: stuff-bit: "1"
10608-10708 can: bit: "1"
10708-10808 can: bit: "0"
10808-10908 can: bit: "0"
10908-11008 can: bit: "0"
11008-11108 can: bit: "0"
11108-11208 can: bit: "0"
11208-11308 can: stuff-bit: "1"
11308-11408 can: bit: "0"
11408-11508 can: bit: "0"
11508-11608 can: bit: "1"
11608-11708 can: bit: "0"
11708-11808 can: bit: "1"
11808-11908 can: bit: "0"
11908-12008 can: bit: "0"
12008-12108 can: bit: "0"
12108-12208 can: bit: "0"
12208-12308 can: bit: "0"
12308-12408 can: stuff-bit: "1"
12408-12508 can: bit: "1"
12508-12608 can: bit: "1"
12608-12708 can: bit: "0"
12708-12808 can: bit: "0"
12808-12908 can: bit: "0"
12908-13008 can: bit: "0"
13008-13108 can: bit: "0"
13108-13208 can: stuff-bit: "1"
13208-13308 can: bit: "0"
13308-13408 can: bit: "1"
13408-13508 can: bit: "1"
13508-13608 can: bit: "1"
6307-7308 can: data: "Data byte 0: 0x00" "DB 0: 0x00" "DB"
7308-8208 can: data: "Data byte 1: 0x01" "DB 1: 0x01" "DB"
8208-9108 can: data: "Data byte 2: 0x02" "DB 2: 0x02" "DB"
9108-10008 can: data: "Data byte 3: 0x03" "DB 3: 0x03" "DB"
10008-10908 can: data: "Data byte 4: 0x04" "DB 4: 0x04" "DB"
10908-11808 can: data: "Data byte 5: 0x05" "DB 5: 0x05" "DB"
11808-12708 can: data: "Data byte 6: 0x06" "DB 6: 0x06" "DB"
12708-13608 can: data: "Data byte 7: 0x07" "DB 7: 0x07" "DB"
13608-13708 can: bit: "0"
13708-13808 can: bit: "0"
13808-13908 can: bit: "1"
13908-14008 can: bit: "1"
14008-14108 can: bit: "0"
14108-14208 can: bit: "1"
14208-14308 can: bit: "0"
14308-14408 can: bit: "1"
14408-14508 can: bit: "0"
14508-14608 can: bit: "1"
14608-14708 can: bit: "0"
14708-14808 can: bit: "1"
14809-14909 can: bit: "0"
14909-15009 can: bit: "1"
15009-15109 can: bit: "0"
15109-15209 can: bit: "1"
15209-15309 can: bit: "1"
15309-15409 can: bit: "1"
15409-15509 can: bit: "0"
15509-15609 can: bit: "0"
15609-15709 can: bit: "1"
15709-15809 can: bit: "1"
15809-15909 can: bit: "1"
15909-16009 can: bit: "0"
16009-16109 can: bit: "1"
16109-16209 can: bit: "0"
16209-16309 can: bit: "0"
13608-16309 can: crc-sequence: "CRC-17 sequence: 0x1aaae74" "CRC-17: 0x1aaae74" "CRC-17"
16309-16409 can: bit: "1"
16309-16409 can: crc-delimiter: "CRC delimiter: 1" "CRC d: 1" "CRC d"
16419-16519 can: bit: "0"
16419-16519 can: ack-slot: "ACK slot: ACK" "ACK s: ACK" "ACK s"
16519-16619 can: bit: "1"
16519-16619 can: ack-delimiter: "ACK delimiter: 1" "ACK d: 1" "ACK d"
16619-16719 can: bit: "1"
16719-16819 can: bit: "1"
16819-16919 can: bit: "1"
16919-17019 can: bit: "1"
17019-17119 can: bit: "1"
17119-17219 can: bit: "1"
17219-17319 can: bit: "1"
16619-17319 can: eof: "End of frame" "EOF" "E"
