2063052-2063083 can: bits: "0"
2063052-2063083 can: sof: "Start of frame" "SOF" "S"
2063084-2063115 can: bits: "1"
2063116-2063147 can: bits: "0"
2063148-2063179 can: bits: "0"
2063180-2063211 can: bits: "0"
2063212-2063243 can: bits: "1"
2063244-2063275 can: bits: "0"
2063276-2063307 can: bits: "0"
2063308-2063339 can: bits: "1"
2063340-2063371 can: bits: "0"
2063372-2063403 can: bits: "0"
2063404-2063435 can: bits: "0"
2063084-2063435 can: id: "Identifier: 1096 (0x448)" "ID: 1096 (0x448)" "ID"
2063436-2063467 can: bits: "1"
2063468-2063499 can: bits: "1"
2063468-2063499 can: ide: "Identifier extension bit: extended frame" "IDE: extended frame" "IDE"
2063500-2063531 can: bits: "1"
2063532-2063563 can: bits: "0"
2063564-2063595 can: bits: "0"
2063596-2063627 can: bits: "0"
2063628-2063659 can: bits: "1"
2063660-2063691 can: bits: "1"
2063692-2063723 can: bits: "0"
2063724-2063755 can: bits: "0"
2063756-2063787 can: bits: "1"
2063788-2063819 can: bits: "1"
2063820-2063851 can: bits: "0"
2063852-2063883 can: bits: "1"
2063884-2063915 can: bits: "0"
2063916-2063947 can: bits: "0"
2063948-2063979 can: bits: "0"
2063980-2064011 can: bits: "1"
2064012-2064043 can: bits: "0"
2064044-2064075 can: bits: "0"
2063500-2064075 can: ext-id: "Extended Identifier: 144196 (0x23344)" "Extended ID: 144196 (0x23344)" "Extended ID" "EID"
2063500-2064075 can: full-id: "Full Identifier: 287454020 (0x11223344)" "Full ID: 287454020 (0x11223344)" "Full ID" "FID"
2063436-2063467 can: srr: "Substitute remote request: 1" "SRR: 1" "SRR"
2064076-2064107 can: bits: "0"
2064076-2064107 can: rtr: "Remote transmission request: data frame" "RTR: data frame" "RTR"
2064108-2064139 can: bits: "0"
2064108-2064139 can: reserved-bit: "Reserved bit 1: 0" "RB1: 0" "RB1"
2064140-2064171 can: bits: "0"
2064140-2064171 can: reserved-bit: "Reserved bit 0: 0" "RB0: 0" "RB0"
2064172-2064203 can: bits: "1"
2064172-2064203 can: stuff-bit: "Stuff bit: 1" "SB: 1" "SB"
2064204-2064235 can: bits: "0"
2064236-2064267 can: bits: "1"
2064268-2064299 can: bits: "1"
2064300-2064331 can: bits: "1"
2064204-2064331 can: dlc: "Data length code: 7" "DLC: 7" "DLC"
2064332-2064363 can: bits: "0"
2064364-2064395 can: bits: "0"
2064396-2064427 can: bits: "0"
2064428-2064459 can: bits: "0"
2064460-2064491 can: bits: "0"
2064492-2064523 can: bits: "1"
2064492-2064523 can: stuff-bit: "Stuff bit: 1" "SB: 1" "SB"
2064524-2064555 can: bits: "0"
2064556-2064587 can: bits: "0"
2064588-2064619 can: bits: "0"
2064620-2064651 can: bits: "0"
2064652-2064683 can: bits: "0"
2064684-2064715 can: bits: "1"
2064684-2064715 can: stuff-bit: "Stuff bit: 1" "SB: 1" "SB"
2064716-2064747 can: bits: "0"
2064748-2064779 can: bits: "1"
2064780-2064811 can: bits: "0"
2064812-2064843 can: bits: "0"
2064844-2064875 can: bits: "0"
2064876-2064907 can: bits: "1"
2064908-2064939 can: bits: "0"
2064940-2064971 can: bits: "0"
2064972-2065003 can: bits: "1"
2065004-2065035 can: bits: "0"
2065036-2065067 can: bits: "0"
2065068-2065099 can: bits: "0"
2065100-2065131 can: bits: "1"
2065132-2065163 can: bits: "0"
2065164-2065195 can: bits: "0"
2065196-2065227 can: bits: "0"
2065228-2065259 can: bits: "1"
2065260-2065291 can: bits: "1"
2065292-2065323 can: bits: "0"
2065324-2065355 can: bits: "0"
2065356-2065387 can: bits: "1"
2065388-2065419 can: bits: "1"
2065420-2065451 can: bits: "0"
2065452-2065483 can: bits: "1"
2065484-2065515 can: bits: "0"
2065516-2065547 can: bits: "0"
2065548-2065579 can: bits: "0"
2065580-2065611 can: bits: "1"
2065612-2065643 can: bits: "0"
2065644-2065675 can: bits: "0"
2065676-2065707 can: bits: "0"
2065708-2065739 can: bits: "1"
2065740-2065771 can: bits: "0"
2065772-2065803 can: bits: "1"
2065804-2065835 can: bits: "0"
2065836-2065867 can: bits: "1"
2065868-2065899 can: bits: "0"
2065900-2065931 can: bits: "1"
2065932-2065963 can: bits: "0"
2065964-2065995 can: bits: "1"
2065996-2066027 can: bits: "1"
2066028-2066059 can: bits: "0"
2066060-2066091 can: bits: "0"
2066092-2066123 can: bits: "1"
2066124-2066155 can: bits: "1"
2066156-2066187 can: bits: "0"
2064332-2064619 can: data: "Data byte 0: 0x00" "DB 0: 0x00" "DB"
2064620-2064907 can: data: "Data byte 1: 0x11" "DB 1: 0x11" "DB"
2064908-2065163 can: data: "Data byte 2: 0x22" "DB 2: 0x22" "DB"
2065164-2065419 can: data: "Data byte 3: 0x33" "DB 3: 0x33" "DB"
2065420-2065675 can: data: "Data byte 4: 0x44" "DB 4: 0x44" "DB"
2065676-2065931 can: data: "Data byte 5: 0x55" "DB 5: 0x55" "DB"
2065932-2066187 can: data: "Data byte 6: 0x66" "DB 6: 0x66" "DB"
2066188-2066219 can: bits: "0"
2066220-2066251 can: bits: "0"
2066252-2066283 can: bits: "0"
2066284-2066315 can: bits: "1"
2066316-2066347 can: bits: "1"
2066348-2066379 can: bits: "0"
2066380-2066411 can: bits: "1"
2066412-2066443 can: bits: "0"
2066444-2066475 can: bits: "0"
2066476-2066507 can: bits: "1"
2066508-2066539 can: bits: "1"
2066540-2066571 can: bits: "0"
2066572-2066603 can: bits: "0"
2066604-2066635 can: bits: "0"
2066636-2066667 can: bits: "0"
2066188-2066667 can: crc-sequence: "CRC sequence: 0x0d30" "CRC: 0x0d30" "CRC"
2066668-2066699 can: bits: "1"
2066668-2066699 can: crc-delimiter: "CRC delimiter: 1" "CRC d: 1" "CRC d"
2066700-2066731 can: bits: "0"
2066700-2066731 can: ack-slot: "ACK slot: ACK" "ACK s: ACK" "ACK s"
2066732-2066763 can: bits: "1"
2066732-2066763 can: ack-delimiter: "ACK delimiter: 1" "ACK d: 1" "ACK d"
2066764-2066795 can: bits: "1"
2066796-2066827 can: bits: "1"
2066828-2066859 can: bits: "1"
2066860-2066891 can: bits: "1"
2066892-2066923 can: bits: "1"
2066924-2066955 can: bits: "1"
2066956-2066987 can: bits: "1"
2066764-2066987 can: eof: "End of frame" "EOF" "E"
4239978-4240009 can: bits: "0"
4239978-4240009 can: sof: "Start of frame" "SOF" "S"
4240010-4240041 can: bits: "1"
4240042-4240073 can: bits: "0"
4240074-4240105 can: bits: "0"
4240106-4240137 can: bits: "0"
4240138-4240169 can: bits: "1"
4240170-4240201 can: bits: "0"
4240202-4240233 can: bits: "0"
4240234-4240265 can: bits: "1"
4240266-4240297 can: bits: "0"
4240298-4240329 can: bits: "0"
4240330-4240361 can: bits: "0"
4240010-4240361 can: id: "Identifier: 1096 (0x448)" "ID: 1096 (0x448)" "ID"
4240362-4240393 can: bits: "1"
4240394-4240425 can: bits: "1"
4240394-4240425 can: ide: "Identifier extension bit: extended frame" "IDE: extended frame" "IDE"
4240426-4240457 can: bits: "1"
4240458-4240489 can: bits: "0"
4240490-4240521 can: bits: "0"
4240522-4240553 can: bits: "0"
4240554-4240585 can: bits: "1"
4240586-4240617 can: bits: "1"
4240618-4240649 can: bits: "0"
4240650-4240681 can: bits: "0"
4240682-4240713 can: bits: "1"
4240714-4240745 can: bits: "1"
4240746-4240777 can: bits: "0"
4240778-4240809 can: bits: "1"
4240810-4240841 can: bits: "0"
4240842-4240873 can: bits: "0"
4240874-4240905 can: bits: "0"
4240906-4240937 can: bits: "1"
4240938-4240969 can: bits: "0"
4240970-4241001 can: bits: "0"
4240426-4241001 can: ext-id: "Extended Identifier: 144196 (0x23344)" "Extended ID: 144196 (0x23344)" "Extended ID" "EID"
4240426-4241001 can: full-id: "Full Identifier: 287454020 (0x11223344)" "Full ID: 287454020 (0x11223344)" "Full ID" "FID"
4240362-4240393 can: srr: "Substitute remote request: 1" "SRR: 1" "SRR"
4241002-4241033 can: bits: "0"
4241002-4241033 can: rtr: "Remote transmission request: data frame" "RTR: data frame" "RTR"
4241034-4241065 can: bits: "0"
4241034-4241065 can: reserved-bit: "Reserved bit 1: 0" "RB1: 0" "RB1"
4241066-4241097 can: bits: "0"
4241066-4241097 can: reserved-bit: "Reserved bit 0: 0" "RB0: 0" "RB0"
4241098-4241129 can: bits: "1"
4241098-4241129 can: stuff-bit: "Stuff bit: 1" "SB: 1" "SB"
4241130-4241161 can: bits: "0"
4241162-4241193 can: bits: "1"
4241194-4241225 can: bits: "1"
4241226-4241257 can: bits: "1"
4241130-4241257 can: dlc: "Data length code: 7" "DLC: 7" "DLC"
4241258-4241289 can: bits: "0"
4241290-4241321 can: bits: "0"
4241322-4241353 can: bits: "0"
4241354-4241385 can: bits: "0"
4241386-4241417 can: bits: "0"
4241418-4241449 can: bits: "1"
4241418-4241449 can: stuff-bit: "Stuff bit: 1" "SB: 1" "SB"
4241450-4241481 can: bits: "0"
4241482-4241513 can: bits: "0"
4241514-4241545 can: bits: "0"
4241546-4241577 can: bits: "0"
4241578-4241609 can: bits: "0"
4241610-4241641 can: bits: "1"
4241610-4241641 can: stuff-bit: "Stuff bit: 1" "SB: 1" "SB"
4241642-4241673 can: bits: "0"
4241674-4241705 can: bits: "1"
4241706-4241737 can: bits: "0"
4241738-4241769 can: bits: "0"
4241770-4241801 can: bits: "0"
4241802-4241833 can: bits: "1"
4241834-4241865 can: bits: "0"
4241866-4241897 can: bits: "0"
4241898-4241929 can: bits: "1"
4241930-4241961 can: bits: "0"
4241962-4241993 can: bits: "0"
4241994-4242025 can: bits: "0"
4242026-4242057 can: bits: "1"
4242058-4242089 can: bits: "0"
4242090-4242121 can: bits: "0"
4242122-4242153 can: bits: "0"
4242154-4242185 can: bits: "1"
4242186-4242217 can: bits: "1"
4242218-4242249 can: bits: "0"
4242250-4242281 can: bits: "0"
4242282-4242313 can: bits: "1"
4242314-4242345 can: bits: "1"
4242346-4242377 can: bits: "0"
4242378-4242409 can: bits: "1"
4242410-4242441 can: bits: "0"
4242442-4242473 can: bits: "0"
4242474-4242505 can: bits: "0"
4242506-4242537 can: bits: "1"
4242538-4242569 can: bits: "0"
4242570-4242601 can: bits: "0"
4242602-4242633 can: bits: "0"
4242634-4242665 can: bits: "1"
4242666-4242697 can: bits: "0"
4242698-4242729 can: bits: "1"
4242730-4242761 can: bits: "0"
4242762-4242793 can: bits: "1"
4242794-4242825 can: bits: "0"
4242826-4242857 can: bits: "1"
4242858-4242889 can: bits: "0"
4242890-4242921 can: bits: "1"
4242922-4242953 can: bits: "1"
4242954-4242985 can: bits: "0"
4242986-4243017 can: bits: "0"
4243018-4243049 can: bits: "1"
4243050-4243081 can: bits: "1"
4243082-4243113 can: bits: "0"
4241258-4241545 can: data: "Data byte 0: 0x00" "DB 0: 0x00" "DB"
4241546-4241833 can: data: "Data byte 1: 0x11" "DB 1: 0x11" "DB"
4241834-4242089 can: data: "Data byte 2: 0x22" "DB 2: 0x22" "DB"
4242090-4242345 can: data: "Data byte 3: 0x33" "DB 3: 0x33" "DB"
4242346-4242601 can: data: "Data byte 4: 0x44" "DB 4: 0x44" "DB"
4242602-4242857 can: data: "Data byte 5: 0x55" "DB 5: 0x55" "DB"
4242858-4243113 can: data: "Data byte 6: 0x66" "DB 6: 0x66" "DB"
4243114-4243145 can: bits: "0"
4243146-4243177 can: bits: "0"
4243178-4243209 can: bits: "0"
4243210-4243241 can: bits: "1"
4243242-4243273 can: bits: "1"
4243274-4243305 can: bits: "0"
4243306-4243337 can: bits: "1"
4243338-4243369 can: bits: "0"
4243370-4243401 can: bits: "0"
4243402-4243433 can: bits: "1"
4243434-4243465 can: bits: "1"
4243466-4243497 can: bits: "0"
4243498-4243529 can: bits: "0"
4243530-4243561 can: bits: "0"
4243562-4243593 can: bits: "0"
4243114-4243593 can: crc-sequence: "CRC sequence: 0x0d30" "CRC: 0x0d30" "CRC"
4243594-4243625 can: bits: "1"
4243594-4243625 can: crc-delimiter: "CRC delimiter: 1" "CRC d: 1" "CRC d"
4243626-4243657 can: bits: "0"
4243626-4243657 can: ack-slot: "ACK slot: ACK" "ACK s: ACK" "ACK s"
4243658-4243689 can: bits: "1"
4243658-4243689 can: ack-delimiter: "ACK delimiter: 1" "ACK d: 1" "ACK d"
4243690-4243721 can: bits: "1"
4243722-4243753 can: bits: "1"
4243754-4243785 can: bits: "1"
4243786-4243817 can: bits: "1"
4243818-4243849 can: bits: "1"
4243850-4243881 can: bits: "1"
4243882-4243913 can: bits: "1"
4243690-4243913 can: eof: "End of frame" "EOF" "E"
6160843-6160874 can: bits: "0"
6160843-6160874 can: sof: "Start of frame" "SOF" "S"
6160875-6160906 can: bits: "1"
6160907-6160938 can: bits: "0"
6160939-6160970 can: bits: "0"
6160971-6161002 can: bits: "0"
6161003-6161034 can: bits: "1"
6161035-6161066 can: bits: "0"
6161067-6161098 can: bits: "0"
6161099-6161130 can: bits: "1"
6161131-6161162 can: bits: "0"
6161163-6161194 can: bits: "0"
6161195-6161226 can: bits: "0"
6160875-6161226 can: id: "Identifier: 1096 (0x448)" "ID: 1096 (0x448)" "ID"
6161227-6161258 can: bits: "1"
6161259-6161290 can: bits: "1"
6161259-6161290 can: ide: "Identifier extension bit: extended frame" "IDE: extended frame" "IDE"
6161291-6161322 can: bits: "1"
6161323-6161354 can: bits: "0"
6161355-6161386 can: bits: "0"
6161387-6161418 can: bits: "0"
6161419-6161450 can: bits: "1"
6161451-6161482 can: bits: "1"
6161483-6161514 can: bits: "0"
6161515-6161546 can: bits: "0"
6161547-6161578 can: bits: "1"
6161579-6161610 can: bits: "1"
6161611-6161642 can: bits: "0"
6161643-6161674 can: bits: "1"
6161675-6161706 can: bits: "0"
6161707-6161738 can: bits: "0"
6161739-6161770 can: bits: "0"
6161771-6161802 can: bits: "1"
6161803-6161834 can: bits: "0"
6161835-6161866 can: bits: "0"
6161291-6161866 can: ext-id: "Extended Identifier: 144196 (0x23344)" "Extended ID: 144196 (0x23344)" "Extended ID" "EID"
6161291-6161866 can: full-id: "Full Identifier: 287454020 (0x11223344)" "Full ID: 287454020 (0x11223344)" "Full ID" "FID"
6161227-6161258 can: srr: "Substitute remote request: 1" "SRR: 1" "SRR"
6161867-6161898 can: bits: "0"
6161867-6161898 can: rtr: "Remote transmission request: data frame" "RTR: data frame" "RTR"
6161899-6161930 can: bits: "0"
6161899-6161930 can: reserved-bit: "Reserved bit 1: 0" "RB1: 0" "RB1"
6161931-6161962 can: bits: "0"
6161931-6161962 can: reserved-bit: "Reserved bit 0: 0" "RB0: 0" "RB0"
6161963-6161994 can: bits: "1"
6161963-6161994 can: stuff-bit: "Stuff bit: 1" "SB: 1" "SB"
6161995-6162026 can: bits: "0"
6162027-6162058 can: bits: "1"
6162059-6162090 can: bits: "1"
6162091-6162122 can: bits: "1"
6161995-6162122 can: dlc: "Data length code: 7" "DLC: 7" "DLC"
6162123-6162154 can: bits: "0"
6162155-6162186 can: bits: "0"
6162187-6162218 can: bits: "0"
6162219-6162250 can: bits: "0"
6162251-6162282 can: bits: "0"
6162283-6162314 can: bits: "1"
6162283-6162314 can: stuff-bit: "Stuff bit: 1" "SB: 1" "SB"
6162315-6162346 can: bits: "0"
6162347-6162378 can: bits: "0"
6162379-6162410 can: bits: "0"
6162411-6162442 can: bits: "0"
6162443-6162474 can: bits: "0"
6162475-6162506 can: bits: "1"
6162475-6162506 can: stuff-bit: "Stuff bit: 1" "SB: 1" "SB"
6162507-6162538 can: bits: "0"
6162539-6162570 can: bits: "1"
6162571-6162602 can: bits: "0"
6162603-6162634 can: bits: "0"
6162635-6162666 can: bits: "0"
6162667-6162698 can: bits: "1"
6162699-6162730 can: bits: "0"
6162731-6162762 can: bits: "0"
6162763-6162794 can: bits: "1"
6162795-6162826 can: bits: "0"
6162827-6162858 can: bits: "0"
6162859-6162890 can: bits: "0"
6162891-6162922 can: bits: "1"
6162923-6162954 can: bits: "0"
6162955-6162986 can: bits: "0"
6162987-6163018 can: bits: "0"
6163019-6163050 can: bits: "1"
6163051-6163082 can: bits: "1"
6163083-6163114 can: bits: "0"
6163115-6163146 can: bits: "0"
6163147-6163178 can: bits: "1"
6163179-6163210 can: bits: "1"
6163211-6163242 can: bits: "0"
6163243-6163274 can: bits: "1"
6163275-6163306 can: bits: "0"
6163307-6163338 can: bits: "0"
6163339-6163370 can: bits: "0"
6163371-6163402 can: bits: "1"
6163403-6163434 can: bits: "0"
6163435-6163466 can: bits: "0"
6163467-6163498 can: bits: "0"
6163499-6163530 can: bits: "1"
6163531-6163562 can: bits: "0"
6163563-6163594 can: bits: "1"
6163595-6163626 can: bits: "0"
6163627-6163658 can: bits: "1"
6163659-6163690 can: bits: "0"
6163691-6163722 can: bits: "1"
6163723-6163754 can: bits: "0"
6163755-6163786 can: bits: "1"
6163787-6163818 can: bits: "1"
6163819-6163850 can: bits: "0"
6163851-6163882 can: bits: "0"
6163883-6163914 can: bits: "1"
6163915-6163946 can: bits: "1"
6163947-6163978 can: bits: "0"
6162123-6162410 can: data: "Data byte 0: 0x00" "DB 0: 0x00" "DB"
6162411-6162698 can: data: "Data byte 1: 0x11" "DB 1: 0x11" "DB"
6162699-6162954 can: data: "Data byte 2: 0x22" "DB 2: 0x22" "DB"
6162955-6163210 can: data: "Data byte 3: 0x33" "DB 3: 0x33" "DB"
6163211-6163466 can: data: "Data byte 4: 0x44" "DB 4: 0x44" "DB"
6163467-6163722 can: data: "Data byte 5: 0x55" "DB 5: 0x55" "DB"
6163723-6163978 can: data: "Data byte 6: 0x66" "DB 6: 0x66" "DB"
6163979-6164010 can: bits: "0"
6164011-6164042 can: bits: "0"
6164043-6164074 can: bits: "0"
6164075-6164106 can: bits: "1"
6164107-6164138 can: bits: "1"
6164139-6164170 can: bits: "0"
6164171-6164202 can: bits: "1"
6164203-6164234 can: bits: "0"
6164235-6164266 can: bits: "0"
6164267-6164298 can: bits: "1"
6164299-6164330 can: bits: "1"
6164331-6164362 can: bits: "0"
6164363-6164394 can: bits: "0"
6164395-6164426 can: bits: "0"
6164427-6164458 can: bits: "0"
6163979-6164458 can: crc-sequence: "CRC sequence: 0x0d30" "CRC: 0x0d30" "CRC"
6164459-6164490 can: bits: "1"
6164459-6164490 can: crc-delimiter: "CRC delimiter: 1" "CRC d: 1" "CRC d"
6164491-6164522 can: bits: "0"
6164491-6164522 can: ack-slot: "ACK slot: ACK" "ACK s: ACK" "ACK s"
6164523-6164554 can: bits: "1"
6164523-6164554 can: ack-delimiter: "ACK delimiter: 1" "ACK d: 1" "ACK d"
6164555-6164586 can: bits: "1"
6164587-6164618 can: bits: "1"
6164619-6164650 can: bits: "1"
6164651-6164682 can: bits: "1"
6164683-6164714 can: bits: "1"
6164715-6164746 can: bits: "1"
6164747-6164778 can: bits: "1"
6164555-6164778 can: eof: "End of frame" "EOF" "E"
8209739-8209770 can: bits: "0"
8209739-8209770 can: sof: "Start of frame" "SOF" "S"
8209771-8209802 can: bits: "1"
8209803-8209834 can: bits: "0"
8209835-8209866 can: bits: "0"
8209867-8209898 can: bits: "0"
8209899-8209930 can: bits: "1"
8209931-8209962 can: bits: "0"
8209963-8209994 can: bits: "0"
8209995-8210026 can: bits: "1"
8210027-8210058 can: bits: "0"
8210059-8210090 can: bits: "0"
8210091-8210122 can: bits: "0"
8209771-8210122 can: id: "Identifier: 1096 (0x448)" "ID: 1096 (0x448)" "ID"
8210123-8210154 can: bits: "1"
8210155-8210186 can: bits: "1"
8210155-8210186 can: ide: "Identifier extension bit: extended frame" "IDE: extended frame" "IDE"
8210187-8210218 can: bits: "1"
8210219-8210250 can: bits: "0"
8210251-8210282 can: bits: "0"
8210283-8210314 can: bits: "0"
8210315-8210346 can: bits: "1"
8210347-8210378 can: bits: "1"
8210379-8210410 can: bits: "0"
8210411-8210442 can: bits: "0"
8210443-8210474 can: bits: "1"
8210475-8210506 can: bits: "1"
8210507-8210538 can: bits: "0"
8210539-8210570 can: bits: "1"
8210571-8210602 can: bits: "0"
8210603-8210634 can: bits: "0"
8210635-8210666 can: bits: "0"
8210667-8210698 can: bits: "1"
8210699-8210730 can: bits: "0"
8210731-8210762 can: bits: "0"
8210187-8210762 can: ext-id: "Extended Identifier: 144196 (0x23344)" "Extended ID: 144196 (0x23344)" "Extended ID" "EID"
8210187-8210762 can: full-id: "Full Identifier: 287454020 (0x11223344)" "Full ID: 287454020 (0x11223344)" "Full ID" "FID"
8210123-8210154 can: srr: "Substitute remote request: 1" "SRR: 1" "SRR"
8210763-8210794 can: bits: "0"
8210763-8210794 can: rtr: "Remote transmission request: data frame" "RTR: data frame" "RTR"
8210795-8210826 can: bits: "0"
8210795-8210826 can: reserved-bit: "Reserved bit 1: 0" "RB1: 0" "RB1"
8210827-8210858 can: bits: "0"
8210827-8210858 can: reserved-bit: "Reserved bit 0: 0" "RB0: 0" "RB0"
8210859-8210890 can: bits: "1"
8210859-8210890 can: stuff-bit: "Stuff bit: 1" "SB: 1" "SB"
8210891-8210922 can: bits: "0"
8210923-8210954 can: bits: "1"
8210955-8210986 can: bits: "1"
8210987-8211018 can: bits: "1"
8210891-8211018 can: dlc: "Data length code: 7" "DLC: 7" "DLC"
8211019-8211050 can: bits: "0"
8211051-8211082 can: bits: "0"
8211083-8211114 can: bits: "0"
8211115-8211146 can: bits: "0"
8211147-8211178 can: bits: "0"
8211179-8211210 can: bits: "1"
8211179-8211210 can: stuff-bit: "Stuff bit: 1" "SB: 1" "SB"
8211211-8211242 can: bits: "0"
8211243-8211274 can: bits: "0"
8211275-8211306 can: bits: "0"
8211307-8211338 can: bits: "0"
8211339-8211370 can: bits: "0"
8211371-8211402 can: bits: "1"
8211371-8211402 can: stuff-bit: "Stuff bit: 1" "SB: 1" "SB"
8211403-8211434 can: bits: "0"
8211435-8211466 can: bits: "1"
8211467-8211498 can: bits: "0"
8211499-8211530 can: bits: "0"
8211531-8211562 can: bits: "0"
8211563-8211594 can: bits: "1"
8211595-8211626 can: bits: "0"
8211627-8211658 can: bits: "0"
8211659-8211690 can: bits: "1"
8211691-8211722 can: bits: "0"
8211723-8211754 can: bits: "0"
8211755-8211786 can: bits: "0"
8211787-8211818 can: bits: "1"
8211819-8211850 can: bits: "0"
8211851-8211882 can: bits: "0"
8211883-8211914 can: bits: "0"
8211915-8211946 can: bits: "1"
8211947-8211978 can: bits: "1"
8211979-8212010 can: bits: "0"
8212011-8212042 can: bits: "0"
8212043-8212074 can: bits: "1"
8212075-8212106 can: bits: "1"
8212107-8212138 can: bits: "0"
8212139-8212170 can: bits: "1"
8212171-8212202 can: bits: "0"
8212203-8212234 can: bits: "0"
8212235-8212266 can: bits: "0"
8212267-8212298 can: bits: "1"
8212299-8212330 can: bits: "0"
8212331-8212362 can: bits: "0"
8212363-8212394 can: bits: "0"
8212395-8212426 can: bits: "1"
8212427-8212458 can: bits: "0"
8212459-8212490 can: bits: "1"
8212491-8212522 can: bits: "0"
8212523-8212554 can: bits: "1"
8212555-8212586 can: bits: "0"
8212587-8212618 can: bits: "1"
8212619-8212650 can: bits: "0"
8212651-8212682 can: bits: "1"
8212683-8212714 can: bits: "1"
8212715-8212746 can: bits: "0"
8212747-8212778 can: bits: "0"
8212779-8212810 can: bits: "1"
8212811-8212842 can: bits: "1"
8212843-8212874 can: bits: "0"
8211019-8211306 can: data: "Data byte 0: 0x00" "DB 0: 0x00" "DB"
8211307-8211594 can: data: "Data byte 1: 0x11" "DB 1: 0x11" "DB"
8211595-8211850 can: data: "Data byte 2: 0x22" "DB 2: 0x22" "DB"
8211851-8212106 can: data: "Data byte 3: 0x33" "DB 3: 0x33" "DB"
8212107-8212362 can: data: "Data byte 4: 0x44" "DB 4: 0x44" "DB"
8212363-8212618 can: data: "Data byte 5: 0x55" "DB 5: 0x55" "DB"
8212619-8212874 can: data: "Data byte 6: 0x66" "DB 6: 0x66" "DB"
8212875-8212906 can: bits: "0"
8212907-8212938 can: bits: "0"
8212939-8212970 can: bits: "0"
8212971-8213002 can: bits: "1"
8213003-8213034 can: bits: "1"
8213035-8213066 can: bits: "0"
8213067-8213098 can: bits: "1"
8213099-8213130 can: bits: "0"
8213131-8213162 can: bits: "0"
8213163-8213194 can: bits: "1"
8213195-8213226 can: bits: "1"
8213227-8213258 can: bits: "0"
8213259-8213290 can: bits: "0"
8213291-8213322 can: bits: "0"
8213323-8213354 can: bits: "0"
8212875-8213354 can: crc-sequence: "CRC sequence: 0x0d30" "CRC: 0x0d30" "CRC"
8213355-8213386 can: bits: "1"
8213355-8213386 can: crc-delimiter: "CRC delimiter: 1" "CRC d: 1" "CRC d"
8213387-8213418 can: bits: "0"
8213387-8213418 can: ack-slot: "ACK slot: ACK" "ACK s: ACK" "ACK s"
8213419-8213450 can: bits: "1"
8213419-8213450 can: ack-delimiter: "ACK delimiter: 1" "ACK d: 1" "ACK d"
8213451-8213482 can: bits: "1"
8213483-8213514 can: bits: "1"
8213515-8213546 can: bits: "1"
8213547-8213578 can: bits: "1"
8213579-8213610 can: bits: "1"
8213611-8213642 can: bits: "1"
8213643-8213674 can: bits: "1"
8213451-8213674 can: eof: "End of frame" "EOF" "E"
10578855-10578886 can: bits: "0"
10578855-10578886 can: sof: "Start of frame" "SOF" "S"
10578887-10578918 can: bits: "1"
10578919-10578950 can: bits: "0"
10578951-10578982 can: bits: "0"
10578983-10579014 can: bits: "0"
10579015-10579046 can: bits: "1"
10579047-10579078 can: bits: "0"
10579079-10579110 can: bits: "0"
10579111-10579142 can: bits: "1"
10579143-10579174 can: bits: "0"
10579175-10579206 can: bits: "0"
10579207-10579238 can: bits: "0"
10578887-10579238 can: id: "Identifier: 1096 (0x448)" "ID: 1096 (0x448)" "ID"
10579239-10579270 can: bits: "1"
10579271-10579302 can: bits: "1"
10579271-10579302 can: ide: "Identifier extension bit: extended frame" "IDE: extended frame" "IDE"
10579303-10579334 can: bits: "1"
10579335-10579366 can: bits: "0"
10579367-10579398 can: bits: "0"
10579399-10579430 can: bits: "0"
10579431-10579462 can: bits: "1"
10579463-10579494 can: bits: "1"
10579495-10579526 can: bits: "0"
10579527-10579558 can: bits: "0"
10579559-10579590 can: bits: "1"
10579591-10579622 can: bits: "1"
10579623-10579654 can: bits: "0"
10579655-10579686 can: bits: "1"
10579687-10579718 can: bits: "0"
10579719-10579750 can: bits: "0"
10579751-10579782 can: bits: "0"
10579783-10579814 can: bits: "1"
10579815-10579846 can: bits: "0"
10579847-10579878 can: bits: "0"
10579303-10579878 can: ext-id: "Extended Identifier: 144196 (0x23344)" "Extended ID: 144196 (0x23344)" "Extended ID" "EID"
10579303-10579878 can: full-id: "Full Identifier: 287454020 (0x11223344)" "Full ID: 287454020 (0x11223344)" "Full ID" "FID"
10579239-10579270 can: srr: "Substitute remote request: 1" "SRR: 1" "SRR"
10579879-10579910 can: bits: "0"
10579879-10579910 can: rtr: "Remote transmission request: data frame" "RTR: data frame" "RTR"
10579911-10579942 can: bits: "0"
10579911-10579942 can: reserved-bit: "Reserved bit 1: 0" "RB1: 0" "RB1"
10579943-10579974 can: bits: "0"
10579943-10579974 can: reserved-bit: "Reserved bit 0: 0" "RB0: 0" "RB0"
10579975-10580006 can: bits: "1"
10579975-10580006 can: stuff-bit: "Stuff bit: 1" "SB: 1" "SB"
10580007-10580038 can: bits: "0"
10580039-10580070 can: bits: "1"
10580071-10580102 can: bits: "1"
10580103-10580134 can: bits: "1"
10580007-10580134 can: dlc: "Data length code: 7" "DLC: 7" "DLC"
10580135-10580166 can: bits: "0"
10580167-10580198 can: bits: "0"
10580199-10580230 can: bits: "0"
10580231-10580262 can: bits: "0"
10580263-10580294 can: bits: "0"
10580295-10580326 can: bits: "1"
10580295-10580326 can: stuff-bit: "Stuff bit: 1" "SB: 1" "SB"
10580327-10580358 can: bits: "0"
10580359-10580390 can: bits: "0"
10580391-10580422 can: bits: "0"
10580423-10580454 can: bits: "0"
10580455-10580486 can: bits: "0"
10580487-10580518 can: bits: "1"
10580487-10580518 can: stuff-bit: "Stuff bit: 1" "SB: 1" "SB"
10580519-10580550 can: bits: "0"
10580551-10580582 can: bits: "1"
10580583-10580614 can: bits: "0"
10580615-10580646 can: bits: "0"
10580647-10580678 can: bits: "0"
10580679-10580710 can: bits: "1"
10580711-10580742 can: bits: "0"
10580743-10580774 can: bits: "0"
10580775-10580806 can: bits: "1"
10580807-10580838 can: bits: "0"
10580839-10580870 can: bits: "0"
10580871-10580902 can: bits: "0"
10580903-10580934 can: bits: "1"
10580935-10580966 can: bits: "0"
10580967-10580998 can: bits: "0"
10580999-10581030 can: bits: "0"
10581031-10581062 can: bits: "1"
10581063-10581094 can: bits: "1"
10581095-10581126 can: bits: "0"
10581127-10581158 can: bits: "0"
10581159-10581190 can: bits: "1"
10581191-10581222 can: bits: "1"
10581223-10581254 can: bits: "0"
10581255-10581286 can: bits: "1"
10581287-10581318 can: bits: "0"
10581319-10581350 can: bits: "0"
10581351-10581382 can: bits: "0"
10581383-10581414 can: bits: "1"
10581415-10581446 can: bits: "0"
10581447-10581478 can: bits: "0"
10581479-10581510 can: bits: "0"
10581511-10581542 can: bits: "1"
10581543-10581574 can: bits: "0"
10581575-10581606 can: bits: "1"
10581607-10581638 can: bits: "0"
10581639-10581670 can: bits: "1"
10581671-10581702 can: bits: "0"
10581703-10581734 can: bits: "1"
10581735-10581766 can: bits: "0"
10581767-10581798 can: bits: "1"
10581799-10581830 can: bits: "1"
10581831-10581862 can: bits: "0"
10581863-10581894 can: bits: "0"
10581895-10581926 can: bits: "1"
10581927-10581958 can: bits: "1"
10581959-10581990 can: bits: "0"
10580135-10580422 can: data: "Data byte 0: 0x00" "DB 0: 0x00" "DB"
10580423-10580710 can: data: "Data byte 1: 0x11" "DB 1: 0x11" "DB"
10580711-10580966 can: data: "Data byte 2: 0x22" "DB 2: 0x22" "DB"
10580967-10581222 can: data: "Data byte 3: 0x33" "DB 3: 0x33" "DB"
10581223-10581478 can: data: "Data byte 4: 0x44" "DB 4: 0x44" "DB"
10581479-10581734 can: data: "Data byte 5: 0x55" "DB 5: 0x55" "DB"
10581735-10581990 can: data: "Data byte 6: 0x66" "DB 6: 0x66" "DB"
10581991-10582022 can: bits: "0"
10582023-10582054 can: bits: "0"
10582055-10582086 can: bits: "0"
10582087-10582118 can: bits: "1"
10582119-10582150 can: bits: "1"
10582151-10582182 can: bits: "0"
10582183-10582214 can: bits: "1"
10582215-10582246 can: bits: "0"
10582247-10582278 can: bits: "0"
10582279-10582310 can: bits: "1"
10582311-10582342 can: bits: "1"
10582343-10582374 can: bits: "0"
10582375-10582406 can: bits: "0"
10582407-10582438 can: bits: "0"
10582439-10582470 can: bits: "0"
10581991-10582470 can: crc-sequence: "CRC sequence: 0x0d30" "CRC: 0x0d30" "CRC"
10582471-10582502 can: bits: "1"
10582471-10582502 can: crc-delimiter: "CRC delimiter: 1" "CRC d: 1" "CRC d"
10582503-10582534 can: bits: "0"
10582503-10582534 can: ack-slot: "ACK slot: ACK" "ACK s: ACK" "ACK s"
10582535-10582566 can: bits: "1"
10582535-10582566 can: ack-delimiter: "ACK delimiter: 1" "ACK d: 1" "ACK d"
10582567-10582598 can: bits: "1"
10582599-10582630 can: bits: "1"
10582631-10582662 can: bits: "1"
10582663-10582694 can: bits: "1"
10582695-10582726 can: bits: "1"
10582727-10582758 can: bits: "1"
10582759-10582790 can: bits: "1"
10582567-10582790 can: eof: "End of frame" "EOF" "E"
