245785-245816 can: sof: "Start of frame" "SOF" "S"
245817-246168 can: id: "Identifier: 1304 (0x518)" "ID: 1304 (0x518)" "ID"
246201-246232 can: ide: "Identifier extension bit: extended frame" "IDE: extended frame" "IDE"
246233-246808 can: ext-id: "Extended Identifier: 70196 (0x11234)" "Extended ID: 70196 (0x11234)" "Extended ID" "EID"
246233-246808 can: full-id: "Full Identifier: 341905972 (0x14611234)" "Full ID: 341905972 (0x14611234)" "Full ID" "FID"
246169-246200 can: srr: "Substitute remote request: 1" "SRR: 1" "SRR"
246809-246840 can: rtr: "Remote transmission request: data frame" "RTR: data frame" "RTR"
246841-246872 can: reserved-bit: "Reserved bit 1: 0" "RB1: 0" "RB1"
246873-246904 can: reserved-bit: "Reserved bit 0: 0" "RB0: 0" "RB0"
246905-246936 can: stuff-bit: "Stuff bit: 1" "SB: 1" "SB"
246937-247064 can: dlc: "Data length code: 4" "DLC: 4" "DLC"
247161-247192 can: stuff-bit: "Stuff bit: 1" "SB: 1" "SB"
247353-247384 can: stuff-bit: "Stuff bit: 1" "SB: 1" "SB"
247545-247576 can: stuff-bit: "Stuff bit: 1" "SB: 1" "SB"
247833-247864 can: stuff-bit: "Stuff bit: 1" "SB: 1" "SB"
248089-248120 can: stuff-bit: "Stuff bit: 1" "SB: 1" "SB"
247065-247352 can: data: "Data byte 0: 0x00" "DB 0: 0x00" "DB"
247385-247672 can: data: "Data byte 1: 0x01" "DB 1: 0x01" "DB"
247673-247960 can: data: "Data byte 2: 0x02" "DB 2: 0x02" "DB"
247961-248248 can: data: "Data byte 3: 0x03" "DB 3: 0x03" "DB"
248441-248472 can: stuff-bit: "Stuff bit: 0" "SB: 0" "SB"
248729-248760 can: stuff-bit: "Stuff bit: 0" "SB: 0" "SB"
248249-248792 can: crc-sequence: "CRC sequence: 0x3fbf" "CRC: 0x3fbf" "CRC"
248793-248824 can: crc-delimiter: "CRC delimiter: 1" "CRC d: 1" "CRC d"
248825-248856 can: ack-slot: "ACK slot: ACK" "ACK s: ACK" "ACK s"
248857-248888 can: ack-delimiter: "ACK delimiter: 1" "ACK d: 1" "ACK d"
248889-249112 can: eof: "End of frame" "EOF" "E"
1141859-1141890 can: sof: "Start of frame" "SOF" "S"
1141891-1142242 can: id: "Identifier: 272 (0x110)" "ID: 272 (0x110)" "ID"
1142275-1142306 can: stuff-bit: "Stuff bit: 1" "SB: 1" "SB"
1142307-1142338 can: ide: "Identifier extension bit: standard frame" "IDE: standard frame" "IDE"
1142339-1142370 can: reserved-bit: "Reserved bit 0: 0" "RB0: 0" "RB0"
1142243-1142274 can: rtr: "Remote transmission request: data frame" "RTR: data frame" "RTR"
1142371-1142498 can: dlc: "Data length code: 2" "DLC: 2" "DLC"
1142627-1142658 can: stuff-bit: "Stuff bit: 1" "SB: 1" "SB"
1142819-1142850 can: stuff-bit: "Stuff bit: 1" "SB: 1" "SB"
1142499-1142786 can: data: "Data byte 0: 0x00" "DB 0: 0x00" "DB"
1142787-1143074 can: data: "Data byte 1: 0x11" "DB 1: 0x11" "DB"
1143395-1143426 can: stuff-bit: "Stuff bit: 1" "SB: 1" "SB"
1143075-1143586 can: crc-sequence: "CRC sequence: 0x4c12" "CRC: 0x4c12" "CRC"
1143587-1143618 can: crc-delimiter: "CRC delimiter: 1" "CRC d: 1" "CRC d"
1143619-1143650 can: ack-slot: "ACK slot: ACK" "ACK s: ACK" "ACK s"
1143651-1143682 can: ack-delimiter: "ACK delimiter: 1" "ACK d: 1" "ACK d"
1143683-1143906 can: eof: "End of frame" "EOF" "E"
2037932-2037963 can: sof: "Start of frame" "SOF" "S"
2037964-2038315 can: id: "Identifier: 1360 (0x550)" "ID: 1360 (0x550)" "ID"
2038348-2038379 can: stuff-bit: "Stuff bit: 1" "SB: 1" "SB"
2038380-2038411 can: ide: "Identifier extension bit: standard frame" "IDE: standard frame" "IDE"
2038412-2038443 can: reserved-bit: "Reserved bit 0: 0" "RB0: 0" "RB0"
2038316-2038347 can: rtr: "Remote transmission request: data frame" "RTR: data frame" "RTR"
2038444-2038571 can: dlc: "Data length code: 8" "DLC: 8" "DLC"
2040012-2040043 can: stuff-bit: "Stuff bit: 0" "SB: 0" "SB"
2040524-2040555 can: stuff-bit: "Stuff bit: 1" "SB: 1" "SB"
2038572-2038827 can: data: "Data byte 0: 0xaa" "DB 0: 0xaa" "DB"
2038828-2039083 can: data: "Data byte 1: 0xbb" "DB 1: 0xbb" "DB"
2039084-2039339 can: data: "Data byte 2: 0xcc" "DB 2: 0xcc" "DB"
2039340-2039595 can: data: "Data byte 3: 0xdd" "DB 3: 0xdd" "DB"
2039596-2039851 can: data: "Data byte 4: 0xee" "DB 4: 0xee" "DB"
2039852-2040139 can: data: "Data byte 5: 0xff" "DB 5: 0xff" "DB"
2040140-2040395 can: data: "Data byte 6: 0x0a" "DB 6: 0x0a" "DB"
2040396-2040683 can: data: "Data byte 7: 0x0b" "DB 7: 0x0b" "DB"
2040940-2040971 can: stuff-bit: "Stuff bit: 0" "SB: 0" "SB"
2040684-2041195 can: crc-sequence: "CRC sequence: 0x4fbc" "CRC: 0x4fbc" "CRC"
2041196-2041227 can: crc-delimiter: "CRC delimiter: 1" "CRC d: 1" "CRC d"
2041228-2041259 can: ack-slot: "ACK slot: ACK" "ACK s: ACK" "ACK s"
2041260-2041291 can: ack-delimiter: "ACK delimiter: 1" "ACK d: 1" "ACK d"
2041292-2041515 can: eof: "End of frame" "EOF" "E"
2934005-2934036 can: sof: "Start of frame" "SOF" "S"
2934037-2934388 can: id: "Identifier: 1304 (0x518)" "ID: 1304 (0x518)" "ID"
2934421-2934452 can: ide: "Identifier extension bit: extended frame" "IDE: extended frame" "IDE"
2934453-2935028 can: ext-id: "Extended Identifier: 70196 (0x11234)" "Extended ID: 70196 (0x11234)" "Extended ID" "EID"
2934453-2935028 can: full-id: "Full Identifier: 341905972 (0x14611234)" "Full ID: 341905972 (0x14611234)" "Full ID" "FID"
2934389-2934420 can: srr: "Substitute remote request: 1" "SRR: 1" "SRR"
2935029-2935060 can: rtr: "Remote transmission request: data frame" "RTR: data frame" "RTR"
2935061-2935092 can: reserved-bit: "Reserved bit 1: 0" "RB1: 0" "RB1"
2935093-2935124 can: reserved-bit: "Reserved bit 0: 0" "RB0: 0" "RB0"
2935125-2935156 can: stuff-bit: "Stuff bit: 1" "SB: 1" "SB"
2935157-2935284 can: dlc: "Data length code: 4" "DLC: 4" "DLC"
2935381-2935412 can: stuff-bit: "Stuff bit: 1" "SB: 1" "SB"
2935573-2935604 can: stuff-bit: "Stuff bit: 1" "SB: 1" "SB"
2935765-2935796 can: stuff-bit: "Stuff bit: 1" "SB: 1" "SB"
2936053-2936084 can: stuff-bit: "Stuff bit: 1" "SB: 1" "SB"
2936309-2936340 can: stuff-bit: "Stuff bit: 1" "SB: 1" "SB"
2935285-2935572 can: data: "Data byte 0: 0x00" "DB 0: 0x00" "DB"
2935605-2935892 can: data: "Data byte 1: 0x01" "DB 1: 0x01" "DB"
2935893-2936180 can: data: "Data byte 2: 0x02" "DB 2: 0x02" "DB"
2936181-2936468 can: data: "Data byte 3: 0x03" "DB 3: 0x03" "DB"
2936661-2936692 can: stuff-bit: "Stuff bit: 0" "SB: 0" "SB"
2936949-2936980 can: stuff-bit: "Stuff bit: 0" "SB: 0" "SB"
2936469-2937012 can: crc-sequence: "CRC sequence: 0x3fbf" "CRC: 0x3fbf" "CRC"
2937013-2937044 can: crc-delimiter: "CRC delimiter: 1" "CRC d: 1" "CRC d"
2937045-2937076 can: ack-slot: "ACK slot: ACK" "ACK s: ACK" "ACK s"
2937077-2937108 can: ack-delimiter: "ACK delimiter: 1" "ACK d: 1" "ACK d"
2937109-2937332 can: eof: "End of frame" "EOF" "E"
3830078-3830109 can: sof: "Start of frame" "SOF" "S"
3830110-3830461 can: id: "Identifier: 272 (0x110)" "ID: 272 (0x110)" "ID"
3830494-3830525 can: stuff-bit: "Stuff bit: 1" "SB: 1" "SB"
3830526-3830557 can: ide: "Identifier extension bit: standard frame" "IDE: standard frame" "IDE"
3830558-3830589 can: reserved-bit: "Reserved bit 0: 0" "RB0: 0" "RB0"
3830462-3830493 can: rtr: "Remote transmission request: data frame" "RTR: data frame" "RTR"
3830590-3830717 can: dlc: "Data length code: 2" "DLC: 2" "DLC"
3830846-3830877 can: stuff-bit: "Stuff bit: 1" "SB: 1" "SB"
3831038-3831069 can: stuff-bit: "Stuff bit: 1" "SB: 1" "SB"
3830718-3831005 can: data: "Data byte 0: 0x00" "DB 0: 0x00" "DB"
3831006-3831293 can: data: "Data byte 1: 0x11" "DB 1: 0x11" "DB"
3831614-3831645 can: stuff-bit: "Stuff bit: 1" "SB: 1" "SB"
3831294-3831805 can: crc-sequence: "CRC sequence: 0x4c12" "CRC: 0x4c12" "CRC"
3831806-3831837 can: crc-delimiter: "CRC delimiter: 1" "CRC d: 1" "CRC d"
3831838-3831869 can: ack-slot: "ACK slot: ACK" "ACK s: ACK" "ACK s"
3831870-3831901 can: ack-delimiter: "ACK delimiter: 1" "ACK d: 1" "ACK d"
3831902-3832125 can: eof: "End of frame" "EOF" "E"
4726152-4726183 can: sof: "Start of frame" "SOF" "S"
4726184-4726535 can: id: "Identifier: 1360 (0x550)" "ID: 1360 (0x550)" "ID"
4726568-4726599 can: stuff-bit: "Stuff bit: 1" "SB: 1" "SB"
4726600-4726631 can: ide: "Identifier extension bit: standard frame" "IDE: standard frame" "IDE"
4726632-4726663 can: reserved-bit: "Reserved bit 0: 0" "RB0: 0" "RB0"
4726536-4726567 can: rtr: "Remote transmission request: data frame" "RTR: data frame" "RTR"
4726664-4726791 can: dlc: "Data length code: 8" "DLC: 8" "DLC"
4728232-4728263 can: stuff-bit: "Stuff bit: 0" "SB: 0" "SB"
4728744-4728775 can: stuff-bit: "Stuff bit: 1" "SB: 1" "SB"
4726792-4727047 can: data: "Data byte 0: 0xaa" "DB 0: 0xaa" "DB"
4727048-4727303 can: data: "Data byte 1: 0xbb" "DB 1: 0xbb" "DB"
4727304-4727559 can: data: "Data byte 2: 0xcc" "DB 2: 0xcc" "DB"
4727560-4727815 can: data: "Data byte 3: 0xdd" "DB 3: 0xdd" "DB"
4727816-4728071 can: data: "Data byte 4: 0xee" "DB 4: 0xee" "DB"
4728072-4728359 can: data: "Data byte 5: 0xff" "DB 5: 0xff" "DB"
4728360-4728615 can: data: "Data byte 6: 0x0a" "DB 6: 0x0a" "DB"
4728616-4728903 can: data: "Data byte 7: 0x0b" "DB 7: 0x0b" "DB"
4729160-4729191 can: stuff-bit: "Stuff bit: 0" "SB: 0" "SB"
4728904-4729415 can: crc-sequence: "CRC sequence: 0x4fbc" "CRC: 0x4fbc" "CRC"
4729416-4729447 can: crc-delimiter: "CRC delimiter: 1" "CRC d: 1" "CRC d"
4729448-4729479 can: ack-slot: "ACK slot: ACK" "ACK s: ACK" "ACK s"
4729480-4729511 can: ack-delimiter: "ACK delimiter: 1" "ACK d: 1" "ACK d"
4729512-4729735 can: eof: "End of frame" "EOF" "E"
5622225-5622256 can: sof: "Start of frame" "SOF" "S"
5622257-5622608 can: id: "Identifier: 1304 (0x518)" "ID: 1304 (0x518)" "ID"
5622641-5622672 can: ide: "Identifier extension bit: extended frame" "IDE: extended frame" "IDE"
5622673-5623248 can: ext-id: "Extended Identifier: 70196 (0x11234)" "Extended ID: 70196 (0x11234)" "Extended ID" "EID"
5622673-5623248 can: full-id: "Full Identifier: 341905972 (0x14611234)" "Full ID: 341905972 (0x14611234)" "Full ID" "FID"
5622609-5622640 can: srr: "Substitute remote request: 1" "SRR: 1" "SRR"
5623249-5623280 can: rtr: "Remote transmission request: data frame" "RTR: data frame" "RTR"
5623281-5623312 can: reserved-bit: "Reserved bit 1: 0" "RB1: 0" "RB1"
5623313-5623344 can: reserved-bit: "Reserved bit 0: 0" "RB0: 0" "RB0"
5623345-5623376 can: stuff-bit: "Stuff bit: 1" "SB: 1" "SB"
5623377-5623504 can: dlc: "Data length code: 4" "DLC: 4" "DLC"
5623601-5623632 can: stuff-bit: "Stuff bit: 1" "SB: 1" "SB"
5623793-5623824 can: stuff-bit: "Stuff bit: 1" "SB: 1" "SB"
5623985-5624016 can: stuff-bit: "Stuff bit: 1" "SB: 1" "SB"
5624273-5624304 can: stuff-bit: "Stuff bit: 1" "SB: 1" "SB"
5624529-5624560 can: stuff-bit: "Stuff bit: 1" "SB: 1" "SB"
5623505-5623792 can: data: "Data byte 0: 0x00" "DB 0: 0x00" "DB"
5623825-5624112 can: data: "Data byte 1: 0x01" "DB 1: 0x01" "DB"
5624113-5624400 can: data: "Data byte 2: 0x02" "DB 2: 0x02" "DB"
5624401-5624688 can: data: "Data byte 3: 0x03" "DB 3: 0x03" "DB"
5624881-5624912 can: stuff-bit: "Stuff bit: 0" "SB: 0" "SB"
5625169-5625200 can: stuff-bit: "Stuff bit: 0" "SB: 0" "SB"
5624689-5625232 can: crc-sequence: "CRC sequence: 0x3fbf" "CRC: 0x3fbf" "CRC"
5625233-5625264 can: crc-delimiter: "CRC delimiter: 1" "CRC d: 1" "CRC d"
5625265-5625296 can: ack-slot: "ACK slot: ACK" "ACK s: ACK" "ACK s"
5625297-5625328 can: ack-delimiter: "ACK delimiter: 1" "ACK d: 1" "ACK d"
5625329-5625552 can: eof: "End of frame" "EOF" "E"
6518330-6518361 can: sof: "Start of frame" "SOF" "S"
6518362-6518713 can: id: "Identifier: 272 (0x110)" "ID: 272 (0x110)" "ID"
6518746-6518777 can: stuff-bit: "Stuff bit: 1" "SB: 1" "SB"
6518778-6518809 can: ide: "Identifier extension bit: standard frame" "IDE: standard frame" "IDE"
6518810-6518841 can: reserved-bit: "Reserved bit 0: 0" "RB0: 0" "RB0"
6518714-6518745 can: rtr: "Remote transmission request: data frame" "RTR: data frame" "RTR"
6518842-6518969 can: dlc: "Data length code: 2" "DLC: 2" "DLC"
6519098-6519129 can: stuff-bit: "Stuff bit: 1" "SB: 1" "SB"
6519290-6519321 can: stuff-bit: "Stuff bit: 1" "SB: 1" "SB"
6518970-6519257 can: data: "Data byte 0: 0x00" "DB 0: 0x00" "DB"
6519258-6519545 can: data: "Data byte 1: 0x11" "DB 1: 0x11" "DB"
6519866-6519897 can: stuff-bit: "Stuff bit: 1" "SB: 1" "SB"
6519546-6520057 can: crc-sequence: "CRC sequence: 0x4c12" "CRC: 0x4c12" "CRC"
6520058-6520089 can: crc-delimiter: "CRC delimiter: 1" "CRC d: 1" "CRC d"
6520090-6520121 can: ack-slot: "ACK slot: ACK" "ACK s: ACK" "ACK s"
6520122-6520153 can: ack-delimiter: "ACK delimiter: 1" "ACK d: 1" "ACK d"
6520154-6520377 can: eof: "End of frame" "EOF" "E"
7414403-7414434 can: sof: "Start of frame" "SOF" "S"
7414435-7414786 can: id: "Identifier: 1360 (0x550)" "ID: 1360 (0x550)" "ID"
7414819-7414850 can: stuff-bit: "Stuff bit: 1" "SB: 1" "SB"
7414851-7414882 can: ide: "Identifier extension bit: standard frame" "IDE: standard frame" "IDE"
7414883-7414914 can: reserved-bit: "Reserved bit 0: 0" "RB0: 0" "RB0"
7414787-7414818 can: rtr: "Remote transmission request: data frame" "RTR: data frame" "RTR"
7414915-7415042 can: dlc: "Data length code: 8" "DLC: 8" "DLC"
7416483-7416514 can: stuff-bit: "Stuff bit: 0" "SB: 0" "SB"
7416995-7417026 can: stuff-bit: "Stuff bit: 1" "SB: 1" "SB"
7415043-7415298 can: data: "Data byte 0: 0xaa" "DB 0: 0xaa" "DB"
7415299-7415554 can: data: "Data byte 1: 0xbb" "DB 1: 0xbb" "DB"
7415555-7415810 can: data: "Data byte 2: 0xcc" "DB 2: 0xcc" "DB"
7415811-7416066 can: data: "Data byte 3: 0xdd" "DB 3: 0xdd" "DB"
7416067-7416322 can: data: "Data byte 4: 0xee" "DB 4: 0xee" "DB"
7416323-7416610 can: data: "Data byte 5: 0xff" "DB 5: 0xff" "DB"
7416611-7416866 can: data: "Data byte 6: 0x0a" "DB 6: 0x0a" "DB"
7416867-7417154 can: data: "Data byte 7: 0x0b" "DB 7: 0x0b" "DB"
7417411-7417442 can: stuff-bit: "Stuff bit: 0" "SB: 0" "SB"
7417155-7417666 can: crc-sequence: "CRC sequence: 0x4fbc" "CRC: 0x4fbc" "CRC"
7417667-7417698 can: crc-delimiter: "CRC delimiter: 1" "CRC d: 1" "CRC d"
7417699-7417730 can: ack-slot: "ACK slot: ACK" "ACK s: ACK" "ACK s"
7417731-7417762 can: ack-delimiter: "ACK delimiter: 1" "ACK d: 1" "ACK d"
7417763-7417986 can: eof: "End of frame" "EOF" "E"
8310476-8310507 can: sof: "Start of frame" "SOF" "S"
8310508-8310859 can: id: "Identifier: 1304 (0x518)" "ID: 1304 (0x518)" "ID"
8310892-8310923 can: ide: "Identifier extension bit: extended frame" "IDE: extended frame" "IDE"
8310924-8311499 can: ext-id: "Extended Identifier: 70196 (0x11234)" "Extended ID: 70196 (0x11234)" "Extended ID" "EID"
8310924-8311499 can: full-id: "Full Identifier: 341905972 (0x14611234)" "Full ID: 341905972 (0x14611234)" "Full ID" "FID"
8310860-8310891 can: srr: "Substitute remote request: 1" "SRR: 1" "SRR"
8311500-8311531 can: rtr: "Remote transmission request: data frame" "RTR: data frame" "RTR"
8311532-8311563 can: reserved-bit: "Reserved bit 1: 0" "RB1: 0" "RB1"
8311564-8311595 can: reserved-bit: "Reserved bit 0: 0" "RB0: 0" "RB0"
8311596-8311627 can: stuff-bit: "Stuff bit: 1" "SB: 1" "SB"
8311628-8311755 can: dlc: "Data length code: 4" "DLC: 4" "DLC"
8311852-8311883 can: stuff-bit: "Stuff bit: 1" "SB: 1" "SB"
8312044-8312075 can: stuff-bit: "Stuff bit: 1" "SB: 1" "SB"
8312236-8312267 can: stuff-bit: "Stuff bit: 1" "SB: 1" "SB"
8312524-8312555 can: stuff-bit: "Stuff bit: 1" "SB: 1" "SB"
8312780-8312811 can: stuff-bit: "Stuff bit: 1" "SB: 1" "SB"
8311756-8312043 can: data: "Data byte 0: 0x00" "DB 0: 0x00" "DB"
8312076-8312363 can: data: "Data byte 1: 0x01" "DB 1: 0x01" "DB"
8312364-8312651 can: data: "Data byte 2: 0x02" "DB 2: 0x02" "DB"
8312652-8312939 can: data: "Data byte 3: 0x03" "DB 3: 0x03" "DB"
8313132-8313163 can: stuff-bit: "Stuff bit: 0" "SB: 0" "SB"
8313420-8313451 can: stuff-bit: "Stuff bit: 0" "SB: 0" "SB"
8312940-8313483 can: crc-sequence: "CRC sequence: 0x3fbf" "CRC: 0x3fbf" "CRC"
8313484-8313515 can: crc-delimiter: "CRC delimiter: 1" "CRC d: 1" "CRC d"
8313516-8313547 can: ack-slot: "ACK slot: ACK" "ACK s: ACK" "ACK s"
8313548-8313579 can: ack-delimiter: "ACK delimiter: 1" "ACK d: 1" "ACK d"
8313580-8313803 can: eof: "End of frame" "EOF" "E"
9206550-9206581 can: sof: "Start of frame" "SOF" "S"
9206582-9206933 can: id: "Identifier: 272 (0x110)" "ID: 272 (0x110)" "ID"
9206966-9206997 can: stuff-bit: "Stuff bit: 1" "SB: 1" "SB"
9206998-9207029 can: ide: "Identifier extension bit: standard frame" "IDE: standard frame" "IDE"
9207030-9207061 can: reserved-bit: "Reserved bit 0: 0" "RB0: 0" "RB0"
9206934-9206965 can: rtr: "Remote transmission request: data frame" "RTR: data frame" "RTR"
9207062-9207189 can: dlc: "Data length code: 2" "DLC: 2" "DLC"
9207318-9207349 can: stuff-bit: "Stuff bit: 1" "SB: 1" "SB"
9207510-9207541 can: stuff-bit: "Stuff bit: 1" "SB: 1" "SB"
9207190-9207477 can: data: "Data byte 0: 0x00" "DB 0: 0x00" "DB"
9207478-9207765 can: data: "Data byte 1: 0x11" "DB 1: 0x11" "DB"
9208086-9208117 can: stuff-bit: "Stuff bit: 1" "SB: 1" "SB"
9207766-9208277 can: crc-sequence: "CRC sequence: 0x4c12" "CRC: 0x4c12" "CRC"
9208278-9208309 can: crc-delimiter: "CRC delimiter: 1" "CRC d: 1" "CRC d"
9208310-9208341 can: ack-slot: "ACK slot: ACK" "ACK s: ACK" "ACK s"
9208342-9208373 can: ack-delimiter: "ACK delimiter: 1" "ACK d: 1" "ACK d"
9208374-9208597 can: eof: "End of frame" "EOF" "E"
10102623-10102654 can: sof: "Start of frame" "SOF" "S"
10102655-10103006 can: id: "Identifier: 1360 (0x550)" "ID: 1360 (0x550)" "ID"
10103039-10103070 can: stuff-bit: "Stuff bit: 1" "SB: 1" "SB"
10103071-10103102 can: ide: "Identifier extension bit: standard frame" "IDE: standard frame" "IDE"
10103103-10103134 can: reserved-bit: "Reserved bit 0: 0" "RB0: 0" "RB0"
10103007-10103038 can: rtr: "Remote transmission request: data frame" "RTR: data frame" "RTR"
10103135-10103262 can: dlc: "Data length code: 8" "DLC: 8" "DLC"
10104703-10104734 can: stuff-bit: "Stuff bit: 0" "SB: 0" "SB"
10105215-10105246 can: stuff-bit: "Stuff bit: 1" "SB: 1" "SB"
10103263-10103518 can: data: "Data byte 0: 0xaa" "DB 0: 0xaa" "DB"
10103519-10103774 can: data: "Data byte 1: 0xbb" "DB 1: 0xbb" "DB"
10103775-10104030 can: data: "Data byte 2: 0xcc" "DB 2: 0xcc" "DB"
10104031-10104286 can: data: "Data byte 3: 0xdd" "DB 3: 0xdd" "DB"
10104287-10104542 can: data: "Data byte 4: 0xee" "DB 4: 0xee" "DB"
10104543-10104830 can: data: "Data byte 5: 0xff" "DB 5: 0xff" "DB"
10104831-10105086 can: data: "Data byte 6: 0x0a" "DB 6: 0x0a" "DB"
10105087-10105374 can: data: "Data byte 7: 0x0b" "DB 7: 0x0b" "DB"
10105631-10105662 can: stuff-bit: "Stuff bit: 0" "SB: 0" "SB"
10105375-10105886 can: crc-sequence: "CRC sequence: 0x4fbc" "CRC: 0x4fbc" "CRC"
10105887-10105918 can: crc-delimiter: "CRC delimiter: 1" "CRC d: 1" "CRC d"
10105919-10105950 can: ack-slot: "ACK slot: ACK" "ACK s: ACK" "ACK s"
10105951-10105982 can: ack-delimiter: "ACK delimiter: 1" "ACK d: 1" "ACK d"
10105983-10106206 can: eof: "End of frame" "EOF" "E"
10998696-10998727 can: sof: "Start of frame" "SOF" "S"
10998728-10999079 can: id: "Identifier: 1304 (0x518)" "ID: 1304 (0x518)" "ID"
10999112-10999143 can: ide: "Identifier extension bit: extended frame" "IDE: extended frame" "IDE"
10999144-10999719 can: ext-id: "Extended Identifier: 70196 (0x11234)" "Extended ID: 70196 (0x11234)" "Extended ID" "EID"
10999144-10999719 can: full-id: "Full Identifier: 341905972 (0x14611234)" "Full ID: 341905972 (0x14611234)" "Full ID" "FID"
10999080-10999111 can: srr: "Substitute remote request: 1" "SRR: 1" "SRR"
10999720-10999751 can: rtr: "Remote transmission request: data frame" "RTR: data frame" "RTR"
10999752-10999783 can: reserved-bit: "Reserved bit 1: 0" "RB1: 0" "RB1"
10999784-10999815 can: reserved-bit: "Reserved bit 0: 0" "RB0: 0" "RB0"
10999816-10999847 can: stuff-bit: "Stuff bit: 1" "SB: 1" "SB"
10999848-10999975 can: dlc: "Data length code: 4" "DLC: 4" "DLC"
11000072-11000103 can: stuff-bit: "Stuff bit: 1" "SB: 1" "SB"
11000264-11000295 can: stuff-bit: "Stuff bit: 1" "SB: 1" "SB"
11000456-11000487 can: stuff-bit: "Stuff bit: 1" "SB: 1" "SB"
11000744-11000775 can: stuff-bit: "Stuff bit: 1" "SB: 1" "SB"
11001000-11001031 can: stuff-bit: "Stuff bit: 1" "SB: 1" "SB"
10999976-11000263 can: data: "Data byte 0: 0x00" "DB 0: 0x00" "DB"
11000296-11000583 can: data: "Data byte 1: 0x01" "DB 1: 0x01" "DB"
11000584-11000871 can: data: "Data byte 2: 0x02" "DB 2: 0x02" "DB"
11000872-11001159 can: data: "Data byte 3: 0x03" "DB 3: 0x03" "DB"
11001352-11001383 can: stuff-bit: "Stuff bit: 0" "SB: 0" "SB"
11001640-11001671 can: stuff-bit: "Stuff bit: 0" "SB: 0" "SB"
11001160-11001703 can: crc-sequence: "CRC sequence: 0x3fbf" "CRC: 0x3fbf" "CRC"
11001704-11001735 can: crc-delimiter: "CRC delimiter: 1" "CRC d: 1" "CRC d"
11001736-11001767 can: ack-slot: "ACK slot: ACK" "ACK s: ACK" "ACK s"
11001768-11001799 can: ack-delimiter: "ACK delimiter: 1" "ACK d: 1" "ACK d"
11001800-11002023 can: eof: "End of frame" "EOF" "E"
11894801-11894832 can: sof: "Start of frame" "SOF" "S"
11894833-11895184 can: id: "Identifier: 272 (0x110)" "ID: 272 (0x110)" "ID"
11895217-11895248 can: stuff-bit: "Stuff bit: 1" "SB: 1" "SB"
11895249-11895280 can: ide: "Identifier extension bit: standard frame" "IDE: standard frame" "IDE"
11895281-11895312 can: reserved-bit: "Reserved bit 0: 0" "RB0: 0" "RB0"
11895185-11895216 can: rtr: "Remote transmission request: data frame" "RTR: data frame" "RTR"
11895313-11895440 can: dlc: "Data length code: 2" "DLC: 2" "DLC"
11895569-11895600 can: stuff-bit: "Stuff bit: 1" "SB: 1" "SB"
11895761-11895792 can: stuff-bit: "Stuff bit: 1" "SB: 1" "SB"
11895441-11895728 can: data: "Data byte 0: 0x00" "DB 0: 0x00" "DB"
11895729-11896016 can: data: "Data byte 1: 0x11" "DB 1: 0x11" "DB"
11896337-11896368 can: stuff-bit: "Stuff bit: 1" "SB: 1" "SB"
11896017-11896528 can: crc-sequence: "CRC sequence: 0x4c12" "CRC: 0x4c12" "CRC"
11896529-11896560 can: crc-delimiter: "CRC delimiter: 1" "CRC d: 1" "CRC d"
11896561-11896592 can: ack-slot: "ACK slot: ACK" "ACK s: ACK" "ACK s"
11896593-11896624 can: ack-delimiter: "ACK delimiter: 1" "ACK d: 1" "ACK d"
11896625-11896848 can: eof: "End of frame" "EOF" "E"
