2377803-2377834 can: sof: "Start of frame" "SOF" "S"
2377835-2378186 can: id: "Identifier: 546 (0x222)" "ID: 546 (0x222)" "ID"
2378219-2378250 can: ide: "Identifier extension bit: standard frame" "IDE: standard frame" "IDE"
2378251-2378282 can: reserved-bit: "Reserved bit 0: 0" "RB0: 0" "RB0"
2378187-2378218 can: rtr: "Remote transmission request: data frame" "RTR: data frame" "RTR"
2378315-2378346 can: stuff-bit: "Stuff bit: 1" "SB: 1" "SB"
2378283-2378442 can: dlc: "Data length code: 5" "DLC: 5" "DLC"
2378603-2378634 can: stuff-bit: "Stuff bit: 1" "SB: 1" "SB"
2378795-2378826 can: stuff-bit: "Stuff bit: 1" "SB: 1" "SB"
2378443-2378730 can: data: "Data byte 0: 0x00" "DB 0: 0x00" "DB"
2378731-2379018 can: data: "Data byte 1: 0x11" "DB 1: 0x11" "DB"
2379019-2379274 can: data: "Data byte 2: 0x22" "DB 2: 0x22" "DB"
2379275-2379530 can: data: "Data byte 3: 0x33" "DB 3: 0x33" "DB"
2379531-2379786 can: data: "Data byte 4: 0x44" "DB 4: 0x44" "DB"
2379787-2380266 can: crc-sequence: "CRC sequence: 0x66da" "CRC: 0x66da" "CRC"
2380267-2380298 can: crc-delimiter: "CRC delimiter: 1" "CRC d: 1" "CRC d"
2380299-2380330 can: ack-slot: "ACK slot: ACK" "ACK s: ACK" "ACK s"
2380331-2380362 can: ack-delimiter: "ACK delimiter: 1" "ACK d: 1" "ACK d"
2380363-2380586 can: eof: "End of frame" "EOF" "E"
5899382-5899413 can: sof: "Start of frame" "SOF" "S"
5899414-5899765 can: id: "Identifier: 546 (0x222)" "ID: 546 (0x222)" "ID"
5899798-5899829 can: ide: "Identifier extension bit: standard frame" "IDE: standard frame" "IDE"
5899830-5899861 can: reserved-bit: "Reserved bit 0: 0" "RB0: 0" "RB0"
5899766-5899797 can: rtr: "Remote transmission request: data frame" "RTR: data frame" "RTR"
5899894-5899925 can: stuff-bit: "Stuff bit: 1" "SB: 1" "SB"
5899862-5900021 can: dlc: "Data length code: 5" "DLC: 5" "DLC"
5900182-5900213 can: stuff-bit: "Stuff bit: 1" "SB: 1" "SB"
5900374-5900405 can: stuff-bit: "Stuff bit: 1" "SB: 1" "SB"
5900022-5900309 can: data: "Data byte 0: 0x00" "DB 0: 0x00" "DB"
5900310-5900597 can: data: "Data byte 1: 0x11" "DB 1: 0x11" "DB"
5900598-5900853 can: data: "Data byte 2: 0x22" "DB 2: 0x22" "DB"
5900854-5901109 can: data: "Data byte 3: 0x33" "DB 3: 0x33" "DB"
5901110-5901365 can: data: "Data byte 4: 0x44" "DB 4: 0x44" "DB"
5901366-5901845 can: crc-sequence: "CRC sequence: 0x66da" "CRC: 0x66da" "CRC"
5901846-5901877 can: crc-delimiter: "CRC delimiter: 1" "CRC d: 1" "CRC d"
5901878-5901909 can: ack-slot: "ACK slot: ACK" "ACK s: ACK" "ACK s"
5901910-5901941 can: ack-delimiter: "ACK delimiter: 1" "ACK d: 1" "ACK d"
5901942-5902165 can: eof: "End of frame" "EOF" "E"
8332496-8332527 can: sof: "Start of frame" "SOF" "S"
8332528-8332879 can: id: "Identifier: 546 (0x222)" "ID: 546 (0x222)" "ID"
8332912-8332943 can: ide: "Identifier extension bit: standard frame" "IDE: standard frame" "IDE"
8332944-8332975 can: reserved-bit: "Reserved bit 0: 0" "RB0: 0" "RB0"
8332880-8332911 can: rtr: "Remote transmission request: data frame" "RTR: data frame" "RTR"
8333008-8333039 can: stuff-bit: "Stuff bit: 1" "SB: 1" "SB"
8332976-8333135 can: dlc: "Data length code: 5" "DLC: 5" "DLC"
8333296-8333327 can: stuff-bit: "Stuff bit: 1" "SB: 1" "SB"
8333488-8333519 can: stuff-bit: "Stuff bit: 1" "SB: 1" "SB"
8333136-8333423 can: data: "Data byte 0: 0x00" "DB 0: 0x00" "DB"
8333424-8333711 can: data: "Data byte 1: 0x11" "DB 1: 0x11" "DB"
8333712-8333967 can: data: "Data byte 2: 0x22" "DB 2: 0x22" "DB"
8333968-8334223 can: data: "Data byte 3: 0x33" "DB 3: 0x33" "DB"
8334224-8334479 can: data: "Data byte 4: 0x44" "DB 4: 0x44" "DB"
8334480-8334959 can: crc-sequence: "CRC sequence: 0x66da" "CRC: 0x66da" "CRC"
8334960-8334991 can: crc-delimiter: "CRC delimiter: 1" "CRC d: 1" "CRC d"
8334992-8335023 can: ack-slot: "ACK slot: ACK" "ACK s: ACK" "ACK s"
8335024-8335055 can: ack-delimiter: "ACK delimiter: 1" "ACK d: 1" "ACK d"
8335056-8335279 can: eof: "End of frame" "EOF" "E"
