2063052-2063083 can: bit: "0"
2063052-2063083 can: sof: "Start of frame" "SOF" "S"
2063084-2063115 can: bit: "1"
2063116-2063147 can: bit: "0"
2063148-2063179 can: bit: "0"
2063180-2063211 can: bit: "0"
2063212-2063243 can: bit: "1"
2063244-2063275 can: bit: "0"
2063276-2063307 can: bit: "0"
2063308-2063339 can: bit: "1"
2063340-2063371 can: bit: "0"
2063372-2063403 can: bit: "0"
2063404-2063435 can: bit: "0"
2063084-2063435 can: id: "Identifier: 1096 (0x448)" "ID: 1096 (0x448)" "ID"
2063436-2063467 can: bit: "1"
2063468-2063499 can: bit: "1"
2063468-2063499 can: ide: "Identifier extension bit: extended frame" "IDE: extended frame" "IDE"
2063500-2063531 can: bit: "1"
2063532-2063563 can: bit: "0"
2063564-2063595 can: bit: "0"
2063596-2063627 can: bit: "0"
2063628-2063659 can: bit: "1"
2063660-2063691 can: bit: "1"
2063692-2063723 can: bit: "0"
2063724-2063755 can: bit: "0"
2063756-2063787 can: bit: "1"
2063788-2063819 can: bit: "1"
2063820-2063851 can: bit: "0"
2063852-2063883 can: bit: "1"
2063884-2063915 can: bit: "0"
2063916-2063947 can: bit: "0"
2063948-2063979 can: bit: "0"
2063980-2064011 can: bit: "1"
2064012-2064043 can: bit: "0"
2064044-2064075 can: bit: "0"
2063500-2064075 can: ext-id: "Extended Identifier: 144196 (0x23344)" "Extended ID: 144196 (0x23344)" "Extended ID" "EID"
2063500-2064075 can: full-id: "Full Identifier: 287454020 (0x11223344)" "Full ID: 287454020 (0x11223344)" "Full ID" "FID"
2063436-2063467 can: srr: "Substitute remote request: 1" "SRR: 1" "SRR"
2064076-2064107 can: bit: "0"
2064076-2064107 can: rtr: "Remote transmission request: data frame" "RTR: data frame" "RTR"
2064108-2064139 can: bit: "0"
2064108-2064139 can: reserved-bit: "Reserved bit 1: 0" "RB1: 0" "RB1"
2064140-2064171 can: bit: "0"
2064140-2064171 can: reserved-bit: "Reserved bit 0: 0" "RB0: 0" "RB0"
2064172-2064203 can: stuff-bit: "1"
2064204-2064235 can: bit: "0"
2064236-2064267 can: bit: "1"
2064268-2064299 can: bit: "1"
2064300-2064331 can: bit: "1"
2064204-2064331 can: dlc: "Data length code: 7" "DLC: 7" "DLC"
2064332-2064363 can: bit: "0"
2064364-2064395 can: bit: "0"
2064396-2064427 can: bit: "0"
2064428-2064459 can: bit: "0"
2064460-2064491 can: bit: "0"
2064492-2064523 can: stuff-bit: "1"
2064524-2064555 can: bit: "0"
2064556-2064587 can: bit: "0"
2064588-2064619 can: bit: "0"
2064620-2064651 can: bit: "0"
2064652-2064683 can: bit: "0"
2064684-2064715 can: stuff-bit: "1"
2064716-2064747 can: bit: "0"
2064748-2064779 can: bit: "1"
2064781-2064812 can: bit: "0"
2064813-2064844 can: bit: "0"
2064845-2064876 can: bit: "0"
2064877-2064908 can: bit: "1"
2064909-2064940 can: bit: "0"
2064941-2064972 can: bit: "0"
2064973-2065004 can: bit: "1"
2065005-2065036 can: bit: "0"
2065037-2065068 can: bit: "0"
2065069-2065100 can: bit: "0"
2065101-2065132 can: bit: "1"
2065133-2065164 can: bit: "0"
2065165-2065196 can: bit: "0"
2065197-2065228 can: bit: "0"
2065229-2065260 can: bit: "1"
2065261-2065292 can: bit: "1"
2065293-2065324 can: bit: "0"
2065325-2065356 can: bit: "0"
2065357-2065388 can: bit: "1"
2065389-2065420 can: bit: "1"
2065421-2065452 can: bit: "0"
2065453-2065484 can: bit: "1"
2065485-2065516 can: bit: "0"
2065517-2065548 can: bit: "0"
2065549-2065580 can: bit: "0"
2065581-2065612 can: bit: "1"
2065613-2065644 can: bit: "0"
2065645-2065676 can: bit: "0"
2065677-2065708 can: bit: "0"
2065709-2065740 can: bit: "1"
2065741-2065772 can: bit: "0"
2065773-2065804 can: bit: "1"
2065805-2065836 can: bit: "0"
2065837-2065868 can: bit: "1"
2065869-2065900 can: bit: "0"
2065901-2065932 can: bit: "1"
2065933-2065964 can: bit: "0"
2065965-2065996 can: bit: "1"
2065997-2066028 can: bit: "1"
2066029-2066060 can: bit: "0"
2066061-2066092 can: bit: "0"
2066093-2066124 can: bit: "1"
2066125-2066156 can: bit: "1"
2066157-2066188 can: bit: "0"
2064332-2064619 can: data: "Data byte 0: 0x00" "DB 0: 0x00" "DB"
2064620-2064908 can: data: "Data byte 1: 0x11" "DB 1: 0x11" "DB"
2064909-2065164 can: data: "Data byte 2: 0x22" "DB 2: 0x22" "DB"
2065165-2065420 can: data: "Data byte 3: 0x33" "DB 3: 0x33" "DB"
2065421-2065676 can: data: "Data byte 4: 0x44" "DB 4: 0x44" "DB"
2065677-2065932 can: data: "Data byte 5: 0x55" "DB 5: 0x55" "DB"
2065933-2066188 can: data: "Data byte 6: 0x66" "DB 6: 0x66" "DB"
2066189-2066220 can: bit: "0"
2066221-2066252 can: bit: "0"
2066253-2066284 can: bit: "0"
2066285-2066316 can: bit: "1"
2066317-2066348 can: bit: "1"
2066349-2066380 can: bit: "0"
2066381-2066412 can: bit: "1"
2066413-2066444 can: bit: "0"
2066445-2066476 can: bit: "0"
2066477-2066508 can: bit: "1"
2066509-2066540 can: bit: "1"
2066541-2066572 can: bit: "0"
2066573-2066604 can: bit: "0"
2066605-2066636 can: bit: "0"
2066637-2066668 can: bit: "0"
2066189-2066668 can: crc-sequence: "CRC-15 sequence: 0x0d30" "CRC-15: 0x0d30" "CRC-15"
2066669-2066700 can: bit: "1"
2066669-2066700 can: crc-delimiter: "CRC delimiter: 1" "CRC d: 1" "CRC d"
2066700-2066731 can: bit: "0"
2066700-2066731 can: ack-slot: "ACK slot: ACK" "ACK s: ACK" "ACK s"
2066732-2066763 can: bit: "1"
2066732-2066763 can: ack-delimiter: "ACK delimiter: 1" "ACK d: 1" "ACK d"
2066764-2066795 can: bit: "1"
2066796-2066827 can: bit: "1"
2066828-2066859 can: bit: "1"
2066860-2066891 can: bit: "1"
2066892-2066923 can: bit: "1"
2066924-2066955 can: bit: "1"
2066956-2066987 can: bit: "1"
2066764-2066987 can: eof: "End of frame" "EOF" "E"
4239978-4240009 can: bit: "0"
4239978-4240009 can: sof: "Start of frame" "SOF" "S"
4240010-4240041 can: bit: "1"
4240042-4240073 can: bit: "0"
4240074-4240105 can: bit: "0"
4240106-4240137 can: bit: "0"
4240138-4240169 can: bit: "1"
4240170-4240201 can: bit: "0"
4240202-4240233 can: bit: "0"
4240234-4240265 can: bit: "1"
4240266-4240297 can: bit: "0"
4240298-4240329 can: bit: "0"
4240330-4240361 can: bit: "0"
4240010-4240361 can: id: "Identifier: 1096 (0x448)" "ID: 1096 (0x448)" "ID"
4240362-4240393 can: bit: "1"
4240394-4240425 can: bit: "1"
4240394-4240425 can: ide: "Identifier extension bit: extended frame" "IDE: extended frame" "IDE"
4240426-4240457 can: bit: "1"
4240458-4240489 can: bit: "0"
4240490-4240521 can: bit: "0"
4240522-4240553 can: bit: "0"
4240554-4240585 can: bit: "1"
4240586-4240617 can: bit: "1"
4240618-4240649 can: bit: "0"
4240650-4240681 can: bit: "0"
4240682-4240713 can: bit: "1"
4240714-4240745 can: bit: "1"
4240746-4240777 can: bit: "0"
4240778-4240809 can: bit: "1"
4240810-4240841 can: bit: "0"
4240842-4240873 can: bit: "0"
4240874-4240905 can: bit: "0"
4240906-4240937 can: bit: "1"
4240938-4240969 can: bit: "0"
4240970-4241001 can: bit: "0"
4240426-4241001 can: ext-id: "Extended Identifier: 144196 (0x23344)" "Extended ID: 144196 (0x23344)" "Extended ID" "EID"
4240426-4241001 can: full-id: "Full Identifier: 287454020 (0x11223344)" "Full ID: 287454020 (0x11223344)" "Full ID" "FID"
4240362-4240393 can: srr: "Substitute remote request: 1" "SRR: 1" "SRR"
4241002-4241033 can: bit: "0"
4241002-4241033 can: rtr: "Remote transmission request: data frame" "RTR: data frame" "RTR"
4241034-4241065 can: bit: "0"
4241034-4241065 can: reserved-bit: "Reserved bit 1: 0" "RB1: 0" "RB1"
4241066-4241097 can: bit: "0"
4241066-4241097 can: reserved-bit: "Reserved bit 0: 0" "RB0: 0" "RB0"
4241098-4241129 can: stuff-bit: "1"
4241130-4241161 can: bit: "0"
4241162-4241193 can: bit: "1"
4241194-4241225 can: bit: "1"
4241226-4241257 can: bit: "1"
4241130-4241257 can: dlc: "Data length code: 7" "DLC: 7" "DLC"
4241258-4241289 can: bit: "0"
4241290-4241321 can: bit: "0"
4241322-4241353 can: bit: "0"
4241354-4241385 can: bit: "0"
4241386-4241417 can: bit: "0"
4241418-4241449 can: stuff-bit: "1"
4241450-4241481 can: bit: "0"
4241482-4241513 can: bit: "0"
4241514-4241545 can: bit: "0"
4241546-4241577 can: bit: "0"
4241578-4241609 can: bit: "0"
4241610-4241641 can: stuff-bit: "1"
4241643-4241674 can: bit: "0"
4241675-4241706 can: bit: "1"
4241707-4241738 can: bit: "0"
4241739-4241770 can: bit: "0"
4241771-4241802 can: bit: "0"
4241803-4241834 can: bit: "1"
4241835-4241866 can: bit: "0"
4241867-4241898 can: bit: "0"
4241899-4241930 can: bit: "1"
4241931-4241962 can: bit: "0"
4241963-4241994 can: bit: "0"
4241995-4242026 can: bit: "0"
4242027-4242058 can: bit: "1"
4242059-4242090 can: bit: "0"
4242091-4242122 can: bit: "0"
4242123-4242154 can: bit: "0"
4242155-4242186 can: bit: "1"
4242187-4242218 can: bit: "1"
4242219-4242250 can: bit: "0"
4242251-4242282 can: bit: "0"
4242283-4242314 can: bit: "1"
4242315-4242346 can: bit: "1"
4242347-4242378 can: bit: "0"
4242379-4242410 can: bit: "1"
4242411-4242442 can: bit: "0"
4242443-4242474 can: bit: "0"
4242475-4242506 can: bit: "0"
4242507-4242538 can: bit: "1"
4242539-4242570 can: bit: "0"
4242571-4242602 can: bit: "0"
4242603-4242634 can: bit: "0"
4242635-4242666 can: bit: "1"
4242667-4242698 can: bit: "0"
4242699-4242730 can: bit: "1"
4242731-4242762 can: bit: "0"
4242763-4242794 can: bit: "1"
4242795-4242826 can: bit: "0"
4242827-4242858 can: bit: "1"
4242859-4242890 can: bit: "0"
4242891-4242922 can: bit: "1"
4242923-4242954 can: bit: "1"
4242955-4242986 can: bit: "0"
4242987-4243018 can: bit: "0"
4243019-4243050 can: bit: "1"
4243051-4243082 can: bit: "1"
4243083-4243114 can: bit: "0"
4241258-4241545 can: data: "Data byte 0: 0x00" "DB 0: 0x00" "DB"
4241546-4241834 can: data: "Data byte 1: 0x11" "DB 1: 0x11" "DB"
4241835-4242090 can: data: "Data byte 2: 0x22" "DB 2: 0x22" "DB"
4242091-4242346 can: data: "Data byte 3: 0x33" "DB 3: 0x33" "DB"
4242347-4242602 can: data: "Data byte 4: 0x44" "DB 4: 0x44" "DB"
4242603-4242858 can: data: "Data byte 5: 0x55" "DB 5: 0x55" "DB"
4242859-4243114 can: data: "Data byte 6: 0x66" "DB 6: 0x66" "DB"
4243115-4243146 can: bit: "0"
4243147-4243178 can: bit: "0"
4243179-4243210 can: bit: "0"
4243211-4243242 can: bit: "1"
4243243-4243274 can: bit: "1"
4243275-4243306 can: bit: "0"
4243307-4243338 can: bit: "1"
4243339-4243370 can: bit: "0"
4243371-4243402 can: bit: "0"
4243403-4243434 can: bit: "1"
4243435-4243466 can: bit: "1"
4243467-4243498 can: bit: "0"
4243499-4243530 can: bit: "0"
4243531-4243562 can: bit: "0"
4243563-4243594 can: bit: "0"
4243115-4243594 can: crc-sequence: "CRC-15 sequence: 0x0d30" "CRC-15: 0x0d30" "CRC-15"
4243595-4243626 can: bit: "1"
4243595-4243626 can: crc-delimiter: "CRC delimiter: 1" "CRC d: 1" "CRC d"
4243627-4243658 can: bit: "0"
4243627-4243658 can: ack-slot: "ACK slot: ACK" "ACK s: ACK" "ACK s"
4243659-4243690 can: bit: "1"
4243659-4243690 can: ack-delimiter: "ACK delimiter: 1" "ACK d: 1" "ACK d"
4243691-4243722 can: bit: "1"
4243723-4243754 can: bit: "1"
4243755-4243786 can: bit: "1"
4243787-4243818 can: bit: "1"
4243819-4243850 can: bit: "1"
4243851-4243882 can: bit: "1"
4243883-4243914 can: bit: "1"
4243691-4243914 can: eof: "End of frame" "EOF" "E"
6160843-6160874 can: bit: "0"
6160843-6160874 can: sof: "Start of frame" "SOF" "S"
6160875-6160906 can: bit: "1"
6160907-6160938 can: bit: "0"
6160939-6160970 can: bit: "0"
6160971-6161002 can: bit: "0"
6161003-6161034 can: bit: "1"
6161036-6161067 can: bit: "0"
6161068-6161099 can: bit: "0"
6161100-6161131 can: bit: "1"
6161132-6161163 can: bit: "0"
6161164-6161195 can: bit: "0"
6161196-6161227 can: bit: "0"
6160875-6161227 can: id: "Identifier: 1096 (0x448)" "ID: 1096 (0x448)" "ID"
6161228-6161259 can: bit: "1"
6161260-6161291 can: bit: "1"
6161260-6161291 can: ide: "Identifier extension bit: extended frame" "IDE: extended frame" "IDE"
6161292-6161323 can: bit: "1"
6161324-6161355 can: bit: "0"
6161356-6161387 can: bit: "0"
6161388-6161419 can: bit: "0"
6161420-6161451 can: bit: "1"
6161452-6161483 can: bit: "1"
6161484-6161515 can: bit: "0"
6161516-6161547 can: bit: "0"
6161548-6161579 can: bit: "1"
6161580-6161611 can: bit: "1"
6161612-6161643 can: bit: "0"
6161644-6161675 can: bit: "1"
6161676-6161707 can: bit: "0"
6161708-6161739 can: bit: "0"
6161740-6161771 can: bit: "0"
6161772-6161803 can: bit: "1"
6161804-6161835 can: bit: "0"
6161836-6161867 can: bit: "0"
6161292-6161867 can: ext-id: "Extended Identifier: 144196 (0x23344)" "Extended ID: 144196 (0x23344)" "Extended ID" "EID"
6161292-6161867 can: full-id: "Full Identifier: 287454020 (0x11223344)" "Full ID: 287454020 (0x11223344)" "Full ID" "FID"
6161228-6161259 can: srr: "Substitute remote request: 1" "SRR: 1" "SRR"
6161868-6161899 can: bit: "0"
6161868-6161899 can: rtr: "Remote transmission request: data frame" "RTR: data frame" "RTR"
6161900-6161931 can: bit: "0"
6161900-6161931 can: reserved-bit: "Reserved bit 1: 0" "RB1: 0" "RB1"
6161932-6161963 can: bit: "0"
6161932-6161963 can: reserved-bit: "Reserved bit 0: 0" "RB0: 0" "RB0"
6161964-6161995 can: stuff-bit: "1"
6161996-6162027 can: bit: "0"
6162028-6162059 can: bit: "1"
6162060-6162091 can: bit: "1"
6162092-6162123 can: bit: "1"
6161996-6162123 can: dlc: "Data length code: 7" "DLC: 7" "DLC"
6162124-6162155 can: bit: "0"
6162156-6162187 can: bit: "0"
6162188-6162219 can: bit: "0"
6162220-6162251 can: bit: "0"
6162252-6162283 can: bit: "0"
6162284-6162315 can: stuff-bit: "1"
6162316-6162347 can: bit: "0"
6162348-6162379 can: bit: "0"
6162380-6162411 can: bit: "0"
6162412-6162443 can: bit: "0"
6162444-6162475 can: bit: "0"
6162476-6162507 can: stuff-bit: "1"
6162508-6162539 can: bit: "0"
6162540-6162571 can: bit: "1"
6162572-6162603 can: bit: "0"
6162604-6162635 can: bit: "0"
6162636-6162667 can: bit: "0"
6162668-6162699 can: bit: "1"
6162700-6162731 can: bit: "0"
6162732-6162763 can: bit: "0"
6162764-6162795 can: bit: "1"
6162796-6162827 can: bit: "0"
6162828-6162859 can: bit: "0"
6162860-6162891 can: bit: "0"
6162892-6162923 can: bit: "1"
6162924-6162955 can: bit: "0"
6162956-6162987 can: bit: "0"
6162988-6163019 can: bit: "0"
6163020-6163051 can: bit: "1"
6163052-6163083 can: bit: "1"
6163085-6163116 can: bit: "0"
6163117-6163148 can: bit: "0"
6163149-6163180 can: bit: "1"
6163181-6163212 can: bit: "1"
6163213-6163244 can: bit: "0"
6163245-6163276 can: bit: "1"
6163277-6163308 can: bit: "0"
6163309-6163340 can: bit: "0"
6163341-6163372 can: bit: "0"
6163373-6163404 can: bit: "1"
6163405-6163436 can: bit: "0"
6163437-6163468 can: bit: "0"
6163469-6163500 can: bit: "0"
6163501-6163532 can: bit: "1"
6163533-6163564 can: bit: "0"
6163565-6163596 can: bit: "1"
6163597-6163628 can: bit: "0"
6163629-6163660 can: bit: "1"
6163661-6163692 can: bit: "0"
6163693-6163724 can: bit: "1"
6163725-6163756 can: bit: "0"
6163757-6163788 can: bit: "1"
6163789-6163820 can: bit: "1"
6163821-6163852 can: bit: "0"
6163853-6163884 can: bit: "0"
6163885-6163916 can: bit: "1"
6163917-6163948 can: bit: "1"
6163949-6163980 can: bit: "0"
6162124-6162411 can: data: "Data byte 0: 0x00" "DB 0: 0x00" "DB"
6162412-6162699 can: data: "Data byte 1: 0x11" "DB 1: 0x11" "DB"
6162700-6162955 can: data: "Data byte 2: 0x22" "DB 2: 0x22" "DB"
6162956-6163212 can: data: "Data byte 3: 0x33" "DB 3: 0x33" "DB"
6163213-6163468 can: data: "Data byte 4: 0x44" "DB 4: 0x44" "DB"
6163469-6163724 can: data: "Data byte 5: 0x55" "DB 5: 0x55" "DB"
6163725-6163980 can: data: "Data byte 6: 0x66" "DB 6: 0x66" "DB"
6163981-6164012 can: bit: "0"
6164013-6164044 can: bit: "0"
6164045-6164076 can: bit: "0"
6164077-6164108 can: bit: "1"
6164109-6164140 can: bit: "1"
6164141-6164172 can: bit: "0"
6164173-6164204 can: bit: "1"
6164205-6164236 can: bit: "0"
6164237-6164268 can: bit: "0"
6164269-6164300 can: bit: "1"
6164301-6164332 can: bit: "1"
6164333-6164364 can: bit: "0"
6164365-6164396 can: bit: "0"
6164397-6164428 can: bit: "0"
6164429-6164460 can: bit: "0"
6163981-6164460 can: crc-sequence: "CRC-15 sequence: 0x0d30" "CRC-15: 0x0d30" "CRC-15"
6164461-6164492 can: bit: "1"
6164461-6164492 can: crc-delimiter: "CRC delimiter: 1" "CRC d: 1" "CRC d"
6164491-6164522 can: bit: "0"
6164491-6164522 can: ack-slot: "ACK slot: ACK" "ACK s: ACK" "ACK s"
6164523-6164554 can: bit: "1"
6164523-6164554 can: ack-delimiter: "ACK delimiter: 1" "ACK d: 1" "ACK d"
6164555-6164586 can: bit: "1"
6164587-6164618 can: bit: "1"
6164619-6164650 can: bit: "1"
6164651-6164682 can: bit: "1"
6164683-6164714 can: bit: "1"
6164715-6164746 can: bit: "1"
6164747-6164778 can: bit: "1"
6164555-6164778 can: eof: "End of frame" "EOF" "E"
8209739-8209770 can: bit: "0"
8209739-8209770 can: sof: "Start of frame" "SOF" "S"
8209771-8209802 can: bit: "1"
8209803-8209834 can: bit: "0"
8209835-8209866 can: bit: "0"
8209867-8209898 can: bit: "0"
8209899-8209930 can: bit: "1"
8209931-8209962 can: bit: "0"
8209963-8209994 can: bit: "0"
8209995-8210026 can: bit: "1"
8210027-8210058 can: bit: "0"
8210059-8210090 can: bit: "0"
8210091-8210122 can: bit: "0"
8209771-8210122 can: id: "Identifier: 1096 (0x448)" "ID: 1096 (0x448)" "ID"
8210123-8210154 can: bit: "1"
8210155-8210186 can: bit: "1"
8210155-8210186 can: ide: "Identifier extension bit: extended frame" "IDE: extended frame" "IDE"
8210187-8210218 can: bit: "1"
8210220-8210251 can: bit: "0"
8210252-8210283 can: bit: "0"
8210284-8210315 can: bit: "0"
8210316-8210347 can: bit: "1"
8210348-8210379 can: bit: "1"
8210380-8210411 can: bit: "0"
8210412-8210443 can: bit: "0"
8210444-8210475 can: bit: "1"
8210476-8210507 can: bit: "1"
8210508-8210539 can: bit: "0"
8210540-8210571 can: bit: "1"
8210572-8210603 can: bit: "0"
8210604-8210635 can: bit: "0"
8210636-8210667 can: bit: "0"
8210668-8210699 can: bit: "1"
8210700-8210731 can: bit: "0"
8210732-8210763 can: bit: "0"
8210187-8210763 can: ext-id: "Extended Identifier: 144196 (0x23344)" "Extended ID: 144196 (0x23344)" "Extended ID" "EID"
8210187-8210763 can: full-id: "Full Identifier: 287454020 (0x11223344)" "Full ID: 287454020 (0x11223344)" "Full ID" "FID"
8210123-8210154 can: srr: "Substitute remote request: 1" "SRR: 1" "SRR"
8210764-8210795 can: bit: "0"
8210764-8210795 can: rtr: "Remote transmission request: data frame" "RTR: data frame" "RTR"
8210796-8210827 can: bit: "0"
8210796-8210827 can: reserved-bit: "Reserved bit 1: 0" "RB1: 0" "RB1"
8210828-8210859 can: bit: "0"
8210828-8210859 can: reserved-bit: "Reserved bit 0: 0" "RB0: 0" "RB0"
8210860-8210891 can: stuff-bit: "1"
8210892-8210923 can: bit: "0"
8210924-8210955 can: bit: "1"
8210956-8210987 can: bit: "1"
8210988-8211019 can: bit: "1"
8210892-8211019 can: dlc: "Data length code: 7" "DLC: 7" "DLC"
8211020-8211051 can: bit: "0"
8211052-8211083 can: bit: "0"
8211084-8211115 can: bit: "0"
8211116-8211147 can: bit: "0"
8211148-8211179 can: bit: "0"
8211180-8211211 can: stuff-bit: "1"
8211212-8211243 can: bit: "0"
8211244-8211275 can: bit: "0"
8211276-8211307 can: bit: "0"
8211308-8211339 can: bit: "0"
8211340-8211371 can: bit: "0"
8211372-8211403 can: stuff-bit: "1"
8211404-8211435 can: bit: "0"
8211436-8211467 can: bit: "1"
8211468-8211499 can: bit: "0"
8211500-8211531 can: bit: "0"
8211532-8211563 can: bit: "0"
8211564-8211595 can: bit: "1"
8211596-8211627 can: bit: "0"
8211628-8211659 can: bit: "0"
8211660-8211691 can: bit: "1"
8211692-8211723 can: bit: "0"
8211724-8211755 can: bit: "0"
8211756-8211787 can: bit: "0"
8211788-8211819 can: bit: "1"
8211820-8211851 can: bit: "0"
8211852-8211883 can: bit: "0"
8211884-8211915 can: bit: "0"
8211916-8211947 can: bit: "1"
8211948-8211979 can: bit: "1"
8211980-8212011 can: bit: "0"
8212012-8212043 can: bit: "0"
8212044-8212075 can: bit: "1"
8212076-8212107 can: bit: "1"
8212108-8212139 can: bit: "0"
8212140-8212171 can: bit: "1"
8212173-8212204 can: bit: "0"
8212205-8212236 can: bit: "0"
8212237-8212268 can: bit: "0"
8212269-8212300 can: bit: "1"
8212301-8212332 can: bit: "0"
8212333-8212364 can: bit: "0"
8212365-8212396 can: bit: "0"
8212397-8212428 can: bit: "1"
8212429-8212460 can: bit: "0"
8212461-8212492 can: bit: "1"
8212493-8212524 can: bit: "0"
8212525-8212556 can: bit: "1"
8212557-8212588 can: bit: "0"
8212589-8212620 can: bit: "1"
8212621-8212652 can: bit: "0"
8212653-8212684 can: bit: "1"
8212685-8212716 can: bit: "1"
8212717-8212748 can: bit: "0"
8212749-8212780 can: bit: "0"
8212781-8212812 can: bit: "1"
8212813-8212844 can: bit: "1"
8212845-8212876 can: bit: "0"
8211020-8211307 can: data: "Data byte 0: 0x00" "DB 0: 0x00" "DB"
8211308-8211595 can: data: "Data byte 1: 0x11" "DB 1: 0x11" "DB"
8211596-8211851 can: data: "Data byte 2: 0x22" "DB 2: 0x22" "DB"
8211852-8212107 can: data: "Data byte 3: 0x33" "DB 3: 0x33" "DB"
8212108-8212364 can: data: "Data byte 4: 0x44" "DB 4: 0x44" "DB"
8212365-8212620 can: data: "Data byte 5: 0x55" "DB 5: 0x55" "DB"
8212621-8212876 can: data: "Data byte 6: 0x66" "DB 6: 0x66" "DB"
8212877-8212908 can: bit: "0"
8212909-8212940 can: bit: "0"
8212941-8212972 can: bit: "0"
8212973-8213004 can: bit: "1"
8213005-8213036 can: bit: "1"
8213037-8213068 can: bit: "0"
8213069-8213100 can: bit: "1"
8213101-8213132 can: bit: "0"
8213133-8213164 can: bit: "0"
8213165-8213196 can: bit: "1"
8213197-8213228 can: bit: "1"
8213229-8213260 can: bit: "0"
8213261-8213292 can: bit: "0"
8213293-8213324 can: bit: "0"
8213325-8213356 can: bit: "0"
8212877-8213356 can: crc-sequence: "CRC-15 sequence: 0x0d30" "CRC-15: 0x0d30" "CRC-15"
8213357-8213388 can: bit: "1"
8213357-8213388 can: crc-delimiter: "CRC delimiter: 1" "CRC d: 1" "CRC d"
8213388-8213419 can: bit: "0"
8213388-8213419 can: ack-slot: "ACK slot: ACK" "ACK s: ACK" "ACK s"
8213420-8213451 can: bit: "1"
8213420-8213451 can: ack-delimiter: "ACK delimiter: 1" "ACK d: 1" "ACK d"
8213452-8213483 can: bit: "1"
8213484-8213515 can: bit: "1"
8213516-8213547 can: bit: "1"
8213548-8213579 can: bit: "1"
8213580-8213611 can: bit: "1"
8213612-8213643 can: bit: "1"
8213644-8213675 can: bit: "1"
8213452-8213675 can: eof: "End of frame" "EOF" "E"
10578855-10578886 can: bit: "0"
10578855-10578886 can: sof: "Start of frame" "SOF" "S"
10578887-10578918 can: bit: "1"
10578919-10578950 can: bit: "0"
10578951-10578982 can: bit: "0"
10578983-10579014 can: bit: "0"
10579015-10579046 can: bit: "1"
10579047-10579078 can: bit: "0"
10579079-10579110 can: bit: "0"
10579111-10579142 can: bit: "1"
10579143-10579174 can: bit: "0"
10579175-10579206 can: bit: "0"
10579207-10579238 can: bit: "0"
10578887-10579238 can: id: "Identifier: 1096 (0x448)" "ID: 1096 (0x448)" "ID"
10579239-10579270 can: bit: "1"
10579271-10579302 can: bit: "1"
10579271-10579302 can: ide: "Identifier extension bit: extended frame" "IDE: extended frame" "IDE"
10579303-10579334 can: bit: "1"
10579335-10579366 can: bit: "0"
10579367-10579398 can: bit: "0"
10579399-10579430 can: bit: "0"
10579431-10579462 can: bit: "1"
10579463-10579494 can: bit: "1"
10579495-10579526 can: bit: "0"
10579527-10579558 can: bit: "0"
10579559-10579590 can: bit: "1"
10579591-10579622 can: bit: "1"
10579623-10579654 can: bit: "0"
10579655-10579686 can: bit: "1"
10579687-10579718 can: bit: "0"
10579719-10579750 can: bit: "0"
10579751-10579782 can: bit: "0"
10579783-10579814 can: bit: "1"
10579815-10579846 can: bit: "0"
10579847-10579878 can: bit: "0"
10579303-10579878 can: ext-id: "Extended Identifier: 144196 (0x23344)" "Extended ID: 144196 (0x23344)" "Extended ID" "EID"
10579303-10579878 can: full-id: "Full Identifier: 287454020 (0x11223344)" "Full ID: 287454020 (0x11223344)" "Full ID" "FID"
10579239-10579270 can: srr: "Substitute remote request: 1" "SRR: 1" "SRR"
10579879-10579910 can: bit: "0"
10579879-10579910 can: rtr: "Remote transmission request: data frame" "RTR: data frame" "RTR"
10579911-10579942 can: bit: "0"
10579911-10579942 can: reserved-bit: "Reserved bit 1: 0" "RB1: 0" "RB1"
10579943-10579974 can: bit: "0"
10579943-10579974 can: reserved-bit: "Reserved bit 0: 0" "RB0: 0" "RB0"
10579975-10580006 can: stuff-bit: "1"
10580007-10580038 can: bit: "0"
10580039-10580070 can: bit: "1"
10580071-10580102 can: bit: "1"
10580103-10580134 can: bit: "1"
10580007-10580134 can: dlc: "Data length code: 7" "DLC: 7" "DLC"
10580135-10580166 can: bit: "0"
10580167-10580198 can: bit: "0"
10580199-10580230 can: bit: "0"
10580231-10580262 can: bit: "0"
10580263-10580294 can: bit: "0"
10580295-10580326 can: stuff-bit: "1"
10580327-10580358 can: bit: "0"
10580359-10580390 can: bit: "0"
10580391-10580422 can: bit: "0"
10580423-10580454 can: bit: "0"
10580455-10580486 can: bit: "0"
10580487-10580518 can: stuff-bit: "1"
10580520-10580551 can: bit: "0"
10580552-10580583 can: bit: "1"
10580584-10580615 can: bit: "0"
10580616-10580647 can: bit: "0"
10580648-10580679 can: bit: "0"
10580680-10580711 can: bit: "1"
10580712-10580743 can: bit: "0"
10580744-10580775 can: bit: "0"
10580776-10580807 can: bit: "1"
10580808-10580839 can: bit: "0"
10580840-10580871 can: bit: "0"
10580872-10580903 can: bit: "0"
10580904-10580935 can: bit: "1"
10580936-10580967 can: bit: "0"
10580968-10580999 can: bit: "0"
10581000-10581031 can: bit: "0"
10581032-10581063 can: bit: "1"
10581064-10581095 can: bit: "1"
10581096-10581127 can: bit: "0"
10581128-10581159 can: bit: "0"
10581160-10581191 can: bit: "1"
10581192-10581223 can: bit: "1"
10581224-10581255 can: bit: "0"
10581256-10581287 can: bit: "1"
10581288-10581319 can: bit: "0"
10581320-10581351 can: bit: "0"
10581352-10581383 can: bit: "0"
10581384-10581415 can: bit: "1"
10581416-10581447 can: bit: "0"
10581448-10581479 can: bit: "0"
10581480-10581511 can: bit: "0"
10581512-10581543 can: bit: "1"
10581544-10581575 can: bit: "0"
10581576-10581607 can: bit: "1"
10581608-10581639 can: bit: "0"
10581640-10581671 can: bit: "1"
10581672-10581703 can: bit: "0"
10581704-10581735 can: bit: "1"
10581736-10581767 can: bit: "0"
10581768-10581799 can: bit: "1"
10581800-10581831 can: bit: "1"
10581832-10581863 can: bit: "0"
10581864-10581895 can: bit: "0"
10581896-10581927 can: bit: "1"
10581928-10581959 can: bit: "1"
10581960-10581991 can: bit: "0"
10580135-10580422 can: data: "Data byte 0: 0x00" "DB 0: 0x00" "DB"
10580423-10580711 can: data: "Data byte 1: 0x11" "DB 1: 0x11" "DB"
10580712-10580967 can: data: "Data byte 2: 0x22" "DB 2: 0x22" "DB"
10580968-10581223 can: data: "Data byte 3: 0x33" "DB 3: 0x33" "DB"
10581224-10581479 can: data: "Data byte 4: 0x44" "DB 4: 0x44" "DB"
10581480-10581735 can: data: "Data byte 5: 0x55" "DB 5: 0x55" "DB"
10581736-10581991 can: data: "Data byte 6: 0x66" "DB 6: 0x66" "DB"
10581992-10582023 can: bit: "0"
10582024-10582055 can: bit: "0"
10582056-10582087 can: bit: "0"
10582088-10582119 can: bit: "1"
10582120-10582151 can: bit: "1"
10582152-10582183 can: bit: "0"
10582184-10582215 can: bit: "1"
10582216-10582247 can: bit: "0"
10582248-10582279 can: bit: "0"
10582280-10582311 can: bit: "1"
10582312-10582343 can: bit: "1"
10582344-10582375 can: bit: "0"
10582376-10582407 can: bit: "0"
10582408-10582439 can: bit: "0"
10582440-10582471 can: bit: "0"
10581992-10582471 can: crc-sequence: "CRC-15 sequence: 0x0d30" "CRC-15: 0x0d30" "CRC-15"
10582472-10582503 can: bit: "1"
10582472-10582503 can: crc-delimiter: "CRC delimiter: 1" "CRC d: 1" "CRC d"
10582504-10582535 can: bit: "0"
10582504-10582535 can: ack-slot: "ACK slot: ACK" "ACK s: ACK" "ACK s"
10582536-10582567 can: bit: "1"
10582536-10582567 can: ack-delimiter: "ACK delimiter: 1" "ACK d: 1" "ACK d"
10582568-10582599 can: bit: "1"
10582600-10582631 can: bit: "1"
10582632-10582663 can: bit: "1"
10582664-10582695 can: bit: "1"
10582696-10582727 can: bit: "1"
10582728-10582759 can: bit: "1"
10582760-10582791 can: bit: "1"
10582568-10582791 can: eof: "End of frame" "EOF" "E"
