2377803-2377834 can: bit: "0"
2377803-2377834 can: sof: "Start of frame" "SOF" "S"
2377835-2377866 can: bit: "0"
2377867-2377898 can: bit: "1"
2377899-2377930 can: bit: "0"
2377931-2377962 can: bit: "0"
2377963-2377994 can: bit: "0"
2377995-2378026 can: bit: "1"
2378027-2378058 can: bit: "0"
2378059-2378090 can: bit: "0"
2378091-2378122 can: bit: "0"
2378123-2378154 can: bit: "1"
2378155-2378186 can: bit: "0"
2377835-2378186 can: id: "Identifier: 546 (0x222)" "ID: 546 (0x222)" "ID"
2378187-2378218 can: bit: "0"
2378219-2378250 can: bit: "0"
2378219-2378250 can: ide: "Identifier extension bit: standard frame" "IDE: standard frame" "IDE"
2378251-2378282 can: bit: "0"
2378251-2378282 can: reserved-bit: "Reserved bit 0: 0" "RB0: 0" "RB0"
2378187-2378218 can: rtr: "Remote transmission request: data frame" "RTR: data frame" "RTR"
2378283-2378314 can: bit: "0"
2378315-2378346 can: stuff-bit: "1"
2378347-2378378 can: bit: "1"
2378379-2378410 can: bit: "0"
2378411-2378442 can: bit: "1"
2378283-2378442 can: dlc: "Data length code: 5" "DLC: 5" "DLC"
2378443-2378474 can: bit: "0"
2378475-2378506 can: bit: "0"
2378507-2378538 can: bit: "0"
2378539-2378570 can: bit: "0"
2378571-2378602 can: bit: "0"
2378603-2378634 can: stuff-bit: "1"
2378635-2378666 can: bit: "0"
2378667-2378698 can: bit: "0"
2378699-2378730 can: bit: "0"
2378731-2378762 can: bit: "0"
2378763-2378794 can: bit: "0"
2378795-2378826 can: stuff-bit: "1"
2378827-2378858 can: bit: "0"
2378859-2378890 can: bit: "1"
2378891-2378922 can: bit: "0"
2378923-2378954 can: bit: "0"
2378955-2378986 can: bit: "0"
2378987-2379018 can: bit: "1"
2379019-2379050 can: bit: "0"
2379051-2379082 can: bit: "0"
2379083-2379114 can: bit: "1"
2379115-2379146 can: bit: "0"
2379147-2379178 can: bit: "0"
2379179-2379210 can: bit: "0"
2379211-2379242 can: bit: "1"
2379244-2379275 can: bit: "0"
2379276-2379307 can: bit: "0"
2379308-2379339 can: bit: "0"
2379340-2379371 can: bit: "1"
2379372-2379403 can: bit: "1"
2379404-2379435 can: bit: "0"
2379436-2379467 can: bit: "0"
2379468-2379499 can: bit: "1"
2379500-2379531 can: bit: "1"
2379532-2379563 can: bit: "0"
2379564-2379595 can: bit: "1"
2379596-2379627 can: bit: "0"
2379628-2379659 can: bit: "0"
2379660-2379691 can: bit: "0"
2379692-2379723 can: bit: "1"
2379724-2379755 can: bit: "0"
2379756-2379787 can: bit: "0"
2378443-2378730 can: data: "Data byte 0: 0x00" "DB 0: 0x00" "DB"
2378731-2379018 can: data: "Data byte 1: 0x11" "DB 1: 0x11" "DB"
2379019-2379275 can: data: "Data byte 2: 0x22" "DB 2: 0x22" "DB"
2379276-2379531 can: data: "Data byte 3: 0x33" "DB 3: 0x33" "DB"
2379532-2379787 can: data: "Data byte 4: 0x44" "DB 4: 0x44" "DB"
2379788-2379819 can: bit: "1"
2379820-2379851 can: bit: "1"
2379852-2379883 can: bit: "0"
2379884-2379915 can: bit: "0"
2379916-2379947 can: bit: "1"
2379948-2379979 can: bit: "1"
2379980-2380011 can: bit: "0"
2380012-2380043 can: bit: "1"
2380044-2380075 can: bit: "1"
2380076-2380107 can: bit: "0"
2380108-2380139 can: bit: "1"
2380140-2380171 can: bit: "1"
2380172-2380203 can: bit: "0"
2380204-2380235 can: bit: "1"
2380236-2380267 can: bit: "0"
2379788-2380267 can: crc-sequence: "CRC-15 sequence: 0x66da" "CRC-15: 0x66da" "CRC-15"
2380268-2380299 can: bit: "1"
2380268-2380299 can: crc-delimiter: "CRC delimiter: 1" "CRC d: 1" "CRC d"
2380299-2380330 can: bit: "0"
2380299-2380330 can: ack-slot: "ACK slot: ACK" "ACK s: ACK" "ACK s"
2380331-2380362 can: bit: "1"
2380331-2380362 can: ack-delimiter: "ACK delimiter: 1" "ACK d: 1" "ACK d"
2380363-2380394 can: bit: "1"
2380395-2380426 can: bit: "1"
2380427-2380458 can: bit: "1"
2380459-2380490 can: bit: "1"
2380491-2380522 can: bit: "1"
2380523-2380554 can: bit: "1"
2380555-2380586 can: bit: "1"
2380363-2380586 can: eof: "End of frame" "EOF" "E"
5899382-5899413 can: bit: "0"
5899382-5899413 can: sof: "Start of frame" "SOF" "S"
5899414-5899445 can: bit: "0"
5899446-5899477 can: bit: "1"
5899478-5899509 can: bit: "0"
5899510-5899541 can: bit: "0"
5899542-5899573 can: bit: "0"
5899574-5899605 can: bit: "1"
5899606-5899637 can: bit: "0"
5899638-5899669 can: bit: "0"
5899670-5899701 can: bit: "0"
5899702-5899733 can: bit: "1"
5899734-5899765 can: bit: "0"
5899414-5899765 can: id: "Identifier: 546 (0x222)" "ID: 546 (0x222)" "ID"
5899766-5899797 can: bit: "0"
5899798-5899829 can: bit: "0"
5899798-5899829 can: ide: "Identifier extension bit: standard frame" "IDE: standard frame" "IDE"
5899830-5899861 can: bit: "0"
5899830-5899861 can: reserved-bit: "Reserved bit 0: 0" "RB0: 0" "RB0"
5899766-5899797 can: rtr: "Remote transmission request: data frame" "RTR: data frame" "RTR"
5899862-5899893 can: bit: "0"
5899894-5899925 can: stuff-bit: "1"
5899926-5899957 can: bit: "1"
5899958-5899989 can: bit: "0"
5899990-5900021 can: bit: "1"
5899862-5900021 can: dlc: "Data length code: 5" "DLC: 5" "DLC"
5900022-5900053 can: bit: "0"
5900054-5900085 can: bit: "0"
5900086-5900117 can: bit: "0"
5900118-5900149 can: bit: "0"
5900150-5900181 can: bit: "0"
5900182-5900213 can: stuff-bit: "1"
5900214-5900245 can: bit: "0"
5900246-5900277 can: bit: "0"
5900278-5900309 can: bit: "0"
5900310-5900341 can: bit: "0"
5900342-5900373 can: bit: "0"
5900374-5900405 can: stuff-bit: "1"
5900406-5900437 can: bit: "0"
5900438-5900469 can: bit: "1"
5900470-5900501 can: bit: "0"
5900502-5900533 can: bit: "0"
5900534-5900565 can: bit: "0"
5900566-5900597 can: bit: "1"
5900599-5900630 can: bit: "0"
5900631-5900662 can: bit: "0"
5900663-5900694 can: bit: "1"
5900695-5900726 can: bit: "0"
5900727-5900758 can: bit: "0"
5900759-5900790 can: bit: "0"
5900791-5900822 can: bit: "1"
5900823-5900854 can: bit: "0"
5900855-5900886 can: bit: "0"
5900887-5900918 can: bit: "0"
5900919-5900950 can: bit: "1"
5900951-5900982 can: bit: "1"
5900983-5901014 can: bit: "0"
5901015-5901046 can: bit: "0"
5901047-5901078 can: bit: "1"
5901079-5901110 can: bit: "1"
5901111-5901142 can: bit: "0"
5901143-5901174 can: bit: "1"
5901175-5901206 can: bit: "0"
5901207-5901238 can: bit: "0"
5901239-5901270 can: bit: "0"
5901271-5901302 can: bit: "1"
5901303-5901334 can: bit: "0"
5901335-5901366 can: bit: "0"
5900022-5900309 can: data: "Data byte 0: 0x00" "DB 0: 0x00" "DB"
5900310-5900597 can: data: "Data byte 1: 0x11" "DB 1: 0x11" "DB"
5900599-5900854 can: data: "Data byte 2: 0x22" "DB 2: 0x22" "DB"
5900855-5901110 can: data: "Data byte 3: 0x33" "DB 3: 0x33" "DB"
5901111-5901366 can: data: "Data byte 4: 0x44" "DB 4: 0x44" "DB"
5901367-5901398 can: bit: "1"
5901399-5901430 can: bit: "1"
5901431-5901462 can: bit: "0"
5901463-5901494 can: bit: "0"
5901495-5901526 can: bit: "1"
5901527-5901558 can: bit: "1"
5901559-5901590 can: bit: "0"
5901591-5901622 can: bit: "1"
5901623-5901654 can: bit: "1"
5901655-5901686 can: bit: "0"
5901687-5901718 can: bit: "1"
5901719-5901750 can: bit: "1"
5901751-5901782 can: bit: "0"
5901783-5901814 can: bit: "1"
5901815-5901846 can: bit: "0"
5901367-5901846 can: crc-sequence: "CRC-15 sequence: 0x66da" "CRC-15: 0x66da" "CRC-15"
5901847-5901878 can: bit: "1"
5901847-5901878 can: crc-delimiter: "CRC delimiter: 1" "CRC d: 1" "CRC d"
5901878-5901909 can: bit: "0"
5901878-5901909 can: ack-slot: "ACK slot: ACK" "ACK s: ACK" "ACK s"
5901910-5901941 can: bit: "1"
5901910-5901941 can: ack-delimiter: "ACK delimiter: 1" "ACK d: 1" "ACK d"
5901942-5901973 can: bit: "1"
5901974-5902005 can: bit: "1"
5902006-5902037 can: bit: "1"
5902038-5902069 can: bit: "1"
5902070-5902101 can: bit: "1"
5902102-5902133 can: bit: "1"
5902134-5902165 can: bit: "1"
5901942-5902165 can: eof: "End of frame" "EOF" "E"
8332496-8332527 can: bit: "0"
8332496-8332527 can: sof: "Start of frame" "SOF" "S"
8332528-8332559 can: bit: "0"
8332560-8332591 can: bit: "1"
8332592-8332623 can: bit: "0"
8332624-8332655 can: bit: "0"
8332656-8332687 can: bit: "0"
8332688-8332719 can: bit: "1"
8332721-8332752 can: bit: "0"
8332753-8332784 can: bit: "0"
8332785-8332816 can: bit: "0"
8332817-8332848 can: bit: "1"
8332849-8332880 can: bit: "0"
8332528-8332880 can: id: "Identifier: 546 (0x222)" "ID: 546 (0x222)" "ID"
8332881-8332912 can: bit: "0"
8332913-8332944 can: bit: "0"
8332913-8332944 can: ide: "Identifier extension bit: standard frame" "IDE: standard frame" "IDE"
8332945-8332976 can: bit: "0"
8332945-8332976 can: reserved-bit: "Reserved bit 0: 0" "RB0: 0" "RB0"
8332881-8332912 can: rtr: "Remote transmission request: data frame" "RTR: data frame" "RTR"
8332977-8333008 can: bit: "0"
8333009-8333040 can: stuff-bit: "1"
8333041-8333072 can: bit: "1"
8333073-8333104 can: bit: "0"
8333105-8333136 can: bit: "1"
8332977-8333136 can: dlc: "Data length code: 5" "DLC: 5" "DLC"
8333137-8333168 can: bit: "0"
8333169-8333200 can: bit: "0"
8333201-8333232 can: bit: "0"
8333233-8333264 can: bit: "0"
8333265-8333296 can: bit: "0"
8333297-8333328 can: stuff-bit: "1"
8333329-8333360 can: bit: "0"
8333361-8333392 can: bit: "0"
8333393-8333424 can: bit: "0"
8333425-8333456 can: bit: "0"
8333457-8333488 can: bit: "0"
8333489-8333520 can: stuff-bit: "1"
8333521-8333552 can: bit: "0"
8333553-8333584 can: bit: "1"
8333585-8333616 can: bit: "0"
8333617-8333648 can: bit: "0"
8333649-8333680 can: bit: "0"
8333681-8333712 can: bit: "1"
8333713-8333744 can: bit: "0"
8333745-8333776 can: bit: "0"
8333777-8333808 can: bit: "1"
8333809-8333840 can: bit: "0"
8333841-8333872 can: bit: "0"
8333873-8333904 can: bit: "0"
8333905-8333936 can: bit: "1"
8333937-8333968 can: bit: "0"
8333969-8334000 can: bit: "0"
8334001-8334032 can: bit: "0"
8334033-8334064 can: bit: "1"
8334065-8334096 can: bit: "1"
8334097-8334128 can: bit: "0"
8334129-8334160 can: bit: "0"
8334161-8334192 can: bit: "1"
8334193-8334224 can: bit: "1"
8334225-8334256 can: bit: "0"
8334257-8334288 can: bit: "1"
8334289-8334320 can: bit: "0"
8334321-8334352 can: bit: "0"
8334353-8334384 can: bit: "0"
8334385-8334416 can: bit: "1"
8334417-8334448 can: bit: "0"
8334449-8334480 can: bit: "0"
8333137-8333424 can: data: "Data byte 0: 0x00" "DB 0: 0x00" "DB"
8333425-8333712 can: data: "Data byte 1: 0x11" "DB 1: 0x11" "DB"
8333713-8333968 can: data: "Data byte 2: 0x22" "DB 2: 0x22" "DB"
8333969-8334224 can: data: "Data byte 3: 0x33" "DB 3: 0x33" "DB"
8334225-8334480 can: data: "Data byte 4: 0x44" "DB 4: 0x44" "DB"
8334481-8334512 can: bit: "1"
8334513-8334544 can: bit: "1"
8334545-8334576 can: bit: "0"
8334577-8334608 can: bit: "0"
8334609-8334640 can: bit: "1"
8334641-8334672 can: bit: "1"
8334673-8334704 can: bit: "0"
8334705-8334736 can: bit: "1"
8334737-8334768 can: bit: "1"
8334770-8334801 can: bit: "0"
8334802-8334833 can: bit: "1"
8334834-8334865 can: bit: "1"
8334866-8334897 can: bit: "0"
8334898-8334929 can: bit: "1"
8334930-8334961 can: bit: "0"
8334481-8334961 can: crc-sequence: "CRC-15 sequence: 0x66da" "CRC-15: 0x66da" "CRC-15"
8334962-8334993 can: bit: "1"
8334962-8334993 can: crc-delimiter: "CRC delimiter: 1" "CRC d: 1" "CRC d"
8334993-8335024 can: bit: "0"
8334993-8335024 can: ack-slot: "ACK slot: ACK" "ACK s: ACK" "ACK s"
8335025-8335056 can: bit: "1"
8335025-8335056 can: ack-delimiter: "ACK delimiter: 1" "ACK d: 1" "ACK d"
8335057-8335088 can: bit: "1"
8335089-8335120 can: bit: "1"
8335121-8335152 can: bit: "1"
8335153-8335184 can: bit: "1"
8335185-8335216 can: bit: "1"
8335217-8335248 can: bit: "1"
8335249-8335280 can: bit: "1"
8335057-8335280 can: eof: "End of frame" "EOF" "E"
