2063052-2063083 can: sof: "Start of frame" "SOF" "S"
2063084-2063435 can: id: "Identifier: 1096 (0x448)" "ID: 1096 (0x448)" "ID"
2063468-2063499 can: ide: "Identifier extension bit: extended frame" "IDE: extended frame" "IDE"
2063500-2064075 can: ext-id: "Extended Identifier: 144196 (0x23344)" "Extended ID: 144196 (0x23344)" "Extended ID" "EID"
2063500-2064075 can: full-id: "Full Identifier: 287454020 (0x11223344)" "Full ID: 287454020 (0x11223344)" "Full ID" "FID"
2063436-2063467 can: srr: "Substitute remote request: 1" "SRR: 1" "SRR"
2064076-2064107 can: rtr: "Remote transmission request: data frame" "RTR: data frame" "RTR"
2064108-2064139 can: reserved-bit: "Reserved bit 1: 0" "RB1: 0" "RB1"
2064140-2064171 can: reserved-bit: "Reserved bit 0: 0" "RB0: 0" "RB0"
2064172-2064203 can: stuff-bit: "Stuff bit: 1" "SB: 1" "SB"
2064204-2064331 can: dlc: "Data length code: 7" "DLC: 7" "DLC"
2064492-2064523 can: stuff-bit: "Stuff bit: 1" "SB: 1" "SB"
2064684-2064715 can: stuff-bit: "Stuff bit: 1" "SB: 1" "SB"
2064332-2064619 can: data: "Data byte 0: 0x00" "DB 0: 0x00" "DB"
2064620-2064907 can: data: "Data byte 1: 0x11" "DB 1: 0x11" "DB"
2064908-2065163 can: data: "Data byte 2: 0x22" "DB 2: 0x22" "DB"
2065164-2065419 can: data: "Data byte 3: 0x33" "DB 3: 0x33" "DB"
2065420-2065675 can: data: "Data byte 4: 0x44" "DB 4: 0x44" "DB"
2065676-2065931 can: data: "Data byte 5: 0x55" "DB 5: 0x55" "DB"
2065932-2066187 can: data: "Data byte 6: 0x66" "DB 6: 0x66" "DB"
2066188-2066667 can: crc-sequence: "CRC sequence: 0x0d30" "CRC: 0x0d30" "CRC"
2066668-2066699 can: crc-delimiter: "CRC delimiter: 1" "CRC d: 1" "CRC d"
2066700-2066731 can: ack-slot: "ACK slot: ACK" "ACK s: ACK" "ACK s"
2066732-2066763 can: ack-delimiter: "ACK delimiter: 1" "ACK d: 1" "ACK d"
2066764-2066987 can: eof: "End of frame" "EOF" "E"
4239978-4240009 can: sof: "Start of frame" "SOF" "S"
4240010-4240361 can: id: "Identifier: 1096 (0x448)" "ID: 1096 (0x448)" "ID"
4240394-4240425 can: ide: "Identifier extension bit: extended frame" "IDE: extended frame" "IDE"
4240426-4241001 can: ext-id: "Extended Identifier: 144196 (0x23344)" "Extended ID: 144196 (0x23344)" "Extended ID" "EID"
4240426-4241001 can: full-id: "Full Identifier: 287454020 (0x11223344)" "Full ID: 287454020 (0x11223344)" "Full ID" "FID"
4240362-4240393 can: srr: "Substitute remote request: 1" "SRR: 1" "SRR"
4241002-4241033 can: rtr: "Remote transmission request: data frame" "RTR: data frame" "RTR"
4241034-4241065 can: reserved-bit: "Reserved bit 1: 0" "RB1: 0" "RB1"
4241066-4241097 can: reserved-bit: "Reserved bit 0: 0" "RB0: 0" "RB0"
4241098-4241129 can: stuff-bit: "Stuff bit: 1" "SB: 1" "SB"
4241130-4241257 can: dlc: "Data length code: 7" "DLC: 7" "DLC"
4241418-4241449 can: stuff-bit: "Stuff bit: 1" "SB: 1" "SB"
4241610-4241641 can: stuff-bit: "Stuff bit: 1" "SB: 1" "SB"
4241258-4241545 can: data: "Data byte 0: 0x00" "DB 0: 0x00" "DB"
4241546-4241833 can: data: "Data byte 1: 0x11" "DB 1: 0x11" "DB"
4241834-4242089 can: data: "Data byte 2: 0x22" "DB 2: 0x22" "DB"
4242090-4242345 can: data: "Data byte 3: 0x33" "DB 3: 0x33" "DB"
4242346-4242601 can: data: "Data byte 4: 0x44" "DB 4: 0x44" "DB"
4242602-4242857 can: data: "Data byte 5: 0x55" "DB 5: 0x55" "DB"
4242858-4243113 can: data: "Data byte 6: 0x66" "DB 6: 0x66" "DB"
4243114-4243593 can: crc-sequence: "CRC sequence: 0x0d30" "CRC: 0x0d30" "CRC"
4243594-4243625 can: crc-delimiter: "CRC delimiter: 1" "CRC d: 1" "CRC d"
4243626-4243657 can: ack-slot: "ACK slot: ACK" "ACK s: ACK" "ACK s"
4243658-4243689 can: ack-delimiter: "ACK delimiter: 1" "ACK d: 1" "ACK d"
4243690-4243913 can: eof: "End of frame" "EOF" "E"
6160843-6160874 can: sof: "Start of frame" "SOF" "S"
6160875-6161226 can: id: "Identifier: 1096 (0x448)" "ID: 1096 (0x448)" "ID"
6161259-6161290 can: ide: "Identifier extension bit: extended frame" "IDE: extended frame" "IDE"
6161291-6161866 can: ext-id: "Extended Identifier: 144196 (0x23344)" "Extended ID: 144196 (0x23344)" "Extended ID" "EID"
6161291-6161866 can: full-id: "Full Identifier: 287454020 (0x11223344)" "Full ID: 287454020 (0x11223344)" "Full ID" "FID"
6161227-6161258 can: srr: "Substitute remote request: 1" "SRR: 1" "SRR"
6161867-6161898 can: rtr: "Remote transmission request: data frame" "RTR: data frame" "RTR"
6161899-6161930 can: reserved-bit: "Reserved bit 1: 0" "RB1: 0" "RB1"
6161931-6161962 can: reserved-bit: "Reserved bit 0: 0" "RB0: 0" "RB0"
6161963-6161994 can: stuff-bit: "Stuff bit: 1" "SB: 1" "SB"
6161995-6162122 can: dlc: "Data length code: 7" "DLC: 7" "DLC"
6162283-6162314 can: stuff-bit: "Stuff bit: 1" "SB: 1" "SB"
6162475-6162506 can: stuff-bit: "Stuff bit: 1" "SB: 1" "SB"
6162123-6162410 can: data: "Data byte 0: 0x00" "DB 0: 0x00" "DB"
6162411-6162698 can: data: "Data byte 1: 0x11" "DB 1: 0x11" "DB"
6162699-6162954 can: data: "Data byte 2: 0x22" "DB 2: 0x22" "DB"
6162955-6163210 can: data: "Data byte 3: 0x33" "DB 3: 0x33" "DB"
6163211-6163466 can: data: "Data byte 4: 0x44" "DB 4: 0x44" "DB"
6163467-6163722 can: data: "Data byte 5: 0x55" "DB 5: 0x55" "DB"
6163723-6163978 can: data: "Data byte 6: 0x66" "DB 6: 0x66" "DB"
6163979-6164458 can: crc-sequence: "CRC sequence: 0x0d30" "CRC: 0x0d30" "CRC"
6164459-6164490 can: crc-delimiter: "CRC delimiter: 1" "CRC d: 1" "CRC d"
6164491-6164522 can: ack-slot: "ACK slot: ACK" "ACK s: ACK" "ACK s"
6164523-6164554 can: ack-delimiter: "ACK delimiter: 1" "ACK d: 1" "ACK d"
6164555-6164778 can: eof: "End of frame" "EOF" "E"
8209739-8209770 can: sof: "Start of frame" "SOF" "S"
8209771-8210122 can: id: "Identifier: 1096 (0x448)" "ID: 1096 (0x448)" "ID"
8210155-8210186 can: ide: "Identifier extension bit: extended frame" "IDE: extended frame" "IDE"
8210187-8210762 can: ext-id: "Extended Identifier: 144196 (0x23344)" "Extended ID: 144196 (0x23344)" "Extended ID" "EID"
8210187-8210762 can: full-id: "Full Identifier: 287454020 (0x11223344)" "Full ID: 287454020 (0x11223344)" "Full ID" "FID"
8210123-8210154 can: srr: "Substitute remote request: 1" "SRR: 1" "SRR"
8210763-8210794 can: rtr: "Remote transmission request: data frame" "RTR: data frame" "RTR"
8210795-8210826 can: reserved-bit: "Reserved bit 1: 0" "RB1: 0" "RB1"
8210827-8210858 can: reserved-bit: "Reserved bit 0: 0" "RB0: 0" "RB0"
8210859-8210890 can: stuff-bit: "Stuff bit: 1" "SB: 1" "SB"
8210891-8211018 can: dlc: "Data length code: 7" "DLC: 7" "DLC"
8211179-8211210 can: stuff-bit: "Stuff bit: 1" "SB: 1" "SB"
8211371-8211402 can: stuff-bit: "Stuff bit: 1" "SB: 1" "SB"
8211019-8211306 can: data: "Data byte 0: 0x00" "DB 0: 0x00" "DB"
8211307-8211594 can: data: "Data byte 1: 0x11" "DB 1: 0x11" "DB"
8211595-8211850 can: data: "Data byte 2: 0x22" "DB 2: 0x22" "DB"
8211851-8212106 can: data: "Data byte 3: 0x33" "DB 3: 0x33" "DB"
8212107-8212362 can: data: "Data byte 4: 0x44" "DB 4: 0x44" "DB"
8212363-8212618 can: data: "Data byte 5: 0x55" "DB 5: 0x55" "DB"
8212619-8212874 can: data: "Data byte 6: 0x66" "DB 6: 0x66" "DB"
8212875-8213354 can: crc-sequence: "CRC sequence: 0x0d30" "CRC: 0x0d30" "CRC"
8213355-8213386 can: crc-delimiter: "CRC delimiter: 1" "CRC d: 1" "CRC d"
8213387-8213418 can: ack-slot: "ACK slot: ACK" "ACK s: ACK" "ACK s"
8213419-8213450 can: ack-delimiter: "ACK delimiter: 1" "ACK d: 1" "ACK d"
8213451-8213674 can: eof: "End of frame" "EOF" "E"
10578855-10578886 can: sof: "Start of frame" "SOF" "S"
10578887-10579238 can: id: "Identifier: 1096 (0x448)" "ID: 1096 (0x448)" "ID"
10579271-10579302 can: ide: "Identifier extension bit: extended frame" "IDE: extended frame" "IDE"
10579303-10579878 can: ext-id: "Extended Identifier: 144196 (0x23344)" "Extended ID: 144196 (0x23344)" "Extended ID" "EID"
10579303-10579878 can: full-id: "Full Identifier: 287454020 (0x11223344)" "Full ID: 287454020 (0x11223344)" "Full ID" "FID"
10579239-10579270 can: srr: "Substitute remote request: 1" "SRR: 1" "SRR"
10579879-10579910 can: rtr: "Remote transmission request: data frame" "RTR: data frame" "RTR"
10579911-10579942 can: reserved-bit: "Reserved bit 1: 0" "RB1: 0" "RB1"
10579943-10579974 can: reserved-bit: "Reserved bit 0: 0" "RB0: 0" "RB0"
10579975-10580006 can: stuff-bit: "Stuff bit: 1" "SB: 1" "SB"
10580007-10580134 can: dlc: "Data length code: 7" "DLC: 7" "DLC"
10580295-10580326 can: stuff-bit: "Stuff bit: 1" "SB: 1" "SB"
10580487-10580518 can: stuff-bit: "Stuff bit: 1" "SB: 1" "SB"
10580135-10580422 can: data: "Data byte 0: 0x00" "DB 0: 0x00" "DB"
10580423-10580710 can: data: "Data byte 1: 0x11" "DB 1: 0x11" "DB"
10580711-10580966 can: data: "Data byte 2: 0x22" "DB 2: 0x22" "DB"
10580967-10581222 can: data: "Data byte 3: 0x33" "DB 3: 0x33" "DB"
10581223-10581478 can: data: "Data byte 4: 0x44" "DB 4: 0x44" "DB"
10581479-10581734 can: data: "Data byte 5: 0x55" "DB 5: 0x55" "DB"
10581735-10581990 can: data: "Data byte 6: 0x66" "DB 6: 0x66" "DB"
10581991-10582470 can: crc-sequence: "CRC sequence: 0x0d30" "CRC: 0x0d30" "CRC"
10582471-10582502 can: crc-delimiter: "CRC delimiter: 1" "CRC d: 1" "CRC d"
10582503-10582534 can: ack-slot: "ACK slot: ACK" "ACK s: ACK" "ACK s"
10582535-10582566 can: ack-delimiter: "ACK delimiter: 1" "ACK d: 1" "ACK d"
10582567-10582790 can: eof: "End of frame" "EOF" "E"
