2377803-2377834 can: bits: "0"
2377803-2377834 can: sof: "Start of frame" "SOF" "S"
2377835-2377866 can: bits: "0"
2377867-2377898 can: bits: "1"
2377899-2377930 can: bits: "0"
2377931-2377962 can: bits: "0"
2377963-2377994 can: bits: "0"
2377995-2378026 can: bits: "1"
2378027-2378058 can: bits: "0"
2378059-2378090 can: bits: "0"
2378091-2378122 can: bits: "0"
2378123-2378154 can: bits: "1"
2378155-2378186 can: bits: "0"
2377835-2378186 can: id: "Identifier: 546 (0x222)" "ID: 546 (0x222)" "ID"
2378187-2378218 can: bits: "0"
2378219-2378250 can: bits: "0"
2378219-2378250 can: ide: "Identifier extension bit: standard frame" "IDE: standard frame" "IDE"
2378251-2378282 can: bits: "0"
2378251-2378282 can: reserved-bit: "Reserved bit 0: 0" "RB0: 0" "RB0"
2378187-2378218 can: rtr: "Remote transmission request: data frame" "RTR: data frame" "RTR"
2378283-2378314 can: bits: "0"
2378315-2378346 can: bits: "1"
2378315-2378346 can: stuff-bit: "Stuff bit: 1" "SB: 1" "SB"
2378347-2378378 can: bits: "1"
2378379-2378410 can: bits: "0"
2378411-2378442 can: bits: "1"
2378283-2378442 can: dlc: "Data length code: 5" "DLC: 5" "DLC"
2378443-2378474 can: bits: "0"
2378475-2378506 can: bits: "0"
2378507-2378538 can: bits: "0"
2378539-2378570 can: bits: "0"
2378571-2378602 can: bits: "0"
2378603-2378634 can: bits: "1"
2378603-2378634 can: stuff-bit: "Stuff bit: 1" "SB: 1" "SB"
2378635-2378666 can: bits: "0"
2378667-2378698 can: bits: "0"
2378699-2378730 can: bits: "0"
2378731-2378762 can: bits: "0"
2378763-2378794 can: bits: "0"
2378795-2378826 can: bits: "1"
2378795-2378826 can: stuff-bit: "Stuff bit: 1" "SB: 1" "SB"
2378827-2378858 can: bits: "0"
2378859-2378890 can: bits: "1"
2378891-2378922 can: bits: "0"
2378923-2378954 can: bits: "0"
2378955-2378986 can: bits: "0"
2378987-2379018 can: bits: "1"
2379019-2379050 can: bits: "0"
2379051-2379082 can: bits: "0"
2379083-2379114 can: bits: "1"
2379115-2379146 can: bits: "0"
2379147-2379178 can: bits: "0"
2379179-2379210 can: bits: "0"
2379211-2379242 can: bits: "1"
2379243-2379274 can: bits: "0"
2379275-2379306 can: bits: "0"
2379307-2379338 can: bits: "0"
2379339-2379370 can: bits: "1"
2379371-2379402 can: bits: "1"
2379403-2379434 can: bits: "0"
2379435-2379466 can: bits: "0"
2379467-2379498 can: bits: "1"
2379499-2379530 can: bits: "1"
2379531-2379562 can: bits: "0"
2379563-2379594 can: bits: "1"
2379595-2379626 can: bits: "0"
2379627-2379658 can: bits: "0"
2379659-2379690 can: bits: "0"
2379691-2379722 can: bits: "1"
2379723-2379754 can: bits: "0"
2379755-2379786 can: bits: "0"
2378443-2378730 can: data: "Data byte 0: 0x00" "DB 0: 0x00" "DB"
2378731-2379018 can: data: "Data byte 1: 0x11" "DB 1: 0x11" "DB"
2379019-2379274 can: data: "Data byte 2: 0x22" "DB 2: 0x22" "DB"
2379275-2379530 can: data: "Data byte 3: 0x33" "DB 3: 0x33" "DB"
2379531-2379786 can: data: "Data byte 4: 0x44" "DB 4: 0x44" "DB"
2379787-2379818 can: bits: "1"
2379819-2379850 can: bits: "1"
2379851-2379882 can: bits: "0"
2379883-2379914 can: bits: "0"
2379915-2379946 can: bits: "1"
2379947-2379978 can: bits: "1"
2379979-2380010 can: bits: "0"
2380011-2380042 can: bits: "1"
2380043-2380074 can: bits: "1"
2380075-2380106 can: bits: "0"
2380107-2380138 can: bits: "1"
2380139-2380170 can: bits: "1"
2380171-2380202 can: bits: "0"
2380203-2380234 can: bits: "1"
2380235-2380266 can: bits: "0"
2379787-2380266 can: crc-sequence: "CRC sequence: 0x66da" "CRC: 0x66da" "CRC"
2380267-2380298 can: bits: "1"
2380267-2380298 can: crc-delimiter: "CRC delimiter: 1" "CRC d: 1" "CRC d"
2380299-2380330 can: bits: "0"
2380299-2380330 can: ack-slot: "ACK slot: ACK" "ACK s: ACK" "ACK s"
2380331-2380362 can: bits: "1"
2380331-2380362 can: ack-delimiter: "ACK delimiter: 1" "ACK d: 1" "ACK d"
2380363-2380394 can: bits: "1"
2380395-2380426 can: bits: "1"
2380427-2380458 can: bits: "1"
2380459-2380490 can: bits: "1"
2380491-2380522 can: bits: "1"
2380523-2380554 can: bits: "1"
2380555-2380586 can: bits: "1"
2380363-2380586 can: eof: "End of frame" "EOF" "E"
5899382-5899413 can: bits: "0"
5899382-5899413 can: sof: "Start of frame" "SOF" "S"
5899414-5899445 can: bits: "0"
5899446-5899477 can: bits: "1"
5899478-5899509 can: bits: "0"
5899510-5899541 can: bits: "0"
5899542-5899573 can: bits: "0"
5899574-5899605 can: bits: "1"
5899606-5899637 can: bits: "0"
5899638-5899669 can: bits: "0"
5899670-5899701 can: bits: "0"
5899702-5899733 can: bits: "1"
5899734-5899765 can: bits: "0"
5899414-5899765 can: id: "Identifier: 546 (0x222)" "ID: 546 (0x222)" "ID"
5899766-5899797 can: bits: "0"
5899798-5899829 can: bits: "0"
5899798-5899829 can: ide: "Identifier extension bit: standard frame" "IDE: standard frame" "IDE"
5899830-5899861 can: bits: "0"
5899830-5899861 can: reserved-bit: "Reserved bit 0: 0" "RB0: 0" "RB0"
5899766-5899797 can: rtr: "Remote transmission request: data frame" "RTR: data frame" "RTR"
5899862-5899893 can: bits: "0"
5899894-5899925 can: bits: "1"
5899894-5899925 can: stuff-bit: "Stuff bit: 1" "SB: 1" "SB"
5899926-5899957 can: bits: "1"
5899958-5899989 can: bits: "0"
5899990-5900021 can: bits: "1"
5899862-5900021 can: dlc: "Data length code: 5" "DLC: 5" "DLC"
5900022-5900053 can: bits: "0"
5900054-5900085 can: bits: "0"
5900086-5900117 can: bits: "0"
5900118-5900149 can: bits: "0"
5900150-5900181 can: bits: "0"
5900182-5900213 can: bits: "1"
5900182-5900213 can: stuff-bit: "Stuff bit: 1" "SB: 1" "SB"
5900214-5900245 can: bits: "0"
5900246-5900277 can: bits: "0"
5900278-5900309 can: bits: "0"
5900310-5900341 can: bits: "0"
5900342-5900373 can: bits: "0"
5900374-5900405 can: bits: "1"
5900374-5900405 can: stuff-bit: "Stuff bit: 1" "SB: 1" "SB"
5900406-5900437 can: bits: "0"
5900438-5900469 can: bits: "1"
5900470-5900501 can: bits: "0"
5900502-5900533 can: bits: "0"
5900534-5900565 can: bits: "0"
5900566-5900597 can: bits: "1"
5900598-5900629 can: bits: "0"
5900630-5900661 can: bits: "0"
5900662-5900693 can: bits: "1"
5900694-5900725 can: bits: "0"
5900726-5900757 can: bits: "0"
5900758-5900789 can: bits: "0"
5900790-5900821 can: bits: "1"
5900822-5900853 can: bits: "0"
5900854-5900885 can: bits: "0"
5900886-5900917 can: bits: "0"
5900918-5900949 can: bits: "1"
5900950-5900981 can: bits: "1"
5900982-5901013 can: bits: "0"
5901014-5901045 can: bits: "0"
5901046-5901077 can: bits: "1"
5901078-5901109 can: bits: "1"
5901110-5901141 can: bits: "0"
5901142-5901173 can: bits: "1"
5901174-5901205 can: bits: "0"
5901206-5901237 can: bits: "0"
5901238-5901269 can: bits: "0"
5901270-5901301 can: bits: "1"
5901302-5901333 can: bits: "0"
5901334-5901365 can: bits: "0"
5900022-5900309 can: data: "Data byte 0: 0x00" "DB 0: 0x00" "DB"
5900310-5900597 can: data: "Data byte 1: 0x11" "DB 1: 0x11" "DB"
5900598-5900853 can: data: "Data byte 2: 0x22" "DB 2: 0x22" "DB"
5900854-5901109 can: data: "Data byte 3: 0x33" "DB 3: 0x33" "DB"
5901110-5901365 can: data: "Data byte 4: 0x44" "DB 4: 0x44" "DB"
5901366-5901397 can: bits: "1"
5901398-5901429 can: bits: "1"
5901430-5901461 can: bits: "0"
5901462-5901493 can: bits: "0"
5901494-5901525 can: bits: "1"
5901526-5901557 can: bits: "1"
5901558-5901589 can: bits: "0"
5901590-5901621 can: bits: "1"
5901622-5901653 can: bits: "1"
5901654-5901685 can: bits: "0"
5901686-5901717 can: bits: "1"
5901718-5901749 can: bits: "1"
5901750-5901781 can: bits: "0"
5901782-5901813 can: bits: "1"
5901814-5901845 can: bits: "0"
5901366-5901845 can: crc-sequence: "CRC sequence: 0x66da" "CRC: 0x66da" "CRC"
5901846-5901877 can: bits: "1"
5901846-5901877 can: crc-delimiter: "CRC delimiter: 1" "CRC d: 1" "CRC d"
5901878-5901909 can: bits: "0"
5901878-5901909 can: ack-slot: "ACK slot: ACK" "ACK s: ACK" "ACK s"
5901910-5901941 can: bits: "1"
5901910-5901941 can: ack-delimiter: "ACK delimiter: 1" "ACK d: 1" "ACK d"
5901942-5901973 can: bits: "1"
5901974-5902005 can: bits: "1"
5902006-5902037 can: bits: "1"
5902038-5902069 can: bits: "1"
5902070-5902101 can: bits: "1"
5902102-5902133 can: bits: "1"
5902134-5902165 can: bits: "1"
5901942-5902165 can: eof: "End of frame" "EOF" "E"
8332496-8332527 can: bits: "0"
8332496-8332527 can: sof: "Start of frame" "SOF" "S"
8332528-8332559 can: bits: "0"
8332560-8332591 can: bits: "1"
8332592-8332623 can: bits: "0"
8332624-8332655 can: bits: "0"
8332656-8332687 can: bits: "0"
8332688-8332719 can: bits: "1"
8332720-8332751 can: bits: "0"
8332752-8332783 can: bits: "0"
8332784-8332815 can: bits: "0"
8332816-8332847 can: bits: "1"
8332848-8332879 can: bits: "0"
8332528-8332879 can: id: "Identifier: 546 (0x222)" "ID: 546 (0x222)" "ID"
8332880-8332911 can: bits: "0"
8332912-8332943 can: bits: "0"
8332912-8332943 can: ide: "Identifier extension bit: standard frame" "IDE: standard frame" "IDE"
8332944-8332975 can: bits: "0"
8332944-8332975 can: reserved-bit: "Reserved bit 0: 0" "RB0: 0" "RB0"
8332880-8332911 can: rtr: "Remote transmission request: data frame" "RTR: data frame" "RTR"
8332976-8333007 can: bits: "0"
8333008-8333039 can: bits: "1"
8333008-8333039 can: stuff-bit: "Stuff bit: 1" "SB: 1" "SB"
8333040-8333071 can: bits: "1"
8333072-8333103 can: bits: "0"
8333104-8333135 can: bits: "1"
8332976-8333135 can: dlc: "Data length code: 5" "DLC: 5" "DLC"
8333136-8333167 can: bits: "0"
8333168-8333199 can: bits: "0"
8333200-8333231 can: bits: "0"
8333232-8333263 can: bits: "0"
8333264-8333295 can: bits: "0"
8333296-8333327 can: bits: "1"
8333296-8333327 can: stuff-bit: "Stuff bit: 1" "SB: 1" "SB"
8333328-8333359 can: bits: "0"
8333360-8333391 can: bits: "0"
8333392-8333423 can: bits: "0"
8333424-8333455 can: bits: "0"
8333456-8333487 can: bits: "0"
8333488-8333519 can: bits: "1"
8333488-8333519 can: stuff-bit: "Stuff bit: 1" "SB: 1" "SB"
8333520-8333551 can: bits: "0"
8333552-8333583 can: bits: "1"
8333584-8333615 can: bits: "0"
8333616-8333647 can: bits: "0"
8333648-8333679 can: bits: "0"
8333680-8333711 can: bits: "1"
8333712-8333743 can: bits: "0"
8333744-8333775 can: bits: "0"
8333776-8333807 can: bits: "1"
8333808-8333839 can: bits: "0"
8333840-8333871 can: bits: "0"
8333872-8333903 can: bits: "0"
8333904-8333935 can: bits: "1"
8333936-8333967 can: bits: "0"
8333968-8333999 can: bits: "0"
8334000-8334031 can: bits: "0"
8334032-8334063 can: bits: "1"
8334064-8334095 can: bits: "1"
8334096-8334127 can: bits: "0"
8334128-8334159 can: bits: "0"
8334160-8334191 can: bits: "1"
8334192-8334223 can: bits: "1"
8334224-8334255 can: bits: "0"
8334256-8334287 can: bits: "1"
8334288-8334319 can: bits: "0"
8334320-8334351 can: bits: "0"
8334352-8334383 can: bits: "0"
8334384-8334415 can: bits: "1"
8334416-8334447 can: bits: "0"
8334448-8334479 can: bits: "0"
8333136-8333423 can: data: "Data byte 0: 0x00" "DB 0: 0x00" "DB"
8333424-8333711 can: data: "Data byte 1: 0x11" "DB 1: 0x11" "DB"
8333712-8333967 can: data: "Data byte 2: 0x22" "DB 2: 0x22" "DB"
8333968-8334223 can: data: "Data byte 3: 0x33" "DB 3: 0x33" "DB"
8334224-8334479 can: data: "Data byte 4: 0x44" "DB 4: 0x44" "DB"
8334480-8334511 can: bits: "1"
8334512-8334543 can: bits: "1"
8334544-8334575 can: bits: "0"
8334576-8334607 can: bits: "0"
8334608-8334639 can: bits: "1"
8334640-8334671 can: bits: "1"
8334672-8334703 can: bits: "0"
8334704-8334735 can: bits: "1"
8334736-8334767 can: bits: "1"
8334768-8334799 can: bits: "0"
8334800-8334831 can: bits: "1"
8334832-8334863 can: bits: "1"
8334864-8334895 can: bits: "0"
8334896-8334927 can: bits: "1"
8334928-8334959 can: bits: "0"
8334480-8334959 can: crc-sequence: "CRC sequence: 0x66da" "CRC: 0x66da" "CRC"
8334960-8334991 can: bits: "1"
8334960-8334991 can: crc-delimiter: "CRC delimiter: 1" "CRC d: 1" "CRC d"
8334992-8335023 can: bits: "0"
8334992-8335023 can: ack-slot: "ACK slot: ACK" "ACK s: ACK" "ACK s"
8335024-8335055 can: bits: "1"
8335024-8335055 can: ack-delimiter: "ACK delimiter: 1" "ACK d: 1" "ACK d"
8335056-8335087 can: bits: "1"
8335088-8335119 can: bits: "1"
8335120-8335151 can: bits: "1"
8335152-8335183 can: bits: "1"
8335184-8335215 can: bits: "1"
8335216-8335247 can: bits: "1"
8335248-8335279 can: bits: "1"
8335056-8335279 can: eof: "End of frame" "EOF" "E"
