44221-44222 can: sof: "Start of frame" "SOF" "S"
44241-44242 can: stuff-bit: "Stuff bit: 0" "SB: 0" "SB"
44223-44246 can: id: "Identifier: 638 (0x27e)" "ID: 638 (0x27e)" "ID"
44249-44250 can: ide: "Identifier extension bit: extended frame" "IDE: extended frame" "IDE"
44261-44262 can: stuff-bit: "Stuff bit: 1" "SB: 1" "SB"
44283-44284 can: stuff-bit: "Stuff bit: 1" "SB: 1" "SB"
44251-44290 can: ext-id: "Extended Identifier: 256 (0x100)" "Extended ID: 256 (0x100)" "Extended ID" "EID"
44251-44290 can: full-id: "Full Identifier: 167248128 (0x9f80100)" "Full ID: 167248128 (0x9f80100)" "Full ID" "FID"
44247-44248 can: srr: "Substitute remote request: 1" "SRR: 1" "SRR"
44291-44292 can: rtr: "Remote transmission request: data frame" "RTR: data frame" "RTR"
44293-44294 can: reserved-bit: "Reserved bit 1: 0" "RB1: 0" "RB1"
44295-44296 can: stuff-bit: "Stuff bit: 1" "SB: 1" "SB"
44297-44298 can: reserved-bit: "Reserved bit 0: 0" "RB0: 0" "RB0"
44299-44306 can: dlc: "Data length code: 8" "DLC: 8" "DLC"
44387-44388 can: stuff-bit: "Stuff bit: 1" "SB: 1" "SB"
44307-44322 can: data: "Data byte 0: 0xaa" "DB 0: 0xaa" "DB"
44323-44338 can: data: "Data byte 1: 0xb0" "DB 1: 0xb0" "DB"
44339-44354 can: data: "Data byte 2: 0xc5" "DB 2: 0xc5" "DB"
44355-44370 can: data: "Data byte 3: 0x13" "DB 3: 0x13" "DB"
44371-44386 can: data: "Data byte 4: 0xa0" "DB 4: 0xa0" "DB"
44389-44404 can: data: "Data byte 5: 0x2d" "DB 5: 0x2d" "DB"
44405-44420 can: data: "Data byte 6: 0x44" "DB 6: 0x44" "DB"
44421-44436 can: data: "Data byte 7: 0xc6" "DB 7: 0xc6" "DB"
44445-44446 can: stuff-bit: "Stuff bit: 1" "SB: 1" "SB"
44437-44468 can: crc-sequence: "CRC sequence: 0x01ae" "CRC: 0x01ae" "CRC"
44469-44470 can: crc-delimiter: "CRC delimiter: 1" "CRC d: 1" "CRC d"
44471-44472 can: ack-slot: "ACK slot: NACK" "ACK s: NACK" "ACK s"
44473-44474 can: ack-delimiter: "ACK delimiter: 1" "ACK d: 1" "ACK d"
44475-44488 can: eof: "End of frame" "EOF" "E"
94220-94221 can: sof: "Start of frame" "SOF" "S"
94240-94241 can: stuff-bit: "Stuff bit: 0" "SB: 0" "SB"
94222-94245 can: id: "Identifier: 638 (0x27e)" "ID: 638 (0x27e)" "ID"
94248-94249 can: ide: "Identifier extension bit: extended frame" "IDE: extended frame" "IDE"
94260-94261 can: stuff-bit: "Stuff bit: 1" "SB: 1" "SB"
94282-94283 can: stuff-bit: "Stuff bit: 1" "SB: 1" "SB"
94250-94289 can: ext-id: "Extended Identifier: 256 (0x100)" "Extended ID: 256 (0x100)" "Extended ID" "EID"
94250-94289 can: full-id: "Full Identifier: 167248128 (0x9f80100)" "Full ID: 167248128 (0x9f80100)" "Full ID" "FID"
94246-94247 can: srr: "Substitute remote request: 1" "SRR: 1" "SRR"
94290-94291 can: rtr: "Remote transmission request: data frame" "RTR: data frame" "RTR"
94292-94293 can: reserved-bit: "Reserved bit 1: 0" "RB1: 0" "RB1"
94294-94295 can: stuff-bit: "Stuff bit: 1" "SB: 1" "SB"
94296-94297 can: reserved-bit: "Reserved bit 0: 0" "RB0: 0" "RB0"
94298-94305 can: dlc: "Data length code: 8" "DLC: 8" "DLC"
94386-94387 can: stuff-bit: "Stuff bit: 1" "SB: 1" "SB"
94306-94321 can: data: "Data byte 0: 0xaa" "DB 0: 0xaa" "DB"
94322-94337 can: data: "Data byte 1: 0xb0" "DB 1: 0xb0" "DB"
94338-94353 can: data: "Data byte 2: 0xc5" "DB 2: 0xc5" "DB"
94354-94369 can: data: "Data byte 3: 0x13" "DB 3: 0x13" "DB"
94370-94385 can: data: "Data byte 4: 0xa0" "DB 4: 0xa0" "DB"
94388-94403 can: data: "Data byte 5: 0x2d" "DB 5: 0x2d" "DB"
94404-94419 can: data: "Data byte 6: 0x44" "DB 6: 0x44" "DB"
94420-94435 can: data: "Data byte 7: 0xc6" "DB 7: 0xc6" "DB"
94436-94465 can: crc-sequence: "CRC sequence: 0x226b" "CRC: 0x226b" "CRC"
94466-94467 can: crc-delimiter: "CRC delimiter: 1" "CRC d: 1" "CRC d"
94468-94469 can: ack-slot: "ACK slot: ACK" "ACK s: ACK" "ACK s"
94470-94471 can: ack-delimiter: "ACK delimiter: 1" "ACK d: 1" "ACK d"
94472-94485 can: eof: "End of frame" "EOF" "E"
106732-106733 can: sof: "Start of frame" "SOF" "S"
106734-106755 can: id: "Identifier: 634 (0x27a)" "ID: 634 (0x27a)" "ID"
106758-106759 can: ide: "Identifier extension bit: extended frame" "IDE: extended frame" "IDE"
106770-106771 can: stuff-bit: "Stuff bit: 1" "SB: 1" "SB"
106790-106791 can: stuff-bit: "Stuff bit: 1" "SB: 1" "SB"
106760-106799 can: ext-id: "Extended Identifier: 512 (0x200)" "Extended ID: 512 (0x200)" "Extended ID" "EID"
106760-106799 can: full-id: "Full Identifier: 166199808 (0x9e80200)" "Full ID: 166199808 (0x9e80200)" "Full ID" "FID"
106756-106757 can: srr: "Substitute remote request: 1" "SRR: 1" "SRR"
106800-106801 can: rtr: "Remote transmission request: data frame" "RTR: data frame" "RTR"
106802-106803 can: stuff-bit: "Stuff bit: 1" "SB: 1" "SB"
106804-106805 can: reserved-bit: "Reserved bit 1: 0" "RB1: 0" "RB1"
106806-106807 can: reserved-bit: "Reserved bit 0: 0" "RB0: 0" "RB0"
106808-106815 can: dlc: "Data length code: 8" "DLC: 8" "DLC"
106820-106821 can: stuff-bit: "Stuff bit: 1" "SB: 1" "SB"
106840-106841 can: stuff-bit: "Stuff bit: 0" "SB: 0" "SB"
106892-106893 can: stuff-bit: "Stuff bit: 1" "SB: 1" "SB"
106912-106913 can: stuff-bit: "Stuff bit: 1" "SB: 1" "SB"
106930-106931 can: stuff-bit: "Stuff bit: 0" "SB: 0" "SB"
106942-106943 can: stuff-bit: "Stuff bit: 0" "SB: 0" "SB"
106954-106955 can: stuff-bit: "Stuff bit: 0" "SB: 0" "SB"
106816-106833 can: data: "Data byte 0: 0x23" "DB 0: 0x23" "DB"
106834-106851 can: data: "Data byte 1: 0xfc" "DB 1: 0xfc" "DB"
106852-106867 can: data: "Data byte 2: 0x47" "DB 2: 0x47" "DB"
106868-106883 can: data: "Data byte 3: 0x0a" "DB 3: 0x0a" "DB"
106884-106901 can: data: "Data byte 4: 0x03" "DB 4: 0x03" "DB"
106902-106919 can: data: "Data byte 5: 0x00" "DB 5: 0x00" "DB"
106920-106937 can: data: "Data byte 6: 0xff" "DB 6: 0xff" "DB"
106938-106957 can: data: "Data byte 7: 0xff" "DB 7: 0xff" "DB"
106958-106987 can: crc-sequence: "CRC sequence: 0x592d" "CRC: 0x592d" "CRC"
106988-106989 can: crc-delimiter: "CRC delimiter: 1" "CRC d: 1" "CRC d"
106990-106991 can: ack-slot: "ACK slot: ACK" "ACK s: ACK" "ACK s"
106992-106993 can: ack-delimiter: "ACK delimiter: 1" "ACK d: 1" "ACK d"
106994-107007 can: eof: "End of frame" "EOF" "E"
144218-144219 can: sof: "Start of frame" "SOF" "S"
144238-144239 can: stuff-bit: "Stuff bit: 0" "SB: 0" "SB"
144220-144243 can: id: "Identifier: 638 (0x27e)" "ID: 638 (0x27e)" "ID"
144246-144247 can: ide: "Identifier extension bit: extended frame" "IDE: extended frame" "IDE"
144258-144259 can: stuff-bit: "Stuff bit: 1" "SB: 1" "SB"
144248-144285 can: ext-id: "Extended Identifier: 264 (0x108)" "Extended ID: 264 (0x108)" "Extended ID" "EID"
144248-144285 can: full-id: "Full Identifier: 167248136 (0x9f80108)" "Full ID: 167248136 (0x9f80108)" "Full ID" "FID"
144244-144245 can: srr: "Substitute remote request: 1" "SRR: 1" "SRR"
144286-144287 can: rtr: "Remote transmission request: data frame" "RTR: data frame" "RTR"
144288-144289 can: reserved-bit: "Reserved bit 1: 0" "RB1: 0" "RB1"
144290-144291 can: stuff-bit: "Stuff bit: 1" "SB: 1" "SB"
144292-144293 can: reserved-bit: "Reserved bit 0: 0" "RB0: 0" "RB0"
144294-144301 can: dlc: "Data length code: 8" "DLC: 8" "DLC"
144382-144383 can: stuff-bit: "Stuff bit: 1" "SB: 1" "SB"
144302-144317 can: data: "Data byte 0: 0xaa" "DB 0: 0xaa" "DB"
144318-144333 can: data: "Data byte 1: 0xb0" "DB 1: 0xb0" "DB"
144334-144349 can: data: "Data byte 2: 0xc5" "DB 2: 0xc5" "DB"
144350-144365 can: data: "Data byte 3: 0x13" "DB 3: 0x13" "DB"
144366-144381 can: data: "Data byte 4: 0xa0" "DB 4: 0xa0" "DB"
144384-144399 can: data: "Data byte 5: 0x2d" "DB 5: 0x2d" "DB"
144400-144415 can: data: "Data byte 6: 0x44" "DB 6: 0x44" "DB"
144416-144431 can: data: "Data byte 7: 0xc6" "DB 7: 0xc6" "DB"
144432-144461 can: crc-sequence: "CRC sequence: 0x226b" "CRC: 0x226b" "CRC"
144462-144463 can: crc-delimiter: "CRC delimiter: 1" "CRC d: 1" "CRC d"
144464-144465 can: ack-slot: "ACK slot: ACK" "ACK s: ACK" "ACK s"
144466-144467 can: ack-delimiter: "ACK delimiter: 1" "ACK d: 1" "ACK d"
144468-144481 can: eof: "End of frame" "EOF" "E"
154072-154073 can: sof: "Start of frame" "SOF" "S"
154092-154093 can: stuff-bit: "Stuff bit: 0" "SB: 0" "SB"
154074-154097 can: id: "Identifier: 892 (0x37c)" "ID: 892 (0x37c)" "ID"
154100-154101 can: ide: "Identifier extension bit: extended frame" "IDE: extended frame" "IDE"
154112-154113 can: stuff-bit: "Stuff bit: 1" "SB: 1" "SB"
154126-154127 can: stuff-bit: "Stuff bit: 1" "SB: 1" "SB"
154138-154139 can: stuff-bit: "Stuff bit: 1" "SB: 1" "SB"
154102-154143 can: ext-id: "Extended Identifier: 4096 (0x1000)" "Extended ID: 4096 (0x1000)" "Extended ID" "EID"
154102-154143 can: full-id: "Full Identifier: 233836544 (0xdf01000)" "Full ID: 233836544 (0xdf01000)" "Full ID" "FID"
154098-154099 can: srr: "Substitute remote request: 1" "SRR: 1" "SRR"
154144-154145 can: rtr: "Remote transmission request: data frame" "RTR: data frame" "RTR"
154146-154147 can: reserved-bit: "Reserved bit 1: 0" "RB1: 0" "RB1"
154148-154149 can: reserved-bit: "Reserved bit 0: 0" "RB0: 0" "RB0"
154150-154151 can: stuff-bit: "Stuff bit: 1" "SB: 1" "SB"
154152-154159 can: dlc: "Data length code: 8" "DLC: 8" "DLC"
154164-154165 can: stuff-bit: "Stuff bit: 1" "SB: 1" "SB"
154214-154215 can: stuff-bit: "Stuff bit: 1" "SB: 1" "SB"
154224-154225 can: stuff-bit: "Stuff bit: 0" "SB: 0" "SB"
154246-154247 can: stuff-bit: "Stuff bit: 1" "SB: 1" "SB"
154274-154275 can: stuff-bit: "Stuff bit: 1" "SB: 1" "SB"
154160-154177 can: data: "Data byte 0: 0x24" "DB 0: 0x24" "DB"
154178-154193 can: data: "Data byte 1: 0xf0" "DB 1: 0xf0" "DB"
154194-154209 can: data: "Data byte 2: 0x98" "DB 2: 0x98" "DB"
154210-154229 can: data: "Data byte 3: 0x3e" "DB 3: 0x3e" "DB"
154230-154245 can: data: "Data byte 4: 0xa0" "DB 4: 0xa0" "DB"
154248-154263 can: data: "Data byte 5: 0xef" "DB 5: 0xef" "DB"
154264-154281 can: data: "Data byte 6: 0x03" "DB 6: 0x03" "DB"
154282-154297 can: data: "Data byte 7: 0x1c" "DB 7: 0x1c" "DB"
154298-154327 can: crc-sequence: "CRC sequence: 0x21ac" "CRC: 0x21ac" "CRC"
154328-154329 can: crc-delimiter: "CRC delimiter: 1" "CRC d: 1" "CRC d"
154330-154331 can: ack-slot: "ACK slot: ACK" "ACK s: ACK" "ACK s"
154332-154333 can: ack-delimiter: "ACK delimiter: 1" "ACK d: 1" "ACK d"
154334-154347 can: eof: "End of frame" "EOF" "E"
155230-155231 can: sof: "Start of frame" "SOF" "S"
155250-155251 can: stuff-bit: "Stuff bit: 0" "SB: 0" "SB"
155232-155255 can: id: "Identifier: 1662 (0x67e)" "ID: 1662 (0x67e)" "ID"
155258-155259 can: ide: "Identifier extension bit: extended frame" "IDE: extended frame" "IDE"
155272-155273 can: stuff-bit: "Stuff bit: 1" "SB: 1" "SB"
155260-155297 can: ext-id: "Extended Identifier: 131840 (0x20300)" "Extended ID: 131840 (0x20300)" "Extended ID" "EID"
155260-155297 can: full-id: "Full Identifier: 435815168 (0x19fa0300)" "Full ID: 435815168 (0x19fa0300)" "Full ID" "FID"
155256-155257 can: srr: "Substitute remote request: 1" "SRR: 1" "SRR"
155298-155299 can: rtr: "Remote transmission request: data frame" "RTR: data frame" "RTR"
155300-155301 can: reserved-bit: "Reserved bit 1: 0" "RB1: 0" "RB1"
155302-155303 can: stuff-bit: "Stuff bit: 1" "SB: 1" "SB"
155304-155305 can: reserved-bit: "Reserved bit 0: 0" "RB0: 0" "RB0"
155306-155313 can: dlc: "Data length code: 8" "DLC: 8" "DLC"
155318-155319 can: stuff-bit: "Stuff bit: 1" "SB: 1" "SB"
155374-155375 can: stuff-bit: "Stuff bit: 1" "SB: 1" "SB"
155386-155387 can: stuff-bit: "Stuff bit: 1" "SB: 1" "SB"
155410-155411 can: stuff-bit: "Stuff bit: 1" "SB: 1" "SB"
155440-155441 can: stuff-bit: "Stuff bit: 1" "SB: 1" "SB"
155314-155331 can: data: "Data byte 0: 0x24" "DB 0: 0x24" "DB"
155332-155347 can: data: "Data byte 1: 0xd3" "DB 1: 0xd3" "DB"
155348-155363 can: data: "Data byte 2: 0xd3" "DB 2: 0xd3" "DB"
155364-155381 can: data: "Data byte 3: 0x00" "DB 3: 0x00" "DB"
155382-155399 can: data: "Data byte 4: 0x03" "DB 4: 0x03" "DB"
155400-155417 can: data: "Data byte 5: 0x01" "DB 5: 0x01" "DB"
155418-155433 can: data: "Data byte 6: 0x64" "DB 6: 0x64" "DB"
155434-155451 can: data: "Data byte 7: 0x00" "DB 7: 0x00" "DB"
155452-155453 can: stuff-bit: "Stuff bit: 1" "SB: 1" "SB"
155468-155469 can: stuff-bit: "Stuff bit: 1" "SB: 1" "SB"
155454-155485 can: crc-sequence: "CRC sequence: 0x204c" "CRC: 0x204c" "CRC"
155486-155487 can: crc-delimiter: "CRC delimiter: 1" "CRC d: 1" "CRC d"
155488-155489 can: ack-slot: "ACK slot: ACK" "ACK s: ACK" "ACK s"
155490-155491 can: ack-delimiter: "ACK delimiter: 1" "ACK d: 1" "ACK d"
155492-155505 can: eof: "End of frame" "EOF" "E"
156697-156698 can: sof: "Start of frame" "SOF" "S"
156717-156718 can: stuff-bit: "Stuff bit: 0" "SB: 0" "SB"
156699-156722 can: id: "Identifier: 1662 (0x67e)" "ID: 1662 (0x67e)" "ID"
156725-156726 can: ide: "Identifier extension bit: extended frame" "IDE: extended frame" "IDE"
156739-156740 can: stuff-bit: "Stuff bit: 1" "SB: 1" "SB"
156755-156756 can: stuff-bit: "Stuff bit: 1" "SB: 1" "SB"
156727-156766 can: ext-id: "Extended Identifier: 132096 (0x20400)" "Extended ID: 132096 (0x20400)" "Extended ID" "EID"
156727-156766 can: full-id: "Full Identifier: 435815424 (0x19fa0400)" "Full ID: 435815424 (0x19fa0400)" "Full ID" "FID"
156723-156724 can: srr: "Substitute remote request: 1" "SRR: 1" "SRR"
156767-156768 can: stuff-bit: "Stuff bit: 1" "SB: 1" "SB"
156769-156770 can: rtr: "Remote transmission request: data frame" "RTR: data frame" "RTR"
156771-156772 can: reserved-bit: "Reserved bit 1: 0" "RB1: 0" "RB1"
156773-156774 can: reserved-bit: "Reserved bit 0: 0" "RB0: 0" "RB0"
156775-156782 can: dlc: "Data length code: 8" "DLC: 8" "DLC"
156787-156788 can: stuff-bit: "Stuff bit: 1" "SB: 1" "SB"
156799-156800 can: stuff-bit: "Stuff bit: 1" "SB: 1" "SB"
156845-156846 can: stuff-bit: "Stuff bit: 0" "SB: 0" "SB"
156885-156886 can: stuff-bit: "Stuff bit: 0" "SB: 0" "SB"
156783-156802 can: data: "Data byte 0: 0x00" "DB 0: 0x00" "DB"
156803-156818 can: data: "Data byte 1: 0x87" "DB 1: 0x87" "DB"
156819-156834 can: data: "Data byte 2: 0x24" "DB 2: 0x24" "DB"
156835-156852 can: data: "Data byte 3: 0xfd" "DB 3: 0xfd" "DB"
156853-156868 can: data: "Data byte 4: 0x0b" "DB 4: 0x0b" "DB"
156869-156884 can: data: "Data byte 5: 0x1f" "DB 5: 0x1f" "DB"
156887-156902 can: data: "Data byte 6: 0x22" "DB 6: 0x22" "DB"
156903-156918 can: data: "Data byte 7: 0x24" "DB 7: 0x24" "DB"
156919-156948 can: crc-sequence: "CRC sequence: 0x50dd" "CRC: 0x50dd" "CRC"
156949-156950 can: crc-delimiter: "CRC delimiter: 0" "CRC d: 0" "CRC d"
156951-156952 can: ack-slot: "ACK slot: ACK" "ACK s: ACK" "ACK s"
156953-156954 can: ack-delimiter: "ACK delimiter: 1" "ACK d: 1" "ACK d"
156955-156968 can: eof: "End of frame" "EOF" "E"
158198-158199 can: sof: "Start of frame" "SOF" "S"
158218-158219 can: stuff-bit: "Stuff bit: 0" "SB: 0" "SB"
158200-158223 can: id: "Identifier: 1662 (0x67e)" "ID: 1662 (0x67e)" "ID"
158226-158227 can: ide: "Identifier extension bit: extended frame" "IDE: extended frame" "IDE"
158240-158241 can: stuff-bit: "Stuff bit: 1" "SB: 1" "SB"
158256-158257 can: stuff-bit: "Stuff bit: 1" "SB: 1" "SB"
158228-158267 can: ext-id: "Extended Identifier: 132096 (0x20400)" "Extended ID: 132096 (0x20400)" "Extended ID" "EID"
158228-158267 can: full-id: "Full Identifier: 435815424 (0x19fa0400)" "Full ID: 435815424 (0x19fa0400)" "Full ID" "FID"
158224-158225 can: srr: "Substitute remote request: 1" "SRR: 1" "SRR"
158268-158269 can: stuff-bit: "Stuff bit: 1" "SB: 1" "SB"
158270-158271 can: rtr: "Remote transmission request: data frame" "RTR: data frame" "RTR"
158272-158273 can: reserved-bit: "Reserved bit 1: 0" "RB1: 0" "RB1"
158274-158275 can: reserved-bit: "Reserved bit 0: 0" "RB0: 0" "RB0"
158276-158283 can: dlc: "Data length code: 8" "DLC: 8" "DLC"
158288-158289 can: stuff-bit: "Stuff bit: 1" "SB: 1" "SB"
158300-158301 can: stuff-bit: "Stuff bit: 1" "SB: 1" "SB"
158390-158391 can: stuff-bit: "Stuff bit: 1" "SB: 1" "SB"
158402-158403 can: stuff-bit: "Stuff bit: 1" "SB: 1" "SB"
158414-158415 can: stuff-bit: "Stuff bit: 1" "SB: 1" "SB"
158284-158303 can: data: "Data byte 0: 0x01" "DB 0: 0x01" "DB"
158304-158319 can: data: "Data byte 1: 0x22" "DB 1: 0x22" "DB"
158320-158335 can: data: "Data byte 2: 0x15" "DB 2: 0x15" "DB"
158336-158351 can: data: "Data byte 3: 0x97" "DB 3: 0x97" "DB"
158352-158367 can: data: "Data byte 4: 0x0e" "DB 4: 0x0e" "DB"
158368-158383 can: data: "Data byte 5: 0x1c" "DB 5: 0x1c" "DB"
158384-158401 can: data: "Data byte 6: 0x00" "DB 6: 0x00" "DB"
158404-158421 can: data: "Data byte 7: 0x00" "DB 7: 0x00" "DB"
158442-158443 can: stuff-bit: "Stuff bit: 1" "SB: 1" "SB"
158422-158453 can: crc-sequence: "CRC sequence: 0x341c" "CRC: 0x341c" "CRC"
158454-158455 can: crc-delimiter: "CRC delimiter: 1" "CRC d: 1" "CRC d"
158456-158457 can: ack-slot: "ACK slot: ACK" "ACK s: ACK" "ACK s"
158458-158459 can: ack-delimiter: "ACK delimiter: 1" "ACK d: 1" "ACK d"
158460-158473 can: eof: "End of frame" "EOF" "E"
159697-159698 can: sof: "Start of frame" "SOF" "S"
159717-159718 can: stuff-bit: "Stuff bit: 0" "SB: 0" "SB"
159699-159722 can: id: "Identifier: 1662 (0x67e)" "ID: 1662 (0x67e)" "ID"
159725-159726 can: ide: "Identifier extension bit: extended frame" "IDE: extended frame" "IDE"
159739-159740 can: stuff-bit: "Stuff bit: 1" "SB: 1" "SB"
159755-159756 can: stuff-bit: "Stuff bit: 1" "SB: 1" "SB"
159727-159766 can: ext-id: "Extended Identifier: 132096 (0x20400)" "Extended ID: 132096 (0x20400)" "Extended ID" "EID"
159727-159766 can: full-id: "Full Identifier: 435815424 (0x19fa0400)" "Full ID: 435815424 (0x19fa0400)" "Full ID" "FID"
159723-159724 can: srr: "Substitute remote request: 1" "SRR: 1" "SRR"
159767-159768 can: stuff-bit: "Stuff bit: 1" "SB: 1" "SB"
159769-159770 can: rtr: "Remote transmission request: data frame" "RTR: data frame" "RTR"
159771-159772 can: reserved-bit: "Reserved bit 1: 0" "RB1: 0" "RB1"
159773-159774 can: reserved-bit: "Reserved bit 0: 0" "RB0: 0" "RB0"
159775-159782 can: dlc: "Data length code: 8" "DLC: 8" "DLC"
159787-159788 can: stuff-bit: "Stuff bit: 1" "SB: 1" "SB"
159809-159810 can: stuff-bit: "Stuff bit: 1" "SB: 1" "SB"
159843-159844 can: stuff-bit: "Stuff bit: 1" "SB: 1" "SB"
159877-159878 can: stuff-bit: "Stuff bit: 1" "SB: 1" "SB"
159903-159904 can: stuff-bit: "Stuff bit: 0" "SB: 0" "SB"
159783-159800 can: data: "Data byte 0: 0x02" "DB 0: 0x02" "DB"
159801-159818 can: data: "Data byte 1: 0x00" "DB 1: 0x00" "DB"
159819-159834 can: data: "Data byte 2: 0xf2" "DB 2: 0xf2" "DB"
159835-159852 can: data: "Data byte 3: 0x01" "DB 3: 0x01" "DB"
159853-159868 can: data: "Data byte 4: 0xa2" "DB 4: 0xa2" "DB"
159869-159886 can: data: "Data byte 5: 0x0d" "DB 5: 0x0d" "DB"
159887-159902 can: data: "Data byte 6: 0x1f" "DB 6: 0x1f" "DB"
159905-159920 can: data: "Data byte 7: 0xab" "DB 7: 0xab" "DB"
159921-159950 can: crc-sequence: "CRC sequence: 0x2aad" "CRC: 0x2aad" "CRC"
159951-159952 can: crc-delimiter: "CRC delimiter: 1" "CRC d: 1" "CRC d"
159953-159954 can: ack-slot: "ACK slot: ACK" "ACK s: ACK" "ACK s"
159955-159956 can: ack-delimiter: "ACK delimiter: 1" "ACK d: 1" "ACK d"
159957-159970 can: eof: "End of frame" "EOF" "E"
161217-161218 can: sof: "Start of frame" "SOF" "S"
161237-161238 can: stuff-bit: "Stuff bit: 0" "SB: 0" "SB"
161219-161242 can: id: "Identifier: 1662 (0x67e)" "ID: 1662 (0x67e)" "ID"
161245-161246 can: ide: "Identifier extension bit: extended frame" "IDE: extended frame" "IDE"
161259-161260 can: stuff-bit: "Stuff bit: 1" "SB: 1" "SB"
161275-161276 can: stuff-bit: "Stuff bit: 1" "SB: 1" "SB"
161247-161286 can: ext-id: "Extended Identifier: 132096 (0x20400)" "Extended ID: 132096 (0x20400)" "Extended ID" "EID"
161247-161286 can: full-id: "Full Identifier: 435815424 (0x19fa0400)" "Full ID: 435815424 (0x19fa0400)" "Full ID" "FID"
161243-161244 can: srr: "Substitute remote request: 1" "SRR: 1" "SRR"
161287-161288 can: stuff-bit: "Stuff bit: 1" "SB: 1" "SB"
161289-161290 can: rtr: "Remote transmission request: data frame" "RTR: data frame" "RTR"
161291-161292 can: reserved-bit: "Reserved bit 1: 0" "RB1: 0" "RB1"
161293-161294 can: reserved-bit: "Reserved bit 0: 0" "RB0: 0" "RB0"
161295-161302 can: dlc: "Data length code: 8" "DLC: 8" "DLC"
161307-161308 can: stuff-bit: "Stuff bit: 1" "SB: 1" "SB"
161345-161346 can: stuff-bit: "Stuff bit: 1" "SB: 1" "SB"
161369-161370 can: stuff-bit: "Stuff bit: 1" "SB: 1" "SB"
161381-161382 can: stuff-bit: "Stuff bit: 1" "SB: 1" "SB"
161393-161394 can: stuff-bit: "Stuff bit: 1" "SB: 1" "SB"
161405-161406 can: stuff-bit: "Stuff bit: 1" "SB: 1" "SB"
161417-161418 can: stuff-bit: "Stuff bit: 1" "SB: 1" "SB"
161429-161430 can: stuff-bit: "Stuff bit: 1" "SB: 1" "SB"
161303-161320 can: data: "Data byte 0: 0x03" "DB 0: 0x03" "DB"
161321-161336 can: data: "Data byte 1: 0xda" "DB 1: 0xda" "DB"
161337-161354 can: data: "Data byte 2: 0x0a" "DB 2: 0x0a" "DB"
161355-161372 can: data: "Data byte 3: 0x40" "DB 3: 0x40" "DB"
161373-161390 can: data: "Data byte 4: 0x00" "DB 4: 0x00" "DB"
161391-161410 can: data: "Data byte 5: 0x00" "DB 5: 0x00" "DB"
161411-161428 can: data: "Data byte 6: 0x00" "DB 6: 0x00" "DB"
161431-161446 can: data: "Data byte 7: 0xe2" "DB 7: 0xe2" "DB"
161447-161476 can: crc-sequence: "CRC sequence: 0x4ce9" "CRC: 0x4ce9" "CRC"
161477-161478 can: crc-delimiter: "CRC delimiter: 1" "CRC d: 1" "CRC d"
161479-161480 can: ack-slot: "ACK slot: NACK" "ACK s: NACK" "ACK s"
161481-161482 can: ack-delimiter: "ACK delimiter: 0" "ACK d: 0" "ACK d"
161483-161496 can: eof: "End of frame" "EOF" "E"
162698-162699 can: sof: "Start of frame" "SOF" "S"
162718-162719 can: stuff-bit: "Stuff bit: 0" "SB: 0" "SB"
162700-162723 can: id: "Identifier: 1662 (0x67e)" "ID: 1662 (0x67e)" "ID"
162726-162727 can: ide: "Identifier extension bit: extended frame" "IDE: extended frame" "IDE"
162740-162741 can: stuff-bit: "Stuff bit: 1" "SB: 1" "SB"
162756-162757 can: stuff-bit: "Stuff bit: 1" "SB: 1" "SB"
162728-162767 can: ext-id: "Extended Identifier: 132096 (0x20400)" "Extended ID: 132096 (0x20400)" "Extended ID" "EID"
162728-162767 can: full-id: "Full Identifier: 435815424 (0x19fa0400)" "Full ID: 435815424 (0x19fa0400)" "Full ID" "FID"
162724-162725 can: srr: "Substitute remote request: 1" "SRR: 1" "SRR"
162768-162769 can: stuff-bit: "Stuff bit: 1" "SB: 1" "SB"
162770-162771 can: rtr: "Remote transmission request: data frame" "RTR: data frame" "RTR"
162772-162773 can: reserved-bit: "Reserved bit 1: 0" "RB1: 0" "RB1"
162774-162775 can: reserved-bit: "Reserved bit 0: 0" "RB0: 0" "RB0"
162776-162783 can: dlc: "Data length code: 8" "DLC: 8" "DLC"
162788-162789 can: stuff-bit: "Stuff bit: 1" "SB: 1" "SB"
162808-162809 can: stuff-bit: "Stuff bit: 1" "SB: 1" "SB"
162858-162859 can: stuff-bit: "Stuff bit: 0" "SB: 0" "SB"
162910-162911 can: stuff-bit: "Stuff bit: 1" "SB: 1" "SB"
162784-162801 can: data: "Data byte 0: 0x04" "DB 0: 0x04" "DB"
162802-162819 can: data: "Data byte 1: 0x14" "DB 1: 0x14" "DB"
162820-162835 can: data: "Data byte 2: 0x45" "DB 2: 0x45" "DB"
162836-162851 can: data: "Data byte 3: 0x1b" "DB 3: 0x1b" "DB"
162852-162869 can: data: "Data byte 4: 0xfc" "DB 4: 0xfc" "DB"
162870-162885 can: data: "Data byte 5: 0xd1" "DB 5: 0xd1" "DB"
162886-162901 can: data: "Data byte 6: 0x32" "DB 6: 0x32" "DB"
162902-162919 can: data: "Data byte 7: 0x0c" "DB 7: 0x0c" "DB"
162920-162949 can: crc-sequence: "CRC sequence: 0x561b" "CRC: 0x561b" "CRC"
162950-162951 can: crc-delimiter: "CRC delimiter: 1" "CRC d: 1" "CRC d"
162952-162953 can: ack-slot: "ACK slot: ACK" "ACK s: ACK" "ACK s"
162954-162955 can: ack-delimiter: "ACK delimiter: 1" "ACK d: 1" "ACK d"
162956-162969 can: eof: "End of frame" "EOF" "E"
163342-163343 can: sof: "Start of frame" "SOF" "S"
163362-163363 can: stuff-bit: "Stuff bit: 0" "SB: 0" "SB"
163344-163367 can: id: "Identifier: 1919 (0x77f)" "ID: 1919 (0x77f)" "ID"
163370-163371 can: ide: "Identifier extension bit: extended frame" "IDE: extended frame" "IDE"
163374-163375 can: stuff-bit: "Stuff bit: 0" "SB: 0" "SB"
163402-163403 can: stuff-bit: "Stuff bit: 1" "SB: 1" "SB"
163372-163411 can: ext-id: "Extended Identifier: 202241 (0x31601)" "Extended ID: 202241 (0x31601)" "Extended ID" "EID"
163372-163411 can: full-id: "Full Identifier: 503256577 (0x1dff1601)" "Full ID: 503256577 (0x1dff1601)" "Full ID" "FID"
163368-163369 can: srr: "Substitute remote request: 1" "SRR: 1" "SRR"
163412-163413 can: rtr: "Remote transmission request: data frame" "RTR: data frame" "RTR"
163414-163415 can: reserved-bit: "Reserved bit 1: 0" "RB1: 0" "RB1"
163416-163417 can: reserved-bit: "Reserved bit 0: 0" "RB0: 0" "RB0"
163418-163425 can: dlc: "Data length code: 8" "DLC: 8" "DLC"
163430-163431 can: stuff-bit: "Stuff bit: 1" "SB: 1" "SB"
163444-163445 can: stuff-bit: "Stuff bit: 1" "SB: 1" "SB"
163490-163491 can: stuff-bit: "Stuff bit: 1" "SB: 1" "SB"
163518-163519 can: stuff-bit: "Stuff bit: 1" "SB: 1" "SB"
163538-163539 can: stuff-bit: "Stuff bit: 1" "SB: 1" "SB"
163548-163549 can: stuff-bit: "Stuff bit: 0" "SB: 0" "SB"
163558-163559 can: stuff-bit: "Stuff bit: 1" "SB: 1" "SB"
163426-163443 can: data: "Data byte 0: 0x20" "DB 0: 0x20" "DB"
163446-163461 can: data: "Data byte 1: 0x0a" "DB 1: 0x0a" "DB"
163462-163477 can: data: "Data byte 2: 0x8c" "DB 2: 0x8c" "DB"
163478-163495 can: data: "Data byte 3: 0x80" "DB 3: 0x80" "DB"
163496-163511 can: data: "Data byte 4: 0xec" "DB 4: 0xec" "DB"
163512-163529 can: data: "Data byte 5: 0x16" "DB 5: 0x16" "DB"
163530-163547 can: data: "Data byte 6: 0x0f" "DB 6: 0x0f" "DB"
163550-163567 can: data: "Data byte 7: 0x00" "DB 7: 0x00" "DB"
163568-163597 can: crc-sequence: "CRC sequence: 0x6b68" "CRC: 0x6b68" "CRC"
163598-163599 can: crc-delimiter: "CRC delimiter: 1" "CRC d: 1" "CRC d"
163600-163601 can: ack-slot: "ACK slot: ACK" "ACK s: ACK" "ACK s"
163602-163603 can: ack-delimiter: "ACK delimiter: 1" "ACK d: 1" "ACK d"
163604-163617 can: eof: "End of frame" "EOF" "E"
164015-164016 can: sof: "Start of frame" "SOF" "S"
164035-164036 can: stuff-bit: "Stuff bit: 0" "SB: 0" "SB"
164017-164040 can: id: "Identifier: 1919 (0x77f)" "ID: 1919 (0x77f)" "ID"
164043-164044 can: ide: "Identifier extension bit: extended frame" "IDE: extended frame" "IDE"
164047-164048 can: stuff-bit: "Stuff bit: 0" "SB: 0" "SB"
164075-164076 can: stuff-bit: "Stuff bit: 1" "SB: 1" "SB"
164045-164084 can: ext-id: "Extended Identifier: 202241 (0x31601)" "Extended ID: 202241 (0x31601)" "Extended ID" "EID"
164045-164084 can: full-id: "Full Identifier: 503256577 (0x1dff1601)" "Full ID: 503256577 (0x1dff1601)" "Full ID" "FID"
164041-164042 can: srr: "Substitute remote request: 1" "SRR: 1" "SRR"
164085-164086 can: rtr: "Remote transmission request: data frame" "RTR: data frame" "RTR"
164087-164088 can: reserved-bit: "Reserved bit 1: 0" "RB1: 0" "RB1"
164089-164090 can: reserved-bit: "Reserved bit 0: 0" "RB0: 0" "RB0"
164091-164098 can: dlc: "Data length code: 8" "DLC: 8" "DLC"
164103-164104 can: stuff-bit: "Stuff bit: 1" "SB: 1" "SB"
164129-164130 can: stuff-bit: "Stuff bit: 0" "SB: 0" "SB"
164147-164148 can: stuff-bit: "Stuff bit: 0" "SB: 0" "SB"
164163-164164 can: stuff-bit: "Stuff bit: 0" "SB: 0" "SB"
164193-164194 can: stuff-bit: "Stuff bit: 0" "SB: 0" "SB"
164205-164206 can: stuff-bit: "Stuff bit: 0" "SB: 0" "SB"
164217-164218 can: stuff-bit: "Stuff bit: 0" "SB: 0" "SB"
164229-164230 can: stuff-bit: "Stuff bit: 0" "SB: 0" "SB"
164241-164242 can: stuff-bit: "Stuff bit: 0" "SB: 0" "SB"
164099-164116 can: data: "Data byte 0: 0x21" "DB 0: 0x21" "DB"
164117-164134 can: data: "Data byte 1: 0x7c" "DB 1: 0x7c" "DB"
164135-164152 can: data: "Data byte 2: 0x7c" "DB 2: 0x7c" "DB"
164153-164170 can: data: "Data byte 3: 0xf9" "DB 3: 0xf9" "DB"
164171-164186 can: data: "Data byte 4: 0x63" "DB 4: 0x63" "DB"
164187-164204 can: data: "Data byte 5: 0xff" "DB 5: 0xff" "DB"
164207-164224 can: data: "Data byte 6: 0xff" "DB 6: 0xff" "DB"
164225-164244 can: data: "Data byte 7: 0xff" "DB 7: 0xff" "DB"
164245-164274 can: crc-sequence: "CRC sequence: 0x2229" "CRC: 0x2229" "CRC"
164275-164276 can: crc-delimiter: "CRC delimiter: 1" "CRC d: 1" "CRC d"
164277-164278 can: ack-slot: "ACK slot: ACK" "ACK s: ACK" "ACK s"
164279-164280 can: ack-delimiter: "ACK delimiter: 1" "ACK d: 1" "ACK d"
164281-164294 can: eof: "End of frame" "EOF" "E"
164301-164302 can: sof: "Start of frame" "SOF" "S"
164321-164322 can: stuff-bit: "Stuff bit: 0" "SB: 0" "SB"
164303-164326 can: id: "Identifier: 1662 (0x67e)" "ID: 1662 (0x67e)" "ID"
164329-164330 can: ide: "Identifier extension bit: extended frame" "IDE: extended frame" "IDE"
164357-164358 can: stuff-bit: "Stuff bit: 1" "SB: 1" "SB"
164331-164368 can: ext-id: "Extended Identifier: 136192 (0x21400)" "Extended ID: 136192 (0x21400)" "Extended ID" "EID"
164331-164368 can: full-id: "Full Identifier: 435819520 (0x19fa1400)" "Full ID: 435819520 (0x19fa1400)" "Full ID" "FID"
164327-164328 can: srr: "Substitute remote request: 1" "SRR: 1" "SRR"
164369-164370 can: stuff-bit: "Stuff bit: 1" "SB: 1" "SB"
164371-164372 can: rtr: "Remote transmission request: data frame" "RTR: data frame" "RTR"
164373-164374 can: reserved-bit: "Reserved bit 1: 0" "RB1: 0" "RB1"
164375-164376 can: reserved-bit: "Reserved bit 0: 0" "RB0: 0" "RB0"
164377-164384 can: dlc: "Data length code: 8" "DLC: 8" "DLC"
164389-164390 can: stuff-bit: "Stuff bit: 1" "SB: 1" "SB"
164427-164428 can: stuff-bit: "Stuff bit: 1" "SB: 1" "SB"
164439-164440 can: stuff-bit: "Stuff bit: 1" "SB: 1" "SB"
164451-164452 can: stuff-bit: "Stuff bit: 1" "SB: 1" "SB"
164463-164464 can: stuff-bit: "Stuff bit: 1" "SB: 1" "SB"
164475-164476 can: stuff-bit: "Stuff bit: 1" "SB: 1" "SB"
164485-164486 can: stuff-bit: "Stuff bit: 0" "SB: 0" "SB"
164503-164504 can: stuff-bit: "Stuff bit: 1" "SB: 1" "SB"
164385-164402 can: data: "Data byte 0: 0x05" "DB 0: 0x05" "DB"
164403-164418 can: data: "Data byte 1: 0x2e" "DB 1: 0x2e" "DB"
164419-164436 can: data: "Data byte 2: 0x00" "DB 2: 0x00" "DB"
164437-164456 can: data: "Data byte 3: 0x00" "DB 3: 0x00" "DB"
164457-164474 can: data: "Data byte 4: 0x00" "DB 4: 0x00" "DB"
164477-164494 can: data: "Data byte 5: 0xf2" "DB 5: 0xf2" "DB"
164495-164512 can: data: "Data byte 6: 0x0e" "DB 6: 0x0e" "DB"
164513-164528 can: data: "Data byte 7: 0xb9" "DB 7: 0xb9" "DB"
164551-164552 can: stuff-bit: "Stuff bit: 1" "SB: 1" "SB"
164529-164560 can: crc-sequence: "CRC sequence: 0x7200" "CRC: 0x7200" "CRC"
164561-164562 can: crc-delimiter: "CRC delimiter: 1" "CRC d: 1" "CRC d"
164563-164564 can: ack-slot: "ACK slot: ACK" "ACK s: ACK" "ACK s"
164565-164566 can: ack-delimiter: "ACK delimiter: 1" "ACK d: 1" "ACK d"
164567-164580 can: eof: "End of frame" "EOF" "E"
164588-164589 can: sof: "Start of frame" "SOF" "S"
164608-164609 can: stuff-bit: "Stuff bit: 0" "SB: 0" "SB"
164590-164613 can: id: "Identifier: 636 (0x27c)" "ID: 636 (0x27c)" "ID"
164616-164617 can: ide: "Identifier extension bit: extended frame" "IDE: extended frame" "IDE"
164630-164631 can: stuff-bit: "Stuff bit: 1" "SB: 1" "SB"
164650-164651 can: stuff-bit: "Stuff bit: 1" "SB: 1" "SB"
164618-164657 can: ext-id: "Extended Identifier: 131329 (0x20101)" "Extended ID: 131329 (0x20101)" "Extended ID" "EID"
164618-164657 can: full-id: "Full Identifier: 166854913 (0x9f20101)" "Full ID: 166854913 (0x9f20101)" "Full ID" "FID"
164614-164615 can: srr: "Substitute remote request: 1" "SRR: 1" "SRR"
164658-164659 can: rtr: "Remote transmission request: data frame" "RTR: data frame" "RTR"
164660-164661 can: reserved-bit: "Reserved bit 1: 0" "RB1: 0" "RB1"
164662-164663 can: reserved-bit: "Reserved bit 0: 0" "RB0: 0" "RB0"
164664-164671 can: dlc: "Data length code: 8" "DLC: 8" "DLC"
164688-164689 can: stuff-bit: "Stuff bit: 1" "SB: 1" "SB"
164716-164717 can: stuff-bit: "Stuff bit: 0" "SB: 0" "SB"
164728-164729 can: stuff-bit: "Stuff bit: 0" "SB: 0" "SB"
164740-164741 can: stuff-bit: "Stuff bit: 0" "SB: 0" "SB"
164752-164753 can: stuff-bit: "Stuff bit: 0" "SB: 0" "SB"
164764-164765 can: stuff-bit: "Stuff bit: 0" "SB: 0" "SB"
164776-164777 can: stuff-bit: "Stuff bit: 0" "SB: 0" "SB"
164788-164789 can: stuff-bit: "Stuff bit: 0" "SB: 0" "SB"
164800-164801 can: stuff-bit: "Stuff bit: 0" "SB: 0" "SB"
164812-164813 can: stuff-bit: "Stuff bit: 0" "SB: 0" "SB"
164672-164687 can: data: "Data byte 0: 0x60" "DB 0: 0x60" "DB"
164690-164705 can: data: "Data byte 1: 0x1a" "DB 1: 0x1a" "DB"
164706-164723 can: data: "Data byte 2: 0xff" "DB 2: 0xff" "DB"
164724-164743 can: data: "Data byte 3: 0xff" "DB 3: 0xff" "DB"
164744-164761 can: data: "Data byte 4: 0xff" "DB 4: 0xff" "DB"
164762-164781 can: data: "Data byte 5: 0xff" "DB 5: 0xff" "DB"
164782-164799 can: data: "Data byte 6: 0xff" "DB 6: 0xff" "DB"
164802-164819 can: data: "Data byte 7: 0xff" "DB 7: 0xff" "DB"
164836-164837 can: stuff-bit: "Stuff bit: 1" "SB: 1" "SB"
164820-164851 can: crc-sequence: "CRC sequence: 0x5019" "CRC: 0x5019" "CRC"
164852-164853 can: crc-delimiter: "CRC delimiter: 1" "CRC d: 1" "CRC d"
164854-164855 can: ack-slot: "ACK slot: ACK" "ACK s: ACK" "ACK s"
164856-164857 can: ack-delimiter: "ACK delimiter: 1" "ACK d: 1" "ACK d"
164858-164871 can: eof: "End of frame" "EOF" "E"
164888-164889 can: sof: "Start of frame" "SOF" "S"
164908-164909 can: stuff-bit: "Stuff bit: 0" "SB: 0" "SB"
164890-164913 can: id: "Identifier: 636 (0x27c)" "ID: 636 (0x27c)" "ID"
164916-164917 can: ide: "Identifier extension bit: extended frame" "IDE: extended frame" "IDE"
164930-164931 can: stuff-bit: "Stuff bit: 1" "SB: 1" "SB"
164950-164951 can: stuff-bit: "Stuff bit: 1" "SB: 1" "SB"
164918-164957 can: ext-id: "Extended Identifier: 131329 (0x20101)" "Extended ID: 131329 (0x20101)" "Extended ID" "EID"
164918-164957 can: full-id: "Full Identifier: 166854913 (0x9f20101)" "Full ID: 166854913 (0x9f20101)" "Full ID" "FID"
164914-164915 can: srr: "Substitute remote request: 1" "SRR: 1" "SRR"
164958-164959 can: rtr: "Remote transmission request: data frame" "RTR: data frame" "RTR"
164960-164961 can: reserved-bit: "Reserved bit 1: 0" "RB1: 0" "RB1"
164962-164963 can: reserved-bit: "Reserved bit 0: 0" "RB0: 0" "RB0"
164964-164971 can: dlc: "Data length code: 8" "DLC: 8" "DLC"
164996-164997 can: stuff-bit: "Stuff bit: 0" "SB: 0" "SB"
165008-165009 can: stuff-bit: "Stuff bit: 0" "SB: 0" "SB"
165020-165021 can: stuff-bit: "Stuff bit: 0" "SB: 0" "SB"
165038-165039 can: stuff-bit: "Stuff bit: 0" "SB: 0" "SB"
165054-165055 can: stuff-bit: "Stuff bit: 1" "SB: 1" "SB"
165066-165067 can: stuff-bit: "Stuff bit: 1" "SB: 1" "SB"
165078-165079 can: stuff-bit: "Stuff bit: 1" "SB: 1" "SB"
165092-165093 can: stuff-bit: "Stuff bit: 0" "SB: 0" "SB"
165104-165105 can: stuff-bit: "Stuff bit: 0" "SB: 0" "SB"
165116-165117 can: stuff-bit: "Stuff bit: 0" "SB: 0" "SB"
164972-164987 can: data: "Data byte 0: 0x61" "DB 0: 0x61" "DB"
164988-165005 can: data: "Data byte 1: 0xff" "DB 1: 0xff" "DB"
165006-165025 can: data: "Data byte 2: 0xff" "DB 2: 0xff" "DB"
165026-165043 can: data: "Data byte 3: 0x7f" "DB 3: 0x7f" "DB"
165044-165061 can: data: "Data byte 4: 0x00" "DB 4: 0x00" "DB"
165062-165081 can: data: "Data byte 5: 0x00" "DB 5: 0x00" "DB"
165082-165099 can: data: "Data byte 6: 0xff" "DB 6: 0xff" "DB"
165100-165119 can: data: "Data byte 7: 0xff" "DB 7: 0xff" "DB"
165120-165149 can: crc-sequence: "CRC sequence: 0x155e" "CRC: 0x155e" "CRC"
165150-165151 can: crc-delimiter: "CRC delimiter: 1" "CRC d: 1" "CRC d"
165152-165153 can: ack-slot: "ACK slot: ACK" "ACK s: ACK" "ACK s"
165154-165155 can: ack-delimiter: "ACK delimiter: 1" "ACK d: 1" "ACK d"
165156-165169 can: eof: "End of frame" "EOF" "E"
165200-165201 can: sof: "Start of frame" "SOF" "S"
165220-165221 can: stuff-bit: "Stuff bit: 0" "SB: 0" "SB"
165202-165225 can: id: "Identifier: 636 (0x27c)" "ID: 636 (0x27c)" "ID"
165228-165229 can: ide: "Identifier extension bit: extended frame" "IDE: extended frame" "IDE"
165242-165243 can: stuff-bit: "Stuff bit: 1" "SB: 1" "SB"
165262-165263 can: stuff-bit: "Stuff bit: 1" "SB: 1" "SB"
165230-165269 can: ext-id: "Extended Identifier: 131329 (0x20101)" "Extended ID: 131329 (0x20101)" "Extended ID" "EID"
165230-165269 can: full-id: "Full Identifier: 166854913 (0x9f20101)" "Full ID: 166854913 (0x9f20101)" "Full ID" "FID"
165226-165227 can: srr: "Substitute remote request: 1" "SRR: 1" "SRR"
165270-165271 can: rtr: "Remote transmission request: data frame" "RTR: data frame" "RTR"
165272-165273 can: reserved-bit: "Reserved bit 1: 0" "RB1: 0" "RB1"
165274-165275 can: reserved-bit: "Reserved bit 0: 0" "RB0: 0" "RB0"
165276-165283 can: dlc: "Data length code: 8" "DLC: 8" "DLC"
165310-165311 can: stuff-bit: "Stuff bit: 0" "SB: 0" "SB"
165322-165323 can: stuff-bit: "Stuff bit: 0" "SB: 0" "SB"
165334-165335 can: stuff-bit: "Stuff bit: 0" "SB: 0" "SB"
165346-165347 can: stuff-bit: "Stuff bit: 0" "SB: 0" "SB"
165358-165359 can: stuff-bit: "Stuff bit: 0" "SB: 0" "SB"
165370-165371 can: stuff-bit: "Stuff bit: 0" "SB: 0" "SB"
165382-165383 can: stuff-bit: "Stuff bit: 0" "SB: 0" "SB"
165394-165395 can: stuff-bit: "Stuff bit: 0" "SB: 0" "SB"
165406-165407 can: stuff-bit: "Stuff bit: 0" "SB: 0" "SB"
165418-165419 can: stuff-bit: "Stuff bit: 0" "SB: 0" "SB"
165430-165431 can: stuff-bit: "Stuff bit: 0" "SB: 0" "SB"
165284-165299 can: data: "Data byte 0: 0x62" "DB 0: 0x62" "DB"
165300-165317 can: data: "Data byte 1: 0xff" "DB 1: 0xff" "DB"
165318-165337 can: data: "Data byte 2: 0xff" "DB 2: 0xff" "DB"
165338-165355 can: data: "Data byte 3: 0xff" "DB 3: 0xff" "DB"
165356-165375 can: data: "Data byte 4: 0xff" "DB 4: 0xff" "DB"
165376-165393 can: data: "Data byte 5: 0xff" "DB 5: 0xff" "DB"
165396-165413 can: data: "Data byte 6: 0xff" "DB 6: 0xff" "DB"
165414-165433 can: data: "Data byte 7: 0xff" "DB 7: 0xff" "DB"
165434-165463 can: crc-sequence: "CRC sequence: 0x2bd5" "CRC: 0x2bd5" "CRC"
165464-165465 can: crc-delimiter: "CRC delimiter: 1" "CRC d: 1" "CRC d"
165466-165467 can: ack-slot: "ACK slot: ACK" "ACK s: ACK" "ACK s"
165468-165469 can: ack-delimiter: "ACK delimiter: 1" "ACK d: 1" "ACK d"
165470-165483 can: eof: "End of frame" "EOF" "E"
165514-165515 can: sof: "Start of frame" "SOF" "S"
165534-165535 can: stuff-bit: "Stuff bit: 0" "SB: 0" "SB"
165516-165539 can: id: "Identifier: 636 (0x27c)" "ID: 636 (0x27c)" "ID"
165542-165543 can: ide: "Identifier extension bit: extended frame" "IDE: extended frame" "IDE"
165556-165557 can: stuff-bit: "Stuff bit: 1" "SB: 1" "SB"
165576-165577 can: stuff-bit: "Stuff bit: 1" "SB: 1" "SB"
165544-165583 can: ext-id: "Extended Identifier: 131329 (0x20101)" "Extended ID: 131329 (0x20101)" "Extended ID" "EID"
165544-165583 can: full-id: "Full Identifier: 166854913 (0x9f20101)" "Full ID: 166854913 (0x9f20101)" "Full ID" "FID"
165540-165541 can: srr: "Substitute remote request: 1" "SRR: 1" "SRR"
165584-165585 can: rtr: "Remote transmission request: data frame" "RTR: data frame" "RTR"
165586-165587 can: reserved-bit: "Reserved bit 1: 0" "RB1: 0" "RB1"
165588-165589 can: reserved-bit: "Reserved bit 0: 0" "RB0: 0" "RB0"
165590-165597 can: dlc: "Data length code: 8" "DLC: 8" "DLC"
165624-165625 can: stuff-bit: "Stuff bit: 1" "SB: 1" "SB"
165636-165637 can: stuff-bit: "Stuff bit: 1" "SB: 1" "SB"
165648-165649 can: stuff-bit: "Stuff bit: 1" "SB: 1" "SB"
165660-165661 can: stuff-bit: "Stuff bit: 1" "SB: 1" "SB"
165672-165673 can: stuff-bit: "Stuff bit: 1" "SB: 1" "SB"
165684-165685 can: stuff-bit: "Stuff bit: 1" "SB: 1" "SB"
165702-165703 can: stuff-bit: "Stuff bit: 0" "SB: 0" "SB"
165720-165721 can: stuff-bit: "Stuff bit: 0" "SB: 0" "SB"
165732-165733 can: stuff-bit: "Stuff bit: 0" "SB: 0" "SB"
165598-165613 can: data: "Data byte 0: 0x63" "DB 0: 0x63" "DB"
165614-165631 can: data: "Data byte 1: 0x00" "DB 1: 0x00" "DB"
165632-165651 can: data: "Data byte 2: 0x00" "DB 2: 0x00" "DB"
165652-165669 can: data: "Data byte 3: 0x00" "DB 3: 0x00" "DB"
165670-165689 can: data: "Data byte 4: 0x00" "DB 4: 0x00" "DB"
165690-165707 can: data: "Data byte 5: 0x7f" "DB 5: 0x7f" "DB"
165708-165725 can: data: "Data byte 6: 0x7f" "DB 6: 0x7f" "DB"
165726-165743 can: data: "Data byte 7: 0xff" "DB 7: 0xff" "DB"
165744-165745 can: stuff-bit: "Stuff bit: 0" "SB: 0" "SB"
165762-165763 can: stuff-bit: "Stuff bit: 1" "SB: 1" "SB"
165746-165777 can: crc-sequence: "CRC sequence: 0x305c" "CRC: 0x305c" "CRC"
165778-165779 can: crc-delimiter: "CRC delimiter: 1" "CRC d: 1" "CRC d"
165780-165781 can: ack-slot: "ACK slot: ACK" "ACK s: ACK" "ACK s"
165782-165783 can: ack-delimiter: "ACK delimiter: 1" "ACK d: 1" "ACK d"
165784-165797 can: eof: "End of frame" "EOF" "E"
165805-165806 can: sof: "Start of frame" "SOF" "S"
165825-165826 can: stuff-bit: "Stuff bit: 0" "SB: 0" "SB"
165807-165830 can: id: "Identifier: 1662 (0x67e)" "ID: 1662 (0x67e)" "ID"
165833-165834 can: ide: "Identifier extension bit: extended frame" "IDE: extended frame" "IDE"
165845-165846 can: stuff-bit: "Stuff bit: 1" "SB: 1" "SB"
165861-165862 can: stuff-bit: "Stuff bit: 1" "SB: 1" "SB"
165873-165874 can: stuff-bit: "Stuff bit: 1" "SB: 1" "SB"
165835-165876 can: ext-id: "Extended Identifier: 2048 (0x800)" "Extended ID: 2048 (0x800)" "Extended ID" "EID"
165835-165876 can: full-id: "Full Identifier: 435685376 (0x19f80800)" "Full ID: 435685376 (0x19f80800)" "Full ID" "FID"
165831-165832 can: srr: "Substitute remote request: 1" "SRR: 1" "SRR"
165877-165878 can: rtr: "Remote transmission request: data frame" "RTR: data frame" "RTR"
165879-165880 can: reserved-bit: "Reserved bit 1: 0" "RB1: 0" "RB1"
165881-165882 can: reserved-bit: "Reserved bit 0: 1" "RB0: 1" "RB0"
165883-165890 can: dlc: "Data length code: 0" "DLC: 0" "DLC"
165893-165894 can: stuff-bit: "Stuff bit: 1" "SB: 1" "SB"
165891-165922 can: crc-sequence: "CRC sequence: 0x0611" "CRC: 0x0611" "CRC"
165923-165924 can: crc-delimiter: "CRC delimiter: 1" "CRC d: 1" "CRC d"
165925-165926 can: ack-slot: "ACK slot: NACK" "ACK s: NACK" "ACK s"
165927-165928 can: ack-delimiter: "ACK delimiter: 1" "ACK d: 1" "ACK d"
165931-165932 can: stuff-bit: "Stuff bit: 0" "SB: 0" "SB"
165929-165944 can: eof: "End of frame" "EOF" "E"
165945-165946 can: warnings: "Start of frame (SOF) must be a dominant bit"
165947-165968 can: id: "Identifier: 1628 (0x65c)" "ID: 1628 (0x65c)" "ID"
165971-165972 can: ide: "Identifier extension bit: standard frame" "IDE: standard frame" "IDE"
165973-165974 can: reserved-bit: "Reserved bit 0: 0" "RB0: 0" "RB0"
165969-165970 can: rtr: "Remote transmission request: data frame" "RTR: data frame" "RTR"
165975-165976 can: stuff-bit: "Stuff bit: 1" "SB: 1" "SB"
165977-165984 can: dlc: "Data length code: 1" "DLC: 1" "DLC"
165985-166000 can: data: "Data byte 0: 0xe7" "DB 0: 0xe7" "DB"
166017-166018 can: stuff-bit: "Stuff bit: 1" "SB: 1" "SB"
166001-166032 can: crc-sequence: "CRC sequence: 0x3005" "CRC: 0x3005" "CRC"
166033-166034 can: crc-delimiter: "CRC delimiter: 1" "CRC d: 1" "CRC d"
166035-166036 can: ack-slot: "ACK slot: ACK" "ACK s: ACK" "ACK s"
166037-166038 can: ack-delimiter: "ACK delimiter: 1" "ACK d: 1" "ACK d"
166039-166052 can: eof: "End of frame" "EOF" "E"
166053-166054 can: warnings: "Start of frame (SOF) must be a dominant bit"
166055-166076 can: id: "Identifier: 1535 (0x5ff)" "ID: 1535 (0x5ff)" "ID"
166079-166080 can: ide: "Identifier extension bit: extended frame" "IDE: extended frame" "IDE"
166081-166116 can: ext-id: "Extended Identifier: 262143 (0x3ffff)" "Extended ID: 262143 (0x3ffff)" "Extended ID" "EID"
166081-166116 can: full-id: "Full Identifier: 402653183 (0x17ffffff)" "Full ID: 402653183 (0x17ffffff)" "Full ID" "FID"
166077-166078 can: srr: "Substitute remote request: 1" "SRR: 1" "SRR"
166117-166118 can: rtr: "Remote transmission request: remote frame" "RTR: remote frame" "RTR"
166119-166120 can: reserved-bit: "Reserved bit 1: 1" "RB1: 1" "RB1"
166121-166122 can: reserved-bit: "Reserved bit 0: 1" "RB0: 1" "RB0"
166123-166130 can: dlc: "Data length code: 15" "DLC: 15" "DLC"
166131-166146 can: data: "Data byte 0: 0xff" "DB 0: 0xff" "DB"
166147-166162 can: data: "Data byte 1: 0xff" "DB 1: 0xff" "DB"
166163-166178 can: data: "Data byte 2: 0xff" "DB 2: 0xff" "DB"
166179-166194 can: data: "Data byte 3: 0xff" "DB 3: 0xff" "DB"
166195-166210 can: data: "Data byte 4: 0xff" "DB 4: 0xff" "DB"
166211-166226 can: data: "Data byte 5: 0xff" "DB 5: 0xff" "DB"
166227-166242 can: data: "Data byte 6: 0xff" "DB 6: 0xff" "DB"
166243-166258 can: data: "Data byte 7: 0xff" "DB 7: 0xff" "DB"
166259-166274 can: data: "Data byte 8: 0xff" "DB 8: 0xff" "DB"
166275-166290 can: data: "Data byte 9: 0xff" "DB 9: 0xff" "DB"
166291-166306 can: data: "Data byte 10: 0xff" "DB 10: 0xff" "DB"
166307-166322 can: data: "Data byte 11: 0xff" "DB 11: 0xff" "DB"
166323-166338 can: data: "Data byte 12: 0xff" "DB 12: 0xff" "DB"
166339-166354 can: data: "Data byte 13: 0xff" "DB 13: 0xff" "DB"
166355-166370 can: data: "Data byte 14: 0xff" "DB 14: 0xff" "DB"
166371-166400 can: crc-sequence: "CRC sequence: 0x7fff" "CRC: 0x7fff" "CRC"
166401-166402 can: crc-delimiter: "CRC delimiter: 1" "CRC d: 1" "CRC d"
166403-166404 can: ack-slot: "ACK slot: NACK" "ACK s: NACK" "ACK s"
166405-166406 can: ack-delimiter: "ACK delimiter: 1" "ACK d: 1" "ACK d"
166407-166420 can: eof: "End of frame" "EOF" "E"
167218-167219 can: sof: "Start of frame" "SOF" "S"
167238-167239 can: stuff-bit: "Stuff bit: 0" "SB: 0" "SB"
167220-167243 can: id: "Identifier: 1662 (0x67e)" "ID: 1662 (0x67e)" "ID"
167246-167247 can: ide: "Identifier extension bit: extended frame" "IDE: extended frame" "IDE"
167260-167261 can: stuff-bit: "Stuff bit: 1" "SB: 1" "SB"
167276-167277 can: stuff-bit: "Stuff bit: 1" "SB: 1" "SB"
167248-167287 can: ext-id: "Extended Identifier: 132096 (0x20400)" "Extended ID: 132096 (0x20400)" "Extended ID" "EID"
167248-167287 can: full-id: "Full Identifier: 435815424 (0x19fa0400)" "Full ID: 435815424 (0x19fa0400)" "Full ID" "FID"
167244-167245 can: srr: "Substitute remote request: 1" "SRR: 1" "SRR"
167288-167289 can: stuff-bit: "Stuff bit: 1" "SB: 1" "SB"
167290-167291 can: rtr: "Remote transmission request: data frame" "RTR: data frame" "RTR"
167292-167293 can: reserved-bit: "Reserved bit 1: 0" "RB1: 0" "RB1"
167294-167295 can: reserved-bit: "Reserved bit 0: 0" "RB0: 0" "RB0"
167296-167303 can: dlc: "Data length code: 8" "DLC: 8" "DLC"
167308-167309 can: stuff-bit: "Stuff bit: 1" "SB: 1" "SB"
167332-167333 can: stuff-bit: "Stuff bit: 1" "SB: 1" "SB"
167344-167345 can: stuff-bit: "Stuff bit: 1" "SB: 1" "SB"
167356-167357 can: stuff-bit: "Stuff bit: 1" "SB: 1" "SB"
167392-167393 can: stuff-bit: "Stuff bit: 1" "SB: 1" "SB"
167304-167321 can: data: "Data byte 0: 0x07" "DB 0: 0x07" "DB"
167322-167339 can: data: "Data byte 1: 0x00" "DB 1: 0x00" "DB"
167340-167359 can: data: "Data byte 2: 0x00" "DB 2: 0x00" "DB"
167360-167375 can: data: "Data byte 3: 0xf2" "DB 3: 0xf2" "DB"
167376-167391 can: data: "Data byte 4: 0x20" "DB 4: 0x20" "DB"
167394-167409 can: data: "Data byte 5: 0xb9" "DB 5: 0xb9" "DB"
167410-167425 can: data: "Data byte 6: 0x2f" "DB 6: 0x2f" "DB"
167426-167441 can: data: "Data byte 7: 0x13" "DB 7: 0x13" "DB"
167456-167457 can: stuff-bit: "Stuff bit: 0" "SB: 0" "SB"
167442-167473 can: crc-sequence: "CRC sequence: 0x5fb0" "CRC: 0x5fb0" "CRC"
167474-167475 can: crc-delimiter: "CRC delimiter: 1" "CRC d: 1" "CRC d"
167476-167477 can: ack-slot: "ACK slot: ACK" "ACK s: ACK" "ACK s"
167478-167479 can: ack-delimiter: "ACK delimiter: 1" "ACK d: 1" "ACK d"
167480-167493 can: eof: "End of frame" "EOF" "E"
168698-168699 can: sof: "Start of frame" "SOF" "S"
168718-168719 can: stuff-bit: "Stuff bit: 0" "SB: 0" "SB"
168700-168723 can: id: "Identifier: 1662 (0x67e)" "ID: 1662 (0x67e)" "ID"
168726-168727 can: ide: "Identifier extension bit: extended frame" "IDE: extended frame" "IDE"
168740-168741 can: stuff-bit: "Stuff bit: 1" "SB: 1" "SB"
168754-168755 can: stuff-bit: "Stuff bit: 1" "SB: 1" "SB"
168766-168767 can: stuff-bit: "Stuff bit: 1" "SB: 1" "SB"
168728-168769 can: ext-id: "Extended Identifier: 131072 (0x20000)" "Extended ID: 131072 (0x20000)" "Extended ID" "EID"
168728-168769 can: full-id: "Full Identifier: 435814400 (0x19fa0000)" "Full ID: 435814400 (0x19fa0000)" "Full ID" "FID"
168724-168725 can: srr: "Substitute remote request: 1" "SRR: 1" "SRR"
168770-168771 can: rtr: "Remote transmission request: data frame" "RTR: data frame" "RTR"
168772-168773 can: reserved-bit: "Reserved bit 1: 0" "RB1: 0" "RB1"
168774-168775 can: reserved-bit: "Reserved bit 0: 1" "RB0: 1" "RB0"
168776-168783 can: dlc: "Data length code: 0" "DLC: 0" "DLC"
168786-168787 can: stuff-bit: "Stuff bit: 1" "SB: 1" "SB"
168784-168815 can: crc-sequence: "CRC sequence: 0x08c7" "CRC: 0x08c7" "CRC"
168816-168817 can: crc-delimiter: "CRC delimiter: 0" "CRC d: 0" "CRC d"
168818-168819 can: ack-slot: "ACK slot: ACK" "ACK s: ACK" "ACK s"
168820-168821 can: ack-delimiter: "ACK delimiter: 0" "ACK d: 0" "ACK d"
168822-168835 can: eof: "End of frame" "EOF" "E"
168836-168837 can: sof: "Start of frame" "SOF" "S"
168838-168859 can: id: "Identifier: 903 (0x387)" "ID: 903 (0x387)" "ID"
168862-168863 can: ide: "Identifier extension bit: extended frame" "IDE: extended frame" "IDE"
168874-168875 can: stuff-bit: "Stuff bit: 1" "SB: 1" "SB"
168886-168887 can: stuff-bit: "Stuff bit: 1" "SB: 1" "SB"
168898-168899 can: stuff-bit: "Stuff bit: 1" "SB: 1" "SB"
168864-168905 can: ext-id: "Extended Identifier: 0 (0x0)" "Extended ID: 0 (0x0)" "Extended ID" "EID"
168864-168905 can: full-id: "Full Identifier: 236716032 (0xe1c0000)" "Full ID: 236716032 (0xe1c0000)" "Full ID" "FID"
168860-168861 can: srr: "Substitute remote request: 0" "SRR: 0" "SRR"
168906-168907 can: rtr: "Remote transmission request: data frame" "RTR: data frame" "RTR"
168908-168909 can: reserved-bit: "Reserved bit 1: 0" "RB1: 0" "RB1"
168910-168911 can: stuff-bit: "Stuff bit: 1" "SB: 1" "SB"
168912-168913 can: reserved-bit: "Reserved bit 0: 0" "RB0: 0" "RB0"
168914-168921 can: dlc: "Data length code: 0" "DLC: 0" "DLC"
168922-168923 can: stuff-bit: "Stuff bit: 1" "SB: 1" "SB"
168924-168953 can: crc-sequence: "CRC sequence: 0x3351" "CRC: 0x3351" "CRC"
168954-168955 can: crc-delimiter: "CRC delimiter: 0" "CRC d: 0" "CRC d"
168956-168957 can: ack-slot: "ACK slot: NACK" "ACK s: NACK" "ACK s"
168958-168959 can: ack-delimiter: "ACK delimiter: 1" "ACK d: 1" "ACK d"
168960-168973 can: eof: "End of frame" "EOF" "E"
170199-170200 can: sof: "Start of frame" "SOF" "S"
170219-170220 can: stuff-bit: "Stuff bit: 0" "SB: 0" "SB"
170201-170224 can: id: "Identifier: 1662 (0x67e)" "ID: 1662 (0x67e)" "ID"
170227-170228 can: ide: "Identifier extension bit: extended frame" "IDE: extended frame" "IDE"
170241-170242 can: stuff-bit: "Stuff bit: 1" "SB: 1" "SB"
170257-170258 can: stuff-bit: "Stuff bit: 1" "SB: 1" "SB"
170229-170268 can: ext-id: "Extended Identifier: 132096 (0x20400)" "Extended ID: 132096 (0x20400)" "Extended ID" "EID"
170229-170268 can: full-id: "Full Identifier: 435815424 (0x19fa0400)" "Full ID: 435815424 (0x19fa0400)" "Full ID" "FID"
170225-170226 can: srr: "Substitute remote request: 1" "SRR: 1" "SRR"
170269-170270 can: stuff-bit: "Stuff bit: 1" "SB: 1" "SB"
170271-170272 can: rtr: "Remote transmission request: data frame" "RTR: data frame" "RTR"
170273-170274 can: reserved-bit: "Reserved bit 1: 0" "RB1: 0" "RB1"
170275-170276 can: reserved-bit: "Reserved bit 0: 0" "RB0: 0" "RB0"
170277-170284 can: dlc: "Data length code: 8" "DLC: 8" "DLC"
170289-170290 can: stuff-bit: "Stuff bit: 1" "SB: 1" "SB"
170311-170312 can: stuff-bit: "Stuff bit: 0" "SB: 0" "SB"
170363-170364 can: stuff-bit: "Stuff bit: 0" "SB: 0" "SB"
170381-170382 can: stuff-bit: "Stuff bit: 1" "SB: 1" "SB"
170393-170394 can: stuff-bit: "Stuff bit: 1" "SB: 1" "SB"
170405-170406 can: stuff-bit: "Stuff bit: 1" "SB: 1" "SB"
170285-170302 can: data: "Data byte 0: 0x09" "DB 0: 0x09" "DB"
170303-170320 can: data: "Data byte 1: 0xf2" "DB 1: 0xf2" "DB"
170321-170336 can: data: "Data byte 2: 0x1e" "DB 2: 0x1e" "DB"
170337-170352 can: data: "Data byte 3: 0x52" "DB 3: 0x52" "DB"
170353-170370 can: data: "Data byte 4: 0xff" "DB 4: 0xff" "DB"
170371-170388 can: data: "Data byte 5: 0x00" "DB 5: 0x00" "DB"
170389-170408 can: data: "Data byte 6: 0x00" "DB 6: 0x00" "DB"
170409-170424 can: data: "Data byte 7: 0x35" "DB 7: 0x35" "DB"
170425-170454 can: crc-sequence: "CRC sequence: 0x0acd" "CRC: 0x0acd" "CRC"
170455-170456 can: crc-delimiter: "CRC delimiter: 1" "CRC d: 1" "CRC d"
170457-170458 can: ack-slot: "ACK slot: ACK" "ACK s: ACK" "ACK s"
170459-170460 can: ack-delimiter: "ACK delimiter: 1" "ACK d: 1" "ACK d"
170461-170474 can: eof: "End of frame" "EOF" "E"
171696-171697 can: sof: "Start of frame" "SOF" "S"
171716-171717 can: stuff-bit: "Stuff bit: 0" "SB: 0" "SB"
171698-171721 can: id: "Identifier: 1662 (0x67e)" "ID: 1662 (0x67e)" "ID"
171724-171725 can: ide: "Identifier extension bit: extended frame" "IDE: extended frame" "IDE"
171738-171739 can: stuff-bit: "Stuff bit: 1" "SB: 1" "SB"
171754-171755 can: stuff-bit: "Stuff bit: 1" "SB: 1" "SB"
171726-171765 can: ext-id: "Extended Identifier: 132096 (0x20400)" "Extended ID: 132096 (0x20400)" "Extended ID" "EID"
171726-171765 can: full-id: "Full Identifier: 435815424 (0x19fa0400)" "Full ID: 435815424 (0x19fa0400)" "Full ID" "FID"
171722-171723 can: srr: "Substitute remote request: 1" "SRR: 1" "SRR"
171766-171767 can: stuff-bit: "Stuff bit: 1" "SB: 1" "SB"
171768-171769 can: rtr: "Remote transmission request: data frame" "RTR: data frame" "RTR"
171770-171771 can: reserved-bit: "Reserved bit 1: 0" "RB1: 0" "RB1"
171772-171773 can: reserved-bit: "Reserved bit 0: 0" "RB0: 0" "RB0"
171774-171781 can: dlc: "Data length code: 8" "DLC: 8" "DLC"
171786-171787 can: stuff-bit: "Stuff bit: 1" "SB: 1" "SB"
171808-171809 can: stuff-bit: "Stuff bit: 1" "SB: 1" "SB"
171828-171829 can: stuff-bit: "Stuff bit: 1" "SB: 1" "SB"
171840-171841 can: stuff-bit: "Stuff bit: 1" "SB: 1" "SB"
171852-171853 can: stuff-bit: "Stuff bit: 1" "SB: 1" "SB"
171864-171865 can: stuff-bit: "Stuff bit: 1" "SB: 1" "SB"
171876-171877 can: stuff-bit: "Stuff bit: 1" "SB: 1" "SB"
171888-171889 can: stuff-bit: "Stuff bit: 1" "SB: 1" "SB"
171782-171799 can: data: "Data byte 0: 0x0a" "DB 0: 0x0a" "DB"
171800-171817 can: data: "Data byte 1: 0x0d" "DB 1: 0x0d" "DB"
171818-171835 can: data: "Data byte 2: 0x00" "DB 2: 0x00" "DB"
171836-171855 can: data: "Data byte 3: 0x00" "DB 3: 0x00" "DB"
171856-171873 can: data: "Data byte 4: 0x00" "DB 4: 0x00" "DB"
171874-171893 can: data: "Data byte 5: 0x00" "DB 5: 0x00" "DB"
171894-171909 can: data: "Data byte 6: 0xf1" "DB 6: 0xf1" "DB"
171910-171925 can: data: "Data byte 7: 0x0b" "DB 7: 0x0b" "DB"
171926-171955 can: crc-sequence: "CRC sequence: 0x2a8f" "CRC: 0x2a8f" "CRC"
171956-171957 can: crc-delimiter: "CRC delimiter: 1" "CRC d: 1" "CRC d"
171958-171959 can: stuff-bit: "Stuff bit: 0" "SB: 0" "SB"
171960-171961 can: ack-slot: "ACK slot: NACK" "ACK s: NACK" "ACK s"
171962-171963 can: ack-delimiter: "ACK delimiter: 1" "ACK d: 1" "ACK d"
171964-171977 can: eof: "End of frame" "EOF" "E"
173220-173221 can: sof: "Start of frame" "SOF" "S"
173240-173241 can: stuff-bit: "Stuff bit: 0" "SB: 0" "SB"
173222-173245 can: id: "Identifier: 1662 (0x67e)" "ID: 1662 (0x67e)" "ID"
173248-173249 can: ide: "Identifier extension bit: extended frame" "IDE: extended frame" "IDE"
173262-173263 can: stuff-bit: "Stuff bit: 1" "SB: 1" "SB"
173278-173279 can: stuff-bit: "Stuff bit: 1" "SB: 1" "SB"
173250-173289 can: ext-id: "Extended Identifier: 132096 (0x20400)" "Extended ID: 132096 (0x20400)" "Extended ID" "EID"
173250-173289 can: full-id: "Full Identifier: 435815424 (0x19fa0400)" "Full ID: 435815424 (0x19fa0400)" "Full ID" "FID"
173246-173247 can: srr: "Substitute remote request: 1" "SRR: 1" "SRR"
173290-173291 can: stuff-bit: "Stuff bit: 1" "SB: 1" "SB"
173292-173293 can: rtr: "Remote transmission request: data frame" "RTR: data frame" "RTR"
173294-173295 can: reserved-bit: "Reserved bit 1: 0" "RB1: 0" "RB1"
173296-173297 can: reserved-bit: "Reserved bit 0: 0" "RB0: 0" "RB0"
173298-173305 can: dlc: "Data length code: 8" "DLC: 8" "DLC"
173310-173311 can: stuff-bit: "Stuff bit: 1" "SB: 1" "SB"
173350-173351 can: stuff-bit: "Stuff bit: 1" "SB: 1" "SB"
173414-173415 can: stuff-bit: "Stuff bit: 0" "SB: 0" "SB"
173432-173433 can: stuff-bit: "Stuff bit: 1" "SB: 1" "SB"
173306-173323 can: data: "Data byte 0: 0x0b" "DB 0: 0x0b" "DB"
173324-173339 can: data: "Data byte 1: 0x17" "DB 1: 0x17" "DB"
173340-173357 can: data: "Data byte 2: 0x04" "DB 2: 0x04" "DB"
173358-173373 can: data: "Data byte 3: 0x2b" "DB 3: 0x2b" "DB"
173374-173389 can: data: "Data byte 4: 0x9d" "DB 4: 0x9d" "DB"
173390-173405 can: data: "Data byte 5: 0x39" "DB 5: 0x39" "DB"
173406-173423 can: data: "Data byte 6: 0xfe" "DB 6: 0xfe" "DB"
173424-173441 can: data: "Data byte 7: 0x00" "DB 7: 0x00" "DB"
173442-173471 can: crc-sequence: "CRC sequence: 0x5d7b" "CRC: 0x5d7b" "CRC"
173472-173473 can: crc-delimiter: "CRC delimiter: 0" "CRC d: 0" "CRC d"
173474-173475 can: ack-slot: "ACK slot: ACK" "ACK s: ACK" "ACK s"
173476-173477 can: ack-delimiter: "ACK delimiter: 1" "ACK d: 1" "ACK d"
173478-173491 can: eof: "End of frame" "EOF" "E"
174697-174698 can: sof: "Start of frame" "SOF" "S"
174717-174718 can: stuff-bit: "Stuff bit: 0" "SB: 0" "SB"
174699-174722 can: id: "Identifier: 1662 (0x67e)" "ID: 1662 (0x67e)" "ID"
174725-174726 can: ide: "Identifier extension bit: extended frame" "IDE: extended frame" "IDE"
174739-174740 can: stuff-bit: "Stuff bit: 1" "SB: 1" "SB"
174755-174756 can: stuff-bit: "Stuff bit: 1" "SB: 1" "SB"
174727-174766 can: ext-id: "Extended Identifier: 132096 (0x20400)" "Extended ID: 132096 (0x20400)" "Extended ID" "EID"
174727-174766 can: full-id: "Full Identifier: 435815424 (0x19fa0400)" "Full ID: 435815424 (0x19fa0400)" "Full ID" "FID"
174723-174724 can: srr: "Substitute remote request: 1" "SRR: 1" "SRR"
174767-174768 can: stuff-bit: "Stuff bit: 1" "SB: 1" "SB"
174769-174770 can: rtr: "Remote transmission request: data frame" "RTR: data frame" "RTR"
174771-174772 can: reserved-bit: "Reserved bit 1: 0" "RB1: 0" "RB1"
174773-174774 can: reserved-bit: "Reserved bit 0: 0" "RB0: 0" "RB0"
174775-174782 can: dlc: "Data length code: 8" "DLC: 8" "DLC"
174787-174788 can: stuff-bit: "Stuff bit: 1" "SB: 1" "SB"
174807-174808 can: stuff-bit: "Stuff bit: 1" "SB: 1" "SB"
174819-174820 can: stuff-bit: "Stuff bit: 1" "SB: 1" "SB"
174831-174832 can: stuff-bit: "Stuff bit: 1" "SB: 1" "SB"
174843-174844 can: stuff-bit: "Stuff bit: 1" "SB: 1" "SB"
174855-174856 can: stuff-bit: "Stuff bit: 1" "SB: 1" "SB"
174877-174878 can: stuff-bit: "Stuff bit: 1" "SB: 1" "SB"
174895-174896 can: stuff-bit: "Stuff bit: 1" "SB: 1" "SB"
174905-174906 can: stuff-bit: "Stuff bit: 0" "SB: 0" "SB"
174783-174800 can: data: "Data byte 0: 0x0c" "DB 0: 0x0c" "DB"
174801-174818 can: data: "Data byte 1: 0x00" "DB 1: 0x00" "DB"
174821-174838 can: data: "Data byte 2: 0x00" "DB 2: 0x00" "DB"
174839-174858 can: data: "Data byte 3: 0x00" "DB 3: 0x00" "DB"
174859-174874 can: data: "Data byte 4: 0xf0" "DB 4: 0xf0" "DB"
174875-174892 can: data: "Data byte 5: 0x10" "DB 5: 0x10" "DB"
174893-174912 can: data: "Data byte 6: 0x7f" "DB 6: 0x7f" "DB"
174913-174928 can: data: "Data byte 7: 0x16" "DB 7: 0x16" "DB"
174943-174944 can: stuff-bit: "Stuff bit: 1" "SB: 1" "SB"
174929-174960 can: crc-sequence: "CRC sequence: 0x2058" "CRC: 0x2058" "CRC"
174961-174962 can: crc-delimiter: "CRC delimiter: 1" "CRC d: 1" "CRC d"
174963-174964 can: ack-slot: "ACK slot: ACK" "ACK s: ACK" "ACK s"
174965-174966 can: ack-delimiter: "ACK delimiter: 1" "ACK d: 1" "ACK d"
174967-174980 can: eof: "End of frame" "EOF" "E"
176197-176198 can: sof: "Start of frame" "SOF" "S"
176217-176218 can: stuff-bit: "Stuff bit: 0" "SB: 0" "SB"
176199-176222 can: id: "Identifier: 1662 (0x67e)" "ID: 1662 (0x67e)" "ID"
176225-176226 can: ide: "Identifier extension bit: extended frame" "IDE: extended frame" "IDE"
176239-176240 can: stuff-bit: "Stuff bit: 1" "SB: 1" "SB"
176255-176256 can: stuff-bit: "Stuff bit: 1" "SB: 1" "SB"
176227-176266 can: ext-id: "Extended Identifier: 132096 (0x20400)" "Extended ID: 132096 (0x20400)" "Extended ID" "EID"
176227-176266 can: full-id: "Full Identifier: 435815424 (0x19fa0400)" "Full ID: 435815424 (0x19fa0400)" "Full ID" "FID"
176223-176224 can: srr: "Substitute remote request: 1" "SRR: 1" "SRR"
176267-176268 can: stuff-bit: "Stuff bit: 1" "SB: 1" "SB"
176269-176270 can: rtr: "Remote transmission request: data frame" "RTR: data frame" "RTR"
176271-176272 can: reserved-bit: "Reserved bit 1: 0" "RB1: 0" "RB1"
176273-176274 can: reserved-bit: "Reserved bit 0: 0" "RB0: 0" "RB0"
176275-176282 can: dlc: "Data length code: 8" "DLC: 8" "DLC"
176287-176288 can: stuff-bit: "Stuff bit: 1" "SB: 1" "SB"
176357-176358 can: stuff-bit: "Stuff bit: 0" "SB: 0" "SB"
176375-176376 can: stuff-bit: "Stuff bit: 1" "SB: 1" "SB"
176387-176388 can: stuff-bit: "Stuff bit: 1" "SB: 1" "SB"
176399-176400 can: stuff-bit: "Stuff bit: 1" "SB: 1" "SB"
176411-176412 can: stuff-bit: "Stuff bit: 1" "SB: 1" "SB"
176283-176300 can: data: "Data byte 0: 0x0e" "DB 0: 0x0e" "DB"
176301-176316 can: data: "Data byte 1: 0x86" "DB 1: 0x86" "DB"
176317-176332 can: data: "Data byte 2: 0xeb" "DB 2: 0xeb" "DB"
176333-176348 can: data: "Data byte 3: 0x39" "DB 3: 0x39" "DB"
176349-176366 can: data: "Data byte 4: 0xfe" "DB 4: 0xfe" "DB"
176367-176384 can: data: "Data byte 5: 0x00" "DB 5: 0x00" "DB"
176385-176404 can: data: "Data byte 6: 0x00" "DB 6: 0x00" "DB"
176405-176422 can: data: "Data byte 7: 0x00" "DB 7: 0x00" "DB"
176423-176424 can: stuff-bit: "Stuff bit: 1" "SB: 1" "SB"
176425-176454 can: crc-sequence: "CRC sequence: 0x64bb" "CRC: 0x64bb" "CRC"
176455-176456 can: crc-delimiter: "CRC delimiter: 0" "CRC d: 0" "CRC d"
176457-176458 can: ack-slot: "ACK slot: NACK" "ACK s: NACK" "ACK s"
176459-176460 can: ack-delimiter: "ACK delimiter: 1" "ACK d: 1" "ACK d"
176461-176474 can: eof: "End of frame" "EOF" "E"
177698-177699 can: sof: "Start of frame" "SOF" "S"
177718-177719 can: stuff-bit: "Stuff bit: 0" "SB: 0" "SB"
177700-177723 can: id: "Identifier: 1662 (0x67e)" "ID: 1662 (0x67e)" "ID"
177726-177727 can: ide: "Identifier extension bit: extended frame" "IDE: extended frame" "IDE"
177740-177741 can: stuff-bit: "Stuff bit: 1" "SB: 1" "SB"
177756-177757 can: stuff-bit: "Stuff bit: 1" "SB: 1" "SB"
177728-177767 can: ext-id: "Extended Identifier: 132096 (0x20400)" "Extended ID: 132096 (0x20400)" "Extended ID" "EID"
177728-177767 can: full-id: "Full Identifier: 435815424 (0x19fa0400)" "Full ID: 435815424 (0x19fa0400)" "Full ID" "FID"
177724-177725 can: srr: "Substitute remote request: 1" "SRR: 1" "SRR"
177768-177769 can: stuff-bit: "Stuff bit: 1" "SB: 1" "SB"
177770-177771 can: rtr: "Remote transmission request: data frame" "RTR: data frame" "RTR"
177772-177773 can: reserved-bit: "Reserved bit 1: 0" "RB1: 0" "RB1"
177774-177775 can: reserved-bit: "Reserved bit 0: 0" "RB0: 0" "RB0"
177776-177783 can: dlc: "Data length code: 8" "DLC: 8" "DLC"
177788-177789 can: stuff-bit: "Stuff bit: 1" "SB: 1" "SB"
177810-177811 can: stuff-bit: "Stuff bit: 1" "SB: 1" "SB"
177838-177839 can: stuff-bit: "Stuff bit: 1" "SB: 1" "SB"
177874-177875 can: stuff-bit: "Stuff bit: 1" "SB: 1" "SB"
177784-177801 can: data: "Data byte 0: 0x0e" "DB 0: 0x0e" "DB"
177802-177819 can: data: "Data byte 1: 0x00" "DB 1: 0x00" "DB"
177820-177835 can: data: "Data byte 2: 0xf0" "DB 2: 0xf0" "DB"
177836-177853 can: data: "Data byte 3: 0x16" "DB 3: 0x16" "DB"
177854-177869 can: data: "Data byte 4: 0x68" "DB 4: 0x68" "DB"
177870-177887 can: data: "Data byte 5: 0x03" "DB 5: 0x03" "DB"
177888-177903 can: data: "Data byte 6: 0x38" "DB 6: 0x38" "DB"
177904-177919 can: data: "Data byte 7: 0x64" "DB 7: 0x64" "DB"
177920-177949 can: crc-sequence: "CRC sequence: 0x5e38" "CRC: 0x5e38" "CRC"
177950-177951 can: crc-delimiter: "CRC delimiter: 1" "CRC d: 1" "CRC d"
177952-177953 can: ack-slot: "ACK slot: ACK" "ACK s: ACK" "ACK s"
177954-177955 can: ack-delimiter: "ACK delimiter: 1" "ACK d: 1" "ACK d"
177956-177969 can: eof: "End of frame" "EOF" "E"
179221-179222 can: sof: "Start of frame" "SOF" "S"
179241-179242 can: stuff-bit: "Stuff bit: 0" "SB: 0" "SB"
179223-179246 can: id: "Identifier: 1662 (0x67e)" "ID: 1662 (0x67e)" "ID"
179249-179250 can: ide: "Identifier extension bit: extended frame" "IDE: extended frame" "IDE"
179263-179264 can: stuff-bit: "Stuff bit: 1" "SB: 1" "SB"
179279-179280 can: stuff-bit: "Stuff bit: 1" "SB: 1" "SB"
179251-179290 can: ext-id: "Extended Identifier: 132096 (0x20400)" "Extended ID: 132096 (0x20400)" "Extended ID" "EID"
179251-179290 can: full-id: "Full Identifier: 435815424 (0x19fa0400)" "Full ID: 435815424 (0x19fa0400)" "Full ID" "FID"
179247-179248 can: srr: "Substitute remote request: 1" "SRR: 1" "SRR"
179291-179292 can: stuff-bit: "Stuff bit: 1" "SB: 1" "SB"
179293-179294 can: rtr: "Remote transmission request: data frame" "RTR: data frame" "RTR"
179295-179296 can: reserved-bit: "Reserved bit 1: 0" "RB1: 0" "RB1"
179297-179298 can: reserved-bit: "Reserved bit 0: 0" "RB0: 0" "RB0"
179299-179306 can: dlc: "Data length code: 8" "DLC: 8" "DLC"
179311-179312 can: stuff-bit: "Stuff bit: 1" "SB: 1" "SB"
179327-179328 can: stuff-bit: "Stuff bit: 0" "SB: 0" "SB"
179353-179354 can: stuff-bit: "Stuff bit: 0" "SB: 0" "SB"
179371-179372 can: stuff-bit: "Stuff bit: 1" "SB: 1" "SB"
179383-179384 can: stuff-bit: "Stuff bit: 1" "SB: 1" "SB"
179395-179396 can: stuff-bit: "Stuff bit: 1" "SB: 1" "SB"
179407-179408 can: stuff-bit: "Stuff bit: 1" "SB: 1" "SB"
179419-179420 can: stuff-bit: "Stuff bit: 1" "SB: 1" "SB"
179431-179432 can: stuff-bit: "Stuff bit: 1" "SB: 1" "SB"
179307-179324 can: data: "Data byte 0: 0x0f" "DB 0: 0x0f" "DB"
179325-179342 can: data: "Data byte 1: 0x9c" "DB 1: 0x9c" "DB"
179343-179360 can: data: "Data byte 2: 0xff" "DB 2: 0xff" "DB"
179361-179378 can: data: "Data byte 3: 0x00" "DB 3: 0x00" "DB"
179379-179398 can: data: "Data byte 4: 0x00" "DB 4: 0x00" "DB"
179399-179416 can: data: "Data byte 5: 0x00" "DB 5: 0x00" "DB"
179417-179436 can: data: "Data byte 6: 0x00" "DB 6: 0x00" "DB"
179437-179452 can: data: "Data byte 7: 0xf0" "DB 7: 0xf0" "DB"
179455-179456 can: stuff-bit: "Stuff bit: 1" "SB: 1" "SB"
179453-179484 can: crc-sequence: "CRC sequence: 0x3128" "CRC: 0x3128" "CRC"
179485-179486 can: crc-delimiter: "CRC delimiter: 1" "CRC d: 1" "CRC d"
179487-179488 can: ack-slot: "ACK slot: ACK" "ACK s: ACK" "ACK s"
179489-179490 can: ack-delimiter: "ACK delimiter: 1" "ACK d: 1" "ACK d"
179491-179504 can: eof: "End of frame" "EOF" "E"
180697-180698 can: sof: "Start of frame" "SOF" "S"
180717-180718 can: stuff-bit: "Stuff bit: 0" "SB: 0" "SB"
180699-180722 can: id: "Identifier: 1662 (0x67e)" "ID: 1662 (0x67e)" "ID"
180725-180726 can: ide: "Identifier extension bit: extended frame" "IDE: extended frame" "IDE"
180739-180740 can: stuff-bit: "Stuff bit: 1" "SB: 1" "SB"
180755-180756 can: stuff-bit: "Stuff bit: 1" "SB: 1" "SB"
180727-180766 can: ext-id: "Extended Identifier: 132096 (0x20400)" "Extended ID: 132096 (0x20400)" "Extended ID" "EID"
180727-180766 can: full-id: "Full Identifier: 435815424 (0x19fa0400)" "Full ID: 435815424 (0x19fa0400)" "Full ID" "FID"
180723-180724 can: srr: "Substitute remote request: 1" "SRR: 1" "SRR"
180767-180768 can: stuff-bit: "Stuff bit: 1" "SB: 1" "SB"
180769-180770 can: rtr: "Remote transmission request: data frame" "RTR: data frame" "RTR"
180771-180772 can: reserved-bit: "Reserved bit 1: 0" "RB1: 0" "RB1"
180773-180774 can: reserved-bit: "Reserved bit 0: 0" "RB0: 0" "RB0"
180775-180782 can: dlc: "Data length code: 8" "DLC: 8" "DLC"
180787-180788 can: stuff-bit: "Stuff bit: 1" "SB: 1" "SB"
180803-180804 can: stuff-bit: "Stuff bit: 1" "SB: 1" "SB"
180823-180824 can: stuff-bit: "Stuff bit: 0" "SB: 0" "SB"
180841-180842 can: stuff-bit: "Stuff bit: 1" "SB: 1" "SB"
180911-180912 can: stuff-bit: "Stuff bit: 0" "SB: 0" "SB"
180783-180800 can: data: "Data byte 0: 0x10" "DB 0: 0x10" "DB"
180801-180818 can: data: "Data byte 1: 0x17" "DB 1: 0x17" "DB"
180819-180836 can: data: "Data byte 2: 0xe8" "DB 2: 0xe8" "DB"
180837-180854 can: data: "Data byte 3: 0x0a" "DB 3: 0x0a" "DB"
180855-180870 can: data: "Data byte 4: 0x35" "DB 4: 0x35" "DB"
180871-180886 can: data: "Data byte 5: 0x97" "DB 5: 0x97" "DB"
180887-180902 can: data: "Data byte 6: 0x39" "DB 6: 0x39" "DB"
180903-180920 can: data: "Data byte 7: 0xff" "DB 7: 0xff" "DB"
180923-180924 can: stuff-bit: "Stuff bit: 0" "SB: 0" "SB"
180921-180952 can: crc-sequence: "CRC sequence: 0x6af3" "CRC: 0x6af3" "CRC"
180953-180954 can: crc-delimiter: "CRC delimiter: 0" "CRC d: 0" "CRC d"
180955-180956 can: ack-slot: "ACK slot: NACK" "ACK s: NACK" "ACK s"
180957-180958 can: ack-delimiter: "ACK delimiter: 1" "ACK d: 1" "ACK d"
180959-180972 can: eof: "End of frame" "EOF" "E"
182196-182197 can: sof: "Start of frame" "SOF" "S"
182216-182217 can: stuff-bit: "Stuff bit: 0" "SB: 0" "SB"
182198-182221 can: id: "Identifier: 1662 (0x67e)" "ID: 1662 (0x67e)" "ID"
182224-182225 can: ide: "Identifier extension bit: extended frame" "IDE: extended frame" "IDE"
182238-182239 can: stuff-bit: "Stuff bit: 1" "SB: 1" "SB"
182254-182255 can: stuff-bit: "Stuff bit: 1" "SB: 1" "SB"
182226-182265 can: ext-id: "Extended Identifier: 132096 (0x20400)" "Extended ID: 132096 (0x20400)" "Extended ID" "EID"
182226-182265 can: full-id: "Full Identifier: 435815424 (0x19fa0400)" "Full ID: 435815424 (0x19fa0400)" "Full ID" "FID"
182222-182223 can: srr: "Substitute remote request: 1" "SRR: 1" "SRR"
182266-182267 can: stuff-bit: "Stuff bit: 1" "SB: 1" "SB"
182268-182269 can: rtr: "Remote transmission request: data frame" "RTR: data frame" "RTR"
182270-182271 can: reserved-bit: "Reserved bit 1: 0" "RB1: 0" "RB1"
182272-182273 can: reserved-bit: "Reserved bit 0: 0" "RB0: 0" "RB0"
182274-182281 can: dlc: "Data length code: 8" "DLC: 8" "DLC"
182286-182287 can: stuff-bit: "Stuff bit: 1" "SB: 1" "SB"
182310-182311 can: stuff-bit: "Stuff bit: 1" "SB: 1" "SB"
182322-182323 can: stuff-bit: "Stuff bit: 1" "SB: 1" "SB"
182334-182335 can: stuff-bit: "Stuff bit: 1" "SB: 1" "SB"
182346-182347 can: stuff-bit: "Stuff bit: 1" "SB: 1" "SB"
182358-182359 can: stuff-bit: "Stuff bit: 1" "SB: 1" "SB"
182370-182371 can: stuff-bit: "Stuff bit: 1" "SB: 1" "SB"
182394-182395 can: stuff-bit: "Stuff bit: 1" "SB: 1" "SB"
182282-182299 can: data: "Data byte 0: 0x11" "DB 0: 0x11" "DB"
182300-182317 can: data: "Data byte 1: 0x00" "DB 1: 0x00" "DB"
182318-182337 can: data: "Data byte 2: 0x00" "DB 2: 0x00" "DB"
182338-182355 can: data: "Data byte 3: 0x00" "DB 3: 0x00" "DB"
182356-182375 can: data: "Data byte 4: 0x00" "DB 4: 0x00" "DB"
182376-182391 can: data: "Data byte 5: 0xf0" "DB 5: 0xf0" "DB"
182392-182409 can: data: "Data byte 6: 0x19" "DB 6: 0x19" "DB"
182410-182425 can: data: "Data byte 7: 0xc5" "DB 7: 0xc5" "DB"
182426-182455 can: crc-sequence: "CRC sequence: 0x557b" "CRC: 0x557b" "CRC"
182456-182457 can: crc-delimiter: "CRC delimiter: 1" "CRC d: 1" "CRC d"
182458-182459 can: ack-slot: "ACK slot: ACK" "ACK s: ACK" "ACK s"
182460-182461 can: ack-delimiter: "ACK delimiter: 1" "ACK d: 1" "ACK d"
182462-182475 can: eof: "End of frame" "EOF" "E"
183698-183699 can: sof: "Start of frame" "SOF" "S"
183718-183719 can: stuff-bit: "Stuff bit: 0" "SB: 0" "SB"
183700-183723 can: id: "Identifier: 1662 (0x67e)" "ID: 1662 (0x67e)" "ID"
183726-183727 can: ide: "Identifier extension bit: extended frame" "IDE: extended frame" "IDE"
183740-183741 can: stuff-bit: "Stuff bit: 1" "SB: 1" "SB"
183756-183757 can: stuff-bit: "Stuff bit: 1" "SB: 1" "SB"
183728-183767 can: ext-id: "Extended Identifier: 132096 (0x20400)" "Extended ID: 132096 (0x20400)" "Extended ID" "EID"
183728-183767 can: full-id: "Full Identifier: 435815424 (0x19fa0400)" "Full ID: 435815424 (0x19fa0400)" "Full ID" "FID"
183724-183725 can: srr: "Substitute remote request: 1" "SRR: 1" "SRR"
183768-183769 can: stuff-bit: "Stuff bit: 1" "SB: 1" "SB"
183770-183771 can: rtr: "Remote transmission request: data frame" "RTR: data frame" "RTR"
183772-183773 can: reserved-bit: "Reserved bit 1: 0" "RB1: 0" "RB1"
183774-183775 can: reserved-bit: "Reserved bit 0: 1" "RB0: 1" "RB0"
183776-183783 can: dlc: "Data length code: 0" "DLC: 0" "DLC"
183786-183787 can: stuff-bit: "Stuff bit: 1" "SB: 1" "SB"
183808-183809 can: stuff-bit: "Stuff bit: 1" "SB: 1" "SB"
183784-183817 can: crc-sequence: "CRC sequence: 0x1204" "CRC: 0x1204" "CRC"
183818-183819 can: crc-delimiter: "CRC delimiter: 1" "CRC d: 1" "CRC d"
183820-183821 can: ack-slot: "ACK slot: ACK" "ACK s: ACK" "ACK s"
183822-183823 can: ack-delimiter: "ACK delimiter: 0" "ACK d: 0" "ACK d"
183824-183837 can: eof: "End of frame" "EOF" "E"
183838-183839 can: sof: "Start of frame" "SOF" "S"
183840-183861 can: id: "Identifier: 1575 (0x627)" "ID: 1575 (0x627)" "ID"
183864-183865 can: ide: "Identifier extension bit: standard frame" "IDE: standard frame" "IDE"
183866-183867 can: reserved-bit: "Reserved bit 0: 1" "RB0: 1" "RB0"
183862-183863 can: rtr: "Remote transmission request: data frame" "RTR: data frame" "RTR"
183868-183875 can: dlc: "Data length code: 15" "DLC: 15" "DLC"
183876-183877 can: stuff-bit: "Stuff bit: 0" "SB: 0" "SB"
183908-183909 can: stuff-bit: "Stuff bit: 1" "SB: 1" "SB"
183938-183939 can: stuff-bit: "Stuff bit: 0" "SB: 0" "SB"
183878-183893 can: data: "Data byte 0: 0xe5" "DB 0: 0xe5" "DB"
183894-183911 can: data: "Data byte 1: 0x40" "DB 1: 0x40" "DB"
183912-183927 can: data: "Data byte 2: 0x10" "DB 2: 0x10" "DB"
183928-183945 can: data: "Data byte 3: 0xfb" "DB 3: 0xfb" "DB"
183946-183961 can: data: "Data byte 4: 0xaf" "DB 4: 0xaf" "DB"
183962-183977 can: data: "Data byte 5: 0xff" "DB 5: 0xff" "DB"
183978-183993 can: data: "Data byte 6: 0xff" "DB 6: 0xff" "DB"
183994-184009 can: data: "Data byte 7: 0xff" "DB 7: 0xff" "DB"
184010-184025 can: data: "Data byte 8: 0xff" "DB 8: 0xff" "DB"
184026-184041 can: data: "Data byte 9: 0xff" "DB 9: 0xff" "DB"
184042-184057 can: data: "Data byte 10: 0xff" "DB 10: 0xff" "DB"
184058-184073 can: data: "Data byte 11: 0xff" "DB 11: 0xff" "DB"
184074-184089 can: data: "Data byte 12: 0xff" "DB 12: 0xff" "DB"
184090-184105 can: data: "Data byte 13: 0xff" "DB 13: 0xff" "DB"
184106-184121 can: data: "Data byte 14: 0xff" "DB 14: 0xff" "DB"
184122-184151 can: crc-sequence: "CRC sequence: 0x7fff" "CRC: 0x7fff" "CRC"
184152-184153 can: crc-delimiter: "CRC delimiter: 1" "CRC d: 1" "CRC d"
184154-184155 can: ack-slot: "ACK slot: NACK" "ACK s: NACK" "ACK s"
184156-184157 can: ack-delimiter: "ACK delimiter: 1" "ACK d: 1" "ACK d"
184158-184171 can: eof: "End of frame" "EOF" "E"
185223-185224 can: sof: "Start of frame" "SOF" "S"
185243-185244 can: stuff-bit: "Stuff bit: 0" "SB: 0" "SB"
185225-185248 can: id: "Identifier: 1662 (0x67e)" "ID: 1662 (0x67e)" "ID"
185251-185252 can: ide: "Identifier extension bit: extended frame" "IDE: extended frame" "IDE"
185265-185266 can: stuff-bit: "Stuff bit: 1" "SB: 1" "SB"
185281-185282 can: stuff-bit: "Stuff bit: 1" "SB: 1" "SB"
185253-185292 can: ext-id: "Extended Identifier: 132096 (0x20400)" "Extended ID: 132096 (0x20400)" "Extended ID" "EID"
185253-185292 can: full-id: "Full Identifier: 435815424 (0x19fa0400)" "Full ID: 435815424 (0x19fa0400)" "Full ID" "FID"
185249-185250 can: srr: "Substitute remote request: 1" "SRR: 1" "SRR"
185293-185294 can: stuff-bit: "Stuff bit: 1" "SB: 1" "SB"
185295-185296 can: rtr: "Remote transmission request: data frame" "RTR: data frame" "RTR"
185297-185298 can: reserved-bit: "Reserved bit 1: 0" "RB1: 0" "RB1"
185299-185300 can: reserved-bit: "Reserved bit 0: 0" "RB0: 0" "RB0"
185301-185308 can: dlc: "Data length code: 8" "DLC: 8" "DLC"
185313-185314 can: stuff-bit: "Stuff bit: 1" "SB: 1" "SB"
185337-185338 can: stuff-bit: "Stuff bit: 1" "SB: 1" "SB"
185349-185350 can: stuff-bit: "Stuff bit: 1" "SB: 1" "SB"
185361-185362 can: stuff-bit: "Stuff bit: 1" "SB: 1" "SB"
185391-185392 can: stuff-bit: "Stuff bit: 0" "SB: 0" "SB"
185403-185404 can: stuff-bit: "Stuff bit: 0" "SB: 0" "SB"
185415-185416 can: stuff-bit: "Stuff bit: 0" "SB: 0" "SB"
185427-185428 can: stuff-bit: "Stuff bit: 0" "SB: 0" "SB"
185439-185440 can: stuff-bit: "Stuff bit: 0" "SB: 0" "SB"
185451-185452 can: stuff-bit: "Stuff bit: 0" "SB: 0" "SB"
185309-185326 can: data: "Data byte 0: 0x13" "DB 0: 0x13" "DB"
185327-185344 can: data: "Data byte 1: 0x00" "DB 1: 0x00" "DB"
185345-185364 can: data: "Data byte 2: 0x00" "DB 2: 0x00" "DB"
185365-185380 can: data: "Data byte 3: 0xf0" "DB 3: 0xf0" "DB"
185381-185398 can: data: "Data byte 4: 0xff" "DB 4: 0xff" "DB"
185399-185418 can: data: "Data byte 5: 0xff" "DB 5: 0xff" "DB"
185419-185436 can: data: "Data byte 6: 0xff" "DB 6: 0xff" "DB"
185437-185456 can: data: "Data byte 7: 0xff" "DB 7: 0xff" "DB"
185463-185464 can: stuff-bit: "Stuff bit: 0" "SB: 0" "SB"
185483-185484 can: stuff-bit: "Stuff bit: 1" "SB: 1" "SB"
185457-185490 can: crc-sequence: "CRC sequence: 0x7706" "CRC: 0x7706" "CRC"
185491-185492 can: crc-delimiter: "CRC delimiter: 0" "CRC d: 0" "CRC d"
185493-185494 can: ack-slot: "ACK slot: NACK" "ACK s: NACK" "ACK s"
185495-185496 can: ack-delimiter: "ACK delimiter: 1" "ACK d: 1" "ACK d"
185497-185510 can: eof: "End of frame" "EOF" "E"
186696-186697 can: sof: "Start of frame" "SOF" "S"
186716-186717 can: stuff-bit: "Stuff bit: 0" "SB: 0" "SB"
186698-186721 can: id: "Identifier: 894 (0x37e)" "ID: 894 (0x37e)" "ID"
186724-186725 can: ide: "Identifier extension bit: extended frame" "IDE: extended frame" "IDE"
186736-186737 can: stuff-bit: "Stuff bit: 1" "SB: 1" "SB"
186758-186759 can: stuff-bit: "Stuff bit: 1" "SB: 1" "SB"
186726-186765 can: ext-id: "Extended Identifier: 1280 (0x500)" "Extended ID: 1280 (0x500)" "Extended ID" "EID"
186726-186765 can: full-id: "Full Identifier: 234358016 (0xdf80500)" "Full ID: 234358016 (0xdf80500)" "Full ID" "FID"
186722-186723 can: srr: "Substitute remote request: 1" "SRR: 1" "SRR"
186766-186767 can: rtr: "Remote transmission request: data frame" "RTR: data frame" "RTR"
186768-186769 can: reserved-bit: "Reserved bit 1: 0" "RB1: 0" "RB1"
186770-186771 can: stuff-bit: "Stuff bit: 1" "SB: 1" "SB"
186772-186773 can: reserved-bit: "Reserved bit 0: 0" "RB0: 0" "RB0"
186774-186781 can: dlc: "Data length code: 8" "DLC: 8" "DLC"
186786-186787 can: stuff-bit: "Stuff bit: 1" "SB: 1" "SB"
186798-186799 can: stuff-bit: "Stuff bit: 1" "SB: 1" "SB"
186840-186841 can: stuff-bit: "Stuff bit: 1" "SB: 1" "SB"
186856-186857 can: stuff-bit: "Stuff bit: 1" "SB: 1" "SB"
186866-186867 can: stuff-bit: "Stuff bit: 0" "SB: 0" "SB"
186888-186889 can: stuff-bit: "Stuff bit: 1" "SB: 1" "SB"
186916-186917 can: stuff-bit: "Stuff bit: 1" "SB: 1" "SB"
186782-186801 can: data: "Data byte 0: 0x00" "DB 0: 0x00" "DB"
186802-186817 can: data: "Data byte 1: 0x2f" "DB 1: 0x2f" "DB"
186818-186833 can: data: "Data byte 2: 0x24" "DB 2: 0x24" "DB"
186834-186851 can: data: "Data byte 3: 0x18" "DB 3: 0x18" "DB"
186852-186871 can: data: "Data byte 4: 0x3e" "DB 4: 0x3e" "DB"
186872-186887 can: data: "Data byte 5: 0xa0" "DB 5: 0xa0" "DB"
186890-186905 can: data: "Data byte 6: 0xef" "DB 6: 0xef" "DB"
186906-186923 can: data: "Data byte 7: 0x03" "DB 7: 0x03" "DB"
186934-186935 can: stuff-bit: "Stuff bit: 1" "SB: 1" "SB"
186924-186955 can: crc-sequence: "CRC sequence: 0x0120" "CRC: 0x0120" "CRC"
186956-186957 can: stuff-bit: "Stuff bit: 1" "SB: 1" "SB"
186958-186959 can: crc-delimiter: "CRC delimiter: 1" "CRC d: 1" "CRC d"
186960-186961 can: ack-slot: "ACK slot: ACK" "ACK s: ACK" "ACK s"
186962-186963 can: ack-delimiter: "ACK delimiter: 1" "ACK d: 1" "ACK d"
186964-186977 can: eof: "End of frame" "EOF" "E"
188198-188199 can: sof: "Start of frame" "SOF" "S"
188218-188219 can: stuff-bit: "Stuff bit: 0" "SB: 0" "SB"
188200-188223 can: id: "Identifier: 894 (0x37e)" "ID: 894 (0x37e)" "ID"
188226-188227 can: ide: "Identifier extension bit: extended frame" "IDE: extended frame" "IDE"
188238-188239 can: stuff-bit: "Stuff bit: 1" "SB: 1" "SB"
188260-188261 can: stuff-bit: "Stuff bit: 1" "SB: 1" "SB"
188228-188267 can: ext-id: "Extended Identifier: 1280 (0x500)" "Extended ID: 1280 (0x500)" "Extended ID" "EID"
188228-188267 can: full-id: "Full Identifier: 234358016 (0xdf80500)" "Full ID: 234358016 (0xdf80500)" "Full ID" "FID"
188224-188225 can: srr: "Substitute remote request: 1" "SRR: 1" "SRR"
188268-188269 can: rtr: "Remote transmission request: data frame" "RTR: data frame" "RTR"
188270-188271 can: reserved-bit: "Reserved bit 1: 0" "RB1: 0" "RB1"
188272-188273 can: stuff-bit: "Stuff bit: 1" "SB: 1" "SB"
188274-188275 can: reserved-bit: "Reserved bit 0: 0" "RB0: 0" "RB0"
188276-188283 can: dlc: "Data length code: 8" "DLC: 8" "DLC"
188288-188289 can: stuff-bit: "Stuff bit: 1" "SB: 1" "SB"
188300-188301 can: stuff-bit: "Stuff bit: 1" "SB: 1" "SB"
188338-188339 can: stuff-bit: "Stuff bit: 1" "SB: 1" "SB"
188368-188369 can: stuff-bit: "Stuff bit: 0" "SB: 0" "SB"
188284-188303 can: data: "Data byte 0: 0x01" "DB 0: 0x01" "DB"
188304-188319 can: data: "Data byte 1: 0x1c" "DB 1: 0x1c" "DB"
188320-188335 can: data: "Data byte 2: 0xc0" "DB 2: 0xc0" "DB"
188336-188353 can: data: "Data byte 3: 0x5a" "DB 3: 0x5a" "DB"
188354-188371 can: data: "Data byte 4: 0xbf" "DB 4: 0xbf" "DB"
188372-188387 can: data: "Data byte 5: 0x2e" "DB 5: 0x2e" "DB"
188388-188403 can: data: "Data byte 6: 0x7b" "DB 6: 0x7b" "DB"
188404-188419 can: data: "Data byte 7: 0x08" "DB 7: 0x08" "DB"
188424-188425 can: stuff-bit: "Stuff bit: 1" "SB: 1" "SB"
188420-188451 can: crc-sequence: "CRC sequence: 0x02d7" "CRC: 0x02d7" "CRC"
188452-188453 can: crc-delimiter: "CRC delimiter: 0" "CRC d: 0" "CRC d"
188454-188455 can: ack-slot: "ACK slot: NACK" "ACK s: NACK" "ACK s"
188456-188457 can: ack-delimiter: "ACK delimiter: 1" "ACK d: 1" "ACK d"
188458-188471 can: eof: "End of frame" "EOF" "E"
189697-189698 can: sof: "Start of frame" "SOF" "S"
189717-189718 can: stuff-bit: "Stuff bit: 0" "SB: 0" "SB"
189699-189722 can: id: "Identifier: 894 (0x37e)" "ID: 894 (0x37e)" "ID"
189725-189726 can: ide: "Identifier extension bit: extended frame" "IDE: extended frame" "IDE"
189737-189738 can: stuff-bit: "Stuff bit: 1" "SB: 1" "SB"
189759-189760 can: stuff-bit: "Stuff bit: 1" "SB: 1" "SB"
189727-189766 can: ext-id: "Extended Identifier: 1280 (0x500)" "Extended ID: 1280 (0x500)" "Extended ID" "EID"
189727-189766 can: full-id: "Full Identifier: 234358016 (0xdf80500)" "Full ID: 234358016 (0xdf80500)" "Full ID" "FID"
189723-189724 can: srr: "Substitute remote request: 1" "SRR: 1" "SRR"
189767-189768 can: rtr: "Remote transmission request: data frame" "RTR: data frame" "RTR"
189769-189770 can: reserved-bit: "Reserved bit 1: 0" "RB1: 0" "RB1"
189771-189772 can: stuff-bit: "Stuff bit: 1" "SB: 1" "SB"
189773-189774 can: reserved-bit: "Reserved bit 0: 0" "RB0: 0" "RB0"
189775-189782 can: dlc: "Data length code: 8" "DLC: 8" "DLC"
189787-189788 can: stuff-bit: "Stuff bit: 1" "SB: 1" "SB"
189825-189826 can: stuff-bit: "Stuff bit: 1" "SB: 1" "SB"
189841-189842 can: stuff-bit: "Stuff bit: 1" "SB: 1" "SB"
189853-189854 can: stuff-bit: "Stuff bit: 1" "SB: 1" "SB"
189885-189886 can: stuff-bit: "Stuff bit: 0" "SB: 0" "SB"
189895-189896 can: stuff-bit: "Stuff bit: 1" "SB: 1" "SB"
189909-189910 can: stuff-bit: "Stuff bit: 0" "SB: 0" "SB"
189783-189800 can: data: "Data byte 0: 0x02" "DB 0: 0x02" "DB"
189801-189816 can: data: "Data byte 1: 0x9a" "DB 1: 0x9a" "DB"
189817-189834 can: data: "Data byte 2: 0x04" "DB 2: 0x04" "DB"
189835-189852 can: data: "Data byte 3: 0x00" "DB 3: 0x00" "DB"
189855-189870 can: data: "Data byte 4: 0xb1" "DB 4: 0xb1" "DB"
189871-189888 can: data: "Data byte 5: 0x3e" "DB 5: 0x3e" "DB"
189889-189906 can: data: "Data byte 6: 0x0f" "DB 6: 0x0f" "DB"
189907-189924 can: data: "Data byte 7: 0xf9" "DB 7: 0xf9" "DB"
189925-189954 can: crc-sequence: "CRC sequence: 0x5ad4" "CRC: 0x5ad4" "CRC"
189955-189956 can: crc-delimiter: "CRC delimiter: 1" "CRC d: 1" "CRC d"
189957-189958 can: ack-slot: "ACK slot: ACK" "ACK s: ACK" "ACK s"
189959-189960 can: ack-delimiter: "ACK delimiter: 1" "ACK d: 1" "ACK d"
189961-189974 can: eof: "End of frame" "EOF" "E"
191227-191228 can: sof: "Start of frame" "SOF" "S"
191229-191250 can: id: "Identifier: 890 (0x37a)" "ID: 890 (0x37a)" "ID"
191253-191254 can: ide: "Identifier extension bit: extended frame" "IDE: extended frame" "IDE"
191265-191266 can: stuff-bit: "Stuff bit: 1" "SB: 1" "SB"
191287-191288 can: stuff-bit: "Stuff bit: 1" "SB: 1" "SB"
191255-191294 can: ext-id: "Extended Identifier: 1280 (0x500)" "Extended ID: 1280 (0x500)" "Extended ID" "EID"
191255-191294 can: full-id: "Full Identifier: 233309440 (0xde80500)" "Full ID: 233309440 (0xde80500)" "Full ID" "FID"
191251-191252 can: srr: "Substitute remote request: 1" "SRR: 1" "SRR"
191295-191296 can: rtr: "Remote transmission request: data frame" "RTR: data frame" "RTR"
191297-191298 can: reserved-bit: "Reserved bit 1: 0" "RB1: 0" "RB1"
191299-191300 can: stuff-bit: "Stuff bit: 1" "SB: 1" "SB"
191301-191302 can: reserved-bit: "Reserved bit 0: 0" "RB0: 0" "RB0"
191303-191310 can: dlc: "Data length code: 8" "DLC: 8" "DLC"
191315-191316 can: stuff-bit: "Stuff bit: 1" "SB: 1" "SB"
191387-191388 can: stuff-bit: "Stuff bit: 0" "SB: 0" "SB"
191421-191422 can: stuff-bit: "Stuff bit: 0" "SB: 0" "SB"
191431-191432 can: stuff-bit: "Stuff bit: 1" "SB: 1" "SB"
191311-191328 can: data: "Data byte 0: 0x03" "DB 0: 0x03" "DB"
191329-191344 can: data: "Data byte 1: 0xcd" "DB 1: 0xcd" "DB"
191345-191360 can: data: "Data byte 2: 0x8e" "DB 2: 0x8e" "DB"
191361-191376 can: data: "Data byte 3: 0xf2" "DB 3: 0xf2" "DB"
191377-191394 can: data: "Data byte 4: 0xfb" "DB 4: 0xfb" "DB"
191395-191410 can: data: "Data byte 5: 0x48" "DB 5: 0x48" "DB"
191411-191428 can: data: "Data byte 6: 0xf8" "DB 6: 0xf8" "DB"
191429-191446 can: data: "Data byte 7: 0x09" "DB 7: 0x09" "DB"
191447-191476 can: crc-sequence: "CRC sequence: 0x61ac" "CRC: 0x61ac" "CRC"
191477-191478 can: crc-delimiter: "CRC delimiter: 1" "CRC d: 1" "CRC d"
191479-191480 can: ack-slot: "ACK slot: ACK" "ACK s: ACK" "ACK s"
191481-191482 can: ack-delimiter: "ACK delimiter: 1" "ACK d: 1" "ACK d"
191483-191496 can: eof: "End of frame" "EOF" "E"
192696-192697 can: sof: "Start of frame" "SOF" "S"
192716-192717 can: stuff-bit: "Stuff bit: 0" "SB: 0" "SB"
192698-192721 can: id: "Identifier: 894 (0x37e)" "ID: 894 (0x37e)" "ID"
192724-192725 can: ide: "Identifier extension bit: extended frame" "IDE: extended frame" "IDE"
192736-192737 can: stuff-bit: "Stuff bit: 1" "SB: 1" "SB"
192758-192759 can: stuff-bit: "Stuff bit: 1" "SB: 1" "SB"
192726-192765 can: ext-id: "Extended Identifier: 1280 (0x500)" "Extended ID: 1280 (0x500)" "Extended ID" "EID"
192726-192765 can: full-id: "Full Identifier: 234358016 (0xdf80500)" "Full ID: 234358016 (0xdf80500)" "Full ID" "FID"
192722-192723 can: srr: "Substitute remote request: 1" "SRR: 1" "SRR"
192766-192767 can: rtr: "Remote transmission request: data frame" "RTR: data frame" "RTR"
192768-192769 can: reserved-bit: "Reserved bit 1: 0" "RB1: 0" "RB1"
192770-192771 can: stuff-bit: "Stuff bit: 1" "SB: 1" "SB"
192772-192773 can: reserved-bit: "Reserved bit 0: 0" "RB0: 0" "RB0"
192774-192781 can: dlc: "Data length code: 8" "DLC: 8" "DLC"
192786-192787 can: stuff-bit: "Stuff bit: 1" "SB: 1" "SB"
192806-192807 can: stuff-bit: "Stuff bit: 1" "SB: 1" "SB"
192818-192819 can: stuff-bit: "Stuff bit: 1" "SB: 1" "SB"
192830-192831 can: stuff-bit: "Stuff bit: 1" "SB: 1" "SB"
192842-192843 can: stuff-bit: "Stuff bit: 1" "SB: 1" "SB"
192854-192855 can: stuff-bit: "Stuff bit: 1" "SB: 1" "SB"
192866-192867 can: stuff-bit: "Stuff bit: 1" "SB: 1" "SB"
192878-192879 can: stuff-bit: "Stuff bit: 1" "SB: 1" "SB"
192900-192901 can: stuff-bit: "Stuff bit: 0" "SB: 0" "SB"
192918-192919 can: stuff-bit: "Stuff bit: 1" "SB: 1" "SB"
192782-192799 can: data: "Data byte 0: 0x04" "DB 0: 0x04" "DB"
192800-192817 can: data: "Data byte 1: 0x00" "DB 1: 0x00" "DB"
192820-192837 can: data: "Data byte 2: 0x00" "DB 2: 0x00" "DB"
192838-192857 can: data: "Data byte 3: 0x00" "DB 3: 0x00" "DB"
192858-192875 can: data: "Data byte 4: 0x00" "DB 4: 0x00" "DB"
192876-192893 can: data: "Data byte 5: 0x13" "DB 5: 0x13" "DB"
192894-192911 can: data: "Data byte 6: 0xfc" "DB 6: 0xfc" "DB"
192912-192929 can: data: "Data byte 7: 0x05" "DB 7: 0x05" "DB"
192930-192959 can: crc-sequence: "CRC sequence: 0x6e56" "CRC: 0x6e56" "CRC"
192960-192961 can: crc-delimiter: "CRC delimiter: 1" "CRC d: 1" "CRC d"
192962-192963 can: ack-slot: "ACK slot: ACK" "ACK s: ACK" "ACK s"
192964-192965 can: ack-delimiter: "ACK delimiter: 1" "ACK d: 1" "ACK d"
192966-192979 can: eof: "End of frame" "EOF" "E"
194197-194198 can: sof: "Start of frame" "SOF" "S"
194217-194218 can: stuff-bit: "Stuff bit: 0" "SB: 0" "SB"
194199-194222 can: id: "Identifier: 894 (0x37e)" "ID: 894 (0x37e)" "ID"
194225-194226 can: ide: "Identifier extension bit: extended frame" "IDE: extended frame" "IDE"
194237-194238 can: stuff-bit: "Stuff bit: 1" "SB: 1" "SB"
194259-194260 can: stuff-bit: "Stuff bit: 1" "SB: 1" "SB"
194227-194266 can: ext-id: "Extended Identifier: 1280 (0x500)" "Extended ID: 1280 (0x500)" "Extended ID" "EID"
194227-194266 can: full-id: "Full Identifier: 234358016 (0xdf80500)" "Full ID: 234358016 (0xdf80500)" "Full ID" "FID"
194223-194224 can: srr: "Substitute remote request: 1" "SRR: 1" "SRR"
194267-194268 can: rtr: "Remote transmission request: data frame" "RTR: data frame" "RTR"
194269-194270 can: reserved-bit: "Reserved bit 1: 0" "RB1: 0" "RB1"
194271-194272 can: stuff-bit: "Stuff bit: 1" "SB: 1" "SB"
194273-194274 can: reserved-bit: "Reserved bit 0: 0" "RB0: 0" "RB0"
194275-194282 can: dlc: "Data length code: 8" "DLC: 8" "DLC"
194287-194288 can: stuff-bit: "Stuff bit: 1" "SB: 1" "SB"
194327-194328 can: stuff-bit: "Stuff bit: 1" "SB: 1" "SB"
194361-194362 can: stuff-bit: "Stuff bit: 1" "SB: 1" "SB"
194411-194412 can: stuff-bit: "Stuff bit: 0" "SB: 0" "SB"
194283-194300 can: data: "Data byte 0: 0x05" "DB 0: 0x05" "DB"
194301-194316 can: data: "Data byte 1: 0xd3" "DB 1: 0xd3" "DB"
194317-194334 can: data: "Data byte 2: 0x00" "DB 2: 0x00" "DB"
194335-194350 can: data: "Data byte 3: 0x4f" "DB 3: 0x4f" "DB"
194351-194368 can: data: "Data byte 4: 0x01" "DB 4: 0x01" "DB"
194369-194384 can: data: "Data byte 5: 0x96" "DB 5: 0x96" "DB"
194385-194400 can: data: "Data byte 6: 0xf6" "DB 6: 0xf6" "DB"
194401-194418 can: data: "Data byte 7: 0xff" "DB 7: 0xff" "DB"
194419-194448 can: crc-sequence: "CRC sequence: 0x09cc" "CRC: 0x09cc" "CRC"
194449-194450 can: crc-delimiter: "CRC delimiter: 1" "CRC d: 1" "CRC d"
194451-194452 can: ack-slot: "ACK slot: ACK" "ACK s: ACK" "ACK s"
194453-194454 can: ack-delimiter: "ACK delimiter: 1" "ACK d: 1" "ACK d"
194455-194468 can: eof: "End of frame" "EOF" "E"
195697-195698 can: sof: "Start of frame" "SOF" "S"
195717-195718 can: stuff-bit: "Stuff bit: 0" "SB: 0" "SB"
195699-195722 can: id: "Identifier: 894 (0x37e)" "ID: 894 (0x37e)" "ID"
195725-195726 can: ide: "Identifier extension bit: extended frame" "IDE: extended frame" "IDE"
195737-195738 can: stuff-bit: "Stuff bit: 1" "SB: 1" "SB"
195759-195760 can: stuff-bit: "Stuff bit: 1" "SB: 1" "SB"
195727-195766 can: ext-id: "Extended Identifier: 1280 (0x500)" "Extended ID: 1280 (0x500)" "Extended ID" "EID"
195727-195766 can: full-id: "Full Identifier: 234358016 (0xdf80500)" "Full ID: 234358016 (0xdf80500)" "Full ID" "FID"
195723-195724 can: srr: "Substitute remote request: 1" "SRR: 1" "SRR"
195767-195768 can: rtr: "Remote transmission request: data frame" "RTR: data frame" "RTR"
195769-195770 can: reserved-bit: "Reserved bit 1: 0" "RB1: 0" "RB1"
195771-195772 can: stuff-bit: "Stuff bit: 1" "SB: 1" "SB"
195773-195774 can: reserved-bit: "Reserved bit 0: 0" "RB0: 0" "RB0"
195775-195782 can: dlc: "Data length code: 8" "DLC: 8" "DLC"
195787-195788 can: stuff-bit: "Stuff bit: 1" "SB: 1" "SB"
195811-195812 can: stuff-bit: "Stuff bit: 0" "SB: 0" "SB"
195829-195830 can: stuff-bit: "Stuff bit: 1" "SB: 1" "SB"
195847-195848 can: stuff-bit: "Stuff bit: 0" "SB: 0" "SB"
195859-195860 can: stuff-bit: "Stuff bit: 0" "SB: 0" "SB"
195871-195872 can: stuff-bit: "Stuff bit: 0" "SB: 0" "SB"
195883-195884 can: stuff-bit: "Stuff bit: 0" "SB: 0" "SB"
195905-195906 can: stuff-bit: "Stuff bit: 0" "SB: 0" "SB"
195917-195918 can: stuff-bit: "Stuff bit: 0" "SB: 0" "SB"
195783-195800 can: data: "Data byte 0: 0x06" "DB 0: 0x06" "DB"
195801-195818 can: data: "Data byte 1: 0xff" "DB 1: 0xff" "DB"
195819-195836 can: data: "Data byte 2: 0x00" "DB 2: 0x00" "DB"
195837-195854 can: data: "Data byte 3: 0xff" "DB 3: 0xff" "DB"
195855-195874 can: data: "Data byte 4: 0xff" "DB 4: 0xff" "DB"
195875-195892 can: data: "Data byte 5: 0xff" "DB 5: 0xff" "DB"
195893-195910 can: data: "Data byte 6: 0x7f" "DB 6: 0x7f" "DB"
195911-195928 can: data: "Data byte 7: 0xff" "DB 7: 0xff" "DB"
195929-195930 can: stuff-bit: "Stuff bit: 0" "SB: 0" "SB"
195931-195960 can: crc-sequence: "CRC sequence: 0x1dce" "CRC: 0x1dce" "CRC"
195961-195962 can: crc-delimiter: "CRC delimiter: 1" "CRC d: 1" "CRC d"
195963-195964 can: ack-slot: "ACK slot: ACK" "ACK s: ACK" "ACK s"
195965-195966 can: ack-delimiter: "ACK delimiter: 1" "ACK d: 1" "ACK d"
195967-195980 can: eof: "End of frame" "EOF" "E"
197228-197229 can: sof: "Start of frame" "SOF" "S"
197248-197249 can: stuff-bit: "Stuff bit: 0" "SB: 0" "SB"
197230-197253 can: id: "Identifier: 638 (0x27e)" "ID: 638 (0x27e)" "ID"
197256-197257 can: ide: "Identifier extension bit: extended frame" "IDE: extended frame" "IDE"
197268-197269 can: stuff-bit: "Stuff bit: 1" "SB: 1" "SB"
197290-197291 can: stuff-bit: "Stuff bit: 1" "SB: 1" "SB"
197258-197297 can: ext-id: "Extended Identifier: 256 (0x100)" "Extended ID: 256 (0x100)" "Extended ID" "EID"
197258-197297 can: full-id: "Full Identifier: 167248128 (0x9f80100)" "Full ID: 167248128 (0x9f80100)" "Full ID" "FID"
197254-197255 can: srr: "Substitute remote request: 1" "SRR: 1" "SRR"
197298-197299 can: rtr: "Remote transmission request: data frame" "RTR: data frame" "RTR"
197300-197301 can: reserved-bit: "Reserved bit 1: 0" "RB1: 0" "RB1"
197302-197303 can: stuff-bit: "Stuff bit: 1" "SB: 1" "SB"
197304-197305 can: reserved-bit: "Reserved bit 0: 0" "RB0: 0" "RB0"
197306-197313 can: dlc: "Data length code: 8" "DLC: 8" "DLC"
197394-197395 can: stuff-bit: "Stuff bit: 1" "SB: 1" "SB"
197314-197329 can: data: "Data byte 0: 0xaa" "DB 0: 0xaa" "DB"
197330-197345 can: data: "Data byte 1: 0xb0" "DB 1: 0xb0" "DB"
197346-197361 can: data: "Data byte 2: 0xc5" "DB 2: 0xc5" "DB"
197362-197377 can: data: "Data byte 3: 0x13" "DB 3: 0x13" "DB"
197378-197393 can: data: "Data byte 4: 0xa0" "DB 4: 0xa0" "DB"
197396-197411 can: data: "Data byte 5: 0x2d" "DB 5: 0x2d" "DB"
197412-197427 can: data: "Data byte 6: 0x44" "DB 6: 0x44" "DB"
197428-197443 can: data: "Data byte 7: 0xc6" "DB 7: 0xc6" "DB"
197444-197473 can: crc-sequence: "CRC sequence: 0x226b" "CRC: 0x226b" "CRC"
197474-197475 can: crc-delimiter: "CRC delimiter: 1" "CRC d: 1" "CRC d"
197476-197477 can: ack-slot: "ACK slot: ACK" "ACK s: ACK" "ACK s"
197478-197479 can: ack-delimiter: "ACK delimiter: 1" "ACK d: 1" "ACK d"
197480-197493 can: eof: "End of frame" "EOF" "E"
216216-216217 can: sof: "Start of frame" "SOF" "S"
216236-216237 can: stuff-bit: "Stuff bit: 0" "SB: 0" "SB"
216218-216241 can: id: "Identifier: 638 (0x27e)" "ID: 638 (0x27e)" "ID"
216244-216245 can: ide: "Identifier extension bit: extended frame" "IDE: extended frame" "IDE"
216256-216257 can: stuff-bit: "Stuff bit: 1" "SB: 1" "SB"
216276-216277 can: stuff-bit: "Stuff bit: 1" "SB: 1" "SB"
216246-216285 can: ext-id: "Extended Identifier: 512 (0x200)" "Extended ID: 512 (0x200)" "Extended ID" "EID"
216246-216285 can: full-id: "Full Identifier: 167248384 (0x9f80200)" "Full ID: 167248384 (0x9f80200)" "Full ID" "FID"
216242-216243 can: srr: "Substitute remote request: 1" "SRR: 1" "SRR"
216286-216287 can: rtr: "Remote transmission request: data frame" "RTR: data frame" "RTR"
216288-216289 can: stuff-bit: "Stuff bit: 1" "SB: 1" "SB"
216290-216291 can: reserved-bit: "Reserved bit 1: 0" "RB1: 0" "RB1"
216292-216293 can: reserved-bit: "Reserved bit 0: 0" "RB0: 0" "RB0"
216294-216301 can: dlc: "Data length code: 8" "DLC: 8" "DLC"
216306-216307 can: stuff-bit: "Stuff bit: 1" "SB: 1" "SB"
216328-216329 can: stuff-bit: "Stuff bit: 0" "SB: 0" "SB"
216378-216379 can: stuff-bit: "Stuff bit: 1" "SB: 1" "SB"
216398-216399 can: stuff-bit: "Stuff bit: 1" "SB: 1" "SB"
216416-216417 can: stuff-bit: "Stuff bit: 0" "SB: 0" "SB"
216438-216439 can: stuff-bit: "Stuff bit: 0" "SB: 0" "SB"
216302-216319 can: data: "Data byte 0: 0x25" "DB 0: 0x25" "DB"
216320-216337 can: data: "Data byte 1: 0xfc" "DB 1: 0xfc" "DB"
216338-216353 can: data: "Data byte 2: 0x47" "DB 2: 0x47" "DB"
216354-216369 can: data: "Data byte 3: 0x0a" "DB 3: 0x0a" "DB"
216370-216387 can: data: "Data byte 4: 0x01" "DB 4: 0x01" "DB"
216388-216405 can: data: "Data byte 5: 0x00" "DB 5: 0x00" "DB"
216406-216423 can: data: "Data byte 6: 0xff" "DB 6: 0xff" "DB"
216424-216441 can: data: "Data byte 7: 0xbf" "DB 7: 0xbf" "DB"
216442-216471 can: crc-sequence: "CRC sequence: 0x1d4f" "CRC: 0x1d4f" "CRC"
216472-216473 can: crc-delimiter: "CRC delimiter: 1" "CRC d: 1" "CRC d"
216474-216475 can: stuff-bit: "Stuff bit: 0" "SB: 0" "SB"
216476-216477 can: ack-slot: "ACK slot: NACK" "ACK s: NACK" "ACK s"
216478-216479 can: ack-delimiter: "ACK delimiter: 1" "ACK d: 1" "ACK d"
216480-216493 can: eof: "End of frame" "EOF" "E"
228717-228718 can: sof: "Start of frame" "SOF" "S"
228737-228738 can: stuff-bit: "Stuff bit: 0" "SB: 0" "SB"
228719-228742 can: id: "Identifier: 638 (0x27e)" "ID: 638 (0x27e)" "ID"
228745-228746 can: ide: "Identifier extension bit: extended frame" "IDE: extended frame" "IDE"
228757-228758 can: stuff-bit: "Stuff bit: 1" "SB: 1" "SB"
228779-228780 can: stuff-bit: "Stuff bit: 1" "SB: 1" "SB"
228747-228786 can: ext-id: "Extended Identifier: 256 (0x100)" "Extended ID: 256 (0x100)" "Extended ID" "EID"
228747-228786 can: full-id: "Full Identifier: 167248128 (0x9f80100)" "Full ID: 167248128 (0x9f80100)" "Full ID" "FID"
228743-228744 can: srr: "Substitute remote request: 1" "SRR: 1" "SRR"
228787-228788 can: rtr: "Remote transmission request: data frame" "RTR: data frame" "RTR"
228789-228790 can: reserved-bit: "Reserved bit 1: 0" "RB1: 0" "RB1"
228791-228792 can: stuff-bit: "Stuff bit: 1" "SB: 1" "SB"
228793-228794 can: reserved-bit: "Reserved bit 0: 0" "RB0: 0" "RB0"
228795-228802 can: dlc: "Data length code: 8" "DLC: 8" "DLC"
228883-228884 can: stuff-bit: "Stuff bit: 1" "SB: 1" "SB"
228803-228818 can: data: "Data byte 0: 0xaa" "DB 0: 0xaa" "DB"
228819-228834 can: data: "Data byte 1: 0xb0" "DB 1: 0xb0" "DB"
228835-228850 can: data: "Data byte 2: 0xc5" "DB 2: 0xc5" "DB"
228851-228866 can: data: "Data byte 3: 0x13" "DB 3: 0x13" "DB"
228867-228882 can: data: "Data byte 4: 0xa0" "DB 4: 0xa0" "DB"
228885-228900 can: data: "Data byte 5: 0x2d" "DB 5: 0x2d" "DB"
228901-228916 can: data: "Data byte 6: 0x44" "DB 6: 0x44" "DB"
228917-228932 can: data: "Data byte 7: 0xc6" "DB 7: 0xc6" "DB"
228933-228962 can: crc-sequence: "CRC sequence: 0x226b" "CRC: 0x226b" "CRC"
228963-228964 can: crc-delimiter: "CRC delimiter: 1" "CRC d: 1" "CRC d"
228965-228966 can: ack-slot: "ACK slot: ACK" "ACK s: ACK" "ACK s"
228967-228968 can: ack-delimiter: "ACK delimiter: 1" "ACK d: 1" "ACK d"
228969-228982 can: eof: "End of frame" "EOF" "E"
278716-278717 can: sof: "Start of frame" "SOF" "S"
278736-278737 can: stuff-bit: "Stuff bit: 0" "SB: 0" "SB"
278718-278741 can: id: "Identifier: 638 (0x27e)" "ID: 638 (0x27e)" "ID"
278744-278745 can: ide: "Identifier extension bit: extended frame" "IDE: extended frame" "IDE"
278756-278757 can: stuff-bit: "Stuff bit: 1" "SB: 1" "SB"
278778-278779 can: stuff-bit: "Stuff bit: 1" "SB: 1" "SB"
278746-278785 can: ext-id: "Extended Identifier: 256 (0x100)" "Extended ID: 256 (0x100)" "Extended ID" "EID"
278746-278785 can: full-id: "Full Identifier: 167248128 (0x9f80100)" "Full ID: 167248128 (0x9f80100)" "Full ID" "FID"
278742-278743 can: srr: "Substitute remote request: 1" "SRR: 1" "SRR"
278786-278787 can: rtr: "Remote transmission request: data frame" "RTR: data frame" "RTR"
278788-278789 can: reserved-bit: "Reserved bit 1: 0" "RB1: 0" "RB1"
278790-278791 can: stuff-bit: "Stuff bit: 1" "SB: 1" "SB"
278792-278793 can: reserved-bit: "Reserved bit 0: 0" "RB0: 0" "RB0"
278794-278801 can: dlc: "Data length code: 8" "DLC: 8" "DLC"
278882-278883 can: stuff-bit: "Stuff bit: 1" "SB: 1" "SB"
278802-278817 can: data: "Data byte 0: 0xaa" "DB 0: 0xaa" "DB"
278818-278833 can: data: "Data byte 1: 0xb0" "DB 1: 0xb0" "DB"
278834-278849 can: data: "Data byte 2: 0xc5" "DB 2: 0xc5" "DB"
278850-278865 can: data: "Data byte 3: 0x13" "DB 3: 0x13" "DB"
278866-278881 can: data: "Data byte 4: 0xa0" "DB 4: 0xa0" "DB"
278884-278899 can: data: "Data byte 5: 0x2d" "DB 5: 0x2d" "DB"
278900-278915 can: data: "Data byte 6: 0x44" "DB 6: 0x44" "DB"
278916-278931 can: data: "Data byte 7: 0xc6" "DB 7: 0xc6" "DB"
278932-278961 can: crc-sequence: "CRC sequence: 0x226b" "CRC: 0x226b" "CRC"
278962-278963 can: crc-delimiter: "CRC delimiter: 1" "CRC d: 1" "CRC d"
278964-278965 can: ack-slot: "ACK slot: ACK" "ACK s: ACK" "ACK s"
278966-278967 can: ack-delimiter: "ACK delimiter: 1" "ACK d: 1" "ACK d"
278968-278981 can: eof: "End of frame" "EOF" "E"
328716-328717 can: sof: "Start of frame" "SOF" "S"
328736-328737 can: stuff-bit: "Stuff bit: 0" "SB: 0" "SB"
328718-328741 can: id: "Identifier: 638 (0x27e)" "ID: 638 (0x27e)" "ID"
328744-328745 can: ide: "Identifier extension bit: extended frame" "IDE: extended frame" "IDE"
328756-328757 can: stuff-bit: "Stuff bit: 1" "SB: 1" "SB"
328778-328779 can: stuff-bit: "Stuff bit: 1" "SB: 1" "SB"
328746-328785 can: ext-id: "Extended Identifier: 256 (0x100)" "Extended ID: 256 (0x100)" "Extended ID" "EID"
328746-328785 can: full-id: "Full Identifier: 167248128 (0x9f80100)" "Full ID: 167248128 (0x9f80100)" "Full ID" "FID"
328742-328743 can: srr: "Substitute remote request: 1" "SRR: 1" "SRR"
328786-328787 can: rtr: "Remote transmission request: data frame" "RTR: data frame" "RTR"
328788-328789 can: reserved-bit: "Reserved bit 1: 0" "RB1: 0" "RB1"
328790-328791 can: stuff-bit: "Stuff bit: 1" "SB: 1" "SB"
328792-328793 can: reserved-bit: "Reserved bit 0: 0" "RB0: 0" "RB0"
328794-328801 can: dlc: "Data length code: 8" "DLC: 8" "DLC"
328880-328881 can: stuff-bit: "Stuff bit: 1" "SB: 1" "SB"
328802-328817 can: data: "Data byte 0: 0xaa" "DB 0: 0xaa" "DB"
328818-328833 can: data: "Data byte 1: 0xb0" "DB 1: 0xb0" "DB"
328834-328849 can: data: "Data byte 2: 0xc4" "DB 2: 0xc4" "DB"
328850-328865 can: data: "Data byte 3: 0x27" "DB 3: 0x27" "DB"
328866-328883 can: data: "Data byte 4: 0x40" "DB 4: 0x40" "DB"
328884-328899 can: data: "Data byte 5: 0x5a" "DB 5: 0x5a" "DB"
328900-328915 can: data: "Data byte 6: 0x89" "DB 6: 0x89" "DB"
328916-328931 can: data: "Data byte 7: 0x8c" "DB 7: 0x8c" "DB"
328932-328961 can: crc-sequence: "CRC sequence: 0x44d7" "CRC: 0x44d7" "CRC"
328962-328963 can: crc-delimiter: "CRC delimiter: 0" "CRC d: 0" "CRC d"
328964-328965 can: ack-slot: "ACK slot: NACK" "ACK s: NACK" "ACK s"
328966-328967 can: ack-delimiter: "ACK delimiter: 1" "ACK d: 1" "ACK d"
328968-328981 can: eof: "End of frame" "EOF" "E"
341299-341300 can: sof: "Start of frame" "SOF" "S"
341319-341320 can: stuff-bit: "Stuff bit: 0" "SB: 0" "SB"
341301-341324 can: id: "Identifier: 638 (0x27e)" "ID: 638 (0x27e)" "ID"
341327-341328 can: ide: "Identifier extension bit: extended frame" "IDE: extended frame" "IDE"
341339-341340 can: stuff-bit: "Stuff bit: 1" "SB: 1" "SB"
341359-341360 can: stuff-bit: "Stuff bit: 1" "SB: 1" "SB"
341329-341368 can: ext-id: "Extended Identifier: 512 (0x200)" "Extended ID: 512 (0x200)" "Extended ID" "EID"
341329-341368 can: full-id: "Full Identifier: 167248384 (0x9f80200)" "Full ID: 167248384 (0x9f80200)" "Full ID" "FID"
341325-341326 can: srr: "Substitute remote request: 1" "SRR: 1" "SRR"
341369-341370 can: rtr: "Remote transmission request: data frame" "RTR: data frame" "RTR"
341371-341372 can: stuff-bit: "Stuff bit: 1" "SB: 1" "SB"
341373-341374 can: reserved-bit: "Reserved bit 1: 0" "RB1: 0" "RB1"
341375-341376 can: reserved-bit: "Reserved bit 0: 0" "RB0: 0" "RB0"
341377-341384 can: dlc: "Data length code: 8" "DLC: 8" "DLC"
341389-341390 can: stuff-bit: "Stuff bit: 1" "SB: 1" "SB"
341413-341414 can: stuff-bit: "Stuff bit: 0" "SB: 0" "SB"
341461-341462 can: stuff-bit: "Stuff bit: 1" "SB: 1" "SB"
341481-341482 can: stuff-bit: "Stuff bit: 1" "SB: 1" "SB"
341499-341500 can: stuff-bit: "Stuff bit: 0" "SB: 0" "SB"
341511-341512 can: stuff-bit: "Stuff bit: 0" "SB: 0" "SB"
341385-341402 can: data: "Data byte 0: 0x26" "DB 0: 0x26" "DB"
341403-341420 can: data: "Data byte 1: 0xfc" "DB 1: 0xfc" "DB"
341421-341436 can: data: "Data byte 2: 0x47" "DB 2: 0x47" "DB"
341437-341452 can: data: "Data byte 3: 0x0a" "DB 3: 0x0a" "DB"
341453-341470 can: data: "Data byte 4: 0x01" "DB 4: 0x01" "DB"
341471-341488 can: data: "Data byte 5: 0x00" "DB 5: 0x00" "DB"
341489-341506 can: data: "Data byte 6: 0xff" "DB 6: 0xff" "DB"
341507-341524 can: data: "Data byte 7: 0xfd" "DB 7: 0xfd" "DB"
341525-341554 can: crc-sequence: "CRC sequence: 0x2186" "CRC: 0x2186" "CRC"
341555-341556 can: crc-delimiter: "CRC delimiter: 1" "CRC d: 1" "CRC d"
341557-341558 can: ack-slot: "ACK slot: ACK" "ACK s: ACK" "ACK s"
341559-341560 can: ack-delimiter: "ACK delimiter: 1" "ACK d: 1" "ACK d"
341561-341574 can: eof: "End of frame" "EOF" "E"
378715-378716 can: sof: "Start of frame" "SOF" "S"
378735-378736 can: stuff-bit: "Stuff bit: 0" "SB: 0" "SB"
378717-378740 can: id: "Identifier: 638 (0x27e)" "ID: 638 (0x27e)" "ID"
378743-378744 can: ide: "Identifier extension bit: extended frame" "IDE: extended frame" "IDE"
378755-378756 can: stuff-bit: "Stuff bit: 1" "SB: 1" "SB"
378777-378778 can: stuff-bit: "Stuff bit: 1" "SB: 1" "SB"
378745-378784 can: ext-id: "Extended Identifier: 256 (0x100)" "Extended ID: 256 (0x100)" "Extended ID" "EID"
378745-378784 can: full-id: "Full Identifier: 167248128 (0x9f80100)" "Full ID: 167248128 (0x9f80100)" "Full ID" "FID"
378741-378742 can: srr: "Substitute remote request: 1" "SRR: 1" "SRR"
378785-378786 can: rtr: "Remote transmission request: data frame" "RTR: data frame" "RTR"
378787-378788 can: reserved-bit: "Reserved bit 1: 0" "RB1: 0" "RB1"
378789-378790 can: stuff-bit: "Stuff bit: 1" "SB: 1" "SB"
378791-378792 can: reserved-bit: "Reserved bit 0: 0" "RB0: 0" "RB0"
378793-378800 can: dlc: "Data length code: 8" "DLC: 8" "DLC"
378881-378882 can: stuff-bit: "Stuff bit: 1" "SB: 1" "SB"
378801-378816 can: data: "Data byte 0: 0xaa" "DB 0: 0xaa" "DB"
378817-378832 can: data: "Data byte 1: 0xb0" "DB 1: 0xb0" "DB"
378833-378848 can: data: "Data byte 2: 0xc5" "DB 2: 0xc5" "DB"
378849-378864 can: data: "Data byte 3: 0x13" "DB 3: 0x13" "DB"
378865-378880 can: data: "Data byte 4: 0xa0" "DB 4: 0xa0" "DB"
378883-378898 can: data: "Data byte 5: 0x2d" "DB 5: 0x2d" "DB"
378899-378914 can: data: "Data byte 6: 0x44" "DB 6: 0x44" "DB"
378915-378930 can: data: "Data byte 7: 0xc6" "DB 7: 0xc6" "DB"
378931-378960 can: crc-sequence: "CRC sequence: 0x226b" "CRC: 0x226b" "CRC"
378961-378962 can: crc-delimiter: "CRC delimiter: 1" "CRC d: 1" "CRC d"
378963-378964 can: ack-slot: "ACK slot: ACK" "ACK s: ACK" "ACK s"
378965-378966 can: ack-delimiter: "ACK delimiter: 1" "ACK d: 1" "ACK d"
378967-378980 can: eof: "End of frame" "EOF" "E"
414291-414292 can: sof: "Start of frame" "SOF" "S"
414311-414312 can: stuff-bit: "Stuff bit: 0" "SB: 0" "SB"
414293-414316 can: id: "Identifier: 1407 (0x57f)" "ID: 1407 (0x57f)" "ID"
414319-414320 can: ide: "Identifier extension bit: extended frame" "IDE: extended frame" "IDE"
414323-414324 can: stuff-bit: "Stuff bit: 0" "SB: 0" "SB"
414345-414346 can: stuff-bit: "Stuff bit: 1" "SB: 1" "SB"
414357-414358 can: stuff-bit: "Stuff bit: 1" "SB: 1" "SB"
414321-414362 can: ext-id: "Extended Identifier: 200705 (0x31001)" "Extended ID: 200705 (0x31001)" "Extended ID" "EID"
414321-414362 can: full-id: "Full Identifier: 369037313 (0x15ff1001)" "Full ID: 369037313 (0x15ff1001)" "Full ID" "FID"
414317-414318 can: srr: "Substitute remote request: 1" "SRR: 1" "SRR"
414363-414364 can: rtr: "Remote transmission request: data frame" "RTR: data frame" "RTR"
414365-414366 can: reserved-bit: "Reserved bit 1: 0" "RB1: 0" "RB1"
414367-414368 can: reserved-bit: "Reserved bit 0: 0" "RB0: 0" "RB0"
414369-414376 can: dlc: "Data length code: 8" "DLC: 8" "DLC"
414391-414392 can: stuff-bit: "Stuff bit: 1" "SB: 1" "SB"
414439-414440 can: stuff-bit: "Stuff bit: 1" "SB: 1" "SB"
414455-414456 can: stuff-bit: "Stuff bit: 0" "SB: 0" "SB"
414501-414502 can: stuff-bit: "Stuff bit: 1" "SB: 1" "SB"
414377-414394 can: data: "Data byte 0: 0x40" "DB 0: 0x40" "DB"
414395-414410 can: data: "Data byte 1: 0x16" "DB 1: 0x16" "DB"
414411-414426 can: data: "Data byte 2: 0x8c" "DB 2: 0x8c" "DB"
414427-414444 can: data: "Data byte 3: 0x80" "DB 3: 0x80" "DB"
414445-414462 can: data: "Data byte 4: 0xff" "DB 4: 0xff" "DB"
414463-414478 can: data: "Data byte 5: 0x16" "DB 5: 0x16" "DB"
414479-414494 can: data: "Data byte 6: 0x3c" "DB 6: 0x3c" "DB"
414495-414512 can: data: "Data byte 7: 0x00" "DB 7: 0x00" "DB"
414513-414514 can: stuff-bit: "Stuff bit: 1" "SB: 1" "SB"
414539-414540 can: stuff-bit: "Stuff bit: 0" "SB: 0" "SB"
414515-414546 can: crc-sequence: "CRC sequence: 0x0eff" "CRC: 0x0eff" "CRC"
414547-414548 can: crc-delimiter: "CRC delimiter: 1" "CRC d: 1" "CRC d"
414549-414550 can: ack-slot: "ACK slot: ACK" "ACK s: ACK" "ACK s"
414551-414552 can: ack-delimiter: "ACK delimiter: 1" "ACK d: 1" "ACK d"
414553-414566 can: eof: "End of frame" "EOF" "E"
414573-414574 can: sof: "Start of frame" "SOF" "S"
414593-414594 can: stuff-bit: "Stuff bit: 0" "SB: 0" "SB"
414575-414598 can: id: "Identifier: 1407 (0x57f)" "ID: 1407 (0x57f)" "ID"
414601-414602 can: ide: "Identifier extension bit: extended frame" "IDE: extended frame" "IDE"
414605-414606 can: stuff-bit: "Stuff bit: 0" "SB: 0" "SB"
414627-414628 can: stuff-bit: "Stuff bit: 1" "SB: 1" "SB"
414639-414640 can: stuff-bit: "Stuff bit: 1" "SB: 1" "SB"
414603-414644 can: ext-id: "Extended Identifier: 200705 (0x31001)" "Extended ID: 200705 (0x31001)" "Extended ID" "EID"
414603-414644 can: full-id: "Full Identifier: 369037313 (0x15ff1001)" "Full ID: 369037313 (0x15ff1001)" "Full ID" "FID"
414599-414600 can: srr: "Substitute remote request: 1" "SRR: 1" "SRR"
414645-414646 can: rtr: "Remote transmission request: data frame" "RTR: data frame" "RTR"
414647-414648 can: reserved-bit: "Reserved bit 1: 0" "RB1: 0" "RB1"
414649-414650 can: reserved-bit: "Reserved bit 0: 0" "RB0: 0" "RB0"
414651-414658 can: dlc: "Data length code: 8" "DLC: 8" "DLC"
414673-414674 can: stuff-bit: "Stuff bit: 1" "SB: 1" "SB"
414687-414688 can: stuff-bit: "Stuff bit: 1" "SB: 1" "SB"
414705-414706 can: stuff-bit: "Stuff bit: 0" "SB: 0" "SB"
414717-414718 can: stuff-bit: "Stuff bit: 0" "SB: 0" "SB"
414729-414730 can: stuff-bit: "Stuff bit: 0" "SB: 0" "SB"
414741-414742 can: stuff-bit: "Stuff bit: 0" "SB: 0" "SB"
414753-414754 can: stuff-bit: "Stuff bit: 0" "SB: 0" "SB"
414765-414766 can: stuff-bit: "Stuff bit: 0" "SB: 0" "SB"
414659-414676 can: data: "Data byte 0: 0x41" "DB 0: 0x41" "DB"
414677-414694 can: data: "Data byte 1: 0x00" "DB 1: 0x00" "DB"
414695-414712 can: data: "Data byte 2: 0xff" "DB 2: 0xff" "DB"
414713-414732 can: data: "Data byte 3: 0xff" "DB 3: 0xff" "DB"
414733-414750 can: data: "Data byte 4: 0xff" "DB 4: 0xff" "DB"
414751-414770 can: data: "Data byte 5: 0xff" "DB 5: 0xff" "DB"
414771-414786 can: data: "Data byte 6: 0x16" "DB 6: 0x16" "DB"
414787-414802 can: data: "Data byte 7: 0x3c" "DB 7: 0x3c" "DB"
414821-414822 can: stuff-bit: "Stuff bit: 1" "SB: 1" "SB"
414803-414834 can: crc-sequence: "CRC sequence: 0x182c" "CRC: 0x182c" "CRC"
414835-414836 can: crc-delimiter: "CRC delimiter: 1" "CRC d: 1" "CRC d"
414837-414838 can: ack-slot: "ACK slot: ACK" "ACK s: ACK" "ACK s"
414839-414840 can: ack-delimiter: "ACK delimiter: 1" "ACK d: 1" "ACK d"
414841-414854 can: eof: "End of frame" "EOF" "E"
414861-414862 can: sof: "Start of frame" "SOF" "S"
414881-414882 can: stuff-bit: "Stuff bit: 0" "SB: 0" "SB"
414863-414886 can: id: "Identifier: 1407 (0x57f)" "ID: 1407 (0x57f)" "ID"
414889-414890 can: ide: "Identifier extension bit: extended frame" "IDE: extended frame" "IDE"
414893-414894 can: stuff-bit: "Stuff bit: 0" "SB: 0" "SB"
414915-414916 can: stuff-bit: "Stuff bit: 1" "SB: 1" "SB"
414927-414928 can: stuff-bit: "Stuff bit: 1" "SB: 1" "SB"
414891-414932 can: ext-id: "Extended Identifier: 200705 (0x31001)" "Extended ID: 200705 (0x31001)" "Extended ID" "EID"
414891-414932 can: full-id: "Full Identifier: 369037313 (0x15ff1001)" "Full ID: 369037313 (0x15ff1001)" "Full ID" "FID"
414887-414888 can: srr: "Substitute remote request: 1" "SRR: 1" "SRR"
414933-414934 can: rtr: "Remote transmission request: data frame" "RTR: data frame" "RTR"
414935-414936 can: reserved-bit: "Reserved bit 1: 0" "RB1: 0" "RB1"
414937-414938 can: reserved-bit: "Reserved bit 0: 0" "RB0: 0" "RB0"
414939-414946 can: dlc: "Data length code: 8" "DLC: 8" "DLC"
414971-414972 can: stuff-bit: "Stuff bit: 1" "SB: 1" "SB"
414983-414984 can: stuff-bit: "Stuff bit: 1" "SB: 1" "SB"
414995-414996 can: stuff-bit: "Stuff bit: 1" "SB: 1" "SB"
415007-415008 can: stuff-bit: "Stuff bit: 1" "SB: 1" "SB"
415041-415042 can: stuff-bit: "Stuff bit: 1" "SB: 1" "SB"
415053-415054 can: stuff-bit: "Stuff bit: 1" "SB: 1" "SB"
415065-415066 can: stuff-bit: "Stuff bit: 1" "SB: 1" "SB"
415083-415084 can: stuff-bit: "Stuff bit: 0" "SB: 0" "SB"
414947-414962 can: data: "Data byte 0: 0x42" "DB 0: 0x42" "DB"
414963-414980 can: data: "Data byte 1: 0x00" "DB 1: 0x00" "DB"
414981-415000 can: data: "Data byte 2: 0x00" "DB 2: 0x00" "DB"
415001-415018 can: data: "Data byte 3: 0x16" "DB 3: 0x16" "DB"
415019-415034 can: data: "Data byte 4: 0x3c" "DB 4: 0x3c" "DB"
415035-415052 can: data: "Data byte 5: 0x00" "DB 5: 0x00" "DB"
415055-415072 can: data: "Data byte 6: 0x00" "DB 6: 0x00" "DB"
415073-415090 can: data: "Data byte 7: 0xff" "DB 7: 0xff" "DB"
415091-415120 can: crc-sequence: "CRC sequence: 0x34c6" "CRC: 0x34c6" "CRC"
415121-415122 can: crc-delimiter: "CRC delimiter: 1" "CRC d: 1" "CRC d"
415123-415124 can: ack-slot: "ACK slot: ACK" "ACK s: ACK" "ACK s"
415125-415126 can: ack-delimiter: "ACK delimiter: 1" "ACK d: 1" "ACK d"
415127-415140 can: eof: "End of frame" "EOF" "E"
415147-415148 can: sof: "Start of frame" "SOF" "S"
415167-415168 can: stuff-bit: "Stuff bit: 0" "SB: 0" "SB"
415149-415172 can: id: "Identifier: 1407 (0x57f)" "ID: 1407 (0x57f)" "ID"
415175-415176 can: ide: "Identifier extension bit: extended frame" "IDE: extended frame" "IDE"
415179-415180 can: stuff-bit: "Stuff bit: 0" "SB: 0" "SB"
415201-415202 can: stuff-bit: "Stuff bit: 1" "SB: 1" "SB"
415213-415214 can: stuff-bit: "Stuff bit: 1" "SB: 1" "SB"
415177-415218 can: ext-id: "Extended Identifier: 200705 (0x31001)" "Extended ID: 200705 (0x31001)" "Extended ID" "EID"
415177-415218 can: full-id: "Full Identifier: 369037313 (0x15ff1001)" "Full ID: 369037313 (0x15ff1001)" "Full ID" "FID"
415173-415174 can: srr: "Substitute remote request: 1" "SRR: 1" "SRR"
415219-415220 can: rtr: "Remote transmission request: data frame" "RTR: data frame" "RTR"
415221-415222 can: reserved-bit: "Reserved bit 1: 0" "RB1: 0" "RB1"
415223-415224 can: reserved-bit: "Reserved bit 0: 0" "RB0: 0" "RB0"
415225-415232 can: dlc: "Data length code: 8" "DLC: 8" "DLC"
415259-415260 can: stuff-bit: "Stuff bit: 1" "SB: 1" "SB"
415271-415272 can: stuff-bit: "Stuff bit: 1" "SB: 1" "SB"
415283-415284 can: stuff-bit: "Stuff bit: 1" "SB: 1" "SB"
415297-415298 can: stuff-bit: "Stuff bit: 0" "SB: 0" "SB"
415309-415310 can: stuff-bit: "Stuff bit: 0" "SB: 0" "SB"
415321-415322 can: stuff-bit: "Stuff bit: 0" "SB: 0" "SB"
415333-415334 can: stuff-bit: "Stuff bit: 0" "SB: 0" "SB"
415345-415346 can: stuff-bit: "Stuff bit: 0" "SB: 0" "SB"
415357-415358 can: stuff-bit: "Stuff bit: 0" "SB: 0" "SB"
415369-415370 can: stuff-bit: "Stuff bit: 0" "SB: 0" "SB"
415233-415248 can: data: "Data byte 0: 0x43" "DB 0: 0x43" "DB"
415249-415266 can: data: "Data byte 1: 0x00" "DB 1: 0x00" "DB"
415267-415286 can: data: "Data byte 2: 0x00" "DB 2: 0x00" "DB"
415287-415304 can: data: "Data byte 3: 0xff" "DB 3: 0xff" "DB"
415305-415324 can: data: "Data byte 4: 0xff" "DB 4: 0xff" "DB"
415325-415342 can: data: "Data byte 5: 0xff" "DB 5: 0xff" "DB"
415343-415362 can: data: "Data byte 6: 0xff" "DB 6: 0xff" "DB"
415363-415380 can: data: "Data byte 7: 0xff" "DB 7: 0xff" "DB"
415381-415382 can: stuff-bit: "Stuff bit: 0" "SB: 0" "SB"
415383-415412 can: crc-sequence: "CRC sequence: 0x3895" "CRC: 0x3895" "CRC"
415413-415414 can: crc-delimiter: "CRC delimiter: 1" "CRC d: 1" "CRC d"
415415-415416 can: ack-slot: "ACK slot: ACK" "ACK s: ACK" "ACK s"
415417-415418 can: ack-delimiter: "ACK delimiter: 1" "ACK d: 1" "ACK d"
415419-415432 can: eof: "End of frame" "EOF" "E"
415440-415441 can: sof: "Start of frame" "SOF" "S"
415460-415461 can: stuff-bit: "Stuff bit: 0" "SB: 0" "SB"
415442-415465 can: id: "Identifier: 636 (0x27c)" "ID: 636 (0x27c)" "ID"
415468-415469 can: ide: "Identifier extension bit: extended frame" "IDE: extended frame" "IDE"
415482-415483 can: stuff-bit: "Stuff bit: 1" "SB: 1" "SB"
415502-415503 can: stuff-bit: "Stuff bit: 1" "SB: 1" "SB"
415470-415509 can: ext-id: "Extended Identifier: 131329 (0x20101)" "Extended ID: 131329 (0x20101)" "Extended ID" "EID"
415470-415509 can: full-id: "Full Identifier: 166854913 (0x9f20101)" "Full ID: 166854913 (0x9f20101)" "Full ID" "FID"
415466-415467 can: srr: "Substitute remote request: 1" "SRR: 1" "SRR"
415510-415511 can: rtr: "Remote transmission request: data frame" "RTR: data frame" "RTR"
415512-415513 can: reserved-bit: "Reserved bit 1: 0" "RB1: 0" "RB1"
415514-415515 can: reserved-bit: "Reserved bit 0: 0" "RB0: 0" "RB0"
415516-415523 can: dlc: "Data length code: 8" "DLC: 8" "DLC"
415536-415537 can: stuff-bit: "Stuff bit: 1" "SB: 1" "SB"
415548-415549 can: stuff-bit: "Stuff bit: 1" "SB: 1" "SB"
415570-415571 can: stuff-bit: "Stuff bit: 0" "SB: 0" "SB"
415582-415583 can: stuff-bit: "Stuff bit: 0" "SB: 0" "SB"
415594-415595 can: stuff-bit: "Stuff bit: 0" "SB: 0" "SB"
415606-415607 can: stuff-bit: "Stuff bit: 0" "SB: 0" "SB"
415618-415619 can: stuff-bit: "Stuff bit: 0" "SB: 0" "SB"
415630-415631 can: stuff-bit: "Stuff bit: 0" "SB: 0" "SB"
415642-415643 can: stuff-bit: "Stuff bit: 0" "SB: 0" "SB"
415654-415655 can: stuff-bit: "Stuff bit: 0" "SB: 0" "SB"
415666-415667 can: stuff-bit: "Stuff bit: 0" "SB: 0" "SB"
415524-415541 can: data: "Data byte 0: 0x80" "DB 0: 0x80" "DB"
415542-415559 can: data: "Data byte 1: 0x1a" "DB 1: 0x1a" "DB"
415560-415577 can: data: "Data byte 2: 0xff" "DB 2: 0xff" "DB"
415578-415597 can: data: "Data byte 3: 0xff" "DB 3: 0xff" "DB"
415598-415615 can: data: "Data byte 4: 0xff" "DB 4: 0xff" "DB"
415616-415635 can: data: "Data byte 5: 0xff" "DB 5: 0xff" "DB"
415636-415653 can: data: "Data byte 6: 0xff" "DB 6: 0xff" "DB"
415656-415673 can: data: "Data byte 7: 0xff" "DB 7: 0xff" "DB"
415678-415679 can: stuff-bit: "Stuff bit: 0" "SB: 0" "SB"
415674-415705 can: crc-sequence: "CRC sequence: 0x7b6c" "CRC: 0x7b6c" "CRC"
415706-415707 can: crc-delimiter: "CRC delimiter: 1" "CRC d: 1" "CRC d"
415708-415709 can: ack-slot: "ACK slot: ACK" "ACK s: ACK" "ACK s"
415710-415711 can: ack-delimiter: "ACK delimiter: 1" "ACK d: 1" "ACK d"
415712-415725 can: eof: "End of frame" "EOF" "E"
415742-415743 can: sof: "Start of frame" "SOF" "S"
415762-415763 can: stuff-bit: "Stuff bit: 0" "SB: 0" "SB"
415744-415767 can: id: "Identifier: 636 (0x27c)" "ID: 636 (0x27c)" "ID"
415770-415771 can: ide: "Identifier extension bit: extended frame" "IDE: extended frame" "IDE"
415784-415785 can: stuff-bit: "Stuff bit: 1" "SB: 1" "SB"
415804-415805 can: stuff-bit: "Stuff bit: 1" "SB: 1" "SB"
415772-415811 can: ext-id: "Extended Identifier: 131329 (0x20101)" "Extended ID: 131329 (0x20101)" "Extended ID" "EID"
415772-415811 can: full-id: "Full Identifier: 166854913 (0x9f20101)" "Full ID: 166854913 (0x9f20101)" "Full ID" "FID"
415768-415769 can: srr: "Substitute remote request: 1" "SRR: 1" "SRR"
415812-415813 can: rtr: "Remote transmission request: data frame" "RTR: data frame" "RTR"
415814-415815 can: reserved-bit: "Reserved bit 1: 0" "RB1: 0" "RB1"
415816-415817 can: reserved-bit: "Reserved bit 0: 0" "RB0: 0" "RB0"
415818-415825 can: dlc: "Data length code: 8" "DLC: 8" "DLC"
415838-415839 can: stuff-bit: "Stuff bit: 1" "SB: 1" "SB"
415852-415853 can: stuff-bit: "Stuff bit: 0" "SB: 0" "SB"
415864-415865 can: stuff-bit: "Stuff bit: 0" "SB: 0" "SB"
415876-415877 can: stuff-bit: "Stuff bit: 0" "SB: 0" "SB"
415894-415895 can: stuff-bit: "Stuff bit: 0" "SB: 0" "SB"
415910-415911 can: stuff-bit: "Stuff bit: 1" "SB: 1" "SB"
415922-415923 can: stuff-bit: "Stuff bit: 1" "SB: 1" "SB"
415934-415935 can: stuff-bit: "Stuff bit: 1" "SB: 1" "SB"
415948-415949 can: stuff-bit: "Stuff bit: 0" "SB: 0" "SB"
415960-415961 can: stuff-bit: "Stuff bit: 0" "SB: 0" "SB"
415972-415973 can: stuff-bit: "Stuff bit: 0" "SB: 0" "SB"
415826-415843 can: data: "Data byte 0: 0x81" "DB 0: 0x81" "DB"
415844-415861 can: data: "Data byte 1: 0xff" "DB 1: 0xff" "DB"
415862-415881 can: data: "Data byte 2: 0xff" "DB 2: 0xff" "DB"
415882-415899 can: data: "Data byte 3: 0x7f" "DB 3: 0x7f" "DB"
415900-415917 can: data: "Data byte 4: 0x00" "DB 4: 0x00" "DB"
415918-415937 can: data: "Data byte 5: 0x00" "DB 5: 0x00" "DB"
415938-415955 can: data: "Data byte 6: 0xff" "DB 6: 0xff" "DB"
415956-415975 can: data: "Data byte 7: 0xff" "DB 7: 0xff" "DB"
415988-415989 can: stuff-bit: "Stuff bit: 0" "SB: 0" "SB"
415976-416007 can: crc-sequence: "CRC sequence: 0x3e2b" "CRC: 0x3e2b" "CRC"
416008-416009 can: crc-delimiter: "CRC delimiter: 1" "CRC d: 1" "CRC d"
416010-416011 can: ack-slot: "ACK slot: ACK" "ACK s: ACK" "ACK s"
416012-416013 can: ack-delimiter: "ACK delimiter: 1" "ACK d: 1" "ACK d"
416014-416027 can: eof: "End of frame" "EOF" "E"
416058-416059 can: sof: "Start of frame" "SOF" "S"
416078-416079 can: stuff-bit: "Stuff bit: 0" "SB: 0" "SB"
416060-416083 can: id: "Identifier: 636 (0x27c)" "ID: 636 (0x27c)" "ID"
416086-416087 can: ide: "Identifier extension bit: extended frame" "IDE: extended frame" "IDE"
416100-416101 can: stuff-bit: "Stuff bit: 1" "SB: 1" "SB"
416120-416121 can: stuff-bit: "Stuff bit: 1" "SB: 1" "SB"
416088-416127 can: ext-id: "Extended Identifier: 131329 (0x20101)" "Extended ID: 131329 (0x20101)" "Extended ID" "EID"
416088-416127 can: full-id: "Full Identifier: 166854913 (0x9f20101)" "Full ID: 166854913 (0x9f20101)" "Full ID" "FID"
416084-416085 can: srr: "Substitute remote request: 1" "SRR: 1" "SRR"
416128-416129 can: rtr: "Remote transmission request: data frame" "RTR: data frame" "RTR"
416130-416131 can: reserved-bit: "Reserved bit 1: 0" "RB1: 0" "RB1"
416132-416133 can: reserved-bit: "Reserved bit 0: 0" "RB0: 0" "RB0"
416134-416141 can: dlc: "Data length code: 8" "DLC: 8" "DLC"
416154-416155 can: stuff-bit: "Stuff bit: 1" "SB: 1" "SB"
416170-416171 can: stuff-bit: "Stuff bit: 0" "SB: 0" "SB"
416182-416183 can: stuff-bit: "Stuff bit: 0" "SB: 0" "SB"
416194-416195 can: stuff-bit: "Stuff bit: 0" "SB: 0" "SB"
416206-416207 can: stuff-bit: "Stuff bit: 0" "SB: 0" "SB"
416218-416219 can: stuff-bit: "Stuff bit: 0" "SB: 0" "SB"
416230-416231 can: stuff-bit: "Stuff bit: 0" "SB: 0" "SB"
416242-416243 can: stuff-bit: "Stuff bit: 0" "SB: 0" "SB"
416254-416255 can: stuff-bit: "Stuff bit: 0" "SB: 0" "SB"
416266-416267 can: stuff-bit: "Stuff bit: 0" "SB: 0" "SB"
416278-416279 can: stuff-bit: "Stuff bit: 0" "SB: 0" "SB"
416290-416291 can: stuff-bit: "Stuff bit: 0" "SB: 0" "SB"
416142-416159 can: data: "Data byte 0: 0x82" "DB 0: 0x82" "DB"
416160-416177 can: data: "Data byte 1: 0xff" "DB 1: 0xff" "DB"
416178-416197 can: data: "Data byte 2: 0xff" "DB 2: 0xff" "DB"
416198-416215 can: data: "Data byte 3: 0xff" "DB 3: 0xff" "DB"
416216-416235 can: data: "Data byte 4: 0xff" "DB 4: 0xff" "DB"
416236-416253 can: data: "Data byte 5: 0xff" "DB 5: 0xff" "DB"
416256-416273 can: data: "Data byte 6: 0xff" "DB 6: 0xff" "DB"
416274-416293 can: data: "Data byte 7: 0xff" "DB 7: 0xff" "DB"
416304-416305 can: stuff-bit: "Stuff bit: 1" "SB: 1" "SB"
416294-416325 can: crc-sequence: "CRC sequence: 0x00a0" "CRC: 0x00a0" "CRC"
416326-416327 can: stuff-bit: "Stuff bit: 1" "SB: 1" "SB"
416328-416329 can: crc-delimiter: "CRC delimiter: 1" "CRC d: 1" "CRC d"
416330-416331 can: ack-slot: "ACK slot: ACK" "ACK s: ACK" "ACK s"
416332-416333 can: ack-delimiter: "ACK delimiter: 1" "ACK d: 1" "ACK d"
416334-416347 can: eof: "End of frame" "EOF" "E"
416378-416379 can: sof: "Start of frame" "SOF" "S"
416398-416399 can: stuff-bit: "Stuff bit: 0" "SB: 0" "SB"
416380-416403 can: id: "Identifier: 636 (0x27c)" "ID: 636 (0x27c)" "ID"
416406-416407 can: ide: "Identifier extension bit: extended frame" "IDE: extended frame" "IDE"
416420-416421 can: stuff-bit: "Stuff bit: 1" "SB: 1" "SB"
416440-416441 can: stuff-bit: "Stuff bit: 1" "SB: 1" "SB"
416408-416447 can: ext-id: "Extended Identifier: 131329 (0x20101)" "Extended ID: 131329 (0x20101)" "Extended ID" "EID"
416408-416447 can: full-id: "Full Identifier: 166854913 (0x9f20101)" "Full ID: 166854913 (0x9f20101)" "Full ID" "FID"
416404-416405 can: srr: "Substitute remote request: 1" "SRR: 1" "SRR"
416448-416449 can: rtr: "Remote transmission request: data frame" "RTR: data frame" "RTR"
416450-416451 can: reserved-bit: "Reserved bit 1: 0" "RB1: 0" "RB1"
416452-416453 can: reserved-bit: "Reserved bit 0: 0" "RB0: 0" "RB0"
416454-416461 can: dlc: "Data length code: 8" "DLC: 8" "DLC"
416474-416475 can: stuff-bit: "Stuff bit: 1" "SB: 1" "SB"
416490-416491 can: stuff-bit: "Stuff bit: 1" "SB: 1" "SB"
416502-416503 can: stuff-bit: "Stuff bit: 1" "SB: 1" "SB"
416514-416515 can: stuff-bit: "Stuff bit: 1" "SB: 1" "SB"
416526-416527 can: stuff-bit: "Stuff bit: 1" "SB: 1" "SB"
416538-416539 can: stuff-bit: "Stuff bit: 1" "SB: 1" "SB"
416550-416551 can: stuff-bit: "Stuff bit: 1" "SB: 1" "SB"
416568-416569 can: stuff-bit: "Stuff bit: 0" "SB: 0" "SB"
416586-416587 can: stuff-bit: "Stuff bit: 0" "SB: 0" "SB"
416598-416599 can: stuff-bit: "Stuff bit: 0" "SB: 0" "SB"
416462-416479 can: data: "Data byte 0: 0x83" "DB 0: 0x83" "DB"
416480-416497 can: data: "Data byte 1: 0x00" "DB 1: 0x00" "DB"
416498-416517 can: data: "Data byte 2: 0x00" "DB 2: 0x00" "DB"
416518-416535 can: data: "Data byte 3: 0x00" "DB 3: 0x00" "DB"
416536-416555 can: data: "Data byte 4: 0x00" "DB 4: 0x00" "DB"
416556-416573 can: data: "Data byte 5: 0x7f" "DB 5: 0x7f" "DB"
416574-416591 can: data: "Data byte 6: 0x7f" "DB 6: 0x7f" "DB"
416592-416609 can: data: "Data byte 7: 0xff" "DB 7: 0xff" "DB"
416610-416611 can: stuff-bit: "Stuff bit: 0" "SB: 0" "SB"
416612-416641 can: crc-sequence: "CRC sequence: 0x1b29" "CRC: 0x1b29" "CRC"
416642-416643 can: crc-delimiter: "CRC delimiter: 1" "CRC d: 1" "CRC d"
416644-416645 can: ack-slot: "ACK slot: ACK" "ACK s: ACK" "ACK s"
416646-416647 can: ack-delimiter: "ACK delimiter: 1" "ACK d: 1" "ACK d"
416648-416661 can: eof: "End of frame" "EOF" "E"
428714-428715 can: sof: "Start of frame" "SOF" "S"
428734-428735 can: stuff-bit: "Stuff bit: 0" "SB: 0" "SB"
428716-428739 can: id: "Identifier: 638 (0x27e)" "ID: 638 (0x27e)" "ID"
428742-428743 can: ide: "Identifier extension bit: extended frame" "IDE: extended frame" "IDE"
428754-428755 can: stuff-bit: "Stuff bit: 1" "SB: 1" "SB"
428776-428777 can: stuff-bit: "Stuff bit: 1" "SB: 1" "SB"
428744-428783 can: ext-id: "Extended Identifier: 256 (0x100)" "Extended ID: 256 (0x100)" "Extended ID" "EID"
428744-428783 can: full-id: "Full Identifier: 167248128 (0x9f80100)" "Full ID: 167248128 (0x9f80100)" "Full ID" "FID"
428740-428741 can: srr: "Substitute remote request: 1" "SRR: 1" "SRR"
428784-428785 can: rtr: "Remote transmission request: data frame" "RTR: data frame" "RTR"
428786-428787 can: reserved-bit: "Reserved bit 1: 0" "RB1: 0" "RB1"
428788-428789 can: stuff-bit: "Stuff bit: 1" "SB: 1" "SB"
428790-428791 can: reserved-bit: "Reserved bit 0: 0" "RB0: 0" "RB0"
428792-428799 can: dlc: "Data length code: 8" "DLC: 8" "DLC"
428880-428881 can: stuff-bit: "Stuff bit: 1" "SB: 1" "SB"
428800-428815 can: data: "Data byte 0: 0xaa" "DB 0: 0xaa" "DB"
428816-428831 can: data: "Data byte 1: 0xb0" "DB 1: 0xb0" "DB"
428832-428847 can: data: "Data byte 2: 0xc5" "DB 2: 0xc5" "DB"
428848-428863 can: data: "Data byte 3: 0x13" "DB 3: 0x13" "DB"
428864-428879 can: data: "Data byte 4: 0xa0" "DB 4: 0xa0" "DB"
428882-428897 can: data: "Data byte 5: 0x2d" "DB 5: 0x2d" "DB"
428898-428913 can: data: "Data byte 6: 0x44" "DB 6: 0x44" "DB"
428914-428929 can: data: "Data byte 7: 0xc6" "DB 7: 0xc6" "DB"
428930-428959 can: crc-sequence: "CRC sequence: 0x226b" "CRC: 0x226b" "CRC"
428960-428961 can: crc-delimiter: "CRC delimiter: 0" "CRC d: 0" "CRC d"
428962-428963 can: ack-slot: "ACK slot: ACK" "ACK s: ACK" "ACK s"
428964-428965 can: ack-delimiter: "ACK delimiter: 1" "ACK d: 1" "ACK d"
428966-428979 can: eof: "End of frame" "EOF" "E"
466212-466213 can: sof: "Start of frame" "SOF" "S"
466232-466233 can: stuff-bit: "Stuff bit: 0" "SB: 0" "SB"
466214-466237 can: id: "Identifier: 638 (0x27e)" "ID: 638 (0x27e)" "ID"
466240-466241 can: ide: "Identifier extension bit: extended frame" "IDE: extended frame" "IDE"
466252-466253 can: stuff-bit: "Stuff bit: 1" "SB: 1" "SB"
466272-466273 can: stuff-bit: "Stuff bit: 1" "SB: 1" "SB"
466242-466281 can: ext-id: "Extended Identifier: 512 (0x200)" "Extended ID: 512 (0x200)" "Extended ID" "EID"
466242-466281 can: full-id: "Full Identifier: 167248384 (0x9f80200)" "Full ID: 167248384 (0x9f80200)" "Full ID" "FID"
466238-466239 can: srr: "Substitute remote request: 1" "SRR: 1" "SRR"
466282-466283 can: rtr: "Remote transmission request: data frame" "RTR: data frame" "RTR"
466284-466285 can: stuff-bit: "Stuff bit: 1" "SB: 1" "SB"
466286-466287 can: reserved-bit: "Reserved bit 1: 0" "RB1: 0" "RB1"
466288-466289 can: reserved-bit: "Reserved bit 0: 0" "RB0: 0" "RB0"
466290-466297 can: dlc: "Data length code: 8" "DLC: 8" "DLC"
466302-466303 can: stuff-bit: "Stuff bit: 1" "SB: 1" "SB"
466320-466321 can: stuff-bit: "Stuff bit: 0" "SB: 0" "SB"
466374-466375 can: stuff-bit: "Stuff bit: 1" "SB: 1" "SB"
466394-466395 can: stuff-bit: "Stuff bit: 1" "SB: 1" "SB"
466412-466413 can: stuff-bit: "Stuff bit: 0" "SB: 0" "SB"
466424-466425 can: stuff-bit: "Stuff bit: 0" "SB: 0" "SB"
466436-466437 can: stuff-bit: "Stuff bit: 0" "SB: 0" "SB"
466298-466315 can: data: "Data byte 0: 0x27" "DB 0: 0x27" "DB"
466316-466333 can: data: "Data byte 1: 0xfc" "DB 1: 0xfc" "DB"
466334-466349 can: data: "Data byte 2: 0x47" "DB 2: 0x47" "DB"
466350-466365 can: data: "Data byte 3: 0x0a" "DB 3: 0x0a" "DB"
466366-466383 can: data: "Data byte 4: 0x01" "DB 4: 0x01" "DB"
466384-466401 can: data: "Data byte 5: 0x00" "DB 5: 0x00" "DB"
466402-466419 can: data: "Data byte 6: 0xff" "DB 6: 0xff" "DB"
466420-466439 can: data: "Data byte 7: 0xff" "DB 7: 0xff" "DB"
466440-466469 can: crc-sequence: "CRC sequence: 0x756d" "CRC: 0x756d" "CRC"
466470-466471 can: crc-delimiter: "CRC delimiter: 1" "CRC d: 1" "CRC d"
466472-466473 can: ack-slot: "ACK slot: ACK" "ACK s: ACK" "ACK s"
466474-466475 can: ack-delimiter: "ACK delimiter: 1" "ACK d: 1" "ACK d"
466476-466489 can: eof: "End of frame" "EOF" "E"
478713-478714 can: sof: "Start of frame" "SOF" "S"
478733-478734 can: stuff-bit: "Stuff bit: 0" "SB: 0" "SB"
478715-478738 can: id: "Identifier: 638 (0x27e)" "ID: 638 (0x27e)" "ID"
478741-478742 can: ide: "Identifier extension bit: extended frame" "IDE: extended frame" "IDE"
478753-478754 can: stuff-bit: "Stuff bit: 1" "SB: 1" "SB"
478775-478776 can: stuff-bit: "Stuff bit: 1" "SB: 1" "SB"
478743-478782 can: ext-id: "Extended Identifier: 256 (0x100)" "Extended ID: 256 (0x100)" "Extended ID" "EID"
478743-478782 can: full-id: "Full Identifier: 167248128 (0x9f80100)" "Full ID: 167248128 (0x9f80100)" "Full ID" "FID"
478739-478740 can: srr: "Substitute remote request: 1" "SRR: 1" "SRR"
478783-478784 can: rtr: "Remote transmission request: data frame" "RTR: data frame" "RTR"
478785-478786 can: reserved-bit: "Reserved bit 1: 0" "RB1: 0" "RB1"
478787-478788 can: stuff-bit: "Stuff bit: 1" "SB: 1" "SB"
478789-478790 can: reserved-bit: "Reserved bit 0: 0" "RB0: 0" "RB0"
478791-478798 can: dlc: "Data length code: 8" "DLC: 8" "DLC"
478879-478880 can: stuff-bit: "Stuff bit: 1" "SB: 1" "SB"
478799-478814 can: data: "Data byte 0: 0xaa" "DB 0: 0xaa" "DB"
478815-478830 can: data: "Data byte 1: 0xb0" "DB 1: 0xb0" "DB"
478831-478846 can: data: "Data byte 2: 0xc5" "DB 2: 0xc5" "DB"
478847-478862 can: data: "Data byte 3: 0x13" "DB 3: 0x13" "DB"
478863-478878 can: data: "Data byte 4: 0xa0" "DB 4: 0xa0" "DB"
478881-478896 can: data: "Data byte 5: 0x2d" "DB 5: 0x2d" "DB"
478897-478912 can: data: "Data byte 6: 0x44" "DB 6: 0x44" "DB"
478913-478928 can: data: "Data byte 7: 0xc6" "DB 7: 0xc6" "DB"
478929-478958 can: crc-sequence: "CRC sequence: 0x226b" "CRC: 0x226b" "CRC"
478959-478960 can: crc-delimiter: "CRC delimiter: 1" "CRC d: 1" "CRC d"
478961-478962 can: ack-slot: "ACK slot: ACK" "ACK s: ACK" "ACK s"
478963-478964 can: ack-delimiter: "ACK delimiter: 1" "ACK d: 1" "ACK d"
478965-478978 can: eof: "End of frame" "EOF" "E"
528713-528714 can: sof: "Start of frame" "SOF" "S"
528733-528734 can: stuff-bit: "Stuff bit: 0" "SB: 0" "SB"
528715-528738 can: id: "Identifier: 638 (0x27e)" "ID: 638 (0x27e)" "ID"
528741-528742 can: ide: "Identifier extension bit: extended frame" "IDE: extended frame" "IDE"
528753-528754 can: stuff-bit: "Stuff bit: 1" "SB: 1" "SB"
528773-528774 can: stuff-bit: "Stuff bit: 1" "SB: 1" "SB"
528743-528782 can: ext-id: "Extended Identifier: 0 (0x0)" "Extended ID: 0 (0x0)" "Extended ID" "EID"
528743-528782 can: full-id: "Full Identifier: 167247872 (0x9f80000)" "Full ID: 167247872 (0x9f80000)" "Full ID" "FID"
528739-528740 can: srr: "Substitute remote request: 1" "SRR: 1" "SRR"
528783-528784 can: rtr: "Remote transmission request: data frame" "RTR: data frame" "RTR"
528785-528786 can: stuff-bit: "Stuff bit: 1" "SB: 1" "SB"
528787-528788 can: reserved-bit: "Reserved bit 1: 0" "RB1: 0" "RB1"
528789-528790 can: reserved-bit: "Reserved bit 0: 1" "RB0: 1" "RB0"
528791-528798 can: dlc: "Data length code: 1" "DLC: 1" "DLC"
528799-528814 can: data: "Data byte 0: 0x55" "DB 0: 0x55" "DB"
528815-528844 can: crc-sequence: "CRC sequence: 0x30c5" "CRC: 0x30c5" "CRC"
528845-528846 can: crc-delimiter: "CRC delimiter: 0" "CRC d: 0" "CRC d"
528847-528848 can: ack-slot: "ACK slot: ACK" "ACK s: ACK" "ACK s"
528849-528850 can: ack-delimiter: "ACK delimiter: 0" "ACK d: 0" "ACK d"
528851-528864 can: eof: "End of frame" "EOF" "E"
528865-528866 can: warnings: "Start of frame (SOF) must be a dominant bit"
528877-528878 can: stuff-bit: "Stuff bit: 1" "SB: 1" "SB"
528867-528890 can: id: "Identifier: 11 (0xb)" "ID: 11 (0xb)" "ID"
528893-528894 can: ide: "Identifier extension bit: extended frame" "IDE: extended frame" "IDE"
528895-528930 can: ext-id: "Extended Identifier: 70425 (0x11319)" "Extended ID: 70425 (0x11319)" "Extended ID" "EID"
528895-528930 can: full-id: "Full Identifier: 2954009 (0x2d1319)" "Full ID: 2954009 (0x2d1319)" "Full ID" "FID"
528891-528892 can: srr: "Substitute remote request: 0" "SRR: 0" "SRR"
528931-528932 can: rtr: "Remote transmission request: data frame" "RTR: data frame" "RTR"
528933-528934 can: reserved-bit: "Reserved bit 1: 0" "RB1: 0" "RB1"
528935-528936 can: reserved-bit: "Reserved bit 0: 0" "RB0: 0" "RB0"
528937-528944 can: dlc: "Data length code: 9" "DLC: 9" "DLC"
528945-528960 can: data: "Data byte 0: 0xae" "DB 0: 0xae" "DB"
528961-528976 can: data: "Data byte 1: 0xff" "DB 1: 0xff" "DB"
528977-528992 can: data: "Data byte 2: 0xff" "DB 2: 0xff" "DB"
528993-529008 can: data: "Data byte 3: 0xff" "DB 3: 0xff" "DB"
529009-529024 can: data: "Data byte 4: 0xff" "DB 4: 0xff" "DB"
529025-529040 can: data: "Data byte 5: 0xff" "DB 5: 0xff" "DB"
529041-529056 can: data: "Data byte 6: 0xff" "DB 6: 0xff" "DB"
529057-529072 can: data: "Data byte 7: 0xff" "DB 7: 0xff" "DB"
529073-529088 can: data: "Data byte 8: 0xff" "DB 8: 0xff" "DB"
529089-529118 can: crc-sequence: "CRC sequence: 0x7fff" "CRC: 0x7fff" "CRC"
529119-529120 can: crc-delimiter: "CRC delimiter: 1" "CRC d: 1" "CRC d"
529121-529122 can: ack-slot: "ACK slot: NACK" "ACK s: NACK" "ACK s"
529123-529124 can: ack-delimiter: "ACK delimiter: 1" "ACK d: 1" "ACK d"
529125-529138 can: eof: "End of frame" "EOF" "E"
578712-578713 can: sof: "Start of frame" "SOF" "S"
578732-578733 can: stuff-bit: "Stuff bit: 0" "SB: 0" "SB"
578714-578737 can: id: "Identifier: 638 (0x27e)" "ID: 638 (0x27e)" "ID"
578740-578741 can: ide: "Identifier extension bit: extended frame" "IDE: extended frame" "IDE"
578752-578753 can: stuff-bit: "Stuff bit: 1" "SB: 1" "SB"
578774-578775 can: stuff-bit: "Stuff bit: 1" "SB: 1" "SB"
578742-578781 can: ext-id: "Extended Identifier: 256 (0x100)" "Extended ID: 256 (0x100)" "Extended ID" "EID"
578742-578781 can: full-id: "Full Identifier: 167248128 (0x9f80100)" "Full ID: 167248128 (0x9f80100)" "Full ID" "FID"
578738-578739 can: srr: "Substitute remote request: 1" "SRR: 1" "SRR"
578782-578783 can: rtr: "Remote transmission request: data frame" "RTR: data frame" "RTR"
578784-578785 can: reserved-bit: "Reserved bit 1: 0" "RB1: 0" "RB1"
578786-578787 can: stuff-bit: "Stuff bit: 1" "SB: 1" "SB"
578788-578789 can: reserved-bit: "Reserved bit 0: 0" "RB0: 0" "RB0"
578790-578797 can: dlc: "Data length code: 8" "DLC: 8" "DLC"
578878-578879 can: stuff-bit: "Stuff bit: 1" "SB: 1" "SB"
578798-578813 can: data: "Data byte 0: 0xaa" "DB 0: 0xaa" "DB"
578814-578829 can: data: "Data byte 1: 0xb0" "DB 1: 0xb0" "DB"
578830-578845 can: data: "Data byte 2: 0xc5" "DB 2: 0xc5" "DB"
578846-578861 can: data: "Data byte 3: 0x13" "DB 3: 0x13" "DB"
578862-578877 can: data: "Data byte 4: 0xa0" "DB 4: 0xa0" "DB"
578880-578895 can: data: "Data byte 5: 0x2d" "DB 5: 0x2d" "DB"
578896-578911 can: data: "Data byte 6: 0x44" "DB 6: 0x44" "DB"
578912-578927 can: data: "Data byte 7: 0xc6" "DB 7: 0xc6" "DB"
578928-578957 can: crc-sequence: "CRC sequence: 0x226b" "CRC: 0x226b" "CRC"
578958-578959 can: crc-delimiter: "CRC delimiter: 1" "CRC d: 1" "CRC d"
578960-578961 can: ack-slot: "ACK slot: ACK" "ACK s: ACK" "ACK s"
578962-578963 can: ack-delimiter: "ACK delimiter: 1" "ACK d: 1" "ACK d"
578964-578977 can: eof: "End of frame" "EOF" "E"
591361-591362 can: sof: "Start of frame" "SOF" "S"
591381-591382 can: stuff-bit: "Stuff bit: 0" "SB: 0" "SB"
591363-591386 can: id: "Identifier: 638 (0x27e)" "ID: 638 (0x27e)" "ID"
591389-591390 can: ide: "Identifier extension bit: extended frame" "IDE: extended frame" "IDE"
591401-591402 can: stuff-bit: "Stuff bit: 1" "SB: 1" "SB"
591421-591422 can: stuff-bit: "Stuff bit: 1" "SB: 1" "SB"
591391-591430 can: ext-id: "Extended Identifier: 512 (0x200)" "Extended ID: 512 (0x200)" "Extended ID" "EID"
591391-591430 can: full-id: "Full Identifier: 167248384 (0x9f80200)" "Full ID: 167248384 (0x9f80200)" "Full ID" "FID"
591387-591388 can: srr: "Substitute remote request: 1" "SRR: 1" "SRR"
591431-591432 can: rtr: "Remote transmission request: data frame" "RTR: data frame" "RTR"
591433-591434 can: stuff-bit: "Stuff bit: 1" "SB: 1" "SB"
591435-591436 can: reserved-bit: "Reserved bit 1: 0" "RB1: 0" "RB1"
591437-591438 can: reserved-bit: "Reserved bit 0: 0" "RB0: 0" "RB0"
591439-591446 can: dlc: "Data length code: 8" "DLC: 8" "DLC"
591451-591452 can: stuff-bit: "Stuff bit: 1" "SB: 1" "SB"
591475-591476 can: stuff-bit: "Stuff bit: 0" "SB: 0" "SB"
591523-591524 can: stuff-bit: "Stuff bit: 1" "SB: 1" "SB"
591543-591544 can: stuff-bit: "Stuff bit: 1" "SB: 1" "SB"
591561-591562 can: stuff-bit: "Stuff bit: 0" "SB: 0" "SB"
591573-591574 can: stuff-bit: "Stuff bit: 0" "SB: 0" "SB"
591585-591586 can: stuff-bit: "Stuff bit: 0" "SB: 0" "SB"
591447-591464 can: data: "Data byte 0: 0x28" "DB 0: 0x28" "DB"
591465-591482 can: data: "Data byte 1: 0xfc" "DB 1: 0xfc" "DB"
591483-591498 can: data: "Data byte 2: 0x47" "DB 2: 0x47" "DB"
591499-591514 can: data: "Data byte 3: 0x0a" "DB 3: 0x0a" "DB"
591515-591532 can: data: "Data byte 4: 0x01" "DB 4: 0x01" "DB"
591533-591550 can: data: "Data byte 5: 0x00" "DB 5: 0x00" "DB"
591551-591568 can: data: "Data byte 6: 0xff" "DB 6: 0xff" "DB"
591569-591588 can: data: "Data byte 7: 0xff" "DB 7: 0xff" "DB"
591597-591598 can: stuff-bit: "Stuff bit: 0" "SB: 0" "SB"
591589-591620 can: crc-sequence: "CRC sequence: 0x7cc2" "CRC: 0x7cc2" "CRC"
591621-591622 can: crc-delimiter: "CRC delimiter: 1" "CRC d: 1" "CRC d"
591623-591624 can: ack-slot: "ACK slot: ACK" "ACK s: ACK" "ACK s"
591625-591626 can: ack-delimiter: "ACK delimiter: 1" "ACK d: 1" "ACK d"
591627-591640 can: eof: "End of frame" "EOF" "E"
628753-628754 can: sof: "Start of frame" "SOF" "S"
628773-628774 can: stuff-bit: "Stuff bit: 0" "SB: 0" "SB"
628755-628778 can: id: "Identifier: 638 (0x27e)" "ID: 638 (0x27e)" "ID"
628781-628782 can: ide: "Identifier extension bit: extended frame" "IDE: extended frame" "IDE"
628793-628794 can: stuff-bit: "Stuff bit: 1" "SB: 1" "SB"
628815-628816 can: stuff-bit: "Stuff bit: 1" "SB: 1" "SB"
628783-628822 can: ext-id: "Extended Identifier: 256 (0x100)" "Extended ID: 256 (0x100)" "Extended ID" "EID"
628783-628822 can: full-id: "Full Identifier: 167248128 (0x9f80100)" "Full ID: 167248128 (0x9f80100)" "Full ID" "FID"
628779-628780 can: srr: "Substitute remote request: 1" "SRR: 1" "SRR"
628823-628824 can: rtr: "Remote transmission request: data frame" "RTR: data frame" "RTR"
628825-628826 can: reserved-bit: "Reserved bit 1: 0" "RB1: 0" "RB1"
628827-628828 can: stuff-bit: "Stuff bit: 1" "SB: 1" "SB"
628829-628830 can: reserved-bit: "Reserved bit 0: 0" "RB0: 0" "RB0"
628831-628838 can: dlc: "Data length code: 8" "DLC: 8" "DLC"
628919-628920 can: stuff-bit: "Stuff bit: 1" "SB: 1" "SB"
628839-628854 can: data: "Data byte 0: 0xaa" "DB 0: 0xaa" "DB"
628855-628870 can: data: "Data byte 1: 0xb0" "DB 1: 0xb0" "DB"
628871-628886 can: data: "Data byte 2: 0xc5" "DB 2: 0xc5" "DB"
628887-628902 can: data: "Data byte 3: 0x13" "DB 3: 0x13" "DB"
628903-628918 can: data: "Data byte 4: 0xa0" "DB 4: 0xa0" "DB"
628921-628936 can: data: "Data byte 5: 0x2d" "DB 5: 0x2d" "DB"
628937-628952 can: data: "Data byte 6: 0x44" "DB 6: 0x44" "DB"
628953-628968 can: data: "Data byte 7: 0xc6" "DB 7: 0xc6" "DB"
628969-628998 can: crc-sequence: "CRC sequence: 0x226b" "CRC: 0x226b" "CRC"
628999-629000 can: crc-delimiter: "CRC delimiter: 1" "CRC d: 1" "CRC d"
629001-629002 can: ack-slot: "ACK slot: ACK" "ACK s: ACK" "ACK s"
629003-629004 can: ack-delimiter: "ACK delimiter: 1" "ACK d: 1" "ACK d"
629005-629018 can: eof: "End of frame" "EOF" "E"
663489-663490 can: sof: "Start of frame" "SOF" "S"
663509-663510 can: stuff-bit: "Stuff bit: 0" "SB: 0" "SB"
663491-663514 can: id: "Identifier: 636 (0x27c)" "ID: 636 (0x27c)" "ID"
663517-663518 can: ide: "Identifier extension bit: extended frame" "IDE: extended frame" "IDE"
663531-663532 can: stuff-bit: "Stuff bit: 1" "SB: 1" "SB"
663551-663552 can: stuff-bit: "Stuff bit: 1" "SB: 1" "SB"
663519-663558 can: ext-id: "Extended Identifier: 131329 (0x20101)" "Extended ID: 131329 (0x20101)" "Extended ID" "EID"
663519-663558 can: full-id: "Full Identifier: 166854913 (0x9f20101)" "Full ID: 166854913 (0x9f20101)" "Full ID" "FID"
663515-663516 can: srr: "Substitute remote request: 1" "SRR: 1" "SRR"
663559-663560 can: rtr: "Remote transmission request: data frame" "RTR: data frame" "RTR"
663561-663562 can: reserved-bit: "Reserved bit 1: 0" "RB1: 0" "RB1"
663563-663564 can: reserved-bit: "Reserved bit 0: 0" "RB0: 0" "RB0"
663565-663572 can: dlc: "Data length code: 8" "DLC: 8" "DLC"
663589-663590 can: stuff-bit: "Stuff bit: 1" "SB: 1" "SB"
663617-663618 can: stuff-bit: "Stuff bit: 0" "SB: 0" "SB"
663629-663630 can: stuff-bit: "Stuff bit: 0" "SB: 0" "SB"
663641-663642 can: stuff-bit: "Stuff bit: 0" "SB: 0" "SB"
663653-663654 can: stuff-bit: "Stuff bit: 0" "SB: 0" "SB"
663665-663666 can: stuff-bit: "Stuff bit: 0" "SB: 0" "SB"
663677-663678 can: stuff-bit: "Stuff bit: 0" "SB: 0" "SB"
663689-663690 can: stuff-bit: "Stuff bit: 0" "SB: 0" "SB"
663701-663702 can: stuff-bit: "Stuff bit: 0" "SB: 0" "SB"
663713-663714 can: stuff-bit: "Stuff bit: 0" "SB: 0" "SB"
663573-663588 can: data: "Data byte 0: 0xa0" "DB 0: 0xa0" "DB"
663591-663606 can: data: "Data byte 1: 0x1a" "DB 1: 0x1a" "DB"
663607-663624 can: data: "Data byte 2: 0xff" "DB 2: 0xff" "DB"
663625-663644 can: data: "Data byte 3: 0xff" "DB 3: 0xff" "DB"
663645-663662 can: data: "Data byte 4: 0xff" "DB 4: 0xff" "DB"
663663-663682 can: data: "Data byte 5: 0xff" "DB 5: 0xff" "DB"
663683-663700 can: data: "Data byte 6: 0xff" "DB 6: 0xff" "DB"
663703-663720 can: data: "Data byte 7: 0xff" "DB 7: 0xff" "DB"
663721-663750 can: crc-sequence: "CRC sequence: 0x2dad" "CRC: 0x2dad" "CRC"
663751-663752 can: crc-delimiter: "CRC delimiter: 1" "CRC d: 1" "CRC d"
663753-663754 can: ack-slot: "ACK slot: ACK" "ACK s: ACK" "ACK s"
663755-663756 can: ack-delimiter: "ACK delimiter: 1" "ACK d: 1" "ACK d"
663757-663770 can: eof: "End of frame" "EOF" "E"
663803-663804 can: sof: "Start of frame" "SOF" "S"
663823-663824 can: stuff-bit: "Stuff bit: 0" "SB: 0" "SB"
663805-663828 can: id: "Identifier: 636 (0x27c)" "ID: 636 (0x27c)" "ID"
663831-663832 can: ide: "Identifier extension bit: extended frame" "IDE: extended frame" "IDE"
663845-663846 can: stuff-bit: "Stuff bit: 1" "SB: 1" "SB"
663865-663866 can: stuff-bit: "Stuff bit: 1" "SB: 1" "SB"
663833-663872 can: ext-id: "Extended Identifier: 131329 (0x20101)" "Extended ID: 131329 (0x20101)" "Extended ID" "EID"
663833-663872 can: full-id: "Full Identifier: 166854913 (0x9f20101)" "Full ID: 166854913 (0x9f20101)" "Full ID" "FID"
663829-663830 can: srr: "Substitute remote request: 1" "SRR: 1" "SRR"
663873-663874 can: rtr: "Remote transmission request: data frame" "RTR: data frame" "RTR"
663875-663876 can: reserved-bit: "Reserved bit 1: 0" "RB1: 0" "RB1"
663877-663878 can: reserved-bit: "Reserved bit 0: 0" "RB0: 0" "RB0"
663879-663886 can: dlc: "Data length code: 8" "DLC: 8" "DLC"
663911-663912 can: stuff-bit: "Stuff bit: 0" "SB: 0" "SB"
663923-663924 can: stuff-bit: "Stuff bit: 0" "SB: 0" "SB"
663935-663936 can: stuff-bit: "Stuff bit: 0" "SB: 0" "SB"
663953-663954 can: stuff-bit: "Stuff bit: 0" "SB: 0" "SB"
663969-663970 can: stuff-bit: "Stuff bit: 1" "SB: 1" "SB"
663981-663982 can: stuff-bit: "Stuff bit: 1" "SB: 1" "SB"
663993-663994 can: stuff-bit: "Stuff bit: 1" "SB: 1" "SB"
664007-664008 can: stuff-bit: "Stuff bit: 0" "SB: 0" "SB"
664019-664020 can: stuff-bit: "Stuff bit: 0" "SB: 0" "SB"
664031-664032 can: stuff-bit: "Stuff bit: 0" "SB: 0" "SB"
663887-663902 can: data: "Data byte 0: 0xa1" "DB 0: 0xa1" "DB"
663903-663920 can: data: "Data byte 1: 0xff" "DB 1: 0xff" "DB"
663921-663940 can: data: "Data byte 2: 0xff" "DB 2: 0xff" "DB"
663941-663958 can: data: "Data byte 3: 0x7f" "DB 3: 0x7f" "DB"
663959-663976 can: data: "Data byte 4: 0x00" "DB 4: 0x00" "DB"
663977-663996 can: data: "Data byte 5: 0x00" "DB 5: 0x00" "DB"
663997-664014 can: data: "Data byte 6: 0xff" "DB 6: 0xff" "DB"
664015-664034 can: data: "Data byte 7: 0xff" "DB 7: 0xff" "DB"
664035-664064 can: crc-sequence: "CRC sequence: 0x68ea" "CRC: 0x68ea" "CRC"
664065-664066 can: crc-delimiter: "CRC delimiter: 1" "CRC d: 1" "CRC d"
664067-664068 can: ack-slot: "ACK slot: ACK" "ACK s: ACK" "ACK s"
664069-664070 can: ack-delimiter: "ACK delimiter: 1" "ACK d: 1" "ACK d"
664071-664084 can: eof: "End of frame" "EOF" "E"
664115-664116 can: sof: "Start of frame" "SOF" "S"
664135-664136 can: stuff-bit: "Stuff bit: 0" "SB: 0" "SB"
664117-664140 can: id: "Identifier: 636 (0x27c)" "ID: 636 (0x27c)" "ID"
664143-664144 can: ide: "Identifier extension bit: extended frame" "IDE: extended frame" "IDE"
664157-664158 can: stuff-bit: "Stuff bit: 1" "SB: 1" "SB"
664177-664178 can: stuff-bit: "Stuff bit: 1" "SB: 1" "SB"
664145-664184 can: ext-id: "Extended Identifier: 131329 (0x20101)" "Extended ID: 131329 (0x20101)" "Extended ID" "EID"
664145-664184 can: full-id: "Full Identifier: 166854913 (0x9f20101)" "Full ID: 166854913 (0x9f20101)" "Full ID" "FID"
664141-664142 can: srr: "Substitute remote request: 1" "SRR: 1" "SRR"
664185-664186 can: rtr: "Remote transmission request: data frame" "RTR: data frame" "RTR"
664187-664188 can: reserved-bit: "Reserved bit 1: 0" "RB1: 0" "RB1"
664189-664190 can: reserved-bit: "Reserved bit 0: 0" "RB0: 0" "RB0"
664191-664198 can: dlc: "Data length code: 8" "DLC: 8" "DLC"
664225-664226 can: stuff-bit: "Stuff bit: 0" "SB: 0" "SB"
664237-664238 can: stuff-bit: "Stuff bit: 0" "SB: 0" "SB"
664249-664250 can: stuff-bit: "Stuff bit: 0" "SB: 0" "SB"
664261-664262 can: stuff-bit: "Stuff bit: 0" "SB: 0" "SB"
664273-664274 can: stuff-bit: "Stuff bit: 0" "SB: 0" "SB"
664285-664286 can: stuff-bit: "Stuff bit: 0" "SB: 0" "SB"
664297-664298 can: stuff-bit: "Stuff bit: 0" "SB: 0" "SB"
664309-664310 can: stuff-bit: "Stuff bit: 0" "SB: 0" "SB"
664321-664322 can: stuff-bit: "Stuff bit: 0" "SB: 0" "SB"
664333-664334 can: stuff-bit: "Stuff bit: 0" "SB: 0" "SB"
664345-664346 can: stuff-bit: "Stuff bit: 0" "SB: 0" "SB"
664199-664214 can: data: "Data byte 0: 0xa2" "DB 0: 0xa2" "DB"
664215-664232 can: data: "Data byte 1: 0xff" "DB 1: 0xff" "DB"
664233-664252 can: data: "Data byte 2: 0xff" "DB 2: 0xff" "DB"
664253-664270 can: data: "Data byte 3: 0xff" "DB 3: 0xff" "DB"
664271-664290 can: data: "Data byte 4: 0xff" "DB 4: 0xff" "DB"
664291-664308 can: data: "Data byte 5: 0xff" "DB 5: 0xff" "DB"
664311-664328 can: data: "Data byte 6: 0xff" "DB 6: 0xff" "DB"
664329-664348 can: data: "Data byte 7: 0xff" "DB 7: 0xff" "DB"
664349-664378 can: crc-sequence: "CRC sequence: 0x5661" "CRC: 0x5661" "CRC"
664379-664380 can: crc-delimiter: "CRC delimiter: 1" "CRC d: 1" "CRC d"
664381-664382 can: ack-slot: "ACK slot: ACK" "ACK s: ACK" "ACK s"
664383-664384 can: ack-delimiter: "ACK delimiter: 1" "ACK d: 1" "ACK d"
664385-664398 can: eof: "End of frame" "EOF" "E"
664431-664432 can: sof: "Start of frame" "SOF" "S"
664451-664452 can: stuff-bit: "Stuff bit: 0" "SB: 0" "SB"
664433-664456 can: id: "Identifier: 636 (0x27c)" "ID: 636 (0x27c)" "ID"
664459-664460 can: ide: "Identifier extension bit: extended frame" "IDE: extended frame" "IDE"
664473-664474 can: stuff-bit: "Stuff bit: 1" "SB: 1" "SB"
664493-664494 can: stuff-bit: "Stuff bit: 1" "SB: 1" "SB"
664461-664500 can: ext-id: "Extended Identifier: 131329 (0x20101)" "Extended ID: 131329 (0x20101)" "Extended ID" "EID"
664461-664500 can: full-id: "Full Identifier: 166854913 (0x9f20101)" "Full ID: 166854913 (0x9f20101)" "Full ID" "FID"
664457-664458 can: srr: "Substitute remote request: 1" "SRR: 1" "SRR"
664501-664502 can: rtr: "Remote transmission request: data frame" "RTR: data frame" "RTR"
664503-664504 can: reserved-bit: "Reserved bit 1: 0" "RB1: 0" "RB1"
664505-664506 can: reserved-bit: "Reserved bit 0: 0" "RB0: 0" "RB0"
664507-664514 can: dlc: "Data length code: 8" "DLC: 8" "DLC"
664541-664542 can: stuff-bit: "Stuff bit: 1" "SB: 1" "SB"
664553-664554 can: stuff-bit: "Stuff bit: 1" "SB: 1" "SB"
664565-664566 can: stuff-bit: "Stuff bit: 1" "SB: 1" "SB"
664577-664578 can: stuff-bit: "Stuff bit: 1" "SB: 1" "SB"
664589-664590 can: stuff-bit: "Stuff bit: 1" "SB: 1" "SB"
664601-664602 can: stuff-bit: "Stuff bit: 1" "SB: 1" "SB"
664619-664620 can: stuff-bit: "Stuff bit: 0" "SB: 0" "SB"
664637-664638 can: stuff-bit: "Stuff bit: 0" "SB: 0" "SB"
664649-664650 can: stuff-bit: "Stuff bit: 0" "SB: 0" "SB"
664515-664530 can: data: "Data byte 0: 0xa3" "DB 0: 0xa3" "DB"
664531-664548 can: data: "Data byte 1: 0x00" "DB 1: 0x00" "DB"
664549-664568 can: data: "Data byte 2: 0x00" "DB 2: 0x00" "DB"
664569-664586 can: data: "Data byte 3: 0x00" "DB 3: 0x00" "DB"
664587-664606 can: data: "Data byte 4: 0x00" "DB 4: 0x00" "DB"
664607-664624 can: data: "Data byte 5: 0x7f" "DB 5: 0x7f" "DB"
664625-664642 can: data: "Data byte 6: 0x7f" "DB 6: 0x7f" "DB"
664643-664660 can: data: "Data byte 7: 0xff" "DB 7: 0xff" "DB"
664661-664662 can: stuff-bit: "Stuff bit: 0" "SB: 0" "SB"
664663-664692 can: crc-sequence: "CRC sequence: 0x4de8" "CRC: 0x4de8" "CRC"
664693-664694 can: crc-delimiter: "CRC delimiter: 1" "CRC d: 1" "CRC d"
664695-664696 can: ack-slot: "ACK slot: ACK" "ACK s: ACK" "ACK s"
664697-664698 can: ack-delimiter: "ACK delimiter: 1" "ACK d: 1" "ACK d"
664699-664712 can: eof: "End of frame" "EOF" "E"
670451-670452 can: sof: "Start of frame" "SOF" "S"
670471-670472 can: stuff-bit: "Stuff bit: 0" "SB: 0" "SB"
670453-670476 can: id: "Identifier: 892 (0x37c)" "ID: 892 (0x37c)" "ID"
670479-670480 can: ide: "Identifier extension bit: extended frame" "IDE: extended frame" "IDE"
670491-670492 can: stuff-bit: "Stuff bit: 1" "SB: 1" "SB"
670505-670506 can: stuff-bit: "Stuff bit: 1" "SB: 1" "SB"
670517-670518 can: stuff-bit: "Stuff bit: 1" "SB: 1" "SB"
670481-670522 can: ext-id: "Extended Identifier: 4096 (0x1000)" "Extended ID: 4096 (0x1000)" "Extended ID" "EID"
670481-670522 can: full-id: "Full Identifier: 233836544 (0xdf01000)" "Full ID: 233836544 (0xdf01000)" "Full ID" "FID"
670477-670478 can: srr: "Substitute remote request: 1" "SRR: 1" "SRR"
670523-670524 can: rtr: "Remote transmission request: data frame" "RTR: data frame" "RTR"
670525-670526 can: reserved-bit: "Reserved bit 1: 0" "RB1: 0" "RB1"
670527-670528 can: reserved-bit: "Reserved bit 0: 0" "RB0: 0" "RB0"
670529-670530 can: stuff-bit: "Stuff bit: 1" "SB: 1" "SB"
670531-670538 can: dlc: "Data length code: 8" "DLC: 8" "DLC"
670543-670544 can: stuff-bit: "Stuff bit: 1" "SB: 1" "SB"
670565-670566 can: stuff-bit: "Stuff bit: 0" "SB: 0" "SB"
670575-670576 can: stuff-bit: "Stuff bit: 1" "SB: 1" "SB"
670597-670598 can: stuff-bit: "Stuff bit: 1" "SB: 1" "SB"
670607-670608 can: stuff-bit: "Stuff bit: 0" "SB: 0" "SB"
670631-670632 can: stuff-bit: "Stuff bit: 1" "SB: 1" "SB"
670655-670656 can: stuff-bit: "Stuff bit: 1" "SB: 1" "SB"
670671-670672 can: stuff-bit: "Stuff bit: 1" "SB: 1" "SB"
670539-670556 can: data: "Data byte 0: 0x29" "DB 0: 0x29" "DB"
670557-670574 can: data: "Data byte 1: 0xf0" "DB 1: 0xf0" "DB"
670577-670592 can: data: "Data byte 2: 0x18" "DB 2: 0x18" "DB"
670593-670612 can: data: "Data byte 3: 0x3e" "DB 3: 0x3e" "DB"
670613-670628 can: data: "Data byte 4: 0xb0" "DB 4: 0xb0" "DB"
670629-670646 can: data: "Data byte 5: 0x16" "DB 5: 0x16" "DB"
670647-670664 can: data: "Data byte 6: 0x04" "DB 6: 0x04" "DB"
670665-670682 can: data: "Data byte 7: 0x1c" "DB 7: 0x1c" "DB"
670701-670702 can: stuff-bit: "Stuff bit: 1" "SB: 1" "SB"
670683-670714 can: crc-sequence: "CRC sequence: 0x3824" "CRC: 0x3824" "CRC"
670715-670716 can: crc-delimiter: "CRC delimiter: 1" "CRC d: 1" "CRC d"
670717-670718 can: ack-slot: "ACK slot: ACK" "ACK s: ACK" "ACK s"
670719-670720 can: ack-delimiter: "ACK delimiter: 1" "ACK d: 1" "ACK d"
670721-670734 can: eof: "End of frame" "EOF" "E"
671687-671688 can: sof: "Start of frame" "SOF" "S"
671707-671708 can: stuff-bit: "Stuff bit: 0" "SB: 0" "SB"
671689-671712 can: id: "Identifier: 1662 (0x67e)" "ID: 1662 (0x67e)" "ID"
671715-671716 can: ide: "Identifier extension bit: extended frame" "IDE: extended frame" "IDE"
671729-671730 can: stuff-bit: "Stuff bit: 1" "SB: 1" "SB"
671749-671750 can: stuff-bit: "Stuff bit: 1" "SB: 1" "SB"
671717-671756 can: ext-id: "Extended Identifier: 131840 (0x20300)" "Extended ID: 131840 (0x20300)" "Extended ID" "EID"
671717-671756 can: full-id: "Full Identifier: 435815168 (0x19fa0300)" "Full ID: 435815168 (0x19fa0300)" "Full ID" "FID"
671713-671714 can: srr: "Substitute remote request: 1" "SRR: 1" "SRR"
671757-671758 can: rtr: "Remote transmission request: data frame" "RTR: data frame" "RTR"
671759-671760 can: reserved-bit: "Reserved bit 1: 0" "RB1: 0" "RB1"
671761-671762 can: stuff-bit: "Stuff bit: 1" "SB: 1" "SB"
671763-671764 can: reserved-bit: "Reserved bit 0: 0" "RB0: 0" "RB0"
671765-671772 can: dlc: "Data length code: 8" "DLC: 8" "DLC"
671777-671778 can: stuff-bit: "Stuff bit: 1" "SB: 1" "SB"
671833-671834 can: stuff-bit: "Stuff bit: 1" "SB: 1" "SB"
671845-671846 can: stuff-bit: "Stuff bit: 1" "SB: 1" "SB"
671869-671870 can: stuff-bit: "Stuff bit: 1" "SB: 1" "SB"
671899-671900 can: stuff-bit: "Stuff bit: 1" "SB: 1" "SB"
671773-671790 can: data: "Data byte 0: 0x29" "DB 0: 0x29" "DB"
671791-671806 can: data: "Data byte 1: 0xd3" "DB 1: 0xd3" "DB"
671807-671822 can: data: "Data byte 2: 0xd3" "DB 2: 0xd3" "DB"
671823-671840 can: data: "Data byte 3: 0x00" "DB 3: 0x00" "DB"
671841-671858 can: data: "Data byte 4: 0x03" "DB 4: 0x03" "DB"
671859-671876 can: data: "Data byte 5: 0x01" "DB 5: 0x01" "DB"
671877-671892 can: data: "Data byte 6: 0x64" "DB 6: 0x64" "DB"
671893-671910 can: data: "Data byte 7: 0x00" "DB 7: 0x00" "DB"
671911-671912 can: stuff-bit: "Stuff bit: 1" "SB: 1" "SB"
671925-671926 can: stuff-bit: "Stuff bit: 1" "SB: 1" "SB"
671943-671944 can: stuff-bit: "Stuff bit: 1" "SB: 1" "SB"
671913-671946 can: crc-sequence: "CRC sequence: 0x41c1" "CRC: 0x41c1" "CRC"
671947-671948 can: crc-delimiter: "CRC delimiter: 1" "CRC d: 1" "CRC d"
671949-671950 can: ack-slot: "ACK slot: ACK" "ACK s: ACK" "ACK s"
671951-671952 can: ack-delimiter: "ACK delimiter: 1" "ACK d: 1" "ACK d"
671953-671966 can: eof: "End of frame" "EOF" "E"
673188-673189 can: sof: "Start of frame" "SOF" "S"
673208-673209 can: stuff-bit: "Stuff bit: 0" "SB: 0" "SB"
673190-673213 can: id: "Identifier: 1662 (0x67e)" "ID: 1662 (0x67e)" "ID"
673216-673217 can: ide: "Identifier extension bit: extended frame" "IDE: extended frame" "IDE"
673230-673231 can: stuff-bit: "Stuff bit: 1" "SB: 1" "SB"
673246-673247 can: stuff-bit: "Stuff bit: 1" "SB: 1" "SB"
673218-673257 can: ext-id: "Extended Identifier: 132096 (0x20400)" "Extended ID: 132096 (0x20400)" "Extended ID" "EID"
673218-673257 can: full-id: "Full Identifier: 435815424 (0x19fa0400)" "Full ID: 435815424 (0x19fa0400)" "Full ID" "FID"
673214-673215 can: srr: "Substitute remote request: 1" "SRR: 1" "SRR"
673258-673259 can: stuff-bit: "Stuff bit: 1" "SB: 1" "SB"
673260-673261 can: rtr: "Remote transmission request: data frame" "RTR: data frame" "RTR"
673262-673263 can: reserved-bit: "Reserved bit 1: 0" "RB1: 0" "RB1"
673264-673265 can: reserved-bit: "Reserved bit 0: 0" "RB0: 0" "RB0"
673266-673273 can: dlc: "Data length code: 8" "DLC: 8" "DLC"
673278-673279 can: stuff-bit: "Stuff bit: 1" "SB: 1" "SB"
673292-673293 can: stuff-bit: "Stuff bit: 1" "SB: 1" "SB"
673334-673335 can: stuff-bit: "Stuff bit: 0" "SB: 0" "SB"
673376-673377 can: stuff-bit: "Stuff bit: 0" "SB: 0" "SB"
673274-673291 can: data: "Data byte 0: 0x20" "DB 0: 0x20" "DB"
673294-673309 can: data: "Data byte 1: 0x87" "DB 1: 0x87" "DB"
673310-673325 can: data: "Data byte 2: 0x29" "DB 2: 0x29" "DB"
673326-673343 can: data: "Data byte 3: 0xfd" "DB 3: 0xfd" "DB"
673344-673359 can: data: "Data byte 4: 0x0b" "DB 4: 0x0b" "DB"
673360-673375 can: data: "Data byte 5: 0x1f" "DB 5: 0x1f" "DB"
673378-673393 can: data: "Data byte 6: 0x22" "DB 6: 0x22" "DB"
673394-673409 can: data: "Data byte 7: 0x24" "DB 7: 0x24" "DB"
673410-673439 can: crc-sequence: "CRC sequence: 0x547a" "CRC: 0x547a" "CRC"
673440-673441 can: crc-delimiter: "CRC delimiter: 1" "CRC d: 1" "CRC d"
673442-673443 can: ack-slot: "ACK slot: ACK" "ACK s: ACK" "ACK s"
673444-673445 can: ack-delimiter: "ACK delimiter: 1" "ACK d: 1" "ACK d"
673446-673459 can: eof: "End of frame" "EOF" "E"
674726-674727 can: sof: "Start of frame" "SOF" "S"
674746-674747 can: stuff-bit: "Stuff bit: 0" "SB: 0" "SB"
674728-674751 can: id: "Identifier: 1662 (0x67e)" "ID: 1662 (0x67e)" "ID"
674754-674755 can: ide: "Identifier extension bit: extended frame" "IDE: extended frame" "IDE"
674768-674769 can: stuff-bit: "Stuff bit: 1" "SB: 1" "SB"
674784-674785 can: stuff-bit: "Stuff bit: 1" "SB: 1" "SB"
674756-674795 can: ext-id: "Extended Identifier: 132096 (0x20400)" "Extended ID: 132096 (0x20400)" "Extended ID" "EID"
674756-674795 can: full-id: "Full Identifier: 435815424 (0x19fa0400)" "Full ID: 435815424 (0x19fa0400)" "Full ID" "FID"
674752-674753 can: srr: "Substitute remote request: 1" "SRR: 1" "SRR"
674796-674797 can: stuff-bit: "Stuff bit: 1" "SB: 1" "SB"
674798-674799 can: rtr: "Remote transmission request: data frame" "RTR: data frame" "RTR"
674800-674801 can: reserved-bit: "Reserved bit 1: 0" "RB1: 0" "RB1"
674802-674803 can: reserved-bit: "Reserved bit 0: 0" "RB0: 0" "RB0"
674804-674811 can: dlc: "Data length code: 8" "DLC: 8" "DLC"
674816-674817 can: stuff-bit: "Stuff bit: 1" "SB: 1" "SB"
674882-674883 can: stuff-bit: "Stuff bit: 1" "SB: 1" "SB"
674920-674921 can: stuff-bit: "Stuff bit: 1" "SB: 1" "SB"
674932-674933 can: stuff-bit: "Stuff bit: 1" "SB: 1" "SB"
674944-674945 can: stuff-bit: "Stuff bit: 1" "SB: 1" "SB"
674812-674829 can: data: "Data byte 0: 0x21" "DB 0: 0x21" "DB"
674830-674845 can: data: "Data byte 1: 0x22" "DB 1: 0x22" "DB"
674846-674861 can: data: "Data byte 2: 0x15" "DB 2: 0x15" "DB"
674862-674877 can: data: "Data byte 3: 0x58" "DB 3: 0x58" "DB"
674878-674895 can: data: "Data byte 4: 0x1c" "DB 4: 0x1c" "DB"
674896-674911 can: data: "Data byte 5: 0x32" "DB 5: 0x32" "DB"
674912-674929 can: data: "Data byte 6: 0x00" "DB 6: 0x00" "DB"
674930-674949 can: data: "Data byte 7: 0x00" "DB 7: 0x00" "DB"
674950-674979 can: crc-sequence: "CRC sequence: 0x5cdf" "CRC: 0x5cdf" "CRC"
674980-674981 can: stuff-bit: "Stuff bit: 0" "SB: 0" "SB"
674982-674983 can: crc-delimiter: "CRC delimiter: 1" "CRC d: 1" "CRC d"
674984-674985 can: ack-slot: "ACK slot: NACK" "ACK s: NACK" "ACK s"
674986-674987 can: ack-delimiter: "ACK delimiter: 1" "ACK d: 1" "ACK d"
674988-675001 can: eof: "End of frame" "EOF" "E"
676187-676188 can: sof: "Start of frame" "SOF" "S"
676207-676208 can: stuff-bit: "Stuff bit: 0" "SB: 0" "SB"
676189-676212 can: id: "Identifier: 1662 (0x67e)" "ID: 1662 (0x67e)" "ID"
676215-676216 can: ide: "Identifier extension bit: extended frame" "IDE: extended frame" "IDE"
676229-676230 can: stuff-bit: "Stuff bit: 1" "SB: 1" "SB"
676245-676246 can: stuff-bit: "Stuff bit: 1" "SB: 1" "SB"
676217-676256 can: ext-id: "Extended Identifier: 132096 (0x20400)" "Extended ID: 132096 (0x20400)" "Extended ID" "EID"
676217-676256 can: full-id: "Full Identifier: 435815424 (0x19fa0400)" "Full ID: 435815424 (0x19fa0400)" "Full ID" "FID"
676213-676214 can: srr: "Substitute remote request: 1" "SRR: 1" "SRR"
676257-676258 can: stuff-bit: "Stuff bit: 1" "SB: 1" "SB"
676259-676260 can: rtr: "Remote transmission request: data frame" "RTR: data frame" "RTR"
676261-676262 can: reserved-bit: "Reserved bit 1: 0" "RB1: 0" "RB1"
676263-676264 can: reserved-bit: "Reserved bit 0: 0" "RB0: 0" "RB0"
676265-676272 can: dlc: "Data length code: 8" "DLC: 8" "DLC"
676277-676278 can: stuff-bit: "Stuff bit: 1" "SB: 1" "SB"
676299-676300 can: stuff-bit: "Stuff bit: 1" "SB: 1" "SB"
676333-676334 can: stuff-bit: "Stuff bit: 1" "SB: 1" "SB"
676367-676368 can: stuff-bit: "Stuff bit: 1" "SB: 1" "SB"
676393-676394 can: stuff-bit: "Stuff bit: 0" "SB: 0" "SB"
676273-676290 can: data: "Data byte 0: 0x22" "DB 0: 0x22" "DB"
676291-676308 can: data: "Data byte 1: 0x00" "DB 1: 0x00" "DB"
676309-676324 can: data: "Data byte 2: 0xf2" "DB 2: 0xf2" "DB"
676325-676342 can: data: "Data byte 3: 0x01" "DB 3: 0x01" "DB"
676343-676358 can: data: "Data byte 4: 0xa2" "DB 4: 0xa2" "DB"
676359-676376 can: data: "Data byte 5: 0x0d" "DB 5: 0x0d" "DB"
676377-676392 can: data: "Data byte 6: 0x1f" "DB 6: 0x1f" "DB"
676395-676410 can: data: "Data byte 7: 0xab" "DB 7: 0xab" "DB"
676417-676418 can: stuff-bit: "Stuff bit: 0" "SB: 0" "SB"
676411-676442 can: crc-sequence: "CRC sequence: 0x7c6c" "CRC: 0x7c6c" "CRC"
676443-676444 can: crc-delimiter: "CRC delimiter: 1" "CRC d: 1" "CRC d"
676445-676446 can: ack-slot: "ACK slot: ACK" "ACK s: ACK" "ACK s"
676447-676448 can: ack-delimiter: "ACK delimiter: 1" "ACK d: 1" "ACK d"
676449-676462 can: eof: "End of frame" "EOF" "E"
677687-677688 can: sof: "Start of frame" "SOF" "S"
677705-677706 can: stuff-bit: "Stuff bit: 0" "SB: 0" "SB"
677689-677712 can: id: "Identifier: 1789 (0x6fd)" "ID: 1789 (0x6fd)" "ID"
677715-677716 can: ide: "Identifier extension bit: extended frame" "IDE: extended frame" "IDE"
677727-677728 can: stuff-bit: "Stuff bit: 1" "SB: 1" "SB"
677743-677744 can: stuff-bit: "Stuff bit: 1" "SB: 1" "SB"
677755-677756 can: stuff-bit: "Stuff bit: 1" "SB: 1" "SB"
677717-677758 can: ext-id: "Extended Identifier: 2048 (0x800)" "Extended ID: 2048 (0x800)" "Extended ID" "EID"
677717-677758 can: full-id: "Full Identifier: 468977664 (0x1bf40800)" "Full ID: 468977664 (0x1bf40800)" "Full ID" "FID"
677713-677714 can: srr: "Substitute remote request: 1" "SRR: 1" "SRR"
677759-677760 can: rtr: "Remote transmission request: data frame" "RTR: data frame" "RTR"
677761-677762 can: reserved-bit: "Reserved bit 1: 0" "RB1: 0" "RB1"
677763-677764 can: reserved-bit: "Reserved bit 0: 1" "RB0: 1" "RB0"
677765-677772 can: dlc: "Data length code: 0" "DLC: 0" "DLC"
677775-677776 can: stuff-bit: "Stuff bit: 1" "SB: 1" "SB"
677795-677796 can: stuff-bit: "Stuff bit: 0" "SB: 0" "SB"
677773-677806 can: crc-sequence: "CRC sequence: 0x23f0" "CRC: 0x23f0" "CRC"
677807-677808 can: crc-delimiter: "CRC delimiter: 0" "CRC d: 0" "CRC d"
677809-677810 can: stuff-bit: "Stuff bit: 1" "SB: 1" "SB"
677811-677812 can: ack-slot: "ACK slot: ACK" "ACK s: ACK" "ACK s"
677813-677814 can: ack-delimiter: "ACK delimiter: 0" "ACK d: 0" "ACK d"
677815-677828 can: eof: "End of frame" "EOF" "E"
677829-677830 can: warnings: "Start of frame (SOF) must be a dominant bit"
677845-677846 can: stuff-bit: "Stuff bit: 1" "SB: 1" "SB"
677831-677854 can: id: "Identifier: 512 (0x200)" "ID: 512 (0x200)" "ID"
677857-677858 can: stuff-bit: "Stuff bit: 1" "SB: 1" "SB"
677859-677860 can: ide: "Identifier extension bit: standard frame" "IDE: standard frame" "IDE"
677861-677862 can: reserved-bit: "Reserved bit 0: 0" "RB0: 0" "RB0"
677855-677856 can: rtr: "Remote transmission request: data frame" "RTR: data frame" "RTR"
677869-677870 can: stuff-bit: "Stuff bit: 1" "SB: 1" "SB"
677863-677872 can: dlc: "Data length code: 0" "DLC: 0" "DLC"
677881-677882 can: stuff-bit: "Stuff bit: 1" "SB: 1" "SB"
677893-677894 can: stuff-bit: "Stuff bit: 1" "SB: 1" "SB"
677873-677906 can: crc-sequence: "CRC sequence: 0x000f" "CRC: 0x000f" "CRC"
677907-677908 can: crc-delimiter: "CRC delimiter: 0" "CRC d: 0" "CRC d"
677909-677910 can: ack-slot: "ACK slot: ACK" "ACK s: ACK" "ACK s"
677911-677912 can: ack-delimiter: "ACK delimiter: 1" "ACK d: 1" "ACK d"
677913-677926 can: eof: "End of frame" "EOF" "E"
677928-677929 can: sof: "Start of frame" "SOF" "S"
677930-677951 can: id: "Identifier: 821 (0x335)" "ID: 821 (0x335)" "ID"
677954-677955 can: ide: "Identifier extension bit: extended frame" "IDE: extended frame" "IDE"
677956-677991 can: ext-id: "Extended Identifier: 262143 (0x3ffff)" "Extended ID: 262143 (0x3ffff)" "Extended ID" "EID"
677956-677991 can: full-id: "Full Identifier: 215482367 (0xcd7ffff)" "Full ID: 215482367 (0xcd7ffff)" "Full ID" "FID"
677952-677953 can: srr: "Substitute remote request: 1" "SRR: 1" "SRR"
677992-677993 can: rtr: "Remote transmission request: remote frame" "RTR: remote frame" "RTR"
677994-677995 can: reserved-bit: "Reserved bit 1: 1" "RB1: 1" "RB1"
677996-677997 can: reserved-bit: "Reserved bit 0: 1" "RB0: 1" "RB0"
677998-678005 can: dlc: "Data length code: 15" "DLC: 15" "DLC"
678006-678021 can: data: "Data byte 0: 0xff" "DB 0: 0xff" "DB"
678022-678037 can: data: "Data byte 1: 0xff" "DB 1: 0xff" "DB"
678038-678053 can: data: "Data byte 2: 0xff" "DB 2: 0xff" "DB"
678054-678069 can: data: "Data byte 3: 0xff" "DB 3: 0xff" "DB"
678070-678085 can: data: "Data byte 4: 0xff" "DB 4: 0xff" "DB"
678086-678101 can: data: "Data byte 5: 0xff" "DB 5: 0xff" "DB"
678102-678117 can: data: "Data byte 6: 0xff" "DB 6: 0xff" "DB"
678118-678133 can: data: "Data byte 7: 0xff" "DB 7: 0xff" "DB"
678134-678149 can: data: "Data byte 8: 0xff" "DB 8: 0xff" "DB"
678150-678165 can: data: "Data byte 9: 0xff" "DB 9: 0xff" "DB"
678166-678181 can: data: "Data byte 10: 0xff" "DB 10: 0xff" "DB"
678182-678197 can: data: "Data byte 11: 0xff" "DB 11: 0xff" "DB"
678198-678213 can: data: "Data byte 12: 0xff" "DB 12: 0xff" "DB"
678214-678229 can: data: "Data byte 13: 0xff" "DB 13: 0xff" "DB"
678230-678245 can: data: "Data byte 14: 0xff" "DB 14: 0xff" "DB"
678246-678275 can: crc-sequence: "CRC sequence: 0x7fff" "CRC: 0x7fff" "CRC"
678276-678277 can: crc-delimiter: "CRC delimiter: 1" "CRC d: 1" "CRC d"
678278-678279 can: ack-slot: "ACK slot: NACK" "ACK s: NACK" "ACK s"
678280-678281 can: ack-delimiter: "ACK delimiter: 1" "ACK d: 1" "ACK d"
678282-678295 can: eof: "End of frame" "EOF" "E"
679188-679189 can: sof: "Start of frame" "SOF" "S"
679208-679209 can: stuff-bit: "Stuff bit: 0" "SB: 0" "SB"
679190-679213 can: id: "Identifier: 1662 (0x67e)" "ID: 1662 (0x67e)" "ID"
679216-679217 can: ide: "Identifier extension bit: extended frame" "IDE: extended frame" "IDE"
679230-679231 can: stuff-bit: "Stuff bit: 1" "SB: 1" "SB"
679246-679247 can: stuff-bit: "Stuff bit: 1" "SB: 1" "SB"
679218-679257 can: ext-id: "Extended Identifier: 132096 (0x20400)" "Extended ID: 132096 (0x20400)" "Extended ID" "EID"
679218-679257 can: full-id: "Full Identifier: 435815424 (0x19fa0400)" "Full ID: 435815424 (0x19fa0400)" "Full ID" "FID"
679214-679215 can: srr: "Substitute remote request: 1" "SRR: 1" "SRR"
679258-679259 can: stuff-bit: "Stuff bit: 1" "SB: 1" "SB"
679260-679261 can: rtr: "Remote transmission request: data frame" "RTR: data frame" "RTR"
679262-679263 can: reserved-bit: "Reserved bit 1: 0" "RB1: 0" "RB1"
679264-679265 can: reserved-bit: "Reserved bit 0: 0" "RB0: 0" "RB0"
679266-679273 can: dlc: "Data length code: 8" "DLC: 8" "DLC"
679278-679279 can: stuff-bit: "Stuff bit: 1" "SB: 1" "SB"
679298-679299 can: stuff-bit: "Stuff bit: 1" "SB: 1" "SB"
679348-679349 can: stuff-bit: "Stuff bit: 0" "SB: 0" "SB"
679396-679397 can: stuff-bit: "Stuff bit: 1" "SB: 1" "SB"
679274-679291 can: data: "Data byte 0: 0x24" "DB 0: 0x24" "DB"
679292-679309 can: data: "Data byte 1: 0x14" "DB 1: 0x14" "DB"
679310-679325 can: data: "Data byte 2: 0x45" "DB 2: 0x45" "DB"
679326-679341 can: data: "Data byte 3: 0x1b" "DB 3: 0x1b" "DB"
679342-679359 can: data: "Data byte 4: 0xfc" "DB 4: 0xfc" "DB"
679360-679375 can: data: "Data byte 5: 0xd1" "DB 5: 0xd1" "DB"
679376-679391 can: data: "Data byte 6: 0x38" "DB 6: 0x38" "DB"
679392-679409 can: data: "Data byte 7: 0x0c" "DB 7: 0x0c" "DB"
679410-679439 can: crc-sequence: "CRC sequence: 0x34e1" "CRC: 0x34e1" "CRC"
679440-679441 can: crc-delimiter: "CRC delimiter: 1" "CRC d: 1" "CRC d"
679442-679443 can: ack-slot: "ACK slot: ACK" "ACK s: ACK" "ACK s"
679444-679445 can: ack-delimiter: "ACK delimiter: 1" "ACK d: 1" "ACK d"
679446-679459 can: eof: "End of frame" "EOF" "E"
680709-680710 can: sof: "Start of frame" "SOF" "S"
680729-680730 can: stuff-bit: "Stuff bit: 0" "SB: 0" "SB"
680711-680734 can: id: "Identifier: 1662 (0x67e)" "ID: 1662 (0x67e)" "ID"
680737-680738 can: ide: "Identifier extension bit: extended frame" "IDE: extended frame" "IDE"
680751-680752 can: stuff-bit: "Stuff bit: 1" "SB: 1" "SB"
680767-680768 can: stuff-bit: "Stuff bit: 1" "SB: 1" "SB"
680739-680778 can: ext-id: "Extended Identifier: 132096 (0x20400)" "Extended ID: 132096 (0x20400)" "Extended ID" "EID"
680739-680778 can: full-id: "Full Identifier: 435815424 (0x19fa0400)" "Full ID: 435815424 (0x19fa0400)" "Full ID" "FID"
680735-680736 can: srr: "Substitute remote request: 1" "SRR: 1" "SRR"
680779-680780 can: stuff-bit: "Stuff bit: 1" "SB: 1" "SB"
680781-680782 can: rtr: "Remote transmission request: data frame" "RTR: data frame" "RTR"
680783-680784 can: reserved-bit: "Reserved bit 1: 0" "RB1: 0" "RB1"
680785-680786 can: reserved-bit: "Reserved bit 0: 0" "RB0: 0" "RB0"
680787-680794 can: dlc: "Data length code: 8" "DLC: 8" "DLC"
680799-680800 can: stuff-bit: "Stuff bit: 1" "SB: 1" "SB"
680835-680836 can: stuff-bit: "Stuff bit: 1" "SB: 1" "SB"
680847-680848 can: stuff-bit: "Stuff bit: 1" "SB: 1" "SB"
680859-680860 can: stuff-bit: "Stuff bit: 1" "SB: 1" "SB"
680871-680872 can: stuff-bit: "Stuff bit: 1" "SB: 1" "SB"
680883-680884 can: stuff-bit: "Stuff bit: 1" "SB: 1" "SB"
680911-680912 can: stuff-bit: "Stuff bit: 1" "SB: 1" "SB"
680795-680812 can: data: "Data byte 0: 0x25" "DB 0: 0x25" "DB"
680813-680828 can: data: "Data byte 1: 0x24" "DB 1: 0x24" "DB"
680829-680846 can: data: "Data byte 2: 0x00" "DB 2: 0x00" "DB"
680849-680866 can: data: "Data byte 3: 0x00" "DB 3: 0x00" "DB"
680867-680886 can: data: "Data byte 4: 0x00" "DB 4: 0x00" "DB"
680887-680902 can: data: "Data byte 5: 0xf2" "DB 5: 0xf2" "DB"
680903-680920 can: data: "Data byte 6: 0x0e" "DB 6: 0x0e" "DB"
680921-680936 can: data: "Data byte 7: 0xb9" "DB 7: 0xb9" "DB"
680937-680966 can: crc-sequence: "CRC sequence: 0x6dcf" "CRC: 0x6dcf" "CRC"
680967-680968 can: crc-delimiter: "CRC delimiter: 1" "CRC d: 1" "CRC d"
680969-680970 can: stuff-bit: "Stuff bit: 0" "SB: 0" "SB"
680971-680972 can: ack-slot: "ACK slot: NACK" "ACK s: NACK" "ACK s"
680973-680974 can: ack-delimiter: "ACK delimiter: 1" "ACK d: 1" "ACK d"
680975-680988 can: eof: "End of frame" "EOF" "E"
682187-682188 can: sof: "Start of frame" "SOF" "S"
682207-682208 can: stuff-bit: "Stuff bit: 0" "SB: 0" "SB"
682189-682212 can: id: "Identifier: 1662 (0x67e)" "ID: 1662 (0x67e)" "ID"
682215-682216 can: ide: "Identifier extension bit: extended frame" "IDE: extended frame" "IDE"
682229-682230 can: stuff-bit: "Stuff bit: 1" "SB: 1" "SB"
682245-682246 can: stuff-bit: "Stuff bit: 1" "SB: 1" "SB"
682217-682256 can: ext-id: "Extended Identifier: 132096 (0x20400)" "Extended ID: 132096 (0x20400)" "Extended ID" "EID"
682217-682256 can: full-id: "Full Identifier: 435815424 (0x19fa0400)" "Full ID: 435815424 (0x19fa0400)" "Full ID" "FID"
682213-682214 can: srr: "Substitute remote request: 1" "SRR: 1" "SRR"
682257-682258 can: stuff-bit: "Stuff bit: 1" "SB: 1" "SB"
682259-682260 can: rtr: "Remote transmission request: data frame" "RTR: data frame" "RTR"
682261-682262 can: reserved-bit: "Reserved bit 1: 0" "RB1: 0" "RB1"
682263-682264 can: reserved-bit: "Reserved bit 0: 0" "RB0: 0" "RB0"
682265-682272 can: dlc: "Data length code: 8" "DLC: 8" "DLC"
682277-682278 can: stuff-bit: "Stuff bit: 1" "SB: 1" "SB"
682315-682316 can: stuff-bit: "Stuff bit: 0" "SB: 0" "SB"
682391-682392 can: stuff-bit: "Stuff bit: 1" "SB: 1" "SB"
682403-682404 can: stuff-bit: "Stuff bit: 1" "SB: 1" "SB"
682273-682290 can: data: "Data byte 0: 0x26" "DB 0: 0x26" "DB"
682291-682306 can: data: "Data byte 1: 0x11" "DB 1: 0x11" "DB"
682307-682324 can: data: "Data byte 2: 0xf3" "DB 2: 0xf3" "DB"
682325-682340 can: data: "Data byte 3: 0x3a" "DB 3: 0x3a" "DB"
682341-682356 can: data: "Data byte 4: 0xda" "DB 4: 0xda" "DB"
682357-682372 can: data: "Data byte 5: 0x1e" "DB 5: 0x1e" "DB"
682373-682388 can: data: "Data byte 6: 0x70" "DB 6: 0x70" "DB"
682389-682408 can: data: "Data byte 7: 0x01" "DB 7: 0x01" "DB"
682419-682420 can: stuff-bit: "Stuff bit: 1" "SB: 1" "SB"
682409-682440 can: crc-sequence: "CRC sequence: 0x0289" "CRC: 0x0289" "CRC"
682441-682442 can: crc-delimiter: "CRC delimiter: 0" "CRC d: 0" "CRC d"
682443-682444 can: ack-slot: "ACK slot: NACK" "ACK s: NACK" "ACK s"
682445-682446 can: ack-delimiter: "ACK delimiter: 1" "ACK d: 1" "ACK d"
682447-682460 can: eof: "End of frame" "EOF" "E"
683688-683689 can: sof: "Start of frame" "SOF" "S"
683708-683709 can: stuff-bit: "Stuff bit: 0" "SB: 0" "SB"
683690-683713 can: id: "Identifier: 1662 (0x67e)" "ID: 1662 (0x67e)" "ID"
683716-683717 can: ide: "Identifier extension bit: extended frame" "IDE: extended frame" "IDE"
683730-683731 can: stuff-bit: "Stuff bit: 1" "SB: 1" "SB"
683746-683747 can: stuff-bit: "Stuff bit: 1" "SB: 1" "SB"
683718-683757 can: ext-id: "Extended Identifier: 132096 (0x20400)" "Extended ID: 132096 (0x20400)" "Extended ID" "EID"
683718-683757 can: full-id: "Full Identifier: 435815424 (0x19fa0400)" "Full ID: 435815424 (0x19fa0400)" "Full ID" "FID"
683714-683715 can: srr: "Substitute remote request: 1" "SRR: 1" "SRR"
683758-683759 can: stuff-bit: "Stuff bit: 1" "SB: 1" "SB"
683760-683761 can: rtr: "Remote transmission request: data frame" "RTR: data frame" "RTR"
683762-683763 can: reserved-bit: "Reserved bit 1: 0" "RB1: 0" "RB1"
683764-683765 can: reserved-bit: "Reserved bit 0: 0" "RB0: 0" "RB0"
683766-683773 can: dlc: "Data length code: 8" "DLC: 8" "DLC"
683778-683779 can: stuff-bit: "Stuff bit: 1" "SB: 1" "SB"
683802-683803 can: stuff-bit: "Stuff bit: 1" "SB: 1" "SB"
683814-683815 can: stuff-bit: "Stuff bit: 1" "SB: 1" "SB"
683826-683827 can: stuff-bit: "Stuff bit: 1" "SB: 1" "SB"
683862-683863 can: stuff-bit: "Stuff bit: 1" "SB: 1" "SB"
683774-683791 can: data: "Data byte 0: 0x27" "DB 0: 0x27" "DB"
683792-683809 can: data: "Data byte 1: 0x00" "DB 1: 0x00" "DB"
683810-683829 can: data: "Data byte 2: 0x00" "DB 2: 0x00" "DB"
683830-683845 can: data: "Data byte 3: 0xf2" "DB 3: 0xf2" "DB"
683846-683861 can: data: "Data byte 4: 0x20" "DB 4: 0x20" "DB"
683864-683879 can: data: "Data byte 5: 0xb9" "DB 5: 0xb9" "DB"
683880-683895 can: data: "Data byte 6: 0x2f" "DB 6: 0x2f" "DB"
683896-683911 can: data: "Data byte 7: 0x13" "DB 7: 0x13" "DB"
683912-683941 can: crc-sequence: "CRC sequence: 0x0971" "CRC: 0x0971" "CRC"
683942-683943 can: crc-delimiter: "CRC delimiter: 1" "CRC d: 1" "CRC d"
683944-683945 can: ack-slot: "ACK slot: ACK" "ACK s: ACK" "ACK s"
683946-683947 can: ack-delimiter: "ACK delimiter: 1" "ACK d: 1" "ACK d"
683948-683961 can: eof: "End of frame" "EOF" "E"
685188-685189 can: sof: "Start of frame" "SOF" "S"
685208-685209 can: stuff-bit: "Stuff bit: 0" "SB: 0" "SB"
685190-685213 can: id: "Identifier: 1662 (0x67e)" "ID: 1662 (0x67e)" "ID"
685216-685217 can: ide: "Identifier extension bit: extended frame" "IDE: extended frame" "IDE"
685230-685231 can: stuff-bit: "Stuff bit: 1" "SB: 1" "SB"
685246-685247 can: stuff-bit: "Stuff bit: 1" "SB: 1" "SB"
685218-685257 can: ext-id: "Extended Identifier: 132097 (0x20401)" "Extended ID: 132097 (0x20401)" "Extended ID" "EID"
685218-685257 can: full-id: "Full Identifier: 435815425 (0x19fa0401)" "Full ID: 435815425 (0x19fa0401)" "Full ID" "FID"
685214-685215 can: srr: "Substitute remote request: 1" "SRR: 1" "SRR"
685258-685259 can: rtr: "Remote transmission request: data frame" "RTR: data frame" "RTR"
685260-685261 can: reserved-bit: "Reserved bit 1: 0" "RB1: 0" "RB1"
685262-685263 can: reserved-bit: "Reserved bit 0: 0" "RB0: 0" "RB0"
685264-685271 can: dlc: "Data length code: 8" "DLC: 8" "DLC"
685276-685277 can: stuff-bit: "Stuff bit: 1" "SB: 1" "SB"
685354-685355 can: stuff-bit: "Stuff bit: 0" "SB: 0" "SB"
685364-685365 can: stuff-bit: "Stuff bit: 1" "SB: 1" "SB"
685376-685377 can: stuff-bit: "Stuff bit: 1" "SB: 1" "SB"
685388-685389 can: stuff-bit: "Stuff bit: 1" "SB: 1" "SB"
685400-685401 can: stuff-bit: "Stuff bit: 1" "SB: 1" "SB"
685272-685289 can: data: "Data byte 0: 0x28" "DB 0: 0x28" "DB"
685290-685305 can: data: "Data byte 1: 0xc7" "DB 1: 0xc7" "DB"
685306-685321 can: data: "Data byte 2: 0x11" "DB 2: 0x11" "DB"
685322-685337 can: data: "Data byte 3: 0x0e" "DB 3: 0x0e" "DB"
685338-685353 can: data: "Data byte 4: 0x1f" "DB 4: 0x1f" "DB"
685356-685373 can: data: "Data byte 5: 0x00" "DB 5: 0x00" "DB"
685374-685393 can: data: "Data byte 6: 0x00" "DB 6: 0x00" "DB"
685394-685411 can: data: "Data byte 7: 0x00" "DB 7: 0x00" "DB"
685412-685413 can: stuff-bit: "Stuff bit: 1" "SB: 1" "SB"
685414-685443 can: crc-sequence: "CRC sequence: 0x6b7a" "CRC: 0x6b7a" "CRC"
685444-685445 can: crc-delimiter: "CRC delimiter: 1" "CRC d: 1" "CRC d"
685446-685447 can: ack-slot: "ACK slot: ACK" "ACK s: ACK" "ACK s"
685448-685449 can: ack-delimiter: "ACK delimiter: 1" "ACK d: 1" "ACK d"
685450-685463 can: eof: "End of frame" "EOF" "E"
686727-686728 can: sof: "Start of frame" "SOF" "S"
686747-686748 can: stuff-bit: "Stuff bit: 0" "SB: 0" "SB"
686729-686752 can: id: "Identifier: 1662 (0x67e)" "ID: 1662 (0x67e)" "ID"
686755-686756 can: ide: "Identifier extension bit: extended frame" "IDE: extended frame" "IDE"
686769-686770 can: stuff-bit: "Stuff bit: 1" "SB: 1" "SB"
686785-686786 can: stuff-bit: "Stuff bit: 1" "SB: 1" "SB"
686757-686796 can: ext-id: "Extended Identifier: 132096 (0x20400)" "Extended ID: 132096 (0x20400)" "Extended ID" "EID"
686757-686796 can: full-id: "Full Identifier: 435815424 (0x19fa0400)" "Full ID: 435815424 (0x19fa0400)" "Full ID" "FID"
686753-686754 can: srr: "Substitute remote request: 1" "SRR: 1" "SRR"
686797-686798 can: stuff-bit: "Stuff bit: 1" "SB: 1" "SB"
686799-686800 can: rtr: "Remote transmission request: data frame" "RTR: data frame" "RTR"
686801-686802 can: reserved-bit: "Reserved bit 1: 0" "RB1: 0" "RB1"
686803-686804 can: reserved-bit: "Reserved bit 0: 0" "RB0: 0" "RB0"
686805-686812 can: dlc: "Data length code: 8" "DLC: 8" "DLC"
686817-686818 can: stuff-bit: "Stuff bit: 1" "SB: 1" "SB"
686839-686840 can: stuff-bit: "Stuff bit: 0" "SB: 0" "SB"
686891-686892 can: stuff-bit: "Stuff bit: 0" "SB: 0" "SB"
686909-686910 can: stuff-bit: "Stuff bit: 1" "SB: 1" "SB"
686921-686922 can: stuff-bit: "Stuff bit: 1" "SB: 1" "SB"
686933-686934 can: stuff-bit: "Stuff bit: 1" "SB: 1" "SB"
686813-686830 can: data: "Data byte 0: 0x29" "DB 0: 0x29" "DB"
686831-686848 can: data: "Data byte 1: 0xf2" "DB 1: 0xf2" "DB"
686849-686864 can: data: "Data byte 2: 0x1e" "DB 2: 0x1e" "DB"
686865-686880 can: data: "Data byte 3: 0x52" "DB 3: 0x52" "DB"
686881-686898 can: data: "Data byte 4: 0xff" "DB 4: 0xff" "DB"
686899-686916 can: data: "Data byte 5: 0x00" "DB 5: 0x00" "DB"
686917-686936 can: data: "Data byte 6: 0x00" "DB 6: 0x00" "DB"
686937-686952 can: data: "Data byte 7: 0x3c" "DB 7: 0x3c" "DB"
686953-686982 can: crc-sequence: "CRC sequence: 0x6d91" "CRC: 0x6d91" "CRC"
686983-686984 can: crc-delimiter: "CRC delimiter: 0" "CRC d: 0" "CRC d"
686985-686986 can: ack-slot: "ACK slot: ACK" "ACK s: ACK" "ACK s"
686987-686988 can: ack-delimiter: "ACK delimiter: 1" "ACK d: 1" "ACK d"
686989-687002 can: eof: "End of frame" "EOF" "E"
688186-688187 can: sof: "Start of frame" "SOF" "S"
688206-688207 can: stuff-bit: "Stuff bit: 0" "SB: 0" "SB"
688188-688211 can: id: "Identifier: 1662 (0x67e)" "ID: 1662 (0x67e)" "ID"
688214-688215 can: ide: "Identifier extension bit: extended frame" "IDE: extended frame" "IDE"
688228-688229 can: stuff-bit: "Stuff bit: 1" "SB: 1" "SB"
688244-688245 can: stuff-bit: "Stuff bit: 1" "SB: 1" "SB"
688216-688255 can: ext-id: "Extended Identifier: 132096 (0x20400)" "Extended ID: 132096 (0x20400)" "Extended ID" "EID"
688216-688255 can: full-id: "Full Identifier: 435815424 (0x19fa0400)" "Full ID: 435815424 (0x19fa0400)" "Full ID" "FID"
688212-688213 can: srr: "Substitute remote request: 1" "SRR: 1" "SRR"
688256-688257 can: stuff-bit: "Stuff bit: 1" "SB: 1" "SB"
688258-688259 can: rtr: "Remote transmission request: data frame" "RTR: data frame" "RTR"
688260-688261 can: reserved-bit: "Reserved bit 1: 0" "RB1: 0" "RB1"
688262-688263 can: reserved-bit: "Reserved bit 0: 0" "RB0: 0" "RB0"
688264-688271 can: dlc: "Data length code: 8" "DLC: 8" "DLC"
688276-688277 can: stuff-bit: "Stuff bit: 1" "SB: 1" "SB"
688298-688299 can: stuff-bit: "Stuff bit: 1" "SB: 1" "SB"
688318-688319 can: stuff-bit: "Stuff bit: 1" "SB: 1" "SB"
688330-688331 can: stuff-bit: "Stuff bit: 1" "SB: 1" "SB"
688342-688343 can: stuff-bit: "Stuff bit: 1" "SB: 1" "SB"
688354-688355 can: stuff-bit: "Stuff bit: 1" "SB: 1" "SB"
688366-688367 can: stuff-bit: "Stuff bit: 1" "SB: 1" "SB"
688378-688379 can: stuff-bit: "Stuff bit: 1" "SB: 1" "SB"
688272-688289 can: data: "Data byte 0: 0x2a" "DB 0: 0x2a" "DB"
688290-688307 can: data: "Data byte 1: 0x0d" "DB 1: 0x0d" "DB"
688308-688325 can: data: "Data byte 2: 0x00" "DB 2: 0x00" "DB"
688326-688345 can: data: "Data byte 3: 0x00" "DB 3: 0x00" "DB"
688346-688363 can: data: "Data byte 4: 0x00" "DB 4: 0x00" "DB"
688364-688383 can: data: "Data byte 5: 0x00" "DB 5: 0x00" "DB"
688384-688399 can: data: "Data byte 6: 0xf1" "DB 6: 0xf1" "DB"
688400-688415 can: data: "Data byte 7: 0x0b" "DB 7: 0x0b" "DB"
688422-688423 can: stuff-bit: "Stuff bit: 0" "SB: 0" "SB"
688416-688447 can: crc-sequence: "CRC sequence: 0x7c4e" "CRC: 0x7c4e" "CRC"
688448-688449 can: crc-delimiter: "CRC delimiter: 1" "CRC d: 1" "CRC d"
688450-688451 can: ack-slot: "ACK slot: ACK" "ACK s: ACK" "ACK s"
688452-688453 can: ack-delimiter: "ACK delimiter: 1" "ACK d: 1" "ACK d"
688454-688467 can: eof: "End of frame" "EOF" "E"
689688-689689 can: sof: "Start of frame" "SOF" "S"
689708-689709 can: stuff-bit: "Stuff bit: 0" "SB: 0" "SB"
689690-689713 can: id: "Identifier: 1662 (0x67e)" "ID: 1662 (0x67e)" "ID"
689716-689717 can: ide: "Identifier extension bit: extended frame" "IDE: extended frame" "IDE"
689730-689731 can: stuff-bit: "Stuff bit: 1" "SB: 1" "SB"
689746-689747 can: stuff-bit: "Stuff bit: 1" "SB: 1" "SB"
689718-689757 can: ext-id: "Extended Identifier: 132096 (0x20400)" "Extended ID: 132096 (0x20400)" "Extended ID" "EID"
689718-689757 can: full-id: "Full Identifier: 435815424 (0x19fa0400)" "Full ID: 435815424 (0x19fa0400)" "Full ID" "FID"
689714-689715 can: srr: "Substitute remote request: 1" "SRR: 1" "SRR"
689758-689759 can: stuff-bit: "Stuff bit: 1" "SB: 1" "SB"
689760-689761 can: rtr: "Remote transmission request: data frame" "RTR: data frame" "RTR"
689762-689763 can: reserved-bit: "Reserved bit 1: 0" "RB1: 0" "RB1"
689764-689765 can: reserved-bit: "Reserved bit 0: 0" "RB0: 0" "RB0"
689766-689773 can: dlc: "Data length code: 8" "DLC: 8" "DLC"
689778-689779 can: stuff-bit: "Stuff bit: 1" "SB: 1" "SB"
689882-689883 can: stuff-bit: "Stuff bit: 0" "SB: 0" "SB"
689900-689901 can: stuff-bit: "Stuff bit: 1" "SB: 1" "SB"
689774-689791 can: data: "Data byte 0: 0x2b" "DB 0: 0x2b" "DB"
689792-689807 can: data: "Data byte 1: 0x17" "DB 1: 0x17" "DB"
689808-689823 can: data: "Data byte 2: 0x0c" "DB 2: 0x0c" "DB"
689824-689839 can: data: "Data byte 3: 0x2b" "DB 3: 0x2b" "DB"
689840-689855 can: data: "Data byte 4: 0x9e" "DB 4: 0x9e" "DB"
689856-689871 can: data: "Data byte 5: 0x9c" "DB 5: 0x9c" "DB"
689872-689889 can: data: "Data byte 6: 0xff" "DB 6: 0xff" "DB"
689890-689907 can: data: "Data byte 7: 0x00" "DB 7: 0x00" "DB"
689934-689935 can: stuff-bit: "Stuff bit: 0" "SB: 0" "SB"
689908-689939 can: crc-sequence: "CRC sequence: 0x787c" "CRC: 0x787c" "CRC"
689940-689941 can: crc-delimiter: "CRC delimiter: 1" "CRC d: 1" "CRC d"
689942-689943 can: ack-slot: "ACK slot: ACK" "ACK s: ACK" "ACK s"
689944-689945 can: ack-delimiter: "ACK delimiter: 1" "ACK d: 1" "ACK d"
689946-689959 can: eof: "End of frame" "EOF" "E"
691187-691188 can: sof: "Start of frame" "SOF" "S"
691207-691208 can: stuff-bit: "Stuff bit: 0" "SB: 0" "SB"
691189-691212 can: id: "Identifier: 1662 (0x67e)" "ID: 1662 (0x67e)" "ID"
691215-691216 can: ide: "Identifier extension bit: extended frame" "IDE: extended frame" "IDE"
691229-691230 can: stuff-bit: "Stuff bit: 1" "SB: 1" "SB"
691245-691246 can: stuff-bit: "Stuff bit: 1" "SB: 1" "SB"
691217-691256 can: ext-id: "Extended Identifier: 132096 (0x20400)" "Extended ID: 132096 (0x20400)" "Extended ID" "EID"
691217-691256 can: full-id: "Full Identifier: 435815424 (0x19fa0400)" "Full ID: 435815424 (0x19fa0400)" "Full ID" "FID"
691213-691214 can: srr: "Substitute remote request: 1" "SRR: 1" "SRR"
691257-691258 can: stuff-bit: "Stuff bit: 1" "SB: 1" "SB"
691259-691260 can: rtr: "Remote transmission request: data frame" "RTR: data frame" "RTR"
691261-691262 can: reserved-bit: "Reserved bit 1: 0" "RB1: 0" "RB1"
691263-691264 can: reserved-bit: "Reserved bit 0: 0" "RB0: 0" "RB0"
691265-691272 can: dlc: "Data length code: 8" "DLC: 8" "DLC"
691277-691278 can: stuff-bit: "Stuff bit: 1" "SB: 1" "SB"
691297-691298 can: stuff-bit: "Stuff bit: 1" "SB: 1" "SB"
691309-691310 can: stuff-bit: "Stuff bit: 1" "SB: 1" "SB"
691321-691322 can: stuff-bit: "Stuff bit: 1" "SB: 1" "SB"
691333-691334 can: stuff-bit: "Stuff bit: 1" "SB: 1" "SB"
691345-691346 can: stuff-bit: "Stuff bit: 1" "SB: 1" "SB"
691367-691368 can: stuff-bit: "Stuff bit: 1" "SB: 1" "SB"
691385-691386 can: stuff-bit: "Stuff bit: 1" "SB: 1" "SB"
691395-691396 can: stuff-bit: "Stuff bit: 0" "SB: 0" "SB"
691273-691290 can: data: "Data byte 0: 0x2c" "DB 0: 0x2c" "DB"
691291-691308 can: data: "Data byte 1: 0x00" "DB 1: 0x00" "DB"
691311-691328 can: data: "Data byte 2: 0x00" "DB 2: 0x00" "DB"
691329-691348 can: data: "Data byte 3: 0x00" "DB 3: 0x00" "DB"
691349-691364 can: data: "Data byte 4: 0xf0" "DB 4: 0xf0" "DB"
691365-691382 can: data: "Data byte 5: 0x10" "DB 5: 0x10" "DB"
691383-691402 can: data: "Data byte 6: 0x7f" "DB 6: 0x7f" "DB"
691403-691418 can: data: "Data byte 7: 0x16" "DB 7: 0x16" "DB"
691419-691448 can: crc-sequence: "CRC sequence: 0x7699" "CRC: 0x7699" "CRC"
691449-691450 can: crc-delimiter: "CRC delimiter: 1" "CRC d: 1" "CRC d"
691451-691452 can: ack-slot: "ACK slot: ACK" "ACK s: ACK" "ACK s"
691453-691454 can: ack-delimiter: "ACK delimiter: 1" "ACK d: 1" "ACK d"
691455-691468 can: eof: "End of frame" "EOF" "E"
692699-692700 can: sof: "Start of frame" "SOF" "S"
692719-692720 can: stuff-bit: "Stuff bit: 0" "SB: 0" "SB"
692701-692724 can: id: "Identifier: 1661 (0x67d)" "ID: 1661 (0x67d)" "ID"
692727-692728 can: ide: "Identifier extension bit: extended frame" "IDE: extended frame" "IDE"
692739-692740 can: stuff-bit: "Stuff bit: 1" "SB: 1" "SB"
692755-692756 can: stuff-bit: "Stuff bit: 1" "SB: 1" "SB"
692767-692768 can: stuff-bit: "Stuff bit: 1" "SB: 1" "SB"
692729-692770 can: ext-id: "Extended Identifier: 2048 (0x800)" "Extended ID: 2048 (0x800)" "Extended ID" "EID"
692729-692770 can: full-id: "Full Identifier: 435423232 (0x19f40800)" "Full ID: 435423232 (0x19f40800)" "Full ID" "FID"
692725-692726 can: srr: "Substitute remote request: 1" "SRR: 1" "SRR"
692771-692772 can: rtr: "Remote transmission request: data frame" "RTR: data frame" "RTR"
692773-692774 can: reserved-bit: "Reserved bit 1: 0" "RB1: 0" "RB1"
692775-692776 can: reserved-bit: "Reserved bit 0: 1" "RB0: 1" "RB0"
692777-692784 can: dlc: "Data length code: 0" "DLC: 0" "DLC"
692787-692788 can: stuff-bit: "Stuff bit: 1" "SB: 1" "SB"
692785-692816 can: crc-sequence: "CRC sequence: 0x2d43" "CRC: 0x2d43" "CRC"
692817-692818 can: crc-delimiter: "CRC delimiter: 0" "CRC d: 0" "CRC d"
692819-692820 can: ack-slot: "ACK slot: NACK" "ACK s: NACK" "ACK s"
692821-692822 can: ack-delimiter: "ACK delimiter: 1" "ACK d: 1" "ACK d"
692823-692836 can: eof: "End of frame" "EOF" "E"
692837-692838 can: sof: "Start of frame" "SOF" "S"
692859-692860 can: stuff-bit: "Stuff bit: 0" "SB: 0" "SB"
692839-692862 can: id: "Identifier: 1855 (0x73f)" "ID: 1855 (0x73f)" "ID"
692865-692866 can: ide: "Identifier extension bit: extended frame" "IDE: extended frame" "IDE"
692877-692878 can: stuff-bit: "Stuff bit: 1" "SB: 1" "SB"
692889-692890 can: stuff-bit: "Stuff bit: 1" "SB: 1" "SB"
692901-692902 can: stuff-bit: "Stuff bit: 1" "SB: 1" "SB"
692867-692908 can: ext-id: "Extended Identifier: 0 (0x0)" "Extended ID: 0 (0x0)" "Extended ID" "EID"
692867-692908 can: full-id: "Full Identifier: 486277120 (0x1cfc0000)" "Full ID: 486277120 (0x1cfc0000)" "Full ID" "FID"
692863-692864 can: srr: "Substitute remote request: 1" "SRR: 1" "SRR"
692909-692910 can: rtr: "Remote transmission request: data frame" "RTR: data frame" "RTR"
692911-692912 can: reserved-bit: "Reserved bit 1: 0" "RB1: 0" "RB1"
692913-692914 can: stuff-bit: "Stuff bit: 1" "SB: 1" "SB"
692915-692916 can: reserved-bit: "Reserved bit 0: 0" "RB0: 0" "RB0"
692917-692924 can: dlc: "Data length code: 1" "DLC: 1" "DLC"
692925-692940 can: data: "Data byte 0: 0x92" "DB 0: 0x92" "DB"
692941-692970 can: crc-sequence: "CRC sequence: 0x397f" "CRC: 0x397f" "CRC"
692971-692972 can: crc-delimiter: "CRC delimiter: 1" "CRC d: 1" "CRC d"
692973-692974 can: ack-slot: "ACK slot: NACK" "ACK s: NACK" "ACK s"
692975-692976 can: ack-delimiter: "ACK delimiter: 1" "ACK d: 1" "ACK d"
692977-692990 can: eof: "End of frame" "EOF" "E"
694188-694189 can: sof: "Start of frame" "SOF" "S"
694208-694209 can: stuff-bit: "Stuff bit: 0" "SB: 0" "SB"
694190-694213 can: id: "Identifier: 1662 (0x67e)" "ID: 1662 (0x67e)" "ID"
694216-694217 can: ide: "Identifier extension bit: extended frame" "IDE: extended frame" "IDE"
694230-694231 can: stuff-bit: "Stuff bit: 1" "SB: 1" "SB"
694246-694247 can: stuff-bit: "Stuff bit: 1" "SB: 1" "SB"
694218-694257 can: ext-id: "Extended Identifier: 132096 (0x20400)" "Extended ID: 132096 (0x20400)" "Extended ID" "EID"
694218-694257 can: full-id: "Full Identifier: 435815424 (0x19fa0400)" "Full ID: 435815424 (0x19fa0400)" "Full ID" "FID"
694214-694215 can: srr: "Substitute remote request: 1" "SRR: 1" "SRR"
694258-694259 can: stuff-bit: "Stuff bit: 1" "SB: 1" "SB"
694260-694261 can: rtr: "Remote transmission request: data frame" "RTR: data frame" "RTR"
694262-694263 can: reserved-bit: "Reserved bit 1: 0" "RB1: 0" "RB1"
694264-694265 can: reserved-bit: "Reserved bit 0: 0" "RB0: 0" "RB0"
694266-694273 can: dlc: "Data length code: 8" "DLC: 8" "DLC"
694278-694279 can: stuff-bit: "Stuff bit: 1" "SB: 1" "SB"
694300-694301 can: stuff-bit: "Stuff bit: 1" "SB: 1" "SB"
694328-694329 can: stuff-bit: "Stuff bit: 1" "SB: 1" "SB"
694364-694365 can: stuff-bit: "Stuff bit: 1" "SB: 1" "SB"
694274-694291 can: data: "Data byte 0: 0x2e" "DB 0: 0x2e" "DB"
694292-694309 can: data: "Data byte 1: 0x00" "DB 1: 0x00" "DB"
694310-694325 can: data: "Data byte 2: 0xf0" "DB 2: 0xf0" "DB"
694326-694343 can: data: "Data byte 3: 0x16" "DB 3: 0x16" "DB"
694344-694359 can: data: "Data byte 4: 0x68" "DB 4: 0x68" "DB"
694360-694377 can: data: "Data byte 5: 0x03" "DB 5: 0x03" "DB"
694378-694393 can: data: "Data byte 6: 0x38" "DB 6: 0x38" "DB"
694394-694409 can: data: "Data byte 7: 0x64" "DB 7: 0x64" "DB"
694416-694417 can: stuff-bit: "Stuff bit: 1" "SB: 1" "SB"
694436-694437 can: stuff-bit: "Stuff bit: 0" "SB: 0" "SB"
694410-694443 can: crc-sequence: "CRC sequence: 0x08f9" "CRC: 0x08f9" "CRC"
694444-694445 can: crc-delimiter: "CRC delimiter: 1" "CRC d: 1" "CRC d"
694446-694447 can: ack-slot: "ACK slot: ACK" "ACK s: ACK" "ACK s"
694448-694449 can: ack-delimiter: "ACK delimiter: 1" "ACK d: 1" "ACK d"
694450-694463 can: eof: "End of frame" "EOF" "E"
695687-695688 can: sof: "Start of frame" "SOF" "S"
695707-695708 can: stuff-bit: "Stuff bit: 0" "SB: 0" "SB"
695689-695712 can: id: "Identifier: 1662 (0x67e)" "ID: 1662 (0x67e)" "ID"
695715-695716 can: ide: "Identifier extension bit: extended frame" "IDE: extended frame" "IDE"
695729-695730 can: stuff-bit: "Stuff bit: 1" "SB: 1" "SB"
695745-695746 can: stuff-bit: "Stuff bit: 1" "SB: 1" "SB"
695717-695756 can: ext-id: "Extended Identifier: 132096 (0x20400)" "Extended ID: 132096 (0x20400)" "Extended ID" "EID"
695717-695756 can: full-id: "Full Identifier: 435815424 (0x19fa0400)" "Full ID: 435815424 (0x19fa0400)" "Full ID" "FID"
695713-695714 can: srr: "Substitute remote request: 1" "SRR: 1" "SRR"
695757-695758 can: stuff-bit: "Stuff bit: 1" "SB: 1" "SB"
695759-695760 can: rtr: "Remote transmission request: data frame" "RTR: data frame" "RTR"
695761-695762 can: reserved-bit: "Reserved bit 1: 0" "RB1: 0" "RB1"
695763-695764 can: reserved-bit: "Reserved bit 0: 0" "RB0: 0" "RB0"
695765-695772 can: dlc: "Data length code: 8" "DLC: 8" "DLC"
695777-695778 can: stuff-bit: "Stuff bit: 1" "SB: 1" "SB"
695793-695794 can: stuff-bit: "Stuff bit: 0" "SB: 0" "SB"
695819-695820 can: stuff-bit: "Stuff bit: 0" "SB: 0" "SB"
695837-695838 can: stuff-bit: "Stuff bit: 1" "SB: 1" "SB"
695849-695850 can: stuff-bit: "Stuff bit: 1" "SB: 1" "SB"
695861-695862 can: stuff-bit: "Stuff bit: 1" "SB: 1" "SB"
695873-695874 can: stuff-bit: "Stuff bit: 1" "SB: 1" "SB"
695885-695886 can: stuff-bit: "Stuff bit: 1" "SB: 1" "SB"
695897-695898 can: stuff-bit: "Stuff bit: 1" "SB: 1" "SB"
695773-695790 can: data: "Data byte 0: 0x2f" "DB 0: 0x2f" "DB"
695791-695808 can: data: "Data byte 1: 0x9c" "DB 1: 0x9c" "DB"
695809-695826 can: data: "Data byte 2: 0xff" "DB 2: 0xff" "DB"
695827-695844 can: data: "Data byte 3: 0x00" "DB 3: 0x00" "DB"
695845-695864 can: data: "Data byte 4: 0x00" "DB 4: 0x00" "DB"
695865-695882 can: data: "Data byte 5: 0x00" "DB 5: 0x00" "DB"
695883-695902 can: data: "Data byte 6: 0x00" "DB 6: 0x00" "DB"
695903-695918 can: data: "Data byte 7: 0xf0" "DB 7: 0xf0" "DB"
695937-695938 can: stuff-bit: "Stuff bit: 0" "SB: 0" "SB"
695919-695950 can: crc-sequence: "CRC sequence: 0x67e9" "CRC: 0x67e9" "CRC"
695951-695952 can: crc-delimiter: "CRC delimiter: 1" "CRC d: 1" "CRC d"
695953-695954 can: ack-slot: "ACK slot: ACK" "ACK s: ACK" "ACK s"
695955-695956 can: ack-delimiter: "ACK delimiter: 1" "ACK d: 1" "ACK d"
695957-695970 can: eof: "End of frame" "EOF" "E"
697187-697188 can: sof: "Start of frame" "SOF" "S"
697207-697208 can: stuff-bit: "Stuff bit: 0" "SB: 0" "SB"
697189-697212 can: id: "Identifier: 1662 (0x67e)" "ID: 1662 (0x67e)" "ID"
697215-697216 can: ide: "Identifier extension bit: extended frame" "IDE: extended frame" "IDE"
697229-697230 can: stuff-bit: "Stuff bit: 1" "SB: 1" "SB"
697245-697246 can: stuff-bit: "Stuff bit: 1" "SB: 1" "SB"
697217-697256 can: ext-id: "Extended Identifier: 132096 (0x20400)" "Extended ID: 132096 (0x20400)" "Extended ID" "EID"
697217-697256 can: full-id: "Full Identifier: 435815424 (0x19fa0400)" "Full ID: 435815424 (0x19fa0400)" "Full ID" "FID"
697213-697214 can: srr: "Substitute remote request: 1" "SRR: 1" "SRR"
697257-697258 can: stuff-bit: "Stuff bit: 1" "SB: 1" "SB"
697259-697260 can: rtr: "Remote transmission request: data frame" "RTR: data frame" "RTR"
697261-697262 can: reserved-bit: "Reserved bit 1: 0" "RB1: 0" "RB1"
697263-697264 can: reserved-bit: "Reserved bit 0: 0" "RB0: 0" "RB0"
697265-697272 can: dlc: "Data length code: 8" "DLC: 8" "DLC"
697277-697278 can: stuff-bit: "Stuff bit: 1" "SB: 1" "SB"
697293-697294 can: stuff-bit: "Stuff bit: 1" "SB: 1" "SB"
697313-697314 can: stuff-bit: "Stuff bit: 0" "SB: 0" "SB"
697331-697332 can: stuff-bit: "Stuff bit: 1" "SB: 1" "SB"
697401-697402 can: stuff-bit: "Stuff bit: 0" "SB: 0" "SB"
697273-697290 can: data: "Data byte 0: 0x30" "DB 0: 0x30" "DB"
697291-697308 can: data: "Data byte 1: 0x17" "DB 1: 0x17" "DB"
697309-697326 can: data: "Data byte 2: 0xe8" "DB 2: 0xe8" "DB"
697327-697344 can: data: "Data byte 3: 0x0a" "DB 3: 0x0a" "DB"
697345-697360 can: data: "Data byte 4: 0x2a" "DB 4: 0x2a" "DB"
697361-697376 can: data: "Data byte 5: 0x97" "DB 5: 0x97" "DB"
697377-697392 can: data: "Data byte 6: 0x39" "DB 6: 0x39" "DB"
697393-697410 can: data: "Data byte 7: 0xfe" "DB 7: 0xfe" "DB"
697411-697440 can: crc-sequence: "CRC sequence: 0x4771" "CRC: 0x4771" "CRC"
697441-697442 can: crc-delimiter: "CRC delimiter: 0" "CRC d: 0" "CRC d"
697443-697444 can: ack-slot: "ACK slot: ACK" "ACK s: ACK" "ACK s"
697445-697446 can: ack-delimiter: "ACK delimiter: 1" "ACK d: 1" "ACK d"
697447-697460 can: eof: "End of frame" "EOF" "E"
698726-698727 can: sof: "Start of frame" "SOF" "S"
698746-698747 can: stuff-bit: "Stuff bit: 0" "SB: 0" "SB"
698728-698751 can: id: "Identifier: 1662 (0x67e)" "ID: 1662 (0x67e)" "ID"
698754-698755 can: ide: "Identifier extension bit: extended frame" "IDE: extended frame" "IDE"
698768-698769 can: stuff-bit: "Stuff bit: 1" "SB: 1" "SB"
698784-698785 can: stuff-bit: "Stuff bit: 1" "SB: 1" "SB"
698756-698795 can: ext-id: "Extended Identifier: 132096 (0x20400)" "Extended ID: 132096 (0x20400)" "Extended ID" "EID"
698756-698795 can: full-id: "Full Identifier: 435815424 (0x19fa0400)" "Full ID: 435815424 (0x19fa0400)" "Full ID" "FID"
698752-698753 can: srr: "Substitute remote request: 1" "SRR: 1" "SRR"
698796-698797 can: stuff-bit: "Stuff bit: 1" "SB: 1" "SB"
698798-698799 can: rtr: "Remote transmission request: data frame" "RTR: data frame" "RTR"
698800-698801 can: reserved-bit: "Reserved bit 1: 0" "RB1: 0" "RB1"
698802-698803 can: reserved-bit: "Reserved bit 0: 0" "RB0: 0" "RB0"
698804-698811 can: dlc: "Data length code: 8" "DLC: 8" "DLC"
698816-698817 can: stuff-bit: "Stuff bit: 1" "SB: 1" "SB"
698840-698841 can: stuff-bit: "Stuff bit: 1" "SB: 1" "SB"
698852-698853 can: stuff-bit: "Stuff bit: 1" "SB: 1" "SB"
698864-698865 can: stuff-bit: "Stuff bit: 1" "SB: 1" "SB"
698876-698877 can: stuff-bit: "Stuff bit: 1" "SB: 1" "SB"
698888-698889 can: stuff-bit: "Stuff bit: 1" "SB: 1" "SB"
698900-698901 can: stuff-bit: "Stuff bit: 1" "SB: 1" "SB"
698924-698925 can: stuff-bit: "Stuff bit: 1" "SB: 1" "SB"
698812-698829 can: data: "Data byte 0: 0x31" "DB 0: 0x31" "DB"
698830-698847 can: data: "Data byte 1: 0x00" "DB 1: 0x00" "DB"
698848-698867 can: data: "Data byte 2: 0x00" "DB 2: 0x00" "DB"
698868-698885 can: data: "Data byte 3: 0x00" "DB 3: 0x00" "DB"
698886-698905 can: data: "Data byte 4: 0x00" "DB 4: 0x00" "DB"
698906-698921 can: data: "Data byte 5: 0xf0" "DB 5: 0xf0" "DB"
698922-698939 can: data: "Data byte 6: 0x19" "DB 6: 0x19" "DB"
698940-698955 can: data: "Data byte 7: 0xc5" "DB 7: 0xc5" "DB"
698966-698967 can: stuff-bit: "Stuff bit: 1" "SB: 1" "SB"
698956-698987 can: crc-sequence: "CRC sequence: 0x03ba" "CRC: 0x03ba" "CRC"
698988-698989 can: crc-delimiter: "CRC delimiter: 1" "CRC d: 1" "CRC d"
698990-698991 can: ack-slot: "ACK slot: ACK" "ACK s: ACK" "ACK s"
698992-698993 can: ack-delimiter: "ACK delimiter: 1" "ACK d: 1" "ACK d"
698994-699007 can: eof: "End of frame" "EOF" "E"
700188-700189 can: sof: "Start of frame" "SOF" "S"
700206-700207 can: stuff-bit: "Stuff bit: 0" "SB: 0" "SB"
700190-700213 can: id: "Identifier: 1789 (0x6fd)" "ID: 1789 (0x6fd)" "ID"
700216-700217 can: ide: "Identifier extension bit: extended frame" "IDE: extended frame" "IDE"
700228-700229 can: stuff-bit: "Stuff bit: 1" "SB: 1" "SB"
700244-700245 can: stuff-bit: "Stuff bit: 1" "SB: 1" "SB"
700256-700257 can: stuff-bit: "Stuff bit: 1" "SB: 1" "SB"
700218-700259 can: ext-id: "Extended Identifier: 2048 (0x800)" "Extended ID: 2048 (0x800)" "Extended ID" "EID"
700218-700259 can: full-id: "Full Identifier: 468977664 (0x1bf40800)" "Full ID: 468977664 (0x1bf40800)" "Full ID" "FID"
700214-700215 can: srr: "Substitute remote request: 1" "SRR: 1" "SRR"
700260-700261 can: rtr: "Remote transmission request: data frame" "RTR: data frame" "RTR"
700262-700263 can: reserved-bit: "Reserved bit 1: 0" "RB1: 0" "RB1"
700264-700265 can: reserved-bit: "Reserved bit 0: 1" "RB0: 1" "RB0"
700266-700273 can: dlc: "Data length code: 0" "DLC: 0" "DLC"
700276-700277 can: stuff-bit: "Stuff bit: 1" "SB: 1" "SB"
700298-700299 can: stuff-bit: "Stuff bit: 1" "SB: 1" "SB"
700274-700307 can: crc-sequence: "CRC sequence: 0x3204" "CRC: 0x3204" "CRC"
700308-700309 can: crc-delimiter: "CRC delimiter: 1" "CRC d: 1" "CRC d"
700310-700311 can: ack-slot: "ACK slot: ACK" "ACK s: ACK" "ACK s"
700312-700313 can: ack-delimiter: "ACK delimiter: 0" "ACK d: 0" "ACK d"
700314-700327 can: eof: "End of frame" "EOF" "E"
700328-700329 can: sof: "Start of frame" "SOF" "S"
700330-700351 can: id: "Identifier: 1575 (0x627)" "ID: 1575 (0x627)" "ID"
700354-700355 can: ide: "Identifier extension bit: standard frame" "IDE: standard frame" "IDE"
700356-700357 can: reserved-bit: "Reserved bit 0: 1" "RB0: 1" "RB0"
700352-700353 can: rtr: "Remote transmission request: data frame" "RTR: data frame" "RTR"
700358-700365 can: dlc: "Data length code: 15" "DLC: 15" "DLC"
700366-700367 can: stuff-bit: "Stuff bit: 0" "SB: 0" "SB"
700398-700399 can: stuff-bit: "Stuff bit: 1" "SB: 1" "SB"
700410-700411 can: stuff-bit: "Stuff bit: 1" "SB: 1" "SB"
700442-700443 can: stuff-bit: "Stuff bit: 0" "SB: 0" "SB"
700368-700383 can: data: "Data byte 0: 0xe5" "DB 0: 0xe5" "DB"
700384-700401 can: data: "Data byte 1: 0x40" "DB 1: 0x40" "DB"
700402-700419 can: data: "Data byte 2: 0x05" "DB 2: 0x05" "DB"
700420-700435 can: data: "Data byte 3: 0x4b" "DB 3: 0x4b" "DB"
700436-700453 can: data: "Data byte 4: 0xff" "DB 4: 0xff" "DB"
700454-700469 can: data: "Data byte 5: 0xff" "DB 5: 0xff" "DB"
700470-700485 can: data: "Data byte 6: 0xff" "DB 6: 0xff" "DB"
700486-700501 can: data: "Data byte 7: 0xff" "DB 7: 0xff" "DB"
700502-700517 can: data: "Data byte 8: 0xff" "DB 8: 0xff" "DB"
700518-700533 can: data: "Data byte 9: 0xff" "DB 9: 0xff" "DB"
700534-700549 can: data: "Data byte 10: 0xff" "DB 10: 0xff" "DB"
700550-700565 can: data: "Data byte 11: 0xff" "DB 11: 0xff" "DB"
700566-700581 can: data: "Data byte 12: 0xff" "DB 12: 0xff" "DB"
700582-700597 can: data: "Data byte 13: 0xff" "DB 13: 0xff" "DB"
700598-700613 can: data: "Data byte 14: 0xff" "DB 14: 0xff" "DB"
700614-700643 can: crc-sequence: "CRC sequence: 0x7fff" "CRC: 0x7fff" "CRC"
700644-700645 can: crc-delimiter: "CRC delimiter: 1" "CRC d: 1" "CRC d"
700646-700647 can: ack-slot: "ACK slot: NACK" "ACK s: NACK" "ACK s"
700648-700649 can: ack-delimiter: "ACK delimiter: 1" "ACK d: 1" "ACK d"
700650-700663 can: eof: "End of frame" "EOF" "E"
701687-701688 can: sof: "Start of frame" "SOF" "S"
701707-701708 can: stuff-bit: "Stuff bit: 0" "SB: 0" "SB"
701689-701712 can: id: "Identifier: 1662 (0x67e)" "ID: 1662 (0x67e)" "ID"
701715-701716 can: ide: "Identifier extension bit: extended frame" "IDE: extended frame" "IDE"
701729-701730 can: stuff-bit: "Stuff bit: 1" "SB: 1" "SB"
701745-701746 can: stuff-bit: "Stuff bit: 1" "SB: 1" "SB"
701717-701756 can: ext-id: "Extended Identifier: 132096 (0x20400)" "Extended ID: 132096 (0x20400)" "Extended ID" "EID"
701717-701756 can: full-id: "Full Identifier: 435815424 (0x19fa0400)" "Full ID: 435815424 (0x19fa0400)" "Full ID" "FID"
701713-701714 can: srr: "Substitute remote request: 1" "SRR: 1" "SRR"
701757-701758 can: stuff-bit: "Stuff bit: 1" "SB: 1" "SB"
701759-701760 can: rtr: "Remote transmission request: data frame" "RTR: data frame" "RTR"
701761-701762 can: reserved-bit: "Reserved bit 1: 0" "RB1: 0" "RB1"
701763-701764 can: reserved-bit: "Reserved bit 0: 0" "RB0: 0" "RB0"
701765-701772 can: dlc: "Data length code: 8" "DLC: 8" "DLC"
701777-701778 can: stuff-bit: "Stuff bit: 1" "SB: 1" "SB"
701801-701802 can: stuff-bit: "Stuff bit: 1" "SB: 1" "SB"
701813-701814 can: stuff-bit: "Stuff bit: 1" "SB: 1" "SB"
701825-701826 can: stuff-bit: "Stuff bit: 1" "SB: 1" "SB"
701855-701856 can: stuff-bit: "Stuff bit: 0" "SB: 0" "SB"
701867-701868 can: stuff-bit: "Stuff bit: 0" "SB: 0" "SB"
701879-701880 can: stuff-bit: "Stuff bit: 0" "SB: 0" "SB"
701891-701892 can: stuff-bit: "Stuff bit: 0" "SB: 0" "SB"
701903-701904 can: stuff-bit: "Stuff bit: 0" "SB: 0" "SB"
701915-701916 can: stuff-bit: "Stuff bit: 0" "SB: 0" "SB"
701773-701790 can: data: "Data byte 0: 0x33" "DB 0: 0x33" "DB"
701791-701808 can: data: "Data byte 1: 0x00" "DB 1: 0x00" "DB"
701809-701828 can: data: "Data byte 2: 0x00" "DB 2: 0x00" "DB"
701829-701844 can: data: "Data byte 3: 0xf0" "DB 3: 0xf0" "DB"
701845-701862 can: data: "Data byte 4: 0xff" "DB 4: 0xff" "DB"
701863-701882 can: data: "Data byte 5: 0xff" "DB 5: 0xff" "DB"
701883-701900 can: data: "Data byte 6: 0xff" "DB 6: 0xff" "DB"
701901-701920 can: data: "Data byte 7: 0xff" "DB 7: 0xff" "DB"
701921-701950 can: crc-sequence: "CRC sequence: 0x238f" "CRC: 0x238f" "CRC"
701951-701952 can: crc-delimiter: "CRC delimiter: 1" "CRC d: 1" "CRC d"
701953-701954 can: stuff-bit: "Stuff bit: 0" "SB: 0" "SB"
701955-701956 can: ack-slot: "ACK slot: NACK" "ACK s: NACK" "ACK s"
701957-701958 can: ack-delimiter: "ACK delimiter: 1" "ACK d: 1" "ACK d"
701959-701972 can: eof: "End of frame" "EOF" "E"
703186-703187 can: sof: "Start of frame" "SOF" "S"
703206-703207 can: stuff-bit: "Stuff bit: 0" "SB: 0" "SB"
703188-703211 can: id: "Identifier: 894 (0x37e)" "ID: 894 (0x37e)" "ID"
703214-703215 can: ide: "Identifier extension bit: extended frame" "IDE: extended frame" "IDE"
703226-703227 can: stuff-bit: "Stuff bit: 1" "SB: 1" "SB"
703248-703249 can: stuff-bit: "Stuff bit: 1" "SB: 1" "SB"
703216-703255 can: ext-id: "Extended Identifier: 1280 (0x500)" "Extended ID: 1280 (0x500)" "Extended ID" "EID"
703216-703255 can: full-id: "Full Identifier: 234358016 (0xdf80500)" "Full ID: 234358016 (0xdf80500)" "Full ID" "FID"
703212-703213 can: srr: "Substitute remote request: 1" "SRR: 1" "SRR"
703256-703257 can: rtr: "Remote transmission request: data frame" "RTR: data frame" "RTR"
703258-703259 can: reserved-bit: "Reserved bit 1: 0" "RB1: 0" "RB1"
703260-703261 can: stuff-bit: "Stuff bit: 1" "SB: 1" "SB"
703262-703263 can: reserved-bit: "Reserved bit 0: 0" "RB0: 0" "RB0"
703264-703271 can: dlc: "Data length code: 8" "DLC: 8" "DLC"
703276-703277 can: stuff-bit: "Stuff bit: 1" "SB: 1" "SB"
703290-703291 can: stuff-bit: "Stuff bit: 1" "SB: 1" "SB"
703344-703345 can: stuff-bit: "Stuff bit: 1" "SB: 1" "SB"
703354-703355 can: stuff-bit: "Stuff bit: 0" "SB: 0" "SB"
703378-703379 can: stuff-bit: "Stuff bit: 1" "SB: 1" "SB"
703402-703403 can: stuff-bit: "Stuff bit: 1" "SB: 1" "SB"
703272-703289 can: data: "Data byte 0: 0x20" "DB 0: 0x20" "DB"
703292-703307 can: data: "Data byte 1: 0x2f" "DB 1: 0x2f" "DB"
703308-703323 can: data: "Data byte 2: 0x29" "DB 2: 0x29" "DB"
703324-703339 can: data: "Data byte 3: 0x18" "DB 3: 0x18" "DB"
703340-703359 can: data: "Data byte 4: 0x3e" "DB 4: 0x3e" "DB"
703360-703375 can: data: "Data byte 5: 0xb0" "DB 5: 0xb0" "DB"
703376-703393 can: data: "Data byte 6: 0x16" "DB 6: 0x16" "DB"
703394-703411 can: data: "Data byte 7: 0x04" "DB 7: 0x04" "DB"
703412-703441 can: crc-sequence: "CRC sequence: 0x7625" "CRC: 0x7625" "CRC"
703442-703443 can: crc-delimiter: "CRC delimiter: 1" "CRC d: 1" "CRC d"
703444-703445 can: ack-slot: "ACK slot: ACK" "ACK s: ACK" "ACK s"
703446-703447 can: ack-delimiter: "ACK delimiter: 1" "ACK d: 1" "ACK d"
703448-703461 can: eof: "End of frame" "EOF" "E"
704738-704739 can: sof: "Start of frame" "SOF" "S"
704758-704759 can: stuff-bit: "Stuff bit: 0" "SB: 0" "SB"
704740-704763 can: id: "Identifier: 894 (0x37e)" "ID: 894 (0x37e)" "ID"
704766-704767 can: ide: "Identifier extension bit: extended frame" "IDE: extended frame" "IDE"
704778-704779 can: stuff-bit: "Stuff bit: 1" "SB: 1" "SB"
704800-704801 can: stuff-bit: "Stuff bit: 1" "SB: 1" "SB"
704768-704807 can: ext-id: "Extended Identifier: 1280 (0x500)" "Extended ID: 1280 (0x500)" "Extended ID" "EID"
704768-704807 can: full-id: "Full Identifier: 234358016 (0xdf80500)" "Full ID: 234358016 (0xdf80500)" "Full ID" "FID"
704764-704765 can: srr: "Substitute remote request: 1" "SRR: 1" "SRR"
704808-704809 can: rtr: "Remote transmission request: data frame" "RTR: data frame" "RTR"
704810-704811 can: reserved-bit: "Reserved bit 1: 0" "RB1: 0" "RB1"
704812-704813 can: stuff-bit: "Stuff bit: 1" "SB: 1" "SB"
704814-704815 can: reserved-bit: "Reserved bit 0: 0" "RB0: 0" "RB0"
704816-704823 can: dlc: "Data length code: 8" "DLC: 8" "DLC"
704828-704829 can: stuff-bit: "Stuff bit: 1" "SB: 1" "SB"
704870-704871 can: stuff-bit: "Stuff bit: 1" "SB: 1" "SB"
704906-704907 can: stuff-bit: "Stuff bit: 0" "SB: 0" "SB"
704824-704841 can: data: "Data byte 0: 0x22" "DB 0: 0x22" "DB"
704842-704857 can: data: "Data byte 1: 0x39" "DB 1: 0x39" "DB"
704858-704875 can: data: "Data byte 2: 0x80" "DB 2: 0x80" "DB"
704876-704891 can: data: "Data byte 3: 0xda" "DB 3: 0xda" "DB"
704892-704909 can: data: "Data byte 4: 0xbf" "DB 4: 0xbf" "DB"
704910-704925 can: data: "Data byte 5: 0x2e" "DB 5: 0x2e" "DB"
704926-704941 can: data: "Data byte 6: 0x7b" "DB 6: 0x7b" "DB"
704942-704957 can: data: "Data byte 7: 0x09" "DB 7: 0x09" "DB"
704958-704987 can: crc-sequence: "CRC sequence: 0x2f55" "CRC: 0x2f55" "CRC"
704988-704989 can: crc-delimiter: "CRC delimiter: 0" "CRC d: 0" "CRC d"
704990-704991 can: ack-slot: "ACK slot: NACK" "ACK s: NACK" "ACK s"
704992-704993 can: ack-delimiter: "ACK delimiter: 1" "ACK d: 1" "ACK d"
704994-705007 can: eof: "End of frame" "EOF" "E"
706187-706188 can: sof: "Start of frame" "SOF" "S"
706207-706208 can: stuff-bit: "Stuff bit: 0" "SB: 0" "SB"
706189-706212 can: id: "Identifier: 894 (0x37e)" "ID: 894 (0x37e)" "ID"
706215-706216 can: ide: "Identifier extension bit: extended frame" "IDE: extended frame" "IDE"
706227-706228 can: stuff-bit: "Stuff bit: 1" "SB: 1" "SB"
706249-706250 can: stuff-bit: "Stuff bit: 1" "SB: 1" "SB"
706217-706256 can: ext-id: "Extended Identifier: 1280 (0x500)" "Extended ID: 1280 (0x500)" "Extended ID" "EID"
706217-706256 can: full-id: "Full Identifier: 234358016 (0xdf80500)" "Full ID: 234358016 (0xdf80500)" "Full ID" "FID"
706213-706214 can: srr: "Substitute remote request: 1" "SRR: 1" "SRR"
706257-706258 can: rtr: "Remote transmission request: data frame" "RTR: data frame" "RTR"
706259-706260 can: reserved-bit: "Reserved bit 1: 0" "RB1: 0" "RB1"
706261-706262 can: stuff-bit: "Stuff bit: 1" "SB: 1" "SB"
706263-706264 can: reserved-bit: "Reserved bit 0: 0" "RB0: 0" "RB0"
706265-706272 can: dlc: "Data length code: 8" "DLC: 8" "DLC"
706277-706278 can: stuff-bit: "Stuff bit: 1" "SB: 1" "SB"
706315-706316 can: stuff-bit: "Stuff bit: 1" "SB: 1" "SB"
706331-706332 can: stuff-bit: "Stuff bit: 1" "SB: 1" "SB"
706343-706344 can: stuff-bit: "Stuff bit: 1" "SB: 1" "SB"
706375-706376 can: stuff-bit: "Stuff bit: 0" "SB: 0" "SB"
706385-706386 can: stuff-bit: "Stuff bit: 1" "SB: 1" "SB"
706399-706400 can: stuff-bit: "Stuff bit: 0" "SB: 0" "SB"
706273-706290 can: data: "Data byte 0: 0x22" "DB 0: 0x22" "DB"
706291-706306 can: data: "Data byte 1: 0x9a" "DB 1: 0x9a" "DB"
706307-706324 can: data: "Data byte 2: 0x04" "DB 2: 0x04" "DB"
706325-706342 can: data: "Data byte 3: 0x00" "DB 3: 0x00" "DB"
706345-706360 can: data: "Data byte 4: 0xb1" "DB 4: 0xb1" "DB"
706361-706378 can: data: "Data byte 5: 0x3e" "DB 5: 0x3e" "DB"
706379-706396 can: data: "Data byte 6: 0x0f" "DB 6: 0x0f" "DB"
706397-706414 can: data: "Data byte 7: 0xf9" "DB 7: 0xf9" "DB"
706435-706436 can: stuff-bit: "Stuff bit: 1" "SB: 1" "SB"
706415-706446 can: crc-sequence: "CRC sequence: 0x0c15" "CRC: 0x0c15" "CRC"
706447-706448 can: crc-delimiter: "CRC delimiter: 1" "CRC d: 1" "CRC d"
706449-706450 can: ack-slot: "ACK slot: ACK" "ACK s: ACK" "ACK s"
706451-706452 can: ack-delimiter: "ACK delimiter: 1" "ACK d: 1" "ACK d"
706453-706466 can: eof: "End of frame" "EOF" "E"
707686-707687 can: sof: "Start of frame" "SOF" "S"
707706-707707 can: stuff-bit: "Stuff bit: 0" "SB: 0" "SB"
707688-707711 can: id: "Identifier: 894 (0x37e)" "ID: 894 (0x37e)" "ID"
707714-707715 can: ide: "Identifier extension bit: extended frame" "IDE: extended frame" "IDE"
707726-707727 can: stuff-bit: "Stuff bit: 1" "SB: 1" "SB"
707748-707749 can: stuff-bit: "Stuff bit: 1" "SB: 1" "SB"
707716-707755 can: ext-id: "Extended Identifier: 1280 (0x500)" "Extended ID: 1280 (0x500)" "Extended ID" "EID"
707716-707755 can: full-id: "Full Identifier: 234358016 (0xdf80500)" "Full ID: 234358016 (0xdf80500)" "Full ID" "FID"
707712-707713 can: srr: "Substitute remote request: 1" "SRR: 1" "SRR"
707756-707757 can: rtr: "Remote transmission request: data frame" "RTR: data frame" "RTR"
707758-707759 can: reserved-bit: "Reserved bit 1: 0" "RB1: 0" "RB1"
707760-707761 can: stuff-bit: "Stuff bit: 1" "SB: 1" "SB"
707762-707763 can: reserved-bit: "Reserved bit 0: 0" "RB0: 0" "RB0"
707764-707771 can: dlc: "Data length code: 8" "DLC: 8" "DLC"
707776-707777 can: stuff-bit: "Stuff bit: 1" "SB: 1" "SB"
707848-707849 can: stuff-bit: "Stuff bit: 0" "SB: 0" "SB"
707882-707883 can: stuff-bit: "Stuff bit: 0" "SB: 0" "SB"
707892-707893 can: stuff-bit: "Stuff bit: 1" "SB: 1" "SB"
707772-707789 can: data: "Data byte 0: 0x23" "DB 0: 0x23" "DB"
707790-707805 can: data: "Data byte 1: 0xcd" "DB 1: 0xcd" "DB"
707806-707821 can: data: "Data byte 2: 0x8e" "DB 2: 0x8e" "DB"
707822-707837 can: data: "Data byte 3: 0xf2" "DB 3: 0xf2" "DB"
707838-707855 can: data: "Data byte 4: 0xfb" "DB 4: 0xfb" "DB"
707856-707871 can: data: "Data byte 5: 0x48" "DB 5: 0x48" "DB"
707872-707889 can: data: "Data byte 6: 0xf8" "DB 6: 0xf8" "DB"
707890-707907 can: data: "Data byte 7: 0x09" "DB 7: 0x09" "DB"
707908-707937 can: crc-sequence: "CRC sequence: 0x376d" "CRC: 0x376d" "CRC"
707938-707939 can: crc-delimiter: "CRC delimiter: 1" "CRC d: 1" "CRC d"
707940-707941 can: ack-slot: "ACK slot: ACK" "ACK s: ACK" "ACK s"
707942-707943 can: ack-delimiter: "ACK delimiter: 1" "ACK d: 1" "ACK d"
707944-707957 can: eof: "End of frame" "EOF" "E"
709188-709189 can: sof: "Start of frame" "SOF" "S"
709208-709209 can: stuff-bit: "Stuff bit: 0" "SB: 0" "SB"
709190-709213 can: id: "Identifier: 894 (0x37e)" "ID: 894 (0x37e)" "ID"
709216-709217 can: ide: "Identifier extension bit: extended frame" "IDE: extended frame" "IDE"
709228-709229 can: stuff-bit: "Stuff bit: 1" "SB: 1" "SB"
709250-709251 can: stuff-bit: "Stuff bit: 1" "SB: 1" "SB"
709218-709257 can: ext-id: "Extended Identifier: 1280 (0x500)" "Extended ID: 1280 (0x500)" "Extended ID" "EID"
709218-709257 can: full-id: "Full Identifier: 234358016 (0xdf80500)" "Full ID: 234358016 (0xdf80500)" "Full ID" "FID"
709214-709215 can: srr: "Substitute remote request: 1" "SRR: 1" "SRR"
709258-709259 can: rtr: "Remote transmission request: data frame" "RTR: data frame" "RTR"
709260-709261 can: reserved-bit: "Reserved bit 1: 0" "RB1: 0" "RB1"
709262-709263 can: stuff-bit: "Stuff bit: 1" "SB: 1" "SB"
709264-709265 can: reserved-bit: "Reserved bit 0: 0" "RB0: 0" "RB0"
709266-709273 can: dlc: "Data length code: 8" "DLC: 8" "DLC"
709278-709279 can: stuff-bit: "Stuff bit: 1" "SB: 1" "SB"
709298-709299 can: stuff-bit: "Stuff bit: 1" "SB: 1" "SB"
709310-709311 can: stuff-bit: "Stuff bit: 1" "SB: 1" "SB"
709332-709333 can: stuff-bit: "Stuff bit: 1" "SB: 1" "SB"
709344-709345 can: stuff-bit: "Stuff bit: 1" "SB: 1" "SB"
709356-709357 can: stuff-bit: "Stuff bit: 1" "SB: 1" "SB"
709368-709369 can: stuff-bit: "Stuff bit: 1" "SB: 1" "SB"
709390-709391 can: stuff-bit: "Stuff bit: 0" "SB: 0" "SB"
709408-709409 can: stuff-bit: "Stuff bit: 1" "SB: 1" "SB"
709274-709291 can: data: "Data byte 0: 0x24" "DB 0: 0x24" "DB"
709292-709309 can: data: "Data byte 1: 0x00" "DB 1: 0x00" "DB"
709312-709327 can: data: "Data byte 2: 0x00" "DB 2: 0x00" "DB"
709328-709347 can: data: "Data byte 3: 0x00" "DB 3: 0x00" "DB"
709348-709365 can: data: "Data byte 4: 0x00" "DB 4: 0x00" "DB"
709366-709383 can: data: "Data byte 5: 0x13" "DB 5: 0x13" "DB"
709384-709401 can: data: "Data byte 6: 0xfc" "DB 6: 0xfc" "DB"
709402-709419 can: data: "Data byte 7: 0x05" "DB 7: 0x05" "DB"
709420-709449 can: crc-sequence: "CRC sequence: 0x3897" "CRC: 0x3897" "CRC"
709450-709451 can: crc-delimiter: "CRC delimiter: 1" "CRC d: 1" "CRC d"
709452-709453 can: ack-slot: "ACK slot: ACK" "ACK s: ACK" "ACK s"
709454-709455 can: ack-delimiter: "ACK delimiter: 1" "ACK d: 1" "ACK d"
709456-709469 can: eof: "End of frame" "EOF" "E"
710701-710702 can: sof: "Start of frame" "SOF" "S"
710721-710722 can: stuff-bit: "Stuff bit: 0" "SB: 0" "SB"
710703-710726 can: id: "Identifier: 894 (0x37e)" "ID: 894 (0x37e)" "ID"
710729-710730 can: ide: "Identifier extension bit: extended frame" "IDE: extended frame" "IDE"
710741-710742 can: stuff-bit: "Stuff bit: 1" "SB: 1" "SB"
710763-710764 can: stuff-bit: "Stuff bit: 1" "SB: 1" "SB"
710731-710770 can: ext-id: "Extended Identifier: 1280 (0x500)" "Extended ID: 1280 (0x500)" "Extended ID" "EID"
710731-710770 can: full-id: "Full Identifier: 234358016 (0xdf80500)" "Full ID: 234358016 (0xdf80500)" "Full ID" "FID"
710727-710728 can: srr: "Substitute remote request: 1" "SRR: 1" "SRR"
710771-710772 can: rtr: "Remote transmission request: data frame" "RTR: data frame" "RTR"
710773-710774 can: reserved-bit: "Reserved bit 1: 0" "RB1: 0" "RB1"
710775-710776 can: stuff-bit: "Stuff bit: 1" "SB: 1" "SB"
710777-710778 can: reserved-bit: "Reserved bit 0: 0" "RB0: 0" "RB0"
710779-710786 can: dlc: "Data length code: 8" "DLC: 8" "DLC"
710791-710792 can: stuff-bit: "Stuff bit: 1" "SB: 1" "SB"
710831-710832 can: stuff-bit: "Stuff bit: 1" "SB: 1" "SB"
710863-710864 can: stuff-bit: "Stuff bit: 1" "SB: 1" "SB"
710915-710916 can: stuff-bit: "Stuff bit: 0" "SB: 0" "SB"
710787-710804 can: data: "Data byte 0: 0x25" "DB 0: 0x25" "DB"
710805-710820 can: data: "Data byte 1: 0xd3" "DB 1: 0xd3" "DB"
710821-710838 can: data: "Data byte 2: 0x00" "DB 2: 0x00" "DB"
710839-710854 can: data: "Data byte 3: 0x4e" "DB 3: 0x4e" "DB"
710855-710872 can: data: "Data byte 4: 0x01" "DB 4: 0x01" "DB"
710873-710888 can: data: "Data byte 5: 0x96" "DB 5: 0x96" "DB"
710889-710904 can: data: "Data byte 6: 0xf6" "DB 6: 0xf6" "DB"
710905-710922 can: data: "Data byte 7: 0xff" "DB 7: 0xff" "DB"
710923-710952 can: crc-sequence: "CRC sequence: 0x38e5" "CRC: 0x38e5" "CRC"
710953-710954 can: crc-delimiter: "CRC delimiter: 1" "CRC d: 1" "CRC d"
710955-710956 can: ack-slot: "ACK slot: ACK" "ACK s: ACK" "ACK s"
710957-710958 can: ack-delimiter: "ACK delimiter: 1" "ACK d: 1" "ACK d"
710959-710972 can: eof: "End of frame" "EOF" "E"
712186-712187 can: sof: "Start of frame" "SOF" "S"
712206-712207 can: stuff-bit: "Stuff bit: 0" "SB: 0" "SB"
712188-712211 can: id: "Identifier: 894 (0x37e)" "ID: 894 (0x37e)" "ID"
712214-712215 can: ide: "Identifier extension bit: extended frame" "IDE: extended frame" "IDE"
712226-712227 can: stuff-bit: "Stuff bit: 1" "SB: 1" "SB"
712248-712249 can: stuff-bit: "Stuff bit: 1" "SB: 1" "SB"
712216-712255 can: ext-id: "Extended Identifier: 1280 (0x500)" "Extended ID: 1280 (0x500)" "Extended ID" "EID"
712216-712255 can: full-id: "Full Identifier: 234358016 (0xdf80500)" "Full ID: 234358016 (0xdf80500)" "Full ID" "FID"
712212-712213 can: srr: "Substitute remote request: 1" "SRR: 1" "SRR"
712256-712257 can: rtr: "Remote transmission request: data frame" "RTR: data frame" "RTR"
712258-712259 can: reserved-bit: "Reserved bit 1: 0" "RB1: 0" "RB1"
712260-712261 can: stuff-bit: "Stuff bit: 1" "SB: 1" "SB"
712262-712263 can: reserved-bit: "Reserved bit 0: 0" "RB0: 0" "RB0"
712264-712271 can: dlc: "Data length code: 8" "DLC: 8" "DLC"
712276-712277 can: stuff-bit: "Stuff bit: 1" "SB: 1" "SB"
712300-712301 can: stuff-bit: "Stuff bit: 0" "SB: 0" "SB"
712318-712319 can: stuff-bit: "Stuff bit: 1" "SB: 1" "SB"
712336-712337 can: stuff-bit: "Stuff bit: 0" "SB: 0" "SB"
712348-712349 can: stuff-bit: "Stuff bit: 0" "SB: 0" "SB"
712360-712361 can: stuff-bit: "Stuff bit: 0" "SB: 0" "SB"
712372-712373 can: stuff-bit: "Stuff bit: 0" "SB: 0" "SB"
712384-712385 can: stuff-bit: "Stuff bit: 0" "SB: 0" "SB"
712396-712397 can: stuff-bit: "Stuff bit: 0" "SB: 0" "SB"
712408-712409 can: stuff-bit: "Stuff bit: 0" "SB: 0" "SB"
712272-712289 can: data: "Data byte 0: 0x26" "DB 0: 0x26" "DB"
712290-712307 can: data: "Data byte 1: 0xff" "DB 1: 0xff" "DB"
712308-712325 can: data: "Data byte 2: 0x00" "DB 2: 0x00" "DB"
712326-712343 can: data: "Data byte 3: 0xff" "DB 3: 0xff" "DB"
712344-712363 can: data: "Data byte 4: 0xff" "DB 4: 0xff" "DB"
712364-712381 can: data: "Data byte 5: 0xff" "DB 5: 0xff" "DB"
712382-712401 can: data: "Data byte 6: 0xff" "DB 6: 0xff" "DB"
712402-712419 can: data: "Data byte 7: 0xff" "DB 7: 0xff" "DB"
712420-712421 can: stuff-bit: "Stuff bit: 0" "SB: 0" "SB"
712422-712451 can: crc-sequence: "CRC sequence: 0x4b0f" "CRC: 0x4b0f" "CRC"
712452-712453 can: crc-delimiter: "CRC delimiter: 1" "CRC d: 1" "CRC d"
712454-712455 can: stuff-bit: "Stuff bit: 0" "SB: 0" "SB"
712456-712457 can: ack-slot: "ACK slot: NACK" "ACK s: NACK" "ACK s"
712458-712459 can: ack-delimiter: "ACK delimiter: 1" "ACK d: 1" "ACK d"
712460-712473 can: eof: "End of frame" "EOF" "E"
713686-713687 can: sof: "Start of frame" "SOF" "S"
713706-713707 can: stuff-bit: "Stuff bit: 0" "SB: 0" "SB"
713688-713711 can: id: "Identifier: 638 (0x27e)" "ID: 638 (0x27e)" "ID"
713714-713715 can: ide: "Identifier extension bit: extended frame" "IDE: extended frame" "IDE"
713726-713727 can: stuff-bit: "Stuff bit: 1" "SB: 1" "SB"
713748-713749 can: stuff-bit: "Stuff bit: 1" "SB: 1" "SB"
713716-713755 can: ext-id: "Extended Identifier: 256 (0x100)" "Extended ID: 256 (0x100)" "Extended ID" "EID"
713716-713755 can: full-id: "Full Identifier: 167248128 (0x9f80100)" "Full ID: 167248128 (0x9f80100)" "Full ID" "FID"
713712-713713 can: srr: "Substitute remote request: 1" "SRR: 1" "SRR"
713756-713757 can: rtr: "Remote transmission request: data frame" "RTR: data frame" "RTR"
713758-713759 can: reserved-bit: "Reserved bit 1: 0" "RB1: 0" "RB1"
713760-713761 can: stuff-bit: "Stuff bit: 1" "SB: 1" "SB"
713762-713763 can: reserved-bit: "Reserved bit 0: 0" "RB0: 0" "RB0"
713764-713771 can: dlc: "Data length code: 8" "DLC: 8" "DLC"
713852-713853 can: stuff-bit: "Stuff bit: 1" "SB: 1" "SB"
713772-713787 can: data: "Data byte 0: 0xaa" "DB 0: 0xaa" "DB"
713788-713803 can: data: "Data byte 1: 0xb0" "DB 1: 0xb0" "DB"
713804-713819 can: data: "Data byte 2: 0xc5" "DB 2: 0xc5" "DB"
713820-713835 can: data: "Data byte 3: 0x13" "DB 3: 0x13" "DB"
713836-713851 can: data: "Data byte 4: 0xa0" "DB 4: 0xa0" "DB"
713854-713869 can: data: "Data byte 5: 0x2d" "DB 5: 0x2d" "DB"
713870-713885 can: data: "Data byte 6: 0x44" "DB 6: 0x44" "DB"
713886-713901 can: data: "Data byte 7: 0x8c" "DB 7: 0x8c" "DB"
713902-713931 can: crc-sequence: "CRC sequence: 0x44d7" "CRC: 0x44d7" "CRC"
713932-713933 can: crc-delimiter: "CRC delimiter: 0" "CRC d: 0" "CRC d"
713934-713935 can: ack-slot: "ACK slot: ACK" "ACK s: ACK" "ACK s"
713936-713937 can: ack-delimiter: "ACK delimiter: 1" "ACK d: 1" "ACK d"
713938-713951 can: eof: "End of frame" "EOF" "E"
732727-732728 can: sof: "Start of frame" "SOF" "S"
732747-732748 can: stuff-bit: "Stuff bit: 0" "SB: 0" "SB"
732729-732752 can: id: "Identifier: 638 (0x27e)" "ID: 638 (0x27e)" "ID"
732755-732756 can: ide: "Identifier extension bit: extended frame" "IDE: extended frame" "IDE"
732767-732768 can: stuff-bit: "Stuff bit: 1" "SB: 1" "SB"
732787-732788 can: stuff-bit: "Stuff bit: 1" "SB: 1" "SB"
732757-732796 can: ext-id: "Extended Identifier: 512 (0x200)" "Extended ID: 512 (0x200)" "Extended ID" "EID"
732757-732796 can: full-id: "Full Identifier: 167248384 (0x9f80200)" "Full ID: 167248384 (0x9f80200)" "Full ID" "FID"
732753-732754 can: srr: "Substitute remote request: 1" "SRR: 1" "SRR"
732797-732798 can: rtr: "Remote transmission request: data frame" "RTR: data frame" "RTR"
732799-732800 can: stuff-bit: "Stuff bit: 1" "SB: 1" "SB"
732801-732802 can: reserved-bit: "Reserved bit 1: 0" "RB1: 0" "RB1"
732803-732804 can: reserved-bit: "Reserved bit 0: 0" "RB0: 0" "RB0"
732805-732812 can: dlc: "Data length code: 8" "DLC: 8" "DLC"
732817-732818 can: stuff-bit: "Stuff bit: 1" "SB: 1" "SB"
732841-732842 can: stuff-bit: "Stuff bit: 0" "SB: 0" "SB"
732889-732890 can: stuff-bit: "Stuff bit: 1" "SB: 1" "SB"
732909-732910 can: stuff-bit: "Stuff bit: 1" "SB: 1" "SB"
732927-732928 can: stuff-bit: "Stuff bit: 0" "SB: 0" "SB"
732939-732940 can: stuff-bit: "Stuff bit: 0" "SB: 0" "SB"
732951-732952 can: stuff-bit: "Stuff bit: 0" "SB: 0" "SB"
732813-732830 can: data: "Data byte 0: 0x2a" "DB 0: 0x2a" "DB"
732831-732848 can: data: "Data byte 1: 0xfc" "DB 1: 0xfc" "DB"
732849-732864 can: data: "Data byte 2: 0x47" "DB 2: 0x47" "DB"
732865-732880 can: data: "Data byte 3: 0x0a" "DB 3: 0x0a" "DB"
732881-732898 can: data: "Data byte 4: 0x05" "DB 4: 0x05" "DB"
732899-732916 can: data: "Data byte 5: 0x00" "DB 5: 0x00" "DB"
732917-732934 can: data: "Data byte 6: 0xff" "DB 6: 0xff" "DB"
732935-732954 can: data: "Data byte 7: 0xff" "DB 7: 0xff" "DB"
732955-732984 can: crc-sequence: "CRC sequence: 0x6cdb" "CRC: 0x6cdb" "CRC"
732985-732986 can: crc-delimiter: "CRC delimiter: 1" "CRC d: 1" "CRC d"
732987-732988 can: ack-slot: "ACK slot: ACK" "ACK s: ACK" "ACK s"
732989-732990 can: ack-delimiter: "ACK delimiter: 1" "ACK d: 1" "ACK d"
732991-733004 can: eof: "End of frame" "EOF" "E"
745213-745214 can: sof: "Start of frame" "SOF" "S"
745233-745234 can: stuff-bit: "Stuff bit: 0" "SB: 0" "SB"
745215-745238 can: id: "Identifier: 638 (0x27e)" "ID: 638 (0x27e)" "ID"
745241-745242 can: ide: "Identifier extension bit: extended frame" "IDE: extended frame" "IDE"
745253-745254 can: stuff-bit: "Stuff bit: 1" "SB: 1" "SB"
745275-745276 can: stuff-bit: "Stuff bit: 1" "SB: 1" "SB"
745243-745282 can: ext-id: "Extended Identifier: 256 (0x100)" "Extended ID: 256 (0x100)" "Extended ID" "EID"
745243-745282 can: full-id: "Full Identifier: 167248128 (0x9f80100)" "Full ID: 167248128 (0x9f80100)" "Full ID" "FID"
745239-745240 can: srr: "Substitute remote request: 1" "SRR: 1" "SRR"
745283-745284 can: rtr: "Remote transmission request: data frame" "RTR: data frame" "RTR"
745285-745286 can: reserved-bit: "Reserved bit 1: 0" "RB1: 0" "RB1"
745287-745288 can: stuff-bit: "Stuff bit: 1" "SB: 1" "SB"
745289-745290 can: reserved-bit: "Reserved bit 0: 0" "RB0: 0" "RB0"
745291-745298 can: dlc: "Data length code: 8" "DLC: 8" "DLC"
745377-745378 can: stuff-bit: "Stuff bit: 1" "SB: 1" "SB"
745299-745314 can: data: "Data byte 0: 0xaa" "DB 0: 0xaa" "DB"
745315-745330 can: data: "Data byte 1: 0xb0" "DB 1: 0xb0" "DB"
745331-745346 can: data: "Data byte 2: 0xc5" "DB 2: 0xc5" "DB"
745347-745362 can: data: "Data byte 3: 0x17" "DB 3: 0x17" "DB"
745363-745380 can: data: "Data byte 4: 0x40" "DB 4: 0x40" "DB"
745381-745396 can: data: "Data byte 5: 0x5a" "DB 5: 0x5a" "DB"
745397-745412 can: data: "Data byte 6: 0x89" "DB 6: 0x89" "DB"
745413-745428 can: data: "Data byte 7: 0x8c" "DB 7: 0x8c" "DB"
745429-745458 can: crc-sequence: "CRC sequence: 0x44d7" "CRC: 0x44d7" "CRC"
745459-745460 can: crc-delimiter: "CRC delimiter: 0" "CRC d: 0" "CRC d"
745461-745462 can: ack-slot: "ACK slot: NACK" "ACK s: NACK" "ACK s"
745463-745464 can: ack-delimiter: "ACK delimiter: 1" "ACK d: 1" "ACK d"
745465-745478 can: eof: "End of frame" "EOF" "E"
795212-795213 can: sof: "Start of frame" "SOF" "S"
795232-795233 can: stuff-bit: "Stuff bit: 0" "SB: 0" "SB"
795214-795237 can: id: "Identifier: 638 (0x27e)" "ID: 638 (0x27e)" "ID"
795240-795241 can: ide: "Identifier extension bit: extended frame" "IDE: extended frame" "IDE"
795252-795253 can: stuff-bit: "Stuff bit: 1" "SB: 1" "SB"
795274-795275 can: stuff-bit: "Stuff bit: 1" "SB: 1" "SB"
795242-795281 can: ext-id: "Extended Identifier: 256 (0x100)" "Extended ID: 256 (0x100)" "Extended ID" "EID"
795242-795281 can: full-id: "Full Identifier: 167248128 (0x9f80100)" "Full ID: 167248128 (0x9f80100)" "Full ID" "FID"
795238-795239 can: srr: "Substitute remote request: 1" "SRR: 1" "SRR"
795282-795283 can: rtr: "Remote transmission request: data frame" "RTR: data frame" "RTR"
795284-795285 can: reserved-bit: "Reserved bit 1: 0" "RB1: 0" "RB1"
795286-795287 can: stuff-bit: "Stuff bit: 1" "SB: 1" "SB"
795288-795289 can: reserved-bit: "Reserved bit 0: 0" "RB0: 0" "RB0"
795290-795297 can: dlc: "Data length code: 8" "DLC: 8" "DLC"
795378-795379 can: stuff-bit: "Stuff bit: 1" "SB: 1" "SB"
795298-795313 can: data: "Data byte 0: 0xaa" "DB 0: 0xaa" "DB"
795314-795329 can: data: "Data byte 1: 0xb0" "DB 1: 0xb0" "DB"
795330-795345 can: data: "Data byte 2: 0xc5" "DB 2: 0xc5" "DB"
795346-795361 can: data: "Data byte 3: 0x13" "DB 3: 0x13" "DB"
795362-795377 can: data: "Data byte 4: 0xa0" "DB 4: 0xa0" "DB"
795380-795395 can: data: "Data byte 5: 0x2d" "DB 5: 0x2d" "DB"
795396-795411 can: data: "Data byte 6: 0x44" "DB 6: 0x44" "DB"
795412-795427 can: data: "Data byte 7: 0xc6" "DB 7: 0xc6" "DB"
795428-795457 can: crc-sequence: "CRC sequence: 0x226b" "CRC: 0x226b" "CRC"
795458-795459 can: crc-delimiter: "CRC delimiter: 1" "CRC d: 1" "CRC d"
795460-795461 can: ack-slot: "ACK slot: ACK" "ACK s: ACK" "ACK s"
795462-795463 can: ack-delimiter: "ACK delimiter: 1" "ACK d: 1" "ACK d"
795464-795477 can: eof: "End of frame" "EOF" "E"
845211-845212 can: sof: "Start of frame" "SOF" "S"
845231-845232 can: stuff-bit: "Stuff bit: 0" "SB: 0" "SB"
845213-845236 can: id: "Identifier: 638 (0x27e)" "ID: 638 (0x27e)" "ID"
845239-845240 can: ide: "Identifier extension bit: extended frame" "IDE: extended frame" "IDE"
845251-845252 can: stuff-bit: "Stuff bit: 1" "SB: 1" "SB"
845273-845274 can: stuff-bit: "Stuff bit: 1" "SB: 1" "SB"
845241-845280 can: ext-id: "Extended Identifier: 256 (0x100)" "Extended ID: 256 (0x100)" "Extended ID" "EID"
845241-845280 can: full-id: "Full Identifier: 167248128 (0x9f80100)" "Full ID: 167248128 (0x9f80100)" "Full ID" "FID"
845237-845238 can: srr: "Substitute remote request: 1" "SRR: 1" "SRR"
845281-845282 can: rtr: "Remote transmission request: data frame" "RTR: data frame" "RTR"
845283-845284 can: reserved-bit: "Reserved bit 1: 0" "RB1: 0" "RB1"
845285-845286 can: stuff-bit: "Stuff bit: 1" "SB: 1" "SB"
845287-845288 can: reserved-bit: "Reserved bit 0: 0" "RB0: 0" "RB0"
845289-845296 can: dlc: "Data length code: 8" "DLC: 8" "DLC"
845377-845378 can: stuff-bit: "Stuff bit: 1" "SB: 1" "SB"
845297-845312 can: data: "Data byte 0: 0xaa" "DB 0: 0xaa" "DB"
845313-845328 can: data: "Data byte 1: 0xb0" "DB 1: 0xb0" "DB"
845329-845344 can: data: "Data byte 2: 0xc5" "DB 2: 0xc5" "DB"
845345-845360 can: data: "Data byte 3: 0x13" "DB 3: 0x13" "DB"
845361-845376 can: data: "Data byte 4: 0xa0" "DB 4: 0xa0" "DB"
845379-845394 can: data: "Data byte 5: 0x2d" "DB 5: 0x2d" "DB"
845395-845410 can: data: "Data byte 6: 0x44" "DB 6: 0x44" "DB"
845411-845426 can: data: "Data byte 7: 0xc6" "DB 7: 0xc6" "DB"
845427-845456 can: crc-sequence: "CRC sequence: 0x226b" "CRC: 0x226b" "CRC"
845457-845458 can: crc-delimiter: "CRC delimiter: 1" "CRC d: 1" "CRC d"
845459-845460 can: ack-slot: "ACK slot: ACK" "ACK s: ACK" "ACK s"
845461-845462 can: ack-delimiter: "ACK delimiter: 1" "ACK d: 1" "ACK d"
845463-845476 can: eof: "End of frame" "EOF" "E"
857705-857706 can: sof: "Start of frame" "SOF" "S"
857725-857726 can: stuff-bit: "Stuff bit: 0" "SB: 0" "SB"
857707-857730 can: id: "Identifier: 638 (0x27e)" "ID: 638 (0x27e)" "ID"
857733-857734 can: ide: "Identifier extension bit: extended frame" "IDE: extended frame" "IDE"
857745-857746 can: stuff-bit: "Stuff bit: 1" "SB: 1" "SB"
857765-857766 can: stuff-bit: "Stuff bit: 1" "SB: 1" "SB"
857735-857774 can: ext-id: "Extended Identifier: 512 (0x200)" "Extended ID: 512 (0x200)" "Extended ID" "EID"
857735-857774 can: full-id: "Full Identifier: 167248384 (0x9f80200)" "Full ID: 167248384 (0x9f80200)" "Full ID" "FID"
857731-857732 can: srr: "Substitute remote request: 1" "SRR: 1" "SRR"
857775-857776 can: rtr: "Remote transmission request: data frame" "RTR: data frame" "RTR"
857777-857778 can: stuff-bit: "Stuff bit: 1" "SB: 1" "SB"
857779-857780 can: reserved-bit: "Reserved bit 1: 0" "RB1: 0" "RB1"
857781-857782 can: reserved-bit: "Reserved bit 0: 0" "RB0: 0" "RB0"
857783-857790 can: dlc: "Data length code: 0" "DLC: 0" "DLC"
857793-857794 can: stuff-bit: "Stuff bit: 1" "SB: 1" "SB"
857813-857814 can: stuff-bit: "Stuff bit: 0" "SB: 0" "SB"
857791-857824 can: crc-sequence: "CRC sequence: 0x2bfc" "CRC: 0x2bfc" "CRC"
857825-857826 can: crc-delimiter: "CRC delimiter: 0" "CRC d: 0" "CRC d"
857827-857828 can: ack-slot: "ACK slot: NACK" "ACK s: NACK" "ACK s"
857829-857830 can: ack-delimiter: "ACK delimiter: 0" "ACK d: 0" "ACK d"
857831-857844 can: eof: "End of frame" "EOF" "E"
857845-857846 can: sof: "Start of frame" "SOF" "S"
857865-857866 can: stuff-bit: "Stuff bit: 1" "SB: 1" "SB"
857847-857870 can: id: "Identifier: 641 (0x281)" "ID: 641 (0x281)" "ID"
857873-857874 can: ide: "Identifier extension bit: extended frame" "IDE: extended frame" "IDE"
857885-857886 can: stuff-bit: "Stuff bit: 1" "SB: 1" "SB"
857903-857904 can: stuff-bit: "Stuff bit: 0" "SB: 0" "SB"
857875-857914 can: ext-id: "Extended Identifier: 1023 (0x3ff)" "Extended ID: 1023 (0x3ff)" "Extended ID" "EID"
857875-857914 can: full-id: "Full Identifier: 168035327 (0xa0403ff)" "Full ID: 168035327 (0xa0403ff)" "Full ID" "FID"
857871-857872 can: srr: "Substitute remote request: 0" "SRR: 0" "SRR"
857915-857916 can: stuff-bit: "Stuff bit: 0" "SB: 0" "SB"
857917-857918 can: rtr: "Remote transmission request: remote frame" "RTR: remote frame" "RTR"
857919-857920 can: reserved-bit: "Reserved bit 1: 1" "RB1: 1" "RB1"
857921-857922 can: reserved-bit: "Reserved bit 0: 1" "RB0: 1" "RB0"
857927-857928 can: stuff-bit: "Stuff bit: 0" "SB: 0" "SB"
857923-857932 can: dlc: "Data length code: 14" "DLC: 14" "DLC"
857951-857952 can: stuff-bit: "Stuff bit: 0" "SB: 0" "SB"
857933-857948 can: data: "Data byte 0: 0xef" "DB 0: 0xef" "DB"
857949-857966 can: data: "Data byte 1: 0xae" "DB 1: 0xae" "DB"
857967-857982 can: data: "Data byte 2: 0xff" "DB 2: 0xff" "DB"
857983-857998 can: data: "Data byte 3: 0xff" "DB 3: 0xff" "DB"
857999-858014 can: data: "Data byte 4: 0xff" "DB 4: 0xff" "DB"
858015-858030 can: data: "Data byte 5: 0xff" "DB 5: 0xff" "DB"
858031-858046 can: data: "Data byte 6: 0xff" "DB 6: 0xff" "DB"
858047-858062 can: data: "Data byte 7: 0xff" "DB 7: 0xff" "DB"
858063-858078 can: data: "Data byte 8: 0xff" "DB 8: 0xff" "DB"
858079-858094 can: data: "Data byte 9: 0xff" "DB 9: 0xff" "DB"
858095-858110 can: data: "Data byte 10: 0xff" "DB 10: 0xff" "DB"
858111-858126 can: data: "Data byte 11: 0xff" "DB 11: 0xff" "DB"
858127-858142 can: data: "Data byte 12: 0xff" "DB 12: 0xff" "DB"
858143-858158 can: data: "Data byte 13: 0xff" "DB 13: 0xff" "DB"
858159-858188 can: crc-sequence: "CRC sequence: 0x7fff" "CRC: 0x7fff" "CRC"
858189-858190 can: crc-delimiter: "CRC delimiter: 1" "CRC d: 1" "CRC d"
858191-858192 can: ack-slot: "ACK slot: NACK" "ACK s: NACK" "ACK s"
858193-858194 can: ack-delimiter: "ACK delimiter: 1" "ACK d: 1" "ACK d"
858195-858208 can: eof: "End of frame" "EOF" "E"
895211-895212 can: sof: "Start of frame" "SOF" "S"
895233-895234 can: stuff-bit: "Stuff bit: 0" "SB: 0" "SB"
895213-895236 can: id: "Identifier: 639 (0x27f)" "ID: 639 (0x27f)" "ID"
895239-895240 can: ide: "Identifier extension bit: standard frame" "IDE: standard frame" "IDE"
895241-895242 can: reserved-bit: "Reserved bit 0: 0" "RB0: 0" "RB0"
895237-895238 can: rtr: "Remote transmission request: remote frame" "RTR: remote frame" "RTR"
895249-895250 can: stuff-bit: "Stuff bit: 1" "SB: 1" "SB"
895243-895252 can: dlc: "Data length code: 0" "DLC: 0" "DLC"
895271-895272 can: stuff-bit: "Stuff bit: 1" "SB: 1" "SB"
895283-895284 can: stuff-bit: "Stuff bit: 1" "SB: 1" "SB"
895253-895286 can: crc-sequence: "CRC sequence: 0x0800" "CRC: 0x0800" "CRC"
895287-895288 can: crc-delimiter: "CRC delimiter: 1" "CRC d: 1" "CRC d"
895289-895290 can: ack-slot: "ACK slot: ACK" "ACK s: ACK" "ACK s"
895291-895292 can: ack-delimiter: "ACK delimiter: 0" "ACK d: 0" "ACK d"
895293-895306 can: eof: "End of frame" "EOF" "E"
895307-895308 can: warnings: "Start of frame (SOF) must be a dominant bit"
895309-895330 can: id: "Identifier: 707 (0x2c3)" "ID: 707 (0x2c3)" "ID"
895333-895334 can: ide: "Identifier extension bit: standard frame" "IDE: standard frame" "IDE"
895335-895336 can: reserved-bit: "Reserved bit 0: 0" "RB0: 0" "RB0"
895331-895332 can: rtr: "Remote transmission request: data frame" "RTR: data frame" "RTR"
895337-895344 can: dlc: "Data length code: 10" "DLC: 10" "DLC"
895375-895376 can: stuff-bit: "Stuff bit: 1" "SB: 1" "SB"
895345-895360 can: data: "Data byte 0: 0x27" "DB 0: 0x27" "DB"
895361-895378 can: data: "Data byte 1: 0x40" "DB 1: 0x40" "DB"
895379-895394 can: data: "Data byte 2: 0x5a" "DB 2: 0x5a" "DB"
895395-895410 can: data: "Data byte 3: 0x89" "DB 3: 0x89" "DB"
895411-895426 can: data: "Data byte 4: 0x8c" "DB 4: 0x8c" "DB"
895427-895442 can: data: "Data byte 5: 0x89" "DB 5: 0x89" "DB"
895443-895458 can: data: "Data byte 6: 0xae" "DB 6: 0xae" "DB"
895459-895474 can: data: "Data byte 7: 0xff" "DB 7: 0xff" "DB"
895475-895490 can: data: "Data byte 8: 0xff" "DB 8: 0xff" "DB"
895491-895506 can: data: "Data byte 9: 0xff" "DB 9: 0xff" "DB"
895507-895536 can: crc-sequence: "CRC sequence: 0x7fff" "CRC: 0x7fff" "CRC"
895537-895538 can: crc-delimiter: "CRC delimiter: 1" "CRC d: 1" "CRC d"
895539-895540 can: ack-slot: "ACK slot: NACK" "ACK s: NACK" "ACK s"
895541-895542 can: ack-delimiter: "ACK delimiter: 1" "ACK d: 1" "ACK d"
895543-895556 can: eof: "End of frame" "EOF" "E"
913833-913834 can: sof: "Start of frame" "SOF" "S"
913853-913854 can: stuff-bit: "Stuff bit: 0" "SB: 0" "SB"
913835-913858 can: id: "Identifier: 636 (0x27c)" "ID: 636 (0x27c)" "ID"
913861-913862 can: ide: "Identifier extension bit: extended frame" "IDE: extended frame" "IDE"
913875-913876 can: stuff-bit: "Stuff bit: 1" "SB: 1" "SB"
913895-913896 can: stuff-bit: "Stuff bit: 1" "SB: 1" "SB"
913863-913902 can: ext-id: "Extended Identifier: 131329 (0x20101)" "Extended ID: 131329 (0x20101)" "Extended ID" "EID"
913863-913902 can: full-id: "Full Identifier: 166854913 (0x9f20101)" "Full ID: 166854913 (0x9f20101)" "Full ID" "FID"
913859-913860 can: srr: "Substitute remote request: 1" "SRR: 1" "SRR"
913903-913904 can: rtr: "Remote transmission request: data frame" "RTR: data frame" "RTR"
913905-913906 can: reserved-bit: "Reserved bit 1: 0" "RB1: 0" "RB1"
913907-913908 can: reserved-bit: "Reserved bit 0: 0" "RB0: 0" "RB0"
913909-913916 can: dlc: "Data length code: 8" "DLC: 8" "DLC"
913931-913932 can: stuff-bit: "Stuff bit: 1" "SB: 1" "SB"
913961-913962 can: stuff-bit: "Stuff bit: 0" "SB: 0" "SB"
913973-913974 can: stuff-bit: "Stuff bit: 0" "SB: 0" "SB"
913985-913986 can: stuff-bit: "Stuff bit: 0" "SB: 0" "SB"
913997-913998 can: stuff-bit: "Stuff bit: 0" "SB: 0" "SB"
914009-914010 can: stuff-bit: "Stuff bit: 0" "SB: 0" "SB"
914021-914022 can: stuff-bit: "Stuff bit: 0" "SB: 0" "SB"
914033-914034 can: stuff-bit: "Stuff bit: 0" "SB: 0" "SB"
914045-914046 can: stuff-bit: "Stuff bit: 0" "SB: 0" "SB"
914057-914058 can: stuff-bit: "Stuff bit: 0" "SB: 0" "SB"
913917-913934 can: data: "Data byte 0: 0xc0" "DB 0: 0xc0" "DB"
913935-913950 can: data: "Data byte 1: 0x1a" "DB 1: 0x1a" "DB"
913951-913968 can: data: "Data byte 2: 0xff" "DB 2: 0xff" "DB"
913969-913988 can: data: "Data byte 3: 0xff" "DB 3: 0xff" "DB"
913989-914006 can: data: "Data byte 4: 0xff" "DB 4: 0xff" "DB"
914007-914026 can: data: "Data byte 5: 0xff" "DB 5: 0xff" "DB"
914027-914044 can: data: "Data byte 6: 0xff" "DB 6: 0xff" "DB"
914047-914064 can: data: "Data byte 7: 0xff" "DB 7: 0xff" "DB"
914065-914094 can: crc-sequence: "CRC sequence: 0x1377" "CRC: 0x1377" "CRC"
914095-914096 can: crc-delimiter: "CRC delimiter: 1" "CRC d: 1" "CRC d"
914097-914098 can: ack-slot: "ACK slot: ACK" "ACK s: ACK" "ACK s"
914099-914100 can: ack-delimiter: "ACK delimiter: 1" "ACK d: 1" "ACK d"
914101-914114 can: eof: "End of frame" "EOF" "E"
914146-914147 can: sof: "Start of frame" "SOF" "S"
914166-914167 can: stuff-bit: "Stuff bit: 0" "SB: 0" "SB"
914148-914171 can: id: "Identifier: 636 (0x27c)" "ID: 636 (0x27c)" "ID"
914174-914175 can: ide: "Identifier extension bit: extended frame" "IDE: extended frame" "IDE"
914188-914189 can: stuff-bit: "Stuff bit: 1" "SB: 1" "SB"
914208-914209 can: stuff-bit: "Stuff bit: 1" "SB: 1" "SB"
914176-914215 can: ext-id: "Extended Identifier: 131329 (0x20101)" "Extended ID: 131329 (0x20101)" "Extended ID" "EID"
914176-914215 can: full-id: "Full Identifier: 166854913 (0x9f20101)" "Full ID: 166854913 (0x9f20101)" "Full ID" "FID"
914172-914173 can: srr: "Substitute remote request: 1" "SRR: 1" "SRR"
914216-914217 can: rtr: "Remote transmission request: data frame" "RTR: data frame" "RTR"
914218-914219 can: reserved-bit: "Reserved bit 1: 0" "RB1: 0" "RB1"
914220-914221 can: reserved-bit: "Reserved bit 0: 0" "RB0: 0" "RB0"
914222-914229 can: dlc: "Data length code: 8" "DLC: 8" "DLC"
914244-914245 can: stuff-bit: "Stuff bit: 1" "SB: 1" "SB"
914254-914255 can: stuff-bit: "Stuff bit: 0" "SB: 0" "SB"
914266-914267 can: stuff-bit: "Stuff bit: 0" "SB: 0" "SB"
914278-914279 can: stuff-bit: "Stuff bit: 0" "SB: 0" "SB"
914298-914299 can: stuff-bit: "Stuff bit: 0" "SB: 0" "SB"
914314-914315 can: stuff-bit: "Stuff bit: 1" "SB: 1" "SB"
914326-914327 can: stuff-bit: "Stuff bit: 1" "SB: 1" "SB"
914338-914339 can: stuff-bit: "Stuff bit: 1" "SB: 1" "SB"
914352-914353 can: stuff-bit: "Stuff bit: 0" "SB: 0" "SB"
914364-914365 can: stuff-bit: "Stuff bit: 0" "SB: 0" "SB"
914376-914377 can: stuff-bit: "Stuff bit: 0" "SB: 0" "SB"
914230-914247 can: data: "Data byte 0: 0xc1" "DB 0: 0xc1" "DB"
914248-914265 can: data: "Data byte 1: 0xff" "DB 1: 0xff" "DB"
914268-914285 can: data: "Data byte 2: 0xff" "DB 2: 0xff" "DB"
914286-914303 can: data: "Data byte 3: 0x7f" "DB 3: 0x7f" "DB"
914304-914321 can: data: "Data byte 4: 0x00" "DB 4: 0x00" "DB"
914322-914341 can: data: "Data byte 5: 0x00" "DB 5: 0x00" "DB"
914342-914359 can: data: "Data byte 6: 0xff" "DB 6: 0xff" "DB"
914360-914379 can: data: "Data byte 7: 0xff" "DB 7: 0xff" "DB"
914380-914409 can: crc-sequence: "CRC sequence: 0x5630" "CRC: 0x5630" "CRC"
914410-914411 can: crc-delimiter: "CRC delimiter: 1" "CRC d: 1" "CRC d"
914412-914413 can: ack-slot: "ACK slot: ACK" "ACK s: ACK" "ACK s"
914414-914415 can: ack-delimiter: "ACK delimiter: 1" "ACK d: 1" "ACK d"
914416-914429 can: eof: "End of frame" "EOF" "E"
914462-914463 can: sof: "Start of frame" "SOF" "S"
914482-914483 can: stuff-bit: "Stuff bit: 0" "SB: 0" "SB"
914464-914487 can: id: "Identifier: 636 (0x27c)" "ID: 636 (0x27c)" "ID"
914490-914491 can: ide: "Identifier extension bit: extended frame" "IDE: extended frame" "IDE"
914504-914505 can: stuff-bit: "Stuff bit: 1" "SB: 1" "SB"
914524-914525 can: stuff-bit: "Stuff bit: 1" "SB: 1" "SB"
914492-914531 can: ext-id: "Extended Identifier: 131329 (0x20101)" "Extended ID: 131329 (0x20101)" "Extended ID" "EID"
914492-914531 can: full-id: "Full Identifier: 166854913 (0x9f20101)" "Full ID: 166854913 (0x9f20101)" "Full ID" "FID"
914488-914489 can: srr: "Substitute remote request: 1" "SRR: 1" "SRR"
914532-914533 can: rtr: "Remote transmission request: data frame" "RTR: data frame" "RTR"
914534-914535 can: reserved-bit: "Reserved bit 1: 0" "RB1: 0" "RB1"
914536-914537 can: reserved-bit: "Reserved bit 0: 0" "RB0: 0" "RB0"
914538-914545 can: dlc: "Data length code: 8" "DLC: 8" "DLC"
914572-914573 can: stuff-bit: "Stuff bit: 0" "SB: 0" "SB"
914584-914585 can: stuff-bit: "Stuff bit: 0" "SB: 0" "SB"
914596-914597 can: stuff-bit: "Stuff bit: 0" "SB: 0" "SB"
914608-914609 can: stuff-bit: "Stuff bit: 0" "SB: 0" "SB"
914620-914621 can: stuff-bit: "Stuff bit: 0" "SB: 0" "SB"
914632-914633 can: stuff-bit: "Stuff bit: 0" "SB: 0" "SB"
914644-914645 can: stuff-bit: "Stuff bit: 0" "SB: 0" "SB"
914656-914657 can: stuff-bit: "Stuff bit: 0" "SB: 0" "SB"
914668-914669 can: stuff-bit: "Stuff bit: 0" "SB: 0" "SB"
914680-914681 can: stuff-bit: "Stuff bit: 0" "SB: 0" "SB"
914692-914693 can: stuff-bit: "Stuff bit: 0" "SB: 0" "SB"
914546-914561 can: data: "Data byte 0: 0xc2" "DB 0: 0xc2" "DB"
914562-914579 can: data: "Data byte 1: 0xff" "DB 1: 0xff" "DB"
914580-914599 can: data: "Data byte 2: 0xff" "DB 2: 0xff" "DB"
914600-914617 can: data: "Data byte 3: 0xff" "DB 3: 0xff" "DB"
914618-914637 can: data: "Data byte 4: 0xff" "DB 4: 0xff" "DB"
914638-914655 can: data: "Data byte 5: 0xff" "DB 5: 0xff" "DB"
914658-914675 can: data: "Data byte 6: 0xff" "DB 6: 0xff" "DB"
914676-914695 can: data: "Data byte 7: 0xff" "DB 7: 0xff" "DB"
914696-914725 can: crc-sequence: "CRC sequence: 0x68bb" "CRC: 0x68bb" "CRC"
914726-914727 can: crc-delimiter: "CRC delimiter: 1" "CRC d: 1" "CRC d"
914728-914729 can: ack-slot: "ACK slot: ACK" "ACK s: ACK" "ACK s"
914730-914731 can: ack-delimiter: "ACK delimiter: 1" "ACK d: 1" "ACK d"
914732-914745 can: eof: "End of frame" "EOF" "E"
914778-914779 can: sof: "Start of frame" "SOF" "S"
914798-914799 can: stuff-bit: "Stuff bit: 0" "SB: 0" "SB"
914780-914803 can: id: "Identifier: 636 (0x27c)" "ID: 636 (0x27c)" "ID"
914806-914807 can: ide: "Identifier extension bit: extended frame" "IDE: extended frame" "IDE"
914820-914821 can: stuff-bit: "Stuff bit: 1" "SB: 1" "SB"
914840-914841 can: stuff-bit: "Stuff bit: 1" "SB: 1" "SB"
914808-914847 can: ext-id: "Extended Identifier: 131329 (0x20101)" "Extended ID: 131329 (0x20101)" "Extended ID" "EID"
914808-914847 can: full-id: "Full Identifier: 166854913 (0x9f20101)" "Full ID: 166854913 (0x9f20101)" "Full ID" "FID"
914804-914805 can: srr: "Substitute remote request: 1" "SRR: 1" "SRR"
914848-914849 can: rtr: "Remote transmission request: data frame" "RTR: data frame" "RTR"
914850-914851 can: reserved-bit: "Reserved bit 1: 0" "RB1: 0" "RB1"
914852-914853 can: reserved-bit: "Reserved bit 0: 0" "RB0: 0" "RB0"
914854-914861 can: dlc: "Data length code: 8" "DLC: 8" "DLC"
914888-914889 can: stuff-bit: "Stuff bit: 1" "SB: 1" "SB"
914900-914901 can: stuff-bit: "Stuff bit: 1" "SB: 1" "SB"
914912-914913 can: stuff-bit: "Stuff bit: 1" "SB: 1" "SB"
914924-914925 can: stuff-bit: "Stuff bit: 1" "SB: 1" "SB"
914936-914937 can: stuff-bit: "Stuff bit: 1" "SB: 1" "SB"
914948-914949 can: stuff-bit: "Stuff bit: 1" "SB: 1" "SB"
914966-914967 can: stuff-bit: "Stuff bit: 0" "SB: 0" "SB"
914984-914985 can: stuff-bit: "Stuff bit: 0" "SB: 0" "SB"
914996-914997 can: stuff-bit: "Stuff bit: 0" "SB: 0" "SB"
914862-914877 can: data: "Data byte 0: 0xc3" "DB 0: 0xc3" "DB"
914878-914895 can: data: "Data byte 1: 0x00" "DB 1: 0x00" "DB"
914896-914915 can: data: "Data byte 2: 0x00" "DB 2: 0x00" "DB"
914916-914933 can: data: "Data byte 3: 0x00" "DB 3: 0x00" "DB"
914934-914953 can: data: "Data byte 4: 0x00" "DB 4: 0x00" "DB"
914954-914971 can: data: "Data byte 5: 0x7f" "DB 5: 0x7f" "DB"
914972-914989 can: data: "Data byte 6: 0x7f" "DB 6: 0x7f" "DB"
914990-915007 can: data: "Data byte 7: 0xff" "DB 7: 0xff" "DB"
915008-915009 can: stuff-bit: "Stuff bit: 0" "SB: 0" "SB"
915010-915039 can: crc-sequence: "CRC sequence: 0x7332" "CRC: 0x7332" "CRC"
915040-915041 can: crc-delimiter: "CRC delimiter: 1" "CRC d: 1" "CRC d"
915042-915043 can: ack-slot: "ACK slot: ACK" "ACK s: ACK" "ACK s"
915044-915045 can: ack-delimiter: "ACK delimiter: 1" "ACK d: 1" "ACK d"
915046-915059 can: eof: "End of frame" "EOF" "E"
915708-915709 can: sof: "Start of frame" "SOF" "S"
915728-915729 can: stuff-bit: "Stuff bit: 0" "SB: 0" "SB"
915710-915733 can: id: "Identifier: 1407 (0x57f)" "ID: 1407 (0x57f)" "ID"
915736-915737 can: ide: "Identifier extension bit: extended frame" "IDE: extended frame" "IDE"
915740-915741 can: stuff-bit: "Stuff bit: 0" "SB: 0" "SB"
915762-915763 can: stuff-bit: "Stuff bit: 1" "SB: 1" "SB"
915774-915775 can: stuff-bit: "Stuff bit: 1" "SB: 1" "SB"
915738-915779 can: ext-id: "Extended Identifier: 200705 (0x31001)" "Extended ID: 200705 (0x31001)" "Extended ID" "EID"
915738-915779 can: full-id: "Full Identifier: 369037313 (0x15ff1001)" "Full ID: 369037313 (0x15ff1001)" "Full ID" "FID"
915734-915735 can: srr: "Substitute remote request: 1" "SRR: 1" "SRR"
915780-915781 can: rtr: "Remote transmission request: data frame" "RTR: data frame" "RTR"
915782-915783 can: reserved-bit: "Reserved bit 1: 0" "RB1: 0" "RB1"
915784-915785 can: reserved-bit: "Reserved bit 0: 0" "RB0: 0" "RB0"
915786-915793 can: dlc: "Data length code: 8" "DLC: 8" "DLC"
915810-915811 can: stuff-bit: "Stuff bit: 1" "SB: 1" "SB"
915856-915857 can: stuff-bit: "Stuff bit: 1" "SB: 1" "SB"
915872-915873 can: stuff-bit: "Stuff bit: 0" "SB: 0" "SB"
915918-915919 can: stuff-bit: "Stuff bit: 1" "SB: 1" "SB"
915794-915809 can: data: "Data byte 0: 0x60" "DB 0: 0x60" "DB"
915812-915827 can: data: "Data byte 1: 0x16" "DB 1: 0x16" "DB"
915828-915843 can: data: "Data byte 2: 0x8c" "DB 2: 0x8c" "DB"
915844-915861 can: data: "Data byte 3: 0x80" "DB 3: 0x80" "DB"
915862-915879 can: data: "Data byte 4: 0xff" "DB 4: 0xff" "DB"
915880-915895 can: data: "Data byte 5: 0x16" "DB 5: 0x16" "DB"
915896-915911 can: data: "Data byte 6: 0x3c" "DB 6: 0x3c" "DB"
915912-915929 can: data: "Data byte 7: 0x00" "DB 7: 0x00" "DB"
915930-915931 can: stuff-bit: "Stuff bit: 1" "SB: 1" "SB"
915950-915951 can: stuff-bit: "Stuff bit: 1" "SB: 1" "SB"
915960-915961 can: stuff-bit: "Stuff bit: 0" "SB: 0" "SB"
915932-915965 can: crc-sequence: "CRC sequence: 0x583e" "CRC: 0x583e" "CRC"
915966-915967 can: crc-delimiter: "CRC delimiter: 1" "CRC d: 1" "CRC d"
915968-915969 can: ack-slot: "ACK slot: ACK" "ACK s: ACK" "ACK s"
915970-915971 can: ack-delimiter: "ACK delimiter: 1" "ACK d: 1" "ACK d"
915972-915985 can: eof: "End of frame" "EOF" "E"
915992-915993 can: sof: "Start of frame" "SOF" "S"
916012-916013 can: stuff-bit: "Stuff bit: 0" "SB: 0" "SB"
915994-916017 can: id: "Identifier: 1407 (0x57f)" "ID: 1407 (0x57f)" "ID"
916020-916021 can: ide: "Identifier extension bit: extended frame" "IDE: extended frame" "IDE"
916024-916025 can: stuff-bit: "Stuff bit: 0" "SB: 0" "SB"
916046-916047 can: stuff-bit: "Stuff bit: 1" "SB: 1" "SB"
916058-916059 can: stuff-bit: "Stuff bit: 1" "SB: 1" "SB"
916022-916063 can: ext-id: "Extended Identifier: 200705 (0x31001)" "Extended ID: 200705 (0x31001)" "Extended ID" "EID"
916022-916063 can: full-id: "Full Identifier: 369037313 (0x15ff1001)" "Full ID: 369037313 (0x15ff1001)" "Full ID" "FID"
916018-916019 can: srr: "Substitute remote request: 1" "SRR: 1" "SRR"
916064-916065 can: rtr: "Remote transmission request: data frame" "RTR: data frame" "RTR"
916066-916067 can: reserved-bit: "Reserved bit 1: 0" "RB1: 0" "RB1"
916068-916069 can: reserved-bit: "Reserved bit 0: 0" "RB0: 0" "RB0"
916070-916077 can: dlc: "Data length code: 8" "DLC: 8" "DLC"
916104-916105 can: stuff-bit: "Stuff bit: 1" "SB: 1" "SB"
916122-916123 can: stuff-bit: "Stuff bit: 0" "SB: 0" "SB"
916134-916135 can: stuff-bit: "Stuff bit: 0" "SB: 0" "SB"
916146-916147 can: stuff-bit: "Stuff bit: 0" "SB: 0" "SB"
916158-916159 can: stuff-bit: "Stuff bit: 0" "SB: 0" "SB"
916170-916171 can: stuff-bit: "Stuff bit: 0" "SB: 0" "SB"
916182-916183 can: stuff-bit: "Stuff bit: 0" "SB: 0" "SB"
916078-916093 can: data: "Data byte 0: 0x61" "DB 0: 0x61" "DB"
916094-916111 can: data: "Data byte 1: 0x00" "DB 1: 0x00" "DB"
916112-916129 can: data: "Data byte 2: 0xff" "DB 2: 0xff" "DB"
916130-916149 can: data: "Data byte 3: 0xff" "DB 3: 0xff" "DB"
916150-916167 can: data: "Data byte 4: 0xff" "DB 4: 0xff" "DB"
916168-916187 can: data: "Data byte 5: 0xff" "DB 5: 0xff" "DB"
916188-916203 can: data: "Data byte 6: 0x16" "DB 6: 0x16" "DB"
916204-916219 can: data: "Data byte 7: 0x3c" "DB 7: 0x3c" "DB"
916220-916249 can: crc-sequence: "CRC sequence: 0x4eed" "CRC: 0x4eed" "CRC"
916250-916251 can: crc-delimiter: "CRC delimiter: 1" "CRC d: 1" "CRC d"
916252-916253 can: ack-slot: "ACK slot: ACK" "ACK s: ACK" "ACK s"
916254-916255 can: ack-delimiter: "ACK delimiter: 1" "ACK d: 1" "ACK d"
916256-916269 can: eof: "End of frame" "EOF" "E"
916276-916277 can: sof: "Start of frame" "SOF" "S"
916296-916297 can: stuff-bit: "Stuff bit: 0" "SB: 0" "SB"
916278-916301 can: id: "Identifier: 1407 (0x57f)" "ID: 1407 (0x57f)" "ID"
916304-916305 can: ide: "Identifier extension bit: extended frame" "IDE: extended frame" "IDE"
916308-916309 can: stuff-bit: "Stuff bit: 0" "SB: 0" "SB"
916330-916331 can: stuff-bit: "Stuff bit: 1" "SB: 1" "SB"
916342-916343 can: stuff-bit: "Stuff bit: 1" "SB: 1" "SB"
916306-916347 can: ext-id: "Extended Identifier: 200705 (0x31001)" "Extended ID: 200705 (0x31001)" "Extended ID" "EID"
916306-916347 can: full-id: "Full Identifier: 369037313 (0x15ff1001)" "Full ID: 369037313 (0x15ff1001)" "Full ID" "FID"
916302-916303 can: srr: "Substitute remote request: 1" "SRR: 1" "SRR"
916348-916349 can: rtr: "Remote transmission request: data frame" "RTR: data frame" "RTR"
916350-916351 can: reserved-bit: "Reserved bit 1: 0" "RB1: 0" "RB1"
916352-916353 can: reserved-bit: "Reserved bit 0: 0" "RB0: 0" "RB0"
916354-916361 can: dlc: "Data length code: 8" "DLC: 8" "DLC"
916386-916387 can: stuff-bit: "Stuff bit: 1" "SB: 1" "SB"
916398-916399 can: stuff-bit: "Stuff bit: 1" "SB: 1" "SB"
916410-916411 can: stuff-bit: "Stuff bit: 1" "SB: 1" "SB"
916422-916423 can: stuff-bit: "Stuff bit: 1" "SB: 1" "SB"
916456-916457 can: stuff-bit: "Stuff bit: 1" "SB: 1" "SB"
916468-916469 can: stuff-bit: "Stuff bit: 1" "SB: 1" "SB"
916480-916481 can: stuff-bit: "Stuff bit: 1" "SB: 1" "SB"
916498-916499 can: stuff-bit: "Stuff bit: 0" "SB: 0" "SB"
916362-916377 can: data: "Data byte 0: 0x62" "DB 0: 0x62" "DB"
916378-916395 can: data: "Data byte 1: 0x00" "DB 1: 0x00" "DB"
916396-916415 can: data: "Data byte 2: 0x00" "DB 2: 0x00" "DB"
916416-916433 can: data: "Data byte 3: 0x16" "DB 3: 0x16" "DB"
916434-916449 can: data: "Data byte 4: 0x3c" "DB 4: 0x3c" "DB"
916450-916467 can: data: "Data byte 5: 0x00" "DB 5: 0x00" "DB"
916470-916487 can: data: "Data byte 6: 0x00" "DB 6: 0x00" "DB"
916488-916505 can: data: "Data byte 7: 0xff" "DB 7: 0xff" "DB"
916510-916511 can: stuff-bit: "Stuff bit: 0" "SB: 0" "SB"
916530-916531 can: stuff-bit: "Stuff bit: 1" "SB: 1" "SB"
916506-916539 can: crc-sequence: "CRC sequence: 0x6207" "CRC: 0x6207" "CRC"
916540-916541 can: crc-delimiter: "CRC delimiter: 1" "CRC d: 1" "CRC d"
916542-916543 can: ack-slot: "ACK slot: ACK" "ACK s: ACK" "ACK s"
916544-916545 can: ack-delimiter: "ACK delimiter: 1" "ACK d: 1" "ACK d"
916546-916559 can: eof: "End of frame" "EOF" "E"
916567-916568 can: sof: "Start of frame" "SOF" "S"
916587-916588 can: stuff-bit: "Stuff bit: 0" "SB: 0" "SB"
916569-916592 can: id: "Identifier: 1407 (0x57f)" "ID: 1407 (0x57f)" "ID"
916595-916596 can: ide: "Identifier extension bit: extended frame" "IDE: extended frame" "IDE"
916599-916600 can: stuff-bit: "Stuff bit: 0" "SB: 0" "SB"
916621-916622 can: stuff-bit: "Stuff bit: 1" "SB: 1" "SB"
916633-916634 can: stuff-bit: "Stuff bit: 1" "SB: 1" "SB"
916597-916638 can: ext-id: "Extended Identifier: 200705 (0x31001)" "Extended ID: 200705 (0x31001)" "Extended ID" "EID"
916597-916638 can: full-id: "Full Identifier: 369037313 (0x15ff1001)" "Full ID: 369037313 (0x15ff1001)" "Full ID" "FID"
916593-916594 can: srr: "Substitute remote request: 1" "SRR: 1" "SRR"
916639-916640 can: rtr: "Remote transmission request: data frame" "RTR: data frame" "RTR"
916641-916642 can: reserved-bit: "Reserved bit 1: 0" "RB1: 0" "RB1"
916643-916644 can: reserved-bit: "Reserved bit 0: 0" "RB0: 0" "RB0"
916645-916652 can: dlc: "Data length code: 8" "DLC: 8" "DLC"
916679-916680 can: stuff-bit: "Stuff bit: 1" "SB: 1" "SB"
916691-916692 can: stuff-bit: "Stuff bit: 1" "SB: 1" "SB"
916703-916704 can: stuff-bit: "Stuff bit: 1" "SB: 1" "SB"
916717-916718 can: stuff-bit: "Stuff bit: 0" "SB: 0" "SB"
916729-916730 can: stuff-bit: "Stuff bit: 0" "SB: 0" "SB"
916741-916742 can: stuff-bit: "Stuff bit: 0" "SB: 0" "SB"
916753-916754 can: stuff-bit: "Stuff bit: 0" "SB: 0" "SB"
916765-916766 can: stuff-bit: "Stuff bit: 0" "SB: 0" "SB"
916777-916778 can: stuff-bit: "Stuff bit: 0" "SB: 0" "SB"
916789-916790 can: stuff-bit: "Stuff bit: 0" "SB: 0" "SB"
916653-916668 can: data: "Data byte 0: 0x63" "DB 0: 0x63" "DB"
916669-916686 can: data: "Data byte 1: 0x00" "DB 1: 0x00" "DB"
916687-916706 can: data: "Data byte 2: 0x00" "DB 2: 0x00" "DB"
916707-916724 can: data: "Data byte 3: 0xff" "DB 3: 0xff" "DB"
916725-916744 can: data: "Data byte 4: 0xff" "DB 4: 0xff" "DB"
916745-916762 can: data: "Data byte 5: 0xff" "DB 5: 0xff" "DB"
916763-916782 can: data: "Data byte 6: 0xff" "DB 6: 0xff" "DB"
916783-916800 can: data: "Data byte 7: 0xff" "DB 7: 0xff" "DB"
916801-916802 can: stuff-bit: "Stuff bit: 0" "SB: 0" "SB"
916803-916832 can: crc-sequence: "CRC sequence: 0x6e54" "CRC: 0x6e54" "CRC"
916833-916834 can: crc-delimiter: "CRC delimiter: 1" "CRC d: 1" "CRC d"
916835-916836 can: ack-slot: "ACK slot: ACK" "ACK s: ACK" "ACK s"
916837-916838 can: ack-delimiter: "ACK delimiter: 1" "ACK d: 1" "ACK d"
916839-916852 can: eof: "End of frame" "EOF" "E"
945209-945210 can: sof: "Start of frame" "SOF" "S"
945229-945230 can: stuff-bit: "Stuff bit: 0" "SB: 0" "SB"
945211-945234 can: id: "Identifier: 638 (0x27e)" "ID: 638 (0x27e)" "ID"
945237-945238 can: ide: "Identifier extension bit: extended frame" "IDE: extended frame" "IDE"
945249-945250 can: stuff-bit: "Stuff bit: 1" "SB: 1" "SB"
945271-945272 can: stuff-bit: "Stuff bit: 1" "SB: 1" "SB"
945239-945278 can: ext-id: "Extended Identifier: 256 (0x100)" "Extended ID: 256 (0x100)" "Extended ID" "EID"
945239-945278 can: full-id: "Full Identifier: 167248128 (0x9f80100)" "Full ID: 167248128 (0x9f80100)" "Full ID" "FID"
945235-945236 can: srr: "Substitute remote request: 1" "SRR: 1" "SRR"
945279-945280 can: rtr: "Remote transmission request: data frame" "RTR: data frame" "RTR"
945281-945282 can: reserved-bit: "Reserved bit 1: 0" "RB1: 0" "RB1"
945283-945284 can: stuff-bit: "Stuff bit: 1" "SB: 1" "SB"
945285-945286 can: reserved-bit: "Reserved bit 0: 0" "RB0: 0" "RB0"
945287-945294 can: dlc: "Data length code: 8" "DLC: 8" "DLC"
945375-945376 can: stuff-bit: "Stuff bit: 1" "SB: 1" "SB"
945295-945310 can: data: "Data byte 0: 0xaa" "DB 0: 0xaa" "DB"
945311-945326 can: data: "Data byte 1: 0xb0" "DB 1: 0xb0" "DB"
945327-945342 can: data: "Data byte 2: 0xc5" "DB 2: 0xc5" "DB"
945343-945358 can: data: "Data byte 3: 0x13" "DB 3: 0x13" "DB"
945359-945374 can: data: "Data byte 4: 0xa0" "DB 4: 0xa0" "DB"
945377-945392 can: data: "Data byte 5: 0x2d" "DB 5: 0x2d" "DB"
945393-945408 can: data: "Data byte 6: 0x44" "DB 6: 0x44" "DB"
945409-945424 can: data: "Data byte 7: 0xc6" "DB 7: 0xc6" "DB"
945425-945454 can: crc-sequence: "CRC sequence: 0x226b" "CRC: 0x226b" "CRC"
945455-945456 can: crc-delimiter: "CRC delimiter: 1" "CRC d: 1" "CRC d"
945457-945458 can: ack-slot: "ACK slot: ACK" "ACK s: ACK" "ACK s"
945459-945460 can: ack-delimiter: "ACK delimiter: 1" "ACK d: 1" "ACK d"
945461-945474 can: eof: "End of frame" "EOF" "E"
982805-982806 can: sof: "Start of frame" "SOF" "S"
982825-982826 can: stuff-bit: "Stuff bit: 0" "SB: 0" "SB"
982807-982830 can: id: "Identifier: 638 (0x27e)" "ID: 638 (0x27e)" "ID"
982833-982834 can: ide: "Identifier extension bit: extended frame" "IDE: extended frame" "IDE"
982845-982846 can: stuff-bit: "Stuff bit: 1" "SB: 1" "SB"
982865-982866 can: stuff-bit: "Stuff bit: 1" "SB: 1" "SB"
982835-982874 can: ext-id: "Extended Identifier: 512 (0x200)" "Extended ID: 512 (0x200)" "Extended ID" "EID"
982835-982874 can: full-id: "Full Identifier: 167248384 (0x9f80200)" "Full ID: 167248384 (0x9f80200)" "Full ID" "FID"
982831-982832 can: srr: "Substitute remote request: 1" "SRR: 1" "SRR"
982875-982876 can: rtr: "Remote transmission request: data frame" "RTR: data frame" "RTR"
982877-982878 can: stuff-bit: "Stuff bit: 1" "SB: 1" "SB"
982879-982880 can: reserved-bit: "Reserved bit 1: 0" "RB1: 0" "RB1"
982881-982882 can: reserved-bit: "Reserved bit 0: 0" "RB0: 0" "RB0"
982883-982890 can: dlc: "Data length code: 8" "DLC: 8" "DLC"
982895-982896 can: stuff-bit: "Stuff bit: 1" "SB: 1" "SB"
982919-982920 can: stuff-bit: "Stuff bit: 0" "SB: 0" "SB"
982967-982968 can: stuff-bit: "Stuff bit: 1" "SB: 1" "SB"
982987-982988 can: stuff-bit: "Stuff bit: 1" "SB: 1" "SB"
983005-983006 can: stuff-bit: "Stuff bit: 0" "SB: 0" "SB"
983017-983018 can: stuff-bit: "Stuff bit: 0" "SB: 0" "SB"
983029-983030 can: stuff-bit: "Stuff bit: 0" "SB: 0" "SB"
982891-982908 can: data: "Data byte 0: 0x2c" "DB 0: 0x2c" "DB"
982909-982926 can: data: "Data byte 1: 0xfc" "DB 1: 0xfc" "DB"
982927-982942 can: data: "Data byte 2: 0x47" "DB 2: 0x47" "DB"
982943-982958 can: data: "Data byte 3: 0x0a" "DB 3: 0x0a" "DB"
982959-982976 can: data: "Data byte 4: 0x05" "DB 4: 0x05" "DB"
982977-982994 can: data: "Data byte 5: 0x00" "DB 5: 0x00" "DB"
982995-983012 can: data: "Data byte 6: 0xff" "DB 6: 0xff" "DB"
983013-983032 can: data: "Data byte 7: 0xff" "DB 7: 0xff" "DB"
983033-983062 can: crc-sequence: "CRC sequence: 0x1549" "CRC: 0x1549" "CRC"
983063-983064 can: crc-delimiter: "CRC delimiter: 1" "CRC d: 1" "CRC d"
983065-983066 can: ack-slot: "ACK slot: ACK" "ACK s: ACK" "ACK s"
983067-983068 can: ack-delimiter: "ACK delimiter: 1" "ACK d: 1" "ACK d"
983069-983082 can: eof: "End of frame" "EOF" "E"
995207-995208 can: sof: "Start of frame" "SOF" "S"
995227-995228 can: stuff-bit: "Stuff bit: 0" "SB: 0" "SB"
995209-995232 can: id: "Identifier: 638 (0x27e)" "ID: 638 (0x27e)" "ID"
995235-995236 can: ide: "Identifier extension bit: extended frame" "IDE: extended frame" "IDE"
995247-995248 can: stuff-bit: "Stuff bit: 1" "SB: 1" "SB"
995269-995270 can: stuff-bit: "Stuff bit: 1" "SB: 1" "SB"
995237-995276 can: ext-id: "Extended Identifier: 256 (0x100)" "Extended ID: 256 (0x100)" "Extended ID" "EID"
995237-995276 can: full-id: "Full Identifier: 167248128 (0x9f80100)" "Full ID: 167248128 (0x9f80100)" "Full ID" "FID"
995233-995234 can: srr: "Substitute remote request: 1" "SRR: 1" "SRR"
995277-995278 can: rtr: "Remote transmission request: data frame" "RTR: data frame" "RTR"
995279-995280 can: reserved-bit: "Reserved bit 1: 0" "RB1: 0" "RB1"
995281-995282 can: stuff-bit: "Stuff bit: 1" "SB: 1" "SB"
995283-995284 can: reserved-bit: "Reserved bit 0: 0" "RB0: 0" "RB0"
995285-995292 can: dlc: "Data length code: 8" "DLC: 8" "DLC"
995371-995372 can: stuff-bit: "Stuff bit: 1" "SB: 1" "SB"
995293-995308 can: data: "Data byte 0: 0xab" "DB 0: 0xab" "DB"
995309-995324 can: data: "Data byte 1: 0x61" "DB 1: 0x61" "DB"
995325-995340 can: data: "Data byte 2: 0x8a" "DB 2: 0x8a" "DB"
995341-995356 can: data: "Data byte 3: 0x27" "DB 3: 0x27" "DB"
995357-995374 can: data: "Data byte 4: 0x40" "DB 4: 0x40" "DB"
995375-995390 can: data: "Data byte 5: 0x5a" "DB 5: 0x5a" "DB"
995391-995406 can: data: "Data byte 6: 0x89" "DB 6: 0x89" "DB"
995407-995422 can: data: "Data byte 7: 0x8c" "DB 7: 0x8c" "DB"
995423-995452 can: crc-sequence: "CRC sequence: 0x44d7" "CRC: 0x44d7" "CRC"
995453-995454 can: crc-delimiter: "CRC delimiter: 0" "CRC d: 0" "CRC d"
995455-995456 can: ack-slot: "ACK slot: NACK" "ACK s: NACK" "ACK s"
995457-995458 can: ack-delimiter: "ACK delimiter: 1" "ACK d: 1" "ACK d"
995459-995472 can: eof: "End of frame" "EOF" "E"
1045206-1045207 can: sof: "Start of frame" "SOF" "S"
1045226-1045227 can: stuff-bit: "Stuff bit: 0" "SB: 0" "SB"
1045208-1045231 can: id: "Identifier: 638 (0x27e)" "ID: 638 (0x27e)" "ID"
1045234-1045235 can: ide: "Identifier extension bit: extended frame" "IDE: extended frame" "IDE"
1045246-1045247 can: stuff-bit: "Stuff bit: 1" "SB: 1" "SB"
1045268-1045269 can: stuff-bit: "Stuff bit: 1" "SB: 1" "SB"
1045236-1045275 can: ext-id: "Extended Identifier: 256 (0x100)" "Extended ID: 256 (0x100)" "Extended ID" "EID"
1045236-1045275 can: full-id: "Full Identifier: 167248128 (0x9f80100)" "Full ID: 167248128 (0x9f80100)" "Full ID" "FID"
1045232-1045233 can: srr: "Substitute remote request: 1" "SRR: 1" "SRR"
1045276-1045277 can: rtr: "Remote transmission request: data frame" "RTR: data frame" "RTR"
1045278-1045279 can: reserved-bit: "Reserved bit 1: 0" "RB1: 0" "RB1"
1045280-1045281 can: stuff-bit: "Stuff bit: 1" "SB: 1" "SB"
1045282-1045283 can: reserved-bit: "Reserved bit 0: 0" "RB0: 0" "RB0"
1045284-1045291 can: dlc: "Data length code: 8" "DLC: 8" "DLC"
1045372-1045373 can: stuff-bit: "Stuff bit: 1" "SB: 1" "SB"
1045292-1045307 can: data: "Data byte 0: 0xaa" "DB 0: 0xaa" "DB"
1045308-1045323 can: data: "Data byte 1: 0xb0" "DB 1: 0xb0" "DB"
1045324-1045339 can: data: "Data byte 2: 0xc5" "DB 2: 0xc5" "DB"
1045340-1045355 can: data: "Data byte 3: 0x13" "DB 3: 0x13" "DB"
1045356-1045371 can: data: "Data byte 4: 0xa0" "DB 4: 0xa0" "DB"
1045374-1045389 can: data: "Data byte 5: 0x2d" "DB 5: 0x2d" "DB"
1045390-1045405 can: data: "Data byte 6: 0x44" "DB 6: 0x44" "DB"
1045406-1045421 can: data: "Data byte 7: 0xc6" "DB 7: 0xc6" "DB"
1045422-1045451 can: crc-sequence: "CRC sequence: 0x44d7" "CRC: 0x44d7" "CRC"
1045452-1045453 can: crc-delimiter: "CRC delimiter: 1" "CRC d: 1" "CRC d"
1045454-1045455 can: ack-slot: "ACK slot: ACK" "ACK s: ACK" "ACK s"
1045456-1045457 can: ack-delimiter: "ACK delimiter: 1" "ACK d: 1" "ACK d"
1045458-1045471 can: eof: "End of frame" "EOF" "E"
