0-201 swd: reset: "LINERESET"
201-262 swd: enable: "JTAG->SWD"
266-467 swd: reset: "LINERESET"
848-876 swd: read: "IDCODE"
883-891 swd: ack: "OK"
895-1020 swd: data: "0x0bb11477"
1034-1063 swd: write: "W ABORT"
1069-1077 swd: ack: "OK"
1088-1212 swd: data: "0x0000001e"
2079-2107 swd: read: "R CTRL/STAT"
2113-2121 swd: ack: "OK"
2125-2250 swd: data: "0xf0000041"
2265-2293 swd: write: "W CTRL/STAT"
2300-2308 swd: ack: "OK"
2319-2443 swd: data: "0x00000020"
2453-2481 swd: read: "R CTRL/STAT"
2487-2495 swd: ack: "OK"
2499-2624 swd: data: "0x00000040"
2639-2667 swd: write: "W CTRL/STAT"
2674-2682 swd: ack: "OK"
2693-2817 swd: data: "0x50000000"
2827-2855 swd: read: "R CTRL/STAT"
2862-2870 swd: ack: "OK"
2874-2998 swd: data: "0xf0000040"
3644-3672 swd: read: "R CTRL/STAT"
3679-3687 swd: ack: "OK"
3691-3815 swd: data: "0xf0000040"
4625-4654 swd: read: "R CTRL/STAT"
4660-4668 swd: ack: "OK"
4672-4797 swd: data: "0xf0000040"
4812-4840 swd: write: "W CTRL/STAT"
4847-4855 swd: ack: "OK"
4866-4990 swd: data: "0x50000001"
5000-5028 swd: read: "R CTRL/STAT"
5034-5042 swd: ack: "OK"
5046-5171 swd: data: "0xf0000041"
5186-5214 swd: write: "W SELECT"
5221-5229 swd: ack: "OK"
5240-5364 swd: data: "0x00000000"
5374-5402 swd: write: "W AP0"
5408-5416 swd: ack: "OK"
5427-5552 swd: data: "0xa2000020"
5594-5622 swd: write: "W AP4"
5629-5637 swd: ack: "OK"
5648-5772 swd: data: "0x00000000"
5814-5843 swd: read: "R AP0"
5849-5857 swd: ack: "OK"
5861-5986 swd: data: "0x00000000"
6034-6062 swd: read: "RDBUFF"
6069-6077 swd: ack: "OK"
6081-6206 swd: data: "0x03000040"
6221-6249 swd: write: "W SELECT"
6255-6263 swd: ack: "OK"
6274-6399 swd: data: "0x000000f0"
6408-6436 swd: read: "R AP4"
6443-6451 swd: ack: "OK"
6455-6580 swd: data: "0x00000000"
7013-7041 swd: read: "RDBUFF"
7048-7056 swd: ack: "OK"
7060-7185 swd: data: "0x00000000"
7510-7538 swd: write: "W SELECT"
7544-7552 swd: ack: "OK"
7563-7687 swd: data: "0x00000000"
7697-7725 swd: write: "W AP4"
7731-7739 swd: ack: "OK"
7750-7875 swd: data: "0xe000ed00"
7917-7945 swd: write: "W AP0"
7952-7960 swd: ack: "OK"
7971-8095 swd: data: "0xa2000012"
8138-8166 swd: read: "R APc"
8173-8181 swd: ack: "OK"
8185-8309 swd: data: "0x00000000"
8357-8385 swd: read: "RDBUFF"
8392-8400 swd: ack: "OK"
8404-8529 swd: data: "0x410cc200"
8871-8899 swd: write: "W AP4"
8906-8914 swd: ack: "OK"
8925-9049 swd: data: "0xe0002000"
9092-9120 swd: read: "R APc"
9127-9135 swd: ack: "OK"
9139-9264 swd: data: "0x00000000"
9311-9339 swd: read: "RDBUFF"
9346-9354 swd: ack: "OK"
9358-9483 swd: data: "0x00000041"
10087-10115 swd: write: "W AP4"
10121-10129 swd: ack: "OK"
10140-10265 swd: data: "0xe0002008"
10307-10335 swd: write: "W APc"
10342-10350 swd: ack: "OK"
10360-10485 swd: data: "0x00000000"
10911-10939 swd: write: "W AP4"
10945-10953 swd: ack: "OK"
10964-11088 swd: data: "0xe000200c"
11131-11159 swd: write: "W APc"
11165-11173 swd: ack: "OK"
11184-11309 swd: data: "0x00000000"
11740-11768 swd: write: "W AP4"
11775-11783 swd: ack: "OK"
11794-11918 swd: data: "0xe0002010"
11961-11989 swd: write: "W APc"
11995-12003 swd: ack: "OK"
12014-12138 swd: data: "0x00000000"
12611-12639 swd: write: "W AP4"
12646-12654 swd: ack: "OK"
12665-12789 swd: data: "0xe0002014"
12832-12860 swd: write: "W APc"
12866-12874 swd: ack: "OK"
12885-13010 swd: data: "0x00000000"
13327-13355 swd: write: "W AP4"
13361-13369 swd: ack: "OK"
13380-13505 swd: data: "0xe0001000"
13547-13575 swd: read: "R APc"
13582-13590 swd: ack: "OK"
13594-13719 swd: data: "0x00000000"
13767-13795 swd: read: "RDBUFF"
13802-13810 swd: ack: "OK"
13814-13939 swd: data: "0x20000000"
14288-14316 swd: write: "W AP4"
14323-14331 swd: ack: "OK"
14342-14466 swd: data: "0xe0001028"
14509-14537 swd: write: "W APc"
14543-14551 swd: ack: "OK"
14562-14687 swd: data: "0x00000000"
15011-15039 swd: write: "W AP4"
15046-15054 swd: ack: "OK"
15065-15189 swd: data: "0xe0001038"
15232-15260 swd: write: "W APc"
15266-15274 swd: ack: "OK"
15285-15410 swd: data: "0x00000000"
16199-16227 swd: write: "W AP0"
16233-16241 swd: ack: "OK"
16252-16377 swd: data: "0xa2000002"
16419-16447 swd: write: "W AP4"
16454-16462 swd: ack: "OK"
16473-16597 swd: data: "0xe000edf0"
16640-16668 swd: write: "W SELECT"
16674-16682 swd: ack: "OK"
16693-16818 swd: data: "0x00000010"
16827-16855 swd: read: "R AP0"
16862-16870 swd: ack: "OK"
16874-16999 swd: data: "0x00000000"
17047-17075 swd: read: "RDBUFF"
17082-17090 swd: ack: "OK"
17094-17219 swd: data: "0x01000001"
18577-18605 swd: read: "R AP0"
18611-18619 swd: ack: "OK"
18623-18748 swd: data: "0x00000000"
18796-18824 swd: read: "RDBUFF"
18831-18839 swd: ack: "OK"
18843-18968 swd: data: "0x01000001"
19608-19636 swd: read: "R AP0"
19643-19651 swd: ack: "OK"
19655-19780 swd: data: "0x00000000"
19828-19856 swd: read: "RDBUFF"
19862-19870 swd: ack: "OK"
19874-19999 swd: data: "0x01000001"
20694-20722 swd: read: "R AP0"
20728-20736 swd: ack: "OK"
20740-20865 swd: data: "0x00000000"
20913-20941 swd: read: "RDBUFF"
20948-20956 swd: ack: "OK"
20960-21085 swd: data: "0x01000001"
22044-22072 swd: read: "R AP0"
22079-22087 swd: ack: "OK"
22091-22216 swd: data: "0x00000000"
22264-22292 swd: read: "RDBUFF"
22299-22307 swd: ack: "OK"
22311-22436 swd: data: "0x01000001"
23911-23939 swd: write: "W SELECT"
23946-23954 swd: ack: "OK"
23965-24089 swd: data: "0x00000000"
24099-24127 swd: write: "W AP4"
24133-24141 swd: ack: "OK"
24152-24277 swd: data: "0x20000000"
24319-24347 swd: write: "W AP0"
24354-24362 swd: ack: "OK"
24372-24497 swd: data: "0xa2000012"
24539-24567 swd: write: "W APc"
24574-24582 swd: ack: "OK"
24593-24717 swd: data: "0xabbabeeb"
24760-24788 swd: write: "W APc"
24794-24802 swd: ack: "OK"
24813-24938 swd: data: "0xabbabeeb"
24980-25008 swd: write: "W APc"
25015-25023 swd: ack: "OK"
25034-25158 swd: data: "0xabbabeeb"
25201-25229 swd: write: "W APc"
25235-25243 swd: ack: "OK"
25254-25378 swd: data: "0xabbabeeb"
25421-25449 swd: write: "W APc"
25456-25464 swd: ack: "OK"
25474-25599 swd: data: "0xabbabeeb"
25641-25669 swd: write: "W APc"
25676-25684 swd: ack: "OK"
25695-25819 swd: data: "0xabbabeeb"
25862-25890 swd: write: "W APc"
25896-25904 swd: ack: "OK"
25915-26040 swd: data: "0xabbabeeb"
26082-26110 swd: write: "W APc"
26117-26125 swd: ack: "OK"
26136-26260 swd: data: "0xabbabeeb"
26303-26331 swd: write: "W APc"
26337-26345 swd: ack: "OK"
26356-26480 swd: data: "0xabbabeeb"
26523-26551 swd: write: "W APc"
26557-26565 swd: ack: "OK"
26576-26701 swd: data: "0xabbabeeb"
26743-26771 swd: write: "W APc"
26778-26786 swd: ack: "OK"
26797-26921 swd: data: "0xabbabeeb"
26964-26992 swd: write: "W APc"
26998-27006 swd: ack: "OK"
27017-27142 swd: data: "0xabbabeeb"
27184-27212 swd: write: "W APc"
27219-27227 swd: ack: "OK"
27238-27362 swd: data: "0xabbabeeb"
27405-27433 swd: write: "W APc"
27439-27447 swd: ack: "OK"
27458-27582 swd: data: "0xabbabeeb"
27625-27653 swd: write: "W APc"
27659-27667 swd: ack: "OK"
27678-27803 swd: data: "0xabbabeeb"
27845-27873 swd: write: "W APc"
27880-27888 swd: ack: "OK"
27899-28023 swd: data: "0xabbabeeb"
28066-28094 swd: write: "W APc"
28100-28108 swd: ack: "OK"
28119-28244 swd: data: "0xabbabeeb"
28711-28739 swd: write: "W APc"
28745-28753 swd: ack: "OK"
28764-28889 swd: data: "0xabbabeeb"
28931-28959 swd: write: "W APc"
28966-28974 swd: ack: "OK"
28984-29109 swd: data: "0xabbabeeb"
29151-29179 swd: write: "W APc"
29186-29194 swd: ack: "OK"
29205-29329 swd: data: "0xabbabeeb"
30186-30214 swd: write: "W AP0"
30220-30228 swd: ack: "OK"
30239-30364 swd: data: "0xa2000002"
30406-30434 swd: write: "W AP4"
30441-30449 swd: ack: "OK"
30460-30584 swd: data: "0xe000edf0"
30627-30655 swd: write: "W SELECT"
30661-30669 swd: ack: "OK"
30680-30804 swd: data: "0x00000010"
30814-30842 swd: read: "R AP0"
30849-30857 swd: ack: "OK"
30861-30986 swd: data: "0x00000000"
31034-31062 swd: read: "RDBUFF"
31068-31076 swd: ack: "OK"
31080-31205 swd: data: "0x01000001"
