773838-773859 spiflash: field: "Command: 2x I/O read (2READ)" "Command: 2x I/O read" "Cmd: 2x I/O read" "Cmd: 2READ" "2READ"
773858-773879 spiflash: bit: "Address bits 23..16: 0x06" "Addr bits 23..16: 0x06" "Addr bits 23..16" "A23..A16"
773858-773879 spiflash: bit: "Address bits 15..8: 0x9b" "Addr bits 15..8: 0x9b" "Addr bits 15..8" "A15..A8"
773878-773899 spiflash: bit: "Address bits 7..0: 0xc0" "Addr bits 7..0: 0xc0" "Addr bits 7..0" "A7..A0"
773858-773899 spiflash: field: "Address: 0x069bc0" "Addr: 0x069bc0" "0x069bc0"
773878-773899 spiflash: bit: "Dummy byte: 0x00"
773898-774219 spiflash: field: "Data (32 bytes)"
773838-774217 spiflash: 2read: "2x I/O read (addr 0x069bc0, 32 bytes): 61 00 22 ce 0a 05 f7 fe 16 12 f0 28 91 58 11 48 01 32 ce 18 50 44 c0 42 c4 fc 40 40 f4 4a 4e 42"
774277-774298 spiflash: field: "Command: 2x I/O read (2READ)" "Command: 2x I/O read" "Cmd: 2x I/O read" "Cmd: 2READ" "2READ"
774297-774318 spiflash: bit: "Address bits 23..16: 0x06" "Addr bits 23..16: 0x06" "Addr bits 23..16" "A23..A16"
774297-774318 spiflash: bit: "Address bits 15..8: 0xa5" "Addr bits 15..8: 0xa5" "Addr bits 15..8" "A15..A8"
774317-774338 spiflash: bit: "Address bits 7..0: 0xc0" "Addr bits 7..0: 0xc0" "Addr bits 7..0" "A7..A0"
774297-774338 spiflash: field: "Address: 0x06a5c0" "Addr: 0x06a5c0" "0x06a5c0"
774317-774338 spiflash: bit: "Dummy byte: 0x00"
774337-774658 spiflash: field: "Data (32 bytes)"
774277-774656 spiflash: 2read: "2x I/O read (addr 0x06a5c0, 32 bytes): 33 10 0b 42 30 f3 40 30 30 60 21 84 ff 32 c3 1f 50 33 82 3a 22 0c 03 40 23 93 0d f0 12 c1 e0 d9"
774931-774950 spiflash: field: "Command: 2x I/O read (2READ)" "Command: 2x I/O read" "Cmd: 2x I/O read" "Cmd: 2READ" "2READ"
774951-774970 spiflash: bit: "Address bits 23..16: 0x06" "Addr bits 23..16: 0x06" "Addr bits 23..16" "A23..A16"
774951-774970 spiflash: bit: "Address bits 15..8: 0x72" "Addr bits 15..8: 0x72" "Addr bits 15..8" "A15..A8"
774971-774990 spiflash: bit: "Address bits 7..0: 0xa0" "Addr bits 7..0: 0xa0" "Addr bits 7..0" "A7..A0"
774951-774990 spiflash: field: "Address: 0x0672a0" "Addr: 0x0672a0" "0x0672a0"
774971-774990 spiflash: bit: "Dummy byte: 0x00"
774991-775310 spiflash: field: "Data (32 bytes)"
774931-775310 spiflash: 2read: "2x I/O read (addr 0x0672a0, 32 bytes): 20 45 98 ea 20 20 74 02 21 00 12 c1 10 80 00 00 41 cc ff c0 52 11 5a 44 38 24 0c 02 26 13 07 72"
775337-775358 spiflash: field: "Command: 2x I/O read (2READ)" "Command: 2x I/O read" "Cmd: 2x I/O read" "Cmd: 2READ" "2READ"
775357-775378 spiflash: bit: "Address bits 23..16: 0x06" "Addr bits 23..16: 0x06" "Addr bits 23..16" "A23..A16"
775357-775378 spiflash: bit: "Address bits 15..8: 0x72" "Addr bits 15..8: 0x72" "Addr bits 15..8" "A15..A8"
775377-775398 spiflash: bit: "Address bits 7..0: 0xc0" "Addr bits 7..0: 0xc0" "Addr bits 7..0" "A7..A0"
775357-775398 spiflash: field: "Address: 0x0672c0" "Addr: 0x0672c0" "0x0672c0"
775377-775398 spiflash: bit: "Dummy byte: 0x00"
775397-775718 spiflash: field: "Data (32 bytes)"
775337-775716 spiflash: 2read: "2x I/O read (addr 0x0672c0, 32 bytes): 04 0c 0c 16 70 26 83 20 20 74 0d f0 31 c5 ff c0 22 11 2a 23 22 02 0d 0d f0 00 00 00 31 c1 ff c0"
776110-776129 spiflash: field: "Command: 2x I/O read (2READ)" "Command: 2x I/O read" "Cmd: 2x I/O read" "Cmd: 2READ" "2READ"
776130-776149 spiflash: bit: "Address bits 23..16: 0x05" "Addr bits 23..16: 0x05" "Addr bits 23..16" "A23..A16"
776130-776149 spiflash: bit: "Address bits 15..8: 0xa5" "Addr bits 15..8: 0xa5" "Addr bits 15..8" "A15..A8"
776150-776169 spiflash: bit: "Address bits 7..0: 0xc0" "Addr bits 7..0: 0xc0" "Addr bits 7..0" "A7..A0"
776130-776169 spiflash: field: "Address: 0x05a5c0" "Addr: 0x05a5c0" "0x05a5c0"
776150-776169 spiflash: bit: "Dummy byte: 0x00"
776170-776489 spiflash: field: "Data (32 bytes)"
776110-776489 spiflash: 2read: "2x I/O read (addr 0x05a5c0, 32 bytes): 32 00 01 d0 22 90 37 e3 02 46 de ff 42 12 2c 80 44 c0 16 94 f4 46 db ff 56 3a f4 52 a0 17 97 35"
777053-777074 spiflash: field: "Command: 2x I/O read (2READ)" "Command: 2x I/O read" "Cmd: 2x I/O read" "Cmd: 2READ" "2READ"
777073-777094 spiflash: bit: "Address bits 23..16: 0x05" "Addr bits 23..16: 0x05" "Addr bits 23..16" "A23..A16"
777073-777094 spiflash: bit: "Address bits 15..8: 0x72" "Addr bits 15..8: 0x72" "Addr bits 15..8" "A15..A8"
777093-777114 spiflash: bit: "Address bits 7..0: 0x60" "Addr bits 7..0: 0x60" "Addr bits 7..0" "A7..A0"
777073-777114 spiflash: field: "Address: 0x057260" "Addr: 0x057260" "0x057260"
777093-777114 spiflash: bit: "Dummy byte: 0x00"
777113-777433 spiflash: field: "Data (32 bytes)"
777053-777432 spiflash: 2read: "2x I/O read (addr 0x057260, 32 bytes): e9 41 d9 31 ed 02 d8 12 f2 12 0b d8 1d cd 03 da ff f2 cf 18 d0 5f c0 02 c5 e8 e6 a0 02 46 8c 00"
777952-777973 spiflash: field: "Command: 2x I/O read (2READ)" "Command: 2x I/O read" "Cmd: 2x I/O read" "Cmd: 2READ" "2READ"
777972-777993 spiflash: bit: "Address bits 23..16: 0x05" "Addr bits 23..16: 0x05" "Addr bits 23..16" "A23..A16"
777972-777993 spiflash: bit: "Address bits 15..8: 0x72" "Addr bits 15..8: 0x72" "Addr bits 15..8" "A15..A8"
777992-778013 spiflash: bit: "Address bits 7..0: 0xa0" "Addr bits 7..0: 0xa0" "Addr bits 7..0" "A7..A0"
777972-778013 spiflash: field: "Address: 0x0572a0" "Addr: 0x0572a0" "0x0572a0"
777992-778013 spiflash: bit: "Dummy byte: 0x00"
778012-778333 spiflash: field: "Data (32 bytes)"
777952-778331 spiflash: 2read: "2x I/O read (addr 0x0572a0, 32 bytes): 5c 01 28 22 85 13 fe d9 3c 62 a0 dd 22 4c 01 78 01 20 30 74 32 4c 00 72 c7 dc 79 4c e6 27 02 06"
778385-778404 spiflash: field: "Command: 2x I/O read (2READ)" "Command: 2x I/O read" "Cmd: 2x I/O read" "Cmd: 2READ" "2READ"
778405-778424 spiflash: bit: "Address bits 23..16: 0x05" "Addr bits 23..16: 0x05" "Addr bits 23..16" "A23..A16"
778405-778424 spiflash: bit: "Address bits 15..8: 0x72" "Addr bits 15..8: 0x72" "Addr bits 15..8" "A15..A8"
778425-778444 spiflash: bit: "Address bits 7..0: 0xc0" "Addr bits 7..0: 0xc0" "Addr bits 7..0" "A7..A0"
778405-778444 spiflash: field: "Address: 0x0572c0" "Addr: 0x0572c0" "0x0572c0"
778425-778444 spiflash: bit: "Dummy byte: 0x00"
778445-778764 spiflash: field: "Data (32 bytes)"
778385-778764 spiflash: 2read: "2x I/O read (addr 0x0572c0, 32 bytes): 7d 00 81 e1 ff 3c 2a 2c db 91 11 f0 d0 2f c0 02 0d 01 7d 0d 2b 40 47 a2 02 46 75 00 22 0d 00 2c"
778799-778818 spiflash: field: "Command: 2x I/O read (2READ)" "Command: 2x I/O read" "Cmd: 2x I/O read" "Cmd: 2READ" "2READ"
778819-778838 spiflash: bit: "Address bits 23..16: 0x05" "Addr bits 23..16: 0x05" "Addr bits 23..16" "A23..A16"
778819-778838 spiflash: bit: "Address bits 15..8: 0x33" "Addr bits 15..8: 0x33" "Addr bits 15..8" "A15..A8"
778839-778858 spiflash: bit: "Address bits 7..0: 0x00" "Addr bits 7..0: 0x00" "Addr bits 7..0" "A7..A0"
778819-778858 spiflash: field: "Address: 0x053300" "Addr: 0x053300" "0x053300"
778839-778858 spiflash: bit: "Dummy byte: 0x00"
778859-779178 spiflash: field: "Data (32 bytes)"
778799-779177 spiflash: 2read: "2x I/O read (addr 0x053300, 32 bytes): 01 f0 ff c0 00 00 08 01 12 c1 10 0d f0 00 00 00 74 96 fe 3f 22 a3 70 12 c1 f0 c2 61 01 02 61 00"
779230-779249 spiflash: field: "Command: 2x I/O read (2READ)" "Command: 2x I/O read" "Cmd: 2x I/O read" "Cmd: 2READ" "2READ"
779250-779269 spiflash: bit: "Address bits 23..16: 0x05" "Addr bits 23..16: 0x05" "Addr bits 23..16" "A23..A16"
779250-779269 spiflash: bit: "Address bits 15..8: 0x73" "Addr bits 15..8: 0x73" "Addr bits 15..8" "A15..A8"
779270-779289 spiflash: bit: "Address bits 7..0: 0x00" "Addr bits 7..0: 0x00" "Addr bits 7..0" "A7..A0"
779250-779289 spiflash: field: "Address: 0x057300" "Addr: 0x057300" "0x057300"
779270-779289 spiflash: bit: "Dummy byte: 0x00"
779290-779609 spiflash: field: "Data (32 bytes)"
779230-779609 spiflash: 2read: "2x I/O read (addr 0x057300, 32 bytes): 22 cc 46 6c 00 67 a2 02 06 46 00 27 26 e9 0c 02 b6 40 25 52 0d 03 42 0d 02 80 55 11 d2 0d 05 50"
780172-780193 spiflash: field: "Command: 2x I/O read (2READ)" "Command: 2x I/O read" "Cmd: 2x I/O read" "Cmd: 2READ" "2READ"
780192-780213 spiflash: bit: "Address bits 23..16: 0x05" "Addr bits 23..16: 0x05" "Addr bits 23..16" "A23..A16"
780192-780213 spiflash: bit: "Address bits 15..8: 0x75" "Addr bits 15..8: 0x75" "Addr bits 15..8" "A15..A8"
780212-780233 spiflash: bit: "Address bits 7..0: 0x00" "Addr bits 7..0: 0x00" "Addr bits 7..0" "A7..A0"
780192-780233 spiflash: field: "Address: 0x057500" "Addr: 0x057500" "0x057500"
780212-780233 spiflash: bit: "Dummy byte: 0x00"
780232-780552 spiflash: field: "Data (32 bytes)"
780172-780551 spiflash: 2read: "2x I/O read (addr 0x057500, 32 bytes): 8c 60 d2 00 01 f6 3d 01 39 7c 08 fc 1c a8 9c 30 e2 00 01 1c e4 52 00 00 fd 08 60 55 c0 50 f4 83"
780580-780601 spiflash: field: "Command: 2x I/O read (2READ)" "Command: 2x I/O read" "Cmd: 2x I/O read" "Cmd: 2READ" "2READ"
780600-780621 spiflash: bit: "Address bits 23..16: 0x05" "Addr bits 23..16: 0x05" "Addr bits 23..16" "A23..A16"
780600-780621 spiflash: bit: "Address bits 15..8: 0x75" "Addr bits 15..8: 0x75" "Addr bits 15..8" "A15..A8"
780620-780641 spiflash: bit: "Address bits 7..0: 0x20" "Addr bits 7..0: 0x20" "Addr bits 7..0" "A7..A0"
780600-780641 spiflash: field: "Address: 0x057520" "Addr: 0x057520" "0x057520"
780620-780641 spiflash: bit: "Dummy byte: 0x00"
780640-780961 spiflash: field: "Data (32 bytes)"
780580-780959 spiflash: 2read: "2x I/O read (addr 0x057520, 32 bytes): f7 be 01 39 fc 02 2c 10 1c 69 9c 00 a2 00 00 72 00 01 60 aa c0 a0 98 83 97 b7 02 32 6c 10 c8 21"
780990-781011 spiflash: field: "Command: 2x I/O read (2READ)" "Command: 2x I/O read" "Cmd: 2x I/O read" "Cmd: 2READ" "2READ"
781010-781031 spiflash: bit: "Address bits 23..16: 0x05" "Addr bits 23..16: 0x05" "Addr bits 23..16" "A23..A16"
781010-781031 spiflash: bit: "Address bits 15..8: 0x75" "Addr bits 15..8: 0x75" "Addr bits 15..8" "A15..A8"
781030-781051 spiflash: bit: "Address bits 7..0: 0x40" "Addr bits 7..0: 0x40" "Addr bits 7..0" "A7..A0"
781010-781051 spiflash: field: "Address: 0x057540" "Addr: 0x057540" "0x057540"
781030-781051 spiflash: bit: "Dummy byte: 0x00"
781050-781371 spiflash: field: "Data (32 bytes)"
780990-781369 spiflash: 2read: "2x I/O read (addr 0x057540, 32 bytes): d8 31 e8 41 f8 51 08 11 12 c1 20 0d f0 0c 22 86 dd ff 00 00 00 50 f2 00 00 50 f2 04 00 50 f2 05"
781735-781756 spiflash: field: "Command: 2x I/O read (2READ)" "Command: 2x I/O read" "Cmd: 2x I/O read" "Cmd: 2READ" "2READ"
781755-781776 spiflash: bit: "Address bits 23..16: 0x05" "Addr bits 23..16: 0x05" "Addr bits 23..16" "A23..A16"
781755-781776 spiflash: bit: "Address bits 15..8: 0x9c" "Addr bits 15..8: 0x9c" "Addr bits 15..8" "A15..A8"
781775-781796 spiflash: bit: "Address bits 7..0: 0x00" "Addr bits 7..0: 0x00" "Addr bits 7..0" "A7..A0"
781755-781796 spiflash: field: "Address: 0x059c00" "Addr: 0x059c00" "0x059c00"
781775-781796 spiflash: bit: "Dummy byte: 0x00"
781795-782116 spiflash: field: "Data (32 bytes)"
781735-782114 spiflash: 2read: "2x I/O read (addr 0x059c00, 32 bytes): 12 02 00 18 29 41 02 c0 fe 16 d0 0c 28 8c 45 fa ff 01 f0 ff fc f2 09 21 38 8c 52 c0 e3 42 05 03"
782145-782166 spiflash: field: "Command: 2x I/O read (2READ)" "Command: 2x I/O read" "Cmd: 2x I/O read" "Cmd: 2READ" "2READ"
782165-782186 spiflash: bit: "Address bits 23..16: 0x05" "Addr bits 23..16: 0x05" "Addr bits 23..16" "A23..A16"
782165-782186 spiflash: bit: "Address bits 15..8: 0x9b" "Addr bits 15..8: 0x9b" "Addr bits 15..8" "A15..A8"
782185-782206 spiflash: bit: "Address bits 7..0: 0xc0" "Addr bits 7..0: 0xc0" "Addr bits 7..0" "A7..A0"
782165-782206 spiflash: field: "Address: 0x059bc0" "Addr: 0x059bc0" "0x059bc0"
782185-782206 spiflash: bit: "Dummy byte: 0x00"
782205-782526 spiflash: field: "Data (32 bytes)"
782145-782524 spiflash: 2read: "2x I/O read (addr 0x059bc0, 32 bytes): 1b 55 8c 23 0c 02 0d f0 50 50 74 57 96 ec 0c 12 0d f0 00 00 9d 96 fe 3f ab 96 fe 3f 50 3c 27 40"
782559-782578 spiflash: field: "Command: 2x I/O read (2READ)" "Command: 2x I/O read" "Cmd: 2x I/O read" "Cmd: 2READ" "2READ"
782579-782598 spiflash: bit: "Address bits 23..16: 0x05" "Addr bits 23..16: 0x05" "Addr bits 23..16" "A23..A16"
782579-782598 spiflash: bit: "Address bits 15..8: 0x9c" "Addr bits 15..8: 0x9c" "Addr bits 15..8" "A15..A8"
782599-782618 spiflash: bit: "Address bits 7..0: 0x20" "Addr bits 7..0: 0x20" "Addr bits 7..0" "A7..A0"
782579-782618 spiflash: field: "Address: 0x059c20" "Addr: 0x059c20" "0x059c20"
782599-782618 spiflash: bit: "Dummy byte: 0x00"
782619-782938 spiflash: field: "Data (32 bytes)"
782559-782938 spiflash: 2read: "2x I/O read (addr 0x059c20, 32 bytes): 62 05 02 80 44 11 60 44 20 80 44 11 62 05 01 52 05 00 60 44 20 62 03 01 80 44 11 50 44 20 67 94"
783184-783203 spiflash: field: "Command: 2x I/O read (2READ)" "Command: 2x I/O read" "Cmd: 2x I/O read" "Cmd: 2READ" "2READ"
783204-783223 spiflash: bit: "Address bits 23..16: 0x05" "Addr bits 23..16: 0x05" "Addr bits 23..16" "A23..A16"
783204-783223 spiflash: bit: "Address bits 15..8: 0x9c" "Addr bits 15..8: 0x9c" "Addr bits 15..8" "A15..A8"
783224-783243 spiflash: bit: "Address bits 7..0: 0x60" "Addr bits 7..0: 0x60" "Addr bits 7..0" "A7..A0"
783204-783243 spiflash: field: "Address: 0x059c60" "Addr: 0x059c60" "0x059c60"
783224-783243 spiflash: bit: "Dummy byte: 0x00"
783244-783563 spiflash: field: "Data (32 bytes)"
783184-783563 spiflash: 2read: "2x I/O read (addr 0x059c60, 32 bytes): 16 e3 fe 21 20 e9 32 21 04 42 a0 06 32 c3 10 01 52 35 c0 00 00 08 21 56 72 fd 42 1c 01 32 a0 f0"
784825-784846 spiflash: field: "Command: 2x I/O read (2READ)" "Command: 2x I/O read" "Cmd: 2x I/O read" "Cmd: 2READ" "2READ"
784845-784866 spiflash: bit: "Address bits 23..16: 0x03" "Addr bits 23..16: 0x03" "Addr bits 23..16" "A23..A16"
784845-784866 spiflash: bit: "Address bits 15..8: 0x32" "Addr bits 15..8: 0x32" "Addr bits 15..8" "A15..A8"
784865-784886 spiflash: bit: "Address bits 7..0: 0x60" "Addr bits 7..0: 0x60" "Addr bits 7..0" "A7..A0"
784845-784886 spiflash: field: "Address: 0x033260" "Addr: 0x033260" "0x033260"
784865-784886 spiflash: bit: "Dummy byte: 0x00"
784885-785206 spiflash: field: "Data (32 bytes)"
784825-785204 spiflash: 2read: "2x I/O read (addr 0x033260, 32 bytes): 00 00 01 00 00 00 02 00 00 00 04 00 92 a0 90 90 11 c0 d2 61 21 e2 61 20 f2 61 1f 02 61 23 c2 61"
785480-785501 spiflash: field: "Command: 2x I/O read (2READ)" "Command: 2x I/O read" "Cmd: 2x I/O read" "Cmd: 2READ" "2READ"
785500-785521 spiflash: bit: "Address bits 23..16: 0x05" "Addr bits 23..16: 0x05" "Addr bits 23..16" "A23..A16"
785500-785521 spiflash: bit: "Address bits 15..8: 0xa0" "Addr bits 15..8: 0xa0" "Addr bits 15..8" "A15..A8"
785520-785541 spiflash: bit: "Address bits 7..0: 0xa0" "Addr bits 7..0: 0xa0" "Addr bits 7..0" "A7..A0"
785500-785541 spiflash: field: "Address: 0x05a0a0" "Addr: 0x05a0a0" "0x05a0a0"
785520-785541 spiflash: bit: "Dummy byte: 0x00"
785540-785861 spiflash: field: "Data (32 bytes)"
785480-785859 spiflash: 2read: "2x I/O read (addr 0x05a0a0, 32 bytes): dc f2 42 0d 08 0c 45 50 44 20 42 4d 08 0c 02 c2 21 13 d2 21 14 e2 21 15 f2 21 16 02 21 12 12 c1"
786128-786147 spiflash: field: "Command: 2x I/O read (2READ)" "Command: 2x I/O read" "Cmd: 2x I/O read" "Cmd: 2READ" "2READ"
786148-786167 spiflash: bit: "Address bits 23..16: 0x02" "Addr bits 23..16: 0x02" "Addr bits 23..16" "A23..A16"
786148-786167 spiflash: bit: "Address bits 15..8: 0x75" "Addr bits 15..8: 0x75" "Addr bits 15..8" "A15..A8"
786168-786187 spiflash: bit: "Address bits 7..0: 0x00" "Addr bits 7..0: 0x00" "Addr bits 7..0" "A7..A0"
786148-786187 spiflash: field: "Address: 0x027500" "Addr: 0x027500" "0x027500"
786168-786187 spiflash: bit: "Dummy byte: 0x00"
786188-786507 spiflash: field: "Data (32 bytes)"
786128-786507 spiflash: 2read: "2x I/O read (addr 0x027500, 32 bytes): f0 00 00 00 b4 08 10 40 12 c1 d0 c2 61 0a c1 a8 ff 02 61 0b 72 2c 00 16 97 04 39 01 49 11 29 21"
786538-786557 spiflash: field: "Command: 2x I/O read (2READ)" "Command: 2x I/O read" "Cmd: 2x I/O read" "Cmd: 2READ" "2READ"
786558-786577 spiflash: bit: "Address bits 23..16: 0x02" "Addr bits 23..16: 0x02" "Addr bits 23..16" "A23..A16"
786558-786577 spiflash: bit: "Address bits 15..8: 0x75" "Addr bits 15..8: 0x75" "Addr bits 15..8" "A15..A8"
786578-786597 spiflash: bit: "Address bits 7..0: 0x20" "Addr bits 7..0: 0x20" "Addr bits 7..0" "A7..A0"
786558-786597 spiflash: field: "Address: 0x027520" "Addr: 0x027520" "0x027520"
786578-786597 spiflash: bit: "Dummy byte: 0x00"
786598-786919 spiflash: field: "Data (32 bytes)"
786538-786917 spiflash: 2read: "2x I/O read (addr 0x027520, 32 bytes): ec e5 59 41 69 51 85 dd ff 58 41 68 51 66 12 0f 28 0c 3d 01 4d 06 01 f3 ff c0 00 00 86 09 00 00"
786943-786964 spiflash: field: "Command: 2x I/O read (2READ)" "Command: 2x I/O read" "Cmd: 2x I/O read" "Cmd: 2READ" "2READ"
786963-786982 spiflash: bit: "Address bits 23..16: 0x02" "Addr bits 23..16: 0x02" "Addr bits 23..16" "A23..A16"
786963-786982 spiflash: bit: "Address bits 15..8: 0x73" "Addr bits 15..8: 0x73" "Addr bits 15..8" "A15..A8"
786983-787004 spiflash: bit: "Address bits 7..0: 0x00" "Addr bits 7..0: 0x00" "Addr bits 7..0" "A7..A0"
786963-787004 spiflash: field: "Address: 0x027300" "Addr: 0x027300" "0x027300"
786983-787004 spiflash: bit: "Dummy byte: 0x00"
787003-787324 spiflash: field: "Data (32 bytes)"
786943-787322 spiflash: 2read: "2x I/O read (addr 0x027300, 32 bytes): 31 a4 fe 0c 02 c0 20 00 38 03 27 13 0e 21 6b ff 0c 23 c0 20 00 48 02 0c 12 40 23 93 0d f0 00 00"
787387-787406 spiflash: field: "Command: 2x I/O read (2READ)" "Command: 2x I/O read" "Cmd: 2x I/O read" "Cmd: 2READ" "2READ"
787407-787426 spiflash: bit: "Address bits 23..16: 0x02" "Addr bits 23..16: 0x02" "Addr bits 23..16" "A23..A16"
787407-787426 spiflash: bit: "Address bits 15..8: 0x75" "Addr bits 15..8: 0x75" "Addr bits 15..8" "A15..A8"
787427-787446 spiflash: bit: "Address bits 7..0: 0x40" "Addr bits 7..0: 0x40" "Addr bits 7..0" "A7..A0"
787407-787446 spiflash: field: "Address: 0x027540" "Addr: 0x027540" "0x027540"
787427-787446 spiflash: bit: "Dummy byte: 0x00"
787447-787766 spiflash: field: "Data (32 bytes)"
787387-787766 spiflash: 2read: "2x I/O read (addr 0x027540, 32 bytes): 28 0c 3d 01 4d 05 01 ef ff c0 00 00 86 05 00 00 00 00 50 45 20 70 27 20 10 31 20 0c 05 c5 4d ff"
790114-790135 spiflash: field: "Command: 2x I/O read (2READ)" "Command: 2x I/O read" "Cmd: 2x I/O read" "Cmd: 2READ" "2READ"
790134-790155 spiflash: bit: "Address bits 23..16: 0x05" "Addr bits 23..16: 0x05" "Addr bits 23..16" "A23..A16"
790134-790155 spiflash: bit: "Address bits 15..8: 0x1c" "Addr bits 15..8: 0x1c" "Addr bits 15..8" "A15..A8"
790154-790175 spiflash: bit: "Address bits 7..0: 0x60" "Addr bits 7..0: 0x60" "Addr bits 7..0" "A7..A0"
790134-790175 spiflash: field: "Address: 0x051c60" "Addr: 0x051c60" "0x051c60"
790154-790175 spiflash: bit: "Dummy byte: 0x00"
790174-790494 spiflash: field: "Data (32 bytes)"
790114-790493 spiflash: 2read: "2x I/O read (addr 0x051c60, 32 bytes): 12 c1 f0 0c 04 0c a5 09 31 85 6f d1 08 31 12 c1 10 0d f0 00 20 52 20 21 8a 39 12 c1 f0 22 22 00"
790517-790538 spiflash: field: "Command: 2x I/O read (2READ)" "Command: 2x I/O read" "Cmd: 2x I/O read" "Cmd: 2READ" "2READ"
790537-790558 spiflash: bit: "Address bits 23..16: 0x05" "Addr bits 23..16: 0x05" "Addr bits 23..16" "A23..A16"
790537-790558 spiflash: bit: "Address bits 15..8: 0x1c" "Addr bits 15..8: 0x1c" "Addr bits 15..8" "A15..A8"
790557-790578 spiflash: bit: "Address bits 7..0: 0x80" "Addr bits 7..0: 0x80" "Addr bits 7..0" "A7..A0"
790537-790578 spiflash: field: "Address: 0x051c80" "Addr: 0x051c80" "0x051c80"
790557-790578 spiflash: bit: "Dummy byte: 0x00"
790577-790898 spiflash: field: "Data (32 bytes)"
790517-790896 spiflash: 2read: "2x I/O read (addr 0x051c80, 32 bytes): 30 43 20 3d 05 09 31 45 ea d3 08 31 12 c1 10 0d f0 00 00 00 21 83 39 28 02 0d f0 00 82 03 00 1b"
790927-790948 spiflash: field: "Command: 2x I/O read (2READ)" "Command: 2x I/O read" "Cmd: 2x I/O read" "Cmd: 2READ" "2READ"
790947-790968 spiflash: bit: "Address bits 23..16: 0x02" "Addr bits 23..16: 0x02" "Addr bits 23..16" "A23..A16"
790947-790968 spiflash: bit: "Address bits 15..8: 0x5b" "Addr bits 15..8: 0x5b" "Addr bits 15..8" "A15..A8"
790967-790988 spiflash: bit: "Address bits 7..0: 0x20" "Addr bits 7..0: 0x20" "Addr bits 7..0" "A7..A0"
790947-790988 spiflash: field: "Address: 0x025b20" "Addr: 0x025b20" "0x025b20"
790967-790988 spiflash: bit: "Dummy byte: 0x00"
790987-791308 spiflash: field: "Data (32 bytes)"
790927-791306 spiflash: 2read: "2x I/O read (addr 0x025b20, 32 bytes): 35 f5 0c 02 0d f0 0c 12 0d f0 00 00 12 c1 f0 d9 11 40 d3 82 c9 21 3d 0d 09 31 01 f4 eb c0 00 00"
791330-791349 spiflash: field: "Command: 2x I/O read (2READ)" "Command: 2x I/O read" "Cmd: 2x I/O read" "Cmd: 2READ" "2READ"
791350-791369 spiflash: bit: "Address bits 23..16: 0x02" "Addr bits 23..16: 0x02" "Addr bits 23..16" "A23..A16"
791350-791369 spiflash: bit: "Address bits 15..8: 0x5b" "Addr bits 15..8: 0x5b" "Addr bits 15..8" "A15..A8"
791370-791389 spiflash: bit: "Address bits 7..0: 0x40" "Addr bits 7..0: 0x40" "Addr bits 7..0" "A7..A0"
791350-791389 spiflash: field: "Address: 0x025b40" "Addr: 0x025b40" "0x025b40"
791370-791389 spiflash: bit: "Dummy byte: 0x00"
791390-791709 spiflash: field: "Data (32 bytes)"
791330-791708 spiflash: 2read: "2x I/O read (addr 0x025b40, 32 bytes): cd 02 8c 82 0c 03 4d 0d 01 e2 e9 c0 00 00 08 31 2d 0c d8 11 c8 21 12 c1 10 0d f0 00 12 c1 e0 c9"
792063-792084 spiflash: field: "Command: 2x I/O read (2READ)" "Command: 2x I/O read" "Cmd: 2x I/O read" "Cmd: 2READ" "2READ"
792083-792104 spiflash: bit: "Address bits 23..16: 0x06" "Addr bits 23..16: 0x06" "Addr bits 23..16" "A23..A16"
792083-792104 spiflash: bit: "Address bits 15..8: 0x90" "Addr bits 15..8: 0x90" "Addr bits 15..8" "A15..A8"
792103-792124 spiflash: bit: "Address bits 7..0: 0x60" "Addr bits 7..0: 0x60" "Addr bits 7..0" "A7..A0"
792083-792124 spiflash: field: "Address: 0x069060" "Addr: 0x069060" "0x069060"
792103-792124 spiflash: bit: "Dummy byte: 0x00"
792123-792444 spiflash: field: "Data (32 bytes)"
792063-792442 spiflash: 2read: "2x I/O read (addr 0x069060, 32 bytes): 54 15 10 40 d8 36 10 40 22 a0 28 32 a0 04 0c 04 12 c1 e0 f9 61 e9 51 d9 41 c9 31 09 21 45 95 bd"
795564-795583 spiflash: field: "Command: 2x I/O read (2READ)" "Command: 2x I/O read" "Cmd: 2x I/O read" "Cmd: 2READ" "2READ"
795584-795603 spiflash: bit: "Address bits 23..16: 0x02" "Addr bits 23..16: 0x02" "Addr bits 23..16" "A23..A16"
795584-795603 spiflash: bit: "Address bits 15..8: 0x72" "Addr bits 15..8: 0x72" "Addr bits 15..8" "A15..A8"
795604-795623 spiflash: bit: "Address bits 7..0: 0x60" "Addr bits 7..0: 0x60" "Addr bits 7..0" "A7..A0"
795584-795623 spiflash: field: "Address: 0x027260" "Addr: 0x027260" "0x027260"
795604-795623 spiflash: bit: "Dummy byte: 0x00"
795624-795943 spiflash: field: "Data (32 bytes)"
795564-795943 spiflash: 2read: "2x I/O read (addr 0x027260, 32 bytes): 02 0b 33 c0 20 00 39 02 86 f1 ff 00 28 12 29 14 28 32 c0 20 00 29 0c 08 31 c8 21 12 c1 10 0d f0"
797415-797436 spiflash: field: "Command: 2x I/O read (2READ)" "Command: 2x I/O read" "Cmd: 2x I/O read" "Cmd: 2READ" "2READ"
797435-797456 spiflash: bit: "Address bits 23..16: 0x02" "Addr bits 23..16: 0x02" "Addr bits 23..16" "A23..A16"
797435-797456 spiflash: bit: "Address bits 15..8: 0xbe" "Addr bits 15..8: 0xbe" "Addr bits 15..8" "A15..A8"
797455-797476 spiflash: bit: "Address bits 7..0: 0x60" "Addr bits 7..0: 0x60" "Addr bits 7..0" "A7..A0"
797435-797476 spiflash: field: "Address: 0x02be60" "Addr: 0x02be60" "0x02be60"
797455-797476 spiflash: bit: "Dummy byte: 0x00"
797475-797796 spiflash: field: "Data (32 bytes)"
797415-797794 spiflash: 2read: "2x I/O read (addr 0x02be60, 32 bytes): 32 21 01 28 01 85 bf 02 66 02 20 58 0c e8 05 d8 25 2d 05 f8 35 e9 0c 01 68 d0 c0 00 00 cc 3d 5d"
797821-797842 spiflash: field: "Command: 2x I/O read (2READ)" "Command: 2x I/O read" "Cmd: 2x I/O read" "Cmd: 2READ" "2READ"
797841-797862 spiflash: bit: "Address bits 23..16: 0x02" "Addr bits 23..16: 0x02" "Addr bits 23..16" "A23..A16"
797841-797862 spiflash: bit: "Address bits 15..8: 0xbe" "Addr bits 15..8: 0xbe" "Addr bits 15..8" "A15..A8"
797861-797882 spiflash: bit: "Address bits 7..0: 0x80" "Addr bits 7..0: 0x80" "Addr bits 7..0" "A7..A0"
797841-797882 spiflash: field: "Address: 0x02be80" "Addr: 0x02be80" "0x02be80"
797861-797882 spiflash: bit: "Dummy byte: 0x00"
797881-798202 spiflash: field: "Data (32 bytes)"
797821-798200 spiflash: 2read: "2x I/O read (addr 0x02be80, 32 bytes): 0e 06 f1 ff 2d 0f c0 0d 00 86 ee ff 38 0c 48 13 47 b2 07 20 24 c0 29 13 c6 00 00 0c 02 29 13 08"
798498-798517 spiflash: field: "Command: 2x I/O read (2READ)" "Command: 2x I/O read" "Cmd: 2x I/O read" "Cmd: 2READ" "2READ"
798518-798537 spiflash: bit: "Address bits 23..16: 0x02" "Addr bits 23..16: 0x02" "Addr bits 23..16" "A23..A16"
798518-798537 spiflash: bit: "Address bits 15..8: 0xaa" "Addr bits 15..8: 0xaa" "Addr bits 15..8" "A15..A8"
798538-798557 spiflash: bit: "Address bits 7..0: 0x60" "Addr bits 7..0: 0x60" "Addr bits 7..0" "A7..A0"
798518-798557 spiflash: field: "Address: 0x02aa60" "Addr: 0x02aa60" "0x02aa60"
798538-798557 spiflash: bit: "Dummy byte: 0x00"
798558-798877 spiflash: field: "Data (32 bytes)"
798498-798876 spiflash: 2read: "2x I/O read (addr 0x02aa60, 32 bytes): 20 0d f0 00 75 0e ff 3f 12 c1 f0 09 31 c5 f6 ff 31 fd ff 22 03 00 1b 22 20 20 74 22 43 00 07 62"
798986-799007 spiflash: field: "Command: 2x I/O read (2READ)" "Command: 2x I/O read" "Cmd: 2x I/O read" "Cmd: 2READ" "2READ"
799006-799027 spiflash: bit: "Address bits 23..16: 0x02" "Addr bits 23..16: 0x02" "Addr bits 23..16" "A23..A16"
799006-799027 spiflash: bit: "Address bits 15..8: 0xaa" "Addr bits 15..8: 0xaa" "Addr bits 15..8" "A15..A8"
799026-799047 spiflash: bit: "Address bits 7..0: 0x80" "Addr bits 7..0: 0x80" "Addr bits 7..0" "A7..A0"
799006-799047 spiflash: field: "Address: 0x02aa80" "Addr: 0x02aa80" "0x02aa80"
799026-799047 spiflash: bit: "Dummy byte: 0x00"
799046-799367 spiflash: field: "Data (32 bytes)"
798986-799365 spiflash: 2read: "2x I/O read (addr 0x02aa80, 32 bytes): 02 85 96 ff 08 31 12 c1 10 0d f0 00 12 c1 e0 58 62 c9 61 09 71 cd 02 26 15 51 ac f3 32 02 22 1c"
799899-799918 spiflash: field: "Command: 2x I/O read (2READ)" "Command: 2x I/O read" "Cmd: 2x I/O read" "Cmd: 2READ" "2READ"
799919-799938 spiflash: bit: "Address bits 23..16: 0x02" "Addr bits 23..16: 0x02" "Addr bits 23..16" "A23..A16"
799919-799938 spiflash: bit: "Address bits 15..8: 0xbe" "Addr bits 15..8: 0xbe" "Addr bits 15..8" "A15..A8"
799939-799958 spiflash: bit: "Address bits 7..0: 0x40" "Addr bits 7..0: 0x40" "Addr bits 7..0" "A7..A0"
799919-799958 spiflash: field: "Address: 0x02be40" "Addr: 0x02be40" "0x02be40"
799939-799958 spiflash: bit: "Dummy byte: 0x00"
799959-800280 spiflash: field: "Data (32 bytes)"
799899-800278 spiflash: 2read: "2x I/O read (addr 0x02be40, 32 bytes): 81 f9 71 29 01 39 11 58 0c cc d5 28 01 38 11 4d 05 c5 c0 02 c6 11 00 00 00 00 42 25 01 16 c4 00"
800312-800331 spiflash: field: "Command: 2x I/O read (2READ)" "Command: 2x I/O read" "Cmd: 2x I/O read" "Cmd: 2READ" "2READ"
800332-800351 spiflash: bit: "Address bits 23..16: 0x02" "Addr bits 23..16: 0x02" "Addr bits 23..16" "A23..A16"
800332-800351 spiflash: bit: "Address bits 15..8: 0xea" "Addr bits 15..8: 0xea" "Addr bits 15..8" "A15..A8"
800352-800371 spiflash: bit: "Address bits 7..0: 0x60" "Addr bits 7..0: 0x60" "Addr bits 7..0" "A7..A0"
800332-800371 spiflash: field: "Address: 0x02ea60" "Addr: 0x02ea60" "0x02ea60"
800352-800371 spiflash: bit: "Dummy byte: 0x00"
800372-800691 spiflash: field: "Data (32 bytes)"
800312-800690 spiflash: 2read: "2x I/O read (addr 0x02ea60, 32 bytes): 12 c1 d0 d2 61 09 dd 03 c9 a1 e9 81 f9 71 09 b1 cd 04 ed 02 30 d1 83 c5 61 f8 fd 02 ac ec 0c a3"
800895-800916 spiflash: field: "Command: 2x I/O read (2READ)" "Command: 2x I/O read" "Cmd: 2x I/O read" "Cmd: 2READ" "2READ"
800915-800936 spiflash: bit: "Address bits 23..16: 0x02" "Addr bits 23..16: 0x02" "Addr bits 23..16" "A23..A16"
800915-800936 spiflash: bit: "Address bits 15..8: 0xea" "Addr bits 15..8: 0xea" "Addr bits 15..8" "A15..A8"
800935-800956 spiflash: bit: "Address bits 7..0: 0x80" "Addr bits 7..0: 0x80" "Addr bits 7..0" "A7..A0"
800915-800956 spiflash: field: "Address: 0x02ea80" "Addr: 0x02ea80" "0x02ea80"
800935-800956 spiflash: bit: "Dummy byte: 0x00"
800955-801276 spiflash: field: "Data (32 bytes)"
800895-801274 spiflash: 2read: "2x I/O read (addr 0x02ea80, 32 bytes): 2d 0c 01 d3 c7 c0 00 00 4d 02 28 0e 3d 0d 0c 05 05 03 f8 66 12 0e c5 5f f8 f0 22 c0 20 22 a0 f0"
804204-804225 spiflash: field: "Command: 2x I/O read (2READ)" "Command: 2x I/O read" "Cmd: 2x I/O read" "Cmd: 2READ" "2READ"
804224-804245 spiflash: bit: "Address bits 23..16: 0x02" "Addr bits 23..16: 0x02" "Addr bits 23..16" "A23..A16"
804224-804245 spiflash: bit: "Address bits 15..8: 0x65" "Addr bits 15..8: 0x65" "Addr bits 15..8" "A15..A8"
804244-804265 spiflash: bit: "Address bits 7..0: 0xc0" "Addr bits 7..0: 0xc0" "Addr bits 7..0" "A7..A0"
804224-804265 spiflash: field: "Address: 0x0265c0" "Addr: 0x0265c0" "0x0265c0"
804244-804265 spiflash: bit: "Dummy byte: 0x00"
804264-804585 spiflash: field: "Data (32 bytes)"
804204-804583 spiflash: 2read: "2x I/O read (addr 0x0265c0, 32 bytes): f7 a5 85 21 d1 fe 1a 22 f9 02 c6 de ff 31 81 fe fd 0d 3a 21 c5 75 10 41 7f fe 4a 21 c5 a9 11 51"
805344-805365 spiflash: field: "Command: 2x I/O read (2READ)" "Command: 2x I/O read" "Cmd: 2x I/O read" "Cmd: 2READ" "2READ"
805364-805385 spiflash: bit: "Address bits 23..16: 0x03" "Addr bits 23..16: 0x03" "Addr bits 23..16" "A23..A16"
805364-805385 spiflash: bit: "Address bits 15..8: 0x7e" "Addr bits 15..8: 0x7e" "Addr bits 15..8" "A15..A8"
805384-805405 spiflash: bit: "Address bits 7..0: 0x80" "Addr bits 7..0: 0x80" "Addr bits 7..0" "A7..A0"
805364-805405 spiflash: field: "Address: 0x037e80" "Addr: 0x037e80" "0x037e80"
805384-805405 spiflash: bit: "Dummy byte: 0x00"
805404-805725 spiflash: field: "Data (32 bytes)"
805344-805723 spiflash: 2read: "2x I/O read (addr 0x037e80, 32 bytes): 66 12 e1 2d 0c 05 18 fe 16 92 fd 46 77 00 2d 0c 85 e2 fe 31 eb ff 37 92 22 46 09 00 00 00 00 28"
807255-807274 spiflash: field: "Command: 2x I/O read (2READ)" "Command: 2x I/O read" "Cmd: 2x I/O read" "Cmd: 2READ" "2READ"
807275-807294 spiflash: bit: "Address bits 23..16: 0x02" "Addr bits 23..16: 0x02" "Addr bits 23..16" "A23..A16"
807275-807294 spiflash: bit: "Address bits 15..8: 0x60" "Addr bits 15..8: 0x60" "Addr bits 15..8" "A15..A8"
807295-807314 spiflash: bit: "Address bits 7..0: 0xa0" "Addr bits 7..0: 0xa0" "Addr bits 7..0" "A7..A0"
807275-807314 spiflash: field: "Address: 0x0260a0" "Addr: 0x0260a0" "0x0260a0"
807295-807314 spiflash: bit: "Dummy byte: 0x00"
807315-807634 spiflash: field: "Data (32 bytes)"
807255-807633 spiflash: 2read: "2x I/O read (addr 0x0260a0, 32 bytes): ac 0c 00 00 8c 0c 00 00 c8 0c 00 00 c0 0c 00 00 c4 0c 00 00 bc 0c 00 00 80 0c 00 00 d8 0c 00 00"
808310-808329 spiflash: field: "Command: 2x I/O read (2READ)" "Command: 2x I/O read" "Cmd: 2x I/O read" "Cmd: 2READ" "2READ"
808330-808349 spiflash: bit: "Address bits 23..16: 0x02" "Addr bits 23..16: 0x02" "Addr bits 23..16" "A23..A16"
808330-808349 spiflash: bit: "Address bits 15..8: 0x35" "Addr bits 15..8: 0x35" "Addr bits 15..8" "A15..A8"
808350-808369 spiflash: bit: "Address bits 7..0: 0x00" "Addr bits 7..0: 0x00" "Addr bits 7..0" "A7..A0"
808330-808369 spiflash: field: "Address: 0x023500" "Addr: 0x023500" "0x023500"
808350-808369 spiflash: bit: "Dummy byte: 0x00"
808370-808689 spiflash: field: "Data (32 bytes)"
808310-808688 spiflash: 2read: "2x I/O read (addr 0x023500, 32 bytes): 21 37 f5 27 9c 05 c8 1d 06 05 00 00 21 35 f5 27 9c 05 c8 2d 06 02 00 00 21 33 f5 27 9c 01 c8 3d"
808731-808750 spiflash: field: "Command: 2x I/O read (2READ)" "Command: 2x I/O read" "Cmd: 2x I/O read" "Cmd: 2READ" "2READ"
808751-808770 spiflash: bit: "Address bits 23..16: 0x02" "Addr bits 23..16: 0x02" "Addr bits 23..16" "A23..A16"
808751-808770 spiflash: bit: "Address bits 15..8: 0x35" "Addr bits 15..8: 0x35" "Addr bits 15..8" "A15..A8"
808771-808790 spiflash: bit: "Address bits 7..0: 0x20" "Addr bits 7..0: 0x20" "Addr bits 7..0" "A7..A0"
808751-808790 spiflash: field: "Address: 0x023520" "Addr: 0x023520" "0x023520"
808771-808790 spiflash: bit: "Dummy byte: 0x00"
808791-809110 spiflash: field: "Data (32 bytes)"
808731-809110 spiflash: 2read: "2x I/O read (addr 0x023520, 32 bytes): 28 6c 29 2c 22 1c 06 37 62 1b 22 2c 04 16 52 01 32 9c 06 21 30 f5 e0 e0 74 20 43 10 40 40 f4 9c"
809158-809179 spiflash: field: "Command: 2x I/O read (2READ)" "Command: 2x I/O read" "Cmd: 2x I/O read" "Cmd: 2READ" "2READ"
809178-809199 spiflash: bit: "Address bits 23..16: 0x02" "Addr bits 23..16: 0x02" "Addr bits 23..16" "A23..A16"
809178-809199 spiflash: bit: "Address bits 15..8: 0x35" "Addr bits 15..8: 0x35" "Addr bits 15..8" "A15..A8"
809198-809219 spiflash: bit: "Address bits 7..0: 0x40" "Addr bits 7..0: 0x40" "Addr bits 7..0" "A7..A0"
809178-809219 spiflash: field: "Address: 0x023540" "Addr: 0x023540" "0x023540"
809198-809219 spiflash: bit: "Dummy byte: 0x00"
809218-809538 spiflash: field: "Data (32 bytes)"
809158-809537 spiflash: 2read: "2x I/O read (addr 0x023540, 32 bytes): 24 86 08 00 00 00 2d 0d 3d 0c c5 08 00 16 f2 fd 7c f2 c6 15 00 20 23 20 22 5c 06 32 2c 19 21 26"
809780-809799 spiflash: field: "Command: 2x I/O read (2READ)" "Command: 2x I/O read" "Cmd: 2x I/O read" "Cmd: 2READ" "2READ"
809800-809819 spiflash: bit: "Address bits 23..16: 0x02" "Addr bits 23..16: 0x02" "Addr bits 23..16" "A23..A16"
809800-809819 spiflash: bit: "Address bits 15..8: 0x5c" "Addr bits 15..8: 0x5c" "Addr bits 15..8" "A15..A8"
809820-809839 spiflash: bit: "Address bits 7..0: 0x00" "Addr bits 7..0: 0x00" "Addr bits 7..0" "A7..A0"
809800-809839 spiflash: field: "Address: 0x025c00" "Addr: 0x025c00" "0x025c00"
809820-809839 spiflash: bit: "Dummy byte: 0x00"
809840-810159 spiflash: field: "Data (32 bytes)"
809780-810159 spiflash: 2read: "2x I/O read (addr 0x025c00, 32 bytes): 12 c1 10 0d f0 00 00 00 0c 02 0d f0 12 c1 e0 d9 51 dd 02 22 13 06 c9 61 e9 41 f9 31 09 71 cd 03"
810182-810203 spiflash: field: "Command: 2x I/O read (2READ)" "Command: 2x I/O read" "Cmd: 2x I/O read" "Cmd: 2READ" "2READ"
810202-810223 spiflash: bit: "Address bits 23..16: 0x02" "Addr bits 23..16: 0x02" "Addr bits 23..16" "A23..A16"
810202-810223 spiflash: bit: "Address bits 15..8: 0x5c" "Addr bits 15..8: 0x5c" "Addr bits 15..8" "A15..A8"
810222-810243 spiflash: bit: "Address bits 7..0: 0x20" "Addr bits 7..0: 0x20" "Addr bits 7..0" "A7..A0"
810202-810243 spiflash: field: "Address: 0x025c20" "Addr: 0x025c20" "0x025c20"
810222-810243 spiflash: bit: "Dummy byte: 0x00"
810242-810563 spiflash: field: "Data (32 bytes)"
810182-810561 spiflash: 2read: "2x I/O read (addr 0x025c20, 32 bytes): fd 04 ed 05 87 62 0d 32 93 07 2d 0d 42 a0 00 52 a0 02 45 70 2c 32 1c 06 21 c7 eb f0 4f 20 20 23"
810679-810698 spiflash: field: "Command: 2x I/O read (2READ)" "Command: 2x I/O read" "Cmd: 2x I/O read" "Cmd: 2READ" "2READ"
810699-810718 spiflash: bit: "Address bits 23..16: 0x02" "Addr bits 23..16: 0x02" "Addr bits 23..16" "A23..A16"
810699-810718 spiflash: bit: "Address bits 15..8: 0x5c" "Addr bits 15..8: 0x5c" "Addr bits 15..8" "A15..A8"
810719-810738 spiflash: bit: "Address bits 7..0: 0x60" "Addr bits 7..0: 0x60" "Addr bits 7..0" "A7..A0"
810699-810738 spiflash: field: "Address: 0x025c60" "Addr: 0x025c60" "0x025c60"
810719-810738 spiflash: bit: "Dummy byte: 0x00"
810739-811058 spiflash: field: "Data (32 bytes)"
810679-811057 spiflash: 2read: "2x I/O read (addr 0x025c60, 32 bytes): 12 c1 f0 c9 21 cd 03 32 93 07 02 61 03 85 6c 2c 32 1c 06 66 02 0d 41 b7 eb 30 34 10 32 5c 06 46"
811450-811469 spiflash: field: "Command: 2x I/O read (2READ)" "Command: 2x I/O read" "Cmd: 2x I/O read" "Cmd: 2READ" "2READ"
811470-811489 spiflash: bit: "Address bits 23..16: 0x05" "Addr bits 23..16: 0x05" "Addr bits 23..16" "A23..A16"
811470-811489 spiflash: bit: "Address bits 15..8: 0x20" "Addr bits 15..8: 0x20" "Addr bits 15..8" "A15..A8"
811490-811509 spiflash: bit: "Address bits 7..0: 0xa0" "Addr bits 7..0: 0xa0" "Addr bits 7..0" "A7..A0"
811470-811509 spiflash: field: "Address: 0x0520a0" "Addr: 0x0520a0" "0x0520a0"
811490-811509 spiflash: bit: "Dummy byte: 0x00"
811510-811829 spiflash: field: "Data (32 bytes)"
811450-811829 spiflash: 2read: "2x I/O read (addr 0x0520a0, 32 bytes): 0d f0 00 00 30 30 74 4a 42 c6 01 00 52 02 00 37 15 06 1b 22 47 92 f4 0c 02 0d f0 00 5d 02 0c 02"
813240-813261 spiflash: field: "Command: 2x I/O read (2READ)" "Command: 2x I/O read" "Cmd: 2x I/O read" "Cmd: 2READ" "2READ"
813260-813281 spiflash: bit: "Address bits 23..16: 0x02" "Addr bits 23..16: 0x02" "Addr bits 23..16" "A23..A16"
813260-813281 spiflash: bit: "Address bits 15..8: 0x1c" "Addr bits 15..8: 0x1c" "Addr bits 15..8" "A15..A8"
813280-813301 spiflash: bit: "Address bits 7..0: 0x00" "Addr bits 7..0: 0x00" "Addr bits 7..0" "A7..A0"
813260-813301 spiflash: field: "Address: 0x021c00" "Addr: 0x021c00" "0x021c00"
813280-813301 spiflash: bit: "Dummy byte: 0x00"
813300-813621 spiflash: field: "Data (32 bytes)"
813240-813619 spiflash: 2read: "2x I/O read (addr 0x021c00, 32 bytes): 28 41 3d 0f 4d 01 5d 0d 6d 0e 05 bb ff 66 02 04 7c f2 86 13 00 28 41 58 4f 3d 0d 4d 0c c0 0e 00"
813815-813836 spiflash: field: "Command: 2x I/O read (2READ)" "Command: 2x I/O read" "Cmd: 2x I/O read" "Cmd: 2READ" "2READ"
813835-813856 spiflash: bit: "Address bits 23..16: 0x02" "Addr bits 23..16: 0x02" "Addr bits 23..16" "A23..A16"
813835-813856 spiflash: bit: "Address bits 15..8: 0x1c" "Addr bits 15..8: 0x1c" "Addr bits 15..8" "A15..A8"
813855-813876 spiflash: bit: "Address bits 7..0: 0x20" "Addr bits 7..0: 0x20" "Addr bits 7..0" "A7..A0"
813835-813876 spiflash: field: "Address: 0x021c20" "Addr: 0x021c20" "0x021c20"
813855-813876 spiflash: bit: "Dummy byte: 0x00"
813875-814196 spiflash: field: "Data (32 bytes)"
813815-814194 spiflash: 2read: "2x I/O read (addr 0x021c20, 32 bytes): 26 02 ec 28 0f 17 e2 0b 38 01 28 3f 37 a2 34 2d 03 c6 0b 00 0c 06 72 cf 19 06 06 00 00 28 41 4d"
816538-816557 spiflash: field: "Command: 2x I/O read (2READ)" "Command: 2x I/O read" "Cmd: 2x I/O read" "Cmd: 2READ" "2READ"
816558-816577 spiflash: bit: "Address bits 23..16: 0x02" "Addr bits 23..16: 0x02" "Addr bits 23..16" "A23..A16"
816558-816577 spiflash: bit: "Address bits 15..8: 0x1c" "Addr bits 15..8: 0x1c" "Addr bits 15..8" "A15..A8"
816578-816597 spiflash: bit: "Address bits 7..0: 0x60" "Addr bits 7..0: 0x60" "Addr bits 7..0" "A7..A0"
816558-816597 spiflash: field: "Address: 0x021c60" "Addr: 0x021c60" "0x021c60"
816578-816597 spiflash: bit: "Dummy byte: 0x00"
816598-816917 spiflash: field: "Data (32 bytes)"
816538-816917 spiflash: 2read: "2x I/O read (addr 0x021c60, 32 bytes): f1 ff 00 00 02 21 13 c2 21 12 d2 21 11 e2 21 10 f8 f1 12 c1 50 0d f0 00 12 c1 b0 29 01 28 23 c2"
940171-940192 spiflash: field: "Command: 2x I/O read (2READ)" "Command: 2x I/O read" "Cmd: 2x I/O read" "Cmd: 2READ" "2READ"
940191-940212 spiflash: bit: "Address bits 23..16: 0x02" "Addr bits 23..16: 0x02" "Addr bits 23..16" "A23..A16"
940191-940212 spiflash: bit: "Address bits 15..8: 0x1b" "Addr bits 15..8: 0x1b" "Addr bits 15..8" "A15..A8"
940211-940232 spiflash: bit: "Address bits 7..0: 0xc0" "Addr bits 7..0: 0xc0" "Addr bits 7..0" "A7..A0"
940191-940232 spiflash: field: "Address: 0x021bc0" "Addr: 0x021bc0" "0x021bc0"
940211-940232 spiflash: bit: "Dummy byte: 0x00"
940231-940552 spiflash: field: "Data (32 bytes)"
940171-940550 spiflash: 2read: "2x I/O read (addr 0x021bc0, 32 bytes): 07 28 16 06 03 00 00 00 00 27 23 04 2c 42 22 66 02 28 06 38 26 48 1f 3a 22 22 c2 fc c8 02 0c 03"
