773838-773859 spiflash: field: "Command: 2x I/O read (2READ)" "Command: 2x I/O read" "Cmd: 2x I/O read" "Cmd: 2READ" "2READ"
773858-773879 spiflash: bit: "Address bits 23..16: 0x06" "Addr bits 23..16: 0x06" "Addr bits 23..16" "A23..A16"
773858-773879 spiflash: bit: "Address bits 15..8: 0x9b" "Addr bits 15..8: 0x9b" "Addr bits 15..8" "A15..A8"
773878-773899 spiflash: bit: "Address bits 7..0: 0xc0" "Addr bits 7..0: 0xc0" "Addr bits 7..0" "A7..A0"
773858-773899 spiflash: field: "Address: 0x069bc0" "Addr: 0x069bc0" "0x069bc0"
773878-773899 spiflash: bit: "Dummy byte: 0x00"
773898-774219 spiflash: field: "Data (32 bytes)"
773838-774217 spiflash: 2read: "2x I/O read (addr 0x069bc0, 32 bytes): a"
774277-774298 spiflash: field: "Command: 2x I/O read (2READ)" "Command: 2x I/O read" "Cmd: 2x I/O read" "Cmd: 2READ" "2READ"
774297-774318 spiflash: bit: "Address bits 23..16: 0x06" "Addr bits 23..16: 0x06" "Addr bits 23..16" "A23..A16"
774297-774318 spiflash: bit: "Address bits 15..8: 0xa5" "Addr bits 15..8: 0xa5" "Addr bits 15..8" "A15..A8"
774317-774338 spiflash: bit: "Address bits 7..0: 0xc0" "Addr bits 7..0: 0xc0" "Addr bits 7..0" "A7..A0"
774297-774338 spiflash: field: "Address: 0x06a5c0" "Addr: 0x06a5c0" "0x06a5c0"
774317-774338 spiflash: bit: "Dummy byte: 0x00"
774337-774658 spiflash: field: "Data (32 bytes)"
774277-774656 spiflash: 2read: "2x I/O read (addr 0x06a5c0, 32 bytes): 3B0Ã³@00`!Â„Ã¿2ÃƒP3Â‚:"@#Â“Ã°ÃÃ Ã™"
774931-774950 spiflash: field: "Command: 2x I/O read (2READ)" "Command: 2x I/O read" "Cmd: 2x I/O read" "Cmd: 2READ" "2READ"
774951-774970 spiflash: bit: "Address bits 23..16: 0x06" "Addr bits 23..16: 0x06" "Addr bits 23..16" "A23..A16"
774951-774970 spiflash: bit: "Address bits 15..8: 0x72" "Addr bits 15..8: 0x72" "Addr bits 15..8" "A15..A8"
774971-774990 spiflash: bit: "Address bits 7..0: 0xa0" "Addr bits 7..0: 0xa0" "Addr bits 7..0" "A7..A0"
774951-774990 spiflash: field: "Address: 0x0672a0" "Addr: 0x0672a0" "0x0672a0"
774971-774990 spiflash: bit: "Dummy byte: 0x00"
774991-775310 spiflash: field: "Data (32 bytes)"
774931-775310 spiflash: 2read: "2x I/O read (addr 0x0672a0, 32 bytes):  EÂ˜Ãª  t!"
775337-775358 spiflash: field: "Command: 2x I/O read (2READ)" "Command: 2x I/O read" "Cmd: 2x I/O read" "Cmd: 2READ" "2READ"
775357-775378 spiflash: bit: "Address bits 23..16: 0x06" "Addr bits 23..16: 0x06" "Addr bits 23..16" "A23..A16"
775357-775378 spiflash: bit: "Address bits 15..8: 0x72" "Addr bits 15..8: 0x72" "Addr bits 15..8" "A15..A8"
775377-775398 spiflash: bit: "Address bits 7..0: 0xc0" "Addr bits 7..0: 0xc0" "Addr bits 7..0" "A7..A0"
775357-775398 spiflash: field: "Address: 0x0672c0" "Addr: 0x0672c0" "0x0672c0"
775377-775398 spiflash: bit: "Dummy byte: 0x00"
775397-775718 spiflash: field: "Data (32 bytes)"
775337-775716 spiflash: 2read: "2x I/O read (addr 0x0672c0, 32 bytes): p&Âƒ  tÃ°1Ã…Ã¿Ã€"*#"Ã°"
776110-776129 spiflash: field: "Command: 2x I/O read (2READ)" "Command: 2x I/O read" "Cmd: 2x I/O read" "Cmd: 2READ" "2READ"
776130-776149 spiflash: bit: "Address bits 23..16: 0x05" "Addr bits 23..16: 0x05" "Addr bits 23..16" "A23..A16"
776130-776149 spiflash: bit: "Address bits 15..8: 0xa5" "Addr bits 15..8: 0xa5" "Addr bits 15..8" "A15..A8"
776150-776169 spiflash: bit: "Address bits 7..0: 0xc0" "Addr bits 7..0: 0xc0" "Addr bits 7..0" "A7..A0"
776130-776169 spiflash: field: "Address: 0x05a5c0" "Addr: 0x05a5c0" "0x05a5c0"
776150-776169 spiflash: bit: "Dummy byte: 0x00"
776170-776489 spiflash: field: "Data (32 bytes)"
776110-776489 spiflash: 2read: "2x I/O read (addr 0x05a5c0, 32 bytes): 2"
777053-777074 spiflash: field: "Command: 2x I/O read (2READ)" "Command: 2x I/O read" "Cmd: 2x I/O read" "Cmd: 2READ" "2READ"
777073-777094 spiflash: bit: "Address bits 23..16: 0x05" "Addr bits 23..16: 0x05" "Addr bits 23..16" "A23..A16"
777073-777094 spiflash: bit: "Address bits 15..8: 0x72" "Addr bits 15..8: 0x72" "Addr bits 15..8" "A15..A8"
777093-777114 spiflash: bit: "Address bits 7..0: 0x60" "Addr bits 7..0: 0x60" "Addr bits 7..0" "A7..A0"
777073-777114 spiflash: field: "Address: 0x057260" "Addr: 0x057260" "0x057260"
777093-777114 spiflash: bit: "Dummy byte: 0x00"
777113-777433 spiflash: field: "Data (32 bytes)"
777053-777432 spiflash: 2read: "2x I/O read (addr 0x057260, 32 bytes): Ã©AÃ™1Ã­Ã˜Ã²Ã˜ÃÃšÃ¿Ã²ÃÃ_Ã€Ã…Ã¨Ã¦Â FÂŒ"
777952-777973 spiflash: field: "Command: 2x I/O read (2READ)" "Command: 2x I/O read" "Cmd: 2x I/O read" "Cmd: 2READ" "2READ"
777972-777993 spiflash: bit: "Address bits 23..16: 0x05" "Addr bits 23..16: 0x05" "Addr bits 23..16" "A23..A16"
777972-777993 spiflash: bit: "Address bits 15..8: 0x72" "Addr bits 15..8: 0x72" "Addr bits 15..8" "A15..A8"
777992-778013 spiflash: bit: "Address bits 7..0: 0xa0" "Addr bits 7..0: 0xa0" "Addr bits 7..0" "A7..A0"
777972-778013 spiflash: field: "Address: 0x0572a0" "Addr: 0x0572a0" "0x0572a0"
777992-778013 spiflash: bit: "Dummy byte: 0x00"
778012-778333 spiflash: field: "Data (32 bytes)"
777952-778331 spiflash: 2read: "2x I/O read (addr 0x0572a0, 32 bytes): \("Â…Ã¾Ã™<bÂ Ã"Lx 0t2L"
778385-778404 spiflash: field: "Command: 2x I/O read (2READ)" "Command: 2x I/O read" "Cmd: 2x I/O read" "Cmd: 2READ" "2READ"
778405-778424 spiflash: bit: "Address bits 23..16: 0x05" "Addr bits 23..16: 0x05" "Addr bits 23..16" "A23..A16"
778405-778424 spiflash: bit: "Address bits 15..8: 0x72" "Addr bits 15..8: 0x72" "Addr bits 15..8" "A15..A8"
778425-778444 spiflash: bit: "Address bits 7..0: 0xc0" "Addr bits 7..0: 0xc0" "Addr bits 7..0" "A7..A0"
778405-778444 spiflash: field: "Address: 0x0572c0" "Addr: 0x0572c0" "0x0572c0"
778425-778444 spiflash: bit: "Dummy byte: 0x00"
778445-778764 spiflash: field: "Data (32 bytes)"
778385-778764 spiflash: 2read: "2x I/O read (addr 0x0572c0, 32 bytes): }"
778799-778818 spiflash: field: "Command: 2x I/O read (2READ)" "Command: 2x I/O read" "Cmd: 2x I/O read" "Cmd: 2READ" "2READ"
778819-778838 spiflash: bit: "Address bits 23..16: 0x05" "Addr bits 23..16: 0x05" "Addr bits 23..16" "A23..A16"
778819-778838 spiflash: bit: "Address bits 15..8: 0x33" "Addr bits 15..8: 0x33" "Addr bits 15..8" "A15..A8"
778839-778858 spiflash: bit: "Address bits 7..0: 0x00" "Addr bits 7..0: 0x00" "Addr bits 7..0" "A7..A0"
778819-778858 spiflash: field: "Address: 0x053300" "Addr: 0x053300" "0x053300"
778839-778858 spiflash: bit: "Dummy byte: 0x00"
778859-779178 spiflash: field: "Data (32 bytes)"
778799-779177 spiflash: 2read: "2x I/O read (addr 0x053300, 32 bytes): Ã°Ã¿Ã€"
779230-779249 spiflash: field: "Command: 2x I/O read (2READ)" "Command: 2x I/O read" "Cmd: 2x I/O read" "Cmd: 2READ" "2READ"
779250-779269 spiflash: bit: "Address bits 23..16: 0x05" "Addr bits 23..16: 0x05" "Addr bits 23..16" "A23..A16"
779250-779269 spiflash: bit: "Address bits 15..8: 0x73" "Addr bits 15..8: 0x73" "Addr bits 15..8" "A15..A8"
779270-779289 spiflash: bit: "Address bits 7..0: 0x00" "Addr bits 7..0: 0x00" "Addr bits 7..0" "A7..A0"
779250-779289 spiflash: field: "Address: 0x057300" "Addr: 0x057300" "0x057300"
779270-779289 spiflash: bit: "Dummy byte: 0x00"
779290-779609 spiflash: field: "Data (32 bytes)"
779230-779609 spiflash: 2read: "2x I/O read (addr 0x057300, 32 bytes): "ÃŒFl"
780172-780193 spiflash: field: "Command: 2x I/O read (2READ)" "Command: 2x I/O read" "Cmd: 2x I/O read" "Cmd: 2READ" "2READ"
780192-780213 spiflash: bit: "Address bits 23..16: 0x05" "Addr bits 23..16: 0x05" "Addr bits 23..16" "A23..A16"
780192-780213 spiflash: bit: "Address bits 15..8: 0x75" "Addr bits 15..8: 0x75" "Addr bits 15..8" "A15..A8"
780212-780233 spiflash: bit: "Address bits 7..0: 0x00" "Addr bits 7..0: 0x00" "Addr bits 7..0" "A7..A0"
780192-780233 spiflash: field: "Address: 0x057500" "Addr: 0x057500" "0x057500"
780212-780233 spiflash: bit: "Dummy byte: 0x00"
780232-780552 spiflash: field: "Data (32 bytes)"
780172-780551 spiflash: 2read: "2x I/O read (addr 0x057500, 32 bytes): ÂŒ`Ã’"
780580-780601 spiflash: field: "Command: 2x I/O read (2READ)" "Command: 2x I/O read" "Cmd: 2x I/O read" "Cmd: 2READ" "2READ"
780600-780621 spiflash: bit: "Address bits 23..16: 0x05" "Addr bits 23..16: 0x05" "Addr bits 23..16" "A23..A16"
780600-780621 spiflash: bit: "Address bits 15..8: 0x75" "Addr bits 15..8: 0x75" "Addr bits 15..8" "A15..A8"
780620-780641 spiflash: bit: "Address bits 7..0: 0x20" "Addr bits 7..0: 0x20" "Addr bits 7..0" "A7..A0"
780600-780641 spiflash: field: "Address: 0x057520" "Addr: 0x057520" "0x057520"
780620-780641 spiflash: bit: "Dummy byte: 0x00"
780640-780961 spiflash: field: "Data (32 bytes)"
780580-780959 spiflash: 2read: "2x I/O read (addr 0x057520, 32 bytes): Ã·Â¾9Ã¼,iÂœ"
780990-781011 spiflash: field: "Command: 2x I/O read (2READ)" "Command: 2x I/O read" "Cmd: 2x I/O read" "Cmd: 2READ" "2READ"
781010-781031 spiflash: bit: "Address bits 23..16: 0x05" "Addr bits 23..16: 0x05" "Addr bits 23..16" "A23..A16"
781010-781031 spiflash: bit: "Address bits 15..8: 0x75" "Addr bits 15..8: 0x75" "Addr bits 15..8" "A15..A8"
781030-781051 spiflash: bit: "Address bits 7..0: 0x40" "Addr bits 7..0: 0x40" "Addr bits 7..0" "A7..A0"
781010-781051 spiflash: field: "Address: 0x057540" "Addr: 0x057540" "0x057540"
781030-781051 spiflash: bit: "Dummy byte: 0x00"
781050-781371 spiflash: field: "Data (32 bytes)"
780990-781369 spiflash: 2read: "2x I/O read (addr 0x057540, 32 bytes): Ã˜1Ã¨AÃ¸QÃ Ã°"Â†ÃÃ¿"
781735-781756 spiflash: field: "Command: 2x I/O read (2READ)" "Command: 2x I/O read" "Cmd: 2x I/O read" "Cmd: 2READ" "2READ"
781755-781776 spiflash: bit: "Address bits 23..16: 0x05" "Addr bits 23..16: 0x05" "Addr bits 23..16" "A23..A16"
781755-781776 spiflash: bit: "Address bits 15..8: 0x9c" "Addr bits 15..8: 0x9c" "Addr bits 15..8" "A15..A8"
781775-781796 spiflash: bit: "Address bits 7..0: 0x00" "Addr bits 7..0: 0x00" "Addr bits 7..0" "A7..A0"
781755-781796 spiflash: field: "Address: 0x059c00" "Addr: 0x059c00" "0x059c00"
781775-781796 spiflash: bit: "Dummy byte: 0x00"
781795-782116 spiflash: field: "Data (32 bytes)"
781735-782114 spiflash: 2read: "2x I/O read (addr 0x059c00, 32 bytes): "
782145-782166 spiflash: field: "Command: 2x I/O read (2READ)" "Command: 2x I/O read" "Cmd: 2x I/O read" "Cmd: 2READ" "2READ"
782165-782186 spiflash: bit: "Address bits 23..16: 0x05" "Addr bits 23..16: 0x05" "Addr bits 23..16" "A23..A16"
782165-782186 spiflash: bit: "Address bits 15..8: 0x9b" "Addr bits 15..8: 0x9b" "Addr bits 15..8" "A15..A8"
782185-782206 spiflash: bit: "Address bits 7..0: 0xc0" "Addr bits 7..0: 0xc0" "Addr bits 7..0" "A7..A0"
782165-782206 spiflash: field: "Address: 0x059bc0" "Addr: 0x059bc0" "0x059bc0"
782185-782206 spiflash: bit: "Dummy byte: 0x00"
782205-782526 spiflash: field: "Data (32 bytes)"
782145-782524 spiflash: 2read: "2x I/O read (addr 0x059bc0, 32 bytes): UÂŒ#Ã°PPtWÂ–Ã¬Ã°"
782559-782578 spiflash: field: "Command: 2x I/O read (2READ)" "Command: 2x I/O read" "Cmd: 2x I/O read" "Cmd: 2READ" "2READ"
782579-782598 spiflash: bit: "Address bits 23..16: 0x05" "Addr bits 23..16: 0x05" "Addr bits 23..16" "A23..A16"
782579-782598 spiflash: bit: "Address bits 15..8: 0x9c" "Addr bits 15..8: 0x9c" "Addr bits 15..8" "A15..A8"
782599-782618 spiflash: bit: "Address bits 7..0: 0x20" "Addr bits 7..0: 0x20" "Addr bits 7..0" "A7..A0"
782579-782618 spiflash: field: "Address: 0x059c20" "Addr: 0x059c20" "0x059c20"
782599-782618 spiflash: bit: "Dummy byte: 0x00"
782619-782938 spiflash: field: "Data (32 bytes)"
782559-782938 spiflash: 2read: "2x I/O read (addr 0x059c20, 32 bytes): bÂ€D`D Â€DbR"
783184-783203 spiflash: field: "Command: 2x I/O read (2READ)" "Command: 2x I/O read" "Cmd: 2x I/O read" "Cmd: 2READ" "2READ"
783204-783223 spiflash: bit: "Address bits 23..16: 0x05" "Addr bits 23..16: 0x05" "Addr bits 23..16" "A23..A16"
783204-783223 spiflash: bit: "Address bits 15..8: 0x9c" "Addr bits 15..8: 0x9c" "Addr bits 15..8" "A15..A8"
783224-783243 spiflash: bit: "Address bits 7..0: 0x60" "Addr bits 7..0: 0x60" "Addr bits 7..0" "A7..A0"
783204-783243 spiflash: field: "Address: 0x059c60" "Addr: 0x059c60" "0x059c60"
783224-783243 spiflash: bit: "Dummy byte: 0x00"
783244-783563 spiflash: field: "Data (32 bytes)"
783184-783563 spiflash: 2read: "2x I/O read (addr 0x059c60, 32 bytes): Ã£Ã¾! Ã©2!BÂ 2ÃƒR5Ã€"
784825-784846 spiflash: field: "Command: 2x I/O read (2READ)" "Command: 2x I/O read" "Cmd: 2x I/O read" "Cmd: 2READ" "2READ"
784845-784866 spiflash: bit: "Address bits 23..16: 0x03" "Addr bits 23..16: 0x03" "Addr bits 23..16" "A23..A16"
784845-784866 spiflash: bit: "Address bits 15..8: 0x32" "Addr bits 15..8: 0x32" "Addr bits 15..8" "A15..A8"
784865-784886 spiflash: bit: "Address bits 7..0: 0x60" "Addr bits 7..0: 0x60" "Addr bits 7..0" "A7..A0"
784845-784886 spiflash: field: "Address: 0x033260" "Addr: 0x033260" "0x033260"
784865-784886 spiflash: bit: "Dummy byte: 0x00"
784885-785206 spiflash: field: "Data (32 bytes)"
784825-785204 spiflash: 2read: "2x I/O read (addr 0x033260, 32 bytes): "
785480-785501 spiflash: field: "Command: 2x I/O read (2READ)" "Command: 2x I/O read" "Cmd: 2x I/O read" "Cmd: 2READ" "2READ"
785500-785521 spiflash: bit: "Address bits 23..16: 0x05" "Addr bits 23..16: 0x05" "Addr bits 23..16" "A23..A16"
785500-785521 spiflash: bit: "Address bits 15..8: 0xa0" "Addr bits 15..8: 0xa0" "Addr bits 15..8" "A15..A8"
785520-785541 spiflash: bit: "Address bits 7..0: 0xa0" "Addr bits 7..0: 0xa0" "Addr bits 7..0" "A7..A0"
785500-785541 spiflash: field: "Address: 0x05a0a0" "Addr: 0x05a0a0" "0x05a0a0"
785520-785541 spiflash: bit: "Dummy byte: 0x00"
785540-785861 spiflash: field: "Data (32 bytes)"
785480-785859 spiflash: 2read: "2x I/O read (addr 0x05a0a0, 32 bytes): ÃœÃ²BEPD BMÃ‚!Ã’!Ã¢!Ã²!!Ã"
786128-786147 spiflash: field: "Command: 2x I/O read (2READ)" "Command: 2x I/O read" "Cmd: 2x I/O read" "Cmd: 2READ" "2READ"
786148-786167 spiflash: bit: "Address bits 23..16: 0x02" "Addr bits 23..16: 0x02" "Addr bits 23..16" "A23..A16"
786148-786167 spiflash: bit: "Address bits 15..8: 0x75" "Addr bits 15..8: 0x75" "Addr bits 15..8" "A15..A8"
786168-786187 spiflash: bit: "Address bits 7..0: 0x00" "Addr bits 7..0: 0x00" "Addr bits 7..0" "A7..A0"
786148-786187 spiflash: field: "Address: 0x027500" "Addr: 0x027500" "0x027500"
786168-786187 spiflash: bit: "Dummy byte: 0x00"
786188-786507 spiflash: field: "Data (32 bytes)"
786128-786507 spiflash: 2read: "2x I/O read (addr 0x027500, 32 bytes): Ã°"
786538-786557 spiflash: field: "Command: 2x I/O read (2READ)" "Command: 2x I/O read" "Cmd: 2x I/O read" "Cmd: 2READ" "2READ"
786558-786577 spiflash: bit: "Address bits 23..16: 0x02" "Addr bits 23..16: 0x02" "Addr bits 23..16" "A23..A16"
786558-786577 spiflash: bit: "Address bits 15..8: 0x75" "Addr bits 15..8: 0x75" "Addr bits 15..8" "A15..A8"
786578-786597 spiflash: bit: "Address bits 7..0: 0x20" "Addr bits 7..0: 0x20" "Addr bits 7..0" "A7..A0"
786558-786597 spiflash: field: "Address: 0x027520" "Addr: 0x027520" "0x027520"
786578-786597 spiflash: bit: "Dummy byte: 0x00"
786598-786919 spiflash: field: "Data (32 bytes)"
786538-786917 spiflash: 2read: "2x I/O read (addr 0x027520, 32 bytes): Ã¬Ã¥YAiQÂ…ÃÃ¿XAhQf(=MÃ³Ã¿Ã€"
786943-786964 spiflash: field: "Command: 2x I/O read (2READ)" "Command: 2x I/O read" "Cmd: 2x I/O read" "Cmd: 2READ" "2READ"
786963-786982 spiflash: bit: "Address bits 23..16: 0x02" "Addr bits 23..16: 0x02" "Addr bits 23..16" "A23..A16"
786963-786982 spiflash: bit: "Address bits 15..8: 0x73" "Addr bits 15..8: 0x73" "Addr bits 15..8" "A15..A8"
786983-787004 spiflash: bit: "Address bits 7..0: 0x00" "Addr bits 7..0: 0x00" "Addr bits 7..0" "A7..A0"
786963-787004 spiflash: field: "Address: 0x027300" "Addr: 0x027300" "0x027300"
786983-787004 spiflash: bit: "Dummy byte: 0x00"
787003-787324 spiflash: field: "Data (32 bytes)"
786943-787322 spiflash: 2read: "2x I/O read (addr 0x027300, 32 bytes): 1Â¤Ã¾Ã€ "
787387-787406 spiflash: field: "Command: 2x I/O read (2READ)" "Command: 2x I/O read" "Cmd: 2x I/O read" "Cmd: 2READ" "2READ"
787407-787426 spiflash: bit: "Address bits 23..16: 0x02" "Addr bits 23..16: 0x02" "Addr bits 23..16" "A23..A16"
787407-787426 spiflash: bit: "Address bits 15..8: 0x75" "Addr bits 15..8: 0x75" "Addr bits 15..8" "A15..A8"
787427-787446 spiflash: bit: "Address bits 7..0: 0x40" "Addr bits 7..0: 0x40" "Addr bits 7..0" "A7..A0"
787407-787446 spiflash: field: "Address: 0x027540" "Addr: 0x027540" "0x027540"
787427-787446 spiflash: bit: "Dummy byte: 0x00"
787447-787766 spiflash: field: "Data (32 bytes)"
787387-787766 spiflash: 2read: "2x I/O read (addr 0x027540, 32 bytes): (=MÃ¯Ã¿Ã€"
790114-790135 spiflash: field: "Command: 2x I/O read (2READ)" "Command: 2x I/O read" "Cmd: 2x I/O read" "Cmd: 2READ" "2READ"
790134-790155 spiflash: bit: "Address bits 23..16: 0x05" "Addr bits 23..16: 0x05" "Addr bits 23..16" "A23..A16"
790134-790155 spiflash: bit: "Address bits 15..8: 0x1c" "Addr bits 15..8: 0x1c" "Addr bits 15..8" "A15..A8"
790154-790175 spiflash: bit: "Address bits 7..0: 0x60" "Addr bits 7..0: 0x60" "Addr bits 7..0" "A7..A0"
790134-790175 spiflash: field: "Address: 0x051c60" "Addr: 0x051c60" "0x051c60"
790154-790175 spiflash: bit: "Dummy byte: 0x00"
790174-790494 spiflash: field: "Data (32 bytes)"
790114-790493 spiflash: 2read: "2x I/O read (addr 0x051c60, 32 bytes): ÃÃ°Â¥	1Â…oÃ‘1ÃÃ°"
790517-790538 spiflash: field: "Command: 2x I/O read (2READ)" "Command: 2x I/O read" "Cmd: 2x I/O read" "Cmd: 2READ" "2READ"
790537-790558 spiflash: bit: "Address bits 23..16: 0x05" "Addr bits 23..16: 0x05" "Addr bits 23..16" "A23..A16"
790537-790558 spiflash: bit: "Address bits 15..8: 0x1c" "Addr bits 15..8: 0x1c" "Addr bits 15..8" "A15..A8"
790557-790578 spiflash: bit: "Address bits 7..0: 0x80" "Addr bits 7..0: 0x80" "Addr bits 7..0" "A7..A0"
790537-790578 spiflash: field: "Address: 0x051c80" "Addr: 0x051c80" "0x051c80"
790557-790578 spiflash: bit: "Dummy byte: 0x00"
790577-790898 spiflash: field: "Data (32 bytes)"
790517-790896 spiflash: 2read: "2x I/O read (addr 0x051c80, 32 bytes): 0C =	1EÃªÃ“1ÃÃ°"
790927-790948 spiflash: field: "Command: 2x I/O read (2READ)" "Command: 2x I/O read" "Cmd: 2x I/O read" "Cmd: 2READ" "2READ"
790947-790968 spiflash: bit: "Address bits 23..16: 0x02" "Addr bits 23..16: 0x02" "Addr bits 23..16" "A23..A16"
790947-790968 spiflash: bit: "Address bits 15..8: 0x5b" "Addr bits 15..8: 0x5b" "Addr bits 15..8" "A15..A8"
790967-790988 spiflash: bit: "Address bits 7..0: 0x20" "Addr bits 7..0: 0x20" "Addr bits 7..0" "A7..A0"
790947-790988 spiflash: field: "Address: 0x025b20" "Addr: 0x025b20" "0x025b20"
790967-790988 spiflash: bit: "Dummy byte: 0x00"
790987-791308 spiflash: field: "Data (32 bytes)"
790927-791306 spiflash: 2read: "2x I/O read (addr 0x025b20, 32 bytes): 5ÃµÃ°Ã°"
791330-791349 spiflash: field: "Command: 2x I/O read (2READ)" "Command: 2x I/O read" "Cmd: 2x I/O read" "Cmd: 2READ" "2READ"
791350-791369 spiflash: bit: "Address bits 23..16: 0x02" "Addr bits 23..16: 0x02" "Addr bits 23..16" "A23..A16"
791350-791369 spiflash: bit: "Address bits 15..8: 0x5b" "Addr bits 15..8: 0x5b" "Addr bits 15..8" "A15..A8"
791370-791389 spiflash: bit: "Address bits 7..0: 0x40" "Addr bits 7..0: 0x40" "Addr bits 7..0" "A7..A0"
791350-791389 spiflash: field: "Address: 0x025b40" "Addr: 0x025b40" "0x025b40"
791370-791389 spiflash: bit: "Dummy byte: 0x00"
791390-791709 spiflash: field: "Data (32 bytes)"
791330-791708 spiflash: 2read: "2x I/O read (addr 0x025b40, 32 bytes): ÃÂŒÂ‚MÃ¢Ã©Ã€"
792063-792084 spiflash: field: "Command: 2x I/O read (2READ)" "Command: 2x I/O read" "Cmd: 2x I/O read" "Cmd: 2READ" "2READ"
792083-792104 spiflash: bit: "Address bits 23..16: 0x06" "Addr bits 23..16: 0x06" "Addr bits 23..16" "A23..A16"
792083-792104 spiflash: bit: "Address bits 15..8: 0x90" "Addr bits 15..8: 0x90" "Addr bits 15..8" "A15..A8"
792103-792124 spiflash: bit: "Address bits 7..0: 0x60" "Addr bits 7..0: 0x60" "Addr bits 7..0" "A7..A0"
792083-792124 spiflash: field: "Address: 0x069060" "Addr: 0x069060" "0x069060"
792103-792124 spiflash: bit: "Dummy byte: 0x00"
792123-792444 spiflash: field: "Data (32 bytes)"
792063-792442 spiflash: 2read: "2x I/O read (addr 0x069060, 32 bytes): T@Ã˜6@"Â (2Â ÃÃ Ã¹aÃ©QÃ™AÃ‰1	!EÂ•Â½"
795564-795583 spiflash: field: "Command: 2x I/O read (2READ)" "Command: 2x I/O read" "Cmd: 2x I/O read" "Cmd: 2READ" "2READ"
795584-795603 spiflash: bit: "Address bits 23..16: 0x02" "Addr bits 23..16: 0x02" "Addr bits 23..16" "A23..A16"
795584-795603 spiflash: bit: "Address bits 15..8: 0x72" "Addr bits 15..8: 0x72" "Addr bits 15..8" "A15..A8"
795604-795623 spiflash: bit: "Address bits 7..0: 0x60" "Addr bits 7..0: 0x60" "Addr bits 7..0" "A7..A0"
795584-795623 spiflash: field: "Address: 0x027260" "Addr: 0x027260" "0x027260"
795604-795623 spiflash: bit: "Dummy byte: 0x00"
795624-795943 spiflash: field: "Data (32 bytes)"
795564-795943 spiflash: 2read: "2x I/O read (addr 0x027260, 32 bytes): 3Ã€ "
797415-797436 spiflash: field: "Command: 2x I/O read (2READ)" "Command: 2x I/O read" "Cmd: 2x I/O read" "Cmd: 2READ" "2READ"
797435-797456 spiflash: bit: "Address bits 23..16: 0x02" "Addr bits 23..16: 0x02" "Addr bits 23..16" "A23..A16"
797435-797456 spiflash: bit: "Address bits 15..8: 0xbe" "Addr bits 15..8: 0xbe" "Addr bits 15..8" "A15..A8"
797455-797476 spiflash: bit: "Address bits 7..0: 0x60" "Addr bits 7..0: 0x60" "Addr bits 7..0" "A7..A0"
797435-797476 spiflash: field: "Address: 0x02be60" "Addr: 0x02be60" "0x02be60"
797455-797476 spiflash: bit: "Dummy byte: 0x00"
797475-797796 spiflash: field: "Data (32 bytes)"
797415-797794 spiflash: 2read: "2x I/O read (addr 0x02be60, 32 bytes): 2!(Â…Â¿f XÃ¨Ã˜%-Ã¸5Ã©hÃÃ€"
797821-797842 spiflash: field: "Command: 2x I/O read (2READ)" "Command: 2x I/O read" "Cmd: 2x I/O read" "Cmd: 2READ" "2READ"
797841-797862 spiflash: bit: "Address bits 23..16: 0x02" "Addr bits 23..16: 0x02" "Addr bits 23..16" "A23..A16"
797841-797862 spiflash: bit: "Address bits 15..8: 0xbe" "Addr bits 15..8: 0xbe" "Addr bits 15..8" "A15..A8"
797861-797882 spiflash: bit: "Address bits 7..0: 0x80" "Addr bits 7..0: 0x80" "Addr bits 7..0" "A7..A0"
797841-797882 spiflash: field: "Address: 0x02be80" "Addr: 0x02be80" "0x02be80"
797861-797882 spiflash: bit: "Dummy byte: 0x00"
797881-798202 spiflash: field: "Data (32 bytes)"
797821-798200 spiflash: 2read: "2x I/O read (addr 0x02be80, 32 bytes): Ã±Ã¿-Ã€"
798498-798517 spiflash: field: "Command: 2x I/O read (2READ)" "Command: 2x I/O read" "Cmd: 2x I/O read" "Cmd: 2READ" "2READ"
798518-798537 spiflash: bit: "Address bits 23..16: 0x02" "Addr bits 23..16: 0x02" "Addr bits 23..16" "A23..A16"
798518-798537 spiflash: bit: "Address bits 15..8: 0xaa" "Addr bits 15..8: 0xaa" "Addr bits 15..8" "A15..A8"
798538-798557 spiflash: bit: "Address bits 7..0: 0x60" "Addr bits 7..0: 0x60" "Addr bits 7..0" "A7..A0"
798518-798557 spiflash: field: "Address: 0x02aa60" "Addr: 0x02aa60" "0x02aa60"
798538-798557 spiflash: bit: "Dummy byte: 0x00"
798558-798877 spiflash: field: "Data (32 bytes)"
798498-798876 spiflash: 2read: "2x I/O read (addr 0x02aa60, 32 bytes):  Ã°"
798986-799007 spiflash: field: "Command: 2x I/O read (2READ)" "Command: 2x I/O read" "Cmd: 2x I/O read" "Cmd: 2READ" "2READ"
799006-799027 spiflash: bit: "Address bits 23..16: 0x02" "Addr bits 23..16: 0x02" "Addr bits 23..16" "A23..A16"
799006-799027 spiflash: bit: "Address bits 15..8: 0xaa" "Addr bits 15..8: 0xaa" "Addr bits 15..8" "A15..A8"
799026-799047 spiflash: bit: "Address bits 7..0: 0x80" "Addr bits 7..0: 0x80" "Addr bits 7..0" "A7..A0"
799006-799047 spiflash: field: "Address: 0x02aa80" "Addr: 0x02aa80" "0x02aa80"
799026-799047 spiflash: bit: "Dummy byte: 0x00"
799046-799367 spiflash: field: "Data (32 bytes)"
798986-799365 spiflash: 2read: "2x I/O read (addr 0x02aa80, 32 bytes): Â…Â–Ã¿1ÃÃ°"
799899-799918 spiflash: field: "Command: 2x I/O read (2READ)" "Command: 2x I/O read" "Cmd: 2x I/O read" "Cmd: 2READ" "2READ"
799919-799938 spiflash: bit: "Address bits 23..16: 0x02" "Addr bits 23..16: 0x02" "Addr bits 23..16" "A23..A16"
799919-799938 spiflash: bit: "Address bits 15..8: 0xbe" "Addr bits 15..8: 0xbe" "Addr bits 15..8" "A15..A8"
799939-799958 spiflash: bit: "Address bits 7..0: 0x40" "Addr bits 7..0: 0x40" "Addr bits 7..0" "A7..A0"
799919-799958 spiflash: field: "Address: 0x02be40" "Addr: 0x02be40" "0x02be40"
799939-799958 spiflash: bit: "Dummy byte: 0x00"
799959-800280 spiflash: field: "Data (32 bytes)"
799899-800278 spiflash: 2read: "2x I/O read (addr 0x02be40, 32 bytes): ÂÃ¹q)9XÃŒÃ•(8MÃ…Ã€Ã†"
800312-800331 spiflash: field: "Command: 2x I/O read (2READ)" "Command: 2x I/O read" "Cmd: 2x I/O read" "Cmd: 2READ" "2READ"
800332-800351 spiflash: bit: "Address bits 23..16: 0x02" "Addr bits 23..16: 0x02" "Addr bits 23..16" "A23..A16"
800332-800351 spiflash: bit: "Address bits 15..8: 0xea" "Addr bits 15..8: 0xea" "Addr bits 15..8" "A15..A8"
800352-800371 spiflash: bit: "Address bits 7..0: 0x60" "Addr bits 7..0: 0x60" "Addr bits 7..0" "A7..A0"
800332-800371 spiflash: field: "Address: 0x02ea60" "Addr: 0x02ea60" "0x02ea60"
800352-800371 spiflash: bit: "Dummy byte: 0x00"
800372-800691 spiflash: field: "Data (32 bytes)"
800312-800690 spiflash: 2read: "2x I/O read (addr 0x02ea60, 32 bytes): ÃÃÃ’a	ÃÃ‰Â¡Ã©ÂÃ¹q	Â±ÃÃ­0Ã‘ÂƒÃ…aÃ¸Ã½Â¬Ã¬Â£"
800895-800916 spiflash: field: "Command: 2x I/O read (2READ)" "Command: 2x I/O read" "Cmd: 2x I/O read" "Cmd: 2READ" "2READ"
800915-800936 spiflash: bit: "Address bits 23..16: 0x02" "Addr bits 23..16: 0x02" "Addr bits 23..16" "A23..A16"
800915-800936 spiflash: bit: "Address bits 15..8: 0xea" "Addr bits 15..8: 0xea" "Addr bits 15..8" "A15..A8"
800935-800956 spiflash: bit: "Address bits 7..0: 0x80" "Addr bits 7..0: 0x80" "Addr bits 7..0" "A7..A0"
800915-800956 spiflash: field: "Address: 0x02ea80" "Addr: 0x02ea80" "0x02ea80"
800935-800956 spiflash: bit: "Dummy byte: 0x00"
800955-801276 spiflash: field: "Data (32 bytes)"
800895-801274 spiflash: 2read: "2x I/O read (addr 0x02ea80, 32 bytes): -Ã“Ã‡Ã€"
804204-804225 spiflash: field: "Command: 2x I/O read (2READ)" "Command: 2x I/O read" "Cmd: 2x I/O read" "Cmd: 2READ" "2READ"
804224-804245 spiflash: bit: "Address bits 23..16: 0x02" "Addr bits 23..16: 0x02" "Addr bits 23..16" "A23..A16"
804224-804245 spiflash: bit: "Address bits 15..8: 0x65" "Addr bits 15..8: 0x65" "Addr bits 15..8" "A15..A8"
804244-804265 spiflash: bit: "Address bits 7..0: 0xc0" "Addr bits 7..0: 0xc0" "Addr bits 7..0" "A7..A0"
804224-804265 spiflash: field: "Address: 0x0265c0" "Addr: 0x0265c0" "0x0265c0"
804244-804265 spiflash: bit: "Dummy byte: 0x00"
804264-804585 spiflash: field: "Data (32 bytes)"
804204-804583 spiflash: 2read: "2x I/O read (addr 0x0265c0, 32 bytes): Ã·Â¥Â…!Ã‘Ã¾"Ã¹Ã†ÃÃ¿1ÂÃ¾Ã½:!Ã…uAÃ¾J!Ã…Â©Q"
805344-805365 spiflash: field: "Command: 2x I/O read (2READ)" "Command: 2x I/O read" "Cmd: 2x I/O read" "Cmd: 2READ" "2READ"
805364-805385 spiflash: bit: "Address bits 23..16: 0x03" "Addr bits 23..16: 0x03" "Addr bits 23..16" "A23..A16"
805364-805385 spiflash: bit: "Address bits 15..8: 0x7e" "Addr bits 15..8: 0x7e" "Addr bits 15..8" "A15..A8"
805384-805405 spiflash: bit: "Address bits 7..0: 0x80" "Addr bits 7..0: 0x80" "Addr bits 7..0" "A7..A0"
805364-805405 spiflash: field: "Address: 0x037e80" "Addr: 0x037e80" "0x037e80"
805384-805405 spiflash: bit: "Dummy byte: 0x00"
805404-805725 spiflash: field: "Data (32 bytes)"
805344-805723 spiflash: 2read: "2x I/O read (addr 0x037e80, 32 bytes): fÃ¡-Ã¾Â’Ã½Fw"
807255-807274 spiflash: field: "Command: 2x I/O read (2READ)" "Command: 2x I/O read" "Cmd: 2x I/O read" "Cmd: 2READ" "2READ"
807275-807294 spiflash: bit: "Address bits 23..16: 0x02" "Addr bits 23..16: 0x02" "Addr bits 23..16" "A23..A16"
807275-807294 spiflash: bit: "Address bits 15..8: 0x60" "Addr bits 15..8: 0x60" "Addr bits 15..8" "A15..A8"
807295-807314 spiflash: bit: "Address bits 7..0: 0xa0" "Addr bits 7..0: 0xa0" "Addr bits 7..0" "A7..A0"
807275-807314 spiflash: field: "Address: 0x0260a0" "Addr: 0x0260a0" "0x0260a0"
807295-807314 spiflash: bit: "Dummy byte: 0x00"
807315-807634 spiflash: field: "Data (32 bytes)"
807255-807633 spiflash: 2read: "2x I/O read (addr 0x0260a0, 32 bytes): Â¬"
808310-808329 spiflash: field: "Command: 2x I/O read (2READ)" "Command: 2x I/O read" "Cmd: 2x I/O read" "Cmd: 2READ" "2READ"
808330-808349 spiflash: bit: "Address bits 23..16: 0x02" "Addr bits 23..16: 0x02" "Addr bits 23..16" "A23..A16"
808330-808349 spiflash: bit: "Address bits 15..8: 0x35" "Addr bits 15..8: 0x35" "Addr bits 15..8" "A15..A8"
808350-808369 spiflash: bit: "Address bits 7..0: 0x00" "Addr bits 7..0: 0x00" "Addr bits 7..0" "A7..A0"
808330-808369 spiflash: field: "Address: 0x023500" "Addr: 0x023500" "0x023500"
808350-808369 spiflash: bit: "Dummy byte: 0x00"
808370-808689 spiflash: field: "Data (32 bytes)"
808310-808688 spiflash: 2read: "2x I/O read (addr 0x023500, 32 bytes): !7Ãµ'ÂœÃˆ"
808731-808750 spiflash: field: "Command: 2x I/O read (2READ)" "Command: 2x I/O read" "Cmd: 2x I/O read" "Cmd: 2READ" "2READ"
808751-808770 spiflash: bit: "Address bits 23..16: 0x02" "Addr bits 23..16: 0x02" "Addr bits 23..16" "A23..A16"
808751-808770 spiflash: bit: "Address bits 15..8: 0x35" "Addr bits 15..8: 0x35" "Addr bits 15..8" "A15..A8"
808771-808790 spiflash: bit: "Address bits 7..0: 0x20" "Addr bits 7..0: 0x20" "Addr bits 7..0" "A7..A0"
808751-808790 spiflash: field: "Address: 0x023520" "Addr: 0x023520" "0x023520"
808771-808790 spiflash: bit: "Dummy byte: 0x00"
808791-809110 spiflash: field: "Data (32 bytes)"
808731-809110 spiflash: 2read: "2x I/O read (addr 0x023520, 32 bytes): (l),"7b",R2Âœ!0ÃµÃ Ã t C@@Ã´Âœ"
809158-809179 spiflash: field: "Command: 2x I/O read (2READ)" "Command: 2x I/O read" "Cmd: 2x I/O read" "Cmd: 2READ" "2READ"
809178-809199 spiflash: bit: "Address bits 23..16: 0x02" "Addr bits 23..16: 0x02" "Addr bits 23..16" "A23..A16"
809178-809199 spiflash: bit: "Address bits 15..8: 0x35" "Addr bits 15..8: 0x35" "Addr bits 15..8" "A15..A8"
809198-809219 spiflash: bit: "Address bits 7..0: 0x40" "Addr bits 7..0: 0x40" "Addr bits 7..0" "A7..A0"
809178-809219 spiflash: field: "Address: 0x023540" "Addr: 0x023540" "0x023540"
809198-809219 spiflash: bit: "Dummy byte: 0x00"
809218-809538 spiflash: field: "Data (32 bytes)"
809158-809537 spiflash: 2read: "2x I/O read (addr 0x023540, 32 bytes): $Â†"
809780-809799 spiflash: field: "Command: 2x I/O read (2READ)" "Command: 2x I/O read" "Cmd: 2x I/O read" "Cmd: 2READ" "2READ"
809800-809819 spiflash: bit: "Address bits 23..16: 0x02" "Addr bits 23..16: 0x02" "Addr bits 23..16" "A23..A16"
809800-809819 spiflash: bit: "Address bits 15..8: 0x5c" "Addr bits 15..8: 0x5c" "Addr bits 15..8" "A15..A8"
809820-809839 spiflash: bit: "Address bits 7..0: 0x00" "Addr bits 7..0: 0x00" "Addr bits 7..0" "A7..A0"
809800-809839 spiflash: field: "Address: 0x025c00" "Addr: 0x025c00" "0x025c00"
809820-809839 spiflash: bit: "Dummy byte: 0x00"
809840-810159 spiflash: field: "Data (32 bytes)"
809780-810159 spiflash: 2read: "2x I/O read (addr 0x025c00, 32 bytes): ÃÃ°"
810182-810203 spiflash: field: "Command: 2x I/O read (2READ)" "Command: 2x I/O read" "Cmd: 2x I/O read" "Cmd: 2READ" "2READ"
810202-810223 spiflash: bit: "Address bits 23..16: 0x02" "Addr bits 23..16: 0x02" "Addr bits 23..16" "A23..A16"
810202-810223 spiflash: bit: "Address bits 15..8: 0x5c" "Addr bits 15..8: 0x5c" "Addr bits 15..8" "A15..A8"
810222-810243 spiflash: bit: "Address bits 7..0: 0x20" "Addr bits 7..0: 0x20" "Addr bits 7..0" "A7..A0"
810202-810243 spiflash: field: "Address: 0x025c20" "Addr: 0x025c20" "0x025c20"
810222-810243 spiflash: bit: "Dummy byte: 0x00"
810242-810563 spiflash: field: "Data (32 bytes)"
810182-810561 spiflash: 2read: "2x I/O read (addr 0x025c20, 32 bytes): Ã½Ã­Â‡b2Â“-BÂ "
810679-810698 spiflash: field: "Command: 2x I/O read (2READ)" "Command: 2x I/O read" "Cmd: 2x I/O read" "Cmd: 2READ" "2READ"
810699-810718 spiflash: bit: "Address bits 23..16: 0x02" "Addr bits 23..16: 0x02" "Addr bits 23..16" "A23..A16"
810699-810718 spiflash: bit: "Address bits 15..8: 0x5c" "Addr bits 15..8: 0x5c" "Addr bits 15..8" "A15..A8"
810719-810738 spiflash: bit: "Address bits 7..0: 0x60" "Addr bits 7..0: 0x60" "Addr bits 7..0" "A7..A0"
810699-810738 spiflash: field: "Address: 0x025c60" "Addr: 0x025c60" "0x025c60"
810719-810738 spiflash: bit: "Dummy byte: 0x00"
810739-811058 spiflash: field: "Data (32 bytes)"
810679-811057 spiflash: 2read: "2x I/O read (addr 0x025c60, 32 bytes): ÃÃ°Ã‰!Ã2Â“aÂ…l,2fAÂ·Ã«042\F"
811450-811469 spiflash: field: "Command: 2x I/O read (2READ)" "Command: 2x I/O read" "Cmd: 2x I/O read" "Cmd: 2READ" "2READ"
811470-811489 spiflash: bit: "Address bits 23..16: 0x05" "Addr bits 23..16: 0x05" "Addr bits 23..16" "A23..A16"
811470-811489 spiflash: bit: "Address bits 15..8: 0x20" "Addr bits 15..8: 0x20" "Addr bits 15..8" "A15..A8"
811490-811509 spiflash: bit: "Address bits 7..0: 0xa0" "Addr bits 7..0: 0xa0" "Addr bits 7..0" "A7..A0"
811470-811509 spiflash: field: "Address: 0x0520a0" "Addr: 0x0520a0" "0x0520a0"
811490-811509 spiflash: bit: "Dummy byte: 0x00"
811510-811829 spiflash: field: "Data (32 bytes)"
811450-811829 spiflash: 2read: "2x I/O read (addr 0x0520a0, 32 bytes): Ã°"
813240-813261 spiflash: field: "Command: 2x I/O read (2READ)" "Command: 2x I/O read" "Cmd: 2x I/O read" "Cmd: 2READ" "2READ"
813260-813281 spiflash: bit: "Address bits 23..16: 0x02" "Addr bits 23..16: 0x02" "Addr bits 23..16" "A23..A16"
813260-813281 spiflash: bit: "Address bits 15..8: 0x1c" "Addr bits 15..8: 0x1c" "Addr bits 15..8" "A15..A8"
813280-813301 spiflash: bit: "Address bits 7..0: 0x00" "Addr bits 7..0: 0x00" "Addr bits 7..0" "A7..A0"
813260-813301 spiflash: field: "Address: 0x021c00" "Addr: 0x021c00" "0x021c00"
813280-813301 spiflash: bit: "Dummy byte: 0x00"
813300-813621 spiflash: field: "Data (32 bytes)"
813240-813619 spiflash: 2read: "2x I/O read (addr 0x021c00, 32 bytes): (A=M]mÂ»Ã¿f|Ã²Â†"
813815-813836 spiflash: field: "Command: 2x I/O read (2READ)" "Command: 2x I/O read" "Cmd: 2x I/O read" "Cmd: 2READ" "2READ"
813835-813856 spiflash: bit: "Address bits 23..16: 0x02" "Addr bits 23..16: 0x02" "Addr bits 23..16" "A23..A16"
813835-813856 spiflash: bit: "Address bits 15..8: 0x1c" "Addr bits 15..8: 0x1c" "Addr bits 15..8" "A15..A8"
813855-813876 spiflash: bit: "Address bits 7..0: 0x20" "Addr bits 7..0: 0x20" "Addr bits 7..0" "A7..A0"
813835-813876 spiflash: field: "Address: 0x021c20" "Addr: 0x021c20" "0x021c20"
813855-813876 spiflash: bit: "Dummy byte: 0x00"
813875-814196 spiflash: field: "Data (32 bytes)"
813815-814194 spiflash: 2read: "2x I/O read (addr 0x021c20, 32 bytes): &Ã¬(Ã¢8(?7Â¢4-Ã†"
816538-816557 spiflash: field: "Command: 2x I/O read (2READ)" "Command: 2x I/O read" "Cmd: 2x I/O read" "Cmd: 2READ" "2READ"
816558-816577 spiflash: bit: "Address bits 23..16: 0x02" "Addr bits 23..16: 0x02" "Addr bits 23..16" "A23..A16"
816558-816577 spiflash: bit: "Address bits 15..8: 0x1c" "Addr bits 15..8: 0x1c" "Addr bits 15..8" "A15..A8"
816578-816597 spiflash: bit: "Address bits 7..0: 0x60" "Addr bits 7..0: 0x60" "Addr bits 7..0" "A7..A0"
816558-816597 spiflash: field: "Address: 0x021c60" "Addr: 0x021c60" "0x021c60"
816578-816597 spiflash: bit: "Dummy byte: 0x00"
816598-816917 spiflash: field: "Data (32 bytes)"
816538-816917 spiflash: 2read: "2x I/O read (addr 0x021c60, 32 bytes): Ã±Ã¿"
940171-940192 spiflash: field: "Command: 2x I/O read (2READ)" "Command: 2x I/O read" "Cmd: 2x I/O read" "Cmd: 2READ" "2READ"
940191-940212 spiflash: bit: "Address bits 23..16: 0x02" "Addr bits 23..16: 0x02" "Addr bits 23..16" "A23..A16"
940191-940212 spiflash: bit: "Address bits 15..8: 0x1b" "Addr bits 15..8: 0x1b" "Addr bits 15..8" "A15..A8"
940211-940232 spiflash: bit: "Address bits 7..0: 0xc0" "Addr bits 7..0: 0xc0" "Addr bits 7..0" "A7..A0"
940191-940232 spiflash: field: "Address: 0x021bc0" "Addr: 0x021bc0" "0x021bc0"
940211-940232 spiflash: bit: "Dummy byte: 0x00"
940231-940552 spiflash: field: "Data (32 bytes)"
940171-940550 spiflash: 2read: "2x I/O read (addr 0x021bc0, 32 bytes): ("
