773838-773859 spiflash: rdsr: "Command: 2x I/O read"
773858-773879 spiflash: bits: "AD1: 0x06"
773858-773879 spiflash: bits: "AD2: 0x9b"
773878-773899 spiflash: bits: "AD3: 0xc0"
773878-773899 spiflash: bits: "Dummy byte: 0x00"
773858-773899 spiflash: rdsr: "Read address: 0x069bc0"
773898-774217 spiflash: bits2: "Read 32 bytes: a"
774277-774298 spiflash: rdsr: "Command: 2x I/O read"
774297-774318 spiflash: bits: "AD1: 0x06"
774297-774318 spiflash: bits: "AD2: 0xa5"
774317-774338 spiflash: bits: "AD3: 0xc0"
774317-774338 spiflash: bits: "Dummy byte: 0x00"
774297-774338 spiflash: rdsr: "Read address: 0x06a5c0"
774337-774656 spiflash: bits2: "Read 32 bytes: 3B0Ã³@00`!Â„Ã¿2ÃƒP3Â‚:"@#Â“Ã°ÃÃ Ã™"
774931-774950 spiflash: rdsr: "Command: 2x I/O read"
774951-774970 spiflash: bits: "AD1: 0x06"
774951-774970 spiflash: bits: "AD2: 0x72"
774971-774990 spiflash: bits: "AD3: 0xa0"
774971-774990 spiflash: bits: "Dummy byte: 0x00"
774951-774990 spiflash: rdsr: "Read address: 0x0672a0"
774991-775310 spiflash: bits2: "Read 32 bytes:  EÂ˜Ãª  t!"
775337-775358 spiflash: rdsr: "Command: 2x I/O read"
775357-775378 spiflash: bits: "AD1: 0x06"
775357-775378 spiflash: bits: "AD2: 0x72"
775377-775398 spiflash: bits: "AD3: 0xc0"
775377-775398 spiflash: bits: "Dummy byte: 0x00"
775357-775398 spiflash: rdsr: "Read address: 0x0672c0"
775397-775716 spiflash: bits2: "Read 32 bytes: p&Âƒ  tÃ°1Ã…Ã¿Ã€"*#"Ã°"
776110-776129 spiflash: rdsr: "Command: 2x I/O read"
776130-776149 spiflash: bits: "AD1: 0x05"
776130-776149 spiflash: bits: "AD2: 0xa5"
776150-776169 spiflash: bits: "AD3: 0xc0"
776150-776169 spiflash: bits: "Dummy byte: 0x00"
776130-776169 spiflash: rdsr: "Read address: 0x05a5c0"
776170-776489 spiflash: bits2: "Read 32 bytes: 2"
777053-777074 spiflash: rdsr: "Command: 2x I/O read"
777073-777094 spiflash: bits: "AD1: 0x05"
777073-777094 spiflash: bits: "AD2: 0x72"
777093-777114 spiflash: bits: "AD3: 0x60"
777093-777114 spiflash: bits: "Dummy byte: 0x00"
777073-777114 spiflash: rdsr: "Read address: 0x057260"
777113-777432 spiflash: bits2: "Read 32 bytes: Ã©AÃ™1Ã­Ã˜Ã²Ã˜ÃÃšÃ¿Ã²ÃÃ_Ã€Ã…Ã¨Ã¦Â FÂŒ"
777952-777973 spiflash: rdsr: "Command: 2x I/O read"
777972-777993 spiflash: bits: "AD1: 0x05"
777972-777993 spiflash: bits: "AD2: 0x72"
777992-778013 spiflash: bits: "AD3: 0xa0"
777992-778013 spiflash: bits: "Dummy byte: 0x00"
777972-778013 spiflash: rdsr: "Read address: 0x0572a0"
778012-778331 spiflash: bits2: "Read 32 bytes: \("Â…Ã¾Ã™<bÂ Ã"Lx 0t2L"
778385-778404 spiflash: rdsr: "Command: 2x I/O read"
778405-778424 spiflash: bits: "AD1: 0x05"
778405-778424 spiflash: bits: "AD2: 0x72"
778425-778444 spiflash: bits: "AD3: 0xc0"
778425-778444 spiflash: bits: "Dummy byte: 0x00"
778405-778444 spiflash: rdsr: "Read address: 0x0572c0"
778445-778764 spiflash: bits2: "Read 32 bytes: }"
778799-778818 spiflash: rdsr: "Command: 2x I/O read"
778819-778838 spiflash: bits: "AD1: 0x05"
778819-778838 spiflash: bits: "AD2: 0x33"
778839-778858 spiflash: bits: "AD3: 0x00"
778839-778858 spiflash: bits: "Dummy byte: 0x00"
778819-778858 spiflash: rdsr: "Read address: 0x053300"
778859-779177 spiflash: bits2: "Read 32 bytes: Ã°Ã¿Ã€"
779230-779249 spiflash: rdsr: "Command: 2x I/O read"
779250-779269 spiflash: bits: "AD1: 0x05"
779250-779269 spiflash: bits: "AD2: 0x73"
779270-779289 spiflash: bits: "AD3: 0x00"
779270-779289 spiflash: bits: "Dummy byte: 0x00"
779250-779289 spiflash: rdsr: "Read address: 0x057300"
779290-779609 spiflash: bits2: "Read 32 bytes: "ÃŒFl"
780172-780193 spiflash: rdsr: "Command: 2x I/O read"
780192-780213 spiflash: bits: "AD1: 0x05"
780192-780213 spiflash: bits: "AD2: 0x75"
780212-780233 spiflash: bits: "AD3: 0x00"
780212-780233 spiflash: bits: "Dummy byte: 0x00"
780192-780233 spiflash: rdsr: "Read address: 0x057500"
780232-780551 spiflash: bits2: "Read 32 bytes: ÂŒ`Ã’"
780580-780601 spiflash: rdsr: "Command: 2x I/O read"
780600-780621 spiflash: bits: "AD1: 0x05"
780600-780621 spiflash: bits: "AD2: 0x75"
780620-780641 spiflash: bits: "AD3: 0x20"
780620-780641 spiflash: bits: "Dummy byte: 0x00"
780600-780641 spiflash: rdsr: "Read address: 0x057520"
780640-780959 spiflash: bits2: "Read 32 bytes: Ã·Â¾9Ã¼,iÂœ"
780990-781011 spiflash: rdsr: "Command: 2x I/O read"
781010-781031 spiflash: bits: "AD1: 0x05"
781010-781031 spiflash: bits: "AD2: 0x75"
781030-781051 spiflash: bits: "AD3: 0x40"
781030-781051 spiflash: bits: "Dummy byte: 0x00"
781010-781051 spiflash: rdsr: "Read address: 0x057540"
781050-781369 spiflash: bits2: "Read 32 bytes: Ã˜1Ã¨AÃ¸QÃ Ã°"Â†ÃÃ¿"
781735-781756 spiflash: rdsr: "Command: 2x I/O read"
781755-781776 spiflash: bits: "AD1: 0x05"
781755-781776 spiflash: bits: "AD2: 0x9c"
781775-781796 spiflash: bits: "AD3: 0x00"
781775-781796 spiflash: bits: "Dummy byte: 0x00"
781755-781796 spiflash: rdsr: "Read address: 0x059c00"
781795-782114 spiflash: bits2: "Read 32 bytes: "
782145-782166 spiflash: rdsr: "Command: 2x I/O read"
782165-782186 spiflash: bits: "AD1: 0x05"
782165-782186 spiflash: bits: "AD2: 0x9b"
782185-782206 spiflash: bits: "AD3: 0xc0"
782185-782206 spiflash: bits: "Dummy byte: 0x00"
782165-782206 spiflash: rdsr: "Read address: 0x059bc0"
782205-782524 spiflash: bits2: "Read 32 bytes: UÂŒ#Ã°PPtWÂ–Ã¬Ã°"
782559-782578 spiflash: rdsr: "Command: 2x I/O read"
782579-782598 spiflash: bits: "AD1: 0x05"
782579-782598 spiflash: bits: "AD2: 0x9c"
782599-782618 spiflash: bits: "AD3: 0x20"
782599-782618 spiflash: bits: "Dummy byte: 0x00"
782579-782618 spiflash: rdsr: "Read address: 0x059c20"
782619-782938 spiflash: bits2: "Read 32 bytes: bÂ€D`D Â€DbR"
783184-783203 spiflash: rdsr: "Command: 2x I/O read"
783204-783223 spiflash: bits: "AD1: 0x05"
783204-783223 spiflash: bits: "AD2: 0x9c"
783224-783243 spiflash: bits: "AD3: 0x60"
783224-783243 spiflash: bits: "Dummy byte: 0x00"
783204-783243 spiflash: rdsr: "Read address: 0x059c60"
783244-783563 spiflash: bits2: "Read 32 bytes: Ã£Ã¾! Ã©2!BÂ 2ÃƒR5Ã€"
784825-784846 spiflash: rdsr: "Command: 2x I/O read"
784845-784866 spiflash: bits: "AD1: 0x03"
784845-784866 spiflash: bits: "AD2: 0x32"
784865-784886 spiflash: bits: "AD3: 0x60"
784865-784886 spiflash: bits: "Dummy byte: 0x00"
784845-784886 spiflash: rdsr: "Read address: 0x033260"
784885-785204 spiflash: bits2: "Read 32 bytes: "
785480-785501 spiflash: rdsr: "Command: 2x I/O read"
785500-785521 spiflash: bits: "AD1: 0x05"
785500-785521 spiflash: bits: "AD2: 0xa0"
785520-785541 spiflash: bits: "AD3: 0xa0"
785520-785541 spiflash: bits: "Dummy byte: 0x00"
785500-785541 spiflash: rdsr: "Read address: 0x05a0a0"
785540-785859 spiflash: bits2: "Read 32 bytes: ÃœÃ²BEPD BMÃ‚!Ã’!Ã¢!Ã²!!Ã"
786128-786147 spiflash: rdsr: "Command: 2x I/O read"
786148-786167 spiflash: bits: "AD1: 0x02"
786148-786167 spiflash: bits: "AD2: 0x75"
786168-786187 spiflash: bits: "AD3: 0x00"
786168-786187 spiflash: bits: "Dummy byte: 0x00"
786148-786187 spiflash: rdsr: "Read address: 0x027500"
786188-786507 spiflash: bits2: "Read 32 bytes: Ã°"
786538-786557 spiflash: rdsr: "Command: 2x I/O read"
786558-786577 spiflash: bits: "AD1: 0x02"
786558-786577 spiflash: bits: "AD2: 0x75"
786578-786597 spiflash: bits: "AD3: 0x20"
786578-786597 spiflash: bits: "Dummy byte: 0x00"
786558-786597 spiflash: rdsr: "Read address: 0x027520"
786598-786917 spiflash: bits2: "Read 32 bytes: Ã¬Ã¥YAiQÂ…ÃÃ¿XAhQf(=MÃ³Ã¿Ã€"
786943-786964 spiflash: rdsr: "Command: 2x I/O read"
786963-786982 spiflash: bits: "AD1: 0x02"
786963-786982 spiflash: bits: "AD2: 0x73"
786983-787004 spiflash: bits: "AD3: 0x00"
786983-787004 spiflash: bits: "Dummy byte: 0x00"
786963-787004 spiflash: rdsr: "Read address: 0x027300"
787003-787322 spiflash: bits2: "Read 32 bytes: 1Â¤Ã¾Ã€ "
787387-787406 spiflash: rdsr: "Command: 2x I/O read"
787407-787426 spiflash: bits: "AD1: 0x02"
787407-787426 spiflash: bits: "AD2: 0x75"
787427-787446 spiflash: bits: "AD3: 0x40"
787427-787446 spiflash: bits: "Dummy byte: 0x00"
787407-787446 spiflash: rdsr: "Read address: 0x027540"
787447-787766 spiflash: bits2: "Read 32 bytes: (=MÃ¯Ã¿Ã€"
790114-790135 spiflash: rdsr: "Command: 2x I/O read"
790134-790155 spiflash: bits: "AD1: 0x05"
790134-790155 spiflash: bits: "AD2: 0x1c"
790154-790175 spiflash: bits: "AD3: 0x60"
790154-790175 spiflash: bits: "Dummy byte: 0x00"
790134-790175 spiflash: rdsr: "Read address: 0x051c60"
790174-790493 spiflash: bits2: "Read 32 bytes: ÃÃ°Â¥	1Â…oÃ‘1ÃÃ°"
790517-790538 spiflash: rdsr: "Command: 2x I/O read"
790537-790558 spiflash: bits: "AD1: 0x05"
790537-790558 spiflash: bits: "AD2: 0x1c"
790557-790578 spiflash: bits: "AD3: 0x80"
790557-790578 spiflash: bits: "Dummy byte: 0x00"
790537-790578 spiflash: rdsr: "Read address: 0x051c80"
790577-790896 spiflash: bits2: "Read 32 bytes: 0C =	1EÃªÃ“1ÃÃ°"
790927-790948 spiflash: rdsr: "Command: 2x I/O read"
790947-790968 spiflash: bits: "AD1: 0x02"
790947-790968 spiflash: bits: "AD2: 0x5b"
790967-790988 spiflash: bits: "AD3: 0x20"
790967-790988 spiflash: bits: "Dummy byte: 0x00"
790947-790988 spiflash: rdsr: "Read address: 0x025b20"
790987-791306 spiflash: bits2: "Read 32 bytes: 5ÃµÃ°Ã°"
791330-791349 spiflash: rdsr: "Command: 2x I/O read"
791350-791369 spiflash: bits: "AD1: 0x02"
791350-791369 spiflash: bits: "AD2: 0x5b"
791370-791389 spiflash: bits: "AD3: 0x40"
791370-791389 spiflash: bits: "Dummy byte: 0x00"
791350-791389 spiflash: rdsr: "Read address: 0x025b40"
791390-791708 spiflash: bits2: "Read 32 bytes: ÃÂŒÂ‚MÃ¢Ã©Ã€"
792063-792084 spiflash: rdsr: "Command: 2x I/O read"
792083-792104 spiflash: bits: "AD1: 0x06"
792083-792104 spiflash: bits: "AD2: 0x90"
792103-792124 spiflash: bits: "AD3: 0x60"
792103-792124 spiflash: bits: "Dummy byte: 0x00"
792083-792124 spiflash: rdsr: "Read address: 0x069060"
792123-792442 spiflash: bits2: "Read 32 bytes: T@Ã˜6@"Â (2Â ÃÃ Ã¹aÃ©QÃ™AÃ‰1	!EÂ•Â½"
795564-795583 spiflash: rdsr: "Command: 2x I/O read"
795584-795603 spiflash: bits: "AD1: 0x02"
795584-795603 spiflash: bits: "AD2: 0x72"
795604-795623 spiflash: bits: "AD3: 0x60"
795604-795623 spiflash: bits: "Dummy byte: 0x00"
795584-795623 spiflash: rdsr: "Read address: 0x027260"
795624-795943 spiflash: bits2: "Read 32 bytes: 3Ã€ "
797415-797436 spiflash: rdsr: "Command: 2x I/O read"
797435-797456 spiflash: bits: "AD1: 0x02"
797435-797456 spiflash: bits: "AD2: 0xbe"
797455-797476 spiflash: bits: "AD3: 0x60"
797455-797476 spiflash: bits: "Dummy byte: 0x00"
797435-797476 spiflash: rdsr: "Read address: 0x02be60"
797475-797794 spiflash: bits2: "Read 32 bytes: 2!(Â…Â¿f XÃ¨Ã˜%-Ã¸5Ã©hÃÃ€"
797821-797842 spiflash: rdsr: "Command: 2x I/O read"
797841-797862 spiflash: bits: "AD1: 0x02"
797841-797862 spiflash: bits: "AD2: 0xbe"
797861-797882 spiflash: bits: "AD3: 0x80"
797861-797882 spiflash: bits: "Dummy byte: 0x00"
797841-797882 spiflash: rdsr: "Read address: 0x02be80"
797881-798200 spiflash: bits2: "Read 32 bytes: Ã±Ã¿-Ã€"
798498-798517 spiflash: rdsr: "Command: 2x I/O read"
798518-798537 spiflash: bits: "AD1: 0x02"
798518-798537 spiflash: bits: "AD2: 0xaa"
798538-798557 spiflash: bits: "AD3: 0x60"
798538-798557 spiflash: bits: "Dummy byte: 0x00"
798518-798557 spiflash: rdsr: "Read address: 0x02aa60"
798558-798876 spiflash: bits2: "Read 32 bytes:  Ã°"
798986-799007 spiflash: rdsr: "Command: 2x I/O read"
799006-799027 spiflash: bits: "AD1: 0x02"
799006-799027 spiflash: bits: "AD2: 0xaa"
799026-799047 spiflash: bits: "AD3: 0x80"
799026-799047 spiflash: bits: "Dummy byte: 0x00"
799006-799047 spiflash: rdsr: "Read address: 0x02aa80"
799046-799365 spiflash: bits2: "Read 32 bytes: Â…Â–Ã¿1ÃÃ°"
799899-799918 spiflash: rdsr: "Command: 2x I/O read"
799919-799938 spiflash: bits: "AD1: 0x02"
799919-799938 spiflash: bits: "AD2: 0xbe"
799939-799958 spiflash: bits: "AD3: 0x40"
799939-799958 spiflash: bits: "Dummy byte: 0x00"
799919-799958 spiflash: rdsr: "Read address: 0x02be40"
799959-800278 spiflash: bits2: "Read 32 bytes: ÂÃ¹q)9XÃŒÃ•(8MÃ…Ã€Ã†"
800312-800331 spiflash: rdsr: "Command: 2x I/O read"
800332-800351 spiflash: bits: "AD1: 0x02"
800332-800351 spiflash: bits: "AD2: 0xea"
800352-800371 spiflash: bits: "AD3: 0x60"
800352-800371 spiflash: bits: "Dummy byte: 0x00"
800332-800371 spiflash: rdsr: "Read address: 0x02ea60"
800372-800690 spiflash: bits2: "Read 32 bytes: ÃÃÃ’a	ÃÃ‰Â¡Ã©ÂÃ¹q	Â±ÃÃ­0Ã‘ÂƒÃ…aÃ¸Ã½Â¬Ã¬Â£"
800895-800916 spiflash: rdsr: "Command: 2x I/O read"
800915-800936 spiflash: bits: "AD1: 0x02"
800915-800936 spiflash: bits: "AD2: 0xea"
800935-800956 spiflash: bits: "AD3: 0x80"
800935-800956 spiflash: bits: "Dummy byte: 0x00"
800915-800956 spiflash: rdsr: "Read address: 0x02ea80"
800955-801274 spiflash: bits2: "Read 32 bytes: -Ã“Ã‡Ã€"
804204-804225 spiflash: rdsr: "Command: 2x I/O read"
804224-804245 spiflash: bits: "AD1: 0x02"
804224-804245 spiflash: bits: "AD2: 0x65"
804244-804265 spiflash: bits: "AD3: 0xc0"
804244-804265 spiflash: bits: "Dummy byte: 0x00"
804224-804265 spiflash: rdsr: "Read address: 0x0265c0"
804264-804583 spiflash: bits2: "Read 32 bytes: Ã·Â¥Â…!Ã‘Ã¾"Ã¹Ã†ÃÃ¿1ÂÃ¾Ã½:!Ã…uAÃ¾J!Ã…Â©Q"
805344-805365 spiflash: rdsr: "Command: 2x I/O read"
805364-805385 spiflash: bits: "AD1: 0x03"
805364-805385 spiflash: bits: "AD2: 0x7e"
805384-805405 spiflash: bits: "AD3: 0x80"
805384-805405 spiflash: bits: "Dummy byte: 0x00"
805364-805405 spiflash: rdsr: "Read address: 0x037e80"
805404-805723 spiflash: bits2: "Read 32 bytes: fÃ¡-Ã¾Â’Ã½Fw"
807255-807274 spiflash: rdsr: "Command: 2x I/O read"
807275-807294 spiflash: bits: "AD1: 0x02"
807275-807294 spiflash: bits: "AD2: 0x60"
807295-807314 spiflash: bits: "AD3: 0xa0"
807295-807314 spiflash: bits: "Dummy byte: 0x00"
807275-807314 spiflash: rdsr: "Read address: 0x0260a0"
807315-807633 spiflash: bits2: "Read 32 bytes: Â¬"
808310-808329 spiflash: rdsr: "Command: 2x I/O read"
808330-808349 spiflash: bits: "AD1: 0x02"
808330-808349 spiflash: bits: "AD2: 0x35"
808350-808369 spiflash: bits: "AD3: 0x00"
808350-808369 spiflash: bits: "Dummy byte: 0x00"
808330-808369 spiflash: rdsr: "Read address: 0x023500"
808370-808688 spiflash: bits2: "Read 32 bytes: !7Ãµ'ÂœÃˆ"
808731-808750 spiflash: rdsr: "Command: 2x I/O read"
808751-808770 spiflash: bits: "AD1: 0x02"
808751-808770 spiflash: bits: "AD2: 0x35"
808771-808790 spiflash: bits: "AD3: 0x20"
808771-808790 spiflash: bits: "Dummy byte: 0x00"
808751-808790 spiflash: rdsr: "Read address: 0x023520"
808791-809110 spiflash: bits2: "Read 32 bytes: (l),"7b",R2Âœ!0ÃµÃ Ã t C@@Ã´Âœ"
809158-809179 spiflash: rdsr: "Command: 2x I/O read"
809178-809199 spiflash: bits: "AD1: 0x02"
809178-809199 spiflash: bits: "AD2: 0x35"
809198-809219 spiflash: bits: "AD3: 0x40"
809198-809219 spiflash: bits: "Dummy byte: 0x00"
809178-809219 spiflash: rdsr: "Read address: 0x023540"
809218-809537 spiflash: bits2: "Read 32 bytes: $Â†"
809780-809799 spiflash: rdsr: "Command: 2x I/O read"
809800-809819 spiflash: bits: "AD1: 0x02"
809800-809819 spiflash: bits: "AD2: 0x5c"
809820-809839 spiflash: bits: "AD3: 0x00"
809820-809839 spiflash: bits: "Dummy byte: 0x00"
809800-809839 spiflash: rdsr: "Read address: 0x025c00"
809840-810159 spiflash: bits2: "Read 32 bytes: ÃÃ°"
810182-810203 spiflash: rdsr: "Command: 2x I/O read"
810202-810223 spiflash: bits: "AD1: 0x02"
810202-810223 spiflash: bits: "AD2: 0x5c"
810222-810243 spiflash: bits: "AD3: 0x20"
810222-810243 spiflash: bits: "Dummy byte: 0x00"
810202-810243 spiflash: rdsr: "Read address: 0x025c20"
810242-810561 spiflash: bits2: "Read 32 bytes: Ã½Ã­Â‡b2Â“-BÂ "
810679-810698 spiflash: rdsr: "Command: 2x I/O read"
810699-810718 spiflash: bits: "AD1: 0x02"
810699-810718 spiflash: bits: "AD2: 0x5c"
810719-810738 spiflash: bits: "AD3: 0x60"
810719-810738 spiflash: bits: "Dummy byte: 0x00"
810699-810738 spiflash: rdsr: "Read address: 0x025c60"
810739-811057 spiflash: bits2: "Read 32 bytes: ÃÃ°Ã‰!Ã2Â“aÂ…l,2fAÂ·Ã«042\F"
811450-811469 spiflash: rdsr: "Command: 2x I/O read"
811470-811489 spiflash: bits: "AD1: 0x05"
811470-811489 spiflash: bits: "AD2: 0x20"
811490-811509 spiflash: bits: "AD3: 0xa0"
811490-811509 spiflash: bits: "Dummy byte: 0x00"
811470-811509 spiflash: rdsr: "Read address: 0x0520a0"
811510-811829 spiflash: bits2: "Read 32 bytes: Ã°"
813240-813261 spiflash: rdsr: "Command: 2x I/O read"
813260-813281 spiflash: bits: "AD1: 0x02"
813260-813281 spiflash: bits: "AD2: 0x1c"
813280-813301 spiflash: bits: "AD3: 0x00"
813280-813301 spiflash: bits: "Dummy byte: 0x00"
813260-813301 spiflash: rdsr: "Read address: 0x021c00"
813300-813619 spiflash: bits2: "Read 32 bytes: (A=M]mÂ»Ã¿f|Ã²Â†"
813815-813836 spiflash: rdsr: "Command: 2x I/O read"
813835-813856 spiflash: bits: "AD1: 0x02"
813835-813856 spiflash: bits: "AD2: 0x1c"
813855-813876 spiflash: bits: "AD3: 0x20"
813855-813876 spiflash: bits: "Dummy byte: 0x00"
813835-813876 spiflash: rdsr: "Read address: 0x021c20"
813875-814194 spiflash: bits2: "Read 32 bytes: &Ã¬(Ã¢8(?7Â¢4-Ã†"
816538-816557 spiflash: rdsr: "Command: 2x I/O read"
816558-816577 spiflash: bits: "AD1: 0x02"
816558-816577 spiflash: bits: "AD2: 0x1c"
816578-816597 spiflash: bits: "AD3: 0x60"
816578-816597 spiflash: bits: "Dummy byte: 0x00"
816558-816597 spiflash: rdsr: "Read address: 0x021c60"
816598-816917 spiflash: bits2: "Read 32 bytes: Ã±Ã¿"
940171-940192 spiflash: rdsr: "Command: 2x I/O read"
940191-940212 spiflash: bits: "AD1: 0x02"
940191-940212 spiflash: bits: "AD2: 0x1b"
940211-940232 spiflash: bits: "AD3: 0xc0"
940211-940232 spiflash: bits: "Dummy byte: 0x00"
940191-940232 spiflash: rdsr: "Read address: 0x021bc0"
940231-940550 spiflash: bits2: "Read 32 bytes: ("
