22040-22061 spiflash: field: "Command: Read data (READ)" "Command: Read data" "Cmd: Read data" "Cmd: READ" "READ"
22061-22082 spiflash: bit: "Address bits 23..16: 0x11" "Addr bits 23..16: 0x11" "Addr bits 23..16" "A23..A16"
22082-22101 spiflash: bit: "Address bits 15..8: 0x7c" "Addr bits 15..8: 0x7c" "Addr bits 15..8" "A15..A8"
22103-22122 spiflash: bit: "Address bits 7..0: 0x00" "Addr bits 7..0: 0x00" "Addr bits 7..0" "A7..A0"
22061-22122 spiflash: field: "Address: 0x117c00" "Addr: 0x117c00" "0x117c00"
22128-27461 spiflash: field: "Data (256 bytes)"
22040-66812 spiflash: read: "Read data (addr 0x117c00, 256 bytes): 6f 72 6c 64 48 65 6c 6c 6f 57 6f 72 6c 64 48 65 6c 6c 6f 57 6f 72 6c 64 48 65 6c 6c 6f 57 6f 72 6c 64 48 65 6c 6c 6f 57 6f 72 6c 64 48 65 6c 6c 6f 57 6f 72 6c 64 48 65 6c 6c 6f 57 6f 72 6c 64 48 65 6c 6c 6f 57 6f 72 6c 64 48 65 6c 6c 6f 57 6f 72 6c 64 48 65 6c 6c 6f 57 6f 72 6c 64 48 65 6c 6c 6f 57 6f 72 6c 64 48 65 6c 6c 6f 57 6f 72 6c 64 48 65 6c 6c 6f 57 6f 72 6c 64 48 65 6c 6c 6f 57 6f 72 6c 64 48 65 6c 6c 6f 57 6f 72 6c 64 48 65 6c 6c 6f 57 6f 72 6c 64 48 65 6c 6c 6f 57 6f 72 6c 64 48 65 6c 6c 6f 57 6f 72 6c 64 48 65 6c 6c 6f 57 6f 72 6c 64 48 65 6c 6c 6f 57 6f 72 6c 64 48 65 6c 6c 6f 57 6f 72 6c 64 48 65 6c 6c 6f 57 6f 72 6c 64 48 65 6c 6c 6f 57 6f 72 6c 64 48 65 6c 6c 6f 57 6f 72 6c 64 48 65 6c 6c 6f 57 6f 72 6c 64 48 65 6c 6c 6f 57 6f 72 6c 64 48 65"
68906-68925 spiflash: field: "Command: Read data (READ)" "Command: Read data" "Cmd: Read data" "Cmd: READ" "READ"
68927-68946 spiflash: bit: "Address bits 23..16: 0x11" "Addr bits 23..16: 0x11" "Addr bits 23..16" "A23..A16"
68948-68967 spiflash: bit: "Address bits 15..8: 0x7d" "Addr bits 15..8: 0x7d" "Addr bits 15..8" "A15..A8"
68968-68989 spiflash: bit: "Address bits 7..0: 0x00" "Addr bits 7..0: 0x00" "Addr bits 7..0" "A7..A0"
68927-68989 spiflash: field: "Address: 0x117d00" "Addr: 0x117d00" "0x117d00"
68993-74325 spiflash: field: "Data (256 bytes)"
68906-116816 spiflash: read: "Read data (addr 0x117d00, 256 bytes): 6c 6c 6f 57 6f 72 6c 64 48 65 6c 6c 6f 57 6f 72 6c 64 48 65 6c 6c 6f 57 6f 72 6c 64 48 65 6c 6c 6f 57 6f 72 6c 64 48 65 6c 6c 6f 57 6f 72 6c 64 48 65 6c 6c 6f 57 6f 72 6c 64 48 65 6c 6c 6f 57 6f 72 6c 64 48 65 6c 6c 6f 57 6f 72 6c 64 48 65 6c 6c 6f 57 6f 72 6c 64 48 65 6c 6c 6f 57 6f 72 6c 64 48 65 6c 6c 6f 57 6f 72 6c 64 48 65 6c 6c 6f 57 6f 72 6c 64 48 65 6c 6c 6f 57 6f 72 6c 64 48 65 6c 6c 6f 57 6f 72 6c 64 48 65 6c 6c 6f 57 6f 72 6c 64 48 65 6c 6c 6f 57 6f 72 6c 64 48 65 6c 6c 6f 57 6f 72 6c 64 48 65 6c 6c 6f 57 6f 72 6c 64 48 65 6c 6c 6f 57 6f 72 6c 64 48 65 6c 6c 6f 57 6f 72 6c 64 48 65 6c 6c 6f 57 6f 72 6c 64 48 65 6c 6c 6f 57 6f 72 6c 64 48 65 6c 6c 6f 57 6f 72 6c 64 48 65 6c 6c 6f 57 6f 72 6c 64 48 65 6c 6c 6f 57 6f 72 6c 64 48 65 6c 6c 6f 57 6f 72"
118909-118928 spiflash: field: "Command: Read data (READ)" "Command: Read data" "Cmd: Read data" "Cmd: READ" "READ"
118929-118950 spiflash: bit: "Address bits 23..16: 0x11" "Addr bits 23..16: 0x11" "Addr bits 23..16" "A23..A16"
118950-118971 spiflash: bit: "Address bits 15..8: 0x7e" "Addr bits 15..8: 0x7e" "Addr bits 15..8" "A15..A8"
118971-118992 spiflash: bit: "Address bits 7..0: 0x00" "Addr bits 7..0: 0x00" "Addr bits 7..0" "A7..A0"
118929-118992 spiflash: field: "Address: 0x117e00" "Addr: 0x117e00" "0x117e00"
118996-124329 spiflash: field: "Data (256 bytes)"
118909-166794 spiflash: read: "Read data (addr 0x117e00, 256 bytes): 6c 64 48 65 6c 6c 6f 57 6f 72 6c 64 48 65 6c 6c 6f 57 6f 72 6c 64 48 65 6c 6c 6f 57 6f 72 6c 64 48 65 6c 6c 6f 57 6f 72 6c 64 48 65 6c 6c 6f 57 6f 72 6c 64 48 65 6c 6c 6f 57 6f 72 6c 64 48 65 6c 6c 6f 57 6f 72 6c 64 48 65 6c 6c 6f 57 6f 72 6c 64 48 65 6c 6c 6f 57 6f 72 6c 64 48 65 6c 6c 6f 57 6f 72 6c 64 48 65 6c 6c 6f 57 6f 72 6c 64 48 65 6c 6c 6f 57 6f 72 6c 64 48 65 6c 6c 6f 57 6f 72 6c 64 48 65 6c 6c 6f 57 6f 72 6c 64 48 65 6c 6c 6f 57 6f 72 6c 64 48 65 6c 6c 6f 57 6f 72 6c 64 48 65 6c 6c 6f 57 6f 72 6c 64 48 65 6c 6c 6f 57 6f 72 6c 64 48 65 6c 6c 6f 57 6f 72 6c 64 48 65 6c 6c 6f 57 6f 72 6c 64 48 65 6c 6c 6f 57 6f 72 6c 64 48 65 6c 6c 6f 57 6f 72 6c 64 48 65 6c 6c 6f 57 6f 72 6c 64 48 65 6c 6c 6f 57 6f 72 6c 64 48 65 6c 6c 6f 57 6f 72 6c 64 48 65 6c 6c"
168898-168919 spiflash: field: "Command: Read data (READ)" "Command: Read data" "Cmd: Read data" "Cmd: READ" "READ"
168919-168940 spiflash: bit: "Address bits 23..16: 0x11" "Addr bits 23..16: 0x11" "Addr bits 23..16" "A23..A16"
168940-168959 spiflash: bit: "Address bits 15..8: 0x7f" "Addr bits 15..8: 0x7f" "Addr bits 15..8" "A15..A8"
168961-168980 spiflash: bit: "Address bits 7..0: 0x00" "Addr bits 7..0: 0x00" "Addr bits 7..0" "A7..A0"
168919-168980 spiflash: field: "Address: 0x117f00" "Addr: 0x117f00" "0x117f00"
168986-174319 spiflash: field: "Data (256 bytes)"
168898-216794 spiflash: read: "Read data (addr 0x117f00, 256 bytes): 6f 57 6f 72 6c 64 48 65 6c 6c 6f 57 6f 72 6c 64 48 65 6c 6c 6f 57 6f 72 6c 64 48 65 6c 6c 6f 57 6f 72 6c 64 48 65 6c 6c 6f 57 6f 72 6c 64 48 65 6c 6c 6f 57 6f 72 6c 64 48 65 6c 6c 6f 57 6f 72 6c 64 48 65 6c 6c 6f 57 6f 72 6c 64 48 65 6c 6c 6f 57 6f 72 6c 64 48 65 6c 6c 6f 57 6f 72 6c 64 48 65 6c 6c 6f 57 6f 72 6c 64 48 65 6c 6c 6f 57 6f 72 6c 64 48 65 6c 6c 6f 57 6f 72 6c 64 48 65 6c 6c 6f 57 6f 72 6c 64 48 65 6c 6c 6f 57 6f 72 6c 64 48 65 6c 6c 6f 57 6f 72 6c 64 48 65 6c 6c 6f 57 6f 72 6c 64 48 65 6c 6c 6f 57 6f 72 6c 64 48 65 6c 6c 6f 57 6f 72 6c 64 48 65 6c 6c 6f 57 6f 72 6c 64 48 65 6c 6c 6f 57 6f 72 6c 64 48 65 6c 6c 6f 57 6f 72 6c 64 48 65 6c 6c 6f 57 6f 72 6c 64 48 65 6c 6c 6f 57 6f 72 6c 64 48 65 6c 6c 6f 57 6f 72 6c 64 48 65 6c 6c 6f 57 6f 72 6c 64"
218893-218912 spiflash: field: "Command: Read data (READ)" "Command: Read data" "Cmd: Read data" "Cmd: READ" "READ"
218914-218933 spiflash: bit: "Address bits 23..16: 0x11" "Addr bits 23..16: 0x11" "Addr bits 23..16" "A23..A16"
218935-218954 spiflash: bit: "Address bits 15..8: 0x80" "Addr bits 15..8: 0x80" "Addr bits 15..8" "A15..A8"
218955-218976 spiflash: bit: "Address bits 7..0: 0x00" "Addr bits 7..0: 0x00" "Addr bits 7..0" "A7..A0"
218914-218976 spiflash: field: "Address: 0x118000" "Addr: 0x118000" "0x118000"
218980-224312 spiflash: field: "Data (256 bytes)"
218893-265748 spiflash: read: "Read data (addr 0x118000, 256 bytes): 48 65 6c 6c 6f 57 6f 72 6c 64 48 65 6c 6c 6f 57 6f 72 6c 64 48 65 6c 6c 6f 57 6f 72 6c 64 48 65 6c 6c 6f 57 6f 72 6c 64 48 65 6c 6c 6f 57 6f 72 6c 64 48 65 6c 6c 6f 57 6f 72 6c 64 48 65 6c 6c 6f 57 6f 72 6c 64 48 65 6c 6c 6f 57 6f 72 6c 64 48 65 6c 6c 6f 57 6f 72 6c 64 48 65 6c 6c 6f 57 6f 72 6c 64 48 65 6c 6c 6f 57 6f 72 6c 64 48 65 6c 6c 6f 57 6f 72 6c 64 48 65 6c 6c 6f 57 6f 72 6c 64 48 65 6c 6c 6f 57 6f 72 6c 64 48 65 6c 6c 6f 57 6f 72 6c 64 48 65 6c 6c 6f 57 6f 72 6c 64 48 65 6c 6c 6f 57 6f 72 6c 64 48 65 6c 6c 6f 57 6f 72 6c 64 48 65 6c 6c 6f 57 6f 72 6c 64 48 65 6c 6c 6f 57 6f 72 6c 64 48 65 6c 6c 6f 57 6f 72 6c 64 48 65 6c 6c 6f 57 6f 72 6c 64 48 65 6c 6c 6f 57 6f 72 6c 64 48 65 6c 6c 6f 57 6f 72 6c 64 48 65 6c 6c 6f 57 6f 72 6c 64 48 65 6c 6c 6f 57"
269403-269422 spiflash: field: "Command: Read data (READ)" "Command: Read data" "Cmd: Read data" "Cmd: READ" "READ"
269424-269443 spiflash: bit: "Address bits 23..16: 0x11" "Addr bits 23..16: 0x11" "Addr bits 23..16" "A23..A16"
269445-269464 spiflash: bit: "Address bits 15..8: 0x81" "Addr bits 15..8: 0x81" "Addr bits 15..8" "A15..A8"
269465-269486 spiflash: bit: "Address bits 7..0: 0x00" "Addr bits 7..0: 0x00" "Addr bits 7..0" "A7..A0"
269424-269486 spiflash: field: "Address: 0x118100" "Addr: 0x118100" "0x118100"
269490-274822 spiflash: field: "Data (256 bytes)"
269403-315875 spiflash: read: "Read data (addr 0x118100, 256 bytes): 6f 72 6c 64 48 65 6c 6c 6f 57 6f 72 6c 64 48 65 6c 6c 6f 57 6f 72 6c 64 48 65 6c 6c 6f 57 6f 72 6c 64 48 65 6c 6c 6f 57 6f 72 6c 64 48 65 6c 6c 6f 57 6f 72 6c 64 48 65 6c 6c 6f 57 6f 72 6c 64 48 65 6c 6c 6f 57 6f 72 6c 64 48 65 6c 6c 6f 57 6f 72 6c 64 48 65 6c 6c 6f 57 6f 72 6c 64 48 65 6c 6c 6f 57 6f 72 6c 64 48 65 6c 6c 6f 57 6f 72 6c 64 48 65 6c 6c 6f 57 6f 72 6c 64 48 65 6c 6c 6f 57 6f 72 6c 64 48 65 6c 6c 6f 57 6f 72 6c 64 48 65 6c 6c 6f 57 6f 72 6c 64 48 65 6c 6c 6f 57 6f 72 6c 64 48 65 6c 6c 6f 57 6f 72 6c 64 48 65 6c 6c 6f 57 6f 72 6c 64 48 65 6c 6c 6f 57 6f 72 6c 64 48 65 6c 6c 6f 57 6f 72 6c 64 48 65 6c 6c 6f 57 6f 72 6c 64 48 65 6c 6c 6f 57 6f 72 6c 64 48 65 6c 6c 6f 57 6f 72 6c 64 48 65 6c 6c 6f 57 6f 72 6c 64 48 65 6c 6c 6f 57 6f 72 6c 64 48 65"
318875-318894 spiflash: field: "Command: Read data (READ)" "Command: Read data" "Cmd: Read data" "Cmd: READ" "READ"
318896-318915 spiflash: bit: "Address bits 23..16: 0x11" "Addr bits 23..16: 0x11" "Addr bits 23..16" "A23..A16"
318916-318937 spiflash: bit: "Address bits 15..8: 0x82" "Addr bits 15..8: 0x82" "Addr bits 15..8" "A15..A8"
318937-318958 spiflash: bit: "Address bits 7..0: 0x00" "Addr bits 7..0: 0x00" "Addr bits 7..0" "A7..A0"
318896-318958 spiflash: field: "Address: 0x118200" "Addr: 0x118200" "0x118200"
318962-324294 spiflash: field: "Data (256 bytes)"
318875-365733 spiflash: read: "Read data (addr 0x118200, 256 bytes): 6c 6c 6f 57 6f 72 6c 64 48 65 6c 6c 6f 57 6f 72 6c 64 48 65 6c 6c 6f 57 6f 72 6c 64 48 65 6c 6c 6f 57 6f 72 6c 64 48 65 6c 6c 6f 57 6f 72 6c 64 48 65 6c 6c 6f 57 6f 72 6c 64 48 65 6c 6c 6f 57 6f 72 6c 64 48 65 6c 6c 6f 57 6f 72 6c 64 48 65 6c 6c 6f 57 6f 72 6c 64 48 65 6c 6c 6f 57 6f 72 6c 64 48 65 6c 6c 6f 57 6f 72 6c 64 48 65 6c 6c 6f 57 6f 72 6c 64 48 65 6c 6c 6f 57 6f 72 6c 64 48 65 6c 6c 6f 57 6f 72 6c 64 48 65 6c 6c 6f 57 6f 72 6c 64 48 65 6c 6c 6f 57 6f 72 6c 64 48 65 6c 6c 6f 57 6f 72 6c 64 48 65 6c 6c 6f 57 6f 72 6c 64 48 65 6c 6c 6f 57 6f 72 6c 64 48 65 6c 6c 6f 57 6f 72 6c 64 48 65 6c 6c 6f 57 6f 72 6c 64 48 65 6c 6c 6f 57 6f 72 6c 64 48 65 6c 6c 6f 57 6f 72 6c 64 48 65 6c 6c 6f 57 6f 72 6c 64 48 65 6c 6c 6f 57 6f 72 6c 64 48 65 6c 6c 6f 57 6f 72"
369395-369416 spiflash: field: "Command: Read data (READ)" "Command: Read data" "Cmd: Read data" "Cmd: READ" "READ"
369416-369437 spiflash: bit: "Address bits 23..16: 0x11" "Addr bits 23..16: 0x11" "Addr bits 23..16" "A23..A16"
369437-369456 spiflash: bit: "Address bits 15..8: 0x83" "Addr bits 15..8: 0x83" "Addr bits 15..8" "A15..A8"
369458-369477 spiflash: bit: "Address bits 7..0: 0x00" "Addr bits 7..0: 0x00" "Addr bits 7..0" "A7..A0"
369416-369477 spiflash: field: "Address: 0x118300" "Addr: 0x118300" "0x118300"
369483-374816 spiflash: field: "Data (256 bytes)"
369395-415723 spiflash: read: "Read data (addr 0x118300, 256 bytes): 6c 64 48 65 6c 6c 6f 57 6f 72 6c 64 48 65 6c 6c 6f 57 6f 72 6c 64 48 65 6c 6c 6f 57 6f 72 6c 64 48 65 6c 6c 6f 57 6f 72 6c 64 48 65 6c 6c 6f 57 6f 72 6c 64 48 65 6c 6c 6f 57 6f 72 6c 64 48 65 6c 6c 6f 57 6f 72 6c 64 48 65 6c 6c 6f 57 6f 72 6c 64 48 65 6c 6c 6f 57 6f 72 6c 64 48 65 6c 6c 6f 57 6f 72 6c 64 48 65 6c 6c 6f 57 6f 72 6c 64 48 65 6c 6c 6f 57 6f 72 6c 64 48 65 6c 6c 6f 57 6f 72 6c 64 48 65 6c 6c 6f 57 6f 72 6c 64 48 65 6c 6c 6f 57 6f 72 6c 64 48 65 6c 6c 6f 57 6f 72 6c 64 48 65 6c 6c 6f 57 6f 72 6c 64 48 65 6c 6c 6f 57 6f 72 6c 64 48 65 6c 6c 6f 57 6f 72 6c 64 48 65 6c 6c 6f 57 6f 72 6c 64 48 65 6c 6c 6f 57 6f 72 6c 64 48 65 6c 6c 6f 57 6f 72 6c 64 48 65 6c 6c 6f 57 6f 72 6c 64 48 65 6c 6c 6f 57 6f 72 6c 64 48 65 6c 6c 6f 57 6f 72 6c 64 48 65 6c 6c"
420045-420064 spiflash: field: "Command: Read data (READ)" "Command: Read data" "Cmd: Read data" "Cmd: READ" "READ"
420066-420085 spiflash: bit: "Address bits 23..16: 0x11" "Addr bits 23..16: 0x11" "Addr bits 23..16" "A23..A16"
420087-420106 spiflash: bit: "Address bits 15..8: 0x84" "Addr bits 15..8: 0x84" "Addr bits 15..8" "A15..A8"
420107-420128 spiflash: bit: "Address bits 7..0: 0x00" "Addr bits 7..0: 0x00" "Addr bits 7..0" "A7..A0"
420066-420128 spiflash: field: "Address: 0x118400" "Addr: 0x118400" "0x118400"
420132-425464 spiflash: field: "Data (256 bytes)"
420045-465717 spiflash: read: "Read data (addr 0x118400, 256 bytes): 6f 57 6f 72 6c 64 48 65 6c 6c 6f 57 6f 72 6c 64 48 65 6c 6c 6f 57 6f 72 6c 64 48 65 6c 6c 6f 57 6f 72 6c 64 48 65 6c 6c 6f 57 6f 72 6c 64 48 65 6c 6c 6f 57 6f 72 6c 64 48 65 6c 6c 6f 57 6f 72 6c 64 48 65 6c 6c 6f 57 6f 72 6c 64 48 65 6c 6c 6f 57 6f 72 6c 64 48 65 6c 6c 6f 57 6f 72 6c 64 48 65 6c 6c 6f 57 6f 72 6c 64 48 65 6c 6c 6f 57 6f 72 6c 64 48 65 6c 6c 6f 57 6f 72 6c 64 48 65 6c 6c 6f 57 6f 72 6c 64 48 65 6c 6c 6f 57 6f 72 6c 64 48 65 6c 6c 6f 57 6f 72 6c 64 48 65 6c 6c 6f 57 6f 72 6c 64 48 65 6c 6c 6f 57 6f 72 6c 64 48 65 6c 6c 6f 57 6f 72 6c 64 48 65 6c 6c 6f 57 6f 72 6c 64 48 65 6c 6c 6f 57 6f 72 6c 64 48 65 6c 6c 6f 57 6f 72 6c 64 48 65 6c 6c 6f 57 6f 72 6c 64 48 65 6c 6c 6f 57 6f 72 6c 64 48 65 6c 6c 6f 57 6f 72 6c 64 48 65 6c 6c 6f 57 6f 72 6c 64"
469381-469400 spiflash: field: "Command: Read data (READ)" "Command: Read data" "Cmd: Read data" "Cmd: READ" "READ"
469402-469421 spiflash: bit: "Address bits 23..16: 0x11" "Addr bits 23..16: 0x11" "Addr bits 23..16" "A23..A16"
469423-469442 spiflash: bit: "Address bits 15..8: 0x85" "Addr bits 15..8: 0x85" "Addr bits 15..8" "A15..A8"
469443-469464 spiflash: bit: "Address bits 7..0: 0x00" "Addr bits 7..0: 0x00" "Addr bits 7..0" "A7..A0"
469402-469464 spiflash: field: "Address: 0x118500" "Addr: 0x118500" "0x118500"
469468-474800 spiflash: field: "Data (256 bytes)"
469381-517268 spiflash: read: "Read data (addr 0x118500, 256 bytes): 48 65 6c 6c 6f 57 6f 72 6c 64 48 65 6c 6c 6f 57 6f 72 6c 64 48 65 6c 6c 6f 57 6f 72 6c 64 48 65 6c 6c 6f 57 6f 72 6c 64 48 65 6c 6c 6f 57 6f 72 6c 64 48 65 6c 6c 6f 57 6f 72 6c 64 48 65 6c 6c 6f 57 6f 72 6c 64 48 65 6c 6c 6f 57 6f 72 6c 64 48 65 6c 6c 6f 57 6f 72 6c 64 48 65 6c 6c 6f 57 6f 72 6c 64 48 65 6c 6c 6f 57 6f 72 6c 64 48 65 6c 6c 6f 57 6f 72 6c 64 48 65 6c 6c 6f 57 6f 72 6c 64 48 65 6c 6c 6f 57 6f 72 6c 64 48 65 6c 6c 6f 57 6f 72 6c 64 48 65 6c 6c 6f 57 6f 72 6c 64 48 65 6c 6c 6f 57 6f 72 6c 64 48 65 6c 6c 6f 57 6f 72 6c 64 48 65 6c 6c 6f 57 6f 72 6c 64 48 65 6c 6c 6f 57 6f 72 6c 64 48 65 6c 6c 6f 57 6f 72 6c 64 48 65 6c 6c 6f 57 6f 72 6c 64 48 65 6c 6c 6f 57 6f 72 6c 64 48 65 6c 6c 6f 57 6f 72 6c 64 48 65 6c 6c 6f 57 6f 72 6c 64 48 65 6c 6c 6f 57"
518463-518482 spiflash: field: "Command: Read data (READ)" "Command: Read data" "Cmd: Read data" "Cmd: READ" "READ"
518484-518503 spiflash: bit: "Address bits 23..16: 0x11" "Addr bits 23..16: 0x11" "Addr bits 23..16" "A23..A16"
518504-518525 spiflash: bit: "Address bits 15..8: 0x86" "Addr bits 15..8: 0x86" "Addr bits 15..8" "A15..A8"
518525-518546 spiflash: bit: "Address bits 7..0: 0x00" "Addr bits 7..0: 0x00" "Addr bits 7..0" "A7..A0"
518484-518546 spiflash: field: "Address: 0x118600" "Addr: 0x118600" "0x118600"
518550-523882 spiflash: field: "Data (256 bytes)"
518463-565701 spiflash: read: "Read data (addr 0x118600, 256 bytes): 6f 72 6c 64 48 65 6c 6c 6f 57 6f 72 6c 64 48 65 6c 6c 6f 57 6f 72 6c 64 48 65 6c 6c 6f 57 6f 72 6c 64 48 65 6c 6c 6f 57 6f 72 6c 64 48 65 6c 6c 6f 57 6f 72 6c 64 48 65 6c 6c 6f 57 6f 72 6c 64 48 65 6c 6c 6f 57 6f 72 6c 64 48 65 6c 6c 6f 57 6f 72 6c 64 48 65 6c 6c 6f 57 6f 72 6c 64 48 65 6c 6c 6f 57 6f 72 6c 64 48 65 6c 6c 6f 57 6f 72 6c 64 48 65 6c 6c 6f 57 6f 72 6c 64 48 65 6c 6c 6f 57 6f 72 6c 64 48 65 6c 6c 6f 57 6f 72 6c 64 48 65 6c 6c 6f 57 6f 72 6c 64 48 65 6c 6c 6f 57 6f 72 6c 64 48 65 6c 6c 6f 57 6f 72 6c 64 48 65 6c 6c 6f 57 6f 72 6c 64 48 65 6c 6c 6f 57 6f 72 6c 64 48 65 6c 6c 6f 57 6f 72 6c 64 48 65 6c 6c 6f 57 6f 72 6c 64 48 65 6c 6c 6f 57 6f 72 6c 64 48 65 6c 6c 6f 57 6f 72 6c 64 48 65 6c 6c 6f 57 6f 72 6c 64 48 65 6c 6c 6f 57 6f 72 6c 64 48 65"
569365-569384 spiflash: field: "Command: Read data (READ)" "Command: Read data" "Cmd: Read data" "Cmd: READ" "READ"
569386-569405 spiflash: bit: "Address bits 23..16: 0x11" "Addr bits 23..16: 0x11" "Addr bits 23..16" "A23..A16"
569407-569426 spiflash: bit: "Address bits 15..8: 0x87" "Addr bits 15..8: 0x87" "Addr bits 15..8" "A15..A8"
569427-569448 spiflash: bit: "Address bits 7..0: 0x00" "Addr bits 7..0: 0x00" "Addr bits 7..0" "A7..A0"
569386-569448 spiflash: field: "Address: 0x118700" "Addr: 0x118700" "0x118700"
569452-574784 spiflash: field: "Data (256 bytes)"
569365-615697 spiflash: read: "Read data (addr 0x118700, 256 bytes): 6c 6c 6f 57 6f 72 6c 64 48 65 6c 6c 6f 57 6f 72 6c 64 48 65 6c 6c 6f 57 6f 72 6c 64 48 65 6c 6c 6f 57 6f 72 6c 64 48 65 6c 6c 6f 57 6f 72 6c 64 48 65 6c 6c 6f 57 6f 72 6c 64 48 65 6c 6c 6f 57 6f 72 6c 64 48 65 6c 6c 6f 57 6f 72 6c 64 48 65 6c 6c 6f 57 6f 72 6c 64 48 65 6c 6c 6f 57 6f 72 6c 64 48 65 6c 6c 6f 57 6f 72 6c 64 48 65 6c 6c 6f 57 6f 72 6c 64 48 65 6c 6c 6f 57 6f 72 6c 64 48 65 6c 6c 6f 57 6f 72 6c 64 48 65 6c 6c 6f 57 6f 72 6c 64 48 65 6c 6c 6f 57 6f 72 6c 64 48 65 6c 6c 6f 57 6f 72 6c 64 48 65 6c 6c 6f 57 6f 72 6c 64 48 65 6c 6c 6f 57 6f 72 6c 64 48 65 6c 6c 6f 57 6f 72 6c 64 48 65 6c 6c 6f 57 6f 72 6c 64 48 65 6c 6c 6f 57 6f 72 6c 64 48 65 6c 6c 6f 57 6f 72 6c 64 48 65 6c 6c 6f 57 6f 72 6c 64 48 65 6c 6c 6f 57 6f 72 6c 64 48 65 6c 6c 6f 57 6f 72"
619886-619905 spiflash: field: "Command: Read data (READ)" "Command: Read data" "Cmd: Read data" "Cmd: READ" "READ"
619907-619926 spiflash: bit: "Address bits 23..16: 0x11" "Addr bits 23..16: 0x11" "Addr bits 23..16" "A23..A16"
619927-619948 spiflash: bit: "Address bits 15..8: 0x88" "Addr bits 15..8: 0x88" "Addr bits 15..8" "A15..A8"
619948-619969 spiflash: bit: "Address bits 7..0: 0x00" "Addr bits 7..0: 0x00" "Addr bits 7..0" "A7..A0"
619907-619969 spiflash: field: "Address: 0x118800" "Addr: 0x118800" "0x118800"
619973-625305 spiflash: field: "Data (256 bytes)"
619886-665681 spiflash: read: "Read data (addr 0x118800, 256 bytes): 6c 64 48 65 6c 6c 6f 57 6f 72 6c 64 48 65 6c 6c 6f 57 6f 72 6c 64 48 65 6c 6c 6f 57 6f 72 6c 64 48 65 6c 6c 6f 57 6f 72 6c 64 48 65 6c 6c 6f 57 6f 72 6c 64 48 65 6c 6c 6f 57 6f 72 6c 64 48 65 6c 6c 6f 57 6f 72 6c 64 48 65 6c 6c 6f 57 6f 72 6c 64 48 65 6c 6c 6f 57 6f 72 6c 64 48 65 6c 6c 6f 57 6f 72 6c 64 48 65 6c 6c 6f 57 6f 72 6c 64 48 65 6c 6c 6f 57 6f 72 6c 64 48 65 6c 6c 6f 57 6f 72 6c 64 48 65 6c 6c 6f 57 6f 72 6c 64 48 65 6c 6c 6f 57 6f 72 6c 64 48 65 6c 6c 6f 57 6f 72 6c 64 48 65 6c 6c 6f 57 6f 72 6c 64 48 65 6c 6c 6f 57 6f 72 6c 64 48 65 6c 6c 6f 57 6f 72 6c 64 48 65 6c 6c 6f 57 6f 72 6c 64 48 65 6c 6c 6f 57 6f 72 6c 64 48 65 6c 6c 6f 57 6f 72 6c 64 48 65 6c 6c 6f 57 6f 72 6c 64 48 65 6c 6c 6f 57 6f 72 6c 64 48 65 6c 6c 6f 57 6f 72 6c 64 48 65 6c 6c"
670910-670929 spiflash: field: "Command: Read data (READ)" "Command: Read data" "Cmd: Read data" "Cmd: READ" "READ"
670930-670951 spiflash: bit: "Address bits 23..16: 0x11" "Addr bits 23..16: 0x11" "Addr bits 23..16" "A23..A16"
670951-670972 spiflash: bit: "Address bits 15..8: 0x89" "Addr bits 15..8: 0x89" "Addr bits 15..8" "A15..A8"
670972-670993 spiflash: bit: "Address bits 7..0: 0x00" "Addr bits 7..0: 0x00" "Addr bits 7..0" "A7..A0"
670930-670993 spiflash: field: "Address: 0x118900" "Addr: 0x118900" "0x118900"
670997-676329 spiflash: field: "Data (256 bytes)"
670910-715816 spiflash: read: "Read data (addr 0x118900, 256 bytes): 6f 57 6f 72 6c 64 48 65 6c 6c 6f 57 6f 72 6c 64 48 65 6c 6c 6f 57 6f 72 6c 64 48 65 6c 6c 6f 57 6f 72 6c 64 48 65 6c 6c 6f 57 6f 72 6c 64 48 65 6c 6c 6f 57 6f 72 6c 64 48 65 6c 6c 6f 57 6f 72 6c 64 48 65 6c 6c 6f 57 6f 72 6c 64 48 65 6c 6c 6f 57 6f 72 6c 64 48 65 6c 6c 6f 57 6f 72 6c 64 48 65 6c 6c 6f 57 6f 72 6c 64 48 65 6c 6c 6f 57 6f 72 6c 64 48 65 6c 6c 6f 57 6f 72 6c 64 48 65 6c 6c 6f 57 6f 72 6c 64 48 65 6c 6c 6f 57 6f 72 6c 64 48 65 6c 6c 6f 57 6f 72 6c 64 48 65 6c 6c 6f 57 6f 72 6c 64 48 65 6c 6c 6f 57 6f 72 6c 64 48 65 6c 6c 6f 57 6f 72 6c 64 48 65 6c 6c 6f 57 6f 72 6c 64 48 65 6c 6c 6f 57 6f 72 6c 64 48 65 6c 6c 6f 57 6f 72 6c 64 48 65 6c 6c 6f 57 6f 72 6c 64 48 65 6c 6c 6f 57 6f 72 6c 64 48 65 6c 6c 6f 57 6f 72 6c 64 48 65 6c 6c 6f 57 6f 72 6c 64"
719898-719919 spiflash: field: "Command: Read data (READ)" "Command: Read data" "Cmd: Read data" "Cmd: READ" "READ"
719919-719938 spiflash: bit: "Address bits 23..16: 0x11" "Addr bits 23..16: 0x11" "Addr bits 23..16" "A23..A16"
719940-719959 spiflash: bit: "Address bits 15..8: 0x8a" "Addr bits 15..8: 0x8a" "Addr bits 15..8" "A15..A8"
719961-719980 spiflash: bit: "Address bits 7..0: 0x00" "Addr bits 7..0: 0x00" "Addr bits 7..0" "A7..A0"
719919-719980 spiflash: field: "Address: 0x118a00" "Addr: 0x118a00" "0x118a00"
719986-725317 spiflash: field: "Data (256 bytes)"
719898-765679 spiflash: read: "Read data (addr 0x118a00, 256 bytes): 48 65 6c 6c 6f 57 6f 72 6c 64 48 65 6c 6c 6f 57 6f 72 6c 64 48 65 6c 6c 6f 57 6f 72 6c 64 48 65 6c 6c 6f 57 6f 72 6c 64 48 65 6c 6c 6f 57 6f 72 6c 64 48 65 6c 6c 6f 57 6f 72 6c 64 48 65 6c 6c 6f 57 6f 72 6c 64 48 65 6c 6c 6f 57 6f 72 6c 64 48 65 6c 6c 6f 57 6f 72 6c 64 48 65 6c 6c 6f 57 6f 72 6c 64 48 65 6c 6c 6f 57 6f 72 6c 64 48 65 6c 6c 6f 57 6f 72 6c 64 48 65 6c 6c 6f 57 6f 72 6c 64 48 65 6c 6c 6f 57 6f 72 6c 64 48 65 6c 6c 6f 57 6f 72 6c 64 48 65 6c 6c 6f 57 6f 72 6c 64 48 65 6c 6c 6f 57 6f 72 6c 64 48 65 6c 6c 6f 57 6f 72 6c 64 48 65 6c 6c 6f 57 6f 72 6c 64 48 65 6c 6c 6f 57 6f 72 6c 64 48 65 6c 6c 6f 57 6f 72 6c 64 48 65 6c 6c 6f 57 6f 72 6c 64 48 65 6c 6c 6f 57 6f 72 6c 64 48 65 6c 6c 6f 57 6f 72 6c 64 48 65 6c 6c 6f 57 6f 72 6c 64 48 65 6c 6c 6f 57"
769329-769350 spiflash: field: "Command: Read data (READ)" "Command: Read data" "Cmd: Read data" "Cmd: READ" "READ"
769350-769369 spiflash: bit: "Address bits 23..16: 0x11" "Addr bits 23..16: 0x11" "Addr bits 23..16" "A23..A16"
769371-769390 spiflash: bit: "Address bits 15..8: 0x8b" "Addr bits 15..8: 0x8b" "Addr bits 15..8" "A15..A8"
769392-769411 spiflash: bit: "Address bits 7..0: 0x00" "Addr bits 7..0: 0x00" "Addr bits 7..0" "A7..A0"
769350-769411 spiflash: field: "Address: 0x118b00" "Addr: 0x118b00" "0x118b00"
769417-774748 spiflash: field: "Data (256 bytes)"
769329-815690 spiflash: read: "Read data (addr 0x118b00, 256 bytes): 6f 72 6c 64 48 65 6c 6c 6f 57 6f 72 6c 64 48 65 6c 6c 6f 57 6f 72 6c 64 48 65 6c 6c 6f 57 6f 72 6c 64 48 65 6c 6c 6f 57 6f 72 6c 64 48 65 6c 6c 6f 57 6f 72 6c 64 48 65 6c 6c 6f 57 6f 72 6c 64 48 65 6c 6c 6f 57 6f 72 6c 64 48 65 6c 6c 6f 57 6f 72 6c 64 48 65 6c 6c 6f 57 6f 72 6c 64 48 65 6c 6c 6f 57 6f 72 6c 64 48 65 6c 6c 6f 57 6f 72 6c 64 48 65 6c 6c 6f 57 6f 72 6c 64 48 65 6c 6c 6f 57 6f 72 6c 64 48 65 6c 6c 6f 57 6f 72 6c 64 48 65 6c 6c 6f 57 6f 72 6c 64 48 65 6c 6c 6f 57 6f 72 6c 64 48 65 6c 6c 6f 57 6f 72 6c 64 48 65 6c 6c 6f 57 6f 72 6c 64 48 65 6c 6c 6f 57 6f 72 6c 64 48 65 6c 6c 6f 57 6f 72 6c 64 48 65 6c 6c 6f 57 6f 72 6c 64 48 65 6c 6c 6f 57 6f 72 6c 64 48 65 6c 6c 6f 57 6f 72 6c 64 48 65 6c 6c 6f 57 6f 72 6c 64 48 65 6c 6c 6f 57 6f 72 6c 64 48 65"
819872-819891 spiflash: field: "Command: Read data (READ)" "Command: Read data" "Cmd: Read data" "Cmd: READ" "READ"
819892-819913 spiflash: bit: "Address bits 23..16: 0x11" "Addr bits 23..16: 0x11" "Addr bits 23..16" "A23..A16"
819913-819934 spiflash: bit: "Address bits 15..8: 0x8c" "Addr bits 15..8: 0x8c" "Addr bits 15..8" "A15..A8"
819934-819955 spiflash: bit: "Address bits 7..0: 0x00" "Addr bits 7..0: 0x00" "Addr bits 7..0" "A7..A0"
819892-819955 spiflash: field: "Address: 0x118c00" "Addr: 0x118c00" "0x118c00"
819959-825292 spiflash: field: "Data (256 bytes)"
819872-866190 spiflash: read: "Read data (addr 0x118c00, 256 bytes): 6c 6c 6f 57 6f 72 6c 64 48 65 6c 6c 6f 57 6f 72 6c 64 48 65 6c 6c 6f 57 6f 72 6c 64 48 65 6c 6c 6f 57 6f 72 6c 64 48 65 6c 6c 6f 57 6f 72 6c 64 48 65 6c 6c 6f 57 6f 72 6c 64 48 65 6c 6c 6f 57 6f 72 6c 64 48 65 6c 6c 6f 57 6f 72 6c 64 48 65 6c 6c 6f 57 6f 72 6c 64 48 65 6c 6c 6f 57 6f 72 6c 64 48 65 6c 6c 6f 57 6f 72 6c 64 48 65 6c 6c 6f 57 6f 72 6c 64 48 65 6c 6c 6f 57 6f 72 6c 64 48 65 6c 6c 6f 57 6f 72 6c 64 48 65 6c 6c 6f 57 6f 72 6c 64 48 65 6c 6c 6f 57 6f 72 6c 64 48 65 6c 6c 6f 57 6f 72 6c 64 48 65 6c 6c 6f 57 6f 72 6c 64 48 65 6c 6c 6f 57 6f 72 6c 64 48 65 6c 6c 6f 57 6f 72 6c 64 48 65 6c 6c 6f 57 6f 72 6c 64 48 65 6c 6c 6f 57 6f 72 6c 64 48 65 6c 6c 6f 57 6f 72 6c 64 48 65 6c 6c 6f 57 6f 72 6c 64 48 65 6c 6c 6f 57 6f 72 6c 64 48 65 6c 6c 6f 57 6f 72"
870382-870403 spiflash: field: "Command: Read data (READ)" "Command: Read data" "Cmd: Read data" "Cmd: READ" "READ"
870403-870422 spiflash: bit: "Address bits 23..16: 0x11" "Addr bits 23..16: 0x11" "Addr bits 23..16" "A23..A16"
870424-870443 spiflash: bit: "Address bits 15..8: 0x8d" "Addr bits 15..8: 0x8d" "Addr bits 15..8" "A15..A8"
870445-870464 spiflash: bit: "Address bits 7..0: 0x00" "Addr bits 7..0: 0x00" "Addr bits 7..0" "A7..A0"
870403-870464 spiflash: field: "Address: 0x118d00" "Addr: 0x118d00" "0x118d00"
870470-875803 spiflash: field: "Data (256 bytes)"
870382-915131 spiflash: read: "Read data (addr 0x118d00, 256 bytes): 6c 64 48 65 6c 6c 6f 57 6f 72 6c 64 48 65 6c 6c 6f 57 6f 72 6c 64 48 65 6c 6c 6f 57 6f 72 6c 64 48 65 6c 6c 6f 57 6f 72 6c 64 48 65 6c 6c 6f 57 6f 72 6c 64 48 65 6c 6c 6f 57 6f 72 6c 64 48 65 6c 6c 6f 57 6f 72 6c 64 48 65 6c 6c 6f 57 6f 72 6c 64 48 65 6c 6c 6f 57 6f 72 6c 64 48 65 6c 6c 6f 57 6f 72 6c 64 48 65 6c 6c 6f 57 6f 72 6c 64 48 65 6c 6c 6f 57 6f 72 6c 64 48 65 6c 6c 6f 57 6f 72 6c 64 48 65 6c 6c 6f 57 6f 72 6c 64 48 65 6c 6c 6f 57 6f 72 6c 64 48 65 6c 6c 6f 57 6f 72 6c 64 48 65 6c 6c 6f 57 6f 72 6c 64 48 65 6c 6c 6f 57 6f 72 6c 64 48 65 6c 6c 6f 57 6f 72 6c 64 48 65 6c 6c 6f 57 6f 72 6c 64 48 65 6c 6c 6f 57 6f 72 6c 64 48 65 6c 6c 6f 57 6f 72 6c 64 48 65 6c 6c 6f 57 6f 72 6c 64 48 65 6c 6c 6f 57 6f 72 6c 64 48 65 6c 6c 6f 57 6f 72 6c 64 48 65 6c 6c"
919315-919334 spiflash: field: "Command: Read data (READ)" "Command: Read data" "Cmd: Read data" "Cmd: READ" "READ"
919336-919355 spiflash: bit: "Address bits 23..16: 0x11" "Addr bits 23..16: 0x11" "Addr bits 23..16" "A23..A16"
919356-919377 spiflash: bit: "Address bits 15..8: 0x8e" "Addr bits 15..8: 0x8e" "Addr bits 15..8" "A15..A8"
919377-919398 spiflash: bit: "Address bits 7..0: 0x00" "Addr bits 7..0: 0x00" "Addr bits 7..0" "A7..A0"
919336-919398 spiflash: field: "Address: 0x118e00" "Addr: 0x118e00" "0x118e00"
919402-924734 spiflash: field: "Data (256 bytes)"
919315-965127 spiflash: read: "Read data (addr 0x118e00, 256 bytes): 6f 57 6f 72 6c 64 48 65 6c 6c 6f 57 6f 72 6c 64 48 65 6c 6c 6f 57 6f 72 6c 64 48 65 6c 6c 6f 57 6f 72 6c 64 48 65 6c 6c 6f 57 6f 72 6c 64 48 65 6c 6c 6f 57 6f 72 6c 64 48 65 6c 6c 6f 57 6f 72 6c 64 48 65 6c 6c 6f 57 6f 72 6c 64 48 65 6c 6c 6f 57 6f 72 6c 64 48 65 6c 6c 6f 57 6f 72 6c 64 48 65 6c 6c 6f 57 6f 72 6c 64 48 65 6c 6c 6f 57 6f 72 6c 64 48 65 6c 6c 6f 57 6f 72 6c 64 48 65 6c 6c 6f 57 6f 72 6c 64 48 65 6c 6c 6f 57 6f 72 6c 64 48 65 6c 6c 6f 57 6f 72 6c 64 48 65 6c 6c 6f 57 6f 72 6c 64 48 65 6c 6c 6f 57 6f 72 6c 64 48 65 6c 6c 6f 57 6f 72 6c 64 48 65 6c 6c 6f 57 6f 72 6c 64 48 65 6c 6c 6f 57 6f 72 6c 64 48 65 6c 6c 6f 57 6f 72 6c 64 48 65 6c 6c 6f 57 6f 72 6c 64 48 65 6c 6c 6f 57 6f 72 6c 64 48 65 6c 6c 6f 57 6f 72 6c 64 48 65 6c 6c 6f 57 6f 72 6c 64"
970364-970385 spiflash: field: "Command: Read data (READ)" "Command: Read data" "Cmd: Read data" "Cmd: READ" "READ"
970385-970406 spiflash: bit: "Address bits 23..16: 0x11" "Addr bits 23..16: 0x11" "Addr bits 23..16" "A23..A16"
970406-970427 spiflash: bit: "Address bits 15..8: 0x8f" "Addr bits 15..8: 0x8f" "Addr bits 15..8" "A15..A8"
970427-970446 spiflash: bit: "Address bits 7..0: 0x00" "Addr bits 7..0: 0x00" "Addr bits 7..0" "A7..A0"
970385-970446 spiflash: field: "Address: 0x118f00" "Addr: 0x118f00" "0x118f00"
970452-975785 spiflash: field: "Data (256 bytes)"
970364-1018702 spiflash: read: "Read data (addr 0x118f00, 256 bytes): 48 65 6c 6c 6f 57 6f 72 6c 64 48 65 6c 6c 6f 57 6f 72 6c 64 48 65 6c 6c 6f 57 6f 72 6c 64 48 65 6c 6c 6f 57 6f 72 6c 64 48 65 6c 6c 6f 57 6f 72 6c 64 48 65 6c 6c 6f 57 6f 72 6c 64 48 65 6c 6c 6f 57 6f 72 6c 64 48 65 6c 6c 6f 57 6f 72 6c 64 48 65 6c 6c 6f 57 6f 72 6c 64 48 65 6c 6c 6f 57 6f 72 6c 64 48 65 6c 6c 6f 57 6f 72 6c 64 48 65 6c 6c 6f 57 6f 72 6c 64 48 65 6c 6c 6f 57 6f 72 6c 64 48 65 6c 6c 6f 57 6f 72 6c 64 48 65 6c 6c 6f 57 6f 72 6c 64 48 65 6c 6c 6f 57 6f 72 6c 64 48 65 6c 6c 6f 57 6f 72 6c 64 48 65 6c 6c 6f 57 6f 72 6c 64 48 65 6c 6c 6f 57 6f 72 6c 64 48 65 6c 6c 6f 57 6f 72 6c 64 48 65 6c 6c 6f 57 6f 72 6c 64 48 65 6c 6c 6f 57 6f 72 6c 64 48 65 6c 6c 6f 57 6f 72 6c 64 48 65 6c 6c 6f 57 6f 72 6c 64 48 65 6c 6c 6f 57 6f 72 6c 64 48 65 6c 6c 6f 57"
1023088-1023109 spiflash: field: "Command: Read data (READ)" "Command: Read data" "Cmd: Read data" "Cmd: READ" "READ"
1023109-1023130 spiflash: bit: "Address bits 23..16: 0x11" "Addr bits 23..16: 0x11" "Addr bits 23..16" "A23..A16"
1023130-1023149 spiflash: bit: "Address bits 15..8: 0x90" "Addr bits 15..8: 0x90" "Addr bits 15..8" "A15..A8"
1023151-1023170 spiflash: bit: "Address bits 7..0: 0x00" "Addr bits 7..0: 0x00" "Addr bits 7..0" "A7..A0"
1023109-1023170 spiflash: field: "Address: 0x119000" "Addr: 0x119000" "0x119000"
1023176-1028509 spiflash: field: "Data (256 bytes)"
1023088-1065113 spiflash: read: "Read data (addr 0x119000, 256 bytes): 6f 72 6c 64 48 65 6c 6c 6f 57 6f 72 6c 64 48 65 6c 6c 6f 57 6f 72 6c 64 48 65 6c 6c 6f 57 6f 72 6c 64 48 65 6c 6c 6f 57 6f 72 6c 64 48 65 6c 6c 6f 57 6f 72 6c 64 48 65 6c 6c 6f 57 6f 72 6c 64 48 65 6c 6c 6f 57 6f 72 6c 64 48 65 6c 6c 6f 57 6f 72 6c 64 48 65 6c 6c 6f 57 6f 72 6c 64 48 65 6c 6c 6f 57 6f 72 6c 64 48 65 6c 6c 6f 57 6f 72 6c 64 48 65 6c 6c 6f 57 6f 72 6c 64 48 65 6c 6c 6f 57 6f 72 6c 64 48 65 6c 6c 6f 57 6f 72 6c 64 48 65 6c 6c 6f 57 6f 72 6c 64 48 65 6c 6c 6f 57 6f 72 6c 64 48 65 6c 6c 6f 57 6f 72 6c 64 48 65 6c 6c 6f 57 6f 72 6c 64 48 65 6c 6c 6f 57 6f 72 6c 64 48 65 6c 6c 6f 57 6f 72 6c 64 48 65 6c 6c 6f 57 6f 72 6c 64 48 65 6c 6c 6f 57 6f 72 6c 64 48 65 6c 6c 6f 57 6f 72 6c 64 48 65 6c 6c 6f 57 6f 72 6c 64 48 65 6c 6c 6f 57 6f 72 6c 64 48 65"
1095848-1095867 spiflash: field: "Command: Read data (READ)" "Command: Read data" "Cmd: Read data" "Cmd: READ" "READ"
1095869-1095888 spiflash: bit: "Address bits 23..16: 0x11" "Addr bits 23..16: 0x11" "Addr bits 23..16" "A23..A16"
1095889-1095910 spiflash: bit: "Address bits 15..8: 0x91" "Addr bits 15..8: 0x91" "Addr bits 15..8" "A15..A8"
1095910-1095931 spiflash: bit: "Address bits 7..0: 0x00" "Addr bits 7..0: 0x00" "Addr bits 7..0" "A7..A0"
1095869-1095931 spiflash: field: "Address: 0x119100" "Addr: 0x119100" "0x119100"
1095935-1101267 spiflash: field: "Data (256 bytes)"
1095848-1115630 spiflash: read: "Read data (addr 0x119100, 256 bytes): 6c 6c 6f 57 6f 72 6c 64 48 65 6c 6c 6f 57 6f 72 6c 64 48 65 6c 6c 6f 57 6f 72 6c 64 48 65 6c 6c 6f 57 6f 72 6c 64 48 65 6c 6c 6f 57 6f 72 6c 64 48 65 6c 6c 6f 57 6f 72 6c 64 48 65 6c 6c 6f 57 6f 72 6c 64 48 65 6c 6c 6f 57 6f 72 6c 64 48 65 6c 6c 6f 57 6f 72 6c 64 48 65 6c 6c 6f 57 6f 72 6c 64 48 65 6c 6c 6f 57 6f 72 6c 64 48 65 6c 6c 6f 57 6f 72 6c 64 48 65 6c 6c 6f 57 6f 72 6c 64 48 65 6c 6c 6f 57 6f 72 6c 64 48 65 6c 6c 6f 57 6f 72 6c 64 48 65 6c 6c 6f 57 6f 72 6c 64 48 65 6c 6c 6f 57 6f 72 6c 64 48 65 6c 6c 6f 57 6f 72 6c 64 48 65 6c 6c 6f 57 6f 72 6c 64 48 65 6c 6c 6f 57 6f 72 6c 64 48 65 6c 6c 6f 57 6f 72 6c 64 48 65 6c 6c 6f 57 6f 72 6c 64 48 65 6c 6c 6f 57 6f 72 6c 64 48 65 6c 6c 6f 57 6f 72 6c 64 48 65 6c 6c 6f 57 6f 72 6c 64 48 65 6c 6c 6f 57 6f 72"
1120344-1120363 spiflash: field: "Command: Read data (READ)" "Command: Read data" "Cmd: Read data" "Cmd: READ" "READ"
1120365-1120384 spiflash: bit: "Address bits 23..16: 0x11" "Addr bits 23..16: 0x11" "Addr bits 23..16" "A23..A16"
1120386-1120405 spiflash: bit: "Address bits 15..8: 0x92" "Addr bits 15..8: 0x92" "Addr bits 15..8" "A15..A8"
1120406-1120427 spiflash: bit: "Address bits 7..0: 0x00" "Addr bits 7..0: 0x00" "Addr bits 7..0" "A7..A0"
1120365-1120427 spiflash: field: "Address: 0x119200" "Addr: 0x119200" "0x119200"
1120431-1125763 spiflash: field: "Data (256 bytes)"
1120344-1165625 spiflash: read: "Read data (addr 0x119200, 256 bytes): 6c 64 48 65 6c 6c 6f 57 6f 72 6c 64 48 65 6c 6c 6f 57 6f 72 6c 64 48 65 6c 6c 6f 57 6f 72 6c 64 48 65 6c 6c 6f 57 6f 72 6c 64 48 65 6c 6c 6f 57 6f 72 6c 64 48 65 6c 6c 6f 57 6f 72 6c 64 48 65 6c 6c 6f 57 6f 72 6c 64 48 65 6c 6c 6f 57 6f 72 6c 64 48 65 6c 6c 6f 57 6f 72 6c 64 48 65 6c 6c 6f 57 6f 72 6c 64 48 65 6c 6c 6f 57 6f 72 6c 64 48 65 6c 6c 6f 57 6f 72 6c 64 48 65 6c 6c 6f 57 6f 72 6c 64 48 65 6c 6c 6f 57 6f 72 6c 64 48 65 6c 6c 6f 57 6f 72 6c 64 48 65 6c 6c 6f 57 6f 72 6c 64 48 65 6c 6c 6f 57 6f 72 6c 64 48 65 6c 6c 6f 57 6f 72 6c 64 48 65 6c 6c 6f 57 6f 72 6c 64 48 65 6c 6c 6f 57 6f 72 6c 64 48 65 6c 6c 6f 57 6f 72 6c 64 48 65 6c 6c 6f 57 6f 72 6c 64 48 65 6c 6c 6f 57 6f 72 6c 64 48 65 6c 6c 6f 57 6f 72 6c 64 48 65 6c 6c 6f 57 6f 72 6c 64 48 65 6c 6c"
1169283-1169302 spiflash: field: "Command: Read data (READ)" "Command: Read data" "Cmd: Read data" "Cmd: READ" "READ"
1169304-1169323 spiflash: bit: "Address bits 23..16: 0x11" "Addr bits 23..16: 0x11" "Addr bits 23..16" "A23..A16"
1169324-1169345 spiflash: bit: "Address bits 15..8: 0x93" "Addr bits 15..8: 0x93" "Addr bits 15..8" "A15..A8"
1169345-1169366 spiflash: bit: "Address bits 7..0: 0x00" "Addr bits 7..0: 0x00" "Addr bits 7..0" "A7..A0"
1169304-1169366 spiflash: field: "Address: 0x119300" "Addr: 0x119300" "0x119300"
1169370-1174702 spiflash: field: "Data (256 bytes)"
1169283-1215637 spiflash: read: "Read data (addr 0x119300, 256 bytes): 6f 57 6f 72 6c 64 48 65 6c 6c 6f 57 6f 72 6c 64 48 65 6c 6c 6f 57 6f 72 6c 64 48 65 6c 6c 6f 57 6f 72 6c 64 48 65 6c 6c 6f 57 6f 72 6c 64 48 65 6c 6c 6f 57 6f 72 6c 64 48 65 6c 6c 6f 57 6f 72 6c 64 48 65 6c 6c 6f 57 6f 72 6c 64 48 65 6c 6c 6f 57 6f 72 6c 64 48 65 6c 6c 6f 57 6f 72 6c 64 48 65 6c 6c 6f 57 6f 72 6c 64 48 65 6c 6c 6f 57 6f 72 6c 64 48 65 6c 6c 6f 57 6f 72 6c 64 48 65 6c 6c 6f 57 6f 72 6c 64 48 65 6c 6c 6f 57 6f 72 6c 64 48 65 6c 6c 6f 57 6f 72 6c 64 48 65 6c 6c 6f 57 6f 72 6c 64 48 65 6c 6c 6f 57 6f 72 6c 64 48 65 6c 6c 6f 57 6f 72 6c 64 48 65 6c 6c 6f 57 6f 72 6c 64 48 65 6c 6c 6f 57 6f 72 6c 64 48 65 6c 6c 6f 57 6f 72 6c 64 48 65 6c 6c 6f 57 6f 72 6c 64 48 65 6c 6c 6f 57 6f 72 6c 64 48 65 6c 6c 6f 57 6f 72 6c 64 48 65 6c 6c 6f 57 6f 72 6c 64"
1219806-1219825 spiflash: field: "Command: Read data (READ)" "Command: Read data" "Cmd: Read data" "Cmd: READ" "READ"
1219827-1219846 spiflash: bit: "Address bits 23..16: 0x11" "Addr bits 23..16: 0x11" "Addr bits 23..16" "A23..A16"
1219847-1219868 spiflash: bit: "Address bits 15..8: 0x94" "Addr bits 15..8: 0x94" "Addr bits 15..8" "A15..A8"
1219868-1219889 spiflash: bit: "Address bits 7..0: 0x00" "Addr bits 7..0: 0x00" "Addr bits 7..0" "A7..A0"
1219827-1219889 spiflash: field: "Address: 0x119400" "Addr: 0x119400" "0x119400"
1219893-1225225 spiflash: field: "Data (256 bytes)"
1219806-1265604 spiflash: read: "Read data (addr 0x119400, 256 bytes): 48 65 6c 6c 6f 57 6f 72 6c 64 48 65 6c 6c 6f 57 6f 72 6c 64 48 65 6c 6c 6f 57 6f 72 6c 64 48 65 6c 6c 6f 57 6f 72 6c 64 48 65 6c 6c 6f 57 6f 72 6c 64 48 65 6c 6c 6f 57 6f 72 6c 64 48 65 6c 6c 6f 57 6f 72 6c 64 48 65 6c 6c 6f 57 6f 72 6c 64 48 65 6c 6c 6f 57 6f 72 6c 64 48 65 6c 6c 6f 57 6f 72 6c 64 48 65 6c 6c 6f 57 6f 72 6c 64 48 65 6c 6c 6f 57 6f 72 6c 64 48 65 6c 6c 6f 57 6f 72 6c 64 48 65 6c 6c 6f 57 6f 72 6c 64 48 65 6c 6c 6f 57 6f 72 6c 64 48 65 6c 6c 6f 57 6f 72 6c 64 48 65 6c 6c 6f 57 6f 72 6c 64 48 65 6c 6c 6f 57 6f 72 6c 64 48 65 6c 6c 6f 57 6f 72 6c 64 48 65 6c 6c 6f 57 6f 72 6c 64 48 65 6c 6c 6f 57 6f 72 6c 64 48 65 6c 6c 6f 57 6f 72 6c 64 48 65 6c 6c 6f 57 6f 72 6c 64 48 65 6c 6c 6f 57 6f 72 6c 64 48 65 6c 6c 6f 57 6f 72 6c 64 48 65 6c 6c 6f 57"
1269271-1269292 spiflash: field: "Command: Read data (READ)" "Command: Read data" "Cmd: Read data" "Cmd: READ" "READ"
1269292-1269313 spiflash: bit: "Address bits 23..16: 0x11" "Addr bits 23..16: 0x11" "Addr bits 23..16" "A23..A16"
1269313-1269334 spiflash: bit: "Address bits 15..8: 0x95" "Addr bits 15..8: 0x95" "Addr bits 15..8" "A15..A8"
1269334-1269353 spiflash: bit: "Address bits 7..0: 0x00" "Addr bits 7..0: 0x00" "Addr bits 7..0" "A7..A0"
1269292-1269353 spiflash: field: "Address: 0x119500" "Addr: 0x119500" "0x119500"
1269359-1274692 spiflash: field: "Data (256 bytes)"
1269271-1315617 spiflash: read: "Read data (addr 0x119500, 256 bytes): 6f 72 6c 64 48 65 6c 6c 6f 57 6f 72 6c 64 48 65 6c 6c 6f 57 6f 72 6c 64 48 65 6c 6c 6f 57 6f 72 6c 64 48 65 6c 6c 6f 57 6f 72 6c 64 48 65 6c 6c 6f 57 6f 72 6c 64 48 65 6c 6c 6f 57 6f 72 6c 64 48 65 6c 6c 6f 57 6f 72 6c 64 48 65 6c 6c 6f 57 6f 72 6c 64 48 65 6c 6c 6f 57 6f 72 6c 64 48 65 6c 6c 6f 57 6f 72 6c 64 48 65 6c 6c 6f 57 6f 72 6c 64 48 65 6c 6c 6f 57 6f 72 6c 64 48 65 6c 6c 6f 57 6f 72 6c 64 48 65 6c 6c 6f 57 6f 72 6c 64 48 65 6c 6c 6f 57 6f 72 6c 64 48 65 6c 6c 6f 57 6f 72 6c 64 48 65 6c 6c 6f 57 6f 72 6c 64 48 65 6c 6c 6f 57 6f 72 6c 64 48 65 6c 6c 6f 57 6f 72 6c 64 48 65 6c 6c 6f 57 6f 72 6c 64 48 65 6c 6c 6f 57 6f 72 6c 64 48 65 6c 6c 6f 57 6f 72 6c 64 48 65 6c 6c 6f 57 6f 72 6c 64 48 65 6c 6c 6f 57 6f 72 6c 64 48 65 6c 6c 6f 57 6f 72 6c 64 48 65"
1318746-1318765 spiflash: field: "Command: Read data (READ)" "Command: Read data" "Cmd: Read data" "Cmd: READ" "READ"
1318766-1318787 spiflash: bit: "Address bits 23..16: 0x11" "Addr bits 23..16: 0x11" "Addr bits 23..16" "A23..A16"
1318787-1318808 spiflash: bit: "Address bits 15..8: 0x96" "Addr bits 15..8: 0x96" "Addr bits 15..8" "A15..A8"
1318808-1318829 spiflash: bit: "Address bits 7..0: 0x00" "Addr bits 7..0: 0x00" "Addr bits 7..0" "A7..A0"
1318766-1318829 spiflash: field: "Address: 0x119600" "Addr: 0x119600" "0x119600"
1318833-1324166 spiflash: field: "Data (256 bytes)"
1318746-1365593 spiflash: read: "Read data (addr 0x119600, 256 bytes): 6c 6c 6f 57 6f 72 6c 64 48 65 6c 6c 6f 57 6f 72 6c 64 48 65 6c 6c 6f 57 6f 72 6c 64 48 65 6c 6c 6f 57 6f 72 6c 64 48 65 6c 6c 6f 57 6f 72 6c 64 48 65 6c 6c 6f 57 6f 72 6c 64 48 65 6c 6c 6f 57 6f 72 6c 64 48 65 6c 6c 6f 57 6f 72 6c 64 48 65 6c 6c 6f 57 6f 72 6c 64 48 65 6c 6c 6f 57 6f 72 6c 64 48 65 6c 6c 6f 57 6f 72 6c 64 48 65 6c 6c 6f 57 6f 72 6c 64 48 65 6c 6c 6f 57 6f 72 6c 64 48 65 6c 6c 6f 57 6f 72 6c 64 48 65 6c 6c 6f 57 6f 72 6c 64 48 65 6c 6c 6f 57 6f 72 6c 64 48 65 6c 6c 6f 57 6f 72 6c 64 48 65 6c 6c 6f 57 6f 72 6c 64 48 65 6c 6c 6f 57 6f 72 6c 64 48 65 6c 6c 6f 57 6f 72 6c 64 48 65 6c 6c 6f 57 6f 72 6c 64 48 65 6c 6c 6f 57 6f 72 6c 64 48 65 6c 6c 6f 57 6f 72 6c 64 48 65 6c 6c 6f 57 6f 72 6c 64 48 65 6c 6c 6f 57 6f 72 6c 64 48 65 6c 6c 6f 57 6f 72"
1369265-1369286 spiflash: field: "Command: Read data (READ)" "Command: Read data" "Cmd: Read data" "Cmd: READ" "READ"
1369286-1369307 spiflash: bit: "Address bits 23..16: 0x11" "Addr bits 23..16: 0x11" "Addr bits 23..16" "A23..A16"
1369307-1369326 spiflash: bit: "Address bits 15..8: 0x97" "Addr bits 15..8: 0x97" "Addr bits 15..8" "A15..A8"
1369328-1369347 spiflash: bit: "Address bits 7..0: 0x00" "Addr bits 7..0: 0x00" "Addr bits 7..0" "A7..A0"
1369286-1369347 spiflash: field: "Address: 0x119700" "Addr: 0x119700" "0x119700"
1369353-1374686 spiflash: field: "Data (256 bytes)"
1369265-1416516 spiflash: read: "Read data (addr 0x119700, 256 bytes): 6c 64 48 65 6c 6c 6f 57 6f 72 6c 64 48 65 6c 6c 6f 57 6f 72 6c 64 48 65 6c 6c 6f 57 6f 72 6c 64 48 65 6c 6c 6f 57 6f 72 6c 64 48 65 6c 6c 6f 57 6f 72 6c 64 48 65 6c 6c 6f 57 6f 72 6c 64 48 65 6c 6c 6f 57 6f 72 6c 64 48 65 6c 6c 6f 57 6f 72 6c 64 48 65 6c 6c 6f 57 6f 72 6c 64 48 65 6c 6c 6f 57 6f 72 6c 64 48 65 6c 6c 6f 57 6f 72 6c 64 48 65 6c 6c 6f 57 6f 72 6c 64 48 65 6c 6c 6f 57 6f 72 6c 64 48 65 6c 6c 6f 57 6f 72 6c 64 48 65 6c 6c 6f 57 6f 72 6c 64 48 65 6c 6c 6f 57 6f 72 6c 64 48 65 6c 6c 6f 57 6f 72 6c 64 48 65 6c 6c 6f 57 6f 72 6c 64 48 65 6c 6c 6f 57 6f 72 6c 64 48 65 6c 6c 6f 57 6f 72 6c 64 48 65 6c 6c 6f 57 6f 72 6c 64 48 65 6c 6c 6f 57 6f 72 6c 64 48 65 6c 6c 6f 57 6f 72 6c 64 48 65 6c 6c 6f 57 6f 72 6c 64 48 65 6c 6c 6f 57 6f 72 6c 64 48 65 6c 6c"
1418728-1418749 spiflash: field: "Command: Read data (READ)" "Command: Read data" "Cmd: Read data" "Cmd: READ" "READ"
1418749-1418770 spiflash: bit: "Address bits 23..16: 0x11" "Addr bits 23..16: 0x11" "Addr bits 23..16" "A23..A16"
1418770-1418789 spiflash: bit: "Address bits 15..8: 0x98" "Addr bits 15..8: 0x98" "Addr bits 15..8" "A15..A8"
1418791-1418810 spiflash: bit: "Address bits 7..0: 0x00" "Addr bits 7..0: 0x00" "Addr bits 7..0" "A7..A0"
1418749-1418810 spiflash: field: "Address: 0x119800" "Addr: 0x119800" "0x119800"
1418816-1424149 spiflash: field: "Data (256 bytes)"
1418728-1464662 spiflash: read: "Read data (addr 0x119800, 256 bytes): 6f 57 6f 72 6c 64 48 65 6c 6c 6f 57 6f 72 6c 64 48 65 6c 6c 6f 57 6f 72 6c 64 48 65 6c 6c 6f 57 6f 72 6c 64 48 65 6c 6c 6f 57 6f 72 6c 64 48 65 6c 6c 6f 57 6f 72 6c 64 48 65 6c 6c 6f 57 6f 72 6c 64 48 65 6c 6c 6f 57 6f 72 6c 64 48 65 6c 6c 6f 57 6f 72 6c 64 48 65 6c 6c 6f 57 6f 72 6c 64 48 65 6c 6c 6f 57 6f 72 6c 64 48 65 6c 6c 6f 57 6f 72 6c 64 48 65 6c 6c 6f 57 6f 72 6c 64 48 65 6c 6c 6f 57 6f 72 6c 64 48 65 6c 6c 6f 57 6f 72 6c 64 48 65 6c 6c 6f 57 6f 72 6c 64 48 65 6c 6c 6f 57 6f 72 6c 64 48 65 6c 6c 6f 57 6f 72 6c 64 48 65 6c 6c 6f 57 6f 72 6c 64 48 65 6c 6c 6f 57 6f 72 6c 64 48 65 6c 6c 6f 57 6f 72 6c 64 48 65 6c 6c 6f 57 6f 72 6c 64 48 65 6c 6c 6f 57 6f 72 6c 64 48 65 6c 6c 6f 57 6f 72 6c 64 48 65 6c 6c 6f 57 6f 72 6c 64 48 65 6c 6c 6f 57 6f 72 6c 64"
1469909-1469928 spiflash: field: "Command: Read data (READ)" "Command: Read data" "Cmd: Read data" "Cmd: READ" "READ"
1469930-1469949 spiflash: bit: "Address bits 23..16: 0x11" "Addr bits 23..16: 0x11" "Addr bits 23..16" "A23..A16"
1469950-1469971 spiflash: bit: "Address bits 15..8: 0x99" "Addr bits 15..8: 0x99" "Addr bits 15..8" "A15..A8"
1469971-1469992 spiflash: bit: "Address bits 7..0: 0x00" "Addr bits 7..0: 0x00" "Addr bits 7..0" "A7..A0"
1469930-1469992 spiflash: field: "Address: 0x119900" "Addr: 0x119900" "0x119900"
1469996-1475328 spiflash: field: "Data (256 bytes)"
1469909-1515713 spiflash: read: "Read data (addr 0x119900, 256 bytes): 48 65 6c 6c 6f 57 6f 72 6c 64 48 65 6c 6c 6f 57 6f 72 6c 64 48 65 6c 6c 6f 57 6f 72 6c 64 48 65 6c 6c 6f 57 6f 72 6c 64 48 65 6c 6c 6f 57 6f 72 6c 64 48 65 6c 6c 6f 57 6f 72 6c 64 48 65 6c 6c 6f 57 6f 72 6c 64 48 65 6c 6c 6f 57 6f 72 6c 64 48 65 6c 6c 6f 57 6f 72 6c 64 48 65 6c 6c 6f 57 6f 72 6c 64 48 65 6c 6c 6f 57 6f 72 6c 64 48 65 6c 6c 6f 57 6f 72 6c 64 48 65 6c 6c 6f 57 6f 72 6c 64 48 65 6c 6c 6f 57 6f 72 6c 64 48 65 6c 6c 6f 57 6f 72 6c 64 48 65 6c 6c 6f 57 6f 72 6c 64 48 65 6c 6c 6f 57 6f 72 6c 64 48 65 6c 6c 6f 57 6f 72 6c 64 48 65 6c 6c 6f 57 6f 72 6c 64 48 65 6c 6c 6f 57 6f 72 6c 64 48 65 6c 6c 6f 57 6f 72 6c 64 48 65 6c 6c 6f 57 6f 72 6c 64 48 65 6c 6c 6f 57 6f 72 6c 64 48 65 6c 6c 6f 57 6f 72 6c 64 48 65 6c 6c 6f 57 6f 72 6c 64 48 65 6c 6c 6f 57"
1519913-1519932 spiflash: field: "Command: Read data (READ)" "Command: Read data" "Cmd: Read data" "Cmd: READ" "READ"
1519934-1519954 spiflash: bit: "Address bits 23..16: 0x11" "Addr bits 23..16: 0x11" "Addr bits 23..16" "A23..A16"
1519954-1519975 spiflash: bit: "Address bits 15..8: 0x9a" "Addr bits 15..8: 0x9a" "Addr bits 15..8" "A15..A8"
1519975-1519996 spiflash: bit: "Address bits 7..0: 0x00" "Addr bits 7..0: 0x00" "Addr bits 7..0" "A7..A0"
1519934-1519996 spiflash: field: "Address: 0x119a00" "Addr: 0x119a00" "0x119a00"
1520000-1525332 spiflash: field: "Data (256 bytes)"
1519913-1565980 spiflash: read: "Read data (addr 0x119a00, 256 bytes): 6f 72 6c 64 48 65 6c 6c 6f 57 6f 72 6c 64 48 65 6c 6c 6f 57 6f 72 6c 64 48 65 6c 6c 6f 57 6f 72 6c 64 48 65 6c 6c 6f 57 6f 72 6c 64 48 65 6c 6c 6f 57 6f 72 6c 64 48 65 6c 6c 6f 57 6f 72 6c 64 48 65 6c 6c 6f 57 6f 72 6c 64 48 65 6c 6c 6f 57 6f 72 6c 64 48 65 6c 6c 6f 57 6f 72 6c 64 48 65 6c 6c 6f 57 6f 72 6c 64 48 65 6c 6c 6f 57 6f 72 6c 64 48 65 6c 6c 6f 57 6f 72 6c 64 48 65 6c 6c 6f 57 6f 72 6c 64 48 65 6c 6c 6f 57 6f 72 6c 64 48 65 6c 6c 6f 57 6f 72 6c 64 48 65 6c 6c 6f 57 6f 72 6c 64 48 65 6c 6c 6f 57 6f 72 6c 64 48 65 6c 6c 6f 57 6f 72 6c 64 48 65 6c 6c 6f 57 6f 72 6c 64 48 65 6c 6c 6f 57 6f 72 6c 64 48 65 6c 6c 6f 57 6f 72 6c 64 48 65 6c 6c 6f 57 6f 72 6c 64 48 65 6c 6c 6f 57 6f 72 6c 64 48 65 6c 6c 6f 57 6f 72 6c 64 48 65 6c 6c 6f 57 6f 72 6c 64 48 65"
1568705-1568724 spiflash: field: "Command: Read data (READ)" "Command: Read data" "Cmd: Read data" "Cmd: READ" "READ"
1568726-1568745 spiflash: bit: "Address bits 23..16: 0x11" "Addr bits 23..16: 0x11" "Addr bits 23..16" "A23..A16"
1568747-1568766 spiflash: bit: "Address bits 15..8: 0x9b" "Addr bits 15..8: 0x9b" "Addr bits 15..8" "A15..A8"
1568767-1568788 spiflash: bit: "Address bits 7..0: 0x00" "Addr bits 7..0: 0x00" "Addr bits 7..0" "A7..A0"
1568726-1568788 spiflash: field: "Address: 0x119b00" "Addr: 0x119b00" "0x119b00"
1568792-1574124 spiflash: field: "Data (256 bytes)"
1568705-1615558 spiflash: read: "Read data (addr 0x119b00, 256 bytes): 6c 6c 6f 57 6f 72 6c 64 48 65 6c 6c 6f 57 6f 72 6c 64 48 65 6c 6c 6f 57 6f 72 6c 64 48 65 6c 6c 6f 57 6f 72 6c 64 48 65 6c 6c 6f 57 6f 72 6c 64 48 65 6c 6c 6f 57 6f 72 6c 64 48 65 6c 6c 6f 57 6f 72 6c 64 48 65 6c 6c 6f 57 6f 72 6c 64 48 65 6c 6c 6f 57 6f 72 6c 64 48 65 6c 6c 6f 57 6f 72 6c 64 48 65 6c 6c 6f 57 6f 72 6c 64 48 65 6c 6c 6f 57 6f 72 6c 64 48 65 6c 6c 6f 57 6f 72 6c 64 48 65 6c 6c 6f 57 6f 72 6c 64 48 65 6c 6c 6f 57 6f 72 6c 64 48 65 6c 6c 6f 57 6f 72 6c 64 48 65 6c 6c 6f 57 6f 72 6c 64 48 65 6c 6c 6f 57 6f 72 6c 64 48 65 6c 6c 6f 57 6f 72 6c 64 48 65 6c 6c 6f 57 6f 72 6c 64 48 65 6c 6c 6f 57 6f 72 6c 64 48 65 6c 6c 6f 57 6f 72 6c 64 48 65 6c 6c 6f 57 6f 72 6c 64 48 65 6c 6c 6f 57 6f 72 6c 64 48 65 6c 6c 6f 57 6f 72 6c 64 48 65 6c 6c 6f 57 6f 72"
1619756-1619777 spiflash: field: "Command: Read data (READ)" "Command: Read data" "Cmd: Read data" "Cmd: READ" "READ"
1619777-1619798 spiflash: bit: "Address bits 23..16: 0x11" "Addr bits 23..16: 0x11" "Addr bits 23..16" "A23..A16"
1619798-1619817 spiflash: bit: "Address bits 15..8: 0x9c" "Addr bits 15..8: 0x9c" "Addr bits 15..8" "A15..A8"
1619819-1619838 spiflash: bit: "Address bits 7..0: 0x00" "Addr bits 7..0: 0x00" "Addr bits 7..0" "A7..A0"
1619777-1619838 spiflash: field: "Address: 0x119c00" "Addr: 0x119c00" "0x119c00"
1619844-1625177 spiflash: field: "Data (256 bytes)"
1619756-1665559 spiflash: read: "Read data (addr 0x119c00, 256 bytes): 6c 64 48 65 6c 6c 6f 57 6f 72 6c 64 48 65 6c 6c 6f 57 6f 72 6c 64 48 65 6c 6c 6f 57 6f 72 6c 64 48 65 6c 6c 6f 57 6f 72 6c 64 48 65 6c 6c 6f 57 6f 72 6c 64 48 65 6c 6c 6f 57 6f 72 6c 64 48 65 6c 6c 6f 57 6f 72 6c 64 48 65 6c 6c 6f 57 6f 72 6c 64 48 65 6c 6c 6f 57 6f 72 6c 64 48 65 6c 6c 6f 57 6f 72 6c 64 48 65 6c 6c 6f 57 6f 72 6c 64 48 65 6c 6c 6f 57 6f 72 6c 64 48 65 6c 6c 6f 57 6f 72 6c 64 48 65 6c 6c 6f 57 6f 72 6c 64 48 65 6c 6c 6f 57 6f 72 6c 64 48 65 6c 6c 6f 57 6f 72 6c 64 48 65 6c 6c 6f 57 6f 72 6c 64 48 65 6c 6c 6f 57 6f 72 6c 64 48 65 6c 6c 6f 57 6f 72 6c 64 48 65 6c 6c 6f 57 6f 72 6c 64 48 65 6c 6c 6f 57 6f 72 6c 64 48 65 6c 6c 6f 57 6f 72 6c 64 48 65 6c 6c 6f 57 6f 72 6c 64 48 65 6c 6c 6f 57 6f 72 6c 64 48 65 6c 6c 6f 57 6f 72 6c 64 48 65 6c 6c"
1669215-1669234 spiflash: field: "Command: Read data (READ)" "Command: Read data" "Cmd: Read data" "Cmd: READ" "READ"
1669236-1669255 spiflash: bit: "Address bits 23..16: 0x11" "Addr bits 23..16: 0x11" "Addr bits 23..16" "A23..A16"
1669256-1669277 spiflash: bit: "Address bits 15..8: 0x9d" "Addr bits 15..8: 0x9d" "Addr bits 15..8" "A15..A8"
1669277-1669298 spiflash: bit: "Address bits 7..0: 0x00" "Addr bits 7..0: 0x00" "Addr bits 7..0" "A7..A0"
1669236-1669298 spiflash: field: "Address: 0x119d00" "Addr: 0x119d00" "0x119d00"
1669302-1674634 spiflash: field: "Data (256 bytes)"
1669215-1715966 spiflash: read: "Read data (addr 0x119d00, 256 bytes): 6f 57 6f 72 6c 64 48 65 6c 6c 6f 57 6f 72 6c 64 48 65 6c 6c 6f 57 6f 72 6c 64 48 65 6c 6c 6f 57 6f 72 6c 64 48 65 6c 6c 6f 57 6f 72 6c 64 48 65 6c 6c 6f 57 6f 72 6c 64 48 65 6c 6c 6f 57 6f 72 6c 64 48 65 6c 6c 6f 57 6f 72 6c 64 48 65 6c 6c 6f 57 6f 72 6c 64 48 65 6c 6c 6f 57 6f 72 6c 64 48 65 6c 6c 6f 57 6f 72 6c 64 48 65 6c 6c 6f 57 6f 72 6c 64 48 65 6c 6c 6f 57 6f 72 6c 64 48 65 6c 6c 6f 57 6f 72 6c 64 48 65 6c 6c 6f 57 6f 72 6c 64 48 65 6c 6c 6f 57 6f 72 6c 64 48 65 6c 6c 6f 57 6f 72 6c 64 48 65 6c 6c 6f 57 6f 72 6c 64 48 65 6c 6c 6f 57 6f 72 6c 64 48 65 6c 6c 6f 57 6f 72 6c 64 48 65 6c 6c 6f 57 6f 72 6c 64 48 65 6c 6c 6f 57 6f 72 6c 64 48 65 6c 6c 6f 57 6f 72 6c 64 48 65 6c 6c 6f 57 6f 72 6c 64 48 65 6c 6c 6f 57 6f 72 6c 64 48 65 6c 6c 6f 57 6f 72 6c 64"
1718686-1718707 spiflash: field: "Command: Read data (READ)" "Command: Read data" "Cmd: Read data" "Cmd: READ" "READ"
1718707-1718726 spiflash: bit: "Address bits 23..16: 0x11" "Addr bits 23..16: 0x11" "Addr bits 23..16" "A23..A16"
1718728-1718747 spiflash: bit: "Address bits 15..8: 0x9e" "Addr bits 15..8: 0x9e" "Addr bits 15..8" "A15..A8"
1718749-1718768 spiflash: bit: "Address bits 7..0: 0x00" "Addr bits 7..0: 0x00" "Addr bits 7..0" "A7..A0"
1718707-1718768 spiflash: field: "Address: 0x119e00" "Addr: 0x119e00" "0x119e00"
1718774-1724105 spiflash: field: "Data (256 bytes)"
1718686-1766012 spiflash: read: "Read data (addr 0x119e00, 256 bytes): 48 65 6c 6c 6f 57 6f 72 6c 64 48 65 6c 6c 6f 57 6f 72 6c 64 48 65 6c 6c 6f 57 6f 72 6c 64 48 65 6c 6c 6f 57 6f 72 6c 64 48 65 6c 6c 6f 57 6f 72 6c 64 48 65 6c 6c 6f 57 6f 72 6c 64 48 65 6c 6c 6f 57 6f 72 6c 64 48 65 6c 6c 6f 57 6f 72 6c 64 48 65 6c 6c 6f 57 6f 72 6c 64 48 65 6c 6c 6f 57 6f 72 6c 64 48 65 6c 6c 6f 57 6f 72 6c 64 48 65 6c 6c 6f 57 6f 72 6c 64 48 65 6c 6c 6f 57 6f 72 6c 64 48 65 6c 6c 6f 57 6f 72 6c 64 48 65 6c 6c 6f 57 6f 72 6c 64 48 65 6c 6c 6f 57 6f 72 6c 64 48 65 6c 6c 6f 57 6f 72 6c 64 48 65 6c 6c 6f 57 6f 72 6c 64 48 65 6c 6c 6f 57 6f 72 6c 64 48 65 6c 6c 6f 57 6f 72 6c 64 48 65 6c 6c 6f 57 6f 72 6c 64 48 65 6c 6c 6f 57 6f 72 6c 64 48 65 6c 6c 6f 57 6f 72 6c 64 48 65 6c 6c 6f 57 6f 72 6c 64 48 65 6c 6c 6f 57 6f 72 6c 64 48 65 6c 6c 6f 57"
1768822-1768841 spiflash: field: "Command: Read data (READ)" "Command: Read data" "Cmd: Read data" "Cmd: READ" "READ"
1768842-1768863 spiflash: bit: "Address bits 23..16: 0x11" "Addr bits 23..16: 0x11" "Addr bits 23..16" "A23..A16"
1768863-1768884 spiflash: bit: "Address bits 15..8: 0x9f" "Addr bits 15..8: 0x9f" "Addr bits 15..8" "A15..A8"
1768884-1768905 spiflash: bit: "Address bits 7..0: 0x00" "Addr bits 7..0: 0x00" "Addr bits 7..0" "A7..A0"
1768842-1768905 spiflash: field: "Address: 0x119f00" "Addr: 0x119f00" "0x119f00"
1768909-1774242 spiflash: field: "Data (256 bytes)"
1768822-1816580 spiflash: read: "Read data (addr 0x119f00, 256 bytes): 6f 72 6c 64 48 65 6c 6c 6f 57 6f 72 6c 64 48 65 6c 6c 6f 57 6f 72 6c 64 48 65 6c 6c 6f 57 6f 72 6c 64 48 65 6c 6c 6f 57 6f 72 6c 64 48 65 6c 6c 6f 57 6f 72 6c 64 48 65 6c 6c 6f 57 6f 72 6c 64 48 65 6c 6c 6f 57 6f 72 6c 64 48 65 6c 6c 6f 57 6f 72 6c 64 48 65 6c 6c 6f 57 6f 72 6c 64 48 65 6c 6c 6f 57 6f 72 6c 64 48 65 6c 6c 6f 57 6f 72 6c 64 48 65 6c 6c 6f 57 6f 72 6c 64 48 65 6c 6c 6f 57 6f 72 6c 64 48 65 6c 6c 6f 57 6f 72 6c 64 48 65 6c 6c 6f 57 6f 72 6c 64 48 65 6c 6c 6f 57 6f 72 6c 64 48 65 6c 6c 6f 57 6f 72 6c 64 48 65 6c 6c 6f 57 6f 72 6c 64 48 65 6c 6c 6f 57 6f 72 6c 64 48 65 6c 6c 6f 57 6f 72 6c 64 48 65 6c 6c 6f 57 6f 72 6c 64 48 65 6c 6c 6f 57 6f 72 6c 64 48 65 6c 6c 6f 57 6f 72 6c 64 48 65 6c 6c 6f 57 6f 72 6c 64 48 65 6c 6c 6f 57 6f 72 6c 64 48 65"
1818675-1818696 spiflash: field: "Command: Read data (READ)" "Command: Read data" "Cmd: Read data" "Cmd: READ" "READ"
1818696-1818715 spiflash: bit: "Address bits 23..16: 0x11" "Addr bits 23..16: 0x11" "Addr bits 23..16" "A23..A16"
1818717-1818736 spiflash: bit: "Address bits 15..8: 0xa0" "Addr bits 15..8: 0xa0" "Addr bits 15..8" "A15..A8"
1818738-1818757 spiflash: bit: "Address bits 7..0: 0x00" "Addr bits 7..0: 0x00" "Addr bits 7..0" "A7..A0"
1818696-1818757 spiflash: field: "Address: 0x11a000" "Addr: 0x11a000" "0x11a000"
1818762-1824094 spiflash: field: "Data (256 bytes)"
1818675-1866042 spiflash: read: "Read data (addr 0x11a000, 256 bytes): 6c 6c 6f 57 6f 72 6c 64 48 65 6c 6c 6f 57 6f 72 6c 64 48 65 6c 6c 6f 57 6f 72 6c 64 48 65 6c 6c 6f 57 6f 72 6c 64 48 65 6c 6c 6f 57 6f 72 6c 64 48 65 6c 6c 6f 57 6f 72 6c 64 48 65 6c 6c 6f 57 6f 72 6c 64 48 65 6c 6c 6f 57 6f 72 6c 64 48 65 6c 6c 6f 57 6f 72 6c 64 48 65 6c 6c 6f 57 6f 72 6c 64 48 65 6c 6c 6f 57 6f 72 6c 64 48 65 6c 6c 6f 57 6f 72 6c 64 48 65 6c 6c 6f 57 6f 72 6c 64 48 65 6c 6c 6f 57 6f 72 6c 64 48 65 6c 6c 6f 57 6f 72 6c 64 48 65 6c 6c 6f 57 6f 72 6c 64 48 65 6c 6c 6f 57 6f 72 6c 64 48 65 6c 6c 6f 57 6f 72 6c 64 48 65 6c 6c 6f 57 6f 72 6c 64 48 65 6c 6c 6f 57 6f 72 6c 64 48 65 6c 6c 6f 57 6f 72 6c 64 48 65 6c 6c 6f 57 6f 72 6c 64 48 65 6c 6c 6f 57 6f 72 6c 64 48 65 6c 6c 6f 57 6f 72 6c 64 48 65 6c 6c 6f 57 6f 72 6c 64 48 65 6c 6c 6f 57 6f 72"
1868668-1868687 spiflash: field: "Command: Read data (READ)" "Command: Read data" "Cmd: Read data" "Cmd: READ" "READ"
1868688-1868709 spiflash: bit: "Address bits 23..16: 0x11" "Addr bits 23..16: 0x11" "Addr bits 23..16" "A23..A16"
1868709-1868730 spiflash: bit: "Address bits 15..8: 0xa1" "Addr bits 15..8: 0xa1" "Addr bits 15..8" "A15..A8"
1868730-1868751 spiflash: bit: "Address bits 7..0: 0x00" "Addr bits 7..0: 0x00" "Addr bits 7..0" "A7..A0"
1868688-1868751 spiflash: field: "Address: 0x11a100" "Addr: 0x11a100" "0x11a100"
1868755-1874088 spiflash: field: "Data (256 bytes)"
1868668-1915654 spiflash: read: "Read data (addr 0x11a100, 256 bytes): 6c 64 48 65 6c 6c 6f 57 6f 72 6c 64 48 65 6c 6c 6f 57 6f 72 6c 64 48 65 6c 6c 6f 57 6f 72 6c 64 48 65 6c 6c 6f 57 6f 72 6c 64 48 65 6c 6c 6f 57 6f 72 6c 64 48 65 6c 6c 6f 57 6f 72 6c 64 48 65 6c 6c 6f 57 6f 72 6c 64 48 65 6c 6c 6f 57 6f 72 6c 64 48 65 6c 6c 6f 57 6f 72 6c 64 48 65 6c 6c 6f 57 6f 72 6c 64 48 65 6c 6c 6f 57 6f 72 6c 64 48 65 6c 6c 6f 57 6f 72 6c 64 48 65 6c 6c 6f 57 6f 72 6c 64 48 65 6c 6c 6f 57 6f 72 6c 64 48 65 6c 6c 6f 57 6f 72 6c 64 48 65 6c 6c 6f 57 6f 72 6c 64 48 65 6c 6c 6f 57 6f 72 6c 64 48 65 6c 6c 6f 57 6f 72 6c 64 48 65 6c 6c 6f 57 6f 72 6c 64 48 65 6c 6c 6f 57 6f 72 6c 64 48 65 6c 6c 6f 57 6f 72 6c 64 48 65 6c 6c 6f 57 6f 72 6c 64 48 65 6c 6c 6f 57 6f 72 6c 64 48 65 6c 6c 6f 57 6f 72 6c 64 48 65 6c 6c 6f 57 6f 72 6c 64 48 65 6c 6c"
1919712-1919733 spiflash: field: "Command: Read data (READ)" "Command: Read data" "Cmd: Read data" "Cmd: READ" "READ"
1919733-1919754 spiflash: bit: "Address bits 23..16: 0x11" "Addr bits 23..16: 0x11" "Addr bits 23..16" "A23..A16"
1919754-1919773 spiflash: bit: "Address bits 15..8: 0xa2" "Addr bits 15..8: 0xa2" "Addr bits 15..8" "A15..A8"
1919775-1919794 spiflash: bit: "Address bits 7..0: 0x00" "Addr bits 7..0: 0x00" "Addr bits 7..0" "A7..A0"
1919733-1919794 spiflash: field: "Address: 0x11a200" "Addr: 0x11a200" "0x11a200"
1919800-1925133 spiflash: field: "Data (256 bytes)"
1919712-1966033 spiflash: read: "Read data (addr 0x11a200, 256 bytes): 6f 57 6f 72 6c 64 48 65 6c 6c 6f 57 6f 72 6c 64 48 65 6c 6c 6f 57 6f 72 6c 64 48 65 6c 6c 6f 57 6f 72 6c 64 48 65 6c 6c 6f 57 6f 72 6c 64 48 65 6c 6c 6f 57 6f 72 6c 64 48 65 6c 6c 6f 57 6f 72 6c 64 48 65 6c 6c 6f 57 6f 72 6c 64 48 65 6c 6c 6f 57 6f 72 6c 64 48 65 6c 6c 6f 57 6f 72 6c 64 48 65 6c 6c 6f 57 6f 72 6c 64 48 65 6c 6c 6f 57 6f 72 6c 64 48 65 6c 6c 6f 57 6f 72 6c 64 48 65 6c 6c 6f 57 6f 72 6c 64 48 65 6c 6c 6f 57 6f 72 6c 64 48 65 6c 6c 6f 57 6f 72 6c 64 48 65 6c 6c 6f 57 6f 72 6c 64 48 65 6c 6c 6f 57 6f 72 6c 64 48 65 6c 6c 6f 57 6f 72 6c 64 48 65 6c 6c 6f 57 6f 72 6c 64 48 65 6c 6c 6f 57 6f 72 6c 64 48 65 6c 6c 6f 57 6f 72 6c 64 48 65 6c 6c 6f 57 6f 72 6c 64 48 65 6c 6c 6f 57 6f 72 6c 64 48 65 6c 6c 6f 57 6f 72 6c 64 48 65 6c 6c 6f 57 6f 72 6c 64"
1968653-1968674 spiflash: field: "Command: Read data (READ)" "Command: Read data" "Cmd: Read data" "Cmd: READ" "READ"
1968674-1968695 spiflash: bit: "Address bits 23..16: 0x11" "Addr bits 23..16: 0x11" "Addr bits 23..16" "A23..A16"
1968695-1968714 spiflash: bit: "Address bits 15..8: 0xa3" "Addr bits 15..8: 0xa3" "Addr bits 15..8" "A15..A8"
1968716-1968735 spiflash: bit: "Address bits 7..0: 0x00" "Addr bits 7..0: 0x00" "Addr bits 7..0" "A7..A0"
1968674-1968735 spiflash: field: "Address: 0x11a300" "Addr: 0x11a300" "0x11a300"
1968741-1974074 spiflash: field: "Data (256 bytes)"
1968653-2015637 spiflash: read: "Read data (addr 0x11a300, 256 bytes): 48 65 6c 6c 6f 57 6f 72 6c 64 48 65 6c 6c 6f 57 6f 72 6c 64 48 65 6c 6c 6f 57 6f 72 6c 64 48 65 6c 6c 6f 57 6f 72 6c 64 48 65 6c 6c 6f 57 6f 72 6c 64 48 65 6c 6c 6f 57 6f 72 6c 64 48 65 6c 6c 6f 57 6f 72 6c 64 48 65 6c 6c 6f 57 6f 72 6c 64 48 65 6c 6c 6f 57 6f 72 6c 64 48 65 6c 6c 6f 57 6f 72 6c 64 48 65 6c 6c 6f 57 6f 72 6c 64 48 65 6c 6c 6f 57 6f 72 6c 64 48 65 6c 6c 6f 57 6f 72 6c 64 48 65 6c 6c 6f 57 6f 72 6c 64 48 65 6c 6c 6f 57 6f 72 6c 64 48 65 6c 6c 6f 57 6f 72 6c 64 48 65 6c 6c 6f 57 6f 72 6c 64 48 65 6c 6c 6f 57 6f 72 6c 64 48 65 6c 6c 6f 57 6f 72 6c 64 48 65 6c 6c 6f 57 6f 72 6c 64 48 65 6c 6c 6f 57 6f 72 6c 64 48 65 6c 6c 6f 57 6f 72 6c 64 48 65 6c 6c 6f 57 6f 72 6c 64 48 65 6c 6c 6f 57 6f 72 6c 64 48 65 6c 6c 6f 57 6f 72 6c 64 48 65 6c 6c 6f 57"
2019696-2019715 spiflash: field: "Command: Read data (READ)" "Command: Read data" "Cmd: Read data" "Cmd: READ" "READ"
2019717-2019736 spiflash: bit: "Address bits 23..16: 0x11" "Addr bits 23..16: 0x11" "Addr bits 23..16" "A23..A16"
2019737-2019758 spiflash: bit: "Address bits 15..8: 0xa4" "Addr bits 15..8: 0xa4" "Addr bits 15..8" "A15..A8"
2019758-2019779 spiflash: bit: "Address bits 7..0: 0x00" "Addr bits 7..0: 0x00" "Addr bits 7..0" "A7..A0"
2019717-2019779 spiflash: field: "Address: 0x11a400" "Addr: 0x11a400" "0x11a400"
2019783-2025115 spiflash: field: "Data (256 bytes)"
2019696-2066023 spiflash: read: "Read data (addr 0x11a400, 256 bytes): 6f 72 6c 64 48 65 6c 6c 6f 57 6f 72 6c 64 48 65 6c 6c 6f 57 6f 72 6c 64 48 65 6c 6c 6f 57 6f 72 6c 64 48 65 6c 6c 6f 57 6f 72 6c 64 48 65 6c 6c 6f 57 6f 72 6c 64 48 65 6c 6c 6f 57 6f 72 6c 64 48 65 6c 6c 6f 57 6f 72 6c 64 48 65 6c 6c 6f 57 6f 72 6c 64 48 65 6c 6c 6f 57 6f 72 6c 64 48 65 6c 6c 6f 57 6f 72 6c 64 48 65 6c 6c 6f 57 6f 72 6c 64 48 65 6c 6c 6f 57 6f 72 6c 64 48 65 6c 6c 6f 57 6f 72 6c 64 48 65 6c 6c 6f 57 6f 72 6c 64 48 65 6c 6c 6f 57 6f 72 6c 64 48 65 6c 6c 6f 57 6f 72 6c 64 48 65 6c 6c 6f 57 6f 72 6c 64 48 65 6c 6c 6f 57 6f 72 6c 64 48 65 6c 6c 6f 57 6f 72 6c 64 48 65 6c 6c 6f 57 6f 72 6c 64 48 65 6c 6c 6f 57 6f 72 6c 64 48 65 6c 6c 6f 57 6f 72 6c 64 48 65 6c 6c 6f 57 6f 72 6c 64 48 65 6c 6c 6f 57 6f 72 6c 64 48 65 6c 6c 6f 57 6f 72 6c 64 48 65"
2068654-2068673 spiflash: field: "Command: Read data (READ)" "Command: Read data" "Cmd: Read data" "Cmd: READ" "READ"
2068675-2068694 spiflash: bit: "Address bits 23..16: 0x11" "Addr bits 23..16: 0x11" "Addr bits 23..16" "A23..A16"
2068696-2068715 spiflash: bit: "Address bits 15..8: 0xa5" "Addr bits 15..8: 0xa5" "Addr bits 15..8" "A15..A8"
2068716-2068737 spiflash: bit: "Address bits 7..0: 0x00" "Addr bits 7..0: 0x00" "Addr bits 7..0" "A7..A0"
2068675-2068737 spiflash: field: "Address: 0x11a500" "Addr: 0x11a500" "0x11a500"
2068741-2074073 spiflash: field: "Data (256 bytes)"
2068654-2115628 spiflash: read: "Read data (addr 0x11a500, 256 bytes): 6c 6c 6f 57 6f 72 6c 64 48 65 6c 6c 6f 57 6f 72 6c 64 48 65 6c 6c 6f 57 6f 72 6c 64 48 65 6c 6c 6f 57 6f 72 6c 64 48 65 6c 6c 6f 57 6f 72 6c 64 48 65 6c 6c 6f 57 6f 72 6c 64 48 65 6c 6c 6f 57 6f 72 6c 64 48 65 6c 6c 6f 57 6f 72 6c 64 48 65 6c 6c 6f 57 6f 72 6c 64 48 65 6c 6c 6f 57 6f 72 6c 64 48 65 6c 6c 6f 57 6f 72 6c 64 48 65 6c 6c 6f 57 6f 72 6c 64 48 65 6c 6c 6f 57 6f 72 6c 64 48 65 6c 6c 6f 57 6f 72 6c 64 48 65 6c 6c 6f 57 6f 72 6c 64 48 65 6c 6c 6f 57 6f 72 6c 64 48 65 6c 6c 6f 57 6f 72 6c 64 48 65 6c 6c 6f 57 6f 72 6c 64 48 65 6c 6c 6f 57 6f 72 6c 64 48 65 6c 6c 6f 57 6f 72 6c 64 48 65 6c 6c 6f 57 6f 72 6c 64 48 65 6c 6c 6f 57 6f 72 6c 64 48 65 6c 6c 6f 57 6f 72 6c 64 48 65 6c 6c 6f 57 6f 72 6c 64 48 65 6c 6c 6f 57 6f 72 6c 64 48 65 6c 6c 6f 57 6f 72"
2119687-2119706 spiflash: field: "Command: Read data (READ)" "Command: Read data" "Cmd: Read data" "Cmd: READ" "READ"
2119708-2119727 spiflash: bit: "Address bits 23..16: 0x11" "Addr bits 23..16: 0x11" "Addr bits 23..16" "A23..A16"
2119729-2119748 spiflash: bit: "Address bits 15..8: 0xa6" "Addr bits 15..8: 0xa6" "Addr bits 15..8" "A15..A8"
2119749-2119770 spiflash: bit: "Address bits 7..0: 0x00" "Addr bits 7..0: 0x00" "Addr bits 7..0" "A7..A0"
2119708-2119770 spiflash: field: "Address: 0x11a600" "Addr: 0x11a600" "0x11a600"
2119774-2125106 spiflash: field: "Data (256 bytes)"
2119687-2166013 spiflash: read: "Read data (addr 0x11a600, 256 bytes): 6c 64 48 65 6c 6c 6f 57 6f 72 6c 64 48 65 6c 6c 6f 57 6f 72 6c 64 48 65 6c 6c 6f 57 6f 72 6c 64 48 65 6c 6c 6f 57 6f 72 6c 64 48 65 6c 6c 6f 57 6f 72 6c 64 48 65 6c 6c 6f 57 6f 72 6c 64 48 65 6c 6c 6f 57 6f 72 6c 64 48 65 6c 6c 6f 57 6f 72 6c 64 48 65 6c 6c 6f 57 6f 72 6c 64 48 65 6c 6c 6f 57 6f 72 6c 64 48 65 6c 6c 6f 57 6f 72 6c 64 48 65 6c 6c 6f 57 6f 72 6c 64 48 65 6c 6c 6f 57 6f 72 6c 64 48 65 6c 6c 6f 57 6f 72 6c 64 48 65 6c 6c 6f 57 6f 72 6c 64 48 65 6c 6c 6f 57 6f 72 6c 64 48 65 6c 6c 6f 57 6f 72 6c 64 48 65 6c 6c 6f 57 6f 72 6c 64 48 65 6c 6c 6f 57 6f 72 6c 64 48 65 6c 6c 6f 57 6f 72 6c 64 48 65 6c 6c 6f 57 6f 72 6c 64 48 65 6c 6c 6f 57 6f 72 6c 64 48 65 6c 6c 6f 57 6f 72 6c 64 48 65 6c 6c 6f 57 6f 72 6c 64 48 65 6c 6c 6f 57 6f 72 6c 64 48 65 6c 6c"
2169667-2169686 spiflash: field: "Command: Read data (READ)" "Command: Read data" "Cmd: Read data" "Cmd: READ" "READ"
2169688-2169707 spiflash: bit: "Address bits 23..16: 0x11" "Addr bits 23..16: 0x11" "Addr bits 23..16" "A23..A16"
2169709-2169728 spiflash: bit: "Address bits 15..8: 0xa7" "Addr bits 15..8: 0xa7" "Addr bits 15..8" "A15..A8"
2169729-2169750 spiflash: bit: "Address bits 7..0: 0x00" "Addr bits 7..0: 0x00" "Addr bits 7..0" "A7..A0"
2169688-2169750 spiflash: field: "Address: 0x11a700" "Addr: 0x11a700" "0x11a700"
2169754-2175086 spiflash: field: "Data (256 bytes)"
2169667-2215609 spiflash: read: "Read data (addr 0x11a700, 256 bytes): 6f 57 6f 72 6c 64 48 65 6c 6c 6f 57 6f 72 6c 64 48 65 6c 6c 6f 57 6f 72 6c 64 48 65 6c 6c 6f 57 6f 72 6c 64 48 65 6c 6c 6f 57 6f 72 6c 64 48 65 6c 6c 6f 57 6f 72 6c 64 48 65 6c 6c 6f 57 6f 72 6c 64 48 65 6c 6c 6f 57 6f 72 6c 64 48 65 6c 6c 6f 57 6f 72 6c 64 48 65 6c 6c 6f 57 6f 72 6c 64 48 65 6c 6c 6f 57 6f 72 6c 64 48 65 6c 6c 6f 57 6f 72 6c 64 48 65 6c 6c 6f 57 6f 72 6c 64 48 65 6c 6c 6f 57 6f 72 6c 64 48 65 6c 6c 6f 57 6f 72 6c 64 48 65 6c 6c 6f 57 6f 72 6c 64 48 65 6c 6c 6f 57 6f 72 6c 64 48 65 6c 6c 6f 57 6f 72 6c 64 48 65 6c 6c 6f 57 6f 72 6c 64 48 65 6c 6c 6f 57 6f 72 6c 64 48 65 6c 6c 6f 57 6f 72 6c 64 48 65 6c 6c 6f 57 6f 72 6c 64 48 65 6c 6c 6f 57 6f 72 6c 64 48 65 6c 6c 6f 57 6f 72 6c 64 48 65 6c 6c 6f 57 6f 72 6c 64 48 65 6c 6c 6f 57 6f 72 6c 64"
2219676-2219697 spiflash: field: "Command: Read data (READ)" "Command: Read data" "Cmd: Read data" "Cmd: READ" "READ"
2219697-2219718 spiflash: bit: "Address bits 23..16: 0x11" "Addr bits 23..16: 0x11" "Addr bits 23..16" "A23..A16"
2219718-2219737 spiflash: bit: "Address bits 15..8: 0xa8" "Addr bits 15..8: 0xa8" "Addr bits 15..8" "A15..A8"
2219739-2219758 spiflash: bit: "Address bits 7..0: 0x00" "Addr bits 7..0: 0x00" "Addr bits 7..0" "A7..A0"
2219697-2219758 spiflash: field: "Address: 0x11a800" "Addr: 0x11a800" "0x11a800"
2219764-2225097 spiflash: field: "Data (256 bytes)"
2219676-2265471 spiflash: read: "Read data (addr 0x11a800, 256 bytes): 48 65 6c 6c 6f 57 6f 72 6c 64 48 65 6c 6c 6f 57 6f 72 6c 64 48 65 6c 6c 6f 57 6f 72 6c 64 48 65 6c 6c 6f 57 6f 72 6c 64 48 65 6c 6c 6f 57 6f 72 6c 64 48 65 6c 6c 6f 57 6f 72 6c 64 48 65 6c 6c 6f 57 6f 72 6c 64 48 65 6c 6c 6f 57 6f 72 6c 64 48 65 6c 6c 6f 57 6f 72 6c 64 48 65 6c 6c 6f 57 6f 72 6c 64 48 65 6c 6c 6f 57 6f 72 6c 64 48 65 6c 6c 6f 57 6f 72 6c 64 48 65 6c 6c 6f 57 6f 72 6c 64 48 65 6c 6c 6f 57 6f 72 6c 64 48 65 6c 6c 6f 57 6f 72 6c 64 48 65 6c 6c 6f 57 6f 72 6c 64 48 65 6c 6c 6f 57 6f 72 6c 64 48 65 6c 6c 6f 57 6f 72 6c 64 48 65 6c 6c 6f 57 6f 72 6c 64 48 65 6c 6c 6f 57 6f 72 6c 64 48 65 6c 6c 6f 57 6f 72 6c 64 48 65 6c 6c 6f 57 6f 72 6c 64 48 65 6c 6c 6f 57 6f 72 6c 64 48 65 6c 6c 6f 57 6f 72 6c 64 48 65 6c 6c 6f 57 6f 72 6c 64 48 65 6c 6c 6f 57"
2269140-2269161 spiflash: field: "Command: Read data (READ)" "Command: Read data" "Cmd: Read data" "Cmd: READ" "READ"
2269161-2269180 spiflash: bit: "Address bits 23..16: 0x11" "Addr bits 23..16: 0x11" "Addr bits 23..16" "A23..A16"
2269182-2269201 spiflash: bit: "Address bits 15..8: 0xa9" "Addr bits 15..8: 0xa9" "Addr bits 15..8" "A15..A8"
2269203-2269222 spiflash: bit: "Address bits 7..0: 0x00" "Addr bits 7..0: 0x00" "Addr bits 7..0" "A7..A0"
2269161-2269222 spiflash: field: "Address: 0x11a900" "Addr: 0x11a900" "0x11a900"
2269228-2274559 spiflash: field: "Data (256 bytes)"
2269140-2315455 spiflash: read: "Read data (addr 0x11a900, 256 bytes): 6f 72 6c 64 48 65 6c 6c 6f 57 6f 72 6c 64 48 65 6c 6c 6f 57 6f 72 6c 64 48 65 6c 6c 6f 57 6f 72 6c 64 48 65 6c 6c 6f 57 6f 72 6c 64 48 65 6c 6c 6f 57 6f 72 6c 64 48 65 6c 6c 6f 57 6f 72 6c 64 48 65 6c 6c 6f 57 6f 72 6c 64 48 65 6c 6c 6f 57 6f 72 6c 64 48 65 6c 6c 6f 57 6f 72 6c 64 48 65 6c 6c 6f 57 6f 72 6c 64 48 65 6c 6c 6f 57 6f 72 6c 64 48 65 6c 6c 6f 57 6f 72 6c 64 48 65 6c 6c 6f 57 6f 72 6c 64 48 65 6c 6c 6f 57 6f 72 6c 64 48 65 6c 6c 6f 57 6f 72 6c 64 48 65 6c 6c 6f 57 6f 72 6c 64 48 65 6c 6c 6f 57 6f 72 6c 64 48 65 6c 6c 6f 57 6f 72 6c 64 48 65 6c 6c 6f 57 6f 72 6c 64 48 65 6c 6c 6f 57 6f 72 6c 64 48 65 6c 6c 6f 57 6f 72 6c 64 48 65 6c 6c 6f 57 6f 72 6c 64 48 65 6c 6c 6f 57 6f 72 6c 64 48 65 6c 6c 6f 57 6f 72 6c 64 48 65 6c 6c 6f 57 6f 72 6c 64 48 65"
2319797-2319816 spiflash: field: "Command: Read data (READ)" "Command: Read data" "Cmd: Read data" "Cmd: READ" "READ"
2319818-2319837 spiflash: bit: "Address bits 23..16: 0x11" "Addr bits 23..16: 0x11" "Addr bits 23..16" "A23..A16"
2319839-2319858 spiflash: bit: "Address bits 15..8: 0xaa" "Addr bits 15..8: 0xaa" "Addr bits 15..8" "A15..A8"
2319859-2319880 spiflash: bit: "Address bits 7..0: 0x00" "Addr bits 7..0: 0x00" "Addr bits 7..0" "A7..A0"
2319818-2319880 spiflash: field: "Address: 0x11aa00" "Addr: 0x11aa00" "0x11aa00"
2319884-2325216 spiflash: field: "Data (256 bytes)"
2319797-2364036 spiflash: read: "Read data (addr 0x11aa00, 256 bytes): 6c 6c 6f 57 6f 72 6c 64 48 65 6c 6c 6f 57 6f 72 6c 64 48 65 6c 6c 6f 57 6f 72 6c 64 48 65 6c 6c 6f 57 6f 72 6c 64 48 65 6c 6c 6f 57 6f 72 6c 64 48 65 6c 6c 6f 57 6f 72 6c 64 48 65 6c 6c 6f 57 6f 72 6c 64 48 65 6c 6c 6f 57 6f 72 6c 64 48 65 6c 6c 6f 57 6f 72 6c 64 48 65 6c 6c 6f 57 6f 72 6c 64 48 65 6c 6c 6f 57 6f 72 6c 64 48 65 6c 6c 6f 57 6f 72 6c 64 48 65 6c 6c 6f 57 6f 72 6c 64 48 65 6c 6c 6f 57 6f 72 6c 64 48 65 6c 6c 6f 57 6f 72 6c 64 48 65 6c 6c 6f 57 6f 72 6c 64 48 65 6c 6c 6f 57 6f 72 6c 64 48 65 6c 6c 6f 57 6f 72 6c 64 48 65 6c 6c 6f 57 6f 72 6c 64 48 65 6c 6c 6f 57 6f 72 6c 64 48 65 6c 6c 6f 57 6f 72 6c 64 48 65 6c 6c 6f 57 6f 72 6c 64 48 65 6c 6c 6f 57 6f 72 6c 64 48 65 6c 6c 6f 57 6f 72 6c 64 48 65 6c 6c 6f 57 6f 72 6c 64 48 65 6c 6c 6f 57 6f 72"
2366136-2366155 spiflash: field: "Command: Read data (READ)" "Command: Read data" "Cmd: Read data" "Cmd: READ" "READ"
2366157-2366176 spiflash: bit: "Address bits 23..16: 0x11" "Addr bits 23..16: 0x11" "Addr bits 23..16" "A23..A16"
2366177-2366198 spiflash: bit: "Address bits 15..8: 0xab" "Addr bits 15..8: 0xab" "Addr bits 15..8" "A15..A8"
2366198-2366219 spiflash: bit: "Address bits 7..0: 0x00" "Addr bits 7..0: 0x00" "Addr bits 7..0" "A7..A0"
2366157-2366219 spiflash: field: "Address: 0x11ab00" "Addr: 0x11ab00" "0x11ab00"
2366223-2371555 spiflash: field: "Data (256 bytes)"
2366136-2415868 spiflash: read: "Read data (addr 0x11ab00, 256 bytes): 6c 64 48 65 6c 6c 6f 57 6f 72 6c 64 48 65 6c 6c 6f 57 6f 72 6c 64 48 65 6c 6c 6f 57 6f 72 6c 64 48 65 6c 6c 6f 57 6f 72 6c 64 48 65 6c 6c 6f 57 6f 72 6c 64 48 65 6c 6c 6f 57 6f 72 6c 64 48 65 6c 6c 6f 57 6f 72 6c 64 48 65 6c 6c 6f 57 6f 72 6c 64 48 65 6c 6c 6f 57 6f 72 6c 64 48 65 6c 6c 6f 57 6f 72 6c 64 48 65 6c 6c 6f 57 6f 72 6c 64 48 65 6c 6c 6f 57 6f 72 6c 64 48 65 6c 6c 6f 57 6f 72 6c 64 48 65 6c 6c 6f 57 6f 72 6c 64 48 65 6c 6c 6f 57 6f 72 6c 64 48 65 6c 6c 6f 57 6f 72 6c 64 48 65 6c 6c 6f 57 6f 72 6c 64 48 65 6c 6c 6f 57 6f 72 6c 64 48 65 6c 6c 6f 57 6f 72 6c 64 48 65 6c 6c 6f 57 6f 72 6c 64 48 65 6c 6c 6f 57 6f 72 6c 64 48 65 6c 6c 6f 57 6f 72 6c 64 48 65 6c 6c 6f 57 6f 72 6c 64 48 65 6c 6c 6f 57 6f 72 6c 64 48 65 6c 6c 6f 57 6f 72 6c 64 48 65 6c 6c"
2419652-2419673 spiflash: field: "Command: Read data (READ)" "Command: Read data" "Cmd: Read data" "Cmd: READ" "READ"
2419673-2419694 spiflash: bit: "Address bits 23..16: 0x11" "Addr bits 23..16: 0x11" "Addr bits 23..16" "A23..A16"
2419694-2419715 spiflash: bit: "Address bits 15..8: 0xac" "Addr bits 15..8: 0xac" "Addr bits 15..8" "A15..A8"
2419715-2419734 spiflash: bit: "Address bits 7..0: 0x00" "Addr bits 7..0: 0x00" "Addr bits 7..0" "A7..A0"
2419673-2419734 spiflash: field: "Address: 0x11ac00" "Addr: 0x11ac00" "0x11ac00"
2419740-2425073 spiflash: field: "Data (256 bytes)"
2419652-2465979 spiflash: read: "Read data (addr 0x11ac00, 256 bytes): 6f 57 6f 72 6c 64 48 65 6c 6c 6f 57 6f 72 6c 64 48 65 6c 6c 6f 57 6f 72 6c 64 48 65 6c 6c 6f 57 6f 72 6c 64 48 65 6c 6c 6f 57 6f 72 6c 64 48 65 6c 6c 6f 57 6f 72 6c 64 48 65 6c 6c 6f 57 6f 72 6c 64 48 65 6c 6c 6f 57 6f 72 6c 64 48 65 6c 6c 6f 57 6f 72 6c 64 48 65 6c 6c 6f 57 6f 72 6c 64 48 65 6c 6c 6f 57 6f 72 6c 64 48 65 6c 6c 6f 57 6f 72 6c 64 48 65 6c 6c 6f 57 6f 72 6c 64 48 65 6c 6c 6f 57 6f 72 6c 64 48 65 6c 6c 6f 57 6f 72 6c 64 48 65 6c 6c 6f 57 6f 72 6c 64 48 65 6c 6c 6f 57 6f 72 6c 64 48 65 6c 6c 6f 57 6f 72 6c 64 48 65 6c 6c 6f 57 6f 72 6c 64 48 65 6c 6c 6f 57 6f 72 6c 64 48 65 6c 6c 6f 57 6f 72 6c 64 48 65 6c 6c 6f 57 6f 72 6c 64 48 65 6c 6c 6f 57 6f 72 6c 64 48 65 6c 6c 6f 57 6f 72 6c 64 48 65 6c 6c 6f 57 6f 72 6c 64 48 65 6c 6c 6f 57 6f 72 6c 64"
2468583-2468604 spiflash: field: "Command: Read data (READ)" "Command: Read data" "Cmd: Read data" "Cmd: READ" "READ"
2468604-2468623 spiflash: bit: "Address bits 23..16: 0x11" "Addr bits 23..16: 0x11" "Addr bits 23..16" "A23..A16"
2468625-2468644 spiflash: bit: "Address bits 15..8: 0xad" "Addr bits 15..8: 0xad" "Addr bits 15..8" "A15..A8"
2468646-2468665 spiflash: bit: "Address bits 7..0: 0x00" "Addr bits 7..0: 0x00" "Addr bits 7..0" "A7..A0"
2468604-2468665 spiflash: field: "Address: 0x11ad00" "Addr: 0x11ad00" "0x11ad00"
2468671-2474002 spiflash: field: "Data (256 bytes)"
2468583-2515578 spiflash: read: "Read data (addr 0x11ad00, 256 bytes): 48 65 6c 6c 6f 57 6f 72 6c 64 48 65 6c 6c 6f 57 6f 72 6c 64 48 65 6c 6c 6f 57 6f 72 6c 64 48 65 6c 6c 6f 57 6f 72 6c 64 48 65 6c 6c 6f 57 6f 72 6c 64 48 65 6c 6c 6f 57 6f 72 6c 64 48 65 6c 6c 6f 57 6f 72 6c 64 48 65 6c 6c 6f 57 6f 72 6c 64 48 65 6c 6c 6f 57 6f 72 6c 64 48 65 6c 6c 6f 57 6f 72 6c 64 48 65 6c 6c 6f 57 6f 72 6c 64 48 65 6c 6c 6f 57 6f 72 6c 64 48 65 6c 6c 6f 57 6f 72 6c 64 48 65 6c 6c 6f 57 6f 72 6c 64 48 65 6c 6c 6f 57 6f 72 6c 64 48 65 6c 6c 6f 57 6f 72 6c 64 48 65 6c 6c 6f 57 6f 72 6c 64 48 65 6c 6c 6f 57 6f 72 6c 64 48 65 6c 6c 6f 57 6f 72 6c 64 48 65 6c 6c 6f 57 6f 72 6c 64 48 65 6c 6c 6f 57 6f 72 6c 64 48 65 6c 6c 6f 57 6f 72 6c 64 48 65 6c 6c 6f 57 6f 72 6c 64 48 65 6c 6c 6f 57 6f 72 6c 64 48 65 6c 6c 6f 57 6f 72 6c 64 48 65 6c 6c 6f 57"
2519780-2519799 spiflash: field: "Command: Read data (READ)" "Command: Read data" "Cmd: Read data" "Cmd: READ" "READ"
2519801-2519820 spiflash: bit: "Address bits 23..16: 0x11" "Addr bits 23..16: 0x11" "Addr bits 23..16" "A23..A16"
2519821-2519842 spiflash: bit: "Address bits 15..8: 0xae" "Addr bits 15..8: 0xae" "Addr bits 15..8" "A15..A8"
2519842-2519863 spiflash: bit: "Address bits 7..0: 0x00" "Addr bits 7..0: 0x00" "Addr bits 7..0" "A7..A0"
2519801-2519863 spiflash: field: "Address: 0x11ae00" "Addr: 0x11ae00" "0x11ae00"
2519867-2525199 spiflash: field: "Data (256 bytes)"
2519780-2565957 spiflash: read: "Read data (addr 0x11ae00, 256 bytes): 6f 72 6c 64 48 65 6c 6c 6f 57 6f 72 6c 64 48 65 6c 6c 6f 57 6f 72 6c 64 48 65 6c 6c 6f 57 6f 72 6c 64 48 65 6c 6c 6f 57 6f 72 6c 64 48 65 6c 6c 6f 57 6f 72 6c 64 48 65 6c 6c 6f 57 6f 72 6c 64 48 65 6c 6c 6f 57 6f 72 6c 64 48 65 6c 6c 6f 57 6f 72 6c 64 48 65 6c 6c 6f 57 6f 72 6c 64 48 65 6c 6c 6f 57 6f 72 6c 64 48 65 6c 6c 6f 57 6f 72 6c 64 48 65 6c 6c 6f 57 6f 72 6c 64 48 65 6c 6c 6f 57 6f 72 6c 64 48 65 6c 6c 6f 57 6f 72 6c 64 48 65 6c 6c 6f 57 6f 72 6c 64 48 65 6c 6c 6f 57 6f 72 6c 64 48 65 6c 6c 6f 57 6f 72 6c 64 48 65 6c 6c 6f 57 6f 72 6c 64 48 65 6c 6c 6f 57 6f 72 6c 64 48 65 6c 6c 6f 57 6f 72 6c 64 48 65 6c 6c 6f 57 6f 72 6c 64 48 65 6c 6c 6f 57 6f 72 6c 64 48 65 6c 6c 6f 57 6f 72 6c 64 48 65 6c 6c 6f 57 6f 72 6c 64 48 65 6c 6c 6f 57 6f 72 6c 64 48 65"
2569628-2569649 spiflash: field: "Command: Read data (READ)" "Command: Read data" "Cmd: Read data" "Cmd: READ" "READ"
2569649-2569670 spiflash: bit: "Address bits 23..16: 0x11" "Addr bits 23..16: 0x11" "Addr bits 23..16" "A23..A16"
2569670-2569689 spiflash: bit: "Address bits 15..8: 0xaf" "Addr bits 15..8: 0xaf" "Addr bits 15..8" "A15..A8"
2569691-2569710 spiflash: bit: "Address bits 7..0: 0x00" "Addr bits 7..0: 0x00" "Addr bits 7..0" "A7..A0"
2569649-2569710 spiflash: field: "Address: 0x11af00" "Addr: 0x11af00" "0x11af00"
2569716-2575049 spiflash: field: "Data (256 bytes)"
2569628-2615944 spiflash: read: "Read data (addr 0x11af00, 256 bytes): 6c 6c 6f 57 6f 72 6c 64 48 65 6c 6c 6f 57 6f 72 6c 64 48 65 6c 6c 6f 57 6f 72 6c 64 48 65 6c 6c 6f 57 6f 72 6c 64 48 65 6c 6c 6f 57 6f 72 6c 64 48 65 6c 6c 6f 57 6f 72 6c 64 48 65 6c 6c 6f 57 6f 72 6c 64 48 65 6c 6c 6f 57 6f 72 6c 64 48 65 6c 6c 6f 57 6f 72 6c 64 48 65 6c 6c 6f 57 6f 72 6c 64 48 65 6c 6c 6f 57 6f 72 6c 64 48 65 6c 6c 6f 57 6f 72 6c 64 48 65 6c 6c 6f 57 6f 72 6c 64 48 65 6c 6c 6f 57 6f 72 6c 64 48 65 6c 6c 6f 57 6f 72 6c 64 48 65 6c 6c 6f 57 6f 72 6c 64 48 65 6c 6c 6f 57 6f 72 6c 64 48 65 6c 6c 6f 57 6f 72 6c 64 48 65 6c 6c 6f 57 6f 72 6c 64 48 65 6c 6c 6f 57 6f 72 6c 64 48 65 6c 6c 6f 57 6f 72 6c 64 48 65 6c 6c 6f 57 6f 72 6c 64 48 65 6c 6c 6f 57 6f 72 6c 64 48 65 6c 6c 6f 57 6f 72 6c 64 48 65 6c 6c 6f 57 6f 72 6c 64 48 65 6c 6c 6f 57 6f 72"
2618568-2618589 spiflash: field: "Command: Read data (READ)" "Command: Read data" "Cmd: Read data" "Cmd: READ" "READ"
2618589-2618610 spiflash: bit: "Address bits 23..16: 0x11" "Addr bits 23..16: 0x11" "Addr bits 23..16" "A23..A16"
2618610-2618629 spiflash: bit: "Address bits 15..8: 0xb0" "Addr bits 15..8: 0xb0" "Addr bits 15..8" "A15..A8"
2618631-2618650 spiflash: bit: "Address bits 7..0: 0x00" "Addr bits 7..0: 0x00" "Addr bits 7..0" "A7..A0"
2618589-2618650 spiflash: field: "Address: 0x11b000" "Addr: 0x11b000" "0x11b000"
2618656-2623989 spiflash: field: "Data (256 bytes)"
2618568-2665950 spiflash: read: "Read data (addr 0x11b000, 256 bytes): 6c 64 48 65 6c 6c 6f 57 6f 72 6c 64 48 65 6c 6c 6f 57 6f 72 6c 64 48 65 6c 6c 6f 57 6f 72 6c 64 48 65 6c 6c 6f 57 6f 72 6c 64 48 65 6c 6c 6f 57 6f 72 6c 64 48 65 6c 6c 6f 57 6f 72 6c 64 48 65 6c 6c 6f 57 6f 72 6c 64 48 65 6c 6c 6f 57 6f 72 6c 64 48 65 6c 6c 6f 57 6f 72 6c 64 48 65 6c 6c 6f 57 6f 72 6c 64 48 65 6c 6c 6f 57 6f 72 6c 64 48 65 6c 6c 6f 57 6f 72 6c 64 48 65 6c 6c 6f 57 6f 72 6c 64 48 65 6c 6c 6f 57 6f 72 6c 64 48 65 6c 6c 6f 57 6f 72 6c 64 48 65 6c 6c 6f 57 6f 72 6c 64 48 65 6c 6c 6f 57 6f 72 6c 64 48 65 6c 6c 6f 57 6f 72 6c 64 48 65 6c 6c 6f 57 6f 72 6c 64 48 65 6c 6c 6f 57 6f 72 6c 64 48 65 6c 6c 6f 57 6f 72 6c 64 48 65 6c 6c 6f 57 6f 72 6c 64 48 65 6c 6c 6f 57 6f 72 6c 64 48 65 6c 6c 6f 57 6f 72 6c 64 48 65 6c 6c 6f 57 6f 72 6c 64 48 65 6c 6c"
2669608-2669629 spiflash: field: "Command: Read data (READ)" "Command: Read data" "Cmd: Read data" "Cmd: READ" "READ"
2669629-2669650 spiflash: bit: "Address bits 23..16: 0x11" "Addr bits 23..16: 0x11" "Addr bits 23..16" "A23..A16"
2669650-2669671 spiflash: bit: "Address bits 15..8: 0xb1" "Addr bits 15..8: 0xb1" "Addr bits 15..8" "A15..A8"
2669671-2669690 spiflash: bit: "Address bits 7..0: 0x00" "Addr bits 7..0: 0x00" "Addr bits 7..0" "A7..A0"
2669629-2669690 spiflash: field: "Address: 0x11b100" "Addr: 0x11b100" "0x11b100"
2669696-2675029 spiflash: field: "Data (256 bytes)"
2669608-2715546 spiflash: read: "Read data (addr 0x11b100, 256 bytes): 6f 57 6f 72 6c 64 48 65 6c 6c 6f 57 6f 72 6c 64 48 65 6c 6c 6f 57 6f 72 6c 64 48 65 6c 6c 6f 57 6f 72 6c 64 48 65 6c 6c 6f 57 6f 72 6c 64 48 65 6c 6c 6f 57 6f 72 6c 64 48 65 6c 6c 6f 57 6f 72 6c 64 48 65 6c 6c 6f 57 6f 72 6c 64 48 65 6c 6c 6f 57 6f 72 6c 64 48 65 6c 6c 6f 57 6f 72 6c 64 48 65 6c 6c 6f 57 6f 72 6c 64 48 65 6c 6c 6f 57 6f 72 6c 64 48 65 6c 6c 6f 57 6f 72 6c 64 48 65 6c 6c 6f 57 6f 72 6c 64 48 65 6c 6c 6f 57 6f 72 6c 64 48 65 6c 6c 6f 57 6f 72 6c 64 48 65 6c 6c 6f 57 6f 72 6c 64 48 65 6c 6c 6f 57 6f 72 6c 64 48 65 6c 6c 6f 57 6f 72 6c 64 48 65 6c 6c 6f 57 6f 72 6c 64 48 65 6c 6c 6f 57 6f 72 6c 64 48 65 6c 6c 6f 57 6f 72 6c 64 48 65 6c 6c 6f 57 6f 72 6c 64 48 65 6c 6c 6f 57 6f 72 6c 64 48 65 6c 6c 6f 57 6f 72 6c 64 48 65 6c 6c 6f 57 6f 72 6c 64"
2719602-2719623 spiflash: field: "Command: Read data (READ)" "Command: Read data" "Cmd: Read data" "Cmd: READ" "READ"
2719623-2719644 spiflash: bit: "Address bits 23..16: 0x11" "Addr bits 23..16: 0x11" "Addr bits 23..16" "A23..A16"
2719644-2719663 spiflash: bit: "Address bits 15..8: 0xb2" "Addr bits 15..8: 0xb2" "Addr bits 15..8" "A15..A8"
2719665-2719684 spiflash: bit: "Address bits 7..0: 0x00" "Addr bits 7..0: 0x00" "Addr bits 7..0" "A7..A0"
2719623-2719684 spiflash: field: "Address: 0x11b200" "Addr: 0x11b200" "0x11b200"
2719690-2725023 spiflash: field: "Data (256 bytes)"
2719602-2765932 spiflash: read: "Read data (addr 0x11b200, 256 bytes): 48 65 6c 6c 6f 57 6f 72 6c 64 48 65 6c 6c 6f 57 6f 72 6c 64 48 65 6c 6c 6f 57 6f 72 6c 64 48 65 6c 6c 6f 57 6f 72 6c 64 48 65 6c 6c 6f 57 6f 72 6c 64 48 65 6c 6c 6f 57 6f 72 6c 64 48 65 6c 6c 6f 57 6f 72 6c 64 48 65 6c 6c 6f 57 6f 72 6c 64 48 65 6c 6c 6f 57 6f 72 6c 64 48 65 6c 6c 6f 57 6f 72 6c 64 48 65 6c 6c 6f 57 6f 72 6c 64 48 65 6c 6c 6f 57 6f 72 6c 64 48 65 6c 6c 6f 57 6f 72 6c 64 48 65 6c 6c 6f 57 6f 72 6c 64 48 65 6c 6c 6f 57 6f 72 6c 64 48 65 6c 6c 6f 57 6f 72 6c 64 48 65 6c 6c 6f 57 6f 72 6c 64 48 65 6c 6c 6f 57 6f 72 6c 64 48 65 6c 6c 6f 57 6f 72 6c 64 48 65 6c 6c 6f 57 6f 72 6c 64 48 65 6c 6c 6f 57 6f 72 6c 64 48 65 6c 6c 6f 57 6f 72 6c 64 48 65 6c 6c 6f 57 6f 72 6c 64 48 65 6c 6c 6f 57 6f 72 6c 64 48 65 6c 6c 6f 57 6f 72 6c 64 48 65 6c 6c 6f 57"
2768162-2768181 spiflash: field: "Command: Read data (READ)" "Command: Read data" "Cmd: Read data" "Cmd: READ" "READ"
2768182-2768203 spiflash: bit: "Address bits 23..16: 0x11" "Addr bits 23..16: 0x11" "Addr bits 23..16" "A23..A16"
2768203-2768224 spiflash: bit: "Address bits 15..8: 0xb3" "Addr bits 15..8: 0xb3" "Addr bits 15..8" "A15..A8"
2768224-2768245 spiflash: bit: "Address bits 7..0: 0x00" "Addr bits 7..0: 0x00" "Addr bits 7..0" "A7..A0"
2768182-2768245 spiflash: field: "Address: 0x11b300" "Addr: 0x11b300" "0x11b300"
2768249-2773582 spiflash: field: "Data (256 bytes)"
2768162-2815398 spiflash: read: "Read data (addr 0x11b300, 256 bytes): 6f 72 6c 64 48 65 6c 6c 6f 57 6f 72 6c 64 48 65 6c 6c 6f 57 6f 72 6c 64 48 65 6c 6c 6f 57 6f 72 6c 64 48 65 6c 6c 6f 57 6f 72 6c 64 48 65 6c 6c 6f 57 6f 72 6c 64 48 65 6c 6c 6f 57 6f 72 6c 64 48 65 6c 6c 6f 57 6f 72 6c 64 48 65 6c 6c 6f 57 6f 72 6c 64 48 65 6c 6c 6f 57 6f 72 6c 64 48 65 6c 6c 6f 57 6f 72 6c 64 48 65 6c 6c 6f 57 6f 72 6c 64 48 65 6c 6c 6f 57 6f 72 6c 64 48 65 6c 6c 6f 57 6f 72 6c 64 48 65 6c 6c 6f 57 6f 72 6c 64 48 65 6c 6c 6f 57 6f 72 6c 64 48 65 6c 6c 6f 57 6f 72 6c 64 48 65 6c 6c 6f 57 6f 72 6c 64 48 65 6c 6c 6f 57 6f 72 6c 64 48 65 6c 6c 6f 57 6f 72 6c 64 48 65 6c 6c 6f 57 6f 72 6c 64 48 65 6c 6c 6f 57 6f 72 6c 64 48 65 6c 6c 6f 57 6f 72 6c 64 48 65 6c 6c 6f 57 6f 72 6c 64 48 65 6c 6c 6f 57 6f 72 6c 64 48 65 6c 6c 6f 57 6f 72 6c 64 48 65"
2819584-2819605 spiflash: field: "Command: Read data (READ)" "Command: Read data" "Cmd: Read data" "Cmd: READ" "READ"
2819605-2819624 spiflash: bit: "Address bits 23..16: 0x11" "Addr bits 23..16: 0x11" "Addr bits 23..16" "A23..A16"
2819626-2819645 spiflash: bit: "Address bits 15..8: 0xb4" "Addr bits 15..8: 0xb4" "Addr bits 15..8" "A15..A8"
2819647-2819666 spiflash: bit: "Address bits 7..0: 0x00" "Addr bits 7..0: 0x00" "Addr bits 7..0" "A7..A0"
2819605-2819666 spiflash: field: "Address: 0x11b400" "Addr: 0x11b400" "0x11b400"
2819672-2825005 spiflash: field: "Data (256 bytes)"
2819584-2865528 spiflash: read: "Read data (addr 0x11b400, 256 bytes): 6c 6c 6f 57 6f 72 6c 64 48 65 6c 6c 6f 57 6f 72 6c 64 48 65 6c 6c 6f 57 6f 72 6c 64 48 65 6c 6c 6f 57 6f 72 6c 64 48 65 6c 6c 6f 57 6f 72 6c 64 48 65 6c 6c 6f 57 6f 72 6c 64 48 65 6c 6c 6f 57 6f 72 6c 64 48 65 6c 6c 6f 57 6f 72 6c 64 48 65 6c 6c 6f 57 6f 72 6c 64 48 65 6c 6c 6f 57 6f 72 6c 64 48 65 6c 6c 6f 57 6f 72 6c 64 48 65 6c 6c 6f 57 6f 72 6c 64 48 65 6c 6c 6f 57 6f 72 6c 64 48 65 6c 6c 6f 57 6f 72 6c 64 48 65 6c 6c 6f 57 6f 72 6c 64 48 65 6c 6c 6f 57 6f 72 6c 64 48 65 6c 6c 6f 57 6f 72 6c 64 48 65 6c 6c 6f 57 6f 72 6c 64 48 65 6c 6c 6f 57 6f 72 6c 64 48 65 6c 6c 6f 57 6f 72 6c 64 48 65 6c 6c 6f 57 6f 72 6c 64 48 65 6c 6c 6f 57 6f 72 6c 64 48 65 6c 6c 6f 57 6f 72 6c 64 48 65 6c 6c 6f 57 6f 72 6c 64 48 65 6c 6c 6f 57 6f 72 6c 64 48 65 6c 6c 6f 57 6f 72"
2869063-2869084 spiflash: field: "Command: Read data (READ)" "Command: Read data" "Cmd: Read data" "Cmd: READ" "READ"
2869084-2869105 spiflash: bit: "Address bits 23..16: 0x11" "Addr bits 23..16: 0x11" "Addr bits 23..16" "A23..A16"
2869105-2869126 spiflash: bit: "Address bits 15..8: 0xb5" "Addr bits 15..8: 0xb5" "Addr bits 15..8" "A15..A8"
2869126-2869145 spiflash: bit: "Address bits 7..0: 0x00" "Addr bits 7..0: 0x00" "Addr bits 7..0" "A7..A0"
2869084-2869145 spiflash: field: "Address: 0x11b500" "Addr: 0x11b500" "0x11b500"
2869151-2874484 spiflash: field: "Data (256 bytes)"
2869063-2915272 spiflash: read: "Read data (addr 0x11b500, 256 bytes): 6c 64 48 65 6c 6c 6f 57 6f 72 6c 64 48 65 6c 6c 6f 57 6f 72 6c 64 48 65 6c 6c 6f 57 6f 72 6c 64 48 65 6c 6c 6f 57 6f 72 6c 64 48 65 6c 6c 6f 57 6f 72 6c 64 48 65 6c 6c 6f 57 6f 72 6c 64 48 65 6c 6c 6f 57 6f 72 6c 64 48 65 6c 6c 6f 57 6f 72 6c 64 48 65 6c 6c 6f 57 6f 72 6c 64 48 65 6c 6c 6f 57 6f 72 6c 64 48 65 6c 6c 6f 57 6f 72 6c 64 48 65 6c 6c 6f 57 6f 72 6c 64 48 65 6c 6c 6f 57 6f 72 6c 64 48 65 6c 6c 6f 57 6f 72 6c 64 48 65 6c 6c 6f 57 6f 72 6c 64 48 65 6c 6c 6f 57 6f 72 6c 64 48 65 6c 6c 6f 57 6f 72 6c 64 48 65 6c 6c 6f 57 6f 72 6c 64 48 65 6c 6c 6f 57 6f 72 6c 64 48 65 6c 6c 6f 57 6f 72 6c 64 48 65 6c 6c 6f 57 6f 72 6c 64 48 65 6c 6c 6f 57 6f 72 6c 64 48 65 6c 6c 6f 57 6f 72 6c 64 48 65 6c 6c 6f 57 6f 72 6c 64 48 65 6c 6c 6f 57 6f 72 6c 64 48 65 6c 6c"
2919578-2919597 spiflash: field: "Command: Read data (READ)" "Command: Read data" "Cmd: Read data" "Cmd: READ" "READ"
2919599-2919618 spiflash: bit: "Address bits 23..16: 0x11" "Addr bits 23..16: 0x11" "Addr bits 23..16" "A23..A16"
2919619-2919640 spiflash: bit: "Address bits 15..8: 0xb6" "Addr bits 15..8: 0xb6" "Addr bits 15..8" "A15..A8"
2919640-2919661 spiflash: bit: "Address bits 7..0: 0x00" "Addr bits 7..0: 0x00" "Addr bits 7..0" "A7..A0"
2919599-2919661 spiflash: field: "Address: 0x11b600" "Addr: 0x11b600" "0x11b600"
2919665-2924997 spiflash: field: "Data (256 bytes)"
2919578-2965407 spiflash: read: "Read data (addr 0x11b600, 256 bytes): 6f 57 6f 72 6c 64 48 65 6c 6c 6f 57 6f 72 6c 64 48 65 6c 6c 6f 57 6f 72 6c 64 48 65 6c 6c 6f 57 6f 72 6c 64 48 65 6c 6c 6f 57 6f 72 6c 64 48 65 6c 6c 6f 57 6f 72 6c 64 48 65 6c 6c 6f 57 6f 72 6c 64 48 65 6c 6c 6f 57 6f 72 6c 64 48 65 6c 6c 6f 57 6f 72 6c 64 48 65 6c 6c 6f 57 6f 72 6c 64 48 65 6c 6c 6f 57 6f 72 6c 64 48 65 6c 6c 6f 57 6f 72 6c 64 48 65 6c 6c 6f 57 6f 72 6c 64 48 65 6c 6c 6f 57 6f 72 6c 64 48 65 6c 6c 6f 57 6f 72 6c 64 48 65 6c 6c 6f 57 6f 72 6c 64 48 65 6c 6c 6f 57 6f 72 6c 64 48 65 6c 6c 6f 57 6f 72 6c 64 48 65 6c 6c 6f 57 6f 72 6c 64 48 65 6c 6c 6f 57 6f 72 6c 64 48 65 6c 6c 6f 57 6f 72 6c 64 48 65 6c 6c 6f 57 6f 72 6c 64 48 65 6c 6c 6f 57 6f 72 6c 64 48 65 6c 6c 6f 57 6f 72 6c 64 48 65 6c 6c 6f 57 6f 72 6c 64 48 65 6c 6c 6f 57 6f 72 6c 64"
2968129-2968150 spiflash: field: "Command: Read data (READ)" "Command: Read data" "Cmd: Read data" "Cmd: READ" "READ"
2968150-2968169 spiflash: bit: "Address bits 23..16: 0x11" "Addr bits 23..16: 0x11" "Addr bits 23..16" "A23..A16"
2968171-2968190 spiflash: bit: "Address bits 15..8: 0xb7" "Addr bits 15..8: 0xb7" "Addr bits 15..8" "A15..A8"
2968192-2968211 spiflash: bit: "Address bits 7..0: 0x00" "Addr bits 7..0: 0x00" "Addr bits 7..0" "A7..A0"
2968150-2968211 spiflash: field: "Address: 0x11b700" "Addr: 0x11b700" "0x11b700"
2968217-2973548 spiflash: field: "Data (256 bytes)"
2968129-3015514 spiflash: read: "Read data (addr 0x11b700, 256 bytes): 48 65 6c 6c 6f 57 6f 72 6c 64 48 65 6c 6c 6f 57 6f 72 6c 64 48 65 6c 6c 6f 57 6f 72 6c 64 48 65 6c 6c 6f 57 6f 72 6c 64 48 65 6c 6c 6f 57 6f 72 6c 64 48 65 6c 6c 6f 57 6f 72 6c 64 48 65 6c 6c 6f 57 6f 72 6c 64 48 65 6c 6c 6f 57 6f 72 6c 64 48 65 6c 6c 6f 57 6f 72 6c 64 48 65 6c 6c 6f 57 6f 72 6c 64 48 65 6c 6c 6f 57 6f 72 6c 64 48 65 6c 6c 6f 57 6f 72 6c 64 48 65 6c 6c 6f 57 6f 72 6c 64 48 65 6c 6c 6f 57 6f 72 6c 64 48 65 6c 6c 6f 57 6f 72 6c 64 48 65 6c 6c 6f 57 6f 72 6c 64 48 65 6c 6c 6f 57 6f 72 6c 64 48 65 6c 6c 6f 57 6f 72 6c 64 48 65 6c 6c 6f 57 6f 72 6c 64 48 65 6c 6c 6f 57 6f 72 6c 64 48 65 6c 6c 6f 57 6f 72 6c 64 48 65 6c 6c 6f 57 6f 72 6c 64 48 65 6c 6c 6f 57 6f 72 6c 64 48 65 6c 6c 6f 57 6f 72 6c 64 48 65 6c 6c 6f 57 6f 72 6c 64 48 65 6c 6c 6f 57"
3019454-3019475 spiflash: field: "Command: Read data (READ)" "Command: Read data" "Cmd: Read data" "Cmd: READ" "READ"
3019475-3019496 spiflash: bit: "Address bits 23..16: 0x11" "Addr bits 23..16: 0x11" "Addr bits 23..16" "A23..A16"
3019496-3019515 spiflash: bit: "Address bits 15..8: 0xb8" "Addr bits 15..8: 0xb8" "Addr bits 15..8" "A15..A8"
3019517-3019536 spiflash: bit: "Address bits 7..0: 0x00" "Addr bits 7..0: 0x00" "Addr bits 7..0" "A7..A0"
3019475-3019536 spiflash: field: "Address: 0x11b800" "Addr: 0x11b800" "0x11b800"
3019542-3024875 spiflash: field: "Data (256 bytes)"
3019454-3065778 spiflash: read: "Read data (addr 0x11b800, 256 bytes): 6f 72 6c 64 48 65 6c 6c 6f 57 6f 72 6c 64 48 65 6c 6c 6f 57 6f 72 6c 64 48 65 6c 6c 6f 57 6f 72 6c 64 48 65 6c 6c 6f 57 6f 72 6c 64 48 65 6c 6c 6f 57 6f 72 6c 64 48 65 6c 6c 6f 57 6f 72 6c 64 48 65 6c 6c 6f 57 6f 72 6c 64 48 65 6c 6c 6f 57 6f 72 6c 64 48 65 6c 6c 6f 57 6f 72 6c 64 48 65 6c 6c 6f 57 6f 72 6c 64 48 65 6c 6c 6f 57 6f 72 6c 64 48 65 6c 6c 6f 57 6f 72 6c 64 48 65 6c 6c 6f 57 6f 72 6c 64 48 65 6c 6c 6f 57 6f 72 6c 64 48 65 6c 6c 6f 57 6f 72 6c 64 48 65 6c 6c 6f 57 6f 72 6c 64 48 65 6c 6c 6f 57 6f 72 6c 64 48 65 6c 6c 6f 57 6f 72 6c 64 48 65 6c 6c 6f 57 6f 72 6c 64 48 65 6c 6c 6f 57 6f 72 6c 64 48 65 6c 6c 6f 57 6f 72 6c 64 48 65 6c 6c 6f 57 6f 72 6c 64 48 65 6c 6c 6f 57 6f 72 6c 64 48 65 6c 6c 6f 57 6f 72 6c 64 48 65 6c 6c 6f 57 6f 72 6c 64 48 65"
3069568-3069587 spiflash: field: "Command: Read data (READ)" "Command: Read data" "Cmd: Read data" "Cmd: READ" "READ"
3069588-3069609 spiflash: bit: "Address bits 23..16: 0x11" "Addr bits 23..16: 0x11" "Addr bits 23..16" "A23..A16"
3069609-3069630 spiflash: bit: "Address bits 15..8: 0xb9" "Addr bits 15..8: 0xb9" "Addr bits 15..8" "A15..A8"
3069630-3069651 spiflash: bit: "Address bits 7..0: 0x00" "Addr bits 7..0: 0x00" "Addr bits 7..0" "A7..A0"
3069588-3069651 spiflash: field: "Address: 0x11b900" "Addr: 0x11b900" "0x11b900"
3069655-3074988 spiflash: field: "Data (256 bytes)"
3069568-3115383 spiflash: read: "Read data (addr 0x11b900, 256 bytes): 6c 6c 6f 57 6f 72 6c 64 48 65 6c 6c 6f 57 6f 72 6c 64 48 65 6c 6c 6f 57 6f 72 6c 64 48 65 6c 6c 6f 57 6f 72 6c 64 48 65 6c 6c 6f 57 6f 72 6c 64 48 65 6c 6c 6f 57 6f 72 6c 64 48 65 6c 6c 6f 57 6f 72 6c 64 48 65 6c 6c 6f 57 6f 72 6c 64 48 65 6c 6c 6f 57 6f 72 6c 64 48 65 6c 6c 6f 57 6f 72 6c 64 48 65 6c 6c 6f 57 6f 72 6c 64 48 65 6c 6c 6f 57 6f 72 6c 64 48 65 6c 6c 6f 57 6f 72 6c 64 48 65 6c 6c 6f 57 6f 72 6c 64 48 65 6c 6c 6f 57 6f 72 6c 64 48 65 6c 6c 6f 57 6f 72 6c 64 48 65 6c 6c 6f 57 6f 72 6c 64 48 65 6c 6c 6f 57 6f 72 6c 64 48 65 6c 6c 6f 57 6f 72 6c 64 48 65 6c 6c 6f 57 6f 72 6c 64 48 65 6c 6c 6f 57 6f 72 6c 64 48 65 6c 6c 6f 57 6f 72 6c 64 48 65 6c 6c 6f 57 6f 72 6c 64 48 65 6c 6c 6f 57 6f 72 6c 64 48 65 6c 6c 6f 57 6f 72 6c 64 48 65 6c 6c 6f 57 6f 72"
3119561-3119582 spiflash: field: "Command: Read data (READ)" "Command: Read data" "Cmd: Read data" "Cmd: READ" "READ"
3119582-3119601 spiflash: bit: "Address bits 23..16: 0x11" "Addr bits 23..16: 0x11" "Addr bits 23..16" "A23..A16"
3119603-3119622 spiflash: bit: "Address bits 15..8: 0xba" "Addr bits 15..8: 0xba" "Addr bits 15..8" "A15..A8"
3119624-3119643 spiflash: bit: "Address bits 7..0: 0x00" "Addr bits 7..0: 0x00" "Addr bits 7..0" "A7..A0"
3119582-3119643 spiflash: field: "Address: 0x11ba00" "Addr: 0x11ba00" "0x11ba00"
3119649-3124980 spiflash: field: "Data (256 bytes)"
3119561-3165777 spiflash: read: "Read data (addr 0x11ba00, 256 bytes): 6c 64 48 65 6c 6c 6f 57 6f 72 6c 64 48 65 6c 6c 6f 57 6f 72 6c 64 48 65 6c 6c 6f 57 6f 72 6c 64 48 65 6c 6c 6f 57 6f 72 6c 64 48 65 6c 6c 6f 57 6f 72 6c 64 48 65 6c 6c 6f 57 6f 72 6c 64 48 65 6c 6c 6f 57 6f 72 6c 64 48 65 6c 6c 6f 57 6f 72 6c 64 48 65 6c 6c 6f 57 6f 72 6c 64 48 65 6c 6c 6f 57 6f 72 6c 64 48 65 6c 6c 6f 57 6f 72 6c 64 48 65 6c 6c 6f 57 6f 72 6c 64 48 65 6c 6c 6f 57 6f 72 6c 64 48 65 6c 6c 6f 57 6f 72 6c 64 48 65 6c 6c 6f 57 6f 72 6c 64 48 65 6c 6c 6f 57 6f 72 6c 64 48 65 6c 6c 6f 57 6f 72 6c 64 48 65 6c 6c 6f 57 6f 72 6c 64 48 65 6c 6c 6f 57 6f 72 6c 64 48 65 6c 6c 6f 57 6f 72 6c 64 48 65 6c 6c 6f 57 6f 72 6c 64 48 65 6c 6c 6f 57 6f 72 6c 64 48 65 6c 6c 6f 57 6f 72 6c 64 48 65 6c 6c 6f 57 6f 72 6c 64 48 65 6c 6c 6f 57 6f 72 6c 64 48 65 6c 6c"
3169542-3169561 spiflash: field: "Command: Read data (READ)" "Command: Read data" "Cmd: Read data" "Cmd: READ" "READ"
3169562-3169583 spiflash: bit: "Address bits 23..16: 0x11" "Addr bits 23..16: 0x11" "Addr bits 23..16" "A23..A16"
3169583-3169604 spiflash: bit: "Address bits 15..8: 0xbb" "Addr bits 15..8: 0xbb" "Addr bits 15..8" "A15..A8"
3169604-3169625 spiflash: bit: "Address bits 7..0: 0x00" "Addr bits 7..0: 0x00" "Addr bits 7..0" "A7..A0"
3169562-3169625 spiflash: field: "Address: 0x11bb00" "Addr: 0x11bb00" "0x11bb00"
3169629-3174962 spiflash: field: "Data (256 bytes)"
3169542-3239287 spiflash: read: "Read data (addr 0x11bb00, 256 bytes): 6f 57 6f 72 6c 64 48 65 6c 6c 6f 57 6f 72 6c 64 48 65 6c 6c 6f 57 6f 72 6c 64 48 65 6c 6c 6f 57 6f 72 6c 64 48 65 6c 6c 6f 57 6f 72 6c 64 48 65 6c 6c 6f 57 6f 72 6c 64 48 65 6c 6c 6f 57 6f 72 6c 64 48 65 6c 6c 6f 57 6f 72 6c 64 48 65 6c 6c 6f 57 6f 72 6c 64 48 65 6c 6c 6f 57 6f 72 6c 64 48 65 6c 6c 6f 57 6f 72 6c 64 48 65 6c 6c 6f 57 6f 72 6c 64 48 65 6c 6c 6f 57 6f 72 6c 64 48 65 6c 6c 6f 57 6f 72 6c 64 48 65 6c 6c 6f 57 6f 72 6c 64 48 65 6c 6c 6f 57 6f 72 6c 64 48 65 6c 6c 6f 57 6f 72 6c 64 48 65 6c 6c 6f 57 6f 72 6c 64 48 65 6c 6c 6f 57 6f 72 6c 64 48 65 6c 6c 6f 57 6f 72 6c 64 48 65 6c 6c 6f 57 6f 72 6c 64 48 65 6c 6c 6f 57 6f 72 6c 64 48 65 6c 6c 6f 57 6f 72 6c 64 48 65 6c 6c 6f 57 6f 72 6c 64 48 65 6c 6c 6f 57 6f 72 6c 64 48 65 6c 6c 6f 57 6f 72 6c 64"
3246604-3246625 spiflash: field: "Command: Read data (READ)" "Command: Read data" "Cmd: Read data" "Cmd: READ" "READ"
3246625-3246646 spiflash: bit: "Address bits 23..16: 0x11" "Addr bits 23..16: 0x11" "Addr bits 23..16" "A23..A16"
3246646-3246667 spiflash: bit: "Address bits 15..8: 0xbc" "Addr bits 15..8: 0xbc" "Addr bits 15..8" "A15..A8"
3246667-3246686 spiflash: bit: "Address bits 7..0: 0x00" "Addr bits 7..0: 0x00" "Addr bits 7..0" "A7..A0"
3246625-3246686 spiflash: field: "Address: 0x11bc00" "Addr: 0x11bc00" "0x11bc00"
3246692-3252025 spiflash: field: "Data (256 bytes)"
3246604-3265230 spiflash: read: "Read data (addr 0x11bc00, 256 bytes): 48 65 6c 6c 6f 57 6f 72 6c 64 48 65 6c 6c 6f 57 6f 72 6c 64 48 65 6c 6c 6f 57 6f 72 6c 64 48 65 6c 6c 6f 57 6f 72 6c 64 48 65 6c 6c 6f 57 6f 72 6c 64 48 65 6c 6c 6f 57 6f 72 6c 64 48 65 6c 6c 6f 57 6f 72 6c 64 48 65 6c 6c 6f 57 6f 72 6c 64 48 65 6c 6c 6f 57 6f 72 6c 64 48 65 6c 6c 6f 57 6f 72 6c 64 48 65 6c 6c 6f 57 6f 72 6c 64 48 65 6c 6c 6f 57 6f 72 6c 64 48 65 6c 6c 6f 57 6f 72 6c 64 48 65 6c 6c 6f 57 6f 72 6c 64 48 65 6c 6c 6f 57 6f 72 6c 64 48 65 6c 6c 6f 57 6f 72 6c 64 48 65 6c 6c 6f 57 6f 72 6c 64 48 65 6c 6c 6f 57 6f 72 6c 64 48 65 6c 6c 6f 57 6f 72 6c 64 48 65 6c 6c 6f 57 6f 72 6c 64 48 65 6c 6c 6f 57 6f 72 6c 64 48 65 6c 6c 6f 57 6f 72 6c 64 48 65 6c 6c 6f 57 6f 72 6c 64 48 65 6c 6c 6f 57 6f 72 6c 64 48 65 6c 6c 6f 57 6f 72 6c 64 48 65 6c 6c 6f 57"
3269008-3269027 spiflash: field: "Command: Read data (READ)" "Command: Read data" "Cmd: Read data" "Cmd: READ" "READ"
3269028-3269049 spiflash: bit: "Address bits 23..16: 0x11" "Addr bits 23..16: 0x11" "Addr bits 23..16" "A23..A16"
3269049-3269070 spiflash: bit: "Address bits 15..8: 0xbd" "Addr bits 15..8: 0xbd" "Addr bits 15..8" "A15..A8"
3269070-3269091 spiflash: bit: "Address bits 7..0: 0x00" "Addr bits 7..0: 0x00" "Addr bits 7..0" "A7..A0"
3269028-3269091 spiflash: field: "Address: 0x11bd00" "Addr: 0x11bd00" "0x11bd00"
3269095-3274428 spiflash: field: "Data (256 bytes)"
3269008-3315358 spiflash: read: "Read data (addr 0x11bd00, 256 bytes): 6f 72 6c 64 48 65 6c 6c 6f 57 6f 72 6c 64 48 65 6c 6c 6f 57 6f 72 6c 64 48 65 6c 6c 6f 57 6f 72 6c 64 48 65 6c 6c 6f 57 6f 72 6c 64 48 65 6c 6c 6f 57 6f 72 6c 64 48 65 6c 6c 6f 57 6f 72 6c 64 48 65 6c 6c 6f 57 6f 72 6c 64 48 65 6c 6c 6f 57 6f 72 6c 64 48 65 6c 6c 6f 57 6f 72 6c 64 48 65 6c 6c 6f 57 6f 72 6c 64 48 65 6c 6c 6f 57 6f 72 6c 64 48 65 6c 6c 6f 57 6f 72 6c 64 48 65 6c 6c 6f 57 6f 72 6c 64 48 65 6c 6c 6f 57 6f 72 6c 64 48 65 6c 6c 6f 57 6f 72 6c 64 48 65 6c 6c 6f 57 6f 72 6c 64 48 65 6c 6c 6f 57 6f 72 6c 64 48 65 6c 6c 6f 57 6f 72 6c 64 48 65 6c 6c 6f 57 6f 72 6c 64 48 65 6c 6c 6f 57 6f 72 6c 64 48 65 6c 6c 6f 57 6f 72 6c 64 48 65 6c 6c 6f 57 6f 72 6c 64 48 65 6c 6c 6f 57 6f 72 6c 64 48 65 6c 6c 6f 57 6f 72 6c 64 48 65 6c 6c 6f 57 6f 72 6c 64 48 65"
3319525-3319544 spiflash: field: "Command: Read data (READ)" "Command: Read data" "Cmd: Read data" "Cmd: READ" "READ"
3319546-3319565 spiflash: bit: "Address bits 23..16: 0x11" "Addr bits 23..16: 0x11" "Addr bits 23..16" "A23..A16"
3319566-3319587 spiflash: bit: "Address bits 15..8: 0xbe" "Addr bits 15..8: 0xbe" "Addr bits 15..8" "A15..A8"
3319587-3319608 spiflash: bit: "Address bits 7..0: 0x00" "Addr bits 7..0: 0x00" "Addr bits 7..0" "A7..A0"
3319546-3319608 spiflash: field: "Address: 0x11be00" "Addr: 0x11be00" "0x11be00"
3319612-3324944 spiflash: field: "Data (256 bytes)"
3319525-3365862 spiflash: read: "Read data (addr 0x11be00, 256 bytes): 6c 6c 6f 57 6f 72 6c 64 48 65 6c 6c 6f 57 6f 72 6c 64 48 65 6c 6c 6f 57 6f 72 6c 64 48 65 6c 6c 6f 57 6f 72 6c 64 48 65 6c 6c 6f 57 6f 72 6c 64 48 65 6c 6c 6f 57 6f 72 6c 64 48 65 6c 6c 6f 57 6f 72 6c 64 48 65 6c 6c 6f 57 6f 72 6c 64 48 65 6c 6c 6f 57 6f 72 6c 64 48 65 6c 6c 6f 57 6f 72 6c 64 48 65 6c 6c 6f 57 6f 72 6c 64 48 65 6c 6c 6f 57 6f 72 6c 64 48 65 6c 6c 6f 57 6f 72 6c 64 48 65 6c 6c 6f 57 6f 72 6c 64 48 65 6c 6c 6f 57 6f 72 6c 64 48 65 6c 6c 6f 57 6f 72 6c 64 48 65 6c 6c 6f 57 6f 72 6c 64 48 65 6c 6c 6f 57 6f 72 6c 64 48 65 6c 6c 6f 57 6f 72 6c 64 48 65 6c 6c 6f 57 6f 72 6c 64 48 65 6c 6c 6f 57 6f 72 6c 64 48 65 6c 6c 6f 57 6f 72 6c 64 48 65 6c 6c 6f 57 6f 72 6c 64 48 65 6c 6c 6f 57 6f 72 6c 64 48 65 6c 6c 6f 57 6f 72 6c 64 48 65 6c 6c 6f 57 6f 72"
3369528-3369547 spiflash: field: "Command: Read data (READ)" "Command: Read data" "Cmd: Read data" "Cmd: READ" "READ"
3369549-3369568 spiflash: bit: "Address bits 23..16: 0x11" "Addr bits 23..16: 0x11" "Addr bits 23..16" "A23..A16"
3369569-3369590 spiflash: bit: "Address bits 15..8: 0xbf" "Addr bits 15..8: 0xbf" "Addr bits 15..8" "A15..A8"
3369590-3369611 spiflash: bit: "Address bits 7..0: 0x00" "Addr bits 7..0: 0x00" "Addr bits 7..0" "A7..A0"
3369549-3369611 spiflash: field: "Address: 0x11bf00" "Addr: 0x11bf00" "0x11bf00"
3369615-3374947 spiflash: field: "Data (256 bytes)"
3369528-3415849 spiflash: read: "Read data (addr 0x11bf00, 256 bytes): 6c 64 48 65 6c 6c 6f 57 6f 72 6c 64 48 65 6c 6c 6f 57 6f 72 6c 64 48 65 6c 6c 6f 57 6f 72 6c 64 48 65 6c 6c 6f 57 6f 72 6c 64 48 65 6c 6c 6f 57 6f 72 6c 64 48 65 6c 6c 6f 57 6f 72 6c 64 48 65 6c 6c 6f 57 6f 72 6c 64 48 65 6c 6c 6f 57 6f 72 6c 64 48 65 6c 6c 6f 57 6f 72 6c 64 48 65 6c 6c 6f 57 6f 72 6c 64 48 65 6c 6c 6f 57 6f 72 6c 64 48 65 6c 6c 6f 57 6f 72 6c 64 48 65 6c 6c 6f 57 6f 72 6c 64 48 65 6c 6c 6f 57 6f 72 6c 64 48 65 6c 6c 6f 57 6f 72 6c 64 48 65 6c 6c 6f 57 6f 72 6c 64 48 65 6c 6c 6f 57 6f 72 6c 64 48 65 6c 6c 6f 57 6f 72 6c 64 48 65 6c 6c 6f 57 6f 72 6c 64 48 65 6c 6c 6f 57 6f 72 6c 64 48 65 6c 6c 6f 57 6f 72 6c 64 48 65 6c 6c 6f 57 6f 72 6c 64 48 65 6c 6c 6f 57 6f 72 6c 64 48 65 6c 6c 6f 57 6f 72 6c 64 48 65 6c 6c 6f 57 6f 72 6c 64 48 65 6c 6c"
3418461-3418482 spiflash: field: "Command: Read data (READ)" "Command: Read data" "Cmd: Read data" "Cmd: READ" "READ"
3418482-3418503 spiflash: bit: "Address bits 23..16: 0x11" "Addr bits 23..16: 0x11" "Addr bits 23..16" "A23..A16"
3418503-3418522 spiflash: bit: "Address bits 15..8: 0xc0" "Addr bits 15..8: 0xc0" "Addr bits 15..8" "A15..A8"
3418524-3418543 spiflash: bit: "Address bits 7..0: 0x00" "Addr bits 7..0: 0x00" "Addr bits 7..0" "A7..A0"
3418482-3418543 spiflash: field: "Address: 0x11c000" "Addr: 0x11c000" "0x11c000"
3418549-3423882 spiflash: field: "Data (256 bytes)"
3418461-3465732 spiflash: read: "Read data (addr 0x11c000, 256 bytes): 6f 57 6f 72 6c 64 48 65 6c 6c 6f 57 6f 72 6c 64 48 65 6c 6c 6f 57 6f 72 6c 64 48 65 6c 6c 6f 57 6f 72 6c 64 48 65 6c 6c 6f 57 6f 72 6c 64 48 65 6c 6c 6f 57 6f 72 6c 64 48 65 6c 6c 6f 57 6f 72 6c 64 48 65 6c 6c 6f 57 6f 72 6c 64 48 65 6c 6c 6f 57 6f 72 6c 64 48 65 6c 6c 6f 57 6f 72 6c 64 48 65 6c 6c 6f 57 6f 72 6c 64 48 65 6c 6c 6f 57 6f 72 6c 64 48 65 6c 6c 6f 57 6f 72 6c 64 48 65 6c 6c 6f 57 6f 72 6c 64 48 65 6c 6c 6f 57 6f 72 6c 64 48 65 6c 6c 6f 57 6f 72 6c 64 48 65 6c 6c 6f 57 6f 72 6c 64 48 65 6c 6c 6f 57 6f 72 6c 64 48 65 6c 6c 6f 57 6f 72 6c 64 48 65 6c 6c 6f 57 6f 72 6c 64 48 65 6c 6c 6f 57 6f 72 6c 64 48 65 6c 6c 6f 57 6f 72 6c 64 48 65 6c 6c 6f 57 6f 72 6c 64 48 65 6c 6c 6f 57 6f 72 6c 64 48 65 6c 6c 6f 57 6f 72 6c 64 48 65 6c 6c 6f 57 6f 72 6c 64"
3469524-3469545 spiflash: field: "Command: Read data (READ)" "Command: Read data" "Cmd: Read data" "Cmd: READ" "READ"
3469545-3469566 spiflash: bit: "Address bits 23..16: 0x11" "Addr bits 23..16: 0x11" "Addr bits 23..16" "A23..A16"
3469566-3469585 spiflash: bit: "Address bits 15..8: 0xc1" "Addr bits 15..8: 0xc1" "Addr bits 15..8" "A15..A8"
3469587-3469606 spiflash: bit: "Address bits 7..0: 0x00" "Addr bits 7..0: 0x00" "Addr bits 7..0" "A7..A0"
3469545-3469606 spiflash: field: "Address: 0x11c100" "Addr: 0x11c100" "0x11c100"
3469612-3474945 spiflash: field: "Data (256 bytes)"
3469524-3515722 spiflash: read: "Read data (addr 0x11c100, 256 bytes): 48 65 6c 6c 6f 57 6f 72 6c 64 48 65 6c 6c 6f 57 6f 72 6c 64 48 65 6c 6c 6f 57 6f 72 6c 64 48 65 6c 6c 6f 57 6f 72 6c 64 48 65 6c 6c 6f 57 6f 72 6c 64 48 65 6c 6c 6f 57 6f 72 6c 64 48 65 6c 6c 6f 57 6f 72 6c 64 48 65 6c 6c 6f 57 6f 72 6c 64 48 65 6c 6c 6f 57 6f 72 6c 64 48 65 6c 6c 6f 57 6f 72 6c 64 48 65 6c 6c 6f 57 6f 72 6c 64 48 65 6c 6c 6f 57 6f 72 6c 64 48 65 6c 6c 6f 57 6f 72 6c 64 48 65 6c 6c 6f 57 6f 72 6c 64 48 65 6c 6c 6f 57 6f 72 6c 64 48 65 6c 6c 6f 57 6f 72 6c 64 48 65 6c 6c 6f 57 6f 72 6c 64 48 65 6c 6c 6f 57 6f 72 6c 64 48 65 6c 6c 6f 57 6f 72 6c 64 48 65 6c 6c 6f 57 6f 72 6c 64 48 65 6c 6c 6f 57 6f 72 6c 64 48 65 6c 6c 6f 57 6f 72 6c 64 48 65 6c 6c 6f 57 6f 72 6c 64 48 65 6c 6c 6f 57 6f 72 6c 64 48 65 6c 6c 6f 57 6f 72 6c 64 48 65 6c 6c 6f 57"
3519497-3519518 spiflash: field: "Command: Read data (READ)" "Command: Read data" "Cmd: Read data" "Cmd: READ" "READ"
3519518-3519539 spiflash: bit: "Address bits 23..16: 0x11" "Addr bits 23..16: 0x11" "Addr bits 23..16" "A23..A16"
3519539-3519558 spiflash: bit: "Address bits 15..8: 0xc2" "Addr bits 15..8: 0xc2" "Addr bits 15..8" "A15..A8"
3519560-3519579 spiflash: bit: "Address bits 7..0: 0x00" "Addr bits 7..0: 0x00" "Addr bits 7..0" "A7..A0"
3519518-3519579 spiflash: field: "Address: 0x11c200" "Addr: 0x11c200" "0x11c200"
3519585-3524918 spiflash: field: "Data (256 bytes)"
3519497-3564246 spiflash: read: "Read data (addr 0x11c200, 256 bytes): 6f 72 6c 64 48 65 6c 6c 6f 57 6f 72 6c 64 48 65 6c 6c 6f 57 6f 72 6c 64 48 65 6c 6c 6f 57 6f 72 6c 64 48 65 6c 6c 6f 57 6f 72 6c 64 48 65 6c 6c 6f 57 6f 72 6c 64 48 65 6c 6c 6f 57 6f 72 6c 64 48 65 6c 6c 6f 57 6f 72 6c 64 48 65 6c 6c 6f 57 6f 72 6c 64 48 65 6c 6c 6f 57 6f 72 6c 64 48 65 6c 6c 6f 57 6f 72 6c 64 48 65 6c 6c 6f 57 6f 72 6c 64 48 65 6c 6c 6f 57 6f 72 6c 64 48 65 6c 6c 6f 57 6f 72 6c 64 48 65 6c 6c 6f 57 6f 72 6c 64 48 65 6c 6c 6f 57 6f 72 6c 64 48 65 6c 6c 6f 57 6f 72 6c 64 48 65 6c 6c 6f 57 6f 72 6c 64 48 65 6c 6c 6f 57 6f 72 6c 64 48 65 6c 6c 6f 57 6f 72 6c 64 48 65 6c 6c 6f 57 6f 72 6c 64 48 65 6c 6c 6f 57 6f 72 6c 64 48 65 6c 6c 6f 57 6f 72 6c 64 48 65 6c 6c 6f 57 6f 72 6c 64 48 65 6c 6c 6f 57 6f 72 6c 64 48 65 6c 6c 6f 57 6f 72 6c 64 48 65"
3569626-3569645 spiflash: field: "Command: Read data (READ)" "Command: Read data" "Cmd: Read data" "Cmd: READ" "READ"
3569647-3569666 spiflash: bit: "Address bits 23..16: 0x11" "Addr bits 23..16: 0x11" "Addr bits 23..16" "A23..A16"
3569667-3569688 spiflash: bit: "Address bits 15..8: 0xc3" "Addr bits 15..8: 0xc3" "Addr bits 15..8" "A15..A8"
3569688-3569709 spiflash: bit: "Address bits 7..0: 0x00" "Addr bits 7..0: 0x00" "Addr bits 7..0" "A7..A0"
3569647-3569709 spiflash: field: "Address: 0x11c300" "Addr: 0x11c300" "0x11c300"
3569713-3575045 spiflash: field: "Data (256 bytes)"
3569626-3613791 spiflash: read: "Read data (addr 0x11c300, 256 bytes): 6c 6c 6f 57 6f 72 6c 64 48 65 6c 6c 6f 57 6f 72 6c 64 48 65 6c 6c 6f 57 6f 72 6c 64 48 65 6c 6c 6f 57 6f 72 6c 64 48 65 6c 6c 6f 57 6f 72 6c 64 48 65 6c 6c 6f 57 6f 72 6c 64 48 65 6c 6c 6f 57 6f 72 6c 64 48 65 6c 6c 6f 57 6f 72 6c 64 48 65 6c 6c 6f 57 6f 72 6c 64 48 65 6c 6c 6f 57 6f 72 6c 64 48 65 6c 6c 6f 57 6f 72 6c 64 48 65 6c 6c 6f 57 6f 72 6c 64 48 65 6c 6c 6f 57 6f 72 6c 64 48 65 6c 6c 6f 57 6f 72 6c 64 48 65 6c 6c 6f 57 6f 72 6c 64 48 65 6c 6c 6f 57 6f 72 6c 64 48 65 6c 6c 6f 57 6f 72 6c 64 48 65 6c 6c 6f 57 6f 72 6c 64 48 65 6c 6c 6f 57 6f 72 6c 64 48 65 6c 6c 6f 57 6f 72 6c 64 48 65 6c 6c 6f 57 6f 72 6c 64 48 65 6c 6c 6f 57 6f 72 6c 64 48 65 6c 6c 6f 57 6f 72 6c 64 48 65 6c 6c 6f 57 6f 72 6c 64 48 65 6c 6c 6f 57 6f 72 6c 64 48 65 6c 6c 6f 57 6f 72"
3616353-3616372 spiflash: field: "Command: Read data (READ)" "Command: Read data" "Cmd: Read data" "Cmd: READ" "READ"
3616373-3616394 spiflash: bit: "Address bits 23..16: 0x11" "Addr bits 23..16: 0x11" "Addr bits 23..16" "A23..A16"
3616394-3616415 spiflash: bit: "Address bits 15..8: 0xc4" "Addr bits 15..8: 0xc4" "Addr bits 15..8" "A15..A8"
3616415-3616436 spiflash: bit: "Address bits 7..0: 0x00" "Addr bits 7..0: 0x00" "Addr bits 7..0" "A7..A0"
3616373-3616436 spiflash: field: "Address: 0x11c400" "Addr: 0x11c400" "0x11c400"
3616440-3621773 spiflash: field: "Data (256 bytes)"
3616353-3665708 spiflash: read: "Read data (addr 0x11c400, 256 bytes): 6c 64 48 65 6c 6c 6f 57 6f 72 6c 64 48 65 6c 6c 6f 57 6f 72 6c 64 48 65 6c 6c 6f 57 6f 72 6c 64 48 65 6c 6c 6f 57 6f 72 6c 64 48 65 6c 6c 6f 57 6f 72 6c 64 48 65 6c 6c 6f 57 6f 72 6c 64 48 65 6c 6c 6f 57 6f 72 6c 64 48 65 6c 6c 6f 57 6f 72 6c 64 48 65 6c 6c 6f 57 6f 72 6c 64 48 65 6c 6c 6f 57 6f 72 6c 64 48 65 6c 6c 6f 57 6f 72 6c 64 48 65 6c 6c 6f 57 6f 72 6c 64 48 65 6c 6c 6f 57 6f 72 6c 64 48 65 6c 6c 6f 57 6f 72 6c 64 48 65 6c 6c 6f 57 6f 72 6c 64 48 65 6c 6c 6f 57 6f 72 6c 64 48 65 6c 6c 6f 57 6f 72 6c 64 48 65 6c 6c 6f 57 6f 72 6c 64 48 65 6c 6c 6f 57 6f 72 6c 64 48 65 6c 6c 6f 57 6f 72 6c 64 48 65 6c 6c 6f 57 6f 72 6c 64 48 65 6c 6c 6f 57 6f 72 6c 64 48 65 6c 6c 6f 57 6f 72 6c 64 48 65 6c 6c 6f 57 6f 72 6c 64 48 65 6c 6c 6f 57 6f 72 6c 64 48 65 6c 6c"
3668040-3668061 spiflash: field: "Command: Read data (READ)" "Command: Read data" "Cmd: Read data" "Cmd: READ" "READ"
3668061-3668080 spiflash: bit: "Address bits 23..16: 0x11" "Addr bits 23..16: 0x11" "Addr bits 23..16" "A23..A16"
3668082-3668101 spiflash: bit: "Address bits 15..8: 0xc5" "Addr bits 15..8: 0xc5" "Addr bits 15..8" "A15..A8"
3668103-3668122 spiflash: bit: "Address bits 7..0: 0x00" "Addr bits 7..0: 0x00" "Addr bits 7..0" "A7..A0"
3668061-3668122 spiflash: field: "Address: 0x11c500" "Addr: 0x11c500" "0x11c500"
3668128-3673461 spiflash: field: "Data (256 bytes)"
3668040-3715413 spiflash: read: "Read data (addr 0x11c500, 256 bytes): 6f 57 6f 72 6c 64 48 65 6c 6c 6f 57 6f 72 6c 64 48 65 6c 6c 6f 57 6f 72 6c 64 48 65 6c 6c 6f 57 6f 72 6c 64 48 65 6c 6c 6f 57 6f 72 6c 64 48 65 6c 6c 6f 57 6f 72 6c 64 48 65 6c 6c 6f 57 6f 72 6c 64 48 65 6c 6c 6f 57 6f 72 6c 64 48 65 6c 6c 6f 57 6f 72 6c 64 48 65 6c 6c 6f 57 6f 72 6c 64 48 65 6c 6c 6f 57 6f 72 6c 64 48 65 6c 6c 6f 57 6f 72 6c 64 48 65 6c 6c 6f 57 6f 72 6c 64 48 65 6c 6c 6f 57 6f 72 6c 64 48 65 6c 6c 6f 57 6f 72 6c 64 48 65 6c 6c 6f 57 6f 72 6c 64 48 65 6c 6c 6f 57 6f 72 6c 64 48 65 6c 6c 6f 57 6f 72 6c 64 48 65 6c 6c 6f 57 6f 72 6c 64 48 65 6c 6c 6f 57 6f 72 6c 64 48 65 6c 6c 6f 57 6f 72 6c 64 48 65 6c 6c 6f 57 6f 72 6c 64 48 65 6c 6c 6f 57 6f 72 6c 64 48 65 6c 6c 6f 57 6f 72 6c 64 48 65 6c 6c 6f 57 6f 72 6c 64 48 65 6c 6c 6f 57 6f 72 6c 64"
3719365-3719384 spiflash: field: "Command: Read data (READ)" "Command: Read data" "Cmd: Read data" "Cmd: READ" "READ"
3719386-3719405 spiflash: bit: "Address bits 23..16: 0x11" "Addr bits 23..16: 0x11" "Addr bits 23..16" "A23..A16"
3719406-3719427 spiflash: bit: "Address bits 15..8: 0xc6" "Addr bits 15..8: 0xc6" "Addr bits 15..8" "A15..A8"
3719427-3719448 spiflash: bit: "Address bits 7..0: 0x00" "Addr bits 7..0: 0x00" "Addr bits 7..0" "A7..A0"
3719386-3719448 spiflash: field: "Address: 0x11c600" "Addr: 0x11c600" "0x11c600"
3719452-3724784 spiflash: field: "Data (256 bytes)"
3719365-3765688 spiflash: read: "Read data (addr 0x11c600, 256 bytes): 48 65 6c 6c 6f 57 6f 72 6c 64 48 65 6c 6c 6f 57 6f 72 6c 64 48 65 6c 6c 6f 57 6f 72 6c 64 48 65 6c 6c 6f 57 6f 72 6c 64 48 65 6c 6c 6f 57 6f 72 6c 64 48 65 6c 6c 6f 57 6f 72 6c 64 48 65 6c 6c 6f 57 6f 72 6c 64 48 65 6c 6c 6f 57 6f 72 6c 64 48 65 6c 6c 6f 57 6f 72 6c 64 48 65 6c 6c 6f 57 6f 72 6c 64 48 65 6c 6c 6f 57 6f 72 6c 64 48 65 6c 6c 6f 57 6f 72 6c 64 48 65 6c 6c 6f 57 6f 72 6c 64 48 65 6c 6c 6f 57 6f 72 6c 64 48 65 6c 6c 6f 57 6f 72 6c 64 48 65 6c 6c 6f 57 6f 72 6c 64 48 65 6c 6c 6f 57 6f 72 6c 64 48 65 6c 6c 6f 57 6f 72 6c 64 48 65 6c 6c 6f 57 6f 72 6c 64 48 65 6c 6c 6f 57 6f 72 6c 64 48 65 6c 6c 6f 57 6f 72 6c 64 48 65 6c 6c 6f 57 6f 72 6c 64 48 65 6c 6c 6f 57 6f 72 6c 64 48 65 6c 6c 6f 57 6f 72 6c 64 48 65 6c 6c 6f 57 6f 72 6c 64 48 65 6c 6c 6f 57"
3768034-3768055 spiflash: field: "Command: Read data (READ)" "Command: Read data" "Cmd: Read data" "Cmd: READ" "READ"
3768055-3768074 spiflash: bit: "Address bits 23..16: 0x11" "Addr bits 23..16: 0x11" "Addr bits 23..16" "A23..A16"
3768076-3768095 spiflash: bit: "Address bits 15..8: 0xc7" "Addr bits 15..8: 0xc7" "Addr bits 15..8" "A15..A8"
3768097-3768116 spiflash: bit: "Address bits 7..0: 0x00" "Addr bits 7..0: 0x00" "Addr bits 7..0" "A7..A0"
3768055-3768116 spiflash: field: "Address: 0x11c700" "Addr: 0x11c700" "0x11c700"
3768122-3773453 spiflash: field: "Data (256 bytes)"
3768034-3815404 spiflash: read: "Read data (addr 0x11c700, 256 bytes): 6f 72 6c 64 48 65 6c 6c 6f 57 6f 72 6c 64 48 65 6c 6c 6f 57 6f 72 6c 64 48 65 6c 6c 6f 57 6f 72 6c 64 48 65 6c 6c 6f 57 6f 72 6c 64 48 65 6c 6c 6f 57 6f 72 6c 64 48 65 6c 6c 6f 57 6f 72 6c 64 48 65 6c 6c 6f 57 6f 72 6c 64 48 65 6c 6c 6f 57 6f 72 6c 64 48 65 6c 6c 6f 57 6f 72 6c 64 48 65 6c 6c 6f 57 6f 72 6c 64 48 65 6c 6c 6f 57 6f 72 6c 64 48 65 6c 6c 6f 57 6f 72 6c 64 48 65 6c 6c 6f 57 6f 72 6c 64 48 65 6c 6c 6f 57 6f 72 6c 64 48 65 6c 6c 6f 57 6f 72 6c 64 48 65 6c 6c 6f 57 6f 72 6c 64 48 65 6c 6c 6f 57 6f 72 6c 64 48 65 6c 6c 6f 57 6f 72 6c 64 48 65 6c 6c 6f 57 6f 72 6c 64 48 65 6c 6c 6f 57 6f 72 6c 64 48 65 6c 6c 6f 57 6f 72 6c 64 48 65 6c 6c 6f 57 6f 72 6c 64 48 65 6c 6c 6f 57 6f 72 6c 64 48 65 6c 6c 6f 57 6f 72 6c 64 48 65 6c 6c 6f 57 6f 72 6c 64 48 65"
3819467-3819488 spiflash: field: "Command: Read data (READ)" "Command: Read data" "Cmd: Read data" "Cmd: READ" "READ"
3819488-3819507 spiflash: bit: "Address bits 23..16: 0x11" "Addr bits 23..16: 0x11" "Addr bits 23..16" "A23..A16"
3819509-3819528 spiflash: bit: "Address bits 15..8: 0xc8" "Addr bits 15..8: 0xc8" "Addr bits 15..8" "A15..A8"
3819530-3819549 spiflash: bit: "Address bits 7..0: 0x00" "Addr bits 7..0: 0x00" "Addr bits 7..0" "A7..A0"
3819488-3819549 spiflash: field: "Address: 0x11c800" "Addr: 0x11c800" "0x11c800"
3819555-3824886 spiflash: field: "Data (256 bytes)"
3819467-3865674 spiflash: read: "Read data (addr 0x11c800, 256 bytes): 6c 6c 6f 57 6f 72 6c 64 48 65 6c 6c 6f 57 6f 72 6c 64 48 65 6c 6c 6f 57 6f 72 6c 64 48 65 6c 6c 6f 57 6f 72 6c 64 48 65 6c 6c 6f 57 6f 72 6c 64 48 65 6c 6c 6f 57 6f 72 6c 64 48 65 6c 6c 6f 57 6f 72 6c 64 48 65 6c 6c 6f 57 6f 72 6c 64 48 65 6c 6c 6f 57 6f 72 6c 64 48 65 6c 6c 6f 57 6f 72 6c 64 48 65 6c 6c 6f 57 6f 72 6c 64 48 65 6c 6c 6f 57 6f 72 6c 64 48 65 6c 6c 6f 57 6f 72 6c 64 48 65 6c 6c 6f 57 6f 72 6c 64 48 65 6c 6c 6f 57 6f 72 6c 64 48 65 6c 6c 6f 57 6f 72 6c 64 48 65 6c 6c 6f 57 6f 72 6c 64 48 65 6c 6c 6f 57 6f 72 6c 64 48 65 6c 6c 6f 57 6f 72 6c 64 48 65 6c 6c 6f 57 6f 72 6c 64 48 65 6c 6c 6f 57 6f 72 6c 64 48 65 6c 6c 6f 57 6f 72 6c 64 48 65 6c 6c 6f 57 6f 72 6c 64 48 65 6c 6c 6f 57 6f 72 6c 64 48 65 6c 6c 6f 57 6f 72 6c 64 48 65 6c 6c 6f 57 6f 72"
3868006-3868027 spiflash: field: "Command: Read data (READ)" "Command: Read data" "Cmd: Read data" "Cmd: READ" "READ"
3868027-3868048 spiflash: bit: "Address bits 23..16: 0x11" "Addr bits 23..16: 0x11" "Addr bits 23..16" "A23..A16"
3868048-3868069 spiflash: bit: "Address bits 15..8: 0xc9" "Addr bits 15..8: 0xc9" "Addr bits 15..8" "A15..A8"
3868069-3868088 spiflash: bit: "Address bits 7..0: 0x00" "Addr bits 7..0: 0x00" "Addr bits 7..0" "A7..A0"
3868027-3868088 spiflash: field: "Address: 0x11c900" "Addr: 0x11c900" "0x11c900"
3868094-3873427 spiflash: field: "Data (256 bytes)"
3868006-3915391 spiflash: read: "Read data (addr 0x11c900, 256 bytes): 6c 64 48 65 6c 6c 6f 57 6f 72 6c 64 48 65 6c 6c 6f 57 6f 72 6c 64 48 65 6c 6c 6f 57 6f 72 6c 64 48 65 6c 6c 6f 57 6f 72 6c 64 48 65 6c 6c 6f 57 6f 72 6c 64 48 65 6c 6c 6f 57 6f 72 6c 64 48 65 6c 6c 6f 57 6f 72 6c 64 48 65 6c 6c 6f 57 6f 72 6c 64 48 65 6c 6c 6f 57 6f 72 6c 64 48 65 6c 6c 6f 57 6f 72 6c 64 48 65 6c 6c 6f 57 6f 72 6c 64 48 65 6c 6c 6f 57 6f 72 6c 64 48 65 6c 6c 6f 57 6f 72 6c 64 48 65 6c 6c 6f 57 6f 72 6c 64 48 65 6c 6c 6f 57 6f 72 6c 64 48 65 6c 6c 6f 57 6f 72 6c 64 48 65 6c 6c 6f 57 6f 72 6c 64 48 65 6c 6c 6f 57 6f 72 6c 64 48 65 6c 6c 6f 57 6f 72 6c 64 48 65 6c 6c 6f 57 6f 72 6c 64 48 65 6c 6c 6f 57 6f 72 6c 64 48 65 6c 6c 6f 57 6f 72 6c 64 48 65 6c 6c 6f 57 6f 72 6c 64 48 65 6c 6c 6f 57 6f 72 6c 64 48 65 6c 6c 6f 57 6f 72 6c 64 48 65 6c 6c"
3919342-3919361 spiflash: field: "Command: Read data (READ)" "Command: Read data" "Cmd: Read data" "Cmd: READ" "READ"
3919363-3919382 spiflash: bit: "Address bits 23..16: 0x11" "Addr bits 23..16: 0x11" "Addr bits 23..16" "A23..A16"
3919384-3919403 spiflash: bit: "Address bits 15..8: 0xca" "Addr bits 15..8: 0xca" "Addr bits 15..8" "A15..A8"
3919404-3919425 spiflash: bit: "Address bits 7..0: 0x00" "Addr bits 7..0: 0x00" "Addr bits 7..0" "A7..A0"
3919363-3919425 spiflash: field: "Address: 0x11ca00" "Addr: 0x11ca00" "0x11ca00"
3919429-3924761 spiflash: field: "Data (256 bytes)"
3919342-3965656 spiflash: read: "Read data (addr 0x11ca00, 256 bytes): 6f 57 6f 72 6c 64 48 65 6c 6c 6f 57 6f 72 6c 64 48 65 6c 6c 6f 57 6f 72 6c 64 48 65 6c 6c 6f 57 6f 72 6c 64 48 65 6c 6c 6f 57 6f 72 6c 64 48 65 6c 6c 6f 57 6f 72 6c 64 48 65 6c 6c 6f 57 6f 72 6c 64 48 65 6c 6c 6f 57 6f 72 6c 64 48 65 6c 6c 6f 57 6f 72 6c 64 48 65 6c 6c 6f 57 6f 72 6c 64 48 65 6c 6c 6f 57 6f 72 6c 64 48 65 6c 6c 6f 57 6f 72 6c 64 48 65 6c 6c 6f 57 6f 72 6c 64 48 65 6c 6c 6f 57 6f 72 6c 64 48 65 6c 6c 6f 57 6f 72 6c 64 48 65 6c 6c 6f 57 6f 72 6c 64 48 65 6c 6c 6f 57 6f 72 6c 64 48 65 6c 6c 6f 57 6f 72 6c 64 48 65 6c 6c 6f 57 6f 72 6c 64 48 65 6c 6c 6f 57 6f 72 6c 64 48 65 6c 6c 6f 57 6f 72 6c 64 48 65 6c 6c 6f 57 6f 72 6c 64 48 65 6c 6c 6f 57 6f 72 6c 64 48 65 6c 6c 6f 57 6f 72 6c 64 48 65 6c 6c 6f 57 6f 72 6c 64 48 65 6c 6c 6f 57 6f 72 6c 64"
3967992-3968013 spiflash: field: "Command: Read data (READ)" "Command: Read data" "Cmd: Read data" "Cmd: READ" "READ"
3968013-3968032 spiflash: bit: "Address bits 23..16: 0x11" "Addr bits 23..16: 0x11" "Addr bits 23..16" "A23..A16"
3968034-3968053 spiflash: bit: "Address bits 15..8: 0xcb" "Addr bits 15..8: 0xcb" "Addr bits 15..8" "A15..A8"
3968055-3968074 spiflash: bit: "Address bits 7..0: 0x00" "Addr bits 7..0: 0x00" "Addr bits 7..0" "A7..A0"
3968013-3968074 spiflash: field: "Address: 0x11cb00" "Addr: 0x11cb00" "0x11cb00"
3968080-3973411 spiflash: field: "Data (256 bytes)"
3967992-4015382 spiflash: read: "Read data (addr 0x11cb00, 256 bytes): 48 65 6c 6c 6f 57 6f 72 6c 64 48 65 6c 6c 6f 57 6f 72 6c 64 48 65 6c 6c 6f 57 6f 72 6c 64 48 65 6c 6c 6f 57 6f 72 6c 64 48 65 6c 6c 6f 57 6f 72 6c 64 48 65 6c 6c 6f 57 6f 72 6c 64 48 65 6c 6c 6f 57 6f 72 6c 64 48 65 6c 6c 6f 57 6f 72 6c 64 48 65 6c 6c 6f 57 6f 72 6c 64 48 65 6c 6c 6f 57 6f 72 6c 64 48 65 6c 6c 6f 57 6f 72 6c 64 48 65 6c 6c 6f 57 6f 72 6c 64 48 65 6c 6c 6f 57 6f 72 6c 64 48 65 6c 6c 6f 57 6f 72 6c 64 48 65 6c 6c 6f 57 6f 72 6c 64 48 65 6c 6c 6f 57 6f 72 6c 64 48 65 6c 6c 6f 57 6f 72 6c 64 48 65 6c 6c 6f 57 6f 72 6c 64 48 65 6c 6c 6f 57 6f 72 6c 64 48 65 6c 6c 6f 57 6f 72 6c 64 48 65 6c 6c 6f 57 6f 72 6c 64 48 65 6c 6c 6f 57 6f 72 6c 64 48 65 6c 6c 6f 57 6f 72 6c 64 48 65 6c 6c 6f 57 6f 72 6c 64 48 65 6c 6c 6f 57 6f 72 6c 64 48 65 6c 6c 6f 57"
4019458-4019479 spiflash: field: "Command: Read data (READ)" "Command: Read data" "Cmd: Read data" "Cmd: READ" "READ"
4019479-4019500 spiflash: bit: "Address bits 23..16: 0x11" "Addr bits 23..16: 0x11" "Addr bits 23..16" "A23..A16"
4019500-4019521 spiflash: bit: "Address bits 15..8: 0xcc" "Addr bits 15..8: 0xcc" "Addr bits 15..8" "A15..A8"
4019521-4019540 spiflash: bit: "Address bits 7..0: 0x00" "Addr bits 7..0: 0x00" "Addr bits 7..0" "A7..A0"
4019479-4019540 spiflash: field: "Address: 0x11cc00" "Addr: 0x11cc00" "0x11cc00"
4019546-4024879 spiflash: field: "Data (256 bytes)"
4019458-4065655 spiflash: read: "Read data (addr 0x11cc00, 256 bytes): 6f 72 6c 64 48 65 6c 6c 6f 57 6f 72 6c 64 48 65 6c 6c 6f 57 6f 72 6c 64 48 65 6c 6c 6f 57 6f 72 6c 64 48 65 6c 6c 6f 57 6f 72 6c 64 48 65 6c 6c 6f 57 6f 72 6c 64 48 65 6c 6c 6f 57 6f 72 6c 64 48 65 6c 6c 6f 57 6f 72 6c 64 48 65 6c 6c 6f 57 6f 72 6c 64 48 65 6c 6c 6f 57 6f 72 6c 64 48 65 6c 6c 6f 57 6f 72 6c 64 48 65 6c 6c 6f 57 6f 72 6c 64 48 65 6c 6c 6f 57 6f 72 6c 64 48 65 6c 6c 6f 57 6f 72 6c 64 48 65 6c 6c 6f 57 6f 72 6c 64 48 65 6c 6c 6f 57 6f 72 6c 64 48 65 6c 6c 6f 57 6f 72 6c 64 48 65 6c 6c 6f 57 6f 72 6c 64 48 65 6c 6c 6f 57 6f 72 6c 64 48 65 6c 6c 6f 57 6f 72 6c 64 48 65 6c 6c 6f 57 6f 72 6c 64 48 65 6c 6c 6f 57 6f 72 6c 64 48 65 6c 6c 6f 57 6f 72 6c 64 48 65 6c 6c 6f 57 6f 72 6c 64 48 65 6c 6c 6f 57 6f 72 6c 64 48 65 6c 6c 6f 57 6f 72 6c 64 48 65"
4069424-4069443 spiflash: field: "Command: Read data (READ)" "Command: Read data" "Cmd: Read data" "Cmd: READ" "READ"
4069445-4069464 spiflash: bit: "Address bits 23..16: 0x11" "Addr bits 23..16: 0x11" "Addr bits 23..16" "A23..A16"
4069466-4069485 spiflash: bit: "Address bits 15..8: 0xcd" "Addr bits 15..8: 0xcd" "Addr bits 15..8" "A15..A8"
4069486-4069507 spiflash: bit: "Address bits 7..0: 0x00" "Addr bits 7..0: 0x00" "Addr bits 7..0" "A7..A0"
4069445-4069507 spiflash: field: "Address: 0x11cd00" "Addr: 0x11cd00" "0x11cd00"
4069511-4074843 spiflash: field: "Data (256 bytes)"
4069424-4115367 spiflash: read: "Read data (addr 0x11cd00, 256 bytes): 6c 6c 6f 57 6f 72 6c 64 48 65 6c 6c 6f 57 6f 72 6c 64 48 65 6c 6c 6f 57 6f 72 6c 64 48 65 6c 6c 6f 57 6f 72 6c 64 48 65 6c 6c 6f 57 6f 72 6c 64 48 65 6c 6c 6f 57 6f 72 6c 64 48 65 6c 6c 6f 57 6f 72 6c 64 48 65 6c 6c 6f 57 6f 72 6c 64 48 65 6c 6c 6f 57 6f 72 6c 64 48 65 6c 6c 6f 57 6f 72 6c 64 48 65 6c 6c 6f 57 6f 72 6c 64 48 65 6c 6c 6f 57 6f 72 6c 64 48 65 6c 6c 6f 57 6f 72 6c 64 48 65 6c 6c 6f 57 6f 72 6c 64 48 65 6c 6c 6f 57 6f 72 6c 64 48 65 6c 6c 6f 57 6f 72 6c 64 48 65 6c 6c 6f 57 6f 72 6c 64 48 65 6c 6c 6f 57 6f 72 6c 64 48 65 6c 6c 6f 57 6f 72 6c 64 48 65 6c 6c 6f 57 6f 72 6c 64 48 65 6c 6c 6f 57 6f 72 6c 64 48 65 6c 6c 6f 57 6f 72 6c 64 48 65 6c 6c 6f 57 6f 72 6c 64 48 65 6c 6c 6f 57 6f 72 6c 64 48 65 6c 6c 6f 57 6f 72 6c 64 48 65 6c 6c 6f 57 6f 72"
4119444-4119465 spiflash: field: "Command: Read data (READ)" "Command: Read data" "Cmd: Read data" "Cmd: READ" "READ"
4119465-4119486 spiflash: bit: "Address bits 23..16: 0x11" "Addr bits 23..16: 0x11" "Addr bits 23..16" "A23..A16"
4119486-4119507 spiflash: bit: "Address bits 15..8: 0xce" "Addr bits 15..8: 0xce" "Addr bits 15..8" "A15..A8"
4119507-4119526 spiflash: bit: "Address bits 7..0: 0x00" "Addr bits 7..0: 0x00" "Addr bits 7..0" "A7..A0"
4119465-4119526 spiflash: field: "Address: 0x11ce00" "Addr: 0x11ce00" "0x11ce00"
4119532-4124865 spiflash: field: "Data (256 bytes)"
4119444-4169010 spiflash: read: "Read data (addr 0x11ce00, 256 bytes): 6c 64 48 65 6c 6c 6f 57 6f 72 6c 64 48 65 6c 6c 6f 57 6f 72 6c 64 48 65 6c 6c 6f 57 6f 72 6c 64 48 65 6c 6c 6f 57 6f 72 6c 64 48 65 6c 6c 6f 57 6f 72 6c 64 48 65 6c 6c 6f 57 6f 72 6c 64 48 65 6c 6c 6f 57 6f 72 6c 64 48 65 6c 6c 6f 57 6f 72 6c 64 48 65 6c 6c 6f 57 6f 72 6c 64 48 65 6c 6c 6f 57 6f 72 6c 64 48 65 6c 6c 6f 57 6f 72 6c 64 48 65 6c 6c 6f 57 6f 72 6c 64 48 65 6c 6c 6f 57 6f 72 6c 64 48 65 6c 6c 6f 57 6f 72 6c 64 48 65 6c 6c 6f 57 6f 72 6c 64 48 65 6c 6c 6f 57 6f 72 6c 64 48 65 6c 6c 6f 57 6f 72 6c 64 48 65 6c 6c 6f 57 6f 72 6c 64 48 65 6c 6c 6f 57 6f 72 6c 64 48 65 6c 6c 6f 57 6f 72 6c 64 48 65 6c 6c 6f 57 6f 72 6c 64 48 65 6c 6c 6f 57 6f 72 6c 64 48 65 6c 6c 6f 57 6f 72 6c 64 48 65 6c 6c 6f 57 6f 72 6c 64 48 65 6c 6c 6f 57 6f 72 6c 64 48 65 6c 6c"
4171382-4171403 spiflash: field: "Command: Read data (READ)" "Command: Read data" "Cmd: Read data" "Cmd: READ" "READ"
4171403-4171424 spiflash: bit: "Address bits 23..16: 0x11" "Addr bits 23..16: 0x11" "Addr bits 23..16" "A23..A16"
4171424-4171445 spiflash: bit: "Address bits 15..8: 0xcf" "Addr bits 15..8: 0xcf" "Addr bits 15..8" "A15..A8"
4171445-4171464 spiflash: bit: "Address bits 7..0: 0x00" "Addr bits 7..0: 0x00" "Addr bits 7..0" "A7..A0"
4171403-4171464 spiflash: field: "Address: 0x11cf00" "Addr: 0x11cf00" "0x11cf00"
4171470-4176803 spiflash: field: "Data (256 bytes)"
4171382-4215741 spiflash: read: "Read data (addr 0x11cf00, 256 bytes): 6f 57 6f 72 6c 64 48 65 6c 6c 6f 57 6f 72 6c 64 48 65 6c 6c 6f 57 6f 72 6c 64 48 65 6c 6c 6f 57 6f 72 6c 64 48 65 6c 6c 6f 57 6f 72 6c 64 48 65 6c 6c 6f 57 6f 72 6c 64 48 65 6c 6c 6f 57 6f 72 6c 64 48 65 6c 6c 6f 57 6f 72 6c 64 48 65 6c 6c 6f 57 6f 72 6c 64 48 65 6c 6c 6f 57 6f 72 6c 64 48 65 6c 6c 6f 57 6f 72 6c 64 48 65 6c 6c 6f 57 6f 72 6c 64 48 65 6c 6c 6f 57 6f 72 6c 64 48 65 6c 6c 6f 57 6f 72 6c 64 48 65 6c 6c 6f 57 6f 72 6c 64 48 65 6c 6c 6f 57 6f 72 6c 64 48 65 6c 6c 6f 57 6f 72 6c 64 48 65 6c 6c 6f 57 6f 72 6c 64 48 65 6c 6c 6f 57 6f 72 6c 64 48 65 6c 6c 6f 57 6f 72 6c 64 48 65 6c 6c 6f 57 6f 72 6c 64 48 65 6c 6c 6f 57 6f 72 6c 64 48 65 6c 6c 6f 57 6f 72 6c 64 48 65 6c 6c 6f 57 6f 72 6c 64 48 65 6c 6c 6f 57 6f 72 6c 64 48 65 6c 6c 6f 57 6f 72 6c 64"
4217966-4217985 spiflash: field: "Command: Read data (READ)" "Command: Read data" "Cmd: Read data" "Cmd: READ" "READ"
4217987-4218006 spiflash: bit: "Address bits 23..16: 0x11" "Addr bits 23..16: 0x11" "Addr bits 23..16" "A23..A16"
4218008-4218027 spiflash: bit: "Address bits 15..8: 0xd0" "Addr bits 15..8: 0xd0" "Addr bits 15..8" "A15..A8"
4218028-4218049 spiflash: bit: "Address bits 7..0: 0x00" "Addr bits 7..0: 0x00" "Addr bits 7..0" "A7..A0"
4217987-4218049 spiflash: field: "Address: 0x11d000" "Addr: 0x11d000" "0x11d000"
4218053-4223385 spiflash: field: "Data (256 bytes)"
4217966-4265621 spiflash: read: "Read data (addr 0x11d000, 256 bytes): 48 65 6c 6c 6f 57 6f 72 6c 64 48 65 6c 6c 6f 57 6f 72 6c 64 48 65 6c 6c 6f 57 6f 72 6c 64 48 65 6c 6c 6f 57 6f 72 6c 64 48 65 6c 6c 6f 57 6f 72 6c 64 48 65 6c 6c 6f 57 6f 72 6c 64 48 65 6c 6c 6f 57 6f 72 6c 64 48 65 6c 6c 6f 57 6f 72 6c 64 48 65 6c 6c 6f 57 6f 72 6c 64 48 65 6c 6c 6f 57 6f 72 6c 64 48 65 6c 6c 6f 57 6f 72 6c 64 48 65 6c 6c 6f 57 6f 72 6c 64 48 65 6c 6c 6f 57 6f 72 6c 64 48 65 6c 6c 6f 57 6f 72 6c 64 48 65 6c 6c 6f 57 6f 72 6c 64 48 65 6c 6c 6f 57 6f 72 6c 64 48 65 6c 6c 6f 57 6f 72 6c 64 48 65 6c 6c 6f 57 6f 72 6c 64 48 65 6c 6c 6f 57 6f 72 6c 64 48 65 6c 6c 6f 57 6f 72 6c 64 48 65 6c 6c 6f 57 6f 72 6c 64 48 65 6c 6c 6f 57 6f 72 6c 64 48 65 6c 6c 6f 57 6f 72 6c 64 48 65 6c 6c 6f 57 6f 72 6c 64 48 65 6c 6c 6f 57 6f 72 6c 64 48 65 6c 6c 6f 57"
4267956-4267975 spiflash: field: "Command: Read data (READ)" "Command: Read data" "Cmd: Read data" "Cmd: READ" "READ"
4267976-4267997 spiflash: bit: "Address bits 23..16: 0x11" "Addr bits 23..16: 0x11" "Addr bits 23..16" "A23..A16"
4267997-4268018 spiflash: bit: "Address bits 15..8: 0xd1" "Addr bits 15..8: 0xd1" "Addr bits 15..8" "A15..A8"
4268018-4268039 spiflash: bit: "Address bits 7..0: 0x00" "Addr bits 7..0: 0x00" "Addr bits 7..0" "A7..A0"
4267976-4268039 spiflash: field: "Address: 0x11d100" "Addr: 0x11d100" "0x11d100"
4268043-4273376 spiflash: field: "Data (256 bytes)"
4267956-4315334 spiflash: read: "Read data (addr 0x11d100, 256 bytes): 6f 72 6c 64 48 65 6c 6c 6f 57 6f 72 6c 64 48 65 6c 6c 6f 57 6f 72 6c 64 48 65 6c 6c 6f 57 6f 72 6c 64 48 65 6c 6c 6f 57 6f 72 6c 64 48 65 6c 6c 6f 57 6f 72 6c 64 48 65 6c 6c 6f 57 6f 72 6c 64 48 65 6c 6c 6f 57 6f 72 6c 64 48 65 6c 6c 6f 57 6f 72 6c 64 48 65 6c 6c 6f 57 6f 72 6c 64 48 65 6c 6c 6f 57 6f 72 6c 64 48 65 6c 6c 6f 57 6f 72 6c 64 48 65 6c 6c 6f 57 6f 72 6c 64 48 65 6c 6c 6f 57 6f 72 6c 64 48 65 6c 6c 6f 57 6f 72 6c 64 48 65 6c 6c 6f 57 6f 72 6c 64 48 65 6c 6c 6f 57 6f 72 6c 64 48 65 6c 6c 6f 57 6f 72 6c 64 48 65 6c 6c 6f 57 6f 72 6c 64 48 65 6c 6c 6f 57 6f 72 6c 64 48 65 6c 6c 6f 57 6f 72 6c 64 48 65 6c 6c 6f 57 6f 72 6c 64 48 65 6c 6c 6f 57 6f 72 6c 64 48 65 6c 6c 6f 57 6f 72 6c 64 48 65 6c 6c 6f 57 6f 72 6c 64 48 65 6c 6c 6f 57 6f 72 6c 64 48 65"
4319392-4319411 spiflash: field: "Command: Read data (READ)" "Command: Read data" "Cmd: Read data" "Cmd: READ" "READ"
4319413-4319432 spiflash: bit: "Address bits 23..16: 0x11" "Addr bits 23..16: 0x11" "Addr bits 23..16" "A23..A16"
4319434-4319453 spiflash: bit: "Address bits 15..8: 0xd2" "Addr bits 15..8: 0xd2" "Addr bits 15..8" "A15..A8"
4319454-4319475 spiflash: bit: "Address bits 7..0: 0x00" "Addr bits 7..0: 0x00" "Addr bits 7..0" "A7..A0"
4319413-4319475 spiflash: field: "Address: 0x11d200" "Addr: 0x11d200" "0x11d200"
4319479-4324811 spiflash: field: "Data (256 bytes)"
4319392-4365609 spiflash: read: "Read data (addr 0x11d200, 256 bytes): 6c 6c 6f 57 6f 72 6c 64 48 65 6c 6c 6f 57 6f 72 6c 64 48 65 6c 6c 6f 57 6f 72 6c 64 48 65 6c 6c 6f 57 6f 72 6c 64 48 65 6c 6c 6f 57 6f 72 6c 64 48 65 6c 6c 6f 57 6f 72 6c 64 48 65 6c 6c 6f 57 6f 72 6c 64 48 65 6c 6c 6f 57 6f 72 6c 64 48 65 6c 6c 6f 57 6f 72 6c 64 48 65 6c 6c 6f 57 6f 72 6c 64 48 65 6c 6c 6f 57 6f 72 6c 64 48 65 6c 6c 6f 57 6f 72 6c 64 48 65 6c 6c 6f 57 6f 72 6c 64 48 65 6c 6c 6f 57 6f 72 6c 64 48 65 6c 6c 6f 57 6f 72 6c 64 48 65 6c 6c 6f 57 6f 72 6c 64 48 65 6c 6c 6f 57 6f 72 6c 64 48 65 6c 6c 6f 57 6f 72 6c 64 48 65 6c 6c 6f 57 6f 72 6c 64 48 65 6c 6c 6f 57 6f 72 6c 64 48 65 6c 6c 6f 57 6f 72 6c 64 48 65 6c 6c 6f 57 6f 72 6c 64 48 65 6c 6c 6f 57 6f 72 6c 64 48 65 6c 6c 6f 57 6f 72 6c 64 48 65 6c 6c 6f 57 6f 72 6c 64 48 65 6c 6c 6f 57 6f 72"
4369396-4369415 spiflash: field: "Command: Read data (READ)" "Command: Read data" "Cmd: Read data" "Cmd: READ" "READ"
4369417-4369436 spiflash: bit: "Address bits 23..16: 0x11" "Addr bits 23..16: 0x11" "Addr bits 23..16" "A23..A16"
4369437-4369458 spiflash: bit: "Address bits 15..8: 0xd3" "Addr bits 15..8: 0xd3" "Addr bits 15..8" "A15..A8"
4369458-4369479 spiflash: bit: "Address bits 7..0: 0x00" "Addr bits 7..0: 0x00" "Addr bits 7..0" "A7..A0"
4369417-4369479 spiflash: field: "Address: 0x11d300" "Addr: 0x11d300" "0x11d300"
4369483-4374815 spiflash: field: "Data (256 bytes)"
4369396-4415597 spiflash: read: "Read data (addr 0x11d300, 256 bytes): 6c 64 48 65 6c 6c 6f 57 6f 72 6c 64 48 65 6c 6c 6f 57 6f 72 6c 64 48 65 6c 6c 6f 57 6f 72 6c 64 48 65 6c 6c 6f 57 6f 72 6c 64 48 65 6c 6c 6f 57 6f 72 6c 64 48 65 6c 6c 6f 57 6f 72 6c 64 48 65 6c 6c 6f 57 6f 72 6c 64 48 65 6c 6c 6f 57 6f 72 6c 64 48 65 6c 6c 6f 57 6f 72 6c 64 48 65 6c 6c 6f 57 6f 72 6c 64 48 65 6c 6c 6f 57 6f 72 6c 64 48 65 6c 6c 6f 57 6f 72 6c 64 48 65 6c 6c 6f 57 6f 72 6c 64 48 65 6c 6c 6f 57 6f 72 6c 64 48 65 6c 6c 6f 57 6f 72 6c 64 48 65 6c 6c 6f 57 6f 72 6c 64 48 65 6c 6c 6f 57 6f 72 6c 64 48 65 6c 6c 6f 57 6f 72 6c 64 48 65 6c 6c 6f 57 6f 72 6c 64 48 65 6c 6c 6f 57 6f 72 6c 64 48 65 6c 6c 6f 57 6f 72 6c 64 48 65 6c 6c 6f 57 6f 72 6c 64 48 65 6c 6c 6f 57 6f 72 6c 64 48 65 6c 6c 6f 57 6f 72 6c 64 48 65 6c 6c 6f 57 6f 72 6c 64 48 65 6c 6c"
4419375-4419396 spiflash: field: "Command: Read data (READ)" "Command: Read data" "Cmd: Read data" "Cmd: READ" "READ"
4419396-4419417 spiflash: bit: "Address bits 23..16: 0x11" "Addr bits 23..16: 0x11" "Addr bits 23..16" "A23..A16"
4419417-4419438 spiflash: bit: "Address bits 15..8: 0xd4" "Addr bits 15..8: 0xd4" "Addr bits 15..8" "A15..A8"
4419438-4419457 spiflash: bit: "Address bits 7..0: 0x00" "Addr bits 7..0: 0x00" "Addr bits 7..0" "A7..A0"
4419396-4419457 spiflash: field: "Address: 0x11d400" "Addr: 0x11d400" "0x11d400"
4419463-4424796 spiflash: field: "Data (256 bytes)"
4419375-4465700 spiflash: read: "Read data (addr 0x11d400, 256 bytes): 6f 57 6f 72 6c 64 48 65 6c 6c 6f 57 6f 72 6c 64 48 65 6c 6c 6f 57 6f 72 6c 64 48 65 6c 6c 6f 57 6f 72 6c 64 48 65 6c 6c 6f 57 6f 72 6c 64 48 65 6c 6c 6f 57 6f 72 6c 64 48 65 6c 6c 6f 57 6f 72 6c 64 48 65 6c 6c 6f 57 6f 72 6c 64 48 65 6c 6c 6f 57 6f 72 6c 64 48 65 6c 6c 6f 57 6f 72 6c 64 48 65 6c 6c 6f 57 6f 72 6c 64 48 65 6c 6c 6f 57 6f 72 6c 64 48 65 6c 6c 6f 57 6f 72 6c 64 48 65 6c 6c 6f 57 6f 72 6c 64 48 65 6c 6c 6f 57 6f 72 6c 64 48 65 6c 6c 6f 57 6f 72 6c 64 48 65 6c 6c 6f 57 6f 72 6c 64 48 65 6c 6c 6f 57 6f 72 6c 64 48 65 6c 6c 6f 57 6f 72 6c 64 48 65 6c 6c 6f 57 6f 72 6c 64 48 65 6c 6c 6f 57 6f 72 6c 64 48 65 6c 6c 6f 57 6f 72 6c 64 48 65 6c 6c 6f 57 6f 72 6c 64 48 65 6c 6c 6f 57 6f 72 6c 64 48 65 6c 6c 6f 57 6f 72 6c 64 48 65 6c 6c 6f 57 6f 72 6c 64"
4469361-4469380 spiflash: field: "Command: Read data (READ)" "Command: Read data" "Cmd: Read data" "Cmd: READ" "READ"
4469381-4469402 spiflash: bit: "Address bits 23..16: 0x11" "Addr bits 23..16: 0x11" "Addr bits 23..16" "A23..A16"
4469402-4469423 spiflash: bit: "Address bits 15..8: 0xd5" "Addr bits 15..8: 0xd5" "Addr bits 15..8" "A15..A8"
4469423-4469444 spiflash: bit: "Address bits 7..0: 0x00" "Addr bits 7..0: 0x00" "Addr bits 7..0" "A7..A0"
4469381-4469444 spiflash: field: "Address: 0x11d500" "Addr: 0x11d500" "0x11d500"
4469448-4474781 spiflash: field: "Data (256 bytes)"
4469361-4515312 spiflash: read: "Read data (addr 0x11d500, 256 bytes): 48 65 6c 6c 6f 57 6f 72 6c 64 48 65 6c 6c 6f 57 6f 72 6c 64 48 65 6c 6c 6f 57 6f 72 6c 64 48 65 6c 6c 6f 57 6f 72 6c 64 48 65 6c 6c 6f 57 6f 72 6c 64 48 65 6c 6c 6f 57 6f 72 6c 64 48 65 6c 6c 6f 57 6f 72 6c 64 48 65 6c 6c 6f 57 6f 72 6c 64 48 65 6c 6c 6f 57 6f 72 6c 64 48 65 6c 6c 6f 57 6f 72 6c 64 48 65 6c 6c 6f 57 6f 72 6c 64 48 65 6c 6c 6f 57 6f 72 6c 64 48 65 6c 6c 6f 57 6f 72 6c 64 48 65 6c 6c 6f 57 6f 72 6c 64 48 65 6c 6c 6f 57 6f 72 6c 64 48 65 6c 6c 6f 57 6f 72 6c 64 48 65 6c 6c 6f 57 6f 72 6c 64 48 65 6c 6c 6f 57 6f 72 6c 64 48 65 6c 6c 6f 57 6f 72 6c 64 48 65 6c 6c 6f 57 6f 72 6c 64 48 65 6c 6c 6f 57 6f 72 6c 64 48 65 6c 6c 6f 57 6f 72 6c 64 48 65 6c 6c 6f 57 6f 72 6c 64 48 65 6c 6c 6f 57 6f 72 6c 64 48 65 6c 6c 6f 57 6f 72 6c 64 48 65 6c 6c 6f 57"
4519257-4519276 spiflash: field: "Command: Read data (READ)" "Command: Read data" "Cmd: Read data" "Cmd: READ" "READ"
4519278-4519297 spiflash: bit: "Address bits 23..16: 0x11" "Addr bits 23..16: 0x11" "Addr bits 23..16" "A23..A16"
4519299-4519318 spiflash: bit: "Address bits 15..8: 0xd6" "Addr bits 15..8: 0xd6" "Addr bits 15..8" "A15..A8"
4519319-4519340 spiflash: bit: "Address bits 7..0: 0x00" "Addr bits 7..0: 0x00" "Addr bits 7..0" "A7..A0"
4519278-4519340 spiflash: field: "Address: 0x11d600" "Addr: 0x11d600" "0x11d600"
4519344-4524676 spiflash: field: "Data (256 bytes)"
4519257-4565696 spiflash: read: "Read data (addr 0x11d600, 256 bytes): 6f 72 6c 64 48 65 6c 6c 6f 57 6f 72 6c 64 48 65 6c 6c 6f 57 6f 72 6c 64 48 65 6c 6c 6f 57 6f 72 6c 64 48 65 6c 6c 6f 57 6f 72 6c 64 48 65 6c 6c 6f 57 6f 72 6c 64 48 65 6c 6c 6f 57 6f 72 6c 64 48 65 6c 6c 6f 57 6f 72 6c 64 48 65 6c 6c 6f 57 6f 72 6c 64 48 65 6c 6c 6f 57 6f 72 6c 64 48 65 6c 6c 6f 57 6f 72 6c 64 48 65 6c 6c 6f 57 6f 72 6c 64 48 65 6c 6c 6f 57 6f 72 6c 64 48 65 6c 6c 6f 57 6f 72 6c 64 48 65 6c 6c 6f 57 6f 72 6c 64 48 65 6c 6c 6f 57 6f 72 6c 64 48 65 6c 6c 6f 57 6f 72 6c 64 48 65 6c 6c 6f 57 6f 72 6c 64 48 65 6c 6c 6f 57 6f 72 6c 64 48 65 6c 6c 6f 57 6f 72 6c 64 48 65 6c 6c 6f 57 6f 72 6c 64 48 65 6c 6c 6f 57 6f 72 6c 64 48 65 6c 6c 6f 57 6f 72 6c 64 48 65 6c 6c 6f 57 6f 72 6c 64 48 65 6c 6c 6f 57 6f 72 6c 64 48 65 6c 6c 6f 57 6f 72 6c 64 48 65"
4569357-4569376 spiflash: field: "Command: Read data (READ)" "Command: Read data" "Cmd: Read data" "Cmd: READ" "READ"
4569378-4569397 spiflash: bit: "Address bits 23..16: 0x11" "Addr bits 23..16: 0x11" "Addr bits 23..16" "A23..A16"
4569399-4569418 spiflash: bit: "Address bits 15..8: 0xd7" "Addr bits 15..8: 0xd7" "Addr bits 15..8" "A15..A8"
4569419-4569440 spiflash: bit: "Address bits 7..0: 0x00" "Addr bits 7..0: 0x00" "Addr bits 7..0" "A7..A0"
4569378-4569440 spiflash: field: "Address: 0x11d700" "Addr: 0x11d700" "0x11d700"
4569444-4574776 spiflash: field: "Data (256 bytes)"
4569357-4615288 spiflash: read: "Read data (addr 0x11d700, 256 bytes): 6c 6c 6f 57 6f 72 6c 64 48 65 6c 6c 6f 57 6f 72 6c 64 48 65 6c 6c 6f 57 6f 72 6c 64 48 65 6c 6c 6f 57 6f 72 6c 64 48 65 6c 6c 6f 57 6f 72 6c 64 48 65 6c 6c 6f 57 6f 72 6c 64 48 65 6c 6c 6f 57 6f 72 6c 64 48 65 6c 6c 6f 57 6f 72 6c 64 48 65 6c 6c 6f 57 6f 72 6c 64 48 65 6c 6c 6f 57 6f 72 6c 64 48 65 6c 6c 6f 57 6f 72 6c 64 48 65 6c 6c 6f 57 6f 72 6c 64 48 65 6c 6c 6f 57 6f 72 6c 64 48 65 6c 6c 6f 57 6f 72 6c 64 48 65 6c 6c 6f 57 6f 72 6c 64 48 65 6c 6c 6f 57 6f 72 6c 64 48 65 6c 6c 6f 57 6f 72 6c 64 48 65 6c 6c 6f 57 6f 72 6c 64 48 65 6c 6c 6f 57 6f 72 6c 64 48 65 6c 6c 6f 57 6f 72 6c 64 48 65 6c 6c 6f 57 6f 72 6c 64 48 65 6c 6c 6f 57 6f 72 6c 64 48 65 6c 6c 6f 57 6f 72 6c 64 48 65 6c 6c 6f 57 6f 72 6c 64 48 65 6c 6c 6f 57 6f 72 6c 64 48 65 6c 6c 6f 57 6f 72"
4619349-4619368 spiflash: field: "Command: Read data (READ)" "Command: Read data" "Cmd: Read data" "Cmd: READ" "READ"
4619370-4619389 spiflash: bit: "Address bits 23..16: 0x11" "Addr bits 23..16: 0x11" "Addr bits 23..16" "A23..A16"
4619390-4619411 spiflash: bit: "Address bits 15..8: 0xd8" "Addr bits 15..8: 0xd8" "Addr bits 15..8" "A15..A8"
4619411-4619432 spiflash: bit: "Address bits 7..0: 0x00" "Addr bits 7..0: 0x00" "Addr bits 7..0" "A7..A0"
4619370-4619432 spiflash: field: "Address: 0x11d800" "Addr: 0x11d800" "0x11d800"
4619436-4624768 spiflash: field: "Data (256 bytes)"
4619349-4665673 spiflash: read: "Read data (addr 0x11d800, 256 bytes): 6c 64 48 65 6c 6c 6f 57 6f 72 6c 64 48 65 6c 6c 6f 57 6f 72 6c 64 48 65 6c 6c 6f 57 6f 72 6c 64 48 65 6c 6c 6f 57 6f 72 6c 64 48 65 6c 6c 6f 57 6f 72 6c 64 48 65 6c 6c 6f 57 6f 72 6c 64 48 65 6c 6c 6f 57 6f 72 6c 64 48 65 6c 6c 6f 57 6f 72 6c 64 48 65 6c 6c 6f 57 6f 72 6c 64 48 65 6c 6c 6f 57 6f 72 6c 64 48 65 6c 6c 6f 57 6f 72 6c 64 48 65 6c 6c 6f 57 6f 72 6c 64 48 65 6c 6c 6f 57 6f 72 6c 64 48 65 6c 6c 6f 57 6f 72 6c 64 48 65 6c 6c 6f 57 6f 72 6c 64 48 65 6c 6c 6f 57 6f 72 6c 64 48 65 6c 6c 6f 57 6f 72 6c 64 48 65 6c 6c 6f 57 6f 72 6c 64 48 65 6c 6c 6f 57 6f 72 6c 64 48 65 6c 6c 6f 57 6f 72 6c 64 48 65 6c 6c 6f 57 6f 72 6c 64 48 65 6c 6c 6f 57 6f 72 6c 64 48 65 6c 6c 6f 57 6f 72 6c 64 48 65 6c 6c 6f 57 6f 72 6c 64 48 65 6c 6c 6f 57 6f 72 6c 64 48 65 6c 6c"
4669345-4669364 spiflash: field: "Command: Read data (READ)" "Command: Read data" "Cmd: Read data" "Cmd: READ" "READ"
4669366-4669385 spiflash: bit: "Address bits 23..16: 0x11" "Addr bits 23..16: 0x11" "Addr bits 23..16" "A23..A16"
4669386-4669407 spiflash: bit: "Address bits 15..8: 0xd9" "Addr bits 15..8: 0xd9" "Addr bits 15..8" "A15..A8"
4669407-4669428 spiflash: bit: "Address bits 7..0: 0x00" "Addr bits 7..0: 0x00" "Addr bits 7..0" "A7..A0"
4669366-4669428 spiflash: field: "Address: 0x11d900" "Addr: 0x11d900" "0x11d900"
4669432-4674764 spiflash: field: "Data (256 bytes)"
4669345-4715275 spiflash: read: "Read data (addr 0x11d900, 256 bytes): 6f 57 6f 72 6c 64 48 65 6c 6c 6f 57 6f 72 6c 64 48 65 6c 6c 6f 57 6f 72 6c 64 48 65 6c 6c 6f 57 6f 72 6c 64 48 65 6c 6c 6f 57 6f 72 6c 64 48 65 6c 6c 6f 57 6f 72 6c 64 48 65 6c 6c 6f 57 6f 72 6c 64 48 65 6c 6c 6f 57 6f 72 6c 64 48 65 6c 6c 6f 57 6f 72 6c 64 48 65 6c 6c 6f 57 6f 72 6c 64 48 65 6c 6c 6f 57 6f 72 6c 64 48 65 6c 6c 6f 57 6f 72 6c 64 48 65 6c 6c 6f 57 6f 72 6c 64 48 65 6c 6c 6f 57 6f 72 6c 64 48 65 6c 6c 6f 57 6f 72 6c 64 48 65 6c 6c 6f 57 6f 72 6c 64 48 65 6c 6c 6f 57 6f 72 6c 64 48 65 6c 6c 6f 57 6f 72 6c 64 48 65 6c 6c 6f 57 6f 72 6c 64 48 65 6c 6c 6f 57 6f 72 6c 64 48 65 6c 6c 6f 57 6f 72 6c 64 48 65 6c 6c 6f 57 6f 72 6c 64 48 65 6c 6c 6f 57 6f 72 6c 64 48 65 6c 6c 6f 57 6f 72 6c 64 48 65 6c 6c 6f 57 6f 72 6c 64 48 65 6c 6c 6f 57 6f 72 6c 64"
4719352-4719371 spiflash: field: "Command: Read data (READ)" "Command: Read data" "Cmd: Read data" "Cmd: READ" "READ"
4719373-4719392 spiflash: bit: "Address bits 23..16: 0x11" "Addr bits 23..16: 0x11" "Addr bits 23..16" "A23..A16"
4719394-4719413 spiflash: bit: "Address bits 15..8: 0xda" "Addr bits 15..8: 0xda" "Addr bits 15..8" "A15..A8"
4719414-4719435 spiflash: bit: "Address bits 7..0: 0x00" "Addr bits 7..0: 0x00" "Addr bits 7..0" "A7..A0"
4719373-4719435 spiflash: field: "Address: 0x11da00" "Addr: 0x11da00" "0x11da00"
4719439-4724771 spiflash: field: "Data (256 bytes)"
4719352-4764618 spiflash: read: "Read data (addr 0x11da00, 256 bytes): 48 65 6c 6c 6f 57 6f 72 6c 64 48 65 6c 6c 6f 57 6f 72 6c 64 48 65 6c 6c 6f 57 6f 72 6c 64 48 65 6c 6c 6f 57 6f 72 6c 64 48 65 6c 6c 6f 57 6f 72 6c 64 48 65 6c 6c 6f 57 6f 72 6c 64 48 65 6c 6c 6f 57 6f 72 6c 64 48 65 6c 6c 6f 57 6f 72 6c 64 48 65 6c 6c 6f 57 6f 72 6c 64 48 65 6c 6c 6f 57 6f 72 6c 64 48 65 6c 6c 6f 57 6f 72 6c 64 48 65 6c 6c 6f 57 6f 72 6c 64 48 65 6c 6c 6f 57 6f 72 6c 64 48 65 6c 6c 6f 57 6f 72 6c 64 48 65 6c 6c 6f 57 6f 72 6c 64 48 65 6c 6c 6f 57 6f 72 6c 64 48 65 6c 6c 6f 57 6f 72 6c 64 48 65 6c 6c 6f 57 6f 72 6c 64 48 65 6c 6c 6f 57 6f 72 6c 64 48 65 6c 6c 6f 57 6f 72 6c 64 48 65 6c 6c 6f 57 6f 72 6c 64 48 65 6c 6c 6f 57 6f 72 6c 64 48 65 6c 6c 6f 57 6f 72 6c 64 48 65 6c 6c 6f 57 6f 72 6c 64 48 65 6c 6c 6f 57 6f 72 6c 64 48 65 6c 6c 6f 57"
4769327-4769346 spiflash: field: "Command: Read data (READ)" "Command: Read data" "Cmd: Read data" "Cmd: READ" "READ"
4769347-4769368 spiflash: bit: "Address bits 23..16: 0x11" "Addr bits 23..16: 0x11" "Addr bits 23..16" "A23..A16"
4769368-4769389 spiflash: bit: "Address bits 15..8: 0xdb" "Addr bits 15..8: 0xdb" "Addr bits 15..8" "A15..A8"
4769389-4769410 spiflash: bit: "Address bits 7..0: 0x00" "Addr bits 7..0: 0x00" "Addr bits 7..0" "A7..A0"
4769347-4769410 spiflash: field: "Address: 0x11db00" "Addr: 0x11db00" "0x11db00"
4769414-4774747 spiflash: field: "Data (256 bytes)"
4769327-4815263 spiflash: read: "Read data (addr 0x11db00, 256 bytes): 6f 72 6c 64 48 65 6c 6c 6f 57 6f 72 6c 64 48 65 6c 6c 6f 57 6f 72 6c 64 48 65 6c 6c 6f 57 6f 72 6c 64 48 65 6c 6c 6f 57 6f 72 6c 64 48 65 6c 6c 6f 57 6f 72 6c 64 48 65 6c 6c 6f 57 6f 72 6c 64 48 65 6c 6c 6f 57 6f 72 6c 64 48 65 6c 6c 6f 57 6f 72 6c 64 48 65 6c 6c 6f 57 6f 72 6c 64 48 65 6c 6c 6f 57 6f 72 6c 64 48 65 6c 6c 6f 57 6f 72 6c 64 48 65 6c 6c 6f 57 6f 72 6c 64 48 65 6c 6c 6f 57 6f 72 6c 64 48 65 6c 6c 6f 57 6f 72 6c 64 48 65 6c 6c 6f 57 6f 72 6c 64 48 65 6c 6c 6f 57 6f 72 6c 64 48 65 6c 6c 6f 57 6f 72 6c 64 48 65 6c 6c 6f 57 6f 72 6c 64 48 65 6c 6c 6f 57 6f 72 6c 64 48 65 6c 6c 6f 57 6f 72 6c 64 48 65 6c 6c 6f 57 6f 72 6c 64 48 65 6c 6c 6f 57 6f 72 6c 64 48 65 6c 6c 6f 57 6f 72 6c 64 48 65 6c 6c 6f 57 6f 72 6c 64 48 65 6c 6c 6f 57 6f 72 6c 64 48 65"
4819319-4819340 spiflash: field: "Command: Read data (READ)" "Command: Read data" "Cmd: Read data" "Cmd: READ" "READ"
4819340-4819359 spiflash: bit: "Address bits 23..16: 0x11" "Addr bits 23..16: 0x11" "Addr bits 23..16" "A23..A16"
4819361-4819380 spiflash: bit: "Address bits 15..8: 0xdc" "Addr bits 15..8: 0xdc" "Addr bits 15..8" "A15..A8"
4819382-4819401 spiflash: bit: "Address bits 7..0: 0x00" "Addr bits 7..0: 0x00" "Addr bits 7..0" "A7..A0"
4819340-4819401 spiflash: field: "Address: 0x11dc00" "Addr: 0x11dc00" "0x11dc00"
4819407-4824740 spiflash: field: "Data (256 bytes)"
4819319-4865646 spiflash: read: "Read data (addr 0x11dc00, 256 bytes): 6c 6c 6f 57 6f 72 6c 64 48 65 6c 6c 6f 57 6f 72 6c 64 48 65 6c 6c 6f 57 6f 72 6c 64 48 65 6c 6c 6f 57 6f 72 6c 64 48 65 6c 6c 6f 57 6f 72 6c 64 48 65 6c 6c 6f 57 6f 72 6c 64 48 65 6c 6c 6f 57 6f 72 6c 64 48 65 6c 6c 6f 57 6f 72 6c 64 48 65 6c 6c 6f 57 6f 72 6c 64 48 65 6c 6c 6f 57 6f 72 6c 64 48 65 6c 6c 6f 57 6f 72 6c 64 48 65 6c 6c 6f 57 6f 72 6c 64 48 65 6c 6c 6f 57 6f 72 6c 64 48 65 6c 6c 6f 57 6f 72 6c 64 48 65 6c 6c 6f 57 6f 72 6c 64 48 65 6c 6c 6f 57 6f 72 6c 64 48 65 6c 6c 6f 57 6f 72 6c 64 48 65 6c 6c 6f 57 6f 72 6c 64 48 65 6c 6c 6f 57 6f 72 6c 64 48 65 6c 6c 6f 57 6f 72 6c 64 48 65 6c 6c 6f 57 6f 72 6c 64 48 65 6c 6c 6f 57 6f 72 6c 64 48 65 6c 6c 6f 57 6f 72 6c 64 48 65 6c 6c 6f 57 6f 72 6c 64 48 65 6c 6c 6f 57 6f 72 6c 64 48 65 6c 6c 6f 57 6f 72"
4876587-4876606 spiflash: field: "Command: Read data (READ)" "Command: Read data" "Cmd: Read data" "Cmd: READ" "READ"
4876607-4876628 spiflash: bit: "Address bits 23..16: 0x11" "Addr bits 23..16: 0x11" "Addr bits 23..16" "A23..A16"
4876628-4876649 spiflash: bit: "Address bits 15..8: 0xdd" "Addr bits 15..8: 0xdd" "Addr bits 15..8" "A15..A8"
4876649-4876670 spiflash: bit: "Address bits 7..0: 0x00" "Addr bits 7..0: 0x00" "Addr bits 7..0" "A7..A0"
4876607-4876670 spiflash: field: "Address: 0x11dd00" "Addr: 0x11dd00" "0x11dd00"
4876674-4882007 spiflash: field: "Data (256 bytes)"
4876587-4912466 spiflash: read: "Read data (addr 0x11dd00, 256 bytes): 6c 64 48 65 6c 6c 6f 57 6f 72 6c 64 48 65 6c 6c 6f 57 6f 72 6c 64 48 65 6c 6c 6f 57 6f 72 6c 64 48 65 6c 6c 6f 57 6f 72 6c 64 48 65 6c 6c 6f 57 6f 72 6c 64 48 65 6c 6c 6f 57 6f 72 6c 64 48 65 6c 6c 6f 57 6f 72 6c 64 48 65 6c 6c 6f 57 6f 72 6c 64 48 65 6c 6c 6f 57 6f 72 6c 64 48 65 6c 6c 6f 57 6f 72 6c 64 48 65 6c 6c 6f 57 6f 72 6c 64 48 65 6c 6c 6f 57 6f 72 6c 64 48 65 6c 6c 6f 57 6f 72 6c 64 48 65 6c 6c 6f 57 6f 72 6c 64 48 65 6c 6c 6f 57 6f 72 6c 64 48 65 6c 6c 6f 57 6f 72 6c 64 48 65 6c 6c 6f 57 6f 72 6c 64 48 65 6c 6c 6f 57 6f 72 6c 64 48 65 6c 6c 6f 57 6f 72 6c 64 48 65 6c 6c 6f 57 6f 72 6c 64 48 65 6c 6c 6f 57 6f 72 6c 64 48 65 6c 6c 6f 57 6f 72 6c 64 48 65 6c 6c 6f 57 6f 72 6c 64 48 65 6c 6c 6f 57 6f 72 6c 64 48 65 6c 6c 6f 57 6f 72 6c 64 48 65 6c 6c"
4918262-4918281 spiflash: field: "Command: Read data (READ)" "Command: Read data" "Cmd: Read data" "Cmd: READ" "READ"
4918283-4918302 spiflash: bit: "Address bits 23..16: 0x11" "Addr bits 23..16: 0x11" "Addr bits 23..16" "A23..A16"
4918304-4918323 spiflash: bit: "Address bits 15..8: 0xde" "Addr bits 15..8: 0xde" "Addr bits 15..8" "A15..A8"
4918324-4918345 spiflash: bit: "Address bits 7..0: 0x00" "Addr bits 7..0: 0x00" "Addr bits 7..0" "A7..A0"
4918283-4918345 spiflash: field: "Address: 0x11de00" "Addr: 0x11de00" "0x11de00"
4918349-4923681 spiflash: field: "Data (256 bytes)"
4918262-4965639 spiflash: read: "Read data (addr 0x11de00, 256 bytes): 6f 57 6f 72 6c 64 48 65 6c 6c 6f 57 6f 72 6c 64 48 65 6c 6c 6f 57 6f 72 6c 64 48 65 6c 6c 6f 57 6f 72 6c 64 48 65 6c 6c 6f 57 6f 72 6c 64 48 65 6c 6c 6f 57 6f 72 6c 64 48 65 6c 6c 6f 57 6f 72 6c 64 48 65 6c 6c 6f 57 6f 72 6c 64 48 65 6c 6c 6f 57 6f 72 6c 64 48 65 6c 6c 6f 57 6f 72 6c 64 48 65 6c 6c 6f 57 6f 72 6c 64 48 65 6c 6c 6f 57 6f 72 6c 64 48 65 6c 6c 6f 57 6f 72 6c 64 48 65 6c 6c 6f 57 6f 72 6c 64 48 65 6c 6c 6f 57 6f 72 6c 64 48 65 6c 6c 6f 57 6f 72 6c 64 48 65 6c 6c 6f 57 6f 72 6c 64 48 65 6c 6c 6f 57 6f 72 6c 64 48 65 6c 6c 6f 57 6f 72 6c 64 48 65 6c 6c 6f 57 6f 72 6c 64 48 65 6c 6c 6f 57 6f 72 6c 64 48 65 6c 6c 6f 57 6f 72 6c 64 48 65 6c 6c 6f 57 6f 72 6c 64 48 65 6c 6c 6f 57 6f 72 6c 64 48 65 6c 6c 6f 57 6f 72 6c 64 48 65 6c 6c 6f 57 6f 72 6c 64"
4969440-4969459 spiflash: field: "Command: Read data (READ)" "Command: Read data" "Cmd: Read data" "Cmd: READ" "READ"
4969461-4969480 spiflash: bit: "Address bits 23..16: 0x11" "Addr bits 23..16: 0x11" "Addr bits 23..16" "A23..A16"
4969482-4969501 spiflash: bit: "Address bits 15..8: 0xdf" "Addr bits 15..8: 0xdf" "Addr bits 15..8" "A15..A8"
4969502-4969523 spiflash: bit: "Address bits 7..0: 0x00" "Addr bits 7..0: 0x00" "Addr bits 7..0" "A7..A0"
4969461-4969523 spiflash: field: "Address: 0x11df00" "Addr: 0x11df00" "0x11df00"
4969527-4974859 spiflash: field: "Data (256 bytes)"
4969440-5015103 spiflash: read: "Read data (addr 0x11df00, 256 bytes): 48 65 6c 6c 6f 57 6f 72 6c 64 48 65 6c 6c 6f 57 6f 72 6c 64 48 65 6c 6c 6f 57 6f 72 6c 64 48 65 6c 6c 6f 57 6f 72 6c 64 48 65 6c 6c 6f 57 6f 72 6c 64 48 65 6c 6c 6f 57 6f 72 6c 64 48 65 6c 6c 6f 57 6f 72 6c 64 48 65 6c 6c 6f 57 6f 72 6c 64 48 65 6c 6c 6f 57 6f 72 6c 64 48 65 6c 6c 6f 57 6f 72 6c 64 48 65 6c 6c 6f 57 6f 72 6c 64 48 65 6c 6c 6f 57 6f 72 6c 64 48 65 6c 6c 6f 57 6f 72 6c 64 48 65 6c 6c 6f 57 6f 72 6c 64 48 65 6c 6c 6f 57 6f 72 6c 64 48 65 6c 6c 6f 57 6f 72 6c 64 48 65 6c 6c 6f 57 6f 72 6c 64 48 65 6c 6c 6f 57 6f 72 6c 64 48 65 6c 6c 6f 57 6f 72 6c 64 48 65 6c 6c 6f 57 6f 72 6c 64 48 65 6c 6c 6f 57 6f 72 6c 64 48 65 6c 6c 6f 57 6f 72 6c 64 48 65 6c 6c 6f 57 6f 72 6c 64 48 65 6c 6c 6f 57 6f 72 6c 64 48 65 6c 6c 6f 57 6f 72 6c 64 48 65 6c 6c 6f 57"
5019293-5019314 spiflash: field: "Command: Read data (READ)" "Command: Read data" "Cmd: Read data" "Cmd: READ" "READ"
5019314-5019335 spiflash: bit: "Address bits 23..16: 0x11" "Addr bits 23..16: 0x11" "Addr bits 23..16" "A23..A16"
5019335-5019356 spiflash: bit: "Address bits 15..8: 0xe0" "Addr bits 15..8: 0xe0" "Addr bits 15..8" "A15..A8"
5019356-5019375 spiflash: bit: "Address bits 7..0: 0x00" "Addr bits 7..0: 0x00" "Addr bits 7..0" "A7..A0"
5019314-5019375 spiflash: field: "Address: 0x11e000" "Addr: 0x11e000" "0x11e000"
5019381-5024714 spiflash: field: "Data (256 bytes)"
5019293-5065619 spiflash: read: "Read data (addr 0x11e000, 256 bytes): 6f 72 6c 64 48 65 6c 6c 6f 57 6f 72 6c 64 48 65 6c 6c 6f 57 6f 72 6c 64 48 65 6c 6c 6f 57 6f 72 6c 64 48 65 6c 6c 6f 57 6f 72 6c 64 48 65 6c 6c 6f 57 6f 72 6c 64 48 65 6c 6c 6f 57 6f 72 6c 64 48 65 6c 6c 6f 57 6f 72 6c 64 48 65 6c 6c 6f 57 6f 72 6c 64 48 65 6c 6c 6f 57 6f 72 6c 64 48 65 6c 6c 6f 57 6f 72 6c 64 48 65 6c 6c 6f 57 6f 72 6c 64 48 65 6c 6c 6f 57 6f 72 6c 64 48 65 6c 6c 6f 57 6f 72 6c 64 48 65 6c 6c 6f 57 6f 72 6c 64 48 65 6c 6c 6f 57 6f 72 6c 64 48 65 6c 6c 6f 57 6f 72 6c 64 48 65 6c 6c 6f 57 6f 72 6c 64 48 65 6c 6c 6f 57 6f 72 6c 64 48 65 6c 6c 6f 57 6f 72 6c 64 48 65 6c 6c 6f 57 6f 72 6c 64 48 65 6c 6c 6f 57 6f 72 6c 64 48 65 6c 6c 6f 57 6f 72 6c 64 48 65 6c 6c 6f 57 6f 72 6c 64 48 65 6c 6c 6f 57 6f 72 6c 64 48 65 6c 6c 6f 57 6f 72 6c 64 48 65"
5069290-5069311 spiflash: field: "Command: Read data (READ)" "Command: Read data" "Cmd: Read data" "Cmd: READ" "READ"
5069311-5069330 spiflash: bit: "Address bits 23..16: 0x11" "Addr bits 23..16: 0x11" "Addr bits 23..16" "A23..A16"
5069332-5069351 spiflash: bit: "Address bits 15..8: 0xe1" "Addr bits 15..8: 0xe1" "Addr bits 15..8" "A15..A8"
5069353-5069372 spiflash: bit: "Address bits 7..0: 0x00" "Addr bits 7..0: 0x00" "Addr bits 7..0" "A7..A0"
5069311-5069372 spiflash: field: "Address: 0x11e100" "Addr: 0x11e100" "0x11e100"
5069378-5074711 spiflash: field: "Data (256 bytes)"
5069290-5115222 spiflash: read: "Read data (addr 0x11e100, 256 bytes): 6c 6c 6f 57 6f 72 6c 64 48 65 6c 6c 6f 57 6f 72 6c 64 48 65 6c 6c 6f 57 6f 72 6c 64 48 65 6c 6c 6f 57 6f 72 6c 64 48 65 6c 6c 6f 57 6f 72 6c 64 48 65 6c 6c 6f 57 6f 72 6c 64 48 65 6c 6c 6f 57 6f 72 6c 64 48 65 6c 6c 6f 57 6f 72 6c 64 48 65 6c 6c 6f 57 6f 72 6c 64 48 65 6c 6c 6f 57 6f 72 6c 64 48 65 6c 6c 6f 57 6f 72 6c 64 48 65 6c 6c 6f 57 6f 72 6c 64 48 65 6c 6c 6f 57 6f 72 6c 64 48 65 6c 6c 6f 57 6f 72 6c 64 48 65 6c 6c 6f 57 6f 72 6c 64 48 65 6c 6c 6f 57 6f 72 6c 64 48 65 6c 6c 6f 57 6f 72 6c 64 48 65 6c 6c 6f 57 6f 72 6c 64 48 65 6c 6c 6f 57 6f 72 6c 64 48 65 6c 6c 6f 57 6f 72 6c 64 48 65 6c 6c 6f 57 6f 72 6c 64 48 65 6c 6c 6f 57 6f 72 6c 64 48 65 6c 6c 6f 57 6f 72 6c 64 48 65 6c 6c 6f 57 6f 72 6c 64 48 65 6c 6c 6f 57 6f 72 6c 64 48 65 6c 6c 6f 57 6f 72"
5119288-5119309 spiflash: field: "Command: Read data (READ)" "Command: Read data" "Cmd: Read data" "Cmd: READ" "READ"
5119309-5119328 spiflash: bit: "Address bits 23..16: 0x11" "Addr bits 23..16: 0x11" "Addr bits 23..16" "A23..A16"
5119330-5119349 spiflash: bit: "Address bits 15..8: 0xe2" "Addr bits 15..8: 0xe2" "Addr bits 15..8" "A15..A8"
5119351-5119370 spiflash: bit: "Address bits 7..0: 0x00" "Addr bits 7..0: 0x00" "Addr bits 7..0" "A7..A0"
5119309-5119370 spiflash: field: "Address: 0x11e200" "Addr: 0x11e200" "0x11e200"
5119376-5124707 spiflash: field: "Data (256 bytes)"
5119288-5165615 spiflash: read: "Read data (addr 0x11e200, 256 bytes): 6c 64 48 65 6c 6c 6f 57 6f 72 6c 64 48 65 6c 6c 6f 57 6f 72 6c 64 48 65 6c 6c 6f 57 6f 72 6c 64 48 65 6c 6c 6f 57 6f 72 6c 64 48 65 6c 6c 6f 57 6f 72 6c 64 48 65 6c 6c 6f 57 6f 72 6c 64 48 65 6c 6c 6f 57 6f 72 6c 64 48 65 6c 6c 6f 57 6f 72 6c 64 48 65 6c 6c 6f 57 6f 72 6c 64 48 65 6c 6c 6f 57 6f 72 6c 64 48 65 6c 6c 6f 57 6f 72 6c 64 48 65 6c 6c 6f 57 6f 72 6c 64 48 65 6c 6c 6f 57 6f 72 6c 64 48 65 6c 6c 6f 57 6f 72 6c 64 48 65 6c 6c 6f 57 6f 72 6c 64 48 65 6c 6c 6f 57 6f 72 6c 64 48 65 6c 6c 6f 57 6f 72 6c 64 48 65 6c 6c 6f 57 6f 72 6c 64 48 65 6c 6c 6f 57 6f 72 6c 64 48 65 6c 6c 6f 57 6f 72 6c 64 48 65 6c 6c 6f 57 6f 72 6c 64 48 65 6c 6c 6f 57 6f 72 6c 64 48 65 6c 6c 6f 57 6f 72 6c 64 48 65 6c 6c 6f 57 6f 72 6c 64 48 65 6c 6c 6f 57 6f 72 6c 64 48 65 6c 6c"
5169269-5169290 spiflash: field: "Command: Read data (READ)" "Command: Read data" "Cmd: Read data" "Cmd: READ" "READ"
5169290-5169309 spiflash: bit: "Address bits 23..16: 0x11" "Addr bits 23..16: 0x11" "Addr bits 23..16" "A23..A16"
5169311-5169330 spiflash: bit: "Address bits 15..8: 0xe3" "Addr bits 15..8: 0xe3" "Addr bits 15..8" "A15..A8"
5169332-5169351 spiflash: bit: "Address bits 7..0: 0x00" "Addr bits 7..0: 0x00" "Addr bits 7..0" "A7..A0"
5169290-5169351 spiflash: field: "Address: 0x11e300" "Addr: 0x11e300" "0x11e300"
5169357-5174688 spiflash: field: "Data (256 bytes)"
5169269-5215211 spiflash: read: "Read data (addr 0x11e300, 256 bytes): 6f 57 6f 72 6c 64 48 65 6c 6c 6f 57 6f 72 6c 64 48 65 6c 6c 6f 57 6f 72 6c 64 48 65 6c 6c 6f 57 6f 72 6c 64 48 65 6c 6c 6f 57 6f 72 6c 64 48 65 6c 6c 6f 57 6f 72 6c 64 48 65 6c 6c 6f 57 6f 72 6c 64 48 65 6c 6c 6f 57 6f 72 6c 64 48 65 6c 6c 6f 57 6f 72 6c 64 48 65 6c 6c 6f 57 6f 72 6c 64 48 65 6c 6c 6f 57 6f 72 6c 64 48 65 6c 6c 6f 57 6f 72 6c 64 48 65 6c 6c 6f 57 6f 72 6c 64 48 65 6c 6c 6f 57 6f 72 6c 64 48 65 6c 6c 6f 57 6f 72 6c 64 48 65 6c 6c 6f 57 6f 72 6c 64 48 65 6c 6c 6f 57 6f 72 6c 64 48 65 6c 6c 6f 57 6f 72 6c 64 48 65 6c 6c 6f 57 6f 72 6c 64 48 65 6c 6c 6f 57 6f 72 6c 64 48 65 6c 6c 6f 57 6f 72 6c 64 48 65 6c 6c 6f 57 6f 72 6c 64 48 65 6c 6c 6f 57 6f 72 6c 64 48 65 6c 6c 6f 57 6f 72 6c 64 48 65 6c 6c 6f 57 6f 72 6c 64 48 65 6c 6c 6f 57 6f 72 6c 64"
5219279-5219298 spiflash: field: "Command: Read data (READ)" "Command: Read data" "Cmd: Read data" "Cmd: READ" "READ"
5219300-5219319 spiflash: bit: "Address bits 23..16: 0x11" "Addr bits 23..16: 0x11" "Addr bits 23..16" "A23..A16"
5219320-5219341 spiflash: bit: "Address bits 15..8: 0xe4" "Addr bits 15..8: 0xe4" "Addr bits 15..8" "A15..A8"
5219341-5219362 spiflash: bit: "Address bits 7..0: 0x00" "Addr bits 7..0: 0x00" "Addr bits 7..0" "A7..A0"
5219300-5219362 spiflash: field: "Address: 0x11e400" "Addr: 0x11e400" "0x11e400"
5219366-5224698 spiflash: field: "Data (256 bytes)"
5219279-5265588 spiflash: read: "Read data (addr 0x11e400, 256 bytes): 48 65 6c 6c 6f 57 6f 72 6c 64 48 65 6c 6c 6f 57 6f 72 6c 64 48 65 6c 6c 6f 57 6f 72 6c 64 48 65 6c 6c 6f 57 6f 72 6c 64 48 65 6c 6c 6f 57 6f 72 6c 64 48 65 6c 6c 6f 57 6f 72 6c 64 48 65 6c 6c 6f 57 6f 72 6c 64 48 65 6c 6c 6f 57 6f 72 6c 64 48 65 6c 6c 6f 57 6f 72 6c 64 48 65 6c 6c 6f 57 6f 72 6c 64 48 65 6c 6c 6f 57 6f 72 6c 64 48 65 6c 6c 6f 57 6f 72 6c 64 48 65 6c 6c 6f 57 6f 72 6c 64 48 65 6c 6c 6f 57 6f 72 6c 64 48 65 6c 6c 6f 57 6f 72 6c 64 48 65 6c 6c 6f 57 6f 72 6c 64 48 65 6c 6c 6f 57 6f 72 6c 64 48 65 6c 6c 6f 57 6f 72 6c 64 48 65 6c 6c 6f 57 6f 72 6c 64 48 65 6c 6c 6f 57 6f 72 6c 64 48 65 6c 6c 6f 57 6f 72 6c 64 48 65 6c 6c 6f 57 6f 72 6c 64 48 65 6c 6c 6f 57 6f 72 6c 64 48 65 6c 6c 6f 57 6f 72 6c 64 48 65 6c 6c 6f 57 6f 72 6c 64 48 65 6c 6c 6f 57"
5269272-5269291 spiflash: field: "Command: Read data (READ)" "Command: Read data" "Cmd: Read data" "Cmd: READ" "READ"
5269293-5269312 spiflash: bit: "Address bits 23..16: 0x11" "Addr bits 23..16: 0x11" "Addr bits 23..16" "A23..A16"
5269313-5269334 spiflash: bit: "Address bits 15..8: 0xe5" "Addr bits 15..8: 0xe5" "Addr bits 15..8" "A15..A8"
5269334-5269355 spiflash: bit: "Address bits 7..0: 0x00" "Addr bits 7..0: 0x00" "Addr bits 7..0" "A7..A0"
5269293-5269355 spiflash: field: "Address: 0x11e500" "Addr: 0x11e500" "0x11e500"
5269359-5274691 spiflash: field: "Data (256 bytes)"
5269272-5315197 spiflash: read: "Read data (addr 0x11e500, 256 bytes): 6f 72 6c 64 48 65 6c 6c 6f 57 6f 72 6c 64 48 65 6c 6c 6f 57 6f 72 6c 64 48 65 6c 6c 6f 57 6f 72 6c 64 48 65 6c 6c 6f 57 6f 72 6c 64 48 65 6c 6c 6f 57 6f 72 6c 64 48 65 6c 6c 6f 57 6f 72 6c 64 48 65 6c 6c 6f 57 6f 72 6c 64 48 65 6c 6c 6f 57 6f 72 6c 64 48 65 6c 6c 6f 57 6f 72 6c 64 48 65 6c 6c 6f 57 6f 72 6c 64 48 65 6c 6c 6f 57 6f 72 6c 64 48 65 6c 6c 6f 57 6f 72 6c 64 48 65 6c 6c 6f 57 6f 72 6c 64 48 65 6c 6c 6f 57 6f 72 6c 64 48 65 6c 6c 6f 57 6f 72 6c 64 48 65 6c 6c 6f 57 6f 72 6c 64 48 65 6c 6c 6f 57 6f 72 6c 64 48 65 6c 6c 6f 57 6f 72 6c 64 48 65 6c 6c 6f 57 6f 72 6c 64 48 65 6c 6c 6f 57 6f 72 6c 64 48 65 6c 6c 6f 57 6f 72 6c 64 48 65 6c 6c 6f 57 6f 72 6c 64 48 65 6c 6c 6f 57 6f 72 6c 64 48 65 6c 6c 6f 57 6f 72 6c 64 48 65 6c 6c 6f 57 6f 72 6c 64 48 65"
5319259-5319278 spiflash: field: "Command: Read data (READ)" "Command: Read data" "Cmd: Read data" "Cmd: READ" "READ"
5319280-5319299 spiflash: bit: "Address bits 23..16: 0x11" "Addr bits 23..16: 0x11" "Addr bits 23..16" "A23..A16"
5319301-5319320 spiflash: bit: "Address bits 15..8: 0xe6" "Addr bits 15..8: 0xe6" "Addr bits 15..8" "A15..A8"
5319321-5319342 spiflash: bit: "Address bits 7..0: 0x00" "Addr bits 7..0: 0x00" "Addr bits 7..0" "A7..A0"
5319280-5319342 spiflash: field: "Address: 0x11e600" "Addr: 0x11e600" "0x11e600"
5319346-5324678 spiflash: field: "Data (256 bytes)"
5319259-5365584 spiflash: read: "Read data (addr 0x11e600, 256 bytes): 6c 6c 6f 57 6f 72 6c 64 48 65 6c 6c 6f 57 6f 72 6c 64 48 65 6c 6c 6f 57 6f 72 6c 64 48 65 6c 6c 6f 57 6f 72 6c 64 48 65 6c 6c 6f 57 6f 72 6c 64 48 65 6c 6c 6f 57 6f 72 6c 64 48 65 6c 6c 6f 57 6f 72 6c 64 48 65 6c 6c 6f 57 6f 72 6c 64 48 65 6c 6c 6f 57 6f 72 6c 64 48 65 6c 6c 6f 57 6f 72 6c 64 48 65 6c 6c 6f 57 6f 72 6c 64 48 65 6c 6c 6f 57 6f 72 6c 64 48 65 6c 6c 6f 57 6f 72 6c 64 48 65 6c 6c 6f 57 6f 72 6c 64 48 65 6c 6c 6f 57 6f 72 6c 64 48 65 6c 6c 6f 57 6f 72 6c 64 48 65 6c 6c 6f 57 6f 72 6c 64 48 65 6c 6c 6f 57 6f 72 6c 64 48 65 6c 6c 6f 57 6f 72 6c 64 48 65 6c 6c 6f 57 6f 72 6c 64 48 65 6c 6c 6f 57 6f 72 6c 64 48 65 6c 6c 6f 57 6f 72 6c 64 48 65 6c 6c 6f 57 6f 72 6c 64 48 65 6c 6c 6f 57 6f 72 6c 64 48 65 6c 6c 6f 57 6f 72 6c 64 48 65 6c 6c 6f 57 6f 72"
5369240-5369259 spiflash: field: "Command: Read data (READ)" "Command: Read data" "Cmd: Read data" "Cmd: READ" "READ"
5369260-5369281 spiflash: bit: "Address bits 23..16: 0x11" "Addr bits 23..16: 0x11" "Addr bits 23..16" "A23..A16"
5369281-5369302 spiflash: bit: "Address bits 15..8: 0xe7" "Addr bits 15..8: 0xe7" "Addr bits 15..8" "A15..A8"
5369302-5369323 spiflash: bit: "Address bits 7..0: 0x00" "Addr bits 7..0: 0x00" "Addr bits 7..0" "A7..A0"
5369260-5369323 spiflash: field: "Address: 0x11e700" "Addr: 0x11e700" "0x11e700"
5369327-5374660 spiflash: field: "Data (256 bytes)"
5369240-5415044 spiflash: read: "Read data (addr 0x11e700, 256 bytes): 6c 64 48 65 6c 6c 6f 57 6f 72 6c 64 48 65 6c 6c 6f 57 6f 72 6c 64 48 65 6c 6c 6f 57 6f 72 6c 64 48 65 6c 6c 6f 57 6f 72 6c 64 48 65 6c 6c 6f 57 6f 72 6c 64 48 65 6c 6c 6f 57 6f 72 6c 64 48 65 6c 6c 6f 57 6f 72 6c 64 48 65 6c 6c 6f 57 6f 72 6c 64 48 65 6c 6c 6f 57 6f 72 6c 64 48 65 6c 6c 6f 57 6f 72 6c 64 48 65 6c 6c 6f 57 6f 72 6c 64 48 65 6c 6c 6f 57 6f 72 6c 64 48 65 6c 6c 6f 57 6f 72 6c 64 48 65 6c 6c 6f 57 6f 72 6c 64 48 65 6c 6c 6f 57 6f 72 6c 64 48 65 6c 6c 6f 57 6f 72 6c 64 48 65 6c 6c 6f 57 6f 72 6c 64 48 65 6c 6c 6f 57 6f 72 6c 64 48 65 6c 6c 6f 57 6f 72 6c 64 48 65 6c 6c 6f 57 6f 72 6c 64 48 65 6c 6c 6f 57 6f 72 6c 64 48 65 6c 6c 6f 57 6f 72 6c 64 48 65 6c 6c 6f 57 6f 72 6c 64 48 65 6c 6c 6f 57 6f 72 6c 64 48 65 6c 6c 6f 57 6f 72 6c 64 48 65 6c 6c"
5419239-5419260 spiflash: field: "Command: Read data (READ)" "Command: Read data" "Cmd: Read data" "Cmd: READ" "READ"
5419260-5419281 spiflash: bit: "Address bits 23..16: 0x11" "Addr bits 23..16: 0x11" "Addr bits 23..16" "A23..A16"
5419281-5419300 spiflash: bit: "Address bits 15..8: 0xe8" "Addr bits 15..8: 0xe8" "Addr bits 15..8" "A15..A8"
5419302-5419321 spiflash: bit: "Address bits 7..0: 0x00" "Addr bits 7..0: 0x00" "Addr bits 7..0" "A7..A0"
5419260-5419321 spiflash: field: "Address: 0x11e800" "Addr: 0x11e800" "0x11e800"
5419327-5424660 spiflash: field: "Data (256 bytes)"
5419239-5465563 spiflash: read: "Read data (addr 0x11e800, 256 bytes): 6f 57 6f 72 6c 64 48 65 6c 6c 6f 57 6f 72 6c 64 48 65 6c 6c 6f 57 6f 72 6c 64 48 65 6c 6c 6f 57 6f 72 6c 64 48 65 6c 6c 6f 57 6f 72 6c 64 48 65 6c 6c 6f 57 6f 72 6c 64 48 65 6c 6c 6f 57 6f 72 6c 64 48 65 6c 6c 6f 57 6f 72 6c 64 48 65 6c 6c 6f 57 6f 72 6c 64 48 65 6c 6c 6f 57 6f 72 6c 64 48 65 6c 6c 6f 57 6f 72 6c 64 48 65 6c 6c 6f 57 6f 72 6c 64 48 65 6c 6c 6f 57 6f 72 6c 64 48 65 6c 6c 6f 57 6f 72 6c 64 48 65 6c 6c 6f 57 6f 72 6c 64 48 65 6c 6c 6f 57 6f 72 6c 64 48 65 6c 6c 6f 57 6f 72 6c 64 48 65 6c 6c 6f 57 6f 72 6c 64 48 65 6c 6c 6f 57 6f 72 6c 64 48 65 6c 6c 6f 57 6f 72 6c 64 48 65 6c 6c 6f 57 6f 72 6c 64 48 65 6c 6c 6f 57 6f 72 6c 64 48 65 6c 6c 6f 57 6f 72 6c 64 48 65 6c 6c 6f 57 6f 72 6c 64 48 65 6c 6c 6f 57 6f 72 6c 64 48 65 6c 6c 6f 57 6f 72 6c 64"
5467793-5467814 spiflash: field: "Command: Read data (READ)" "Command: Read data" "Cmd: Read data" "Cmd: READ" "READ"
5467814-5467833 spiflash: bit: "Address bits 23..16: 0x11" "Addr bits 23..16: 0x11" "Addr bits 23..16" "A23..A16"
5467835-5467854 spiflash: bit: "Address bits 15..8: 0xe9" "Addr bits 15..8: 0xe9" "Addr bits 15..8" "A15..A8"
5467856-5467875 spiflash: bit: "Address bits 7..0: 0x00" "Addr bits 7..0: 0x00" "Addr bits 7..0" "A7..A0"
5467814-5467875 spiflash: field: "Address: 0x11e900" "Addr: 0x11e900" "0x11e900"
5467881-5473212 spiflash: field: "Data (256 bytes)"
5467793-5515034 spiflash: read: "Read data (addr 0x11e900, 256 bytes): 48 65 6c 6c 6f 57 6f 72 6c 64 48 65 6c 6c 6f 57 6f 72 6c 64 48 65 6c 6c 6f 57 6f 72 6c 64 48 65 6c 6c 6f 57 6f 72 6c 64 48 65 6c 6c 6f 57 6f 72 6c 64 48 65 6c 6c 6f 57 6f 72 6c 64 48 65 6c 6c 6f 57 6f 72 6c 64 48 65 6c 6c 6f 57 6f 72 6c 64 48 65 6c 6c 6f 57 6f 72 6c 64 48 65 6c 6c 6f 57 6f 72 6c 64 48 65 6c 6c 6f 57 6f 72 6c 64 48 65 6c 6c 6f 57 6f 72 6c 64 48 65 6c 6c 6f 57 6f 72 6c 64 48 65 6c 6c 6f 57 6f 72 6c 64 48 65 6c 6c 6f 57 6f 72 6c 64 48 65 6c 6c 6f 57 6f 72 6c 64 48 65 6c 6c 6f 57 6f 72 6c 64 48 65 6c 6c 6f 57 6f 72 6c 64 48 65 6c 6c 6f 57 6f 72 6c 64 48 65 6c 6c 6f 57 6f 72 6c 64 48 65 6c 6c 6f 57 6f 72 6c 64 48 65 6c 6c 6f 57 6f 72 6c 64 48 65 6c 6c 6f 57 6f 72 6c 64 48 65 6c 6c 6f 57 6f 72 6c 64 48 65 6c 6c 6f 57 6f 72 6c 64 48 65 6c 6c 6f 57"
5519221-5519242 spiflash: field: "Command: Read data (READ)" "Command: Read data" "Cmd: Read data" "Cmd: READ" "READ"
5519242-5519261 spiflash: bit: "Address bits 23..16: 0x11" "Addr bits 23..16: 0x11" "Addr bits 23..16" "A23..A16"
5519263-5519282 spiflash: bit: "Address bits 15..8: 0xea" "Addr bits 15..8: 0xea" "Addr bits 15..8" "A15..A8"
5519284-5519303 spiflash: bit: "Address bits 7..0: 0x00" "Addr bits 7..0: 0x00" "Addr bits 7..0" "A7..A0"
5519242-5519303 spiflash: field: "Address: 0x11ea00" "Addr: 0x11ea00" "0x11ea00"
5519309-5524640 spiflash: field: "Data (256 bytes)"
5519221-5565030 spiflash: read: "Read data (addr 0x11ea00, 256 bytes): 6f 72 6c 64 48 65 6c 6c 6f 57 6f 72 6c 64 48 65 6c 6c 6f 57 6f 72 6c 64 48 65 6c 6c 6f 57 6f 72 6c 64 48 65 6c 6c 6f 57 6f 72 6c 64 48 65 6c 6c 6f 57 6f 72 6c 64 48 65 6c 6c 6f 57 6f 72 6c 64 48 65 6c 6c 6f 57 6f 72 6c 64 48 65 6c 6c 6f 57 6f 72 6c 64 48 65 6c 6c 6f 57 6f 72 6c 64 48 65 6c 6c 6f 57 6f 72 6c 64 48 65 6c 6c 6f 57 6f 72 6c 64 48 65 6c 6c 6f 57 6f 72 6c 64 48 65 6c 6c 6f 57 6f 72 6c 64 48 65 6c 6c 6f 57 6f 72 6c 64 48 65 6c 6c 6f 57 6f 72 6c 64 48 65 6c 6c 6f 57 6f 72 6c 64 48 65 6c 6c 6f 57 6f 72 6c 64 48 65 6c 6c 6f 57 6f 72 6c 64 48 65 6c 6c 6f 57 6f 72 6c 64 48 65 6c 6c 6f 57 6f 72 6c 64 48 65 6c 6c 6f 57 6f 72 6c 64 48 65 6c 6c 6f 57 6f 72 6c 64 48 65 6c 6c 6f 57 6f 72 6c 64 48 65 6c 6c 6f 57 6f 72 6c 64 48 65 6c 6c 6f 57 6f 72 6c 64 48 65"
5567785-5567804 spiflash: field: "Command: Read data (READ)" "Command: Read data" "Cmd: Read data" "Cmd: READ" "READ"
5567805-5567826 spiflash: bit: "Address bits 23..16: 0x11" "Addr bits 23..16: 0x11" "Addr bits 23..16" "A23..A16"
5567826-5567847 spiflash: bit: "Address bits 15..8: 0xeb" "Addr bits 15..8: 0xeb" "Addr bits 15..8" "A15..A8"
5567847-5567868 spiflash: bit: "Address bits 7..0: 0x00" "Addr bits 7..0: 0x00" "Addr bits 7..0" "A7..A0"
5567805-5567868 spiflash: field: "Address: 0x11eb00" "Addr: 0x11eb00" "0x11eb00"
5567872-5573205 spiflash: field: "Data (256 bytes)"
5567785-5615018 spiflash: read: "Read data (addr 0x11eb00, 256 bytes): 6c 6c 6f 57 6f 72 6c 64 48 65 6c 6c 6f 57 6f 72 6c 64 48 65 6c 6c 6f 57 6f 72 6c 64 48 65 6c 6c 6f 57 6f 72 6c 64 48 65 6c 6c 6f 57 6f 72 6c 64 48 65 6c 6c 6f 57 6f 72 6c 64 48 65 6c 6c 6f 57 6f 72 6c 64 48 65 6c 6c 6f 57 6f 72 6c 64 48 65 6c 6c 6f 57 6f 72 6c 64 48 65 6c 6c 6f 57 6f 72 6c 64 48 65 6c 6c 6f 57 6f 72 6c 64 48 65 6c 6c 6f 57 6f 72 6c 64 48 65 6c 6c 6f 57 6f 72 6c 64 48 65 6c 6c 6f 57 6f 72 6c 64 48 65 6c 6c 6f 57 6f 72 6c 64 48 65 6c 6c 6f 57 6f 72 6c 64 48 65 6c 6c 6f 57 6f 72 6c 64 48 65 6c 6c 6f 57 6f 72 6c 64 48 65 6c 6c 6f 57 6f 72 6c 64 48 65 6c 6c 6f 57 6f 72 6c 64 48 65 6c 6c 6f 57 6f 72 6c 64 48 65 6c 6c 6f 57 6f 72 6c 64 48 65 6c 6c 6f 57 6f 72 6c 64 48 65 6c 6c 6f 57 6f 72 6c 64 48 65 6c 6c 6f 57 6f 72 6c 64 48 65 6c 6c 6f 57 6f 72"
5619217-5619238 spiflash: field: "Command: Read data (READ)" "Command: Read data" "Cmd: Read data" "Cmd: READ" "READ"
5619238-5619257 spiflash: bit: "Address bits 23..16: 0x11" "Addr bits 23..16: 0x11" "Addr bits 23..16" "A23..A16"
5619259-5619278 spiflash: bit: "Address bits 15..8: 0xec" "Addr bits 15..8: 0xec" "Addr bits 15..8" "A15..A8"
5619280-5619299 spiflash: bit: "Address bits 7..0: 0x00" "Addr bits 7..0: 0x00" "Addr bits 7..0" "A7..A0"
5619238-5619299 spiflash: field: "Address: 0x11ec00" "Addr: 0x11ec00" "0x11ec00"
5619305-5624636 spiflash: field: "Data (256 bytes)"
5619217-5665543 spiflash: read: "Read data (addr 0x11ec00, 256 bytes): 6c 64 48 65 6c 6c 6f 57 6f 72 6c 64 48 65 6c 6c 6f 57 6f 72 6c 64 48 65 6c 6c 6f 57 6f 72 6c 64 48 65 6c 6c 6f 57 6f 72 6c 64 48 65 6c 6c 6f 57 6f 72 6c 64 48 65 6c 6c 6f 57 6f 72 6c 64 48 65 6c 6c 6f 57 6f 72 6c 64 48 65 6c 6c 6f 57 6f 72 6c 64 48 65 6c 6c 6f 57 6f 72 6c 64 48 65 6c 6c 6f 57 6f 72 6c 64 48 65 6c 6c 6f 57 6f 72 6c 64 48 65 6c 6c 6f 57 6f 72 6c 64 48 65 6c 6c 6f 57 6f 72 6c 64 48 65 6c 6c 6f 57 6f 72 6c 64 48 65 6c 6c 6f 57 6f 72 6c 64 48 65 6c 6c 6f 57 6f 72 6c 64 48 65 6c 6c 6f 57 6f 72 6c 64 48 65 6c 6c 6f 57 6f 72 6c 64 48 65 6c 6c 6f 57 6f 72 6c 64 48 65 6c 6c 6f 57 6f 72 6c 64 48 65 6c 6c 6f 57 6f 72 6c 64 48 65 6c 6c 6f 57 6f 72 6c 64 48 65 6c 6c 6f 57 6f 72 6c 64 48 65 6c 6c 6f 57 6f 72 6c 64 48 65 6c 6c 6f 57 6f 72 6c 64 48 65 6c 6c"
5668151-5668170 spiflash: field: "Command: Read data (READ)" "Command: Read data" "Cmd: Read data" "Cmd: READ" "READ"
5668172-5668191 spiflash: bit: "Address bits 23..16: 0x11" "Addr bits 23..16: 0x11" "Addr bits 23..16" "A23..A16"
5668193-5668212 spiflash: bit: "Address bits 15..8: 0xed" "Addr bits 15..8: 0xed" "Addr bits 15..8" "A15..A8"
5668213-5668234 spiflash: bit: "Address bits 7..0: 0x00" "Addr bits 7..0: 0x00" "Addr bits 7..0" "A7..A0"
5668172-5668234 spiflash: field: "Address: 0x11ed00" "Addr: 0x11ed00" "0x11ed00"
5668238-5673570 spiflash: field: "Data (256 bytes)"
5668151-5715152 spiflash: read: "Read data (addr 0x11ed00, 256 bytes): 6f 57 6f 72 6c 64 48 65 6c 6c 6f 57 6f 72 6c 64 48 65 6c 6c 6f 57 6f 72 6c 64 48 65 6c 6c 6f 57 6f 72 6c 64 48 65 6c 6c 6f 57 6f 72 6c 64 48 65 6c 6c 6f 57 6f 72 6c 64 48 65 6c 6c 6f 57 6f 72 6c 64 48 65 6c 6c 6f 57 6f 72 6c 64 48 65 6c 6c 6f 57 6f 72 6c 64 48 65 6c 6c 6f 57 6f 72 6c 64 48 65 6c 6c 6f 57 6f 72 6c 64 48 65 6c 6c 6f 57 6f 72 6c 64 48 65 6c 6c 6f 57 6f 72 6c 64 48 65 6c 6c 6f 57 6f 72 6c 64 48 65 6c 6c 6f 57 6f 72 6c 64 48 65 6c 6c 6f 57 6f 72 6c 64 48 65 6c 6c 6f 57 6f 72 6c 64 48 65 6c 6c 6f 57 6f 72 6c 64 48 65 6c 6c 6f 57 6f 72 6c 64 48 65 6c 6c 6f 57 6f 72 6c 64 48 65 6c 6c 6f 57 6f 72 6c 64 48 65 6c 6c 6f 57 6f 72 6c 64 48 65 6c 6c 6f 57 6f 72 6c 64 48 65 6c 6c 6f 57 6f 72 6c 64 48 65 6c 6c 6f 57 6f 72 6c 64 48 65 6c 6c 6f 57 6f 72 6c 64"
5719092-5719113 spiflash: field: "Command: Read data (READ)" "Command: Read data" "Cmd: Read data" "Cmd: READ" "READ"
5719113-5719134 spiflash: bit: "Address bits 23..16: 0x11" "Addr bits 23..16: 0x11" "Addr bits 23..16" "A23..A16"
5719134-5719153 spiflash: bit: "Address bits 15..8: 0xee" "Addr bits 15..8: 0xee" "Addr bits 15..8" "A15..A8"
5719155-5719174 spiflash: bit: "Address bits 7..0: 0x00" "Addr bits 7..0: 0x00" "Addr bits 7..0" "A7..A0"
5719113-5719174 spiflash: field: "Address: 0x11ee00" "Addr: 0x11ee00" "0x11ee00"
5719180-5724513 spiflash: field: "Data (256 bytes)"
5719092-5765533 spiflash: read: "Read data (addr 0x11ee00, 256 bytes): 48 65 6c 6c 6f 57 6f 72 6c 64 48 65 6c 6c 6f 57 6f 72 6c 64 48 65 6c 6c 6f 57 6f 72 6c 64 48 65 6c 6c 6f 57 6f 72 6c 64 48 65 6c 6c 6f 57 6f 72 6c 64 48 65 6c 6c 6f 57 6f 72 6c 64 48 65 6c 6c 6f 57 6f 72 6c 64 48 65 6c 6c 6f 57 6f 72 6c 64 48 65 6c 6c 6f 57 6f 72 6c 64 48 65 6c 6c 6f 57 6f 72 6c 64 48 65 6c 6c 6f 57 6f 72 6c 64 48 65 6c 6c 6f 57 6f 72 6c 64 48 65 6c 6c 6f 57 6f 72 6c 64 48 65 6c 6c 6f 57 6f 72 6c 64 48 65 6c 6c 6f 57 6f 72 6c 64 48 65 6c 6c 6f 57 6f 72 6c 64 48 65 6c 6c 6f 57 6f 72 6c 64 48 65 6c 6c 6f 57 6f 72 6c 64 48 65 6c 6c 6f 57 6f 72 6c 64 48 65 6c 6c 6f 57 6f 72 6c 64 48 65 6c 6c 6f 57 6f 72 6c 64 48 65 6c 6c 6f 57 6f 72 6c 64 48 65 6c 6c 6f 57 6f 72 6c 64 48 65 6c 6c 6f 57 6f 72 6c 64 48 65 6c 6c 6f 57 6f 72 6c 64 48 65 6c 6c 6f 57"
5769192-5769213 spiflash: field: "Command: Read data (READ)" "Command: Read data" "Cmd: Read data" "Cmd: READ" "READ"
5769213-5769234 spiflash: bit: "Address bits 23..16: 0x11" "Addr bits 23..16: 0x11" "Addr bits 23..16" "A23..A16"
5769234-5769255 spiflash: bit: "Address bits 15..8: 0xef" "Addr bits 15..8: 0xef" "Addr bits 15..8" "A15..A8"
5769255-5769274 spiflash: bit: "Address bits 7..0: 0x00" "Addr bits 7..0: 0x00" "Addr bits 7..0" "A7..A0"
5769213-5769274 spiflash: field: "Address: 0x11ef00" "Addr: 0x11ef00" "0x11ef00"
5769280-5774613 spiflash: field: "Data (256 bytes)"
5769192-5816048 spiflash: read: "Read data (addr 0x11ef00, 256 bytes): 6f 72 6c 64 48 65 6c 6c 6f 57 6f 72 6c 64 48 65 6c 6c 6f 57 6f 72 6c 64 48 65 6c 6c 6f 57 6f 72 6c 64 48 65 6c 6c 6f 57 6f 72 6c 64 48 65 6c 6c 6f 57 6f 72 6c 64 48 65 6c 6c 6f 57 6f 72 6c 64 48 65 6c 6c 6f 57 6f 72 6c 64 48 65 6c 6c 6f 57 6f 72 6c 64 48 65 6c 6c 6f 57 6f 72 6c 64 48 65 6c 6c 6f 57 6f 72 6c 64 48 65 6c 6c 6f 57 6f 72 6c 64 48 65 6c 6c 6f 57 6f 72 6c 64 48 65 6c 6c 6f 57 6f 72 6c 64 48 65 6c 6c 6f 57 6f 72 6c 64 48 65 6c 6c 6f 57 6f 72 6c 64 48 65 6c 6c 6f 57 6f 72 6c 64 48 65 6c 6c 6f 57 6f 72 6c 64 48 65 6c 6c 6f 57 6f 72 6c 64 48 65 6c 6c 6f 57 6f 72 6c 64 48 65 6c 6c 6f 57 6f 72 6c 64 48 65 6c 6c 6f 57 6f 72 6c 64 48 65 6c 6c 6f 57 6f 72 6c 64 48 65 6c 6c 6f 57 6f 72 6c 64 48 65 6c 6c 6f 57 6f 72 6c 64 48 65 6c 6c 6f 57 6f 72 6c 64 48 65"
5818140-5818159 spiflash: field: "Command: Read data (READ)" "Command: Read data" "Cmd: Read data" "Cmd: READ" "READ"
5818160-5818181 spiflash: bit: "Address bits 23..16: 0x11" "Addr bits 23..16: 0x11" "Addr bits 23..16" "A23..A16"
5818181-5818202 spiflash: bit: "Address bits 15..8: 0xf0" "Addr bits 15..8: 0xf0" "Addr bits 15..8" "A15..A8"
5818202-5818223 spiflash: bit: "Address bits 7..0: 0x00" "Addr bits 7..0: 0x00" "Addr bits 7..0" "A7..A0"
5818160-5818223 spiflash: field: "Address: 0x11f000" "Addr: 0x11f000" "0x11f000"
5818227-5823559 spiflash: field: "Data (256 bytes)"
5818140-5865524 spiflash: read: "Read data (addr 0x11f000, 256 bytes): 6c 6c 6f 57 6f 72 6c 64 48 65 6c 6c 6f 57 6f 72 6c 64 48 65 6c 6c 6f 57 6f 72 6c 64 48 65 6c 6c 6f 57 6f 72 6c 64 48 65 6c 6c 6f 57 6f 72 6c 64 48 65 6c 6c 6f 57 6f 72 6c 64 48 65 6c 6c 6f 57 6f 72 6c 64 48 65 6c 6c 6f 57 6f 72 6c 64 48 65 6c 6c 6f 57 6f 72 6c 64 48 65 6c 6c 6f 57 6f 72 6c 64 48 65 6c 6c 6f 57 6f 72 6c 64 48 65 6c 6c 6f 57 6f 72 6c 64 48 65 6c 6c 6f 57 6f 72 6c 64 48 65 6c 6c 6f 57 6f 72 6c 64 48 65 6c 6c 6f 57 6f 72 6c 64 48 65 6c 6c 6f 57 6f 72 6c 64 48 65 6c 6c 6f 57 6f 72 6c 64 48 65 6c 6c 6f 57 6f 72 6c 64 48 65 6c 6c 6f 57 6f 72 6c 64 48 65 6c 6c 6f 57 6f 72 6c 64 48 65 6c 6c 6f 57 6f 72 6c 64 48 65 6c 6c 6f 57 6f 72 6c 64 48 65 6c 6c 6f 57 6f 72 6c 64 48 65 6c 6c 6f 57 6f 72 6c 64 48 65 6c 6c 6f 57 6f 72 6c 64 48 65 6c 6c 6f 57 6f 72"
5869200-5869219 spiflash: field: "Command: Read data (READ)" "Command: Read data" "Cmd: Read data" "Cmd: READ" "READ"
5869221-5869240 spiflash: bit: "Address bits 23..16: 0x11" "Addr bits 23..16: 0x11" "Addr bits 23..16" "A23..A16"
5869241-5869262 spiflash: bit: "Address bits 15..8: 0xf1" "Addr bits 15..8: 0xf1" "Addr bits 15..8" "A15..A8"
5869262-5869283 spiflash: bit: "Address bits 7..0: 0x00" "Addr bits 7..0: 0x00" "Addr bits 7..0" "A7..A0"
5869221-5869283 spiflash: field: "Address: 0x11f100" "Addr: 0x11f100" "0x11f100"
5869287-5874619 spiflash: field: "Data (256 bytes)"
5869200-5915122 spiflash: read: "Read data (addr 0x11f100, 256 bytes): 6c 64 48 65 6c 6c 6f 57 6f 72 6c 64 48 65 6c 6c 6f 57 6f 72 6c 64 48 65 6c 6c 6f 57 6f 72 6c 64 48 65 6c 6c 6f 57 6f 72 6c 64 48 65 6c 6c 6f 57 6f 72 6c 64 48 65 6c 6c 6f 57 6f 72 6c 64 48 65 6c 6c 6f 57 6f 72 6c 64 48 65 6c 6c 6f 57 6f 72 6c 64 48 65 6c 6c 6f 57 6f 72 6c 64 48 65 6c 6c 6f 57 6f 72 6c 64 48 65 6c 6c 6f 57 6f 72 6c 64 48 65 6c 6c 6f 57 6f 72 6c 64 48 65 6c 6c 6f 57 6f 72 6c 64 48 65 6c 6c 6f 57 6f 72 6c 64 48 65 6c 6c 6f 57 6f 72 6c 64 48 65 6c 6c 6f 57 6f 72 6c 64 48 65 6c 6c 6f 57 6f 72 6c 64 48 65 6c 6c 6f 57 6f 72 6c 64 48 65 6c 6c 6f 57 6f 72 6c 64 48 65 6c 6c 6f 57 6f 72 6c 64 48 65 6c 6c 6f 57 6f 72 6c 64 48 65 6c 6c 6f 57 6f 72 6c 64 48 65 6c 6c 6f 57 6f 72 6c 64 48 65 6c 6c 6f 57 6f 72 6c 64 48 65 6c 6c 6f 57 6f 72 6c 64 48 65 6c 6c"
5919065-5919086 spiflash: field: "Command: Read data (READ)" "Command: Read data" "Cmd: Read data" "Cmd: READ" "READ"
5919086-5919107 spiflash: bit: "Address bits 23..16: 0x11" "Addr bits 23..16: 0x11" "Addr bits 23..16" "A23..A16"
5919107-5919126 spiflash: bit: "Address bits 15..8: 0xf2" "Addr bits 15..8: 0xf2" "Addr bits 15..8" "A15..A8"
5919128-5919147 spiflash: bit: "Address bits 7..0: 0x00" "Addr bits 7..0: 0x00" "Addr bits 7..0" "A7..A0"
5919086-5919147 spiflash: field: "Address: 0x11f200" "Addr: 0x11f200" "0x11f200"
5919153-5924486 spiflash: field: "Data (256 bytes)"
5919065-5965503 spiflash: read: "Read data (addr 0x11f200, 256 bytes): 6f 57 6f 72 6c 64 48 65 6c 6c 6f 57 6f 72 6c 64 48 65 6c 6c 6f 57 6f 72 6c 64 48 65 6c 6c 6f 57 6f 72 6c 64 48 65 6c 6c 6f 57 6f 72 6c 64 48 65 6c 6c 6f 57 6f 72 6c 64 48 65 6c 6c 6f 57 6f 72 6c 64 48 65 6c 6c 6f 57 6f 72 6c 64 48 65 6c 6c 6f 57 6f 72 6c 64 48 65 6c 6c 6f 57 6f 72 6c 64 48 65 6c 6c 6f 57 6f 72 6c 64 48 65 6c 6c 6f 57 6f 72 6c 64 48 65 6c 6c 6f 57 6f 72 6c 64 48 65 6c 6c 6f 57 6f 72 6c 64 48 65 6c 6c 6f 57 6f 72 6c 64 48 65 6c 6c 6f 57 6f 72 6c 64 48 65 6c 6c 6f 57 6f 72 6c 64 48 65 6c 6c 6f 57 6f 72 6c 64 48 65 6c 6c 6f 57 6f 72 6c 64 48 65 6c 6c 6f 57 6f 72 6c 64 48 65 6c 6c 6f 57 6f 72 6c 64 48 65 6c 6c 6f 57 6f 72 6c 64 48 65 6c 6c 6f 57 6f 72 6c 64 48 65 6c 6c 6f 57 6f 72 6c 64 48 65 6c 6c 6f 57 6f 72 6c 64 48 65 6c 6c 6f 57 6f 72 6c 64"
5969177-5969198 spiflash: field: "Command: Read data (READ)" "Command: Read data" "Cmd: Read data" "Cmd: READ" "READ"
5969198-5969219 spiflash: bit: "Address bits 23..16: 0x11" "Addr bits 23..16: 0x11" "Addr bits 23..16" "A23..A16"
5969219-5969240 spiflash: bit: "Address bits 15..8: 0xf3" "Addr bits 15..8: 0xf3" "Addr bits 15..8" "A15..A8"
5969240-5969259 spiflash: bit: "Address bits 7..0: 0x00" "Addr bits 7..0: 0x00" "Addr bits 7..0" "A7..A0"
5969198-5969259 spiflash: field: "Address: 0x11f300" "Addr: 0x11f300" "0x11f300"
5969265-5974598 spiflash: field: "Data (256 bytes)"
5969177-6015108 spiflash: read: "Read data (addr 0x11f300, 256 bytes): 48 65 6c 6c 6f 57 6f 72 6c 64 48 65 6c 6c 6f 57 6f 72 6c 64 48 65 6c 6c 6f 57 6f 72 6c 64 48 65 6c 6c 6f 57 6f 72 6c 64 48 65 6c 6c 6f 57 6f 72 6c 64 48 65 6c 6c 6f 57 6f 72 6c 64 48 65 6c 6c 6f 57 6f 72 6c 64 48 65 6c 6c 6f 57 6f 72 6c 64 48 65 6c 6c 6f 57 6f 72 6c 64 48 65 6c 6c 6f 57 6f 72 6c 64 48 65 6c 6c 6f 57 6f 72 6c 64 48 65 6c 6c 6f 57 6f 72 6c 64 48 65 6c 6c 6f 57 6f 72 6c 64 48 65 6c 6c 6f 57 6f 72 6c 64 48 65 6c 6c 6f 57 6f 72 6c 64 48 65 6c 6c 6f 57 6f 72 6c 64 48 65 6c 6c 6f 57 6f 72 6c 64 48 65 6c 6c 6f 57 6f 72 6c 64 48 65 6c 6c 6f 57 6f 72 6c 64 48 65 6c 6c 6f 57 6f 72 6c 64 48 65 6c 6c 6f 57 6f 72 6c 64 48 65 6c 6c 6f 57 6f 72 6c 64 48 65 6c 6c 6f 57 6f 72 6c 64 48 65 6c 6c 6f 57 6f 72 6c 64 48 65 6c 6c 6f 57 6f 72 6c 64 48 65 6c 6c 6f 57"
6019165-6019186 spiflash: field: "Command: Read data (READ)" "Command: Read data" "Cmd: Read data" "Cmd: READ" "READ"
6019186-6019205 spiflash: bit: "Address bits 23..16: 0x11" "Addr bits 23..16: 0x11" "Addr bits 23..16" "A23..A16"
6019207-6019226 spiflash: bit: "Address bits 15..8: 0xf4" "Addr bits 15..8: 0xf4" "Addr bits 15..8" "A15..A8"
6019228-6019248 spiflash: bit: "Address bits 7..0: 0x00" "Addr bits 7..0: 0x00" "Addr bits 7..0" "A7..A0"
6019186-6019248 spiflash: field: "Address: 0x11f400" "Addr: 0x11f400" "0x11f400"
6019252-6024584 spiflash: field: "Data (256 bytes)"
6019165-6065484 spiflash: read: "Read data (addr 0x11f400, 256 bytes): 6f 72 6c 64 48 65 6c 6c 6f 57 6f 72 6c 64 48 65 6c 6c 6f 57 6f 72 6c 64 48 65 6c 6c 6f 57 6f 72 6c 64 48 65 6c 6c 6f 57 6f 72 6c 64 48 65 6c 6c 6f 57 6f 72 6c 64 48 65 6c 6c 6f 57 6f 72 6c 64 48 65 6c 6c 6f 57 6f 72 6c 64 48 65 6c 6c 6f 57 6f 72 6c 64 48 65 6c 6c 6f 57 6f 72 6c 64 48 65 6c 6c 6f 57 6f 72 6c 64 48 65 6c 6c 6f 57 6f 72 6c 64 48 65 6c 6c 6f 57 6f 72 6c 64 48 65 6c 6c 6f 57 6f 72 6c 64 48 65 6c 6c 6f 57 6f 72 6c 64 48 65 6c 6c 6f 57 6f 72 6c 64 48 65 6c 6c 6f 57 6f 72 6c 64 48 65 6c 6c 6f 57 6f 72 6c 64 48 65 6c 6c 6f 57 6f 72 6c 64 48 65 6c 6c 6f 57 6f 72 6c 64 48 65 6c 6c 6f 57 6f 72 6c 64 48 65 6c 6c 6f 57 6f 72 6c 64 48 65 6c 6c 6f 57 6f 72 6c 64 48 65 6c 6c 6f 57 6f 72 6c 64 48 65 6c 6c 6f 57 6f 72 6c 64 48 65 6c 6c 6f 57 6f 72 6c 64 48 65"
6069154-6069175 spiflash: field: "Command: Read data (READ)" "Command: Read data" "Cmd: Read data" "Cmd: READ" "READ"
6069175-6069196 spiflash: bit: "Address bits 23..16: 0x11" "Addr bits 23..16: 0x11" "Addr bits 23..16" "A23..A16"
6069196-6069215 spiflash: bit: "Address bits 15..8: 0xf5" "Addr bits 15..8: 0xf5" "Addr bits 15..8" "A15..A8"
6069217-6069236 spiflash: bit: "Address bits 7..0: 0x00" "Addr bits 7..0: 0x00" "Addr bits 7..0" "A7..A0"
6069175-6069236 spiflash: field: "Address: 0x11f500" "Addr: 0x11f500" "0x11f500"
6069242-6074575 spiflash: field: "Data (256 bytes)"
6069154-6113443 spiflash: read: "Read data (addr 0x11f500, 256 bytes): 6c 6c 6f 57 6f 72 6c 64 48 65 6c 6c 6f 57 6f 72 6c 64 48 65 6c 6c 6f 57 6f 72 6c 64 48 65 6c 6c 6f 57 6f 72 6c 64 48 65 6c 6c 6f 57 6f 72 6c 64 48 65 6c 6c 6f 57 6f 72 6c 64 48 65 6c 6c 6f 57 6f 72 6c 64 48 65 6c 6c 6f 57 6f 72 6c 64 48 65 6c 6c 6f 57 6f 72 6c 64 48 65 6c 6c 6f 57 6f 72 6c 64 48 65 6c 6c 6f 57 6f 72 6c 64 48 65 6c 6c 6f 57 6f 72 6c 64 48 65 6c 6c 6f 57 6f 72 6c 64 48 65 6c 6c 6f 57 6f 72 6c 64 48 65 6c 6c 6f 57 6f 72 6c 64 48 65 6c 6c 6f 57 6f 72 6c 64 48 65 6c 6c 6f 57 6f 72 6c 64 48 65 6c 6c 6f 57 6f 72 6c 64 48 65 6c 6c 6f 57 6f 72 6c 64 48 65 6c 6c 6f 57 6f 72 6c 64 48 65 6c 6c 6f 57 6f 72 6c 64 48 65 6c 6c 6f 57 6f 72 6c 64 48 65 6c 6c 6f 57 6f 72 6c 64 48 65 6c 6c 6f 57 6f 72 6c 64 48 65 6c 6c 6f 57 6f 72 6c 64 48 65 6c 6c 6f 57 6f 72"
6116536-6116555 spiflash: field: "Command: Read data (READ)" "Command: Read data" "Cmd: Read data" "Cmd: READ" "READ"
6116557-6116576 spiflash: bit: "Address bits 23..16: 0x11" "Addr bits 23..16: 0x11" "Addr bits 23..16" "A23..A16"
6116577-6116598 spiflash: bit: "Address bits 15..8: 0xf6" "Addr bits 15..8: 0xf6" "Addr bits 15..8" "A15..A8"
6116598-6116619 spiflash: bit: "Address bits 7..0: 0x00" "Addr bits 7..0: 0x00" "Addr bits 7..0" "A7..A0"
6116557-6116619 spiflash: field: "Address: 0x11f600" "Addr: 0x11f600" "0x11f600"
6116623-6121955 spiflash: field: "Data (256 bytes)"
6116536-6163842 spiflash: read: "Read data (addr 0x11f600, 256 bytes): 6c 64 48 65 6c 6c 6f 57 6f 72 6c 64 48 65 6c 6c 6f 57 6f 72 6c 64 48 65 6c 6c 6f 57 6f 72 6c 64 48 65 6c 6c 6f 57 6f 72 6c 64 48 65 6c 6c 6f 57 6f 72 6c 64 48 65 6c 6c 6f 57 6f 72 6c 64 48 65 6c 6c 6f 57 6f 72 6c 64 48 65 6c 6c 6f 57 6f 72 6c 64 48 65 6c 6c 6f 57 6f 72 6c 64 48 65 6c 6c 6f 57 6f 72 6c 64 48 65 6c 6c 6f 57 6f 72 6c 64 48 65 6c 6c 6f 57 6f 72 6c 64 48 65 6c 6c 6f 57 6f 72 6c 64 48 65 6c 6c 6f 57 6f 72 6c 64 48 65 6c 6c 6f 57 6f 72 6c 64 48 65 6c 6c 6f 57 6f 72 6c 64 48 65 6c 6c 6f 57 6f 72 6c 64 48 65 6c 6c 6f 57 6f 72 6c 64 48 65 6c 6c 6f 57 6f 72 6c 64 48 65 6c 6c 6f 57 6f 72 6c 64 48 65 6c 6c 6f 57 6f 72 6c 64 48 65 6c 6c 6f 57 6f 72 6c 64 48 65 6c 6c 6f 57 6f 72 6c 64 48 65 6c 6c 6f 57 6f 72 6c 64 48 65 6c 6c 6f 57 6f 72 6c 64 48 65 6c 6c"
6195158-6195179 spiflash: field: "Command: Read data (READ)" "Command: Read data" "Cmd: Read data" "Cmd: READ" "READ"
6195179-6195200 spiflash: bit: "Address bits 23..16: 0x11" "Addr bits 23..16: 0x11" "Addr bits 23..16" "A23..A16"
6195200-6195221 spiflash: bit: "Address bits 15..8: 0xf7" "Addr bits 15..8: 0xf7" "Addr bits 15..8" "A15..A8"
6195221-6195240 spiflash: bit: "Address bits 7..0: 0x00" "Addr bits 7..0: 0x00" "Addr bits 7..0" "A7..A0"
6195179-6195240 spiflash: field: "Address: 0x11f700" "Addr: 0x11f700" "0x11f700"
6195246-6200579 spiflash: field: "Data (256 bytes)"
6195158-6212760 spiflash: read: "Read data (addr 0x11f700, 256 bytes): 6f 57 6f 72 6c 64 48 65 6c 6c 6f 57 6f 72 6c 64 48 65 6c 6c 6f 57 6f 72 6c 64 48 65 6c 6c 6f 57 6f 72 6c 64 48 65 6c 6c 6f 57 6f 72 6c 64 48 65 6c 6c 6f 57 6f 72 6c 64 48 65 6c 6c 6f 57 6f 72 6c 64 48 65 6c 6c 6f 57 6f 72 6c 64 48 65 6c 6c 6f 57 6f 72 6c 64 48 65 6c 6c 6f 57 6f 72 6c 64 48 65 6c 6c 6f 57 6f 72 6c 64 48 65 6c 6c 6f 57 6f 72 6c 64 48 65 6c 6c 6f 57 6f 72 6c 64 48 65 6c 6c 6f 57 6f 72 6c 64 48 65 6c 6c 6f 57 6f 72 6c 64 48 65 6c 6c 6f 57 6f 72 6c 64 48 65 6c 6c 6f 57 6f 72 6c 64 48 65 6c 6c 6f 57 6f 72 6c 64 48 65 6c 6c 6f 57 6f 72 6c 64 48 65 6c 6c 6f 57 6f 72 6c 64 48 65 6c 6c 6f 57 6f 72 6c 64 48 65 6c 6c 6f 57 6f 72 6c 64 48 65 6c 6c 6f 57 6f 72 6c 64 48 65 6c 6c 6f 57 6f 72 6c 64 48 65 6c 6c 6f 57 6f 72 6c 64 48 65 6c 6c 6f 57 6f 72 6c 64"
6216018-6216037 spiflash: field: "Command: Read data (READ)" "Command: Read data" "Cmd: Read data" "Cmd: READ" "READ"
6216038-6216059 spiflash: bit: "Address bits 23..16: 0x11" "Addr bits 23..16: 0x11" "Addr bits 23..16" "A23..A16"
6216059-6216080 spiflash: bit: "Address bits 15..8: 0xf8" "Addr bits 15..8: 0xf8" "Addr bits 15..8" "A15..A8"
6216080-6216101 spiflash: bit: "Address bits 7..0: 0x00" "Addr bits 7..0: 0x00" "Addr bits 7..0" "A7..A0"
6216038-6216101 spiflash: field: "Address: 0x11f800" "Addr: 0x11f800" "0x11f800"
6216105-6221438 spiflash: field: "Data (256 bytes)"
6216018-6265076 spiflash: read: "Read data (addr 0x11f800, 256 bytes): 48 65 6c 6c 6f 57 6f 72 6c 64 48 65 6c 6c 6f 57 6f 72 6c 64 48 65 6c 6c 6f 57 6f 72 6c 64 48 65 6c 6c 6f 57 6f 72 6c 64 48 65 6c 6c 6f 57 6f 72 6c 64 48 65 6c 6c 6f 57 6f 72 6c 64 48 65 6c 6c 6f 57 6f 72 6c 64 48 65 6c 6c 6f 57 6f 72 6c 64 48 65 6c 6c 6f 57 6f 72 6c 64 48 65 6c 6c 6f 57 6f 72 6c 64 48 65 6c 6c 6f 57 6f 72 6c 64 48 65 6c 6c 6f 57 6f 72 6c 64 48 65 6c 6c 6f 57 6f 72 6c 64 48 65 6c 6c 6f 57 6f 72 6c 64 48 65 6c 6c 6f 57 6f 72 6c 64 48 65 6c 6c 6f 57 6f 72 6c 64 48 65 6c 6c 6f 57 6f 72 6c 64 48 65 6c 6c 6f 57 6f 72 6c 64 48 65 6c 6c 6f 57 6f 72 6c 64 48 65 6c 6c 6f 57 6f 72 6c 64 48 65 6c 6c 6f 57 6f 72 6c 64 48 65 6c 6c 6f 57 6f 72 6c 64 48 65 6c 6c 6f 57 6f 72 6c 64 48 65 6c 6c 6f 57 6f 72 6c 64 48 65 6c 6c 6f 57 6f 72 6c 64 48 65 6c 6c 6f 57"
6269013-6269032 spiflash: field: "Command: Read data (READ)" "Command: Read data" "Cmd: Read data" "Cmd: READ" "READ"
6269033-6269054 spiflash: bit: "Address bits 23..16: 0x11" "Addr bits 23..16: 0x11" "Addr bits 23..16" "A23..A16"
6269054-6269075 spiflash: bit: "Address bits 15..8: 0xf9" "Addr bits 15..8: 0xf9" "Addr bits 15..8" "A15..A8"
6269075-6269096 spiflash: bit: "Address bits 7..0: 0x00" "Addr bits 7..0: 0x00" "Addr bits 7..0" "A7..A0"
6269033-6269096 spiflash: field: "Address: 0x11f900" "Addr: 0x11f900" "0x11f900"
6269100-6274433 spiflash: field: "Data (256 bytes)"
6269013-6314926 spiflash: read: "Read data (addr 0x11f900, 256 bytes): 6f 72 6c 64 48 65 6c 6c 6f 57 6f 72 6c 64 48 65 6c 6c 6f 57 6f 72 6c 64 48 65 6c 6c 6f 57 6f 72 6c 64 48 65 6c 6c 6f 57 6f 72 6c 64 48 65 6c 6c 6f 57 6f 72 6c 64 48 65 6c 6c 6f 57 6f 72 6c 64 48 65 6c 6c 6f 57 6f 72 6c 64 48 65 6c 6c 6f 57 6f 72 6c 64 48 65 6c 6c 6f 57 6f 72 6c 64 48 65 6c 6c 6f 57 6f 72 6c 64 48 65 6c 6c 6f 57 6f 72 6c 64 48 65 6c 6c 6f 57 6f 72 6c 64 48 65 6c 6c 6f 57 6f 72 6c 64 48 65 6c 6c 6f 57 6f 72 6c 64 48 65 6c 6c 6f 57 6f 72 6c 64 48 65 6c 6c 6f 57 6f 72 6c 64 48 65 6c 6c 6f 57 6f 72 6c 64 48 65 6c 6c 6f 57 6f 72 6c 64 48 65 6c 6c 6f 57 6f 72 6c 64 48 65 6c 6c 6f 57 6f 72 6c 64 48 65 6c 6c 6f 57 6f 72 6c 64 48 65 6c 6c 6f 57 6f 72 6c 64 48 65 6c 6c 6f 57 6f 72 6c 64 48 65 6c 6c 6f 57 6f 72 6c 64 48 65 6c 6c 6f 57 6f 72 6c 64 48 65"
6319123-6319144 spiflash: field: "Command: Read data (READ)" "Command: Read data" "Cmd: Read data" "Cmd: READ" "READ"
6319144-6319165 spiflash: bit: "Address bits 23..16: 0x11" "Addr bits 23..16: 0x11" "Addr bits 23..16" "A23..A16"
6319165-6319184 spiflash: bit: "Address bits 15..8: 0xfa" "Addr bits 15..8: 0xfa" "Addr bits 15..8" "A15..A8"
6319186-6319205 spiflash: bit: "Address bits 7..0: 0x00" "Addr bits 7..0: 0x00" "Addr bits 7..0" "A7..A0"
6319144-6319205 spiflash: field: "Address: 0x11fa00" "Addr: 0x11fa00" "0x11fa00"
6319211-6324544 spiflash: field: "Data (256 bytes)"
6319123-6364918 spiflash: read: "Read data (addr 0x11fa00, 256 bytes): 6c 6c 6f 57 6f 72 6c 64 48 65 6c 6c 6f 57 6f 72 6c 64 48 65 6c 6c 6f 57 6f 72 6c 64 48 65 6c 6c 6f 57 6f 72 6c 64 48 65 6c 6c 6f 57 6f 72 6c 64 48 65 6c 6c 6f 57 6f 72 6c 64 48 65 6c 6c 6f 57 6f 72 6c 64 48 65 6c 6c 6f 57 6f 72 6c 64 48 65 6c 6c 6f 57 6f 72 6c 64 48 65 6c 6c 6f 57 6f 72 6c 64 48 65 6c 6c 6f 57 6f 72 6c 64 48 65 6c 6c 6f 57 6f 72 6c 64 48 65 6c 6c 6f 57 6f 72 6c 64 48 65 6c 6c 6f 57 6f 72 6c 64 48 65 6c 6c 6f 57 6f 72 6c 64 48 65 6c 6c 6f 57 6f 72 6c 64 48 65 6c 6c 6f 57 6f 72 6c 64 48 65 6c 6c 6f 57 6f 72 6c 64 48 65 6c 6c 6f 57 6f 72 6c 64 48 65 6c 6c 6f 57 6f 72 6c 64 48 65 6c 6c 6f 57 6f 72 6c 64 48 65 6c 6c 6f 57 6f 72 6c 64 48 65 6c 6c 6f 57 6f 72 6c 64 48 65 6c 6c 6f 57 6f 72 6c 64 48 65 6c 6c 6f 57 6f 72 6c 64 48 65 6c 6c 6f 57 6f 72"
6369254-6369273 spiflash: field: "Command: Read data (READ)" "Command: Read data" "Cmd: Read data" "Cmd: READ" "READ"
6369275-6369294 spiflash: bit: "Address bits 23..16: 0x11" "Addr bits 23..16: 0x11" "Addr bits 23..16" "A23..A16"
6369295-6369316 spiflash: bit: "Address bits 15..8: 0xfb" "Addr bits 15..8: 0xfb" "Addr bits 15..8" "A15..A8"
6369316-6369337 spiflash: bit: "Address bits 7..0: 0x00" "Addr bits 7..0: 0x00" "Addr bits 7..0" "A7..A0"
6369275-6369337 spiflash: field: "Address: 0x11fb00" "Addr: 0x11fb00" "0x11fb00"
6369341-6374673 spiflash: field: "Data (256 bytes)"
6369254-6414915 spiflash: read: "Read data (addr 0x11fb00, 256 bytes): 6c 64 48 65 6c 6c 6f 57 6f 72 6c 64 48 65 6c 6c 6f 57 6f 72 6c 64 48 65 6c 6c 6f 57 6f 72 6c 64 48 65 6c 6c 6f 57 6f 72 6c 64 48 65 6c 6c 6f 57 6f 72 6c 64 48 65 6c 6c 6f 57 6f 72 6c 64 48 65 6c 6c 6f 57 6f 72 6c 64 48 65 6c 6c 6f 57 6f 72 6c 64 48 65 6c 6c 6f 57 6f 72 6c 64 48 65 6c 6c 6f 57 6f 72 6c 64 48 65 6c 6c 6f 57 6f 72 6c 64 48 65 6c 6c 6f 57 6f 72 6c 64 48 65 6c 6c 6f 57 6f 72 6c 64 48 65 6c 6c 6f 57 6f 72 6c 64 48 65 6c 6c 6f 57 6f 72 6c 64 48 65 6c 6c 6f 57 6f 72 6c 64 48 65 6c 6c 6f 57 6f 72 6c 64 48 65 6c 6c 6f 57 6f 72 6c 64 48 65 6c 6c 6f 57 6f 72 6c 64 48 65 6c 6c 6f 57 6f 72 6c 64 48 65 6c 6c 6f 57 6f 72 6c 64 48 65 6c 6c 6f 57 6f 72 6c 64 48 65 6c 6c 6f 57 6f 72 6c 64 48 65 6c 6c 6f 57 6f 72 6c 64 48 65 6c 6c 6f 57 6f 72 6c 64 48 65 6c 6c"
6419110-6419129 spiflash: field: "Command: Read data (READ)" "Command: Read data" "Cmd: Read data" "Cmd: READ" "READ"
6419130-6419151 spiflash: bit: "Address bits 23..16: 0x11" "Addr bits 23..16: 0x11" "Addr bits 23..16" "A23..A16"
6419151-6419172 spiflash: bit: "Address bits 15..8: 0xfc" "Addr bits 15..8: 0xfc" "Addr bits 15..8" "A15..A8"
6419172-6419193 spiflash: bit: "Address bits 7..0: 0x00" "Addr bits 7..0: 0x00" "Addr bits 7..0" "A7..A0"
6419130-6419193 spiflash: field: "Address: 0x11fc00" "Addr: 0x11fc00" "0x11fc00"
6419197-6424530 spiflash: field: "Data (256 bytes)"
6419110-6464909 spiflash: read: "Read data (addr 0x11fc00, 256 bytes): 6f 57 6f 72 6c 64 48 65 6c 6c 6f 57 6f 72 6c 64 48 65 6c 6c 6f 57 6f 72 6c 64 48 65 6c 6c 6f 57 6f 72 6c 64 48 65 6c 6c 6f 57 6f 72 6c 64 48 65 6c 6c 6f 57 6f 72 6c 64 48 65 6c 6c 6f 57 6f 72 6c 64 48 65 6c 6c 6f 57 6f 72 6c 64 48 65 6c 6c 6f 57 6f 72 6c 64 48 65 6c 6c 6f 57 6f 72 6c 64 48 65 6c 6c 6f 57 6f 72 6c 64 48 65 6c 6c 6f 57 6f 72 6c 64 48 65 6c 6c 6f 57 6f 72 6c 64 48 65 6c 6c 6f 57 6f 72 6c 64 48 65 6c 6c 6f 57 6f 72 6c 64 48 65 6c 6c 6f 57 6f 72 6c 64 48 65 6c 6c 6f 57 6f 72 6c 64 48 65 6c 6c 6f 57 6f 72 6c 64 48 65 6c 6c 6f 57 6f 72 6c 64 48 65 6c 6c 6f 57 6f 72 6c 64 48 65 6c 6c 6f 57 6f 72 6c 64 48 65 6c 6c 6f 57 6f 72 6c 64 48 65 6c 6c 6f 57 6f 72 6c 64 48 65 6c 6c 6f 57 6f 72 6c 64 48 65 6c 6c 6f 57 6f 72 6c 64 48 65 6c 6c 6f 57 6f 72 6c 64"
6469103-6469122 spiflash: field: "Command: Read data (READ)" "Command: Read data" "Cmd: Read data" "Cmd: READ" "READ"
6469123-6469144 spiflash: bit: "Address bits 23..16: 0x11" "Addr bits 23..16: 0x11" "Addr bits 23..16" "A23..A16"
6469144-6469165 spiflash: bit: "Address bits 15..8: 0xfd" "Addr bits 15..8: 0xfd" "Addr bits 15..8" "A15..A8"
6469165-6469186 spiflash: bit: "Address bits 7..0: 0x00" "Addr bits 7..0: 0x00" "Addr bits 7..0" "A7..A0"
6469123-6469186 spiflash: field: "Address: 0x11fd00" "Addr: 0x11fd00" "0x11fd00"
6469190-6474522 spiflash: field: "Data (256 bytes)"
6469103-6515040 spiflash: read: "Read data (addr 0x11fd00, 256 bytes): 48 65 6c 6c 6f 57 6f 72 6c 64 48 65 6c 6c 6f 57 6f 72 6c 64 48 65 6c 6c 6f 57 6f 72 6c 64 48 65 6c 6c 6f 57 6f 72 6c 64 48 65 6c 6c 6f 57 6f 72 6c 64 48 65 6c 6c 6f 57 6f 72 6c 64 48 65 6c 6c 6f 57 6f 72 6c 64 48 65 6c 6c 6f 57 6f 72 6c 64 48 65 6c 6c 6f 57 6f 72 6c 64 48 65 6c 6c 6f 57 6f 72 6c 64 48 65 6c 6c 6f 57 6f 72 6c 64 48 65 6c 6c 6f 57 6f 72 6c 64 48 65 6c 6c 6f 57 6f 72 6c 64 48 65 6c 6c 6f 57 6f 72 6c 64 48 65 6c 6c 6f 57 6f 72 6c 64 48 65 6c 6c 6f 57 6f 72 6c 64 48 65 6c 6c 6f 57 6f 72 6c 64 48 65 6c 6c 6f 57 6f 72 6c 64 48 65 6c 6c 6f 57 6f 72 6c 64 48 65 6c 6c 6f 57 6f 72 6c 64 48 65 6c 6c 6f 57 6f 72 6c 64 48 65 6c 6c 6f 57 6f 72 6c 64 48 65 6c 6c 6f 57 6f 72 6c 64 48 65 6c 6c 6f 57 6f 72 6c 64 48 65 6c 6c 6f 57 6f 72 6c 64 48 65 6c 6c 6f 57"
6518988-6519007 spiflash: field: "Command: Read data (READ)" "Command: Read data" "Cmd: Read data" "Cmd: READ" "READ"
6519009-6519028 spiflash: bit: "Address bits 23..16: 0x11" "Addr bits 23..16: 0x11" "Addr bits 23..16" "A23..A16"
6519029-6519050 spiflash: bit: "Address bits 15..8: 0xfe" "Addr bits 15..8: 0xfe" "Addr bits 15..8" "A15..A8"
6519050-6519071 spiflash: bit: "Address bits 7..0: 0x00" "Addr bits 7..0: 0x00" "Addr bits 7..0" "A7..A0"
6519009-6519071 spiflash: field: "Address: 0x11fe00" "Addr: 0x11fe00" "0x11fe00"
6519075-6524407 spiflash: field: "Data (256 bytes)"
6518988-6565430 spiflash: read: "Read data (addr 0x11fe00, 256 bytes): 6f 72 6c 64 48 65 6c 6c 6f 57 6f 72 6c 64 48 65 6c 6c 6f 57 6f 72 6c 64 48 65 6c 6c 6f 57 6f 72 6c 64 48 65 6c 6c 6f 57 6f 72 6c 64 48 65 6c 6c 6f 57 6f 72 6c 64 48 65 6c 6c 6f 57 6f 72 6c 64 48 65 6c 6c 6f 57 6f 72 6c 64 48 65 6c 6c 6f 57 6f 72 6c 64 48 65 6c 6c 6f 57 6f 72 6c 64 48 65 6c 6c 6f 57 6f 72 6c 64 48 65 6c 6c 6f 57 6f 72 6c 64 48 65 6c 6c 6f 57 6f 72 6c 64 48 65 6c 6c 6f 57 6f 72 6c 64 48 65 6c 6c 6f 57 6f 72 6c 64 48 65 6c 6c 6f 57 6f 72 6c 64 48 65 6c 6c 6f 57 6f 72 6c 64 48 65 6c 6c 6f 57 6f 72 6c 64 48 65 6c 6c 6f 57 6f 72 6c 64 48 65 6c 6c 6f 57 6f 72 6c 64 48 65 6c 6c 6f 57 6f 72 6c 64 48 65 6c 6c 6f 57 6f 72 6c 64 48 65 6c 6c 6f 57 6f 72 6c 64 48 65 6c 6c 6f 57 6f 72 6c 64 48 65 6c 6c 6f 57 6f 72 6c 64 48 65 6c 6c 6f 57 6f 72 6c 64 48 65"
6569099-6569120 spiflash: field: "Command: Read data (READ)" "Command: Read data" "Cmd: Read data" "Cmd: READ" "READ"
6569120-6569139 spiflash: bit: "Address bits 23..16: 0x11" "Addr bits 23..16: 0x11" "Addr bits 23..16" "A23..A16"
6569141-6569160 spiflash: bit: "Address bits 15..8: 0xff" "Addr bits 15..8: 0xff" "Addr bits 15..8" "A15..A8"
6569162-6569181 spiflash: bit: "Address bits 7..0: 0x00" "Addr bits 7..0: 0x00" "Addr bits 7..0" "A7..A0"
6569120-6569181 spiflash: field: "Address: 0x11ff00" "Addr: 0x11ff00" "0x11ff00"
6569187-6574518 spiflash: field: "Data (256 bytes)"
6569099-6615422 spiflash: read: "Read data (addr 0x11ff00, 256 bytes): 6c 6c 6f 57 6f 72 6c 64 48 65 6c 6c 6f 57 6f 72 6c 64 48 65 6c 6c 6f 57 6f 72 6c 64 48 65 6c 6c 6f 57 6f 72 6c 64 48 65 6c 6c 6f 57 6f 72 6c 64 48 65 6c 6c 6f 57 6f 72 6c 64 48 65 6c 6c 6f 57 6f 72 6c 64 48 65 6c 6c 6f 57 6f 72 6c 64 48 65 6c 6c 6f 57 6f 72 6c 64 48 65 6c 6c 6f 57 6f 72 6c 64 48 65 6c 6c 6f 57 6f 72 6c 64 48 65 6c 6c 6f 57 6f 72 6c 64 48 65 6c 6c 6f 57 6f 72 6c 64 48 65 6c 6c 6f 57 6f 72 6c 64 48 65 6c 6c 6f 57 6f 72 6c 64 48 65 6c 6c 6f 57 6f 72 6c 64 48 65 6c 6c 6f 57 6f 72 6c 64 48 65 6c 6c 6f 57 6f 72 6c 64 48 65 6c 6c 6f 57 6f 72 6c 64 48 65 6c 6c 6f 57 6f 72 6c 64 48 65 6c 6c 6f 57 6f 72 6c 64 48 65 6c 6c 6f 57 6f 72 6c 64 48 65 6c 6c 6f 57 6f 72 6c 64 48 65 6c 6c 6f 57 6f 72 6c 64 48 65 6c 6c 6f 57 6f 72 6c 64 48 65 6c 6c 6f 57 6f 72"
6618029-6618050 spiflash: field: "Command: Read data (READ)" "Command: Read data" "Cmd: Read data" "Cmd: READ" "READ"
6618050-6618071 spiflash: bit: "Address bits 23..16: 0x12" "Addr bits 23..16: 0x12" "Addr bits 23..16" "A23..A16"
6618071-6618090 spiflash: bit: "Address bits 15..8: 0x00" "Addr bits 15..8: 0x00" "Addr bits 15..8" "A15..A8"
6618092-6618111 spiflash: bit: "Address bits 7..0: 0x00" "Addr bits 7..0: 0x00" "Addr bits 7..0" "A7..A0"
6618050-6618111 spiflash: field: "Address: 0x120000" "Addr: 0x120000" "0x120000"
6618117-6623450 spiflash: field: "Data (256 bytes)"
6618029-6665406 spiflash: read: "Read data (addr 0x120000, 256 bytes): 6c 64 48 65 6c 6c 6f 57 6f 72 6c 64 48 65 6c 6c 6f 57 6f 72 6c 64 48 65 6c 6c 6f 57 6f 72 6c 64 48 65 6c 6c 6f 57 6f 72 6c 64 48 65 6c 6c 6f 57 6f 72 6c 64 48 65 6c 6c 6f 57 6f 72 6c 64 48 65 6c 6c 6f 57 6f 72 6c 64 48 65 6c 6c 6f 57 6f 72 6c 64 48 65 6c 6c 6f 57 6f 72 6c 64 48 65 6c 6c 6f 57 6f 72 6c 64 48 65 6c 6c 6f 57 6f 72 6c 64 48 65 6c 6c 6f 57 6f 72 6c 64 48 65 6c 6c 6f 57 6f 72 6c 64 48 65 6c 6c 6f 57 6f 72 6c 64 48 65 6c 6c 6f 57 6f 72 6c 64 48 65 6c 6c 6f 57 6f 72 6c 64 48 65 6c 6c 6f 57 6f 72 6c 64 48 65 6c 6c 6f 57 6f 72 6c 64 48 65 6c 6c 6f 57 6f 72 6c 64 48 65 6c 6c 6f 57 6f 72 6c 64 48 65 6c 6c 6f 57 6f 72 6c 64 48 65 6c 6c 6f 57 6f 72 6c 64 48 65 6c 6c 6f 57 6f 72 6c 64 48 65 6c 6c 6f 57 6f 72 6c 64 48 65 6c 6c 6f 57 6f 72 6c 64 48 65 6c 6c"
6669081-6669102 spiflash: field: "Command: Read data (READ)" "Command: Read data" "Cmd: Read data" "Cmd: READ" "READ"
6669102-6669123 spiflash: bit: "Address bits 23..16: 0x12" "Addr bits 23..16: 0x12" "Addr bits 23..16" "A23..A16"
6669123-6669144 spiflash: bit: "Address bits 15..8: 0x01" "Addr bits 15..8: 0x01" "Addr bits 15..8" "A15..A8"
6669144-6669163 spiflash: bit: "Address bits 7..0: 0x00" "Addr bits 7..0: 0x00" "Addr bits 7..0" "A7..A0"
6669102-6669163 spiflash: field: "Address: 0x120100" "Addr: 0x120100" "0x120100"
6669169-6674502 spiflash: field: "Data (256 bytes)"
6669081-6715010 spiflash: read: "Read data (addr 0x120100, 256 bytes): 6f 57 6f 72 6c 64 48 65 6c 6c 6f 57 6f 72 6c 64 48 65 6c 6c 6f 57 6f 72 6c 64 48 65 6c 6c 6f 57 6f 72 6c 64 48 65 6c 6c 6f 57 6f 72 6c 64 48 65 6c 6c 6f 57 6f 72 6c 64 48 65 6c 6c 6f 57 6f 72 6c 64 48 65 6c 6c 6f 57 6f 72 6c 64 48 65 6c 6c 6f 57 6f 72 6c 64 48 65 6c 6c 6f 57 6f 72 6c 64 48 65 6c 6c 6f 57 6f 72 6c 64 48 65 6c 6c 6f 57 6f 72 6c 64 48 65 6c 6c 6f 57 6f 72 6c 64 48 65 6c 6c 6f 57 6f 72 6c 64 48 65 6c 6c 6f 57 6f 72 6c 64 48 65 6c 6c 6f 57 6f 72 6c 64 48 65 6c 6c 6f 57 6f 72 6c 64 48 65 6c 6c 6f 57 6f 72 6c 64 48 65 6c 6c 6f 57 6f 72 6c 64 48 65 6c 6c 6f 57 6f 72 6c 64 48 65 6c 6c 6f 57 6f 72 6c 64 48 65 6c 6c 6f 57 6f 72 6c 64 48 65 6c 6c 6f 57 6f 72 6c 64 48 65 6c 6c 6f 57 6f 72 6c 64 48 65 6c 6c 6f 57 6f 72 6c 64 48 65 6c 6c 6f 57 6f 72 6c 64"
6719071-6719092 spiflash: field: "Command: Read data (READ)" "Command: Read data" "Cmd: Read data" "Cmd: READ" "READ"
6719092-6719111 spiflash: bit: "Address bits 23..16: 0x12" "Addr bits 23..16: 0x12" "Addr bits 23..16" "A23..A16"
6719113-6719132 spiflash: bit: "Address bits 15..8: 0x02" "Addr bits 15..8: 0x02" "Addr bits 15..8" "A15..A8"
6719134-6719153 spiflash: bit: "Address bits 7..0: 0x00" "Addr bits 7..0: 0x00" "Addr bits 7..0" "A7..A0"
6719092-6719153 spiflash: field: "Address: 0x120200" "Addr: 0x120200" "0x120200"
6719159-6724490 spiflash: field: "Data (256 bytes)"
6719071-6763331 spiflash: read: "Read data (addr 0x120200, 256 bytes): 48 65 6c 6c 6f 57 6f 72 6c 64 48 65 6c 6c 6f 57 6f 72 6c 64 48 65 6c 6c 6f 57 6f 72 6c 64 48 65 6c 6c 6f 57 6f 72 6c 64 48 65 6c 6c 6f 57 6f 72 6c 64 48 65 6c 6c 6f 57 6f 72 6c 64 48 65 6c 6c 6f 57 6f 72 6c 64 48 65 6c 6c 6f 57 6f 72 6c 64 48 65 6c 6c 6f 57 6f 72 6c 64 48 65 6c 6c 6f 57 6f 72 6c 64 48 65 6c 6c 6f 57 6f 72 6c 64 48 65 6c 6c 6f 57 6f 72 6c 64 48 65 6c 6c 6f 57 6f 72 6c 64 48 65 6c 6c 6f 57 6f 72 6c 64 48 65 6c 6c 6f 57 6f 72 6c 64 48 65 6c 6c 6f 57 6f 72 6c 64 48 65 6c 6c 6f 57 6f 72 6c 64 48 65 6c 6c 6f 57 6f 72 6c 64 48 65 6c 6c 6f 57 6f 72 6c 64 48 65 6c 6c 6f 57 6f 72 6c 64 48 65 6c 6c 6f 57 6f 72 6c 64 48 65 6c 6c 6f 57 6f 72 6c 64 48 65 6c 6c 6f 57 6f 72 6c 64 48 65 6c 6c 6f 57 6f 72 6c 64 48 65 6c 6c 6f 57 6f 72 6c 64 48 65 6c 6c 6f 57"
6764890-6764911 spiflash: field: "Command: Read data (READ)" "Command: Read data" "Cmd: Read data" "Cmd: READ" "READ"
6764911-6764930 spiflash: bit: "Address bits 23..16: 0x12" "Addr bits 23..16: 0x12" "Addr bits 23..16" "A23..A16"
6764932-6764951 spiflash: bit: "Address bits 15..8: 0x03" "Addr bits 15..8: 0x03" "Addr bits 15..8" "A15..A8"
6764953-6764972 spiflash: bit: "Address bits 7..0: 0x00" "Addr bits 7..0: 0x00" "Addr bits 7..0" "A7..A0"
6764911-6764972 spiflash: field: "Address: 0x120300" "Addr: 0x120300" "0x120300"
6764978-6770309 spiflash: field: "Data (256 bytes)"
6764890-6814857 spiflash: read: "Read data (addr 0x120300, 256 bytes): 6f 72 6c 64 48 65 6c 6c 6f 57 6f 72 6c 64 48 65 6c 6c 6f 57 6f 72 6c 64 48 65 6c 6c 6f 57 6f 72 6c 64 48 65 6c 6c 6f 57 6f 72 6c 64 48 65 6c 6c 6f 57 6f 72 6c 64 48 65 6c 6c 6f 57 6f 72 6c 64 48 65 6c 6c 6f 57 6f 72 6c 64 48 65 6c 6c 6f 57 6f 72 6c 64 48 65 6c 6c 6f 57 6f 72 6c 64 48 65 6c 6c 6f 57 6f 72 6c 64 48 65 6c 6c 6f 57 6f 72 6c 64 48 65 6c 6c 6f 57 6f 72 6c 64 48 65 6c 6c 6f 57 6f 72 6c 64 48 65 6c 6c 6f 57 6f 72 6c 64 48 65 6c 6c 6f 57 6f 72 6c 64 48 65 6c 6c 6f 57 6f 72 6c 64 48 65 6c 6c 6f 57 6f 72 6c 64 48 65 6c 6c 6f 57 6f 72 6c 64 48 65 6c 6c 6f 57 6f 72 6c 64 48 65 6c 6c 6f 57 6f 72 6c 64 48 65 6c 6c 6f 57 6f 72 6c 64 48 65 6c 6c 6f 57 6f 72 6c 64 48 65 6c 6c 6f 57 6f 72 6c 64 48 65 6c 6c 6f 57 6f 72 6c 64 48 65 6c 6c 6f 57 6f 72 6c 64 48 65"
6819055-6819076 spiflash: field: "Command: Read data (READ)" "Command: Read data" "Cmd: Read data" "Cmd: READ" "READ"
6819076-6819097 spiflash: bit: "Address bits 23..16: 0x12" "Addr bits 23..16: 0x12" "Addr bits 23..16" "A23..A16"
6819097-6819118 spiflash: bit: "Address bits 15..8: 0x04" "Addr bits 15..8: 0x04" "Addr bits 15..8" "A15..A8"
6819118-6819137 spiflash: bit: "Address bits 7..0: 0x00" "Addr bits 7..0: 0x00" "Addr bits 7..0" "A7..A0"
6819076-6819137 spiflash: field: "Address: 0x120400" "Addr: 0x120400" "0x120400"
6819143-6824476 spiflash: field: "Data (256 bytes)"
6819055-6864847 spiflash: read: "Read data (addr 0x120400, 256 bytes): 6c 6c 6f 57 6f 72 6c 64 48 65 6c 6c 6f 57 6f 72 6c 64 48 65 6c 6c 6f 57 6f 72 6c 64 48 65 6c 6c 6f 57 6f 72 6c 64 48 65 6c 6c 6f 57 6f 72 6c 64 48 65 6c 6c 6f 57 6f 72 6c 64 48 65 6c 6c 6f 57 6f 72 6c 64 48 65 6c 6c 6f 57 6f 72 6c 64 48 65 6c 6c 6f 57 6f 72 6c 64 48 65 6c 6c 6f 57 6f 72 6c 64 48 65 6c 6c 6f 57 6f 72 6c 64 48 65 6c 6c 6f 57 6f 72 6c 64 48 65 6c 6c 6f 57 6f 72 6c 64 48 65 6c 6c 6f 57 6f 72 6c 64 48 65 6c 6c 6f 57 6f 72 6c 64 48 65 6c 6c 6f 57 6f 72 6c 64 48 65 6c 6c 6f 57 6f 72 6c 64 48 65 6c 6c 6f 57 6f 72 6c 64 48 65 6c 6c 6f 57 6f 72 6c 64 48 65 6c 6c 6f 57 6f 72 6c 64 48 65 6c 6c 6f 57 6f 72 6c 64 48 65 6c 6c 6f 57 6f 72 6c 64 48 65 6c 6c 6f 57 6f 72 6c 64 48 65 6c 6c 6f 57 6f 72 6c 64 48 65 6c 6c 6f 57 6f 72 6c 64 48 65 6c 6c 6f 57 6f 72"
6869051-6869070 spiflash: field: "Command: Read data (READ)" "Command: Read data" "Cmd: Read data" "Cmd: READ" "READ"
6869072-6869091 spiflash: bit: "Address bits 23..16: 0x12" "Addr bits 23..16: 0x12" "Addr bits 23..16" "A23..A16"
6869093-6869112 spiflash: bit: "Address bits 15..8: 0x05" "Addr bits 15..8: 0x05" "Addr bits 15..8" "A15..A8"
6869113-6869134 spiflash: bit: "Address bits 7..0: 0x00" "Addr bits 7..0: 0x00" "Addr bits 7..0" "A7..A0"
6869072-6869134 spiflash: field: "Address: 0x120500" "Addr: 0x120500" "0x120500"
6869138-6874470 spiflash: field: "Data (256 bytes)"
6869051-6914980 spiflash: read: "Read data (addr 0x120500, 256 bytes): 6c 64 48 65 6c 6c 6f 57 6f 72 6c 64 48 65 6c 6c 6f 57 6f 72 6c 64 48 65 6c 6c 6f 57 6f 72 6c 64 48 65 6c 6c 6f 57 6f 72 6c 64 48 65 6c 6c 6f 57 6f 72 6c 64 48 65 6c 6c 6f 57 6f 72 6c 64 48 65 6c 6c 6f 57 6f 72 6c 64 48 65 6c 6c 6f 57 6f 72 6c 64 48 65 6c 6c 6f 57 6f 72 6c 64 48 65 6c 6c 6f 57 6f 72 6c 64 48 65 6c 6c 6f 57 6f 72 6c 64 48 65 6c 6c 6f 57 6f 72 6c 64 48 65 6c 6c 6f 57 6f 72 6c 64 48 65 6c 6c 6f 57 6f 72 6c 64 48 65 6c 6c 6f 57 6f 72 6c 64 48 65 6c 6c 6f 57 6f 72 6c 64 48 65 6c 6c 6f 57 6f 72 6c 64 48 65 6c 6c 6f 57 6f 72 6c 64 48 65 6c 6c 6f 57 6f 72 6c 64 48 65 6c 6c 6f 57 6f 72 6c 64 48 65 6c 6c 6f 57 6f 72 6c 64 48 65 6c 6c 6f 57 6f 72 6c 64 48 65 6c 6c 6f 57 6f 72 6c 64 48 65 6c 6c 6f 57 6f 72 6c 64 48 65 6c 6c 6f 57 6f 72 6c 64 48 65 6c 6c"
6918934-6918953 spiflash: field: "Command: Read data (READ)" "Command: Read data" "Cmd: Read data" "Cmd: READ" "READ"
6918954-6918975 spiflash: bit: "Address bits 23..16: 0x12" "Addr bits 23..16: 0x12" "Addr bits 23..16" "A23..A16"
6918975-6918996 spiflash: bit: "Address bits 15..8: 0x06" "Addr bits 15..8: 0x06" "Addr bits 15..8" "A15..A8"
6918996-6919017 spiflash: bit: "Address bits 7..0: 0x00" "Addr bits 7..0: 0x00" "Addr bits 7..0" "A7..A0"
6918954-6919017 spiflash: field: "Address: 0x120600" "Addr: 0x120600" "0x120600"
6919021-6924354 spiflash: field: "Data (256 bytes)"
6918934-6965368 spiflash: read: "Read data (addr 0x120600, 256 bytes): 6f 57 6f 72 6c 64 48 65 6c 6c 6f 57 6f 72 6c 64 48 65 6c 6c 6f 57 6f 72 6c 64 48 65 6c 6c 6f 57 6f 72 6c 64 48 65 6c 6c 6f 57 6f 72 6c 64 48 65 6c 6c 6f 57 6f 72 6c 64 48 65 6c 6c 6f 57 6f 72 6c 64 48 65 6c 6c 6f 57 6f 72 6c 64 48 65 6c 6c 6f 57 6f 72 6c 64 48 65 6c 6c 6f 57 6f 72 6c 64 48 65 6c 6c 6f 57 6f 72 6c 64 48 65 6c 6c 6f 57 6f 72 6c 64 48 65 6c 6c 6f 57 6f 72 6c 64 48 65 6c 6c 6f 57 6f 72 6c 64 48 65 6c 6c 6f 57 6f 72 6c 64 48 65 6c 6c 6f 57 6f 72 6c 64 48 65 6c 6c 6f 57 6f 72 6c 64 48 65 6c 6c 6f 57 6f 72 6c 64 48 65 6c 6c 6f 57 6f 72 6c 64 48 65 6c 6c 6f 57 6f 72 6c 64 48 65 6c 6c 6f 57 6f 72 6c 64 48 65 6c 6c 6f 57 6f 72 6c 64 48 65 6c 6c 6f 57 6f 72 6c 64 48 65 6c 6c 6f 57 6f 72 6c 64 48 65 6c 6c 6f 57 6f 72 6c 64 48 65 6c 6c 6f 57 6f 72 6c 64"
6969032-6969051 spiflash: field: "Command: Read data (READ)" "Command: Read data" "Cmd: Read data" "Cmd: READ" "READ"
6969052-6969073 spiflash: bit: "Address bits 23..16: 0x12" "Addr bits 23..16: 0x12" "Addr bits 23..16" "A23..A16"
6969073-6969094 spiflash: bit: "Address bits 15..8: 0x07" "Addr bits 15..8: 0x07" "Addr bits 15..8" "A15..A8"
6969094-6969115 spiflash: bit: "Address bits 7..0: 0x00" "Addr bits 7..0: 0x00" "Addr bits 7..0" "A7..A0"
6969052-6969115 spiflash: field: "Address: 0x120700" "Addr: 0x120700" "0x120700"
6969119-6974452 spiflash: field: "Data (256 bytes)"
6969032-7014969 spiflash: read: "Read data (addr 0x120700, 256 bytes): 48 65 6c 6c 6f 57 6f 72 6c 64 48 65 6c 6c 6f 57 6f 72 6c 64 48 65 6c 6c 6f 57 6f 72 6c 64 48 65 6c 6c 6f 57 6f 72 6c 64 48 65 6c 6c 6f 57 6f 72 6c 64 48 65 6c 6c 6f 57 6f 72 6c 64 48 65 6c 6c 6f 57 6f 72 6c 64 48 65 6c 6c 6f 57 6f 72 6c 64 48 65 6c 6c 6f 57 6f 72 6c 64 48 65 6c 6c 6f 57 6f 72 6c 64 48 65 6c 6c 6f 57 6f 72 6c 64 48 65 6c 6c 6f 57 6f 72 6c 64 48 65 6c 6c 6f 57 6f 72 6c 64 48 65 6c 6c 6f 57 6f 72 6c 64 48 65 6c 6c 6f 57 6f 72 6c 64 48 65 6c 6c 6f 57 6f 72 6c 64 48 65 6c 6c 6f 57 6f 72 6c 64 48 65 6c 6c 6f 57 6f 72 6c 64 48 65 6c 6c 6f 57 6f 72 6c 64 48 65 6c 6c 6f 57 6f 72 6c 64 48 65 6c 6c 6f 57 6f 72 6c 64 48 65 6c 6c 6f 57 6f 72 6c 64 48 65 6c 6c 6f 57 6f 72 6c 64 48 65 6c 6c 6f 57 6f 72 6c 64 48 65 6c 6c 6f 57 6f 72 6c 64 48 65 6c 6c 6f 57"
7019990-7020011 spiflash: field: "Command: Read data (READ)" "Command: Read data" "Cmd: Read data" "Cmd: READ" "READ"
7020011-7020032 spiflash: bit: "Address bits 23..16: 0x12" "Addr bits 23..16: 0x12" "Addr bits 23..16" "A23..A16"
7020032-7020053 spiflash: bit: "Address bits 15..8: 0x08" "Addr bits 15..8: 0x08" "Addr bits 15..8" "A15..A8"
7020053-7020072 spiflash: bit: "Address bits 7..0: 0x00" "Addr bits 7..0: 0x00" "Addr bits 7..0" "A7..A0"
7020011-7020072 spiflash: field: "Address: 0x120800" "Addr: 0x120800" "0x120800"
7020078-7025411 spiflash: field: "Data (256 bytes)"
7019990-7065345 spiflash: read: "Read data (addr 0x120800, 256 bytes): 6f 72 6c 64 48 65 6c 6c 6f 57 6f 72 6c 64 48 65 6c 6c 6f 57 6f 72 6c 64 48 65 6c 6c 6f 57 6f 72 6c 64 48 65 6c 6c 6f 57 6f 72 6c 64 48 65 6c 6c 6f 57 6f 72 6c 64 48 65 6c 6c 6f 57 6f 72 6c 64 48 65 6c 6c 6f 57 6f 72 6c 64 48 65 6c 6c 6f 57 6f 72 6c 64 48 65 6c 6c 6f 57 6f 72 6c 64 48 65 6c 6c 6f 57 6f 72 6c 64 48 65 6c 6c 6f 57 6f 72 6c 64 48 65 6c 6c 6f 57 6f 72 6c 64 48 65 6c 6c 6f 57 6f 72 6c 64 48 65 6c 6c 6f 57 6f 72 6c 64 48 65 6c 6c 6f 57 6f 72 6c 64 48 65 6c 6c 6f 57 6f 72 6c 64 48 65 6c 6c 6f 57 6f 72 6c 64 48 65 6c 6c 6f 57 6f 72 6c 64 48 65 6c 6c 6f 57 6f 72 6c 64 48 65 6c 6c 6f 57 6f 72 6c 64 48 65 6c 6c 6f 57 6f 72 6c 64 48 65 6c 6c 6f 57 6f 72 6c 64 48 65 6c 6c 6f 57 6f 72 6c 64 48 65 6c 6c 6f 57 6f 72 6c 64 48 65 6c 6c 6f 57 6f 72 6c 64 48 65"
7069013-7069034 spiflash: field: "Command: Read data (READ)" "Command: Read data" "Cmd: Read data" "Cmd: READ" "READ"
7069034-7069053 spiflash: bit: "Address bits 23..16: 0x12" "Addr bits 23..16: 0x12" "Addr bits 23..16" "A23..A16"
7069055-7069074 spiflash: bit: "Address bits 15..8: 0x09" "Addr bits 15..8: 0x09" "Addr bits 15..8" "A15..A8"
7069076-7069095 spiflash: bit: "Address bits 7..0: 0x00" "Addr bits 7..0: 0x00" "Addr bits 7..0" "A7..A0"
7069034-7069095 spiflash: field: "Address: 0x120900" "Addr: 0x120900" "0x120900"
7069101-7074432 spiflash: field: "Data (256 bytes)"
7069013-7114950 spiflash: read: "Read data (addr 0x120900, 256 bytes): 6c 6c 6f 57 6f 72 6c 64 48 65 6c 6c 6f 57 6f 72 6c 64 48 65 6c 6c 6f 57 6f 72 6c 64 48 65 6c 6c 6f 57 6f 72 6c 64 48 65 6c 6c 6f 57 6f 72 6c 64 48 65 6c 6c 6f 57 6f 72 6c 64 48 65 6c 6c 6f 57 6f 72 6c 64 48 65 6c 6c 6f 57 6f 72 6c 64 48 65 6c 6c 6f 57 6f 72 6c 64 48 65 6c 6c 6f 57 6f 72 6c 64 48 65 6c 6c 6f 57 6f 72 6c 64 48 65 6c 6c 6f 57 6f 72 6c 64 48 65 6c 6c 6f 57 6f 72 6c 64 48 65 6c 6c 6f 57 6f 72 6c 64 48 65 6c 6c 6f 57 6f 72 6c 64 48 65 6c 6c 6f 57 6f 72 6c 64 48 65 6c 6c 6f 57 6f 72 6c 64 48 65 6c 6c 6f 57 6f 72 6c 64 48 65 6c 6c 6f 57 6f 72 6c 64 48 65 6c 6c 6f 57 6f 72 6c 64 48 65 6c 6c 6f 57 6f 72 6c 64 48 65 6c 6c 6f 57 6f 72 6c 64 48 65 6c 6c 6f 57 6f 72 6c 64 48 65 6c 6c 6f 57 6f 72 6c 64 48 65 6c 6c 6f 57 6f 72 6c 64 48 65 6c 6c 6f 57 6f 72"
7119015-7119034 spiflash: field: "Command: Read data (READ)" "Command: Read data" "Cmd: Read data" "Cmd: READ" "READ"
7119036-7119055 spiflash: bit: "Address bits 23..16: 0x12" "Addr bits 23..16: 0x12" "Addr bits 23..16" "A23..A16"
7119056-7119077 spiflash: bit: "Address bits 15..8: 0x0a" "Addr bits 15..8: 0x0a" "Addr bits 15..8" "A15..A8"
7119077-7119098 spiflash: bit: "Address bits 7..0: 0x00" "Addr bits 7..0: 0x00" "Addr bits 7..0" "A7..A0"
7119036-7119098 spiflash: field: "Address: 0x120a00" "Addr: 0x120a00" "0x120a00"
7119102-7124434 spiflash: field: "Data (256 bytes)"
7119015-7165334 spiflash: read: "Read data (addr 0x120a00, 256 bytes): 6c 64 48 65 6c 6c 6f 57 6f 72 6c 64 48 65 6c 6c 6f 57 6f 72 6c 64 48 65 6c 6c 6f 57 6f 72 6c 64 48 65 6c 6c 6f 57 6f 72 6c 64 48 65 6c 6c 6f 57 6f 72 6c 64 48 65 6c 6c 6f 57 6f 72 6c 64 48 65 6c 6c 6f 57 6f 72 6c 64 48 65 6c 6c 6f 57 6f 72 6c 64 48 65 6c 6c 6f 57 6f 72 6c 64 48 65 6c 6c 6f 57 6f 72 6c 64 48 65 6c 6c 6f 57 6f 72 6c 64 48 65 6c 6c 6f 57 6f 72 6c 64 48 65 6c 6c 6f 57 6f 72 6c 64 48 65 6c 6c 6f 57 6f 72 6c 64 48 65 6c 6c 6f 57 6f 72 6c 64 48 65 6c 6c 6f 57 6f 72 6c 64 48 65 6c 6c 6f 57 6f 72 6c 64 48 65 6c 6c 6f 57 6f 72 6c 64 48 65 6c 6c 6f 57 6f 72 6c 64 48 65 6c 6c 6f 57 6f 72 6c 64 48 65 6c 6c 6f 57 6f 72 6c 64 48 65 6c 6c 6f 57 6f 72 6c 64 48 65 6c 6c 6f 57 6f 72 6c 64 48 65 6c 6c 6f 57 6f 72 6c 64 48 65 6c 6c 6f 57 6f 72 6c 64 48 65 6c 6c"
7169143-7169162 spiflash: field: "Command: Read data (READ)" "Command: Read data" "Cmd: Read data" "Cmd: READ" "READ"
7169164-7169183 spiflash: bit: "Address bits 23..16: 0x12" "Addr bits 23..16: 0x12" "Addr bits 23..16" "A23..A16"
7169185-7169204 spiflash: bit: "Address bits 15..8: 0x0b" "Addr bits 15..8: 0x0b" "Addr bits 15..8" "A15..A8"
7169205-7169226 spiflash: bit: "Address bits 7..0: 0x00" "Addr bits 7..0: 0x00" "Addr bits 7..0" "A7..A0"
7169164-7169226 spiflash: field: "Address: 0x120b00" "Addr: 0x120b00" "0x120b00"
7169230-7174562 spiflash: field: "Data (256 bytes)"
7169143-7214938 spiflash: read: "Read data (addr 0x120b00, 256 bytes): 6f 57 6f 72 6c 64 48 65 6c 6c 6f 57 6f 72 6c 64 48 65 6c 6c 6f 57 6f 72 6c 64 48 65 6c 6c 6f 57 6f 72 6c 64 48 65 6c 6c 6f 57 6f 72 6c 64 48 65 6c 6c 6f 57 6f 72 6c 64 48 65 6c 6c 6f 57 6f 72 6c 64 48 65 6c 6c 6f 57 6f 72 6c 64 48 65 6c 6c 6f 57 6f 72 6c 64 48 65 6c 6c 6f 57 6f 72 6c 64 48 65 6c 6c 6f 57 6f 72 6c 64 48 65 6c 6c 6f 57 6f 72 6c 64 48 65 6c 6c 6f 57 6f 72 6c 64 48 65 6c 6c 6f 57 6f 72 6c 64 48 65 6c 6c 6f 57 6f 72 6c 64 48 65 6c 6c 6f 57 6f 72 6c 64 48 65 6c 6c 6f 57 6f 72 6c 64 48 65 6c 6c 6f 57 6f 72 6c 64 48 65 6c 6c 6f 57 6f 72 6c 64 48 65 6c 6c 6f 57 6f 72 6c 64 48 65 6c 6c 6f 57 6f 72 6c 64 48 65 6c 6c 6f 57 6f 72 6c 64 48 65 6c 6c 6f 57 6f 72 6c 64 48 65 6c 6c 6f 57 6f 72 6c 64 48 65 6c 6c 6f 57 6f 72 6c 64 48 65 6c 6c 6f 57 6f 72 6c 64"
7218995-7219014 spiflash: field: "Command: Read data (READ)" "Command: Read data" "Cmd: Read data" "Cmd: READ" "READ"
7219015-7219036 spiflash: bit: "Address bits 23..16: 0x12" "Addr bits 23..16: 0x12" "Addr bits 23..16" "A23..A16"
7219036-7219057 spiflash: bit: "Address bits 15..8: 0x0c" "Addr bits 15..8: 0x0c" "Addr bits 15..8" "A15..A8"
7219057-7219078 spiflash: bit: "Address bits 7..0: 0x00" "Addr bits 7..0: 0x00" "Addr bits 7..0" "A7..A0"
7219015-7219078 spiflash: field: "Address: 0x120c00" "Addr: 0x120c00" "0x120c00"
7219082-7224414 spiflash: field: "Data (256 bytes)"
7218995-7265332 spiflash: read: "Read data (addr 0x120c00, 256 bytes): 48 65 6c 6c 6f 57 6f 72 6c 64 48 65 6c 6c 6f 57 6f 72 6c 64 48 65 6c 6c 6f 57 6f 72 6c 64 48 65 6c 6c 6f 57 6f 72 6c 64 48 65 6c 6c 6f 57 6f 72 6c 64 48 65 6c 6c 6f 57 6f 72 6c 64 48 65 6c 6c 6f 57 6f 72 6c 64 48 65 6c 6c 6f 57 6f 72 6c 64 48 65 6c 6c 6f 57 6f 72 6c 64 48 65 6c 6c 6f 57 6f 72 6c 64 48 65 6c 6c 6f 57 6f 72 6c 64 48 65 6c 6c 6f 57 6f 72 6c 64 48 65 6c 6c 6f 57 6f 72 6c 64 48 65 6c 6c 6f 57 6f 72 6c 64 48 65 6c 6c 6f 57 6f 72 6c 64 48 65 6c 6c 6f 57 6f 72 6c 64 48 65 6c 6c 6f 57 6f 72 6c 64 48 65 6c 6c 6f 57 6f 72 6c 64 48 65 6c 6c 6f 57 6f 72 6c 64 48 65 6c 6c 6f 57 6f 72 6c 64 48 65 6c 6c 6f 57 6f 72 6c 64 48 65 6c 6c 6f 57 6f 72 6c 64 48 65 6c 6c 6f 57 6f 72 6c 64 48 65 6c 6c 6f 57 6f 72 6c 64 48 65 6c 6c 6f 57 6f 72 6c 64 48 65 6c 6c 6f 57"
7268993-7269014 spiflash: field: "Command: Read data (READ)" "Command: Read data" "Cmd: Read data" "Cmd: READ" "READ"
7269014-7269033 spiflash: bit: "Address bits 23..16: 0x12" "Addr bits 23..16: 0x12" "Addr bits 23..16" "A23..A16"
7269035-7269054 spiflash: bit: "Address bits 15..8: 0x0d" "Addr bits 15..8: 0x0d" "Addr bits 15..8" "A15..A8"
7269056-7269075 spiflash: bit: "Address bits 7..0: 0x00" "Addr bits 7..0: 0x00" "Addr bits 7..0" "A7..A0"
7269014-7269075 spiflash: field: "Address: 0x120d00" "Addr: 0x120d00" "0x120d00"
7269081-7274412 spiflash: field: "Data (256 bytes)"
7268993-7313350 spiflash: read: "Read data (addr 0x120d00, 256 bytes): 6f 72 6c 64 48 65 6c 6c 6f 57 6f 72 6c 64 48 65 6c 6c 6f 57 6f 72 6c 64 48 65 6c 6c 6f 57 6f 72 6c 64 48 65 6c 6c 6f 57 6f 72 6c 64 48 65 6c 6c 6f 57 6f 72 6c 64 48 65 6c 6c 6f 57 6f 72 6c 64 48 65 6c 6c 6f 57 6f 72 6c 64 48 65 6c 6c 6f 57 6f 72 6c 64 48 65 6c 6c 6f 57 6f 72 6c 64 48 65 6c 6c 6f 57 6f 72 6c 64 48 65 6c 6c 6f 57 6f 72 6c 64 48 65 6c 6c 6f 57 6f 72 6c 64 48 65 6c 6c 6f 57 6f 72 6c 64 48 65 6c 6c 6f 57 6f 72 6c 64 48 65 6c 6c 6f 57 6f 72 6c 64 48 65 6c 6c 6f 57 6f 72 6c 64 48 65 6c 6c 6f 57 6f 72 6c 64 48 65 6c 6c 6f 57 6f 72 6c 64 48 65 6c 6c 6f 57 6f 72 6c 64 48 65 6c 6c 6f 57 6f 72 6c 64 48 65 6c 6c 6f 57 6f 72 6c 64 48 65 6c 6c 6f 57 6f 72 6c 64 48 65 6c 6c 6f 57 6f 72 6c 64 48 65 6c 6c 6f 57 6f 72 6c 64 48 65 6c 6c 6f 57 6f 72 6c 64 48 65"
7315871-7315892 spiflash: field: "Command: Read data (READ)" "Command: Read data" "Cmd: Read data" "Cmd: READ" "READ"
7315892-7315911 spiflash: bit: "Address bits 23..16: 0x12" "Addr bits 23..16: 0x12" "Addr bits 23..16" "A23..A16"
7315913-7315932 spiflash: bit: "Address bits 15..8: 0x0e" "Addr bits 15..8: 0x0e" "Addr bits 15..8" "A15..A8"
7315934-7315953 spiflash: bit: "Address bits 7..0: 0x00" "Addr bits 7..0: 0x00" "Addr bits 7..0" "A7..A0"
7315892-7315953 spiflash: field: "Address: 0x120e00" "Addr: 0x120e00" "0x120e00"
7315959-7321292 spiflash: field: "Data (256 bytes)"
7315871-7363678 spiflash: read: "Read data (addr 0x120e00, 256 bytes): 6c 6c 6f 57 6f 72 6c 64 48 65 6c 6c 6f 57 6f 72 6c 64 48 65 6c 6c 6f 57 6f 72 6c 64 48 65 6c 6c 6f 57 6f 72 6c 64 48 65 6c 6c 6f 57 6f 72 6c 64 48 65 6c 6c 6f 57 6f 72 6c 64 48 65 6c 6c 6f 57 6f 72 6c 64 48 65 6c 6c 6f 57 6f 72 6c 64 48 65 6c 6c 6f 57 6f 72 6c 64 48 65 6c 6c 6f 57 6f 72 6c 64 48 65 6c 6c 6f 57 6f 72 6c 64 48 65 6c 6c 6f 57 6f 72 6c 64 48 65 6c 6c 6f 57 6f 72 6c 64 48 65 6c 6c 6f 57 6f 72 6c 64 48 65 6c 6c 6f 57 6f 72 6c 64 48 65 6c 6c 6f 57 6f 72 6c 64 48 65 6c 6c 6f 57 6f 72 6c 64 48 65 6c 6c 6f 57 6f 72 6c 64 48 65 6c 6c 6f 57 6f 72 6c 64 48 65 6c 6c 6f 57 6f 72 6c 64 48 65 6c 6c 6f 57 6f 72 6c 64 48 65 6c 6c 6f 57 6f 72 6c 64 48 65 6c 6c 6f 57 6f 72 6c 64 48 65 6c 6c 6f 57 6f 72 6c 64 48 65 6c 6c 6f 57 6f 72 6c 64 48 65 6c 6c 6f 57 6f 72"
7367920-7367939 spiflash: field: "Command: Read data (READ)" "Command: Read data" "Cmd: Read data" "Cmd: READ" "READ"
7367941-7367960 spiflash: bit: "Address bits 23..16: 0x12" "Addr bits 23..16: 0x12" "Addr bits 23..16" "A23..A16"
7367962-7367981 spiflash: bit: "Address bits 15..8: 0x0f" "Addr bits 15..8: 0x0f" "Addr bits 15..8" "A15..A8"
7367982-7368003 spiflash: bit: "Address bits 7..0: 0x00" "Addr bits 7..0: 0x00" "Addr bits 7..0" "A7..A0"
7367941-7368003 spiflash: field: "Address: 0x120f00" "Addr: 0x120f00" "0x120f00"
7368007-7373339 spiflash: field: "Data (256 bytes)"
7367920-7415302 spiflash: read: "Read data (addr 0x120f00, 256 bytes): 6c 64 48 65 6c 6c 6f 57 6f 72 6c 64 48 65 6c 6c 6f 57 6f 72 6c 64 48 65 6c 6c 6f 57 6f 72 6c 64 48 65 6c 6c 6f 57 6f 72 6c 64 48 65 6c 6c 6f 57 6f 72 6c 64 48 65 6c 6c 6f 57 6f 72 6c 64 48 65 6c 6c 6f 57 6f 72 6c 64 48 65 6c 6c 6f 57 6f 72 6c 64 48 65 6c 6c 6f 57 6f 72 6c 64 48 65 6c 6c 6f 57 6f 72 6c 64 48 65 6c 6c 6f 57 6f 72 6c 64 48 65 6c 6c 6f 57 6f 72 6c 64 48 65 6c 6c 6f 57 6f 72 6c 64 48 65 6c 6c 6f 57 6f 72 6c 64 48 65 6c 6c 6f 57 6f 72 6c 64 48 65 6c 6c 6f 57 6f 72 6c 64 48 65 6c 6c 6f 57 6f 72 6c 64 48 65 6c 6c 6f 57 6f 72 6c 64 48 65 6c 6c 6f 57 6f 72 6c 64 48 65 6c 6c 6f 57 6f 72 6c 64 48 65 6c 6c 6f 57 6f 72 6c 64 48 65 6c 6c 6f 57 6f 72 6c 64 48 65 6c 6c 6f 57 6f 72 6c 64 48 65 6c 6c 6f 57 6f 72 6c 64 48 65 6c 6c 6f 57 6f 72 6c 64 48 65 6c 6c"
7417921-7417940 spiflash: field: "Command: Read data (READ)" "Command: Read data" "Cmd: Read data" "Cmd: READ" "READ"
7417942-7417961 spiflash: bit: "Address bits 23..16: 0x12" "Addr bits 23..16: 0x12" "Addr bits 23..16" "A23..A16"
7417963-7417982 spiflash: bit: "Address bits 15..8: 0x10" "Addr bits 15..8: 0x10" "Addr bits 15..8" "A15..A8"
7417983-7418004 spiflash: bit: "Address bits 7..0: 0x00" "Addr bits 7..0: 0x00" "Addr bits 7..0" "A7..A0"
7417942-7418004 spiflash: field: "Address: 0x121000" "Addr: 0x121000" "0x121000"
7418008-7423340 spiflash: field: "Data (256 bytes)"
7417921-7465299 spiflash: read: "Read data (addr 0x121000, 256 bytes): 6f 57 6f 72 6c 64 48 65 6c 6c 6f 57 6f 72 6c 64 48 65 6c 6c 6f 57 6f 72 6c 64 48 65 6c 6c 6f 57 6f 72 6c 64 48 65 6c 6c 6f 57 6f 72 6c 64 48 65 6c 6c 6f 57 6f 72 6c 64 48 65 6c 6c 6f 57 6f 72 6c 64 48 65 6c 6c 6f 57 6f 72 6c 64 48 65 6c 6c 6f 57 6f 72 6c 64 48 65 6c 6c 6f 57 6f 72 6c 64 48 65 6c 6c 6f 57 6f 72 6c 64 48 65 6c 6c 6f 57 6f 72 6c 64 48 65 6c 6c 6f 57 6f 72 6c 64 48 65 6c 6c 6f 57 6f 72 6c 64 48 65 6c 6c 6f 57 6f 72 6c 64 48 65 6c 6c 6f 57 6f 72 6c 64 48 65 6c 6c 6f 57 6f 72 6c 64 48 65 6c 6c 6f 57 6f 72 6c 64 48 65 6c 6c 6f 57 6f 72 6c 64 48 65 6c 6c 6f 57 6f 72 6c 64 48 65 6c 6c 6f 57 6f 72 6c 64 48 65 6c 6c 6f 57 6f 72 6c 64 48 65 6c 6c 6f 57 6f 72 6c 64 48 65 6c 6c 6f 57 6f 72 6c 64 48 65 6c 6c 6f 57 6f 72 6c 64 48 65 6c 6c 6f 57 6f 72 6c 64"
7468968-7468989 spiflash: field: "Command: Read data (READ)" "Command: Read data" "Cmd: Read data" "Cmd: READ" "READ"
7468989-7469008 spiflash: bit: "Address bits 23..16: 0x12" "Addr bits 23..16: 0x12" "Addr bits 23..16" "A23..A16"
7469010-7469029 spiflash: bit: "Address bits 15..8: 0x11" "Addr bits 15..8: 0x11" "Addr bits 15..8" "A15..A8"
7469031-7469050 spiflash: bit: "Address bits 7..0: 0x00" "Addr bits 7..0: 0x00" "Addr bits 7..0" "A7..A0"
7468989-7469050 spiflash: field: "Address: 0x121100" "Addr: 0x121100" "0x121100"
7469056-7474387 spiflash: field: "Data (256 bytes)"
7468968-7514901 spiflash: read: "Read data (addr 0x121100, 256 bytes): 48 65 6c 6c 6f 57 6f 72 6c 64 48 65 6c 6c 6f 57 6f 72 6c 64 48 65 6c 6c 6f 57 6f 72 6c 64 48 65 6c 6c 6f 57 6f 72 6c 64 48 65 6c 6c 6f 57 6f 72 6c 64 48 65 6c 6c 6f 57 6f 72 6c 64 48 65 6c 6c 6f 57 6f 72 6c 64 48 65 6c 6c 6f 57 6f 72 6c 64 48 65 6c 6c 6f 57 6f 72 6c 64 48 65 6c 6c 6f 57 6f 72 6c 64 48 65 6c 6c 6f 57 6f 72 6c 64 48 65 6c 6c 6f 57 6f 72 6c 64 48 65 6c 6c 6f 57 6f 72 6c 64 48 65 6c 6c 6f 57 6f 72 6c 64 48 65 6c 6c 6f 57 6f 72 6c 64 48 65 6c 6c 6f 57 6f 72 6c 64 48 65 6c 6c 6f 57 6f 72 6c 64 48 65 6c 6c 6f 57 6f 72 6c 64 48 65 6c 6c 6f 57 6f 72 6c 64 48 65 6c 6c 6f 57 6f 72 6c 64 48 65 6c 6c 6f 57 6f 72 6c 64 48 65 6c 6c 6f 57 6f 72 6c 64 48 65 6c 6c 6f 57 6f 72 6c 64 48 65 6c 6c 6f 57 6f 72 6c 64 48 65 6c 6c 6f 57 6f 72 6c 64 48 65 6c 6c 6f 57"
7518957-7518978 spiflash: field: "Command: Read data (READ)" "Command: Read data" "Cmd: Read data" "Cmd: READ" "READ"
7518978-7518999 spiflash: bit: "Address bits 23..16: 0x12" "Addr bits 23..16: 0x12" "Addr bits 23..16" "A23..A16"
7518999-7519020 spiflash: bit: "Address bits 15..8: 0x12" "Addr bits 15..8: 0x12" "Addr bits 15..8" "A15..A8"
7519020-7519039 spiflash: bit: "Address bits 7..0: 0x00" "Addr bits 7..0: 0x00" "Addr bits 7..0" "A7..A0"
7518978-7519039 spiflash: field: "Address: 0x121200" "Addr: 0x121200" "0x121200"
7519045-7524378 spiflash: field: "Data (256 bytes)"
7518957-7564895 spiflash: read: "Read data (addr 0x121200, 256 bytes): 6f 72 6c 64 48 65 6c 6c 6f 57 6f 72 6c 64 48 65 6c 6c 6f 57 6f 72 6c 64 48 65 6c 6c 6f 57 6f 72 6c 64 48 65 6c 6c 6f 57 6f 72 6c 64 48 65 6c 6c 6f 57 6f 72 6c 64 48 65 6c 6c 6f 57 6f 72 6c 64 48 65 6c 6c 6f 57 6f 72 6c 64 48 65 6c 6c 6f 57 6f 72 6c 64 48 65 6c 6c 6f 57 6f 72 6c 64 48 65 6c 6c 6f 57 6f 72 6c 64 48 65 6c 6c 6f 57 6f 72 6c 64 48 65 6c 6c 6f 57 6f 72 6c 64 48 65 6c 6c 6f 57 6f 72 6c 64 48 65 6c 6c 6f 57 6f 72 6c 64 48 65 6c 6c 6f 57 6f 72 6c 64 48 65 6c 6c 6f 57 6f 72 6c 64 48 65 6c 6c 6f 57 6f 72 6c 64 48 65 6c 6c 6f 57 6f 72 6c 64 48 65 6c 6c 6f 57 6f 72 6c 64 48 65 6c 6c 6f 57 6f 72 6c 64 48 65 6c 6c 6f 57 6f 72 6c 64 48 65 6c 6c 6f 57 6f 72 6c 64 48 65 6c 6c 6f 57 6f 72 6c 64 48 65 6c 6c 6f 57 6f 72 6c 64 48 65 6c 6c 6f 57 6f 72 6c 64 48 65"
7568945-7568964 spiflash: field: "Command: Read data (READ)" "Command: Read data" "Cmd: Read data" "Cmd: READ" "READ"
7568966-7568985 spiflash: bit: "Address bits 23..16: 0x12" "Addr bits 23..16: 0x12" "Addr bits 23..16" "A23..A16"
7568987-7569006 spiflash: bit: "Address bits 15..8: 0x13" "Addr bits 15..8: 0x13" "Addr bits 15..8" "A15..A8"
7569007-7569028 spiflash: bit: "Address bits 7..0: 0x00" "Addr bits 7..0: 0x00" "Addr bits 7..0" "A7..A0"
7568966-7569028 spiflash: field: "Address: 0x121300" "Addr: 0x121300" "0x121300"
7569032-7574364 spiflash: field: "Data (256 bytes)"
7568945-7614893 spiflash: read: "Read data (addr 0x121300, 256 bytes): 6c 6c 6f 57 6f 72 6c 64 48 65 6c 6c 6f 57 6f 72 6c 64 48 65 6c 6c 6f 57 6f 72 6c 64 48 65 6c 6c 6f 57 6f 72 6c 64 48 65 6c 6c 6f 57 6f 72 6c 64 48 65 6c 6c 6f 57 6f 72 6c 64 48 65 6c 6c 6f 57 6f 72 6c 64 48 65 6c 6c 6f 57 6f 72 6c 64 48 65 6c 6c 6f 57 6f 72 6c 64 48 65 6c 6c 6f 57 6f 72 6c 64 48 65 6c 6c 6f 57 6f 72 6c 64 48 65 6c 6c 6f 57 6f 72 6c 64 48 65 6c 6c 6f 57 6f 72 6c 64 48 65 6c 6c 6f 57 6f 72 6c 64 48 65 6c 6c 6f 57 6f 72 6c 64 48 65 6c 6c 6f 57 6f 72 6c 64 48 65 6c 6c 6f 57 6f 72 6c 64 48 65 6c 6c 6f 57 6f 72 6c 64 48 65 6c 6c 6f 57 6f 72 6c 64 48 65 6c 6c 6f 57 6f 72 6c 64 48 65 6c 6c 6f 57 6f 72 6c 64 48 65 6c 6c 6f 57 6f 72 6c 64 48 65 6c 6c 6f 57 6f 72 6c 64 48 65 6c 6c 6f 57 6f 72 6c 64 48 65 6c 6c 6f 57 6f 72 6c 64 48 65 6c 6c 6f 57 6f 72"
7618963-7618984 spiflash: field: "Command: Read data (READ)" "Command: Read data" "Cmd: Read data" "Cmd: READ" "READ"
7618984-7619005 spiflash: bit: "Address bits 23..16: 0x12" "Addr bits 23..16: 0x12" "Addr bits 23..16" "A23..A16"
7619005-7619026 spiflash: bit: "Address bits 15..8: 0x14" "Addr bits 15..8: 0x14" "Addr bits 15..8" "A15..A8"
7619026-7619045 spiflash: bit: "Address bits 7..0: 0x00" "Addr bits 7..0: 0x00" "Addr bits 7..0" "A7..A0"
7618984-7619045 spiflash: field: "Address: 0x121400" "Addr: 0x121400" "0x121400"
7619051-7624384 spiflash: field: "Data (256 bytes)"
7618963-7665270 spiflash: read: "Read data (addr 0x121400, 256 bytes): 6c 64 48 65 6c 6c 6f 57 6f 72 6c 64 48 65 6c 6c 6f 57 6f 72 6c 64 48 65 6c 6c 6f 57 6f 72 6c 64 48 65 6c 6c 6f 57 6f 72 6c 64 48 65 6c 6c 6f 57 6f 72 6c 64 48 65 6c 6c 6f 57 6f 72 6c 64 48 65 6c 6c 6f 57 6f 72 6c 64 48 65 6c 6c 6f 57 6f 72 6c 64 48 65 6c 6c 6f 57 6f 72 6c 64 48 65 6c 6c 6f 57 6f 72 6c 64 48 65 6c 6c 6f 57 6f 72 6c 64 48 65 6c 6c 6f 57 6f 72 6c 64 48 65 6c 6c 6f 57 6f 72 6c 64 48 65 6c 6c 6f 57 6f 72 6c 64 48 65 6c 6c 6f 57 6f 72 6c 64 48 65 6c 6c 6f 57 6f 72 6c 64 48 65 6c 6c 6f 57 6f 72 6c 64 48 65 6c 6c 6f 57 6f 72 6c 64 48 65 6c 6c 6f 57 6f 72 6c 64 48 65 6c 6c 6f 57 6f 72 6c 64 48 65 6c 6c 6f 57 6f 72 6c 64 48 65 6c 6c 6f 57 6f 72 6c 64 48 65 6c 6c 6f 57 6f 72 6c 64 48 65 6c 6c 6f 57 6f 72 6c 64 48 65 6c 6c 6f 57 6f 72 6c 64 48 65 6c 6c"
7668936-7668955 spiflash: field: "Command: Read data (READ)" "Command: Read data" "Cmd: Read data" "Cmd: READ" "READ"
7668956-7668977 spiflash: bit: "Address bits 23..16: 0x12" "Addr bits 23..16: 0x12" "Addr bits 23..16" "A23..A16"
7668977-7668998 spiflash: bit: "Address bits 15..8: 0x15" "Addr bits 15..8: 0x15" "Addr bits 15..8" "A15..A8"
7668998-7669019 spiflash: bit: "Address bits 7..0: 0x00" "Addr bits 7..0: 0x00" "Addr bits 7..0" "A7..A0"
7668956-7669019 spiflash: field: "Address: 0x121500" "Addr: 0x121500" "0x121500"
7669023-7674356 spiflash: field: "Data (256 bytes)"
7668936-7714878 spiflash: read: "Read data (addr 0x121500, 256 bytes): 6f 57 6f 72 6c 64 48 65 6c 6c 6f 57 6f 72 6c 64 48 65 6c 6c 6f 57 6f 72 6c 64 48 65 6c 6c 6f 57 6f 72 6c 64 48 65 6c 6c 6f 57 6f 72 6c 64 48 65 6c 6c 6f 57 6f 72 6c 64 48 65 6c 6c 6f 57 6f 72 6c 64 48 65 6c 6c 6f 57 6f 72 6c 64 48 65 6c 6c 6f 57 6f 72 6c 64 48 65 6c 6c 6f 57 6f 72 6c 64 48 65 6c 6c 6f 57 6f 72 6c 64 48 65 6c 6c 6f 57 6f 72 6c 64 48 65 6c 6c 6f 57 6f 72 6c 64 48 65 6c 6c 6f 57 6f 72 6c 64 48 65 6c 6c 6f 57 6f 72 6c 64 48 65 6c 6c 6f 57 6f 72 6c 64 48 65 6c 6c 6f 57 6f 72 6c 64 48 65 6c 6c 6f 57 6f 72 6c 64 48 65 6c 6c 6f 57 6f 72 6c 64 48 65 6c 6c 6f 57 6f 72 6c 64 48 65 6c 6c 6f 57 6f 72 6c 64 48 65 6c 6c 6f 57 6f 72 6c 64 48 65 6c 6c 6f 57 6f 72 6c 64 48 65 6c 6c 6f 57 6f 72 6c 64 48 65 6c 6c 6f 57 6f 72 6c 64 48 65 6c 6c 6f 57 6f 72 6c 64"
7718819-7718840 spiflash: field: "Command: Read data (READ)" "Command: Read data" "Cmd: Read data" "Cmd: READ" "READ"
7718840-7718859 spiflash: bit: "Address bits 23..16: 0x12" "Addr bits 23..16: 0x12" "Addr bits 23..16" "A23..A16"
7718861-7718880 spiflash: bit: "Address bits 15..8: 0x16" "Addr bits 15..8: 0x16" "Addr bits 15..8" "A15..A8"
7718882-7718901 spiflash: bit: "Address bits 7..0: 0x00" "Addr bits 7..0: 0x00" "Addr bits 7..0" "A7..A0"
7718840-7718901 spiflash: field: "Address: 0x121600" "Addr: 0x121600" "0x121600"
7718907-7724238 spiflash: field: "Data (256 bytes)"
7718819-7764867 spiflash: read: "Read data (addr 0x121600, 256 bytes): 48 65 6c 6c 6f 57 6f 72 6c 64 48 65 6c 6c 6f 57 6f 72 6c 64 48 65 6c 6c 6f 57 6f 72 6c 64 48 65 6c 6c 6f 57 6f 72 6c 64 48 65 6c 6c 6f 57 6f 72 6c 64 48 65 6c 6c 6f 57 6f 72 6c 64 48 65 6c 6c 6f 57 6f 72 6c 64 48 65 6c 6c 6f 57 6f 72 6c 64 48 65 6c 6c 6f 57 6f 72 6c 64 48 65 6c 6c 6f 57 6f 72 6c 64 48 65 6c 6c 6f 57 6f 72 6c 64 48 65 6c 6c 6f 57 6f 72 6c 64 48 65 6c 6c 6f 57 6f 72 6c 64 48 65 6c 6c 6f 57 6f 72 6c 64 48 65 6c 6c 6f 57 6f 72 6c 64 48 65 6c 6c 6f 57 6f 72 6c 64 48 65 6c 6c 6f 57 6f 72 6c 64 48 65 6c 6c 6f 57 6f 72 6c 64 48 65 6c 6c 6f 57 6f 72 6c 64 48 65 6c 6c 6f 57 6f 72 6c 64 48 65 6c 6c 6f 57 6f 72 6c 64 48 65 6c 6c 6f 57 6f 72 6c 64 48 65 6c 6c 6f 57 6f 72 6c 64 48 65 6c 6c 6f 57 6f 72 6c 64 48 65 6c 6c 6f 57 6f 72 6c 64 48 65 6c 6c 6f 57"
7768932-7768951 spiflash: field: "Command: Read data (READ)" "Command: Read data" "Cmd: Read data" "Cmd: READ" "READ"
7768952-7768973 spiflash: bit: "Address bits 23..16: 0x12" "Addr bits 23..16: 0x12" "Addr bits 23..16" "A23..A16"
7768973-7768994 spiflash: bit: "Address bits 15..8: 0x17" "Addr bits 15..8: 0x17" "Addr bits 15..8" "A15..A8"
7768994-7769015 spiflash: bit: "Address bits 7..0: 0x00" "Addr bits 7..0: 0x00" "Addr bits 7..0" "A7..A0"
7768952-7769015 spiflash: field: "Address: 0x121700" "Addr: 0x121700" "0x121700"
7769019-7774352 spiflash: field: "Data (256 bytes)"
7768932-7814863 spiflash: read: "Read data (addr 0x121700, 256 bytes): 6f 72 6c 64 48 65 6c 6c 6f 57 6f 72 6c 64 48 65 6c 6c 6f 57 6f 72 6c 64 48 65 6c 6c 6f 57 6f 72 6c 64 48 65 6c 6c 6f 57 6f 72 6c 64 48 65 6c 6c 6f 57 6f 72 6c 64 48 65 6c 6c 6f 57 6f 72 6c 64 48 65 6c 6c 6f 57 6f 72 6c 64 48 65 6c 6c 6f 57 6f 72 6c 64 48 65 6c 6c 6f 57 6f 72 6c 64 48 65 6c 6c 6f 57 6f 72 6c 64 48 65 6c 6c 6f 57 6f 72 6c 64 48 65 6c 6c 6f 57 6f 72 6c 64 48 65 6c 6c 6f 57 6f 72 6c 64 48 65 6c 6c 6f 57 6f 72 6c 64 48 65 6c 6c 6f 57 6f 72 6c 64 48 65 6c 6c 6f 57 6f 72 6c 64 48 65 6c 6c 6f 57 6f 72 6c 64 48 65 6c 6c 6f 57 6f 72 6c 64 48 65 6c 6c 6f 57 6f 72 6c 64 48 65 6c 6c 6f 57 6f 72 6c 64 48 65 6c 6c 6f 57 6f 72 6c 64 48 65 6c 6c 6f 57 6f 72 6c 64 48 65 6c 6c 6f 57 6f 72 6c 64 48 65 6c 6c 6f 57 6f 72 6c 64 48 65 6c 6c 6f 57 6f 72 6c 64 48 65"
7818806-7818827 spiflash: field: "Command: Read data (READ)" "Command: Read data" "Cmd: Read data" "Cmd: READ" "READ"
7818827-7818848 spiflash: bit: "Address bits 23..16: 0x12" "Addr bits 23..16: 0x12" "Addr bits 23..16" "A23..A16"
7818848-7818867 spiflash: bit: "Address bits 15..8: 0x18" "Addr bits 15..8: 0x18" "Addr bits 15..8" "A15..A8"
7818869-7818888 spiflash: bit: "Address bits 7..0: 0x00" "Addr bits 7..0: 0x00" "Addr bits 7..0" "A7..A0"
7818827-7818888 spiflash: field: "Address: 0x121800" "Addr: 0x121800" "0x121800"
7818894-7824227 spiflash: field: "Data (256 bytes)"
7818806-7864848 spiflash: read: "Read data (addr 0x121800, 256 bytes): 6c 6c 6f 57 6f 72 6c 64 48 65 6c 6c 6f 57 6f 72 6c 64 48 65 6c 6c 6f 57 6f 72 6c 64 48 65 6c 6c 6f 57 6f 72 6c 64 48 65 6c 6c 6f 57 6f 72 6c 64 48 65 6c 6c 6f 57 6f 72 6c 64 48 65 6c 6c 6f 57 6f 72 6c 64 48 65 6c 6c 6f 57 6f 72 6c 64 48 65 6c 6c 6f 57 6f 72 6c 64 48 65 6c 6c 6f 57 6f 72 6c 64 48 65 6c 6c 6f 57 6f 72 6c 64 48 65 6c 6c 6f 57 6f 72 6c 64 48 65 6c 6c 6f 57 6f 72 6c 64 48 65 6c 6c 6f 57 6f 72 6c 64 48 65 6c 6c 6f 57 6f 72 6c 64 48 65 6c 6c 6f 57 6f 72 6c 64 48 65 6c 6c 6f 57 6f 72 6c 64 48 65 6c 6c 6f 57 6f 72 6c 64 48 65 6c 6c 6f 57 6f 72 6c 64 48 65 6c 6c 6f 57 6f 72 6c 64 48 65 6c 6c 6f 57 6f 72 6c 64 48 65 6c 6c 6f 57 6f 72 6c 64 48 65 6c 6c 6f 57 6f 72 6c 64 48 65 6c 6c 6f 57 6f 72 6c 64 48 65 6c 6c 6f 57 6f 72 6c 64 48 65 6c 6c 6f 57 6f 72"
7868905-7868926 spiflash: field: "Command: Read data (READ)" "Command: Read data" "Cmd: Read data" "Cmd: READ" "READ"
7868926-7868947 spiflash: bit: "Address bits 23..16: 0x12" "Addr bits 23..16: 0x12" "Addr bits 23..16" "A23..A16"
7868947-7868966 spiflash: bit: "Address bits 15..8: 0x19" "Addr bits 15..8: 0x19" "Addr bits 15..8" "A15..A8"
7868968-7868987 spiflash: bit: "Address bits 7..0: 0x00" "Addr bits 7..0: 0x00" "Addr bits 7..0" "A7..A0"
7868926-7868987 spiflash: field: "Address: 0x121900" "Addr: 0x121900" "0x121900"
7868993-7874326 spiflash: field: "Data (256 bytes)"
7868905-7915130 spiflash: read: "Read data (addr 0x121900, 256 bytes): 6c 64 48 65 6c 6c 6f 57 6f 72 6c 64 48 65 6c 6c 6f 57 6f 72 6c 64 48 65 6c 6c 6f 57 6f 72 6c 64 48 65 6c 6c 6f 57 6f 72 6c 64 48 65 6c 6c 6f 57 6f 72 6c 64 48 65 6c 6c 6f 57 6f 72 6c 64 48 65 6c 6c 6f 57 6f 72 6c 64 48 65 6c 6c 6f 57 6f 72 6c 64 48 65 6c 6c 6f 57 6f 72 6c 64 48 65 6c 6c 6f 57 6f 72 6c 64 48 65 6c 6c 6f 57 6f 72 6c 64 48 65 6c 6c 6f 57 6f 72 6c 64 48 65 6c 6c 6f 57 6f 72 6c 64 48 65 6c 6c 6f 57 6f 72 6c 64 48 65 6c 6c 6f 57 6f 72 6c 64 48 65 6c 6c 6f 57 6f 72 6c 64 48 65 6c 6c 6f 57 6f 72 6c 64 48 65 6c 6c 6f 57 6f 72 6c 64 48 65 6c 6c 6f 57 6f 72 6c 64 48 65 6c 6c 6f 57 6f 72 6c 64 48 65 6c 6c 6f 57 6f 72 6c 64 48 65 6c 6c 6f 57 6f 72 6c 64 48 65 6c 6c 6f 57 6f 72 6c 64 48 65 6c 6c 6f 57 6f 72 6c 64 48 65 6c 6c 6f 57 6f 72 6c 64 48 65 6c 6c"
7918912-7918932 spiflash: field: "Command: Read data (READ)" "Command: Read data" "Cmd: Read data" "Cmd: READ" "READ"
7918932-7918953 spiflash: bit: "Address bits 23..16: 0x12" "Addr bits 23..16: 0x12" "Addr bits 23..16" "A23..A16"
7918953-7918974 spiflash: bit: "Address bits 15..8: 0x1a" "Addr bits 15..8: 0x1a" "Addr bits 15..8" "A15..A8"
7918974-7918995 spiflash: bit: "Address bits 7..0: 0x00" "Addr bits 7..0: 0x00" "Addr bits 7..0" "A7..A0"
7918932-7918995 spiflash: field: "Address: 0x121a00" "Addr: 0x121a00" "0x121a00"
7918999-7924332 spiflash: field: "Data (256 bytes)"
7918912-7962627 spiflash: read: "Read data (addr 0x121a00, 256 bytes): 6f 57 6f 72 6c 64 48 65 6c 6c 6f 57 6f 72 6c 64 48 65 6c 6c 6f 57 6f 72 6c 64 48 65 6c 6c 6f 57 6f 72 6c 64 48 65 6c 6c 6f 57 6f 72 6c 64 48 65 6c 6c 6f 57 6f 72 6c 64 48 65 6c 6c 6f 57 6f 72 6c 64 48 65 6c 6c 6f 57 6f 72 6c 64 48 65 6c 6c 6f 57 6f 72 6c 64 48 65 6c 6c 6f 57 6f 72 6c 64 48 65 6c 6c 6f 57 6f 72 6c 64 48 65 6c 6c 6f 57 6f 72 6c 64 48 65 6c 6c 6f 57 6f 72 6c 64 48 65 6c 6c 6f 57 6f 72 6c 64 48 65 6c 6c 6f 57 6f 72 6c 64 48 65 6c 6c 6f 57 6f 72 6c 64 48 65 6c 6c 6f 57 6f 72 6c 64 48 65 6c 6c 6f 57 6f 72 6c 64 48 65 6c 6c 6f 57 6f 72 6c 64 48 65 6c 6c 6f 57 6f 72 6c 64 48 65 6c 6c 6f 57 6f 72 6c 64 48 65 6c 6c 6f 57 6f 72 6c 64 48 65 6c 6c 6f 57 6f 72 6c 64 48 65 6c 6c 6f 57 6f 72 6c 64 48 65 6c 6c 6f 57 6f 72 6c 64 48 65 6c 6c 6f 57 6f 72 6c 64"
7966436-7966457 spiflash: field: "Command: Read data (READ)" "Command: Read data" "Cmd: Read data" "Cmd: READ" "READ"
7966457-7966478 spiflash: bit: "Address bits 23..16: 0x12" "Addr bits 23..16: 0x12" "Addr bits 23..16" "A23..A16"
7966478-7966497 spiflash: bit: "Address bits 15..8: 0x1b" "Addr bits 15..8: 0x1b" "Addr bits 15..8" "A15..A8"
7966499-7966518 spiflash: bit: "Address bits 7..0: 0x00" "Addr bits 7..0: 0x00" "Addr bits 7..0" "A7..A0"
7966457-7966518 spiflash: field: "Address: 0x121b00" "Addr: 0x121b00" "0x121b00"
7966524-7971857 spiflash: field: "Data (256 bytes)"
7966436-8014725 spiflash: read: "Read data (addr 0x121b00, 256 bytes): 48 65 6c 6c 6f 57 6f 72 6c 64 48 65 6c 6c 6f 57 6f 72 6c 64 48 65 6c 6c 6f 57 6f 72 6c 64 48 65 6c 6c 6f 57 6f 72 6c 64 48 65 6c 6c 6f 57 6f 72 6c 64 48 65 6c 6c 6f 57 6f 72 6c 64 48 65 6c 6c 6f 57 6f 72 6c 64 48 65 6c 6c 6f 57 6f 72 6c 64 48 65 6c 6c 6f 57 6f 72 6c 64 48 65 6c 6c 6f 57 6f 72 6c 64 48 65 6c 6c 6f 57 6f 72 6c 64 48 65 6c 6c 6f 57 6f 72 6c 64 48 65 6c 6c 6f 57 6f 72 6c 64 48 65 6c 6c 6f 57 6f 72 6c 64 48 65 6c 6c 6f 57 6f 72 6c 64 48 65 6c 6c 6f 57 6f 72 6c 64 48 65 6c 6c 6f 57 6f 72 6c 64 48 65 6c 6c 6f 57 6f 72 6c 64 48 65 6c 6c 6f 57 6f 72 6c 64 48 65 6c 6c 6f 57 6f 72 6c 64 48 65 6c 6c 6f 57 6f 72 6c 64 48 65 6c 6c 6f 57 6f 72 6c 64 48 65 6c 6c 6f 57 6f 72 6c 64 48 65 6c 6c 6f 57 6f 72 6c 64 48 65 6c 6c 6f 57 6f 72 6c 64 48 65 6c 6c 6f 57"
8018887-8018908 spiflash: field: "Command: Read data (READ)" "Command: Read data" "Cmd: Read data" "Cmd: READ" "READ"
8018908-8018927 spiflash: bit: "Address bits 23..16: 0x12" "Addr bits 23..16: 0x12" "Addr bits 23..16" "A23..A16"
8018929-8018948 spiflash: bit: "Address bits 15..8: 0x1c" "Addr bits 15..8: 0x1c" "Addr bits 15..8" "A15..A8"
8018950-8018969 spiflash: bit: "Address bits 7..0: 0x00" "Addr bits 7..0: 0x00" "Addr bits 7..0" "A7..A0"
8018908-8018969 spiflash: field: "Address: 0x121c00" "Addr: 0x121c00" "0x121c00"
8018975-8024308 spiflash: field: "Data (256 bytes)"
8018887-8065107 spiflash: read: "Read data (addr 0x121c00, 256 bytes): 6f 72 6c 64 48 65 6c 6c 6f 57 6f 72 6c 64 48 65 6c 6c 6f 57 6f 72 6c 64 48 65 6c 6c 6f 57 6f 72 6c 64 48 65 6c 6c 6f 57 6f 72 6c 64 48 65 6c 6c 6f 57 6f 72 6c 64 48 65 6c 6c 6f 57 6f 72 6c 64 48 65 6c 6c 6f 57 6f 72 6c 64 48 65 6c 6c 6f 57 6f 72 6c 64 48 65 6c 6c 6f 57 6f 72 6c 64 48 65 6c 6c 6f 57 6f 72 6c 64 48 65 6c 6c 6f 57 6f 72 6c 64 48 65 6c 6c 6f 57 6f 72 6c 64 48 65 6c 6c 6f 57 6f 72 6c 64 48 65 6c 6c 6f 57 6f 72 6c 64 48 65 6c 6c 6f 57 6f 72 6c 64 48 65 6c 6c 6f 57 6f 72 6c 64 48 65 6c 6c 6f 57 6f 72 6c 64 48 65 6c 6c 6f 57 6f 72 6c 64 48 65 6c 6c 6f 57 6f 72 6c 64 48 65 6c 6c 6f 57 6f 72 6c 64 48 65 6c 6c 6f 57 6f 72 6c 64 48 65 6c 6c 6f 57 6f 72 6c 64 48 65 6c 6c 6f 57 6f 72 6c 64 48 65 6c 6c 6f 57 6f 72 6c 64 48 65 6c 6c 6f 57 6f 72 6c 64 48 65"
8067829-8067848 spiflash: field: "Command: Read data (READ)" "Command: Read data" "Cmd: Read data" "Cmd: READ" "READ"
8067849-8067870 spiflash: bit: "Address bits 23..16: 0x12" "Addr bits 23..16: 0x12" "Addr bits 23..16" "A23..A16"
8067870-8067891 spiflash: bit: "Address bits 15..8: 0x1d" "Addr bits 15..8: 0x1d" "Addr bits 15..8" "A15..A8"
8067891-8067912 spiflash: bit: "Address bits 7..0: 0x00" "Addr bits 7..0: 0x00" "Addr bits 7..0" "A7..A0"
8067849-8067912 spiflash: field: "Address: 0x121d00" "Addr: 0x121d00" "0x121d00"
8067916-8073249 spiflash: field: "Data (256 bytes)"
8067829-8114677 spiflash: read: "Read data (addr 0x121d00, 256 bytes): 6c 6c 6f 57 6f 72 6c 64 48 65 6c 6c 6f 57 6f 72 6c 64 48 65 6c 6c 6f 57 6f 72 6c 64 48 65 6c 6c 6f 57 6f 72 6c 64 48 65 6c 6c 6f 57 6f 72 6c 64 48 65 6c 6c 6f 57 6f 72 6c 64 48 65 6c 6c 6f 57 6f 72 6c 64 48 65 6c 6c 6f 57 6f 72 6c 64 48 65 6c 6c 6f 57 6f 72 6c 64 48 65 6c 6c 6f 57 6f 72 6c 64 48 65 6c 6c 6f 57 6f 72 6c 64 48 65 6c 6c 6f 57 6f 72 6c 64 48 65 6c 6c 6f 57 6f 72 6c 64 48 65 6c 6c 6f 57 6f 72 6c 64 48 65 6c 6c 6f 57 6f 72 6c 64 48 65 6c 6c 6f 57 6f 72 6c 64 48 65 6c 6c 6f 57 6f 72 6c 64 48 65 6c 6c 6f 57 6f 72 6c 64 48 65 6c 6c 6f 57 6f 72 6c 64 48 65 6c 6c 6f 57 6f 72 6c 64 48 65 6c 6c 6f 57 6f 72 6c 64 48 65 6c 6c 6f 57 6f 72 6c 64 48 65 6c 6c 6f 57 6f 72 6c 64 48 65 6c 6c 6f 57 6f 72 6c 64 48 65 6c 6c 6f 57 6f 72 6c 64 48 65 6c 6c 6f 57 6f 72"
8118881-8118902 spiflash: field: "Command: Read data (READ)" "Command: Read data" "Cmd: Read data" "Cmd: READ" "READ"
8118902-8118923 spiflash: bit: "Address bits 23..16: 0x12" "Addr bits 23..16: 0x12" "Addr bits 23..16" "A23..A16"
8118923-8118944 spiflash: bit: "Address bits 15..8: 0x1e" "Addr bits 15..8: 0x1e" "Addr bits 15..8" "A15..A8"
8118944-8118963 spiflash: bit: "Address bits 7..0: 0x00" "Addr bits 7..0: 0x00" "Addr bits 7..0" "A7..A0"
8118902-8118963 spiflash: field: "Address: 0x121e00" "Addr: 0x121e00" "0x121e00"
8118969-8124302 spiflash: field: "Data (256 bytes)"
8118881-8165199 spiflash: read: "Read data (addr 0x121e00, 256 bytes): 6c 64 48 65 6c 6c 6f 57 6f 72 6c 64 48 65 6c 6c 6f 57 6f 72 6c 64 48 65 6c 6c 6f 57 6f 72 6c 64 48 65 6c 6c 6f 57 6f 72 6c 64 48 65 6c 6c 6f 57 6f 72 6c 64 48 65 6c 6c 6f 57 6f 72 6c 64 48 65 6c 6c 6f 57 6f 72 6c 64 48 65 6c 6c 6f 57 6f 72 6c 64 48 65 6c 6c 6f 57 6f 72 6c 64 48 65 6c 6c 6f 57 6f 72 6c 64 48 65 6c 6c 6f 57 6f 72 6c 64 48 65 6c 6c 6f 57 6f 72 6c 64 48 65 6c 6c 6f 57 6f 72 6c 64 48 65 6c 6c 6f 57 6f 72 6c 64 48 65 6c 6c 6f 57 6f 72 6c 64 48 65 6c 6c 6f 57 6f 72 6c 64 48 65 6c 6c 6f 57 6f 72 6c 64 48 65 6c 6c 6f 57 6f 72 6c 64 48 65 6c 6c 6f 57 6f 72 6c 64 48 65 6c 6c 6f 57 6f 72 6c 64 48 65 6c 6c 6f 57 6f 72 6c 64 48 65 6c 6c 6f 57 6f 72 6c 64 48 65 6c 6c 6f 57 6f 72 6c 64 48 65 6c 6c 6f 57 6f 72 6c 64 48 65 6c 6c 6f 57 6f 72 6c 64 48 65 6c 6c"
8167817-8167836 spiflash: field: "Command: Read data (READ)" "Command: Read data" "Cmd: Read data" "Cmd: READ" "READ"
8167838-8167857 spiflash: bit: "Address bits 23..16: 0x12" "Addr bits 23..16: 0x12" "Addr bits 23..16" "A23..A16"
8167858-8167879 spiflash: bit: "Address bits 15..8: 0x1f" "Addr bits 15..8: 0x1f" "Addr bits 15..8" "A15..A8"
8167879-8167900 spiflash: bit: "Address bits 7..0: 0x00" "Addr bits 7..0: 0x00" "Addr bits 7..0" "A7..A0"
8167838-8167900 spiflash: field: "Address: 0x121f00" "Addr: 0x121f00" "0x121f00"
8167904-8173236 spiflash: field: "Data (256 bytes)"
8167817-8215743 spiflash: read: "Read data (addr 0x121f00, 256 bytes): 6f 57 6f 72 6c 64 48 65 6c 6c 6f 57 6f 72 6c 64 48 65 6c 6c 6f 57 6f 72 6c 64 48 65 6c 6c 6f 57 6f 72 6c 64 48 65 6c 6c 6f 57 6f 72 6c 64 48 65 6c 6c 6f 57 6f 72 6c 64 48 65 6c 6c 6f 57 6f 72 6c 64 48 65 6c 6c 6f 57 6f 72 6c 64 48 65 6c 6c 6f 57 6f 72 6c 64 48 65 6c 6c 6f 57 6f 72 6c 64 48 65 6c 6c 6f 57 6f 72 6c 64 48 65 6c 6c 6f 57 6f 72 6c 64 48 65 6c 6c 6f 57 6f 72 6c 64 48 65 6c 6c 6f 57 6f 72 6c 64 48 65 6c 6c 6f 57 6f 72 6c 64 48 65 6c 6c 6f 57 6f 72 6c 64 48 65 6c 6c 6f 57 6f 72 6c 64 48 65 6c 6c 6f 57 6f 72 6c 64 48 65 6c 6c 6f 57 6f 72 6c 64 48 65 6c 6c 6f 57 6f 72 6c 64 48 65 6c 6c 6f 57 6f 72 6c 64 48 65 6c 6c 6f 57 6f 72 6c 64 48 65 6c 6c 6f 57 6f 72 6c 64 48 65 6c 6c 6f 57 6f 72 6c 64 48 65 6c 6c 6f 57 6f 72 6c 64 48 65 6c 6c 6f 57 6f 72 6c 64"
8217821-8217840 spiflash: field: "Command: Read data (READ)" "Command: Read data" "Cmd: Read data" "Cmd: READ" "READ"
8217842-8217861 spiflash: bit: "Address bits 23..16: 0x12" "Addr bits 23..16: 0x12" "Addr bits 23..16" "A23..A16"
8217863-8217882 spiflash: bit: "Address bits 15..8: 0x20" "Addr bits 15..8: 0x20" "Addr bits 15..8" "A15..A8"
8217883-8217904 spiflash: bit: "Address bits 7..0: 0x00" "Addr bits 7..0: 0x00" "Addr bits 7..0" "A7..A0"
8217842-8217904 spiflash: field: "Address: 0x122000" "Addr: 0x122000" "0x122000"
8217908-8223240 spiflash: field: "Data (256 bytes)"
8217821-8264805 spiflash: read: "Read data (addr 0x122000, 256 bytes): 48 65 6c 6c 6f 57 6f 72 6c 64 48 65 6c 6c 6f 57 6f 72 6c 64 48 65 6c 6c 6f 57 6f 72 6c 64 48 65 6c 6c 6f 57 6f 72 6c 64 48 65 6c 6c 6f 57 6f 72 6c 64 48 65 6c 6c 6f 57 6f 72 6c 64 48 65 6c 6c 6f 57 6f 72 6c 64 48 65 6c 6c 6f 57 6f 72 6c 64 48 65 6c 6c 6f 57 6f 72 6c 64 48 65 6c 6c 6f 57 6f 72 6c 64 48 65 6c 6c 6f 57 6f 72 6c 64 48 65 6c 6c 6f 57 6f 72 6c 64 48 65 6c 6c 6f 57 6f 72 6c 64 48 65 6c 6c 6f 57 6f 72 6c 64 48 65 6c 6c 6f 57 6f 72 6c 64 48 65 6c 6c 6f 57 6f 72 6c 64 48 65 6c 6c 6f 57 6f 72 6c 64 48 65 6c 6c 6f 57 6f 72 6c 64 48 65 6c 6c 6f 57 6f 72 6c 64 48 65 6c 6c 6f 57 6f 72 6c 64 48 65 6c 6c 6f 57 6f 72 6c 64 48 65 6c 6c 6f 57 6f 72 6c 64 48 65 6c 6c 6f 57 6f 72 6c 64 48 65 6c 6c 6f 57 6f 72 6c 64 48 65 6c 6c 6f 57 6f 72 6c 64 48 65 6c 6c 6f 57"
8268746-8268765 spiflash: field: "Command: Read data (READ)" "Command: Read data" "Cmd: Read data" "Cmd: READ" "READ"
8268766-8268787 spiflash: bit: "Address bits 23..16: 0x12" "Addr bits 23..16: 0x12" "Addr bits 23..16" "A23..A16"
8268787-8268808 spiflash: bit: "Address bits 15..8: 0x21" "Addr bits 15..8: 0x21" "Addr bits 15..8" "A15..A8"
8268808-8268829 spiflash: bit: "Address bits 7..0: 0x00" "Addr bits 7..0: 0x00" "Addr bits 7..0" "A7..A0"
8268766-8268829 spiflash: field: "Address: 0x122100" "Addr: 0x122100" "0x122100"
8268833-8274166 spiflash: field: "Data (256 bytes)"
8268746-8315070 spiflash: read: "Read data (addr 0x122100, 256 bytes): 6f 72 6c 64 48 65 6c 6c 6f 57 6f 72 6c 64 48 65 6c 6c 6f 57 6f 72 6c 64 48 65 6c 6c 6f 57 6f 72 6c 64 48 65 6c 6c 6f 57 6f 72 6c 64 48 65 6c 6c 6f 57 6f 72 6c 64 48 65 6c 6c 6f 57 6f 72 6c 64 48 65 6c 6c 6f 57 6f 72 6c 64 48 65 6c 6c 6f 57 6f 72 6c 64 48 65 6c 6c 6f 57 6f 72 6c 64 48 65 6c 6c 6f 57 6f 72 6c 64 48 65 6c 6c 6f 57 6f 72 6c 64 48 65 6c 6c 6f 57 6f 72 6c 64 48 65 6c 6c 6f 57 6f 72 6c 64 48 65 6c 6c 6f 57 6f 72 6c 64 48 65 6c 6c 6f 57 6f 72 6c 64 48 65 6c 6c 6f 57 6f 72 6c 64 48 65 6c 6c 6f 57 6f 72 6c 64 48 65 6c 6c 6f 57 6f 72 6c 64 48 65 6c 6c 6f 57 6f 72 6c 64 48 65 6c 6c 6f 57 6f 72 6c 64 48 65 6c 6c 6f 57 6f 72 6c 64 48 65 6c 6c 6f 57 6f 72 6c 64 48 65 6c 6c 6f 57 6f 72 6c 64 48 65 6c 6c 6f 57 6f 72 6c 64 48 65 6c 6c 6f 57 6f 72 6c 64 48 65"
8318849-8318868 spiflash: field: "Command: Read data (READ)" "Command: Read data" "Cmd: Read data" "Cmd: READ" "READ"
8318869-8318890 spiflash: bit: "Address bits 23..16: 0x12" "Addr bits 23..16: 0x12" "Addr bits 23..16" "A23..A16"
8318890-8318911 spiflash: bit: "Address bits 15..8: 0x22" "Addr bits 15..8: 0x22" "Addr bits 15..8" "A15..A8"
8318911-8318932 spiflash: bit: "Address bits 7..0: 0x00" "Addr bits 7..0: 0x00" "Addr bits 7..0" "A7..A0"
8318869-8318932 spiflash: field: "Address: 0x122200" "Addr: 0x122200" "0x122200"
8318936-8324269 spiflash: field: "Data (256 bytes)"
8318849-8364790 spiflash: read: "Read data (addr 0x122200, 256 bytes): 6c 6c 6f 57 6f 72 6c 64 48 65 6c 6c 6f 57 6f 72 6c 64 48 65 6c 6c 6f 57 6f 72 6c 64 48 65 6c 6c 6f 57 6f 72 6c 64 48 65 6c 6c 6f 57 6f 72 6c 64 48 65 6c 6c 6f 57 6f 72 6c 64 48 65 6c 6c 6f 57 6f 72 6c 64 48 65 6c 6c 6f 57 6f 72 6c 64 48 65 6c 6c 6f 57 6f 72 6c 64 48 65 6c 6c 6f 57 6f 72 6c 64 48 65 6c 6c 6f 57 6f 72 6c 64 48 65 6c 6c 6f 57 6f 72 6c 64 48 65 6c 6c 6f 57 6f 72 6c 64 48 65 6c 6c 6f 57 6f 72 6c 64 48 65 6c 6c 6f 57 6f 72 6c 64 48 65 6c 6c 6f 57 6f 72 6c 64 48 65 6c 6c 6f 57 6f 72 6c 64 48 65 6c 6c 6f 57 6f 72 6c 64 48 65 6c 6c 6f 57 6f 72 6c 64 48 65 6c 6c 6f 57 6f 72 6c 64 48 65 6c 6c 6f 57 6f 72 6c 64 48 65 6c 6c 6f 57 6f 72 6c 64 48 65 6c 6c 6f 57 6f 72 6c 64 48 65 6c 6c 6f 57 6f 72 6c 64 48 65 6c 6c 6f 57 6f 72 6c 64 48 65 6c 6c 6f 57 6f 72"
8368840-8368859 spiflash: field: "Command: Read data (READ)" "Command: Read data" "Cmd: Read data" "Cmd: READ" "READ"
8368860-8368881 spiflash: bit: "Address bits 23..16: 0x12" "Addr bits 23..16: 0x12" "Addr bits 23..16" "A23..A16"
8368881-8368902 spiflash: bit: "Address bits 15..8: 0x23" "Addr bits 15..8: 0x23" "Addr bits 15..8" "A15..A8"
8368902-8368923 spiflash: bit: "Address bits 7..0: 0x00" "Addr bits 7..0: 0x00" "Addr bits 7..0" "A7..A0"
8368860-8368923 spiflash: field: "Address: 0x122300" "Addr: 0x122300" "0x122300"
