307-1057 i2s: left: "Left channel: f6780000" "Left: f6780000" "L: f6780000" "L"
1057-1807 i2s: right: "Right channel: fffd0000" "Right: fffd0000" "R: fffd0000" "R"
1807-2557 i2s: left: "Left channel: f4b80000" "Left: f4b80000" "L: f4b80000" "L"
2557-3308 i2s: right: "Right channel: fffd0000" "Right: fffd0000" "R: fffd0000" "R"
3308-4058 i2s: left: "Left channel: f3ac0000" "Left: f3ac0000" "L: f3ac0000" "L"
4058-4808 i2s: right: "Right channel: fffe0000" "Right: fffe0000" "R: fffe0000" "R"
4808-5558 i2s: left: "Left channel: f3060000" "Left: f3060000" "L: f3060000" "L"
5558-6309 i2s: right: "Right channel: fffe0000" "Right: fffe0000" "R: fffe0000" "R"
6309-7059 i2s: left: "Left channel: f2010000" "Left: f2010000" "L: f2010000" "L"
7059-7809 i2s: right: "Right channel: fffe0000" "Right: fffe0000" "R: fffe0000" "R"
7809-8559 i2s: left: "Left channel: f1e30000" "Left: f1e30000" "L: f1e30000" "L"
8559-9310 i2s: right: "Right channel: fffe0000" "Right: fffe0000" "R: fffe0000" "R"
9310-10060 i2s: left: "Left channel: f2590000" "Left: f2590000" "L: f2590000" "L"
10060-10810 i2s: right: "Right channel: 00000000" "Right: 00000000" "R: 00000000" "R"
10810-11560 i2s: left: "Left channel: f35b0000" "Left: f35b0000" "L: f35b0000" "L"
11560-12311 i2s: right: "Right channel: 00000000" "Right: 00000000" "R: 00000000" "R"
12311-13061 i2s: left: "Left channel: f4db0000" "Left: f4db0000" "L: f4db0000" "L"
13061-13811 i2s: right: "Right channel: 00020000" "Right: 00020000" "R: 00020000" "R"
13811-14561 i2s: left: "Left channel: f65d0000" "Left: f65d0000" "L: f65d0000" "L"
14561-15312 i2s: right: "Right channel: 00010000" "Right: 00010000" "R: 00010000" "R"
15312-16062 i2s: left: "Left channel: f84d0000" "Left: f84d0000" "L: f84d0000" "L"
16062-16812 i2s: right: "Right channel: 00010000" "Right: 00010000" "R: 00010000" "R"
16812-17562 i2s: left: "Left channel: fa350000" "Left: fa350000" "L: fa350000" "L"
17562-18313 i2s: right: "Right channel: 00040000" "Right: 00040000" "R: 00040000" "R"
18313-19063 i2s: left: "Left channel: fc5f0000" "Left: fc5f0000" "L: fc5f0000" "L"
19063-19813 i2s: right: "Right channel: 00030000" "Right: 00030000" "R: 00030000" "R"
19813-20563 i2s: left: "Left channel: ff430000" "Left: ff430000" "L: ff430000" "L"
20563-21314 i2s: right: "Right channel: 00060000" "Right: 00060000" "R: 00060000" "R"
21314-22064 i2s: left: "Left channel: 01d50000" "Left: 01d50000" "L: 01d50000" "L"
22064-22814 i2s: right: "Right channel: 00020000" "Right: 00020000" "R: 00020000" "R"
22814-23564 i2s: left: "Left channel: 046e0000" "Left: 046e0000" "L: 046e0000" "L"
23564-24315 i2s: right: "Right channel: 00040000" "Right: 00040000" "R: 00040000" "R"
24315-25065 i2s: left: "Left channel: 06c30000" "Left: 06c30000" "L: 06c30000" "L"
25065-25815 i2s: right: "Right channel: 00050000" "Right: 00050000" "R: 00050000" "R"
25815-26565 i2s: left: "Left channel: 09300000" "Left: 09300000" "L: 09300000" "L"
26565-27316 i2s: right: "Right channel: 00040000" "Right: 00040000" "R: 00040000" "R"
27316-28066 i2s: left: "Left channel: 0ba00000" "Left: 0ba00000" "L: 0ba00000" "L"
28066-28816 i2s: right: "Right channel: 00040000" "Right: 00040000" "R: 00040000" "R"
28816-29566 i2s: left: "Left channel: 0d830000" "Left: 0d830000" "L: 0d830000" "L"
29566-30317 i2s: right: "Right channel: 00050000" "Right: 00050000" "R: 00050000" "R"
30317-31067 i2s: left: "Left channel: 0f960000" "Left: 0f960000" "L: 0f960000" "L"
31067-31817 i2s: right: "Right channel: 00040000" "Right: 00040000" "R: 00040000" "R"
31817-32567 i2s: left: "Left channel: 11940000" "Left: 11940000" "L: 11940000" "L"
32567-33318 i2s: right: "Right channel: 00030000" "Right: 00030000" "R: 00030000" "R"
33318-34068 i2s: left: "Left channel: 131f0000" "Left: 131f0000" "L: 131f0000" "L"
34068-34818 i2s: right: "Right channel: 00030000" "Right: 00030000" "R: 00030000" "R"
34818-35568 i2s: left: "Left channel: 14180000" "Left: 14180000" "L: 14180000" "L"
35568-36319 i2s: right: "Right channel: 00040000" "Right: 00040000" "R: 00040000" "R"
36319-37069 i2s: left: "Left channel: 14990000" "Left: 14990000" "L: 14990000" "L"
37069-37819 i2s: right: "Right channel: 00000000" "Right: 00000000" "R: 00000000" "R"
37819-38569 i2s: left: "Left channel: 15470000" "Left: 15470000" "L: 15470000" "L"
38569-39320 i2s: right: "Right channel: 00010000" "Right: 00010000" "R: 00010000" "R"
39320-40070 i2s: left: "Left channel: 15d50000" "Left: 15d50000" "L: 15d50000" "L"
40070-40820 i2s: right: "Right channel: 00000000" "Right: 00000000" "R: 00000000" "R"
40820-41570 i2s: left: "Left channel: 15c00000" "Left: 15c00000" "L: 15c00000" "L"
41570-42321 i2s: right: "Right channel: 00000000" "Right: 00000000" "R: 00000000" "R"
42321-43071 i2s: left: "Left channel: 156d0000" "Left: 156d0000" "L: 156d0000" "L"
43071-43821 i2s: right: "Right channel: 00010000" "Right: 00010000" "R: 00010000" "R"
43821-44571 i2s: left: "Left channel: 14890000" "Left: 14890000" "L: 14890000" "L"
44571-45322 i2s: right: "Right channel: ffff0000" "Right: ffff0000" "R: ffff0000" "R"
45322-46072 i2s: left: "Left channel: 13890000" "Left: 13890000" "L: 13890000" "L"
46072-46822 i2s: right: "Right channel: fffe0000" "Right: fffe0000" "R: fffe0000" "R"
46822-47572 i2s: left: "Left channel: 121f0000" "Left: 121f0000" "L: 121f0000" "L"
47572-48323 i2s: right: "Right channel: fffe0000" "Right: fffe0000" "R: fffe0000" "R"
48323-49073 i2s: left: "Left channel: 108d0000" "Left: 108d0000" "L: 108d0000" "L"
49073-49823 i2s: right: "Right channel: ffff0000" "Right: ffff0000" "R: ffff0000" "R"
49823-50573 i2s: left: "Left channel: 0ed30000" "Left: 0ed30000" "L: 0ed30000" "L"
50573-51324 i2s: right: "Right channel: fffa0000" "Right: fffa0000" "R: fffa0000" "R"
51324-52074 i2s: left: "Left channel: 0ca40000" "Left: 0ca40000" "L: 0ca40000" "L"
52074-52824 i2s: right: "Right channel: fffd0000" "Right: fffd0000" "R: fffd0000" "R"
52824-53574 i2s: left: "Left channel: 0a310000" "Left: 0a310000" "L: 0a310000" "L"
53574-54325 i2s: right: "Right channel: fffc0000" "Right: fffc0000" "R: fffc0000" "R"
54325-55075 i2s: left: "Left channel: 07950000" "Left: 07950000" "L: 07950000" "L"
55075-55825 i2s: right: "Right channel: fffe0000" "Right: fffe0000" "R: fffe0000" "R"
55825-56575 i2s: left: "Left channel: 04a60000" "Left: 04a60000" "L: 04a60000" "L"
56575-57326 i2s: right: "Right channel: fffc0000" "Right: fffc0000" "R: fffc0000" "R"
57326-58076 i2s: left: "Left channel: 01ca0000" "Left: 01ca0000" "L: 01ca0000" "L"
58076-58826 i2s: right: "Right channel: fffa0000" "Right: fffa0000" "R: fffa0000" "R"
58826-59576 i2s: left: "Left channel: fedf0000" "Left: fedf0000" "L: fedf0000" "L"
59576-60327 i2s: right: "Right channel: 00000000" "Right: 00000000" "R: 00000000" "R"
60327-61077 i2s: left: "Left channel: fc8c0000" "Left: fc8c0000" "L: fc8c0000" "L"
61077-61827 i2s: right: "Right channel: fffd0000" "Right: fffd0000" "R: fffd0000" "R"
61827-62577 i2s: left: "Left channel: fa2a0000" "Left: fa2a0000" "L: fa2a0000" "L"
62577-63328 i2s: right: "Right channel: fffd0000" "Right: fffd0000" "R: fffd0000" "R"
63328-64078 i2s: left: "Left channel: f7980000" "Left: f7980000" "L: f7980000" "L"
64078-64828 i2s: right: "Right channel: fffd0000" "Right: fffd0000" "R: fffd0000" "R"
64828-65578 i2s: left: "Left channel: f5470000" "Left: f5470000" "L: f5470000" "L"
65578-66329 i2s: right: "Right channel: ffff0000" "Right: ffff0000" "R: ffff0000" "R"
66329-67079 i2s: left: "Left channel: f3af0000" "Left: f3af0000" "L: f3af0000" "L"
67079-67829 i2s: right: "Right channel: fffd0000" "Right: fffd0000" "R: fffd0000" "R"
67829-68579 i2s: left: "Left channel: f2b00000" "Left: f2b00000" "L: f2b00000" "L"
68579-69330 i2s: right: "Right channel: ffff0000" "Right: ffff0000" "R: ffff0000" "R"
69330-70080 i2s: left: "Left channel: f2150000" "Left: f2150000" "L: f2150000" "L"
70080-70830 i2s: right: "Right channel: ffff0000" "Right: ffff0000" "R: ffff0000" "R"
70830-71580 i2s: left: "Left channel: f1a00000" "Left: f1a00000" "L: f1a00000" "L"
71580-72331 i2s: right: "Right channel: ffff0000" "Right: ffff0000" "R: ffff0000" "R"
72331-73081 i2s: left: "Left channel: f1ac0000" "Left: f1ac0000" "L: f1ac0000" "L"
73081-73831 i2s: right: "Right channel: 00000000" "Right: 00000000" "R: 00000000" "R"
73831-74581 i2s: left: "Left channel: f2220000" "Left: f2220000" "L: f2220000" "L"
74581-75332 i2s: right: "Right channel: ffff0000" "Right: ffff0000" "R: ffff0000" "R"
75332-76082 i2s: left: "Left channel: f2ff0000" "Left: f2ff0000" "L: f2ff0000" "L"
76082-76832 i2s: right: "Right channel: 00010000" "Right: 00010000" "R: 00010000" "R"
76832-77583 i2s: left: "Left channel: f4200000" "Left: f4200000" "L: f4200000" "L"
77583-78333 i2s: right: "Right channel: 00030000" "Right: 00030000" "R: 00030000" "R"
78333-79083 i2s: left: "Left channel: f5950000" "Left: f5950000" "L: f5950000" "L"
79083-79833 i2s: right: "Right channel: 00020000" "Right: 00020000" "R: 00020000" "R"
79833-80583 i2s: left: "Left channel: f7640000" "Left: f7640000" "L: f7640000" "L"
80583-81334 i2s: right: "Right channel: 00040000" "Right: 00040000" "R: 00040000" "R"
81334-82084 i2s: left: "Left channel: f93b0000" "Left: f93b0000" "L: f93b0000" "L"
82084-82834 i2s: right: "Right channel: 00010000" "Right: 00010000" "R: 00010000" "R"
82834-83584 i2s: left: "Left channel: fafb0000" "Left: fafb0000" "L: fafb0000" "L"
83584-84335 i2s: right: "Right channel: 00010000" "Right: 00010000" "R: 00010000" "R"
84335-85085 i2s: left: "Left channel: fc8a0000" "Left: fc8a0000" "L: fc8a0000" "L"
85085-85835 i2s: right: "Right channel: 00030000" "Right: 00030000" "R: 00030000" "R"
85835-86585 i2s: left: "Left channel: fe0f0000" "Left: fe0f0000" "L: fe0f0000" "L"
86585-87336 i2s: right: "Right channel: 00040000" "Right: 00040000" "R: 00040000" "R"
87336-88086 i2s: left: "Left channel: ffab0000" "Left: ffab0000" "L: ffab0000" "L"
88086-88836 i2s: right: "Right channel: 00030000" "Right: 00030000" "R: 00030000" "R"
88836-89587 i2s: left: "Left channel: 01280000" "Left: 01280000" "L: 01280000" "L"
89587-90337 i2s: right: "Right channel: 00030000" "Right: 00030000" "R: 00030000" "R"
90337-91087 i2s: left: "Left channel: 023a0000" "Left: 023a0000" "L: 023a0000" "L"
91087-91837 i2s: right: "Right channel: 00020000" "Right: 00020000" "R: 00020000" "R"
91837-92588 i2s: left: "Left channel: 02d40000" "Left: 02d40000" "L: 02d40000" "L"
92588-93338 i2s: right: "Right channel: 00010000" "Right: 00010000" "R: 00010000" "R"
93338-94088 i2s: left: "Left channel: 03250000" "Left: 03250000" "L: 03250000" "L"
94088-94838 i2s: right: "Right channel: 00030000" "Right: 00030000" "R: 00030000" "R"
94838-95589 i2s: left: "Left channel: 036f0000" "Left: 036f0000" "L: 036f0000" "L"
95589-96339 i2s: right: "Right channel: 00020000" "Right: 00020000" "R: 00020000" "R"
96339-97089 i2s: left: "Left channel: 039c0000" "Left: 039c0000" "L: 039c0000" "L"
97089-97839 i2s: right: "Right channel: 00020000" "Right: 00020000" "R: 00020000" "R"
97839-98590 i2s: left: "Left channel: 03700000" "Left: 03700000" "L: 03700000" "L"
98590-99340 i2s: right: "Right channel: ffff0000" "Right: ffff0000" "R: ffff0000" "R"
99340-100090 i2s: left: "Left channel: 02e90000" "Left: 02e90000" "L: 02e90000" "L"
100090-100840 i2s: right: "Right channel: 00030000" "Right: 00030000" "R: 00030000" "R"
100840-101591 i2s: left: "Left channel: 02440000" "Left: 02440000" "L: 02440000" "L"
101591-102341 i2s: right: "Right channel: 00000000" "Right: 00000000" "R: 00000000" "R"
102341-103091 i2s: left: "Left channel: 018c0000" "Left: 018c0000" "L: 018c0000" "L"
103091-103841 i2s: right: "Right channel: 00020000" "Right: 00020000" "R: 00020000" "R"
103841-104592 i2s: left: "Left channel: 00b80000" "Left: 00b80000" "L: 00b80000" "L"
104592-105342 i2s: right: "Right channel: fffd0000" "Right: fffd0000" "R: fffd0000" "R"
105342-106092 i2s: left: "Left channel: ffcd0000" "Left: ffcd0000" "L: ffcd0000" "L"
106092-106842 i2s: right: "Right channel: fffe0000" "Right: fffe0000" "R: fffe0000" "R"
106842-107593 i2s: left: "Left channel: fee30000" "Left: fee30000" "L: fee30000" "L"
107593-108343 i2s: right: "Right channel: 00000000" "Right: 00000000" "R: 00000000" "R"
108343-109093 i2s: left: "Left channel: fdfa0000" "Left: fdfa0000" "L: fdfa0000" "L"
109093-109843 i2s: right: "Right channel: fffc0000" "Right: fffc0000" "R: fffc0000" "R"
109843-110594 i2s: left: "Left channel: fd250000" "Left: fd250000" "L: fd250000" "L"
110594-111344 i2s: right: "Right channel: ffff0000" "Right: ffff0000" "R: ffff0000" "R"
111344-112094 i2s: left: "Left channel: fc2c0000" "Left: fc2c0000" "L: fc2c0000" "L"
112094-112844 i2s: right: "Right channel: 00000000" "Right: 00000000" "R: 00000000" "R"
112844-113595 i2s: left: "Left channel: fb3d0000" "Left: fb3d0000" "L: fb3d0000" "L"
113595-114345 i2s: right: "Right channel: ffff0000" "Right: ffff0000" "R: ffff0000" "R"
114345-115095 i2s: left: "Left channel: fa7e0000" "Left: fa7e0000" "L: fa7e0000" "L"
115095-115845 i2s: right: "Right channel: ffff0000" "Right: ffff0000" "R: ffff0000" "R"
115845-116596 i2s: left: "Left channel: fa0c0000" "Left: fa0c0000" "L: fa0c0000" "L"
116596-117346 i2s: right: "Right channel: 00030000" "Right: 00030000" "R: 00030000" "R"
117346-118096 i2s: left: "Left channel: f9b70000" "Left: f9b70000" "L: f9b70000" "L"
118096-118846 i2s: right: "Right channel: ffff0000" "Right: ffff0000" "R: ffff0000" "R"
118846-119597 i2s: left: "Left channel: f9610000" "Left: f9610000" "L: f9610000" "L"
119597-120347 i2s: right: "Right channel: 00000000" "Right: 00000000" "R: 00000000" "R"
120347-121097 i2s: left: "Left channel: f8e90000" "Left: f8e90000" "L: f8e90000" "L"
121097-121847 i2s: right: "Right channel: 00020000" "Right: 00020000" "R: 00020000" "R"
121847-122598 i2s: left: "Left channel: f8bd0000" "Left: f8bd0000" "L: f8bd0000" "L"
122598-123348 i2s: right: "Right channel: 00000000" "Right: 00000000" "R: 00000000" "R"
123348-124098 i2s: left: "Left channel: f8b40000" "Left: f8b40000" "L: f8b40000" "L"
124098-124848 i2s: right: "Right channel: 00010000" "Right: 00010000" "R: 00010000" "R"
124848-125599 i2s: left: "Left channel: f9130000" "Left: f9130000" "L: f9130000" "L"
125599-126349 i2s: right: "Right channel: ffff0000" "Right: ffff0000" "R: ffff0000" "R"
126349-127099 i2s: left: "Left channel: f9530000" "Left: f9530000" "L: f9530000" "L"
127099-127849 i2s: right: "Right channel: 00010000" "Right: 00010000" "R: 00010000" "R"
127849-128600 i2s: left: "Left channel: f9710000" "Left: f9710000" "L: f9710000" "L"
128600-129350 i2s: right: "Right channel: ffff0000" "Right: ffff0000" "R: ffff0000" "R"
129350-130100 i2s: left: "Left channel: fa0b0000" "Left: fa0b0000" "L: fa0b0000" "L"
130100-130850 i2s: right: "Right channel: 00010000" "Right: 00010000" "R: 00010000" "R"
130850-131601 i2s: left: "Left channel: faa40000" "Left: faa40000" "L: faa40000" "L"
131601-132351 i2s: right: "Right channel: 00000000" "Right: 00000000" "R: 00000000" "R"
132351-133101 i2s: left: "Left channel: fb2c0000" "Left: fb2c0000" "L: fb2c0000" "L"
133101-133851 i2s: right: "Right channel: 00020000" "Right: 00020000" "R: 00020000" "R"
133851-134602 i2s: left: "Left channel: fc0b0000" "Left: fc0b0000" "L: fc0b0000" "L"
134602-135352 i2s: right: "Right channel: 00030000" "Right: 00030000" "R: 00030000" "R"
135352-136102 i2s: left: "Left channel: fc8b0000" "Left: fc8b0000" "L: fc8b0000" "L"
136102-136852 i2s: right: "Right channel: 00010000" "Right: 00010000" "R: 00010000" "R"
136852-137603 i2s: left: "Left channel: fdb50000" "Left: fdb50000" "L: fdb50000" "L"
137603-138353 i2s: right: "Right channel: 00010000" "Right: 00010000" "R: 00010000" "R"
138353-139103 i2s: left: "Left channel: fe360000" "Left: fe360000" "L: fe360000" "L"
139103-139853 i2s: right: "Right channel: 00000000" "Right: 00000000" "R: 00000000" "R"
139853-140604 i2s: left: "Left channel: fef40000" "Left: fef40000" "L: fef40000" "L"
140604-141354 i2s: right: "Right channel: 00000000" "Right: 00000000" "R: 00000000" "R"
141354-142104 i2s: left: "Left channel: ffc40000" "Left: ffc40000" "L: ffc40000" "L"
142104-142854 i2s: right: "Right channel: ffff0000" "Right: ffff0000" "R: ffff0000" "R"
142854-143605 i2s: left: "Left channel: 01290000" "Left: 01290000" "L: 01290000" "L"
143605-144355 i2s: right: "Right channel: 00020000" "Right: 00020000" "R: 00020000" "R"
144355-145105 i2s: left: "Left channel: 03520000" "Left: 03520000" "L: 03520000" "L"
145105-145855 i2s: right: "Right channel: 00030000" "Right: 00030000" "R: 00030000" "R"
145855-146606 i2s: left: "Left channel: 03c10000" "Left: 03c10000" "L: 03c10000" "L"
146606-147356 i2s: right: "Right channel: 00010000" "Right: 00010000" "R: 00010000" "R"
147356-148106 i2s: left: "Left channel: 02830000" "Left: 02830000" "L: 02830000" "L"
148106-148856 i2s: right: "Right channel: 00000000" "Right: 00000000" "R: 00000000" "R"
148856-149607 i2s: left: "Left channel: 01f90000" "Left: 01f90000" "L: 01f90000" "L"
149607-150357 i2s: right: "Right channel: 00010000" "Right: 00010000" "R: 00010000" "R"
150357-151107 i2s: left: "Left channel: 013d0000" "Left: 013d0000" "L: 013d0000" "L"
151107-151857 i2s: right: "Right channel: fffe0000" "Right: fffe0000" "R: fffe0000" "R"
151857-152608 i2s: left: "Left channel: 01430000" "Left: 01430000" "L: 01430000" "L"
152608-153358 i2s: right: "Right channel: 00000000" "Right: 00000000" "R: 00000000" "R"
153358-154108 i2s: left: "Left channel: 000c0000" "Left: 000c0000" "L: 000c0000" "L"
154108-154858 i2s: right: "Right channel: ffff0000" "Right: ffff0000" "R: ffff0000" "R"
154858-155609 i2s: left: "Left channel: fe4b0000" "Left: fe4b0000" "L: fe4b0000" "L"
155609-156359 i2s: right: "Right channel: fffd0000" "Right: fffd0000" "R: fffd0000" "R"
156359-157109 i2s: left: "Left channel: fd3e0000" "Left: fd3e0000" "L: fd3e0000" "L"
157109-157859 i2s: right: "Right channel: ffff0000" "Right: ffff0000" "R: ffff0000" "R"
157859-158610 i2s: left: "Left channel: fc7b0000" "Left: fc7b0000" "L: fc7b0000" "L"
158610-159360 i2s: right: "Right channel: fffe0000" "Right: fffe0000" "R: fffe0000" "R"
159360-160110 i2s: left: "Left channel: fb7e0000" "Left: fb7e0000" "L: fb7e0000" "L"
160110-160860 i2s: right: "Right channel: ffff0000" "Right: ffff0000" "R: ffff0000" "R"
160860-161611 i2s: left: "Left channel: fb4c0000" "Left: fb4c0000" "L: fb4c0000" "L"
161611-162361 i2s: right: "Right channel: ffff0000" "Right: ffff0000" "R: ffff0000" "R"
162361-163111 i2s: left: "Left channel: fbd00000" "Left: fbd00000" "L: fbd00000" "L"
163111-163861 i2s: right: "Right channel: ffff0000" "Right: ffff0000" "R: ffff0000" "R"
163861-164612 i2s: left: "Left channel: fdcc0000" "Left: fdcc0000" "L: fdcc0000" "L"
164612-165362 i2s: right: "Right channel: 00020000" "Right: 00020000" "R: 00020000" "R"
165362-166112 i2s: left: "Left channel: feb20000" "Left: feb20000" "L: feb20000" "L"
166112-166862 i2s: right: "Right channel: 00040000" "Right: 00040000" "R: 00040000" "R"
166862-167613 i2s: left: "Left channel: ffee0000" "Left: ffee0000" "L: ffee0000" "L"
167613-168363 i2s: right: "Right channel: 00000000" "Right: 00000000" "R: 00000000" "R"
168363-169113 i2s: left: "Left channel: 01260000" "Left: 01260000" "L: 01260000" "L"
169113-169863 i2s: right: "Right channel: 00020000" "Right: 00020000" "R: 00020000" "R"
169863-170614 i2s: left: "Left channel: 02d70000" "Left: 02d70000" "L: 02d70000" "L"
170614-171364 i2s: right: "Right channel: 00010000" "Right: 00010000" "R: 00010000" "R"
171364-172114 i2s: left: "Left channel: 04b50000" "Left: 04b50000" "L: 04b50000" "L"
172114-172864 i2s: right: "Right channel: 00020000" "Right: 00020000" "R: 00020000" "R"
172864-173615 i2s: left: "Left channel: 06490000" "Left: 06490000" "L: 06490000" "L"
173615-174365 i2s: right: "Right channel: 00020000" "Right: 00020000" "R: 00020000" "R"
174365-175115 i2s: left: "Left channel: 07980000" "Left: 07980000" "L: 07980000" "L"
175115-175865 i2s: right: "Right channel: 00030000" "Right: 00030000" "R: 00030000" "R"
175865-176616 i2s: left: "Left channel: 08700000" "Left: 08700000" "L: 08700000" "L"
176616-177366 i2s: right: "Right channel: 00000000" "Right: 00000000" "R: 00000000" "R"
177366-178116 i2s: left: "Left channel: 07e20000" "Left: 07e20000" "L: 07e20000" "L"
178116-178866 i2s: right: "Right channel: fffe0000" "Right: fffe0000" "R: fffe0000" "R"
178866-179617 i2s: left: "Left channel: 080f0000" "Left: 080f0000" "L: 080f0000" "L"
179617-180367 i2s: right: "Right channel: ffff0000" "Right: ffff0000" "R: ffff0000" "R"
180367-181117 i2s: left: "Left channel: 07d70000" "Left: 07d70000" "L: 07d70000" "L"
181117-181867 i2s: right: "Right channel: 00000000" "Right: 00000000" "R: 00000000" "R"
181867-182618 i2s: left: "Left channel: 07730000" "Left: 07730000" "L: 07730000" "L"
182618-183368 i2s: right: "Right channel: 00000000" "Right: 00000000" "R: 00000000" "R"
183368-184118 i2s: left: "Left channel: 061a0000" "Left: 061a0000" "L: 061a0000" "L"
184118-184868 i2s: right: "Right channel: fffb0000" "Right: fffb0000" "R: fffb0000" "R"
184868-185619 i2s: left: "Left channel: 04570000" "Left: 04570000" "L: 04570000" "L"
185619-186369 i2s: right: "Right channel: fffe0000" "Right: fffe0000" "R: fffe0000" "R"
186369-187119 i2s: left: "Left channel: 028a0000" "Left: 028a0000" "L: 028a0000" "L"
187119-187869 i2s: right: "Right channel: 00000000" "Right: 00000000" "R: 00000000" "R"
187869-188620 i2s: left: "Left channel: 004e0000" "Left: 004e0000" "L: 004e0000" "L"
188620-189370 i2s: right: "Right channel: fffb0000" "Right: fffb0000" "R: fffb0000" "R"
189370-190120 i2s: left: "Left channel: fd5a0000" "Left: fd5a0000" "L: fd5a0000" "L"
190120-190870 i2s: right: "Right channel: fffe0000" "Right: fffe0000" "R: fffe0000" "R"
190870-191621 i2s: left: "Left channel: fb0c0000" "Left: fb0c0000" "L: fb0c0000" "L"
191621-192371 i2s: right: "Right channel: fffe0000" "Right: fffe0000" "R: fffe0000" "R"
192371-193121 i2s: left: "Left channel: f9160000" "Left: f9160000" "L: f9160000" "L"
193121-193871 i2s: right: "Right channel: ffff0000" "Right: ffff0000" "R: ffff0000" "R"
193871-194622 i2s: left: "Left channel: f7c70000" "Left: f7c70000" "L: f7c70000" "L"
194622-195372 i2s: right: "Right channel: ffff0000" "Right: ffff0000" "R: ffff0000" "R"
195372-196122 i2s: left: "Left channel: f5930000" "Left: f5930000" "L: f5930000" "L"
196122-196873 i2s: right: "Right channel: 00000000" "Right: 00000000" "R: 00000000" "R"
196873-197623 i2s: left: "Left channel: f4170000" "Left: f4170000" "L: f4170000" "L"
197623-198373 i2s: right: "Right channel: ffff0000" "Right: ffff0000" "R: ffff0000" "R"
198373-199123 i2s: left: "Left channel: f3730000" "Left: f3730000" "L: f3730000" "L"
199123-199874 i2s: right: "Right channel: 00010000" "Right: 00010000" "R: 00010000" "R"
199874-200624 i2s: left: "Left channel: f3860000" "Left: f3860000" "L: f3860000" "L"
200624-201374 i2s: right: "Right channel: fffd0000" "Right: fffd0000" "R: fffd0000" "R"
201374-202124 i2s: left: "Left channel: f4250000" "Left: f4250000" "L: f4250000" "L"
202124-202875 i2s: right: "Right channel: 00010000" "Right: 00010000" "R: 00010000" "R"
202875-203625 i2s: left: "Left channel: f5060000" "Left: f5060000" "L: f5060000" "L"
203625-204375 i2s: right: "Right channel: ffff0000" "Right: ffff0000" "R: ffff0000" "R"
204375-205125 i2s: left: "Left channel: f6260000" "Left: f6260000" "L: f6260000" "L"
205125-205876 i2s: right: "Right channel: 00020000" "Right: 00020000" "R: 00020000" "R"
205876-206626 i2s: left: "Left channel: f7c90000" "Left: f7c90000" "L: f7c90000" "L"
206626-207376 i2s: right: "Right channel: 00030000" "Right: 00030000" "R: 00030000" "R"
207376-208126 i2s: left: "Left channel: f9580000" "Left: f9580000" "L: f9580000" "L"
208126-208877 i2s: right: "Right channel: 00050000" "Right: 00050000" "R: 00050000" "R"
208877-209627 i2s: left: "Left channel: fb950000" "Left: fb950000" "L: fb950000" "L"
209627-210377 i2s: right: "Right channel: 00040000" "Right: 00040000" "R: 00040000" "R"
210377-211127 i2s: left: "Left channel: fded0000" "Left: fded0000" "L: fded0000" "L"
211127-211878 i2s: right: "Right channel: 00030000" "Right: 00030000" "R: 00030000" "R"
211878-212628 i2s: left: "Left channel: 00380000" "Left: 00380000" "L: 00380000" "L"
212628-213378 i2s: right: "Right channel: 00040000" "Right: 00040000" "R: 00040000" "R"
213378-214128 i2s: left: "Left channel: 02620000" "Left: 02620000" "L: 02620000" "L"
214128-214879 i2s: right: "Right channel: 00050000" "Right: 00050000" "R: 00050000" "R"
214879-215629 i2s: left: "Left channel: 04980000" "Left: 04980000" "L: 04980000" "L"
215629-216379 i2s: right: "Right channel: 00000000" "Right: 00000000" "R: 00000000" "R"
216379-217129 i2s: left: "Left channel: 06ae0000" "Left: 06ae0000" "L: 06ae0000" "L"
217129-217880 i2s: right: "Right channel: 00020000" "Right: 00020000" "R: 00020000" "R"
217880-218630 i2s: left: "Left channel: 084c0000" "Left: 084c0000" "L: 084c0000" "L"
218630-219380 i2s: right: "Right channel: 00020000" "Right: 00020000" "R: 00020000" "R"
219380-220130 i2s: left: "Left channel: 09fb0000" "Left: 09fb0000" "L: 09fb0000" "L"
220130-220881 i2s: right: "Right channel: 00040000" "Right: 00040000" "R: 00040000" "R"
220881-221631 i2s: left: "Left channel: 0c060000" "Left: 0c060000" "L: 0c060000" "L"
221631-222381 i2s: right: "Right channel: 00020000" "Right: 00020000" "R: 00020000" "R"
222381-223131 i2s: left: "Left channel: 0db40000" "Left: 0db40000" "L: 0db40000" "L"
223131-223882 i2s: right: "Right channel: 00010000" "Right: 00010000" "R: 00010000" "R"
223882-224632 i2s: left: "Left channel: 0edf0000" "Left: 0edf0000" "L: 0edf0000" "L"
224632-225382 i2s: right: "Right channel: 00010000" "Right: 00010000" "R: 00010000" "R"
225382-226132 i2s: left: "Left channel: 0f780000" "Left: 0f780000" "L: 0f780000" "L"
226132-226883 i2s: right: "Right channel: ffff0000" "Right: ffff0000" "R: ffff0000" "R"
226883-227633 i2s: left: "Left channel: 105c0000" "Left: 105c0000" "L: 105c0000" "L"
227633-228383 i2s: right: "Right channel: 00010000" "Right: 00010000" "R: 00010000" "R"
228383-229133 i2s: left: "Left channel: 11770000" "Left: 11770000" "L: 11770000" "L"
229133-229884 i2s: right: "Right channel: 00020000" "Right: 00020000" "R: 00020000" "R"
229884-230634 i2s: left: "Left channel: 12360000" "Left: 12360000" "L: 12360000" "L"
230634-231384 i2s: right: "Right channel: 00000000" "Right: 00000000" "R: 00000000" "R"
231384-232134 i2s: left: "Left channel: 12980000" "Left: 12980000" "L: 12980000" "L"
232134-232885 i2s: right: "Right channel: 00020000" "Right: 00020000" "R: 00020000" "R"
232885-233635 i2s: left: "Left channel: 12dc0000" "Left: 12dc0000" "L: 12dc0000" "L"
233635-234385 i2s: right: "Right channel: 00000000" "Right: 00000000" "R: 00000000" "R"
234385-235135 i2s: left: "Left channel: 12e80000" "Left: 12e80000" "L: 12e80000" "L"
235135-235886 i2s: right: "Right channel: 00000000" "Right: 00000000" "R: 00000000" "R"
235886-236636 i2s: left: "Left channel: 12980000" "Left: 12980000" "L: 12980000" "L"
236636-237386 i2s: right: "Right channel: fffd0000" "Right: fffd0000" "R: fffd0000" "R"
237386-238136 i2s: left: "Left channel: 11f70000" "Left: 11f70000" "L: 11f70000" "L"
238136-238887 i2s: right: "Right channel: ffff0000" "Right: ffff0000" "R: ffff0000" "R"
238887-239637 i2s: left: "Left channel: 113c0000" "Left: 113c0000" "L: 113c0000" "L"
239637-240387 i2s: right: "Right channel: fffe0000" "Right: fffe0000" "R: fffe0000" "R"
240387-241137 i2s: left: "Left channel: 10300000" "Left: 10300000" "L: 10300000" "L"
241137-241888 i2s: right: "Right channel: fffe0000" "Right: fffe0000" "R: fffe0000" "R"
241888-242638 i2s: left: "Left channel: 0ecd0000" "Left: 0ecd0000" "L: 0ecd0000" "L"
242638-243388 i2s: right: "Right channel: ffff0000" "Right: ffff0000" "R: ffff0000" "R"
243388-244138 i2s: left: "Left channel: 0ccd0000" "Left: 0ccd0000" "L: 0ccd0000" "L"
244138-244889 i2s: right: "Right channel: fffd0000" "Right: fffd0000" "R: fffd0000" "R"
244889-245639 i2s: left: "Left channel: 0a310000" "Left: 0a310000" "L: 0a310000" "L"
245639-246389 i2s: right: "Right channel: fffb0000" "Right: fffb0000" "R: fffb0000" "R"
246389-247139 i2s: left: "Left channel: 076c0000" "Left: 076c0000" "L: 076c0000" "L"
247139-247890 i2s: right: "Right channel: fffc0000" "Right: fffc0000" "R: fffc0000" "R"
247890-248640 i2s: left: "Left channel: 04c20000" "Left: 04c20000" "L: 04c20000" "L"
248640-249390 i2s: right: "Right channel: fffa0000" "Right: fffa0000" "R: fffa0000" "R"
249390-250140 i2s: left: "Left channel: 01d50000" "Left: 01d50000" "L: 01d50000" "L"
250140-250891 i2s: right: "Right channel: fffb0000" "Right: fffb0000" "R: fffb0000" "R"
250891-251641 i2s: left: "Left channel: fefc0000" "Left: fefc0000" "L: fefc0000" "L"
251641-252391 i2s: right: "Right channel: fffb0000" "Right: fffb0000" "R: fffb0000" "R"
252391-253141 i2s: left: "Left channel: fbb50000" "Left: fbb50000" "L: fbb50000" "L"
253141-253892 i2s: right: "Right channel: fffc0000" "Right: fffc0000" "R: fffc0000" "R"
253892-254642 i2s: left: "Left channel: f8950000" "Left: f8950000" "L: f8950000" "L"
254642-255392 i2s: right: "Right channel: fffb0000" "Right: fffb0000" "R: fffb0000" "R"
255392-256142 i2s: left: "Left channel: f60e0000" "Left: f60e0000" "L: f60e0000" "L"
256142-256893 i2s: right: "Right channel: fffd0000" "Right: fffd0000" "R: fffd0000" "R"
256893-257643 i2s: left: "Left channel: f4160000" "Left: f4160000" "L: f4160000" "L"
257643-258393 i2s: right: "Right channel: fffd0000" "Right: fffd0000" "R: fffd0000" "R"
258393-259143 i2s: left: "Left channel: f2740000" "Left: f2740000" "L: f2740000" "L"
259143-259894 i2s: right: "Right channel: ffff0000" "Right: ffff0000" "R: ffff0000" "R"
259894-260644 i2s: left: "Left channel: f13a0000" "Left: f13a0000" "L: f13a0000" "L"
260644-261394 i2s: right: "Right channel: ffff0000" "Right: ffff0000" "R: ffff0000" "R"
261394-262144 i2s: left: "Left channel: f06f0000" "Left: f06f0000" "L: f06f0000" "L"
262144-262895 i2s: right: "Right channel: fffe0000" "Right: fffe0000" "R: fffe0000" "R"
262895-263645 i2s: left: "Left channel: f04b0000" "Left: f04b0000" "L: f04b0000" "L"
263645-264395 i2s: right: "Right channel: 00000000" "Right: 00000000" "R: 00000000" "R"
264395-265145 i2s: left: "Left channel: f08c0000" "Left: f08c0000" "L: f08c0000" "L"
265145-265896 i2s: right: "Right channel: ffff0000" "Right: ffff0000" "R: ffff0000" "R"
265896-266646 i2s: left: "Left channel: f1390000" "Left: f1390000" "L: f1390000" "L"
266646-267396 i2s: right: "Right channel: 00030000" "Right: 00030000" "R: 00030000" "R"
267396-268146 i2s: left: "Left channel: f2420000" "Left: f2420000" "L: f2420000" "L"
268146-268897 i2s: right: "Right channel: 00010000" "Right: 00010000" "R: 00010000" "R"
268897-269647 i2s: left: "Left channel: f3d00000" "Left: f3d00000" "L: f3d00000" "L"
269647-270397 i2s: right: "Right channel: 00040000" "Right: 00040000" "R: 00040000" "R"
270397-271147 i2s: left: "Left channel: f59a0000" "Left: f59a0000" "L: f59a0000" "L"
271147-271898 i2s: right: "Right channel: 00020000" "Right: 00020000" "R: 00020000" "R"
271898-272648 i2s: left: "Left channel: f74e0000" "Left: f74e0000" "L: f74e0000" "L"
272648-273398 i2s: right: "Right channel: 00030000" "Right: 00030000" "R: 00030000" "R"
273398-274148 i2s: left: "Left channel: f8cc0000" "Left: f8cc0000" "L: f8cc0000" "L"
274148-274899 i2s: right: "Right channel: 00000000" "Right: 00000000" "R: 00000000" "R"
274899-275649 i2s: left: "Left channel: fa4f0000" "Left: fa4f0000" "L: fa4f0000" "L"
275649-276399 i2s: right: "Right channel: 00030000" "Right: 00030000" "R: 00030000" "R"
276399-277149 i2s: left: "Left channel: fc0d0000" "Left: fc0d0000" "L: fc0d0000" "L"
277149-277900 i2s: right: "Right channel: 00020000" "Right: 00020000" "R: 00020000" "R"
277900-278650 i2s: left: "Left channel: fdb60000" "Left: fdb60000" "L: fdb60000" "L"
278650-279400 i2s: right: "Right channel: 00030000" "Right: 00030000" "R: 00030000" "R"
279400-280150 i2s: left: "Left channel: feeb0000" "Left: feeb0000" "L: feeb0000" "L"
280150-280901 i2s: right: "Right channel: 00030000" "Right: 00030000" "R: 00030000" "R"
280901-281651 i2s: left: "Left channel: ffc90000" "Left: ffc90000" "L: ffc90000" "L"
281651-282401 i2s: right: "Right channel: 00010000" "Right: 00010000" "R: 00010000" "R"
282401-283151 i2s: left: "Left channel: 00790000" "Left: 00790000" "L: 00790000" "L"
283151-283902 i2s: right: "Right channel: 00020000" "Right: 00020000" "R: 00020000" "R"
283902-284652 i2s: left: "Left channel: 011b0000" "Left: 011b0000" "L: 011b0000" "L"
284652-285402 i2s: right: "Right channel: 00010000" "Right: 00010000" "R: 00010000" "R"
285402-286152 i2s: left: "Left channel: 01a60000" "Left: 01a60000" "L: 01a60000" "L"
286152-286903 i2s: right: "Right channel: 00000000" "Right: 00000000" "R: 00000000" "R"
286903-287653 i2s: left: "Left channel: 01f50000" "Left: 01f50000" "L: 01f50000" "L"
287653-288403 i2s: right: "Right channel: 00010000" "Right: 00010000" "R: 00010000" "R"
288403-289153 i2s: left: "Left channel: 021b0000" "Left: 021b0000" "L: 021b0000" "L"
289153-289904 i2s: right: "Right channel: 00010000" "Right: 00010000" "R: 00010000" "R"
289904-290654 i2s: left: "Left channel: 02260000" "Left: 02260000" "L: 02260000" "L"
290654-291404 i2s: right: "Right channel: 00000000" "Right: 00000000" "R: 00000000" "R"
291404-292154 i2s: left: "Left channel: 02160000" "Left: 02160000" "L: 02160000" "L"
292154-292905 i2s: right: "Right channel: ffff0000" "Right: ffff0000" "R: ffff0000" "R"
292905-293655 i2s: left: "Left channel: 01e00000" "Left: 01e00000" "L: 01e00000" "L"
293655-294405 i2s: right: "Right channel: 00010000" "Right: 00010000" "R: 00010000" "R"
294405-295155 i2s: left: "Left channel: 01af0000" "Left: 01af0000" "L: 01af0000" "L"
295155-295906 i2s: right: "Right channel: 00000000" "Right: 00000000" "R: 00000000" "R"
295906-296656 i2s: left: "Left channel: 01670000" "Left: 01670000" "L: 01670000" "L"
296656-297406 i2s: right: "Right channel: 00000000" "Right: 00000000" "R: 00000000" "R"
297406-298156 i2s: left: "Left channel: 01390000" "Left: 01390000" "L: 01390000" "L"
298156-298907 i2s: right: "Right channel: ffff0000" "Right: ffff0000" "R: ffff0000" "R"
298907-299657 i2s: left: "Left channel: 01040000" "Left: 01040000" "L: 01040000" "L"
299657-300407 i2s: right: "Right channel: 00000000" "Right: 00000000" "R: 00000000" "R"
300407-301157 i2s: left: "Left channel: 00960000" "Left: 00960000" "L: 00960000" "L"
301157-301908 i2s: right: "Right channel: 00010000" "Right: 00010000" "R: 00010000" "R"
301908-302658 i2s: left: "Left channel: fff10000" "Left: fff10000" "L: fff10000" "L"
302658-303408 i2s: right: "Right channel: fffe0000" "Right: fffe0000" "R: fffe0000" "R"
303408-304158 i2s: left: "Left channel: ff3d0000" "Left: ff3d0000" "L: ff3d0000" "L"
304158-304909 i2s: right: "Right channel: 00010000" "Right: 00010000" "R: 00010000" "R"
304909-305659 i2s: left: "Left channel: fe9b0000" "Left: fe9b0000" "L: fe9b0000" "L"
305659-306409 i2s: right: "Right channel: 00020000" "Right: 00020000" "R: 00020000" "R"
306409-307159 i2s: left: "Left channel: fe2b0000" "Left: fe2b0000" "L: fe2b0000" "L"
307159-307910 i2s: right: "Right channel: ffff0000" "Right: ffff0000" "R: ffff0000" "R"
307910-308660 i2s: left: "Left channel: fd520000" "Left: fd520000" "L: fd520000" "L"
308660-309410 i2s: right: "Right channel: ffff0000" "Right: ffff0000" "R: ffff0000" "R"
309410-310160 i2s: left: "Left channel: fcda0000" "Left: fcda0000" "L: fcda0000" "L"
310160-310911 i2s: right: "Right channel: ffff0000" "Right: ffff0000" "R: ffff0000" "R"
310911-311661 i2s: left: "Left channel: fc120000" "Left: fc120000" "L: fc120000" "L"
311661-312411 i2s: right: "Right channel: 00000000" "Right: 00000000" "R: 00000000" "R"
312411-313161 i2s: left: "Left channel: fb810000" "Left: fb810000" "L: fb810000" "L"
313161-313912 i2s: right: "Right channel: ffff0000" "Right: ffff0000" "R: ffff0000" "R"
313912-314662 i2s: left: "Left channel: fb320000" "Left: fb320000" "L: fb320000" "L"
314662-315412 i2s: right: "Right channel: 00010000" "Right: 00010000" "R: 00010000" "R"
315412-316162 i2s: left: "Left channel: faae0000" "Left: faae0000" "L: faae0000" "L"
316162-316913 i2s: right: "Right channel: 00000000" "Right: 00000000" "R: 00000000" "R"
316913-317663 i2s: left: "Left channel: fa730000" "Left: fa730000" "L: fa730000" "L"
317663-318413 i2s: right: "Right channel: ffff0000" "Right: ffff0000" "R: ffff0000" "R"
318413-319164 i2s: left: "Left channel: fa290000" "Left: fa290000" "L: fa290000" "L"
319164-319914 i2s: right: "Right channel: ffff0000" "Right: ffff0000" "R: ffff0000" "R"
319914-320664 i2s: left: "Left channel: fa850000" "Left: fa850000" "L: fa850000" "L"
320664-321414 i2s: right: "Right channel: 00030000" "Right: 00030000" "R: 00030000" "R"
321414-322165 i2s: left: "Left channel: fb4a0000" "Left: fb4a0000" "L: fb4a0000" "L"
322165-322915 i2s: right: "Right channel: 00010000" "Right: 00010000" "R: 00010000" "R"
322915-323665 i2s: left: "Left channel: fcf50000" "Left: fcf50000" "L: fcf50000" "L"
323665-324415 i2s: right: "Right channel: 00010000" "Right: 00010000" "R: 00010000" "R"
324415-325165 i2s: left: "Left channel: fd0a0000" "Left: fd0a0000" "L: fd0a0000" "L"
325165-325916 i2s: right: "Right channel: 00000000" "Right: 00000000" "R: 00000000" "R"
325916-326666 i2s: left: "Left channel: fc460000" "Left: fc460000" "L: fc460000" "L"
326666-327416 i2s: right: "Right channel: 00000000" "Right: 00000000" "R: 00000000" "R"
327416-328167 i2s: left: "Left channel: fbd30000" "Left: fbd30000" "L: fbd30000" "L"
328167-328917 i2s: right: "Right channel: fffd0000" "Right: fffd0000" "R: fffd0000" "R"
328917-329667 i2s: left: "Left channel: fc050000" "Left: fc050000" "L: fc050000" "L"
329667-330417 i2s: right: "Right channel: 00010000" "Right: 00010000" "R: 00010000" "R"
330417-331168 i2s: left: "Left channel: fc4e0000" "Left: fc4e0000" "L: fc4e0000" "L"
331168-331918 i2s: right: "Right channel: 00000000" "Right: 00000000" "R: 00000000" "R"
331918-332668 i2s: left: "Left channel: fbf30000" "Left: fbf30000" "L: fbf30000" "L"
332668-333418 i2s: right: "Right channel: 00000000" "Right: 00000000" "R: 00000000" "R"
333418-334169 i2s: left: "Left channel: fb0e0000" "Left: fb0e0000" "L: fb0e0000" "L"
334169-334919 i2s: right: "Right channel: 00000000" "Right: 00000000" "R: 00000000" "R"
334919-335669 i2s: left: "Left channel: fad20000" "Left: fad20000" "L: fad20000" "L"
335669-336419 i2s: right: "Right channel: 00010000" "Right: 00010000" "R: 00010000" "R"
336419-337170 i2s: left: "Left channel: faff0000" "Left: faff0000" "L: faff0000" "L"
337170-337920 i2s: right: "Right channel: 00010000" "Right: 00010000" "R: 00010000" "R"
337920-338670 i2s: left: "Left channel: fac00000" "Left: fac00000" "L: fac00000" "L"
338670-339420 i2s: right: "Right channel: 00000000" "Right: 00000000" "R: 00000000" "R"
339420-340171 i2s: left: "Left channel: fb390000" "Left: fb390000" "L: fb390000" "L"
340171-340921 i2s: right: "Right channel: ffff0000" "Right: ffff0000" "R: ffff0000" "R"
340921-341671 i2s: left: "Left channel: fc850000" "Left: fc850000" "L: fc850000" "L"
341671-342421 i2s: right: "Right channel: 00010000" "Right: 00010000" "R: 00010000" "R"
342421-343172 i2s: left: "Left channel: feca0000" "Left: feca0000" "L: feca0000" "L"
343172-343922 i2s: right: "Right channel: 00010000" "Right: 00010000" "R: 00010000" "R"
343922-344672 i2s: left: "Left channel: 000e0000" "Left: 000e0000" "L: 000e0000" "L"
344672-345422 i2s: right: "Right channel: 00000000" "Right: 00000000" "R: 00000000" "R"
345422-346173 i2s: left: "Left channel: 01930000" "Left: 01930000" "L: 01930000" "L"
346173-346923 i2s: right: "Right channel: 00010000" "Right: 00010000" "R: 00010000" "R"
346923-347673 i2s: left: "Left channel: 02b60000" "Left: 02b60000" "L: 02b60000" "L"
347673-348423 i2s: right: "Right channel: 00000000" "Right: 00000000" "R: 00000000" "R"
348423-349174 i2s: left: "Left channel: 04ab0000" "Left: 04ab0000" "L: 04ab0000" "L"
349174-349924 i2s: right: "Right channel: 00010000" "Right: 00010000" "R: 00010000" "R"
349924-350674 i2s: left: "Left channel: 063a0000" "Left: 063a0000" "L: 063a0000" "L"
350674-351424 i2s: right: "Right channel: 00010000" "Right: 00010000" "R: 00010000" "R"
351424-352175 i2s: left: "Left channel: 07b30000" "Left: 07b30000" "L: 07b30000" "L"
352175-352925 i2s: right: "Right channel: 00010000" "Right: 00010000" "R: 00010000" "R"
352925-353675 i2s: left: "Left channel: 08500000" "Left: 08500000" "L: 08500000" "L"
353675-354425 i2s: right: "Right channel: 00020000" "Right: 00020000" "R: 00020000" "R"
354425-355176 i2s: left: "Left channel: 08c50000" "Left: 08c50000" "L: 08c50000" "L"
355176-355926 i2s: right: "Right channel: 00010000" "Right: 00010000" "R: 00010000" "R"
355926-356676 i2s: left: "Left channel: 080e0000" "Left: 080e0000" "L: 080e0000" "L"
356676-357426 i2s: right: "Right channel: 00010000" "Right: 00010000" "R: 00010000" "R"
357426-358177 i2s: left: "Left channel: 07d40000" "Left: 07d40000" "L: 07d40000" "L"
358177-358927 i2s: right: "Right channel: ffff0000" "Right: ffff0000" "R: ffff0000" "R"
358927-359677 i2s: left: "Left channel: 070e0000" "Left: 070e0000" "L: 070e0000" "L"
359677-360427 i2s: right: "Right channel: fffe0000" "Right: fffe0000" "R: fffe0000" "R"
360427-361178 i2s: left: "Left channel: 06130000" "Left: 06130000" "L: 06130000" "L"
361178-361928 i2s: right: "Right channel: ffff0000" "Right: ffff0000" "R: ffff0000" "R"
361928-362678 i2s: left: "Left channel: 04160000" "Left: 04160000" "L: 04160000" "L"
362678-363428 i2s: right: "Right channel: fffe0000" "Right: fffe0000" "R: fffe0000" "R"
363428-364179 i2s: left: "Left channel: 02300000" "Left: 02300000" "L: 02300000" "L"
364179-364929 i2s: right: "Right channel: fffd0000" "Right: fffd0000" "R: fffd0000" "R"
364929-365679 i2s: left: "Left channel: ffe40000" "Left: ffe40000" "L: ffe40000" "L"
365679-366429 i2s: right: "Right channel: ffff0000" "Right: ffff0000" "R: ffff0000" "R"
366429-367180 i2s: left: "Left channel: fd920000" "Left: fd920000" "L: fd920000" "L"
367180-367930 i2s: right: "Right channel: fffd0000" "Right: fffd0000" "R: fffd0000" "R"
367930-368680 i2s: left: "Left channel: faea0000" "Left: faea0000" "L: faea0000" "L"
368680-369430 i2s: right: "Right channel: fffb0000" "Right: fffb0000" "R: fffb0000" "R"
369430-370181 i2s: left: "Left channel: f90f0000" "Left: f90f0000" "L: f90f0000" "L"
370181-370931 i2s: right: "Right channel: fffd0000" "Right: fffd0000" "R: fffd0000" "R"
370931-371681 i2s: left: "Left channel: f7860000" "Left: f7860000" "L: f7860000" "L"
371681-372431 i2s: right: "Right channel: fffe0000" "Right: fffe0000" "R: fffe0000" "R"
372431-373182 i2s: left: "Left channel: f6590000" "Left: f6590000" "L: f6590000" "L"
373182-373932 i2s: right: "Right channel: fffd0000" "Right: fffd0000" "R: fffd0000" "R"
373932-374682 i2s: left: "Left channel: f4a10000" "Left: f4a10000" "L: f4a10000" "L"
374682-375432 i2s: right: "Right channel: fffe0000" "Right: fffe0000" "R: fffe0000" "R"
375432-376183 i2s: left: "Left channel: f3d60000" "Left: f3d60000" "L: f3d60000" "L"
376183-376933 i2s: right: "Right channel: fffe0000" "Right: fffe0000" "R: fffe0000" "R"
376933-377683 i2s: left: "Left channel: f3c30000" "Left: f3c30000" "L: f3c30000" "L"
377683-378433 i2s: right: "Right channel: fffe0000" "Right: fffe0000" "R: fffe0000" "R"
378433-379184 i2s: left: "Left channel: f4720000" "Left: f4720000" "L: f4720000" "L"
379184-379934 i2s: right: "Right channel: ffff0000" "Right: ffff0000" "R: ffff0000" "R"
379934-380684 i2s: left: "Left channel: f55b0000" "Left: f55b0000" "L: f55b0000" "L"
380684-381434 i2s: right: "Right channel: 00000000" "Right: 00000000" "R: 00000000" "R"
381434-382185 i2s: left: "Left channel: f6a00000" "Left: f6a00000" "L: f6a00000" "L"
382185-382935 i2s: right: "Right channel: 00050000" "Right: 00050000" "R: 00050000" "R"
382935-383685 i2s: left: "Left channel: f7da0000" "Left: f7da0000" "L: f7da0000" "L"
383685-384435 i2s: right: "Right channel: 00020000" "Right: 00020000" "R: 00020000" "R"
384435-385186 i2s: left: "Left channel: f9620000" "Left: f9620000" "L: f9620000" "L"
385186-385936 i2s: right: "Right channel: 00010000" "Right: 00010000" "R: 00010000" "R"
385936-386686 i2s: left: "Left channel: fb160000" "Left: fb160000" "L: fb160000" "L"
386686-387436 i2s: right: "Right channel: 00020000" "Right: 00020000" "R: 00020000" "R"
387436-388187 i2s: left: "Left channel: fd2a0000" "Left: fd2a0000" "L: fd2a0000" "L"
388187-388937 i2s: right: "Right channel: 00030000" "Right: 00030000" "R: 00030000" "R"
388937-389687 i2s: left: "Left channel: ff510000" "Left: ff510000" "L: ff510000" "L"
389687-390437 i2s: right: "Right channel: 00020000" "Right: 00020000" "R: 00020000" "R"
390437-391188 i2s: left: "Left channel: 01610000" "Left: 01610000" "L: 01610000" "L"
391188-391938 i2s: right: "Right channel: 00040000" "Right: 00040000" "R: 00040000" "R"
391938-392688 i2s: left: "Left channel: 03670000" "Left: 03670000" "L: 03670000" "L"
392688-393438 i2s: right: "Right channel: 00030000" "Right: 00030000" "R: 00030000" "R"
393438-394189 i2s: left: "Left channel: 05730000" "Left: 05730000" "L: 05730000" "L"
394189-394939 i2s: right: "Right channel: 00010000" "Right: 00010000" "R: 00010000" "R"
394939-395689 i2s: left: "Left channel: 074d0000" "Left: 074d0000" "L: 074d0000" "L"
395689-396439 i2s: right: "Right channel: 00020000" "Right: 00020000" "R: 00020000" "R"
396439-397190 i2s: left: "Left channel: 08ef0000" "Left: 08ef0000" "L: 08ef0000" "L"
397190-397940 i2s: right: "Right channel: 00030000" "Right: 00030000" "R: 00030000" "R"
397940-398690 i2s: left: "Left channel: 0af20000" "Left: 0af20000" "L: 0af20000" "L"
398690-399440 i2s: right: "Right channel: 00030000" "Right: 00030000" "R: 00030000" "R"
399440-400191 i2s: left: "Left channel: 0d460000" "Left: 0d460000" "L: 0d460000" "L"
400191-400941 i2s: right: "Right channel: 00050000" "Right: 00050000" "R: 00050000" "R"
400941-401691 i2s: left: "Left channel: 0f2c0000" "Left: 0f2c0000" "L: 0f2c0000" "L"
401691-402441 i2s: right: "Right channel: 00030000" "Right: 00030000" "R: 00030000" "R"
402441-403192 i2s: left: "Left channel: 10760000" "Left: 10760000" "L: 10760000" "L"
403192-403942 i2s: right: "Right channel: 00000000" "Right: 00000000" "R: 00000000" "R"
403942-404692 i2s: left: "Left channel: 11690000" "Left: 11690000" "L: 11690000" "L"
404692-405442 i2s: right: "Right channel: 00020000" "Right: 00020000" "R: 00020000" "R"
405442-406193 i2s: left: "Left channel: 12ac0000" "Left: 12ac0000" "L: 12ac0000" "L"
406193-406943 i2s: right: "Right channel: 00010000" "Right: 00010000" "R: 00010000" "R"
406943-407693 i2s: left: "Left channel: 140b0000" "Left: 140b0000" "L: 140b0000" "L"
407693-408443 i2s: right: "Right channel: 00020000" "Right: 00020000" "R: 00020000" "R"
408443-409194 i2s: left: "Left channel: 14d50000" "Left: 14d50000" "L: 14d50000" "L"
409194-409944 i2s: right: "Right channel: 00000000" "Right: 00000000" "R: 00000000" "R"
409944-410694 i2s: left: "Left channel: 15050000" "Left: 15050000" "L: 15050000" "L"
410694-411444 i2s: right: "Right channel: ffff0000" "Right: ffff0000" "R: ffff0000" "R"
411444-412195 i2s: left: "Left channel: 14fd0000" "Left: 14fd0000" "L: 14fd0000" "L"
412195-412945 i2s: right: "Right channel: ffff0000" "Right: ffff0000" "R: ffff0000" "R"
412945-413695 i2s: left: "Left channel: 14b70000" "Left: 14b70000" "L: 14b70000" "L"
413695-414445 i2s: right: "Right channel: 00010000" "Right: 00010000" "R: 00010000" "R"
414445-415196 i2s: left: "Left channel: 141b0000" "Left: 141b0000" "L: 141b0000" "L"
415196-415946 i2s: right: "Right channel: fffe0000" "Right: fffe0000" "R: fffe0000" "R"
415946-416696 i2s: left: "Left channel: 12ed0000" "Left: 12ed0000" "L: 12ed0000" "L"
416696-417446 i2s: right: "Right channel: ffff0000" "Right: ffff0000" "R: ffff0000" "R"
417446-418197 i2s: left: "Left channel: 11650000" "Left: 11650000" "L: 11650000" "L"
418197-418947 i2s: right: "Right channel: 00000000" "Right: 00000000" "R: 00000000" "R"
418947-419697 i2s: left: "Left channel: 0fcf0000" "Left: 0fcf0000" "L: 0fcf0000" "L"
419697-420447 i2s: right: "Right channel: fffa0000" "Right: fffa0000" "R: fffa0000" "R"
420447-421198 i2s: left: "Left channel: 0e0b0000" "Left: 0e0b0000" "L: 0e0b0000" "L"
421198-421948 i2s: right: "Right channel: ffff0000" "Right: ffff0000" "R: ffff0000" "R"
421948-422698 i2s: left: "Left channel: 0b7a0000" "Left: 0b7a0000" "L: 0b7a0000" "L"
422698-423448 i2s: right: "Right channel: fffc0000" "Right: fffc0000" "R: fffc0000" "R"
423448-424199 i2s: left: "Left channel: 081f0000" "Left: 081f0000" "L: 081f0000" "L"
424199-424949 i2s: right: "Right channel: fffd0000" "Right: fffd0000" "R: fffd0000" "R"
424949-425699 i2s: left: "Left channel: 04fe0000" "Left: 04fe0000" "L: 04fe0000" "L"
425699-426449 i2s: right: "Right channel: fffc0000" "Right: fffc0000" "R: fffc0000" "R"
426449-427200 i2s: left: "Left channel: 01fc0000" "Left: 01fc0000" "L: 01fc0000" "L"
427200-427950 i2s: right: "Right channel: fffb0000" "Right: fffb0000" "R: fffb0000" "R"
427950-428700 i2s: left: "Left channel: ff560000" "Left: ff560000" "L: ff560000" "L"
428700-429450 i2s: right: "Right channel: fffd0000" "Right: fffd0000" "R: fffd0000" "R"
429450-430201 i2s: left: "Left channel: fc550000" "Left: fc550000" "L: fc550000" "L"
430201-430951 i2s: right: "Right channel: fffb0000" "Right: fffb0000" "R: fffb0000" "R"
430951-431701 i2s: left: "Left channel: f9200000" "Left: f9200000" "L: f9200000" "L"
431701-432451 i2s: right: "Right channel: fffc0000" "Right: fffc0000" "R: fffc0000" "R"
432451-433202 i2s: left: "Left channel: f65e0000" "Left: f65e0000" "L: f65e0000" "L"
433202-433952 i2s: right: "Right channel: fffc0000" "Right: fffc0000" "R: fffc0000" "R"
433952-434702 i2s: left: "Left channel: f4760000" "Left: f4760000" "L: f4760000" "L"
434702-435453 i2s: right: "Right channel: fffc0000" "Right: fffc0000" "R: fffc0000" "R"
435453-436203 i2s: left: "Left channel: f2ea0000" "Left: f2ea0000" "L: f2ea0000" "L"
436203-436953 i2s: right: "Right channel: fffe0000" "Right: fffe0000" "R: fffe0000" "R"
436953-437703 i2s: left: "Left channel: f1d40000" "Left: f1d40000" "L: f1d40000" "L"
437703-438454 i2s: right: "Right channel: fffd0000" "Right: fffd0000" "R: fffd0000" "R"
438454-439204 i2s: left: "Left channel: f1130000" "Left: f1130000" "L: f1130000" "L"
439204-439954 i2s: right: "Right channel: 00000000" "Right: 00000000" "R: 00000000" "R"
439954-440704 i2s: left: "Left channel: f0f80000" "Left: f0f80000" "L: f0f80000" "L"
440704-441455 i2s: right: "Right channel: 00010000" "Right: 00010000" "R: 00010000" "R"
441455-442205 i2s: left: "Left channel: f1570000" "Left: f1570000" "L: f1570000" "L"
442205-442955 i2s: right: "Right channel: 00000000" "Right: 00000000" "R: 00000000" "R"
442955-443705 i2s: left: "Left channel: f1f00000" "Left: f1f00000" "L: f1f00000" "L"
443705-444456 i2s: right: "Right channel: 00010000" "Right: 00010000" "R: 00010000" "R"
444456-445206 i2s: left: "Left channel: f2a90000" "Left: f2a90000" "L: f2a90000" "L"
445206-445956 i2s: right: "Right channel: 00010000" "Right: 00010000" "R: 00010000" "R"
445956-446706 i2s: left: "Left channel: f3cf0000" "Left: f3cf0000" "L: f3cf0000" "L"
446706-447457 i2s: right: "Right channel: 00030000" "Right: 00030000" "R: 00030000" "R"
447457-448207 i2s: left: "Left channel: f5620000" "Left: f5620000" "L: f5620000" "L"
448207-448957 i2s: right: "Right channel: 00010000" "Right: 00010000" "R: 00010000" "R"
448957-449707 i2s: left: "Left channel: f7170000" "Left: f7170000" "L: f7170000" "L"
449707-450458 i2s: right: "Right channel: 00020000" "Right: 00020000" "R: 00020000" "R"
450458-451208 i2s: left: "Left channel: f8770000" "Left: f8770000" "L: f8770000" "L"
451208-451958 i2s: right: "Right channel: 00030000" "Right: 00030000" "R: 00030000" "R"
451958-452708 i2s: left: "Left channel: f9830000" "Left: f9830000" "L: f9830000" "L"
452708-453459 i2s: right: "Right channel: 00030000" "Right: 00030000" "R: 00030000" "R"
453459-454209 i2s: left: "Left channel: fa900000" "Left: fa900000" "L: fa900000" "L"
454209-454959 i2s: right: "Right channel: 00040000" "Right: 00040000" "R: 00040000" "R"
454959-455709 i2s: left: "Left channel: fbeb0000" "Left: fbeb0000" "L: fbeb0000" "L"
455709-456460 i2s: right: "Right channel: 00030000" "Right: 00030000" "R: 00030000" "R"
456460-457210 i2s: left: "Left channel: fd3e0000" "Left: fd3e0000" "L: fd3e0000" "L"
457210-457960 i2s: right: "Right channel: 00020000" "Right: 00020000" "R: 00020000" "R"
457960-458710 i2s: left: "Left channel: fe350000" "Left: fe350000" "L: fe350000" "L"
458710-459461 i2s: right: "Right channel: 00010000" "Right: 00010000" "R: 00010000" "R"
459461-460211 i2s: left: "Left channel: fec70000" "Left: fec70000" "L: fec70000" "L"
460211-460961 i2s: right: "Right channel: 00010000" "Right: 00010000" "R: 00010000" "R"
460961-461711 i2s: left: "Left channel: ff450000" "Left: ff450000" "L: ff450000" "L"
461711-462462 i2s: right: "Right channel: 00020000" "Right: 00020000" "R: 00020000" "R"
462462-463212 i2s: left: "Left channel: 00020000" "Left: 00020000" "L: 00020000" "L"
463212-463962 i2s: right: "Right channel: 00020000" "Right: 00020000" "R: 00020000" "R"
463962-464712 i2s: left: "Left channel: 00c60000" "Left: 00c60000" "L: 00c60000" "L"
464712-465463 i2s: right: "Right channel: 00010000" "Right: 00010000" "R: 00010000" "R"
465463-466213 i2s: left: "Left channel: 01490000" "Left: 01490000" "L: 01490000" "L"
466213-466963 i2s: right: "Right channel: 00000000" "Right: 00000000" "R: 00000000" "R"
466963-467713 i2s: left: "Left channel: 01cf0000" "Left: 01cf0000" "L: 01cf0000" "L"
467713-468464 i2s: right: "Right channel: fffe0000" "Right: fffe0000" "R: fffe0000" "R"
468464-469214 i2s: left: "Left channel: 02550000" "Left: 02550000" "L: 02550000" "L"
469214-469964 i2s: right: "Right channel: 00010000" "Right: 00010000" "R: 00010000" "R"
469964-470714 i2s: left: "Left channel: 030a0000" "Left: 030a0000" "L: 030a0000" "L"
470714-471465 i2s: right: "Right channel: 00030000" "Right: 00030000" "R: 00030000" "R"
471465-472215 i2s: left: "Left channel: 03530000" "Left: 03530000" "L: 03530000" "L"
472215-472965 i2s: right: "Right channel: 00000000" "Right: 00000000" "R: 00000000" "R"
472965-473715 i2s: left: "Left channel: 038b0000" "Left: 038b0000" "L: 038b0000" "L"
473715-474466 i2s: right: "Right channel: ffff0000" "Right: ffff0000" "R: ffff0000" "R"
474466-475216 i2s: left: "Left channel: 038b0000" "Left: 038b0000" "L: 038b0000" "L"
475216-475966 i2s: right: "Right channel: fffe0000" "Right: fffe0000" "R: fffe0000" "R"
475966-476716 i2s: left: "Left channel: 03b10000" "Left: 03b10000" "L: 03b10000" "L"
476716-477467 i2s: right: "Right channel: 00010000" "Right: 00010000" "R: 00010000" "R"
477467-478217 i2s: left: "Left channel: 03c60000" "Left: 03c60000" "L: 03c60000" "L"
478217-478967 i2s: right: "Right channel: 00000000" "Right: 00000000" "R: 00000000" "R"
478967-479717 i2s: left: "Left channel: 032c0000" "Left: 032c0000" "L: 032c0000" "L"
479717-480468 i2s: right: "Right channel: ffff0000" "Right: ffff0000" "R: ffff0000" "R"
480468-481218 i2s: left: "Left channel: 025e0000" "Left: 025e0000" "L: 025e0000" "L"
481218-481968 i2s: right: "Right channel: ffff0000" "Right: ffff0000" "R: ffff0000" "R"
481968-482718 i2s: left: "Left channel: 01650000" "Left: 01650000" "L: 01650000" "L"
482718-483469 i2s: right: "Right channel: 00000000" "Right: 00000000" "R: 00000000" "R"
483469-484219 i2s: left: "Left channel: 00990000" "Left: 00990000" "L: 00990000" "L"
484219-484969 i2s: right: "Right channel: fffe0000" "Right: fffe0000" "R: fffe0000" "R"
484969-485719 i2s: left: "Left channel: ff940000" "Left: ff940000" "L: ff940000" "L"
485719-486470 i2s: right: "Right channel: fffe0000" "Right: fffe0000" "R: fffe0000" "R"
486470-487220 i2s: left: "Left channel: fe880000" "Left: fe880000" "L: fe880000" "L"
487220-487970 i2s: right: "Right channel: ffff0000" "Right: ffff0000" "R: ffff0000" "R"
487970-488720 i2s: left: "Left channel: fd1d0000" "Left: fd1d0000" "L: fd1d0000" "L"
488720-489471 i2s: right: "Right channel: ffff0000" "Right: ffff0000" "R: ffff0000" "R"
489471-490221 i2s: left: "Left channel: fc210000" "Left: fc210000" "L: fc210000" "L"
490221-490971 i2s: right: "Right channel: 00000000" "Right: 00000000" "R: 00000000" "R"
490971-491721 i2s: left: "Left channel: fb480000" "Left: fb480000" "L: fb480000" "L"
491721-492472 i2s: right: "Right channel: fffe0000" "Right: fffe0000" "R: fffe0000" "R"
492472-493222 i2s: left: "Left channel: faad0000" "Left: faad0000" "L: faad0000" "L"
493222-493972 i2s: right: "Right channel: fffe0000" "Right: fffe0000" "R: fffe0000" "R"
493972-494722 i2s: left: "Left channel: f9840000" "Left: f9840000" "L: f9840000" "L"
494722-495473 i2s: right: "Right channel: ffff0000" "Right: ffff0000" "R: ffff0000" "R"
495473-496223 i2s: left: "Left channel: f8a80000" "Left: f8a80000" "L: f8a80000" "L"
496223-496973 i2s: right: "Right channel: 00000000" "Right: 00000000" "R: 00000000" "R"
496973-497723 i2s: left: "Left channel: f9ae0000" "Left: f9ae0000" "L: f9ae0000" "L"
497723-498474 i2s: right: "Right channel: 00000000" "Right: 00000000" "R: 00000000" "R"
498474-499224 i2s: left: "Left channel: fbf10000" "Left: fbf10000" "L: fbf10000" "L"
499224-499974 i2s: right: "Right channel: 00020000" "Right: 00020000" "R: 00020000" "R"
499974-500724 i2s: left: "Left channel: fbfa0000" "Left: fbfa0000" "L: fbfa0000" "L"
500724-501475 i2s: right: "Right channel: 00020000" "Right: 00020000" "R: 00020000" "R"
501475-502225 i2s: left: "Left channel: fa960000" "Left: fa960000" "L: fa960000" "L"
502225-502975 i2s: right: "Right channel: 00010000" "Right: 00010000" "R: 00010000" "R"
502975-503725 i2s: left: "Left channel: f99a0000" "Left: f99a0000" "L: f99a0000" "L"
503725-504476 i2s: right: "Right channel: ffff0000" "Right: ffff0000" "R: ffff0000" "R"
504476-505226 i2s: left: "Left channel: fac70000" "Left: fac70000" "L: fac70000" "L"
505226-505976 i2s: right: "Right channel: 00010000" "Right: 00010000" "R: 00010000" "R"
505976-506726 i2s: left: "Left channel: fc3f0000" "Left: fc3f0000" "L: fc3f0000" "L"
506726-507477 i2s: right: "Right channel: 00010000" "Right: 00010000" "R: 00010000" "R"
507477-508227 i2s: left: "Left channel: fb820000" "Left: fb820000" "L: fb820000" "L"
508227-508977 i2s: right: "Right channel: 00010000" "Right: 00010000" "R: 00010000" "R"
508977-509727 i2s: left: "Left channel: fa240000" "Left: fa240000" "L: fa240000" "L"
509727-510478 i2s: right: "Right channel: 00020000" "Right: 00020000" "R: 00020000" "R"
510478-511228 i2s: left: "Left channel: fa6c0000" "Left: fa6c0000" "L: fa6c0000" "L"
511228-511978 i2s: right: "Right channel: fffe0000" "Right: fffe0000" "R: fffe0000" "R"
511978-512728 i2s: left: "Left channel: fb090000" "Left: fb090000" "L: fb090000" "L"
512728-513479 i2s: right: "Right channel: 00020000" "Right: 00020000" "R: 00020000" "R"
513479-514229 i2s: left: "Left channel: faa50000" "Left: faa50000" "L: faa50000" "L"
514229-514979 i2s: right: "Right channel: fffe0000" "Right: fffe0000" "R: fffe0000" "R"
514979-515729 i2s: left: "Left channel: fa400000" "Left: fa400000" "L: fa400000" "L"
515729-516480 i2s: right: "Right channel: 00020000" "Right: 00020000" "R: 00020000" "R"
516480-517230 i2s: left: "Left channel: fb7b0000" "Left: fb7b0000" "L: fb7b0000" "L"
517230-517980 i2s: right: "Right channel: 00010000" "Right: 00010000" "R: 00010000" "R"
517980-518730 i2s: left: "Left channel: fdb10000" "Left: fdb10000" "L: fdb10000" "L"
518730-519481 i2s: right: "Right channel: 00030000" "Right: 00030000" "R: 00030000" "R"
519481-520231 i2s: left: "Left channel: ff060000" "Left: ff060000" "L: ff060000" "L"
520231-520981 i2s: right: "Right channel: 00010000" "Right: 00010000" "R: 00010000" "R"
520981-521731 i2s: left: "Left channel: ffb00000" "Left: ffb00000" "L: ffb00000" "L"
521731-522482 i2s: right: "Right channel: 00020000" "Right: 00020000" "R: 00020000" "R"
522482-523232 i2s: left: "Left channel: 00610000" "Left: 00610000" "L: 00610000" "L"
523232-523982 i2s: right: "Right channel: 00010000" "Right: 00010000" "R: 00010000" "R"
523982-524732 i2s: left: "Left channel: 02150000" "Left: 02150000" "L: 02150000" "L"
524732-525483 i2s: right: "Right channel: 00030000" "Right: 00030000" "R: 00030000" "R"
525483-526233 i2s: left: "Left channel: 03a80000" "Left: 03a80000" "L: 03a80000" "L"
526233-526983 i2s: right: "Right channel: 00020000" "Right: 00020000" "R: 00020000" "R"
526983-527733 i2s: left: "Left channel: 05400000" "Left: 05400000" "L: 05400000" "L"
527733-528484 i2s: right: "Right channel: 00040000" "Right: 00040000" "R: 00040000" "R"
528484-529234 i2s: left: "Left channel: 063c0000" "Left: 063c0000" "L: 063c0000" "L"
529234-529984 i2s: right: "Right channel: 00020000" "Right: 00020000" "R: 00020000" "R"
529984-530734 i2s: left: "Left channel: 06050000" "Left: 06050000" "L: 06050000" "L"
530734-531485 i2s: right: "Right channel: 00020000" "Right: 00020000" "R: 00020000" "R"
531485-532235 i2s: left: "Left channel: 05800000" "Left: 05800000" "L: 05800000" "L"
532235-532985 i2s: right: "Right channel: 00000000" "Right: 00000000" "R: 00000000" "R"
532985-533735 i2s: left: "Left channel: 05d50000" "Left: 05d50000" "L: 05d50000" "L"
533735-534486 i2s: right: "Right channel: 00010000" "Right: 00010000" "R: 00010000" "R"
534486-535236 i2s: left: "Left channel: 05c20000" "Left: 05c20000" "L: 05c20000" "L"
535236-535986 i2s: right: "Right channel: 00020000" "Right: 00020000" "R: 00020000" "R"
535986-536736 i2s: left: "Left channel: 04ff0000" "Left: 04ff0000" "L: 04ff0000" "L"
536736-537487 i2s: right: "Right channel: 00000000" "Right: 00000000" "R: 00000000" "R"
537487-538237 i2s: left: "Left channel: 03470000" "Left: 03470000" "L: 03470000" "L"
538237-538987 i2s: right: "Right channel: 00000000" "Right: 00000000" "R: 00000000" "R"
538987-539737 i2s: left: "Left channel: 01b40000" "Left: 01b40000" "L: 01b40000" "L"
539737-540488 i2s: right: "Right channel: fffe0000" "Right: fffe0000" "R: fffe0000" "R"
540488-541238 i2s: left: "Left channel: 00770000" "Left: 00770000" "L: 00770000" "L"
541238-541988 i2s: right: "Right channel: ffff0000" "Right: ffff0000" "R: ffff0000" "R"
541988-542738 i2s: left: "Left channel: fe830000" "Left: fe830000" "L: fe830000" "L"
542738-543489 i2s: right: "Right channel: 00010000" "Right: 00010000" "R: 00010000" "R"
543489-544239 i2s: left: "Left channel: fbde0000" "Left: fbde0000" "L: fbde0000" "L"
544239-544989 i2s: right: "Right channel: fffc0000" "Right: fffc0000" "R: fffc0000" "R"
544989-545739 i2s: left: "Left channel: fa1c0000" "Left: fa1c0000" "L: fa1c0000" "L"
545739-546490 i2s: right: "Right channel: ffff0000" "Right: ffff0000" "R: ffff0000" "R"
546490-547240 i2s: left: "Left channel: f95c0000" "Left: f95c0000" "L: f95c0000" "L"
547240-547990 i2s: right: "Right channel: fffd0000" "Right: fffd0000" "R: fffd0000" "R"
547990-548740 i2s: left: "Left channel: f82f0000" "Left: f82f0000" "L: f82f0000" "L"
548740-549491 i2s: right: "Right channel: fffe0000" "Right: fffe0000" "R: fffe0000" "R"
549491-550241 i2s: left: "Left channel: f6960000" "Left: f6960000" "L: f6960000" "L"
550241-550991 i2s: right: "Right channel: fffc0000" "Right: fffc0000" "R: fffc0000" "R"
550991-551741 i2s: left: "Left channel: f57e0000" "Left: f57e0000" "L: f57e0000" "L"
551741-552492 i2s: right: "Right channel: fffe0000" "Right: fffe0000" "R: fffe0000" "R"
552492-553242 i2s: left: "Left channel: f5220000" "Left: f5220000" "L: f5220000" "L"
553242-553992 i2s: right: "Right channel: 00010000" "Right: 00010000" "R: 00010000" "R"
553992-554743 i2s: left: "Left channel: f5bb0000" "Left: f5bb0000" "L: f5bb0000" "L"
554743-555493 i2s: right: "Right channel: 00000000" "Right: 00000000" "R: 00000000" "R"
555493-556243 i2s: left: "Left channel: f6c10000" "Left: f6c10000" "L: f6c10000" "L"
556243-556993 i2s: right: "Right channel: 00020000" "Right: 00020000" "R: 00020000" "R"
556993-557744 i2s: left: "Left channel: f7a30000" "Left: f7a30000" "L: f7a30000" "L"
557744-558494 i2s: right: "Right channel: 00010000" "Right: 00010000" "R: 00010000" "R"
558494-559244 i2s: left: "Left channel: f89d0000" "Left: f89d0000" "L: f89d0000" "L"
559244-559994 i2s: right: "Right channel: 00020000" "Right: 00020000" "R: 00020000" "R"
559994-560745 i2s: left: "Left channel: f9e30000" "Left: f9e30000" "L: f9e30000" "L"
560745-561495 i2s: right: "Right channel: 00010000" "Right: 00010000" "R: 00010000" "R"
561495-562245 i2s: left: "Left channel: fbab0000" "Left: fbab0000" "L: fbab0000" "L"
562245-562995 i2s: right: "Right channel: ffff0000" "Right: ffff0000" "R: ffff0000" "R"
562995-563746 i2s: left: "Left channel: fdda0000" "Left: fdda0000" "L: fdda0000" "L"
563746-564496 i2s: right: "Right channel: 00010000" "Right: 00010000" "R: 00010000" "R"
564496-565246 i2s: left: "Left channel: ffc60000" "Left: ffc60000" "L: ffc60000" "L"
565246-565996 i2s: right: "Right channel: 00010000" "Right: 00010000" "R: 00010000" "R"
565996-566747 i2s: left: "Left channel: 01530000" "Left: 01530000" "L: 01530000" "L"
566747-567497 i2s: right: "Right channel: 00010000" "Right: 00010000" "R: 00010000" "R"
567497-568247 i2s: left: "Left channel: 03890000" "Left: 03890000" "L: 03890000" "L"
568247-568997 i2s: right: "Right channel: 00020000" "Right: 00020000" "R: 00020000" "R"
568997-569748 i2s: left: "Left channel: 06090000" "Left: 06090000" "L: 06090000" "L"
569748-570498 i2s: right: "Right channel: 00030000" "Right: 00030000" "R: 00030000" "R"
570498-571248 i2s: left: "Left channel: 07a00000" "Left: 07a00000" "L: 07a00000" "L"
571248-571998 i2s: right: "Right channel: 00020000" "Right: 00020000" "R: 00020000" "R"
571998-572749 i2s: left: "Left channel: 08cd0000" "Left: 08cd0000" "L: 08cd0000" "L"
572749-573499 i2s: right: "Right channel: 00020000" "Right: 00020000" "R: 00020000" "R"
573499-574249 i2s: left: "Left channel: 0a9b0000" "Left: 0a9b0000" "L: 0a9b0000" "L"
574249-574999 i2s: right: "Right channel: 00040000" "Right: 00040000" "R: 00040000" "R"
574999-575750 i2s: left: "Left channel: 0ce70000" "Left: 0ce70000" "L: 0ce70000" "L"
575750-576500 i2s: right: "Right channel: 00010000" "Right: 00010000" "R: 00010000" "R"
576500-577250 i2s: left: "Left channel: 0ee70000" "Left: 0ee70000" "L: 0ee70000" "L"
577250-578000 i2s: right: "Right channel: 00040000" "Right: 00040000" "R: 00040000" "R"
578000-578751 i2s: left: "Left channel: 0fcb0000" "Left: 0fcb0000" "L: 0fcb0000" "L"
578751-579501 i2s: right: "Right channel: 00020000" "Right: 00020000" "R: 00020000" "R"
579501-580251 i2s: left: "Left channel: 103b0000" "Left: 103b0000" "L: 103b0000" "L"
580251-581001 i2s: right: "Right channel: 00020000" "Right: 00020000" "R: 00020000" "R"
581001-581752 i2s: left: "Left channel: 116a0000" "Left: 116a0000" "L: 116a0000" "L"
581752-582502 i2s: right: "Right channel: 00020000" "Right: 00020000" "R: 00020000" "R"
582502-583252 i2s: left: "Left channel: 12db0000" "Left: 12db0000" "L: 12db0000" "L"
583252-584002 i2s: right: "Right channel: 00020000" "Right: 00020000" "R: 00020000" "R"
584002-584753 i2s: left: "Left channel: 13940000" "Left: 13940000" "L: 13940000" "L"
584753-585503 i2s: right: "Right channel: 00020000" "Right: 00020000" "R: 00020000" "R"
585503-586253 i2s: left: "Left channel: 13ba0000" "Left: 13ba0000" "L: 13ba0000" "L"
586253-587003 i2s: right: "Right channel: ffff0000" "Right: ffff0000" "R: ffff0000" "R"
587003-587754 i2s: left: "Left channel: 135a0000" "Left: 135a0000" "L: 135a0000" "L"
587754-588504 i2s: right: "Right channel: 00010000" "Right: 00010000" "R: 00010000" "R"
588504-589254 i2s: left: "Left channel: 12ff0000" "Left: 12ff0000" "L: 12ff0000" "L"
589254-590004 i2s: right: "Right channel: 00010000" "Right: 00010000" "R: 00010000" "R"
590004-590755 i2s: left: "Left channel: 12950000" "Left: 12950000" "L: 12950000" "L"
590755-591505 i2s: right: "Right channel: 00000000" "Right: 00000000" "R: 00000000" "R"
591505-592255 i2s: left: "Left channel: 11850000" "Left: 11850000" "L: 11850000" "L"
592255-593005 i2s: right: "Right channel: ffff0000" "Right: ffff0000" "R: ffff0000" "R"
593005-593756 i2s: left: "Left channel: 0fdd0000" "Left: 0fdd0000" "L: 0fdd0000" "L"
593756-594506 i2s: right: "Right channel: fffd0000" "Right: fffd0000" "R: fffd0000" "R"
594506-595256 i2s: left: "Left channel: 0e530000" "Left: 0e530000" "L: 0e530000" "L"
595256-596006 i2s: right: "Right channel: ffff0000" "Right: ffff0000" "R: ffff0000" "R"
596006-596757 i2s: left: "Left channel: 0cba0000" "Left: 0cba0000" "L: 0cba0000" "L"
596757-597507 i2s: right: "Right channel: fffc0000" "Right: fffc0000" "R: fffc0000" "R"
597507-598257 i2s: left: "Left channel: 0a6a0000" "Left: 0a6a0000" "L: 0a6a0000" "L"
598257-599007 i2s: right: "Right channel: fffd0000" "Right: fffd0000" "R: fffd0000" "R"
599007-599758 i2s: left: "Left channel: 07750000" "Left: 07750000" "L: 07750000" "L"
599758-600508 i2s: right: "Right channel: fffd0000" "Right: fffd0000" "R: fffd0000" "R"
600508-601258 i2s: left: "Left channel: 045d0000" "Left: 045d0000" "L: 045d0000" "L"
601258-602008 i2s: right: "Right channel: fffe0000" "Right: fffe0000" "R: fffe0000" "R"
602008-602759 i2s: left: "Left channel: 01d60000" "Left: 01d60000" "L: 01d60000" "L"
602759-603509 i2s: right: "Right channel: fffc0000" "Right: fffc0000" "R: fffc0000" "R"
603509-604259 i2s: left: "Left channel: ff900000" "Left: ff900000" "L: ff900000" "L"
604259-605009 i2s: right: "Right channel: fffd0000" "Right: fffd0000" "R: fffd0000" "R"
605009-605760 i2s: left: "Left channel: fcd40000" "Left: fcd40000" "L: fcd40000" "L"
605760-606510 i2s: right: "Right channel: fffc0000" "Right: fffc0000" "R: fffc0000" "R"
606510-607260 i2s: left: "Left channel: f97f0000" "Left: f97f0000" "L: f97f0000" "L"
607260-608010 i2s: right: "Right channel: fffd0000" "Right: fffd0000" "R: fffd0000" "R"
608010-608761 i2s: left: "Left channel: f6a80000" "Left: f6a80000" "L: f6a80000" "L"
608761-609511 i2s: right: "Right channel: fffb0000" "Right: fffb0000" "R: fffb0000" "R"
609511-610261 i2s: left: "Left channel: f48e0000" "Left: f48e0000" "L: f48e0000" "L"
610261-611011 i2s: right: "Right channel: fffd0000" "Right: fffd0000" "R: fffd0000" "R"
611011-611762 i2s: left: "Left channel: f2f40000" "Left: f2f40000" "L: f2f40000" "L"
611762-612512 i2s: right: "Right channel: fffc0000" "Right: fffc0000" "R: fffc0000" "R"
612512-613262 i2s: left: "Left channel: f1820000" "Left: f1820000" "L: f1820000" "L"
613262-614012 i2s: right: "Right channel: ffff0000" "Right: ffff0000" "R: ffff0000" "R"
614012-614763 i2s: left: "Left channel: f03d0000" "Left: f03d0000" "L: f03d0000" "L"
614763-615513 i2s: right: "Right channel: fffd0000" "Right: fffd0000" "R: fffd0000" "R"
615513-616263 i2s: left: "Left channel: ef700000" "Left: ef700000" "L: ef700000" "L"
616263-617013 i2s: right: "Right channel: 00000000" "Right: 00000000" "R: 00000000" "R"
617013-617764 i2s: left: "Left channel: ef5d0000" "Left: ef5d0000" "L: ef5d0000" "L"
617764-618514 i2s: right: "Right channel: 00010000" "Right: 00010000" "R: 00010000" "R"
618514-619264 i2s: left: "Left channel: ef9d0000" "Left: ef9d0000" "L: ef9d0000" "L"
619264-620014 i2s: right: "Right channel: ffff0000" "Right: ffff0000" "R: ffff0000" "R"
620014-620765 i2s: left: "Left channel: f0180000" "Left: f0180000" "L: f0180000" "L"
620765-621515 i2s: right: "Right channel: 00010000" "Right: 00010000" "R: 00010000" "R"
621515-622265 i2s: left: "Left channel: f1020000" "Left: f1020000" "L: f1020000" "L"
622265-623015 i2s: right: "Right channel: 00030000" "Right: 00030000" "R: 00030000" "R"
623015-623766 i2s: left: "Left channel: f2800000" "Left: f2800000" "L: f2800000" "L"
623766-624516 i2s: right: "Right channel: 00000000" "Right: 00000000" "R: 00000000" "R"
624516-625266 i2s: left: "Left channel: f4490000" "Left: f4490000" "L: f4490000" "L"
625266-626016 i2s: right: "Right channel: 00040000" "Right: 00040000" "R: 00040000" "R"
626016-626767 i2s: left: "Left channel: f5d10000" "Left: f5d10000" "L: f5d10000" "L"
626767-627517 i2s: right: "Right channel: 00020000" "Right: 00020000" "R: 00020000" "R"
627517-628267 i2s: left: "Left channel: f72d0000" "Left: f72d0000" "L: f72d0000" "L"
628267-629017 i2s: right: "Right channel: 00040000" "Right: 00040000" "R: 00040000" "R"
629017-629768 i2s: left: "Left channel: f8d40000" "Left: f8d40000" "L: f8d40000" "L"
629768-630518 i2s: right: "Right channel: 00030000" "Right: 00030000" "R: 00030000" "R"
630518-631268 i2s: left: "Left channel: fb0f0000" "Left: fb0f0000" "L: fb0f0000" "L"
631268-632018 i2s: right: "Right channel: 00040000" "Right: 00040000" "R: 00040000" "R"
632018-632769 i2s: left: "Left channel: fd5f0000" "Left: fd5f0000" "L: fd5f0000" "L"
632769-633519 i2s: right: "Right channel: 00030000" "Right: 00030000" "R: 00030000" "R"
633519-634269 i2s: left: "Left channel: ff040000" "Left: ff040000" "L: ff040000" "L"
634269-635019 i2s: right: "Right channel: 00050000" "Right: 00050000" "R: 00050000" "R"
635019-635770 i2s: left: "Left channel: 00710000" "Left: 00710000" "L: 00710000" "L"
635770-636520 i2s: right: "Right channel: 00030000" "Right: 00030000" "R: 00030000" "R"
636520-637270 i2s: left: "Left channel: 02020000" "Left: 02020000" "L: 02020000" "L"
637270-638020 i2s: right: "Right channel: 00050000" "Right: 00050000" "R: 00050000" "R"
638020-638771 i2s: left: "Left channel: 03820000" "Left: 03820000" "L: 03820000" "L"
638771-639521 i2s: right: "Right channel: 00040000" "Right: 00040000" "R: 00040000" "R"
639521-640271 i2s: left: "Left channel: 04f00000" "Left: 04f00000" "L: 04f00000" "L"
640271-641021 i2s: right: "Right channel: 00020000" "Right: 00020000" "R: 00020000" "R"
641021-641772 i2s: left: "Left channel: 05a40000" "Left: 05a40000" "L: 05a40000" "L"
641772-642522 i2s: right: "Right channel: 00010000" "Right: 00010000" "R: 00010000" "R"
642522-643272 i2s: left: "Left channel: 06320000" "Left: 06320000" "L: 06320000" "L"
643272-644022 i2s: right: "Right channel: 00040000" "Right: 00040000" "R: 00040000" "R"
644022-644773 i2s: left: "Left channel: 06a10000" "Left: 06a10000" "L: 06a10000" "L"
644773-645523 i2s: right: "Right channel: 00010000" "Right: 00010000" "R: 00010000" "R"
645523-646273 i2s: left: "Left channel: 06cc0000" "Left: 06cc0000" "L: 06cc0000" "L"
646273-647023 i2s: right: "Right channel: 00010000" "Right: 00010000" "R: 00010000" "R"
647023-647774 i2s: left: "Left channel: 069b0000" "Left: 069b0000" "L: 069b0000" "L"
647774-648524 i2s: right: "Right channel: 00010000" "Right: 00010000" "R: 00010000" "R"
648524-649274 i2s: left: "Left channel: 05f10000" "Left: 05f10000" "L: 05f10000" "L"
649274-650024 i2s: right: "Right channel: 00000000" "Right: 00000000" "R: 00000000" "R"
650024-650775 i2s: left: "Left channel: 05460000" "Left: 05460000" "L: 05460000" "L"
650775-651525 i2s: right: "Right channel: 00000000" "Right: 00000000" "R: 00000000" "R"
651525-652275 i2s: left: "Left channel: 044d0000" "Left: 044d0000" "L: 044d0000" "L"
652275-653025 i2s: right: "Right channel: fffe0000" "Right: fffe0000" "R: fffe0000" "R"
653025-653776 i2s: left: "Left channel: 03820000" "Left: 03820000" "L: 03820000" "L"
653776-654526 i2s: right: "Right channel: 00000000" "Right: 00000000" "R: 00000000" "R"
654526-655276 i2s: left: "Left channel: 02110000" "Left: 02110000" "L: 02110000" "L"
655276-656026 i2s: right: "Right channel: fffe0000" "Right: fffe0000" "R: fffe0000" "R"
656026-656777 i2s: left: "Left channel: 008f0000" "Left: 008f0000" "L: 008f0000" "L"
656777-657527 i2s: right: "Right channel: fffd0000" "Right: fffd0000" "R: fffd0000" "R"
657527-658277 i2s: left: "Left channel: ff300000" "Left: ff300000" "L: ff300000" "L"
658277-659027 i2s: right: "Right channel: fffe0000" "Right: fffe0000" "R: fffe0000" "R"
659027-659778 i2s: left: "Left channel: fde70000" "Left: fde70000" "L: fde70000" "L"
659778-660528 i2s: right: "Right channel: fffc0000" "Right: fffc0000" "R: fffc0000" "R"
660528-661278 i2s: left: "Left channel: fcf60000" "Left: fcf60000" "L: fcf60000" "L"
661278-662028 i2s: right: "Right channel: fffe0000" "Right: fffe0000" "R: fffe0000" "R"
662028-662779 i2s: left: "Left channel: fb890000" "Left: fb890000" "L: fb890000" "L"
662779-663529 i2s: right: "Right channel: fffd0000" "Right: fffd0000" "R: fffd0000" "R"
663529-664279 i2s: left: "Left channel: fa520000" "Left: fa520000" "L: fa520000" "L"
664279-665030 i2s: right: "Right channel: fffe0000" "Right: fffe0000" "R: fffe0000" "R"
665030-665780 i2s: left: "Left channel: f93c0000" "Left: f93c0000" "L: f93c0000" "L"
665780-666530 i2s: right: "Right channel: ffff0000" "Right: ffff0000" "R: ffff0000" "R"
666530-667280 i2s: left: "Left channel: f83e0000" "Left: f83e0000" "L: f83e0000" "L"
667280-668030 i2s: right: "Right channel: fffe0000" "Right: fffe0000" "R: fffe0000" "R"
668030-668781 i2s: left: "Left channel: f8100000" "Left: f8100000" "L: f8100000" "L"
668781-669531 i2s: right: "Right channel: ffff0000" "Right: ffff0000" "R: ffff0000" "R"
669531-670281 i2s: left: "Left channel: f9020000" "Left: f9020000" "L: f9020000" "L"
670281-671031 i2s: right: "Right channel: 00000000" "Right: 00000000" "R: 00000000" "R"
671031-671782 i2s: left: "Left channel: f9750000" "Left: f9750000" "L: f9750000" "L"
671782-672532 i2s: right: "Right channel: 00020000" "Right: 00020000" "R: 00020000" "R"
672532-673282 i2s: left: "Left channel: f8800000" "Left: f8800000" "L: f8800000" "L"
673282-674033 i2s: right: "Right channel: ffff0000" "Right: ffff0000" "R: ffff0000" "R"
674033-674783 i2s: left: "Left channel: f7750000" "Left: f7750000" "L: f7750000" "L"
674783-675533 i2s: right: "Right channel: 00020000" "Right: 00020000" "R: 00020000" "R"
675533-676283 i2s: left: "Left channel: f71b0000" "Left: f71b0000" "L: f71b0000" "L"
676283-677034 i2s: right: "Right channel: 00000000" "Right: 00000000" "R: 00000000" "R"
677034-677784 i2s: left: "Left channel: f80d0000" "Left: f80d0000" "L: f80d0000" "L"
677784-678534 i2s: right: "Right channel: 00000000" "Right: 00000000" "R: 00000000" "R"
678534-679284 i2s: left: "Left channel: f8170000" "Left: f8170000" "L: f8170000" "L"
679284-680035 i2s: right: "Right channel: 00010000" "Right: 00010000" "R: 00010000" "R"
680035-680785 i2s: left: "Left channel: f77e0000" "Left: f77e0000" "L: f77e0000" "L"
680785-681535 i2s: right: "Right channel: 00030000" "Right: 00030000" "R: 00030000" "R"
681535-682285 i2s: left: "Left channel: f75b0000" "Left: f75b0000" "L: f75b0000" "L"
682285-683036 i2s: right: "Right channel: ffff0000" "Right: ffff0000" "R: ffff0000" "R"
683036-683786 i2s: left: "Left channel: f8390000" "Left: f8390000" "L: f8390000" "L"
683786-684536 i2s: right: "Right channel: 00030000" "Right: 00030000" "R: 00030000" "R"
684536-685286 i2s: left: "Left channel: f86a0000" "Left: f86a0000" "L: f86a0000" "L"
685286-686037 i2s: right: "Right channel: 00000000" "Right: 00000000" "R: 00000000" "R"
686037-686787 i2s: left: "Left channel: f9060000" "Left: f9060000" "L: f9060000" "L"
686787-687537 i2s: right: "Right channel: 00010000" "Right: 00010000" "R: 00010000" "R"
687537-688287 i2s: left: "Left channel: fa170000" "Left: fa170000" "L: fa170000" "L"
688287-689038 i2s: right: "Right channel: 00020000" "Right: 00020000" "R: 00020000" "R"
689038-689788 i2s: left: "Left channel: fcd70000" "Left: fcd70000" "L: fcd70000" "L"
689788-690538 i2s: right: "Right channel: 00020000" "Right: 00020000" "R: 00020000" "R"
690538-691288 i2s: left: "Left channel: febf0000" "Left: febf0000" "L: febf0000" "L"
691288-692039 i2s: right: "Right channel: 00020000" "Right: 00020000" "R: 00020000" "R"
692039-692789 i2s: left: "Left channel: 00950000" "Left: 00950000" "L: 00950000" "L"
692789-693539 i2s: right: "Right channel: 00040000" "Right: 00040000" "R: 00040000" "R"
693539-694289 i2s: left: "Left channel: 01f10000" "Left: 01f10000" "L: 01f10000" "L"
694289-695040 i2s: right: "Right channel: 00020000" "Right: 00020000" "R: 00020000" "R"
695040-695790 i2s: left: "Left channel: 042a0000" "Left: 042a0000" "L: 042a0000" "L"
695790-696540 i2s: right: "Right channel: 00020000" "Right: 00020000" "R: 00020000" "R"
696540-697290 i2s: left: "Left channel: 05f80000" "Left: 05f80000" "L: 05f80000" "L"
697290-698041 i2s: right: "Right channel: 00020000" "Right: 00020000" "R: 00020000" "R"
698041-698791 i2s: left: "Left channel: 07a20000" "Left: 07a20000" "L: 07a20000" "L"
698791-699541 i2s: right: "Right channel: 00030000" "Right: 00030000" "R: 00030000" "R"
699541-700291 i2s: left: "Left channel: 08fe0000" "Left: 08fe0000" "L: 08fe0000" "L"
700291-701042 i2s: right: "Right channel: 00020000" "Right: 00020000" "R: 00020000" "R"
701042-701792 i2s: left: "Left channel: 09940000" "Left: 09940000" "L: 09940000" "L"
701792-702542 i2s: right: "Right channel: 00020000" "Right: 00020000" "R: 00020000" "R"
702542-703292 i2s: left: "Left channel: 091d0000" "Left: 091d0000" "L: 091d0000" "L"
703292-704043 i2s: right: "Right channel: 00000000" "Right: 00000000" "R: 00000000" "R"
704043-704793 i2s: left: "Left channel: 08b80000" "Left: 08b80000" "L: 08b80000" "L"
704793-705543 i2s: right: "Right channel: 00010000" "Right: 00010000" "R: 00010000" "R"
705543-706293 i2s: left: "Left channel: 07c00000" "Left: 07c00000" "L: 07c00000" "L"
706293-707044 i2s: right: "Right channel: 00030000" "Right: 00030000" "R: 00030000" "R"
707044-707794 i2s: left: "Left channel: 06a70000" "Left: 06a70000" "L: 06a70000" "L"
707794-708544 i2s: right: "Right channel: 00000000" "Right: 00000000" "R: 00000000" "R"
708544-709294 i2s: left: "Left channel: 04e90000" "Left: 04e90000" "L: 04e90000" "L"
709294-710045 i2s: right: "Right channel: fffd0000" "Right: fffd0000" "R: fffd0000" "R"
710045-710795 i2s: left: "Left channel: 02b10000" "Left: 02b10000" "L: 02b10000" "L"
710795-711545 i2s: right: "Right channel: ffff0000" "Right: ffff0000" "R: ffff0000" "R"
711545-712295 i2s: left: "Left channel: 004e0000" "Left: 004e0000" "L: 004e0000" "L"
712295-713046 i2s: right: "Right channel: fffc0000" "Right: fffc0000" "R: fffc0000" "R"
713046-713796 i2s: left: "Left channel: fde50000" "Left: fde50000" "L: fde50000" "L"
713796-714546 i2s: right: "Right channel: fffe0000" "Right: fffe0000" "R: fffe0000" "R"
714546-715296 i2s: left: "Left channel: fb390000" "Left: fb390000" "L: fb390000" "L"
715296-716047 i2s: right: "Right channel: fffc0000" "Right: fffc0000" "R: fffc0000" "R"
716047-716797 i2s: left: "Left channel: f9120000" "Left: f9120000" "L: f9120000" "L"
716797-717547 i2s: right: "Right channel: fffd0000" "Right: fffd0000" "R: fffd0000" "R"
717547-718297 i2s: left: "Left channel: f7c60000" "Left: f7c60000" "L: f7c60000" "L"
718297-719048 i2s: right: "Right channel: ffff0000" "Right: ffff0000" "R: ffff0000" "R"
719048-719798 i2s: left: "Left channel: f64e0000" "Left: f64e0000" "L: f64e0000" "L"
719798-720548 i2s: right: "Right channel: ffff0000" "Right: ffff0000" "R: ffff0000" "R"
720548-721298 i2s: left: "Left channel: f4e80000" "Left: f4e80000" "L: f4e80000" "L"
721298-722049 i2s: right: "Right channel: ffff0000" "Right: ffff0000" "R: ffff0000" "R"
722049-722799 i2s: left: "Left channel: f4300000" "Left: f4300000" "L: f4300000" "L"
722799-723549 i2s: right: "Right channel: fffe0000" "Right: fffe0000" "R: fffe0000" "R"
723549-724299 i2s: left: "Left channel: f3fb0000" "Left: f3fb0000" "L: f3fb0000" "L"
724299-725050 i2s: right: "Right channel: 00000000" "Right: 00000000" "R: 00000000" "R"
725050-725800 i2s: left: "Left channel: f4860000" "Left: f4860000" "L: f4860000" "L"
725800-726550 i2s: right: "Right channel: 00010000" "Right: 00010000" "R: 00010000" "R"
726550-727300 i2s: left: "Left channel: f5850000" "Left: f5850000" "L: f5850000" "L"
727300-728051 i2s: right: "Right channel: 00000000" "Right: 00000000" "R: 00000000" "R"
728051-728801 i2s: left: "Left channel: f6a30000" "Left: f6a30000" "L: f6a30000" "L"
728801-729551 i2s: right: "Right channel: 00010000" "Right: 00010000" "R: 00010000" "R"
729551-730301 i2s: left: "Left channel: f7c70000" "Left: f7c70000" "L: f7c70000" "L"
730301-731052 i2s: right: "Right channel: 00030000" "Right: 00030000" "R: 00030000" "R"
731052-731802 i2s: left: "Left channel: f93b0000" "Left: f93b0000" "L: f93b0000" "L"
731802-732552 i2s: right: "Right channel: 00030000" "Right: 00030000" "R: 00030000" "R"
732552-733302 i2s: left: "Left channel: fac60000" "Left: fac60000" "L: fac60000" "L"
733302-734053 i2s: right: "Right channel: 00010000" "Right: 00010000" "R: 00010000" "R"
734053-734803 i2s: left: "Left channel: fca70000" "Left: fca70000" "L: fca70000" "L"
734803-735553 i2s: right: "Right channel: 00000000" "Right: 00000000" "R: 00000000" "R"
735553-736303 i2s: left: "Left channel: fe900000" "Left: fe900000" "L: fe900000" "L"
736303-737054 i2s: right: "Right channel: 00030000" "Right: 00030000" "R: 00030000" "R"
737054-737804 i2s: left: "Left channel: 002f0000" "Left: 002f0000" "L: 002f0000" "L"
737804-738554 i2s: right: "Right channel: 00030000" "Right: 00030000" "R: 00030000" "R"
738554-739304 i2s: left: "Left channel: 020c0000" "Left: 020c0000" "L: 020c0000" "L"
739304-740055 i2s: right: "Right channel: 00020000" "Right: 00020000" "R: 00020000" "R"
740055-740805 i2s: left: "Left channel: 04220000" "Left: 04220000" "L: 04220000" "L"
740805-741555 i2s: right: "Right channel: 00030000" "Right: 00030000" "R: 00030000" "R"
741555-742305 i2s: left: "Left channel: 05c00000" "Left: 05c00000" "L: 05c00000" "L"
742305-743056 i2s: right: "Right channel: 00030000" "Right: 00030000" "R: 00030000" "R"
743056-743806 i2s: left: "Left channel: 07540000" "Left: 07540000" "L: 07540000" "L"
743806-744556 i2s: right: "Right channel: 00030000" "Right: 00030000" "R: 00030000" "R"
744556-745306 i2s: left: "Left channel: 09390000" "Left: 09390000" "L: 09390000" "L"
745306-746057 i2s: right: "Right channel: 00020000" "Right: 00020000" "R: 00020000" "R"
746057-746807 i2s: left: "Left channel: 0b3e0000" "Left: 0b3e0000" "L: 0b3e0000" "L"
746807-747557 i2s: right: "Right channel: 00020000" "Right: 00020000" "R: 00020000" "R"
747557-748307 i2s: left: "Left channel: 0d5a0000" "Left: 0d5a0000" "L: 0d5a0000" "L"
748307-749058 i2s: right: "Right channel: 00040000" "Right: 00040000" "R: 00040000" "R"
749058-749808 i2s: left: "Left channel: 0ef10000" "Left: 0ef10000" "L: 0ef10000" "L"
749808-750558 i2s: right: "Right channel: 00030000" "Right: 00030000" "R: 00030000" "R"
750558-751308 i2s: left: "Left channel: 0fd50000" "Left: 0fd50000" "L: 0fd50000" "L"
751308-752059 i2s: right: "Right channel: 00030000" "Right: 00030000" "R: 00030000" "R"
752059-752809 i2s: left: "Left channel: 10ef0000" "Left: 10ef0000" "L: 10ef0000" "L"
752809-753559 i2s: right: "Right channel: 00020000" "Right: 00020000" "R: 00020000" "R"
753559-754309 i2s: left: "Left channel: 12780000" "Left: 12780000" "L: 12780000" "L"
754309-755060 i2s: right: "Right channel: 00000000" "Right: 00000000" "R: 00000000" "R"
755060-755810 i2s: left: "Left channel: 13890000" "Left: 13890000" "L: 13890000" "L"
755810-756560 i2s: right: "Right channel: 00010000" "Right: 00010000" "R: 00010000" "R"
756560-757310 i2s: left: "Left channel: 142f0000" "Left: 142f0000" "L: 142f0000" "L"
757310-758061 i2s: right: "Right channel: 00010000" "Right: 00010000" "R: 00010000" "R"
758061-758811 i2s: left: "Left channel: 14480000" "Left: 14480000" "L: 14480000" "L"
758811-759561 i2s: right: "Right channel: 00010000" "Right: 00010000" "R: 00010000" "R"
759561-760311 i2s: left: "Left channel: 140d0000" "Left: 140d0000" "L: 140d0000" "L"
760311-761062 i2s: right: "Right channel: 00000000" "Right: 00000000" "R: 00000000" "R"
761062-761812 i2s: left: "Left channel: 13d20000" "Left: 13d20000" "L: 13d20000" "L"
761812-762562 i2s: right: "Right channel: fffd0000" "Right: fffd0000" "R: fffd0000" "R"
762562-763312 i2s: left: "Left channel: 134d0000" "Left: 134d0000" "L: 134d0000" "L"
763312-764063 i2s: right: "Right channel: fffd0000" "Right: fffd0000" "R: fffd0000" "R"
764063-764813 i2s: left: "Left channel: 122a0000" "Left: 122a0000" "L: 122a0000" "L"
764813-765563 i2s: right: "Right channel: fffd0000" "Right: fffd0000" "R: fffd0000" "R"
765563-766313 i2s: left: "Left channel: 10f00000" "Left: 10f00000" "L: 10f00000" "L"
766313-767064 i2s: right: "Right channel: fffe0000" "Right: fffe0000" "R: fffe0000" "R"
767064-767814 i2s: left: "Left channel: 0f320000" "Left: 0f320000" "L: 0f320000" "L"
767814-768564 i2s: right: "Right channel: fffe0000" "Right: fffe0000" "R: fffe0000" "R"
768564-769314 i2s: left: "Left channel: 0d020000" "Left: 0d020000" "L: 0d020000" "L"
769314-770065 i2s: right: "Right channel: fffb0000" "Right: fffb0000" "R: fffb0000" "R"
770065-770815 i2s: left: "Left channel: 0a370000" "Left: 0a370000" "L: 0a370000" "L"
770815-771565 i2s: right: "Right channel: fffc0000" "Right: fffc0000" "R: fffc0000" "R"
771565-772315 i2s: left: "Left channel: 07470000" "Left: 07470000" "L: 07470000" "L"
772315-773066 i2s: right: "Right channel: fffc0000" "Right: fffc0000" "R: fffc0000" "R"
773066-773816 i2s: left: "Left channel: 045f0000" "Left: 045f0000" "L: 045f0000" "L"
773816-774566 i2s: right: "Right channel: fffc0000" "Right: fffc0000" "R: fffc0000" "R"
774566-775316 i2s: left: "Left channel: 01b00000" "Left: 01b00000" "L: 01b00000" "L"
775316-776067 i2s: right: "Right channel: fffa0000" "Right: fffa0000" "R: fffa0000" "R"
776067-776817 i2s: left: "Left channel: fe980000" "Left: fe980000" "L: fe980000" "L"
776817-777567 i2s: right: "Right channel: fffa0000" "Right: fffa0000" "R: fffa0000" "R"
777567-778317 i2s: left: "Left channel: fb400000" "Left: fb400000" "L: fb400000" "L"
778317-779068 i2s: right: "Right channel: fffb0000" "Right: fffb0000" "R: fffb0000" "R"
779068-779818 i2s: left: "Left channel: f8020000" "Left: f8020000" "L: f8020000" "L"
779818-780568 i2s: right: "Right channel: fffe0000" "Right: fffe0000" "R: fffe0000" "R"
780568-781318 i2s: left: "Left channel: f5470000" "Left: f5470000" "L: f5470000" "L"
781318-782069 i2s: right: "Right channel: fff80000" "Right: fff80000" "R: fff80000" "R"
782069-782819 i2s: left: "Left channel: f30f0000" "Left: f30f0000" "L: f30f0000" "L"
782819-783569 i2s: right: "Right channel: fffd0000" "Right: fffd0000" "R: fffd0000" "R"
783569-784319 i2s: left: "Left channel: f14c0000" "Left: f14c0000" "L: f14c0000" "L"
784319-785070 i2s: right: "Right channel: fffc0000" "Right: fffc0000" "R: fffc0000" "R"
785070-785820 i2s: left: "Left channel: efc40000" "Left: efc40000" "L: efc40000" "L"
785820-786570 i2s: right: "Right channel: fffe0000" "Right: fffe0000" "R: fffe0000" "R"
786570-787320 i2s: left: "Left channel: eea70000" "Left: eea70000" "L: eea70000" "L"
787320-788071 i2s: right: "Right channel: ffff0000" "Right: ffff0000" "R: ffff0000" "R"
788071-788821 i2s: left: "Left channel: ee110000" "Left: ee110000" "L: ee110000" "L"
788821-789571 i2s: right: "Right channel: fffd0000" "Right: fffd0000" "R: fffd0000" "R"
789571-790322 i2s: left: "Left channel: ee2a0000" "Left: ee2a0000" "L: ee2a0000" "L"
790322-791072 i2s: right: "Right channel: ffff0000" "Right: ffff0000" "R: ffff0000" "R"
791072-791822 i2s: left: "Left channel: eeed0000" "Left: eeed0000" "L: eeed0000" "L"
791822-792572 i2s: right: "Right channel: 00000000" "Right: 00000000" "R: 00000000" "R"
792572-793323 i2s: left: "Left channel: f02f0000" "Left: f02f0000" "L: f02f0000" "L"
793323-794073 i2s: right: "Right channel: 00020000" "Right: 00020000" "R: 00020000" "R"
794073-794823 i2s: left: "Left channel: f1b90000" "Left: f1b90000" "L: f1b90000" "L"
794823-795573 i2s: right: "Right channel: 00010000" "Right: 00010000" "R: 00010000" "R"
795573-796324 i2s: left: "Left channel: f3710000" "Left: f3710000" "L: f3710000" "L"
796324-797074 i2s: right: "Right channel: 00010000" "Right: 00010000" "R: 00010000" "R"
797074-797824 i2s: left: "Left channel: f5490000" "Left: f5490000" "L: f5490000" "L"
797824-798574 i2s: right: "Right channel: 00020000" "Right: 00020000" "R: 00020000" "R"
798574-799325 i2s: left: "Left channel: f72e0000" "Left: f72e0000" "L: f72e0000" "L"
799325-800075 i2s: right: "Right channel: 00020000" "Right: 00020000" "R: 00020000" "R"
800075-800825 i2s: left: "Left channel: f9250000" "Left: f9250000" "L: f9250000" "L"
800825-801575 i2s: right: "Right channel: 00030000" "Right: 00030000" "R: 00030000" "R"
801575-802326 i2s: left: "Left channel: fb2e0000" "Left: fb2e0000" "L: fb2e0000" "L"
802326-803076 i2s: right: "Right channel: 00040000" "Right: 00040000" "R: 00040000" "R"
803076-803826 i2s: left: "Left channel: fd190000" "Left: fd190000" "L: fd190000" "L"
803826-804576 i2s: right: "Right channel: 00030000" "Right: 00030000" "R: 00030000" "R"
804576-805327 i2s: left: "Left channel: ff100000" "Left: ff100000" "L: ff100000" "L"
805327-806077 i2s: right: "Right channel: 00050000" "Right: 00050000" "R: 00050000" "R"
806077-806827 i2s: left: "Left channel: 00bf0000" "Left: 00bf0000" "L: 00bf0000" "L"
806827-807577 i2s: right: "Right channel: 00030000" "Right: 00030000" "R: 00030000" "R"
807577-808328 i2s: left: "Left channel: 01fc0000" "Left: 01fc0000" "L: 01fc0000" "L"
808328-809078 i2s: right: "Right channel: 00030000" "Right: 00030000" "R: 00030000" "R"
809078-809828 i2s: left: "Left channel: 03030000" "Left: 03030000" "L: 03030000" "L"
809828-810578 i2s: right: "Right channel: 00030000" "Right: 00030000" "R: 00030000" "R"
810578-811329 i2s: left: "Left channel: 046c0000" "Left: 046c0000" "L: 046c0000" "L"
811329-812079 i2s: right: "Right channel: 00020000" "Right: 00020000" "R: 00020000" "R"
812079-812829 i2s: left: "Left channel: 053f0000" "Left: 053f0000" "L: 053f0000" "L"
812829-813579 i2s: right: "Right channel: 00020000" "Right: 00020000" "R: 00020000" "R"
813579-814330 i2s: left: "Left channel: 061d0000" "Left: 061d0000" "L: 061d0000" "L"
814330-815080 i2s: right: "Right channel: 00030000" "Right: 00030000" "R: 00030000" "R"
815080-815830 i2s: left: "Left channel: 06740000" "Left: 06740000" "L: 06740000" "L"
815830-816580 i2s: right: "Right channel: 00030000" "Right: 00030000" "R: 00030000" "R"
816580-817331 i2s: left: "Left channel: 06870000" "Left: 06870000" "L: 06870000" "L"
817331-818081 i2s: right: "Right channel: 00010000" "Right: 00010000" "R: 00010000" "R"
818081-818831 i2s: left: "Left channel: 068a0000" "Left: 068a0000" "L: 068a0000" "L"
818831-819581 i2s: right: "Right channel: 00030000" "Right: 00030000" "R: 00030000" "R"
819581-820332 i2s: left: "Left channel: 06730000" "Left: 06730000" "L: 06730000" "L"
820332-821082 i2s: right: "Right channel: 00010000" "Right: 00010000" "R: 00010000" "R"
821082-821832 i2s: left: "Left channel: 05de0000" "Left: 05de0000" "L: 05de0000" "L"
821832-822582 i2s: right: "Right channel: 00020000" "Right: 00020000" "R: 00020000" "R"
822582-823333 i2s: left: "Left channel: 05170000" "Left: 05170000" "L: 05170000" "L"
823333-824083 i2s: right: "Right channel: 00000000" "Right: 00000000" "R: 00000000" "R"
824083-824833 i2s: left: "Left channel: 04c30000" "Left: 04c30000" "L: 04c30000" "L"
824833-825583 i2s: right: "Right channel: 00000000" "Right: 00000000" "R: 00000000" "R"
825583-826334 i2s: left: "Left channel: 037e0000" "Left: 037e0000" "L: 037e0000" "L"
826334-827084 i2s: right: "Right channel: ffff0000" "Right: ffff0000" "R: ffff0000" "R"
827084-827834 i2s: left: "Left channel: 02890000" "Left: 02890000" "L: 02890000" "L"
827834-828584 i2s: right: "Right channel: 00010000" "Right: 00010000" "R: 00010000" "R"
828584-829335 i2s: left: "Left channel: 010d0000" "Left: 010d0000" "L: 010d0000" "L"
829335-830085 i2s: right: "Right channel: ffff0000" "Right: ffff0000" "R: ffff0000" "R"
830085-830835 i2s: left: "Left channel: ffd10000" "Left: ffd10000" "L: ffd10000" "L"
830835-831585 i2s: right: "Right channel: fffe0000" "Right: fffe0000" "R: fffe0000" "R"
831585-832336 i2s: left: "Left channel: fe3a0000" "Left: fe3a0000" "L: fe3a0000" "L"
832336-833086 i2s: right: "Right channel: ffff0000" "Right: ffff0000" "R: ffff0000" "R"
833086-833836 i2s: left: "Left channel: fcfa0000" "Left: fcfa0000" "L: fcfa0000" "L"
833836-834586 i2s: right: "Right channel: fffc0000" "Right: fffc0000" "R: fffc0000" "R"
834586-835337 i2s: left: "Left channel: fb4a0000" "Left: fb4a0000" "L: fb4a0000" "L"
835337-836087 i2s: right: "Right channel: 00000000" "Right: 00000000" "R: 00000000" "R"
836087-836837 i2s: left: "Left channel: f96f0000" "Left: f96f0000" "L: f96f0000" "L"
836837-837587 i2s: right: "Right channel: fffd0000" "Right: fffd0000" "R: fffd0000" "R"
837587-838338 i2s: left: "Left channel: f8dd0000" "Left: f8dd0000" "L: f8dd0000" "L"
838338-839088 i2s: right: "Right channel: 00000000" "Right: 00000000" "R: 00000000" "R"
839088-839838 i2s: left: "Left channel: f8f30000" "Left: f8f30000" "L: f8f30000" "L"
839838-840588 i2s: right: "Right channel: ffff0000" "Right: ffff0000" "R: ffff0000" "R"
840588-841339 i2s: left: "Left channel: f7da0000" "Left: f7da0000" "L: f7da0000" "L"
841339-842089 i2s: right: "Right channel: ffff0000" "Right: ffff0000" "R: ffff0000" "R"
842089-842839 i2s: left: "Left channel: f69a0000" "Left: f69a0000" "L: f69a0000" "L"
842839-843589 i2s: right: "Right channel: fffe0000" "Right: fffe0000" "R: fffe0000" "R"
843589-844340 i2s: left: "Left channel: f5380000" "Left: f5380000" "L: f5380000" "L"
844340-845090 i2s: right: "Right channel: fffe0000" "Right: fffe0000" "R: fffe0000" "R"
845090-845840 i2s: left: "Left channel: f51a0000" "Left: f51a0000" "L: f51a0000" "L"
845840-846590 i2s: right: "Right channel: ffff0000" "Right: ffff0000" "R: ffff0000" "R"
846590-847341 i2s: left: "Left channel: f5a50000" "Left: f5a50000" "L: f5a50000" "L"
847341-848091 i2s: right: "Right channel: ffff0000" "Right: ffff0000" "R: ffff0000" "R"
848091-848841 i2s: left: "Left channel: f5980000" "Left: f5980000" "L: f5980000" "L"
848841-849591 i2s: right: "Right channel: ffff0000" "Right: ffff0000" "R: ffff0000" "R"
849591-850342 i2s: left: "Left channel: f5320000" "Left: f5320000" "L: f5320000" "L"
850342-851092 i2s: right: "Right channel: fffd0000" "Right: fffd0000" "R: fffd0000" "R"
851092-851842 i2s: left: "Left channel: f5890000" "Left: f5890000" "L: f5890000" "L"
851842-852592 i2s: right: "Right channel: ffff0000" "Right: ffff0000" "R: ffff0000" "R"
852592-853343 i2s: left: "Left channel: f6a90000" "Left: f6a90000" "L: f6a90000" "L"
853343-854093 i2s: right: "Right channel: ffff0000" "Right: ffff0000" "R: ffff0000" "R"
854093-854843 i2s: left: "Left channel: f7b10000" "Left: f7b10000" "L: f7b10000" "L"
854843-855593 i2s: right: "Right channel: 00020000" "Right: 00020000" "R: 00020000" "R"
855593-856344 i2s: left: "Left channel: f91a0000" "Left: f91a0000" "L: f91a0000" "L"
856344-857094 i2s: right: "Right channel: 00030000" "Right: 00030000" "R: 00030000" "R"
857094-857844 i2s: left: "Left channel: faf10000" "Left: faf10000" "L: faf10000" "L"
857844-858594 i2s: right: "Right channel: 00000000" "Right: 00000000" "R: 00000000" "R"
858594-859345 i2s: left: "Left channel: fcf10000" "Left: fcf10000" "L: fcf10000" "L"
859345-860095 i2s: right: "Right channel: 00040000" "Right: 00040000" "R: 00040000" "R"
860095-860845 i2s: left: "Left channel: fef00000" "Left: fef00000" "L: fef00000" "L"
860845-861595 i2s: right: "Right channel: 00020000" "Right: 00020000" "R: 00020000" "R"
861595-862346 i2s: left: "Left channel: 00c60000" "Left: 00c60000" "L: 00c60000" "L"
862346-863096 i2s: right: "Right channel: 00050000" "Right: 00050000" "R: 00050000" "R"
863096-863846 i2s: left: "Left channel: 02a40000" "Left: 02a40000" "L: 02a40000" "L"
863846-864596 i2s: right: "Right channel: 00030000" "Right: 00030000" "R: 00030000" "R"
864596-865347 i2s: left: "Left channel: 049e0000" "Left: 049e0000" "L: 049e0000" "L"
865347-866097 i2s: right: "Right channel: 00030000" "Right: 00030000" "R: 00030000" "R"
866097-866847 i2s: left: "Left channel: 062c0000" "Left: 062c0000" "L: 062c0000" "L"
866847-867597 i2s: right: "Right channel: 00030000" "Right: 00030000" "R: 00030000" "R"
867597-868348 i2s: left: "Left channel: 077a0000" "Left: 077a0000" "L: 077a0000" "L"
868348-869098 i2s: right: "Right channel: 00030000" "Right: 00030000" "R: 00030000" "R"
869098-869848 i2s: left: "Left channel: 08730000" "Left: 08730000" "L: 08730000" "L"
869848-870598 i2s: right: "Right channel: 00030000" "Right: 00030000" "R: 00030000" "R"
870598-871349 i2s: left: "Left channel: 08af0000" "Left: 08af0000" "L: 08af0000" "L"
871349-872099 i2s: right: "Right channel: 00010000" "Right: 00010000" "R: 00010000" "R"
872099-872849 i2s: left: "Left channel: 08630000" "Left: 08630000" "L: 08630000" "L"
872849-873599 i2s: right: "Right channel: 00010000" "Right: 00010000" "R: 00010000" "R"
873599-874350 i2s: left: "Left channel: 07f20000" "Left: 07f20000" "L: 07f20000" "L"
874350-875100 i2s: right: "Right channel: ffff0000" "Right: ffff0000" "R: ffff0000" "R"
875100-875850 i2s: left: "Left channel: 072f0000" "Left: 072f0000" "L: 072f0000" "L"
875850-876600 i2s: right: "Right channel: 00000000" "Right: 00000000" "R: 00000000" "R"
876600-877351 i2s: left: "Left channel: 060a0000" "Left: 060a0000" "L: 060a0000" "L"
877351-878101 i2s: right: "Right channel: ffff0000" "Right: ffff0000" "R: ffff0000" "R"
878101-878851 i2s: left: "Left channel: 04710000" "Left: 04710000" "L: 04710000" "L"
878851-879601 i2s: right: "Right channel: fffe0000" "Right: fffe0000" "R: fffe0000" "R"
879601-880352 i2s: left: "Left channel: 024d0000" "Left: 024d0000" "L: 024d0000" "L"
880352-881102 i2s: right: "Right channel: ffff0000" "Right: ffff0000" "R: ffff0000" "R"
881102-881852 i2s: left: "Left channel: 00510000" "Left: 00510000" "L: 00510000" "L"
881852-882602 i2s: right: "Right channel: fffe0000" "Right: fffe0000" "R: fffe0000" "R"
882602-883353 i2s: left: "Left channel: fe870000" "Left: fe870000" "L: fe870000" "L"
883353-884103 i2s: right: "Right channel: fffe0000" "Right: fffe0000" "R: fffe0000" "R"
884103-884853 i2s: left: "Left channel: fcb60000" "Left: fcb60000" "L: fcb60000" "L"
884853-885603 i2s: right: "Right channel: fffe0000" "Right: fffe0000" "R: fffe0000" "R"
885603-886354 i2s: left: "Left channel: fb1c0000" "Left: fb1c0000" "L: fb1c0000" "L"
886354-887104 i2s: right: "Right channel: 00010000" "Right: 00010000" "R: 00010000" "R"
887104-887854 i2s: left: "Left channel: f9d50000" "Left: f9d50000" "L: f9d50000" "L"
887854-888604 i2s: right: "Right channel: fffd0000" "Right: fffd0000" "R: fffd0000" "R"
888604-889355 i2s: left: "Left channel: f8c60000" "Left: f8c60000" "L: f8c60000" "L"
889355-890105 i2s: right: "Right channel: fffd0000" "Right: fffd0000" "R: fffd0000" "R"
890105-890855 i2s: left: "Left channel: f81b0000" "Left: f81b0000" "L: f81b0000" "L"
890855-891605 i2s: right: "Right channel: 00000000" "Right: 00000000" "R: 00000000" "R"
891605-892356 i2s: left: "Left channel: f7bf0000" "Left: f7bf0000" "L: f7bf0000" "L"
892356-893106 i2s: right: "Right channel: fffd0000" "Right: fffd0000" "R: fffd0000" "R"
893106-893856 i2s: left: "Left channel: f79b0000" "Left: f79b0000" "L: f79b0000" "L"
893856-894606 i2s: right: "Right channel: ffff0000" "Right: ffff0000" "R: ffff0000" "R"
894606-895357 i2s: left: "Left channel: f7d90000" "Left: f7d90000" "L: f7d90000" "L"
895357-896107 i2s: right: "Right channel: 00000000" "Right: 00000000" "R: 00000000" "R"
896107-896857 i2s: left: "Left channel: f8aa0000" "Left: f8aa0000" "L: f8aa0000" "L"
896857-897607 i2s: right: "Right channel: ffff0000" "Right: ffff0000" "R: ffff0000" "R"
897607-898358 i2s: left: "Left channel: f96b0000" "Left: f96b0000" "L: f96b0000" "L"
898358-899108 i2s: right: "Right channel: ffff0000" "Right: ffff0000" "R: ffff0000" "R"
899108-899858 i2s: left: "Left channel: f9ea0000" "Left: f9ea0000" "L: f9ea0000" "L"
899858-900608 i2s: right: "Right channel: 00020000" "Right: 00020000" "R: 00020000" "R"
900608-901359 i2s: left: "Left channel: fa6e0000" "Left: fa6e0000" "L: fa6e0000" "L"
901359-902109 i2s: right: "Right channel: ffff0000" "Right: ffff0000" "R: ffff0000" "R"
902109-902859 i2s: left: "Left channel: fb5c0000" "Left: fb5c0000" "L: fb5c0000" "L"
902859-903609 i2s: right: "Right channel: ffff0000" "Right: ffff0000" "R: ffff0000" "R"
903609-904360 i2s: left: "Left channel: fcc20000" "Left: fcc20000" "L: fcc20000" "L"
904360-905110 i2s: right: "Right channel: 00000000" "Right: 00000000" "R: 00000000" "R"
905110-905860 i2s: left: "Left channel: fe4a0000" "Left: fe4a0000" "L: fe4a0000" "L"
905860-906611 i2s: right: "Right channel: 00010000" "Right: 00010000" "R: 00010000" "R"
906611-907361 i2s: left: "Left channel: ffbd0000" "Left: ffbd0000" "L: ffbd0000" "L"
907361-908111 i2s: right: "Right channel: 00020000" "Right: 00020000" "R: 00020000" "R"
908111-908861 i2s: left: "Left channel: 015f0000" "Left: 015f0000" "L: 015f0000" "L"
908861-909611 i2s: right: "Right channel: 00020000" "Right: 00020000" "R: 00020000" "R"
909611-910362 i2s: left: "Left channel: 031a0000" "Left: 031a0000" "L: 031a0000" "L"
910362-911112 i2s: right: "Right channel: 00020000" "Right: 00020000" "R: 00020000" "R"
911112-911862 i2s: left: "Left channel: 04e90000" "Left: 04e90000" "L: 04e90000" "L"
911862-912613 i2s: right: "Right channel: 00030000" "Right: 00030000" "R: 00030000" "R"
912613-913363 i2s: left: "Left channel: 06e50000" "Left: 06e50000" "L: 06e50000" "L"
913363-914113 i2s: right: "Right channel: 00030000" "Right: 00030000" "R: 00030000" "R"
914113-914863 i2s: left: "Left channel: 08de0000" "Left: 08de0000" "L: 08de0000" "L"
914863-915614 i2s: right: "Right channel: 00020000" "Right: 00020000" "R: 00020000" "R"
915614-916364 i2s: left: "Left channel: 0acd0000" "Left: 0acd0000" "L: 0acd0000" "L"
916364-917114 i2s: right: "Right channel: 00050000" "Right: 00050000" "R: 00050000" "R"
917114-917864 i2s: left: "Left channel: 0c6b0000" "Left: 0c6b0000" "L: 0c6b0000" "L"
917864-918615 i2s: right: "Right channel: 00010000" "Right: 00010000" "R: 00010000" "R"
918615-919365 i2s: left: "Left channel: 0da90000" "Left: 0da90000" "L: 0da90000" "L"
919365-920115 i2s: right: "Right channel: 00010000" "Right: 00010000" "R: 00010000" "R"
920115-920865 i2s: left: "Left channel: 0ed60000" "Left: 0ed60000" "L: 0ed60000" "L"
920865-921616 i2s: right: "Right channel: 00040000" "Right: 00040000" "R: 00040000" "R"
921616-922366 i2s: left: "Left channel: 10270000" "Left: 10270000" "L: 10270000" "L"
922366-923116 i2s: right: "Right channel: 00010000" "Right: 00010000" "R: 00010000" "R"
923116-923866 i2s: left: "Left channel: 116e0000" "Left: 116e0000" "L: 116e0000" "L"
923866-924617 i2s: right: "Right channel: 00030000" "Right: 00030000" "R: 00030000" "R"
924617-925367 i2s: left: "Left channel: 12660000" "Left: 12660000" "L: 12660000" "L"
925367-926117 i2s: right: "Right channel: 00020000" "Right: 00020000" "R: 00020000" "R"
926117-926867 i2s: left: "Left channel: 12fc0000" "Left: 12fc0000" "L: 12fc0000" "L"
926867-927618 i2s: right: "Right channel: 00020000" "Right: 00020000" "R: 00020000" "R"
927618-928368 i2s: left: "Left channel: 13140000" "Left: 13140000" "L: 13140000" "L"
928368-929118 i2s: right: "Right channel: ffff0000" "Right: ffff0000" "R: ffff0000" "R"
929118-929868 i2s: left: "Left channel: 13010000" "Left: 13010000" "L: 13010000" "L"
929868-930619 i2s: right: "Right channel: 00000000" "Right: 00000000" "R: 00000000" "R"
930619-931369 i2s: left: "Left channel: 12e00000" "Left: 12e00000" "L: 12e00000" "L"
931369-932119 i2s: right: "Right channel: fffe0000" "Right: fffe0000" "R: fffe0000" "R"
932119-932869 i2s: left: "Left channel: 12800000" "Left: 12800000" "L: 12800000" "L"
932869-933620 i2s: right: "Right channel: 00000000" "Right: 00000000" "R: 00000000" "R"
933620-934370 i2s: left: "Left channel: 118d0000" "Left: 118d0000" "L: 118d0000" "L"
934370-935120 i2s: right: "Right channel: 00010000" "Right: 00010000" "R: 00010000" "R"
935120-935870 i2s: left: "Left channel: 0ffd0000" "Left: 0ffd0000" "L: 0ffd0000" "L"
935870-936621 i2s: right: "Right channel: ffff0000" "Right: ffff0000" "R: ffff0000" "R"
936621-937371 i2s: left: "Left channel: 0dfb0000" "Left: 0dfb0000" "L: 0dfb0000" "L"
937371-938121 i2s: right: "Right channel: fffb0000" "Right: fffb0000" "R: fffb0000" "R"
938121-938871 i2s: left: "Left channel: 0bbd0000" "Left: 0bbd0000" "L: 0bbd0000" "L"
938871-939622 i2s: right: "Right channel: fffd0000" "Right: fffd0000" "R: fffd0000" "R"
939622-940372 i2s: left: "Left channel: 094f0000" "Left: 094f0000" "L: 094f0000" "L"
940372-941122 i2s: right: "Right channel: fffc0000" "Right: fffc0000" "R: fffc0000" "R"
941122-941872 i2s: left: "Left channel: 06940000" "Left: 06940000" "L: 06940000" "L"
941872-942623 i2s: right: "Right channel: fffd0000" "Right: fffd0000" "R: fffd0000" "R"
942623-943373 i2s: left: "Left channel: 03b80000" "Left: 03b80000" "L: 03b80000" "L"
943373-944123 i2s: right: "Right channel: fffe0000" "Right: fffe0000" "R: fffe0000" "R"
944123-944873 i2s: left: "Left channel: 00d60000" "Left: 00d60000" "L: 00d60000" "L"
944873-945624 i2s: right: "Right channel: fffc0000" "Right: fffc0000" "R: fffc0000" "R"
945624-946374 i2s: left: "Left channel: fe030000" "Left: fe030000" "L: fe030000" "L"
946374-947124 i2s: right: "Right channel: fffc0000" "Right: fffc0000" "R: fffc0000" "R"
947124-947874 i2s: left: "Left channel: fb4d0000" "Left: fb4d0000" "L: fb4d0000" "L"
947874-948625 i2s: right: "Right channel: fffa0000" "Right: fffa0000" "R: fffa0000" "R"
948625-949375 i2s: left: "Left channel: f8d40000" "Left: f8d40000" "L: f8d40000" "L"
949375-950125 i2s: right: "Right channel: fffb0000" "Right: fffb0000" "R: fffb0000" "R"
950125-950875 i2s: left: "Left channel: f6c30000" "Left: f6c30000" "L: f6c30000" "L"
950875-951626 i2s: right: "Right channel: fffd0000" "Right: fffd0000" "R: fffd0000" "R"
951626-952376 i2s: left: "Left channel: f5360000" "Left: f5360000" "L: f5360000" "L"
952376-953126 i2s: right: "Right channel: fffc0000" "Right: fffc0000" "R: fffc0000" "R"
953126-953876 i2s: left: "Left channel: f3e40000" "Left: f3e40000" "L: f3e40000" "L"
953876-954627 i2s: right: "Right channel: fffe0000" "Right: fffe0000" "R: fffe0000" "R"
954627-955377 i2s: left: "Left channel: f3020000" "Left: f3020000" "L: f3020000" "L"
955377-956127 i2s: right: "Right channel: fffc0000" "Right: fffc0000" "R: fffc0000" "R"
956127-956877 i2s: left: "Left channel: f2910000" "Left: f2910000" "L: f2910000" "L"
956877-957628 i2s: right: "Right channel: fffe0000" "Right: fffe0000" "R: fffe0000" "R"
957628-958378 i2s: left: "Left channel: f2ab0000" "Left: f2ab0000" "L: f2ab0000" "L"
958378-959128 i2s: right: "Right channel: ffff0000" "Right: ffff0000" "R: ffff0000" "R"
959128-959878 i2s: left: "Left channel: f3460000" "Left: f3460000" "L: f3460000" "L"
959878-960629 i2s: right: "Right channel: ffff0000" "Right: ffff0000" "R: ffff0000" "R"
960629-961379 i2s: left: "Left channel: f4140000" "Left: f4140000" "L: f4140000" "L"
961379-962129 i2s: right: "Right channel: 00020000" "Right: 00020000" "R: 00020000" "R"
962129-962879 i2s: left: "Left channel: f4f00000" "Left: f4f00000" "L: f4f00000" "L"
962879-963630 i2s: right: "Right channel: 00000000" "Right: 00000000" "R: 00000000" "R"
963630-964380 i2s: left: "Left channel: f5ea0000" "Left: f5ea0000" "L: f5ea0000" "L"
964380-965130 i2s: right: "Right channel: 00020000" "Right: 00020000" "R: 00020000" "R"
965130-965880 i2s: left: "Left channel: f7310000" "Left: f7310000" "L: f7310000" "L"
965880-966631 i2s: right: "Right channel: 00000000" "Right: 00000000" "R: 00000000" "R"
966631-967381 i2s: left: "Left channel: f87e0000" "Left: f87e0000" "L: f87e0000" "L"
967381-968131 i2s: right: "Right channel: 00020000" "Right: 00020000" "R: 00020000" "R"
968131-968881 i2s: left: "Left channel: f9a80000" "Left: f9a80000" "L: f9a80000" "L"
968881-969632 i2s: right: "Right channel: 00030000" "Right: 00030000" "R: 00030000" "R"
969632-970382 i2s: left: "Left channel: fa9a0000" "Left: fa9a0000" "L: fa9a0000" "L"
970382-971132 i2s: right: "Right channel: 00030000" "Right: 00030000" "R: 00030000" "R"
971132-971882 i2s: left: "Left channel: fb770000" "Left: fb770000" "L: fb770000" "L"
971882-972633 i2s: right: "Right channel: 00020000" "Right: 00020000" "R: 00020000" "R"
972633-973383 i2s: left: "Left channel: fc4e0000" "Left: fc4e0000" "L: fc4e0000" "L"
973383-974133 i2s: right: "Right channel: 00020000" "Right: 00020000" "R: 00020000" "R"
974133-974883 i2s: left: "Left channel: fd110000" "Left: fd110000" "L: fd110000" "L"
974883-975634 i2s: right: "Right channel: 00010000" "Right: 00010000" "R: 00010000" "R"
975634-976384 i2s: left: "Left channel: fdef0000" "Left: fdef0000" "L: fdef0000" "L"
976384-977134 i2s: right: "Right channel: 00020000" "Right: 00020000" "R: 00020000" "R"
977134-977884 i2s: left: "Left channel: fe920000" "Left: fe920000" "L: fe920000" "L"
977884-978635 i2s: right: "Right channel: 00020000" "Right: 00020000" "R: 00020000" "R"
978635-979385 i2s: left: "Left channel: ff900000" "Left: ff900000" "L: ff900000" "L"
979385-980135 i2s: right: "Right channel: 00010000" "Right: 00010000" "R: 00010000" "R"
980135-980885 i2s: left: "Left channel: 00570000" "Left: 00570000" "L: 00570000" "L"
980885-981636 i2s: right: "Right channel: 00020000" "Right: 00020000" "R: 00020000" "R"
981636-982386 i2s: left: "Left channel: 01000000" "Left: 01000000" "L: 01000000" "L"
982386-983136 i2s: right: "Right channel: 00000000" "Right: 00000000" "R: 00000000" "R"
983136-983886 i2s: left: "Left channel: 01980000" "Left: 01980000" "L: 01980000" "L"
983886-984637 i2s: right: "Right channel: 00030000" "Right: 00030000" "R: 00030000" "R"
984637-985387 i2s: left: "Left channel: 02470000" "Left: 02470000" "L: 02470000" "L"
985387-986137 i2s: right: "Right channel: 00010000" "Right: 00010000" "R: 00010000" "R"
986137-986887 i2s: left: "Left channel: 02400000" "Left: 02400000" "L: 02400000" "L"
986887-987638 i2s: right: "Right channel: 00020000" "Right: 00020000" "R: 00020000" "R"
987638-988388 i2s: left: "Left channel: 02c30000" "Left: 02c30000" "L: 02c30000" "L"
988388-989138 i2s: right: "Right channel: 00000000" "Right: 00000000" "R: 00000000" "R"
989138-989888 i2s: left: "Left channel: 02a60000" "Left: 02a60000" "L: 02a60000" "L"
989888-990639 i2s: right: "Right channel: 00010000" "Right: 00010000" "R: 00010000" "R"
990639-991389 i2s: left: "Left channel: 02eb0000" "Left: 02eb0000" "L: 02eb0000" "L"
991389-992139 i2s: right: "Right channel: 00010000" "Right: 00010000" "R: 00010000" "R"
992139-992889 i2s: left: "Left channel: 02520000" "Left: 02520000" "L: 02520000" "L"
992889-993640 i2s: right: "Right channel: ffff0000" "Right: ffff0000" "R: ffff0000" "R"
993640-994390 i2s: left: "Left channel: 02660000" "Left: 02660000" "L: 02660000" "L"
994390-995140 i2s: right: "Right channel: 00010000" "Right: 00010000" "R: 00010000" "R"
995140-995890 i2s: left: "Left channel: 015c0000" "Left: 015c0000" "L: 015c0000" "L"
995890-996641 i2s: right: "Right channel: 00000000" "Right: 00000000" "R: 00000000" "R"
996641-997391 i2s: left: "Left channel: 00fe0000" "Left: 00fe0000" "L: 00fe0000" "L"
997391-998141 i2s: right: "Right channel: 00000000" "Right: 00000000" "R: 00000000" "R"
998141-998891 i2s: left: "Left channel: ffc30000" "Left: ffc30000" "L: ffc30000" "L"
998891-999642 i2s: right: "Right channel: 00000000" "Right: 00000000" "R: 00000000" "R"
999642-1000392 i2s: left: "Left channel: ff2f0000" "Left: ff2f0000" "L: ff2f0000" "L"
1000392-1001142 i2s: right: "Right channel: 00000000" "Right: 00000000" "R: 00000000" "R"
1001142-1001892 i2s: left: "Left channel: fe580000" "Left: fe580000" "L: fe580000" "L"
1001892-1002643 i2s: right: "Right channel: fffd0000" "Right: fffd0000" "R: fffd0000" "R"
1002643-1003393 i2s: left: "Left channel: fd910000" "Left: fd910000" "L: fd910000" "L"
1003393-1004143 i2s: right: "Right channel: 00000000" "Right: 00000000" "R: 00000000" "R"
1004143-1004893 i2s: left: "Left channel: fc940000" "Left: fc940000" "L: fc940000" "L"
1004893-1005644 i2s: right: "Right channel: fffe0000" "Right: fffe0000" "R: fffe0000" "R"
1005644-1006394 i2s: left: "Left channel: fbb80000" "Left: fbb80000" "L: fbb80000" "L"
1006394-1007144 i2s: right: "Right channel: 00010000" "Right: 00010000" "R: 00010000" "R"
1007144-1007894 i2s: left: "Left channel: fb970000" "Left: fb970000" "L: fb970000" "L"
1007894-1008645 i2s: right: "Right channel: fffe0000" "Right: fffe0000" "R: fffe0000" "R"
1008645-1009395 i2s: left: "Left channel: fb360000" "Left: fb360000" "L: fb360000" "L"
1009395-1010145 i2s: right: "Right channel: 00000000" "Right: 00000000" "R: 00000000" "R"
1010145-1010895 i2s: left: "Left channel: fb350000" "Left: fb350000" "L: fb350000" "L"
1010895-1011646 i2s: right: "Right channel: 00000000" "Right: 00000000" "R: 00000000" "R"
1011646-1012396 i2s: left: "Left channel: fab90000" "Left: fab90000" "L: fab90000" "L"
1012396-1013146 i2s: right: "Right channel: ffff0000" "Right: ffff0000" "R: ffff0000" "R"
1013146-1013896 i2s: left: "Left channel: fa500000" "Left: fa500000" "L: fa500000" "L"
1013896-1014647 i2s: right: "Right channel: fffe0000" "Right: fffe0000" "R: fffe0000" "R"
1014647-1015397 i2s: left: "Left channel: fa3d0000" "Left: fa3d0000" "L: fa3d0000" "L"
1015397-1016147 i2s: right: "Right channel: ffff0000" "Right: ffff0000" "R: ffff0000" "R"
1016147-1016897 i2s: left: "Left channel: faf60000" "Left: faf60000" "L: faf60000" "L"
1016897-1017648 i2s: right: "Right channel: 00000000" "Right: 00000000" "R: 00000000" "R"
1017648-1018398 i2s: left: "Left channel: fad40000" "Left: fad40000" "L: fad40000" "L"
1018398-1019148 i2s: right: "Right channel: 00000000" "Right: 00000000" "R: 00000000" "R"
1019148-1019898 i2s: left: "Left channel: fafa0000" "Left: fafa0000" "L: fafa0000" "L"
1019898-1020649 i2s: right: "Right channel: 00020000" "Right: 00020000" "R: 00020000" "R"
1020649-1021399 i2s: left: "Left channel: fab40000" "Left: fab40000" "L: fab40000" "L"
1021399-1022149 i2s: right: "Right channel: 00000000" "Right: 00000000" "R: 00000000" "R"
1022149-1022899 i2s: left: "Left channel: fadb0000" "Left: fadb0000" "L: fadb0000" "L"
1022899-1023650 i2s: right: "Right channel: 00010000" "Right: 00010000" "R: 00010000" "R"
1023650-1024400 i2s: left: "Left channel: facf0000" "Left: facf0000" "L: facf0000" "L"
1024400-1025150 i2s: right: "Right channel: 00000000" "Right: 00000000" "R: 00000000" "R"
1025150-1025900 i2s: left: "Left channel: fb300000" "Left: fb300000" "L: fb300000" "L"
1025900-1026651 i2s: right: "Right channel: 00010000" "Right: 00010000" "R: 00010000" "R"
1026651-1027401 i2s: left: "Left channel: fae20000" "Left: fae20000" "L: fae20000" "L"
1027401-1028151 i2s: right: "Right channel: ffff0000" "Right: ffff0000" "R: ffff0000" "R"
1028151-1028902 i2s: left: "Left channel: fb770000" "Left: fb770000" "L: fb770000" "L"
1028902-1029652 i2s: right: "Right channel: 00020000" "Right: 00020000" "R: 00020000" "R"
1029652-1030402 i2s: left: "Left channel: fbdc0000" "Left: fbdc0000" "L: fbdc0000" "L"
1030402-1031152 i2s: right: "Right channel: 00010000" "Right: 00010000" "R: 00010000" "R"
1031152-1031903 i2s: left: "Left channel: fc2a0000" "Left: fc2a0000" "L: fc2a0000" "L"
1031903-1032653 i2s: right: "Right channel: 00010000" "Right: 00010000" "R: 00010000" "R"
1032653-1033403 i2s: left: "Left channel: fc910000" "Left: fc910000" "L: fc910000" "L"
1033403-1034153 i2s: right: "Right channel: 00000000" "Right: 00000000" "R: 00000000" "R"
1034153-1034904 i2s: left: "Left channel: fd990000" "Left: fd990000" "L: fd990000" "L"
1034904-1035654 i2s: right: "Right channel: 00020000" "Right: 00020000" "R: 00020000" "R"
1035654-1036404 i2s: left: "Left channel: fe590000" "Left: fe590000" "L: fe590000" "L"
1036404-1037154 i2s: right: "Right channel: 00020000" "Right: 00020000" "R: 00020000" "R"
1037154-1037905 i2s: left: "Left channel: ffbf0000" "Left: ffbf0000" "L: ffbf0000" "L"
1037905-1038655 i2s: right: "Right channel: 00020000" "Right: 00020000" "R: 00020000" "R"
1038655-1039405 i2s: left: "Left channel: 00fb0000" "Left: 00fb0000" "L: 00fb0000" "L"
1039405-1040155 i2s: right: "Right channel: 00020000" "Right: 00020000" "R: 00020000" "R"
1040155-1040906 i2s: left: "Left channel: 02170000" "Left: 02170000" "L: 02170000" "L"
1040906-1041656 i2s: right: "Right channel: 00020000" "Right: 00020000" "R: 00020000" "R"
1041656-1042406 i2s: left: "Left channel: 02cb0000" "Left: 02cb0000" "L: 02cb0000" "L"
1042406-1043156 i2s: right: "Right channel: 00010000" "Right: 00010000" "R: 00010000" "R"
1043156-1043907 i2s: left: "Left channel: 03ec0000" "Left: 03ec0000" "L: 03ec0000" "L"
1043907-1044657 i2s: right: "Right channel: 00000000" "Right: 00000000" "R: 00000000" "R"
1044657-1045407 i2s: left: "Left channel: 04a30000" "Left: 04a30000" "L: 04a30000" "L"
1045407-1046157 i2s: right: "Right channel: 00010000" "Right: 00010000" "R: 00010000" "R"
1046157-1046908 i2s: left: "Left channel: 057a0000" "Left: 057a0000" "L: 057a0000" "L"
1046908-1047658 i2s: right: "Right channel: 00020000" "Right: 00020000" "R: 00020000" "R"
1047658-1048408 i2s: left: "Left channel: 05a30000" "Left: 05a30000" "L: 05a30000" "L"
1048408-1049158 i2s: right: "Right channel: 00010000" "Right: 00010000" "R: 00010000" "R"
1049158-1049909 i2s: left: "Left channel: 05680000" "Left: 05680000" "L: 05680000" "L"
1049909-1050659 i2s: right: "Right channel: 00000000" "Right: 00000000" "R: 00000000" "R"
1050659-1051409 i2s: left: "Left channel: 052c0000" "Left: 052c0000" "L: 052c0000" "L"
1051409-1052159 i2s: right: "Right channel: 00010000" "Right: 00010000" "R: 00010000" "R"
1052159-1052910 i2s: left: "Left channel: 04dd0000" "Left: 04dd0000" "L: 04dd0000" "L"
1052910-1053660 i2s: right: "Right channel: fffe0000" "Right: fffe0000" "R: fffe0000" "R"
1053660-1054410 i2s: left: "Left channel: 04260000" "Left: 04260000" "L: 04260000" "L"
1054410-1055160 i2s: right: "Right channel: 00000000" "Right: 00000000" "R: 00000000" "R"
1055160-1055911 i2s: left: "Left channel: 035e0000" "Left: 035e0000" "L: 035e0000" "L"
1055911-1056661 i2s: right: "Right channel: 00000000" "Right: 00000000" "R: 00000000" "R"
1056661-1057411 i2s: left: "Left channel: 02680000" "Left: 02680000" "L: 02680000" "L"
1057411-1058161 i2s: right: "Right channel: 00000000" "Right: 00000000" "R: 00000000" "R"
1058161-1058912 i2s: left: "Left channel: 01880000" "Left: 01880000" "L: 01880000" "L"
1058912-1059662 i2s: right: "Right channel: fffd0000" "Right: fffd0000" "R: fffd0000" "R"
1059662-1060412 i2s: left: "Left channel: 00a70000" "Left: 00a70000" "L: 00a70000" "L"
1060412-1061162 i2s: right: "Right channel: 00000000" "Right: 00000000" "R: 00000000" "R"
1061162-1061913 i2s: left: "Left channel: 00030000" "Left: 00030000" "L: 00030000" "L"
1061913-1062663 i2s: right: "Right channel: 00000000" "Right: 00000000" "R: 00000000" "R"
1062663-1063413 i2s: left: "Left channel: ff460000" "Left: ff460000" "L: ff460000" "L"
1063413-1064163 i2s: right: "Right channel: ffff0000" "Right: ffff0000" "R: ffff0000" "R"
1064163-1064914 i2s: left: "Left channel: ff0a0000" "Left: ff0a0000" "L: ff0a0000" "L"
1064914-1065664 i2s: right: "Right channel: 00010000" "Right: 00010000" "R: 00010000" "R"
1065664-1066414 i2s: left: "Left channel: ff210000" "Left: ff210000" "L: ff210000" "L"
1066414-1067164 i2s: right: "Right channel: fffe0000" "Right: fffe0000" "R: fffe0000" "R"
1067164-1067915 i2s: left: "Left channel: ff240000" "Left: ff240000" "L: ff240000" "L"
1067915-1068665 i2s: right: "Right channel: 00010000" "Right: 00010000" "R: 00010000" "R"
1068665-1069415 i2s: left: "Left channel: ff570000" "Left: ff570000" "L: ff570000" "L"
1069415-1070165 i2s: right: "Right channel: ffff0000" "Right: ffff0000" "R: ffff0000" "R"
1070165-1070916 i2s: left: "Left channel: ff550000" "Left: ff550000" "L: ff550000" "L"
1070916-1071666 i2s: right: "Right channel: fffe0000" "Right: fffe0000" "R: fffe0000" "R"
1071666-1072416 i2s: left: "Left channel: ff510000" "Left: ff510000" "L: ff510000" "L"
1072416-1073166 i2s: right: "Right channel: 00020000" "Right: 00020000" "R: 00020000" "R"
1073166-1073917 i2s: left: "Left channel: ff980000" "Left: ff980000" "L: ff980000" "L"
1073917-1074667 i2s: right: "Right channel: fffd0000" "Right: fffd0000" "R: fffd0000" "R"
1074667-1075417 i2s: left: "Left channel: ffe40000" "Left: ffe40000" "L: ffe40000" "L"
1075417-1076167 i2s: right: "Right channel: 00010000" "Right: 00010000" "R: 00010000" "R"
1076167-1076918 i2s: left: "Left channel: fff30000" "Left: fff30000" "L: fff30000" "L"
1076918-1077668 i2s: right: "Right channel: 00000000" "Right: 00000000" "R: 00000000" "R"
1077668-1078418 i2s: left: "Left channel: ffd80000" "Left: ffd80000" "L: ffd80000" "L"
1078418-1079168 i2s: right: "Right channel: 00020000" "Right: 00020000" "R: 00020000" "R"
1079168-1079919 i2s: left: "Left channel: ffa60000" "Left: ffa60000" "L: ffa60000" "L"
1079919-1080669 i2s: right: "Right channel: ffff0000" "Right: ffff0000" "R: ffff0000" "R"
1080669-1081419 i2s: left: "Left channel: ff920000" "Left: ff920000" "L: ff920000" "L"
1081419-1082169 i2s: right: "Right channel: 00010000" "Right: 00010000" "R: 00010000" "R"
1082169-1082920 i2s: left: "Left channel: ffb50000" "Left: ffb50000" "L: ffb50000" "L"
1082920-1083670 i2s: right: "Right channel: fffe0000" "Right: fffe0000" "R: fffe0000" "R"
1083670-1084420 i2s: left: "Left channel: ffea0000" "Left: ffea0000" "L: ffea0000" "L"
1084420-1085170 i2s: right: "Right channel: 00020000" "Right: 00020000" "R: 00020000" "R"
1085170-1085921 i2s: left: "Left channel: ffcb0000" "Left: ffcb0000" "L: ffcb0000" "L"
1085921-1086671 i2s: right: "Right channel: ffff0000" "Right: ffff0000" "R: ffff0000" "R"
1086671-1087421 i2s: left: "Left channel: 00200000" "Left: 00200000" "L: 00200000" "L"
1087421-1088171 i2s: right: "Right channel: 00010000" "Right: 00010000" "R: 00010000" "R"
1088171-1088922 i2s: left: "Left channel: 00ba0000" "Left: 00ba0000" "L: 00ba0000" "L"
1088922-1089672 i2s: right: "Right channel: 00000000" "Right: 00000000" "R: 00000000" "R"
1089672-1090422 i2s: left: "Left channel: 016f0000" "Left: 016f0000" "L: 016f0000" "L"
1090422-1091172 i2s: right: "Right channel: 00000000" "Right: 00000000" "R: 00000000" "R"
1091172-1091923 i2s: left: "Left channel: 02370000" "Left: 02370000" "L: 02370000" "L"
1091923-1092673 i2s: right: "Right channel: 00010000" "Right: 00010000" "R: 00010000" "R"
1092673-1093423 i2s: left: "Left channel: 03350000" "Left: 03350000" "L: 03350000" "L"
1093423-1094173 i2s: right: "Right channel: 00010000" "Right: 00010000" "R: 00010000" "R"
1094173-1094924 i2s: left: "Left channel: 04800000" "Left: 04800000" "L: 04800000" "L"
1094924-1095674 i2s: right: "Right channel: 00020000" "Right: 00020000" "R: 00020000" "R"
1095674-1096424 i2s: left: "Left channel: 05ef0000" "Left: 05ef0000" "L: 05ef0000" "L"
1096424-1097174 i2s: right: "Right channel: 00030000" "Right: 00030000" "R: 00030000" "R"
1097174-1097925 i2s: left: "Left channel: 07530000" "Left: 07530000" "L: 07530000" "L"
1097925-1098675 i2s: right: "Right channel: 00000000" "Right: 00000000" "R: 00000000" "R"
1098675-1099425 i2s: left: "Left channel: 087b0000" "Left: 087b0000" "L: 087b0000" "L"
1099425-1100175 i2s: right: "Right channel: 00010000" "Right: 00010000" "R: 00010000" "R"
1100175-1100926 i2s: left: "Left channel: 09a10000" "Left: 09a10000" "L: 09a10000" "L"
1100926-1101676 i2s: right: "Right channel: ffff0000" "Right: ffff0000" "R: ffff0000" "R"
1101676-1102426 i2s: left: "Left channel: 0afd0000" "Left: 0afd0000" "L: 0afd0000" "L"
1102426-1103176 i2s: right: "Right channel: 00010000" "Right: 00010000" "R: 00010000" "R"
1103176-1103927 i2s: left: "Left channel: 0c020000" "Left: 0c020000" "L: 0c020000" "L"
1103927-1104677 i2s: right: "Right channel: 00010000" "Right: 00010000" "R: 00010000" "R"
1104677-1105427 i2s: left: "Left channel: 0c7f0000" "Left: 0c7f0000" "L: 0c7f0000" "L"
1105427-1106177 i2s: right: "Right channel: 00010000" "Right: 00010000" "R: 00010000" "R"
1106177-1106928 i2s: left: "Left channel: 0cb00000" "Left: 0cb00000" "L: 0cb00000" "L"
1106928-1107678 i2s: right: "Right channel: 00000000" "Right: 00000000" "R: 00000000" "R"
1107678-1108428 i2s: left: "Left channel: 0c9e0000" "Left: 0c9e0000" "L: 0c9e0000" "L"
1108428-1109178 i2s: right: "Right channel: 00000000" "Right: 00000000" "R: 00000000" "R"
1109178-1109929 i2s: left: "Left channel: 0c100000" "Left: 0c100000" "L: 0c100000" "L"
1109929-1110679 i2s: right: "Right channel: ffff0000" "Right: ffff0000" "R: ffff0000" "R"
1110679-1111429 i2s: left: "Left channel: 0b280000" "Left: 0b280000" "L: 0b280000" "L"
1111429-1112179 i2s: right: "Right channel: 00000000" "Right: 00000000" "R: 00000000" "R"
1112179-1112930 i2s: left: "Left channel: 0a110000" "Left: 0a110000" "L: 0a110000" "L"
1112930-1113680 i2s: right: "Right channel: fffd0000" "Right: fffd0000" "R: fffd0000" "R"
1113680-1114430 i2s: left: "Left channel: 08c60000" "Left: 08c60000" "L: 08c60000" "L"
1114430-1115180 i2s: right: "Right channel: 00000000" "Right: 00000000" "R: 00000000" "R"
1115180-1115931 i2s: left: "Left channel: 07870000" "Left: 07870000" "L: 07870000" "L"
1115931-1116681 i2s: right: "Right channel: fffc0000" "Right: fffc0000" "R: fffc0000" "R"
1116681-1117431 i2s: left: "Left channel: 06160000" "Left: 06160000" "L: 06160000" "L"
1117431-1118181 i2s: right: "Right channel: fffc0000" "Right: fffc0000" "R: fffc0000" "R"
1118181-1118932 i2s: left: "Left channel: 04a90000" "Left: 04a90000" "L: 04a90000" "L"
1118932-1119682 i2s: right: "Right channel: ffff0000" "Right: ffff0000" "R: ffff0000" "R"
1119682-1120432 i2s: left: "Left channel: 037f0000" "Left: 037f0000" "L: 037f0000" "L"
1120432-1121182 i2s: right: "Right channel: fffe0000" "Right: fffe0000" "R: fffe0000" "R"
1121182-1121933 i2s: left: "Left channel: 02880000" "Left: 02880000" "L: 02880000" "L"
1121933-1122683 i2s: right: "Right channel: fffe0000" "Right: fffe0000" "R: fffe0000" "R"
1122683-1123433 i2s: left: "Left channel: 01a20000" "Left: 01a20000" "L: 01a20000" "L"
1123433-1124183 i2s: right: "Right channel: fffe0000" "Right: fffe0000" "R: fffe0000" "R"
1124183-1124934 i2s: left: "Left channel: 01090000" "Left: 01090000" "L: 01090000" "L"
1124934-1125684 i2s: right: "Right channel: fffe0000" "Right: fffe0000" "R: fffe0000" "R"
1125684-1126434 i2s: left: "Left channel: 00740000" "Left: 00740000" "L: 00740000" "L"
1126434-1127184 i2s: right: "Right channel: fffe0000" "Right: fffe0000" "R: fffe0000" "R"
1127184-1127935 i2s: left: "Left channel: ffc40000" "Left: ffc40000" "L: ffc40000" "L"
1127935-1128685 i2s: right: "Right channel: ffff0000" "Right: ffff0000" "R: ffff0000" "R"
1128685-1129435 i2s: left: "Left channel: fed50000" "Left: fed50000" "L: fed50000" "L"
1129435-1130185 i2s: right: "Right channel: fffd0000" "Right: fffd0000" "R: fffd0000" "R"
1130185-1130936 i2s: left: "Left channel: fe2b0000" "Left: fe2b0000" "L: fe2b0000" "L"
1130936-1131686 i2s: right: "Right channel: 00010000" "Right: 00010000" "R: 00010000" "R"
1131686-1132436 i2s: left: "Left channel: fdae0000" "Left: fdae0000" "L: fdae0000" "L"
1132436-1133187 i2s: right: "Right channel: ffff0000" "Right: ffff0000" "R: ffff0000" "R"
1133187-1133937 i2s: left: "Left channel: fd190000" "Left: fd190000" "L: fd190000" "L"
1133937-1134687 i2s: right: "Right channel: ffff0000" "Right: ffff0000" "R: ffff0000" "R"
1134687-1135437 i2s: left: "Left channel: fc7c0000" "Left: fc7c0000" "L: fc7c0000" "L"
1135437-1136188 i2s: right: "Right channel: 00000000" "Right: 00000000" "R: 00000000" "R"
1136188-1136938 i2s: left: "Left channel: fb6b0000" "Left: fb6b0000" "L: fb6b0000" "L"
1136938-1137688 i2s: right: "Right channel: 00010000" "Right: 00010000" "R: 00010000" "R"
1137688-1138438 i2s: left: "Left channel: fa970000" "Left: fa970000" "L: fa970000" "L"
1138438-1139189 i2s: right: "Right channel: fffe0000" "Right: fffe0000" "R: fffe0000" "R"
1139189-1139939 i2s: left: "Left channel: f9f50000" "Left: f9f50000" "L: f9f50000" "L"
1139939-1140689 i2s: right: "Right channel: fffe0000" "Right: fffe0000" "R: fffe0000" "R"
1140689-1141439 i2s: left: "Left channel: f93b0000" "Left: f93b0000" "L: f93b0000" "L"
1141439-1142190 i2s: right: "Right channel: 00000000" "Right: 00000000" "R: 00000000" "R"
1142190-1142940 i2s: left: "Left channel: f9150000" "Left: f9150000" "L: f9150000" "L"
1142940-1143690 i2s: right: "Right channel: 00010000" "Right: 00010000" "R: 00010000" "R"
1143690-1144440 i2s: left: "Left channel: f8c60000" "Left: f8c60000" "L: f8c60000" "L"
1144440-1145191 i2s: right: "Right channel: fffe0000" "Right: fffe0000" "R: fffe0000" "R"
1145191-1145941 i2s: left: "Left channel: f8a70000" "Left: f8a70000" "L: f8a70000" "L"
1145941-1146691 i2s: right: "Right channel: 00010000" "Right: 00010000" "R: 00010000" "R"
1146691-1147441 i2s: left: "Left channel: f92f0000" "Left: f92f0000" "L: f92f0000" "L"
1147441-1148192 i2s: right: "Right channel: 00010000" "Right: 00010000" "R: 00010000" "R"
1148192-1148942 i2s: left: "Left channel: f9c40000" "Left: f9c40000" "L: f9c40000" "L"
1148942-1149692 i2s: right: "Right channel: 00010000" "Right: 00010000" "R: 00010000" "R"
1149692-1150442 i2s: left: "Left channel: fa710000" "Left: fa710000" "L: fa710000" "L"
1150442-1151193 i2s: right: "Right channel: 00040000" "Right: 00040000" "R: 00040000" "R"
1151193-1151943 i2s: left: "Left channel: fac20000" "Left: fac20000" "L: fac20000" "L"
1151943-1152693 i2s: right: "Right channel: 00010000" "Right: 00010000" "R: 00010000" "R"
1152693-1153443 i2s: left: "Left channel: fb720000" "Left: fb720000" "L: fb720000" "L"
1153443-1154194 i2s: right: "Right channel: 00030000" "Right: 00030000" "R: 00030000" "R"
1154194-1154944 i2s: left: "Left channel: fbb30000" "Left: fbb30000" "L: fbb30000" "L"
1154944-1155694 i2s: right: "Right channel: 00030000" "Right: 00030000" "R: 00030000" "R"
1155694-1156444 i2s: left: "Left channel: fc360000" "Left: fc360000" "L: fc360000" "L"
1156444-1157195 i2s: right: "Right channel: 00030000" "Right: 00030000" "R: 00030000" "R"
1157195-1157945 i2s: left: "Left channel: fcd20000" "Left: fcd20000" "L: fcd20000" "L"
1157945-1158695 i2s: right: "Right channel: 00020000" "Right: 00020000" "R: 00020000" "R"
1158695-1159445 i2s: left: "Left channel: fc7c0000" "Left: fc7c0000" "L: fc7c0000" "L"
1159445-1160196 i2s: right: "Right channel: ffff0000" "Right: ffff0000" "R: ffff0000" "R"
1160196-1160946 i2s: left: "Left channel: fcc00000" "Left: fcc00000" "L: fcc00000" "L"
1160946-1161696 i2s: right: "Right channel: 00000000" "Right: 00000000" "R: 00000000" "R"
1161696-1162446 i2s: left: "Left channel: fca30000" "Left: fca30000" "L: fca30000" "L"
1162446-1163197 i2s: right: "Right channel: 00010000" "Right: 00010000" "R: 00010000" "R"
1163197-1163947 i2s: left: "Left channel: fcc00000" "Left: fcc00000" "L: fcc00000" "L"
1163947-1164697 i2s: right: "Right channel: 00000000" "Right: 00000000" "R: 00000000" "R"
1164697-1165447 i2s: left: "Left channel: fce50000" "Left: fce50000" "L: fce50000" "L"
1165447-1166198 i2s: right: "Right channel: ffff0000" "Right: ffff0000" "R: ffff0000" "R"
1166198-1166948 i2s: left: "Left channel: fcd20000" "Left: fcd20000" "L: fcd20000" "L"
1166948-1167698 i2s: right: "Right channel: 00000000" "Right: 00000000" "R: 00000000" "R"
1167698-1168448 i2s: left: "Left channel: fd420000" "Left: fd420000" "L: fd420000" "L"
1168448-1169199 i2s: right: "Right channel: 00000000" "Right: 00000000" "R: 00000000" "R"
1169199-1169949 i2s: left: "Left channel: fd010000" "Left: fd010000" "L: fd010000" "L"
1169949-1170699 i2s: right: "Right channel: 00020000" "Right: 00020000" "R: 00020000" "R"
1170699-1171449 i2s: left: "Left channel: fd850000" "Left: fd850000" "L: fd850000" "L"
1171449-1172200 i2s: right: "Right channel: 00010000" "Right: 00010000" "R: 00010000" "R"
1172200-1172950 i2s: left: "Left channel: fd540000" "Left: fd540000" "L: fd540000" "L"
1172950-1173700 i2s: right: "Right channel: 00000000" "Right: 00000000" "R: 00000000" "R"
1173700-1174450 i2s: left: "Left channel: fd210000" "Left: fd210000" "L: fd210000" "L"
1174450-1175201 i2s: right: "Right channel: 00000000" "Right: 00000000" "R: 00000000" "R"
1175201-1175951 i2s: left: "Left channel: fd0c0000" "Left: fd0c0000" "L: fd0c0000" "L"
1175951-1176701 i2s: right: "Right channel: 00020000" "Right: 00020000" "R: 00020000" "R"
1176701-1177451 i2s: left: "Left channel: fcad0000" "Left: fcad0000" "L: fcad0000" "L"
1177451-1178202 i2s: right: "Right channel: ffff0000" "Right: ffff0000" "R: ffff0000" "R"
1178202-1178952 i2s: left: "Left channel: fcfe0000" "Left: fcfe0000" "L: fcfe0000" "L"
1178952-1179702 i2s: right: "Right channel: 00010000" "Right: 00010000" "R: 00010000" "R"
1179702-1180452 i2s: left: "Left channel: fced0000" "Left: fced0000" "L: fced0000" "L"
1180452-1181203 i2s: right: "Right channel: 00000000" "Right: 00000000" "R: 00000000" "R"
1181203-1181953 i2s: left: "Left channel: fcdc0000" "Left: fcdc0000" "L: fcdc0000" "L"
1181953-1182703 i2s: right: "Right channel: 00000000" "Right: 00000000" "R: 00000000" "R"
1182703-1183453 i2s: left: "Left channel: fc5d0000" "Left: fc5d0000" "L: fc5d0000" "L"
1183453-1184204 i2s: right: "Right channel: ffff0000" "Right: ffff0000" "R: ffff0000" "R"
1184204-1184954 i2s: left: "Left channel: fc180000" "Left: fc180000" "L: fc180000" "L"
1184954-1185704 i2s: right: "Right channel: ffff0000" "Right: ffff0000" "R: ffff0000" "R"
1185704-1186454 i2s: left: "Left channel: fc260000" "Left: fc260000" "L: fc260000" "L"
1186454-1187205 i2s: right: "Right channel: ffff0000" "Right: ffff0000" "R: ffff0000" "R"
1187205-1187955 i2s: left: "Left channel: fc060000" "Left: fc060000" "L: fc060000" "L"
1187955-1188705 i2s: right: "Right channel: 00000000" "Right: 00000000" "R: 00000000" "R"
1188705-1189455 i2s: left: "Left channel: fc1a0000" "Left: fc1a0000" "L: fc1a0000" "L"
1189455-1190206 i2s: right: "Right channel: fffe0000" "Right: fffe0000" "R: fffe0000" "R"
1190206-1190956 i2s: left: "Left channel: fbbc0000" "Left: fbbc0000" "L: fbbc0000" "L"
1190956-1191706 i2s: right: "Right channel: 00000000" "Right: 00000000" "R: 00000000" "R"
1191706-1192456 i2s: left: "Left channel: fb090000" "Left: fb090000" "L: fb090000" "L"
1192456-1193207 i2s: right: "Right channel: ffff0000" "Right: ffff0000" "R: ffff0000" "R"
1193207-1193957 i2s: left: "Left channel: fb960000" "Left: fb960000" "L: fb960000" "L"
1193957-1194707 i2s: right: "Right channel: 00010000" "Right: 00010000" "R: 00010000" "R"
1194707-1195457 i2s: left: "Left channel: fbbd0000" "Left: fbbd0000" "L: fbbd0000" "L"
1195457-1196208 i2s: right: "Right channel: 00000000" "Right: 00000000" "R: 00000000" "R"
1196208-1196958 i2s: left: "Left channel: fbf60000" "Left: fbf60000" "L: fbf60000" "L"
1196958-1197708 i2s: right: "Right channel: 00000000" "Right: 00000000" "R: 00000000" "R"
1197708-1198458 i2s: left: "Left channel: fb670000" "Left: fb670000" "L: fb670000" "L"
1198458-1199209 i2s: right: "Right channel: 00000000" "Right: 00000000" "R: 00000000" "R"
1199209-1199959 i2s: left: "Left channel: fb2f0000" "Left: fb2f0000" "L: fb2f0000" "L"
1199959-1200709 i2s: right: "Right channel: ffff0000" "Right: ffff0000" "R: ffff0000" "R"
1200709-1201459 i2s: left: "Left channel: fb560000" "Left: fb560000" "L: fb560000" "L"
1201459-1202210 i2s: right: "Right channel: 00010000" "Right: 00010000" "R: 00010000" "R"
1202210-1202960 i2s: left: "Left channel: fc160000" "Left: fc160000" "L: fc160000" "L"
