45-295 i2s: left: "Left channel: 0x00fffe25" "Left: 00fffe25" "L: 00fffe25" "L"
295-545 i2s: right: "Right channel: 0x00db2231" "Right: 00db2231" "R: 00db2231" "R"
545-796 i2s: left: "Left channel: 0x00ffff6d" "Left: 00ffff6d" "L: 00ffff6d" "L"
796-1046 i2s: right: "Right channel: 0x00d2a228" "Right: 00d2a228" "R: 00d2a228" "R"
1046-1296 i2s: left: "Left channel: 0x00fffee5" "Left: 00fffee5" "L: 00fffee5" "L"
1296-1546 i2s: right: "Right channel: 0x00cbd323" "Right: 00cbd323" "R: 00cbd323" "R"
1546-1796 i2s: left: "Left channel: 0x00fffe7d" "Left: 00fffe7d" "L: 00fffe7d" "L"
1796-2046 i2s: right: "Right channel: 0x00c5b914" "Right: 00c5b914" "R: 00c5b914" "R"
2046-2296 i2s: left: "Left channel: 0x00fffc3d" "Left: 00fffc3d" "L: 00fffc3d" "L"
2296-2546 i2s: right: "Right channel: 0x00c139c7" "Right: 00c139c7" "R: 00c139c7" "R"
2546-2796 i2s: left: "Left channel: 0x00000105" "Left: 00000105" "L: 00000105" "L"
2796-3046 i2s: right: "Right channel: 0x00bfdc85" "Right: 00bfdc85" "R: 00bfdc85" "R"
3046-3296 i2s: left: "Left channel: 0x0000002d" "Left: 0000002d" "L: 0000002d" "L"
3296-3546 i2s: right: "Right channel: 0x00c3427e" "Right: 00c3427e" "R: 00c3427e" "R"
3546-3796 i2s: left: "Left channel: 0x0000014d" "Left: 0000014d" "L: 0000014d" "L"
3796-4046 i2s: right: "Right channel: 0x00c88bec" "Right: 00c88bec" "R: 00c88bec" "R"
4046-4296 i2s: left: "Left channel: 0x0000026d" "Left: 0000026d" "L: 0000026d" "L"
4296-4546 i2s: right: "Right channel: 0x00cfe8a7" "Right: 00cfe8a7" "R: 00cfe8a7" "R"
4546-4796 i2s: left: "Left channel: 0x00000605" "Left: 00000605" "L: 00000605" "L"
4796-5046 i2s: right: "Right channel: 0x00d8d4c0" "Right: 00d8d4c0" "R: 00d8d4c0" "R"
5046-5296 i2s: left: "Left channel: 0x00ffffc5" "Left: 00ffffc5" "L: 00ffffc5" "L"
5296-5546 i2s: right: "Right channel: 0x00e1ab5a" "Right: 00e1ab5a" "R: 00e1ab5a" "R"
5546-5796 i2s: left: "Left channel: 0x00000165" "Left: 00000165" "L: 00000165" "L"
5796-6046 i2s: right: "Right channel: 0x00eb66f4" "Right: 00eb66f4" "R: 00eb66f4" "R"
6046-6296 i2s: left: "Left channel: 0x00000224" "Left: 00000224" "L: 00000224" "L"
6296-6546 i2s: right: "Right channel: 0x00f515e9" "Right: 00f515e9" "R: 00f515e9" "R"
6546-6796 i2s: left: "Left channel: 0x00000364" "Left: 00000364" "L: 00000364" "L"
6796-7046 i2s: right: "Right channel: 0x00ff0d20" "Right: 00ff0d20" "R: 00ff0d20" "R"
7046-7296 i2s: left: "Left channel: 0x0000032c" "Left: 0000032c" "L: 0000032c" "L"
7296-7546 i2s: right: "Right channel: 0x0008f920" "Right: 0008f920" "R: 0008f920" "R"
7546-7796 i2s: left: "Left channel: 0x0000049c" "Left: 0000049c" "L: 0000049c" "L"
7796-8046 i2s: right: "Right channel: 0x0012d9a8" "Right: 0012d9a8" "R: 0012d9a8" "R"
8046-8296 i2s: left: "Left channel: 0x00000274" "Left: 00000274" "L: 00000274" "L"
8296-8546 i2s: right: "Right channel: 0x001c55c9" "Right: 001c55c9" "R: 001c55c9" "R"
8546-8796 i2s: left: "Left channel: 0x000002a4" "Left: 000002a4" "L: 000002a4" "L"
8796-9046 i2s: right: "Right channel: 0x002543d7" "Right: 002543d7" "R: 002543d7" "R"
9046-9296 i2s: left: "Left channel: 0x000004ac" "Left: 000004ac" "L: 000004ac" "L"
9296-9546 i2s: right: "Right channel: 0x002d7405" "Right: 002d7405" "R: 002d7405" "R"
9546-9796 i2s: left: "Left channel: 0x000000ec" "Left: 000000ec" "L: 000000ec" "L"
9796-10046 i2s: right: "Right channel: 0x0034b5d9" "Right: 0034b5d9" "R: 0034b5d9" "R"
10046-10296 i2s: left: "Left channel: 0x0000003c" "Left: 0000003c" "L: 0000003c" "L"
10296-10546 i2s: right: "Right channel: 0x003a8493" "Right: 003a8493" "R: 003a8493" "R"
10546-10796 i2s: left: "Left channel: 0x00fffcc4" "Left: 00fffcc4" "L: 00fffcc4" "L"
10796-11046 i2s: right: "Right channel: 0x003e954f" "Right: 003e954f" "R: 003e954f" "R"
11046-11296 i2s: left: "Left channel: 0x00ffff54" "Left: 00ffff54" "L: 00ffff54" "L"
11296-11546 i2s: right: "Right channel: 0x003f7e62" "Right: 003f7e62" "R: 003f7e62" "R"
11546-11796 i2s: left: "Left channel: 0x00fffd84" "Left: 00fffd84" "L: 00fffd84" "L"
11796-12046 i2s: right: "Right channel: 0x003b748e" "Right: 003b748e" "R: 003b748e" "R"
12046-12296 i2s: left: "Left channel: 0x00fffe04" "Left: 00fffe04" "L: 00fffe04" "L"
12296-12546 i2s: right: "Right channel: 0x0035700b" "Right: 0035700b" "R: 0035700b" "R"
12546-12796 i2s: left: "Left channel: 0x00fffe8c" "Left: 00fffe8c" "L: 00fffe8c" "L"
12796-13047 i2s: right: "Right channel: 0x002de81f" "Right: 002de81f" "R: 002de81f" "R"
13047-13297 i2s: left: "Left channel: 0x00fffcc4" "Left: 00fffcc4" "L: 00fffcc4" "L"
13297-13547 i2s: right: "Right channel: 0x00257018" "Right: 00257018" "R: 00257018" "R"
13547-13797 i2s: left: "Left channel: 0x00fffe3c" "Left: 00fffe3c" "L: 00fffe3c" "L"
13797-14047 i2s: right: "Right channel: 0x001c4abc" "Right: 001c4abc" "R: 001c4abc" "R"
14047-14297 i2s: left: "Left channel: 0x00fffc5c" "Left: 00fffc5c" "L: 00fffc5c" "L"
14297-14547 i2s: right: "Right channel: 0x0012c102" "Right: 0012c102" "R: 0012c102" "R"
14547-14797 i2s: left: "Left channel: 0x00fffddc" "Left: 00fffddc" "L: 00fffddc" "L"
14797-15047 i2s: right: "Right channel: 0x0008e8c4" "Right: 0008e8c4" "R: 0008e8c4" "R"
15047-15297 i2s: left: "Left channel: 0x00fffb6c" "Left: 00fffb6c" "L: 00fffb6c" "L"
15297-15547 i2s: right: "Right channel: 0x00feef9d" "Right: 00feef9d" "R: 00feef9d" "R"
15547-15797 i2s: left: "Left channel: 0x00fffeb5" "Left: 00fffeb5" "L: 00fffeb5" "L"
15797-16047 i2s: right: "Right channel: 0x00f4e2dd" "Right: 00f4e2dd" "R: 00f4e2dd" "R"
16047-16297 i2s: left: "Left channel: 0x00fffb55" "Left: 00fffb55" "L: 00fffb55" "L"
16297-16547 i2s: right: "Right channel: 0x00eb15de" "Right: 00eb15de" "R: 00eb15de" "R"
16547-16797 i2s: left: "Left channel: 0x00fffe3d" "Left: 00fffe3d" "L: 00fffe3d" "L"
16797-17047 i2s: right: "Right channel: 0x00e19d7e" "Right: 00e19d7e" "R: 00e19d7e" "R"
17047-17297 i2s: left: "Left channel: 0x00fff9dd" "Left: 00fff9dd" "L: 00fff9dd" "L"
17297-17547 i2s: right: "Right channel: 0x00d8bee1" "Right: 00d8bee1" "R: 00d8bee1" "R"
17547-17797 i2s: left: "Left channel: 0x00fffe5d" "Left: 00fffe5d" "L: 00fffe5d" "L"
17797-18047 i2s: right: "Right channel: 0x00d09ccb" "Right: 00d09ccb" "R: 00d09ccb" "R"
18047-18297 i2s: left: "Left channel: 0x00fffad5" "Left: 00fffad5" "L: 00fffad5" "L"
18297-18547 i2s: right: "Right channel: 0x00ca04be" "Right: 00ca04be" "R: 00ca04be" "R"
18547-18797 i2s: left: "Left channel: 0x00fffec5" "Left: 00fffec5" "L: 00fffec5" "L"
18797-19047 i2s: right: "Right channel: 0x00c42fa6" "Right: 00c42fa6" "R: 00c42fa6" "R"
19047-19297 i2s: left: "Left channel: 0x00ffff05" "Left: 00ffff05" "L: 00ffff05" "L"
19297-19547 i2s: right: "Right channel: 0x00c05c6c" "Right: 00c05c6c" "R: 00c05c6c" "R"
19547-19797 i2s: left: "Left channel: 0x0000006d" "Left: 0000006d" "L: 0000006d" "L"
19797-20047 i2s: right: "Right channel: 0x00c05a29" "Right: 00c05a29" "R: 00c05a29" "R"
20047-20297 i2s: left: "Left channel: 0x000000ed" "Left: 000000ed" "L: 000000ed" "L"
20297-20547 i2s: right: "Right channel: 0x00c49e37" "Right: 00c49e37" "R: 00c49e37" "R"
20547-20797 i2s: left: "Left channel: 0x00fffebd" "Left: 00fffebd" "L: 00fffebd" "L"
20797-21047 i2s: right: "Right channel: 0x00ca26fa" "Right: 00ca26fa" "R: 00ca26fa" "R"
21047-21297 i2s: left: "Left channel: 0x000002f5" "Left: 000002f5" "L: 000002f5" "L"
21297-21547 i2s: right: "Right channel: 0x00d257a0" "Right: 00d257a0" "R: 00d257a0" "R"
21547-21797 i2s: left: "Left channel: 0x00fffff5" "Left: 00fffff5" "L: 00fffff5" "L"
21797-22047 i2s: right: "Right channel: 0x00dafe06" "Right: 00dafe06" "R: 00dafe06" "R"
22047-22297 i2s: left: "Left channel: 0x0000076d" "Left: 0000076d" "L: 0000076d" "L"
22297-22547 i2s: right: "Right channel: 0x00e434e6" "Right: 00e434e6" "R: 00e434e6" "R"
22547-22797 i2s: left: "Left channel: 0x000001d5" "Left: 000001d5" "L: 000001d5" "L"
22797-23047 i2s: right: "Right channel: 0x00edd264" "Right: 00edd264" "R: 00edd264" "R"
23047-23297 i2s: left: "Left channel: 0x0000036d" "Left: 0000036d" "L: 0000036d" "L"
23297-23547 i2s: right: "Right channel: 0x00f7a91e" "Right: 00f7a91e" "R: 00f7a91e" "R"
23547-23797 i2s: left: "Left channel: 0x00000175" "Left: 00000175" "L: 00000175" "L"
23797-24047 i2s: right: "Right channel: 0x0001ab18" "Right: 0001ab18" "R: 0001ab18" "R"
24047-24297 i2s: left: "Left channel: 0x00000125" "Left: 00000125" "L: 00000125" "L"
24297-24547 i2s: right: "Right channel: 0x000ba3db" "Right: 000ba3db" "R: 000ba3db" "R"
24547-24797 i2s: left: "Left channel: 0x00000675" "Left: 00000675" "L: 00000675" "L"
24797-25048 i2s: right: "Right channel: 0x001561ae" "Right: 001561ae" "R: 001561ae" "R"
25048-25298 i2s: left: "Left channel: 0x0000005d" "Left: 0000005d" "L: 0000005d" "L"
25298-25548 i2s: right: "Right channel: 0x001eae2b" "Right: 001eae2b" "R: 001eae2b" "R"
25548-25798 i2s: left: "Left channel: 0x000001c4" "Left: 000001c4" "L: 000001c4" "L"
25798-26048 i2s: right: "Right channel: 0x00277775" "Right: 00277775" "R: 00277775" "R"
26048-26298 i2s: left: "Left channel: 0x000000dc" "Left: 000000dc" "L: 000000dc" "L"
26298-26548 i2s: right: "Right channel: 0x002f514a" "Right: 002f514a" "R: 002f514a" "R"
26548-26798 i2s: left: "Left channel: 0x00fffd94" "Left: 00fffd94" "L: 00fffd94" "L"
26798-27048 i2s: right: "Right channel: 0x003646af" "Right: 003646af" "R: 003646af" "R"
27048-27298 i2s: left: "Left channel: 0x000000ec" "Left: 000000ec" "L: 000000ec" "L"
27298-27548 i2s: right: "Right channel: 0x003b7b15" "Right: 003b7b15" "R: 003b7b15" "R"
27548-27798 i2s: left: "Left channel: 0x000000fc" "Left: 000000fc" "L: 000000fc" "L"
27798-28048 i2s: right: "Right channel: 0x003f1571" "Right: 003f1571" "R: 003f1571" "R"
28048-28298 i2s: left: "Left channel: 0x00fffc2c" "Left: 00fffc2c" "L: 00fffc2c" "L"
28298-28548 i2s: right: "Right channel: 0x003e81f8" "Right: 003e81f8" "R: 003e81f8" "R"
28548-28798 i2s: left: "Left channel: 0x00fffedd" "Left: 00fffedd" "L: 00fffedd" "L"
28798-29048 i2s: right: "Right channel: 0x0039a024" "Right: 0039a024" "R: 0039a024" "R"
29048-29298 i2s: left: "Left channel: 0x00fffd15" "Left: 00fffd15" "L: 00fffd15" "L"
29298-29548 i2s: right: "Right channel: 0x00333b1f" "Right: 00333b1f" "R: 00333b1f" "R"
29548-29798 i2s: left: "Left channel: 0x00ffff1d" "Left: 00ffff1d" "L: 00ffff1d" "L"
29798-30048 i2s: right: "Right channel: 0x002b3bb5" "Right: 002b3bb5" "R: 002b3bb5" "R"
30048-30298 i2s: left: "Left channel: 0x00fffdad" "Left: 00fffdad" "L: 00fffdad" "L"
30298-30548 i2s: right: "Right channel: 0x0022c893" "Right: 0022c893" "R: 0022c893" "R"
30548-30798 i2s: left: "Left channel: 0x00fffa05" "Left: 00fffa05" "L: 00fffa05" "L"
30798-31048 i2s: right: "Right channel: 0x00196fbd" "Right: 00196fbd" "R: 00196fbd" "R"
31048-31298 i2s: left: "Left channel: 0x00fffd8d" "Left: 00fffd8d" "L: 00fffd8d" "L"
31298-31548 i2s: right: "Right channel: 0x001004ba" "Right: 001004ba" "R: 001004ba" "R"
31548-31798 i2s: left: "Left channel: 0x00fffb0d" "Left: 00fffb0d" "L: 00fffb0d" "L"
31798-32048 i2s: right: "Right channel: 0x00060fe1" "Right: 00060fe1" "R: 00060fe1" "R"
32048-32298 i2s: left: "Left channel: 0x00fff9bd" "Left: 00fff9bd" "L: 00fff9bd" "L"
32298-32548 i2s: right: "Right channel: 0x00fc2021" "Right: 00fc2021" "R: 00fc2021" "R"
32548-32798 i2s: left: "Left channel: 0x00fffb3d" "Left: 00fffb3d" "L: 00fffb3d" "L"
32798-33048 i2s: right: "Right channel: 0x00f22e88" "Right: 00f22e88" "R: 00f22e88" "R"
33048-33298 i2s: left: "Left channel: 0x00fffc96" "Left: 00fffc96" "L: 00fffc96" "L"
33298-33548 i2s: right: "Right channel: 0x00e86abe" "Right: 00e86abe" "R: 00e86abe" "R"
33548-33798 i2s: left: "Left channel: 0x00fffe8e" "Left: 00fffe8e" "L: 00fffe8e" "L"
33798-34048 i2s: right: "Right channel: 0x00df24d3" "Right: 00df24d3" "R: 00df24d3" "R"
34048-34298 i2s: left: "Left channel: 0x00fffcae" "Left: 00fffcae" "L: 00fffcae" "L"
34298-34548 i2s: right: "Right channel: 0x00d669fa" "Right: 00d669fa" "R: 00d669fa" "R"
34548-34798 i2s: left: "Left channel: 0x00fffc5e" "Left: 00fffc5e" "L: 00fffc5e" "L"
34798-35048 i2s: right: "Right channel: 0x00cec017" "Right: 00cec017" "R: 00cec017" "R"
35048-35298 i2s: left: "Left channel: 0x00fffc46" "Left: 00fffc46" "L: 00fffc46" "L"
35298-35548 i2s: right: "Right channel: 0x00c86a29" "Right: 00c86a29" "R: 00c86a29" "R"
35548-35798 i2s: left: "Left channel: 0x00fffe9e" "Left: 00fffe9e" "L: 00fffe9e" "L"
35798-36048 i2s: right: "Right channel: 0x00c3031d" "Right: 00c3031d" "R: 00c3031d" "R"
36048-36299 i2s: left: "Left channel: 0x00fffe3e" "Left: 00fffe3e" "L: 00fffe3e" "L"
36299-36549 i2s: right: "Right channel: 0x00c0034d" "Right: 00c0034d" "R: 00c0034d" "R"
36549-36799 i2s: left: "Left channel: 0x00000376" "Left: 00000376" "L: 00000376" "L"
36799-37049 i2s: right: "Right channel: 0x00c18885" "Right: 00c18885" "R: 00c18885" "R"
37049-37299 i2s: left: "Left channel: 0x00000066" "Left: 00000066" "L: 00000066" "L"
37299-37549 i2s: right: "Right channel: 0x00c64651" "Right: 00c64651" "R: 00c64651" "R"
37549-37799 i2s: left: "Left channel: 0x00000126" "Left: 00000126" "L: 00000126" "L"
37799-38049 i2s: right: "Right channel: 0x00cc803f" "Right: 00cc803f" "R: 00cc803f" "R"
38049-38299 i2s: left: "Left channel: 0x00ffffb6" "Left: 00ffffb6" "L: 00ffffb6" "L"
38299-38549 i2s: right: "Right channel: 0x00d51873" "Right: 00d51873" "R: 00d51873" "R"
38549-38799 i2s: left: "Left channel: 0x000005be" "Left: 000005be" "L: 000005be" "L"
38799-39049 i2s: right: "Right channel: 0x00ddad72" "Right: 00ddad72" "R: 00ddad72" "R"
39049-39299 i2s: left: "Left channel: 0x0000050e" "Left: 0000050e" "L: 0000050e" "L"
39299-39549 i2s: right: "Right channel: 0x00e71c8d" "Right: 00e71c8d" "R: 00e71c8d" "R"
39549-39799 i2s: left: "Left channel: 0x000002c6" "Left: 000002c6" "L: 000002c6" "L"
39799-40049 i2s: right: "Right channel: 0x00f0c614" "Right: 00f0c614" "R: 00f0c614" "R"
40049-40299 i2s: left: "Left channel: 0x00000416" "Left: 00000416" "L: 00000416" "L"
40299-40549 i2s: right: "Right channel: 0x00fac136" "Right: 00fac136" "R: 00fac136" "R"
40549-40799 i2s: left: "Left channel: 0x000003fe" "Left: 000003fe" "L: 000003fe" "L"
40799-41049 i2s: right: "Right channel: 0x0004c038" "Right: 0004c038" "R: 0004c038" "R"
41049-41299 i2s: left: "Left channel: 0x000002dd" "Left: 000002dd" "L: 000002dd" "L"
41299-41549 i2s: right: "Right channel: 0x000eb322" "Right: 000eb322" "R: 000eb322" "R"
41549-41799 i2s: left: "Left channel: 0x00000235" "Left: 00000235" "L: 00000235" "L"
41799-42049 i2s: right: "Right channel: 0x001854dc" "Right: 001854dc" "R: 001854dc" "R"
42049-42299 i2s: left: "Left channel: 0x00ffff15" "Left: 00ffff15" "L: 00ffff15" "L"
42299-42549 i2s: right: "Right channel: 0x00218119" "Right: 00218119" "R: 00218119" "R"
42549-42799 i2s: left: "Left channel: 0x00fffda5" "Left: 00fffda5" "L: 00fffda5" "L"
42799-43049 i2s: right: "Right channel: 0x002a1275" "Right: 002a1275" "R: 002a1275" "R"
43049-43299 i2s: left: "Left channel: 0x0000018d" "Left: 0000018d" "L: 0000018d" "L"
43299-43549 i2s: right: "Right channel: 0x0031b4ed" "Right: 0031b4ed" "R: 0031b4ed" "R"
43549-43799 i2s: left: "Left channel: 0x00000195" "Left: 00000195" "L: 00000195" "L"
43799-44049 i2s: right: "Right channel: 0x00383a07" "Right: 00383a07" "R: 00383a07" "R"
44049-44299 i2s: left: "Left channel: 0x00ffffd5" "Left: 00ffffd5" "L: 00ffffd5" "L"
44299-44549 i2s: right: "Right channel: 0x003cf51d" "Right: 003cf51d" "R: 003cf51d" "R"
44549-44799 i2s: left: "Left channel: 0x00fffc1d" "Left: 00fffc1d" "L: 00fffc1d" "L"
44799-45049 i2s: right: "Right channel: 0x003f95b5" "Right: 003f95b5" "R: 003f95b5" "R"
45049-45299 i2s: left: "Left channel: 0x00fffecd" "Left: 00fffecd" "L: 00fffecd" "L"
45299-45549 i2s: right: "Right channel: 0x003d5e21" "Right: 003d5e21" "R: 003d5e21" "R"
45549-45799 i2s: left: "Left channel: 0x00ffff2d" "Left: 00ffff2d" "L: 00ffff2d" "L"
45799-46049 i2s: right: "Right channel: 0x0037eefe" "Right: 0037eefe" "R: 0037eefe" "R"
46049-46299 i2s: left: "Left channel: 0x00fffd1d" "Left: 00fffd1d" "L: 00fffd1d" "L"
46299-46549 i2s: right: "Right channel: 0x003107ce" "Right: 003107ce" "R: 003107ce" "R"
46549-46799 i2s: left: "Left channel: 0x00fffc36" "Left: 00fffc36" "L: 00fffc36" "L"
46799-47049 i2s: right: "Right channel: 0x0028e0de" "Right: 0028e0de" "R: 0028e0de" "R"
47049-47299 i2s: left: "Left channel: 0x00fffd4e" "Left: 00fffd4e" "L: 00fffd4e" "L"
47299-47549 i2s: right: "Right channel: 0x001ffef7" "Right: 001ffef7" "R: 001ffef7" "R"
47549-47799 i2s: left: "Left channel: 0x00fffcf6" "Left: 00fffcf6" "L: 00fffcf6" "L"
47799-48049 i2s: right: "Right channel: 0x001699d7" "Right: 001699d7" "R: 001699d7" "R"
48049-48299 i2s: left: "Left channel: 0x00fffa66" "Left: 00fffa66" "L: 00fffa66" "L"
48299-48550 i2s: right: "Right channel: 0x000cd70a" "Right: 000cd70a" "R: 000cd70a" "R"
48550-48800 i2s: left: "Left channel: 0x00fffb4e" "Left: 00fffb4e" "L: 00fffb4e" "L"
48800-49050 i2s: right: "Right channel: 0x0002f183" "Right: 0002f183" "R: 0002f183" "R"
49050-49300 i2s: left: "Left channel: 0x00fffc96" "Left: 00fffc96" "L: 00fffc96" "L"
49300-49550 i2s: right: "Right channel: 0x00f8ddf4" "Right: 00f8ddf4" "R: 00f8ddf4" "R"
49550-49800 i2s: left: "Left channel: 0x000000a6" "Left: 000000a6" "L: 000000a6" "L"
49800-50050 i2s: right: "Right channel: 0x00eef4ed" "Right: 00eef4ed" "R: 00eef4ed" "R"
50050-50300 i2s: left: "Left channel: 0x00fffb6e" "Left: 00fffb6e" "L: 00fffb6e" "L"
50300-50550 i2s: right: "Right channel: 0x00e53ff5" "Right: 00e53ff5" "R: 00e53ff5" "R"
50550-50800 i2s: left: "Left channel: 0x00fffc36" "Left: 00fffc36" "L: 00fffc36" "L"
50800-51050 i2s: right: "Right channel: 0x00dc2e53" "Right: 00dc2e53" "R: 00dc2e53" "R"
51050-51300 i2s: left: "Left channel: 0x00fffddf" "Left: 00fffddf" "L: 00fffddf" "L"
51300-51550 i2s: right: "Right channel: 0x00d39c32" "Right: 00d39c32" "R: 00d39c32" "R"
51550-51800 i2s: left: "Left channel: 0x00fffd9f" "Left: 00fffd9f" "L: 00fffd9f" "L"
51800-52050 i2s: right: "Right channel: 0x00cc8455" "Right: 00cc8455" "R: 00cc8455" "R"
52050-52300 i2s: left: "Left channel: 0x00fffbff" "Left: 00fffbff" "L: 00fffbff" "L"
