295-1045 i2s: right: "Right channel: f6780000" "Right: f6780000" "R: f6780000" "R"
1045-1795 i2s: left: "Left channel: fffd0000" "Left: fffd0000" "L: fffd0000" "L"
1795-2546 i2s: right: "Right channel: f4b80000" "Right: f4b80000" "R: f4b80000" "R"
2546-3296 i2s: left: "Left channel: fffd0000" "Left: fffd0000" "L: fffd0000" "L"
3296-4046 i2s: right: "Right channel: f3ac0000" "Right: f3ac0000" "R: f3ac0000" "R"
4046-4796 i2s: left: "Left channel: fffe0000" "Left: fffe0000" "L: fffe0000" "L"
4796-5547 i2s: right: "Right channel: f3060000" "Right: f3060000" "R: f3060000" "R"
5547-6297 i2s: left: "Left channel: fffe0000" "Left: fffe0000" "L: fffe0000" "L"
6297-7047 i2s: right: "Right channel: f2010000" "Right: f2010000" "R: f2010000" "R"
7047-7797 i2s: left: "Left channel: fffe0000" "Left: fffe0000" "L: fffe0000" "L"
7797-8548 i2s: right: "Right channel: f1e30000" "Right: f1e30000" "R: f1e30000" "R"
8548-9298 i2s: left: "Left channel: fffe0000" "Left: fffe0000" "L: fffe0000" "L"
9298-10048 i2s: right: "Right channel: f2590000" "Right: f2590000" "R: f2590000" "R"
10048-10798 i2s: left: "Left channel: 00000000" "Left: 00000000" "L: 00000000" "L"
10798-11549 i2s: right: "Right channel: f35b0000" "Right: f35b0000" "R: f35b0000" "R"
11549-12299 i2s: left: "Left channel: 00000000" "Left: 00000000" "L: 00000000" "L"
12299-13049 i2s: right: "Right channel: f4db0000" "Right: f4db0000" "R: f4db0000" "R"
13049-13799 i2s: left: "Left channel: 00020000" "Left: 00020000" "L: 00020000" "L"
13799-14550 i2s: right: "Right channel: f65d0000" "Right: f65d0000" "R: f65d0000" "R"
14550-15300 i2s: left: "Left channel: 00010000" "Left: 00010000" "L: 00010000" "L"
15300-16050 i2s: right: "Right channel: f84d0000" "Right: f84d0000" "R: f84d0000" "R"
16050-16800 i2s: left: "Left channel: 00010000" "Left: 00010000" "L: 00010000" "L"
16800-17551 i2s: right: "Right channel: fa350000" "Right: fa350000" "R: fa350000" "R"
17551-18301 i2s: left: "Left channel: 00040000" "Left: 00040000" "L: 00040000" "L"
18301-19051 i2s: right: "Right channel: fc5f0000" "Right: fc5f0000" "R: fc5f0000" "R"
19051-19801 i2s: left: "Left channel: 00030000" "Left: 00030000" "L: 00030000" "L"
19801-20552 i2s: right: "Right channel: ff430000" "Right: ff430000" "R: ff430000" "R"
20552-21302 i2s: left: "Left channel: 00060000" "Left: 00060000" "L: 00060000" "L"
21302-22052 i2s: right: "Right channel: 01d50000" "Right: 01d50000" "R: 01d50000" "R"
22052-22802 i2s: left: "Left channel: 00020000" "Left: 00020000" "L: 00020000" "L"
22802-23553 i2s: right: "Right channel: 046e0000" "Right: 046e0000" "R: 046e0000" "R"
23553-24303 i2s: left: "Left channel: 00040000" "Left: 00040000" "L: 00040000" "L"
24303-25053 i2s: right: "Right channel: 06c30000" "Right: 06c30000" "R: 06c30000" "R"
25053-25803 i2s: left: "Left channel: 00050000" "Left: 00050000" "L: 00050000" "L"
25803-26554 i2s: right: "Right channel: 09300000" "Right: 09300000" "R: 09300000" "R"
26554-27304 i2s: left: "Left channel: 00040000" "Left: 00040000" "L: 00040000" "L"
27304-28054 i2s: right: "Right channel: 0ba00000" "Right: 0ba00000" "R: 0ba00000" "R"
28054-28804 i2s: left: "Left channel: 00040000" "Left: 00040000" "L: 00040000" "L"
28804-29555 i2s: right: "Right channel: 0d830000" "Right: 0d830000" "R: 0d830000" "R"
29555-30305 i2s: left: "Left channel: 00050000" "Left: 00050000" "L: 00050000" "L"
30305-31055 i2s: right: "Right channel: 0f960000" "Right: 0f960000" "R: 0f960000" "R"
31055-31805 i2s: left: "Left channel: 00040000" "Left: 00040000" "L: 00040000" "L"
31805-32556 i2s: right: "Right channel: 11940000" "Right: 11940000" "R: 11940000" "R"
32556-33306 i2s: left: "Left channel: 00030000" "Left: 00030000" "L: 00030000" "L"
33306-34056 i2s: right: "Right channel: 131f0000" "Right: 131f0000" "R: 131f0000" "R"
34056-34806 i2s: left: "Left channel: 00030000" "Left: 00030000" "L: 00030000" "L"
34806-35557 i2s: right: "Right channel: 14180000" "Right: 14180000" "R: 14180000" "R"
35557-36307 i2s: left: "Left channel: 00040000" "Left: 00040000" "L: 00040000" "L"
36307-37057 i2s: right: "Right channel: 14990000" "Right: 14990000" "R: 14990000" "R"
37057-37807 i2s: left: "Left channel: 00000000" "Left: 00000000" "L: 00000000" "L"
37807-38558 i2s: right: "Right channel: 15470000" "Right: 15470000" "R: 15470000" "R"
38558-39308 i2s: left: "Left channel: 00010000" "Left: 00010000" "L: 00010000" "L"
39308-40058 i2s: right: "Right channel: 15d50000" "Right: 15d50000" "R: 15d50000" "R"
40058-40808 i2s: left: "Left channel: 00000000" "Left: 00000000" "L: 00000000" "L"
40808-41559 i2s: right: "Right channel: 15c00000" "Right: 15c00000" "R: 15c00000" "R"
41559-42309 i2s: left: "Left channel: 00000000" "Left: 00000000" "L: 00000000" "L"
42309-43059 i2s: right: "Right channel: 156d0000" "Right: 156d0000" "R: 156d0000" "R"
43059-43809 i2s: left: "Left channel: 00010000" "Left: 00010000" "L: 00010000" "L"
43809-44560 i2s: right: "Right channel: 14890000" "Right: 14890000" "R: 14890000" "R"
44560-45310 i2s: left: "Left channel: ffff0000" "Left: ffff0000" "L: ffff0000" "L"
45310-46060 i2s: right: "Right channel: 13890000" "Right: 13890000" "R: 13890000" "R"
46060-46810 i2s: left: "Left channel: fffe0000" "Left: fffe0000" "L: fffe0000" "L"
46810-47561 i2s: right: "Right channel: 121f0000" "Right: 121f0000" "R: 121f0000" "R"
47561-48311 i2s: left: "Left channel: fffe0000" "Left: fffe0000" "L: fffe0000" "L"
48311-49061 i2s: right: "Right channel: 108d0000" "Right: 108d0000" "R: 108d0000" "R"
49061-49811 i2s: left: "Left channel: ffff0000" "Left: ffff0000" "L: ffff0000" "L"
49811-50562 i2s: right: "Right channel: 0ed30000" "Right: 0ed30000" "R: 0ed30000" "R"
50562-51312 i2s: left: "Left channel: fffa0000" "Left: fffa0000" "L: fffa0000" "L"
51312-52062 i2s: right: "Right channel: 0ca40000" "Right: 0ca40000" "R: 0ca40000" "R"
52062-52812 i2s: left: "Left channel: fffd0000" "Left: fffd0000" "L: fffd0000" "L"
52812-53563 i2s: right: "Right channel: 0a310000" "Right: 0a310000" "R: 0a310000" "R"
53563-54313 i2s: left: "Left channel: fffc0000" "Left: fffc0000" "L: fffc0000" "L"
54313-55063 i2s: right: "Right channel: 07950000" "Right: 07950000" "R: 07950000" "R"
55063-55813 i2s: left: "Left channel: fffe0000" "Left: fffe0000" "L: fffe0000" "L"
55813-56564 i2s: right: "Right channel: 04a60000" "Right: 04a60000" "R: 04a60000" "R"
56564-57314 i2s: left: "Left channel: fffc0000" "Left: fffc0000" "L: fffc0000" "L"
57314-58064 i2s: right: "Right channel: 01ca0000" "Right: 01ca0000" "R: 01ca0000" "R"
58064-58814 i2s: left: "Left channel: fffa0000" "Left: fffa0000" "L: fffa0000" "L"
58814-59565 i2s: right: "Right channel: fedf0000" "Right: fedf0000" "R: fedf0000" "R"
59565-60315 i2s: left: "Left channel: 00000000" "Left: 00000000" "L: 00000000" "L"
60315-61065 i2s: right: "Right channel: fc8c0000" "Right: fc8c0000" "R: fc8c0000" "R"
61065-61815 i2s: left: "Left channel: fffd0000" "Left: fffd0000" "L: fffd0000" "L"
61815-62566 i2s: right: "Right channel: fa2a0000" "Right: fa2a0000" "R: fa2a0000" "R"
62566-63316 i2s: left: "Left channel: fffd0000" "Left: fffd0000" "L: fffd0000" "L"
63316-64066 i2s: right: "Right channel: f7980000" "Right: f7980000" "R: f7980000" "R"
64066-64816 i2s: left: "Left channel: fffd0000" "Left: fffd0000" "L: fffd0000" "L"
64816-65567 i2s: right: "Right channel: f5470000" "Right: f5470000" "R: f5470000" "R"
65567-66317 i2s: left: "Left channel: ffff0000" "Left: ffff0000" "L: ffff0000" "L"
66317-67067 i2s: right: "Right channel: f3af0000" "Right: f3af0000" "R: f3af0000" "R"
67067-67817 i2s: left: "Left channel: fffd0000" "Left: fffd0000" "L: fffd0000" "L"
67817-68568 i2s: right: "Right channel: f2b00000" "Right: f2b00000" "R: f2b00000" "R"
68568-69318 i2s: left: "Left channel: ffff0000" "Left: ffff0000" "L: ffff0000" "L"
69318-70068 i2s: right: "Right channel: f2150000" "Right: f2150000" "R: f2150000" "R"
70068-70818 i2s: left: "Left channel: ffff0000" "Left: ffff0000" "L: ffff0000" "L"
70818-71569 i2s: right: "Right channel: f1a00000" "Right: f1a00000" "R: f1a00000" "R"
71569-72319 i2s: left: "Left channel: ffff0000" "Left: ffff0000" "L: ffff0000" "L"
72319-73069 i2s: right: "Right channel: f1ac0000" "Right: f1ac0000" "R: f1ac0000" "R"
73069-73819 i2s: left: "Left channel: 00000000" "Left: 00000000" "L: 00000000" "L"
73819-74570 i2s: right: "Right channel: f2220000" "Right: f2220000" "R: f2220000" "R"
74570-75320 i2s: left: "Left channel: ffff0000" "Left: ffff0000" "L: ffff0000" "L"
75320-76070 i2s: right: "Right channel: f2ff0000" "Right: f2ff0000" "R: f2ff0000" "R"
76070-76821 i2s: left: "Left channel: 00010000" "Left: 00010000" "L: 00010000" "L"
76821-77571 i2s: right: "Right channel: f4200000" "Right: f4200000" "R: f4200000" "R"
77571-78321 i2s: left: "Left channel: 00030000" "Left: 00030000" "L: 00030000" "L"
78321-79071 i2s: right: "Right channel: f5950000" "Right: f5950000" "R: f5950000" "R"
79071-79822 i2s: left: "Left channel: 00020000" "Left: 00020000" "L: 00020000" "L"
79822-80572 i2s: right: "Right channel: f7640000" "Right: f7640000" "R: f7640000" "R"
80572-81322 i2s: left: "Left channel: 00040000" "Left: 00040000" "L: 00040000" "L"
81322-82072 i2s: right: "Right channel: f93b0000" "Right: f93b0000" "R: f93b0000" "R"
82072-82823 i2s: left: "Left channel: 00010000" "Left: 00010000" "L: 00010000" "L"
82823-83573 i2s: right: "Right channel: fafb0000" "Right: fafb0000" "R: fafb0000" "R"
83573-84323 i2s: left: "Left channel: 00010000" "Left: 00010000" "L: 00010000" "L"
84323-85073 i2s: right: "Right channel: fc8a0000" "Right: fc8a0000" "R: fc8a0000" "R"
85073-85824 i2s: left: "Left channel: 00030000" "Left: 00030000" "L: 00030000" "L"
85824-86574 i2s: right: "Right channel: fe0f0000" "Right: fe0f0000" "R: fe0f0000" "R"
86574-87324 i2s: left: "Left channel: 00040000" "Left: 00040000" "L: 00040000" "L"
87324-88074 i2s: right: "Right channel: ffab0000" "Right: ffab0000" "R: ffab0000" "R"
88074-88825 i2s: left: "Left channel: 00030000" "Left: 00030000" "L: 00030000" "L"
88825-89575 i2s: right: "Right channel: 01280000" "Right: 01280000" "R: 01280000" "R"
89575-90325 i2s: left: "Left channel: 00030000" "Left: 00030000" "L: 00030000" "L"
90325-91075 i2s: right: "Right channel: 023a0000" "Right: 023a0000" "R: 023a0000" "R"
91075-91826 i2s: left: "Left channel: 00020000" "Left: 00020000" "L: 00020000" "L"
91826-92576 i2s: right: "Right channel: 02d40000" "Right: 02d40000" "R: 02d40000" "R"
92576-93326 i2s: left: "Left channel: 00010000" "Left: 00010000" "L: 00010000" "L"
93326-94076 i2s: right: "Right channel: 03250000" "Right: 03250000" "R: 03250000" "R"
94076-94827 i2s: left: "Left channel: 00030000" "Left: 00030000" "L: 00030000" "L"
94827-95577 i2s: right: "Right channel: 036f0000" "Right: 036f0000" "R: 036f0000" "R"
95577-96327 i2s: left: "Left channel: 00020000" "Left: 00020000" "L: 00020000" "L"
96327-97077 i2s: right: "Right channel: 039c0000" "Right: 039c0000" "R: 039c0000" "R"
97077-97828 i2s: left: "Left channel: 00020000" "Left: 00020000" "L: 00020000" "L"
97828-98578 i2s: right: "Right channel: 03700000" "Right: 03700000" "R: 03700000" "R"
98578-99328 i2s: left: "Left channel: ffff0000" "Left: ffff0000" "L: ffff0000" "L"
99328-100078 i2s: right: "Right channel: 02e90000" "Right: 02e90000" "R: 02e90000" "R"
100078-100829 i2s: left: "Left channel: 00030000" "Left: 00030000" "L: 00030000" "L"
100829-101579 i2s: right: "Right channel: 02440000" "Right: 02440000" "R: 02440000" "R"
101579-102329 i2s: left: "Left channel: 00000000" "Left: 00000000" "L: 00000000" "L"
102329-103079 i2s: right: "Right channel: 018c0000" "Right: 018c0000" "R: 018c0000" "R"
103079-103830 i2s: left: "Left channel: 00020000" "Left: 00020000" "L: 00020000" "L"
103830-104580 i2s: right: "Right channel: 00b80000" "Right: 00b80000" "R: 00b80000" "R"
104580-105330 i2s: left: "Left channel: fffd0000" "Left: fffd0000" "L: fffd0000" "L"
105330-106080 i2s: right: "Right channel: ffcd0000" "Right: ffcd0000" "R: ffcd0000" "R"
106080-106831 i2s: left: "Left channel: fffe0000" "Left: fffe0000" "L: fffe0000" "L"
106831-107581 i2s: right: "Right channel: fee30000" "Right: fee30000" "R: fee30000" "R"
107581-108331 i2s: left: "Left channel: 00000000" "Left: 00000000" "L: 00000000" "L"
108331-109081 i2s: right: "Right channel: fdfa0000" "Right: fdfa0000" "R: fdfa0000" "R"
109081-109832 i2s: left: "Left channel: fffc0000" "Left: fffc0000" "L: fffc0000" "L"
109832-110582 i2s: right: "Right channel: fd250000" "Right: fd250000" "R: fd250000" "R"
110582-111332 i2s: left: "Left channel: ffff0000" "Left: ffff0000" "L: ffff0000" "L"
111332-112082 i2s: right: "Right channel: fc2c0000" "Right: fc2c0000" "R: fc2c0000" "R"
112082-112833 i2s: left: "Left channel: 00000000" "Left: 00000000" "L: 00000000" "L"
112833-113583 i2s: right: "Right channel: fb3d0000" "Right: fb3d0000" "R: fb3d0000" "R"
113583-114333 i2s: left: "Left channel: ffff0000" "Left: ffff0000" "L: ffff0000" "L"
114333-115083 i2s: right: "Right channel: fa7e0000" "Right: fa7e0000" "R: fa7e0000" "R"
115083-115834 i2s: left: "Left channel: ffff0000" "Left: ffff0000" "L: ffff0000" "L"
115834-116584 i2s: right: "Right channel: fa0c0000" "Right: fa0c0000" "R: fa0c0000" "R"
116584-117334 i2s: left: "Left channel: 00030000" "Left: 00030000" "L: 00030000" "L"
117334-118084 i2s: right: "Right channel: f9b70000" "Right: f9b70000" "R: f9b70000" "R"
118084-118835 i2s: left: "Left channel: ffff0000" "Left: ffff0000" "L: ffff0000" "L"
118835-119585 i2s: right: "Right channel: f9610000" "Right: f9610000" "R: f9610000" "R"
119585-120335 i2s: left: "Left channel: 00000000" "Left: 00000000" "L: 00000000" "L"
120335-121085 i2s: right: "Right channel: f8e90000" "Right: f8e90000" "R: f8e90000" "R"
121085-121836 i2s: left: "Left channel: 00020000" "Left: 00020000" "L: 00020000" "L"
121836-122586 i2s: right: "Right channel: f8bd0000" "Right: f8bd0000" "R: f8bd0000" "R"
122586-123336 i2s: left: "Left channel: 00000000" "Left: 00000000" "L: 00000000" "L"
123336-124086 i2s: right: "Right channel: f8b40000" "Right: f8b40000" "R: f8b40000" "R"
124086-124837 i2s: left: "Left channel: 00010000" "Left: 00010000" "L: 00010000" "L"
124837-125587 i2s: right: "Right channel: f9130000" "Right: f9130000" "R: f9130000" "R"
125587-126337 i2s: left: "Left channel: ffff0000" "Left: ffff0000" "L: ffff0000" "L"
126337-127087 i2s: right: "Right channel: f9530000" "Right: f9530000" "R: f9530000" "R"
127087-127838 i2s: left: "Left channel: 00010000" "Left: 00010000" "L: 00010000" "L"
127838-128588 i2s: right: "Right channel: f9710000" "Right: f9710000" "R: f9710000" "R"
128588-129338 i2s: left: "Left channel: ffff0000" "Left: ffff0000" "L: ffff0000" "L"
129338-130088 i2s: right: "Right channel: fa0b0000" "Right: fa0b0000" "R: fa0b0000" "R"
130088-130839 i2s: left: "Left channel: 00010000" "Left: 00010000" "L: 00010000" "L"
130839-131589 i2s: right: "Right channel: faa40000" "Right: faa40000" "R: faa40000" "R"
131589-132339 i2s: left: "Left channel: 00000000" "Left: 00000000" "L: 00000000" "L"
132339-133089 i2s: right: "Right channel: fb2c0000" "Right: fb2c0000" "R: fb2c0000" "R"
133089-133840 i2s: left: "Left channel: 00020000" "Left: 00020000" "L: 00020000" "L"
133840-134590 i2s: right: "Right channel: fc0b0000" "Right: fc0b0000" "R: fc0b0000" "R"
134590-135340 i2s: left: "Left channel: 00030000" "Left: 00030000" "L: 00030000" "L"
135340-136090 i2s: right: "Right channel: fc8b0000" "Right: fc8b0000" "R: fc8b0000" "R"
136090-136841 i2s: left: "Left channel: 00010000" "Left: 00010000" "L: 00010000" "L"
136841-137591 i2s: right: "Right channel: fdb50000" "Right: fdb50000" "R: fdb50000" "R"
137591-138341 i2s: left: "Left channel: 00010000" "Left: 00010000" "L: 00010000" "L"
138341-139091 i2s: right: "Right channel: fe360000" "Right: fe360000" "R: fe360000" "R"
139091-139842 i2s: left: "Left channel: 00000000" "Left: 00000000" "L: 00000000" "L"
139842-140592 i2s: right: "Right channel: fef40000" "Right: fef40000" "R: fef40000" "R"
140592-141342 i2s: left: "Left channel: 00000000" "Left: 00000000" "L: 00000000" "L"
141342-142092 i2s: right: "Right channel: ffc40000" "Right: ffc40000" "R: ffc40000" "R"
142092-142843 i2s: left: "Left channel: ffff0000" "Left: ffff0000" "L: ffff0000" "L"
142843-143593 i2s: right: "Right channel: 01290000" "Right: 01290000" "R: 01290000" "R"
143593-144343 i2s: left: "Left channel: 00020000" "Left: 00020000" "L: 00020000" "L"
144343-145093 i2s: right: "Right channel: 03520000" "Right: 03520000" "R: 03520000" "R"
145093-145844 i2s: left: "Left channel: 00030000" "Left: 00030000" "L: 00030000" "L"
145844-146594 i2s: right: "Right channel: 03c10000" "Right: 03c10000" "R: 03c10000" "R"
146594-147344 i2s: left: "Left channel: 00010000" "Left: 00010000" "L: 00010000" "L"
147344-148094 i2s: right: "Right channel: 02830000" "Right: 02830000" "R: 02830000" "R"
148094-148845 i2s: left: "Left channel: 00000000" "Left: 00000000" "L: 00000000" "L"
148845-149595 i2s: right: "Right channel: 01f90000" "Right: 01f90000" "R: 01f90000" "R"
149595-150345 i2s: left: "Left channel: 00010000" "Left: 00010000" "L: 00010000" "L"
150345-151095 i2s: right: "Right channel: 013d0000" "Right: 013d0000" "R: 013d0000" "R"
151095-151846 i2s: left: "Left channel: fffe0000" "Left: fffe0000" "L: fffe0000" "L"
151846-152596 i2s: right: "Right channel: 01430000" "Right: 01430000" "R: 01430000" "R"
152596-153346 i2s: left: "Left channel: 00000000" "Left: 00000000" "L: 00000000" "L"
153346-154096 i2s: right: "Right channel: 000c0000" "Right: 000c0000" "R: 000c0000" "R"
154096-154847 i2s: left: "Left channel: ffff0000" "Left: ffff0000" "L: ffff0000" "L"
154847-155597 i2s: right: "Right channel: fe4b0000" "Right: fe4b0000" "R: fe4b0000" "R"
155597-156347 i2s: left: "Left channel: fffd0000" "Left: fffd0000" "L: fffd0000" "L"
156347-157097 i2s: right: "Right channel: fd3e0000" "Right: fd3e0000" "R: fd3e0000" "R"
157097-157848 i2s: left: "Left channel: ffff0000" "Left: ffff0000" "L: ffff0000" "L"
157848-158598 i2s: right: "Right channel: fc7b0000" "Right: fc7b0000" "R: fc7b0000" "R"
158598-159348 i2s: left: "Left channel: fffe0000" "Left: fffe0000" "L: fffe0000" "L"
159348-160098 i2s: right: "Right channel: fb7e0000" "Right: fb7e0000" "R: fb7e0000" "R"
160098-160849 i2s: left: "Left channel: ffff0000" "Left: ffff0000" "L: ffff0000" "L"
160849-161599 i2s: right: "Right channel: fb4c0000" "Right: fb4c0000" "R: fb4c0000" "R"
161599-162349 i2s: left: "Left channel: ffff0000" "Left: ffff0000" "L: ffff0000" "L"
162349-163099 i2s: right: "Right channel: fbd00000" "Right: fbd00000" "R: fbd00000" "R"
163099-163850 i2s: left: "Left channel: ffff0000" "Left: ffff0000" "L: ffff0000" "L"
163850-164600 i2s: right: "Right channel: fdcc0000" "Right: fdcc0000" "R: fdcc0000" "R"
164600-165350 i2s: left: "Left channel: 00020000" "Left: 00020000" "L: 00020000" "L"
165350-166100 i2s: right: "Right channel: feb20000" "Right: feb20000" "R: feb20000" "R"
166100-166851 i2s: left: "Left channel: 00040000" "Left: 00040000" "L: 00040000" "L"
166851-167601 i2s: right: "Right channel: ffee0000" "Right: ffee0000" "R: ffee0000" "R"
167601-168351 i2s: left: "Left channel: 00000000" "Left: 00000000" "L: 00000000" "L"
168351-169101 i2s: right: "Right channel: 01260000" "Right: 01260000" "R: 01260000" "R"
169101-169852 i2s: left: "Left channel: 00020000" "Left: 00020000" "L: 00020000" "L"
169852-170602 i2s: right: "Right channel: 02d70000" "Right: 02d70000" "R: 02d70000" "R"
170602-171352 i2s: left: "Left channel: 00010000" "Left: 00010000" "L: 00010000" "L"
171352-172102 i2s: right: "Right channel: 04b50000" "Right: 04b50000" "R: 04b50000" "R"
172102-172853 i2s: left: "Left channel: 00020000" "Left: 00020000" "L: 00020000" "L"
172853-173603 i2s: right: "Right channel: 06490000" "Right: 06490000" "R: 06490000" "R"
173603-174353 i2s: left: "Left channel: 00020000" "Left: 00020000" "L: 00020000" "L"
174353-175103 i2s: right: "Right channel: 07980000" "Right: 07980000" "R: 07980000" "R"
175103-175854 i2s: left: "Left channel: 00030000" "Left: 00030000" "L: 00030000" "L"
175854-176604 i2s: right: "Right channel: 08700000" "Right: 08700000" "R: 08700000" "R"
176604-177354 i2s: left: "Left channel: 00000000" "Left: 00000000" "L: 00000000" "L"
177354-178104 i2s: right: "Right channel: 07e20000" "Right: 07e20000" "R: 07e20000" "R"
178104-178855 i2s: left: "Left channel: fffe0000" "Left: fffe0000" "L: fffe0000" "L"
178855-179605 i2s: right: "Right channel: 080f0000" "Right: 080f0000" "R: 080f0000" "R"
179605-180355 i2s: left: "Left channel: ffff0000" "Left: ffff0000" "L: ffff0000" "L"
180355-181105 i2s: right: "Right channel: 07d70000" "Right: 07d70000" "R: 07d70000" "R"
181105-181856 i2s: left: "Left channel: 00000000" "Left: 00000000" "L: 00000000" "L"
181856-182606 i2s: right: "Right channel: 07730000" "Right: 07730000" "R: 07730000" "R"
182606-183356 i2s: left: "Left channel: 00000000" "Left: 00000000" "L: 00000000" "L"
183356-184106 i2s: right: "Right channel: 061a0000" "Right: 061a0000" "R: 061a0000" "R"
184106-184857 i2s: left: "Left channel: fffb0000" "Left: fffb0000" "L: fffb0000" "L"
184857-185607 i2s: right: "Right channel: 04570000" "Right: 04570000" "R: 04570000" "R"
185607-186357 i2s: left: "Left channel: fffe0000" "Left: fffe0000" "L: fffe0000" "L"
186357-187107 i2s: right: "Right channel: 028a0000" "Right: 028a0000" "R: 028a0000" "R"
187107-187858 i2s: left: "Left channel: 00000000" "Left: 00000000" "L: 00000000" "L"
187858-188608 i2s: right: "Right channel: 004e0000" "Right: 004e0000" "R: 004e0000" "R"
188608-189358 i2s: left: "Left channel: fffb0000" "Left: fffb0000" "L: fffb0000" "L"
189358-190108 i2s: right: "Right channel: fd5a0000" "Right: fd5a0000" "R: fd5a0000" "R"
190108-190859 i2s: left: "Left channel: fffe0000" "Left: fffe0000" "L: fffe0000" "L"
190859-191609 i2s: right: "Right channel: fb0c0000" "Right: fb0c0000" "R: fb0c0000" "R"
191609-192359 i2s: left: "Left channel: fffe0000" "Left: fffe0000" "L: fffe0000" "L"
192359-193109 i2s: right: "Right channel: f9160000" "Right: f9160000" "R: f9160000" "R"
193109-193860 i2s: left: "Left channel: ffff0000" "Left: ffff0000" "L: ffff0000" "L"
193860-194610 i2s: right: "Right channel: f7c70000" "Right: f7c70000" "R: f7c70000" "R"
194610-195360 i2s: left: "Left channel: ffff0000" "Left: ffff0000" "L: ffff0000" "L"
195360-196110 i2s: right: "Right channel: f5930000" "Right: f5930000" "R: f5930000" "R"
196110-196861 i2s: left: "Left channel: 00000000" "Left: 00000000" "L: 00000000" "L"
196861-197611 i2s: right: "Right channel: f4170000" "Right: f4170000" "R: f4170000" "R"
197611-198361 i2s: left: "Left channel: ffff0000" "Left: ffff0000" "L: ffff0000" "L"
198361-199112 i2s: right: "Right channel: f3730000" "Right: f3730000" "R: f3730000" "R"
199112-199862 i2s: left: "Left channel: 00010000" "Left: 00010000" "L: 00010000" "L"
199862-200612 i2s: right: "Right channel: f3860000" "Right: f3860000" "R: f3860000" "R"
200612-201362 i2s: left: "Left channel: fffd0000" "Left: fffd0000" "L: fffd0000" "L"
201362-202113 i2s: right: "Right channel: f4250000" "Right: f4250000" "R: f4250000" "R"
202113-202863 i2s: left: "Left channel: 00010000" "Left: 00010000" "L: 00010000" "L"
202863-203613 i2s: right: "Right channel: f5060000" "Right: f5060000" "R: f5060000" "R"
203613-204363 i2s: left: "Left channel: ffff0000" "Left: ffff0000" "L: ffff0000" "L"
204363-205114 i2s: right: "Right channel: f6260000" "Right: f6260000" "R: f6260000" "R"
205114-205864 i2s: left: "Left channel: 00020000" "Left: 00020000" "L: 00020000" "L"
205864-206614 i2s: right: "Right channel: f7c90000" "Right: f7c90000" "R: f7c90000" "R"
206614-207364 i2s: left: "Left channel: 00030000" "Left: 00030000" "L: 00030000" "L"
207364-208115 i2s: right: "Right channel: f9580000" "Right: f9580000" "R: f9580000" "R"
208115-208865 i2s: left: "Left channel: 00050000" "Left: 00050000" "L: 00050000" "L"
208865-209615 i2s: right: "Right channel: fb950000" "Right: fb950000" "R: fb950000" "R"
209615-210365 i2s: left: "Left channel: 00040000" "Left: 00040000" "L: 00040000" "L"
210365-211116 i2s: right: "Right channel: fded0000" "Right: fded0000" "R: fded0000" "R"
211116-211866 i2s: left: "Left channel: 00030000" "Left: 00030000" "L: 00030000" "L"
211866-212616 i2s: right: "Right channel: 00380000" "Right: 00380000" "R: 00380000" "R"
212616-213366 i2s: left: "Left channel: 00040000" "Left: 00040000" "L: 00040000" "L"
213366-214117 i2s: right: "Right channel: 02620000" "Right: 02620000" "R: 02620000" "R"
214117-214867 i2s: left: "Left channel: 00050000" "Left: 00050000" "L: 00050000" "L"
214867-215617 i2s: right: "Right channel: 04980000" "Right: 04980000" "R: 04980000" "R"
215617-216367 i2s: left: "Left channel: 00000000" "Left: 00000000" "L: 00000000" "L"
216367-217118 i2s: right: "Right channel: 06ae0000" "Right: 06ae0000" "R: 06ae0000" "R"
217118-217868 i2s: left: "Left channel: 00020000" "Left: 00020000" "L: 00020000" "L"
217868-218618 i2s: right: "Right channel: 084c0000" "Right: 084c0000" "R: 084c0000" "R"
218618-219368 i2s: left: "Left channel: 00020000" "Left: 00020000" "L: 00020000" "L"
219368-220119 i2s: right: "Right channel: 09fb0000" "Right: 09fb0000" "R: 09fb0000" "R"
220119-220869 i2s: left: "Left channel: 00040000" "Left: 00040000" "L: 00040000" "L"
220869-221619 i2s: right: "Right channel: 0c060000" "Right: 0c060000" "R: 0c060000" "R"
221619-222369 i2s: left: "Left channel: 00020000" "Left: 00020000" "L: 00020000" "L"
222369-223120 i2s: right: "Right channel: 0db40000" "Right: 0db40000" "R: 0db40000" "R"
223120-223870 i2s: left: "Left channel: 00010000" "Left: 00010000" "L: 00010000" "L"
223870-224620 i2s: right: "Right channel: 0edf0000" "Right: 0edf0000" "R: 0edf0000" "R"
224620-225370 i2s: left: "Left channel: 00010000" "Left: 00010000" "L: 00010000" "L"
225370-226121 i2s: right: "Right channel: 0f780000" "Right: 0f780000" "R: 0f780000" "R"
226121-226871 i2s: left: "Left channel: ffff0000" "Left: ffff0000" "L: ffff0000" "L"
226871-227621 i2s: right: "Right channel: 105c0000" "Right: 105c0000" "R: 105c0000" "R"
227621-228371 i2s: left: "Left channel: 00010000" "Left: 00010000" "L: 00010000" "L"
228371-229122 i2s: right: "Right channel: 11770000" "Right: 11770000" "R: 11770000" "R"
229122-229872 i2s: left: "Left channel: 00020000" "Left: 00020000" "L: 00020000" "L"
229872-230622 i2s: right: "Right channel: 12360000" "Right: 12360000" "R: 12360000" "R"
230622-231372 i2s: left: "Left channel: 00000000" "Left: 00000000" "L: 00000000" "L"
231372-232123 i2s: right: "Right channel: 12980000" "Right: 12980000" "R: 12980000" "R"
232123-232873 i2s: left: "Left channel: 00020000" "Left: 00020000" "L: 00020000" "L"
232873-233623 i2s: right: "Right channel: 12dc0000" "Right: 12dc0000" "R: 12dc0000" "R"
233623-234373 i2s: left: "Left channel: 00000000" "Left: 00000000" "L: 00000000" "L"
234373-235124 i2s: right: "Right channel: 12e80000" "Right: 12e80000" "R: 12e80000" "R"
235124-235874 i2s: left: "Left channel: 00000000" "Left: 00000000" "L: 00000000" "L"
235874-236624 i2s: right: "Right channel: 12980000" "Right: 12980000" "R: 12980000" "R"
236624-237374 i2s: left: "Left channel: fffd0000" "Left: fffd0000" "L: fffd0000" "L"
237374-238125 i2s: right: "Right channel: 11f70000" "Right: 11f70000" "R: 11f70000" "R"
238125-238875 i2s: left: "Left channel: ffff0000" "Left: ffff0000" "L: ffff0000" "L"
238875-239625 i2s: right: "Right channel: 113c0000" "Right: 113c0000" "R: 113c0000" "R"
239625-240375 i2s: left: "Left channel: fffe0000" "Left: fffe0000" "L: fffe0000" "L"
240375-241126 i2s: right: "Right channel: 10300000" "Right: 10300000" "R: 10300000" "R"
241126-241876 i2s: left: "Left channel: fffe0000" "Left: fffe0000" "L: fffe0000" "L"
241876-242626 i2s: right: "Right channel: 0ecd0000" "Right: 0ecd0000" "R: 0ecd0000" "R"
242626-243376 i2s: left: "Left channel: ffff0000" "Left: ffff0000" "L: ffff0000" "L"
243376-244127 i2s: right: "Right channel: 0ccd0000" "Right: 0ccd0000" "R: 0ccd0000" "R"
244127-244877 i2s: left: "Left channel: fffd0000" "Left: fffd0000" "L: fffd0000" "L"
244877-245627 i2s: right: "Right channel: 0a310000" "Right: 0a310000" "R: 0a310000" "R"
245627-246377 i2s: left: "Left channel: fffb0000" "Left: fffb0000" "L: fffb0000" "L"
246377-247128 i2s: right: "Right channel: 076c0000" "Right: 076c0000" "R: 076c0000" "R"
247128-247878 i2s: left: "Left channel: fffc0000" "Left: fffc0000" "L: fffc0000" "L"
247878-248628 i2s: right: "Right channel: 04c20000" "Right: 04c20000" "R: 04c20000" "R"
248628-249378 i2s: left: "Left channel: fffa0000" "Left: fffa0000" "L: fffa0000" "L"
249378-250129 i2s: right: "Right channel: 01d50000" "Right: 01d50000" "R: 01d50000" "R"
250129-250879 i2s: left: "Left channel: fffb0000" "Left: fffb0000" "L: fffb0000" "L"
250879-251629 i2s: right: "Right channel: fefc0000" "Right: fefc0000" "R: fefc0000" "R"
251629-252379 i2s: left: "Left channel: fffb0000" "Left: fffb0000" "L: fffb0000" "L"
252379-253130 i2s: right: "Right channel: fbb50000" "Right: fbb50000" "R: fbb50000" "R"
253130-253880 i2s: left: "Left channel: fffc0000" "Left: fffc0000" "L: fffc0000" "L"
253880-254630 i2s: right: "Right channel: f8950000" "Right: f8950000" "R: f8950000" "R"
254630-255380 i2s: left: "Left channel: fffb0000" "Left: fffb0000" "L: fffb0000" "L"
255380-256131 i2s: right: "Right channel: f60e0000" "Right: f60e0000" "R: f60e0000" "R"
256131-256881 i2s: left: "Left channel: fffd0000" "Left: fffd0000" "L: fffd0000" "L"
256881-257631 i2s: right: "Right channel: f4160000" "Right: f4160000" "R: f4160000" "R"
257631-258381 i2s: left: "Left channel: fffd0000" "Left: fffd0000" "L: fffd0000" "L"
258381-259132 i2s: right: "Right channel: f2740000" "Right: f2740000" "R: f2740000" "R"
259132-259882 i2s: left: "Left channel: ffff0000" "Left: ffff0000" "L: ffff0000" "L"
259882-260632 i2s: right: "Right channel: f13a0000" "Right: f13a0000" "R: f13a0000" "R"
260632-261382 i2s: left: "Left channel: ffff0000" "Left: ffff0000" "L: ffff0000" "L"
261382-262133 i2s: right: "Right channel: f06f0000" "Right: f06f0000" "R: f06f0000" "R"
262133-262883 i2s: left: "Left channel: fffe0000" "Left: fffe0000" "L: fffe0000" "L"
262883-263633 i2s: right: "Right channel: f04b0000" "Right: f04b0000" "R: f04b0000" "R"
263633-264383 i2s: left: "Left channel: 00000000" "Left: 00000000" "L: 00000000" "L"
264383-265134 i2s: right: "Right channel: f08c0000" "Right: f08c0000" "R: f08c0000" "R"
265134-265884 i2s: left: "Left channel: ffff0000" "Left: ffff0000" "L: ffff0000" "L"
265884-266634 i2s: right: "Right channel: f1390000" "Right: f1390000" "R: f1390000" "R"
266634-267384 i2s: left: "Left channel: 00030000" "Left: 00030000" "L: 00030000" "L"
267384-268135 i2s: right: "Right channel: f2420000" "Right: f2420000" "R: f2420000" "R"
268135-268885 i2s: left: "Left channel: 00010000" "Left: 00010000" "L: 00010000" "L"
268885-269635 i2s: right: "Right channel: f3d00000" "Right: f3d00000" "R: f3d00000" "R"
269635-270385 i2s: left: "Left channel: 00040000" "Left: 00040000" "L: 00040000" "L"
270385-271136 i2s: right: "Right channel: f59a0000" "Right: f59a0000" "R: f59a0000" "R"
271136-271886 i2s: left: "Left channel: 00020000" "Left: 00020000" "L: 00020000" "L"
271886-272636 i2s: right: "Right channel: f74e0000" "Right: f74e0000" "R: f74e0000" "R"
272636-273386 i2s: left: "Left channel: 00030000" "Left: 00030000" "L: 00030000" "L"
273386-274137 i2s: right: "Right channel: f8cc0000" "Right: f8cc0000" "R: f8cc0000" "R"
274137-274887 i2s: left: "Left channel: 00000000" "Left: 00000000" "L: 00000000" "L"
274887-275637 i2s: right: "Right channel: fa4f0000" "Right: fa4f0000" "R: fa4f0000" "R"
275637-276387 i2s: left: "Left channel: 00030000" "Left: 00030000" "L: 00030000" "L"
276387-277138 i2s: right: "Right channel: fc0d0000" "Right: fc0d0000" "R: fc0d0000" "R"
277138-277888 i2s: left: "Left channel: 00020000" "Left: 00020000" "L: 00020000" "L"
277888-278638 i2s: right: "Right channel: fdb60000" "Right: fdb60000" "R: fdb60000" "R"
278638-279388 i2s: left: "Left channel: 00030000" "Left: 00030000" "L: 00030000" "L"
279388-280139 i2s: right: "Right channel: feeb0000" "Right: feeb0000" "R: feeb0000" "R"
280139-280889 i2s: left: "Left channel: 00030000" "Left: 00030000" "L: 00030000" "L"
280889-281639 i2s: right: "Right channel: ffc90000" "Right: ffc90000" "R: ffc90000" "R"
281639-282389 i2s: left: "Left channel: 00010000" "Left: 00010000" "L: 00010000" "L"
282389-283140 i2s: right: "Right channel: 00790000" "Right: 00790000" "R: 00790000" "R"
283140-283890 i2s: left: "Left channel: 00020000" "Left: 00020000" "L: 00020000" "L"
283890-284640 i2s: right: "Right channel: 011b0000" "Right: 011b0000" "R: 011b0000" "R"
284640-285390 i2s: left: "Left channel: 00010000" "Left: 00010000" "L: 00010000" "L"
285390-286141 i2s: right: "Right channel: 01a60000" "Right: 01a60000" "R: 01a60000" "R"
286141-286891 i2s: left: "Left channel: 00000000" "Left: 00000000" "L: 00000000" "L"
286891-287641 i2s: right: "Right channel: 01f50000" "Right: 01f50000" "R: 01f50000" "R"
287641-288391 i2s: left: "Left channel: 00010000" "Left: 00010000" "L: 00010000" "L"
288391-289142 i2s: right: "Right channel: 021b0000" "Right: 021b0000" "R: 021b0000" "R"
289142-289892 i2s: left: "Left channel: 00010000" "Left: 00010000" "L: 00010000" "L"
289892-290642 i2s: right: "Right channel: 02260000" "Right: 02260000" "R: 02260000" "R"
290642-291392 i2s: left: "Left channel: 00000000" "Left: 00000000" "L: 00000000" "L"
291392-292143 i2s: right: "Right channel: 02160000" "Right: 02160000" "R: 02160000" "R"
292143-292893 i2s: left: "Left channel: ffff0000" "Left: ffff0000" "L: ffff0000" "L"
292893-293643 i2s: right: "Right channel: 01e00000" "Right: 01e00000" "R: 01e00000" "R"
293643-294393 i2s: left: "Left channel: 00010000" "Left: 00010000" "L: 00010000" "L"
294393-295144 i2s: right: "Right channel: 01af0000" "Right: 01af0000" "R: 01af0000" "R"
295144-295894 i2s: left: "Left channel: 00000000" "Left: 00000000" "L: 00000000" "L"
295894-296644 i2s: right: "Right channel: 01670000" "Right: 01670000" "R: 01670000" "R"
296644-297394 i2s: left: "Left channel: 00000000" "Left: 00000000" "L: 00000000" "L"
297394-298145 i2s: right: "Right channel: 01390000" "Right: 01390000" "R: 01390000" "R"
298145-298895 i2s: left: "Left channel: ffff0000" "Left: ffff0000" "L: ffff0000" "L"
298895-299645 i2s: right: "Right channel: 01040000" "Right: 01040000" "R: 01040000" "R"
299645-300395 i2s: left: "Left channel: 00000000" "Left: 00000000" "L: 00000000" "L"
300395-301146 i2s: right: "Right channel: 00960000" "Right: 00960000" "R: 00960000" "R"
301146-301896 i2s: left: "Left channel: 00010000" "Left: 00010000" "L: 00010000" "L"
301896-302646 i2s: right: "Right channel: fff10000" "Right: fff10000" "R: fff10000" "R"
302646-303396 i2s: left: "Left channel: fffe0000" "Left: fffe0000" "L: fffe0000" "L"
303396-304147 i2s: right: "Right channel: ff3d0000" "Right: ff3d0000" "R: ff3d0000" "R"
304147-304897 i2s: left: "Left channel: 00010000" "Left: 00010000" "L: 00010000" "L"
304897-305647 i2s: right: "Right channel: fe9b0000" "Right: fe9b0000" "R: fe9b0000" "R"
305647-306397 i2s: left: "Left channel: 00020000" "Left: 00020000" "L: 00020000" "L"
306397-307148 i2s: right: "Right channel: fe2b0000" "Right: fe2b0000" "R: fe2b0000" "R"
307148-307898 i2s: left: "Left channel: ffff0000" "Left: ffff0000" "L: ffff0000" "L"
307898-308648 i2s: right: "Right channel: fd520000" "Right: fd520000" "R: fd520000" "R"
308648-309398 i2s: left: "Left channel: ffff0000" "Left: ffff0000" "L: ffff0000" "L"
309398-310149 i2s: right: "Right channel: fcda0000" "Right: fcda0000" "R: fcda0000" "R"
310149-310899 i2s: left: "Left channel: ffff0000" "Left: ffff0000" "L: ffff0000" "L"
310899-311649 i2s: right: "Right channel: fc120000" "Right: fc120000" "R: fc120000" "R"
311649-312400 i2s: left: "Left channel: 00000000" "Left: 00000000" "L: 00000000" "L"
312400-313150 i2s: right: "Right channel: fb810000" "Right: fb810000" "R: fb810000" "R"
313150-313900 i2s: left: "Left channel: ffff0000" "Left: ffff0000" "L: ffff0000" "L"
313900-314650 i2s: right: "Right channel: fb320000" "Right: fb320000" "R: fb320000" "R"
314650-315400 i2s: left: "Left channel: 00010000" "Left: 00010000" "L: 00010000" "L"
315400-316151 i2s: right: "Right channel: faae0000" "Right: faae0000" "R: faae0000" "R"
316151-316901 i2s: left: "Left channel: 00000000" "Left: 00000000" "L: 00000000" "L"
316901-317651 i2s: right: "Right channel: fa730000" "Right: fa730000" "R: fa730000" "R"
317651-318402 i2s: left: "Left channel: ffff0000" "Left: ffff0000" "L: ffff0000" "L"
318402-319152 i2s: right: "Right channel: fa290000" "Right: fa290000" "R: fa290000" "R"
319152-319902 i2s: left: "Left channel: ffff0000" "Left: ffff0000" "L: ffff0000" "L"
319902-320652 i2s: right: "Right channel: fa850000" "Right: fa850000" "R: fa850000" "R"
320652-321403 i2s: left: "Left channel: 00030000" "Left: 00030000" "L: 00030000" "L"
321403-322153 i2s: right: "Right channel: fb4a0000" "Right: fb4a0000" "R: fb4a0000" "R"
322153-322903 i2s: left: "Left channel: 00010000" "Left: 00010000" "L: 00010000" "L"
322903-323653 i2s: right: "Right channel: fcf50000" "Right: fcf50000" "R: fcf50000" "R"
323653-324404 i2s: left: "Left channel: 00010000" "Left: 00010000" "L: 00010000" "L"
324404-325154 i2s: right: "Right channel: fd0a0000" "Right: fd0a0000" "R: fd0a0000" "R"
325154-325904 i2s: left: "Left channel: 00000000" "Left: 00000000" "L: 00000000" "L"
325904-326654 i2s: right: "Right channel: fc460000" "Right: fc460000" "R: fc460000" "R"
326654-327405 i2s: left: "Left channel: 00000000" "Left: 00000000" "L: 00000000" "L"
327405-328155 i2s: right: "Right channel: fbd30000" "Right: fbd30000" "R: fbd30000" "R"
328155-328905 i2s: left: "Left channel: fffd0000" "Left: fffd0000" "L: fffd0000" "L"
328905-329655 i2s: right: "Right channel: fc050000" "Right: fc050000" "R: fc050000" "R"
329655-330406 i2s: left: "Left channel: 00010000" "Left: 00010000" "L: 00010000" "L"
330406-331156 i2s: right: "Right channel: fc4e0000" "Right: fc4e0000" "R: fc4e0000" "R"
331156-331906 i2s: left: "Left channel: 00000000" "Left: 00000000" "L: 00000000" "L"
331906-332656 i2s: right: "Right channel: fbf30000" "Right: fbf30000" "R: fbf30000" "R"
332656-333407 i2s: left: "Left channel: 00000000" "Left: 00000000" "L: 00000000" "L"
333407-334157 i2s: right: "Right channel: fb0e0000" "Right: fb0e0000" "R: fb0e0000" "R"
334157-334907 i2s: left: "Left channel: 00000000" "Left: 00000000" "L: 00000000" "L"
334907-335657 i2s: right: "Right channel: fad20000" "Right: fad20000" "R: fad20000" "R"
335657-336408 i2s: left: "Left channel: 00010000" "Left: 00010000" "L: 00010000" "L"
336408-337158 i2s: right: "Right channel: faff0000" "Right: faff0000" "R: faff0000" "R"
337158-337908 i2s: left: "Left channel: 00010000" "Left: 00010000" "L: 00010000" "L"
337908-338658 i2s: right: "Right channel: fac00000" "Right: fac00000" "R: fac00000" "R"
338658-339409 i2s: left: "Left channel: 00000000" "Left: 00000000" "L: 00000000" "L"
339409-340159 i2s: right: "Right channel: fb390000" "Right: fb390000" "R: fb390000" "R"
340159-340909 i2s: left: "Left channel: ffff0000" "Left: ffff0000" "L: ffff0000" "L"
340909-341659 i2s: right: "Right channel: fc850000" "Right: fc850000" "R: fc850000" "R"
341659-342410 i2s: left: "Left channel: 00010000" "Left: 00010000" "L: 00010000" "L"
342410-343160 i2s: right: "Right channel: feca0000" "Right: feca0000" "R: feca0000" "R"
343160-343910 i2s: left: "Left channel: 00010000" "Left: 00010000" "L: 00010000" "L"
343910-344660 i2s: right: "Right channel: 000e0000" "Right: 000e0000" "R: 000e0000" "R"
344660-345411 i2s: left: "Left channel: 00000000" "Left: 00000000" "L: 00000000" "L"
345411-346161 i2s: right: "Right channel: 01930000" "Right: 01930000" "R: 01930000" "R"
346161-346911 i2s: left: "Left channel: 00010000" "Left: 00010000" "L: 00010000" "L"
346911-347661 i2s: right: "Right channel: 02b60000" "Right: 02b60000" "R: 02b60000" "R"
347661-348412 i2s: left: "Left channel: 00000000" "Left: 00000000" "L: 00000000" "L"
348412-349162 i2s: right: "Right channel: 04ab0000" "Right: 04ab0000" "R: 04ab0000" "R"
349162-349912 i2s: left: "Left channel: 00010000" "Left: 00010000" "L: 00010000" "L"
349912-350662 i2s: right: "Right channel: 063a0000" "Right: 063a0000" "R: 063a0000" "R"
350662-351413 i2s: left: "Left channel: 00010000" "Left: 00010000" "L: 00010000" "L"
351413-352163 i2s: right: "Right channel: 07b30000" "Right: 07b30000" "R: 07b30000" "R"
352163-352913 i2s: left: "Left channel: 00010000" "Left: 00010000" "L: 00010000" "L"
352913-353663 i2s: right: "Right channel: 08500000" "Right: 08500000" "R: 08500000" "R"
353663-354414 i2s: left: "Left channel: 00020000" "Left: 00020000" "L: 00020000" "L"
354414-355164 i2s: right: "Right channel: 08c50000" "Right: 08c50000" "R: 08c50000" "R"
355164-355914 i2s: left: "Left channel: 00010000" "Left: 00010000" "L: 00010000" "L"
355914-356664 i2s: right: "Right channel: 080e0000" "Right: 080e0000" "R: 080e0000" "R"
356664-357415 i2s: left: "Left channel: 00010000" "Left: 00010000" "L: 00010000" "L"
357415-358165 i2s: right: "Right channel: 07d40000" "Right: 07d40000" "R: 07d40000" "R"
358165-358915 i2s: left: "Left channel: ffff0000" "Left: ffff0000" "L: ffff0000" "L"
358915-359665 i2s: right: "Right channel: 070e0000" "Right: 070e0000" "R: 070e0000" "R"
359665-360416 i2s: left: "Left channel: fffe0000" "Left: fffe0000" "L: fffe0000" "L"
360416-361166 i2s: right: "Right channel: 06130000" "Right: 06130000" "R: 06130000" "R"
361166-361916 i2s: left: "Left channel: ffff0000" "Left: ffff0000" "L: ffff0000" "L"
361916-362666 i2s: right: "Right channel: 04160000" "Right: 04160000" "R: 04160000" "R"
362666-363417 i2s: left: "Left channel: fffe0000" "Left: fffe0000" "L: fffe0000" "L"
363417-364167 i2s: right: "Right channel: 02300000" "Right: 02300000" "R: 02300000" "R"
364167-364917 i2s: left: "Left channel: fffd0000" "Left: fffd0000" "L: fffd0000" "L"
364917-365667 i2s: right: "Right channel: ffe40000" "Right: ffe40000" "R: ffe40000" "R"
365667-366418 i2s: left: "Left channel: ffff0000" "Left: ffff0000" "L: ffff0000" "L"
366418-367168 i2s: right: "Right channel: fd920000" "Right: fd920000" "R: fd920000" "R"
367168-367918 i2s: left: "Left channel: fffd0000" "Left: fffd0000" "L: fffd0000" "L"
367918-368668 i2s: right: "Right channel: faea0000" "Right: faea0000" "R: faea0000" "R"
368668-369419 i2s: left: "Left channel: fffb0000" "Left: fffb0000" "L: fffb0000" "L"
369419-370169 i2s: right: "Right channel: f90f0000" "Right: f90f0000" "R: f90f0000" "R"
370169-370919 i2s: left: "Left channel: fffd0000" "Left: fffd0000" "L: fffd0000" "L"
370919-371669 i2s: right: "Right channel: f7860000" "Right: f7860000" "R: f7860000" "R"
371669-372420 i2s: left: "Left channel: fffe0000" "Left: fffe0000" "L: fffe0000" "L"
372420-373170 i2s: right: "Right channel: f6590000" "Right: f6590000" "R: f6590000" "R"
373170-373920 i2s: left: "Left channel: fffd0000" "Left: fffd0000" "L: fffd0000" "L"
373920-374670 i2s: right: "Right channel: f4a10000" "Right: f4a10000" "R: f4a10000" "R"
374670-375421 i2s: left: "Left channel: fffe0000" "Left: fffe0000" "L: fffe0000" "L"
375421-376171 i2s: right: "Right channel: f3d60000" "Right: f3d60000" "R: f3d60000" "R"
376171-376921 i2s: left: "Left channel: fffe0000" "Left: fffe0000" "L: fffe0000" "L"
376921-377671 i2s: right: "Right channel: f3c30000" "Right: f3c30000" "R: f3c30000" "R"
377671-378422 i2s: left: "Left channel: fffe0000" "Left: fffe0000" "L: fffe0000" "L"
378422-379172 i2s: right: "Right channel: f4720000" "Right: f4720000" "R: f4720000" "R"
379172-379922 i2s: left: "Left channel: ffff0000" "Left: ffff0000" "L: ffff0000" "L"
379922-380672 i2s: right: "Right channel: f55b0000" "Right: f55b0000" "R: f55b0000" "R"
380672-381423 i2s: left: "Left channel: 00000000" "Left: 00000000" "L: 00000000" "L"
381423-382173 i2s: right: "Right channel: f6a00000" "Right: f6a00000" "R: f6a00000" "R"
382173-382923 i2s: left: "Left channel: 00050000" "Left: 00050000" "L: 00050000" "L"
382923-383673 i2s: right: "Right channel: f7da0000" "Right: f7da0000" "R: f7da0000" "R"
383673-384424 i2s: left: "Left channel: 00020000" "Left: 00020000" "L: 00020000" "L"
384424-385174 i2s: right: "Right channel: f9620000" "Right: f9620000" "R: f9620000" "R"
385174-385924 i2s: left: "Left channel: 00010000" "Left: 00010000" "L: 00010000" "L"
385924-386674 i2s: right: "Right channel: fb160000" "Right: fb160000" "R: fb160000" "R"
386674-387425 i2s: left: "Left channel: 00020000" "Left: 00020000" "L: 00020000" "L"
387425-388175 i2s: right: "Right channel: fd2a0000" "Right: fd2a0000" "R: fd2a0000" "R"
388175-388925 i2s: left: "Left channel: 00030000" "Left: 00030000" "L: 00030000" "L"
388925-389675 i2s: right: "Right channel: ff510000" "Right: ff510000" "R: ff510000" "R"
389675-390426 i2s: left: "Left channel: 00020000" "Left: 00020000" "L: 00020000" "L"
390426-391176 i2s: right: "Right channel: 01610000" "Right: 01610000" "R: 01610000" "R"
391176-391926 i2s: left: "Left channel: 00040000" "Left: 00040000" "L: 00040000" "L"
391926-392676 i2s: right: "Right channel: 03670000" "Right: 03670000" "R: 03670000" "R"
392676-393427 i2s: left: "Left channel: 00030000" "Left: 00030000" "L: 00030000" "L"
393427-394177 i2s: right: "Right channel: 05730000" "Right: 05730000" "R: 05730000" "R"
394177-394927 i2s: left: "Left channel: 00010000" "Left: 00010000" "L: 00010000" "L"
394927-395677 i2s: right: "Right channel: 074d0000" "Right: 074d0000" "R: 074d0000" "R"
395677-396428 i2s: left: "Left channel: 00020000" "Left: 00020000" "L: 00020000" "L"
396428-397178 i2s: right: "Right channel: 08ef0000" "Right: 08ef0000" "R: 08ef0000" "R"
397178-397928 i2s: left: "Left channel: 00030000" "Left: 00030000" "L: 00030000" "L"
397928-398678 i2s: right: "Right channel: 0af20000" "Right: 0af20000" "R: 0af20000" "R"
398678-399429 i2s: left: "Left channel: 00030000" "Left: 00030000" "L: 00030000" "L"
399429-400179 i2s: right: "Right channel: 0d460000" "Right: 0d460000" "R: 0d460000" "R"
400179-400929 i2s: left: "Left channel: 00050000" "Left: 00050000" "L: 00050000" "L"
400929-401679 i2s: right: "Right channel: 0f2c0000" "Right: 0f2c0000" "R: 0f2c0000" "R"
401679-402430 i2s: left: "Left channel: 00030000" "Left: 00030000" "L: 00030000" "L"
402430-403180 i2s: right: "Right channel: 10760000" "Right: 10760000" "R: 10760000" "R"
403180-403930 i2s: left: "Left channel: 00000000" "Left: 00000000" "L: 00000000" "L"
403930-404680 i2s: right: "Right channel: 11690000" "Right: 11690000" "R: 11690000" "R"
404680-405431 i2s: left: "Left channel: 00020000" "Left: 00020000" "L: 00020000" "L"
405431-406181 i2s: right: "Right channel: 12ac0000" "Right: 12ac0000" "R: 12ac0000" "R"
406181-406931 i2s: left: "Left channel: 00010000" "Left: 00010000" "L: 00010000" "L"
406931-407681 i2s: right: "Right channel: 140b0000" "Right: 140b0000" "R: 140b0000" "R"
407681-408432 i2s: left: "Left channel: 00020000" "Left: 00020000" "L: 00020000" "L"
408432-409182 i2s: right: "Right channel: 14d50000" "Right: 14d50000" "R: 14d50000" "R"
409182-409932 i2s: left: "Left channel: 00000000" "Left: 00000000" "L: 00000000" "L"
409932-410682 i2s: right: "Right channel: 15050000" "Right: 15050000" "R: 15050000" "R"
410682-411433 i2s: left: "Left channel: ffff0000" "Left: ffff0000" "L: ffff0000" "L"
411433-412183 i2s: right: "Right channel: 14fd0000" "Right: 14fd0000" "R: 14fd0000" "R"
412183-412933 i2s: left: "Left channel: ffff0000" "Left: ffff0000" "L: ffff0000" "L"
412933-413683 i2s: right: "Right channel: 14b70000" "Right: 14b70000" "R: 14b70000" "R"
413683-414434 i2s: left: "Left channel: 00010000" "Left: 00010000" "L: 00010000" "L"
414434-415184 i2s: right: "Right channel: 141b0000" "Right: 141b0000" "R: 141b0000" "R"
415184-415934 i2s: left: "Left channel: fffe0000" "Left: fffe0000" "L: fffe0000" "L"
415934-416684 i2s: right: "Right channel: 12ed0000" "Right: 12ed0000" "R: 12ed0000" "R"
416684-417435 i2s: left: "Left channel: ffff0000" "Left: ffff0000" "L: ffff0000" "L"
417435-418185 i2s: right: "Right channel: 11650000" "Right: 11650000" "R: 11650000" "R"
418185-418935 i2s: left: "Left channel: 00000000" "Left: 00000000" "L: 00000000" "L"
418935-419685 i2s: right: "Right channel: 0fcf0000" "Right: 0fcf0000" "R: 0fcf0000" "R"
419685-420436 i2s: left: "Left channel: fffa0000" "Left: fffa0000" "L: fffa0000" "L"
420436-421186 i2s: right: "Right channel: 0e0b0000" "Right: 0e0b0000" "R: 0e0b0000" "R"
421186-421936 i2s: left: "Left channel: ffff0000" "Left: ffff0000" "L: ffff0000" "L"
421936-422686 i2s: right: "Right channel: 0b7a0000" "Right: 0b7a0000" "R: 0b7a0000" "R"
422686-423437 i2s: left: "Left channel: fffc0000" "Left: fffc0000" "L: fffc0000" "L"
423437-424187 i2s: right: "Right channel: 081f0000" "Right: 081f0000" "R: 081f0000" "R"
424187-424937 i2s: left: "Left channel: fffd0000" "Left: fffd0000" "L: fffd0000" "L"
424937-425687 i2s: right: "Right channel: 04fe0000" "Right: 04fe0000" "R: 04fe0000" "R"
425687-426438 i2s: left: "Left channel: fffc0000" "Left: fffc0000" "L: fffc0000" "L"
426438-427188 i2s: right: "Right channel: 01fc0000" "Right: 01fc0000" "R: 01fc0000" "R"
427188-427938 i2s: left: "Left channel: fffb0000" "Left: fffb0000" "L: fffb0000" "L"
427938-428688 i2s: right: "Right channel: ff560000" "Right: ff560000" "R: ff560000" "R"
428688-429439 i2s: left: "Left channel: fffd0000" "Left: fffd0000" "L: fffd0000" "L"
429439-430189 i2s: right: "Right channel: fc550000" "Right: fc550000" "R: fc550000" "R"
430189-430939 i2s: left: "Left channel: fffb0000" "Left: fffb0000" "L: fffb0000" "L"
430939-431689 i2s: right: "Right channel: f9200000" "Right: f9200000" "R: f9200000" "R"
431689-432440 i2s: left: "Left channel: fffc0000" "Left: fffc0000" "L: fffc0000" "L"
432440-433190 i2s: right: "Right channel: f65e0000" "Right: f65e0000" "R: f65e0000" "R"
433190-433940 i2s: left: "Left channel: fffc0000" "Left: fffc0000" "L: fffc0000" "L"
433940-434691 i2s: right: "Right channel: f4760000" "Right: f4760000" "R: f4760000" "R"
434691-435441 i2s: left: "Left channel: fffc0000" "Left: fffc0000" "L: fffc0000" "L"
435441-436191 i2s: right: "Right channel: f2ea0000" "Right: f2ea0000" "R: f2ea0000" "R"
436191-436941 i2s: left: "Left channel: fffe0000" "Left: fffe0000" "L: fffe0000" "L"
436941-437692 i2s: right: "Right channel: f1d40000" "Right: f1d40000" "R: f1d40000" "R"
437692-438442 i2s: left: "Left channel: fffd0000" "Left: fffd0000" "L: fffd0000" "L"
438442-439192 i2s: right: "Right channel: f1130000" "Right: f1130000" "R: f1130000" "R"
439192-439942 i2s: left: "Left channel: 00000000" "Left: 00000000" "L: 00000000" "L"
439942-440693 i2s: right: "Right channel: f0f80000" "Right: f0f80000" "R: f0f80000" "R"
440693-441443 i2s: left: "Left channel: 00010000" "Left: 00010000" "L: 00010000" "L"
441443-442193 i2s: right: "Right channel: f1570000" "Right: f1570000" "R: f1570000" "R"
442193-442943 i2s: left: "Left channel: 00000000" "Left: 00000000" "L: 00000000" "L"
442943-443694 i2s: right: "Right channel: f1f00000" "Right: f1f00000" "R: f1f00000" "R"
443694-444444 i2s: left: "Left channel: 00010000" "Left: 00010000" "L: 00010000" "L"
444444-445194 i2s: right: "Right channel: f2a90000" "Right: f2a90000" "R: f2a90000" "R"
445194-445944 i2s: left: "Left channel: 00010000" "Left: 00010000" "L: 00010000" "L"
445944-446695 i2s: right: "Right channel: f3cf0000" "Right: f3cf0000" "R: f3cf0000" "R"
446695-447445 i2s: left: "Left channel: 00030000" "Left: 00030000" "L: 00030000" "L"
447445-448195 i2s: right: "Right channel: f5620000" "Right: f5620000" "R: f5620000" "R"
448195-448945 i2s: left: "Left channel: 00010000" "Left: 00010000" "L: 00010000" "L"
448945-449696 i2s: right: "Right channel: f7170000" "Right: f7170000" "R: f7170000" "R"
449696-450446 i2s: left: "Left channel: 00020000" "Left: 00020000" "L: 00020000" "L"
450446-451196 i2s: right: "Right channel: f8770000" "Right: f8770000" "R: f8770000" "R"
451196-451946 i2s: left: "Left channel: 00030000" "Left: 00030000" "L: 00030000" "L"
451946-452697 i2s: right: "Right channel: f9830000" "Right: f9830000" "R: f9830000" "R"
452697-453447 i2s: left: "Left channel: 00030000" "Left: 00030000" "L: 00030000" "L"
453447-454197 i2s: right: "Right channel: fa900000" "Right: fa900000" "R: fa900000" "R"
454197-454947 i2s: left: "Left channel: 00040000" "Left: 00040000" "L: 00040000" "L"
454947-455698 i2s: right: "Right channel: fbeb0000" "Right: fbeb0000" "R: fbeb0000" "R"
455698-456448 i2s: left: "Left channel: 00030000" "Left: 00030000" "L: 00030000" "L"
456448-457198 i2s: right: "Right channel: fd3e0000" "Right: fd3e0000" "R: fd3e0000" "R"
457198-457948 i2s: left: "Left channel: 00020000" "Left: 00020000" "L: 00020000" "L"
457948-458699 i2s: right: "Right channel: fe350000" "Right: fe350000" "R: fe350000" "R"
458699-459449 i2s: left: "Left channel: 00010000" "Left: 00010000" "L: 00010000" "L"
459449-460199 i2s: right: "Right channel: fec70000" "Right: fec70000" "R: fec70000" "R"
460199-460949 i2s: left: "Left channel: 00010000" "Left: 00010000" "L: 00010000" "L"
460949-461700 i2s: right: "Right channel: ff450000" "Right: ff450000" "R: ff450000" "R"
461700-462450 i2s: left: "Left channel: 00020000" "Left: 00020000" "L: 00020000" "L"
462450-463200 i2s: right: "Right channel: 00020000" "Right: 00020000" "R: 00020000" "R"
463200-463950 i2s: left: "Left channel: 00020000" "Left: 00020000" "L: 00020000" "L"
463950-464701 i2s: right: "Right channel: 00c60000" "Right: 00c60000" "R: 00c60000" "R"
464701-465451 i2s: left: "Left channel: 00010000" "Left: 00010000" "L: 00010000" "L"
465451-466201 i2s: right: "Right channel: 01490000" "Right: 01490000" "R: 01490000" "R"
466201-466951 i2s: left: "Left channel: 00000000" "Left: 00000000" "L: 00000000" "L"
466951-467702 i2s: right: "Right channel: 01cf0000" "Right: 01cf0000" "R: 01cf0000" "R"
467702-468452 i2s: left: "Left channel: fffe0000" "Left: fffe0000" "L: fffe0000" "L"
468452-469202 i2s: right: "Right channel: 02550000" "Right: 02550000" "R: 02550000" "R"
469202-469952 i2s: left: "Left channel: 00010000" "Left: 00010000" "L: 00010000" "L"
469952-470703 i2s: right: "Right channel: 030a0000" "Right: 030a0000" "R: 030a0000" "R"
470703-471453 i2s: left: "Left channel: 00030000" "Left: 00030000" "L: 00030000" "L"
471453-472203 i2s: right: "Right channel: 03530000" "Right: 03530000" "R: 03530000" "R"
472203-472953 i2s: left: "Left channel: 00000000" "Left: 00000000" "L: 00000000" "L"
472953-473704 i2s: right: "Right channel: 038b0000" "Right: 038b0000" "R: 038b0000" "R"
473704-474454 i2s: left: "Left channel: ffff0000" "Left: ffff0000" "L: ffff0000" "L"
474454-475204 i2s: right: "Right channel: 038b0000" "Right: 038b0000" "R: 038b0000" "R"
475204-475954 i2s: left: "Left channel: fffe0000" "Left: fffe0000" "L: fffe0000" "L"
475954-476705 i2s: right: "Right channel: 03b10000" "Right: 03b10000" "R: 03b10000" "R"
476705-477455 i2s: left: "Left channel: 00010000" "Left: 00010000" "L: 00010000" "L"
477455-478205 i2s: right: "Right channel: 03c60000" "Right: 03c60000" "R: 03c60000" "R"
478205-478955 i2s: left: "Left channel: 00000000" "Left: 00000000" "L: 00000000" "L"
478955-479706 i2s: right: "Right channel: 032c0000" "Right: 032c0000" "R: 032c0000" "R"
479706-480456 i2s: left: "Left channel: ffff0000" "Left: ffff0000" "L: ffff0000" "L"
480456-481206 i2s: right: "Right channel: 025e0000" "Right: 025e0000" "R: 025e0000" "R"
481206-481956 i2s: left: "Left channel: ffff0000" "Left: ffff0000" "L: ffff0000" "L"
481956-482707 i2s: right: "Right channel: 01650000" "Right: 01650000" "R: 01650000" "R"
482707-483457 i2s: left: "Left channel: 00000000" "Left: 00000000" "L: 00000000" "L"
483457-484207 i2s: right: "Right channel: 00990000" "Right: 00990000" "R: 00990000" "R"
484207-484957 i2s: left: "Left channel: fffe0000" "Left: fffe0000" "L: fffe0000" "L"
484957-485708 i2s: right: "Right channel: ff940000" "Right: ff940000" "R: ff940000" "R"
485708-486458 i2s: left: "Left channel: fffe0000" "Left: fffe0000" "L: fffe0000" "L"
486458-487208 i2s: right: "Right channel: fe880000" "Right: fe880000" "R: fe880000" "R"
487208-487958 i2s: left: "Left channel: ffff0000" "Left: ffff0000" "L: ffff0000" "L"
487958-488709 i2s: right: "Right channel: fd1d0000" "Right: fd1d0000" "R: fd1d0000" "R"
488709-489459 i2s: left: "Left channel: ffff0000" "Left: ffff0000" "L: ffff0000" "L"
489459-490209 i2s: right: "Right channel: fc210000" "Right: fc210000" "R: fc210000" "R"
490209-490959 i2s: left: "Left channel: 00000000" "Left: 00000000" "L: 00000000" "L"
490959-491710 i2s: right: "Right channel: fb480000" "Right: fb480000" "R: fb480000" "R"
491710-492460 i2s: left: "Left channel: fffe0000" "Left: fffe0000" "L: fffe0000" "L"
492460-493210 i2s: right: "Right channel: faad0000" "Right: faad0000" "R: faad0000" "R"
493210-493960 i2s: left: "Left channel: fffe0000" "Left: fffe0000" "L: fffe0000" "L"
493960-494711 i2s: right: "Right channel: f9840000" "Right: f9840000" "R: f9840000" "R"
494711-495461 i2s: left: "Left channel: ffff0000" "Left: ffff0000" "L: ffff0000" "L"
495461-496211 i2s: right: "Right channel: f8a80000" "Right: f8a80000" "R: f8a80000" "R"
496211-496961 i2s: left: "Left channel: 00000000" "Left: 00000000" "L: 00000000" "L"
496961-497712 i2s: right: "Right channel: f9ae0000" "Right: f9ae0000" "R: f9ae0000" "R"
497712-498462 i2s: left: "Left channel: 00000000" "Left: 00000000" "L: 00000000" "L"
498462-499212 i2s: right: "Right channel: fbf10000" "Right: fbf10000" "R: fbf10000" "R"
499212-499962 i2s: left: "Left channel: 00020000" "Left: 00020000" "L: 00020000" "L"
499962-500713 i2s: right: "Right channel: fbfa0000" "Right: fbfa0000" "R: fbfa0000" "R"
500713-501463 i2s: left: "Left channel: 00020000" "Left: 00020000" "L: 00020000" "L"
501463-502213 i2s: right: "Right channel: fa960000" "Right: fa960000" "R: fa960000" "R"
502213-502963 i2s: left: "Left channel: 00010000" "Left: 00010000" "L: 00010000" "L"
502963-503714 i2s: right: "Right channel: f99a0000" "Right: f99a0000" "R: f99a0000" "R"
503714-504464 i2s: left: "Left channel: ffff0000" "Left: ffff0000" "L: ffff0000" "L"
504464-505214 i2s: right: "Right channel: fac70000" "Right: fac70000" "R: fac70000" "R"
505214-505964 i2s: left: "Left channel: 00010000" "Left: 00010000" "L: 00010000" "L"
505964-506715 i2s: right: "Right channel: fc3f0000" "Right: fc3f0000" "R: fc3f0000" "R"
506715-507465 i2s: left: "Left channel: 00010000" "Left: 00010000" "L: 00010000" "L"
507465-508215 i2s: right: "Right channel: fb820000" "Right: fb820000" "R: fb820000" "R"
508215-508965 i2s: left: "Left channel: 00010000" "Left: 00010000" "L: 00010000" "L"
508965-509716 i2s: right: "Right channel: fa240000" "Right: fa240000" "R: fa240000" "R"
509716-510466 i2s: left: "Left channel: 00020000" "Left: 00020000" "L: 00020000" "L"
510466-511216 i2s: right: "Right channel: fa6c0000" "Right: fa6c0000" "R: fa6c0000" "R"
511216-511966 i2s: left: "Left channel: fffe0000" "Left: fffe0000" "L: fffe0000" "L"
511966-512717 i2s: right: "Right channel: fb090000" "Right: fb090000" "R: fb090000" "R"
512717-513467 i2s: left: "Left channel: 00020000" "Left: 00020000" "L: 00020000" "L"
513467-514217 i2s: right: "Right channel: faa50000" "Right: faa50000" "R: faa50000" "R"
514217-514967 i2s: left: "Left channel: fffe0000" "Left: fffe0000" "L: fffe0000" "L"
514967-515718 i2s: right: "Right channel: fa400000" "Right: fa400000" "R: fa400000" "R"
515718-516468 i2s: left: "Left channel: 00020000" "Left: 00020000" "L: 00020000" "L"
516468-517218 i2s: right: "Right channel: fb7b0000" "Right: fb7b0000" "R: fb7b0000" "R"
517218-517968 i2s: left: "Left channel: 00010000" "Left: 00010000" "L: 00010000" "L"
517968-518719 i2s: right: "Right channel: fdb10000" "Right: fdb10000" "R: fdb10000" "R"
518719-519469 i2s: left: "Left channel: 00030000" "Left: 00030000" "L: 00030000" "L"
519469-520219 i2s: right: "Right channel: ff060000" "Right: ff060000" "R: ff060000" "R"
520219-520969 i2s: left: "Left channel: 00010000" "Left: 00010000" "L: 00010000" "L"
520969-521720 i2s: right: "Right channel: ffb00000" "Right: ffb00000" "R: ffb00000" "R"
521720-522470 i2s: left: "Left channel: 00020000" "Left: 00020000" "L: 00020000" "L"
522470-523220 i2s: right: "Right channel: 00610000" "Right: 00610000" "R: 00610000" "R"
523220-523970 i2s: left: "Left channel: 00010000" "Left: 00010000" "L: 00010000" "L"
523970-524721 i2s: right: "Right channel: 02150000" "Right: 02150000" "R: 02150000" "R"
524721-525471 i2s: left: "Left channel: 00030000" "Left: 00030000" "L: 00030000" "L"
525471-526221 i2s: right: "Right channel: 03a80000" "Right: 03a80000" "R: 03a80000" "R"
526221-526971 i2s: left: "Left channel: 00020000" "Left: 00020000" "L: 00020000" "L"
526971-527722 i2s: right: "Right channel: 05400000" "Right: 05400000" "R: 05400000" "R"
527722-528472 i2s: left: "Left channel: 00040000" "Left: 00040000" "L: 00040000" "L"
528472-529222 i2s: right: "Right channel: 063c0000" "Right: 063c0000" "R: 063c0000" "R"
529222-529972 i2s: left: "Left channel: 00020000" "Left: 00020000" "L: 00020000" "L"
529972-530723 i2s: right: "Right channel: 06050000" "Right: 06050000" "R: 06050000" "R"
530723-531473 i2s: left: "Left channel: 00020000" "Left: 00020000" "L: 00020000" "L"
531473-532223 i2s: right: "Right channel: 05800000" "Right: 05800000" "R: 05800000" "R"
532223-532973 i2s: left: "Left channel: 00000000" "Left: 00000000" "L: 00000000" "L"
532973-533724 i2s: right: "Right channel: 05d50000" "Right: 05d50000" "R: 05d50000" "R"
533724-534474 i2s: left: "Left channel: 00010000" "Left: 00010000" "L: 00010000" "L"
534474-535224 i2s: right: "Right channel: 05c20000" "Right: 05c20000" "R: 05c20000" "R"
535224-535974 i2s: left: "Left channel: 00020000" "Left: 00020000" "L: 00020000" "L"
535974-536725 i2s: right: "Right channel: 04ff0000" "Right: 04ff0000" "R: 04ff0000" "R"
536725-537475 i2s: left: "Left channel: 00000000" "Left: 00000000" "L: 00000000" "L"
537475-538225 i2s: right: "Right channel: 03470000" "Right: 03470000" "R: 03470000" "R"
538225-538975 i2s: left: "Left channel: 00000000" "Left: 00000000" "L: 00000000" "L"
538975-539726 i2s: right: "Right channel: 01b40000" "Right: 01b40000" "R: 01b40000" "R"
539726-540476 i2s: left: "Left channel: fffe0000" "Left: fffe0000" "L: fffe0000" "L"
540476-541226 i2s: right: "Right channel: 00770000" "Right: 00770000" "R: 00770000" "R"
541226-541976 i2s: left: "Left channel: ffff0000" "Left: ffff0000" "L: ffff0000" "L"
541976-542727 i2s: right: "Right channel: fe830000" "Right: fe830000" "R: fe830000" "R"
542727-543477 i2s: left: "Left channel: 00010000" "Left: 00010000" "L: 00010000" "L"
543477-544227 i2s: right: "Right channel: fbde0000" "Right: fbde0000" "R: fbde0000" "R"
544227-544977 i2s: left: "Left channel: fffc0000" "Left: fffc0000" "L: fffc0000" "L"
544977-545728 i2s: right: "Right channel: fa1c0000" "Right: fa1c0000" "R: fa1c0000" "R"
545728-546478 i2s: left: "Left channel: ffff0000" "Left: ffff0000" "L: ffff0000" "L"
546478-547228 i2s: right: "Right channel: f95c0000" "Right: f95c0000" "R: f95c0000" "R"
547228-547978 i2s: left: "Left channel: fffd0000" "Left: fffd0000" "L: fffd0000" "L"
547978-548729 i2s: right: "Right channel: f82f0000" "Right: f82f0000" "R: f82f0000" "R"
548729-549479 i2s: left: "Left channel: fffe0000" "Left: fffe0000" "L: fffe0000" "L"
549479-550229 i2s: right: "Right channel: f6960000" "Right: f6960000" "R: f6960000" "R"
550229-550979 i2s: left: "Left channel: fffc0000" "Left: fffc0000" "L: fffc0000" "L"
550979-551730 i2s: right: "Right channel: f57e0000" "Right: f57e0000" "R: f57e0000" "R"
551730-552480 i2s: left: "Left channel: fffe0000" "Left: fffe0000" "L: fffe0000" "L"
552480-553230 i2s: right: "Right channel: f5220000" "Right: f5220000" "R: f5220000" "R"
553230-553981 i2s: left: "Left channel: 00010000" "Left: 00010000" "L: 00010000" "L"
553981-554731 i2s: right: "Right channel: f5bb0000" "Right: f5bb0000" "R: f5bb0000" "R"
554731-555481 i2s: left: "Left channel: 00000000" "Left: 00000000" "L: 00000000" "L"
555481-556231 i2s: right: "Right channel: f6c10000" "Right: f6c10000" "R: f6c10000" "R"
556231-556982 i2s: left: "Left channel: 00020000" "Left: 00020000" "L: 00020000" "L"
556982-557732 i2s: right: "Right channel: f7a30000" "Right: f7a30000" "R: f7a30000" "R"
557732-558482 i2s: left: "Left channel: 00010000" "Left: 00010000" "L: 00010000" "L"
558482-559232 i2s: right: "Right channel: f89d0000" "Right: f89d0000" "R: f89d0000" "R"
559232-559983 i2s: left: "Left channel: 00020000" "Left: 00020000" "L: 00020000" "L"
559983-560733 i2s: right: "Right channel: f9e30000" "Right: f9e30000" "R: f9e30000" "R"
560733-561483 i2s: left: "Left channel: 00010000" "Left: 00010000" "L: 00010000" "L"
561483-562233 i2s: right: "Right channel: fbab0000" "Right: fbab0000" "R: fbab0000" "R"
562233-562984 i2s: left: "Left channel: ffff0000" "Left: ffff0000" "L: ffff0000" "L"
562984-563734 i2s: right: "Right channel: fdda0000" "Right: fdda0000" "R: fdda0000" "R"
563734-564484 i2s: left: "Left channel: 00010000" "Left: 00010000" "L: 00010000" "L"
564484-565234 i2s: right: "Right channel: ffc60000" "Right: ffc60000" "R: ffc60000" "R"
565234-565985 i2s: left: "Left channel: 00010000" "Left: 00010000" "L: 00010000" "L"
565985-566735 i2s: right: "Right channel: 01530000" "Right: 01530000" "R: 01530000" "R"
566735-567485 i2s: left: "Left channel: 00010000" "Left: 00010000" "L: 00010000" "L"
567485-568235 i2s: right: "Right channel: 03890000" "Right: 03890000" "R: 03890000" "R"
568235-568986 i2s: left: "Left channel: 00020000" "Left: 00020000" "L: 00020000" "L"
568986-569736 i2s: right: "Right channel: 06090000" "Right: 06090000" "R: 06090000" "R"
569736-570486 i2s: left: "Left channel: 00030000" "Left: 00030000" "L: 00030000" "L"
570486-571236 i2s: right: "Right channel: 07a00000" "Right: 07a00000" "R: 07a00000" "R"
571236-571987 i2s: left: "Left channel: 00020000" "Left: 00020000" "L: 00020000" "L"
571987-572737 i2s: right: "Right channel: 08cd0000" "Right: 08cd0000" "R: 08cd0000" "R"
572737-573487 i2s: left: "Left channel: 00020000" "Left: 00020000" "L: 00020000" "L"
573487-574237 i2s: right: "Right channel: 0a9b0000" "Right: 0a9b0000" "R: 0a9b0000" "R"
574237-574988 i2s: left: "Left channel: 00040000" "Left: 00040000" "L: 00040000" "L"
574988-575738 i2s: right: "Right channel: 0ce70000" "Right: 0ce70000" "R: 0ce70000" "R"
575738-576488 i2s: left: "Left channel: 00010000" "Left: 00010000" "L: 00010000" "L"
576488-577238 i2s: right: "Right channel: 0ee70000" "Right: 0ee70000" "R: 0ee70000" "R"
577238-577989 i2s: left: "Left channel: 00040000" "Left: 00040000" "L: 00040000" "L"
577989-578739 i2s: right: "Right channel: 0fcb0000" "Right: 0fcb0000" "R: 0fcb0000" "R"
578739-579489 i2s: left: "Left channel: 00020000" "Left: 00020000" "L: 00020000" "L"
579489-580239 i2s: right: "Right channel: 103b0000" "Right: 103b0000" "R: 103b0000" "R"
580239-580990 i2s: left: "Left channel: 00020000" "Left: 00020000" "L: 00020000" "L"
580990-581740 i2s: right: "Right channel: 116a0000" "Right: 116a0000" "R: 116a0000" "R"
581740-582490 i2s: left: "Left channel: 00020000" "Left: 00020000" "L: 00020000" "L"
582490-583240 i2s: right: "Right channel: 12db0000" "Right: 12db0000" "R: 12db0000" "R"
583240-583991 i2s: left: "Left channel: 00020000" "Left: 00020000" "L: 00020000" "L"
583991-584741 i2s: right: "Right channel: 13940000" "Right: 13940000" "R: 13940000" "R"
584741-585491 i2s: left: "Left channel: 00020000" "Left: 00020000" "L: 00020000" "L"
585491-586241 i2s: right: "Right channel: 13ba0000" "Right: 13ba0000" "R: 13ba0000" "R"
586241-586992 i2s: left: "Left channel: ffff0000" "Left: ffff0000" "L: ffff0000" "L"
586992-587742 i2s: right: "Right channel: 135a0000" "Right: 135a0000" "R: 135a0000" "R"
587742-588492 i2s: left: "Left channel: 00010000" "Left: 00010000" "L: 00010000" "L"
588492-589242 i2s: right: "Right channel: 12ff0000" "Right: 12ff0000" "R: 12ff0000" "R"
589242-589993 i2s: left: "Left channel: 00010000" "Left: 00010000" "L: 00010000" "L"
589993-590743 i2s: right: "Right channel: 12950000" "Right: 12950000" "R: 12950000" "R"
590743-591493 i2s: left: "Left channel: 00000000" "Left: 00000000" "L: 00000000" "L"
591493-592243 i2s: right: "Right channel: 11850000" "Right: 11850000" "R: 11850000" "R"
592243-592994 i2s: left: "Left channel: ffff0000" "Left: ffff0000" "L: ffff0000" "L"
592994-593744 i2s: right: "Right channel: 0fdd0000" "Right: 0fdd0000" "R: 0fdd0000" "R"
593744-594494 i2s: left: "Left channel: fffd0000" "Left: fffd0000" "L: fffd0000" "L"
594494-595244 i2s: right: "Right channel: 0e530000" "Right: 0e530000" "R: 0e530000" "R"
595244-595995 i2s: left: "Left channel: ffff0000" "Left: ffff0000" "L: ffff0000" "L"
595995-596745 i2s: right: "Right channel: 0cba0000" "Right: 0cba0000" "R: 0cba0000" "R"
596745-597495 i2s: left: "Left channel: fffc0000" "Left: fffc0000" "L: fffc0000" "L"
597495-598245 i2s: right: "Right channel: 0a6a0000" "Right: 0a6a0000" "R: 0a6a0000" "R"
598245-598996 i2s: left: "Left channel: fffd0000" "Left: fffd0000" "L: fffd0000" "L"
598996-599746 i2s: right: "Right channel: 07750000" "Right: 07750000" "R: 07750000" "R"
599746-600496 i2s: left: "Left channel: fffd0000" "Left: fffd0000" "L: fffd0000" "L"
600496-601246 i2s: right: "Right channel: 045d0000" "Right: 045d0000" "R: 045d0000" "R"
601246-601997 i2s: left: "Left channel: fffe0000" "Left: fffe0000" "L: fffe0000" "L"
601997-602747 i2s: right: "Right channel: 01d60000" "Right: 01d60000" "R: 01d60000" "R"
602747-603497 i2s: left: "Left channel: fffc0000" "Left: fffc0000" "L: fffc0000" "L"
603497-604247 i2s: right: "Right channel: ff900000" "Right: ff900000" "R: ff900000" "R"
604247-604998 i2s: left: "Left channel: fffd0000" "Left: fffd0000" "L: fffd0000" "L"
604998-605748 i2s: right: "Right channel: fcd40000" "Right: fcd40000" "R: fcd40000" "R"
605748-606498 i2s: left: "Left channel: fffc0000" "Left: fffc0000" "L: fffc0000" "L"
606498-607248 i2s: right: "Right channel: f97f0000" "Right: f97f0000" "R: f97f0000" "R"
607248-607999 i2s: left: "Left channel: fffd0000" "Left: fffd0000" "L: fffd0000" "L"
607999-608749 i2s: right: "Right channel: f6a80000" "Right: f6a80000" "R: f6a80000" "R"
608749-609499 i2s: left: "Left channel: fffb0000" "Left: fffb0000" "L: fffb0000" "L"
609499-610249 i2s: right: "Right channel: f48e0000" "Right: f48e0000" "R: f48e0000" "R"
610249-611000 i2s: left: "Left channel: fffd0000" "Left: fffd0000" "L: fffd0000" "L"
611000-611750 i2s: right: "Right channel: f2f40000" "Right: f2f40000" "R: f2f40000" "R"
611750-612500 i2s: left: "Left channel: fffc0000" "Left: fffc0000" "L: fffc0000" "L"
612500-613250 i2s: right: "Right channel: f1820000" "Right: f1820000" "R: f1820000" "R"
613250-614001 i2s: left: "Left channel: ffff0000" "Left: ffff0000" "L: ffff0000" "L"
614001-614751 i2s: right: "Right channel: f03d0000" "Right: f03d0000" "R: f03d0000" "R"
614751-615501 i2s: left: "Left channel: fffd0000" "Left: fffd0000" "L: fffd0000" "L"
615501-616251 i2s: right: "Right channel: ef700000" "Right: ef700000" "R: ef700000" "R"
616251-617002 i2s: left: "Left channel: 00000000" "Left: 00000000" "L: 00000000" "L"
617002-617752 i2s: right: "Right channel: ef5d0000" "Right: ef5d0000" "R: ef5d0000" "R"
617752-618502 i2s: left: "Left channel: 00010000" "Left: 00010000" "L: 00010000" "L"
618502-619252 i2s: right: "Right channel: ef9d0000" "Right: ef9d0000" "R: ef9d0000" "R"
619252-620003 i2s: left: "Left channel: ffff0000" "Left: ffff0000" "L: ffff0000" "L"
620003-620753 i2s: right: "Right channel: f0180000" "Right: f0180000" "R: f0180000" "R"
620753-621503 i2s: left: "Left channel: 00010000" "Left: 00010000" "L: 00010000" "L"
621503-622253 i2s: right: "Right channel: f1020000" "Right: f1020000" "R: f1020000" "R"
622253-623004 i2s: left: "Left channel: 00030000" "Left: 00030000" "L: 00030000" "L"
623004-623754 i2s: right: "Right channel: f2800000" "Right: f2800000" "R: f2800000" "R"
623754-624504 i2s: left: "Left channel: 00000000" "Left: 00000000" "L: 00000000" "L"
624504-625254 i2s: right: "Right channel: f4490000" "Right: f4490000" "R: f4490000" "R"
625254-626005 i2s: left: "Left channel: 00040000" "Left: 00040000" "L: 00040000" "L"
626005-626755 i2s: right: "Right channel: f5d10000" "Right: f5d10000" "R: f5d10000" "R"
626755-627505 i2s: left: "Left channel: 00020000" "Left: 00020000" "L: 00020000" "L"
627505-628255 i2s: right: "Right channel: f72d0000" "Right: f72d0000" "R: f72d0000" "R"
628255-629006 i2s: left: "Left channel: 00040000" "Left: 00040000" "L: 00040000" "L"
629006-629756 i2s: right: "Right channel: f8d40000" "Right: f8d40000" "R: f8d40000" "R"
629756-630506 i2s: left: "Left channel: 00030000" "Left: 00030000" "L: 00030000" "L"
630506-631256 i2s: right: "Right channel: fb0f0000" "Right: fb0f0000" "R: fb0f0000" "R"
631256-632007 i2s: left: "Left channel: 00040000" "Left: 00040000" "L: 00040000" "L"
632007-632757 i2s: right: "Right channel: fd5f0000" "Right: fd5f0000" "R: fd5f0000" "R"
632757-633507 i2s: left: "Left channel: 00030000" "Left: 00030000" "L: 00030000" "L"
633507-634257 i2s: right: "Right channel: ff040000" "Right: ff040000" "R: ff040000" "R"
634257-635008 i2s: left: "Left channel: 00050000" "Left: 00050000" "L: 00050000" "L"
635008-635758 i2s: right: "Right channel: 00710000" "Right: 00710000" "R: 00710000" "R"
635758-636508 i2s: left: "Left channel: 00030000" "Left: 00030000" "L: 00030000" "L"
636508-637258 i2s: right: "Right channel: 02020000" "Right: 02020000" "R: 02020000" "R"
637258-638009 i2s: left: "Left channel: 00050000" "Left: 00050000" "L: 00050000" "L"
638009-638759 i2s: right: "Right channel: 03820000" "Right: 03820000" "R: 03820000" "R"
638759-639509 i2s: left: "Left channel: 00040000" "Left: 00040000" "L: 00040000" "L"
639509-640259 i2s: right: "Right channel: 04f00000" "Right: 04f00000" "R: 04f00000" "R"
640259-641010 i2s: left: "Left channel: 00020000" "Left: 00020000" "L: 00020000" "L"
641010-641760 i2s: right: "Right channel: 05a40000" "Right: 05a40000" "R: 05a40000" "R"
641760-642510 i2s: left: "Left channel: 00010000" "Left: 00010000" "L: 00010000" "L"
642510-643260 i2s: right: "Right channel: 06320000" "Right: 06320000" "R: 06320000" "R"
643260-644011 i2s: left: "Left channel: 00040000" "Left: 00040000" "L: 00040000" "L"
644011-644761 i2s: right: "Right channel: 06a10000" "Right: 06a10000" "R: 06a10000" "R"
644761-645511 i2s: left: "Left channel: 00010000" "Left: 00010000" "L: 00010000" "L"
645511-646261 i2s: right: "Right channel: 06cc0000" "Right: 06cc0000" "R: 06cc0000" "R"
646261-647012 i2s: left: "Left channel: 00010000" "Left: 00010000" "L: 00010000" "L"
647012-647762 i2s: right: "Right channel: 069b0000" "Right: 069b0000" "R: 069b0000" "R"
647762-648512 i2s: left: "Left channel: 00010000" "Left: 00010000" "L: 00010000" "L"
648512-649262 i2s: right: "Right channel: 05f10000" "Right: 05f10000" "R: 05f10000" "R"
649262-650013 i2s: left: "Left channel: 00000000" "Left: 00000000" "L: 00000000" "L"
650013-650763 i2s: right: "Right channel: 05460000" "Right: 05460000" "R: 05460000" "R"
650763-651513 i2s: left: "Left channel: 00000000" "Left: 00000000" "L: 00000000" "L"
651513-652263 i2s: right: "Right channel: 044d0000" "Right: 044d0000" "R: 044d0000" "R"
652263-653014 i2s: left: "Left channel: fffe0000" "Left: fffe0000" "L: fffe0000" "L"
653014-653764 i2s: right: "Right channel: 03820000" "Right: 03820000" "R: 03820000" "R"
653764-654514 i2s: left: "Left channel: 00000000" "Left: 00000000" "L: 00000000" "L"
654514-655264 i2s: right: "Right channel: 02110000" "Right: 02110000" "R: 02110000" "R"
655264-656015 i2s: left: "Left channel: fffe0000" "Left: fffe0000" "L: fffe0000" "L"
656015-656765 i2s: right: "Right channel: 008f0000" "Right: 008f0000" "R: 008f0000" "R"
656765-657515 i2s: left: "Left channel: fffd0000" "Left: fffd0000" "L: fffd0000" "L"
657515-658265 i2s: right: "Right channel: ff300000" "Right: ff300000" "R: ff300000" "R"
658265-659016 i2s: left: "Left channel: fffe0000" "Left: fffe0000" "L: fffe0000" "L"
659016-659766 i2s: right: "Right channel: fde70000" "Right: fde70000" "R: fde70000" "R"
659766-660516 i2s: left: "Left channel: fffc0000" "Left: fffc0000" "L: fffc0000" "L"
660516-661266 i2s: right: "Right channel: fcf60000" "Right: fcf60000" "R: fcf60000" "R"
661266-662017 i2s: left: "Left channel: fffe0000" "Left: fffe0000" "L: fffe0000" "L"
662017-662767 i2s: right: "Right channel: fb890000" "Right: fb890000" "R: fb890000" "R"
662767-663517 i2s: left: "Left channel: fffd0000" "Left: fffd0000" "L: fffd0000" "L"
663517-664268 i2s: right: "Right channel: fa520000" "Right: fa520000" "R: fa520000" "R"
664268-665018 i2s: left: "Left channel: fffe0000" "Left: fffe0000" "L: fffe0000" "L"
665018-665768 i2s: right: "Right channel: f93c0000" "Right: f93c0000" "R: f93c0000" "R"
665768-666518 i2s: left: "Left channel: ffff0000" "Left: ffff0000" "L: ffff0000" "L"
666518-667268 i2s: right: "Right channel: f83e0000" "Right: f83e0000" "R: f83e0000" "R"
667268-668019 i2s: left: "Left channel: fffe0000" "Left: fffe0000" "L: fffe0000" "L"
668019-668769 i2s: right: "Right channel: f8100000" "Right: f8100000" "R: f8100000" "R"
668769-669519 i2s: left: "Left channel: ffff0000" "Left: ffff0000" "L: ffff0000" "L"
669519-670270 i2s: right: "Right channel: f9020000" "Right: f9020000" "R: f9020000" "R"
670270-671020 i2s: left: "Left channel: 00000000" "Left: 00000000" "L: 00000000" "L"
671020-671770 i2s: right: "Right channel: f9750000" "Right: f9750000" "R: f9750000" "R"
671770-672520 i2s: left: "Left channel: 00020000" "Left: 00020000" "L: 00020000" "L"
672520-673271 i2s: right: "Right channel: f8800000" "Right: f8800000" "R: f8800000" "R"
673271-674021 i2s: left: "Left channel: ffff0000" "Left: ffff0000" "L: ffff0000" "L"
674021-674771 i2s: right: "Right channel: f7750000" "Right: f7750000" "R: f7750000" "R"
674771-675521 i2s: left: "Left channel: 00020000" "Left: 00020000" "L: 00020000" "L"
675521-676272 i2s: right: "Right channel: f71b0000" "Right: f71b0000" "R: f71b0000" "R"
676272-677022 i2s: left: "Left channel: 00000000" "Left: 00000000" "L: 00000000" "L"
677022-677772 i2s: right: "Right channel: f80d0000" "Right: f80d0000" "R: f80d0000" "R"
677772-678522 i2s: left: "Left channel: 00000000" "Left: 00000000" "L: 00000000" "L"
678522-679273 i2s: right: "Right channel: f8170000" "Right: f8170000" "R: f8170000" "R"
679273-680023 i2s: left: "Left channel: 00010000" "Left: 00010000" "L: 00010000" "L"
680023-680773 i2s: right: "Right channel: f77e0000" "Right: f77e0000" "R: f77e0000" "R"
680773-681523 i2s: left: "Left channel: 00030000" "Left: 00030000" "L: 00030000" "L"
681523-682274 i2s: right: "Right channel: f75b0000" "Right: f75b0000" "R: f75b0000" "R"
682274-683024 i2s: left: "Left channel: ffff0000" "Left: ffff0000" "L: ffff0000" "L"
683024-683774 i2s: right: "Right channel: f8390000" "Right: f8390000" "R: f8390000" "R"
683774-684524 i2s: left: "Left channel: 00030000" "Left: 00030000" "L: 00030000" "L"
684524-685275 i2s: right: "Right channel: f86a0000" "Right: f86a0000" "R: f86a0000" "R"
685275-686025 i2s: left: "Left channel: 00000000" "Left: 00000000" "L: 00000000" "L"
686025-686775 i2s: right: "Right channel: f9060000" "Right: f9060000" "R: f9060000" "R"
686775-687525 i2s: left: "Left channel: 00010000" "Left: 00010000" "L: 00010000" "L"
687525-688276 i2s: right: "Right channel: fa170000" "Right: fa170000" "R: fa170000" "R"
688276-689026 i2s: left: "Left channel: 00020000" "Left: 00020000" "L: 00020000" "L"
689026-689776 i2s: right: "Right channel: fcd70000" "Right: fcd70000" "R: fcd70000" "R"
689776-690526 i2s: left: "Left channel: 00020000" "Left: 00020000" "L: 00020000" "L"
690526-691277 i2s: right: "Right channel: febf0000" "Right: febf0000" "R: febf0000" "R"
691277-692027 i2s: left: "Left channel: 00020000" "Left: 00020000" "L: 00020000" "L"
692027-692777 i2s: right: "Right channel: 00950000" "Right: 00950000" "R: 00950000" "R"
692777-693527 i2s: left: "Left channel: 00040000" "Left: 00040000" "L: 00040000" "L"
693527-694278 i2s: right: "Right channel: 01f10000" "Right: 01f10000" "R: 01f10000" "R"
694278-695028 i2s: left: "Left channel: 00020000" "Left: 00020000" "L: 00020000" "L"
695028-695778 i2s: right: "Right channel: 042a0000" "Right: 042a0000" "R: 042a0000" "R"
695778-696528 i2s: left: "Left channel: 00020000" "Left: 00020000" "L: 00020000" "L"
696528-697279 i2s: right: "Right channel: 05f80000" "Right: 05f80000" "R: 05f80000" "R"
697279-698029 i2s: left: "Left channel: 00020000" "Left: 00020000" "L: 00020000" "L"
698029-698779 i2s: right: "Right channel: 07a20000" "Right: 07a20000" "R: 07a20000" "R"
698779-699529 i2s: left: "Left channel: 00030000" "Left: 00030000" "L: 00030000" "L"
699529-700280 i2s: right: "Right channel: 08fe0000" "Right: 08fe0000" "R: 08fe0000" "R"
700280-701030 i2s: left: "Left channel: 00020000" "Left: 00020000" "L: 00020000" "L"
701030-701780 i2s: right: "Right channel: 09940000" "Right: 09940000" "R: 09940000" "R"
701780-702530 i2s: left: "Left channel: 00020000" "Left: 00020000" "L: 00020000" "L"
702530-703281 i2s: right: "Right channel: 091d0000" "Right: 091d0000" "R: 091d0000" "R"
703281-704031 i2s: left: "Left channel: 00000000" "Left: 00000000" "L: 00000000" "L"
704031-704781 i2s: right: "Right channel: 08b80000" "Right: 08b80000" "R: 08b80000" "R"
704781-705531 i2s: left: "Left channel: 00010000" "Left: 00010000" "L: 00010000" "L"
705531-706282 i2s: right: "Right channel: 07c00000" "Right: 07c00000" "R: 07c00000" "R"
706282-707032 i2s: left: "Left channel: 00030000" "Left: 00030000" "L: 00030000" "L"
707032-707782 i2s: right: "Right channel: 06a70000" "Right: 06a70000" "R: 06a70000" "R"
707782-708532 i2s: left: "Left channel: 00000000" "Left: 00000000" "L: 00000000" "L"
708532-709283 i2s: right: "Right channel: 04e90000" "Right: 04e90000" "R: 04e90000" "R"
709283-710033 i2s: left: "Left channel: fffd0000" "Left: fffd0000" "L: fffd0000" "L"
710033-710783 i2s: right: "Right channel: 02b10000" "Right: 02b10000" "R: 02b10000" "R"
710783-711533 i2s: left: "Left channel: ffff0000" "Left: ffff0000" "L: ffff0000" "L"
711533-712284 i2s: right: "Right channel: 004e0000" "Right: 004e0000" "R: 004e0000" "R"
712284-713034 i2s: left: "Left channel: fffc0000" "Left: fffc0000" "L: fffc0000" "L"
713034-713784 i2s: right: "Right channel: fde50000" "Right: fde50000" "R: fde50000" "R"
713784-714534 i2s: left: "Left channel: fffe0000" "Left: fffe0000" "L: fffe0000" "L"
714534-715285 i2s: right: "Right channel: fb390000" "Right: fb390000" "R: fb390000" "R"
715285-716035 i2s: left: "Left channel: fffc0000" "Left: fffc0000" "L: fffc0000" "L"
716035-716785 i2s: right: "Right channel: f9120000" "Right: f9120000" "R: f9120000" "R"
716785-717535 i2s: left: "Left channel: fffd0000" "Left: fffd0000" "L: fffd0000" "L"
717535-718286 i2s: right: "Right channel: f7c60000" "Right: f7c60000" "R: f7c60000" "R"
718286-719036 i2s: left: "Left channel: ffff0000" "Left: ffff0000" "L: ffff0000" "L"
719036-719786 i2s: right: "Right channel: f64e0000" "Right: f64e0000" "R: f64e0000" "R"
719786-720536 i2s: left: "Left channel: ffff0000" "Left: ffff0000" "L: ffff0000" "L"
720536-721287 i2s: right: "Right channel: f4e80000" "Right: f4e80000" "R: f4e80000" "R"
721287-722037 i2s: left: "Left channel: ffff0000" "Left: ffff0000" "L: ffff0000" "L"
722037-722787 i2s: right: "Right channel: f4300000" "Right: f4300000" "R: f4300000" "R"
722787-723537 i2s: left: "Left channel: fffe0000" "Left: fffe0000" "L: fffe0000" "L"
723537-724288 i2s: right: "Right channel: f3fb0000" "Right: f3fb0000" "R: f3fb0000" "R"
724288-725038 i2s: left: "Left channel: 00000000" "Left: 00000000" "L: 00000000" "L"
725038-725788 i2s: right: "Right channel: f4860000" "Right: f4860000" "R: f4860000" "R"
725788-726538 i2s: left: "Left channel: 00010000" "Left: 00010000" "L: 00010000" "L"
726538-727289 i2s: right: "Right channel: f5850000" "Right: f5850000" "R: f5850000" "R"
727289-728039 i2s: left: "Left channel: 00000000" "Left: 00000000" "L: 00000000" "L"
728039-728789 i2s: right: "Right channel: f6a30000" "Right: f6a30000" "R: f6a30000" "R"
728789-729539 i2s: left: "Left channel: 00010000" "Left: 00010000" "L: 00010000" "L"
729539-730290 i2s: right: "Right channel: f7c70000" "Right: f7c70000" "R: f7c70000" "R"
730290-731040 i2s: left: "Left channel: 00030000" "Left: 00030000" "L: 00030000" "L"
731040-731790 i2s: right: "Right channel: f93b0000" "Right: f93b0000" "R: f93b0000" "R"
731790-732540 i2s: left: "Left channel: 00030000" "Left: 00030000" "L: 00030000" "L"
732540-733291 i2s: right: "Right channel: fac60000" "Right: fac60000" "R: fac60000" "R"
733291-734041 i2s: left: "Left channel: 00010000" "Left: 00010000" "L: 00010000" "L"
734041-734791 i2s: right: "Right channel: fca70000" "Right: fca70000" "R: fca70000" "R"
734791-735541 i2s: left: "Left channel: 00000000" "Left: 00000000" "L: 00000000" "L"
735541-736292 i2s: right: "Right channel: fe900000" "Right: fe900000" "R: fe900000" "R"
736292-737042 i2s: left: "Left channel: 00030000" "Left: 00030000" "L: 00030000" "L"
737042-737792 i2s: right: "Right channel: 002f0000" "Right: 002f0000" "R: 002f0000" "R"
737792-738542 i2s: left: "Left channel: 00030000" "Left: 00030000" "L: 00030000" "L"
738542-739293 i2s: right: "Right channel: 020c0000" "Right: 020c0000" "R: 020c0000" "R"
739293-740043 i2s: left: "Left channel: 00020000" "Left: 00020000" "L: 00020000" "L"
740043-740793 i2s: right: "Right channel: 04220000" "Right: 04220000" "R: 04220000" "R"
740793-741543 i2s: left: "Left channel: 00030000" "Left: 00030000" "L: 00030000" "L"
741543-742294 i2s: right: "Right channel: 05c00000" "Right: 05c00000" "R: 05c00000" "R"
742294-743044 i2s: left: "Left channel: 00030000" "Left: 00030000" "L: 00030000" "L"
743044-743794 i2s: right: "Right channel: 07540000" "Right: 07540000" "R: 07540000" "R"
743794-744544 i2s: left: "Left channel: 00030000" "Left: 00030000" "L: 00030000" "L"
744544-745295 i2s: right: "Right channel: 09390000" "Right: 09390000" "R: 09390000" "R"
745295-746045 i2s: left: "Left channel: 00020000" "Left: 00020000" "L: 00020000" "L"
746045-746795 i2s: right: "Right channel: 0b3e0000" "Right: 0b3e0000" "R: 0b3e0000" "R"
746795-747545 i2s: left: "Left channel: 00020000" "Left: 00020000" "L: 00020000" "L"
747545-748296 i2s: right: "Right channel: 0d5a0000" "Right: 0d5a0000" "R: 0d5a0000" "R"
748296-749046 i2s: left: "Left channel: 00040000" "Left: 00040000" "L: 00040000" "L"
749046-749796 i2s: right: "Right channel: 0ef10000" "Right: 0ef10000" "R: 0ef10000" "R"
749796-750546 i2s: left: "Left channel: 00030000" "Left: 00030000" "L: 00030000" "L"
750546-751297 i2s: right: "Right channel: 0fd50000" "Right: 0fd50000" "R: 0fd50000" "R"
751297-752047 i2s: left: "Left channel: 00030000" "Left: 00030000" "L: 00030000" "L"
752047-752797 i2s: right: "Right channel: 10ef0000" "Right: 10ef0000" "R: 10ef0000" "R"
752797-753547 i2s: left: "Left channel: 00020000" "Left: 00020000" "L: 00020000" "L"
753547-754298 i2s: right: "Right channel: 12780000" "Right: 12780000" "R: 12780000" "R"
754298-755048 i2s: left: "Left channel: 00000000" "Left: 00000000" "L: 00000000" "L"
755048-755798 i2s: right: "Right channel: 13890000" "Right: 13890000" "R: 13890000" "R"
755798-756548 i2s: left: "Left channel: 00010000" "Left: 00010000" "L: 00010000" "L"
756548-757299 i2s: right: "Right channel: 142f0000" "Right: 142f0000" "R: 142f0000" "R"
757299-758049 i2s: left: "Left channel: 00010000" "Left: 00010000" "L: 00010000" "L"
758049-758799 i2s: right: "Right channel: 14480000" "Right: 14480000" "R: 14480000" "R"
758799-759549 i2s: left: "Left channel: 00010000" "Left: 00010000" "L: 00010000" "L"
759549-760300 i2s: right: "Right channel: 140d0000" "Right: 140d0000" "R: 140d0000" "R"
760300-761050 i2s: left: "Left channel: 00000000" "Left: 00000000" "L: 00000000" "L"
761050-761800 i2s: right: "Right channel: 13d20000" "Right: 13d20000" "R: 13d20000" "R"
761800-762550 i2s: left: "Left channel: fffd0000" "Left: fffd0000" "L: fffd0000" "L"
762550-763301 i2s: right: "Right channel: 134d0000" "Right: 134d0000" "R: 134d0000" "R"
763301-764051 i2s: left: "Left channel: fffd0000" "Left: fffd0000" "L: fffd0000" "L"
764051-764801 i2s: right: "Right channel: 122a0000" "Right: 122a0000" "R: 122a0000" "R"
764801-765551 i2s: left: "Left channel: fffd0000" "Left: fffd0000" "L: fffd0000" "L"
765551-766302 i2s: right: "Right channel: 10f00000" "Right: 10f00000" "R: 10f00000" "R"
766302-767052 i2s: left: "Left channel: fffe0000" "Left: fffe0000" "L: fffe0000" "L"
767052-767802 i2s: right: "Right channel: 0f320000" "Right: 0f320000" "R: 0f320000" "R"
767802-768552 i2s: left: "Left channel: fffe0000" "Left: fffe0000" "L: fffe0000" "L"
768552-769303 i2s: right: "Right channel: 0d020000" "Right: 0d020000" "R: 0d020000" "R"
769303-770053 i2s: left: "Left channel: fffb0000" "Left: fffb0000" "L: fffb0000" "L"
770053-770803 i2s: right: "Right channel: 0a370000" "Right: 0a370000" "R: 0a370000" "R"
770803-771553 i2s: left: "Left channel: fffc0000" "Left: fffc0000" "L: fffc0000" "L"
771553-772304 i2s: right: "Right channel: 07470000" "Right: 07470000" "R: 07470000" "R"
772304-773054 i2s: left: "Left channel: fffc0000" "Left: fffc0000" "L: fffc0000" "L"
773054-773804 i2s: right: "Right channel: 045f0000" "Right: 045f0000" "R: 045f0000" "R"
773804-774554 i2s: left: "Left channel: fffc0000" "Left: fffc0000" "L: fffc0000" "L"
774554-775305 i2s: right: "Right channel: 01b00000" "Right: 01b00000" "R: 01b00000" "R"
775305-776055 i2s: left: "Left channel: fffa0000" "Left: fffa0000" "L: fffa0000" "L"
776055-776805 i2s: right: "Right channel: fe980000" "Right: fe980000" "R: fe980000" "R"
776805-777555 i2s: left: "Left channel: fffa0000" "Left: fffa0000" "L: fffa0000" "L"
777555-778306 i2s: right: "Right channel: fb400000" "Right: fb400000" "R: fb400000" "R"
778306-779056 i2s: left: "Left channel: fffb0000" "Left: fffb0000" "L: fffb0000" "L"
779056-779806 i2s: right: "Right channel: f8020000" "Right: f8020000" "R: f8020000" "R"
779806-780556 i2s: left: "Left channel: fffe0000" "Left: fffe0000" "L: fffe0000" "L"
780556-781307 i2s: right: "Right channel: f5470000" "Right: f5470000" "R: f5470000" "R"
781307-782057 i2s: left: "Left channel: fff80000" "Left: fff80000" "L: fff80000" "L"
782057-782807 i2s: right: "Right channel: f30f0000" "Right: f30f0000" "R: f30f0000" "R"
782807-783557 i2s: left: "Left channel: fffd0000" "Left: fffd0000" "L: fffd0000" "L"
783557-784308 i2s: right: "Right channel: f14c0000" "Right: f14c0000" "R: f14c0000" "R"
784308-785058 i2s: left: "Left channel: fffc0000" "Left: fffc0000" "L: fffc0000" "L"
785058-785808 i2s: right: "Right channel: efc40000" "Right: efc40000" "R: efc40000" "R"
785808-786558 i2s: left: "Left channel: fffe0000" "Left: fffe0000" "L: fffe0000" "L"
786558-787309 i2s: right: "Right channel: eea70000" "Right: eea70000" "R: eea70000" "R"
787309-788059 i2s: left: "Left channel: ffff0000" "Left: ffff0000" "L: ffff0000" "L"
788059-788809 i2s: right: "Right channel: ee110000" "Right: ee110000" "R: ee110000" "R"
788809-789560 i2s: left: "Left channel: fffd0000" "Left: fffd0000" "L: fffd0000" "L"
789560-790310 i2s: right: "Right channel: ee2a0000" "Right: ee2a0000" "R: ee2a0000" "R"
790310-791060 i2s: left: "Left channel: ffff0000" "Left: ffff0000" "L: ffff0000" "L"
791060-791810 i2s: right: "Right channel: eeed0000" "Right: eeed0000" "R: eeed0000" "R"
791810-792561 i2s: left: "Left channel: 00000000" "Left: 00000000" "L: 00000000" "L"
792561-793311 i2s: right: "Right channel: f02f0000" "Right: f02f0000" "R: f02f0000" "R"
793311-794061 i2s: left: "Left channel: 00020000" "Left: 00020000" "L: 00020000" "L"
794061-794811 i2s: right: "Right channel: f1b90000" "Right: f1b90000" "R: f1b90000" "R"
794811-795562 i2s: left: "Left channel: 00010000" "Left: 00010000" "L: 00010000" "L"
795562-796312 i2s: right: "Right channel: f3710000" "Right: f3710000" "R: f3710000" "R"
796312-797062 i2s: left: "Left channel: 00010000" "Left: 00010000" "L: 00010000" "L"
797062-797812 i2s: right: "Right channel: f5490000" "Right: f5490000" "R: f5490000" "R"
797812-798563 i2s: left: "Left channel: 00020000" "Left: 00020000" "L: 00020000" "L"
798563-799313 i2s: right: "Right channel: f72e0000" "Right: f72e0000" "R: f72e0000" "R"
799313-800063 i2s: left: "Left channel: 00020000" "Left: 00020000" "L: 00020000" "L"
800063-800813 i2s: right: "Right channel: f9250000" "Right: f9250000" "R: f9250000" "R"
800813-801564 i2s: left: "Left channel: 00030000" "Left: 00030000" "L: 00030000" "L"
801564-802314 i2s: right: "Right channel: fb2e0000" "Right: fb2e0000" "R: fb2e0000" "R"
802314-803064 i2s: left: "Left channel: 00040000" "Left: 00040000" "L: 00040000" "L"
803064-803814 i2s: right: "Right channel: fd190000" "Right: fd190000" "R: fd190000" "R"
803814-804565 i2s: left: "Left channel: 00030000" "Left: 00030000" "L: 00030000" "L"
804565-805315 i2s: right: "Right channel: ff100000" "Right: ff100000" "R: ff100000" "R"
805315-806065 i2s: left: "Left channel: 00050000" "Left: 00050000" "L: 00050000" "L"
806065-806815 i2s: right: "Right channel: 00bf0000" "Right: 00bf0000" "R: 00bf0000" "R"
806815-807566 i2s: left: "Left channel: 00030000" "Left: 00030000" "L: 00030000" "L"
807566-808316 i2s: right: "Right channel: 01fc0000" "Right: 01fc0000" "R: 01fc0000" "R"
808316-809066 i2s: left: "Left channel: 00030000" "Left: 00030000" "L: 00030000" "L"
809066-809816 i2s: right: "Right channel: 03030000" "Right: 03030000" "R: 03030000" "R"
809816-810567 i2s: left: "Left channel: 00030000" "Left: 00030000" "L: 00030000" "L"
810567-811317 i2s: right: "Right channel: 046c0000" "Right: 046c0000" "R: 046c0000" "R"
811317-812067 i2s: left: "Left channel: 00020000" "Left: 00020000" "L: 00020000" "L"
812067-812817 i2s: right: "Right channel: 053f0000" "Right: 053f0000" "R: 053f0000" "R"
812817-813568 i2s: left: "Left channel: 00020000" "Left: 00020000" "L: 00020000" "L"
813568-814318 i2s: right: "Right channel: 061d0000" "Right: 061d0000" "R: 061d0000" "R"
814318-815068 i2s: left: "Left channel: 00030000" "Left: 00030000" "L: 00030000" "L"
815068-815818 i2s: right: "Right channel: 06740000" "Right: 06740000" "R: 06740000" "R"
815818-816569 i2s: left: "Left channel: 00030000" "Left: 00030000" "L: 00030000" "L"
816569-817319 i2s: right: "Right channel: 06870000" "Right: 06870000" "R: 06870000" "R"
817319-818069 i2s: left: "Left channel: 00010000" "Left: 00010000" "L: 00010000" "L"
818069-818819 i2s: right: "Right channel: 068a0000" "Right: 068a0000" "R: 068a0000" "R"
818819-819570 i2s: left: "Left channel: 00030000" "Left: 00030000" "L: 00030000" "L"
819570-820320 i2s: right: "Right channel: 06730000" "Right: 06730000" "R: 06730000" "R"
820320-821070 i2s: left: "Left channel: 00010000" "Left: 00010000" "L: 00010000" "L"
821070-821820 i2s: right: "Right channel: 05de0000" "Right: 05de0000" "R: 05de0000" "R"
821820-822571 i2s: left: "Left channel: 00020000" "Left: 00020000" "L: 00020000" "L"
822571-823321 i2s: right: "Right channel: 05170000" "Right: 05170000" "R: 05170000" "R"
823321-824071 i2s: left: "Left channel: 00000000" "Left: 00000000" "L: 00000000" "L"
824071-824821 i2s: right: "Right channel: 04c30000" "Right: 04c30000" "R: 04c30000" "R"
824821-825572 i2s: left: "Left channel: 00000000" "Left: 00000000" "L: 00000000" "L"
825572-826322 i2s: right: "Right channel: 037e0000" "Right: 037e0000" "R: 037e0000" "R"
826322-827072 i2s: left: "Left channel: ffff0000" "Left: ffff0000" "L: ffff0000" "L"
827072-827822 i2s: right: "Right channel: 02890000" "Right: 02890000" "R: 02890000" "R"
827822-828573 i2s: left: "Left channel: 00010000" "Left: 00010000" "L: 00010000" "L"
828573-829323 i2s: right: "Right channel: 010d0000" "Right: 010d0000" "R: 010d0000" "R"
829323-830073 i2s: left: "Left channel: ffff0000" "Left: ffff0000" "L: ffff0000" "L"
830073-830823 i2s: right: "Right channel: ffd10000" "Right: ffd10000" "R: ffd10000" "R"
830823-831574 i2s: left: "Left channel: fffe0000" "Left: fffe0000" "L: fffe0000" "L"
831574-832324 i2s: right: "Right channel: fe3a0000" "Right: fe3a0000" "R: fe3a0000" "R"
832324-833074 i2s: left: "Left channel: ffff0000" "Left: ffff0000" "L: ffff0000" "L"
833074-833824 i2s: right: "Right channel: fcfa0000" "Right: fcfa0000" "R: fcfa0000" "R"
833824-834575 i2s: left: "Left channel: fffc0000" "Left: fffc0000" "L: fffc0000" "L"
834575-835325 i2s: right: "Right channel: fb4a0000" "Right: fb4a0000" "R: fb4a0000" "R"
835325-836075 i2s: left: "Left channel: 00000000" "Left: 00000000" "L: 00000000" "L"
836075-836825 i2s: right: "Right channel: f96f0000" "Right: f96f0000" "R: f96f0000" "R"
836825-837576 i2s: left: "Left channel: fffd0000" "Left: fffd0000" "L: fffd0000" "L"
837576-838326 i2s: right: "Right channel: f8dd0000" "Right: f8dd0000" "R: f8dd0000" "R"
838326-839076 i2s: left: "Left channel: 00000000" "Left: 00000000" "L: 00000000" "L"
839076-839826 i2s: right: "Right channel: f8f30000" "Right: f8f30000" "R: f8f30000" "R"
839826-840577 i2s: left: "Left channel: ffff0000" "Left: ffff0000" "L: ffff0000" "L"
840577-841327 i2s: right: "Right channel: f7da0000" "Right: f7da0000" "R: f7da0000" "R"
841327-842077 i2s: left: "Left channel: ffff0000" "Left: ffff0000" "L: ffff0000" "L"
842077-842827 i2s: right: "Right channel: f69a0000" "Right: f69a0000" "R: f69a0000" "R"
842827-843578 i2s: left: "Left channel: fffe0000" "Left: fffe0000" "L: fffe0000" "L"
843578-844328 i2s: right: "Right channel: f5380000" "Right: f5380000" "R: f5380000" "R"
844328-845078 i2s: left: "Left channel: fffe0000" "Left: fffe0000" "L: fffe0000" "L"
845078-845828 i2s: right: "Right channel: f51a0000" "Right: f51a0000" "R: f51a0000" "R"
845828-846579 i2s: left: "Left channel: ffff0000" "Left: ffff0000" "L: ffff0000" "L"
846579-847329 i2s: right: "Right channel: f5a50000" "Right: f5a50000" "R: f5a50000" "R"
847329-848079 i2s: left: "Left channel: ffff0000" "Left: ffff0000" "L: ffff0000" "L"
848079-848829 i2s: right: "Right channel: f5980000" "Right: f5980000" "R: f5980000" "R"
848829-849580 i2s: left: "Left channel: ffff0000" "Left: ffff0000" "L: ffff0000" "L"
849580-850330 i2s: right: "Right channel: f5320000" "Right: f5320000" "R: f5320000" "R"
850330-851080 i2s: left: "Left channel: fffd0000" "Left: fffd0000" "L: fffd0000" "L"
851080-851830 i2s: right: "Right channel: f5890000" "Right: f5890000" "R: f5890000" "R"
851830-852581 i2s: left: "Left channel: ffff0000" "Left: ffff0000" "L: ffff0000" "L"
852581-853331 i2s: right: "Right channel: f6a90000" "Right: f6a90000" "R: f6a90000" "R"
853331-854081 i2s: left: "Left channel: ffff0000" "Left: ffff0000" "L: ffff0000" "L"
854081-854831 i2s: right: "Right channel: f7b10000" "Right: f7b10000" "R: f7b10000" "R"
854831-855582 i2s: left: "Left channel: 00020000" "Left: 00020000" "L: 00020000" "L"
855582-856332 i2s: right: "Right channel: f91a0000" "Right: f91a0000" "R: f91a0000" "R"
856332-857082 i2s: left: "Left channel: 00030000" "Left: 00030000" "L: 00030000" "L"
857082-857832 i2s: right: "Right channel: faf10000" "Right: faf10000" "R: faf10000" "R"
857832-858583 i2s: left: "Left channel: 00000000" "Left: 00000000" "L: 00000000" "L"
858583-859333 i2s: right: "Right channel: fcf10000" "Right: fcf10000" "R: fcf10000" "R"
859333-860083 i2s: left: "Left channel: 00040000" "Left: 00040000" "L: 00040000" "L"
860083-860833 i2s: right: "Right channel: fef00000" "Right: fef00000" "R: fef00000" "R"
860833-861584 i2s: left: "Left channel: 00020000" "Left: 00020000" "L: 00020000" "L"
861584-862334 i2s: right: "Right channel: 00c60000" "Right: 00c60000" "R: 00c60000" "R"
862334-863084 i2s: left: "Left channel: 00050000" "Left: 00050000" "L: 00050000" "L"
863084-863834 i2s: right: "Right channel: 02a40000" "Right: 02a40000" "R: 02a40000" "R"
863834-864585 i2s: left: "Left channel: 00030000" "Left: 00030000" "L: 00030000" "L"
864585-865335 i2s: right: "Right channel: 049e0000" "Right: 049e0000" "R: 049e0000" "R"
865335-866085 i2s: left: "Left channel: 00030000" "Left: 00030000" "L: 00030000" "L"
866085-866835 i2s: right: "Right channel: 062c0000" "Right: 062c0000" "R: 062c0000" "R"
866835-867586 i2s: left: "Left channel: 00030000" "Left: 00030000" "L: 00030000" "L"
867586-868336 i2s: right: "Right channel: 077a0000" "Right: 077a0000" "R: 077a0000" "R"
868336-869086 i2s: left: "Left channel: 00030000" "Left: 00030000" "L: 00030000" "L"
869086-869836 i2s: right: "Right channel: 08730000" "Right: 08730000" "R: 08730000" "R"
869836-870587 i2s: left: "Left channel: 00030000" "Left: 00030000" "L: 00030000" "L"
870587-871337 i2s: right: "Right channel: 08af0000" "Right: 08af0000" "R: 08af0000" "R"
871337-872087 i2s: left: "Left channel: 00010000" "Left: 00010000" "L: 00010000" "L"
872087-872837 i2s: right: "Right channel: 08630000" "Right: 08630000" "R: 08630000" "R"
872837-873588 i2s: left: "Left channel: 00010000" "Left: 00010000" "L: 00010000" "L"
873588-874338 i2s: right: "Right channel: 07f20000" "Right: 07f20000" "R: 07f20000" "R"
874338-875088 i2s: left: "Left channel: ffff0000" "Left: ffff0000" "L: ffff0000" "L"
875088-875838 i2s: right: "Right channel: 072f0000" "Right: 072f0000" "R: 072f0000" "R"
875838-876589 i2s: left: "Left channel: 00000000" "Left: 00000000" "L: 00000000" "L"
876589-877339 i2s: right: "Right channel: 060a0000" "Right: 060a0000" "R: 060a0000" "R"
877339-878089 i2s: left: "Left channel: ffff0000" "Left: ffff0000" "L: ffff0000" "L"
878089-878839 i2s: right: "Right channel: 04710000" "Right: 04710000" "R: 04710000" "R"
878839-879590 i2s: left: "Left channel: fffe0000" "Left: fffe0000" "L: fffe0000" "L"
879590-880340 i2s: right: "Right channel: 024d0000" "Right: 024d0000" "R: 024d0000" "R"
880340-881090 i2s: left: "Left channel: ffff0000" "Left: ffff0000" "L: ffff0000" "L"
881090-881840 i2s: right: "Right channel: 00510000" "Right: 00510000" "R: 00510000" "R"
881840-882591 i2s: left: "Left channel: fffe0000" "Left: fffe0000" "L: fffe0000" "L"
882591-883341 i2s: right: "Right channel: fe870000" "Right: fe870000" "R: fe870000" "R"
883341-884091 i2s: left: "Left channel: fffe0000" "Left: fffe0000" "L: fffe0000" "L"
884091-884841 i2s: right: "Right channel: fcb60000" "Right: fcb60000" "R: fcb60000" "R"
884841-885592 i2s: left: "Left channel: fffe0000" "Left: fffe0000" "L: fffe0000" "L"
885592-886342 i2s: right: "Right channel: fb1c0000" "Right: fb1c0000" "R: fb1c0000" "R"
886342-887092 i2s: left: "Left channel: 00010000" "Left: 00010000" "L: 00010000" "L"
887092-887842 i2s: right: "Right channel: f9d50000" "Right: f9d50000" "R: f9d50000" "R"
887842-888593 i2s: left: "Left channel: fffd0000" "Left: fffd0000" "L: fffd0000" "L"
888593-889343 i2s: right: "Right channel: f8c60000" "Right: f8c60000" "R: f8c60000" "R"
889343-890093 i2s: left: "Left channel: fffd0000" "Left: fffd0000" "L: fffd0000" "L"
890093-890843 i2s: right: "Right channel: f81b0000" "Right: f81b0000" "R: f81b0000" "R"
890843-891594 i2s: left: "Left channel: 00000000" "Left: 00000000" "L: 00000000" "L"
891594-892344 i2s: right: "Right channel: f7bf0000" "Right: f7bf0000" "R: f7bf0000" "R"
892344-893094 i2s: left: "Left channel: fffd0000" "Left: fffd0000" "L: fffd0000" "L"
893094-893844 i2s: right: "Right channel: f79b0000" "Right: f79b0000" "R: f79b0000" "R"
893844-894595 i2s: left: "Left channel: ffff0000" "Left: ffff0000" "L: ffff0000" "L"
894595-895345 i2s: right: "Right channel: f7d90000" "Right: f7d90000" "R: f7d90000" "R"
895345-896095 i2s: left: "Left channel: 00000000" "Left: 00000000" "L: 00000000" "L"
896095-896845 i2s: right: "Right channel: f8aa0000" "Right: f8aa0000" "R: f8aa0000" "R"
896845-897596 i2s: left: "Left channel: ffff0000" "Left: ffff0000" "L: ffff0000" "L"
897596-898346 i2s: right: "Right channel: f96b0000" "Right: f96b0000" "R: f96b0000" "R"
898346-899096 i2s: left: "Left channel: ffff0000" "Left: ffff0000" "L: ffff0000" "L"
899096-899846 i2s: right: "Right channel: f9ea0000" "Right: f9ea0000" "R: f9ea0000" "R"
899846-900597 i2s: left: "Left channel: 00020000" "Left: 00020000" "L: 00020000" "L"
900597-901347 i2s: right: "Right channel: fa6e0000" "Right: fa6e0000" "R: fa6e0000" "R"
901347-902097 i2s: left: "Left channel: ffff0000" "Left: ffff0000" "L: ffff0000" "L"
902097-902847 i2s: right: "Right channel: fb5c0000" "Right: fb5c0000" "R: fb5c0000" "R"
902847-903598 i2s: left: "Left channel: ffff0000" "Left: ffff0000" "L: ffff0000" "L"
903598-904348 i2s: right: "Right channel: fcc20000" "Right: fcc20000" "R: fcc20000" "R"
904348-905098 i2s: left: "Left channel: 00000000" "Left: 00000000" "L: 00000000" "L"
905098-905849 i2s: right: "Right channel: fe4a0000" "Right: fe4a0000" "R: fe4a0000" "R"
905849-906599 i2s: left: "Left channel: 00010000" "Left: 00010000" "L: 00010000" "L"
906599-907349 i2s: right: "Right channel: ffbd0000" "Right: ffbd0000" "R: ffbd0000" "R"
907349-908099 i2s: left: "Left channel: 00020000" "Left: 00020000" "L: 00020000" "L"
908099-908850 i2s: right: "Right channel: 015f0000" "Right: 015f0000" "R: 015f0000" "R"
908850-909600 i2s: left: "Left channel: 00020000" "Left: 00020000" "L: 00020000" "L"
909600-910350 i2s: right: "Right channel: 031a0000" "Right: 031a0000" "R: 031a0000" "R"
910350-911100 i2s: left: "Left channel: 00020000" "Left: 00020000" "L: 00020000" "L"
911100-911851 i2s: right: "Right channel: 04e90000" "Right: 04e90000" "R: 04e90000" "R"
911851-912601 i2s: left: "Left channel: 00030000" "Left: 00030000" "L: 00030000" "L"
912601-913351 i2s: right: "Right channel: 06e50000" "Right: 06e50000" "R: 06e50000" "R"
913351-914101 i2s: left: "Left channel: 00030000" "Left: 00030000" "L: 00030000" "L"
914101-914852 i2s: right: "Right channel: 08de0000" "Right: 08de0000" "R: 08de0000" "R"
914852-915602 i2s: left: "Left channel: 00020000" "Left: 00020000" "L: 00020000" "L"
915602-916352 i2s: right: "Right channel: 0acd0000" "Right: 0acd0000" "R: 0acd0000" "R"
916352-917102 i2s: left: "Left channel: 00050000" "Left: 00050000" "L: 00050000" "L"
917102-917853 i2s: right: "Right channel: 0c6b0000" "Right: 0c6b0000" "R: 0c6b0000" "R"
917853-918603 i2s: left: "Left channel: 00010000" "Left: 00010000" "L: 00010000" "L"
918603-919353 i2s: right: "Right channel: 0da90000" "Right: 0da90000" "R: 0da90000" "R"
919353-920103 i2s: left: "Left channel: 00010000" "Left: 00010000" "L: 00010000" "L"
920103-920854 i2s: right: "Right channel: 0ed60000" "Right: 0ed60000" "R: 0ed60000" "R"
920854-921604 i2s: left: "Left channel: 00040000" "Left: 00040000" "L: 00040000" "L"
921604-922354 i2s: right: "Right channel: 10270000" "Right: 10270000" "R: 10270000" "R"
922354-923104 i2s: left: "Left channel: 00010000" "Left: 00010000" "L: 00010000" "L"
923104-923855 i2s: right: "Right channel: 116e0000" "Right: 116e0000" "R: 116e0000" "R"
923855-924605 i2s: left: "Left channel: 00030000" "Left: 00030000" "L: 00030000" "L"
924605-925355 i2s: right: "Right channel: 12660000" "Right: 12660000" "R: 12660000" "R"
925355-926105 i2s: left: "Left channel: 00020000" "Left: 00020000" "L: 00020000" "L"
926105-926856 i2s: right: "Right channel: 12fc0000" "Right: 12fc0000" "R: 12fc0000" "R"
926856-927606 i2s: left: "Left channel: 00020000" "Left: 00020000" "L: 00020000" "L"
927606-928356 i2s: right: "Right channel: 13140000" "Right: 13140000" "R: 13140000" "R"
928356-929106 i2s: left: "Left channel: ffff0000" "Left: ffff0000" "L: ffff0000" "L"
929106-929857 i2s: right: "Right channel: 13010000" "Right: 13010000" "R: 13010000" "R"
929857-930607 i2s: left: "Left channel: 00000000" "Left: 00000000" "L: 00000000" "L"
930607-931357 i2s: right: "Right channel: 12e00000" "Right: 12e00000" "R: 12e00000" "R"
931357-932107 i2s: left: "Left channel: fffe0000" "Left: fffe0000" "L: fffe0000" "L"
932107-932858 i2s: right: "Right channel: 12800000" "Right: 12800000" "R: 12800000" "R"
932858-933608 i2s: left: "Left channel: 00000000" "Left: 00000000" "L: 00000000" "L"
933608-934358 i2s: right: "Right channel: 118d0000" "Right: 118d0000" "R: 118d0000" "R"
934358-935108 i2s: left: "Left channel: 00010000" "Left: 00010000" "L: 00010000" "L"
935108-935859 i2s: right: "Right channel: 0ffd0000" "Right: 0ffd0000" "R: 0ffd0000" "R"
935859-936609 i2s: left: "Left channel: ffff0000" "Left: ffff0000" "L: ffff0000" "L"
936609-937359 i2s: right: "Right channel: 0dfb0000" "Right: 0dfb0000" "R: 0dfb0000" "R"
937359-938109 i2s: left: "Left channel: fffb0000" "Left: fffb0000" "L: fffb0000" "L"
938109-938860 i2s: right: "Right channel: 0bbd0000" "Right: 0bbd0000" "R: 0bbd0000" "R"
938860-939610 i2s: left: "Left channel: fffd0000" "Left: fffd0000" "L: fffd0000" "L"
939610-940360 i2s: right: "Right channel: 094f0000" "Right: 094f0000" "R: 094f0000" "R"
940360-941110 i2s: left: "Left channel: fffc0000" "Left: fffc0000" "L: fffc0000" "L"
941110-941861 i2s: right: "Right channel: 06940000" "Right: 06940000" "R: 06940000" "R"
941861-942611 i2s: left: "Left channel: fffd0000" "Left: fffd0000" "L: fffd0000" "L"
942611-943361 i2s: right: "Right channel: 03b80000" "Right: 03b80000" "R: 03b80000" "R"
943361-944111 i2s: left: "Left channel: fffe0000" "Left: fffe0000" "L: fffe0000" "L"
944111-944862 i2s: right: "Right channel: 00d60000" "Right: 00d60000" "R: 00d60000" "R"
944862-945612 i2s: left: "Left channel: fffc0000" "Left: fffc0000" "L: fffc0000" "L"
945612-946362 i2s: right: "Right channel: fe030000" "Right: fe030000" "R: fe030000" "R"
946362-947112 i2s: left: "Left channel: fffc0000" "Left: fffc0000" "L: fffc0000" "L"
947112-947863 i2s: right: "Right channel: fb4d0000" "Right: fb4d0000" "R: fb4d0000" "R"
947863-948613 i2s: left: "Left channel: fffa0000" "Left: fffa0000" "L: fffa0000" "L"
948613-949363 i2s: right: "Right channel: f8d40000" "Right: f8d40000" "R: f8d40000" "R"
949363-950113 i2s: left: "Left channel: fffb0000" "Left: fffb0000" "L: fffb0000" "L"
950113-950864 i2s: right: "Right channel: f6c30000" "Right: f6c30000" "R: f6c30000" "R"
950864-951614 i2s: left: "Left channel: fffd0000" "Left: fffd0000" "L: fffd0000" "L"
951614-952364 i2s: right: "Right channel: f5360000" "Right: f5360000" "R: f5360000" "R"
952364-953114 i2s: left: "Left channel: fffc0000" "Left: fffc0000" "L: fffc0000" "L"
953114-953865 i2s: right: "Right channel: f3e40000" "Right: f3e40000" "R: f3e40000" "R"
953865-954615 i2s: left: "Left channel: fffe0000" "Left: fffe0000" "L: fffe0000" "L"
954615-955365 i2s: right: "Right channel: f3020000" "Right: f3020000" "R: f3020000" "R"
955365-956115 i2s: left: "Left channel: fffc0000" "Left: fffc0000" "L: fffc0000" "L"
956115-956866 i2s: right: "Right channel: f2910000" "Right: f2910000" "R: f2910000" "R"
956866-957616 i2s: left: "Left channel: fffe0000" "Left: fffe0000" "L: fffe0000" "L"
957616-958366 i2s: right: "Right channel: f2ab0000" "Right: f2ab0000" "R: f2ab0000" "R"
958366-959116 i2s: left: "Left channel: ffff0000" "Left: ffff0000" "L: ffff0000" "L"
959116-959867 i2s: right: "Right channel: f3460000" "Right: f3460000" "R: f3460000" "R"
959867-960617 i2s: left: "Left channel: ffff0000" "Left: ffff0000" "L: ffff0000" "L"
960617-961367 i2s: right: "Right channel: f4140000" "Right: f4140000" "R: f4140000" "R"
961367-962117 i2s: left: "Left channel: 00020000" "Left: 00020000" "L: 00020000" "L"
962117-962868 i2s: right: "Right channel: f4f00000" "Right: f4f00000" "R: f4f00000" "R"
962868-963618 i2s: left: "Left channel: 00000000" "Left: 00000000" "L: 00000000" "L"
963618-964368 i2s: right: "Right channel: f5ea0000" "Right: f5ea0000" "R: f5ea0000" "R"
964368-965118 i2s: left: "Left channel: 00020000" "Left: 00020000" "L: 00020000" "L"
965118-965869 i2s: right: "Right channel: f7310000" "Right: f7310000" "R: f7310000" "R"
965869-966619 i2s: left: "Left channel: 00000000" "Left: 00000000" "L: 00000000" "L"
966619-967369 i2s: right: "Right channel: f87e0000" "Right: f87e0000" "R: f87e0000" "R"
967369-968119 i2s: left: "Left channel: 00020000" "Left: 00020000" "L: 00020000" "L"
968119-968870 i2s: right: "Right channel: f9a80000" "Right: f9a80000" "R: f9a80000" "R"
968870-969620 i2s: left: "Left channel: 00030000" "Left: 00030000" "L: 00030000" "L"
969620-970370 i2s: right: "Right channel: fa9a0000" "Right: fa9a0000" "R: fa9a0000" "R"
970370-971120 i2s: left: "Left channel: 00030000" "Left: 00030000" "L: 00030000" "L"
971120-971871 i2s: right: "Right channel: fb770000" "Right: fb770000" "R: fb770000" "R"
971871-972621 i2s: left: "Left channel: 00020000" "Left: 00020000" "L: 00020000" "L"
972621-973371 i2s: right: "Right channel: fc4e0000" "Right: fc4e0000" "R: fc4e0000" "R"
973371-974121 i2s: left: "Left channel: 00020000" "Left: 00020000" "L: 00020000" "L"
974121-974872 i2s: right: "Right channel: fd110000" "Right: fd110000" "R: fd110000" "R"
974872-975622 i2s: left: "Left channel: 00010000" "Left: 00010000" "L: 00010000" "L"
975622-976372 i2s: right: "Right channel: fdef0000" "Right: fdef0000" "R: fdef0000" "R"
976372-977122 i2s: left: "Left channel: 00020000" "Left: 00020000" "L: 00020000" "L"
977122-977873 i2s: right: "Right channel: fe920000" "Right: fe920000" "R: fe920000" "R"
977873-978623 i2s: left: "Left channel: 00020000" "Left: 00020000" "L: 00020000" "L"
978623-979373 i2s: right: "Right channel: ff900000" "Right: ff900000" "R: ff900000" "R"
979373-980123 i2s: left: "Left channel: 00010000" "Left: 00010000" "L: 00010000" "L"
980123-980874 i2s: right: "Right channel: 00570000" "Right: 00570000" "R: 00570000" "R"
980874-981624 i2s: left: "Left channel: 00020000" "Left: 00020000" "L: 00020000" "L"
981624-982374 i2s: right: "Right channel: 01000000" "Right: 01000000" "R: 01000000" "R"
982374-983124 i2s: left: "Left channel: 00000000" "Left: 00000000" "L: 00000000" "L"
983124-983875 i2s: right: "Right channel: 01980000" "Right: 01980000" "R: 01980000" "R"
983875-984625 i2s: left: "Left channel: 00030000" "Left: 00030000" "L: 00030000" "L"
984625-985375 i2s: right: "Right channel: 02470000" "Right: 02470000" "R: 02470000" "R"
985375-986125 i2s: left: "Left channel: 00010000" "Left: 00010000" "L: 00010000" "L"
986125-986876 i2s: right: "Right channel: 02400000" "Right: 02400000" "R: 02400000" "R"
986876-987626 i2s: left: "Left channel: 00020000" "Left: 00020000" "L: 00020000" "L"
987626-988376 i2s: right: "Right channel: 02c30000" "Right: 02c30000" "R: 02c30000" "R"
988376-989126 i2s: left: "Left channel: 00000000" "Left: 00000000" "L: 00000000" "L"
989126-989877 i2s: right: "Right channel: 02a60000" "Right: 02a60000" "R: 02a60000" "R"
989877-990627 i2s: left: "Left channel: 00010000" "Left: 00010000" "L: 00010000" "L"
990627-991377 i2s: right: "Right channel: 02eb0000" "Right: 02eb0000" "R: 02eb0000" "R"
991377-992127 i2s: left: "Left channel: 00010000" "Left: 00010000" "L: 00010000" "L"
992127-992878 i2s: right: "Right channel: 02520000" "Right: 02520000" "R: 02520000" "R"
992878-993628 i2s: left: "Left channel: ffff0000" "Left: ffff0000" "L: ffff0000" "L"
993628-994378 i2s: right: "Right channel: 02660000" "Right: 02660000" "R: 02660000" "R"
994378-995128 i2s: left: "Left channel: 00010000" "Left: 00010000" "L: 00010000" "L"
995128-995879 i2s: right: "Right channel: 015c0000" "Right: 015c0000" "R: 015c0000" "R"
995879-996629 i2s: left: "Left channel: 00000000" "Left: 00000000" "L: 00000000" "L"
996629-997379 i2s: right: "Right channel: 00fe0000" "Right: 00fe0000" "R: 00fe0000" "R"
997379-998129 i2s: left: "Left channel: 00000000" "Left: 00000000" "L: 00000000" "L"
998129-998880 i2s: right: "Right channel: ffc30000" "Right: ffc30000" "R: ffc30000" "R"
998880-999630 i2s: left: "Left channel: 00000000" "Left: 00000000" "L: 00000000" "L"
999630-1000380 i2s: right: "Right channel: ff2f0000" "Right: ff2f0000" "R: ff2f0000" "R"
1000380-1001130 i2s: left: "Left channel: 00000000" "Left: 00000000" "L: 00000000" "L"
1001130-1001881 i2s: right: "Right channel: fe580000" "Right: fe580000" "R: fe580000" "R"
1001881-1002631 i2s: left: "Left channel: fffd0000" "Left: fffd0000" "L: fffd0000" "L"
1002631-1003381 i2s: right: "Right channel: fd910000" "Right: fd910000" "R: fd910000" "R"
1003381-1004131 i2s: left: "Left channel: 00000000" "Left: 00000000" "L: 00000000" "L"
1004131-1004882 i2s: right: "Right channel: fc940000" "Right: fc940000" "R: fc940000" "R"
1004882-1005632 i2s: left: "Left channel: fffe0000" "Left: fffe0000" "L: fffe0000" "L"
1005632-1006382 i2s: right: "Right channel: fbb80000" "Right: fbb80000" "R: fbb80000" "R"
1006382-1007132 i2s: left: "Left channel: 00010000" "Left: 00010000" "L: 00010000" "L"
1007132-1007883 i2s: right: "Right channel: fb970000" "Right: fb970000" "R: fb970000" "R"
1007883-1008633 i2s: left: "Left channel: fffe0000" "Left: fffe0000" "L: fffe0000" "L"
1008633-1009383 i2s: right: "Right channel: fb360000" "Right: fb360000" "R: fb360000" "R"
1009383-1010133 i2s: left: "Left channel: 00000000" "Left: 00000000" "L: 00000000" "L"
1010133-1010884 i2s: right: "Right channel: fb350000" "Right: fb350000" "R: fb350000" "R"
1010884-1011634 i2s: left: "Left channel: 00000000" "Left: 00000000" "L: 00000000" "L"
1011634-1012384 i2s: right: "Right channel: fab90000" "Right: fab90000" "R: fab90000" "R"
1012384-1013134 i2s: left: "Left channel: ffff0000" "Left: ffff0000" "L: ffff0000" "L"
1013134-1013885 i2s: right: "Right channel: fa500000" "Right: fa500000" "R: fa500000" "R"
1013885-1014635 i2s: left: "Left channel: fffe0000" "Left: fffe0000" "L: fffe0000" "L"
1014635-1015385 i2s: right: "Right channel: fa3d0000" "Right: fa3d0000" "R: fa3d0000" "R"
1015385-1016135 i2s: left: "Left channel: ffff0000" "Left: ffff0000" "L: ffff0000" "L"
1016135-1016886 i2s: right: "Right channel: faf60000" "Right: faf60000" "R: faf60000" "R"
1016886-1017636 i2s: left: "Left channel: 00000000" "Left: 00000000" "L: 00000000" "L"
1017636-1018386 i2s: right: "Right channel: fad40000" "Right: fad40000" "R: fad40000" "R"
1018386-1019136 i2s: left: "Left channel: 00000000" "Left: 00000000" "L: 00000000" "L"
1019136-1019887 i2s: right: "Right channel: fafa0000" "Right: fafa0000" "R: fafa0000" "R"
1019887-1020637 i2s: left: "Left channel: 00020000" "Left: 00020000" "L: 00020000" "L"
1020637-1021387 i2s: right: "Right channel: fab40000" "Right: fab40000" "R: fab40000" "R"
1021387-1022137 i2s: left: "Left channel: 00000000" "Left: 00000000" "L: 00000000" "L"
1022137-1022888 i2s: right: "Right channel: fadb0000" "Right: fadb0000" "R: fadb0000" "R"
1022888-1023638 i2s: left: "Left channel: 00010000" "Left: 00010000" "L: 00010000" "L"
1023638-1024388 i2s: right: "Right channel: facf0000" "Right: facf0000" "R: facf0000" "R"
1024388-1025139 i2s: left: "Left channel: 00000000" "Left: 00000000" "L: 00000000" "L"
1025139-1025889 i2s: right: "Right channel: fb300000" "Right: fb300000" "R: fb300000" "R"
1025889-1026639 i2s: left: "Left channel: 00010000" "Left: 00010000" "L: 00010000" "L"
1026639-1027389 i2s: right: "Right channel: fae20000" "Right: fae20000" "R: fae20000" "R"
1027389-1028140 i2s: left: "Left channel: ffff0000" "Left: ffff0000" "L: ffff0000" "L"
1028140-1028890 i2s: right: "Right channel: fb770000" "Right: fb770000" "R: fb770000" "R"
1028890-1029640 i2s: left: "Left channel: 00020000" "Left: 00020000" "L: 00020000" "L"
1029640-1030390 i2s: right: "Right channel: fbdc0000" "Right: fbdc0000" "R: fbdc0000" "R"
1030390-1031141 i2s: left: "Left channel: 00010000" "Left: 00010000" "L: 00010000" "L"
1031141-1031891 i2s: right: "Right channel: fc2a0000" "Right: fc2a0000" "R: fc2a0000" "R"
1031891-1032641 i2s: left: "Left channel: 00010000" "Left: 00010000" "L: 00010000" "L"
1032641-1033391 i2s: right: "Right channel: fc910000" "Right: fc910000" "R: fc910000" "R"
1033391-1034142 i2s: left: "Left channel: 00000000" "Left: 00000000" "L: 00000000" "L"
1034142-1034892 i2s: right: "Right channel: fd990000" "Right: fd990000" "R: fd990000" "R"
1034892-1035642 i2s: left: "Left channel: 00020000" "Left: 00020000" "L: 00020000" "L"
1035642-1036392 i2s: right: "Right channel: fe590000" "Right: fe590000" "R: fe590000" "R"
1036392-1037143 i2s: left: "Left channel: 00020000" "Left: 00020000" "L: 00020000" "L"
1037143-1037893 i2s: right: "Right channel: ffbf0000" "Right: ffbf0000" "R: ffbf0000" "R"
1037893-1038643 i2s: left: "Left channel: 00020000" "Left: 00020000" "L: 00020000" "L"
1038643-1039393 i2s: right: "Right channel: 00fb0000" "Right: 00fb0000" "R: 00fb0000" "R"
1039393-1040144 i2s: left: "Left channel: 00020000" "Left: 00020000" "L: 00020000" "L"
1040144-1040894 i2s: right: "Right channel: 02170000" "Right: 02170000" "R: 02170000" "R"
1040894-1041644 i2s: left: "Left channel: 00020000" "Left: 00020000" "L: 00020000" "L"
1041644-1042394 i2s: right: "Right channel: 02cb0000" "Right: 02cb0000" "R: 02cb0000" "R"
1042394-1043145 i2s: left: "Left channel: 00010000" "Left: 00010000" "L: 00010000" "L"
1043145-1043895 i2s: right: "Right channel: 03ec0000" "Right: 03ec0000" "R: 03ec0000" "R"
1043895-1044645 i2s: left: "Left channel: 00000000" "Left: 00000000" "L: 00000000" "L"
1044645-1045395 i2s: right: "Right channel: 04a30000" "Right: 04a30000" "R: 04a30000" "R"
1045395-1046146 i2s: left: "Left channel: 00010000" "Left: 00010000" "L: 00010000" "L"
1046146-1046896 i2s: right: "Right channel: 057a0000" "Right: 057a0000" "R: 057a0000" "R"
1046896-1047646 i2s: left: "Left channel: 00020000" "Left: 00020000" "L: 00020000" "L"
1047646-1048396 i2s: right: "Right channel: 05a30000" "Right: 05a30000" "R: 05a30000" "R"
1048396-1049147 i2s: left: "Left channel: 00010000" "Left: 00010000" "L: 00010000" "L"
1049147-1049897 i2s: right: "Right channel: 05680000" "Right: 05680000" "R: 05680000" "R"
1049897-1050647 i2s: left: "Left channel: 00000000" "Left: 00000000" "L: 00000000" "L"
1050647-1051397 i2s: right: "Right channel: 052c0000" "Right: 052c0000" "R: 052c0000" "R"
1051397-1052148 i2s: left: "Left channel: 00010000" "Left: 00010000" "L: 00010000" "L"
1052148-1052898 i2s: right: "Right channel: 04dd0000" "Right: 04dd0000" "R: 04dd0000" "R"
1052898-1053648 i2s: left: "Left channel: fffe0000" "Left: fffe0000" "L: fffe0000" "L"
1053648-1054398 i2s: right: "Right channel: 04260000" "Right: 04260000" "R: 04260000" "R"
1054398-1055149 i2s: left: "Left channel: 00000000" "Left: 00000000" "L: 00000000" "L"
1055149-1055899 i2s: right: "Right channel: 035e0000" "Right: 035e0000" "R: 035e0000" "R"
1055899-1056649 i2s: left: "Left channel: 00000000" "Left: 00000000" "L: 00000000" "L"
1056649-1057399 i2s: right: "Right channel: 02680000" "Right: 02680000" "R: 02680000" "R"
1057399-1058150 i2s: left: "Left channel: 00000000" "Left: 00000000" "L: 00000000" "L"
1058150-1058900 i2s: right: "Right channel: 01880000" "Right: 01880000" "R: 01880000" "R"
1058900-1059650 i2s: left: "Left channel: fffd0000" "Left: fffd0000" "L: fffd0000" "L"
1059650-1060400 i2s: right: "Right channel: 00a70000" "Right: 00a70000" "R: 00a70000" "R"
1060400-1061151 i2s: left: "Left channel: 00000000" "Left: 00000000" "L: 00000000" "L"
1061151-1061901 i2s: right: "Right channel: 00030000" "Right: 00030000" "R: 00030000" "R"
1061901-1062651 i2s: left: "Left channel: 00000000" "Left: 00000000" "L: 00000000" "L"
1062651-1063401 i2s: right: "Right channel: ff460000" "Right: ff460000" "R: ff460000" "R"
1063401-1064152 i2s: left: "Left channel: ffff0000" "Left: ffff0000" "L: ffff0000" "L"
1064152-1064902 i2s: right: "Right channel: ff0a0000" "Right: ff0a0000" "R: ff0a0000" "R"
1064902-1065652 i2s: left: "Left channel: 00010000" "Left: 00010000" "L: 00010000" "L"
1065652-1066402 i2s: right: "Right channel: ff210000" "Right: ff210000" "R: ff210000" "R"
1066402-1067153 i2s: left: "Left channel: fffe0000" "Left: fffe0000" "L: fffe0000" "L"
1067153-1067903 i2s: right: "Right channel: ff240000" "Right: ff240000" "R: ff240000" "R"
1067903-1068653 i2s: left: "Left channel: 00010000" "Left: 00010000" "L: 00010000" "L"
1068653-1069403 i2s: right: "Right channel: ff570000" "Right: ff570000" "R: ff570000" "R"
1069403-1070154 i2s: left: "Left channel: ffff0000" "Left: ffff0000" "L: ffff0000" "L"
1070154-1070904 i2s: right: "Right channel: ff550000" "Right: ff550000" "R: ff550000" "R"
1070904-1071654 i2s: left: "Left channel: fffe0000" "Left: fffe0000" "L: fffe0000" "L"
1071654-1072404 i2s: right: "Right channel: ff510000" "Right: ff510000" "R: ff510000" "R"
1072404-1073155 i2s: left: "Left channel: 00020000" "Left: 00020000" "L: 00020000" "L"
1073155-1073905 i2s: right: "Right channel: ff980000" "Right: ff980000" "R: ff980000" "R"
1073905-1074655 i2s: left: "Left channel: fffd0000" "Left: fffd0000" "L: fffd0000" "L"
1074655-1075405 i2s: right: "Right channel: ffe40000" "Right: ffe40000" "R: ffe40000" "R"
1075405-1076156 i2s: left: "Left channel: 00010000" "Left: 00010000" "L: 00010000" "L"
1076156-1076906 i2s: right: "Right channel: fff30000" "Right: fff30000" "R: fff30000" "R"
1076906-1077656 i2s: left: "Left channel: 00000000" "Left: 00000000" "L: 00000000" "L"
1077656-1078406 i2s: right: "Right channel: ffd80000" "Right: ffd80000" "R: ffd80000" "R"
1078406-1079157 i2s: left: "Left channel: 00020000" "Left: 00020000" "L: 00020000" "L"
1079157-1079907 i2s: right: "Right channel: ffa60000" "Right: ffa60000" "R: ffa60000" "R"
1079907-1080657 i2s: left: "Left channel: ffff0000" "Left: ffff0000" "L: ffff0000" "L"
1080657-1081407 i2s: right: "Right channel: ff920000" "Right: ff920000" "R: ff920000" "R"
1081407-1082158 i2s: left: "Left channel: 00010000" "Left: 00010000" "L: 00010000" "L"
1082158-1082908 i2s: right: "Right channel: ffb50000" "Right: ffb50000" "R: ffb50000" "R"
1082908-1083658 i2s: left: "Left channel: fffe0000" "Left: fffe0000" "L: fffe0000" "L"
1083658-1084408 i2s: right: "Right channel: ffea0000" "Right: ffea0000" "R: ffea0000" "R"
1084408-1085159 i2s: left: "Left channel: 00020000" "Left: 00020000" "L: 00020000" "L"
1085159-1085909 i2s: right: "Right channel: ffcb0000" "Right: ffcb0000" "R: ffcb0000" "R"
1085909-1086659 i2s: left: "Left channel: ffff0000" "Left: ffff0000" "L: ffff0000" "L"
1086659-1087409 i2s: right: "Right channel: 00200000" "Right: 00200000" "R: 00200000" "R"
1087409-1088160 i2s: left: "Left channel: 00010000" "Left: 00010000" "L: 00010000" "L"
1088160-1088910 i2s: right: "Right channel: 00ba0000" "Right: 00ba0000" "R: 00ba0000" "R"
1088910-1089660 i2s: left: "Left channel: 00000000" "Left: 00000000" "L: 00000000" "L"
1089660-1090410 i2s: right: "Right channel: 016f0000" "Right: 016f0000" "R: 016f0000" "R"
1090410-1091161 i2s: left: "Left channel: 00000000" "Left: 00000000" "L: 00000000" "L"
1091161-1091911 i2s: right: "Right channel: 02370000" "Right: 02370000" "R: 02370000" "R"
1091911-1092661 i2s: left: "Left channel: 00010000" "Left: 00010000" "L: 00010000" "L"
1092661-1093411 i2s: right: "Right channel: 03350000" "Right: 03350000" "R: 03350000" "R"
1093411-1094162 i2s: left: "Left channel: 00010000" "Left: 00010000" "L: 00010000" "L"
1094162-1094912 i2s: right: "Right channel: 04800000" "Right: 04800000" "R: 04800000" "R"
1094912-1095662 i2s: left: "Left channel: 00020000" "Left: 00020000" "L: 00020000" "L"
1095662-1096412 i2s: right: "Right channel: 05ef0000" "Right: 05ef0000" "R: 05ef0000" "R"
1096412-1097163 i2s: left: "Left channel: 00030000" "Left: 00030000" "L: 00030000" "L"
1097163-1097913 i2s: right: "Right channel: 07530000" "Right: 07530000" "R: 07530000" "R"
1097913-1098663 i2s: left: "Left channel: 00000000" "Left: 00000000" "L: 00000000" "L"
1098663-1099413 i2s: right: "Right channel: 087b0000" "Right: 087b0000" "R: 087b0000" "R"
1099413-1100164 i2s: left: "Left channel: 00010000" "Left: 00010000" "L: 00010000" "L"
1100164-1100914 i2s: right: "Right channel: 09a10000" "Right: 09a10000" "R: 09a10000" "R"
1100914-1101664 i2s: left: "Left channel: ffff0000" "Left: ffff0000" "L: ffff0000" "L"
1101664-1102414 i2s: right: "Right channel: 0afd0000" "Right: 0afd0000" "R: 0afd0000" "R"
1102414-1103165 i2s: left: "Left channel: 00010000" "Left: 00010000" "L: 00010000" "L"
1103165-1103915 i2s: right: "Right channel: 0c020000" "Right: 0c020000" "R: 0c020000" "R"
1103915-1104665 i2s: left: "Left channel: 00010000" "Left: 00010000" "L: 00010000" "L"
1104665-1105415 i2s: right: "Right channel: 0c7f0000" "Right: 0c7f0000" "R: 0c7f0000" "R"
1105415-1106166 i2s: left: "Left channel: 00010000" "Left: 00010000" "L: 00010000" "L"
1106166-1106916 i2s: right: "Right channel: 0cb00000" "Right: 0cb00000" "R: 0cb00000" "R"
1106916-1107666 i2s: left: "Left channel: 00000000" "Left: 00000000" "L: 00000000" "L"
1107666-1108416 i2s: right: "Right channel: 0c9e0000" "Right: 0c9e0000" "R: 0c9e0000" "R"
1108416-1109167 i2s: left: "Left channel: 00000000" "Left: 00000000" "L: 00000000" "L"
1109167-1109917 i2s: right: "Right channel: 0c100000" "Right: 0c100000" "R: 0c100000" "R"
1109917-1110667 i2s: left: "Left channel: ffff0000" "Left: ffff0000" "L: ffff0000" "L"
1110667-1111417 i2s: right: "Right channel: 0b280000" "Right: 0b280000" "R: 0b280000" "R"
1111417-1112168 i2s: left: "Left channel: 00000000" "Left: 00000000" "L: 00000000" "L"
1112168-1112918 i2s: right: "Right channel: 0a110000" "Right: 0a110000" "R: 0a110000" "R"
1112918-1113668 i2s: left: "Left channel: fffd0000" "Left: fffd0000" "L: fffd0000" "L"
1113668-1114418 i2s: right: "Right channel: 08c60000" "Right: 08c60000" "R: 08c60000" "R"
1114418-1115169 i2s: left: "Left channel: 00000000" "Left: 00000000" "L: 00000000" "L"
1115169-1115919 i2s: right: "Right channel: 07870000" "Right: 07870000" "R: 07870000" "R"
1115919-1116669 i2s: left: "Left channel: fffc0000" "Left: fffc0000" "L: fffc0000" "L"
1116669-1117419 i2s: right: "Right channel: 06160000" "Right: 06160000" "R: 06160000" "R"
1117419-1118170 i2s: left: "Left channel: fffc0000" "Left: fffc0000" "L: fffc0000" "L"
1118170-1118920 i2s: right: "Right channel: 04a90000" "Right: 04a90000" "R: 04a90000" "R"
1118920-1119670 i2s: left: "Left channel: ffff0000" "Left: ffff0000" "L: ffff0000" "L"
1119670-1120420 i2s: right: "Right channel: 037f0000" "Right: 037f0000" "R: 037f0000" "R"
1120420-1121171 i2s: left: "Left channel: fffe0000" "Left: fffe0000" "L: fffe0000" "L"
1121171-1121921 i2s: right: "Right channel: 02880000" "Right: 02880000" "R: 02880000" "R"
1121921-1122671 i2s: left: "Left channel: fffe0000" "Left: fffe0000" "L: fffe0000" "L"
1122671-1123421 i2s: right: "Right channel: 01a20000" "Right: 01a20000" "R: 01a20000" "R"
1123421-1124172 i2s: left: "Left channel: fffe0000" "Left: fffe0000" "L: fffe0000" "L"
1124172-1124922 i2s: right: "Right channel: 01090000" "Right: 01090000" "R: 01090000" "R"
1124922-1125672 i2s: left: "Left channel: fffe0000" "Left: fffe0000" "L: fffe0000" "L"
1125672-1126422 i2s: right: "Right channel: 00740000" "Right: 00740000" "R: 00740000" "R"
1126422-1127173 i2s: left: "Left channel: fffe0000" "Left: fffe0000" "L: fffe0000" "L"
1127173-1127923 i2s: right: "Right channel: ffc40000" "Right: ffc40000" "R: ffc40000" "R"
1127923-1128673 i2s: left: "Left channel: ffff0000" "Left: ffff0000" "L: ffff0000" "L"
1128673-1129423 i2s: right: "Right channel: fed50000" "Right: fed50000" "R: fed50000" "R"
1129423-1130174 i2s: left: "Left channel: fffd0000" "Left: fffd0000" "L: fffd0000" "L"
1130174-1130924 i2s: right: "Right channel: fe2b0000" "Right: fe2b0000" "R: fe2b0000" "R"
1130924-1131674 i2s: left: "Left channel: 00010000" "Left: 00010000" "L: 00010000" "L"
1131674-1132425 i2s: right: "Right channel: fdae0000" "Right: fdae0000" "R: fdae0000" "R"
1132425-1133175 i2s: left: "Left channel: ffff0000" "Left: ffff0000" "L: ffff0000" "L"
1133175-1133925 i2s: right: "Right channel: fd190000" "Right: fd190000" "R: fd190000" "R"
1133925-1134675 i2s: left: "Left channel: ffff0000" "Left: ffff0000" "L: ffff0000" "L"
1134675-1135426 i2s: right: "Right channel: fc7c0000" "Right: fc7c0000" "R: fc7c0000" "R"
1135426-1136176 i2s: left: "Left channel: 00000000" "Left: 00000000" "L: 00000000" "L"
1136176-1136926 i2s: right: "Right channel: fb6b0000" "Right: fb6b0000" "R: fb6b0000" "R"
1136926-1137676 i2s: left: "Left channel: 00010000" "Left: 00010000" "L: 00010000" "L"
1137676-1138427 i2s: right: "Right channel: fa970000" "Right: fa970000" "R: fa970000" "R"
1138427-1139177 i2s: left: "Left channel: fffe0000" "Left: fffe0000" "L: fffe0000" "L"
1139177-1139927 i2s: right: "Right channel: f9f50000" "Right: f9f50000" "R: f9f50000" "R"
1139927-1140677 i2s: left: "Left channel: fffe0000" "Left: fffe0000" "L: fffe0000" "L"
1140677-1141428 i2s: right: "Right channel: f93b0000" "Right: f93b0000" "R: f93b0000" "R"
1141428-1142178 i2s: left: "Left channel: 00000000" "Left: 00000000" "L: 00000000" "L"
1142178-1142928 i2s: right: "Right channel: f9150000" "Right: f9150000" "R: f9150000" "R"
1142928-1143678 i2s: left: "Left channel: 00010000" "Left: 00010000" "L: 00010000" "L"
1143678-1144429 i2s: right: "Right channel: f8c60000" "Right: f8c60000" "R: f8c60000" "R"
1144429-1145179 i2s: left: "Left channel: fffe0000" "Left: fffe0000" "L: fffe0000" "L"
1145179-1145929 i2s: right: "Right channel: f8a70000" "Right: f8a70000" "R: f8a70000" "R"
1145929-1146679 i2s: left: "Left channel: 00010000" "Left: 00010000" "L: 00010000" "L"
1146679-1147430 i2s: right: "Right channel: f92f0000" "Right: f92f0000" "R: f92f0000" "R"
1147430-1148180 i2s: left: "Left channel: 00010000" "Left: 00010000" "L: 00010000" "L"
1148180-1148930 i2s: right: "Right channel: f9c40000" "Right: f9c40000" "R: f9c40000" "R"
1148930-1149680 i2s: left: "Left channel: 00010000" "Left: 00010000" "L: 00010000" "L"
1149680-1150431 i2s: right: "Right channel: fa710000" "Right: fa710000" "R: fa710000" "R"
1150431-1151181 i2s: left: "Left channel: 00040000" "Left: 00040000" "L: 00040000" "L"
1151181-1151931 i2s: right: "Right channel: fac20000" "Right: fac20000" "R: fac20000" "R"
1151931-1152681 i2s: left: "Left channel: 00010000" "Left: 00010000" "L: 00010000" "L"
1152681-1153432 i2s: right: "Right channel: fb720000" "Right: fb720000" "R: fb720000" "R"
1153432-1154182 i2s: left: "Left channel: 00030000" "Left: 00030000" "L: 00030000" "L"
1154182-1154932 i2s: right: "Right channel: fbb30000" "Right: fbb30000" "R: fbb30000" "R"
1154932-1155682 i2s: left: "Left channel: 00030000" "Left: 00030000" "L: 00030000" "L"
1155682-1156433 i2s: right: "Right channel: fc360000" "Right: fc360000" "R: fc360000" "R"
1156433-1157183 i2s: left: "Left channel: 00030000" "Left: 00030000" "L: 00030000" "L"
1157183-1157933 i2s: right: "Right channel: fcd20000" "Right: fcd20000" "R: fcd20000" "R"
1157933-1158683 i2s: left: "Left channel: 00020000" "Left: 00020000" "L: 00020000" "L"
1158683-1159434 i2s: right: "Right channel: fc7c0000" "Right: fc7c0000" "R: fc7c0000" "R"
1159434-1160184 i2s: left: "Left channel: ffff0000" "Left: ffff0000" "L: ffff0000" "L"
1160184-1160934 i2s: right: "Right channel: fcc00000" "Right: fcc00000" "R: fcc00000" "R"
1160934-1161684 i2s: left: "Left channel: 00000000" "Left: 00000000" "L: 00000000" "L"
1161684-1162435 i2s: right: "Right channel: fca30000" "Right: fca30000" "R: fca30000" "R"
1162435-1163185 i2s: left: "Left channel: 00010000" "Left: 00010000" "L: 00010000" "L"
1163185-1163935 i2s: right: "Right channel: fcc00000" "Right: fcc00000" "R: fcc00000" "R"
1163935-1164685 i2s: left: "Left channel: 00000000" "Left: 00000000" "L: 00000000" "L"
1164685-1165436 i2s: right: "Right channel: fce50000" "Right: fce50000" "R: fce50000" "R"
1165436-1166186 i2s: left: "Left channel: ffff0000" "Left: ffff0000" "L: ffff0000" "L"
1166186-1166936 i2s: right: "Right channel: fcd20000" "Right: fcd20000" "R: fcd20000" "R"
1166936-1167686 i2s: left: "Left channel: 00000000" "Left: 00000000" "L: 00000000" "L"
1167686-1168437 i2s: right: "Right channel: fd420000" "Right: fd420000" "R: fd420000" "R"
1168437-1169187 i2s: left: "Left channel: 00000000" "Left: 00000000" "L: 00000000" "L"
1169187-1169937 i2s: right: "Right channel: fd010000" "Right: fd010000" "R: fd010000" "R"
1169937-1170687 i2s: left: "Left channel: 00020000" "Left: 00020000" "L: 00020000" "L"
1170687-1171438 i2s: right: "Right channel: fd850000" "Right: fd850000" "R: fd850000" "R"
1171438-1172188 i2s: left: "Left channel: 00010000" "Left: 00010000" "L: 00010000" "L"
1172188-1172938 i2s: right: "Right channel: fd540000" "Right: fd540000" "R: fd540000" "R"
1172938-1173688 i2s: left: "Left channel: 00000000" "Left: 00000000" "L: 00000000" "L"
1173688-1174439 i2s: right: "Right channel: fd210000" "Right: fd210000" "R: fd210000" "R"
1174439-1175189 i2s: left: "Left channel: 00000000" "Left: 00000000" "L: 00000000" "L"
1175189-1175939 i2s: right: "Right channel: fd0c0000" "Right: fd0c0000" "R: fd0c0000" "R"
1175939-1176689 i2s: left: "Left channel: 00020000" "Left: 00020000" "L: 00020000" "L"
1176689-1177440 i2s: right: "Right channel: fcad0000" "Right: fcad0000" "R: fcad0000" "R"
1177440-1178190 i2s: left: "Left channel: ffff0000" "Left: ffff0000" "L: ffff0000" "L"
1178190-1178940 i2s: right: "Right channel: fcfe0000" "Right: fcfe0000" "R: fcfe0000" "R"
1178940-1179690 i2s: left: "Left channel: 00010000" "Left: 00010000" "L: 00010000" "L"
1179690-1180441 i2s: right: "Right channel: fced0000" "Right: fced0000" "R: fced0000" "R"
1180441-1181191 i2s: left: "Left channel: 00000000" "Left: 00000000" "L: 00000000" "L"
1181191-1181941 i2s: right: "Right channel: fcdc0000" "Right: fcdc0000" "R: fcdc0000" "R"
1181941-1182691 i2s: left: "Left channel: 00000000" "Left: 00000000" "L: 00000000" "L"
1182691-1183442 i2s: right: "Right channel: fc5d0000" "Right: fc5d0000" "R: fc5d0000" "R"
1183442-1184192 i2s: left: "Left channel: ffff0000" "Left: ffff0000" "L: ffff0000" "L"
1184192-1184942 i2s: right: "Right channel: fc180000" "Right: fc180000" "R: fc180000" "R"
1184942-1185692 i2s: left: "Left channel: ffff0000" "Left: ffff0000" "L: ffff0000" "L"
1185692-1186443 i2s: right: "Right channel: fc260000" "Right: fc260000" "R: fc260000" "R"
1186443-1187193 i2s: left: "Left channel: ffff0000" "Left: ffff0000" "L: ffff0000" "L"
1187193-1187943 i2s: right: "Right channel: fc060000" "Right: fc060000" "R: fc060000" "R"
1187943-1188693 i2s: left: "Left channel: 00000000" "Left: 00000000" "L: 00000000" "L"
1188693-1189444 i2s: right: "Right channel: fc1a0000" "Right: fc1a0000" "R: fc1a0000" "R"
1189444-1190194 i2s: left: "Left channel: fffe0000" "Left: fffe0000" "L: fffe0000" "L"
1190194-1190944 i2s: right: "Right channel: fbbc0000" "Right: fbbc0000" "R: fbbc0000" "R"
1190944-1191694 i2s: left: "Left channel: 00000000" "Left: 00000000" "L: 00000000" "L"
1191694-1192445 i2s: right: "Right channel: fb090000" "Right: fb090000" "R: fb090000" "R"
1192445-1193195 i2s: left: "Left channel: ffff0000" "Left: ffff0000" "L: ffff0000" "L"
1193195-1193945 i2s: right: "Right channel: fb960000" "Right: fb960000" "R: fb960000" "R"
1193945-1194695 i2s: left: "Left channel: 00010000" "Left: 00010000" "L: 00010000" "L"
1194695-1195446 i2s: right: "Right channel: fbbd0000" "Right: fbbd0000" "R: fbbd0000" "R"
1195446-1196196 i2s: left: "Left channel: 00000000" "Left: 00000000" "L: 00000000" "L"
1196196-1196946 i2s: right: "Right channel: fbf60000" "Right: fbf60000" "R: fbf60000" "R"
1196946-1197696 i2s: left: "Left channel: 00000000" "Left: 00000000" "L: 00000000" "L"
1197696-1198447 i2s: right: "Right channel: fb670000" "Right: fb670000" "R: fb670000" "R"
1198447-1199197 i2s: left: "Left channel: 00000000" "Left: 00000000" "L: 00000000" "L"
1199197-1199947 i2s: right: "Right channel: fb2f0000" "Right: fb2f0000" "R: fb2f0000" "R"
1199947-1200697 i2s: left: "Left channel: ffff0000" "Left: ffff0000" "L: ffff0000" "L"
1200697-1201448 i2s: right: "Right channel: fb560000" "Right: fb560000" "R: fb560000" "R"
1201448-1202198 i2s: left: "Left channel: 00010000" "Left: 00010000" "L: 00010000" "L"
1202198-1202948 i2s: right: "Right channel: fc160000" "Right: fc160000" "R: fc160000" "R"
