539358-542936 avclan: address: "AUDIO_HU1"
543274-546848 avclan: address: "BROADCAST"
552300-554671 avclan: function: "From Function: COMMUNICATION" "From Function" "From"
555309-557684 avclan: function: "To Function: COMM_CTRL" "To Function" "To"
616165-619738 avclan: address: "AUDIO_HU1"
620075-623648 avclan: address: "BROADCAST"
629103-631473 avclan: function: "From Function: COMM_CTRL" "From Function" "From"
632111-634481 avclan: function: "To Function: COMM_CTRL" "To Function" "To"
679046-682620 avclan: address: "AUDIO_HU1"
682958-686534 avclan: address: "AUDIO_HU2"
694995-697367 avclan: function: "From Function: CMD_SW" "From Function" "From"
698005-700375 avclan: function: "To Function: TUNER" "To Function" "To"
743940-747513 avclan: address: "AUDIO_HU1"
747851-751427 avclan: address: "GROUP_AUDIO"
756878-759249 avclan: function: "From Function" "From"
759888-762259 avclan: function: "To Function" "To"
802398-806194 avclan: address: "AUDIO_HU2"
806568-810313 avclan: address: "GROUP_AUDIO"
816070-818570 avclan: function: "From Function: CD" "From Function" "From"
819258-821769 avclan: function: "To Function" "To"
828842-831353 avclan: cd-state: "State: CDStateCodes.SEEKING_TRACK|PLAYBACK" "CDStateCodes.SEEKING_TRACK|PLAYBACK" "State"
832050-834582 avclan: disc-number: "CD #1" "CD #" "CD" "C"
835259-837718 avclan: track-number: "Track #" "Tra" "T"
838405-844011 avclan: playback-time: "Time" "T"
844699-847230 avclan: cd-flags: "Flags: CDFlags.0" "CDFlags.0" "Flags"
822445-824936 avclan: cd-opcode: "Opcode: REPORT_PLAYBACK" "REPORT_PLAYBACK" "Opcode"
854402-857975 avclan: address: "AUDIO_HU1"
858313-861886 avclan: address: "AUDIO_HU2"
870350-872723 avclan: function: "From Function: CMD_SW" "From Function" "From"
873362-875731 avclan: function: "To Function: TUNER" "To Function" "To"
918352-921925 avclan: address: "AUDIO_HU1"
922263-925836 avclan: address: "AUDIO_HU2"
934297-936668 avclan: function: "From Function: CMD_SW" "From Function" "From"
937307-939678 avclan: function: "To Function: CD" "To Function" "To"
951122-954918 avclan: address: "AUDIO_HU2"
955292-959088 avclan: address: "AUDIO_HU1"
968105-970637 avclan: function: "From Function: COMM_CTRL" "From Function" "From"
971314-973825 avclan: function: "To Function: COMMUNICATION" "To Function" "To"
1025839-1029412 avclan: address: "AUDIO_HU1"
1029749-1033327 avclan: address: "AUDIO_HU2"
1041787-1044158 avclan: function: "From Function: CMD_SW" "From Function" "From"
1044796-1047166 avclan: function: "To Function: AUDIO_AMP" "To Function" "To"
1093179-1096976 avclan: address: "AUDIO_HU2"
1097350-1101146 avclan: address: "AUDIO_HU1"
1110163-1112674 avclan: function: "From Function: TUNER" "From Function" "From"
1113371-1115882 avclan: function: "To Function: CMD_SW" "To Function" "To"
1148622-1152195 avclan: address: "AUDIO_HU1"
1152532-1156107 avclan: address: "AUDIO_HU2"
1164570-1166939 avclan: function: "From Function: CMD_SW" "From Function" "From"
1167578-1169947 avclan: function: "To Function: AUDIO_AMP" "To Function" "To"
1241384-1245181 avclan: address: "AUDIO_HU2"
1245554-1249351 avclan: address: "AUDIO_HU1"
1258347-1260858 avclan: function: "From Function: TUNER" "From Function" "From"
1261556-1264067 avclan: function: "To Function: CMD_SW" "To Function" "To"
1303508-1307083 avclan: address: "AUDIO_HU1"
1307421-1310993 avclan: address: "AUDIO_HU2"
1319458-1321828 avclan: function: "From Function: COMMUNICATION" "From Function" "From"
1322466-1324836 avclan: function: "To Function: COMM_CTRL" "To Function" "To"
1385968-1389541 avclan: address: "AUDIO_HU1"
1389879-1393453 avclan: address: "BROADCAST"
1398905-1401276 avclan: function: "From Function: COMMUNICATION" "From Function" "From"
1401914-1404286 avclan: function: "To Function: COMM_CTRL" "To Function" "To"
1404924-1407294 avclan: ctrl-opcode: "Opcode: GENERAL_QUERY" "GENERAL_QUERY"
1404924-1407294 avclan: ctrl-opcode: "Opcode: GENERAL_QUERY" "GENERAL_QUERY"
1457960-1461756 avclan: address: "AUDIO_HU2"
1462130-1465926 avclan: address: "AUDIO_HU1"
1474943-1477444 avclan: function: "From Function: CD" "From Function" "From"
1478131-1480642 avclan: function: "To Function: CMD_SW" "To Function" "To"
1481319-1483809 avclan: cd-opcode: "Opcode: f0" "f0" "Opcode"
1555436-1559232 avclan: address: "AUDIO_HU2"
1559606-1563403 avclan: address: "AUDIO_HU1"
1572419-1574951 avclan: function: "From Function: COMM_CTRL" "From Function" "From"
1575628-1578139 avclan: function: "To Function: COMMUNICATION" "To Function" "To"
1652630-1656426 avclan: address: "AUDIO_HU2"
1656800-1660545 avclan: address: "GROUP_AUDIO"
1666322-1668823 avclan: function: "From Function: CD" "From Function" "From"
1669510-1672021 avclan: function: "To Function" "To"
1679094-1681626 avclan: disc-slots: "Slots-1: CDSlots.SLOT1" "CDSlots.SLOT1" "Slots-1"
1685532-1688064 avclan: disc-slots: "Slots-2: CDSlots.SLOT1" "CDSlots.SLOT1" "Slots-2"
1691970-1694501 avclan: disc-slots: "Slots-3: CDSlots.SLOT1" "CDSlots.SLOT1" "Slots-3"
1672698-1675178 avclan: cd-opcode: "Opcode: REPORT_LOADER" "REPORT_LOADER" "Opcode"
1701627-1705201 avclan: address: "AUDIO_HU1"
1705539-1709113 avclan: address: "AUDIO_HU2"
1717573-1719944 avclan: function: "From Function: COMMUNICATION" "From Function" "From"
1720583-1722956 avclan: function: "To Function: COMM_CTRL" "To Function" "To"
1758572-1762144 avclan: address: "AUDIO_HU1"
1762482-1766055 avclan: address: "AUDIO_HU2"
1774515-1776884 avclan: function: "From Function: COMMUNICATION" "From Function" "From"
1777523-1779894 avclan: function: "To Function: CD" "To Function" "To"
1821870-1825666 avclan: address: "AUDIO_HU2"
1826040-1829836 avclan: address: "AUDIO_HU1"
1838853-1841343 avclan: function: "From Function: AUDIO_AMP" "From Function" "From"
1842041-1844552 avclan: function: "To Function: CMD_SW" "To Function" "To"
1971307-1975104 avclan: address: "AUDIO_HU2"
1975477-1979222 avclan: address: "GROUP_AUDIO"
1984999-1987500 avclan: function: "From Function: CD" "From Function" "From"
1988187-1990698 avclan: function: "To Function" "To"
1997772-2000303 avclan: disc-slots: "Slots-1: CDSlots.SLOT1" "CDSlots.SLOT1" "Slots-1"
2004209-2006741 avclan: disc-slots: "Slots-2: CDSlots.SLOT1" "CDSlots.SLOT1" "Slots-2"
2010647-2013179 avclan: disc-slots: "Slots-3: CDSlots.SLOT1" "CDSlots.SLOT1" "Slots-3"
1991375-1993855 avclan: cd-opcode: "Opcode: REPORT_LOADER" "REPORT_LOADER" "Opcode"
2118220-2122017 avclan: address: "AUDIO_HU2"
2122390-2126187 avclan: address: "AUDIO_HU1"
2135204-2137694 avclan: function: "From Function: AUDIO_AMP" "From Function" "From"
2138391-2140902 avclan: function: "To Function: CMD_SW" "To Function" "To"
