4174269-4181414 avclan: address: "AUDIO_HU1"
4182090-4189236 avclan: address: "BROADCAST"
4200145-4204884 avclan: function: "From Function" "From"
4206161-4210903 avclan: function: "To Function: COMM_CTRL" "To Function" "To"
4212180-4216920 avclan: ctrl-opcode: "Opcode: LANCHECK_SCAN_REQ" "LANCHECK_SCAN_REQ"
4243000-4250484 avclan: address: "AUDIO_HU1"
4268533-4273499 avclan: function: "From Function: COMM_CTRL" "From Function" "From"
4274917-4279884 avclan: function: "To Function" "To"
4281314-4286262 avclan: ctrl-opcode: "Opcode: LANCHECK_SCAN_RESP" "LANCHECK_SCAN_RESP"
4467044-4474657 avclan: address: "AUDIO_HU2"
4475407-4483020 avclan: address: "AUDIO_HU1"
4501101-4506182 avclan: function: "From Function: COMM_CTRL" "From Function" "From"
4507536-4512617 avclan: function: "To Function" "To"
4514018-4519030 avclan: ctrl-opcode: "Opcode: LANCHECK_SCAN_RESP" "LANCHECK_SCAN_RESP"
4531849-4539187 avclan: address: "CD_CH1"
4539908-4547261 avclan: address: "AUDIO_HU1"
4564708-4569608 avclan: function: "From Function: COMM_CTRL" "From Function" "From"
4570914-4575814 avclan: function: "To Function" "To"
4577152-4582007 avclan: ctrl-opcode: "Opcode: LANCHECK_SCAN_RESP" "LANCHECK_SCAN_RESP"
36477408-36484553 avclan: address: "AUDIO_HU1"
36485232-36492378 avclan: address: "BROADCAST"
36503287-36508026 avclan: function: "From Function" "From"
36509306-36514045 avclan: function: "To Function: COMM_CTRL" "To Function" "To"
36515322-36520062 avclan: ctrl-opcode: "Opcode: LANCHECK_REQ" "LANCHECK_REQ"
36546324-36553809 avclan: address: "AUDIO_HU1"
36571858-36576824 avclan: function: "From Function: COMM_CTRL" "From Function" "From"
36578242-36583208 avclan: function: "To Function" "To"
36584639-36589587 avclan: ctrl-opcode: "Opcode: LANCHECK_RESP" "LANCHECK_RESP"
37043941-37051555 avclan: address: "AUDIO_HU2"
37052305-37059918 avclan: address: "AUDIO_HU1"
37077999-37083080 avclan: function: "From Function: COMM_CTRL" "From Function" "From"
37084434-37089515 avclan: function: "To Function" "To"
37090916-37095927 avclan: ctrl-opcode: "Opcode: LANCHECK_RESP" "LANCHECK_RESP"
37401872-37409018 avclan: address: "AUDIO_HU1"
37409693-37416843 avclan: address: "BROADCAST"
37427752-37432494 avclan: function: "From Function" "From"
37433771-37438513 avclan: function: "To Function: COMM_CTRL" "To Function" "To"
37439790-37444533 avclan: ctrl-opcode: "Opcode: LANCHECK_END_REQ" "LANCHECK_END_REQ"
37470691-37478176 avclan: address: "AUDIO_HU1"
37496225-37501191 avclan: function: "From Function: COMM_CTRL" "From Function" "From"
37502609-37507575 avclan: function: "To Function" "To"
37509006-37513960 avclan: ctrl-opcode: "Opcode: LANCHECK_END_RESP" "LANCHECK_END_RESP"
37689909-37697522 avclan: address: "AUDIO_HU2"
37698272-37705886 avclan: address: "AUDIO_HU1"
37723966-37729047 avclan: function: "From Function: COMM_CTRL" "From Function" "From"
37730401-37735483 avclan: function: "To Function" "To"
37736883-37741918 avclan: ctrl-opcode: "Opcode: LANCHECK_END_RESP" "LANCHECK_END_RESP"
41358164-41365502 avclan: address: "CD_CH1"
41366223-41373576 avclan: address: "AUDIO_HU1"
41391018-41395918 avclan: function: "From Function: COMM_CTRL" "From Function" "From"
41397226-41402126 avclan: function: "To Function" "To"
41403465-41408319 avclan: ctrl-opcode: "Opcode: LANCHECK_RESP" "LANCHECK_RESP"
41841474-41848812 avclan: address: "CD_CH1"
41849533-41856886 avclan: address: "AUDIO_HU1"
41874335-41879236 avclan: function: "From Function: COMM_CTRL" "From Function" "From"
41880543-41885444 avclan: function: "To Function" "To"
41886782-41891652 avclan: ctrl-opcode: "Opcode: LANCHECK_END_RESP" "LANCHECK_END_RESP"
